[I 2025-09-01 08:27:07,173] Trial 377 finished with values: [-1000000000.0, 1000000000.0] and parameters: {'p_sma': 53, 'p_std': 47, 'p_atr': 22, 'p_adx': 23, 'rsi_period': 55, 'ema1': 13, 'ema2': 10, 'slip_atr_k': 7.027701036567807e-05, 'slip_spread_k': 0.8903267938990903, 'spread_hl_frac': 0.012988493887794182, 'bb_std_mult': 3.076436899833408, 'rsi_os': 34, 'rsi_ob': 66, 'vol_spike': 0.05200990485548272, 'adx_thresh': 28.077252508036455, 'atr_min_pct': 0.015395927421943683, 'atr_max_pct': 0.13112396831876125, 'tp_mult': 1.6794962000730305, 'tsl_mult': 0.3156808032767786, 'strategy': 'breakout', 'time_stop': 260, 'use_sma': False, 'use_atr': False, 'use_adx': True, 'use_ema': True, 'use_spike': True, 'rsi_required': True, 'edge_k': 1.4806594689584762, 'edge_cap': 0.19762933991825904, 'bull_strategy': 'breakout', 'bull_bb_std_mult': 2.851317664590652, 'bull_rsi_os': 31, 'bull_rsi_ob': 52, 'bull_adx_thresh': 27.814491107348758, 'bull_atr_min_pct': 0.007588737174264462, 'bull_atr_max_pct': 0.08359653897877628, 'bull_tp_mult': 1.9914367361174155, 'bull_tsl_mult': 0.5870618028535132, 'bull_time_stop': 70, 'bull_use_sma': True, 'bull_use_ema': True, 'bull_use_atr': False, 'bull_use_adx': False, 'bull_use_spike': False, 'bull_rsi_required': False, 'bear_strategy': 'mean_reversion', 'bear_bb_std_mult': 1.7584454334862398, 'bear_rsi_os': 41, 'bear_rsi_ob': 80, 'bear_adx_thresh': 16.165654421274752, 'bear_atr_min_pct': 0.00847127106887301, 'bear_atr_max_pct': 0.0713019226566684, 'bear_tp_mult': 2.214707080316326, 'bear_tsl_mult': 0.010637360336501235, 'bear_time_stop': 27, 'bear_use_sma': True, 'bear_use_ema': False, 'bear_use_atr': False, 'bear_use_adx': True, 'bear_use_spike': False, 'bear_rsi_required': False, 'sideways_strategy': 'breakout', 'sideways_bb_std_mult': 1.0369771790635853, 'sideways_rsi_os': 6, 'sideways_rsi_ob': 87, 'sideways_adx_thresh': 9.751038296415489, 'sideways_atr_min_pct': 0.003145398041986113, 'sideways_atr_max_pct': 0.13416829137818903, 'sideways_tp_mult': 1.3538216486614798, 'sideways_tsl_mult': 0.018021425874293562, 'sideways_time_stop': 140, 'sideways_use_sma': True, 'sideways_use_ema': True, 'sideways_use_atr': True, 'sideways_use_adx': True, 'sideways_use_spike': False, 'sideways_rsi_required': False}.
[I 2025-09-01 08:27:07,590] Trial 379 finished with values: [-0.02367305477198678, 0.025446420210314985] and parameters: {'p_sma': 34, 'p_std': 51, 'p_atr': 22, 'p_adx': 23, 'rsi_period': 14, 'ema1': 13, 'ema2': 25, 'slip_atr_k': 0.2119841258158826, 'slip_spread_k': 0.8816402847596323, 'spread_hl_frac': 0.009854337198166162, 'bb_std_mult': 1.1422766458999418, 'rsi_os': 34, 'rsi_ob': 66, 'vol_spike': 0.05306645036866375, 'adx_thresh': 27.971844236786247, 'atr_min_pct': 0.0020582585927748486, 'atr_max_pct': 0.1166071625235661, 'tp_mult': 1.8803498139687258, 'tsl_mult': 0.3590485433666377, 'strategy': 'mean_reversion', 'time_stop': 222, 'use_sma': False, 'use_atr': False, 'use_adx': False, 'use_ema': True, 'use_spike': True, 'rsi_required': True, 'edge_k': 0.2655222973278324, 'edge_cap': 0.20801067473350557, 'bull_strategy': 'breakout', 'bull_bb_std_mult': 2.9154705971647425, 'bull_rsi_os': 42, 'bull_rsi_ob': 67, 'bull_adx_thresh': 5.921042955852398, 'bull_atr_min_pct': 0.003716958219502956, 'bull_atr_max_pct': 0.10666441625915588, 'bull_tp_mult': 1.2567888252907757, 'bull_tsl_mult': 0.5871014736885093, 'bull_time_stop': 49, 'bull_use_sma': True, 'bull_use_ema': True, 'bull_use_atr': True, 'bull_use_adx': True, 'bull_use_spike': True, 'bull_rsi_required': False, 'bear_strategy': 'mean_reversion', 'bear_bb_std_mult': 1.63617485560672, 'bear_rsi_os': 48, 'bear_rsi_ob': 79, 'bear_adx_thresh': 15.819981117437525, 'bear_atr_min_pct': 0.005179628275022835, 'bear_atr_max_pct': 0.09289467212788305, 'bear_tp_mult': 2.433713813001029, 'bear_tsl_mult': 0.019005109066221104, 'bear_time_stop': 284, 'bear_use_sma': True, 'bear_use_ema': False, 'bear_use_atr': False, 'bear_use_adx': True, 'bear_use_spike': True, 'bear_rsi_required': False, 'sideways_strategy': 'breakout', 'sideways_bb_std_mult': 1.9106155558559794, 'sideways_rsi_os': 6, 'sideways_rsi_ob': 82, 'sideways_adx_thresh': 9.774847328838158, 'sideways_atr_min_pct': 0.02875461730445138, 'sideways_atr_max_pct': 0.013916925686222997, 'sideways_tp_mult': 1.2176652895175677, 'sideways_tsl_mult': 0.017320384850840684, 'sideways_time_stop': 229, 'sideways_use_sma': True, 'sideways_use_ema': True, 'sideways_use_atr': True, 'sideways_use_adx': True, 'sideways_use_spike': False, 'sideways_rsi_required': True}.
[I 2025-09-01 08:27:08,167] Trial 380 finished with values: [-1000000000.0, 1000000000.0] and parameters: {'p_sma': 26, 'p_std': 14, 'p_atr': 22, 'p_adx': 29, 'rsi_period': 55, 'ema1': 13, 'ema2': 13, 'slip_atr_k': 0.08726303647830831, 'slip_spread_k': 0.8908798640887182, 'spread_hl_frac': 0.03210841617105881, 'bb_std_mult': 2.463324146781906, 'rsi_os': 34, 'rsi_ob': 59, 'vol_spike': 0.07470607507089057, 'adx_thresh': 26.45840059855323, 'atr_min_pct': 0.001833533540936766, 'atr_max_pct': 0.13235085951639786, 'tp_mult': 1.323055842237562, 'tsl_mult': 0.05092620268107083, 'strategy': 'mean_reversion', 'time_stop': 221, 'use_sma': False, 'use_atr': False, 'use_adx': False, 'use_ema': True, 'use_spike': False, 'rsi_required': False, 'edge_k': 0.3009907047764913, 'edge_cap': 0.22333765209426376, 'bull_strategy': 'breakout', 'bull_bb_std_mult': 3.109706467942921, 'bull_rsi_os': 49, 'bull_rsi_ob': 95, 'bull_adx_thresh': 5.218824188337937, 'bull_atr_min_pct': 0.005681627042796254, 'bull_atr_max_pct': 0.1165633095793124, 'bull_tp_mult': 1.4583095776330899, 'bull_tsl_mult': 0.5957802121559459, 'bull_time_stop': 49, 'bull_use_sma': True, 'bull_use_ema': False, 'bull_use_atr': True, 'bull_use_adx': True, 'bull_use_spike': True, 'bull_rsi_required': False, 'bear_strategy': 'mean_reversion', 'bear_bb_std_mult': 1.6484182409581647, 'bear_rsi_os': 28, 'bear_rsi_ob': 72, 'bear_adx_thresh': 6.6766409263335404, 'bear_atr_min_pct': 0.008573752392753979, 'bear_atr_max_pct': 0.11229703074447761, 'bear_tp_mult': 2.4355559487107694, 'bear_tsl_mult': 0.010766463579728422, 'bear_time_stop': 188, 'bear_use_sma': True, 'bear_use_ema': False, 'bear_use_atr': False, 'bear_use_adx': True, 'bear_use_spike': True, 'bear_rsi_required': True, 'sideways_strategy': 'breakout', 'sideways_bb_std_mult': 2.1437078432094547, 'sideways_rsi_os': 6, 'sideways_rsi_ob': 93, 'sideways_adx_thresh': 9.567370043150527, 'sideways_atr_min_pct': 0.02863998156600511, 'sideways_atr_max_pct': 0.1205002982985253, 'sideways_tp_mult': 2.3814615141062583, 'sideways_tsl_mult': 0.10074979215377348, 'sideways_time_stop': 75, 'sideways_use_sma': False, 'sideways_use_ema': True, 'sideways_use_atr': True, 'sideways_use_adx': False, 'sideways_use_spike': True, 'sideways_rsi_required': True}.
[I 2025-09-01 08:27:57,360] Trial 384 finished with values: [-0.0017637138894560644, 0.0036714193684116727] and parameters: {'p_sma': 32, 'p_std': 53, 'p_atr': 23, 'p_adx': 11, 'rsi_period': 74, 'ema1': 16, 'ema2': 20, 'slip_atr_k': 0.06823010546748223, 'slip_spread_k': 0.913413301027971, 'spread_hl_frac': 0.01526881914735379, 'bb_std_mult': 2.0540498455845206, 'rsi_os': 30, 'rsi_ob': 62, 'vol_spike': 0.042426354153901565, 'adx_thresh': 29.334742488067278, 'atr_min_pct': 0.023192662685773843, 'atr_max_pct': 0.10779916577542825, 'tp_mult': 2.172136668736777, 'tsl_mult': 0.240175471653426, 'strategy': 'breakout', 'time_stop': 237, 'use_sma': False, 'use_atr': False, 'use_adx': True, 'use_ema': True, 'use_spike': False, 'rsi_required': True, 'edge_k': 0.18854856185447977, 'edge_cap': 0.248395330107536, 'bull_strategy': 'breakout', 'bull_bb_std_mult': 3.0809691671970163, 'bull_rsi_os': 52, 'bull_rsi_ob': 64, 'bull_adx_thresh': 10.881341813057299, 'bull_atr_min_pct': 0.003075497130836137, 'bull_atr_max_pct': 0.05140287105967446, 'bull_tp_mult': 2.9996965240713487, 'bull_tsl_mult': 0.6134156967821, 'bull_time_stop': 278, 'bull_use_sma': True, 'bull_use_ema': False, 'bull_use_atr': False, 'bull_use_adx': False, 'bull_use_spike': False, 'bull_rsi_required': False, 'bear_strategy': 'mean_reversion', 'bear_bb_std_mult': 0.5735197963337415, 'bear_rsi_os': 43, 'bear_rsi_ob': 77, 'bear_adx_thresh': 5.006833434024377, 'bear_atr_min_pct': 0.0065803808144031355, 'bear_atr_max_pct': 0.11865967083721479, 'bear_tp_mult': 2.1846402766168516, 'bear_tsl_mult': 0.3859397998062107, 'bear_time_stop': 300, 'bear_use_sma': True, 'bear_use_ema': False, 'bear_use_atr': True, 'bear_use_adx': False, 'bear_use_spike': False, 'bear_rsi_required': True, 'sideways_strategy': 'breakout', 'sideways_bb_std_mult': 0.7687525503639729, 'sideways_rsi_os': 31, 'sideways_rsi_ob': 73, 'sideways_adx_thresh': 12.161489728594042, 'sideways_atr_min_pct': 0.020738421454275964, 'sideways_atr_max_pct': 0.01891672023264812, 'sideways_tp_mult': 1.413263343093483, 'sideways_tsl_mult': 0.5372025246060299, 'sideways_time_stop': 218, 'sideways_use_sma': True, 'sideways_use_ema': True, 'sideways_use_atr': False, 'sideways_use_adx': False, 'sideways_use_spike': True, 'sideways_rsi_required': False}.
[I 2025-09-01 08:27:58,076] Trial 383 finished with values: [-1000000000.0, 1000000000.0] and parameters: {'p_sma': 6, 'p_std': 53, 'p_atr': 23, 'p_adx': 14, 'rsi_period': 60, 'ema1': 16, 'ema2': 54, 'slip_atr_k': 0.0680790308161637, 'slip_spread_k': 0.11196366087295345, 'spread_hl_frac': 0.015037182564422897, 'bb_std_mult': 2.0443646867398533, 'rsi_os': 33, 'rsi_ob': 83, 'vol_spike': 0.07439817619882905, 'adx_thresh': 29.250245571577167, 'atr_min_pct': 0.0034068772209074226, 'atr_max_pct': 0.04222786857499051, 'tp_mult': 1.9548484389164682, 'tsl_mult': 0.5265784447296508, 'strategy': 'breakout', 'time_stop': 76, 'use_sma': False, 'use_atr': False, 'use_adx': True, 'use_ema': True, 'use_spike': False, 'rsi_required': False, 'edge_k': 0.18906974601851995, 'edge_cap': 0.23801637819307292, 'bull_strategy': 'breakout', 'bull_bb_std_mult': 3.0891219108787475, 'bull_rsi_os': 49, 'bull_rsi_ob': 47, 'bull_adx_thresh': 9.581277025087374, 'bull_atr_min_pct': 0.023023758374090975, 'bull_atr_max_pct': 0.05439540747318784, 'bull_tp_mult': 2.3902511534372075, 'bull_tsl_mult': 0.6092726303478172, 'bull_time_stop': 55, 'bull_use_sma': True, 'bull_use_ema': False, 'bull_use_atr': False, 'bull_use_adx': False, 'bull_use_spike': False, 'bull_rsi_required': False, 'bear_strategy': 'mean_reversion', 'bear_bb_std_mult': 2.201649487508587, 'bear_rsi_os': 26, 'bear_rsi_ob': 72, 'bear_adx_thresh': 23.547525811905736, 'bear_atr_min_pct': 0.006683340148715543, 'bear_atr_max_pct': 0.08825494558992955, 'bear_tp_mult': 2.1858071084951765, 'bear_tsl_mult': 0.11564333633481015, 'bear_time_stop': 295, 'bear_use_sma': True, 'bear_use_ema': False, 'bear_use_atr': False, 'bear_use_adx': False, 'bear_use_spike': False, 'bear_rsi_required': True, 'sideways_strategy': 'breakout', 'sideways_bb_std_mult': 0.8020254230283993, 'sideways_rsi_os': 31, 'sideways_rsi_ob': 63, 'sideways_adx_thresh': 20.62774093449217, 'sideways_atr_min_pct': 0.01967703237841459, 'sideways_atr_max_pct': 0.05192178052149527, 'sideways_tp_mult': 1.413748475309065, 'sideways_tsl_mult': 0.19449393275339494, 'sideways_time_stop': 71, 'sideways_use_sma': False, 'sideways_use_ema': True, 'sideways_use_atr': False, 'sideways_use_adx': False, 'sideways_use_spike': True, 'sideways_rsi_required': True}.
[I 2025-09-01 08:27:58,228] Trial 382 finished with values: [-0.011851419006035924, 0.01193452928947533] and parameters: {'p_sma': 59, 'p_std': 49, 'p_atr': 23, 'p_adx': 14, 'rsi_period': 56, 'ema1': 15, 'ema2': 54, 'slip_atr_k': 0.08763111968287807, 'slip_spread_k': 0.9198140561789137, 'spread_hl_frac': 0.032207821775293945, 'bb_std_mult': 2.394660170761965, 'rsi_os': 30, 'rsi_ob': 59, 'vol_spike': 0.04460428109788915, 'adx_thresh': 29.20895179548314, 'atr_min_pct': 0.0016981431189775423, 'atr_max_pct': 0.057856947060029223, 'tp_mult': 1.3060359503009271, 'tsl_mult': 0.596627889989121, 'strategy': 'mean_reversion', 'time_stop': 236, 'use_sma': False, 'use_atr': False, 'use_adx': False, 'use_ema': True, 'use_spike': False, 'rsi_required': False, 'edge_k': 0.30177409853458215, 'edge_cap': 0.5505508969076726, 'bull_strategy': 'breakout', 'bull_bb_std_mult': 3.10445618312755, 'bull_rsi_os': 52, 'bull_rsi_ob': 47, 'bull_adx_thresh': 6.084905544877669, 'bull_atr_min_pct': 0.003054619170681266, 'bull_atr_max_pct': 0.07184736483638209, 'bull_tp_mult': 1.4685070051813045, 'bull_tsl_mult': 0.6124887091828268, 'bull_time_stop': 127, 'bull_use_sma': True, 'bull_use_ema': False, 'bull_use_atr': True, 'bull_use_adx': True, 'bull_use_spike': True, 'bull_rsi_required': False, 'bear_strategy': 'mean_reversion', 'bear_bb_std_mult': 3.0093408122919505, 'bear_rsi_os': 44, 'bear_rsi_ob': 78, 'bear_adx_thresh': 6.753255233821471, 'bear_atr_min_pct': 0.013361408046018392, 'bear_atr_max_pct': 0.08640767614640528, 'bear_tp_mult': 1.997268458828947, 'bear_tsl_mult': 0.38616885550673713, 'bear_time_stop': 300, 'bear_use_sma': True, 'bear_use_ema': False, 'bear_use_atr': False, 'bear_use_adx': False, 'bear_use_spike': True, 'bear_rsi_required': True, 'sideways_strategy': 'breakout', 'sideways_bb_std_mult': 2.1387788492261657, 'sideways_rsi_os': 8, 'sideways_rsi_ob': 53, 'sideways_adx_thresh': 32.89456571174045, 'sideways_atr_min_pct': 0.020858397085697082, 'sideways_atr_max_pct': 0.013378301363252442, 'sideways_tp_mult': 2.056375268744337, 'sideways_tsl_mult': 0.5358785902977592, 'sideways_time_stop': 229, 'sideways_use_sma': False, 'sideways_use_ema': True, 'sideways_use_atr': False, 'sideways_use_adx': False, 'sideways_use_spike': True, 'sideways_rsi_required': True}.
[I 2025-09-01 08:27:58,387] Trial 381 finished with values: [-1000000000.0, 1000000000.0] and parameters: {'p_sma': 32, 'p_std': 49, 'p_atr': 23, 'p_adx': 26, 'rsi_period': 55, 'ema1': 15, 'ema2': 13, 'slip_atr_k': 0.234933170533627, 'slip_spread_k': 0.9142474031690682, 'spread_hl_frac': 0.012946455882525063, 'bb_std_mult': 3.0241271908588563, 'rsi_os': 34, 'rsi_ob': 93, 'vol_spike': 0.041447303133168356, 'adx_thresh': 27.961113870848262, 'atr_min_pct': 0.0033678781552305527, 'atr_max_pct': 0.08822835113386232, 'tp_mult': 2.197705922722137, 'tsl_mult': 0.09963106034920827, 'strategy': 'mean_reversion', 'time_stop': 76, 'use_sma': False, 'use_atr': False, 'use_adx': False, 'use_ema': True, 'use_spike': False, 'rsi_required': False, 'edge_k': 1.3721739261582164, 'edge_cap': 0.24819308020256434, 'bull_strategy': 'breakout', 'bull_bb_std_mult': 3.1093748903262437, 'bull_rsi_os': 44, 'bull_rsi_ob': 58, 'bull_adx_thresh': 9.948284125893753, 'bull_atr_min_pct': 0.007595081969019512, 'bull_atr_max_pct': 0.01561483177889589, 'bull_tp_mult': 2.4058224725676713, 'bull_tsl_mult': 0.11122073391958515, 'bull_time_stop': 128, 'bull_use_sma': True, 'bull_use_ema': False, 'bull_use_atr': True, 'bull_use_adx': True, 'bull_use_spike': True, 'bull_rsi_required': False, 'bear_strategy': 'mean_reversion', 'bear_bb_std_mult': 1.6849095769370845, 'bear_rsi_os': 44, 'bear_rsi_ob': 78, 'bear_adx_thresh': 9.75953664973443, 'bear_atr_min_pct': 0.006516228939804294, 'bear_atr_max_pct': 0.08954724399724537, 'bear_tp_mult': 2.187264521402488, 'bear_tsl_mult': 0.15717184777531001, 'bear_time_stop': 300, 'bear_use_sma': True, 'bear_use_ema': False, 'bear_use_atr': False, 'bear_use_adx': False, 'bear_use_spike': True, 'bear_rsi_required': True, 'sideways_strategy': 'breakout', 'sideways_bb_std_mult': 1.8263508979994327, 'sideways_rsi_os': 8, 'sideways_rsi_ob': 92, 'sideways_adx_thresh': 11.835470715222963, 'sideways_atr_min_pct': 0.028261297270882193, 'sideways_atr_max_pct': 0.013633027151096187, 'sideways_tp_mult': 1.2169362322611612, 'sideways_tsl_mult': 0.1038650859656673, 'sideways_time_stop': 76, 'sideways_use_sma': False, 'sideways_use_ema': True, 'sideways_use_atr': False, 'sideways_use_adx': False, 'sideways_use_spike': True, 'sideways_rsi_required': True}.
[I 2025-09-01 08:28:40,455] Trial 386 finished with values: [-1000000000.0, 1000000000.0] and parameters: {'p_sma': 14, 'p_std': 47, 'p_atr': 24, 'p_adx': 16, 'rsi_period': 47, 'ema1': 14, 'ema2': 29, 'slip_atr_k': 0.03310304747551988, 'slip_spread_k': 0.8476230492456683, 'spread_hl_frac': 0.038089770746548526, 'bb_std_mult': 1.0593617017305204, 'rsi_os': 27, 'rsi_ob': 63, 'vol_spike': 0.057221313014037926, 'adx_thresh': 10.460876760866586, 'atr_min_pct': 0.004600488407828606, 'atr_max_pct': 0.11610932385134305, 'tp_mult': 1.4527459824472904, 'tsl_mult': 0.2384948777477897, 'strategy': 'breakout', 'time_stop': 160, 'use_sma': True, 'use_atr': True, 'use_adx': True, 'use_ema': True, 'use_spike': True, 'rsi_required': True, 'edge_k': 1.7848113373080554, 'edge_cap': 0.06439159191006211, 'bull_strategy': 'mean_reversion', 'bull_bb_std_mult': 2.667585602802094, 'bull_rsi_os': 22, 'bull_rsi_ob': 57, 'bull_adx_thresh': 23.826915073915714, 'bull_atr_min_pct': 0.0027372748074663365, 'bull_atr_max_pct': 0.06170225072445192, 'bull_tp_mult': 1.5827029840553566, 'bull_tsl_mult': 0.566733919228528, 'bull_time_stop': 161, 'bull_use_sma': False, 'bull_use_ema': True, 'bull_use_atr': False, 'bull_use_adx': False, 'bull_use_spike': False, 'bull_rsi_required': True, 'bear_strategy': 'breakout', 'bear_bb_std_mult': 2.0338488702700777, 'bear_rsi_os': 43, 'bear_rsi_ob': 77, 'bear_adx_thresh': 5.015666791378798, 'bear_atr_min_pct': 0.007914427430439377, 'bear_atr_max_pct': 0.010139045181137646, 'bear_tp_mult': 2.5783802075680273, 'bear_tsl_mult': 0.1513177781646463, 'bear_time_stop': 153, 'bear_use_sma': False, 'bear_use_ema': True, 'bear_use_atr': True, 'bear_use_adx': False, 'bear_use_spike': False, 'bear_rsi_required': False, 'sideways_strategy': 'mean_reversion', 'sideways_bb_std_mult': 0.7500777316931829, 'sideways_rsi_os': 14, 'sideways_rsi_ob': 92, 'sideways_adx_thresh': 12.177973575812842, 'sideways_atr_min_pct': 0.023330985246693768, 'sideways_atr_max_pct': 0.019247162204750735, 'sideways_tp_mult': 1.2371249891905887, 'sideways_tsl_mult': 0.13869700296063295, 'sideways_time_stop': 255, 'sideways_use_sma': True, 'sideways_use_ema': True, 'sideways_use_atr': True, 'sideways_use_adx': True, 'sideways_use_spike': False, 'sideways_rsi_required': False}.
[I 2025-09-01 08:28:41,873] Trial 385 finished with values: [-1000000000.0, 1000000000.0] and parameters: {'p_sma': 32, 'p_std': 44, 'p_atr': 30, 'p_adx': 14, 'rsi_period': 73, 'ema1': 24, 'ema2': 21, 'slip_atr_k': 0.023271189821230897, 'slip_spread_k': 0.9139212723724727, 'spread_hl_frac': 0.01494841285170652, 'bb_std_mult': 1.3856298555236752, 'rsi_os': 51, 'rsi_ob': 62, 'vol_spike': 0.04184986082931208, 'adx_thresh': 29.261715887247856, 'atr_min_pct': 0.0032235498899567607, 'atr_max_pct': 0.11232381579982512, 'tp_mult': 2.1945436836342673, 'tsl_mult': 0.6078280103746253, 'strategy': 'breakout', 'time_stop': 237, 'use_sma': False, 'use_atr': False, 'use_adx': True, 'use_ema': True, 'use_spike': False, 'rsi_required': False, 'edge_k': 0.19606129649425946, 'edge_cap': 0.2489639374180823, 'bull_strategy': 'breakout', 'bull_bb_std_mult': 3.0604016455471426, 'bull_rsi_os': 23, 'bull_rsi_ob': 56, 'bull_adx_thresh': 9.62480899156073, 'bull_atr_min_pct': 0.01372338593786412, 'bull_atr_max_pct': 0.06180496999772878, 'bull_tp_mult': 2.3746194689853066, 'bull_tsl_mult': 0.5184982370195681, 'bull_time_stop': 223, 'bull_use_sma': True, 'bull_use_ema': False, 'bull_use_atr': False, 'bull_use_adx': False, 'bull_use_spike': False, 'bull_rsi_required': False, 'bear_strategy': 'mean_reversion', 'bear_bb_std_mult': 2.1791428219358058, 'bear_rsi_os': 44, 'bear_rsi_ob': 77, 'bear_adx_thresh': 30.95596919989756, 'bear_atr_min_pct': 0.006616023155489151, 'bear_atr_max_pct': 0.013335292607350585, 'bear_tp_mult': 2.181229261324513, 'bear_tsl_mult': 0.16561957132811503, 'bear_time_stop': 296, 'bear_use_sma': True, 'bear_use_ema': False, 'bear_use_atr': False, 'bear_use_adx': False, 'bear_use_spike': False, 'bear_rsi_required': True, 'sideways_strategy': 'breakout', 'sideways_bb_std_mult': 0.6516538932216442, 'sideways_rsi_os': 19, 'sideways_rsi_ob': 73, 'sideways_adx_thresh': 11.94317203838623, 'sideways_atr_min_pct': 0.020713266119070237, 'sideways_atr_max_pct': 0.08311597251005347, 'sideways_tp_mult': 2.046613120314348, 'sideways_tsl_mult': 0.19569662248965194, 'sideways_time_stop': 288, 'sideways_use_sma': False, 'sideways_use_ema': True, 'sideways_use_atr': False, 'sideways_use_adx': False, 'sideways_use_spike': True, 'sideways_rsi_required': False}.
