[I 2025-09-01 08:59:24,219] Trial 569 finished with values: [-1000000000.0, 1000000000.0] and parameters: {'p_sma': 58, 'p_std': 6, 'p_atr': 20, 'p_adx': 17, 'rsi_period': 37, 'ema1': 7, 'ema2': 52, 'slip_atr_k': 0.21048569987634647, 'slip_spread_k': 0.17289539847209467, 'spread_hl_frac': 0.007773090476131655, 'bb_std_mult': 0.7166177900248498, 'rsi_os': 46, 'rsi_ob': 67, 'vol_spike': 0.01735305103562847, 'adx_thresh': 13.97048172581325, 'atr_min_pct': 0.009446751554788769, 'atr_max_pct': 0.03850709775559799, 'tp_mult': 2.5309261710089377, 'tsl_mult': 0.8951524172263003, 'strategy': 'mean_reversion', 'time_stop': 27, 'use_sma': True, 'use_atr': False, 'use_adx': False, 'use_ema': False, 'use_spike': False, 'rsi_required': False, 'edge_k': 0.855057785022633, 'edge_cap': 0.32561497725911076, 'bull_strategy': 'breakout', 'bull_bb_std_mult': 2.2625606468357247, 'bull_rsi_os': 12, 'bull_rsi_ob': 57, 'bull_adx_thresh': 31.07599942469226, 'bull_atr_min_pct': 0.02134324435564173, 'bull_atr_max_pct': 0.0777900121992112, 'bull_tp_mult': 1.1458311166309818, 'bull_tsl_mult': 0.8138677712259043, 'bull_time_stop': 182, 'bull_use_sma': True, 'bull_use_ema': True, 'bull_use_atr': True, 'bull_use_adx': True, 'bull_use_spike': True, 'bull_rsi_required': False, 'bear_strategy': 'mean_reversion', 'bear_bb_std_mult': 0.6640245006510557, 'bear_rsi_os': 40, 'bear_rsi_ob': 89, 'bear_adx_thresh': 14.196541317723963, 'bear_atr_min_pct': 0.02115891263152994, 'bear_atr_max_pct': 0.043261693357417884, 'bear_tp_mult': 2.7515773017852667, 'bear_tsl_mult': 0.2926726768540443, 'bear_time_stop': 31, 'bear_use_sma': False, 'bear_use_ema': False, 'bear_use_atr': True, 'bear_use_adx': True, 'bear_use_spike': True, 'bear_rsi_required': True, 'sideways_strategy': 'breakout', 'sideways_bb_std_mult': 2.65922694331193, 'sideways_rsi_os': 10, 'sideways_rsi_ob': 59, 'sideways_adx_thresh': 20.492971621984154, 'sideways_atr_min_pct': 0.008398826170998372, 'sideways_atr_max_pct': 0.08389691241846871, 'sideways_tp_mult': 2.7312147858784934, 'sideways_tsl_mult': 0.49276352296186876, 'sideways_time_stop': 266, 'sideways_use_sma': False, 'sideways_use_ema': False, 'sideways_use_atr': False, 'sideways_use_adx': False, 'sideways_use_spike': True, 'sideways_rsi_required': True}.
[I 2025-09-01 08:59:24,502] Trial 567 finished with values: [-1000000000.0, 1000000000.0] and parameters: {'p_sma': 38, 'p_std': 37, 'p_atr': 20, 'p_adx': 15, 'rsi_period': 42, 'ema1': 9, 'ema2': 59, 'slip_atr_k': 0.20226192841978072, 'slip_spread_k': 0.34752997642812195, 'spread_hl_frac': 0.018275477467939425, 'bb_std_mult': 2.5525672419751673, 'rsi_os': 48, 'rsi_ob': 92, 'vol_spike': 0.0160359159596116, 'adx_thresh': 13.678709992055474, 'atr_min_pct': 0.029694795711264897, 'atr_max_pct': 0.09307481969840828, 'tp_mult': 1.3353603716269402, 'tsl_mult': 0.48490299249943003, 'strategy': 'mean_reversion', 'time_stop': 26, 'use_sma': False, 'use_atr': False, 'use_adx': False, 'use_ema': False, 'use_spike': False, 'rsi_required': False, 'edge_k': 0.8488706474773743, 'edge_cap': 0.9570594730989161, 'bull_strategy': 'breakout', 'bull_bb_std_mult': 2.2368832397627663, 'bull_rsi_os': 12, 'bull_rsi_ob': 78, 'bull_adx_thresh': 11.170329600590394, 'bull_atr_min_pct': 0.020875762519520367, 'bull_atr_max_pct': 0.11173030976690274, 'bull_tp_mult': 1.1554158828258858, 'bull_tsl_mult': 0.7934260208697959, 'bull_time_stop': 182, 'bull_use_sma': True, 'bull_use_ema': True, 'bull_use_atr': True, 'bull_use_adx': True, 'bull_use_spike': True, 'bull_rsi_required': False, 'bear_strategy': 'mean_reversion', 'bear_bb_std_mult': 0.7036755603267131, 'bear_rsi_os': 44, 'bear_rsi_ob': 52, 'bear_adx_thresh': 34.56756954729242, 'bear_atr_min_pct': 0.006705700829621174, 'bear_atr_max_pct': 0.03392336403965212, 'bear_tp_mult': 1.7187687236868565, 'bear_tsl_mult': 0.29366156811445715, 'bear_time_stop': 211, 'bear_use_sma': False, 'bear_use_ema': True, 'bear_use_atr': True, 'bear_use_adx': True, 'bear_use_spike': True, 'bear_rsi_required': True, 'sideways_strategy': 'breakout', 'sideways_bb_std_mult': 1.979629998532765, 'sideways_rsi_os': 11, 'sideways_rsi_ob': 63, 'sideways_adx_thresh': 11.595781298294602, 'sideways_atr_min_pct': 0.00805018913598931, 'sideways_atr_max_pct': 0.09268398249354443, 'sideways_tp_mult': 2.3662166023757836, 'sideways_tsl_mult': 0.9756602009651624, 'sideways_time_stop': 159, 'sideways_use_sma': False, 'sideways_use_ema': False, 'sideways_use_atr': True, 'sideways_use_adx': False, 'sideways_use_spike': True, 'sideways_rsi_required': True}.
[I 2025-09-01 08:59:24,733] Trial 566 finished with values: [-1000000000.0, 1000000000.0] and parameters: {'p_sma': 58, 'p_std': 15, 'p_atr': 7, 'p_adx': 15, 'rsi_period': 26, 'ema1': 9, 'ema2': 59, 'slip_atr_k': 0.2246349927679513, 'slip_spread_k': 0.3686703146711833, 'spread_hl_frac': 0.02700252944450688, 'bb_std_mult': 2.539539098001799, 'rsi_os': 10, 'rsi_ob': 92, 'vol_spike': 0.015833857597962426, 'adx_thresh': 5.371835634983926, 'atr_min_pct': 0.009478013087893708, 'atr_max_pct': 0.09444539311507524, 'tp_mult': 2.532347339926847, 'tsl_mult': 0.8958596782723381, 'strategy': 'mean_reversion', 'time_stop': 44, 'use_sma': False, 'use_atr': False, 'use_adx': False, 'use_ema': False, 'use_spike': False, 'rsi_required': False, 'edge_k': 1.5699127444375054, 'edge_cap': 0.6937144445650412, 'bull_strategy': 'breakout', 'bull_bb_std_mult': 1.8464409466567953, 'bull_rsi_os': 13, 'bull_rsi_ob': 90, 'bull_adx_thresh': 19.554547801949628, 'bull_atr_min_pct': 0.02043649943559252, 'bull_atr_max_pct': 0.07790646438466521, 'bull_tp_mult': 2.2290313752712323, 'bull_tsl_mult': 0.8268970367023152, 'bull_time_stop': 183, 'bull_use_sma': True, 'bull_use_ema': True, 'bull_use_atr': True, 'bull_use_adx': True, 'bull_use_spike': True, 'bull_rsi_required': False, 'bear_strategy': 'mean_reversion', 'bear_bb_std_mult': 0.7038591604079354, 'bear_rsi_os': 15, 'bear_rsi_ob': 66, 'bear_adx_thresh': 12.862710081225364, 'bear_atr_min_pct': 0.016869835374345585, 'bear_atr_max_pct': 0.033647358862100726, 'bear_tp_mult': 2.8917519435747367, 'bear_tsl_mult': 0.18784756826008972, 'bear_time_stop': 232, 'bear_use_sma': False, 'bear_use_ema': False, 'bear_use_atr': True, 'bear_use_adx': True, 'bear_use_spike': True, 'bear_rsi_required': True, 'sideways_strategy': 'breakout', 'sideways_bb_std_mult': 1.2628945913429137, 'sideways_rsi_os': 50, 'sideways_rsi_ob': 62, 'sideways_adx_thresh': 20.29131053350129, 'sideways_atr_min_pct': 0.004992470983256815, 'sideways_atr_max_pct': 0.08999031194922723, 'sideways_tp_mult': 2.369630230251859, 'sideways_tsl_mult': 0.5163314856710917, 'sideways_time_stop': 263, 'sideways_use_sma': False, 'sideways_use_ema': False, 'sideways_use_atr': True, 'sideways_use_adx': False, 'sideways_use_spike': True, 'sideways_rsi_required': True}.
[I 2025-09-01 08:59:25,682] Trial 572 finished with values: [-1000000000.0, 1000000000.0] and parameters: {'p_sma': 51, 'p_std': 20, 'p_atr': 20, 'p_adx': 16, 'rsi_period': 40, 'ema1': 8, 'ema2': 57, 'slip_atr_k': 0.15806007457915608, 'slip_spread_k': 0.43103671133474053, 'spread_hl_frac': 0.022416624733400836, 'bb_std_mult': 1.398282221592788, 'rsi_os': 47, 'rsi_ob': 47, 'vol_spike': 0.1757251241810006, 'adx_thresh': 19.93131697583973, 'atr_min_pct': 0.016653906394294316, 'atr_max_pct': 0.034918335000173044, 'tp_mult': 1.0850760986401682, 'tsl_mult': 0.7720806422765093, 'strategy': 'mean_reversion', 'time_stop': 70, 'use_sma': False, 'use_atr': False, 'use_adx': False, 'use_ema': False, 'use_spike': False, 'rsi_required': False, 'edge_k': 0.9252592118635903, 'edge_cap': 0.2882092706052498, 'bull_strategy': 'breakout', 'bull_bb_std_mult': 2.4627126804576016, 'bull_rsi_os': 7, 'bull_rsi_ob': 54, 'bull_adx_thresh': 19.561024715962763, 'bull_atr_min_pct': 0.020285558805204544, 'bull_atr_max_pct': 0.0713870587947219, 'bull_tp_mult': 2.878617857244117, 'bull_tsl_mult': 0.8836630949949483, 'bull_time_stop': 178, 'bull_use_sma': True, 'bull_use_ema': True, 'bull_use_atr': True, 'bull_use_adx': True, 'bull_use_spike': True, 'bull_rsi_required': False, 'bear_strategy': 'mean_reversion', 'bear_bb_std_mult': 3.436476378023401, 'bear_rsi_os': 41, 'bear_rsi_ob': 53, 'bear_adx_thresh': 11.72389481623853, 'bear_atr_min_pct': 0.005101642484982299, 'bear_atr_max_pct': 0.04565223926049517, 'bear_tp_mult': 2.697174983825064, 'bear_tsl_mult': 0.20093286608361227, 'bear_time_stop': 231, 'bear_use_sma': False, 'bear_use_ema': False, 'bear_use_atr': True, 'bear_use_adx': True, 'bear_use_spike': True, 'bear_rsi_required': True, 'sideways_strategy': 'mean_reversion', 'sideways_bb_std_mult': 1.2562408663103517, 'sideways_rsi_os': 12, 'sideways_rsi_ob': 64, 'sideways_adx_thresh': 10.10538263852591, 'sideways_atr_min_pct': 0.006747266837645544, 'sideways_atr_max_pct': 0.07747964949484312, 'sideways_tp_mult': 2.457989742760885, 'sideways_tsl_mult': 0.6099609813221368, 'sideways_time_stop': 145, 'sideways_use_sma': False, 'sideways_use_ema': False, 'sideways_use_atr': True, 'sideways_use_adx': False, 'sideways_use_spike': True, 'sideways_rsi_required': True}.
[I 2025-09-01 09:00:08,189] Trial 571 finished with values: [-0.05815040929624993, 0.05779258220361721] and parameters: {'p_sma': 51, 'p_std': 36, 'p_atr': 14, 'p_adx': 16, 'rsi_period': 41, 'ema1': 20, 'ema2': 57, 'slip_atr_k': 0.23604902846920817, 'slip_spread_k': 0.6275228585928525, 'spread_hl_frac': 0.022260952543544297, 'bb_std_mult': 1.085007363636837, 'rsi_os': 47, 'rsi_ob': 90, 'vol_spike': 0.014821545149401809, 'adx_thresh': 34.34555151438692, 'atr_min_pct': 0.018594174106487733, 'atr_max_pct': 0.08592109282781697, 'tp_mult': 1.403969381016322, 'tsl_mult': 0.16935462194228068, 'strategy': 'mean_reversion', 'time_stop': 71, 'use_sma': False, 'use_atr': False, 'use_adx': False, 'use_ema': False, 'use_spike': False, 'rsi_required': False, 'edge_k': 0.9250604651365174, 'edge_cap': 0.26720808976343513, 'bull_strategy': 'breakout', 'bull_bb_std_mult': 1.2225986819992842, 'bull_rsi_os': 39, 'bull_rsi_ob': 54, 'bull_adx_thresh': 23.222196533455072, 'bull_atr_min_pct': 0.02696570521562366, 'bull_atr_max_pct': 0.0710710132276991, 'bull_tp_mult': 2.33130851232271, 'bull_tsl_mult': 0.8870863013405047, 'bull_time_stop': 172, 'bull_use_sma': True, 'bull_use_ema': True, 'bull_use_atr': True, 'bull_use_adx': True, 'bull_use_spike': True, 'bull_rsi_required': False, 'bear_strategy': 'mean_reversion', 'bear_bb_std_mult': 0.9965929817543171, 'bear_rsi_os': 54, 'bear_rsi_ob': 55, 'bear_adx_thresh': 15.16482564552074, 'bear_atr_min_pct': 0.005030008031613955, 'bear_atr_max_pct': 0.045964131337785756, 'bear_tp_mult': 1.815364198788106, 'bear_tsl_mult': 0.1853930530049505, 'bear_time_stop': 233, 'bear_use_sma': False, 'bear_use_ema': False, 'bear_use_atr': True, 'bear_use_adx': True, 'bear_use_spike': True, 'bear_rsi_required': True, 'sideways_strategy': 'mean_reversion', 'sideways_bb_std_mult': 1.2600420213679524, 'sideways_rsi_os': 12, 'sideways_rsi_ob': 64, 'sideways_adx_thresh': 24.521174903527406, 'sideways_atr_min_pct': 0.0068632292079573035, 'sideways_atr_max_pct': 0.08622519890944406, 'sideways_tp_mult': 1.8921314725787903, 'sideways_tsl_mult': 0.9347308426439762, 'sideways_time_stop': 153, 'sideways_use_sma': False, 'sideways_use_ema': False, 'sideways_use_atr': True, 'sideways_use_adx': False, 'sideways_use_spike': True, 'sideways_rsi_required': True}.
[I 2025-09-01 09:00:08,504] Trial 574 finished with values: [-1000000000.0, 1000000000.0] and parameters: {'p_sma': 42, 'p_std': 25, 'p_atr': 21, 'p_adx': 16, 'rsi_period': 42, 'ema1': 28, 'ema2': 60, 'slip_atr_k': 0.09769108787880526, 'slip_spread_k': 0.620856599655687, 'spread_hl_frac': 0.017535420279543718, 'bb_std_mult': 2.703234162402007, 'rsi_os': 47, 'rsi_ob': 90, 'vol_spike': 0.2546236629816251, 'adx_thresh': 33.58006634105786, 'atr_min_pct': 0.014944104556125982, 'atr_max_pct': 0.08580793422258037, 'tp_mult': 1.403327301113404, 'tsl_mult': 0.1733657569541805, 'strategy': 'mean_reversion', 'time_stop': 128, 'use_sma': False, 'use_atr': True, 'use_adx': False, 'use_ema': False, 'use_spike': False, 'rsi_required': False, 'edge_k': 0.7990255342101091, 'edge_cap': 0.2632958758206261, 'bull_strategy': 'mean_reversion', 'bull_bb_std_mult': 2.548267105767479, 'bull_rsi_os': 41, 'bull_rsi_ob': 56, 'bull_adx_thresh': 23.25102017868897, 'bull_atr_min_pct': 0.026871625921358236, 'bull_atr_max_pct': 0.14117641713097756, 'bull_tp_mult': 2.3257859831237457, 'bull_tsl_mult': 0.681335296884545, 'bull_time_stop': 171, 'bull_use_sma': False, 'bull_use_ema': True, 'bull_use_atr': True, 'bull_use_adx': True, 'bull_use_spike': True, 'bull_rsi_required': True, 'bear_strategy': 'mean_reversion', 'bear_bb_std_mult': 3.1478204160194916, 'bear_rsi_os': 43, 'bear_rsi_ob': 89, 'bear_adx_thresh': 22.88939321703541, 'bear_atr_min_pct': 0.029231679458046556, 'bear_atr_max_pct': 0.04119930674627248, 'bear_tp_mult': 2.761995824172307, 'bear_tsl_mult': 0.20688549960843805, 'bear_time_stop': 12, 'bear_use_sma': False, 'bear_use_ema': False, 'bear_use_atr': True, 'bear_use_adx': True, 'bear_use_spike': True, 'bear_rsi_required': True, 'sideways_strategy': 'breakout', 'sideways_bb_std_mult': 1.3932627002945979, 'sideways_rsi_os': 12, 'sideways_rsi_ob': 75, 'sideways_adx_thresh': 11.002515604690302, 'sideways_atr_min_pct': 0.007382015882201231, 'sideways_atr_max_pct': 0.07863947386071575, 'sideways_tp_mult': 2.5669526506126474, 'sideways_tsl_mult': 0.9351860569810019, 'sideways_time_stop': 155, 'sideways_use_sma': False, 'sideways_use_ema': False, 'sideways_use_atr': True, 'sideways_use_adx': False, 'sideways_use_spike': True, 'sideways_rsi_required': True}.
[I 2025-09-01 09:00:09,056] Trial 573 finished with values: [-1000000000.0, 1000000000.0] and parameters: {'p_sma': 22, 'p_std': 36, 'p_atr': 15, 'p_adx': 16, 'rsi_period': 40, 'ema1': 8, 'ema2': 53, 'slip_atr_k': 0.2395244130262838, 'slip_spread_k': 0.6250964238468317, 'spread_hl_frac': 0.023227750139003196, 'bb_std_mult': 1.3856022126433687, 'rsi_os': 47, 'rsi_ob': 56, 'vol_spike': 0.0006009552257846638, 'adx_thresh': 34.36359144451374, 'atr_min_pct': 0.014627482481132612, 'atr_max_pct': 0.06253796019863267, 'tp_mult': 1.0883485829888806, 'tsl_mult': 0.5568760581645733, 'strategy': 'mean_reversion', 'time_stop': 57, 'use_sma': False, 'use_atr': False, 'use_adx': False, 'use_ema': False, 'use_spike': False, 'rsi_required': False, 'edge_k': 0.9225809388234478, 'edge_cap': 0.2600253712639148, 'bull_strategy': 'breakout', 'bull_bb_std_mult': 1.221121065009283, 'bull_rsi_os': 7, 'bull_rsi_ob': 54, 'bull_adx_thresh': 11.498957631339618, 'bull_atr_min_pct': 0.026395969290905888, 'bull_atr_max_pct': 0.07168280230500786, 'bull_tp_mult': 2.5678785510480875, 'bull_tsl_mult': 0.3593387965828625, 'bull_time_stop': 173, 'bull_use_sma': True, 'bull_use_ema': True, 'bull_use_atr': True, 'bull_use_adx': True, 'bull_use_spike': True, 'bull_rsi_required': False, 'bear_strategy': 'mean_reversion', 'bear_bb_std_mult': 3.144982143655146, 'bear_rsi_os': 19, 'bear_rsi_ob': 45, 'bear_adx_thresh': 27.465874170598262, 'bear_atr_min_pct': 0.005185644422918181, 'bear_atr_max_pct': 0.14758661409772922, 'bear_tp_mult': 1.3471208578681277, 'bear_tsl_mult': 0.20418674725380156, 'bear_time_stop': 87, 'bear_use_sma': False, 'bear_use_ema': False, 'bear_use_atr': True, 'bear_use_adx': True, 'bear_use_spike': True, 'bear_rsi_required': True, 'sideways_strategy': 'mean_reversion', 'sideways_bb_std_mult': 1.420241604624499, 'sideways_rsi_os': 12, 'sideways_rsi_ob': 64, 'sideways_adx_thresh': 32.574207116154604, 'sideways_atr_min_pct': 0.006632963859641132, 'sideways_atr_max_pct': 0.04597736031365141, 'sideways_tp_mult': 2.4459792902243103, 'sideways_tsl_mult': 0.5399354079106011, 'sideways_time_stop': 156, 'sideways_use_sma': False, 'sideways_use_ema': False, 'sideways_use_atr': True, 'sideways_use_adx': False, 'sideways_use_spike': True, 'sideways_rsi_required': True}.
[I 2025-09-01 09:00:09,057] Trial 570 finished with values: [-1000000000.0, 1000000000.0] and parameters: {'p_sma': 22, 'p_std': 36, 'p_atr': 8, 'p_adx': 22, 'rsi_period': 40, 'ema1': 28, 'ema2': 59, 'slip_atr_k': 0.16008002082940787, 'slip_spread_k': 0.671380022531334, 'spread_hl_frac': 0.038558894444383776, 'bb_std_mult': 2.727818955369796, 'rsi_os': 47, 'rsi_ob': 90, 'vol_spike': 0.25360304240967885, 'adx_thresh': 20.58544983181701, 'atr_min_pct': 0.021736760707623197, 'atr_max_pct': 0.0957139790913497, 'tp_mult': 1.4012616450367363, 'tsl_mult': 0.6636097507822457, 'strategy': 'mean_reversion', 'time_stop': 41, 'use_sma': False, 'use_atr': False, 'use_adx': False, 'use_ema': False, 'use_spike': False, 'rsi_required': False, 'edge_k': 1.758306442919475, 'edge_cap': 0.2653031858659542, 'bull_strategy': 'breakout', 'bull_bb_std_mult': 0.6462630300287986, 'bull_rsi_os': 6, 'bull_rsi_ob': 76, 'bull_adx_thresh': 23.29419275375207, 'bull_atr_min_pct': 0.02680252050751519, 'bull_atr_max_pct': 0.07111757794256396, 'bull_tp_mult': 2.8774683813919024, 'bull_tsl_mult': 0.8705164573134863, 'bull_time_stop': 174, 'bull_use_sma': True, 'bull_use_ema': True, 'bull_use_atr': True, 'bull_use_adx': True, 'bull_use_spike': True, 'bull_rsi_required': False, 'bear_strategy': 'mean_reversion', 'bear_bb_std_mult': 2.707410466916341, 'bear_rsi_os': 5, 'bear_rsi_ob': 90, 'bear_adx_thresh': 22.99046318937554, 'bear_atr_min_pct': 0.005152700452415746, 'bear_atr_max_pct': 0.04151961092435951, 'bear_tp_mult': 2.7041074951033828, 'bear_tsl_mult': 0.20099112517722184, 'bear_time_stop': 230, 'bear_use_sma': False, 'bear_use_ema': False, 'bear_use_atr': True, 'bear_use_adx': True, 'bear_use_spike': True, 'bear_rsi_required': True, 'sideways_strategy': 'mean_reversion', 'sideways_bb_std_mult': 1.2656801669457833, 'sideways_rsi_os': 53, 'sideways_rsi_ob': 64, 'sideways_adx_thresh': 32.5838928592695, 'sideways_atr_min_pct': 0.0068877432231308836, 'sideways_atr_max_pct': 0.07782937288964745, 'sideways_tp_mult': 2.4647756636282763, 'sideways_tsl_mult': 0.9402919188314324, 'sideways_time_stop': 146, 'sideways_use_sma': False, 'sideways_use_ema': False, 'sideways_use_atr': True, 'sideways_use_adx': False, 'sideways_use_spike': True, 'sideways_rsi_required': True}.
[I 2025-09-01 09:00:10,001] Trial 578 finished with values: [-1000000000.0, 1000000000.0] and parameters: {'p_sma': 12, 'p_std': 35, 'p_atr': 20, 'p_adx': 17, 'rsi_period': 43, 'ema1': 26, 'ema2': 60, 'slip_atr_k': 0.019664894580000584, 'slip_spread_k': 0.1389117302245499, 'spread_hl_frac': 0.01880533969103054, 'bb_std_mult': 2.437552204969031, 'rsi_os': 52, 'rsi_ob': 94, 'vol_spike': 0.2192116075766965, 'adx_thresh': 18.696451102433095, 'atr_min_pct': 0.028836204367150377, 'atr_max_pct': 0.08966624271093876, 'tp_mult': 1.3027192769049865, 'tsl_mult': 0.19169546848534993, 'strategy': 'mean_reversion', 'time_stop': 38, 'use_sma': True, 'use_atr': True, 'use_adx': False, 'use_ema': False, 'use_spike': False, 'rsi_required': False, 'edge_k': 0.8172613856915771, 'edge_cap': 0.7223040619150022, 'bull_strategy': 'mean_reversion', 'bull_bb_std_mult': 0.9300205517870315, 'bull_rsi_os': 17, 'bull_rsi_ob': 57, 'bull_adx_thresh': 9.797264919826537, 'bull_atr_min_pct': 0.028471243130786368, 'bull_atr_max_pct': 0.08062672866294159, 'bull_tp_mult': 2.73443375848455, 'bull_tsl_mult': 0.7203468423206706, 'bull_time_stop': 26, 'bull_use_sma': False, 'bull_use_ema': True, 'bull_use_atr': True, 'bull_use_adx': True, 'bull_use_spike': True, 'bull_rsi_required': True, 'bear_strategy': 'breakout', 'bear_bb_std_mult': 3.236057006527519, 'bear_rsi_os': 42, 'bear_rsi_ob': 87, 'bear_adx_thresh': 11.233325572218778, 'bear_atr_min_pct': 0.00407076800949388, 'bear_atr_max_pct': 0.1302763126461674, 'bear_tp_mult': 2.758283314689779, 'bear_tsl_mult': 0.16753030509427674, 'bear_time_stop': 218, 'bear_use_sma': False, 'bear_use_ema': True, 'bear_use_atr': True, 'bear_use_adx': True, 'bear_use_spike': True, 'bear_rsi_required': True, 'sideways_strategy': 'breakout', 'sideways_bb_std_mult': 3.2806997926197834, 'sideways_rsi_os': 10, 'sideways_rsi_ob': 62, 'sideways_adx_thresh': 11.829487399916239, 'sideways_atr_min_pct': 0.007709777140364611, 'sideways_atr_max_pct': 0.07162727774434839, 'sideways_tp_mult': 2.4102466458150698, 'sideways_tsl_mult': 0.4275758686479376, 'sideways_time_stop': 172, 'sideways_use_sma': False, 'sideways_use_ema': False, 'sideways_use_atr': False, 'sideways_use_adx': False, 'sideways_use_spike': True, 'sideways_rsi_required': True}.
