[I 2025-09-01 07:42:15,305] Trial 129 finished with values: [-1000000000.0, 1000000000.0] and parameters: {'p_sma': 40, 'p_std': 41, 'p_atr': 29, 'p_adx': 9, 'rsi_period': 39, 'ema1': 30, 'ema2': 32, 'slip_atr_k': 0.13870473088150684, 'slip_spread_k': 0.677106613160515, 'spread_hl_frac': 0.034377360919076144, 'bb_std_mult': 1.0305291666148626, 'rsi_os': 48, 'rsi_ob': 76, 'vol_spike': 0.24730042650664125, 'adx_thresh': 25.030619973258265, 'atr_min_pct': 0.029421847872694796, 'atr_max_pct': 0.10154463796859883, 'tp_mult': 1.6099320097468512, 'tsl_mult': 0.17414169638822952, 'strategy': 'breakout', 'time_stop': 137, 'use_sma': False, 'use_atr': True, 'use_adx': True, 'use_ema': True, 'use_spike': True, 'rsi_required': False, 'edge_k': 1.4132950734600425, 'edge_cap': 0.5617703588123555, 'bull_strategy': 'mean_reversion', 'bull_bb_std_mult': 2.0980967380411055, 'bull_rsi_os': 38, 'bull_rsi_ob': 90, 'bull_adx_thresh': 22.516130343692904, 'bull_atr_min_pct': 0.006652016203691111, 'bull_atr_max_pct': 0.10062400798390694, 'bull_tp_mult': 1.981001371861546, 'bull_tsl_mult': 0.9657293662716929, 'bull_time_stop': 161, 'bull_use_sma': True, 'bull_use_ema': True, 'bull_use_atr': False, 'bull_use_adx': False, 'bull_use_spike': True, 'bull_rsi_required': False, 'bear_strategy': 'mean_reversion', 'bear_bb_std_mult': 3.3794587377890197, 'bear_rsi_os': 27, 'bear_rsi_ob': 66, 'bear_adx_thresh': 25.75192937519146, 'bear_atr_min_pct': 0.007503863307689862, 'bear_atr_max_pct': 0.06358497341426415, 'bear_tp_mult': 2.0878180362122682, 'bear_tsl_mult': 0.5786279922039756, 'bear_time_stop': 114, 'bear_use_sma': True, 'bear_use_ema': False, 'bear_use_atr': False, 'bear_use_adx': False, 'bear_use_spike': False, 'bear_rsi_required': True, 'sideways_strategy': 'breakout', 'sideways_bb_std_mult': 2.9778998578068325, 'sideways_rsi_os': 41, 'sideways_rsi_ob': 54, 'sideways_adx_thresh': 24.77805579809236, 'sideways_atr_min_pct': 0.0072745111352773345, 'sideways_atr_max_pct': 0.02010295580586914, 'sideways_tp_mult': 1.1941178461564006, 'sideways_tsl_mult': 0.5275446538491928, 'sideways_time_stop': 145, 'sideways_use_sma': False, 'sideways_use_ema': True, 'sideways_use_atr': False, 'sideways_use_adx': False, 'sideways_use_spike': False, 'sideways_rsi_required': True}.
[I 2025-09-01 07:42:15,308] Trial 128 finished with values: [-1000000000.0, 1000000000.0] and parameters: {'p_sma': 52, 'p_std': 45, 'p_atr': 21, 'p_adx': 9, 'rsi_period': 60, 'ema1': 30, 'ema2': 35, 'slip_atr_k': 0.12794971776785136, 'slip_spread_k': 0.3868051499457861, 'spread_hl_frac': 0.044896642318236396, 'bb_std_mult': 1.0124406583259011, 'rsi_os': 36, 'rsi_ob': 77, 'vol_spike': 0.24736537396549726, 'adx_thresh': 23.100485657989694, 'atr_min_pct': 0.003889971820138196, 'atr_max_pct': 0.11109062644647213, 'tp_mult': 1.5495465717067138, 'tsl_mult': 0.16590203673906567, 'strategy': 'mean_reversion', 'time_stop': 154, 'use_sma': True, 'use_atr': True, 'use_adx': True, 'use_ema': True, 'use_spike': True, 'rsi_required': False, 'edge_k': 0.33233054399020434, 'edge_cap': 0.0882048799484268, 'bull_strategy': 'mean_reversion', 'bull_bb_std_mult': 2.999770627795022, 'bull_rsi_os': 5, 'bull_rsi_ob': 59, 'bull_adx_thresh': 19.51540171063088, 'bull_atr_min_pct': 0.003189601466099792, 'bull_atr_max_pct': 0.1025178905746438, 'bull_tp_mult': 1.9554528026390654, 'bull_tsl_mult': 0.045191629074410225, 'bull_time_stop': 177, 'bull_use_sma': False, 'bull_use_ema': True, 'bull_use_atr': True, 'bull_use_adx': True, 'bull_use_spike': True, 'bull_rsi_required': True, 'bear_strategy': 'breakout', 'bear_bb_std_mult': 2.5326496121003643, 'bear_rsi_os': 31, 'bear_rsi_ob': 64, 'bear_adx_thresh': 25.81914597339152, 'bear_atr_min_pct': 0.029270974413181355, 'bear_atr_max_pct': 0.1261637926627219, 'bear_tp_mult': 1.1656596592542945, 'bear_tsl_mult': 0.5788725150463181, 'bear_time_stop': 216, 'bear_use_sma': False, 'bear_use_ema': False, 'bear_use_atr': False, 'bear_use_adx': False, 'bear_use_spike': True, 'bear_rsi_required': True, 'sideways_strategy': 'breakout', 'sideways_bb_std_mult': 2.645924198058726, 'sideways_rsi_os': 41, 'sideways_rsi_ob': 54, 'sideways_adx_thresh': 25.64027733068561, 'sideways_atr_min_pct': 0.011141601361537001, 'sideways_atr_max_pct': 0.01784271626973908, 'sideways_tp_mult': 2.4914869437726415, 'sideways_tsl_mult': 0.48335811536318857, 'sideways_time_stop': 52, 'sideways_use_sma': False, 'sideways_use_ema': True, 'sideways_use_atr': False, 'sideways_use_adx': False, 'sideways_use_spike': False, 'sideways_rsi_required': True}.
[I 2025-09-01 07:42:16,062] Trial 126 finished with values: [-0.014420927720071863, 0.014694842936139157] and parameters: {'p_sma': 48, 'p_std': 33, 'p_atr': 29, 'p_adx': 18, 'rsi_period': 35, 'ema1': 13, 'ema2': 14, 'slip_atr_k': 0.14126702578980527, 'slip_spread_k': 0.7961255965070826, 'spread_hl_frac': 0.016554014234283543, 'bb_std_mult': 3.485557640432889, 'rsi_os': 14, 'rsi_ob': 71, 'vol_spike': 0.01085007852927758, 'adx_thresh': 23.37490298117065, 'atr_min_pct': 0.02511375062716492, 'atr_max_pct': 0.111107615059665, 'tp_mult': 1.5738700784768531, 'tsl_mult': 0.12010668831062926, 'strategy': 'breakout', 'time_stop': 215, 'use_sma': False, 'use_atr': False, 'use_adx': True, 'use_ema': True, 'use_spike': False, 'rsi_required': False, 'edge_k': 1.0616077676090279, 'edge_cap': 0.09057815811640646, 'bull_strategy': 'breakout', 'bull_bb_std_mult': 2.1507048137453038, 'bull_rsi_os': 25, 'bull_rsi_ob': 59, 'bull_adx_thresh': 12.538171745823586, 'bull_atr_min_pct': 0.0032371238102360898, 'bull_atr_max_pct': 0.06600605587536257, 'bull_tp_mult': 1.9479216248627236, 'bull_tsl_mult': 0.0018773498477928268, 'bull_time_stop': 177, 'bull_use_sma': False, 'bull_use_ema': True, 'bull_use_atr': False, 'bull_use_adx': False, 'bull_use_spike': False, 'bull_rsi_required': True, 'bear_strategy': 'breakout', 'bear_bb_std_mult': 2.2334151280395362, 'bear_rsi_os': 31, 'bear_rsi_ob': 64, 'bear_adx_thresh': 5.017334244100336, 'bear_atr_min_pct': 0.029975495514078094, 'bear_atr_max_pct': 0.10321013528863632, 'bear_tp_mult': 1.1618551171741633, 'bear_tsl_mult': 0.9999140850624991, 'bear_time_stop': 104, 'bear_use_sma': False, 'bear_use_ema': False, 'bear_use_atr': False, 'bear_use_adx': False, 'bear_use_spike': False, 'bear_rsi_required': True, 'sideways_strategy': 'breakout', 'sideways_bb_std_mult': 2.6506385007945794, 'sideways_rsi_os': 45, 'sideways_rsi_ob': 45, 'sideways_adx_thresh': 23.688407300824736, 'sideways_atr_min_pct': 0.011148660927068076, 'sideways_atr_max_pct': 0.020349199178654957, 'sideways_tp_mult': 1.1815296004007247, 'sideways_tsl_mult': 0.47974878549307315, 'sideways_time_stop': 33, 'sideways_use_sma': False, 'sideways_use_ema': True, 'sideways_use_atr': True, 'sideways_use_adx': False, 'sideways_use_spike': True, 'sideways_rsi_required': True}.
[I 2025-09-01 07:42:16,298] Trial 125 finished with values: [-1000000000.0, 1000000000.0] and parameters: {'p_sma': 7, 'p_std': 58, 'p_atr': 25, 'p_adx': 29, 'rsi_period': 42, 'ema1': 13, 'ema2': 60, 'slip_atr_k': 0.1469027839663449, 'slip_spread_k': 0.4621865751800399, 'spread_hl_frac': 0.012084244547938059, 'bb_std_mult': 3.5050157740238035, 'rsi_os': 48, 'rsi_ob': 77, 'vol_spike': 0.17256693650077773, 'adx_thresh': 23.013507604213622, 'atr_min_pct': 0.02852734870999274, 'atr_max_pct': 0.11107482554834901, 'tp_mult': 1.5588932878477895, 'tsl_mult': 0.11722223711351676, 'strategy': 'breakout', 'time_stop': 157, 'use_sma': False, 'use_atr': True, 'use_adx': False, 'use_ema': True, 'use_spike': True, 'rsi_required': False, 'edge_k': 1.1017678275239375, 'edge_cap': 0.09394265764156673, 'bull_strategy': 'mean_reversion', 'bull_bb_std_mult': 3.1989776953018203, 'bull_rsi_os': 53, 'bull_rsi_ob': 62, 'bull_adx_thresh': 19.039589630282205, 'bull_atr_min_pct': 0.005391948142050502, 'bull_atr_max_pct': 0.12318014108925336, 'bull_tp_mult': 1.9414494962512479, 'bull_tsl_mult': 0.9428651280301552, 'bull_time_stop': 173, 'bull_use_sma': False, 'bull_use_ema': True, 'bull_use_atr': False, 'bull_use_adx': False, 'bull_use_spike': False, 'bull_rsi_required': True, 'bear_strategy': 'breakout', 'bear_bb_std_mult': 2.218075331700821, 'bear_rsi_os': 12, 'bear_rsi_ob': 60, 'bear_adx_thresh': 6.778630362220884, 'bear_atr_min_pct': 0.02942417187237776, 'bear_atr_max_pct': 0.06102358616181767, 'bear_tp_mult': 1.0174333273620209, 'bear_tsl_mult': 0.5737065431287768, 'bear_time_stop': 104, 'bear_use_sma': False, 'bear_use_ema': False, 'bear_use_atr': False, 'bear_use_adx': False, 'bear_use_spike': False, 'bear_rsi_required': True, 'sideways_strategy': 'mean_reversion', 'sideways_bb_std_mult': 2.378225000390826, 'sideways_rsi_os': 40, 'sideways_rsi_ob': 54, 'sideways_adx_thresh': 22.31270588079347, 'sideways_atr_min_pct': 0.01036589504853851, 'sideways_atr_max_pct': 0.019376931370635467, 'sideways_tp_mult': 2.5032335764228337, 'sideways_tsl_mult': 0.48768353241825, 'sideways_time_stop': 69, 'sideways_use_sma': False, 'sideways_use_ema': True, 'sideways_use_atr': False, 'sideways_use_adx': False, 'sideways_use_spike': True, 'sideways_rsi_required': True}.
[I 2025-09-01 07:42:59,227] Trial 132 finished with values: [-0.021842441726552697, 0.021702459628777402] and parameters: {'p_sma': 20, 'p_std': 33, 'p_atr': 10, 'p_adx': 22, 'rsi_period': 36, 'ema1': 27, 'ema2': 13, 'slip_atr_k': 0.2319408665262068, 'slip_spread_k': 0.06329510775596181, 'spread_hl_frac': 0.012083707100747028, 'bb_std_mult': 0.7468749169548737, 'rsi_os': 13, 'rsi_ob': 74, 'vol_spike': 0.17259809624369632, 'adx_thresh': 21.550605120167543, 'atr_min_pct': 0.018784076702623345, 'atr_max_pct': 0.08597948025649313, 'tp_mult': 1.7237391512825866, 'tsl_mult': 0.1158777190536305, 'strategy': 'breakout', 'time_stop': 16, 'use_sma': False, 'use_atr': False, 'use_adx': False, 'use_ema': False, 'use_spike': False, 'rsi_required': False, 'edge_k': 1.0695788310524437, 'edge_cap': 0.20361091301370127, 'bull_strategy': 'breakout', 'bull_bb_std_mult': 2.180776445163963, 'bull_rsi_os': 29, 'bull_rsi_ob': 62, 'bull_adx_thresh': 23.18913628409847, 'bull_atr_min_pct': 0.0013677765784287869, 'bull_atr_max_pct': 0.06659827944643561, 'bull_tp_mult': 2.070531603378917, 'bull_tsl_mult': 0.7357991732427258, 'bull_time_stop': 183, 'bull_use_sma': False, 'bull_use_ema': True, 'bull_use_atr': False, 'bull_use_adx': False, 'bull_use_spike': True, 'bull_rsi_required': True, 'bear_strategy': 'breakout', 'bear_bb_std_mult': 2.2813573133223053, 'bear_rsi_os': 39, 'bear_rsi_ob': 58, 'bear_adx_thresh': 6.7650498134989405, 'bear_atr_min_pct': 0.028712352255398418, 'bear_atr_max_pct': 0.14984460369032743, 'bear_tp_mult': 2.7389727637087886, 'bear_tsl_mult': 0.43257985682176764, 'bear_time_stop': 164, 'bear_use_sma': False, 'bear_use_ema': False, 'bear_use_atr': False, 'bear_use_adx': False, 'bear_use_spike': False, 'bear_rsi_required': False, 'sideways_strategy': 'mean_reversion', 'sideways_bb_std_mult': 2.8315405609757835, 'sideways_rsi_os': 21, 'sideways_rsi_ob': 47, 'sideways_adx_thresh': 7.5807411408228695, 'sideways_atr_min_pct': 0.014252393724294382, 'sideways_atr_max_pct': 0.015646682085230266, 'sideways_tp_mult': 2.0066147449565905, 'sideways_tsl_mult': 0.6262256161428772, 'sideways_time_stop': 260, 'sideways_use_sma': False, 'sideways_use_ema': False, 'sideways_use_atr': True, 'sideways_use_adx': False, 'sideways_use_spike': True, 'sideways_rsi_required': True}.
[I 2025-09-01 07:42:59,725] Trial 130 finished with values: [-0.030443812479883703, 0.03039754438486894] and parameters: {'p_sma': 20, 'p_std': 37, 'p_atr': 10, 'p_adx': 15, 'rsi_period': 36, 'ema1': 27, 'ema2': 13, 'slip_atr_k': 0.1432094821961693, 'slip_spread_k': 0.7894686758947473, 'spread_hl_frac': 0.02223881275814313, 'bb_std_mult': 2.457856011886727, 'rsi_os': 13, 'rsi_ob': 72, 'vol_spike': 0.007970445757479627, 'adx_thresh': 29.647740939292266, 'atr_min_pct': 0.021772122172568527, 'atr_max_pct': 0.08460252356363353, 'tp_mult': 1.7351102480693488, 'tsl_mult': 0.3246297940298292, 'strategy': 'breakout', 'time_stop': 83, 'use_sma': False, 'use_atr': False, 'use_adx': False, 'use_ema': False, 'use_spike': False, 'rsi_required': False, 'edge_k': 1.0726014548217833, 'edge_cap': 0.9298464954353252, 'bull_strategy': 'breakout', 'bull_bb_std_mult': 3.1781087221567095, 'bull_rsi_os': 28, 'bull_rsi_ob': 62, 'bull_adx_thresh': 11.546386486750709, 'bull_atr_min_pct': 0.0009616170009929259, 'bull_atr_max_pct': 0.06636830032229941, 'bull_tp_mult': 2.2016394287896035, 'bull_tsl_mult': 0.0009948200602419655, 'bull_time_stop': 146, 'bull_use_sma': False, 'bull_use_ema': True, 'bull_use_atr': False, 'bull_use_adx': False, 'bull_use_spike': True, 'bull_rsi_required': True, 'bear_strategy': 'breakout', 'bear_bb_std_mult': 0.6025902759282682, 'bear_rsi_os': 38, 'bear_rsi_ob': 58, 'bear_adx_thresh': 6.5835195227029715, 'bear_atr_min_pct': 0.027643786140792746, 'bear_atr_max_pct': 0.1171540255562151, 'bear_tp_mult': 2.407313947978058, 'bear_tsl_mult': 0.31967281464986447, 'bear_time_stop': 54, 'bear_use_sma': False, 'bear_use_ema': False, 'bear_use_atr': False, 'bear_use_adx': False, 'bear_use_spike': False, 'bear_rsi_required': False, 'sideways_strategy': 'mean_reversion', 'sideways_bb_std_mult': 2.36059117531652, 'sideways_rsi_os': 22, 'sideways_rsi_ob': 51, 'sideways_adx_thresh': 27.65381693913412, 'sideways_atr_min_pct': 0.012868979595839387, 'sideways_atr_max_pct': 0.02471700492192725, 'sideways_tp_mult': 2.354101098444091, 'sideways_tsl_mult': 0.6241480231693819, 'sideways_time_stop': 13, 'sideways_use_sma': False, 'sideways_use_ema': False, 'sideways_use_atr': True, 'sideways_use_adx': False, 'sideways_use_spike': True, 'sideways_rsi_required': True}.
[I 2025-09-01 07:43:00,060] Trial 133 finished with values: [-0.02482027930925801, 0.02474847684950323] and parameters: {'p_sma': 37, 'p_std': 33, 'p_atr': 9, 'p_adx': 22, 'rsi_period': 19, 'ema1': 18, 'ema2': 13, 'slip_atr_k': 0.16491658406490695, 'slip_spread_k': 0.5759109348832094, 'spread_hl_frac': 0.016590710125473567, 'bb_std_mult': 0.758278678201591, 'rsi_os': 13, 'rsi_ob': 67, 'vol_spike': 0.1943306609908706, 'adx_thresh': 21.736409642273813, 'atr_min_pct': 0.022004686641959464, 'atr_max_pct': 0.10797392593912844, 'tp_mult': 1.7235630707547547, 'tsl_mult': 0.37945165407618653, 'strategy': 'breakout', 'time_stop': 295, 'use_sma': False, 'use_atr': False, 'use_adx': False, 'use_ema': False, 'use_spike': False, 'rsi_required': False, 'edge_k': 0.8494489857126556, 'edge_cap': 0.4413968338251134, 'bull_strategy': 'breakout', 'bull_bb_std_mult': 2.378129030901949, 'bull_rsi_os': 30, 'bull_rsi_ob': 49, 'bull_adx_thresh': 30.1417805909729, 'bull_atr_min_pct': 0.0011196722980891848, 'bull_atr_max_pct': 0.06173604387439584, 'bull_tp_mult': 2.242203023296632, 'bull_tsl_mult': 0.733649124938532, 'bull_time_stop': 289, 'bull_use_sma': False, 'bull_use_ema': True, 'bull_use_atr': False, 'bull_use_adx': False, 'bull_use_spike': True, 'bull_rsi_required': True, 'bear_strategy': 'breakout', 'bear_bb_std_mult': 2.006179963927303, 'bear_rsi_os': 38, 'bear_rsi_ob': 59, 'bear_adx_thresh': 34.08288485455333, 'bear_atr_min_pct': 0.027826743574771245, 'bear_atr_max_pct': 0.0553246809085601, 'bear_tp_mult': 1.2453802181785167, 'bear_tsl_mult': 0.32167508431557146, 'bear_time_stop': 163, 'bear_use_sma': False, 'bear_use_ema': False, 'bear_use_atr': True, 'bear_use_adx': False, 'bear_use_spike': False, 'bear_rsi_required': False, 'sideways_strategy': 'mean_reversion', 'sideways_bb_std_mult': 2.8435152887529096, 'sideways_rsi_os': 8, 'sideways_rsi_ob': 57, 'sideways_adx_thresh': 19.82388857872127, 'sideways_atr_min_pct': 0.014223129436265256, 'sideways_atr_max_pct': 0.01570118339361332, 'sideways_tp_mult': 1.0570177895105601, 'sideways_tsl_mult': 0.6137901519524924, 'sideways_time_stop': 91, 'sideways_use_sma': False, 'sideways_use_ema': False, 'sideways_use_atr': True, 'sideways_use_adx': False, 'sideways_use_spike': True, 'sideways_rsi_required': False}.
[I 2025-09-01 07:43:00,076] Trial 131 finished with values: [-0.043088310106288885, 0.042975807223702575] and parameters: {'p_sma': 53, 'p_std': 34, 'p_atr': 24, 'p_adx': 29, 'rsi_period': 35, 'ema1': 27, 'ema2': 13, 'slip_atr_k': 0.05117202290849905, 'slip_spread_k': 0.7092306564047955, 'spread_hl_frac': 0.01698663973251633, 'bb_std_mult': 0.758906178555634, 'rsi_os': 13, 'rsi_ob': 72, 'vol_spike': 0.17241072392888912, 'adx_thresh': 29.9530902525062, 'atr_min_pct': 0.022005972999146084, 'atr_max_pct': 0.10709326749643934, 'tp_mult': 1.720352251747591, 'tsl_mult': 0.4043708213738162, 'strategy': 'breakout', 'time_stop': 124, 'use_sma': False, 'use_atr': False, 'use_adx': False, 'use_ema': False, 'use_spike': False, 'rsi_required': False, 'edge_k': 0.865838469335712, 'edge_cap': 0.4488458077373141, 'bull_strategy': 'breakout', 'bull_bb_std_mult': 2.394188305229893, 'bull_rsi_os': 10, 'bull_rsi_ob': 83, 'bull_adx_thresh': 12.13230555133953, 'bull_atr_min_pct': 0.0009728213434465564, 'bull_atr_max_pct': 0.06237620657929482, 'bull_tp_mult': 2.104238651603706, 'bull_tsl_mult': 0.0016782217671001548, 'bull_time_stop': 147, 'bull_use_sma': False, 'bull_use_ema': True, 'bull_use_atr': False, 'bull_use_adx': False, 'bull_use_spike': True, 'bull_rsi_required': True, 'bear_strategy': 'breakout', 'bear_bb_std_mult': 3.004717220376713, 'bear_rsi_os': 45, 'bear_rsi_ob': 58, 'bear_adx_thresh': 6.722215320102254, 'bear_atr_min_pct': 0.027734801088323623, 'bear_atr_max_pct': 0.05069430762806053, 'bear_tp_mult': 1.0121003503230988, 'bear_tsl_mult': 0.4399522172762129, 'bear_time_stop': 93, 'bear_use_sma': False, 'bear_use_ema': False, 'bear_use_atr': False, 'bear_use_adx': False, 'bear_use_spike': False, 'bear_rsi_required': False, 'sideways_strategy': 'mean_reversion', 'sideways_bb_std_mult': 1.77873467220518, 'sideways_rsi_os': 22, 'sideways_rsi_ob': 57, 'sideways_adx_thresh': 26.435711894356825, 'sideways_atr_min_pct': 0.005301133015516062, 'sideways_atr_max_pct': 0.12642139179496292, 'sideways_tp_mult': 1.0508251822150378, 'sideways_tsl_mult': 0.6210320727572168, 'sideways_time_stop': 97, 'sideways_use_sma': False, 'sideways_use_ema': False, 'sideways_use_atr': True, 'sideways_use_adx': False, 'sideways_use_spike': True, 'sideways_rsi_required': True}.
[I 2025-09-01 07:43:00,549] Trial 136 finished with values: [-1000000000.0, 1000000000.0] and parameters: {'p_sma': 26, 'p_std': 30, 'p_atr': 16, 'p_adx': 27, 'rsi_period': 31, 'ema1': 17, 'ema2': 40, 'slip_atr_k': 0.1737640858348554, 'slip_spread_k': 0.13959508130471537, 'spread_hl_frac': 0.00254684817922691, 'bb_std_mult': 0.6795756686274398, 'rsi_os': 54, 'rsi_ob': 95, 'vol_spike': 0.2576964695546591, 'adx_thresh': 24.24699499786645, 'atr_min_pct': 0.029095262835565093, 'atr_max_pct': 0.05623086668819975, 'tp_mult': 1.8887370177948763, 'tsl_mult': 0.8031724516956102, 'strategy': 'mean_reversion', 'time_stop': 125, 'use_sma': True, 'use_atr': False, 'use_adx': False, 'use_ema': False, 'use_spike': False, 'rsi_required': True, 'edge_k': 0.6326251187968563, 'edge_cap': 0.47010840452953395, 'bull_strategy': 'breakout', 'bull_bb_std_mult': 1.4439109740304836, 'bull_rsi_os': 10, 'bull_rsi_ob': 51, 'bull_adx_thresh': 21.92548941069128, 'bull_atr_min_pct': 0.0028788166662076058, 'bull_atr_max_pct': 0.06334203413838081, 'bull_tp_mult': 1.6913631897788983, 'bull_tsl_mult': 0.018966129820809308, 'bull_time_stop': 165, 'bull_use_sma': True, 'bull_use_ema': False, 'bull_use_atr': True, 'bull_use_adx': True, 'bull_use_spike': True, 'bull_rsi_required': False, 'bear_strategy': 'mean_reversion', 'bear_bb_std_mult': 2.1312528717878894, 'bear_rsi_os': 45, 'bear_rsi_ob': 62, 'bear_adx_thresh': 24.051251727348422, 'bear_atr_min_pct': 0.01737339774936501, 'bear_atr_max_pct': 0.08451646614110517, 'bear_tp_mult': 1.052842398720625, 'bear_tsl_mult': 0.19524607003897027, 'bear_time_stop': 266, 'bear_use_sma': True, 'bear_use_ema': True, 'bear_use_atr': False, 'bear_use_adx': True, 'bear_use_spike': True, 'bear_rsi_required': False, 'sideways_strategy': 'mean_reversion', 'sideways_bb_std_mult': 0.5400569128631805, 'sideways_rsi_os': 37, 'sideways_rsi_ob': 88, 'sideways_adx_thresh': 11.843087609811983, 'sideways_atr_min_pct': 0.02997298600924638, 'sideways_atr_max_pct': 0.010403574647659376, 'sideways_tp_mult': 1.731571010203487, 'sideways_tsl_mult': 0.3515868257491871, 'sideways_time_stop': 208, 'sideways_use_sma': True, 'sideways_use_ema': False, 'sideways_use_atr': True, 'sideways_use_adx': False, 'sideways_use_spike': True, 'sideways_rsi_required': True}.
