[I 2025-08-30 14:23:45,213] Trial 30 finished with values: [-1000000000.0, 1000000000.0] and parameters: {'p_sma': 6, 'p_std': 55, 'p_atr': 22, 'p_adx': 9, 'rsi_period': 35, 'ema1': 7, 'ema2': 46, 'slip_atr_k': 0.19863204407570395, 'slip_spread_k': 0.8504305860196805, 'spread_hl_frac': 0.03954181027640661, 'bb_std_mult': 1.96142720185392, 'rsi_os': 25, 'rsi_ob': 45, 'vol_spike': 0.07566055933426394, 'adx_thresh': 8.13786304879012, 'atr_min_pct': 0.012340599048713048, 'atr_max_pct': 0.0976829821174478, 'tp_mult': 1.707063951263956, 'tsl_mult': 0.8665692107749278, 'strategy': 'mean_reversion', 'time_stop': 42, 'use_sma': False, 'use_atr': False, 'use_adx': False, 'use_ema': False, 'use_spike': False, 'rsi_required': False, 'edge_k': 1.0583270519329837, 'edge_cap': 0.13457771032253824, 'bull_strategy': 'mean_reversion', 'bull_bb_std_mult': 2.4530319887907703, 'bull_rsi_os': 32, 'bull_rsi_ob': 74, 'bull_adx_thresh': 20.92692650919235, 'bull_atr_min_pct': 0.02347507383818341, 'bull_atr_max_pct': 0.14975668154597177, 'bull_tp_mult': 2.2594447850260204, 'bull_tsl_mult': 0.021830653603721495, 'bull_time_stop': 228, 'bull_use_sma': True, 'bull_use_ema': False, 'bull_use_atr': False, 'bull_use_adx': True, 'bull_use_spike': True, 'bull_rsi_required': True, 'bear_strategy': 'breakout', 'bear_bb_std_mult': 1.840440346879114, 'bear_rsi_os': 17, 'bear_rsi_ob': 73, 'bear_adx_thresh': 20.747930983433555, 'bear_atr_min_pct': 0.026340623631920076, 'bear_atr_max_pct': 0.024382031882011046, 'bear_tp_mult': 2.0695195987892645, 'bear_tsl_mult': 0.3315924874041865, 'bear_time_stop': 196, 'bear_use_sma': False, 'bear_use_ema': True, 'bear_use_atr': False, 'bear_use_adx': True, 'bear_use_spike': False, 'bear_rsi_required': True, 'sideways_strategy': 'breakout', 'sideways_bb_std_mult': 2.9507444312203353, 'sideways_rsi_os': 21, 'sideways_rsi_ob': 67, 'sideways_adx_thresh': 31.592451413382985, 'sideways_atr_min_pct': 0.02490759183776029, 'sideways_atr_max_pct': 0.0486169764480445, 'sideways_tp_mult': 1.913678120098722, 'sideways_tsl_mult': 0.3569308708418647, 'sideways_time_stop': 155, 'sideways_use_sma': False, 'sideways_use_ema': True, 'sideways_use_atr': True, 'sideways_use_adx': False, 'sideways_use_spike': False, 'sideways_rsi_required': False}.
[I 2025-08-30 14:24:17,535] Trial 27 finished with values: [-1000000000.0, 1000000000.0] and parameters: {'p_sma': 37, 'p_std': 59, 'p_atr': 10, 'p_adx': 21, 'rsi_period': 34, 'ema1': 14, 'ema2': 40, 'slip_atr_k': 0.1511057338745167, 'slip_spread_k': 0.7465377343836782, 'spread_hl_frac': 0.007624061266736121, 'bb_std_mult': 0.9207486819288437, 'rsi_os': 15, 'rsi_ob': 83, 'vol_spike': 0.20255653250393796, 'adx_thresh': 10.282233527436848, 'atr_min_pct': 0.019967751208726334, 'atr_max_pct': 0.14605810633055238, 'tp_mult': 1.7067647561538124, 'tsl_mult': 0.23902373543388789, 'strategy': 'breakout', 'time_stop': 200, 'use_sma': True, 'use_atr': False, 'use_adx': True, 'use_ema': False, 'use_spike': False, 'rsi_required': False, 'edge_k': 1.7185431819341306, 'edge_cap': 0.16510824864620458, 'bull_strategy': 'mean_reversion', 'bull_bb_std_mult': 0.5342770789718059, 'bull_rsi_os': 32, 'bull_rsi_ob': 59, 'bull_adx_thresh': 21.113822834625118, 'bull_atr_min_pct': 0.004089534614819149, 'bull_atr_max_pct': 0.11833158976181024, 'bull_tp_mult': 1.9225265444115758, 'bull_tsl_mult': 0.35005944025407987, 'bull_time_stop': 77, 'bull_use_sma': False, 'bull_use_ema': False, 'bull_use_atr': True, 'bull_use_adx': False, 'bull_use_spike': True, 'bull_rsi_required': True, 'bear_strategy': 'breakout', 'bear_bb_std_mult': 2.2406697658658508, 'bear_rsi_os': 15, 'bear_rsi_ob': 62, 'bear_adx_thresh': 31.70164162871227, 'bear_atr_min_pct': 0.025121761688475644, 'bear_atr_max_pct': 0.09222734500759683, 'bear_tp_mult': 1.5910323127382056, 'bear_tsl_mult': 0.7530910224190184, 'bear_time_stop': 172, 'bear_use_sma': False, 'bear_use_ema': True, 'bear_use_atr': True, 'bear_use_adx': False, 'bear_use_spike': False, 'bear_rsi_required': True, 'sideways_strategy': 'breakout', 'sideways_bb_std_mult': 1.0549319639326045, 'sideways_rsi_os': 44, 'sideways_rsi_ob': 66, 'sideways_adx_thresh': 23.302687042286117, 'sideways_atr_min_pct': 0.023330142213644444, 'sideways_atr_max_pct': 0.13460586468163355, 'sideways_tp_mult': 2.030134611804854, 'sideways_tsl_mult': 0.16295155177509718, 'sideways_time_stop': 258, 'sideways_use_sma': True, 'sideways_use_ema': True, 'sideways_use_atr': True, 'sideways_use_adx': False, 'sideways_use_spike': True, 'sideways_rsi_required': False}.
[I 2025-08-30 14:24:17,739] Trial 31 finished with values: [-1000000000.0, 1000000000.0] and parameters: {'p_sma': 48, 'p_std': 53, 'p_atr': 19, 'p_adx': 24, 'rsi_period': 32, 'ema1': 26, 'ema2': 54, 'slip_atr_k': 0.024516961878533652, 'slip_spread_k': 0.5364381277918925, 'spread_hl_frac': 0.0002598955270123604, 'bb_std_mult': 0.8487480585191447, 'rsi_os': 33, 'rsi_ob': 55, 'vol_spike': 0.0916908157409888, 'adx_thresh': 27.251341000041236, 'atr_min_pct': 0.02283334926768038, 'atr_max_pct': 0.07177385360884775, 'tp_mult': 1.2159762779974443, 'tsl_mult': 0.471973796192503, 'strategy': 'breakout', 'time_stop': 286, 'use_sma': True, 'use_atr': False, 'use_adx': True, 'use_ema': False, 'use_spike': True, 'rsi_required': True, 'edge_k': 0.6201999924318539, 'edge_cap': 0.21323506658070923, 'bull_strategy': 'breakout', 'bull_bb_std_mult': 3.376134358846297, 'bull_rsi_os': 42, 'bull_rsi_ob': 83, 'bull_adx_thresh': 22.039601940193176, 'bull_atr_min_pct': 0.025836986908839975, 'bull_atr_max_pct': 0.03778050299032796, 'bull_tp_mult': 1.4840718592012823, 'bull_tsl_mult': 0.8922128839398178, 'bull_time_stop': 267, 'bull_use_sma': False, 'bull_use_ema': True, 'bull_use_atr': True, 'bull_use_adx': False, 'bull_use_spike': True, 'bull_rsi_required': False, 'bear_strategy': 'breakout', 'bear_bb_std_mult': 0.5118580286632641, 'bear_rsi_os': 24, 'bear_rsi_ob': 95, 'bear_adx_thresh': 31.499120558987617, 'bear_atr_min_pct': 0.025007863826736136, 'bear_atr_max_pct': 0.052793776881079814, 'bear_tp_mult': 2.6952523404212467, 'bear_tsl_mult': 0.0013150608455237967, 'bear_time_stop': 252, 'bear_use_sma': True, 'bear_use_ema': False, 'bear_use_atr': True, 'bear_use_adx': False, 'bear_use_spike': True, 'bear_rsi_required': True, 'sideways_strategy': 'mean_reversion', 'sideways_bb_std_mult': 1.1104125996478889, 'sideways_rsi_os': 33, 'sideways_rsi_ob': 67, 'sideways_adx_thresh': 34.81864060526034, 'sideways_atr_min_pct': 0.024314947321661506, 'sideways_atr_max_pct': 0.0967853312026884, 'sideways_tp_mult': 1.8437561408647678, 'sideways_tsl_mult': 0.20763779224574164, 'sideways_time_stop': 213, 'sideways_use_sma': True, 'sideways_use_ema': False, 'sideways_use_atr': False, 'sideways_use_adx': True, 'sideways_use_spike': True, 'sideways_rsi_required': True}.
[I 2025-08-30 14:24:17,864] Trial 28 finished with values: [-1000000000.0, 1000000000.0] and parameters: {'p_sma': 37, 'p_std': 60, 'p_atr': 10, 'p_adx': 23, 'rsi_period': 34, 'ema1': 23, 'ema2': 45, 'slip_atr_k': 0.15132529092673347, 'slip_spread_k': 0.7261809455976058, 'spread_hl_frac': 0.008593554843306674, 'bb_std_mult': 3.1454324048759985, 'rsi_os': 24, 'rsi_ob': 82, 'vol_spike': 0.20690861385923265, 'adx_thresh': 10.481314301344215, 'atr_min_pct': 0.01941655002626247, 'atr_max_pct': 0.04634712697417521, 'tp_mult': 1.701241987085481, 'tsl_mult': 0.8416002170779433, 'strategy': 'breakout', 'time_stop': 291, 'use_sma': True, 'use_atr': False, 'use_adx': True, 'use_ema': False, 'use_spike': False, 'rsi_required': False, 'edge_k': 1.041952771362442, 'edge_cap': 0.2292946597145249, 'bull_strategy': 'mean_reversion', 'bull_bb_std_mult': 0.5044916434693207, 'bull_rsi_os': 33, 'bull_rsi_ob': 60, 'bull_adx_thresh': 20.46962430824804, 'bull_atr_min_pct': 0.02525444456111106, 'bull_atr_max_pct': 0.12279265394355933, 'bull_tp_mult': 1.9252873660936414, 'bull_tsl_mult': 0.3535179250074143, 'bull_time_stop': 264, 'bull_use_sma': False, 'bull_use_ema': False, 'bull_use_atr': True, 'bull_use_adx': False, 'bull_use_spike': True, 'bull_rsi_required': True, 'bear_strategy': 'breakout', 'bear_bb_std_mult': 1.865135924050732, 'bear_rsi_os': 15, 'bear_rsi_ob': 61, 'bear_adx_thresh': 20.917589241322105, 'bear_atr_min_pct': 0.02510062845562413, 'bear_atr_max_pct': 0.05411012822603816, 'bear_tp_mult': 2.0594252947333422, 'bear_tsl_mult': 0.7632598722904174, 'bear_time_stop': 195, 'bear_use_sma': False, 'bear_use_ema': True, 'bear_use_atr': True, 'bear_use_adx': False, 'bear_use_spike': False, 'bear_rsi_required': True, 'sideways_strategy': 'breakout', 'sideways_bb_std_mult': 1.088756244934956, 'sideways_rsi_os': 21, 'sideways_rsi_ob': 66, 'sideways_adx_thresh': 6.057216385177824, 'sideways_atr_min_pct': 0.025227041362601697, 'sideways_atr_max_pct': 0.14618271475556627, 'sideways_tp_mult': 1.9254545239688976, 'sideways_tsl_mult': 0.9744048673509098, 'sideways_time_stop': 218, 'sideways_use_sma': True, 'sideways_use_ema': True, 'sideways_use_atr': True, 'sideways_use_adx': False, 'sideways_use_spike': True, 'sideways_rsi_required': False}.
[I 2025-08-30 14:24:17,957] Trial 29 finished with values: [-1000000000.0, 1000000000.0] and parameters: {'p_sma': 47, 'p_std': 55, 'p_atr': 10, 'p_adx': 9, 'rsi_period': 36, 'ema1': 23, 'ema2': 47, 'slip_atr_k': 0.15466736472096232, 'slip_spread_k': 0.5477586281014317, 'spread_hl_frac': 0.008147123236249065, 'bb_std_mult': 3.331049159368729, 'rsi_os': 5, 'rsi_ob': 56, 'vol_spike': 0.07890995328302775, 'adx_thresh': 10.092959748753099, 'atr_min_pct': 0.011857668313453765, 'atr_max_pct': 0.09979451021271393, 'tp_mult': 1.729446406189415, 'tsl_mult': 0.8463928202455894, 'strategy': 'mean_reversion', 'time_stop': 285, 'use_sma': False, 'use_atr': False, 'use_adx': False, 'use_ema': False, 'use_spike': False, 'rsi_required': False, 'edge_k': 1.116333630657431, 'edge_cap': 0.20085415542439378, 'bull_strategy': 'mean_reversion', 'bull_bb_std_mult': 0.5293685043847898, 'bull_rsi_os': 31, 'bull_rsi_ob': 74, 'bull_adx_thresh': 21.316259033479533, 'bull_atr_min_pct': 0.021641336413754035, 'bull_atr_max_pct': 0.12314988690135417, 'bull_tp_mult': 2.3597725860116308, 'bull_tsl_mult': 0.037497907159278476, 'bull_time_stop': 219, 'bull_use_sma': True, 'bull_use_ema': False, 'bull_use_atr': False, 'bull_use_adx': True, 'bull_use_spike': True, 'bull_rsi_required': True, 'bear_strategy': 'breakout', 'bear_bb_std_mult': 1.9096372013644505, 'bear_rsi_os': 16, 'bear_rsi_ob': 62, 'bear_adx_thresh': 31.374285821679543, 'bear_atr_min_pct': 0.02658783049574275, 'bear_atr_max_pct': 0.02786020625424694, 'bear_tp_mult': 2.0581726837584964, 'bear_tsl_mult': 0.7713994079673165, 'bear_time_stop': 198, 'bear_use_sma': False, 'bear_use_ema': True, 'bear_use_atr': False, 'bear_use_adx': True, 'bear_use_spike': False, 'bear_rsi_required': True, 'sideways_strategy': 'breakout', 'sideways_bb_std_mult': 1.62691843581419, 'sideways_rsi_os': 44, 'sideways_rsi_ob': 66, 'sideways_adx_thresh': 31.937935044068134, 'sideways_atr_min_pct': 0.02396147719358047, 'sideways_atr_max_pct': 0.045354137999179145, 'sideways_tp_mult': 1.9198843633515914, 'sideways_tsl_mult': 0.3567938636259781, 'sideways_time_stop': 59, 'sideways_use_sma': False, 'sideways_use_ema': True, 'sideways_use_atr': True, 'sideways_use_adx': False, 'sideways_use_spike': False, 'sideways_rsi_required': False}.
[I 2025-08-30 14:24:47,891] Trial 32 finished with values: [-1000000000.0, 1000000000.0] and parameters: {'p_sma': 31, 'p_std': 54, 'p_atr': 19, 'p_adx': 24, 'rsi_period': 50, 'ema1': 22, 'ema2': 10, 'slip_atr_k': 0.0879182276279398, 'slip_spread_k': 0.42127931005400826, 'spread_hl_frac': 0.024797379027371266, 'bb_std_mult': 2.920038224730657, 'rsi_os': 33, 'rsi_ob': 58, 'vol_spike': 0.14972718661124704, 'adx_thresh': 31.50517876226215, 'atr_min_pct': 0.009349689565731435, 'atr_max_pct': 0.07573537280090345, 'tp_mult': 2.7993091741936214, 'tsl_mult': 0.851178289613177, 'strategy': 'mean_reversion', 'time_stop': 287, 'use_sma': False, 'use_atr': True, 'use_adx': False, 'use_ema': True, 'use_spike': True, 'rsi_required': True, 'edge_k': 0.569802297532193, 'edge_cap': 0.05072375509153704, 'bull_strategy': 'breakout', 'bull_bb_std_mult': 2.840382642836787, 'bull_rsi_os': 42, 'bull_rsi_ob': 49, 'bull_adx_thresh': 18.71954072987466, 'bull_atr_min_pct': 0.025477443806790373, 'bull_atr_max_pct': 0.05389606689462882, 'bull_tp_mult': 1.4100030791294251, 'bull_tsl_mult': 0.7082320966821325, 'bull_time_stop': 158, 'bull_use_sma': True, 'bull_use_ema': True, 'bull_use_atr': True, 'bull_use_adx': False, 'bull_use_spike': True, 'bull_rsi_required': False, 'bear_strategy': 'breakout', 'bear_bb_std_mult': 3.570733728371173, 'bear_rsi_os': 25, 'bear_rsi_ob': 49, 'bear_adx_thresh': 15.179960227808214, 'bear_atr_min_pct': 0.02333839752827055, 'bear_atr_max_pct': 0.07777710647472613, 'bear_tp_mult': 2.7097911250939704, 'bear_tsl_mult': 0.023982671044048942, 'bear_time_stop': 276, 'bear_use_sma': True, 'bear_use_ema': False, 'bear_use_atr': False, 'bear_use_adx': False, 'bear_use_spike': True, 'bear_rsi_required': True, 'sideways_strategy': 'mean_reversion', 'sideways_bb_std_mult': 1.6142204297645502, 'sideways_rsi_os': 34, 'sideways_rsi_ob': 74, 'sideways_adx_thresh': 30.613588228670118, 'sideways_atr_min_pct': 0.005611213555919415, 'sideways_atr_max_pct': 0.022861043030210124, 'sideways_tp_mult': 2.1306142571869637, 'sideways_tsl_mult': 0.957031029199668, 'sideways_time_stop': 210, 'sideways_use_sma': False, 'sideways_use_ema': False, 'sideways_use_atr': False, 'sideways_use_adx': True, 'sideways_use_spike': False, 'sideways_rsi_required': True}.
[I 2025-08-30 14:24:48,325] Trial 34 finished with values: [-1000000000.0, 1000000000.0] and parameters: {'p_sma': 29, 'p_std': 35, 'p_atr': 25, 'p_adx': 30, 'rsi_period': 24, 'ema1': 7, 'ema2': 12, 'slip_atr_k': 0.0873735184604758, 'slip_spread_k': 0.4054655163405949, 'spread_hl_frac': 0.024691491056277798, 'bb_std_mult': 2.7892179308512257, 'rsi_os': 19, 'rsi_ob': 79, 'vol_spike': 0.15003147434131053, 'adx_thresh': 7.31463432090011, 'atr_min_pct': 0.007054208389845711, 'atr_max_pct': 0.0755590153447883, 'tp_mult': 2.771243104235655, 'tsl_mult': 0.917740605606963, 'strategy': 'mean_reversion', 'time_stop': 35, 'use_sma': False, 'use_atr': True, 'use_adx': False, 'use_ema': True, 'use_spike': True, 'rsi_required': True, 'edge_k': 1.4769068170846242, 'edge_cap': 0.05160263169148589, 'bull_strategy': 'breakout', 'bull_bb_std_mult': 2.743525693126789, 'bull_rsi_os': 37, 'bull_rsi_ob': 95, 'bull_adx_thresh': 9.89293062362831, 'bull_atr_min_pct': 0.0023646647086292775, 'bull_atr_max_pct': 0.054443184668205094, 'bull_tp_mult': 1.6797280426480314, 'bull_tsl_mult': 0.5457526573668027, 'bull_time_stop': 155, 'bull_use_sma': True, 'bull_use_ema': True, 'bull_use_atr': False, 'bull_use_adx': False, 'bull_use_spike': True, 'bull_rsi_required': False, 'bear_strategy': 'breakout', 'bear_bb_std_mult': 2.939430996007265, 'bear_rsi_os': 26, 'bear_rsi_ob': 48, 'bear_adx_thresh': 15.68086814375122, 'bear_atr_min_pct': 0.010466987586048988, 'bear_atr_max_pct': 0.0783602120166563, 'bear_tp_mult': 2.303488950521632, 'bear_tsl_mult': 0.6586775947529788, 'bear_time_stop': 278, 'bear_use_sma': True, 'bear_use_ema': False, 'bear_use_atr': False, 'bear_use_adx': True, 'bear_use_spike': True, 'bear_rsi_required': True, 'sideways_strategy': 'mean_reversion', 'sideways_bb_std_mult': 1.6038383092664883, 'sideways_rsi_os': 33, 'sideways_rsi_ob': 74, 'sideways_adx_thresh': 29.526230224305372, 'sideways_atr_min_pct': 0.005916482608770351, 'sideways_atr_max_pct': 0.0756987716714072, 'sideways_tp_mult': 1.0320874108401954, 'sideways_tsl_mult': 0.09033494075530703, 'sideways_time_stop': 299, 'sideways_use_sma': False, 'sideways_use_ema': False, 'sideways_use_atr': False, 'sideways_use_adx': True, 'sideways_use_spike': False, 'sideways_rsi_required': True}.
[I 2025-08-30 14:24:48,532] Trial 33 finished with values: [-1000000000.0, 1000000000.0] and parameters: {'p_sma': 33, 'p_std': 33, 'p_atr': 24, 'p_adx': 30, 'rsi_period': 54, 'ema1': 22, 'ema2': 11, 'slip_atr_k': 0.0930169184224076, 'slip_spread_k': 0.4120021735754549, 'spread_hl_frac': 0.027745641191409008, 'bb_std_mult': 2.742294256956736, 'rsi_os': 27, 'rsi_ob': 95, 'vol_spike': 0.14553279715005024, 'adx_thresh': 31.36375204048587, 'atr_min_pct': 0.011372326221022092, 'atr_max_pct': 0.02590264201395509, 'tp_mult': 2.8613016008463457, 'tsl_mult': 0.8437448351656501, 'strategy': 'mean_reversion', 'time_stop': 261, 'use_sma': False, 'use_atr': True, 'use_adx': False, 'use_ema': True, 'use_spike': True, 'rsi_required': False, 'edge_k': 1.1482866064463813, 'edge_cap': 0.054340507491338064, 'bull_strategy': 'breakout', 'bull_bb_std_mult': 2.8545523495334932, 'bull_rsi_os': 18, 'bull_rsi_ob': 51, 'bull_adx_thresh': 9.89457757046954, 'bull_atr_min_pct': 0.01899710065100653, 'bull_atr_max_pct': 0.058538776384026596, 'bull_tp_mult': 1.3874341609830625, 'bull_tsl_mult': 0.7252535220887061, 'bull_time_stop': 160, 'bull_use_sma': True, 'bull_use_ema': True, 'bull_use_atr': False, 'bull_use_adx': True, 'bull_use_spike': False, 'bull_rsi_required': False, 'bear_strategy': 'mean_reversion', 'bear_bb_std_mult': 2.904979511574159, 'bear_rsi_os': 26, 'bear_rsi_ob': 49, 'bear_adx_thresh': 15.211949742395932, 'bear_atr_min_pct': 0.01106358238089128, 'bear_atr_max_pct': 0.07733119467543004, 'bear_tp_mult': 2.332144791013881, 'bear_tsl_mult': 0.32301576418787153, 'bear_time_stop': 277, 'bear_use_sma': True, 'bear_use_ema': True, 'bear_use_atr': False, 'bear_use_adx': True, 'bear_use_spike': False, 'bear_rsi_required': False, 'sideways_strategy': 'mean_reversion', 'sideways_bb_std_mult': 1.576310808977987, 'sideways_rsi_os': 49, 'sideways_rsi_ob': 74, 'sideways_adx_thresh': 29.708052497667886, 'sideways_atr_min_pct': 0.006067132387192425, 'sideways_atr_max_pct': 0.07340047447632571, 'sideways_tp_mult': 2.1299274581014545, 'sideways_tsl_mult': 0.9709124823718306, 'sideways_time_stop': 60, 'sideways_use_sma': False, 'sideways_use_ema': True, 'sideways_use_atr': False, 'sideways_use_adx': True, 'sideways_use_spike': False, 'sideways_rsi_required': True}.
[I 2025-08-30 14:24:48,533] Trial 35 finished with values: [-1000000000.0, 1000000000.0] and parameters: {'p_sma': 28, 'p_std': 36, 'p_atr': 25, 'p_adx': 30, 'rsi_period': 21, 'ema1': 6, 'ema2': 55, 'slip_atr_k': 0.08958956685309216, 'slip_spread_k': 0.3807420378716272, 'spread_hl_frac': 0.024894957949132726, 'bb_std_mult': 2.707490010562772, 'rsi_os': 19, 'rsi_ob': 79, 'vol_spike': 0.25032003440387135, 'adx_thresh': 31.792734180629033, 'atr_min_pct': 0.007706342813838265, 'atr_max_pct': 0.025922815309272214, 'tp_mult': 2.845904737768312, 'tsl_mult': 0.659822424405757, 'strategy': 'breakout', 'time_stop': 31, 'use_sma': True, 'use_atr': True, 'use_adx': True, 'use_ema': True, 'use_spike': True, 'rsi_required': True, 'edge_k': 1.4837044297057298, 'edge_cap': 0.9813105172754399, 'bull_strategy': 'breakout', 'bull_bb_std_mult': 2.842380324714787, 'bull_rsi_os': 37, 'bull_rsi_ob': 95, 'bull_adx_thresh': 18.34556735244514, 'bull_atr_min_pct': 0.0020788622820647933, 'bull_atr_max_pct': 0.050931166881352546, 'bull_tp_mult': 1.6694403485780716, 'bull_tsl_mult': 0.7111608163646737, 'bull_time_stop': 175, 'bull_use_sma': True, 'bull_use_ema': True, 'bull_use_atr': False, 'bull_use_adx': False, 'bull_use_spike': False, 'bull_rsi_required': False, 'bear_strategy': 'breakout', 'bear_bb_std_mult': 2.7891281783707162, 'bear_rsi_os': 9, 'bear_rsi_ob': 50, 'bear_adx_thresh': 15.175547425966919, 'bear_atr_min_pct': 0.023348383521346543, 'bear_atr_max_pct': 0.07663973227319104, 'bear_tp_mult': 2.309733925083447, 'bear_tsl_mult': 0.27823754923482136, 'bear_time_stop': 275, 'bear_use_sma': True, 'bear_use_ema': False, 'bear_use_atr': False, 'bear_use_adx': True, 'bear_use_spike': True, 'bear_rsi_required': False, 'sideways_strategy': 'mean_reversion', 'sideways_bb_std_mult': 2.156202348177879, 'sideways_rsi_os': 50, 'sideways_rsi_ob': 58, 'sideways_adx_thresh': 29.403585993705256, 'sideways_atr_min_pct': 0.0062597391872136095, 'sideways_atr_max_pct': 0.017754315821118225, 'sideways_tp_mult': 2.1190853443014146, 'sideways_tsl_mult': 0.09222579593887342, 'sideways_time_stop': 281, 'sideways_use_sma': False, 'sideways_use_ema': False, 'sideways_use_atr': False, 'sideways_use_adx': True, 'sideways_use_spike': False, 'sideways_rsi_required': True}.
