[I 2025-08-30 14:33:51,061] Trial 106 finished with values: [-1000000000.0, 1000000000.0] and parameters: {'p_sma': 31, 'p_std': 11, 'p_atr': 13, 'p_adx': 8, 'rsi_period': 44, 'ema1': 10, 'ema2': 15, 'slip_atr_k': 0.027157707579930836, 'slip_spread_k': 0.2517040529140928, 'spread_hl_frac': 0.0051218869260881835, 'bb_std_mult': 2.032525521688689, 'rsi_os': 32, 'rsi_ob': 91, 'vol_spike': 0.011193510271470392, 'adx_thresh': 21.56148159081401, 'atr_min_pct': 0.02540190036738634, 'atr_max_pct': 0.0790899322604637, 'tp_mult': 2.699264063831543, 'tsl_mult': 0.7146823389976323, 'strategy': 'mean_reversion', 'time_stop': 157, 'use_sma': False, 'use_atr': True, 'use_adx': False, 'use_ema': True, 'use_spike': False, 'rsi_required': False, 'edge_k': 0.5326310334788766, 'edge_cap': 0.669951081951346, 'bull_strategy': 'breakout', 'bull_bb_std_mult': 2.381054447792438, 'bull_rsi_os': 14, 'bull_rsi_ob': 82, 'bull_adx_thresh': 31.690171328318556, 'bull_atr_min_pct': 0.01907937051320831, 'bull_atr_max_pct': 0.031112928977201713, 'bull_tp_mult': 1.6311853011296278, 'bull_tsl_mult': 0.2400450494428334, 'bull_time_stop': 253, 'bull_use_sma': False, 'bull_use_ema': False, 'bull_use_atr': True, 'bull_use_adx': True, 'bull_use_spike': False, 'bull_rsi_required': True, 'bear_strategy': 'breakout', 'bear_bb_std_mult': 1.9891134415986298, 'bear_rsi_os': 24, 'bear_rsi_ob': 63, 'bear_adx_thresh': 19.297801177364175, 'bear_atr_min_pct': 0.016664882074690062, 'bear_atr_max_pct': 0.04540160503773666, 'bear_tp_mult': 2.3573936762560157, 'bear_tsl_mult': 0.24789141036904563, 'bear_time_stop': 285, 'bear_use_sma': False, 'bear_use_ema': False, 'bear_use_atr': False, 'bear_use_adx': True, 'bear_use_spike': True, 'bear_rsi_required': False, 'sideways_strategy': 'breakout', 'sideways_bb_std_mult': 2.927540385377558, 'sideways_rsi_os': 7, 'sideways_rsi_ob': 53, 'sideways_adx_thresh': 6.675729061236645, 'sideways_atr_min_pct': 0.003946938949802802, 'sideways_atr_max_pct': 0.08213443457654356, 'sideways_tp_mult': 2.559576032515965, 'sideways_tsl_mult': 0.4002045506307769, 'sideways_time_stop': 52, 'sideways_use_sma': False, 'sideways_use_ema': True, 'sideways_use_atr': False, 'sideways_use_adx': True, 'sideways_use_spike': True, 'sideways_rsi_required': False}.
[I 2025-08-30 14:33:51,341] Trial 109 finished with values: [-1000000000.0, 1000000000.0] and parameters: {'p_sma': 31, 'p_std': 16, 'p_atr': 12, 'p_adx': 28, 'rsi_period': 44, 'ema1': 29, 'ema2': 27, 'slip_atr_k': 0.08178391605484142, 'slip_spread_k': 0.24784101289719973, 'spread_hl_frac': 0.04765509426952383, 'bb_std_mult': 2.022691750684004, 'rsi_os': 47, 'rsi_ob': 74, 'vol_spike': 0.24743791213712388, 'adx_thresh': 21.681369124400916, 'atr_min_pct': 0.02948550981815233, 'atr_max_pct': 0.011152745944651113, 'tp_mult': 2.5677572213358846, 'tsl_mult': 0.8704803658085245, 'strategy': 'mean_reversion', 'time_stop': 14, 'use_sma': False, 'use_atr': True, 'use_adx': False, 'use_ema': True, 'use_spike': False, 'rsi_required': False, 'edge_k': 1.6846983708990166, 'edge_cap': 0.6267678641439225, 'bull_strategy': 'breakout', 'bull_bb_std_mult': 2.218325053610247, 'bull_rsi_os': 25, 'bull_rsi_ob': 76, 'bull_adx_thresh': 13.974254736076267, 'bull_atr_min_pct': 0.009427575347912116, 'bull_atr_max_pct': 0.09266697166937388, 'bull_tp_mult': 1.6363973469601734, 'bull_tsl_mult': 0.6516621740429697, 'bull_time_stop': 166, 'bull_use_sma': False, 'bull_use_ema': True, 'bull_use_atr': True, 'bull_use_adx': True, 'bull_use_spike': False, 'bull_rsi_required': True, 'bear_strategy': 'breakout', 'bear_bb_std_mult': 0.7582550128397769, 'bear_rsi_os': 48, 'bear_rsi_ob': 52, 'bear_adx_thresh': 15.680027906124426, 'bear_atr_min_pct': 0.016950566306539707, 'bear_atr_max_pct': 0.02753158284716163, 'bear_tp_mult': 2.2109641039332044, 'bear_tsl_mult': 0.18609523942249395, 'bear_time_stop': 188, 'bear_use_sma': False, 'bear_use_ema': True, 'bear_use_atr': False, 'bear_use_adx': True, 'bear_use_spike': False, 'bear_rsi_required': False, 'sideways_strategy': 'breakout', 'sideways_bb_std_mult': 2.613460596240939, 'sideways_rsi_os': 11, 'sideways_rsi_ob': 47, 'sideways_adx_thresh': 21.975700685450295, 'sideways_atr_min_pct': 0.02298524830361903, 'sideways_atr_max_pct': 0.05962537969476975, 'sideways_tp_mult': 2.8762096308386647, 'sideways_tsl_mult': 0.6752610724945886, 'sideways_time_stop': 241, 'sideways_use_sma': False, 'sideways_use_ema': True, 'sideways_use_atr': False, 'sideways_use_adx': True, 'sideways_use_spike': False, 'sideways_rsi_required': False}.
[I 2025-08-30 14:34:21,918] Trial 111 finished with values: [-0.14718873192965054, 0.14712703494543508] and parameters: {'p_sma': 37, 'p_std': 29, 'p_atr': 14, 'p_adx': 8, 'rsi_period': 51, 'ema1': 29, 'ema2': 51, 'slip_atr_k': 0.005532538786624776, 'slip_spread_k': 0.33639385652410925, 'spread_hl_frac': 0.0016893191699411474, 'bb_std_mult': 0.588699143464428, 'rsi_os': 47, 'rsi_ob': 85, 'vol_spike': 0.23500748306139005, 'adx_thresh': 21.585381857789756, 'atr_min_pct': 0.01078148137915181, 'atr_max_pct': 0.14999754798833026, 'tp_mult': 2.9976289613390406, 'tsl_mult': 0.8698592304948928, 'strategy': 'mean_reversion', 'time_stop': 210, 'use_sma': True, 'use_atr': False, 'use_adx': False, 'use_ema': False, 'use_spike': False, 'rsi_required': False, 'edge_k': 1.6850006143351135, 'edge_cap': 0.6215640143192447, 'bull_strategy': 'breakout', 'bull_bb_std_mult': 2.1019442567072373, 'bull_rsi_os': 25, 'bull_rsi_ob': 93, 'bull_adx_thresh': 11.996637774396534, 'bull_atr_min_pct': 0.02660666254445755, 'bull_atr_max_pct': 0.09475254682161142, 'bull_tp_mult': 1.2669951290637815, 'bull_tsl_mult': 0.7966552668312774, 'bull_time_stop': 281, 'bull_use_sma': True, 'bull_use_ema': True, 'bull_use_atr': True, 'bull_use_adx': True, 'bull_use_spike': False, 'bull_rsi_required': True, 'bear_strategy': 'breakout', 'bear_bb_std_mult': 3.2733596751875282, 'bear_rsi_os': 24, 'bear_rsi_ob': 49, 'bear_adx_thresh': 15.788807095106279, 'bear_atr_min_pct': 0.0021855116198473343, 'bear_atr_max_pct': 0.028366625455445604, 'bear_tp_mult': 1.183266186171619, 'bear_tsl_mult': 0.6061740075491685, 'bear_time_stop': 137, 'bear_use_sma': False, 'bear_use_ema': False, 'bear_use_atr': True, 'bear_use_adx': False, 'bear_use_spike': False, 'bear_rsi_required': False, 'sideways_strategy': 'mean_reversion', 'sideways_bb_std_mult': 2.0359803777511765, 'sideways_rsi_os': 53, 'sideways_rsi_ob': 55, 'sideways_adx_thresh': 9.989959405097864, 'sideways_atr_min_pct': 0.000844225984880727, 'sideways_atr_max_pct': 0.018218987300027058, 'sideways_tp_mult': 2.412887401940778, 'sideways_tsl_mult': 0.41886587870002345, 'sideways_time_stop': 111, 'sideways_use_sma': False, 'sideways_use_ema': False, 'sideways_use_atr': False, 'sideways_use_adx': True, 'sideways_use_spike': True, 'sideways_rsi_required': True}.
[I 2025-08-30 14:34:22,113] Trial 112 finished with values: [-1000000000.0, 1000000000.0] and parameters: {'p_sma': 11, 'p_std': 29, 'p_atr': 17, 'p_adx': 19, 'rsi_period': 61, 'ema1': 29, 'ema2': 25, 'slip_atr_k': 0.11556514589019162, 'slip_spread_k': 0.3289977227965876, 'spread_hl_frac': 0.0011623727689344283, 'bb_std_mult': 1.7563394933921623, 'rsi_os': 24, 'rsi_ob': 93, 'vol_spike': 0.04911538361131097, 'adx_thresh': 33.680460524176084, 'atr_min_pct': 0.0127611618347939, 'atr_max_pct': 0.04319830826185872, 'tp_mult': 1.1386626784738803, 'tsl_mult': 0.8662572867061182, 'strategy': 'mean_reversion', 'time_stop': 214, 'use_sma': True, 'use_atr': False, 'use_adx': False, 'use_ema': False, 'use_spike': True, 'rsi_required': False, 'edge_k': 1.3014897968923953, 'edge_cap': 0.7407804709637753, 'bull_strategy': 'breakout', 'bull_bb_std_mult': 2.0758305125339844, 'bull_rsi_os': 16, 'bull_rsi_ob': 92, 'bull_adx_thresh': 13.859164724122433, 'bull_atr_min_pct': 0.021100501667313067, 'bull_atr_max_pct': 0.03780735009762936, 'bull_tp_mult': 2.640167590906775, 'bull_tsl_mult': 0.5023293880196086, 'bull_time_stop': 278, 'bull_use_sma': True, 'bull_use_ema': True, 'bull_use_atr': True, 'bull_use_adx': True, 'bull_use_spike': False, 'bull_rsi_required': True, 'bear_strategy': 'breakout', 'bear_bb_std_mult': 1.496587150539754, 'bear_rsi_os': 49, 'bear_rsi_ob': 92, 'bear_adx_thresh': 22.919237139740073, 'bear_atr_min_pct': 0.0222450174096797, 'bear_atr_max_pct': 0.028455756240997433, 'bear_tp_mult': 2.201209281617013, 'bear_tsl_mult': 0.6180769110151381, 'bear_time_stop': 111, 'bear_use_sma': True, 'bear_use_ema': True, 'bear_use_atr': True, 'bear_use_adx': False, 'bear_use_spike': False, 'bear_rsi_required': False, 'sideways_strategy': 'mean_reversion', 'sideways_bb_std_mult': 2.672378868916131, 'sideways_rsi_os': 11, 'sideways_rsi_ob': 92, 'sideways_adx_thresh': 21.41010544710732, 'sideways_atr_min_pct': 0.002434258295414103, 'sideways_atr_max_pct': 0.06517394802501981, 'sideways_tp_mult': 2.3757482098925764, 'sideways_tsl_mult': 0.0773076107105193, 'sideways_time_stop': 245, 'sideways_use_sma': False, 'sideways_use_ema': False, 'sideways_use_atr': False, 'sideways_use_adx': True, 'sideways_use_spike': True, 'sideways_rsi_required': True}.
[I 2025-08-30 14:34:22,352] Trial 110 finished with values: [-0.11666446206331693, 0.11657696069433582] and parameters: {'p_sma': 31, 'p_std': 31, 'p_atr': 17, 'p_adx': 8, 'rsi_period': 44, 'ema1': 30, 'ema2': 25, 'slip_atr_k': 0.08245310850981119, 'slip_spread_k': 0.29439899348590115, 'spread_hl_frac': 0.04790772077120751, 'bb_std_mult': 1.7852562609681986, 'rsi_os': 38, 'rsi_ob': 85, 'vol_spike': 0.23561799914919282, 'adx_thresh': 22.252895044441853, 'atr_min_pct': 0.025514717423814816, 'atr_max_pct': 0.09446260984372122, 'tp_mult': 1.7536217126320721, 'tsl_mult': 0.8624065620822985, 'strategy': 'mean_reversion', 'time_stop': 13, 'use_sma': True, 'use_atr': True, 'use_adx': False, 'use_ema': True, 'use_spike': False, 'rsi_required': False, 'edge_k': 1.683416999784838, 'edge_cap': 0.6120269821901922, 'bull_strategy': 'breakout', 'bull_bb_std_mult': 2.775047609775263, 'bull_rsi_os': 16, 'bull_rsi_ob': 76, 'bull_adx_thresh': 31.627822678534425, 'bull_atr_min_pct': 0.028318359688970802, 'bull_atr_max_pct': 0.12860155192638947, 'bull_tp_mult': 1.5933528108151307, 'bull_tsl_mult': 0.6543694328778988, 'bull_time_stop': 199, 'bull_use_sma': True, 'bull_use_ema': True, 'bull_use_atr': True, 'bull_use_adx': True, 'bull_use_spike': False, 'bull_rsi_required': True, 'bear_strategy': 'breakout', 'bear_bb_std_mult': 2.8519177722865345, 'bear_rsi_os': 31, 'bear_rsi_ob': 52, 'bear_adx_thresh': 20.18555815011431, 'bear_atr_min_pct': 0.027023600114672794, 'bear_atr_max_pct': 0.029265933561941175, 'bear_tp_mult': 2.3842073471004106, 'bear_tsl_mult': 0.19498138959998929, 'bear_time_stop': 105, 'bear_use_sma': False, 'bear_use_ema': True, 'bear_use_atr': True, 'bear_use_adx': True, 'bear_use_spike': False, 'bear_rsi_required': False, 'sideways_strategy': 'breakout', 'sideways_bb_std_mult': 3.4079056890671104, 'sideways_rsi_os': 47, 'sideways_rsi_ob': 53, 'sideways_adx_thresh': 34.75716666259932, 'sideways_atr_min_pct': 0.0012327230729418516, 'sideways_atr_max_pct': 0.06012260225734891, 'sideways_tp_mult': 2.388131383086275, 'sideways_tsl_mult': 0.3615623370873086, 'sideways_time_stop': 245, 'sideways_use_sma': False, 'sideways_use_ema': True, 'sideways_use_atr': False, 'sideways_use_adx': True, 'sideways_use_spike': True, 'sideways_rsi_required': True}.
[I 2025-08-30 14:34:22,638] Trial 113 finished with values: [-1000000000.0, 1000000000.0] and parameters: {'p_sma': 36, 'p_std': 29, 'p_atr': 15, 'p_adx': 19, 'rsi_period': 61, 'ema1': 30, 'ema2': 51, 'slip_atr_k': 0.006064374511623283, 'slip_spread_k': 0.33041084224332495, 'spread_hl_frac': 0.0010727559693871993, 'bb_std_mult': 1.7854578893423636, 'rsi_os': 24, 'rsi_ob': 69, 'vol_spike': 0.23392432851079975, 'adx_thresh': 22.488278101312165, 'atr_min_pct': 0.01062654639483009, 'atr_max_pct': 0.14151743775393505, 'tp_mult': 2.2664910864419023, 'tsl_mult': 0.7565655914978286, 'strategy': 'breakout', 'time_stop': 202, 'use_sma': True, 'use_atr': False, 'use_adx': False, 'use_ema': False, 'use_spike': True, 'rsi_required': True, 'edge_k': 1.0300347944334565, 'edge_cap': 0.604653952288182, 'bull_strategy': 'breakout', 'bull_bb_std_mult': 3.068658679966448, 'bull_rsi_os': 7, 'bull_rsi_ob': 78, 'bull_adx_thresh': 13.237310323703616, 'bull_atr_min_pct': 0.02126139737344694, 'bull_atr_max_pct': 0.03766194521690872, 'bull_tp_mult': 1.1551872563035293, 'bull_tsl_mult': 0.5061434221683612, 'bull_time_stop': 280, 'bull_use_sma': True, 'bull_use_ema': False, 'bull_use_atr': True, 'bull_use_adx': True, 'bull_use_spike': False, 'bull_rsi_required': True, 'bear_strategy': 'breakout', 'bear_bb_std_mult': 1.5038048132078126, 'bear_rsi_os': 21, 'bear_rsi_ob': 91, 'bear_adx_thresh': 9.257175273698897, 'bear_atr_min_pct': 0.0023823603870280242, 'bear_atr_max_pct': 0.010300250870144276, 'bear_tp_mult': 1.9148067512428621, 'bear_tsl_mult': 0.04554648032901171, 'bear_time_stop': 109, 'bear_use_sma': True, 'bear_use_ema': False, 'bear_use_atr': True, 'bear_use_adx': False, 'bear_use_spike': False, 'bear_rsi_required': False, 'sideways_strategy': 'mean_reversion', 'sideways_bb_std_mult': 1.9986418740045955, 'sideways_rsi_os': 28, 'sideways_rsi_ob': 92, 'sideways_adx_thresh': 5.18763513188836, 'sideways_atr_min_pct': 0.0023261782171343282, 'sideways_atr_max_pct': 0.01733609742448207, 'sideways_tp_mult': 2.3728393790951987, 'sideways_tsl_mult': 0.3475939680311545, 'sideways_time_stop': 230, 'sideways_use_sma': False, 'sideways_use_ema': False, 'sideways_use_atr': False, 'sideways_use_adx': True, 'sideways_use_spike': True, 'sideways_rsi_required': True}.
[I 2025-08-30 14:34:22,971] Trial 116 finished with values: [-1000000000.0, 1000000000.0] and parameters: {'p_sma': 34, 'p_std': 40, 'p_atr': 11, 'p_adx': 13, 'rsi_period': 48, 'ema1': 12, 'ema2': 10, 'slip_atr_k': 0.17946208366688454, 'slip_spread_k': 0.20727377473700956, 'spread_hl_frac': 0.0035544956390003053, 'bb_std_mult': 2.3112565870071045, 'rsi_os': 37, 'rsi_ob': 68, 'vol_spike': 0.028093385320158537, 'adx_thresh': 20.09783269125265, 'atr_min_pct': 0.028435748512548393, 'atr_max_pct': 0.018963579992571873, 'tp_mult': 2.608798532062498, 'tsl_mult': 0.5251905445139398, 'strategy': 'breakout', 'time_stop': 221, 'use_sma': True, 'use_atr': False, 'use_adx': True, 'use_ema': False, 'use_spike': True, 'rsi_required': True, 'edge_k': 1.0259401926792362, 'edge_cap': 0.6947172324842269, 'bull_strategy': 'breakout', 'bull_bb_std_mult': 3.269642948831744, 'bull_rsi_os': 6, 'bull_rsi_ob': 50, 'bull_adx_thresh': 15.927091472152963, 'bull_atr_min_pct': 0.000682513836683666, 'bull_atr_max_pct': 0.05888849154076377, 'bull_tp_mult': 2.882733287186178, 'bull_tsl_mult': 0.867866928398826, 'bull_time_stop': 290, 'bull_use_sma': False, 'bull_use_ema': False, 'bull_use_atr': True, 'bull_use_adx': True, 'bull_use_spike': False, 'bull_rsi_required': True, 'bear_strategy': 'mean_reversion', 'bear_bb_std_mult': 1.2601890505805053, 'bear_rsi_os': 39, 'bear_rsi_ob': 50, 'bear_adx_thresh': 17.463692979837173, 'bear_atr_min_pct': 0.00023547428774130068, 'bear_atr_max_pct': 0.06489330604976531, 'bear_tp_mult': 2.0220176895604727, 'bear_tsl_mult': 0.04747460148974442, 'bear_time_stop': 71, 'bear_use_sma': True, 'bear_use_ema': False, 'bear_use_atr': False, 'bear_use_adx': False, 'bear_use_spike': True, 'bear_rsi_required': False, 'sideways_strategy': 'breakout', 'sideways_bb_std_mult': 3.1204540347745438, 'sideways_rsi_os': 28, 'sideways_rsi_ob': 90, 'sideways_adx_thresh': 24.055826822526782, 'sideways_atr_min_pct': 0.004558945063641918, 'sideways_atr_max_pct': 0.12952946545358182, 'sideways_tp_mult': 2.6832278436191395, 'sideways_tsl_mult': 0.14168918442403683, 'sideways_time_stop': 229, 'sideways_use_sma': False, 'sideways_use_ema': False, 'sideways_use_atr': False, 'sideways_use_adx': True, 'sideways_use_spike': True, 'sideways_rsi_required': True}.
[I 2025-08-30 14:34:53,383] Trial 117 finished with values: [-1000000000.0, 1000000000.0] and parameters: {'p_sma': 34, 'p_std': 27, 'p_atr': 20, 'p_adx': 15, 'rsi_period': 49, 'ema1': 26, 'ema2': 10, 'slip_atr_k': 0.14636522466327478, 'slip_spread_k': 0.2109039113449487, 'spread_hl_frac': 0.0031784639675783407, 'bb_std_mult': 2.171321090976761, 'rsi_os': 17, 'rsi_ob': 48, 'vol_spike': 0.2753061350668865, 'adx_thresh': 20.246203528400315, 'atr_min_pct': 0.01719270261358599, 'atr_max_pct': 0.10076402062547472, 'tp_mult': 1.4862935619239752, 'tsl_mult': 0.03167249408510453, 'strategy': 'breakout', 'time_stop': 110, 'use_sma': True, 'use_atr': False, 'use_adx': True, 'use_ema': False, 'use_spike': False, 'rsi_required': True, 'edge_k': 0.8635517437526684, 'edge_cap': 0.7135116804460232, 'bull_strategy': 'breakout', 'bull_bb_std_mult': 3.2532432624031085, 'bull_rsi_os': 19, 'bull_rsi_ob': 66, 'bull_adx_thresh': 22.17586350738082, 'bull_atr_min_pct': 0.012188659235851797, 'bull_atr_max_pct': 0.021099698214589284, 'bull_tp_mult': 2.4854776846331186, 'bull_tsl_mult': 0.8564535007351219, 'bull_time_stop': 290, 'bull_use_sma': False, 'bull_use_ema': False, 'bull_use_atr': False, 'bull_use_adx': True, 'bull_use_spike': False, 'bull_rsi_required': True, 'bear_strategy': 'mean_reversion', 'bear_bb_std_mult': 1.3050753789351675, 'bear_rsi_os': 17, 'bear_rsi_ob': 70, 'bear_adx_thresh': 17.279919556990855, 'bear_atr_min_pct': 0.009301600394835144, 'bear_atr_max_pct': 0.1446926807761086, 'bear_tp_mult': 2.0321580599929194, 'bear_tsl_mult': 0.22049360335946863, 'bear_time_stop': 95, 'bear_use_sma': False, 'bear_use_ema': False, 'bear_use_atr': False, 'bear_use_adx': False, 'bear_use_spike': True, 'bear_rsi_required': False, 'sideways_strategy': 'breakout', 'sideways_bb_std_mult': 2.9706920563991606, 'sideways_rsi_os': 15, 'sideways_rsi_ob': 90, 'sideways_adx_thresh': 24.087317543156388, 'sideways_atr_min_pct': 0.005070950919574792, 'sideways_atr_max_pct': 0.08754738141168845, 'sideways_tp_mult': 2.061481264187637, 'sideways_tsl_mult': 0.1718977520027041, 'sideways_time_stop': 129, 'sideways_use_sma': False, 'sideways_use_ema': False, 'sideways_use_atr': False, 'sideways_use_adx': True, 'sideways_use_spike': True, 'sideways_rsi_required': True}.
[I 2025-08-30 14:34:53,718] Trial 114 finished with values: [-1000000000.0, 1000000000.0] and parameters: {'p_sma': 51, 'p_std': 39, 'p_atr': 17, 'p_adx': 19, 'rsi_period': 25, 'ema1': 28, 'ema2': 10, 'slip_atr_k': 0.03495143739871011, 'slip_spread_k': 0.29837937835870537, 'spread_hl_frac': 0.0011596117282977204, 'bb_std_mult': 1.7933834696479458, 'rsi_os': 17, 'rsi_ob': 93, 'vol_spike': 0.11790056096351981, 'adx_thresh': 33.76753475675969, 'atr_min_pct': 0.012860039996704872, 'atr_max_pct': 0.09324857551281109, 'tp_mult': 1.7701997423456157, 'tsl_mult': 0.9997482992074458, 'strategy': 'breakout', 'time_stop': 220, 'use_sma': True, 'use_atr': False, 'use_adx': False, 'use_ema': False, 'use_spike': True, 'rsi_required': True, 'edge_k': 1.0742246498470673, 'edge_cap': 0.7161564818599117, 'bull_strategy': 'breakout', 'bull_bb_std_mult': 2.6534743985629996, 'bull_rsi_os': 16, 'bull_rsi_ob': 50, 'bull_adx_thresh': 15.85688844476871, 'bull_atr_min_pct': 0.02076303881016302, 'bull_atr_max_pct': 0.1288179580827528, 'bull_tp_mult': 1.9409739339281709, 'bull_tsl_mult': 0.5020475995603393, 'bull_time_stop': 272, 'bull_use_sma': True, 'bull_use_ema': False, 'bull_use_atr': True, 'bull_use_adx': True, 'bull_use_spike': False, 'bull_rsi_required': True, 'bear_strategy': 'breakout', 'bear_bb_std_mult': 1.2872571398329788, 'bear_rsi_os': 14, 'bear_rsi_ob': 51, 'bear_adx_thresh': 17.314025798234983, 'bear_atr_min_pct': 0.026833269444163883, 'bear_atr_max_pct': 0.065262520931783, 'bear_tp_mult': 1.9269473265686758, 'bear_tsl_mult': 0.01953449255969808, 'bear_time_stop': 109, 'bear_use_sma': True, 'bear_use_ema': False, 'bear_use_atr': True, 'bear_use_adx': False, 'bear_use_spike': True, 'bear_rsi_required': False, 'sideways_strategy': 'mean_reversion', 'sideways_bb_std_mult': 3.114531213512865, 'sideways_rsi_os': 28, 'sideways_rsi_ob': 92, 'sideways_adx_thresh': 34.96499030932888, 'sideways_atr_min_pct': 0.00236797007271603, 'sideways_atr_max_pct': 0.06453394789953104, 'sideways_tp_mult': 2.073068030393775, 'sideways_tsl_mult': 0.17138395538083817, 'sideways_time_stop': 234, 'sideways_use_sma': False, 'sideways_use_ema': False, 'sideways_use_atr': False, 'sideways_use_adx': True, 'sideways_use_spike': True, 'sideways_rsi_required': True}.
