[I 2025-08-30 15:35:09,961] Trial 496 finished with values: [-1000000000.0, 1000000000.0] and parameters: {'p_sma': 7, 'p_std': 56, 'p_atr': 7, 'p_adx': 27, 'rsi_period': 80, 'ema1': 30, 'ema2': 32, 'slip_atr_k': 0.0820761903971109, 'slip_spread_k': 0.06894569982409268, 'spread_hl_frac': 0.02746928680997429, 'bb_std_mult': 1.4915427287718046, 'rsi_os': 8, 'rsi_ob': 48, 'vol_spike': 0.14085906021271294, 'adx_thresh': 12.953539305001012, 'atr_min_pct': 0.013555186639175303, 'atr_max_pct': 0.12237469473694867, 'tp_mult': 1.8258847191438057, 'tsl_mult': 0.7808180525343189, 'strategy': 'breakout', 'time_stop': 205, 'use_sma': True, 'use_atr': True, 'use_adx': False, 'use_ema': True, 'use_spike': False, 'rsi_required': False, 'edge_k': 0.26563184878851737, 'edge_cap': 0.5619316307330414, 'bull_strategy': 'breakout', 'bull_bb_std_mult': 1.6657456745119203, 'bull_rsi_os': 41, 'bull_rsi_ob': 70, 'bull_adx_thresh': 23.017862179821172, 'bull_atr_min_pct': 0.017862430673976307, 'bull_atr_max_pct': 0.09894034926735351, 'bull_tp_mult': 2.0891355311704163, 'bull_tsl_mult': 0.2560587821688478, 'bull_time_stop': 178, 'bull_use_sma': True, 'bull_use_ema': True, 'bull_use_atr': False, 'bull_use_adx': False, 'bull_use_spike': True, 'bull_rsi_required': False, 'bear_strategy': 'mean_reversion', 'bear_bb_std_mult': 3.2956125544651536, 'bear_rsi_os': 29, 'bear_rsi_ob': 78, 'bear_adx_thresh': 5.569181325786493, 'bear_atr_min_pct': 0.022196774743422104, 'bear_atr_max_pct': 0.06285326897449217, 'bear_tp_mult': 1.6100073012701392, 'bear_tsl_mult': 0.6144423108141159, 'bear_time_stop': 55, 'bear_use_sma': True, 'bear_use_ema': False, 'bear_use_atr': True, 'bear_use_adx': True, 'bear_use_spike': True, 'bear_rsi_required': True, 'sideways_strategy': 'mean_reversion', 'sideways_bb_std_mult': 2.814973661800452, 'sideways_rsi_os': 43, 'sideways_rsi_ob': 59, 'sideways_adx_thresh': 9.769189968065893, 'sideways_atr_min_pct': 0.008647918624502027, 'sideways_atr_max_pct': 0.1309399794992503, 'sideways_tp_mult': 2.4599919689384304, 'sideways_tsl_mult': 0.9784413594968759, 'sideways_time_stop': 92, 'sideways_use_sma': True, 'sideways_use_ema': True, 'sideways_use_atr': False, 'sideways_use_adx': True, 'sideways_use_spike': True, 'sideways_rsi_required': True}.
[I 2025-08-30 15:35:09,954] Trial 495 finished with values: [-1000000000.0, 1000000000.0] and parameters: {'p_sma': 42, 'p_std': 56, 'p_atr': 23, 'p_adx': 27, 'rsi_period': 80, 'ema1': 5, 'ema2': 31, 'slip_atr_k': 0.07356299011673151, 'slip_spread_k': 0.13200837507992655, 'spread_hl_frac': 0.027422181013823037, 'bb_std_mult': 1.5547190271980285, 'rsi_os': 8, 'rsi_ob': 70, 'vol_spike': 0.18681973949552738, 'adx_thresh': 12.976778207290547, 'atr_min_pct': 0.013195278401825189, 'atr_max_pct': 0.0776628529643751, 'tp_mult': 1.8181412304133464, 'tsl_mult': 0.7278053478226609, 'strategy': 'breakout', 'time_stop': 135, 'use_sma': True, 'use_atr': True, 'use_adx': False, 'use_ema': True, 'use_spike': True, 'rsi_required': True, 'edge_k': 0.27808938588688337, 'edge_cap': 0.26387992481010863, 'bull_strategy': 'breakout', 'bull_bb_std_mult': 2.5604745039720602, 'bull_rsi_os': 54, 'bull_rsi_ob': 51, 'bull_adx_thresh': 22.178812230726045, 'bull_atr_min_pct': 0.021208730569983604, 'bull_atr_max_pct': 0.07653476685454745, 'bull_tp_mult': 2.072469580237488, 'bull_tsl_mult': 0.31285974840805486, 'bull_time_stop': 197, 'bull_use_sma': True, 'bull_use_ema': True, 'bull_use_atr': False, 'bull_use_adx': False, 'bull_use_spike': True, 'bull_rsi_required': False, 'bear_strategy': 'mean_reversion', 'bear_bb_std_mult': 0.5527192761892809, 'bear_rsi_os': 28, 'bear_rsi_ob': 78, 'bear_adx_thresh': 29.002557756392818, 'bear_atr_min_pct': 0.02211394744620197, 'bear_atr_max_pct': 0.06162984027831142, 'bear_tp_mult': 1.622509007192824, 'bear_tsl_mult': 0.906787995511513, 'bear_time_stop': 188, 'bear_use_sma': True, 'bear_use_ema': False, 'bear_use_atr': True, 'bear_use_adx': True, 'bear_use_spike': True, 'bear_rsi_required': True, 'sideways_strategy': 'mean_reversion', 'sideways_bb_std_mult': 2.540655840470589, 'sideways_rsi_os': 7, 'sideways_rsi_ob': 70, 'sideways_adx_thresh': 10.761462109156103, 'sideways_atr_min_pct': 0.01894051025784659, 'sideways_atr_max_pct': 0.10165528281958022, 'sideways_tp_mult': 2.423292238059561, 'sideways_tsl_mult': 0.9799835732973162, 'sideways_time_stop': 89, 'sideways_use_sma': True, 'sideways_use_ema': True, 'sideways_use_atr': False, 'sideways_use_adx': True, 'sideways_use_spike': True, 'sideways_rsi_required': False}.
[I 2025-08-30 15:35:10,691] Trial 497 finished with values: [-1000000000.0, 1000000000.0] and parameters: {'p_sma': 7, 'p_std': 56, 'p_atr': 7, 'p_adx': 24, 'rsi_period': 65, 'ema1': 30, 'ema2': 56, 'slip_atr_k': 0.0819213985223699, 'slip_spread_k': 0.8108022486777253, 'spread_hl_frac': 0.02353984427580104, 'bb_std_mult': 2.7915492171169154, 'rsi_os': 55, 'rsi_ob': 49, 'vol_spike': 0.14355910174183278, 'adx_thresh': 24.26559761741718, 'atr_min_pct': 0.023604410044026046, 'atr_max_pct': 0.13719074390524655, 'tp_mult': 1.8446954613078705, 'tsl_mult': 0.7846086858837259, 'strategy': 'breakout', 'time_stop': 203, 'use_sma': True, 'use_atr': True, 'use_adx': False, 'use_ema': True, 'use_spike': False, 'rsi_required': False, 'edge_k': 0.2776488768803532, 'edge_cap': 0.5616335898462428, 'bull_strategy': 'breakout', 'bull_bb_std_mult': 2.465725310824536, 'bull_rsi_os': 40, 'bull_rsi_ob': 66, 'bull_adx_thresh': 16.258086657501604, 'bull_atr_min_pct': 0.01774629449236736, 'bull_atr_max_pct': 0.0611514677181001, 'bull_tp_mult': 2.074859986169875, 'bull_tsl_mult': 0.9458531824195744, 'bull_time_stop': 226, 'bull_use_sma': False, 'bull_use_ema': False, 'bull_use_atr': False, 'bull_use_adx': False, 'bull_use_spike': True, 'bull_rsi_required': False, 'bear_strategy': 'breakout', 'bear_bb_std_mult': 2.2445393653959975, 'bear_rsi_os': 45, 'bear_rsi_ob': 78, 'bear_adx_thresh': 25.89887920062819, 'bear_atr_min_pct': 0.02202719253029238, 'bear_atr_max_pct': 0.12480062955953787, 'bear_tp_mult': 1.6152753067783212, 'bear_tsl_mult': 0.8483356974994957, 'bear_time_stop': 54, 'bear_use_sma': True, 'bear_use_ema': False, 'bear_use_atr': False, 'bear_use_adx': False, 'bear_use_spike': False, 'bear_rsi_required': True, 'sideways_strategy': 'breakout', 'sideways_bb_std_mult': 1.4004460941456727, 'sideways_rsi_os': 43, 'sideways_rsi_ob': 82, 'sideways_adx_thresh': 7.323549374630938, 'sideways_atr_min_pct': 0.022596814412897022, 'sideways_atr_max_pct': 0.1306577517312151, 'sideways_tp_mult': 2.468520541295311, 'sideways_tsl_mult': 0.9769767667740755, 'sideways_time_stop': 85, 'sideways_use_sma': True, 'sideways_use_ema': True, 'sideways_use_atr': False, 'sideways_use_adx': True, 'sideways_use_spike': True, 'sideways_rsi_required': True}.
[I 2025-08-30 15:35:11,741] Trial 498 finished with values: [-1000000000.0, 1000000000.0] and parameters: {'p_sma': 7, 'p_std': 40, 'p_atr': 14, 'p_adx': 24, 'rsi_period': 18, 'ema1': 21, 'ema2': 32, 'slip_atr_k': 0.08099338106563625, 'slip_spread_k': 0.15163412387932979, 'spread_hl_frac': 0.023364912254220195, 'bb_std_mult': 2.7551476400950365, 'rsi_os': 8, 'rsi_ob': 49, 'vol_spike': 0.14201220264542067, 'adx_thresh': 24.323695466964807, 'atr_min_pct': 0.023415126646632915, 'atr_max_pct': 0.07249275219039242, 'tp_mult': 1.843591602564041, 'tsl_mult': 0.7772169218382637, 'strategy': 'breakout', 'time_stop': 119, 'use_sma': True, 'use_atr': True, 'use_adx': False, 'use_ema': True, 'use_spike': False, 'rsi_required': False, 'edge_k': 0.05368867359652002, 'edge_cap': 0.5625367912863038, 'bull_strategy': 'breakout', 'bull_bb_std_mult': 2.7329969316256837, 'bull_rsi_os': 40, 'bull_rsi_ob': 65, 'bull_adx_thresh': 22.958483848246463, 'bull_atr_min_pct': 0.01788630215845841, 'bull_atr_max_pct': 0.06100082190555058, 'bull_tp_mult': 2.3107155893461275, 'bull_tsl_mult': 0.26252246823649594, 'bull_time_stop': 203, 'bull_use_sma': False, 'bull_use_ema': False, 'bull_use_atr': False, 'bull_use_adx': False, 'bull_use_spike': True, 'bull_rsi_required': False, 'bear_strategy': 'breakout', 'bear_bb_std_mult': 1.5736119643304507, 'bear_rsi_os': 52, 'bear_rsi_ob': 64, 'bear_adx_thresh': 25.708030066914155, 'bear_atr_min_pct': 0.02222575815376763, 'bear_atr_max_pct': 0.10916023391252815, 'bear_tp_mult': 1.6055577181831007, 'bear_tsl_mult': 0.8917811316944424, 'bear_time_stop': 230, 'bear_use_sma': True, 'bear_use_ema': False, 'bear_use_atr': False, 'bear_use_adx': False, 'bear_use_spike': False, 'bear_rsi_required': True, 'sideways_strategy': 'breakout', 'sideways_bb_std_mult': 2.3748145972719037, 'sideways_rsi_os': 14, 'sideways_rsi_ob': 70, 'sideways_adx_thresh': 7.14590800284005, 'sideways_atr_min_pct': 0.0003644395791677425, 'sideways_atr_max_pct': 0.02743677865804977, 'sideways_tp_mult': 2.465044943751808, 'sideways_tsl_mult': 0.9827341059988384, 'sideways_time_stop': 83, 'sideways_use_sma': True, 'sideways_use_ema': True, 'sideways_use_atr': False, 'sideways_use_adx': True, 'sideways_use_spike': True, 'sideways_rsi_required': True}.
[I 2025-08-30 15:35:12,405] Trial 499 finished with values: [-1000000000.0, 1000000000.0] and parameters: {'p_sma': 7, 'p_std': 12, 'p_atr': 27, 'p_adx': 24, 'rsi_period': 78, 'ema1': 14, 'ema2': 34, 'slip_atr_k': 0.06293014467280314, 'slip_spread_k': 0.8615792183717934, 'spread_hl_frac': 0.009834498412095964, 'bb_std_mult': 0.9173870013519001, 'rsi_os': 55, 'rsi_ob': 68, 'vol_spike': 0.1602713294208979, 'adx_thresh': 13.315879069310885, 'atr_min_pct': 0.009166902424867703, 'atr_max_pct': 0.14149559951593027, 'tp_mult': 1.6887046774773133, 'tsl_mult': 0.7762530279813799, 'strategy': 'mean_reversion', 'time_stop': 192, 'use_sma': False, 'use_atr': True, 'use_adx': False, 'use_ema': True, 'use_spike': False, 'rsi_required': False, 'edge_k': 0.10722603584122052, 'edge_cap': 0.6118431710817106, 'bull_strategy': 'mean_reversion', 'bull_bb_std_mult': 3.5961946138620253, 'bull_rsi_os': 37, 'bull_rsi_ob': 63, 'bull_adx_thresh': 20.902753955549525, 'bull_atr_min_pct': 0.010265418846894088, 'bull_atr_max_pct': 0.060052307604301865, 'bull_tp_mult': 2.3118771933655955, 'bull_tsl_mult': 0.2987285497024613, 'bull_time_stop': 187, 'bull_use_sma': False, 'bull_use_ema': False, 'bull_use_atr': False, 'bull_use_adx': False, 'bull_use_spike': True, 'bull_rsi_required': False, 'bear_strategy': 'breakout', 'bear_bb_std_mult': 1.5542683666047545, 'bear_rsi_os': 52, 'bear_rsi_ob': 66, 'bear_adx_thresh': 25.66340830796691, 'bear_atr_min_pct': 0.021415861516274382, 'bear_atr_max_pct': 0.07730497188950686, 'bear_tp_mult': 1.653033957181613, 'bear_tsl_mult': 0.8892682491141033, 'bear_time_stop': 229, 'bear_use_sma': True, 'bear_use_ema': True, 'bear_use_atr': False, 'bear_use_adx': False, 'bear_use_spike': False, 'bear_rsi_required': True, 'sideways_strategy': 'breakout', 'sideways_bb_std_mult': 1.3881438771847174, 'sideways_rsi_os': 10, 'sideways_rsi_ob': 58, 'sideways_adx_thresh': 29.053185514967222, 'sideways_atr_min_pct': 0.0006024507402174858, 'sideways_atr_max_pct': 0.09565013482356256, 'sideways_tp_mult': 2.3702875404308674, 'sideways_tsl_mult': 0.9988153232960314, 'sideways_time_stop': 83, 'sideways_use_sma': True, 'sideways_use_ema': True, 'sideways_use_atr': True, 'sideways_use_adx': False, 'sideways_use_spike': True, 'sideways_rsi_required': True}.
[I 2025-08-30 15:35:13,015] Trial 502 finished with values: [-1000000000.0, 1000000000.0] and parameters: {'p_sma': 20, 'p_std': 44, 'p_atr': 15, 'p_adx': 7, 'rsi_period': 76, 'ema1': 10, 'ema2': 35, 'slip_atr_k': 0.20894050055306476, 'slip_spread_k': 0.06934889407779085, 'spread_hl_frac': 0.012801739512459331, 'bb_std_mult': 1.3109808117981983, 'rsi_os': 53, 'rsi_ob': 75, 'vol_spike': 0.16437476844245733, 'adx_thresh': 11.82406166277116, 'atr_min_pct': 0.013784226511842492, 'atr_max_pct': 0.07947852657922186, 'tp_mult': 1.7086535588631, 'tsl_mult': 0.7292801927780481, 'strategy': 'mean_reversion', 'time_stop': 93, 'use_sma': False, 'use_atr': True, 'use_adx': True, 'use_ema': True, 'use_spike': True, 'rsi_required': True, 'edge_k': 0.109701421069873, 'edge_cap': 0.6158150939777451, 'bull_strategy': 'mean_reversion', 'bull_bb_std_mult': 2.6042160406605266, 'bull_rsi_os': 37, 'bull_rsi_ob': 63, 'bull_adx_thresh': 20.861332702478784, 'bull_atr_min_pct': 0.020119567703330597, 'bull_atr_max_pct': 0.0642733057539876, 'bull_tp_mult': 1.23693619999619, 'bull_tsl_mult': 0.7825709884175519, 'bull_time_stop': 170, 'bull_use_sma': False, 'bull_use_ema': False, 'bull_use_atr': False, 'bull_use_adx': False, 'bull_use_spike': True, 'bull_rsi_required': False, 'bear_strategy': 'mean_reversion', 'bear_bb_std_mult': 0.8215882070503042, 'bear_rsi_os': 36, 'bear_rsi_ob': 68, 'bear_adx_thresh': 26.941991503636196, 'bear_atr_min_pct': 0.003918560691104918, 'bear_atr_max_pct': 0.07674298472931482, 'bear_tp_mult': 2.608066486077197, 'bear_tsl_mult': 0.5242921514811555, 'bear_time_stop': 10, 'bear_use_sma': True, 'bear_use_ema': True, 'bear_use_atr': True, 'bear_use_adx': False, 'bear_use_spike': False, 'bear_rsi_required': True, 'sideways_strategy': 'breakout', 'sideways_bb_std_mult': 2.4239062783030842, 'sideways_rsi_os': 21, 'sideways_rsi_ob': 84, 'sideways_adx_thresh': 28.944412516614356, 'sideways_atr_min_pct': 0.0021646319258201495, 'sideways_atr_max_pct': 0.14998377286322367, 'sideways_tp_mult': 2.371205086835621, 'sideways_tsl_mult': 0.9839340823487288, 'sideways_time_stop': 157, 'sideways_use_sma': True, 'sideways_use_ema': True, 'sideways_use_atr': True, 'sideways_use_adx': False, 'sideways_use_spike': False, 'sideways_rsi_required': False}.
[I 2025-08-30 15:35:59,643] Trial 500 finished with values: [-1000000000.0, 1000000000.0] and parameters: {'p_sma': 20, 'p_std': 40, 'p_atr': 20, 'p_adx': 24, 'rsi_period': 65, 'ema1': 29, 'ema2': 57, 'slip_atr_k': 0.1427873075585681, 'slip_spread_k': 0.1516289587981432, 'spread_hl_frac': 0.011720097791214532, 'bb_std_mult': 1.3349347217639782, 'rsi_os': 27, 'rsi_ob': 68, 'vol_spike': 0.16147599550669256, 'adx_thresh': 13.550638220101835, 'atr_min_pct': 0.023789379504209243, 'atr_max_pct': 0.07273570578200601, 'tp_mult': 1.8489330434366664, 'tsl_mult': 0.7781662805323364, 'strategy': 'mean_reversion', 'time_stop': 167, 'use_sma': False, 'use_atr': True, 'use_adx': False, 'use_ema': True, 'use_spike': False, 'rsi_required': False, 'edge_k': 1.861660284834757, 'edge_cap': 0.6129429689574435, 'bull_strategy': 'mean_reversion', 'bull_bb_std_mult': 1.200934930668737, 'bull_rsi_os': 37, 'bull_rsi_ob': 48, 'bull_adx_thresh': 9.285709650284286, 'bull_atr_min_pct': 0.022146304672802784, 'bull_atr_max_pct': 0.060149446187189176, 'bull_tp_mult': 2.9985852535153357, 'bull_tsl_mult': 0.7845498781757655, 'bull_time_stop': 206, 'bull_use_sma': False, 'bull_use_ema': False, 'bull_use_atr': False, 'bull_use_adx': False, 'bull_use_spike': True, 'bull_rsi_required': False, 'bear_strategy': 'breakout', 'bear_bb_std_mult': 1.9446678125135173, 'bear_rsi_os': 53, 'bear_rsi_ob': 66, 'bear_adx_thresh': 26.930770661917332, 'bear_atr_min_pct': 0.019573566441702824, 'bear_atr_max_pct': 0.10881842715401549, 'bear_tp_mult': 1.4687698272026157, 'bear_tsl_mult': 0.887317347200958, 'bear_time_stop': 231, 'bear_use_sma': True, 'bear_use_ema': True, 'bear_use_atr': False, 'bear_use_adx': False, 'bear_use_spike': False, 'bear_rsi_required': True, 'sideways_strategy': 'breakout', 'sideways_bb_std_mult': 2.343254580787648, 'sideways_rsi_os': 14, 'sideways_rsi_ob': 67, 'sideways_adx_thresh': 27.876708369800944, 'sideways_atr_min_pct': 0.016031119242659132, 'sideways_atr_max_pct': 0.09534620514116084, 'sideways_tp_mult': 1.451717585120101, 'sideways_tsl_mult': 0.9998045466153341, 'sideways_time_stop': 81, 'sideways_use_sma': True, 'sideways_use_ema': True, 'sideways_use_atr': True, 'sideways_use_adx': False, 'sideways_use_spike': True, 'sideways_rsi_required': True}.
[I 2025-08-30 15:36:00,702] Trial 501 finished with values: [-0.1434400988981055, 0.14340890757109223] and parameters: {'p_sma': 20, 'p_std': 59, 'p_atr': 15, 'p_adx': 19, 'rsi_period': 18, 'ema1': 14, 'ema2': 10, 'slip_atr_k': 0.19847926775493044, 'slip_spread_k': 0.1577135508733667, 'spread_hl_frac': 0.025965086024211256, 'bb_std_mult': 3.0336775985612556, 'rsi_os': 27, 'rsi_ob': 67, 'vol_spike': 0.16590721992803562, 'adx_thresh': 11.87776877386651, 'atr_min_pct': 0.009115772864333757, 'atr_max_pct': 0.07243520756601518, 'tp_mult': 1.696203208678925, 'tsl_mult': 0.7659144598020345, 'strategy': 'mean_reversion', 'time_stop': 122, 'use_sma': False, 'use_atr': True, 'use_adx': True, 'use_ema': True, 'use_spike': True, 'rsi_required': True, 'edge_k': 0.05715949872140513, 'edge_cap': 0.6164334080451259, 'bull_strategy': 'mean_reversion', 'bull_bb_std_mult': 2.753129846108976, 'bull_rsi_os': 37, 'bull_rsi_ob': 54, 'bull_adx_thresh': 20.848086477146452, 'bull_atr_min_pct': 0.020025425337910276, 'bull_atr_max_pct': 0.06535334345796841, 'bull_tp_mult': 1.2466197425744072, 'bull_tsl_mult': 0.2686638935321488, 'bull_time_stop': 204, 'bull_use_sma': False, 'bull_use_ema': False, 'bull_use_atr': False, 'bull_use_adx': False, 'bull_use_spike': True, 'bull_rsi_required': False, 'bear_strategy': 'breakout', 'bear_bb_std_mult': 1.9256658702666938, 'bear_rsi_os': 29, 'bear_rsi_ob': 66, 'bear_adx_thresh': 26.969518110654104, 'bear_atr_min_pct': 0.019413286515861813, 'bear_atr_max_pct': 0.0769773628245398, 'bear_tp_mult': 1.5327930050157963, 'bear_tsl_mult': 0.9420812656863714, 'bear_time_stop': 150, 'bear_use_sma': True, 'bear_use_ema': True, 'bear_use_atr': False, 'bear_use_adx': False, 'bear_use_spike': False, 'bear_rsi_required': True, 'sideways_strategy': 'breakout', 'sideways_bb_std_mult': 2.348107039628442, 'sideways_rsi_os': 42, 'sideways_rsi_ob': 66, 'sideways_adx_thresh': 28.975912744588985, 'sideways_atr_min_pct': 0.0005747798635632265, 'sideways_atr_max_pct': 0.09702990115913097, 'sideways_tp_mult': 1.9495682998980723, 'sideways_tsl_mult': 0.004461178019445289, 'sideways_time_stop': 83, 'sideways_use_sma': True, 'sideways_use_ema': True, 'sideways_use_atr': True, 'sideways_use_adx': False, 'sideways_use_spike': False, 'sideways_rsi_required': False}.
[I 2025-08-30 15:36:01,213] Trial 503 finished with values: [-1000000000.0, 1000000000.0] and parameters: {'p_sma': 47, 'p_std': 44, 'p_atr': 20, 'p_adx': 17, 'rsi_period': 77, 'ema1': 9, 'ema2': 10, 'slip_atr_k': 0.063811614029274, 'slip_spread_k': 0.15648403731269, 'spread_hl_frac': 0.02589941300959794, 'bb_std_mult': 1.3330515223120059, 'rsi_os': 26, 'rsi_ob': 76, 'vol_spike': 0.16581370882811117, 'adx_thresh': 11.883869624988051, 'atr_min_pct': 0.000770176760122844, 'atr_max_pct': 0.03972160726542295, 'tp_mult': 1.7003807050320772, 'tsl_mult': 0.7295549200602206, 'strategy': 'mean_reversion', 'time_stop': 218, 'use_sma': False, 'use_atr': True, 'use_adx': True, 'use_ema': True, 'use_spike': True, 'rsi_required': True, 'edge_k': 0.13109102273718215, 'edge_cap': 0.5881939673482406, 'bull_strategy': 'mean_reversion', 'bull_bb_std_mult': 2.3712321107107868, 'bull_rsi_os': 38, 'bull_rsi_ob': 48, 'bull_adx_thresh': 29.529323930065132, 'bull_atr_min_pct': 0.022045232278507597, 'bull_atr_max_pct': 0.06507310299745746, 'bull_tp_mult': 2.3924794938663454, 'bull_tsl_mult': 0.3145132797373218, 'bull_time_stop': 169, 'bull_use_sma': False, 'bull_use_ema': False, 'bull_use_atr': False, 'bull_use_adx': False, 'bull_use_spike': True, 'bull_rsi_required': False, 'bear_strategy': 'mean_reversion', 'bear_bb_std_mult': 1.9322747515317893, 'bear_rsi_os': 26, 'bear_rsi_ob': 80, 'bear_adx_thresh': 27.18680747857935, 'bear_atr_min_pct': 0.020822132374316904, 'bear_atr_max_pct': 0.07494461073568601, 'bear_tp_mult': 1.473918696545154, 'bear_tsl_mult': 0.943943206476147, 'bear_time_stop': 12, 'bear_use_sma': True, 'bear_use_ema': True, 'bear_use_atr': True, 'bear_use_adx': False, 'bear_use_spike': False, 'bear_rsi_required': True, 'sideways_strategy': 'breakout', 'sideways_bb_std_mult': 1.6766208073829987, 'sideways_rsi_os': 21, 'sideways_rsi_ob': 84, 'sideways_adx_thresh': 27.959352634731225, 'sideways_atr_min_pct': 0.026040481704522833, 'sideways_atr_max_pct': 0.1498193114461845, 'sideways_tp_mult': 1.185857290801065, 'sideways_tsl_mult': 0.00011214814111659699, 'sideways_time_stop': 154, 'sideways_use_sma': True, 'sideways_use_ema': True, 'sideways_use_atr': True, 'sideways_use_adx': False, 'sideways_use_spike': False, 'sideways_rsi_required': False}.
