[I 2025-08-30 14:52:33,769] Trial 260 finished with values: [-1000000000.0, 1000000000.0] and parameters: {'p_sma': 23, 'p_std': 33, 'p_atr': 12, 'p_adx': 18, 'rsi_period': 50, 'ema1': 30, 'ema2': 52, 'slip_atr_k': 0.0031760353269528196, 'slip_spread_k': 0.14958419881688095, 'spread_hl_frac': 0.018107710745839188, 'bb_std_mult': 2.0340506922648016, 'rsi_os': 33, 'rsi_ob': 84, 'vol_spike': 0.24841912127999013, 'adx_thresh': 20.901537704255553, 'atr_min_pct': 0.021136917338010014, 'atr_max_pct': 0.10657038419549986, 'tp_mult': 1.5007237707744068, 'tsl_mult': 0.606825139097738, 'strategy': 'mean_reversion', 'time_stop': 17, 'use_sma': True, 'use_atr': False, 'use_adx': False, 'use_ema': False, 'use_spike': False, 'rsi_required': False, 'edge_k': 1.7175495943984114, 'edge_cap': 0.05111504220708224, 'bull_strategy': 'breakout', 'bull_bb_std_mult': 1.4738351843663675, 'bull_rsi_os': 17, 'bull_rsi_ob': 78, 'bull_adx_thresh': 5.118002885141529, 'bull_atr_min_pct': 0.0033134881081650193, 'bull_atr_max_pct': 0.013792147170428232, 'bull_tp_mult': 2.6747744920233645, 'bull_tsl_mult': 0.16260485627782661, 'bull_time_stop': 99, 'bull_use_sma': False, 'bull_use_ema': False, 'bull_use_atr': True, 'bull_use_adx': True, 'bull_use_spike': True, 'bull_rsi_required': False, 'bear_strategy': 'breakout', 'bear_bb_std_mult': 2.3027498511168045, 'bear_rsi_os': 18, 'bear_rsi_ob': 52, 'bear_adx_thresh': 24.016803442408026, 'bear_atr_min_pct': 0.021888802100392523, 'bear_atr_max_pct': 0.021971915565093064, 'bear_tp_mult': 2.083939485602126, 'bear_tsl_mult': 0.7169192095769813, 'bear_time_stop': 20, 'bear_use_sma': False, 'bear_use_ema': False, 'bear_use_atr': False, 'bear_use_adx': True, 'bear_use_spike': True, 'bear_rsi_required': True, 'sideways_strategy': 'mean_reversion', 'sideways_bb_std_mult': 3.498480503849642, 'sideways_rsi_os': 37, 'sideways_rsi_ob': 86, 'sideways_adx_thresh': 15.42435501631439, 'sideways_atr_min_pct': 0.002926183412214743, 'sideways_atr_max_pct': 0.010571226042408774, 'sideways_tp_mult': 2.5511325109645817, 'sideways_tsl_mult': 0.10894282948969326, 'sideways_time_stop': 238, 'sideways_use_sma': False, 'sideways_use_ema': False, 'sideways_use_atr': False, 'sideways_use_adx': True, 'sideways_use_spike': True, 'sideways_rsi_required': False}.
[I 2025-08-30 14:52:33,786] Trial 261 finished with values: [-0.065646812258213, 0.06554598825599346] and parameters: {'p_sma': 46, 'p_std': 8, 'p_atr': 28, 'p_adx': 27, 'rsi_period': 84, 'ema1': 26, 'ema2': 18, 'slip_atr_k': 0.19304870044834477, 'slip_spread_k': 0.32808388813880585, 'spread_hl_frac': 0.017955019924732404, 'bb_std_mult': 1.279578530936666, 'rsi_os': 52, 'rsi_ob': 92, 'vol_spike': 0.22979763215352997, 'adx_thresh': 29.002069538540802, 'atr_min_pct': 0.005387342665939827, 'atr_max_pct': 0.10705297987805767, 'tp_mult': 1.1524971200890843, 'tsl_mult': 0.684475708470976, 'strategy': 'breakout', 'time_stop': 17, 'use_sma': True, 'use_atr': False, 'use_adx': False, 'use_ema': False, 'use_spike': False, 'rsi_required': True, 'edge_k': 1.3833060580254117, 'edge_cap': 0.7073475242957643, 'bull_strategy': 'mean_reversion', 'bull_bb_std_mult': 1.4949001463292952, 'bull_rsi_os': 50, 'bull_rsi_ob': 78, 'bull_adx_thresh': 16.736352492903446, 'bull_atr_min_pct': 0.00060867507442002, 'bull_atr_max_pct': 0.014387167229940462, 'bull_tp_mult': 1.5556623671361924, 'bull_tsl_mult': 0.5191127141236918, 'bull_time_stop': 38, 'bull_use_sma': False, 'bull_use_ema': False, 'bull_use_atr': True, 'bull_use_adx': True, 'bull_use_spike': True, 'bull_rsi_required': False, 'bear_strategy': 'breakout', 'bear_bb_std_mult': 2.6986705904528434, 'bear_rsi_os': 18, 'bear_rsi_ob': 52, 'bear_adx_thresh': 19.76496097945612, 'bear_atr_min_pct': 0.011321316073158174, 'bear_atr_max_pct': 0.057501568869725295, 'bear_tp_mult': 1.757231449724508, 'bear_tsl_mult': 0.20505764010047955, 'bear_time_stop': 19, 'bear_use_sma': False, 'bear_use_ema': False, 'bear_use_atr': False, 'bear_use_adx': True, 'bear_use_spike': True, 'bear_rsi_required': True, 'sideways_strategy': 'mean_reversion', 'sideways_bb_std_mult': 3.0228166674607864, 'sideways_rsi_os': 14, 'sideways_rsi_ob': 92, 'sideways_adx_thresh': 17.041907415868785, 'sideways_atr_min_pct': 0.004681942141808797, 'sideways_atr_max_pct': 0.07727575698150564, 'sideways_tp_mult': 2.7624126855672073, 'sideways_tsl_mult': 0.12330392710370701, 'sideways_time_stop': 236, 'sideways_use_sma': False, 'sideways_use_ema': False, 'sideways_use_atr': True, 'sideways_use_adx': False, 'sideways_use_spike': True, 'sideways_rsi_required': False}.
[I 2025-08-30 14:53:08,497] Trial 264 finished with values: [-0.021809567259667872, 0.022147971963725116] and parameters: {'p_sma': 37, 'p_std': 43, 'p_atr': 12, 'p_adx': 22, 'rsi_period': 50, 'ema1': 9, 'ema2': 11, 'slip_atr_k': 0.023853495978211365, 'slip_spread_k': 0.32770219565151437, 'spread_hl_frac': 0.04716103898856328, 'bb_std_mult': 0.8891288724646618, 'rsi_os': 35, 'rsi_ob': 84, 'vol_spike': 0.22910636220134384, 'adx_thresh': 31.781987409187913, 'atr_min_pct': 0.021330250213348265, 'atr_max_pct': 0.08298732008746866, 'tp_mult': 2.998166168405559, 'tsl_mult': 0.293074709895775, 'strategy': 'mean_reversion', 'time_stop': 16, 'use_sma': False, 'use_atr': False, 'use_adx': False, 'use_ema': False, 'use_spike': False, 'rsi_required': True, 'edge_k': 1.6194080262868698, 'edge_cap': 0.6455374108551368, 'bull_strategy': 'breakout', 'bull_bb_std_mult': 3.29072863486765, 'bull_rsi_os': 13, 'bull_rsi_ob': 81, 'bull_adx_thresh': 12.207726469277217, 'bull_atr_min_pct': 0.0031529244392537402, 'bull_atr_max_pct': 0.12442072664339354, 'bull_tp_mult': 1.3990433658742463, 'bull_tsl_mult': 0.4367222872695281, 'bull_time_stop': 261, 'bull_use_sma': True, 'bull_use_ema': True, 'bull_use_atr': True, 'bull_use_adx': False, 'bull_use_spike': True, 'bull_rsi_required': False, 'bear_strategy': 'breakout', 'bear_bb_std_mult': 1.0648504766198943, 'bear_rsi_os': 17, 'bear_rsi_ob': 63, 'bear_adx_thresh': 18.092656564209687, 'bear_atr_min_pct': 0.011465377067362914, 'bear_atr_max_pct': 0.010512546361983066, 'bear_tp_mult': 1.7367662619182738, 'bear_tsl_mult': 0.43555360199810406, 'bear_time_stop': 36, 'bear_use_sma': False, 'bear_use_ema': True, 'bear_use_atr': False, 'bear_use_adx': True, 'bear_use_spike': False, 'bear_rsi_required': True, 'sideways_strategy': 'breakout', 'sideways_bb_std_mult': 3.495356092446035, 'sideways_rsi_os': 40, 'sideways_rsi_ob': 92, 'sideways_adx_thresh': 17.282805567020482, 'sideways_atr_min_pct': 0.0037377448415020337, 'sideways_atr_max_pct': 0.02457877603655658, 'sideways_tp_mult': 1.873311046719424, 'sideways_tsl_mult': 0.12478384459429097, 'sideways_time_stop': 224, 'sideways_use_sma': True, 'sideways_use_ema': False, 'sideways_use_atr': False, 'sideways_use_adx': True, 'sideways_use_spike': True, 'sideways_rsi_required': False}.
[I 2025-08-30 14:53:08,806] Trial 265 finished with values: [-1000000000.0, 1000000000.0] and parameters: {'p_sma': 37, 'p_std': 28, 'p_atr': 12, 'p_adx': 22, 'rsi_period': 66, 'ema1': 25, 'ema2': 52, 'slip_atr_k': 0.19552742751845087, 'slip_spread_k': 0.3372120001524694, 'spread_hl_frac': 0.04687835194400365, 'bb_std_mult': 2.3519517906318588, 'rsi_os': 52, 'rsi_ob': 92, 'vol_spike': 0.2578404049155841, 'adx_thresh': 19.090867888181787, 'atr_min_pct': 0.02642013304083803, 'atr_max_pct': 0.08326833421235642, 'tp_mult': 2.991410569724551, 'tsl_mult': 0.24167625431609407, 'strategy': 'breakout', 'time_stop': 126, 'use_sma': False, 'use_atr': False, 'use_adx': False, 'use_ema': False, 'use_spike': True, 'rsi_required': True, 'edge_k': 1.6648807754675847, 'edge_cap': 0.8602958365530504, 'bull_strategy': 'mean_reversion', 'bull_bb_std_mult': 3.4283533586045607, 'bull_rsi_os': 50, 'bull_rsi_ob': 90, 'bull_adx_thresh': 16.290669512284623, 'bull_atr_min_pct': 0.004760936444899326, 'bull_atr_max_pct': 0.017330817450785716, 'bull_tp_mult': 1.5643474207747141, 'bull_tsl_mult': 0.4376664839123376, 'bull_time_stop': 262, 'bull_use_sma': True, 'bull_use_ema': True, 'bull_use_atr': False, 'bull_use_adx': False, 'bull_use_spike': False, 'bull_rsi_required': True, 'bear_strategy': 'breakout', 'bear_bb_std_mult': 1.7440004317344564, 'bear_rsi_os': 50, 'bear_rsi_ob': 93, 'bear_adx_thresh': 5.048668878538326, 'bear_atr_min_pct': 0.018829377610025105, 'bear_atr_max_pct': 0.03722556600100985, 'bear_tp_mult': 1.8819088714862142, 'bear_tsl_mult': 0.22787210352280843, 'bear_time_stop': 35, 'bear_use_sma': True, 'bear_use_ema': True, 'bear_use_atr': False, 'bear_use_adx': False, 'bear_use_spike': False, 'bear_rsi_required': False, 'sideways_strategy': 'breakout', 'sideways_bb_std_mult': 3.1634094543000946, 'sideways_rsi_os': 40, 'sideways_rsi_ob': 74, 'sideways_adx_thresh': 6.40766298092778, 'sideways_atr_min_pct': 0.005448083575016157, 'sideways_atr_max_pct': 0.024818531244768793, 'sideways_tp_mult': 1.6386459894987366, 'sideways_tsl_mult': 0.08622563482260401, 'sideways_time_stop': 224, 'sideways_use_sma': True, 'sideways_use_ema': False, 'sideways_use_atr': True, 'sideways_use_adx': False, 'sideways_use_spike': True, 'sideways_rsi_required': True}.
[I 2025-08-30 14:53:08,920] Trial 263 finished with values: [-1000000000.0, 1000000000.0] and parameters: {'p_sma': 23, 'p_std': 16, 'p_atr': 12, 'p_adx': 22, 'rsi_period': 67, 'ema1': 26, 'ema2': 11, 'slip_atr_k': 0.19703910613485942, 'slip_spread_k': 0.7451033704991978, 'spread_hl_frac': 0.01017919204476952, 'bb_std_mult': 3.195480763727595, 'rsi_os': 11, 'rsi_ob': 92, 'vol_spike': 0.11590063254077981, 'adx_thresh': 28.999521498413813, 'atr_min_pct': 0.0014986559093533216, 'atr_max_pct': 0.10720002322293957, 'tp_mult': 1.1662941575268186, 'tsl_mult': 0.09838385740281963, 'strategy': 'breakout', 'time_stop': 100, 'use_sma': False, 'use_atr': False, 'use_adx': False, 'use_ema': False, 'use_spike': False, 'rsi_required': True, 'edge_k': 1.6130841607633377, 'edge_cap': 0.8027633213975294, 'bull_strategy': 'mean_reversion', 'bull_bb_std_mult': 1.0231136758285588, 'bull_rsi_os': 50, 'bull_rsi_ob': 57, 'bull_adx_thresh': 16.390786072290403, 'bull_atr_min_pct': 0.011661712173812112, 'bull_atr_max_pct': 0.028966179356762344, 'bull_tp_mult': 2.202102930644484, 'bull_tsl_mult': 0.5208661304463468, 'bull_time_stop': 262, 'bull_use_sma': False, 'bull_use_ema': False, 'bull_use_atr': True, 'bull_use_adx': True, 'bull_use_spike': True, 'bull_rsi_required': False, 'bear_strategy': 'mean_reversion', 'bear_bb_std_mult': 1.7614301084411914, 'bear_rsi_os': 17, 'bear_rsi_ob': 81, 'bear_adx_thresh': 15.332307058996212, 'bear_atr_min_pct': 0.023741616635970242, 'bear_atr_max_pct': 0.030217878568443348, 'bear_tp_mult': 1.5441102837102534, 'bear_tsl_mult': 0.11322905341950079, 'bear_time_stop': 129, 'bear_use_sma': True, 'bear_use_ema': True, 'bear_use_atr': False, 'bear_use_adx': True, 'bear_use_spike': False, 'bear_rsi_required': False, 'sideways_strategy': 'mean_reversion', 'sideways_bb_std_mult': 3.0243527103131624, 'sideways_rsi_os': 43, 'sideways_rsi_ob': 92, 'sideways_adx_thresh': 17.204974707815683, 'sideways_atr_min_pct': 0.021387933192289404, 'sideways_atr_max_pct': 0.12566865881030542, 'sideways_tp_mult': 2.7454944237184544, 'sideways_tsl_mult': 0.13200518557723562, 'sideways_time_stop': 224, 'sideways_use_sma': True, 'sideways_use_ema': False, 'sideways_use_atr': True, 'sideways_use_adx': False, 'sideways_use_spike': True, 'sideways_rsi_required': False}.
[I 2025-08-30 14:53:09,023] Trial 266 finished with values: [-1000000000.0, 1000000000.0] and parameters: {'p_sma': 33, 'p_std': 44, 'p_atr': 30, 'p_adx': 22, 'rsi_period': 10, 'ema1': 9, 'ema2': 51, 'slip_atr_k': 0.025694954718066806, 'slip_spread_k': 0.7437537913042098, 'spread_hl_frac': 0.0263574561674026, 'bb_std_mult': 1.8192166532971763, 'rsi_os': 35, 'rsi_ob': 88, 'vol_spike': 0.17214913331195927, 'adx_thresh': 18.713664439065813, 'atr_min_pct': 0.019176312489770964, 'atr_max_pct': 0.10052743397551775, 'tp_mult': 2.3514730380129114, 'tsl_mult': 0.10329208119551814, 'strategy': 'mean_reversion', 'time_stop': 97, 'use_sma': False, 'use_atr': False, 'use_adx': False, 'use_ema': False, 'use_spike': True, 'rsi_required': False, 'edge_k': 1.6136462787790824, 'edge_cap': 0.6158194187871843, 'bull_strategy': 'breakout', 'bull_bb_std_mult': 2.2682758930810154, 'bull_rsi_os': 11, 'bull_rsi_ob': 57, 'bull_adx_thresh': 19.648669872198298, 'bull_atr_min_pct': 0.022639073884145, 'bull_atr_max_pct': 0.018269117985898635, 'bull_tp_mult': 1.3990132570236895, 'bull_tsl_mult': 0.4761628433245844, 'bull_time_stop': 263, 'bull_use_sma': True, 'bull_use_ema': True, 'bull_use_atr': False, 'bull_use_adx': False, 'bull_use_spike': False, 'bull_rsi_required': True, 'bear_strategy': 'mean_reversion', 'bear_bb_std_mult': 1.7514046099827596, 'bear_rsi_os': 37, 'bear_rsi_ob': 50, 'bear_adx_thresh': 22.124413121155392, 'bear_atr_min_pct': 0.01874265700942918, 'bear_atr_max_pct': 0.036839045761301856, 'bear_tp_mult': 2.5332674411382197, 'bear_tsl_mult': 0.10556137567211046, 'bear_time_stop': 37, 'bear_use_sma': True, 'bear_use_ema': True, 'bear_use_atr': True, 'bear_use_adx': False, 'bear_use_spike': False, 'bear_rsi_required': False, 'sideways_strategy': 'breakout', 'sideways_bb_std_mult': 3.157759696382586, 'sideways_rsi_os': 43, 'sideways_rsi_ob': 74, 'sideways_adx_thresh': 16.462046024587448, 'sideways_atr_min_pct': 0.007455305521275887, 'sideways_atr_max_pct': 0.08982025470500477, 'sideways_tp_mult': 1.6359871389339347, 'sideways_tsl_mult': 0.08744294577026392, 'sideways_time_stop': 174, 'sideways_use_sma': True, 'sideways_use_ema': False, 'sideways_use_atr': False, 'sideways_use_adx': True, 'sideways_use_spike': True, 'sideways_rsi_required': True}.
[I 2025-08-30 14:53:09,645] Trial 269 finished with values: [-1000000000.0, 1000000000.0] and parameters: {'p_sma': 33, 'p_std': 31, 'p_atr': 30, 'p_adx': 19, 'rsi_period': 46, 'ema1': 9, 'ema2': 45, 'slip_atr_k': 0.20890879546512495, 'slip_spread_k': 0.25691048620375073, 'spread_hl_frac': 0.04518168087756331, 'bb_std_mult': 1.832562914726964, 'rsi_os': 16, 'rsi_ob': 88, 'vol_spike': 0.23929178984627023, 'adx_thresh': 22.954906062356876, 'atr_min_pct': 0.01890889031427305, 'atr_max_pct': 0.015540548868862983, 'tp_mult': 1.3649067507934962, 'tsl_mult': 0.9173890235757085, 'strategy': 'mean_reversion', 'time_stop': 159, 'use_sma': True, 'use_atr': False, 'use_adx': False, 'use_ema': False, 'use_spike': True, 'rsi_required': False, 'edge_k': 1.7662229794740325, 'edge_cap': 0.6258161962399813, 'bull_strategy': 'breakout', 'bull_bb_std_mult': 3.279575752143543, 'bull_rsi_os': 13, 'bull_rsi_ob': 73, 'bull_adx_thresh': 12.19973001422876, 'bull_atr_min_pct': 0.026628924864406708, 'bull_atr_max_pct': 0.124200581573875, 'bull_tp_mult': 1.3975984348727597, 'bull_tsl_mult': 0.5837101143660712, 'bull_time_stop': 183, 'bull_use_sma': False, 'bull_use_ema': False, 'bull_use_atr': False, 'bull_use_adx': True, 'bull_use_spike': False, 'bull_rsi_required': True, 'bear_strategy': 'breakout', 'bear_bb_std_mult': 1.1818618293389214, 'bear_rsi_os': 21, 'bear_rsi_ob': 50, 'bear_adx_thresh': 18.096799739954413, 'bear_atr_min_pct': 0.0107427028384538, 'bear_atr_max_pct': 0.07170854266510242, 'bear_tp_mult': 1.8173145170005256, 'bear_tsl_mult': 0.43115576364244773, 'bear_time_stop': 43, 'bear_use_sma': False, 'bear_use_ema': False, 'bear_use_atr': True, 'bear_use_adx': False, 'bear_use_spike': True, 'bear_rsi_required': False, 'sideways_strategy': 'breakout', 'sideways_bb_std_mult': 0.752452799077888, 'sideways_rsi_os': 31, 'sideways_rsi_ob': 87, 'sideways_adx_thresh': 16.212340155893198, 'sideways_atr_min_pct': 0.003826013900449508, 'sideways_atr_max_pct': 0.11051158661879969, 'sideways_tp_mult': 2.8022006759873728, 'sideways_tsl_mult': 0.07838843138067453, 'sideways_time_stop': 178, 'sideways_use_sma': False, 'sideways_use_ema': True, 'sideways_use_atr': False, 'sideways_use_adx': True, 'sideways_use_spike': True, 'sideways_rsi_required': True}.
[I 2025-08-30 14:53:10,193] Trial 271 finished with values: [-1000000000.0, 1000000000.0] and parameters: {'p_sma': 31, 'p_std': 30, 'p_atr': 13, 'p_adx': 23, 'rsi_period': 39, 'ema1': 12, 'ema2': 58, 'slip_atr_k': 0.019199415483732933, 'slip_spread_k': 0.23553598948212362, 'spread_hl_frac': 0.03487264636463164, 'bb_std_mult': 0.898146778242521, 'rsi_os': 20, 'rsi_ob': 49, 'vol_spike': 0.01705541870851604, 'adx_thresh': 31.82159958362357, 'atr_min_pct': 0.0228465958905869, 'atr_max_pct': 0.09654192077042775, 'tp_mult': 2.5401876761164472, 'tsl_mult': 0.3113770185362772, 'strategy': 'mean_reversion', 'time_stop': 198, 'use_sma': True, 'use_atr': True, 'use_adx': False, 'use_ema': True, 'use_spike': False, 'rsi_required': False, 'edge_k': 1.5386343405237521, 'edge_cap': 0.45132244023949136, 'bull_strategy': 'breakout', 'bull_bb_std_mult': 3.3518420038519436, 'bull_rsi_os': 15, 'bull_rsi_ob': 76, 'bull_adx_thresh': 24.581376680221858, 'bull_atr_min_pct': 0.003877018347627118, 'bull_atr_max_pct': 0.023235661897866043, 'bull_tp_mult': 1.21493416265715, 'bull_tsl_mult': 0.8169355779973575, 'bull_time_stop': 278, 'bull_use_sma': False, 'bull_use_ema': False, 'bull_use_atr': True, 'bull_use_adx': True, 'bull_use_spike': False, 'bull_rsi_required': True, 'bear_strategy': 'breakout', 'bear_bb_std_mult': 1.1688982666388912, 'bear_rsi_os': 16, 'bear_rsi_ob': 60, 'bear_adx_thresh': 16.193379773777437, 'bear_atr_min_pct': 0.011713677917843375, 'bear_atr_max_pct': 0.012090800723507072, 'bear_tp_mult': 1.9786587751553235, 'bear_tsl_mult': 0.34587161304859215, 'bear_time_stop': 43, 'bear_use_sma': False, 'bear_use_ema': False, 'bear_use_atr': False, 'bear_use_adx': False, 'bear_use_spike': True, 'bear_rsi_required': True, 'sideways_strategy': 'breakout', 'sideways_bb_std_mult': 2.611576815184856, 'sideways_rsi_os': 33, 'sideways_rsi_ob': 50, 'sideways_adx_thresh': 16.180399418539654, 'sideways_atr_min_pct': 0.003979427371980287, 'sideways_atr_max_pct': 0.04231023917060569, 'sideways_tp_mult': 1.8935898405823108, 'sideways_tsl_mult': 0.14797941578310528, 'sideways_time_stop': 232, 'sideways_use_sma': False, 'sideways_use_ema': True, 'sideways_use_atr': False, 'sideways_use_adx': True, 'sideways_use_spike': False, 'sideways_rsi_required': True}.
[I 2025-08-30 14:53:40,917] Trial 270 finished with values: [-1000000000.0, 1000000000.0] and parameters: {'p_sma': 50, 'p_std': 31, 'p_atr': 13, 'p_adx': 21, 'rsi_period': 45, 'ema1': 17, 'ema2': 44, 'slip_atr_k': 0.020345518844874948, 'slip_spread_k': 0.26129357378628015, 'spread_hl_frac': 0.0033029044432348223, 'bb_std_mult': 2.139083989327152, 'rsi_os': 20, 'rsi_ob': 90, 'vol_spike': 0.23941215921231804, 'adx_thresh': 20.700688158721686, 'atr_min_pct': 0.006975816641489444, 'atr_max_pct': 0.11020689743396528, 'tp_mult': 2.571842691859773, 'tsl_mult': 0.2834218196970305, 'strategy': 'mean_reversion', 'time_stop': 190, 'use_sma': True, 'use_atr': True, 'use_adx': False, 'use_ema': True, 'use_spike': False, 'rsi_required': False, 'edge_k': 1.7717373999025976, 'edge_cap': 0.3367366243198946, 'bull_strategy': 'breakout', 'bull_bb_std_mult': 3.2778750199660442, 'bull_rsi_os': 13, 'bull_rsi_ob': 74, 'bull_adx_thresh': 12.234697499178905, 'bull_atr_min_pct': 0.026949135767452975, 'bull_atr_max_pct': 0.022435649729452382, 'bull_tp_mult': 1.4458590877793362, 'bull_tsl_mult': 0.5740558499864717, 'bull_time_stop': 282, 'bull_use_sma': False, 'bull_use_ema': False, 'bull_use_atr': True, 'bull_use_adx': True, 'bull_use_spike': False, 'bull_rsi_required': True, 'bear_strategy': 'breakout', 'bear_bb_std_mult': 1.1831128453803996, 'bear_rsi_os': 45, 'bear_rsi_ob': 74, 'bear_adx_thresh': 18.174388890149665, 'bear_atr_min_pct': 0.02599301148280059, 'bear_atr_max_pct': 0.13514216307946852, 'bear_tp_mult': 2.3216927484130023, 'bear_tsl_mult': 0.15358765767844074, 'bear_time_stop': 243, 'bear_use_sma': False, 'bear_use_ema': False, 'bear_use_atr': False, 'bear_use_adx': False, 'bear_use_spike': True, 'bear_rsi_required': False, 'sideways_strategy': 'breakout', 'sideways_bb_std_mult': 2.353417249739669, 'sideways_rsi_os': 31, 'sideways_rsi_ob': 87, 'sideways_adx_thresh': 16.61566988971527, 'sideways_atr_min_pct': 0.004032423596959256, 'sideways_atr_max_pct': 0.07414809760796728, 'sideways_tp_mult': 2.90136438806034, 'sideways_tsl_mult': 0.15123921135114943, 'sideways_time_stop': 134, 'sideways_use_sma': False, 'sideways_use_ema': True, 'sideways_use_atr': False, 'sideways_use_adx': True, 'sideways_use_spike': True, 'sideways_rsi_required': True}.
