[I 2025-08-30 15:30:58,684] Trial 477 finished with values: [-1000000000.0, 1000000000.0] and parameters: {'p_sma': 57, 'p_std': 22, 'p_atr': 16, 'p_adx': 25, 'rsi_period': 78, 'ema1': 30, 'ema2': 34, 'slip_atr_k': 0.06487248322171307, 'slip_spread_k': 0.7155726903242723, 'spread_hl_frac': 0.028404414757360996, 'bb_std_mult': 1.0565307026298165, 'rsi_os': 10, 'rsi_ob': 69, 'vol_spike': 0.17770950508726488, 'adx_thresh': 12.61472356553887, 'atr_min_pct': 0.007884740704477741, 'atr_max_pct': 0.08191061370449094, 'tp_mult': 1.884834140045244, 'tsl_mult': 0.7148595015860378, 'strategy': 'breakout', 'time_stop': 141, 'use_sma': False, 'use_atr': True, 'use_adx': False, 'use_ema': True, 'use_spike': True, 'rsi_required': True, 'edge_k': 0.213044090509492, 'edge_cap': 0.5412349446344729, 'bull_strategy': 'mean_reversion', 'bull_bb_std_mult': 2.704895134762174, 'bull_rsi_os': 40, 'bull_rsi_ob': 50, 'bull_adx_thresh': 22.16412116080555, 'bull_atr_min_pct': 0.022853623831187407, 'bull_atr_max_pct': 0.069437897196321, 'bull_tp_mult': 2.105698212534383, 'bull_tsl_mult': 0.2776049624215675, 'bull_time_stop': 197, 'bull_use_sma': True, 'bull_use_ema': True, 'bull_use_atr': False, 'bull_use_adx': False, 'bull_use_spike': True, 'bull_rsi_required': False, 'bear_strategy': 'mean_reversion', 'bear_bb_std_mult': 0.6799465211708158, 'bear_rsi_os': 30, 'bear_rsi_ob': 75, 'bear_adx_thresh': 6.8256509058213375, 'bear_atr_min_pct': 0.004377953642270185, 'bear_atr_max_pct': 0.06487762004972111, 'bear_tp_mult': 1.5694732361513224, 'bear_tsl_mult': 0.9642823668667623, 'bear_time_stop': 256, 'bear_use_sma': True, 'bear_use_ema': True, 'bear_use_atr': True, 'bear_use_adx': True, 'bear_use_spike': False, 'bear_rsi_required': True, 'sideways_strategy': 'breakout', 'sideways_bb_std_mult': 1.6384607797765054, 'sideways_rsi_os': 15, 'sideways_rsi_ob': 77, 'sideways_adx_thresh': 20.684680721521325, 'sideways_atr_min_pct': 0.000554709926074113, 'sideways_atr_max_pct': 0.06346049947629165, 'sideways_tp_mult': 2.048668363551286, 'sideways_tsl_mult': 0.9836544538338938, 'sideways_time_stop': 89, 'sideways_use_sma': True, 'sideways_use_ema': True, 'sideways_use_atr': True, 'sideways_use_adx': False, 'sideways_use_spike': True, 'sideways_rsi_required': False}.
[I 2025-08-30 15:30:59,710] Trial 481 finished with values: [-1000000000.0, 1000000000.0] and parameters: {'p_sma': 5, 'p_std': 36, 'p_atr': 10, 'p_adx': 25, 'rsi_period': 78, 'ema1': 18, 'ema2': 32, 'slip_atr_k': 0.24575369496342409, 'slip_spread_k': 0.1259064368425647, 'spread_hl_frac': 0.027329630799331713, 'bb_std_mult': 0.8967592040399623, 'rsi_os': 28, 'rsi_ob': 58, 'vol_spike': 0.02204150869106908, 'adx_thresh': 13.798463243274888, 'atr_min_pct': 0.027675530090324505, 'atr_max_pct': 0.011258190124894402, 'tp_mult': 1.7747490228731464, 'tsl_mult': 0.749327326148175, 'strategy': 'breakout', 'time_stop': 129, 'use_sma': False, 'use_atr': True, 'use_adx': False, 'use_ema': True, 'use_spike': True, 'rsi_required': True, 'edge_k': 0.09257908159529148, 'edge_cap': 0.5784586890562647, 'bull_strategy': 'mean_reversion', 'bull_bb_std_mult': 2.539808826965928, 'bull_rsi_os': 38, 'bull_rsi_ob': 51, 'bull_adx_thresh': 27.027041565505446, 'bull_atr_min_pct': 0.020486266438797217, 'bull_atr_max_pct': 0.061670425142956176, 'bull_tp_mult': 2.006591252708983, 'bull_tsl_mult': 0.32964339485954075, 'bull_time_stop': 142, 'bull_use_sma': False, 'bull_use_ema': False, 'bull_use_atr': False, 'bull_use_adx': False, 'bull_use_spike': True, 'bull_rsi_required': False, 'bear_strategy': 'mean_reversion', 'bear_bb_std_mult': 0.7997791804009297, 'bear_rsi_os': 42, 'bear_rsi_ob': 77, 'bear_adx_thresh': 29.19685078009851, 'bear_atr_min_pct': 0.02292913163537743, 'bear_atr_max_pct': 0.08114747388823162, 'bear_tp_mult': 2.270439186891704, 'bear_tsl_mult': 0.9941972903504984, 'bear_time_stop': 69, 'bear_use_sma': True, 'bear_use_ema': True, 'bear_use_atr': True, 'bear_use_adx': False, 'bear_use_spike': False, 'bear_rsi_required': True, 'sideways_strategy': 'mean_reversion', 'sideways_bb_std_mult': 1.991128343687437, 'sideways_rsi_os': 43, 'sideways_rsi_ob': 74, 'sideways_adx_thresh': 12.508915083730326, 'sideways_atr_min_pct': 0.027580853973317568, 'sideways_atr_max_pct': 0.09893355037667664, 'sideways_tp_mult': 2.463222435782514, 'sideways_tsl_mult': 0.9268140113470725, 'sideways_time_stop': 98, 'sideways_use_sma': True, 'sideways_use_ema': True, 'sideways_use_atr': True, 'sideways_use_adx': False, 'sideways_use_spike': True, 'sideways_rsi_required': False}.
[I 2025-08-30 15:31:51,799] Trial 480 finished with values: [-1000000000.0, 1000000000.0] and parameters: {'p_sma': 27, 'p_std': 59, 'p_atr': 10, 'p_adx': 25, 'rsi_period': 78, 'ema1': 18, 'ema2': 32, 'slip_atr_k': 0.24545455661106585, 'slip_spread_k': 0.05548785729680153, 'spread_hl_frac': 0.023153113191670256, 'bb_std_mult': 1.4532132124196449, 'rsi_os': 28, 'rsi_ob': 78, 'vol_spike': 0.06695476166085178, 'adx_thresh': 13.838451748034162, 'atr_min_pct': 0.010415121153644666, 'atr_max_pct': 0.07814234771096039, 'tp_mult': 1.7803147092957978, 'tsl_mult': 0.7520555996095611, 'strategy': 'breakout', 'time_stop': 119, 'use_sma': False, 'use_atr': True, 'use_adx': False, 'use_ema': True, 'use_spike': True, 'rsi_required': True, 'edge_k': 0.10264232386097179, 'edge_cap': 0.11378905153832752, 'bull_strategy': 'mean_reversion', 'bull_bb_std_mult': 0.943055339649197, 'bull_rsi_os': 38, 'bull_rsi_ob': 53, 'bull_adx_thresh': 9.957980214323376, 'bull_atr_min_pct': 0.02040625514682973, 'bull_atr_max_pct': 0.06222976162546717, 'bull_tp_mult': 2.0060311169733067, 'bull_tsl_mult': 0.32017240280809695, 'bull_time_stop': 173, 'bull_use_sma': False, 'bull_use_ema': False, 'bull_use_atr': False, 'bull_use_adx': False, 'bull_use_spike': True, 'bull_rsi_required': False, 'bear_strategy': 'mean_reversion', 'bear_bb_std_mult': 0.8030059546064265, 'bear_rsi_os': 28, 'bear_rsi_ob': 77, 'bear_adx_thresh': 29.409978611970416, 'bear_atr_min_pct': 0.0229339866546849, 'bear_atr_max_pct': 0.07908221494964188, 'bear_tp_mult': 1.5439552073164893, 'bear_tsl_mult': 0.993139285856661, 'bear_time_stop': 74, 'bear_use_sma': True, 'bear_use_ema': True, 'bear_use_atr': True, 'bear_use_adx': False, 'bear_use_spike': False, 'bear_rsi_required': True, 'sideways_strategy': 'mean_reversion', 'sideways_bb_std_mult': 2.685146860794979, 'sideways_rsi_os': 43, 'sideways_rsi_ob': 74, 'sideways_adx_thresh': 28.74800054113627, 'sideways_atr_min_pct': 0.017255666265044572, 'sideways_atr_max_pct': 0.09868780090515726, 'sideways_tp_mult': 2.9704103918620115, 'sideways_tsl_mult': 0.9333781312031177, 'sideways_time_stop': 258, 'sideways_use_sma': True, 'sideways_use_ema': True, 'sideways_use_atr': True, 'sideways_use_adx': False, 'sideways_use_spike': True, 'sideways_rsi_required': False}.
[I 2025-08-30 15:31:52,853] Trial 482 finished with values: [-0.019563429715019454, 0.019448769458211647] and parameters: {'p_sma': 7, 'p_std': 58, 'p_atr': 14, 'p_adx': 26, 'rsi_period': 26, 'ema1': 11, 'ema2': 32, 'slip_atr_k': 0.22694622718101193, 'slip_spread_k': 0.10496664751909608, 'spread_hl_frac': 0.024181473036884858, 'bb_std_mult': 1.1251899166741632, 'rsi_os': 26, 'rsi_ob': 72, 'vol_spike': 0.06785038099507018, 'adx_thresh': 12.282855631646655, 'atr_min_pct': 0.02590987108652399, 'atr_max_pct': 0.026886048401010075, 'tp_mult': 1.81916138144929, 'tsl_mult': 0.7325687860493656, 'strategy': 'breakout', 'time_stop': 260, 'use_sma': False, 'use_atr': True, 'use_adx': False, 'use_ema': True, 'use_spike': True, 'rsi_required': True, 'edge_k': 0.20475095711795102, 'edge_cap': 0.586323417743946, 'bull_strategy': 'mean_reversion', 'bull_bb_std_mult': 1.5506838686902182, 'bull_rsi_os': 51, 'bull_rsi_ob': 48, 'bull_adx_thresh': 21.94126144525623, 'bull_atr_min_pct': 0.019721269809794544, 'bull_atr_max_pct': 0.06606138638539184, 'bull_tp_mult': 2.1990038485561385, 'bull_tsl_mult': 0.31578645570549413, 'bull_time_stop': 190, 'bull_use_sma': False, 'bull_use_ema': False, 'bull_use_atr': False, 'bull_use_adx': False, 'bull_use_spike': True, 'bull_rsi_required': False, 'bear_strategy': 'mean_reversion', 'bear_bb_std_mult': 0.5978135512875504, 'bear_rsi_os': 21, 'bear_rsi_ob': 72, 'bear_adx_thresh': 27.86931412005424, 'bear_atr_min_pct': 0.020147672241917165, 'bear_atr_max_pct': 0.11796327639007463, 'bear_tp_mult': 2.541172800079382, 'bear_tsl_mult': 0.9997959811778537, 'bear_time_stop': 300, 'bear_use_sma': True, 'bear_use_ema': True, 'bear_use_atr': True, 'bear_use_adx': False, 'bear_use_spike': False, 'bear_rsi_required': True, 'sideways_strategy': 'breakout', 'sideways_bb_std_mult': 2.2647082488655923, 'sideways_rsi_os': 45, 'sideways_rsi_ob': 65, 'sideways_adx_thresh': 23.206857998851454, 'sideways_atr_min_pct': 0.0018291562722926574, 'sideways_atr_max_pct': 0.01660113187025626, 'sideways_tp_mult': 1.5925506210218687, 'sideways_tsl_mult': 0.9700304128926873, 'sideways_time_stop': 191, 'sideways_use_sma': True, 'sideways_use_ema': True, 'sideways_use_atr': True, 'sideways_use_adx': False, 'sideways_use_spike': True, 'sideways_rsi_required': False}.
[I 2025-08-30 15:31:53,177] Trial 479 finished with values: [-1000000000.0, 1000000000.0] and parameters: {'p_sma': 24, 'p_std': 59, 'p_atr': 14, 'p_adx': 10, 'rsi_period': 57, 'ema1': 18, 'ema2': 31, 'slip_atr_k': 0.058786033141859956, 'slip_spread_k': 0.13222228659673785, 'spread_hl_frac': 0.027269717158979013, 'bb_std_mult': 1.1106327050044633, 'rsi_os': 51, 'rsi_ob': 78, 'vol_spike': 0.1643046542647864, 'adx_thresh': 13.729610014595085, 'atr_min_pct': 0.02482723001628121, 'atr_max_pct': 0.07726163010119382, 'tp_mult': 1.7809455346922929, 'tsl_mult': 0.7633687334903567, 'strategy': 'breakout', 'time_stop': 128, 'use_sma': False, 'use_atr': True, 'use_adx': False, 'use_ema': True, 'use_spike': True, 'rsi_required': True, 'edge_k': 0.08248509163071194, 'edge_cap': 0.5800874125455334, 'bull_strategy': 'mean_reversion', 'bull_bb_std_mult': 0.972651718852575, 'bull_rsi_os': 38, 'bull_rsi_ob': 53, 'bull_adx_thresh': 9.96065512061749, 'bull_atr_min_pct': 0.02036440777293897, 'bull_atr_max_pct': 0.06634063727896189, 'bull_tp_mult': 2.8898843172383772, 'bull_tsl_mult': 0.313010380277032, 'bull_time_stop': 175, 'bull_use_sma': False, 'bull_use_ema': False, 'bull_use_atr': False, 'bull_use_adx': False, 'bull_use_spike': True, 'bull_rsi_required': False, 'bear_strategy': 'mean_reversion', 'bear_bb_std_mult': 0.7881286452390333, 'bear_rsi_os': 28, 'bear_rsi_ob': 59, 'bear_adx_thresh': 29.32197454433155, 'bear_atr_min_pct': 0.022958265687078174, 'bear_atr_max_pct': 0.07993252151656685, 'bear_tp_mult': 1.5700588712536951, 'bear_tsl_mult': 0.2992470760629, 'bear_time_stop': 75, 'bear_use_sma': True, 'bear_use_ema': True, 'bear_use_atr': True, 'bear_use_adx': False, 'bear_use_spike': False, 'bear_rsi_required': True, 'sideways_strategy': 'mean_reversion', 'sideways_bb_std_mult': 2.6816621142497485, 'sideways_rsi_os': 43, 'sideways_rsi_ob': 53, 'sideways_adx_thresh': 27.44626097249968, 'sideways_atr_min_pct': 0.001647517704892828, 'sideways_atr_max_pct': 0.09902260674528912, 'sideways_tp_mult': 1.5932691534653798, 'sideways_tsl_mult': 0.9260485508879439, 'sideways_time_stop': 97, 'sideways_use_sma': True, 'sideways_use_ema': True, 'sideways_use_atr': True, 'sideways_use_adx': False, 'sideways_use_spike': True, 'sideways_rsi_required': False}.
[I 2025-08-30 15:31:53,634] Trial 478 finished with values: [-0.05331663998510194, 0.0532476056479945] and parameters: {'p_sma': 7, 'p_std': 24, 'p_atr': 16, 'p_adx': 26, 'rsi_period': 69, 'ema1': 30, 'ema2': 34, 'slip_atr_k': 0.06465357273199776, 'slip_spread_k': 0.05925377658078074, 'spread_hl_frac': 0.015023244371194608, 'bb_std_mult': 1.120293134391494, 'rsi_os': 26, 'rsi_ob': 72, 'vol_spike': 0.19387534555174615, 'adx_thresh': 12.710555100107044, 'atr_min_pct': 0.013936747134956302, 'atr_max_pct': 0.07751294912073009, 'tp_mult': 1.8789702274801303, 'tsl_mult': 0.7174834742602233, 'strategy': 'breakout', 'time_stop': 145, 'use_sma': False, 'use_atr': True, 'use_adx': False, 'use_ema': True, 'use_spike': True, 'rsi_required': True, 'edge_k': 0.20892532639138137, 'edge_cap': 0.5430313390741148, 'bull_strategy': 'mean_reversion', 'bull_bb_std_mult': 2.658126997195038, 'bull_rsi_os': 40, 'bull_rsi_ob': 47, 'bull_adx_thresh': 28.550884773600572, 'bull_atr_min_pct': 0.022945812065212227, 'bull_atr_max_pct': 0.06953846305548589, 'bull_tp_mult': 2.893686044017282, 'bull_tsl_mult': 0.27627004143463824, 'bull_time_stop': 144, 'bull_use_sma': True, 'bull_use_ema': True, 'bull_use_atr': False, 'bull_use_adx': False, 'bull_use_spike': True, 'bull_rsi_required': False, 'bear_strategy': 'mean_reversion', 'bear_bb_std_mult': 0.6588394509101168, 'bear_rsi_os': 28, 'bear_rsi_ob': 79, 'bear_adx_thresh': 29.254335379175345, 'bear_atr_min_pct': 0.004748506802140154, 'bear_atr_max_pct': 0.06690239912519408, 'bear_tp_mult': 1.564218085164082, 'bear_tsl_mult': 0.9671096048295603, 'bear_time_stop': 75, 'bear_use_sma': True, 'bear_use_ema': True, 'bear_use_atr': True, 'bear_use_adx': True, 'bear_use_spike': False, 'bear_rsi_required': True, 'sideways_strategy': 'breakout', 'sideways_bb_std_mult': 2.2635194349887007, 'sideways_rsi_os': 45, 'sideways_rsi_ob': 58, 'sideways_adx_thresh': 22.837176313156903, 'sideways_atr_min_pct': 0.0006608400763901862, 'sideways_atr_max_pct': 0.01337692673225968, 'sideways_tp_mult': 2.3926441656752964, 'sideways_tsl_mult': 0.9726505817297765, 'sideways_time_stop': 88, 'sideways_use_sma': True, 'sideways_use_ema': True, 'sideways_use_atr': True, 'sideways_use_adx': False, 'sideways_use_spike': True, 'sideways_rsi_required': False}.
[I 2025-08-30 15:32:44,373] Trial 484 finished with values: [-1000000000.0, 1000000000.0] and parameters: {'p_sma': 60, 'p_std': 57, 'p_atr': 18, 'p_adx': 13, 'rsi_period': 7, 'ema1': 13, 'ema2': 33, 'slip_atr_k': 0.058465977097844145, 'slip_spread_k': 0.1461473389529542, 'spread_hl_frac': 0.025029737103322715, 'bb_std_mult': 1.3364298160194479, 'rsi_os': 25, 'rsi_ob': 71, 'vol_spike': 0.19505827347006488, 'adx_thresh': 13.233345593219164, 'atr_min_pct': 0.014295078618718498, 'atr_max_pct': 0.13249740881304484, 'tp_mult': 2.9453332575526248, 'tsl_mult': 0.7688989650931908, 'strategy': 'breakout', 'time_stop': 128, 'use_sma': False, 'use_atr': True, 'use_adx': False, 'use_ema': True, 'use_spike': True, 'rsi_required': True, 'edge_k': 0.2730222573755259, 'edge_cap': 0.9735412154618017, 'bull_strategy': 'mean_reversion', 'bull_bb_std_mult': 2.66644069741479, 'bull_rsi_os': 42, 'bull_rsi_ob': 51, 'bull_adx_thresh': 20.261787025838686, 'bull_atr_min_pct': 0.018712183045591312, 'bull_atr_max_pct': 0.07166429863583668, 'bull_tp_mult': 2.4389207605565097, 'bull_tsl_mult': 0.285980706032955, 'bull_time_stop': 152, 'bull_use_sma': False, 'bull_use_ema': False, 'bull_use_atr': False, 'bull_use_adx': False, 'bull_use_spike': True, 'bull_rsi_required': False, 'bear_strategy': 'mean_reversion', 'bear_bb_std_mult': 0.7480137164391274, 'bear_rsi_os': 29, 'bear_rsi_ob': 93, 'bear_adx_thresh': 27.115581771844, 'bear_atr_min_pct': 0.02187568121473547, 'bear_atr_max_pct': 0.06844381802937982, 'bear_tp_mult': 1.577250375432533, 'bear_tsl_mult': 0.9677082392689993, 'bear_time_stop': 60, 'bear_use_sma': True, 'bear_use_ema': True, 'bear_use_atr': True, 'bear_use_adx': False, 'bear_use_spike': False, 'bear_rsi_required': True, 'sideways_strategy': 'breakout', 'sideways_bb_std_mult': 1.724802740607673, 'sideways_rsi_os': 42, 'sideways_rsi_ob': 53, 'sideways_adx_thresh': 27.475662532760907, 'sideways_atr_min_pct': 0.009565285981261265, 'sideways_atr_max_pct': 0.02066165203178877, 'sideways_tp_mult': 2.403291745383724, 'sideways_tsl_mult': 0.9736100876659078, 'sideways_time_stop': 289, 'sideways_use_sma': True, 'sideways_use_ema': True, 'sideways_use_atr': True, 'sideways_use_adx': False, 'sideways_use_spike': True, 'sideways_rsi_required': False}.
[I 2025-08-30 15:32:45,268] Trial 483 finished with values: [-1000000000.0, 1000000000.0] and parameters: {'p_sma': 7, 'p_std': 38, 'p_atr': 21, 'p_adx': 26, 'rsi_period': 75, 'ema1': 13, 'ema2': 33, 'slip_atr_k': 0.057529560433460844, 'slip_spread_k': 0.10776241446725872, 'spread_hl_frac': 0.02445794176846343, 'bb_std_mult': 1.1160380121378441, 'rsi_os': 26, 'rsi_ob': 72, 'vol_spike': 0.19531582241161252, 'adx_thresh': 12.346537748720781, 'atr_min_pct': 0.013997954171123317, 'atr_max_pct': 0.09329589635166309, 'tp_mult': 2.950515984399116, 'tsl_mult': 0.7359289559228288, 'strategy': 'breakout', 'time_stop': 243, 'use_sma': False, 'use_atr': True, 'use_adx': False, 'use_ema': True, 'use_spike': True, 'rsi_required': True, 'edge_k': 1.9096634471801777, 'edge_cap': 0.5771172695711619, 'bull_strategy': 'mean_reversion', 'bull_bb_std_mult': 2.6436825460509774, 'bull_rsi_os': 55, 'bull_rsi_ob': 48, 'bull_adx_thresh': 20.191564836672946, 'bull_atr_min_pct': 0.01960098561583529, 'bull_atr_max_pct': 0.06671831491905701, 'bull_tp_mult': 2.2684817086677187, 'bull_tsl_mult': 0.2712324475594672, 'bull_time_stop': 57, 'bull_use_sma': False, 'bull_use_ema': False, 'bull_use_atr': False, 'bull_use_adx': False, 'bull_use_spike': True, 'bull_rsi_required': False, 'bear_strategy': 'mean_reversion', 'bear_bb_std_mult': 0.5880988077470395, 'bear_rsi_os': 29, 'bear_rsi_ob': 88, 'bear_adx_thresh': 27.792398754256673, 'bear_atr_min_pct': 0.005045458006774271, 'bear_atr_max_pct': 0.06980048387293705, 'bear_tp_mult': 1.5821954234273534, 'bear_tsl_mult': 0.9728696207059048, 'bear_time_stop': 59, 'bear_use_sma': True, 'bear_use_ema': True, 'bear_use_atr': True, 'bear_use_adx': False, 'bear_use_spike': False, 'bear_rsi_required': True, 'sideways_strategy': 'breakout', 'sideways_bb_std_mult': 2.5003031973720673, 'sideways_rsi_os': 27, 'sideways_rsi_ob': 58, 'sideways_adx_thresh': 27.46176562333794, 'sideways_atr_min_pct': 0.0017081899731580083, 'sideways_atr_max_pct': 0.020115819392916463, 'sideways_tp_mult': 2.3174746987942054, 'sideways_tsl_mult': 0.9705103525463407, 'sideways_time_stop': 292, 'sideways_use_sma': True, 'sideways_use_ema': True, 'sideways_use_atr': True, 'sideways_use_adx': False, 'sideways_use_spike': True, 'sideways_rsi_required': False}.
[I 2025-08-30 15:32:46,126] Trial 486 finished with values: [-0.08511267647724474, 0.08508733779518395] and parameters: {'p_sma': 51, 'p_std': 57, 'p_atr': 18, 'p_adx': 9, 'rsi_period': 75, 'ema1': 29, 'ema2': 33, 'slip_atr_k': 0.058547221990672194, 'slip_spread_k': 0.14651033955340192, 'spread_hl_frac': 0.025456330985707393, 'bb_std_mult': 1.2343148508849269, 'rsi_os': 25, 'rsi_ob': 74, 'vol_spike': 0.17160128323604423, 'adx_thresh': 13.125748595365712, 'atr_min_pct': 0.014397667720043363, 'atr_max_pct': 0.07419040380486158, 'tp_mult': 2.8245760362271373, 'tsl_mult': 0.7026993862171632, 'strategy': 'breakout', 'time_stop': 278, 'use_sma': False, 'use_atr': True, 'use_adx': True, 'use_ema': True, 'use_spike': True, 'rsi_required': True, 'edge_k': 0.13785332285767676, 'edge_cap': 0.6045093298505144, 'bull_strategy': 'mean_reversion', 'bull_bb_std_mult': 2.4869443948758168, 'bull_rsi_os': 42, 'bull_rsi_ob': 68, 'bull_adx_thresh': 20.30680945071598, 'bull_atr_min_pct': 0.018583215921164006, 'bull_atr_max_pct': 0.14073925868176534, 'bull_tp_mult': 2.2400416118345117, 'bull_tsl_mult': 0.28469882232085475, 'bull_time_stop': 216, 'bull_use_sma': False, 'bull_use_ema': False, 'bull_use_atr': False, 'bull_use_adx': False, 'bull_use_spike': True, 'bull_rsi_required': False, 'bear_strategy': 'mean_reversion', 'bear_bb_std_mult': 0.7371714649228814, 'bear_rsi_os': 27, 'bear_rsi_ob': 87, 'bear_adx_thresh': 15.360306539412537, 'bear_atr_min_pct': 0.021404291866265884, 'bear_atr_max_pct': 0.07516222510723826, 'bear_tp_mult': 1.7642580162500334, 'bear_tsl_mult': 0.9540295184526829, 'bear_time_stop': 62, 'bear_use_sma': True, 'bear_use_ema': True, 'bear_use_atr': True, 'bear_use_adx': False, 'bear_use_spike': False, 'bear_rsi_required': True, 'sideways_strategy': 'breakout', 'sideways_bb_std_mult': 2.4898871484007716, 'sideways_rsi_os': 42, 'sideways_rsi_ob': 60, 'sideways_adx_thresh': 31.672737640726467, 'sideways_atr_min_pct': 1.4586225366190362e-05, 'sideways_atr_max_pct': 0.1102761842762557, 'sideways_tp_mult': 2.3373969586574823, 'sideways_tsl_mult': 0.9993711688332868, 'sideways_time_stop': 75, 'sideways_use_sma': True, 'sideways_use_ema': True, 'sideways_use_atr': True, 'sideways_use_adx': False, 'sideways_use_spike': False, 'sideways_rsi_required': False}.
