[I 2025-08-30 14:55:51,231] Trial 288 finished with values: [-0.027569009908972153, 0.0274757178064677] and parameters: {'p_sma': 15, 'p_std': 50, 'p_atr': 18, 'p_adx': 24, 'rsi_period': 42, 'ema1': 29, 'ema2': 25, 'slip_atr_k': 0.030944210200668985, 'slip_spread_k': 0.5083882506141187, 'spread_hl_frac': 0.0003002519468063938, 'bb_std_mult': 3.281108150676259, 'rsi_os': 10, 'rsi_ob': 95, 'vol_spike': 0.2810826600581554, 'adx_thresh': 27.031038929886705, 'atr_min_pct': 0.01646036719262872, 'atr_max_pct': 0.052058014215038396, 'tp_mult': 2.425439896840037, 'tsl_mult': 0.9117586283498118, 'strategy': 'breakout', 'time_stop': 136, 'use_sma': False, 'use_atr': False, 'use_adx': False, 'use_ema': False, 'use_spike': True, 'rsi_required': True, 'edge_k': 1.1943226647292136, 'edge_cap': 0.585224425391695, 'bull_strategy': 'mean_reversion', 'bull_bb_std_mult': 3.5248602396851325, 'bull_rsi_os': 27, 'bull_rsi_ob': 86, 'bull_adx_thresh': 11.682378788597637, 'bull_atr_min_pct': 0.00646557802674765, 'bull_atr_max_pct': 0.017296102130805218, 'bull_tp_mult': 1.504966973843791, 'bull_tsl_mult': 0.7057462180394042, 'bull_time_stop': 101, 'bull_use_sma': False, 'bull_use_ema': False, 'bull_use_atr': False, 'bull_use_adx': True, 'bull_use_spike': False, 'bull_rsi_required': True, 'bear_strategy': 'mean_reversion', 'bear_bb_std_mult': 0.9672091083921134, 'bear_rsi_os': 11, 'bear_rsi_ob': 72, 'bear_adx_thresh': 33.359042098681854, 'bear_atr_min_pct': 0.012964481093736565, 'bear_atr_max_pct': 0.015119495612759487, 'bear_tp_mult': 1.220665417288042, 'bear_tsl_mult': 0.029636185866591856, 'bear_time_stop': 62, 'bear_use_sma': False, 'bear_use_ema': True, 'bear_use_atr': True, 'bear_use_adx': False, 'bear_use_spike': False, 'bear_rsi_required': False, 'sideways_strategy': 'breakout', 'sideways_bb_std_mult': 3.4324346549232576, 'sideways_rsi_os': 37, 'sideways_rsi_ob': 91, 'sideways_adx_thresh': 17.58111516374204, 'sideways_atr_min_pct': 0.001148996548001623, 'sideways_atr_max_pct': 0.08812355173220414, 'sideways_tp_mult': 2.158532979022291, 'sideways_tsl_mult': 0.482937421022519, 'sideways_time_stop': 23, 'sideways_use_sma': False, 'sideways_use_ema': True, 'sideways_use_atr': True, 'sideways_use_adx': False, 'sideways_use_spike': False, 'sideways_rsi_required': False}.
[I 2025-08-30 14:55:51,246] Trial 287 finished with values: [-0.032251333810023985, 0.03215492248037692] and parameters: {'p_sma': 15, 'p_std': 50, 'p_atr': 13, 'p_adx': 24, 'rsi_period': 43, 'ema1': 29, 'ema2': 22, 'slip_atr_k': 0.03279106699531016, 'slip_spread_k': 0.45904016994594954, 'spread_hl_frac': 0.00028772575894234014, 'bb_std_mult': 3.3034454002845943, 'rsi_os': 33, 'rsi_ob': 95, 'vol_spike': 0.2800146691290811, 'adx_thresh': 26.892624719255437, 'atr_min_pct': 0.016614622733714543, 'atr_max_pct': 0.05219705100029697, 'tp_mult': 2.4140938256071927, 'tsl_mult': 0.9128186166129498, 'strategy': 'breakout', 'time_stop': 139, 'use_sma': False, 'use_atr': False, 'use_adx': False, 'use_ema': False, 'use_spike': True, 'rsi_required': True, 'edge_k': 1.239702639459934, 'edge_cap': 0.5878679620341565, 'bull_strategy': 'mean_reversion', 'bull_bb_std_mult': 3.4607192953107515, 'bull_rsi_os': 26, 'bull_rsi_ob': 86, 'bull_adx_thresh': 10.747742055620524, 'bull_atr_min_pct': 0.005790983903085224, 'bull_atr_max_pct': 0.018009194474667835, 'bull_tp_mult': 1.5352164204427243, 'bull_tsl_mult': 0.7071869663430186, 'bull_time_stop': 82, 'bull_use_sma': False, 'bull_use_ema': False, 'bull_use_atr': False, 'bull_use_adx': True, 'bull_use_spike': False, 'bull_rsi_required': True, 'bear_strategy': 'mean_reversion', 'bear_bb_std_mult': 0.9904983030875618, 'bear_rsi_os': 11, 'bear_rsi_ob': 72, 'bear_adx_thresh': 33.60208082118892, 'bear_atr_min_pct': 0.013089373136611886, 'bear_atr_max_pct': 0.01503643260468431, 'bear_tp_mult': 1.2130919596905982, 'bear_tsl_mult': 0.03782806006442507, 'bear_time_stop': 67, 'bear_use_sma': False, 'bear_use_ema': True, 'bear_use_atr': True, 'bear_use_adx': False, 'bear_use_spike': False, 'bear_rsi_required': False, 'sideways_strategy': 'breakout', 'sideways_bb_std_mult': 3.413267640163398, 'sideways_rsi_os': 38, 'sideways_rsi_ob': 92, 'sideways_adx_thresh': 17.646598575700203, 'sideways_atr_min_pct': 0.0013457996783717851, 'sideways_atr_max_pct': 0.08916150104725827, 'sideways_tp_mult': 2.1537933281188186, 'sideways_tsl_mult': 0.3839722523394039, 'sideways_time_stop': 17, 'sideways_use_sma': False, 'sideways_use_ema': True, 'sideways_use_atr': True, 'sideways_use_adx': False, 'sideways_use_spike': False, 'sideways_rsi_required': False}.
[I 2025-08-30 14:56:22,730] Trial 291 finished with values: [-0.045606074648259165, 0.04553801552818209] and parameters: {'p_sma': 17, 'p_std': 56, 'p_atr': 13, 'p_adx': 24, 'rsi_period': 43, 'ema1': 29, 'ema2': 21, 'slip_atr_k': 0.027099582534673747, 'slip_spread_k': 0.6041979237430213, 'spread_hl_frac': 0.0005391101804997946, 'bb_std_mult': 3.3111540089260183, 'rsi_os': 31, 'rsi_ob': 95, 'vol_spike': 0.28577296469745284, 'adx_thresh': 25.461499842161935, 'atr_min_pct': 0.01684972562562726, 'atr_max_pct': 0.04936737303531763, 'tp_mult': 2.444965299303372, 'tsl_mult': 0.9040024413603054, 'strategy': 'breakout', 'time_stop': 135, 'use_sma': False, 'use_atr': False, 'use_adx': True, 'use_ema': False, 'use_spike': True, 'rsi_required': True, 'edge_k': 1.1213346013191408, 'edge_cap': 0.6022092405374155, 'bull_strategy': 'mean_reversion', 'bull_bb_std_mult': 3.393893700848272, 'bull_rsi_os': 27, 'bull_rsi_ob': 87, 'bull_adx_thresh': 12.846615816030065, 'bull_atr_min_pct': 0.007518309887753214, 'bull_atr_max_pct': 0.010065542899396552, 'bull_tp_mult': 1.6238005384731682, 'bull_tsl_mult': 0.664476542984133, 'bull_time_stop': 107, 'bull_use_sma': False, 'bull_use_ema': False, 'bull_use_atr': False, 'bull_use_adx': True, 'bull_use_spike': False, 'bull_rsi_required': True, 'bear_strategy': 'mean_reversion', 'bear_bb_std_mult': 0.9095904993736372, 'bear_rsi_os': 12, 'bear_rsi_ob': 72, 'bear_adx_thresh': 34.37119980144431, 'bear_atr_min_pct': 0.01295154096935487, 'bear_atr_max_pct': 0.0170730936586405, 'bear_tp_mult': 1.2825553315374163, 'bear_tsl_mult': 0.05876650069219997, 'bear_time_stop': 68, 'bear_use_sma': True, 'bear_use_ema': True, 'bear_use_atr': True, 'bear_use_adx': False, 'bear_use_spike': False, 'bear_rsi_required': False, 'sideways_strategy': 'breakout', 'sideways_bb_std_mult': 3.5308300690713974, 'sideways_rsi_os': 37, 'sideways_rsi_ob': 92, 'sideways_adx_thresh': 17.638012744719884, 'sideways_atr_min_pct': 0.0005585151414938775, 'sideways_atr_max_pct': 0.08751784566226428, 'sideways_tp_mult': 2.242513601508267, 'sideways_tsl_mult': 0.3280993879439058, 'sideways_time_stop': 31, 'sideways_use_sma': False, 'sideways_use_ema': False, 'sideways_use_atr': True, 'sideways_use_adx': False, 'sideways_use_spike': True, 'sideways_rsi_required': False}.
[I 2025-08-30 14:56:23,011] Trial 292 finished with values: [-0.026410992398813726, 0.026341820256591694] and parameters: {'p_sma': 17, 'p_std': 56, 'p_atr': 13, 'p_adx': 24, 'rsi_period': 43, 'ema1': 28, 'ema2': 20, 'slip_atr_k': 0.021239328155155543, 'slip_spread_k': 0.5974923911933083, 'spread_hl_frac': 0.0012070938267056612, 'bb_std_mult': 3.4164827305449914, 'rsi_os': 31, 'rsi_ob': 94, 'vol_spike': 0.2871574559394874, 'adx_thresh': 24.875200914780763, 'atr_min_pct': 0.017517205947833528, 'atr_max_pct': 0.04955267663947494, 'tp_mult': 2.4609307126953226, 'tsl_mult': 0.9303456479168896, 'strategy': 'breakout', 'time_stop': 139, 'use_sma': False, 'use_atr': False, 'use_adx': True, 'use_ema': False, 'use_spike': True, 'rsi_required': True, 'edge_k': 1.399878614064274, 'edge_cap': 0.514752458862585, 'bull_strategy': 'mean_reversion', 'bull_bb_std_mult': 3.3814426774119455, 'bull_rsi_os': 23, 'bull_rsi_ob': 88, 'bull_adx_thresh': 12.748395876148223, 'bull_atr_min_pct': 0.008201986492710433, 'bull_atr_max_pct': 0.07912761156567023, 'bull_tp_mult': 1.94824193092632, 'bull_tsl_mult': 0.6724106040368268, 'bull_time_stop': 91, 'bull_use_sma': False, 'bull_use_ema': False, 'bull_use_atr': False, 'bull_use_adx': True, 'bull_use_spike': False, 'bull_rsi_required': True, 'bear_strategy': 'mean_reversion', 'bear_bb_std_mult': 0.8980299862348636, 'bear_rsi_os': 12, 'bear_rsi_ob': 89, 'bear_adx_thresh': 34.342170789146806, 'bear_atr_min_pct': 0.01413183447371016, 'bear_atr_max_pct': 0.01700324889636577, 'bear_tp_mult': 1.285147621574121, 'bear_tsl_mult': 0.05695512411282065, 'bear_time_stop': 70, 'bear_use_sma': True, 'bear_use_ema': True, 'bear_use_atr': True, 'bear_use_adx': False, 'bear_use_spike': False, 'bear_rsi_required': False, 'sideways_strategy': 'breakout', 'sideways_bb_std_mult': 3.4863119551873485, 'sideways_rsi_os': 37, 'sideways_rsi_ob': 93, 'sideways_adx_thresh': 33.29136802179064, 'sideways_atr_min_pct': 0.0006227221507345104, 'sideways_atr_max_pct': 0.09023591030779142, 'sideways_tp_mult': 2.2236122688742697, 'sideways_tsl_mult': 0.31591453274658104, 'sideways_time_stop': 34, 'sideways_use_sma': False, 'sideways_use_ema': False, 'sideways_use_atr': True, 'sideways_use_adx': False, 'sideways_use_spike': True, 'sideways_rsi_required': False}.
[I 2025-08-30 14:56:23,131] Trial 290 finished with values: [-0.04396018217479081, 0.04389171383656446] and parameters: {'p_sma': 15, 'p_std': 48, 'p_atr': 13, 'p_adx': 24, 'rsi_period': 43, 'ema1': 29, 'ema2': 25, 'slip_atr_k': 0.03368523375717258, 'slip_spread_k': 0.45845300025129215, 'spread_hl_frac': 6.318083461839298e-05, 'bb_std_mult': 3.27437074565759, 'rsi_os': 36, 'rsi_ob': 95, 'vol_spike': 0.289271626360812, 'adx_thresh': 25.153334272470545, 'atr_min_pct': 0.01682682475675073, 'atr_max_pct': 0.0506689308658297, 'tp_mult': 2.419284482734178, 'tsl_mult': 0.9349791171979511, 'strategy': 'breakout', 'time_stop': 138, 'use_sma': False, 'use_atr': False, 'use_adx': True, 'use_ema': False, 'use_spike': True, 'rsi_required': True, 'edge_k': 1.1789964856617827, 'edge_cap': 0.6179835603025466, 'bull_strategy': 'mean_reversion', 'bull_bb_std_mult': 3.3973467303867557, 'bull_rsi_os': 24, 'bull_rsi_ob': 86, 'bull_adx_thresh': 11.63002012058245, 'bull_atr_min_pct': 0.0057795156591619445, 'bull_atr_max_pct': 0.012664573766552265, 'bull_tp_mult': 1.6048920305869614, 'bull_tsl_mult': 0.6729833389283635, 'bull_time_stop': 98, 'bull_use_sma': False, 'bull_use_ema': False, 'bull_use_atr': False, 'bull_use_adx': True, 'bull_use_spike': False, 'bull_rsi_required': True, 'bear_strategy': 'mean_reversion', 'bear_bb_std_mult': 0.9634297206250668, 'bear_rsi_os': 10, 'bear_rsi_ob': 71, 'bear_adx_thresh': 33.18454572267288, 'bear_atr_min_pct': 0.012950470196032985, 'bear_atr_max_pct': 0.016205889601606432, 'bear_tp_mult': 1.2857730766894364, 'bear_tsl_mult': 0.06378813838517822, 'bear_time_stop': 68, 'bear_use_sma': True, 'bear_use_ema': True, 'bear_use_atr': True, 'bear_use_adx': False, 'bear_use_spike': False, 'bear_rsi_required': False, 'sideways_strategy': 'breakout', 'sideways_bb_std_mult': 3.462873269891919, 'sideways_rsi_os': 37, 'sideways_rsi_ob': 92, 'sideways_adx_thresh': 17.779552423583368, 'sideways_atr_min_pct': 0.0005191389894884726, 'sideways_atr_max_pct': 0.08779627694584553, 'sideways_tp_mult': 2.2329516876775686, 'sideways_tsl_mult': 0.33054404439343027, 'sideways_time_stop': 36, 'sideways_use_sma': False, 'sideways_use_ema': True, 'sideways_use_atr': True, 'sideways_use_adx': False, 'sideways_use_spike': False, 'sideways_rsi_required': False}.
[I 2025-08-30 14:56:23,251] Trial 293 finished with values: [-1000000000.0, 1000000000.0] and parameters: {'p_sma': 17, 'p_std': 56, 'p_atr': 13, 'p_adx': 24, 'rsi_period': 44, 'ema1': 29, 'ema2': 26, 'slip_atr_k': 0.21638913833788948, 'slip_spread_k': 0.6156899626854156, 'spread_hl_frac': 0.0010479719537954306, 'bb_std_mult': 3.4258829121713577, 'rsi_os': 31, 'rsi_ob': 94, 'vol_spike': 0.29060137271020364, 'adx_thresh': 24.876656637168143, 'atr_min_pct': 0.01756281073297674, 'atr_max_pct': 0.047978879768851665, 'tp_mult': 2.4579086905376077, 'tsl_mult': 0.9278758954396157, 'strategy': 'breakout', 'time_stop': 126, 'use_sma': False, 'use_atr': True, 'use_adx': True, 'use_ema': True, 'use_spike': True, 'rsi_required': True, 'edge_k': 1.4109804581300183, 'edge_cap': 0.9250086067948471, 'bull_strategy': 'mean_reversion', 'bull_bb_std_mult': 3.396548601946073, 'bull_rsi_os': 23, 'bull_rsi_ob': 95, 'bull_adx_thresh': 12.612486938040467, 'bull_atr_min_pct': 0.007555631525487338, 'bull_atr_max_pct': 0.1146808957503663, 'bull_tp_mult': 1.4804391056087904, 'bull_tsl_mult': 0.6699118300753135, 'bull_time_stop': 73, 'bull_use_sma': False, 'bull_use_ema': False, 'bull_use_atr': False, 'bull_use_adx': True, 'bull_use_spike': False, 'bull_rsi_required': True, 'bear_strategy': 'mean_reversion', 'bear_bb_std_mult': 0.8865267796489473, 'bear_rsi_os': 10, 'bear_rsi_ob': 74, 'bear_adx_thresh': 32.59133380713557, 'bear_atr_min_pct': 0.013913212973203084, 'bear_atr_max_pct': 0.017660205097367102, 'bear_tp_mult': 1.2879191490611237, 'bear_tsl_mult': 0.0645021595495303, 'bear_time_stop': 74, 'bear_use_sma': True, 'bear_use_ema': True, 'bear_use_atr': True, 'bear_use_adx': False, 'bear_use_spike': False, 'bear_rsi_required': False, 'sideways_strategy': 'mean_reversion', 'sideways_bb_std_mult': 3.5315269056608622, 'sideways_rsi_os': 36, 'sideways_rsi_ob': 91, 'sideways_adx_thresh': 16.69567446609928, 'sideways_atr_min_pct': 0.000650579864963467, 'sideways_atr_max_pct': 0.09286973048867961, 'sideways_tp_mult': 2.3458710682570247, 'sideways_tsl_mult': 0.3271225158721857, 'sideways_time_stop': 61, 'sideways_use_sma': False, 'sideways_use_ema': False, 'sideways_use_atr': True, 'sideways_use_adx': False, 'sideways_use_spike': True, 'sideways_rsi_required': False}.
[I 2025-08-30 14:56:55,482] Trial 297 finished with values: [-1000000000.0, 1000000000.0] and parameters: {'p_sma': 13, 'p_std': 45, 'p_atr': 12, 'p_adx': 23, 'rsi_period': 41, 'ema1': 29, 'ema2': 29, 'slip_atr_k': 0.23876944648333126, 'slip_spread_k': 0.3944397434722568, 'spread_hl_frac': 0.0009771294681164282, 'bb_std_mult': 3.209405129861212, 'rsi_os': 36, 'rsi_ob': 94, 'vol_spike': 0.2986044875930315, 'adx_thresh': 29.61843381336854, 'atr_min_pct': 0.015912275439513106, 'atr_max_pct': 0.057277291948724905, 'tp_mult': 2.3702564802400037, 'tsl_mult': 0.9409030844833489, 'strategy': 'breakout', 'time_stop': 151, 'use_sma': False, 'use_atr': True, 'use_adx': False, 'use_ema': True, 'use_spike': True, 'rsi_required': True, 'edge_k': 0.9682181946301386, 'edge_cap': 0.48097553713953506, 'bull_strategy': 'mean_reversion', 'bull_bb_std_mult': 1.928355796278941, 'bull_rsi_os': 25, 'bull_rsi_ob': 93, 'bull_adx_thresh': 13.06113375910556, 'bull_atr_min_pct': 0.005340597204136918, 'bull_atr_max_pct': 0.040485819217019145, 'bull_tp_mult': 2.9652853316428898, 'bull_tsl_mult': 0.7316517754200978, 'bull_time_stop': 45, 'bull_use_sma': False, 'bull_use_ema': False, 'bull_use_atr': False, 'bull_use_adx': True, 'bull_use_spike': True, 'bull_rsi_required': True, 'bear_strategy': 'mean_reversion', 'bear_bb_std_mult': 2.9024452202808453, 'bear_rsi_os': 12, 'bear_rsi_ob': 68, 'bear_adx_thresh': 32.625979763827644, 'bear_atr_min_pct': 0.012473181333707015, 'bear_atr_max_pct': 0.018226864383570632, 'bear_tp_mult': 1.1618137487633144, 'bear_tsl_mult': 0.002326206333911951, 'bear_time_stop': 59, 'bear_use_sma': False, 'bear_use_ema': True, 'bear_use_atr': True, 'bear_use_adx': True, 'bear_use_spike': False, 'bear_rsi_required': True, 'sideways_strategy': 'mean_reversion', 'sideways_bb_std_mult': 3.361064843901821, 'sideways_rsi_os': 39, 'sideways_rsi_ob': 90, 'sideways_adx_thresh': 16.829690655632906, 'sideways_atr_min_pct': 0.0020011150831518994, 'sideways_atr_max_pct': 0.0854022861478328, 'sideways_tp_mult': 2.445615221791288, 'sideways_tsl_mult': 0.26651456778570054, 'sideways_time_stop': 7, 'sideways_use_sma': True, 'sideways_use_ema': False, 'sideways_use_atr': True, 'sideways_use_adx': False, 'sideways_use_spike': True, 'sideways_rsi_required': False}.
[I 2025-08-30 14:56:55,838] Trial 295 finished with values: [-1000000000.0, 1000000000.0] and parameters: {'p_sma': 13, 'p_std': 47, 'p_atr': 12, 'p_adx': 23, 'rsi_period': 41, 'ema1': 29, 'ema2': 26, 'slip_atr_k': 0.23701310604727213, 'slip_spread_k': 0.4172375259772017, 'spread_hl_frac': 0.0009335387256084991, 'bb_std_mult': 3.23699887391852, 'rsi_os': 15, 'rsi_ob': 94, 'vol_spike': 0.29332859836154573, 'adx_thresh': 25.92197174874348, 'atr_min_pct': 0.01768333474018094, 'atr_max_pct': 0.056457478714228855, 'tp_mult': 2.3839113273794985, 'tsl_mult': 0.9229432133234149, 'strategy': 'breakout', 'time_stop': 150, 'use_sma': False, 'use_atr': True, 'use_adx': False, 'use_ema': True, 'use_spike': True, 'rsi_required': True, 'edge_k': 0.9722535746314442, 'edge_cap': 0.6544138393250133, 'bull_strategy': 'mean_reversion', 'bull_bb_std_mult': 1.3224195167768116, 'bull_rsi_os': 25, 'bull_rsi_ob': 93, 'bull_adx_thresh': 25.781123723222443, 'bull_atr_min_pct': 0.005776070287860954, 'bull_atr_max_pct': 0.04066185661864676, 'bull_tp_mult': 1.4760792332143762, 'bull_tsl_mult': 0.6873906680953149, 'bull_time_stop': 53, 'bull_use_sma': False, 'bull_use_ema': False, 'bull_use_atr': False, 'bull_use_adx': True, 'bull_use_spike': True, 'bull_rsi_required': True, 'bear_strategy': 'mean_reversion', 'bear_bb_std_mult': 3.527817065097155, 'bear_rsi_os': 12, 'bear_rsi_ob': 94, 'bear_adx_thresh': 32.37427148213035, 'bear_atr_min_pct': 0.01248267297710422, 'bear_atr_max_pct': 0.01236275380298325, 'bear_tp_mult': 1.1635034058191516, 'bear_tsl_mult': 0.08722879798217723, 'bear_time_stop': 57, 'bear_use_sma': False, 'bear_use_ema': True, 'bear_use_atr': True, 'bear_use_adx': False, 'bear_use_spike': False, 'bear_rsi_required': True, 'sideways_strategy': 'mean_reversion', 'sideways_bb_std_mult': 3.5516316334514713, 'sideways_rsi_os': 36, 'sideways_rsi_ob': 90, 'sideways_adx_thresh': 16.83457096786571, 'sideways_atr_min_pct': 0.002041320712060526, 'sideways_atr_max_pct': 0.08751005013972221, 'sideways_tp_mult': 2.3337098652664157, 'sideways_tsl_mult': 0.5506619143393172, 'sideways_time_stop': 5, 'sideways_use_sma': False, 'sideways_use_ema': False, 'sideways_use_atr': True, 'sideways_use_adx': False, 'sideways_use_spike': True, 'sideways_rsi_required': False}.
[I 2025-08-30 14:56:55,838] Trial 294 finished with values: [-1000000000.0, 1000000000.0] and parameters: {'p_sma': 13, 'p_std': 48, 'p_atr': 25, 'p_adx': 24, 'rsi_period': 44, 'ema1': 29, 'ema2': 28, 'slip_atr_k': 0.02100214850846652, 'slip_spread_k': 0.42962452821775154, 'spread_hl_frac': 0.0009138937002211114, 'bb_std_mult': 3.420035477202041, 'rsi_os': 36, 'rsi_ob': 94, 'vol_spike': 0.2906000834256347, 'adx_thresh': 24.871678070740252, 'atr_min_pct': 0.017428013050207008, 'atr_max_pct': 0.057400537347870303, 'tp_mult': 2.4605527711610398, 'tsl_mult': 0.9259574068263583, 'strategy': 'breakout', 'time_stop': 127, 'use_sma': False, 'use_atr': True, 'use_adx': True, 'use_ema': True, 'use_spike': True, 'rsi_required': True, 'edge_k': 1.4108431711663094, 'edge_cap': 0.6651955767476785, 'bull_strategy': 'mean_reversion', 'bull_bb_std_mult': 1.9119799321358084, 'bull_rsi_os': 23, 'bull_rsi_ob': 93, 'bull_adx_thresh': 12.628786622556966, 'bull_atr_min_pct': 0.008753454962793021, 'bull_atr_max_pct': 0.06761760353544681, 'bull_tp_mult': 1.9440013394844138, 'bull_tsl_mult': 0.7318227372268123, 'bull_time_stop': 75, 'bull_use_sma': False, 'bull_use_ema': False, 'bull_use_atr': False, 'bull_use_adx': True, 'bull_use_spike': True, 'bull_rsi_required': True, 'bear_strategy': 'mean_reversion', 'bear_bb_std_mult': 0.898794762140104, 'bear_rsi_os': 12, 'bear_rsi_ob': 83, 'bear_adx_thresh': 32.6503421853635, 'bear_atr_min_pct': 0.013856501037038296, 'bear_atr_max_pct': 0.01763760972586141, 'bear_tp_mult': 1.1615935277330263, 'bear_tsl_mult': 0.07965256795433054, 'bear_time_stop': 73, 'bear_use_sma': True, 'bear_use_ema': True, 'bear_use_atr': True, 'bear_use_adx': False, 'bear_use_spike': False, 'bear_rsi_required': True, 'sideways_strategy': 'mean_reversion', 'sideways_bb_std_mult': 3.5484428815351228, 'sideways_rsi_os': 36, 'sideways_rsi_ob': 90, 'sideways_adx_thresh': 16.931211104306982, 'sideways_atr_min_pct': 0.0021779871509883197, 'sideways_atr_max_pct': 0.08640788475231022, 'sideways_tp_mult': 2.3385747711702325, 'sideways_tsl_mult': 0.2710408541219866, 'sideways_time_stop': 63, 'sideways_use_sma': False, 'sideways_use_ema': False, 'sideways_use_atr': True, 'sideways_use_adx': False, 'sideways_use_spike': True, 'sideways_rsi_required': False}.
