[I 2025-08-30 15:51:34,656] Trial 575 finished with values: [-1000000000.0, 1000000000.0] and parameters: {'p_sma': 6, 'p_std': 39, 'p_atr': 21, 'p_adx': 24, 'rsi_period': 80, 'ema1': 29, 'ema2': 31, 'slip_atr_k': 0.06842144485546478, 'slip_spread_k': 0.3650289626562985, 'spread_hl_frac': 0.029078607322847283, 'bb_std_mult': 1.4616024497984306, 'rsi_os': 14, 'rsi_ob': 76, 'vol_spike': 0.15627072528420033, 'adx_thresh': 11.72719452726778, 'atr_min_pct': 0.01283936892188544, 'atr_max_pct': 0.07881373657396841, 'tp_mult': 1.5069389002492652, 'tsl_mult': 0.7158194815944806, 'strategy': 'breakout', 'time_stop': 272, 'use_sma': False, 'use_atr': True, 'use_adx': False, 'use_ema': True, 'use_spike': True, 'rsi_required': True, 'edge_k': 0.21830590778297757, 'edge_cap': 0.39459197008223235, 'bull_strategy': 'mean_reversion', 'bull_bb_std_mult': 0.9993882992158778, 'bull_rsi_os': 38, 'bull_rsi_ob': 49, 'bull_adx_thresh': 8.65631296967427, 'bull_atr_min_pct': 0.00020534570657933932, 'bull_atr_max_pct': 0.010397651211412534, 'bull_tp_mult': 2.250517327279298, 'bull_tsl_mult': 0.2869172307285889, 'bull_time_stop': 157, 'bull_use_sma': False, 'bull_use_ema': False, 'bull_use_atr': False, 'bull_use_adx': False, 'bull_use_spike': True, 'bull_rsi_required': False, 'bear_strategy': 'mean_reversion', 'bear_bb_std_mult': 0.8175991416657687, 'bear_rsi_os': 30, 'bear_rsi_ob': 79, 'bear_adx_thresh': 14.142983326663956, 'bear_atr_min_pct': 0.009324705864864433, 'bear_atr_max_pct': 0.07808974019618409, 'bear_tp_mult': 2.500278675768736, 'bear_tsl_mult': 0.9699259816438359, 'bear_time_stop': 69, 'bear_use_sma': True, 'bear_use_ema': True, 'bear_use_atr': True, 'bear_use_adx': False, 'bear_use_spike': False, 'bear_rsi_required': True, 'sideways_strategy': 'breakout', 'sideways_bb_std_mult': 2.12862332721044, 'sideways_rsi_os': 10, 'sideways_rsi_ob': 56, 'sideways_adx_thresh': 27.398160941275982, 'sideways_atr_min_pct': 0.0011519653721967565, 'sideways_atr_max_pct': 0.11268407478283068, 'sideways_tp_mult': 2.288890196562451, 'sideways_tsl_mult': 0.7055646532116818, 'sideways_time_stop': 193, 'sideways_use_sma': True, 'sideways_use_ema': True, 'sideways_use_atr': True, 'sideways_use_adx': False, 'sideways_use_spike': False, 'sideways_rsi_required': False}.
[I 2025-08-30 15:51:35,321] Trial 574 finished with values: [-0.02272802237853988, 0.022668370298112958] and parameters: {'p_sma': 7, 'p_std': 25, 'p_atr': 16, 'p_adx': 25, 'rsi_period': 79, 'ema1': 29, 'ema2': 34, 'slip_atr_k': 0.05720364176394686, 'slip_spread_k': 0.09419999593202757, 'spread_hl_frac': 0.01737337412182821, 'bb_std_mult': 1.4714897160355966, 'rsi_os': 27, 'rsi_ob': 60, 'vol_spike': 0.17772666947500573, 'adx_thresh': 6.813959906252373, 'atr_min_pct': 0.014074918012673762, 'atr_max_pct': 0.0874405791484324, 'tp_mult': 1.404506875369699, 'tsl_mult': 0.7268715482790454, 'strategy': 'breakout', 'time_stop': 229, 'use_sma': False, 'use_atr': True, 'use_adx': True, 'use_ema': True, 'use_spike': True, 'rsi_required': True, 'edge_k': 0.22843076261224965, 'edge_cap': 0.9265881281675602, 'bull_strategy': 'mean_reversion', 'bull_bb_std_mult': 2.8135219470314006, 'bull_rsi_os': 39, 'bull_rsi_ob': 46, 'bull_adx_thresh': 8.971057273018936, 'bull_atr_min_pct': 0.021543382159155345, 'bull_atr_max_pct': 0.061814941812849016, 'bull_tp_mult': 2.2620326646410587, 'bull_tsl_mult': 0.2668380551137224, 'bull_time_stop': 155, 'bull_use_sma': False, 'bull_use_ema': False, 'bull_use_atr': False, 'bull_use_adx': False, 'bull_use_spike': True, 'bull_rsi_required': False, 'bear_strategy': 'mean_reversion', 'bear_bb_std_mult': 0.8436347536269486, 'bear_rsi_os': 27, 'bear_rsi_ob': 70, 'bear_adx_thresh': 28.37223013421346, 'bear_atr_min_pct': 0.021857453653405905, 'bear_atr_max_pct': 0.07963128265066612, 'bear_tp_mult': 1.5140464797188613, 'bear_tsl_mult': 0.9006572820742367, 'bear_time_stop': 5, 'bear_use_sma': True, 'bear_use_ema': True, 'bear_use_atr': True, 'bear_use_adx': False, 'bear_use_spike': False, 'bear_rsi_required': True, 'sideways_strategy': 'breakout', 'sideways_bb_std_mult': 2.328401992011744, 'sideways_rsi_os': 43, 'sideways_rsi_ob': 56, 'sideways_adx_thresh': 26.07037267741266, 'sideways_atr_min_pct': 0.0008842406944644301, 'sideways_atr_max_pct': 0.10027028915765218, 'sideways_tp_mult': 1.626072736377119, 'sideways_tsl_mult': 0.9556694712546321, 'sideways_time_stop': 42, 'sideways_use_sma': True, 'sideways_use_ema': True, 'sideways_use_atr': True, 'sideways_use_adx': False, 'sideways_use_spike': True, 'sideways_rsi_required': False}.
[I 2025-08-30 15:52:25,855] Trial 578 finished with values: [-1000000000.0, 0.15036840368515667] and parameters: {'p_sma': 27, 'p_std': 9, 'p_atr': 10, 'p_adx': 27, 'rsi_period': 81, 'ema1': 24, 'ema2': 32, 'slip_atr_k': 0.056349161265611986, 'slip_spread_k': 0.9957906677001105, 'spread_hl_frac': 0.024438993820534792, 'bb_std_mult': 3.088421962118981, 'rsi_os': 52, 'rsi_ob': 62, 'vol_spike': 0.005007592822368928, 'adx_thresh': 6.683963011539465, 'atr_min_pct': 0.003748433863183539, 'atr_max_pct': 0.07017751045303579, 'tp_mult': 2.2518832167086122, 'tsl_mult': 0.7153684984365684, 'strategy': 'breakout', 'time_stop': 5, 'use_sma': False, 'use_atr': True, 'use_adx': False, 'use_ema': True, 'use_spike': True, 'rsi_required': True, 'edge_k': 0.23318753119161245, 'edge_cap': 0.4063127055976328, 'bull_strategy': 'mean_reversion', 'bull_bb_std_mult': 2.607301247888202, 'bull_rsi_os': 21, 'bull_rsi_ob': 73, 'bull_adx_thresh': 17.89783155895396, 'bull_atr_min_pct': 0.0003156046114800252, 'bull_atr_max_pct': 0.06262411075009357, 'bull_tp_mult': 2.1082312371474137, 'bull_tsl_mult': 0.9177384077146309, 'bull_time_stop': 153, 'bull_use_sma': False, 'bull_use_ema': False, 'bull_use_atr': False, 'bull_use_adx': False, 'bull_use_spike': True, 'bull_rsi_required': False, 'bear_strategy': 'mean_reversion', 'bear_bb_std_mult': 2.2471020897369223, 'bear_rsi_os': 30, 'bear_rsi_ob': 86, 'bear_adx_thresh': 29.60968843134266, 'bear_atr_min_pct': 0.009279540085133433, 'bear_atr_max_pct': 0.07732135177910213, 'bear_tp_mult': 2.509581482876096, 'bear_tsl_mult': 0.9994620440096117, 'bear_time_stop': 167, 'bear_use_sma': True, 'bear_use_ema': True, 'bear_use_atr': True, 'bear_use_adx': False, 'bear_use_spike': False, 'bear_rsi_required': True, 'sideways_strategy': 'breakout', 'sideways_bb_std_mult': 1.973164155692292, 'sideways_rsi_os': 45, 'sideways_rsi_ob': 66, 'sideways_adx_thresh': 13.017394223838307, 'sideways_atr_min_pct': 0.0010063206292078436, 'sideways_atr_max_pct': 0.09998344792632084, 'sideways_tp_mult': 2.0921637358445344, 'sideways_tsl_mult': 0.9593612204894335, 'sideways_time_stop': 134, 'sideways_use_sma': True, 'sideways_use_ema': True, 'sideways_use_atr': True, 'sideways_use_adx': False, 'sideways_use_spike': True, 'sideways_rsi_required': False}.
[I 2025-08-30 15:52:26,379] Trial 579 finished with values: [-1000000000.0, 1000000000.0] and parameters: {'p_sma': 5, 'p_std': 19, 'p_atr': 8, 'p_adx': 15, 'rsi_period': 39, 'ema1': 30, 'ema2': 32, 'slip_atr_k': 0.0557650704933088, 'slip_spread_k': 0.15304728000080298, 'spread_hl_frac': 0.024834076161128846, 'bb_std_mult': 0.9266561523791476, 'rsi_os': 25, 'rsi_ob': 75, 'vol_spike': 0.1714434078098397, 'adx_thresh': 14.368337205318099, 'atr_min_pct': 0.014743677917477742, 'atr_max_pct': 0.0705683391729323, 'tp_mult': 2.2670102767591302, 'tsl_mult': 0.8101760400738626, 'strategy': 'breakout', 'time_stop': 128, 'use_sma': False, 'use_atr': True, 'use_adx': False, 'use_ema': True, 'use_spike': True, 'rsi_required': True, 'edge_k': 0.239654855522881, 'edge_cap': 0.25117650678864717, 'bull_strategy': 'mean_reversion', 'bull_bb_std_mult': 2.8324514855905547, 'bull_rsi_os': 36, 'bull_rsi_ob': 82, 'bull_adx_thresh': 17.657657620039807, 'bull_atr_min_pct': 0.02061072814668819, 'bull_atr_max_pct': 0.062424137524617104, 'bull_tp_mult': 2.863798943179561, 'bull_tsl_mult': 0.3589178211640095, 'bull_time_stop': 150, 'bull_use_sma': False, 'bull_use_ema': False, 'bull_use_atr': False, 'bull_use_adx': False, 'bull_use_spike': True, 'bull_rsi_required': False, 'bear_strategy': 'mean_reversion', 'bear_bb_std_mult': 3.0750403667259265, 'bear_rsi_os': 30, 'bear_rsi_ob': 77, 'bear_adx_thresh': 8.872152517294136, 'bear_atr_min_pct': 0.023968182886516785, 'bear_atr_max_pct': 0.0675576953806189, 'bear_tp_mult': 1.5339691421690955, 'bear_tsl_mult': 0.999926839805137, 'bear_time_stop': 131, 'bear_use_sma': True, 'bear_use_ema': True, 'bear_use_atr': True, 'bear_use_adx': False, 'bear_use_spike': False, 'bear_rsi_required': True, 'sideways_strategy': 'breakout', 'sideways_bb_std_mult': 2.118437460946532, 'sideways_rsi_os': 26, 'sideways_rsi_ob': 60, 'sideways_adx_thresh': 20.059190551908966, 'sideways_atr_min_pct': 0.02304030085303257, 'sideways_atr_max_pct': 0.11389723240449486, 'sideways_tp_mult': 2.4053745628219567, 'sideways_tsl_mult': 0.9530174575295369, 'sideways_time_stop': 93, 'sideways_use_sma': True, 'sideways_use_ema': True, 'sideways_use_atr': True, 'sideways_use_adx': False, 'sideways_use_spike': True, 'sideways_rsi_required': False}.
[I 2025-08-30 15:52:26,903] Trial 580 finished with values: [-0.033939153650418996, 0.03390538572814509] and parameters: {'p_sma': 43, 'p_std': 45, 'p_atr': 17, 'p_adx': 27, 'rsi_period': 11, 'ema1': 24, 'ema2': 33, 'slip_atr_k': 0.05264013435113478, 'slip_spread_k': 0.9964048829415002, 'spread_hl_frac': 0.04456051067859562, 'bb_std_mult': 0.9452845782402867, 'rsi_os': 25, 'rsi_ob': 73, 'vol_spike': 0.17190178383594085, 'adx_thresh': 6.935155021738595, 'atr_min_pct': 0.025442235333134687, 'atr_max_pct': 0.08738891818891767, 'tp_mult': 2.2543921640857505, 'tsl_mult': 0.7730455404359147, 'strategy': 'breakout', 'time_stop': 128, 'use_sma': False, 'use_atr': True, 'use_adx': False, 'use_ema': True, 'use_spike': True, 'rsi_required': True, 'edge_k': 0.12600057928700187, 'edge_cap': 0.5941305891833064, 'bull_strategy': 'breakout', 'bull_bb_std_mult': 2.783024453883796, 'bull_rsi_os': 41, 'bull_rsi_ob': 46, 'bull_adx_thresh': 22.43341078489497, 'bull_atr_min_pct': 0.020815831219663503, 'bull_atr_max_pct': 0.06119353581063073, 'bull_tp_mult': 2.098879982768309, 'bull_tsl_mult': 0.36233929857899394, 'bull_time_stop': 150, 'bull_use_sma': False, 'bull_use_ema': False, 'bull_use_atr': False, 'bull_use_adx': False, 'bull_use_spike': True, 'bull_rsi_required': False, 'bear_strategy': 'mean_reversion', 'bear_bb_std_mult': 3.068684951095313, 'bear_rsi_os': 54, 'bear_rsi_ob': 55, 'bear_adx_thresh': 9.06703314732552, 'bear_atr_min_pct': 0.01959699523798656, 'bear_atr_max_pct': 0.14551592335591554, 'bear_tp_mult': 1.5308157946167065, 'bear_tsl_mult': 0.9995347268212551, 'bear_time_stop': 136, 'bear_use_sma': True, 'bear_use_ema': False, 'bear_use_atr': True, 'bear_use_adx': True, 'bear_use_spike': False, 'bear_rsi_required': True, 'sideways_strategy': 'breakout', 'sideways_bb_std_mult': 1.0569810415337322, 'sideways_rsi_os': 41, 'sideways_rsi_ob': 61, 'sideways_adx_thresh': 32.01836375975568, 'sideways_atr_min_pct': 0.0021223879806706735, 'sideways_atr_max_pct': 0.10064979470078671, 'sideways_tp_mult': 1.4163555774160304, 'sideways_tsl_mult': 0.6469042457391603, 'sideways_time_stop': 89, 'sideways_use_sma': True, 'sideways_use_ema': True, 'sideways_use_atr': False, 'sideways_use_adx': True, 'sideways_use_spike': True, 'sideways_rsi_required': False}.
[I 2025-08-30 15:52:27,336] Trial 581 finished with values: [-1000000000.0, 1000000000.0] and parameters: {'p_sma': 43, 'p_std': 59, 'p_atr': 10, 'p_adx': 26, 'rsi_period': 57, 'ema1': 24, 'ema2': 32, 'slip_atr_k': 0.052342757701144646, 'slip_spread_k': 0.7104106346485173, 'spread_hl_frac': 0.02449296457488712, 'bb_std_mult': 0.9323586587529349, 'rsi_os': 52, 'rsi_ob': 50, 'vol_spike': 0.11952525655695023, 'adx_thresh': 14.254397646918166, 'atr_min_pct': 0.028936246662282034, 'atr_max_pct': 0.07130916060445074, 'tp_mult': 1.8500902084718678, 'tsl_mult': 0.6932911237656187, 'strategy': 'breakout', 'time_stop': 127, 'use_sma': False, 'use_atr': True, 'use_adx': False, 'use_ema': True, 'use_spike': True, 'rsi_required': True, 'edge_k': 0.5545874223165291, 'edge_cap': 0.2446120059755038, 'bull_strategy': 'breakout', 'bull_bb_std_mult': 0.5864666258908144, 'bull_rsi_os': 5, 'bull_rsi_ob': 70, 'bull_adx_thresh': 18.042518528690913, 'bull_atr_min_pct': 0.020631944709541498, 'bull_atr_max_pct': 0.05892686016674813, 'bull_tp_mult': 2.104531679218902, 'bull_tsl_mult': 0.7742974487252017, 'bull_time_stop': 150, 'bull_use_sma': True, 'bull_use_ema': True, 'bull_use_atr': True, 'bull_use_adx': False, 'bull_use_spike': True, 'bull_rsi_required': False, 'bear_strategy': 'mean_reversion', 'bear_bb_std_mult': 3.4514734095220456, 'bear_rsi_os': 30, 'bear_rsi_ob': 77, 'bear_adx_thresh': 15.222191554433817, 'bear_atr_min_pct': 0.01961580984576293, 'bear_atr_max_pct': 0.09696052000824996, 'bear_tp_mult': 1.5557087529824896, 'bear_tsl_mult': 0.9428168778351907, 'bear_time_stop': 128, 'bear_use_sma': True, 'bear_use_ema': False, 'bear_use_atr': True, 'bear_use_adx': True, 'bear_use_spike': False, 'bear_rsi_required': True, 'sideways_strategy': 'breakout', 'sideways_bb_std_mult': 1.9935935058509764, 'sideways_rsi_os': 13, 'sideways_rsi_ob': 83, 'sideways_adx_thresh': 8.499825241960254, 'sideways_atr_min_pct': 0.000508225158550453, 'sideways_atr_max_pct': 0.09370674552485102, 'sideways_tp_mult': 2.4121226168735013, 'sideways_tsl_mult': 0.9797028723105217, 'sideways_time_stop': 91, 'sideways_use_sma': True, 'sideways_use_ema': True, 'sideways_use_atr': False, 'sideways_use_adx': True, 'sideways_use_spike': True, 'sideways_rsi_required': False}.
[I 2025-08-30 15:53:14,433] Trial 584 finished with values: [-1000000000.0, 1000000000.0] and parameters: {'p_sma': 56, 'p_std': 57, 'p_atr': 15, 'p_adx': 26, 'rsi_period': 74, 'ema1': 30, 'ema2': 36, 'slip_atr_k': 0.1443994375718775, 'slip_spread_k': 0.05027411330242154, 'spread_hl_frac': 0.026711638522206708, 'bb_std_mult': 0.7979199665311212, 'rsi_os': 44, 'rsi_ob': 69, 'vol_spike': 0.16374748798950334, 'adx_thresh': 12.548606436118844, 'atr_min_pct': 0.013369505724533296, 'atr_max_pct': 0.07310475248841464, 'tp_mult': 1.8628354084052123, 'tsl_mult': 0.6865191366788774, 'strategy': 'breakout', 'time_stop': 115, 'use_sma': False, 'use_atr': True, 'use_adx': False, 'use_ema': True, 'use_spike': True, 'rsi_required': True, 'edge_k': 1.4433496480269288, 'edge_cap': 0.5535235649993082, 'bull_strategy': 'breakout', 'bull_bb_std_mult': 2.522106096044832, 'bull_rsi_os': 44, 'bull_rsi_ob': 71, 'bull_adx_thresh': 23.79138811861116, 'bull_atr_min_pct': 0.026957325404574774, 'bull_atr_max_pct': 0.051505014134248656, 'bull_tp_mult': 2.2118773940230376, 'bull_tsl_mult': 0.30559969427426276, 'bull_time_stop': 171, 'bull_use_sma': True, 'bull_use_ema': True, 'bull_use_atr': True, 'bull_use_adx': True, 'bull_use_spike': True, 'bull_rsi_required': False, 'bear_strategy': 'mean_reversion', 'bear_bb_std_mult': 3.478234361110787, 'bear_rsi_os': 26, 'bear_rsi_ob': 75, 'bear_adx_thresh': 27.263924971048205, 'bear_atr_min_pct': 0.02072918788478066, 'bear_atr_max_pct': 0.05628319398458603, 'bear_tp_mult': 1.4614445598704362, 'bear_tsl_mult': 0.7358031110408652, 'bear_time_stop': 60, 'bear_use_sma': True, 'bear_use_ema': False, 'bear_use_atr': False, 'bear_use_adx': True, 'bear_use_spike': False, 'bear_rsi_required': True, 'sideways_strategy': 'mean_reversion', 'sideways_bb_std_mult': 2.6969571485469332, 'sideways_rsi_os': 43, 'sideways_rsi_ob': 75, 'sideways_adx_thresh': 7.700875577668512, 'sideways_atr_min_pct': 0.026203205592503016, 'sideways_atr_max_pct': 0.10581528153771962, 'sideways_tp_mult': 2.438839170065146, 'sideways_tsl_mult': 0.7306646729462536, 'sideways_time_stop': 269, 'sideways_use_sma': True, 'sideways_use_ema': False, 'sideways_use_atr': False, 'sideways_use_adx': True, 'sideways_use_spike': True, 'sideways_rsi_required': False}.
[I 2025-08-30 15:53:14,897] Trial 585 finished with values: [-1000000000.0, 1000000000.0] and parameters: {'p_sma': 9, 'p_std': 57, 'p_atr': 25, 'p_adx': 26, 'rsi_period': 59, 'ema1': 30, 'ema2': 36, 'slip_atr_k': 0.08327154741027545, 'slip_spread_k': 0.12467833679866233, 'spread_hl_frac': 0.026829594054960337, 'bb_std_mult': 1.05878382996162, 'rsi_os': 22, 'rsi_ob': 85, 'vol_spike': 0.1640128985454069, 'adx_thresh': 23.914262891341767, 'atr_min_pct': 0.01337122785440861, 'atr_max_pct': 0.07363858907660818, 'tp_mult': 1.4661802055316384, 'tsl_mult': 0.7579965950931132, 'strategy': 'breakout', 'time_stop': 115, 'use_sma': False, 'use_atr': True, 'use_adx': False, 'use_ema': True, 'use_spike': False, 'rsi_required': False, 'edge_k': 0.1714751740647778, 'edge_cap': 0.551459628589289, 'bull_strategy': 'mean_reversion', 'bull_bb_std_mult': 2.6794681953321806, 'bull_rsi_os': 39, 'bull_rsi_ob': 49, 'bull_adx_thresh': 29.929358595819377, 'bull_atr_min_pct': 0.02688280949358366, 'bull_atr_max_pct': 0.051314759504828056, 'bull_tp_mult': 2.333696354374208, 'bull_tsl_mult': 0.31701629806749143, 'bull_time_stop': 170, 'bull_use_sma': True, 'bull_use_ema': True, 'bull_use_atr': True, 'bull_use_adx': True, 'bull_use_spike': True, 'bull_rsi_required': False, 'bear_strategy': 'mean_reversion', 'bear_bb_std_mult': 0.7593101192100621, 'bear_rsi_os': 34, 'bear_rsi_ob': 75, 'bear_adx_thresh': 26.876130284026093, 'bear_atr_min_pct': 0.020663312666470268, 'bear_atr_max_pct': 0.05632063601359235, 'bear_tp_mult': 2.9572527655941236, 'bear_tsl_mult': 0.5251712549022958, 'bear_time_stop': 279, 'bear_use_sma': True, 'bear_use_ema': True, 'bear_use_atr': False, 'bear_use_adx': False, 'bear_use_spike': True, 'bear_rsi_required': True, 'sideways_strategy': 'mean_reversion', 'sideways_bb_std_mult': 0.7344934454945473, 'sideways_rsi_os': 42, 'sideways_rsi_ob': 58, 'sideways_adx_thresh': 23.16869653470843, 'sideways_atr_min_pct': 0.020559834965849167, 'sideways_atr_max_pct': 0.1051031406589416, 'sideways_tp_mult': 2.4318416075152203, 'sideways_tsl_mult': 0.9783441232098137, 'sideways_time_stop': 74, 'sideways_use_sma': True, 'sideways_use_ema': False, 'sideways_use_atr': True, 'sideways_use_adx': False, 'sideways_use_spike': True, 'sideways_rsi_required': True}.
[I 2025-08-30 15:53:16,161] Trial 583 finished with values: [-1000000000.0, 1000000000.0] and parameters: {'p_sma': 8, 'p_std': 47, 'p_atr': 17, 'p_adx': 26, 'rsi_period': 57, 'ema1': 30, 'ema2': 36, 'slip_atr_k': 0.0682582480741875, 'slip_spread_k': 0.03188958564934957, 'spread_hl_frac': 0.026947602411401917, 'bb_std_mult': 1.0569912499475018, 'rsi_os': 38, 'rsi_ob': 73, 'vol_spike': 0.16464234466575642, 'adx_thresh': 12.6350695509772, 'atr_min_pct': 0.025409202419381396, 'atr_max_pct': 0.07346800042451547, 'tp_mult': 1.8442041370598439, 'tsl_mult': 0.6873692463493623, 'strategy': 'breakout', 'time_stop': 133, 'use_sma': False, 'use_atr': True, 'use_adx': False, 'use_ema': True, 'use_spike': True, 'rsi_required': True, 'edge_k': 0.5632178572336239, 'edge_cap': 0.5548984171122997, 'bull_strategy': 'breakout', 'bull_bb_std_mult': 0.5815304375709054, 'bull_rsi_os': 41, 'bull_rsi_ob': 49, 'bull_adx_thresh': 21.319249165839935, 'bull_atr_min_pct': 0.022279970145066674, 'bull_atr_max_pct': 0.06616128295166376, 'bull_tp_mult': 2.2172195312090923, 'bull_tsl_mult': 0.31990140600834027, 'bull_time_stop': 145, 'bull_use_sma': True, 'bull_use_ema': True, 'bull_use_atr': True, 'bull_use_adx': False, 'bull_use_spike': True, 'bull_rsi_required': False, 'bear_strategy': 'mean_reversion', 'bear_bb_std_mult': 0.751545265813326, 'bear_rsi_os': 26, 'bear_rsi_ob': 55, 'bear_adx_thresh': 30.641392063835724, 'bear_atr_min_pct': 0.005224972109732922, 'bear_atr_max_pct': 0.06108116537055672, 'bear_tp_mult': 1.582120848672865, 'bear_tsl_mult': 0.2768607233022201, 'bear_time_stop': 17, 'bear_use_sma': True, 'bear_use_ema': False, 'bear_use_atr': False, 'bear_use_adx': True, 'bear_use_spike': False, 'bear_rsi_required': True, 'sideways_strategy': 'mean_reversion', 'sideways_bb_std_mult': 2.248331220404457, 'sideways_rsi_os': 41, 'sideways_rsi_ob': 59, 'sideways_adx_thresh': 31.96338238616321, 'sideways_atr_min_pct': 0.0019381787681483683, 'sideways_atr_max_pct': 0.10585097428211775, 'sideways_tp_mult': 2.4365305859424167, 'sideways_tsl_mult': 0.9999157980511869, 'sideways_time_stop': 274, 'sideways_use_sma': True, 'sideways_use_ema': True, 'sideways_use_atr': False, 'sideways_use_adx': True, 'sideways_use_spike': True, 'sideways_rsi_required': False}.
