[I 2025-08-30 16:15:59,009] Trial 699 finished with values: [-1000000000.0, 1000000000.0] and parameters: {'p_sma': 19, 'p_std': 56, 'p_atr': 26, 'p_adx': 11, 'rsi_period': 77, 'ema1': 22, 'ema2': 32, 'slip_atr_k': 0.08121114529570025, 'slip_spread_k': 0.43563375126863724, 'spread_hl_frac': 0.020012328370273173, 'bb_std_mult': 2.4184618684349997, 'rsi_os': 37, 'rsi_ob': 77, 'vol_spike': 0.03182833060997724, 'adx_thresh': 14.306802891079176, 'atr_min_pct': 0.015446904266118573, 'atr_max_pct': 0.06460437579742512, 'tp_mult': 2.9656691935342145, 'tsl_mult': 0.42000326387630194, 'strategy': 'mean_reversion', 'time_stop': 235, 'use_sma': True, 'use_atr': True, 'use_adx': False, 'use_ema': True, 'use_spike': True, 'rsi_required': False, 'edge_k': 0.4413774267229786, 'edge_cap': 0.5966904703165403, 'bull_strategy': 'breakout', 'bull_bb_std_mult': 0.9547001042580561, 'bull_rsi_os': 41, 'bull_rsi_ob': 60, 'bull_adx_thresh': 23.05545633505991, 'bull_atr_min_pct': 0.01959549015095207, 'bull_atr_max_pct': 0.09428738684872032, 'bull_tp_mult': 2.0781538588800075, 'bull_tsl_mult': 0.1931395825023458, 'bull_time_stop': 21, 'bull_use_sma': True, 'bull_use_ema': True, 'bull_use_atr': True, 'bull_use_adx': True, 'bull_use_spike': True, 'bull_rsi_required': True, 'bear_strategy': 'mean_reversion', 'bear_bb_std_mult': 2.446745013185571, 'bear_rsi_os': 32, 'bear_rsi_ob': 82, 'bear_adx_thresh': 28.973103074771167, 'bear_atr_min_pct': 0.02054096812686319, 'bear_atr_max_pct': 0.07254299687356182, 'bear_tp_mult': 2.7400214500086975, 'bear_tsl_mult': 0.14512341157616723, 'bear_time_stop': 265, 'bear_use_sma': False, 'bear_use_ema': False, 'bear_use_atr': True, 'bear_use_adx': True, 'bear_use_spike': True, 'bear_rsi_required': True, 'sideways_strategy': 'breakout', 'sideways_bb_std_mult': 1.2886284358885889, 'sideways_rsi_os': 38, 'sideways_rsi_ob': 61, 'sideways_adx_thresh': 24.480637382808435, 'sideways_atr_min_pct': 0.002025551350307713, 'sideways_atr_max_pct': 0.10478210037529553, 'sideways_tp_mult': 2.9579998769817117, 'sideways_tsl_mult': 0.5594098036725953, 'sideways_time_stop': 65, 'sideways_use_sma': True, 'sideways_use_ema': True, 'sideways_use_atr': False, 'sideways_use_adx': True, 'sideways_use_spike': True, 'sideways_rsi_required': True}.
[I 2025-08-30 16:16:50,131] Trial 704 finished with values: [-0.038008489646553234, 0.03838972993050878] and parameters: {'p_sma': 40, 'p_std': 56, 'p_atr': 27, 'p_adx': 12, 'rsi_period': 80, 'ema1': 20, 'ema2': 29, 'slip_atr_k': 0.08151505280446247, 'slip_spread_k': 0.4271042185731756, 'spread_hl_frac': 0.014626694031777061, 'bb_std_mult': 2.313954172743143, 'rsi_os': 39, 'rsi_ob': 74, 'vol_spike': 0.01852825533640634, 'adx_thresh': 15.701206204593436, 'atr_min_pct': 0.017125776713447748, 'atr_max_pct': 0.073926419146431, 'tp_mult': 1.7894515651380543, 'tsl_mult': 0.13833777461033447, 'strategy': 'mean_reversion', 'time_stop': 207, 'use_sma': True, 'use_atr': False, 'use_adx': False, 'use_ema': True, 'use_spike': True, 'rsi_required': False, 'edge_k': 0.39135248707538606, 'edge_cap': 0.6164910809967643, 'bull_strategy': 'breakout', 'bull_bb_std_mult': 0.9705276925526682, 'bull_rsi_os': 40, 'bull_rsi_ob': 60, 'bull_adx_thresh': 24.44036146823461, 'bull_atr_min_pct': 0.0008536563511997407, 'bull_atr_max_pct': 0.0918055143722488, 'bull_tp_mult': 1.9980687420436214, 'bull_tsl_mult': 0.07029291570933828, 'bull_time_stop': 95, 'bull_use_sma': True, 'bull_use_ema': True, 'bull_use_atr': True, 'bull_use_adx': True, 'bull_use_spike': True, 'bull_rsi_required': True, 'bear_strategy': 'mean_reversion', 'bear_bb_std_mult': 2.55605847417769, 'bear_rsi_os': 24, 'bear_rsi_ob': 85, 'bear_adx_thresh': 28.79523752278146, 'bear_atr_min_pct': 0.005849555333730964, 'bear_atr_max_pct': 0.07442650020894413, 'bear_tp_mult': 2.8178284966425022, 'bear_tsl_mult': 0.6031689515586602, 'bear_time_stop': 263, 'bear_use_sma': False, 'bear_use_ema': False, 'bear_use_atr': False, 'bear_use_adx': True, 'bear_use_spike': True, 'bear_rsi_required': False, 'sideways_strategy': 'breakout', 'sideways_bb_std_mult': 0.7707739362975661, 'sideways_rsi_os': 40, 'sideways_rsi_ob': 65, 'sideways_adx_thresh': 25.42077383328482, 'sideways_atr_min_pct': 0.002114519009270406, 'sideways_atr_max_pct': 0.14014312723826472, 'sideways_tp_mult': 2.9304174339719187, 'sideways_tsl_mult': 0.7117657237900767, 'sideways_time_stop': 81, 'sideways_use_sma': True, 'sideways_use_ema': True, 'sideways_use_atr': False, 'sideways_use_adx': True, 'sideways_use_spike': True, 'sideways_rsi_required': True}.
[I 2025-08-30 16:16:50,957] Trial 705 finished with values: [-0.0371514868337095, 0.036991633191501484] and parameters: {'p_sma': 57, 'p_std': 56, 'p_atr': 27, 'p_adx': 11, 'rsi_period': 62, 'ema1': 17, 'ema2': 28, 'slip_atr_k': 0.06787516910378093, 'slip_spread_k': 0.13868514465097964, 'spread_hl_frac': 0.025518549396136417, 'bb_std_mult': 2.4389498584668217, 'rsi_os': 40, 'rsi_ob': 62, 'vol_spike': 0.0865739959240967, 'adx_thresh': 15.585666540256632, 'atr_min_pct': 0.017360606645744202, 'atr_max_pct': 0.11346099785718974, 'tp_mult': 1.6227627374864788, 'tsl_mult': 0.28049889780851844, 'strategy': 'mean_reversion', 'time_stop': 204, 'use_sma': True, 'use_atr': False, 'use_adx': False, 'use_ema': True, 'use_spike': True, 'rsi_required': False, 'edge_k': 0.4942895458901073, 'edge_cap': 0.6109652293108391, 'bull_strategy': 'breakout', 'bull_bb_std_mult': 0.712610786366563, 'bull_rsi_os': 39, 'bull_rsi_ob': 69, 'bull_adx_thresh': 24.48398048495371, 'bull_atr_min_pct': 0.0008948063045252155, 'bull_atr_max_pct': 0.1009888570696409, 'bull_tp_mult': 1.994127490781961, 'bull_tsl_mult': 0.11380479493285162, 'bull_time_stop': 32, 'bull_use_sma': True, 'bull_use_ema': True, 'bull_use_atr': True, 'bull_use_adx': True, 'bull_use_spike': True, 'bull_rsi_required': True, 'bear_strategy': 'mean_reversion', 'bear_bb_std_mult': 2.5583524428886673, 'bear_rsi_os': 24, 'bear_rsi_ob': 85, 'bear_adx_thresh': 28.96689756830886, 'bear_atr_min_pct': 5.604644601289038e-05, 'bear_atr_max_pct': 0.07453865463064288, 'bear_tp_mult': 2.821438734388887, 'bear_tsl_mult': 0.3832183404221965, 'bear_time_stop': 236, 'bear_use_sma': False, 'bear_use_ema': False, 'bear_use_atr': False, 'bear_use_adx': True, 'bear_use_spike': True, 'bear_rsi_required': False, 'sideways_strategy': 'breakout', 'sideways_bb_std_mult': 0.794317815924136, 'sideways_rsi_os': 37, 'sideways_rsi_ob': 61, 'sideways_adx_thresh': 24.4729505102975, 'sideways_atr_min_pct': 0.0020264456881263788, 'sideways_atr_max_pct': 0.14262589125023242, 'sideways_tp_mult': 2.9455222199519864, 'sideways_tsl_mult': 0.7195072273854044, 'sideways_time_stop': 78, 'sideways_use_sma': True, 'sideways_use_ema': True, 'sideways_use_atr': False, 'sideways_use_adx': True, 'sideways_use_spike': True, 'sideways_rsi_required': True}.
[I 2025-08-30 16:16:51,897] Trial 706 finished with values: [-0.042486267753676143, 0.04251891749773465] and parameters: {'p_sma': 35, 'p_std': 22, 'p_atr': 21, 'p_adx': 12, 'rsi_period': 79, 'ema1': 23, 'ema2': 27, 'slip_atr_k': 0.24986440374730512, 'slip_spread_k': 0.13633360010721715, 'spread_hl_frac': 0.025436114394533197, 'bb_std_mult': 2.3265443561566395, 'rsi_os': 40, 'rsi_ob': 74, 'vol_spike': 0.021869784474831316, 'adx_thresh': 15.65229600392694, 'atr_min_pct': 0.01453490050650624, 'atr_max_pct': 0.0738853063816209, 'tp_mult': 1.7841863085595102, 'tsl_mult': 0.32177890393443087, 'strategy': 'mean_reversion', 'time_stop': 209, 'use_sma': True, 'use_atr': False, 'use_adx': True, 'use_ema': False, 'use_spike': True, 'rsi_required': False, 'edge_k': 0.49727601711329394, 'edge_cap': 0.8571438939765222, 'bull_strategy': 'breakout', 'bull_bb_std_mult': 0.7061745038503052, 'bull_rsi_os': 23, 'bull_rsi_ob': 69, 'bull_adx_thresh': 24.55438386605386, 'bull_atr_min_pct': 0.0009299150947615544, 'bull_atr_max_pct': 0.09865429936731063, 'bull_tp_mult': 1.9937092296566203, 'bull_tsl_mult': 0.0771962381738509, 'bull_time_stop': 97, 'bull_use_sma': True, 'bull_use_ema': True, 'bull_use_atr': True, 'bull_use_adx': True, 'bull_use_spike': True, 'bull_rsi_required': True, 'bear_strategy': 'mean_reversion', 'bear_bb_std_mult': 2.549917694726828, 'bear_rsi_os': 34, 'bear_rsi_ob': 85, 'bear_adx_thresh': 30.15016878188513, 'bear_atr_min_pct': 0.005900653135318122, 'bear_atr_max_pct': 0.07560881526648293, 'bear_tp_mult': 2.8400890109903982, 'bear_tsl_mult': 0.2435463982666429, 'bear_time_stop': 242, 'bear_use_sma': False, 'bear_use_ema': False, 'bear_use_atr': False, 'bear_use_adx': True, 'bear_use_spike': True, 'bear_rsi_required': False, 'sideways_strategy': 'breakout', 'sideways_bb_std_mult': 0.5165809347789208, 'sideways_rsi_os': 29, 'sideways_rsi_ob': 61, 'sideways_adx_thresh': 25.395544350369313, 'sideways_atr_min_pct': 0.0007972467852289907, 'sideways_atr_max_pct': 0.10611048223417713, 'sideways_tp_mult': 2.9997763873499763, 'sideways_tsl_mult': 0.239702193897339, 'sideways_time_stop': 81, 'sideways_use_sma': True, 'sideways_use_ema': True, 'sideways_use_atr': False, 'sideways_use_adx': True, 'sideways_use_spike': True, 'sideways_rsi_required': True}.
[I 2025-08-30 16:16:51,952] Trial 703 finished with values: [-1000000000.0, 1000000000.0] and parameters: {'p_sma': 5, 'p_std': 56, 'p_atr': 27, 'p_adx': 10, 'rsi_period': 7, 'ema1': 16, 'ema2': 29, 'slip_atr_k': 0.07620742641588393, 'slip_spread_k': 0.12596976967582849, 'spread_hl_frac': 0.040201993389536124, 'bb_std_mult': 2.310074819010836, 'rsi_os': 39, 'rsi_ob': 73, 'vol_spike': 0.0185903988829286, 'adx_thresh': 15.146075370086532, 'atr_min_pct': 0.01719236479594088, 'atr_max_pct': 0.06604447027025824, 'tp_mult': 1.6764064549417181, 'tsl_mult': 0.23899257395015097, 'strategy': 'mean_reversion', 'time_stop': 235, 'use_sma': True, 'use_atr': False, 'use_adx': True, 'use_ema': False, 'use_spike': True, 'rsi_required': False, 'edge_k': 0.43578724171181127, 'edge_cap': 0.5801307439313073, 'bull_strategy': 'breakout', 'bull_bb_std_mult': 0.7117780726160629, 'bull_rsi_os': 40, 'bull_rsi_ob': 59, 'bull_adx_thresh': 6.181085895826804, 'bull_atr_min_pct': 0.0008582552242735707, 'bull_atr_max_pct': 0.09578768237967096, 'bull_tp_mult': 1.9944463807264186, 'bull_tsl_mult': 0.014735157559447515, 'bull_time_stop': 72, 'bull_use_sma': True, 'bull_use_ema': True, 'bull_use_atr': True, 'bull_use_adx': True, 'bull_use_spike': True, 'bull_rsi_required': True, 'bear_strategy': 'mean_reversion', 'bear_bb_std_mult': 2.549896135049422, 'bear_rsi_os': 41, 'bear_rsi_ob': 84, 'bear_adx_thresh': 28.962749525845616, 'bear_atr_min_pct': 2.297637752680763e-05, 'bear_atr_max_pct': 0.07307042676847265, 'bear_tp_mult': 2.8199699786615646, 'bear_tsl_mult': 0.44626635858718156, 'bear_time_stop': 287, 'bear_use_sma': False, 'bear_use_ema': False, 'bear_use_atr': False, 'bear_use_adx': True, 'bear_use_spike': True, 'bear_rsi_required': True, 'sideways_strategy': 'mean_reversion', 'sideways_bb_std_mult': 1.3390977686307128, 'sideways_rsi_os': 40, 'sideways_rsi_ob': 61, 'sideways_adx_thresh': 25.16455473522523, 'sideways_atr_min_pct': 0.001880991877087606, 'sideways_atr_max_pct': 0.017482563099346926, 'sideways_tp_mult': 2.885860183828162, 'sideways_tsl_mult': 0.5481524309214695, 'sideways_time_stop': 54, 'sideways_use_sma': True, 'sideways_use_ema': True, 'sideways_use_atr': False, 'sideways_use_adx': True, 'sideways_use_spike': True, 'sideways_rsi_required': True}.
[I 2025-08-30 16:17:36,270] Trial 710 finished with values: [-0.022099707662081358, 0.022048641300839982] and parameters: {'p_sma': 51, 'p_std': 7, 'p_atr': 29, 'p_adx': 11, 'rsi_period': 33, 'ema1': 26, 'ema2': 33, 'slip_atr_k': 0.14279571792712906, 'slip_spread_k': 0.1599943576794292, 'spread_hl_frac': 0.022558038126273734, 'bb_std_mult': 2.163475228408017, 'rsi_os': 38, 'rsi_ob': 70, 'vol_spike': 0.168277499255343, 'adx_thresh': 14.695241615203123, 'atr_min_pct': 0.005878928307407072, 'atr_max_pct': 0.05056561261930097, 'tp_mult': 1.7003808509641463, 'tsl_mult': 0.202979735825934, 'strategy': 'mean_reversion', 'time_stop': 219, 'use_sma': True, 'use_atr': True, 'use_adx': False, 'use_ema': True, 'use_spike': True, 'rsi_required': False, 'edge_k': 0.3970795544419473, 'edge_cap': 0.6134365744951126, 'bull_strategy': 'breakout', 'bull_bb_std_mult': 0.8276324445835053, 'bull_rsi_os': 19, 'bull_rsi_ob': 62, 'bull_adx_thresh': 25.194653584533178, 'bull_atr_min_pct': 0.011509542252428062, 'bull_atr_max_pct': 0.09150629994593105, 'bull_tp_mult': 2.040762847816642, 'bull_tsl_mult': 0.11071954094053998, 'bull_time_stop': 79, 'bull_use_sma': True, 'bull_use_ema': True, 'bull_use_atr': True, 'bull_use_adx': True, 'bull_use_spike': False, 'bull_rsi_required': True, 'bear_strategy': 'breakout', 'bear_bb_std_mult': 2.6095128576145314, 'bear_rsi_os': 34, 'bear_rsi_ob': 86, 'bear_adx_thresh': 13.262856868818039, 'bear_atr_min_pct': 0.004837835374113036, 'bear_atr_max_pct': 0.080512169691776, 'bear_tp_mult': 2.6972885675539042, 'bear_tsl_mult': 0.3556602984993625, 'bear_time_stop': 272, 'bear_use_sma': False, 'bear_use_ema': False, 'bear_use_atr': True, 'bear_use_adx': True, 'bear_use_spike': True, 'bear_rsi_required': True, 'sideways_strategy': 'breakout', 'sideways_bb_std_mult': 1.1411656337138898, 'sideways_rsi_os': 23, 'sideways_rsi_ob': 63, 'sideways_adx_thresh': 22.970824665138338, 'sideways_atr_min_pct': 0.00103357067416796, 'sideways_atr_max_pct': 0.05546165051899726, 'sideways_tp_mult': 2.8227941546069992, 'sideways_tsl_mult': 0.031735768158270894, 'sideways_time_stop': 73, 'sideways_use_sma': False, 'sideways_use_ema': False, 'sideways_use_atr': False, 'sideways_use_adx': True, 'sideways_use_spike': True, 'sideways_rsi_required': True}.
[I 2025-08-30 16:17:38,140] Trial 708 finished with values: [-0.030218977177973616, 0.03014705817184732] and parameters: {'p_sma': 36, 'p_std': 51, 'p_atr': 30, 'p_adx': 11, 'rsi_period': 78, 'ema1': 26, 'ema2': 30, 'slip_atr_k': 0.07523942017009816, 'slip_spread_k': 0.2980042607203508, 'spread_hl_frac': 0.03423340215230409, 'bb_std_mult': 2.28880129805511, 'rsi_os': 39, 'rsi_ob': 72, 'vol_spike': 0.0071161684409252746, 'adx_thresh': 14.963397891304496, 'atr_min_pct': 0.015820853283863213, 'atr_max_pct': 0.03501663983817219, 'tp_mult': 1.7045786433725658, 'tsl_mult': 0.32782882388150414, 'strategy': 'mean_reversion', 'time_stop': 218, 'use_sma': True, 'use_atr': True, 'use_adx': True, 'use_ema': False, 'use_spike': True, 'rsi_required': False, 'edge_k': 0.38439680498343104, 'edge_cap': 0.8518282538060215, 'bull_strategy': 'breakout', 'bull_bb_std_mult': 0.6514368565682113, 'bull_rsi_os': 23, 'bull_rsi_ob': 59, 'bull_adx_thresh': 25.225482536085305, 'bull_atr_min_pct': 0.012343054801142226, 'bull_atr_max_pct': 0.09131525876939416, 'bull_tp_mult': 2.018523032712354, 'bull_tsl_mult': 0.027087645513095455, 'bull_time_stop': 81, 'bull_use_sma': True, 'bull_use_ema': True, 'bull_use_atr': True, 'bull_use_adx': True, 'bull_use_spike': False, 'bull_rsi_required': True, 'bear_strategy': 'breakout', 'bear_bb_std_mult': 2.6497112073865754, 'bear_rsi_os': 37, 'bear_rsi_ob': 84, 'bear_adx_thresh': 22.646260615887442, 'bear_atr_min_pct': 0.019112503665682297, 'bear_atr_max_pct': 0.07937570343299469, 'bear_tp_mult': 2.681793733091363, 'bear_tsl_mult': 0.361834126052307, 'bear_time_stop': 272, 'bear_use_sma': False, 'bear_use_ema': False, 'bear_use_atr': True, 'bear_use_adx': True, 'bear_use_spike': True, 'bear_rsi_required': True, 'sideways_strategy': 'breakout', 'sideways_bb_std_mult': 0.5136304061050372, 'sideways_rsi_os': 39, 'sideways_rsi_ob': 60, 'sideways_adx_thresh': 25.33870440534348, 'sideways_atr_min_pct': 0.0007045201440656742, 'sideways_atr_max_pct': 0.10673643411938469, 'sideways_tp_mult': 2.9931308361649314, 'sideways_tsl_mult': 0.9153310427081782, 'sideways_time_stop': 73, 'sideways_use_sma': False, 'sideways_use_ema': False, 'sideways_use_atr': False, 'sideways_use_adx': True, 'sideways_use_spike': True, 'sideways_rsi_required': True}.
[I 2025-08-30 16:17:38,711] Trial 709 finished with values: [-0.043068448211415644, 0.04289217381745245] and parameters: {'p_sma': 6, 'p_std': 6, 'p_atr': 29, 'p_adx': 11, 'rsi_period': 33, 'ema1': 26, 'ema2': 24, 'slip_atr_k': 0.18266035801855748, 'slip_spread_k': 0.12403150895304804, 'spread_hl_frac': 0.022510687115431152, 'bb_std_mult': 2.2569684880229146, 'rsi_os': 38, 'rsi_ob': 70, 'vol_spike': 0.16971039482506917, 'adx_thresh': 14.897490350449987, 'atr_min_pct': 0.01594753433744504, 'atr_max_pct': 0.03473086416109638, 'tp_mult': 1.710865064014064, 'tsl_mult': 0.2000931154757588, 'strategy': 'mean_reversion', 'time_stop': 220, 'use_sma': True, 'use_atr': True, 'use_adx': False, 'use_ema': True, 'use_spike': True, 'rsi_required': False, 'edge_k': 0.3873582152007139, 'edge_cap': 0.2606832988104227, 'bull_strategy': 'breakout', 'bull_bb_std_mult': 0.6511683401723973, 'bull_rsi_os': 19, 'bull_rsi_ob': 59, 'bull_adx_thresh': 25.09657447871625, 'bull_atr_min_pct': 0.02094009583561237, 'bull_atr_max_pct': 0.08419177977324527, 'bull_tp_mult': 2.026550950225356, 'bull_tsl_mult': 0.05232862284944967, 'bull_time_stop': 40, 'bull_use_sma': True, 'bull_use_ema': True, 'bull_use_atr': True, 'bull_use_adx': True, 'bull_use_spike': False, 'bull_rsi_required': True, 'bear_strategy': 'breakout', 'bear_bb_std_mult': 2.655090091629654, 'bear_rsi_os': 42, 'bear_rsi_ob': 84, 'bear_adx_thresh': 22.472910772106857, 'bear_atr_min_pct': 0.003320128579839255, 'bear_atr_max_pct': 0.08055609081192548, 'bear_tp_mult': 2.777000368073568, 'bear_tsl_mult': 0.5493382657484445, 'bear_time_stop': 272, 'bear_use_sma': False, 'bear_use_ema': False, 'bear_use_atr': True, 'bear_use_adx': True, 'bear_use_spike': True, 'bear_rsi_required': True, 'sideways_strategy': 'breakout', 'sideways_bb_std_mult': 1.3671521093483976, 'sideways_rsi_os': 23, 'sideways_rsi_ob': 60, 'sideways_adx_thresh': 23.4732292276035, 'sideways_atr_min_pct': 0.025638273892447667, 'sideways_atr_max_pct': 0.11096350600579057, 'sideways_tp_mult': 2.83287632680278, 'sideways_tsl_mult': 0.9159086302660894, 'sideways_time_stop': 70, 'sideways_use_sma': False, 'sideways_use_ema': False, 'sideways_use_atr': False, 'sideways_use_adx': True, 'sideways_use_spike': True, 'sideways_rsi_required': True}.
[I 2025-08-30 16:17:39,090] Trial 707 finished with values: [-1000000000.0, 1000000000.0] and parameters: {'p_sma': 6, 'p_std': 22, 'p_atr': 30, 'p_adx': 11, 'rsi_period': 68, 'ema1': 23, 'ema2': 27, 'slip_atr_k': 0.07568808976438221, 'slip_spread_k': 0.13253762582340234, 'spread_hl_frac': 0.022538453178986922, 'bb_std_mult': 2.170062371460235, 'rsi_os': 40, 'rsi_ob': 72, 'vol_spike': 0.16989069245768926, 'adx_thresh': 14.987624304969973, 'atr_min_pct': 0.015926755953296484, 'atr_max_pct': 0.11341774297858806, 'tp_mult': 1.6856326214422526, 'tsl_mult': 0.2804428201997551, 'strategy': 'mean_reversion', 'time_stop': 218, 'use_sma': True, 'use_atr': False, 'use_adx': True, 'use_ema': False, 'use_spike': True, 'rsi_required': False, 'edge_k': 0.5007969332621233, 'edge_cap': 0.30335101345872306, 'bull_strategy': 'breakout', 'bull_bb_std_mult': 0.6752057152985125, 'bull_rsi_os': 39, 'bull_rsi_ob': 59, 'bull_adx_thresh': 6.038624584428055, 'bull_atr_min_pct': 0.020797217301881717, 'bull_atr_max_pct': 0.09888118483539626, 'bull_tp_mult': 2.0114993595768618, 'bull_tsl_mult': 0.1073471616931636, 'bull_time_stop': 29, 'bull_use_sma': True, 'bull_use_ema': True, 'bull_use_atr': True, 'bull_use_adx': True, 'bull_use_spike': False, 'bull_rsi_required': True, 'bear_strategy': 'mean_reversion', 'bear_bb_std_mult': 2.644477086789615, 'bear_rsi_os': 23, 'bear_rsi_ob': 84, 'bear_adx_thresh': 22.059103359768642, 'bear_atr_min_pct': 0.027303139003042216, 'bear_atr_max_pct': 0.08027909948933494, 'bear_tp_mult': 2.6849554544489935, 'bear_tsl_mult': 0.3564957273077786, 'bear_time_stop': 273, 'bear_use_sma': False, 'bear_use_ema': False, 'bear_use_atr': False, 'bear_use_adx': True, 'bear_use_spike': True, 'bear_rsi_required': True, 'sideways_strategy': 'breakout', 'sideways_bb_std_mult': 0.5125649931492661, 'sideways_rsi_os': 37, 'sideways_rsi_ob': 60, 'sideways_adx_thresh': 25.352784672576664, 'sideways_atr_min_pct': 0.0008403340772565202, 'sideways_atr_max_pct': 0.10613332765307953, 'sideways_tp_mult': 2.998033548993581, 'sideways_tsl_mult': 0.9215062244236513, 'sideways_time_stop': 78, 'sideways_use_sma': False, 'sideways_use_ema': True, 'sideways_use_atr': False, 'sideways_use_adx': True, 'sideways_use_spike': True, 'sideways_rsi_required': True}.
