[I 2025-08-30 15:07:36,094] Trial 369 finished with values: [-1000000000.0, 1000000000.0] and parameters: {'p_sma': 9, 'p_std': 56, 'p_atr': 17, 'p_adx': 25, 'rsi_period': 81, 'ema1': 29, 'ema2': 19, 'slip_atr_k': 0.04881552931828855, 'slip_spread_k': 0.6007995815207309, 'spread_hl_frac': 0.040580654382636146, 'bb_std_mult': 3.5587298293540313, 'rsi_os': 25, 'rsi_ob': 74, 'vol_spike': 0.16323433067848905, 'adx_thresh': 27.439671439007416, 'atr_min_pct': 0.0082142611745439, 'atr_max_pct': 0.07741835226916645, 'tp_mult': 1.6176941522642565, 'tsl_mult': 0.13105765370989425, 'strategy': 'breakout', 'time_stop': 124, 'use_sma': False, 'use_atr': True, 'use_adx': True, 'use_ema': True, 'use_spike': True, 'rsi_required': True, 'edge_k': 1.0126733532530965, 'edge_cap': 0.5474147289516003, 'bull_strategy': 'mean_reversion', 'bull_bb_std_mult': 2.5044367058109227, 'bull_rsi_os': 35, 'bull_rsi_ob': 90, 'bull_adx_thresh': 22.492438959454077, 'bull_atr_min_pct': 0.007731951734395852, 'bull_atr_max_pct': 0.07146951247186098, 'bull_tp_mult': 1.8424610249702762, 'bull_tsl_mult': 0.5716380387601481, 'bull_time_stop': 147, 'bull_use_sma': False, 'bull_use_ema': False, 'bull_use_atr': False, 'bull_use_adx': False, 'bull_use_spike': True, 'bull_rsi_required': False, 'bear_strategy': 'mean_reversion', 'bear_bb_std_mult': 0.5908659870647144, 'bear_rsi_os': 5, 'bear_rsi_ob': 75, 'bear_adx_thresh': 28.312400824967277, 'bear_atr_min_pct': 0.020117168013120156, 'bear_atr_max_pct': 0.06570192684350762, 'bear_tp_mult': 1.4714490170286265, 'bear_tsl_mult': 0.7923094652442075, 'bear_time_stop': 67, 'bear_use_sma': True, 'bear_use_ema': True, 'bear_use_atr': True, 'bear_use_adx': False, 'bear_use_spike': False, 'bear_rsi_required': True, 'sideways_strategy': 'mean_reversion', 'sideways_bb_std_mult': 1.9237742482975468, 'sideways_rsi_os': 51, 'sideways_rsi_ob': 59, 'sideways_adx_thresh': 24.156826129698587, 'sideways_atr_min_pct': 0.02575067183502657, 'sideways_atr_max_pct': 0.09923470387426528, 'sideways_tp_mult': 2.4365132951878907, 'sideways_tsl_mult': 0.6313459805906654, 'sideways_time_stop': 19, 'sideways_use_sma': False, 'sideways_use_ema': True, 'sideways_use_atr': True, 'sideways_use_adx': False, 'sideways_use_spike': False, 'sideways_rsi_required': False}.
[I 2025-08-30 15:08:15,429] Trial 373 finished with values: [-1000000000.0, 1000000000.0] and parameters: {'p_sma': 6, 'p_std': 56, 'p_atr': 18, 'p_adx': 24, 'rsi_period': 79, 'ema1': 30, 'ema2': 19, 'slip_atr_k': 0.05596032095960157, 'slip_spread_k': 0.5570502638351726, 'spread_hl_frac': 0.03309695616318956, 'bb_std_mult': 3.513342485869961, 'rsi_os': 22, 'rsi_ob': 75, 'vol_spike': 0.2101899255108002, 'adx_thresh': 28.266437734653813, 'atr_min_pct': 0.013895657226734456, 'atr_max_pct': 0.08269931227027594, 'tp_mult': 1.7292127893020095, 'tsl_mult': 0.08677821697412136, 'strategy': 'breakout', 'time_stop': 116, 'use_sma': False, 'use_atr': False, 'use_adx': False, 'use_ema': True, 'use_spike': True, 'rsi_required': True, 'edge_k': 1.0448236872162053, 'edge_cap': 0.5806565504157863, 'bull_strategy': 'mean_reversion', 'bull_bb_std_mult': 2.7038477468801596, 'bull_rsi_os': 29, 'bull_rsi_ob': 90, 'bull_adx_thresh': 23.703759174502064, 'bull_atr_min_pct': 0.007536204200582132, 'bull_atr_max_pct': 0.06520950452828315, 'bull_tp_mult': 1.7591800893049023, 'bull_tsl_mult': 0.07676741878051879, 'bull_time_stop': 151, 'bull_use_sma': False, 'bull_use_ema': False, 'bull_use_atr': False, 'bull_use_adx': False, 'bull_use_spike': False, 'bull_rsi_required': False, 'bear_strategy': 'mean_reversion', 'bear_bb_std_mult': 0.7323660952278125, 'bear_rsi_os': 6, 'bear_rsi_ob': 76, 'bear_adx_thresh': 28.4893840099292, 'bear_atr_min_pct': 0.01781027045424005, 'bear_atr_max_pct': 0.08368225831579032, 'bear_tp_mult': 1.4504995383423618, 'bear_tsl_mult': 0.4640521568954061, 'bear_time_stop': 79, 'bear_use_sma': True, 'bear_use_ema': True, 'bear_use_atr': True, 'bear_use_adx': False, 'bear_use_spike': False, 'bear_rsi_required': True, 'sideways_strategy': 'breakout', 'sideways_bb_std_mult': 1.737552349207801, 'sideways_rsi_os': 16, 'sideways_rsi_ob': 58, 'sideways_adx_thresh': 25.46861603986038, 'sideways_atr_min_pct': 0.00849258679945326, 'sideways_atr_max_pct': 0.10230957588698068, 'sideways_tp_mult': 2.4030681119114554, 'sideways_tsl_mult': 0.5641500486776634, 'sideways_time_stop': 39, 'sideways_use_sma': True, 'sideways_use_ema': True, 'sideways_use_atr': True, 'sideways_use_adx': False, 'sideways_use_spike': True, 'sideways_rsi_required': False}.
[I 2025-08-30 15:08:15,573] Trial 371 finished with values: [-1000000000.0, 1000000000.0] and parameters: {'p_sma': 6, 'p_std': 56, 'p_atr': 17, 'p_adx': 24, 'rsi_period': 78, 'ema1': 30, 'ema2': 19, 'slip_atr_k': 0.05683172386332927, 'slip_spread_k': 0.6005392362868822, 'spread_hl_frac': 0.03826741491521497, 'bb_std_mult': 3.5279819266083043, 'rsi_os': 25, 'rsi_ob': 74, 'vol_spike': 0.20212432376844464, 'adx_thresh': 28.338070366374307, 'atr_min_pct': 0.008293408904359848, 'atr_max_pct': 0.07679284870975735, 'tp_mult': 1.6137182187132815, 'tsl_mult': 0.13004798576116486, 'strategy': 'breakout', 'time_stop': 217, 'use_sma': False, 'use_atr': False, 'use_adx': False, 'use_ema': True, 'use_spike': True, 'rsi_required': True, 'edge_k': 1.0315231458534067, 'edge_cap': 0.539464937250995, 'bull_strategy': 'mean_reversion', 'bull_bb_std_mult': 2.6970353992921994, 'bull_rsi_os': 30, 'bull_rsi_ob': 90, 'bull_adx_thresh': 22.38616708662285, 'bull_atr_min_pct': 0.009654648439337823, 'bull_atr_max_pct': 0.06614161800019336, 'bull_tp_mult': 1.8707632577857236, 'bull_tsl_mult': 0.20230089493025438, 'bull_time_stop': 152, 'bull_use_sma': False, 'bull_use_ema': False, 'bull_use_atr': False, 'bull_use_adx': False, 'bull_use_spike': False, 'bull_rsi_required': False, 'bear_strategy': 'mean_reversion', 'bear_bb_std_mult': 0.7369010007172696, 'bear_rsi_os': 6, 'bear_rsi_ob': 75, 'bear_adx_thresh': 28.390432921579645, 'bear_atr_min_pct': 0.026941404750195935, 'bear_atr_max_pct': 0.08425039798538385, 'bear_tp_mult': 1.452966766885533, 'bear_tsl_mult': 0.6583200125366159, 'bear_time_stop': 77, 'bear_use_sma': True, 'bear_use_ema': True, 'bear_use_atr': True, 'bear_use_adx': False, 'bear_use_spike': False, 'bear_rsi_required': True, 'sideways_strategy': 'mean_reversion', 'sideways_bb_std_mult': 1.9160306697492215, 'sideways_rsi_os': 16, 'sideways_rsi_ob': 59, 'sideways_adx_thresh': 25.281669218336063, 'sideways_atr_min_pct': 0.0009005899755352506, 'sideways_atr_max_pct': 0.09800704634267743, 'sideways_tp_mult': 2.394102255076047, 'sideways_tsl_mult': 0.6268341767546048, 'sideways_time_stop': 17, 'sideways_use_sma': True, 'sideways_use_ema': True, 'sideways_use_atr': True, 'sideways_use_adx': False, 'sideways_use_spike': True, 'sideways_rsi_required': False}.
[I 2025-08-30 15:08:15,847] Trial 372 finished with values: [-0.023759086629889903, 0.023819586417074056] and parameters: {'p_sma': 6, 'p_std': 56, 'p_atr': 18, 'p_adx': 24, 'rsi_period': 78, 'ema1': 30, 'ema2': 19, 'slip_atr_k': 0.05484604154175803, 'slip_spread_k': 0.5551673827384964, 'spread_hl_frac': 0.0444815651585787, 'bb_std_mult': 3.535408535925147, 'rsi_os': 25, 'rsi_ob': 75, 'vol_spike': 0.20951922854642782, 'adx_thresh': 28.343837984034625, 'atr_min_pct': 0.027420752452120646, 'atr_max_pct': 0.08259358307449571, 'tp_mult': 1.7220758497691824, 'tsl_mult': 0.07885120833455256, 'strategy': 'breakout', 'time_stop': 129, 'use_sma': False, 'use_atr': False, 'use_adx': False, 'use_ema': True, 'use_spike': True, 'rsi_required': True, 'edge_k': 1.0580986005028723, 'edge_cap': 0.5879796918331629, 'bull_strategy': 'mean_reversion', 'bull_bb_std_mult': 2.6824961167382964, 'bull_rsi_os': 29, 'bull_rsi_ob': 90, 'bull_adx_thresh': 21.827512622413426, 'bull_atr_min_pct': 0.00769018747649538, 'bull_atr_max_pct': 0.06684334507739915, 'bull_tp_mult': 1.972479321460679, 'bull_tsl_mult': 0.19841282855020342, 'bull_time_stop': 153, 'bull_use_sma': False, 'bull_use_ema': False, 'bull_use_atr': False, 'bull_use_adx': False, 'bull_use_spike': False, 'bull_rsi_required': False, 'bear_strategy': 'mean_reversion', 'bear_bb_std_mult': 0.7268664464948846, 'bear_rsi_os': 6, 'bear_rsi_ob': 76, 'bear_adx_thresh': 28.394747646913935, 'bear_atr_min_pct': 0.02711641717012251, 'bear_atr_max_pct': 0.016627879496553248, 'bear_tp_mult': 1.4705275095777246, 'bear_tsl_mult': 0.6639811647076547, 'bear_time_stop': 77, 'bear_use_sma': True, 'bear_use_ema': True, 'bear_use_atr': True, 'bear_use_adx': False, 'bear_use_spike': False, 'bear_rsi_required': True, 'sideways_strategy': 'breakout', 'sideways_bb_std_mult': 1.8849251776799454, 'sideways_rsi_os': 43, 'sideways_rsi_ob': 59, 'sideways_adx_thresh': 25.45592939867907, 'sideways_atr_min_pct': 9.918588247047572e-06, 'sideways_atr_max_pct': 0.10208431229975311, 'sideways_tp_mult': 2.414646015930541, 'sideways_tsl_mult': 0.5529115608455948, 'sideways_time_stop': 35, 'sideways_use_sma': True, 'sideways_use_ema': True, 'sideways_use_atr': True, 'sideways_use_adx': False, 'sideways_use_spike': True, 'sideways_rsi_required': False}.
[I 2025-08-30 15:08:15,970] Trial 370 finished with values: [-0.022572285247216328, 0.0224827310001536] and parameters: {'p_sma': 8, 'p_std': 56, 'p_atr': 17, 'p_adx': 25, 'rsi_period': 78, 'ema1': 29, 'ema2': 19, 'slip_atr_k': 0.05450568827934347, 'slip_spread_k': 0.6084215483738469, 'spread_hl_frac': 0.03901589465591335, 'bb_std_mult': 3.546411870635483, 'rsi_os': 25, 'rsi_ob': 74, 'vol_spike': 0.1637405280801407, 'adx_thresh': 28.290282082098287, 'atr_min_pct': 0.01374069906000574, 'atr_max_pct': 0.07624593943370915, 'tp_mult': 1.6170245939025483, 'tsl_mult': 0.08786251662865968, 'strategy': 'breakout', 'time_stop': 226, 'use_sma': False, 'use_atr': True, 'use_adx': True, 'use_ema': True, 'use_spike': True, 'rsi_required': True, 'edge_k': 1.013750940150248, 'edge_cap': 0.5452537375807139, 'bull_strategy': 'mean_reversion', 'bull_bb_std_mult': 2.478515626075189, 'bull_rsi_os': 30, 'bull_rsi_ob': 90, 'bull_adx_thresh': 23.532150905279707, 'bull_atr_min_pct': 0.00817213827627958, 'bull_atr_max_pct': 0.07082990559334845, 'bull_tp_mult': 1.8513186847682062, 'bull_tsl_mult': 0.2068556874887657, 'bull_time_stop': 150, 'bull_use_sma': False, 'bull_use_ema': False, 'bull_use_atr': False, 'bull_use_adx': False, 'bull_use_spike': True, 'bull_rsi_required': False, 'bear_strategy': 'mean_reversion', 'bear_bb_std_mult': 0.7235862729485774, 'bear_rsi_os': 6, 'bear_rsi_ob': 78, 'bear_adx_thresh': 28.193251188023137, 'bear_atr_min_pct': 0.018070988671782504, 'bear_atr_max_pct': 0.11307660142314968, 'bear_tp_mult': 1.470038953496696, 'bear_tsl_mult': 0.6545518770044874, 'bear_time_stop': 79, 'bear_use_sma': True, 'bear_use_ema': True, 'bear_use_atr': True, 'bear_use_adx': False, 'bear_use_spike': False, 'bear_rsi_required': True, 'sideways_strategy': 'breakout', 'sideways_bb_std_mult': 1.9210859620657013, 'sideways_rsi_os': 43, 'sideways_rsi_ob': 59, 'sideways_adx_thresh': 25.344284465727004, 'sideways_atr_min_pct': 0.0008343149158710026, 'sideways_atr_max_pct': 0.09807259238030634, 'sideways_tp_mult': 2.4064601160341805, 'sideways_tsl_mult': 0.9237860447697932, 'sideways_time_stop': 18, 'sideways_use_sma': True, 'sideways_use_ema': True, 'sideways_use_atr': True, 'sideways_use_adx': False, 'sideways_use_spike': True, 'sideways_rsi_required': False}.
[I 2025-08-30 15:08:56,218] Trial 374 finished with values: [-1000000000.0, 1000000000.0] and parameters: {'p_sma': 7, 'p_std': 57, 'p_atr': 16, 'p_adx': 26, 'rsi_period': 78, 'ema1': 30, 'ema2': 22, 'slip_atr_k': 0.05528356744652232, 'slip_spread_k': 0.5680156380135409, 'spread_hl_frac': 0.04342172344985533, 'bb_std_mult': 3.5454172421753967, 'rsi_os': 25, 'rsi_ob': 75, 'vol_spike': 0.1748170859555076, 'adx_thresh': 28.426202582183706, 'atr_min_pct': 0.014429104858605078, 'atr_max_pct': 0.08716825939567398, 'tp_mult': 1.648894422772961, 'tsl_mult': 0.07854531961422796, 'strategy': 'breakout', 'time_stop': 129, 'use_sma': False, 'use_atr': False, 'use_adx': False, 'use_ema': True, 'use_spike': True, 'rsi_required': True, 'edge_k': 0.9669199605948657, 'edge_cap': 0.5903119385484181, 'bull_strategy': 'mean_reversion', 'bull_bb_std_mult': 2.8842996502447074, 'bull_rsi_os': 30, 'bull_rsi_ob': 90, 'bull_adx_thresh': 21.7498407100545, 'bull_atr_min_pct': 0.007777806393560481, 'bull_atr_max_pct': 0.07103719473228311, 'bull_tp_mult': 1.8234034117230575, 'bull_tsl_mult': 0.6054463095887451, 'bull_time_stop': 165, 'bull_use_sma': False, 'bull_use_ema': False, 'bull_use_atr': False, 'bull_use_adx': False, 'bull_use_spike': False, 'bull_rsi_required': False, 'bear_strategy': 'mean_reversion', 'bear_bb_std_mult': 0.553146739565963, 'bear_rsi_os': 6, 'bear_rsi_ob': 76, 'bear_adx_thresh': 28.903395941535006, 'bear_atr_min_pct': 0.01914623610564634, 'bear_atr_max_pct': 0.14058428941100945, 'bear_tp_mult': 2.875699635097482, 'bear_tsl_mult': 0.09463510648957885, 'bear_time_stop': 76, 'bear_use_sma': True, 'bear_use_ema': True, 'bear_use_atr': True, 'bear_use_adx': False, 'bear_use_spike': False, 'bear_rsi_required': True, 'sideways_strategy': 'breakout', 'sideways_bb_std_mult': 1.7047728314068262, 'sideways_rsi_os': 41, 'sideways_rsi_ob': 59, 'sideways_adx_thresh': 26.79877023872798, 'sideways_atr_min_pct': 0.024993865771400677, 'sideways_atr_max_pct': 0.09847181476502825, 'sideways_tp_mult': 2.3792051495034032, 'sideways_tsl_mult': 0.28593913044530095, 'sideways_time_stop': 19, 'sideways_use_sma': False, 'sideways_use_ema': True, 'sideways_use_atr': True, 'sideways_use_adx': False, 'sideways_use_spike': False, 'sideways_rsi_required': False}.
[I 2025-08-30 15:08:56,573] Trial 375 finished with values: [-1000000000.0, 1000000000.0] and parameters: {'p_sma': 7, 'p_std': 57, 'p_atr': 16, 'p_adx': 26, 'rsi_period': 83, 'ema1': 30, 'ema2': 22, 'slip_atr_k': 0.054225070607359614, 'slip_spread_k': 0.5643798091381012, 'spread_hl_frac': 0.025379913247336846, 'bb_std_mult': 3.5420905566133944, 'rsi_os': 26, 'rsi_ob': 75, 'vol_spike': 0.17625166016525387, 'adx_thresh': 28.406501406695742, 'atr_min_pct': 0.014592529412461757, 'atr_max_pct': 0.08681897912348663, 'tp_mult': 1.6573150953433735, 'tsl_mult': 0.08741089358010878, 'strategy': 'breakout', 'time_stop': 114, 'use_sma': False, 'use_atr': False, 'use_adx': False, 'use_ema': True, 'use_spike': True, 'rsi_required': True, 'edge_k': 0.9681914326381269, 'edge_cap': 0.5897147817485311, 'bull_strategy': 'mean_reversion', 'bull_bb_std_mult': 2.656010413641359, 'bull_rsi_os': 30, 'bull_rsi_ob': 90, 'bull_adx_thresh': 21.681818494067798, 'bull_atr_min_pct': 0.007706296439352433, 'bull_atr_max_pct': 0.07103559387466186, 'bull_tp_mult': 1.8208006062148783, 'bull_tsl_mult': 0.6035488111475469, 'bull_time_stop': 134, 'bull_use_sma': False, 'bull_use_ema': False, 'bull_use_atr': False, 'bull_use_adx': False, 'bull_use_spike': False, 'bull_rsi_required': False, 'bear_strategy': 'mean_reversion', 'bear_bb_std_mult': 0.5404785928314088, 'bear_rsi_os': 6, 'bear_rsi_ob': 80, 'bear_adx_thresh': 28.944249448675848, 'bear_atr_min_pct': 0.019336537794742207, 'bear_atr_max_pct': 0.14548979108237858, 'bear_tp_mult': 1.4275518216085137, 'bear_tsl_mult': 0.10180918284045604, 'bear_time_stop': 76, 'bear_use_sma': True, 'bear_use_ema': True, 'bear_use_atr': True, 'bear_use_adx': False, 'bear_use_spike': False, 'bear_rsi_required': True, 'sideways_strategy': 'breakout', 'sideways_bb_std_mult': 1.712123051631822, 'sideways_rsi_os': 43, 'sideways_rsi_ob': 61, 'sideways_adx_thresh': 26.70995496317074, 'sideways_atr_min_pct': 0.020521223602556274, 'sideways_atr_max_pct': 0.09710168624041171, 'sideways_tp_mult': 2.378801648529387, 'sideways_tsl_mult': 0.8835859532473658, 'sideways_time_stop': 19, 'sideways_use_sma': False, 'sideways_use_ema': True, 'sideways_use_atr': True, 'sideways_use_adx': False, 'sideways_use_spike': False, 'sideways_rsi_required': False}.
[I 2025-08-30 15:08:56,894] Trial 376 finished with values: [-1000000000.0, 1000000000.0] and parameters: {'p_sma': 7, 'p_std': 57, 'p_atr': 16, 'p_adx': 26, 'rsi_period': 82, 'ema1': 17, 'ema2': 19, 'slip_atr_k': 0.07227237911827392, 'slip_spread_k': 0.610699275491984, 'spread_hl_frac': 0.025313435795128115, 'bb_std_mult': 3.5911749084224533, 'rsi_os': 26, 'rsi_ob': 72, 'vol_spike': 0.17466061376053393, 'adx_thresh': 28.480518680498175, 'atr_min_pct': 0.013630882161481266, 'atr_max_pct': 0.0856744220650342, 'tp_mult': 1.6491966380488852, 'tsl_mult': 0.09303212426126505, 'strategy': 'breakout', 'time_stop': 114, 'use_sma': False, 'use_atr': False, 'use_adx': False, 'use_ema': True, 'use_spike': True, 'rsi_required': True, 'edge_k': 0.9531117006728514, 'edge_cap': 0.5823976930078283, 'bull_strategy': 'mean_reversion', 'bull_bb_std_mult': 2.487713495851469, 'bull_rsi_os': 31, 'bull_rsi_ob': 90, 'bull_adx_thresh': 23.736793159217957, 'bull_atr_min_pct': 0.023279429073701258, 'bull_atr_max_pct': 0.07153995577250503, 'bull_tp_mult': 1.818559935933703, 'bull_tsl_mult': 0.3952619702189438, 'bull_time_stop': 165, 'bull_use_sma': False, 'bull_use_ema': False, 'bull_use_atr': False, 'bull_use_adx': False, 'bull_use_spike': False, 'bull_rsi_required': False, 'bear_strategy': 'mean_reversion', 'bear_bb_std_mult': 0.567473132565551, 'bear_rsi_os': 7, 'bear_rsi_ob': 79, 'bear_adx_thresh': 11.546792321247718, 'bear_atr_min_pct': 0.008540712040765525, 'bear_atr_max_pct': 0.07630304901238466, 'bear_tp_mult': 1.4149415959390421, 'bear_tsl_mult': 0.06243173070002978, 'bear_time_stop': 72, 'bear_use_sma': True, 'bear_use_ema': True, 'bear_use_atr': True, 'bear_use_adx': False, 'bear_use_spike': False, 'bear_rsi_required': True, 'sideways_strategy': 'breakout', 'sideways_bb_std_mult': 1.701341265883451, 'sideways_rsi_os': 41, 'sideways_rsi_ob': 58, 'sideways_adx_thresh': 26.736469977744274, 'sideways_atr_min_pct': 0.0246523098091116, 'sideways_atr_max_pct': 0.10951019513654264, 'sideways_tp_mult': 2.378790717983031, 'sideways_tsl_mult': 0.6899662211644754, 'sideways_time_stop': 18, 'sideways_use_sma': False, 'sideways_use_ema': True, 'sideways_use_atr': True, 'sideways_use_adx': False, 'sideways_use_spike': False, 'sideways_rsi_required': False}.
[I 2025-08-30 15:08:57,379] Trial 377 finished with values: [-1000000000.0, 1000000000.0] and parameters: {'p_sma': 8, 'p_std': 57, 'p_atr': 16, 'p_adx': 26, 'rsi_period': 82, 'ema1': 30, 'ema2': 22, 'slip_atr_k': 0.044547098675153246, 'slip_spread_k': 0.5742806235903137, 'spread_hl_frac': 0.03059116458168784, 'bb_std_mult': 3.5376484167150193, 'rsi_os': 22, 'rsi_ob': 72, 'vol_spike': 0.17615782508779632, 'adx_thresh': 27.09476201454061, 'atr_min_pct': 0.014482231103069109, 'atr_max_pct': 0.08522715556148504, 'tp_mult': 1.579557282694497, 'tsl_mult': 0.06798657872473425, 'strategy': 'breakout', 'time_stop': 114, 'use_sma': False, 'use_atr': False, 'use_adx': False, 'use_ema': True, 'use_spike': True, 'rsi_required': True, 'edge_k': 0.9359061967842628, 'edge_cap': 0.5790268800489502, 'bull_strategy': 'mean_reversion', 'bull_bb_std_mult': 2.5183616257390558, 'bull_rsi_os': 30, 'bull_rsi_ob': 91, 'bull_adx_thresh': 23.609982788501615, 'bull_atr_min_pct': 0.007071018604910105, 'bull_atr_max_pct': 0.06505874509527207, 'bull_tp_mult': 1.8114907373046767, 'bull_tsl_mult': 0.0031320279247612492, 'bull_time_stop': 165, 'bull_use_sma': False, 'bull_use_ema': False, 'bull_use_atr': False, 'bull_use_adx': False, 'bull_use_spike': False, 'bull_rsi_required': False, 'bear_strategy': 'mean_reversion', 'bear_bb_std_mult': 0.5591803810560259, 'bear_rsi_os': 7, 'bear_rsi_ob': 79, 'bear_adx_thresh': 29.003044760456536, 'bear_atr_min_pct': 0.008575388365098389, 'bear_atr_max_pct': 0.01482916755504602, 'bear_tp_mult': 1.4241133125114909, 'bear_tsl_mult': 0.09399909537366877, 'bear_time_stop': 74, 'bear_use_sma': True, 'bear_use_ema': True, 'bear_use_atr': True, 'bear_use_adx': False, 'bear_use_spike': False, 'bear_rsi_required': True, 'sideways_strategy': 'breakout', 'sideways_bb_std_mult': 2.0119852508794733, 'sideways_rsi_os': 49, 'sideways_rsi_ob': 58, 'sideways_adx_thresh': 26.61942211098009, 'sideways_atr_min_pct': 0.021878185883494942, 'sideways_atr_max_pct': 0.10785261863207653, 'sideways_tp_mult': 2.374296189191455, 'sideways_tsl_mult': 0.5889256327093991, 'sideways_time_stop': 97, 'sideways_use_sma': False, 'sideways_use_ema': True, 'sideways_use_atr': True, 'sideways_use_adx': False, 'sideways_use_spike': False, 'sideways_rsi_required': False}.
