[I 2025-08-30 16:39:19,387] Trial 828 finished with values: [-1000000000.0, 1000000000.0] and parameters: {'p_sma': 5, 'p_std': 16, 'p_atr': 26, 'p_adx': 18, 'rsi_period': 75, 'ema1': 23, 'ema2': 14, 'slip_atr_k': 0.21315469151492344, 'slip_spread_k': 0.4142165959777091, 'spread_hl_frac': 0.02612405865407857, 'bb_std_mult': 2.3328708453831593, 'rsi_os': 8, 'rsi_ob': 73, 'vol_spike': 0.14469634499514483, 'adx_thresh': 27.020870838931746, 'atr_min_pct': 0.015547218263534102, 'atr_max_pct': 0.020913609261885763, 'tp_mult': 1.7269056658756374, 'tsl_mult': 0.15705319507947316, 'strategy': 'mean_reversion', 'time_stop': 232, 'use_sma': True, 'use_atr': True, 'use_adx': False, 'use_ema': True, 'use_spike': False, 'rsi_required': False, 'edge_k': 0.47732979824322297, 'edge_cap': 0.43613670802401155, 'bull_strategy': 'breakout', 'bull_bb_std_mult': 0.915787350347472, 'bull_rsi_os': 41, 'bull_rsi_ob': 80, 'bull_adx_thresh': 23.96533189787837, 'bull_atr_min_pct': 0.020242038785624025, 'bull_atr_max_pct': 0.09755989559916314, 'bull_tp_mult': 2.0562713691824017, 'bull_tsl_mult': 0.017410251768270685, 'bull_time_stop': 5, 'bull_use_sma': True, 'bull_use_ema': True, 'bull_use_atr': True, 'bull_use_adx': True, 'bull_use_spike': True, 'bull_rsi_required': True, 'bear_strategy': 'mean_reversion', 'bear_bb_std_mult': 2.5657230873610297, 'bear_rsi_os': 31, 'bear_rsi_ob': 61, 'bear_adx_thresh': 24.340889394948732, 'bear_atr_min_pct': 0.020124506683549506, 'bear_atr_max_pct': 0.09038775889750358, 'bear_tp_mult': 2.7777927761952936, 'bear_tsl_mult': 0.6592468582040925, 'bear_time_stop': 229, 'bear_use_sma': False, 'bear_use_ema': False, 'bear_use_atr': True, 'bear_use_adx': True, 'bear_use_spike': True, 'bear_rsi_required': True, 'sideways_strategy': 'breakout', 'sideways_bb_std_mult': 0.9806713174064021, 'sideways_rsi_os': 19, 'sideways_rsi_ob': 60, 'sideways_adx_thresh': 23.273100423471927, 'sideways_atr_min_pct': 0.011131473478949744, 'sideways_atr_max_pct': 0.10050676575381214, 'sideways_tp_mult': 2.9664927118788893, 'sideways_tsl_mult': 0.9560767408742248, 'sideways_time_stop': 277, 'sideways_use_sma': False, 'sideways_use_ema': False, 'sideways_use_atr': False, 'sideways_use_adx': True, 'sideways_use_spike': False, 'sideways_rsi_required': True}.
[I 2025-08-30 16:39:19,646] Trial 829 finished with values: [-1000000000.0, 1000000000.0] and parameters: {'p_sma': 5, 'p_std': 56, 'p_atr': 11, 'p_adx': 11, 'rsi_period': 78, 'ema1': 23, 'ema2': 31, 'slip_atr_k': 0.05871573482759729, 'slip_spread_k': 0.4870686372389595, 'spread_hl_frac': 0.02009510126490329, 'bb_std_mult': 2.317348529259007, 'rsi_os': 40, 'rsi_ob': 73, 'vol_spike': 0.16208695776786639, 'adx_thresh': 31.906210316163005, 'atr_min_pct': 0.0022060046772336504, 'atr_max_pct': 0.020668278952194252, 'tp_mult': 2.797919328294964, 'tsl_mult': 0.17527252940138702, 'strategy': 'mean_reversion', 'time_stop': 67, 'use_sma': True, 'use_atr': True, 'use_adx': False, 'use_ema': True, 'use_spike': False, 'rsi_required': False, 'edge_k': 0.4128791994925096, 'edge_cap': 0.655094872699975, 'bull_strategy': 'breakout', 'bull_bb_std_mult': 0.9793106856920033, 'bull_rsi_os': 41, 'bull_rsi_ob': 56, 'bull_adx_thresh': 23.138794156783845, 'bull_atr_min_pct': 0.018354692469204573, 'bull_atr_max_pct': 0.0981841565455278, 'bull_tp_mult': 2.06783655537253, 'bull_tsl_mult': 0.13167467467767602, 'bull_time_stop': 240, 'bull_use_sma': True, 'bull_use_ema': True, 'bull_use_atr': True, 'bull_use_adx': True, 'bull_use_spike': True, 'bull_rsi_required': True, 'bear_strategy': 'mean_reversion', 'bear_bb_std_mult': 2.5492808256541837, 'bear_rsi_os': 31, 'bear_rsi_ob': 52, 'bear_adx_thresh': 24.350840884782933, 'bear_atr_min_pct': 0.020106714667622146, 'bear_atr_max_pct': 0.0682838161893418, 'bear_tp_mult': 2.8748055156726884, 'bear_tsl_mult': 0.165165770046594, 'bear_time_stop': 227, 'bear_use_sma': False, 'bear_use_ema': False, 'bear_use_atr': True, 'bear_use_adx': True, 'bear_use_spike': True, 'bear_rsi_required': True, 'sideways_strategy': 'breakout', 'sideways_bb_std_mult': 1.4123386333601715, 'sideways_rsi_os': 19, 'sideways_rsi_ob': 73, 'sideways_adx_thresh': 33.458989542409455, 'sideways_atr_min_pct': 0.001066510627620356, 'sideways_atr_max_pct': 0.10081595170451929, 'sideways_tp_mult': 2.9654348638201222, 'sideways_tsl_mult': 0.8687730154046637, 'sideways_time_stop': 54, 'sideways_use_sma': False, 'sideways_use_ema': False, 'sideways_use_atr': False, 'sideways_use_adx': True, 'sideways_use_spike': True, 'sideways_rsi_required': True}.
[I 2025-08-30 16:39:21,019] Trial 830 finished with values: [-1000000000.0, 1000000000.0] and parameters: {'p_sma': 8, 'p_std': 33, 'p_atr': 9, 'p_adx': 11, 'rsi_period': 52, 'ema1': 7, 'ema2': 30, 'slip_atr_k': 0.17239344986445776, 'slip_spread_k': 0.3545645853773406, 'spread_hl_frac': 0.022166445807387566, 'bb_std_mult': 2.3397121924476303, 'rsi_os': 40, 'rsi_ob': 46, 'vol_spike': 0.16292245289614304, 'adx_thresh': 30.56427072463233, 'atr_min_pct': 0.016165738072760314, 'atr_max_pct': 0.11139432516220871, 'tp_mult': 1.7248765081876642, 'tsl_mult': 0.38165619108206894, 'strategy': 'mean_reversion', 'time_stop': 81, 'use_sma': True, 'use_atr': True, 'use_adx': True, 'use_ema': True, 'use_spike': True, 'rsi_required': False, 'edge_k': 0.412680517112626, 'edge_cap': 0.6015829264237365, 'bull_strategy': 'breakout', 'bull_bb_std_mult': 0.999422216110915, 'bull_rsi_os': 43, 'bull_rsi_ob': 65, 'bull_adx_thresh': 6.990612908440379, 'bull_atr_min_pct': 0.0015125983094824071, 'bull_atr_max_pct': 0.0970115555122395, 'bull_tp_mult': 2.0869229775617257, 'bull_tsl_mult': 0.13433217836991573, 'bull_time_stop': 42, 'bull_use_sma': True, 'bull_use_ema': True, 'bull_use_atr': True, 'bull_use_adx': True, 'bull_use_spike': True, 'bull_rsi_required': True, 'bear_strategy': 'mean_reversion', 'bear_bb_std_mult': 2.554552536641816, 'bear_rsi_os': 49, 'bear_rsi_ob': 81, 'bear_adx_thresh': 29.646249630996532, 'bear_atr_min_pct': 0.020679197708659315, 'bear_atr_max_pct': 0.10288450739893404, 'bear_tp_mult': 2.8820640664752575, 'bear_tsl_mult': 0.11894508805639514, 'bear_time_stop': 279, 'bear_use_sma': False, 'bear_use_ema': False, 'bear_use_atr': False, 'bear_use_adx': True, 'bear_use_spike': True, 'bear_rsi_required': True, 'sideways_strategy': 'breakout', 'sideways_bb_std_mult': 0.7762049948049863, 'sideways_rsi_os': 27, 'sideways_rsi_ob': 63, 'sideways_adx_thresh': 23.33421156275079, 'sideways_atr_min_pct': 0.011054577133342161, 'sideways_atr_max_pct': 0.1007614634181111, 'sideways_tp_mult': 2.8528929215191097, 'sideways_tsl_mult': 0.8099539900860586, 'sideways_time_stop': 287, 'sideways_use_sma': True, 'sideways_use_ema': False, 'sideways_use_atr': False, 'sideways_use_adx': True, 'sideways_use_spike': True, 'sideways_rsi_required': True}.
[I 2025-08-30 16:39:21,845] Trial 832 finished with values: [-1000000000.0, 1000000000.0] and parameters: {'p_sma': 6, 'p_std': 6, 'p_atr': 11, 'p_adx': 11, 'rsi_period': 53, 'ema1': 24, 'ema2': 41, 'slip_atr_k': 0.05895245289815765, 'slip_spread_k': 0.1631594115722629, 'spread_hl_frac': 0.005267482436677309, 'bb_std_mult': 2.365211320964405, 'rsi_os': 38, 'rsi_ob': 46, 'vol_spike': 0.16735913547485315, 'adx_thresh': 14.249107721681908, 'atr_min_pct': 0.01630614449438986, 'atr_max_pct': 0.07203663934582506, 'tp_mult': 1.2525577949040292, 'tsl_mult': 0.13743975885436904, 'strategy': 'mean_reversion', 'time_stop': 79, 'use_sma': True, 'use_atr': True, 'use_adx': True, 'use_ema': True, 'use_spike': True, 'rsi_required': False, 'edge_k': 0.4144877603244737, 'edge_cap': 0.5893438764837116, 'bull_strategy': 'breakout', 'bull_bb_std_mult': 1.0002189317578123, 'bull_rsi_os': 25, 'bull_rsi_ob': 64, 'bull_adx_thresh': 18.408689120339865, 'bull_atr_min_pct': 0.022200995913251045, 'bull_atr_max_pct': 0.05026837670954101, 'bull_tp_mult': 1.105952595770637, 'bull_tsl_mult': 0.07133522650250701, 'bull_time_stop': 42, 'bull_use_sma': True, 'bull_use_ema': True, 'bull_use_atr': True, 'bull_use_adx': True, 'bull_use_spike': False, 'bull_rsi_required': True, 'bear_strategy': 'mean_reversion', 'bear_bb_std_mult': 2.8062192973437234, 'bear_rsi_os': 21, 'bear_rsi_ob': 94, 'bear_adx_thresh': 15.059810698000462, 'bear_atr_min_pct': 0.020803363065456368, 'bear_atr_max_pct': 0.06778515243298613, 'bear_tp_mult': 2.8662366607337355, 'bear_tsl_mult': 0.1651372205560444, 'bear_time_stop': 293, 'bear_use_sma': False, 'bear_use_ema': False, 'bear_use_atr': False, 'bear_use_adx': True, 'bear_use_spike': True, 'bear_rsi_required': True, 'sideways_strategy': 'breakout', 'sideways_bb_std_mult': 0.8045011465276042, 'sideways_rsi_os': 41, 'sideways_rsi_ob': 63, 'sideways_adx_thresh': 10.949867090767574, 'sideways_atr_min_pct': 0.002565473019655585, 'sideways_atr_max_pct': 0.10666593312637604, 'sideways_tp_mult': 1.9637966019054718, 'sideways_tsl_mult': 0.963835255816058, 'sideways_time_stop': 80, 'sideways_use_sma': True, 'sideways_use_ema': True, 'sideways_use_atr': False, 'sideways_use_adx': True, 'sideways_use_spike': True, 'sideways_rsi_required': True}.
[I 2025-08-30 16:39:21,904] Trial 833 finished with values: [-1000000000.0, 1000000000.0] and parameters: {'p_sma': 8, 'p_std': 44, 'p_atr': 19, 'p_adx': 9, 'rsi_period': 54, 'ema1': 5, 'ema2': 30, 'slip_atr_k': 0.07416115391315833, 'slip_spread_k': 0.16584906694493787, 'spread_hl_frac': 0.022327839378650093, 'bb_std_mult': 2.969001485970922, 'rsi_os': 38, 'rsi_ob': 46, 'vol_spike': 0.16982584908310683, 'adx_thresh': 16.54826470314409, 'atr_min_pct': 0.008006750974225466, 'atr_max_pct': 0.08955265054245132, 'tp_mult': 1.9091125698764857, 'tsl_mult': 0.37793823423350614, 'strategy': 'mean_reversion', 'time_stop': 223, 'use_sma': True, 'use_atr': True, 'use_adx': True, 'use_ema': True, 'use_spike': True, 'rsi_required': False, 'edge_k': 0.547914618432152, 'edge_cap': 0.6040223735387575, 'bull_strategy': 'breakout', 'bull_bb_std_mult': 2.225304656594521, 'bull_rsi_os': 43, 'bull_rsi_ob': 65, 'bull_adx_thresh': 11.27773282217954, 'bull_atr_min_pct': 0.0015771276095333, 'bull_atr_max_pct': 0.03582567068364219, 'bull_tp_mult': 2.018056374868965, 'bull_tsl_mult': 0.9235733426870554, 'bull_time_stop': 42, 'bull_use_sma': True, 'bull_use_ema': True, 'bull_use_atr': True, 'bull_use_adx': True, 'bull_use_spike': False, 'bull_rsi_required': True, 'bear_strategy': 'mean_reversion', 'bear_bb_std_mult': 2.54292677409557, 'bear_rsi_os': 35, 'bear_rsi_ob': 68, 'bear_adx_thresh': 29.737176242082988, 'bear_atr_min_pct': 0.014526268078730437, 'bear_atr_max_pct': 0.14955945975236734, 'bear_tp_mult': 2.856400125333099, 'bear_tsl_mult': 0.5985706513675804, 'bear_time_stop': 277, 'bear_use_sma': False, 'bear_use_ema': False, 'bear_use_atr': False, 'bear_use_adx': True, 'bear_use_spike': True, 'bear_rsi_required': True, 'sideways_strategy': 'breakout', 'sideways_bb_std_mult': 0.8132081185694855, 'sideways_rsi_os': 41, 'sideways_rsi_ob': 61, 'sideways_adx_thresh': 18.14345172991359, 'sideways_atr_min_pct': 0.0026663447519216345, 'sideways_atr_max_pct': 0.10791880636947362, 'sideways_tp_mult': 2.9093891019258846, 'sideways_tsl_mult': 0.43508404804675826, 'sideways_time_stop': 287, 'sideways_use_sma': True, 'sideways_use_ema': True, 'sideways_use_atr': False, 'sideways_use_adx': True, 'sideways_use_spike': True, 'sideways_rsi_required': True}.
[I 2025-08-30 16:40:01,204] Trial 831 finished with values: [-0.03743664136979774, 0.03733797169122475] and parameters: {'p_sma': 8, 'p_std': 55, 'p_atr': 24, 'p_adx': 11, 'rsi_period': 75, 'ema1': 5, 'ema2': 31, 'slip_atr_k': 0.1740353920430262, 'slip_spread_k': 0.9963173879193135, 'spread_hl_frac': 0.04748952379176348, 'bb_std_mult': 2.3259753227959252, 'rsi_os': 37, 'rsi_ob': 66, 'vol_spike': 0.16999379700628497, 'adx_thresh': 32.366770423273216, 'atr_min_pct': 0.002422749576265641, 'atr_max_pct': 0.02010474201774723, 'tp_mult': 1.7016783918021896, 'tsl_mult': 0.4868845182804037, 'strategy': 'mean_reversion', 'time_stop': 229, 'use_sma': True, 'use_atr': True, 'use_adx': True, 'use_ema': True, 'use_spike': True, 'rsi_required': False, 'edge_k': 0.8142769992721338, 'edge_cap': 0.6317409426183695, 'bull_strategy': 'breakout', 'bull_bb_std_mult': 1.0115837380435986, 'bull_rsi_os': 43, 'bull_rsi_ob': 64, 'bull_adx_thresh': 25.422925598541177, 'bull_atr_min_pct': 0.023559635333544354, 'bull_atr_max_pct': 0.09656976451099925, 'bull_tp_mult': 2.609378306741286, 'bull_tsl_mult': 0.01862490595403149, 'bull_time_stop': 42, 'bull_use_sma': True, 'bull_use_ema': True, 'bull_use_atr': True, 'bull_use_adx': True, 'bull_use_spike': True, 'bull_rsi_required': True, 'bear_strategy': 'mean_reversion', 'bear_bb_std_mult': 2.5467316602982644, 'bear_rsi_os': 19, 'bear_rsi_ob': 71, 'bear_adx_thresh': 29.656194599915466, 'bear_atr_min_pct': 0.02066958520456936, 'bear_atr_max_pct': 0.14751263977943593, 'bear_tp_mult': 1.2716737414278043, 'bear_tsl_mult': 0.1507779193573858, 'bear_time_stop': 279, 'bear_use_sma': False, 'bear_use_ema': False, 'bear_use_atr': False, 'bear_use_adx': True, 'bear_use_spike': True, 'bear_rsi_required': True, 'sideways_strategy': 'breakout', 'sideways_bb_std_mult': 0.61211434595636, 'sideways_rsi_os': 41, 'sideways_rsi_ob': 75, 'sideways_adx_thresh': 14.150837872854947, 'sideways_atr_min_pct': 0.0005433439820314987, 'sideways_atr_max_pct': 0.05728677808210739, 'sideways_tp_mult': 2.9616495248564267, 'sideways_tsl_mult': 0.6350926629662709, 'sideways_time_stop': 81, 'sideways_use_sma': True, 'sideways_use_ema': True, 'sideways_use_atr': False, 'sideways_use_adx': True, 'sideways_use_spike': True, 'sideways_rsi_required': True}.
[I 2025-08-30 16:40:05,655] Trial 834 finished with values: [-1000000000.0, 1000000000.0] and parameters: {'p_sma': 28, 'p_std': 47, 'p_atr': 24, 'p_adx': 12, 'rsi_period': 55, 'ema1': 10, 'ema2': 60, 'slip_atr_k': 0.08248027815065313, 'slip_spread_k': 0.7805324694936573, 'spread_hl_frac': 0.04780612246538348, 'bb_std_mult': 2.3847352308000374, 'rsi_os': 7, 'rsi_ob': 89, 'vol_spike': 0.17375477362706304, 'adx_thresh': 23.427266174855077, 'atr_min_pct': 0.021599059897614806, 'atr_max_pct': 0.054848784571416356, 'tp_mult': 1.688505109370244, 'tsl_mult': 0.14174060952451187, 'strategy': 'mean_reversion', 'time_stop': 222, 'use_sma': True, 'use_atr': True, 'use_adx': True, 'use_ema': True, 'use_spike': True, 'rsi_required': False, 'edge_k': 0.547006033215657, 'edge_cap': 0.8065783007176913, 'bull_strategy': 'breakout', 'bull_bb_std_mult': 1.2862179548849935, 'bull_rsi_os': 26, 'bull_rsi_ob': 64, 'bull_adx_thresh': 25.379291336622117, 'bull_atr_min_pct': 0.02348420255468434, 'bull_atr_max_pct': 0.03450350763043998, 'bull_tp_mult': 2.62072957301372, 'bull_tsl_mult': 0.7670463849632153, 'bull_time_stop': 13, 'bull_use_sma': True, 'bull_use_ema': True, 'bull_use_atr': True, 'bull_use_adx': True, 'bull_use_spike': False, 'bull_rsi_required': True, 'bear_strategy': 'mean_reversion', 'bear_bb_std_mult': 3.0073312611488907, 'bear_rsi_os': 30, 'bear_rsi_ob': 90, 'bear_adx_thresh': 28.195829322112896, 'bear_atr_min_pct': 0.022131347955588652, 'bear_atr_max_pct': 0.07796266087657655, 'bear_tp_mult': 2.7228494457703443, 'bear_tsl_mult': 0.5113526279252811, 'bear_time_stop': 295, 'bear_use_sma': False, 'bear_use_ema': False, 'bear_use_atr': False, 'bear_use_adx': True, 'bear_use_spike': True, 'bear_rsi_required': True, 'sideways_strategy': 'breakout', 'sideways_bb_std_mult': 0.5736361478121611, 'sideways_rsi_os': 41, 'sideways_rsi_ob': 63, 'sideways_adx_thresh': 24.288825950226958, 'sideways_atr_min_pct': 0.012262798184712587, 'sideways_atr_max_pct': 0.10745398831598986, 'sideways_tp_mult': 2.9005235317741844, 'sideways_tsl_mult': 0.9438559215803854, 'sideways_time_stop': 248, 'sideways_use_sma': True, 'sideways_use_ema': True, 'sideways_use_atr': False, 'sideways_use_adx': True, 'sideways_use_spike': True, 'sideways_rsi_required': True}.
[I 2025-08-30 16:40:07,544] Trial 837 finished with values: [-1000000000.0, 1000000000.0] and parameters: {'p_sma': 19, 'p_std': 47, 'p_atr': 10, 'p_adx': 12, 'rsi_period': 30, 'ema1': 21, 'ema2': 32, 'slip_atr_k': 0.08356236718620355, 'slip_spread_k': 0.20727003941000946, 'spread_hl_frac': 0.0254097302212306, 'bb_std_mult': 2.401743757999165, 'rsi_os': 50, 'rsi_ob': 57, 'vol_spike': 0.17686891090867304, 'adx_thresh': 25.171676938165902, 'atr_min_pct': 0.014822987958087216, 'atr_max_pct': 0.12611529926803688, 'tp_mult': 1.7592550403228386, 'tsl_mult': 0.3183603263832437, 'strategy': 'mean_reversion', 'time_stop': 296, 'use_sma': True, 'use_atr': True, 'use_adx': False, 'use_ema': True, 'use_spike': True, 'rsi_required': False, 'edge_k': 0.5219414017871598, 'edge_cap': 0.5563620810002584, 'bull_strategy': 'breakout', 'bull_bb_std_mult': 1.8482556506384056, 'bull_rsi_os': 40, 'bull_rsi_ob': 70, 'bull_adx_thresh': 22.45496756882458, 'bull_atr_min_pct': 0.016706479829748464, 'bull_atr_max_pct': 0.0885987762999198, 'bull_tp_mult': 2.0216694179388193, 'bull_tsl_mult': 0.1676631789688119, 'bull_time_stop': 16, 'bull_use_sma': True, 'bull_use_ema': True, 'bull_use_atr': True, 'bull_use_adx': True, 'bull_use_spike': True, 'bull_rsi_required': True, 'bear_strategy': 'breakout', 'bear_bb_std_mult': 1.79655562086869, 'bear_rsi_os': 30, 'bear_rsi_ob': 66, 'bear_adx_thresh': 27.89241228386755, 'bear_atr_min_pct': 0.0075058106496063105, 'bear_atr_max_pct': 0.07285626770172429, 'bear_tp_mult': 2.6749477812445805, 'bear_tsl_mult': 0.5088915317845795, 'bear_time_stop': 240, 'bear_use_sma': False, 'bear_use_ema': False, 'bear_use_atr': True, 'bear_use_adx': True, 'bear_use_spike': True, 'bear_rsi_required': False, 'sideways_strategy': 'breakout', 'sideways_bb_std_mult': 1.0762948207971559, 'sideways_rsi_os': 40, 'sideways_rsi_ob': 85, 'sideways_adx_thresh': 24.23420510028782, 'sideways_atr_min_pct': 0.008779898507415, 'sideways_atr_max_pct': 0.01892440295894969, 'sideways_tp_mult': 2.910085744078954, 'sideways_tsl_mult': 0.949993453038926, 'sideways_time_stop': 70, 'sideways_use_sma': True, 'sideways_use_ema': True, 'sideways_use_atr': False, 'sideways_use_adx': True, 'sideways_use_spike': True, 'sideways_rsi_required': True}.
[I 2025-08-30 16:40:08,518] Trial 835 finished with values: [-1000000000.0, 1000000000.0] and parameters: {'p_sma': 40, 'p_std': 56, 'p_atr': 24, 'p_adx': 12, 'rsi_period': 76, 'ema1': 22, 'ema2': 27, 'slip_atr_k': 0.08368675690075081, 'slip_spread_k': 0.20859396512086378, 'spread_hl_frac': 0.02305657245557447, 'bb_std_mult': 2.117855474667522, 'rsi_os': 38, 'rsi_ob': 69, 'vol_spike': 0.17534808869608193, 'adx_thresh': 5.056042343309086, 'atr_min_pct': 0.02175499599273574, 'atr_max_pct': 0.05397944471530014, 'tp_mult': 1.6829489706003136, 'tsl_mult': 0.33131483785202787, 'strategy': 'mean_reversion', 'time_stop': 224, 'use_sma': True, 'use_atr': True, 'use_adx': False, 'use_ema': True, 'use_spike': True, 'rsi_required': False, 'edge_k': 0.5482771762778315, 'edge_cap': 0.6333017043123794, 'bull_strategy': 'breakout', 'bull_bb_std_mult': 0.8547782751425131, 'bull_rsi_os': 7, 'bull_rsi_ob': 62, 'bull_adx_thresh': 25.29979497588775, 'bull_atr_min_pct': 0.020275170888316884, 'bull_atr_max_pct': 0.08846720055314214, 'bull_tp_mult': 2.024273277266428, 'bull_tsl_mult': 0.15731766479332798, 'bull_time_stop': 13, 'bull_use_sma': True, 'bull_use_ema': True, 'bull_use_atr': True, 'bull_use_adx': True, 'bull_use_spike': True, 'bull_rsi_required': True, 'bear_strategy': 'mean_reversion', 'bear_bb_std_mult': 2.778757475545073, 'bear_rsi_os': 35, 'bear_rsi_ob': 92, 'bear_adx_thresh': 25.174891529027427, 'bear_atr_min_pct': 0.02219147412515553, 'bear_atr_max_pct': 0.0781836759256874, 'bear_tp_mult': 2.559317145931182, 'bear_tsl_mult': 0.45570776163482096, 'bear_time_stop': 240, 'bear_use_sma': False, 'bear_use_ema': False, 'bear_use_atr': True, 'bear_use_adx': True, 'bear_use_spike': True, 'bear_rsi_required': True, 'sideways_strategy': 'breakout', 'sideways_bb_std_mult': 1.07764019321318, 'sideways_rsi_os': 40, 'sideways_rsi_ob': 75, 'sideways_adx_thresh': 14.157098013041551, 'sideways_atr_min_pct': 0.01231784693255909, 'sideways_atr_max_pct': 0.0522467783804883, 'sideways_tp_mult': 2.920119322754067, 'sideways_tsl_mult': 0.938441953894754, 'sideways_time_stop': 248, 'sideways_use_sma': True, 'sideways_use_ema': True, 'sideways_use_atr': False, 'sideways_use_adx': True, 'sideways_use_spike': True, 'sideways_rsi_required': True}.
