[I 2025-08-30 14:40:14,320] Trial 164 finished with values: [-1000000000.0, 1000000000.0] and parameters: {'p_sma': 31, 'p_std': 18, 'p_atr': 25, 'p_adx': 21, 'rsi_period': 52, 'ema1': 27, 'ema2': 50, 'slip_atr_k': 0.013291495051597577, 'slip_spread_k': 0.20174500449222793, 'spread_hl_frac': 0.01864337631688587, 'bb_std_mult': 2.0781667969021256, 'rsi_os': 33, 'rsi_ob': 50, 'vol_spike': 0.0857085840617549, 'adx_thresh': 5.9742860592573255, 'atr_min_pct': 0.022127663025989893, 'atr_max_pct': 0.10742921923504727, 'tp_mult': 2.621779160307116, 'tsl_mult': 0.47871525376727675, 'strategy': 'mean_reversion', 'time_stop': 169, 'use_sma': True, 'use_atr': False, 'use_adx': False, 'use_ema': False, 'use_spike': False, 'rsi_required': False, 'edge_k': 0.6453868896737399, 'edge_cap': 0.9091314039153549, 'bull_strategy': 'breakout', 'bull_bb_std_mult': 3.281100160207602, 'bull_rsi_os': 16, 'bull_rsi_ob': 94, 'bull_adx_thresh': 24.79113130016532, 'bull_atr_min_pct': 0.0035947211938442037, 'bull_atr_max_pct': 0.018067296674327167, 'bull_tp_mult': 1.550246842161222, 'bull_tsl_mult': 0.924434043292736, 'bull_time_stop': 258, 'bull_use_sma': False, 'bull_use_ema': False, 'bull_use_atr': True, 'bull_use_adx': True, 'bull_use_spike': False, 'bull_rsi_required': True, 'bear_strategy': 'breakout', 'bear_bb_std_mult': 3.2139431905375133, 'bear_rsi_os': 46, 'bear_rsi_ob': 86, 'bear_adx_thresh': 18.73636916073168, 'bear_atr_min_pct': 0.010192845357426207, 'bear_atr_max_pct': 0.1432246997413653, 'bear_tp_mult': 2.0075408074052494, 'bear_tsl_mult': 0.7600404193651333, 'bear_time_stop': 246, 'bear_use_sma': False, 'bear_use_ema': False, 'bear_use_atr': False, 'bear_use_adx': False, 'bear_use_spike': True, 'bear_rsi_required': False, 'sideways_strategy': 'breakout', 'sideways_bb_std_mult': 3.376818229388705, 'sideways_rsi_os': 33, 'sideways_rsi_ob': 87, 'sideways_adx_thresh': 18.361429783080688, 'sideways_atr_min_pct': 0.002812758515883601, 'sideways_atr_max_pct': 0.07526198851113036, 'sideways_tp_mult': 2.7977096744535, 'sideways_tsl_mult': 0.674708871347703, 'sideways_time_stop': 177, 'sideways_use_sma': False, 'sideways_use_ema': False, 'sideways_use_atr': False, 'sideways_use_adx': True, 'sideways_use_spike': True, 'sideways_rsi_required': False}.
[I 2025-08-30 14:40:44,811] Trial 165 finished with values: [-1000000000.0, 1000000000.0] and parameters: {'p_sma': 13, 'p_std': 27, 'p_atr': 25, 'p_adx': 13, 'rsi_period': 49, 'ema1': 27, 'ema2': 29, 'slip_atr_k': 0.12803027114448037, 'slip_spread_k': 0.49789452615050533, 'spread_hl_frac': 0.003592745997254469, 'bb_std_mult': 1.997304188031112, 'rsi_os': 34, 'rsi_ob': 93, 'vol_spike': 0.08450505147042926, 'adx_thresh': 20.58449328704639, 'atr_min_pct': 0.019002027943663402, 'atr_max_pct': 0.10775920135029685, 'tp_mult': 2.616897320325305, 'tsl_mult': 0.9318247537860883, 'strategy': 'mean_reversion', 'time_stop': 40, 'use_sma': True, 'use_atr': False, 'use_adx': False, 'use_ema': False, 'use_spike': False, 'rsi_required': False, 'edge_k': 1.6076663931436466, 'edge_cap': 0.7258560568388691, 'bull_strategy': 'breakout', 'bull_bb_std_mult': 3.2868474530867253, 'bull_rsi_os': 44, 'bull_rsi_ob': 94, 'bull_adx_thresh': 12.929035475222623, 'bull_atr_min_pct': 0.0023702463385445955, 'bull_atr_max_pct': 0.029402969623075325, 'bull_tp_mult': 2.2149353276116126, 'bull_tsl_mult': 0.5708662333897564, 'bull_time_stop': 20, 'bull_use_sma': True, 'bull_use_ema': False, 'bull_use_atr': True, 'bull_use_adx': True, 'bull_use_spike': False, 'bull_rsi_required': True, 'bear_strategy': 'breakout', 'bear_bb_std_mult': 3.2295065210503036, 'bear_rsi_os': 26, 'bear_rsi_ob': 69, 'bear_adx_thresh': 18.84198898939801, 'bear_atr_min_pct': 0.02603755573608578, 'bear_atr_max_pct': 0.10213707545790597, 'bear_tp_mult': 2.1692552368044935, 'bear_tsl_mult': 0.7352625275537239, 'bear_time_stop': 38, 'bear_use_sma': False, 'bear_use_ema': False, 'bear_use_atr': False, 'bear_use_adx': False, 'bear_use_spike': True, 'bear_rsi_required': False, 'sideways_strategy': 'breakout', 'sideways_bb_std_mult': 2.104773028424804, 'sideways_rsi_os': 33, 'sideways_rsi_ob': 87, 'sideways_adx_thresh': 18.507308957549235, 'sideways_atr_min_pct': 0.0045174185555027155, 'sideways_atr_max_pct': 0.08282779082833477, 'sideways_tp_mult': 2.81073591373982, 'sideways_tsl_mult': 0.044476805718988585, 'sideways_time_stop': 232, 'sideways_use_sma': False, 'sideways_use_ema': False, 'sideways_use_atr': False, 'sideways_use_adx': True, 'sideways_use_spike': True, 'sideways_rsi_required': False}.
[I 2025-08-30 14:40:45,193] Trial 162 finished with values: [-1000000000.0, 1000000000.0] and parameters: {'p_sma': 29, 'p_std': 51, 'p_atr': 11, 'p_adx': 23, 'rsi_period': 77, 'ema1': 19, 'ema2': 56, 'slip_atr_k': 0.1283273523038422, 'slip_spread_k': 0.21098578211702523, 'spread_hl_frac': 0.04958943918312804, 'bb_std_mult': 2.790070628979107, 'rsi_os': 36, 'rsi_ob': 88, 'vol_spike': 0.08641231973632724, 'adx_thresh': 20.658677047652194, 'atr_min_pct': 0.018310904614616718, 'atr_max_pct': 0.10760547476579739, 'tp_mult': 1.8732273010904623, 'tsl_mult': 0.4887218330480585, 'strategy': 'breakout', 'time_stop': 5, 'use_sma': True, 'use_atr': False, 'use_adx': False, 'use_ema': False, 'use_spike': False, 'rsi_required': True, 'edge_k': 1.6182534690341743, 'edge_cap': 0.7106029211860841, 'bull_strategy': 'breakout', 'bull_bb_std_mult': 3.3164141464390404, 'bull_rsi_os': 19, 'bull_rsi_ob': 80, 'bull_adx_thresh': 11.796980446731748, 'bull_atr_min_pct': 0.0036019392758398897, 'bull_atr_max_pct': 0.034203254023661735, 'bull_tp_mult': 1.5330199796810855, 'bull_tsl_mult': 0.3738311704749623, 'bull_time_stop': 19, 'bull_use_sma': False, 'bull_use_ema': False, 'bull_use_atr': True, 'bull_use_adx': True, 'bull_use_spike': True, 'bull_rsi_required': False, 'bear_strategy': 'mean_reversion', 'bear_bb_std_mult': 1.1379767151102795, 'bear_rsi_os': 13, 'bear_rsi_ob': 61, 'bear_adx_thresh': 8.621588845614445, 'bear_atr_min_pct': 0.008329367045225584, 'bear_atr_max_pct': 0.05112534455593373, 'bear_tp_mult': 2.0675031106653567, 'bear_tsl_mult': 0.16564624463060354, 'bear_time_stop': 288, 'bear_use_sma': False, 'bear_use_ema': False, 'bear_use_atr': False, 'bear_use_adx': False, 'bear_use_spike': True, 'bear_rsi_required': True, 'sideways_strategy': 'mean_reversion', 'sideways_bb_std_mult': 1.3755373828694442, 'sideways_rsi_os': 33, 'sideways_rsi_ob': 79, 'sideways_adx_thresh': 16.877048424244066, 'sideways_atr_min_pct': 0.02551940577543675, 'sideways_atr_max_pct': 0.08093542167217706, 'sideways_tp_mult': 2.611726879750755, 'sideways_tsl_mult': 0.12298907611520085, 'sideways_time_stop': 289, 'sideways_use_sma': False, 'sideways_use_ema': True, 'sideways_use_atr': False, 'sideways_use_adx': True, 'sideways_use_spike': True, 'sideways_rsi_required': True}.
[I 2025-08-30 14:40:45,545] Trial 163 finished with values: [-1000000000.0, 1000000000.0] and parameters: {'p_sma': 31, 'p_std': 22, 'p_atr': 8, 'p_adx': 21, 'rsi_period': 43, 'ema1': 27, 'ema2': 56, 'slip_atr_k': 0.1332192809446918, 'slip_spread_k': 0.39596526348600347, 'spread_hl_frac': 0.00964421855200595, 'bb_std_mult': 2.7832926766820716, 'rsi_os': 40, 'rsi_ob': 88, 'vol_spike': 0.19028492088065344, 'adx_thresh': 20.545459236287677, 'atr_min_pct': 0.02200107304469178, 'atr_max_pct': 0.10302567768960973, 'tp_mult': 1.1157328541024638, 'tsl_mult': 0.9271317633811382, 'strategy': 'breakout', 'time_stop': 40, 'use_sma': True, 'use_atr': False, 'use_adx': False, 'use_ema': False, 'use_spike': False, 'rsi_required': True, 'edge_k': 0.07629587314198505, 'edge_cap': 0.7113523851500477, 'bull_strategy': 'breakout', 'bull_bb_std_mult': 2.885118978459489, 'bull_rsi_os': 16, 'bull_rsi_ob': 80, 'bull_adx_thresh': 7.9982613271341805, 'bull_atr_min_pct': 0.004763782290304743, 'bull_atr_max_pct': 0.058414370732716256, 'bull_tp_mult': 1.3157430186041867, 'bull_tsl_mult': 0.6189284220535993, 'bull_time_stop': 267, 'bull_use_sma': False, 'bull_use_ema': False, 'bull_use_atr': True, 'bull_use_adx': True, 'bull_use_spike': True, 'bull_rsi_required': False, 'bear_strategy': 'mean_reversion', 'bear_bb_std_mult': 1.6878634979321436, 'bear_rsi_os': 51, 'bear_rsi_ob': 82, 'bear_adx_thresh': 18.73988053026913, 'bear_atr_min_pct': 0.013540478476927194, 'bear_atr_max_pct': 0.14356276625331615, 'bear_tp_mult': 2.0431292911188286, 'bear_tsl_mult': 0.17201227059214774, 'bear_time_stop': 246, 'bear_use_sma': False, 'bear_use_ema': False, 'bear_use_atr': False, 'bear_use_adx': False, 'bear_use_spike': True, 'bear_rsi_required': True, 'sideways_strategy': 'mean_reversion', 'sideways_bb_std_mult': 3.1214203155587756, 'sideways_rsi_os': 33, 'sideways_rsi_ob': 79, 'sideways_adx_thresh': 15.198525216174039, 'sideways_atr_min_pct': 0.025557704072942077, 'sideways_atr_max_pct': 0.07929791059756754, 'sideways_tp_mult': 2.6386414125133624, 'sideways_tsl_mult': 0.6690380236676582, 'sideways_time_stop': 219, 'sideways_use_sma': False, 'sideways_use_ema': True, 'sideways_use_atr': False, 'sideways_use_adx': True, 'sideways_use_spike': True, 'sideways_rsi_required': True}.
[I 2025-08-30 14:40:46,021] Trial 166 finished with values: [-1000000000.0, 1000000000.0] and parameters: {'p_sma': 13, 'p_std': 53, 'p_atr': 21, 'p_adx': 22, 'rsi_period': 49, 'ema1': 19, 'ema2': 54, 'slip_atr_k': 0.13069371443713107, 'slip_spread_k': 0.21115978425215157, 'spread_hl_frac': 0.03082691324641437, 'bb_std_mult': 2.8180876029049973, 'rsi_os': 34, 'rsi_ob': 90, 'vol_spike': 0.2518509290129202, 'adx_thresh': 20.615499723179102, 'atr_min_pct': 0.019151993611649227, 'atr_max_pct': 0.11051117707923322, 'tp_mult': 2.548606832368228, 'tsl_mult': 0.9307848448458563, 'strategy': 'breakout', 'time_stop': 38, 'use_sma': True, 'use_atr': False, 'use_adx': True, 'use_ema': False, 'use_spike': False, 'rsi_required': True, 'edge_k': 0.08452112670040579, 'edge_cap': 0.728130329844347, 'bull_strategy': 'breakout', 'bull_bb_std_mult': 0.8290242189952035, 'bull_rsi_os': 15, 'bull_rsi_ob': 80, 'bull_adx_thresh': 12.734863990622578, 'bull_atr_min_pct': 0.0023422808020545365, 'bull_atr_max_pct': 0.029114318555234733, 'bull_tp_mult': 1.398772081308941, 'bull_tsl_mult': 0.5391522101051274, 'bull_time_stop': 12, 'bull_use_sma': True, 'bull_use_ema': False, 'bull_use_atr': True, 'bull_use_adx': True, 'bull_use_spike': False, 'bull_rsi_required': True, 'bear_strategy': 'breakout', 'bear_bb_std_mult': 1.679102154498148, 'bear_rsi_os': 14, 'bear_rsi_ob': 71, 'bear_adx_thresh': 25.589696354961035, 'bear_atr_min_pct': 0.013416467634271895, 'bear_atr_max_pct': 0.04466070069957143, 'bear_tp_mult': 1.9548724034181737, 'bear_tsl_mult': 0.17204049116683398, 'bear_time_stop': 38, 'bear_use_sma': False, 'bear_use_ema': False, 'bear_use_atr': False, 'bear_use_adx': False, 'bear_use_spike': True, 'bear_rsi_required': False, 'sideways_strategy': 'breakout', 'sideways_bb_std_mult': 0.889567474511995, 'sideways_rsi_os': 29, 'sideways_rsi_ob': 88, 'sideways_adx_thresh': 17.13800250964013, 'sideways_atr_min_pct': 0.004884884689958454, 'sideways_atr_max_pct': 0.13351938577806916, 'sideways_tp_mult': 1.3539804002120066, 'sideways_tsl_mult': 0.12246765224429298, 'sideways_time_stop': 61, 'sideways_use_sma': False, 'sideways_use_ema': False, 'sideways_use_atr': False, 'sideways_use_adx': True, 'sideways_use_spike': True, 'sideways_rsi_required': True}.
[I 2025-08-30 14:40:46,412] Trial 168 finished with values: [-1000000000.0, 1000000000.0] and parameters: {'p_sma': 10, 'p_std': 25, 'p_atr': 9, 'p_adx': 22, 'rsi_period': 46, 'ema1': 28, 'ema2': 44, 'slip_atr_k': 0.0016113012006442745, 'slip_spread_k': 0.7641892165977033, 'spread_hl_frac': 0.0013639419797906475, 'bb_std_mult': 1.9268532494922102, 'rsi_os': 34, 'rsi_ob': 46, 'vol_spike': 0.2772260650059197, 'adx_thresh': 20.199258017234484, 'atr_min_pct': 0.022949884638674003, 'atr_max_pct': 0.11294421396710608, 'tp_mult': 1.3722504376304658, 'tsl_mult': 0.3918547006682939, 'strategy': 'mean_reversion', 'time_stop': 228, 'use_sma': False, 'use_atr': False, 'use_adx': True, 'use_ema': False, 'use_spike': False, 'rsi_required': False, 'edge_k': 0.5841211378937018, 'edge_cap': 0.6624519791139756, 'bull_strategy': 'breakout', 'bull_bb_std_mult': 3.1659693000837983, 'bull_rsi_os': 15, 'bull_rsi_ob': 67, 'bull_adx_thresh': 15.202442075375181, 'bull_atr_min_pct': 0.023694786790120055, 'bull_atr_max_pct': 0.02485297488189345, 'bull_tp_mult': 1.4878524095629042, 'bull_tsl_mult': 0.4877908572288978, 'bull_time_stop': 213, 'bull_use_sma': False, 'bull_use_ema': False, 'bull_use_atr': True, 'bull_use_adx': True, 'bull_use_spike': False, 'bull_rsi_required': True, 'bear_strategy': 'breakout', 'bear_bb_std_mult': 1.6978336394384517, 'bear_rsi_os': 14, 'bear_rsi_ob': 82, 'bear_adx_thresh': 17.303583732195378, 'bear_atr_min_pct': 0.02856972745078995, 'bear_atr_max_pct': 0.021538650320567797, 'bear_tp_mult': 1.9571175561493828, 'bear_tsl_mult': 0.5415635020586209, 'bear_time_stop': 60, 'bear_use_sma': False, 'bear_use_ema': True, 'bear_use_atr': True, 'bear_use_adx': False, 'bear_use_spike': False, 'bear_rsi_required': False, 'sideways_strategy': 'breakout', 'sideways_bb_std_mult': 3.1326928912975904, 'sideways_rsi_os': 37, 'sideways_rsi_ob': 70, 'sideways_adx_thresh': 15.001980545591556, 'sideways_atr_min_pct': 0.012897314868277322, 'sideways_atr_max_pct': 0.13302998560878548, 'sideways_tp_mult': 2.700170530759322, 'sideways_tsl_mult': 0.11311120618333038, 'sideways_time_stop': 111, 'sideways_use_sma': True, 'sideways_use_ema': False, 'sideways_use_atr': False, 'sideways_use_adx': True, 'sideways_use_spike': True, 'sideways_rsi_required': True}.
[I 2025-08-30 14:41:15,816] Trial 169 finished with values: [-0.021851268536698942, 0.022182222350885922] and parameters: {'p_sma': 33, 'p_std': 25, 'p_atr': 9, 'p_adx': 15, 'rsi_period': 80, 'ema1': 28, 'ema2': 50, 'slip_atr_k': 0.030856408054991097, 'slip_spread_k': 0.3037195530418042, 'spread_hl_frac': 2.0805983034413028e-05, 'bb_std_mult': 0.6046804474878711, 'rsi_os': 13, 'rsi_ob': 90, 'vol_spike': 0.1470073710655214, 'adx_thresh': 19.84534710414748, 'atr_min_pct': 0.020387894842525563, 'atr_max_pct': 0.1123883446288099, 'tp_mult': 2.1462829895411746, 'tsl_mult': 0.8164707699650849, 'strategy': 'mean_reversion', 'time_stop': 29, 'use_sma': False, 'use_atr': False, 'use_adx': True, 'use_ema': False, 'use_spike': False, 'rsi_required': False, 'edge_k': 0.5655739973964522, 'edge_cap': 0.665110202080941, 'bull_strategy': 'breakout', 'bull_bb_std_mult': 1.2372217414878244, 'bull_rsi_os': 14, 'bull_rsi_ob': 65, 'bull_adx_thresh': 15.010203422119774, 'bull_atr_min_pct': 0.002267701672013094, 'bull_atr_max_pct': 0.026176686520289903, 'bull_tp_mult': 1.4815324358399793, 'bull_tsl_mult': 0.031011415419189725, 'bull_time_stop': 216, 'bull_use_sma': True, 'bull_use_ema': False, 'bull_use_atr': False, 'bull_use_adx': False, 'bull_use_spike': False, 'bull_rsi_required': True, 'bear_strategy': 'breakout', 'bear_bb_std_mult': 1.3298409891724476, 'bear_rsi_os': 14, 'bear_rsi_ob': 46, 'bear_adx_thresh': 5.850262412198484, 'bear_atr_min_pct': 0.012373848520089267, 'bear_atr_max_pct': 0.11443348363059096, 'bear_tp_mult': 1.9546989786092854, 'bear_tsl_mult': 0.5432121863619902, 'bear_time_stop': 53, 'bear_use_sma': False, 'bear_use_ema': True, 'bear_use_atr': True, 'bear_use_adx': False, 'bear_use_spike': False, 'bear_rsi_required': False, 'sideways_strategy': 'breakout', 'sideways_bb_std_mult': 0.8683230897404701, 'sideways_rsi_os': 29, 'sideways_rsi_ob': 90, 'sideways_adx_thresh': 28.626285858875885, 'sideways_atr_min_pct': 0.0043008429253957176, 'sideways_atr_max_pct': 0.0671531947504655, 'sideways_tp_mult': 2.6833107837362578, 'sideways_tsl_mult': 0.1139010843698649, 'sideways_time_stop': 32, 'sideways_use_sma': True, 'sideways_use_ema': False, 'sideways_use_atr': False, 'sideways_use_adx': True, 'sideways_use_spike': True, 'sideways_rsi_required': True}.
[I 2025-08-30 14:41:16,099] Trial 167 finished with values: [-1000000000.0, 1000000000.0] and parameters: {'p_sma': 33, 'p_std': 51, 'p_atr': 14, 'p_adx': 22, 'rsi_period': 76, 'ema1': 19, 'ema2': 55, 'slip_atr_k': 0.13319573679069271, 'slip_spread_k': 0.21002207511080706, 'spread_hl_frac': 0.001256189518887195, 'bb_std_mult': 0.9965096241099665, 'rsi_os': 36, 'rsi_ob': 90, 'vol_spike': 0.06217134543945391, 'adx_thresh': 19.993807432779647, 'atr_min_pct': 0.018107061299430374, 'atr_max_pct': 0.11228635493276513, 'tp_mult': 2.549282713010053, 'tsl_mult': 0.7433399531708046, 'strategy': 'breakout', 'time_stop': 29, 'use_sma': False, 'use_atr': False, 'use_adx': True, 'use_ema': False, 'use_spike': False, 'rsi_required': True, 'edge_k': 0.5769886837654145, 'edge_cap': 0.7131814455458364, 'bull_strategy': 'breakout', 'bull_bb_std_mult': 0.8611512216613215, 'bull_rsi_os': 14, 'bull_rsi_ob': 80, 'bull_adx_thresh': 8.166598494964486, 'bull_atr_min_pct': 0.0046987519308176046, 'bull_atr_max_pct': 0.02498648107575296, 'bull_tp_mult': 1.4716580822144054, 'bull_tsl_mult': 0.031123890825083877, 'bull_time_stop': 267, 'bull_use_sma': False, 'bull_use_ema': False, 'bull_use_atr': True, 'bull_use_adx': True, 'bull_use_spike': False, 'bull_rsi_required': True, 'bear_strategy': 'breakout', 'bear_bb_std_mult': 1.3392593572938678, 'bear_rsi_os': 14, 'bear_rsi_ob': 82, 'bear_adx_thresh': 17.22511010668555, 'bear_atr_min_pct': 0.013450516905930496, 'bear_atr_max_pct': 0.02075451595007982, 'bear_tp_mult': 1.9487036847074537, 'bear_tsl_mult': 0.1719689035417063, 'bear_time_stop': 57, 'bear_use_sma': False, 'bear_use_ema': True, 'bear_use_atr': True, 'bear_use_adx': False, 'bear_use_spike': True, 'bear_rsi_required': False, 'sideways_strategy': 'breakout', 'sideways_bb_std_mult': 3.124875350335509, 'sideways_rsi_os': 29, 'sideways_rsi_ob': 70, 'sideways_adx_thresh': 15.291196043906716, 'sideways_atr_min_pct': 0.025452965283920655, 'sideways_atr_max_pct': 0.07898256479190695, 'sideways_tp_mult': 2.6795048427121584, 'sideways_tsl_mult': 0.12014236970332827, 'sideways_time_stop': 286, 'sideways_use_sma': False, 'sideways_use_ema': False, 'sideways_use_atr': False, 'sideways_use_adx': True, 'sideways_use_spike': True, 'sideways_rsi_required': True}.
[I 2025-08-30 14:41:16,943] Trial 170 finished with values: [-0.05704801629735179, 0.05701135143619075] and parameters: {'p_sma': 33, 'p_std': 35, 'p_atr': 14, 'p_adx': 17, 'rsi_period': 16, 'ema1': 28, 'ema2': 45, 'slip_atr_k': 0.17436112346218735, 'slip_spread_k': 0.7688867019987718, 'spread_hl_frac': 0.0009469218275001529, 'bb_std_mult': 3.142079871863835, 'rsi_os': 32, 'rsi_ob': 90, 'vol_spike': 0.043062783025905244, 'adx_thresh': 19.726773723029716, 'atr_min_pct': 0.017828648682674496, 'atr_max_pct': 0.1138773051063871, 'tp_mult': 2.44166300075343, 'tsl_mult': 0.9771157152778406, 'strategy': 'mean_reversion', 'time_stop': 26, 'use_sma': False, 'use_atr': False, 'use_adx': True, 'use_ema': False, 'use_spike': True, 'rsi_required': False, 'edge_k': 1.5357346652498802, 'edge_cap': 0.663408006341814, 'bull_strategy': 'mean_reversion', 'bull_bb_std_mult': 1.7820275341242229, 'bull_rsi_os': 14, 'bull_rsi_ob': 77, 'bull_adx_thresh': 14.884194766390955, 'bull_atr_min_pct': 0.006025503707995818, 'bull_atr_max_pct': 0.12553132385128235, 'bull_tp_mult': 1.4829367277703218, 'bull_tsl_mult': 0.48933258225202714, 'bull_time_stop': 251, 'bull_use_sma': False, 'bull_use_ema': False, 'bull_use_atr': False, 'bull_use_adx': False, 'bull_use_spike': False, 'bull_rsi_required': True, 'bear_strategy': 'breakout', 'bear_bb_std_mult': 0.8023680825692383, 'bear_rsi_os': 11, 'bear_rsi_ob': 46, 'bear_adx_thresh': 5.944561926691275, 'bear_atr_min_pct': 0.019172737698690545, 'bear_atr_max_pct': 0.027567855374216098, 'bear_tp_mult': 2.2949787232249537, 'bear_tsl_mult': 0.264602288318448, 'bear_time_stop': 57, 'bear_use_sma': True, 'bear_use_ema': True, 'bear_use_atr': True, 'bear_use_adx': False, 'bear_use_spike': False, 'bear_rsi_required': False, 'sideways_strategy': 'breakout', 'sideways_bb_std_mult': 2.9646879488370135, 'sideways_rsi_os': 31, 'sideways_rsi_ob': 62, 'sideways_adx_thresh': 19.5614299664195, 'sideways_atr_min_pct': 0.0020302483764623796, 'sideways_atr_max_pct': 0.06748847639346867, 'sideways_tp_mult': 2.716269717213907, 'sideways_tsl_mult': 0.9953895789723226, 'sideways_time_stop': 240, 'sideways_use_sma': True, 'sideways_use_ema': False, 'sideways_use_atr': True, 'sideways_use_adx': False, 'sideways_use_spike': True, 'sideways_rsi_required': True}.
