[I 2025-08-30 14:59:38,298] Trial 314 finished with values: [-1000000000.0, 1000000000.0] and parameters: {'p_sma': 7, 'p_std': 51, 'p_atr': 15, 'p_adx': 24, 'rsi_period': 81, 'ema1': 30, 'ema2': 15, 'slip_atr_k': 0.0387983289762181, 'slip_spread_k': 0.5835575120150234, 'spread_hl_frac': 3.221954427973017e-05, 'bb_std_mult': 3.596371059302504, 'rsi_os': 30, 'rsi_ob': 95, 'vol_spike': 0.2857853494094132, 'adx_thresh': 31.33703461990468, 'atr_min_pct': 0.01620061700076202, 'atr_max_pct': 0.06272316472083034, 'tp_mult': 2.2959180074554926, 'tsl_mult': 0.18779119837543934, 'strategy': 'breakout', 'time_stop': 119, 'use_sma': False, 'use_atr': False, 'use_adx': False, 'use_ema': False, 'use_spike': True, 'rsi_required': True, 'edge_k': 1.449272403171447, 'edge_cap': 0.3571576873217328, 'bull_strategy': 'mean_reversion', 'bull_bb_std_mult': 2.485805984998909, 'bull_rsi_os': 30, 'bull_rsi_ob': 85, 'bull_adx_thresh': 22.234743336864824, 'bull_atr_min_pct': 0.005385785159454709, 'bull_atr_max_pct': 0.08709099078880754, 'bull_tp_mult': 1.7344604416669984, 'bull_tsl_mult': 0.682585377095707, 'bull_time_stop': 92, 'bull_use_sma': False, 'bull_use_ema': False, 'bull_use_atr': False, 'bull_use_adx': True, 'bull_use_spike': False, 'bull_rsi_required': True, 'bear_strategy': 'mean_reversion', 'bear_bb_std_mult': 1.143169592455338, 'bear_rsi_os': 9, 'bear_rsi_ob': 64, 'bear_adx_thresh': 28.093491103360208, 'bear_atr_min_pct': 0.014374650548773743, 'bear_atr_max_pct': 0.020839946496772444, 'bear_tp_mult': 1.454961808120631, 'bear_tsl_mult': 0.001913398675792672, 'bear_time_stop': 91, 'bear_use_sma': False, 'bear_use_ema': True, 'bear_use_atr': True, 'bear_use_adx': False, 'bear_use_spike': False, 'bear_rsi_required': False, 'sideways_strategy': 'mean_reversion', 'sideways_bb_std_mult': 3.5447987494999795, 'sideways_rsi_os': 38, 'sideways_rsi_ob': 64, 'sideways_adx_thresh': 27.732356435875275, 'sideways_atr_min_pct': 0.002657113528042055, 'sideways_atr_max_pct': 0.08327229311173721, 'sideways_tp_mult': 2.1815410858086914, 'sideways_tsl_mult': 0.43599272908596853, 'sideways_time_stop': 13, 'sideways_use_sma': False, 'sideways_use_ema': True, 'sideways_use_atr': True, 'sideways_use_adx': False, 'sideways_use_spike': True, 'sideways_rsi_required': False}.
[I 2025-08-30 14:59:38,322] Trial 317 finished with values: [-1000000000.0, 1000000000.0] and parameters: {'p_sma': 21, 'p_std': 51, 'p_atr': 15, 'p_adx': 24, 'rsi_period': 37, 'ema1': 28, 'ema2': 14, 'slip_atr_k': 0.04323468227219708, 'slip_spread_k': 0.5393345545012923, 'spread_hl_frac': 4.9338972789015175e-05, 'bb_std_mult': 3.5294378997361515, 'rsi_os': 30, 'rsi_ob': 95, 'vol_spike': 0.29380662862053936, 'adx_thresh': 33.5529597985701, 'atr_min_pct': 0.01607481182685645, 'atr_max_pct': 0.060441125548469005, 'tp_mult': 2.5139743925954017, 'tsl_mult': 0.19704053677707906, 'strategy': 'breakout', 'time_stop': 121, 'use_sma': False, 'use_atr': False, 'use_adx': False, 'use_ema': False, 'use_spike': True, 'rsi_required': True, 'edge_k': 1.3372029530886813, 'edge_cap': 0.6426746213990062, 'bull_strategy': 'mean_reversion', 'bull_bb_std_mult': 2.3274992602032247, 'bull_rsi_os': 27, 'bull_rsi_ob': 85, 'bull_adx_thresh': 22.12870827305375, 'bull_atr_min_pct': 0.0052564956903656404, 'bull_atr_max_pct': 0.08700413703588464, 'bull_tp_mult': 1.7175721119877658, 'bull_tsl_mult': 0.6815159461610539, 'bull_time_stop': 90, 'bull_use_sma': False, 'bull_use_ema': False, 'bull_use_atr': False, 'bull_use_adx': True, 'bull_use_spike': True, 'bull_rsi_required': True, 'bear_strategy': 'mean_reversion', 'bear_bb_std_mult': 1.1530945844466003, 'bear_rsi_os': 8, 'bear_rsi_ob': 60, 'bear_adx_thresh': 30.166281047096017, 'bear_atr_min_pct': 0.014503815016802176, 'bear_atr_max_pct': 0.02108746456305484, 'bear_tp_mult': 1.465218098547141, 'bear_tsl_mult': 0.0057256079043240815, 'bear_time_stop': 121, 'bear_use_sma': True, 'bear_use_ema': True, 'bear_use_atr': True, 'bear_use_adx': False, 'bear_use_spike': False, 'bear_rsi_required': True, 'sideways_strategy': 'mean_reversion', 'sideways_bb_std_mult': 3.5708546341215524, 'sideways_rsi_os': 39, 'sideways_rsi_ob': 52, 'sideways_adx_thresh': 28.602399562582157, 'sideways_atr_min_pct': 0.002699281072639846, 'sideways_atr_max_pct': 0.09741240463369098, 'sideways_tp_mult': 2.1787654297017864, 'sideways_tsl_mult': 0.42688723875680373, 'sideways_time_stop': 10, 'sideways_use_sma': False, 'sideways_use_ema': True, 'sideways_use_atr': True, 'sideways_use_adx': False, 'sideways_use_spike': True, 'sideways_rsi_required': False}.
[I 2025-08-30 14:59:38,401] Trial 315 finished with values: [-1000000000.0, 1000000000.0] and parameters: {'p_sma': 21, 'p_std': 49, 'p_atr': 15, 'p_adx': 24, 'rsi_period': 34, 'ema1': 28, 'ema2': 14, 'slip_atr_k': 0.03950523068437294, 'slip_spread_k': 0.578852745769391, 'spread_hl_frac': 0.0007578948766987561, 'bb_std_mult': 3.5449333542658503, 'rsi_os': 31, 'rsi_ob': 95, 'vol_spike': 0.29980007110916657, 'adx_thresh': 32.35340824691058, 'atr_min_pct': 0.016158807847681343, 'atr_max_pct': 0.06051070927016881, 'tp_mult': 2.4949318880009734, 'tsl_mult': 0.2025617286281201, 'strategy': 'breakout', 'time_stop': 105, 'use_sma': False, 'use_atr': False, 'use_adx': False, 'use_ema': False, 'use_spike': True, 'rsi_required': True, 'edge_k': 1.3492449290503852, 'edge_cap': 0.643813449020854, 'bull_strategy': 'mean_reversion', 'bull_bb_std_mult': 2.635046372652038, 'bull_rsi_os': 27, 'bull_rsi_ob': 83, 'bull_adx_thresh': 26.917642068494715, 'bull_atr_min_pct': 0.005234467069008788, 'bull_atr_max_pct': 0.08571555002381658, 'bull_tp_mult': 1.797001692681998, 'bull_tsl_mult': 0.6817992358334791, 'bull_time_stop': 89, 'bull_use_sma': False, 'bull_use_ema': True, 'bull_use_atr': False, 'bull_use_adx': True, 'bull_use_spike': True, 'bull_rsi_required': True, 'bear_strategy': 'mean_reversion', 'bear_bb_std_mult': 1.1615580908921683, 'bear_rsi_os': 8, 'bear_rsi_ob': 64, 'bear_adx_thresh': 28.22476363430171, 'bear_atr_min_pct': 0.014534584647143462, 'bear_atr_max_pct': 0.020374794191942318, 'bear_tp_mult': 1.4231893114061704, 'bear_tsl_mult': 0.0014398639375408362, 'bear_time_stop': 87, 'bear_use_sma': True, 'bear_use_ema': True, 'bear_use_atr': True, 'bear_use_adx': False, 'bear_use_spike': False, 'bear_rsi_required': True, 'sideways_strategy': 'mean_reversion', 'sideways_bb_std_mult': 3.591175385692768, 'sideways_rsi_os': 38, 'sideways_rsi_ob': 52, 'sideways_adx_thresh': 28.480580400801113, 'sideways_atr_min_pct': 0.0025560336111279127, 'sideways_atr_max_pct': 0.09723069626760517, 'sideways_tp_mult': 2.183080133232923, 'sideways_tsl_mult': 0.4267726945171722, 'sideways_time_stop': 15, 'sideways_use_sma': False, 'sideways_use_ema': True, 'sideways_use_atr': True, 'sideways_use_adx': False, 'sideways_use_spike': True, 'sideways_rsi_required': False}.
[I 2025-08-30 15:00:10,847] Trial 321 finished with values: [-1000000000.0, 1000000000.0] and parameters: {'p_sma': 6, 'p_std': 48, 'p_atr': 16, 'p_adx': 23, 'rsi_period': 61, 'ema1': 12, 'ema2': 16, 'slip_atr_k': 0.03565661606862665, 'slip_spread_k': 0.550982452643244, 'spread_hl_frac': 0.03644152310953486, 'bb_std_mult': 3.496925355708968, 'rsi_os': 29, 'rsi_ob': 94, 'vol_spike': 0.2819910638231259, 'adx_thresh': 34.18523840516184, 'atr_min_pct': 0.014506854781620393, 'atr_max_pct': 0.06741269447718871, 'tp_mult': 2.3902164262546375, 'tsl_mult': 0.06606349803042338, 'strategy': 'breakout', 'time_stop': 125, 'use_sma': False, 'use_atr': True, 'use_adx': False, 'use_ema': True, 'use_spike': True, 'rsi_required': True, 'edge_k': 1.2315547939946265, 'edge_cap': 0.6798808766507852, 'bull_strategy': 'mean_reversion', 'bull_bb_std_mult': 2.3867970048040625, 'bull_rsi_os': 26, 'bull_rsi_ob': 84, 'bull_adx_thresh': 21.483400675557142, 'bull_atr_min_pct': 0.006219048766923269, 'bull_atr_max_pct': 0.09326443287725167, 'bull_tp_mult': 1.666090430265673, 'bull_tsl_mult': 0.7028346494028791, 'bull_time_stop': 101, 'bull_use_sma': False, 'bull_use_ema': False, 'bull_use_atr': False, 'bull_use_adx': False, 'bull_use_spike': False, 'bull_rsi_required': False, 'bear_strategy': 'mean_reversion', 'bear_bb_std_mult': 1.0410207553689075, 'bear_rsi_os': 10, 'bear_rsi_ob': 67, 'bear_adx_thresh': 29.64464401281156, 'bear_atr_min_pct': 0.015525681777956836, 'bear_atr_max_pct': 0.016765410181338942, 'bear_tp_mult': 1.5347512051624004, 'bear_tsl_mult': 0.027388028332672107, 'bear_time_stop': 133, 'bear_use_sma': False, 'bear_use_ema': True, 'bear_use_atr': True, 'bear_use_adx': False, 'bear_use_spike': False, 'bear_rsi_required': False, 'sideways_strategy': 'breakout', 'sideways_bb_std_mult': 3.5012842771322785, 'sideways_rsi_os': 37, 'sideways_rsi_ob': 72, 'sideways_adx_thresh': 26.991590612181387, 'sideways_atr_min_pct': 0.00187449243881689, 'sideways_atr_max_pct': 0.05861909662303039, 'sideways_tp_mult': 2.2518759913447055, 'sideways_tsl_mult': 0.4777330375792635, 'sideways_time_stop': 22, 'sideways_use_sma': False, 'sideways_use_ema': True, 'sideways_use_atr': True, 'sideways_use_adx': False, 'sideways_use_spike': False, 'sideways_rsi_required': False}.
[I 2025-08-30 15:00:11,413] Trial 318 finished with values: [-1000000000.0, 1000000000.0] and parameters: {'p_sma': 25, 'p_std': 51, 'p_atr': 15, 'p_adx': 24, 'rsi_period': 62, 'ema1': 29, 'ema2': 14, 'slip_atr_k': 0.03633177238977006, 'slip_spread_k': 0.5372574567052372, 'spread_hl_frac': 0.001355233651436001, 'bb_std_mult': 3.5413761847547667, 'rsi_os': 30, 'rsi_ob': 95, 'vol_spike': 0.28506598911115694, 'adx_thresh': 32.300523125945894, 'atr_min_pct': 0.016271170749187422, 'atr_max_pct': 0.06551520976923414, 'tp_mult': 1.3173193331112747, 'tsl_mult': 0.028670684763491522, 'strategy': 'breakout', 'time_stop': 120, 'use_sma': False, 'use_atr': False, 'use_adx': False, 'use_ema': False, 'use_spike': True, 'rsi_required': True, 'edge_k': 1.348427676121769, 'edge_cap': 0.6497201001615959, 'bull_strategy': 'mean_reversion', 'bull_bb_std_mult': 2.334668695538248, 'bull_rsi_os': 30, 'bull_rsi_ob': 85, 'bull_adx_thresh': 21.174917452102164, 'bull_atr_min_pct': 0.005668557511458044, 'bull_atr_max_pct': 0.08347691147334257, 'bull_tp_mult': 1.7641553538639956, 'bull_tsl_mult': 0.6816694222903144, 'bull_time_stop': 104, 'bull_use_sma': False, 'bull_use_ema': False, 'bull_use_atr': False, 'bull_use_adx': False, 'bull_use_spike': False, 'bull_rsi_required': True, 'bear_strategy': 'mean_reversion', 'bear_bb_std_mult': 1.964810084222805, 'bear_rsi_os': 8, 'bear_rsi_ob': 66, 'bear_adx_thresh': 29.908693665967128, 'bear_atr_min_pct': 0.014476552285210392, 'bear_atr_max_pct': 0.020914689067100915, 'bear_tp_mult': 1.463884385987986, 'bear_tsl_mult': 0.0029520638316865282, 'bear_time_stop': 89, 'bear_use_sma': False, 'bear_use_ema': True, 'bear_use_atr': True, 'bear_use_adx': False, 'bear_use_spike': False, 'bear_rsi_required': False, 'sideways_strategy': 'mean_reversion', 'sideways_bb_std_mult': 3.599330804640438, 'sideways_rsi_os': 39, 'sideways_rsi_ob': 65, 'sideways_adx_thresh': 27.355573314263765, 'sideways_atr_min_pct': 0.00179191929094988, 'sideways_atr_max_pct': 0.08300203898330756, 'sideways_tp_mult': 2.17493772523267, 'sideways_tsl_mult': 0.4285176800915969, 'sideways_time_stop': 11, 'sideways_use_sma': False, 'sideways_use_ema': True, 'sideways_use_atr': True, 'sideways_use_adx': False, 'sideways_use_spike': True, 'sideways_rsi_required': False}.
[I 2025-08-30 15:00:11,522] Trial 320 finished with values: [-0.02059983199165616, 0.020490890653520603] and parameters: {'p_sma': 25, 'p_std': 49, 'p_atr': 16, 'p_adx': 23, 'rsi_period': 63, 'ema1': 29, 'ema2': 16, 'slip_atr_k': 0.03528290984558551, 'slip_spread_k': 0.6162506888489933, 'spread_hl_frac': 0.0009512281849498078, 'bb_std_mult': 3.503200077676505, 'rsi_os': 31, 'rsi_ob': 95, 'vol_spike': 0.28049287279308754, 'adx_thresh': 32.49434228236339, 'atr_min_pct': 0.014643048484417599, 'atr_max_pct': 0.06713542300960984, 'tp_mult': 2.3990386932295267, 'tsl_mult': 0.06049688441704697, 'strategy': 'breakout', 'time_stop': 125, 'use_sma': False, 'use_atr': True, 'use_adx': False, 'use_ema': True, 'use_spike': True, 'rsi_required': True, 'edge_k': 1.2469302624458056, 'edge_cap': 0.6749636650963464, 'bull_strategy': 'mean_reversion', 'bull_bb_std_mult': 2.4109086732407072, 'bull_rsi_os': 26, 'bull_rsi_ob': 84, 'bull_adx_thresh': 21.23710752359095, 'bull_atr_min_pct': 0.005870737383468759, 'bull_atr_max_pct': 0.09409885042423394, 'bull_tp_mult': 1.7722469684575937, 'bull_tsl_mult': 0.6651689338791451, 'bull_time_stop': 70, 'bull_use_sma': False, 'bull_use_ema': False, 'bull_use_atr': False, 'bull_use_adx': False, 'bull_use_spike': False, 'bull_rsi_required': False, 'bear_strategy': 'mean_reversion', 'bear_bb_std_mult': 1.9783776177912027, 'bear_rsi_os': 10, 'bear_rsi_ob': 73, 'bear_adx_thresh': 29.462590832655827, 'bear_atr_min_pct': 0.01374785354597421, 'bear_atr_max_pct': 0.01638443974568316, 'bear_tp_mult': 1.3222088874409383, 'bear_tsl_mult': 0.02364180864666684, 'bear_time_stop': 132, 'bear_use_sma': False, 'bear_use_ema': True, 'bear_use_atr': True, 'bear_use_adx': False, 'bear_use_spike': False, 'bear_rsi_required': False, 'sideways_strategy': 'breakout', 'sideways_bb_std_mult': 3.592335202680834, 'sideways_rsi_os': 39, 'sideways_rsi_ob': 72, 'sideways_adx_thresh': 27.2194896915243, 'sideways_atr_min_pct': 0.0018066017243441614, 'sideways_atr_max_pct': 0.0862575197410608, 'sideways_tp_mult': 2.25288809308486, 'sideways_tsl_mult': 0.48135525255694667, 'sideways_time_stop': 5, 'sideways_use_sma': False, 'sideways_use_ema': True, 'sideways_use_atr': True, 'sideways_use_adx': False, 'sideways_use_spike': True, 'sideways_rsi_required': False}.
[I 2025-08-30 15:00:11,695] Trial 319 finished with values: [-0.018883143150190906, 0.018772197255401097] and parameters: {'p_sma': 25, 'p_std': 49, 'p_atr': 15, 'p_adx': 23, 'rsi_period': 62, 'ema1': 12, 'ema2': 16, 'slip_atr_k': 0.03229470396589125, 'slip_spread_k': 0.5462967259185071, 'spread_hl_frac': 0.0012099937145833412, 'bb_std_mult': 3.513086213753169, 'rsi_os': 31, 'rsi_ob': 95, 'vol_spike': 0.2824154997016522, 'adx_thresh': 32.44626036040374, 'atr_min_pct': 0.015651168877933833, 'atr_max_pct': 0.059439880588355476, 'tp_mult': 2.3766048725139184, 'tsl_mult': 0.06616650169260321, 'strategy': 'breakout', 'time_stop': 124, 'use_sma': False, 'use_atr': True, 'use_adx': False, 'use_ema': True, 'use_spike': True, 'rsi_required': True, 'edge_k': 1.3436457609573829, 'edge_cap': 0.6454794691635898, 'bull_strategy': 'mean_reversion', 'bull_bb_std_mult': 2.341296176363134, 'bull_rsi_os': 27, 'bull_rsi_ob': 84, 'bull_adx_thresh': 21.617444052920213, 'bull_atr_min_pct': 0.005732800611953475, 'bull_atr_max_pct': 0.09457202218719847, 'bull_tp_mult': 1.6968744295415124, 'bull_tsl_mult': 0.6678853799086427, 'bull_time_stop': 100, 'bull_use_sma': False, 'bull_use_ema': False, 'bull_use_atr': False, 'bull_use_adx': False, 'bull_use_spike': True, 'bull_rsi_required': False, 'bear_strategy': 'mean_reversion', 'bear_bb_std_mult': 2.444855926402272, 'bear_rsi_os': 8, 'bear_rsi_ob': 67, 'bear_adx_thresh': 29.9520159997635, 'bear_atr_min_pct': 0.015166312870361347, 'bear_atr_max_pct': 0.14982222747932572, 'bear_tp_mult': 1.318099609934306, 'bear_tsl_mult': 0.026187111171849353, 'bear_time_stop': 121, 'bear_use_sma': False, 'bear_use_ema': True, 'bear_use_atr': True, 'bear_use_adx': False, 'bear_use_spike': False, 'bear_rsi_required': True, 'sideways_strategy': 'breakout', 'sideways_bb_std_mult': 3.5996973068089573, 'sideways_rsi_os': 39, 'sideways_rsi_ob': 47, 'sideways_adx_thresh': 27.199950563034637, 'sideways_atr_min_pct': 0.0019268489430257951, 'sideways_atr_max_pct': 0.08577383924181785, 'sideways_tp_mult': 2.230682754463364, 'sideways_tsl_mult': 0.4206167522267105, 'sideways_time_stop': 5, 'sideways_use_sma': False, 'sideways_use_ema': True, 'sideways_use_atr': True, 'sideways_use_adx': False, 'sideways_use_spike': True, 'sideways_rsi_required': False}.
[I 2025-08-30 15:00:45,792] Trial 323 finished with values: [-0.014247353986403644, 0.014176118789751136] and parameters: {'p_sma': 10, 'p_std': 49, 'p_atr': 15, 'p_adx': 23, 'rsi_period': 46, 'ema1': 7, 'ema2': 16, 'slip_atr_k': 0.03085652442817323, 'slip_spread_k': 0.6184956670197157, 'spread_hl_frac': 0.0011264071716191658, 'bb_std_mult': 3.468315219445918, 'rsi_os': 31, 'rsi_ob': 94, 'vol_spike': 0.29024249142644476, 'adx_thresh': 29.36359869160403, 'atr_min_pct': 0.015154688070671997, 'atr_max_pct': 0.05910889377991508, 'tp_mult': 2.4484636940300697, 'tsl_mult': 0.15946181403016457, 'strategy': 'breakout', 'time_stop': 127, 'use_sma': False, 'use_atr': True, 'use_adx': True, 'use_ema': True, 'use_spike': True, 'rsi_required': True, 'edge_k': 1.2744635003741969, 'edge_cap': 0.6674488972192966, 'bull_strategy': 'mean_reversion', 'bull_bb_std_mult': 2.5553272247858048, 'bull_rsi_os': 29, 'bull_rsi_ob': 86, 'bull_adx_thresh': 23.94435243176622, 'bull_atr_min_pct': 0.005857933708243565, 'bull_atr_max_pct': 0.0897576690363876, 'bull_tp_mult': 1.683359032549795, 'bull_tsl_mult': 0.6390791828150144, 'bull_time_stop': 68, 'bull_use_sma': False, 'bull_use_ema': False, 'bull_use_atr': False, 'bull_use_adx': True, 'bull_use_spike': False, 'bull_rsi_required': False, 'bear_strategy': 'mean_reversion', 'bear_bb_std_mult': 2.449018928007999, 'bear_rsi_os': 10, 'bear_rsi_ob': 81, 'bear_adx_thresh': 30.444307282843333, 'bear_atr_min_pct': 0.013562548698413893, 'bear_atr_max_pct': 0.014317409442476295, 'bear_tp_mult': 1.3308321751980667, 'bear_tsl_mult': 0.023381954028935382, 'bear_time_stop': 108, 'bear_use_sma': False, 'bear_use_ema': True, 'bear_use_atr': True, 'bear_use_adx': False, 'bear_use_spike': False, 'bear_rsi_required': False, 'sideways_strategy': 'breakout', 'sideways_bb_std_mult': 3.48228713915506, 'sideways_rsi_os': 37, 'sideways_rsi_ob': 47, 'sideways_adx_thresh': 29.23684351832751, 'sideways_atr_min_pct': 0.0010391412396416838, 'sideways_atr_max_pct': 0.08643101882185021, 'sideways_tp_mult': 2.272317260836624, 'sideways_tsl_mult': 0.4025880795459328, 'sideways_time_stop': 5, 'sideways_use_sma': False, 'sideways_use_ema': True, 'sideways_use_atr': True, 'sideways_use_adx': False, 'sideways_use_spike': True, 'sideways_rsi_required': False}.
[I 2025-08-30 15:00:46,062] Trial 324 finished with values: [-1000000000.0, 1000000000.0] and parameters: {'p_sma': 11, 'p_std': 52, 'p_atr': 15, 'p_adx': 8, 'rsi_period': 40, 'ema1': 19, 'ema2': 15, 'slip_atr_k': 0.03047696664874125, 'slip_spread_k': 0.5051450667078611, 'spread_hl_frac': 0.019275821675170106, 'bb_std_mult': 3.462546025549226, 'rsi_os': 32, 'rsi_ob': 94, 'vol_spike': 0.2879740403048716, 'adx_thresh': 29.524490730962984, 'atr_min_pct': 0.01549447850178651, 'atr_max_pct': 0.058982230938944655, 'tp_mult': 1.8906022881580662, 'tsl_mult': 0.15751833575277846, 'strategy': 'breakout', 'time_stop': 128, 'use_sma': False, 'use_atr': False, 'use_adx': True, 'use_ema': False, 'use_spike': True, 'rsi_required': True, 'edge_k': 1.2776715817205855, 'edge_cap': 0.6593070262223536, 'bull_strategy': 'mean_reversion', 'bull_bb_std_mult': 2.6909587632256047, 'bull_rsi_os': 29, 'bull_rsi_ob': 86, 'bull_adx_thresh': 23.519702919985516, 'bull_atr_min_pct': 0.010763302591881588, 'bull_atr_max_pct': 0.09122927546618802, 'bull_tp_mult': 1.706450236943036, 'bull_tsl_mult': 0.6415841896368417, 'bull_time_stop': 96, 'bull_use_sma': False, 'bull_use_ema': False, 'bull_use_atr': False, 'bull_use_adx': True, 'bull_use_spike': False, 'bull_rsi_required': True, 'bear_strategy': 'mean_reversion', 'bear_bb_std_mult': 1.0106978462762553, 'bear_rsi_os': 10, 'bear_rsi_ob': 76, 'bear_adx_thresh': 30.69209117874069, 'bear_atr_min_pct': 0.01355680795166646, 'bear_atr_max_pct': 0.0132173573106784, 'bear_tp_mult': 1.3787745923191894, 'bear_tsl_mult': 0.02652381177837556, 'bear_time_stop': 113, 'bear_use_sma': False, 'bear_use_ema': True, 'bear_use_atr': True, 'bear_use_adx': False, 'bear_use_spike': False, 'bear_rsi_required': False, 'sideways_strategy': 'breakout', 'sideways_bb_std_mult': 3.4928190272430517, 'sideways_rsi_os': 37, 'sideways_rsi_ob': 69, 'sideways_adx_thresh': 29.271784650401464, 'sideways_atr_min_pct': 0.007945577362943903, 'sideways_atr_max_pct': 0.0864818724566898, 'sideways_tp_mult': 2.217272401337057, 'sideways_tsl_mult': 0.39840221452264946, 'sideways_time_stop': 18, 'sideways_use_sma': False, 'sideways_use_ema': True, 'sideways_use_atr': True, 'sideways_use_adx': False, 'sideways_use_spike': False, 'sideways_rsi_required': False}.
