[I 2025-08-30 16:45:17,842] Trial 861 finished with values: [-0.05368360062939137, 0.053653273497469164] and parameters: {'p_sma': 49, 'p_std': 30, 'p_atr': 23, 'p_adx': 8, 'rsi_period': 9, 'ema1': 23, 'ema2': 28, 'slip_atr_k': 0.05691612052502322, 'slip_spread_k': 0.21725870594115038, 'spread_hl_frac': 0.02908280783777727, 'bb_std_mult': 1.8598071311173738, 'rsi_os': 47, 'rsi_ob': 78, 'vol_spike': 0.1444357863674014, 'adx_thresh': 13.086981026797437, 'atr_min_pct': 0.01760061275993481, 'atr_max_pct': 0.06486726608155706, 'tp_mult': 1.8951791385359689, 'tsl_mult': 0.6391540313980615, 'strategy': 'mean_reversion', 'time_stop': 166, 'use_sma': True, 'use_atr': True, 'use_adx': True, 'use_ema': True, 'use_spike': True, 'rsi_required': False, 'edge_k': 1.067052769435008, 'edge_cap': 0.2992763650796034, 'bull_strategy': 'breakout', 'bull_bb_std_mult': 1.5178736041390135, 'bull_rsi_os': 44, 'bull_rsi_ob': 61, 'bull_adx_thresh': 25.714008211381454, 'bull_atr_min_pct': 0.018978137138732615, 'bull_atr_max_pct': 0.12875625258406087, 'bull_tp_mult': 1.544039708134545, 'bull_tsl_mult': 0.033553247620399206, 'bull_time_stop': 28, 'bull_use_sma': True, 'bull_use_ema': True, 'bull_use_atr': True, 'bull_use_adx': True, 'bull_use_spike': True, 'bull_rsi_required': True, 'bear_strategy': 'mean_reversion', 'bear_bb_std_mult': 2.239412493910211, 'bear_rsi_os': 36, 'bear_rsi_ob': 90, 'bear_adx_thresh': 30.04663517057562, 'bear_atr_min_pct': 0.0017296413985532792, 'bear_atr_max_pct': 0.12631456136071967, 'bear_tp_mult': 2.195209027299671, 'bear_tsl_mult': 0.39773395155020996, 'bear_time_stop': 286, 'bear_use_sma': False, 'bear_use_ema': False, 'bear_use_atr': False, 'bear_use_adx': True, 'bear_use_spike': True, 'bear_rsi_required': True, 'sideways_strategy': 'breakout', 'sideways_bb_std_mult': 1.7334299536881945, 'sideways_rsi_os': 42, 'sideways_rsi_ob': 84, 'sideways_adx_thresh': 22.934109775627363, 'sideways_atr_min_pct': 0.0022267834906001312, 'sideways_atr_max_pct': 0.11690059909268521, 'sideways_tp_mult': 2.8787084225445683, 'sideways_tsl_mult': 0.16456900424046064, 'sideways_time_stop': 31, 'sideways_use_sma': True, 'sideways_use_ema': True, 'sideways_use_atr': False, 'sideways_use_adx': True, 'sideways_use_spike': True, 'sideways_rsi_required': True}.
[I 2025-08-30 16:45:19,367] Trial 864 finished with values: [-1000000000.0, 1000000000.0] and parameters: {'p_sma': 7, 'p_std': 31, 'p_atr': 20, 'p_adx': 8, 'rsi_period': 84, 'ema1': 23, 'ema2': 29, 'slip_atr_k': 0.05816283942577262, 'slip_spread_k': 0.1992559362098637, 'spread_hl_frac': 0.028705849116678162, 'bb_std_mult': 3.2477164582703173, 'rsi_os': 45, 'rsi_ob': 78, 'vol_spike': 0.14060035919058858, 'adx_thresh': 13.28786028046372, 'atr_min_pct': 0.01655776465444163, 'atr_max_pct': 0.06843415569240506, 'tp_mult': 1.8906770898147134, 'tsl_mult': 0.639747939930153, 'strategy': 'mean_reversion', 'time_stop': 195, 'use_sma': True, 'use_atr': True, 'use_adx': True, 'use_ema': True, 'use_spike': False, 'rsi_required': False, 'edge_k': 1.0515201658520885, 'edge_cap': 0.4188893888458991, 'bull_strategy': 'breakout', 'bull_bb_std_mult': 1.6025841825531524, 'bull_rsi_os': 45, 'bull_rsi_ob': 62, 'bull_adx_thresh': 25.54477009600796, 'bull_atr_min_pct': 0.017835985835169592, 'bull_atr_max_pct': 0.12478506379148427, 'bull_tp_mult': 1.5149118249282878, 'bull_tsl_mult': 0.0895812119596832, 'bull_time_stop': 28, 'bull_use_sma': True, 'bull_use_ema': True, 'bull_use_atr': True, 'bull_use_adx': True, 'bull_use_spike': True, 'bull_rsi_required': True, 'bear_strategy': 'mean_reversion', 'bear_bb_std_mult': 2.3466016853886886, 'bear_rsi_os': 35, 'bear_rsi_ob': 91, 'bear_adx_thresh': 29.848483710423867, 'bear_atr_min_pct': 0.004260253924921912, 'bear_atr_max_pct': 0.12133698194258463, 'bear_tp_mult': 2.293984673309568, 'bear_tsl_mult': 0.4067447259163333, 'bear_time_stop': 286, 'bear_use_sma': False, 'bear_use_ema': False, 'bear_use_atr': False, 'bear_use_adx': True, 'bear_use_spike': True, 'bear_rsi_required': True, 'sideways_strategy': 'breakout', 'sideways_bb_std_mult': 1.6589552162779273, 'sideways_rsi_os': 42, 'sideways_rsi_ob': 74, 'sideways_adx_thresh': 21.79139495400372, 'sideways_atr_min_pct': 0.002089609681942118, 'sideways_atr_max_pct': 0.12231345369664758, 'sideways_tp_mult': 1.0653627074715, 'sideways_tsl_mult': 0.11298448476094322, 'sideways_time_stop': 43, 'sideways_use_sma': True, 'sideways_use_ema': True, 'sideways_use_atr': False, 'sideways_use_adx': True, 'sideways_use_spike': False, 'sideways_rsi_required': True}.
[I 2025-08-30 16:45:23,563] Trial 869 finished with values: [-1000000000.0, 1000000000.0] and parameters: {'p_sma': 5, 'p_std': 22, 'p_atr': 19, 'p_adx': 15, 'rsi_period': 80, 'ema1': 22, 'ema2': 30, 'slip_atr_k': 0.04530587382313212, 'slip_spread_k': 0.2787847414502431, 'spread_hl_frac': 0.027714394627236173, 'bb_std_mult': 1.731346507062708, 'rsi_os': 50, 'rsi_ob': 75, 'vol_spike': 0.15126848486345895, 'adx_thresh': 12.61800759274746, 'atr_min_pct': 0.016594448276675392, 'atr_max_pct': 0.071168637945016, 'tp_mult': 1.9476395742787942, 'tsl_mult': 0.5145931388869728, 'strategy': 'mean_reversion', 'time_stop': 224, 'use_sma': True, 'use_atr': False, 'use_adx': True, 'use_ema': False, 'use_spike': True, 'rsi_required': False, 'edge_k': 1.1794718005485711, 'edge_cap': 0.31886730767629123, 'bull_strategy': 'breakout', 'bull_bb_std_mult': 1.7841518067249504, 'bull_rsi_os': 43, 'bull_rsi_ob': 60, 'bull_adx_thresh': 25.21606287216475, 'bull_atr_min_pct': 0.019470146954494734, 'bull_atr_max_pct': 0.10979712780421166, 'bull_tp_mult': 1.7379797047124002, 'bull_tsl_mult': 0.14181770540416488, 'bull_time_stop': 37, 'bull_use_sma': True, 'bull_use_ema': True, 'bull_use_atr': True, 'bull_use_adx': True, 'bull_use_spike': True, 'bull_rsi_required': True, 'bear_strategy': 'breakout', 'bear_bb_std_mult': 2.2822516816132783, 'bear_rsi_os': 35, 'bear_rsi_ob': 88, 'bear_adx_thresh': 22.936349423658235, 'bear_atr_min_pct': 0.0005184793802296508, 'bear_atr_max_pct': 0.10340388111977863, 'bear_tp_mult': 2.605951235367415, 'bear_tsl_mult': 0.3266745310552256, 'bear_time_stop': 294, 'bear_use_sma': False, 'bear_use_ema': False, 'bear_use_atr': False, 'bear_use_adx': True, 'bear_use_spike': True, 'bear_rsi_required': True, 'sideways_strategy': 'mean_reversion', 'sideways_bb_std_mult': 1.81068366867392, 'sideways_rsi_os': 41, 'sideways_rsi_ob': 76, 'sideways_adx_thresh': 23.17289900009038, 'sideways_atr_min_pct': 0.0019972857019720535, 'sideways_atr_max_pct': 0.11563845100607881, 'sideways_tp_mult': 1.7671375370947289, 'sideways_tsl_mult': 0.1328040044654192, 'sideways_time_stop': 49, 'sideways_use_sma': True, 'sideways_use_ema': True, 'sideways_use_atr': False, 'sideways_use_adx': True, 'sideways_use_spike': True, 'sideways_rsi_required': True}.
[I 2025-08-30 16:45:26,700] Trial 870 finished with values: [-1000000000.0, 1000000000.0] and parameters: {'p_sma': 9, 'p_std': 28, 'p_atr': 30, 'p_adx': 7, 'rsi_period': 18, 'ema1': 14, 'ema2': 30, 'slip_atr_k': 0.05942365970948316, 'slip_spread_k': 0.1927624977799599, 'spread_hl_frac': 0.027656413423701082, 'bb_std_mult': 2.9872218778502413, 'rsi_os': 51, 'rsi_ob': 75, 'vol_spike': 0.15623619167796268, 'adx_thresh': 12.541970658793112, 'atr_min_pct': 0.017271683874785452, 'atr_max_pct': 0.06957913801011091, 'tp_mult': 1.8653537908652729, 'tsl_mult': 0.4575098383309053, 'strategy': 'mean_reversion', 'time_stop': 218, 'use_sma': True, 'use_atr': True, 'use_adx': True, 'use_ema': True, 'use_spike': True, 'rsi_required': False, 'edge_k': 1.1238303488658226, 'edge_cap': 0.2157803570819224, 'bull_strategy': 'breakout', 'bull_bb_std_mult': 1.6480837121084213, 'bull_rsi_os': 43, 'bull_rsi_ob': 62, 'bull_adx_thresh': 24.948300165101813, 'bull_atr_min_pct': 0.019220053258253773, 'bull_atr_max_pct': 0.10862660593179532, 'bull_tp_mult': 1.7101298370237734, 'bull_tsl_mult': 0.1143338515451925, 'bull_time_stop': 39, 'bull_use_sma': True, 'bull_use_ema': True, 'bull_use_atr': True, 'bull_use_adx': True, 'bull_use_spike': False, 'bull_rsi_required': True, 'bear_strategy': 'mean_reversion', 'bear_bb_std_mult': 2.3561924099824045, 'bear_rsi_os': 40, 'bear_rsi_ob': 89, 'bear_adx_thresh': 30.322513695346093, 'bear_atr_min_pct': 0.006944895422895446, 'bear_atr_max_pct': 0.14000775382682817, 'bear_tp_mult': 2.4458194518447764, 'bear_tsl_mult': 0.275265498025412, 'bear_time_stop': 284, 'bear_use_sma': False, 'bear_use_ema': False, 'bear_use_atr': False, 'bear_use_adx': True, 'bear_use_spike': True, 'bear_rsi_required': False, 'sideways_strategy': 'breakout', 'sideways_bb_std_mult': 1.8314587683557673, 'sideways_rsi_os': 43, 'sideways_rsi_ob': 71, 'sideways_adx_thresh': 23.092334661201924, 'sideways_atr_min_pct': 0.003480062107951789, 'sideways_atr_max_pct': 0.12179276219360519, 'sideways_tp_mult': 2.924956347803301, 'sideways_tsl_mult': 0.14447067507764763, 'sideways_time_stop': 49, 'sideways_use_sma': False, 'sideways_use_ema': False, 'sideways_use_atr': False, 'sideways_use_adx': True, 'sideways_use_spike': True, 'sideways_rsi_required': True}.
[I 2025-08-30 16:45:32,901] Trial 866 finished with values: [-0.02564949940402439, 0.025709524166541754] and parameters: {'p_sma': 8, 'p_std': 30, 'p_atr': 30, 'p_adx': 7, 'rsi_period': 9, 'ema1': 23, 'ema2': 29, 'slip_atr_k': 0.045889158151970214, 'slip_spread_k': 0.198838692600822, 'spread_hl_frac': 0.02731206702661184, 'bb_std_mult': 2.949963244712441, 'rsi_os': 45, 'rsi_ob': 78, 'vol_spike': 0.1537490090684391, 'adx_thresh': 12.691258382786563, 'atr_min_pct': 0.016874639097074155, 'atr_max_pct': 0.06400111853001599, 'tp_mult': 1.9463062656053514, 'tsl_mult': 0.5324590613057668, 'strategy': 'mean_reversion', 'time_stop': 5, 'use_sma': True, 'use_atr': True, 'use_adx': True, 'use_ema': True, 'use_spike': False, 'rsi_required': False, 'edge_k': 1.1966498474561977, 'edge_cap': 0.32897605362646687, 'bull_strategy': 'breakout', 'bull_bb_std_mult': 1.5705665568023146, 'bull_rsi_os': 43, 'bull_rsi_ob': 62, 'bull_adx_thresh': 25.00762289053066, 'bull_atr_min_pct': 0.019035745141082323, 'bull_atr_max_pct': 0.10953509268094826, 'bull_tp_mult': 1.5335383652689225, 'bull_tsl_mult': 0.09559803570913154, 'bull_time_stop': 27, 'bull_use_sma': True, 'bull_use_ema': True, 'bull_use_atr': True, 'bull_use_adx': True, 'bull_use_spike': True, 'bull_rsi_required': True, 'bear_strategy': 'mean_reversion', 'bear_bb_std_mult': 2.3521206313405973, 'bear_rsi_os': 35, 'bear_rsi_ob': 88, 'bear_adx_thresh': 30.005455516322495, 'bear_atr_min_pct': 0.0017820169053645238, 'bear_atr_max_pct': 0.14038487007419587, 'bear_tp_mult': 2.4494965990946675, 'bear_tsl_mult': 0.3134832895898101, 'bear_time_stop': 284, 'bear_use_sma': False, 'bear_use_ema': False, 'bear_use_atr': False, 'bear_use_adx': True, 'bear_use_spike': True, 'bear_rsi_required': True, 'sideways_strategy': 'breakout', 'sideways_bb_std_mult': 1.824453108861746, 'sideways_rsi_os': 42, 'sideways_rsi_ob': 85, 'sideways_adx_thresh': 22.928145694733463, 'sideways_atr_min_pct': 0.002330700394723793, 'sideways_atr_max_pct': 0.12292695177884697, 'sideways_tp_mult': 2.908208614047286, 'sideways_tsl_mult': 0.11910580078583669, 'sideways_time_stop': 47, 'sideways_use_sma': True, 'sideways_use_ema': False, 'sideways_use_atr': False, 'sideways_use_adx': True, 'sideways_use_spike': True, 'sideways_rsi_required': True}.
[I 2025-08-30 16:45:38,966] Trial 872 finished with values: [-1000000000.0, 1000000000.0] and parameters: {'p_sma': 6, 'p_std': 23, 'p_atr': 21, 'p_adx': 16, 'rsi_period': 79, 'ema1': 25, 'ema2': 30, 'slip_atr_k': 0.06148226035168511, 'slip_spread_k': 0.050385477896307276, 'spread_hl_frac': 0.027290920985929192, 'bb_std_mult': 2.687615126030138, 'rsi_os': 52, 'rsi_ob': 75, 'vol_spike': 0.15147038471703766, 'adx_thresh': 13.271927454869074, 'atr_min_pct': 0.01631552917011176, 'atr_max_pct': 0.06989078646265857, 'tp_mult': 1.8574523260430198, 'tsl_mult': 0.4316175906224654, 'strategy': 'mean_reversion', 'time_stop': 180, 'use_sma': True, 'use_atr': True, 'use_adx': True, 'use_ema': False, 'use_spike': True, 'rsi_required': False, 'edge_k': 1.2732802613459002, 'edge_cap': 0.1913735642082991, 'bull_strategy': 'breakout', 'bull_bb_std_mult': 1.9096976172881373, 'bull_rsi_os': 43, 'bull_rsi_ob': 59, 'bull_adx_thresh': 26.094331251905174, 'bull_atr_min_pct': 0.01871498302131696, 'bull_atr_max_pct': 0.1315671813728079, 'bull_tp_mult': 1.6104065169254338, 'bull_tsl_mult': 0.021115880922742192, 'bull_time_stop': 38, 'bull_use_sma': True, 'bull_use_ema': True, 'bull_use_atr': True, 'bull_use_adx': True, 'bull_use_spike': True, 'bull_rsi_required': True, 'bear_strategy': 'breakout', 'bear_bb_std_mult': 2.361905378919404, 'bear_rsi_os': 36, 'bear_rsi_ob': 95, 'bear_adx_thresh': 18.8640027149804, 'bear_atr_min_pct': 0.005430093565841421, 'bear_atr_max_pct': 0.11131807611705449, 'bear_tp_mult': 2.094174177606217, 'bear_tsl_mult': 0.4424985575589218, 'bear_time_stop': 292, 'bear_use_sma': False, 'bear_use_ema': False, 'bear_use_atr': False, 'bear_use_adx': True, 'bear_use_spike': True, 'bear_rsi_required': True, 'sideways_strategy': 'mean_reversion', 'sideways_bb_std_mult': 1.7750599650988552, 'sideways_rsi_os': 47, 'sideways_rsi_ob': 72, 'sideways_adx_thresh': 23.267588957670753, 'sideways_atr_min_pct': 0.0017213991395241012, 'sideways_atr_max_pct': 0.11549246786661324, 'sideways_tp_mult': 1.1615096008842007, 'sideways_tsl_mult': 0.17984517906611666, 'sideways_time_stop': 37, 'sideways_use_sma': True, 'sideways_use_ema': True, 'sideways_use_atr': False, 'sideways_use_adx': True, 'sideways_use_spike': False, 'sideways_rsi_required': True}.
[I 2025-08-30 16:45:58,661] Trial 867 finished with values: [-1000000000.0, 1000000000.0] and parameters: {'p_sma': 7, 'p_std': 22, 'p_atr': 29, 'p_adx': 16, 'rsi_period': 80, 'ema1': 23, 'ema2': 30, 'slip_atr_k': 0.045848531311011104, 'slip_spread_k': 0.1905959489462039, 'spread_hl_frac': 0.027419169314559785, 'bb_std_mult': 3.1844081413192624, 'rsi_os': 49, 'rsi_ob': 75, 'vol_spike': 0.14659688030650794, 'adx_thresh': 12.546145056798188, 'atr_min_pct': 0.01657810313318508, 'atr_max_pct': 0.06831774947698405, 'tp_mult': 1.8693354786079956, 'tsl_mult': 0.5250063890488544, 'strategy': 'mean_reversion', 'time_stop': 195, 'use_sma': True, 'use_atr': True, 'use_adx': True, 'use_ema': True, 'use_spike': True, 'rsi_required': False, 'edge_k': 1.0357754926649019, 'edge_cap': 0.3189158261248587, 'bull_strategy': 'breakout', 'bull_bb_std_mult': 1.7820729615740438, 'bull_rsi_os': 43, 'bull_rsi_ob': 62, 'bull_adx_thresh': 26.412427251298077, 'bull_atr_min_pct': 0.019251304718879446, 'bull_atr_max_pct': 0.12501250533188427, 'bull_tp_mult': 1.6865652090281922, 'bull_tsl_mult': 0.08112769579035806, 'bull_time_stop': 38, 'bull_use_sma': True, 'bull_use_ema': True, 'bull_use_atr': True, 'bull_use_adx': True, 'bull_use_spike': True, 'bull_rsi_required': True, 'bear_strategy': 'mean_reversion', 'bear_bb_std_mult': 2.3448621685795388, 'bear_rsi_os': 35, 'bear_rsi_ob': 89, 'bear_adx_thresh': 30.670707323817524, 'bear_atr_min_pct': 0.006965618627042458, 'bear_atr_max_pct': 0.1418249528148515, 'bear_tp_mult': 2.1120283164475646, 'bear_tsl_mult': 0.3193890067525075, 'bear_time_stop': 286, 'bear_use_sma': False, 'bear_use_ema': False, 'bear_use_atr': False, 'bear_use_adx': True, 'bear_use_spike': True, 'bear_rsi_required': True, 'sideways_strategy': 'breakout', 'sideways_bb_std_mult': 1.798716826204191, 'sideways_rsi_os': 42, 'sideways_rsi_ob': 71, 'sideways_adx_thresh': 22.84314904125409, 'sideways_atr_min_pct': 0.002234076924327151, 'sideways_atr_max_pct': 0.12166341241090173, 'sideways_tp_mult': 2.9100157663623083, 'sideways_tsl_mult': 0.1174532658721231, 'sideways_time_stop': 48, 'sideways_use_sma': True, 'sideways_use_ema': True, 'sideways_use_atr': False, 'sideways_use_adx': True, 'sideways_use_spike': True, 'sideways_rsi_required': True}.
[I 2025-08-30 16:45:59,136] Trial 868 finished with values: [-1000000000.0, 1000000000.0] and parameters: {'p_sma': 53, 'p_std': 22, 'p_atr': 19, 'p_adx': 15, 'rsi_period': 84, 'ema1': 24, 'ema2': 29, 'slip_atr_k': 0.05970442920065232, 'slip_spread_k': 0.18786051939683013, 'spread_hl_frac': 0.027517404980871775, 'bb_std_mult': 2.940350751932984, 'rsi_os': 49, 'rsi_ob': 75, 'vol_spike': 0.1528586640410975, 'adx_thresh': 12.783516015504324, 'atr_min_pct': 0.016492610226838306, 'atr_max_pct': 0.06950336326096147, 'tp_mult': 1.972875619551407, 'tsl_mult': 0.44339630746021225, 'strategy': 'mean_reversion', 'time_stop': 97, 'use_sma': True, 'use_atr': True, 'use_adx': True, 'use_ema': False, 'use_spike': True, 'rsi_required': False, 'edge_k': 1.1267971929554665, 'edge_cap': 0.319563328053626, 'bull_strategy': 'breakout', 'bull_bb_std_mult': 1.8078449775617205, 'bull_rsi_os': 43, 'bull_rsi_ob': 62, 'bull_adx_thresh': 26.830711843144087, 'bull_atr_min_pct': 0.019370993754026282, 'bull_atr_max_pct': 0.12524666610480786, 'bull_tp_mult': 1.7387130185588724, 'bull_tsl_mult': 0.4435271896108821, 'bull_time_stop': 39, 'bull_use_sma': True, 'bull_use_ema': True, 'bull_use_atr': True, 'bull_use_adx': True, 'bull_use_spike': True, 'bull_rsi_required': True, 'bear_strategy': 'mean_reversion', 'bear_bb_std_mult': 2.4077547359747458, 'bear_rsi_os': 40, 'bear_rsi_ob': 88, 'bear_adx_thresh': 30.53632406872778, 'bear_atr_min_pct': 0.0010870679191160174, 'bear_atr_max_pct': 0.14153162758339463, 'bear_tp_mult': 2.5686698376554022, 'bear_tsl_mult': 0.44407450230423884, 'bear_time_stop': 297, 'bear_use_sma': False, 'bear_use_ema': False, 'bear_use_atr': False, 'bear_use_adx': True, 'bear_use_spike': True, 'bear_rsi_required': True, 'sideways_strategy': 'mean_reversion', 'sideways_bb_std_mult': 1.779124861387646, 'sideways_rsi_os': 43, 'sideways_rsi_ob': 73, 'sideways_adx_thresh': 23.193999279865636, 'sideways_atr_min_pct': 0.0026539628907102323, 'sideways_atr_max_pct': 0.1229760308577443, 'sideways_tp_mult': 1.1781946577240987, 'sideways_tsl_mult': 0.1149549360077238, 'sideways_time_stop': 44, 'sideways_use_sma': True, 'sideways_use_ema': True, 'sideways_use_atr': False, 'sideways_use_adx': True, 'sideways_use_spike': False, 'sideways_rsi_required': True}.
[I 2025-08-30 16:46:06,438] Trial 874 finished with values: [-1000000000.0, 1000000000.0] and parameters: {'p_sma': 53, 'p_std': 32, 'p_atr': 28, 'p_adx': 14, 'rsi_period': 77, 'ema1': 24, 'ema2': 30, 'slip_atr_k': 0.05940642625903508, 'slip_spread_k': 0.23089670616542007, 'spread_hl_frac': 0.02711199783241798, 'bb_std_mult': 2.8012572322582607, 'rsi_os': 55, 'rsi_ob': 75, 'vol_spike': 0.13342154043064805, 'adx_thresh': 13.549995268358908, 'atr_min_pct': 0.016430553188346048, 'atr_max_pct': 0.06906935782536049, 'tp_mult': 1.8516407590316655, 'tsl_mult': 0.4717801373809781, 'strategy': 'mean_reversion', 'time_stop': 14, 'use_sma': True, 'use_atr': False, 'use_adx': True, 'use_ema': True, 'use_spike': True, 'rsi_required': False, 'edge_k': 1.1507990784438085, 'edge_cap': 0.39546492018181484, 'bull_strategy': 'breakout', 'bull_bb_std_mult': 1.1582833866856623, 'bull_rsi_os': 45, 'bull_rsi_ob': 60, 'bull_adx_thresh': 26.6725190607402, 'bull_atr_min_pct': 0.018175361780902597, 'bull_atr_max_pct': 0.11784765099481528, 'bull_tp_mult': 1.757485776969459, 'bull_tsl_mult': 0.17021099667427209, 'bull_time_stop': 32, 'bull_use_sma': True, 'bull_use_ema': True, 'bull_use_atr': True, 'bull_use_adx': True, 'bull_use_spike': False, 'bull_rsi_required': True, 'bear_strategy': 'mean_reversion', 'bear_bb_std_mult': 2.3923472453828882, 'bear_rsi_os': 37, 'bear_rsi_ob': 87, 'bear_adx_thresh': 30.71215688756422, 'bear_atr_min_pct': 0.0008544033434606819, 'bear_atr_max_pct': 0.09485248359385749, 'bear_tp_mult': 2.5441825907596693, 'bear_tsl_mult': 0.13651944391940662, 'bear_time_stop': 297, 'bear_use_sma': False, 'bear_use_ema': False, 'bear_use_atr': False, 'bear_use_adx': True, 'bear_use_spike': True, 'bear_rsi_required': False, 'sideways_strategy': 'breakout', 'sideways_bb_std_mult': 1.6378514482556388, 'sideways_rsi_os': 41, 'sideways_rsi_ob': 78, 'sideways_adx_thresh': 21.184931515801143, 'sideways_atr_min_pct': 0.0018646638828737187, 'sideways_atr_max_pct': 0.11574939688176848, 'sideways_tp_mult': 2.0989658507064886, 'sideways_tsl_mult': 0.1482762430956451, 'sideways_time_stop': 40, 'sideways_use_sma': False, 'sideways_use_ema': True, 'sideways_use_atr': False, 'sideways_use_adx': True, 'sideways_use_spike': True, 'sideways_rsi_required': True}.
