[I 2025-08-30 16:17:40,654] Trial 713 finished with values: [-1000000000.0, 1000000000.0] and parameters: {'p_sma': 6, 'p_std': 12, 'p_atr': 20, 'p_adx': 9, 'rsi_period': 77, 'ema1': 19, 'ema2': 30, 'slip_atr_k': 0.0724469891447843, 'slip_spread_k': 0.1512320663357024, 'spread_hl_frac': 0.037667122396255776, 'bb_std_mult': 2.4589344929405517, 'rsi_os': 36, 'rsi_ob': 47, 'vol_spike': 0.06719706190460589, 'adx_thresh': 14.04092860066296, 'atr_min_pct': 0.023130580179010905, 'atr_max_pct': 0.02696761364474938, 'tp_mult': 2.140669850620071, 'tsl_mult': 0.2566049033275117, 'strategy': 'mean_reversion', 'time_stop': 229, 'use_sma': True, 'use_atr': True, 'use_adx': False, 'use_ema': True, 'use_spike': False, 'rsi_required': False, 'edge_k': 0.46000431328730407, 'edge_cap': 0.9261228523333336, 'bull_strategy': 'breakout', 'bull_bb_std_mult': 0.7709425822558774, 'bull_rsi_os': 54, 'bull_rsi_ob': 64, 'bull_adx_thresh': 23.084844415896875, 'bull_atr_min_pct': 0.020708976553774436, 'bull_atr_max_pct': 0.09721324311333546, 'bull_tp_mult': 1.9239295304116708, 'bull_tsl_mult': 0.08302498982142337, 'bull_time_stop': 65, 'bull_use_sma': True, 'bull_use_ema': True, 'bull_use_atr': True, 'bull_use_adx': True, 'bull_use_spike': True, 'bull_rsi_required': True, 'bear_strategy': 'mean_reversion', 'bear_bb_std_mult': 2.5243887197274684, 'bear_rsi_os': 22, 'bear_rsi_ob': 86, 'bear_adx_thresh': 31.02191860494676, 'bear_atr_min_pct': 0.019541520769770695, 'bear_atr_max_pct': 0.09077497564127085, 'bear_tp_mult': 2.911380373166022, 'bear_tsl_mult': 0.29943641023319906, 'bear_time_stop': 251, 'bear_use_sma': False, 'bear_use_ema': False, 'bear_use_atr': True, 'bear_use_adx': True, 'bear_use_spike': True, 'bear_rsi_required': True, 'sideways_strategy': 'breakout', 'sideways_bb_std_mult': 0.9605093957904557, 'sideways_rsi_os': 10, 'sideways_rsi_ob': 62, 'sideways_adx_thresh': 24.12011762047294, 'sideways_atr_min_pct': 0.026775689020705394, 'sideways_atr_max_pct': 0.10193866597235857, 'sideways_tp_mult': 2.921770765213047, 'sideways_tsl_mult': 0.8017193855969718, 'sideways_time_stop': 83, 'sideways_use_sma': True, 'sideways_use_ema': True, 'sideways_use_atr': False, 'sideways_use_adx': True, 'sideways_use_spike': False, 'sideways_rsi_required': True}.
[I 2025-08-30 16:18:23,251] Trial 711 finished with values: [-1000000000.0, 1000000000.0] and parameters: {'p_sma': 6, 'p_std': 32, 'p_atr': 30, 'p_adx': 13, 'rsi_period': 68, 'ema1': 20, 'ema2': 30, 'slip_atr_k': 0.07269194134985697, 'slip_spread_k': 0.7983184237458443, 'spread_hl_frac': 0.02370207185369631, 'bb_std_mult': 2.2624670642919424, 'rsi_os': 39, 'rsi_ob': 72, 'vol_spike': 0.06761159093131014, 'adx_thresh': 14.948265602352013, 'atr_min_pct': 0.015649030905389574, 'atr_max_pct': 0.06894462738136753, 'tp_mult': 1.389138526149436, 'tsl_mult': 0.34489506152103333, 'strategy': 'mean_reversion', 'time_stop': 215, 'use_sma': True, 'use_atr': True, 'use_adx': False, 'use_ema': True, 'use_spike': True, 'rsi_required': False, 'edge_k': 0.3483768942656461, 'edge_cap': 0.21832286589734323, 'bull_strategy': 'breakout', 'bull_bb_std_mult': 0.7656448054717608, 'bull_rsi_os': 25, 'bull_rsi_ob': 59, 'bull_adx_thresh': 23.645794234075787, 'bull_atr_min_pct': 0.027438366862322747, 'bull_atr_max_pct': 0.08357177093011249, 'bull_tp_mult': 2.0292306247996112, 'bull_tsl_mult': 0.05626218981739512, 'bull_time_stop': 29, 'bull_use_sma': True, 'bull_use_ema': True, 'bull_use_atr': True, 'bull_use_adx': True, 'bull_use_spike': False, 'bull_rsi_required': True, 'bear_strategy': 'mean_reversion', 'bear_bb_std_mult': 2.659111881829647, 'bear_rsi_os': 22, 'bear_rsi_ob': 84, 'bear_adx_thresh': 33.20091126127834, 'bear_atr_min_pct': 0.019205798948351276, 'bear_atr_max_pct': 0.12363764500109964, 'bear_tp_mult': 2.899595327518776, 'bear_tsl_mult': 0.26771103514849587, 'bear_time_stop': 252, 'bear_use_sma': False, 'bear_use_ema': False, 'bear_use_atr': True, 'bear_use_adx': True, 'bear_use_spike': True, 'bear_rsi_required': True, 'sideways_strategy': 'breakout', 'sideways_bb_std_mult': 0.7187668880954334, 'sideways_rsi_os': 39, 'sideways_rsi_ob': 60, 'sideways_adx_thresh': 23.964917791409675, 'sideways_atr_min_pct': 0.025708792931840467, 'sideways_atr_max_pct': 0.06587779353451169, 'sideways_tp_mult': 2.9178012202999786, 'sideways_tsl_mult': 0.9094727036861052, 'sideways_time_stop': 247, 'sideways_use_sma': False, 'sideways_use_ema': True, 'sideways_use_atr': False, 'sideways_use_adx': True, 'sideways_use_spike': False, 'sideways_rsi_required': True}.
[I 2025-08-30 16:18:24,465] Trial 712 finished with values: [-1000000000.0, 1000000000.0] and parameters: {'p_sma': 6, 'p_std': 8, 'p_atr': 24, 'p_adx': 9, 'rsi_period': 76, 'ema1': 19, 'ema2': 14, 'slip_atr_k': 0.1948928786046985, 'slip_spread_k': 0.21238580433035104, 'spread_hl_frac': 0.023690288975239573, 'bb_std_mult': 2.4102096947038434, 'rsi_os': 41, 'rsi_ob': 69, 'vol_spike': 0.14605276283995453, 'adx_thresh': 14.859539308657514, 'atr_min_pct': 0.024875180264038645, 'atr_max_pct': 0.06942893913170091, 'tp_mult': 1.7478184097277798, 'tsl_mult': 0.27699734430985434, 'strategy': 'mean_reversion', 'time_stop': 191, 'use_sma': True, 'use_atr': True, 'use_adx': False, 'use_ema': True, 'use_spike': True, 'rsi_required': False, 'edge_k': 0.44593583871915193, 'edge_cap': 0.287604778018123, 'bull_strategy': 'breakout', 'bull_bb_std_mult': 0.7741092957900199, 'bull_rsi_os': 26, 'bull_rsi_ob': 63, 'bull_adx_thresh': 23.343542282308107, 'bull_atr_min_pct': 0.020578439083479685, 'bull_atr_max_pct': 0.09773901885222261, 'bull_tp_mult': 2.090915692027496, 'bull_tsl_mult': 0.04873123333212759, 'bull_time_stop': 29, 'bull_use_sma': True, 'bull_use_ema': True, 'bull_use_atr': True, 'bull_use_adx': True, 'bull_use_spike': True, 'bull_rsi_required': True, 'bear_strategy': 'mean_reversion', 'bear_bb_std_mult': 2.303572845925979, 'bear_rsi_os': 22, 'bear_rsi_ob': 86, 'bear_adx_thresh': 8.352448961911964, 'bear_atr_min_pct': 0.0032072267098098607, 'bear_atr_max_pct': 0.13369207300716612, 'bear_tp_mult': 2.8989775263745874, 'bear_tsl_mult': 0.41479017078325653, 'bear_time_stop': 282, 'bear_use_sma': False, 'bear_use_ema': False, 'bear_use_atr': True, 'bear_use_adx': True, 'bear_use_spike': True, 'bear_rsi_required': True, 'sideways_strategy': 'breakout', 'sideways_bb_std_mult': 0.9769118568751545, 'sideways_rsi_os': 37, 'sideways_rsi_ob': 62, 'sideways_adx_thresh': 23.98906984730532, 'sideways_atr_min_pct': 0.02584110622818988, 'sideways_atr_max_pct': 0.147583520484233, 'sideways_tp_mult': 2.9179843341870053, 'sideways_tsl_mult': 0.9276706391384919, 'sideways_time_stop': 243, 'sideways_use_sma': True, 'sideways_use_ema': True, 'sideways_use_atr': False, 'sideways_use_adx': True, 'sideways_use_spike': False, 'sideways_rsi_required': True}.
[I 2025-08-30 16:18:24,726] Trial 714 finished with values: [-1000000000.0, 1000000000.0] and parameters: {'p_sma': 48, 'p_std': 32, 'p_atr': 23, 'p_adx': 13, 'rsi_period': 10, 'ema1': 21, 'ema2': 30, 'slip_atr_k': 0.06812518816835077, 'slip_spread_k': 0.1515979690292934, 'spread_hl_frac': 0.020982570238332485, 'bb_std_mult': 2.400405953346231, 'rsi_os': 41, 'rsi_ob': 82, 'vol_spike': 0.06658672325668337, 'adx_thresh': 14.235918030857002, 'atr_min_pct': 0.023052018273741252, 'atr_max_pct': 0.06842114212964755, 'tp_mult': 2.150477986008154, 'tsl_mult': 0.3492272759726305, 'strategy': 'mean_reversion', 'time_stop': 190, 'use_sma': True, 'use_atr': True, 'use_adx': False, 'use_ema': True, 'use_spike': False, 'rsi_required': False, 'edge_k': 0.3401301302376017, 'edge_cap': 0.9331084954885773, 'bull_strategy': 'breakout', 'bull_bb_std_mult': 0.7586710418901966, 'bull_rsi_os': 43, 'bull_rsi_ob': 61, 'bull_adx_thresh': 23.513672247410064, 'bull_atr_min_pct': 0.02026791574076066, 'bull_atr_max_pct': 0.10266930317792572, 'bull_tp_mult': 1.9241118471736185, 'bull_tsl_mult': 0.14199755563977545, 'bull_time_stop': 65, 'bull_use_sma': True, 'bull_use_ema': True, 'bull_use_atr': True, 'bull_use_adx': True, 'bull_use_spike': True, 'bull_rsi_required': True, 'bear_strategy': 'mean_reversion', 'bear_bb_std_mult': 2.5129865215574867, 'bear_rsi_os': 32, 'bear_rsi_ob': 87, 'bear_adx_thresh': 30.330571913076604, 'bear_atr_min_pct': 0.019405500591861722, 'bear_atr_max_pct': 0.12097577309372008, 'bear_tp_mult': 2.8831829868613563, 'bear_tsl_mult': 0.41509631482104314, 'bear_time_stop': 282, 'bear_use_sma': False, 'bear_use_ema': False, 'bear_use_atr': True, 'bear_use_adx': True, 'bear_use_spike': True, 'bear_rsi_required': True, 'sideways_strategy': 'mean_reversion', 'sideways_bb_std_mult': 0.9644877883789, 'sideways_rsi_os': 20, 'sideways_rsi_ob': 62, 'sideways_adx_thresh': 23.981430324914037, 'sideways_atr_min_pct': 0.02070708454547337, 'sideways_atr_max_pct': 0.06626016582784205, 'sideways_tp_mult': 2.9232723357731225, 'sideways_tsl_mult': 0.9516399225178337, 'sideways_time_stop': 259, 'sideways_use_sma': True, 'sideways_use_ema': True, 'sideways_use_atr': False, 'sideways_use_adx': True, 'sideways_use_spike': False, 'sideways_rsi_required': True}.
[I 2025-08-30 16:18:26,334] Trial 715 finished with values: [-1000000000.0, 1000000000.0] and parameters: {'p_sma': 22, 'p_std': 33, 'p_atr': 21, 'p_adx': 12, 'rsi_period': 84, 'ema1': 21, 'ema2': 55, 'slip_atr_k': 0.06718574365127616, 'slip_spread_k': 0.20738038236225065, 'spread_hl_frac': 0.023711680490940187, 'bb_std_mult': 2.3612230443458566, 'rsi_os': 41, 'rsi_ob': 79, 'vol_spike': 0.1571346228728974, 'adx_thresh': 17.902561951406298, 'atr_min_pct': 0.015269036523398907, 'atr_max_pct': 0.13752704838952304, 'tp_mult': 1.9999258395356396, 'tsl_mult': 0.36139046278858994, 'strategy': 'mean_reversion', 'time_stop': 191, 'use_sma': True, 'use_atr': True, 'use_adx': False, 'use_ema': True, 'use_spike': True, 'rsi_required': False, 'edge_k': 0.3504959936666697, 'edge_cap': 0.5772897031951711, 'bull_strategy': 'breakout', 'bull_bb_std_mult': 0.8436810188511373, 'bull_rsi_os': 10, 'bull_rsi_ob': 66, 'bull_adx_thresh': 23.640879195048047, 'bull_atr_min_pct': 0.020203271672748484, 'bull_atr_max_pct': 0.10237711236991132, 'bull_tp_mult': 2.081678366380957, 'bull_tsl_mult': 0.05705700089624695, 'bull_time_stop': 15, 'bull_use_sma': True, 'bull_use_ema': True, 'bull_use_atr': True, 'bull_use_adx': True, 'bull_use_spike': True, 'bull_rsi_required': True, 'bear_strategy': 'mean_reversion', 'bear_bb_std_mult': 2.306579378130273, 'bear_rsi_os': 39, 'bear_rsi_ob': 87, 'bear_adx_thresh': 30.40886952566026, 'bear_atr_min_pct': 0.021438404210013175, 'bear_atr_max_pct': 0.1229601220654096, 'bear_tp_mult': 2.8763027179537817, 'bear_tsl_mult': 0.42113207093906535, 'bear_time_stop': 257, 'bear_use_sma': False, 'bear_use_ema': False, 'bear_use_atr': True, 'bear_use_adx': True, 'bear_use_spike': True, 'bear_rsi_required': False, 'sideways_strategy': 'mean_reversion', 'sideways_bb_std_mult': 0.6333413335945757, 'sideways_rsi_os': 52, 'sideways_rsi_ob': 62, 'sideways_adx_thresh': 24.39573238689006, 'sideways_atr_min_pct': 0.020752220007036262, 'sideways_atr_max_pct': 0.022826424557162682, 'sideways_tp_mult': 2.9325170918364325, 'sideways_tsl_mult': 0.9538251149041458, 'sideways_time_stop': 84, 'sideways_use_sma': True, 'sideways_use_ema': True, 'sideways_use_atr': False, 'sideways_use_adx': True, 'sideways_use_spike': False, 'sideways_rsi_required': True}.
[I 2025-08-30 16:19:13,222] Trial 718 finished with values: [-1000000000.0, 1000000000.0] and parameters: {'p_sma': 7, 'p_std': 39, 'p_atr': 28, 'p_adx': 12, 'rsi_period': 84, 'ema1': 25, 'ema2': 32, 'slip_atr_k': 0.06649558162129254, 'slip_spread_k': 0.16970727387305906, 'spread_hl_frac': 0.02545282817682278, 'bb_std_mult': 2.355214601737816, 'rsi_os': 38, 'rsi_ob': 74, 'vol_spike': 0.15894742556940014, 'adx_thresh': 15.977759806020414, 'atr_min_pct': 0.014650455581525822, 'atr_max_pct': 0.08060469046039409, 'tp_mult': 2.2906280172593796, 'tsl_mult': 0.37986671749324624, 'strategy': 'mean_reversion', 'time_stop': 210, 'use_sma': True, 'use_atr': True, 'use_adx': False, 'use_ema': True, 'use_spike': True, 'rsi_required': False, 'edge_k': 0.43335776514289703, 'edge_cap': 0.10134252229689716, 'bull_strategy': 'breakout', 'bull_bb_std_mult': 0.8558741808626236, 'bull_rsi_os': 13, 'bull_rsi_ob': 66, 'bull_adx_thresh': 24.03874097107827, 'bull_atr_min_pct': 0.01796430405137628, 'bull_atr_max_pct': 0.08928053813075097, 'bull_tp_mult': 2.4883136025936285, 'bull_tsl_mult': 0.0023339710542634867, 'bull_time_stop': 11, 'bull_use_sma': True, 'bull_use_ema': True, 'bull_use_atr': True, 'bull_use_adx': True, 'bull_use_spike': True, 'bull_rsi_required': True, 'bear_strategy': 'mean_reversion', 'bear_bb_std_mult': 2.3489539275193216, 'bear_rsi_os': 39, 'bear_rsi_ob': 82, 'bear_adx_thresh': 29.662835448570007, 'bear_atr_min_pct': 0.019924795794312646, 'bear_atr_max_pct': 0.07631682618573954, 'bear_tp_mult': 2.7711131730609795, 'bear_tsl_mult': 0.22226314985179169, 'bear_time_stop': 264, 'bear_use_sma': False, 'bear_use_ema': False, 'bear_use_atr': True, 'bear_use_adx': True, 'bear_use_spike': True, 'bear_rsi_required': False, 'sideways_strategy': 'mean_reversion', 'sideways_bb_std_mult': 1.5113649363632329, 'sideways_rsi_os': 52, 'sideways_rsi_ob': 63, 'sideways_adx_thresh': 23.131771609339552, 'sideways_atr_min_pct': 0.0014085590747295092, 'sideways_atr_max_pct': 0.10960180668875524, 'sideways_tp_mult': 2.953310769861618, 'sideways_tsl_mult': 0.9518426402384141, 'sideways_time_stop': 67, 'sideways_use_sma': True, 'sideways_use_ema': True, 'sideways_use_atr': False, 'sideways_use_adx': True, 'sideways_use_spike': True, 'sideways_rsi_required': True}.
[I 2025-08-30 16:19:14,622] Trial 717 finished with values: [-1000000000.0, 1000000000.0] and parameters: {'p_sma': 15, 'p_std': 25, 'p_atr': 21, 'p_adx': 12, 'rsi_period': 10, 'ema1': 25, 'ema2': 33, 'slip_atr_k': 0.06750811627685144, 'slip_spread_k': 0.8297082967120741, 'spread_hl_frac': 0.025527625134343188, 'bb_std_mult': 2.362771360902895, 'rsi_os': 38, 'rsi_ob': 79, 'vol_spike': 0.15713983947989818, 'adx_thresh': 15.960435754719267, 'atr_min_pct': 0.01476765113915065, 'atr_max_pct': 0.08186192559351335, 'tp_mult': 2.289530907977603, 'tsl_mult': 0.4452612616938738, 'strategy': 'mean_reversion', 'time_stop': 225, 'use_sma': True, 'use_atr': True, 'use_adx': False, 'use_ema': True, 'use_spike': False, 'rsi_required': False, 'edge_k': 0.5426137752212403, 'edge_cap': 0.6500911751505005, 'bull_strategy': 'breakout', 'bull_bb_std_mult': 0.8533409952074658, 'bull_rsi_os': 9, 'bull_rsi_ob': 62, 'bull_adx_thresh': 23.812817711013825, 'bull_atr_min_pct': 0.02000293558668703, 'bull_atr_max_pct': 0.08892617168632135, 'bull_tp_mult': 2.485363935484268, 'bull_tsl_mult': 0.13967963702884403, 'bull_time_stop': 53, 'bull_use_sma': True, 'bull_use_ema': True, 'bull_use_atr': True, 'bull_use_adx': True, 'bull_use_spike': True, 'bull_rsi_required': True, 'bear_strategy': 'mean_reversion', 'bear_bb_std_mult': 2.4748509322438705, 'bear_rsi_os': 36, 'bear_rsi_ob': 87, 'bear_adx_thresh': 16.357749798751847, 'bear_atr_min_pct': 0.0014747132072083693, 'bear_atr_max_pct': 0.1202537563787239, 'bear_tp_mult': 2.783825819957048, 'bear_tsl_mult': 0.5810997207547868, 'bear_time_stop': 261, 'bear_use_sma': False, 'bear_use_ema': False, 'bear_use_atr': True, 'bear_use_adx': True, 'bear_use_spike': True, 'bear_rsi_required': False, 'sideways_strategy': 'mean_reversion', 'sideways_bb_std_mult': 0.63942070048405, 'sideways_rsi_os': 50, 'sideways_rsi_ob': 65, 'sideways_adx_thresh': 24.554719056712138, 'sideways_atr_min_pct': 0.01842055754662227, 'sideways_atr_max_pct': 0.0603894404682535, 'sideways_tp_mult': 2.9588873005530583, 'sideways_tsl_mult': 0.3173022802199489, 'sideways_time_stop': 83, 'sideways_use_sma': True, 'sideways_use_ema': True, 'sideways_use_atr': False, 'sideways_use_adx': True, 'sideways_use_spike': True, 'sideways_rsi_required': True}.
[I 2025-08-30 16:19:15,130] Trial 716 finished with values: [-1000000000.0, 1000000000.0] and parameters: {'p_sma': 48, 'p_std': 54, 'p_atr': 23, 'p_adx': 12, 'rsi_period': 76, 'ema1': 25, 'ema2': 14, 'slip_atr_k': 0.06803503834908735, 'slip_spread_k': 0.5051371615731676, 'spread_hl_frac': 0.021048160752004146, 'bb_std_mult': 2.3686154350459625, 'rsi_os': 41, 'rsi_ob': 86, 'vol_spike': 0.15793042614824418, 'adx_thresh': 34.96759419249722, 'atr_min_pct': 0.01481756514377463, 'atr_max_pct': 0.057278336665491654, 'tp_mult': 2.0006895914852088, 'tsl_mult': 0.5196182495174929, 'strategy': 'mean_reversion', 'time_stop': 195, 'use_sma': True, 'use_atr': True, 'use_adx': False, 'use_ema': True, 'use_spike': True, 'rsi_required': False, 'edge_k': 0.426393242592573, 'edge_cap': 0.5792768154674114, 'bull_strategy': 'breakout', 'bull_bb_std_mult': 0.8594394801936315, 'bull_rsi_os': 43, 'bull_rsi_ob': 66, 'bull_adx_thresh': 23.727043544616215, 'bull_atr_min_pct': 0.020153583089400615, 'bull_atr_max_pct': 0.10182046842778346, 'bull_tp_mult': 2.080190403181699, 'bull_tsl_mult': 0.1347664316895355, 'bull_time_stop': 54, 'bull_use_sma': True, 'bull_use_ema': True, 'bull_use_atr': True, 'bull_use_adx': True, 'bull_use_spike': True, 'bull_rsi_required': True, 'bear_strategy': 'mean_reversion', 'bear_bb_std_mult': 2.4914607911640037, 'bear_rsi_os': 33, 'bear_rsi_ob': 87, 'bear_adx_thresh': 30.22769973702802, 'bear_atr_min_pct': 0.026629317167800183, 'bear_atr_max_pct': 0.11915966940440484, 'bear_tp_mult': 2.8720380903537066, 'bear_tsl_mult': 0.4071880332768672, 'bear_time_stop': 258, 'bear_use_sma': False, 'bear_use_ema': False, 'bear_use_atr': True, 'bear_use_adx': True, 'bear_use_spike': True, 'bear_rsi_required': False, 'sideways_strategy': 'mean_reversion', 'sideways_bb_std_mult': 0.635128646493273, 'sideways_rsi_os': 54, 'sideways_rsi_ob': 62, 'sideways_adx_thresh': 24.595919098903437, 'sideways_atr_min_pct': 0.014520750667422037, 'sideways_atr_max_pct': 0.05981035985276538, 'sideways_tp_mult': 2.9467190858869197, 'sideways_tsl_mult': 0.3299038373694523, 'sideways_time_stop': 84, 'sideways_use_sma': True, 'sideways_use_ema': True, 'sideways_use_atr': False, 'sideways_use_adx': True, 'sideways_use_spike': True, 'sideways_rsi_required': True}.
[I 2025-08-30 16:19:16,262] Trial 719 finished with values: [-1000000000.0, 1000000000.0] and parameters: {'p_sma': 7, 'p_std': 40, 'p_atr': 24, 'p_adx': 10, 'rsi_period': 79, 'ema1': 18, 'ema2': 32, 'slip_atr_k': 0.13219142232257608, 'slip_spread_k': 0.17573076790337908, 'spread_hl_frac': 0.04548053770810925, 'bb_std_mult': 2.315813528012421, 'rsi_os': 43, 'rsi_ob': 80, 'vol_spike': 0.03763222806633032, 'adx_thresh': 15.51907584214376, 'atr_min_pct': 0.014534106410135828, 'atr_max_pct': 0.08106134099172901, 'tp_mult': 1.7768635118627785, 'tsl_mult': 0.31667965411602217, 'strategy': 'mean_reversion', 'time_stop': 211, 'use_sma': True, 'use_atr': True, 'use_adx': False, 'use_ema': True, 'use_spike': True, 'rsi_required': False, 'edge_k': 0.5327059534438456, 'edge_cap': 0.0999886642440328, 'bull_strategy': 'breakout', 'bull_bb_std_mult': 0.8609597014011311, 'bull_rsi_os': 40, 'bull_rsi_ob': 61, 'bull_adx_thresh': 8.306225971106173, 'bull_atr_min_pct': 0.018143602942918582, 'bull_atr_max_pct': 0.08814052142835753, 'bull_tp_mult': 2.9199496930947593, 'bull_tsl_mult': 0.1697498088086204, 'bull_time_stop': 102, 'bull_use_sma': True, 'bull_use_ema': True, 'bull_use_atr': True, 'bull_use_adx': True, 'bull_use_spike': True, 'bull_rsi_required': True, 'bear_strategy': 'mean_reversion', 'bear_bb_std_mult': 2.4705951524496386, 'bear_rsi_os': 48, 'bear_rsi_ob': 85, 'bear_adx_thresh': 29.46719103924029, 'bear_atr_min_pct': 0.0066071714525765685, 'bear_atr_max_pct': 0.1433406121967843, 'bear_tp_mult': 2.7660526880445384, 'bear_tsl_mult': 0.530840983980869, 'bear_time_stop': 245, 'bear_use_sma': False, 'bear_use_ema': False, 'bear_use_atr': True, 'bear_use_adx': True, 'bear_use_spike': True, 'bear_rsi_required': False, 'sideways_strategy': 'breakout', 'sideways_bb_std_mult': 1.5015966649803345, 'sideways_rsi_os': 25, 'sideways_rsi_ob': 60, 'sideways_adx_thresh': 23.127617247611877, 'sideways_atr_min_pct': 0.01354684842174515, 'sideways_atr_max_pct': 0.10115876552464134, 'sideways_tp_mult': 2.963472097742197, 'sideways_tsl_mult': 0.29872625024569, 'sideways_time_stop': 81, 'sideways_use_sma': True, 'sideways_use_ema': False, 'sideways_use_atr': False, 'sideways_use_adx': True, 'sideways_use_spike': True, 'sideways_rsi_required': True}.
