[I 2025-08-30 14:54:48,019] Trial 278 finished with values: [-1000000000.0, 1000000000.0] and parameters: {'p_sma': 15, 'p_std': 60, 'p_atr': 13, 'p_adx': 13, 'rsi_period': 48, 'ema1': 24, 'ema2': 48, 'slip_atr_k': 0.018642140534064086, 'slip_spread_k': 0.2750905599138552, 'spread_hl_frac': 0.04995878219316072, 'bb_std_mult': 3.545853545767303, 'rsi_os': 6, 'rsi_ob': 94, 'vol_spike': 0.054469011718014534, 'adx_thresh': 6.323587295940818, 'atr_min_pct': 0.01977290895899949, 'atr_max_pct': 0.028757390859714252, 'tp_mult': 2.5296963681178006, 'tsl_mult': 0.9999551843035679, 'strategy': 'breakout', 'time_stop': 24, 'use_sma': True, 'use_atr': True, 'use_adx': False, 'use_ema': True, 'use_spike': False, 'rsi_required': True, 'edge_k': 0.6283368551186017, 'edge_cap': 0.6888449154697439, 'bull_strategy': 'mean_reversion', 'bull_bb_std_mult': 3.452178105545673, 'bull_rsi_os': 25, 'bull_rsi_ob': 77, 'bull_adx_thresh': 13.592695006572878, 'bull_atr_min_pct': 0.0033207849295081066, 'bull_atr_max_pct': 0.10600880420381228, 'bull_tp_mult': 1.3470668609996888, 'bull_tsl_mult': 0.13304505611416112, 'bull_time_stop': 61, 'bull_use_sma': False, 'bull_use_ema': False, 'bull_use_atr': True, 'bull_use_adx': True, 'bull_use_spike': False, 'bull_rsi_required': False, 'bear_strategy': 'breakout', 'bear_bb_std_mult': 1.2761133378592053, 'bear_rsi_os': 13, 'bear_rsi_ob': 63, 'bear_adx_thresh': 19.032978624170912, 'bear_atr_min_pct': 0.012822164187528748, 'bear_atr_max_pct': 0.023770451442152563, 'bear_tp_mult': 2.1036211650754706, 'bear_tsl_mult': 0.24751502200809472, 'bear_time_stop': 41, 'bear_use_sma': False, 'bear_use_ema': False, 'bear_use_atr': True, 'bear_use_adx': True, 'bear_use_spike': True, 'bear_rsi_required': False, 'sideways_strategy': 'mean_reversion', 'sideways_bb_std_mult': 3.1949353104931695, 'sideways_rsi_os': 19, 'sideways_rsi_ob': 89, 'sideways_adx_thresh': 15.27812365919954, 'sideways_atr_min_pct': 0.02266070498763822, 'sideways_atr_max_pct': 0.07035178698471167, 'sideways_tp_mult': 1.1965087384112638, 'sideways_tsl_mult': 0.10832759797628214, 'sideways_time_stop': 213, 'sideways_use_sma': False, 'sideways_use_ema': False, 'sideways_use_atr': True, 'sideways_use_adx': False, 'sideways_use_spike': True, 'sideways_rsi_required': False}.
[I 2025-08-30 14:54:48,132] Trial 280 finished with values: [-1000000000.0, 1000000000.0] and parameters: {'p_sma': 39, 'p_std': 23, 'p_atr': 13, 'p_adx': 10, 'rsi_period': 48, 'ema1': 24, 'ema2': 28, 'slip_atr_k': 0.040164213758650535, 'slip_spread_k': 0.2729733201245002, 'spread_hl_frac': 0.0013059788037553817, 'bb_std_mult': 1.3569248979667035, 'rsi_os': 6, 'rsi_ob': 52, 'vol_spike': 0.24528991061653863, 'adx_thresh': 32.64463534874646, 'atr_min_pct': 0.01734360934484406, 'atr_max_pct': 0.10402792852282555, 'tp_mult': 2.4625804240716858, 'tsl_mult': 0.9588728847320671, 'strategy': 'breakout', 'time_stop': 23, 'use_sma': False, 'use_atr': True, 'use_adx': False, 'use_ema': True, 'use_spike': True, 'rsi_required': True, 'edge_k': 1.3185000005447725, 'edge_cap': 0.8945264443077593, 'bull_strategy': 'mean_reversion', 'bull_bb_std_mult': 2.955544186046497, 'bull_rsi_os': 17, 'bull_rsi_ob': 77, 'bull_adx_thresh': 13.673888720125548, 'bull_atr_min_pct': 0.004037188787878927, 'bull_atr_max_pct': 0.021165049869962916, 'bull_tp_mult': 2.1063395661750377, 'bull_tsl_mult': 0.2502274899564328, 'bull_time_stop': 15, 'bull_use_sma': False, 'bull_use_ema': False, 'bull_use_atr': False, 'bull_use_adx': True, 'bull_use_spike': False, 'bull_rsi_required': False, 'bear_strategy': 'breakout', 'bear_bb_std_mult': 1.2910571154961499, 'bear_rsi_os': 16, 'bear_rsi_ob': 62, 'bear_adx_thresh': 26.268147315998746, 'bear_atr_min_pct': 0.012205279621506535, 'bear_atr_max_pct': 0.09454584316791521, 'bear_tp_mult': 1.2101318133375933, 'bear_tsl_mult': 0.25148297198191727, 'bear_time_stop': 42, 'bear_use_sma': True, 'bear_use_ema': True, 'bear_use_atr': True, 'bear_use_adx': True, 'bear_use_spike': True, 'bear_rsi_required': False, 'sideways_strategy': 'mean_reversion', 'sideways_bb_std_mult': 3.202040528440275, 'sideways_rsi_os': 32, 'sideways_rsi_ob': 89, 'sideways_adx_thresh': 25.84195795369839, 'sideways_atr_min_pct': 0.02263229645006451, 'sideways_atr_max_pct': 0.14537594129384285, 'sideways_tp_mult': 2.723506840316929, 'sideways_tsl_mult': 0.8645765882140986, 'sideways_time_stop': 299, 'sideways_use_sma': False, 'sideways_use_ema': False, 'sideways_use_atr': True, 'sideways_use_adx': False, 'sideways_use_spike': True, 'sideways_rsi_required': False}.
[I 2025-08-30 14:54:48,755] Trial 284 finished with values: [-1000000000.0, 1000000000.0] and parameters: {'p_sma': 34, 'p_std': 10, 'p_atr': 20, 'p_adx': 23, 'rsi_period': 46, 'ema1': 28, 'ema2': 24, 'slip_atr_k': 0.015301740613249194, 'slip_spread_k': 0.24243532296429324, 'spread_hl_frac': 0.025257906865419063, 'bb_std_mult': 2.839726940641939, 'rsi_os': 54, 'rsi_ob': 56, 'vol_spike': 0.1954375516740996, 'adx_thresh': 19.810739133669422, 'atr_min_pct': 0.020512115091696162, 'atr_max_pct': 0.11666338130228357, 'tp_mult': 2.5890441027878937, 'tsl_mult': 0.9659659336418249, 'strategy': 'mean_reversion', 'time_stop': 243, 'use_sma': False, 'use_atr': False, 'use_adx': False, 'use_ema': False, 'use_spike': True, 'rsi_required': False, 'edge_k': 1.7258825068593826, 'edge_cap': 0.7346601501924607, 'bull_strategy': 'breakout', 'bull_bb_std_mult': 3.3467378545023605, 'bull_rsi_os': 10, 'bull_rsi_ob': 75, 'bull_adx_thresh': 12.811196013584379, 'bull_atr_min_pct': 0.018383164250599122, 'bull_atr_max_pct': 0.019193353971684608, 'bull_tp_mult': 1.4307241952394978, 'bull_tsl_mult': 0.4655237532248662, 'bull_time_stop': 270, 'bull_use_sma': True, 'bull_use_ema': True, 'bull_use_atr': False, 'bull_use_adx': False, 'bull_use_spike': True, 'bull_rsi_required': True, 'bear_strategy': 'mean_reversion', 'bear_bb_std_mult': 1.0390441122208471, 'bear_rsi_os': 14, 'bear_rsi_ob': 78, 'bear_adx_thresh': 10.285996599635315, 'bear_atr_min_pct': 0.01751841305151987, 'bear_atr_max_pct': 0.07923773592508758, 'bear_tp_mult': 1.981029423337168, 'bear_tsl_mult': 0.15953279176207955, 'bear_time_stop': 31, 'bear_use_sma': False, 'bear_use_ema': True, 'bear_use_atr': False, 'bear_use_adx': False, 'bear_use_spike': False, 'bear_rsi_required': True, 'sideways_strategy': 'breakout', 'sideways_bb_std_mult': 2.6728130065636786, 'sideways_rsi_os': 35, 'sideways_rsi_ob': 68, 'sideways_adx_thresh': 16.64683238964177, 'sideways_atr_min_pct': 0.015288248996146036, 'sideways_atr_max_pct': 0.09242554820956438, 'sideways_tp_mult': 2.7780068863088574, 'sideways_tsl_mult': 0.1219243845892933, 'sideways_time_stop': 44, 'sideways_use_sma': True, 'sideways_use_ema': False, 'sideways_use_atr': False, 'sideways_use_adx': True, 'sideways_use_spike': True, 'sideways_rsi_required': True}.
[I 2025-08-30 14:55:18,339] Trial 281 finished with values: [-0.012103422747365533, 0.012200305769407558] and parameters: {'p_sma': 15, 'p_std': 50, 'p_atr': 13, 'p_adx': 23, 'rsi_period': 46, 'ema1': 28, 'ema2': 24, 'slip_atr_k': 0.017066240096205217, 'slip_spread_k': 0.4949519860250243, 'spread_hl_frac': 0.0012232487894195425, 'bb_std_mult': 3.3197192689749953, 'rsi_os': 34, 'rsi_ob': 94, 'vol_spike': 0.2808107648709701, 'adx_thresh': 26.928420884312743, 'atr_min_pct': 0.01730952895823038, 'atr_max_pct': 0.052070154202144656, 'tp_mult': 2.4794877101294124, 'tsl_mult': 0.9634166246535409, 'strategy': 'breakout', 'time_stop': 140, 'use_sma': False, 'use_atr': False, 'use_adx': False, 'use_ema': False, 'use_spike': True, 'rsi_required': True, 'edge_k': 1.3178830665709862, 'edge_cap': 0.6817169958408792, 'bull_strategy': 'mean_reversion', 'bull_bb_std_mult': 3.3523259925427533, 'bull_rsi_os': 25, 'bull_rsi_ob': 86, 'bull_adx_thresh': 12.769091306884459, 'bull_atr_min_pct': 0.0038823645753853055, 'bull_atr_max_pct': 0.020583691477563962, 'bull_tp_mult': 1.4454454563398516, 'bull_tsl_mult': 0.7015378855855654, 'bull_time_stop': 86, 'bull_use_sma': False, 'bull_use_ema': False, 'bull_use_atr': False, 'bull_use_adx': True, 'bull_use_spike': False, 'bull_rsi_required': True, 'bear_strategy': 'mean_reversion', 'bear_bb_std_mult': 1.0760711050492613, 'bear_rsi_os': 13, 'bear_rsi_ob': 72, 'bear_adx_thresh': 33.32421482143236, 'bear_atr_min_pct': 0.012130811914807723, 'bear_atr_max_pct': 0.0182746311320693, 'bear_tp_mult': 1.2110824559124662, 'bear_tsl_mult': 0.051750628172687496, 'bear_time_stop': 47, 'bear_use_sma': False, 'bear_use_ema': True, 'bear_use_atr': True, 'bear_use_adx': False, 'bear_use_spike': False, 'bear_rsi_required': False, 'sideways_strategy': 'breakout', 'sideways_bb_std_mult': 3.4385532143363484, 'sideways_rsi_os': 36, 'sideways_rsi_ob': 90, 'sideways_adx_thresh': 16.64327417095266, 'sideways_atr_min_pct': 0.002344275285536556, 'sideways_atr_max_pct': 0.08476194997695194, 'sideways_tp_mult': 2.235198293574971, 'sideways_tsl_mult': 0.3710402152147568, 'sideways_time_stop': 22, 'sideways_use_sma': False, 'sideways_use_ema': False, 'sideways_use_atr': True, 'sideways_use_adx': False, 'sideways_use_spike': True, 'sideways_rsi_required': False}.
[I 2025-08-30 14:55:18,941] Trial 283 finished with values: [-0.035521473798544645, 0.0355010512931959] and parameters: {'p_sma': 35, 'p_std': 52, 'p_atr': 12, 'p_adx': 10, 'rsi_period': 21, 'ema1': 22, 'ema2': 24, 'slip_atr_k': 0.015213061751584052, 'slip_spread_k': 0.0973836956999406, 'spread_hl_frac': 0.0030485802223634735, 'bb_std_mult': 1.0946880371089729, 'rsi_os': 34, 'rsi_ob': 61, 'vol_spike': 0.2453526870331964, 'adx_thresh': 19.53159718112227, 'atr_min_pct': 0.01719332633940671, 'atr_max_pct': 0.08088378610678576, 'tp_mult': 2.450393706848442, 'tsl_mult': 0.763323573084502, 'strategy': 'mean_reversion', 'time_stop': 11, 'use_sma': False, 'use_atr': False, 'use_adx': False, 'use_ema': False, 'use_spike': True, 'rsi_required': False, 'edge_k': 1.9588368454207166, 'edge_cap': 0.7320445824445526, 'bull_strategy': 'breakout', 'bull_bb_std_mult': 2.944837566828352, 'bull_rsi_os': 30, 'bull_rsi_ob': 75, 'bull_adx_thresh': 20.690931970428878, 'bull_atr_min_pct': 0.00414551048762443, 'bull_atr_max_pct': 0.01909437382076094, 'bull_tp_mult': 1.421324478780643, 'bull_tsl_mult': 0.25031758826357176, 'bull_time_stop': 268, 'bull_use_sma': True, 'bull_use_ema': True, 'bull_use_atr': False, 'bull_use_adx': False, 'bull_use_spike': True, 'bull_rsi_required': True, 'bear_strategy': 'mean_reversion', 'bear_bb_std_mult': 1.0703233440078548, 'bear_rsi_os': 14, 'bear_rsi_ob': 85, 'bear_adx_thresh': 10.358222857216964, 'bear_atr_min_pct': 0.011556671049716456, 'bear_atr_max_pct': 0.07896875072663252, 'bear_tp_mult': 2.716447325147186, 'bear_tsl_mult': 0.1922302308292269, 'bear_time_stop': 31, 'bear_use_sma': True, 'bear_use_ema': True, 'bear_use_atr': False, 'bear_use_adx': False, 'bear_use_spike': False, 'bear_rsi_required': True, 'sideways_strategy': 'breakout', 'sideways_bb_std_mult': 3.3793418730545937, 'sideways_rsi_os': 32, 'sideways_rsi_ob': 71, 'sideways_adx_thresh': 15.929516277234509, 'sideways_atr_min_pct': 0.002359085670046047, 'sideways_atr_max_pct': 0.14361353668876975, 'sideways_tp_mult': 2.0421238853649437, 'sideways_tsl_mult': 0.8123929390303707, 'sideways_time_stop': 46, 'sideways_use_sma': True, 'sideways_use_ema': False, 'sideways_use_atr': False, 'sideways_use_adx': True, 'sideways_use_spike': True, 'sideways_rsi_required': True}.
[I 2025-08-30 14:55:19,345] Trial 282 finished with values: [-1000000000.0, 1000000000.0] and parameters: {'p_sma': 34, 'p_std': 10, 'p_atr': 13, 'p_adx': 23, 'rsi_period': 47, 'ema1': 22, 'ema2': 22, 'slip_atr_k': 0.01649910429021457, 'slip_spread_k': 0.4852895651172078, 'spread_hl_frac': 0.002794754910344869, 'bb_std_mult': 3.527378252394681, 'rsi_os': 34, 'rsi_ob': 56, 'vol_spike': 0.2227783058422832, 'adx_thresh': 18.072925155523347, 'atr_min_pct': 0.020530164053564972, 'atr_max_pct': 0.11544759164776824, 'tp_mult': 2.5093134034801685, 'tsl_mult': 0.9598255885680566, 'strategy': 'mean_reversion', 'time_stop': 153, 'use_sma': False, 'use_atr': True, 'use_adx': False, 'use_ema': True, 'use_spike': True, 'rsi_required': False, 'edge_k': 0.6206182505374587, 'edge_cap': 0.7325841606248242, 'bull_strategy': 'breakout', 'bull_bb_std_mult': 2.9438456126883286, 'bull_rsi_os': 26, 'bull_rsi_ob': 77, 'bull_adx_thresh': 13.629652464416361, 'bull_atr_min_pct': 0.01936642214335707, 'bull_atr_max_pct': 0.01952974932315559, 'bull_tp_mult': 1.413040558103006, 'bull_tsl_mult': 0.6213051894997521, 'bull_time_stop': 283, 'bull_use_sma': True, 'bull_use_ema': True, 'bull_use_atr': False, 'bull_use_adx': False, 'bull_use_spike': False, 'bull_rsi_required': True, 'bear_strategy': 'mean_reversion', 'bear_bb_std_mult': 1.047207574566722, 'bear_rsi_os': 26, 'bear_rsi_ob': 63, 'bear_adx_thresh': 21.680614152375334, 'bear_atr_min_pct': 0.012176424245090878, 'bear_atr_max_pct': 0.019327338787997857, 'bear_tp_mult': 1.9998732070934864, 'bear_tsl_mult': 0.15953673087452408, 'bear_time_stop': 45, 'bear_use_sma': False, 'bear_use_ema': True, 'bear_use_atr': False, 'bear_use_adx': True, 'bear_use_spike': False, 'bear_rsi_required': False, 'sideways_strategy': 'mean_reversion', 'sideways_bb_std_mult': 2.813179911623935, 'sideways_rsi_os': 32, 'sideways_rsi_ob': 57, 'sideways_adx_thresh': 26.78890551550718, 'sideways_atr_min_pct': 0.017266538769412712, 'sideways_atr_max_pct': 0.08459656906033453, 'sideways_tp_mult': 2.4086027049057717, 'sideways_tsl_mult': 0.8069461846713026, 'sideways_time_stop': 45, 'sideways_use_sma': True, 'sideways_use_ema': False, 'sideways_use_atr': False, 'sideways_use_adx': True, 'sideways_use_spike': True, 'sideways_rsi_required': False}.
[I 2025-08-30 14:55:19,939] Trial 285 finished with values: [-1000000000.0, 1000000000.0] and parameters: {'p_sma': 58, 'p_std': 51, 'p_atr': 18, 'p_adx': 24, 'rsi_period': 21, 'ema1': 21, 'ema2': 53, 'slip_atr_k': 0.24997852240568574, 'slip_spread_k': 0.04007080743316138, 'spread_hl_frac': 0.04375151950459472, 'bb_std_mult': 1.0326840925220238, 'rsi_os': 34, 'rsi_ob': 61, 'vol_spike': 0.0928981332418978, 'adx_thresh': 5.3089451140513635, 'atr_min_pct': 0.029045866298196582, 'atr_max_pct': 0.09833214464120975, 'tp_mult': 2.502511332829366, 'tsl_mult': 0.8858603223624057, 'strategy': 'mean_reversion', 'time_stop': 12, 'use_sma': True, 'use_atr': False, 'use_adx': False, 'use_ema': False, 'use_spike': False, 'rsi_required': False, 'edge_k': 1.827830860968056, 'edge_cap': 0.7191547433411174, 'bull_strategy': 'breakout', 'bull_bb_std_mult': 3.2192702016889108, 'bull_rsi_os': 21, 'bull_rsi_ob': 45, 'bull_adx_thresh': 10.890473529863433, 'bull_atr_min_pct': 0.013611886010178235, 'bull_atr_max_pct': 0.12922526364382964, 'bull_tp_mult': 2.5020189805943382, 'bull_tsl_mult': 0.5011910909647809, 'bull_time_stop': 267, 'bull_use_sma': True, 'bull_use_ema': True, 'bull_use_atr': True, 'bull_use_adx': False, 'bull_use_spike': False, 'bull_rsi_required': True, 'bear_strategy': 'mean_reversion', 'bear_bb_std_mult': 1.077889271124184, 'bear_rsi_os': 11, 'bear_rsi_ob': 49, 'bear_adx_thresh': 6.52330627110509, 'bear_atr_min_pct': 0.010244377144781842, 'bear_atr_max_pct': 0.020594951123348436, 'bear_tp_mult': 2.7167689464489624, 'bear_tsl_mult': 0.19251071870463574, 'bear_time_stop': 190, 'bear_use_sma': False, 'bear_use_ema': False, 'bear_use_atr': False, 'bear_use_adx': False, 'bear_use_spike': False, 'bear_rsi_required': False, 'sideways_strategy': 'breakout', 'sideways_bb_std_mult': 3.4164244330996985, 'sideways_rsi_os': 8, 'sideways_rsi_ob': 71, 'sideways_adx_thresh': 16.120680636943973, 'sideways_atr_min_pct': 0.003238343771769308, 'sideways_atr_max_pct': 0.08529564736474704, 'sideways_tp_mult': 2.632830409681457, 'sideways_tsl_mult': 0.12453143003193257, 'sideways_time_stop': 24, 'sideways_use_sma': False, 'sideways_use_ema': False, 'sideways_use_atr': False, 'sideways_use_adx': True, 'sideways_use_spike': True, 'sideways_rsi_required': True}.
[I 2025-08-30 14:55:50,453] Trial 286 finished with values: [-0.03807634363760393, 0.03797318317327757] and parameters: {'p_sma': 15, 'p_std': 52, 'p_atr': 13, 'p_adx': 24, 'rsi_period': 44, 'ema1': 29, 'ema2': 23, 'slip_atr_k': 0.10503369196588831, 'slip_spread_k': 0.4874633140244944, 'spread_hl_frac': 3.0031022256789318e-05, 'bb_std_mult': 3.340764462062809, 'rsi_os': 34, 'rsi_ob': 95, 'vol_spike': 0.28071428467556375, 'adx_thresh': 26.948035678236046, 'atr_min_pct': 0.016531915646776137, 'atr_max_pct': 0.05221840072864398, 'tp_mult': 2.4224853156137502, 'tsl_mult': 0.9007128477120074, 'strategy': 'breakout', 'time_stop': 141, 'use_sma': False, 'use_atr': False, 'use_adx': False, 'use_ema': False, 'use_spike': True, 'rsi_required': True, 'edge_k': 1.2349420612805404, 'edge_cap': 0.1051336065165509, 'bull_strategy': 'mean_reversion', 'bull_bb_std_mult': 3.470509677127806, 'bull_rsi_os': 26, 'bull_rsi_ob': 90, 'bull_adx_thresh': 10.939955277135848, 'bull_atr_min_pct': 0.006172244189414936, 'bull_atr_max_pct': 0.01678295635243968, 'bull_tp_mult': 1.5282452823915769, 'bull_tsl_mult': 0.7075762534214988, 'bull_time_stop': 83, 'bull_use_sma': False, 'bull_use_ema': False, 'bull_use_atr': False, 'bull_use_adx': True, 'bull_use_spike': False, 'bull_rsi_required': True, 'bear_strategy': 'mean_reversion', 'bear_bb_std_mult': 0.9911191916163505, 'bear_rsi_os': 11, 'bear_rsi_ob': 80, 'bear_adx_thresh': 33.58093737720823, 'bear_atr_min_pct': 0.014648345859233386, 'bear_atr_max_pct': 0.014119144234467352, 'bear_tp_mult': 1.2234003667009972, 'bear_tsl_mult': 0.030694957965881297, 'bear_time_stop': 61, 'bear_use_sma': False, 'bear_use_ema': True, 'bear_use_atr': True, 'bear_use_adx': False, 'bear_use_spike': False, 'bear_rsi_required': False, 'sideways_strategy': 'breakout', 'sideways_bb_std_mult': 3.4275327344687883, 'sideways_rsi_os': 39, 'sideways_rsi_ob': 91, 'sideways_adx_thresh': 17.81987244717366, 'sideways_atr_min_pct': 0.001490784565943086, 'sideways_atr_max_pct': 0.08896662325761788, 'sideways_tp_mult': 2.0335467402846428, 'sideways_tsl_mult': 0.37660234317307834, 'sideways_time_stop': 18, 'sideways_use_sma': False, 'sideways_use_ema': True, 'sideways_use_atr': True, 'sideways_use_adx': False, 'sideways_use_spike': False, 'sideways_rsi_required': False}.
[I 2025-08-30 14:55:50,656] Trial 289 finished with values: [-0.03656704696721458, 0.036471040806555076] and parameters: {'p_sma': 15, 'p_std': 50, 'p_atr': 13, 'p_adx': 24, 'rsi_period': 43, 'ema1': 29, 'ema2': 25, 'slip_atr_k': 0.03324009921598628, 'slip_spread_k': 0.457270709346567, 'spread_hl_frac': 5.9850154743191965e-05, 'bb_std_mult': 3.281922492724389, 'rsi_os': 33, 'rsi_ob': 95, 'vol_spike': 0.2811225509285119, 'adx_thresh': 26.72346970366175, 'atr_min_pct': 0.016623796946689372, 'atr_max_pct': 0.0530887969627797, 'tp_mult': 2.4166791596461317, 'tsl_mult': 0.9284579469702444, 'strategy': 'breakout', 'time_stop': 144, 'use_sma': False, 'use_atr': False, 'use_adx': False, 'use_ema': False, 'use_spike': True, 'rsi_required': True, 'edge_k': 1.213119771655091, 'edge_cap': 0.6277348971720689, 'bull_strategy': 'mean_reversion', 'bull_bb_std_mult': 3.4627639369815837, 'bull_rsi_os': 24, 'bull_rsi_ob': 86, 'bull_adx_thresh': 11.473339783250822, 'bull_atr_min_pct': 0.006511522070842322, 'bull_atr_max_pct': 0.017124373902793026, 'bull_tp_mult': 1.5258817288285207, 'bull_tsl_mult': 0.7083841434249567, 'bull_time_stop': 83, 'bull_use_sma': False, 'bull_use_ema': False, 'bull_use_atr': False, 'bull_use_adx': True, 'bull_use_spike': False, 'bull_rsi_required': True, 'bear_strategy': 'mean_reversion', 'bear_bb_std_mult': 0.9923092945555585, 'bear_rsi_os': 10, 'bear_rsi_ob': 68, 'bear_adx_thresh': 33.356798155872255, 'bear_atr_min_pct': 0.014848962924758572, 'bear_atr_max_pct': 0.014917801937625817, 'bear_tp_mult': 1.216559134764867, 'bear_tsl_mult': 0.02551011324521273, 'bear_time_stop': 63, 'bear_use_sma': False, 'bear_use_ema': True, 'bear_use_atr': True, 'bear_use_adx': False, 'bear_use_spike': False, 'bear_rsi_required': False, 'sideways_strategy': 'breakout', 'sideways_bb_std_mult': 3.4530641872408534, 'sideways_rsi_os': 38, 'sideways_rsi_ob': 91, 'sideways_adx_thresh': 8.544230580783523, 'sideways_atr_min_pct': 0.0013037677923703485, 'sideways_atr_max_pct': 0.0887579011679891, 'sideways_tp_mult': 2.091928568962201, 'sideways_tsl_mult': 0.3802079283602571, 'sideways_time_stop': 20, 'sideways_use_sma': False, 'sideways_use_ema': True, 'sideways_use_atr': True, 'sideways_use_adx': False, 'sideways_use_spike': False, 'sideways_rsi_required': False}.
