[I 2025-08-30 15:27:38,932] Trial 460 finished with values: [-1000000000.0, 1000000000.0] and parameters: {'p_sma': 7, 'p_std': 59, 'p_atr': 14, 'p_adx': 18, 'rsi_period': 36, 'ema1': 30, 'ema2': 35, 'slip_atr_k': 0.07116492476469913, 'slip_spread_k': 0.13981749318205794, 'spread_hl_frac': 0.027174841027336877, 'bb_std_mult': 1.02235465519832, 'rsi_os': 44, 'rsi_ob': 73, 'vol_spike': 0.1649393735522842, 'adx_thresh': 17.85004028833794, 'atr_min_pct': 0.026900657204194087, 'atr_max_pct': 0.08020237520084314, 'tp_mult': 1.8520079185946556, 'tsl_mult': 0.6166841310257345, 'strategy': 'breakout', 'time_stop': 233, 'use_sma': False, 'use_atr': True, 'use_adx': False, 'use_ema': True, 'use_spike': True, 'rsi_required': True, 'edge_k': 0.11861866846767055, 'edge_cap': 0.5603711767453393, 'bull_strategy': 'mean_reversion', 'bull_bb_std_mult': 2.666513221468896, 'bull_rsi_os': 8, 'bull_rsi_ob': 49, 'bull_adx_thresh': 22.557143020352083, 'bull_atr_min_pct': 0.020858147539565677, 'bull_atr_max_pct': 0.11879910002031147, 'bull_tp_mult': 2.18927018527529, 'bull_tsl_mult': 0.08771919531166994, 'bull_time_stop': 222, 'bull_use_sma': True, 'bull_use_ema': False, 'bull_use_atr': False, 'bull_use_adx': False, 'bull_use_spike': True, 'bull_rsi_required': False, 'bear_strategy': 'mean_reversion', 'bear_bb_std_mult': 0.5058288942830383, 'bear_rsi_os': 29, 'bear_rsi_ob': 62, 'bear_adx_thresh': 20.407020159045448, 'bear_atr_min_pct': 0.02264330895049508, 'bear_atr_max_pct': 0.06712016148122953, 'bear_tp_mult': 2.182726075802297, 'bear_tsl_mult': 0.9828693375181873, 'bear_time_stop': 71, 'bear_use_sma': True, 'bear_use_ema': True, 'bear_use_atr': True, 'bear_use_adx': False, 'bear_use_spike': False, 'bear_rsi_required': True, 'sideways_strategy': 'breakout', 'sideways_bb_std_mult': 2.409618948938399, 'sideways_rsi_os': 5, 'sideways_rsi_ob': 46, 'sideways_adx_thresh': 9.092259684186729, 'sideways_atr_min_pct': 2.916078618521792e-05, 'sideways_atr_max_pct': 0.10149325003761785, 'sideways_tp_mult': 1.2896425923188728, 'sideways_tsl_mult': 0.9808920937548475, 'sideways_time_stop': 77, 'sideways_use_sma': True, 'sideways_use_ema': True, 'sideways_use_atr': True, 'sideways_use_adx': False, 'sideways_use_spike': True, 'sideways_rsi_required': False}.
[I 2025-08-30 15:27:40,018] Trial 458 finished with values: [-1000000000.0, 1000000000.0] and parameters: {'p_sma': 7, 'p_std': 58, 'p_atr': 14, 'p_adx': 25, 'rsi_period': 73, 'ema1': 29, 'ema2': 35, 'slip_atr_k': 0.17253873589986973, 'slip_spread_k': 0.11640978371677174, 'spread_hl_frac': 0.024198350638358613, 'bb_std_mult': 0.9642992755012197, 'rsi_os': 24, 'rsi_ob': 57, 'vol_spike': 0.033125788808829285, 'adx_thresh': 14.022297398548156, 'atr_min_pct': 0.013223489837806137, 'atr_max_pct': 0.07961886928861417, 'tp_mult': 1.723891032867384, 'tsl_mult': 0.26510032021699304, 'strategy': 'breakout', 'time_stop': 123, 'use_sma': False, 'use_atr': True, 'use_adx': False, 'use_ema': True, 'use_spike': True, 'rsi_required': True, 'edge_k': 0.11812298466451708, 'edge_cap': 0.6074771001909776, 'bull_strategy': 'mean_reversion', 'bull_bb_std_mult': 0.8544291888970195, 'bull_rsi_os': 38, 'bull_rsi_ob': 51, 'bull_adx_thresh': 21.93648833552942, 'bull_atr_min_pct': 0.019559330996602287, 'bull_atr_max_pct': 0.053956402185223434, 'bull_tp_mult': 2.230237203279984, 'bull_tsl_mult': 0.35763698072874145, 'bull_time_stop': 46, 'bull_use_sma': True, 'bull_use_ema': False, 'bull_use_atr': False, 'bull_use_adx': False, 'bull_use_spike': True, 'bull_rsi_required': False, 'bear_strategy': 'mean_reversion', 'bear_bb_std_mult': 0.5013622578939977, 'bear_rsi_os': 30, 'bear_rsi_ob': 76, 'bear_adx_thresh': 20.643176688794714, 'bear_atr_min_pct': 0.022536672728905766, 'bear_atr_max_pct': 0.07494410023410325, 'bear_tp_mult': 2.332292120225992, 'bear_tsl_mult': 0.9825590200747969, 'bear_time_stop': 65, 'bear_use_sma': True, 'bear_use_ema': True, 'bear_use_atr': True, 'bear_use_adx': False, 'bear_use_spike': False, 'bear_rsi_required': True, 'sideways_strategy': 'breakout', 'sideways_bb_std_mult': 2.4940691195445424, 'sideways_rsi_os': 24, 'sideways_rsi_ob': 57, 'sideways_adx_thresh': 11.481928823276974, 'sideways_atr_min_pct': 0.012410134138888881, 'sideways_atr_max_pct': 0.10188625134536522, 'sideways_tp_mult': 2.3996780385221483, 'sideways_tsl_mult': 0.9806829391725076, 'sideways_time_stop': 87, 'sideways_use_sma': True, 'sideways_use_ema': True, 'sideways_use_atr': True, 'sideways_use_adx': False, 'sideways_use_spike': True, 'sideways_rsi_required': False}.
[I 2025-08-30 15:27:40,676] Trial 461 finished with values: [-0.04120633685603459, 0.04114621589365634] and parameters: {'p_sma': 7, 'p_std': 59, 'p_atr': 23, 'p_adx': 7, 'rsi_period': 10, 'ema1': 16, 'ema2': 33, 'slip_atr_k': 0.1887548062108525, 'slip_spread_k': 0.1387290530662057, 'spread_hl_frac': 0.04830291633201299, 'bb_std_mult': 1.2375870494059764, 'rsi_os': 28, 'rsi_ob': 80, 'vol_spike': 0.16887687026737888, 'adx_thresh': 15.449960835746255, 'atr_min_pct': 0.013422761364616394, 'atr_max_pct': 0.0797949650792033, 'tp_mult': 2.15851553627618, 'tsl_mult': 0.6526719990737763, 'strategy': 'breakout', 'time_stop': 229, 'use_sma': False, 'use_atr': True, 'use_adx': False, 'use_ema': True, 'use_spike': True, 'rsi_required': True, 'edge_k': 0.13959318490304673, 'edge_cap': 0.5612835703842189, 'bull_strategy': 'mean_reversion', 'bull_bb_std_mult': 2.72819661551942, 'bull_rsi_os': 41, 'bull_rsi_ob': 49, 'bull_adx_thresh': 32.27246125789015, 'bull_atr_min_pct': 0.020572521210988813, 'bull_atr_max_pct': 0.04232395051026867, 'bull_tp_mult': 2.090785254327367, 'bull_tsl_mult': 0.1966374930071816, 'bull_time_stop': 45, 'bull_use_sma': True, 'bull_use_ema': False, 'bull_use_atr': False, 'bull_use_adx': False, 'bull_use_spike': True, 'bull_rsi_required': False, 'bear_strategy': 'mean_reversion', 'bear_bb_std_mult': 0.5534421484613723, 'bear_rsi_os': 29, 'bear_rsi_ob': 62, 'bear_adx_thresh': 28.947823656827676, 'bear_atr_min_pct': 0.022485267643423134, 'bear_atr_max_pct': 0.06717466702419717, 'bear_tp_mult': 2.2025094766802864, 'bear_tsl_mult': 0.9787133185218865, 'bear_time_stop': 74, 'bear_use_sma': True, 'bear_use_ema': True, 'bear_use_atr': True, 'bear_use_adx': False, 'bear_use_spike': False, 'bear_rsi_required': True, 'sideways_strategy': 'mean_reversion', 'sideways_bb_std_mult': 1.9445574823431186, 'sideways_rsi_os': 20, 'sideways_rsi_ob': 57, 'sideways_adx_thresh': 8.8525559152818, 'sideways_atr_min_pct': 6.616793642146013e-06, 'sideways_atr_max_pct': 0.1007147381376003, 'sideways_tp_mult': 2.44316876126075, 'sideways_tsl_mult': 0.9784184124187733, 'sideways_time_stop': 80, 'sideways_use_sma': True, 'sideways_use_ema': True, 'sideways_use_atr': True, 'sideways_use_adx': False, 'sideways_use_spike': True, 'sideways_rsi_required': False}.
[I 2025-08-30 15:28:27,855] Trial 462 finished with values: [-1000000000.0, 1000000000.0] and parameters: {'p_sma': 5, 'p_std': 57, 'p_atr': 14, 'p_adx': 30, 'rsi_period': 79, 'ema1': 7, 'ema2': 33, 'slip_atr_k': 0.07923079297683681, 'slip_spread_k': 0.7718097604002709, 'spread_hl_frac': 0.0297361321851371, 'bb_std_mult': 1.2378691597568943, 'rsi_os': 46, 'rsi_ob': 50, 'vol_spike': 0.1697962985409711, 'adx_thresh': 15.616748885135976, 'atr_min_pct': 0.013584431156321505, 'atr_max_pct': 0.03764692790959227, 'tp_mult': 1.207609289371444, 'tsl_mult': 0.4565230160501123, 'strategy': 'breakout', 'time_stop': 254, 'use_sma': False, 'use_atr': True, 'use_adx': False, 'use_ema': True, 'use_spike': True, 'rsi_required': True, 'edge_k': 0.101167918135003, 'edge_cap': 0.7967702239902814, 'bull_strategy': 'mean_reversion', 'bull_bb_std_mult': 2.5047665181599927, 'bull_rsi_os': 41, 'bull_rsi_ob': 52, 'bull_adx_thresh': 20.657232350237756, 'bull_atr_min_pct': 0.020067920070204436, 'bull_atr_max_pct': 0.053278947948895435, 'bull_tp_mult': 2.6543570179724805, 'bull_tsl_mult': 0.4472387852806633, 'bull_time_stop': 10, 'bull_use_sma': False, 'bull_use_ema': False, 'bull_use_atr': False, 'bull_use_adx': False, 'bull_use_spike': True, 'bull_rsi_required': False, 'bear_strategy': 'mean_reversion', 'bear_bb_std_mult': 2.5082007190284297, 'bear_rsi_os': 29, 'bear_rsi_ob': 78, 'bear_adx_thresh': 9.916359177721837, 'bear_atr_min_pct': 0.021028308944194496, 'bear_atr_max_pct': 0.07698902519878394, 'bear_tp_mult': 1.6173033559231813, 'bear_tsl_mult': 0.9561773051055865, 'bear_time_stop': 55, 'bear_use_sma': True, 'bear_use_ema': True, 'bear_use_atr': True, 'bear_use_adx': False, 'bear_use_spike': False, 'bear_rsi_required': True, 'sideways_strategy': 'mean_reversion', 'sideways_bb_std_mult': 2.6154791042758365, 'sideways_rsi_os': 20, 'sideways_rsi_ob': 57, 'sideways_adx_thresh': 29.16561805387653, 'sideways_atr_min_pct': 0.00728094106431698, 'sideways_atr_max_pct': 0.09796458830237541, 'sideways_tp_mult': 2.4333525741565483, 'sideways_tsl_mult': 0.9989909919344773, 'sideways_time_stop': 70, 'sideways_use_sma': True, 'sideways_use_ema': True, 'sideways_use_atr': True, 'sideways_use_adx': False, 'sideways_use_spike': True, 'sideways_rsi_required': False}.
[I 2025-08-30 15:28:28,625] Trial 465 finished with values: [-1000000000.0, 1000000000.0] and parameters: {'p_sma': 5, 'p_std': 35, 'p_atr': 15, 'p_adx': 14, 'rsi_period': 17, 'ema1': 6, 'ema2': 33, 'slip_atr_k': 0.07928873812248557, 'slip_spread_k': 0.9016924281611757, 'spread_hl_frac': 0.026176814006988056, 'bb_std_mult': 1.4130832557755793, 'rsi_os': 25, 'rsi_ob': 55, 'vol_spike': 0.1846255585567752, 'adx_thresh': 12.96685349000488, 'atr_min_pct': 0.013606758002629142, 'atr_max_pct': 0.07630093068942424, 'tp_mult': 2.232767847055172, 'tsl_mult': 0.7396867397405064, 'strategy': 'breakout', 'time_stop': 147, 'use_sma': False, 'use_atr': True, 'use_adx': False, 'use_ema': True, 'use_spike': True, 'rsi_required': True, 'edge_k': 0.19759065024765357, 'edge_cap': 0.5031990378571067, 'bull_strategy': 'mean_reversion', 'bull_bb_std_mult': 2.496265369507529, 'bull_rsi_os': 41, 'bull_rsi_ob': 52, 'bull_adx_thresh': 20.82810440367373, 'bull_atr_min_pct': 0.02019904321829245, 'bull_atr_max_pct': 0.06855428221438045, 'bull_tp_mult': 2.1368619561593714, 'bull_tsl_mult': 0.4461571604657036, 'bull_time_stop': 158, 'bull_use_sma': False, 'bull_use_ema': True, 'bull_use_atr': False, 'bull_use_adx': False, 'bull_use_spike': True, 'bull_rsi_required': False, 'bear_strategy': 'mean_reversion', 'bear_bb_std_mult': 2.203110870198921, 'bear_rsi_os': 28, 'bear_rsi_ob': 78, 'bear_adx_thresh': 25.25403075082862, 'bear_atr_min_pct': 0.020354641909240374, 'bear_atr_max_pct': 0.07700871661218303, 'bear_tp_mult': 1.5296097741922092, 'bear_tsl_mult': 0.9485379388041165, 'bear_time_stop': 165, 'bear_use_sma': True, 'bear_use_ema': True, 'bear_use_atr': True, 'bear_use_adx': True, 'bear_use_spike': False, 'bear_rsi_required': True, 'sideways_strategy': 'mean_reversion', 'sideways_bb_std_mult': 2.2275544658397957, 'sideways_rsi_os': 44, 'sideways_rsi_ob': 75, 'sideways_adx_thresh': 27.778967033829613, 'sideways_atr_min_pct': 0.0010176644902867087, 'sideways_atr_max_pct': 0.09676742613907217, 'sideways_tp_mult': 2.4332870389654877, 'sideways_tsl_mult': 0.9460075040072016, 'sideways_time_stop': 95, 'sideways_use_sma': True, 'sideways_use_ema': True, 'sideways_use_atr': True, 'sideways_use_adx': False, 'sideways_use_spike': True, 'sideways_rsi_required': False}.
[I 2025-08-30 15:28:29,388] Trial 463 finished with values: [-1000000000.0, 1000000000.0] and parameters: {'p_sma': 5, 'p_std': 58, 'p_atr': 7, 'p_adx': 25, 'rsi_period': 79, 'ema1': 7, 'ema2': 33, 'slip_atr_k': 0.06947798179469007, 'slip_spread_k': 0.7675357082656102, 'spread_hl_frac': 0.029385368824247252, 'bb_std_mult': 1.4657574419963089, 'rsi_os': 27, 'rsi_ob': 72, 'vol_spike': 0.18523872940192931, 'adx_thresh': 15.759301952067913, 'atr_min_pct': 0.013476708821378488, 'atr_max_pct': 0.08269204707382777, 'tp_mult': 1.8001375703947955, 'tsl_mult': 0.4571995620434349, 'strategy': 'breakout', 'time_stop': 153, 'use_sma': False, 'use_atr': True, 'use_adx': False, 'use_ema': True, 'use_spike': True, 'rsi_required': True, 'edge_k': 0.09707669580743183, 'edge_cap': 0.5106133625897549, 'bull_strategy': 'mean_reversion', 'bull_bb_std_mult': 0.8598579262650601, 'bull_rsi_os': 41, 'bull_rsi_ob': 52, 'bull_adx_thresh': 8.046958701811304, 'bull_atr_min_pct': 0.019078368630201698, 'bull_atr_max_pct': 0.053358815179925, 'bull_tp_mult': 2.097006953399, 'bull_tsl_mult': 0.29316290582935295, 'bull_time_stop': 35, 'bull_use_sma': False, 'bull_use_ema': False, 'bull_use_atr': False, 'bull_use_adx': False, 'bull_use_spike': True, 'bull_rsi_required': False, 'bear_strategy': 'mean_reversion', 'bear_bb_std_mult': 3.4792891919822173, 'bear_rsi_os': 29, 'bear_rsi_ob': 76, 'bear_adx_thresh': 34.97940957350137, 'bear_atr_min_pct': 0.020292096021902357, 'bear_atr_max_pct': 0.07674977254034232, 'bear_tp_mult': 1.6168587015266669, 'bear_tsl_mult': 0.9637602977228434, 'bear_time_stop': 55, 'bear_use_sma': True, 'bear_use_ema': True, 'bear_use_atr': True, 'bear_use_adx': False, 'bear_use_spike': False, 'bear_rsi_required': True, 'sideways_strategy': 'mean_reversion', 'sideways_bb_std_mult': 2.5867461372228746, 'sideways_rsi_os': 44, 'sideways_rsi_ob': 57, 'sideways_adx_thresh': 29.103462631212444, 'sideways_atr_min_pct': 0.0009821029470484261, 'sideways_atr_max_pct': 0.022739535680803828, 'sideways_tp_mult': 1.0194408872543974, 'sideways_tsl_mult': 0.9478444719589546, 'sideways_time_stop': 71, 'sideways_use_sma': True, 'sideways_use_ema': True, 'sideways_use_atr': True, 'sideways_use_adx': False, 'sideways_use_spike': True, 'sideways_rsi_required': False}.
[I 2025-08-30 15:28:30,433] Trial 464 finished with values: [-1000000000.0, 1000000000.0] and parameters: {'p_sma': 5, 'p_std': 11, 'p_atr': 15, 'p_adx': 25, 'rsi_period': 79, 'ema1': 30, 'ema2': 33, 'slip_atr_k': 0.18054032298446318, 'slip_spread_k': 0.144550582016165, 'spread_hl_frac': 0.029502770419073798, 'bb_std_mult': 1.4147852912434467, 'rsi_os': 46, 'rsi_ob': 64, 'vol_spike': 0.1371458383922135, 'adx_thresh': 12.810705099447393, 'atr_min_pct': 0.01354428913718659, 'atr_max_pct': 0.07728710538409228, 'tp_mult': 1.798848649984547, 'tsl_mult': 0.6527912232752946, 'strategy': 'breakout', 'time_stop': 133, 'use_sma': False, 'use_atr': True, 'use_adx': False, 'use_ema': True, 'use_spike': True, 'rsi_required': True, 'edge_k': 0.20167065690154526, 'edge_cap': 0.8646682915089419, 'bull_strategy': 'mean_reversion', 'bull_bb_std_mult': 1.6161801099562891, 'bull_rsi_os': 40, 'bull_rsi_ob': 46, 'bull_adx_thresh': 20.537752638196476, 'bull_atr_min_pct': 0.01910749806142845, 'bull_atr_max_pct': 0.042044022747766197, 'bull_tp_mult': 2.7643880553361555, 'bull_tsl_mult': 0.2597858790283478, 'bull_time_stop': 214, 'bull_use_sma': False, 'bull_use_ema': False, 'bull_use_atr': False, 'bull_use_adx': False, 'bull_use_spike': True, 'bull_rsi_required': False, 'bear_strategy': 'mean_reversion', 'bear_bb_std_mult': 2.4957978762416744, 'bear_rsi_os': 29, 'bear_rsi_ob': 78, 'bear_adx_thresh': 29.03539622995651, 'bear_atr_min_pct': 0.021217839149628808, 'bear_atr_max_pct': 0.06792535845520264, 'bear_tp_mult': 1.5974272025954215, 'bear_tsl_mult': 0.6318794756138716, 'bear_time_stop': 55, 'bear_use_sma': True, 'bear_use_ema': True, 'bear_use_atr': True, 'bear_use_adx': False, 'bear_use_spike': False, 'bear_rsi_required': True, 'sideways_strategy': 'mean_reversion', 'sideways_bb_std_mult': 2.609940252474368, 'sideways_rsi_os': 44, 'sideways_rsi_ob': 58, 'sideways_adx_thresh': 27.83640711536526, 'sideways_atr_min_pct': 0.007510938781903541, 'sideways_atr_max_pct': 0.09761283523859562, 'sideways_tp_mult': 2.439391020839815, 'sideways_tsl_mult': 0.9445073798305557, 'sideways_time_stop': 70, 'sideways_use_sma': True, 'sideways_use_ema': True, 'sideways_use_atr': True, 'sideways_use_adx': False, 'sideways_use_spike': True, 'sideways_rsi_required': False}.
[I 2025-08-30 15:29:16,497] Trial 469 finished with values: [-1000000000.0, 1000000000.0] and parameters: {'p_sma': 6, 'p_std': 57, 'p_atr': 9, 'p_adx': 17, 'rsi_period': 32, 'ema1': 30, 'ema2': 37, 'slip_atr_k': 0.2145096623750859, 'slip_spread_k': 0.08025554437450641, 'spread_hl_frac': 0.007715867831830658, 'bb_std_mult': 1.153634297368516, 'rsi_os': 24, 'rsi_ob': 46, 'vol_spike': 0.014465287826445516, 'adx_thresh': 12.08167102715226, 'atr_min_pct': 0.005840487098129423, 'atr_max_pct': 0.07438416329847597, 'tp_mult': 1.2966191072371807, 'tsl_mult': 0.777711666500879, 'strategy': 'breakout', 'time_stop': 141, 'use_sma': False, 'use_atr': True, 'use_adx': False, 'use_ema': True, 'use_spike': True, 'rsi_required': True, 'edge_k': 0.04741730038422745, 'edge_cap': 0.5810450766755184, 'bull_strategy': 'mean_reversion', 'bull_bb_std_mult': 2.5965331061729615, 'bull_rsi_os': 39, 'bull_rsi_ob': 50, 'bull_adx_thresh': 22.498789189037442, 'bull_atr_min_pct': 0.023630320310514034, 'bull_atr_max_pct': 0.07446982748908125, 'bull_tp_mult': 2.8229094249418303, 'bull_tsl_mult': 0.21655833383130968, 'bull_time_stop': 167, 'bull_use_sma': False, 'bull_use_ema': True, 'bull_use_atr': False, 'bull_use_adx': False, 'bull_use_spike': True, 'bull_rsi_required': False, 'bear_strategy': 'mean_reversion', 'bear_bb_std_mult': 0.6545293073887641, 'bear_rsi_os': 47, 'bear_rsi_ob': 92, 'bear_adx_thresh': 12.900412707659145, 'bear_atr_min_pct': 0.021781284933666142, 'bear_atr_max_pct': 0.07138003704340216, 'bear_tp_mult': 2.4634702539152817, 'bear_tsl_mult': 0.8143561973275697, 'bear_time_stop': 241, 'bear_use_sma': True, 'bear_use_ema': True, 'bear_use_atr': True, 'bear_use_adx': True, 'bear_use_spike': False, 'bear_rsi_required': True, 'sideways_strategy': 'breakout', 'sideways_bb_std_mult': 1.8879365871216645, 'sideways_rsi_os': 42, 'sideways_rsi_ob': 45, 'sideways_adx_thresh': 26.57516015481923, 'sideways_atr_min_pct': 0.013539722594422945, 'sideways_atr_max_pct': 0.05038352999552731, 'sideways_tp_mult': 2.5309454119832298, 'sideways_tsl_mult': 0.9664311428530977, 'sideways_time_stop': 91, 'sideways_use_sma': True, 'sideways_use_ema': True, 'sideways_use_atr': True, 'sideways_use_adx': False, 'sideways_use_spike': True, 'sideways_rsi_required': False}.
[I 2025-08-30 15:29:18,223] Trial 466 finished with values: [-0.014761162225752966, 0.014654239290009625] and parameters: {'p_sma': 6, 'p_std': 36, 'p_atr': 7, 'p_adx': 25, 'rsi_period': 79, 'ema1': 30, 'ema2': 32, 'slip_atr_k': 0.06923582418591616, 'slip_spread_k': 0.07630082102696134, 'spread_hl_frac': 0.02609737389434835, 'bb_std_mult': 1.4523546631657331, 'rsi_os': 22, 'rsi_ob': 55, 'vol_spike': 0.18690794015907683, 'adx_thresh': 12.233696107592213, 'atr_min_pct': 0.0012253040416059704, 'atr_max_pct': 0.0765028119274752, 'tp_mult': 1.7959002754496751, 'tsl_mult': 0.7432353980463359, 'strategy': 'breakout', 'time_stop': 153, 'use_sma': False, 'use_atr': True, 'use_adx': False, 'use_ema': True, 'use_spike': True, 'rsi_required': True, 'edge_k': 0.2137659352190716, 'edge_cap': 0.5024986071380342, 'bull_strategy': 'mean_reversion', 'bull_bb_std_mult': 1.6071802795734715, 'bull_rsi_os': 40, 'bull_rsi_ob': 47, 'bull_adx_thresh': 22.50777361775308, 'bull_atr_min_pct': 0.021613298494525604, 'bull_atr_max_pct': 0.13320942495788227, 'bull_tp_mult': 2.770359681061896, 'bull_tsl_mult': 0.2946300279663796, 'bull_time_stop': 196, 'bull_use_sma': False, 'bull_use_ema': True, 'bull_use_atr': False, 'bull_use_adx': False, 'bull_use_spike': True, 'bull_rsi_required': False, 'bear_strategy': 'mean_reversion', 'bear_bb_std_mult': 2.2393884405691726, 'bear_rsi_os': 28, 'bear_rsi_ob': 93, 'bear_adx_thresh': 21.497714659981703, 'bear_atr_min_pct': 0.020260250311164567, 'bear_atr_max_pct': 0.07101720211660628, 'bear_tp_mult': 2.467433970504603, 'bear_tsl_mult': 0.817922961812938, 'bear_time_stop': 166, 'bear_use_sma': True, 'bear_use_ema': True, 'bear_use_atr': True, 'bear_use_adx': True, 'bear_use_spike': False, 'bear_rsi_required': True, 'sideways_strategy': 'breakout', 'sideways_bb_std_mult': 1.8805093826029107, 'sideways_rsi_os': 44, 'sideways_rsi_ob': 76, 'sideways_adx_thresh': 27.85103316090899, 'sideways_atr_min_pct': 0.0011716977291049936, 'sideways_atr_max_pct': 0.04119846792375609, 'sideways_tp_mult': 1.0185571731110805, 'sideways_tsl_mult': 0.9492194310569331, 'sideways_time_stop': 92, 'sideways_use_sma': True, 'sideways_use_ema': True, 'sideways_use_atr': True, 'sideways_use_adx': False, 'sideways_use_spike': True, 'sideways_rsi_required': False}.
