[I 2025-08-30 14:43:25,973] Trial 189 finished with values: [-1000000000.0, 1000000000.0] and parameters: {'p_sma': 30, 'p_std': 27, 'p_atr': 26, 'p_adx': 28, 'rsi_period': 47, 'ema1': 25, 'ema2': 35, 'slip_atr_k': 0.1127594452659621, 'slip_spread_k': 0.17186988312976864, 'spread_hl_frac': 0.013162127111392715, 'bb_std_mult': 0.6611801903820889, 'rsi_os': 26, 'rsi_ob': 75, 'vol_spike': 0.2611380096393518, 'adx_thresh': 22.086642481896273, 'atr_min_pct': 0.020780873332503082, 'atr_max_pct': 0.09198088133450365, 'tp_mult': 2.5127154089693615, 'tsl_mult': 0.4338517441495291, 'strategy': 'mean_reversion', 'time_stop': 156, 'use_sma': False, 'use_atr': False, 'use_adx': False, 'use_ema': False, 'use_spike': False, 'rsi_required': False, 'edge_k': 1.7507020608750365, 'edge_cap': 0.7857800330653448, 'bull_strategy': 'breakout', 'bull_bb_std_mult': 3.3239408957059764, 'bull_rsi_os': 15, 'bull_rsi_ob': 79, 'bull_adx_thresh': 13.185909801519125, 'bull_atr_min_pct': 0.0028395968394709747, 'bull_atr_max_pct': 0.09607537001232457, 'bull_tp_mult': 2.3287059503772634, 'bull_tsl_mult': 0.4979953300346662, 'bull_time_stop': 287, 'bull_use_sma': False, 'bull_use_ema': False, 'bull_use_atr': True, 'bull_use_adx': True, 'bull_use_spike': False, 'bull_rsi_required': True, 'bear_strategy': 'breakout', 'bear_bb_std_mult': 2.4733860713679, 'bear_rsi_os': 9, 'bear_rsi_ob': 50, 'bear_adx_thresh': 27.02123887310917, 'bear_atr_min_pct': 0.02152303827020518, 'bear_atr_max_pct': 0.10726267830374417, 'bear_tp_mult': 1.6357340016041224, 'bear_tsl_mult': 0.18936844185824592, 'bear_time_stop': 188, 'bear_use_sma': False, 'bear_use_ema': True, 'bear_use_atr': True, 'bear_use_adx': False, 'bear_use_spike': False, 'bear_rsi_required': False, 'sideways_strategy': 'breakout', 'sideways_bb_std_mult': 1.2099247823861305, 'sideways_rsi_os': 47, 'sideways_rsi_ob': 86, 'sideways_adx_thresh': 12.952038127297659, 'sideways_atr_min_pct': 0.022434550500649374, 'sideways_atr_max_pct': 0.13727220118698805, 'sideways_tp_mult': 2.7659544363190127, 'sideways_tsl_mult': 0.14430672561129848, 'sideways_time_stop': 198, 'sideways_use_sma': False, 'sideways_use_ema': False, 'sideways_use_atr': False, 'sideways_use_adx': True, 'sideways_use_spike': True, 'sideways_rsi_required': False}.
[I 2025-08-30 14:43:55,764] Trial 192 finished with values: [-1000000000.0, 1000000000.0] and parameters: {'p_sma': 29, 'p_std': 49, 'p_atr': 15, 'p_adx': 27, 'rsi_period': 48, 'ema1': 7, 'ema2': 38, 'slip_atr_k': 0.02547081980812191, 'slip_spread_k': 0.5268511662170758, 'spread_hl_frac': 0.013027423092021106, 'bb_std_mult': 2.0605163403699844, 'rsi_os': 30, 'rsi_ob': 89, 'vol_spike': 0.23257779608679044, 'adx_thresh': 28.756284866259815, 'atr_min_pct': 0.01890768355738443, 'atr_max_pct': 0.09399688287307598, 'tp_mult': 1.078043197938157, 'tsl_mult': 0.3310286726350707, 'strategy': 'mean_reversion', 'time_stop': 22, 'use_sma': True, 'use_atr': False, 'use_adx': False, 'use_ema': False, 'use_spike': False, 'rsi_required': False, 'edge_k': 1.6432649569498323, 'edge_cap': 0.6978074975144974, 'bull_strategy': 'breakout', 'bull_bb_std_mult': 1.5906977912763463, 'bull_rsi_os': 15, 'bull_rsi_ob': 73, 'bull_adx_thresh': 25.272302801130397, 'bull_atr_min_pct': 0.0030480406021723607, 'bull_atr_max_pct': 0.09756946367047557, 'bull_tp_mult': 1.5134354421236171, 'bull_tsl_mult': 0.7729324226105851, 'bull_time_stop': 288, 'bull_use_sma': False, 'bull_use_ema': False, 'bull_use_atr': True, 'bull_use_adx': True, 'bull_use_spike': False, 'bull_rsi_required': True, 'bear_strategy': 'mean_reversion', 'bear_bb_std_mult': 2.2023999125547515, 'bear_rsi_os': 15, 'bear_rsi_ob': 50, 'bear_adx_thresh': 23.573334335191415, 'bear_atr_min_pct': 0.010626074993782243, 'bear_atr_max_pct': 0.015546713090319797, 'bear_tp_mult': 1.9941512137470307, 'bear_tsl_mult': 0.9615085434670327, 'bear_time_stop': 189, 'bear_use_sma': False, 'bear_use_ema': False, 'bear_use_atr': False, 'bear_use_adx': False, 'bear_use_spike': True, 'bear_rsi_required': False, 'sideways_strategy': 'breakout', 'sideways_bb_std_mult': 1.2002341022845586, 'sideways_rsi_os': 44, 'sideways_rsi_ob': 86, 'sideways_adx_thresh': 6.080987766283647, 'sideways_atr_min_pct': 0.0270302326972437, 'sideways_atr_max_pct': 0.11319463314316441, 'sideways_tp_mult': 1.5596662526443679, 'sideways_tsl_mult': 0.07830497766779347, 'sideways_time_stop': 262, 'sideways_use_sma': False, 'sideways_use_ema': False, 'sideways_use_atr': False, 'sideways_use_adx': True, 'sideways_use_spike': False, 'sideways_rsi_required': False}.
[I 2025-08-30 14:43:56,418] Trial 190 finished with values: [-1000000000.0, 1000000000.0] and parameters: {'p_sma': 43, 'p_std': 39, 'p_atr': 14, 'p_adx': 7, 'rsi_period': 83, 'ema1': 25, 'ema2': 53, 'slip_atr_k': 0.08034518523514314, 'slip_spread_k': 0.178515554662491, 'spread_hl_frac': 0.045968828515171034, 'bb_std_mult': 1.9982223683521947, 'rsi_os': 23, 'rsi_ob': 92, 'vol_spike': 0.12092566179730742, 'adx_thresh': 13.386904196713495, 'atr_min_pct': 0.01889408039553804, 'atr_max_pct': 0.051129593368650375, 'tp_mult': 2.863630434607135, 'tsl_mult': 0.9967053957176173, 'strategy': 'mean_reversion', 'time_stop': 196, 'use_sma': True, 'use_atr': False, 'use_adx': False, 'use_ema': False, 'use_spike': False, 'rsi_required': False, 'edge_k': 0.6751954197834514, 'edge_cap': 0.16426077585147525, 'bull_strategy': 'breakout', 'bull_bb_std_mult': 3.324560562084527, 'bull_rsi_os': 20, 'bull_rsi_ob': 79, 'bull_adx_thresh': 12.115799588036351, 'bull_atr_min_pct': 0.002900985085174515, 'bull_atr_max_pct': 0.018927500852488073, 'bull_tp_mult': 2.581346108731047, 'bull_tsl_mult': 0.49810363603103736, 'bull_time_stop': 288, 'bull_use_sma': False, 'bull_use_ema': True, 'bull_use_atr': True, 'bull_use_adx': True, 'bull_use_spike': False, 'bull_rsi_required': True, 'bear_strategy': 'breakout', 'bear_bb_std_mult': 1.1611545440448927, 'bear_rsi_os': 12, 'bear_rsi_ob': 50, 'bear_adx_thresh': 16.959785523564918, 'bear_atr_min_pct': 0.010246576383176094, 'bear_atr_max_pct': 0.02713594395892587, 'bear_tp_mult': 1.994402571212592, 'bear_tsl_mult': 0.8920116538541383, 'bear_time_stop': 220, 'bear_use_sma': False, 'bear_use_ema': False, 'bear_use_atr': False, 'bear_use_adx': True, 'bear_use_spike': True, 'bear_rsi_required': False, 'sideways_strategy': 'breakout', 'sideways_bb_std_mult': 0.5501652884642816, 'sideways_rsi_os': 22, 'sideways_rsi_ob': 77, 'sideways_adx_thresh': 18.993401085442443, 'sideways_atr_min_pct': 0.0034416218722718352, 'sideways_atr_max_pct': 0.0721986945185524, 'sideways_tp_mult': 1.0143428034900328, 'sideways_tsl_mult': 0.14022834606797716, 'sideways_time_stop': 219, 'sideways_use_sma': False, 'sideways_use_ema': False, 'sideways_use_atr': False, 'sideways_use_adx': True, 'sideways_use_spike': True, 'sideways_rsi_required': False}.
[I 2025-08-30 14:43:56,508] Trial 191 finished with values: [-0.02993946995554997, 0.029936825321369858] and parameters: {'p_sma': 30, 'p_std': 33, 'p_atr': 16, 'p_adx': 12, 'rsi_period': 48, 'ema1': 28, 'ema2': 14, 'slip_atr_k': 0.08025254223530026, 'slip_spread_k': 0.17378329195052689, 'spread_hl_frac': 0.0051210722052721916, 'bb_std_mult': 2.013570231483106, 'rsi_os': 23, 'rsi_ob': 63, 'vol_spike': 0.2308464234043728, 'adx_thresh': 33.13113028006916, 'atr_min_pct': 0.02276647270280972, 'atr_max_pct': 0.039405145674683256, 'tp_mult': 2.5959223190587752, 'tsl_mult': 0.998097134334498, 'strategy': 'mean_reversion', 'time_stop': 24, 'use_sma': True, 'use_atr': False, 'use_adx': False, 'use_ema': False, 'use_spike': False, 'rsi_required': False, 'edge_k': 1.7487874431242842, 'edge_cap': 0.7001581277725148, 'bull_strategy': 'breakout', 'bull_bb_std_mult': 1.556038551676591, 'bull_rsi_os': 47, 'bull_rsi_ob': 79, 'bull_adx_thresh': 11.983688414806432, 'bull_atr_min_pct': 0.002807425681117336, 'bull_atr_max_pct': 0.023246615059249392, 'bull_tp_mult': 1.3844119067373206, 'bull_tsl_mult': 0.576532691758382, 'bull_time_stop': 289, 'bull_use_sma': False, 'bull_use_ema': False, 'bull_use_atr': True, 'bull_use_adx': True, 'bull_use_spike': False, 'bull_rsi_required': True, 'bear_strategy': 'breakout', 'bear_bb_std_mult': 3.3707446650886155, 'bear_rsi_os': 15, 'bear_rsi_ob': 50, 'bear_adx_thresh': 14.300322598561978, 'bear_atr_min_pct': 0.010438235695871555, 'bear_atr_max_pct': 0.014401394205404983, 'bear_tp_mult': 1.981251236232963, 'bear_tsl_mult': 0.00644868109505109, 'bear_time_stop': 177, 'bear_use_sma': False, 'bear_use_ema': False, 'bear_use_atr': False, 'bear_use_adx': False, 'bear_use_spike': True, 'bear_rsi_required': False, 'sideways_strategy': 'breakout', 'sideways_bb_std_mult': 2.52447507252799, 'sideways_rsi_os': 32, 'sideways_rsi_ob': 77, 'sideways_adx_thresh': 30.364473811148148, 'sideways_atr_min_pct': 0.0009238928464060086, 'sideways_atr_max_pct': 0.11286550945033275, 'sideways_tp_mult': 1.765174688454135, 'sideways_tsl_mult': 0.1399768997659929, 'sideways_time_stop': 262, 'sideways_use_sma': False, 'sideways_use_ema': False, 'sideways_use_atr': False, 'sideways_use_adx': True, 'sideways_use_spike': True, 'sideways_rsi_required': True}.
[I 2025-08-30 14:43:56,801] Trial 193 finished with values: [-1000000000.0, 0.1913907199998518] and parameters: {'p_sma': 45, 'p_std': 38, 'p_atr': 16, 'p_adx': 7, 'rsi_period': 43, 'ema1': 7, 'ema2': 51, 'slip_atr_k': 0.08014933998746535, 'slip_spread_k': 0.7351306998770151, 'spread_hl_frac': 0.0050882118053825545, 'bb_std_mult': 2.028285595946041, 'rsi_os': 21, 'rsi_ob': 60, 'vol_spike': 0.22829969478925088, 'adx_thresh': 28.53725790222429, 'atr_min_pct': 0.01871348217315148, 'atr_max_pct': 0.09498580542923857, 'tp_mult': 1.0685132175478338, 'tsl_mult': 0.3239366443093792, 'strategy': 'mean_reversion', 'time_stop': 23, 'use_sma': True, 'use_atr': True, 'use_adx': False, 'use_ema': True, 'use_spike': False, 'rsi_required': False, 'edge_k': 1.6729481107455533, 'edge_cap': 0.8658567795367251, 'bull_strategy': 'breakout', 'bull_bb_std_mult': 3.46460598013007, 'bull_rsi_os': 32, 'bull_rsi_ob': 52, 'bull_adx_thresh': 21.074429796144706, 'bull_atr_min_pct': 0.004205952586364474, 'bull_atr_max_pct': 0.022847895856127832, 'bull_tp_mult': 1.3929292398074191, 'bull_tsl_mult': 0.5297837016423517, 'bull_time_stop': 271, 'bull_use_sma': False, 'bull_use_ema': True, 'bull_use_atr': True, 'bull_use_adx': True, 'bull_use_spike': True, 'bull_rsi_required': False, 'bear_strategy': 'mean_reversion', 'bear_bb_std_mult': 1.4972596325580798, 'bear_rsi_os': 12, 'bear_rsi_ob': 47, 'bear_adx_thresh': 16.802231763907724, 'bear_atr_min_pct': 0.003028851189269514, 'bear_atr_max_pct': 0.016748549226041957, 'bear_tp_mult': 1.987309231723582, 'bear_tsl_mult': 0.3961937398984916, 'bear_time_stop': 137, 'bear_use_sma': False, 'bear_use_ema': False, 'bear_use_atr': False, 'bear_use_adx': True, 'bear_use_spike': True, 'bear_rsi_required': True, 'sideways_strategy': 'breakout', 'sideways_bb_std_mult': 3.089421490405626, 'sideways_rsi_os': 45, 'sideways_rsi_ob': 91, 'sideways_adx_thresh': 18.900676477019278, 'sideways_atr_min_pct': 0.0009098713290046382, 'sideways_atr_max_pct': 0.07216900560643882, 'sideways_tp_mult': 1.5608997050398843, 'sideways_tsl_mult': 0.22626340059335198, 'sideways_time_stop': 236, 'sideways_use_sma': True, 'sideways_use_ema': True, 'sideways_use_atr': False, 'sideways_use_adx': True, 'sideways_use_spike': False, 'sideways_rsi_required': True}.
[I 2025-08-30 14:44:27,946] Trial 197 finished with values: [-0.021323907847688672, 0.021217140297880424] and parameters: {'p_sma': 36, 'p_std': 31, 'p_atr': 10, 'p_adx': 22, 'rsi_period': 44, 'ema1': 27, 'ema2': 28, 'slip_atr_k': 0.054880297945114356, 'slip_spread_k': 0.26076101374215976, 'spread_hl_frac': 0.0021498637027851154, 'bb_std_mult': 0.7518451589917952, 'rsi_os': 49, 'rsi_ob': 91, 'vol_spike': 0.16983647269011065, 'adx_thresh': 21.33919215619528, 'atr_min_pct': 0.0033567184363548653, 'atr_max_pct': 0.10974542033684787, 'tp_mult': 2.588813992779156, 'tsl_mult': 0.9817808370447454, 'strategy': 'breakout', 'time_stop': 69, 'use_sma': True, 'use_atr': True, 'use_adx': False, 'use_ema': True, 'use_spike': True, 'rsi_required': True, 'edge_k': 1.5850767208638674, 'edge_cap': 0.33173204731167266, 'bull_strategy': 'mean_reversion', 'bull_bb_std_mult': 3.1511194827083093, 'bull_rsi_os': 16, 'bull_rsi_ob': 78, 'bull_adx_thresh': 22.85250365451011, 'bull_atr_min_pct': 0.0019393994339951945, 'bull_atr_max_pct': 0.026752899241212186, 'bull_tp_mult': 1.460703183258805, 'bull_tsl_mult': 0.518822135599693, 'bull_time_stop': 159, 'bull_use_sma': False, 'bull_use_ema': False, 'bull_use_atr': False, 'bull_use_adx': True, 'bull_use_spike': False, 'bull_rsi_required': True, 'bear_strategy': 'breakout', 'bear_bb_std_mult': 2.049909815008246, 'bear_rsi_os': 13, 'bear_rsi_ob': 48, 'bear_adx_thresh': 32.24032330618406, 'bear_atr_min_pct': 0.012265875182060713, 'bear_atr_max_pct': 0.026165621344998512, 'bear_tp_mult': 1.2492660943500677, 'bear_tsl_mult': 0.2125013101121507, 'bear_time_stop': 38, 'bear_use_sma': True, 'bear_use_ema': False, 'bear_use_atr': False, 'bear_use_adx': False, 'bear_use_spike': False, 'bear_rsi_required': False, 'sideways_strategy': 'breakout', 'sideways_bb_std_mult': 1.9709794643141705, 'sideways_rsi_os': 32, 'sideways_rsi_ob': 87, 'sideways_adx_thresh': 23.353110639459697, 'sideways_atr_min_pct': 0.028212942636154807, 'sideways_atr_max_pct': 0.08034250125304859, 'sideways_tp_mult': 2.689161917657854, 'sideways_tsl_mult': 0.17452223742327866, 'sideways_time_stop': 149, 'sideways_use_sma': False, 'sideways_use_ema': False, 'sideways_use_atr': True, 'sideways_use_adx': False, 'sideways_use_spike': True, 'sideways_rsi_required': True}.
[I 2025-08-30 14:44:28,951] Trial 194 finished with values: [-1000000000.0, 1000000000.0] and parameters: {'p_sma': 50, 'p_std': 40, 'p_atr': 28, 'p_adx': 22, 'rsi_period': 42, 'ema1': 28, 'ema2': 51, 'slip_atr_k': 0.20629356461929613, 'slip_spread_k': 0.2595071577285073, 'spread_hl_frac': 0.0051663032927797775, 'bb_std_mult': 2.017754030889459, 'rsi_os': 23, 'rsi_ob': 63, 'vol_spike': 0.2545322217818394, 'adx_thresh': 33.16332358629002, 'atr_min_pct': 0.021614567042782522, 'atr_max_pct': 0.10125984051550362, 'tp_mult': 2.0419385221402515, 'tsl_mult': 0.9995633646226857, 'strategy': 'mean_reversion', 'time_stop': 26, 'use_sma': True, 'use_atr': True, 'use_adx': False, 'use_ema': True, 'use_spike': False, 'rsi_required': False, 'edge_k': 1.687786956249906, 'edge_cap': 0.7030693177464733, 'bull_strategy': 'breakout', 'bull_bb_std_mult': 3.3887087507094646, 'bull_rsi_os': 40, 'bull_rsi_ob': 78, 'bull_adx_thresh': 11.703852824174394, 'bull_atr_min_pct': 0.004103750209147529, 'bull_atr_max_pct': 0.02288268742081572, 'bull_tp_mult': 2.601544157430583, 'bull_tsl_mult': 0.527137963874119, 'bull_time_stop': 272, 'bull_use_sma': False, 'bull_use_ema': True, 'bull_use_atr': True, 'bull_use_adx': True, 'bull_use_spike': False, 'bull_rsi_required': True, 'bear_strategy': 'breakout', 'bear_bb_std_mult': 3.4886729432304087, 'bear_rsi_os': 35, 'bear_rsi_ob': 67, 'bear_adx_thresh': 16.51456173776244, 'bear_atr_min_pct': 0.01208602951367459, 'bear_atr_max_pct': 0.026285790499572127, 'bear_tp_mult': 1.441627021830354, 'bear_tsl_mult': 0.8972133373782539, 'bear_time_stop': 136, 'bear_use_sma': False, 'bear_use_ema': False, 'bear_use_atr': False, 'bear_use_adx': True, 'bear_use_spike': True, 'bear_rsi_required': True, 'sideways_strategy': 'breakout', 'sideways_bb_std_mult': 3.0939285689910445, 'sideways_rsi_os': 32, 'sideways_rsi_ob': 76, 'sideways_adx_thresh': 26.40052310944028, 'sideways_atr_min_pct': 0.003666898056372503, 'sideways_atr_max_pct': 0.07234762432176167, 'sideways_tp_mult': 2.6958282427665106, 'sideways_tsl_mult': 0.44867385858479325, 'sideways_time_stop': 171, 'sideways_use_sma': True, 'sideways_use_ema': True, 'sideways_use_atr': False, 'sideways_use_adx': True, 'sideways_use_spike': True, 'sideways_rsi_required': True}.
[I 2025-08-30 14:44:29,242] Trial 195 finished with values: [-1000000000.0, 1000000000.0] and parameters: {'p_sma': 45, 'p_std': 9, 'p_atr': 29, 'p_adx': 22, 'rsi_period': 48, 'ema1': 16, 'ema2': 51, 'slip_atr_k': 0.02219339336970685, 'slip_spread_k': 0.2518043180989245, 'spread_hl_frac': 0.00506419275204753, 'bb_std_mult': 2.008213441569696, 'rsi_os': 21, 'rsi_ob': 91, 'vol_spike': 0.1986714672682322, 'adx_thresh': 20.922121521205575, 'atr_min_pct': 0.022828737063676205, 'atr_max_pct': 0.03994583959051231, 'tp_mult': 2.5783319064374335, 'tsl_mult': 0.9820208741111593, 'strategy': 'mean_reversion', 'time_stop': 22, 'use_sma': True, 'use_atr': True, 'use_adx': False, 'use_ema': True, 'use_spike': False, 'rsi_required': True, 'edge_k': 1.6789457360681102, 'edge_cap': 0.4739372121797153, 'bull_strategy': 'breakout', 'bull_bb_std_mult': 3.465436674307376, 'bull_rsi_os': 47, 'bull_rsi_ob': 86, 'bull_adx_thresh': 21.0969095837488, 'bull_atr_min_pct': 0.004326925608905114, 'bull_atr_max_pct': 0.022834839094989783, 'bull_tp_mult': 1.3733149173535277, 'bull_tsl_mult': 0.692504729119207, 'bull_time_stop': 271, 'bull_use_sma': False, 'bull_use_ema': True, 'bull_use_atr': False, 'bull_use_adx': True, 'bull_use_spike': True, 'bull_rsi_required': False, 'bear_strategy': 'breakout', 'bear_bb_std_mult': 0.7241884489203244, 'bear_rsi_os': 13, 'bear_rsi_ob': 47, 'bear_adx_thresh': 32.02702392474885, 'bear_atr_min_pct': 0.012310407537980305, 'bear_atr_max_pct': 0.09258143883773698, 'bear_tp_mult': 1.1383217928045486, 'bear_tsl_mult': 0.4190408833511802, 'bear_time_stop': 174, 'bear_use_sma': False, 'bear_use_ema': False, 'bear_use_atr': False, 'bear_use_adx': True, 'bear_use_spike': True, 'bear_rsi_required': True, 'sideways_strategy': 'breakout', 'sideways_bb_std_mult': 1.9447189492041366, 'sideways_rsi_os': 53, 'sideways_rsi_ob': 89, 'sideways_adx_thresh': 34.20299831856758, 'sideways_atr_min_pct': 0.02827316282105361, 'sideways_atr_max_pct': 0.07856365075166574, 'sideways_tp_mult': 2.6751940312172966, 'sideways_tsl_mult': 0.03222240568431714, 'sideways_time_stop': 210, 'sideways_use_sma': True, 'sideways_use_ema': True, 'sideways_use_atr': False, 'sideways_use_adx': True, 'sideways_use_spike': True, 'sideways_rsi_required': True}.
[I 2025-08-30 14:44:29,319] Trial 196 finished with values: [-1000000000.0, 1000000000.0] and parameters: {'p_sma': 23, 'p_std': 31, 'p_atr': 29, 'p_adx': 15, 'rsi_period': 42, 'ema1': 16, 'ema2': 51, 'slip_atr_k': 0.09219321580966178, 'slip_spread_k': 0.23923818777220254, 'spread_hl_frac': 0.0026333721718471907, 'bb_std_mult': 0.7701957299232891, 'rsi_os': 40, 'rsi_ob': 79, 'vol_spike': 0.2444337537711274, 'adx_thresh': 20.79751094555057, 'atr_min_pct': 0.01992268138365257, 'atr_max_pct': 0.10113327343710873, 'tp_mult': 1.8036076757450807, 'tsl_mult': 0.9798662241439173, 'strategy': 'breakout', 'time_stop': 70, 'use_sma': True, 'use_atr': True, 'use_adx': False, 'use_ema': True, 'use_spike': True, 'rsi_required': True, 'edge_k': 1.1571511487400532, 'edge_cap': 0.7274682641177722, 'bull_strategy': 'mean_reversion', 'bull_bb_std_mult': 3.42447104458856, 'bull_rsi_os': 16, 'bull_rsi_ob': 78, 'bull_adx_thresh': 14.050900971269947, 'bull_atr_min_pct': 0.004173004820117225, 'bull_atr_max_pct': 0.04430973308391091, 'bull_tp_mult': 1.4512237903209724, 'bull_tsl_mult': 0.0021043461365700122, 'bull_time_stop': 271, 'bull_use_sma': False, 'bull_use_ema': True, 'bull_use_atr': False, 'bull_use_adx': True, 'bull_use_spike': True, 'bull_rsi_required': False, 'bear_strategy': 'mean_reversion', 'bear_bb_std_mult': 3.115500793036712, 'bear_rsi_os': 13, 'bear_rsi_ob': 47, 'bear_adx_thresh': 16.74786160606544, 'bear_atr_min_pct': 0.0124805702621193, 'bear_atr_max_pct': 0.02564380561143083, 'bear_tp_mult': 1.260475648380213, 'bear_tsl_mult': 0.4072872661485127, 'bear_time_stop': 280, 'bear_use_sma': True, 'bear_use_ema': False, 'bear_use_atr': False, 'bear_use_adx': True, 'bear_use_spike': True, 'bear_rsi_required': True, 'sideways_strategy': 'breakout', 'sideways_bb_std_mult': 1.8192216957189475, 'sideways_rsi_os': 32, 'sideways_rsi_ob': 91, 'sideways_adx_thresh': 17.46914254692347, 'sideways_atr_min_pct': 0.003833587551371034, 'sideways_atr_max_pct': 0.07868094619061229, 'sideways_tp_mult': 1.2675145754541801, 'sideways_tsl_mult': 0.025910604245740376, 'sideways_time_stop': 150, 'sideways_use_sma': True, 'sideways_use_ema': True, 'sideways_use_atr': True, 'sideways_use_adx': False, 'sideways_use_spike': True, 'sideways_rsi_required': True}.
