[I 2025-08-30 14:41:17,431] Trial 171 finished with values: [-1000000000.0, 1000000000.0] and parameters: {'p_sma': 5, 'p_std': 32, 'p_atr': 14, 'p_adx': 14, 'rsi_period': 15, 'ema1': 26, 'ema2': 17, 'slip_atr_k': 0.1739898130078948, 'slip_spread_k': 0.8254655483982479, 'spread_hl_frac': 0.033616904421193514, 'bb_std_mult': 1.0002256451641929, 'rsi_os': 36, 'rsi_ob': 91, 'vol_spike': 0.06386347589782967, 'adx_thresh': 23.048317736274274, 'atr_min_pct': 0.017782572494279485, 'atr_max_pct': 0.09985585951750328, 'tp_mult': 2.681786449427172, 'tsl_mult': 0.25582272292121383, 'strategy': 'mean_reversion', 'time_stop': 28, 'use_sma': False, 'use_atr': True, 'use_adx': False, 'use_ema': True, 'use_spike': True, 'rsi_required': False, 'edge_k': 1.5489448905261256, 'edge_cap': 0.36839967951542785, 'bull_strategy': 'mean_reversion', 'bull_bb_std_mult': 3.102014798006876, 'bull_rsi_os': 14, 'bull_rsi_ob': 64, 'bull_adx_thresh': 30.67937666176779, 'bull_atr_min_pct': 0.01394665899086542, 'bull_atr_max_pct': 0.08841167823263076, 'bull_tp_mult': 2.900787617738372, 'bull_tsl_mult': 0.030248641814872135, 'bull_time_stop': 256, 'bull_use_sma': False, 'bull_use_ema': False, 'bull_use_atr': False, 'bull_use_adx': False, 'bull_use_spike': False, 'bull_rsi_required': True, 'bear_strategy': 'breakout', 'bear_bb_std_mult': 0.8270432061312509, 'bear_rsi_os': 17, 'bear_rsi_ob': 46, 'bear_adx_thresh': 16.612627330792165, 'bear_atr_min_pct': 0.011127552913290746, 'bear_atr_max_pct': 0.1146710607785639, 'bear_tp_mult': 1.0488560237574422, 'bear_tsl_mult': 0.5020947117278942, 'bear_time_stop': 52, 'bear_use_sma': True, 'bear_use_ema': True, 'bear_use_atr': True, 'bear_use_adx': False, 'bear_use_spike': False, 'bear_rsi_required': False, 'sideways_strategy': 'breakout', 'sideways_bb_std_mult': 2.947711916333724, 'sideways_rsi_os': 31, 'sideways_rsi_ob': 62, 'sideways_adx_thresh': 28.994275769345585, 'sideways_atr_min_pct': 0.020036807886967285, 'sideways_atr_max_pct': 0.06772721945938172, 'sideways_tp_mult': 1.666851014368069, 'sideways_tsl_mult': 0.8672157335049637, 'sideways_time_stop': 240, 'sideways_use_sma': False, 'sideways_use_ema': False, 'sideways_use_atr': True, 'sideways_use_adx': False, 'sideways_use_spike': True, 'sideways_rsi_required': False}.
[I 2025-08-30 14:41:48,199] Trial 175 finished with values: [-1000000000.0, 1000000000.0] and parameters: {'p_sma': 52, 'p_std': 28, 'p_atr': 12, 'p_adx': 20, 'rsi_period': 46, 'ema1': 26, 'ema2': 51, 'slip_atr_k': 0.010409259478219773, 'slip_spread_k': 0.2693991582079186, 'spread_hl_frac': 0.003649030181043673, 'bb_std_mult': 2.2244081045501716, 'rsi_os': 28, 'rsi_ob': 67, 'vol_spike': 0.2396102552901971, 'adx_thresh': 21.676494413640302, 'atr_min_pct': 0.02110556361729595, 'atr_max_pct': 0.10514147320000285, 'tp_mult': 2.593365533631214, 'tsl_mult': 0.1629929428145428, 'strategy': 'mean_reversion', 'time_stop': 32, 'use_sma': True, 'use_atr': False, 'use_adx': False, 'use_ema': False, 'use_spike': False, 'rsi_required': False, 'edge_k': 0.9498006537336015, 'edge_cap': 0.9865719200957648, 'bull_strategy': 'breakout', 'bull_bb_std_mult': 0.6165922154063215, 'bull_rsi_os': 20, 'bull_rsi_ob': 77, 'bull_adx_thresh': 13.64478244868128, 'bull_atr_min_pct': 0.018399523505394144, 'bull_atr_max_pct': 0.019889162802641795, 'bull_tp_mult': 1.9067290751046395, 'bull_tsl_mult': 0.2197752670314459, 'bull_time_stop': 268, 'bull_use_sma': True, 'bull_use_ema': True, 'bull_use_atr': True, 'bull_use_adx': True, 'bull_use_spike': False, 'bull_rsi_required': True, 'bear_strategy': 'breakout', 'bear_bb_std_mult': 1.4251843989122632, 'bear_rsi_os': 15, 'bear_rsi_ob': 64, 'bear_adx_thresh': 18.097892690478684, 'bear_atr_min_pct': 0.0039505687260137125, 'bear_atr_max_pct': 0.02966669128945336, 'bear_tp_mult': 2.007403776867232, 'bear_tsl_mult': 0.20176494882802265, 'bear_time_stop': 161, 'bear_use_sma': True, 'bear_use_ema': False, 'bear_use_atr': False, 'bear_use_adx': True, 'bear_use_spike': True, 'bear_rsi_required': False, 'sideways_strategy': 'breakout', 'sideways_bb_std_mult': 2.8645829066931587, 'sideways_rsi_os': 32, 'sideways_rsi_ob': 89, 'sideways_adx_thresh': 31.456908804364083, 'sideways_atr_min_pct': 0.003409786130927392, 'sideways_atr_max_pct': 0.01510983389637964, 'sideways_tp_mult': 2.7831075289049263, 'sideways_tsl_mult': 0.165761602527491, 'sideways_time_stop': 248, 'sideways_use_sma': False, 'sideways_use_ema': False, 'sideways_use_atr': False, 'sideways_use_adx': True, 'sideways_use_spike': False, 'sideways_rsi_required': False}.
[I 2025-08-30 14:41:48,317] Trial 173 finished with values: [-0.02178650206654853, 0.021697984975226993] and parameters: {'p_sma': 18, 'p_std': 34, 'p_atr': 18, 'p_adx': 21, 'rsi_period': 14, 'ema1': 26, 'ema2': 45, 'slip_atr_k': 0.011505671745201278, 'slip_spread_k': 0.2740315463671998, 'spread_hl_frac': 0.0048793646161764195, 'bb_std_mult': 1.5248411597647407, 'rsi_os': 5, 'rsi_ob': 67, 'vol_spike': 0.23767583018314797, 'adx_thresh': 19.18977583146325, 'atr_min_pct': 0.004622038210788881, 'atr_max_pct': 0.09762363710797105, 'tp_mult': 1.9714708766758242, 'tsl_mult': 0.9991661870014745, 'strategy': 'mean_reversion', 'time_stop': 16, 'use_sma': True, 'use_atr': True, 'use_adx': False, 'use_ema': True, 'use_spike': True, 'rsi_required': False, 'edge_k': 1.5407135552963367, 'edge_cap': 0.9919010808302247, 'bull_strategy': 'mean_reversion', 'bull_bb_std_mult': 3.457592517098015, 'bull_rsi_os': 47, 'bull_rsi_ob': 77, 'bull_adx_thresh': 13.85602744650409, 'bull_atr_min_pct': 0.006407428295380866, 'bull_atr_max_pct': 0.09072142097868567, 'bull_tp_mult': 2.3933726128996744, 'bull_tsl_mult': 0.4655521576023731, 'bull_time_stop': 256, 'bull_use_sma': False, 'bull_use_ema': True, 'bull_use_atr': False, 'bull_use_adx': False, 'bull_use_spike': False, 'bull_rsi_required': True, 'bear_strategy': 'breakout', 'bear_bb_std_mult': 3.5162456735037093, 'bear_rsi_os': 11, 'bear_rsi_ob': 49, 'bear_adx_thresh': 19.91791366390485, 'bear_atr_min_pct': 0.0036263388794046877, 'bear_atr_max_pct': 0.028168934031125137, 'bear_tp_mult': 2.0122573419967957, 'bear_tsl_mult': 0.2677087337808232, 'bear_time_stop': 188, 'bear_use_sma': True, 'bear_use_ema': False, 'bear_use_atr': False, 'bear_use_adx': True, 'bear_use_spike': True, 'bear_rsi_required': False, 'sideways_strategy': 'breakout', 'sideways_bb_std_mult': 2.8525376127201607, 'sideways_rsi_os': 32, 'sideways_rsi_ob': 62, 'sideways_adx_thresh': 30.81204478610301, 'sideways_atr_min_pct': 0.002096370946041423, 'sideways_atr_max_pct': 0.07653507355064497, 'sideways_tp_mult': 2.861284564807434, 'sideways_tsl_mult': 0.8566986559703775, 'sideways_time_stop': 241, 'sideways_use_sma': False, 'sideways_use_ema': False, 'sideways_use_atr': True, 'sideways_use_adx': False, 'sideways_use_spike': False, 'sideways_rsi_required': False}.
[I 2025-08-30 14:41:48,652] Trial 174 finished with values: [-1000000000.0, 1000000000.0] and parameters: {'p_sma': 5, 'p_std': 29, 'p_atr': 12, 'p_adx': 20, 'rsi_period': 47, 'ema1': 26, 'ema2': 52, 'slip_atr_k': 0.227582671831138, 'slip_spread_k': 0.9301103472215793, 'spread_hl_frac': 0.0045901411698786474, 'bb_std_mult': 1.507285755540268, 'rsi_os': 29, 'rsi_ob': 93, 'vol_spike': 0.23752054825505275, 'adx_thresh': 31.025836392524297, 'atr_min_pct': 0.021372963143097737, 'atr_max_pct': 0.09735532052723342, 'tp_mult': 1.9855267463965993, 'tsl_mult': 0.9980175060295294, 'strategy': 'mean_reversion', 'time_stop': 35, 'use_sma': True, 'use_atr': True, 'use_adx': False, 'use_ema': True, 'use_spike': False, 'rsi_required': False, 'edge_k': 0.9693369661401483, 'edge_cap': 0.6972428010903859, 'bull_strategy': 'breakout', 'bull_bb_std_mult': 0.5815914251927337, 'bull_rsi_os': 46, 'bull_rsi_ob': 77, 'bull_adx_thresh': 13.810811825889031, 'bull_atr_min_pct': 0.003013651032149579, 'bull_atr_max_pct': 0.09137043245276295, 'bull_tp_mult': 1.407655972844302, 'bull_tsl_mult': 0.5241267175222245, 'bull_time_stop': 277, 'bull_use_sma': True, 'bull_use_ema': True, 'bull_use_atr': True, 'bull_use_adx': False, 'bull_use_spike': False, 'bull_rsi_required': True, 'bear_strategy': 'breakout', 'bear_bb_std_mult': 1.4111172089604351, 'bear_rsi_os': 6, 'bear_rsi_ob': 90, 'bear_adx_thresh': 7.289504189578018, 'bear_atr_min_pct': 0.012487011477314092, 'bear_atr_max_pct': 0.06839528936964374, 'bear_tp_mult': 2.0068823867372156, 'bear_tsl_mult': 0.20601978390606318, 'bear_time_stop': 160, 'bear_use_sma': True, 'bear_use_ema': False, 'bear_use_atr': False, 'bear_use_adx': True, 'bear_use_spike': True, 'bear_rsi_required': False, 'sideways_strategy': 'breakout', 'sideways_bb_std_mult': 2.8611872432460252, 'sideways_rsi_os': 31, 'sideways_rsi_ob': 89, 'sideways_adx_thresh': 31.23629157716007, 'sideways_atr_min_pct': 0.016045096818589406, 'sideways_atr_max_pct': 0.07532034627516448, 'sideways_tp_mult': 2.780406437040311, 'sideways_tsl_mult': 0.16176304722922413, 'sideways_time_stop': 250, 'sideways_use_sma': False, 'sideways_use_ema': False, 'sideways_use_atr': False, 'sideways_use_adx': True, 'sideways_use_spike': False, 'sideways_rsi_required': False}.
[I 2025-08-30 14:41:48,725] Trial 172 finished with values: [-1000000000.0, 1000000000.0] and parameters: {'p_sma': 5, 'p_std': 35, 'p_atr': 18, 'p_adx': 20, 'rsi_period': 55, 'ema1': 26, 'ema2': 52, 'slip_atr_k': 0.1848159870275211, 'slip_spread_k': 0.9862352352370921, 'spread_hl_frac': 0.033364491334627024, 'bb_std_mult': 2.1276027322949678, 'rsi_os': 36, 'rsi_ob': 93, 'vol_spike': 0.06372094702065284, 'adx_thresh': 9.242635793194346, 'atr_min_pct': 0.01800644581579355, 'atr_max_pct': 0.09875730966128193, 'tp_mult': 1.2244953063334043, 'tsl_mult': 0.7492774640290213, 'strategy': 'mean_reversion', 'time_stop': 295, 'use_sma': True, 'use_atr': True, 'use_adx': False, 'use_ema': True, 'use_spike': True, 'rsi_required': False, 'edge_k': 1.5372269294204897, 'edge_cap': 0.641038753749183, 'bull_strategy': 'mean_reversion', 'bull_bb_std_mult': 1.7907455883746346, 'bull_rsi_os': 17, 'bull_rsi_ob': 77, 'bull_adx_thresh': 29.98621800367551, 'bull_atr_min_pct': 0.006152826703761804, 'bull_atr_max_pct': 0.06862691390542462, 'bull_tp_mult': 2.6664330359629718, 'bull_tsl_mult': 0.46836785534535513, 'bull_time_stop': 106, 'bull_use_sma': False, 'bull_use_ema': True, 'bull_use_atr': True, 'bull_use_adx': False, 'bull_use_spike': False, 'bull_rsi_required': True, 'bear_strategy': 'breakout', 'bear_bb_std_mult': 1.425741468604902, 'bear_rsi_os': 11, 'bear_rsi_ob': 64, 'bear_adx_thresh': 19.715530420226575, 'bear_atr_min_pct': 0.019135500878655773, 'bear_atr_max_pct': 0.06800358004600136, 'bear_tp_mult': 1.815294146543856, 'bear_tsl_mult': 0.20380782292556468, 'bear_time_stop': 67, 'bear_use_sma': True, 'bear_use_ema': False, 'bear_use_atr': False, 'bear_use_adx': True, 'bear_use_spike': True, 'bear_rsi_required': False, 'sideways_strategy': 'breakout', 'sideways_bb_std_mult': 2.9470203393550167, 'sideways_rsi_os': 31, 'sideways_rsi_ob': 51, 'sideways_adx_thresh': 19.49531770697873, 'sideways_atr_min_pct': 0.0020936026819978596, 'sideways_atr_max_pct': 0.08640469194625632, 'sideways_tp_mult': 2.857517966194145, 'sideways_tsl_mult': 0.4904279622881417, 'sideways_time_stop': 248, 'sideways_use_sma': False, 'sideways_use_ema': False, 'sideways_use_atr': True, 'sideways_use_adx': False, 'sideways_use_spike': False, 'sideways_rsi_required': False}.
[I 2025-08-30 14:41:49,175] Trial 179 finished with values: [-1000000000.0, 1000000000.0] and parameters: {'p_sma': 54, 'p_std': 26, 'p_atr': 13, 'p_adx': 23, 'rsi_period': 12, 'ema1': 27, 'ema2': 21, 'slip_atr_k': 0.019004924155035158, 'slip_spread_k': 0.08513166974312253, 'spread_hl_frac': 0.028279700999136986, 'bb_std_mult': 2.961382676109084, 'rsi_os': 55, 'rsi_ob': 83, 'vol_spike': 0.15979947803602365, 'adx_thresh': 12.653017603926905, 'atr_min_pct': 0.0024158746375383903, 'atr_max_pct': 0.10900075203541035, 'tp_mult': 2.6483521192699193, 'tsl_mult': 0.07951655556450499, 'strategy': 'mean_reversion', 'time_stop': 15, 'use_sma': True, 'use_atr': False, 'use_adx': False, 'use_ema': False, 'use_spike': False, 'rsi_required': False, 'edge_k': 0.4530258693834259, 'edge_cap': 0.7574811905842168, 'bull_strategy': 'breakout', 'bull_bb_std_mult': 3.377603930392576, 'bull_rsi_os': 50, 'bull_rsi_ob': 76, 'bull_adx_thresh': 13.05470535649803, 'bull_atr_min_pct': 0.019999428623953545, 'bull_atr_max_pct': 0.022948311855579488, 'bull_tp_mult': 1.5836978855036874, 'bull_tsl_mult': 0.8036133524302662, 'bull_time_stop': 180, 'bull_use_sma': False, 'bull_use_ema': False, 'bull_use_atr': True, 'bull_use_adx': True, 'bull_use_spike': True, 'bull_rsi_required': False, 'bear_strategy': 'mean_reversion', 'bear_bb_std_mult': 1.5301977333529106, 'bear_rsi_os': 38, 'bear_rsi_ob': 48, 'bear_adx_thresh': 15.98944993913398, 'bear_atr_min_pct': 0.008941140473831818, 'bear_atr_max_pct': 0.032886949205575784, 'bear_tp_mult': 2.1053345329978526, 'bear_tsl_mult': 0.22530254255110088, 'bear_time_stop': 45, 'bear_use_sma': False, 'bear_use_ema': False, 'bear_use_atr': False, 'bear_use_adx': False, 'bear_use_spike': True, 'bear_rsi_required': True, 'sideways_strategy': 'mean_reversion', 'sideways_bb_std_mult': 1.6791791965417655, 'sideways_rsi_os': 39, 'sideways_rsi_ob': 92, 'sideways_adx_thresh': 17.8817757270343, 'sideways_atr_min_pct': 0.00389678635844205, 'sideways_atr_max_pct': 0.044520187268163744, 'sideways_tp_mult': 2.7469517075291856, 'sideways_tsl_mult': 0.8195715926625899, 'sideways_time_stop': 208, 'sideways_use_sma': False, 'sideways_use_ema': True, 'sideways_use_atr': False, 'sideways_use_adx': True, 'sideways_use_spike': True, 'sideways_rsi_required': True}.
[I 2025-08-30 14:42:19,345] Trial 176 finished with values: [-1000000000.0, 1000000000.0] and parameters: {'p_sma': 30, 'p_std': 29, 'p_atr': 13, 'p_adx': 23, 'rsi_period': 47, 'ema1': 18, 'ema2': 49, 'slip_atr_k': 0.22971960028397637, 'slip_spread_k': 0.23761412336062904, 'spread_hl_frac': 0.004882172351528245, 'bb_std_mult': 1.4964922618835286, 'rsi_os': 29, 'rsi_ob': 93, 'vol_spike': 0.29893487319734036, 'adx_thresh': 9.305759969797146, 'atr_min_pct': 0.0018530881750496685, 'atr_max_pct': 0.10409895467566858, 'tp_mult': 1.1896820166618736, 'tsl_mult': 0.07980842427567209, 'strategy': 'mean_reversion', 'time_stop': 16, 'use_sma': True, 'use_atr': True, 'use_adx': False, 'use_ema': True, 'use_spike': False, 'rsi_required': False, 'edge_k': 0.7595878628940602, 'edge_cap': 0.6405060102805182, 'bull_strategy': 'breakout', 'bull_bb_std_mult': 1.6912699097441286, 'bull_rsi_os': 17, 'bull_rsi_ob': 76, 'bull_adx_thresh': 13.985215401079818, 'bull_atr_min_pct': 0.003409781215339516, 'bull_atr_max_pct': 0.10039043538922986, 'bull_tp_mult': 2.986545107449344, 'bull_tsl_mult': 0.5241573126387173, 'bull_time_stop': 276, 'bull_use_sma': False, 'bull_use_ema': True, 'bull_use_atr': True, 'bull_use_adx': True, 'bull_use_spike': False, 'bull_rsi_required': True, 'bear_strategy': 'breakout', 'bear_bb_std_mult': 0.9444736472424469, 'bear_rsi_os': 20, 'bear_rsi_ob': 50, 'bear_adx_thresh': 9.878129742067076, 'bear_atr_min_pct': 0.01272014284723023, 'bear_atr_max_pct': 0.02619808852045005, 'bear_tp_mult': 2.012770948093357, 'bear_tsl_mult': 0.19820185980319763, 'bear_time_stop': 44, 'bear_use_sma': False, 'bear_use_ema': False, 'bear_use_atr': False, 'bear_use_adx': True, 'bear_use_spike': True, 'bear_rsi_required': False, 'sideways_strategy': 'breakout', 'sideways_bb_std_mult': 3.2886452957814134, 'sideways_rsi_os': 30, 'sideways_rsi_ob': 90, 'sideways_adx_thresh': 27.42039148236494, 'sideways_atr_min_pct': 0.008255731494573357, 'sideways_atr_max_pct': 0.02178295029862487, 'sideways_tp_mult': 2.8370615100607637, 'sideways_tsl_mult': 0.1937598447743144, 'sideways_time_stop': 228, 'sideways_use_sma': False, 'sideways_use_ema': False, 'sideways_use_atr': False, 'sideways_use_adx': True, 'sideways_use_spike': False, 'sideways_rsi_required': False}.
[I 2025-08-30 14:42:20,565] Trial 177 finished with values: [-1000000000.0, 1000000000.0] and parameters: {'p_sma': 54, 'p_std': 29, 'p_atr': 13, 'p_adx': 23, 'rsi_period': 50, 'ema1': 27, 'ema2': 52, 'slip_atr_k': 0.0178720827069615, 'slip_spread_k': 0.22923767487056868, 'spread_hl_frac': 0.027457069047019843, 'bb_std_mult': 2.131654044342417, 'rsi_os': 5, 'rsi_ob': 93, 'vol_spike': 0.23640254951800485, 'adx_thresh': 12.585714028799696, 'atr_min_pct': 0.00461896224450154, 'atr_max_pct': 0.09825392968722432, 'tp_mult': 1.1854949553551908, 'tsl_mult': 0.195322135445961, 'strategy': 'mean_reversion', 'time_stop': 20, 'use_sma': True, 'use_atr': True, 'use_adx': False, 'use_ema': True, 'use_spike': False, 'rsi_required': False, 'edge_k': 1.5707234928792622, 'edge_cap': 0.6340514471154908, 'bull_strategy': 'breakout', 'bull_bb_std_mult': 1.692998648581693, 'bull_rsi_os': 17, 'bull_rsi_ob': 76, 'bull_adx_thresh': 29.691471783857537, 'bull_atr_min_pct': 0.026099659878850996, 'bull_atr_max_pct': 0.06164905792349777, 'bull_tp_mult': 2.994017335846773, 'bull_tsl_mult': 0.12899115538816258, 'bull_time_stop': 277, 'bull_use_sma': False, 'bull_use_ema': True, 'bull_use_atr': True, 'bull_use_adx': True, 'bull_use_spike': True, 'bull_rsi_required': False, 'bear_strategy': 'breakout', 'bear_bb_std_mult': 1.905255631444351, 'bear_rsi_os': 38, 'bear_rsi_ob': 48, 'bear_adx_thresh': 19.620701106114918, 'bear_atr_min_pct': 0.011076530389722162, 'bear_atr_max_pct': 0.06817803821705526, 'bear_tp_mult': 2.1036925289811528, 'bear_tsl_mult': 0.1941820000028012, 'bear_time_stop': 43, 'bear_use_sma': False, 'bear_use_ema': False, 'bear_use_atr': False, 'bear_use_adx': True, 'bear_use_spike': True, 'bear_rsi_required': True, 'sideways_strategy': 'mean_reversion', 'sideways_bb_std_mult': 2.196375443373866, 'sideways_rsi_os': 10, 'sideways_rsi_ob': 92, 'sideways_adx_thresh': 8.905262969520956, 'sideways_atr_min_pct': 0.015810509445943758, 'sideways_atr_max_pct': 0.022056220349223853, 'sideways_tp_mult': 2.8459977964786742, 'sideways_tsl_mult': 0.0948669219043682, 'sideways_time_stop': 225, 'sideways_use_sma': False, 'sideways_use_ema': True, 'sideways_use_atr': False, 'sideways_use_adx': True, 'sideways_use_spike': False, 'sideways_rsi_required': True}.
[I 2025-08-30 14:42:20,842] Trial 180 finished with values: [-1000000000.0, 1000000000.0] and parameters: {'p_sma': 20, 'p_std': 43, 'p_atr': 12, 'p_adx': 22, 'rsi_period': 49, 'ema1': 18, 'ema2': 49, 'slip_atr_k': 0.016182110812982892, 'slip_spread_k': 0.23727375074840396, 'spread_hl_frac': 0.04163249421513053, 'bb_std_mult': 1.7390937813068206, 'rsi_os': 25, 'rsi_ob': 89, 'vol_spike': 0.24696218966495012, 'adx_thresh': 10.819934616580733, 'atr_min_pct': 0.019776580825218264, 'atr_max_pct': 0.03259964195024254, 'tp_mult': 2.5413499398128763, 'tsl_mult': 0.13051237417230094, 'strategy': 'mean_reversion', 'time_stop': 248, 'use_sma': True, 'use_atr': False, 'use_adx': False, 'use_ema': False, 'use_spike': False, 'rsi_required': False, 'edge_k': 0.8903494641259802, 'edge_cap': 0.6827919211157145, 'bull_strategy': 'breakout', 'bull_bb_std_mult': 2.3583918473737264, 'bull_rsi_os': 17, 'bull_rsi_ob': 72, 'bull_adx_thresh': 27.11235380123209, 'bull_atr_min_pct': 0.0040968700690156784, 'bull_atr_max_pct': 0.13498319959038485, 'bull_tp_mult': 2.4201367800384332, 'bull_tsl_mult': 0.12709643678176474, 'bull_time_stop': 113, 'bull_use_sma': False, 'bull_use_ema': False, 'bull_use_atr': True, 'bull_use_adx': True, 'bull_use_spike': False, 'bull_rsi_required': True, 'bear_strategy': 'breakout', 'bear_bb_std_mult': 0.9268578163077787, 'bear_rsi_os': 17, 'bear_rsi_ob': 49, 'bear_adx_thresh': 29.57243314744595, 'bear_atr_min_pct': 0.02355231897903324, 'bear_atr_max_pct': 0.027386468309609963, 'bear_tp_mult': 1.88077763308762, 'bear_tsl_mult': 0.6878514977373289, 'bear_time_stop': 205, 'bear_use_sma': False, 'bear_use_ema': False, 'bear_use_atr': False, 'bear_use_adx': False, 'bear_use_spike': True, 'bear_rsi_required': False, 'sideways_strategy': 'mean_reversion', 'sideways_bb_std_mult': 1.5332645964965461, 'sideways_rsi_os': 34, 'sideways_rsi_ob': 90, 'sideways_adx_thresh': 16.050761604781144, 'sideways_atr_min_pct': 0.007599629009649078, 'sideways_atr_max_pct': 0.01998314501321656, 'sideways_tp_mult': 2.8290403915014264, 'sideways_tsl_mult': 0.09509533950577856, 'sideways_time_stop': 228, 'sideways_use_sma': True, 'sideways_use_ema': False, 'sideways_use_atr': False, 'sideways_use_adx': True, 'sideways_use_spike': True, 'sideways_rsi_required': True}.
