[I 2025-08-30 15:04:56,573] Trial 351 finished with values: [-1000000000.0, 1000000000.0] and parameters: {'p_sma': 7, 'p_std': 55, 'p_atr': 17, 'p_adx': 18, 'rsi_period': 82, 'ema1': 30, 'ema2': 19, 'slip_atr_k': 0.056478034504984724, 'slip_spread_k': 0.6883251937047135, 'spread_hl_frac': 0.03818934518101131, 'bb_std_mult': 3.3345362422056186, 'rsi_os': 27, 'rsi_ob': 75, 'vol_spike': 0.29126329212119645, 'adx_thresh': 28.439654488497144, 'atr_min_pct': 0.014512821641542507, 'atr_max_pct': 0.07647885426204351, 'tp_mult': 1.577293311567276, 'tsl_mult': 0.08474213628535844, 'strategy': 'breakout', 'time_stop': 118, 'use_sma': False, 'use_atr': False, 'use_adx': False, 'use_ema': False, 'use_spike': True, 'rsi_required': True, 'edge_k': 0.787057300789917, 'edge_cap': 0.5339489116368408, 'bull_strategy': 'mean_reversion', 'bull_bb_std_mult': 2.830768017555879, 'bull_rsi_os': 33, 'bull_rsi_ob': 89, 'bull_adx_thresh': 26.084244477417172, 'bull_atr_min_pct': 0.0082338440750395, 'bull_atr_max_pct': 0.06935683294224461, 'bull_tp_mult': 1.8523191296182895, 'bull_tsl_mult': 0.5925893431133712, 'bull_time_stop': 116, 'bull_use_sma': False, 'bull_use_ema': False, 'bull_use_atr': False, 'bull_use_adx': False, 'bull_use_spike': False, 'bull_rsi_required': True, 'bear_strategy': 'mean_reversion', 'bear_bb_std_mult': 0.8491785759840108, 'bear_rsi_os': 7, 'bear_rsi_ob': 76, 'bear_adx_thresh': 28.645574573456827, 'bear_atr_min_pct': 0.016052853335273374, 'bear_atr_max_pct': 0.01590080366311543, 'bear_tp_mult': 1.4161825105250436, 'bear_tsl_mult': 0.06625545050091852, 'bear_time_stop': 74, 'bear_use_sma': True, 'bear_use_ema': True, 'bear_use_atr': True, 'bear_use_adx': False, 'bear_use_spike': False, 'bear_rsi_required': False, 'sideways_strategy': 'mean_reversion', 'sideways_bb_std_mult': 3.539995948835311, 'sideways_rsi_os': 41, 'sideways_rsi_ob': 59, 'sideways_adx_thresh': 24.418297975342938, 'sideways_atr_min_pct': 0.0007653283128223871, 'sideways_atr_max_pct': 0.09599590330799597, 'sideways_tp_mult': 2.378174563257091, 'sideways_tsl_mult': 0.49106229655725464, 'sideways_time_stop': 14, 'sideways_use_sma': False, 'sideways_use_ema': True, 'sideways_use_atr': True, 'sideways_use_adx': False, 'sideways_use_spike': True, 'sideways_rsi_required': False}.
[I 2025-08-30 15:04:56,974] Trial 352 finished with values: [-0.012432165999383349, 0.012347307503120146] and parameters: {'p_sma': 6, 'p_std': 53, 'p_atr': 16, 'p_adx': 15, 'rsi_period': 80, 'ema1': 30, 'ema2': 19, 'slip_atr_k': 0.052828913235106106, 'slip_spread_k': 0.5979064731670308, 'spread_hl_frac': 0.0033263504486543936, 'bb_std_mult': 3.3186025377283768, 'rsi_os': 27, 'rsi_ob': 73, 'vol_spike': 0.28539353639356285, 'adx_thresh': 28.58354476586201, 'atr_min_pct': 0.014542021433878779, 'atr_max_pct': 0.07609028761643563, 'tp_mult': 1.6431923313782244, 'tsl_mult': 0.08186708845540375, 'strategy': 'breakout', 'time_stop': 105, 'use_sma': False, 'use_atr': False, 'use_adx': False, 'use_ema': False, 'use_spike': True, 'rsi_required': True, 'edge_k': 1.0146078274183994, 'edge_cap': 0.5396367594842207, 'bull_strategy': 'mean_reversion', 'bull_bb_std_mult': 2.764188776694374, 'bull_rsi_os': 32, 'bull_rsi_ob': 89, 'bull_adx_thresh': 26.275269039774205, 'bull_atr_min_pct': 0.007152289689011344, 'bull_atr_max_pct': 0.06938074889076486, 'bull_tp_mult': 1.855552829204626, 'bull_tsl_mult': 0.6063522695747431, 'bull_time_stop': 124, 'bull_use_sma': False, 'bull_use_ema': False, 'bull_use_atr': False, 'bull_use_adx': False, 'bull_use_spike': False, 'bull_rsi_required': False, 'bear_strategy': 'mean_reversion', 'bear_bb_std_mult': 0.7610522552847384, 'bear_rsi_os': 6, 'bear_rsi_ob': 76, 'bear_adx_thresh': 29.148477708225073, 'bear_atr_min_pct': 0.01633646341377752, 'bear_atr_max_pct': 0.013500436299792038, 'bear_tp_mult': 1.4329615154423099, 'bear_tsl_mult': 0.07821756773281434, 'bear_time_stop': 75, 'bear_use_sma': True, 'bear_use_ema': True, 'bear_use_atr': True, 'bear_use_adx': False, 'bear_use_spike': False, 'bear_rsi_required': False, 'sideways_strategy': 'breakout', 'sideways_bb_std_mult': 1.583773801330175, 'sideways_rsi_os': 41, 'sideways_rsi_ob': 58, 'sideways_adx_thresh': 26.233275185229857, 'sideways_atr_min_pct': 0.0006395252409370588, 'sideways_atr_max_pct': 0.09804568252355793, 'sideways_tp_mult': 2.4140920647706516, 'sideways_tsl_mult': 0.5008240008963409, 'sideways_time_stop': 15, 'sideways_use_sma': False, 'sideways_use_ema': True, 'sideways_use_atr': True, 'sideways_use_adx': False, 'sideways_use_spike': True, 'sideways_rsi_required': False}.
[I 2025-08-30 15:04:57,068] Trial 353 finished with values: [-0.011744193042015794, 0.01166292086132068] and parameters: {'p_sma': 8, 'p_std': 56, 'p_atr': 16, 'p_adx': 26, 'rsi_period': 82, 'ema1': 30, 'ema2': 19, 'slip_atr_k': 0.058083353455340124, 'slip_spread_k': 0.6263780274090054, 'spread_hl_frac': 0.007799943632053774, 'bb_std_mult': 3.0131816802717473, 'rsi_os': 25, 'rsi_ob': 74, 'vol_spike': 0.18646324748623352, 'adx_thresh': 28.395427050315988, 'atr_min_pct': 0.014557576414656957, 'atr_max_pct': 0.07625732913959239, 'tp_mult': 1.5257309464779403, 'tsl_mult': 0.07712527338596237, 'strategy': 'breakout', 'time_stop': 118, 'use_sma': False, 'use_atr': False, 'use_adx': False, 'use_ema': True, 'use_spike': True, 'rsi_required': True, 'edge_k': 1.0234363924128704, 'edge_cap': 0.5808690122948985, 'bull_strategy': 'mean_reversion', 'bull_bb_std_mult': 2.8264343737076474, 'bull_rsi_os': 32, 'bull_rsi_ob': 89, 'bull_adx_thresh': 24.128595848659668, 'bull_atr_min_pct': 0.007070747597079534, 'bull_atr_max_pct': 0.0699140459932027, 'bull_tp_mult': 1.8402420556459966, 'bull_tsl_mult': 0.6069080904771325, 'bull_time_stop': 124, 'bull_use_sma': False, 'bull_use_ema': False, 'bull_use_atr': False, 'bull_use_adx': False, 'bull_use_spike': False, 'bull_rsi_required': False, 'bear_strategy': 'mean_reversion', 'bear_bb_std_mult': 0.7526451948189797, 'bear_rsi_os': 5, 'bear_rsi_ob': 74, 'bear_adx_thresh': 28.549957089857653, 'bear_atr_min_pct': 0.01574487416848253, 'bear_atr_max_pct': 0.014263796548530761, 'bear_tp_mult': 1.426227134059697, 'bear_tsl_mult': 0.06536915633561816, 'bear_time_stop': 74, 'bear_use_sma': True, 'bear_use_ema': True, 'bear_use_atr': True, 'bear_use_adx': False, 'bear_use_spike': False, 'bear_rsi_required': False, 'sideways_strategy': 'breakout', 'sideways_bb_std_mult': 3.5371236210900334, 'sideways_rsi_os': 41, 'sideways_rsi_ob': 58, 'sideways_adx_thresh': 25.964419556985895, 'sideways_atr_min_pct': 0.000565418001069757, 'sideways_atr_max_pct': 0.09452747142138809, 'sideways_tp_mult': 2.407993293718375, 'sideways_tsl_mult': 0.5011793873134387, 'sideways_time_stop': 5, 'sideways_use_sma': False, 'sideways_use_ema': True, 'sideways_use_atr': True, 'sideways_use_adx': False, 'sideways_use_spike': True, 'sideways_rsi_required': False}.
[I 2025-08-30 15:05:33,542] Trial 357 finished with values: [-0.024309491575460918, 0.024297300942962265] and parameters: {'p_sma': 6, 'p_std': 53, 'p_atr': 16, 'p_adx': 26, 'rsi_period': 75, 'ema1': 30, 'ema2': 18, 'slip_atr_k': 0.05024997012419602, 'slip_spread_k': 0.5949088001882316, 'spread_hl_frac': 0.034384312742823615, 'bb_std_mult': 3.0201526165944523, 'rsi_os': 27, 'rsi_ob': 74, 'vol_spike': 0.2821374195548756, 'adx_thresh': 28.642106826092984, 'atr_min_pct': 0.015021640900286832, 'atr_max_pct': 0.06829933401701119, 'tp_mult': 1.5458505475773883, 'tsl_mult': 0.042309461220198526, 'strategy': 'breakout', 'time_stop': 108, 'use_sma': False, 'use_atr': False, 'use_adx': True, 'use_ema': True, 'use_spike': True, 'rsi_required': True, 'edge_k': 0.9973993767325144, 'edge_cap': 0.5816738036721806, 'bull_strategy': 'mean_reversion', 'bull_bb_std_mult': 2.6311120530524756, 'bull_rsi_os': 32, 'bull_rsi_ob': 89, 'bull_adx_thresh': 23.637815948714948, 'bull_atr_min_pct': 0.006897997617451672, 'bull_atr_max_pct': 0.0741990369626571, 'bull_tp_mult': 1.821588580409285, 'bull_tsl_mult': 0.6118505041690359, 'bull_time_stop': 125, 'bull_use_sma': True, 'bull_use_ema': False, 'bull_use_atr': False, 'bull_use_adx': False, 'bull_use_spike': False, 'bull_rsi_required': False, 'bear_strategy': 'mean_reversion', 'bear_bb_std_mult': 0.8078617879997857, 'bear_rsi_os': 5, 'bear_rsi_ob': 74, 'bear_adx_thresh': 29.739983892672182, 'bear_atr_min_pct': 0.016865270670156817, 'bear_atr_max_pct': 0.11697164868244522, 'bear_tp_mult': 1.437054249074718, 'bear_tsl_mult': 0.10493364501403649, 'bear_time_stop': 79, 'bear_use_sma': True, 'bear_use_ema': True, 'bear_use_atr': True, 'bear_use_adx': False, 'bear_use_spike': False, 'bear_rsi_required': True, 'sideways_strategy': 'breakout', 'sideways_bb_std_mult': 1.7555413062657892, 'sideways_rsi_os': 44, 'sideways_rsi_ob': 58, 'sideways_adx_thresh': 25.85983081816205, 'sideways_atr_min_pct': 2.452534021911445e-05, 'sideways_atr_max_pct': 0.10116052503818809, 'sideways_tp_mult': 2.3330287392666276, 'sideways_tsl_mult': 0.4694347267929848, 'sideways_time_stop': 5, 'sideways_use_sma': False, 'sideways_use_ema': True, 'sideways_use_atr': True, 'sideways_use_adx': False, 'sideways_use_spike': False, 'sideways_rsi_required': False}.
[I 2025-08-30 15:05:33,632] Trial 356 finished with values: [-0.022585903955053444, 0.022516306204134893] and parameters: {'p_sma': 9, 'p_std': 57, 'p_atr': 16, 'p_adx': 24, 'rsi_period': 75, 'ema1': 30, 'ema2': 18, 'slip_atr_k': 0.05095465137088444, 'slip_spread_k': 0.5935475871098534, 'spread_hl_frac': 0.011068211427610934, 'bb_std_mult': 3.515300217074465, 'rsi_os': 27, 'rsi_ob': 75, 'vol_spike': 0.28436875370306425, 'adx_thresh': 29.253704199055537, 'atr_min_pct': 0.01510827983115993, 'atr_max_pct': 0.06915521323532578, 'tp_mult': 1.645474019098828, 'tsl_mult': 0.06536909163365118, 'strategy': 'breakout', 'time_stop': 109, 'use_sma': False, 'use_atr': False, 'use_adx': False, 'use_ema': True, 'use_spike': True, 'rsi_required': True, 'edge_k': 1.0011874617846632, 'edge_cap': 0.5852367242569952, 'bull_strategy': 'mean_reversion', 'bull_bb_std_mult': 2.6329664366227408, 'bull_rsi_os': 31, 'bull_rsi_ob': 89, 'bull_adx_thresh': 23.246517139705034, 'bull_atr_min_pct': 0.006497389989824784, 'bull_atr_max_pct': 0.0724907788935123, 'bull_tp_mult': 1.8939041981643736, 'bull_tsl_mult': 0.6126423065191657, 'bull_time_stop': 126, 'bull_use_sma': False, 'bull_use_ema': False, 'bull_use_atr': False, 'bull_use_adx': False, 'bull_use_spike': False, 'bull_rsi_required': False, 'bear_strategy': 'mean_reversion', 'bear_bb_std_mult': 0.9185360727666271, 'bear_rsi_os': 6, 'bear_rsi_ob': 74, 'bear_adx_thresh': 29.852914548849366, 'bear_atr_min_pct': 0.015433852505424025, 'bear_atr_max_pct': 0.013321031638960193, 'bear_tp_mult': 1.4321004921328204, 'bear_tsl_mult': 0.06605353538262289, 'bear_time_stop': 79, 'bear_use_sma': True, 'bear_use_ema': True, 'bear_use_atr': True, 'bear_use_adx': False, 'bear_use_spike': False, 'bear_rsi_required': True, 'sideways_strategy': 'breakout', 'sideways_bb_std_mult': 3.4653993234985725, 'sideways_rsi_os': 44, 'sideways_rsi_ob': 58, 'sideways_adx_thresh': 26.036748369653957, 'sideways_atr_min_pct': 0.0010762143048000776, 'sideways_atr_max_pct': 0.1004791296221943, 'sideways_tp_mult': 2.357876742664461, 'sideways_tsl_mult': 0.47157420087483215, 'sideways_time_stop': 9, 'sideways_use_sma': False, 'sideways_use_ema': True, 'sideways_use_atr': True, 'sideways_use_adx': False, 'sideways_use_spike': False, 'sideways_rsi_required': False}.
[I 2025-08-30 15:05:33,658] Trial 355 finished with values: [-0.025008651581826746, 0.024925461949255504] and parameters: {'p_sma': 8, 'p_std': 57, 'p_atr': 16, 'p_adx': 30, 'rsi_period': 78, 'ema1': 30, 'ema2': 15, 'slip_atr_k': 0.05968234827602277, 'slip_spread_k': 0.5979638598972002, 'spread_hl_frac': 0.03393194126270131, 'bb_std_mult': 2.7290560226544143, 'rsi_os': 25, 'rsi_ob': 74, 'vol_spike': 0.2839813909480968, 'adx_thresh': 28.741681901968576, 'atr_min_pct': 0.015236335522711824, 'atr_max_pct': 0.07501571529414339, 'tp_mult': 1.65749046774338, 'tsl_mult': 0.06683613359330282, 'strategy': 'breakout', 'time_stop': 110, 'use_sma': False, 'use_atr': False, 'use_adx': True, 'use_ema': True, 'use_spike': True, 'rsi_required': True, 'edge_k': 1.0097623061816106, 'edge_cap': 0.5802543006806841, 'bull_strategy': 'mean_reversion', 'bull_bb_std_mult': 2.6501863565119415, 'bull_rsi_os': 31, 'bull_rsi_ob': 89, 'bull_adx_thresh': 24.120353400049183, 'bull_atr_min_pct': 0.007056584331609089, 'bull_atr_max_pct': 0.07321168474161752, 'bull_tp_mult': 1.8239637607635024, 'bull_tsl_mult': 0.6113995488159082, 'bull_time_stop': 133, 'bull_use_sma': False, 'bull_use_ema': False, 'bull_use_atr': False, 'bull_use_adx': False, 'bull_use_spike': False, 'bull_rsi_required': False, 'bear_strategy': 'mean_reversion', 'bear_bb_std_mult': 0.703688136787094, 'bear_rsi_os': 6, 'bear_rsi_ob': 74, 'bear_adx_thresh': 28.75646417291283, 'bear_atr_min_pct': 0.017108530715504403, 'bear_atr_max_pct': 0.013839041008349488, 'bear_tp_mult': 1.4420930585615712, 'bear_tsl_mult': 0.06125309743868166, 'bear_time_stop': 225, 'bear_use_sma': True, 'bear_use_ema': True, 'bear_use_atr': True, 'bear_use_adx': False, 'bear_use_spike': False, 'bear_rsi_required': True, 'sideways_strategy': 'breakout', 'sideways_bb_std_mult': 3.540507920249684, 'sideways_rsi_os': 44, 'sideways_rsi_ob': 58, 'sideways_adx_thresh': 25.707775390247612, 'sideways_atr_min_pct': 0.0003675538437412655, 'sideways_atr_max_pct': 0.10057751665832412, 'sideways_tp_mult': 2.359641488209174, 'sideways_tsl_mult': 0.4450049779668892, 'sideways_time_stop': 5, 'sideways_use_sma': False, 'sideways_use_ema': True, 'sideways_use_atr': True, 'sideways_use_adx': False, 'sideways_use_spike': False, 'sideways_rsi_required': False}.
[I 2025-08-30 15:05:33,925] Trial 354 finished with values: [-0.009965502403797344, 0.009872039017993339] and parameters: {'p_sma': 8, 'p_std': 56, 'p_atr': 16, 'p_adx': 24, 'rsi_period': 80, 'ema1': 30, 'ema2': 19, 'slip_atr_k': 0.05107407933678155, 'slip_spread_k': 0.5950431241823585, 'spread_hl_frac': 0.033851571283109706, 'bb_std_mult': 3.5923521513444636, 'rsi_os': 25, 'rsi_ob': 74, 'vol_spike': 0.18546657504269246, 'adx_thresh': 28.53275894105101, 'atr_min_pct': 0.015027797016951975, 'atr_max_pct': 0.0766394024152612, 'tp_mult': 1.6444938934421545, 'tsl_mult': 0.08552712863014268, 'strategy': 'breakout', 'time_stop': 119, 'use_sma': False, 'use_atr': False, 'use_adx': False, 'use_ema': True, 'use_spike': True, 'rsi_required': True, 'edge_k': 0.9882990591703851, 'edge_cap': 0.57984563295522, 'bull_strategy': 'mean_reversion', 'bull_bb_std_mult': 2.6270618214804076, 'bull_rsi_os': 31, 'bull_rsi_ob': 90, 'bull_adx_thresh': 23.273218198554314, 'bull_atr_min_pct': 0.00725768914039305, 'bull_atr_max_pct': 0.0699032112917524, 'bull_tp_mult': 1.8277653492376538, 'bull_tsl_mult': 0.6093441745467303, 'bull_time_stop': 136, 'bull_use_sma': False, 'bull_use_ema': False, 'bull_use_atr': False, 'bull_use_adx': False, 'bull_use_spike': False, 'bull_rsi_required': False, 'bear_strategy': 'mean_reversion', 'bear_bb_std_mult': 0.7089571678429778, 'bear_rsi_os': 6, 'bear_rsi_ob': 76, 'bear_adx_thresh': 28.856990616084374, 'bear_atr_min_pct': 0.016870786233005794, 'bear_atr_max_pct': 0.01379955250167332, 'bear_tp_mult': 1.4266579048578134, 'bear_tsl_mult': 0.07056000100402883, 'bear_time_stop': 75, 'bear_use_sma': True, 'bear_use_ema': True, 'bear_use_atr': True, 'bear_use_adx': False, 'bear_use_spike': False, 'bear_rsi_required': True, 'sideways_strategy': 'breakout', 'sideways_bb_std_mult': 1.8479962809881565, 'sideways_rsi_os': 40, 'sideways_rsi_ob': 58, 'sideways_adx_thresh': 26.17065907633657, 'sideways_atr_min_pct': 0.0008482916946368235, 'sideways_atr_max_pct': 0.09729536522244812, 'sideways_tp_mult': 2.3784677012158437, 'sideways_tsl_mult': 0.5185969267013125, 'sideways_time_stop': 16, 'sideways_use_sma': False, 'sideways_use_ema': True, 'sideways_use_atr': True, 'sideways_use_adx': False, 'sideways_use_spike': True, 'sideways_rsi_required': False}.
[I 2025-08-30 15:06:12,849] Trial 360 finished with values: [-0.01167253735640339, 0.011580687138867592] and parameters: {'p_sma': 8, 'p_std': 54, 'p_atr': 16, 'p_adx': 24, 'rsi_period': 77, 'ema1': 30, 'ema2': 20, 'slip_atr_k': 0.06404822463045419, 'slip_spread_k': 0.6284363324179468, 'spread_hl_frac': 0.004156200538331723, 'bb_std_mult': 3.581989611327796, 'rsi_os': 27, 'rsi_ob': 76, 'vol_spike': 0.18757080037115448, 'adx_thresh': 30.59040104217888, 'atr_min_pct': 0.012688434110675278, 'atr_max_pct': 0.06696233600873189, 'tp_mult': 1.526153894526027, 'tsl_mult': 0.03851956977284007, 'strategy': 'breakout', 'time_stop': 119, 'use_sma': False, 'use_atr': False, 'use_adx': False, 'use_ema': False, 'use_spike': True, 'rsi_required': True, 'edge_k': 0.9139256706210278, 'edge_cap': 0.5966301306990119, 'bull_strategy': 'mean_reversion', 'bull_bb_std_mult': 2.7969494896530662, 'bull_rsi_os': 32, 'bull_rsi_ob': 90, 'bull_adx_thresh': 25.514796497854018, 'bull_atr_min_pct': 0.007241319059815803, 'bull_atr_max_pct': 0.07811161780721565, 'bull_tp_mult': 1.9531258126086788, 'bull_tsl_mult': 0.6383543013201961, 'bull_time_stop': 123, 'bull_use_sma': False, 'bull_use_ema': False, 'bull_use_atr': False, 'bull_use_adx': False, 'bull_use_spike': False, 'bull_rsi_required': True, 'bear_strategy': 'mean_reversion', 'bear_bb_std_mult': 0.7460268976228513, 'bear_rsi_os': 8, 'bear_rsi_ob': 76, 'bear_adx_thresh': 27.47950845808269, 'bear_atr_min_pct': 0.015540963056618312, 'bear_atr_max_pct': 0.01416506578051974, 'bear_tp_mult': 1.3620969414178619, 'bear_tsl_mult': 0.8011107153814908, 'bear_time_stop': 83, 'bear_use_sma': True, 'bear_use_ema': True, 'bear_use_atr': True, 'bear_use_adx': False, 'bear_use_spike': False, 'bear_rsi_required': False, 'sideways_strategy': 'breakout', 'sideways_bb_std_mult': 3.551367086079782, 'sideways_rsi_os': 40, 'sideways_rsi_ob': 55, 'sideways_adx_thresh': 26.321995263048034, 'sideways_atr_min_pct': 0.0007659246575569164, 'sideways_atr_max_pct': 0.092064594240606, 'sideways_tp_mult': 2.2852260315989215, 'sideways_tsl_mult': 0.5045901037840503, 'sideways_time_stop': 187, 'sideways_use_sma': False, 'sideways_use_ema': True, 'sideways_use_atr': True, 'sideways_use_adx': False, 'sideways_use_spike': True, 'sideways_rsi_required': False}.
[I 2025-08-30 15:06:13,422] Trial 358 finished with values: [-1000000000.0, 1000000000.0] and parameters: {'p_sma': 8, 'p_std': 54, 'p_atr': 16, 'p_adx': 24, 'rsi_period': 80, 'ema1': 30, 'ema2': 20, 'slip_atr_k': 0.06491171660021416, 'slip_spread_k': 0.6338995075706159, 'spread_hl_frac': 0.0038120169357396243, 'bb_std_mult': 3.583897852443411, 'rsi_os': 27, 'rsi_ob': 76, 'vol_spike': 0.1250017037177718, 'adx_thresh': 29.618604261638538, 'atr_min_pct': 0.012590097006722934, 'atr_max_pct': 0.06773290639129906, 'tp_mult': 1.5471557944913024, 'tsl_mult': 0.0429890611097354, 'strategy': 'breakout', 'time_stop': 120, 'use_sma': False, 'use_atr': False, 'use_adx': False, 'use_ema': False, 'use_spike': True, 'rsi_required': True, 'edge_k': 0.8945857860152524, 'edge_cap': 0.5968780687917735, 'bull_strategy': 'mean_reversion', 'bull_bb_std_mult': 2.812695954757981, 'bull_rsi_os': 32, 'bull_rsi_ob': 88, 'bull_adx_thresh': 24.07280315500274, 'bull_atr_min_pct': 0.007187136513750645, 'bull_atr_max_pct': 0.07706526177392427, 'bull_tp_mult': 1.9041187788283809, 'bull_tsl_mult': 0.6403786174765665, 'bull_time_stop': 136, 'bull_use_sma': False, 'bull_use_ema': False, 'bull_use_atr': False, 'bull_use_adx': False, 'bull_use_spike': False, 'bull_rsi_required': True, 'bear_strategy': 'mean_reversion', 'bear_bb_std_mult': 0.7885651453134052, 'bear_rsi_os': 8, 'bear_rsi_ob': 76, 'bear_adx_thresh': 27.463345643488225, 'bear_atr_min_pct': 0.015456445972520457, 'bear_atr_max_pct': 0.01376415843438893, 'bear_tp_mult': 1.382437696080019, 'bear_tsl_mult': 0.0974571109299197, 'bear_time_stop': 85, 'bear_use_sma': True, 'bear_use_ema': True, 'bear_use_atr': True, 'bear_use_adx': False, 'bear_use_spike': False, 'bear_rsi_required': False, 'sideways_strategy': 'breakout', 'sideways_bb_std_mult': 1.070739533850956, 'sideways_rsi_os': 40, 'sideways_rsi_ob': 56, 'sideways_adx_thresh': 26.312987938917953, 'sideways_atr_min_pct': 0.012603643265830106, 'sideways_atr_max_pct': 0.0938837556083186, 'sideways_tp_mult': 2.2777891994065977, 'sideways_tsl_mult': 0.5165568521357373, 'sideways_time_stop': 16, 'sideways_use_sma': False, 'sideways_use_ema': True, 'sideways_use_atr': True, 'sideways_use_adx': False, 'sideways_use_spike': True, 'sideways_rsi_required': False}.
