[I 2025-08-30 16:00:19,181] Trial 621 finished with values: [-0.07179050713727686, 0.07174677291359305] and parameters: {'p_sma': 58, 'p_std': 24, 'p_atr': 23, 'p_adx': 26, 'rsi_period': 61, 'ema1': 17, 'ema2': 23, 'slip_atr_k': 0.06666475850658626, 'slip_spread_k': 0.12532283990941695, 'spread_hl_frac': 0.028985035804190006, 'bb_std_mult': 1.3055390485363725, 'rsi_os': 25, 'rsi_ob': 69, 'vol_spike': 0.18347674919323478, 'adx_thresh': 10.563365507363999, 'atr_min_pct': 0.015181127172207626, 'atr_max_pct': 0.06277136272627275, 'tp_mult': 1.7400168318575246, 'tsl_mult': 0.14978878036198473, 'strategy': 'mean_reversion', 'time_stop': 239, 'use_sma': True, 'use_atr': True, 'use_adx': False, 'use_ema': True, 'use_spike': True, 'rsi_required': True, 'edge_k': 0.5950859889003159, 'edge_cap': 0.60701343289775, 'bull_strategy': 'breakout', 'bull_bb_std_mult': 2.53939089743496, 'bull_rsi_os': 39, 'bull_rsi_ob': 54, 'bull_adx_thresh': 9.493525655576729, 'bull_atr_min_pct': 0.02071727657710586, 'bull_atr_max_pct': 0.06327788959090357, 'bull_tp_mult': 2.1495663826326714, 'bull_tsl_mult': 0.762911876813602, 'bull_time_stop': 156, 'bull_use_sma': True, 'bull_use_ema': True, 'bull_use_atr': True, 'bull_use_adx': True, 'bull_use_spike': True, 'bull_rsi_required': False, 'bear_strategy': 'mean_reversion', 'bear_bb_std_mult': 3.0153724016560393, 'bear_rsi_os': 29, 'bear_rsi_ob': 76, 'bear_adx_thresh': 5.001157868229026, 'bear_atr_min_pct': 0.02307802037969327, 'bear_atr_max_pct': 0.07427148162883046, 'bear_tp_mult': 1.4544008031998383, 'bear_tsl_mult': 0.40967100485568153, 'bear_time_stop': 123, 'bear_use_sma': True, 'bear_use_ema': False, 'bear_use_atr': True, 'bear_use_adx': True, 'bear_use_spike': False, 'bear_rsi_required': True, 'sideways_strategy': 'breakout', 'sideways_bb_std_mult': 2.747410080232222, 'sideways_rsi_os': 41, 'sideways_rsi_ob': 62, 'sideways_adx_thresh': 25.513598935624238, 'sideways_atr_min_pct': 0.0007863421393725841, 'sideways_atr_max_pct': 0.09829011389006907, 'sideways_tp_mult': 1.363350880726602, 'sideways_tsl_mult': 0.8410879233848498, 'sideways_time_stop': 83, 'sideways_use_sma': True, 'sideways_use_ema': False, 'sideways_use_atr': False, 'sideways_use_adx': True, 'sideways_use_spike': True, 'sideways_rsi_required': False}.
[I 2025-08-30 16:01:08,322] Trial 624 finished with values: [-1000000000.0, 1000000000.0] and parameters: {'p_sma': 12, 'p_std': 60, 'p_atr': 17, 'p_adx': 25, 'rsi_period': 79, 'ema1': 30, 'ema2': 34, 'slip_atr_k': 0.19057072535030667, 'slip_spread_k': 0.1810660440562872, 'spread_hl_frac': 0.02518370613794507, 'bb_std_mult': 1.8035765970982471, 'rsi_os': 25, 'rsi_ob': 70, 'vol_spike': 0.16046506978107877, 'adx_thresh': 15.214534678230637, 'atr_min_pct': 0.011120965074223986, 'atr_max_pct': 0.07432008819302038, 'tp_mult': 1.8186196517257744, 'tsl_mult': 0.7362995305537795, 'strategy': 'mean_reversion', 'time_stop': 147, 'use_sma': True, 'use_atr': True, 'use_adx': False, 'use_ema': True, 'use_spike': True, 'rsi_required': True, 'edge_k': 1.3866902397221632, 'edge_cap': 0.607490482535041, 'bull_strategy': 'breakout', 'bull_bb_std_mult': 2.5287691828790804, 'bull_rsi_os': 39, 'bull_rsi_ob': 50, 'bull_adx_thresh': 28.972326217256516, 'bull_atr_min_pct': 0.021821844296342256, 'bull_atr_max_pct': 0.06922547134032966, 'bull_tp_mult': 2.6064274959179192, 'bull_tsl_mult': 0.30848683662285753, 'bull_time_stop': 149, 'bull_use_sma': False, 'bull_use_ema': False, 'bull_use_atr': False, 'bull_use_adx': False, 'bull_use_spike': True, 'bull_rsi_required': True, 'bear_strategy': 'mean_reversion', 'bear_bb_std_mult': 0.8683248884989583, 'bear_rsi_os': 43, 'bear_rsi_ob': 76, 'bear_adx_thresh': 28.522282446428616, 'bear_atr_min_pct': 0.01835706363414188, 'bear_atr_max_pct': 0.07599054434736524, 'bear_tp_mult': 1.6412711471837302, 'bear_tsl_mult': 0.9231895245278601, 'bear_time_stop': 242, 'bear_use_sma': False, 'bear_use_ema': False, 'bear_use_atr': True, 'bear_use_adx': True, 'bear_use_spike': False, 'bear_rsi_required': True, 'sideways_strategy': 'breakout', 'sideways_bb_std_mult': 1.8103991556107806, 'sideways_rsi_os': 42, 'sideways_rsi_ob': 76, 'sideways_adx_thresh': 26.83678545482743, 'sideways_atr_min_pct': 0.008263669079628284, 'sideways_atr_max_pct': 0.09754784062451007, 'sideways_tp_mult': 2.609800673423433, 'sideways_tsl_mult': 0.916772096128194, 'sideways_time_stop': 152, 'sideways_use_sma': True, 'sideways_use_ema': True, 'sideways_use_atr': False, 'sideways_use_adx': True, 'sideways_use_spike': False, 'sideways_rsi_required': False}.
[I 2025-08-30 16:01:09,168] Trial 625 finished with values: [-1000000000.0, 1000000000.0] and parameters: {'p_sma': 7, 'p_std': 43, 'p_atr': 7, 'p_adx': 25, 'rsi_period': 75, 'ema1': 30, 'ema2': 32, 'slip_atr_k': 0.19020798677315626, 'slip_spread_k': 0.17296784722568834, 'spread_hl_frac': 0.015637910515146656, 'bb_std_mult': 1.489624954319209, 'rsi_os': 27, 'rsi_ob': 74, 'vol_spike': 0.16796059850818923, 'adx_thresh': 15.221998565628407, 'atr_min_pct': 0.007608716953266478, 'atr_max_pct': 0.07229387497670742, 'tp_mult': 1.8188209096524761, 'tsl_mult': 0.7339199713331703, 'strategy': 'mean_reversion', 'time_stop': 147, 'use_sma': True, 'use_atr': True, 'use_adx': False, 'use_ema': True, 'use_spike': True, 'rsi_required': True, 'edge_k': 0.038788208188659884, 'edge_cap': 0.5888121344912812, 'bull_strategy': 'breakout', 'bull_bb_std_mult': 2.399799179380612, 'bull_rsi_os': 40, 'bull_rsi_ob': 47, 'bull_adx_thresh': 24.03037211144073, 'bull_atr_min_pct': 0.021836684120102996, 'bull_atr_max_pct': 0.06977192415002462, 'bull_tp_mult': 1.217708336441847, 'bull_tsl_mult': 0.3116653823978145, 'bull_time_stop': 146, 'bull_use_sma': False, 'bull_use_ema': False, 'bull_use_atr': False, 'bull_use_adx': False, 'bull_use_spike': True, 'bull_rsi_required': True, 'bear_strategy': 'mean_reversion', 'bear_bb_std_mult': 1.6267874647408298, 'bear_rsi_os': 33, 'bear_rsi_ob': 68, 'bear_adx_thresh': 28.479224116935747, 'bear_atr_min_pct': 0.020676761627026946, 'bear_atr_max_pct': 0.0852278641741649, 'bear_tp_mult': 1.647656261598363, 'bear_tsl_mult': 0.9260615646193424, 'bear_time_stop': 22, 'bear_use_sma': False, 'bear_use_ema': False, 'bear_use_atr': True, 'bear_use_adx': True, 'bear_use_spike': False, 'bear_rsi_required': True, 'sideways_strategy': 'breakout', 'sideways_bb_std_mult': 0.873302114056907, 'sideways_rsi_os': 15, 'sideways_rsi_ob': 73, 'sideways_adx_thresh': 27.14404191760127, 'sideways_atr_min_pct': 0.02394444028572848, 'sideways_atr_max_pct': 0.10173874199855329, 'sideways_tp_mult': 2.6050777724708296, 'sideways_tsl_mult': 0.9087341028699605, 'sideways_time_stop': 49, 'sideways_use_sma': True, 'sideways_use_ema': True, 'sideways_use_atr': False, 'sideways_use_adx': True, 'sideways_use_spike': False, 'sideways_rsi_required': False}.
[I 2025-08-30 16:01:09,208] Trial 623 finished with values: [-1000000000.0, 1000000000.0] and parameters: {'p_sma': 5, 'p_std': 43, 'p_atr': 17, 'p_adx': 25, 'rsi_period': 79, 'ema1': 30, 'ema2': 43, 'slip_atr_k': 0.1896477313771045, 'slip_spread_k': 0.1293231213371651, 'spread_hl_frac': 0.025262009859114233, 'bb_std_mult': 2.733464465779779, 'rsi_os': 47, 'rsi_ob': 70, 'vol_spike': 0.15970420780758735, 'adx_thresh': 13.827720301503234, 'atr_min_pct': 0.0076519095895751146, 'atr_max_pct': 0.06984532781655263, 'tp_mult': 1.8157005408846116, 'tsl_mult': 0.7278678749400516, 'strategy': 'mean_reversion', 'time_stop': 84, 'use_sma': True, 'use_atr': True, 'use_adx': False, 'use_ema': True, 'use_spike': True, 'rsi_required': True, 'edge_k': 0.20234271369340234, 'edge_cap': 0.2281075587085546, 'bull_strategy': 'breakout', 'bull_bb_std_mult': 2.512828946873367, 'bull_rsi_os': 39, 'bull_rsi_ob': 65, 'bull_adx_thresh': 9.631052983033769, 'bull_atr_min_pct': 0.02006779276765343, 'bull_atr_max_pct': 0.06332881382865752, 'bull_tp_mult': 2.0716866060205565, 'bull_tsl_mult': 0.3118614917938467, 'bull_time_stop': 147, 'bull_use_sma': True, 'bull_use_ema': False, 'bull_use_atr': False, 'bull_use_adx': False, 'bull_use_spike': True, 'bull_rsi_required': True, 'bear_strategy': 'mean_reversion', 'bear_bb_std_mult': 0.8651016451374369, 'bear_rsi_os': 31, 'bear_rsi_ob': 67, 'bear_adx_thresh': 28.73730916155446, 'bear_atr_min_pct': 0.018637500399187146, 'bear_atr_max_pct': 0.07618126804305825, 'bear_tp_mult': 1.6454224147386052, 'bear_tsl_mult': 0.40967897294967015, 'bear_time_stop': 121, 'bear_use_sma': False, 'bear_use_ema': False, 'bear_use_atr': True, 'bear_use_adx': True, 'bear_use_spike': False, 'bear_rsi_required': True, 'sideways_strategy': 'breakout', 'sideways_bb_std_mult': 2.7113134739837137, 'sideways_rsi_os': 15, 'sideways_rsi_ob': 59, 'sideways_adx_thresh': 23.64199877002308, 'sideways_atr_min_pct': 0.0008455439515806588, 'sideways_atr_max_pct': 0.04887514113111431, 'sideways_tp_mult': 1.1417617084721858, 'sideways_tsl_mult': 0.8530451560182071, 'sideways_time_stop': 84, 'sideways_use_sma': True, 'sideways_use_ema': True, 'sideways_use_atr': False, 'sideways_use_adx': True, 'sideways_use_spike': True, 'sideways_rsi_required': False}.
[I 2025-08-30 16:01:10,415] Trial 622 finished with values: [-0.02146796373039539, 0.021388486091321445] and parameters: {'p_sma': 5, 'p_std': 43, 'p_atr': 22, 'p_adx': 25, 'rsi_period': 79, 'ema1': 30, 'ema2': 34, 'slip_atr_k': 0.08076716035143283, 'slip_spread_k': 0.12423398035946957, 'spread_hl_frac': 0.01627638800873507, 'bb_std_mult': 0.7984193516865683, 'rsi_os': 25, 'rsi_ob': 70, 'vol_spike': 0.1118691015544325, 'adx_thresh': 15.303949388930928, 'atr_min_pct': 0.003355271863017416, 'atr_max_pct': 0.07008863048087084, 'tp_mult': 1.7980851654234242, 'tsl_mult': 0.5018694462454641, 'strategy': 'mean_reversion', 'time_stop': 237, 'use_sma': True, 'use_atr': True, 'use_adx': False, 'use_ema': True, 'use_spike': True, 'rsi_required': True, 'edge_k': 0.5989072215704591, 'edge_cap': 0.6019150617006062, 'bull_strategy': 'breakout', 'bull_bb_std_mult': 2.527082552132621, 'bull_rsi_os': 39, 'bull_rsi_ob': 54, 'bull_adx_thresh': 29.50774577730833, 'bull_atr_min_pct': 0.020058260724178507, 'bull_atr_max_pct': 0.06946264291922302, 'bull_tp_mult': 1.264237421257787, 'bull_tsl_mult': 0.3092402078267571, 'bull_time_stop': 147, 'bull_use_sma': True, 'bull_use_ema': False, 'bull_use_atr': False, 'bull_use_adx': False, 'bull_use_spike': True, 'bull_rsi_required': True, 'bear_strategy': 'mean_reversion', 'bear_bb_std_mult': 0.884149093528326, 'bear_rsi_os': 31, 'bear_rsi_ob': 76, 'bear_adx_thresh': 16.027100133637347, 'bear_atr_min_pct': 0.02070506727057212, 'bear_atr_max_pct': 0.07986577448654492, 'bear_tp_mult': 1.6584605844829179, 'bear_tsl_mult': 0.9441688432679487, 'bear_time_stop': 96, 'bear_use_sma': False, 'bear_use_ema': False, 'bear_use_atr': True, 'bear_use_adx': True, 'bear_use_spike': False, 'bear_rsi_required': True, 'sideways_strategy': 'breakout', 'sideways_bb_std_mult': 1.791554668619321, 'sideways_rsi_os': 53, 'sideways_rsi_ob': 59, 'sideways_adx_thresh': 27.07149235683153, 'sideways_atr_min_pct': 0.0007627617199365156, 'sideways_atr_max_pct': 0.10058516069040001, 'sideways_tp_mult': 2.455070734765394, 'sideways_tsl_mult': 0.8587472501651696, 'sideways_time_stop': 141, 'sideways_use_sma': True, 'sideways_use_ema': True, 'sideways_use_atr': False, 'sideways_use_adx': True, 'sideways_use_spike': True, 'sideways_rsi_required': False}.
[I 2025-08-30 16:01:59,296] Trial 626 finished with values: [-1000000000.0, 1000000000.0] and parameters: {'p_sma': 28, 'p_std': 54, 'p_atr': 15, 'p_adx': 24, 'rsi_period': 75, 'ema1': 13, 'ema2': 43, 'slip_atr_k': 0.055276149715653894, 'slip_spread_k': 0.04967547074939829, 'spread_hl_frac': 0.02653064683100859, 'bb_std_mult': 0.8016833204723053, 'rsi_os': 27, 'rsi_ob': 55, 'vol_spike': 0.12300968313284201, 'adx_thresh': 13.911883958311837, 'atr_min_pct': 0.00724443486315484, 'atr_max_pct': 0.09140626467586599, 'tp_mult': 1.1589435868487297, 'tsl_mult': 0.495127812218682, 'strategy': 'breakout', 'time_stop': 123, 'use_sma': False, 'use_atr': True, 'use_adx': True, 'use_ema': True, 'use_spike': True, 'rsi_required': True, 'edge_k': 0.04357029041747906, 'edge_cap': 0.5548169183454315, 'bull_strategy': 'mean_reversion', 'bull_bb_std_mult': 2.4250999836657168, 'bull_rsi_os': 38, 'bull_rsi_ob': 52, 'bull_adx_thresh': 23.81735623606793, 'bull_atr_min_pct': 0.020451231466074866, 'bull_atr_max_pct': 0.07500810018230769, 'bull_tp_mult': 1.2080029147677986, 'bull_tsl_mult': 0.32592856799456826, 'bull_time_stop': 140, 'bull_use_sma': False, 'bull_use_ema': False, 'bull_use_atr': False, 'bull_use_adx': False, 'bull_use_spike': True, 'bull_rsi_required': True, 'bear_strategy': 'mean_reversion', 'bear_bb_std_mult': 1.6135792690314448, 'bear_rsi_os': 23, 'bear_rsi_ob': 89, 'bear_adx_thresh': 22.42247247921122, 'bear_atr_min_pct': 0.02038762295114013, 'bear_atr_max_pct': 0.06620570741222737, 'bear_tp_mult': 1.5273455817679493, 'bear_tsl_mult': 0.9384668347622598, 'bear_time_stop': 53, 'bear_use_sma': False, 'bear_use_ema': True, 'bear_use_atr': True, 'bear_use_adx': False, 'bear_use_spike': False, 'bear_rsi_required': True, 'sideways_strategy': 'breakout', 'sideways_bb_std_mult': 2.142068885195364, 'sideways_rsi_os': 27, 'sideways_rsi_ob': 56, 'sideways_adx_thresh': 28.41824145282812, 'sideways_atr_min_pct': 0.023768192517618816, 'sideways_atr_max_pct': 0.10139785774843196, 'sideways_tp_mult': 2.437414414680878, 'sideways_tsl_mult': 0.9819952481655662, 'sideways_time_stop': 115, 'sideways_use_sma': True, 'sideways_use_ema': True, 'sideways_use_atr': True, 'sideways_use_adx': False, 'sideways_use_spike': True, 'sideways_rsi_required': False}.
[I 2025-08-30 16:01:59,694] Trial 628 finished with values: [-1000000000.0, 1000000000.0] and parameters: {'p_sma': 6, 'p_std': 54, 'p_atr': 15, 'p_adx': 24, 'rsi_period': 76, 'ema1': 13, 'ema2': 37, 'slip_atr_k': 0.20113765176438964, 'slip_spread_k': 0.062040965594504935, 'spread_hl_frac': 0.026467731155294206, 'bb_std_mult': 0.7532359155277304, 'rsi_os': 26, 'rsi_ob': 80, 'vol_spike': 0.16931386872993132, 'adx_thresh': 13.256421071419686, 'atr_min_pct': 0.012518586697137402, 'atr_max_pct': 0.013689106486456423, 'tp_mult': 1.7694306698177327, 'tsl_mult': 0.7561767951891641, 'strategy': 'breakout', 'time_stop': 125, 'use_sma': False, 'use_atr': True, 'use_adx': True, 'use_ema': True, 'use_spike': True, 'rsi_required': True, 'edge_k': 0.3014522607428532, 'edge_cap': 0.4595755019726367, 'bull_strategy': 'mean_reversion', 'bull_bb_std_mult': 2.606898104370973, 'bull_rsi_os': 38, 'bull_rsi_ob': 48, 'bull_adx_thresh': 30.637297541702743, 'bull_atr_min_pct': 0.020687615330789052, 'bull_atr_max_pct': 0.059565183321109896, 'bull_tp_mult': 2.1913536731006564, 'bull_tsl_mult': 0.2953127688546847, 'bull_time_stop': 235, 'bull_use_sma': False, 'bull_use_ema': False, 'bull_use_atr': False, 'bull_use_adx': False, 'bull_use_spike': True, 'bull_rsi_required': False, 'bear_strategy': 'mean_reversion', 'bear_bb_std_mult': 0.7740476172887201, 'bear_rsi_os': 28, 'bear_rsi_ob': 90, 'bear_adx_thresh': 8.032492704868682, 'bear_atr_min_pct': 0.021203902020298624, 'bear_atr_max_pct': 0.06671525138983629, 'bear_tp_mult': 1.4848948688904606, 'bear_tsl_mult': 0.6753253959856756, 'bear_time_stop': 94, 'bear_use_sma': True, 'bear_use_ema': True, 'bear_use_atr': True, 'bear_use_adx': False, 'bear_use_spike': False, 'bear_rsi_required': True, 'sideways_strategy': 'mean_reversion', 'sideways_bb_std_mult': 1.7493429237966567, 'sideways_rsi_os': 51, 'sideways_rsi_ob': 78, 'sideways_adx_thresh': 30.32529797637583, 'sideways_atr_min_pct': 0.0019410298069942288, 'sideways_atr_max_pct': 0.05448115871007225, 'sideways_tp_mult': 2.4484173016641986, 'sideways_tsl_mult': 0.9864663305318498, 'sideways_time_stop': 63, 'sideways_use_sma': True, 'sideways_use_ema': True, 'sideways_use_atr': True, 'sideways_use_adx': False, 'sideways_use_spike': True, 'sideways_rsi_required': False}.
[I 2025-08-30 16:02:00,041] Trial 627 finished with values: [-1000000000.0, 1000000000.0] and parameters: {'p_sma': 23, 'p_std': 46, 'p_atr': 14, 'p_adx': 24, 'rsi_period': 28, 'ema1': 13, 'ema2': 26, 'slip_atr_k': 0.1999424028161359, 'slip_spread_k': 0.09804550209091473, 'spread_hl_frac': 0.01174656007043953, 'bb_std_mult': 0.7857700737528974, 'rsi_os': 5, 'rsi_ob': 77, 'vol_spike': 0.10969413544072557, 'adx_thresh': 13.575652046150356, 'atr_min_pct': 0.022222792829578862, 'atr_max_pct': 0.08086847452527264, 'tp_mult': 1.1660543762548996, 'tsl_mult': 0.6986142256114726, 'strategy': 'breakout', 'time_stop': 125, 'use_sma': False, 'use_atr': True, 'use_adx': True, 'use_ema': True, 'use_spike': True, 'rsi_required': True, 'edge_k': 0.18581700228833492, 'edge_cap': 0.4498112152275285, 'bull_strategy': 'mean_reversion', 'bull_bb_std_mult': 2.579034983648788, 'bull_rsi_os': 38, 'bull_rsi_ob': 49, 'bull_adx_thresh': 10.319457524025283, 'bull_atr_min_pct': 0.01946942997313237, 'bull_atr_max_pct': 0.060295179055781564, 'bull_tp_mult': 2.0949217209808606, 'bull_tsl_mult': 0.7964981201133247, 'bull_time_stop': 235, 'bull_use_sma': False, 'bull_use_ema': False, 'bull_use_atr': False, 'bull_use_adx': False, 'bull_use_spike': True, 'bull_rsi_required': False, 'bear_strategy': 'mean_reversion', 'bear_bb_std_mult': 2.1405347977323355, 'bear_rsi_os': 31, 'bear_rsi_ob': 65, 'bear_adx_thresh': 27.083819229570043, 'bear_atr_min_pct': 0.0216723936611127, 'bear_atr_max_pct': 0.0664454455325846, 'bear_tp_mult': 1.7771989490741067, 'bear_tsl_mult': 0.9464553234928843, 'bear_time_stop': 52, 'bear_use_sma': True, 'bear_use_ema': True, 'bear_use_atr': True, 'bear_use_adx': False, 'bear_use_spike': False, 'bear_rsi_required': True, 'sideways_strategy': 'mean_reversion', 'sideways_bb_std_mult': 2.138028885486367, 'sideways_rsi_os': 46, 'sideways_rsi_ob': 78, 'sideways_adx_thresh': 28.194699695558374, 'sideways_atr_min_pct': 0.0019086916487202911, 'sideways_atr_max_pct': 0.11626154608005537, 'sideways_tp_mult': 2.4569275229757506, 'sideways_tsl_mult': 0.9780554776334187, 'sideways_time_stop': 68, 'sideways_use_sma': True, 'sideways_use_ema': True, 'sideways_use_atr': True, 'sideways_use_adx': False, 'sideways_use_spike': True, 'sideways_rsi_required': False}.
[I 2025-08-30 16:02:00,771] Trial 629 finished with values: [-1000000000.0, 1000000000.0] and parameters: {'p_sma': 47, 'p_std': 56, 'p_atr': 15, 'p_adx': 24, 'rsi_period': 54, 'ema1': 29, 'ema2': 37, 'slip_atr_k': 0.05988675023571287, 'slip_spread_k': 0.057341527222146305, 'spread_hl_frac': 0.01285384986455742, 'bb_std_mult': 1.1777801175953915, 'rsi_os': 26, 'rsi_ob': 73, 'vol_spike': 0.09196201071064591, 'adx_thresh': 25.84096392248398, 'atr_min_pct': 0.012472241430877468, 'atr_max_pct': 0.13168706524991738, 'tp_mult': 1.9682294012728854, 'tsl_mult': 0.7541390136138706, 'strategy': 'breakout', 'time_stop': 125, 'use_sma': False, 'use_atr': True, 'use_adx': True, 'use_ema': True, 'use_spike': True, 'rsi_required': True, 'edge_k': 0.28564630550772024, 'edge_cap': 0.5562757428188232, 'bull_strategy': 'mean_reversion', 'bull_bb_std_mult': 2.8563260516983675, 'bull_rsi_os': 38, 'bull_rsi_ob': 52, 'bull_adx_thresh': 22.268177556938998, 'bull_atr_min_pct': 0.019279460829575667, 'bull_atr_max_pct': 0.048275692477891596, 'bull_tp_mult': 2.199698304307726, 'bull_tsl_mult': 0.7971601091082614, 'bull_time_stop': 161, 'bull_use_sma': False, 'bull_use_ema': False, 'bull_use_atr': False, 'bull_use_adx': False, 'bull_use_spike': True, 'bull_rsi_required': False, 'bear_strategy': 'mean_reversion', 'bear_bb_std_mult': 2.1312519237444336, 'bear_rsi_os': 28, 'bear_rsi_ob': 78, 'bear_adx_thresh': 27.08171083718232, 'bear_atr_min_pct': 0.021566076509938435, 'bear_atr_max_pct': 0.06574875992812948, 'bear_tp_mult': 2.351321623092758, 'bear_tsl_mult': 0.6760209644420863, 'bear_time_stop': 56, 'bear_use_sma': True, 'bear_use_ema': True, 'bear_use_atr': True, 'bear_use_adx': False, 'bear_use_spike': False, 'bear_rsi_required': True, 'sideways_strategy': 'mean_reversion', 'sideways_bb_std_mult': 1.2958936718799388, 'sideways_rsi_os': 27, 'sideways_rsi_ob': 56, 'sideways_adx_thresh': 28.28200069425737, 'sideways_atr_min_pct': 0.0021160430469992783, 'sideways_atr_max_pct': 0.13422401994710959, 'sideways_tp_mult': 2.4494268853653147, 'sideways_tsl_mult': 0.9832487553748149, 'sideways_time_stop': 115, 'sideways_use_sma': True, 'sideways_use_ema': True, 'sideways_use_atr': True, 'sideways_use_adx': False, 'sideways_use_spike': True, 'sideways_rsi_required': False}.
