[I 2025-08-30 16:12:37,789] Trial 684 finished with values: [-1000000000.0, 1000000000.0] and parameters: {'p_sma': 38, 'p_std': 56, 'p_atr': 25, 'p_adx': 12, 'rsi_period': 78, 'ema1': 26, 'ema2': 30, 'slip_atr_k': 0.13497999155655324, 'slip_spread_k': 0.4689163311904814, 'spread_hl_frac': 0.025256583690758904, 'bb_std_mult': 2.3567290052553966, 'rsi_os': 37, 'rsi_ob': 74, 'vol_spike': 0.11851820548569944, 'adx_thresh': 15.082327678885484, 'atr_min_pct': 0.015738909372467233, 'atr_max_pct': 0.07077990490513356, 'tp_mult': 1.6863810541312734, 'tsl_mult': 0.3664642061739082, 'strategy': 'mean_reversion', 'time_stop': 209, 'use_sma': True, 'use_atr': True, 'use_adx': False, 'use_ema': True, 'use_spike': True, 'rsi_required': False, 'edge_k': 0.4216938886585526, 'edge_cap': 0.343437540124899, 'bull_strategy': 'breakout', 'bull_bb_std_mult': 0.7243008057689626, 'bull_rsi_os': 6, 'bull_rsi_ob': 67, 'bull_adx_thresh': 25.031888179512706, 'bull_atr_min_pct': 0.010447075686934516, 'bull_atr_max_pct': 0.09088644706504134, 'bull_tp_mult': 1.9976967205673986, 'bull_tsl_mult': 0.14928471099775076, 'bull_time_stop': 86, 'bull_use_sma': True, 'bull_use_ema': True, 'bull_use_atr': True, 'bull_use_adx': True, 'bull_use_spike': True, 'bull_rsi_required': True, 'bear_strategy': 'mean_reversion', 'bear_bb_std_mult': 2.4770877843079937, 'bear_rsi_os': 41, 'bear_rsi_ob': 86, 'bear_adx_thresh': 24.20585079683586, 'bear_atr_min_pct': 0.018373504234359135, 'bear_atr_max_pct': 0.11398429096998315, 'bear_tp_mult': 2.6965698110757197, 'bear_tsl_mult': 0.40997705776686144, 'bear_time_stop': 292, 'bear_use_sma': False, 'bear_use_ema': False, 'bear_use_atr': True, 'bear_use_adx': True, 'bear_use_spike': True, 'bear_rsi_required': True, 'sideways_strategy': 'breakout', 'sideways_bb_std_mult': 1.2033956348808554, 'sideways_rsi_os': 40, 'sideways_rsi_ob': 62, 'sideways_adx_thresh': 25.183243267814, 'sideways_atr_min_pct': 0.0065270402379972725, 'sideways_atr_max_pct': 0.12319648227974375, 'sideways_tp_mult': 2.942776617631103, 'sideways_tsl_mult': 0.9368922004803006, 'sideways_time_stop': 156, 'sideways_use_sma': True, 'sideways_use_ema': True, 'sideways_use_atr': False, 'sideways_use_adx': True, 'sideways_use_spike': True, 'sideways_rsi_required': True}.
[I 2025-08-30 16:12:39,530] Trial 688 finished with values: [-1000000000.0, 1000000000.0] and parameters: {'p_sma': 59, 'p_std': 53, 'p_atr': 29, 'p_adx': 11, 'rsi_period': 22, 'ema1': 25, 'ema2': 31, 'slip_atr_k': 0.06932187416055974, 'slip_spread_k': 0.6722408126371477, 'spread_hl_frac': 0.041700745718907084, 'bb_std_mult': 2.465502009532238, 'rsi_os': 40, 'rsi_ob': 48, 'vol_spike': 0.16849202436810204, 'adx_thresh': 14.341286778872023, 'atr_min_pct': 0.014940570973724547, 'atr_max_pct': 0.07415778161377118, 'tp_mult': 1.7123720337093082, 'tsl_mult': 0.21122573762070976, 'strategy': 'mean_reversion', 'time_stop': 196, 'use_sma': True, 'use_atr': False, 'use_adx': False, 'use_ema': True, 'use_spike': False, 'rsi_required': False, 'edge_k': 0.5021906622585325, 'edge_cap': 0.8077185675686295, 'bull_strategy': 'breakout', 'bull_bb_std_mult': 0.9353448349672153, 'bull_rsi_os': 40, 'bull_rsi_ob': 61, 'bull_adx_thresh': 23.161039488281986, 'bull_atr_min_pct': 0.029893438354201777, 'bull_atr_max_pct': 0.08525783861858417, 'bull_tp_mult': 2.0664245488316495, 'bull_tsl_mult': 0.02668029157363159, 'bull_time_stop': 38, 'bull_use_sma': True, 'bull_use_ema': True, 'bull_use_atr': True, 'bull_use_adx': True, 'bull_use_spike': True, 'bull_rsi_required': True, 'bear_strategy': 'breakout', 'bear_bb_std_mult': 2.5221974083632293, 'bear_rsi_os': 32, 'bear_rsi_ob': 86, 'bear_adx_thresh': 28.870707281659115, 'bear_atr_min_pct': 0.020320256354030227, 'bear_atr_max_pct': 0.1289500184341244, 'bear_tp_mult': 2.789982322022776, 'bear_tsl_mult': 0.5696907651315135, 'bear_time_stop': 259, 'bear_use_sma': False, 'bear_use_ema': False, 'bear_use_atr': True, 'bear_use_adx': True, 'bear_use_spike': True, 'bear_rsi_required': False, 'sideways_strategy': 'mean_reversion', 'sideways_bb_std_mult': 0.5588161548076254, 'sideways_rsi_os': 36, 'sideways_rsi_ob': 64, 'sideways_adx_thresh': 24.492675393327207, 'sideways_atr_min_pct': 0.008016915321597764, 'sideways_atr_max_pct': 0.10356856110215018, 'sideways_tp_mult': 2.8688821386234604, 'sideways_tsl_mult': 0.9005203395054849, 'sideways_time_stop': 282, 'sideways_use_sma': True, 'sideways_use_ema': False, 'sideways_use_atr': False, 'sideways_use_adx': True, 'sideways_use_spike': True, 'sideways_rsi_required': True}.
[I 2025-08-30 16:13:26,860] Trial 687 finished with values: [-1000000000.0, 1000000000.0] and parameters: {'p_sma': 5, 'p_std': 53, 'p_atr': 29, 'p_adx': 12, 'rsi_period': 29, 'ema1': 19, 'ema2': 32, 'slip_atr_k': 0.06961008570582823, 'slip_spread_k': 0.7793950048862699, 'spread_hl_frac': 0.025059654470871755, 'bb_std_mult': 2.453941746392964, 'rsi_os': 40, 'rsi_ob': 71, 'vol_spike': 0.1697725713135495, 'adx_thresh': 15.479219214800892, 'atr_min_pct': 0.01485215647572855, 'atr_max_pct': 0.12125445063439261, 'tp_mult': 2.8228167317743504, 'tsl_mult': 0.22658476422086915, 'strategy': 'mean_reversion', 'time_stop': 200, 'use_sma': True, 'use_atr': True, 'use_adx': False, 'use_ema': True, 'use_spike': False, 'rsi_required': False, 'edge_k': 0.4896271598665372, 'edge_cap': 0.9673818814287396, 'bull_strategy': 'breakout', 'bull_bb_std_mult': 0.9069616108557621, 'bull_rsi_os': 40, 'bull_rsi_ob': 61, 'bull_adx_thresh': 24.4656730224594, 'bull_atr_min_pct': 0.02038114040456619, 'bull_atr_max_pct': 0.09942886212632011, 'bull_tp_mult': 2.0008566055925527, 'bull_tsl_mult': 0.1673718726116336, 'bull_time_stop': 58, 'bull_use_sma': True, 'bull_use_ema': True, 'bull_use_atr': True, 'bull_use_adx': True, 'bull_use_spike': True, 'bull_rsi_required': True, 'bear_strategy': 'breakout', 'bear_bb_std_mult': 2.511121275839676, 'bear_rsi_os': 32, 'bear_rsi_ob': 86, 'bear_adx_thresh': 29.34582842198334, 'bear_atr_min_pct': 0.020476497131752848, 'bear_atr_max_pct': 0.0735728413798189, 'bear_tp_mult': 2.79599869153057, 'bear_tsl_mult': 0.5635549652833247, 'bear_time_stop': 283, 'bear_use_sma': False, 'bear_use_ema': False, 'bear_use_atr': True, 'bear_use_adx': True, 'bear_use_spike': True, 'bear_rsi_required': False, 'sideways_strategy': 'breakout', 'sideways_bb_std_mult': 1.2764717826619822, 'sideways_rsi_os': 36, 'sideways_rsi_ob': 64, 'sideways_adx_thresh': 24.784264975942108, 'sideways_atr_min_pct': 0.002901429321510253, 'sideways_atr_max_pct': 0.10827792814360157, 'sideways_tp_mult': 2.8503952254273623, 'sideways_tsl_mult': 0.8904754402790959, 'sideways_time_stop': 284, 'sideways_use_sma': True, 'sideways_use_ema': False, 'sideways_use_atr': False, 'sideways_use_adx': True, 'sideways_use_spike': True, 'sideways_rsi_required': True}.
[I 2025-08-30 16:13:28,813] Trial 685 finished with values: [-1000000000.0, 1000000000.0] and parameters: {'p_sma': 27, 'p_std': 53, 'p_atr': 25, 'p_adx': 12, 'rsi_period': 26, 'ema1': 26, 'ema2': 30, 'slip_atr_k': 0.07053152676471519, 'slip_spread_k': 0.8755997649248394, 'spread_hl_frac': 0.02483640612378813, 'bb_std_mult': 2.3391017761258537, 'rsi_os': 40, 'rsi_ob': 71, 'vol_spike': 0.16884952809080928, 'adx_thresh': 15.485551708244339, 'atr_min_pct': 0.015454546851443414, 'atr_max_pct': 0.12082917949585609, 'tp_mult': 2.832006169070142, 'tsl_mult': 0.14391976691307656, 'strategy': 'mean_reversion', 'time_stop': 209, 'use_sma': True, 'use_atr': True, 'use_adx': False, 'use_ema': True, 'use_spike': True, 'rsi_required': False, 'edge_k': 0.4181941842256429, 'edge_cap': 0.33644394783000864, 'bull_strategy': 'breakout', 'bull_bb_std_mult': 0.7108243758133765, 'bull_rsi_os': 40, 'bull_rsi_ob': 67, 'bull_adx_thresh': 23.302236682241595, 'bull_atr_min_pct': 0.020395653818487708, 'bull_atr_max_pct': 0.09167311723122494, 'bull_tp_mult': 2.0195476081746055, 'bull_tsl_mult': 0.15656155919341788, 'bull_time_stop': 36, 'bull_use_sma': True, 'bull_use_ema': True, 'bull_use_atr': True, 'bull_use_adx': True, 'bull_use_spike': True, 'bull_rsi_required': True, 'bear_strategy': 'mean_reversion', 'bear_bb_std_mult': 2.476015143079465, 'bear_rsi_os': 32, 'bear_rsi_ob': 86, 'bear_adx_thresh': 31.52732125607698, 'bear_atr_min_pct': 0.01670050090515276, 'bear_atr_max_pct': 0.07355340663510793, 'bear_tp_mult': 2.787840028774329, 'bear_tsl_mult': 0.13497752605192953, 'bear_time_stop': 294, 'bear_use_sma': False, 'bear_use_ema': False, 'bear_use_atr': True, 'bear_use_adx': True, 'bear_use_spike': True, 'bear_rsi_required': False, 'sideways_strategy': 'breakout', 'sideways_bb_std_mult': 0.5791393435327288, 'sideways_rsi_os': 40, 'sideways_rsi_ob': 64, 'sideways_adx_thresh': 24.67949061457084, 'sideways_atr_min_pct': 0.02855321716480748, 'sideways_atr_max_pct': 0.10858204567556508, 'sideways_tp_mult': 2.848027618228141, 'sideways_tsl_mult': 0.933383944212623, 'sideways_time_stop': 63, 'sideways_use_sma': True, 'sideways_use_ema': True, 'sideways_use_atr': False, 'sideways_use_adx': True, 'sideways_use_spike': True, 'sideways_rsi_required': True}.
[I 2025-08-30 16:13:29,839] Trial 686 finished with values: [-1000000000.0, 1000000000.0] and parameters: {'p_sma': 27, 'p_std': 53, 'p_atr': 25, 'p_adx': 12, 'rsi_period': 30, 'ema1': 25, 'ema2': 28, 'slip_atr_k': 0.07006748315242659, 'slip_spread_k': 0.14124745372149522, 'spread_hl_frac': 0.043676947206058414, 'bb_std_mult': 2.4630827866928526, 'rsi_os': 40, 'rsi_ob': 71, 'vol_spike': 0.10054644941513052, 'adx_thresh': 15.366821354901765, 'atr_min_pct': 0.01562146603896767, 'atr_max_pct': 0.07363501763608313, 'tp_mult': 1.689461085992859, 'tsl_mult': 0.21636346607512613, 'strategy': 'mean_reversion', 'time_stop': 198, 'use_sma': True, 'use_atr': True, 'use_adx': False, 'use_ema': True, 'use_spike': True, 'rsi_required': False, 'edge_k': 0.401360807026825, 'edge_cap': 0.41712048419457354, 'bull_strategy': 'breakout', 'bull_bb_std_mult': 0.7395497540475116, 'bull_rsi_os': 40, 'bull_rsi_ob': 67, 'bull_adx_thresh': 24.887687096367436, 'bull_atr_min_pct': 0.02053450037526903, 'bull_atr_max_pct': 0.08499680535412882, 'bull_tp_mult': 2.0038107802484384, 'bull_tsl_mult': 0.1625824862332073, 'bull_time_stop': 58, 'bull_use_sma': True, 'bull_use_ema': True, 'bull_use_atr': True, 'bull_use_adx': True, 'bull_use_spike': True, 'bull_rsi_required': True, 'bear_strategy': 'breakout', 'bear_bb_std_mult': 2.4783578100487316, 'bear_rsi_os': 34, 'bear_rsi_ob': 86, 'bear_adx_thresh': 29.13854247278192, 'bear_atr_min_pct': 0.01673319874361668, 'bear_atr_max_pct': 0.11639730903088909, 'bear_tp_mult': 2.78122415272363, 'bear_tsl_mult': 0.5606938870221017, 'bear_time_stop': 293, 'bear_use_sma': False, 'bear_use_ema': False, 'bear_use_atr': True, 'bear_use_adx': True, 'bear_use_spike': True, 'bear_rsi_required': False, 'sideways_strategy': 'breakout', 'sideways_bb_std_mult': 0.5776666462413771, 'sideways_rsi_os': 36, 'sideways_rsi_ob': 64, 'sideways_adx_thresh': 24.624822336332496, 'sideways_atr_min_pct': 0.006516087907771412, 'sideways_atr_max_pct': 0.10845500321982475, 'sideways_tp_mult': 2.8472561281350335, 'sideways_tsl_mult': 0.9397666784255836, 'sideways_time_stop': 282, 'sideways_use_sma': True, 'sideways_use_ema': False, 'sideways_use_atr': False, 'sideways_use_adx': True, 'sideways_use_spike': True, 'sideways_rsi_required': True}.
[I 2025-08-30 16:13:31,795] Trial 689 finished with values: [-1000000000.0, 1000000000.0] and parameters: {'p_sma': 5, 'p_std': 54, 'p_atr': 23, 'p_adx': 12, 'rsi_period': 26, 'ema1': 19, 'ema2': 32, 'slip_atr_k': 0.20696216128357453, 'slip_spread_k': 0.14288880527984832, 'spread_hl_frac': 0.02528223534921383, 'bb_std_mult': 2.2176291843610025, 'rsi_os': 41, 'rsi_ob': 71, 'vol_spike': 0.22792008671241845, 'adx_thresh': 17.265400328603484, 'atr_min_pct': 0.016277710777052097, 'atr_max_pct': 0.07632725165379728, 'tp_mult': 1.7972380956215468, 'tsl_mult': 0.2712211893176351, 'strategy': 'mean_reversion', 'time_stop': 201, 'use_sma': True, 'use_atr': True, 'use_adx': False, 'use_ema': True, 'use_spike': True, 'rsi_required': False, 'edge_k': 0.39748535072554975, 'edge_cap': 0.6193675718640029, 'bull_strategy': 'breakout', 'bull_bb_std_mult': 0.7808332267128685, 'bull_rsi_os': 21, 'bull_rsi_ob': 65, 'bull_adx_thresh': 23.15069868933659, 'bull_atr_min_pct': 0.018807460913402504, 'bull_atr_max_pct': 0.09898472954949784, 'bull_tp_mult': 2.0163581722866764, 'bull_tsl_mult': 0.16280669677857723, 'bull_time_stop': 58, 'bull_use_sma': True, 'bull_use_ema': True, 'bull_use_atr': True, 'bull_use_adx': True, 'bull_use_spike': True, 'bull_rsi_required': True, 'bear_strategy': 'mean_reversion', 'bear_bb_std_mult': 2.5385566021137196, 'bear_rsi_os': 33, 'bear_rsi_ob': 84, 'bear_adx_thresh': 33.90891682482158, 'bear_atr_min_pct': 0.016686932073404315, 'bear_atr_max_pct': 0.08447438036755864, 'bear_tp_mult': 2.797976070952859, 'bear_tsl_mult': 0.28675410192367934, 'bear_time_stop': 281, 'bear_use_sma': False, 'bear_use_ema': False, 'bear_use_atr': True, 'bear_use_adx': True, 'bear_use_spike': True, 'bear_rsi_required': False, 'sideways_strategy': 'breakout', 'sideways_bb_std_mult': 0.8930155945465454, 'sideways_rsi_os': 39, 'sideways_rsi_ob': 61, 'sideways_adx_thresh': 24.630817756264353, 'sideways_atr_min_pct': 0.017781433768916735, 'sideways_atr_max_pct': 0.10751966180387741, 'sideways_tp_mult': 2.9214949953296214, 'sideways_tsl_mult': 0.9483854761416257, 'sideways_time_stop': 80, 'sideways_use_sma': True, 'sideways_use_ema': False, 'sideways_use_atr': False, 'sideways_use_adx': True, 'sideways_use_spike': True, 'sideways_rsi_required': True}.
[I 2025-08-30 16:14:19,441] Trial 692 finished with values: [-1000000000.0, 1000000000.0] and parameters: {'p_sma': 7, 'p_std': 54, 'p_atr': 23, 'p_adx': 10, 'rsi_period': 20, 'ema1': 18, 'ema2': 32, 'slip_atr_k': 0.24328050295920547, 'slip_spread_k': 0.7013100898759939, 'spread_hl_frac': 0.009528077574371225, 'bb_std_mult': 2.2310934554273767, 'rsi_os': 41, 'rsi_ob': 73, 'vol_spike': 0.1537704599197117, 'adx_thresh': 14.265287259074437, 'atr_min_pct': 0.01642437692342299, 'atr_max_pct': 0.07682168457358354, 'tp_mult': 1.4955339537002859, 'tsl_mult': 0.16957940270769695, 'strategy': 'mean_reversion', 'time_stop': 243, 'use_sma': True, 'use_atr': False, 'use_adx': True, 'use_ema': False, 'use_spike': True, 'rsi_required': False, 'edge_k': 0.4572048483156642, 'edge_cap': 0.6167692686963852, 'bull_strategy': 'breakout', 'bull_bb_std_mult': 0.8062577344856883, 'bull_rsi_os': 12, 'bull_rsi_ob': 65, 'bull_adx_thresh': 24.052068676594466, 'bull_atr_min_pct': 0.018693477843903496, 'bull_atr_max_pct': 0.09720305525507564, 'bull_tp_mult': 2.0571041746776615, 'bull_tsl_mult': 0.07614244868119611, 'bull_time_stop': 46, 'bull_use_sma': True, 'bull_use_ema': True, 'bull_use_atr': True, 'bull_use_adx': True, 'bull_use_spike': True, 'bull_rsi_required': True, 'bear_strategy': 'mean_reversion', 'bear_bb_std_mult': 2.5995587529826607, 'bear_rsi_os': 35, 'bear_rsi_ob': 84, 'bear_adx_thresh': 30.29503936823367, 'bear_atr_min_pct': 0.021228454995507937, 'bear_atr_max_pct': 0.08354626526503799, 'bear_tp_mult': 2.9381466500215536, 'bear_tsl_mult': 0.47510431910640294, 'bear_time_stop': 277, 'bear_use_sma': False, 'bear_use_ema': False, 'bear_use_atr': False, 'bear_use_adx': True, 'bear_use_spike': True, 'bear_rsi_required': True, 'sideways_strategy': 'mean_reversion', 'sideways_bb_std_mult': 1.3541046937935994, 'sideways_rsi_os': 39, 'sideways_rsi_ob': 61, 'sideways_adx_thresh': 23.898083090716074, 'sideways_atr_min_pct': 0.0008080806167484814, 'sideways_atr_max_pct': 0.04498929356609635, 'sideways_tp_mult': 2.9218947201694427, 'sideways_tsl_mult': 0.7424023554687614, 'sideways_time_stop': 183, 'sideways_use_sma': True, 'sideways_use_ema': True, 'sideways_use_atr': False, 'sideways_use_adx': True, 'sideways_use_spike': False, 'sideways_rsi_required': True}.
[I 2025-08-30 16:14:20,973] Trial 693 finished with values: [-1000000000.0, 1000000000.0] and parameters: {'p_sma': 12, 'p_std': 56, 'p_atr': 21, 'p_adx': 11, 'rsi_period': 82, 'ema1': 18, 'ema2': 31, 'slip_atr_k': 0.0004436609054947471, 'slip_spread_k': 0.3635375446777779, 'spread_hl_frac': 0.02322516643493636, 'bb_std_mult': 2.2911961435104273, 'rsi_os': 39, 'rsi_ob': 73, 'vol_spike': 0.15033453390115875, 'adx_thresh': 14.23707696227097, 'atr_min_pct': 0.016620398461257006, 'atr_max_pct': 0.13245574564676682, 'tp_mult': 1.742497622171349, 'tsl_mult': 0.392373043674318, 'strategy': 'mean_reversion', 'time_stop': 245, 'use_sma': True, 'use_atr': False, 'use_adx': True, 'use_ema': False, 'use_spike': True, 'rsi_required': False, 'edge_k': 0.4588956021515283, 'edge_cap': 0.3842443090283723, 'bull_strategy': 'breakout', 'bull_bb_std_mult': 0.8081037799128459, 'bull_rsi_os': 48, 'bull_rsi_ob': 62, 'bull_adx_thresh': 24.00090514049925, 'bull_atr_min_pct': 0.013040108940040238, 'bull_atr_max_pct': 0.08734993195442582, 'bull_tp_mult': 2.05894193997679, 'bull_tsl_mult': 0.03719744777306381, 'bull_time_stop': 48, 'bull_use_sma': True, 'bull_use_ema': True, 'bull_use_atr': True, 'bull_use_adx': True, 'bull_use_spike': True, 'bull_rsi_required': True, 'bear_strategy': 'mean_reversion', 'bear_bb_std_mult': 2.608445491240474, 'bear_rsi_os': 37, 'bear_rsi_ob': 84, 'bear_adx_thresh': 9.976145310852868, 'bear_atr_min_pct': 0.021206502829774324, 'bear_atr_max_pct': 0.07702747152780236, 'bear_tp_mult': 2.862972695412909, 'bear_tsl_mult': 0.5114063268776725, 'bear_time_stop': 274, 'bear_use_sma': False, 'bear_use_ema': False, 'bear_use_atr': False, 'bear_use_adx': True, 'bear_use_spike': True, 'bear_rsi_required': True, 'sideways_strategy': 'mean_reversion', 'sideways_bb_std_mult': 0.9138303605330352, 'sideways_rsi_os': 39, 'sideways_rsi_ob': 62, 'sideways_adx_thresh': 23.487699090811688, 'sideways_atr_min_pct': 0.0007474515718978093, 'sideways_atr_max_pct': 0.11249208995565482, 'sideways_tp_mult': 2.962108302067892, 'sideways_tsl_mult': 0.619614269493614, 'sideways_time_stop': 189, 'sideways_use_sma': True, 'sideways_use_ema': True, 'sideways_use_atr': False, 'sideways_use_adx': True, 'sideways_use_spike': False, 'sideways_rsi_required': True}.
[I 2025-08-30 16:14:22,353] Trial 690 finished with values: [-1000000000.0, 1000000000.0] and parameters: {'p_sma': 46, 'p_std': 54, 'p_atr': 23, 'p_adx': 11, 'rsi_period': 80, 'ema1': 24, 'ema2': 31, 'slip_atr_k': 0.09072691886718273, 'slip_spread_k': 0.13748541497140862, 'spread_hl_frac': 0.009277812932392639, 'bb_std_mult': 2.2065803543839615, 'rsi_os': 39, 'rsi_ob': 58, 'vol_spike': 0.22583163134227163, 'adx_thresh': 17.28048560288319, 'atr_min_pct': 0.016212922790809166, 'atr_max_pct': 0.07605245935627016, 'tp_mult': 1.5013148701608758, 'tsl_mult': 0.1739176767747842, 'strategy': 'mean_reversion', 'time_stop': 245, 'use_sma': True, 'use_atr': True, 'use_adx': False, 'use_ema': True, 'use_spike': True, 'rsi_required': False, 'edge_k': 0.40482349692007463, 'edge_cap': 0.19860612648745601, 'bull_strategy': 'breakout', 'bull_bb_std_mult': 0.7659849696994281, 'bull_rsi_os': 52, 'bull_rsi_ob': 65, 'bull_adx_thresh': 23.262029871234596, 'bull_atr_min_pct': 0.020529736944366685, 'bull_atr_max_pct': 0.09797575258486166, 'bull_tp_mult': 2.0389171160610764, 'bull_tsl_mult': 0.040949441546155756, 'bull_time_stop': 45, 'bull_use_sma': True, 'bull_use_ema': True, 'bull_use_atr': True, 'bull_use_adx': True, 'bull_use_spike': True, 'bull_rsi_required': True, 'bear_strategy': 'mean_reversion', 'bear_bb_std_mult': 2.589572589910095, 'bear_rsi_os': 33, 'bear_rsi_ob': 85, 'bear_adx_thresh': 33.93064305038673, 'bear_atr_min_pct': 0.02131495032346086, 'bear_atr_max_pct': 0.07647563606374984, 'bear_tp_mult': 2.790113057066444, 'bear_tsl_mult': 0.28932085361325655, 'bear_time_stop': 278, 'bear_use_sma': False, 'bear_use_ema': False, 'bear_use_atr': True, 'bear_use_adx': True, 'bear_use_spike': True, 'bear_rsi_required': True, 'sideways_strategy': 'breakout', 'sideways_bb_std_mult': 0.917663754165374, 'sideways_rsi_os': 40, 'sideways_rsi_ob': 61, 'sideways_adx_thresh': 23.64536912033388, 'sideways_atr_min_pct': 0.00557824098094303, 'sideways_atr_max_pct': 0.11195475811339768, 'sideways_tp_mult': 2.923174792234445, 'sideways_tsl_mult': 0.9482731062458453, 'sideways_time_stop': 266, 'sideways_use_sma': True, 'sideways_use_ema': True, 'sideways_use_atr': False, 'sideways_use_adx': True, 'sideways_use_spike': True, 'sideways_rsi_required': True}.
