[I 2025-08-30 15:53:16,671] Trial 582 finished with values: [-1000000000.0, 1000000000.0] and parameters: {'p_sma': 5, 'p_std': 15, 'p_atr': 9, 'p_adx': 26, 'rsi_period': 74, 'ema1': 9, 'ema2': 42, 'slip_atr_k': 0.14583466050821386, 'slip_spread_k': 0.13943338230227295, 'spread_hl_frac': 0.026944446851766085, 'bb_std_mult': 0.9281243372810722, 'rsi_os': 17, 'rsi_ob': 74, 'vol_spike': 0.17099155829545695, 'adx_thresh': 12.597213859730406, 'atr_min_pct': 0.014451284441761985, 'atr_max_pct': 0.07241246577722736, 'tp_mult': 1.7897222534600679, 'tsl_mult': 0.6893079120243237, 'strategy': 'breakout', 'time_stop': 89, 'use_sma': False, 'use_atr': True, 'use_adx': False, 'use_ema': True, 'use_spike': True, 'rsi_required': True, 'edge_k': 1.4313696998931267, 'edge_cap': 0.5410678443269074, 'bull_strategy': 'breakout', 'bull_bb_std_mult': 2.5200343231810414, 'bull_rsi_os': 36, 'bull_rsi_ob': 49, 'bull_adx_thresh': 10.488614777858658, 'bull_atr_min_pct': 0.02693990858019528, 'bull_atr_max_pct': 0.059535713540478985, 'bull_tp_mult': 2.0763026745184217, 'bull_tsl_mult': 0.33453012780372615, 'bull_time_stop': 172, 'bull_use_sma': True, 'bull_use_ema': True, 'bull_use_atr': True, 'bull_use_adx': False, 'bull_use_spike': True, 'bull_rsi_required': False, 'bear_strategy': 'mean_reversion', 'bear_bb_std_mult': 0.7294085136359516, 'bear_rsi_os': 26, 'bear_rsi_ob': 53, 'bear_adx_thresh': 26.667953161634216, 'bear_atr_min_pct': 0.019507458213767353, 'bear_atr_max_pct': 0.0674616137454977, 'bear_tp_mult': 1.548750350821047, 'bear_tsl_mult': 0.9343847566748179, 'bear_time_stop': 279, 'bear_use_sma': True, 'bear_use_ema': False, 'bear_use_atr': False, 'bear_use_adx': True, 'bear_use_spike': False, 'bear_rsi_required': True, 'sideways_strategy': 'mean_reversion', 'sideways_bb_std_mult': 2.1560329150290265, 'sideways_rsi_os': 41, 'sideways_rsi_ob': 61, 'sideways_adx_thresh': 32.02604472571253, 'sideways_atr_min_pct': 0.02274570137437795, 'sideways_atr_max_pct': 0.10568698546365499, 'sideways_tp_mult': 1.4312150459446547, 'sideways_tsl_mult': 0.9798464023434476, 'sideways_time_stop': 145, 'sideways_use_sma': True, 'sideways_use_ema': True, 'sideways_use_atr': False, 'sideways_use_adx': True, 'sideways_use_spike': True, 'sideways_rsi_required': False}.
[I 2025-08-30 15:54:00,409] Trial 588 finished with values: [-1000000000.0, 1000000000.0] and parameters: {'p_sma': 5, 'p_std': 55, 'p_atr': 29, 'p_adx': 25, 'rsi_period': 9, 'ema1': 20, 'ema2': 42, 'slip_atr_k': 0.0625520998278097, 'slip_spread_k': 0.14211048712364008, 'spread_hl_frac': 0.025492820590405644, 'bb_std_mult': 2.4921405566597716, 'rsi_os': 24, 'rsi_ob': 78, 'vol_spike': 0.036754732466181356, 'adx_thresh': 10.689762091572891, 'atr_min_pct': 0.014497479207076495, 'atr_max_pct': 0.07841018002335581, 'tp_mult': 1.7593501507136498, 'tsl_mult': 0.5141895737514761, 'strategy': 'mean_reversion', 'time_stop': 137, 'use_sma': True, 'use_atr': True, 'use_adx': True, 'use_ema': True, 'use_spike': True, 'rsi_required': True, 'edge_k': 1.9360132362070934, 'edge_cap': 0.20605743807854437, 'bull_strategy': 'mean_reversion', 'bull_bb_std_mult': 2.615469419410997, 'bull_rsi_os': 36, 'bull_rsi_ob': 52, 'bull_adx_thresh': 22.392087672921853, 'bull_atr_min_pct': 0.02033879580954199, 'bull_atr_max_pct': 0.1276491981323381, 'bull_tp_mult': 2.1330523065958484, 'bull_tsl_mult': 0.2919913845437829, 'bull_time_stop': 160, 'bull_use_sma': False, 'bull_use_ema': False, 'bull_use_atr': False, 'bull_use_adx': False, 'bull_use_spike': True, 'bull_rsi_required': False, 'bear_strategy': 'breakout', 'bear_bb_std_mult': 0.6709893029735431, 'bear_rsi_os': 48, 'bear_rsi_ob': 53, 'bear_adx_thresh': 28.975402643670442, 'bear_atr_min_pct': 0.002601125527389758, 'bear_atr_max_pct': 0.08171609202002204, 'bear_tp_mult': 1.6303805620159608, 'bear_tsl_mult': 0.9406211520999186, 'bear_time_stop': 48, 'bear_use_sma': False, 'bear_use_ema': True, 'bear_use_atr': True, 'bear_use_adx': False, 'bear_use_spike': False, 'bear_rsi_required': True, 'sideways_strategy': 'breakout', 'sideways_bb_std_mult': 2.3911542134924675, 'sideways_rsi_os': 6, 'sideways_rsi_ob': 57, 'sideways_adx_thresh': 18.98071876954114, 'sideways_atr_min_pct': 0.022497331152196424, 'sideways_atr_max_pct': 0.14213852390619536, 'sideways_tp_mult': 2.4837607606983596, 'sideways_tsl_mult': 0.3638242748902866, 'sideways_time_stop': 58, 'sideways_use_sma': True, 'sideways_use_ema': True, 'sideways_use_atr': True, 'sideways_use_adx': False, 'sideways_use_spike': False, 'sideways_rsi_required': False}.
[I 2025-08-30 15:54:00,949] Trial 586 finished with values: [-0.034202664527289706, 0.03419476475791376] and parameters: {'p_sma': 8, 'p_std': 15, 'p_atr': 9, 'p_adx': 25, 'rsi_period': 9, 'ema1': 30, 'ema2': 55, 'slip_atr_k': 0.0674183992729974, 'slip_spread_k': 0.11947631714710626, 'spread_hl_frac': 0.02701972061372671, 'bb_std_mult': 1.0673348308483939, 'rsi_os': 38, 'rsi_ob': 85, 'vol_spike': 0.08353939895044277, 'adx_thresh': 13.399090936812565, 'atr_min_pct': 0.014576751117230202, 'atr_max_pct': 0.07777871899718629, 'tp_mult': 1.7655779639362807, 'tsl_mult': 0.7523752679802963, 'strategy': 'breakout', 'time_stop': 136, 'use_sma': False, 'use_atr': True, 'use_adx': False, 'use_ema': True, 'use_spike': False, 'rsi_required': False, 'edge_k': 0.1733316106161421, 'edge_cap': 0.6207093274307984, 'bull_strategy': 'mean_reversion', 'bull_bb_std_mult': 2.662664845231481, 'bull_rsi_os': 42, 'bull_rsi_ob': 49, 'bull_adx_thresh': 21.157649198568464, 'bull_atr_min_pct': 0.02805486748821128, 'bull_atr_max_pct': 0.08995636467797309, 'bull_tp_mult': 2.3237419822286207, 'bull_tsl_mult': 0.33309150868850157, 'bull_time_stop': 171, 'bull_use_sma': False, 'bull_use_ema': False, 'bull_use_atr': False, 'bull_use_adx': False, 'bull_use_spike': True, 'bull_rsi_required': False, 'bear_strategy': 'mean_reversion', 'bear_bb_std_mult': 0.7450010027946234, 'bear_rsi_os': 29, 'bear_rsi_ob': 53, 'bear_adx_thresh': 9.840310385804177, 'bear_atr_min_pct': 0.02334392827395796, 'bear_atr_max_pct': 0.059538195161588384, 'bear_tp_mult': 1.604948688958364, 'bear_tsl_mult': 0.27421923836132855, 'bear_time_stop': 52, 'bear_use_sma': False, 'bear_use_ema': True, 'bear_use_atr': False, 'bear_use_adx': False, 'bear_use_spike': True, 'bear_rsi_required': True, 'sideways_strategy': 'mean_reversion', 'sideways_bb_std_mult': 0.7268217727403441, 'sideways_rsi_os': 55, 'sideways_rsi_ob': 58, 'sideways_adx_thresh': 14.50766302583515, 'sideways_atr_min_pct': 0.0018425793724146551, 'sideways_atr_max_pct': 0.05750565995450808, 'sideways_tp_mult': 2.460520968357672, 'sideways_tsl_mult': 0.8036658697957475, 'sideways_time_stop': 282, 'sideways_use_sma': True, 'sideways_use_ema': True, 'sideways_use_atr': True, 'sideways_use_adx': False, 'sideways_use_spike': False, 'sideways_rsi_required': True}.
[I 2025-08-30 15:54:01,293] Trial 587 finished with values: [-1000000000.0, 1000000000.0] and parameters: {'p_sma': 5, 'p_std': 55, 'p_atr': 16, 'p_adx': 25, 'rsi_period': 73, 'ema1': 30, 'ema2': 34, 'slip_atr_k': 0.06809525599848919, 'slip_spread_k': 0.15005819876754087, 'spread_hl_frac': 0.026095840850479272, 'bb_std_mult': 1.3256882763098972, 'rsi_os': 17, 'rsi_ob': 52, 'vol_spike': 0.06425260013006616, 'adx_thresh': 34.56529982687578, 'atr_min_pct': 0.014466231206393575, 'atr_max_pct': 0.07805070443513422, 'tp_mult': 1.7679098255090915, 'tsl_mult': 0.7461935806985869, 'strategy': 'breakout', 'time_stop': 134, 'use_sma': False, 'use_atr': True, 'use_adx': False, 'use_ema': True, 'use_spike': True, 'rsi_required': True, 'edge_k': 0.13053862824381535, 'edge_cap': 0.6095877117859503, 'bull_strategy': 'mean_reversion', 'bull_bb_std_mult': 2.6230109080013255, 'bull_rsi_os': 41, 'bull_rsi_ob': 61, 'bull_adx_thresh': 21.35434172913668, 'bull_atr_min_pct': 0.01979512915204493, 'bull_atr_max_pct': 0.06614726077823599, 'bull_tp_mult': 2.0451057578855907, 'bull_tsl_mult': 0.328904323552355, 'bull_time_stop': 145, 'bull_use_sma': False, 'bull_use_ema': False, 'bull_use_atr': False, 'bull_use_adx': False, 'bull_use_spike': True, 'bull_rsi_required': False, 'bear_strategy': 'mean_reversion', 'bear_bb_std_mult': 1.4233205828830249, 'bear_rsi_os': 29, 'bear_rsi_ob': 63, 'bear_adx_thresh': 20.836898517103638, 'bear_atr_min_pct': 0.00528257763882866, 'bear_atr_max_pct': 0.08260124608446547, 'bear_tp_mult': 1.6025281954455377, 'bear_tsl_mult': 0.9370421211132153, 'bear_time_stop': 48, 'bear_use_sma': False, 'bear_use_ema': True, 'bear_use_atr': True, 'bear_use_adx': False, 'bear_use_spike': False, 'bear_rsi_required': True, 'sideways_strategy': 'breakout', 'sideways_bb_std_mult': 1.1653236467241532, 'sideways_rsi_os': 40, 'sideways_rsi_ob': 59, 'sideways_adx_thresh': 21.978622306935186, 'sideways_atr_min_pct': 0.0018285741551052033, 'sideways_atr_max_pct': 0.09518060713008421, 'sideways_tp_mult': 2.035211434151526, 'sideways_tsl_mult': 0.53876756219059, 'sideways_time_stop': 59, 'sideways_use_sma': True, 'sideways_use_ema': True, 'sideways_use_atr': True, 'sideways_use_adx': False, 'sideways_use_spike': False, 'sideways_rsi_required': False}.
[I 2025-08-30 15:54:01,570] Trial 589 finished with values: [-1000000000.0, 1000000000.0] and parameters: {'p_sma': 5, 'p_std': 55, 'p_atr': 28, 'p_adx': 25, 'rsi_period': 82, 'ema1': 14, 'ema2': 34, 'slip_atr_k': 0.06146007340206487, 'slip_spread_k': 0.0702080789862416, 'spread_hl_frac': 0.040876325271110056, 'bb_std_mult': 2.50002827364873, 'rsi_os': 24, 'rsi_ob': 72, 'vol_spike': 0.08288021246320983, 'adx_thresh': 34.45763161148638, 'atr_min_pct': 0.014714825009621891, 'atr_max_pct': 0.032609823955503645, 'tp_mult': 2.3219538449682844, 'tsl_mult': 0.3865144171396644, 'strategy': 'mean_reversion', 'time_stop': 105, 'use_sma': True, 'use_atr': True, 'use_adx': True, 'use_ema': True, 'use_spike': False, 'rsi_required': False, 'edge_k': 0.13131417998085484, 'edge_cap': 0.5976135890919049, 'bull_strategy': 'mean_reversion', 'bull_bb_std_mult': 2.608964460948116, 'bull_rsi_os': 39, 'bull_rsi_ob': 52, 'bull_adx_thresh': 6.706789494741129, 'bull_atr_min_pct': 0.02806218567031651, 'bull_atr_max_pct': 0.044440032132349254, 'bull_tp_mult': 2.1452782894919986, 'bull_tsl_mult': 0.2955517266485405, 'bull_time_stop': 159, 'bull_use_sma': False, 'bull_use_ema': False, 'bull_use_atr': False, 'bull_use_adx': False, 'bull_use_spike': True, 'bull_rsi_required': False, 'bear_strategy': 'breakout', 'bear_bb_std_mult': 2.7505478256350626, 'bear_rsi_os': 49, 'bear_rsi_ob': 78, 'bear_adx_thresh': 28.979022139862295, 'bear_atr_min_pct': 0.02307940844611948, 'bear_atr_max_pct': 0.07245719582636842, 'bear_tp_mult': 1.6188066607553697, 'bear_tsl_mult': 0.42606226079794346, 'bear_time_stop': 48, 'bear_use_sma': False, 'bear_use_ema': True, 'bear_use_atr': True, 'bear_use_adx': False, 'bear_use_spike': True, 'bear_rsi_required': True, 'sideways_strategy': 'breakout', 'sideways_bb_std_mult': 1.2182050666915387, 'sideways_rsi_os': 8, 'sideways_rsi_ob': 54, 'sideways_adx_thresh': 28.12006756268954, 'sideways_atr_min_pct': 0.0016110587394826683, 'sideways_atr_max_pct': 0.09556977260737479, 'sideways_tp_mult': 2.4829409628042045, 'sideways_tsl_mult': 0.8202604304193859, 'sideways_time_stop': 81, 'sideways_use_sma': True, 'sideways_use_ema': True, 'sideways_use_atr': True, 'sideways_use_adx': False, 'sideways_use_spike': False, 'sideways_rsi_required': True}.
[I 2025-08-30 15:54:44,677] Trial 593 finished with values: [-0.08870069887229204, 0.08863531693270489] and parameters: {'p_sma': 22, 'p_std': 59, 'p_atr': 15, 'p_adx': 24, 'rsi_period': 70, 'ema1': 29, 'ema2': 25, 'slip_atr_k': 0.059057127401401364, 'slip_spread_k': 0.16642268053988651, 'spread_hl_frac': 0.014425064752029863, 'bb_std_mult': 1.392915953365447, 'rsi_os': 26, 'rsi_ob': 74, 'vol_spike': 0.18022400138820346, 'adx_thresh': 13.610477016257384, 'atr_min_pct': 0.012752094079670689, 'atr_max_pct': 0.07941518695250868, 'tp_mult': 1.3257331806442558, 'tsl_mult': 0.7299532886936482, 'strategy': 'breakout', 'time_stop': 300, 'use_sma': False, 'use_atr': True, 'use_adx': False, 'use_ema': True, 'use_spike': True, 'rsi_required': True, 'edge_k': 1.8406685970480605, 'edge_cap': 0.5808791529606459, 'bull_strategy': 'mean_reversion', 'bull_bb_std_mult': 2.7496164338566103, 'bull_rsi_os': 37, 'bull_rsi_ob': 47, 'bull_adx_thresh': 22.980944538863856, 'bull_atr_min_pct': 0.022154449618976405, 'bull_atr_max_pct': 0.06916008373435557, 'bull_tp_mult': 2.192792268330145, 'bull_tsl_mult': 0.2369752031046894, 'bull_time_stop': 156, 'bull_use_sma': False, 'bull_use_ema': False, 'bull_use_atr': False, 'bull_use_adx': True, 'bull_use_spike': True, 'bull_rsi_required': False, 'bear_strategy': 'mean_reversion', 'bear_bb_std_mult': 0.6531865289135123, 'bear_rsi_os': 28, 'bear_rsi_ob': 76, 'bear_adx_thresh': 27.967055636154566, 'bear_atr_min_pct': 0.022141814825976693, 'bear_atr_max_pct': 0.04370046852370054, 'bear_tp_mult': 1.7449076944373312, 'bear_tsl_mult': 0.9739600727290597, 'bear_time_stop': 61, 'bear_use_sma': True, 'bear_use_ema': True, 'bear_use_atr': True, 'bear_use_adx': False, 'bear_use_spike': False, 'bear_rsi_required': True, 'sideways_strategy': 'breakout', 'sideways_bb_std_mult': 1.5308563938241335, 'sideways_rsi_os': 48, 'sideways_rsi_ob': 69, 'sideways_adx_thresh': 29.67574891056875, 'sideways_atr_min_pct': 0.00044828605655550463, 'sideways_atr_max_pct': 0.12081128601888691, 'sideways_tp_mult': 2.36816303416079, 'sideways_tsl_mult': 0.39509230134018325, 'sideways_time_stop': 168, 'sideways_use_sma': True, 'sideways_use_ema': False, 'sideways_use_atr': True, 'sideways_use_adx': False, 'sideways_use_spike': True, 'sideways_rsi_required': False}.
[I 2025-08-30 15:54:45,149] Trial 592 finished with values: [-1000000000.0, 1000000000.0] and parameters: {'p_sma': 7, 'p_std': 59, 'p_atr': 15, 'p_adx': 24, 'rsi_period': 83, 'ema1': 18, 'ema2': 35, 'slip_atr_k': 0.05979356182440098, 'slip_spread_k': 0.10988900826978287, 'spread_hl_frac': 0.02277422807060367, 'bb_std_mult': 0.7139179705118996, 'rsi_os': 10, 'rsi_ob': 72, 'vol_spike': 0.18144207854116473, 'adx_thresh': 11.933963717075162, 'atr_min_pct': 0.013695928284621245, 'atr_max_pct': 0.08086688935099956, 'tp_mult': 1.6728465048224126, 'tsl_mult': 0.7840794055724083, 'strategy': 'mean_reversion', 'time_stop': 103, 'use_sma': True, 'use_atr': True, 'use_adx': True, 'use_ema': True, 'use_spike': False, 'rsi_required': False, 'edge_k': 0.045218583998094114, 'edge_cap': 0.5945450837029456, 'bull_strategy': 'mean_reversion', 'bull_bb_std_mult': 1.1299083093710311, 'bull_rsi_os': 39, 'bull_rsi_ob': 51, 'bull_adx_thresh': 15.133417338029044, 'bull_atr_min_pct': 0.021268437453562366, 'bull_atr_max_pct': 0.043274240349854914, 'bull_tp_mult': 2.144597099181508, 'bull_tsl_mult': 0.2291395417697999, 'bull_time_stop': 159, 'bull_use_sma': False, 'bull_use_ema': False, 'bull_use_atr': False, 'bull_use_adx': True, 'bull_use_spike': True, 'bull_rsi_required': False, 'bear_strategy': 'breakout', 'bear_bb_std_mult': 1.5213875650428736, 'bear_rsi_os': 28, 'bear_rsi_ob': 83, 'bear_adx_thresh': 28.041253117849585, 'bear_atr_min_pct': 0.001710606208836776, 'bear_atr_max_pct': 0.07296391052991166, 'bear_tp_mult': 1.4402226925656727, 'bear_tsl_mult': 0.9733430231372672, 'bear_time_stop': 76, 'bear_use_sma': True, 'bear_use_ema': True, 'bear_use_atr': True, 'bear_use_adx': False, 'bear_use_spike': True, 'bear_rsi_required': True, 'sideways_strategy': 'breakout', 'sideways_bb_std_mult': 1.5643230770786936, 'sideways_rsi_os': 8, 'sideways_rsi_ob': 81, 'sideways_adx_thresh': 29.871195720935116, 'sideways_atr_min_pct': 0.0072741848769173984, 'sideways_atr_max_pct': 0.03481107428411692, 'sideways_tp_mult': 2.389369823641544, 'sideways_tsl_mult': 0.03279417268663998, 'sideways_time_stop': 83, 'sideways_use_sma': True, 'sideways_use_ema': False, 'sideways_use_atr': True, 'sideways_use_adx': False, 'sideways_use_spike': True, 'sideways_rsi_required': True}.
[I 2025-08-30 15:54:45,841] Trial 590 finished with values: [-1000000000.0, 1000000000.0] and parameters: {'p_sma': 7, 'p_std': 33, 'p_atr': 7, 'p_adx': 20, 'rsi_period': 70, 'ema1': 14, 'ema2': 34, 'slip_atr_k': 0.0718522945942405, 'slip_spread_k': 0.10850692409238191, 'spread_hl_frac': 0.04737436146159214, 'bb_std_mult': 0.6767778661256625, 'rsi_os': 10, 'rsi_ob': 81, 'vol_spike': 0.020925830027020392, 'adx_thresh': 13.521379609604649, 'atr_min_pct': 0.002520572447208172, 'atr_max_pct': 0.07874948589347262, 'tp_mult': 1.6916226373327174, 'tsl_mult': 0.770769267395149, 'strategy': 'breakout', 'time_stop': 172, 'use_sma': False, 'use_atr': True, 'use_adx': False, 'use_ema': True, 'use_spike': False, 'rsi_required': False, 'edge_k': 0.15752736233677572, 'edge_cap': 0.6155839082748741, 'bull_strategy': 'mean_reversion', 'bull_bb_std_mult': 1.8857441896812788, 'bull_rsi_os': 42, 'bull_rsi_ob': 51, 'bull_adx_thresh': 21.21834097393704, 'bull_atr_min_pct': 0.01192897208928828, 'bull_atr_max_pct': 0.09084589374631931, 'bull_tp_mult': 1.0826181857105497, 'bull_tsl_mult': 0.2271584631032666, 'bull_time_stop': 159, 'bull_use_sma': False, 'bull_use_ema': False, 'bull_use_atr': False, 'bull_use_adx': False, 'bull_use_spike': True, 'bull_rsi_required': False, 'bear_strategy': 'mean_reversion', 'bear_bb_std_mult': 1.5329037694413636, 'bear_rsi_os': 28, 'bear_rsi_ob': 81, 'bear_adx_thresh': 20.982465053132394, 'bear_atr_min_pct': 0.017697191865265933, 'bear_atr_max_pct': 0.0726640663915432, 'bear_tp_mult': 1.4429640530242105, 'bear_tsl_mult': 0.9745218966705301, 'bear_time_stop': 102, 'bear_use_sma': False, 'bear_use_ema': True, 'bear_use_atr': True, 'bear_use_adx': False, 'bear_use_spike': True, 'bear_rsi_required': True, 'sideways_strategy': 'breakout', 'sideways_bb_std_mult': 1.850140245311919, 'sideways_rsi_os': 40, 'sideways_rsi_ob': 59, 'sideways_adx_thresh': 26.70407699122937, 'sideways_atr_min_pct': 0.0070802790811957395, 'sideways_atr_max_pct': 0.05741957952590683, 'sideways_tp_mult': 2.3892144255995382, 'sideways_tsl_mult': 0.9242735095034886, 'sideways_time_stop': 82, 'sideways_use_sma': True, 'sideways_use_ema': True, 'sideways_use_atr': True, 'sideways_use_adx': False, 'sideways_use_spike': False, 'sideways_rsi_required': True}.
[I 2025-08-30 15:54:46,257] Trial 591 finished with values: [-1000000000.0, 1000000000.0] and parameters: {'p_sma': 6, 'p_std': 37, 'p_atr': 30, 'p_adx': 20, 'rsi_period': 72, 'ema1': 14, 'ema2': 34, 'slip_atr_k': 0.06012143574179327, 'slip_spread_k': 0.5212616208845672, 'spread_hl_frac': 0.03136910764048331, 'bb_std_mult': 1.3215733644130532, 'rsi_os': 10, 'rsi_ob': 72, 'vol_spike': 0.18004777789840581, 'adx_thresh': 11.96501807964309, 'atr_min_pct': 0.012328208495827855, 'atr_max_pct': 0.032929554481852884, 'tp_mult': 1.6863402651361257, 'tsl_mult': 0.7728109187521456, 'strategy': 'mean_reversion', 'time_stop': 142, 'use_sma': True, 'use_atr': True, 'use_adx': False, 'use_ema': True, 'use_spike': True, 'rsi_required': True, 'edge_k': 0.0806961279094109, 'edge_cap': 0.5898954474549873, 'bull_strategy': 'mean_reversion', 'bull_bb_std_mult': 1.8571200791852136, 'bull_rsi_os': 37, 'bull_rsi_ob': 62, 'bull_adx_thresh': 25.921195988908934, 'bull_atr_min_pct': 0.019714342945148604, 'bull_atr_max_pct': 0.06814245825344194, 'bull_tp_mult': 1.094629372108777, 'bull_tsl_mult': 0.22720905345303527, 'bull_time_stop': 157, 'bull_use_sma': False, 'bull_use_ema': False, 'bull_use_atr': False, 'bull_use_adx': True, 'bull_use_spike': True, 'bull_rsi_required': False, 'bear_strategy': 'mean_reversion', 'bear_bb_std_mult': 1.4393788613963814, 'bear_rsi_os': 28, 'bear_rsi_ob': 93, 'bear_adx_thresh': 27.980238186207366, 'bear_atr_min_pct': 0.017410899999235556, 'bear_atr_max_pct': 0.07240058358071792, 'bear_tp_mult': 1.483285931545497, 'bear_tsl_mult': 0.973660803860176, 'bear_time_stop': 77, 'bear_use_sma': True, 'bear_use_ema': True, 'bear_use_atr': True, 'bear_use_adx': False, 'bear_use_spike': False, 'bear_rsi_required': True, 'sideways_strategy': 'breakout', 'sideways_bb_std_mult': 1.403694539187042, 'sideways_rsi_os': 48, 'sideways_rsi_ob': 59, 'sideways_adx_thresh': 28.342630846317718, 'sideways_atr_min_pct': 0.007000488430064044, 'sideways_atr_max_pct': 0.09535485465829667, 'sideways_tp_mult': 2.3683156606549254, 'sideways_tsl_mult': 0.38937855050462344, 'sideways_time_stop': 80, 'sideways_use_sma': True, 'sideways_use_ema': False, 'sideways_use_atr': True, 'sideways_use_adx': False, 'sideways_use_spike': True, 'sideways_rsi_required': False}.
