[I 2025-08-30 16:20:58,051] Trial 732 finished with values: [-1000000000.0, 1000000000.0] and parameters: {'p_sma': 39, 'p_std': 45, 'p_atr': 26, 'p_adx': 10, 'rsi_period': 66, 'ema1': 23, 'ema2': 54, 'slip_atr_k': 0.07654806880388552, 'slip_spread_k': 0.16283753293043127, 'spread_hl_frac': 0.032090275149869604, 'bb_std_mult': 2.2837461551374543, 'rsi_os': 39, 'rsi_ob': 45, 'vol_spike': 0.14526288942435864, 'adx_thresh': 23.855024627563253, 'atr_min_pct': 0.015390232767451056, 'atr_max_pct': 0.07324208616035109, 'tp_mult': 1.1303418542506831, 'tsl_mult': 0.40502137830929813, 'strategy': 'mean_reversion', 'time_stop': 250, 'use_sma': True, 'use_atr': True, 'use_adx': False, 'use_ema': True, 'use_spike': False, 'rsi_required': False, 'edge_k': 0.3907271712470335, 'edge_cap': 0.8853082844063751, 'bull_strategy': 'breakout', 'bull_bb_std_mult': 0.8061056937505112, 'bull_rsi_os': 39, 'bull_rsi_ob': 64, 'bull_adx_thresh': 24.469116766682934, 'bull_atr_min_pct': 0.020863703017571834, 'bull_atr_max_pct': 0.09178314879983818, 'bull_tp_mult': 2.63419886779327, 'bull_tsl_mult': 0.12519686149675482, 'bull_time_stop': 28, 'bull_use_sma': True, 'bull_use_ema': True, 'bull_use_atr': True, 'bull_use_adx': True, 'bull_use_spike': True, 'bull_rsi_required': True, 'bear_strategy': 'mean_reversion', 'bear_bb_std_mult': 2.3600846405019063, 'bear_rsi_os': 32, 'bear_rsi_ob': 91, 'bear_adx_thresh': 21.514386758672316, 'bear_atr_min_pct': 0.020040859799557047, 'bear_atr_max_pct': 0.08794890834617455, 'bear_tp_mult': 2.8486335660636737, 'bear_tsl_mult': 0.24364130715913507, 'bear_time_stop': 268, 'bear_use_sma': False, 'bear_use_ema': False, 'bear_use_atr': True, 'bear_use_adx': True, 'bear_use_spike': True, 'bear_rsi_required': True, 'sideways_strategy': 'breakout', 'sideways_bb_std_mult': 1.1990542747092852, 'sideways_rsi_os': 39, 'sideways_rsi_ob': 64, 'sideways_adx_thresh': 25.48213846241847, 'sideways_atr_min_pct': 0.0013316968054062923, 'sideways_atr_max_pct': 0.1061473432188888, 'sideways_tp_mult': 2.9223233684228345, 'sideways_tsl_mult': 0.16188521482664164, 'sideways_time_stop': 67, 'sideways_use_sma': True, 'sideways_use_ema': True, 'sideways_use_atr': False, 'sideways_use_adx': True, 'sideways_use_spike': False, 'sideways_rsi_required': True}.
[I 2025-08-30 16:21:45,892] Trial 731 finished with values: [-1000000000.0, 1000000000.0] and parameters: {'p_sma': 8, 'p_std': 56, 'p_atr': 26, 'p_adx': 10, 'rsi_period': 76, 'ema1': 23, 'ema2': 54, 'slip_atr_k': 0.07370225831033754, 'slip_spread_k': 0.1620920194119306, 'spread_hl_frac': 0.04216617859266458, 'bb_std_mult': 2.3027682445069595, 'rsi_os': 39, 'rsi_ob': 71, 'vol_spike': 0.14572132433878615, 'adx_thresh': 14.614875501608667, 'atr_min_pct': 0.01533405521633563, 'atr_max_pct': 0.1499969945810216, 'tp_mult': 1.6356658118400564, 'tsl_mult': 0.18108654775853142, 'strategy': 'mean_reversion', 'time_stop': 206, 'use_sma': True, 'use_atr': True, 'use_adx': False, 'use_ema': True, 'use_spike': False, 'rsi_required': False, 'edge_k': 0.3250786811697901, 'edge_cap': 0.8795948828798676, 'bull_strategy': 'breakout', 'bull_bb_std_mult': 0.8100107185789158, 'bull_rsi_os': 47, 'bull_rsi_ob': 64, 'bull_adx_thresh': 5.501611683222668, 'bull_atr_min_pct': 0.020863890190416602, 'bull_atr_max_pct': 0.09111061044374313, 'bull_tp_mult': 1.9704477000072926, 'bull_tsl_mult': 0.12341963128767369, 'bull_time_stop': 26, 'bull_use_sma': True, 'bull_use_ema': True, 'bull_use_atr': True, 'bull_use_adx': True, 'bull_use_spike': True, 'bull_rsi_required': True, 'bear_strategy': 'mean_reversion', 'bear_bb_std_mult': 2.689298060761936, 'bear_rsi_os': 32, 'bear_rsi_ob': 90, 'bear_adx_thresh': 29.81311974047412, 'bear_atr_min_pct': 0.020096650908239307, 'bear_atr_max_pct': 0.07753985675624475, 'bear_tp_mult': 2.863499576903648, 'bear_tsl_mult': 0.470742549403328, 'bear_time_stop': 288, 'bear_use_sma': False, 'bear_use_ema': False, 'bear_use_atr': True, 'bear_use_adx': True, 'bear_use_spike': True, 'bear_rsi_required': True, 'sideways_strategy': 'breakout', 'sideways_bb_std_mult': 1.0408375012970514, 'sideways_rsi_os': 39, 'sideways_rsi_ob': 64, 'sideways_adx_thresh': 25.562417400100056, 'sideways_atr_min_pct': 0.024730926261078156, 'sideways_atr_max_pct': 0.10492234114143652, 'sideways_tp_mult': 2.9258776730062332, 'sideways_tsl_mult': 0.9511897683634485, 'sideways_time_stop': 146, 'sideways_use_sma': True, 'sideways_use_ema': True, 'sideways_use_atr': False, 'sideways_use_adx': True, 'sideways_use_spike': False, 'sideways_rsi_required': True}.
[I 2025-08-30 16:21:47,170] Trial 730 finished with values: [-1000000000.0, 1000000000.0] and parameters: {'p_sma': 44, 'p_std': 57, 'p_atr': 26, 'p_adx': 10, 'rsi_period': 78, 'ema1': 23, 'ema2': 33, 'slip_atr_k': 0.07483144266888445, 'slip_spread_k': 0.1157143165564383, 'spread_hl_frac': 0.02318147710604854, 'bb_std_mult': 2.2867917922669294, 'rsi_os': 40, 'rsi_ob': 53, 'vol_spike': 0.15166716027890845, 'adx_thresh': 15.170234186656069, 'atr_min_pct': 0.015335570383308196, 'atr_max_pct': 0.08846687775846021, 'tp_mult': 1.888267094138532, 'tsl_mult': 0.559765916753709, 'strategy': 'mean_reversion', 'time_stop': 201, 'use_sma': True, 'use_atr': True, 'use_adx': False, 'use_ema': True, 'use_spike': True, 'rsi_required': False, 'edge_k': 0.4396211576778099, 'edge_cap': 0.23504371756138925, 'bull_strategy': 'breakout', 'bull_bb_std_mult': 0.6212144404168576, 'bull_rsi_os': 39, 'bull_rsi_ob': 64, 'bull_adx_thresh': 22.825182885228646, 'bull_atr_min_pct': 0.021014556903639174, 'bull_atr_max_pct': 0.09053498760319104, 'bull_tp_mult': 2.6459787220818662, 'bull_tsl_mult': 0.020993032356521196, 'bull_time_stop': 26, 'bull_use_sma': True, 'bull_use_ema': True, 'bull_use_atr': True, 'bull_use_adx': True, 'bull_use_spike': True, 'bull_rsi_required': True, 'bear_strategy': 'mean_reversion', 'bear_bb_std_mult': 2.394189189934356, 'bear_rsi_os': 32, 'bear_rsi_ob': 90, 'bear_adx_thresh': 29.205895763000004, 'bear_atr_min_pct': 0.020581348214179594, 'bear_atr_max_pct': 0.07826659918175562, 'bear_tp_mult': 2.7525113067253724, 'bear_tsl_mult': 0.16005117134762015, 'bear_time_stop': 300, 'bear_use_sma': False, 'bear_use_ema': False, 'bear_use_atr': True, 'bear_use_adx': True, 'bear_use_spike': True, 'bear_rsi_required': True, 'sideways_strategy': 'breakout', 'sideways_bb_std_mult': 1.0257834785095152, 'sideways_rsi_os': 18, 'sideways_rsi_ob': 63, 'sideways_adx_thresh': 25.64590028131102, 'sideways_atr_min_pct': 0.011490236335955766, 'sideways_atr_max_pct': 0.1080075169334433, 'sideways_tp_mult': 2.911032888807232, 'sideways_tsl_mult': 0.9555313005418374, 'sideways_time_stop': 47, 'sideways_use_sma': True, 'sideways_use_ema': True, 'sideways_use_atr': False, 'sideways_use_adx': True, 'sideways_use_spike': False, 'sideways_rsi_required': True}.
[I 2025-08-30 16:21:48,477] Trial 729 finished with values: [-1000000000.0, 1000000000.0] and parameters: {'p_sma': 23, 'p_std': 56, 'p_atr': 27, 'p_adx': 10, 'rsi_period': 78, 'ema1': 22, 'ema2': 25, 'slip_atr_k': 0.0738797818495302, 'slip_spread_k': 0.12299078284507836, 'spread_hl_frac': 0.0387691895002672, 'bb_std_mult': 2.2662091526427717, 'rsi_os': 40, 'rsi_ob': 73, 'vol_spike': 0.1487515461578723, 'adx_thresh': 23.612430114697013, 'atr_min_pct': 0.028312127825734244, 'atr_max_pct': 0.04001273578963354, 'tp_mult': 1.8692560774315419, 'tsl_mult': 0.5446987616339325, 'strategy': 'mean_reversion', 'time_stop': 203, 'use_sma': True, 'use_atr': True, 'use_adx': False, 'use_ema': True, 'use_spike': True, 'rsi_required': False, 'edge_k': 0.4532952447759216, 'edge_cap': 0.3701057526684409, 'bull_strategy': 'breakout', 'bull_bb_std_mult': 0.8160907904927953, 'bull_rsi_os': 39, 'bull_rsi_ob': 65, 'bull_adx_thresh': 31.22002961363456, 'bull_atr_min_pct': 0.024113639152006504, 'bull_atr_max_pct': 0.10520582285794723, 'bull_tp_mult': 2.0968854305901234, 'bull_tsl_mult': 0.034533273922359775, 'bull_time_stop': 12, 'bull_use_sma': True, 'bull_use_ema': True, 'bull_use_atr': True, 'bull_use_adx': True, 'bull_use_spike': False, 'bull_rsi_required': True, 'bear_strategy': 'mean_reversion', 'bear_bb_std_mult': 2.4251429353735516, 'bear_rsi_os': 37, 'bear_rsi_ob': 82, 'bear_adx_thresh': 23.594575840972084, 'bear_atr_min_pct': 0.020776261169422345, 'bear_atr_max_pct': 0.08723849702746342, 'bear_tp_mult': 2.73147802874354, 'bear_tsl_mult': 0.4853563208853902, 'bear_time_stop': 297, 'bear_use_sma': False, 'bear_use_ema': False, 'bear_use_atr': True, 'bear_use_adx': True, 'bear_use_spike': True, 'bear_rsi_required': True, 'sideways_strategy': 'breakout', 'sideways_bb_std_mult': 1.2769327384437672, 'sideways_rsi_os': 49, 'sideways_rsi_ob': 63, 'sideways_adx_thresh': 25.728899708492182, 'sideways_atr_min_pct': 0.017176357433811407, 'sideways_atr_max_pct': 0.10566935960433486, 'sideways_tp_mult': 2.9961112457536183, 'sideways_tsl_mult': 0.048536881699162926, 'sideways_time_stop': 193, 'sideways_use_sma': False, 'sideways_use_ema': True, 'sideways_use_atr': False, 'sideways_use_adx': True, 'sideways_use_spike': True, 'sideways_rsi_required': True}.
[I 2025-08-30 16:21:50,626] Trial 733 finished with values: [-1000000000.0, 1000000000.0] and parameters: {'p_sma': 37, 'p_std': 56, 'p_atr': 26, 'p_adx': 12, 'rsi_period': 15, 'ema1': 23, 'ema2': 32, 'slip_atr_k': 0.11164348052819792, 'slip_spread_k': 0.1895097114432273, 'spread_hl_frac': 0.013596926475470172, 'bb_std_mult': 2.298369290127336, 'rsi_os': 40, 'rsi_ob': 64, 'vol_spike': 0.19974409026866252, 'adx_thresh': 25.427331836879574, 'atr_min_pct': 0.015255380342661466, 'atr_max_pct': 0.1247176096539063, 'tp_mult': 1.8175698700058003, 'tsl_mult': 0.49339562054222935, 'strategy': 'mean_reversion', 'time_stop': 241, 'use_sma': True, 'use_atr': True, 'use_adx': True, 'use_ema': True, 'use_spike': True, 'rsi_required': False, 'edge_k': 0.443794742163677, 'edge_cap': 0.9576790807587863, 'bull_strategy': 'breakout', 'bull_bb_std_mult': 0.64466943414186, 'bull_rsi_os': 39, 'bull_rsi_ob': 56, 'bull_adx_thresh': 27.51835503164112, 'bull_atr_min_pct': 0.02433863937481718, 'bull_atr_max_pct': 0.09702777321395188, 'bull_tp_mult': 2.097248394408775, 'bull_tsl_mult': 0.07293699689657833, 'bull_time_stop': 35, 'bull_use_sma': True, 'bull_use_ema': True, 'bull_use_atr': True, 'bull_use_adx': True, 'bull_use_spike': True, 'bull_rsi_required': True, 'bear_strategy': 'mean_reversion', 'bear_bb_std_mult': 2.6824765969173097, 'bear_rsi_os': 32, 'bear_rsi_ob': 90, 'bear_adx_thresh': 29.838525969532682, 'bear_atr_min_pct': 0.02077555041538375, 'bear_atr_max_pct': 0.07403943248809268, 'bear_tp_mult': 2.7967302537576852, 'bear_tsl_mult': 0.47353504727512585, 'bear_time_stop': 300, 'bear_use_sma': False, 'bear_use_ema': False, 'bear_use_atr': False, 'bear_use_adx': True, 'bear_use_spike': True, 'bear_rsi_required': True, 'sideways_strategy': 'breakout', 'sideways_bb_std_mult': 1.0397202251400977, 'sideways_rsi_os': 38, 'sideways_rsi_ob': 84, 'sideways_adx_thresh': 22.845687533841403, 'sideways_atr_min_pct': 0.00759964712058444, 'sideways_atr_max_pct': 0.11307531472403387, 'sideways_tp_mult': 2.997866110933784, 'sideways_tsl_mult': 0.8862183864802727, 'sideways_time_stop': 78, 'sideways_use_sma': True, 'sideways_use_ema': True, 'sideways_use_atr': False, 'sideways_use_adx': True, 'sideways_use_spike': True, 'sideways_rsi_required': True}.
[I 2025-08-30 16:22:37,219] Trial 736 finished with values: [-1000000000.0, 1000000000.0] and parameters: {'p_sma': 7, 'p_std': 20, 'p_atr': 26, 'p_adx': 12, 'rsi_period': 24, 'ema1': 23, 'ema2': 44, 'slip_atr_k': 0.13762623174717786, 'slip_spread_k': 0.14193929150325799, 'spread_hl_frac': 0.02546512121715801, 'bb_std_mult': 2.347751874302431, 'rsi_os': 38, 'rsi_ob': 72, 'vol_spike': 0.16348095306066196, 'adx_thresh': 9.365528188785586, 'atr_min_pct': 0.006560775784483689, 'atr_max_pct': 0.07473701170913465, 'tp_mult': 1.20335114669436, 'tsl_mult': 0.38912936632642064, 'strategy': 'mean_reversion', 'time_stop': 215, 'use_sma': True, 'use_atr': False, 'use_adx': True, 'use_ema': True, 'use_spike': True, 'rsi_required': False, 'edge_k': 0.41698765105352414, 'edge_cap': 0.6058036044380651, 'bull_strategy': 'breakout', 'bull_bb_std_mult': 0.6794817534190958, 'bull_rsi_os': 41, 'bull_rsi_ob': 56, 'bull_adx_thresh': 30.260366014464203, 'bull_atr_min_pct': 0.009404599226422332, 'bull_atr_max_pct': 0.09654957725260141, 'bull_tp_mult': 2.0352892211630165, 'bull_tsl_mult': 0.06662140799421176, 'bull_time_stop': 34, 'bull_use_sma': True, 'bull_use_ema': True, 'bull_use_atr': True, 'bull_use_adx': True, 'bull_use_spike': True, 'bull_rsi_required': True, 'bear_strategy': 'mean_reversion', 'bear_bb_std_mult': 2.6302749172369166, 'bear_rsi_os': 33, 'bear_rsi_ob': 92, 'bear_adx_thresh': 9.257135397782047, 'bear_atr_min_pct': 0.009738827125328671, 'bear_atr_max_pct': 0.07430368260417511, 'bear_tp_mult': 2.7934918478556403, 'bear_tsl_mult': 0.2952357300327013, 'bear_time_stop': 251, 'bear_use_sma': False, 'bear_use_ema': False, 'bear_use_atr': False, 'bear_use_adx': True, 'bear_use_spike': True, 'bear_rsi_required': False, 'sideways_strategy': 'mean_reversion', 'sideways_bb_std_mult': 1.5469149730520275, 'sideways_rsi_os': 16, 'sideways_rsi_ob': 45, 'sideways_adx_thresh': 24.25435139650908, 'sideways_atr_min_pct': 0.0299641635275048, 'sideways_atr_max_pct': 0.10090248383121758, 'sideways_tp_mult': 2.96924975450574, 'sideways_tsl_mult': 0.8945639065504567, 'sideways_time_stop': 59, 'sideways_use_sma': True, 'sideways_use_ema': True, 'sideways_use_atr': False, 'sideways_use_adx': True, 'sideways_use_spike': True, 'sideways_rsi_required': True}.
[I 2025-08-30 16:22:37,866] Trial 735 finished with values: [-1000000000.0, 1000000000.0] and parameters: {'p_sma': 37, 'p_std': 52, 'p_atr': 26, 'p_adx': 12, 'rsi_period': 38, 'ema1': 23, 'ema2': 31, 'slip_atr_k': 0.06643350905636022, 'slip_spread_k': 0.19273595350871536, 'spread_hl_frac': 0.025433581179997673, 'bb_std_mult': 2.1902708496220002, 'rsi_os': 38, 'rsi_ob': 73, 'vol_spike': 0.19759644223591027, 'adx_thresh': 25.22133197751789, 'atr_min_pct': 0.0004883920921131702, 'atr_max_pct': 0.07481248167851007, 'tp_mult': 1.753839371462992, 'tsl_mult': 0.5020722666829665, 'strategy': 'mean_reversion', 'time_stop': 214, 'use_sma': True, 'use_atr': False, 'use_adx': True, 'use_ema': True, 'use_spike': True, 'rsi_required': False, 'edge_k': 0.4628242768088787, 'edge_cap': 0.5895655447701323, 'bull_strategy': 'breakout', 'bull_bb_std_mult': 0.6865985651598527, 'bull_rsi_os': 44, 'bull_rsi_ob': 56, 'bull_adx_thresh': 24.411320571508206, 'bull_atr_min_pct': 0.01865570269566113, 'bull_atr_max_pct': 0.09962433384006941, 'bull_tp_mult': 2.098326367160688, 'bull_tsl_mult': 0.15185880235236357, 'bull_time_stop': 35, 'bull_use_sma': True, 'bull_use_ema': True, 'bull_use_atr': True, 'bull_use_adx': True, 'bull_use_spike': True, 'bull_rsi_required': True, 'bear_strategy': 'mean_reversion', 'bear_bb_std_mult': 2.6253367158105263, 'bear_rsi_os': 33, 'bear_rsi_ob': 92, 'bear_adx_thresh': 23.434119692579436, 'bear_atr_min_pct': 0.020895174456333213, 'bear_atr_max_pct': 0.0415163084815191, 'bear_tp_mult': 2.772787465537989, 'bear_tsl_mult': 0.659799025156062, 'bear_time_stop': 258, 'bear_use_sma': False, 'bear_use_ema': False, 'bear_use_atr': False, 'bear_use_adx': True, 'bear_use_spike': True, 'bear_rsi_required': True, 'sideways_strategy': 'mean_reversion', 'sideways_bb_std_mult': 1.2465213963503716, 'sideways_rsi_os': 40, 'sideways_rsi_ob': 63, 'sideways_adx_thresh': 22.696247912176748, 'sideways_atr_min_pct': 0.0010882184004651855, 'sideways_atr_max_pct': 0.11253109061474509, 'sideways_tp_mult': 2.998367632737474, 'sideways_tsl_mult': 0.9309040779376991, 'sideways_time_stop': 292, 'sideways_use_sma': True, 'sideways_use_ema': True, 'sideways_use_atr': False, 'sideways_use_adx': True, 'sideways_use_spike': True, 'sideways_rsi_required': True}.
[I 2025-08-30 16:22:38,316] Trial 737 finished with values: [-1000000000.0, 1000000000.0] and parameters: {'p_sma': 7, 'p_std': 52, 'p_atr': 26, 'p_adx': 11, 'rsi_period': 60, 'ema1': 23, 'ema2': 31, 'slip_atr_k': 0.07982617005154947, 'slip_spread_k': 0.3328816717216529, 'spread_hl_frac': 0.00809995303156889, 'bb_std_mult': 2.1833227239080957, 'rsi_os': 38, 'rsi_ob': 83, 'vol_spike': 0.05570185173921352, 'adx_thresh': 13.918289981991203, 'atr_min_pct': 0.016263500967517573, 'atr_max_pct': 0.07479037127004569, 'tp_mult': 1.7151083607930384, 'tsl_mult': 0.3829777104844624, 'strategy': 'mean_reversion', 'time_stop': 216, 'use_sma': True, 'use_atr': False, 'use_adx': True, 'use_ema': True, 'use_spike': True, 'rsi_required': False, 'edge_k': 0.40533205951869095, 'edge_cap': 0.5782230835794597, 'bull_strategy': 'breakout', 'bull_bb_std_mult': 0.7428303942701142, 'bull_rsi_os': 45, 'bull_rsi_ob': 56, 'bull_adx_thresh': 24.355779508037834, 'bull_atr_min_pct': 0.019975370626313556, 'bull_atr_max_pct': 0.09912962727574877, 'bull_tp_mult': 2.0338901001959147, 'bull_tsl_mult': 0.06670455476124454, 'bull_time_stop': 35, 'bull_use_sma': True, 'bull_use_ema': True, 'bull_use_atr': True, 'bull_use_adx': True, 'bull_use_spike': True, 'bull_rsi_required': True, 'bear_strategy': 'mean_reversion', 'bear_bb_std_mult': 2.522938238604882, 'bear_rsi_os': 33, 'bear_rsi_ob': 92, 'bear_adx_thresh': 28.423979681600375, 'bear_atr_min_pct': 0.010035720855978017, 'bear_atr_max_pct': 0.040367931841609875, 'bear_tp_mult': 2.802872960969147, 'bear_tsl_mult': 0.6618374062635829, 'bear_time_stop': 253, 'bear_use_sma': False, 'bear_use_ema': False, 'bear_use_atr': False, 'bear_use_adx': True, 'bear_use_spike': True, 'bear_rsi_required': False, 'sideways_strategy': 'mean_reversion', 'sideways_bb_std_mult': 0.7519117342244624, 'sideways_rsi_os': 16, 'sideways_rsi_ob': 63, 'sideways_adx_thresh': 24.47300761524298, 'sideways_atr_min_pct': 0.0010789657270971593, 'sideways_atr_max_pct': 0.012389718793473767, 'sideways_tp_mult': 2.9721448087551736, 'sideways_tsl_mult': 0.932119043158917, 'sideways_time_stop': 62, 'sideways_use_sma': True, 'sideways_use_ema': True, 'sideways_use_atr': False, 'sideways_use_adx': True, 'sideways_use_spike': True, 'sideways_rsi_required': True}.
[I 2025-08-30 16:22:38,783] Trial 734 finished with values: [-1000000000.0, 1000000000.0] and parameters: {'p_sma': 25, 'p_std': 42, 'p_atr': 26, 'p_adx': 12, 'rsi_period': 38, 'ema1': 23, 'ema2': 32, 'slip_atr_k': 0.13963414183312928, 'slip_spread_k': 0.8546823795514127, 'spread_hl_frac': 0.025428897882972312, 'bb_std_mult': 2.1722924834771145, 'rsi_os': 40, 'rsi_ob': 73, 'vol_spike': 0.16617433474659923, 'adx_thresh': 15.360977237932671, 'atr_min_pct': 0.01896579171507999, 'atr_max_pct': 0.041281069818846265, 'tp_mult': 1.2071836487647207, 'tsl_mult': 0.3849203614167436, 'strategy': 'mean_reversion', 'time_stop': 215, 'use_sma': True, 'use_atr': True, 'use_adx': True, 'use_ema': True, 'use_spike': True, 'rsi_required': False, 'edge_k': 0.4489183740274996, 'edge_cap': 0.07126021095211232, 'bull_strategy': 'breakout', 'bull_bb_std_mult': 0.6668659644634558, 'bull_rsi_os': 21, 'bull_rsi_ob': 57, 'bull_adx_thresh': 30.88802051685488, 'bull_atr_min_pct': 0.023973709432126674, 'bull_atr_max_pct': 0.10622704217806314, 'bull_tp_mult': 2.540793183167155, 'bull_tsl_mult': 0.1525238388261711, 'bull_time_stop': 35, 'bull_use_sma': True, 'bull_use_ema': True, 'bull_use_atr': True, 'bull_use_adx': True, 'bull_use_spike': True, 'bull_rsi_required': True, 'bear_strategy': 'mean_reversion', 'bear_bb_std_mult': 2.624163008548976, 'bear_rsi_os': 32, 'bear_rsi_ob': 92, 'bear_adx_thresh': 23.086242630790068, 'bear_atr_min_pct': 0.020921512366495074, 'bear_atr_max_pct': 0.07579600488793516, 'bear_tp_mult': 2.7927190457160687, 'bear_tsl_mult': 0.3088300441981826, 'bear_time_stop': 252, 'bear_use_sma': False, 'bear_use_ema': False, 'bear_use_atr': False, 'bear_use_adx': True, 'bear_use_spike': True, 'bear_rsi_required': True, 'sideways_strategy': 'mean_reversion', 'sideways_bb_std_mult': 0.776253313606734, 'sideways_rsi_os': 49, 'sideways_rsi_ob': 63, 'sideways_adx_thresh': 22.75572786825085, 'sideways_atr_min_pct': 0.017189361609012476, 'sideways_atr_max_pct': 0.11123652138350348, 'sideways_tp_mult': 2.999477561285607, 'sideways_tsl_mult': 0.9584573006714675, 'sideways_time_stop': 58, 'sideways_use_sma': True, 'sideways_use_ema': True, 'sideways_use_atr': False, 'sideways_use_adx': True, 'sideways_use_spike': True, 'sideways_rsi_required': True}.
