[I 2025-08-30 15:50:02,071] Trial 567 finished with values: [-0.022884951551717325, 0.02281273034107432] and parameters: {'p_sma': 6, 'p_std': 20, 'p_atr': 15, 'p_adx': 28, 'rsi_period': 77, 'ema1': 30, 'ema2': 24, 'slip_atr_k': 0.06305737841275377, 'slip_spread_k': 0.42321266377234634, 'spread_hl_frac': 0.034809765917855985, 'bb_std_mult': 2.8329995252248654, 'rsi_os': 23, 'rsi_ob': 71, 'vol_spike': 0.0768584530236135, 'adx_thresh': 25.39163265752366, 'atr_min_pct': 0.027503420529257347, 'atr_max_pct': 0.08046829506761767, 'tp_mult': 2.0983889606197277, 'tsl_mult': 0.17389920784904195, 'strategy': 'breakout', 'time_stop': 136, 'use_sma': False, 'use_atr': True, 'use_adx': False, 'use_ema': True, 'use_spike': False, 'rsi_required': False, 'edge_k': 0.28760835036824894, 'edge_cap': 0.555671083743061, 'bull_strategy': 'mean_reversion', 'bull_bb_std_mult': 2.50555755608339, 'bull_rsi_os': 38, 'bull_rsi_ob': 55, 'bull_adx_thresh': 23.613584646608754, 'bull_atr_min_pct': 0.015050848658899012, 'bull_atr_max_pct': 0.1355218879486094, 'bull_tp_mult': 2.21984048645359, 'bull_tsl_mult': 0.2914908695282193, 'bull_time_stop': 160, 'bull_use_sma': True, 'bull_use_ema': True, 'bull_use_atr': True, 'bull_use_adx': False, 'bull_use_spike': True, 'bull_rsi_required': False, 'bear_strategy': 'mean_reversion', 'bear_bb_std_mult': 0.6183806151162932, 'bear_rsi_os': 32, 'bear_rsi_ob': 88, 'bear_adx_thresh': 27.4936057115232, 'bear_atr_min_pct': 0.004012360676885079, 'bear_atr_max_pct': 0.12574880329375435, 'bear_tp_mult': 1.7059545041546906, 'bear_tsl_mult': 0.949023483206531, 'bear_time_stop': 90, 'bear_use_sma': True, 'bear_use_ema': True, 'bear_use_atr': True, 'bear_use_adx': False, 'bear_use_spike': True, 'bear_rsi_required': True, 'sideways_strategy': 'breakout', 'sideways_bb_std_mult': 2.200483854478908, 'sideways_rsi_os': 42, 'sideways_rsi_ob': 57, 'sideways_adx_thresh': 21.236777953139605, 'sideways_atr_min_pct': 0.0009897041954320526, 'sideways_atr_max_pct': 0.10346500249694356, 'sideways_tp_mult': 1.8319341792064066, 'sideways_tsl_mult': 0.8840598347689566, 'sideways_time_stop': 202, 'sideways_use_sma': True, 'sideways_use_ema': True, 'sideways_use_atr': True, 'sideways_use_adx': False, 'sideways_use_spike': True, 'sideways_rsi_required': True}.
[I 2025-08-30 15:50:02,375] Trial 566 finished with values: [-1000000000.0, 1000000000.0] and parameters: {'p_sma': 6, 'p_std': 13, 'p_atr': 20, 'p_adx': 12, 'rsi_period': 77, 'ema1': 22, 'ema2': 13, 'slip_atr_k': 0.06236720937284276, 'slip_spread_k': 0.1358842515958742, 'spread_hl_frac': 0.026320452350869137, 'bb_std_mult': 0.5026619838021684, 'rsi_os': 48, 'rsi_ob': 71, 'vol_spike': 0.1808702811470599, 'adx_thresh': 13.759461247035953, 'atr_min_pct': 0.0010986616411831854, 'atr_max_pct': 0.07591385017443857, 'tp_mult': 2.1029669953809687, 'tsl_mult': 0.21129610949565314, 'strategy': 'breakout', 'time_stop': 121, 'use_sma': False, 'use_atr': True, 'use_adx': False, 'use_ema': True, 'use_spike': False, 'rsi_required': False, 'edge_k': 0.3222929403406948, 'edge_cap': 0.1811528541645797, 'bull_strategy': 'mean_reversion', 'bull_bb_std_mult': 0.5094897895935673, 'bull_rsi_os': 40, 'bull_rsi_ob': 58, 'bull_adx_thresh': 15.858035516588107, 'bull_atr_min_pct': 0.013729210872246144, 'bull_atr_max_pct': 0.03915046562124987, 'bull_tp_mult': 1.9890820159989984, 'bull_tsl_mult': 0.24132942353802608, 'bull_time_stop': 161, 'bull_use_sma': True, 'bull_use_ema': True, 'bull_use_atr': True, 'bull_use_adx': False, 'bull_use_spike': True, 'bull_rsi_required': False, 'bear_strategy': 'mean_reversion', 'bear_bb_std_mult': 0.6353021244229379, 'bear_rsi_os': 42, 'bear_rsi_ob': 58, 'bear_adx_thresh': 6.7402827335416085, 'bear_atr_min_pct': 0.020950211620360194, 'bear_atr_max_pct': 0.07023496058334118, 'bear_tp_mult': 1.6967021710260468, 'bear_tsl_mult': 0.7700380734659946, 'bear_time_stop': 73, 'bear_use_sma': True, 'bear_use_ema': True, 'bear_use_atr': True, 'bear_use_adx': False, 'bear_use_spike': True, 'bear_rsi_required': True, 'sideways_strategy': 'breakout', 'sideways_bb_std_mult': 2.8735327219838034, 'sideways_rsi_os': 41, 'sideways_rsi_ob': 60, 'sideways_adx_thresh': 33.79329165913964, 'sideways_atr_min_pct': 0.0024586688890619003, 'sideways_atr_max_pct': 0.029859944328281728, 'sideways_tp_mult': 2.355888254054521, 'sideways_tsl_mult': 0.9374800296309692, 'sideways_time_stop': 84, 'sideways_use_sma': True, 'sideways_use_ema': True, 'sideways_use_atr': True, 'sideways_use_adx': False, 'sideways_use_spike': True, 'sideways_rsi_required': True}.
[I 2025-08-30 15:50:03,020] Trial 569 finished with values: [-1000000000.0, 1000000000.0] and parameters: {'p_sma': 18, 'p_std': 58, 'p_atr': 15, 'p_adx': 25, 'rsi_period': 77, 'ema1': 30, 'ema2': 36, 'slip_atr_k': 0.2490490139196999, 'slip_spread_k': 0.07981092453706985, 'spread_hl_frac': 0.023554315054367416, 'bb_std_mult': 1.2022387457148629, 'rsi_os': 23, 'rsi_ob': 71, 'vol_spike': 0.1693940913832219, 'adx_thresh': 13.421392823252905, 'atr_min_pct': 0.011958711959270871, 'atr_max_pct': 0.0833543038534837, 'tp_mult': 2.127338330747931, 'tsl_mult': 0.2090235084190158, 'strategy': 'mean_reversion', 'time_stop': 246, 'use_sma': True, 'use_atr': True, 'use_adx': False, 'use_ema': True, 'use_spike': False, 'rsi_required': False, 'edge_k': 0.6287283843326027, 'edge_cap': 0.17212340138922266, 'bull_strategy': 'breakout', 'bull_bb_std_mult': 2.0654443105994305, 'bull_rsi_os': 55, 'bull_rsi_ob': 54, 'bull_adx_thresh': 15.725908559698254, 'bull_atr_min_pct': 0.02173200110452533, 'bull_atr_max_pct': 0.06926011187143656, 'bull_tp_mult': 1.985601469421088, 'bull_tsl_mult': 0.24759387259078602, 'bull_time_stop': 161, 'bull_use_sma': False, 'bull_use_ema': False, 'bull_use_atr': False, 'bull_use_adx': False, 'bull_use_spike': True, 'bull_rsi_required': False, 'bear_strategy': 'breakout', 'bear_bb_std_mult': 0.6557903050407407, 'bear_rsi_os': 29, 'bear_rsi_ob': 64, 'bear_adx_thresh': 28.656409953918924, 'bear_atr_min_pct': 0.0038290186640740614, 'bear_atr_max_pct': 0.12510485118287756, 'bear_tp_mult': 1.8602093181762043, 'bear_tsl_mult': 0.35217215247348066, 'bear_time_stop': 81, 'bear_use_sma': True, 'bear_use_ema': True, 'bear_use_atr': True, 'bear_use_adx': True, 'bear_use_spike': True, 'bear_rsi_required': True, 'sideways_strategy': 'breakout', 'sideways_bb_std_mult': 1.7448550824099773, 'sideways_rsi_os': 19, 'sideways_rsi_ob': 45, 'sideways_adx_thresh': 27.69563766275606, 'sideways_atr_min_pct': 0.0024002099604326435, 'sideways_atr_max_pct': 0.10878835824694096, 'sideways_tp_mult': 2.4152906064175745, 'sideways_tsl_mult': 0.9770379154838903, 'sideways_time_stop': 294, 'sideways_use_sma': True, 'sideways_use_ema': True, 'sideways_use_atr': False, 'sideways_use_adx': True, 'sideways_use_spike': True, 'sideways_rsi_required': True}.
[I 2025-08-30 15:50:48,955] Trial 573 finished with values: [-1000000000.0, 1000000000.0] and parameters: {'p_sma': 36, 'p_std': 58, 'p_atr': 22, 'p_adx': 9, 'rsi_period': 27, 'ema1': 19, 'ema2': 39, 'slip_atr_k': 0.07632350023857876, 'slip_spread_k': 0.11618196541790675, 'spread_hl_frac': 0.00733728369047508, 'bb_std_mult': 1.3078440121437451, 'rsi_os': 26, 'rsi_ob': 77, 'vol_spike': 0.04914266185130797, 'adx_thresh': 12.82815128737256, 'atr_min_pct': 0.005315348358162721, 'atr_max_pct': 0.08251407597723198, 'tp_mult': 1.8042514468054611, 'tsl_mult': 0.7402638791163936, 'strategy': 'mean_reversion', 'time_stop': 150, 'use_sma': True, 'use_atr': True, 'use_adx': True, 'use_ema': True, 'use_spike': True, 'rsi_required': True, 'edge_k': 0.09939627538483252, 'edge_cap': 0.47069937854320953, 'bull_strategy': 'mean_reversion', 'bull_bb_std_mult': 2.6353913732684937, 'bull_rsi_os': 8, 'bull_rsi_ob': 50, 'bull_adx_thresh': 22.823191027826, 'bull_atr_min_pct': 0.020950669987968955, 'bull_atr_max_pct': 0.12365270338988499, 'bull_tp_mult': 2.1619088416649834, 'bull_tsl_mult': 0.9533198113751966, 'bull_time_stop': 166, 'bull_use_sma': False, 'bull_use_ema': False, 'bull_use_atr': False, 'bull_use_adx': True, 'bull_use_spike': True, 'bull_rsi_required': False, 'bear_strategy': 'breakout', 'bear_bb_std_mult': 0.5053557852424232, 'bear_rsi_os': 51, 'bear_rsi_ob': 65, 'bear_adx_thresh': 7.6314409089566695, 'bear_atr_min_pct': 0.021623190416398607, 'bear_atr_max_pct': 0.12088249794854677, 'bear_tp_mult': 2.4327041078374516, 'bear_tsl_mult': 0.9245747171324414, 'bear_time_stop': 58, 'bear_use_sma': True, 'bear_use_ema': True, 'bear_use_atr': False, 'bear_use_adx': False, 'bear_use_spike': False, 'bear_rsi_required': True, 'sideways_strategy': 'mean_reversion', 'sideways_bb_std_mult': 2.2904434447458306, 'sideways_rsi_os': 43, 'sideways_rsi_ob': 73, 'sideways_adx_thresh': 25.612627451133587, 'sideways_atr_min_pct': 0.011485749005039044, 'sideways_atr_max_pct': 0.0973223079615046, 'sideways_tp_mult': 1.9177481638693061, 'sideways_tsl_mult': 0.9996270782137602, 'sideways_time_stop': 76, 'sideways_use_sma': True, 'sideways_use_ema': False, 'sideways_use_atr': True, 'sideways_use_adx': False, 'sideways_use_spike': True, 'sideways_rsi_required': False}.
[I 2025-08-30 15:50:51,294] Trial 572 finished with values: [-1000000000.0, 1000000000.0] and parameters: {'p_sma': 60, 'p_std': 58, 'p_atr': 16, 'p_adx': 9, 'rsi_period': 20, 'ema1': 7, 'ema2': 34, 'slip_atr_k': 0.07619841503638851, 'slip_spread_k': 0.09589059165605107, 'spread_hl_frac': 0.01222112863347045, 'bb_std_mult': 1.1749618234633603, 'rsi_os': 27, 'rsi_ob': 59, 'vol_spike': 0.22132566219235694, 'adx_thresh': 12.972408275681579, 'atr_min_pct': 0.006079219367426399, 'atr_max_pct': 0.08287715644537061, 'tp_mult': 1.7977842519578626, 'tsl_mult': 0.7340096555683988, 'strategy': 'mean_reversion', 'time_stop': 257, 'use_sma': True, 'use_atr': True, 'use_adx': True, 'use_ema': True, 'use_spike': True, 'rsi_required': True, 'edge_k': 0.10161738436480139, 'edge_cap': 0.5446730514325988, 'bull_strategy': 'breakout', 'bull_bb_std_mult': 2.99534983473347, 'bull_rsi_os': 38, 'bull_rsi_ob': 50, 'bull_adx_thresh': 22.646667279241203, 'bull_atr_min_pct': 0.02130513197167534, 'bull_atr_max_pct': 0.12276071888419055, 'bull_tp_mult': 2.1648628582027314, 'bull_tsl_mult': 0.26447561087254196, 'bull_time_stop': 167, 'bull_use_sma': False, 'bull_use_ema': False, 'bull_use_atr': False, 'bull_use_adx': False, 'bull_use_spike': True, 'bull_rsi_required': False, 'bear_strategy': 'breakout', 'bear_bb_std_mult': 1.8220457271117279, 'bear_rsi_os': 27, 'bear_rsi_ob': 75, 'bear_adx_thresh': 11.374444168130392, 'bear_atr_min_pct': 0.021693619116779157, 'bear_atr_max_pct': 0.12018962776737502, 'bear_tp_mult': 1.515797123983714, 'bear_tsl_mult': 0.9135314911313579, 'bear_time_stop': 81, 'bear_use_sma': True, 'bear_use_ema': True, 'bear_use_atr': False, 'bear_use_adx': True, 'bear_use_spike': False, 'bear_rsi_required': True, 'sideways_strategy': 'mean_reversion', 'sideways_bb_std_mult': 2.331985971130578, 'sideways_rsi_os': 19, 'sideways_rsi_ob': 63, 'sideways_adx_thresh': 26.12469337312607, 'sideways_atr_min_pct': 0.009265498017679197, 'sideways_atr_max_pct': 0.09732664478538224, 'sideways_tp_mult': 1.9380747636732885, 'sideways_tsl_mult': 0.27941083689109925, 'sideways_time_stop': 91, 'sideways_use_sma': True, 'sideways_use_ema': True, 'sideways_use_atr': False, 'sideways_use_adx': True, 'sideways_use_spike': True, 'sideways_rsi_required': False}.
[I 2025-08-30 15:50:51,962] Trial 570 finished with values: [-1000000000.0, 1000000000.0] and parameters: {'p_sma': 6, 'p_std': 25, 'p_atr': 21, 'p_adx': 18, 'rsi_period': 64, 'ema1': 19, 'ema2': 39, 'slip_atr_k': 0.07698764592932332, 'slip_spread_k': 0.4153218960402255, 'spread_hl_frac': 0.007078382560353282, 'bb_std_mult': 1.4418136584488686, 'rsi_os': 25, 'rsi_ob': 83, 'vol_spike': 0.22347235652372782, 'adx_thresh': 16.831450264001987, 'atr_min_pct': 0.012815178170617234, 'atr_max_pct': 0.08124826988602558, 'tp_mult': 1.3815395725464172, 'tsl_mult': 0.17023895331331756, 'strategy': 'mean_reversion', 'time_stop': 118, 'use_sma': True, 'use_atr': True, 'use_adx': True, 'use_ema': True, 'use_spike': False, 'rsi_required': False, 'edge_k': 0.4886175983771953, 'edge_cap': 0.9245788297454913, 'bull_strategy': 'mean_reversion', 'bull_bb_std_mult': 2.036471860977918, 'bull_rsi_os': 38, 'bull_rsi_ob': 50, 'bull_adx_thresh': 23.136710630722746, 'bull_atr_min_pct': 0.021557241404745204, 'bull_atr_max_pct': 0.06846652923850764, 'bull_tp_mult': 2.18783893602324, 'bull_tsl_mult': 0.28929460852605565, 'bull_time_stop': 165, 'bull_use_sma': False, 'bull_use_ema': False, 'bull_use_atr': False, 'bull_use_adx': False, 'bull_use_spike': True, 'bull_rsi_required': False, 'bear_strategy': 'breakout', 'bear_bb_std_mult': 0.8275924986064636, 'bear_rsi_os': 32, 'bear_rsi_ob': 75, 'bear_adx_thresh': 28.476944450106465, 'bear_atr_min_pct': 0.020921451793920336, 'bear_atr_max_pct': 0.12583748215697688, 'bear_tp_mult': 2.4215013461422905, 'bear_tsl_mult': 0.6695227661984577, 'bear_time_stop': 207, 'bear_use_sma': True, 'bear_use_ema': True, 'bear_use_atr': True, 'bear_use_adx': False, 'bear_use_spike': True, 'bear_rsi_required': True, 'sideways_strategy': 'breakout', 'sideways_bb_std_mult': 2.717041036774615, 'sideways_rsi_os': 43, 'sideways_rsi_ob': 56, 'sideways_adx_thresh': 25.777090202150468, 'sideways_atr_min_pct': 0.009277524651201973, 'sideways_atr_max_pct': 0.09775368923391174, 'sideways_tp_mult': 1.9227426043872495, 'sideways_tsl_mult': 0.2769384310688221, 'sideways_time_stop': 82, 'sideways_use_sma': True, 'sideways_use_ema': True, 'sideways_use_atr': True, 'sideways_use_adx': False, 'sideways_use_spike': True, 'sideways_rsi_required': True}.
[I 2025-08-30 15:50:52,615] Trial 571 finished with values: [-1000000000.0, 1000000000.0] and parameters: {'p_sma': 6, 'p_std': 58, 'p_atr': 21, 'p_adx': 25, 'rsi_period': 80, 'ema1': 29, 'ema2': 34, 'slip_atr_k': 0.0770366523050798, 'slip_spread_k': 0.08741156893976715, 'spread_hl_frac': 0.04608030684122763, 'bb_std_mult': 1.1947074018982864, 'rsi_os': 27, 'rsi_ob': 76, 'vol_spike': 0.18115718765727987, 'adx_thresh': 13.239508056549399, 'atr_min_pct': 0.012909087875273988, 'atr_max_pct': 0.13041785690928778, 'tp_mult': 1.2713963916091997, 'tsl_mult': 0.7489907897791321, 'strategy': 'mean_reversion', 'time_stop': 150, 'use_sma': True, 'use_atr': True, 'use_adx': True, 'use_ema': True, 'use_spike': True, 'rsi_required': True, 'edge_k': 0.661931958518204, 'edge_cap': 0.08281207809662083, 'bull_strategy': 'mean_reversion', 'bull_bb_std_mult': 2.3212957522449713, 'bull_rsi_os': 38, 'bull_rsi_ob': 58, 'bull_adx_thresh': 8.847733792922295, 'bull_atr_min_pct': 0.02158631328498552, 'bull_atr_max_pct': 0.01014779851363562, 'bull_tp_mult': 2.1694910992098064, 'bull_tsl_mult': 0.2643737747013124, 'bull_time_stop': 167, 'bull_use_sma': False, 'bull_use_ema': False, 'bull_use_atr': False, 'bull_use_adx': False, 'bull_use_spike': True, 'bull_rsi_required': False, 'bear_strategy': 'breakout', 'bear_bb_std_mult': 1.8233079159565575, 'bear_rsi_os': 38, 'bear_rsi_ob': 79, 'bear_adx_thresh': 28.67346060733629, 'bear_atr_min_pct': 0.021124075491246952, 'bear_atr_max_pct': 0.07160807075803398, 'bear_tp_mult': 2.326592183104644, 'bear_tsl_mult': 0.9157131896959658, 'bear_time_stop': 207, 'bear_use_sma': True, 'bear_use_ema': True, 'bear_use_atr': False, 'bear_use_adx': False, 'bear_use_spike': False, 'bear_rsi_required': True, 'sideways_strategy': 'mean_reversion', 'sideways_bb_std_mult': 0.6099182436891433, 'sideways_rsi_os': 19, 'sideways_rsi_ob': 71, 'sideways_adx_thresh': 9.537176218274789, 'sideways_atr_min_pct': 0.01966109565343289, 'sideways_atr_max_pct': 0.1082025603711129, 'sideways_tp_mult': 1.9376090601893212, 'sideways_tsl_mult': 0.9365477908543143, 'sideways_time_stop': 82, 'sideways_use_sma': True, 'sideways_use_ema': True, 'sideways_use_atr': True, 'sideways_use_adx': False, 'sideways_use_spike': True, 'sideways_rsi_required': False}.
[I 2025-08-30 15:51:33,488] Trial 576 finished with values: [-1000000000.0, 1000000000.0] and parameters: {'p_sma': 7, 'p_std': 60, 'p_atr': 14, 'p_adx': 24, 'rsi_period': 79, 'ema1': 29, 'ema2': 35, 'slip_atr_k': 0.06825891641446835, 'slip_spread_k': 0.18537979542640842, 'spread_hl_frac': 0.029333220162573215, 'bb_std_mult': 1.0990716930982969, 'rsi_os': 27, 'rsi_ob': 76, 'vol_spike': 0.15640715406485672, 'adx_thresh': 11.639553768322036, 'atr_min_pct': 0.013957495271086293, 'atr_max_pct': 0.021391087492991373, 'tp_mult': 1.983063687745227, 'tsl_mult': 0.6716190678377643, 'strategy': 'breakout', 'time_stop': 145, 'use_sma': False, 'use_atr': True, 'use_adx': False, 'use_ema': True, 'use_spike': True, 'rsi_required': True, 'edge_k': 0.6644028395238533, 'edge_cap': 0.572512090918761, 'bull_strategy': 'mean_reversion', 'bull_bb_std_mult': 2.5637463485604406, 'bull_rsi_os': 54, 'bull_rsi_ob': 53, 'bull_adx_thresh': 21.49240889964903, 'bull_atr_min_pct': 0.02220969823267821, 'bull_atr_max_pct': 0.07718697232398934, 'bull_tp_mult': 2.2644792995197642, 'bull_tsl_mult': 0.28964603123408833, 'bull_time_stop': 156, 'bull_use_sma': False, 'bull_use_ema': False, 'bull_use_atr': False, 'bull_use_adx': True, 'bull_use_spike': True, 'bull_rsi_required': False, 'bear_strategy': 'mean_reversion', 'bear_bb_std_mult': 0.7148402511580649, 'bear_rsi_os': 28, 'bear_rsi_ob': 79, 'bear_adx_thresh': 13.989069233853904, 'bear_atr_min_pct': 0.022044934754950323, 'bear_atr_max_pct': 0.07213417592663735, 'bear_tp_mult': 1.4755271256525944, 'bear_tsl_mult': 0.9639808790818037, 'bear_time_stop': 70, 'bear_use_sma': True, 'bear_use_ema': True, 'bear_use_atr': True, 'bear_use_adx': False, 'bear_use_spike': False, 'bear_rsi_required': True, 'sideways_strategy': 'breakout', 'sideways_bb_std_mult': 1.8836860885336029, 'sideways_rsi_os': 11, 'sideways_rsi_ob': 58, 'sideways_adx_thresh': 28.188890217986984, 'sideways_atr_min_pct': 5.374199423340302e-06, 'sideways_atr_max_pct': 0.10116454249668821, 'sideways_tp_mult': 2.296731726752201, 'sideways_tsl_mult': 0.18718966220172611, 'sideways_time_stop': 75, 'sideways_use_sma': True, 'sideways_use_ema': False, 'sideways_use_atr': True, 'sideways_use_adx': False, 'sideways_use_spike': False, 'sideways_rsi_required': False}.
[I 2025-08-30 15:51:34,247] Trial 577 finished with values: [-0.12365303306663156, 0.12355965509784247] and parameters: {'p_sma': 28, 'p_std': 9, 'p_atr': 14, 'p_adx': 24, 'rsi_period': 79, 'ema1': 30, 'ema2': 35, 'slip_atr_k': 0.21613596013423592, 'slip_spread_k': 0.12432798580600427, 'spread_hl_frac': 0.0291600176211929, 'bb_std_mult': 1.769196113014699, 'rsi_os': 26, 'rsi_ob': 73, 'vol_spike': 0.15594453971099242, 'adx_thresh': 9.518834534945228, 'atr_min_pct': 0.013948249067983445, 'atr_max_pct': 0.037306948278821674, 'tp_mult': 1.529942919765526, 'tsl_mult': 0.7182743940975327, 'strategy': 'breakout', 'time_stop': 232, 'use_sma': False, 'use_atr': True, 'use_adx': False, 'use_ema': True, 'use_spike': True, 'rsi_required': True, 'edge_k': 0.19855344087165377, 'edge_cap': 0.572398803474742, 'bull_strategy': 'mean_reversion', 'bull_bb_std_mult': 1.0144285249535614, 'bull_rsi_os': 20, 'bull_rsi_ob': 52, 'bull_adx_thresh': 32.16212009196549, 'bull_atr_min_pct': 1.07750980980377e-05, 'bull_atr_max_pct': 0.064792426590738, 'bull_tp_mult': 2.2594331164506527, 'bull_tsl_mult': 0.9085004796615141, 'bull_time_stop': 155, 'bull_use_sma': False, 'bull_use_ema': False, 'bull_use_atr': False, 'bull_use_adx': True, 'bull_use_spike': True, 'bull_rsi_required': False, 'bear_strategy': 'mean_reversion', 'bear_bb_std_mult': 2.0935738928813827, 'bear_rsi_os': 28, 'bear_rsi_ob': 86, 'bear_adx_thresh': 29.424298475125394, 'bear_atr_min_pct': 0.008868380509916528, 'bear_atr_max_pct': 0.077918778222174, 'bear_tp_mult': 1.5758096297509234, 'bear_tsl_mult': 0.9614106079427602, 'bear_time_stop': 169, 'bear_use_sma': True, 'bear_use_ema': True, 'bear_use_atr': True, 'bear_use_adx': False, 'bear_use_spike': False, 'bear_rsi_required': True, 'sideways_strategy': 'breakout', 'sideways_bb_std_mult': 1.9193156475389321, 'sideways_rsi_os': 45, 'sideways_rsi_ob': 77, 'sideways_adx_thresh': 27.523452084202457, 'sideways_atr_min_pct': 0.0012213717899262034, 'sideways_atr_max_pct': 0.01733969933458694, 'sideways_tp_mult': 2.287276941348857, 'sideways_tsl_mult': 0.9691775713198449, 'sideways_time_stop': 134, 'sideways_use_sma': True, 'sideways_use_ema': False, 'sideways_use_atr': True, 'sideways_use_adx': False, 'sideways_use_spike': False, 'sideways_rsi_required': False}.
