[I 2025-08-30 15:41:56,692] Trial 534 finished with values: [-1000000000.0, 1000000000.0] and parameters: {'p_sma': 56, 'p_std': 58, 'p_atr': 14, 'p_adx': 24, 'rsi_period': 73, 'ema1': 30, 'ema2': 60, 'slip_atr_k': 0.07099245021740402, 'slip_spread_k': 0.07457661675491946, 'spread_hl_frac': 0.04284932395463985, 'bb_std_mult': 1.1454846415359108, 'rsi_os': 22, 'rsi_ob': 73, 'vol_spike': 0.1643828192628352, 'adx_thresh': 12.49761420766553, 'atr_min_pct': 0.011922158994008619, 'atr_max_pct': 0.07255922466391614, 'tp_mult': 1.6719892403605021, 'tsl_mult': 0.24514646646217092, 'strategy': 'breakout', 'time_stop': 119, 'use_sma': False, 'use_atr': True, 'use_adx': False, 'use_ema': True, 'use_spike': False, 'rsi_required': False, 'edge_k': 0.21529094677853872, 'edge_cap': 0.5285446450758824, 'bull_strategy': 'breakout', 'bull_bb_std_mult': 2.5268991497354145, 'bull_rsi_os': 11, 'bull_rsi_ob': 55, 'bull_adx_thresh': 21.767728709267608, 'bull_atr_min_pct': 0.020512554788341103, 'bull_atr_max_pct': 0.03724756718661889, 'bull_tp_mult': 2.16061465913514, 'bull_tsl_mult': 0.3012094540839283, 'bull_time_stop': 168, 'bull_use_sma': False, 'bull_use_ema': True, 'bull_use_atr': False, 'bull_use_adx': False, 'bull_use_spike': True, 'bull_rsi_required': False, 'bear_strategy': 'mean_reversion', 'bear_bb_std_mult': 0.7797354096608405, 'bear_rsi_os': 28, 'bear_rsi_ob': 86, 'bear_adx_thresh': 27.608333387746, 'bear_atr_min_pct': 0.02132226603660774, 'bear_atr_max_pct': 0.07939481715410135, 'bear_tp_mult': 1.4681488795283093, 'bear_tsl_mult': 0.9323804292456603, 'bear_time_stop': 69, 'bear_use_sma': True, 'bear_use_ema': True, 'bear_use_atr': True, 'bear_use_adx': False, 'bear_use_spike': True, 'bear_rsi_required': True, 'sideways_strategy': 'breakout', 'sideways_bb_std_mult': 1.9015936010597962, 'sideways_rsi_os': 41, 'sideways_rsi_ob': 57, 'sideways_adx_thresh': 22.44169367100003, 'sideways_atr_min_pct': 0.020648230243284542, 'sideways_atr_max_pct': 0.12472955551590971, 'sideways_tp_mult': 2.4014008495797645, 'sideways_tsl_mult': 0.9642666992723334, 'sideways_time_stop': 63, 'sideways_use_sma': True, 'sideways_use_ema': True, 'sideways_use_atr': False, 'sideways_use_adx': True, 'sideways_use_spike': True, 'sideways_rsi_required': True}.
[I 2025-08-30 15:41:58,399] Trial 532 finished with values: [-1000000000.0, 1000000000.0] and parameters: {'p_sma': 6, 'p_std': 58, 'p_atr': 14, 'p_adx': 25, 'rsi_period': 73, 'ema1': 8, 'ema2': 36, 'slip_atr_k': 0.24091561825345337, 'slip_spread_k': 0.0620611856311722, 'spread_hl_frac': 0.02868676488529592, 'bb_std_mult': 2.5168827847057913, 'rsi_os': 41, 'rsi_ob': 72, 'vol_spike': 0.16760944387627655, 'adx_thresh': 14.708215761096882, 'atr_min_pct': 0.011891852159239028, 'atr_max_pct': 0.07645052065578897, 'tp_mult': 1.9361571194564369, 'tsl_mult': 0.33202781136206483, 'strategy': 'breakout', 'time_stop': 118, 'use_sma': False, 'use_atr': True, 'use_adx': False, 'use_ema': True, 'use_spike': False, 'rsi_required': False, 'edge_k': 0.2869508809111523, 'edge_cap': 0.5324253795735556, 'bull_strategy': 'mean_reversion', 'bull_bb_std_mult': 2.5848139503914545, 'bull_rsi_os': 38, 'bull_rsi_ob': 47, 'bull_adx_thresh': 22.243644175801357, 'bull_atr_min_pct': 0.0209230456892047, 'bull_atr_max_pct': 0.0634542450177142, 'bull_tp_mult': 2.217679633353563, 'bull_tsl_mult': 0.29212991336252425, 'bull_time_stop': 164, 'bull_use_sma': False, 'bull_use_ema': True, 'bull_use_atr': False, 'bull_use_adx': False, 'bull_use_spike': True, 'bull_rsi_required': False, 'bear_strategy': 'mean_reversion', 'bear_bb_std_mult': 0.8205083400227731, 'bear_rsi_os': 48, 'bear_rsi_ob': 54, 'bear_adx_thresh': 27.96814867396395, 'bear_atr_min_pct': 0.02113820544616839, 'bear_atr_max_pct': 0.07413606453920246, 'bear_tp_mult': 1.4586626608822328, 'bear_tsl_mult': 0.9782104490640477, 'bear_time_stop': 221, 'bear_use_sma': True, 'bear_use_ema': True, 'bear_use_atr': True, 'bear_use_adx': False, 'bear_use_spike': True, 'bear_rsi_required': True, 'sideways_strategy': 'breakout', 'sideways_bb_std_mult': 1.9381896926181708, 'sideways_rsi_os': 55, 'sideways_rsi_ob': 46, 'sideways_adx_thresh': 34.55504526326803, 'sideways_atr_min_pct': 0.023422873170079468, 'sideways_atr_max_pct': 0.1013782520891233, 'sideways_tp_mult': 2.4138841522293166, 'sideways_tsl_mult': 0.9580878288343764, 'sideways_time_stop': 149, 'sideways_use_sma': True, 'sideways_use_ema': True, 'sideways_use_atr': True, 'sideways_use_adx': False, 'sideways_use_spike': True, 'sideways_rsi_required': True}.
[I 2025-08-30 15:41:58,825] Trial 533 finished with values: [-1000000000.0, 1000000000.0] and parameters: {'p_sma': 6, 'p_std': 58, 'p_atr': 14, 'p_adx': 24, 'rsi_period': 73, 'ema1': 15, 'ema2': 36, 'slip_atr_k': 0.2212748496978767, 'slip_spread_k': 0.07719021092450543, 'spread_hl_frac': 0.019876441212041643, 'bb_std_mult': 2.8742155995777514, 'rsi_os': 23, 'rsi_ob': 73, 'vol_spike': 0.1726212830376137, 'adx_thresh': 12.550764625304572, 'atr_min_pct': 0.011221471129009668, 'atr_max_pct': 0.07355834410719067, 'tp_mult': 1.8837693922809848, 'tsl_mult': 0.7759082200017069, 'strategy': 'breakout', 'time_stop': 118, 'use_sma': False, 'use_atr': True, 'use_adx': False, 'use_ema': True, 'use_spike': False, 'rsi_required': False, 'edge_k': 1.8922914533303672, 'edge_cap': 0.527783884156175, 'bull_strategy': 'breakout', 'bull_bb_std_mult': 2.524817873504458, 'bull_rsi_os': 11, 'bull_rsi_ob': 53, 'bull_adx_thresh': 21.552640640311253, 'bull_atr_min_pct': 0.020428528055529357, 'bull_atr_max_pct': 0.06680152994912988, 'bull_tp_mult': 2.160684704032478, 'bull_tsl_mult': 0.29917676397703635, 'bull_time_stop': 165, 'bull_use_sma': False, 'bull_use_ema': True, 'bull_use_atr': False, 'bull_use_adx': False, 'bull_use_spike': True, 'bull_rsi_required': False, 'bear_strategy': 'mean_reversion', 'bear_bb_std_mult': 0.7927359863140455, 'bear_rsi_os': 30, 'bear_rsi_ob': 75, 'bear_adx_thresh': 28.1338922855251, 'bear_atr_min_pct': 0.021358443355542458, 'bear_atr_max_pct': 0.05710336475362082, 'bear_tp_mult': 1.5142776038567674, 'bear_tsl_mult': 0.9087088402954632, 'bear_time_stop': 142, 'bear_use_sma': True, 'bear_use_ema': True, 'bear_use_atr': True, 'bear_use_adx': False, 'bear_use_spike': True, 'bear_rsi_required': True, 'sideways_strategy': 'breakout', 'sideways_bb_std_mult': 1.9579678597398154, 'sideways_rsi_os': 41, 'sideways_rsi_ob': 60, 'sideways_adx_thresh': 10.167468366204764, 'sideways_atr_min_pct': 0.015162978227837588, 'sideways_atr_max_pct': 0.12365678237939168, 'sideways_tp_mult': 1.8619552800316792, 'sideways_tsl_mult': 0.9647842710377673, 'sideways_time_stop': 72, 'sideways_use_sma': True, 'sideways_use_ema': True, 'sideways_use_atr': False, 'sideways_use_adx': True, 'sideways_use_spike': True, 'sideways_rsi_required': True}.
[I 2025-08-30 15:41:59,231] Trial 531 finished with values: [-0.010901997102180427, 0.010781491952210011] and parameters: {'p_sma': 6, 'p_std': 22, 'p_atr': 14, 'p_adx': 25, 'rsi_period': 58, 'ema1': 30, 'ema2': 36, 'slip_atr_k': 0.08759809998517373, 'slip_spread_k': 0.06710949272647661, 'spread_hl_frac': 0.023193329309453118, 'bb_std_mult': 1.146382832096692, 'rsi_os': 21, 'rsi_ob': 72, 'vol_spike': 0.16631561739522668, 'adx_thresh': 14.720250840325761, 'atr_min_pct': 0.013103569412722933, 'atr_max_pct': 0.07337276206828357, 'tp_mult': 1.8719804941033824, 'tsl_mult': 0.7934917012852253, 'strategy': 'breakout', 'time_stop': 116, 'use_sma': False, 'use_atr': True, 'use_adx': False, 'use_ema': True, 'use_spike': False, 'rsi_required': False, 'edge_k': 0.2077344913066251, 'edge_cap': 0.053339185203312434, 'bull_strategy': 'mean_reversion', 'bull_bb_std_mult': 2.9752684216020566, 'bull_rsi_os': 36, 'bull_rsi_ob': 48, 'bull_adx_thresh': 21.834292715144112, 'bull_atr_min_pct': 0.020611848078812937, 'bull_atr_max_pct': 0.036297236518324054, 'bull_tp_mult': 2.1928473171721192, 'bull_tsl_mult': 0.29529339115147235, 'bull_time_stop': 165, 'bull_use_sma': False, 'bull_use_ema': True, 'bull_use_atr': False, 'bull_use_adx': False, 'bull_use_spike': True, 'bull_rsi_required': False, 'bear_strategy': 'mean_reversion', 'bear_bb_std_mult': 1.7088649313454485, 'bear_rsi_os': 48, 'bear_rsi_ob': 54, 'bear_adx_thresh': 28.063168257128172, 'bear_atr_min_pct': 0.021117212360525783, 'bear_atr_max_pct': 0.13624426599731349, 'bear_tp_mult': 1.4483313445862094, 'bear_tsl_mult': 0.9746482290986787, 'bear_time_stop': 221, 'bear_use_sma': True, 'bear_use_ema': True, 'bear_use_atr': True, 'bear_use_adx': False, 'bear_use_spike': True, 'bear_rsi_required': True, 'sideways_strategy': 'breakout', 'sideways_bb_std_mult': 2.8070901594170783, 'sideways_rsi_os': 44, 'sideways_rsi_ob': 60, 'sideways_adx_thresh': 31.381597498593045, 'sideways_atr_min_pct': 0.0017425157451144905, 'sideways_atr_max_pct': 0.10153308631673985, 'sideways_tp_mult': 2.9995887068662963, 'sideways_tsl_mult': 0.9700075261527207, 'sideways_time_stop': 148, 'sideways_use_sma': True, 'sideways_use_ema': True, 'sideways_use_atr': True, 'sideways_use_adx': False, 'sideways_use_spike': True, 'sideways_rsi_required': True}.
[I 2025-08-30 15:42:00,822] Trial 536 finished with values: [-1000000000.0, 1000000000.0] and parameters: {'p_sma': 6, 'p_std': 56, 'p_atr': 15, 'p_adx': 26, 'rsi_period': 76, 'ema1': 15, 'ema2': 33, 'slip_atr_k': 0.14891068439068833, 'slip_spread_k': 0.11782944690216336, 'spread_hl_frac': 0.025343305856850504, 'bb_std_mult': 1.4364439027941687, 'rsi_os': 23, 'rsi_ob': 75, 'vol_spike': 0.16476212383376881, 'adx_thresh': 13.052031501556261, 'atr_min_pct': 0.0136456354659425, 'atr_max_pct': 0.010383135640443714, 'tp_mult': 1.758276678902994, 'tsl_mult': 0.7394000077383499, 'strategy': 'breakout', 'time_stop': 132, 'use_sma': False, 'use_atr': True, 'use_adx': False, 'use_ema': True, 'use_spike': True, 'rsi_required': True, 'edge_k': 0.19765118880816968, 'edge_cap': 0.7992121924816193, 'bull_strategy': 'mean_reversion', 'bull_bb_std_mult': 2.636227201686867, 'bull_rsi_os': 9, 'bull_rsi_ob': 52, 'bull_adx_thresh': 30.413211239047254, 'bull_atr_min_pct': 0.029951721204335004, 'bull_atr_max_pct': 0.06709117114816561, 'bull_tp_mult': 2.1712839146625513, 'bull_tsl_mult': 0.30824954826207057, 'bull_time_stop': 145, 'bull_use_sma': False, 'bull_use_ema': False, 'bull_use_atr': False, 'bull_use_adx': False, 'bull_use_spike': True, 'bull_rsi_required': False, 'bear_strategy': 'mean_reversion', 'bear_bb_std_mult': 0.5040322429584453, 'bear_rsi_os': 30, 'bear_rsi_ob': 75, 'bear_adx_thresh': 21.883789999910523, 'bear_atr_min_pct': 0.02221208201675247, 'bear_atr_max_pct': 0.07521225986104882, 'bear_tp_mult': 1.5109577004452277, 'bear_tsl_mult': 0.9084066282197877, 'bear_time_stop': 143, 'bear_use_sma': True, 'bear_use_ema': True, 'bear_use_atr': True, 'bear_use_adx': False, 'bear_use_spike': False, 'bear_rsi_required': True, 'sideways_strategy': 'breakout', 'sideways_bb_std_mult': 2.3011632167121525, 'sideways_rsi_os': 46, 'sideways_rsi_ob': 62, 'sideways_adx_thresh': 23.71867485816951, 'sideways_atr_min_pct': 0.014527097868967734, 'sideways_atr_max_pct': 0.11352228128765195, 'sideways_tp_mult': 2.3195669058805715, 'sideways_tsl_mult': 0.9995297338276783, 'sideways_time_stop': 175, 'sideways_use_sma': True, 'sideways_use_ema': True, 'sideways_use_atr': True, 'sideways_use_adx': False, 'sideways_use_spike': True, 'sideways_rsi_required': False}.
[I 2025-08-30 15:42:52,887] Trial 537 finished with values: [-1000000000.0, 1000000000.0] and parameters: {'p_sma': 5, 'p_std': 37, 'p_atr': 26, 'p_adx': 26, 'rsi_period': 76, 'ema1': 30, 'ema2': 33, 'slip_atr_k': 0.06573231769077065, 'slip_spread_k': 0.11723520019566315, 'spread_hl_frac': 0.022915322199363555, 'bb_std_mult': 1.4691993325647508, 'rsi_os': 47, 'rsi_ob': 65, 'vol_spike': 0.17392969358874824, 'adx_thresh': 13.068042547961921, 'atr_min_pct': 0.008318349836221796, 'atr_max_pct': 0.042346750704150164, 'tp_mult': 1.7595850325651368, 'tsl_mult': 0.6742181946943033, 'strategy': 'mean_reversion', 'time_stop': 131, 'use_sma': True, 'use_atr': True, 'use_adx': False, 'use_ema': True, 'use_spike': True, 'rsi_required': True, 'edge_k': 0.11775163543080464, 'edge_cap': 0.9477486084913547, 'bull_strategy': 'mean_reversion', 'bull_bb_std_mult': 1.9625977702717927, 'bull_rsi_os': 38, 'bull_rsi_ob': 52, 'bull_adx_thresh': 33.76598643909768, 'bull_atr_min_pct': 0.02039844867999373, 'bull_atr_max_pct': 0.07562693662852878, 'bull_tp_mult': 1.1290948045608475, 'bull_tsl_mult': 0.31830179363060257, 'bull_time_stop': 159, 'bull_use_sma': False, 'bull_use_ema': False, 'bull_use_atr': False, 'bull_use_adx': False, 'bull_use_spike': True, 'bull_rsi_required': False, 'bear_strategy': 'mean_reversion', 'bear_bb_std_mult': 0.6226598890529075, 'bear_rsi_os': 30, 'bear_rsi_ob': 77, 'bear_adx_thresh': 22.153417147372977, 'bear_atr_min_pct': 0.022328582531893217, 'bear_atr_max_pct': 0.1359027291365157, 'bear_tp_mult': 1.799706725886604, 'bear_tsl_mult': 0.5843416313138694, 'bear_time_stop': 264, 'bear_use_sma': True, 'bear_use_ema': False, 'bear_use_atr': True, 'bear_use_adx': False, 'bear_use_spike': False, 'bear_rsi_required': True, 'sideways_strategy': 'mean_reversion', 'sideways_bb_std_mult': 2.8096702147800547, 'sideways_rsi_os': 44, 'sideways_rsi_ob': 59, 'sideways_adx_thresh': 26.928139527792442, 'sideways_atr_min_pct': 0.014390520801096115, 'sideways_atr_max_pct': 0.10444596290254415, 'sideways_tp_mult': 2.458514664586725, 'sideways_tsl_mult': 0.9824912782167271, 'sideways_time_stop': 88, 'sideways_use_sma': True, 'sideways_use_ema': True, 'sideways_use_atr': True, 'sideways_use_adx': False, 'sideways_use_spike': True, 'sideways_rsi_required': False}.
[I 2025-08-30 15:42:54,837] Trial 535 finished with values: [-1000000000.0, 1000000000.0] and parameters: {'p_sma': 6, 'p_std': 56, 'p_atr': 14, 'p_adx': 25, 'rsi_period': 75, 'ema1': 10, 'ema2': 36, 'slip_atr_k': 0.06580691457671216, 'slip_spread_k': 0.9617014334177776, 'spread_hl_frac': 0.02002802383569344, 'bb_std_mult': 1.1593248235612996, 'rsi_os': 21, 'rsi_ob': 64, 'vol_spike': 0.17437455852056927, 'adx_thresh': 12.404927860253201, 'atr_min_pct': 0.011102932316613344, 'atr_max_pct': 0.07485289438086991, 'tp_mult': 1.9361409121005226, 'tsl_mult': 0.7813864525295985, 'strategy': 'breakout', 'time_stop': 133, 'use_sma': False, 'use_atr': True, 'use_adx': False, 'use_ema': True, 'use_spike': False, 'rsi_required': False, 'edge_k': 1.8862096179281367, 'edge_cap': 0.5792996964503339, 'bull_strategy': 'mean_reversion', 'bull_bb_std_mult': 1.26308020472177, 'bull_rsi_os': 38, 'bull_rsi_ob': 53, 'bull_adx_thresh': 33.59305757351513, 'bull_atr_min_pct': 0.020605554892028647, 'bull_atr_max_pct': 0.06734772198485171, 'bull_tp_mult': 2.1425661722369216, 'bull_tsl_mult': 0.3163106384171323, 'bull_time_stop': 164, 'bull_use_sma': False, 'bull_use_ema': False, 'bull_use_atr': False, 'bull_use_adx': False, 'bull_use_spike': True, 'bull_rsi_required': False, 'bear_strategy': 'mean_reversion', 'bear_bb_std_mult': 0.6156346549535704, 'bear_rsi_os': 33, 'bear_rsi_ob': 54, 'bear_adx_thresh': 28.095422918540983, 'bear_atr_min_pct': 0.0220284645184134, 'bear_atr_max_pct': 0.04672594684967975, 'bear_tp_mult': 1.50940527109273, 'bear_tsl_mult': 0.9121784844719688, 'bear_time_stop': 61, 'bear_use_sma': True, 'bear_use_ema': True, 'bear_use_atr': True, 'bear_use_adx': False, 'bear_use_spike': True, 'bear_rsi_required': True, 'sideways_strategy': 'breakout', 'sideways_bb_std_mult': 2.759999401340488, 'sideways_rsi_os': 42, 'sideways_rsi_ob': 60, 'sideways_adx_thresh': 31.517343419146393, 'sideways_atr_min_pct': 0.0015752192671582696, 'sideways_atr_max_pct': 0.10078423207854763, 'sideways_tp_mult': 2.4526457915781563, 'sideways_tsl_mult': 0.9810622753067186, 'sideways_time_stop': 72, 'sideways_use_sma': True, 'sideways_use_ema': True, 'sideways_use_atr': True, 'sideways_use_adx': False, 'sideways_use_spike': True, 'sideways_rsi_required': True}.
[I 2025-08-30 15:42:55,724] Trial 538 finished with values: [-1000000000.0, 1000000000.0] and parameters: {'p_sma': 59, 'p_std': 38, 'p_atr': 26, 'p_adx': 26, 'rsi_period': 28, 'ema1': 29, 'ema2': 33, 'slip_atr_k': 0.0656497253418415, 'slip_spread_k': 0.1156021437314055, 'spread_hl_frac': 0.02248730212382633, 'bb_std_mult': 2.7021545517069194, 'rsi_os': 28, 'rsi_ob': 64, 'vol_spike': 0.1620985053762145, 'adx_thresh': 8.060835330566707, 'atr_min_pct': 0.008270013924496278, 'atr_max_pct': 0.08136650756647665, 'tp_mult': 2.3053452506292125, 'tsl_mult': 0.7371093141340896, 'strategy': 'breakout', 'time_stop': 132, 'use_sma': False, 'use_atr': True, 'use_adx': False, 'use_ema': True, 'use_spike': True, 'rsi_required': True, 'edge_k': 0.10633311113073396, 'edge_cap': 0.5926111234533361, 'bull_strategy': 'mean_reversion', 'bull_bb_std_mult': 2.666995739335713, 'bull_rsi_os': 37, 'bull_rsi_ob': 64, 'bull_adx_thresh': 23.307538213699633, 'bull_atr_min_pct': 0.02088006673756664, 'bull_atr_max_pct': 0.06677265439419347, 'bull_tp_mult': 2.0853705841318466, 'bull_tsl_mult': 0.9737691973845838, 'bull_time_stop': 158, 'bull_use_sma': False, 'bull_use_ema': False, 'bull_use_atr': False, 'bull_use_adx': False, 'bull_use_spike': True, 'bull_rsi_required': False, 'bear_strategy': 'mean_reversion', 'bear_bb_std_mult': 0.6256175123089003, 'bear_rsi_os': 33, 'bear_rsi_ob': 77, 'bear_adx_thresh': 15.697426197073437, 'bear_atr_min_pct': 0.022233535735952728, 'bear_atr_max_pct': 0.07551535030835534, 'bear_tp_mult': 1.628602347184422, 'bear_tsl_mult': 0.29271132002529376, 'bear_time_stop': 262, 'bear_use_sma': True, 'bear_use_ema': True, 'bear_use_atr': True, 'bear_use_adx': False, 'bear_use_spike': False, 'bear_rsi_required': True, 'sideways_strategy': 'mean_reversion', 'sideways_bb_std_mult': 1.00905912271853, 'sideways_rsi_os': 46, 'sideways_rsi_ob': 62, 'sideways_adx_thresh': 31.255400864380825, 'sideways_atr_min_pct': 0.0014386030406758968, 'sideways_atr_max_pct': 0.06551136074318975, 'sideways_tp_mult': 2.3201263343803644, 'sideways_tsl_mult': 0.9825999548048594, 'sideways_time_stop': 175, 'sideways_use_sma': True, 'sideways_use_ema': True, 'sideways_use_atr': True, 'sideways_use_adx': False, 'sideways_use_spike': True, 'sideways_rsi_required': False}.
[I 2025-08-30 15:42:56,534] Trial 539 finished with values: [-1000000000.0, 1000000000.0] and parameters: {'p_sma': 8, 'p_std': 10, 'p_atr': 26, 'p_adx': 25, 'rsi_period': 78, 'ema1': 30, 'ema2': 35, 'slip_atr_k': 0.08744897702183163, 'slip_spread_k': 0.14257466383387282, 'spread_hl_frac': 0.021207185836972398, 'bb_std_mult': 2.595582984218645, 'rsi_os': 21, 'rsi_ob': 61, 'vol_spike': 0.17144834037242257, 'adx_thresh': 13.035848924616733, 'atr_min_pct': 0.010272316837539961, 'atr_max_pct': 0.0801434095339159, 'tp_mult': 1.715303353288948, 'tsl_mult': 0.7955813386213149, 'strategy': 'mean_reversion', 'time_stop': 239, 'use_sma': True, 'use_atr': True, 'use_adx': False, 'use_ema': True, 'use_spike': True, 'rsi_required': True, 'edge_k': 0.11046828008735882, 'edge_cap': 0.9488989190067706, 'bull_strategy': 'mean_reversion', 'bull_bb_std_mult': 2.9556609973503307, 'bull_rsi_os': 36, 'bull_rsi_ob': 62, 'bull_adx_thresh': 33.67146074852597, 'bull_atr_min_pct': 0.020569645430336864, 'bull_atr_max_pct': 0.07491896284042131, 'bull_tp_mult': 2.2706116723774463, 'bull_tsl_mult': 0.31963947805253345, 'bull_time_stop': 156, 'bull_use_sma': False, 'bull_use_ema': False, 'bull_use_atr': False, 'bull_use_adx': False, 'bull_use_spike': True, 'bull_rsi_required': False, 'bear_strategy': 'mean_reversion', 'bear_bb_std_mult': 0.6436040920215035, 'bear_rsi_os': 33, 'bear_rsi_ob': 77, 'bear_adx_thresh': 28.70755104741602, 'bear_atr_min_pct': 0.008188806458670834, 'bear_atr_max_pct': 0.07792469325904096, 'bear_tp_mult': 1.7994463981984445, 'bear_tsl_mult': 0.4209799659665122, 'bear_time_stop': 181, 'bear_use_sma': True, 'bear_use_ema': False, 'bear_use_atr': True, 'bear_use_adx': False, 'bear_use_spike': False, 'bear_rsi_required': True, 'sideways_strategy': 'mean_reversion', 'sideways_bb_std_mult': 2.777728853922331, 'sideways_rsi_os': 44, 'sideways_rsi_ob': 60, 'sideways_adx_thresh': 13.779038636669398, 'sideways_atr_min_pct': 3.4297262122111425e-05, 'sideways_atr_max_pct': 0.10480490881409414, 'sideways_tp_mult': 2.5065922712235693, 'sideways_tsl_mult': 0.9797707694222173, 'sideways_time_stop': 85, 'sideways_use_sma': True, 'sideways_use_ema': True, 'sideways_use_atr': True, 'sideways_use_adx': False, 'sideways_use_spike': True, 'sideways_rsi_required': False}.
