[I 2025-08-30 15:00:46,190] Trial 325 finished with values: [-1000000000.0, 1000000000.0] and parameters: {'p_sma': 19, 'p_std': 52, 'p_atr': 15, 'p_adx': 23, 'rsi_period': 41, 'ema1': 15, 'ema2': 17, 'slip_atr_k': 0.029358680587297528, 'slip_spread_k': 0.5030852903682917, 'spread_hl_frac': 0.0012528256466351883, 'bb_std_mult': 3.4593612637749027, 'rsi_os': 32, 'rsi_ob': 94, 'vol_spike': 0.29154269848901937, 'adx_thresh': 30.955830083211737, 'atr_min_pct': 0.016505168864968157, 'atr_max_pct': 0.05862738852795638, 'tp_mult': 1.719865399446147, 'tsl_mult': 0.23707314322459788, 'strategy': 'breakout', 'time_stop': 129, 'use_sma': False, 'use_atr': False, 'use_adx': True, 'use_ema': False, 'use_spike': True, 'rsi_required': True, 'edge_k': 1.27150414160429, 'edge_cap': 0.31093078775089456, 'bull_strategy': 'mean_reversion', 'bull_bb_std_mult': 2.721575294785544, 'bull_rsi_os': 29, 'bull_rsi_ob': 86, 'bull_adx_thresh': 22.631300463286852, 'bull_atr_min_pct': 0.004876490374052178, 'bull_atr_max_pct': 0.08166693794900498, 'bull_tp_mult': 1.6883319629291402, 'bull_tsl_mult': 0.64896673798759, 'bull_time_stop': 81, 'bull_use_sma': False, 'bull_use_ema': False, 'bull_use_atr': False, 'bull_use_adx': True, 'bull_use_spike': False, 'bull_rsi_required': True, 'bear_strategy': 'mean_reversion', 'bear_bb_std_mult': 1.0106578592134048, 'bear_rsi_os': 10, 'bear_rsi_ob': 71, 'bear_adx_thresh': 30.782648928008832, 'bear_atr_min_pct': 0.015261872164774194, 'bear_atr_max_pct': 0.013261363732661766, 'bear_tp_mult': 1.3341805874244104, 'bear_tsl_mult': 0.025022298812345405, 'bear_time_stop': 144, 'bear_use_sma': False, 'bear_use_ema': True, 'bear_use_atr': True, 'bear_use_adx': False, 'bear_use_spike': False, 'bear_rsi_required': False, 'sideways_strategy': 'breakout', 'sideways_bb_std_mult': 3.5022621811145984, 'sideways_rsi_os': 40, 'sideways_rsi_ob': 69, 'sideways_adx_thresh': 29.39391166537016, 'sideways_atr_min_pct': 0.010847535471424419, 'sideways_atr_max_pct': 0.08599269778952405, 'sideways_tp_mult': 2.2239975318550447, 'sideways_tsl_mult': 0.4083532597091492, 'sideways_time_stop': 20, 'sideways_use_sma': False, 'sideways_use_ema': True, 'sideways_use_atr': True, 'sideways_use_adx': False, 'sideways_use_spike': False, 'sideways_rsi_required': False}.
[I 2025-08-30 15:00:46,535] Trial 322 finished with values: [-0.010766034105665123, 0.010748709783513838] and parameters: {'p_sma': 10, 'p_std': 52, 'p_atr': 15, 'p_adx': 23, 'rsi_period': 46, 'ema1': 29, 'ema2': 17, 'slip_atr_k': 0.03087014086615004, 'slip_spread_k': 0.6199711526591574, 'spread_hl_frac': 0.0009569784494908179, 'bb_std_mult': 3.457884748883072, 'rsi_os': 30, 'rsi_ob': 95, 'vol_spike': 0.28772829752421547, 'adx_thresh': 29.33875370484925, 'atr_min_pct': 0.01531334926589908, 'atr_max_pct': 0.0654846510588264, 'tp_mult': 1.3027608590194406, 'tsl_mult': 0.032184943955028064, 'strategy': 'breakout', 'time_stop': 124, 'use_sma': False, 'use_atr': False, 'use_adx': False, 'use_ema': False, 'use_spike': True, 'rsi_required': True, 'edge_k': 1.2584863279665848, 'edge_cap': 0.6582037243501125, 'bull_strategy': 'mean_reversion', 'bull_bb_std_mult': 2.558150238115914, 'bull_rsi_os': 29, 'bull_rsi_ob': 86, 'bull_adx_thresh': 23.802125340018684, 'bull_atr_min_pct': 0.005672688891670825, 'bull_atr_max_pct': 0.08294304397646725, 'bull_tp_mult': 1.6988389771480927, 'bull_tsl_mult': 0.6390836281380717, 'bull_time_stop': 105, 'bull_use_sma': False, 'bull_use_ema': False, 'bull_use_atr': False, 'bull_use_adx': False, 'bull_use_spike': False, 'bull_rsi_required': True, 'bear_strategy': 'mean_reversion', 'bear_bb_std_mult': 1.0055228244443988, 'bear_rsi_os': 10, 'bear_rsi_ob': 75, 'bear_adx_thresh': 30.62526302012526, 'bear_atr_min_pct': 0.013753778206028347, 'bear_atr_max_pct': 0.013878982144081321, 'bear_tp_mult': 1.328417773672832, 'bear_tsl_mult': 0.024212572211041075, 'bear_time_stop': 97, 'bear_use_sma': False, 'bear_use_ema': True, 'bear_use_atr': True, 'bear_use_adx': False, 'bear_use_spike': False, 'bear_rsi_required': False, 'sideways_strategy': 'breakout', 'sideways_bb_std_mult': 3.598428900392308, 'sideways_rsi_os': 39, 'sideways_rsi_ob': 57, 'sideways_adx_thresh': 27.472976512825362, 'sideways_atr_min_pct': 0.0018161974394454183, 'sideways_atr_max_pct': 0.08619520505700339, 'sideways_tp_mult': 2.233648023903087, 'sideways_tsl_mult': 0.4553906062438899, 'sideways_time_stop': 6, 'sideways_use_sma': False, 'sideways_use_ema': True, 'sideways_use_atr': True, 'sideways_use_adx': False, 'sideways_use_spike': True, 'sideways_rsi_required': False}.
[I 2025-08-30 15:01:22,350] Trial 326 finished with values: [-0.042411719152793514, 0.04231882078415523] and parameters: {'p_sma': 19, 'p_std': 52, 'p_atr': 15, 'p_adx': 23, 'rsi_period': 41, 'ema1': 14, 'ema2': 17, 'slip_atr_k': 0.03086590376574946, 'slip_spread_k': 0.5631362970942662, 'spread_hl_frac': 0.0009628567786701263, 'bb_std_mult': 3.4588719090792304, 'rsi_os': 32, 'rsi_ob': 94, 'vol_spike': 0.2910486529357032, 'adx_thresh': 30.903307198843283, 'atr_min_pct': 0.016483824936609867, 'atr_max_pct': 0.05852319501590085, 'tp_mult': 2.441093785923485, 'tsl_mult': 0.16251820821176208, 'strategy': 'breakout', 'time_stop': 129, 'use_sma': False, 'use_atr': False, 'use_adx': True, 'use_ema': False, 'use_spike': True, 'rsi_required': True, 'edge_k': 1.2963749398362496, 'edge_cap': 0.30048473419706195, 'bull_strategy': 'mean_reversion', 'bull_bb_std_mult': 2.5389749295459723, 'bull_rsi_os': 29, 'bull_rsi_ob': 86, 'bull_adx_thresh': 22.59392043821387, 'bull_atr_min_pct': 0.004870810692098753, 'bull_atr_max_pct': 0.08960738006377844, 'bull_tp_mult': 1.6848218212890056, 'bull_tsl_mult': 0.6371052168447722, 'bull_time_stop': 97, 'bull_use_sma': False, 'bull_use_ema': False, 'bull_use_atr': False, 'bull_use_adx': True, 'bull_use_spike': False, 'bull_rsi_required': True, 'bear_strategy': 'mean_reversion', 'bear_bb_std_mult': 2.451771656961834, 'bear_rsi_os': 10, 'bear_rsi_ob': 71, 'bear_adx_thresh': 30.527805871446326, 'bear_atr_min_pct': 0.01358163602267629, 'bear_atr_max_pct': 0.1230725038475469, 'bear_tp_mult': 1.3298607789187538, 'bear_tsl_mult': 0.028920383629646797, 'bear_time_stop': 110, 'bear_use_sma': False, 'bear_use_ema': True, 'bear_use_atr': True, 'bear_use_adx': True, 'bear_use_spike': False, 'bear_rsi_required': False, 'sideways_strategy': 'breakout', 'sideways_bb_std_mult': 3.501778799767316, 'sideways_rsi_os': 40, 'sideways_rsi_ob': 47, 'sideways_adx_thresh': 29.014487791065772, 'sideways_atr_min_pct': 0.00115257258701714, 'sideways_atr_max_pct': 0.13155442191362046, 'sideways_tp_mult': 2.21811429022331, 'sideways_tsl_mult': 0.35904158384069673, 'sideways_time_stop': 20, 'sideways_use_sma': False, 'sideways_use_ema': True, 'sideways_use_atr': True, 'sideways_use_adx': False, 'sideways_use_spike': False, 'sideways_rsi_required': False}.
[I 2025-08-30 15:01:23,179] Trial 328 finished with values: [-1000000000.0, 1000000000.0] and parameters: {'p_sma': 10, 'p_std': 49, 'p_atr': 14, 'p_adx': 23, 'rsi_period': 11, 'ema1': 28, 'ema2': 16, 'slip_atr_k': 0.02936058867798917, 'slip_spread_k': 0.5581804486558596, 'spread_hl_frac': 0.0008997901947056905, 'bb_std_mult': 3.5098434455582184, 'rsi_os': 32, 'rsi_ob': 95, 'vol_spike': 0.2797113127630889, 'adx_thresh': 31.63717410044104, 'atr_min_pct': 0.015316142211153736, 'atr_max_pct': 0.0639349121758505, 'tp_mult': 2.1893679139335496, 'tsl_mult': 0.09346667959108851, 'strategy': 'breakout', 'time_stop': 122, 'use_sma': False, 'use_atr': True, 'use_adx': False, 'use_ema': True, 'use_spike': True, 'rsi_required': True, 'edge_k': 1.314969774294195, 'edge_cap': 0.09008934757043624, 'bull_strategy': 'mean_reversion', 'bull_bb_std_mult': 2.5411360230696265, 'bull_rsi_os': 27, 'bull_rsi_ob': 83, 'bull_adx_thresh': 22.05167489539129, 'bull_atr_min_pct': 0.005071705084803339, 'bull_atr_max_pct': 0.09612238102505424, 'bull_tp_mult': 1.6524946608277813, 'bull_tsl_mult': 0.7579435265822355, 'bull_time_stop': 85, 'bull_use_sma': True, 'bull_use_ema': True, 'bull_use_atr': False, 'bull_use_adx': True, 'bull_use_spike': True, 'bull_rsi_required': False, 'bear_strategy': 'mean_reversion', 'bear_bb_std_mult': 2.428089339076601, 'bear_rsi_os': 9, 'bear_rsi_ob': 70, 'bear_adx_thresh': 28.71124521174598, 'bear_atr_min_pct': 0.01379707064721551, 'bear_atr_max_pct': 0.12213189472544428, 'bear_tp_mult': 1.3384117149766892, 'bear_tsl_mult': 0.03968964130916777, 'bear_time_stop': 105, 'bear_use_sma': False, 'bear_use_ema': True, 'bear_use_atr': True, 'bear_use_adx': True, 'bear_use_spike': False, 'bear_rsi_required': True, 'sideways_strategy': 'breakout', 'sideways_bb_std_mult': 3.4323441911183052, 'sideways_rsi_os': 38, 'sideways_rsi_ob': 47, 'sideways_adx_thresh': 28.12057867635634, 'sideways_atr_min_pct': 0.027319113004679152, 'sideways_atr_max_pct': 0.017547096201951752, 'sideways_tp_mult': 2.1484449948877904, 'sideways_tsl_mult': 0.4511655733968829, 'sideways_time_stop': 8, 'sideways_use_sma': True, 'sideways_use_ema': True, 'sideways_use_atr': True, 'sideways_use_adx': False, 'sideways_use_spike': True, 'sideways_rsi_required': False}.
[I 2025-08-30 15:01:23,438] Trial 329 finished with values: [-0.017480428754128696, 0.017419694112514254] and parameters: {'p_sma': 10, 'p_std': 53, 'p_atr': 16, 'p_adx': 23, 'rsi_period': 76, 'ema1': 30, 'ema2': 17, 'slip_atr_k': 0.04536543749983136, 'slip_spread_k': 0.6141290036816599, 'spread_hl_frac': 0.002157648177870455, 'bb_std_mult': 3.4292371478327506, 'rsi_os': 29, 'rsi_ob': 95, 'vol_spike': 0.2979104192141917, 'adx_thresh': 29.002283106403354, 'atr_min_pct': 0.014009178301628542, 'atr_max_pct': 0.06972248473615825, 'tp_mult': 1.1001781471071699, 'tsl_mult': 0.03158910007852819, 'strategy': 'breakout', 'time_stop': 113, 'use_sma': False, 'use_atr': True, 'use_adx': False, 'use_ema': True, 'use_spike': True, 'rsi_required': True, 'edge_k': 1.0706274593035936, 'edge_cap': 0.6184044710238781, 'bull_strategy': 'mean_reversion', 'bull_bb_std_mult': 2.547196645194847, 'bull_rsi_os': 31, 'bull_rsi_ob': 87, 'bull_adx_thresh': 24.912624494077917, 'bull_atr_min_pct': 0.00683950644828925, 'bull_atr_max_pct': 0.08067004233832097, 'bull_tp_mult': 1.641365076854348, 'bull_tsl_mult': 0.6225101985536162, 'bull_time_stop': 106, 'bull_use_sma': False, 'bull_use_ema': False, 'bull_use_atr': False, 'bull_use_adx': False, 'bull_use_spike': True, 'bull_rsi_required': True, 'bear_strategy': 'mean_reversion', 'bear_bb_std_mult': 0.9569574928437946, 'bear_rsi_os': 8, 'bear_rsi_ob': 75, 'bear_adx_thresh': 31.059485577485486, 'bear_atr_min_pct': 0.01513615325848824, 'bear_atr_max_pct': 0.010974537167385154, 'bear_tp_mult': 1.3373411260021477, 'bear_tsl_mult': 0.04194688919076919, 'bear_time_stop': 107, 'bear_use_sma': False, 'bear_use_ema': True, 'bear_use_atr': True, 'bear_use_adx': False, 'bear_use_spike': False, 'bear_rsi_required': True, 'sideways_strategy': 'breakout', 'sideways_bb_std_mult': 3.595107038418733, 'sideways_rsi_os': 42, 'sideways_rsi_ob': 57, 'sideways_adx_thresh': 26.84601703148577, 'sideways_atr_min_pct': 0.0011401404788742488, 'sideways_atr_max_pct': 0.09138032466269427, 'sideways_tp_mult': 2.2948424302127557, 'sideways_tsl_mult': 0.4614051901645624, 'sideways_time_stop': 6, 'sideways_use_sma': True, 'sideways_use_ema': True, 'sideways_use_atr': True, 'sideways_use_adx': False, 'sideways_use_spike': True, 'sideways_rsi_required': False}.
[I 2025-08-30 15:01:23,528] Trial 327 finished with values: [-0.01746425207978064, 0.01737019049575781] and parameters: {'p_sma': 10, 'p_std': 52, 'p_atr': 14, 'p_adx': 23, 'rsi_period': 44, 'ema1': 28, 'ema2': 17, 'slip_atr_k': 0.03267358669644473, 'slip_spread_k': 0.5682028201503444, 'spread_hl_frac': 0.0005544845569649428, 'bb_std_mult': 3.46892281760483, 'rsi_os': 31, 'rsi_ob': 94, 'vol_spike': 0.2710858077789894, 'adx_thresh': 31.215365183327194, 'atr_min_pct': 0.01518770656513653, 'atr_max_pct': 0.06273234616208023, 'tp_mult': 2.4422735625912617, 'tsl_mult': 0.1218594350254215, 'strategy': 'breakout', 'time_stop': 115, 'use_sma': False, 'use_atr': False, 'use_adx': False, 'use_ema': False, 'use_spike': True, 'rsi_required': True, 'edge_k': 1.293317086537661, 'edge_cap': 0.3062611813908741, 'bull_strategy': 'mean_reversion', 'bull_bb_std_mult': 2.5241898785058323, 'bull_rsi_os': 27, 'bull_rsi_ob': 83, 'bull_adx_thresh': 22.443010775633287, 'bull_atr_min_pct': 0.00477114748847999, 'bull_atr_max_pct': 0.08052785398226031, 'bull_tp_mult': 1.6565196685745518, 'bull_tsl_mult': 0.7202522716221009, 'bull_time_stop': 82, 'bull_use_sma': False, 'bull_use_ema': True, 'bull_use_atr': False, 'bull_use_adx': True, 'bull_use_spike': False, 'bull_rsi_required': True, 'bear_strategy': 'mean_reversion', 'bear_bb_std_mult': 1.068730149179339, 'bear_rsi_os': 10, 'bear_rsi_ob': 71, 'bear_adx_thresh': 28.90908487591455, 'bear_atr_min_pct': 0.015426745111663446, 'bear_atr_max_pct': 0.12271497313194334, 'bear_tp_mult': 1.3182557237283443, 'bear_tsl_mult': 0.026973378088150545, 'bear_time_stop': 103, 'bear_use_sma': False, 'bear_use_ema': True, 'bear_use_atr': True, 'bear_use_adx': True, 'bear_use_spike': False, 'bear_rsi_required': False, 'sideways_strategy': 'breakout', 'sideways_bb_std_mult': 3.4952245423060995, 'sideways_rsi_os': 38, 'sideways_rsi_ob': 57, 'sideways_adx_thresh': 28.180441973002885, 'sideways_atr_min_pct': 0.0011154487231935547, 'sideways_atr_max_pct': 0.019347869319670502, 'sideways_tp_mult': 2.2214332755030908, 'sideways_tsl_mult': 0.37056800538632606, 'sideways_time_stop': 21, 'sideways_use_sma': True, 'sideways_use_ema': True, 'sideways_use_atr': True, 'sideways_use_adx': False, 'sideways_use_spike': True, 'sideways_rsi_required': False}.
[I 2025-08-30 15:01:58,917] Trial 330 finished with values: [-0.03506492991942434, 0.034995672502279224] and parameters: {'p_sma': 10, 'p_std': 54, 'p_atr': 16, 'p_adx': 23, 'rsi_period': 47, 'ema1': 30, 'ema2': 18, 'slip_atr_k': 0.04357567142950978, 'slip_spread_k': 0.6148617921719542, 'spread_hl_frac': 0.01666935389314432, 'bb_std_mult': 3.40207733053296, 'rsi_os': 29, 'rsi_ob': 95, 'vol_spike': 0.2957067822265502, 'adx_thresh': 28.968915609923314, 'atr_min_pct': 0.013916379309734387, 'atr_max_pct': 0.07000933763387139, 'tp_mult': 1.0260060500898414, 'tsl_mult': 0.025400874855149122, 'strategy': 'breakout', 'time_stop': 113, 'use_sma': False, 'use_atr': True, 'use_adx': False, 'use_ema': True, 'use_spike': True, 'rsi_required': True, 'edge_k': 1.179983399889422, 'edge_cap': 0.5989632041493612, 'bull_strategy': 'mean_reversion', 'bull_bb_std_mult': 2.572696425025346, 'bull_rsi_os': 31, 'bull_rsi_ob': 87, 'bull_adx_thresh': 24.968328932458522, 'bull_atr_min_pct': 0.006755657056009684, 'bull_atr_max_pct': 0.08032378292763707, 'bull_tp_mult': 1.6312104319297964, 'bull_tsl_mult': 0.6222492389081123, 'bull_time_stop': 105, 'bull_use_sma': False, 'bull_use_ema': True, 'bull_use_atr': False, 'bull_use_adx': False, 'bull_use_spike': True, 'bull_rsi_required': True, 'bear_strategy': 'mean_reversion', 'bear_bb_std_mult': 0.9539961716516998, 'bear_rsi_os': 9, 'bear_rsi_ob': 75, 'bear_adx_thresh': 31.130600376434533, 'bear_atr_min_pct': 0.014116493534332355, 'bear_atr_max_pct': 0.0119389347082178, 'bear_tp_mult': 1.3063492716993883, 'bear_tsl_mult': 0.04188855436090036, 'bear_time_stop': 96, 'bear_use_sma': False, 'bear_use_ema': True, 'bear_use_atr': True, 'bear_use_adx': False, 'bear_use_spike': False, 'bear_rsi_required': True, 'sideways_strategy': 'breakout', 'sideways_bb_std_mult': 3.5804343774072516, 'sideways_rsi_os': 42, 'sideways_rsi_ob': 56, 'sideways_adx_thresh': 26.57285505249091, 'sideways_atr_min_pct': 0.0009073313982427536, 'sideways_atr_max_pct': 0.08924937293633234, 'sideways_tp_mult': 2.274682728329528, 'sideways_tsl_mult': 0.4489754093364358, 'sideways_time_stop': 6, 'sideways_use_sma': True, 'sideways_use_ema': True, 'sideways_use_atr': True, 'sideways_use_adx': False, 'sideways_use_spike': True, 'sideways_rsi_required': False}.
[I 2025-08-30 15:01:59,365] Trial 333 finished with values: [-0.021820964486161554, 0.02177045704276124] and parameters: {'p_sma': 9, 'p_std': 54, 'p_atr': 16, 'p_adx': 7, 'rsi_period': 76, 'ema1': 30, 'ema2': 17, 'slip_atr_k': 0.04471676799285036, 'slip_spread_k': 0.6146753824812774, 'spread_hl_frac': 0.002361270500863412, 'bb_std_mult': 3.4112123119146127, 'rsi_os': 28, 'rsi_ob': 74, 'vol_spike': 0.29945138350768014, 'adx_thresh': 29.065201283351588, 'atr_min_pct': 0.01359760712306123, 'atr_max_pct': 0.07035892922886172, 'tp_mult': 1.0486112512381083, 'tsl_mult': 0.025693161041080104, 'strategy': 'breakout', 'time_stop': 110, 'use_sma': False, 'use_atr': False, 'use_adx': False, 'use_ema': False, 'use_spike': True, 'rsi_required': True, 'edge_k': 1.1641665929709344, 'edge_cap': 0.619556731470898, 'bull_strategy': 'mean_reversion', 'bull_bb_std_mult': 2.59112325236589, 'bull_rsi_os': 31, 'bull_rsi_ob': 87, 'bull_adx_thresh': 24.535238831389318, 'bull_atr_min_pct': 0.006794689425821929, 'bull_atr_max_pct': 0.07902019042398108, 'bull_tp_mult': 1.6295018635526979, 'bull_tsl_mult': 0.6202541101169451, 'bull_time_stop': 106, 'bull_use_sma': False, 'bull_use_ema': False, 'bull_use_atr': False, 'bull_use_adx': False, 'bull_use_spike': True, 'bull_rsi_required': True, 'bear_strategy': 'mean_reversion', 'bear_bb_std_mult': 0.9427777409074598, 'bear_rsi_os': 8, 'bear_rsi_ob': 75, 'bear_adx_thresh': 31.22877394730242, 'bear_atr_min_pct': 0.015316256204178546, 'bear_atr_max_pct': 0.011261938246774414, 'bear_tp_mult': 1.3077945843441396, 'bear_tsl_mult': 0.05288294233970198, 'bear_time_stop': 98, 'bear_use_sma': True, 'bear_use_ema': True, 'bear_use_atr': True, 'bear_use_adx': False, 'bear_use_spike': False, 'bear_rsi_required': False, 'sideways_strategy': 'breakout', 'sideways_bb_std_mult': 3.5980187204697214, 'sideways_rsi_os': 40, 'sideways_rsi_ob': 57, 'sideways_adx_thresh': 26.35783568782397, 'sideways_atr_min_pct': 0.0005153511191047424, 'sideways_atr_max_pct': 0.09014369299559642, 'sideways_tp_mult': 2.2954336995390845, 'sideways_tsl_mult': 0.464749252372229, 'sideways_time_stop': 6, 'sideways_use_sma': True, 'sideways_use_ema': True, 'sideways_use_atr': True, 'sideways_use_adx': False, 'sideways_use_spike': True, 'sideways_rsi_required': False}.
[I 2025-08-30 15:01:59,377] Trial 332 finished with values: [-0.03640047840226035, 0.03631838905019666] and parameters: {'p_sma': 9, 'p_std': 54, 'p_atr': 16, 'p_adx': 7, 'rsi_period': 77, 'ema1': 30, 'ema2': 17, 'slip_atr_k': 0.042937327167010174, 'slip_spread_k': 0.6123851311236244, 'spread_hl_frac': 0.0022215718672737245, 'bb_std_mult': 3.4288081647025628, 'rsi_os': 29, 'rsi_ob': 81, 'vol_spike': 0.2986426982070135, 'adx_thresh': 29.157626897333223, 'atr_min_pct': 0.014088432533205594, 'atr_max_pct': 0.07042946842252618, 'tp_mult': 1.03689640073092, 'tsl_mult': 0.026525328406502787, 'strategy': 'breakout', 'time_stop': 112, 'use_sma': False, 'use_atr': False, 'use_adx': False, 'use_ema': False, 'use_spike': True, 'rsi_required': True, 'edge_k': 1.1824123630646117, 'edge_cap': 0.6195589464421121, 'bull_strategy': 'mean_reversion', 'bull_bb_std_mult': 2.613192474646574, 'bull_rsi_os': 30, 'bull_rsi_ob': 87, 'bull_adx_thresh': 24.233237963483592, 'bull_atr_min_pct': 0.006899611302410701, 'bull_atr_max_pct': 0.07857297001783926, 'bull_tp_mult': 1.859401845329898, 'bull_tsl_mult': 0.6302962030434518, 'bull_time_stop': 115, 'bull_use_sma': False, 'bull_use_ema': False, 'bull_use_atr': False, 'bull_use_adx': False, 'bull_use_spike': True, 'bull_rsi_required': True, 'bear_strategy': 'mean_reversion', 'bear_bb_std_mult': 0.9594556287901927, 'bear_rsi_os': 6, 'bear_rsi_ob': 75, 'bear_adx_thresh': 31.16297194787529, 'bear_atr_min_pct': 0.015534113740567308, 'bear_atr_max_pct': 0.01169860290722993, 'bear_tp_mult': 1.3146186489236444, 'bear_tsl_mult': 0.051884176610145105, 'bear_time_stop': 78, 'bear_use_sma': False, 'bear_use_ema': True, 'bear_use_atr': True, 'bear_use_adx': False, 'bear_use_spike': False, 'bear_rsi_required': True, 'sideways_strategy': 'breakout', 'sideways_bb_std_mult': 3.5938222546257013, 'sideways_rsi_os': 42, 'sideways_rsi_ob': 58, 'sideways_adx_thresh': 26.22991043228379, 'sideways_atr_min_pct': 0.00047281850956238736, 'sideways_atr_max_pct': 0.095045800690514, 'sideways_tp_mult': 2.2973753935723846, 'sideways_tsl_mult': 0.4726772234499036, 'sideways_time_stop': 10, 'sideways_use_sma': False, 'sideways_use_ema': True, 'sideways_use_atr': True, 'sideways_use_adx': False, 'sideways_use_spike': True, 'sideways_rsi_required': False}.
