[I 2025-08-30 16:02:48,335] Trial 633 finished with values: [-1000000000.0, 1000000000.0] and parameters: {'p_sma': 7, 'p_std': 59, 'p_atr': 14, 'p_adx': 26, 'rsi_period': 19, 'ema1': 6, 'ema2': 40, 'slip_atr_k': 0.06299981930143735, 'slip_spread_k': 0.15791297447812475, 'spread_hl_frac': 0.027556292571557863, 'bb_std_mult': 1.5728323762909207, 'rsi_os': 23, 'rsi_ob': 45, 'vol_spike': 0.15085046557939405, 'adx_thresh': 13.065652452037945, 'atr_min_pct': 0.02599149687860644, 'atr_max_pct': 0.07973933058561254, 'tp_mult': 1.9013590914283784, 'tsl_mult': 0.3770981114588954, 'strategy': 'breakout', 'time_stop': 74, 'use_sma': False, 'use_atr': True, 'use_adx': False, 'use_ema': False, 'use_spike': False, 'rsi_required': False, 'edge_k': 0.15134256837285542, 'edge_cap': 0.5730279129514, 'bull_strategy': 'mean_reversion', 'bull_bb_std_mult': 2.7429603511075724, 'bull_rsi_os': 35, 'bull_rsi_ob': 49, 'bull_adx_thresh': 22.304756837398376, 'bull_atr_min_pct': 0.021596356985278783, 'bull_atr_max_pct': 0.06688267506348751, 'bull_tp_mult': 2.1385096755409356, 'bull_tsl_mult': 0.2539118189988965, 'bull_time_stop': 40, 'bull_use_sma': False, 'bull_use_ema': True, 'bull_use_atr': True, 'bull_use_adx': True, 'bull_use_spike': True, 'bull_rsi_required': False, 'bear_strategy': 'breakout', 'bear_bb_std_mult': 2.841846725260039, 'bear_rsi_os': 27, 'bear_rsi_ob': 75, 'bear_adx_thresh': 34.40089828426905, 'bear_atr_min_pct': 0.02215883934386518, 'bear_atr_max_pct': 0.06903348085431059, 'bear_tp_mult': 2.529536845881419, 'bear_tsl_mult': 0.8924715439780673, 'bear_time_stop': 63, 'bear_use_sma': True, 'bear_use_ema': True, 'bear_use_atr': False, 'bear_use_adx': False, 'bear_use_spike': True, 'bear_rsi_required': False, 'sideways_strategy': 'breakout', 'sideways_bb_std_mult': 1.4583896798027767, 'sideways_rsi_os': 21, 'sideways_rsi_ob': 81, 'sideways_adx_thresh': 34.20649364226628, 'sideways_atr_min_pct': 0.0004341776804822711, 'sideways_atr_max_pct': 0.09460470868237059, 'sideways_tp_mult': 1.9759005526505586, 'sideways_tsl_mult': 0.5970337539711886, 'sideways_time_stop': 104, 'sideways_use_sma': True, 'sideways_use_ema': False, 'sideways_use_atr': True, 'sideways_use_adx': False, 'sideways_use_spike': False, 'sideways_rsi_required': True}.
[I 2025-08-30 16:02:48,755] Trial 632 finished with values: [-1000000000.0, 1000000000.0] and parameters: {'p_sma': 7, 'p_std': 60, 'p_atr': 14, 'p_adx': 16, 'rsi_period': 12, 'ema1': 7, 'ema2': 55, 'slip_atr_k': 0.061060166305777326, 'slip_spread_k': 0.15479583286534057, 'spread_hl_frac': 0.02703540086559699, 'bb_std_mult': 1.5689212888750013, 'rsi_os': 49, 'rsi_ob': 73, 'vol_spike': 0.14844540146028984, 'adx_thresh': 12.893614017892128, 'atr_min_pct': 0.01012013544993976, 'atr_max_pct': 0.07957806985395303, 'tp_mult': 1.449067197453763, 'tsl_mult': 0.753524061587685, 'strategy': 'breakout', 'time_stop': 200, 'use_sma': False, 'use_atr': True, 'use_adx': False, 'use_ema': False, 'use_spike': False, 'rsi_required': True, 'edge_k': 0.14707667255920678, 'edge_cap': 0.56772159846874, 'bull_strategy': 'mean_reversion', 'bull_bb_std_mult': 2.887678005531307, 'bull_rsi_os': 40, 'bull_rsi_ob': 51, 'bull_adx_thresh': 22.255068199805905, 'bull_atr_min_pct': 0.02275450723796455, 'bull_atr_max_pct': 0.06774593484499353, 'bull_tp_mult': 1.0429909112801379, 'bull_tsl_mult': 0.21058731146038123, 'bull_time_stop': 168, 'bull_use_sma': False, 'bull_use_ema': False, 'bull_use_atr': False, 'bull_use_adx': True, 'bull_use_spike': True, 'bull_rsi_required': False, 'bear_strategy': 'mean_reversion', 'bear_bb_std_mult': 1.3721288658086594, 'bear_rsi_os': 30, 'bear_rsi_ob': 75, 'bear_adx_thresh': 29.404450893682153, 'bear_atr_min_pct': 0.022526121516334575, 'bear_atr_max_pct': 0.06952401425894165, 'bear_tp_mult': 2.376835173774622, 'bear_tsl_mult': 0.9994068043274388, 'bear_time_stop': 64, 'bear_use_sma': True, 'bear_use_ema': True, 'bear_use_atr': False, 'bear_use_adx': False, 'bear_use_spike': False, 'bear_rsi_required': False, 'sideways_strategy': 'breakout', 'sideways_bb_std_mult': 2.321146988094834, 'sideways_rsi_os': 43, 'sideways_rsi_ob': 57, 'sideways_adx_thresh': 26.22902254887731, 'sideways_atr_min_pct': 0.01609654234772865, 'sideways_atr_max_pct': 0.09314709060992209, 'sideways_tp_mult': 2.401371581719814, 'sideways_tsl_mult': 0.9998748429108658, 'sideways_time_stop': 92, 'sideways_use_sma': True, 'sideways_use_ema': True, 'sideways_use_atr': True, 'sideways_use_adx': False, 'sideways_use_spike': False, 'sideways_rsi_required': False}.
[I 2025-08-30 16:02:50,051] Trial 630 finished with values: [-1000000000.0, 1000000000.0] and parameters: {'p_sma': 6, 'p_std': 46, 'p_atr': 14, 'p_adx': 24, 'rsi_period': 84, 'ema1': 29, 'ema2': 26, 'slip_atr_k': 0.061069478816727286, 'slip_spread_k': 0.09814645095446208, 'spread_hl_frac': 0.012851675316660689, 'bb_std_mult': 1.1851333468815406, 'rsi_os': 55, 'rsi_ob': 75, 'vol_spike': 0.09321924108850317, 'adx_thresh': 13.318789492566562, 'atr_min_pct': 0.012340415793700935, 'atr_max_pct': 0.08001335642941283, 'tp_mult': 1.4337093745976763, 'tsl_mult': 0.6992424445448479, 'strategy': 'breakout', 'time_stop': 75, 'use_sma': False, 'use_atr': True, 'use_adx': True, 'use_ema': True, 'use_spike': False, 'rsi_required': True, 'edge_k': 0.14422662242642068, 'edge_cap': 0.5664693450633962, 'bull_strategy': 'mean_reversion', 'bull_bb_std_mult': 2.8690080967769624, 'bull_rsi_os': 46, 'bull_rsi_ob': 50, 'bull_adx_thresh': 22.26679071128679, 'bull_atr_min_pct': 0.021736734549059347, 'bull_atr_max_pct': 0.05834290706323605, 'bull_tp_mult': 2.2229299516200554, 'bull_tsl_mult': 0.2851618669480695, 'bull_time_stop': 161, 'bull_use_sma': False, 'bull_use_ema': False, 'bull_use_atr': False, 'bull_use_adx': False, 'bull_use_spike': True, 'bull_rsi_required': False, 'bear_strategy': 'mean_reversion', 'bear_bb_std_mult': 2.135473160146053, 'bear_rsi_os': 28, 'bear_rsi_ob': 78, 'bear_adx_thresh': 27.03340120793695, 'bear_atr_min_pct': 0.021669383414046443, 'bear_atr_max_pct': 0.1079124738264009, 'bear_tp_mult': 2.544037979161617, 'bear_tsl_mult': 0.7541331888861706, 'bear_time_stop': 53, 'bear_use_sma': True, 'bear_use_ema': True, 'bear_use_atr': True, 'bear_use_adx': False, 'bear_use_spike': False, 'bear_rsi_required': True, 'sideways_strategy': 'mean_reversion', 'sideways_bb_std_mult': 1.287235730486834, 'sideways_rsi_os': 21, 'sideways_rsi_ob': 57, 'sideways_adx_thresh': 26.35462440506978, 'sideways_atr_min_pct': 0.0020790823660873942, 'sideways_atr_max_pct': 0.13168735955156743, 'sideways_tp_mult': 2.4099148627331184, 'sideways_tsl_mult': 0.5950979255901581, 'sideways_time_stop': 106, 'sideways_use_sma': True, 'sideways_use_ema': True, 'sideways_use_atr': True, 'sideways_use_adx': False, 'sideways_use_spike': True, 'sideways_rsi_required': False}.
[I 2025-08-30 16:02:50,941] Trial 631 finished with values: [-1000000000.0, 1000000000.0] and parameters: {'p_sma': 52, 'p_std': 46, 'p_atr': 14, 'p_adx': 26, 'rsi_period': 54, 'ema1': 29, 'ema2': 30, 'slip_atr_k': 0.06142529683550915, 'slip_spread_k': 0.08943184347886406, 'spread_hl_frac': 0.04914954381737621, 'bb_std_mult': 2.8643192092078764, 'rsi_os': 51, 'rsi_ob': 79, 'vol_spike': 0.1523301684786406, 'adx_thresh': 18.808970664336123, 'atr_min_pct': 0.013980042866664504, 'atr_max_pct': 0.029849105110019675, 'tp_mult': 1.9540518136710263, 'tsl_mult': 0.7006436176759253, 'strategy': 'breakout', 'time_stop': 132, 'use_sma': False, 'use_atr': True, 'use_adx': False, 'use_ema': False, 'use_spike': False, 'rsi_required': True, 'edge_k': 0.14735389012184938, 'edge_cap': 0.1519448370426168, 'bull_strategy': 'mean_reversion', 'bull_bb_std_mult': 0.8847015322102758, 'bull_rsi_os': 46, 'bull_rsi_ob': 49, 'bull_adx_thresh': 22.29936243879086, 'bull_atr_min_pct': 0.019449064859206396, 'bull_atr_max_pct': 0.06663717360292085, 'bull_tp_mult': 2.0860358913245216, 'bull_tsl_mult': 0.247980441079938, 'bull_time_stop': 162, 'bull_use_sma': False, 'bull_use_ema': False, 'bull_use_atr': False, 'bull_use_adx': False, 'bull_use_spike': True, 'bull_rsi_required': False, 'bear_strategy': 'mean_reversion', 'bear_bb_std_mult': 3.2033779168439365, 'bear_rsi_os': 30, 'bear_rsi_ob': 71, 'bear_adx_thresh': 13.571643073459507, 'bear_atr_min_pct': 0.02161270241670642, 'bear_atr_max_pct': 0.1020971551066567, 'bear_tp_mult': 1.768247074131216, 'bear_tsl_mult': 0.7234004864979133, 'bear_time_stop': 62, 'bear_use_sma': True, 'bear_use_ema': True, 'bear_use_atr': False, 'bear_use_adx': False, 'bear_use_spike': False, 'bear_rsi_required': False, 'sideways_strategy': 'mean_reversion', 'sideways_bb_std_mult': 2.0040481636759298, 'sideways_rsi_os': 13, 'sideways_rsi_ob': 57, 'sideways_adx_thresh': 27.864011523117387, 'sideways_atr_min_pct': 7.160321837841729e-06, 'sideways_atr_max_pct': 0.1339754759875748, 'sideways_tp_mult': 2.411594308751266, 'sideways_tsl_mult': 0.9820148848536019, 'sideways_time_stop': 94, 'sideways_use_sma': True, 'sideways_use_ema': True, 'sideways_use_atr': True, 'sideways_use_adx': False, 'sideways_use_spike': False, 'sideways_rsi_required': False}.
[I 2025-08-30 16:03:35,739] Trial 636 finished with values: [-1000000000.0, 1000000000.0] and parameters: {'p_sma': 18, 'p_std': 39, 'p_atr': 15, 'p_adx': 25, 'rsi_period': 73, 'ema1': 30, 'ema2': 12, 'slip_atr_k': 0.0685932214018158, 'slip_spread_k': 0.7295437651188502, 'spread_hl_frac': 0.023222499209464842, 'bb_std_mult': 1.031298154798916, 'rsi_os': 24, 'rsi_ob': 74, 'vol_spike': 0.010425848312291264, 'adx_thresh': 12.048385998445841, 'atr_min_pct': 0.014282697114585784, 'atr_max_pct': 0.038613422596669944, 'tp_mult': 1.8613701909103044, 'tsl_mult': 0.7815266222798787, 'strategy': 'breakout', 'time_stop': 132, 'use_sma': False, 'use_atr': True, 'use_adx': False, 'use_ema': True, 'use_spike': True, 'rsi_required': True, 'edge_k': 0.20895678074138774, 'edge_cap': 0.5382148753084361, 'bull_strategy': 'mean_reversion', 'bull_bb_std_mult': 1.543144380919232, 'bull_rsi_os': 55, 'bull_rsi_ob': 51, 'bull_adx_thresh': 21.297035637577718, 'bull_atr_min_pct': 0.02100302268871305, 'bull_atr_max_pct': 0.12038611373558841, 'bull_tp_mult': 2.128638623984455, 'bull_tsl_mult': 0.3423945152182562, 'bull_time_stop': 156, 'bull_use_sma': False, 'bull_use_ema': False, 'bull_use_atr': False, 'bull_use_adx': False, 'bull_use_spike': True, 'bull_rsi_required': False, 'bear_strategy': 'breakout', 'bear_bb_std_mult': 0.6716609170311946, 'bear_rsi_os': 29, 'bear_rsi_ob': 77, 'bear_adx_thresh': 30.89136700876275, 'bear_atr_min_pct': 0.023749618372532113, 'bear_atr_max_pct': 0.10037736470108134, 'bear_tp_mult': 2.718795657053322, 'bear_tsl_mult': 0.9671214931593629, 'bear_time_stop': 72, 'bear_use_sma': True, 'bear_use_ema': True, 'bear_use_atr': True, 'bear_use_adx': False, 'bear_use_spike': False, 'bear_rsi_required': True, 'sideways_strategy': 'breakout', 'sideways_bb_std_mult': 1.997855349927445, 'sideways_rsi_os': 42, 'sideways_rsi_ob': 54, 'sideways_adx_thresh': 29.128445555219066, 'sideways_atr_min_pct': 0.01985491793384551, 'sideways_atr_max_pct': 0.11151653239334194, 'sideways_tp_mult': 2.076368582370138, 'sideways_tsl_mult': 0.9470534906596956, 'sideways_time_stop': 74, 'sideways_use_sma': True, 'sideways_use_ema': False, 'sideways_use_atr': True, 'sideways_use_adx': False, 'sideways_use_spike': True, 'sideways_rsi_required': False}.
[I 2025-08-30 16:03:38,062] Trial 637 finished with values: [-1000000000.0, 1000000000.0] and parameters: {'p_sma': 5, 'p_std': 36, 'p_atr': 28, 'p_adx': 29, 'rsi_period': 73, 'ema1': 20, 'ema2': 34, 'slip_atr_k': 0.162831087273203, 'slip_spread_k': 0.7290116373307426, 'spread_hl_frac': 0.045035223562602256, 'bb_std_mult': 1.3573224389228387, 'rsi_os': 44, 'rsi_ob': 72, 'vol_spike': 0.07316241204771884, 'adx_thresh': 12.131875729087692, 'atr_min_pct': 0.013365489319597192, 'atr_max_pct': 0.042391240655075796, 'tp_mult': 2.1831903609551784, 'tsl_mult': 0.3344400094959271, 'strategy': 'breakout', 'time_stop': 276, 'use_sma': False, 'use_atr': True, 'use_adx': False, 'use_ema': True, 'use_spike': True, 'rsi_required': False, 'edge_k': 0.2071904527360869, 'edge_cap': 0.6219906466310774, 'bull_strategy': 'mean_reversion', 'bull_bb_std_mult': 2.634239776033559, 'bull_rsi_os': 7, 'bull_rsi_ob': 69, 'bull_adx_thresh': 21.380902444808854, 'bull_atr_min_pct': 0.0211279923570958, 'bull_atr_max_pct': 0.1187365319976965, 'bull_tp_mult': 2.1434391279827296, 'bull_tsl_mult': 0.28332087785270826, 'bull_time_stop': 155, 'bull_use_sma': True, 'bull_use_ema': True, 'bull_use_atr': True, 'bull_use_adx': False, 'bull_use_spike': True, 'bull_rsi_required': False, 'bear_strategy': 'breakout', 'bear_bb_std_mult': 0.694579092411158, 'bear_rsi_os': 50, 'bear_rsi_ob': 74, 'bear_adx_thresh': 30.16889781942822, 'bear_atr_min_pct': 0.004414048977042765, 'bear_atr_max_pct': 0.08887091847707837, 'bear_tp_mult': 1.5744896965929922, 'bear_tsl_mult': 0.8533532637736914, 'bear_time_stop': 74, 'bear_use_sma': True, 'bear_use_ema': True, 'bear_use_atr': True, 'bear_use_adx': False, 'bear_use_spike': True, 'bear_rsi_required': True, 'sideways_strategy': 'breakout', 'sideways_bb_std_mult': 1.6980392873790922, 'sideways_rsi_os': 42, 'sideways_rsi_ob': 60, 'sideways_adx_thresh': 26.927321320542028, 'sideways_atr_min_pct': 0.0016090599394430183, 'sideways_atr_max_pct': 0.10793134641995236, 'sideways_tp_mult': 2.320675802657146, 'sideways_tsl_mult': 0.9411926565374525, 'sideways_time_stop': 295, 'sideways_use_sma': True, 'sideways_use_ema': False, 'sideways_use_atr': True, 'sideways_use_adx': False, 'sideways_use_spike': True, 'sideways_rsi_required': True}.
[I 2025-08-30 16:03:38,095] Trial 635 finished with values: [-1000000000.0, 1000000000.0] and parameters: {'p_sma': 52, 'p_std': 57, 'p_atr': 15, 'p_adx': 28, 'rsi_period': 72, 'ema1': 20, 'ema2': 34, 'slip_atr_k': 0.12976949104738625, 'slip_spread_k': 0.10520083613042372, 'spread_hl_frac': 0.0231341341753961, 'bb_std_mult': 2.9059303175660176, 'rsi_os': 51, 'rsi_ob': 75, 'vol_spike': 0.04365127638895748, 'adx_thresh': 12.096637965168126, 'atr_min_pct': 0.014094993947771967, 'atr_max_pct': 0.07538520174975946, 'tp_mult': 1.735725097064563, 'tsl_mult': 0.3292512948967382, 'strategy': 'breakout', 'time_stop': 190, 'use_sma': False, 'use_atr': True, 'use_adx': False, 'use_ema': True, 'use_spike': True, 'rsi_required': True, 'edge_k': 0.20171692584511264, 'edge_cap': 0.625518773903237, 'bull_strategy': 'mean_reversion', 'bull_bb_std_mult': 2.607872216445284, 'bull_rsi_os': 36, 'bull_rsi_ob': 72, 'bull_adx_thresh': 21.485564848833036, 'bull_atr_min_pct': 0.0213079567492125, 'bull_atr_max_pct': 0.03611386596979969, 'bull_tp_mult': 2.2487841663595716, 'bull_tsl_mult': 0.28817678934178625, 'bull_time_stop': 300, 'bull_use_sma': False, 'bull_use_ema': False, 'bull_use_atr': False, 'bull_use_adx': False, 'bull_use_spike': True, 'bull_rsi_required': False, 'bear_strategy': 'mean_reversion', 'bear_bb_std_mult': 0.6513189743511093, 'bear_rsi_os': 29, 'bear_rsi_ob': 71, 'bear_adx_thresh': 30.80234092530083, 'bear_atr_min_pct': 0.01979409668903337, 'bear_atr_max_pct': 0.09951742272623271, 'bear_tp_mult': 1.566276388219244, 'bear_tsl_mult': 0.9628641987619971, 'bear_time_stop': 72, 'bear_use_sma': True, 'bear_use_ema': True, 'bear_use_atr': True, 'bear_use_adx': False, 'bear_use_spike': False, 'bear_rsi_required': True, 'sideways_strategy': 'breakout', 'sideways_bb_std_mult': 2.009661139770533, 'sideways_rsi_os': 13, 'sideways_rsi_ob': 60, 'sideways_adx_thresh': 29.286324426341505, 'sideways_atr_min_pct': 0.0015067812525914916, 'sideways_atr_max_pct': 0.03161909878517922, 'sideways_tp_mult': 2.395660942328751, 'sideways_tsl_mult': 0.780081990126204, 'sideways_time_stop': 288, 'sideways_use_sma': True, 'sideways_use_ema': True, 'sideways_use_atr': True, 'sideways_use_adx': False, 'sideways_use_spike': True, 'sideways_rsi_required': False}.
[I 2025-08-30 16:03:38,757] Trial 634 finished with values: [-1000000000.0, 1000000000.0] and parameters: {'p_sma': 6, 'p_std': 60, 'p_atr': 14, 'p_adx': 25, 'rsi_period': 82, 'ema1': 20, 'ema2': 34, 'slip_atr_k': 0.05691581228028841, 'slip_spread_k': 0.025716356899838477, 'spread_hl_frac': 0.02321835453701475, 'bb_std_mult': 0.6314032432388106, 'rsi_os': 24, 'rsi_ob': 78, 'vol_spike': 0.0005052902518562497, 'adx_thresh': 16.13844988698611, 'atr_min_pct': 0.01422790167927333, 'atr_max_pct': 0.029117869093111357, 'tp_mult': 2.1670404174302393, 'tsl_mult': 0.7872575391461752, 'strategy': 'breakout', 'time_stop': 134, 'use_sma': False, 'use_atr': True, 'use_adx': False, 'use_ema': False, 'use_spike': False, 'rsi_required': True, 'edge_k': 0.10979099364361414, 'edge_cap': 0.15876784411655376, 'bull_strategy': 'mean_reversion', 'bull_bb_std_mult': 1.4923835132487033, 'bull_rsi_os': 46, 'bull_rsi_ob': 73, 'bull_adx_thresh': 7.459542940232108, 'bull_atr_min_pct': 0.022586339676745937, 'bull_atr_max_pct': 0.07246576423651409, 'bull_tp_mult': 2.223760288087022, 'bull_tsl_mult': 0.21166895916618117, 'bull_time_stop': 66, 'bull_use_sma': False, 'bull_use_ema': False, 'bull_use_atr': False, 'bull_use_adx': False, 'bull_use_spike': True, 'bull_rsi_required': False, 'bear_strategy': 'mean_reversion', 'bear_bb_std_mult': 3.2082995844817286, 'bear_rsi_os': 30, 'bear_rsi_ob': 71, 'bear_adx_thresh': 23.612630411815832, 'bear_atr_min_pct': 0.02248689602587729, 'bear_atr_max_pct': 0.09967392061538997, 'bear_tp_mult': 2.714454709821883, 'bear_tsl_mult': 0.9647835358694973, 'bear_time_stop': 72, 'bear_use_sma': True, 'bear_use_ema': True, 'bear_use_atr': False, 'bear_use_adx': False, 'bear_use_spike': False, 'bear_rsi_required': False, 'sideways_strategy': 'breakout', 'sideways_bb_std_mult': 2.3183453187133436, 'sideways_rsi_os': 43, 'sideways_rsi_ob': 85, 'sideways_adx_thresh': 26.149586284538376, 'sideways_atr_min_pct': 0.016098903967065918, 'sideways_atr_max_pct': 0.02531319529315984, 'sideways_tp_mult': 2.411719521195125, 'sideways_tsl_mult': 0.2596075388247786, 'sideways_time_stop': 89, 'sideways_use_sma': True, 'sideways_use_ema': True, 'sideways_use_atr': True, 'sideways_use_adx': False, 'sideways_use_spike': True, 'sideways_rsi_required': False}.
[I 2025-08-30 16:04:22,108] Trial 640 finished with values: [-1000000000.0, 1000000000.0] and parameters: {'p_sma': 6, 'p_std': 59, 'p_atr': 15, 'p_adx': 25, 'rsi_period': 82, 'ema1': 30, 'ema2': 41, 'slip_atr_k': 0.17504990896314376, 'slip_spread_k': 0.9431327072447379, 'spread_hl_frac': 0.024863439709981644, 'bb_std_mult': 0.6325050951233124, 'rsi_os': 12, 'rsi_ob': 71, 'vol_spike': 0.12809775995536526, 'adx_thresh': 14.569079011132844, 'atr_min_pct': 0.014923808808921128, 'atr_max_pct': 0.07619292151030654, 'tp_mult': 1.748719212462741, 'tsl_mult': 0.6753798543029723, 'strategy': 'mean_reversion', 'time_stop': 217, 'use_sma': True, 'use_atr': True, 'use_adx': False, 'use_ema': True, 'use_spike': True, 'rsi_required': True, 'edge_k': 1.7636752976799488, 'edge_cap': 0.48216087004583447, 'bull_strategy': 'breakout', 'bull_bb_std_mult': 0.8083178637949024, 'bull_rsi_os': 20, 'bull_rsi_ob': 73, 'bull_adx_thresh': 16.72639982260386, 'bull_atr_min_pct': 0.020480691981873175, 'bull_atr_max_pct': 0.07262975276741665, 'bull_tp_mult': 2.19739204385792, 'bull_tsl_mult': 0.42562165660957163, 'bull_time_stop': 249, 'bull_use_sma': False, 'bull_use_ema': False, 'bull_use_atr': False, 'bull_use_adx': True, 'bull_use_spike': True, 'bull_rsi_required': False, 'bear_strategy': 'mean_reversion', 'bear_bb_std_mult': 2.5477349273890963, 'bear_rsi_os': 37, 'bear_rsi_ob': 87, 'bear_adx_thresh': 28.09439131098113, 'bear_atr_min_pct': 0.009845649597547992, 'bear_atr_max_pct': 0.07362689092565174, 'bear_tp_mult': 1.425054443959357, 'bear_tsl_mult': 0.9128710271059192, 'bear_time_stop': 269, 'bear_use_sma': True, 'bear_use_ema': False, 'bear_use_atr': True, 'bear_use_adx': True, 'bear_use_spike': False, 'bear_rsi_required': True, 'sideways_strategy': 'breakout', 'sideways_bb_std_mult': 2.8366292378928977, 'sideways_rsi_os': 40, 'sideways_rsi_ob': 58, 'sideways_adx_thresh': 24.824639612676414, 'sideways_atr_min_pct': 0.021092003441480947, 'sideways_atr_max_pct': 0.026244843236817146, 'sideways_tp_mult': 1.638757983597856, 'sideways_tsl_mult': 0.9590485679308893, 'sideways_time_stop': 78, 'sideways_use_sma': True, 'sideways_use_ema': True, 'sideways_use_atr': False, 'sideways_use_adx': True, 'sideways_use_spike': True, 'sideways_rsi_required': False}.
