[I 2025-08-30 16:24:18,422] Trial 746 finished with values: [-1000000000.0, 1000000000.0] and parameters: {'p_sma': 7, 'p_std': 26, 'p_atr': 25, 'p_adx': 13, 'rsi_period': 76, 'ema1': 24, 'ema2': 32, 'slip_atr_k': 0.2052431564157343, 'slip_spread_k': 0.1427100582048614, 'spread_hl_frac': 0.022661089453490935, 'bb_std_mult': 2.5186796080566594, 'rsi_os': 41, 'rsi_ob': 50, 'vol_spike': 0.17805857096903868, 'adx_thresh': 33.07494336330392, 'atr_min_pct': 0.014514346778662458, 'atr_max_pct': 0.1354595284918279, 'tp_mult': 2.9083365370524916, 'tsl_mult': 0.15111570893119367, 'strategy': 'mean_reversion', 'time_stop': 240, 'use_sma': True, 'use_atr': True, 'use_adx': False, 'use_ema': True, 'use_spike': True, 'rsi_required': False, 'edge_k': 0.4862540406343552, 'edge_cap': 0.6014160516516004, 'bull_strategy': 'breakout', 'bull_bb_std_mult': 0.7898356756941797, 'bull_rsi_os': 40, 'bull_rsi_ob': 61, 'bull_adx_thresh': 23.02194375461462, 'bull_atr_min_pct': 0.020041156784197944, 'bull_atr_max_pct': 0.0947352611761238, 'bull_tp_mult': 1.9391384318796445, 'bull_tsl_mult': 0.0006565574118268941, 'bull_time_stop': 39, 'bull_use_sma': True, 'bull_use_ema': True, 'bull_use_atr': True, 'bull_use_adx': True, 'bull_use_spike': False, 'bull_rsi_required': True, 'bear_strategy': 'mean_reversion', 'bear_bb_std_mult': 2.5912762333991908, 'bear_rsi_os': 33, 'bear_rsi_ob': 91, 'bear_adx_thresh': 29.166767123178197, 'bear_atr_min_pct': 0.01991942409508118, 'bear_atr_max_pct': 0.07483120094385066, 'bear_tp_mult': 2.8740242580534017, 'bear_tsl_mult': 0.2630699684037477, 'bear_time_stop': 235, 'bear_use_sma': False, 'bear_use_ema': False, 'bear_use_atr': True, 'bear_use_adx': True, 'bear_use_spike': True, 'bear_rsi_required': True, 'sideways_strategy': 'breakout', 'sideways_bb_std_mult': 1.1714512289282595, 'sideways_rsi_os': 38, 'sideways_rsi_ob': 60, 'sideways_adx_thresh': 23.48561501369514, 'sideways_atr_min_pct': 0.0015942025267909644, 'sideways_atr_max_pct': 0.10949300509038837, 'sideways_tp_mult': 2.8814868008607184, 'sideways_tsl_mult': 0.8462283593469611, 'sideways_time_stop': 270, 'sideways_use_sma': False, 'sideways_use_ema': True, 'sideways_use_atr': False, 'sideways_use_adx': True, 'sideways_use_spike': False, 'sideways_rsi_required': True}.
[I 2025-08-30 16:24:56,933] Trial 749 finished with values: [-1000000000.0, 1000000000.0] and parameters: {'p_sma': 7, 'p_std': 56, 'p_atr': 27, 'p_adx': 11, 'rsi_period': 78, 'ema1': 22, 'ema2': 29, 'slip_atr_k': 0.06464005683284373, 'slip_spread_k': 0.15324612947126406, 'spread_hl_frac': 0.022814454158958365, 'bb_std_mult': 2.5064939146684493, 'rsi_os': 41, 'rsi_ob': 71, 'vol_spike': 0.17970882497459564, 'adx_thresh': 18.64889886433588, 'atr_min_pct': 0.02195660690581281, 'atr_max_pct': 0.14059551524931221, 'tp_mult': 1.7977449168843616, 'tsl_mult': 0.4124074253715503, 'strategy': 'mean_reversion', 'time_stop': 209, 'use_sma': True, 'use_atr': False, 'use_adx': False, 'use_ema': True, 'use_spike': True, 'rsi_required': False, 'edge_k': 0.49159936458927156, 'edge_cap': 0.5942883232291478, 'bull_strategy': 'breakout', 'bull_bb_std_mult': 0.7820457882045692, 'bull_rsi_os': 39, 'bull_rsi_ob': 65, 'bull_adx_thresh': 23.001276216332585, 'bull_atr_min_pct': 0.020955889183310025, 'bull_atr_max_pct': 0.09240513562690039, 'bull_tp_mult': 1.9803822004285299, 'bull_tsl_mult': 0.20921432028972411, 'bull_time_stop': 38, 'bull_use_sma': True, 'bull_use_ema': True, 'bull_use_atr': True, 'bull_use_adx': True, 'bull_use_spike': True, 'bull_rsi_required': True, 'bear_strategy': 'mean_reversion', 'bear_bb_std_mult': 2.389610254514663, 'bear_rsi_os': 31, 'bear_rsi_ob': 89, 'bear_adx_thresh': 29.888433876772215, 'bear_atr_min_pct': 0.0287769918330266, 'bear_atr_max_pct': 0.08270130357678761, 'bear_tp_mult': 2.823012171114644, 'bear_tsl_mult': 0.36953547839133566, 'bear_time_stop': 285, 'bear_use_sma': False, 'bear_use_ema': False, 'bear_use_atr': True, 'bear_use_adx': True, 'bear_use_spike': True, 'bear_rsi_required': True, 'sideways_strategy': 'breakout', 'sideways_bb_std_mult': 1.188860038247129, 'sideways_rsi_os': 37, 'sideways_rsi_ob': 79, 'sideways_adx_thresh': 18.768793791435176, 'sideways_atr_min_pct': 1.2156333817080786e-05, 'sideways_atr_max_pct': 0.10042388948139352, 'sideways_tp_mult': 2.872070113431379, 'sideways_tsl_mult': 0.8555611178832963, 'sideways_time_stop': 68, 'sideways_use_sma': True, 'sideways_use_ema': False, 'sideways_use_atr': False, 'sideways_use_adx': True, 'sideways_use_spike': True, 'sideways_rsi_required': True}.
[I 2025-08-30 16:24:58,270] Trial 747 finished with values: [-1000000000.0, 1000000000.0] and parameters: {'p_sma': 55, 'p_std': 57, 'p_atr': 25, 'p_adx': 11, 'rsi_period': 79, 'ema1': 22, 'ema2': 33, 'slip_atr_k': 0.16614272908815048, 'slip_spread_k': 0.6937877141835761, 'spread_hl_frac': 0.03527651244578739, 'bb_std_mult': 2.4937286562438694, 'rsi_os': 39, 'rsi_ob': 71, 'vol_spike': 0.16153950010859489, 'adx_thresh': 15.897617064117998, 'atr_min_pct': 0.01459678690551869, 'atr_max_pct': 0.1410169885631431, 'tp_mult': 1.738437486862649, 'tsl_mult': 0.1629486460258041, 'strategy': 'mean_reversion', 'time_stop': 209, 'use_sma': True, 'use_atr': True, 'use_adx': False, 'use_ema': True, 'use_spike': True, 'rsi_required': False, 'edge_k': 0.4830622235367616, 'edge_cap': 0.9101539665270005, 'bull_strategy': 'breakout', 'bull_bb_std_mult': 0.7891005903666132, 'bull_rsi_os': 55, 'bull_rsi_ob': 67, 'bull_adx_thresh': 22.915664251733425, 'bull_atr_min_pct': 0.019871350158486283, 'bull_atr_max_pct': 0.09141235411077692, 'bull_tp_mult': 1.983520773203365, 'bull_tsl_mult': 0.11760023767391331, 'bull_time_stop': 39, 'bull_use_sma': True, 'bull_use_ema': True, 'bull_use_atr': True, 'bull_use_adx': True, 'bull_use_spike': True, 'bull_rsi_required': True, 'bear_strategy': 'mean_reversion', 'bear_bb_std_mult': 2.5768302833010437, 'bear_rsi_os': 31, 'bear_rsi_ob': 81, 'bear_adx_thresh': 30.271179375504897, 'bear_atr_min_pct': 0.021050412565285975, 'bear_atr_max_pct': 0.0825635868234037, 'bear_tp_mult': 2.823389520839718, 'bear_tsl_mult': 0.13204886660794007, 'bear_time_stop': 275, 'bear_use_sma': False, 'bear_use_ema': False, 'bear_use_atr': True, 'bear_use_adx': True, 'bear_use_spike': True, 'bear_rsi_required': True, 'sideways_strategy': 'breakout', 'sideways_bb_std_mult': 1.17413997477652, 'sideways_rsi_os': 12, 'sideways_rsi_ob': 61, 'sideways_adx_thresh': 23.515021543617586, 'sideways_atr_min_pct': 0.012675384528959872, 'sideways_atr_max_pct': 0.10951743730024206, 'sideways_tp_mult': 2.887280791357069, 'sideways_tsl_mult': 0.8516166060908235, 'sideways_time_stop': 75, 'sideways_use_sma': True, 'sideways_use_ema': False, 'sideways_use_atr': False, 'sideways_use_adx': True, 'sideways_use_spike': True, 'sideways_rsi_required': True}.
[I 2025-08-30 16:25:00,976] Trial 751 finished with values: [-1000000000.0, 0.24757232982719438] and parameters: {'p_sma': 8, 'p_std': 5, 'p_atr': 27, 'p_adx': 12, 'rsi_period': 19, 'ema1': 22, 'ema2': 30, 'slip_atr_k': 0.06480892312722729, 'slip_spread_k': 0.175354137161278, 'spread_hl_frac': 0.0360353616715367, 'bb_std_mult': 2.303956530863011, 'rsi_os': 38, 'rsi_ob': 76, 'vol_spike': 0.20572496484421127, 'adx_thresh': 14.74905168200765, 'atr_min_pct': 0.015886228861834422, 'atr_max_pct': 0.07691075360932349, 'tp_mult': 1.6026291673929736, 'tsl_mult': 0.12669616098358652, 'strategy': 'mean_reversion', 'time_stop': 195, 'use_sma': True, 'use_atr': False, 'use_adx': True, 'use_ema': True, 'use_spike': False, 'rsi_required': False, 'edge_k': 0.32407942301597825, 'edge_cap': 0.6182397314462852, 'bull_strategy': 'breakout', 'bull_bb_std_mult': 0.7326945724148306, 'bull_rsi_os': 12, 'bull_rsi_ob': 71, 'bull_adx_thresh': 23.571081794314033, 'bull_atr_min_pct': 0.02050857389519555, 'bull_atr_max_pct': 0.09181485891330708, 'bull_tp_mult': 2.0086752823973613, 'bull_tsl_mult': 0.03927024141098044, 'bull_time_stop': 42, 'bull_use_sma': True, 'bull_use_ema': True, 'bull_use_atr': True, 'bull_use_adx': True, 'bull_use_spike': True, 'bull_rsi_required': True, 'bear_strategy': 'mean_reversion', 'bear_bb_std_mult': 2.4539044517796014, 'bear_rsi_os': 31, 'bear_rsi_ob': 89, 'bear_adx_thresh': 30.666035815430526, 'bear_atr_min_pct': 0.021987907184208278, 'bear_atr_max_pct': 0.08148608474251112, 'bear_tp_mult': 2.774365395687052, 'bear_tsl_mult': 0.12451744562657929, 'bear_time_stop': 277, 'bear_use_sma': False, 'bear_use_ema': False, 'bear_use_atr': True, 'bear_use_adx': True, 'bear_use_spike': True, 'bear_rsi_required': True, 'sideways_strategy': 'breakout', 'sideways_bb_std_mult': 0.9323523658222058, 'sideways_rsi_os': 55, 'sideways_rsi_ob': 62, 'sideways_adx_thresh': 24.108631671010507, 'sideways_atr_min_pct': 0.0005392301295896797, 'sideways_atr_max_pct': 0.10047440774666805, 'sideways_tp_mult': 2.823201300867868, 'sideways_tsl_mult': 0.22822908642413225, 'sideways_time_stop': 69, 'sideways_use_sma': True, 'sideways_use_ema': False, 'sideways_use_atr': False, 'sideways_use_adx': True, 'sideways_use_spike': True, 'sideways_rsi_required': True}.
[I 2025-08-30 16:25:01,494] Trial 750 finished with values: [-0.06176173239556915, 0.06168818516804706] and parameters: {'p_sma': 29, 'p_std': 5, 'p_atr': 26, 'p_adx': 12, 'rsi_period': 52, 'ema1': 22, 'ema2': 33, 'slip_atr_k': 0.16576173620556225, 'slip_spread_k': 0.15105517342994879, 'spread_hl_frac': 0.02264664541674485, 'bb_std_mult': 2.2517580700196365, 'rsi_os': 41, 'rsi_ob': 71, 'vol_spike': 0.17597316987252773, 'adx_thresh': 14.64995875602188, 'atr_min_pct': 0.014489339764558497, 'atr_max_pct': 0.030814529267302597, 'tp_mult': 1.701164892267202, 'tsl_mult': 0.12760217338224894, 'strategy': 'mean_reversion', 'time_stop': 210, 'use_sma': True, 'use_atr': False, 'use_adx': False, 'use_ema': True, 'use_spike': False, 'rsi_required': False, 'edge_k': 0.4254520642306315, 'edge_cap': 0.6081216490058697, 'bull_strategy': 'breakout', 'bull_bb_std_mult': 0.806788684795015, 'bull_rsi_os': 12, 'bull_rsi_ob': 71, 'bull_adx_thresh': 23.424135977445253, 'bull_atr_min_pct': 0.020314333052741128, 'bull_atr_max_pct': 0.09184136400303218, 'bull_tp_mult': 2.0016756593089005, 'bull_tsl_mult': 0.0028236031370049153, 'bull_time_stop': 42, 'bull_use_sma': True, 'bull_use_ema': True, 'bull_use_atr': True, 'bull_use_adx': True, 'bull_use_spike': True, 'bull_rsi_required': True, 'bear_strategy': 'mean_reversion', 'bear_bb_std_mult': 2.4796205060227057, 'bear_rsi_os': 31, 'bear_rsi_ob': 89, 'bear_adx_thresh': 21.016782508795178, 'bear_atr_min_pct': 0.017959121264857207, 'bear_atr_max_pct': 0.07395964462139419, 'bear_tp_mult': 2.714285685573192, 'bear_tsl_mult': 0.33952245503851014, 'bear_time_stop': 273, 'bear_use_sma': False, 'bear_use_ema': False, 'bear_use_atr': True, 'bear_use_adx': True, 'bear_use_spike': True, 'bear_rsi_required': True, 'sideways_strategy': 'breakout', 'sideways_bb_std_mult': 0.9474159623046476, 'sideways_rsi_os': 37, 'sideways_rsi_ob': 80, 'sideways_adx_thresh': 18.616142619694582, 'sideways_atr_min_pct': 0.0006122372505649466, 'sideways_atr_max_pct': 0.10119992088025191, 'sideways_tp_mult': 2.8241659492709097, 'sideways_tsl_mult': 0.40850832132486253, 'sideways_time_stop': 277, 'sideways_use_sma': True, 'sideways_use_ema': True, 'sideways_use_atr': False, 'sideways_use_adx': True, 'sideways_use_spike': True, 'sideways_rsi_required': True}.
[I 2025-08-30 16:25:44,157] Trial 752 finished with values: [-1000000000.0, 1000000000.0] and parameters: {'p_sma': 8, 'p_std': 10, 'p_atr': 26, 'p_adx': 10, 'rsi_period': 21, 'ema1': 22, 'ema2': 30, 'slip_atr_k': 0.1668057898718152, 'slip_spread_k': 0.6653728939648199, 'spread_hl_frac': 0.035725734571051194, 'bb_std_mult': 2.2691229654504195, 'rsi_os': 37, 'rsi_ob': 72, 'vol_spike': 0.16205465227547977, 'adx_thresh': 16.349084045610535, 'atr_min_pct': 0.014480205072538178, 'atr_max_pct': 0.061401959120477384, 'tp_mult': 1.7048415575505624, 'tsl_mult': 0.3191161825399143, 'strategy': 'mean_reversion', 'time_stop': 211, 'use_sma': True, 'use_atr': True, 'use_adx': True, 'use_ema': True, 'use_spike': False, 'rsi_required': False, 'edge_k': 0.5668605667694773, 'edge_cap': 0.6135008414045134, 'bull_strategy': 'breakout', 'bull_bb_std_mult': 0.736710722314066, 'bull_rsi_os': 49, 'bull_rsi_ob': 62, 'bull_adx_thresh': 34.24024138666553, 'bull_atr_min_pct': 0.020349082551866394, 'bull_atr_max_pct': 0.09125705451797296, 'bull_tp_mult': 2.7437802161259373, 'bull_tsl_mult': 0.14729620340650662, 'bull_time_stop': 27, 'bull_use_sma': True, 'bull_use_ema': True, 'bull_use_atr': True, 'bull_use_adx': True, 'bull_use_spike': True, 'bull_rsi_required': True, 'bear_strategy': 'mean_reversion', 'bear_bb_std_mult': 2.485012971548325, 'bear_rsi_os': 34, 'bear_rsi_ob': 81, 'bear_adx_thresh': 31.08299418908799, 'bear_atr_min_pct': 0.02193572392646219, 'bear_atr_max_pct': 0.05368318636259423, 'bear_tp_mult': 2.751662303557407, 'bear_tsl_mult': 0.1306870584564846, 'bear_time_stop': 276, 'bear_use_sma': False, 'bear_use_ema': False, 'bear_use_atr': False, 'bear_use_adx': True, 'bear_use_spike': True, 'bear_rsi_required': True, 'sideways_strategy': 'mean_reversion', 'sideways_bb_std_mult': 0.9502885090559274, 'sideways_rsi_os': 39, 'sideways_rsi_ob': 86, 'sideways_adx_thresh': 25.454040393478984, 'sideways_atr_min_pct': 0.0006317940713142546, 'sideways_atr_max_pct': 0.13806865225825635, 'sideways_tp_mult': 2.9534254282187797, 'sideways_tsl_mult': 0.9138999253068018, 'sideways_time_stop': 81, 'sideways_use_sma': True, 'sideways_use_ema': True, 'sideways_use_atr': False, 'sideways_use_adx': True, 'sideways_use_spike': True, 'sideways_rsi_required': True}.
[I 2025-08-30 16:25:44,429] Trial 754 finished with values: [-1000000000.0, 1000000000.0] and parameters: {'p_sma': 29, 'p_std': 55, 'p_atr': 26, 'p_adx': 10, 'rsi_period': 57, 'ema1': 23, 'ema2': 13, 'slip_atr_k': 0.10499288715892384, 'slip_spread_k': 0.11634825368043175, 'spread_hl_frac': 0.02582776766867338, 'bb_std_mult': 2.4277579536413314, 'rsi_os': 37, 'rsi_ob': 72, 'vol_spike': 0.1619783789019652, 'adx_thresh': 16.704071223330594, 'atr_min_pct': 0.005222412012303083, 'atr_max_pct': 0.08387534684968331, 'tp_mult': 1.6895549600933006, 'tsl_mult': 0.31304937581175174, 'strategy': 'mean_reversion', 'time_stop': 256, 'use_sma': True, 'use_atr': True, 'use_adx': False, 'use_ema': True, 'use_spike': False, 'rsi_required': False, 'edge_k': 0.4256567010980587, 'edge_cap': 0.6274684606392931, 'bull_strategy': 'breakout', 'bull_bb_std_mult': 0.8330136235310496, 'bull_rsi_os': 20, 'bull_rsi_ob': 60, 'bull_adx_thresh': 24.950740225908913, 'bull_atr_min_pct': 0.02141727972666852, 'bull_atr_max_pct': 0.09564352638064838, 'bull_tp_mult': 2.9730445596978217, 'bull_tsl_mult': 0.08068262292477622, 'bull_time_stop': 14, 'bull_use_sma': True, 'bull_use_ema': True, 'bull_use_atr': True, 'bull_use_adx': True, 'bull_use_spike': True, 'bull_rsi_required': True, 'bear_strategy': 'breakout', 'bear_bb_std_mult': 2.6951162650770457, 'bear_rsi_os': 34, 'bear_rsi_ob': 93, 'bear_adx_thresh': 21.167312469097638, 'bear_atr_min_pct': 0.004496783847419783, 'bear_atr_max_pct': 0.07777583189222781, 'bear_tp_mult': 2.7294320564946895, 'bear_tsl_mult': 0.43792894670650856, 'bear_time_stop': 270, 'bear_use_sma': False, 'bear_use_ema': False, 'bear_use_atr': False, 'bear_use_adx': True, 'bear_use_spike': True, 'bear_rsi_required': False, 'sideways_strategy': 'mean_reversion', 'sideways_bb_std_mult': 1.562141973461602, 'sideways_rsi_os': 28, 'sideways_rsi_ob': 48, 'sideways_adx_thresh': 25.48585821130177, 'sideways_atr_min_pct': 0.010689704725349329, 'sideways_atr_max_pct': 0.1360436689228495, 'sideways_tp_mult': 2.9587568177936108, 'sideways_tsl_mult': 0.27262922394629774, 'sideways_time_stop': 80, 'sideways_use_sma': True, 'sideways_use_ema': True, 'sideways_use_atr': False, 'sideways_use_adx': True, 'sideways_use_spike': True, 'sideways_rsi_required': True}.
[I 2025-08-30 16:25:44,812] Trial 753 finished with values: [-1000000000.0, 1000000000.0] and parameters: {'p_sma': 29, 'p_std': 35, 'p_atr': 27, 'p_adx': 12, 'rsi_period': 82, 'ema1': 23, 'ema2': 30, 'slip_atr_k': 0.06511498091542539, 'slip_spread_k': 0.11174874472078561, 'spread_hl_frac': 0.02609621956124454, 'bb_std_mult': 2.2525143617689802, 'rsi_os': 37, 'rsi_ob': 72, 'vol_spike': 0.2095789055930617, 'adx_thresh': 14.544926753578457, 'atr_min_pct': 0.0157405401364598, 'atr_max_pct': 0.060616902497329386, 'tp_mult': 1.671163081056942, 'tsl_mult': 0.12816402223093468, 'strategy': 'mean_reversion', 'time_stop': 260, 'use_sma': True, 'use_atr': False, 'use_adx': True, 'use_ema': True, 'use_spike': False, 'rsi_required': False, 'edge_k': 0.40680776865967433, 'edge_cap': 0.619018564001188, 'bull_strategy': 'breakout', 'bull_bb_std_mult': 0.8171220032394892, 'bull_rsi_os': 11, 'bull_rsi_ob': 71, 'bull_adx_thresh': 23.46446350870092, 'bull_atr_min_pct': 0.02062776585593198, 'bull_atr_max_pct': 0.08678765288189867, 'bull_tp_mult': 2.978342780812171, 'bull_tsl_mult': 0.041424972159103804, 'bull_time_stop': 47, 'bull_use_sma': True, 'bull_use_ema': True, 'bull_use_atr': True, 'bull_use_adx': True, 'bull_use_spike': True, 'bull_rsi_required': True, 'bear_strategy': 'mean_reversion', 'bear_bb_std_mult': 2.80836086198451, 'bear_rsi_os': 34, 'bear_rsi_ob': 81, 'bear_adx_thresh': 30.790303605186963, 'bear_atr_min_pct': 0.022012630104847185, 'bear_atr_max_pct': 0.1393952012797083, 'bear_tp_mult': 2.714624011842441, 'bear_tsl_mult': 0.5027776313595188, 'bear_time_stop': 257, 'bear_use_sma': False, 'bear_use_ema': False, 'bear_use_atr': False, 'bear_use_adx': True, 'bear_use_spike': True, 'bear_rsi_required': True, 'sideways_strategy': 'mean_reversion', 'sideways_bb_std_mult': 0.584864156179475, 'sideways_rsi_os': 41, 'sideways_rsi_ob': 65, 'sideways_adx_thresh': 24.272954493861985, 'sideways_atr_min_pct': 0.0008516430435787058, 'sideways_atr_max_pct': 0.10612404161969587, 'sideways_tp_mult': 2.955749018573042, 'sideways_tsl_mult': 0.02396967880081774, 'sideways_time_stop': 80, 'sideways_use_sma': True, 'sideways_use_ema': True, 'sideways_use_atr': False, 'sideways_use_adx': True, 'sideways_use_spike': True, 'sideways_rsi_required': True}.
[I 2025-08-30 16:25:45,122] Trial 755 finished with values: [-1000000000.0, 1000000000.0] and parameters: {'p_sma': 6, 'p_std': 12, 'p_atr': 26, 'p_adx': 10, 'rsi_period': 57, 'ema1': 24, 'ema2': 40, 'slip_atr_k': 0.10513651740833525, 'slip_spread_k': 0.6659568466990714, 'spread_hl_frac': 0.025977991062989925, 'bb_std_mult': 2.385285839316856, 'rsi_os': 37, 'rsi_ob': 72, 'vol_spike': 0.011883500972180994, 'adx_thresh': 14.006457486617862, 'atr_min_pct': 0.015090791680741488, 'atr_max_pct': 0.09263418125138119, 'tp_mult': 1.837226625943047, 'tsl_mult': 0.2800036356661326, 'strategy': 'mean_reversion', 'time_stop': 218, 'use_sma': True, 'use_atr': True, 'use_adx': True, 'use_ema': True, 'use_spike': True, 'rsi_required': False, 'edge_k': 0.4509570958371091, 'edge_cap': 0.45812077373732013, 'bull_strategy': 'breakout', 'bull_bb_std_mult': 0.5730542570472785, 'bull_rsi_os': 24, 'bull_rsi_ob': 60, 'bull_adx_thresh': 24.844756389879635, 'bull_atr_min_pct': 0.020978348162223662, 'bull_atr_max_pct': 0.08683474512476418, 'bull_tp_mult': 2.1024473211566552, 'bull_tsl_mult': 0.15098345418644166, 'bull_time_stop': 31, 'bull_use_sma': True, 'bull_use_ema': True, 'bull_use_atr': True, 'bull_use_adx': True, 'bull_use_spike': True, 'bull_rsi_required': True, 'bear_strategy': 'breakout', 'bear_bb_std_mult': 2.6799260405875875, 'bear_rsi_os': 34, 'bear_rsi_ob': 81, 'bear_adx_thresh': 13.45413668035831, 'bear_atr_min_pct': 0.01914797105010767, 'bear_atr_max_pct': 0.05431089887677714, 'bear_tp_mult': 2.7502413289461174, 'bear_tsl_mult': 0.6869515993250976, 'bear_time_stop': 257, 'bear_use_sma': False, 'bear_use_ema': False, 'bear_use_atr': False, 'bear_use_adx': True, 'bear_use_spike': True, 'bear_rsi_required': False, 'sideways_strategy': 'mean_reversion', 'sideways_bb_std_mult': 1.5341152906472866, 'sideways_rsi_os': 26, 'sideways_rsi_ob': 65, 'sideways_adx_thresh': 25.531552051365793, 'sideways_atr_min_pct': 0.0011310560730166657, 'sideways_atr_max_pct': 0.13602809336006663, 'sideways_tp_mult': 2.9565141412126508, 'sideways_tsl_mult': 0.9139023470695695, 'sideways_time_stop': 80, 'sideways_use_sma': True, 'sideways_use_ema': True, 'sideways_use_atr': False, 'sideways_use_adx': True, 'sideways_use_spike': True, 'sideways_rsi_required': True}.
