[I 2025-08-30 16:46:09,804] Trial 871 finished with values: [-0.021022438398100363, 0.020924364916015317] and parameters: {'p_sma': 56, 'p_std': 25, 'p_atr': 21, 'p_adx': 16, 'rsi_period': 77, 'ema1': 7, 'ema2': 30, 'slip_atr_k': 0.060760627807083425, 'slip_spread_k': 0.056812003754554585, 'spread_hl_frac': 0.027672426331850603, 'bb_std_mult': 2.6882616852709056, 'rsi_os': 49, 'rsi_ob': 75, 'vol_spike': 0.1520893788185585, 'adx_thresh': 13.52534900287631, 'atr_min_pct': 0.016541196886439107, 'atr_max_pct': 0.060765478359399334, 'tp_mult': 1.9523316906736987, 'tsl_mult': 0.4215351033418303, 'strategy': 'mean_reversion', 'time_stop': 12, 'use_sma': True, 'use_atr': True, 'use_adx': True, 'use_ema': True, 'use_spike': True, 'rsi_required': False, 'edge_k': 1.283795391045925, 'edge_cap': 0.2716587244244504, 'bull_strategy': 'breakout', 'bull_bb_std_mult': 1.9123500217837799, 'bull_rsi_os': 45, 'bull_rsi_ob': 60, 'bull_adx_thresh': 24.958515143391786, 'bull_atr_min_pct': 0.01871542796374585, 'bull_atr_max_pct': 0.1164450152749654, 'bull_tp_mult': 1.5790451182092498, 'bull_tsl_mult': 0.0783990808535338, 'bull_time_stop': 34, 'bull_use_sma': True, 'bull_use_ema': True, 'bull_use_atr': True, 'bull_use_adx': True, 'bull_use_spike': True, 'bull_rsi_required': True, 'bear_strategy': 'mean_reversion', 'bear_bb_std_mult': 2.3808117713165844, 'bear_rsi_os': 35, 'bear_rsi_ob': 95, 'bear_adx_thresh': 30.840461760902656, 'bear_atr_min_pct': 0.0055908391309819104, 'bear_atr_max_pct': 0.11054289266457959, 'bear_tp_mult': 2.1059287788532197, 'bear_tsl_mult': 0.2149568892752417, 'bear_time_stop': 296, 'bear_use_sma': False, 'bear_use_ema': False, 'bear_use_atr': False, 'bear_use_adx': True, 'bear_use_spike': True, 'bear_rsi_required': True, 'sideways_strategy': 'breakout', 'sideways_bb_std_mult': 1.7744708493773382, 'sideways_rsi_os': 41, 'sideways_rsi_ob': 73, 'sideways_adx_thresh': 21.055754147767768, 'sideways_atr_min_pct': 0.0024044226386139246, 'sideways_atr_max_pct': 0.11516456176056564, 'sideways_tp_mult': 2.9142621728165174, 'sideways_tsl_mult': 0.1763058769786486, 'sideways_time_stop': 37, 'sideways_use_sma': True, 'sideways_use_ema': True, 'sideways_use_atr': False, 'sideways_use_adx': True, 'sideways_use_spike': True, 'sideways_rsi_required': True}.
[I 2025-08-30 16:46:17,700] Trial 877 finished with values: [-1000000000.0, 1000000000.0] and parameters: {'p_sma': 5, 'p_std': 28, 'p_atr': 23, 'p_adx': 9, 'rsi_period': 34, 'ema1': 22, 'ema2': 27, 'slip_atr_k': 0.05296511476673914, 'slip_spread_k': 0.2632443838904731, 'spread_hl_frac': 0.030576313984916764, 'bb_std_mult': 1.6799507995504408, 'rsi_os': 54, 'rsi_ob': 76, 'vol_spike': 0.1558620839547245, 'adx_thresh': 13.482072091108781, 'atr_min_pct': 0.016872051449812665, 'atr_max_pct': 0.06530164479676058, 'tp_mult': 1.9243125773013563, 'tsl_mult': 0.3852215110038284, 'strategy': 'mean_reversion', 'time_stop': 288, 'use_sma': True, 'use_atr': False, 'use_adx': True, 'use_ema': True, 'use_spike': True, 'rsi_required': False, 'edge_k': 1.0095592891295166, 'edge_cap': 0.44586681180404814, 'bull_strategy': 'breakout', 'bull_bb_std_mult': 1.35250250008827, 'bull_rsi_os': 46, 'bull_rsi_ob': 61, 'bull_adx_thresh': 24.77142780027891, 'bull_atr_min_pct': 0.01966527343323997, 'bull_atr_max_pct': 0.10627551531335729, 'bull_tp_mult': 1.681135390861941, 'bull_tsl_mult': 0.0391654052825086, 'bull_time_stop': 28, 'bull_use_sma': True, 'bull_use_ema': True, 'bull_use_atr': True, 'bull_use_adx': True, 'bull_use_spike': False, 'bull_rsi_required': True, 'bear_strategy': 'breakout', 'bear_bb_std_mult': 2.317493228808959, 'bear_rsi_os': 38, 'bear_rsi_ob': 91, 'bear_adx_thresh': 29.555560011325184, 'bear_atr_min_pct': 0.00643110236122691, 'bear_atr_max_pct': 0.13116557861990352, 'bear_tp_mult': 2.2362107946254675, 'bear_tsl_mult': 0.17953409136821805, 'bear_time_stop': 281, 'bear_use_sma': False, 'bear_use_ema': False, 'bear_use_atr': False, 'bear_use_adx': True, 'bear_use_spike': True, 'bear_rsi_required': True, 'sideways_strategy': 'breakout', 'sideways_bb_std_mult': 1.6957151020548296, 'sideways_rsi_os': 41, 'sideways_rsi_ob': 86, 'sideways_adx_thresh': 23.563583515209427, 'sideways_atr_min_pct': 0.001843897898788696, 'sideways_atr_max_pct': 0.11920530226134396, 'sideways_tp_mult': 2.796160699822757, 'sideways_tsl_mult': 0.08828182039920503, 'sideways_time_stop': 26, 'sideways_use_sma': False, 'sideways_use_ema': False, 'sideways_use_atr': False, 'sideways_use_adx': True, 'sideways_use_spike': True, 'sideways_rsi_required': True}.
[I 2025-08-30 16:46:28,571] Trial 873 finished with values: [-1000000000.0, 1000000000.0] and parameters: {'p_sma': 5, 'p_std': 25, 'p_atr': 23, 'p_adx': 16, 'rsi_period': 77, 'ema1': 24, 'ema2': 30, 'slip_atr_k': 0.0628303954688237, 'slip_spread_k': 0.18958008718681008, 'spread_hl_frac': 0.02714873427204578, 'bb_std_mult': 3.160407763281546, 'rsi_os': 46, 'rsi_ob': 76, 'vol_spike': 0.15438447444977232, 'adx_thresh': 13.606865400576531, 'atr_min_pct': 0.017982861864803124, 'atr_max_pct': 0.06918988846255332, 'tp_mult': 1.9514535555279309, 'tsl_mult': 0.46983769601381875, 'strategy': 'mean_reversion', 'time_stop': 187, 'use_sma': True, 'use_atr': False, 'use_adx': True, 'use_ema': True, 'use_spike': True, 'rsi_required': False, 'edge_k': 1.1531285746298494, 'edge_cap': 0.39654968697737936, 'bull_strategy': 'breakout', 'bull_bb_std_mult': 2.1751297368167415, 'bull_rsi_os': 46, 'bull_rsi_ob': 60, 'bull_adx_thresh': 26.291391317858174, 'bull_atr_min_pct': 0.019567801480064113, 'bull_atr_max_pct': 0.11659648120001119, 'bull_tp_mult': 1.6762673632251417, 'bull_tsl_mult': 0.16447326981192895, 'bull_time_stop': 34, 'bull_use_sma': True, 'bull_use_ema': True, 'bull_use_atr': True, 'bull_use_adx': True, 'bull_use_spike': False, 'bull_rsi_required': True, 'bear_strategy': 'mean_reversion', 'bear_bb_std_mult': 2.386663078224222, 'bear_rsi_os': 38, 'bear_rsi_ob': 89, 'bear_adx_thresh': 30.644716637104885, 'bear_atr_min_pct': 0.0010520761963075773, 'bear_atr_max_pct': 0.13099743896861474, 'bear_tp_mult': 2.1115371710167716, 'bear_tsl_mult': 0.3507186135909308, 'bear_time_stop': 297, 'bear_use_sma': False, 'bear_use_ema': False, 'bear_use_atr': False, 'bear_use_adx': True, 'bear_use_spike': True, 'bear_rsi_required': True, 'sideways_strategy': 'breakout', 'sideways_bb_std_mult': 1.687214084184097, 'sideways_rsi_os': 41, 'sideways_rsi_ob': 78, 'sideways_adx_thresh': 23.195484944275773, 'sideways_atr_min_pct': 0.0026087490696935986, 'sideways_atr_max_pct': 0.11928546178957711, 'sideways_tp_mult': 2.9239848340148167, 'sideways_tsl_mult': 0.09778592077317877, 'sideways_time_stop': 43, 'sideways_use_sma': False, 'sideways_use_ema': True, 'sideways_use_atr': False, 'sideways_use_adx': True, 'sideways_use_spike': True, 'sideways_rsi_required': True}.
[I 2025-08-30 16:46:39,132] Trial 879 finished with values: [-1000000000.0, 1000000000.0] and parameters: {'p_sma': 6, 'p_std': 26, 'p_atr': 22, 'p_adx': 7, 'rsi_period': 22, 'ema1': 12, 'ema2': 29, 'slip_atr_k': 0.052074711729833204, 'slip_spread_k': 0.06939351970192444, 'spread_hl_frac': 0.028396182361688834, 'bb_std_mult': 3.081963994391448, 'rsi_os': 51, 'rsi_ob': 77, 'vol_spike': 0.1461763514066089, 'adx_thresh': 12.596236300020575, 'atr_min_pct': 0.01624504752014446, 'atr_max_pct': 0.06694932461975811, 'tp_mult': 1.8715895391150041, 'tsl_mult': 0.5630802330218407, 'strategy': 'mean_reversion', 'time_stop': 214, 'use_sma': True, 'use_atr': True, 'use_adx': True, 'use_ema': True, 'use_spike': False, 'rsi_required': False, 'edge_k': 1.092072661758096, 'edge_cap': 0.08999995203321876, 'bull_strategy': 'breakout', 'bull_bb_std_mult': 1.4286719153585925, 'bull_rsi_os': 43, 'bull_rsi_ob': 61, 'bull_adx_thresh': 25.3788892521206, 'bull_atr_min_pct': 0.019432441956644415, 'bull_atr_max_pct': 0.11281821685554283, 'bull_tp_mult': 1.5773811374264899, 'bull_tsl_mult': 0.12670980368236112, 'bull_time_stop': 24, 'bull_use_sma': True, 'bull_use_ema': True, 'bull_use_atr': True, 'bull_use_adx': True, 'bull_use_spike': True, 'bull_rsi_required': True, 'bear_strategy': 'mean_reversion', 'bear_bb_std_mult': 2.405526820710178, 'bear_rsi_os': 35, 'bear_rsi_ob': 92, 'bear_adx_thresh': 15.324095965067842, 'bear_atr_min_pct': 0.003640877133279718, 'bear_atr_max_pct': 0.1344863944762869, 'bear_tp_mult': 2.330207402745533, 'bear_tsl_mult': 0.2689105473575554, 'bear_time_stop': 283, 'bear_use_sma': False, 'bear_use_ema': False, 'bear_use_atr': False, 'bear_use_adx': True, 'bear_use_spike': True, 'bear_rsi_required': False, 'sideways_strategy': 'mean_reversion', 'sideways_bb_std_mult': 1.8629085624412371, 'sideways_rsi_os': 15, 'sideways_rsi_ob': 68, 'sideways_adx_thresh': 23.49698934830094, 'sideways_atr_min_pct': 0.003645257741779387, 'sideways_atr_max_pct': 0.11401386690677184, 'sideways_tp_mult': 2.940190462948677, 'sideways_tsl_mult': 0.19177615399982012, 'sideways_time_stop': 31, 'sideways_use_sma': True, 'sideways_use_ema': True, 'sideways_use_atr': False, 'sideways_use_adx': True, 'sideways_use_spike': False, 'sideways_rsi_required': True}.
[I 2025-08-30 16:46:44,556] Trial 875 finished with values: [-1000000000.0, 1000000000.0] and parameters: {'p_sma': 5, 'p_std': 32, 'p_atr': 28, 'p_adx': 9, 'rsi_period': 77, 'ema1': 24, 'ema2': 30, 'slip_atr_k': 0.06215639222327861, 'slip_spread_k': 0.18719648193955252, 'spread_hl_frac': 0.026889730908445694, 'bb_std_mult': 2.815383878202365, 'rsi_os': 46, 'rsi_ob': 76, 'vol_spike': 0.13434290505547705, 'adx_thresh': 13.446496038514347, 'atr_min_pct': 0.017952617649616545, 'atr_max_pct': 0.0698835852835883, 'tp_mult': 1.8586604202310792, 'tsl_mult': 0.4794913058006829, 'strategy': 'mean_reversion', 'time_stop': 282, 'use_sma': True, 'use_atr': False, 'use_adx': True, 'use_ema': True, 'use_spike': True, 'rsi_required': False, 'edge_k': 1.006318954251601, 'edge_cap': 0.11874393074275619, 'bull_strategy': 'breakout', 'bull_bb_std_mult': 1.1739674565610334, 'bull_rsi_os': 45, 'bull_rsi_ob': 60, 'bull_adx_thresh': 25.000092994312872, 'bull_atr_min_pct': 0.019782892865820436, 'bull_atr_max_pct': 0.11678560785665563, 'bull_tp_mult': 1.6725742960916683, 'bull_tsl_mult': 0.9461852145426665, 'bull_time_stop': 34, 'bull_use_sma': True, 'bull_use_ema': True, 'bull_use_atr': True, 'bull_use_adx': True, 'bull_use_spike': False, 'bull_rsi_required': True, 'bear_strategy': 'mean_reversion', 'bear_bb_std_mult': 2.390463029282281, 'bear_rsi_os': 37, 'bear_rsi_ob': 92, 'bear_adx_thresh': 29.4288152304508, 'bear_atr_min_pct': 0.005324352527235806, 'bear_atr_max_pct': 0.13225842687069986, 'bear_tp_mult': 2.407549340838662, 'bear_tsl_mult': 0.3532579564623767, 'bear_time_stop': 283, 'bear_use_sma': False, 'bear_use_ema': False, 'bear_use_atr': False, 'bear_use_adx': True, 'bear_use_spike': True, 'bear_rsi_required': False, 'sideways_strategy': 'breakout', 'sideways_bb_std_mult': 1.6508088080314598, 'sideways_rsi_os': 41, 'sideways_rsi_ob': 86, 'sideways_adx_thresh': 21.91872121835097, 'sideways_atr_min_pct': 0.0015938043533233017, 'sideways_atr_max_pct': 0.11856065642362196, 'sideways_tp_mult': 2.7863703878362305, 'sideways_tsl_mult': 0.18583487477586347, 'sideways_time_stop': 26, 'sideways_use_sma': False, 'sideways_use_ema': True, 'sideways_use_atr': False, 'sideways_use_adx': True, 'sideways_use_spike': True, 'sideways_rsi_required': True}.
[I 2025-08-30 16:46:49,957] Trial 876 finished with values: [-1000000000.0, 1000000000.0] and parameters: {'p_sma': 5, 'p_std': 27, 'p_atr': 23, 'p_adx': 14, 'rsi_period': 72, 'ema1': 22, 'ema2': 30, 'slip_atr_k': 0.05272527102667307, 'slip_spread_k': 0.06390660901217951, 'spread_hl_frac': 0.028546986531016665, 'bb_std_mult': 2.665963901553401, 'rsi_os': 44, 'rsi_ob': 76, 'vol_spike': 0.15479104222654883, 'adx_thresh': 13.416508798628028, 'atr_min_pct': 0.018014594231540546, 'atr_max_pct': 0.06049458423046757, 'tp_mult': 1.9232381756824992, 'tsl_mult': 0.48416418639683456, 'strategy': 'mean_reversion', 'time_stop': 228, 'use_sma': True, 'use_atr': False, 'use_adx': True, 'use_ema': True, 'use_spike': True, 'rsi_required': False, 'edge_k': 1.011503665995231, 'edge_cap': 0.4361776901719089, 'bull_strategy': 'breakout', 'bull_bb_std_mult': 1.3446127084139707, 'bull_rsi_os': 43, 'bull_rsi_ob': 60, 'bull_adx_thresh': 24.856905385748874, 'bull_atr_min_pct': 0.01720870236216046, 'bull_atr_max_pct': 0.11982834070316678, 'bull_tp_mult': 1.6718431273670826, 'bull_tsl_mult': 0.48222670251809685, 'bull_time_stop': 33, 'bull_use_sma': True, 'bull_use_ema': True, 'bull_use_atr': True, 'bull_use_adx': True, 'bull_use_spike': True, 'bull_rsi_required': True, 'bear_strategy': 'breakout', 'bear_bb_std_mult': 2.186836576858227, 'bear_rsi_os': 38, 'bear_rsi_ob': 92, 'bear_adx_thresh': 29.694728727949997, 'bear_atr_min_pct': 0.005426097801997471, 'bear_atr_max_pct': 0.13416217387457996, 'bear_tp_mult': 2.3588230677967226, 'bear_tsl_mult': 0.21300671773965257, 'bear_time_stop': 283, 'bear_use_sma': False, 'bear_use_ema': False, 'bear_use_atr': False, 'bear_use_adx': True, 'bear_use_spike': True, 'bear_rsi_required': True, 'sideways_strategy': 'breakout', 'sideways_bb_std_mult': 1.728057142763038, 'sideways_rsi_os': 41, 'sideways_rsi_ob': 87, 'sideways_adx_thresh': 23.5111649871011, 'sideways_atr_min_pct': 0.0018279839805535809, 'sideways_atr_max_pct': 0.11826608461708897, 'sideways_tp_mult': 2.9282920953091334, 'sideways_tsl_mult': 0.1927518817958113, 'sideways_time_stop': 28, 'sideways_use_sma': True, 'sideways_use_ema': True, 'sideways_use_atr': False, 'sideways_use_adx': True, 'sideways_use_spike': True, 'sideways_rsi_required': True}.
[I 2025-08-30 16:46:54,647] Trial 881 finished with values: [-1000000000.0, 1000000000.0] and parameters: {'p_sma': 8, 'p_std': 27, 'p_atr': 29, 'p_adx': 13, 'rsi_period': 82, 'ema1': 16, 'ema2': 28, 'slip_atr_k': 0.055374609285754356, 'slip_spread_k': 0.21602150503034456, 'spread_hl_frac': 0.02860949575604565, 'bb_std_mult': 2.0518197502445923, 'rsi_os': 50, 'rsi_ob': 75, 'vol_spike': 0.15718848829664872, 'adx_thresh': 12.952581442310054, 'atr_min_pct': 0.017117809796538885, 'atr_max_pct': 0.07063099208162328, 'tp_mult': 1.8498971896765843, 'tsl_mult': 0.6062140586069353, 'strategy': 'mean_reversion', 'time_stop': 226, 'use_sma': True, 'use_atr': True, 'use_adx': True, 'use_ema': False, 'use_spike': False, 'rsi_required': False, 'edge_k': 0.9067114736626776, 'edge_cap': 0.3671083872310684, 'bull_strategy': 'breakout', 'bull_bb_std_mult': 2.100083983149024, 'bull_rsi_os': 43, 'bull_rsi_ob': 59, 'bull_adx_thresh': 25.624142286864675, 'bull_atr_min_pct': 0.017104562182003773, 'bull_atr_max_pct': 0.10731010863062164, 'bull_tp_mult': 1.5098131166355688, 'bull_tsl_mult': 0.6671290457421881, 'bull_time_stop': 43, 'bull_use_sma': True, 'bull_use_ema': True, 'bull_use_atr': True, 'bull_use_adx': True, 'bull_use_spike': True, 'bull_rsi_required': True, 'bear_strategy': 'breakout', 'bear_bb_std_mult': 2.242399872563532, 'bear_rsi_os': 36, 'bear_rsi_ob': 89, 'bear_adx_thresh': 8.750375727439838, 'bear_atr_min_pct': 0.004371891821921436, 'bear_atr_max_pct': 0.11746951015490271, 'bear_tp_mult': 2.5322183555096287, 'bear_tsl_mult': 0.2958498340130773, 'bear_time_stop': 289, 'bear_use_sma': False, 'bear_use_ema': False, 'bear_use_atr': False, 'bear_use_adx': True, 'bear_use_spike': True, 'bear_rsi_required': True, 'sideways_strategy': 'breakout', 'sideways_bb_std_mult': 1.7533205479640064, 'sideways_rsi_os': 23, 'sideways_rsi_ob': 82, 'sideways_adx_thresh': 21.953949603298767, 'sideways_atr_min_pct': 0.0017355420809791369, 'sideways_atr_max_pct': 0.12558391560996493, 'sideways_tp_mult': 1.4917696105022427, 'sideways_tsl_mult': 0.1520064071925218, 'sideways_time_stop': 33, 'sideways_use_sma': True, 'sideways_use_ema': False, 'sideways_use_atr': False, 'sideways_use_adx': True, 'sideways_use_spike': True, 'sideways_rsi_required': True}.
