[I 2025-08-30 16:28:10,406] Trial 767 finished with values: [-1000000000.0, 1000000000.0] and parameters: {'p_sma': 42, 'p_std': 23, 'p_atr': 26, 'p_adx': 11, 'rsi_period': 31, 'ema1': 22, 'ema2': 42, 'slip_atr_k': 0.0659087821182616, 'slip_spread_k': 0.15641603568137738, 'spread_hl_frac': 0.023475494692068465, 'bb_std_mult': 2.7701029344575834, 'rsi_os': 42, 'rsi_ob': 81, 'vol_spike': 0.16664591244756147, 'adx_thresh': 14.63752714444639, 'atr_min_pct': 0.015065568097459583, 'atr_max_pct': 0.06738495271906185, 'tp_mult': 1.7342668966997874, 'tsl_mult': 0.34268599201939653, 'strategy': 'mean_reversion', 'time_stop': 239, 'use_sma': True, 'use_atr': False, 'use_adx': True, 'use_ema': True, 'use_spike': True, 'rsi_required': False, 'edge_k': 0.38427629403415337, 'edge_cap': 0.4387867666874016, 'bull_strategy': 'breakout', 'bull_bb_std_mult': 0.8357971591011523, 'bull_rsi_os': 42, 'bull_rsi_ob': 55, 'bull_adx_thresh': 32.54695195709751, 'bull_atr_min_pct': 0.029157497675403023, 'bull_atr_max_pct': 0.09409111857542142, 'bull_tp_mult': 2.0229433152633503, 'bull_tsl_mult': 0.9871281883756315, 'bull_time_stop': 34, 'bull_use_sma': True, 'bull_use_ema': True, 'bull_use_atr': True, 'bull_use_adx': True, 'bull_use_spike': True, 'bull_rsi_required': True, 'bear_strategy': 'mean_reversion', 'bear_bb_std_mult': 2.4294882120688417, 'bear_rsi_os': 31, 'bear_rsi_ob': 92, 'bear_adx_thresh': 16.09568017844782, 'bear_atr_min_pct': 0.005222008356383869, 'bear_atr_max_pct': 0.07260460653860473, 'bear_tp_mult': 2.893007566256849, 'bear_tsl_mult': 0.7360364064018761, 'bear_time_stop': 281, 'bear_use_sma': False, 'bear_use_ema': False, 'bear_use_atr': True, 'bear_use_adx': True, 'bear_use_spike': True, 'bear_rsi_required': True, 'sideways_strategy': 'breakout', 'sideways_bb_std_mult': 1.1092342691755355, 'sideways_rsi_os': 35, 'sideways_rsi_ob': 70, 'sideways_adx_thresh': 24.85172970032619, 'sideways_atr_min_pct': 0.005375169007417838, 'sideways_atr_max_pct': 0.029398299141176795, 'sideways_tp_mult': 2.8398540127622764, 'sideways_tsl_mult': 0.3813309182511065, 'sideways_time_stop': 63, 'sideways_use_sma': False, 'sideways_use_ema': True, 'sideways_use_atr': False, 'sideways_use_adx': True, 'sideways_use_spike': True, 'sideways_rsi_required': True}.
[I 2025-08-30 16:28:11,139] Trial 765 finished with values: [-1000000000.0, 1000000000.0] and parameters: {'p_sma': 5, 'p_std': 24, 'p_atr': 26, 'p_adx': 11, 'rsi_period': 79, 'ema1': 23, 'ema2': 32, 'slip_atr_k': 0.07219813846432728, 'slip_spread_k': 0.7975803286624159, 'spread_hl_frac': 0.024888627336525596, 'bb_std_mult': 2.240163197923581, 'rsi_os': 41, 'rsi_ob': 81, 'vol_spike': 0.2717508032258523, 'adx_thresh': 14.761507940483417, 'atr_min_pct': 0.014381263495893975, 'atr_max_pct': 0.07385440246260024, 'tp_mult': 1.5439082116850955, 'tsl_mult': 0.4518725429887581, 'strategy': 'mean_reversion', 'time_stop': 241, 'use_sma': True, 'use_atr': False, 'use_adx': False, 'use_ema': True, 'use_spike': True, 'rsi_required': False, 'edge_k': 0.46387034802655264, 'edge_cap': 0.998956329448129, 'bull_strategy': 'breakout', 'bull_bb_std_mult': 0.7527817091642655, 'bull_rsi_os': 43, 'bull_rsi_ob': 65, 'bull_adx_thresh': 22.744289259765225, 'bull_atr_min_pct': 0.021392566694187275, 'bull_atr_max_pct': 0.08267298769590214, 'bull_tp_mult': 2.4197101678821795, 'bull_tsl_mult': 0.1355893041723091, 'bull_time_stop': 33, 'bull_use_sma': True, 'bull_use_ema': True, 'bull_use_atr': True, 'bull_use_adx': True, 'bull_use_spike': True, 'bull_rsi_required': True, 'bear_strategy': 'mean_reversion', 'bear_bb_std_mult': 2.4144283528795016, 'bear_rsi_os': 31, 'bear_rsi_ob': 82, 'bear_adx_thresh': 25.778864416400246, 'bear_atr_min_pct': 0.026335283359053475, 'bear_atr_max_pct': 0.07290385072184594, 'bear_tp_mult': 2.7867071478156022, 'bear_tsl_mult': 0.31305148351765955, 'bear_time_stop': 282, 'bear_use_sma': False, 'bear_use_ema': False, 'bear_use_atr': True, 'bear_use_adx': True, 'bear_use_spike': True, 'bear_rsi_required': True, 'sideways_strategy': 'breakout', 'sideways_bb_std_mult': 1.097063049609958, 'sideways_rsi_os': 39, 'sideways_rsi_ob': 61, 'sideways_adx_thresh': 20.313229212746187, 'sideways_atr_min_pct': 0.0011333712270655343, 'sideways_atr_max_pct': 0.09968097263945298, 'sideways_tp_mult': 2.9153093700844237, 'sideways_tsl_mult': 0.9598573696191639, 'sideways_time_stop': 87, 'sideways_use_sma': False, 'sideways_use_ema': True, 'sideways_use_atr': False, 'sideways_use_adx': True, 'sideways_use_spike': True, 'sideways_rsi_required': True}.
[I 2025-08-30 16:28:11,535] Trial 764 finished with values: [-1000000000.0, 1000000000.0] and parameters: {'p_sma': 5, 'p_std': 23, 'p_atr': 26, 'p_adx': 9, 'rsi_period': 77, 'ema1': 23, 'ema2': 23, 'slip_atr_k': 0.24495753854042718, 'slip_spread_k': 0.9784451431408616, 'spread_hl_frac': 0.023465703680352012, 'bb_std_mult': 2.2333179703337396, 'rsi_os': 41, 'rsi_ob': 81, 'vol_spike': 0.16463823292831983, 'adx_thresh': 15.116641525297018, 'atr_min_pct': 0.014274783635438411, 'atr_max_pct': 0.07436553506311556, 'tp_mult': 1.9208194780904049, 'tsl_mult': 0.4477196410044963, 'strategy': 'mean_reversion', 'time_stop': 238, 'use_sma': True, 'use_atr': False, 'use_adx': False, 'use_ema': True, 'use_spike': True, 'rsi_required': False, 'edge_k': 1.1458438879949058, 'edge_cap': 0.6394989183608571, 'bull_strategy': 'breakout', 'bull_bb_std_mult': 0.8672376736264815, 'bull_rsi_os': 43, 'bull_rsi_ob': 65, 'bull_adx_thresh': 22.718756703387875, 'bull_atr_min_pct': 0.019557379948001642, 'bull_atr_max_pct': 0.08166683393473236, 'bull_tp_mult': 2.04818518912452, 'bull_tsl_mult': 0.13259578651339474, 'bull_time_stop': 34, 'bull_use_sma': True, 'bull_use_ema': True, 'bull_use_atr': True, 'bull_use_adx': True, 'bull_use_spike': True, 'bull_rsi_required': True, 'bear_strategy': 'mean_reversion', 'bear_bb_std_mult': 2.596188141871911, 'bear_rsi_os': 31, 'bear_rsi_ob': 82, 'bear_adx_thresh': 15.89219465670836, 'bear_atr_min_pct': 0.02105814868615402, 'bear_atr_max_pct': 0.0737477837370115, 'bear_tp_mult': 2.768091749325443, 'bear_tsl_mult': 0.7365703503844627, 'bear_time_stop': 278, 'bear_use_sma': False, 'bear_use_ema': False, 'bear_use_atr': True, 'bear_use_adx': True, 'bear_use_spike': True, 'bear_rsi_required': True, 'sideways_strategy': 'breakout', 'sideways_bb_std_mult': 0.8693802018869592, 'sideways_rsi_os': 35, 'sideways_rsi_ob': 67, 'sideways_adx_thresh': 24.804927670122197, 'sideways_atr_min_pct': 0.005735445826989731, 'sideways_atr_max_pct': 0.09965140810632961, 'sideways_tp_mult': 2.855340065548125, 'sideways_tsl_mult': 0.7415926582814816, 'sideways_time_stop': 87, 'sideways_use_sma': False, 'sideways_use_ema': True, 'sideways_use_atr': False, 'sideways_use_adx': True, 'sideways_use_spike': True, 'sideways_rsi_required': True}.
[I 2025-08-30 16:28:12,014] Trial 768 finished with values: [-1000000000.0, 1000000000.0] and parameters: {'p_sma': 6, 'p_std': 57, 'p_atr': 25, 'p_adx': 11, 'rsi_period': 80, 'ema1': 22, 'ema2': 44, 'slip_atr_k': 0.17984059957346016, 'slip_spread_k': 0.023132512217934886, 'spread_hl_frac': 0.02353173742392351, 'bb_std_mult': 2.4691960570579936, 'rsi_os': 40, 'rsi_ob': 88, 'vol_spike': 0.16634353505385507, 'adx_thresh': 14.5313338766013, 'atr_min_pct': 0.014354435848509033, 'atr_max_pct': 0.05306279412021023, 'tp_mult': 1.9398643788603676, 'tsl_mult': 0.3435081178649365, 'strategy': 'mean_reversion', 'time_stop': 228, 'use_sma': True, 'use_atr': False, 'use_adx': False, 'use_ema': True, 'use_spike': True, 'rsi_required': False, 'edge_k': 0.369479475016426, 'edge_cap': 0.5854735035044731, 'bull_strategy': 'breakout', 'bull_bb_std_mult': 0.8245518979025741, 'bull_rsi_os': 41, 'bull_rsi_ob': 63, 'bull_adx_thresh': 32.37151939305677, 'bull_atr_min_pct': 0.021324454119141124, 'bull_atr_max_pct': 0.0897063128137282, 'bull_tp_mult': 1.2377405204995264, 'bull_tsl_mult': 0.21312221087776212, 'bull_time_stop': 35, 'bull_use_sma': True, 'bull_use_ema': True, 'bull_use_atr': True, 'bull_use_adx': True, 'bull_use_spike': True, 'bull_rsi_required': True, 'bear_strategy': 'mean_reversion', 'bear_bb_std_mult': 2.5813370680190206, 'bear_rsi_os': 31, 'bear_rsi_ob': 92, 'bear_adx_thresh': 15.932272961828602, 'bear_atr_min_pct': 0.026424864881899275, 'bear_atr_max_pct': 0.03501302244691798, 'bear_tp_mult': 2.761718344295022, 'bear_tsl_mult': 0.24677589889947446, 'bear_time_stop': 225, 'bear_use_sma': False, 'bear_use_ema': False, 'bear_use_atr': True, 'bear_use_adx': True, 'bear_use_spike': True, 'bear_rsi_required': True, 'sideways_strategy': 'breakout', 'sideways_bb_std_mult': 0.8656635211549015, 'sideways_rsi_os': 40, 'sideways_rsi_ob': 67, 'sideways_adx_thresh': 19.978521741193326, 'sideways_atr_min_pct': 0.018659384637958885, 'sideways_atr_max_pct': 0.10004645105509079, 'sideways_tp_mult': 2.8573406115500797, 'sideways_tsl_mult': 0.9403185688572804, 'sideways_time_stop': 63, 'sideways_use_sma': True, 'sideways_use_ema': True, 'sideways_use_atr': False, 'sideways_use_adx': True, 'sideways_use_spike': True, 'sideways_rsi_required': True}.
[I 2025-08-30 16:28:58,448] Trial 770 finished with values: [-1000000000.0, 1000000000.0] and parameters: {'p_sma': 6, 'p_std': 57, 'p_atr': 25, 'p_adx': 10, 'rsi_period': 77, 'ema1': 24, 'ema2': 29, 'slip_atr_k': 0.2118019285332216, 'slip_spread_k': 0.10644008318533468, 'spread_hl_frac': 0.015181582010595296, 'bb_std_mult': 2.4614984640975885, 'rsi_os': 40, 'rsi_ob': 70, 'vol_spike': 0.1628981816473336, 'adx_thresh': 16.253270678615397, 'atr_min_pct': 0.015620988632378067, 'atr_max_pct': 0.0766386766455852, 'tp_mult': 1.6148707820658117, 'tsl_mult': 0.1803030326981096, 'strategy': 'mean_reversion', 'time_stop': 213, 'use_sma': True, 'use_atr': True, 'use_adx': False, 'use_ema': True, 'use_spike': False, 'rsi_required': False, 'edge_k': 1.140549631218001, 'edge_cap': 0.5843187357626386, 'bull_strategy': 'breakout', 'bull_bb_std_mult': 0.9604640998158058, 'bull_rsi_os': 41, 'bull_rsi_ob': 82, 'bull_adx_thresh': 7.697118680650455, 'bull_atr_min_pct': 0.008962813640261642, 'bull_atr_max_pct': 0.10913478547589676, 'bull_tp_mult': 1.2913894080443709, 'bull_tsl_mult': 0.02634002085452971, 'bull_time_stop': 19, 'bull_use_sma': True, 'bull_use_ema': True, 'bull_use_atr': True, 'bull_use_adx': True, 'bull_use_spike': False, 'bull_rsi_required': True, 'bear_strategy': 'mean_reversion', 'bear_bb_std_mult': 2.5151347543137015, 'bear_rsi_os': 34, 'bear_rsi_ob': 80, 'bear_adx_thresh': 28.145750540672253, 'bear_atr_min_pct': 0.02994236213941713, 'bear_atr_max_pct': 0.03335649703190378, 'bear_tp_mult': 2.9917899870168307, 'bear_tsl_mult': 0.21028921763339098, 'bear_time_stop': 260, 'bear_use_sma': False, 'bear_use_ema': False, 'bear_use_atr': False, 'bear_use_adx': True, 'bear_use_spike': True, 'bear_rsi_required': False, 'sideways_strategy': 'breakout', 'sideways_bb_std_mult': 0.8623586229929459, 'sideways_rsi_os': 20, 'sideways_rsi_ob': 67, 'sideways_adx_thresh': 23.9165802384574, 'sideways_atr_min_pct': 0.01877776881142413, 'sideways_atr_max_pct': 0.10807817658412712, 'sideways_tp_mult': 2.9561173613167675, 'sideways_tsl_mult': 0.06556634163672032, 'sideways_time_stop': 168, 'sideways_use_sma': True, 'sideways_use_ema': False, 'sideways_use_atr': False, 'sideways_use_adx': True, 'sideways_use_spike': True, 'sideways_rsi_required': True}.
[I 2025-08-30 16:28:59,005] Trial 771 finished with values: [-1000000000.0, 1000000000.0] and parameters: {'p_sma': 9, 'p_std': 50, 'p_atr': 25, 'p_adx': 10, 'rsi_period': 75, 'ema1': 24, 'ema2': 31, 'slip_atr_k': 0.17195466643764565, 'slip_spread_k': 0.46503341678523197, 'spread_hl_frac': 0.015351576807850594, 'bb_std_mult': 2.4501682274272087, 'rsi_os': 39, 'rsi_ob': 73, 'vol_spike': 0.11119926491517305, 'adx_thresh': 26.74176962176733, 'atr_min_pct': 0.010606887742395904, 'atr_max_pct': 0.022966806189630956, 'tp_mult': 2.341052821463244, 'tsl_mult': 0.00021397935011457925, 'strategy': 'mean_reversion', 'time_stop': 226, 'use_sma': True, 'use_atr': True, 'use_adx': False, 'use_ema': True, 'use_spike': False, 'rsi_required': False, 'edge_k': 1.2100914062011188, 'edge_cap': 0.20501581401956886, 'bull_strategy': 'breakout', 'bull_bb_std_mult': 0.8000181034877633, 'bull_rsi_os': 41, 'bull_rsi_ob': 63, 'bull_adx_thresh': 24.62323331791972, 'bull_atr_min_pct': 0.011571263299964569, 'bull_atr_max_pct': 0.039436979588117614, 'bull_tp_mult': 1.2406332473243853, 'bull_tsl_mult': 0.2114933375598289, 'bull_time_stop': 20, 'bull_use_sma': True, 'bull_use_ema': True, 'bull_use_atr': True, 'bull_use_adx': True, 'bull_use_spike': False, 'bull_rsi_required': True, 'bear_strategy': 'mean_reversion', 'bear_bb_std_mult': 2.508468275527636, 'bear_rsi_os': 34, 'bear_rsi_ob': 88, 'bear_adx_thresh': 29.50838527386961, 'bear_atr_min_pct': 0.019512206570012614, 'bear_atr_max_pct': 0.03417325819338049, 'bear_tp_mult': 2.858226205621169, 'bear_tsl_mult': 0.25027754677193725, 'bear_time_stop': 260, 'bear_use_sma': False, 'bear_use_ema': False, 'bear_use_atr': False, 'bear_use_adx': True, 'bear_use_spike': True, 'bear_rsi_required': False, 'sideways_strategy': 'mean_reversion', 'sideways_bb_std_mult': 0.7947107173614574, 'sideways_rsi_os': 22, 'sideways_rsi_ob': 64, 'sideways_adx_thresh': 24.071663317305813, 'sideways_atr_min_pct': 0.01865061294078349, 'sideways_atr_max_pct': 0.14647706892963885, 'sideways_tp_mult': 2.970695953879281, 'sideways_tsl_mult': 0.888308713049428, 'sideways_time_stop': 168, 'sideways_use_sma': True, 'sideways_use_ema': False, 'sideways_use_atr': False, 'sideways_use_adx': True, 'sideways_use_spike': True, 'sideways_rsi_required': True}.
[I 2025-08-30 16:28:59,299] Trial 772 finished with values: [-1000000000.0, 1000000000.0] and parameters: {'p_sma': 10, 'p_std': 50, 'p_atr': 25, 'p_adx': 10, 'rsi_period': 13, 'ema1': 24, 'ema2': 30, 'slip_atr_k': 0.1462984804034881, 'slip_spread_k': 0.45351091326854653, 'spread_hl_frac': 0.014556194466457274, 'bb_std_mult': 3.2363774587570275, 'rsi_os': 38, 'rsi_ob': 51, 'vol_spike': 0.11027235847461528, 'adx_thresh': 17.630742809678658, 'atr_min_pct': 0.007929233202717361, 'atr_max_pct': 0.07641373168357003, 'tp_mult': 1.6190099994095553, 'tsl_mult': 0.16911331120382372, 'strategy': 'mean_reversion', 'time_stop': 214, 'use_sma': True, 'use_atr': True, 'use_adx': False, 'use_ema': True, 'use_spike': False, 'rsi_required': False, 'edge_k': 0.41992631722548535, 'edge_cap': 0.6014693925509148, 'bull_strategy': 'breakout', 'bull_bb_std_mult': 0.9563019695599136, 'bull_rsi_os': 22, 'bull_rsi_ob': 60, 'bull_adx_thresh': 23.46968464489303, 'bull_atr_min_pct': 0.012140389595925774, 'bull_atr_max_pct': 0.09913571364187955, 'bull_tp_mult': 1.3148208811216286, 'bull_tsl_mult': 0.019887321407669634, 'bull_time_stop': 17, 'bull_use_sma': True, 'bull_use_ema': True, 'bull_use_atr': True, 'bull_use_adx': True, 'bull_use_spike': False, 'bull_rsi_required': True, 'bear_strategy': 'breakout', 'bear_bb_std_mult': 2.5094228473455593, 'bear_rsi_os': 34, 'bear_rsi_ob': 58, 'bear_adx_thresh': 24.824339277490154, 'bear_atr_min_pct': 0.019875149745992807, 'bear_atr_max_pct': 0.13499626573619533, 'bear_tp_mult': 2.8492752249504063, 'bear_tsl_mult': 0.2080782313553312, 'bear_time_stop': 260, 'bear_use_sma': False, 'bear_use_ema': False, 'bear_use_atr': False, 'bear_use_adx': True, 'bear_use_spike': True, 'bear_rsi_required': False, 'sideways_strategy': 'mean_reversion', 'sideways_bb_std_mult': 3.290378564846371, 'sideways_rsi_os': 47, 'sideways_rsi_ob': 64, 'sideways_adx_thresh': 23.895965495313735, 'sideways_atr_min_pct': 0.023662579170483138, 'sideways_atr_max_pct': 0.06310205396984331, 'sideways_tp_mult': 2.953475934756453, 'sideways_tsl_mult': 0.9326806841533438, 'sideways_time_stop': 211, 'sideways_use_sma': True, 'sideways_use_ema': False, 'sideways_use_atr': False, 'sideways_use_adx': True, 'sideways_use_spike': True, 'sideways_rsi_required': True}.
[I 2025-08-30 16:28:59,859] Trial 769 finished with values: [-1000000000.0, 1000000000.0] and parameters: {'p_sma': 16, 'p_std': 57, 'p_atr': 25, 'p_adx': 10, 'rsi_period': 77, 'ema1': 23, 'ema2': 31, 'slip_atr_k': 0.06502782745555656, 'slip_spread_k': 0.10677792228748602, 'spread_hl_frac': 0.025153429136804063, 'bb_std_mult': 2.460726508564719, 'rsi_os': 40, 'rsi_ob': 88, 'vol_spike': 0.0007290718204626956, 'adx_thresh': 16.158247517560067, 'atr_min_pct': 0.014536868555435895, 'atr_max_pct': 0.07418834133330149, 'tp_mult': 1.7201230309465894, 'tsl_mult': 0.18268971416081575, 'strategy': 'mean_reversion', 'time_stop': 226, 'use_sma': True, 'use_atr': True, 'use_adx': False, 'use_ema': True, 'use_spike': False, 'rsi_required': False, 'edge_k': 0.451406626211133, 'edge_cap': 0.5866880808675425, 'bull_strategy': 'breakout', 'bull_bb_std_mult': 0.784644075855295, 'bull_rsi_os': 41, 'bull_rsi_ob': 63, 'bull_adx_thresh': 22.80537206792863, 'bull_atr_min_pct': 0.021216396139393388, 'bull_atr_max_pct': 0.08918405149825469, 'bull_tp_mult': 1.273709401162216, 'bull_tsl_mult': 0.2156889492758035, 'bull_time_stop': 15, 'bull_use_sma': True, 'bull_use_ema': True, 'bull_use_atr': True, 'bull_use_adx': True, 'bull_use_spike': False, 'bull_rsi_required': True, 'bear_strategy': 'mean_reversion', 'bear_bb_std_mult': 2.5137765285404425, 'bear_rsi_os': 33, 'bear_rsi_ob': 80, 'bear_adx_thresh': 29.66938249840387, 'bear_atr_min_pct': 0.02990616660974212, 'bear_atr_max_pct': 0.09342674207656232, 'bear_tp_mult': 2.9996533582884544, 'bear_tsl_mult': 0.3244475947795692, 'bear_time_stop': 294, 'bear_use_sma': False, 'bear_use_ema': False, 'bear_use_atr': True, 'bear_use_adx': True, 'bear_use_spike': True, 'bear_rsi_required': False, 'sideways_strategy': 'breakout', 'sideways_bb_std_mult': 0.5781162839427474, 'sideways_rsi_os': 39, 'sideways_rsi_ob': 62, 'sideways_adx_thresh': 23.943725468159123, 'sideways_atr_min_pct': 0.023647811906341444, 'sideways_atr_max_pct': 0.06296716984810412, 'sideways_tp_mult': 2.9960373784070624, 'sideways_tsl_mult': 0.9384918308446653, 'sideways_time_stop': 167, 'sideways_use_sma': True, 'sideways_use_ema': True, 'sideways_use_atr': False, 'sideways_use_adx': True, 'sideways_use_spike': True, 'sideways_rsi_required': True}.
[I 2025-08-30 16:29:45,111] Trial 773 finished with values: [-0.026358024487707743, 0.027095026158335807] and parameters: {'p_sma': 10, 'p_std': 54, 'p_atr': 26, 'p_adx': 12, 'rsi_period': 78, 'ema1': 24, 'ema2': 48, 'slip_atr_k': 0.06514244882371326, 'slip_spread_k': 0.15217481353327147, 'spread_hl_frac': 0.025070930294457987, 'bb_std_mult': 2.316716215896097, 'rsi_os': 14, 'rsi_ob': 52, 'vol_spike': 0.2193839011011911, 'adx_thresh': 13.978172243573148, 'atr_min_pct': 0.027566612324506766, 'atr_max_pct': 0.0825526817170545, 'tp_mult': 2.364465553419569, 'tsl_mult': 0.25687838075040553, 'strategy': 'mean_reversion', 'time_stop': 226, 'use_sma': True, 'use_atr': True, 'use_adx': False, 'use_ema': True, 'use_spike': False, 'rsi_required': False, 'edge_k': 0.5201325288569182, 'edge_cap': 0.6038799739418358, 'bull_strategy': 'breakout', 'bull_bb_std_mult': 1.066127527296038, 'bull_rsi_os': 34, 'bull_rsi_ob': 60, 'bull_adx_thresh': 27.294526224318723, 'bull_atr_min_pct': 0.012600444021469362, 'bull_atr_max_pct': 0.10030808716269095, 'bull_tp_mult': 1.549846104342244, 'bull_tsl_mult': 0.06255715082711438, 'bull_time_stop': 50, 'bull_use_sma': True, 'bull_use_ema': True, 'bull_use_atr': True, 'bull_use_adx': True, 'bull_use_spike': False, 'bull_rsi_required': True, 'bear_strategy': 'breakout', 'bear_bb_std_mult': 2.4903497757976427, 'bear_rsi_os': 55, 'bear_rsi_ob': 88, 'bear_adx_thresh': 11.824104817511868, 'bear_atr_min_pct': 0.002406854772688812, 'bear_atr_max_pct': 0.09236110309296343, 'bear_tp_mult': 2.8597030888066457, 'bear_tsl_mult': 0.2906558447883625, 'bear_time_stop': 270, 'bear_use_sma': False, 'bear_use_ema': False, 'bear_use_atr': True, 'bear_use_adx': True, 'bear_use_spike': True, 'bear_rsi_required': False, 'sideways_strategy': 'mean_reversion', 'sideways_bb_std_mult': 1.6091791081993476, 'sideways_rsi_os': 40, 'sideways_rsi_ob': 64, 'sideways_adx_thresh': 21.837851510581377, 'sideways_atr_min_pct': 0.001710970671628744, 'sideways_atr_max_pct': 0.10334050932874647, 'sideways_tp_mult': 2.9477352548957887, 'sideways_tsl_mult': 0.9086454691813237, 'sideways_time_stop': 74, 'sideways_use_sma': True, 'sideways_use_ema': False, 'sideways_use_atr': False, 'sideways_use_adx': True, 'sideways_use_spike': True, 'sideways_rsi_required': True}.
