[I 2025-08-30 15:39:14,951] Trial 522 finished with values: [-1000000000.0, 1000000000.0] and parameters: {'p_sma': 5, 'p_std': 60, 'p_atr': 8, 'p_adx': 18, 'rsi_period': 77, 'ema1': 22, 'ema2': 33, 'slip_atr_k': 0.06782394212909636, 'slip_spread_k': 0.3864958711020455, 'spread_hl_frac': 0.008294113257312451, 'bb_std_mult': 1.089630178111382, 'rsi_os': 11, 'rsi_ob': 79, 'vol_spike': 0.18020506436053932, 'adx_thresh': 11.279697381936495, 'atr_min_pct': 0.025050992601370174, 'atr_max_pct': 0.08205730962061408, 'tp_mult': 2.161018886125642, 'tsl_mult': 0.7192724184999849, 'strategy': 'breakout', 'time_stop': 140, 'use_sma': False, 'use_atr': True, 'use_adx': False, 'use_ema': True, 'use_spike': True, 'rsi_required': True, 'edge_k': 0.16118967751990956, 'edge_cap': 0.5344467316137884, 'bull_strategy': 'mean_reversion', 'bull_bb_std_mult': 1.7940378359334819, 'bull_rsi_os': 41, 'bull_rsi_ob': 69, 'bull_adx_thresh': 21.202966606301512, 'bull_atr_min_pct': 0.019112303627993443, 'bull_atr_max_pct': 0.10482163872026709, 'bull_tp_mult': 2.7890665534701222, 'bull_tsl_mult': 0.33709837502198464, 'bull_time_stop': 41, 'bull_use_sma': False, 'bull_use_ema': False, 'bull_use_atr': False, 'bull_use_adx': False, 'bull_use_spike': True, 'bull_rsi_required': False, 'bear_strategy': 'mean_reversion', 'bear_bb_std_mult': 2.4087201063285915, 'bear_rsi_os': 27, 'bear_rsi_ob': 76, 'bear_adx_thresh': 27.461445738713014, 'bear_atr_min_pct': 0.005971873726687976, 'bear_atr_max_pct': 0.05085293109167821, 'bear_tp_mult': 1.6610986474977898, 'bear_tsl_mult': 0.9627076040663062, 'bear_time_stop': 71, 'bear_use_sma': True, 'bear_use_ema': True, 'bear_use_atr': False, 'bear_use_adx': False, 'bear_use_spike': False, 'bear_rsi_required': True, 'sideways_strategy': 'breakout', 'sideways_bb_std_mult': 0.5179090356265998, 'sideways_rsi_os': 28, 'sideways_rsi_ob': 57, 'sideways_adx_thresh': 28.38952870383928, 'sideways_atr_min_pct': 0.01258452817636979, 'sideways_atr_max_pct': 0.107511083745076, 'sideways_tp_mult': 2.487682853085311, 'sideways_tsl_mult': 0.9999803474821648, 'sideways_time_stop': 88, 'sideways_use_sma': True, 'sideways_use_ema': True, 'sideways_use_atr': True, 'sideways_use_adx': False, 'sideways_use_spike': True, 'sideways_rsi_required': False}.
[I 2025-08-30 15:40:00,299] Trial 525 finished with values: [-1000000000.0, 1000000000.0] and parameters: {'p_sma': 8, 'p_std': 60, 'p_atr': 27, 'p_adx': 29, 'rsi_period': 74, 'ema1': 20, 'ema2': 32, 'slip_atr_k': 0.07657514015012454, 'slip_spread_k': 0.08661388078895096, 'spread_hl_frac': 0.02564313693221628, 'bb_std_mult': 2.311670465503246, 'rsi_os': 26, 'rsi_ob': 80, 'vol_spike': 0.15175316489309437, 'adx_thresh': 12.935414924557673, 'atr_min_pct': 0.005579620938544031, 'atr_max_pct': 0.07170366436583606, 'tp_mult': 1.8136875722150696, 'tsl_mult': 0.7299046162230607, 'strategy': 'breakout', 'time_stop': 79, 'use_sma': True, 'use_atr': True, 'use_adx': True, 'use_ema': True, 'use_spike': True, 'rsi_required': True, 'edge_k': 1.8035767616532334, 'edge_cap': 0.13513577909953622, 'bull_strategy': 'mean_reversion', 'bull_bb_std_mult': 0.6704582814506554, 'bull_rsi_os': 21, 'bull_rsi_ob': 53, 'bull_adx_thresh': 6.445959147187617, 'bull_atr_min_pct': 0.018885970822420228, 'bull_atr_max_pct': 0.0704584240512361, 'bull_tp_mult': 2.16742346037856, 'bull_tsl_mult': 0.3247869174545252, 'bull_time_stop': 126, 'bull_use_sma': False, 'bull_use_ema': False, 'bull_use_atr': True, 'bull_use_adx': False, 'bull_use_spike': True, 'bull_rsi_required': False, 'bear_strategy': 'breakout', 'bear_bb_std_mult': 0.6213144336130023, 'bear_rsi_os': 27, 'bear_rsi_ob': 74, 'bear_adx_thresh': 9.646898368636709, 'bear_atr_min_pct': 0.005682711169445423, 'bear_atr_max_pct': 0.06483292164553643, 'bear_tp_mult': 2.3037797840585883, 'bear_tsl_mult': 0.9591631822772888, 'bear_time_stop': 159, 'bear_use_sma': True, 'bear_use_ema': False, 'bear_use_atr': False, 'bear_use_adx': False, 'bear_use_spike': False, 'bear_rsi_required': True, 'sideways_strategy': 'breakout', 'sideways_bb_std_mult': 2.641791959062156, 'sideways_rsi_os': 42, 'sideways_rsi_ob': 78, 'sideways_adx_thresh': 19.465317506652674, 'sideways_atr_min_pct': 0.012409555338517776, 'sideways_atr_max_pct': 0.1069568244612613, 'sideways_tp_mult': 2.4921577585601686, 'sideways_tsl_mult': 0.9820526745770027, 'sideways_time_stop': 84, 'sideways_use_sma': True, 'sideways_use_ema': True, 'sideways_use_atr': True, 'sideways_use_adx': False, 'sideways_use_spike': False, 'sideways_rsi_required': False}.
[I 2025-08-30 15:40:01,188] Trial 523 finished with values: [-0.01103714227500352, 0.011096421596521352] and parameters: {'p_sma': 8, 'p_std': 60, 'p_atr': 16, 'p_adx': 24, 'rsi_period': 11, 'ema1': 30, 'ema2': 33, 'slip_atr_k': 0.06911093117795275, 'slip_spread_k': 0.08322046677771043, 'spread_hl_frac': 0.02684041921962619, 'bb_std_mult': 1.1631074349565478, 'rsi_os': 11, 'rsi_ob': 80, 'vol_spike': 0.17932305223235878, 'adx_thresh': 11.449444341540012, 'atr_min_pct': 0.013650357005939508, 'atr_max_pct': 0.07655949132205635, 'tp_mult': 1.81903835656825, 'tsl_mult': 0.7230797613092567, 'strategy': 'breakout', 'time_stop': 225, 'use_sma': False, 'use_atr': True, 'use_adx': False, 'use_ema': True, 'use_spike': True, 'rsi_required': True, 'edge_k': 0.17416310746142186, 'edge_cap': 0.05100029423176594, 'bull_strategy': 'mean_reversion', 'bull_bb_std_mult': 2.5622029422881774, 'bull_rsi_os': 41, 'bull_rsi_ob': 69, 'bull_adx_thresh': 21.21198178358281, 'bull_atr_min_pct': 0.019841394277714454, 'bull_atr_max_pct': 0.0690231456463675, 'bull_tp_mult': 2.5858171926240567, 'bull_tsl_mult': 0.3041841111273974, 'bull_time_stop': 177, 'bull_use_sma': False, 'bull_use_ema': False, 'bull_use_atr': True, 'bull_use_adx': False, 'bull_use_spike': True, 'bull_rsi_required': False, 'bear_strategy': 'breakout', 'bear_bb_std_mult': 2.3840194670274015, 'bear_rsi_os': 27, 'bear_rsi_ob': 76, 'bear_adx_thresh': 30.571280794923133, 'bear_atr_min_pct': 0.021165363343468347, 'bear_atr_max_pct': 0.08536413235214507, 'bear_tp_mult': 1.585822644423805, 'bear_tsl_mult': 0.9615221328540404, 'bear_time_stop': 205, 'bear_use_sma': True, 'bear_use_ema': True, 'bear_use_atr': False, 'bear_use_adx': False, 'bear_use_spike': False, 'bear_rsi_required': True, 'sideways_strategy': 'breakout', 'sideways_bb_std_mult': 0.5076213156653497, 'sideways_rsi_os': 43, 'sideways_rsi_ob': 57, 'sideways_adx_thresh': 20.092764562455784, 'sideways_atr_min_pct': 0.002254001927007283, 'sideways_atr_max_pct': 0.10772979092762225, 'sideways_tp_mult': 2.50071013988359, 'sideways_tsl_mult': 0.9436574469361134, 'sideways_time_stop': 87, 'sideways_use_sma': True, 'sideways_use_ema': True, 'sideways_use_atr': True, 'sideways_use_adx': False, 'sideways_use_spike': False, 'sideways_rsi_required': False}.
[I 2025-08-30 15:40:01,997] Trial 524 finished with values: [-1000000000.0, 1000000000.0] and parameters: {'p_sma': 6, 'p_std': 60, 'p_atr': 16, 'p_adx': 15, 'rsi_period': 78, 'ema1': 6, 'ema2': 34, 'slip_atr_k': 0.06906737823209833, 'slip_spread_k': 0.10939694457292552, 'spread_hl_frac': 0.04803547814636655, 'bb_std_mult': 2.2914560995986903, 'rsi_os': 50, 'rsi_ob': 73, 'vol_spike': 0.15414216685738513, 'adx_thresh': 7.17165690239726, 'atr_min_pct': 0.013551748231673336, 'atr_max_pct': 0.14959992308325926, 'tp_mult': 1.193419114571211, 'tsl_mult': 0.7183906595437743, 'strategy': 'breakout', 'time_stop': 141, 'use_sma': True, 'use_atr': True, 'use_adx': True, 'use_ema': True, 'use_spike': True, 'rsi_required': True, 'edge_k': 0.11745875373978742, 'edge_cap': 0.1450123940851873, 'bull_strategy': 'mean_reversion', 'bull_bb_std_mult': 2.7914750443404417, 'bull_rsi_os': 41, 'bull_rsi_ob': 50, 'bull_adx_thresh': 32.75035599519724, 'bull_atr_min_pct': 0.019225377834915562, 'bull_atr_max_pct': 0.10209603198512071, 'bull_tp_mult': 2.234859521567202, 'bull_tsl_mult': 0.3066770016223439, 'bull_time_stop': 127, 'bull_use_sma': False, 'bull_use_ema': False, 'bull_use_atr': True, 'bull_use_adx': False, 'bull_use_spike': True, 'bull_rsi_required': False, 'bear_strategy': 'breakout', 'bear_bb_std_mult': 0.6281448377956516, 'bear_rsi_os': 27, 'bear_rsi_ob': 74, 'bear_adx_thresh': 12.155864630349875, 'bear_atr_min_pct': 0.019969907196276573, 'bear_atr_max_pct': 0.08393417678739622, 'bear_tp_mult': 1.568798559105693, 'bear_tsl_mult': 0.9522881604519117, 'bear_time_stop': 78, 'bear_use_sma': True, 'bear_use_ema': False, 'bear_use_atr': False, 'bear_use_adx': False, 'bear_use_spike': False, 'bear_rsi_required': True, 'sideways_strategy': 'breakout', 'sideways_bb_std_mult': 2.655308290971026, 'sideways_rsi_os': 22, 'sideways_rsi_ob': 58, 'sideways_adx_thresh': 8.231543616026604, 'sideways_atr_min_pct': 0.0004712684106065908, 'sideways_atr_max_pct': 0.10783754372372621, 'sideways_tp_mult': 1.3917975914881215, 'sideways_tsl_mult': 0.9988136884812455, 'sideways_time_stop': 88, 'sideways_use_sma': True, 'sideways_use_ema': True, 'sideways_use_atr': True, 'sideways_use_adx': False, 'sideways_use_spike': False, 'sideways_rsi_required': False}.
[I 2025-08-30 15:40:02,281] Trial 526 finished with values: [-0.07095746398443004, 0.07093087652963477] and parameters: {'p_sma': 7, 'p_std': 55, 'p_atr': 27, 'p_adx': 13, 'rsi_period': 38, 'ema1': 11, 'ema2': 32, 'slip_atr_k': 0.07513468004126696, 'slip_spread_k': 0.18328763054601674, 'spread_hl_frac': 0.025591732516874806, 'bb_std_mult': 2.290866955578616, 'rsi_os': 26, 'rsi_ob': 73, 'vol_spike': 0.15613047499417723, 'adx_thresh': 13.958602248840474, 'atr_min_pct': 0.0030127592825132405, 'atr_max_pct': 0.0944367129489246, 'tp_mult': 1.8242048607549253, 'tsl_mult': 0.6893487001059422, 'strategy': 'breakout', 'time_stop': 78, 'use_sma': True, 'use_atr': True, 'use_adx': True, 'use_ema': True, 'use_spike': True, 'rsi_required': True, 'edge_k': 1.807461846075203, 'edge_cap': 0.5934718546826542, 'bull_strategy': 'mean_reversion', 'bull_bb_std_mult': 0.6804370353022662, 'bull_rsi_os': 6, 'bull_rsi_ob': 51, 'bull_adx_thresh': 26.622912665413303, 'bull_atr_min_pct': 0.017320683208362598, 'bull_atr_max_pct': 0.06978798777124622, 'bull_tp_mult': 2.5608804989601275, 'bull_tsl_mult': 0.2705080449129127, 'bull_time_stop': 176, 'bull_use_sma': True, 'bull_use_ema': False, 'bull_use_atr': True, 'bull_use_adx': False, 'bull_use_spike': True, 'bull_rsi_required': False, 'bear_strategy': 'breakout', 'bear_bb_std_mult': 2.045030664868433, 'bear_rsi_os': 29, 'bear_rsi_ob': 45, 'bear_adx_thresh': 12.15328774244287, 'bear_atr_min_pct': 0.021875507938650778, 'bear_atr_max_pct': 0.06539284210427317, 'bear_tp_mult': 1.5839111160478112, 'bear_tsl_mult': 0.9495533832197794, 'bear_time_stop': 276, 'bear_use_sma': True, 'bear_use_ema': False, 'bear_use_atr': False, 'bear_use_adx': True, 'bear_use_spike': False, 'bear_rsi_required': True, 'sideways_strategy': 'breakout', 'sideways_bb_std_mult': 2.643487126903401, 'sideways_rsi_os': 43, 'sideways_rsi_ob': 82, 'sideways_adx_thresh': 19.747523508864674, 'sideways_atr_min_pct': 0.0004920851795814547, 'sideways_atr_max_pct': 0.09635580222028074, 'sideways_tp_mult': 2.3152879909503388, 'sideways_tsl_mult': 0.9397384585630014, 'sideways_time_stop': 138, 'sideways_use_sma': True, 'sideways_use_ema': True, 'sideways_use_atr': True, 'sideways_use_adx': False, 'sideways_use_spike': False, 'sideways_rsi_required': False}.
[I 2025-08-30 15:40:57,684] Trial 529 finished with values: [-1000000000.0, 1000000000.0] and parameters: {'p_sma': 7, 'p_std': 55, 'p_atr': 16, 'p_adx': 25, 'rsi_period': 55, 'ema1': 17, 'ema2': 34, 'slip_atr_k': 0.21108958753103502, 'slip_spread_k': 0.13443701640949288, 'spread_hl_frac': 0.02658041812273739, 'bb_std_mult': 1.6032823706162078, 'rsi_os': 25, 'rsi_ob': 75, 'vol_spike': 0.16963625164740423, 'adx_thresh': 13.886065340229997, 'atr_min_pct': 0.026969830477229832, 'atr_max_pct': 0.07745931751730838, 'tp_mult': 1.8122708418011426, 'tsl_mult': 0.38781309495545885, 'strategy': 'breakout', 'time_stop': 126, 'use_sma': False, 'use_atr': True, 'use_adx': False, 'use_ema': True, 'use_spike': True, 'rsi_required': True, 'edge_k': 0.743306817474968, 'edge_cap': 0.5548326477001528, 'bull_strategy': 'mean_reversion', 'bull_bb_std_mult': 1.506011655184157, 'bull_rsi_os': 40, 'bull_rsi_ob': 51, 'bull_adx_thresh': 22.58168340609894, 'bull_atr_min_pct': 0.021320644057424173, 'bull_atr_max_pct': 0.14995248008147163, 'bull_tp_mult': 2.565507606179235, 'bull_tsl_mult': 0.8193930651788393, 'bull_time_stop': 153, 'bull_use_sma': True, 'bull_use_ema': False, 'bull_use_atr': False, 'bull_use_adx': False, 'bull_use_spike': True, 'bull_rsi_required': False, 'bear_strategy': 'mean_reversion', 'bear_bb_std_mult': 0.6973510822918536, 'bear_rsi_os': 29, 'bear_rsi_ob': 77, 'bear_adx_thresh': 30.462552702989775, 'bear_atr_min_pct': 0.002135006780387333, 'bear_atr_max_pct': 0.14089835660790773, 'bear_tp_mult': 1.517151724578002, 'bear_tsl_mult': 0.9403530954714151, 'bear_time_stop': 59, 'bear_use_sma': True, 'bear_use_ema': True, 'bear_use_atr': True, 'bear_use_adx': True, 'bear_use_spike': False, 'bear_rsi_required': True, 'sideways_strategy': 'mean_reversion', 'sideways_bb_std_mult': 1.1786247520284037, 'sideways_rsi_os': 43, 'sideways_rsi_ob': 56, 'sideways_adx_thresh': 27.38393698096973, 'sideways_atr_min_pct': 0.013261911453007001, 'sideways_atr_max_pct': 0.043467464865488824, 'sideways_tp_mult': 1.2744346207231985, 'sideways_tsl_mult': 0.9415328364547808, 'sideways_time_stop': 262, 'sideways_use_sma': True, 'sideways_use_ema': True, 'sideways_use_atr': True, 'sideways_use_adx': False, 'sideways_use_spike': True, 'sideways_rsi_required': False}.
[I 2025-08-30 15:40:57,731] Trial 527 finished with values: [-0.039839225102050624, 0.0398096967663642] and parameters: {'p_sma': 44, 'p_std': 55, 'p_atr': 16, 'p_adx': 13, 'rsi_period': 55, 'ema1': 30, 'ema2': 34, 'slip_atr_k': 0.060539395876623464, 'slip_spread_k': 0.09844432141972972, 'spread_hl_frac': 0.026588450880069447, 'bb_std_mult': 1.2826000772196822, 'rsi_os': 25, 'rsi_ob': 56, 'vol_spike': 0.1588813988672306, 'adx_thresh': 33.71210536037217, 'atr_min_pct': 0.02815248711132457, 'atr_max_pct': 0.08655609375727208, 'tp_mult': 1.0132662480330807, 'tsl_mult': 0.7322484552147235, 'strategy': 'breakout', 'time_stop': 126, 'use_sma': False, 'use_atr': True, 'use_adx': True, 'use_ema': True, 'use_spike': True, 'rsi_required': True, 'edge_k': 0.7140857274387865, 'edge_cap': 0.548316117403343, 'bull_strategy': 'mean_reversion', 'bull_bb_std_mult': 2.7898980991629934, 'bull_rsi_os': 6, 'bull_rsi_ob': 50, 'bull_adx_thresh': 22.23247180899373, 'bull_atr_min_pct': 0.02132072198596106, 'bull_atr_max_pct': 0.07748362824398, 'bull_tp_mult': 2.5770950714728103, 'bull_tsl_mult': 0.2683413642856556, 'bull_time_stop': 9, 'bull_use_sma': True, 'bull_use_ema': False, 'bull_use_atr': True, 'bull_use_adx': False, 'bull_use_spike': True, 'bull_rsi_required': False, 'bear_strategy': 'breakout', 'bear_bb_std_mult': 0.6903277654206506, 'bear_rsi_os': 24, 'bear_rsi_ob': 79, 'bear_adx_thresh': 30.43282687905443, 'bear_atr_min_pct': 0.019946982719246043, 'bear_atr_max_pct': 0.14113036740138685, 'bear_tp_mult': 1.5858855196677988, 'bear_tsl_mult': 0.6851638765849601, 'bear_time_stop': 79, 'bear_use_sma': True, 'bear_use_ema': True, 'bear_use_atr': True, 'bear_use_adx': True, 'bear_use_spike': False, 'bear_rsi_required': True, 'sideways_strategy': 'breakout', 'sideways_bb_std_mult': 2.449156021816695, 'sideways_rsi_os': 43, 'sideways_rsi_ob': 51, 'sideways_adx_thresh': 21.663844366068606, 'sideways_atr_min_pct': 0.002208441373097228, 'sideways_atr_max_pct': 0.09490156352796542, 'sideways_tp_mult': 2.446909826539008, 'sideways_tsl_mult': 0.9407733903924979, 'sideways_time_stop': 79, 'sideways_use_sma': True, 'sideways_use_ema': True, 'sideways_use_atr': True, 'sideways_use_adx': False, 'sideways_use_spike': False, 'sideways_rsi_required': False}.
[I 2025-08-30 15:40:59,112] Trial 528 finished with values: [-1000000000.0, 1000000000.0] and parameters: {'p_sma': 7, 'p_std': 55, 'p_atr': 16, 'p_adx': 25, 'rsi_period': 58, 'ema1': 11, 'ema2': 34, 'slip_atr_k': 0.1381931742423807, 'slip_spread_k': 0.18321022536190468, 'spread_hl_frac': 0.027067507334641184, 'bb_std_mult': 1.5984333837429487, 'rsi_os': 41, 'rsi_ob': 71, 'vol_spike': 0.16780926536213814, 'adx_thresh': 14.106451226859967, 'atr_min_pct': 0.0066041019090967434, 'atr_max_pct': 0.08576622734378513, 'tp_mult': 1.0111520707707597, 'tsl_mult': 0.6899158758375248, 'strategy': 'breakout', 'time_stop': 127, 'use_sma': False, 'use_atr': True, 'use_adx': True, 'use_ema': True, 'use_spike': True, 'rsi_required': True, 'edge_k': 0.7268353210370936, 'edge_cap': 0.5484900551812777, 'bull_strategy': 'mean_reversion', 'bull_bb_std_mult': 2.591783459971414, 'bull_rsi_os': 47, 'bull_rsi_ob': 50, 'bull_adx_thresh': 26.367101573446632, 'bull_atr_min_pct': 0.021338219047460645, 'bull_atr_max_pct': 0.12621702757662287, 'bull_tp_mult': 2.211295819801814, 'bull_tsl_mult': 0.2759483143923857, 'bull_time_stop': 152, 'bull_use_sma': True, 'bull_use_ema': False, 'bull_use_atr': True, 'bull_use_adx': False, 'bull_use_spike': True, 'bull_rsi_required': False, 'bear_strategy': 'breakout', 'bear_bb_std_mult': 2.047891077246338, 'bear_rsi_os': 24, 'bear_rsi_ob': 79, 'bear_adx_thresh': 30.630423968215513, 'bear_atr_min_pct': 0.019858208674338608, 'bear_atr_max_pct': 0.06741861611165978, 'bear_tp_mult': 1.5761365713086737, 'bear_tsl_mult': 0.980934428734977, 'bear_time_stop': 78, 'bear_use_sma': True, 'bear_use_ema': True, 'bear_use_atr': True, 'bear_use_adx': True, 'bear_use_spike': False, 'bear_rsi_required': True, 'sideways_strategy': 'breakout', 'sideways_bb_std_mult': 1.7925215356302804, 'sideways_rsi_os': 43, 'sideways_rsi_ob': 68, 'sideways_adx_thresh': 27.45600906044534, 'sideways_atr_min_pct': 0.002170883772432601, 'sideways_atr_max_pct': 0.09560484246435387, 'sideways_tp_mult': 2.434018113934352, 'sideways_tsl_mult': 0.9431739068353805, 'sideways_time_stop': 80, 'sideways_use_sma': True, 'sideways_use_ema': True, 'sideways_use_atr': True, 'sideways_use_adx': False, 'sideways_use_spike': True, 'sideways_rsi_required': False}.
[I 2025-08-30 15:40:59,156] Trial 530 finished with values: [-1000000000.0, 1000000000.0] and parameters: {'p_sma': 28, 'p_std': 21, 'p_atr': 24, 'p_adx': 25, 'rsi_period': 11, 'ema1': 17, 'ema2': 34, 'slip_atr_k': 0.06404835891945587, 'slip_spread_k': 0.13093504963944405, 'spread_hl_frac': 0.043867979865325285, 'bb_std_mult': 1.5980416416853607, 'rsi_os': 41, 'rsi_ob': 71, 'vol_spike': 0.16922667789479723, 'adx_thresh': 14.554488562908922, 'atr_min_pct': 0.013093940966126165, 'atr_max_pct': 0.07796938056429527, 'tp_mult': 2.023957276354486, 'tsl_mult': 0.8060808137914801, 'strategy': 'breakout', 'time_stop': 224, 'use_sma': False, 'use_atr': True, 'use_adx': False, 'use_ema': True, 'use_spike': True, 'rsi_required': True, 'edge_k': 0.3058831255414063, 'edge_cap': 0.5458071837346712, 'bull_strategy': 'mean_reversion', 'bull_bb_std_mult': 2.5854548118818457, 'bull_rsi_os': 40, 'bull_rsi_ob': 48, 'bull_adx_thresh': 22.35828881041305, 'bull_atr_min_pct': 0.021410056358874854, 'bull_atr_max_pct': 0.06309415518469388, 'bull_tp_mult': 2.220688476510232, 'bull_tsl_mult': 0.9282093302047282, 'bull_time_stop': 154, 'bull_use_sma': False, 'bull_use_ema': False, 'bull_use_atr': False, 'bull_use_adx': False, 'bull_use_spike': True, 'bull_rsi_required': False, 'bear_strategy': 'mean_reversion', 'bear_bb_std_mult': 0.7171663946666414, 'bear_rsi_os': 29, 'bear_rsi_ob': 80, 'bear_adx_thresh': 10.511536766134324, 'bear_atr_min_pct': 0.02091257103103065, 'bear_atr_max_pct': 0.14102536537382201, 'bear_tp_mult': 1.079652905958941, 'bear_tsl_mult': 0.979651374974642, 'bear_time_stop': 58, 'bear_use_sma': True, 'bear_use_ema': True, 'bear_use_atr': True, 'bear_use_adx': True, 'bear_use_spike': False, 'bear_rsi_required': True, 'sideways_strategy': 'mean_reversion', 'sideways_bb_std_mult': 0.7639946270660778, 'sideways_rsi_os': 26, 'sideways_rsi_ob': 68, 'sideways_adx_thresh': 27.34254908901442, 'sideways_atr_min_pct': 0.0020936561409857527, 'sideways_atr_max_pct': 0.04207968399544599, 'sideways_tp_mult': 1.2723402436206497, 'sideways_tsl_mult': 0.8178341489904545, 'sideways_time_stop': 79, 'sideways_use_sma': True, 'sideways_use_ema': True, 'sideways_use_atr': True, 'sideways_use_adx': False, 'sideways_use_spike': True, 'sideways_rsi_required': False}.
