[I 2025-08-30 16:14:24,002] Trial 691 finished with values: [-1000000000.0, 1000000000.0] and parameters: {'p_sma': 6, 'p_std': 54, 'p_atr': 28, 'p_adx': 11, 'rsi_period': 78, 'ema1': 24, 'ema2': 32, 'slip_atr_k': 0.09119192693926437, 'slip_spread_k': 0.15749268342521255, 'spread_hl_frac': 0.04805277051602372, 'bb_std_mult': 2.233095467622734, 'rsi_os': 39, 'rsi_ob': 74, 'vol_spike': 0.15299304640337222, 'adx_thresh': 17.137537103216452, 'atr_min_pct': 0.016341283988626044, 'atr_max_pct': 0.07615437566745879, 'tp_mult': 1.7923287109120922, 'tsl_mult': 0.1795674019714557, 'strategy': 'mean_reversion', 'time_stop': 226, 'use_sma': True, 'use_atr': False, 'use_adx': True, 'use_ema': False, 'use_spike': True, 'rsi_required': False, 'edge_k': 0.3925002265644283, 'edge_cap': 0.42328901396962915, 'bull_strategy': 'breakout', 'bull_bb_std_mult': 0.7916746648277624, 'bull_rsi_os': 50, 'bull_rsi_ob': 65, 'bull_adx_thresh': 24.177151114436708, 'bull_atr_min_pct': 0.0187782320398086, 'bull_atr_max_pct': 0.08700909209340066, 'bull_tp_mult': 2.0676823195666705, 'bull_tsl_mult': 0.07626277401669801, 'bull_time_stop': 45, 'bull_use_sma': True, 'bull_use_ema': True, 'bull_use_atr': True, 'bull_use_adx': True, 'bull_use_spike': True, 'bull_rsi_required': True, 'bear_strategy': 'mean_reversion', 'bear_bb_std_mult': 2.606122112894362, 'bear_rsi_os': 33, 'bear_rsi_ob': 85, 'bear_adx_thresh': 9.920377288504028, 'bear_atr_min_pct': 0.02126537068541572, 'bear_atr_max_pct': 0.08485784778136507, 'bear_tp_mult': 2.8769696555464614, 'bear_tsl_mult': 0.48318940508060143, 'bear_time_stop': 277, 'bear_use_sma': False, 'bear_use_ema': False, 'bear_use_atr': False, 'bear_use_adx': True, 'bear_use_spike': True, 'bear_rsi_required': True, 'sideways_strategy': 'breakout', 'sideways_bb_std_mult': 0.9002604719529237, 'sideways_rsi_os': 39, 'sideways_rsi_ob': 61, 'sideways_adx_thresh': 23.722885006691254, 'sideways_atr_min_pct': 0.0006596009146482702, 'sideways_atr_max_pct': 0.10322005357993781, 'sideways_tp_mult': 2.9160481588231804, 'sideways_tsl_mult': 0.9187916063420909, 'sideways_time_stop': 80, 'sideways_use_sma': True, 'sideways_use_ema': True, 'sideways_use_atr': False, 'sideways_use_adx': True, 'sideways_use_spike': True, 'sideways_rsi_required': True}.
[I 2025-08-30 16:14:25,257] Trial 694 finished with values: [-1000000000.0, 1000000000.0] and parameters: {'p_sma': 46, 'p_std': 56, 'p_atr': 22, 'p_adx': 11, 'rsi_period': 82, 'ema1': 24, 'ema2': 31, 'slip_atr_k': 0.09152391657355996, 'slip_spread_k': 0.36275705529362634, 'spread_hl_frac': 0.023292269698030672, 'bb_std_mult': 2.2903836200483894, 'rsi_os': 39, 'rsi_ob': 49, 'vol_spike': 0.16182414887793822, 'adx_thresh': 16.589926748065768, 'atr_min_pct': 0.014761102639850488, 'atr_max_pct': 0.07957533344341468, 'tp_mult': 1.737307726932878, 'tsl_mult': 0.3933578728200288, 'strategy': 'mean_reversion', 'time_stop': 227, 'use_sma': True, 'use_atr': True, 'use_adx': False, 'use_ema': True, 'use_spike': False, 'rsi_required': False, 'edge_k': 0.46586885913874077, 'edge_cap': 0.6543631309889164, 'bull_strategy': 'breakout', 'bull_bb_std_mult': 0.8920444040802388, 'bull_rsi_os': 50, 'bull_rsi_ob': 57, 'bull_adx_thresh': 24.02617574017951, 'bull_atr_min_pct': 0.02034628676430307, 'bull_atr_max_pct': 0.08798985149688526, 'bull_tp_mult': 2.06536962799504, 'bull_tsl_mult': 0.036781071786258245, 'bull_time_stop': 5, 'bull_use_sma': True, 'bull_use_ema': True, 'bull_use_atr': True, 'bull_use_adx': True, 'bull_use_spike': True, 'bull_rsi_required': True, 'bear_strategy': 'mean_reversion', 'bear_bb_std_mult': 2.753436153149287, 'bear_rsi_os': 38, 'bear_rsi_ob': 88, 'bear_adx_thresh': 9.751751094746286, 'bear_atr_min_pct': 0.0289871165745781, 'bear_atr_max_pct': 0.049402040136101014, 'bear_tp_mult': 2.866340765311022, 'bear_tsl_mult': 0.5056754597931095, 'bear_time_stop': 250, 'bear_use_sma': False, 'bear_use_ema': False, 'bear_use_atr': True, 'bear_use_adx': True, 'bear_use_spike': True, 'bear_rsi_required': True, 'sideways_strategy': 'breakout', 'sideways_bb_std_mult': 0.9039706587108005, 'sideways_rsi_os': 40, 'sideways_rsi_ob': 62, 'sideways_adx_thresh': 23.543862567498923, 'sideways_atr_min_pct': 1.5906369971423824e-05, 'sideways_atr_max_pct': 0.10378869350864071, 'sideways_tp_mult': 2.988656548629392, 'sideways_tsl_mult': 0.6590000412366819, 'sideways_time_stop': 197, 'sideways_use_sma': True, 'sideways_use_ema': True, 'sideways_use_atr': False, 'sideways_use_adx': True, 'sideways_use_spike': True, 'sideways_rsi_required': True}.
[I 2025-08-30 16:15:09,769] Trial 697 finished with values: [-1000000000.0, 1000000000.0] and parameters: {'p_sma': 8, 'p_std': 14, 'p_atr': 22, 'p_adx': 10, 'rsi_period': 64, 'ema1': 21, 'ema2': 31, 'slip_atr_k': 0.21292345397958262, 'slip_spread_k': 0.20698662726457295, 'spread_hl_frac': 0.023755592191363806, 'bb_std_mult': 2.404614470917265, 'rsi_os': 37, 'rsi_ob': 75, 'vol_spike': 0.16132997453786757, 'adx_thresh': 14.766281657799388, 'atr_min_pct': 0.014656789131253576, 'atr_max_pct': 0.07140179812418866, 'tp_mult': 2.3483614674416042, 'tsl_mult': 0.4721855432099907, 'strategy': 'mean_reversion', 'time_stop': 216, 'use_sma': True, 'use_atr': True, 'use_adx': False, 'use_ema': True, 'use_spike': False, 'rsi_required': False, 'edge_k': 0.3366233879235436, 'edge_cap': 0.5857618116477258, 'bull_strategy': 'breakout', 'bull_bb_std_mult': 0.8950803864709738, 'bull_rsi_os': 42, 'bull_rsi_ob': 63, 'bull_adx_thresh': 25.879114514825254, 'bull_atr_min_pct': 0.014754896260889378, 'bull_atr_max_pct': 0.09065331837095246, 'bull_tp_mult': 1.9499199052085094, 'bull_tsl_mult': 0.13261024017850243, 'bull_time_stop': 11, 'bull_use_sma': True, 'bull_use_ema': True, 'bull_use_atr': True, 'bull_use_adx': True, 'bull_use_spike': False, 'bull_rsi_required': True, 'bear_strategy': 'breakout', 'bear_bb_std_mult': 2.7179864769633846, 'bear_rsi_os': 38, 'bear_rsi_ob': 87, 'bear_adx_thresh': 10.872906797414082, 'bear_atr_min_pct': 0.020129120784978242, 'bear_atr_max_pct': 0.0492144839798869, 'bear_tp_mult': 2.8240530821596503, 'bear_tsl_mult': 0.6214780416996937, 'bear_time_stop': 249, 'bear_use_sma': False, 'bear_use_ema': False, 'bear_use_atr': True, 'bear_use_adx': True, 'bear_use_spike': True, 'bear_rsi_required': True, 'sideways_strategy': 'breakout', 'sideways_bb_std_mult': 0.6326610391383615, 'sideways_rsi_os': 38, 'sideways_rsi_ob': 63, 'sideways_adx_thresh': 24.382725211916938, 'sideways_atr_min_pct': 0.023288784492666234, 'sideways_atr_max_pct': 0.050504362442775085, 'sideways_tp_mult': 2.9987332662174886, 'sideways_tsl_mult': 0.9522621939954174, 'sideways_time_stop': 74, 'sideways_use_sma': False, 'sideways_use_ema': True, 'sideways_use_atr': False, 'sideways_use_adx': True, 'sideways_use_spike': True, 'sideways_rsi_required': True}.
[I 2025-08-30 16:15:11,888] Trial 696 finished with values: [-1000000000.0, 1000000000.0] and parameters: {'p_sma': 6, 'p_std': 56, 'p_atr': 28, 'p_adx': 11, 'rsi_period': 77, 'ema1': 21, 'ema2': 32, 'slip_atr_k': 0.12127258872583094, 'slip_spread_k': 0.16723689808590017, 'spread_hl_frac': 0.01739867629337982, 'bb_std_mult': 2.3915233559540097, 'rsi_os': 37, 'rsi_ob': 57, 'vol_spike': 0.03203582252994752, 'adx_thresh': 16.326213623609785, 'atr_min_pct': 0.014827165885474246, 'atr_max_pct': 0.07955732451824271, 'tp_mult': 1.7265979817487418, 'tsl_mult': 0.47105886983838435, 'strategy': 'mean_reversion', 'time_stop': 222, 'use_sma': True, 'use_atr': True, 'use_adx': False, 'use_ema': True, 'use_spike': False, 'rsi_required': False, 'edge_k': 0.4843895542284201, 'edge_cap': 0.6466223377253534, 'bull_strategy': 'breakout', 'bull_bb_std_mult': 0.9194628606619348, 'bull_rsi_os': 42, 'bull_rsi_ob': 57, 'bull_adx_thresh': 25.923205042229657, 'bull_atr_min_pct': 0.0287279280456746, 'bull_atr_max_pct': 0.09027897738059097, 'bull_tp_mult': 1.9461297538508706, 'bull_tsl_mult': 0.13368981960419615, 'bull_time_stop': 5, 'bull_use_sma': True, 'bull_use_ema': True, 'bull_use_atr': True, 'bull_use_adx': True, 'bull_use_spike': False, 'bull_rsi_required': True, 'bear_strategy': 'mean_reversion', 'bear_bb_std_mult': 2.7734401822989643, 'bear_rsi_os': 32, 'bear_rsi_ob': 88, 'bear_adx_thresh': 11.20560135873521, 'bear_atr_min_pct': 0.025893249251031935, 'bear_atr_max_pct': 0.14991663751858503, 'bear_tp_mult': 2.865473411005575, 'bear_tsl_mult': 0.33893543506937557, 'bear_time_stop': 265, 'bear_use_sma': False, 'bear_use_ema': False, 'bear_use_atr': True, 'bear_use_adx': True, 'bear_use_spike': True, 'bear_rsi_required': True, 'sideways_strategy': 'breakout', 'sideways_bb_std_mult': 1.4479049661326902, 'sideways_rsi_os': 38, 'sideways_rsi_ob': 63, 'sideways_adx_thresh': 24.023301926858156, 'sideways_atr_min_pct': 1.5304584948321064e-05, 'sideways_atr_max_pct': 0.10426179811135855, 'sideways_tp_mult': 2.965844122844381, 'sideways_tsl_mult': 0.9225212469416479, 'sideways_time_stop': 74, 'sideways_use_sma': False, 'sideways_use_ema': True, 'sideways_use_atr': False, 'sideways_use_adx': True, 'sideways_use_spike': True, 'sideways_rsi_required': True}.
[I 2025-08-30 16:15:12,396] Trial 695 finished with values: [-1000000000.0, 1000000000.0] and parameters: {'p_sma': 8, 'p_std': 14, 'p_atr': 28, 'p_adx': 11, 'rsi_period': 64, 'ema1': 24, 'ema2': 31, 'slip_atr_k': 0.21681613772983027, 'slip_spread_k': 0.15912421166398527, 'spread_hl_frac': 0.047397627664429884, 'bb_std_mult': 2.376220093221649, 'rsi_os': 37, 'rsi_ob': 77, 'vol_spike': 0.15991057630707264, 'adx_thresh': 16.687939283101862, 'atr_min_pct': 0.014896954455633308, 'atr_max_pct': 0.07938333466448363, 'tp_mult': 1.7331349007892791, 'tsl_mult': 0.4694390672013352, 'strategy': 'mean_reversion', 'time_stop': 228, 'use_sma': True, 'use_atr': True, 'use_adx': False, 'use_ema': True, 'use_spike': False, 'rsi_required': False, 'edge_k': 0.3480452792533963, 'edge_cap': 0.7813231470622677, 'bull_strategy': 'breakout', 'bull_bb_std_mult': 0.8895790543167049, 'bull_rsi_os': 5, 'bull_rsi_ob': 57, 'bull_adx_thresh': 23.24512461835599, 'bull_atr_min_pct': 0.028597661530126574, 'bull_atr_max_pct': 0.08893100559883313, 'bull_tp_mult': 2.0511337001392103, 'bull_tsl_mult': 0.19096600357109175, 'bull_time_stop': 24, 'bull_use_sma': True, 'bull_use_ema': True, 'bull_use_atr': True, 'bull_use_adx': True, 'bull_use_spike': True, 'bull_rsi_required': True, 'bear_strategy': 'mean_reversion', 'bear_bb_std_mult': 2.7307840995928157, 'bear_rsi_os': 33, 'bear_rsi_ob': 88, 'bear_adx_thresh': 15.527351205624868, 'bear_atr_min_pct': 0.0021809917249923563, 'bear_atr_max_pct': 0.07781972875388987, 'bear_tp_mult': 2.7446270268646704, 'bear_tsl_mult': 0.3270981903491381, 'bear_time_stop': 268, 'bear_use_sma': False, 'bear_use_ema': False, 'bear_use_atr': True, 'bear_use_adx': True, 'bear_use_spike': True, 'bear_rsi_required': True, 'sideways_strategy': 'breakout', 'sideways_bb_std_mult': 1.2372463004162049, 'sideways_rsi_os': 5, 'sideways_rsi_ob': 62, 'sideways_adx_thresh': 22.28030399215337, 'sideways_atr_min_pct': 3.486445974235943e-05, 'sideways_atr_max_pct': 0.10359079371330458, 'sideways_tp_mult': 2.956955784225186, 'sideways_tsl_mult': 0.950228740626632, 'sideways_time_stop': 73, 'sideways_use_sma': True, 'sideways_use_ema': True, 'sideways_use_atr': False, 'sideways_use_adx': True, 'sideways_use_spike': True, 'sideways_rsi_required': True}.
[I 2025-08-30 16:15:12,906] Trial 698 finished with values: [-1000000000.0, 1000000000.0] and parameters: {'p_sma': 8, 'p_std': 10, 'p_atr': 26, 'p_adx': 10, 'rsi_period': 77, 'ema1': 22, 'ema2': 32, 'slip_atr_k': 0.07978144115740676, 'slip_spread_k': 0.9685461843651253, 'spread_hl_frac': 0.024420479992804847, 'bb_std_mult': 2.381245087601817, 'rsi_os': 37, 'rsi_ob': 75, 'vol_spike': 0.13148914493391495, 'adx_thresh': 16.191110930694094, 'atr_min_pct': 0.014744091859743657, 'atr_max_pct': 0.07137131140071581, 'tp_mult': 1.8349213215355507, 'tsl_mult': 0.4289584120914489, 'strategy': 'mean_reversion', 'time_stop': 215, 'use_sma': True, 'use_atr': True, 'use_adx': False, 'use_ema': True, 'use_spike': False, 'rsi_required': False, 'edge_k': 0.33346559560463196, 'edge_cap': 0.05206328218403594, 'bull_strategy': 'breakout', 'bull_bb_std_mult': 0.8523135303073007, 'bull_rsi_os': 5, 'bull_rsi_ob': 63, 'bull_adx_thresh': 23.07552504165919, 'bull_atr_min_pct': 0.027794070858333308, 'bull_atr_max_pct': 0.09230899691970637, 'bull_tp_mult': 1.9644606981188037, 'bull_tsl_mult': 0.18885626748075163, 'bull_time_stop': 21, 'bull_use_sma': True, 'bull_use_ema': True, 'bull_use_atr': True, 'bull_use_adx': True, 'bull_use_spike': False, 'bull_rsi_required': True, 'bear_strategy': 'breakout', 'bear_bb_std_mult': 2.692732127296102, 'bear_rsi_os': 35, 'bear_rsi_ob': 87, 'bear_adx_thresh': 11.000991997022012, 'bear_atr_min_pct': 0.02007365049158152, 'bear_atr_max_pct': 0.053227320235112535, 'bear_tp_mult': 2.7552556122574976, 'bear_tsl_mult': 0.6260447216790903, 'bear_time_stop': 268, 'bear_use_sma': False, 'bear_use_ema': False, 'bear_use_atr': True, 'bear_use_adx': True, 'bear_use_spike': True, 'bear_rsi_required': True, 'sideways_strategy': 'breakout', 'sideways_bb_std_mult': 1.4488432297294294, 'sideways_rsi_os': 38, 'sideways_rsi_ob': 63, 'sideways_adx_thresh': 22.308612926698252, 'sideways_atr_min_pct': 0.02935397913231723, 'sideways_atr_max_pct': 0.10347720252069277, 'sideways_tp_mult': 2.967866894923655, 'sideways_tsl_mult': 0.17538824792733715, 'sideways_time_stop': 66, 'sideways_use_sma': False, 'sideways_use_ema': True, 'sideways_use_atr': False, 'sideways_use_adx': True, 'sideways_use_spike': True, 'sideways_rsi_required': True}.
[I 2025-08-30 16:15:56,759] Trial 701 finished with values: [-1000000000.0, 1000000000.0] and parameters: {'p_sma': 29, 'p_std': 55, 'p_atr': 24, 'p_adx': 10, 'rsi_period': 80, 'ema1': 25, 'ema2': 47, 'slip_atr_k': 0.15100295728264218, 'slip_spread_k': 0.1829601814313328, 'spread_hl_frac': 0.024407208189809997, 'bb_std_mult': 2.5133537841639435, 'rsi_os': 42, 'rsi_ob': 72, 'vol_spike': 0.1315101220571099, 'adx_thresh': 14.442249164931031, 'atr_min_pct': 0.015432618157427073, 'atr_max_pct': 0.08317026604911229, 'tp_mult': 1.834875390823319, 'tsl_mult': 0.4240054222494276, 'strategy': 'mean_reversion', 'time_stop': 237, 'use_sma': True, 'use_atr': True, 'use_adx': False, 'use_ema': True, 'use_spike': True, 'rsi_required': False, 'edge_k': 0.430179865048859, 'edge_cap': 0.5981580772179713, 'bull_strategy': 'breakout', 'bull_bb_std_mult': 0.8180038886108697, 'bull_rsi_os': 41, 'bull_rsi_ob': 62, 'bull_adx_thresh': 23.001634847432896, 'bull_atr_min_pct': 0.01950918466469621, 'bull_atr_max_pct': 0.0948627169123688, 'bull_tp_mult': 2.08679335154461, 'bull_tsl_mult': 0.09930203829396253, 'bull_time_stop': 21, 'bull_use_sma': True, 'bull_use_ema': True, 'bull_use_atr': True, 'bull_use_adx': True, 'bull_use_spike': True, 'bull_rsi_required': True, 'bear_strategy': 'breakout', 'bear_bb_std_mult': 2.426761058223155, 'bear_rsi_os': 35, 'bear_rsi_ob': 82, 'bear_adx_thresh': 7.587224822089242, 'bear_atr_min_pct': 0.02062073038178982, 'bear_atr_max_pct': 0.07172361171082049, 'bear_tp_mult': 2.936648806156634, 'bear_tsl_mult': 0.1431484588584044, 'bear_time_stop': 259, 'bear_use_sma': False, 'bear_use_ema': False, 'bear_use_atr': True, 'bear_use_adx': True, 'bear_use_spike': True, 'bear_rsi_required': True, 'sideways_strategy': 'mean_reversion', 'sideways_bb_std_mult': 1.1929608332367327, 'sideways_rsi_os': 40, 'sideways_rsi_ob': 61, 'sideways_adx_thresh': 25.504242420973885, 'sideways_atr_min_pct': 0.019430736728506717, 'sideways_atr_max_pct': 0.11966995488246143, 'sideways_tp_mult': 2.888867059185894, 'sideways_tsl_mult': 0.8701542231678383, 'sideways_time_stop': 139, 'sideways_use_sma': True, 'sideways_use_ema': False, 'sideways_use_atr': False, 'sideways_use_adx': True, 'sideways_use_spike': False, 'sideways_rsi_required': True}.
[I 2025-08-30 16:15:57,215] Trial 702 finished with values: [-0.048144351917528416, 0.04808929231195472] and parameters: {'p_sma': 5, 'p_std': 55, 'p_atr': 24, 'p_adx': 10, 'rsi_period': 12, 'ema1': 16, 'ema2': 10, 'slip_atr_k': 0.0735345673488404, 'slip_spread_k': 0.12239987874218211, 'spread_hl_frac': 0.011020679210197415, 'bb_std_mult': 2.511179149137556, 'rsi_os': 42, 'rsi_ob': 73, 'vol_spike': 0.10514340688002846, 'adx_thresh': 14.154811260481592, 'atr_min_pct': 0.01532615675826185, 'atr_max_pct': 0.08502666415456514, 'tp_mult': 1.6616940318039548, 'tsl_mult': 0.23874470132448167, 'strategy': 'mean_reversion', 'time_stop': 235, 'use_sma': True, 'use_atr': True, 'use_adx': True, 'use_ema': False, 'use_spike': True, 'rsi_required': False, 'edge_k': 0.44713954832759306, 'edge_cap': 0.5879639341778833, 'bull_strategy': 'breakout', 'bull_bb_std_mult': 0.7258700059050553, 'bull_rsi_os': 41, 'bull_rsi_ob': 62, 'bull_adx_thresh': 23.801737306324185, 'bull_atr_min_pct': 0.0195057988974218, 'bull_atr_max_pct': 0.09474335989085755, 'bull_tp_mult': 2.0779446276363664, 'bull_tsl_mult': 0.003221398527490052, 'bull_time_stop': 70, 'bull_use_sma': True, 'bull_use_ema': True, 'bull_use_atr': True, 'bull_use_adx': True, 'bull_use_spike': True, 'bull_rsi_required': True, 'bear_strategy': 'mean_reversion', 'bear_bb_std_mult': 2.4270513074941533, 'bear_rsi_os': 19, 'bear_rsi_ob': 83, 'bear_adx_thresh': 29.623379427608853, 'bear_atr_min_pct': 0.02074117435407999, 'bear_atr_max_pct': 0.0352530811412996, 'bear_tp_mult': 2.821692603303817, 'bear_tsl_mult': 0.44942164922219696, 'bear_time_stop': 287, 'bear_use_sma': False, 'bear_use_ema': False, 'bear_use_atr': True, 'bear_use_adx': True, 'bear_use_spike': True, 'bear_rsi_required': True, 'sideways_strategy': 'mean_reversion', 'sideways_bb_std_mult': 1.2766862562318169, 'sideways_rsi_os': 40, 'sideways_rsi_ob': 61, 'sideways_adx_thresh': 24.898244990805807, 'sideways_atr_min_pct': 0.0007529368287968689, 'sideways_atr_max_pct': 0.06931366273735291, 'sideways_tp_mult': 2.8797586709962606, 'sideways_tsl_mult': 0.5593471329433927, 'sideways_time_stop': 53, 'sideways_use_sma': True, 'sideways_use_ema': False, 'sideways_use_atr': False, 'sideways_use_adx': True, 'sideways_use_spike': False, 'sideways_rsi_required': True}.
[I 2025-08-30 16:15:58,411] Trial 700 finished with values: [-1000000000.0, 1000000000.0] and parameters: {'p_sma': 42, 'p_std': 55, 'p_atr': 26, 'p_adx': 10, 'rsi_period': 80, 'ema1': 22, 'ema2': 32, 'slip_atr_k': 0.15041137519036954, 'slip_spread_k': 0.17845492659798629, 'spread_hl_frac': 0.035949740096757596, 'bb_std_mult': 2.3243945802676107, 'rsi_os': 41, 'rsi_ob': 77, 'vol_spike': 0.13713567837788415, 'adx_thresh': 14.179697502923279, 'atr_min_pct': 0.01538344270240649, 'atr_max_pct': 0.14422436550075957, 'tp_mult': 1.8357476099718615, 'tsl_mult': 0.4291777424701722, 'strategy': 'mean_reversion', 'time_stop': 236, 'use_sma': True, 'use_atr': True, 'use_adx': False, 'use_ema': True, 'use_spike': True, 'rsi_required': False, 'edge_k': 0.36025381157594566, 'edge_cap': 0.5879512333101603, 'bull_strategy': 'breakout', 'bull_bb_std_mult': 0.8552673955613653, 'bull_rsi_os': 41, 'bull_rsi_ob': 60, 'bull_adx_thresh': 23.66666915288868, 'bull_atr_min_pct': 0.020129811640294246, 'bull_atr_max_pct': 0.09452349107001441, 'bull_tp_mult': 2.081642704639852, 'bull_tsl_mult': 0.18878503773924393, 'bull_time_stop': 23, 'bull_use_sma': True, 'bull_use_ema': True, 'bull_use_atr': True, 'bull_use_adx': True, 'bull_use_spike': True, 'bull_rsi_required': True, 'bear_strategy': 'mean_reversion', 'bear_bb_std_mult': 2.39520114968677, 'bear_rsi_os': 35, 'bear_rsi_ob': 83, 'bear_adx_thresh': 29.691745738237223, 'bear_atr_min_pct': 0.020646975707411853, 'bear_atr_max_pct': 0.07198680022737812, 'bear_tp_mult': 2.7399345683103005, 'bear_tsl_mult': 0.44909051185279525, 'bear_time_stop': 259, 'bear_use_sma': False, 'bear_use_ema': False, 'bear_use_atr': True, 'bear_use_adx': True, 'bear_use_spike': True, 'bear_rsi_required': True, 'sideways_strategy': 'mean_reversion', 'sideways_bb_std_mult': 1.2301709472654923, 'sideways_rsi_os': 40, 'sideways_rsi_ob': 62, 'sideways_adx_thresh': 22.35257573267129, 'sideways_atr_min_pct': 0.002359044519413863, 'sideways_atr_max_pct': 0.030132576471155408, 'sideways_tp_mult': 2.8846406870347567, 'sideways_tsl_mult': 0.9482265025602745, 'sideways_time_stop': 64, 'sideways_use_sma': True, 'sideways_use_ema': True, 'sideways_use_atr': False, 'sideways_use_adx': True, 'sideways_use_spike': False, 'sideways_rsi_required': True}.
