[I 2025-08-30 14:48:43,432] Trial 233 finished with values: [-0.10674640903171762, 0.10666126041846337] and parameters: {'p_sma': 35, 'p_std': 49, 'p_atr': 14, 'p_adx': 15, 'rsi_period': 31, 'ema1': 26, 'ema2': 21, 'slip_atr_k': 0.16022802267099112, 'slip_spread_k': 0.43180563734474614, 'spread_hl_frac': 0.004193593192417117, 'bb_std_mult': 1.16967243706531, 'rsi_os': 34, 'rsi_ob': 68, 'vol_spike': 0.25037551909032174, 'adx_thresh': 26.062718307745047, 'atr_min_pct': 0.024628781126593592, 'atr_max_pct': 0.031967398341124484, 'tp_mult': 2.7214293631116897, 'tsl_mult': 0.9999719429903869, 'strategy': 'mean_reversion', 'time_stop': 265, 'use_sma': True, 'use_atr': True, 'use_adx': False, 'use_ema': True, 'use_spike': False, 'rsi_required': False, 'edge_k': 1.599633295651317, 'edge_cap': 0.7663203726095913, 'bull_strategy': 'breakout', 'bull_bb_std_mult': 3.5377622128379116, 'bull_rsi_os': 31, 'bull_rsi_ob': 75, 'bull_adx_thresh': 18.270712882404663, 'bull_atr_min_pct': 0.009913881591105393, 'bull_atr_max_pct': 0.03227930853429249, 'bull_tp_mult': 2.862201677027363, 'bull_tsl_mult': 0.22221377568638012, 'bull_time_stop': 258, 'bull_use_sma': False, 'bull_use_ema': False, 'bull_use_atr': True, 'bull_use_adx': True, 'bull_use_spike': False, 'bull_rsi_required': True, 'bear_strategy': 'breakout', 'bear_bb_std_mult': 1.1312449454343867, 'bear_rsi_os': 23, 'bear_rsi_ob': 58, 'bear_adx_thresh': 27.63123046319871, 'bear_atr_min_pct': 0.025392035963156593, 'bear_atr_max_pct': 0.0184927866503604, 'bear_tp_mult': 1.081514243325611, 'bear_tsl_mult': 0.7733505020772574, 'bear_time_stop': 26, 'bear_use_sma': False, 'bear_use_ema': False, 'bear_use_atr': False, 'bear_use_adx': False, 'bear_use_spike': True, 'bear_rsi_required': False, 'sideways_strategy': 'breakout', 'sideways_bb_std_mult': 2.0547245707090704, 'sideways_rsi_os': 51, 'sideways_rsi_ob': 71, 'sideways_adx_thresh': 18.34073104636621, 'sideways_atr_min_pct': 0.001555778032778689, 'sideways_atr_max_pct': 0.015402090952971279, 'sideways_tp_mult': 2.295642219950885, 'sideways_tsl_mult': 0.2349244488209788, 'sideways_time_stop': 108, 'sideways_use_sma': False, 'sideways_use_ema': True, 'sideways_use_atr': False, 'sideways_use_adx': True, 'sideways_use_spike': True, 'sideways_rsi_required': True}.
[I 2025-08-30 14:49:14,605] Trial 237 finished with values: [-1000000000.0, 1000000000.0] and parameters: {'p_sma': 32, 'p_std': 27, 'p_atr': 13, 'p_adx': 21, 'rsi_period': 47, 'ema1': 6, 'ema2': 43, 'slip_atr_k': 0.014017203651013084, 'slip_spread_k': 0.2170102023592616, 'spread_hl_frac': 0.024496938001041205, 'bb_std_mult': 1.996214033072006, 'rsi_os': 39, 'rsi_ob': 92, 'vol_spike': 0.25883287869010124, 'adx_thresh': 15.184653642236608, 'atr_min_pct': 0.023285684877431587, 'atr_max_pct': 0.10372626607977009, 'tp_mult': 2.6404173654571315, 'tsl_mult': 0.5041477286691112, 'strategy': 'breakout', 'time_stop': 300, 'use_sma': True, 'use_atr': False, 'use_adx': False, 'use_ema': False, 'use_spike': True, 'rsi_required': True, 'edge_k': 1.5842404216792645, 'edge_cap': 0.9386608164750001, 'bull_strategy': 'mean_reversion', 'bull_bb_std_mult': 3.317894135506184, 'bull_rsi_os': 16, 'bull_rsi_ob': 51, 'bull_adx_thresh': 14.156378407466638, 'bull_atr_min_pct': 0.0021066565817548137, 'bull_atr_max_pct': 0.08472572814044985, 'bull_tp_mult': 2.920561362254809, 'bull_tsl_mult': 0.41295804872851116, 'bull_time_stop': 268, 'bull_use_sma': False, 'bull_use_ema': True, 'bull_use_atr': True, 'bull_use_adx': True, 'bull_use_spike': False, 'bull_rsi_required': True, 'bear_strategy': 'breakout', 'bear_bb_std_mult': 2.9940472788668493, 'bear_rsi_os': 16, 'bear_rsi_ob': 51, 'bear_adx_thresh': 20.366142848940115, 'bear_atr_min_pct': 0.012252151049825617, 'bear_atr_max_pct': 0.08867793396463185, 'bear_tp_mult': 2.063356497032386, 'bear_tsl_mult': 0.9752188961356563, 'bear_time_stop': 49, 'bear_use_sma': False, 'bear_use_ema': False, 'bear_use_atr': False, 'bear_use_adx': False, 'bear_use_spike': True, 'bear_rsi_required': False, 'sideways_strategy': 'breakout', 'sideways_bb_std_mult': 1.6370299980324785, 'sideways_rsi_os': 32, 'sideways_rsi_ob': 89, 'sideways_adx_thresh': 13.942339903575691, 'sideways_atr_min_pct': 0.021799955608000826, 'sideways_atr_max_pct': 0.08086556674663115, 'sideways_tp_mult': 1.69212709280499, 'sideways_tsl_mult': 0.8994650109403912, 'sideways_time_stop': 85, 'sideways_use_sma': False, 'sideways_use_ema': False, 'sideways_use_atr': True, 'sideways_use_adx': False, 'sideways_use_spike': True, 'sideways_rsi_required': True}.
[I 2025-08-30 14:49:14,949] Trial 238 finished with values: [-1000000000.0, 1000000000.0] and parameters: {'p_sma': 32, 'p_std': 27, 'p_atr': 13, 'p_adx': 21, 'rsi_period': 44, 'ema1': 6, 'ema2': 50, 'slip_atr_k': 0.01454301468253744, 'slip_spread_k': 0.21674487217838107, 'spread_hl_frac': 0.03170998698829703, 'bb_std_mult': 1.9782126037427854, 'rsi_os': 31, 'rsi_ob': 92, 'vol_spike': 0.0692340677007045, 'adx_thresh': 22.30730397602363, 'atr_min_pct': 0.02208588501122342, 'atr_max_pct': 0.1333134850004055, 'tp_mult': 2.6710325699991726, 'tsl_mult': 0.5066707295237821, 'strategy': 'breakout', 'time_stop': 165, 'use_sma': True, 'use_atr': False, 'use_adx': False, 'use_ema': False, 'use_spike': True, 'rsi_required': True, 'edge_k': 1.576547931269441, 'edge_cap': 0.9973748890896308, 'bull_strategy': 'mean_reversion', 'bull_bb_std_mult': 1.1901355637406414, 'bull_rsi_os': 16, 'bull_rsi_ob': 77, 'bull_adx_thresh': 25.658578936224092, 'bull_atr_min_pct': 0.008594286007924326, 'bull_atr_max_pct': 0.01806887497861743, 'bull_tp_mult': 1.4254912598037786, 'bull_tsl_mult': 0.8855849718729595, 'bull_time_stop': 271, 'bull_use_sma': False, 'bull_use_ema': True, 'bull_use_atr': True, 'bull_use_adx': True, 'bull_use_spike': False, 'bull_rsi_required': True, 'bear_strategy': 'breakout', 'bear_bb_std_mult': 2.9961739099616542, 'bear_rsi_os': 16, 'bear_rsi_ob': 51, 'bear_adx_thresh': 29.11446254875809, 'bear_atr_min_pct': 0.027637074285385005, 'bear_atr_max_pct': 0.14086691634077814, 'bear_tp_mult': 2.479082573260866, 'bear_tsl_mult': 0.14772618581296976, 'bear_time_stop': 253, 'bear_use_sma': False, 'bear_use_ema': False, 'bear_use_atr': False, 'bear_use_adx': False, 'bear_use_spike': True, 'bear_rsi_required': False, 'sideways_strategy': 'breakout', 'sideways_bb_std_mult': 2.7268446379260407, 'sideways_rsi_os': 32, 'sideways_rsi_ob': 89, 'sideways_adx_thresh': 16.264273619255412, 'sideways_atr_min_pct': 0.014118377296594297, 'sideways_atr_max_pct': 0.13085853339683046, 'sideways_tp_mult': 1.1333037475438759, 'sideways_tsl_mult': 0.17342097291585695, 'sideways_time_stop': 223, 'sideways_use_sma': False, 'sideways_use_ema': False, 'sideways_use_atr': True, 'sideways_use_adx': False, 'sideways_use_spike': True, 'sideways_rsi_required': True}.
[I 2025-08-30 14:49:15,074] Trial 236 finished with values: [-0.03197380871533273, 0.03194840654970204] and parameters: {'p_sma': 7, 'p_std': 27, 'p_atr': 13, 'p_adx': 24, 'rsi_period': 47, 'ema1': 26, 'ema2': 42, 'slip_atr_k': 0.08817001871075433, 'slip_spread_k': 0.21983436248413288, 'spread_hl_frac': 0.0028080838411107755, 'bb_std_mult': 1.948121900743613, 'rsi_os': 44, 'rsi_ob': 90, 'vol_spike': 0.25536248879844187, 'adx_thresh': 20.64597334804708, 'atr_min_pct': 0.02460508575858375, 'atr_max_pct': 0.09918529575526723, 'tp_mult': 2.66740769289912, 'tsl_mult': 0.9996619688367073, 'strategy': 'mean_reversion', 'time_stop': 291, 'use_sma': True, 'use_atr': False, 'use_adx': False, 'use_ema': False, 'use_spike': True, 'rsi_required': False, 'edge_k': 1.5807740696586132, 'edge_cap': 0.6625726896569851, 'bull_strategy': 'mean_reversion', 'bull_bb_std_mult': 3.315707134392325, 'bull_rsi_os': 16, 'bull_rsi_ob': 51, 'bull_adx_thresh': 22.802293115240936, 'bull_atr_min_pct': 0.002261427726816403, 'bull_atr_max_pct': 0.018287835519340122, 'bull_tp_mult': 1.4296571974151469, 'bull_tsl_mult': 0.4846567752164348, 'bull_time_stop': 89, 'bull_use_sma': False, 'bull_use_ema': True, 'bull_use_atr': True, 'bull_use_adx': True, 'bull_use_spike': False, 'bull_rsi_required': True, 'bear_strategy': 'breakout', 'bear_bb_std_mult': 2.02811998149927, 'bear_rsi_os': 47, 'bear_rsi_ob': 56, 'bear_adx_thresh': 34.91365149177604, 'bear_atr_min_pct': 0.009958374114655631, 'bear_atr_max_pct': 0.0622247448984367, 'bear_tp_mult': 2.8064371869845584, 'bear_tsl_mult': 0.8600588763846151, 'bear_time_stop': 48, 'bear_use_sma': False, 'bear_use_ema': False, 'bear_use_atr': False, 'bear_use_adx': False, 'bear_use_spike': True, 'bear_rsi_required': False, 'sideways_strategy': 'breakout', 'sideways_bb_std_mult': 2.069789213045434, 'sideways_rsi_os': 46, 'sideways_rsi_ob': 89, 'sideways_adx_thresh': 16.29335074300859, 'sideways_atr_min_pct': 0.001697051498472379, 'sideways_atr_max_pct': 0.029398087409152264, 'sideways_tp_mult': 2.284216559180837, 'sideways_tsl_mult': 0.23350612944066318, 'sideways_time_stop': 106, 'sideways_use_sma': False, 'sideways_use_ema': False, 'sideways_use_atr': True, 'sideways_use_adx': False, 'sideways_use_spike': True, 'sideways_rsi_required': True}.
[I 2025-08-30 14:49:15,143] Trial 235 finished with values: [-1000000000.0, 1000000000.0] and parameters: {'p_sma': 34, 'p_std': 29, 'p_atr': 13, 'p_adx': 26, 'rsi_period': 37, 'ema1': 6, 'ema2': 50, 'slip_atr_k': 0.013952699840035391, 'slip_spread_k': 0.9540427325791854, 'spread_hl_frac': 0.004361774683212865, 'bb_std_mult': 1.9793392574695508, 'rsi_os': 26, 'rsi_ob': 68, 'vol_spike': 0.2518861946620414, 'adx_thresh': 11.444416445636584, 'atr_min_pct': 0.024505286265827264, 'atr_max_pct': 0.10423261522475684, 'tp_mult': 2.512151814146201, 'tsl_mult': 0.16911686896156708, 'strategy': 'breakout', 'time_stop': 33, 'use_sma': True, 'use_atr': False, 'use_adx': False, 'use_ema': False, 'use_spike': False, 'rsi_required': True, 'edge_k': 1.581340859241697, 'edge_cap': 0.6691076349080373, 'bull_strategy': 'breakout', 'bull_bb_std_mult': 3.3049401290107316, 'bull_rsi_os': 53, 'bull_rsi_ob': 77, 'bull_adx_thresh': 12.849541619583366, 'bull_atr_min_pct': 0.01280228284350125, 'bull_atr_max_pct': 0.07610271696407062, 'bull_tp_mult': 2.841732611784801, 'bull_tsl_mult': 0.41437574697808877, 'bull_time_stop': 269, 'bull_use_sma': False, 'bull_use_ema': False, 'bull_use_atr': True, 'bull_use_adx': True, 'bull_use_spike': False, 'bull_rsi_required': True, 'bear_strategy': 'breakout', 'bear_bb_std_mult': 0.9505920725468504, 'bear_rsi_os': 16, 'bear_rsi_ob': 54, 'bear_adx_thresh': 8.264201242206047, 'bear_atr_min_pct': 0.012526035758306117, 'bear_atr_max_pct': 0.018821094930827106, 'bear_tp_mult': 2.8025578638869186, 'bear_tsl_mult': 0.21607280517337543, 'bear_time_stop': 47, 'bear_use_sma': False, 'bear_use_ema': False, 'bear_use_atr': False, 'bear_use_adx': False, 'bear_use_spike': True, 'bear_rsi_required': False, 'sideways_strategy': 'breakout', 'sideways_bb_std_mult': 3.05494077481789, 'sideways_rsi_os': 32, 'sideways_rsi_ob': 90, 'sideways_adx_thresh': 15.876441643169432, 'sideways_atr_min_pct': 0.014213189770781546, 'sideways_atr_max_pct': 0.028261219371721692, 'sideways_tp_mult': 1.67917445228847, 'sideways_tsl_mult': 0.22933589347483438, 'sideways_time_stop': 225, 'sideways_use_sma': True, 'sideways_use_ema': True, 'sideways_use_atr': False, 'sideways_use_adx': True, 'sideways_use_spike': True, 'sideways_rsi_required': True}.
[I 2025-08-30 14:49:46,623] Trial 239 finished with values: [-1000000000.0, 1000000000.0] and parameters: {'p_sma': 21, 'p_std': 31, 'p_atr': 13, 'p_adx': 22, 'rsi_period': 44, 'ema1': 26, 'ema2': 50, 'slip_atr_k': 0.18891265063386697, 'slip_spread_k': 0.23081003568590483, 'spread_hl_frac': 0.0027196328616032788, 'bb_std_mult': 1.8984180630348502, 'rsi_os': 26, 'rsi_ob': 93, 'vol_spike': 0.13260228695361723, 'adx_thresh': 22.13233042791295, 'atr_min_pct': 0.022168627946446473, 'atr_max_pct': 0.13367619662256447, 'tp_mult': 2.6767813652254295, 'tsl_mult': 0.9761713091358045, 'strategy': 'mean_reversion', 'time_stop': 34, 'use_sma': True, 'use_atr': False, 'use_adx': False, 'use_ema': False, 'use_spike': False, 'rsi_required': False, 'edge_k': 1.5661128378930373, 'edge_cap': 0.6712948448803554, 'bull_strategy': 'breakout', 'bull_bb_std_mult': 1.1153558286119178, 'bull_rsi_os': 36, 'bull_rsi_ob': 70, 'bull_adx_thresh': 12.23357485042239, 'bull_atr_min_pct': 0.0037878254431539687, 'bull_atr_max_pct': 0.11602570054606923, 'bull_tp_mult': 1.4376560706023551, 'bull_tsl_mult': 0.8869222713620031, 'bull_time_stop': 25, 'bull_use_sma': False, 'bull_use_ema': False, 'bull_use_atr': True, 'bull_use_adx': True, 'bull_use_spike': True, 'bull_rsi_required': True, 'bear_strategy': 'breakout', 'bear_bb_std_mult': 1.8660764847657019, 'bear_rsi_os': 17, 'bear_rsi_ob': 48, 'bear_adx_thresh': 8.290639974320266, 'bear_atr_min_pct': 0.004856303849720092, 'bear_atr_max_pct': 0.0294941904622854, 'bear_tp_mult': 2.4484829128928425, 'bear_tsl_mult': 0.3785926496501421, 'bear_time_stop': 47, 'bear_use_sma': False, 'bear_use_ema': False, 'bear_use_atr': False, 'bear_use_adx': False, 'bear_use_spike': True, 'bear_rsi_required': False, 'sideways_strategy': 'mean_reversion', 'sideways_bb_std_mult': 2.425594140382653, 'sideways_rsi_os': 17, 'sideways_rsi_ob': 69, 'sideways_adx_thresh': 16.010473032802743, 'sideways_atr_min_pct': 0.009324601612569202, 'sideways_atr_max_pct': 0.07618929439875093, 'sideways_tp_mult': 1.147225296003717, 'sideways_tsl_mult': 0.19784528633996912, 'sideways_time_stop': 221, 'sideways_use_sma': False, 'sideways_use_ema': False, 'sideways_use_atr': False, 'sideways_use_adx': True, 'sideways_use_spike': True, 'sideways_rsi_required': True}.
[I 2025-08-30 14:49:46,849] Trial 240 finished with values: [-1000000000.0, 1000000000.0] and parameters: {'p_sma': 40, 'p_std': 30, 'p_atr': 13, 'p_adx': 26, 'rsi_period': 60, 'ema1': 14, 'ema2': 51, 'slip_atr_k': 0.01883106362515056, 'slip_spread_k': 0.2645839688390521, 'spread_hl_frac': 0.0022442381026701874, 'bb_std_mult': 1.9221796840930818, 'rsi_os': 25, 'rsi_ob': 93, 'vol_spike': 0.13380753607030513, 'adx_thresh': 11.460873293393478, 'atr_min_pct': 0.007558752057791049, 'atr_max_pct': 0.09976277143275647, 'tp_mult': 2.5631823150418005, 'tsl_mult': 0.17847462096066258, 'strategy': 'mean_reversion', 'time_stop': 46, 'use_sma': False, 'use_atr': False, 'use_adx': False, 'use_ema': False, 'use_spike': False, 'rsi_required': False, 'edge_k': 0.23223468260435964, 'edge_cap': 0.6673753250615803, 'bull_strategy': 'breakout', 'bull_bb_std_mult': 3.390493285647819, 'bull_rsi_os': 13, 'bull_rsi_ob': 70, 'bull_adx_thresh': 21.738107724323427, 'bull_atr_min_pct': 0.004016810329267784, 'bull_atr_max_pct': 0.07130966414924417, 'bull_tp_mult': 2.3114293882104695, 'bull_tsl_mult': 0.4820918598995407, 'bull_time_stop': 25, 'bull_use_sma': False, 'bull_use_ema': False, 'bull_use_atr': True, 'bull_use_adx': True, 'bull_use_spike': True, 'bull_rsi_required': False, 'bear_strategy': 'breakout', 'bear_bb_std_mult': 0.9809798761965975, 'bear_rsi_os': 35, 'bear_rsi_ob': 62, 'bear_adx_thresh': 32.920100661013244, 'bear_atr_min_pct': 0.010124619204269237, 'bear_atr_max_pct': 0.02945568884396505, 'bear_tp_mult': 1.4303911073636955, 'bear_tsl_mult': 0.9402841261461491, 'bear_time_stop': 33, 'bear_use_sma': False, 'bear_use_ema': True, 'bear_use_atr': True, 'bear_use_adx': True, 'bear_use_spike': False, 'bear_rsi_required': False, 'sideways_strategy': 'mean_reversion', 'sideways_bb_std_mult': 2.9327523702475893, 'sideways_rsi_os': 46, 'sideways_rsi_ob': 85, 'sideways_adx_thresh': 5.01252204732317, 'sideways_atr_min_pct': 0.006514878873636776, 'sideways_atr_max_pct': 0.027612884690654912, 'sideways_tp_mult': 2.762464680558589, 'sideways_tsl_mult': 0.04665225072111395, 'sideways_time_stop': 231, 'sideways_use_sma': False, 'sideways_use_ema': False, 'sideways_use_atr': False, 'sideways_use_adx': True, 'sideways_use_spike': True, 'sideways_rsi_required': False}.
[I 2025-08-30 14:49:47,212] Trial 241 finished with values: [-1000000000.0, 1000000000.0] and parameters: {'p_sma': 43, 'p_std': 31, 'p_atr': 12, 'p_adx': 9, 'rsi_period': 74, 'ema1': 13, 'ema2': 51, 'slip_atr_k': 0.0072894618374445865, 'slip_spread_k': 0.7883236599895261, 'spread_hl_frac': 0.0016832473090397056, 'bb_std_mult': 2.966348371918427, 'rsi_os': 29, 'rsi_ob': 93, 'vol_spike': 0.21503189773521897, 'adx_thresh': 21.969460314794983, 'atr_min_pct': 0.008748772373744232, 'atr_max_pct': 0.10136179995639119, 'tp_mult': 2.0433415973906075, 'tsl_mult': 0.9760306472294563, 'strategy': 'mean_reversion', 'time_stop': 178, 'use_sma': False, 'use_atr': False, 'use_adx': True, 'use_ema': False, 'use_spike': False, 'rsi_required': False, 'edge_k': 0.30520226072169443, 'edge_cap': 0.3004827957892868, 'bull_strategy': 'breakout', 'bull_bb_std_mult': 3.1810385590564727, 'bull_rsi_os': 46, 'bull_rsi_ob': 84, 'bull_adx_thresh': 7.715784654803622, 'bull_atr_min_pct': 0.004428443372332461, 'bull_atr_max_pct': 0.0707379845526658, 'bull_tp_mult': 2.3673943933555566, 'bull_tsl_mult': 0.3010596162468233, 'bull_time_stop': 142, 'bull_use_sma': False, 'bull_use_ema': False, 'bull_use_atr': True, 'bull_use_adx': False, 'bull_use_spike': True, 'bull_rsi_required': False, 'bear_strategy': 'breakout', 'bear_bb_std_mult': 1.8979484187368796, 'bear_rsi_os': 34, 'bear_rsi_ob': 48, 'bear_adx_thresh': 18.40267869569392, 'bear_atr_min_pct': 0.022935210738661595, 'bear_atr_max_pct': 0.028727698674528623, 'bear_tp_mult': 2.933267131514719, 'bear_tsl_mult': 0.2881449158734272, 'bear_time_stop': 283, 'bear_use_sma': True, 'bear_use_ema': True, 'bear_use_atr': True, 'bear_use_adx': True, 'bear_use_spike': False, 'bear_rsi_required': False, 'sideways_strategy': 'mean_reversion', 'sideways_bb_std_mult': 2.9470971193793436, 'sideways_rsi_os': 12, 'sideways_rsi_ob': 87, 'sideways_adx_thresh': 18.87742397001029, 'sideways_atr_min_pct': 0.009143986894171046, 'sideways_atr_max_pct': 0.14088321518390134, 'sideways_tp_mult': 2.763697672656863, 'sideways_tsl_mult': 0.3026318671825554, 'sideways_time_stop': 99, 'sideways_use_sma': False, 'sideways_use_ema': False, 'sideways_use_atr': False, 'sideways_use_adx': True, 'sideways_use_spike': True, 'sideways_rsi_required': False}.
[I 2025-08-30 14:49:47,213] Trial 242 finished with values: [-1000000000.0, 1000000000.0] and parameters: {'p_sma': 43, 'p_std': 41, 'p_atr': 12, 'p_adx': 22, 'rsi_period': 17, 'ema1': 20, 'ema2': 51, 'slip_atr_k': 0.020946102450410568, 'slip_spread_k': 0.26433309555598117, 'spread_hl_frac': 0.0019942538627986846, 'bb_std_mult': 1.8955066468577977, 'rsi_os': 38, 'rsi_ob': 93, 'vol_spike': 0.19210043386876252, 'adx_thresh': 34.16872302442252, 'atr_min_pct': 0.008941400534341708, 'atr_max_pct': 0.07108478652336425, 'tp_mult': 2.054374643320848, 'tsl_mult': 0.5467406227812471, 'strategy': 'mean_reversion', 'time_stop': 53, 'use_sma': False, 'use_atr': False, 'use_adx': True, 'use_ema': False, 'use_spike': False, 'rsi_required': False, 'edge_k': 1.6189036733584468, 'edge_cap': 0.06990300638142494, 'bull_strategy': 'breakout', 'bull_bb_std_mult': 0.9463625309787784, 'bull_rsi_os': 23, 'bull_rsi_ob': 85, 'bull_adx_thresh': 12.075188150093473, 'bull_atr_min_pct': 0.004036286877958282, 'bull_atr_max_pct': 0.02530988932926139, 'bull_tp_mult': 1.1435149885767903, 'bull_tsl_mult': 0.5403551456338438, 'bull_time_stop': 139, 'bull_use_sma': False, 'bull_use_ema': False, 'bull_use_atr': True, 'bull_use_adx': False, 'bull_use_spike': True, 'bull_rsi_required': False, 'bear_strategy': 'breakout', 'bear_bb_std_mult': 2.5364400382379717, 'bear_rsi_os': 43, 'bear_rsi_ob': 48, 'bear_adx_thresh': 18.49495684389449, 'bear_atr_min_pct': 0.022873474154598936, 'bear_atr_max_pct': 0.0747216400965276, 'bear_tp_mult': 2.218294190439337, 'bear_tsl_mult': 0.9403417736294666, 'bear_time_stop': 63, 'bear_use_sma': True, 'bear_use_ema': True, 'bear_use_atr': True, 'bear_use_adx': True, 'bear_use_spike': False, 'bear_rsi_required': False, 'sideways_strategy': 'mean_reversion', 'sideways_bb_std_mult': 2.946473131699542, 'sideways_rsi_os': 18, 'sideways_rsi_ob': 65, 'sideways_adx_thresh': 13.037437856754154, 'sideways_atr_min_pct': 0.006268406526596027, 'sideways_atr_max_pct': 0.06251981742272342, 'sideways_tp_mult': 2.107182719696482, 'sideways_tsl_mult': 0.06019752203680537, 'sideways_time_stop': 215, 'sideways_use_sma': False, 'sideways_use_ema': False, 'sideways_use_atr': False, 'sideways_use_adx': True, 'sideways_use_spike': True, 'sideways_rsi_required': False}.
