[I 2025-08-30 14:39:11,829] Trial 155 finished with values: [-1000000000.0, 1000000000.0] and parameters: {'p_sma': 40, 'p_std': 29, 'p_atr': 10, 'p_adx': 22, 'rsi_period': 45, 'ema1': 21, 'ema2': 49, 'slip_atr_k': 0.011582228238552584, 'slip_spread_k': 0.5754069845384737, 'spread_hl_frac': 0.005767694396246442, 'bb_std_mult': 1.8712269871413183, 'rsi_os': 36, 'rsi_ob': 93, 'vol_spike': 0.2504176957095941, 'adx_thresh': 20.605509860234303, 'atr_min_pct': 0.02039345366586169, 'atr_max_pct': 0.013843137880645548, 'tp_mult': 2.5992496233658255, 'tsl_mult': 0.9567156454529264, 'strategy': 'breakout', 'time_stop': 23, 'use_sma': True, 'use_atr': False, 'use_adx': True, 'use_ema': False, 'use_spike': False, 'rsi_required': True, 'edge_k': 1.1254305255310901, 'edge_cap': 0.20041525104859603, 'bull_strategy': 'breakout', 'bull_bb_std_mult': 3.490009096508321, 'bull_rsi_os': 18, 'bull_rsi_ob': 77, 'bull_adx_thresh': 14.377306717691608, 'bull_atr_min_pct': 0.0024495686930251573, 'bull_atr_max_pct': 0.021461613194266028, 'bull_tp_mult': 1.4070358183879086, 'bull_tsl_mult': 0.47772608103949177, 'bull_time_stop': 254, 'bull_use_sma': False, 'bull_use_ema': False, 'bull_use_atr': True, 'bull_use_adx': True, 'bull_use_spike': False, 'bull_rsi_required': True, 'bear_strategy': 'breakout', 'bear_bb_std_mult': 0.6505991558429651, 'bear_rsi_os': 21, 'bear_rsi_ob': 48, 'bear_adx_thresh': 16.740811656196698, 'bear_atr_min_pct': 0.009488261641703116, 'bear_atr_max_pct': 0.029559032357286495, 'bear_tp_mult': 2.931995180202061, 'bear_tsl_mult': 0.2507241014735247, 'bear_time_stop': 38, 'bear_use_sma': True, 'bear_use_ema': False, 'bear_use_atr': True, 'bear_use_adx': False, 'bear_use_spike': True, 'bear_rsi_required': False, 'sideways_strategy': 'breakout', 'sideways_bb_std_mult': 3.086980418181057, 'sideways_rsi_os': 29, 'sideways_rsi_ob': 49, 'sideways_adx_thresh': 12.88683463078965, 'sideways_atr_min_pct': 0.004079352148194466, 'sideways_atr_max_pct': 0.08565934084553763, 'sideways_tp_mult': 2.755634577112154, 'sideways_tsl_mult': 0.21754216453545416, 'sideways_time_stop': 231, 'sideways_use_sma': False, 'sideways_use_ema': False, 'sideways_use_atr': False, 'sideways_use_adx': True, 'sideways_use_spike': True, 'sideways_rsi_required': True}.
[I 2025-08-30 14:39:41,411] Trial 156 finished with values: [-0.019401600270126385, 0.019485073241447028] and parameters: {'p_sma': 43, 'p_std': 29, 'p_atr': 10, 'p_adx': 22, 'rsi_period': 45, 'ema1': 26, 'ema2': 49, 'slip_atr_k': 0.06878780749677296, 'slip_spread_k': 0.3102890212713685, 'spread_hl_frac': 0.028780224542518433, 'bb_std_mult': 2.0501933442047, 'rsi_os': 36, 'rsi_ob': 93, 'vol_spike': 0.24779938442312197, 'adx_thresh': 21.47320557212047, 'atr_min_pct': 0.02036286766924601, 'atr_max_pct': 0.11449782302684176, 'tp_mult': 2.5016177857811783, 'tsl_mult': 0.9565305693621001, 'strategy': 'breakout', 'time_stop': 26, 'use_sma': True, 'use_atr': True, 'use_adx': True, 'use_ema': True, 'use_spike': False, 'rsi_required': True, 'edge_k': 1.5360016296381955, 'edge_cap': 0.6373976733211995, 'bull_strategy': 'breakout', 'bull_bb_std_mult': 3.4910086321022726, 'bull_rsi_os': 18, 'bull_rsi_ob': 77, 'bull_adx_thresh': 30.10306308893066, 'bull_atr_min_pct': 0.0023065854701843688, 'bull_atr_max_pct': 0.1210856437448751, 'bull_tp_mult': 1.4033145453586038, 'bull_tsl_mult': 0.9282845968034328, 'bull_time_stop': 253, 'bull_use_sma': True, 'bull_use_ema': False, 'bull_use_atr': True, 'bull_use_adx': True, 'bull_use_spike': False, 'bull_rsi_required': True, 'bear_strategy': 'breakout', 'bear_bb_std_mult': 2.512498204294522, 'bear_rsi_os': 20, 'bear_rsi_ob': 61, 'bear_adx_thresh': 8.818967490039572, 'bear_atr_min_pct': 0.02841870385611739, 'bear_atr_max_pct': 0.020900292622290675, 'bear_tp_mult': 1.4445785826354753, 'bear_tsl_mult': 0.2382228117542763, 'bear_time_stop': 39, 'bear_use_sma': True, 'bear_use_ema': False, 'bear_use_atr': True, 'bear_use_adx': False, 'bear_use_spike': True, 'bear_rsi_required': False, 'sideways_strategy': 'breakout', 'sideways_bb_std_mult': 3.368907217952789, 'sideways_rsi_os': 35, 'sideways_rsi_ob': 79, 'sideways_adx_thresh': 28.896188199922186, 'sideways_atr_min_pct': 0.003996746359377934, 'sideways_atr_max_pct': 0.07299862069664217, 'sideways_tp_mult': 2.652061120411979, 'sideways_tsl_mult': 0.6741323010736657, 'sideways_time_stop': 77, 'sideways_use_sma': True, 'sideways_use_ema': False, 'sideways_use_atr': False, 'sideways_use_adx': True, 'sideways_use_spike': False, 'sideways_rsi_required': True}.
[I 2025-08-30 14:39:42,133] Trial 154 finished with values: [-0.020087860687433068, 0.020036530778874812] and parameters: {'p_sma': 30, 'p_std': 29, 'p_atr': 7, 'p_adx': 22, 'rsi_period': 45, 'ema1': 21, 'ema2': 47, 'slip_atr_k': 0.06828596166418788, 'slip_spread_k': 0.6673725961555157, 'spread_hl_frac': 0.02846587292374698, 'bb_std_mult': 1.8658586329356737, 'rsi_os': 10, 'rsi_ob': 90, 'vol_spike': 0.25632039209012997, 'adx_thresh': 20.64947120293987, 'atr_min_pct': 0.020192929426454117, 'atr_max_pct': 0.10211433589656706, 'tp_mult': 2.664316848137535, 'tsl_mult': 0.9845529658768128, 'strategy': 'mean_reversion', 'time_stop': 25, 'use_sma': True, 'use_atr': False, 'use_adx': True, 'use_ema': False, 'use_spike': False, 'rsi_required': True, 'edge_k': 0.1015539678404851, 'edge_cap': 0.6401642744046516, 'bull_strategy': 'mean_reversion', 'bull_bb_std_mult': 3.481817691215836, 'bull_rsi_os': 19, 'bull_rsi_ob': 95, 'bull_adx_thresh': 30.52485611783319, 'bull_atr_min_pct': 0.002339388821130658, 'bull_atr_max_pct': 0.021569848072511416, 'bull_tp_mult': 1.4050651757906238, 'bull_tsl_mult': 0.4863184537452745, 'bull_time_stop': 256, 'bull_use_sma': False, 'bull_use_ema': False, 'bull_use_atr': True, 'bull_use_adx': False, 'bull_use_spike': False, 'bull_rsi_required': True, 'bear_strategy': 'breakout', 'bear_bb_std_mult': 3.2282572761668207, 'bear_rsi_os': 13, 'bear_rsi_ob': 93, 'bear_adx_thresh': 33.71915267987859, 'bear_atr_min_pct': 0.009451615383893327, 'bear_atr_max_pct': 0.06126480897937468, 'bear_tp_mult': 2.0340353037377668, 'bear_tsl_mult': 0.24611755767967147, 'bear_time_stop': 39, 'bear_use_sma': True, 'bear_use_ema': False, 'bear_use_atr': False, 'bear_use_adx': False, 'bear_use_spike': True, 'bear_rsi_required': False, 'sideways_strategy': 'breakout', 'sideways_bb_std_mult': 3.1006243709257078, 'sideways_rsi_os': 31, 'sideways_rsi_ob': 49, 'sideways_adx_thresh': 18.76096331923668, 'sideways_atr_min_pct': 0.003839457271925122, 'sideways_atr_max_pct': 0.07909325453221336, 'sideways_tp_mult': 2.790628382166317, 'sideways_tsl_mult': 0.49276827619679514, 'sideways_time_stop': 232, 'sideways_use_sma': False, 'sideways_use_ema': False, 'sideways_use_atr': True, 'sideways_use_adx': False, 'sideways_use_spike': True, 'sideways_rsi_required': True}.
[I 2025-08-30 14:39:42,268] Trial 157 finished with values: [-1000000000.0, 1000000000.0] and parameters: {'p_sma': 35, 'p_std': 27, 'p_atr': 7, 'p_adx': 29, 'rsi_period': 51, 'ema1': 26, 'ema2': 47, 'slip_atr_k': 0.02656413865173451, 'slip_spread_k': 0.23930306527106404, 'spread_hl_frac': 0.02558056911077433, 'bb_std_mult': 2.0690820715577734, 'rsi_os': 34, 'rsi_ob': 53, 'vol_spike': 0.10080326394546855, 'adx_thresh': 18.967974542334133, 'atr_min_pct': 0.019414160539282212, 'atr_max_pct': 0.11474215092381318, 'tp_mult': 2.491222654355348, 'tsl_mult': 0.5555100372662114, 'strategy': 'mean_reversion', 'time_stop': 25, 'use_sma': True, 'use_atr': True, 'use_adx': False, 'use_ema': True, 'use_spike': False, 'rsi_required': False, 'edge_k': 0.18930690517269522, 'edge_cap': 0.6572732164639271, 'bull_strategy': 'mean_reversion', 'bull_bb_std_mult': 1.4730298627716096, 'bull_rsi_os': 13, 'bull_rsi_ob': 48, 'bull_adx_thresh': 34.90080159189074, 'bull_atr_min_pct': 0.02196266483770499, 'bull_atr_max_pct': 0.12060631036029808, 'bull_tp_mult': 1.4945867260780754, 'bull_tsl_mult': 0.44666425753392625, 'bull_time_stop': 265, 'bull_use_sma': True, 'bull_use_ema': False, 'bull_use_atr': False, 'bull_use_adx': False, 'bull_use_spike': False, 'bull_rsi_required': True, 'bear_strategy': 'breakout', 'bear_bb_std_mult': 3.287160673250315, 'bear_rsi_os': 16, 'bear_rsi_ob': 93, 'bear_adx_thresh': 17.691432683704456, 'bear_atr_min_pct': 0.012468103933878835, 'bear_atr_max_pct': 0.06139680444768554, 'bear_tp_mult': 1.7377016534969134, 'bear_tsl_mult': 0.242890393217377, 'bear_time_stop': 5, 'bear_use_sma': True, 'bear_use_ema': False, 'bear_use_atr': False, 'bear_use_adx': False, 'bear_use_spike': True, 'bear_rsi_required': False, 'sideways_strategy': 'breakout', 'sideways_bb_std_mult': 3.0037636762185986, 'sideways_rsi_os': 31, 'sideways_rsi_ob': 89, 'sideways_adx_thresh': 33.45953598154641, 'sideways_atr_min_pct': 0.0037696403920574506, 'sideways_atr_max_pct': 0.12334988487995378, 'sideways_tp_mult': 2.6651567744064644, 'sideways_tsl_mult': 0.9093193406995574, 'sideways_time_stop': 159, 'sideways_use_sma': True, 'sideways_use_ema': False, 'sideways_use_atr': True, 'sideways_use_adx': False, 'sideways_use_spike': False, 'sideways_rsi_required': True}.
[I 2025-08-30 14:39:42,374] Trial 153 finished with values: [-1000000000.0, 1000000000.0] and parameters: {'p_sma': 35, 'p_std': 30, 'p_atr': 13, 'p_adx': 22, 'rsi_period': 45, 'ema1': 25, 'ema2': 53, 'slip_atr_k': 0.21401273284567948, 'slip_spread_k': 0.3125749326239672, 'spread_hl_frac': 0.0059947372473160045, 'bb_std_mult': 1.8659305638591344, 'rsi_os': 9, 'rsi_ob': 90, 'vol_spike': 0.25782688956002364, 'adx_thresh': 16.235766318141106, 'atr_min_pct': 0.020168136906683523, 'atr_max_pct': 0.09739691038140955, 'tp_mult': 2.667002057640026, 'tsl_mult': 0.9833835389962337, 'strategy': 'mean_reversion', 'time_stop': 261, 'use_sma': True, 'use_atr': False, 'use_adx': True, 'use_ema': False, 'use_spike': True, 'rsi_required': False, 'edge_k': 0.1946984855784546, 'edge_cap': 0.688157254920411, 'bull_strategy': 'mean_reversion', 'bull_bb_std_mult': 3.4955476851393823, 'bull_rsi_os': 18, 'bull_rsi_ob': 55, 'bull_adx_thresh': 14.283511458765187, 'bull_atr_min_pct': 0.002683793046082173, 'bull_atr_max_pct': 0.022257517771520435, 'bull_tp_mult': 1.3756317469097983, 'bull_tsl_mult': 0.5093492183923529, 'bull_time_stop': 197, 'bull_use_sma': False, 'bull_use_ema': True, 'bull_use_atr': True, 'bull_use_adx': False, 'bull_use_spike': False, 'bull_rsi_required': True, 'bear_strategy': 'breakout', 'bear_bb_std_mult': 2.535844287007565, 'bear_rsi_os': 18, 'bear_rsi_ob': 75, 'bear_adx_thresh': 27.04810545127073, 'bear_atr_min_pct': 0.009366728949876005, 'bear_atr_max_pct': 0.08118976113102382, 'bear_tp_mult': 1.4345278545768547, 'bear_tsl_mult': 0.1353697310850224, 'bear_time_stop': 5, 'bear_use_sma': True, 'bear_use_ema': False, 'bear_use_atr': False, 'bear_use_adx': True, 'bear_use_spike': True, 'bear_rsi_required': False, 'sideways_strategy': 'breakout', 'sideways_bb_std_mult': 1.0395587809692823, 'sideways_rsi_os': 35, 'sideways_rsi_ob': 94, 'sideways_adx_thresh': 14.133813788631905, 'sideways_atr_min_pct': 0.005460541184441995, 'sideways_atr_max_pct': 0.12152630511374712, 'sideways_tp_mult': 2.7523994875078395, 'sideways_tsl_mult': 0.06606172529028868, 'sideways_time_stop': 243, 'sideways_use_sma': False, 'sideways_use_ema': False, 'sideways_use_atr': True, 'sideways_use_adx': False, 'sideways_use_spike': True, 'sideways_rsi_required': True}.
[I 2025-08-30 14:40:13,165] Trial 159 finished with values: [-1000000000.0, 1000000000.0] and parameters: {'p_sma': 32, 'p_std': 31, 'p_atr': 15, 'p_adx': 29, 'rsi_period': 51, 'ema1': 26, 'ema2': 47, 'slip_atr_k': 0.0683483381082024, 'slip_spread_k': 0.2549655707298774, 'spread_hl_frac': 0.020345007502992674, 'bb_std_mult': 2.098736208063578, 'rsi_os': 31, 'rsi_ob': 53, 'vol_spike': 0.02854658308155901, 'adx_thresh': 21.376712925992525, 'atr_min_pct': 0.019701604568602975, 'atr_max_pct': 0.10182995087701721, 'tp_mult': 1.976042781644284, 'tsl_mult': 0.9986425038759902, 'strategy': 'mean_reversion', 'time_stop': 265, 'use_sma': True, 'use_atr': True, 'use_adx': False, 'use_ema': True, 'use_spike': False, 'rsi_required': False, 'edge_k': 1.7133509021715407, 'edge_cap': 0.9579952357112848, 'bull_strategy': 'mean_reversion', 'bull_bb_std_mult': 3.347027140183011, 'bull_rsi_os': 18, 'bull_rsi_ob': 75, 'bull_adx_thresh': 31.111601747390537, 'bull_atr_min_pct': 0.02917749798162171, 'bull_atr_max_pct': 0.010415273612128094, 'bull_tp_mult': 2.585420196696383, 'bull_tsl_mult': 0.7463503606943016, 'bull_time_stop': 199, 'bull_use_sma': False, 'bull_use_ema': False, 'bull_use_atr': False, 'bull_use_adx': True, 'bull_use_spike': False, 'bull_rsi_required': True, 'bear_strategy': 'mean_reversion', 'bear_bb_std_mult': 2.846328693422189, 'bear_rsi_os': 16, 'bear_rsi_ob': 75, 'bear_adx_thresh': 17.785844097055918, 'bear_atr_min_pct': 0.011677747126051597, 'bear_atr_max_pct': 0.05959472422889271, 'bear_tp_mult': 1.2031644713598806, 'bear_tsl_mult': 0.2360426707856344, 'bear_time_stop': 42, 'bear_use_sma': False, 'bear_use_ema': False, 'bear_use_atr': False, 'bear_use_adx': False, 'bear_use_spike': True, 'bear_rsi_required': False, 'sideways_strategy': 'breakout', 'sideways_bb_std_mult': 3.0122040105075962, 'sideways_rsi_os': 35, 'sideways_rsi_ob': 88, 'sideways_adx_thresh': 16.34593134365218, 'sideways_atr_min_pct': 0.003656922499028131, 'sideways_atr_max_pct': 0.0728828349173578, 'sideways_tp_mult': 2.6658592355213795, 'sideways_tsl_mult': 0.18624850841893972, 'sideways_time_stop': 80, 'sideways_use_sma': True, 'sideways_use_ema': False, 'sideways_use_atr': True, 'sideways_use_adx': False, 'sideways_use_spike': False, 'sideways_rsi_required': True}.
[I 2025-08-30 14:40:13,506] Trial 158 finished with values: [-0.016446155544683094, 0.016376707777181976] and parameters: {'p_sma': 13, 'p_std': 18, 'p_atr': 8, 'p_adx': 23, 'rsi_period': 52, 'ema1': 26, 'ema2': 53, 'slip_atr_k': 0.0024791871027340234, 'slip_spread_k': 0.2593622054258668, 'spread_hl_frac': 0.02075189985726376, 'bb_std_mult': 2.814293310094989, 'rsi_os': 34, 'rsi_ob': 88, 'vol_spike': 0.10085483389157675, 'adx_thresh': 21.459209628457806, 'atr_min_pct': 0.01830034582001195, 'atr_max_pct': 0.09758097247024197, 'tp_mult': 2.667142240049797, 'tsl_mult': 0.9994491432553589, 'strategy': 'mean_reversion', 'time_stop': 263, 'use_sma': True, 'use_atr': True, 'use_adx': True, 'use_ema': True, 'use_spike': False, 'rsi_required': False, 'edge_k': 0.1867094542206772, 'edge_cap': 0.7062824643574651, 'bull_strategy': 'mean_reversion', 'bull_bb_std_mult': 3.3371916807719084, 'bull_rsi_os': 19, 'bull_rsi_ob': 48, 'bull_adx_thresh': 14.940365697124811, 'bull_atr_min_pct': 0.0023435545818943975, 'bull_atr_max_pct': 0.12013987564010142, 'bull_tp_mult': 1.4909326114653172, 'bull_tsl_mult': 0.5738870187174719, 'bull_time_stop': 199, 'bull_use_sma': True, 'bull_use_ema': False, 'bull_use_atr': False, 'bull_use_adx': False, 'bull_use_spike': False, 'bull_rsi_required': True, 'bear_strategy': 'mean_reversion', 'bear_bb_std_mult': 3.2760386259055148, 'bear_rsi_os': 51, 'bear_rsi_ob': 93, 'bear_adx_thresh': 17.606550828992297, 'bear_atr_min_pct': 0.012297123148449413, 'bear_atr_max_pct': 0.149936088907492, 'bear_tp_mult': 1.4281507935573292, 'bear_tsl_mult': 0.234186669585904, 'bear_time_stop': 41, 'bear_use_sma': True, 'bear_use_ema': False, 'bear_use_atr': False, 'bear_use_adx': False, 'bear_use_spike': True, 'bear_rsi_required': False, 'sideways_strategy': 'breakout', 'sideways_bb_std_mult': 3.356010742438812, 'sideways_rsi_os': 35, 'sideways_rsi_ob': 89, 'sideways_adx_thresh': 19.66531232336244, 'sideways_atr_min_pct': 0.025224738215703375, 'sideways_atr_max_pct': 0.07276119698584657, 'sideways_tp_mult': 2.6450404234299967, 'sideways_tsl_mult': 0.4955987568596638, 'sideways_time_stop': 158, 'sideways_use_sma': False, 'sideways_use_ema': False, 'sideways_use_atr': True, 'sideways_use_adx': False, 'sideways_use_spike': False, 'sideways_rsi_required': True}.
[I 2025-08-30 14:40:13,754] Trial 161 finished with values: [-1000000000.0, 1000000000.0] and parameters: {'p_sma': 31, 'p_std': 31, 'p_atr': 8, 'p_adx': 27, 'rsi_period': 43, 'ema1': 29, 'ema2': 37, 'slip_atr_k': 0.017750184125531792, 'slip_spread_k': 0.2520895063156715, 'spread_hl_frac': 0.02924692742301938, 'bb_std_mult': 2.021960817845116, 'rsi_os': 31, 'rsi_ob': 88, 'vol_spike': 0.2443151542784375, 'adx_thresh': 21.442567646945985, 'atr_min_pct': 0.01839037431758647, 'atr_max_pct': 0.10263106548015005, 'tp_mult': 2.719591519661251, 'tsl_mult': 0.6703932787933332, 'strategy': 'breakout', 'time_stop': 5, 'use_sma': True, 'use_atr': True, 'use_adx': False, 'use_ema': True, 'use_spike': False, 'rsi_required': True, 'edge_k': 1.7112346587253098, 'edge_cap': 0.7053150847607589, 'bull_strategy': 'breakout', 'bull_bb_std_mult': 2.5284771641373447, 'bull_rsi_os': 19, 'bull_rsi_ob': 75, 'bull_adx_thresh': 11.938398494904018, 'bull_atr_min_pct': 0.028551547149867178, 'bull_atr_max_pct': 0.0580364804648371, 'bull_tp_mult': 1.3050773964316293, 'bull_tsl_mult': 0.3864988268617153, 'bull_time_stop': 59, 'bull_use_sma': False, 'bull_use_ema': False, 'bull_use_atr': False, 'bull_use_adx': True, 'bull_use_spike': True, 'bull_rsi_required': False, 'bear_strategy': 'mean_reversion', 'bear_bb_std_mult': 2.919642714012309, 'bear_rsi_os': 51, 'bear_rsi_ob': 49, 'bear_adx_thresh': 8.878753174224666, 'bear_atr_min_pct': 0.011855240318844244, 'bear_atr_max_pct': 0.05117246831711979, 'bear_tp_mult': 2.0554652389380785, 'bear_tsl_mult': 0.7889673715646539, 'bear_time_stop': 258, 'bear_use_sma': False, 'bear_use_ema': False, 'bear_use_atr': False, 'bear_use_adx': False, 'bear_use_spike': True, 'bear_rsi_required': True, 'sideways_strategy': 'mean_reversion', 'sideways_bb_std_mult': 0.7689611889589905, 'sideways_rsi_os': 35, 'sideways_rsi_ob': 79, 'sideways_adx_thresh': 15.766466550445504, 'sideways_atr_min_pct': 0.014554233567002084, 'sideways_atr_max_pct': 0.08000289287027437, 'sideways_tp_mult': 2.613897504664187, 'sideways_tsl_mult': 0.6185891451320957, 'sideways_time_stop': 220, 'sideways_use_sma': False, 'sideways_use_ema': True, 'sideways_use_atr': False, 'sideways_use_adx': True, 'sideways_use_spike': False, 'sideways_rsi_required': True}.
[I 2025-08-30 14:40:13,924] Trial 160 finished with values: [-1000000000.0, 1000000000.0] and parameters: {'p_sma': 31, 'p_std': 22, 'p_atr': 11, 'p_adx': 23, 'rsi_period': 52, 'ema1': 28, 'ema2': 53, 'slip_atr_k': 0.21223979156106895, 'slip_spread_k': 0.26068576408282357, 'spread_hl_frac': 0.01903393039803045, 'bb_std_mult': 2.0695034891945023, 'rsi_os': 31, 'rsi_ob': 89, 'vol_spike': 0.028320516365214446, 'adx_thresh': 21.0481567955903, 'atr_min_pct': 0.020311492232727824, 'atr_max_pct': 0.10157695473713134, 'tp_mult': 1.8860253443186596, 'tsl_mult': 0.9843565140458586, 'strategy': 'mean_reversion', 'time_stop': 5, 'use_sma': True, 'use_atr': True, 'use_adx': False, 'use_ema': True, 'use_spike': False, 'rsi_required': False, 'edge_k': 1.712280781241932, 'edge_cap': 0.6731704904994594, 'bull_strategy': 'breakout', 'bull_bb_std_mult': 3.3593016456246154, 'bull_rsi_os': 17, 'bull_rsi_ob': 75, 'bull_adx_thresh': 11.817885847130697, 'bull_atr_min_pct': 0.028926569511361314, 'bull_atr_max_pct': 0.019472722441346256, 'bull_tp_mult': 1.5330958555365828, 'bull_tsl_mult': 0.7184725975876349, 'bull_time_stop': 57, 'bull_use_sma': False, 'bull_use_ema': False, 'bull_use_atr': True, 'bull_use_adx': True, 'bull_use_spike': True, 'bull_rsi_required': False, 'bear_strategy': 'mean_reversion', 'bear_bb_std_mult': 0.8878102888862878, 'bear_rsi_os': 15, 'bear_rsi_ob': 61, 'bear_adx_thresh': 16.25828315544537, 'bear_atr_min_pct': 0.011574799441604312, 'bear_atr_max_pct': 0.149431815421656, 'bear_tp_mult': 1.1735806787176395, 'bear_tsl_mult': 0.22863057714138224, 'bear_time_stop': 271, 'bear_use_sma': False, 'bear_use_ema': False, 'bear_use_atr': False, 'bear_use_adx': False, 'bear_use_spike': True, 'bear_rsi_required': True, 'sideways_strategy': 'mean_reversion', 'sideways_bb_std_mult': 0.7769126405503459, 'sideways_rsi_os': 35, 'sideways_rsi_ob': 79, 'sideways_adx_thresh': 16.591488326536176, 'sideways_atr_min_pct': 0.0028683153424292306, 'sideways_atr_max_pct': 0.07369751655193545, 'sideways_tp_mult': 2.633849868809034, 'sideways_tsl_mult': 0.3762440052349702, 'sideways_time_stop': 12, 'sideways_use_sma': False, 'sideways_use_ema': True, 'sideways_use_atr': False, 'sideways_use_adx': True, 'sideways_use_spike': False, 'sideways_rsi_required': True}.
