[I 2025-08-30 16:06:05,085] Trial 648 finished with values: [-1000000000.0, 1000000000.0] and parameters: {'p_sma': 5, 'p_std': 53, 'p_atr': 26, 'p_adx': 11, 'rsi_period': 81, 'ema1': 23, 'ema2': 30, 'slip_atr_k': 0.08192207663829884, 'slip_spread_k': 0.1927432214273258, 'spread_hl_frac': 0.023212582751680085, 'bb_std_mult': 2.4397223805213524, 'rsi_os': 40, 'rsi_ob': 84, 'vol_spike': 0.14984372018252368, 'adx_thresh': 15.50482988059428, 'atr_min_pct': 0.015813622256711176, 'atr_max_pct': 0.06460836182001373, 'tp_mult': 1.6471936959090356, 'tsl_mult': 0.23669843813665614, 'strategy': 'mean_reversion', 'time_stop': 221, 'use_sma': True, 'use_atr': True, 'use_adx': False, 'use_ema': False, 'use_spike': True, 'rsi_required': False, 'edge_k': 0.4470446766980722, 'edge_cap': 0.6393368543716847, 'bull_strategy': 'breakout', 'bull_bb_std_mult': 0.7115300323804465, 'bull_rsi_os': 42, 'bull_rsi_ob': 61, 'bull_adx_thresh': 24.52221284530931, 'bull_atr_min_pct': 0.018930788321409056, 'bull_atr_max_pct': 0.09331714473805881, 'bull_tp_mult': 1.9907051967461662, 'bull_tsl_mult': 0.07878306885256325, 'bull_time_stop': 13, 'bull_use_sma': True, 'bull_use_ema': True, 'bull_use_atr': True, 'bull_use_adx': True, 'bull_use_spike': True, 'bull_rsi_required': True, 'bear_strategy': 'breakout', 'bear_bb_std_mult': 2.5965091641122178, 'bear_rsi_os': 35, 'bear_rsi_ob': 85, 'bear_adx_thresh': 30.643102873521762, 'bear_atr_min_pct': 0.019682456207089194, 'bear_atr_max_pct': 0.08133451789860237, 'bear_tp_mult': 2.8407219420331646, 'bear_tsl_mult': 0.37406353647234236, 'bear_time_stop': 274, 'bear_use_sma': False, 'bear_use_ema': False, 'bear_use_atr': False, 'bear_use_adx': True, 'bear_use_spike': True, 'bear_rsi_required': False, 'sideways_strategy': 'mean_reversion', 'sideways_bb_std_mult': 1.0698568167198172, 'sideways_rsi_os': 38, 'sideways_rsi_ob': 63, 'sideways_adx_thresh': 24.031979269718658, 'sideways_atr_min_pct': 0.0005347808277344947, 'sideways_atr_max_pct': 0.11191344537896225, 'sideways_tp_mult': 2.9615414546714933, 'sideways_tsl_mult': 0.9007342900600164, 'sideways_time_stop': 60, 'sideways_use_sma': True, 'sideways_use_ema': False, 'sideways_use_atr': False, 'sideways_use_adx': True, 'sideways_use_spike': True, 'sideways_rsi_required': True}.
[I 2025-08-30 16:06:05,418] Trial 649 finished with values: [-1000000000.0, 1000000000.0] and parameters: {'p_sma': 5, 'p_std': 54, 'p_atr': 29, 'p_adx': 11, 'rsi_period': 84, 'ema1': 23, 'ema2': 30, 'slip_atr_k': 0.08260071818820222, 'slip_spread_k': 0.1862432104313176, 'spread_hl_frac': 0.02263303423445272, 'bb_std_mult': 2.421924603802333, 'rsi_os': 39, 'rsi_ob': 84, 'vol_spike': 0.14519991629867862, 'adx_thresh': 15.497582993346054, 'atr_min_pct': 0.01566664929329827, 'atr_max_pct': 0.06706443373360019, 'tp_mult': 1.6553543666389783, 'tsl_mult': 0.2123575483126655, 'strategy': 'mean_reversion', 'time_stop': 221, 'use_sma': True, 'use_atr': True, 'use_adx': False, 'use_ema': False, 'use_spike': False, 'rsi_required': False, 'edge_k': 0.5121197329235648, 'edge_cap': 0.6305240110054107, 'bull_strategy': 'breakout', 'bull_bb_std_mult': 0.7160034186147187, 'bull_rsi_os': 43, 'bull_rsi_ob': 63, 'bull_adx_thresh': 24.726800567164627, 'bull_atr_min_pct': 0.01878659201540597, 'bull_atr_max_pct': 0.09466158336875895, 'bull_tp_mult': 2.004920957697272, 'bull_tsl_mult': 0.08175805899966498, 'bull_time_stop': 12, 'bull_use_sma': True, 'bull_use_ema': True, 'bull_use_atr': True, 'bull_use_adx': True, 'bull_use_spike': True, 'bull_rsi_required': True, 'bear_strategy': 'breakout', 'bear_bb_std_mult': 2.573089125665969, 'bear_rsi_os': 37, 'bear_rsi_ob': 85, 'bear_adx_thresh': 30.683714290993723, 'bear_atr_min_pct': 0.019534460259972873, 'bear_atr_max_pct': 0.08185489595345151, 'bear_tp_mult': 2.812918611257071, 'bear_tsl_mult': 0.32839736357971056, 'bear_time_stop': 273, 'bear_use_sma': False, 'bear_use_ema': False, 'bear_use_atr': False, 'bear_use_adx': True, 'bear_use_spike': True, 'bear_rsi_required': False, 'sideways_strategy': 'mean_reversion', 'sideways_bb_std_mult': 1.0613683017918112, 'sideways_rsi_os': 38, 'sideways_rsi_ob': 63, 'sideways_adx_thresh': 23.612866016300874, 'sideways_atr_min_pct': 0.0004440533926603676, 'sideways_atr_max_pct': 0.11025021425224346, 'sideways_tp_mult': 2.9540748418046685, 'sideways_tsl_mult': 0.9234877910677477, 'sideways_time_stop': 61, 'sideways_use_sma': True, 'sideways_use_ema': False, 'sideways_use_atr': False, 'sideways_use_adx': True, 'sideways_use_spike': True, 'sideways_rsi_required': True}.
[I 2025-08-30 16:06:07,211] Trial 651 finished with values: [-1000000000.0, 1000000000.0] and parameters: {'p_sma': 39, 'p_std': 54, 'p_atr': 25, 'p_adx': 11, 'rsi_period': 80, 'ema1': 22, 'ema2': 29, 'slip_atr_k': 0.08482113103014643, 'slip_spread_k': 0.1842656929425003, 'spread_hl_frac': 0.022616306509064647, 'bb_std_mult': 2.5536162992222557, 'rsi_os': 37, 'rsi_ob': 50, 'vol_spike': 0.14704696334595, 'adx_thresh': 15.932373847546154, 'atr_min_pct': 0.015582218712403072, 'atr_max_pct': 0.06879211114593457, 'tp_mult': 1.6473963021165512, 'tsl_mult': 0.3498410984857633, 'strategy': 'mean_reversion', 'time_stop': 213, 'use_sma': True, 'use_atr': True, 'use_adx': False, 'use_ema': True, 'use_spike': False, 'rsi_required': False, 'edge_k': 0.506578036214251, 'edge_cap': 0.6245514137825185, 'bull_strategy': 'breakout', 'bull_bb_std_mult': 0.9530548789691706, 'bull_rsi_os': 43, 'bull_rsi_ob': 63, 'bull_adx_thresh': 23.894886388799847, 'bull_atr_min_pct': 0.01927921863991129, 'bull_atr_max_pct': 0.09663420322075095, 'bull_tp_mult': 2.015932915289254, 'bull_tsl_mult': 0.017981629682833858, 'bull_time_stop': 50, 'bull_use_sma': True, 'bull_use_ema': True, 'bull_use_atr': True, 'bull_use_adx': True, 'bull_use_spike': True, 'bull_rsi_required': True, 'bear_strategy': 'breakout', 'bear_bb_std_mult': 2.4836193643944835, 'bear_rsi_os': 36, 'bear_rsi_ob': 85, 'bear_adx_thresh': 29.81695448224117, 'bear_atr_min_pct': 0.02003432730824834, 'bear_atr_max_pct': 0.08093114008632495, 'bear_tp_mult': 2.800562220541091, 'bear_tsl_mult': 0.3021510132360585, 'bear_time_stop': 262, 'bear_use_sma': False, 'bear_use_ema': False, 'bear_use_atr': True, 'bear_use_adx': True, 'bear_use_spike': True, 'bear_rsi_required': False, 'sideways_strategy': 'breakout', 'sideways_bb_std_mult': 1.116270749447431, 'sideways_rsi_os': 38, 'sideways_rsi_ob': 64, 'sideways_adx_thresh': 24.415685139909982, 'sideways_atr_min_pct': 0.014015313116553704, 'sideways_atr_max_pct': 0.10964062345795446, 'sideways_tp_mult': 2.9866384973339795, 'sideways_tsl_mult': 0.9213679853965517, 'sideways_time_stop': 66, 'sideways_use_sma': True, 'sideways_use_ema': False, 'sideways_use_atr': False, 'sideways_use_adx': True, 'sideways_use_spike': True, 'sideways_rsi_required': True}.
[I 2025-08-30 16:06:53,455] Trial 652 finished with values: [-0.01579699859669559, 0.01568636560765719] and parameters: {'p_sma': 36, 'p_std': 54, 'p_atr': 25, 'p_adx': 11, 'rsi_period': 80, 'ema1': 22, 'ema2': 29, 'slip_atr_k': 0.07783138420211816, 'slip_spread_k': 0.19597231432779144, 'spread_hl_frac': 0.021314983010320688, 'bb_std_mult': 2.5611905605305347, 'rsi_os': 38, 'rsi_ob': 76, 'vol_spike': 0.1539244931325923, 'adx_thresh': 16.286851007756855, 'atr_min_pct': 0.01600507203161326, 'atr_max_pct': 0.07221883800212607, 'tp_mult': 1.6897224884989062, 'tsl_mult': 0.3675182424471124, 'strategy': 'mean_reversion', 'time_stop': 211, 'use_sma': True, 'use_atr': True, 'use_adx': False, 'use_ema': True, 'use_spike': False, 'rsi_required': False, 'edge_k': 0.38630903059603294, 'edge_cap': 0.6221217622869919, 'bull_strategy': 'breakout', 'bull_bb_std_mult': 0.8464776615310609, 'bull_rsi_os': 43, 'bull_rsi_ob': 62, 'bull_adx_thresh': 24.194931742776813, 'bull_atr_min_pct': 0.019912388690670763, 'bull_atr_max_pct': 0.09778952585605037, 'bull_tp_mult': 2.0277582616768957, 'bull_tsl_mult': 0.12546402095334913, 'bull_time_stop': 44, 'bull_use_sma': True, 'bull_use_ema': True, 'bull_use_atr': True, 'bull_use_adx': True, 'bull_use_spike': True, 'bull_rsi_required': True, 'bear_strategy': 'mean_reversion', 'bear_bb_std_mult': 2.493253740643592, 'bear_rsi_os': 36, 'bear_rsi_ob': 84, 'bear_adx_thresh': 29.84701966565673, 'bear_atr_min_pct': 0.020117458953985867, 'bear_atr_max_pct': 0.07914570818265809, 'bear_tp_mult': 2.781474792810679, 'bear_tsl_mult': 0.29420468843537, 'bear_time_stop': 260, 'bear_use_sma': False, 'bear_use_ema': False, 'bear_use_atr': True, 'bear_use_adx': True, 'bear_use_spike': True, 'bear_rsi_required': True, 'sideways_strategy': 'breakout', 'sideways_bb_std_mult': 1.122731862912637, 'sideways_rsi_os': 37, 'sideways_rsi_ob': 63, 'sideways_adx_thresh': 24.448504543121548, 'sideways_atr_min_pct': 6.635620842892088e-05, 'sideways_atr_max_pct': 0.11500858766566713, 'sideways_tp_mult': 2.9798157003150716, 'sideways_tsl_mult': 0.9343485275643774, 'sideways_time_stop': 66, 'sideways_use_sma': True, 'sideways_use_ema': True, 'sideways_use_atr': False, 'sideways_use_adx': True, 'sideways_use_spike': True, 'sideways_rsi_required': True}.
[I 2025-08-30 16:06:54,348] Trial 650 finished with values: [-0.019684372147164453, 0.019619423389677995] and parameters: {'p_sma': 49, 'p_std': 54, 'p_atr': 24, 'p_adx': 11, 'rsi_period': 81, 'ema1': 23, 'ema2': 30, 'slip_atr_k': 0.08357906378209089, 'slip_spread_k': 0.18323395478112753, 'spread_hl_frac': 0.023046945867661938, 'bb_std_mult': 2.241830677544523, 'rsi_os': 37, 'rsi_ob': 81, 'vol_spike': 0.14595077453522903, 'adx_thresh': 15.833019920169964, 'atr_min_pct': 0.01614712380887997, 'atr_max_pct': 0.06602193453951404, 'tp_mult': 1.657545084181529, 'tsl_mult': 0.19185159123693898, 'strategy': 'mean_reversion', 'time_stop': 222, 'use_sma': True, 'use_atr': True, 'use_adx': False, 'use_ema': False, 'use_spike': False, 'rsi_required': False, 'edge_k': 0.44643646667871895, 'edge_cap': 0.6348946192416829, 'bull_strategy': 'breakout', 'bull_bb_std_mult': 0.6297343718874533, 'bull_rsi_os': 42, 'bull_rsi_ob': 63, 'bull_adx_thresh': 24.373721289750286, 'bull_atr_min_pct': 0.019086715286375656, 'bull_atr_max_pct': 0.09612754050223972, 'bull_tp_mult': 1.982157256833947, 'bull_tsl_mult': 0.08132687521798697, 'bull_time_stop': 16, 'bull_use_sma': True, 'bull_use_ema': True, 'bull_use_atr': True, 'bull_use_adx': True, 'bull_use_spike': True, 'bull_rsi_required': True, 'bear_strategy': 'breakout', 'bear_bb_std_mult': 2.603147137804436, 'bear_rsi_os': 34, 'bear_rsi_ob': 85, 'bear_adx_thresh': 30.745693626127345, 'bear_atr_min_pct': 0.019708230826730736, 'bear_atr_max_pct': 0.08167041195943188, 'bear_tp_mult': 2.824418022362294, 'bear_tsl_mult': 0.37432871390689, 'bear_time_stop': 260, 'bear_use_sma': False, 'bear_use_ema': False, 'bear_use_atr': False, 'bear_use_adx': True, 'bear_use_spike': True, 'bear_rsi_required': False, 'sideways_strategy': 'mean_reversion', 'sideways_bb_std_mult': 1.0627893290078119, 'sideways_rsi_os': 38, 'sideways_rsi_ob': 63, 'sideways_adx_thresh': 24.2647581808267, 'sideways_atr_min_pct': 0.000358439312301392, 'sideways_atr_max_pct': 0.11012464111192483, 'sideways_tp_mult': 2.95613815627148, 'sideways_tsl_mult': 0.8981781981437958, 'sideways_time_stop': 60, 'sideways_use_sma': True, 'sideways_use_ema': False, 'sideways_use_atr': False, 'sideways_use_adx': True, 'sideways_use_spike': True, 'sideways_rsi_required': True}.
[I 2025-08-30 16:06:55,464] Trial 653 finished with values: [-1000000000.0, 1000000000.0] and parameters: {'p_sma': 7, 'p_std': 54, 'p_atr': 25, 'p_adx': 11, 'rsi_period': 81, 'ema1': 22, 'ema2': 30, 'slip_atr_k': 0.07764123254242702, 'slip_spread_k': 0.16224813871657115, 'spread_hl_frac': 0.021930937645655003, 'bb_std_mult': 2.5533078836294174, 'rsi_os': 38, 'rsi_ob': 76, 'vol_spike': 0.15370484565921255, 'adx_thresh': 16.079496153269112, 'atr_min_pct': 0.01608816749741705, 'atr_max_pct': 0.07165362109170242, 'tp_mult': 1.6878562573008837, 'tsl_mult': 0.18620922489140873, 'strategy': 'mean_reversion', 'time_stop': 213, 'use_sma': True, 'use_atr': True, 'use_adx': False, 'use_ema': True, 'use_spike': False, 'rsi_required': False, 'edge_k': 0.38425297867319713, 'edge_cap': 0.6205405349432488, 'bull_strategy': 'breakout', 'bull_bb_std_mult': 0.972859378507322, 'bull_rsi_os': 43, 'bull_rsi_ob': 62, 'bull_adx_thresh': 24.162904702324003, 'bull_atr_min_pct': 0.01942876763494013, 'bull_atr_max_pct': 0.09730576696620613, 'bull_tp_mult': 1.9668275204188004, 'bull_tsl_mult': 0.1339396253335881, 'bull_time_stop': 40, 'bull_use_sma': True, 'bull_use_ema': True, 'bull_use_atr': True, 'bull_use_adx': True, 'bull_use_spike': True, 'bull_rsi_required': True, 'bear_strategy': 'mean_reversion', 'bear_bb_std_mult': 2.5010737010919852, 'bear_rsi_os': 36, 'bear_rsi_ob': 84, 'bear_adx_thresh': 29.929664471221653, 'bear_atr_min_pct': 0.020228425864349014, 'bear_atr_max_pct': 0.07911293869107087, 'bear_tp_mult': 2.7822801306533256, 'bear_tsl_mult': 0.3399004573874907, 'bear_time_stop': 262, 'bear_use_sma': False, 'bear_use_ema': False, 'bear_use_atr': True, 'bear_use_adx': True, 'bear_use_spike': True, 'bear_rsi_required': True, 'sideways_strategy': 'breakout', 'sideways_bb_std_mult': 1.0024515455814424, 'sideways_rsi_os': 37, 'sideways_rsi_ob': 64, 'sideways_adx_thresh': 24.310243494353667, 'sideways_atr_min_pct': 0.010644026052890599, 'sideways_atr_max_pct': 0.10965813125920781, 'sideways_tp_mult': 2.990541722639666, 'sideways_tsl_mult': 0.9141451985130038, 'sideways_time_stop': 66, 'sideways_use_sma': True, 'sideways_use_ema': True, 'sideways_use_atr': False, 'sideways_use_adx': True, 'sideways_use_spike': True, 'sideways_rsi_required': True}.
[I 2025-08-30 16:06:57,481] Trial 654 finished with values: [-1000000000.0, 1000000000.0] and parameters: {'p_sma': 7, 'p_std': 54, 'p_atr': 27, 'p_adx': 11, 'rsi_period': 80, 'ema1': 24, 'ema2': 29, 'slip_atr_k': 0.07744516047238945, 'slip_spread_k': 0.19872651305258565, 'spread_hl_frac': 0.021929010313167623, 'bb_std_mult': 2.2404607785663178, 'rsi_os': 40, 'rsi_ob': 76, 'vol_spike': 0.15404616923972822, 'adx_thresh': 16.43075722853456, 'atr_min_pct': 0.01602275357500594, 'atr_max_pct': 0.07131547192975345, 'tp_mult': 1.6737011506347637, 'tsl_mult': 0.1947985898269641, 'strategy': 'mean_reversion', 'time_stop': 229, 'use_sma': True, 'use_atr': True, 'use_adx': True, 'use_ema': True, 'use_spike': True, 'rsi_required': False, 'edge_k': 0.3840642824764121, 'edge_cap': 0.6195686781461863, 'bull_strategy': 'breakout', 'bull_bb_std_mult': 0.8217760256455685, 'bull_rsi_os': 41, 'bull_rsi_ob': 60, 'bull_adx_thresh': 24.330750658674138, 'bull_atr_min_pct': 0.01949428316720958, 'bull_atr_max_pct': 0.08772848293045145, 'bull_tp_mult': 1.9687640337765164, 'bull_tsl_mult': 0.12374226564970557, 'bull_time_stop': 59, 'bull_use_sma': True, 'bull_use_ema': True, 'bull_use_atr': True, 'bull_use_adx': True, 'bull_use_spike': True, 'bull_rsi_required': True, 'bear_strategy': 'mean_reversion', 'bear_bb_std_mult': 2.660596041458393, 'bear_rsi_os': 34, 'bear_rsi_ob': 84, 'bear_adx_thresh': 30.151328484794202, 'bear_atr_min_pct': 0.020064203465170405, 'bear_atr_max_pct': 0.0788007058460327, 'bear_tp_mult': 2.7706183816929646, 'bear_tsl_mult': 0.34785932809038256, 'bear_time_stop': 258, 'bear_use_sma': False, 'bear_use_ema': False, 'bear_use_atr': True, 'bear_use_adx': True, 'bear_use_spike': True, 'bear_rsi_required': True, 'sideways_strategy': 'breakout', 'sideways_bb_std_mult': 0.9879850402961683, 'sideways_rsi_os': 39, 'sideways_rsi_ob': 63, 'sideways_adx_thresh': 24.47569332126257, 'sideways_atr_min_pct': 0.0011169404316831526, 'sideways_atr_max_pct': 0.10738297172738451, 'sideways_tp_mult': 2.8813127238236316, 'sideways_tsl_mult': 0.933266187219866, 'sideways_time_stop': 69, 'sideways_use_sma': True, 'sideways_use_ema': True, 'sideways_use_atr': False, 'sideways_use_adx': True, 'sideways_use_spike': True, 'sideways_rsi_required': True}.
[I 2025-08-30 16:06:58,419] Trial 655 finished with values: [-1000000000.0, 1000000000.0] and parameters: {'p_sma': 50, 'p_std': 54, 'p_atr': 26, 'p_adx': 11, 'rsi_period': 80, 'ema1': 24, 'ema2': 31, 'slip_atr_k': 0.07697915633857658, 'slip_spread_k': 0.1793944525514511, 'spread_hl_frac': 0.023743206472161247, 'bb_std_mult': 2.237071145545353, 'rsi_os': 42, 'rsi_ob': 63, 'vol_spike': 0.15722720268999754, 'adx_thresh': 14.889131420459554, 'atr_min_pct': 0.016039879848821152, 'atr_max_pct': 0.010139095397097925, 'tp_mult': 1.6925341098800688, 'tsl_mult': 0.19210090225497828, 'strategy': 'mean_reversion', 'time_stop': 228, 'use_sma': True, 'use_atr': True, 'use_adx': True, 'use_ema': True, 'use_spike': True, 'rsi_required': False, 'edge_k': 0.37106779483884433, 'edge_cap': 0.6132874397557325, 'bull_strategy': 'breakout', 'bull_bb_std_mult': 0.6190578274635211, 'bull_rsi_os': 41, 'bull_rsi_ob': 60, 'bull_adx_thresh': 25.228899943355245, 'bull_atr_min_pct': 0.0193790377136481, 'bull_atr_max_pct': 0.08921834548199527, 'bull_tp_mult': 2.018543633043398, 'bull_tsl_mult': 0.1363008278910679, 'bull_time_stop': 37, 'bull_use_sma': True, 'bull_use_ema': True, 'bull_use_atr': True, 'bull_use_adx': True, 'bull_use_spike': True, 'bull_rsi_required': True, 'bear_strategy': 'mean_reversion', 'bear_bb_std_mult': 2.6743302512406117, 'bear_rsi_os': 34, 'bear_rsi_ob': 84, 'bear_adx_thresh': 31.342123706488266, 'bear_atr_min_pct': 0.0191664963119929, 'bear_atr_max_pct': 0.07863857382130415, 'bear_tp_mult': 2.859148801783938, 'bear_tsl_mult': 0.3439443489521524, 'bear_time_stop': 266, 'bear_use_sma': False, 'bear_use_ema': False, 'bear_use_atr': True, 'bear_use_adx': True, 'bear_use_spike': True, 'bear_rsi_required': True, 'sideways_strategy': 'breakout', 'sideways_bb_std_mult': 0.9738614812895457, 'sideways_rsi_os': 39, 'sideways_rsi_ob': 62, 'sideways_adx_thresh': 24.307116001086996, 'sideways_atr_min_pct': 0.001089363589544304, 'sideways_atr_max_pct': 0.10736049691124283, 'sideways_tp_mult': 2.8803920875370648, 'sideways_tsl_mult': 0.9015026924990518, 'sideways_time_stop': 71, 'sideways_use_sma': True, 'sideways_use_ema': True, 'sideways_use_atr': False, 'sideways_use_adx': True, 'sideways_use_spike': True, 'sideways_rsi_required': True}.
[I 2025-08-30 16:07:40,481] Trial 659 finished with values: [-1000000000.0, 1000000000.0] and parameters: {'p_sma': 5, 'p_std': 55, 'p_atr': 23, 'p_adx': 10, 'rsi_period': 79, 'ema1': 21, 'ema2': 31, 'slip_atr_k': 0.07415670210602876, 'slip_spread_k': 0.16722939040853824, 'spread_hl_frac': 0.02387373418423426, 'bb_std_mult': 2.354857471358505, 'rsi_os': 39, 'rsi_ob': 60, 'vol_spike': 0.15872674114509672, 'adx_thresh': 15.174992150283854, 'atr_min_pct': 0.01515385043204962, 'atr_max_pct': 0.07392610966134924, 'tp_mult': 1.354359708356422, 'tsl_mult': 0.27273208848703917, 'strategy': 'mean_reversion', 'time_stop': 207, 'use_sma': True, 'use_atr': False, 'use_adx': False, 'use_ema': True, 'use_spike': True, 'rsi_required': False, 'edge_k': 0.5208440199566938, 'edge_cap': 0.6135879702604545, 'bull_strategy': 'breakout', 'bull_bb_std_mult': 1.1877151130062147, 'bull_rsi_os': 41, 'bull_rsi_ob': 65, 'bull_adx_thresh': 23.908651385289975, 'bull_atr_min_pct': 0.01990183361204405, 'bull_atr_max_pct': 0.09190007841658628, 'bull_tp_mult': 2.020630111061023, 'bull_tsl_mult': 0.10118753269242732, 'bull_time_stop': 26, 'bull_use_sma': True, 'bull_use_ema': True, 'bull_use_atr': True, 'bull_use_adx': True, 'bull_use_spike': True, 'bull_rsi_required': True, 'bear_strategy': 'mean_reversion', 'bear_bb_std_mult': 2.424000440194903, 'bear_rsi_os': 33, 'bear_rsi_ob': 87, 'bear_adx_thresh': 30.12935506533944, 'bear_atr_min_pct': 0.020771571140574926, 'bear_atr_max_pct': 0.07665439469707094, 'bear_tp_mult': 2.8455850828723186, 'bear_tsl_mult': 0.43529657525872273, 'bear_time_stop': 281, 'bear_use_sma': False, 'bear_use_ema': False, 'bear_use_atr': True, 'bear_use_adx': True, 'bear_use_spike': True, 'bear_rsi_required': True, 'sideways_strategy': 'breakout', 'sideways_bb_std_mult': 1.1602676376927568, 'sideways_rsi_os': 39, 'sideways_rsi_ob': 62, 'sideways_adx_thresh': 23.579229863878005, 'sideways_atr_min_pct': 0.027824960806111847, 'sideways_atr_max_pct': 0.11285599730235568, 'sideways_tp_mult': 2.926340812519898, 'sideways_tsl_mult': 0.9238139079909354, 'sideways_time_stop': 53, 'sideways_use_sma': False, 'sideways_use_ema': True, 'sideways_use_atr': False, 'sideways_use_adx': True, 'sideways_use_spike': False, 'sideways_rsi_required': True}.
