[I 2025-08-30 16:29:46,108] Trial 776 finished with values: [-1000000000.0, 1000000000.0] and parameters: {'p_sma': 6, 'p_std': 36, 'p_atr': 26, 'p_adx': 12, 'rsi_period': 79, 'ema1': 22, 'ema2': 47, 'slip_atr_k': 0.07044957159774591, 'slip_spread_k': 0.19635674241140372, 'spread_hl_frac': 0.010435762494782855, 'bb_std_mult': 2.6050443669847114, 'rsi_os': 44, 'rsi_ob': 74, 'vol_spike': 0.15797489965790984, 'adx_thresh': 30.568809946514158, 'atr_min_pct': 0.01799375519479599, 'atr_max_pct': 0.07042303964560705, 'tp_mult': 2.9655269397357844, 'tsl_mult': 0.2921612228448135, 'strategy': 'mean_reversion', 'time_stop': 204, 'use_sma': True, 'use_atr': True, 'use_adx': True, 'use_ema': False, 'use_spike': True, 'rsi_required': False, 'edge_k': 0.3544230335317291, 'edge_cap': 0.569187290633231, 'bull_strategy': 'breakout', 'bull_bb_std_mult': 1.0489206720483026, 'bull_rsi_os': 38, 'bull_rsi_ob': 68, 'bull_adx_thresh': 16.40472727369068, 'bull_atr_min_pct': 0.026636708911803177, 'bull_atr_max_pct': 0.09721674440078465, 'bull_tp_mult': 2.0977489367138316, 'bull_tsl_mult': 0.049625024450622744, 'bull_time_stop': 40, 'bull_use_sma': True, 'bull_use_ema': True, 'bull_use_atr': True, 'bull_use_adx': True, 'bull_use_spike': True, 'bull_rsi_required': True, 'bear_strategy': 'breakout', 'bear_bb_std_mult': 2.2900975819604747, 'bear_rsi_os': 55, 'bear_rsi_ob': 90, 'bear_adx_thresh': 11.789929597785493, 'bear_atr_min_pct': 0.021417021310106227, 'bear_atr_max_pct': 0.08012816072953632, 'bear_tp_mult': 2.700802647908847, 'bear_tsl_mult': 0.17350990140458017, 'bear_time_stop': 269, 'bear_use_sma': False, 'bear_use_ema': False, 'bear_use_atr': True, 'bear_use_adx': True, 'bear_use_spike': True, 'bear_rsi_required': True, 'sideways_strategy': 'breakout', 'sideways_bb_std_mult': 1.0023750208325997, 'sideways_rsi_os': 18, 'sideways_rsi_ob': 93, 'sideways_adx_thresh': 5.6618505343177965, 'sideways_atr_min_pct': 0.02886454809064458, 'sideways_atr_max_pct': 0.05433895246313817, 'sideways_tp_mult': 2.9283885089309316, 'sideways_tsl_mult': 0.9573137123762422, 'sideways_time_stop': 74, 'sideways_use_sma': True, 'sideways_use_ema': True, 'sideways_use_atr': False, 'sideways_use_adx': True, 'sideways_use_spike': False, 'sideways_rsi_required': True}.
[I 2025-08-30 16:29:46,130] Trial 775 finished with values: [-1000000000.0, 0.21473622985873383] and parameters: {'p_sma': 50, 'p_std': 55, 'p_atr': 26, 'p_adx': 17, 'rsi_period': 8, 'ema1': 23, 'ema2': 31, 'slip_atr_k': 0.06431828848815128, 'slip_spread_k': 0.19319584544112442, 'spread_hl_frac': 0.022064319882185997, 'bb_std_mult': 2.309829372100408, 'rsi_os': 37, 'rsi_ob': 63, 'vol_spike': 0.18144613231636633, 'adx_thresh': 9.734441796122393, 'atr_min_pct': 0.024541766879261698, 'atr_max_pct': 0.08266580072122853, 'tp_mult': 1.725100353034539, 'tsl_mult': 0.6128398143919992, 'strategy': 'mean_reversion', 'time_stop': 198, 'use_sma': True, 'use_atr': True, 'use_adx': True, 'use_ema': False, 'use_spike': True, 'rsi_required': False, 'edge_k': 1.8983736751792204, 'edge_cap': 0.5668747454517963, 'bull_strategy': 'breakout', 'bull_bb_std_mult': 0.6591974179925005, 'bull_rsi_os': 38, 'bull_rsi_ob': 68, 'bull_adx_thresh': 34.988965567534095, 'bull_atr_min_pct': 0.02659858975075839, 'bull_atr_max_pct': 0.09699059681910316, 'bull_tp_mult': 1.5656630446842124, 'bull_tsl_mult': 0.09424962211582587, 'bull_time_stop': 42, 'bull_use_sma': True, 'bull_use_ema': True, 'bull_use_atr': True, 'bull_use_adx': True, 'bull_use_spike': True, 'bull_rsi_required': True, 'bear_strategy': 'mean_reversion', 'bear_bb_std_mult': 2.2710802206765064, 'bear_rsi_os': 33, 'bear_rsi_ob': 80, 'bear_adx_thresh': 8.548340646986226, 'bear_atr_min_pct': 0.009149271941398317, 'bear_atr_max_pct': 0.0780543139947876, 'bear_tp_mult': 2.69536768056285, 'bear_tsl_mult': 0.4313994261419173, 'bear_time_stop': 269, 'bear_use_sma': False, 'bear_use_ema': False, 'bear_use_atr': True, 'bear_use_adx': True, 'bear_use_spike': True, 'bear_rsi_required': True, 'sideways_strategy': 'breakout', 'sideways_bb_std_mult': 1.2571310152896662, 'sideways_rsi_os': 38, 'sideways_rsi_ob': 49, 'sideways_adx_thresh': 14.561788662216127, 'sideways_atr_min_pct': 4.182807692728165e-07, 'sideways_atr_max_pct': 0.10297495822487204, 'sideways_tp_mult': 2.9966391307119515, 'sideways_tsl_mult': 0.9045427793768875, 'sideways_time_stop': 201, 'sideways_use_sma': True, 'sideways_use_ema': True, 'sideways_use_atr': False, 'sideways_use_adx': True, 'sideways_use_spike': False, 'sideways_rsi_required': True}.
[I 2025-08-30 16:29:46,131] Trial 774 finished with values: [-1000000000.0, 1000000000.0] and parameters: {'p_sma': 58, 'p_std': 54, 'p_atr': 26, 'p_adx': 12, 'rsi_period': 79, 'ema1': 23, 'ema2': 31, 'slip_atr_k': 0.06587582907000927, 'slip_spread_k': 0.7752767891409, 'spread_hl_frac': 0.0314849648682386, 'bb_std_mult': 2.307130540751105, 'rsi_os': 38, 'rsi_ob': 51, 'vol_spike': 0.08770959363465328, 'adx_thresh': 18.098275596393282, 'atr_min_pct': 0.027855495707634865, 'atr_max_pct': 0.07748355716911391, 'tp_mult': 1.7265390653423245, 'tsl_mult': 0.29344333668459516, 'strategy': 'mean_reversion', 'time_stop': 200, 'use_sma': True, 'use_atr': True, 'use_adx': True, 'use_ema': True, 'use_spike': True, 'rsi_required': False, 'edge_k': 0.4205348462744784, 'edge_cap': 0.6059214288045365, 'bull_strategy': 'breakout', 'bull_bb_std_mult': 1.0223628341677744, 'bull_rsi_os': 45, 'bull_rsi_ob': 59, 'bull_adx_thresh': 23.51802711738394, 'bull_atr_min_pct': 0.02039698728087648, 'bull_atr_max_pct': 0.14622010357764276, 'bull_tp_mult': 1.5553376250918363, 'bull_tsl_mult': 0.16207968594939123, 'bull_time_stop': 51, 'bull_use_sma': True, 'bull_use_ema': True, 'bull_use_atr': True, 'bull_use_adx': True, 'bull_use_spike': True, 'bull_rsi_required': True, 'bear_strategy': 'breakout', 'bear_bb_std_mult': 2.488254715519188, 'bear_rsi_os': 55, 'bear_rsi_ob': 58, 'bear_adx_thresh': 28.84017787982959, 'bear_atr_min_pct': 0.008824095931163185, 'bear_atr_max_pct': 0.05933267453377482, 'bear_tp_mult': 2.6981943546401976, 'bear_tsl_mult': 0.4330396690760954, 'bear_time_stop': 268, 'bear_use_sma': False, 'bear_use_ema': False, 'bear_use_atr': True, 'bear_use_adx': True, 'bear_use_spike': True, 'bear_rsi_required': True, 'sideways_strategy': 'breakout', 'sideways_bb_std_mult': 3.304003928905125, 'sideways_rsi_os': 38, 'sideways_rsi_ob': 62, 'sideways_adx_thresh': 23.165419676912947, 'sideways_atr_min_pct': 0.027300480389814856, 'sideways_atr_max_pct': 0.06364009752086086, 'sideways_tp_mult': 2.9946840309061122, 'sideways_tsl_mult': 0.7906735031115365, 'sideways_time_stop': 201, 'sideways_use_sma': True, 'sideways_use_ema': True, 'sideways_use_atr': False, 'sideways_use_adx': True, 'sideways_use_spike': True, 'sideways_rsi_required': True}.
[I 2025-08-30 16:30:33,577] Trial 778 finished with values: [-1000000000.0, 1000000000.0] and parameters: {'p_sma': 5, 'p_std': 44, 'p_atr': 27, 'p_adx': 15, 'rsi_period': 81, 'ema1': 23, 'ema2': 59, 'slip_atr_k': 0.12181771624221052, 'slip_spread_k': 0.12982331261402935, 'spread_hl_frac': 0.03431777202595554, 'bb_std_mult': 2.3767223233597146, 'rsi_os': 39, 'rsi_ob': 61, 'vol_spike': 0.14945265672815988, 'adx_thresh': 15.462081880571915, 'atr_min_pct': 0.01588693220891936, 'atr_max_pct': 0.06474529164334669, 'tp_mult': 1.7966836287709764, 'tsl_mult': 0.5719125791717996, 'strategy': 'mean_reversion', 'time_stop': 184, 'use_sma': True, 'use_atr': True, 'use_adx': False, 'use_ema': True, 'use_spike': True, 'rsi_required': False, 'edge_k': 1.5024866482609123, 'edge_cap': 0.14287968079457386, 'bull_strategy': 'breakout', 'bull_bb_std_mult': 0.8912253774202162, 'bull_rsi_os': 39, 'bull_rsi_ob': 58, 'bull_adx_thresh': 10.118463190171793, 'bull_atr_min_pct': 0.018325442752107936, 'bull_atr_max_pct': 0.13971292806362587, 'bull_tp_mult': 2.5740016877216374, 'bull_tsl_mult': 0.1049309256864912, 'bull_time_stop': 27, 'bull_use_sma': True, 'bull_use_ema': True, 'bull_use_atr': True, 'bull_use_adx': True, 'bull_use_spike': True, 'bull_rsi_required': True, 'bear_strategy': 'mean_reversion', 'bear_bb_std_mult': 2.599746167727728, 'bear_rsi_os': 33, 'bear_rsi_ob': 69, 'bear_adx_thresh': 31.566754468309014, 'bear_atr_min_pct': 0.021973897753342273, 'bear_atr_max_pct': 0.07058712430089081, 'bear_tp_mult': 2.93401781657948, 'bear_tsl_mult': 0.3480462894806683, 'bear_time_stop': 250, 'bear_use_sma': False, 'bear_use_ema': False, 'bear_use_atr': True, 'bear_use_adx': True, 'bear_use_spike': True, 'bear_rsi_required': True, 'sideways_strategy': 'breakout', 'sideways_bb_std_mult': 0.6068428475938048, 'sideways_rsi_os': 8, 'sideways_rsi_ob': 83, 'sideways_adx_thresh': 25.577632657924177, 'sideways_atr_min_pct': 0.021460721410527187, 'sideways_atr_max_pct': 0.11535537202792108, 'sideways_tp_mult': 2.906705161162478, 'sideways_tsl_mult': 0.1885871195988862, 'sideways_time_stop': 141, 'sideways_use_sma': False, 'sideways_use_ema': True, 'sideways_use_atr': False, 'sideways_use_adx': True, 'sideways_use_spike': True, 'sideways_rsi_required': True}.
[I 2025-08-30 16:30:34,228] Trial 777 finished with values: [-1000000000.0, 1000000000.0] and parameters: {'p_sma': 58, 'p_std': 55, 'p_atr': 27, 'p_adx': 12, 'rsi_period': 81, 'ema1': 22, 'ema2': 28, 'slip_atr_k': 0.1980139741940425, 'slip_spread_k': 0.8760011674305983, 'spread_hl_frac': 0.022128668925250276, 'bb_std_mult': 2.3554636732632868, 'rsi_os': 45, 'rsi_ob': 74, 'vol_spike': 0.15833669693179245, 'adx_thresh': 8.625407260168721, 'atr_min_pct': 0.018087986064598688, 'atr_max_pct': 0.07158745649053154, 'tp_mult': 1.758677010402051, 'tsl_mult': 0.6175698827685339, 'strategy': 'mean_reversion', 'time_stop': 197, 'use_sma': True, 'use_atr': True, 'use_adx': True, 'use_ema': False, 'use_spike': True, 'rsi_required': False, 'edge_k': 0.3655759835785579, 'edge_cap': 0.5662834665843448, 'bull_strategy': 'breakout', 'bull_bb_std_mult': 0.644847844162315, 'bull_rsi_os': 38, 'bull_rsi_ob': 67, 'bull_adx_thresh': 10.374314720746606, 'bull_atr_min_pct': 0.01651204288283693, 'bull_atr_max_pct': 0.14003628485372582, 'bull_tp_mult': 2.0989782210845744, 'bull_tsl_mult': 0.15816413410662505, 'bull_time_stop': 25, 'bull_use_sma': True, 'bull_use_ema': True, 'bull_use_atr': True, 'bull_use_adx': True, 'bull_use_spike': True, 'bull_rsi_required': True, 'bear_strategy': 'mean_reversion', 'bear_bb_std_mult': 2.634730407102294, 'bear_rsi_os': 33, 'bear_rsi_ob': 63, 'bear_adx_thresh': 28.932051143129854, 'bear_atr_min_pct': 0.021640256737034253, 'bear_atr_max_pct': 0.14690160131170343, 'bear_tp_mult': 2.690534764943967, 'bear_tsl_mult': 0.35153213253957794, 'bear_time_stop': 266, 'bear_use_sma': False, 'bear_use_ema': False, 'bear_use_atr': True, 'bear_use_adx': True, 'bear_use_spike': True, 'bear_rsi_required': True, 'sideways_strategy': 'breakout', 'sideways_bb_std_mult': 0.9923087153154357, 'sideways_rsi_os': 38, 'sideways_rsi_ob': 62, 'sideways_adx_thresh': 25.463527000075555, 'sideways_atr_min_pct': 0.01032330203880208, 'sideways_atr_max_pct': 0.055928432446043244, 'sideways_tp_mult': 2.900060461669209, 'sideways_tsl_mult': 0.9641363760072804, 'sideways_time_stop': 69, 'sideways_use_sma': True, 'sideways_use_ema': True, 'sideways_use_atr': False, 'sideways_use_adx': True, 'sideways_use_spike': False, 'sideways_rsi_required': True}.
[I 2025-08-30 16:30:34,736] Trial 779 finished with values: [-1000000000.0, 1000000000.0] and parameters: {'p_sma': 5, 'p_std': 48, 'p_atr': 27, 'p_adx': 11, 'rsi_period': 83, 'ema1': 23, 'ema2': 28, 'slip_atr_k': 0.08189676498029606, 'slip_spread_k': 0.13346671989255118, 'spread_hl_frac': 0.02438107600600355, 'bb_std_mult': 2.367142313615127, 'rsi_os': 39, 'rsi_ob': 73, 'vol_spike': 0.14765163247532445, 'adx_thresh': 15.67839705848375, 'atr_min_pct': 0.009093071579424322, 'atr_max_pct': 0.08662647886451308, 'tp_mult': 1.6680802376508779, 'tsl_mult': 0.5646939665550607, 'strategy': 'mean_reversion', 'time_stop': 219, 'use_sma': True, 'use_atr': True, 'use_adx': False, 'use_ema': True, 'use_spike': True, 'rsi_required': False, 'edge_k': 0.4812044127082259, 'edge_cap': 0.8144205065118585, 'bull_strategy': 'breakout', 'bull_bb_std_mult': 0.7584630590608129, 'bull_rsi_os': 39, 'bull_rsi_ob': 58, 'bull_adx_thresh': 10.030369353712821, 'bull_atr_min_pct': 0.01746286685453081, 'bull_atr_max_pct': 0.0926796021272045, 'bull_tp_mult': 2.5865754990050505, 'bull_tsl_mult': 0.10269591705353034, 'bull_time_stop': 25, 'bull_use_sma': True, 'bull_use_ema': True, 'bull_use_atr': True, 'bull_use_adx': True, 'bull_use_spike': True, 'bull_rsi_required': True, 'bear_strategy': 'mean_reversion', 'bear_bb_std_mult': 2.632484397292984, 'bear_rsi_os': 32, 'bear_rsi_ob': 64, 'bear_adx_thresh': 34.82317606606155, 'bear_atr_min_pct': 0.02185947924518191, 'bear_atr_max_pct': 0.07061222693903701, 'bear_tp_mult': 2.825312941311249, 'bear_tsl_mult': 0.3538620710096526, 'bear_time_stop': 231, 'bear_use_sma': False, 'bear_use_ema': False, 'bear_use_atr': True, 'bear_use_adx': True, 'bear_use_spike': True, 'bear_rsi_required': True, 'sideways_strategy': 'breakout', 'sideways_bb_std_mult': 1.2353247886571421, 'sideways_rsi_os': 53, 'sideways_rsi_ob': 83, 'sideways_adx_thresh': 25.36807050982266, 'sideways_atr_min_pct': 0.011810614836954227, 'sideways_atr_max_pct': 0.11331267256351749, 'sideways_tp_mult': 1.3000382380849773, 'sideways_tsl_mult': 0.963530118047203, 'sideways_time_stop': 95, 'sideways_use_sma': False, 'sideways_use_ema': True, 'sideways_use_atr': False, 'sideways_use_adx': True, 'sideways_use_spike': True, 'sideways_rsi_required': True}.
[I 2025-08-30 16:30:35,213] Trial 780 finished with values: [-0.021014431144321666, 0.020917584016112743] and parameters: {'p_sma': 18, 'p_std': 56, 'p_atr': 27, 'p_adx': 11, 'rsi_period': 81, 'ema1': 23, 'ema2': 59, 'slip_atr_k': 0.08057196227236504, 'slip_spread_k': 0.14361968751806128, 'spread_hl_frac': 0.025942026440523056, 'bb_std_mult': 2.3851202700741894, 'rsi_os': 39, 'rsi_ob': 73, 'vol_spike': 0.060619753157512085, 'adx_thresh': 19.05191031299887, 'atr_min_pct': 0.017147376914627317, 'atr_max_pct': 0.07893464854298167, 'tp_mult': 1.670103152152457, 'tsl_mult': 0.5660795488637158, 'strategy': 'mean_reversion', 'time_stop': 219, 'use_sma': True, 'use_atr': True, 'use_adx': False, 'use_ema': True, 'use_spike': True, 'rsi_required': False, 'edge_k': 1.4693127900996874, 'edge_cap': 0.28109167450470157, 'bull_strategy': 'breakout', 'bull_bb_std_mult': 0.8915571857825297, 'bull_rsi_os': 39, 'bull_rsi_ob': 61, 'bull_adx_thresh': 24.207307820667808, 'bull_atr_min_pct': 0.01839238091124296, 'bull_atr_max_pct': 0.08594456545678024, 'bull_tp_mult': 2.103581900156374, 'bull_tsl_mult': 0.18846367854261367, 'bull_time_stop': 12, 'bull_use_sma': True, 'bull_use_ema': True, 'bull_use_atr': True, 'bull_use_adx': True, 'bull_use_spike': True, 'bull_rsi_required': True, 'bear_strategy': 'mean_reversion', 'bear_bb_std_mult': 2.6277017582516193, 'bear_rsi_os': 32, 'bear_rsi_ob': 95, 'bear_adx_thresh': 31.46258249713088, 'bear_atr_min_pct': 0.021911932892748533, 'bear_atr_max_pct': 0.07131828982972152, 'bear_tp_mult': 2.823188514837105, 'bear_tsl_mult': 0.5689284626044471, 'bear_time_stop': 251, 'bear_use_sma': False, 'bear_use_ema': False, 'bear_use_atr': True, 'bear_use_adx': True, 'bear_use_spike': True, 'bear_rsi_required': True, 'sideways_strategy': 'breakout', 'sideways_bb_std_mult': 1.2221104862630918, 'sideways_rsi_os': 40, 'sideways_rsi_ob': 61, 'sideways_adx_thresh': 25.685213245763013, 'sideways_atr_min_pct': 0.0011216301011026152, 'sideways_atr_max_pct': 0.11349747304910868, 'sideways_tp_mult': 2.88038742733562, 'sideways_tsl_mult': 0.8712776237943312, 'sideways_time_stop': 120, 'sideways_use_sma': False, 'sideways_use_ema': True, 'sideways_use_atr': False, 'sideways_use_adx': True, 'sideways_use_spike': True, 'sideways_rsi_required': True}.
[I 2025-08-30 16:30:36,541] Trial 783 finished with values: [-1000000000.0, 1000000000.0] and parameters: {'p_sma': 7, 'p_std': 57, 'p_atr': 26, 'p_adx': 11, 'rsi_period': 74, 'ema1': 24, 'ema2': 32, 'slip_atr_k': 0.0879046851639438, 'slip_spread_k': 0.16195723189322891, 'spread_hl_frac': 0.026005687686212867, 'bb_std_mult': 2.2461002107214543, 'rsi_os': 54, 'rsi_ob': 47, 'vol_spike': 0.039126873021806494, 'adx_thresh': 14.22606513504461, 'atr_min_pct': 0.015106274452959203, 'atr_max_pct': 0.07883273079041112, 'tp_mult': 2.078072379702702, 'tsl_mult': 0.41112120300657373, 'strategy': 'mean_reversion', 'time_stop': 232, 'use_sma': True, 'use_atr': False, 'use_adx': False, 'use_ema': True, 'use_spike': True, 'rsi_required': False, 'edge_k': 0.5673252081500676, 'edge_cap': 0.26335645282266884, 'bull_strategy': 'breakout', 'bull_bb_std_mult': 0.8794332599196293, 'bull_rsi_os': 28, 'bull_rsi_ob': 62, 'bull_adx_thresh': 24.18700295722757, 'bull_atr_min_pct': 0.02052114689332109, 'bull_atr_max_pct': 0.08766179491754089, 'bull_tp_mult': 2.0094637025690725, 'bull_tsl_mult': 0.1841260581628754, 'bull_time_stop': 10, 'bull_use_sma': True, 'bull_use_ema': True, 'bull_use_atr': True, 'bull_use_adx': True, 'bull_use_spike': True, 'bull_rsi_required': True, 'bear_strategy': 'mean_reversion', 'bear_bb_std_mult': 1.8762363106514062, 'bear_rsi_os': 45, 'bear_rsi_ob': 93, 'bear_adx_thresh': 30.301471720475664, 'bear_atr_min_pct': 0.020404075150933818, 'bear_atr_max_pct': 0.07625943179354168, 'bear_tp_mult': 2.751550033375456, 'bear_tsl_mult': 0.5467058330029777, 'bear_time_stop': 14, 'bear_use_sma': False, 'bear_use_ema': False, 'bear_use_atr': False, 'bear_use_adx': True, 'bear_use_spike': True, 'bear_rsi_required': True, 'sideways_strategy': 'mean_reversion', 'sideways_bb_std_mult': 1.3394988589694625, 'sideways_rsi_os': 40, 'sideways_rsi_ob': 60, 'sideways_adx_thresh': 24.65545067597306, 'sideways_atr_min_pct': 0.0016249231160210126, 'sideways_atr_max_pct': 0.10736906386918672, 'sideways_tp_mult': 2.1309567715203346, 'sideways_tsl_mult': 0.660973514841865, 'sideways_time_stop': 78, 'sideways_use_sma': True, 'sideways_use_ema': True, 'sideways_use_atr': False, 'sideways_use_adx': True, 'sideways_use_spike': True, 'sideways_rsi_required': True}.
[I 2025-08-30 16:31:20,900] Trial 782 finished with values: [-1000000000.0, 1000000000.0] and parameters: {'p_sma': 7, 'p_std': 21, 'p_atr': 27, 'p_adx': 11, 'rsi_period': 74, 'ema1': 22, 'ema2': 58, 'slip_atr_k': 0.08291095429521028, 'slip_spread_k': 0.16318346088193544, 'spread_hl_frac': 0.024224800789203256, 'bb_std_mult': 3.0085946515742865, 'rsi_os': 37, 'rsi_ob': 73, 'vol_spike': 0.1737896714065738, 'adx_thresh': 14.205844655183151, 'atr_min_pct': 0.015060291920054392, 'atr_max_pct': 0.044930583328300314, 'tp_mult': 1.8569267173959285, 'tsl_mult': 0.2283589423470445, 'strategy': 'mean_reversion', 'time_stop': 249, 'use_sma': True, 'use_atr': True, 'use_adx': False, 'use_ema': True, 'use_spike': True, 'rsi_required': False, 'edge_k': 0.5654365565896138, 'edge_cap': 0.2612318673386154, 'bull_strategy': 'breakout', 'bull_bb_std_mult': 0.7880857023360416, 'bull_rsi_os': 48, 'bull_rsi_ob': 64, 'bull_adx_thresh': 24.135058071999836, 'bull_atr_min_pct': 0.01761556611404838, 'bull_atr_max_pct': 0.08654367283381184, 'bull_tp_mult': 2.8746524357444208, 'bull_tsl_mult': 0.9631992219872985, 'bull_time_stop': 12, 'bull_use_sma': True, 'bull_use_ema': True, 'bull_use_atr': True, 'bull_use_adx': True, 'bull_use_spike': True, 'bull_rsi_required': True, 'bear_strategy': 'mean_reversion', 'bear_bb_std_mult': 2.5603101853490915, 'bear_rsi_os': 32, 'bear_rsi_ob': 91, 'bear_adx_thresh': 30.07002422365998, 'bear_atr_min_pct': 0.020532075766518512, 'bear_atr_max_pct': 0.07530656561764983, 'bear_tp_mult': 2.824668699640873, 'bear_tsl_mult': 0.45940623556257687, 'bear_time_stop': 293, 'bear_use_sma': False, 'bear_use_ema': False, 'bear_use_atr': False, 'bear_use_adx': True, 'bear_use_spike': True, 'bear_rsi_required': True, 'sideways_strategy': 'mean_reversion', 'sideways_bb_std_mult': 1.38342970591831, 'sideways_rsi_os': 40, 'sideways_rsi_ob': 60, 'sideways_adx_thresh': 8.610549742417325, 'sideways_atr_min_pct': 0.0015717211732251737, 'sideways_atr_max_pct': 0.10721508599995351, 'sideways_tp_mult': 1.4986828461807185, 'sideways_tsl_mult': 0.6610499234394497, 'sideways_time_stop': 95, 'sideways_use_sma': True, 'sideways_use_ema': True, 'sideways_use_atr': False, 'sideways_use_adx': True, 'sideways_use_spike': True, 'sideways_rsi_required': True}.
