[I 2025-08-30 14:32:47,061] Trial 99 finished with values: [-1000000000.0, 1000000000.0] and parameters: {'p_sma': 29, 'p_std': 20, 'p_atr': 12, 'p_adx': 8, 'rsi_period': 70, 'ema1': 26, 'ema2': 33, 'slip_atr_k': 0.061712610920266794, 'slip_spread_k': 0.22029627344434966, 'spread_hl_frac': 0.010959176548872407, 'bb_std_mult': 3.386025041671423, 'rsi_os': 33, 'rsi_ob': 59, 'vol_spike': 0.2633993271415254, 'adx_thresh': 24.0361570904956, 'atr_min_pct': 0.014686858387195967, 'atr_max_pct': 0.11173383954273536, 'tp_mult': 2.010181160725092, 'tsl_mult': 0.3666543789204803, 'strategy': 'mean_reversion', 'time_stop': 135, 'use_sma': True, 'use_atr': False, 'use_adx': False, 'use_ema': False, 'use_spike': False, 'rsi_required': False, 'edge_k': 1.5940704445764642, 'edge_cap': 0.5407885969494677, 'bull_strategy': 'mean_reversion', 'bull_bb_std_mult': 1.4534869741957626, 'bull_rsi_os': 21, 'bull_rsi_ob': 84, 'bull_adx_thresh': 15.170415520651236, 'bull_atr_min_pct': 0.012874838490093018, 'bull_atr_max_pct': 0.02449548540787919, 'bull_tp_mult': 1.5283821664888455, 'bull_tsl_mult': 0.32550779024229115, 'bull_time_stop': 12, 'bull_use_sma': False, 'bull_use_ema': False, 'bull_use_atr': False, 'bull_use_adx': True, 'bull_use_spike': False, 'bull_rsi_required': True, 'bear_strategy': 'mean_reversion', 'bear_bb_std_mult': 1.605481220402535, 'bear_rsi_os': 18, 'bear_rsi_ob': 47, 'bear_adx_thresh': 32.861377559751155, 'bear_atr_min_pct': 0.005447595579014553, 'bear_atr_max_pct': 0.015590643725683131, 'bear_tp_mult': 2.894239586634081, 'bear_tsl_mult': 0.2593891467376337, 'bear_time_stop': 204, 'bear_use_sma': False, 'bear_use_ema': False, 'bear_use_atr': False, 'bear_use_adx': False, 'bear_use_spike': True, 'bear_rsi_required': False, 'sideways_strategy': 'breakout', 'sideways_bb_std_mult': 2.6630520134090783, 'sideways_rsi_os': 38, 'sideways_rsi_ob': 91, 'sideways_adx_thresh': 19.111252180472327, 'sideways_atr_min_pct': 0.02195417587616739, 'sideways_atr_max_pct': 0.10041830484178106, 'sideways_tp_mult': 2.3048218979755064, 'sideways_tsl_mult': 0.03369723038083383, 'sideways_time_stop': 255, 'sideways_use_sma': False, 'sideways_use_ema': False, 'sideways_use_atr': True, 'sideways_use_adx': False, 'sideways_use_spike': True, 'sideways_rsi_required': True}.
[I 2025-08-30 14:32:47,063] Trial 100 finished with values: [-1000000000.0, 1000000000.0] and parameters: {'p_sma': 24, 'p_std': 26, 'p_atr': 23, 'p_adx': 26, 'rsi_period': 71, 'ema1': 26, 'ema2': 52, 'slip_atr_k': 0.10735964962174063, 'slip_spread_k': 0.2287226248073552, 'spread_hl_frac': 0.023809304164846865, 'bb_std_mult': 1.9203524300788415, 'rsi_os': 44, 'rsi_ob': 88, 'vol_spike': 0.2607436014980533, 'adx_thresh': 24.24550004617362, 'atr_min_pct': 0.014878234704331354, 'atr_max_pct': 0.10976654482412174, 'tp_mult': 1.6369247251315289, 'tsl_mult': 0.9166244048175145, 'strategy': 'mean_reversion', 'time_stop': 140, 'use_sma': True, 'use_atr': False, 'use_adx': False, 'use_ema': False, 'use_spike': False, 'rsi_required': False, 'edge_k': 0.25980876603647285, 'edge_cap': 0.43320119345973473, 'bull_strategy': 'mean_reversion', 'bull_bb_std_mult': 3.466267942977937, 'bull_rsi_os': 21, 'bull_rsi_ob': 73, 'bull_adx_thresh': 14.513805640117816, 'bull_atr_min_pct': 0.01655844626694948, 'bull_atr_max_pct': 0.02463260625913048, 'bull_tp_mult': 1.520089053644496, 'bull_tsl_mult': 0.49414673301968853, 'bull_time_stop': 262, 'bull_use_sma': False, 'bull_use_ema': False, 'bull_use_atr': False, 'bull_use_adx': True, 'bull_use_spike': False, 'bull_rsi_required': True, 'bear_strategy': 'mean_reversion', 'bear_bb_std_mult': 3.450526576989991, 'bear_rsi_os': 14, 'bear_rsi_ob': 47, 'bear_adx_thresh': 6.740458321301277, 'bear_atr_min_pct': 0.007055711184301245, 'bear_atr_max_pct': 0.015693032445427454, 'bear_tp_mult': 1.0958624493027829, 'bear_tsl_mult': 0.9647800225736507, 'bear_time_stop': 8, 'bear_use_sma': False, 'bear_use_ema': False, 'bear_use_atr': False, 'bear_use_adx': False, 'bear_use_spike': True, 'bear_rsi_required': False, 'sideways_strategy': 'breakout', 'sideways_bb_std_mult': 2.793205976453181, 'sideways_rsi_os': 20, 'sideways_rsi_ob': 86, 'sideways_adx_thresh': 14.265446238888027, 'sideways_atr_min_pct': 0.006860113615688986, 'sideways_atr_max_pct': 0.09977264770552818, 'sideways_tp_mult': 1.9599723715947466, 'sideways_tsl_mult': 0.06904630344322163, 'sideways_time_stop': 206, 'sideways_use_sma': False, 'sideways_use_ema': False, 'sideways_use_atr': True, 'sideways_use_adx': False, 'sideways_use_spike': True, 'sideways_rsi_required': True}.
[I 2025-08-30 14:33:17,521] Trial 104 finished with values: [-1000000000.0, 1000000000.0] and parameters: {'p_sma': 33, 'p_std': 31, 'p_atr': 11, 'p_adx': 22, 'rsi_period': 36, 'ema1': 27, 'ema2': 54, 'slip_atr_k': 0.020600538372060453, 'slip_spread_k': 0.05736012450470229, 'spread_hl_frac': 0.003279061085048112, 'bb_std_mult': 2.6723974664124386, 'rsi_os': 37, 'rsi_ob': 53, 'vol_spike': 0.28282606204944394, 'adx_thresh': 17.87549136469275, 'atr_min_pct': 0.023346779187915646, 'atr_max_pct': 0.06083918846577939, 'tp_mult': 2.465520623200237, 'tsl_mult': 0.4138965396623633, 'strategy': 'mean_reversion', 'time_stop': 56, 'use_sma': True, 'use_atr': False, 'use_adx': False, 'use_ema': False, 'use_spike': False, 'rsi_required': False, 'edge_k': 1.919235678195314, 'edge_cap': 0.7200512103410824, 'bull_strategy': 'breakout', 'bull_bb_std_mult': 3.21028140763017, 'bull_rsi_os': 24, 'bull_rsi_ob': 89, 'bull_adx_thresh': 11.924668562547827, 'bull_atr_min_pct': 0.005793687158569174, 'bull_atr_max_pct': 0.017517390282360972, 'bull_tp_mult': 1.7284538530417186, 'bull_tsl_mult': 0.6052346420095155, 'bull_time_stop': 238, 'bull_use_sma': False, 'bull_use_ema': False, 'bull_use_atr': True, 'bull_use_adx': True, 'bull_use_spike': False, 'bull_rsi_required': True, 'bear_strategy': 'breakout', 'bear_bb_std_mult': 1.1472554067723544, 'bear_rsi_os': 16, 'bear_rsi_ob': 66, 'bear_adx_thresh': 26.23231721903322, 'bear_atr_min_pct': 0.02007648661181763, 'bear_atr_max_pct': 0.1107495418742158, 'bear_tp_mult': 1.8533282783603506, 'bear_tsl_mult': 0.2250118702592257, 'bear_time_stop': 53, 'bear_use_sma': False, 'bear_use_ema': False, 'bear_use_atr': False, 'bear_use_adx': False, 'bear_use_spike': True, 'bear_rsi_required': False, 'sideways_strategy': 'breakout', 'sideways_bb_std_mult': 2.4761165857737524, 'sideways_rsi_os': 5, 'sideways_rsi_ob': 79, 'sideways_adx_thresh': 13.444333346208282, 'sideways_atr_min_pct': 0.005527203138236894, 'sideways_atr_max_pct': 0.08029497472566849, 'sideways_tp_mult': 2.667122829628998, 'sideways_tsl_mult': 0.24563766401045634, 'sideways_time_stop': 286, 'sideways_use_sma': False, 'sideways_use_ema': False, 'sideways_use_atr': False, 'sideways_use_adx': True, 'sideways_use_spike': False, 'sideways_rsi_required': True}.
[I 2025-08-30 14:33:18,090] Trial 102 finished with values: [-1000000000.0, 1000000000.0] and parameters: {'p_sma': 28, 'p_std': 26, 'p_atr': 23, 'p_adx': 16, 'rsi_period': 70, 'ema1': 27, 'ema2': 43, 'slip_atr_k': 0.05077427632633429, 'slip_spread_k': 0.9979740088754818, 'spread_hl_frac': 0.02366685918835035, 'bb_std_mult': 3.3610847103211876, 'rsi_os': 44, 'rsi_ob': 64, 'vol_spike': 0.07100215938115374, 'adx_thresh': 17.942638543423527, 'atr_min_pct': 0.004642372818610317, 'atr_max_pct': 0.08631737031356332, 'tp_mult': 2.447993406530208, 'tsl_mult': 0.9067922346270753, 'strategy': 'mean_reversion', 'time_stop': 54, 'use_sma': True, 'use_atr': False, 'use_adx': False, 'use_ema': False, 'use_spike': False, 'rsi_required': False, 'edge_k': 0.23374551370867624, 'edge_cap': 0.4433053672704459, 'bull_strategy': 'mean_reversion', 'bull_bb_std_mult': 3.3540716028488275, 'bull_rsi_os': 31, 'bull_rsi_ob': 74, 'bull_adx_thresh': 10.348127542887209, 'bull_atr_min_pct': 0.013240580181989623, 'bull_atr_max_pct': 0.018920597779448812, 'bull_tp_mult': 1.5302201693896067, 'bull_tsl_mult': 0.32674045344555314, 'bull_time_stop': 236, 'bull_use_sma': False, 'bull_use_ema': False, 'bull_use_atr': False, 'bull_use_adx': True, 'bull_use_spike': False, 'bull_rsi_required': True, 'bear_strategy': 'mean_reversion', 'bear_bb_std_mult': 1.5488630925826121, 'bear_rsi_os': 19, 'bear_rsi_ob': 46, 'bear_adx_thresh': 32.93930366651106, 'bear_atr_min_pct': 0.007483196512137145, 'bear_atr_max_pct': 0.1108314163096613, 'bear_tp_mult': 1.8575861888624299, 'bear_tsl_mult': 0.9264949930295259, 'bear_time_stop': 61, 'bear_use_sma': False, 'bear_use_ema': False, 'bear_use_atr': False, 'bear_use_adx': False, 'bear_use_spike': True, 'bear_rsi_required': False, 'sideways_strategy': 'breakout', 'sideways_bb_std_mult': 2.4542829168912785, 'sideways_rsi_os': 38, 'sideways_rsi_ob': 95, 'sideways_adx_thresh': 18.39440213358949, 'sideways_atr_min_pct': 0.005787767277211231, 'sideways_atr_max_pct': 0.09977032469463767, 'sideways_tp_mult': 2.3202328695287977, 'sideways_tsl_mult': 0.20241205746250218, 'sideways_time_stop': 103, 'sideways_use_sma': False, 'sideways_use_ema': False, 'sideways_use_atr': True, 'sideways_use_adx': False, 'sideways_use_spike': True, 'sideways_rsi_required': True}.
[I 2025-08-30 14:33:18,234] Trial 103 finished with values: [-1000000000.0, 1000000000.0] and parameters: {'p_sma': 24, 'p_std': 23, 'p_atr': 24, 'p_adx': 18, 'rsi_period': 42, 'ema1': 27, 'ema2': 15, 'slip_atr_k': 0.10023139287930574, 'slip_spread_k': 0.055992250583421665, 'spread_hl_frac': 0.004954797110439767, 'bb_std_mult': 1.8877415778279676, 'rsi_os': 43, 'rsi_ob': 52, 'vol_spike': 0.07571907490707938, 'adx_thresh': 17.773099441342602, 'atr_min_pct': 0.023338764911637236, 'atr_max_pct': 0.03506177635206855, 'tp_mult': 2.4259112500941713, 'tsl_mult': 0.40227404910084597, 'strategy': 'mean_reversion', 'time_stop': 30, 'use_sma': True, 'use_atr': False, 'use_adx': False, 'use_ema': False, 'use_spike': False, 'rsi_required': False, 'edge_k': 0.28500995494312076, 'edge_cap': 0.44069742076472324, 'bull_strategy': 'mean_reversion', 'bull_bb_std_mult': 1.729115367457012, 'bull_rsi_os': 33, 'bull_rsi_ob': 73, 'bull_adx_thresh': 10.281860371314568, 'bull_atr_min_pct': 0.01900777721548944, 'bull_atr_max_pct': 0.018236477939829916, 'bull_tp_mult': 1.731466963216188, 'bull_tsl_mult': 0.6004878679095818, 'bull_time_stop': 261, 'bull_use_sma': False, 'bull_use_ema': False, 'bull_use_atr': False, 'bull_use_adx': True, 'bull_use_spike': False, 'bull_rsi_required': True, 'bear_strategy': 'breakout', 'bear_bb_std_mult': 3.488542759565946, 'bear_rsi_os': 16, 'bear_rsi_ob': 55, 'bear_adx_thresh': 19.338721480715268, 'bear_atr_min_pct': 0.025656279305851844, 'bear_atr_max_pct': 0.1144229193398194, 'bear_tp_mult': 1.8547348139864912, 'bear_tsl_mult': 0.8861539349983183, 'bear_time_stop': 53, 'bear_use_sma': False, 'bear_use_ema': False, 'bear_use_atr': False, 'bear_use_adx': False, 'bear_use_spike': True, 'bear_rsi_required': False, 'sideways_strategy': 'breakout', 'sideways_bb_std_mult': 2.9290812631545147, 'sideways_rsi_os': 7, 'sideways_rsi_ob': 95, 'sideways_adx_thresh': 18.258075757169397, 'sideways_atr_min_pct': 0.0062589668472578, 'sideways_atr_max_pct': 0.08122217253626787, 'sideways_tp_mult': 2.5275979596668905, 'sideways_tsl_mult': 0.24208249809827276, 'sideways_time_stop': 50, 'sideways_use_sma': False, 'sideways_use_ema': False, 'sideways_use_atr': True, 'sideways_use_adx': False, 'sideways_use_spike': True, 'sideways_rsi_required': True}.
[I 2025-08-30 14:33:18,445] Trial 101 finished with values: [-1000000000.0, 1000000000.0] and parameters: {'p_sma': 28, 'p_std': 21, 'p_atr': 23, 'p_adx': 26, 'rsi_period': 71, 'ema1': 27, 'ema2': 33, 'slip_atr_k': 0.10339027730391834, 'slip_spread_k': 0.049343022031119455, 'spread_hl_frac': 0.023845286810566916, 'bb_std_mult': 0.9343741665177911, 'rsi_os': 33, 'rsi_ob': 88, 'vol_spike': 0.06983274174446708, 'adx_thresh': 24.03174005143392, 'atr_min_pct': 0.008317611271546406, 'atr_max_pct': 0.1098713220308488, 'tp_mult': 2.4497361985032398, 'tsl_mult': 0.9184481886034279, 'strategy': 'mean_reversion', 'time_stop': 137, 'use_sma': True, 'use_atr': False, 'use_adx': False, 'use_ema': False, 'use_spike': False, 'rsi_required': False, 'edge_k': 1.5753256932204054, 'edge_cap': 0.733923038772501, 'bull_strategy': 'mean_reversion', 'bull_bb_std_mult': 3.2194576524577947, 'bull_rsi_os': 49, 'bull_rsi_ob': 71, 'bull_adx_thresh': 15.411112838373002, 'bull_atr_min_pct': 0.013368929152510166, 'bull_atr_max_pct': 0.024572320302384508, 'bull_tp_mult': 1.557272645881302, 'bull_tsl_mult': 0.43169822262531166, 'bull_time_stop': 236, 'bull_use_sma': False, 'bull_use_ema': False, 'bull_use_atr': False, 'bull_use_adx': True, 'bull_use_spike': False, 'bull_rsi_required': True, 'bear_strategy': 'mean_reversion', 'bear_bb_std_mult': 3.4157287806360213, 'bear_rsi_os': 16, 'bear_rsi_ob': 46, 'bear_adx_thresh': 6.667781181793009, 'bear_atr_min_pct': 0.020077596008400787, 'bear_atr_max_pct': 0.015015571805453348, 'bear_tp_mult': 1.850092308301403, 'bear_tsl_mult': 0.23744168815884464, 'bear_time_stop': 204, 'bear_use_sma': False, 'bear_use_ema': False, 'bear_use_atr': False, 'bear_use_adx': False, 'bear_use_spike': True, 'bear_rsi_required': False, 'sideways_strategy': 'breakout', 'sideways_bb_std_mult': 2.209856191317905, 'sideways_rsi_os': 6, 'sideways_rsi_ob': 91, 'sideways_adx_thresh': 19.133378714635388, 'sideways_atr_min_pct': 0.005477824270688688, 'sideways_atr_max_pct': 0.10068230584939367, 'sideways_tp_mult': 1.9786922657024575, 'sideways_tsl_mult': 0.029513685977194323, 'sideways_time_stop': 221, 'sideways_use_sma': False, 'sideways_use_ema': False, 'sideways_use_atr': True, 'sideways_use_adx': False, 'sideways_use_spike': True, 'sideways_rsi_required': True}.
[I 2025-08-30 14:33:49,791] Trial 105 finished with values: [-1000000000.0, 1000000000.0] and parameters: {'p_sma': 8, 'p_std': 24, 'p_atr': 13, 'p_adx': 18, 'rsi_period': 56, 'ema1': 21, 'ema2': 49, 'slip_atr_k': 0.025426627706984367, 'slip_spread_k': 0.5215130953445812, 'spread_hl_frac': 0.0051539250402339405, 'bb_std_mult': 1.891170268465097, 'rsi_os': 34, 'rsi_ob': 91, 'vol_spike': 0.07625034520837025, 'adx_thresh': 34.71674141466855, 'atr_min_pct': 0.026729616471599014, 'atr_max_pct': 0.08636693867324566, 'tp_mult': 2.704150758971638, 'tsl_mult': 0.9347772491071985, 'strategy': 'mean_reversion', 'time_stop': 192, 'use_sma': False, 'use_atr': False, 'use_adx': False, 'use_ema': False, 'use_spike': False, 'rsi_required': False, 'edge_k': 1.729876117304846, 'edge_cap': 0.6741702515426455, 'bull_strategy': 'breakout', 'bull_bb_std_mult': 3.3583632026424954, 'bull_rsi_os': 30, 'bull_rsi_ob': 74, 'bull_adx_thresh': 10.550508477343694, 'bull_atr_min_pct': 0.019284970558192574, 'bull_atr_max_pct': 0.030326148300220783, 'bull_tp_mult': 1.3835415774266084, 'bull_tsl_mult': 0.20867404876715445, 'bull_time_stop': 249, 'bull_use_sma': False, 'bull_use_ema': False, 'bull_use_atr': True, 'bull_use_adx': True, 'bull_use_spike': False, 'bull_rsi_required': True, 'bear_strategy': 'breakout', 'bear_bb_std_mult': 1.9647504862021843, 'bear_rsi_os': 36, 'bear_rsi_ob': 46, 'bear_adx_thresh': 19.181404272478087, 'bear_atr_min_pct': 0.004424698360351393, 'bear_atr_max_pct': 0.033128384192735026, 'bear_tp_mult': 2.0648285069393064, 'bear_tsl_mult': 0.5210906914898678, 'bear_time_stop': 168, 'bear_use_sma': False, 'bear_use_ema': False, 'bear_use_atr': False, 'bear_use_adx': False, 'bear_use_spike': True, 'bear_rsi_required': False, 'sideways_strategy': 'breakout', 'sideways_bb_std_mult': 2.879411166399559, 'sideways_rsi_os': 7, 'sideways_rsi_ob': 89, 'sideways_adx_thresh': 25.843763113658888, 'sideways_atr_min_pct': 0.004086627875379749, 'sideways_atr_max_pct': 0.08142697533585014, 'sideways_tp_mult': 2.522923088061016, 'sideways_tsl_mult': 0.2025896076696363, 'sideways_time_stop': 220, 'sideways_use_sma': False, 'sideways_use_ema': False, 'sideways_use_atr': False, 'sideways_use_adx': True, 'sideways_use_spike': True, 'sideways_rsi_required': False}.
[I 2025-08-30 14:33:50,498] Trial 107 finished with values: [-1000000000.0, 1000000000.0] and parameters: {'p_sma': 8, 'p_std': 11, 'p_atr': 13, 'p_adx': 26, 'rsi_period': 79, 'ema1': 28, 'ema2': 28, 'slip_atr_k': 0.02817622955617891, 'slip_spread_k': 0.3909026987804298, 'spread_hl_frac': 0.029535640531845243, 'bb_std_mult': 2.035169170582066, 'rsi_os': 32, 'rsi_ob': 91, 'vol_spike': 0.012466412619592804, 'adx_thresh': 34.86778806984083, 'atr_min_pct': 0.0028110354598365247, 'atr_max_pct': 0.1155577686941118, 'tp_mult': 2.5617248446021863, 'tsl_mult': 0.6991037421954187, 'strategy': 'mean_reversion', 'time_stop': 67, 'use_sma': False, 'use_atr': True, 'use_adx': False, 'use_ema': True, 'use_spike': False, 'rsi_required': False, 'edge_k': 0.5228416080180205, 'edge_cap': 0.6729647370100903, 'bull_strategy': 'breakout', 'bull_bb_std_mult': 1.8708649692001644, 'bull_rsi_os': 22, 'bull_rsi_ob': 80, 'bull_adx_thresh': 11.233889999335108, 'bull_atr_min_pct': 0.00927004970933575, 'bull_atr_max_pct': 0.02968644063195216, 'bull_tp_mult': 1.3708122649061687, 'bull_tsl_mult': 0.43249756279348084, 'bull_time_stop': 252, 'bull_use_sma': False, 'bull_use_ema': False, 'bull_use_atr': True, 'bull_use_adx': True, 'bull_use_spike': False, 'bull_rsi_required': True, 'bear_strategy': 'breakout', 'bear_bb_std_mult': 0.7164410158017901, 'bear_rsi_os': 36, 'bear_rsi_ob': 79, 'bear_adx_thresh': 34.899496802417886, 'bear_atr_min_pct': 0.02902437690753023, 'bear_atr_max_pct': 0.08265629738163362, 'bear_tp_mult': 2.147316721434352, 'bear_tsl_mult': 0.5263668236252877, 'bear_time_stop': 88, 'bear_use_sma': False, 'bear_use_ema': False, 'bear_use_atr': False, 'bear_use_adx': True, 'bear_use_spike': True, 'bear_rsi_required': False, 'sideways_strategy': 'breakout', 'sideways_bb_std_mult': 2.5808051241015972, 'sideways_rsi_os': 16, 'sideways_rsi_ob': 89, 'sideways_adx_thresh': 7.259784068151934, 'sideways_atr_min_pct': 0.0038286398180818414, 'sideways_atr_max_pct': 0.07669494519014565, 'sideways_tp_mult': 2.8875325392964486, 'sideways_tsl_mult': 0.524563205225512, 'sideways_time_stop': 220, 'sideways_use_sma': False, 'sideways_use_ema': True, 'sideways_use_atr': False, 'sideways_use_adx': True, 'sideways_use_spike': False, 'sideways_rsi_required': False}.
[I 2025-08-30 14:33:50,922] Trial 108 finished with values: [-1000000000.0, 1000000000.0] and parameters: {'p_sma': 8, 'p_std': 16, 'p_atr': 16, 'p_adx': 22, 'rsi_period': 55, 'ema1': 10, 'ema2': 49, 'slip_atr_k': 0.02852392831430816, 'slip_spread_k': 0.521915089487491, 'spread_hl_frac': 0.005535954679810044, 'bb_std_mult': 2.0278244061722908, 'rsi_os': 34, 'rsi_ob': 74, 'vol_spike': 0.24762862384602968, 'adx_thresh': 34.713700155948985, 'atr_min_pct': 0.025581736573361095, 'atr_max_pct': 0.07876626417343642, 'tp_mult': 2.6961153849851187, 'tsl_mult': 0.6949907891402862, 'strategy': 'mean_reversion', 'time_stop': 13, 'use_sma': False, 'use_atr': True, 'use_adx': False, 'use_ema': True, 'use_spike': False, 'rsi_required': False, 'edge_k': 0.47330975594397184, 'edge_cap': 0.669379964599331, 'bull_strategy': 'breakout', 'bull_bb_std_mult': 1.8626241225177358, 'bull_rsi_os': 30, 'bull_rsi_ob': 80, 'bull_adx_thresh': 14.142910135502374, 'bull_atr_min_pct': 0.009210245240789141, 'bull_atr_max_pct': 0.010292509937584064, 'bull_tp_mult': 1.1807872533650103, 'bull_tsl_mult': 0.2461332224093915, 'bull_time_stop': 166, 'bull_use_sma': False, 'bull_use_ema': True, 'bull_use_atr': True, 'bull_use_adx': True, 'bull_use_spike': False, 'bull_rsi_required': True, 'bear_strategy': 'breakout', 'bear_bb_std_mult': 1.9614542600509939, 'bear_rsi_os': 36, 'bear_rsi_ob': 52, 'bear_adx_thresh': 20.155755046241175, 'bear_atr_min_pct': 0.012685744611484863, 'bear_atr_max_pct': 0.03367868854268042, 'bear_tp_mult': 2.1574359241280465, 'bear_tsl_mult': 0.18159069709066278, 'bear_time_stop': 172, 'bear_use_sma': False, 'bear_use_ema': True, 'bear_use_atr': False, 'bear_use_adx': True, 'bear_use_spike': True, 'bear_rsi_required': False, 'sideways_strategy': 'breakout', 'sideways_bb_std_mult': 3.414171529575196, 'sideways_rsi_os': 48, 'sideways_rsi_ob': 51, 'sideways_adx_thresh': 6.930342560910079, 'sideways_atr_min_pct': 0.003991781585797462, 'sideways_atr_max_pct': 0.07041288204780899, 'sideways_tp_mult': 2.885764971418672, 'sideways_tsl_mult': 0.6419082870303563, 'sideways_time_stop': 23, 'sideways_use_sma': False, 'sideways_use_ema': True, 'sideways_use_atr': False, 'sideways_use_adx': True, 'sideways_use_spike': False, 'sideways_rsi_required': False}.
