[I 2025-08-30 16:42:47,609] Trial 848 finished with values: [-0.023458700637688512, 0.023379099878928843] and parameters: {'p_sma': 5, 'p_std': 38, 'p_atr': 25, 'p_adx': 17, 'rsi_period': 20, 'ema1': 25, 'ema2': 31, 'slip_atr_k': 0.10085070711007818, 'slip_spread_k': 0.09576676995526896, 'spread_hl_frac': 0.024548545417440264, 'bb_std_mult': 2.4365382667971702, 'rsi_os': 45, 'rsi_ob': 74, 'vol_spike': 0.16291188568311588, 'adx_thresh': 13.614367319867227, 'atr_min_pct': 0.01554572594518567, 'atr_max_pct': 0.07278777264135775, 'tp_mult': 1.8255274031770863, 'tsl_mult': 0.2830406645239931, 'strategy': 'mean_reversion', 'time_stop': 229, 'use_sma': True, 'use_atr': True, 'use_adx': True, 'use_ema': True, 'use_spike': False, 'rsi_required': False, 'edge_k': 1.1109656037318087, 'edge_cap': 0.6089800232118444, 'bull_strategy': 'breakout', 'bull_bb_std_mult': 0.7647084252070334, 'bull_rsi_os': 34, 'bull_rsi_ob': 68, 'bull_adx_thresh': 8.674199773001462, 'bull_atr_min_pct': 0.019860576427868645, 'bull_atr_max_pct': 0.11006419367589995, 'bull_tp_mult': 1.952327546509866, 'bull_tsl_mult': 0.9872491208434502, 'bull_time_stop': 32, 'bull_use_sma': True, 'bull_use_ema': True, 'bull_use_atr': True, 'bull_use_adx': True, 'bull_use_spike': True, 'bull_rsi_required': True, 'bear_strategy': 'mean_reversion', 'bear_bb_std_mult': 2.4080939000958836, 'bear_rsi_os': 33, 'bear_rsi_ob': 88, 'bear_adx_thresh': 12.699247654345335, 'bear_atr_min_pct': 0.02060288196991853, 'bear_atr_max_pct': 0.09764640472705594, 'bear_tp_mult': 2.6513325413983626, 'bear_tsl_mult': 0.2846707311476444, 'bear_time_stop': 264, 'bear_use_sma': False, 'bear_use_ema': False, 'bear_use_atr': False, 'bear_use_adx': True, 'bear_use_spike': True, 'bear_rsi_required': True, 'sideways_strategy': 'breakout', 'sideways_bb_std_mult': 0.9006472690295644, 'sideways_rsi_os': 30, 'sideways_rsi_ob': 62, 'sideways_adx_thresh': 24.243864771388484, 'sideways_atr_min_pct': 0.0005094248402673087, 'sideways_atr_max_pct': 0.11492034121594616, 'sideways_tp_mult': 2.9551776516740693, 'sideways_tsl_mult': 0.2276026795814844, 'sideways_time_stop': 78, 'sideways_use_sma': True, 'sideways_use_ema': False, 'sideways_use_atr': False, 'sideways_use_adx': True, 'sideways_use_spike': True, 'sideways_rsi_required': True}.
[I 2025-08-30 16:42:49,569] Trial 847 finished with values: [-0.026438096818631074, 0.026333399135450904] and parameters: {'p_sma': 5, 'p_std': 13, 'p_atr': 26, 'p_adx': 17, 'rsi_period': 67, 'ema1': 24, 'ema2': 31, 'slip_atr_k': 0.07690103538997876, 'slip_spread_k': 0.13978424011325025, 'spread_hl_frac': 0.025592041513947544, 'bb_std_mult': 2.444136689104831, 'rsi_os': 46, 'rsi_ob': 72, 'vol_spike': 0.16194497432959612, 'adx_thresh': 13.77831294733857, 'atr_min_pct': 0.01561785122631889, 'atr_max_pct': 0.08346544466423332, 'tp_mult': 2.391115643696674, 'tsl_mult': 0.34388966594426706, 'strategy': 'mean_reversion', 'time_stop': 219, 'use_sma': True, 'use_atr': True, 'use_adx': False, 'use_ema': True, 'use_spike': False, 'rsi_required': False, 'edge_k': 0.3860365854529081, 'edge_cap': 0.5507112523602309, 'bull_strategy': 'breakout', 'bull_bb_std_mult': 1.6737692660886505, 'bull_rsi_os': 9, 'bull_rsi_ob': 95, 'bull_adx_thresh': 23.705568996063096, 'bull_atr_min_pct': 0.008410879142880983, 'bull_atr_max_pct': 0.10143592081675525, 'bull_tp_mult': 1.9611426685597015, 'bull_tsl_mult': 0.0003407277011961696, 'bull_time_stop': 31, 'bull_use_sma': True, 'bull_use_ema': True, 'bull_use_atr': True, 'bull_use_adx': True, 'bull_use_spike': True, 'bull_rsi_required': True, 'bear_strategy': 'mean_reversion', 'bear_bb_std_mult': 2.3985185380747818, 'bear_rsi_os': 33, 'bear_rsi_ob': 83, 'bear_adx_thresh': 10.444188006276233, 'bear_atr_min_pct': 0.003600202549841884, 'bear_atr_max_pct': 0.09871045771133952, 'bear_tp_mult': 2.472364080542501, 'bear_tsl_mult': 0.2832516672479465, 'bear_time_stop': 283, 'bear_use_sma': False, 'bear_use_ema': False, 'bear_use_atr': True, 'bear_use_adx': True, 'bear_use_spike': True, 'bear_rsi_required': True, 'sideways_strategy': 'breakout', 'sideways_bb_std_mult': 0.8738068404904791, 'sideways_rsi_os': 52, 'sideways_rsi_ob': 47, 'sideways_adx_thresh': 25.78040600140164, 'sideways_atr_min_pct': 0.0017195482632014793, 'sideways_atr_max_pct': 0.111174646993044, 'sideways_tp_mult': 1.2776417308008616, 'sideways_tsl_mult': 0.23399833314558577, 'sideways_time_stop': 174, 'sideways_use_sma': True, 'sideways_use_ema': True, 'sideways_use_atr': False, 'sideways_use_adx': True, 'sideways_use_spike': True, 'sideways_rsi_required': True}.
[I 2025-08-30 16:42:50,878] Trial 846 finished with values: [-1000000000.0, 1000000000.0] and parameters: {'p_sma': 6, 'p_std': 13, 'p_atr': 25, 'p_adx': 17, 'rsi_period': 78, 'ema1': 24, 'ema2': 33, 'slip_atr_k': 0.07776506631667934, 'slip_spread_k': 0.14076525943343166, 'spread_hl_frac': 0.026399470878632095, 'bb_std_mult': 2.5714866222268498, 'rsi_os': 36, 'rsi_ob': 74, 'vol_spike': 0.16388554377658981, 'adx_thresh': 14.962553201289646, 'atr_min_pct': 0.018515360184176093, 'atr_max_pct': 0.08273752843258214, 'tp_mult': 2.997574597001442, 'tsl_mult': 0.28212193402555763, 'strategy': 'mean_reversion', 'time_stop': 218, 'use_sma': True, 'use_atr': True, 'use_adx': False, 'use_ema': True, 'use_spike': True, 'rsi_required': False, 'edge_k': 1.1808088337156237, 'edge_cap': 0.9614914009635259, 'bull_strategy': 'breakout', 'bull_bb_std_mult': 1.5487355564400933, 'bull_rsi_os': 41, 'bull_rsi_ob': 72, 'bull_adx_thresh': 8.583079319693304, 'bull_atr_min_pct': 0.022548701506358747, 'bull_atr_max_pct': 0.11017600187635551, 'bull_tp_mult': 2.673960687312448, 'bull_tsl_mult': 0.07739945849175897, 'bull_time_stop': 30, 'bull_use_sma': True, 'bull_use_ema': True, 'bull_use_atr': True, 'bull_use_adx': True, 'bull_use_spike': True, 'bull_rsi_required': True, 'bear_strategy': 'mean_reversion', 'bear_bb_std_mult': 2.416279144905564, 'bear_rsi_os': 41, 'bear_rsi_ob': 59, 'bear_adx_thresh': 27.463366840078656, 'bear_atr_min_pct': 0.005178494796857138, 'bear_atr_max_pct': 0.0686074270139764, 'bear_tp_mult': 2.956283456582045, 'bear_tsl_mult': 0.3391238762806815, 'bear_time_stop': 272, 'bear_use_sma': False, 'bear_use_ema': False, 'bear_use_atr': True, 'bear_use_adx': True, 'bear_use_spike': True, 'bear_rsi_required': True, 'sideways_strategy': 'breakout', 'sideways_bb_std_mult': 0.8907921417938878, 'sideways_rsi_os': 38, 'sideways_rsi_ob': 77, 'sideways_adx_thresh': 25.866913538655062, 'sideways_atr_min_pct': 0.01526032772039743, 'sideways_atr_max_pct': 0.11117224825957497, 'sideways_tp_mult': 1.3297431157669077, 'sideways_tsl_mult': 0.9219155664431208, 'sideways_time_stop': 176, 'sideways_use_sma': True, 'sideways_use_ema': True, 'sideways_use_atr': False, 'sideways_use_adx': True, 'sideways_use_spike': True, 'sideways_rsi_required': True}.
[I 2025-08-30 16:42:52,011] Trial 849 finished with values: [-0.008425075993779174, 0.00836124729032363] and parameters: {'p_sma': 5, 'p_std': 27, 'p_atr': 26, 'p_adx': 11, 'rsi_period': 78, 'ema1': 23, 'ema2': 31, 'slip_atr_k': 0.06564284583112945, 'slip_spread_k': 0.14749554756427669, 'spread_hl_frac': 0.02636030321047354, 'bb_std_mult': 2.394950638874243, 'rsi_os': 47, 'rsi_ob': 74, 'vol_spike': 0.16001291275776508, 'adx_thresh': 13.526857467605653, 'atr_min_pct': 0.015908072810494656, 'atr_max_pct': 0.07265292766618106, 'tp_mult': 1.8343186025416083, 'tsl_mult': 0.33854240559793336, 'strategy': 'mean_reversion', 'time_stop': 217, 'use_sma': True, 'use_atr': True, 'use_adx': True, 'use_ema': True, 'use_spike': True, 'rsi_required': False, 'edge_k': 1.1092608588559076, 'edge_cap': 0.2925964009616253, 'bull_strategy': 'breakout', 'bull_bb_std_mult': 1.515682760412174, 'bull_rsi_os': 42, 'bull_rsi_ob': 61, 'bull_adx_thresh': 24.59922094609412, 'bull_atr_min_pct': 0.019958592272078215, 'bull_atr_max_pct': 0.11051587325064553, 'bull_tp_mult': 1.6267771318482023, 'bull_tsl_mult': 0.08788542292655102, 'bull_time_stop': 32, 'bull_use_sma': True, 'bull_use_ema': True, 'bull_use_atr': True, 'bull_use_adx': True, 'bull_use_spike': True, 'bull_rsi_required': True, 'bear_strategy': 'mean_reversion', 'bear_bb_std_mult': 2.4187796369717747, 'bear_rsi_os': 33, 'bear_rsi_ob': 88, 'bear_adx_thresh': 29.357617337138493, 'bear_atr_min_pct': 0.003442066017872558, 'bear_atr_max_pct': 0.12584579072354354, 'bear_tp_mult': 2.4803071424651955, 'bear_tsl_mult': 0.3383124282298437, 'bear_time_stop': 284, 'bear_use_sma': False, 'bear_use_ema': False, 'bear_use_atr': False, 'bear_use_adx': True, 'bear_use_spike': True, 'bear_rsi_required': True, 'sideways_strategy': 'breakout', 'sideways_bb_std_mult': 1.735641293927221, 'sideways_rsi_os': 41, 'sideways_rsi_ob': 78, 'sideways_adx_thresh': 23.69419177699564, 'sideways_atr_min_pct': 0.0011039832248113546, 'sideways_atr_max_pct': 0.11518755318453866, 'sideways_tp_mult': 2.94850073226035, 'sideways_tsl_mult': 0.1462748651443851, 'sideways_time_stop': 40, 'sideways_use_sma': True, 'sideways_use_ema': True, 'sideways_use_atr': False, 'sideways_use_adx': True, 'sideways_use_spike': True, 'sideways_rsi_required': True}.
[I 2025-08-30 16:43:42,508] Trial 850 finished with values: [-1000000000.0, 1000000000.0] and parameters: {'p_sma': 5, 'p_std': 27, 'p_atr': 26, 'p_adx': 11, 'rsi_period': 78, 'ema1': 15, 'ema2': 31, 'slip_atr_k': 0.0658079501917779, 'slip_spread_k': 0.14862973147603953, 'spread_hl_frac': 0.007490950134180122, 'bb_std_mult': 2.278078954696092, 'rsi_os': 17, 'rsi_ob': 87, 'vol_spike': 0.15771280376325708, 'adx_thresh': 10.150295326071426, 'atr_min_pct': 0.01884920796731232, 'atr_max_pct': 0.07197722045932199, 'tp_mult': 1.6225681024271856, 'tsl_mult': 0.25108239190944115, 'strategy': 'mean_reversion', 'time_stop': 254, 'use_sma': True, 'use_atr': False, 'use_adx': False, 'use_ema': True, 'use_spike': True, 'rsi_required': False, 'edge_k': 0.3931145577717984, 'edge_cap': 0.554305991149615, 'bull_strategy': 'breakout', 'bull_bb_std_mult': 0.8461477149409117, 'bull_rsi_os': 44, 'bull_rsi_ob': 83, 'bull_adx_thresh': 23.756932785870674, 'bull_atr_min_pct': 0.02198584966687261, 'bull_atr_max_pct': 0.1011016988302815, 'bull_tp_mult': 2.035820286793259, 'bull_tsl_mult': 0.11353791702758764, 'bull_time_stop': 230, 'bull_use_sma': True, 'bull_use_ema': True, 'bull_use_atr': True, 'bull_use_adx': True, 'bull_use_spike': True, 'bull_rsi_required': True, 'bear_strategy': 'mean_reversion', 'bear_bb_std_mult': 2.6859772223320943, 'bear_rsi_os': 31, 'bear_rsi_ob': 90, 'bear_adx_thresh': 29.31008044015228, 'bear_atr_min_pct': 0.025947915563785187, 'bear_atr_max_pct': 0.06528601699907738, 'bear_tp_mult': 2.95455759549569, 'bear_tsl_mult': 0.6405158670184351, 'bear_time_stop': 284, 'bear_use_sma': False, 'bear_use_ema': False, 'bear_use_atr': True, 'bear_use_adx': True, 'bear_use_spike': True, 'bear_rsi_required': True, 'sideways_strategy': 'breakout', 'sideways_bb_std_mult': 1.3844289110393115, 'sideways_rsi_os': 7, 'sideways_rsi_ob': 78, 'sideways_adx_thresh': 22.215557722575568, 'sideways_atr_min_pct': 0.029462897476608785, 'sideways_atr_max_pct': 0.0897886665434814, 'sideways_tp_mult': 2.9652386926063827, 'sideways_tsl_mult': 0.14886756654857092, 'sideways_time_stop': 92, 'sideways_use_sma': True, 'sideways_use_ema': True, 'sideways_use_atr': False, 'sideways_use_adx': True, 'sideways_use_spike': True, 'sideways_rsi_required': True}.
[I 2025-08-30 16:43:43,398] Trial 852 finished with values: [-1000000000.0, 1000000000.0] and parameters: {'p_sma': 38, 'p_std': 27, 'p_atr': 28, 'p_adx': 11, 'rsi_period': 78, 'ema1': 15, 'ema2': 27, 'slip_atr_k': 0.23797172496553906, 'slip_spread_k': 0.1572929353546263, 'spread_hl_frac': 0.03680160580020728, 'bb_std_mult': 2.2762853388465607, 'rsi_os': 42, 'rsi_ob': 75, 'vol_spike': 0.0597330148263646, 'adx_thresh': 15.729124632215928, 'atr_min_pct': 0.00960240315834238, 'atr_max_pct': 0.01719303440674759, 'tp_mult': 1.0822498352174934, 'tsl_mult': 0.4361979041631469, 'strategy': 'mean_reversion', 'time_stop': 234, 'use_sma': True, 'use_atr': False, 'use_adx': True, 'use_ema': True, 'use_spike': True, 'rsi_required': False, 'edge_k': 1.5274164758481357, 'edge_cap': 0.5933394545680585, 'bull_strategy': 'breakout', 'bull_bb_std_mult': 0.8359572187093058, 'bull_rsi_os': 45, 'bull_rsi_ob': 61, 'bull_adx_thresh': 17.01946763167836, 'bull_atr_min_pct': 0.014766189362270055, 'bull_atr_max_pct': 0.09124055541006997, 'bull_tp_mult': 1.6402241258623356, 'bull_tsl_mult': 0.9999052546201652, 'bull_time_stop': 23, 'bull_use_sma': True, 'bull_use_ema': True, 'bull_use_atr': True, 'bull_use_adx': True, 'bull_use_spike': True, 'bull_rsi_required': True, 'bear_strategy': 'mean_reversion', 'bear_bb_std_mult': 2.9179999257178606, 'bear_rsi_os': 23, 'bear_rsi_ob': 87, 'bear_adx_thresh': 33.633822541022155, 'bear_atr_min_pct': 0.02170968391028289, 'bear_atr_max_pct': 0.07637679484190833, 'bear_tp_mult': 2.902994990750015, 'bear_tsl_mult': 0.48152891358051575, 'bear_time_stop': 261, 'bear_use_sma': False, 'bear_use_ema': False, 'bear_use_atr': False, 'bear_use_adx': True, 'bear_use_spike': True, 'bear_rsi_required': True, 'sideways_strategy': 'breakout', 'sideways_bb_std_mult': 1.4904911495945856, 'sideways_rsi_os': 8, 'sideways_rsi_ob': 62, 'sideways_adx_thresh': 8.234694166136432, 'sideways_atr_min_pct': 0.029243053613008045, 'sideways_atr_max_pct': 0.02534834626719494, 'sideways_tp_mult': 1.3922707462438801, 'sideways_tsl_mult': 0.8916890616026278, 'sideways_time_stop': 82, 'sideways_use_sma': True, 'sideways_use_ema': True, 'sideways_use_atr': False, 'sideways_use_adx': True, 'sideways_use_spike': True, 'sideways_rsi_required': True}.
[I 2025-08-30 16:43:44,015] Trial 853 finished with values: [-1000000000.0, 1000000000.0] and parameters: {'p_sma': 7, 'p_std': 27, 'p_atr': 23, 'p_adx': 14, 'rsi_period': 78, 'ema1': 15, 'ema2': 28, 'slip_atr_k': 0.049773667128015994, 'slip_spread_k': 0.20200768837929578, 'spread_hl_frac': 0.029844263310986736, 'bb_std_mult': 2.788106676615362, 'rsi_os': 48, 'rsi_ob': 76, 'vol_spike': 0.14508491582655825, 'adx_thresh': 12.93009878530243, 'atr_min_pct': 0.017226738663941817, 'atr_max_pct': 0.06664261562934505, 'tp_mult': 1.9367386413620378, 'tsl_mult': 0.4937267684281123, 'strategy': 'mean_reversion', 'time_stop': 203, 'use_sma': True, 'use_atr': False, 'use_adx': True, 'use_ema': True, 'use_spike': True, 'rsi_required': False, 'edge_k': 1.1260870588912153, 'edge_cap': 0.3499731969993115, 'bull_strategy': 'breakout', 'bull_bb_std_mult': 1.488219131756517, 'bull_rsi_os': 44, 'bull_rsi_ob': 61, 'bull_adx_thresh': 25.597857527088134, 'bull_atr_min_pct': 0.018042348752545182, 'bull_atr_max_pct': 0.11203922572766964, 'bull_tp_mult': 1.6200456687641924, 'bull_tsl_mult': 0.7416829304067379, 'bull_time_stop': 36, 'bull_use_sma': True, 'bull_use_ema': True, 'bull_use_atr': True, 'bull_use_adx': True, 'bull_use_spike': True, 'bull_rsi_required': True, 'bear_strategy': 'mean_reversion', 'bear_bb_std_mult': 2.2843099992108975, 'bear_rsi_os': 36, 'bear_rsi_ob': 93, 'bear_adx_thresh': 31.121252328367774, 'bear_atr_min_pct': 0.002325076248261927, 'bear_atr_max_pct': 0.11438661095851661, 'bear_tp_mult': 2.398918969010578, 'bear_tsl_mult': 0.34447858354410127, 'bear_time_stop': 295, 'bear_use_sma': False, 'bear_use_ema': False, 'bear_use_atr': False, 'bear_use_adx': True, 'bear_use_spike': True, 'bear_rsi_required': True, 'sideways_strategy': 'breakout', 'sideways_bb_std_mult': 1.782181578409979, 'sideways_rsi_os': 42, 'sideways_rsi_ob': 76, 'sideways_adx_thresh': 22.56980154873126, 'sideways_atr_min_pct': 0.003004080373699463, 'sideways_atr_max_pct': 0.11916970195830624, 'sideways_tp_mult': 2.7842336521538726, 'sideways_tsl_mult': 0.15577010468611227, 'sideways_time_stop': 37, 'sideways_use_sma': True, 'sideways_use_ema': True, 'sideways_use_atr': False, 'sideways_use_adx': True, 'sideways_use_spike': True, 'sideways_rsi_required': True}.
[I 2025-08-30 16:43:44,833] Trial 851 finished with values: [-1000000000.0, 1000000000.0] and parameters: {'p_sma': 7, 'p_std': 54, 'p_atr': 8, 'p_adx': 11, 'rsi_period': 78, 'ema1': 15, 'ema2': 58, 'slip_atr_k': 0.06561311389185165, 'slip_spread_k': 0.346402355448837, 'spread_hl_frac': 0.026374309937716483, 'bb_std_mult': 2.315420316572694, 'rsi_os': 48, 'rsi_ob': 75, 'vol_spike': 0.156345078974979, 'adx_thresh': 10.075899459565628, 'atr_min_pct': 0.016157910370368497, 'atr_max_pct': 0.07158912998989918, 'tp_mult': 1.7338938500519816, 'tsl_mult': 0.35916969559991624, 'strategy': 'mean_reversion', 'time_stop': 202, 'use_sma': True, 'use_atr': False, 'use_adx': False, 'use_ema': True, 'use_spike': True, 'rsi_required': False, 'edge_k': 0.31993092763304587, 'edge_cap': 0.15346345839679515, 'bull_strategy': 'breakout', 'bull_bb_std_mult': 0.825893451322621, 'bull_rsi_os': 42, 'bull_rsi_ob': 60, 'bull_adx_thresh': 17.0447266401286, 'bull_atr_min_pct': 0.02267443501239038, 'bull_atr_max_pct': 0.09087191329385268, 'bull_tp_mult': 1.6442574818342617, 'bull_tsl_mult': 0.10507964208615747, 'bull_time_stop': 24, 'bull_use_sma': True, 'bull_use_ema': True, 'bull_use_atr': True, 'bull_use_adx': True, 'bull_use_spike': True, 'bull_rsi_required': True, 'bear_strategy': 'mean_reversion', 'bear_bb_std_mult': 1.3844138230211334, 'bear_rsi_os': 23, 'bear_rsi_ob': 57, 'bear_adx_thresh': 29.444782308061647, 'bear_atr_min_pct': 0.021800258514090773, 'bear_atr_max_pct': 0.06953331172597187, 'bear_tp_mult': 1.7483699823892653, 'bear_tsl_mult': 0.6335841484816053, 'bear_time_stop': 248, 'bear_use_sma': False, 'bear_use_ema': False, 'bear_use_atr': True, 'bear_use_adx': True, 'bear_use_spike': True, 'bear_rsi_required': True, 'sideways_strategy': 'breakout', 'sideways_bb_std_mult': 2.970758200178336, 'sideways_rsi_os': 37, 'sideways_rsi_ob': 63, 'sideways_adx_thresh': 19.302393867840678, 'sideways_atr_min_pct': 0.0012748313079229126, 'sideways_atr_max_pct': 0.1243392786244382, 'sideways_tp_mult': 2.958974490048881, 'sideways_tsl_mult': 0.9158104116703443, 'sideways_time_stop': 93, 'sideways_use_sma': True, 'sideways_use_ema': True, 'sideways_use_atr': False, 'sideways_use_adx': True, 'sideways_use_spike': True, 'sideways_rsi_required': True}.
[I 2025-08-30 16:43:46,998] Trial 856 finished with values: [-1000000000.0, 1000000000.0] and parameters: {'p_sma': 11, 'p_std': 25, 'p_atr': 22, 'p_adx': 8, 'rsi_period': 80, 'ema1': 9, 'ema2': 28, 'slip_atr_k': 0.05344307542783371, 'slip_spread_k': 0.22619277079996072, 'spread_hl_frac': 0.02755416246245836, 'bb_std_mult': 2.7376711242429463, 'rsi_os': 51, 'rsi_ob': 77, 'vol_spike': 0.13553344177942284, 'adx_thresh': 12.972748937858029, 'atr_min_pct': 0.016873110559016153, 'atr_max_pct': 0.06894699714430154, 'tp_mult': 1.903176159410784, 'tsl_mult': 0.5093618413545252, 'strategy': 'mean_reversion', 'time_stop': 210, 'use_sma': True, 'use_atr': True, 'use_adx': True, 'use_ema': True, 'use_spike': True, 'rsi_required': False, 'edge_k': 1.0868658294811717, 'edge_cap': 0.15543205962769496, 'bull_strategy': 'breakout', 'bull_bb_std_mult': 1.7081460348649184, 'bull_rsi_os': 44, 'bull_rsi_ob': 60, 'bull_adx_thresh': 26.089278260637542, 'bull_atr_min_pct': 0.018688791944357866, 'bull_atr_max_pct': 0.12096392241023789, 'bull_tp_mult': 1.647976916553541, 'bull_tsl_mult': 0.19279010421425802, 'bull_time_stop': 33, 'bull_use_sma': True, 'bull_use_ema': True, 'bull_use_atr': True, 'bull_use_adx': True, 'bull_use_spike': False, 'bull_rsi_required': True, 'bear_strategy': 'mean_reversion', 'bear_bb_std_mult': 2.274827777984338, 'bear_rsi_os': 36, 'bear_rsi_ob': 91, 'bear_adx_thresh': 30.278162983459996, 'bear_atr_min_pct': 0.0011499280313969542, 'bear_atr_max_pct': 0.12355568775270971, 'bear_tp_mult': 2.516017716019051, 'bear_tsl_mult': 0.24455146492292246, 'bear_time_stop': 290, 'bear_use_sma': False, 'bear_use_ema': False, 'bear_use_atr': False, 'bear_use_adx': True, 'bear_use_spike': True, 'bear_rsi_required': False, 'sideways_strategy': 'breakout', 'sideways_bb_std_mult': 1.803734096994222, 'sideways_rsi_os': 42, 'sideways_rsi_ob': 79, 'sideways_adx_thresh': 22.2123158405311, 'sideways_atr_min_pct': 0.002456490070097879, 'sideways_atr_max_pct': 0.11838724595101868, 'sideways_tp_mult': 2.858105927252482, 'sideways_tsl_mult': 0.13711326640673172, 'sideways_time_stop': 33, 'sideways_use_sma': False, 'sideways_use_ema': True, 'sideways_use_atr': False, 'sideways_use_adx': True, 'sideways_use_spike': True, 'sideways_rsi_required': True}.
