[I 2025-08-30 16:40:09,437] Trial 836 finished with values: [-1000000000.0, 1000000000.0] and parameters: {'p_sma': 22, 'p_std': 56, 'p_atr': 24, 'p_adx': 12, 'rsi_period': 58, 'ema1': 22, 'ema2': 32, 'slip_atr_k': 0.08379166981969043, 'slip_spread_k': 0.2136971182068067, 'spread_hl_frac': 0.033883242513523634, 'bb_std_mult': 2.0981909374767653, 'rsi_os': 7, 'rsi_ob': 71, 'vol_spike': 0.17245749031306598, 'adx_thresh': 6.129062703166218, 'atr_min_pct': 0.02073052732130044, 'atr_max_pct': 0.0530139166680266, 'tp_mult': 1.6860184187847334, 'tsl_mult': 0.23676748079919546, 'strategy': 'mean_reversion', 'time_stop': 296, 'use_sma': True, 'use_atr': True, 'use_adx': False, 'use_ema': True, 'use_spike': True, 'rsi_required': False, 'edge_k': 1.3416416730215996, 'edge_cap': 0.6305401285155726, 'bull_strategy': 'breakout', 'bull_bb_std_mult': 1.28934901245177, 'bull_rsi_os': 40, 'bull_rsi_ob': 63, 'bull_adx_thresh': 22.434919715795434, 'bull_atr_min_pct': 0.020370647221631455, 'bull_atr_max_pct': 0.08856337992967031, 'bull_tp_mult': 2.612136116969544, 'bull_tsl_mult': 0.1553685822060094, 'bull_time_stop': 16, 'bull_use_sma': True, 'bull_use_ema': True, 'bull_use_atr': True, 'bull_use_adx': True, 'bull_use_spike': True, 'bull_rsi_required': True, 'bear_strategy': 'breakout', 'bear_bb_std_mult': 2.32606671636013, 'bear_rsi_os': 51, 'bear_rsi_ob': 92, 'bear_adx_thresh': 28.909220770452208, 'bear_atr_min_pct': 0.007461754221281546, 'bear_atr_max_pct': 0.0779923971350842, 'bear_tp_mult': 2.726726651639596, 'bear_tsl_mult': 0.8485301737787633, 'bear_time_stop': 127, 'bear_use_sma': False, 'bear_use_ema': False, 'bear_use_atr': True, 'bear_use_adx': True, 'bear_use_spike': True, 'bear_rsi_required': True, 'sideways_strategy': 'breakout', 'sideways_bb_std_mult': 0.5497648362396159, 'sideways_rsi_os': 40, 'sideways_rsi_ob': 61, 'sideways_adx_thresh': 14.008215558720364, 'sideways_atr_min_pct': 0.008604735964304562, 'sideways_atr_max_pct': 0.05818277371238856, 'sideways_tp_mult': 1.6564034831080203, 'sideways_tsl_mult': 0.505795419154841, 'sideways_time_stop': 118, 'sideways_use_sma': True, 'sideways_use_ema': True, 'sideways_use_atr': False, 'sideways_use_adx': True, 'sideways_use_spike': True, 'sideways_rsi_required': True}.
[I 2025-08-30 16:40:58,180] Trial 839 finished with values: [-0.09010098358462981, 0.09003104961675622] and parameters: {'p_sma': 34, 'p_std': 56, 'p_atr': 26, 'p_adx': 21, 'rsi_period': 76, 'ema1': 22, 'ema2': 46, 'slip_atr_k': 0.11683655904182523, 'slip_spread_k': 0.9124940800714452, 'spread_hl_frac': 0.023054668136276546, 'bb_std_mult': 3.05308242264507, 'rsi_os': 11, 'rsi_ob': 72, 'vol_spike': 0.15692557100342697, 'adx_thresh': 5.01264742823847, 'atr_min_pct': 0.014112923443976381, 'atr_max_pct': 0.13482823643457634, 'tp_mult': 2.9428968383400536, 'tsl_mult': 0.24327300260284013, 'strategy': 'mean_reversion', 'time_stop': 208, 'use_sma': True, 'use_atr': False, 'use_adx': False, 'use_ema': False, 'use_spike': True, 'rsi_required': False, 'edge_k': 1.4212046708694608, 'edge_cap': 0.6361702107410161, 'bull_strategy': 'breakout', 'bull_bb_std_mult': 3.171672129120304, 'bull_rsi_os': 39, 'bull_rsi_ob': 62, 'bull_adx_thresh': 23.01059488500913, 'bull_atr_min_pct': 0.020395656436978375, 'bull_atr_max_pct': 0.028195408644381754, 'bull_tp_mult': 2.1118106392701486, 'bull_tsl_mult': 0.22582558381126522, 'bull_time_stop': 23, 'bull_use_sma': True, 'bull_use_ema': True, 'bull_use_atr': True, 'bull_use_adx': True, 'bull_use_spike': True, 'bull_rsi_required': True, 'bear_strategy': 'breakout', 'bear_bb_std_mult': 2.316257063824239, 'bear_rsi_os': 34, 'bear_rsi_ob': 55, 'bear_adx_thresh': 28.897879770139866, 'bear_atr_min_pct': 0.021511159201254494, 'bear_atr_max_pct': 0.08071990437527729, 'bear_tp_mult': 2.2700875377664604, 'bear_tsl_mult': 0.844737780023475, 'bear_time_stop': 252, 'bear_use_sma': False, 'bear_use_ema': False, 'bear_use_atr': True, 'bear_use_adx': True, 'bear_use_spike': True, 'bear_rsi_required': True, 'sideways_strategy': 'mean_reversion', 'sideways_bb_std_mult': 1.5467003239410617, 'sideways_rsi_os': 12, 'sideways_rsi_ob': 45, 'sideways_adx_thresh': 5.99614259122453, 'sideways_atr_min_pct': 3.441474618728771e-05, 'sideways_atr_max_pct': 0.011519723727646411, 'sideways_tp_mult': 1.8467910212396583, 'sideways_tsl_mult': 0.969254478790479, 'sideways_time_stop': 104, 'sideways_use_sma': True, 'sideways_use_ema': True, 'sideways_use_atr': False, 'sideways_use_adx': True, 'sideways_use_spike': False, 'sideways_rsi_required': True}.
[I 2025-08-30 16:40:59,145] Trial 840 finished with values: [-1000000000.0, 1000000000.0] and parameters: {'p_sma': 36, 'p_std': 57, 'p_atr': 26, 'p_adx': 20, 'rsi_period': 36, 'ema1': 23, 'ema2': 24, 'slip_atr_k': 0.11759347483635749, 'slip_spread_k': 0.9106737587198888, 'spread_hl_frac': 0.03404930656515656, 'bb_std_mult': 2.205075650978453, 'rsi_os': 39, 'rsi_ob': 71, 'vol_spike': 0.20239130613950307, 'adx_thresh': 16.037547143824135, 'atr_min_pct': 0.00689170975960751, 'atr_max_pct': 0.1354029230579754, 'tp_mult': 1.7771859276589446, 'tsl_mult': 0.4643529129921984, 'strategy': 'mean_reversion', 'time_stop': 262, 'use_sma': True, 'use_atr': False, 'use_adx': False, 'use_ema': False, 'use_spike': True, 'rsi_required': False, 'edge_k': 1.7318754424184735, 'edge_cap': 0.7386951807268964, 'bull_strategy': 'breakout', 'bull_bb_std_mult': 2.066290229772532, 'bull_rsi_os': 13, 'bull_rsi_ob': 66, 'bull_adx_thresh': 22.721185294763902, 'bull_atr_min_pct': 0.02075402010644206, 'bull_atr_max_pct': 0.10437081143808145, 'bull_tp_mult': 2.1226680087777905, 'bull_tsl_mult': 0.09941253606516823, 'bull_time_stop': 223, 'bull_use_sma': True, 'bull_use_ema': True, 'bull_use_atr': True, 'bull_use_adx': True, 'bull_use_spike': True, 'bull_rsi_required': True, 'bear_strategy': 'breakout', 'bear_bb_std_mult': 2.6225185673672025, 'bear_rsi_os': 43, 'bear_rsi_ob': 55, 'bear_adx_thresh': 28.9346085313083, 'bear_atr_min_pct': 0.02126261884450597, 'bear_atr_max_pct': 0.07360622540262446, 'bear_tp_mult': 2.8222728682702374, 'bear_tsl_mult': 0.37556871949870824, 'bear_time_stop': 266, 'bear_use_sma': False, 'bear_use_ema': False, 'bear_use_atr': True, 'bear_use_adx': True, 'bear_use_spike': True, 'bear_rsi_required': False, 'sideways_strategy': 'mean_reversion', 'sideways_bb_std_mult': 1.5969763783472863, 'sideways_rsi_os': 12, 'sideways_rsi_ob': 53, 'sideways_adx_thresh': 21.67960107554201, 'sideways_atr_min_pct': 0.0015117138997546274, 'sideways_atr_max_pct': 0.10488830934646932, 'sideways_tp_mult': 1.6762587209234288, 'sideways_tsl_mult': 0.9231957734031645, 'sideways_time_stop': 60, 'sideways_use_sma': True, 'sideways_use_ema': True, 'sideways_use_atr': False, 'sideways_use_adx': True, 'sideways_use_spike': False, 'sideways_rsi_required': True}.
[I 2025-08-30 16:41:01,265] Trial 838 finished with values: [-1000000000.0, 1000000000.0] and parameters: {'p_sma': 34, 'p_std': 57, 'p_atr': 10, 'p_adx': 20, 'rsi_period': 76, 'ema1': 22, 'ema2': 32, 'slip_atr_k': 0.14317808566587853, 'slip_spread_k': 0.9425911946405234, 'spread_hl_frac': 0.04080665155232204, 'bb_std_mult': 2.202940140207154, 'rsi_os': 39, 'rsi_ob': 69, 'vol_spike': 0.1774334872552181, 'adx_thresh': 17.59940743274903, 'atr_min_pct': 0.006990379057695499, 'atr_max_pct': 0.13416370127457217, 'tp_mult': 1.7793665489904926, 'tsl_mult': 0.5873397603598429, 'strategy': 'mean_reversion', 'time_stop': 208, 'use_sma': True, 'use_atr': True, 'use_adx': False, 'use_ema': False, 'use_spike': True, 'rsi_required': False, 'edge_k': 1.7371613890634117, 'edge_cap': 0.628669946688236, 'bull_strategy': 'breakout', 'bull_bb_std_mult': 1.8374708442128485, 'bull_rsi_os': 49, 'bull_rsi_ob': 58, 'bull_adx_thresh': 22.44998172543914, 'bull_atr_min_pct': 0.020411999085270666, 'bull_atr_max_pct': 0.08801178985035135, 'bull_tp_mult': 1.3399002152956312, 'bull_tsl_mult': 0.04393719056975426, 'bull_time_stop': 21, 'bull_use_sma': True, 'bull_use_ema': True, 'bull_use_atr': True, 'bull_use_adx': True, 'bull_use_spike': True, 'bull_rsi_required': True, 'bear_strategy': 'breakout', 'bear_bb_std_mult': 2.336257586494217, 'bear_rsi_os': 43, 'bear_rsi_ob': 65, 'bear_adx_thresh': 28.795848354225733, 'bear_atr_min_pct': 0.02262459742323721, 'bear_atr_max_pct': 0.07311118405250322, 'bear_tp_mult': 2.8200990772377645, 'bear_tsl_mult': 0.3731701917475033, 'bear_time_stop': 236, 'bear_use_sma': False, 'bear_use_ema': False, 'bear_use_atr': True, 'bear_use_adx': True, 'bear_use_spike': True, 'bear_rsi_required': False, 'sideways_strategy': 'mean_reversion', 'sideways_bb_std_mult': 1.2067472976780136, 'sideways_rsi_os': 40, 'sideways_rsi_ob': 60, 'sideways_adx_thresh': 14.907520334008778, 'sideways_atr_min_pct': 0.01635958274914708, 'sideways_atr_max_pct': 0.010505916251220507, 'sideways_tp_mult': 2.925306106485199, 'sideways_tsl_mult': 0.5011597322312467, 'sideways_time_stop': 100, 'sideways_use_sma': True, 'sideways_use_ema': True, 'sideways_use_atr': False, 'sideways_use_adx': True, 'sideways_use_spike': True, 'sideways_rsi_required': True}.
[I 2025-08-30 16:41:01,276] Trial 841 finished with values: [-1000000000.0, 1000000000.0] and parameters: {'p_sma': 34, 'p_std': 25, 'p_atr': 27, 'p_adx': 21, 'rsi_period': 7, 'ema1': 23, 'ema2': 44, 'slip_atr_k': 0.06517486121322309, 'slip_spread_k': 0.1305537173311667, 'spread_hl_frac': 0.027096010846858202, 'bb_std_mult': 3.042334390874075, 'rsi_os': 41, 'rsi_ob': 70, 'vol_spike': 0.014114384876771718, 'adx_thresh': 34.87138708455541, 'atr_min_pct': 0.01704418308372248, 'atr_max_pct': 0.13436160549972023, 'tp_mult': 1.484462471187614, 'tsl_mult': 0.4621184281320822, 'strategy': 'mean_reversion', 'time_stop': 265, 'use_sma': True, 'use_atr': False, 'use_adx': False, 'use_ema': False, 'use_spike': True, 'rsi_required': False, 'edge_k': 1.4407256194880915, 'edge_cap': 0.5773689308446386, 'bull_strategy': 'breakout', 'bull_bb_std_mult': 0.9275766369203792, 'bull_rsi_os': 39, 'bull_rsi_ob': 66, 'bull_adx_thresh': 23.22810996470176, 'bull_atr_min_pct': 0.020945606887991682, 'bull_atr_max_pct': 0.12521976331343668, 'bull_tp_mult': 2.1178826001317606, 'bull_tsl_mult': 0.22302239649754804, 'bull_time_stop': 225, 'bull_use_sma': True, 'bull_use_ema': True, 'bull_use_atr': True, 'bull_use_adx': True, 'bull_use_spike': True, 'bull_rsi_required': True, 'bear_strategy': 'mean_reversion', 'bear_bb_std_mult': 2.624752950181609, 'bear_rsi_os': 32, 'bear_rsi_ob': 82, 'bear_adx_thresh': 34.53833990710774, 'bear_atr_min_pct': 0.02151069752151829, 'bear_atr_max_pct': 0.07379905164006968, 'bear_tp_mult': 2.82468677159319, 'bear_tsl_mult': 0.3975100860058087, 'bear_time_stop': 253, 'bear_use_sma': False, 'bear_use_ema': False, 'bear_use_atr': True, 'bear_use_adx': True, 'bear_use_spike': True, 'bear_rsi_required': False, 'sideways_strategy': 'mean_reversion', 'sideways_bb_std_mult': 1.5675896923640562, 'sideways_rsi_os': 39, 'sideways_rsi_ob': 60, 'sideways_adx_thresh': 25.554498207813577, 'sideways_atr_min_pct': 0.021200725301916405, 'sideways_atr_max_pct': 0.011424130363448082, 'sideways_tp_mult': 2.866791695345732, 'sideways_tsl_mult': 0.9672627207810742, 'sideways_time_stop': 86, 'sideways_use_sma': True, 'sideways_use_ema': True, 'sideways_use_atr': False, 'sideways_use_adx': True, 'sideways_use_spike': False, 'sideways_rsi_required': True}.
[I 2025-08-30 16:41:49,226] Trial 844 finished with values: [-1000000000.0, 1000000000.0] and parameters: {'p_sma': 47, 'p_std': 18, 'p_atr': 25, 'p_adx': 19, 'rsi_period': 73, 'ema1': 24, 'ema2': 22, 'slip_atr_k': 0.07302772988722551, 'slip_spread_k': 0.035437787912176694, 'spread_hl_frac': 0.025136978035959292, 'bb_std_mult': 1.789686781309623, 'rsi_os': 37, 'rsi_ob': 76, 'vol_spike': 0.043635417929168654, 'adx_thresh': 14.262204291497186, 'atr_min_pct': 0.014786442349333483, 'atr_max_pct': 0.07671223490672517, 'tp_mult': 1.7451290791833587, 'tsl_mult': 0.020137536597841954, 'strategy': 'mean_reversion', 'time_stop': 175, 'use_sma': True, 'use_atr': True, 'use_adx': False, 'use_ema': True, 'use_spike': False, 'rsi_required': False, 'edge_k': 1.913444029583197, 'edge_cap': 0.07566764013119509, 'bull_strategy': 'breakout', 'bull_bb_std_mult': 3.54945415807446, 'bull_rsi_os': 37, 'bull_rsi_ob': 60, 'bull_adx_thresh': 19.41826690800148, 'bull_atr_min_pct': 0.018622725149853227, 'bull_atr_max_pct': 0.09450850886774602, 'bull_tp_mult': 2.9419206330723453, 'bull_tsl_mult': 0.06374877717994593, 'bull_time_stop': 50, 'bull_use_sma': True, 'bull_use_ema': True, 'bull_use_atr': True, 'bull_use_adx': True, 'bull_use_spike': False, 'bull_rsi_required': True, 'bear_strategy': 'mean_reversion', 'bear_bb_std_mult': 2.4971051513877174, 'bear_rsi_os': 32, 'bear_rsi_ob': 79, 'bear_adx_thresh': 31.934079446342576, 'bear_atr_min_pct': 0.02099486585290464, 'bear_atr_max_pct': 0.10823601792795862, 'bear_tp_mult': 2.788636853261477, 'bear_tsl_mult': 0.3139054507009699, 'bear_time_stop': 106, 'bear_use_sma': False, 'bear_use_ema': False, 'bear_use_atr': True, 'bear_use_adx': True, 'bear_use_spike': True, 'bear_rsi_required': True, 'sideways_strategy': 'breakout', 'sideways_bb_std_mult': 0.7294210355363395, 'sideways_rsi_os': 21, 'sideways_rsi_ob': 72, 'sideways_adx_thresh': 30.478141983296233, 'sideways_atr_min_pct': 0.0005602222000180632, 'sideways_atr_max_pct': 0.10339507961513072, 'sideways_tp_mult': 2.9589349409311563, 'sideways_tsl_mult': 0.19232391864884868, 'sideways_time_stop': 72, 'sideways_use_sma': False, 'sideways_use_ema': False, 'sideways_use_atr': False, 'sideways_use_adx': True, 'sideways_use_spike': True, 'sideways_rsi_required': True}.
[I 2025-08-30 16:41:51,323] Trial 843 finished with values: [-1000000000.0, 1000000000.0] and parameters: {'p_sma': 6, 'p_std': 7, 'p_atr': 27, 'p_adx': 28, 'rsi_period': 81, 'ema1': 24, 'ema2': 33, 'slip_atr_k': 0.1412607035564975, 'slip_spread_k': 0.03226832153762493, 'spread_hl_frac': 0.012178841756294743, 'bb_std_mult': 2.5617104264724597, 'rsi_os': 41, 'rsi_ob': 76, 'vol_spike': 0.18809917083635422, 'adx_thresh': 14.72069937280198, 'atr_min_pct': 0.024224037030852724, 'atr_max_pct': 0.07593960971824154, 'tp_mult': 1.7884386645759218, 'tsl_mult': 0.01461920080001844, 'strategy': 'mean_reversion', 'time_stop': 212, 'use_sma': True, 'use_atr': True, 'use_adx': False, 'use_ema': True, 'use_spike': True, 'rsi_required': False, 'edge_k': 0.4362078164480834, 'edge_cap': 0.5709676197210375, 'bull_strategy': 'breakout', 'bull_bb_std_mult': 0.9337864852875575, 'bull_rsi_os': 20, 'bull_rsi_ob': 58, 'bull_adx_thresh': 6.3283899118815885, 'bull_atr_min_pct': 0.019407578412745933, 'bull_atr_max_pct': 0.09323171848208339, 'bull_tp_mult': 2.118305562688064, 'bull_tsl_mult': 0.06059764110703886, 'bull_time_stop': 34, 'bull_use_sma': True, 'bull_use_ema': True, 'bull_use_atr': True, 'bull_use_adx': True, 'bull_use_spike': False, 'bull_rsi_required': True, 'bear_strategy': 'mean_reversion', 'bear_bb_std_mult': 2.5066031278189103, 'bear_rsi_os': 32, 'bear_rsi_ob': 59, 'bear_adx_thresh': 27.66453461481038, 'bear_atr_min_pct': 0.00983085145354241, 'bear_atr_max_pct': 0.057382540138930294, 'bear_tp_mult': 2.81328993152391, 'bear_tsl_mult': 0.3126475621846714, 'bear_time_stop': 271, 'bear_use_sma': False, 'bear_use_ema': False, 'bear_use_atr': True, 'bear_use_adx': True, 'bear_use_spike': True, 'bear_rsi_required': True, 'sideways_strategy': 'breakout', 'sideways_bb_std_mult': 0.7177912412901377, 'sideways_rsi_os': 38, 'sideways_rsi_ob': 60, 'sideways_adx_thresh': 24.66627340809685, 'sideways_atr_min_pct': 0.02832195171406806, 'sideways_atr_max_pct': 0.10376545271419378, 'sideways_tp_mult': 2.83502333378818, 'sideways_tsl_mult': 0.9720991380631165, 'sideways_time_stop': 87, 'sideways_use_sma': False, 'sideways_use_ema': True, 'sideways_use_atr': False, 'sideways_use_adx': True, 'sideways_use_spike': True, 'sideways_rsi_required': True}.
[I 2025-08-30 16:41:52,365] Trial 842 finished with values: [-1000000000.0, 1000000000.0] and parameters: {'p_sma': 6, 'p_std': 57, 'p_atr': 27, 'p_adx': 20, 'rsi_period': 36, 'ema1': 23, 'ema2': 33, 'slip_atr_k': 0.20356990010851606, 'slip_spread_k': 0.12887053794109088, 'spread_hl_frac': 0.02520070904162305, 'bb_std_mult': 2.186040290919345, 'rsi_os': 39, 'rsi_ob': 72, 'vol_spike': 0.14981015606825684, 'adx_thresh': 34.90711300876568, 'atr_min_pct': 0.02713489912010466, 'atr_max_pct': 0.08277446441153344, 'tp_mult': 2.3913861697319163, 'tsl_mult': 0.017130839643677842, 'strategy': 'mean_reversion', 'time_stop': 212, 'use_sma': True, 'use_atr': True, 'use_adx': False, 'use_ema': False, 'use_spike': True, 'rsi_required': False, 'edge_k': 0.4438414950353705, 'edge_cap': 0.5770304971379574, 'bull_strategy': 'breakout', 'bull_bb_std_mult': 0.9144547798067498, 'bull_rsi_os': 41, 'bull_rsi_ob': 95, 'bull_adx_thresh': 7.771744225539756, 'bull_atr_min_pct': 0.027147321981003954, 'bull_atr_max_pct': 0.09362110319890864, 'bull_tp_mult': 2.6669077061745394, 'bull_tsl_mult': 0.05111774817769874, 'bull_time_stop': 49, 'bull_use_sma': True, 'bull_use_ema': True, 'bull_use_atr': True, 'bull_use_adx': True, 'bull_use_spike': True, 'bull_rsi_required': True, 'bear_strategy': 'mean_reversion', 'bear_bb_std_mult': 2.587278709930635, 'bear_rsi_os': 42, 'bear_rsi_ob': 83, 'bear_adx_thresh': 27.51797253170713, 'bear_atr_min_pct': 0.004925089588573373, 'bear_atr_max_pct': 0.07374987384389856, 'bear_tp_mult': 2.819503092885496, 'bear_tsl_mult': 0.37231538217322946, 'bear_time_stop': 106, 'bear_use_sma': False, 'bear_use_ema': False, 'bear_use_atr': True, 'bear_use_adx': True, 'bear_use_spike': True, 'bear_rsi_required': False, 'sideways_strategy': 'mean_reversion', 'sideways_bb_std_mult': 1.1990940019280054, 'sideways_rsi_os': 39, 'sideways_rsi_ob': 60, 'sideways_adx_thresh': 25.733089147844314, 'sideways_atr_min_pct': 0.0017436110564946969, 'sideways_atr_max_pct': 0.10545808490992202, 'sideways_tp_mult': 1.2931177204132824, 'sideways_tsl_mult': 0.922198931316156, 'sideways_time_stop': 74, 'sideways_use_sma': True, 'sideways_use_ema': True, 'sideways_use_atr': False, 'sideways_use_adx': True, 'sideways_use_spike': False, 'sideways_rsi_required': True}.
[I 2025-08-30 16:41:53,349] Trial 845 finished with values: [-1000000000.0, 1000000000.0] and parameters: {'p_sma': 18, 'p_std': 13, 'p_atr': 25, 'p_adx': 17, 'rsi_period': 20, 'ema1': 24, 'ema2': 22, 'slip_atr_k': 0.0767807988781137, 'slip_spread_k': 0.11675922700841111, 'spread_hl_frac': 0.025110804483901978, 'bb_std_mult': 2.5738872727826636, 'rsi_os': 37, 'rsi_ob': 76, 'vol_spike': 0.14929707259271635, 'adx_thresh': 14.825919889003961, 'atr_min_pct': 0.014778996230229866, 'atr_max_pct': 0.07630119379274439, 'tp_mult': 2.306869811827699, 'tsl_mult': 0.023507167883078328, 'strategy': 'mean_reversion', 'time_stop': 247, 'use_sma': True, 'use_atr': True, 'use_adx': False, 'use_ema': True, 'use_spike': False, 'rsi_required': False, 'edge_k': 0.44607792431944965, 'edge_cap': 0.20638931672741645, 'bull_strategy': 'breakout', 'bull_bb_std_mult': 0.6269809216015125, 'bull_rsi_os': 37, 'bull_rsi_ob': 95, 'bull_adx_thresh': 5.737127623944165, 'bull_atr_min_pct': 0.01938870887894089, 'bull_atr_max_pct': 0.09350347524027278, 'bull_tp_mult': 2.8367964370286898, 'bull_tsl_mult': 0.38865136648588283, 'bull_time_stop': 49, 'bull_use_sma': True, 'bull_use_ema': True, 'bull_use_atr': True, 'bull_use_adx': True, 'bull_use_spike': False, 'bull_rsi_required': True, 'bear_strategy': 'mean_reversion', 'bear_bb_std_mult': 2.4950650677897017, 'bear_rsi_os': 32, 'bear_rsi_ob': 79, 'bear_adx_thresh': 27.55557727309207, 'bear_atr_min_pct': 0.004833385129841888, 'bear_atr_max_pct': 0.10837328187609226, 'bear_tp_mult': 1.1908797127917525, 'bear_tsl_mult': 0.2898464844924669, 'bear_time_stop': 150, 'bear_use_sma': False, 'bear_use_ema': False, 'bear_use_atr': True, 'bear_use_adx': True, 'bear_use_spike': True, 'bear_rsi_required': True, 'sideways_strategy': 'breakout', 'sideways_bb_std_mult': 0.7281060765024243, 'sideways_rsi_os': 38, 'sideways_rsi_ob': 49, 'sideways_adx_thresh': 24.65838429714269, 'sideways_atr_min_pct': 0.003358828361104899, 'sideways_atr_max_pct': 0.10326184085081747, 'sideways_tp_mult': 1.3352095208171861, 'sideways_tsl_mult': 0.9458358384125786, 'sideways_time_stop': 75, 'sideways_use_sma': False, 'sideways_use_ema': False, 'sideways_use_atr': False, 'sideways_use_adx': True, 'sideways_use_spike': True, 'sideways_rsi_required': True}.
