[I 2025-08-30 14:34:53,725] Trial 118 finished with values: [-1000000000.0, 1000000000.0] and parameters: {'p_sma': 33, 'p_std': 27, 'p_atr': 22, 'p_adx': 29, 'rsi_period': 34, 'ema1': 17, 'ema2': 56, 'slip_atr_k': 0.14574141988101919, 'slip_spread_k': 0.7748579937459745, 'spread_hl_frac': 0.02121593307051713, 'bb_std_mult': 2.1783757849270837, 'rsi_os': 6, 'rsi_ob': 47, 'vol_spike': 0.25717013188557203, 'adx_thresh': 20.440018754710415, 'atr_min_pct': 0.024044939921135672, 'atr_max_pct': 0.09909796652456736, 'tp_mult': 1.4718452587789135, 'tsl_mult': 0.03320495202854301, 'strategy': 'breakout', 'time_stop': 40, 'use_sma': True, 'use_atr': False, 'use_adx': True, 'use_ema': False, 'use_spike': False, 'rsi_required': True, 'edge_k': 1.1975690798769916, 'edge_cap': 0.7181153301478156, 'bull_strategy': 'mean_reversion', 'bull_bb_std_mult': 0.9699762127820375, 'bull_rsi_os': 19, 'bull_rsi_ob': 79, 'bull_adx_thresh': 9.582954632240408, 'bull_atr_min_pct': 0.012214141538884934, 'bull_atr_max_pct': 0.02113547032369409, 'bull_tp_mult': 2.4946288758125537, 'bull_tsl_mult': 0.56052556788808, 'bull_time_stop': 269, 'bull_use_sma': False, 'bull_use_ema': False, 'bull_use_atr': False, 'bull_use_adx': True, 'bull_use_spike': False, 'bull_rsi_required': True, 'bear_strategy': 'breakout', 'bear_bb_std_mult': 1.7442967866109393, 'bear_rsi_os': 14, 'bear_rsi_ob': 84, 'bear_adx_thresh': 16.90982332588299, 'bear_atr_min_pct': 0.011313460560244366, 'bear_atr_max_pct': 0.07339102678612863, 'bear_tp_mult': 1.9649065222632023, 'bear_tsl_mult': 0.8177357197124094, 'bear_time_stop': 225, 'bear_use_sma': False, 'bear_use_ema': False, 'bear_use_atr': False, 'bear_use_adx': False, 'bear_use_spike': True, 'bear_rsi_required': False, 'sideways_strategy': 'breakout', 'sideways_bb_std_mult': 2.9758561062485986, 'sideways_rsi_os': 22, 'sideways_rsi_ob': 86, 'sideways_adx_thresh': 12.464338181664418, 'sideways_atr_min_pct': 0.008544067375368173, 'sideways_atr_max_pct': 0.04940158493865899, 'sideways_tp_mult': 2.075008917636203, 'sideways_tsl_mult': 0.8124538873235848, 'sideways_time_stop': 81, 'sideways_use_sma': False, 'sideways_use_ema': False, 'sideways_use_atr': True, 'sideways_use_adx': False, 'sideways_use_spike': False, 'sideways_rsi_required': True}.
[I 2025-08-30 14:34:53,901] Trial 115 finished with values: [-1000000000.0, 1000000000.0] and parameters: {'p_sma': 34, 'p_std': 31, 'p_atr': 10, 'p_adx': 10, 'rsi_period': 25, 'ema1': 28, 'ema2': 53, 'slip_atr_k': 0.1574500745890454, 'slip_spread_k': 0.29677803575101896, 'spread_hl_frac': 0.03236520527461899, 'bb_std_mult': 1.81462773266164, 'rsi_os': 30, 'rsi_ob': 69, 'vol_spike': 0.25682498709099977, 'adx_thresh': 20.264121665238918, 'atr_min_pct': 0.02860068352503508, 'atr_max_pct': 0.1422574393329174, 'tp_mult': 1.4382069846663472, 'tsl_mult': 0.22015422880760732, 'strategy': 'breakout', 'time_stop': 28, 'use_sma': True, 'use_atr': False, 'use_adx': False, 'use_ema': False, 'use_spike': True, 'rsi_required': True, 'edge_k': 0.9974581724699332, 'edge_cap': 0.7169841619317789, 'bull_strategy': 'breakout', 'bull_bb_std_mult': 3.078503049509934, 'bull_rsi_os': 6, 'bull_rsi_ob': 78, 'bull_adx_thresh': 13.322949524968902, 'bull_atr_min_pct': 0.006239206833910883, 'bull_atr_max_pct': 0.021645967225966373, 'bull_tp_mult': 2.4724011477750296, 'bull_tsl_mult': 0.6920448144051476, 'bull_time_stop': 271, 'bull_use_sma': False, 'bull_use_ema': False, 'bull_use_atr': True, 'bull_use_adx': True, 'bull_use_spike': False, 'bull_rsi_required': True, 'bear_strategy': 'mean_reversion', 'bear_bb_std_mult': 1.2920058415386477, 'bear_rsi_os': 39, 'bear_rsi_ob': 50, 'bear_adx_thresh': 17.083563412160593, 'bear_atr_min_pct': 0.027407398693177064, 'bear_atr_max_pct': 0.0642227043622716, 'bear_tp_mult': 2.0260508734946616, 'bear_tsl_mult': 0.028678445239133266, 'bear_time_stop': 103, 'bear_use_sma': True, 'bear_use_ema': False, 'bear_use_atr': True, 'bear_use_adx': False, 'bear_use_spike': True, 'bear_rsi_required': False, 'sideways_strategy': 'breakout', 'sideways_bb_std_mult': 3.0057279866577007, 'sideways_rsi_os': 28, 'sideways_rsi_ob': 76, 'sideways_adx_thresh': 5.712809932402109, 'sideways_atr_min_pct': 0.013002484308667708, 'sideways_atr_max_pct': 0.13406384433399596, 'sideways_tp_mult': 1.8550054677880166, 'sideways_tsl_mult': 0.3336989823461415, 'sideways_time_stop': 230, 'sideways_use_sma': False, 'sideways_use_ema': False, 'sideways_use_atr': False, 'sideways_use_adx': True, 'sideways_use_spike': True, 'sideways_rsi_required': True}.
[I 2025-08-30 14:35:24,646] Trial 122 finished with values: [-1000000000.0, 1000000000.0] and parameters: {'p_sma': 55, 'p_std': 42, 'p_atr': 12, 'p_adx': 23, 'rsi_period': 74, 'ema1': 26, 'ema2': 31, 'slip_atr_k': 0.22555252626356773, 'slip_spread_k': 0.7161296631399026, 'spread_hl_frac': 0.043063549111686, 'bb_std_mult': 2.434911300336457, 'rsi_os': 26, 'rsi_ob': 82, 'vol_spike': 0.24571183933050345, 'adx_thresh': 6.6842802135379, 'atr_min_pct': 0.02250966402166381, 'atr_max_pct': 0.12479945952203272, 'tp_mult': 2.770025673043404, 'tsl_mult': 0.9692277657912663, 'strategy': 'mean_reversion', 'time_stop': 145, 'use_sma': True, 'use_atr': False, 'use_adx': False, 'use_ema': False, 'use_spike': False, 'rsi_required': False, 'edge_k': 0.6271328245686005, 'edge_cap': 0.579477654698162, 'bull_strategy': 'mean_reversion', 'bull_bb_std_mult': 0.8053069586930335, 'bull_rsi_os': 54, 'bull_rsi_ob': 82, 'bull_adx_thresh': 14.753834851901154, 'bull_atr_min_pct': 0.003234122942938322, 'bull_atr_max_pct': 0.09916761063137161, 'bull_tp_mult': 1.703527887549163, 'bull_tsl_mult': 0.4596386241138094, 'bull_time_stop': 227, 'bull_use_sma': False, 'bull_use_ema': False, 'bull_use_atr': True, 'bull_use_adx': False, 'bull_use_spike': False, 'bull_rsi_required': True, 'bear_strategy': 'breakout', 'bear_bb_std_mult': 2.1464090207748105, 'bear_rsi_os': 11, 'bear_rsi_ob': 63, 'bear_adx_thresh': 27.833962486881646, 'bear_atr_min_pct': 0.010650705663624846, 'bear_atr_max_pct': 0.10679749513179111, 'bear_tp_mult': 2.2664072070501415, 'bear_tsl_mult': 0.2919285645941686, 'bear_time_stop': 75, 'bear_use_sma': False, 'bear_use_ema': False, 'bear_use_atr': False, 'bear_use_adx': False, 'bear_use_spike': True, 'bear_rsi_required': False, 'sideways_strategy': 'breakout', 'sideways_bb_std_mult': 2.824436073422945, 'sideways_rsi_os': 13, 'sideways_rsi_ob': 94, 'sideways_adx_thresh': 15.641753899536123, 'sideways_atr_min_pct': 1.8564177644000632e-05, 'sideways_atr_max_pct': 0.07116547605714413, 'sideways_tp_mult': 2.7727227794492926, 'sideways_tsl_mult': 0.8838914308672745, 'sideways_time_stop': 165, 'sideways_use_sma': False, 'sideways_use_ema': False, 'sideways_use_atr': True, 'sideways_use_adx': False, 'sideways_use_spike': False, 'sideways_rsi_required': True}.
[I 2025-08-30 14:35:24,895] Trial 119 finished with values: [-1000000000.0, 1000000000.0] and parameters: {'p_sma': 30, 'p_std': 35, 'p_atr': 22, 'p_adx': 22, 'rsi_period': 25, 'ema1': 17, 'ema2': 31, 'slip_atr_k': 0.15813495521122198, 'slip_spread_k': 0.2840975155413435, 'spread_hl_frac': 0.04279462425287012, 'bb_std_mult': 2.475644915639612, 'rsi_os': 41, 'rsi_ob': 89, 'vol_spike': 0.12305833764861251, 'adx_thresh': 11.189051036557307, 'atr_min_pct': 0.0003833752060155189, 'atr_max_pct': 0.12646529987140925, 'tp_mult': 1.4066525095996127, 'tsl_mult': 0.5983111447237466, 'strategy': 'mean_reversion', 'time_stop': 30, 'use_sma': True, 'use_atr': False, 'use_adx': False, 'use_ema': False, 'use_spike': False, 'rsi_required': False, 'edge_k': 1.0807912952212575, 'edge_cap': 0.5769524164586094, 'bull_strategy': 'mean_reversion', 'bull_bb_std_mult': 0.6378566182588377, 'bull_rsi_os': 13, 'bull_rsi_ob': 75, 'bull_adx_thresh': 11.484940566808671, 'bull_atr_min_pct': 0.01008391051197137, 'bull_atr_max_pct': 0.11665384702793424, 'bull_tp_mult': 2.728727829822321, 'bull_tsl_mult': 0.564405392785239, 'bull_time_stop': 268, 'bull_use_sma': False, 'bull_use_ema': False, 'bull_use_atr': True, 'bull_use_adx': True, 'bull_use_spike': False, 'bull_rsi_required': True, 'bear_strategy': 'breakout', 'bear_bb_std_mult': 1.16252114040398, 'bear_rsi_os': 14, 'bear_rsi_ob': 84, 'bear_adx_thresh': 17.822623782408254, 'bear_atr_min_pct': 0.010549949600523021, 'bear_atr_max_pct': 0.07355392194882984, 'bear_tp_mult': 2.08918632440106, 'bear_tsl_mult': 0.8182961397534934, 'bear_time_stop': 229, 'bear_use_sma': False, 'bear_use_ema': False, 'bear_use_atr': False, 'bear_use_adx': False, 'bear_use_spike': True, 'bear_rsi_required': False, 'sideways_strategy': 'breakout', 'sideways_bb_std_mult': 3.591432390743765, 'sideways_rsi_os': 35, 'sideways_rsi_ob': 86, 'sideways_adx_thresh': 19.65086309246365, 'sideways_atr_min_pct': 0.02101785997469409, 'sideways_atr_max_pct': 0.07041563380257122, 'sideways_tp_mult': 2.2359116148318114, 'sideways_tsl_mult': 0.0011150753511673384, 'sideways_time_stop': 254, 'sideways_use_sma': False, 'sideways_use_ema': False, 'sideways_use_atr': True, 'sideways_use_adx': False, 'sideways_use_spike': False, 'sideways_rsi_required': True}.
[I 2025-08-30 14:35:25,032] Trial 120 finished with values: [-1000000000.0, 1000000000.0] and parameters: {'p_sma': 20, 'p_std': 36, 'p_atr': 10, 'p_adx': 23, 'rsi_period': 7, 'ema1': 15, 'ema2': 53, 'slip_atr_k': 0.041530415041589, 'slip_spread_k': 0.9203860294913677, 'spread_hl_frac': 0.04298344837960327, 'bb_std_mult': 1.1276626780410597, 'rsi_os': 41, 'rsi_ob': 82, 'vol_spike': 0.26883279546018424, 'adx_thresh': 19.57752342417872, 'atr_min_pct': 0.011796168019668322, 'atr_max_pct': 0.12413240161386539, 'tp_mult': 1.835470383226522, 'tsl_mult': 0.5891280118835104, 'strategy': 'mean_reversion', 'time_stop': 29, 'use_sma': True, 'use_atr': False, 'use_adx': False, 'use_ema': False, 'use_spike': False, 'rsi_required': False, 'edge_k': 1.4072602219543475, 'edge_cap': 0.75971215871758, 'bull_strategy': 'breakout', 'bull_bb_std_mult': 2.966591711093832, 'bull_rsi_os': 53, 'bull_rsi_ob': 82, 'bull_adx_thresh': 20.325530393225982, 'bull_atr_min_pct': 0.008370368017217994, 'bull_atr_max_pct': 0.11311540369718115, 'bull_tp_mult': 1.711984190985906, 'bull_tsl_mult': 0.45269512253483707, 'bull_time_stop': 54, 'bull_use_sma': False, 'bull_use_ema': False, 'bull_use_atr': True, 'bull_use_adx': True, 'bull_use_spike': False, 'bull_rsi_required': True, 'bear_strategy': 'breakout', 'bear_bb_std_mult': 1.1630741156191948, 'bear_rsi_os': 19, 'bear_rsi_ob': 55, 'bear_adx_thresh': 17.92787219227968, 'bear_atr_min_pct': 0.008904063364048746, 'bear_atr_max_pct': 0.02201173130412357, 'bear_tp_mult': 2.094835282200348, 'bear_tsl_mult': 0.14512064901503383, 'bear_time_stop': 43, 'bear_use_sma': False, 'bear_use_ema': False, 'bear_use_atr': False, 'bear_use_adx': False, 'bear_use_spike': True, 'bear_rsi_required': False, 'sideways_strategy': 'breakout', 'sideways_bb_std_mult': 3.5881579047322036, 'sideways_rsi_os': 55, 'sideways_rsi_ob': 87, 'sideways_adx_thresh': 15.69945908860198, 'sideways_atr_min_pct': 0.02113535207900412, 'sideways_atr_max_pct': 0.07124973739753475, 'sideways_tp_mult': 1.8351607102403082, 'sideways_tsl_mult': 0.05880494010789872, 'sideways_time_stop': 254, 'sideways_use_sma': False, 'sideways_use_ema': False, 'sideways_use_atr': False, 'sideways_use_adx': True, 'sideways_use_spike': True, 'sideways_rsi_required': True}.
[I 2025-08-30 14:35:25,306] Trial 121 finished with values: [-0.01849288085547507, 0.018479828200636237] and parameters: {'p_sma': 54, 'p_std': 49, 'p_atr': 10, 'p_adx': 23, 'rsi_period': 40, 'ema1': 15, 'ema2': 31, 'slip_atr_k': 0.019072383619004388, 'slip_spread_k': 0.19304360438175838, 'spread_hl_frac': 0.008892147067689775, 'bb_std_mult': 2.4798998618764783, 'rsi_os': 41, 'rsi_ob': 94, 'vol_spike': 0.10379841686694649, 'adx_thresh': 19.484724165724426, 'atr_min_pct': 0.012083226213280295, 'atr_max_pct': 0.12633260032724902, 'tp_mult': 1.85890700523706, 'tsl_mult': 0.23100410876028138, 'strategy': 'mean_reversion', 'time_stop': 29, 'use_sma': True, 'use_atr': False, 'use_adx': False, 'use_ema': False, 'use_spike': False, 'rsi_required': False, 'edge_k': 0.3667665712826156, 'edge_cap': 0.7832750392701442, 'bull_strategy': 'breakout', 'bull_bb_std_mult': 3.522480614418829, 'bull_rsi_os': 35, 'bull_rsi_ob': 75, 'bull_adx_thresh': 20.08889134733015, 'bull_atr_min_pct': 0.0033776902435465254, 'bull_atr_max_pct': 0.03409473169006068, 'bull_tp_mult': 1.8317229517109574, 'bull_tsl_mult': 0.6934321705539948, 'bull_time_stop': 259, 'bull_use_sma': False, 'bull_use_ema': False, 'bull_use_atr': True, 'bull_use_adx': True, 'bull_use_spike': False, 'bull_rsi_required': True, 'bear_strategy': 'breakout', 'bear_bb_std_mult': 0.6255157233282636, 'bear_rsi_os': 11, 'bear_rsi_ob': 55, 'bear_adx_thresh': 27.636523456308286, 'bear_atr_min_pct': 0.010574061220132446, 'bear_atr_max_pct': 0.02144275164203336, 'bear_tp_mult': 2.0885090730591926, 'bear_tsl_mult': 0.999529269269594, 'bear_time_stop': 44, 'bear_use_sma': False, 'bear_use_ema': False, 'bear_use_atr': False, 'bear_use_adx': False, 'bear_use_spike': True, 'bear_rsi_required': False, 'sideways_strategy': 'breakout', 'sideways_bb_std_mult': 3.043572849543674, 'sideways_rsi_os': 34, 'sideways_rsi_ob': 87, 'sideways_adx_thresh': 15.747511188331204, 'sideways_atr_min_pct': 0.0033690157879447758, 'sideways_atr_max_pct': 0.028030925778971177, 'sideways_tp_mult': 1.83725768953206, 'sideways_tsl_mult': 0.05358448965432391, 'sideways_time_stop': 252, 'sideways_use_sma': False, 'sideways_use_ema': False, 'sideways_use_atr': False, 'sideways_use_adx': True, 'sideways_use_spike': True, 'sideways_rsi_required': True}.
[I 2025-08-30 14:35:56,893] Trial 123 finished with values: [-0.041238850544397576, 0.04141271563540173] and parameters: {'p_sma': 47, 'p_std': 46, 'p_atr': 14, 'p_adx': 20, 'rsi_period': 41, 'ema1': 22, 'ema2': 47, 'slip_atr_k': 0.24002473013135395, 'slip_spread_k': 0.46321306570487814, 'spread_hl_frac': 0.00870365948559972, 'bb_std_mult': 1.090793296080045, 'rsi_os': 41, 'rsi_ob': 89, 'vol_spike': 0.08320319884348915, 'adx_thresh': 17.093775698560883, 'atr_min_pct': 0.0010279959211567068, 'atr_max_pct': 0.13340448414580855, 'tp_mult': 2.081674897724954, 'tsl_mult': 0.5962963136895119, 'strategy': 'mean_reversion', 'time_stop': 184, 'use_sma': False, 'use_atr': False, 'use_adx': False, 'use_ema': False, 'use_spike': False, 'rsi_required': False, 'edge_k': 0.3395225063724717, 'edge_cap': 0.39638766497794076, 'bull_strategy': 'breakout', 'bull_bb_std_mult': 2.9936037947396574, 'bull_rsi_os': 13, 'bull_rsi_ob': 75, 'bull_adx_thresh': 20.273510514985396, 'bull_atr_min_pct': 0.0020418428587299833, 'bull_atr_max_pct': 0.1139388315102263, 'bull_tp_mult': 1.8526847532316164, 'bull_tsl_mult': 0.1472609740701218, 'bull_time_stop': 260, 'bull_use_sma': False, 'bull_use_ema': True, 'bull_use_atr': True, 'bull_use_adx': True, 'bull_use_spike': False, 'bull_rsi_required': True, 'bear_strategy': 'breakout', 'bear_bb_std_mult': 1.0974917175633985, 'bear_rsi_os': 53, 'bear_rsi_ob': 88, 'bear_adx_thresh': 18.239192342174018, 'bear_atr_min_pct': 0.00615367732756133, 'bear_atr_max_pct': 0.09624216037463743, 'bear_tp_mult': 2.0817966065741826, 'bear_tsl_mult': 0.3920284837117453, 'bear_time_stop': 12, 'bear_use_sma': False, 'bear_use_ema': True, 'bear_use_atr': False, 'bear_use_adx': True, 'bear_use_spike': True, 'bear_rsi_required': False, 'sideways_strategy': 'mean_reversion', 'sideways_bb_std_mult': 3.551117477979889, 'sideways_rsi_os': 42, 'sideways_rsi_ob': 87, 'sideways_adx_thresh': 13.440148770510138, 'sideways_atr_min_pct': 0.02089499408182663, 'sideways_atr_max_pct': 0.07571412410490842, 'sideways_tp_mult': 2.233567242520163, 'sideways_tsl_mult': 0.007890552830098874, 'sideways_time_stop': 254, 'sideways_use_sma': False, 'sideways_use_ema': False, 'sideways_use_atr': False, 'sideways_use_adx': True, 'sideways_use_spike': True, 'sideways_rsi_required': False}.
[I 2025-08-30 14:35:57,635] Trial 125 finished with values: [-1000000000.0, 1000000000.0] and parameters: {'p_sma': 47, 'p_std': 49, 'p_atr': 14, 'p_adx': 20, 'rsi_period': 41, 'ema1': 25, 'ema2': 39, 'slip_atr_k': 0.018132669577411813, 'slip_spread_k': 0.19218206797213602, 'spread_hl_frac': 0.007372177737920622, 'bb_std_mult': 3.0605787894085115, 'rsi_os': 35, 'rsi_ob': 89, 'vol_spike': 0.1044031143447442, 'adx_thresh': 19.519548148335428, 'atr_min_pct': 0.020095210625428128, 'atr_max_pct': 0.10436908734871311, 'tp_mult': 2.099451513580552, 'tsl_mult': 0.27321696508492027, 'strategy': 'mean_reversion', 'time_stop': 185, 'use_sma': False, 'use_atr': True, 'use_adx': True, 'use_ema': True, 'use_spike': False, 'rsi_required': False, 'edge_k': 1.6001729309515464, 'edge_cap': 0.13920105640475777, 'bull_strategy': 'breakout', 'bull_bb_std_mult': 3.3935067756657165, 'bull_rsi_os': 35, 'bull_rsi_ob': 46, 'bull_adx_thresh': 23.958518727532102, 'bull_atr_min_pct': 0.015962973373274982, 'bull_atr_max_pct': 0.1457463189998171, 'bull_tp_mult': 1.8285917753999077, 'bull_tsl_mult': 0.5351353065411032, 'bull_time_stop': 151, 'bull_use_sma': False, 'bull_use_ema': True, 'bull_use_atr': False, 'bull_use_adx': False, 'bull_use_spike': False, 'bull_rsi_required': False, 'bear_strategy': 'breakout', 'bear_bb_std_mult': 1.6563893202566136, 'bear_rsi_os': 54, 'bear_rsi_ob': 48, 'bear_adx_thresh': 5.152025660584618, 'bear_atr_min_pct': 0.006200430127414493, 'bear_atr_max_pct': 0.0395325614824613, 'bear_tp_mult': 1.4795958856301141, 'bear_tsl_mult': 0.9945455252130955, 'bear_time_stop': 62, 'bear_use_sma': False, 'bear_use_ema': True, 'bear_use_atr': False, 'bear_use_adx': True, 'bear_use_spike': True, 'bear_rsi_required': False, 'sideways_strategy': 'mean_reversion', 'sideways_bb_std_mult': 1.2874020814331018, 'sideways_rsi_os': 41, 'sideways_rsi_ob': 59, 'sideways_adx_thresh': 17.628525995885816, 'sideways_atr_min_pct': 0.003334574487035594, 'sideways_atr_max_pct': 0.07605600329261959, 'sideways_tp_mult': 2.4707676869197335, 'sideways_tsl_mult': 0.1104989260760858, 'sideways_time_stop': 209, 'sideways_use_sma': False, 'sideways_use_ema': True, 'sideways_use_atr': False, 'sideways_use_adx': True, 'sideways_use_spike': True, 'sideways_rsi_required': False}.
[I 2025-08-30 14:35:57,745] Trial 124 finished with values: [-1000000000.0, 1000000000.0] and parameters: {'p_sma': 29, 'p_std': 46, 'p_atr': 14, 'p_adx': 24, 'rsi_period': 41, 'ema1': 15, 'ema2': 48, 'slip_atr_k': 0.2426912542572482, 'slip_spread_k': 0.4516381692522254, 'spread_hl_frac': 0.007122598207865538, 'bb_std_mult': 1.0735877246743346, 'rsi_os': 35, 'rsi_ob': 90, 'vol_spike': 0.037496079978022706, 'adx_thresh': 17.050584684866152, 'atr_min_pct': 0.008778876777614998, 'atr_max_pct': 0.10643386727037274, 'tp_mult': 1.8374611315888603, 'tsl_mult': 0.9736515890643658, 'strategy': 'mean_reversion', 'time_stop': 184, 'use_sma': False, 'use_atr': True, 'use_adx': True, 'use_ema': True, 'use_spike': False, 'rsi_required': False, 'edge_k': 1.6066632087606934, 'edge_cap': 0.3960128561866485, 'bull_strategy': 'breakout', 'bull_bb_std_mult': 3.1590477003308397, 'bull_rsi_os': 33, 'bull_rsi_ob': 46, 'bull_adx_thresh': 27.619407373475326, 'bull_atr_min_pct': 0.001977445074568309, 'bull_atr_max_pct': 0.14569307487071292, 'bull_tp_mult': 1.9606099115266924, 'bull_tsl_mult': 0.5367804329851031, 'bull_time_stop': 261, 'bull_use_sma': False, 'bull_use_ema': True, 'bull_use_atr': False, 'bull_use_adx': False, 'bull_use_spike': False, 'bull_rsi_required': True, 'bear_strategy': 'breakout', 'bear_bb_std_mult': 0.7934397431052214, 'bear_rsi_os': 18, 'bear_rsi_ob': 88, 'bear_adx_thresh': 16.177068559281416, 'bear_atr_min_pct': 0.005887137125669829, 'bear_atr_max_pct': 0.022389703793759427, 'bear_tp_mult': 2.063035835489794, 'bear_tsl_mult': 0.177476790749509, 'bear_time_stop': 64, 'bear_use_sma': False, 'bear_use_ema': True, 'bear_use_atr': False, 'bear_use_adx': True, 'bear_use_spike': True, 'bear_rsi_required': False, 'sideways_strategy': 'mean_reversion', 'sideways_bb_std_mult': 1.703730896204291, 'sideways_rsi_os': 55, 'sideways_rsi_ob': 87, 'sideways_adx_thresh': 13.54546263189702, 'sideways_atr_min_pct': 0.003480935862511997, 'sideways_atr_max_pct': 0.035179702483130834, 'sideways_tp_mult': 2.50011762736649, 'sideways_tsl_mult': 0.05701839490882103, 'sideways_time_stop': 225, 'sideways_use_sma': False, 'sideways_use_ema': True, 'sideways_use_atr': False, 'sideways_use_adx': True, 'sideways_use_spike': True, 'sideways_rsi_required': False}.
