[I 2025-08-30 15:29:18,824] Trial 468 finished with values: [-1000000000.0, 1000000000.0] and parameters: {'p_sma': 6, 'p_std': 57, 'p_atr': 15, 'p_adx': 28, 'rsi_period': 60, 'ema1': 30, 'ema2': 32, 'slip_atr_k': 0.15545149239567713, 'slip_spread_k': 0.08278204653347263, 'spread_hl_frac': 0.026444045180868573, 'bb_std_mult': 1.1774633781964758, 'rsi_os': 14, 'rsi_ob': 75, 'vol_spike': 0.014360098478639616, 'adx_thresh': 11.893179527179576, 'atr_min_pct': 0.014389951958848478, 'atr_max_pct': 0.0736641005383487, 'tp_mult': 1.8208552934370432, 'tsl_mult': 0.6785034632389413, 'strategy': 'breakout', 'time_stop': 134, 'use_sma': False, 'use_atr': True, 'use_adx': False, 'use_ema': True, 'use_spike': True, 'rsi_required': True, 'edge_k': 0.1739151110152498, 'edge_cap': 0.5776485056088134, 'bull_strategy': 'mean_reversion', 'bull_bb_std_mult': 2.5974440305513578, 'bull_rsi_os': 39, 'bull_rsi_ob': 69, 'bull_adx_thresh': 22.68390245011128, 'bull_atr_min_pct': 0.021770448000874933, 'bull_atr_max_pct': 0.038029324807629994, 'bull_tp_mult': 2.1736810701297538, 'bull_tsl_mult': 0.2627907416330807, 'bull_time_stop': 167, 'bull_use_sma': False, 'bull_use_ema': False, 'bull_use_atr': False, 'bull_use_adx': False, 'bull_use_spike': True, 'bull_rsi_required': False, 'bear_strategy': 'mean_reversion', 'bear_bb_std_mult': 2.016034317973456, 'bear_rsi_os': 44, 'bear_rsi_ob': 74, 'bear_adx_thresh': 21.498225418939757, 'bear_atr_min_pct': 0.021985243261264012, 'bear_atr_max_pct': 0.06954510808734327, 'bear_tp_mult': 2.905495874731315, 'bear_tsl_mult': 0.9339805047414076, 'bear_time_stop': 207, 'bear_use_sma': True, 'bear_use_ema': True, 'bear_use_atr': True, 'bear_use_adx': False, 'bear_use_spike': False, 'bear_rsi_required': True, 'sideways_strategy': 'breakout', 'sideways_bb_std_mult': 2.754118306291079, 'sideways_rsi_os': 42, 'sideways_rsi_ob': 80, 'sideways_adx_thresh': 27.58534074684403, 'sideways_atr_min_pct': 0.0013306929699659982, 'sideways_atr_max_pct': 0.040952147416923775, 'sideways_tp_mult': 2.4966009539821856, 'sideways_tsl_mult': 0.959039098739606, 'sideways_time_stop': 94, 'sideways_use_sma': True, 'sideways_use_ema': True, 'sideways_use_atr': True, 'sideways_use_adx': False, 'sideways_use_spike': True, 'sideways_rsi_required': False}.
[I 2025-08-30 15:29:19,420] Trial 467 finished with values: [-0.0353629847130531, 0.035305261652495916] and parameters: {'p_sma': 6, 'p_std': 57, 'p_atr': 8, 'p_adx': 16, 'rsi_period': 23, 'ema1': 8, 'ema2': 36, 'slip_atr_k': 0.07315674668064769, 'slip_spread_k': 0.08858162448283846, 'spread_hl_frac': 0.02625839786375544, 'bb_std_mult': 1.172860368755645, 'rsi_os': 16, 'rsi_ob': 75, 'vol_spike': 0.1541357600135714, 'adx_thresh': 5.890922707782485, 'atr_min_pct': 0.02924904306765358, 'atr_max_pct': 0.07375385113845807, 'tp_mult': 1.3129431043845547, 'tsl_mult': 0.679312932710207, 'strategy': 'breakout', 'time_stop': 133, 'use_sma': False, 'use_atr': True, 'use_adx': False, 'use_ema': True, 'use_spike': True, 'rsi_required': True, 'edge_k': 0.16829154477340375, 'edge_cap': 0.9979199543890185, 'bull_strategy': 'mean_reversion', 'bull_bb_std_mult': 2.568679989490449, 'bull_rsi_os': 39, 'bull_rsi_ob': 45, 'bull_adx_thresh': 22.727103856481275, 'bull_atr_min_pct': 0.02383775305333298, 'bull_atr_max_pct': 0.0742592795972543, 'bull_tp_mult': 2.1827646386132407, 'bull_tsl_mult': 0.2616253219903772, 'bull_time_stop': 34, 'bull_use_sma': False, 'bull_use_ema': False, 'bull_use_atr': False, 'bull_use_adx': False, 'bull_use_spike': True, 'bull_rsi_required': False, 'bear_strategy': 'mean_reversion', 'bear_bb_std_mult': 3.152800350461394, 'bear_rsi_os': 28, 'bear_rsi_ob': 76, 'bear_adx_thresh': 21.439115170820727, 'bear_atr_min_pct': 0.020124314235816412, 'bear_atr_max_pct': 0.07125859696786377, 'bear_tp_mult': 2.786335851775606, 'bear_tsl_mult': 0.8230637493785493, 'bear_time_stop': 65, 'bear_use_sma': True, 'bear_use_ema': True, 'bear_use_atr': True, 'bear_use_adx': False, 'bear_use_spike': False, 'bear_rsi_required': True, 'sideways_strategy': 'breakout', 'sideways_bb_std_mult': 2.055379362265387, 'sideways_rsi_os': 42, 'sideways_rsi_ob': 55, 'sideways_adx_thresh': 28.23654576068757, 'sideways_atr_min_pct': 0.0012502601701743481, 'sideways_atr_max_pct': 0.11829469458387243, 'sideways_tp_mult': 1.5369751738338437, 'sideways_tsl_mult': 0.9593997486695038, 'sideways_time_stop': 73, 'sideways_use_sma': True, 'sideways_use_ema': True, 'sideways_use_atr': True, 'sideways_use_adx': False, 'sideways_use_spike': True, 'sideways_rsi_required': False}.
[I 2025-08-30 15:30:06,446] Trial 473 finished with values: [-1000000000.0, 0.17252855809318707] and parameters: {'p_sma': 55, 'p_std': 60, 'p_atr': 14, 'p_adx': 12, 'rsi_period': 20, 'ema1': 29, 'ema2': 36, 'slip_atr_k': 0.058378623170517466, 'slip_spread_k': 0.12228186753734956, 'spread_hl_frac': 0.02438302338734329, 'bb_std_mult': 2.9131698767037166, 'rsi_os': 22, 'rsi_ob': 53, 'vol_spike': 0.11284345716168649, 'adx_thresh': 13.334932704344409, 'atr_min_pct': 0.012172333905316163, 'atr_max_pct': 0.08490409599755465, 'tp_mult': 1.7648896009030821, 'tsl_mult': 0.7429709696927518, 'strategy': 'breakout', 'time_stop': 128, 'use_sma': False, 'use_atr': True, 'use_adx': True, 'use_ema': True, 'use_spike': True, 'rsi_required': True, 'edge_k': 0.2244388609015475, 'edge_cap': 0.3216196126419567, 'bull_strategy': 'mean_reversion', 'bull_bb_std_mult': 2.833339454647309, 'bull_rsi_os': 37, 'bull_rsi_ob': 49, 'bull_adx_thresh': 6.875045352567193, 'bull_atr_min_pct': 0.021183541729107504, 'bull_atr_max_pct': 0.057436061239743666, 'bull_tp_mult': 2.9358170204385012, 'bull_tsl_mult': 0.30014566144150157, 'bull_time_stop': 183, 'bull_use_sma': False, 'bull_use_ema': False, 'bull_use_atr': False, 'bull_use_adx': False, 'bull_use_spike': True, 'bull_rsi_required': False, 'bear_strategy': 'mean_reversion', 'bear_bb_std_mult': 2.63950151961821, 'bear_rsi_os': 50, 'bear_rsi_ob': 77, 'bear_adx_thresh': 29.9880013020951, 'bear_atr_min_pct': 0.021181302638498885, 'bear_atr_max_pct': 0.07393435562275236, 'bear_tp_mult': 1.5306825992397164, 'bear_tsl_mult': 0.3927756336056668, 'bear_time_stop': 288, 'bear_use_sma': True, 'bear_use_ema': True, 'bear_use_atr': True, 'bear_use_adx': False, 'bear_use_spike': False, 'bear_rsi_required': True, 'sideways_strategy': 'breakout', 'sideways_bb_std_mult': 2.180311594596117, 'sideways_rsi_os': 53, 'sideways_rsi_ob': 62, 'sideways_adx_thresh': 27.17083406757316, 'sideways_atr_min_pct': 0.0007609600955358611, 'sideways_atr_max_pct': 0.1082112148033084, 'sideways_tp_mult': 1.6898419780323348, 'sideways_tsl_mult': 0.9960071750375954, 'sideways_time_stop': 268, 'sideways_use_sma': True, 'sideways_use_ema': True, 'sideways_use_atr': True, 'sideways_use_adx': False, 'sideways_use_spike': False, 'sideways_rsi_required': False}.
[I 2025-08-30 15:30:07,357] Trial 471 finished with values: [-0.024171901000883955, 0.024201513074522247] and parameters: {'p_sma': 6, 'p_std': 56, 'p_atr': 26, 'p_adx': 12, 'rsi_period': 60, 'ema1': 29, 'ema2': 36, 'slip_atr_k': 0.07267689193920494, 'slip_spread_k': 0.1799003068705331, 'spread_hl_frac': 0.009403375120452629, 'bb_std_mult': 1.1862016479921556, 'rsi_os': 48, 'rsi_ob': 75, 'vol_spike': 0.11280294923666759, 'adx_thresh': 13.387048411071063, 'atr_min_pct': 0.014442098795392343, 'atr_max_pct': 0.07117778280317553, 'tp_mult': 1.691648138449455, 'tsl_mult': 0.7420163882465061, 'strategy': 'breakout', 'time_stop': 133, 'use_sma': False, 'use_atr': True, 'use_adx': True, 'use_ema': True, 'use_spike': True, 'rsi_required': True, 'edge_k': 0.17009754652007028, 'edge_cap': 0.32977466112219767, 'bull_strategy': 'mean_reversion', 'bull_bb_std_mult': 1.896337481137447, 'bull_rsi_os': 7, 'bull_rsi_ob': 49, 'bull_adx_thresh': 31.089875624744437, 'bull_atr_min_pct': 0.018503502613830807, 'bull_atr_max_pct': 0.05700557165836697, 'bull_tp_mult': 2.177968760700427, 'bull_tsl_mult': 0.3024611278244975, 'bull_time_stop': 182, 'bull_use_sma': False, 'bull_use_ema': False, 'bull_use_atr': False, 'bull_use_adx': False, 'bull_use_spike': True, 'bull_rsi_required': False, 'bear_strategy': 'mean_reversion', 'bear_bb_std_mult': 3.129058702536374, 'bear_rsi_os': 30, 'bear_rsi_ob': 74, 'bear_adx_thresh': 29.892982662209814, 'bear_atr_min_pct': 0.0016178682001876995, 'bear_atr_max_pct': 0.06983081883951563, 'bear_tp_mult': 2.7861840256831023, 'bear_tsl_mult': 0.9339030183167318, 'bear_time_stop': 64, 'bear_use_sma': True, 'bear_use_ema': True, 'bear_use_atr': True, 'bear_use_adx': False, 'bear_use_spike': False, 'bear_rsi_required': True, 'sideways_strategy': 'breakout', 'sideways_bb_std_mult': 2.1911373863684607, 'sideways_rsi_os': 54, 'sideways_rsi_ob': 56, 'sideways_adx_thresh': 27.25344201040277, 'sideways_atr_min_pct': 0.0012837326219871108, 'sideways_atr_max_pct': 0.11802967690811549, 'sideways_tp_mult': 1.6611612256234563, 'sideways_tsl_mult': 0.9655593478616534, 'sideways_time_stop': 79, 'sideways_use_sma': True, 'sideways_use_ema': True, 'sideways_use_atr': True, 'sideways_use_adx': False, 'sideways_use_spike': False, 'sideways_rsi_required': False}.
[I 2025-08-30 15:30:08,307] Trial 470 finished with values: [-1000000000.0, 1000000000.0] and parameters: {'p_sma': 38, 'p_std': 15, 'p_atr': 15, 'p_adx': 16, 'rsi_period': 23, 'ema1': 30, 'ema2': 36, 'slip_atr_k': 0.2033469214484486, 'slip_spread_k': 0.17209270330601736, 'spread_hl_frac': 0.026462744845178823, 'bb_std_mult': 2.9227462406492877, 'rsi_os': 42, 'rsi_ob': 76, 'vol_spike': 0.15634528225371125, 'adx_thresh': 11.453078551829709, 'atr_min_pct': 0.0292417918439078, 'atr_max_pct': 0.06966646716849241, 'tp_mult': 1.3641260270000823, 'tsl_mult': 0.31010670730887235, 'strategy': 'breakout', 'time_stop': 300, 'use_sma': False, 'use_atr': True, 'use_adx': True, 'use_ema': True, 'use_spike': True, 'rsi_required': True, 'edge_k': 0.17455955129128145, 'edge_cap': 0.3322858275036161, 'bull_strategy': 'mean_reversion', 'bull_bb_std_mult': 2.834926714327951, 'bull_rsi_os': 37, 'bull_rsi_ob': 49, 'bull_adx_thresh': 22.69684747479633, 'bull_atr_min_pct': 0.02175190062989246, 'bull_atr_max_pct': 0.06632610567134985, 'bull_tp_mult': 2.151956239198204, 'bull_tsl_mult': 0.3076460238878988, 'bull_time_stop': 29, 'bull_use_sma': False, 'bull_use_ema': False, 'bull_use_atr': False, 'bull_use_adx': False, 'bull_use_spike': True, 'bull_rsi_required': False, 'bear_strategy': 'mean_reversion', 'bear_bb_std_mult': 2.94217591047549, 'bear_rsi_os': 28, 'bear_rsi_ob': 74, 'bear_adx_thresh': 30.241543806698143, 'bear_atr_min_pct': 0.022096216515475484, 'bear_atr_max_pct': 0.07276069922292473, 'bear_tp_mult': 2.9021202806051467, 'bear_tsl_mult': 0.9428304366343337, 'bear_time_stop': 63, 'bear_use_sma': True, 'bear_use_ema': True, 'bear_use_atr': True, 'bear_use_adx': False, 'bear_use_spike': False, 'bear_rsi_required': True, 'sideways_strategy': 'breakout', 'sideways_bb_std_mult': 2.746483580933883, 'sideways_rsi_os': 54, 'sideways_rsi_ob': 56, 'sideways_adx_thresh': 28.132428137235546, 'sideways_atr_min_pct': 0.024260055715714962, 'sideways_atr_max_pct': 0.10331391554305301, 'sideways_tp_mult': 1.5097757140614068, 'sideways_tsl_mult': 0.9982794481112766, 'sideways_time_stop': 80, 'sideways_use_sma': True, 'sideways_use_ema': True, 'sideways_use_atr': True, 'sideways_use_adx': False, 'sideways_use_spike': False, 'sideways_rsi_required': False}.
[I 2025-08-30 15:30:09,104] Trial 472 finished with values: [-1000000000.0, 1000000000.0] and parameters: {'p_sma': 6, 'p_std': 44, 'p_atr': 14, 'p_adx': 29, 'rsi_period': 76, 'ema1': 29, 'ema2': 36, 'slip_atr_k': 0.0717314385273122, 'slip_spread_k': 0.16907141247368768, 'spread_hl_frac': 0.025655998964175426, 'bb_std_mult': 1.2807133742741836, 'rsi_os': 22, 'rsi_ob': 73, 'vol_spike': 0.15454935203909967, 'adx_thresh': 13.389327195937422, 'atr_min_pct': 0.012712084689902122, 'atr_max_pct': 0.07114062294707708, 'tp_mult': 1.3556663210120297, 'tsl_mult': 0.7420368803086654, 'strategy': 'breakout', 'time_stop': 295, 'use_sma': False, 'use_atr': True, 'use_adx': True, 'use_ema': True, 'use_spike': True, 'rsi_required': True, 'edge_k': 0.1631729103087083, 'edge_cap': 0.5308909821559066, 'bull_strategy': 'mean_reversion', 'bull_bb_std_mult': 2.9000464206903316, 'bull_rsi_os': 48, 'bull_rsi_ob': 49, 'bull_adx_thresh': 21.198790465193948, 'bull_atr_min_pct': 0.0210706326485462, 'bull_atr_max_pct': 0.06018207278708138, 'bull_tp_mult': 2.1407165753634816, 'bull_tsl_mult': 0.29700471172324844, 'bull_time_stop': 29, 'bull_use_sma': False, 'bull_use_ema': False, 'bull_use_atr': False, 'bull_use_adx': False, 'bull_use_spike': True, 'bull_rsi_required': False, 'bear_strategy': 'mean_reversion', 'bear_bb_std_mult': 3.1635752310565532, 'bear_rsi_os': 30, 'bear_rsi_ob': 76, 'bear_adx_thresh': 28.60822659856801, 'bear_atr_min_pct': 0.021076570456937845, 'bear_atr_max_pct': 0.07333127782898492, 'bear_tp_mult': 1.5414552343567627, 'bear_tsl_mult': 0.9151400203120024, 'bear_time_stop': 215, 'bear_use_sma': True, 'bear_use_ema': True, 'bear_use_atr': True, 'bear_use_adx': False, 'bear_use_spike': False, 'bear_rsi_required': True, 'sideways_strategy': 'breakout', 'sideways_bb_std_mult': 2.180864361596469, 'sideways_rsi_os': 41, 'sideways_rsi_ob': 56, 'sideways_adx_thresh': 28.39169287673714, 'sideways_atr_min_pct': 0.000570097102616877, 'sideways_atr_max_pct': 0.117708920773693, 'sideways_tp_mult': 1.3319502565629984, 'sideways_tsl_mult': 0.9984813777873551, 'sideways_time_stop': 79, 'sideways_use_sma': True, 'sideways_use_ema': True, 'sideways_use_atr': True, 'sideways_use_adx': False, 'sideways_use_spike': False, 'sideways_rsi_required': False}.
[I 2025-08-30 15:30:56,218] Trial 474 finished with values: [-1000000000.0, 1000000000.0] and parameters: {'p_sma': 38, 'p_std': 56, 'p_atr': 28, 'p_adx': 29, 'rsi_period': 76, 'ema1': 30, 'ema2': 34, 'slip_atr_k': 0.06680636558153158, 'slip_spread_k': 0.180369664078657, 'spread_hl_frac': 0.025598850374271922, 'bb_std_mult': 1.2818062255465374, 'rsi_os': 41, 'rsi_ob': 85, 'vol_spike': 0.15753268410371207, 'adx_thresh': 12.623292904579827, 'atr_min_pct': 0.012859845414491288, 'atr_max_pct': 0.0697214761236469, 'tp_mult': 1.7193695778145834, 'tsl_mult': 0.7176168651621231, 'strategy': 'breakout', 'time_stop': 138, 'use_sma': False, 'use_atr': True, 'use_adx': False, 'use_ema': True, 'use_spike': True, 'rsi_required': True, 'edge_k': 0.1442862820220839, 'edge_cap': 0.5534060850160872, 'bull_strategy': 'mean_reversion', 'bull_bb_std_mult': 1.9232303982923864, 'bull_rsi_os': 7, 'bull_rsi_ob': 49, 'bull_adx_thresh': 22.1703691791579, 'bull_atr_min_pct': 0.021858054274849045, 'bull_atr_max_pct': 0.13241409625107486, 'bull_tp_mult': 2.1434726756378835, 'bull_tsl_mult': 0.3086428986988515, 'bull_time_stop': 234, 'bull_use_sma': True, 'bull_use_ema': True, 'bull_use_atr': False, 'bull_use_adx': False, 'bull_use_spike': True, 'bull_rsi_required': False, 'bear_strategy': 'mean_reversion', 'bear_bb_std_mult': 2.8732053458688793, 'bear_rsi_os': 30, 'bear_rsi_ob': 84, 'bear_adx_thresh': 28.515981532306515, 'bear_atr_min_pct': 0.0012973850349185176, 'bear_atr_max_pct': 0.06491561751468093, 'bear_tp_mult': 1.49240872118847, 'bear_tsl_mult': 0.9378175448634414, 'bear_time_stop': 216, 'bear_use_sma': True, 'bear_use_ema': True, 'bear_use_atr': True, 'bear_use_adx': True, 'bear_use_spike': False, 'bear_rsi_required': True, 'sideways_strategy': 'breakout', 'sideways_bb_std_mult': 2.8665508763663863, 'sideways_rsi_os': 9, 'sideways_rsi_ob': 56, 'sideways_adx_thresh': 26.60143017045925, 'sideways_atr_min_pct': 0.02405709111866016, 'sideways_atr_max_pct': 0.10400751069391737, 'sideways_tp_mult': 2.3600579046038477, 'sideways_tsl_mult': 0.9997202221158905, 'sideways_time_stop': 81, 'sideways_use_sma': True, 'sideways_use_ema': True, 'sideways_use_atr': True, 'sideways_use_adx': False, 'sideways_use_spike': True, 'sideways_rsi_required': False}.
[I 2025-08-30 15:30:57,077] Trial 476 finished with values: [-1000000000.0, 1000000000.0] and parameters: {'p_sma': 57, 'p_std': 24, 'p_atr': 28, 'p_adx': 25, 'rsi_period': 77, 'ema1': 30, 'ema2': 34, 'slip_atr_k': 0.06497731810429885, 'slip_spread_k': 0.7197886766475624, 'spread_hl_frac': 0.014040445816953231, 'bb_std_mult': 1.3271453274547433, 'rsi_os': 23, 'rsi_ob': 73, 'vol_spike': 0.14459959640128703, 'adx_thresh': 12.830619678462057, 'atr_min_pct': 0.012816562427447636, 'atr_max_pct': 0.08292103547697882, 'tp_mult': 1.883066940128653, 'tsl_mult': 0.7157087913611987, 'strategy': 'breakout', 'time_stop': 144, 'use_sma': False, 'use_atr': True, 'use_adx': False, 'use_ema': True, 'use_spike': True, 'rsi_required': True, 'edge_k': 0.21712930489102114, 'edge_cap': 0.5390692255477874, 'bull_strategy': 'mean_reversion', 'bull_bb_std_mult': 2.377085150140252, 'bull_rsi_os': 48, 'bull_rsi_ob': 47, 'bull_adx_thresh': 21.208642632859586, 'bull_atr_min_pct': 0.022898910454220774, 'bull_atr_max_pct': 0.06877715910910273, 'bull_tp_mult': 2.1236503168813647, 'bull_tsl_mult': 0.2848409958777215, 'bull_time_stop': 64, 'bull_use_sma': True, 'bull_use_ema': True, 'bull_use_atr': False, 'bull_use_adx': False, 'bull_use_spike': True, 'bull_rsi_required': False, 'bear_strategy': 'mean_reversion', 'bear_bb_std_mult': 0.6703741797529167, 'bear_rsi_os': 30, 'bear_rsi_ob': 79, 'bear_adx_thresh': 28.48072406920097, 'bear_atr_min_pct': 0.020770164559351684, 'bear_atr_max_pct': 0.06473063995605245, 'bear_tp_mult': 1.489774333139668, 'bear_tsl_mult': 0.9060555053247253, 'bear_time_stop': 175, 'bear_use_sma': True, 'bear_use_ema': True, 'bear_use_atr': True, 'bear_use_adx': True, 'bear_use_spike': False, 'bear_rsi_required': True, 'sideways_strategy': 'breakout', 'sideways_bb_std_mult': 1.8716210052687707, 'sideways_rsi_os': 25, 'sideways_rsi_ob': 95, 'sideways_adx_thresh': 20.56535530457277, 'sideways_atr_min_pct': 0.0006246459471147877, 'sideways_atr_max_pct': 0.013007684891725907, 'sideways_tp_mult': 1.7575079981396389, 'sideways_tsl_mult': 0.981094372339399, 'sideways_time_stop': 89, 'sideways_use_sma': True, 'sideways_use_ema': True, 'sideways_use_atr': True, 'sideways_use_adx': False, 'sideways_use_spike': True, 'sideways_rsi_required': False}.
[I 2025-08-30 15:30:58,682] Trial 475 finished with values: [-1000000000.0, 1000000000.0] and parameters: {'p_sma': 38, 'p_std': 59, 'p_atr': 16, 'p_adx': 26, 'rsi_period': 69, 'ema1': 17, 'ema2': 34, 'slip_atr_k': 0.2036121634219618, 'slip_spread_k': 0.16229916250227305, 'spread_hl_frac': 0.01537971292868164, 'bb_std_mult': 1.0480136147872985, 'rsi_os': 12, 'rsi_ob': 62, 'vol_spike': 0.15783373353214727, 'adx_thresh': 13.041330783319717, 'atr_min_pct': 0.0012854111738162186, 'atr_max_pct': 0.021145092412645616, 'tp_mult': 1.7308212024367873, 'tsl_mult': 0.7172311078710574, 'strategy': 'breakout', 'time_stop': 182, 'use_sma': False, 'use_atr': True, 'use_adx': False, 'use_ema': True, 'use_spike': True, 'rsi_required': True, 'edge_k': 0.14587507669065589, 'edge_cap': 0.5512788182268943, 'bull_strategy': 'mean_reversion', 'bull_bb_std_mult': 2.641849601196274, 'bull_rsi_os': 37, 'bull_rsi_ob': 50, 'bull_adx_thresh': 28.581952517278157, 'bull_atr_min_pct': 0.022016286066222548, 'bull_atr_max_pct': 0.12556122922893526, 'bull_tp_mult': 2.135956191357187, 'bull_tsl_mult': 0.2898875214110092, 'bull_time_stop': 241, 'bull_use_sma': True, 'bull_use_ema': True, 'bull_use_atr': False, 'bull_use_adx': False, 'bull_use_spike': True, 'bull_rsi_required': False, 'bear_strategy': 'mean_reversion', 'bear_bb_std_mult': 0.580494236622357, 'bear_rsi_os': 54, 'bear_rsi_ob': 84, 'bear_adx_thresh': 28.539268381834706, 'bear_atr_min_pct': 0.022081698237694306, 'bear_atr_max_pct': 0.06631937522267745, 'bear_tp_mult': 1.4888182153739162, 'bear_tsl_mult': 0.6963778237817162, 'bear_time_stop': 254, 'bear_use_sma': True, 'bear_use_ema': True, 'bear_use_atr': True, 'bear_use_adx': True, 'bear_use_spike': False, 'bear_rsi_required': True, 'sideways_strategy': 'breakout', 'sideways_bb_std_mult': 1.8647669981709178, 'sideways_rsi_os': 41, 'sideways_rsi_ob': 59, 'sideways_adx_thresh': 26.519398570588532, 'sideways_atr_min_pct': 0.014189184521881703, 'sideways_atr_max_pct': 0.14176367564819073, 'sideways_tp_mult': 2.3817774616331038, 'sideways_tsl_mult': 0.9977437660759312, 'sideways_time_stop': 82, 'sideways_use_sma': True, 'sideways_use_ema': True, 'sideways_use_atr': True, 'sideways_use_adx': False, 'sideways_use_spike': True, 'sideways_rsi_required': False}.
