[I 2025-08-30 16:09:20,977] Trial 665 finished with values: [-1000000000.0, 1000000000.0] and parameters: {'p_sma': 5, 'p_std': 53, 'p_atr': 22, 'p_adx': 11, 'rsi_period': 78, 'ema1': 21, 'ema2': 28, 'slip_atr_k': 0.07312883422355834, 'slip_spread_k': 0.20036506852439656, 'spread_hl_frac': 0.022782574912026538, 'bb_std_mult': 2.320588842318481, 'rsi_os': 37, 'rsi_ob': 75, 'vol_spike': 0.14835801251378106, 'adx_thresh': 14.824837582018995, 'atr_min_pct': 0.01565888049968048, 'atr_max_pct': 0.07289242308982205, 'tp_mult': 1.0945296728383314, 'tsl_mult': 0.377131652797258, 'strategy': 'mean_reversion', 'time_stop': 204, 'use_sma': True, 'use_atr': False, 'use_adx': False, 'use_ema': True, 'use_spike': True, 'rsi_required': False, 'edge_k': 0.5842020192146714, 'edge_cap': 0.5961921629122647, 'bull_strategy': 'breakout', 'bull_bb_std_mult': 0.9197025933998111, 'bull_rsi_os': 40, 'bull_rsi_ob': 62, 'bull_adx_thresh': 23.583610499937603, 'bull_atr_min_pct': 0.018966878300596655, 'bull_atr_max_pct': 0.09662065380626932, 'bull_tp_mult': 2.053031169966002, 'bull_tsl_mult': 0.06346100292172563, 'bull_time_stop': 63, 'bull_use_sma': True, 'bull_use_ema': True, 'bull_use_atr': True, 'bull_use_adx': True, 'bull_use_spike': False, 'bull_rsi_required': True, 'bear_strategy': 'mean_reversion', 'bear_bb_std_mult': 2.434267236028287, 'bear_rsi_os': 33, 'bear_rsi_ob': 85, 'bear_adx_thresh': 30.624690773238804, 'bear_atr_min_pct': 0.019890412431264763, 'bear_atr_max_pct': 0.07445394102442954, 'bear_tp_mult': 2.8002555277078685, 'bear_tsl_mult': 0.4934862525836805, 'bear_time_stop': 274, 'bear_use_sma': False, 'bear_use_ema': False, 'bear_use_atr': True, 'bear_use_adx': True, 'bear_use_spike': True, 'bear_rsi_required': True, 'sideways_strategy': 'breakout', 'sideways_bb_std_mult': 0.9280825822727086, 'sideways_rsi_os': 36, 'sideways_rsi_ob': 61, 'sideways_adx_thresh': 22.871207735589618, 'sideways_atr_min_pct': 0.0005090373058027083, 'sideways_atr_max_pct': 0.11058368514632672, 'sideways_tp_mult': 2.949457742452061, 'sideways_tsl_mult': 0.9034333948284764, 'sideways_time_stop': 65, 'sideways_use_sma': False, 'sideways_use_ema': True, 'sideways_use_atr': False, 'sideways_use_adx': True, 'sideways_use_spike': False, 'sideways_rsi_required': True}.
[I 2025-08-30 16:09:21,884] Trial 664 finished with values: [-0.01750232806342411, 0.017435786907483795] and parameters: {'p_sma': 5, 'p_std': 55, 'p_atr': 23, 'p_adx': 11, 'rsi_period': 40, 'ema1': 21, 'ema2': 30, 'slip_atr_k': 0.0860164341436428, 'slip_spread_k': 0.30784024180724756, 'spread_hl_frac': 0.024210185004080856, 'bb_std_mult': 2.3200160733322255, 'rsi_os': 37, 'rsi_ob': 75, 'vol_spike': 0.16318452341481932, 'adx_thresh': 15.066765848736836, 'atr_min_pct': 0.015591410041766543, 'atr_max_pct': 0.06977770769109304, 'tp_mult': 1.1010550931935743, 'tsl_mult': 0.22444060846692698, 'strategy': 'mean_reversion', 'time_stop': 215, 'use_sma': True, 'use_atr': True, 'use_adx': False, 'use_ema': True, 'use_spike': True, 'rsi_required': False, 'edge_k': 0.4260281048565986, 'edge_cap': 0.5993658211470209, 'bull_strategy': 'breakout', 'bull_bb_std_mult': 0.8812868845669349, 'bull_rsi_os': 41, 'bull_rsi_ob': 61, 'bull_adx_thresh': 25.512688918757778, 'bull_atr_min_pct': 0.01836826799506458, 'bull_atr_max_pct': 0.09532218169871255, 'bull_tp_mult': 2.042239460490674, 'bull_tsl_mult': 0.0025837765579620753, 'bull_time_stop': 32, 'bull_use_sma': True, 'bull_use_ema': True, 'bull_use_atr': True, 'bull_use_adx': True, 'bull_use_spike': True, 'bull_rsi_required': True, 'bear_strategy': 'mean_reversion', 'bear_bb_std_mult': 2.434291099962748, 'bear_rsi_os': 33, 'bear_rsi_ob': 86, 'bear_adx_thresh': 29.54026653571218, 'bear_atr_min_pct': 0.02036607204354734, 'bear_atr_max_pct': 0.07642936031455325, 'bear_tp_mult': 2.817755009466299, 'bear_tsl_mult': 0.4285213132597265, 'bear_time_stop': 276, 'bear_use_sma': False, 'bear_use_ema': False, 'bear_use_atr': True, 'bear_use_adx': True, 'bear_use_spike': True, 'bear_rsi_required': True, 'sideways_strategy': 'breakout', 'sideways_bb_std_mult': 1.1237558513133217, 'sideways_rsi_os': 37, 'sideways_rsi_ob': 63, 'sideways_adx_thresh': 25.038785625073956, 'sideways_atr_min_pct': 0.000778398362667896, 'sideways_atr_max_pct': 0.10634430537471289, 'sideways_tp_mult': 2.9957389402637467, 'sideways_tsl_mult': 0.8755560494115001, 'sideways_time_stop': 73, 'sideways_use_sma': True, 'sideways_use_ema': True, 'sideways_use_atr': False, 'sideways_use_adx': True, 'sideways_use_spike': True, 'sideways_rsi_required': True}.
[I 2025-08-30 16:09:23,071] Trial 669 finished with values: [-1000000000.0, 1000000000.0] and parameters: {'p_sma': 14, 'p_std': 54, 'p_atr': 26, 'p_adx': 11, 'rsi_period': 39, 'ema1': 21, 'ema2': 32, 'slip_atr_k': 0.09663399903219275, 'slip_spread_k': 0.17573506135938802, 'spread_hl_frac': 0.021042406035672454, 'bb_std_mult': 2.3232987853727325, 'rsi_os': 38, 'rsi_ob': 46, 'vol_spike': 0.26697459664767925, 'adx_thresh': 14.443660575852318, 'atr_min_pct': 0.015300503543245718, 'atr_max_pct': 0.07329075975030207, 'tp_mult': 1.7118617970826997, 'tsl_mult': 0.22572463246895408, 'strategy': 'mean_reversion', 'time_stop': 210, 'use_sma': True, 'use_atr': False, 'use_adx': False, 'use_ema': True, 'use_spike': False, 'rsi_required': False, 'edge_k': 0.4029981908255355, 'edge_cap': 0.6329565519780938, 'bull_strategy': 'breakout', 'bull_bb_std_mult': 0.8152475403334437, 'bull_rsi_os': 42, 'bull_rsi_ob': 58, 'bull_adx_thresh': 23.69050037706236, 'bull_atr_min_pct': 0.02029696394931936, 'bull_atr_max_pct': 0.09871131753189125, 'bull_tp_mult': 1.9929609595439248, 'bull_tsl_mult': 0.16624460703184907, 'bull_time_stop': 30, 'bull_use_sma': True, 'bull_use_ema': True, 'bull_use_atr': True, 'bull_use_adx': True, 'bull_use_spike': True, 'bull_rsi_required': True, 'bear_strategy': 'breakout', 'bear_bb_std_mult': 2.553403779793273, 'bear_rsi_os': 33, 'bear_rsi_ob': 85, 'bear_adx_thresh': 30.45796203465494, 'bear_atr_min_pct': 0.021036175277452582, 'bear_atr_max_pct': 0.0748583923315246, 'bear_tp_mult': 2.7421829886802267, 'bear_tsl_mult': 0.4860574697657821, 'bear_time_stop': 257, 'bear_use_sma': False, 'bear_use_ema': False, 'bear_use_atr': True, 'bear_use_adx': True, 'bear_use_spike': True, 'bear_rsi_required': False, 'sideways_strategy': 'breakout', 'sideways_bb_std_mult': 0.8645656266969088, 'sideways_rsi_os': 39, 'sideways_rsi_ob': 61, 'sideways_adx_thresh': 24.331666822542207, 'sideways_atr_min_pct': 0.02022465209196961, 'sideways_atr_max_pct': 0.11157663333479788, 'sideways_tp_mult': 2.967076545428038, 'sideways_tsl_mult': 0.9306044071604062, 'sideways_time_stop': 77, 'sideways_use_sma': True, 'sideways_use_ema': False, 'sideways_use_atr': False, 'sideways_use_adx': True, 'sideways_use_spike': True, 'sideways_rsi_required': True}.
[I 2025-08-30 16:10:05,016] Trial 668 finished with values: [-0.01689215956503176, 0.016815603835560196] and parameters: {'p_sma': 44, 'p_std': 54, 'p_atr': 28, 'p_adx': 11, 'rsi_period': 81, 'ema1': 18, 'ema2': 31, 'slip_atr_k': 0.08531495606289848, 'slip_spread_k': 0.1938981636516358, 'spread_hl_frac': 0.02059194408853281, 'bb_std_mult': 2.336459114799877, 'rsi_os': 39, 'rsi_ob': 75, 'vol_spike': 0.027121571959095356, 'adx_thresh': 14.620310938351393, 'atr_min_pct': 0.015724209847293686, 'atr_max_pct': 0.036281106550743236, 'tp_mult': 1.2290529709798586, 'tsl_mult': 0.24629308806479097, 'strategy': 'mean_reversion', 'time_stop': 220, 'use_sma': True, 'use_atr': False, 'use_adx': False, 'use_ema': True, 'use_spike': False, 'rsi_required': False, 'edge_k': 0.41214059078913906, 'edge_cap': 0.6013887635114064, 'bull_strategy': 'breakout', 'bull_bb_std_mult': 0.8576941877416442, 'bull_rsi_os': 40, 'bull_rsi_ob': 61, 'bull_adx_thresh': 23.54549414664141, 'bull_atr_min_pct': 0.01918573833229891, 'bull_atr_max_pct': 0.09688402775966265, 'bull_tp_mult': 2.058838025064773, 'bull_tsl_mult': 0.007681827721768564, 'bull_time_stop': 64, 'bull_use_sma': True, 'bull_use_ema': True, 'bull_use_atr': True, 'bull_use_adx': True, 'bull_use_spike': False, 'bull_rsi_required': True, 'bear_strategy': 'breakout', 'bear_bb_std_mult': 2.5589508491765116, 'bear_rsi_os': 33, 'bear_rsi_ob': 85, 'bear_adx_thresh': 30.92720446807447, 'bear_atr_min_pct': 0.020974283378456526, 'bear_atr_max_pct': 0.07503571389885574, 'bear_tp_mult': 2.8896145959289457, 'bear_tsl_mult': 0.4311656409920778, 'bear_time_stop': 284, 'bear_use_sma': False, 'bear_use_ema': False, 'bear_use_atr': True, 'bear_use_adx': True, 'bear_use_spike': True, 'bear_rsi_required': False, 'sideways_strategy': 'breakout', 'sideways_bb_std_mult': 1.2245861431228704, 'sideways_rsi_os': 37, 'sideways_rsi_ob': 61, 'sideways_adx_thresh': 24.8796087379132, 'sideways_atr_min_pct': 6.319756456204715e-06, 'sideways_atr_max_pct': 0.1097677053696503, 'sideways_tp_mult': 2.9598279624720747, 'sideways_tsl_mult': 0.9315997335618181, 'sideways_time_stop': 42, 'sideways_use_sma': False, 'sideways_use_ema': False, 'sideways_use_atr': False, 'sideways_use_adx': True, 'sideways_use_spike': False, 'sideways_rsi_required': True}.
[I 2025-08-30 16:10:06,836] Trial 670 finished with values: [-1000000000.0, 1000000000.0] and parameters: {'p_sma': 21, 'p_std': 52, 'p_atr': 26, 'p_adx': 11, 'rsi_period': 80, 'ema1': 18, 'ema2': 31, 'slip_atr_k': 0.08494981853788615, 'slip_spread_k': 0.8581692990798486, 'spread_hl_frac': 0.02169317691300844, 'bb_std_mult': 2.399507693280949, 'rsi_os': 39, 'rsi_ob': 72, 'vol_spike': 0.16354256553567914, 'adx_thresh': 16.83360990907296, 'atr_min_pct': 0.015443084883715088, 'atr_max_pct': 0.06908838493976442, 'tp_mult': 2.893469540372198, 'tsl_mult': 0.15217842547573418, 'strategy': 'mean_reversion', 'time_stop': 233, 'use_sma': True, 'use_atr': True, 'use_adx': False, 'use_ema': True, 'use_spike': False, 'rsi_required': False, 'edge_k': 0.42358815415332074, 'edge_cap': 0.6331822475891017, 'bull_strategy': 'breakout', 'bull_bb_std_mult': 0.7781211524342432, 'bull_rsi_os': 42, 'bull_rsi_ob': 58, 'bull_adx_thresh': 24.37349913637997, 'bull_atr_min_pct': 0.01588998958306361, 'bull_atr_max_pct': 0.0877138722667976, 'bull_tp_mult': 1.9768879542688649, 'bull_tsl_mult': 0.014194868667993521, 'bull_time_stop': 33, 'bull_use_sma': True, 'bull_use_ema': True, 'bull_use_atr': True, 'bull_use_adx': True, 'bull_use_spike': True, 'bull_rsi_required': True, 'bear_strategy': 'breakout', 'bear_bb_std_mult': 2.5506929779636036, 'bear_rsi_os': 36, 'bear_rsi_ob': 84, 'bear_adx_thresh': 29.7516852878615, 'bear_atr_min_pct': 0.02096874073820146, 'bear_atr_max_pct': 0.07494872649321638, 'bear_tp_mult': 2.8903987043995905, 'bear_tsl_mult': 0.43090878095273805, 'bear_time_stop': 263, 'bear_use_sma': False, 'bear_use_ema': False, 'bear_use_atr': True, 'bear_use_adx': True, 'bear_use_spike': True, 'bear_rsi_required': False, 'sideways_strategy': 'mean_reversion', 'sideways_bb_std_mult': 1.2279582847173414, 'sideways_rsi_os': 39, 'sideways_rsi_ob': 63, 'sideways_adx_thresh': 24.13161872546445, 'sideways_atr_min_pct': 0.00010526116066967965, 'sideways_atr_max_pct': 0.10434930467584613, 'sideways_tp_mult': 2.9030872721609415, 'sideways_tsl_mult': 0.9340445564997536, 'sideways_time_stop': 77, 'sideways_use_sma': True, 'sideways_use_ema': False, 'sideways_use_atr': False, 'sideways_use_adx': True, 'sideways_use_spike': True, 'sideways_rsi_required': True}.
[I 2025-08-30 16:10:08,610] Trial 671 finished with values: [-1000000000.0, 1000000000.0] and parameters: {'p_sma': 6, 'p_std': 52, 'p_atr': 28, 'p_adx': 12, 'rsi_period': 23, 'ema1': 22, 'ema2': 31, 'slip_atr_k': 0.08302497088246909, 'slip_spread_k': 0.14925039227822107, 'spread_hl_frac': 0.022120970907978356, 'bb_std_mult': 2.3891069709957162, 'rsi_os': 39, 'rsi_ob': 59, 'vol_spike': 0.2115421068513675, 'adx_thresh': 16.482262036717916, 'atr_min_pct': 0.015118808382947874, 'atr_max_pct': 0.073251275927693, 'tp_mult': 1.706921582692485, 'tsl_mult': 0.4175059627059554, 'strategy': 'mean_reversion', 'time_stop': 234, 'use_sma': True, 'use_atr': True, 'use_adx': False, 'use_ema': True, 'use_spike': False, 'rsi_required': False, 'edge_k': 0.39578236577894355, 'edge_cap': 0.6375676843754998, 'bull_strategy': 'breakout', 'bull_bb_std_mult': 0.7974522940074774, 'bull_rsi_os': 42, 'bull_rsi_ob': 58, 'bull_adx_thresh': 24.53193110162576, 'bull_atr_min_pct': 0.020501941576480626, 'bull_atr_max_pct': 0.09968906745959455, 'bull_tp_mult': 2.013921785677992, 'bull_tsl_mult': 0.025966214260791723, 'bull_time_stop': 50, 'bull_use_sma': True, 'bull_use_ema': True, 'bull_use_atr': True, 'bull_use_adx': True, 'bull_use_spike': True, 'bull_rsi_required': True, 'bear_strategy': 'breakout', 'bear_bb_std_mult': 2.550800371900532, 'bear_rsi_os': 38, 'bear_rsi_ob': 84, 'bear_adx_thresh': 30.31938656987731, 'bear_atr_min_pct': 0.021026670200855913, 'bear_atr_max_pct': 0.1447204818151901, 'bear_tp_mult': 2.9044187950469733, 'bear_tsl_mult': 0.53771970986557, 'bear_time_stop': 284, 'bear_use_sma': False, 'bear_use_ema': False, 'bear_use_atr': True, 'bear_use_adx': True, 'bear_use_spike': True, 'bear_rsi_required': False, 'sideways_strategy': 'mean_reversion', 'sideways_bb_std_mult': 0.7981465236199488, 'sideways_rsi_os': 39, 'sideways_rsi_ob': 64, 'sideways_adx_thresh': 24.241200911116195, 'sideways_atr_min_pct': 0.013193764952093812, 'sideways_atr_max_pct': 0.10389853716202256, 'sideways_tp_mult': 2.9097147209863556, 'sideways_tsl_mult': 0.9027351658331346, 'sideways_time_stop': 44, 'sideways_use_sma': True, 'sideways_use_ema': False, 'sideways_use_atr': False, 'sideways_use_adx': True, 'sideways_use_spike': True, 'sideways_rsi_required': True}.
[I 2025-08-30 16:10:09,748] Trial 672 finished with values: [-0.02009568455134325, 0.020018882092090583] and parameters: {'p_sma': 41, 'p_std': 52, 'p_atr': 28, 'p_adx': 12, 'rsi_period': 81, 'ema1': 22, 'ema2': 31, 'slip_atr_k': 0.08308975580112776, 'slip_spread_k': 0.1462077888325649, 'spread_hl_frac': 0.022309012077053304, 'bb_std_mult': 2.415991450498216, 'rsi_os': 39, 'rsi_ob': 51, 'vol_spike': 0.21946871368591903, 'adx_thresh': 16.031924115422385, 'atr_min_pct': 0.015038974717050142, 'atr_max_pct': 0.05494860715876444, 'tp_mult': 2.7822129535205256, 'tsl_mult': 0.2572679943077935, 'strategy': 'mean_reversion', 'time_stop': 233, 'use_sma': True, 'use_atr': True, 'use_adx': True, 'use_ema': False, 'use_spike': False, 'rsi_required': False, 'edge_k': 0.4277113817027449, 'edge_cap': 0.6272061647985108, 'bull_strategy': 'breakout', 'bull_bb_std_mult': 0.7679540436526026, 'bull_rsi_os': 40, 'bull_rsi_ob': 64, 'bull_adx_thresh': 24.67349552450174, 'bull_atr_min_pct': 0.015829028344645484, 'bull_atr_max_pct': 0.09010725430078236, 'bull_tp_mult': 1.9273165535458963, 'bull_tsl_mult': 0.15200822270304393, 'bull_time_stop': 79, 'bull_use_sma': True, 'bull_use_ema': True, 'bull_use_atr': True, 'bull_use_adx': True, 'bull_use_spike': True, 'bull_rsi_required': True, 'bear_strategy': 'breakout', 'bear_bb_std_mult': 2.5249174783266772, 'bear_rsi_os': 37, 'bear_rsi_ob': 83, 'bear_adx_thresh': 14.868515003807037, 'bear_atr_min_pct': 0.021118701946504122, 'bear_atr_max_pct': 0.08028552629582646, 'bear_tp_mult': 2.8976915718428065, 'bear_tsl_mult': 0.31478715255240675, 'bear_time_stop': 264, 'bear_use_sma': False, 'bear_use_ema': False, 'bear_use_atr': True, 'bear_use_adx': True, 'bear_use_spike': True, 'bear_rsi_required': False, 'sideways_strategy': 'mean_reversion', 'sideways_bb_std_mult': 0.7431236227333096, 'sideways_rsi_os': 38, 'sideways_rsi_ob': 63, 'sideways_adx_thresh': 24.02749099349234, 'sideways_atr_min_pct': 6.434753560868173e-05, 'sideways_atr_max_pct': 0.1048705086802574, 'sideways_tp_mult': 2.9038312761198504, 'sideways_tsl_mult': 0.9377577378583224, 'sideways_time_stop': 39, 'sideways_use_sma': True, 'sideways_use_ema': False, 'sideways_use_atr': False, 'sideways_use_adx': True, 'sideways_use_spike': True, 'sideways_rsi_required': True}.
[I 2025-08-30 16:10:54,640] Trial 674 finished with values: [-1000000000.0, 1000000000.0] and parameters: {'p_sma': 6, 'p_std': 55, 'p_atr': 29, 'p_adx': 12, 'rsi_period': 59, 'ema1': 22, 'ema2': 31, 'slip_atr_k': 0.07254849226127, 'slip_spread_k': 0.1448577235359753, 'spread_hl_frac': 0.02466956591583898, 'bb_std_mult': 2.3867302111728255, 'rsi_os': 40, 'rsi_ob': 52, 'vol_spike': 0.21525904826331418, 'adx_thresh': 15.819235469552341, 'atr_min_pct': 0.014960780054837159, 'atr_max_pct': 0.019801688118376272, 'tp_mult': 2.0649977678760836, 'tsl_mult': 0.2634880556808359, 'strategy': 'mean_reversion', 'time_stop': 199, 'use_sma': True, 'use_atr': True, 'use_adx': True, 'use_ema': False, 'use_spike': True, 'rsi_required': False, 'edge_k': 0.46428767537057875, 'edge_cap': 0.6332709721406998, 'bull_strategy': 'breakout', 'bull_bb_std_mult': 0.7613901319463705, 'bull_rsi_os': 40, 'bull_rsi_ob': 64, 'bull_adx_thresh': 24.02555730148692, 'bull_atr_min_pct': 0.01684990591128553, 'bull_atr_max_pct': 0.08614250157591684, 'bull_tp_mult': 1.9248427100749337, 'bull_tsl_mult': 0.11648917733871228, 'bull_time_stop': 53, 'bull_use_sma': True, 'bull_use_ema': True, 'bull_use_atr': True, 'bull_use_adx': True, 'bull_use_spike': True, 'bull_rsi_required': True, 'bear_strategy': 'mean_reversion', 'bear_bb_std_mult': 2.5316149852260623, 'bear_rsi_os': 38, 'bear_rsi_ob': 87, 'bear_adx_thresh': 14.590093995557734, 'bear_atr_min_pct': 0.001072781521996349, 'bear_atr_max_pct': 0.09575302739325614, 'bear_tp_mult': 2.7515922215494544, 'bear_tsl_mult': 0.5369113023414969, 'bear_time_stop': 246, 'bear_use_sma': False, 'bear_use_ema': False, 'bear_use_atr': False, 'bear_use_adx': True, 'bear_use_spike': True, 'bear_rsi_required': True, 'sideways_strategy': 'mean_reversion', 'sideways_bb_std_mult': 0.7596482692571451, 'sideways_rsi_os': 40, 'sideways_rsi_ob': 61, 'sideways_adx_thresh': 24.173273839587758, 'sideways_atr_min_pct': 0.012170825919118491, 'sideways_atr_max_pct': 0.01993616121999668, 'sideways_tp_mult': 2.9122052968926386, 'sideways_tsl_mult': 0.9004150868640457, 'sideways_time_stop': 164, 'sideways_use_sma': True, 'sideways_use_ema': True, 'sideways_use_atr': False, 'sideways_use_adx': True, 'sideways_use_spike': True, 'sideways_rsi_required': True}.
[I 2025-08-30 16:10:56,371] Trial 675 finished with values: [-1000000000.0, 1000000000.0] and parameters: {'p_sma': 6, 'p_std': 56, 'p_atr': 24, 'p_adx': 10, 'rsi_period': 78, 'ema1': 23, 'ema2': 32, 'slip_atr_k': 0.07195619846371001, 'slip_spread_k': 0.14805389748245626, 'spread_hl_frac': 0.024695036448946994, 'bb_std_mult': 2.410154672580098, 'rsi_os': 38, 'rsi_ob': 73, 'vol_spike': 0.2045505084645352, 'adx_thresh': 14.419246468857875, 'atr_min_pct': 0.014965922673919031, 'atr_max_pct': 0.021703150903556866, 'tp_mult': 2.773736820714606, 'tsl_mult': 0.3402179212677729, 'strategy': 'mean_reversion', 'time_stop': 225, 'use_sma': True, 'use_atr': True, 'use_adx': True, 'use_ema': False, 'use_spike': True, 'rsi_required': False, 'edge_k': 0.4758801644865265, 'edge_cap': 0.6280119656708161, 'bull_strategy': 'breakout', 'bull_bb_std_mult': 0.7148221847929885, 'bull_rsi_os': 40, 'bull_rsi_ob': 64, 'bull_adx_thresh': 24.12778250894689, 'bull_atr_min_pct': 0.011911474440226194, 'bull_atr_max_pct': 0.0905023547558022, 'bull_tp_mult': 1.962902080720654, 'bull_tsl_mult': 0.1802193411089093, 'bull_time_stop': 79, 'bull_use_sma': True, 'bull_use_ema': True, 'bull_use_atr': True, 'bull_use_adx': True, 'bull_use_spike': True, 'bull_rsi_required': True, 'bear_strategy': 'mean_reversion', 'bear_bb_std_mult': 2.6509180844582128, 'bear_rsi_os': 37, 'bear_rsi_ob': 87, 'bear_adx_thresh': 14.965706875492835, 'bear_atr_min_pct': 0.019655797158718378, 'bear_atr_max_pct': 0.08442935744189917, 'bear_tp_mult': 2.7653448844178756, 'bear_tsl_mult': 0.3200165012425876, 'bear_time_stop': 264, 'bear_use_sma': False, 'bear_use_ema': False, 'bear_use_atr': False, 'bear_use_adx': True, 'bear_use_spike': True, 'bear_rsi_required': True, 'sideways_strategy': 'breakout', 'sideways_bb_std_mult': 0.6752739061728584, 'sideways_rsi_os': 40, 'sideways_rsi_ob': 63, 'sideways_adx_thresh': 23.960756897688768, 'sideways_atr_min_pct': 0.022240203603401502, 'sideways_atr_max_pct': 0.14450202310932278, 'sideways_tp_mult': 2.876062915572671, 'sideways_tsl_mult': 0.9393785919939037, 'sideways_time_stop': 252, 'sideways_use_sma': True, 'sideways_use_ema': True, 'sideways_use_atr': False, 'sideways_use_adx': True, 'sideways_use_spike': True, 'sideways_rsi_required': True}.
