[I 2025-08-30 14:42:21,132] Trial 178 finished with values: [-1000000000.0, 1000000000.0] and parameters: {'p_sma': 54, 'p_std': 42, 'p_atr': 13, 'p_adx': 10, 'rsi_period': 12, 'ema1': 18, 'ema2': 48, 'slip_atr_k': 0.018928959438498587, 'slip_spread_k': 0.7911408935733464, 'spread_hl_frac': 0.015902926860555805, 'bb_std_mult': 1.9107794191700682, 'rsi_os': 15, 'rsi_ob': 83, 'vol_spike': 0.1612443657404184, 'adx_thresh': 21.547609571621543, 'atr_min_pct': 0.004466376496670959, 'atr_max_pct': 0.10423142640876659, 'tp_mult': 2.650579342760409, 'tsl_mult': 0.9999934786610656, 'strategy': 'mean_reversion', 'time_stop': 15, 'use_sma': True, 'use_atr': False, 'use_adx': False, 'use_ema': False, 'use_spike': True, 'rsi_required': False, 'edge_k': 0.8728639511621634, 'edge_cap': 0.6347703702319957, 'bull_strategy': 'mean_reversion', 'bull_bb_std_mult': 1.0941644100850993, 'bull_rsi_os': 17, 'bull_rsi_ob': 84, 'bull_adx_thresh': 5.749707168650048, 'bull_atr_min_pct': 0.025920286326625547, 'bull_atr_max_pct': 0.13394379367953937, 'bull_tp_mult': 1.603414661645267, 'bull_tsl_mult': 0.5491886474213619, 'bull_time_stop': 112, 'bull_use_sma': False, 'bull_use_ema': False, 'bull_use_atr': True, 'bull_use_adx': True, 'bull_use_spike': True, 'bull_rsi_required': False, 'bear_strategy': 'breakout', 'bear_bb_std_mult': 0.9811498585703333, 'bear_rsi_os': 37, 'bear_rsi_ob': 49, 'bear_adx_thresh': 19.526424785017493, 'bear_atr_min_pct': 0.005146811646122424, 'bear_atr_max_pct': 0.03275437579013579, 'bear_tp_mult': 2.1067920909213886, 'bear_tsl_mult': 0.5803198950723071, 'bear_time_stop': 43, 'bear_use_sma': False, 'bear_use_ema': False, 'bear_use_atr': False, 'bear_use_adx': False, 'bear_use_spike': True, 'bear_rsi_required': True, 'sideways_strategy': 'mean_reversion', 'sideways_bb_std_mult': 1.6777655546219916, 'sideways_rsi_os': 39, 'sideways_rsi_ob': 90, 'sideways_adx_thresh': 17.98271979776051, 'sideways_atr_min_pct': 0.029930059209256885, 'sideways_atr_max_pct': 0.04650973062307248, 'sideways_tp_mult': 2.863883734185864, 'sideways_tsl_mult': 0.47999066306859894, 'sideways_time_stop': 227, 'sideways_use_sma': False, 'sideways_use_ema': True, 'sideways_use_atr': True, 'sideways_use_adx': False, 'sideways_use_spike': True, 'sideways_rsi_required': True}.
[I 2025-08-30 14:42:52,648] Trial 183 finished with values: [-1000000000.0, 1000000000.0] and parameters: {'p_sma': 34, 'p_std': 31, 'p_atr': 13, 'p_adx': 21, 'rsi_period': 53, 'ema1': 6, 'ema2': 42, 'slip_atr_k': 0.02577652569761106, 'slip_spread_k': 0.2882618828654575, 'spread_hl_frac': 0.003632727096764804, 'bb_std_mult': 1.3255319187822505, 'rsi_os': 16, 'rsi_ob': 86, 'vol_spike': 0.248025917333577, 'adx_thresh': 19.369982070508662, 'atr_min_pct': 0.029909971188127202, 'atr_max_pct': 0.10579320279322549, 'tp_mult': 1.60314905658976, 'tsl_mult': 0.9744778712547513, 'strategy': 'breakout', 'time_stop': 42, 'use_sma': True, 'use_atr': False, 'use_adx': False, 'use_ema': False, 'use_spike': True, 'rsi_required': True, 'edge_k': 1.4577463954060754, 'edge_cap': 0.08128696551283915, 'bull_strategy': 'mean_reversion', 'bull_bb_std_mult': 3.444349866814147, 'bull_rsi_os': 13, 'bull_rsi_ob': 91, 'bull_adx_thresh': 12.39521877415616, 'bull_atr_min_pct': 0.006779969775599005, 'bull_atr_max_pct': 0.018870753910754767, 'bull_tp_mult': 2.1376180241883875, 'bull_tsl_mult': 0.5492306709420206, 'bull_time_stop': 73, 'bull_use_sma': False, 'bull_use_ema': False, 'bull_use_atr': False, 'bull_use_adx': True, 'bull_use_spike': False, 'bull_rsi_required': True, 'bear_strategy': 'mean_reversion', 'bear_bb_std_mult': 0.5871491745638413, 'bear_rsi_os': 31, 'bear_rsi_ob': 52, 'bear_adx_thresh': 28.243768280077013, 'bear_atr_min_pct': 0.020556765052303597, 'bear_atr_max_pct': 0.0312796694906912, 'bear_tp_mult': 2.1776812792504865, 'bear_tsl_mult': 0.2684372982106003, 'bear_time_stop': 32, 'bear_use_sma': False, 'bear_use_ema': False, 'bear_use_atr': False, 'bear_use_adx': False, 'bear_use_spike': False, 'bear_rsi_required': False, 'sideways_strategy': 'breakout', 'sideways_bb_std_mult': 3.0397890081685395, 'sideways_rsi_os': 16, 'sideways_rsi_ob': 73, 'sideways_adx_thresh': 32.00803748965869, 'sideways_atr_min_pct': 0.004856155678831204, 'sideways_atr_max_pct': 0.08329640066960896, 'sideways_tp_mult': 2.7284396616391566, 'sideways_tsl_mult': 0.5402227525743905, 'sideways_time_stop': 76, 'sideways_use_sma': False, 'sideways_use_ema': False, 'sideways_use_atr': True, 'sideways_use_adx': False, 'sideways_use_spike': True, 'sideways_rsi_required': True}.
[I 2025-08-30 14:42:53,004] Trial 182 finished with values: [-1000000000.0, 1000000000.0] and parameters: {'p_sma': 18, 'p_std': 14, 'p_atr': 12, 'p_adx': 21, 'rsi_period': 53, 'ema1': 21, 'ema2': 48, 'slip_atr_k': 0.011966189175427888, 'slip_spread_k': 0.02944680942683703, 'spread_hl_frac': 0.00329014798517245, 'bb_std_mult': 1.69903764444208, 'rsi_os': 45, 'rsi_ob': 91, 'vol_spike': 0.24827431909507933, 'adx_thresh': 21.489091350222353, 'atr_min_pct': 0.01962528769277605, 'atr_max_pct': 0.10306307431461509, 'tp_mult': 2.7616911618304103, 'tsl_mult': 0.12886748269278603, 'strategy': 'breakout', 'time_stop': 249, 'use_sma': True, 'use_atr': False, 'use_adx': False, 'use_ema': False, 'use_spike': True, 'rsi_required': True, 'edge_k': 1.4281142059427228, 'edge_cap': 0.19243882718747746, 'bull_strategy': 'mean_reversion', 'bull_bb_std_mult': 2.639442033998674, 'bull_rsi_os': 34, 'bull_rsi_ob': 78, 'bull_adx_thresh': 17.349570770068457, 'bull_atr_min_pct': 0.0036591959928872326, 'bull_atr_max_pct': 0.13527089491316968, 'bull_tp_mult': 2.134789278970537, 'bull_tsl_mult': 0.30498592079832126, 'bull_time_stop': 49, 'bull_use_sma': False, 'bull_use_ema': False, 'bull_use_atr': False, 'bull_use_adx': True, 'bull_use_spike': False, 'bull_rsi_required': True, 'bear_strategy': 'breakout', 'bear_bb_std_mult': 1.2556760199646995, 'bear_rsi_os': 16, 'bear_rsi_ob': 51, 'bear_adx_thresh': 28.60204023982709, 'bear_atr_min_pct': 0.009940043968090959, 'bear_atr_max_pct': 0.08681942003895474, 'bear_tp_mult': 1.8889566404535278, 'bear_tsl_mult': 0.6774646137475315, 'bear_time_stop': 149, 'bear_use_sma': False, 'bear_use_ema': False, 'bear_use_atr': False, 'bear_use_adx': False, 'bear_use_spike': True, 'bear_rsi_required': False, 'sideways_strategy': 'breakout', 'sideways_bb_std_mult': 3.0567292641218335, 'sideways_rsi_os': 34, 'sideways_rsi_ob': 83, 'sideways_adx_thresh': 16.12411294989481, 'sideways_atr_min_pct': 0.02970936023337088, 'sideways_atr_max_pct': 0.08293691748641915, 'sideways_tp_mult': 1.880587454120381, 'sideways_tsl_mult': 0.568600232022587, 'sideways_time_stop': 232, 'sideways_use_sma': True, 'sideways_use_ema': False, 'sideways_use_atr': True, 'sideways_use_adx': False, 'sideways_use_spike': True, 'sideways_rsi_required': True}.
[I 2025-08-30 14:42:53,415] Trial 184 finished with values: [-1000000000.0, 1000000000.0] and parameters: {'p_sma': 34, 'p_std': 15, 'p_atr': 14, 'p_adx': 21, 'rsi_period': 45, 'ema1': 29, 'ema2': 24, 'slip_atr_k': 0.009258391001763705, 'slip_spread_k': 0.7185487931694559, 'spread_hl_frac': 0.003686853505581663, 'bb_std_mult': 1.6224137420508427, 'rsi_os': 42, 'rsi_ob': 91, 'vol_spike': 0.2476367725436088, 'adx_thresh': 19.205561799645558, 'atr_min_pct': 0.007590088244215321, 'atr_max_pct': 0.10845632682956355, 'tp_mult': 1.6092647193478926, 'tsl_mult': 0.9733323461642811, 'strategy': 'breakout', 'time_stop': 129, 'use_sma': True, 'use_atr': False, 'use_adx': True, 'use_ema': False, 'use_spike': False, 'rsi_required': True, 'edge_k': 1.6298410595008161, 'edge_cap': 0.4227815960812951, 'bull_strategy': 'breakout', 'bull_bb_std_mult': 1.4158794367178902, 'bull_rsi_os': 52, 'bull_rsi_ob': 62, 'bull_adx_thresh': 12.612701195522746, 'bull_atr_min_pct': 0.011075916435780962, 'bull_atr_max_pct': 0.08492761092082943, 'bull_tp_mult': 2.796613717142348, 'bull_tsl_mult': 0.8890620267254805, 'bull_time_stop': 145, 'bull_use_sma': True, 'bull_use_ema': False, 'bull_use_atr': False, 'bull_use_adx': True, 'bull_use_spike': False, 'bull_rsi_required': True, 'bear_strategy': 'mean_reversion', 'bear_bb_std_mult': 1.250009331626561, 'bear_rsi_os': 16, 'bear_rsi_ob': 51, 'bear_adx_thresh': 18.0854872671702, 'bear_atr_min_pct': 0.011818904283951607, 'bear_atr_max_pct': 0.023228508594311865, 'bear_tp_mult': 2.062720167722724, 'bear_tsl_mult': 0.35391600239250287, 'bear_time_stop': 300, 'bear_use_sma': False, 'bear_use_ema': False, 'bear_use_atr': True, 'bear_use_adx': False, 'bear_use_spike': False, 'bear_rsi_required': False, 'sideways_strategy': 'breakout', 'sideways_bb_std_mult': 3.199877295176292, 'sideways_rsi_os': 32, 'sideways_rsi_ob': 54, 'sideways_adx_thresh': 14.691163578373407, 'sideways_atr_min_pct': 0.004285515856269022, 'sideways_atr_max_pct': 0.08332788119807157, 'sideways_tp_mult': 2.728498911844766, 'sideways_tsl_mult': 0.04948484214126874, 'sideways_time_stop': 74, 'sideways_use_sma': False, 'sideways_use_ema': False, 'sideways_use_atr': False, 'sideways_use_adx': True, 'sideways_use_spike': True, 'sideways_rsi_required': True}.
[I 2025-08-30 14:42:53,511] Trial 181 finished with values: [-1000000000.0, 1000000000.0] and parameters: {'p_sma': 34, 'p_std': 14, 'p_atr': 12, 'p_adx': 30, 'rsi_period': 49, 'ema1': 9, 'ema2': 48, 'slip_atr_k': 0.012606945093985335, 'slip_spread_k': 0.2791400421496994, 'spread_hl_frac': 0.015794716643251796, 'bb_std_mult': 1.927290969340501, 'rsi_os': 42, 'rsi_ob': 70, 'vol_spike': 0.24661325985734275, 'adx_thresh': 22.64512821092382, 'atr_min_pct': 0.004814269057243163, 'atr_max_pct': 0.11692971802407716, 'tp_mult': 2.546553528439798, 'tsl_mult': 0.9709352016487288, 'strategy': 'mean_reversion', 'time_stop': 251, 'use_sma': True, 'use_atr': False, 'use_adx': False, 'use_ema': False, 'use_spike': False, 'rsi_required': False, 'edge_k': 1.5849127138633559, 'edge_cap': 0.6805201963949854, 'bull_strategy': 'breakout', 'bull_bb_std_mult': 2.794407531115504, 'bull_rsi_os': 36, 'bull_rsi_ob': 91, 'bull_adx_thresh': 5.781468407353312, 'bull_atr_min_pct': 0.01668990984962593, 'bull_atr_max_pct': 0.13723051668470687, 'bull_tp_mult': 2.406269014172432, 'bull_tsl_mult': 0.5504603858604048, 'bull_time_stop': 5, 'bull_use_sma': False, 'bull_use_ema': False, 'bull_use_atr': True, 'bull_use_adx': True, 'bull_use_spike': True, 'bull_rsi_required': False, 'bear_strategy': 'breakout', 'bear_bb_std_mult': 1.003363631744946, 'bear_rsi_os': 23, 'bear_rsi_ob': 49, 'bear_adx_thresh': 18.132216272346657, 'bear_atr_min_pct': 0.011134423182664596, 'bear_atr_max_pct': 0.030548271864206666, 'bear_tp_mult': 2.1493283648567183, 'bear_tsl_mult': 0.6822133256220355, 'bear_time_stop': 147, 'bear_use_sma': False, 'bear_use_ema': False, 'bear_use_atr': False, 'bear_use_adx': False, 'bear_use_spike': True, 'bear_rsi_required': True, 'sideways_strategy': 'mean_reversion', 'sideways_bb_std_mult': 3.0386734815242025, 'sideways_rsi_os': 34, 'sideways_rsi_ob': 54, 'sideways_adx_thresh': 16.034721339408218, 'sideways_atr_min_pct': 0.009419454521429763, 'sideways_atr_max_pct': 0.12753498823433784, 'sideways_tp_mult': 2.8964223167231333, 'sideways_tsl_mult': 0.04887057198536474, 'sideways_time_stop': 74, 'sideways_use_sma': True, 'sideways_use_ema': True, 'sideways_use_atr': False, 'sideways_use_adx': True, 'sideways_use_spike': True, 'sideways_rsi_required': True}.
[I 2025-08-30 14:42:53,919] Trial 187 finished with values: [-1000000000.0, 1000000000.0] and parameters: {'p_sma': 32, 'p_std': 28, 'p_atr': 22, 'p_adx': 30, 'rsi_period': 51, 'ema1': 27, 'ema2': 50, 'slip_atr_k': 0.004319084620604083, 'slip_spread_k': 0.28466839750510675, 'spread_hl_frac': 0.0016211199217273306, 'bb_std_mult': 1.1965377700457913, 'rsi_os': 38, 'rsi_ob': 49, 'vol_spike': 0.2591786443388632, 'adx_thresh': 18.445597890433042, 'atr_min_pct': 0.01698520852806603, 'atr_max_pct': 0.045100999498056786, 'tp_mult': 2.223456037507558, 'tsl_mult': 0.9495361586393368, 'strategy': 'mean_reversion', 'time_stop': 35, 'use_sma': False, 'use_atr': False, 'use_adx': True, 'use_ema': False, 'use_spike': False, 'rsi_required': False, 'edge_k': 1.688303671188795, 'edge_cap': 0.7498113910302527, 'bull_strategy': 'breakout', 'bull_bb_std_mult': 0.7366605505135375, 'bull_rsi_os': 16, 'bull_rsi_ob': 60, 'bull_adx_thresh': 10.858793916528905, 'bull_atr_min_pct': 0.0168222114066451, 'bull_atr_max_pct': 0.1061217380890282, 'bull_tp_mult': 1.4315647148335968, 'bull_tsl_mult': 0.1676252017322969, 'bull_time_stop': 261, 'bull_use_sma': True, 'bull_use_ema': False, 'bull_use_atr': True, 'bull_use_adx': False, 'bull_use_spike': False, 'bull_rsi_required': True, 'bear_strategy': 'breakout', 'bear_bb_std_mult': 2.116692917172652, 'bear_rsi_os': 45, 'bear_rsi_ob': 53, 'bear_adx_thresh': 17.655357597517263, 'bear_atr_min_pct': 0.022375348565254798, 'bear_atr_max_pct': 0.13550440704803085, 'bear_tp_mult': 2.042327362062876, 'bear_tsl_mult': 0.23632953347600333, 'bear_time_stop': 34, 'bear_use_sma': True, 'bear_use_ema': True, 'bear_use_atr': False, 'bear_use_adx': False, 'bear_use_spike': True, 'bear_rsi_required': False, 'sideways_strategy': 'breakout', 'sideways_bb_std_mult': 2.3843533195390085, 'sideways_rsi_os': 18, 'sideways_rsi_ob': 88, 'sideways_adx_thresh': 13.729353990895621, 'sideways_atr_min_pct': 0.0028288488604438274, 'sideways_atr_max_pct': 0.07709770692227966, 'sideways_tp_mult': 2.0145064178808, 'sideways_tsl_mult': 0.7522529565291055, 'sideways_time_stop': 275, 'sideways_use_sma': False, 'sideways_use_ema': False, 'sideways_use_atr': False, 'sideways_use_adx': True, 'sideways_use_spike': True, 'sideways_rsi_required': True}.
[I 2025-08-30 14:43:24,944] Trial 186 finished with values: [-1000000000.0, 1000000000.0] and parameters: {'p_sma': 32, 'p_std': 27, 'p_atr': 30, 'p_adx': 22, 'rsi_period': 45, 'ema1': 9, 'ema2': 50, 'slip_atr_k': 0.004873859084020157, 'slip_spread_k': 0.2715978662437285, 'spread_hl_frac': 0.022312843005556613, 'bb_std_mult': 2.205226689496742, 'rsi_os': 42, 'rsi_ob': 75, 'vol_spike': 0.25488515112693333, 'adx_thresh': 22.740415857849577, 'atr_min_pct': 0.020499782554578017, 'atr_max_pct': 0.02783347625689201, 'tp_mult': 2.488008636792803, 'tsl_mult': 0.9625505946990169, 'strategy': 'mean_reversion', 'time_stop': 34, 'use_sma': False, 'use_atr': False, 'use_adx': True, 'use_ema': False, 'use_spike': False, 'rsi_required': False, 'edge_k': 1.612077956481463, 'edge_cap': 0.5271099917717218, 'bull_strategy': 'breakout', 'bull_bb_std_mult': 3.2445687192731683, 'bull_rsi_os': 55, 'bull_rsi_ob': 56, 'bull_adx_thresh': 12.932902452307193, 'bull_atr_min_pct': 0.027543789697600705, 'bull_atr_max_pct': 0.013008397794765321, 'bull_tp_mult': 1.4401367095633244, 'bull_tsl_mult': 0.2591023306244751, 'bull_time_stop': 261, 'bull_use_sma': True, 'bull_use_ema': False, 'bull_use_atr': True, 'bull_use_adx': False, 'bull_use_spike': False, 'bull_rsi_required': True, 'bear_strategy': 'breakout', 'bear_bb_std_mult': 1.1030595611896357, 'bear_rsi_os': 44, 'bear_rsi_ob': 80, 'bear_adx_thresh': 17.848856872022548, 'bear_atr_min_pct': 0.011758909856079245, 'bear_atr_max_pct': 0.022374516191223402, 'bear_tp_mult': 2.634757296195854, 'bear_tsl_mult': 0.6504037448680313, 'bear_time_stop': 28, 'bear_use_sma': False, 'bear_use_ema': True, 'bear_use_atr': True, 'bear_use_adx': False, 'bear_use_spike': False, 'bear_rsi_required': False, 'sideways_strategy': 'breakout', 'sideways_bb_std_mult': 3.1893977995648966, 'sideways_rsi_os': 50, 'sideways_rsi_ob': 88, 'sideways_adx_thresh': 13.265944954441522, 'sideways_atr_min_pct': 0.004231883360611817, 'sideways_atr_max_pct': 0.12749718807155408, 'sideways_tp_mult': 2.7683903655346636, 'sideways_tsl_mult': 0.05503752663689843, 'sideways_time_stop': 200, 'sideways_use_sma': False, 'sideways_use_ema': False, 'sideways_use_atr': False, 'sideways_use_adx': True, 'sideways_use_spike': True, 'sideways_rsi_required': True}.
[I 2025-08-30 14:43:25,177] Trial 185 finished with values: [-0.015931755890119748, 0.01648285149544044] and parameters: {'p_sma': 45, 'p_std': 27, 'p_atr': 12, 'p_adx': 30, 'rsi_period': 45, 'ema1': 9, 'ema2': 51, 'slip_atr_k': 0.009089163280947696, 'slip_spread_k': 0.7315704614620926, 'spread_hl_frac': 0.002930056642003515, 'bb_std_mult': 1.9963759688772502, 'rsi_os': 23, 'rsi_ob': 91, 'vol_spike': 0.25222956594412543, 'adx_thresh': 22.500369960239926, 'atr_min_pct': 0.01698373022464648, 'atr_max_pct': 0.10984320808300686, 'tp_mult': 2.4954208584545694, 'tsl_mult': 0.9630935142787002, 'strategy': 'mean_reversion', 'time_stop': 36, 'use_sma': False, 'use_atr': False, 'use_adx': True, 'use_ema': False, 'use_spike': False, 'rsi_required': False, 'edge_k': 1.6222656851724007, 'edge_cap': 0.7832426586775209, 'bull_strategy': 'breakout', 'bull_bb_std_mult': 2.7906100277047905, 'bull_rsi_os': 52, 'bull_rsi_ob': 62, 'bull_adx_thresh': 10.705777051482237, 'bull_atr_min_pct': 0.0029425347495678086, 'bull_atr_max_pct': 0.017442168348581342, 'bull_tp_mult': 1.4368128560516948, 'bull_tsl_mult': 0.5758751328922294, 'bull_time_stop': 263, 'bull_use_sma': True, 'bull_use_ema': False, 'bull_use_atr': True, 'bull_use_adx': True, 'bull_use_spike': False, 'bull_rsi_required': True, 'bear_strategy': 'breakout', 'bear_bb_std_mult': 1.2511267323078867, 'bear_rsi_os': 15, 'bear_rsi_ob': 51, 'bear_adx_thresh': 18.047624125554467, 'bear_atr_min_pct': 0.01187671619218093, 'bear_atr_max_pct': 0.1338362242531237, 'bear_tp_mult': 1.9025384060535881, 'bear_tsl_mult': 0.8955609986559006, 'bear_time_stop': 37, 'bear_use_sma': False, 'bear_use_ema': True, 'bear_use_atr': True, 'bear_use_adx': False, 'bear_use_spike': False, 'bear_rsi_required': False, 'sideways_strategy': 'breakout', 'sideways_bb_std_mult': 3.0692878741403162, 'sideways_rsi_os': 32, 'sideways_rsi_ob': 77, 'sideways_adx_thresh': 13.34577648535236, 'sideways_atr_min_pct': 0.004358940482264928, 'sideways_atr_max_pct': 0.07677827838042783, 'sideways_tp_mult': 2.711605372771191, 'sideways_tsl_mult': 0.026541569114445995, 'sideways_time_stop': 198, 'sideways_use_sma': True, 'sideways_use_ema': False, 'sideways_use_atr': False, 'sideways_use_adx': True, 'sideways_use_spike': True, 'sideways_rsi_required': True}.
[I 2025-08-30 14:43:25,411] Trial 188 finished with values: [-0.035845654332462784, 0.035943106897944076] and parameters: {'p_sma': 32, 'p_std': 27, 'p_atr': 22, 'p_adx': 22, 'rsi_period': 51, 'ema1': 27, 'ema2': 34, 'slip_atr_k': 0.21900644822105675, 'slip_spread_k': 0.18404767419541843, 'spread_hl_frac': 0.04743200764227554, 'bb_std_mult': 2.198308172932884, 'rsi_os': 38, 'rsi_ob': 92, 'vol_spike': 0.26284859545976225, 'adx_thresh': 13.388068160892162, 'atr_min_pct': 0.02066262819855689, 'atr_max_pct': 0.048664741837642154, 'tp_mult': 2.481791895418615, 'tsl_mult': 0.9512113033543893, 'strategy': 'mean_reversion', 'time_stop': 194, 'use_sma': False, 'use_atr': False, 'use_adx': True, 'use_ema': False, 'use_spike': False, 'rsi_required': False, 'edge_k': 1.7402945069298936, 'edge_cap': 0.7460010040988971, 'bull_strategy': 'breakout', 'bull_bb_std_mult': 3.320253939478038, 'bull_rsi_os': 55, 'bull_rsi_ob': 56, 'bull_adx_thresh': 13.305374103592, 'bull_atr_min_pct': 0.002802489059614095, 'bull_atr_max_pct': 0.012614378622461689, 'bull_tp_mult': 1.4073698775052268, 'bull_tsl_mult': 0.5736799196554785, 'bull_time_stop': 260, 'bull_use_sma': True, 'bull_use_ema': False, 'bull_use_atr': True, 'bull_use_adx': False, 'bull_use_spike': False, 'bull_rsi_required': True, 'bear_strategy': 'breakout', 'bear_bb_std_mult': 1.0903982925157973, 'bear_rsi_os': 9, 'bear_rsi_ob': 48, 'bear_adx_thresh': 17.58603729477196, 'bear_atr_min_pct': 0.0249659013028877, 'bear_atr_max_pct': 0.036297420622732404, 'bear_tp_mult': 1.6328010478201016, 'bear_tsl_mult': 0.2217670352572039, 'bear_time_stop': 35, 'bear_use_sma': True, 'bear_use_ema': True, 'bear_use_atr': True, 'bear_use_adx': False, 'bear_use_spike': True, 'bear_rsi_required': False, 'sideways_strategy': 'breakout', 'sideways_bb_std_mult': 3.186721692763321, 'sideways_rsi_os': 50, 'sideways_rsi_ob': 88, 'sideways_adx_thresh': 13.749095204958227, 'sideways_atr_min_pct': 0.00319834093546781, 'sideways_atr_max_pct': 0.07612763268122916, 'sideways_tp_mult': 2.584754224407081, 'sideways_tsl_mult': 0.1351755242167512, 'sideways_time_stop': 191, 'sideways_use_sma': False, 'sideways_use_ema': False, 'sideways_use_atr': False, 'sideways_use_adx': True, 'sideways_use_spike': True, 'sideways_rsi_required': True}.
