[I 2025-08-30 14:44:58,916] Trial 201 finished with values: [-0.02307485582747104, 0.022972098060719256] and parameters: {'p_sma': 35, 'p_std': 29, 'p_atr': 10, 'p_adx': 14, 'rsi_period': 45, 'ema1': 20, 'ema2': 40, 'slip_atr_k': 0.01436515113889632, 'slip_spread_k': 0.22342385092295028, 'spread_hl_frac': 0.0021861383482603015, 'bb_std_mult': 2.1037167998173527, 'rsi_os': 37, 'rsi_ob': 94, 'vol_spike': 0.11031684305372019, 'adx_thresh': 21.440761883232344, 'atr_min_pct': 0.01162369818891715, 'atr_max_pct': 0.10556883393997751, 'tp_mult': 1.287390623722648, 'tsl_mult': 0.2980726644849446, 'strategy': 'breakout', 'time_stop': 44, 'use_sma': True, 'use_atr': False, 'use_adx': False, 'use_ema': False, 'use_spike': True, 'rsi_required': False, 'edge_k': 0.4164624255986047, 'edge_cap': 0.6760018638344371, 'bull_strategy': 'mean_reversion', 'bull_bb_std_mult': 3.278339131493893, 'bull_rsi_os': 18, 'bull_rsi_ob': 75, 'bull_adx_thresh': 19.862206378860606, 'bull_atr_min_pct': 0.0021054905986036595, 'bull_atr_max_pct': 0.01774864202442763, 'bull_tp_mult': 1.3226240876841358, 'bull_tsl_mult': 0.4583937814330213, 'bull_time_stop': 100, 'bull_use_sma': False, 'bull_use_ema': False, 'bull_use_atr': True, 'bull_use_adx': True, 'bull_use_spike': False, 'bull_rsi_required': True, 'bear_strategy': 'breakout', 'bear_bb_std_mult': 1.6099977331421833, 'bear_rsi_os': 17, 'bear_rsi_ob': 86, 'bear_adx_thresh': 30.9110288981208, 'bear_atr_min_pct': 0.0009525379516337265, 'bear_atr_max_pct': 0.029449477565730513, 'bear_tp_mult': 2.0426018080754873, 'bear_tsl_mult': 0.8449352250784903, 'bear_time_stop': 36, 'bear_use_sma': False, 'bear_use_ema': False, 'bear_use_atr': False, 'bear_use_adx': False, 'bear_use_spike': False, 'bear_rsi_required': False, 'sideways_strategy': 'mean_reversion', 'sideways_bb_std_mult': 3.019278818391165, 'sideways_rsi_os': 33, 'sideways_rsi_ob': 67, 'sideways_adx_thresh': 23.46722831732634, 'sideways_atr_min_pct': 0.004954007410523766, 'sideways_atr_max_pct': 0.08714957778367859, 'sideways_tp_mult': 2.7904399473916115, 'sideways_tsl_mult': 0.07510772671316912, 'sideways_time_stop': 183, 'sideways_use_sma': False, 'sideways_use_ema': False, 'sideways_use_atr': True, 'sideways_use_adx': False, 'sideways_use_spike': False, 'sideways_rsi_required': True}.
[I 2025-08-30 14:44:59,789] Trial 200 finished with values: [-0.08281918009799316, 0.082763521104186] and parameters: {'p_sma': 31, 'p_std': 31, 'p_atr': 11, 'p_adx': 23, 'rsi_period': 33, 'ema1': 27, 'ema2': 28, 'slip_atr_k': 0.16502936073376814, 'slip_spread_k': 0.22916233841176187, 'spread_hl_frac': 0.0030669584036313764, 'bb_std_mult': 0.7807374855773415, 'rsi_os': 40, 'rsi_ob': 66, 'vol_spike': 0.2389617934221422, 'adx_thresh': 26.78386106666939, 'atr_min_pct': 0.027909006461970053, 'atr_max_pct': 0.10532762755421408, 'tp_mult': 2.6998569520737483, 'tsl_mult': 0.647022916762495, 'strategy': 'breakout', 'time_stop': 206, 'use_sma': True, 'use_atr': False, 'use_adx': False, 'use_ema': False, 'use_spike': True, 'rsi_required': True, 'edge_k': 1.5876908823599234, 'edge_cap': 0.7284551965012482, 'bull_strategy': 'mean_reversion', 'bull_bb_std_mult': 3.1798880338400157, 'bull_rsi_os': 16, 'bull_rsi_ob': 45, 'bull_adx_thresh': 6.839145783639056, 'bull_atr_min_pct': 0.002119622659492739, 'bull_atr_max_pct': 0.04378878859108454, 'bull_tp_mult': 1.4469434836665631, 'bull_tsl_mult': 0.4611804160177857, 'bull_time_stop': 192, 'bull_use_sma': False, 'bull_use_ema': False, 'bull_use_atr': False, 'bull_use_adx': True, 'bull_use_spike': False, 'bull_rsi_required': True, 'bear_strategy': 'mean_reversion', 'bear_bb_std_mult': 1.0340668989460873, 'bear_rsi_os': 48, 'bear_rsi_ob': 48, 'bear_adx_thresh': 30.88147711279561, 'bear_atr_min_pct': 0.0008525270418248878, 'bear_atr_max_pct': 0.020114624484968032, 'bear_tp_mult': 1.2469233121375392, 'bear_tsl_mult': 0.14322562107061856, 'bear_time_stop': 50, 'bear_use_sma': True, 'bear_use_ema': False, 'bear_use_atr': False, 'bear_use_adx': False, 'bear_use_spike': True, 'bear_rsi_required': False, 'sideways_strategy': 'mean_reversion', 'sideways_bb_std_mult': 3.0276794169975356, 'sideways_rsi_os': 36, 'sideways_rsi_ob': 87, 'sideways_adx_thresh': 16.743205410893324, 'sideways_atr_min_pct': 0.004742817805188945, 'sideways_atr_max_pct': 0.07990569078874206, 'sideways_tp_mult': 2.647025653193097, 'sideways_tsl_mult': 0.1833342499298173, 'sideways_time_stop': 219, 'sideways_use_sma': False, 'sideways_use_ema': False, 'sideways_use_atr': True, 'sideways_use_adx': False, 'sideways_use_spike': True, 'sideways_rsi_required': True}.
[I 2025-08-30 14:45:00,023] Trial 198 finished with values: [-1000000000.0, 0.19021424243058407] and parameters: {'p_sma': 60, 'p_std': 31, 'p_atr': 10, 'p_adx': 13, 'rsi_period': 44, 'ema1': 27, 'ema2': 30, 'slip_atr_k': 0.19694719647754472, 'slip_spread_k': 0.22649921080135996, 'spread_hl_frac': 0.002384863793433622, 'bb_std_mult': 1.418450019754598, 'rsi_os': 46, 'rsi_ob': 91, 'vol_spike': 0.17058389231820661, 'adx_thresh': 20.86660031345691, 'atr_min_pct': 0.011529445302040956, 'atr_max_pct': 0.10991301295789205, 'tp_mult': 1.7929145730162075, 'tsl_mult': 0.9773881037437053, 'strategy': 'breakout', 'time_stop': 67, 'use_sma': True, 'use_atr': True, 'use_adx': False, 'use_ema': True, 'use_spike': True, 'rsi_required': True, 'edge_k': 1.1688512502778936, 'edge_cap': 0.46856437366087644, 'bull_strategy': 'mean_reversion', 'bull_bb_std_mult': 3.3982042192744863, 'bull_rsi_os': 16, 'bull_rsi_ob': 78, 'bull_adx_thresh': 13.988941899108667, 'bull_atr_min_pct': 0.0018698068567378798, 'bull_atr_max_pct': 0.04365091144990124, 'bull_tp_mult': 1.4567656815649006, 'bull_tsl_mult': 0.060118499498657385, 'bull_time_stop': 268, 'bull_use_sma': False, 'bull_use_ema': False, 'bull_use_atr': False, 'bull_use_adx': True, 'bull_use_spike': True, 'bull_rsi_required': False, 'bear_strategy': 'breakout', 'bear_bb_std_mult': 3.541674250459821, 'bear_rsi_os': 49, 'bear_rsi_ob': 67, 'bear_adx_thresh': 18.865024980369082, 'bear_atr_min_pct': 0.0007596466773624258, 'bear_atr_max_pct': 0.020338047210435622, 'bear_tp_mult': 2.9981789819025435, 'bear_tsl_mult': 0.7143740704559746, 'bear_time_stop': 51, 'bear_use_sma': False, 'bear_use_ema': False, 'bear_use_atr': False, 'bear_use_adx': False, 'bear_use_spike': True, 'bear_rsi_required': True, 'sideways_strategy': 'mean_reversion', 'sideways_bb_std_mult': 1.8710879615528375, 'sideways_rsi_os': 32, 'sideways_rsi_ob': 89, 'sideways_adx_thresh': 23.335017107565946, 'sideways_atr_min_pct': 0.023894160242857385, 'sideways_atr_max_pct': 0.0796005003758167, 'sideways_tp_mult': 2.7027224055543506, 'sideways_tsl_mult': 0.17836148074067176, 'sideways_time_stop': 209, 'sideways_use_sma': True, 'sideways_use_ema': True, 'sideways_use_atr': True, 'sideways_use_adx': False, 'sideways_use_spike': True, 'sideways_rsi_required': True}.
[I 2025-08-30 14:45:00,023] Trial 199 finished with values: [-0.038212476574361776, 0.038109996550881924] and parameters: {'p_sma': 31, 'p_std': 10, 'p_atr': 29, 'p_adx': 22, 'rsi_period': 73, 'ema1': 16, 'ema2': 53, 'slip_atr_k': 0.05441528656961772, 'slip_spread_k': 0.2239829270533243, 'spread_hl_frac': 0.031129564883010746, 'bb_std_mult': 2.100005972499359, 'rsi_os': 40, 'rsi_ob': 94, 'vol_spike': 0.2429689304750655, 'adx_thresh': 20.891578775901802, 'atr_min_pct': 0.0279489390141432, 'atr_max_pct': 0.10837713849882732, 'tp_mult': 1.8090771367262206, 'tsl_mult': 0.9776557680620667, 'strategy': 'breakout', 'time_stop': 232, 'use_sma': True, 'use_atr': False, 'use_adx': False, 'use_ema': False, 'use_spike': True, 'rsi_required': True, 'edge_k': 1.2165248593232816, 'edge_cap': 0.7303261648929665, 'bull_strategy': 'mean_reversion', 'bull_bb_std_mult': 3.165080038643972, 'bull_rsi_os': 16, 'bull_rsi_ob': 69, 'bull_adx_thresh': 6.737772741322077, 'bull_atr_min_pct': 0.001935748959277891, 'bull_atr_max_pct': 0.04757362734279486, 'bull_tp_mult': 1.4519479195243676, 'bull_tsl_mult': 0.6870058746016467, 'bull_time_stop': 189, 'bull_use_sma': False, 'bull_use_ema': False, 'bull_use_atr': False, 'bull_use_adx': True, 'bull_use_spike': True, 'bull_rsi_required': False, 'bear_strategy': 'breakout', 'bear_bb_std_mult': 2.767151061780919, 'bear_rsi_os': 49, 'bear_rsi_ob': 73, 'bear_adx_thresh': 18.679935094557642, 'bear_atr_min_pct': 0.011539621155226408, 'bear_atr_max_pct': 0.0929577042729136, 'bear_tp_mult': 1.2673198508010797, 'bear_tsl_mult': 0.3105870657325215, 'bear_time_stop': 267, 'bear_use_sma': True, 'bear_use_ema': False, 'bear_use_atr': False, 'bear_use_adx': False, 'bear_use_spike': True, 'bear_rsi_required': False, 'sideways_strategy': 'mean_reversion', 'sideways_bb_std_mult': 1.9263238673230167, 'sideways_rsi_os': 53, 'sideways_rsi_ob': 67, 'sideways_adx_thresh': 33.96013740760834, 'sideways_atr_min_pct': 0.02418653873608695, 'sideways_atr_max_pct': 0.07823576253424347, 'sideways_tp_mult': 1.1669371168793095, 'sideways_tsl_mult': 0.38505572098010843, 'sideways_time_stop': 151, 'sideways_use_sma': False, 'sideways_use_ema': False, 'sideways_use_atr': True, 'sideways_use_adx': False, 'sideways_use_spike': True, 'sideways_rsi_required': True}.
[I 2025-08-30 14:45:00,582] Trial 205 finished with values: [-1000000000.0, 1000000000.0] and parameters: {'p_sma': 28, 'p_std': 28, 'p_atr': 15, 'p_adx': 25, 'rsi_period': 50, 'ema1': 11, 'ema2': 49, 'slip_atr_k': 0.030699307653089838, 'slip_spread_k': 0.861977124105531, 'spread_hl_frac': 0.011028151431406577, 'bb_std_mult': 1.9472544258979991, 'rsi_os': 32, 'rsi_ob': 45, 'vol_spike': 0.25393682869355433, 'adx_thresh': 20.159557687728302, 'atr_min_pct': 0.0009586650022189898, 'atr_max_pct': 0.11045086387974697, 'tp_mult': 1.7121714554874545, 'tsl_mult': 0.6206669149016932, 'strategy': 'mean_reversion', 'time_stop': 34, 'use_sma': False, 'use_atr': False, 'use_adx': True, 'use_ema': False, 'use_spike': False, 'rsi_required': False, 'edge_k': 1.6059742173525862, 'edge_cap': 0.3437789886887045, 'bull_strategy': 'breakout', 'bull_bb_std_mult': 3.2363864959705158, 'bull_rsi_os': 12, 'bull_rsi_ob': 77, 'bull_adx_thresh': 12.619196113996264, 'bull_atr_min_pct': 0.0036250401196151094, 'bull_atr_max_pct': 0.027418971847180174, 'bull_tp_mult': 1.5144871393003119, 'bull_tsl_mult': 0.5046425229544846, 'bull_time_stop': 168, 'bull_use_sma': True, 'bull_use_ema': False, 'bull_use_atr': True, 'bull_use_adx': False, 'bull_use_spike': False, 'bull_rsi_required': True, 'bear_strategy': 'breakout', 'bear_bb_std_mult': 1.3244259377059708, 'bear_rsi_os': 15, 'bear_rsi_ob': 49, 'bear_adx_thresh': 18.375272817061553, 'bear_atr_min_pct': 0.011191819865005065, 'bear_atr_max_pct': 0.05620106424621614, 'bear_tp_mult': 1.9246284989959879, 'bear_tsl_mult': 0.18646741177123483, 'bear_time_stop': 41, 'bear_use_sma': False, 'bear_use_ema': True, 'bear_use_atr': True, 'bear_use_adx': False, 'bear_use_spike': False, 'bear_rsi_required': False, 'sideways_strategy': 'breakout', 'sideways_bb_std_mult': 1.1275096254303592, 'sideways_rsi_os': 30, 'sideways_rsi_ob': 89, 'sideways_adx_thresh': 12.449895574998813, 'sideways_atr_min_pct': 0.0024249834019252495, 'sideways_atr_max_pct': 0.14349525738283003, 'sideways_tp_mult': 2.733329051418764, 'sideways_tsl_mult': 0.10860192139727479, 'sideways_time_stop': 236, 'sideways_use_sma': False, 'sideways_use_ema': False, 'sideways_use_atr': False, 'sideways_use_adx': True, 'sideways_use_spike': True, 'sideways_rsi_required': False}.
[I 2025-08-30 14:45:31,233] Trial 203 finished with values: [-1000000000.0, 1000000000.0] and parameters: {'p_sma': 16, 'p_std': 59, 'p_atr': 15, 'p_adx': 21, 'rsi_period': 22, 'ema1': 12, 'ema2': 54, 'slip_atr_k': 0.0003142374946098949, 'slip_spread_k': 0.3098336521848776, 'spread_hl_frac': 0.04434477037146081, 'bb_std_mult': 3.432911932137242, 'rsi_os': 18, 'rsi_ob': 91, 'vol_spike': 0.2532641334227113, 'adx_thresh': 32.22551795472488, 'atr_min_pct': 0.003684157978970752, 'atr_max_pct': 0.10837386255116035, 'tp_mult': 2.639715291133626, 'tsl_mult': 0.9638236422483142, 'strategy': 'mean_reversion', 'time_stop': 115, 'use_sma': True, 'use_atr': False, 'use_adx': True, 'use_ema': False, 'use_spike': False, 'rsi_required': False, 'edge_k': 1.626836188314715, 'edge_cap': 0.3201918656120881, 'bull_strategy': 'breakout', 'bull_bb_std_mult': 3.244519683787545, 'bull_rsi_os': 12, 'bull_rsi_ob': 77, 'bull_adx_thresh': 32.683585073178875, 'bull_atr_min_pct': 0.003580278669069179, 'bull_atr_max_pct': 0.020211120311700907, 'bull_tp_mult': 2.7084465808545684, 'bull_tsl_mult': 0.5381067017731554, 'bull_time_stop': 125, 'bull_use_sma': True, 'bull_use_ema': False, 'bull_use_atr': True, 'bull_use_adx': False, 'bull_use_spike': False, 'bull_rsi_required': True, 'bear_strategy': 'breakout', 'bear_bb_std_mult': 2.7697420277660214, 'bear_rsi_os': 19, 'bear_rsi_ob': 73, 'bear_adx_thresh': 18.61139808733746, 'bear_atr_min_pct': 0.007310529407322086, 'bear_atr_max_pct': 0.023434090528148335, 'bear_tp_mult': 1.9222743297203013, 'bear_tsl_mult': 0.25330306949870857, 'bear_time_stop': 266, 'bear_use_sma': False, 'bear_use_ema': False, 'bear_use_atr': True, 'bear_use_adx': False, 'bear_use_spike': True, 'bear_rsi_required': False, 'sideways_strategy': 'breakout', 'sideways_bb_std_mult': 3.1291849068530504, 'sideways_rsi_os': 24, 'sideways_rsi_ob': 89, 'sideways_adx_thresh': 15.527304364821191, 'sideways_atr_min_pct': 0.023993365581249024, 'sideways_atr_max_pct': 0.07571138598646297, 'sideways_tp_mult': 1.3983408364579164, 'sideways_tsl_mult': 0.9565034848627103, 'sideways_time_stop': 54, 'sideways_use_sma': False, 'sideways_use_ema': False, 'sideways_use_atr': False, 'sideways_use_adx': True, 'sideways_use_spike': True, 'sideways_rsi_required': True}.
[I 2025-08-30 14:45:31,583] Trial 202 finished with values: [-1000000000.0, 1000000000.0] and parameters: {'p_sma': 28, 'p_std': 20, 'p_atr': 15, 'p_adx': 18, 'rsi_period': 23, 'ema1': 27, 'ema2': 18, 'slip_atr_k': 0.031543040619199575, 'slip_spread_k': 0.91066050473895, 'spread_hl_frac': 0.0029319071236902777, 'bb_std_mult': 0.5268762884416696, 'rsi_os': 18, 'rsi_ob': 90, 'vol_spike': 0.24085119401948, 'adx_thresh': 23.59781809445723, 'atr_min_pct': 0.003443056810649242, 'atr_max_pct': 0.10982919491156899, 'tp_mult': 2.3104859269041427, 'tsl_mult': 0.7179615758581985, 'strategy': 'mean_reversion', 'time_stop': 207, 'use_sma': True, 'use_atr': False, 'use_adx': False, 'use_ema': False, 'use_spike': False, 'rsi_required': False, 'edge_k': 1.6027092454347374, 'edge_cap': 0.7219685523772076, 'bull_strategy': 'breakout', 'bull_bb_std_mult': 3.206258151039531, 'bull_rsi_os': 12, 'bull_rsi_ob': 77, 'bull_adx_thresh': 32.447363280369885, 'bull_atr_min_pct': 0.003545422034027909, 'bull_atr_max_pct': 0.026930177741281446, 'bull_tp_mult': 1.4405049036554405, 'bull_tsl_mult': 0.47570906745497865, 'bull_time_stop': 207, 'bull_use_sma': True, 'bull_use_ema': False, 'bull_use_atr': True, 'bull_use_adx': False, 'bull_use_spike': False, 'bull_rsi_required': True, 'bear_strategy': 'breakout', 'bear_bb_std_mult': 1.0295555098065214, 'bear_rsi_os': 19, 'bear_rsi_ob': 48, 'bear_adx_thresh': 24.7210750646206, 'bear_atr_min_pct': 0.015069669848462794, 'bear_atr_max_pct': 0.021290482994508454, 'bear_tp_mult': 2.992939271058442, 'bear_tsl_mult': 0.3185499278581261, 'bear_time_stop': 268, 'bear_use_sma': False, 'bear_use_ema': False, 'bear_use_atr': False, 'bear_use_adx': False, 'bear_use_spike': True, 'bear_rsi_required': False, 'sideways_strategy': 'mean_reversion', 'sideways_bb_std_mult': 3.14924662948953, 'sideways_rsi_os': 13, 'sideways_rsi_ob': 87, 'sideways_adx_thresh': 12.252200980313624, 'sideways_atr_min_pct': 0.0023179875594811893, 'sideways_atr_max_pct': 0.05620622262270585, 'sideways_tp_mult': 1.805855605125725, 'sideways_tsl_mult': 0.9442337472525952, 'sideways_time_stop': 52, 'sideways_use_sma': False, 'sideways_use_ema': False, 'sideways_use_atr': False, 'sideways_use_adx': True, 'sideways_use_spike': True, 'sideways_rsi_required': True}.
[I 2025-08-30 14:45:31,809] Trial 204 finished with values: [-1000000000.0, 1000000000.0] and parameters: {'p_sma': 16, 'p_std': 20, 'p_atr': 15, 'p_adx': 21, 'rsi_period': 50, 'ema1': 26, 'ema2': 54, 'slip_atr_k': 0.03048591030756543, 'slip_spread_k': 0.4122748980543995, 'spread_hl_frac': 0.004231650821743027, 'bb_std_mult': 3.429883377411111, 'rsi_os': 32, 'rsi_ob': 77, 'vol_spike': 0.17875789079729756, 'adx_thresh': 7.687156597975919, 'atr_min_pct': 0.0038933023628850965, 'atr_max_pct': 0.10691755433705376, 'tp_mult': 2.629556510015525, 'tsl_mult': 0.7177064843534806, 'strategy': 'mean_reversion', 'time_stop': 33, 'use_sma': False, 'use_atr': False, 'use_adx': True, 'use_ema': False, 'use_spike': False, 'rsi_required': False, 'edge_k': 1.6351833531883897, 'edge_cap': 0.9067919296030443, 'bull_strategy': 'breakout', 'bull_bb_std_mult': 3.2443743244416576, 'bull_rsi_os': 12, 'bull_rsi_ob': 77, 'bull_adx_thresh': 34.16658005431124, 'bull_atr_min_pct': 0.01994374407678896, 'bull_atr_max_pct': 0.028116723421233808, 'bull_tp_mult': 1.5144228535352182, 'bull_tsl_mult': 0.52234530634103, 'bull_time_stop': 124, 'bull_use_sma': True, 'bull_use_ema': False, 'bull_use_atr': True, 'bull_use_adx': False, 'bull_use_spike': False, 'bull_rsi_required': True, 'bear_strategy': 'breakout', 'bear_bb_std_mult': 0.8674626196702648, 'bear_rsi_os': 15, 'bear_rsi_ob': 48, 'bear_adx_thresh': 33.86639415306504, 'bear_atr_min_pct': 0.011213063333495641, 'bear_atr_max_pct': 0.024159568043449674, 'bear_tp_mult': 1.9273959500442481, 'bear_tsl_mult': 0.2137073324644002, 'bear_time_stop': 39, 'bear_use_sma': False, 'bear_use_ema': True, 'bear_use_atr': True, 'bear_use_adx': False, 'bear_use_spike': False, 'bear_rsi_required': False, 'sideways_strategy': 'breakout', 'sideways_bb_std_mult': 1.1278809818539666, 'sideways_rsi_os': 30, 'sideways_rsi_ob': 89, 'sideways_adx_thresh': 20.186171426071187, 'sideways_atr_min_pct': 0.002586530524694755, 'sideways_atr_max_pct': 0.12047924528177398, 'sideways_tp_mult': 2.7411720580076833, 'sideways_tsl_mult': 0.9491190380154784, 'sideways_time_stop': 53, 'sideways_use_sma': False, 'sideways_use_ema': False, 'sideways_use_atr': False, 'sideways_use_adx': True, 'sideways_use_spike': True, 'sideways_rsi_required': False}.
[I 2025-08-30 14:45:32,544] Trial 206 finished with values: [-1000000000.0, 1000000000.0] and parameters: {'p_sma': 32, 'p_std': 30, 'p_atr': 27, 'p_adx': 21, 'rsi_period': 47, 'ema1': 27, 'ema2': 54, 'slip_atr_k': 0.1403899062439039, 'slip_spread_k': 0.2644979806612381, 'spread_hl_frac': 0.02615745884818174, 'bb_std_mult': 0.5356047992646644, 'rsi_os': 49, 'rsi_ob': 89, 'vol_spike': 0.18324872752297636, 'adx_thresh': 14.564947072087538, 'atr_min_pct': 0.021432697740469128, 'atr_max_pct': 0.10291173917032007, 'tp_mult': 2.6111796228327946, 'tsl_mult': 0.7646320387532366, 'strategy': 'mean_reversion', 'time_stop': 175, 'use_sma': False, 'use_atr': False, 'use_adx': True, 'use_ema': False, 'use_spike': False, 'rsi_required': False, 'edge_k': 1.6309021918713877, 'edge_cap': 0.6726048755645826, 'bull_strategy': 'breakout', 'bull_bb_std_mult': 3.2672156145820717, 'bull_rsi_os': 29, 'bull_rsi_ob': 76, 'bull_adx_thresh': 13.386145170860418, 'bull_atr_min_pct': 0.0034961927682163703, 'bull_atr_max_pct': 0.020317008713775696, 'bull_tp_mult': 2.043528150844062, 'bull_tsl_mult': 0.5191957795820702, 'bull_time_stop': 160, 'bull_use_sma': True, 'bull_use_ema': False, 'bull_use_atr': True, 'bull_use_adx': False, 'bull_use_spike': False, 'bull_rsi_required': True, 'bear_strategy': 'breakout', 'bear_bb_std_mult': 1.171509721526146, 'bear_rsi_os': 15, 'bear_rsi_ob': 92, 'bear_adx_thresh': 33.93455159770118, 'bear_atr_min_pct': 0.01297401357460622, 'bear_atr_max_pct': 0.023534669651525113, 'bear_tp_mult': 2.052253638668401, 'bear_tsl_mult': 0.21865982296076794, 'bear_time_stop': 15, 'bear_use_sma': False, 'bear_use_ema': True, 'bear_use_atr': True, 'bear_use_adx': False, 'bear_use_spike': False, 'bear_rsi_required': False, 'sideways_strategy': 'breakout', 'sideways_bb_std_mult': 3.304956905374438, 'sideways_rsi_os': 27, 'sideways_rsi_ob': 90, 'sideways_adx_thresh': 15.546774014627992, 'sideways_atr_min_pct': 0.016966845002574248, 'sideways_atr_max_pct': 0.0756648594430107, 'sideways_tp_mult': 1.9354683264920876, 'sideways_tsl_mult': 0.09858255059666172, 'sideways_time_stop': 53, 'sideways_use_sma': False, 'sideways_use_ema': False, 'sideways_use_atr': False, 'sideways_use_adx': True, 'sideways_use_spike': False, 'sideways_rsi_required': True}.
