[I 2025-08-30 15:25:22,128] Trial 453 finished with values: [-1000000000.0, 1000000000.0] and parameters: {'p_sma': 22, 'p_std': 42, 'p_atr': 15, 'p_adx': 11, 'rsi_period': 77, 'ema1': 20, 'ema2': 36, 'slip_atr_k': 0.06697334065845222, 'slip_spread_k': 0.06438483663924631, 'spread_hl_frac': 0.025203622018246222, 'bb_std_mult': 1.3614280865830937, 'rsi_os': 54, 'rsi_ob': 82, 'vol_spike': 0.16301015746851868, 'adx_thresh': 10.303630504859054, 'atr_min_pct': 0.012864490716131568, 'atr_max_pct': 0.07843775201860585, 'tp_mult': 1.8152024104135887, 'tsl_mult': 0.5845852409502607, 'strategy': 'breakout', 'time_stop': 196, 'use_sma': False, 'use_atr': True, 'use_adx': False, 'use_ema': True, 'use_spike': True, 'rsi_required': True, 'edge_k': 0.10715328961468293, 'edge_cap': 0.559728465055849, 'bull_strategy': 'mean_reversion', 'bull_bb_std_mult': 1.4300951926466157, 'bull_rsi_os': 40, 'bull_rsi_ob': 50, 'bull_adx_thresh': 29.67894230355082, 'bull_atr_min_pct': 0.019989292986680847, 'bull_atr_max_pct': 0.13635744559726795, 'bull_tp_mult': 2.15815935184255, 'bull_tsl_mult': 0.18938545751291713, 'bull_time_stop': 175, 'bull_use_sma': False, 'bull_use_ema': True, 'bull_use_atr': False, 'bull_use_adx': False, 'bull_use_spike': True, 'bull_rsi_required': False, 'bear_strategy': 'mean_reversion', 'bear_bb_std_mult': 0.5742970916421107, 'bear_rsi_os': 27, 'bear_rsi_ob': 81, 'bear_adx_thresh': 26.666320772063077, 'bear_atr_min_pct': 0.02075074023459995, 'bear_atr_max_pct': 0.06600558873902208, 'bear_tp_mult': 1.6800273037796167, 'bear_tsl_mult': 0.9284533933153453, 'bear_time_stop': 57, 'bear_use_sma': True, 'bear_use_ema': True, 'bear_use_atr': True, 'bear_use_adx': True, 'bear_use_spike': False, 'bear_rsi_required': True, 'sideways_strategy': 'breakout', 'sideways_bb_std_mult': 2.481133613643563, 'sideways_rsi_os': 42, 'sideways_rsi_ob': 58, 'sideways_adx_thresh': 21.26783347281798, 'sideways_atr_min_pct': 0.015392259579350724, 'sideways_atr_max_pct': 0.09873600887677647, 'sideways_tp_mult': 1.3639118100883025, 'sideways_tsl_mult': 0.9312333405582047, 'sideways_time_stop': 74, 'sideways_use_sma': True, 'sideways_use_ema': True, 'sideways_use_atr': True, 'sideways_use_adx': False, 'sideways_use_spike': True, 'sideways_rsi_required': False}.
[I 2025-08-30 15:25:22,110] Trial 450 finished with values: [-1000000000.0, 1000000000.0] and parameters: {'p_sma': 22, 'p_std': 42, 'p_atr': 19, 'p_adx': 26, 'rsi_period': 77, 'ema1': 14, 'ema2': 32, 'slip_atr_k': 0.06835474098742313, 'slip_spread_k': 0.15146925227760052, 'spread_hl_frac': 0.02506410902298957, 'bb_std_mult': 1.295327082356462, 'rsi_os': 27, 'rsi_ob': 82, 'vol_spike': 0.15662522960398884, 'adx_thresh': 10.060549833381033, 'atr_min_pct': 0.012701327274411084, 'atr_max_pct': 0.07196072593593125, 'tp_mult': 1.8243330231465884, 'tsl_mult': 0.5792170445254333, 'strategy': 'breakout', 'time_stop': 137, 'use_sma': False, 'use_atr': True, 'use_adx': False, 'use_ema': True, 'use_spike': True, 'rsi_required': True, 'edge_k': 0.20814446437365394, 'edge_cap': 0.5288870656317943, 'bull_strategy': 'mean_reversion', 'bull_bb_std_mult': 2.639273849550383, 'bull_rsi_os': 40, 'bull_rsi_ob': 50, 'bull_adx_thresh': 33.26716749830085, 'bull_atr_min_pct': 0.02109014516479936, 'bull_atr_max_pct': 0.06334165399672655, 'bull_tp_mult': 2.16487897005938, 'bull_tsl_mult': 0.28557118154095384, 'bull_time_stop': 20, 'bull_use_sma': False, 'bull_use_ema': True, 'bull_use_atr': False, 'bull_use_adx': False, 'bull_use_spike': True, 'bull_rsi_required': False, 'bear_strategy': 'mean_reversion', 'bear_bb_std_mult': 0.7114346121879687, 'bear_rsi_os': 27, 'bear_rsi_ob': 79, 'bear_adx_thresh': 28.42359448543543, 'bear_atr_min_pct': 0.02080504377740404, 'bear_atr_max_pct': 0.066840430283284, 'bear_tp_mult': 1.6791884478513235, 'bear_tsl_mult': 0.9169640287808797, 'bear_time_stop': 58, 'bear_use_sma': True, 'bear_use_ema': True, 'bear_use_atr': True, 'bear_use_adx': True, 'bear_use_spike': False, 'bear_rsi_required': True, 'sideways_strategy': 'breakout', 'sideways_bb_std_mult': 2.0148210623136746, 'sideways_rsi_os': 17, 'sideways_rsi_ob': 60, 'sideways_adx_thresh': 28.205278416534046, 'sideways_atr_min_pct': 0.01812372518328922, 'sideways_atr_max_pct': 0.13424724609971914, 'sideways_tp_mult': 2.3456500577655977, 'sideways_tsl_mult': 0.9609784400229148, 'sideways_time_stop': 75, 'sideways_use_sma': True, 'sideways_use_ema': True, 'sideways_use_atr': True, 'sideways_use_adx': False, 'sideways_use_spike': True, 'sideways_rsi_required': False}.
[I 2025-08-30 15:25:23,588] Trial 452 finished with values: [-1000000000.0, 1000000000.0] and parameters: {'p_sma': 22, 'p_std': 42, 'p_atr': 27, 'p_adx': 26, 'rsi_period': 77, 'ema1': 30, 'ema2': 32, 'slip_atr_k': 0.06829686203709988, 'slip_spread_k': 0.15147811573777756, 'spread_hl_frac': 0.025537595443267086, 'bb_std_mult': 1.3632438834471423, 'rsi_os': 5, 'rsi_ob': 82, 'vol_spike': 0.04460127855710269, 'adx_thresh': 12.297882911297055, 'atr_min_pct': 0.012606272077709823, 'atr_max_pct': 0.03468552500566748, 'tp_mult': 1.7598884770261214, 'tsl_mult': 0.583179305216892, 'strategy': 'breakout', 'time_stop': 142, 'use_sma': False, 'use_atr': True, 'use_adx': False, 'use_ema': True, 'use_spike': True, 'rsi_required': True, 'edge_k': 0.2043191199429736, 'edge_cap': 0.5286902512880507, 'bull_strategy': 'mean_reversion', 'bull_bb_std_mult': 2.4631304143930057, 'bull_rsi_os': 40, 'bull_rsi_ob': 50, 'bull_adx_thresh': 17.051142504787236, 'bull_atr_min_pct': 0.021089601997569044, 'bull_atr_max_pct': 0.06497828378227193, 'bull_tp_mult': 2.34655217567153, 'bull_tsl_mult': 0.396487172930409, 'bull_time_stop': 207, 'bull_use_sma': False, 'bull_use_ema': True, 'bull_use_atr': False, 'bull_use_adx': False, 'bull_use_spike': True, 'bull_rsi_required': False, 'bear_strategy': 'mean_reversion', 'bear_bb_std_mult': 0.722041422519755, 'bear_rsi_os': 27, 'bear_rsi_ob': 54, 'bear_adx_thresh': 26.57369350223333, 'bear_atr_min_pct': 0.021855482635452658, 'bear_atr_max_pct': 0.07220820767262881, 'bear_tp_mult': 2.9617202871348742, 'bear_tsl_mult': 0.9294803652923793, 'bear_time_stop': 59, 'bear_use_sma': True, 'bear_use_ema': True, 'bear_use_atr': True, 'bear_use_adx': True, 'bear_use_spike': False, 'bear_rsi_required': True, 'sideways_strategy': 'breakout', 'sideways_bb_std_mult': 2.3232396561410678, 'sideways_rsi_os': 41, 'sideways_rsi_ob': 60, 'sideways_adx_thresh': 33.75579167144476, 'sideways_atr_min_pct': 0.018047967206077473, 'sideways_atr_max_pct': 0.13418104948508003, 'sideways_tp_mult': 1.1368594809625967, 'sideways_tsl_mult': 0.9595301852851633, 'sideways_time_stop': 75, 'sideways_use_sma': True, 'sideways_use_ema': True, 'sideways_use_atr': True, 'sideways_use_adx': False, 'sideways_use_spike': True, 'sideways_rsi_required': False}.
[I 2025-08-30 15:25:23,862] Trial 451 finished with values: [-1000000000.0, 1000000000.0] and parameters: {'p_sma': 44, 'p_std': 57, 'p_atr': 21, 'p_adx': 26, 'rsi_period': 77, 'ema1': 20, 'ema2': 32, 'slip_atr_k': 0.06572427450125909, 'slip_spread_k': 0.09827178604969536, 'spread_hl_frac': 0.02514288337662867, 'bb_std_mult': 1.3566509612519058, 'rsi_os': 54, 'rsi_ob': 82, 'vol_spike': 0.161709046869497, 'adx_thresh': 13.441843283894828, 'atr_min_pct': 0.0043939368343151215, 'atr_max_pct': 0.07203311710083009, 'tp_mult': 1.7465519836709162, 'tsl_mult': 0.7915660818846773, 'strategy': 'breakout', 'time_stop': 63, 'use_sma': False, 'use_atr': True, 'use_adx': False, 'use_ema': True, 'use_spike': True, 'rsi_required': True, 'edge_k': 0.18744465821156714, 'edge_cap': 0.8359759814088381, 'bull_strategy': 'mean_reversion', 'bull_bb_std_mult': 1.4323340771289885, 'bull_rsi_os': 40, 'bull_rsi_ob': 50, 'bull_adx_thresh': 15.770135165399402, 'bull_atr_min_pct': 0.020455124595879972, 'bull_atr_max_pct': 0.06341882673951786, 'bull_tp_mult': 2.0336490099253735, 'bull_tsl_mult': 0.2746158685924675, 'bull_time_stop': 18, 'bull_use_sma': False, 'bull_use_ema': True, 'bull_use_atr': False, 'bull_use_adx': False, 'bull_use_spike': True, 'bull_rsi_required': False, 'bear_strategy': 'mean_reversion', 'bear_bb_std_mult': 0.7250148790517504, 'bear_rsi_os': 27, 'bear_rsi_ob': 81, 'bear_adx_thresh': 28.398549271776027, 'bear_atr_min_pct': 0.020672564072565625, 'bear_atr_max_pct': 0.07125966466428327, 'bear_tp_mult': 1.6381953791194412, 'bear_tsl_mult': 0.9108420123537444, 'bear_time_stop': 197, 'bear_use_sma': True, 'bear_use_ema': True, 'bear_use_atr': True, 'bear_use_adx': True, 'bear_use_spike': False, 'bear_rsi_required': True, 'sideways_strategy': 'breakout', 'sideways_bb_std_mult': 2.3107078142372104, 'sideways_rsi_os': 18, 'sideways_rsi_ob': 60, 'sideways_adx_thresh': 27.631128929960592, 'sideways_atr_min_pct': 0.018310204292777788, 'sideways_atr_max_pct': 0.0452978918165502, 'sideways_tp_mult': 2.475532878337372, 'sideways_tsl_mult': 0.9337041864152672, 'sideways_time_stop': 85, 'sideways_use_sma': True, 'sideways_use_ema': True, 'sideways_use_atr': True, 'sideways_use_adx': False, 'sideways_use_spike': True, 'sideways_rsi_required': False}.
[I 2025-08-30 15:26:22,245] Trial 455 finished with values: [-1000000000.0, 1000000000.0] and parameters: {'p_sma': 5, 'p_std': 39, 'p_atr': 29, 'p_adx': 25, 'rsi_period': 75, 'ema1': 12, 'ema2': 35, 'slip_atr_k': 0.06290630534440549, 'slip_spread_k': 0.09838276573302346, 'spread_hl_frac': 0.02801577459170923, 'bb_std_mult': 1.1062159664464013, 'rsi_os': 25, 'rsi_ob': 74, 'vol_spike': 0.0981852712996254, 'adx_thresh': 8.920329861886879, 'atr_min_pct': 0.012227017532285504, 'atr_max_pct': 0.07451843842612607, 'tp_mult': 1.7679983251027265, 'tsl_mult': 0.8189073812482073, 'strategy': 'breakout', 'time_stop': 187, 'use_sma': False, 'use_atr': True, 'use_adx': True, 'use_ema': True, 'use_spike': True, 'rsi_required': True, 'edge_k': 0.2386195737150773, 'edge_cap': 0.5859880823704711, 'bull_strategy': 'mean_reversion', 'bull_bb_std_mult': 2.4311841363428965, 'bull_rsi_os': 38, 'bull_rsi_ob': 47, 'bull_adx_thresh': 21.58814906533793, 'bull_atr_min_pct': 0.02241129595884137, 'bull_atr_max_pct': 0.06480274249367014, 'bull_tp_mult': 2.0424168640668925, 'bull_tsl_mult': 0.399559283498642, 'bull_time_stop': 148, 'bull_use_sma': False, 'bull_use_ema': False, 'bull_use_atr': False, 'bull_use_adx': False, 'bull_use_spike': True, 'bull_rsi_required': False, 'bear_strategy': 'mean_reversion', 'bear_bb_std_mult': 0.7360206232437708, 'bear_rsi_os': 31, 'bear_rsi_ob': 55, 'bear_adx_thresh': 27.62844859410264, 'bear_atr_min_pct': 0.021758138566814883, 'bear_atr_max_pct': 0.07185445708871377, 'bear_tp_mult': 2.9762867920602294, 'bear_tsl_mult': 0.9935592339280269, 'bear_time_stop': 69, 'bear_use_sma': True, 'bear_use_ema': True, 'bear_use_atr': True, 'bear_use_adx': False, 'bear_use_spike': False, 'bear_rsi_required': True, 'sideways_strategy': 'breakout', 'sideways_bb_std_mult': 2.306554276337761, 'sideways_rsi_os': 41, 'sideways_rsi_ob': 58, 'sideways_adx_thresh': 30.99491792707195, 'sideways_atr_min_pct': 0.001836759729376393, 'sideways_atr_max_pct': 0.105756866696754, 'sideways_tp_mult': 2.48246677637213, 'sideways_tsl_mult': 0.996809369090068, 'sideways_time_stop': 85, 'sideways_use_sma': True, 'sideways_use_ema': True, 'sideways_use_atr': True, 'sideways_use_adx': False, 'sideways_use_spike': False, 'sideways_rsi_required': False}.
[I 2025-08-30 15:26:24,691] Trial 456 finished with values: [-1000000000.0, 1000000000.0] and parameters: {'p_sma': 53, 'p_std': 58, 'p_atr': 15, 'p_adx': 27, 'rsi_period': 75, 'ema1': 29, 'ema2': 35, 'slip_atr_k': 0.0611888737020156, 'slip_spread_k': 0.11309177086635096, 'spread_hl_frac': 0.023922651897216585, 'bb_std_mult': 0.9546799187435799, 'rsi_os': 24, 'rsi_ob': 70, 'vol_spike': 0.17544031657896214, 'adx_thresh': 14.001330893596258, 'atr_min_pct': 0.0040544196753997015, 'atr_max_pct': 0.07594723658755734, 'tp_mult': 1.7841786237283148, 'tsl_mult': 0.5188510104702854, 'strategy': 'breakout', 'time_stop': 124, 'use_sma': False, 'use_atr': True, 'use_adx': True, 'use_ema': True, 'use_spike': True, 'rsi_required': True, 'edge_k': 0.2535080483786794, 'edge_cap': 0.5972343517108123, 'bull_strategy': 'mean_reversion', 'bull_bb_std_mult': 2.598592085691121, 'bull_rsi_os': 38, 'bull_rsi_ob': 47, 'bull_adx_thresh': 21.75155927827506, 'bull_atr_min_pct': 0.019766655969056274, 'bull_atr_max_pct': 0.0599687144707706, 'bull_tp_mult': 2.2259815909069918, 'bull_tsl_mult': 0.3495858134887049, 'bull_time_stop': 192, 'bull_use_sma': False, 'bull_use_ema': False, 'bull_use_atr': False, 'bull_use_adx': False, 'bull_use_spike': True, 'bull_rsi_required': False, 'bear_strategy': 'mean_reversion', 'bear_bb_std_mult': 1.671299008325648, 'bear_rsi_os': 31, 'bear_rsi_ob': 75, 'bear_adx_thresh': 27.707780624815353, 'bear_atr_min_pct': 0.02150507369887466, 'bear_atr_max_pct': 0.07487651112713753, 'bear_tp_mult': 1.5771407413473042, 'bear_tsl_mult': 0.5677419114571036, 'bear_time_stop': 67, 'bear_use_sma': True, 'bear_use_ema': True, 'bear_use_atr': True, 'bear_use_adx': False, 'bear_use_spike': False, 'bear_rsi_required': True, 'sideways_strategy': 'breakout', 'sideways_bb_std_mult': 2.4375791602709462, 'sideways_rsi_os': 7, 'sideways_rsi_ob': 58, 'sideways_adx_thresh': 27.109646164359642, 'sideways_atr_min_pct': 0.0020195714765664187, 'sideways_atr_max_pct': 0.10484501563836136, 'sideways_tp_mult': 2.3937079514106805, 'sideways_tsl_mult': 0.9991544792108138, 'sideways_time_stop': 85, 'sideways_use_sma': True, 'sideways_use_ema': True, 'sideways_use_atr': True, 'sideways_use_adx': False, 'sideways_use_spike': False, 'sideways_rsi_required': False}.
[I 2025-08-30 15:26:27,169] Trial 454 finished with values: [-1000000000.0, 1000000000.0] and parameters: {'p_sma': 44, 'p_std': 17, 'p_atr': 15, 'p_adx': 25, 'rsi_period': 74, 'ema1': 12, 'ema2': 35, 'slip_atr_k': 0.06273929430634777, 'slip_spread_k': 0.09946897969381979, 'spread_hl_frac': 0.028029678806853996, 'bb_std_mult': 1.1264106881543923, 'rsi_os': 25, 'rsi_ob': 70, 'vol_spike': 0.03236591722985038, 'adx_thresh': 9.063438732795685, 'atr_min_pct': 0.004745805280158933, 'atr_max_pct': 0.01837560812932435, 'tp_mult': 1.7195919112452427, 'tsl_mult': 0.8759880250463571, 'strategy': 'breakout', 'time_stop': 124, 'use_sma': False, 'use_atr': True, 'use_adx': True, 'use_ema': True, 'use_spike': True, 'rsi_required': True, 'edge_k': 0.24822285215294218, 'edge_cap': 0.6064513613212255, 'bull_strategy': 'mean_reversion', 'bull_bb_std_mult': 2.4245483810206574, 'bull_rsi_os': 38, 'bull_rsi_ob': 51, 'bull_adx_thresh': 21.71540550629817, 'bull_atr_min_pct': 0.022473403496483687, 'bull_atr_max_pct': 0.06500718074555366, 'bull_tp_mult': 2.220765695189561, 'bull_tsl_mult': 0.39626793809980343, 'bull_time_stop': 148, 'bull_use_sma': False, 'bull_use_ema': False, 'bull_use_atr': False, 'bull_use_adx': False, 'bull_use_spike': True, 'bull_rsi_required': False, 'bear_strategy': 'mean_reversion', 'bear_bb_std_mult': 0.7421043882476155, 'bear_rsi_os': 31, 'bear_rsi_ob': 75, 'bear_adx_thresh': 27.597360772303833, 'bear_atr_min_pct': 0.02173414983891959, 'bear_atr_max_pct': 0.07170176865679197, 'bear_tp_mult': 1.482914107888779, 'bear_tsl_mult': 0.5621834358135062, 'bear_time_stop': 199, 'bear_use_sma': True, 'bear_use_ema': True, 'bear_use_atr': True, 'bear_use_adx': False, 'bear_use_spike': False, 'bear_rsi_required': True, 'sideways_strategy': 'breakout', 'sideways_bb_std_mult': 2.319876509476211, 'sideways_rsi_os': 41, 'sideways_rsi_ob': 57, 'sideways_adx_thresh': 11.839957352224344, 'sideways_atr_min_pct': 0.023110086041449856, 'sideways_atr_max_pct': 0.03890550306333642, 'sideways_tp_mult': 1.1323784067091558, 'sideways_tsl_mult': 0.9593213908319037, 'sideways_time_stop': 86, 'sideways_use_sma': True, 'sideways_use_ema': True, 'sideways_use_atr': True, 'sideways_use_adx': False, 'sideways_use_spike': False, 'sideways_rsi_required': False}.
[I 2025-08-30 15:26:28,610] Trial 457 finished with values: [-1000000000.0, 1000000000.0] and parameters: {'p_sma': 5, 'p_std': 58, 'p_atr': 15, 'p_adx': 27, 'rsi_period': 75, 'ema1': 29, 'ema2': 35, 'slip_atr_k': 0.061191521982252965, 'slip_spread_k': 0.11560483807069492, 'spread_hl_frac': 0.027726044513414545, 'bb_std_mult': 0.955828826185149, 'rsi_os': 26, 'rsi_ob': 74, 'vol_spike': 0.17526256942718185, 'adx_thresh': 11.03115891162727, 'atr_min_pct': 0.005063062434386784, 'atr_max_pct': 0.029856824635808292, 'tp_mult': 1.7181204183845513, 'tsl_mult': 0.8583817434423142, 'strategy': 'breakout', 'time_stop': 124, 'use_sma': False, 'use_atr': True, 'use_adx': True, 'use_ema': True, 'use_spike': True, 'rsi_required': True, 'edge_k': 0.2518573478694419, 'edge_cap': 0.48619602744216883, 'bull_strategy': 'mean_reversion', 'bull_bb_std_mult': 1.3093313629872965, 'bull_rsi_os': 38, 'bull_rsi_ob': 51, 'bull_adx_thresh': 21.725003517532397, 'bull_atr_min_pct': 0.022485641534304133, 'bull_atr_max_pct': 0.1187090887527322, 'bull_tp_mult': 2.2328583719269033, 'bull_tsl_mult': 0.35447974152552264, 'bull_time_stop': 222, 'bull_use_sma': False, 'bull_use_ema': False, 'bull_use_atr': False, 'bull_use_adx': False, 'bull_use_spike': True, 'bull_rsi_required': False, 'bear_strategy': 'mean_reversion', 'bear_bb_std_mult': 0.6221778469518281, 'bear_rsi_os': 31, 'bear_rsi_ob': 75, 'bear_adx_thresh': 14.006388029368207, 'bear_atr_min_pct': 0.021343740163843116, 'bear_atr_max_pct': 0.07402777055966432, 'bear_tp_mult': 1.5690212414542322, 'bear_tsl_mult': 0.5641361027196938, 'bear_time_stop': 69, 'bear_use_sma': True, 'bear_use_ema': True, 'bear_use_atr': True, 'bear_use_adx': False, 'bear_use_spike': False, 'bear_rsi_required': True, 'sideways_strategy': 'breakout', 'sideways_bb_std_mult': 2.397197143834312, 'sideways_rsi_os': 5, 'sideways_rsi_ob': 51, 'sideways_adx_thresh': 26.92594454991863, 'sideways_atr_min_pct': 0.0019660481530628013, 'sideways_atr_max_pct': 0.106050312854912, 'sideways_tp_mult': 1.2363571017366373, 'sideways_tsl_mult': 0.9847793425510394, 'sideways_time_stop': 86, 'sideways_use_sma': True, 'sideways_use_ema': True, 'sideways_use_atr': True, 'sideways_use_adx': False, 'sideways_use_spike': False, 'sideways_rsi_required': False}.
[I 2025-08-30 15:27:38,929] Trial 459 finished with values: [-1000000000.0, 1000000000.0] and parameters: {'p_sma': 7, 'p_std': 59, 'p_atr': 14, 'p_adx': 19, 'rsi_period': 73, 'ema1': 30, 'ema2': 35, 'slip_atr_k': 0.1844534433292668, 'slip_spread_k': 0.06886592832771408, 'spread_hl_frac': 0.027197656986519565, 'bb_std_mult': 1.0723694706333802, 'rsi_os': 26, 'rsi_ob': 73, 'vol_spike': 0.11826777854616813, 'adx_thresh': 16.28862088573392, 'atr_min_pct': 0.006290806523222805, 'atr_max_pct': 0.07927547633001383, 'tp_mult': 1.8476409603577466, 'tsl_mult': 0.5458736268613475, 'strategy': 'breakout', 'time_stop': 123, 'use_sma': False, 'use_atr': True, 'use_adx': False, 'use_ema': True, 'use_spike': True, 'rsi_required': True, 'edge_k': 0.1314096146109679, 'edge_cap': 0.5616310517661853, 'bull_strategy': 'mean_reversion', 'bull_bb_std_mult': 2.721049670334329, 'bull_rsi_os': 38, 'bull_rsi_ob': 51, 'bull_adx_thresh': 8.957548334151708, 'bull_atr_min_pct': 0.02246739395193274, 'bull_atr_max_pct': 0.04992636132483862, 'bull_tp_mult': 2.092188889832774, 'bull_tsl_mult': 0.1125712199790112, 'bull_time_stop': 180, 'bull_use_sma': True, 'bull_use_ema': False, 'bull_use_atr': False, 'bull_use_adx': False, 'bull_use_spike': True, 'bull_rsi_required': False, 'bear_strategy': 'mean_reversion', 'bear_bb_std_mult': 0.6446049673783085, 'bear_rsi_os': 30, 'bear_rsi_ob': 77, 'bear_adx_thresh': 13.822204489095636, 'bear_atr_min_pct': 0.022661230340140958, 'bear_atr_max_pct': 0.0687025355595344, 'bear_tp_mult': 1.4884598701271186, 'bear_tsl_mult': 0.9814259374617785, 'bear_time_stop': 73, 'bear_use_sma': True, 'bear_use_ema': True, 'bear_use_atr': True, 'bear_use_adx': False, 'bear_use_spike': False, 'bear_rsi_required': True, 'sideways_strategy': 'breakout', 'sideways_bb_std_mult': 1.953948699180037, 'sideways_rsi_os': 13, 'sideways_rsi_ob': 50, 'sideways_adx_thresh': 22.102493495911396, 'sideways_atr_min_pct': 2.595339622554814e-05, 'sideways_atr_max_pct': 0.10098405931293082, 'sideways_tp_mult': 1.2246427105940532, 'sideways_tsl_mult': 0.9799991107324546, 'sideways_time_stop': 80, 'sideways_use_sma': True, 'sideways_use_ema': True, 'sideways_use_atr': True, 'sideways_use_adx': False, 'sideways_use_spike': True, 'sideways_rsi_required': False}.
