[I 2025-08-30 15:43:49,829] Trial 543 finished with values: [-0.05742299999557943, 0.05735432936652941] and parameters: {'p_sma': 48, 'p_std': 57, 'p_atr': 15, 'p_adx': 20, 'rsi_period': 81, 'ema1': 30, 'ema2': 37, 'slip_atr_k': 0.06074160842367997, 'slip_spread_k': 0.15618498804744307, 'spread_hl_frac': 0.028228927056406946, 'bb_std_mult': 1.3731013153402591, 'rsi_os': 26, 'rsi_ob': 69, 'vol_spike': 0.1615981567127661, 'adx_thresh': 11.830442939327112, 'atr_min_pct': 0.012808138657845681, 'atr_max_pct': 0.01862364619183768, 'tp_mult': 1.7888618779999856, 'tsl_mult': 0.7045992347071806, 'strategy': 'breakout', 'time_stop': 60, 'use_sma': False, 'use_atr': True, 'use_adx': True, 'use_ema': True, 'use_spike': True, 'rsi_required': True, 'edge_k': 0.18002807706648377, 'edge_cap': 0.6011081086032035, 'bull_strategy': 'breakout', 'bull_bb_std_mult': 2.4407572140496967, 'bull_rsi_os': 46, 'bull_rsi_ob': 60, 'bull_adx_thresh': 29.001715549276756, 'bull_atr_min_pct': 0.02167402585910909, 'bull_atr_max_pct': 0.0694082624996476, 'bull_tp_mult': 2.671221152404607, 'bull_tsl_mult': 0.0669748449110133, 'bull_time_stop': 158, 'bull_use_sma': False, 'bull_use_ema': False, 'bull_use_atr': False, 'bull_use_adx': False, 'bull_use_spike': True, 'bull_rsi_required': False, 'bear_strategy': 'breakout', 'bear_bb_std_mult': 3.5099448829124036, 'bear_rsi_os': 28, 'bear_rsi_ob': 90, 'bear_adx_thresh': 23.687170799565852, 'bear_atr_min_pct': 0.020562013773741894, 'bear_atr_max_pct': 0.04035736343940869, 'bear_tp_mult': 1.5356248086917528, 'bear_tsl_mult': 0.640072876805609, 'bear_time_stop': 69, 'bear_use_sma': True, 'bear_use_ema': True, 'bear_use_atr': False, 'bear_use_adx': False, 'bear_use_spike': False, 'bear_rsi_required': True, 'sideways_strategy': 'breakout', 'sideways_bb_std_mult': 2.5571266049387917, 'sideways_rsi_os': 42, 'sideways_rsi_ob': 56, 'sideways_adx_thresh': 26.252957457354327, 'sideways_atr_min_pct': 0.0008532267660687926, 'sideways_atr_max_pct': 0.09685812217158443, 'sideways_tp_mult': 2.993779857852151, 'sideways_tsl_mult': 0.3164778347666426, 'sideways_time_stop': 94, 'sideways_use_sma': True, 'sideways_use_ema': False, 'sideways_use_atr': False, 'sideways_use_adx': True, 'sideways_use_spike': False, 'sideways_rsi_required': False}.
[I 2025-08-30 15:43:51,710] Trial 541 finished with values: [-1000000000.0, 1000000000.0] and parameters: {'p_sma': 8, 'p_std': 6, 'p_atr': 23, 'p_adx': 8, 'rsi_period': 78, 'ema1': 29, 'ema2': 35, 'slip_atr_k': 0.05970223837653474, 'slip_spread_k': 0.1404332952657234, 'spread_hl_frac': 0.016091382901749364, 'bb_std_mult': 2.5968852433048264, 'rsi_os': 27, 'rsi_ob': 72, 'vol_spike': 0.1625053082375177, 'adx_thresh': 8.149390967202809, 'atr_min_pct': 0.013045978418570452, 'atr_max_pct': 0.017151229683180932, 'tp_mult': 1.713174119727268, 'tsl_mult': 0.2265027816455369, 'strategy': 'breakout', 'time_stop': 125, 'use_sma': False, 'use_atr': True, 'use_adx': False, 'use_ema': True, 'use_spike': True, 'rsi_required': True, 'edge_k': 0.04708924176626131, 'edge_cap': 0.5991026409225061, 'bull_strategy': 'mean_reversion', 'bull_bb_std_mult': 2.9189079338653174, 'bull_rsi_os': 39, 'bull_rsi_ob': 64, 'bull_adx_thresh': 23.442383181276025, 'bull_atr_min_pct': 0.021271986632787482, 'bull_atr_max_pct': 0.06984599977877172, 'bull_tp_mult': 2.684772458245221, 'bull_tsl_mult': 0.06936860077952084, 'bull_time_stop': 157, 'bull_use_sma': False, 'bull_use_ema': False, 'bull_use_atr': False, 'bull_use_adx': False, 'bull_use_spike': True, 'bull_rsi_required': False, 'bear_strategy': 'mean_reversion', 'bear_bb_std_mult': 0.734637166601674, 'bear_rsi_os': 46, 'bear_rsi_ob': 78, 'bear_adx_thresh': 28.653560416890894, 'bear_atr_min_pct': 0.020601641897105467, 'bear_atr_max_pct': 0.039999025559189556, 'bear_tp_mult': 1.5530787288939236, 'bear_tsl_mult': 0.5431216623193762, 'bear_time_stop': 72, 'bear_use_sma': True, 'bear_use_ema': True, 'bear_use_atr': False, 'bear_use_adx': False, 'bear_use_spike': False, 'bear_rsi_required': True, 'sideways_strategy': 'mean_reversion', 'sideways_bb_std_mult': 2.5520067425875914, 'sideways_rsi_os': 24, 'sideways_rsi_ob': 76, 'sideways_adx_thresh': 26.271302064783256, 'sideways_atr_min_pct': 0.000521204004343786, 'sideways_atr_max_pct': 0.09824354359481995, 'sideways_tp_mult': 2.5139437228885524, 'sideways_tsl_mult': 0.9822330882370256, 'sideways_time_stop': 163, 'sideways_use_sma': True, 'sideways_use_ema': False, 'sideways_use_atr': True, 'sideways_use_adx': False, 'sideways_use_spike': True, 'sideways_rsi_required': False}.
[I 2025-08-30 15:43:53,309] Trial 542 finished with values: [-0.07754640328507723, 0.07747921284479589] and parameters: {'p_sma': 8, 'p_std': 6, 'p_atr': 23, 'p_adx': 7, 'rsi_period': 81, 'ema1': 30, 'ema2': 37, 'slip_atr_k': 0.059104563564478046, 'slip_spread_k': 0.15142401126230193, 'spread_hl_frac': 0.026681142269190213, 'bb_std_mult': 1.2975669991446992, 'rsi_os': 26, 'rsi_ob': 72, 'vol_spike': 0.17127973683939543, 'adx_thresh': 11.799284259918243, 'atr_min_pct': 0.012785554065464623, 'atr_max_pct': 0.03018020379741524, 'tp_mult': 1.0749777908024196, 'tsl_mult': 0.759725811064252, 'strategy': 'breakout', 'time_stop': 123, 'use_sma': False, 'use_atr': True, 'use_adx': False, 'use_ema': True, 'use_spike': True, 'rsi_required': True, 'edge_k': 0.05733204043019566, 'edge_cap': 0.5973975889947505, 'bull_strategy': 'breakout', 'bull_bb_std_mult': 2.908898170595271, 'bull_rsi_os': 40, 'bull_rsi_ob': 49, 'bull_adx_thresh': 18.375020876578716, 'bull_atr_min_pct': 0.02188319535423944, 'bull_atr_max_pct': 0.07098296286196557, 'bull_tp_mult': 2.668437888214928, 'bull_tsl_mult': 0.23366430276660263, 'bull_time_stop': 155, 'bull_use_sma': False, 'bull_use_ema': False, 'bull_use_atr': False, 'bull_use_adx': False, 'bull_use_spike': True, 'bull_rsi_required': False, 'bear_strategy': 'mean_reversion', 'bear_bb_std_mult': 0.7291562357824442, 'bear_rsi_os': 28, 'bear_rsi_ob': 61, 'bear_adx_thresh': 29.548385680817294, 'bear_atr_min_pct': 0.020888177921023036, 'bear_atr_max_pct': 0.07265033696085835, 'bear_tp_mult': 1.6051057235343928, 'bear_tsl_mult': 0.31849302540062063, 'bear_time_stop': 71, 'bear_use_sma': True, 'bear_use_ema': True, 'bear_use_atr': False, 'bear_use_adx': False, 'bear_use_spike': False, 'bear_rsi_required': True, 'sideways_strategy': 'breakout', 'sideways_bb_std_mult': 2.5513536714486125, 'sideways_rsi_os': 42, 'sideways_rsi_ob': 58, 'sideways_adx_thresh': 6.448303463718789, 'sideways_atr_min_pct': 3.480581600945039e-05, 'sideways_atr_max_pct': 0.010038826213570662, 'sideways_tp_mult': 2.5032086434330014, 'sideways_tsl_mult': 0.9818106140037818, 'sideways_time_stop': 84, 'sideways_use_sma': True, 'sideways_use_ema': False, 'sideways_use_atr': False, 'sideways_use_adx': True, 'sideways_use_spike': False, 'sideways_rsi_required': False}.
[I 2025-08-30 15:43:54,523] Trial 540 finished with values: [-0.015262999532860477, 0.015328752966626235] and parameters: {'p_sma': 8, 'p_std': 46, 'p_atr': 22, 'p_adx': 25, 'rsi_period': 78, 'ema1': 29, 'ema2': 32, 'slip_atr_k': 0.08705576287337394, 'slip_spread_k': 0.16393227913628125, 'spread_hl_frac': 0.04903699809925453, 'bb_std_mult': 2.688590742251974, 'rsi_os': 26, 'rsi_ob': 72, 'vol_spike': 0.16178337756022054, 'adx_thresh': 8.422436506129701, 'atr_min_pct': 0.010546344025286206, 'atr_max_pct': 0.08121109437675056, 'tp_mult': 1.7118194323346771, 'tsl_mult': 0.7554077944364389, 'strategy': 'breakout', 'time_stop': 59, 'use_sma': False, 'use_atr': True, 'use_adx': False, 'use_ema': True, 'use_spike': True, 'rsi_required': True, 'edge_k': 0.08094676695605481, 'edge_cap': 0.8505059940110598, 'bull_strategy': 'mean_reversion', 'bull_bb_std_mult': 1.2860100550337696, 'bull_rsi_os': 36, 'bull_rsi_ob': 49, 'bull_adx_thresh': 23.172018245205404, 'bull_atr_min_pct': 0.02071851573677885, 'bull_atr_max_pct': 0.07014876148154066, 'bull_tp_mult': 2.6331756607420447, 'bull_tsl_mult': 0.3446046989637301, 'bull_time_stop': 157, 'bull_use_sma': False, 'bull_use_ema': False, 'bull_use_atr': False, 'bull_use_adx': False, 'bull_use_spike': True, 'bull_rsi_required': False, 'bear_strategy': 'mean_reversion', 'bear_bb_std_mult': 1.7079883775725624, 'bear_rsi_os': 50, 'bear_rsi_ob': 78, 'bear_adx_thresh': 13.125173224228256, 'bear_atr_min_pct': 0.008045738992244578, 'bear_atr_max_pct': 0.07838716480518074, 'bear_tp_mult': 2.934104411255464, 'bear_tsl_mult': 0.8417972563455915, 'bear_time_stop': 293, 'bear_use_sma': True, 'bear_use_ema': True, 'bear_use_atr': True, 'bear_use_adx': False, 'bear_use_spike': False, 'bear_rsi_required': True, 'sideways_strategy': 'breakout', 'sideways_bb_std_mult': 2.5833523975855037, 'sideways_rsi_os': 42, 'sideways_rsi_ob': 56, 'sideways_adx_thresh': 11.136862887010786, 'sideways_atr_min_pct': 0.0014851202776877124, 'sideways_atr_max_pct': 0.09755995237097029, 'sideways_tp_mult': 2.5081716289487717, 'sideways_tsl_mult': 0.29343864753487, 'sideways_time_stop': 94, 'sideways_use_sma': True, 'sideways_use_ema': False, 'sideways_use_atr': True, 'sideways_use_adx': False, 'sideways_use_spike': True, 'sideways_rsi_required': False}.
[I 2025-08-30 15:43:56,315] Trial 547 finished with values: [-1000000000.0, 1000000000.0] and parameters: {'p_sma': 50, 'p_std': 59, 'p_atr': 15, 'p_adx': 24, 'rsi_period': 74, 'ema1': 16, 'ema2': 34, 'slip_atr_k': 0.0728110212717979, 'slip_spread_k': 0.09297957119593356, 'spread_hl_frac': 0.01061756345112456, 'bb_std_mult': 1.0487128189293622, 'rsi_os': 25, 'rsi_ob': 47, 'vol_spike': 0.09750936429122814, 'adx_thresh': 17.630557105755397, 'atr_min_pct': 0.014356785069669873, 'atr_max_pct': 0.07792844323401142, 'tp_mult': 1.7730395189118697, 'tsl_mult': 0.26780175862369243, 'strategy': 'mean_reversion', 'time_stop': 143, 'use_sma': True, 'use_atr': True, 'use_adx': True, 'use_ema': True, 'use_spike': True, 'rsi_required': True, 'edge_k': 0.2152601232505704, 'edge_cap': 0.3814067030649303, 'bull_strategy': 'mean_reversion', 'bull_bb_std_mult': 2.6297644375611915, 'bull_rsi_os': 41, 'bull_rsi_ob': 51, 'bull_adx_thresh': 21.850528924975176, 'bull_atr_min_pct': 0.021115430051338202, 'bull_atr_max_pct': 0.062124289551074095, 'bull_tp_mult': 2.3470456145099883, 'bull_tsl_mult': 0.285949759081258, 'bull_time_stop': 149, 'bull_use_sma': True, 'bull_use_ema': True, 'bull_use_atr': True, 'bull_use_adx': False, 'bull_use_spike': True, 'bull_rsi_required': False, 'bear_strategy': 'breakout', 'bear_bb_std_mult': 0.8469799619211927, 'bear_rsi_os': 39, 'bear_rsi_ob': 75, 'bear_adx_thresh': 26.512629386743647, 'bear_atr_min_pct': 0.022681220692061948, 'bear_atr_max_pct': 0.10030145695706807, 'bear_tp_mult': 2.373706577134965, 'bear_tsl_mult': 0.963863153524182, 'bear_time_stop': 58, 'bear_use_sma': True, 'bear_use_ema': False, 'bear_use_atr': True, 'bear_use_adx': True, 'bear_use_spike': False, 'bear_rsi_required': True, 'sideways_strategy': 'breakout', 'sideways_bb_std_mult': 1.3384757707759478, 'sideways_rsi_os': 53, 'sideways_rsi_ob': 58, 'sideways_adx_thresh': 12.317483256294892, 'sideways_atr_min_pct': 0.017647554797367244, 'sideways_atr_max_pct': 0.10234769248446858, 'sideways_tp_mult': 1.0172472962334362, 'sideways_tsl_mult': 0.5453766696628015, 'sideways_time_stop': 81, 'sideways_use_sma': True, 'sideways_use_ema': True, 'sideways_use_atr': True, 'sideways_use_adx': False, 'sideways_use_spike': True, 'sideways_rsi_required': False}.
[I 2025-08-30 15:44:53,861] Trial 544 finished with values: [-1000000000.0, 1000000000.0] and parameters: {'p_sma': 5, 'p_std': 23, 'p_atr': 16, 'p_adx': 25, 'rsi_period': 68, 'ema1': 29, 'ema2': 57, 'slip_atr_k': 0.05422873343543711, 'slip_spread_k': 0.09497232458020516, 'spread_hl_frac': 0.026923155073081677, 'bb_std_mult': 1.2506962748342716, 'rsi_os': 15, 'rsi_ob': 46, 'vol_spike': 0.16740323415382624, 'adx_thresh': 13.7469739863675, 'atr_min_pct': 0.014267371294955733, 'atr_max_pct': 0.07840485750734841, 'tp_mult': 2.7852833364439733, 'tsl_mult': 0.4290035530676666, 'strategy': 'breakout', 'time_stop': 143, 'use_sma': False, 'use_atr': True, 'use_adx': False, 'use_ema': True, 'use_spike': True, 'rsi_required': True, 'edge_k': 0.05418179205454768, 'edge_cap': 0.8488729796902866, 'bull_strategy': 'mean_reversion', 'bull_bb_std_mult': 2.2280412743406908, 'bull_rsi_os': 40, 'bull_rsi_ob': 49, 'bull_adx_thresh': 16.847942218325787, 'bull_atr_min_pct': 0.021572269169025375, 'bull_atr_max_pct': 0.07160601513617947, 'bull_tp_mult': 2.103279858795336, 'bull_tsl_mult': 0.9996600261075412, 'bull_time_stop': 150, 'bull_use_sma': True, 'bull_use_ema': True, 'bull_use_atr': True, 'bull_use_adx': False, 'bull_use_spike': True, 'bull_rsi_required': False, 'bear_strategy': 'mean_reversion', 'bear_bb_std_mult': 3.380364880327282, 'bear_rsi_os': 29, 'bear_rsi_ob': 78, 'bear_adx_thresh': 29.776674657732645, 'bear_atr_min_pct': 2.4527352486512083e-05, 'bear_atr_max_pct': 0.07251406135007316, 'bear_tp_mult': 1.6133027114351894, 'bear_tsl_mult': 0.9613809595177975, 'bear_time_stop': 291, 'bear_use_sma': True, 'bear_use_ema': True, 'bear_use_atr': True, 'bear_use_adx': False, 'bear_use_spike': False, 'bear_rsi_required': True, 'sideways_strategy': 'breakout', 'sideways_bb_std_mult': 2.112069626637432, 'sideways_rsi_os': 17, 'sideways_rsi_ob': 58, 'sideways_adx_thresh': 26.980158033761253, 'sideways_atr_min_pct': 0.017582224475083574, 'sideways_atr_max_pct': 0.010280707697566213, 'sideways_tp_mult': 2.3702418434213004, 'sideways_tsl_mult': 0.24922733326195246, 'sideways_time_stop': 78, 'sideways_use_sma': True, 'sideways_use_ema': False, 'sideways_use_atr': True, 'sideways_use_adx': False, 'sideways_use_spike': True, 'sideways_rsi_required': False}.
[I 2025-08-30 15:44:55,221] Trial 545 finished with values: [-1000000000.0, 1000000000.0] and parameters: {'p_sma': 40, 'p_std': 59, 'p_atr': 16, 'p_adx': 24, 'rsi_period': 62, 'ema1': 29, 'ema2': 32, 'slip_atr_k': 0.12478457982566536, 'slip_spread_k': 0.09375203857016781, 'spread_hl_frac': 0.02702332084944379, 'bb_std_mult': 1.2741017393570992, 'rsi_os': 24, 'rsi_ob': 75, 'vol_spike': 0.16842802796108913, 'adx_thresh': 12.01704461389817, 'atr_min_pct': 0.014052869279316442, 'atr_max_pct': 0.09018454212525515, 'tp_mult': 1.8546293965351055, 'tsl_mult': 0.7574165840395347, 'strategy': 'breakout', 'time_stop': 123, 'use_sma': False, 'use_atr': True, 'use_adx': False, 'use_ema': True, 'use_spike': True, 'rsi_required': True, 'edge_k': 0.22320415657948617, 'edge_cap': 0.563358202426231, 'bull_strategy': 'mean_reversion', 'bull_bb_std_mult': 2.6329506238981395, 'bull_rsi_os': 53, 'bull_rsi_ob': 68, 'bull_adx_thresh': 20.328733724312883, 'bull_atr_min_pct': 0.021915384867895668, 'bull_atr_max_pct': 0.0632257382669819, 'bull_tp_mult': 2.4668592560521327, 'bull_tsl_mult': 0.22813302399716498, 'bull_time_stop': 163, 'bull_use_sma': True, 'bull_use_ema': True, 'bull_use_atr': True, 'bull_use_adx': False, 'bull_use_spike': True, 'bull_rsi_required': False, 'bear_strategy': 'mean_reversion', 'bear_bb_std_mult': 2.8790790937641004, 'bear_rsi_os': 29, 'bear_rsi_ob': 61, 'bear_adx_thresh': 26.366535762467183, 'bear_atr_min_pct': 0.021293396729518778, 'bear_atr_max_pct': 0.0722773621316748, 'bear_tp_mult': 1.4755909558493319, 'bear_tsl_mult': 0.9666682380953533, 'bear_time_stop': 58, 'bear_use_sma': True, 'bear_use_ema': True, 'bear_use_atr': True, 'bear_use_adx': False, 'bear_use_spike': False, 'bear_rsi_required': True, 'sideways_strategy': 'breakout', 'sideways_bb_std_mult': 2.393282316239452, 'sideways_rsi_os': 17, 'sideways_rsi_ob': 80, 'sideways_adx_thresh': 12.247522645021746, 'sideways_atr_min_pct': 0.0009500781401998737, 'sideways_atr_max_pct': 0.1020543508901612, 'sideways_tp_mult': 1.5479497203231873, 'sideways_tsl_mult': 0.9129751477713822, 'sideways_time_stop': 83, 'sideways_use_sma': True, 'sideways_use_ema': True, 'sideways_use_atr': True, 'sideways_use_adx': False, 'sideways_use_spike': False, 'sideways_rsi_required': False}.
[I 2025-08-30 15:44:56,547] Trial 546 finished with values: [-1000000000.0, 1000000000.0] and parameters: {'p_sma': 5, 'p_std': 43, 'p_atr': 11, 'p_adx': 25, 'rsi_period': 67, 'ema1': 16, 'ema2': 58, 'slip_atr_k': 0.1324798483194963, 'slip_spread_k': 0.8302050257823582, 'spread_hl_frac': 0.030181470408158804, 'bb_std_mult': 1.2429663671656004, 'rsi_os': 15, 'rsi_ob': 76, 'vol_spike': 0.16821929920016407, 'adx_thresh': 18.148503946911397, 'atr_min_pct': 0.014350871578482709, 'atr_max_pct': 0.07841693807577563, 'tp_mult': 2.8475179958111814, 'tsl_mult': 0.7534785080018233, 'strategy': 'breakout', 'time_stop': 155, 'use_sma': False, 'use_atr': True, 'use_adx': False, 'use_ema': True, 'use_spike': True, 'rsi_required': True, 'edge_k': 0.23017878158274563, 'edge_cap': 0.05125381234856902, 'bull_strategy': 'mean_reversion', 'bull_bb_std_mult': 1.5890763671101755, 'bull_rsi_os': 41, 'bull_rsi_ob': 51, 'bull_adx_thresh': 20.109540724384274, 'bull_atr_min_pct': 0.019970522266602023, 'bull_atr_max_pct': 0.06310596959293796, 'bull_tp_mult': 2.12893352618882, 'bull_tsl_mult': 0.27961040861197733, 'bull_time_stop': 149, 'bull_use_sma': True, 'bull_use_ema': True, 'bull_use_atr': True, 'bull_use_adx': False, 'bull_use_spike': True, 'bull_rsi_required': False, 'bear_strategy': 'mean_reversion', 'bear_bb_std_mult': 0.8378179124788118, 'bear_rsi_os': 40, 'bear_rsi_ob': 75, 'bear_adx_thresh': 27.55991408825276, 'bear_atr_min_pct': 0.02287202872060568, 'bear_atr_max_pct': 0.11187596164779585, 'bear_tp_mult': 1.010514334412406, 'bear_tsl_mult': 0.9405184984817919, 'bear_time_stop': 56, 'bear_use_sma': True, 'bear_use_ema': False, 'bear_use_atr': True, 'bear_use_adx': True, 'bear_use_spike': False, 'bear_rsi_required': True, 'sideways_strategy': 'breakout', 'sideways_bb_std_mult': 1.3206345485471453, 'sideways_rsi_os': 17, 'sideways_rsi_ob': 79, 'sideways_adx_thresh': 27.717110914567378, 'sideways_atr_min_pct': 0.021828320136797363, 'sideways_atr_max_pct': 0.1021441236179335, 'sideways_tp_mult': 2.3822843603653245, 'sideways_tsl_mult': 0.9988861021627199, 'sideways_time_stop': 78, 'sideways_use_sma': True, 'sideways_use_ema': True, 'sideways_use_atr': True, 'sideways_use_adx': False, 'sideways_use_spike': True, 'sideways_rsi_required': False}.
[I 2025-08-30 15:44:58,674] Trial 548 finished with values: [-1000000000.0, 1000000000.0] and parameters: {'p_sma': 5, 'p_std': 57, 'p_atr': 16, 'p_adx': 16, 'rsi_period': 67, 'ema1': 29, 'ema2': 32, 'slip_atr_k': 0.07018317068729378, 'slip_spread_k': 0.08866593034688991, 'spread_hl_frac': 0.02999968646911966, 'bb_std_mult': 1.240764631247256, 'rsi_os': 24, 'rsi_ob': 75, 'vol_spike': 0.16898650191369066, 'adx_thresh': 13.793296106582075, 'atr_min_pct': 0.013733578945749106, 'atr_max_pct': 0.09213192356011313, 'tp_mult': 1.822491787811237, 'tsl_mult': 0.7081752813762613, 'strategy': 'breakout', 'time_stop': 113, 'use_sma': False, 'use_atr': True, 'use_adx': False, 'use_ema': True, 'use_spike': False, 'rsi_required': False, 'edge_k': 0.15727896122277957, 'edge_cap': 0.4335400390460807, 'bull_strategy': 'mean_reversion', 'bull_bb_std_mult': 2.233463959678068, 'bull_rsi_os': 39, 'bull_rsi_ob': 46, 'bull_adx_thresh': 20.265602680202807, 'bull_atr_min_pct': 0.02035170598281166, 'bull_atr_max_pct': 0.05885366480282411, 'bull_tp_mult': 2.112227743274833, 'bull_tsl_mult': 0.2706489332170382, 'bull_time_stop': 163, 'bull_use_sma': True, 'bull_use_ema': True, 'bull_use_atr': True, 'bull_use_adx': False, 'bull_use_spike': True, 'bull_rsi_required': False, 'bear_strategy': 'mean_reversion', 'bear_bb_std_mult': 2.965892878046507, 'bear_rsi_os': 31, 'bear_rsi_ob': 72, 'bear_adx_thresh': 24.804262906604283, 'bear_atr_min_pct': 0.021414192674801262, 'bear_atr_max_pct': 0.06762674552804794, 'bear_tp_mult': 2.85692460521438, 'bear_tsl_mult': 0.9381988753411835, 'bear_time_stop': 195, 'bear_use_sma': True, 'bear_use_ema': True, 'bear_use_atr': True, 'bear_use_adx': False, 'bear_use_spike': True, 'bear_rsi_required': True, 'sideways_strategy': 'breakout', 'sideways_bb_std_mult': 2.0816447766129027, 'sideways_rsi_os': 17, 'sideways_rsi_ob': 57, 'sideways_adx_thresh': 26.980526634300215, 'sideways_atr_min_pct': 0.02174461756909372, 'sideways_atr_max_pct': 0.10573203141352742, 'sideways_tp_mult': 2.3861494004694883, 'sideways_tsl_mult': 0.9174342589134035, 'sideways_time_stop': 128, 'sideways_use_sma': True, 'sideways_use_ema': True, 'sideways_use_atr': True, 'sideways_use_adx': False, 'sideways_use_spike': True, 'sideways_rsi_required': True}.
