[I 2025-08-30 16:34:27,316] Trial 800 finished with values: [-1000000000.0, 1000000000.0] and parameters: {'p_sma': 5, 'p_std': 57, 'p_atr': 26, 'p_adx': 11, 'rsi_period': 25, 'ema1': 24, 'ema2': 56, 'slip_atr_k': 0.06339593660202854, 'slip_spread_k': 0.12986437192734449, 'spread_hl_frac': 0.025046754068947318, 'bb_std_mult': 2.3194727893759697, 'rsi_os': 11, 'rsi_ob': 74, 'vol_spike': 0.051126191356365994, 'adx_thresh': 16.044082572257988, 'atr_min_pct': 0.014183731825122628, 'atr_max_pct': 0.08596831605770659, 'tp_mult': 1.1340711587546055, 'tsl_mult': 0.36819396855627967, 'strategy': 'mean_reversion', 'time_stop': 216, 'use_sma': True, 'use_atr': True, 'use_adx': True, 'use_ema': True, 'use_spike': True, 'rsi_required': False, 'edge_k': 0.6349908467275374, 'edge_cap': 0.4065994961524687, 'bull_strategy': 'breakout', 'bull_bb_std_mult': 0.9572981233002732, 'bull_rsi_os': 39, 'bull_rsi_ob': 63, 'bull_adx_thresh': 23.449875518567787, 'bull_atr_min_pct': 0.02015368185984759, 'bull_atr_max_pct': 0.03192785412289326, 'bull_tp_mult': 1.902174093132834, 'bull_tsl_mult': 0.164141517790913, 'bull_time_stop': 18, 'bull_use_sma': True, 'bull_use_ema': True, 'bull_use_atr': True, 'bull_use_adx': True, 'bull_use_spike': False, 'bull_rsi_required': True, 'bear_strategy': 'breakout', 'bear_bb_std_mult': 2.566536899039784, 'bear_rsi_os': 33, 'bear_rsi_ob': 80, 'bear_adx_thresh': 28.788303385735315, 'bear_atr_min_pct': 0.0212644013188416, 'bear_atr_max_pct': 0.0789615694106463, 'bear_tp_mult': 2.2307167160816808, 'bear_tsl_mult': 0.44766228836956534, 'bear_time_stop': 112, 'bear_use_sma': False, 'bear_use_ema': False, 'bear_use_atr': False, 'bear_use_adx': True, 'bear_use_spike': True, 'bear_rsi_required': True, 'sideways_strategy': 'breakout', 'sideways_bb_std_mult': 0.6532480643176559, 'sideways_rsi_os': 10, 'sideways_rsi_ob': 60, 'sideways_adx_thresh': 34.06347192235024, 'sideways_atr_min_pct': 0.0011603318166776462, 'sideways_atr_max_pct': 0.14090586269574004, 'sideways_tp_mult': 2.87574880873282, 'sideways_tsl_mult': 0.9349983142287479, 'sideways_time_stop': 56, 'sideways_use_sma': True, 'sideways_use_ema': True, 'sideways_use_atr': False, 'sideways_use_adx': True, 'sideways_use_spike': True, 'sideways_rsi_required': True}.
[I 2025-08-30 16:35:16,264] Trial 805 finished with values: [-1000000000.0, 1000000000.0] and parameters: {'p_sma': 6, 'p_std': 26, 'p_atr': 25, 'p_adx': 9, 'rsi_period': 75, 'ema1': 23, 'ema2': 33, 'slip_atr_k': 0.07770994381392657, 'slip_spread_k': 0.0007767988281968119, 'spread_hl_frac': 0.023644515136541772, 'bb_std_mult': 2.4972374769052306, 'rsi_os': 39, 'rsi_ob': 74, 'vol_spike': 0.26021166854594285, 'adx_thresh': 15.162365736924107, 'atr_min_pct': 0.015391607809265637, 'atr_max_pct': 0.12318589583967612, 'tp_mult': 2.6973864392604647, 'tsl_mult': 0.5108622659635873, 'strategy': 'mean_reversion', 'time_stop': 171, 'use_sma': True, 'use_atr': True, 'use_adx': False, 'use_ema': False, 'use_spike': True, 'rsi_required': False, 'edge_k': 0.37213205762473883, 'edge_cap': 0.5512841718064179, 'bull_strategy': 'breakout', 'bull_bb_std_mult': 0.7636057935755675, 'bull_rsi_os': 40, 'bull_rsi_ob': 62, 'bull_adx_thresh': 22.510631297522483, 'bull_atr_min_pct': 0.01965641925925212, 'bull_atr_max_pct': 0.12682195346031164, 'bull_tp_mult': 2.1116067921061346, 'bull_tsl_mult': 0.08236624183287111, 'bull_time_stop': 37, 'bull_use_sma': True, 'bull_use_ema': True, 'bull_use_atr': True, 'bull_use_adx': True, 'bull_use_spike': True, 'bull_rsi_required': True, 'bear_strategy': 'mean_reversion', 'bear_bb_std_mult': 2.718854013842925, 'bear_rsi_os': 32, 'bear_rsi_ob': 70, 'bear_adx_thresh': 30.122034391538364, 'bear_atr_min_pct': 0.02208198417628806, 'bear_atr_max_pct': 0.06991230245626749, 'bear_tp_mult': 1.8240025467853045, 'bear_tsl_mult': 0.23576354188105025, 'bear_time_stop': 216, 'bear_use_sma': False, 'bear_use_ema': False, 'bear_use_atr': True, 'bear_use_adx': True, 'bear_use_spike': True, 'bear_rsi_required': True, 'sideways_strategy': 'breakout', 'sideways_bb_std_mult': 1.144070994745206, 'sideways_rsi_os': 22, 'sideways_rsi_ob': 77, 'sideways_adx_thresh': 25.84147910754329, 'sideways_atr_min_pct': 0.0005881721325265014, 'sideways_atr_max_pct': 0.14985882791959937, 'sideways_tp_mult': 1.20884162263732, 'sideways_tsl_mult': 0.165176395128721, 'sideways_time_stop': 242, 'sideways_use_sma': True, 'sideways_use_ema': False, 'sideways_use_atr': False, 'sideways_use_adx': True, 'sideways_use_spike': False, 'sideways_rsi_required': True}.
[I 2025-08-30 16:35:18,757] Trial 804 finished with values: [-0.07186512542900292, 0.07177251946460007] and parameters: {'p_sma': 25, 'p_std': 40, 'p_atr': 25, 'p_adx': 14, 'rsi_period': 75, 'ema1': 23, 'ema2': 33, 'slip_atr_k': 0.06206489504499416, 'slip_spread_k': 0.8911547400395872, 'spread_hl_frac': 0.023913960841239857, 'bb_std_mult': 2.49558793375672, 'rsi_os': 41, 'rsi_ob': 64, 'vol_spike': 0.1758194562771481, 'adx_thresh': 14.881082401484566, 'atr_min_pct': 0.015466647608625317, 'atr_max_pct': 0.06714449930835192, 'tp_mult': 1.820241954225847, 'tsl_mult': 0.1477123302576967, 'strategy': 'mean_reversion', 'time_stop': 205, 'use_sma': True, 'use_atr': True, 'use_adx': True, 'use_ema': True, 'use_spike': True, 'rsi_required': False, 'edge_k': 0.39075708773123025, 'edge_cap': 0.5777698090365805, 'bull_strategy': 'breakout', 'bull_bb_std_mult': 0.773494599242547, 'bull_rsi_os': 39, 'bull_rsi_ob': 63, 'bull_adx_thresh': 22.612922146549735, 'bull_atr_min_pct': 1.448053760245982e-05, 'bull_atr_max_pct': 0.09909071729873917, 'bull_tp_mult': 2.1087891537926047, 'bull_tsl_mult': 0.09248524235935342, 'bull_time_stop': 18, 'bull_use_sma': True, 'bull_use_ema': True, 'bull_use_atr': True, 'bull_use_adx': True, 'bull_use_spike': True, 'bull_rsi_required': True, 'bear_strategy': 'mean_reversion', 'bear_bb_std_mult': 1.6976102470323713, 'bear_rsi_os': 33, 'bear_rsi_ob': 80, 'bear_adx_thresh': 28.95141370515366, 'bear_atr_min_pct': 0.022206023093973248, 'bear_atr_max_pct': 0.08608950529414444, 'bear_tp_mult': 2.7397025717073302, 'bear_tsl_mult': 0.33304236299143203, 'bear_time_stop': 214, 'bear_use_sma': False, 'bear_use_ema': False, 'bear_use_atr': False, 'bear_use_adx': True, 'bear_use_spike': True, 'bear_rsi_required': True, 'sideways_strategy': 'breakout', 'sideways_bb_std_mult': 1.1647166133018854, 'sideways_rsi_os': 41, 'sideways_rsi_ob': 74, 'sideways_adx_thresh': 25.82929597945847, 'sideways_atr_min_pct': 0.0005200737628344788, 'sideways_atr_max_pct': 0.12773840812368883, 'sideways_tp_mult': 2.963673213147684, 'sideways_tsl_mult': 0.9299196552922848, 'sideways_time_stop': 240, 'sideways_use_sma': True, 'sideways_use_ema': False, 'sideways_use_atr': False, 'sideways_use_adx': True, 'sideways_use_spike': True, 'sideways_rsi_required': True}.
[I 2025-08-30 16:35:19,405] Trial 803 finished with values: [-0.06376311330433637, 0.06368027976457327] and parameters: {'p_sma': 25, 'p_std': 53, 'p_atr': 26, 'p_adx': 11, 'rsi_period': 61, 'ema1': 23, 'ema2': 33, 'slip_atr_k': 0.06273419239858709, 'slip_spread_k': 0.38604566199599655, 'spread_hl_frac': 0.008500492497007517, 'bb_std_mult': 2.282297443819829, 'rsi_os': 41, 'rsi_ob': 68, 'vol_spike': 0.17606322915652112, 'adx_thresh': 14.606902604425128, 'atr_min_pct': 0.01444133116205129, 'atr_max_pct': 0.07708608101942531, 'tp_mult': 1.704915220292127, 'tsl_mult': 0.3549624901414936, 'strategy': 'mean_reversion', 'time_stop': 223, 'use_sma': True, 'use_atr': True, 'use_adx': False, 'use_ema': True, 'use_spike': True, 'rsi_required': False, 'edge_k': 0.8816764925912316, 'edge_cap': 0.5547505792540282, 'bull_strategy': 'breakout', 'bull_bb_std_mult': 2.9993185748273294, 'bull_rsi_os': 39, 'bull_rsi_ob': 62, 'bull_adx_thresh': 23.728757017972534, 'bull_atr_min_pct': 0.019913553203413942, 'bull_atr_max_pct': 0.09906857432740351, 'bull_tp_mult': 2.1103233361577116, 'bull_tsl_mult': 0.14706979355612865, 'bull_time_stop': 17, 'bull_use_sma': True, 'bull_use_ema': True, 'bull_use_atr': True, 'bull_use_adx': True, 'bull_use_spike': True, 'bull_rsi_required': True, 'bear_strategy': 'mean_reversion', 'bear_bb_std_mult': 2.7103726451173733, 'bear_rsi_os': 32, 'bear_rsi_ob': 80, 'bear_adx_thresh': 20.297398244815675, 'bear_atr_min_pct': 0.004034668988611883, 'bear_atr_max_pct': 0.07841299789860123, 'bear_tp_mult': 2.7508599955286823, 'bear_tsl_mult': 0.26664762642080475, 'bear_time_stop': 264, 'bear_use_sma': False, 'bear_use_ema': False, 'bear_use_atr': True, 'bear_use_adx': True, 'bear_use_spike': True, 'bear_rsi_required': True, 'sideways_strategy': 'breakout', 'sideways_bb_std_mult': 0.8021668222070568, 'sideways_rsi_os': 41, 'sideways_rsi_ob': 60, 'sideways_adx_thresh': 25.797867894207837, 'sideways_atr_min_pct': 0.0006052900159944768, 'sideways_atr_max_pct': 0.12773007297917852, 'sideways_tp_mult': 2.9987120958134663, 'sideways_tsl_mult': 0.9234201292427476, 'sideways_time_stop': 91, 'sideways_use_sma': True, 'sideways_use_ema': False, 'sideways_use_atr': False, 'sideways_use_adx': True, 'sideways_use_spike': True, 'sideways_rsi_required': True}.
[I 2025-08-30 16:35:19,969] Trial 802 finished with values: [-0.05266423694473199, 0.0525636715621437] and parameters: {'p_sma': 60, 'p_std': 40, 'p_atr': 26, 'p_adx': 16, 'rsi_period': 24, 'ema1': 23, 'ema2': 31, 'slip_atr_k': 0.06335279836008902, 'slip_spread_k': 0.1289431527566799, 'spread_hl_frac': 0.013233766052898168, 'bb_std_mult': 2.3312470509429755, 'rsi_os': 40, 'rsi_ob': 83, 'vol_spike': 0.17257232933180114, 'adx_thresh': 15.250827419806257, 'atr_min_pct': 0.025185183945107693, 'atr_max_pct': 0.08593206777934008, 'tp_mult': 2.6940315641649066, 'tsl_mult': 0.3709071068295976, 'strategy': 'mean_reversion', 'time_stop': 205, 'use_sma': True, 'use_atr': True, 'use_adx': False, 'use_ema': True, 'use_spike': True, 'rsi_required': False, 'edge_k': 0.39250633024787807, 'edge_cap': 0.11458235673026729, 'bull_strategy': 'breakout', 'bull_bb_std_mult': 1.7717437577886757, 'bull_rsi_os': 14, 'bull_rsi_ob': 62, 'bull_adx_thresh': 34.079820214359934, 'bull_atr_min_pct': 0.01991882502869984, 'bull_atr_max_pct': 0.10326701921739097, 'bull_tp_mult': 2.4553639340681688, 'bull_tsl_mult': 0.8690583014539086, 'bull_time_stop': 20, 'bull_use_sma': True, 'bull_use_ema': True, 'bull_use_atr': True, 'bull_use_adx': True, 'bull_use_spike': False, 'bull_rsi_required': True, 'bear_strategy': 'breakout', 'bear_bb_std_mult': 2.7285436545924386, 'bear_rsi_os': 50, 'bear_rsi_ob': 80, 'bear_adx_thresh': 29.859299828591148, 'bear_atr_min_pct': 0.01619633413868655, 'bear_atr_max_pct': 0.08615814037227325, 'bear_tp_mult': 2.7361509048439583, 'bear_tsl_mult': 0.32920842339676276, 'bear_time_stop': 219, 'bear_use_sma': False, 'bear_use_ema': False, 'bear_use_atr': True, 'bear_use_adx': True, 'bear_use_spike': True, 'bear_rsi_required': True, 'sideways_strategy': 'breakout', 'sideways_bb_std_mult': 1.1594589883134143, 'sideways_rsi_os': 37, 'sideways_rsi_ob': 60, 'sideways_adx_thresh': 23.775104926373054, 'sideways_atr_min_pct': 0.0016887466400766142, 'sideways_atr_max_pct': 0.10929892264496234, 'sideways_tp_mult': 2.965625204573939, 'sideways_tsl_mult': 0.9341125516923449, 'sideways_time_stop': 83, 'sideways_use_sma': True, 'sideways_use_ema': True, 'sideways_use_atr': False, 'sideways_use_adx': True, 'sideways_use_spike': True, 'sideways_rsi_required': True}.
[I 2025-08-30 16:35:21,532] Trial 807 finished with values: [-1000000000.0, 1000000000.0] and parameters: {'p_sma': 51, 'p_std': 55, 'p_atr': 26, 'p_adx': 10, 'rsi_period': 60, 'ema1': 23, 'ema2': 46, 'slip_atr_k': 0.073214242908925, 'slip_spread_k': 0.15994585386444643, 'spread_hl_frac': 0.03828504787274989, 'bb_std_mult': 2.278436342108541, 'rsi_os': 53, 'rsi_ob': 71, 'vol_spike': 0.16569363508195278, 'adx_thresh': 6.992950304803255, 'atr_min_pct': 0.019810667604729406, 'atr_max_pct': 0.07736409393801404, 'tp_mult': 1.3735620140042486, 'tsl_mult': 0.10946782429328106, 'strategy': 'mean_reversion', 'time_stop': 224, 'use_sma': True, 'use_atr': True, 'use_adx': False, 'use_ema': True, 'use_spike': False, 'rsi_required': False, 'edge_k': 0.4104100894413345, 'edge_cap': 0.18189932548277193, 'bull_strategy': 'breakout', 'bull_bb_std_mult': 1.9236943996201026, 'bull_rsi_os': 41, 'bull_rsi_ob': 65, 'bull_adx_thresh': 24.282558561070218, 'bull_atr_min_pct': 0.020079431788678097, 'bull_atr_max_pct': 0.10731650711458082, 'bull_tp_mult': 2.7162660396413334, 'bull_tsl_mult': 0.20142800778855974, 'bull_time_stop': 49, 'bull_use_sma': True, 'bull_use_ema': True, 'bull_use_atr': True, 'bull_use_adx': True, 'bull_use_spike': True, 'bull_rsi_required': True, 'bear_strategy': 'mean_reversion', 'bear_bb_std_mult': 2.4913824435890195, 'bear_rsi_os': 32, 'bear_rsi_ob': 88, 'bear_adx_thresh': 30.999596945620475, 'bear_atr_min_pct': 0.02557491655717227, 'bear_atr_max_pct': 0.07632302568771011, 'bear_tp_mult': 2.802615088563048, 'bear_tsl_mult': 0.260845599190918, 'bear_time_stop': 283, 'bear_use_sma': False, 'bear_use_ema': False, 'bear_use_atr': True, 'bear_use_adx': True, 'bear_use_spike': True, 'bear_rsi_required': False, 'sideways_strategy': 'breakout', 'sideways_bb_std_mult': 1.5193341631799617, 'sideways_rsi_os': 9, 'sideways_rsi_ob': 61, 'sideways_adx_thresh': 23.93804138561491, 'sideways_atr_min_pct': 0.024556945349267147, 'sideways_atr_max_pct': 0.1015135379570632, 'sideways_tp_mult': 2.8972658580609414, 'sideways_tsl_mult': 0.8289812958220876, 'sideways_time_stop': 83, 'sideways_use_sma': False, 'sideways_use_ema': True, 'sideways_use_atr': False, 'sideways_use_adx': True, 'sideways_use_spike': True, 'sideways_rsi_required': True}.
[I 2025-08-30 16:35:21,559] Trial 809 finished with values: [-1000000000.0, 1000000000.0] and parameters: {'p_sma': 7, 'p_std': 55, 'p_atr': 27, 'p_adx': 10, 'rsi_period': 42, 'ema1': 9, 'ema2': 32, 'slip_atr_k': 0.22667028892185212, 'slip_spread_k': 0.22457247421810783, 'spread_hl_frac': 0.01769206435508884, 'bb_std_mult': 2.349133490254427, 'rsi_os': 53, 'rsi_ob': 54, 'vol_spike': 0.028289098607030633, 'adx_thresh': 24.157568545771348, 'atr_min_pct': 0.015015219067082834, 'atr_max_pct': 0.07076634965705335, 'tp_mult': 1.8788497472670302, 'tsl_mult': 0.28124954725599405, 'strategy': 'mean_reversion', 'time_stop': 9, 'use_sma': True, 'use_atr': False, 'use_adx': False, 'use_ema': False, 'use_spike': False, 'rsi_required': False, 'edge_k': 0.42791071955923676, 'edge_cap': 0.9046903579122633, 'bull_strategy': 'breakout', 'bull_bb_std_mult': 0.6075770500943605, 'bull_rsi_os': 10, 'bull_rsi_ob': 72, 'bull_adx_thresh': 24.53090907648464, 'bull_atr_min_pct': 0.020768037532521506, 'bull_atr_max_pct': 0.08871684355173454, 'bull_tp_mult': 2.0212470478104447, 'bull_tsl_mult': 0.11515975311556093, 'bull_time_stop': 31, 'bull_use_sma': True, 'bull_use_ema': True, 'bull_use_atr': True, 'bull_use_adx': True, 'bull_use_spike': True, 'bull_rsi_required': True, 'bear_strategy': 'mean_reversion', 'bear_bb_std_mult': 3.5537986010245692, 'bear_rsi_os': 34, 'bear_rsi_ob': 81, 'bear_adx_thresh': 21.97299483834088, 'bear_atr_min_pct': 0.018085361484841963, 'bear_atr_max_pct': 0.04247936829661071, 'bear_tp_mult': 2.8506815492407256, 'bear_tsl_mult': 0.5814690470660137, 'bear_time_stop': 289, 'bear_use_sma': False, 'bear_use_ema': False, 'bear_use_atr': True, 'bear_use_adx': True, 'bear_use_spike': True, 'bear_rsi_required': False, 'sideways_strategy': 'mean_reversion', 'sideways_bb_std_mult': 0.7015143463553721, 'sideways_rsi_os': 48, 'sideways_rsi_ob': 62, 'sideways_adx_thresh': 23.853674844917307, 'sideways_atr_min_pct': 0.009484638693310284, 'sideways_atr_max_pct': 0.1016009607730176, 'sideways_tp_mult': 2.901642402078368, 'sideways_tsl_mult': 0.8342679161069846, 'sideways_time_stop': 110, 'sideways_use_sma': False, 'sideways_use_ema': True, 'sideways_use_atr': False, 'sideways_use_adx': True, 'sideways_use_spike': False, 'sideways_rsi_required': True}.
[I 2025-08-30 16:35:21,728] Trial 808 finished with values: [-1000000000.0, 1000000000.0] and parameters: {'p_sma': 51, 'p_std': 55, 'p_atr': 26, 'p_adx': 16, 'rsi_period': 71, 'ema1': 23, 'ema2': 31, 'slip_atr_k': 0.08780579978954564, 'slip_spread_k': 0.17859271641904678, 'spread_hl_frac': 0.026404874317416803, 'bb_std_mult': 2.1529542466585028, 'rsi_os': 44, 'rsi_ob': 45, 'vol_spike': 0.1635478995821788, 'adx_thresh': 14.047163793948982, 'atr_min_pct': 0.01588072638892607, 'atr_max_pct': 0.07032630896872588, 'tp_mult': 1.8761143320056384, 'tsl_mult': 0.10934069703146435, 'strategy': 'mean_reversion', 'time_stop': 182, 'use_sma': True, 'use_atr': True, 'use_adx': False, 'use_ema': False, 'use_spike': False, 'rsi_required': False, 'edge_k': 0.4396941523875085, 'edge_cap': 0.9085295282851804, 'bull_strategy': 'breakout', 'bull_bb_std_mult': 0.8751593400480564, 'bull_rsi_os': 41, 'bull_rsi_ob': 65, 'bull_adx_thresh': 16.139422284983933, 'bull_atr_min_pct': 0.020513757519499812, 'bull_atr_max_pct': 0.04182479087068705, 'bull_tp_mult': 2.0111955065770006, 'bull_tsl_mult': 0.11484847967543954, 'bull_time_stop': 48, 'bull_use_sma': True, 'bull_use_ema': True, 'bull_use_atr': True, 'bull_use_adx': True, 'bull_use_spike': True, 'bull_rsi_required': True, 'bear_strategy': 'mean_reversion', 'bear_bb_std_mult': 1.3410890232415174, 'bear_rsi_os': 34, 'bear_rsi_ob': 81, 'bear_adx_thresh': 10.454793179723552, 'bear_atr_min_pct': 0.02824903449954514, 'bear_atr_max_pct': 0.05142837039984825, 'bear_tp_mult': 2.8581627879799187, 'bear_tsl_mult': 0.32457940514542755, 'bear_time_stop': 284, 'bear_use_sma': False, 'bear_use_ema': False, 'bear_use_atr': True, 'bear_use_adx': True, 'bear_use_spike': True, 'bear_rsi_required': False, 'sideways_strategy': 'mean_reversion', 'sideways_bb_std_mult': 1.238028119951678, 'sideways_rsi_os': 54, 'sideways_rsi_ob': 51, 'sideways_adx_thresh': 32.61413735852227, 'sideways_atr_min_pct': 0.02655466788602584, 'sideways_atr_max_pct': 0.022328541937612176, 'sideways_tp_mult': 2.803575001050086, 'sideways_tsl_mult': 0.9641481721065851, 'sideways_time_stop': 83, 'sideways_use_sma': False, 'sideways_use_ema': True, 'sideways_use_atr': False, 'sideways_use_adx': True, 'sideways_use_spike': True, 'sideways_rsi_required': True}.
[I 2025-08-30 16:35:58,257] Trial 806 finished with values: [-1000000000.0, 1000000000.0] and parameters: {'p_sma': 9, 'p_std': 55, 'p_atr': 26, 'p_adx': 13, 'rsi_period': 72, 'ema1': 23, 'ema2': 31, 'slip_atr_k': 0.07409066631243758, 'slip_spread_k': 0.17329360218082496, 'spread_hl_frac': 0.017447861640185063, 'bb_std_mult': 2.2660408211951104, 'rsi_os': 41, 'rsi_ob': 68, 'vol_spike': 0.16455804549748898, 'adx_thresh': 14.618070522520814, 'atr_min_pct': 0.015744494651529297, 'atr_max_pct': 0.07692748793778997, 'tp_mult': 1.3594884745189473, 'tsl_mult': 0.10722084470521004, 'strategy': 'mean_reversion', 'time_stop': 207, 'use_sma': True, 'use_atr': True, 'use_adx': False, 'use_ema': True, 'use_spike': False, 'rsi_required': False, 'edge_k': 0.3972550076539094, 'edge_cap': 0.18356644426589086, 'bull_strategy': 'breakout', 'bull_bb_std_mult': 2.9944347738707506, 'bull_rsi_os': 39, 'bull_rsi_ob': 93, 'bull_adx_thresh': 22.676595184027256, 'bull_atr_min_pct': 0.02066460974093572, 'bull_atr_max_pct': 0.041214847482230046, 'bull_tp_mult': 1.6678133011401999, 'bull_tsl_mult': 0.862231262704208, 'bull_time_stop': 47, 'bull_use_sma': True, 'bull_use_ema': True, 'bull_use_atr': True, 'bull_use_adx': True, 'bull_use_spike': True, 'bull_rsi_required': True, 'bear_strategy': 'mean_reversion', 'bear_bb_std_mult': 2.470425822749092, 'bear_rsi_os': 32, 'bear_rsi_ob': 88, 'bear_adx_thresh': 20.273662240652055, 'bear_atr_min_pct': 0.004148445123484166, 'bear_atr_max_pct': 0.07640793143154145, 'bear_tp_mult': 2.742858940148631, 'bear_tsl_mult': 0.2561763154552737, 'bear_time_stop': 136, 'bear_use_sma': False, 'bear_use_ema': False, 'bear_use_atr': True, 'bear_use_adx': True, 'bear_use_spike': True, 'bear_rsi_required': True, 'sideways_strategy': 'breakout', 'sideways_bb_std_mult': 0.7193438257293583, 'sideways_rsi_os': 41, 'sideways_rsi_ob': 50, 'sideways_adx_thresh': 23.888657108491106, 'sideways_atr_min_pct': 0.024841374750061943, 'sideways_atr_max_pct': 0.1008672941518761, 'sideways_tp_mult': 2.997406382724484, 'sideways_tsl_mult': 0.01541359233869366, 'sideways_time_stop': 89, 'sideways_use_sma': False, 'sideways_use_ema': True, 'sideways_use_atr': False, 'sideways_use_adx': True, 'sideways_use_spike': True, 'sideways_rsi_required': True}.
