[I 2025-08-30 16:31:21,439] Trial 784 finished with values: [-1000000000.0, 1000000000.0] and parameters: {'p_sma': 43, 'p_std': 57, 'p_atr': 26, 'p_adx': 11, 'rsi_period': 40, 'ema1': 24, 'ema2': 32, 'slip_atr_k': 0.07232061725617896, 'slip_spread_k': 0.5073422700963635, 'spread_hl_frac': 0.02620149328759282, 'bb_std_mult': 2.1505043181738097, 'rsi_os': 42, 'rsi_ob': 58, 'vol_spike': 0.13956554913898817, 'adx_thresh': 14.285691977376032, 'atr_min_pct': 0.014984125688919485, 'atr_max_pct': 0.06880170853793645, 'tp_mult': 1.845293616609733, 'tsl_mult': 0.4754480835977817, 'strategy': 'mean_reversion', 'time_stop': 250, 'use_sma': True, 'use_atr': False, 'use_adx': False, 'use_ema': True, 'use_spike': True, 'rsi_required': False, 'edge_k': 0.3997338713353264, 'edge_cap': 0.7524178248695141, 'bull_strategy': 'breakout', 'bull_bb_std_mult': 0.825578310149363, 'bull_rsi_os': 28, 'bull_rsi_ob': 64, 'bull_adx_thresh': 23.97334518268739, 'bull_atr_min_pct': 0.020478214065322776, 'bull_atr_max_pct': 0.10289537931383091, 'bull_tp_mult': 2.0086183362269066, 'bull_tsl_mult': 0.06432175714472094, 'bull_time_stop': 9, 'bull_use_sma': True, 'bull_use_ema': True, 'bull_use_atr': True, 'bull_use_adx': True, 'bull_use_spike': True, 'bull_rsi_required': True, 'bear_strategy': 'mean_reversion', 'bear_bb_std_mult': 2.549976953513196, 'bear_rsi_os': 32, 'bear_rsi_ob': 67, 'bear_adx_thresh': 30.363877516422324, 'bear_atr_min_pct': 0.02060997607145406, 'bear_atr_max_pct': 0.0757467890375587, 'bear_tp_mult': 2.296808943836935, 'bear_tsl_mult': 0.381708878500632, 'bear_time_stop': 238, 'bear_use_sma': False, 'bear_use_ema': False, 'bear_use_atr': False, 'bear_use_adx': True, 'bear_use_spike': True, 'bear_rsi_required': True, 'sideways_strategy': 'mean_reversion', 'sideways_bb_std_mult': 1.336620849024424, 'sideways_rsi_os': 36, 'sideways_rsi_ob': 61, 'sideways_adx_thresh': 11.71849093248896, 'sideways_atr_min_pct': 0.0005811871016248218, 'sideways_atr_max_pct': 0.046744279444682076, 'sideways_tp_mult': 2.147640536515392, 'sideways_tsl_mult': 0.6620732227288507, 'sideways_time_stop': 77, 'sideways_use_sma': True, 'sideways_use_ema': True, 'sideways_use_atr': False, 'sideways_use_adx': True, 'sideways_use_spike': True, 'sideways_rsi_required': True}.
[I 2025-08-30 16:31:22,369] Trial 781 finished with values: [-1000000000.0, 1000000000.0] and parameters: {'p_sma': 7, 'p_std': 11, 'p_atr': 27, 'p_adx': 11, 'rsi_period': 55, 'ema1': 22, 'ema2': 32, 'slip_atr_k': 0.0819653010930246, 'slip_spread_k': 0.8337096269720774, 'spread_hl_frac': 0.024520235218343397, 'bb_std_mult': 2.198866845544705, 'rsi_os': 16, 'rsi_ob': 73, 'vol_spike': 0.13683451668216137, 'adx_thresh': 14.219177709141103, 'atr_min_pct': 0.008715307364091953, 'atr_max_pct': 0.070898022723146, 'tp_mult': 1.6661336936126587, 'tsl_mult': 0.36453618325317766, 'strategy': 'mean_reversion', 'time_stop': 220, 'use_sma': True, 'use_atr': True, 'use_adx': False, 'use_ema': True, 'use_spike': True, 'rsi_required': False, 'edge_k': 0.475679080883517, 'edge_cap': 0.6279820385106218, 'bull_strategy': 'breakout', 'bull_bb_std_mult': 1.3176648246163993, 'bull_rsi_os': 28, 'bull_rsi_ob': 64, 'bull_adx_thresh': 22.961302806616978, 'bull_atr_min_pct': 0.02036391942427774, 'bull_atr_max_pct': 0.08650750691179747, 'bull_tp_mult': 2.8799711012590734, 'bull_tsl_mult': 0.06522902705720997, 'bull_time_stop': 11, 'bull_use_sma': True, 'bull_use_ema': True, 'bull_use_atr': True, 'bull_use_adx': True, 'bull_use_spike': True, 'bull_rsi_required': True, 'bear_strategy': 'mean_reversion', 'bear_bb_std_mult': 2.6659563012523466, 'bear_rsi_os': 51, 'bear_rsi_ob': 67, 'bear_adx_thresh': 12.897020703137464, 'bear_atr_min_pct': 0.020390639610958775, 'bear_atr_max_pct': 0.11620382433347115, 'bear_tp_mult': 2.82106319986574, 'bear_tsl_mult': 0.4939167861860087, 'bear_time_stop': 254, 'bear_use_sma': False, 'bear_use_ema': False, 'bear_use_atr': False, 'bear_use_adx': True, 'bear_use_spike': True, 'bear_rsi_required': True, 'sideways_strategy': 'breakout', 'sideways_bb_std_mult': 1.3159634976307937, 'sideways_rsi_os': 40, 'sideways_rsi_ob': 61, 'sideways_adx_thresh': 25.161761369734716, 'sideways_atr_min_pct': 0.010361324115653608, 'sideways_atr_max_pct': 0.11091540101963086, 'sideways_tp_mult': 2.131895626399392, 'sideways_tsl_mult': 0.6525431096591773, 'sideways_time_stop': 77, 'sideways_use_sma': True, 'sideways_use_ema': True, 'sideways_use_atr': False, 'sideways_use_adx': True, 'sideways_use_spike': True, 'sideways_rsi_required': True}.
[I 2025-08-30 16:31:22,874] Trial 785 finished with values: [-0.043435734985630026, 0.04334734339925964] and parameters: {'p_sma': 7, 'p_std': 11, 'p_atr': 25, 'p_adx': 30, 'rsi_period': 40, 'ema1': 22, 'ema2': 32, 'slip_atr_k': 0.2187968635025519, 'slip_spread_k': 0.11388725902088734, 'spread_hl_frac': 0.037483622602998624, 'bb_std_mult': 2.22081732028052, 'rsi_os': 6, 'rsi_ob': 84, 'vol_spike': 0.07428936640628041, 'adx_thresh': 31.247197571402975, 'atr_min_pct': 0.015073848071745872, 'atr_max_pct': 0.13174331047437549, 'tp_mult': 1.8532311990413517, 'tsl_mult': 0.48161006770412174, 'strategy': 'mean_reversion', 'time_stop': 212, 'use_sma': True, 'use_atr': True, 'use_adx': False, 'use_ema': True, 'use_spike': True, 'rsi_required': False, 'edge_k': 0.41835834121908844, 'edge_cap': 0.08472757006225007, 'bull_strategy': 'breakout', 'bull_bb_std_mult': 0.7504849671383685, 'bull_rsi_os': 40, 'bull_rsi_ob': 74, 'bull_adx_thresh': 14.598166291463984, 'bull_atr_min_pct': 0.024933119309168444, 'bull_atr_max_pct': 0.09090779320685594, 'bull_tp_mult': 2.0730155370010155, 'bull_tsl_mult': 0.9570065561996105, 'bull_time_stop': 45, 'bull_use_sma': True, 'bull_use_ema': True, 'bull_use_atr': True, 'bull_use_adx': True, 'bull_use_spike': True, 'bull_rsi_required': True, 'bear_strategy': 'mean_reversion', 'bear_bb_std_mult': 2.9634842602838782, 'bear_rsi_os': 52, 'bear_rsi_ob': 67, 'bear_adx_thresh': 28.358623427857026, 'bear_atr_min_pct': 0.021113762979907007, 'bear_atr_max_pct': 0.11695134761900734, 'bear_tp_mult': 2.7662814849365147, 'bear_tsl_mult': 0.7575818909050325, 'bear_time_stop': 254, 'bear_use_sma': False, 'bear_use_ema': False, 'bear_use_atr': False, 'bear_use_adx': True, 'bear_use_spike': True, 'bear_rsi_required': True, 'sideways_strategy': 'breakout', 'sideways_bb_std_mult': 1.436700949804094, 'sideways_rsi_os': 36, 'sideways_rsi_ob': 63, 'sideways_adx_thresh': 23.168017471959324, 'sideways_atr_min_pct': 0.0005401334268662782, 'sideways_atr_max_pct': 0.10541355519037335, 'sideways_tp_mult': 2.9267726340724627, 'sideways_tsl_mult': 0.9297544151756514, 'sideways_time_stop': 72, 'sideways_use_sma': True, 'sideways_use_ema': False, 'sideways_use_atr': False, 'sideways_use_adx': True, 'sideways_use_spike': True, 'sideways_rsi_required': True}.
[I 2025-08-30 16:32:04,056] Trial 789 finished with values: [-1000000000.0, 1000000000.0] and parameters: {'p_sma': 35, 'p_std': 55, 'p_atr': 26, 'p_adx': 10, 'rsi_period': 76, 'ema1': 23, 'ema2': 33, 'slip_atr_k': 0.07087535540373649, 'slip_spread_k': 0.1827656308541032, 'spread_hl_frac': 0.006768365582236476, 'bb_std_mult': 2.2907432735976143, 'rsi_os': 37, 'rsi_ob': 70, 'vol_spike': 0.19265805454332224, 'adx_thresh': 15.13934108032033, 'atr_min_pct': 0.016464863307808258, 'atr_max_pct': 0.025659334174568275, 'tp_mult': 2.7534257653401975, 'tsl_mult': 0.21106566912262548, 'strategy': 'mean_reversion', 'time_stop': 207, 'use_sma': True, 'use_atr': True, 'use_adx': True, 'use_ema': False, 'use_spike': False, 'rsi_required': False, 'edge_k': 1.9652221926550912, 'edge_cap': 0.591111577362965, 'bull_strategy': 'breakout', 'bull_bb_std_mult': 3.077482126213237, 'bull_rsi_os': 40, 'bull_rsi_ob': 59, 'bull_adx_thresh': 23.403853661926547, 'bull_atr_min_pct': 0.019629026695718393, 'bull_atr_max_pct': 0.09550897513500119, 'bull_tp_mult': 2.79864881800552, 'bull_tsl_mult': 0.1334618074518647, 'bull_time_stop': 38, 'bull_use_sma': True, 'bull_use_ema': True, 'bull_use_atr': True, 'bull_use_adx': True, 'bull_use_spike': False, 'bull_rsi_required': True, 'bear_strategy': 'breakout', 'bear_bb_std_mult': 2.859675241642329, 'bear_rsi_os': 31, 'bear_rsi_ob': 82, 'bear_adx_thresh': 27.854919162374863, 'bear_atr_min_pct': 0.024619312783469113, 'bear_atr_max_pct': 0.11158884958789275, 'bear_tp_mult': 2.8887142506268537, 'bear_tsl_mult': 0.2843005395555637, 'bear_time_stop': 278, 'bear_use_sma': False, 'bear_use_ema': False, 'bear_use_atr': True, 'bear_use_adx': True, 'bear_use_spike': True, 'bear_rsi_required': False, 'sideways_strategy': 'breakout', 'sideways_bb_std_mult': 1.062729333524291, 'sideways_rsi_os': 25, 'sideways_rsi_ob': 63, 'sideways_adx_thresh': 9.335142088137086, 'sideways_atr_min_pct': 0.008186336900984864, 'sideways_atr_max_pct': 0.10246287438334517, 'sideways_tp_mult': 2.802587684035797, 'sideways_tsl_mult': 0.9427782721681349, 'sideways_time_stop': 82, 'sideways_use_sma': True, 'sideways_use_ema': False, 'sideways_use_atr': False, 'sideways_use_adx': True, 'sideways_use_spike': False, 'sideways_rsi_required': True}.
[I 2025-08-30 16:32:04,089] Trial 787 finished with values: [-1000000000.0, 1000000000.0] and parameters: {'p_sma': 8, 'p_std': 15, 'p_atr': 26, 'p_adx': 30, 'rsi_period': 76, 'ema1': 22, 'ema2': 26, 'slip_atr_k': 0.2388985060624002, 'slip_spread_k': 0.8335785320201792, 'spread_hl_frac': 0.046766750524326044, 'bb_std_mult': 2.2162690069987097, 'rsi_os': 19, 'rsi_ob': 71, 'vol_spike': 0.16689297534378114, 'adx_thresh': 25.85600578139418, 'atr_min_pct': 0.01612114366562253, 'atr_max_pct': 0.049987944129404605, 'tp_mult': 2.2476827525565986, 'tsl_mult': 0.20439265571626242, 'strategy': 'mean_reversion', 'time_stop': 290, 'use_sma': True, 'use_atr': True, 'use_adx': False, 'use_ema': False, 'use_spike': True, 'rsi_required': False, 'edge_k': 0.4575509701867483, 'edge_cap': 0.6320783395124235, 'bull_strategy': 'breakout', 'bull_bb_std_mult': 3.0921407246526638, 'bull_rsi_os': 40, 'bull_rsi_ob': 66, 'bull_adx_thresh': 14.407993201734907, 'bull_atr_min_pct': 0.020859067544555146, 'bull_atr_max_pct': 0.09072207464519048, 'bull_tp_mult': 2.067990174396367, 'bull_tsl_mult': 0.12679683015551052, 'bull_time_stop': 41, 'bull_use_sma': True, 'bull_use_ema': True, 'bull_use_atr': True, 'bull_use_adx': True, 'bull_use_spike': False, 'bull_rsi_required': True, 'bear_strategy': 'breakout', 'bear_bb_std_mult': 2.853302537357281, 'bear_rsi_os': 52, 'bear_rsi_ob': 82, 'bear_adx_thresh': 27.73555825008924, 'bear_atr_min_pct': 0.021179585673622662, 'bear_atr_max_pct': 0.07894499374582954, 'bear_tp_mult': 2.8897100188892, 'bear_tsl_mult': 0.2803202397957043, 'bear_time_stop': 157, 'bear_use_sma': False, 'bear_use_ema': False, 'bear_use_atr': True, 'bear_use_adx': True, 'bear_use_spike': True, 'bear_rsi_required': True, 'sideways_strategy': 'breakout', 'sideways_bb_std_mult': 1.4444399636204468, 'sideways_rsi_os': 25, 'sideways_rsi_ob': 85, 'sideways_adx_thresh': 7.007247397742374, 'sideways_atr_min_pct': 0.016577616619985445, 'sideways_atr_max_pct': 0.1045438644898445, 'sideways_tp_mult': 2.9460713322028473, 'sideways_tsl_mult': 0.3498611447195712, 'sideways_time_stop': 70, 'sideways_use_sma': True, 'sideways_use_ema': False, 'sideways_use_atr': False, 'sideways_use_adx': True, 'sideways_use_spike': False, 'sideways_rsi_required': True}.
[I 2025-08-30 16:32:04,687] Trial 788 finished with values: [-0.027832647027325796, 0.027751610261471164] and parameters: {'p_sma': 6, 'p_std': 38, 'p_atr': 25, 'p_adx': 14, 'rsi_period': 15, 'ema1': 23, 'ema2': 26, 'slip_atr_k': 0.13000647401985332, 'slip_spread_k': 0.5450443091422617, 'spread_hl_frac': 0.021205641078781333, 'bb_std_mult': 3.133040168223598, 'rsi_os': 48, 'rsi_ob': 70, 'vol_spike': 0.1886201378630258, 'adx_thresh': 5.706784381000011, 'atr_min_pct': 0.016830777219335187, 'atr_max_pct': 0.07533783339408952, 'tp_mult': 1.8054686753272344, 'tsl_mult': 0.20711226926935028, 'strategy': 'mean_reversion', 'time_stop': 210, 'use_sma': True, 'use_atr': True, 'use_adx': False, 'use_ema': False, 'use_spike': False, 'rsi_required': False, 'edge_k': 0.43815477121599294, 'edge_cap': 0.5871874914145779, 'bull_strategy': 'breakout', 'bull_bb_std_mult': 0.7276900965556532, 'bull_rsi_os': 54, 'bull_rsi_ob': 66, 'bull_adx_thresh': 25.671019346203213, 'bull_atr_min_pct': 0.024879962669346296, 'bull_atr_max_pct': 0.09072941720390781, 'bull_tp_mult': 2.0712605833951008, 'bull_tsl_mult': 0.03551752712186346, 'bull_time_stop': 44, 'bull_use_sma': True, 'bull_use_ema': True, 'bull_use_atr': True, 'bull_use_adx': True, 'bull_use_spike': False, 'bull_rsi_required': True, 'bear_strategy': 'breakout', 'bear_bb_std_mult': 2.864359078112244, 'bear_rsi_os': 31, 'bear_rsi_ob': 46, 'bear_adx_thresh': 19.472408302753223, 'bear_atr_min_pct': 0.008080068246532445, 'bear_atr_max_pct': 0.06781645133032106, 'bear_tp_mult': 2.8905355126311894, 'bear_tsl_mult': 0.5270598239779632, 'bear_time_stop': 275, 'bear_use_sma': False, 'bear_use_ema': False, 'bear_use_atr': True, 'bear_use_adx': True, 'bear_use_spike': True, 'bear_rsi_required': False, 'sideways_strategy': 'breakout', 'sideways_bb_std_mult': 0.7974947303432354, 'sideways_rsi_os': 29, 'sideways_rsi_ob': 63, 'sideways_adx_thresh': 31.03979158840675, 'sideways_atr_min_pct': 0.0008936709583301473, 'sideways_atr_max_pct': 0.10499435703092416, 'sideways_tp_mult': 1.1641826691524857, 'sideways_tsl_mult': 0.3607278418165527, 'sideways_time_stop': 68, 'sideways_use_sma': True, 'sideways_use_ema': False, 'sideways_use_atr': False, 'sideways_use_adx': True, 'sideways_use_spike': False, 'sideways_rsi_required': True}.
[I 2025-08-30 16:32:05,466] Trial 786 finished with values: [-0.055853645642568894, 0.05577430152021611] and parameters: {'p_sma': 8, 'p_std': 15, 'p_atr': 26, 'p_adx': 19, 'rsi_period': 35, 'ema1': 22, 'ema2': 22, 'slip_atr_k': 0.15503901311347804, 'slip_spread_k': 0.4989501640375377, 'spread_hl_frac': 0.0065806026525919645, 'bb_std_mult': 2.2146847907717566, 'rsi_os': 18, 'rsi_ob': 56, 'vol_spike': 0.17218683452689632, 'adx_thresh': 22.66040877153091, 'atr_min_pct': 0.016679615709705265, 'atr_max_pct': 0.04912512309423453, 'tp_mult': 2.253540499943488, 'tsl_mult': 0.31574801653855944, 'strategy': 'mean_reversion', 'time_stop': 212, 'use_sma': True, 'use_atr': True, 'use_adx': False, 'use_ema': False, 'use_spike': True, 'rsi_required': False, 'edge_k': 1.9790558124754658, 'edge_cap': 0.9750652225645111, 'bull_strategy': 'breakout', 'bull_bb_std_mult': 3.089846463872492, 'bull_rsi_os': 40, 'bull_rsi_ob': 55, 'bull_adx_thresh': 6.723764957980592, 'bull_atr_min_pct': 0.027609990825864048, 'bull_atr_max_pct': 0.09041387805802392, 'bull_tp_mult': 2.7882298628998927, 'bull_tsl_mult': 0.8368387094878792, 'bull_time_stop': 44, 'bull_use_sma': True, 'bull_use_ema': True, 'bull_use_atr': True, 'bull_use_adx': True, 'bull_use_spike': True, 'bull_rsi_required': True, 'bear_strategy': 'mean_reversion', 'bear_bb_std_mult': 3.2736266877111815, 'bear_rsi_os': 33, 'bear_rsi_ob': 82, 'bear_adx_thresh': 27.80216156315598, 'bear_atr_min_pct': 0.007840169355003548, 'bear_atr_max_pct': 0.07782223062566092, 'bear_tp_mult': 2.761925091447592, 'bear_tsl_mult': 0.4912188111678702, 'bear_time_stop': 158, 'bear_use_sma': False, 'bear_use_ema': False, 'bear_use_atr': True, 'bear_use_adx': True, 'bear_use_spike': True, 'bear_rsi_required': True, 'sideways_strategy': 'breakout', 'sideways_bb_std_mult': 1.423624913329015, 'sideways_rsi_os': 36, 'sideways_rsi_ob': 46, 'sideways_adx_thresh': 22.296602856409866, 'sideways_atr_min_pct': 0.0006026150299155128, 'sideways_atr_max_pct': 0.10487234447935573, 'sideways_tp_mult': 2.9331033898546046, 'sideways_tsl_mult': 0.3489880752256179, 'sideways_time_stop': 69, 'sideways_use_sma': True, 'sideways_use_ema': False, 'sideways_use_atr': False, 'sideways_use_adx': True, 'sideways_use_spike': False, 'sideways_rsi_required': True}.
[I 2025-08-30 16:32:49,958] Trial 793 finished with values: [-1000000000.0, 1000000000.0] and parameters: {'p_sma': 41, 'p_std': 56, 'p_atr': 25, 'p_adx': 10, 'rsi_period': 78, 'ema1': 24, 'ema2': 10, 'slip_atr_k': 0.072972877514069, 'slip_spread_k': 0.1103110946581132, 'spread_hl_frac': 0.023291330843181378, 'bb_std_mult': 2.3292878867795412, 'rsi_os': 38, 'rsi_ob': 72, 'vol_spike': 0.1275374304717619, 'adx_thresh': 16.76614552797448, 'atr_min_pct': 0.0060982445155705455, 'atr_max_pct': 0.012394439305945096, 'tp_mult': 2.1979865386503947, 'tsl_mult': 0.3993462349310151, 'strategy': 'mean_reversion', 'time_stop': 223, 'use_sma': True, 'use_atr': False, 'use_adx': True, 'use_ema': True, 'use_spike': True, 'rsi_required': False, 'edge_k': 0.3220856490033829, 'edge_cap': 0.9460341917034145, 'bull_strategy': 'breakout', 'bull_bb_std_mult': 0.6893880918800385, 'bull_rsi_os': 6, 'bull_rsi_ob': 61, 'bull_adx_thresh': 22.930020162492923, 'bull_atr_min_pct': 0.01907879017032825, 'bull_atr_max_pct': 0.09343753177958973, 'bull_tp_mult': 1.6129169617299717, 'bull_tsl_mult': 0.7366894218326296, 'bull_time_stop': 30, 'bull_use_sma': True, 'bull_use_ema': True, 'bull_use_atr': True, 'bull_use_adx': True, 'bull_use_spike': True, 'bull_rsi_required': True, 'bear_strategy': 'mean_reversion', 'bear_bb_std_mult': 3.1174937544521573, 'bear_rsi_os': 34, 'bear_rsi_ob': 89, 'bear_adx_thresh': 29.274691301080697, 'bear_atr_min_pct': 0.019552155569442904, 'bear_atr_max_pct': 0.07302612297204135, 'bear_tp_mult': 2.79175054858055, 'bear_tsl_mult': 0.8045678483096314, 'bear_time_stop': 287, 'bear_use_sma': False, 'bear_use_ema': False, 'bear_use_atr': True, 'bear_use_adx': True, 'bear_use_spike': True, 'bear_rsi_required': True, 'sideways_strategy': 'mean_reversion', 'sideways_bb_std_mult': 1.5958963711645682, 'sideways_rsi_os': 41, 'sideways_rsi_ob': 60, 'sideways_adx_thresh': 24.359321649625386, 'sideways_atr_min_pct': 0.0023770394437785955, 'sideways_atr_max_pct': 0.09851075950775331, 'sideways_tp_mult': 1.7943145421455255, 'sideways_tsl_mult': 0.9233149421697668, 'sideways_time_stop': 90, 'sideways_use_sma': False, 'sideways_use_ema': True, 'sideways_use_atr': False, 'sideways_use_adx': True, 'sideways_use_spike': True, 'sideways_rsi_required': True}.
[I 2025-08-30 16:32:51,142] Trial 792 finished with values: [-1000000000.0, 1000000000.0] and parameters: {'p_sma': 26, 'p_std': 45, 'p_atr': 26, 'p_adx': 10, 'rsi_period': 65, 'ema1': 23, 'ema2': 29, 'slip_atr_k': 0.0752997618845475, 'slip_spread_k': 0.10737268316783567, 'spread_hl_frac': 0.041562846208151226, 'bb_std_mult': 2.5820867477810925, 'rsi_os': 38, 'rsi_ob': 85, 'vol_spike': 0.1597095531829935, 'adx_thresh': 7.977780271431653, 'atr_min_pct': 0.0071811736027374284, 'atr_max_pct': 0.0731422304086886, 'tp_mult': 1.7562540140644232, 'tsl_mult': 0.2679899651953819, 'strategy': 'mean_reversion', 'time_stop': 232, 'use_sma': True, 'use_atr': False, 'use_adx': True, 'use_ema': True, 'use_spike': True, 'rsi_required': False, 'edge_k': 0.36007558988657173, 'edge_cap': 0.6581312307943883, 'bull_strategy': 'breakout', 'bull_bb_std_mult': 0.6737536854494351, 'bull_rsi_os': 52, 'bull_rsi_ob': 55, 'bull_adx_thresh': 22.685113085844208, 'bull_atr_min_pct': 0.019197463722086663, 'bull_atr_max_pct': 0.09362626961400784, 'bull_tp_mult': 1.9677126805090406, 'bull_tsl_mult': 0.08430423057891273, 'bull_time_stop': 29, 'bull_use_sma': True, 'bull_use_ema': True, 'bull_use_atr': True, 'bull_use_adx': True, 'bull_use_spike': True, 'bull_rsi_required': True, 'bear_strategy': 'mean_reversion', 'bear_bb_std_mult': 2.3754929822441375, 'bear_rsi_os': 34, 'bear_rsi_ob': 89, 'bear_adx_thresh': 29.068369238758233, 'bear_atr_min_pct': 0.018729369304062472, 'bear_atr_max_pct': 0.07332778791915344, 'bear_tp_mult': 1.086122668245955, 'bear_tsl_mult': 0.8289994584138396, 'bear_time_stop': 147, 'bear_use_sma': False, 'bear_use_ema': False, 'bear_use_atr': True, 'bear_use_adx': True, 'bear_use_spike': True, 'bear_rsi_required': True, 'sideways_strategy': 'breakout', 'sideways_bb_std_mult': 1.5958198049803145, 'sideways_rsi_os': 5, 'sideways_rsi_ob': 62, 'sideways_adx_thresh': 24.321562267764584, 'sideways_atr_min_pct': 1.5297799585888765e-05, 'sideways_atr_max_pct': 0.07163618470414329, 'sideways_tp_mult': 2.892351159619227, 'sideways_tsl_mult': 0.9662239047901424, 'sideways_time_stop': 128, 'sideways_use_sma': False, 'sideways_use_ema': True, 'sideways_use_atr': False, 'sideways_use_adx': True, 'sideways_use_spike': True, 'sideways_rsi_required': True}.
