[I 2025-08-30 14:56:56,023] Trial 296 finished with values: [-1000000000.0, 1000000000.0] and parameters: {'p_sma': 13, 'p_std': 54, 'p_atr': 14, 'p_adx': 23, 'rsi_period': 45, 'ema1': 29, 'ema2': 26, 'slip_atr_k': 0.02211200637485996, 'slip_spread_k': 0.40095425498434983, 'spread_hl_frac': 0.001372120488513998, 'bb_std_mult': 3.1915728954746854, 'rsi_os': 36, 'rsi_ob': 94, 'vol_spike': 0.2947424366442921, 'adx_thresh': 27.754761315968235, 'atr_min_pct': 0.01599600110451441, 'atr_max_pct': 0.05642729323332095, 'tp_mult': 2.3806269232634754, 'tsl_mult': 0.9076164944257193, 'strategy': 'breakout', 'time_stop': 149, 'use_sma': False, 'use_atr': True, 'use_adx': False, 'use_ema': True, 'use_spike': True, 'rsi_required': True, 'edge_k': 1.3771105438581919, 'edge_cap': 0.6594777362777338, 'bull_strategy': 'mean_reversion', 'bull_bb_std_mult': 2.426584271375148, 'bull_rsi_os': 25, 'bull_rsi_ob': 93, 'bull_adx_thresh': 7.381778073589594, 'bull_atr_min_pct': 0.005407859904079699, 'bull_atr_max_pct': 0.023817236527251737, 'bull_tp_mult': 1.4770505685041762, 'bull_tsl_mult': 0.7393584471829708, 'bull_time_stop': 54, 'bull_use_sma': False, 'bull_use_ema': False, 'bull_use_atr': False, 'bull_use_adx': True, 'bull_use_spike': True, 'bull_rsi_required': True, 'bear_strategy': 'mean_reversion', 'bear_bb_std_mult': 0.726748457345119, 'bear_rsi_os': 12, 'bear_rsi_ob': 91, 'bear_adx_thresh': 32.720106826647104, 'bear_atr_min_pct': 0.012636359362563439, 'bear_atr_max_pct': 0.012986581866589058, 'bear_tp_mult': 1.1647064152746713, 'bear_tsl_mult': 0.08412563248003498, 'bear_time_stop': 56, 'bear_use_sma': False, 'bear_use_ema': True, 'bear_use_atr': True, 'bear_use_adx': True, 'bear_use_spike': False, 'bear_rsi_required': True, 'sideways_strategy': 'mean_reversion', 'sideways_bb_std_mult': 3.3661332912759425, 'sideways_rsi_os': 39, 'sideways_rsi_ob': 90, 'sideways_adx_thresh': 5.674665889783656, 'sideways_atr_min_pct': 0.0019396174291596673, 'sideways_atr_max_pct': 0.0947952370248037, 'sideways_tp_mult': 2.3318718817362885, 'sideways_tsl_mult': 0.2659934149094078, 'sideways_time_stop': 60, 'sideways_use_sma': False, 'sideways_use_ema': False, 'sideways_use_atr': True, 'sideways_use_adx': False, 'sideways_use_spike': True, 'sideways_rsi_required': False}.
[I 2025-08-30 14:57:27,640] Trial 299 finished with values: [-0.013283598389120743, 0.013250746504882713] and parameters: {'p_sma': 14, 'p_std': 54, 'p_atr': 29, 'p_adx': 25, 'rsi_period': 45, 'ema1': 28, 'ema2': 19, 'slip_atr_k': 0.0223686954552828, 'slip_spread_k': 0.639290813716646, 'spread_hl_frac': 0.0016719171962746705, 'bb_std_mult': 3.4822739400442373, 'rsi_os': 43, 'rsi_ob': 94, 'vol_spike': 0.28505286856612694, 'adx_thresh': 28.060533650822627, 'atr_min_pct': 0.016187471084981198, 'atr_max_pct': 0.04577952409616366, 'tp_mult': 2.483376773449239, 'tsl_mult': 0.9457447591744186, 'strategy': 'breakout', 'time_stop': 131, 'use_sma': False, 'use_atr': False, 'use_adx': False, 'use_ema': False, 'use_spike': True, 'rsi_required': True, 'edge_k': 1.3408855569117832, 'edge_cap': 0.6396919049651377, 'bull_strategy': 'mean_reversion', 'bull_bb_std_mult': 2.4277555091621323, 'bull_rsi_os': 28, 'bull_rsi_ob': 84, 'bull_adx_thresh': 10.22787273934386, 'bull_atr_min_pct': 0.005246605964700689, 'bull_atr_max_pct': 0.02379406310821414, 'bull_tp_mult': 1.4729827694878344, 'bull_tsl_mult': 0.6476779716473618, 'bull_time_stop': 130, 'bull_use_sma': True, 'bull_use_ema': True, 'bull_use_atr': False, 'bull_use_adx': False, 'bull_use_spike': False, 'bull_rsi_required': False, 'bear_strategy': 'mean_reversion', 'bear_bb_std_mult': 1.004442230575372, 'bear_rsi_os': 12, 'bear_rsi_ob': 87, 'bear_adx_thresh': 34.10783640996991, 'bear_atr_min_pct': 0.029451654922524197, 'bear_atr_max_pct': 0.012362451722682563, 'bear_tp_mult': 1.1230559545813967, 'bear_tsl_mult': 0.038319288229803836, 'bear_time_stop': 164, 'bear_use_sma': False, 'bear_use_ema': True, 'bear_use_atr': True, 'bear_use_adx': True, 'bear_use_spike': False, 'bear_rsi_required': False, 'sideways_strategy': 'breakout', 'sideways_bb_std_mult': 3.376694175924147, 'sideways_rsi_os': 41, 'sideways_rsi_ob': 91, 'sideways_adx_thresh': 27.566932748419802, 'sideways_atr_min_pct': 0.0015801818773754106, 'sideways_atr_max_pct': 0.0935085506690968, 'sideways_tp_mult': 2.2735631601535733, 'sideways_tsl_mult': 0.43332407458739713, 'sideways_time_stop': 69, 'sideways_use_sma': False, 'sideways_use_ema': False, 'sideways_use_atr': True, 'sideways_use_adx': False, 'sideways_use_spike': True, 'sideways_rsi_required': False}.
[I 2025-08-30 14:57:28,142] Trial 298 finished with values: [-0.03557040190051197, 0.03545419362600964] and parameters: {'p_sma': 14, 'p_std': 47, 'p_atr': 14, 'p_adx': 25, 'rsi_period': 45, 'ema1': 28, 'ema2': 27, 'slip_atr_k': 0.23056279722445597, 'slip_spread_k': 0.5237053181400133, 'spread_hl_frac': 0.0011964328774080437, 'bb_std_mult': 3.377462310113646, 'rsi_os': 15, 'rsi_ob': 94, 'vol_spike': 0.27422778918596497, 'adx_thresh': 27.994599490389938, 'atr_min_pct': 0.017635139211364302, 'atr_max_pct': 0.05516347863250524, 'tp_mult': 2.4814948075574823, 'tsl_mult': 0.9411665714072478, 'strategy': 'breakout', 'time_stop': 147, 'use_sma': False, 'use_atr': False, 'use_adx': False, 'use_ema': False, 'use_spike': True, 'rsi_required': True, 'edge_k': 1.3628139099988865, 'edge_cap': 0.6628015235821665, 'bull_strategy': 'mean_reversion', 'bull_bb_std_mult': 1.7384358150120305, 'bull_rsi_os': 22, 'bull_rsi_ob': 84, 'bull_adx_thresh': 7.444899709025881, 'bull_atr_min_pct': 0.009100682743356625, 'bull_atr_max_pct': 0.09841679704091276, 'bull_tp_mult': 1.4776073745945955, 'bull_tsl_mult': 0.6908643096487246, 'bull_time_stop': 129, 'bull_use_sma': False, 'bull_use_ema': False, 'bull_use_atr': False, 'bull_use_adx': True, 'bull_use_spike': True, 'bull_rsi_required': False, 'bear_strategy': 'mean_reversion', 'bear_bb_std_mult': 3.4294537500242406, 'bear_rsi_os': 12, 'bear_rsi_ob': 87, 'bear_adx_thresh': 32.64259337050127, 'bear_atr_min_pct': 0.02940976554264039, 'bear_atr_max_pct': 0.014370336940301633, 'bear_tp_mult': 1.1111177200442757, 'bear_tsl_mult': 0.08257540608770712, 'bear_time_stop': 54, 'bear_use_sma': False, 'bear_use_ema': True, 'bear_use_atr': True, 'bear_use_adx': False, 'bear_use_spike': False, 'bear_rsi_required': True, 'sideways_strategy': 'breakout', 'sideways_bb_std_mult': 3.5812435023362763, 'sideways_rsi_os': 40, 'sideways_rsi_ob': 90, 'sideways_adx_thresh': 16.6903923574206, 'sideways_atr_min_pct': 0.0018722908825729672, 'sideways_atr_max_pct': 0.08643761837712094, 'sideways_tp_mult': 2.3015190482669734, 'sideways_tsl_mult': 0.45972301661751447, 'sideways_time_stop': 66, 'sideways_use_sma': False, 'sideways_use_ema': False, 'sideways_use_atr': True, 'sideways_use_adx': False, 'sideways_use_spike': True, 'sideways_rsi_required': False}.
[I 2025-08-30 14:57:28,821] Trial 300 finished with values: [-0.019780102477672368, 0.01969783344343356] and parameters: {'p_sma': 14, 'p_std': 53, 'p_atr': 29, 'p_adx': 23, 'rsi_period': 45, 'ema1': 28, 'ema2': 21, 'slip_atr_k': 0.12406708845971161, 'slip_spread_k': 0.6432023026224916, 'spread_hl_frac': 0.0014427065438619839, 'bb_std_mult': 3.36372698347699, 'rsi_os': 32, 'rsi_ob': 94, 'vol_spike': 0.27351498367938426, 'adx_thresh': 27.525833409241546, 'atr_min_pct': 0.017056161985349327, 'atr_max_pct': 0.04598879205606657, 'tp_mult': 2.4813625636205203, 'tsl_mult': 0.9439286220686343, 'strategy': 'breakout', 'time_stop': 146, 'use_sma': False, 'use_atr': False, 'use_adx': False, 'use_ema': False, 'use_spike': True, 'rsi_required': True, 'edge_k': 1.031476222169674, 'edge_cap': 0.3876537529152105, 'bull_strategy': 'mean_reversion', 'bull_bb_std_mult': 2.465239724031372, 'bull_rsi_os': 22, 'bull_rsi_ob': 84, 'bull_adx_thresh': 12.126085932982308, 'bull_atr_min_pct': 0.005178994247998335, 'bull_atr_max_pct': 0.05246207893036742, 'bull_tp_mult': 1.4707130505596917, 'bull_tsl_mult': 0.7286986551442661, 'bull_time_stop': 129, 'bull_use_sma': True, 'bull_use_ema': True, 'bull_use_atr': False, 'bull_use_adx': False, 'bull_use_spike': False, 'bull_rsi_required': False, 'bear_strategy': 'mean_reversion', 'bear_bb_std_mult': 1.0258503222086304, 'bear_rsi_os': 12, 'bear_rsi_ob': 86, 'bear_adx_thresh': 34.134877560313974, 'bear_atr_min_pct': 0.02931596503545167, 'bear_atr_max_pct': 0.015072090603001874, 'bear_tp_mult': 1.1191034112704747, 'bear_tsl_mult': 0.041432705950833565, 'bear_time_stop': 54, 'bear_use_sma': False, 'bear_use_ema': True, 'bear_use_atr': True, 'bear_use_adx': True, 'bear_use_spike': False, 'bear_rsi_required': False, 'sideways_strategy': 'breakout', 'sideways_bb_std_mult': 3.3856673200550578, 'sideways_rsi_os': 41, 'sideways_rsi_ob': 91, 'sideways_adx_thresh': 22.99667079872108, 'sideways_atr_min_pct': 0.001743402459559366, 'sideways_atr_max_pct': 0.09343730821089635, 'sideways_tp_mult': 2.2629012054129034, 'sideways_tsl_mult': 0.5052791929987033, 'sideways_time_stop': 13, 'sideways_use_sma': False, 'sideways_use_ema': False, 'sideways_use_atr': True, 'sideways_use_adx': False, 'sideways_use_spike': True, 'sideways_rsi_required': False}.
[I 2025-08-30 14:57:29,008] Trial 301 finished with values: [-0.04042478454373799, 0.04032207699845123] and parameters: {'p_sma': 14, 'p_std': 46, 'p_atr': 12, 'p_adx': 25, 'rsi_period': 45, 'ema1': 28, 'ema2': 23, 'slip_atr_k': 0.08528549325575262, 'slip_spread_k': 0.5193811202200476, 'spread_hl_frac': 0.00182359618884306, 'bb_std_mult': 3.3828810731511436, 'rsi_os': 50, 'rsi_ob': 94, 'vol_spike': 0.27443089718556285, 'adx_thresh': 28.204576307058897, 'atr_min_pct': 0.017087760067787474, 'atr_max_pct': 0.04523187496527192, 'tp_mult': 2.480842749695535, 'tsl_mult': 0.9521321715856289, 'strategy': 'breakout', 'time_stop': 144, 'use_sma': False, 'use_atr': False, 'use_adx': False, 'use_ema': False, 'use_spike': True, 'rsi_required': True, 'edge_k': 1.0290653426961742, 'edge_cap': 0.6314607620061057, 'bull_strategy': 'mean_reversion', 'bull_bb_std_mult': 3.539171447300496, 'bull_rsi_os': 28, 'bull_rsi_ob': 84, 'bull_adx_thresh': 19.103903483128384, 'bull_atr_min_pct': 0.00013454049534784764, 'bull_atr_max_pct': 0.10031417975640003, 'bull_tp_mult': 1.1159352187461606, 'bull_tsl_mult': 0.7215450341479518, 'bull_time_stop': 127, 'bull_use_sma': True, 'bull_use_ema': True, 'bull_use_atr': False, 'bull_use_adx': False, 'bull_use_spike': False, 'bull_rsi_required': False, 'bear_strategy': 'mean_reversion', 'bear_bb_std_mult': 1.0389733793653175, 'bear_rsi_os': 13, 'bear_rsi_ob': 87, 'bear_adx_thresh': 33.91181442397912, 'bear_atr_min_pct': 0.005458436617766323, 'bear_atr_max_pct': 0.014005452393895182, 'bear_tp_mult': 1.0987673263804525, 'bear_tsl_mult': 0.041625155807388424, 'bear_time_stop': 53, 'bear_use_sma': False, 'bear_use_ema': True, 'bear_use_atr': True, 'bear_use_adx': False, 'bear_use_spike': False, 'bear_rsi_required': False, 'sideways_strategy': 'breakout', 'sideways_bb_std_mult': 3.448250295862612, 'sideways_rsi_os': 41, 'sideways_rsi_ob': 93, 'sideways_adx_thresh': 16.99281505595281, 'sideways_atr_min_pct': 0.0016035567096302022, 'sideways_atr_max_pct': 0.09065355324784073, 'sideways_tp_mult': 2.2706479260045778, 'sideways_tsl_mult': 0.5034344929900374, 'sideways_time_stop': 69, 'sideways_use_sma': True, 'sideways_use_ema': False, 'sideways_use_atr': True, 'sideways_use_adx': False, 'sideways_use_spike': True, 'sideways_rsi_required': False}.
[I 2025-08-30 14:58:00,583] Trial 304 finished with values: [-0.021213741810792497, 0.021141406129211903] and parameters: {'p_sma': 16, 'p_std': 50, 'p_atr': 19, 'p_adx': 25, 'rsi_period': 46, 'ema1': 28, 'ema2': 19, 'slip_atr_k': 0.15116365071256188, 'slip_spread_k': 0.6741086106235287, 'spread_hl_frac': 2.1515581059299797e-05, 'bb_std_mult': 3.4830999336965034, 'rsi_os': 32, 'rsi_ob': 95, 'vol_spike': 0.27501168468565884, 'adx_thresh': 30.435853062574495, 'atr_min_pct': 0.017052556328859117, 'atr_max_pct': 0.04512826915603401, 'tp_mult': 2.4754388465162434, 'tsl_mult': 0.9466413937918247, 'strategy': 'breakout', 'time_stop': 132, 'use_sma': False, 'use_atr': False, 'use_adx': False, 'use_ema': False, 'use_spike': True, 'rsi_required': True, 'edge_k': 1.285192756251621, 'edge_cap': 0.24847446084479502, 'bull_strategy': 'mean_reversion', 'bull_bb_std_mult': 3.3446316756686416, 'bull_rsi_os': 28, 'bull_rsi_ob': 88, 'bull_adx_thresh': 30.257804806166913, 'bull_atr_min_pct': 0.00487133192415815, 'bull_atr_max_pct': 0.056971338300302515, 'bull_tp_mult': 2.4494098767982804, 'bull_tsl_mult': 0.7154101196669037, 'bull_time_stop': 111, 'bull_use_sma': True, 'bull_use_ema': True, 'bull_use_atr': False, 'bull_use_adx': False, 'bull_use_spike': False, 'bull_rsi_required': False, 'bear_strategy': 'mean_reversion', 'bear_bb_std_mult': 1.0286695652702413, 'bear_rsi_os': 13, 'bear_rsi_ob': 70, 'bear_adx_thresh': 31.445552199023663, 'bear_atr_min_pct': 0.002677143478819208, 'bear_atr_max_pct': 0.011036602865511062, 'bear_tp_mult': 1.373307990555435, 'bear_tsl_mult': 0.044339115197102354, 'bear_time_stop': 49, 'bear_use_sma': False, 'bear_use_ema': True, 'bear_use_atr': True, 'bear_use_adx': False, 'bear_use_spike': False, 'bear_rsi_required': False, 'sideways_strategy': 'breakout', 'sideways_bb_std_mult': 3.451785952446785, 'sideways_rsi_os': 41, 'sideways_rsi_ob': 93, 'sideways_adx_thresh': 34.42156830465821, 'sideways_atr_min_pct': 0.0014528053352901218, 'sideways_atr_max_pct': 0.09079827188104425, 'sideways_tp_mult': 2.109072692434736, 'sideways_tsl_mult': 0.39880110004895464, 'sideways_time_stop': 30, 'sideways_use_sma': True, 'sideways_use_ema': False, 'sideways_use_atr': True, 'sideways_use_adx': False, 'sideways_use_spike': True, 'sideways_rsi_required': False}.
[I 2025-08-30 14:58:01,276] Trial 302 finished with values: [-0.023566602188150876, 0.023473608997530176] and parameters: {'p_sma': 16, 'p_std': 46, 'p_atr': 13, 'p_adx': 25, 'rsi_period': 45, 'ema1': 28, 'ema2': 23, 'slip_atr_k': 0.08538382828137697, 'slip_spread_k': 0.6358007715892411, 'spread_hl_frac': 0.0018913010850191703, 'bb_std_mult': 3.3550245704442716, 'rsi_os': 18, 'rsi_ob': 94, 'vol_spike': 0.2775197280278004, 'adx_thresh': 28.15928293465628, 'atr_min_pct': 0.01792025441819867, 'atr_max_pct': 0.04362245221027425, 'tp_mult': 2.4618879886253007, 'tsl_mult': 0.9440104783739416, 'strategy': 'breakout', 'time_stop': 132, 'use_sma': False, 'use_atr': False, 'use_adx': False, 'use_ema': False, 'use_spike': True, 'rsi_required': True, 'edge_k': 0.8290332575592618, 'edge_cap': 0.21848778612393932, 'bull_strategy': 'mean_reversion', 'bull_bb_std_mult': 1.6551656559132086, 'bull_rsi_os': 28, 'bull_rsi_ob': 84, 'bull_adx_thresh': 28.250954450852138, 'bull_atr_min_pct': 0.004927824789732971, 'bull_atr_max_pct': 0.05134899291817066, 'bull_tp_mult': 2.046773804439848, 'bull_tsl_mult': 0.7222450162695171, 'bull_time_stop': 118, 'bull_use_sma': True, 'bull_use_ema': False, 'bull_use_atr': False, 'bull_use_adx': True, 'bull_use_spike': False, 'bull_rsi_required': False, 'bear_strategy': 'mean_reversion', 'bear_bb_std_mult': 1.0617651037706668, 'bear_rsi_os': 13, 'bear_rsi_ob': 69, 'bear_adx_thresh': 31.77252772218533, 'bear_atr_min_pct': 0.029239513844134063, 'bear_atr_max_pct': 0.01808835062600894, 'bear_tp_mult': 1.1146241766374885, 'bear_tsl_mult': 0.04720064794761378, 'bear_time_stop': 52, 'bear_use_sma': False, 'bear_use_ema': True, 'bear_use_atr': True, 'bear_use_adx': False, 'bear_use_spike': False, 'bear_rsi_required': False, 'sideways_strategy': 'breakout', 'sideways_bb_std_mult': 3.3817527760647397, 'sideways_rsi_os': 41, 'sideways_rsi_ob': 60, 'sideways_adx_thresh': 7.038622765960044, 'sideways_atr_min_pct': 0.0024607940689404147, 'sideways_atr_max_pct': 0.08486862613429474, 'sideways_tp_mult': 2.130212469085614, 'sideways_tsl_mult': 0.5044775942422092, 'sideways_time_stop': 26, 'sideways_use_sma': True, 'sideways_use_ema': False, 'sideways_use_atr': True, 'sideways_use_adx': False, 'sideways_use_spike': True, 'sideways_rsi_required': False}.
[I 2025-08-30 14:58:01,444] Trial 303 finished with values: [-0.03498077312237968, 0.03488370634619337] and parameters: {'p_sma': 16, 'p_std': 53, 'p_atr': 8, 'p_adx': 23, 'rsi_period': 45, 'ema1': 28, 'ema2': 19, 'slip_atr_k': 0.1398131999944285, 'slip_spread_k': 0.634588338136475, 'spread_hl_frac': 0.0017631846531048073, 'bb_std_mult': 3.3542985086081494, 'rsi_os': 9, 'rsi_ob': 95, 'vol_spike': 0.27314496755212875, 'adx_thresh': 30.30889990687108, 'atr_min_pct': 0.016970457722095336, 'atr_max_pct': 0.04397780375112511, 'tp_mult': 2.4631991833135074, 'tsl_mult': 0.9431092585228328, 'strategy': 'breakout', 'time_stop': 133, 'use_sma': False, 'use_atr': False, 'use_adx': False, 'use_ema': False, 'use_spike': True, 'rsi_required': True, 'edge_k': 1.0302911459673614, 'edge_cap': 0.23648260290229844, 'bull_strategy': 'mean_reversion', 'bull_bb_std_mult': 1.6278341124871125, 'bull_rsi_os': 28, 'bull_rsi_ob': 89, 'bull_adx_thresh': 30.278458678141597, 'bull_atr_min_pct': 0.004859467522308706, 'bull_atr_max_pct': 0.021134706824949435, 'bull_tp_mult': 1.1005936169675787, 'bull_tsl_mult': 0.644522588118289, 'bull_time_stop': 89, 'bull_use_sma': True, 'bull_use_ema': True, 'bull_use_atr': False, 'bull_use_adx': False, 'bull_use_spike': False, 'bull_rsi_required': False, 'bear_strategy': 'mean_reversion', 'bear_bb_std_mult': 1.0479104021669658, 'bear_rsi_os': 13, 'bear_rsi_ob': 69, 'bear_adx_thresh': 31.758585667782654, 'bear_atr_min_pct': 0.0019656676047751735, 'bear_atr_max_pct': 0.01900982868552851, 'bear_tp_mult': 1.3293961107051955, 'bear_tsl_mult': 0.03757258030073163, 'bear_time_stop': 100, 'bear_use_sma': False, 'bear_use_ema': True, 'bear_use_atr': True, 'bear_use_adx': False, 'bear_use_spike': False, 'bear_rsi_required': False, 'sideways_strategy': 'breakout', 'sideways_bb_std_mult': 3.46147846055965, 'sideways_rsi_os': 40, 'sideways_rsi_ob': 60, 'sideways_adx_thresh': 22.36563358925665, 'sideways_atr_min_pct': 0.0023777667989687964, 'sideways_atr_max_pct': 0.09254729350781328, 'sideways_tp_mult': 2.1270738092236967, 'sideways_tsl_mult': 0.5089216254350013, 'sideways_time_stop': 11, 'sideways_use_sma': True, 'sideways_use_ema': False, 'sideways_use_atr': True, 'sideways_use_adx': False, 'sideways_use_spike': True, 'sideways_rsi_required': False}.
[I 2025-08-30 14:58:01,566] Trial 305 finished with values: [-1000000000.0, 1000000000.0] and parameters: {'p_sma': 16, 'p_std': 50, 'p_atr': 21, 'p_adx': 25, 'rsi_period': 46, 'ema1': 28, 'ema2': 19, 'slip_atr_k': 0.026887168805990992, 'slip_spread_k': 0.5604383321075965, 'spread_hl_frac': 0.00025102006064805105, 'bb_std_mult': 3.339679691687934, 'rsi_os': 55, 'rsi_ob': 95, 'vol_spike': 0.27600190513229167, 'adx_thresh': 30.18450129205783, 'atr_min_pct': 0.01702781180384287, 'atr_max_pct': 0.06112404618359467, 'tp_mult': 2.492437287733538, 'tsl_mult': 0.9402711413004053, 'strategy': 'breakout', 'time_stop': 132, 'use_sma': False, 'use_atr': False, 'use_adx': False, 'use_ema': False, 'use_spike': True, 'rsi_required': True, 'edge_k': 1.1347223198434453, 'edge_cap': 0.6366901913158698, 'bull_strategy': 'mean_reversion', 'bull_bb_std_mult': 3.3463683440960086, 'bull_rsi_os': 27, 'bull_rsi_ob': 90, 'bull_adx_thresh': 13.112273762410881, 'bull_atr_min_pct': 0.004812151302621237, 'bull_atr_max_pct': 0.05656660457003476, 'bull_tp_mult': 1.016143218125353, 'bull_tsl_mult': 0.7013890332632657, 'bull_time_stop': 113, 'bull_use_sma': True, 'bull_use_ema': False, 'bull_use_atr': False, 'bull_use_adx': True, 'bull_use_spike': False, 'bull_rsi_required': True, 'bear_strategy': 'mean_reversion', 'bear_bb_std_mult': 1.093867814919266, 'bear_rsi_os': 13, 'bear_rsi_ob': 69, 'bear_adx_thresh': 29.253469130609137, 'bear_atr_min_pct': 0.013269316367011367, 'bear_atr_max_pct': 0.019097462926538866, 'bear_tp_mult': 1.3493038461837898, 'bear_tsl_mult': 0.009132287971243568, 'bear_time_stop': 49, 'bear_use_sma': False, 'bear_use_ema': True, 'bear_use_atr': True, 'bear_use_adx': False, 'bear_use_spike': False, 'bear_rsi_required': False, 'sideways_strategy': 'breakout', 'sideways_bb_std_mult': 3.3761420311729218, 'sideways_rsi_os': 38, 'sideways_rsi_ob': 91, 'sideways_adx_thresh': 28.486424256717655, 'sideways_atr_min_pct': 0.00245575004267576, 'sideways_atr_max_pct': 0.08394651339226435, 'sideways_tp_mult': 2.127659567503907, 'sideways_tsl_mult': 0.6131149772472766, 'sideways_time_stop': 12, 'sideways_use_sma': True, 'sideways_use_ema': True, 'sideways_use_atr': True, 'sideways_use_adx': False, 'sideways_use_spike': True, 'sideways_rsi_required': False}.
