[I 2025-08-30 14:58:32,632] Trial 309 finished with values: [-0.032055582990300535, 0.031939648508319075] and parameters: {'p_sma': 14, 'p_std': 50, 'p_atr': 19, 'p_adx': 23, 'rsi_period': 42, 'ema1': 28, 'ema2': 15, 'slip_atr_k': 0.22370169521070007, 'slip_spread_k': 0.6695425197680979, 'spread_hl_frac': 0.0007584286587073278, 'bb_std_mult': 3.4651166938778517, 'rsi_os': 43, 'rsi_ob': 93, 'vol_spike': 0.284409332524766, 'adx_thresh': 23.827820213100928, 'atr_min_pct': 0.015988060527486518, 'atr_max_pct': 0.053238940292484604, 'tp_mult': 2.412431529977976, 'tsl_mult': 0.8802198451066546, 'strategy': 'breakout', 'time_stop': 140, 'use_sma': False, 'use_atr': False, 'use_adx': False, 'use_ema': False, 'use_spike': True, 'rsi_required': True, 'edge_k': 1.3150707422216357, 'edge_cap': 0.3941066754606408, 'bull_strategy': 'mean_reversion', 'bull_bb_std_mult': 3.4146517701954617, 'bull_rsi_os': 24, 'bull_rsi_ob': 85, 'bull_adx_thresh': 12.22482672456365, 'bull_atr_min_pct': 0.00417143004483788, 'bull_atr_max_pct': 0.08470115767209684, 'bull_tp_mult': 1.4244468756486564, 'bull_tsl_mult': 0.678601813235839, 'bull_time_stop': 95, 'bull_use_sma': False, 'bull_use_ema': False, 'bull_use_atr': False, 'bull_use_adx': True, 'bull_use_spike': False, 'bull_rsi_required': True, 'bear_strategy': 'mean_reversion', 'bear_bb_std_mult': 1.150059854283369, 'bear_rsi_os': 11, 'bear_rsi_ob': 74, 'bear_adx_thresh': 34.555310339235305, 'bear_atr_min_pct': 0.0026293650067198276, 'bear_atr_max_pct': 0.012656486305195482, 'bear_tp_mult': 1.4026672019369142, 'bear_tsl_mult': 0.01733300340407301, 'bear_time_stop': 50, 'bear_use_sma': False, 'bear_use_ema': True, 'bear_use_atr': True, 'bear_use_adx': True, 'bear_use_spike': False, 'bear_rsi_required': False, 'sideways_strategy': 'breakout', 'sideways_bb_std_mult': 3.5057868821165625, 'sideways_rsi_os': 36, 'sideways_rsi_ob': 92, 'sideways_adx_thresh': 18.132804686426258, 'sideways_atr_min_pct': 0.0012807745286579349, 'sideways_atr_max_pct': 0.0910366215937739, 'sideways_tp_mult': 2.257068456102531, 'sideways_tsl_mult': 0.4083340527419721, 'sideways_time_stop': 28, 'sideways_use_sma': False, 'sideways_use_ema': False, 'sideways_use_atr': True, 'sideways_use_adx': False, 'sideways_use_spike': False, 'sideways_rsi_required': False}.
[I 2025-08-30 14:58:32,834] Trial 306 finished with values: [-1000000000.0, 1000000000.0] and parameters: {'p_sma': 16, 'p_std': 50, 'p_atr': 21, 'p_adx': 23, 'rsi_period': 46, 'ema1': 28, 'ema2': 19, 'slip_atr_k': 0.025782453570797864, 'slip_spread_k': 0.6411039647466892, 'spread_hl_frac': 5.6426548166847246e-05, 'bb_std_mult': 3.481705739624049, 'rsi_os': 32, 'rsi_ob': 95, 'vol_spike': 0.27608753264632213, 'adx_thresh': 30.550584484962304, 'atr_min_pct': 0.016909263296662022, 'atr_max_pct': 0.046380198335226615, 'tp_mult': 2.482245601598505, 'tsl_mult': 0.9465359804011767, 'strategy': 'breakout', 'time_stop': 132, 'use_sma': False, 'use_atr': False, 'use_adx': False, 'use_ema': False, 'use_spike': True, 'rsi_required': True, 'edge_k': 1.3029805254932625, 'edge_cap': 0.25181159455254126, 'bull_strategy': 'mean_reversion', 'bull_bb_std_mult': 3.3467261520641647, 'bull_rsi_os': 28, 'bull_rsi_ob': 85, 'bull_adx_thresh': 32.032384761431054, 'bull_atr_min_pct': 0.004867463660166024, 'bull_atr_max_pct': 0.02120193792061934, 'bull_tp_mult': 1.6831855716540423, 'bull_tsl_mult': 0.6949659331233763, 'bull_time_stop': 109, 'bull_use_sma': True, 'bull_use_ema': False, 'bull_use_atr': False, 'bull_use_adx': True, 'bull_use_spike': False, 'bull_rsi_required': True, 'bear_strategy': 'mean_reversion', 'bear_bb_std_mult': 1.094630421918351, 'bear_rsi_os': 11, 'bear_rsi_ob': 70, 'bear_adx_thresh': 31.827499831886033, 'bear_atr_min_pct': 0.0026781405302367754, 'bear_atr_max_pct': 0.018678077088597887, 'bear_tp_mult': 1.3660619533817409, 'bear_tsl_mult': 0.019513294990755742, 'bear_time_stop': 55, 'bear_use_sma': False, 'bear_use_ema': True, 'bear_use_atr': True, 'bear_use_adx': False, 'bear_use_spike': False, 'bear_rsi_required': False, 'sideways_strategy': 'breakout', 'sideways_bb_std_mult': 3.370671370059114, 'sideways_rsi_os': 38, 'sideways_rsi_ob': 91, 'sideways_adx_thresh': 9.050322386572068, 'sideways_atr_min_pct': 0.0024809388817683305, 'sideways_atr_max_pct': 0.08434650352220786, 'sideways_tp_mult': 2.199366835699886, 'sideways_tsl_mult': 0.42698532454416527, 'sideways_time_stop': 28, 'sideways_use_sma': True, 'sideways_use_ema': True, 'sideways_use_atr': True, 'sideways_use_adx': False, 'sideways_use_spike': True, 'sideways_rsi_required': False}.
[I 2025-08-30 14:58:33,008] Trial 308 finished with values: [-0.012542943491478442, 0.012481795336890087] and parameters: {'p_sma': 14, 'p_std': 50, 'p_atr': 28, 'p_adx': 24, 'rsi_period': 46, 'ema1': 28, 'ema2': 16, 'slip_atr_k': 0.1251880751115778, 'slip_spread_k': 0.6660706817300428, 'spread_hl_frac': 8.652650975316672e-07, 'bb_std_mult': 3.5070362755413567, 'rsi_os': 55, 'rsi_ob': 95, 'vol_spike': 0.28161484015854554, 'adx_thresh': 24.163190666100064, 'atr_min_pct': 0.01615675912050049, 'atr_max_pct': 0.05936845945102459, 'tp_mult': 2.4918681378776415, 'tsl_mult': 0.9528219906762403, 'strategy': 'breakout', 'time_stop': 142, 'use_sma': False, 'use_atr': False, 'use_adx': False, 'use_ema': False, 'use_spike': True, 'rsi_required': True, 'edge_k': 1.295064848399027, 'edge_cap': 0.7723505101150228, 'bull_strategy': 'mean_reversion', 'bull_bb_std_mult': 2.7425962377157718, 'bull_rsi_os': 24, 'bull_rsi_ob': 87, 'bull_adx_thresh': 9.352948590148076, 'bull_atr_min_pct': 0.004550155162331769, 'bull_atr_max_pct': 0.021098317961165805, 'bull_tp_mult': 2.5599823816485223, 'bull_tsl_mult': 0.6901100076195664, 'bull_time_stop': 109, 'bull_use_sma': False, 'bull_use_ema': False, 'bull_use_atr': False, 'bull_use_adx': True, 'bull_use_spike': False, 'bull_rsi_required': True, 'bear_strategy': 'mean_reversion', 'bear_bb_std_mult': 1.1434376420302375, 'bear_rsi_os': 10, 'bear_rsi_ob': 59, 'bear_adx_thresh': 34.69255086641954, 'bear_atr_min_pct': 0.01214075228802346, 'bear_atr_max_pct': 0.011418979124851604, 'bear_tp_mult': 1.3948714187343434, 'bear_tsl_mult': 0.015186321238022937, 'bear_time_stop': 49, 'bear_use_sma': False, 'bear_use_ema': True, 'bear_use_atr': True, 'bear_use_adx': True, 'bear_use_spike': False, 'bear_rsi_required': False, 'sideways_strategy': 'breakout', 'sideways_bb_std_mult': 3.500918834050825, 'sideways_rsi_os': 38, 'sideways_rsi_ob': 76, 'sideways_adx_thresh': 34.74596068914019, 'sideways_atr_min_pct': 0.0013352887900499907, 'sideways_atr_max_pct': 0.08372687063252851, 'sideways_tp_mult': 2.191303538970791, 'sideways_tsl_mult': 0.4000849629521866, 'sideways_time_stop': 28, 'sideways_use_sma': False, 'sideways_use_ema': True, 'sideways_use_atr': True, 'sideways_use_adx': False, 'sideways_use_spike': False, 'sideways_rsi_required': False}.
[I 2025-08-30 14:58:33,185] Trial 307 finished with values: [-0.011259583107923188, 0.01124465664662096] and parameters: {'p_sma': 16, 'p_std': 50, 'p_atr': 14, 'p_adx': 23, 'rsi_period': 46, 'ema1': 28, 'ema2': 15, 'slip_atr_k': 0.028185399023209656, 'slip_spread_k': 0.571219016263509, 'spread_hl_frac': 0.000285418113409418, 'bb_std_mult': 3.4969954244378068, 'rsi_os': 32, 'rsi_ob': 95, 'vol_spike': 0.2835433420093235, 'adx_thresh': 30.764713459365314, 'atr_min_pct': 0.016898877894894367, 'atr_max_pct': 0.060145436900187185, 'tp_mult': 2.475688319538151, 'tsl_mult': 0.1434097961076527, 'strategy': 'breakout', 'time_stop': 131, 'use_sma': False, 'use_atr': False, 'use_adx': False, 'use_ema': False, 'use_spike': True, 'rsi_required': True, 'edge_k': 1.2892908779991785, 'edge_cap': 0.6769106026387745, 'bull_strategy': 'mean_reversion', 'bull_bb_std_mult': 2.50123083025968, 'bull_rsi_os': 27, 'bull_rsi_ob': 85, 'bull_adx_thresh': 22.219375929441505, 'bull_atr_min_pct': 0.004842388664429086, 'bull_atr_max_pct': 0.0878756677027309, 'bull_tp_mult': 1.6868146353277675, 'bull_tsl_mult': 0.6934827558362625, 'bull_time_stop': 89, 'bull_use_sma': False, 'bull_use_ema': False, 'bull_use_atr': False, 'bull_use_adx': True, 'bull_use_spike': False, 'bull_rsi_required': True, 'bear_strategy': 'mean_reversion', 'bear_bb_std_mult': 1.0977370283265253, 'bear_rsi_os': 11, 'bear_rsi_ob': 70, 'bear_adx_thresh': 31.271333733949568, 'bear_atr_min_pct': 0.013403534296610132, 'bear_atr_max_pct': 0.018400760991078034, 'bear_tp_mult': 1.3433325424746778, 'bear_tsl_mult': 0.01466638655184583, 'bear_time_stop': 101, 'bear_use_sma': False, 'bear_use_ema': True, 'bear_use_atr': True, 'bear_use_adx': False, 'bear_use_spike': False, 'bear_rsi_required': False, 'sideways_strategy': 'breakout', 'sideways_bb_std_mult': 3.4914486164882184, 'sideways_rsi_os': 38, 'sideways_rsi_ob': 64, 'sideways_adx_thresh': 28.32069862403683, 'sideways_atr_min_pct': 0.002483084326241003, 'sideways_atr_max_pct': 0.08439974721858193, 'sideways_tp_mult': 2.2074455045943155, 'sideways_tsl_mult': 0.4344760350520354, 'sideways_time_stop': 14, 'sideways_use_sma': False, 'sideways_use_ema': True, 'sideways_use_atr': True, 'sideways_use_adx': False, 'sideways_use_spike': True, 'sideways_rsi_required': False}.
[I 2025-08-30 14:59:03,417] Trial 312 finished with values: [-0.028277792623396802, 0.02819389060216947] and parameters: {'p_sma': 12, 'p_std': 52, 'p_atr': 14, 'p_adx': 23, 'rsi_period': 24, 'ema1': 29, 'ema2': 31, 'slip_atr_k': 0.20492994519356, 'slip_spread_k': 0.3638042822307599, 'spread_hl_frac': 0.04001313423943412, 'bb_std_mult': 3.1777840373847126, 'rsi_os': 35, 'rsi_ob': 93, 'vol_spike': 0.2816422049487939, 'adx_thresh': 25.67479407288437, 'atr_min_pct': 0.018070510377711062, 'atr_max_pct': 0.04920437190584284, 'tp_mult': 2.4401071571989292, 'tsl_mult': 0.5733884469181942, 'strategy': 'breakout', 'time_stop': 144, 'use_sma': False, 'use_atr': False, 'use_adx': True, 'use_ema': False, 'use_spike': True, 'rsi_required': True, 'edge_k': 1.2646178114253013, 'edge_cap': 0.6821979685414216, 'bull_strategy': 'mean_reversion', 'bull_bb_std_mult': 2.7572041238970026, 'bull_rsi_os': 25, 'bull_rsi_ob': 87, 'bull_adx_thresh': 9.48800329831169, 'bull_atr_min_pct': 0.004349024074150816, 'bull_atr_max_pct': 0.024041840891013872, 'bull_tp_mult': 1.5666846112634552, 'bull_tsl_mult': 0.6544624046558841, 'bull_time_stop': 78, 'bull_use_sma': False, 'bull_use_ema': False, 'bull_use_atr': False, 'bull_use_adx': True, 'bull_use_spike': False, 'bull_rsi_required': True, 'bear_strategy': 'mean_reversion', 'bear_bb_std_mult': 1.0969666699666243, 'bear_rsi_os': 32, 'bear_rsi_ob': 78, 'bear_adx_thresh': 30.09305483734052, 'bear_atr_min_pct': 0.012018893435924839, 'bear_atr_max_pct': 0.016104026771770162, 'bear_tp_mult': 1.0386882621796805, 'bear_tsl_mult': 0.06928911460275457, 'bear_time_stop': 47, 'bear_use_sma': False, 'bear_use_ema': True, 'bear_use_atr': True, 'bear_use_adx': True, 'bear_use_spike': False, 'bear_rsi_required': False, 'sideways_strategy': 'breakout', 'sideways_bb_std_mult': 3.5150479017510685, 'sideways_rsi_os': 36, 'sideways_rsi_ob': 78, 'sideways_adx_thresh': 29.537176814913213, 'sideways_atr_min_pct': 0.0017386242178045568, 'sideways_atr_max_pct': 0.08740344474097317, 'sideways_tp_mult': 2.2081257545107107, 'sideways_tsl_mult': 0.34682266450780486, 'sideways_time_stop': 16, 'sideways_use_sma': False, 'sideways_use_ema': False, 'sideways_use_atr': True, 'sideways_use_adx': False, 'sideways_use_spike': False, 'sideways_rsi_required': False}.
[I 2025-08-30 14:59:04,231] Trial 311 finished with values: [-0.07262122866871745, 0.07259161668005944] and parameters: {'p_sma': 12, 'p_std': 51, 'p_atr': 24, 'p_adx': 24, 'rsi_period': 24, 'ema1': 20, 'ema2': 31, 'slip_atr_k': 0.15007981028592152, 'slip_spread_k': 0.35025417260386515, 'spread_hl_frac': 0.013540332972887151, 'bb_std_mult': 3.1642605821455434, 'rsi_os': 35, 'rsi_ob': 93, 'vol_spike': 0.2848981973159572, 'adx_thresh': 26.46936309672416, 'atr_min_pct': 0.018069150406339368, 'atr_max_pct': 0.04961325372403753, 'tp_mult': 2.4329545297006763, 'tsl_mult': 0.14990551286328269, 'strategy': 'breakout', 'time_stop': 145, 'use_sma': False, 'use_atr': False, 'use_adx': True, 'use_ema': False, 'use_spike': True, 'rsi_required': True, 'edge_k': 1.28169107199617, 'edge_cap': 0.35728137323065645, 'bull_strategy': 'mean_reversion', 'bull_bb_std_mult': 1.1616450075655453, 'bull_rsi_os': 25, 'bull_rsi_ob': 87, 'bull_adx_thresh': 11.937947114691985, 'bull_atr_min_pct': 0.0045223254048219995, 'bull_atr_max_pct': 0.023155281445757618, 'bull_tp_mult': 1.494706304447158, 'bull_tsl_mult': 0.7203217827771358, 'bull_time_stop': 76, 'bull_use_sma': False, 'bull_use_ema': False, 'bull_use_atr': False, 'bull_use_adx': True, 'bull_use_spike': False, 'bull_rsi_required': True, 'bear_strategy': 'mean_reversion', 'bear_bb_std_mult': 1.1111140440018328, 'bear_rsi_os': 10, 'bear_rsi_ob': 77, 'bear_adx_thresh': 31.251718328683594, 'bear_atr_min_pct': 0.004442802803973163, 'bear_atr_max_pct': 0.011327536368607758, 'bear_tp_mult': 1.0404770424366552, 'bear_tsl_mult': 0.06856237667297123, 'bear_time_stop': 49, 'bear_use_sma': False, 'bear_use_ema': True, 'bear_use_atr': True, 'bear_use_adx': True, 'bear_use_spike': False, 'bear_rsi_required': False, 'sideways_strategy': 'breakout', 'sideways_bb_std_mult': 3.436331160732532, 'sideways_rsi_os': 38, 'sideways_rsi_ob': 78, 'sideways_adx_thresh': 27.884142557523177, 'sideways_atr_min_pct': 1.0786599087358323e-05, 'sideways_atr_max_pct': 0.11537255790456577, 'sideways_tp_mult': 2.3747503206134324, 'sideways_tsl_mult': 0.47009106190671357, 'sideways_time_stop': 20, 'sideways_use_sma': False, 'sideways_use_ema': False, 'sideways_use_atr': True, 'sideways_use_adx': False, 'sideways_use_spike': True, 'sideways_rsi_required': False}.
[I 2025-08-30 14:59:04,316] Trial 313 finished with values: [-1000000000.0, 1000000000.0] and parameters: {'p_sma': 7, 'p_std': 48, 'p_atr': 15, 'p_adx': 23, 'rsi_period': 32, 'ema1': 30, 'ema2': 15, 'slip_atr_k': 0.038444171670080296, 'slip_spread_k': 0.5670752270897385, 'spread_hl_frac': 5.9915316310586784e-06, 'bb_std_mult': 3.5984629934899197, 'rsi_os': 30, 'rsi_ob': 95, 'vol_spike': 0.2869647403902549, 'adx_thresh': 31.274095474069796, 'atr_min_pct': 0.015889030100250508, 'atr_max_pct': 0.063688418941074, 'tp_mult': 2.3928929705766424, 'tsl_mult': 0.1402056108578315, 'strategy': 'breakout', 'time_stop': 115, 'use_sma': False, 'use_atr': False, 'use_adx': True, 'use_ema': False, 'use_spike': True, 'rsi_required': True, 'edge_k': 1.1100286259362124, 'edge_cap': 0.6716109939422076, 'bull_strategy': 'mean_reversion', 'bull_bb_std_mult': 2.485217374055789, 'bull_rsi_os': 29, 'bull_rsi_ob': 85, 'bull_adx_thresh': 20.187331379830542, 'bull_atr_min_pct': 0.005659437506675602, 'bull_atr_max_pct': 0.08806160470193379, 'bull_tp_mult': 1.8581656427044355, 'bull_tsl_mult': 0.6559287440541521, 'bull_time_stop': 85, 'bull_use_sma': False, 'bull_use_ema': False, 'bull_use_atr': False, 'bull_use_adx': True, 'bull_use_spike': False, 'bull_rsi_required': True, 'bear_strategy': 'mean_reversion', 'bear_bb_std_mult': 1.127095524103007, 'bear_rsi_os': 9, 'bear_rsi_ob': 65, 'bear_adx_thresh': 30.678208816485814, 'bear_atr_min_pct': 0.014172690121745886, 'bear_atr_max_pct': 0.016017863395139817, 'bear_tp_mult': 1.4935065049130944, 'bear_tsl_mult': 0.007801338110470413, 'bear_time_stop': 93, 'bear_use_sma': False, 'bear_use_ema': True, 'bear_use_atr': True, 'bear_use_adx': True, 'bear_use_spike': False, 'bear_rsi_required': False, 'sideways_strategy': 'breakout', 'sideways_bb_std_mult': 3.5568322499299176, 'sideways_rsi_os': 38, 'sideways_rsi_ob': 55, 'sideways_adx_thresh': 27.76864479432564, 'sideways_atr_min_pct': 0.0027495842097399184, 'sideways_atr_max_pct': 0.11631334097106212, 'sideways_tp_mult': 2.1995842100243, 'sideways_tsl_mult': 0.4400775724107784, 'sideways_time_stop': 15, 'sideways_use_sma': False, 'sideways_use_ema': True, 'sideways_use_atr': True, 'sideways_use_adx': False, 'sideways_use_spike': False, 'sideways_rsi_required': False}.
[I 2025-08-30 14:59:04,730] Trial 310 finished with values: [-0.018263105534120916, 0.018191953337229977] and parameters: {'p_sma': 12, 'p_std': 51, 'p_atr': 12, 'p_adx': 23, 'rsi_period': 34, 'ema1': 28, 'ema2': 31, 'slip_atr_k': 0.10945609971457995, 'slip_spread_k': 0.35161669090831393, 'spread_hl_frac': 2.10562082353866e-05, 'bb_std_mult': 3.2297260119003512, 'rsi_os': 32, 'rsi_ob': 95, 'vol_spike': 0.2845834758758864, 'adx_thresh': 26.254736769778393, 'atr_min_pct': 0.01832292853096104, 'atr_max_pct': 0.047159473857367386, 'tp_mult': 2.4394478232197856, 'tsl_mult': 0.47959103492713595, 'strategy': 'breakout', 'time_stop': 144, 'use_sma': False, 'use_atr': False, 'use_adx': False, 'use_ema': False, 'use_spike': True, 'rsi_required': True, 'edge_k': 1.265225766775121, 'edge_cap': 0.6731760086134386, 'bull_strategy': 'mean_reversion', 'bull_bb_std_mult': 1.1826942666923532, 'bull_rsi_os': 22, 'bull_rsi_ob': 87, 'bull_adx_thresh': 22.398527561029983, 'bull_atr_min_pct': 0.004469516871313643, 'bull_atr_max_pct': 0.024040392437719875, 'bull_tp_mult': 1.6847493051610838, 'bull_tsl_mult': 0.6970840448753556, 'bull_time_stop': 76, 'bull_use_sma': False, 'bull_use_ema': False, 'bull_use_atr': False, 'bull_use_adx': True, 'bull_use_spike': False, 'bull_rsi_required': True, 'bear_strategy': 'mean_reversion', 'bear_bb_std_mult': 1.012651201199119, 'bear_rsi_os': 8, 'bear_rsi_ob': 78, 'bear_adx_thresh': 31.07258774104386, 'bear_atr_min_pct': 0.012143498539960936, 'bear_atr_max_pct': 0.010365821343569377, 'bear_tp_mult': 1.0304519643135899, 'bear_tsl_mult': 0.06205358141755691, 'bear_time_stop': 49, 'bear_use_sma': False, 'bear_use_ema': True, 'bear_use_atr': True, 'bear_use_adx': False, 'bear_use_spike': False, 'bear_rsi_required': False, 'sideways_strategy': 'breakout', 'sideways_bb_std_mult': 3.409041120981991, 'sideways_rsi_os': 38, 'sideways_rsi_ob': 78, 'sideways_adx_thresh': 34.35774933200011, 'sideways_atr_min_pct': 0.001647269762676156, 'sideways_atr_max_pct': 0.08417710212226454, 'sideways_tp_mult': 2.2115550946798295, 'sideways_tsl_mult': 0.36758347893165744, 'sideways_time_stop': 20, 'sideways_use_sma': False, 'sideways_use_ema': True, 'sideways_use_atr': True, 'sideways_use_adx': False, 'sideways_use_spike': True, 'sideways_rsi_required': False}.
[I 2025-08-30 14:59:37,798] Trial 316 finished with values: [-1000000000.0, 1000000000.0] and parameters: {'p_sma': 20, 'p_std': 49, 'p_atr': 15, 'p_adx': 24, 'rsi_period': 70, 'ema1': 28, 'ema2': 13, 'slip_atr_k': 0.04184480587863211, 'slip_spread_k': 0.5906774420889335, 'spread_hl_frac': 2.829095487108318e-05, 'bb_std_mult': 3.5524431650699837, 'rsi_os': 31, 'rsi_ob': 95, 'vol_spike': 0.2952134942069702, 'adx_thresh': 33.310020214830445, 'atr_min_pct': 0.016202789503796174, 'atr_max_pct': 0.06165334003742173, 'tp_mult': 2.4950896620150567, 'tsl_mult': 0.18873968385046086, 'strategy': 'breakout', 'time_stop': 105, 'use_sma': False, 'use_atr': False, 'use_adx': False, 'use_ema': False, 'use_spike': True, 'rsi_required': True, 'edge_k': 1.474941668888473, 'edge_cap': 0.6726974515252037, 'bull_strategy': 'mean_reversion', 'bull_bb_std_mult': 2.6278493311748585, 'bull_rsi_os': 27, 'bull_rsi_ob': 83, 'bull_adx_thresh': 22.24161387994036, 'bull_atr_min_pct': 0.005356829138979219, 'bull_atr_max_pct': 0.08709449134535274, 'bull_tp_mult': 1.8000108293772674, 'bull_tsl_mult': 0.6871240501733739, 'bull_time_stop': 88, 'bull_use_sma': False, 'bull_use_ema': True, 'bull_use_atr': False, 'bull_use_adx': True, 'bull_use_spike': True, 'bull_rsi_required': True, 'bear_strategy': 'mean_reversion', 'bear_bb_std_mult': 1.1208946786138094, 'bear_rsi_os': 9, 'bear_rsi_ob': 60, 'bear_adx_thresh': 28.326736353255868, 'bear_atr_min_pct': 0.014656590578237363, 'bear_atr_max_pct': 0.02043426861365797, 'bear_tp_mult': 1.4126172429754231, 'bear_tsl_mult': 0.0018685022627966032, 'bear_time_stop': 104, 'bear_use_sma': True, 'bear_use_ema': True, 'bear_use_atr': True, 'bear_use_adx': False, 'bear_use_spike': False, 'bear_rsi_required': True, 'sideways_strategy': 'mean_reversion', 'sideways_bb_std_mult': 3.5644897563280216, 'sideways_rsi_os': 39, 'sideways_rsi_ob': 67, 'sideways_adx_thresh': 28.67836700427249, 'sideways_atr_min_pct': 0.002636068982170458, 'sideways_atr_max_pct': 0.08420352757725806, 'sideways_tp_mult': 2.1715775820661207, 'sideways_tsl_mult': 0.45943628161116395, 'sideways_time_stop': 11, 'sideways_use_sma': False, 'sideways_use_ema': True, 'sideways_use_atr': True, 'sideways_use_adx': False, 'sideways_use_spike': True, 'sideways_rsi_required': False}.
