[I 2025-08-30 14:29:37,700] Trial 71 finished with values: [-1000000000.0, 1000000000.0] and parameters: {'p_sma': 42, 'p_std': 47, 'p_atr': 15, 'p_adx': 25, 'rsi_period': 57, 'ema1': 29, 'ema2': 48, 'slip_atr_k': 0.031804461637657516, 'slip_spread_k': 0.18781240225667112, 'spread_hl_frac': 0.002635345557201382, 'bb_std_mult': 2.3891717847748737, 'rsi_os': 40, 'rsi_ob': 92, 'vol_spike': 0.22855957779899516, 'adx_thresh': 16.57898001447884, 'atr_min_pct': 0.017761729785322512, 'atr_max_pct': 0.09642547721301829, 'tp_mult': 2.6962721048606615, 'tsl_mult': 0.8849635249825366, 'strategy': 'mean_reversion', 'time_stop': 45, 'use_sma': True, 'use_atr': True, 'use_adx': False, 'use_ema': True, 'use_spike': False, 'rsi_required': False, 'edge_k': 1.8048053597310822, 'edge_cap': 0.8487437661309198, 'bull_strategy': 'breakout', 'bull_bb_std_mult': 3.525959163746303, 'bull_rsi_os': 15, 'bull_rsi_ob': 81, 'bull_adx_thresh': 11.611769938768443, 'bull_atr_min_pct': 0.004805364584540818, 'bull_atr_max_pct': 0.016366206241184213, 'bull_tp_mult': 1.1177518094882042, 'bull_tsl_mult': 0.5535139002768648, 'bull_time_stop': 265, 'bull_use_sma': True, 'bull_use_ema': False, 'bull_use_atr': True, 'bull_use_adx': False, 'bull_use_spike': True, 'bull_rsi_required': False, 'bear_strategy': 'mean_reversion', 'bear_bb_std_mult': 0.8513311637350112, 'bear_rsi_os': 12, 'bear_rsi_ob': 50, 'bear_adx_thresh': 21.21199977564627, 'bear_atr_min_pct': 0.007999043824224202, 'bear_atr_max_pct': 0.011367956504379773, 'bear_tp_mult': 2.1343619021808133, 'bear_tsl_mult': 0.13534187607361356, 'bear_time_stop': 239, 'bear_use_sma': False, 'bear_use_ema': True, 'bear_use_atr': False, 'bear_use_adx': False, 'bear_use_spike': False, 'bear_rsi_required': True, 'sideways_strategy': 'breakout', 'sideways_bb_std_mult': 0.9594641634730201, 'sideways_rsi_os': 27, 'sideways_rsi_ob': 86, 'sideways_adx_thresh': 20.415402258922118, 'sideways_atr_min_pct': 0.02624302236366649, 'sideways_atr_max_pct': 0.06733475305117471, 'sideways_tp_mult': 1.0442688090677235, 'sideways_tsl_mult': 0.9218480675730533, 'sideways_time_stop': 31, 'sideways_use_sma': True, 'sideways_use_ema': True, 'sideways_use_atr': False, 'sideways_use_adx': True, 'sideways_use_spike': True, 'sideways_rsi_required': True}.
[I 2025-08-30 14:30:08,594] Trial 75 finished with values: [-1000000000.0, 1000000000.0] and parameters: {'p_sma': 5, 'p_std': 58, 'p_atr': 13, 'p_adx': 25, 'rsi_period': 59, 'ema1': 25, 'ema2': 53, 'slip_atr_k': 0.017081844757290066, 'slip_spread_k': 0.24189652468742487, 'spread_hl_frac': 0.0034830811055773054, 'bb_std_mult': 2.1458057878189027, 'rsi_os': 34, 'rsi_ob': 92, 'vol_spike': 0.22081177890596965, 'adx_thresh': 20.91849131830272, 'atr_min_pct': 0.01863647811887047, 'atr_max_pct': 0.10497775860550473, 'tp_mult': 2.486238323610995, 'tsl_mult': 0.893162003875929, 'strategy': 'mean_reversion', 'time_stop': 272, 'use_sma': True, 'use_atr': False, 'use_adx': False, 'use_ema': False, 'use_spike': False, 'rsi_required': False, 'edge_k': 1.627016574116071, 'edge_cap': 0.5578197985010181, 'bull_strategy': 'breakout', 'bull_bb_std_mult': 3.28865505223965, 'bull_rsi_os': 15, 'bull_rsi_ob': 76, 'bull_adx_thresh': 13.21167327951553, 'bull_atr_min_pct': 0.0047622877852884354, 'bull_atr_max_pct': 0.021194535462908955, 'bull_tp_mult': 2.7562917275618988, 'bull_tsl_mult': 0.5798631039457098, 'bull_time_stop': 273, 'bull_use_sma': False, 'bull_use_ema': False, 'bull_use_atr': True, 'bull_use_adx': True, 'bull_use_spike': True, 'bull_rsi_required': True, 'bear_strategy': 'breakout', 'bear_bb_std_mult': 1.120508675168641, 'bear_rsi_os': 12, 'bear_rsi_ob': 51, 'bear_adx_thresh': 18.170760160436092, 'bear_atr_min_pct': 0.0012616683738815165, 'bear_atr_max_pct': 0.026498025843734514, 'bear_tp_mult': 2.00214272270753, 'bear_tsl_mult': 0.11945953829290923, 'bear_time_stop': 255, 'bear_use_sma': False, 'bear_use_ema': False, 'bear_use_atr': False, 'bear_use_adx': False, 'bear_use_spike': True, 'bear_rsi_required': True, 'sideways_strategy': 'breakout', 'sideways_bb_std_mult': 0.5061794508495373, 'sideways_rsi_os': 27, 'sideways_rsi_ob': 82, 'sideways_adx_thresh': 16.069952729734133, 'sideways_atr_min_pct': 0.002167035123576796, 'sideways_atr_max_pct': 0.06395435155983774, 'sideways_tp_mult': 2.262637759305685, 'sideways_tsl_mult': 0.24860830341891488, 'sideways_time_stop': 223, 'sideways_use_sma': True, 'sideways_use_ema': False, 'sideways_use_atr': False, 'sideways_use_adx': True, 'sideways_use_spike': True, 'sideways_rsi_required': True}.
[I 2025-08-30 14:30:08,688] Trial 76 finished with values: [-0.01250187082483556, 0.012824815681674704] and parameters: {'p_sma': 32, 'p_std': 29, 'p_atr': 13, 'p_adx': 22, 'rsi_period': 48, 'ema1': 27, 'ema2': 51, 'slip_atr_k': 0.015616057236499045, 'slip_spread_k': 0.24401396112473253, 'spread_hl_frac': 0.003214496916235445, 'bb_std_mult': 2.0323341492119136, 'rsi_os': 34, 'rsi_ob': 91, 'vol_spike': 0.24703452361119457, 'adx_thresh': 20.952983298187693, 'atr_min_pct': 0.02010771709083622, 'atr_max_pct': 0.10554709069557075, 'tp_mult': 2.5900342777898455, 'tsl_mult': 0.9993641134282919, 'strategy': 'mean_reversion', 'time_stop': 29, 'use_sma': True, 'use_atr': False, 'use_adx': False, 'use_ema': False, 'use_spike': False, 'rsi_required': False, 'edge_k': 1.633335285020649, 'edge_cap': 0.6948874710164368, 'bull_strategy': 'breakout', 'bull_bb_std_mult': 3.316187677743357, 'bull_rsi_os': 16, 'bull_rsi_ob': 77, 'bull_adx_thresh': 12.867818061464412, 'bull_atr_min_pct': 0.0032417094583514863, 'bull_atr_max_pct': 0.021313231393410986, 'bull_tp_mult': 1.4347717951477659, 'bull_tsl_mult': 0.523806364026802, 'bull_time_stop': 268, 'bull_use_sma': False, 'bull_use_ema': False, 'bull_use_atr': True, 'bull_use_adx': True, 'bull_use_spike': False, 'bull_rsi_required': True, 'bear_strategy': 'breakout', 'bear_bb_std_mult': 1.1741720399352529, 'bear_rsi_os': 15, 'bear_rsi_ob': 49, 'bear_adx_thresh': 17.883612653003695, 'bear_atr_min_pct': 0.0115388222955892, 'bear_atr_max_pct': 0.026349052093523555, 'bear_tp_mult': 2.0140252046765776, 'bear_tsl_mult': 0.20371790081988012, 'bear_time_stop': 41, 'bear_use_sma': False, 'bear_use_ema': False, 'bear_use_atr': False, 'bear_use_adx': False, 'bear_use_spike': True, 'bear_rsi_required': False, 'sideways_strategy': 'breakout', 'sideways_bb_std_mult': 3.1031275730752643, 'sideways_rsi_os': 32, 'sideways_rsi_ob': 89, 'sideways_adx_thresh': 16.263793366478126, 'sideways_atr_min_pct': 0.0038564648798148256, 'sideways_atr_max_pct': 0.07829803494796485, 'sideways_tp_mult': 2.7366028525345243, 'sideways_tsl_mult': 0.1113297531171187, 'sideways_time_stop': 227, 'sideways_use_sma': False, 'sideways_use_ema': False, 'sideways_use_atr': False, 'sideways_use_adx': True, 'sideways_use_spike': True, 'sideways_rsi_required': True}.
[I 2025-08-30 14:30:08,697] Trial 74 finished with values: [-1000000000.0, 1000000000.0] and parameters: {'p_sma': 36, 'p_std': 55, 'p_atr': 15, 'p_adx': 25, 'rsi_period': 58, 'ema1': 29, 'ema2': 47, 'slip_atr_k': 0.016305407860004874, 'slip_spread_k': 0.24114523699684592, 'spread_hl_frac': 0.002637688755039936, 'bb_std_mult': 2.390552775575812, 'rsi_os': 34, 'rsi_ob': 93, 'vol_spike': 0.22655083023785852, 'adx_thresh': 14.594798704583495, 'atr_min_pct': 0.018079332280717942, 'atr_max_pct': 0.09583996613229762, 'tp_mult': 2.733270431430191, 'tsl_mult': 0.8926882334024349, 'strategy': 'mean_reversion', 'time_stop': 131, 'use_sma': True, 'use_atr': False, 'use_adx': False, 'use_ema': False, 'use_spike': False, 'rsi_required': False, 'edge_k': 1.7574775960313924, 'edge_cap': 0.551097263600537, 'bull_strategy': 'breakout', 'bull_bb_std_mult': 3.593126090767952, 'bull_rsi_os': 15, 'bull_rsi_ob': 81, 'bull_adx_thresh': 13.65250907363969, 'bull_atr_min_pct': 0.027279417532284793, 'bull_atr_max_pct': 0.019593935006817366, 'bull_tp_mult': 1.429516507897255, 'bull_tsl_mult': 0.5795365918663679, 'bull_time_stop': 263, 'bull_use_sma': False, 'bull_use_ema': False, 'bull_use_atr': True, 'bull_use_adx': True, 'bull_use_spike': True, 'bull_rsi_required': False, 'bear_strategy': 'mean_reversion', 'bear_bb_std_mult': 0.8196414657642619, 'bear_rsi_os': 16, 'bear_rsi_ob': 50, 'bear_adx_thresh': 21.484535321117413, 'bear_atr_min_pct': 0.007795608466397973, 'bear_atr_max_pct': 0.02730877701370324, 'bear_tp_mult': 2.106228629247968, 'bear_tsl_mult': 0.1266196740546751, 'bear_time_stop': 237, 'bear_use_sma': False, 'bear_use_ema': True, 'bear_use_atr': False, 'bear_use_adx': False, 'bear_use_spike': False, 'bear_rsi_required': True, 'sideways_strategy': 'breakout', 'sideways_bb_std_mult': 3.201608539941347, 'sideways_rsi_os': 35, 'sideways_rsi_ob': 81, 'sideways_adx_thresh': 20.962985219557908, 'sideways_atr_min_pct': 0.026357376905486028, 'sideways_atr_max_pct': 0.06704858455528045, 'sideways_tp_mult': 1.228246595071321, 'sideways_tsl_mult': 0.12503718365262217, 'sideways_time_stop': 228, 'sideways_use_sma': True, 'sideways_use_ema': False, 'sideways_use_atr': False, 'sideways_use_adx': True, 'sideways_use_spike': True, 'sideways_rsi_required': True}.
[I 2025-08-30 14:30:08,962] Trial 73 finished with values: [-1000000000.0, 1000000000.0] and parameters: {'p_sma': 36, 'p_std': 55, 'p_atr': 13, 'p_adx': 25, 'rsi_period': 59, 'ema1': 25, 'ema2': 48, 'slip_atr_k': 0.041214497829875255, 'slip_spread_k': 0.23361001281371793, 'spread_hl_frac': 0.0022669965479909676, 'bb_std_mult': 2.4020133696742896, 'rsi_os': 40, 'rsi_ob': 92, 'vol_spike': 0.22899236326755895, 'adx_thresh': 14.369607548078768, 'atr_min_pct': 0.01801320961424951, 'atr_max_pct': 0.10348151239887765, 'tp_mult': 2.7341781782385723, 'tsl_mult': 0.8864493667014186, 'strategy': 'mean_reversion', 'time_stop': 272, 'use_sma': True, 'use_atr': True, 'use_adx': False, 'use_ema': True, 'use_spike': False, 'rsi_required': False, 'edge_k': 1.778411329911164, 'edge_cap': 0.6967308437009153, 'bull_strategy': 'breakout', 'bull_bb_std_mult': 3.555843294908703, 'bull_rsi_os': 15, 'bull_rsi_ob': 81, 'bull_adx_thresh': 13.535216302355078, 'bull_atr_min_pct': 0.004657880500376736, 'bull_atr_max_pct': 0.020170962432983858, 'bull_tp_mult': 2.992723964187752, 'bull_tsl_mult': 0.5747974206702967, 'bull_time_stop': 93, 'bull_use_sma': False, 'bull_use_ema': False, 'bull_use_atr': True, 'bull_use_adx': True, 'bull_use_spike': True, 'bull_rsi_required': False, 'bear_strategy': 'mean_reversion', 'bear_bb_std_mult': 1.116405698290114, 'bear_rsi_os': 12, 'bear_rsi_ob': 59, 'bear_adx_thresh': 18.293521192454858, 'bear_atr_min_pct': 0.016178606540558707, 'bear_atr_max_pct': 0.012739438822943715, 'bear_tp_mult': 2.1002954118382995, 'bear_tsl_mult': 0.12816898906950275, 'bear_time_stop': 49, 'bear_use_sma': False, 'bear_use_ema': True, 'bear_use_atr': False, 'bear_use_adx': False, 'bear_use_spike': False, 'bear_rsi_required': True, 'sideways_strategy': 'breakout', 'sideways_bb_std_mult': 3.157445426618711, 'sideways_rsi_os': 31, 'sideways_rsi_ob': 81, 'sideways_adx_thresh': 23.005189259944252, 'sideways_atr_min_pct': 0.026934736396430237, 'sideways_atr_max_pct': 0.06870962420445921, 'sideways_tp_mult': 2.2776623692832763, 'sideways_tsl_mult': 0.12572137342727568, 'sideways_time_stop': 228, 'sideways_use_sma': True, 'sideways_use_ema': True, 'sideways_use_atr': False, 'sideways_use_adx': True, 'sideways_use_spike': True, 'sideways_rsi_required': True}.
[I 2025-08-30 14:30:09,274] Trial 79 finished with values: [-1000000000.0, 1000000000.0] and parameters: {'p_sma': 30, 'p_std': 31, 'p_atr': 13, 'p_adx': 22, 'rsi_period': 49, 'ema1': 25, 'ema2': 51, 'slip_atr_k': 0.04842997456702833, 'slip_spread_k': 0.3547430360857037, 'spread_hl_frac': 0.0018405608622258749, 'bb_std_mult': 2.035133155603591, 'rsi_os': 31, 'rsi_ob': 45, 'vol_spike': 0.25301691361963613, 'adx_thresh': 23.252319638144293, 'atr_min_pct': 0.019887271240138955, 'atr_max_pct': 0.12314928466449462, 'tp_mult': 2.3664597220310224, 'tsl_mult': 0.9851503312197348, 'strategy': 'mean_reversion', 'time_stop': 88, 'use_sma': False, 'use_atr': False, 'use_adx': False, 'use_ema': False, 'use_spike': False, 'rsi_required': False, 'edge_k': 1.6621659616445725, 'edge_cap': 0.7081440630927845, 'bull_strategy': 'breakout', 'bull_bb_std_mult': 3.116840952573274, 'bull_rsi_os': 29, 'bull_rsi_ob': 75, 'bull_adx_thresh': 14.867423071678939, 'bull_atr_min_pct': 0.02322698462030904, 'bull_atr_max_pct': 0.03487614241161228, 'bull_tp_mult': 2.631198321856705, 'bull_tsl_mult': 0.5222058367027266, 'bull_time_stop': 247, 'bull_use_sma': False, 'bull_use_ema': False, 'bull_use_atr': False, 'bull_use_adx': True, 'bull_use_spike': False, 'bull_rsi_required': True, 'bear_strategy': 'breakout', 'bear_bb_std_mult': 1.4386468212071724, 'bear_rsi_os': 8, 'bear_rsi_ob': 48, 'bear_adx_thresh': 16.16645485550715, 'bear_atr_min_pct': 0.011856079428190187, 'bear_atr_max_pct': 0.13995730124347774, 'bear_tp_mult': 1.9096886715163854, 'bear_tsl_mult': 0.205981459911048, 'bear_time_stop': 83, 'bear_use_sma': False, 'bear_use_ema': False, 'bear_use_atr': False, 'bear_use_adx': True, 'bear_use_spike': True, 'bear_rsi_required': False, 'sideways_strategy': 'breakout', 'sideways_bb_std_mult': 3.22836170057534, 'sideways_rsi_os': 32, 'sideways_rsi_ob': 90, 'sideways_adx_thresh': 12.756321487559337, 'sideways_atr_min_pct': 0.0034368019938048455, 'sideways_atr_max_pct': 0.07846432708514137, 'sideways_tp_mult': 2.756362101196453, 'sideways_tsl_mult': 0.07115706871781736, 'sideways_time_stop': 72, 'sideways_use_sma': False, 'sideways_use_ema': False, 'sideways_use_atr': False, 'sideways_use_adx': True, 'sideways_use_spike': True, 'sideways_rsi_required': True}.
[I 2025-08-30 14:30:39,786] Trial 80 finished with values: [-1000000000.0, 1000000000.0] and parameters: {'p_sma': 30, 'p_std': 30, 'p_atr': 9, 'p_adx': 22, 'rsi_period': 46, 'ema1': 27, 'ema2': 50, 'slip_atr_k': 0.04847041498368337, 'slip_spread_k': 0.28732884152658966, 'spread_hl_frac': 7.96988921530975e-05, 'bb_std_mult': 1.8711368656148777, 'rsi_os': 30, 'rsi_ob': 87, 'vol_spike': 0.25174533870966265, 'adx_thresh': 23.252695930495552, 'atr_min_pct': 0.015406434466809431, 'atr_max_pct': 0.11503076026526216, 'tp_mult': 2.593225536739267, 'tsl_mult': 0.9902413518655367, 'strategy': 'mean_reversion', 'time_stop': 163, 'use_sma': False, 'use_atr': False, 'use_adx': False, 'use_ema': False, 'use_spike': False, 'rsi_required': False, 'edge_k': 1.5123352697459589, 'edge_cap': 0.7802877440332187, 'bull_strategy': 'breakout', 'bull_bb_std_mult': 3.132174430842993, 'bull_rsi_os': 28, 'bull_rsi_ob': 75, 'bull_adx_thresh': 10.695915680728694, 'bull_atr_min_pct': 0.02294146643972541, 'bull_atr_max_pct': 0.0331687544276584, 'bull_tp_mult': 2.4219765198782803, 'bull_tsl_mult': 0.5179008072823883, 'bull_time_stop': 143, 'bull_use_sma': False, 'bull_use_ema': False, 'bull_use_atr': False, 'bull_use_adx': True, 'bull_use_spike': False, 'bull_rsi_required': True, 'bear_strategy': 'breakout', 'bear_bb_std_mult': 1.4243772750517394, 'bear_rsi_os': 14, 'bear_rsi_ob': 48, 'bear_adx_thresh': 16.694872832950058, 'bear_atr_min_pct': 0.012300729235178765, 'bear_atr_max_pct': 0.13804073065683636, 'bear_tp_mult': 1.6860914330710526, 'bear_tsl_mult': 0.2069063289765954, 'bear_time_stop': 35, 'bear_use_sma': False, 'bear_use_ema': False, 'bear_use_atr': False, 'bear_use_adx': True, 'bear_use_spike': True, 'bear_rsi_required': False, 'sideways_strategy': 'breakout', 'sideways_bb_std_mult': 3.3415115042660153, 'sideways_rsi_os': 32, 'sideways_rsi_ob': 89, 'sideways_adx_thresh': 11.554609959778574, 'sideways_atr_min_pct': 0.004194358740024207, 'sideways_atr_max_pct': 0.08048209270326842, 'sideways_tp_mult': 2.7363589885633535, 'sideways_tsl_mult': 0.06971827973013478, 'sideways_time_stop': 201, 'sideways_use_sma': False, 'sideways_use_ema': False, 'sideways_use_atr': False, 'sideways_use_adx': True, 'sideways_use_spike': False, 'sideways_rsi_required': True}.
[I 2025-08-30 14:30:40,240] Trial 77 finished with values: [-1000000000.0, 1000000000.0] and parameters: {'p_sma': 29, 'p_std': 30, 'p_atr': 13, 'p_adx': 22, 'rsi_period': 50, 'ema1': 25, 'ema2': 50, 'slip_atr_k': 0.013864803357369603, 'slip_spread_k': 0.3513404043741467, 'spread_hl_frac': 0.0015897223278090375, 'bb_std_mult': 1.8440174005415633, 'rsi_os': 31, 'rsi_ob': 87, 'vol_spike': 0.2565012177989374, 'adx_thresh': 23.08003005505015, 'atr_min_pct': 0.02039044330772884, 'atr_max_pct': 0.12289178854061156, 'tp_mult': 2.572369848490705, 'tsl_mult': 0.9884279333754089, 'strategy': 'mean_reversion', 'time_stop': 90, 'use_sma': False, 'use_atr': False, 'use_adx': False, 'use_ema': False, 'use_spike': False, 'rsi_required': False, 'edge_k': 1.5161413652700069, 'edge_cap': 0.6839120321393708, 'bull_strategy': 'breakout', 'bull_bb_std_mult': 1.9843945582941473, 'bull_rsi_os': 26, 'bull_rsi_ob': 75, 'bull_adx_thresh': 14.290513485295536, 'bull_atr_min_pct': 0.012028959832472147, 'bull_atr_max_pct': 0.03609966887773979, 'bull_tp_mult': 2.3931385663202662, 'bull_tsl_mult': 0.5229353455945381, 'bull_time_stop': 245, 'bull_use_sma': False, 'bull_use_ema': False, 'bull_use_atr': False, 'bull_use_adx': True, 'bull_use_spike': False, 'bull_rsi_required': True, 'bear_strategy': 'breakout', 'bear_bb_std_mult': 1.4020648978825287, 'bear_rsi_os': 15, 'bear_rsi_ob': 48, 'bear_adx_thresh': 15.822558496285136, 'bear_atr_min_pct': 0.009815570112340464, 'bear_atr_max_pct': 0.03570625167503648, 'bear_tp_mult': 1.9008910296831294, 'bear_tsl_mult': 0.20628326930630425, 'bear_time_stop': 44, 'bear_use_sma': False, 'bear_use_ema': False, 'bear_use_atr': False, 'bear_use_adx': True, 'bear_use_spike': True, 'bear_rsi_required': False, 'sideways_strategy': 'breakout', 'sideways_bb_std_mult': 3.200026916586634, 'sideways_rsi_os': 31, 'sideways_rsi_ob': 89, 'sideways_adx_thresh': 12.896650394936533, 'sideways_atr_min_pct': 0.0043242063088255525, 'sideways_atr_max_pct': 0.07892684388999902, 'sideways_tp_mult': 2.9983814587130664, 'sideways_tsl_mult': 0.18471966811681745, 'sideways_time_stop': 69, 'sideways_use_sma': False, 'sideways_use_ema': False, 'sideways_use_atr': False, 'sideways_use_adx': True, 'sideways_use_spike': True, 'sideways_rsi_required': True}.
[I 2025-08-30 14:30:40,241] Trial 81 finished with values: [-0.012990102067103493, 0.012909597467328728] and parameters: {'p_sma': 28, 'p_std': 30, 'p_atr': 9, 'p_adx': 24, 'rsi_period': 47, 'ema1': 27, 'ema2': 50, 'slip_atr_k': 0.014197501636217857, 'slip_spread_k': 0.2931635450698575, 'spread_hl_frac': 0.043529621628640026, 'bb_std_mult': 1.8238375738654748, 'rsi_os': 35, 'rsi_ob': 88, 'vol_spike': 0.25998555773976284, 'adx_thresh': 20.695375769770937, 'atr_min_pct': 0.015510000437123514, 'atr_max_pct': 0.1153898227657051, 'tp_mult': 2.6097883782729308, 'tsl_mult': 0.9935869000331574, 'strategy': 'mean_reversion', 'time_stop': 163, 'use_sma': True, 'use_atr': False, 'use_adx': False, 'use_ema': False, 'use_spike': False, 'rsi_required': False, 'edge_k': 1.5369579145474288, 'edge_cap': 0.7680170697353949, 'bull_strategy': 'mean_reversion', 'bull_bb_std_mult': 3.2854005198370704, 'bull_rsi_os': 26, 'bull_rsi_ob': 78, 'bull_adx_thresh': 10.687928276614407, 'bull_atr_min_pct': 0.015158701906210855, 'bull_atr_max_pct': 0.026029193192950335, 'bull_tp_mult': 2.0915494096114062, 'bull_tsl_mult': 0.3963298070786962, 'bull_time_stop': 125, 'bull_use_sma': False, 'bull_use_ema': False, 'bull_use_atr': False, 'bull_use_adx': True, 'bull_use_spike': False, 'bull_rsi_required': True, 'bear_strategy': 'breakout', 'bear_bb_std_mult': 1.2176294266047514, 'bear_rsi_os': 14, 'bear_rsi_ob': 94, 'bear_adx_thresh': 16.69490333164009, 'bear_atr_min_pct': 0.012243587542292, 'bear_atr_max_pct': 0.03375566911868779, 'bear_tp_mult': 1.7467462418941233, 'bear_tsl_mult': 0.18626504368737629, 'bear_time_stop': 30, 'bear_use_sma': False, 'bear_use_ema': False, 'bear_use_atr': False, 'bear_use_adx': True, 'bear_use_spike': True, 'bear_rsi_required': False, 'sideways_strategy': 'breakout', 'sideways_bb_std_mult': 3.356060519068543, 'sideways_rsi_os': 52, 'sideways_rsi_ob': 93, 'sideways_adx_thresh': 16.22311233290504, 'sideways_atr_min_pct': 0.004309783080252241, 'sideways_atr_max_pct': 0.079560685908877, 'sideways_tp_mult': 2.9337003697023545, 'sideways_tsl_mult': 0.18695497785801274, 'sideways_time_stop': 210, 'sideways_use_sma': False, 'sideways_use_ema': False, 'sideways_use_atr': True, 'sideways_use_adx': False, 'sideways_use_spike': False, 'sideways_rsi_required': True}.
