[I 2025-08-30 14:38:06,355] Trial 146 finished with values: [-1000000000.0, 1000000000.0] and parameters: {'p_sma': 49, 'p_std': 28, 'p_atr': 24, 'p_adx': 22, 'rsi_period': 50, 'ema1': 13, 'ema2': 23, 'slip_atr_k': 0.09476099880169472, 'slip_spread_k': 0.19466619988792194, 'spread_hl_frac': 0.002694476539672305, 'bb_std_mult': 2.182891158953372, 'rsi_os': 52, 'rsi_ob': 91, 'vol_spike': 0.13788464449843038, 'adx_thresh': 22.09750059684364, 'atr_min_pct': 0.02119767758313201, 'atr_max_pct': 0.08817976679754518, 'tp_mult': 1.6650678485407993, 'tsl_mult': 0.9517664321053058, 'strategy': 'mean_reversion', 'time_stop': 273, 'use_sma': True, 'use_atr': True, 'use_adx': False, 'use_ema': True, 'use_spike': False, 'rsi_required': False, 'edge_k': 1.793185601466927, 'edge_cap': 0.24579891495577538, 'bull_strategy': 'breakout', 'bull_bb_std_mult': 2.4135667249983137, 'bull_rsi_os': 17, 'bull_rsi_ob': 78, 'bull_adx_thresh': 11.189365335869564, 'bull_atr_min_pct': 0.0009687842177346345, 'bull_atr_max_pct': 0.015066882214327434, 'bull_tp_mult': 1.4362279587999058, 'bull_tsl_mult': 0.8405923766601344, 'bull_time_stop': 273, 'bull_use_sma': False, 'bull_use_ema': False, 'bull_use_atr': True, 'bull_use_adx': True, 'bull_use_spike': True, 'bull_rsi_required': False, 'bear_strategy': 'mean_reversion', 'bear_bb_std_mult': 3.5956896707480253, 'bear_rsi_os': 29, 'bear_rsi_ob': 67, 'bear_adx_thresh': 32.14302870932953, 'bear_atr_min_pct': 0.010717553970995334, 'bear_atr_max_pct': 0.024753891996454995, 'bear_tp_mult': 1.3141902129660887, 'bear_tsl_mult': 0.07917566134236947, 'bear_time_stop': 47, 'bear_use_sma': False, 'bear_use_ema': False, 'bear_use_atr': False, 'bear_use_adx': False, 'bear_use_spike': True, 'bear_rsi_required': True, 'sideways_strategy': 'mean_reversion', 'sideways_bb_std_mult': 2.902707349157556, 'sideways_rsi_os': 36, 'sideways_rsi_ob': 88, 'sideways_adx_thresh': 25.715761542048774, 'sideways_atr_min_pct': 0.001663932941518665, 'sideways_atr_max_pct': 0.07425670642471849, 'sideways_tp_mult': 2.842507888335533, 'sideways_tsl_mult': 0.1567203913965569, 'sideways_time_stop': 224, 'sideways_use_sma': False, 'sideways_use_ema': False, 'sideways_use_atr': False, 'sideways_use_adx': True, 'sideways_use_spike': True, 'sideways_rsi_required': True}.
[I 2025-08-30 14:38:38,206] Trial 144 finished with values: [-0.0350032764689413, 0.03491140980283097] and parameters: {'p_sma': 33, 'p_std': 28, 'p_atr': 20, 'p_adx': 9, 'rsi_period': 58, 'ema1': 14, 'ema2': 22, 'slip_atr_k': 0.036192384836513054, 'slip_spread_k': 0.2773871259692173, 'spread_hl_frac': 0.002495956381083617, 'bb_std_mult': 2.138540524263128, 'rsi_os': 34, 'rsi_ob': 78, 'vol_spike': 0.24771691421732855, 'adx_thresh': 22.157584179328136, 'atr_min_pct': 0.020881531431874503, 'atr_max_pct': 0.02183140272951422, 'tp_mult': 2.499962214346402, 'tsl_mult': 0.9992315462533716, 'strategy': 'mean_reversion', 'time_stop': 48, 'use_sma': True, 'use_atr': False, 'use_adx': False, 'use_ema': False, 'use_spike': False, 'rsi_required': False, 'edge_k': 1.9951279871798162, 'edge_cap': 0.8399040175167948, 'bull_strategy': 'mean_reversion', 'bull_bb_std_mult': 1.0270071708004178, 'bull_rsi_os': 14, 'bull_rsi_ob': 89, 'bull_adx_thresh': 11.313428197582267, 'bull_atr_min_pct': 0.0013350713184328042, 'bull_atr_max_pct': 0.015699792552292167, 'bull_tp_mult': 1.461736071654166, 'bull_tsl_mult': 0.5453921206549961, 'bull_time_stop': 131, 'bull_use_sma': False, 'bull_use_ema': False, 'bull_use_atr': False, 'bull_use_adx': True, 'bull_use_spike': False, 'bull_rsi_required': True, 'bear_strategy': 'breakout', 'bear_bb_std_mult': 3.0787653361342526, 'bear_rsi_os': 42, 'bear_rsi_ob': 49, 'bear_adx_thresh': 19.17527269031209, 'bear_atr_min_pct': 0.013055644131686249, 'bear_atr_max_pct': 0.02390233774786334, 'bear_tp_mult': 1.3266159300378222, 'bear_tsl_mult': 0.07422545880061776, 'bear_time_stop': 48, 'bear_use_sma': False, 'bear_use_ema': False, 'bear_use_atr': False, 'bear_use_adx': False, 'bear_use_spike': True, 'bear_rsi_required': False, 'sideways_strategy': 'breakout', 'sideways_bb_std_mult': 3.243943491678993, 'sideways_rsi_os': 33, 'sideways_rsi_ob': 65, 'sideways_adx_thresh': 22.664984276787028, 'sideways_atr_min_pct': 0.018614719647680654, 'sideways_atr_max_pct': 0.07834711728220768, 'sideways_tp_mult': 2.8417016646571307, 'sideways_tsl_mult': 0.7594213447616968, 'sideways_time_stop': 226, 'sideways_use_sma': False, 'sideways_use_ema': True, 'sideways_use_atr': True, 'sideways_use_adx': False, 'sideways_use_spike': True, 'sideways_rsi_required': True}.
[I 2025-08-30 14:38:38,345] Trial 145 finished with values: [-0.04029143865185125, 0.04024058040825629] and parameters: {'p_sma': 32, 'p_std': 9, 'p_atr': 16, 'p_adx': 12, 'rsi_period': 50, 'ema1': 13, 'ema2': 19, 'slip_atr_k': 0.043791140562008675, 'slip_spread_k': 0.9625232137423854, 'spread_hl_frac': 0.0021981440651186418, 'bb_std_mult': 2.1571656541935296, 'rsi_os': 49, 'rsi_ob': 91, 'vol_spike': 0.13808079134227488, 'adx_thresh': 21.979966725201738, 'atr_min_pct': 0.021318887330634546, 'atr_max_pct': 0.06333641733843105, 'tp_mult': 1.0135353578354684, 'tsl_mult': 0.4478826379726165, 'strategy': 'mean_reversion', 'time_stop': 49, 'use_sma': True, 'use_atr': False, 'use_adx': False, 'use_ema': False, 'use_spike': False, 'rsi_required': False, 'edge_k': 1.632530702304065, 'edge_cap': 0.33012897594033663, 'bull_strategy': 'breakout', 'bull_bb_std_mult': 2.220614501134258, 'bull_rsi_os': 17, 'bull_rsi_ob': 78, 'bull_adx_thresh': 21.59842983119275, 'bull_atr_min_pct': 0.0013878303423335674, 'bull_atr_max_pct': 0.0727491249568142, 'bull_tp_mult': 1.4404469120157781, 'bull_tsl_mult': 0.5575417651256055, 'bull_time_stop': 274, 'bull_use_sma': False, 'bull_use_ema': False, 'bull_use_atr': False, 'bull_use_adx': True, 'bull_use_spike': False, 'bull_rsi_required': True, 'bear_strategy': 'mean_reversion', 'bear_bb_std_mult': 2.9955583818837805, 'bear_rsi_os': 41, 'bear_rsi_ob': 50, 'bear_adx_thresh': 24.16999920975085, 'bear_atr_min_pct': 0.010511692525539724, 'bear_atr_max_pct': 0.025112521642835825, 'bear_tp_mult': 2.1201933606126695, 'bear_tsl_mult': 0.1137270691894143, 'bear_time_stop': 49, 'bear_use_sma': False, 'bear_use_ema': False, 'bear_use_atr': False, 'bear_use_adx': False, 'bear_use_spike': True, 'bear_rsi_required': False, 'sideways_strategy': 'breakout', 'sideways_bb_std_mult': 3.242440561137945, 'sideways_rsi_os': 33, 'sideways_rsi_ob': 75, 'sideways_adx_thresh': 22.37121745252015, 'sideways_atr_min_pct': 0.022983667583250128, 'sideways_atr_max_pct': 0.07719196607995009, 'sideways_tp_mult': 2.709222650781947, 'sideways_tsl_mult': 0.7961128656787698, 'sideways_time_stop': 95, 'sideways_use_sma': False, 'sideways_use_ema': True, 'sideways_use_atr': False, 'sideways_use_adx': True, 'sideways_use_spike': True, 'sideways_rsi_required': True}.
[I 2025-08-30 14:38:38,586] Trial 147 finished with values: [-0.04454851300311424, 0.04449660996367272] and parameters: {'p_sma': 25, 'p_std': 28, 'p_atr': 13, 'p_adx': 24, 'rsi_period': 50, 'ema1': 14, 'ema2': 12, 'slip_atr_k': 0.03566274059362374, 'slip_spread_k': 0.18461590956195434, 'spread_hl_frac': 0.0028405205001205648, 'bb_std_mult': 2.656989124171973, 'rsi_os': 7, 'rsi_ob': 78, 'vol_spike': 0.23304801007125248, 'adx_thresh': 23.57320123796535, 'atr_min_pct': 0.021109566015144625, 'atr_max_pct': 0.14641687644799406, 'tp_mult': 2.556928027166759, 'tsl_mult': 0.10520440229147021, 'strategy': 'mean_reversion', 'time_stop': 278, 'use_sma': True, 'use_atr': True, 'use_adx': False, 'use_ema': True, 'use_spike': False, 'rsi_required': False, 'edge_k': 1.6746069015361131, 'edge_cap': 0.6927160045136765, 'bull_strategy': 'breakout', 'bull_bb_std_mult': 0.9990834099604737, 'bull_rsi_os': 14, 'bull_rsi_ob': 78, 'bull_adx_thresh': 11.197331798752801, 'bull_atr_min_pct': 0.000843605444204542, 'bull_atr_max_pct': 0.016073982240939207, 'bull_tp_mult': 1.4386816550637174, 'bull_tsl_mult': 0.6124897061430737, 'bull_time_stop': 279, 'bull_use_sma': False, 'bull_use_ema': False, 'bull_use_atr': True, 'bull_use_adx': True, 'bull_use_spike': False, 'bull_rsi_required': True, 'bear_strategy': 'mean_reversion', 'bear_bb_std_mult': 1.216500701151445, 'bear_rsi_os': 16, 'bear_rsi_ob': 50, 'bear_adx_thresh': 18.866187861196032, 'bear_atr_min_pct': 0.01054596787698866, 'bear_atr_max_pct': 0.023861900597336592, 'bear_tp_mult': 1.6397908526862128, 'bear_tsl_mult': 0.07118785091875934, 'bear_time_stop': 48, 'bear_use_sma': False, 'bear_use_ema': False, 'bear_use_atr': False, 'bear_use_adx': False, 'bear_use_spike': True, 'bear_rsi_required': False, 'sideways_strategy': 'breakout', 'sideways_bb_std_mult': 2.910509034645096, 'sideways_rsi_os': 34, 'sideways_rsi_ob': 56, 'sideways_adx_thresh': 11.438383515856849, 'sideways_atr_min_pct': 0.0026603387091361057, 'sideways_atr_max_pct': 0.07857206261741836, 'sideways_tp_mult': 2.72824007540622, 'sideways_tsl_mult': 0.14786215241277711, 'sideways_time_stop': 95, 'sideways_use_sma': False, 'sideways_use_ema': True, 'sideways_use_atr': False, 'sideways_use_adx': True, 'sideways_use_spike': True, 'sideways_rsi_required': True}.
[I 2025-08-30 14:38:39,180] Trial 148 finished with values: [-0.020564397755507335, 0.020547912606826958] and parameters: {'p_sma': 35, 'p_std': 30, 'p_atr': 13, 'p_adx': 22, 'rsi_period': 51, 'ema1': 10, 'ema2': 52, 'slip_atr_k': 0.11780870722027278, 'slip_spread_k': 0.9503484493765093, 'spread_hl_frac': 0.005915960168792358, 'bb_std_mult': 2.079698404002272, 'rsi_os': 9, 'rsi_ob': 59, 'vol_spike': 0.24965678653118276, 'adx_thresh': 23.61856029363458, 'atr_min_pct': 0.01804161963411741, 'atr_max_pct': 0.14641264716174857, 'tp_mult': 2.5567022426352657, 'tsl_mult': 0.9045548535727761, 'strategy': 'mean_reversion', 'time_stop': 279, 'use_sma': True, 'use_atr': False, 'use_adx': False, 'use_ema': False, 'use_spike': False, 'rsi_required': False, 'edge_k': 1.6423663023520536, 'edge_cap': 0.6829442297723703, 'bull_strategy': 'breakout', 'bull_bb_std_mult': 3.1948274932711684, 'bull_rsi_os': 14, 'bull_rsi_ob': 77, 'bull_adx_thresh': 13.225616528371512, 'bull_atr_min_pct': 0.0023728060938269773, 'bull_atr_max_pct': 0.02204517466672548, 'bull_tp_mult': 1.3990909438961139, 'bull_tsl_mult': 0.5446928978910934, 'bull_time_stop': 277, 'bull_use_sma': False, 'bull_use_ema': True, 'bull_use_atr': True, 'bull_use_adx': True, 'bull_use_spike': False, 'bull_rsi_required': True, 'bear_strategy': 'breakout', 'bear_bb_std_mult': 3.206061364823745, 'bear_rsi_os': 46, 'bear_rsi_ob': 50, 'bear_adx_thresh': 18.56238531303601, 'bear_atr_min_pct': 0.014871101641737038, 'bear_atr_max_pct': 0.05115271950590196, 'bear_tp_mult': 1.9388327261226044, 'bear_tsl_mult': 0.14661010445290457, 'bear_time_stop': 20, 'bear_use_sma': False, 'bear_use_ema': False, 'bear_use_atr': False, 'bear_use_adx': True, 'bear_use_spike': True, 'bear_rsi_required': False, 'sideways_strategy': 'breakout', 'sideways_bb_std_mult': 3.106088319687972, 'sideways_rsi_os': 34, 'sideways_rsi_ob': 75, 'sideways_adx_thresh': 8.339918246754234, 'sideways_atr_min_pct': 0.0054957296003142735, 'sideways_atr_max_pct': 0.0782828162818179, 'sideways_tp_mult': 2.705670598307875, 'sideways_tsl_mult': 0.7568754089004641, 'sideways_time_stop': 128, 'sideways_use_sma': False, 'sideways_use_ema': True, 'sideways_use_atr': False, 'sideways_use_adx': True, 'sideways_use_spike': True, 'sideways_rsi_required': True}.
[I 2025-08-30 14:39:10,861] Trial 151 finished with values: [-1000000000.0, 1000000000.0] and parameters: {'p_sma': 57, 'p_std': 30, 'p_atr': 11, 'p_adx': 16, 'rsi_period': 48, 'ema1': 12, 'ema2': 51, 'slip_atr_k': 0.11826042907805194, 'slip_spread_k': 0.3666187107610493, 'spread_hl_frac': 0.03967414508461485, 'bb_std_mult': 0.8425722787982766, 'rsi_os': 37, 'rsi_ob': 60, 'vol_spike': 0.003328753530157852, 'adx_thresh': 19.70302541454336, 'atr_min_pct': 0.026124375784878293, 'atr_max_pct': 0.12165206743533569, 'tp_mult': 2.577839537068449, 'tsl_mult': 0.9061961601535551, 'strategy': 'mean_reversion', 'time_stop': 59, 'use_sma': False, 'use_atr': False, 'use_adx': False, 'use_ema': False, 'use_spike': True, 'rsi_required': False, 'edge_k': 1.659571658289655, 'edge_cap': 0.7366974270493833, 'bull_strategy': 'breakout', 'bull_bb_std_mult': 3.1998486327169844, 'bull_rsi_os': 16, 'bull_rsi_ob': 76, 'bull_adx_thresh': 13.53417080147187, 'bull_atr_min_pct': 0.005336291860031523, 'bull_atr_max_pct': 0.05020584692197093, 'bull_tp_mult': 1.3522449865740935, 'bull_tsl_mult': 0.18956229153408305, 'bull_time_stop': 41, 'bull_use_sma': False, 'bull_use_ema': True, 'bull_use_atr': True, 'bull_use_adx': True, 'bull_use_spike': True, 'bull_rsi_required': False, 'bear_strategy': 'breakout', 'bear_bb_std_mult': 1.0164235963162274, 'bear_rsi_os': 14, 'bear_rsi_ob': 59, 'bear_adx_thresh': 18.24709645265838, 'bear_atr_min_pct': 0.029976252998757225, 'bear_atr_max_pct': 0.13720036587772635, 'bear_tp_mult': 1.9352641384768674, 'bear_tsl_mult': 0.15396019577015554, 'bear_time_stop': 24, 'bear_use_sma': False, 'bear_use_ema': True, 'bear_use_atr': False, 'bear_use_adx': True, 'bear_use_spike': False, 'bear_rsi_required': True, 'sideways_strategy': 'mean_reversion', 'sideways_bb_std_mult': 1.7924303696264223, 'sideways_rsi_os': 31, 'sideways_rsi_ob': 91, 'sideways_adx_thresh': 7.853666673613384, 'sideways_atr_min_pct': 0.0166831173635414, 'sideways_atr_max_pct': 0.09619822231232344, 'sideways_tp_mult': 1.0966966420586748, 'sideways_tsl_mult': 0.13107931171454698, 'sideways_time_stop': 45, 'sideways_use_sma': True, 'sideways_use_ema': False, 'sideways_use_atr': False, 'sideways_use_adx': True, 'sideways_use_spike': True, 'sideways_rsi_required': False}.
[I 2025-08-30 14:39:10,979] Trial 150 finished with values: [-1000000000.0, 1000000000.0] and parameters: {'p_sma': 25, 'p_std': 30, 'p_atr': 13, 'p_adx': 24, 'rsi_period': 48, 'ema1': 10, 'ema2': 52, 'slip_atr_k': 0.022500902779121364, 'slip_spread_k': 0.8403055934094326, 'spread_hl_frac': 0.039036087829198825, 'bb_std_mult': 2.6141199402471633, 'rsi_os': 12, 'rsi_ob': 57, 'vol_spike': 0.231163182641567, 'adx_thresh': 9.722186812683104, 'atr_min_pct': 0.02397629824496269, 'atr_max_pct': 0.12211654412399377, 'tp_mult': 2.5741799279649467, 'tsl_mult': 0.5144907179303791, 'strategy': 'mean_reversion', 'time_stop': 281, 'use_sma': False, 'use_atr': False, 'use_adx': False, 'use_ema': False, 'use_spike': True, 'rsi_required': False, 'edge_k': 1.656062190819238, 'edge_cap': 0.687974445976439, 'bull_strategy': 'breakout', 'bull_bb_std_mult': 3.225579699004154, 'bull_rsi_os': 15, 'bull_rsi_ob': 79, 'bull_adx_thresh': 13.109559958131706, 'bull_atr_min_pct': 0.005340725893168561, 'bull_atr_max_pct': 0.023388135827812247, 'bull_tp_mult': 1.353436480236957, 'bull_tsl_mult': 0.5128380836207195, 'bull_time_stop': 285, 'bull_use_sma': False, 'bull_use_ema': True, 'bull_use_atr': True, 'bull_use_adx': True, 'bull_use_spike': False, 'bull_rsi_required': True, 'bear_strategy': 'breakout', 'bear_bb_std_mult': 1.2042502644504542, 'bear_rsi_os': 18, 'bear_rsi_ob': 51, 'bear_adx_thresh': 18.403262512583723, 'bear_atr_min_pct': 0.011363896469174534, 'bear_atr_max_pct': 0.0827073894592399, 'bear_tp_mult': 1.935328383934211, 'bear_tsl_mult': 0.4767831902715019, 'bear_time_stop': 23, 'bear_use_sma': False, 'bear_use_ema': True, 'bear_use_atr': False, 'bear_use_adx': True, 'bear_use_spike': False, 'bear_rsi_required': False, 'sideways_strategy': 'breakout', 'sideways_bb_std_mult': 2.9907882295740795, 'sideways_rsi_os': 26, 'sideways_rsi_ob': 91, 'sideways_adx_thresh': 14.366491040643746, 'sideways_atr_min_pct': 0.00511204741527109, 'sideways_atr_max_pct': 0.14417602395308443, 'sideways_tp_mult': 2.717212334949398, 'sideways_tsl_mult': 0.5183400555170028, 'sideways_time_stop': 130, 'sideways_use_sma': False, 'sideways_use_ema': False, 'sideways_use_atr': False, 'sideways_use_adx': True, 'sideways_use_spike': True, 'sideways_rsi_required': True}.
[I 2025-08-30 14:39:11,236] Trial 152 finished with values: [-1000000000.0, 1000000000.0] and parameters: {'p_sma': 30, 'p_std': 30, 'p_atr': 13, 'p_adx': 16, 'rsi_period': 45, 'ema1': 10, 'ema2': 52, 'slip_atr_k': 0.11894739771106719, 'slip_spread_k': 0.6806129229692598, 'spread_hl_frac': 0.03891001637580699, 'bb_std_mult': 2.253202435738906, 'rsi_os': 10, 'rsi_ob': 57, 'vol_spike': 0.2566121548487066, 'adx_thresh': 24.643397435174943, 'atr_min_pct': 0.019837291493434876, 'atr_max_pct': 0.12099101017899067, 'tp_mult': 2.667807034064202, 'tsl_mult': 0.9793218170107704, 'strategy': 'mean_reversion', 'time_stop': 12, 'use_sma': False, 'use_atr': False, 'use_adx': False, 'use_ema': False, 'use_spike': True, 'rsi_required': False, 'edge_k': 1.6632542836080735, 'edge_cap': 0.7421762485533921, 'bull_strategy': 'mean_reversion', 'bull_bb_std_mult': 3.2348921482888002, 'bull_rsi_os': 15, 'bull_rsi_ob': 76, 'bull_adx_thresh': 32.64069556133221, 'bull_atr_min_pct': 0.005377646709446281, 'bull_atr_max_pct': 0.05178062462617506, 'bull_tp_mult': 1.3527257091301867, 'bull_tsl_mult': 0.5071365089074399, 'bull_time_stop': 42, 'bull_use_sma': False, 'bull_use_ema': True, 'bull_use_atr': True, 'bull_use_adx': False, 'bull_use_spike': True, 'bull_rsi_required': False, 'bear_strategy': 'breakout', 'bear_bb_std_mult': 1.0634116806552185, 'bear_rsi_os': 13, 'bear_rsi_ob': 57, 'bear_adx_thresh': 33.94385519390147, 'bear_atr_min_pct': 0.014642158227899561, 'bear_atr_max_pct': 0.08114742220958984, 'bear_tp_mult': 2.0398889202180603, 'bear_tsl_mult': 0.47310983481698726, 'bear_time_stop': 23, 'bear_use_sma': False, 'bear_use_ema': True, 'bear_use_atr': False, 'bear_use_adx': True, 'bear_use_spike': False, 'bear_rsi_required': True, 'sideways_strategy': 'mean_reversion', 'sideways_bb_std_mult': 2.750418242619156, 'sideways_rsi_os': 31, 'sideways_rsi_ob': 90, 'sideways_adx_thresh': 14.207644845042324, 'sideways_atr_min_pct': 0.005532428447396716, 'sideways_atr_max_pct': 0.08165838029674571, 'sideways_tp_mult': 2.794792324042709, 'sideways_tsl_mult': 0.07961475242126136, 'sideways_time_stop': 120, 'sideways_use_sma': False, 'sideways_use_ema': False, 'sideways_use_atr': True, 'sideways_use_adx': False, 'sideways_use_spike': True, 'sideways_rsi_required': False}.
[I 2025-08-30 14:39:11,476] Trial 149 finished with values: [-1000000000.0, 1000000000.0] and parameters: {'p_sma': 57, 'p_std': 30, 'p_atr': 13, 'p_adx': 24, 'rsi_period': 48, 'ema1': 10, 'ema2': 12, 'slip_atr_k': 0.021816011917319064, 'slip_spread_k': 0.6800827369709949, 'spread_hl_frac': 0.0057819058508887765, 'bb_std_mult': 1.8622148572574526, 'rsi_os': 38, 'rsi_ob': 91, 'vol_spike': 0.2559353704038336, 'adx_thresh': 7.637380381493308, 'atr_min_pct': 0.015426889310592547, 'atr_max_pct': 0.14549824600548844, 'tp_mult': 2.5716853074641337, 'tsl_mult': 0.5342713673655115, 'strategy': 'mean_reversion', 'time_stop': 61, 'use_sma': True, 'use_atr': False, 'use_adx': False, 'use_ema': False, 'use_spike': True, 'rsi_required': False, 'edge_k': 1.6475062425967217, 'edge_cap': 0.6885658788561614, 'bull_strategy': 'breakout', 'bull_bb_std_mult': 3.2141580723064553, 'bull_rsi_os': 16, 'bull_rsi_ob': 79, 'bull_adx_thresh': 13.385999340659666, 'bull_atr_min_pct': 0.005257557029845963, 'bull_atr_max_pct': 0.02177257280330362, 'bull_tp_mult': 1.3584024609152767, 'bull_tsl_mult': 0.5117515998171358, 'bull_time_stop': 283, 'bull_use_sma': False, 'bull_use_ema': True, 'bull_use_atr': True, 'bull_use_adx': True, 'bull_use_spike': False, 'bull_rsi_required': True, 'bear_strategy': 'breakout', 'bear_bb_std_mult': 1.2042229020051232, 'bear_rsi_os': 18, 'bear_rsi_ob': 57, 'bear_adx_thresh': 19.80944178039269, 'bear_atr_min_pct': 0.029930636263938458, 'bear_atr_max_pct': 0.1386965136560545, 'bear_tp_mult': 2.1245424186507713, 'bear_tsl_mult': 0.14600077494673508, 'bear_time_stop': 22, 'bear_use_sma': False, 'bear_use_ema': False, 'bear_use_atr': False, 'bear_use_adx': True, 'bear_use_spike': True, 'bear_rsi_required': False, 'sideways_strategy': 'breakout', 'sideways_bb_std_mult': 3.1084217899785407, 'sideways_rsi_os': 26, 'sideways_rsi_ob': 49, 'sideways_adx_thresh': 8.129423155103261, 'sideways_atr_min_pct': 0.005542505431171967, 'sideways_atr_max_pct': 0.09660271578614704, 'sideways_tp_mult': 2.7487985353423916, 'sideways_tsl_mult': 0.08225066520548716, 'sideways_time_stop': 202, 'sideways_use_sma': False, 'sideways_use_ema': False, 'sideways_use_atr': False, 'sideways_use_adx': True, 'sideways_use_spike': True, 'sideways_rsi_required': True}.
