[I 2025-08-30 16:36:07,751] Trial 810 finished with values: [-1000000000.0, 1000000000.0] and parameters: {'p_sma': 9, 'p_std': 32, 'p_atr': 27, 'p_adx': 12, 'rsi_period': 42, 'ema1': 22, 'ema2': 31, 'slip_atr_k': 0.08680614727883823, 'slip_spread_k': 0.18115995487456343, 'spread_hl_frac': 0.0426153343065228, 'bb_std_mult': 2.1658383438187583, 'rsi_os': 40, 'rsi_ob': 55, 'vol_spike': 0.024602582471029227, 'adx_thresh': 13.807339840982895, 'atr_min_pct': 0.014851166780573825, 'atr_max_pct': 0.10009217959542241, 'tp_mult': 1.6911501274982967, 'tsl_mult': 0.22595611758488926, 'strategy': 'mean_reversion', 'time_stop': 237, 'use_sma': True, 'use_atr': False, 'use_adx': False, 'use_ema': False, 'use_spike': False, 'rsi_required': False, 'edge_k': 0.46405251981780177, 'edge_cap': 0.5950362627297882, 'bull_strategy': 'breakout', 'bull_bb_std_mult': 0.6324864440989955, 'bull_rsi_os': 53, 'bull_rsi_ob': 59, 'bull_adx_thresh': 24.704313584705805, 'bull_atr_min_pct': 0.020762090223771498, 'bull_atr_max_pct': 0.08869826280100694, 'bull_tp_mult': 2.008662001737681, 'bull_tsl_mult': 0.4238631975463043, 'bull_time_stop': 286, 'bull_use_sma': True, 'bull_use_ema': True, 'bull_use_atr': True, 'bull_use_adx': True, 'bull_use_spike': True, 'bull_rsi_required': True, 'bear_strategy': 'mean_reversion', 'bear_bb_std_mult': 1.496835658449566, 'bear_rsi_os': 34, 'bear_rsi_ob': 91, 'bear_adx_thresh': 28.219945815151924, 'bear_atr_min_pct': 0.020505011613784582, 'bear_atr_max_pct': 0.0830204931606022, 'bear_tp_mult': 2.826961135244984, 'bear_tsl_mult': 0.7730332061806761, 'bear_time_stop': 290, 'bear_use_sma': False, 'bear_use_ema': False, 'bear_use_atr': True, 'bear_use_adx': True, 'bear_use_spike': True, 'bear_rsi_required': False, 'sideways_strategy': 'mean_reversion', 'sideways_bb_std_mult': 1.2354497221796397, 'sideways_rsi_os': 40, 'sideways_rsi_ob': 86, 'sideways_adx_thresh': 22.73083240716892, 'sideways_atr_min_pct': 0.026233270022161144, 'sideways_atr_max_pct': 0.09845001502597414, 'sideways_tp_mult': 2.8022347548016038, 'sideways_tsl_mult': 0.9664433754640976, 'sideways_time_stop': 74, 'sideways_use_sma': False, 'sideways_use_ema': True, 'sideways_use_atr': False, 'sideways_use_adx': True, 'sideways_use_spike': False, 'sideways_rsi_required': True}.
[I 2025-08-30 16:36:09,169] Trial 811 finished with values: [-1000000000.0, 1000000000.0] and parameters: {'p_sma': 54, 'p_std': 57, 'p_atr': 25, 'p_adx': 13, 'rsi_period': 77, 'ema1': 22, 'ema2': 39, 'slip_atr_k': 0.06924027683560753, 'slip_spread_k': 0.18212869166361131, 'spread_hl_frac': 0.026494904243613036, 'bb_std_mult': 1.8833341948155673, 'rsi_os': 39, 'rsi_ob': 73, 'vol_spike': 0.15051919762875224, 'adx_thresh': 13.770343165964363, 'atr_min_pct': 0.015953304475137608, 'atr_max_pct': 0.037618600856502905, 'tp_mult': 1.3210527187236458, 'tsl_mult': 0.22157994471466108, 'strategy': 'mean_reversion', 'time_stop': 242, 'use_sma': True, 'use_atr': True, 'use_adx': True, 'use_ema': True, 'use_spike': True, 'rsi_required': False, 'edge_k': 0.4588958134346094, 'edge_cap': 0.3398672782726614, 'bull_strategy': 'breakout', 'bull_bb_std_mult': 0.8858192999802117, 'bull_rsi_os': 53, 'bull_rsi_ob': 59, 'bull_adx_thresh': 16.193185087988354, 'bull_atr_min_pct': 0.021311303559700262, 'bull_atr_max_pct': 0.116147185940161, 'bull_tp_mult': 2.999327489753099, 'bull_tsl_mult': 0.4217321263807315, 'bull_time_stop': 34, 'bull_use_sma': True, 'bull_use_ema': True, 'bull_use_atr': True, 'bull_use_adx': True, 'bull_use_spike': True, 'bull_rsi_required': True, 'bear_strategy': 'mean_reversion', 'bear_bb_std_mult': 1.4708246017744244, 'bear_rsi_os': 47, 'bear_rsi_ob': 90, 'bear_adx_thresh': 7.855903342363396, 'bear_atr_min_pct': 0.006035306894403092, 'bear_atr_max_pct': 0.08189281614832464, 'bear_tp_mult': 2.864314165099551, 'bear_tsl_mult': 0.6161240472527418, 'bear_time_stop': 24, 'bear_use_sma': False, 'bear_use_ema': False, 'bear_use_atr': False, 'bear_use_adx': True, 'bear_use_spike': True, 'bear_rsi_required': True, 'sideways_strategy': 'breakout', 'sideways_bb_std_mult': 0.9555146421431236, 'sideways_rsi_os': 29, 'sideways_rsi_ob': 94, 'sideways_adx_thresh': 7.389814393249951, 'sideways_atr_min_pct': 0.007416218196720311, 'sideways_atr_max_pct': 0.09811652951194098, 'sideways_tp_mult': 2.8364606842026063, 'sideways_tsl_mult': 0.5787435497187868, 'sideways_time_stop': 138, 'sideways_use_sma': True, 'sideways_use_ema': True, 'sideways_use_atr': False, 'sideways_use_adx': True, 'sideways_use_spike': True, 'sideways_rsi_required': True}.
[I 2025-08-30 16:36:10,146] Trial 812 finished with values: [-1000000000.0, 1000000000.0] and parameters: {'p_sma': 9, 'p_std': 57, 'p_atr': 25, 'p_adx': 13, 'rsi_period': 22, 'ema1': 6, 'ema2': 29, 'slip_atr_k': 0.11282945905170896, 'slip_spread_k': 0.09345815155722939, 'spread_hl_frac': 0.019187532491238838, 'bb_std_mult': 2.6965961505292726, 'rsi_os': 39, 'rsi_ob': 72, 'vol_spike': 0.15099426906412053, 'adx_thresh': 13.679329138968448, 'atr_min_pct': 0.017564614447381968, 'atr_max_pct': 0.07954228881597149, 'tp_mult': 1.5767640810161545, 'tsl_mult': 0.032821407005874326, 'strategy': 'mean_reversion', 'time_stop': 241, 'use_sma': True, 'use_atr': True, 'use_adx': True, 'use_ema': True, 'use_spike': True, 'rsi_required': False, 'edge_k': 1.8596214676479628, 'edge_cap': 0.5824907231892483, 'bull_strategy': 'breakout', 'bull_bb_std_mult': 0.8022186946618817, 'bull_rsi_os': 38, 'bull_rsi_ob': 60, 'bull_adx_thresh': 22.653177059457764, 'bull_atr_min_pct': 0.028394342263235964, 'bull_atr_max_pct': 0.1162222660122818, 'bull_tp_mult': 2.051825295315664, 'bull_tsl_mult': 0.4272180930060864, 'bull_time_stop': 38, 'bull_use_sma': True, 'bull_use_ema': True, 'bull_use_atr': True, 'bull_use_adx': True, 'bull_use_spike': True, 'bull_rsi_required': True, 'bear_strategy': 'mean_reversion', 'bear_bb_std_mult': 2.600604217315562, 'bear_rsi_os': 47, 'bear_rsi_ob': 91, 'bear_adx_thresh': 28.411243411172933, 'bear_atr_min_pct': 0.029192581009471488, 'bear_atr_max_pct': 0.0703467416473065, 'bear_tp_mult': 2.8155899885668907, 'bear_tsl_mult': 0.42744008240762865, 'bear_time_stop': 242, 'bear_use_sma': False, 'bear_use_ema': False, 'bear_use_atr': False, 'bear_use_adx': True, 'bear_use_spike': True, 'bear_rsi_required': True, 'sideways_strategy': 'breakout', 'sideways_bb_std_mult': 1.524272291209216, 'sideways_rsi_os': 40, 'sideways_rsi_ob': 71, 'sideways_adx_thresh': 24.567626168019675, 'sideways_atr_min_pct': 0.01796726112369968, 'sideways_atr_max_pct': 0.09782922053185866, 'sideways_tp_mult': 2.9317822631510198, 'sideways_tsl_mult': 0.01228698735776712, 'sideways_time_stop': 263, 'sideways_use_sma': True, 'sideways_use_ema': True, 'sideways_use_atr': False, 'sideways_use_adx': True, 'sideways_use_spike': True, 'sideways_rsi_required': True}.
[I 2025-08-30 16:36:48,385] Trial 813 finished with values: [-1000000000.0, 1000000000.0] and parameters: {'p_sma': 12, 'p_std': 57, 'p_atr': 25, 'p_adx': 11, 'rsi_period': 77, 'ema1': 6, 'ema2': 29, 'slip_atr_k': 0.19496109625461222, 'slip_spread_k': 0.20077044096907676, 'spread_hl_frac': 0.04990067212242629, 'bb_std_mult': 2.364833256066548, 'rsi_os': 39, 'rsi_ob': 60, 'vol_spike': 0.22464690544877597, 'adx_thresh': 13.684422594459022, 'atr_min_pct': 0.01003532521064265, 'atr_max_pct': 0.07928484435167373, 'tp_mult': 1.6452990144664925, 'tsl_mult': 0.1908954966960711, 'strategy': 'mean_reversion', 'time_stop': 240, 'use_sma': True, 'use_atr': False, 'use_adx': True, 'use_ema': True, 'use_spike': True, 'rsi_required': False, 'edge_k': 0.30638474295338436, 'edge_cap': 0.46876007483596227, 'bull_strategy': 'breakout', 'bull_bb_std_mult': 0.7935616237421012, 'bull_rsi_os': 38, 'bull_rsi_ob': 59, 'bull_adx_thresh': 31.266030574108918, 'bull_atr_min_pct': 0.015296740884506112, 'bull_atr_max_pct': 0.09565101003682022, 'bull_tp_mult': 2.0652194764049066, 'bull_tsl_mult': 0.418753989255779, 'bull_time_stop': 37, 'bull_use_sma': True, 'bull_use_ema': True, 'bull_use_atr': True, 'bull_use_adx': True, 'bull_use_spike': False, 'bull_rsi_required': True, 'bear_strategy': 'mean_reversion', 'bear_bb_std_mult': 3.435455568076825, 'bear_rsi_os': 47, 'bear_rsi_ob': 92, 'bear_adx_thresh': 9.166770902531752, 'bear_atr_min_pct': 0.006046327578535756, 'bear_atr_max_pct': 0.07088745231541924, 'bear_tp_mult': 2.814442849918507, 'bear_tsl_mult': 0.4246127354651459, 'bear_time_stop': 175, 'bear_use_sma': False, 'bear_use_ema': False, 'bear_use_atr': False, 'bear_use_adx': True, 'bear_use_spike': True, 'bear_rsi_required': True, 'sideways_strategy': 'breakout', 'sideways_bb_std_mult': 0.5741312517573482, 'sideways_rsi_os': 40, 'sideways_rsi_ob': 94, 'sideways_adx_thresh': 22.737887189890653, 'sideways_atr_min_pct': 0.002164753385598316, 'sideways_atr_max_pct': 0.09806183838623608, 'sideways_tp_mult': 1.1157252362384524, 'sideways_tsl_mult': 0.9036461692661483, 'sideways_time_stop': 76, 'sideways_use_sma': True, 'sideways_use_ema': True, 'sideways_use_atr': False, 'sideways_use_adx': True, 'sideways_use_spike': False, 'sideways_rsi_required': True}.
[I 2025-08-30 16:36:55,938] Trial 816 finished with values: [-1000000000.0, 1000000000.0] and parameters: {'p_sma': 6, 'p_std': 34, 'p_atr': 25, 'p_adx': 11, 'rsi_period': 82, 'ema1': 24, 'ema2': 32, 'slip_atr_k': 0.12506224079875716, 'slip_spread_k': 0.15169090419661116, 'spread_hl_frac': 0.016491169208924763, 'bb_std_mult': 3.201526526519348, 'rsi_os': 49, 'rsi_ob': 71, 'vol_spike': 0.22519635644416797, 'adx_thresh': 9.194552764966854, 'atr_min_pct': 0.014419205027673673, 'atr_max_pct': 0.0327808760775961, 'tp_mult': 1.753402720679775, 'tsl_mult': 0.19064875313990592, 'strategy': 'mean_reversion', 'time_stop': 215, 'use_sma': True, 'use_atr': True, 'use_adx': False, 'use_ema': True, 'use_spike': True, 'rsi_required': False, 'edge_k': 1.814623026737633, 'edge_cap': 0.4696675441243465, 'bull_strategy': 'breakout', 'bull_bb_std_mult': 0.7506554399575526, 'bull_rsi_os': 45, 'bull_rsi_ob': 70, 'bull_adx_thresh': 26.58372051335116, 'bull_atr_min_pct': 0.01571271883118878, 'bull_atr_max_pct': 0.09600339927104139, 'bull_tp_mult': 1.199076128895851, 'bull_tsl_mult': 0.05994138361481122, 'bull_time_stop': 58, 'bull_use_sma': True, 'bull_use_ema': True, 'bull_use_atr': True, 'bull_use_adx': True, 'bull_use_spike': False, 'bull_rsi_required': True, 'bear_strategy': 'mean_reversion', 'bear_bb_std_mult': 2.532609778810157, 'bear_rsi_os': 31, 'bear_rsi_ob': 94, 'bear_adx_thresh': 6.068323835673587, 'bear_atr_min_pct': 0.0026936768005366065, 'bear_atr_max_pct': 0.07172934785770281, 'bear_tp_mult': 2.1401719676497173, 'bear_tsl_mult': 0.3901216123951527, 'bear_time_stop': 178, 'bear_use_sma': False, 'bear_use_ema': False, 'bear_use_atr': True, 'bear_use_adx': True, 'bear_use_spike': True, 'bear_rsi_required': True, 'sideways_strategy': 'breakout', 'sideways_bb_std_mult': 1.6823110581023817, 'sideways_rsi_os': 55, 'sideways_rsi_ob': 64, 'sideways_adx_thresh': 25.213224427997382, 'sideways_atr_min_pct': 0.012850747311751782, 'sideways_atr_max_pct': 0.10832631014351571, 'sideways_tp_mult': 2.9466534972349203, 'sideways_tsl_mult': 0.9090784341500036, 'sideways_time_stop': 75, 'sideways_use_sma': True, 'sideways_use_ema': False, 'sideways_use_atr': False, 'sideways_use_adx': True, 'sideways_use_spike': False, 'sideways_rsi_required': True}.
[I 2025-08-30 16:36:55,957] Trial 815 finished with values: [-0.02779748327748477, 0.027787985162387584] and parameters: {'p_sma': 15, 'p_std': 57, 'p_atr': 25, 'p_adx': 7, 'rsi_period': 83, 'ema1': 24, 'ema2': 12, 'slip_atr_k': 0.13474553628521102, 'slip_spread_k': 0.08930796675828179, 'spread_hl_frac': 0.02261506070516294, 'bb_std_mult': 2.681563193496072, 'rsi_os': 37, 'rsi_ob': 72, 'vol_spike': 0.16926755386388578, 'adx_thresh': 9.312258751572042, 'atr_min_pct': 0.014227053940590265, 'atr_max_pct': 0.07952581575071647, 'tp_mult': 1.769061826691672, 'tsl_mult': 0.42202250540789743, 'strategy': 'mean_reversion', 'time_stop': 212, 'use_sma': True, 'use_atr': True, 'use_adx': True, 'use_ema': True, 'use_spike': True, 'rsi_required': False, 'edge_k': 0.6978430741896597, 'edge_cap': 0.6231106927107027, 'bull_strategy': 'breakout', 'bull_bb_std_mult': 0.7975827263171633, 'bull_rsi_os': 38, 'bull_rsi_ob': 66, 'bull_adx_thresh': 23.14507941856171, 'bull_atr_min_pct': 0.015546771126597218, 'bull_atr_max_pct': 0.09510579217727476, 'bull_tp_mult': 2.040619891977297, 'bull_tsl_mult': 0.001112583589503821, 'bull_time_stop': 59, 'bull_use_sma': True, 'bull_use_ema': True, 'bull_use_atr': True, 'bull_use_adx': True, 'bull_use_spike': False, 'bull_rsi_required': True, 'bear_strategy': 'mean_reversion', 'bear_bb_std_mult': 2.60936118761466, 'bear_rsi_os': 18, 'bear_rsi_ob': 83, 'bear_adx_thresh': 29.279979679112024, 'bear_atr_min_pct': 0.010557146655404814, 'bear_atr_max_pct': 0.07092093451084641, 'bear_tp_mult': 2.4428017318851962, 'bear_tsl_mult': 0.42157262093553666, 'bear_time_stop': 273, 'bear_use_sma': False, 'bear_use_ema': False, 'bear_use_atr': False, 'bear_use_adx': True, 'bear_use_spike': True, 'bear_rsi_required': True, 'sideways_strategy': 'breakout', 'sideways_bb_std_mult': 0.8360716336273567, 'sideways_rsi_os': 55, 'sideways_rsi_ob': 64, 'sideways_adx_thresh': 24.444292966643793, 'sideways_atr_min_pct': 0.0022378589950052697, 'sideways_atr_max_pct': 0.11801121122241484, 'sideways_tp_mult': 2.929086456848216, 'sideways_tsl_mult': 0.9055329870027107, 'sideways_time_stop': 75, 'sideways_use_sma': True, 'sideways_use_ema': False, 'sideways_use_atr': False, 'sideways_use_adx': True, 'sideways_use_spike': True, 'sideways_rsi_required': True}.
[I 2025-08-30 16:36:57,455] Trial 814 finished with values: [-1000000000.0, 1000000000.0] and parameters: {'p_sma': 6, 'p_std': 56, 'p_atr': 25, 'p_adx': 11, 'rsi_period': 77, 'ema1': 22, 'ema2': 33, 'slip_atr_k': 0.0679414707454131, 'slip_spread_k': 0.09826158204956736, 'spread_hl_frac': 0.04985870727348322, 'bb_std_mult': 2.3718331524832155, 'rsi_os': 39, 'rsi_ob': 60, 'vol_spike': 0.17097636044286532, 'adx_thresh': 19.25721992891578, 'atr_min_pct': 0.014281569947939755, 'atr_max_pct': 0.07911279933405312, 'tp_mult': 1.6436192989654177, 'tsl_mult': 0.42222345040821685, 'strategy': 'mean_reversion', 'time_stop': 215, 'use_sma': True, 'use_atr': True, 'use_adx': True, 'use_ema': True, 'use_spike': True, 'rsi_required': False, 'edge_k': 0.30912302375439427, 'edge_cap': 0.47266723038195846, 'bull_strategy': 'breakout', 'bull_bb_std_mult': 0.7902017170037517, 'bull_rsi_os': 38, 'bull_rsi_ob': 67, 'bull_adx_thresh': 28.919798244192876, 'bull_atr_min_pct': 0.02136053084798143, 'bull_atr_max_pct': 0.11569921306324252, 'bull_tp_mult': 1.1893716714068643, 'bull_tsl_mult': 0.021866005883739215, 'bull_time_stop': 37, 'bull_use_sma': True, 'bull_use_ema': True, 'bull_use_atr': True, 'bull_use_adx': True, 'bull_use_spike': False, 'bull_rsi_required': True, 'bear_strategy': 'mean_reversion', 'bear_bb_std_mult': 2.612155768157724, 'bear_rsi_os': 45, 'bear_rsi_ob': 93, 'bear_adx_thresh': 8.025243236130578, 'bear_atr_min_pct': 0.006048498633586849, 'bear_atr_max_pct': 0.07100042037660528, 'bear_tp_mult': 2.409590107111462, 'bear_tsl_mult': 0.4189884433983586, 'bear_time_stop': 245, 'bear_use_sma': False, 'bear_use_ema': False, 'bear_use_atr': False, 'bear_use_adx': True, 'bear_use_spike': True, 'bear_rsi_required': True, 'sideways_strategy': 'breakout', 'sideways_bb_std_mult': 0.9559871324679228, 'sideways_rsi_os': 13, 'sideways_rsi_ob': 64, 'sideways_adx_thresh': 20.70979058090484, 'sideways_atr_min_pct': 0.014214450595922096, 'sideways_atr_max_pct': 0.10736545036589956, 'sideways_tp_mult': 2.9436829802738655, 'sideways_tsl_mult': 0.9068614371003548, 'sideways_time_stop': 66, 'sideways_use_sma': True, 'sideways_use_ema': True, 'sideways_use_atr': False, 'sideways_use_adx': True, 'sideways_use_spike': True, 'sideways_rsi_required': True}.
[I 2025-08-30 16:37:38,634] Trial 817 finished with values: [-1000000000.0, 1000000000.0] and parameters: {'p_sma': 6, 'p_std': 34, 'p_atr': 26, 'p_adx': 11, 'rsi_period': 83, 'ema1': 24, 'ema2': 32, 'slip_atr_k': 0.0784778371920817, 'slip_spread_k': 0.1506719868594726, 'spread_hl_frac': 0.04584059146863207, 'bb_std_mult': 2.915775493580122, 'rsi_os': 37, 'rsi_ob': 71, 'vol_spike': 0.18155969090965032, 'adx_thresh': 14.536234678028492, 'atr_min_pct': 0.01430525068938519, 'atr_max_pct': 0.07471890334006807, 'tp_mult': 1.8155421529947602, 'tsl_mult': 0.4046751537901558, 'strategy': 'mean_reversion', 'time_stop': 215, 'use_sma': True, 'use_atr': True, 'use_adx': False, 'use_ema': True, 'use_spike': True, 'rsi_required': False, 'edge_k': 0.3748971217473783, 'edge_cap': 0.6158390857727936, 'bull_strategy': 'breakout', 'bull_bb_std_mult': 0.7201413412190485, 'bull_rsi_os': 51, 'bull_rsi_ob': 68, 'bull_adx_thresh': 30.137114921419403, 'bull_atr_min_pct': 0.021462599596780808, 'bull_atr_max_pct': 0.08482268770599302, 'bull_tp_mult': 2.1030446183065328, 'bull_tsl_mult': 0.06751625804433908, 'bull_time_stop': 56, 'bull_use_sma': True, 'bull_use_ema': True, 'bull_use_atr': True, 'bull_use_adx': True, 'bull_use_spike': False, 'bull_rsi_required': True, 'bear_strategy': 'breakout', 'bear_bb_std_mult': 1.934062389838958, 'bear_rsi_os': 35, 'bear_rsi_ob': 45, 'bear_adx_thresh': 29.2946778643042, 'bear_atr_min_pct': 0.0014743724930348385, 'bear_atr_max_pct': 0.07486888836088666, 'bear_tp_mult': 2.1474819545070725, 'bear_tsl_mult': 0.6938412780547911, 'bear_time_stop': 276, 'bear_use_sma': False, 'bear_use_ema': False, 'bear_use_atr': True, 'bear_use_adx': True, 'bear_use_spike': True, 'bear_rsi_required': True, 'sideways_strategy': 'breakout', 'sideways_bb_std_mult': 1.6713885823601786, 'sideways_rsi_os': 38, 'sideways_rsi_ob': 64, 'sideways_adx_thresh': 13.28892445440352, 'sideways_atr_min_pct': 0.012957257307335695, 'sideways_atr_max_pct': 0.107392241596745, 'sideways_tp_mult': 2.9361776119571243, 'sideways_tsl_mult': 0.05056197915607258, 'sideways_time_stop': 66, 'sideways_use_sma': True, 'sideways_use_ema': False, 'sideways_use_atr': False, 'sideways_use_adx': True, 'sideways_use_spike': True, 'sideways_rsi_required': True}.
[I 2025-08-30 16:37:41,715] Trial 818 finished with values: [-1000000000.0, 1000000000.0] and parameters: {'p_sma': 57, 'p_std': 52, 'p_atr': 28, 'p_adx': 12, 'rsi_period': 80, 'ema1': 11, 'ema2': 33, 'slip_atr_k': 0.039109575026955015, 'slip_spread_k': 0.6868127446720567, 'spread_hl_frac': 0.04573186554288044, 'bb_std_mult': 1.833456101965121, 'rsi_os': 38, 'rsi_ob': 77, 'vol_spike': 0.1817415826231949, 'adx_thresh': 19.371922669952934, 'atr_min_pct': 0.02925918272970063, 'atr_max_pct': 0.07360720832586119, 'tp_mult': 1.815044508660909, 'tsl_mult': 0.3987841263328485, 'strategy': 'mean_reversion', 'time_stop': 50, 'use_sma': True, 'use_atr': True, 'use_adx': False, 'use_ema': True, 'use_spike': True, 'rsi_required': False, 'edge_k': 0.3586332018145074, 'edge_cap': 0.3189187914288224, 'bull_strategy': 'breakout', 'bull_bb_std_mult': 1.1226856011017965, 'bull_rsi_os': 40, 'bull_rsi_ob': 64, 'bull_adx_thresh': 33.23787361108458, 'bull_atr_min_pct': 0.021350713088178087, 'bull_atr_max_pct': 0.08482787761823163, 'bull_tp_mult': 2.3592434636493578, 'bull_tsl_mult': 0.1928184440084182, 'bull_time_stop': 27, 'bull_use_sma': True, 'bull_use_ema': True, 'bull_use_atr': True, 'bull_use_adx': True, 'bull_use_spike': True, 'bull_rsi_required': True, 'bear_strategy': 'breakout', 'bear_bb_std_mult': 2.321494757827852, 'bear_rsi_os': 53, 'bear_rsi_ob': 63, 'bear_adx_thresh': 5.011189368339746, 'bear_atr_min_pct': 0.021619071665063827, 'bear_atr_max_pct': 0.07491106009836832, 'bear_tp_mult': 1.0261064687555543, 'bear_tsl_mult': 0.304630339065292, 'bear_time_stop': 257, 'bear_use_sma': False, 'bear_use_ema': False, 'bear_use_atr': True, 'bear_use_adx': True, 'bear_use_spike': True, 'bear_rsi_required': True, 'sideways_strategy': 'breakout', 'sideways_bb_std_mult': 1.1127471666386906, 'sideways_rsi_os': 6, 'sideways_rsi_ob': 62, 'sideways_adx_thresh': 12.15070708567066, 'sideways_atr_min_pct': 0.027613613616636685, 'sideways_atr_max_pct': 0.10289888243645108, 'sideways_tp_mult': 1.8926427849127048, 'sideways_tsl_mult': 0.9474522641939229, 'sideways_time_stop': 66, 'sideways_use_sma': True, 'sideways_use_ema': True, 'sideways_use_atr': False, 'sideways_use_adx': True, 'sideways_use_spike': True, 'sideways_rsi_required': True}.
