[I 2025-08-30 16:43:47,978] Trial 858 finished with values: [-1000000000.0, 1000000000.0] and parameters: {'p_sma': 14, 'p_std': 28, 'p_atr': 30, 'p_adx': 7, 'rsi_period': 33, 'ema1': 23, 'ema2': 29, 'slip_atr_k': 0.05712421170661122, 'slip_spread_k': 0.20190035997749198, 'spread_hl_frac': 0.02793958815351474, 'bb_std_mult': 1.9578389672513625, 'rsi_os': 54, 'rsi_ob': 76, 'vol_spike': 0.14734921239789356, 'adx_thresh': 13.262517021910158, 'atr_min_pct': 0.017573615299981808, 'atr_max_pct': 0.07050195273135944, 'tp_mult': 1.8971264204712077, 'tsl_mult': 0.5479217926640101, 'strategy': 'mean_reversion', 'time_stop': 219, 'use_sma': True, 'use_atr': True, 'use_adx': True, 'use_ema': False, 'use_spike': True, 'rsi_required': False, 'edge_k': 1.1913412877747636, 'edge_cap': 0.23003823624642555, 'bull_strategy': 'breakout', 'bull_bb_std_mult': 1.6269926576812745, 'bull_rsi_os': 44, 'bull_rsi_ob': 61, 'bull_adx_thresh': 25.68030969417343, 'bull_atr_min_pct': 0.018581028277268638, 'bull_atr_max_pct': 0.11396316481725, 'bull_tp_mult': 1.602607931099649, 'bull_tsl_mult': 0.8918233328287046, 'bull_time_stop': 36, 'bull_use_sma': True, 'bull_use_ema': True, 'bull_use_atr': True, 'bull_use_adx': True, 'bull_use_spike': False, 'bull_rsi_required': True, 'bear_strategy': 'breakout', 'bear_bb_std_mult': 2.2417957348826123, 'bear_rsi_os': 37, 'bear_rsi_ob': 94, 'bear_adx_thresh': 31.392180715874545, 'bear_atr_min_pct': 0.0031409083563256513, 'bear_atr_max_pct': 0.13597619175343115, 'bear_tp_mult': 2.36219690609035, 'bear_tsl_mult': 0.20815850437729272, 'bear_time_stop': 290, 'bear_use_sma': False, 'bear_use_ema': False, 'bear_use_atr': False, 'bear_use_adx': True, 'bear_use_spike': True, 'bear_rsi_required': True, 'sideways_strategy': 'mean_reversion', 'sideways_bb_std_mult': 1.7168489734116863, 'sideways_rsi_os': 42, 'sideways_rsi_ob': 80, 'sideways_adx_thresh': 22.548180634411345, 'sideways_atr_min_pct': 0.0026747456335706535, 'sideways_atr_max_pct': 0.1197856334646555, 'sideways_tp_mult': 1.5942713669886208, 'sideways_tsl_mult': 0.17281261138715495, 'sideways_time_stop': 43, 'sideways_use_sma': True, 'sideways_use_ema': True, 'sideways_use_atr': False, 'sideways_use_adx': True, 'sideways_use_spike': False, 'sideways_rsi_required': True}.
[I 2025-08-30 16:43:49,523] Trial 859 finished with values: [-1000000000.0, 1000000000.0] and parameters: {'p_sma': 44, 'p_std': 24, 'p_atr': 29, 'p_adx': 14, 'rsi_period': 74, 'ema1': 22, 'ema2': 29, 'slip_atr_k': 0.054901487053794905, 'slip_spread_k': 0.24046319018109386, 'spread_hl_frac': 0.027946009263397915, 'bb_std_mult': 2.8301115316351457, 'rsi_os': 50, 'rsi_ob': 76, 'vol_spike': 0.14217132017206144, 'adx_thresh': 13.075351981524303, 'atr_min_pct': 0.017017383014272493, 'atr_max_pct': 0.06772042088345598, 'tp_mult': 1.9357081447245386, 'tsl_mult': 0.6139614161636899, 'strategy': 'mean_reversion', 'time_stop': 208, 'use_sma': True, 'use_atr': True, 'use_adx': True, 'use_ema': True, 'use_spike': False, 'rsi_required': False, 'edge_k': 1.1506055854075778, 'edge_cap': 0.13278731665092183, 'bull_strategy': 'breakout', 'bull_bb_std_mult': 1.2054782420984487, 'bull_rsi_os': 44, 'bull_rsi_ob': 60, 'bull_adx_thresh': 25.997863791066273, 'bull_atr_min_pct': 0.017620297226106127, 'bull_atr_max_pct': 0.11908237741907028, 'bull_tp_mult': 1.7008408890850877, 'bull_tsl_mult': 0.18291989770003342, 'bull_time_stop': 36, 'bull_use_sma': True, 'bull_use_ema': True, 'bull_use_atr': True, 'bull_use_adx': True, 'bull_use_spike': True, 'bull_rsi_required': True, 'bear_strategy': 'mean_reversion', 'bear_bb_std_mult': 2.327259333754436, 'bear_rsi_os': 36, 'bear_rsi_ob': 95, 'bear_adx_thresh': 30.737228347873614, 'bear_atr_min_pct': 0.0035875969317565684, 'bear_atr_max_pct': 0.12523841535641791, 'bear_tp_mult': 2.588973648035698, 'bear_tsl_mult': 0.2592082199931319, 'bear_time_stop': 296, 'bear_use_sma': False, 'bear_use_ema': False, 'bear_use_atr': False, 'bear_use_adx': True, 'bear_use_spike': True, 'bear_rsi_required': False, 'sideways_strategy': 'breakout', 'sideways_bb_std_mult': 1.7453452421864524, 'sideways_rsi_os': 42, 'sideways_rsi_ob': 82, 'sideways_adx_thresh': 22.905304256249483, 'sideways_atr_min_pct': 0.002997501810898459, 'sideways_atr_max_pct': 0.11718531973453089, 'sideways_tp_mult': 1.5352029201006343, 'sideways_tsl_mult': 0.1343445090634978, 'sideways_time_stop': 40, 'sideways_use_sma': False, 'sideways_use_ema': False, 'sideways_use_atr': False, 'sideways_use_adx': True, 'sideways_use_spike': True, 'sideways_rsi_required': True}.
[I 2025-08-30 16:44:28,288] Trial 857 finished with values: [-1000000000.0, 1000000000.0] and parameters: {'p_sma': 16, 'p_std': 24, 'p_atr': 22, 'p_adx': 14, 'rsi_period': 82, 'ema1': 22, 'ema2': 29, 'slip_atr_k': 0.053171154311398426, 'slip_spread_k': 0.24479028321971083, 'spread_hl_frac': 0.027933352636420602, 'bb_std_mult': 2.8644431275447437, 'rsi_os': 47, 'rsi_ob': 76, 'vol_spike': 0.14030669960389472, 'adx_thresh': 12.994993202085546, 'atr_min_pct': 0.01704351638711568, 'atr_max_pct': 0.06747495995161742, 'tp_mult': 1.9014395560571313, 'tsl_mult': 0.6046079467350184, 'strategy': 'mean_reversion', 'time_stop': 211, 'use_sma': True, 'use_atr': True, 'use_adx': True, 'use_ema': False, 'use_spike': True, 'rsi_required': False, 'edge_k': 1.1610946734240506, 'edge_cap': 0.29158864527889256, 'bull_strategy': 'breakout', 'bull_bb_std_mult': 1.7362520045087133, 'bull_rsi_os': 44, 'bull_rsi_ob': 60, 'bull_adx_thresh': 26.022243720184342, 'bull_atr_min_pct': 0.018496465125791284, 'bull_atr_max_pct': 0.11910393227181153, 'bull_tp_mult': 1.702646701982606, 'bull_tsl_mult': 0.18473684693012415, 'bull_time_stop': 35, 'bull_use_sma': True, 'bull_use_ema': True, 'bull_use_atr': True, 'bull_use_adx': True, 'bull_use_spike': False, 'bull_rsi_required': True, 'bear_strategy': 'breakout', 'bear_bb_std_mult': 2.307737407339445, 'bear_rsi_os': 35, 'bear_rsi_ob': 94, 'bear_adx_thresh': 31.316024782294434, 'bear_atr_min_pct': 0.0033567011414443633, 'bear_atr_max_pct': 0.13717621783573902, 'bear_tp_mult': 2.4967103110976527, 'bear_tsl_mult': 0.23225230448129047, 'bear_time_stop': 289, 'bear_use_sma': False, 'bear_use_ema': False, 'bear_use_atr': False, 'bear_use_adx': True, 'bear_use_spike': True, 'bear_rsi_required': False, 'sideways_strategy': 'mean_reversion', 'sideways_bb_std_mult': 1.737185611707791, 'sideways_rsi_os': 42, 'sideways_rsi_ob': 82, 'sideways_adx_thresh': 22.373642036407684, 'sideways_atr_min_pct': 0.0030999411907592905, 'sideways_atr_max_pct': 0.1204478212541207, 'sideways_tp_mult': 2.8454969827613605, 'sideways_tsl_mult': 0.13735343646883513, 'sideways_time_stop': 34, 'sideways_use_sma': False, 'sideways_use_ema': True, 'sideways_use_atr': False, 'sideways_use_adx': True, 'sideways_use_spike': False, 'sideways_rsi_required': True}.
[I 2025-08-30 16:44:29,552] Trial 854 finished with values: [-1000000000.0, 1000000000.0] and parameters: {'p_sma': 16, 'p_std': 24, 'p_atr': 23, 'p_adx': 8, 'rsi_period': 74, 'ema1': 23, 'ema2': 30, 'slip_atr_k': 0.0527689265011981, 'slip_spread_k': 0.2183728847120338, 'spread_hl_frac': 0.02990006396424101, 'bb_std_mult': 1.924484227335504, 'rsi_os': 48, 'rsi_ob': 76, 'vol_spike': 0.14673084425355018, 'adx_thresh': 13.213651358179657, 'atr_min_pct': 0.017377331669636627, 'atr_max_pct': 0.06535597574746324, 'tp_mult': 1.9067961619113118, 'tsl_mult': 0.4877355138251843, 'strategy': 'mean_reversion', 'time_stop': 208, 'use_sma': True, 'use_atr': False, 'use_adx': True, 'use_ema': True, 'use_spike': True, 'rsi_required': False, 'edge_k': 1.0887594769669593, 'edge_cap': 0.28852833853886894, 'bull_strategy': 'breakout', 'bull_bb_std_mult': 1.4971639234147993, 'bull_rsi_os': 43, 'bull_rsi_ob': 61, 'bull_adx_thresh': 25.468523382210094, 'bull_atr_min_pct': 0.018402511547397166, 'bull_atr_max_pct': 0.12243291575941523, 'bull_tp_mult': 1.6388257998491749, 'bull_tsl_mult': 0.7434632634907175, 'bull_time_stop': 36, 'bull_use_sma': True, 'bull_use_ema': True, 'bull_use_atr': True, 'bull_use_adx': True, 'bull_use_spike': True, 'bull_rsi_required': True, 'bear_strategy': 'mean_reversion', 'bear_bb_std_mult': 2.279626007215933, 'bear_rsi_os': 38, 'bear_rsi_ob': 93, 'bear_adx_thresh': 31.034950150178837, 'bear_atr_min_pct': 0.0031122474891323625, 'bear_atr_max_pct': 0.12524960211891892, 'bear_tp_mult': 2.5071461030833113, 'bear_tsl_mult': 0.2441951257925548, 'bear_time_stop': 293, 'bear_use_sma': False, 'bear_use_ema': False, 'bear_use_atr': False, 'bear_use_adx': True, 'bear_use_spike': True, 'bear_rsi_required': True, 'sideways_strategy': 'breakout', 'sideways_bb_std_mult': 1.7548744394842866, 'sideways_rsi_os': 42, 'sideways_rsi_ob': 79, 'sideways_adx_thresh': 22.551030246441258, 'sideways_atr_min_pct': 0.0029258173393659835, 'sideways_atr_max_pct': 0.11925985167845005, 'sideways_tp_mult': 2.8547618210356376, 'sideways_tsl_mult': 0.1436028335545968, 'sideways_time_stop': 40, 'sideways_use_sma': True, 'sideways_use_ema': True, 'sideways_use_atr': False, 'sideways_use_adx': True, 'sideways_use_spike': True, 'sideways_rsi_required': True}.
[I 2025-08-30 16:44:30,986] Trial 855 finished with values: [-0.02408365438915694, 0.024007703533775335] and parameters: {'p_sma': 44, 'p_std': 26, 'p_atr': 22, 'p_adx': 14, 'rsi_period': 13, 'ema1': 8, 'ema2': 28, 'slip_atr_k': 0.05058558228359244, 'slip_spread_k': 0.2456962512309906, 'spread_hl_frac': 0.027601072134381652, 'bb_std_mult': 2.850198919881442, 'rsi_os': 47, 'rsi_ob': 77, 'vol_spike': 0.15175126389220464, 'adx_thresh': 13.184488062089253, 'atr_min_pct': 0.017394085883633323, 'atr_max_pct': 0.06774607500529375, 'tp_mult': 1.9193571509813963, 'tsl_mult': 0.5028335805751056, 'strategy': 'mean_reversion', 'time_stop': 203, 'use_sma': True, 'use_atr': True, 'use_adx': True, 'use_ema': True, 'use_spike': True, 'rsi_required': False, 'edge_k': 1.10851243865864, 'edge_cap': 0.35118343102729593, 'bull_strategy': 'breakout', 'bull_bb_std_mult': 1.4722434954930443, 'bull_rsi_os': 44, 'bull_rsi_ob': 60, 'bull_adx_thresh': 25.81808577694483, 'bull_atr_min_pct': 0.018478204070731554, 'bull_atr_max_pct': 0.11234943688840114, 'bull_tp_mult': 1.5850297245597607, 'bull_tsl_mult': 0.20168645853666178, 'bull_time_stop': 30, 'bull_use_sma': True, 'bull_use_ema': True, 'bull_use_atr': True, 'bull_use_adx': True, 'bull_use_spike': False, 'bull_rsi_required': True, 'bear_strategy': 'mean_reversion', 'bear_bb_std_mult': 2.2801915062982037, 'bear_rsi_os': 36, 'bear_rsi_ob': 91, 'bear_adx_thresh': 31.742068936240898, 'bear_atr_min_pct': 0.002636350223993428, 'bear_atr_max_pct': 0.1141517601498609, 'bear_tp_mult': 2.3835166335419253, 'bear_tsl_mult': 0.24549123188540423, 'bear_time_stop': 291, 'bear_use_sma': False, 'bear_use_ema': False, 'bear_use_atr': False, 'bear_use_adx': True, 'bear_use_spike': True, 'bear_rsi_required': False, 'sideways_strategy': 'breakout', 'sideways_bb_std_mult': 1.729623821747859, 'sideways_rsi_os': 42, 'sideways_rsi_ob': 80, 'sideways_adx_thresh': 22.463730624765052, 'sideways_atr_min_pct': 0.0028224459871130265, 'sideways_atr_max_pct': 0.1196111727137265, 'sideways_tp_mult': 2.840980963472647, 'sideways_tsl_mult': 0.15880464884725867, 'sideways_time_stop': 38, 'sideways_use_sma': False, 'sideways_use_ema': True, 'sideways_use_atr': False, 'sideways_use_adx': True, 'sideways_use_spike': True, 'sideways_rsi_required': True}.
[I 2025-08-30 16:44:35,433] Trial 862 finished with values: [-1000000000.0, 1000000000.0] and parameters: {'p_sma': 5, 'p_std': 26, 'p_atr': 20, 'p_adx': 8, 'rsi_period': 13, 'ema1': 21, 'ema2': 29, 'slip_atr_k': 0.05836536940118153, 'slip_spread_k': 0.23782971524097932, 'spread_hl_frac': 0.029024561094699947, 'bb_std_mult': 2.7493475973948347, 'rsi_os': 55, 'rsi_ob': 77, 'vol_spike': 0.15043696467077458, 'adx_thresh': 13.321423706841895, 'atr_min_pct': 0.016745288175886285, 'atr_max_pct': 0.0635070091117079, 'tp_mult': 1.8699332664043835, 'tsl_mult': 0.5780206658984373, 'strategy': 'mean_reversion', 'time_stop': 216, 'use_sma': True, 'use_atr': True, 'use_adx': True, 'use_ema': True, 'use_spike': True, 'rsi_required': False, 'edge_k': 1.2451171996762045, 'edge_cap': 0.2536666472307184, 'bull_strategy': 'breakout', 'bull_bb_std_mult': 1.9605494007786382, 'bull_rsi_os': 44, 'bull_rsi_ob': 61, 'bull_adx_thresh': 25.09856032492552, 'bull_atr_min_pct': 0.01917663271646517, 'bull_atr_max_pct': 0.1284783014205552, 'bull_tp_mult': 1.7314545418700653, 'bull_tsl_mult': 0.14391265245724577, 'bull_time_stop': 31, 'bull_use_sma': True, 'bull_use_ema': True, 'bull_use_atr': True, 'bull_use_adx': True, 'bull_use_spike': True, 'bull_rsi_required': True, 'bear_strategy': 'mean_reversion', 'bear_bb_std_mult': 2.2147075072247535, 'bear_rsi_os': 37, 'bear_rsi_ob': 92, 'bear_adx_thresh': 30.23380349382644, 'bear_atr_min_pct': 0.0019062813323483766, 'bear_atr_max_pct': 0.1457759461649401, 'bear_tp_mult': 2.261584254011359, 'bear_tsl_mult': 0.2970884853651269, 'bear_time_stop': 287, 'bear_use_sma': False, 'bear_use_ema': False, 'bear_use_atr': False, 'bear_use_adx': True, 'bear_use_spike': True, 'bear_rsi_required': True, 'sideways_strategy': 'breakout', 'sideways_bb_std_mult': 1.6760361646978115, 'sideways_rsi_os': 42, 'sideways_rsi_ob': 84, 'sideways_adx_thresh': 22.775153524705132, 'sideways_atr_min_pct': 0.0021081184227837568, 'sideways_atr_max_pct': 0.11643374785245053, 'sideways_tp_mult': 2.8853396525232933, 'sideways_tsl_mult': 0.17598314842671633, 'sideways_time_stop': 31, 'sideways_use_sma': True, 'sideways_use_ema': False, 'sideways_use_atr': False, 'sideways_use_adx': True, 'sideways_use_spike': True, 'sideways_rsi_required': True}.
[I 2025-08-30 16:44:37,978] Trial 860 finished with values: [-0.041301744221443726, 0.0412109273156291] and parameters: {'p_sma': 24, 'p_std': 31, 'p_atr': 21, 'p_adx': 8, 'rsi_period': 13, 'ema1': 23, 'ema2': 29, 'slip_atr_k': 0.05739498025462551, 'slip_spread_k': 0.215429438966612, 'spread_hl_frac': 0.02875909960039213, 'bb_std_mult': 1.8940508563796112, 'rsi_os': 47, 'rsi_ob': 76, 'vol_spike': 0.14168817582499013, 'adx_thresh': 13.372565900245872, 'atr_min_pct': 0.017453939673578805, 'atr_max_pct': 0.06552290927772075, 'tp_mult': 1.8966060970745044, 'tsl_mult': 0.6397122020813695, 'strategy': 'mean_reversion', 'time_stop': 214, 'use_sma': True, 'use_atr': True, 'use_adx': True, 'use_ema': True, 'use_spike': True, 'rsi_required': False, 'edge_k': 1.238295760294675, 'edge_cap': 0.24414732912306047, 'bull_strategy': 'breakout', 'bull_bb_std_mult': 1.242229763138862, 'bull_rsi_os': 44, 'bull_rsi_ob': 61, 'bull_adx_thresh': 25.595217452967834, 'bull_atr_min_pct': 0.01888022718507261, 'bull_atr_max_pct': 0.1280300395010911, 'bull_tp_mult': 1.5852852172232375, 'bull_tsl_mult': 0.7080493583438416, 'bull_time_stop': 30, 'bull_use_sma': True, 'bull_use_ema': True, 'bull_use_atr': True, 'bull_use_adx': True, 'bull_use_spike': True, 'bull_rsi_required': True, 'bear_strategy': 'mean_reversion', 'bear_bb_std_mult': 2.2244089710374504, 'bear_rsi_os': 37, 'bear_rsi_ob': 90, 'bear_adx_thresh': 30.212714709372207, 'bear_atr_min_pct': 0.0026134957901521655, 'bear_atr_max_pct': 0.12932746786009025, 'bear_tp_mult': 2.288419352133157, 'bear_tsl_mult': 0.4033071540574961, 'bear_time_stop': 290, 'bear_use_sma': False, 'bear_use_ema': False, 'bear_use_atr': False, 'bear_use_adx': True, 'bear_use_spike': True, 'bear_rsi_required': True, 'sideways_strategy': 'breakout', 'sideways_bb_std_mult': 1.6756071990018124, 'sideways_rsi_os': 42, 'sideways_rsi_ob': 74, 'sideways_adx_thresh': 22.691439947369965, 'sideways_atr_min_pct': 0.002208411617503206, 'sideways_atr_max_pct': 0.12223802620802558, 'sideways_tp_mult': 2.825306235342787, 'sideways_tsl_mult': 0.16026350508776435, 'sideways_time_stop': 32, 'sideways_use_sma': True, 'sideways_use_ema': True, 'sideways_use_atr': False, 'sideways_use_adx': True, 'sideways_use_spike': False, 'sideways_rsi_required': True}.
[I 2025-08-30 16:44:39,567] Trial 865 finished with values: [-1000000000.0, 1000000000.0] and parameters: {'p_sma': 6, 'p_std': 29, 'p_atr': 29, 'p_adx': 7, 'rsi_period': 76, 'ema1': 10, 'ema2': 28, 'slip_atr_k': 0.05954559015599642, 'slip_spread_k': 0.22245477580333017, 'spread_hl_frac': 0.027157698531174154, 'bb_std_mult': 1.7821431603420739, 'rsi_os': 52, 'rsi_ob': 75, 'vol_spike': 0.14901857417281708, 'adx_thresh': 13.216829988892343, 'atr_min_pct': 0.01677379232253263, 'atr_max_pct': 0.0692051173410699, 'tp_mult': 1.8819224373563708, 'tsl_mult': 0.5529684165043438, 'strategy': 'mean_reversion', 'time_stop': 226, 'use_sma': True, 'use_atr': True, 'use_adx': True, 'use_ema': False, 'use_spike': False, 'rsi_required': False, 'edge_k': 1.062559025576199, 'edge_cap': 0.16921803929617169, 'bull_strategy': 'breakout', 'bull_bb_std_mult': 1.3635405525885398, 'bull_rsi_os': 43, 'bull_rsi_ob': 62, 'bull_adx_thresh': 25.082529592075517, 'bull_atr_min_pct': 0.017956245684817997, 'bull_atr_max_pct': 0.11436863764591051, 'bull_tp_mult': 1.5326239143464395, 'bull_tsl_mult': 0.8264991885685039, 'bull_time_stop': 40, 'bull_use_sma': True, 'bull_use_ema': True, 'bull_use_atr': True, 'bull_use_adx': True, 'bull_use_spike': True, 'bull_rsi_required': True, 'bear_strategy': 'breakout', 'bear_bb_std_mult': 2.360629312912817, 'bear_rsi_os': 36, 'bear_rsi_ob': 90, 'bear_adx_thresh': 29.94476989711889, 'bear_atr_min_pct': 0.004381393097248985, 'bear_atr_max_pct': 0.11976759157383733, 'bear_tp_mult': 2.1827935184283627, 'bear_tsl_mult': 0.3494295893233133, 'bear_time_stop': 300, 'bear_use_sma': False, 'bear_use_ema': False, 'bear_use_atr': False, 'bear_use_adx': True, 'bear_use_spike': True, 'bear_rsi_required': True, 'sideways_strategy': 'mean_reversion', 'sideways_bb_std_mult': 1.8505596490436274, 'sideways_rsi_os': 42, 'sideways_rsi_ob': 69, 'sideways_adx_thresh': 21.832596800218525, 'sideways_atr_min_pct': 0.0022158597975637587, 'sideways_atr_max_pct': 0.11642228968646882, 'sideways_tp_mult': 2.896927703832333, 'sideways_tsl_mult': 0.11524854887796437, 'sideways_time_stop': 43, 'sideways_use_sma': True, 'sideways_use_ema': True, 'sideways_use_atr': False, 'sideways_use_adx': True, 'sideways_use_spike': True, 'sideways_rsi_required': True}.
[I 2025-08-30 16:45:15,268] Trial 863 finished with values: [-0.025224435160688508, 0.02515038876685852] and parameters: {'p_sma': 41, 'p_std': 26, 'p_atr': 20, 'p_adx': 8, 'rsi_period': 76, 'ema1': 21, 'ema2': 29, 'slip_atr_k': 0.05798985479400761, 'slip_spread_k': 0.22582847547310977, 'spread_hl_frac': 0.02950438056567175, 'bb_std_mult': 1.8618270124460765, 'rsi_os': 45, 'rsi_ob': 78, 'vol_spike': 0.14122003012185563, 'adx_thresh': 13.445511847454329, 'atr_min_pct': 0.016637126191682824, 'atr_max_pct': 0.06865507032122661, 'tp_mult': 1.8876568699542084, 'tsl_mult': 0.5843091575838331, 'strategy': 'mean_reversion', 'time_stop': 271, 'use_sma': True, 'use_atr': True, 'use_adx': True, 'use_ema': True, 'use_spike': False, 'rsi_required': False, 'edge_k': 1.2161686319273097, 'edge_cap': 0.37909620501934693, 'bull_strategy': 'breakout', 'bull_bb_std_mult': 1.2314764406246776, 'bull_rsi_os': 45, 'bull_rsi_ob': 61, 'bull_adx_thresh': 25.157457088469453, 'bull_atr_min_pct': 0.019187808947528123, 'bull_atr_max_pct': 0.10769008694493862, 'bull_tp_mult': 1.5339186472144208, 'bull_tsl_mult': 0.7181582187668258, 'bull_time_stop': 29, 'bull_use_sma': True, 'bull_use_ema': True, 'bull_use_atr': True, 'bull_use_adx': True, 'bull_use_spike': True, 'bull_rsi_required': True, 'bear_strategy': 'mean_reversion', 'bear_bb_std_mult': 2.326286970060406, 'bear_rsi_os': 35, 'bear_rsi_ob': 93, 'bear_adx_thresh': 29.986572985581653, 'bear_atr_min_pct': 0.0018308045743006766, 'bear_atr_max_pct': 0.12184318442616422, 'bear_tp_mult': 2.1915433823113712, 'bear_tsl_mult': 0.3922435786305831, 'bear_time_stop': 287, 'bear_use_sma': False, 'bear_use_ema': False, 'bear_use_atr': False, 'bear_use_adx': True, 'bear_use_spike': True, 'bear_rsi_required': True, 'sideways_strategy': 'breakout', 'sideways_bb_std_mult': 1.6536603901469742, 'sideways_rsi_os': 42, 'sideways_rsi_ob': 84, 'sideways_adx_thresh': 22.62346059606412, 'sideways_atr_min_pct': 0.002313346130088134, 'sideways_atr_max_pct': 0.11723774356368023, 'sideways_tp_mult': 2.887001735601348, 'sideways_tsl_mult': 0.16760612142035394, 'sideways_time_stop': 28, 'sideways_use_sma': True, 'sideways_use_ema': False, 'sideways_use_atr': False, 'sideways_use_adx': True, 'sideways_use_spike': True, 'sideways_rsi_required': True}.
