[I 2025-08-30 15:38:24,104] Trial 516 finished with values: [-1000000000.0, 1000000000.0] and parameters: {'p_sma': 8, 'p_std': 58, 'p_atr': 19, 'p_adx': 14, 'rsi_period': 79, 'ema1': 25, 'ema2': 31, 'slip_atr_k': 0.07636109612442138, 'slip_spread_k': 0.1320875569381449, 'spread_hl_frac': 0.046640975435364024, 'bb_std_mult': 1.0508492675233305, 'rsi_os': 24, 'rsi_ob': 59, 'vol_spike': 0.1910789688845444, 'adx_thresh': 14.466115347647735, 'atr_min_pct': 0.014145710778041538, 'atr_max_pct': 0.07899077830106924, 'tp_mult': 1.730122166112508, 'tsl_mult': 0.8003909307119715, 'strategy': 'breakout', 'time_stop': 120, 'use_sma': False, 'use_atr': True, 'use_adx': True, 'use_ema': True, 'use_spike': False, 'rsi_required': False, 'edge_k': 0.16432065631367715, 'edge_cap': 0.19186252502341444, 'bull_strategy': 'breakout', 'bull_bb_std_mult': 2.6117521130164305, 'bull_rsi_os': 36, 'bull_rsi_ob': 46, 'bull_adx_thresh': 17.29883162171865, 'bull_atr_min_pct': 0.02154935641653316, 'bull_atr_max_pct': 0.11317486268280769, 'bull_tp_mult': 1.0668863810531273, 'bull_tsl_mult': 0.27495468334298867, 'bull_time_stop': 229, 'bull_use_sma': False, 'bull_use_ema': False, 'bull_use_atr': False, 'bull_use_adx': False, 'bull_use_spike': True, 'bull_rsi_required': False, 'bear_strategy': 'breakout', 'bear_bb_std_mult': 0.5558014096822446, 'bear_rsi_os': 29, 'bear_rsi_ob': 75, 'bear_adx_thresh': 28.38063733014821, 'bear_atr_min_pct': 0.020726892032412497, 'bear_atr_max_pct': 0.07035469413376215, 'bear_tp_mult': 2.4492038350780443, 'bear_tsl_mult': 0.9550106932588763, 'bear_time_stop': 248, 'bear_use_sma': True, 'bear_use_ema': True, 'bear_use_atr': False, 'bear_use_adx': False, 'bear_use_spike': False, 'bear_rsi_required': True, 'sideways_strategy': 'breakout', 'sideways_bb_std_mult': 2.2234896434732443, 'sideways_rsi_os': 16, 'sideways_rsi_ob': 59, 'sideways_adx_thresh': 27.71159872595916, 'sideways_atr_min_pct': 0.0020536469714896068, 'sideways_atr_max_pct': 0.1031410072972265, 'sideways_tp_mult': 2.0754537183902233, 'sideways_tsl_mult': 0.9202312193160747, 'sideways_time_stop': 195, 'sideways_use_sma': True, 'sideways_use_ema': True, 'sideways_use_atr': False, 'sideways_use_adx': True, 'sideways_use_spike': False, 'sideways_rsi_required': True}.
[I 2025-08-30 15:38:24,565] Trial 515 finished with values: [-1000000000.0, 1000000000.0] and parameters: {'p_sma': 18, 'p_std': 8, 'p_atr': 9, 'p_adx': 25, 'rsi_period': 79, 'ema1': 29, 'ema2': 35, 'slip_atr_k': 0.17883767737928555, 'slip_spread_k': 0.035821497754325415, 'spread_hl_frac': 0.02402776466168596, 'bb_std_mult': 0.8194691453187108, 'rsi_os': 39, 'rsi_ob': 74, 'vol_spike': 0.15153339094386326, 'adx_thresh': 5.390723997311792, 'atr_min_pct': 0.014702812095405561, 'atr_max_pct': 0.02355876956003093, 'tp_mult': 2.229573790033562, 'tsl_mult': 0.7209982264082816, 'strategy': 'breakout', 'time_stop': 124, 'use_sma': False, 'use_atr': True, 'use_adx': True, 'use_ema': True, 'use_spike': False, 'rsi_required': False, 'edge_k': 0.08943389258173184, 'edge_cap': 0.49648466128909374, 'bull_strategy': 'breakout', 'bull_bb_std_mult': 2.607918303735392, 'bull_rsi_os': 38, 'bull_rsi_ob': 52, 'bull_adx_thresh': 23.237398674762005, 'bull_atr_min_pct': 0.02231260368449733, 'bull_atr_max_pct': 0.06393510814691475, 'bull_tp_mult': 2.706602601301593, 'bull_tsl_mult': 0.9038145242421611, 'bull_time_stop': 50, 'bull_use_sma': False, 'bull_use_ema': False, 'bull_use_atr': False, 'bull_use_adx': False, 'bull_use_spike': True, 'bull_rsi_required': False, 'bear_strategy': 'breakout', 'bear_bb_std_mult': 1.8202485699897768, 'bear_rsi_os': 20, 'bear_rsi_ob': 75, 'bear_adx_thresh': 7.342761466831968, 'bear_atr_min_pct': 0.020771616103749373, 'bear_atr_max_pct': 0.07067325298986185, 'bear_tp_mult': 1.4822689632233332, 'bear_tsl_mult': 0.9526744076879018, 'bear_time_stop': 63, 'bear_use_sma': True, 'bear_use_ema': True, 'bear_use_atr': False, 'bear_use_adx': False, 'bear_use_spike': False, 'bear_rsi_required': True, 'sideways_strategy': 'breakout', 'sideways_bb_std_mult': 2.532758804542379, 'sideways_rsi_os': 12, 'sideways_rsi_ob': 59, 'sideways_adx_thresh': 30.749938649944127, 'sideways_atr_min_pct': 0.0009996632337667018, 'sideways_atr_max_pct': 0.10316317796128151, 'sideways_tp_mult': 1.0922758445841803, 'sideways_tsl_mult': 0.9343378911840712, 'sideways_time_stop': 278, 'sideways_use_sma': True, 'sideways_use_ema': True, 'sideways_use_atr': False, 'sideways_use_adx': True, 'sideways_use_spike': False, 'sideways_rsi_required': True}.
[I 2025-08-30 15:38:25,092] Trial 514 finished with values: [-1000000000.0, 1000000000.0] and parameters: {'p_sma': 53, 'p_std': 58, 'p_atr': 15, 'p_adx': 25, 'rsi_period': 76, 'ema1': 29, 'ema2': 31, 'slip_atr_k': 0.055265903926559064, 'slip_spread_k': 0.13614744142413654, 'spread_hl_frac': 0.024471803485192168, 'bb_std_mult': 0.8447405040507132, 'rsi_os': 16, 'rsi_ob': 74, 'vol_spike': 0.1850534606104819, 'adx_thresh': 13.418632993370386, 'atr_min_pct': 0.014613870529925879, 'atr_max_pct': 0.11882504758323094, 'tp_mult': 1.7347059667060771, 'tsl_mult': 0.7493417703041693, 'strategy': 'breakout', 'time_stop': 149, 'use_sma': False, 'use_atr': True, 'use_adx': False, 'use_ema': True, 'use_spike': False, 'rsi_required': False, 'edge_k': 0.24808467636019593, 'edge_cap': 0.5005207232239215, 'bull_strategy': 'breakout', 'bull_bb_std_mult': 2.693728810001454, 'bull_rsi_os': 39, 'bull_rsi_ob': 45, 'bull_adx_thresh': 23.25587136246084, 'bull_atr_min_pct': 0.02290165653973289, 'bull_atr_max_pct': 0.05668010180984763, 'bull_tp_mult': 2.111370047154728, 'bull_tsl_mult': 0.25252923302057007, 'bull_time_stop': 69, 'bull_use_sma': False, 'bull_use_ema': True, 'bull_use_atr': False, 'bull_use_adx': False, 'bull_use_spike': True, 'bull_rsi_required': False, 'bear_strategy': 'mean_reversion', 'bear_bb_std_mult': 2.579708343728434, 'bear_rsi_os': 41, 'bear_rsi_ob': 73, 'bear_adx_thresh': 28.654308599503793, 'bear_atr_min_pct': 0.022739098897226084, 'bear_atr_max_pct': 0.07017584635474235, 'bear_tp_mult': 2.569200804555418, 'bear_tsl_mult': 0.9245904945424924, 'bear_time_stop': 237, 'bear_use_sma': True, 'bear_use_ema': True, 'bear_use_atr': True, 'bear_use_adx': True, 'bear_use_spike': True, 'bear_rsi_required': True, 'sideways_strategy': 'mean_reversion', 'sideways_bb_std_mult': 2.238990882100536, 'sideways_rsi_os': 45, 'sideways_rsi_ob': 59, 'sideways_adx_thresh': 26.357843403843475, 'sideways_atr_min_pct': 0.02927541708105124, 'sideways_atr_max_pct': 0.1036614130339404, 'sideways_tp_mult': 1.0964390818734908, 'sideways_tsl_mult': 0.7502365750796969, 'sideways_time_stop': 185, 'sideways_use_sma': True, 'sideways_use_ema': True, 'sideways_use_atr': False, 'sideways_use_adx': True, 'sideways_use_spike': True, 'sideways_rsi_required': True}.
[I 2025-08-30 15:38:25,783] Trial 513 finished with values: [-1000000000.0, 1000000000.0] and parameters: {'p_sma': 54, 'p_std': 58, 'p_atr': 9, 'p_adx': 25, 'rsi_period': 79, 'ema1': 23, 'ema2': 31, 'slip_atr_k': 0.05623175750423566, 'slip_spread_k': 0.47157869041435835, 'spread_hl_frac': 0.024521380357871433, 'bb_std_mult': 1.3863232095738154, 'rsi_os': 24, 'rsi_ob': 74, 'vol_spike': 0.18629022127732117, 'adx_thresh': 13.453376450365239, 'atr_min_pct': 0.014730718850447076, 'atr_max_pct': 0.07947540101739646, 'tp_mult': 2.21978906285687, 'tsl_mult': 0.7489046811157251, 'strategy': 'breakout', 'time_stop': 148, 'use_sma': False, 'use_atr': True, 'use_adx': False, 'use_ema': True, 'use_spike': False, 'rsi_required': False, 'edge_k': 0.243549026747944, 'edge_cap': 0.49352193929172605, 'bull_strategy': 'breakout', 'bull_bb_std_mult': 2.7104458564238625, 'bull_rsi_os': 39, 'bull_rsi_ob': 52, 'bull_adx_thresh': 7.319927422174539, 'bull_atr_min_pct': 0.025494715901730892, 'bull_atr_max_pct': 0.13355682344816308, 'bull_tp_mult': 2.1108259475917057, 'bull_tsl_mult': 0.24913639716936858, 'bull_time_stop': 185, 'bull_use_sma': False, 'bull_use_ema': True, 'bull_use_atr': False, 'bull_use_adx': False, 'bull_use_spike': True, 'bull_rsi_required': False, 'bear_strategy': 'mean_reversion', 'bear_bb_std_mult': 0.5702955556748789, 'bear_rsi_os': 28, 'bear_rsi_ob': 73, 'bear_adx_thresh': 28.426261305586234, 'bear_atr_min_pct': 0.022450109149240064, 'bear_atr_max_pct': 0.07043465472680331, 'bear_tp_mult': 2.4862696636747237, 'bear_tsl_mult': 0.9226816848934062, 'bear_time_stop': 64, 'bear_use_sma': True, 'bear_use_ema': True, 'bear_use_atr': True, 'bear_use_adx': True, 'bear_use_spike': True, 'bear_rsi_required': True, 'sideways_strategy': 'mean_reversion', 'sideways_bb_std_mult': 1.5716137284737197, 'sideways_rsi_os': 18, 'sideways_rsi_ob': 59, 'sideways_adx_thresh': 26.09374488087711, 'sideways_atr_min_pct': 0.0009299513041351912, 'sideways_atr_max_pct': 0.1019654528703826, 'sideways_tp_mult': 1.0856320169557847, 'sideways_tsl_mult': 0.9671909966494466, 'sideways_time_stop': 96, 'sideways_use_sma': True, 'sideways_use_ema': True, 'sideways_use_atr': False, 'sideways_use_adx': True, 'sideways_use_spike': True, 'sideways_rsi_required': True}.
[I 2025-08-30 15:38:27,111] Trial 517 finished with values: [-1000000000.0, 1000000000.0] and parameters: {'p_sma': 5, 'p_std': 59, 'p_atr': 15, 'p_adx': 25, 'rsi_period': 76, 'ema1': 29, 'ema2': 33, 'slip_atr_k': 0.0567230194630059, 'slip_spread_k': 0.03959955541449689, 'spread_hl_frac': 0.02448719767680592, 'bb_std_mult': 0.8738353529590759, 'rsi_os': 52, 'rsi_ob': 74, 'vol_spike': 0.1483380335316549, 'adx_thresh': 12.179843192484322, 'atr_min_pct': 0.011561820274038015, 'atr_max_pct': 0.035143874598219, 'tp_mult': 1.4418200940125996, 'tsl_mult': 0.7221738095587413, 'strategy': 'mean_reversion', 'time_stop': 250, 'use_sma': False, 'use_atr': True, 'use_adx': False, 'use_ema': True, 'use_spike': True, 'rsi_required': True, 'edge_k': 0.07325064670735426, 'edge_cap': 0.5030716068130399, 'bull_strategy': 'mean_reversion', 'bull_bb_std_mult': 2.5245734670659594, 'bull_rsi_os': 38, 'bull_rsi_ob': 49, 'bull_adx_thresh': 22.99574937650228, 'bull_atr_min_pct': 0.025353106953501448, 'bull_atr_max_pct': 0.05611880215769334, 'bull_tp_mult': 2.118007596121379, 'bull_tsl_mult': 0.8717842881524295, 'bull_time_stop': 182, 'bull_use_sma': False, 'bull_use_ema': False, 'bull_use_atr': False, 'bull_use_adx': False, 'bull_use_spike': True, 'bull_rsi_required': False, 'bear_strategy': 'mean_reversion', 'bear_bb_std_mult': 3.0345374997774797, 'bear_rsi_os': 20, 'bear_rsi_ob': 89, 'bear_adx_thresh': 28.969381261901376, 'bear_atr_min_pct': 0.023274873314294973, 'bear_atr_max_pct': 0.07026012936587138, 'bear_tp_mult': 1.4924271697691922, 'bear_tsl_mult': 0.9996131352337728, 'bear_time_stop': 65, 'bear_use_sma': True, 'bear_use_ema': True, 'bear_use_atr': True, 'bear_use_adx': False, 'bear_use_spike': False, 'bear_rsi_required': True, 'sideways_strategy': 'breakout', 'sideways_bb_std_mult': 2.8934763424446803, 'sideways_rsi_os': 12, 'sideways_rsi_ob': 57, 'sideways_adx_thresh': 30.455484293272292, 'sideways_atr_min_pct': 0.029234067792269502, 'sideways_atr_max_pct': 0.09997428576571948, 'sideways_tp_mult': 1.7293490040062023, 'sideways_tsl_mult': 0.7651271896135109, 'sideways_time_stop': 94, 'sideways_use_sma': True, 'sideways_use_ema': True, 'sideways_use_atr': True, 'sideways_use_adx': False, 'sideways_use_spike': True, 'sideways_rsi_required': False}.
[I 2025-08-30 15:38:28,066] Trial 521 finished with values: [-1000000000.0, 1000000000.0] and parameters: {'p_sma': 24, 'p_std': 34, 'p_atr': 15, 'p_adx': 20, 'rsi_period': 29, 'ema1': 30, 'ema2': 35, 'slip_atr_k': 0.1591394386188467, 'slip_spread_k': 0.9276242396568275, 'spread_hl_frac': 0.027802071535414495, 'bb_std_mult': 0.9392341628614334, 'rsi_os': 43, 'rsi_ob': 45, 'vol_spike': 0.13206580232987414, 'adx_thresh': 5.031916156868229, 'atr_min_pct': 0.013983098490815376, 'atr_max_pct': 0.0750824577087497, 'tp_mult': 1.6810309210134455, 'tsl_mult': 0.7654950970776402, 'strategy': 'mean_reversion', 'time_stop': 179, 'use_sma': False, 'use_atr': True, 'use_adx': False, 'use_ema': True, 'use_spike': True, 'rsi_required': True, 'edge_k': 0.1585445550087507, 'edge_cap': 0.5686179690616917, 'bull_strategy': 'mean_reversion', 'bull_bb_std_mult': 2.6385793292688673, 'bull_rsi_os': 51, 'bull_rsi_ob': 47, 'bull_adx_thresh': 15.470551541891382, 'bull_atr_min_pct': 0.013053476403076542, 'bull_atr_max_pct': 0.1379245936896114, 'bull_tp_mult': 2.039346853590981, 'bull_tsl_mult': 0.29088126057787445, 'bull_time_stop': 142, 'bull_use_sma': False, 'bull_use_ema': False, 'bull_use_atr': False, 'bull_use_adx': False, 'bull_use_spike': True, 'bull_rsi_required': False, 'bear_strategy': 'mean_reversion', 'bear_bb_std_mult': 1.656658850990688, 'bear_rsi_os': 31, 'bear_rsi_ob': 56, 'bear_adx_thresh': 29.549486178669994, 'bear_atr_min_pct': 0.021861579424331937, 'bear_atr_max_pct': 0.11915117024427797, 'bear_tp_mult': 1.720218244322933, 'bear_tsl_mult': 0.7385578591793724, 'bear_time_stop': 124, 'bear_use_sma': True, 'bear_use_ema': True, 'bear_use_atr': True, 'bear_use_adx': False, 'bear_use_spike': False, 'bear_rsi_required': True, 'sideways_strategy': 'breakout', 'sideways_bb_std_mult': 1.470503411563245, 'sideways_rsi_os': 41, 'sideways_rsi_ob': 58, 'sideways_adx_thresh': 28.335651017798963, 'sideways_atr_min_pct': 0.0011849328945766828, 'sideways_atr_max_pct': 0.14464426814235026, 'sideways_tp_mult': 2.365087069312414, 'sideways_tsl_mult': 0.9874209887861041, 'sideways_time_stop': 68, 'sideways_use_sma': True, 'sideways_use_ema': True, 'sideways_use_atr': True, 'sideways_use_adx': False, 'sideways_use_spike': True, 'sideways_rsi_required': False}.
[I 2025-08-30 15:39:11,756] Trial 518 finished with values: [-1000000000.0, 1000000000.0] and parameters: {'p_sma': 5, 'p_std': 59, 'p_atr': 15, 'p_adx': 11, 'rsi_period': 77, 'ema1': 23, 'ema2': 35, 'slip_atr_k': 0.17178227149572556, 'slip_spread_k': 0.8902494848234505, 'spread_hl_frac': 0.008069405083848988, 'bb_std_mult': 0.8982069262169807, 'rsi_os': 13, 'rsi_ob': 62, 'vol_spike': 0.16917923869078572, 'adx_thresh': 34.414716584866916, 'atr_min_pct': 0.01458853186137643, 'atr_max_pct': 0.08093226166497289, 'tp_mult': 2.1947463415544335, 'tsl_mult': 0.7592268867676224, 'strategy': 'mean_reversion', 'time_stop': 178, 'use_sma': False, 'use_atr': True, 'use_adx': False, 'use_ema': True, 'use_spike': True, 'rsi_required': True, 'edge_k': 0.2579535515161886, 'edge_cap': 0.5688255551112581, 'bull_strategy': 'mean_reversion', 'bull_bb_std_mult': 2.5169113877555804, 'bull_rsi_os': 49, 'bull_rsi_ob': 59, 'bull_adx_thresh': 31.760659923897638, 'bull_atr_min_pct': 0.02265177274111085, 'bull_atr_max_pct': 0.056436605477674706, 'bull_tp_mult': 2.0337011429310876, 'bull_tsl_mult': 0.34293791612059654, 'bull_time_stop': 186, 'bull_use_sma': False, 'bull_use_ema': True, 'bull_use_atr': False, 'bull_use_adx': False, 'bull_use_spike': True, 'bull_rsi_required': False, 'bear_strategy': 'mean_reversion', 'bear_bb_std_mult': 1.6383249160250115, 'bear_rsi_os': 43, 'bear_rsi_ob': 76, 'bear_adx_thresh': 29.17830776853834, 'bear_atr_min_pct': 0.023398344082274924, 'bear_atr_max_pct': 0.050936515124169274, 'bear_tp_mult': 1.6814885205253218, 'bear_tsl_mult': 0.9273617887735902, 'bear_time_stop': 238, 'bear_use_sma': True, 'bear_use_ema': True, 'bear_use_atr': True, 'bear_use_adx': False, 'bear_use_spike': False, 'bear_rsi_required': True, 'sideways_strategy': 'breakout', 'sideways_bb_std_mult': 1.4687933625569438, 'sideways_rsi_os': 45, 'sideways_rsi_ob': 64, 'sideways_adx_thresh': 28.41301256394406, 'sideways_atr_min_pct': 0.006642786249489767, 'sideways_atr_max_pct': 0.09894615348566733, 'sideways_tp_mult': 2.599946751588798, 'sideways_tsl_mult': 0.9818990692186949, 'sideways_time_stop': 183, 'sideways_use_sma': True, 'sideways_use_ema': True, 'sideways_use_atr': True, 'sideways_use_adx': False, 'sideways_use_spike': True, 'sideways_rsi_required': False}.
[I 2025-08-30 15:39:12,896] Trial 519 finished with values: [-0.016033773345811464, 0.01595168371907523] and parameters: {'p_sma': 5, 'p_std': 14, 'p_atr': 15, 'p_adx': 11, 'rsi_period': 21, 'ema1': 24, 'ema2': 33, 'slip_atr_k': 0.1553757939128142, 'slip_spread_k': 0.48027180095097816, 'spread_hl_frac': 0.027710729569254116, 'bb_std_mult': 1.082705198512252, 'rsi_os': 28, 'rsi_ob': 84, 'vol_spike': 0.1790139422379175, 'adx_thresh': 11.26756529359842, 'atr_min_pct': 0.0139487242120813, 'atr_max_pct': 0.07761627928983808, 'tp_mult': 2.8832479360904797, 'tsl_mult': 0.7607319830320155, 'strategy': 'mean_reversion', 'time_stop': 134, 'use_sma': False, 'use_atr': True, 'use_adx': False, 'use_ema': True, 'use_spike': True, 'rsi_required': True, 'edge_k': 0.17199391137726316, 'edge_cap': 0.5758912979169792, 'bull_strategy': 'mean_reversion', 'bull_bb_std_mult': 1.80336074960578, 'bull_rsi_os': 49, 'bull_rsi_ob': 49, 'bull_adx_thresh': 21.275888119616194, 'bull_atr_min_pct': 0.012353841209916519, 'bull_atr_max_pct': 0.13010654662759213, 'bull_tp_mult': 2.259212136527458, 'bull_tsl_mult': 0.023052952332946075, 'bull_time_stop': 211, 'bull_use_sma': False, 'bull_use_ema': False, 'bull_use_atr': False, 'bull_use_adx': False, 'bull_use_spike': True, 'bull_rsi_required': False, 'bear_strategy': 'mean_reversion', 'bear_bb_std_mult': 3.597393892642012, 'bear_rsi_os': 31, 'bear_rsi_ob': 76, 'bear_adx_thresh': 29.03899366431166, 'bear_atr_min_pct': 0.023384136437242485, 'bear_atr_max_pct': 0.07255801781210493, 'bear_tp_mult': 1.6634272724663146, 'bear_tsl_mult': 0.9977434007447639, 'bear_time_stop': 70, 'bear_use_sma': True, 'bear_use_ema': True, 'bear_use_atr': True, 'bear_use_adx': False, 'bear_use_spike': False, 'bear_rsi_required': True, 'sideways_strategy': 'breakout', 'sideways_bb_std_mult': 1.4827256291755082, 'sideways_rsi_os': 25, 'sideways_rsi_ob': 57, 'sideways_adx_thresh': 27.990688005473988, 'sideways_atr_min_pct': 0.00091619191639426, 'sideways_atr_max_pct': 0.09932060237645496, 'sideways_tp_mult': 2.3635850732556505, 'sideways_tsl_mult': 0.9834486928603421, 'sideways_time_stop': 285, 'sideways_use_sma': True, 'sideways_use_ema': True, 'sideways_use_atr': True, 'sideways_use_adx': False, 'sideways_use_spike': True, 'sideways_rsi_required': False}.
[I 2025-08-30 15:39:13,339] Trial 520 finished with values: [-0.025481351888105963, 0.025369300902267657] and parameters: {'p_sma': 5, 'p_std': 60, 'p_atr': 15, 'p_adx': 11, 'rsi_period': 25, 'ema1': 6, 'ema2': 35, 'slip_atr_k': 0.15820986398945508, 'slip_spread_k': 0.1146815673156307, 'spread_hl_frac': 0.029426509527702246, 'bb_std_mult': 1.7765719948631995, 'rsi_os': 43, 'rsi_ob': 70, 'vol_spike': 0.17941085301717513, 'adx_thresh': 12.204871845272194, 'atr_min_pct': 0.01377551910348202, 'atr_max_pct': 0.0747713890550694, 'tp_mult': 1.1775555572776193, 'tsl_mult': 0.7163567975876272, 'strategy': 'mean_reversion', 'time_stop': 139, 'use_sma': False, 'use_atr': True, 'use_adx': False, 'use_ema': True, 'use_spike': True, 'rsi_required': True, 'edge_k': 0.1643108822760444, 'edge_cap': 0.5659943775556524, 'bull_strategy': 'mean_reversion', 'bull_bb_std_mult': 1.828732034364756, 'bull_rsi_os': 49, 'bull_rsi_ob': 49, 'bull_adx_thresh': 21.225585162158566, 'bull_atr_min_pct': 0.019927906444985443, 'bull_atr_max_pct': 0.10419940501720047, 'bull_tp_mult': 2.0417754130067913, 'bull_tsl_mult': 0.29948727366652245, 'bull_time_stop': 211, 'bull_use_sma': False, 'bull_use_ema': False, 'bull_use_atr': False, 'bull_use_adx': False, 'bull_use_spike': True, 'bull_rsi_required': False, 'bear_strategy': 'mean_reversion', 'bear_bb_std_mult': 2.4145044624645378, 'bear_rsi_os': 31, 'bear_rsi_ob': 76, 'bear_adx_thresh': 29.28887466707619, 'bear_atr_min_pct': 0.023480077288116952, 'bear_atr_max_pct': 0.08289083390401653, 'bear_tp_mult': 1.582471674374709, 'bear_tsl_mult': 0.959015418388196, 'bear_time_stop': 203, 'bear_use_sma': True, 'bear_use_ema': True, 'bear_use_atr': True, 'bear_use_adx': False, 'bear_use_spike': False, 'bear_rsi_required': True, 'sideways_strategy': 'breakout', 'sideways_bb_std_mult': 0.5051186441693314, 'sideways_rsi_os': 41, 'sideways_rsi_ob': 58, 'sideways_adx_thresh': 28.517079199004613, 'sideways_atr_min_pct': 0.0013835014999012997, 'sideways_atr_max_pct': 0.024710721904308862, 'sideways_tp_mult': 2.3657031688018217, 'sideways_tsl_mult': 0.7009973229869686, 'sideways_time_stop': 69, 'sideways_use_sma': True, 'sideways_use_ema': True, 'sideways_use_atr': True, 'sideways_use_adx': False, 'sideways_use_spike': True, 'sideways_rsi_required': False}.
