[I 2025-08-30 14:46:03,141] Trial 210 finished with values: [-1000000000.0, 1000000000.0] and parameters: {'p_sma': 33, 'p_std': 45, 'p_atr': 19, 'p_adx': 22, 'rsi_period': 46, 'ema1': 23, 'ema2': 50, 'slip_atr_k': 0.008720753398767628, 'slip_spread_k': 0.6180487917106633, 'spread_hl_frac': 0.0015112577262128895, 'bb_std_mult': 3.263253526088495, 'rsi_os': 9, 'rsi_ob': 51, 'vol_spike': 0.2505264554232255, 'adx_thresh': 27.657542593200773, 'atr_min_pct': 0.005973966553632181, 'atr_max_pct': 0.09904395701169634, 'tp_mult': 1.3414509011667035, 'tsl_mult': 0.22036262293488174, 'strategy': 'mean_reversion', 'time_stop': 104, 'use_sma': True, 'use_atr': False, 'use_adx': False, 'use_ema': False, 'use_spike': False, 'rsi_required': False, 'edge_k': 1.518624167812279, 'edge_cap': 0.6053574681867817, 'bull_strategy': 'breakout', 'bull_bb_std_mult': 2.012427671263365, 'bull_rsi_os': 19, 'bull_rsi_ob': 88, 'bull_adx_thresh': 10.703999174548843, 'bull_atr_min_pct': 0.01519170561256569, 'bull_atr_max_pct': 0.1397770286969334, 'bull_tp_mult': 1.33084952212142, 'bull_tsl_mult': 0.5561485135817631, 'bull_time_stop': 281, 'bull_use_sma': False, 'bull_use_ema': False, 'bull_use_atr': True, 'bull_use_adx': True, 'bull_use_spike': False, 'bull_rsi_required': True, 'bear_strategy': 'mean_reversion', 'bear_bb_std_mult': 0.5008160920609586, 'bear_rsi_os': 5, 'bear_rsi_ob': 52, 'bear_adx_thresh': 17.421068295138227, 'bear_atr_min_pct': 0.00963275494881161, 'bear_atr_max_pct': 0.07649626872718757, 'bear_tp_mult': 2.736253249938086, 'bear_tsl_mult': 0.6350561365019645, 'bear_time_stop': 28, 'bear_use_sma': True, 'bear_use_ema': False, 'bear_use_atr': False, 'bear_use_adx': False, 'bear_use_spike': True, 'bear_rsi_required': False, 'sideways_strategy': 'breakout', 'sideways_bb_std_mult': 3.2260004494102352, 'sideways_rsi_os': 8, 'sideways_rsi_ob': 58, 'sideways_adx_thresh': 14.317271343589482, 'sideways_atr_min_pct': 0.018204993567136646, 'sideways_atr_max_pct': 0.08204390276062734, 'sideways_tp_mult': 2.8114026808224812, 'sideways_tsl_mult': 0.27859852780150035, 'sideways_time_stop': 163, 'sideways_use_sma': False, 'sideways_use_ema': False, 'sideways_use_atr': False, 'sideways_use_adx': True, 'sideways_use_spike': False, 'sideways_rsi_required': False}.
[I 2025-08-30 14:46:03,427] Trial 207 finished with values: [-1000000000.0, 1000000000.0] and parameters: {'p_sma': 33, 'p_std': 30, 'p_atr': 17, 'p_adx': 22, 'rsi_period': 47, 'ema1': 27, 'ema2': 50, 'slip_atr_k': 0.1430003959445993, 'slip_spread_k': 0.4726395043086801, 'spread_hl_frac': 0.01712527449137121, 'bb_std_mult': 2.8989932220406818, 'rsi_os': 35, 'rsi_ob': 89, 'vol_spike': 0.020225666840311657, 'adx_thresh': 21.754929590368015, 'atr_min_pct': 0.021551334433354948, 'atr_max_pct': 0.1013944886015191, 'tp_mult': 2.6023926758521383, 'tsl_mult': 0.9474935327038968, 'strategy': 'mean_reversion', 'time_stop': 30, 'use_sma': False, 'use_atr': False, 'use_adx': False, 'use_ema': False, 'use_spike': False, 'rsi_required': False, 'edge_k': 1.5026399060327886, 'edge_cap': 0.6816953285153563, 'bull_strategy': 'breakout', 'bull_bb_std_mult': 2.231758945443603, 'bull_rsi_os': 5, 'bull_rsi_ob': 76, 'bull_adx_thresh': 34.389151348757736, 'bull_atr_min_pct': 0.022276047002509892, 'bull_atr_max_pct': 0.01601093131266985, 'bull_tp_mult': 1.4092356465783595, 'bull_tsl_mult': 0.5675128693627538, 'bull_time_stop': 161, 'bull_use_sma': True, 'bull_use_ema': False, 'bull_use_atr': True, 'bull_use_adx': False, 'bull_use_spike': False, 'bull_rsi_required': True, 'bear_strategy': 'breakout', 'bear_bb_std_mult': 2.3725818442378506, 'bear_rsi_os': 25, 'bear_rsi_ob': 51, 'bear_adx_thresh': 17.307796915578823, 'bear_atr_min_pct': 0.0018339474945420556, 'bear_atr_max_pct': 0.02727925310200021, 'bear_tp_mult': 2.567245938053824, 'bear_tsl_mult': 0.21521552218834714, 'bear_time_stop': 81, 'bear_use_sma': False, 'bear_use_ema': True, 'bear_use_atr': False, 'bear_use_adx': False, 'bear_use_spike': False, 'bear_rsi_required': False, 'sideways_strategy': 'breakout', 'sideways_bb_std_mult': 3.3323529376361023, 'sideways_rsi_os': 31, 'sideways_rsi_ob': 57, 'sideways_adx_thresh': 14.68318380616627, 'sideways_atr_min_pct': 0.010466669384208736, 'sideways_atr_max_pct': 0.05579018517783257, 'sideways_tp_mult': 1.9583711638841326, 'sideways_tsl_mult': 0.40824775213568854, 'sideways_time_stop': 164, 'sideways_use_sma': False, 'sideways_use_ema': False, 'sideways_use_atr': False, 'sideways_use_adx': True, 'sideways_use_spike': False, 'sideways_rsi_required': False}.
[I 2025-08-30 14:46:03,437] Trial 208 finished with values: [-1000000000.0, 1000000000.0] and parameters: {'p_sma': 33, 'p_std': 30, 'p_atr': 19, 'p_adx': 23, 'rsi_period': 46, 'ema1': 23, 'ema2': 50, 'slip_atr_k': 0.10453249487423877, 'slip_spread_k': 0.26259651100999215, 'spread_hl_frac': 0.004049282175361639, 'bb_std_mult': 2.528954970949356, 'rsi_os': 33, 'rsi_ob': 89, 'vol_spike': 0.052261111039600724, 'adx_thresh': 27.64255768785845, 'atr_min_pct': 0.021806091320106698, 'atr_max_pct': 0.1028560651731916, 'tp_mult': 2.572936992844278, 'tsl_mult': 0.21072431075336845, 'strategy': 'mean_reversion', 'time_stop': 31, 'use_sma': False, 'use_atr': False, 'use_adx': True, 'use_ema': False, 'use_spike': False, 'rsi_required': False, 'edge_k': 1.5116707113692627, 'edge_cap': 0.6792148396709521, 'bull_strategy': 'breakout', 'bull_bb_std_mult': 2.688778695226847, 'bull_rsi_os': 44, 'bull_rsi_ob': 76, 'bull_adx_thresh': 22.910664015571278, 'bull_atr_min_pct': 0.018295725297944442, 'bull_atr_max_pct': 0.016643694335143348, 'bull_tp_mult': 1.7628170882812646, 'bull_tsl_mult': 0.8319684050582448, 'bull_time_stop': 158, 'bull_use_sma': False, 'bull_use_ema': False, 'bull_use_atr': True, 'bull_use_adx': True, 'bull_use_spike': False, 'bull_rsi_required': True, 'bear_strategy': 'breakout', 'bear_bb_std_mult': 1.1779968431632204, 'bear_rsi_os': 27, 'bear_rsi_ob': 51, 'bear_adx_thresh': 17.24683522006312, 'bear_atr_min_pct': 0.010914118643850505, 'bear_atr_max_pct': 0.026802697894822945, 'bear_tp_mult': 2.5081834204714464, 'bear_tsl_mult': 0.21462519312593434, 'bear_time_stop': 81, 'bear_use_sma': True, 'bear_use_ema': True, 'bear_use_atr': False, 'bear_use_adx': False, 'bear_use_spike': False, 'bear_rsi_required': False, 'sideways_strategy': 'breakout', 'sideways_bb_std_mult': 1.317784591006033, 'sideways_rsi_os': 30, 'sideways_rsi_ob': 90, 'sideways_adx_thresh': 17.055606541530164, 'sideways_atr_min_pct': 0.004212087485386592, 'sideways_atr_max_pct': 0.11932042288981606, 'sideways_tp_mult': 1.7198928861981275, 'sideways_tsl_mult': 0.10124609102708425, 'sideways_time_stop': 243, 'sideways_use_sma': False, 'sideways_use_ema': False, 'sideways_use_atr': False, 'sideways_use_adx': True, 'sideways_use_spike': False, 'sideways_rsi_required': False}.
[I 2025-08-30 14:46:03,628] Trial 209 finished with values: [-1000000000.0, 1000000000.0] and parameters: {'p_sma': 33, 'p_std': 30, 'p_atr': 18, 'p_adx': 23, 'rsi_period': 46, 'ema1': 28, 'ema2': 52, 'slip_atr_k': 0.008576548383774571, 'slip_spread_k': 0.2572922545269861, 'spread_hl_frac': 0.034928049645074385, 'bb_std_mult': 3.545032070912294, 'rsi_os': 48, 'rsi_ob': 51, 'vol_spike': 0.04262568218808191, 'adx_thresh': 21.496717702114893, 'atr_min_pct': 0.014410101853835476, 'atr_max_pct': 0.10298550148943465, 'tp_mult': 2.5795546260345215, 'tsl_mult': 0.0063222933773876, 'strategy': 'mean_reversion', 'time_stop': 30, 'use_sma': False, 'use_atr': False, 'use_adx': False, 'use_ema': False, 'use_spike': False, 'rsi_required': False, 'edge_k': 1.527731769165941, 'edge_cap': 0.6816635806074611, 'bull_strategy': 'breakout', 'bull_bb_std_mult': 2.5525074083684642, 'bull_rsi_os': 29, 'bull_rsi_ob': 75, 'bull_adx_thresh': 28.616597819941767, 'bull_atr_min_pct': 0.02427419835282972, 'bull_atr_max_pct': 0.14028006807005225, 'bull_tp_mult': 1.3281190610902567, 'bull_tsl_mult': 0.8337324049637451, 'bull_time_stop': 281, 'bull_use_sma': False, 'bull_use_ema': False, 'bull_use_atr': True, 'bull_use_adx': True, 'bull_use_spike': False, 'bull_rsi_required': True, 'bear_strategy': 'mean_reversion', 'bear_bb_std_mult': 2.3638151812018395, 'bear_rsi_os': 28, 'bear_rsi_ob': 92, 'bear_adx_thresh': 17.330895491621852, 'bear_atr_min_pct': 0.029151152093308964, 'bear_atr_max_pct': 0.028394738600048635, 'bear_tp_mult': 2.8914950381127094, 'bear_tsl_mult': 0.6232442925191498, 'bear_time_stop': 84, 'bear_use_sma': True, 'bear_use_ema': True, 'bear_use_atr': False, 'bear_use_adx': False, 'bear_use_spike': True, 'bear_rsi_required': False, 'sideways_strategy': 'breakout', 'sideways_bb_std_mult': 3.2990099249680522, 'sideways_rsi_os': 33, 'sideways_rsi_ob': 90, 'sideways_adx_thresh': 16.99986614420926, 'sideways_atr_min_pct': 0.019334138087763714, 'sideways_atr_max_pct': 0.08232894244749715, 'sideways_tp_mult': 1.9252586230134, 'sideways_tsl_mult': 0.4136557220485044, 'sideways_time_stop': 161, 'sideways_use_sma': False, 'sideways_use_ema': False, 'sideways_use_atr': False, 'sideways_use_adx': True, 'sideways_use_spike': False, 'sideways_rsi_required': True}.
[I 2025-08-30 14:46:04,137] Trial 211 finished with values: [-1000000000.0, 1000000000.0] and parameters: {'p_sma': 34, 'p_std': 29, 'p_atr': 11, 'p_adx': 23, 'rsi_period': 48, 'ema1': 28, 'ema2': 52, 'slip_atr_k': 0.01765094417419616, 'slip_spread_k': 0.19914679840828303, 'spread_hl_frac': 0.023108685173533337, 'bb_std_mult': 3.0802688080081264, 'rsi_os': 53, 'rsi_ob': 54, 'vol_spike': 0.23587379756742224, 'adx_thresh': 21.96924901114443, 'atr_min_pct': 0.014635970635634652, 'atr_max_pct': 0.010162488256224733, 'tp_mult': 2.5724736308397658, 'tsl_mult': 0.007593041466197381, 'strategy': 'mean_reversion', 'time_stop': 30, 'use_sma': True, 'use_atr': False, 'use_adx': False, 'use_ema': False, 'use_spike': False, 'rsi_required': False, 'edge_k': 0.2907537544332609, 'edge_cap': 0.9626884369709167, 'bull_strategy': 'breakout', 'bull_bb_std_mult': 2.704268462282432, 'bull_rsi_os': 38, 'bull_rsi_ob': 74, 'bull_adx_thresh': 14.602766946076496, 'bull_atr_min_pct': 0.001371269021204564, 'bull_atr_max_pct': 0.01750314654942026, 'bull_tp_mult': 1.382786431059778, 'bull_tsl_mult': 0.4910569888749053, 'bull_time_stop': 33, 'bull_use_sma': False, 'bull_use_ema': True, 'bull_use_atr': True, 'bull_use_adx': True, 'bull_use_spike': False, 'bull_rsi_required': True, 'bear_strategy': 'breakout', 'bear_bb_std_mult': 2.062430755153192, 'bear_rsi_os': 28, 'bear_rsi_ob': 95, 'bear_adx_thresh': 22.67081108363058, 'bear_atr_min_pct': 0.0283020424702074, 'bear_atr_max_pct': 0.02772568616634537, 'bear_tp_mult': 1.5086897834101167, 'bear_tsl_mult': 0.18691964022876753, 'bear_time_stop': 46, 'bear_use_sma': False, 'bear_use_ema': False, 'bear_use_atr': False, 'bear_use_adx': True, 'bear_use_spike': True, 'bear_rsi_required': False, 'sideways_strategy': 'breakout', 'sideways_bb_std_mult': 0.6753159894435437, 'sideways_rsi_os': 34, 'sideways_rsi_ob': 56, 'sideways_adx_thresh': 21.718242603691174, 'sideways_atr_min_pct': 0.004285384503849619, 'sideways_atr_max_pct': 0.07022684689943098, 'sideways_tp_mult': 2.7716820422510815, 'sideways_tsl_mult': 0.6548568244514009, 'sideways_time_stop': 126, 'sideways_use_sma': False, 'sideways_use_ema': False, 'sideways_use_atr': False, 'sideways_use_adx': True, 'sideways_use_spike': True, 'sideways_rsi_required': True}.
[I 2025-08-30 14:46:04,147] Trial 213 finished with values: [-1000000000.0, 1000000000.0] and parameters: {'p_sma': 30, 'p_std': 28, 'p_atr': 11, 'p_adx': 23, 'rsi_period': 49, 'ema1': 29, 'ema2': 52, 'slip_atr_k': 0.019248434948836306, 'slip_spread_k': 0.19626491619399572, 'spread_hl_frac': 0.006454572278317281, 'bb_std_mult': 1.8442757685796225, 'rsi_os': 50, 'rsi_ob': 54, 'vol_spike': 0.009119243989707482, 'adx_thresh': 19.887803732021357, 'atr_min_pct': 0.02364818463578123, 'atr_max_pct': 0.01946507446119363, 'tp_mult': 2.542423296145026, 'tsl_mult': 0.351098964810008, 'strategy': 'mean_reversion', 'time_stop': 11, 'use_sma': True, 'use_atr': True, 'use_adx': False, 'use_ema': True, 'use_spike': False, 'rsi_required': False, 'edge_k': 0.8175243904618379, 'edge_cap': 0.703301255582378, 'bull_strategy': 'breakout', 'bull_bb_std_mult': 3.366614430881571, 'bull_rsi_os': 18, 'bull_rsi_ob': 49, 'bull_adx_thresh': 14.495010330046641, 'bull_atr_min_pct': 0.023991613117473082, 'bull_atr_max_pct': 0.14968111090661185, 'bull_tp_mult': 1.28331106515557, 'bull_tsl_mult': 0.49870811374759666, 'bull_time_stop': 264, 'bull_use_sma': False, 'bull_use_ema': True, 'bull_use_atr': True, 'bull_use_adx': True, 'bull_use_spike': False, 'bull_rsi_required': True, 'bear_strategy': 'mean_reversion', 'bear_bb_std_mult': 1.2730267127030621, 'bear_rsi_os': 16, 'bear_rsi_ob': 95, 'bear_adx_thresh': 11.905248461775033, 'bear_atr_min_pct': 0.011744885870661841, 'bear_atr_max_pct': 0.1322166733023079, 'bear_tp_mult': 1.70114107479683, 'bear_tsl_mult': 0.17401272323974315, 'bear_time_stop': 44, 'bear_use_sma': False, 'bear_use_ema': False, 'bear_use_atr': False, 'bear_use_adx': True, 'bear_use_spike': True, 'bear_rsi_required': False, 'sideways_strategy': 'breakout', 'sideways_bb_std_mult': 3.066222606113819, 'sideways_rsi_os': 34, 'sideways_rsi_ob': 93, 'sideways_adx_thresh': 18.450313746384207, 'sideways_atr_min_pct': 0.019604691223959306, 'sideways_atr_max_pct': 0.07014348314704044, 'sideways_tp_mult': 2.7735743189259563, 'sideways_tsl_mult': 0.06703056565887905, 'sideways_time_stop': 17, 'sideways_use_sma': False, 'sideways_use_ema': False, 'sideways_use_atr': False, 'sideways_use_adx': True, 'sideways_use_spike': True, 'sideways_rsi_required': True}.
[I 2025-08-30 14:46:04,848] Trial 216 finished with values: [-1000000000.0, 1000000000.0] and parameters: {'p_sma': 36, 'p_std': 25, 'p_atr': 13, 'p_adx': 22, 'rsi_period': 19, 'ema1': 24, 'ema2': 50, 'slip_atr_k': 0.014289130436856805, 'slip_spread_k': 0.29715478480411767, 'spread_hl_frac': 0.0009121032348727749, 'bb_std_mult': 2.06311761413391, 'rsi_os': 35, 'rsi_ob': 92, 'vol_spike': 0.21943434052405847, 'adx_thresh': 19.987199099787905, 'atr_min_pct': 0.019457756146619584, 'atr_max_pct': 0.013807516121013913, 'tp_mult': 2.6720463613499397, 'tsl_mult': 0.04954826564558179, 'strategy': 'breakout', 'time_stop': 122, 'use_sma': True, 'use_atr': False, 'use_adx': False, 'use_ema': False, 'use_spike': True, 'rsi_required': True, 'edge_k': 0.49177539207491294, 'edge_cap': 0.24326647030562043, 'bull_strategy': 'breakout', 'bull_bb_std_mult': 2.4647936523188037, 'bull_rsi_os': 14, 'bull_rsi_ob': 65, 'bull_adx_thresh': 12.335730916071745, 'bull_atr_min_pct': 0.022979881754845326, 'bull_atr_max_pct': 0.12714290355611768, 'bull_tp_mult': 1.4918959879025058, 'bull_tsl_mult': 0.9876648824590035, 'bull_time_stop': 254, 'bull_use_sma': False, 'bull_use_ema': False, 'bull_use_atr': False, 'bull_use_adx': True, 'bull_use_spike': True, 'bull_rsi_required': False, 'bear_strategy': 'breakout', 'bear_bb_std_mult': 1.3634198552126575, 'bear_rsi_os': 14, 'bear_rsi_ob': 79, 'bear_adx_thresh': 18.23123615688194, 'bear_atr_min_pct': 0.012349812618803975, 'bear_atr_max_pct': 0.12182899935055395, 'bear_tp_mult': 1.0120819579603326, 'bear_tsl_mult': 0.23959910827399816, 'bear_time_stop': 52, 'bear_use_sma': False, 'bear_use_ema': False, 'bear_use_atr': True, 'bear_use_adx': False, 'bear_use_spike': True, 'bear_rsi_required': True, 'sideways_strategy': 'breakout', 'sideways_bb_std_mult': 3.2007426934434333, 'sideways_rsi_os': 29, 'sideways_rsi_ob': 81, 'sideways_adx_thresh': 17.5955049357749, 'sideways_atr_min_pct': 0.014960450310839306, 'sideways_atr_max_pct': 0.07491637999130847, 'sideways_tp_mult': 2.6896433912230915, 'sideways_tsl_mult': 0.20942513374042865, 'sideways_time_stop': 42, 'sideways_use_sma': True, 'sideways_use_ema': True, 'sideways_use_atr': False, 'sideways_use_adx': True, 'sideways_use_spike': True, 'sideways_rsi_required': True}.
[I 2025-08-30 14:46:32,122] Trial 214 finished with values: [-0.01568024187995598, 0.015639920272792436] and parameters: {'p_sma': 31, 'p_std': 28, 'p_atr': 13, 'p_adx': 22, 'rsi_period': 19, 'ema1': 28, 'ema2': 52, 'slip_atr_k': 0.017390151559434543, 'slip_spread_k': 0.9516691132365963, 'spread_hl_frac': 5.901688807729861e-05, 'bb_std_mult': 1.9625196518047008, 'rsi_os': 35, 'rsi_ob': 92, 'vol_spike': 0.1435079346389862, 'adx_thresh': 19.80762064295584, 'atr_min_pct': 0.02047808218083726, 'atr_max_pct': 0.11386383079239376, 'tp_mult': 2.5298557685164096, 'tsl_mult': 0.9998142417650967, 'strategy': 'mean_reversion', 'time_stop': 88, 'use_sma': True, 'use_atr': True, 'use_adx': False, 'use_ema': True, 'use_spike': False, 'rsi_required': False, 'edge_k': 0.8349222606947824, 'edge_cap': 0.25941982847535816, 'bull_strategy': 'breakout', 'bull_bb_std_mult': 3.342449253281503, 'bull_rsi_os': 15, 'bull_rsi_ob': 66, 'bull_adx_thresh': 12.60277474453927, 'bull_atr_min_pct': 0.0012977266182623115, 'bull_atr_max_pct': 0.02456859982087088, 'bull_tp_mult': 2.212689287524673, 'bull_tsl_mult': 0.9976560083231683, 'bull_time_stop': 257, 'bull_use_sma': False, 'bull_use_ema': True, 'bull_use_atr': False, 'bull_use_adx': True, 'bull_use_spike': False, 'bull_rsi_required': True, 'bear_strategy': 'breakout', 'bear_bb_std_mult': 1.7757588273112808, 'bear_rsi_os': 13, 'bear_rsi_ob': 45, 'bear_adx_thresh': 13.467040252860532, 'bear_atr_min_pct': 0.012260528731173238, 'bear_atr_max_pct': 0.0337703128029646, 'bear_tp_mult': 2.4029498522747574, 'bear_tsl_mult': 0.18290086161691588, 'bear_time_stop': 126, 'bear_use_sma': False, 'bear_use_ema': False, 'bear_use_atr': True, 'bear_use_adx': True, 'bear_use_spike': True, 'bear_rsi_required': False, 'sideways_strategy': 'breakout', 'sideways_bb_std_mult': 0.6763859595257713, 'sideways_rsi_os': 34, 'sideways_rsi_ob': 81, 'sideways_adx_thresh': 21.577757619698637, 'sideways_atr_min_pct': 0.00441255559523487, 'sideways_atr_max_pct': 0.10350944164867085, 'sideways_tp_mult': 2.6857312846375425, 'sideways_tsl_mult': 0.8376954191085435, 'sideways_time_stop': 110, 'sideways_use_sma': True, 'sideways_use_ema': False, 'sideways_use_atr': False, 'sideways_use_adx': True, 'sideways_use_spike': True, 'sideways_rsi_required': True}.
[I 2025-08-30 14:46:32,406] Trial 212 finished with values: [-1000000000.0, 1000000000.0] and parameters: {'p_sma': 30, 'p_std': 17, 'p_atr': 11, 'p_adx': 23, 'rsi_period': 19, 'ema1': 29, 'ema2': 52, 'slip_atr_k': 0.0192667009628673, 'slip_spread_k': 0.20042272546988785, 'spread_hl_frac': 0.0008152898484061195, 'bb_std_mult': 1.8775286473438433, 'rsi_os': 28, 'rsi_ob': 81, 'vol_spike': 0.12769316624340615, 'adx_thresh': 22.182549518165228, 'atr_min_pct': 0.010747479387501981, 'atr_max_pct': 0.05825082579728966, 'tp_mult': 2.1391785562096763, 'tsl_mult': 0.04758652172297356, 'strategy': 'mean_reversion', 'time_stop': 12, 'use_sma': True, 'use_atr': True, 'use_adx': False, 'use_ema': True, 'use_spike': False, 'rsi_required': False, 'edge_k': 0.12406077211361188, 'edge_cap': 0.9578218659137429, 'bull_strategy': 'breakout', 'bull_bb_std_mult': 3.357051652108863, 'bull_rsi_os': 38, 'bull_rsi_ob': 48, 'bull_adx_thresh': 9.766943656360956, 'bull_atr_min_pct': 0.029930877369150323, 'bull_atr_max_pct': 0.14526873312508592, 'bull_tp_mult': 1.5558436064072616, 'bull_tsl_mult': 0.9950534059688998, 'bull_time_stop': 254, 'bull_use_sma': False, 'bull_use_ema': True, 'bull_use_atr': True, 'bull_use_adx': True, 'bull_use_spike': False, 'bull_rsi_required': True, 'bear_strategy': 'mean_reversion', 'bear_bb_std_mult': 2.6081237106474697, 'bear_rsi_os': 53, 'bear_rsi_ob': 60, 'bear_adx_thresh': 15.735936925123811, 'bear_atr_min_pct': 0.011760677239252547, 'bear_atr_max_pct': 0.10384012182811814, 'bear_tp_mult': 1.6979867338545978, 'bear_tsl_mult': 0.1596486150826224, 'bear_time_stop': 47, 'bear_use_sma': False, 'bear_use_ema': False, 'bear_use_atr': False, 'bear_use_adx': True, 'bear_use_spike': True, 'bear_rsi_required': False, 'sideways_strategy': 'breakout', 'sideways_bb_std_mult': 3.0741700563886996, 'sideways_rsi_os': 34, 'sideways_rsi_ob': 93, 'sideways_adx_thresh': 21.684748115150224, 'sideways_atr_min_pct': 0.005998658090614171, 'sideways_atr_max_pct': 0.0859823503918833, 'sideways_tp_mult': 2.687595046368685, 'sideways_tsl_mult': 0.7937027562356369, 'sideways_time_stop': 223, 'sideways_use_sma': False, 'sideways_use_ema': False, 'sideways_use_atr': False, 'sideways_use_adx': True, 'sideways_use_spike': True, 'sideways_rsi_required': True}.
