[I 2025-08-30 15:09:47,302] Trial 379 finished with values: [-1000000000.0, 1000000000.0] and parameters: {'p_sma': 8, 'p_std': 59, 'p_atr': 28, 'p_adx': 24, 'rsi_period': 83, 'ema1': 7, 'ema2': 20, 'slip_atr_k': 0.045308921185717145, 'slip_spread_k': 0.9192622836816471, 'spread_hl_frac': 0.030616862371419636, 'bb_std_mult': 3.589988845304542, 'rsi_os': 23, 'rsi_ob': 72, 'vol_spike': 0.19298494132847022, 'adx_thresh': 29.00840418910362, 'atr_min_pct': 0.015608179881402584, 'atr_max_pct': 0.07565936706556692, 'tp_mult': 1.5714350420494847, 'tsl_mult': 0.07117222024928221, 'strategy': 'breakout', 'time_stop': 122, 'use_sma': False, 'use_atr': False, 'use_adx': False, 'use_ema': True, 'use_spike': True, 'rsi_required': True, 'edge_k': 0.9248591591118436, 'edge_cap': 0.5715514066779469, 'bull_strategy': 'mean_reversion', 'bull_bb_std_mult': 2.5278121675787015, 'bull_rsi_os': 54, 'bull_rsi_ob': 92, 'bull_adx_thresh': 23.633515503563757, 'bull_atr_min_pct': 0.014822031497723761, 'bull_atr_max_pct': 0.07307186493168573, 'bull_tp_mult': 1.7758583380112187, 'bull_tsl_mult': 0.9586579006443876, 'bull_time_stop': 139, 'bull_use_sma': False, 'bull_use_ema': True, 'bull_use_atr': False, 'bull_use_adx': False, 'bull_use_spike': False, 'bull_rsi_required': False, 'bear_strategy': 'mean_reversion', 'bear_bb_std_mult': 0.6277675980570738, 'bear_rsi_os': 7, 'bear_rsi_ob': 77, 'bear_adx_thresh': 11.88906538204378, 'bear_atr_min_pct': 0.02198216833106109, 'bear_atr_max_pct': 0.014863719308378185, 'bear_tp_mult': 1.6641031541510345, 'bear_tsl_mult': 0.7455652471602292, 'bear_time_stop': 71, 'bear_use_sma': True, 'bear_use_ema': True, 'bear_use_atr': True, 'bear_use_adx': True, 'bear_use_spike': False, 'bear_rsi_required': True, 'sideways_strategy': 'breakout', 'sideways_bb_std_mult': 2.028701603909626, 'sideways_rsi_os': 39, 'sideways_rsi_ob': 57, 'sideways_adx_thresh': 26.531485445954324, 'sideways_atr_min_pct': 0.0147307609235249, 'sideways_atr_max_pct': 0.1022223164025604, 'sideways_tp_mult': 1.3771945463445423, 'sideways_tsl_mult': 0.7700956472156353, 'sideways_time_stop': 30, 'sideways_use_sma': False, 'sideways_use_ema': True, 'sideways_use_atr': True, 'sideways_use_adx': False, 'sideways_use_spike': True, 'sideways_rsi_required': False}.
[I 2025-08-30 15:09:49,536] Trial 378 finished with values: [-1000000000.0, 1000000000.0] and parameters: {'p_sma': 8, 'p_std': 57, 'p_atr': 16, 'p_adx': 24, 'rsi_period': 82, 'ema1': 17, 'ema2': 20, 'slip_atr_k': 0.07165852410739192, 'slip_spread_k': 0.6126148174127418, 'spread_hl_frac': 0.03218065453151012, 'bb_std_mult': 3.593572316172522, 'rsi_os': 26, 'rsi_ob': 72, 'vol_spike': 0.1965307073338685, 'adx_thresh': 28.853477684181232, 'atr_min_pct': 0.015641322221322643, 'atr_max_pct': 0.07727183535059115, 'tp_mult': 1.589277395904663, 'tsl_mult': 0.12214231814136978, 'strategy': 'breakout', 'time_stop': 63, 'use_sma': False, 'use_atr': False, 'use_adx': False, 'use_ema': True, 'use_spike': True, 'rsi_required': True, 'edge_k': 0.912021617511119, 'edge_cap': 0.5825922666439527, 'bull_strategy': 'mean_reversion', 'bull_bb_std_mult': 2.503329657597589, 'bull_rsi_os': 34, 'bull_rsi_ob': 92, 'bull_adx_thresh': 23.734418156216183, 'bull_atr_min_pct': 0.006760397935679931, 'bull_atr_max_pct': 0.07360910946180672, 'bull_tp_mult': 1.7736334584541067, 'bull_tsl_mult': 0.0015904225639362668, 'bull_time_stop': 134, 'bull_use_sma': False, 'bull_use_ema': True, 'bull_use_atr': False, 'bull_use_adx': False, 'bull_use_spike': False, 'bull_rsi_required': False, 'bear_strategy': 'mean_reversion', 'bear_bb_std_mult': 0.6595765409566647, 'bear_rsi_os': 7, 'bear_rsi_ob': 77, 'bear_adx_thresh': 29.06309022587227, 'bear_atr_min_pct': 0.006895166301814876, 'bear_atr_max_pct': 0.05373366102935656, 'bear_tp_mult': 2.3887349094605335, 'bear_tsl_mult': 0.06362437417684487, 'bear_time_stop': 83, 'bear_use_sma': True, 'bear_use_ema': True, 'bear_use_atr': True, 'bear_use_adx': True, 'bear_use_spike': False, 'bear_rsi_required': True, 'sideways_strategy': 'breakout', 'sideways_bb_std_mult': 1.5386005442927921, 'sideways_rsi_os': 12, 'sideways_rsi_ob': 57, 'sideways_adx_thresh': 25.90022809611588, 'sideways_atr_min_pct': 0.02199068524148637, 'sideways_atr_max_pct': 0.10985909814213199, 'sideways_tp_mult': 2.5066256377019056, 'sideways_tsl_mult': 0.602394388004413, 'sideways_time_stop': 29, 'sideways_use_sma': False, 'sideways_use_ema': True, 'sideways_use_atr': True, 'sideways_use_adx': False, 'sideways_use_spike': True, 'sideways_rsi_required': False}.
[I 2025-08-30 15:09:51,245] Trial 380 finished with values: [-1000000000.0, 1000000000.0] and parameters: {'p_sma': 9, 'p_std': 59, 'p_atr': 20, 'p_adx': 24, 'rsi_period': 84, 'ema1': 16, 'ema2': 20, 'slip_atr_k': 0.042958455095944, 'slip_spread_k': 0.618693431386304, 'spread_hl_frac': 0.030248993250015274, 'bb_std_mult': 3.5965749063333208, 'rsi_os': 22, 'rsi_ob': 72, 'vol_spike': 0.19749353771680284, 'adx_thresh': 10.583149545737816, 'atr_min_pct': 0.01569127496161795, 'atr_max_pct': 0.08048047637354888, 'tp_mult': 1.5661384604615856, 'tsl_mult': 0.11899743570385227, 'strategy': 'breakout', 'time_stop': 124, 'use_sma': False, 'use_atr': False, 'use_adx': False, 'use_ema': True, 'use_spike': True, 'rsi_required': True, 'edge_k': 0.9232881695021802, 'edge_cap': 0.5971265324047206, 'bull_strategy': 'mean_reversion', 'bull_bb_std_mult': 2.770587868103639, 'bull_rsi_os': 37, 'bull_rsi_ob': 94, 'bull_adx_thresh': 22.703993740467986, 'bull_atr_min_pct': 0.015393416668613599, 'bull_atr_max_pct': 0.06458117104508056, 'bull_tp_mult': 1.7704676919847344, 'bull_tsl_mult': 0.6540239872177827, 'bull_time_stop': 137, 'bull_use_sma': True, 'bull_use_ema': True, 'bull_use_atr': False, 'bull_use_adx': False, 'bull_use_spike': False, 'bull_rsi_required': False, 'bear_strategy': 'mean_reversion', 'bear_bb_std_mult': 0.6375742937331252, 'bear_rsi_os': 7, 'bear_rsi_ob': 77, 'bear_adx_thresh': 29.240700421427725, 'bear_atr_min_pct': 0.007000080723135729, 'bear_atr_max_pct': 0.014703419316913567, 'bear_tp_mult': 2.41171246384603, 'bear_tsl_mult': 0.5336125425221447, 'bear_time_stop': 83, 'bear_use_sma': True, 'bear_use_ema': True, 'bear_use_atr': True, 'bear_use_adx': True, 'bear_use_spike': False, 'bear_rsi_required': True, 'sideways_strategy': 'breakout', 'sideways_bb_std_mult': 2.0624697585224236, 'sideways_rsi_os': 49, 'sideways_rsi_ob': 57, 'sideways_adx_thresh': 25.97549279528978, 'sideways_atr_min_pct': 0.01477526201316583, 'sideways_atr_max_pct': 0.10573922853511106, 'sideways_tp_mult': 2.4991847164187564, 'sideways_tsl_mult': 0.6051871701970076, 'sideways_time_stop': 281, 'sideways_use_sma': False, 'sideways_use_ema': True, 'sideways_use_atr': True, 'sideways_use_adx': False, 'sideways_use_spike': True, 'sideways_rsi_required': False}.
[I 2025-08-30 15:09:52,278] Trial 381 finished with values: [-0.011844374083340714, 0.011751680087793363] and parameters: {'p_sma': 9, 'p_std': 59, 'p_atr': 16, 'p_adx': 24, 'rsi_period': 80, 'ema1': 18, 'ema2': 20, 'slip_atr_k': 0.04609927844331105, 'slip_spread_k': 0.6201434865625511, 'spread_hl_frac': 0.03204873657680944, 'bb_std_mult': 3.599623899676659, 'rsi_os': 23, 'rsi_ob': 77, 'vol_spike': 0.19813095656328755, 'adx_thresh': 10.72836557505706, 'atr_min_pct': 0.01569385319277157, 'atr_max_pct': 0.07751738577978658, 'tp_mult': 1.713915613911313, 'tsl_mult': 0.12476619837410943, 'strategy': 'breakout', 'time_stop': 88, 'use_sma': False, 'use_atr': False, 'use_adx': False, 'use_ema': True, 'use_spike': True, 'rsi_required': True, 'edge_k': 0.9202004227382539, 'edge_cap': 0.5644403547385171, 'bull_strategy': 'mean_reversion', 'bull_bb_std_mult': 2.7600991947876876, 'bull_rsi_os': 34, 'bull_rsi_ob': 66, 'bull_adx_thresh': 22.733112530381835, 'bull_atr_min_pct': 0.01554358667438793, 'bull_atr_max_pct': 0.05985404341683849, 'bull_tp_mult': 1.9350363024628365, 'bull_tsl_mult': 0.654278143521328, 'bull_time_stop': 132, 'bull_use_sma': True, 'bull_use_ema': True, 'bull_use_atr': False, 'bull_use_adx': False, 'bull_use_spike': False, 'bull_rsi_required': False, 'bear_strategy': 'mean_reversion', 'bear_bb_std_mult': 0.6592317210360648, 'bear_rsi_os': 7, 'bear_rsi_ob': 77, 'bear_adx_thresh': 27.8086985386407, 'bear_atr_min_pct': 0.007069908997376695, 'bear_atr_max_pct': 0.017582866117330575, 'bear_tp_mult': 1.5453541800251815, 'bear_tsl_mult': 0.7075189113651827, 'bear_time_stop': 84, 'bear_use_sma': True, 'bear_use_ema': True, 'bear_use_atr': True, 'bear_use_adx': True, 'bear_use_spike': False, 'bear_rsi_required': True, 'sideways_strategy': 'breakout', 'sideways_bb_std_mult': 1.51582539772242, 'sideways_rsi_os': 39, 'sideways_rsi_ob': 57, 'sideways_adx_thresh': 25.950509164286405, 'sideways_atr_min_pct': 5.126331524265334e-05, 'sideways_atr_max_pct': 0.10189141490283556, 'sideways_tp_mult': 2.444363648067939, 'sideways_tsl_mult': 0.8333582148930292, 'sideways_time_stop': 30, 'sideways_use_sma': False, 'sideways_use_ema': True, 'sideways_use_atr': True, 'sideways_use_adx': False, 'sideways_use_spike': True, 'sideways_rsi_required': False}.
[I 2025-08-30 15:10:44,410] Trial 384 finished with values: [-1000000000.0, 1000000000.0] and parameters: {'p_sma': 60, 'p_std': 56, 'p_atr': 17, 'p_adx': 25, 'rsi_period': 80, 'ema1': 29, 'ema2': 41, 'slip_atr_k': 0.04762919629124865, 'slip_spread_k': 0.8453780067311438, 'spread_hl_frac': 0.035233874280474343, 'bb_std_mult': 3.4991548908650048, 'rsi_os': 24, 'rsi_ob': 74, 'vol_spike': 0.2007460233250208, 'adx_thresh': 29.0443673710813, 'atr_min_pct': 0.014835506998449606, 'atr_max_pct': 0.07388534663696274, 'tp_mult': 1.702947076305727, 'tsl_mult': 0.13640412592634962, 'strategy': 'breakout', 'time_stop': 182, 'use_sma': False, 'use_atr': False, 'use_adx': True, 'use_ema': True, 'use_spike': True, 'rsi_required': True, 'edge_k': 0.9868306060671549, 'edge_cap': 0.5531451542658136, 'bull_strategy': 'mean_reversion', 'bull_bb_std_mult': 2.659130287329964, 'bull_rsi_os': 43, 'bull_rsi_ob': 89, 'bull_adx_thresh': 22.591769105890787, 'bull_atr_min_pct': 0.007234996455859987, 'bull_atr_max_pct': 0.0619635929994854, 'bull_tp_mult': 1.8996981750160562, 'bull_tsl_mult': 0.618294305537127, 'bull_time_stop': 131, 'bull_use_sma': True, 'bull_use_ema': False, 'bull_use_atr': False, 'bull_use_adx': False, 'bull_use_spike': False, 'bull_rsi_required': False, 'bear_strategy': 'mean_reversion', 'bear_bb_std_mult': 0.7622630894221886, 'bear_rsi_os': 6, 'bear_rsi_ob': 75, 'bear_adx_thresh': 26.745169078559233, 'bear_atr_min_pct': 0.0058487758205278285, 'bear_atr_max_pct': 0.017250461772864725, 'bear_tp_mult': 1.6070157041698128, 'bear_tsl_mult': 0.07568625242540239, 'bear_time_stop': 289, 'bear_use_sma': True, 'bear_use_ema': True, 'bear_use_atr': True, 'bear_use_adx': False, 'bear_use_spike': False, 'bear_rsi_required': True, 'sideways_strategy': 'mean_reversion', 'sideways_bb_std_mult': 1.814201599571787, 'sideways_rsi_os': 26, 'sideways_rsi_ob': 62, 'sideways_adx_thresh': 24.728225854521952, 'sideways_atr_min_pct': 3.2888826235722324e-05, 'sideways_atr_max_pct': 0.09730079898109247, 'sideways_tp_mult': 2.4489510317297216, 'sideways_tsl_mult': 0.8299923963116982, 'sideways_time_stop': 26, 'sideways_use_sma': True, 'sideways_use_ema': True, 'sideways_use_atr': True, 'sideways_use_adx': False, 'sideways_use_spike': True, 'sideways_rsi_required': False}.
[I 2025-08-30 15:10:45,672] Trial 385 finished with values: [-1000000000.0, 1000000000.0] and parameters: {'p_sma': 11, 'p_std': 56, 'p_atr': 26, 'p_adx': 24, 'rsi_period': 80, 'ema1': 23, 'ema2': 21, 'slip_atr_k': 0.04822716539946031, 'slip_spread_k': 0.594008064483704, 'spread_hl_frac': 0.041758492056468366, 'bb_std_mult': 0.8338806096557088, 'rsi_os': 24, 'rsi_ob': 77, 'vol_spike': 0.14986532370441705, 'adx_thresh': 7.3312383235201946, 'atr_min_pct': 0.006493146160154412, 'atr_max_pct': 0.0743743722711465, 'tp_mult': 1.682464351332735, 'tsl_mult': 0.10455703608933736, 'strategy': 'breakout', 'time_stop': 104, 'use_sma': False, 'use_atr': False, 'use_adx': True, 'use_ema': True, 'use_spike': True, 'rsi_required': True, 'edge_k': 1.041500722443953, 'edge_cap': 0.5480153225725394, 'bull_strategy': 'mean_reversion', 'bull_bb_std_mult': 2.6722188550874444, 'bull_rsi_os': 32, 'bull_rsi_ob': 89, 'bull_adx_thresh': 22.775819141686, 'bull_atr_min_pct': 0.01623528345677959, 'bull_atr_max_pct': 0.061240633985806286, 'bull_tp_mult': 1.8713809346186012, 'bull_tsl_mult': 0.6012008645052123, 'bull_time_stop': 175, 'bull_use_sma': True, 'bull_use_ema': False, 'bull_use_atr': False, 'bull_use_adx': False, 'bull_use_spike': False, 'bull_rsi_required': False, 'bear_strategy': 'mean_reversion', 'bear_bb_std_mult': 0.7413741439654885, 'bear_rsi_os': 5, 'bear_rsi_ob': 75, 'bear_adx_thresh': 27.59128360943885, 'bear_atr_min_pct': 0.020215962848443937, 'bear_atr_max_pct': 0.017713089335882705, 'bear_tp_mult': 2.5685839682492597, 'bear_tsl_mult': 0.365696718981793, 'bear_time_stop': 211, 'bear_use_sma': True, 'bear_use_ema': True, 'bear_use_atr': True, 'bear_use_adx': False, 'bear_use_spike': False, 'bear_rsi_required': True, 'sideways_strategy': 'mean_reversion', 'sideways_bb_std_mult': 2.2899859436541234, 'sideways_rsi_os': 40, 'sideways_rsi_ob': 61, 'sideways_adx_thresh': 25.01365816632037, 'sideways_atr_min_pct': 0.019368427214475396, 'sideways_atr_max_pct': 0.09562918281833865, 'sideways_tp_mult': 2.3595075836397457, 'sideways_tsl_mult': 0.8372142084667434, 'sideways_time_stop': 170, 'sideways_use_sma': False, 'sideways_use_ema': True, 'sideways_use_atr': True, 'sideways_use_adx': False, 'sideways_use_spike': True, 'sideways_rsi_required': False}.
[I 2025-08-30 15:10:46,247] Trial 383 finished with values: [-1000000000.0, 1000000000.0] and parameters: {'p_sma': 11, 'p_std': 56, 'p_atr': 20, 'p_adx': 24, 'rsi_period': 80, 'ema1': 23, 'ema2': 19, 'slip_atr_k': 0.04840595587238903, 'slip_spread_k': 0.8468107650268591, 'spread_hl_frac': 0.046312927644666935, 'bb_std_mult': 1.6420249711229724, 'rsi_os': 23, 'rsi_ob': 77, 'vol_spike': 0.14127571085570317, 'adx_thresh': 10.738298013491638, 'atr_min_pct': 0.014933276904043415, 'atr_max_pct': 0.08102525302905936, 'tp_mult': 1.700760903368199, 'tsl_mult': 0.12219891038934359, 'strategy': 'breakout', 'time_stop': 271, 'use_sma': False, 'use_atr': False, 'use_adx': False, 'use_ema': True, 'use_spike': True, 'rsi_required': True, 'edge_k': 0.9812523343799089, 'edge_cap': 0.6035384505593602, 'bull_strategy': 'mean_reversion', 'bull_bb_std_mult': 2.772393449381208, 'bull_rsi_os': 32, 'bull_rsi_ob': 94, 'bull_adx_thresh': 22.705696264625157, 'bull_atr_min_pct': 0.007311840369971333, 'bull_atr_max_pct': 0.06176217562355887, 'bull_tp_mult': 1.9469390747800697, 'bull_tsl_mult': 0.598846742382691, 'bull_time_stop': 140, 'bull_use_sma': True, 'bull_use_ema': False, 'bull_use_atr': False, 'bull_use_adx': False, 'bull_use_spike': False, 'bull_rsi_required': False, 'bear_strategy': 'mean_reversion', 'bear_bb_std_mult': 0.7603827006906863, 'bear_rsi_os': 6, 'bear_rsi_ob': 75, 'bear_adx_thresh': 27.692179364862756, 'bear_atr_min_pct': 0.025213388406367686, 'bear_atr_max_pct': 0.08784811283844463, 'bear_tp_mult': 1.5854048032158845, 'bear_tsl_mult': 0.7159876441811479, 'bear_time_stop': 210, 'bear_use_sma': True, 'bear_use_ema': True, 'bear_use_atr': True, 'bear_use_adx': False, 'bear_use_spike': False, 'bear_rsi_required': True, 'sideways_strategy': 'mean_reversion', 'sideways_bb_std_mult': 2.2750972245640164, 'sideways_rsi_os': 39, 'sideways_rsi_ob': 62, 'sideways_adx_thresh': 24.691334450081257, 'sideways_atr_min_pct': 7.086017018659513e-05, 'sideways_atr_max_pct': 0.097401073800214, 'sideways_tp_mult': 2.3508622756209574, 'sideways_tsl_mult': 0.7863001742110929, 'sideways_time_stop': 112, 'sideways_use_sma': False, 'sideways_use_ema': True, 'sideways_use_atr': True, 'sideways_use_adx': False, 'sideways_use_spike': True, 'sideways_rsi_required': False}.
[I 2025-08-30 15:10:47,640] Trial 382 finished with values: [-1000000000.0, 1000000000.0] and parameters: {'p_sma': 10, 'p_std': 56, 'p_atr': 20, 'p_adx': 24, 'rsi_period': 80, 'ema1': 29, 'ema2': 21, 'slip_atr_k': 0.04764149656931297, 'slip_spread_k': 0.6213387783874633, 'spread_hl_frac': 0.041606130531202073, 'bb_std_mult': 3.5991479112391556, 'rsi_os': 26, 'rsi_ob': 77, 'vol_spike': 0.14309121993255425, 'adx_thresh': 14.475395149958937, 'atr_min_pct': 0.011313787728363122, 'atr_max_pct': 0.0815952158783773, 'tp_mult': 1.713119802804096, 'tsl_mult': 0.11791100473706631, 'strategy': 'breakout', 'time_stop': 288, 'use_sma': False, 'use_atr': False, 'use_adx': False, 'use_ema': True, 'use_spike': True, 'rsi_required': True, 'edge_k': 1.0389224038362301, 'edge_cap': 0.5507954951076653, 'bull_strategy': 'mean_reversion', 'bull_bb_std_mult': 0.5740797369552397, 'bull_rsi_os': 37, 'bull_rsi_ob': 89, 'bull_adx_thresh': 22.698936827833535, 'bull_atr_min_pct': 0.0070210624298582035, 'bull_atr_max_pct': 0.06369631258241215, 'bull_tp_mult': 1.765734183949832, 'bull_tsl_mult': 0.6496746979096802, 'bull_time_stop': 132, 'bull_use_sma': True, 'bull_use_ema': True, 'bull_use_atr': False, 'bull_use_adx': False, 'bull_use_spike': False, 'bull_rsi_required': False, 'bear_strategy': 'mean_reversion', 'bear_bb_std_mult': 0.6821604491957233, 'bear_rsi_os': 6, 'bear_rsi_ob': 75, 'bear_adx_thresh': 27.547152700145652, 'bear_atr_min_pct': 0.0203961186959941, 'bear_atr_max_pct': 0.017650686808763333, 'bear_tp_mult': 2.415223324369675, 'bear_tsl_mult': 0.3724374722158611, 'bear_time_stop': 82, 'bear_use_sma': True, 'bear_use_ema': True, 'bear_use_atr': True, 'bear_use_adx': True, 'bear_use_spike': False, 'bear_rsi_required': True, 'sideways_strategy': 'breakout', 'sideways_bb_std_mult': 1.797952697069813, 'sideways_rsi_os': 39, 'sideways_rsi_ob': 57, 'sideways_adx_thresh': 25.91697377160025, 'sideways_atr_min_pct': 0.001460386515431816, 'sideways_atr_max_pct': 0.09693648720274713, 'sideways_tp_mult': 2.499251580263257, 'sideways_tsl_mult': 0.6102820232856355, 'sideways_time_stop': 114, 'sideways_use_sma': False, 'sideways_use_ema': True, 'sideways_use_atr': True, 'sideways_use_adx': False, 'sideways_use_spike': True, 'sideways_rsi_required': False}.
[I 2025-08-30 15:11:38,192] Trial 386 finished with values: [-1000000000.0, 1000000000.0] and parameters: {'p_sma': 52, 'p_std': 56, 'p_atr': 16, 'p_adx': 24, 'rsi_period': 79, 'ema1': 11, 'ema2': 19, 'slip_atr_k': 0.052188796671003214, 'slip_spread_k': 0.9786190675459032, 'spread_hl_frac': 0.023350146362112075, 'bb_std_mult': 3.5231206301309097, 'rsi_os': 24, 'rsi_ob': 77, 'vol_spike': 0.1528545487020576, 'adx_thresh': 7.73828209806895, 'atr_min_pct': 0.0007713454208362926, 'atr_max_pct': 0.07929348845821284, 'tp_mult': 1.6768435836287627, 'tsl_mult': 0.06912822642509703, 'strategy': 'breakout', 'time_stop': 87, 'use_sma': False, 'use_atr': True, 'use_adx': False, 'use_ema': True, 'use_spike': True, 'rsi_required': True, 'edge_k': 1.043416375756898, 'edge_cap': 0.6062711674622879, 'bull_strategy': 'mean_reversion', 'bull_bb_std_mult': 2.632587326632343, 'bull_rsi_os': 32, 'bull_rsi_ob': 89, 'bull_adx_thresh': 23.064195468220046, 'bull_atr_min_pct': 0.009344841814092487, 'bull_atr_max_pct': 0.06932046269049245, 'bull_tp_mult': 1.94908875881027, 'bull_tsl_mult': 0.9049827574436551, 'bull_time_stop': 141, 'bull_use_sma': False, 'bull_use_ema': False, 'bull_use_atr': False, 'bull_use_adx': False, 'bull_use_spike': True, 'bull_rsi_required': False, 'bear_strategy': 'mean_reversion', 'bear_bb_std_mult': 0.7487642850474365, 'bear_rsi_os': 23, 'bear_rsi_ob': 75, 'bear_adx_thresh': 27.707863149701453, 'bear_atr_min_pct': 0.02054191864982789, 'bear_atr_max_pct': 0.013627716067925453, 'bear_tp_mult': 1.3884026474818387, 'bear_tsl_mult': 0.36504217474418044, 'bear_time_stop': 217, 'bear_use_sma': True, 'bear_use_ema': True, 'bear_use_atr': True, 'bear_use_adx': False, 'bear_use_spike': False, 'bear_rsi_required': True, 'sideways_strategy': 'breakout', 'sideways_bb_std_mult': 2.2598520088729046, 'sideways_rsi_os': 39, 'sideways_rsi_ob': 56, 'sideways_adx_thresh': 25.702173118754946, 'sideways_atr_min_pct': 0.019543566823356576, 'sideways_atr_max_pct': 0.10239806692386193, 'sideways_tp_mult': 2.3414920990541646, 'sideways_tsl_mult': 0.6513672984676049, 'sideways_time_stop': 142, 'sideways_use_sma': False, 'sideways_use_ema': True, 'sideways_use_atr': True, 'sideways_use_adx': False, 'sideways_use_spike': True, 'sideways_rsi_required': False}.
