[I 2025-08-30 15:21:02,706] Trial 432 finished with values: [-0.02708562091946265, 0.026992323085681887] and parameters: {'p_sma': 6, 'p_std': 58, 'p_atr': 15, 'p_adx': 8, 'rsi_period': 65, 'ema1': 29, 'ema2': 34, 'slip_atr_k': 0.06664551987083733, 'slip_spread_k': 0.10257544565150113, 'spread_hl_frac': 0.02846172949418793, 'bb_std_mult': 1.603679142887385, 'rsi_os': 25, 'rsi_ob': 74, 'vol_spike': 0.14728301065397914, 'adx_thresh': 11.636791232732229, 'atr_min_pct': 0.009790688550999644, 'atr_max_pct': 0.07075179877766796, 'tp_mult': 1.7445116797567966, 'tsl_mult': 0.832554899934282, 'strategy': 'breakout', 'time_stop': 140, 'use_sma': False, 'use_atr': True, 'use_adx': False, 'use_ema': True, 'use_spike': True, 'rsi_required': True, 'edge_k': 0.4027693681187139, 'edge_cap': 0.546284632417064, 'bull_strategy': 'mean_reversion', 'bull_bb_std_mult': 1.2385485334999893, 'bull_rsi_os': 43, 'bull_rsi_ob': 51, 'bull_adx_thresh': 21.607754290048785, 'bull_atr_min_pct': 0.015818311866226304, 'bull_atr_max_pct': 0.045726363529782245, 'bull_tp_mult': 2.163024486559772, 'bull_tsl_mult': 0.15185208608032483, 'bull_time_stop': 162, 'bull_use_sma': False, 'bull_use_ema': False, 'bull_use_atr': False, 'bull_use_adx': False, 'bull_use_spike': True, 'bull_rsi_required': False, 'bear_strategy': 'mean_reversion', 'bear_bb_std_mult': 2.9413362301775687, 'bear_rsi_os': 30, 'bear_rsi_ob': 91, 'bear_adx_thresh': 28.089339153085078, 'bear_atr_min_pct': 0.021565528015427323, 'bear_atr_max_pct': 0.06994578940110896, 'bear_tp_mult': 1.631229606773155, 'bear_tsl_mult': 0.9697582060904973, 'bear_time_stop': 6, 'bear_use_sma': True, 'bear_use_ema': True, 'bear_use_atr': True, 'bear_use_adx': False, 'bear_use_spike': False, 'bear_rsi_required': True, 'sideways_strategy': 'breakout', 'sideways_bb_std_mult': 0.8153782026691268, 'sideways_rsi_os': 42, 'sideways_rsi_ob': 59, 'sideways_adx_thresh': 26.961223253023093, 'sideways_atr_min_pct': 0.0007298030763029509, 'sideways_atr_max_pct': 0.09998002728865373, 'sideways_tp_mult': 2.3877556457516733, 'sideways_tsl_mult': 0.9581740144743287, 'sideways_time_stop': 118, 'sideways_use_sma': True, 'sideways_use_ema': True, 'sideways_use_atr': True, 'sideways_use_adx': False, 'sideways_use_spike': True, 'sideways_rsi_required': False}.
[I 2025-08-30 15:21:03,151] Trial 433 finished with values: [-0.11212984694793016, 0.11206577063830314] and parameters: {'p_sma': 58, 'p_std': 13, 'p_atr': 15, 'p_adx': 8, 'rsi_period': 58, 'ema1': 24, 'ema2': 40, 'slip_atr_k': 0.06705404133947777, 'slip_spread_k': 0.10941746184534765, 'spread_hl_frac': 0.028711477336518812, 'bb_std_mult': 1.1560443236112148, 'rsi_os': 25, 'rsi_ob': 66, 'vol_spike': 0.15023357252767544, 'adx_thresh': 14.082086054136415, 'atr_min_pct': 0.009639221306409883, 'atr_max_pct': 0.07075597806936347, 'tp_mult': 1.7390073175532976, 'tsl_mult': 0.6766374891650063, 'strategy': 'breakout', 'time_stop': 138, 'use_sma': False, 'use_atr': True, 'use_adx': False, 'use_ema': True, 'use_spike': True, 'rsi_required': True, 'edge_k': 0.4068126598968587, 'edge_cap': 0.5493126474772488, 'bull_strategy': 'mean_reversion', 'bull_bb_std_mult': 2.5491457664828, 'bull_rsi_os': 43, 'bull_rsi_ob': 51, 'bull_adx_thresh': 21.44520216942451, 'bull_atr_min_pct': 0.029447369916883737, 'bull_atr_max_pct': 0.06270047613402809, 'bull_tp_mult': 2.169076695616981, 'bull_tsl_mult': 0.14281013286247135, 'bull_time_stop': 183, 'bull_use_sma': False, 'bull_use_ema': False, 'bull_use_atr': False, 'bull_use_adx': False, 'bull_use_spike': True, 'bull_rsi_required': False, 'bear_strategy': 'mean_reversion', 'bear_bb_std_mult': 3.4105933744967407, 'bear_rsi_os': 29, 'bear_rsi_ob': 95, 'bear_adx_thresh': 11.0622102515649, 'bear_atr_min_pct': 0.021309174639377138, 'bear_atr_max_pct': 0.06966318694132677, 'bear_tp_mult': 1.5041303853490355, 'bear_tsl_mult': 0.9737168597126734, 'bear_time_stop': 160, 'bear_use_sma': True, 'bear_use_ema': True, 'bear_use_atr': True, 'bear_use_adx': False, 'bear_use_spike': False, 'bear_rsi_required': True, 'sideways_strategy': 'breakout', 'sideways_bb_std_mult': 2.8274577978027344, 'sideways_rsi_os': 42, 'sideways_rsi_ob': 59, 'sideways_adx_thresh': 26.797863548831057, 'sideways_atr_min_pct': 0.000814772148406108, 'sideways_atr_max_pct': 0.10050317674427155, 'sideways_tp_mult': 2.383805967277574, 'sideways_tsl_mult': 0.952065981114697, 'sideways_time_stop': 119, 'sideways_use_sma': True, 'sideways_use_ema': True, 'sideways_use_atr': True, 'sideways_use_adx': False, 'sideways_use_spike': True, 'sideways_rsi_required': False}.
[I 2025-08-30 15:21:50,019] Trial 436 finished with values: [-1000000000.0, 1000000000.0] and parameters: {'p_sma': 5, 'p_std': 57, 'p_atr': 15, 'p_adx': 9, 'rsi_period': 8, 'ema1': 24, 'ema2': 27, 'slip_atr_k': 0.06505130508520146, 'slip_spread_k': 0.17247079918904953, 'spread_hl_frac': 0.027880799617374306, 'bb_std_mult': 2.45228926022876, 'rsi_os': 11, 'rsi_ob': 66, 'vol_spike': 0.1512540924894765, 'adx_thresh': 12.242881171330351, 'atr_min_pct': 0.014087140395146913, 'atr_max_pct': 0.0741390806849835, 'tp_mult': 1.7812005611724107, 'tsl_mult': 0.49278888806031224, 'strategy': 'breakout', 'time_stop': 126, 'use_sma': False, 'use_atr': True, 'use_adx': True, 'use_ema': True, 'use_spike': True, 'rsi_required': True, 'edge_k': 0.47661121293940484, 'edge_cap': 0.572501009849333, 'bull_strategy': 'mean_reversion', 'bull_bb_std_mult': 1.785813575570499, 'bull_rsi_os': 42, 'bull_rsi_ob': 52, 'bull_adx_thresh': 31.359902105279822, 'bull_atr_min_pct': 0.014402207980846588, 'bull_atr_max_pct': 0.06368860846995213, 'bull_tp_mult': 2.298376711141965, 'bull_tsl_mult': 0.28627915973733165, 'bull_time_stop': 169, 'bull_use_sma': False, 'bull_use_ema': False, 'bull_use_atr': False, 'bull_use_adx': False, 'bull_use_spike': True, 'bull_rsi_required': False, 'bear_strategy': 'mean_reversion', 'bear_bb_std_mult': 3.4157295950794113, 'bear_rsi_os': 32, 'bear_rsi_ob': 74, 'bear_adx_thresh': 10.840629288950343, 'bear_atr_min_pct': 0.023205809212930167, 'bear_atr_max_pct': 0.07473420283586453, 'bear_tp_mult': 2.838771419233387, 'bear_tsl_mult': 0.9234192541003212, 'bear_time_stop': 260, 'bear_use_sma': True, 'bear_use_ema': True, 'bear_use_atr': True, 'bear_use_adx': False, 'bear_use_spike': False, 'bear_rsi_required': True, 'sideways_strategy': 'breakout', 'sideways_bb_std_mult': 2.2329916267295356, 'sideways_rsi_os': 42, 'sideways_rsi_ob': 59, 'sideways_adx_thresh': 29.572175372070326, 'sideways_atr_min_pct': 0.009042482512748452, 'sideways_atr_max_pct': 0.1271060504591014, 'sideways_tp_mult': 2.4704769090921057, 'sideways_tsl_mult': 0.9452130025432319, 'sideways_time_stop': 74, 'sideways_use_sma': True, 'sideways_use_ema': True, 'sideways_use_atr': True, 'sideways_use_adx': False, 'sideways_use_spike': False, 'sideways_rsi_required': False}.
[I 2025-08-30 15:21:51,046] Trial 437 finished with values: [-1000000000.0, 1000000000.0] and parameters: {'p_sma': 5, 'p_std': 57, 'p_atr': 8, 'p_adx': 16, 'rsi_period': 15, 'ema1': 15, 'ema2': 27, 'slip_atr_k': 0.06562764377347427, 'slip_spread_k': 0.16834847756088908, 'spread_hl_frac': 0.023867351250018033, 'bb_std_mult': 2.425093572936289, 'rsi_os': 26, 'rsi_ob': 48, 'vol_spike': 0.1275679841022908, 'adx_thresh': 13.244107695915432, 'atr_min_pct': 0.011808920594589678, 'atr_max_pct': 0.07829541604526921, 'tp_mult': 1.8096070041649892, 'tsl_mult': 0.8720066787249163, 'strategy': 'breakout', 'time_stop': 126, 'use_sma': False, 'use_atr': True, 'use_adx': True, 'use_ema': True, 'use_spike': True, 'rsi_required': True, 'edge_k': 0.33636467128152925, 'edge_cap': 0.5818094561650848, 'bull_strategy': 'mean_reversion', 'bull_bb_std_mult': 2.711064761567271, 'bull_rsi_os': 38, 'bull_rsi_ob': 52, 'bull_adx_thresh': 22.328424662034728, 'bull_atr_min_pct': 0.014312131518546514, 'bull_atr_max_pct': 0.06850573915424382, 'bull_tp_mult': 2.2947124531228957, 'bull_tsl_mult': 0.05003954428981883, 'bull_time_stop': 172, 'bull_use_sma': False, 'bull_use_ema': False, 'bull_use_atr': False, 'bull_use_adx': False, 'bull_use_spike': True, 'bull_rsi_required': False, 'bear_strategy': 'mean_reversion', 'bear_bb_std_mult': 0.6895087853019486, 'bear_rsi_os': 32, 'bear_rsi_ob': 74, 'bear_adx_thresh': 7.8483586462012305, 'bear_atr_min_pct': 0.024023716925587253, 'bear_atr_max_pct': 0.059675536557430374, 'bear_tp_mult': 1.56646194696635, 'bear_tsl_mult': 0.9274765673877465, 'bear_time_stop': 139, 'bear_use_sma': True, 'bear_use_ema': True, 'bear_use_atr': True, 'bear_use_adx': False, 'bear_use_spike': False, 'bear_rsi_required': True, 'sideways_strategy': 'breakout', 'sideways_bb_std_mult': 1.5242697169137824, 'sideways_rsi_os': 42, 'sideways_rsi_ob': 58, 'sideways_adx_thresh': 27.636779024547163, 'sideways_atr_min_pct': 0.010102384992229825, 'sideways_atr_max_pct': 0.1284029603568482, 'sideways_tp_mult': 1.476670822804088, 'sideways_tsl_mult': 0.9741980353801559, 'sideways_time_stop': 63, 'sideways_use_sma': True, 'sideways_use_ema': True, 'sideways_use_atr': True, 'sideways_use_adx': False, 'sideways_use_spike': False, 'sideways_rsi_required': False}.
[I 2025-08-30 15:21:52,077] Trial 434 finished with values: [-1000000000.0, 1000000000.0] and parameters: {'p_sma': 5, 'p_std': 57, 'p_atr': 26, 'p_adx': 14, 'rsi_period': 13, 'ema1': 29, 'ema2': 28, 'slip_atr_k': 0.06702785566472437, 'slip_spread_k': 0.15949940295599865, 'spread_hl_frac': 0.02377409050431052, 'bb_std_mult': 1.6929120410997873, 'rsi_os': 26, 'rsi_ob': 69, 'vol_spike': 0.15101401068088632, 'adx_thresh': 14.051637151390935, 'atr_min_pct': 0.011459577307050165, 'atr_max_pct': 0.07810326199262776, 'tp_mult': 1.783857646727393, 'tsl_mult': 0.4937228915056041, 'strategy': 'breakout', 'time_stop': 222, 'use_sma': False, 'use_atr': True, 'use_adx': False, 'use_ema': True, 'use_spike': True, 'rsi_required': True, 'edge_k': 0.34984053386391767, 'edge_cap': 0.5637761512481994, 'bull_strategy': 'mean_reversion', 'bull_bb_std_mult': 2.52709907682365, 'bull_rsi_os': 43, 'bull_rsi_ob': 51, 'bull_adx_thresh': 21.2297708947337, 'bull_atr_min_pct': 0.014677282009424218, 'bull_atr_max_pct': 0.12871130173356435, 'bull_tp_mult': 2.2827883579159822, 'bull_tsl_mult': 0.14532929189718513, 'bull_time_stop': 168, 'bull_use_sma': False, 'bull_use_ema': False, 'bull_use_atr': False, 'bull_use_adx': False, 'bull_use_spike': True, 'bull_rsi_required': False, 'bear_strategy': 'mean_reversion', 'bear_bb_std_mult': 0.6874624930813673, 'bear_rsi_os': 29, 'bear_rsi_ob': 95, 'bear_adx_thresh': 28.02734333067339, 'bear_atr_min_pct': 0.023310219875793087, 'bear_atr_max_pct': 0.0593941595356233, 'bear_tp_mult': 1.504128355731146, 'bear_tsl_mult': 0.9735551235410698, 'bear_time_stop': 138, 'bear_use_sma': True, 'bear_use_ema': True, 'bear_use_atr': True, 'bear_use_adx': False, 'bear_use_spike': False, 'bear_rsi_required': True, 'sideways_strategy': 'breakout', 'sideways_bb_std_mult': 1.4970285618162154, 'sideways_rsi_os': 43, 'sideways_rsi_ob': 59, 'sideways_adx_thresh': 29.41655723432238, 'sideways_atr_min_pct': 0.016764547210088587, 'sideways_atr_max_pct': 0.12688672951569402, 'sideways_tp_mult': 1.6182548977778204, 'sideways_tsl_mult': 0.9530087017321007, 'sideways_time_stop': 66, 'sideways_use_sma': True, 'sideways_use_ema': True, 'sideways_use_atr': True, 'sideways_use_adx': False, 'sideways_use_spike': True, 'sideways_rsi_required': False}.
[I 2025-08-30 15:21:52,911] Trial 435 finished with values: [-1000000000.0, 0.1699107286161212] and parameters: {'p_sma': 49, 'p_std': 57, 'p_atr': 14, 'p_adx': 25, 'rsi_period': 13, 'ema1': 29, 'ema2': 31, 'slip_atr_k': 0.0665793484834138, 'slip_spread_k': 0.1655685706186103, 'spread_hl_frac': 0.0275629339879431, 'bb_std_mult': 1.5045016748674367, 'rsi_os': 19, 'rsi_ob': 66, 'vol_spike': 0.14931746881858154, 'adx_thresh': 13.683833263375476, 'atr_min_pct': 0.009837005867104792, 'atr_max_pct': 0.13020553163019052, 'tp_mult': 1.8103521858644247, 'tsl_mult': 0.7615464989991212, 'strategy': 'breakout', 'time_stop': 127, 'use_sma': False, 'use_atr': True, 'use_adx': True, 'use_ema': True, 'use_spike': True, 'rsi_required': True, 'edge_k': 0.6577813430290529, 'edge_cap': 0.5691439872261609, 'bull_strategy': 'mean_reversion', 'bull_bb_std_mult': 2.5535361331536364, 'bull_rsi_os': 39, 'bull_rsi_ob': 52, 'bull_adx_thresh': 21.293295085131255, 'bull_atr_min_pct': 0.01589775952729, 'bull_atr_max_pct': 0.06820315764972153, 'bull_tp_mult': 2.267880177694763, 'bull_tsl_mult': 0.3858192593860064, 'bull_time_stop': 173, 'bull_use_sma': False, 'bull_use_ema': False, 'bull_use_atr': False, 'bull_use_adx': False, 'bull_use_spike': True, 'bull_rsi_required': False, 'bear_strategy': 'mean_reversion', 'bear_bb_std_mult': 2.562142452949989, 'bear_rsi_os': 30, 'bear_rsi_ob': 95, 'bear_adx_thresh': 8.024828014577615, 'bear_atr_min_pct': 0.023396610295938144, 'bear_atr_max_pct': 0.05937807918516929, 'bear_tp_mult': 1.5031042239203238, 'bear_tsl_mult': 0.9662794755924868, 'bear_time_stop': 70, 'bear_use_sma': True, 'bear_use_ema': True, 'bear_use_atr': True, 'bear_use_adx': False, 'bear_use_spike': False, 'bear_rsi_required': True, 'sideways_strategy': 'breakout', 'sideways_bb_std_mult': 0.8166169354034307, 'sideways_rsi_os': 42, 'sideways_rsi_ob': 59, 'sideways_adx_thresh': 6.161255338299284, 'sideways_atr_min_pct': 0.0008748249622194462, 'sideways_atr_max_pct': 0.10020025040472155, 'sideways_tp_mult': 1.4065912932408664, 'sideways_tsl_mult': 0.9476923145351175, 'sideways_time_stop': 64, 'sideways_use_sma': True, 'sideways_use_ema': True, 'sideways_use_atr': True, 'sideways_use_adx': False, 'sideways_use_spike': False, 'sideways_rsi_required': False}.
[I 2025-08-30 15:22:40,592] Trial 440 finished with values: [-0.05071359589778146, 0.050621481944949934] and parameters: {'p_sma': 49, 'p_std': 59, 'p_atr': 14, 'p_adx': 25, 'rsi_period': 74, 'ema1': 30, 'ema2': 30, 'slip_atr_k': 0.06259979469031236, 'slip_spread_k': 0.11808843383432237, 'spread_hl_frac': 0.025881198802455145, 'bb_std_mult': 1.014373228436013, 'rsi_os': 24, 'rsi_ob': 72, 'vol_spike': 0.1616354290661625, 'adx_thresh': 15.675266775937295, 'atr_min_pct': 0.0124723875560073, 'atr_max_pct': 0.12946675384648287, 'tp_mult': 2.839423279089175, 'tsl_mult': 0.7618513148224032, 'strategy': 'breakout', 'time_stop': 82, 'use_sma': False, 'use_atr': True, 'use_adx': False, 'use_ema': True, 'use_spike': True, 'rsi_required': True, 'edge_k': 0.2356336674467915, 'edge_cap': 0.5177592223339065, 'bull_strategy': 'mean_reversion', 'bull_bb_std_mult': 2.608863657848176, 'bull_rsi_os': 39, 'bull_rsi_ob': 50, 'bull_adx_thresh': 27.73227633908687, 'bull_atr_min_pct': 0.022289473565840476, 'bull_atr_max_pct': 0.06694679354097323, 'bull_tp_mult': 2.2330083411310446, 'bull_tsl_mult': 0.2632036510173972, 'bull_time_stop': 195, 'bull_use_sma': False, 'bull_use_ema': False, 'bull_use_atr': False, 'bull_use_adx': False, 'bull_use_spike': True, 'bull_rsi_required': False, 'bear_strategy': 'mean_reversion', 'bear_bb_std_mult': 0.5671810305819139, 'bear_rsi_os': 30, 'bear_rsi_ob': 75, 'bear_adx_thresh': 29.335228646270295, 'bear_atr_min_pct': 0.019926924667245167, 'bear_atr_max_pct': 0.08072450733203745, 'bear_tp_mult': 1.5797058968705964, 'bear_tsl_mult': 0.9452198374998245, 'bear_time_stop': 71, 'bear_use_sma': True, 'bear_use_ema': True, 'bear_use_atr': True, 'bear_use_adx': False, 'bear_use_spike': False, 'bear_rsi_required': True, 'sideways_strategy': 'breakout', 'sideways_bb_std_mult': 1.61258352663913, 'sideways_rsi_os': 42, 'sideways_rsi_ob': 55, 'sideways_adx_thresh': 33.037987414687656, 'sideways_atr_min_pct': 0.000700233662873106, 'sideways_atr_max_pct': 0.10810673924891497, 'sideways_tp_mult': 2.456751920924565, 'sideways_tsl_mult': 0.974206625295453, 'sideways_time_stop': 108, 'sideways_use_sma': True, 'sideways_use_ema': True, 'sideways_use_atr': True, 'sideways_use_adx': False, 'sideways_use_spike': True, 'sideways_rsi_required': False}.
[I 2025-08-30 15:22:41,328] Trial 441 finished with values: [-0.01203394063358032, 0.011973291884815931] and parameters: {'p_sma': 6, 'p_std': 42, 'p_atr': 14, 'p_adx': 26, 'rsi_period': 73, 'ema1': 5, 'ema2': 32, 'slip_atr_k': 0.0750990453250599, 'slip_spread_k': 0.12698886310427798, 'spread_hl_frac': 0.025760908427060754, 'bb_std_mult': 0.7673322803828786, 'rsi_os': 24, 'rsi_ob': 60, 'vol_spike': 0.16305520932831066, 'adx_thresh': 14.901157844709806, 'atr_min_pct': 0.003967292708977962, 'atr_max_pct': 0.08852725738562918, 'tp_mult': 1.771578051862494, 'tsl_mult': 0.5820622998776145, 'strategy': 'breakout', 'time_stop': 203, 'use_sma': False, 'use_atr': True, 'use_adx': False, 'use_ema': True, 'use_spike': True, 'rsi_required': True, 'edge_k': 0.059832837982185055, 'edge_cap': 0.15272343804865263, 'bull_strategy': 'mean_reversion', 'bull_bb_std_mult': 0.7599656447497003, 'bull_rsi_os': 48, 'bull_rsi_ob': 48, 'bull_adx_thresh': 27.611399348012313, 'bull_atr_min_pct': 0.022455091889643015, 'bull_atr_max_pct': 0.07292841921314261, 'bull_tp_mult': 2.2296593840086465, 'bull_tsl_mult': 0.1907258423109166, 'bull_time_stop': 196, 'bull_use_sma': False, 'bull_use_ema': False, 'bull_use_atr': False, 'bull_use_adx': False, 'bull_use_spike': True, 'bull_rsi_required': False, 'bear_strategy': 'mean_reversion', 'bear_bb_std_mult': 0.5877477263499047, 'bear_rsi_os': 27, 'bear_rsi_ob': 75, 'bear_adx_thresh': 29.419167275778307, 'bear_atr_min_pct': 0.02015762967193311, 'bear_atr_max_pct': 0.07625976156048345, 'bear_tp_mult': 2.5957962378585213, 'bear_tsl_mult': 0.9490647300556767, 'bear_time_stop': 61, 'bear_use_sma': True, 'bear_use_ema': True, 'bear_use_atr': True, 'bear_use_adx': False, 'bear_use_spike': False, 'bear_rsi_required': True, 'sideways_strategy': 'breakout', 'sideways_bb_std_mult': 2.6293329099253495, 'sideways_rsi_os': 43, 'sideways_rsi_ob': 56, 'sideways_adx_thresh': 33.727697274230266, 'sideways_atr_min_pct': 0.0004354717980752707, 'sideways_atr_max_pct': 0.12164254994155238, 'sideways_tp_mult': 2.4526806614068697, 'sideways_tsl_mult': 0.9739762565140968, 'sideways_time_stop': 106, 'sideways_use_sma': True, 'sideways_use_ema': True, 'sideways_use_atr': True, 'sideways_use_adx': False, 'sideways_use_spike': True, 'sideways_rsi_required': False}.
[I 2025-08-30 15:22:41,788] Trial 438 finished with values: [-1000000000.0, 1000000000.0] and parameters: {'p_sma': 49, 'p_std': 59, 'p_atr': 14, 'p_adx': 25, 'rsi_period': 13, 'ema1': 15, 'ema2': 28, 'slip_atr_k': 0.07299554520646964, 'slip_spread_k': 0.15880827746716392, 'spread_hl_frac': 0.024115310913699898, 'bb_std_mult': 1.4901706120867977, 'rsi_os': 19, 'rsi_ob': 72, 'vol_spike': 0.13026019391482097, 'adx_thresh': 10.063724621620013, 'atr_min_pct': 0.011676131938858983, 'atr_max_pct': 0.08527196709821462, 'tp_mult': 1.808411940928495, 'tsl_mult': 0.7563151685442612, 'strategy': 'breakout', 'time_stop': 57, 'use_sma': False, 'use_atr': True, 'use_adx': False, 'use_ema': True, 'use_spike': True, 'rsi_required': True, 'edge_k': 0.31214474065358766, 'edge_cap': 0.9145738648989987, 'bull_strategy': 'mean_reversion', 'bull_bb_std_mult': 2.5452034248382716, 'bull_rsi_os': 37, 'bull_rsi_ob': 48, 'bull_adx_thresh': 22.320232253238277, 'bull_atr_min_pct': 0.019608843928807837, 'bull_atr_max_pct': 0.06773371963864616, 'bull_tp_mult': 2.255819920578103, 'bull_tsl_mult': 0.4333923506812743, 'bull_time_stop': 179, 'bull_use_sma': False, 'bull_use_ema': False, 'bull_use_atr': False, 'bull_use_adx': False, 'bull_use_spike': True, 'bull_rsi_required': False, 'bear_strategy': 'mean_reversion', 'bear_bb_std_mult': 2.3297009957360526, 'bear_rsi_os': 25, 'bear_rsi_ob': 73, 'bear_adx_thresh': 29.42063484438647, 'bear_atr_min_pct': 0.023811062863264443, 'bear_atr_max_pct': 0.07719091239091783, 'bear_tp_mult': 1.5087102515799926, 'bear_tsl_mult': 0.9435117951399092, 'bear_time_stop': 71, 'bear_use_sma': True, 'bear_use_ema': True, 'bear_use_atr': True, 'bear_use_adx': False, 'bear_use_spike': False, 'bear_rsi_required': True, 'sideways_strategy': 'breakout', 'sideways_bb_std_mult': 1.5119454854240124, 'sideways_rsi_os': 42, 'sideways_rsi_ob': 63, 'sideways_adx_thresh': 6.7142173941952645, 'sideways_atr_min_pct': 0.01678910310435857, 'sideways_atr_max_pct': 0.10813667339906619, 'sideways_tp_mult': 1.9984449397206034, 'sideways_tsl_mult': 0.9721364018451376, 'sideways_time_stop': 107, 'sideways_use_sma': True, 'sideways_use_ema': True, 'sideways_use_atr': True, 'sideways_use_adx': False, 'sideways_use_spike': True, 'sideways_rsi_required': False}.
