[I 2025-08-30 16:32:51,202] Trial 791 finished with values: [-1000000000.0, 0.25957401657272605] and parameters: {'p_sma': 47, 'p_std': 9, 'p_atr': 25, 'p_adx': 12, 'rsi_period': 65, 'ema1': 23, 'ema2': 10, 'slip_atr_k': 0.15376680969259895, 'slip_spread_k': 0.10606390547307032, 'spread_hl_frac': 0.021541486540511193, 'bb_std_mult': 3.139206504620849, 'rsi_os': 38, 'rsi_ob': 56, 'vol_spike': 0.1587612457863923, 'adx_thresh': 34.103086537566355, 'atr_min_pct': 0.005776963718090352, 'atr_max_pct': 0.015175233525123524, 'tp_mult': 1.8041678400063628, 'tsl_mult': 0.3165702998899708, 'strategy': 'mean_reversion', 'time_stop': 282, 'use_sma': True, 'use_atr': False, 'use_adx': False, 'use_ema': True, 'use_spike': True, 'rsi_required': False, 'edge_k': 1.4013817269121465, 'edge_cap': 0.3766673386366971, 'bull_strategy': 'breakout', 'bull_bb_std_mult': 2.0020696780290663, 'bull_rsi_os': 54, 'bull_rsi_ob': 61, 'bull_adx_thresh': 9.410170042529279, 'bull_atr_min_pct': 0.018869204331185708, 'bull_atr_max_pct': 0.09301385048149897, 'bull_tp_mult': 1.9655282920078907, 'bull_tsl_mult': 0.045089795210184413, 'bull_time_stop': 56, 'bull_use_sma': True, 'bull_use_ema': True, 'bull_use_atr': True, 'bull_use_adx': True, 'bull_use_spike': True, 'bull_rsi_required': True, 'bear_strategy': 'mean_reversion', 'bear_bb_std_mult': 2.3892358607696127, 'bear_rsi_os': 49, 'bear_rsi_ob': 89, 'bear_adx_thresh': 19.510535415257724, 'bear_atr_min_pct': 0.01971628937380505, 'bear_atr_max_pct': 0.06746342567323618, 'bear_tp_mult': 2.7836025060967704, 'bear_tsl_mult': 0.5196617661216087, 'bear_time_stop': 274, 'bear_use_sma': False, 'bear_use_ema': False, 'bear_use_atr': True, 'bear_use_adx': True, 'bear_use_spike': True, 'bear_rsi_required': True, 'sideways_strategy': 'breakout', 'sideways_bb_std_mult': 0.758207179362671, 'sideways_rsi_os': 51, 'sideways_rsi_ob': 46, 'sideways_adx_thresh': 24.371170873167916, 'sideways_atr_min_pct': 4.035311985348469e-06, 'sideways_atr_max_pct': 0.07100361497741695, 'sideways_tp_mult': 2.951797908228853, 'sideways_tsl_mult': 0.28839196555024166, 'sideways_time_stop': 37, 'sideways_use_sma': False, 'sideways_use_ema': True, 'sideways_use_atr': False, 'sideways_use_adx': True, 'sideways_use_spike': True, 'sideways_rsi_required': True}.
[I 2025-08-30 16:32:51,582] Trial 790 finished with values: [-0.07159536881367035, 0.0715658094180427] and parameters: {'p_sma': 6, 'p_std': 51, 'p_atr': 25, 'p_adx': 18, 'rsi_period': 16, 'ema1': 23, 'ema2': 10, 'slip_atr_k': 0.15454928808879215, 'slip_spread_k': 0.14518073175166954, 'spread_hl_frac': 0.023203890807900366, 'bb_std_mult': 2.5609077838909493, 'rsi_os': 38, 'rsi_ob': 72, 'vol_spike': 0.15923675998254855, 'adx_thresh': 16.843660759723882, 'atr_min_pct': 0.006119130148800745, 'atr_max_pct': 0.07467161595739767, 'tp_mult': 1.7840944524702358, 'tsl_mult': 0.31363375638868296, 'strategy': 'mean_reversion', 'time_stop': 57, 'use_sma': True, 'use_atr': False, 'use_adx': False, 'use_ema': True, 'use_spike': True, 'rsi_required': False, 'edge_k': 0.32552881692276664, 'edge_cap': 0.775318883107956, 'bull_strategy': 'breakout', 'bull_bb_std_mult': 0.6928309569936144, 'bull_rsi_os': 26, 'bull_rsi_ob': 57, 'bull_adx_thresh': 9.227134173290397, 'bull_atr_min_pct': 0.019062382565279562, 'bull_atr_max_pct': 0.09410100840428026, 'bull_tp_mult': 1.9636978097056177, 'bull_tsl_mult': 0.0013894060734369468, 'bull_time_stop': 31, 'bull_use_sma': True, 'bull_use_ema': True, 'bull_use_atr': True, 'bull_use_adx': True, 'bull_use_spike': True, 'bull_rsi_required': True, 'bear_strategy': 'mean_reversion', 'bear_bb_std_mult': 2.385599582197795, 'bear_rsi_os': 34, 'bear_rsi_ob': 65, 'bear_adx_thresh': 19.471781416100892, 'bear_atr_min_pct': 0.019703843515399222, 'bear_atr_max_pct': 0.06843885318270031, 'bear_tp_mult': 1.878624392254163, 'bear_tsl_mult': 0.48176461843609736, 'bear_time_stop': 273, 'bear_use_sma': False, 'bear_use_ema': False, 'bear_use_atr': True, 'bear_use_adx': True, 'bear_use_spike': True, 'bear_rsi_required': True, 'sideways_strategy': 'breakout', 'sideways_bb_std_mult': 0.9298814753458913, 'sideways_rsi_os': 41, 'sideways_rsi_ob': 62, 'sideways_adx_thresh': 24.84156703014958, 'sideways_atr_min_pct': 1.9764157659964425e-05, 'sideways_atr_max_pct': 0.12183111834995801, 'sideways_tp_mult': 1.3831265838227553, 'sideways_tsl_mult': 0.958357733395368, 'sideways_time_stop': 258, 'sideways_use_sma': False, 'sideways_use_ema': True, 'sideways_use_atr': False, 'sideways_use_adx': True, 'sideways_use_spike': True, 'sideways_rsi_required': True}.
[I 2025-08-30 16:33:36,335] Trial 795 finished with values: [-1000000000.0, 1000000000.0] and parameters: {'p_sma': 21, 'p_std': 51, 'p_atr': 27, 'p_adx': 8, 'rsi_period': 79, 'ema1': 24, 'ema2': 43, 'slip_atr_k': 0.06946372754402448, 'slip_spread_k': 0.14681428164394716, 'spread_hl_frac': 0.04444229624672968, 'bb_std_mult': 2.3860560561520394, 'rsi_os': 40, 'rsi_ob': 76, 'vol_spike': 0.15338243587174624, 'adx_thresh': 13.723491795290766, 'atr_min_pct': 0.0007312092800447739, 'atr_max_pct': 0.0778365122049204, 'tp_mult': 1.745541265582408, 'tsl_mult': 0.8476231229418323, 'strategy': 'mean_reversion', 'time_stop': 230, 'use_sma': True, 'use_atr': True, 'use_adx': False, 'use_ema': True, 'use_spike': False, 'rsi_required': False, 'edge_k': 0.5231827607850195, 'edge_cap': 0.36844754248454437, 'bull_strategy': 'breakout', 'bull_bb_std_mult': 0.8272321944448747, 'bull_rsi_os': 42, 'bull_rsi_ob': 57, 'bull_adx_thresh': 25.18887183756065, 'bull_atr_min_pct': 0.02186794778209464, 'bull_atr_max_pct': 0.10041073334236468, 'bull_tp_mult': 2.0330822009299063, 'bull_tsl_mult': 0.03511497635671962, 'bull_time_stop': 53, 'bull_use_sma': True, 'bull_use_ema': True, 'bull_use_atr': True, 'bull_use_adx': True, 'bull_use_spike': True, 'bull_rsi_required': True, 'bear_strategy': 'mean_reversion', 'bear_bb_std_mult': 2.4597159234871975, 'bear_rsi_os': 31, 'bear_rsi_ob': 95, 'bear_adx_thresh': 28.468260719235108, 'bear_atr_min_pct': 0.017221211403155665, 'bear_atr_max_pct': 0.06294418318936779, 'bear_tp_mult': 1.8683292190703442, 'bear_tsl_mult': 0.37944220151026936, 'bear_time_stop': 203, 'bear_use_sma': False, 'bear_use_ema': False, 'bear_use_atr': True, 'bear_use_adx': True, 'bear_use_spike': True, 'bear_rsi_required': False, 'sideways_strategy': 'breakout', 'sideways_bb_std_mult': 0.9128279632116671, 'sideways_rsi_os': 39, 'sideways_rsi_ob': 68, 'sideways_adx_thresh': 25.01314378012302, 'sideways_atr_min_pct': 0.0019298221927704553, 'sideways_atr_max_pct': 0.03556923690823715, 'sideways_tp_mult': 1.7066970434810527, 'sideways_tsl_mult': 0.9624419709223676, 'sideways_time_stop': 149, 'sideways_use_sma': True, 'sideways_use_ema': True, 'sideways_use_atr': False, 'sideways_use_adx': True, 'sideways_use_spike': True, 'sideways_rsi_required': True}.
[I 2025-08-30 16:33:37,322] Trial 797 finished with values: [-1000000000.0, 1000000000.0] and parameters: {'p_sma': 5, 'p_std': 20, 'p_atr': 27, 'p_adx': 11, 'rsi_period': 79, 'ema1': 24, 'ema2': 33, 'slip_atr_k': 0.06954160009727166, 'slip_spread_k': 0.16858441536197694, 'spread_hl_frac': 0.0446961365131978, 'bb_std_mult': 2.4282395680208473, 'rsi_os': 9, 'rsi_ob': 75, 'vol_spike': 0.10295614742787637, 'adx_thresh': 13.714505438653372, 'atr_min_pct': 0.015733366826163005, 'atr_max_pct': 0.08117602928342155, 'tp_mult': 1.7175371669536423, 'tsl_mult': 0.33731090459280116, 'strategy': 'mean_reversion', 'time_stop': 193, 'use_sma': True, 'use_atr': True, 'use_adx': False, 'use_ema': True, 'use_spike': False, 'rsi_required': False, 'edge_k': 0.48827417782138416, 'edge_cap': 0.612193059620118, 'bull_strategy': 'breakout', 'bull_bb_std_mult': 0.8430532020740488, 'bull_rsi_os': 42, 'bull_rsi_ob': 69, 'bull_adx_thresh': 24.791498001836054, 'bull_atr_min_pct': 0.029866308412774205, 'bull_atr_max_pct': 0.09738728261260102, 'bull_tp_mult': 1.7273872177964593, 'bull_tsl_mult': 0.7787860826773771, 'bull_time_stop': 25, 'bull_use_sma': True, 'bull_use_ema': True, 'bull_use_atr': True, 'bull_use_adx': True, 'bull_use_spike': True, 'bull_rsi_required': True, 'bear_strategy': 'mean_reversion', 'bear_bb_std_mult': 2.4467280865793706, 'bear_rsi_os': 31, 'bear_rsi_ob': 95, 'bear_adx_thresh': 29.69155599197346, 'bear_atr_min_pct': 0.021124323969693656, 'bear_atr_max_pct': 0.10533161844911285, 'bear_tp_mult': 2.9369776053537446, 'bear_tsl_mult': 0.1980328123381937, 'bear_time_stop': 264, 'bear_use_sma': False, 'bear_use_ema': False, 'bear_use_atr': True, 'bear_use_adx': True, 'bear_use_spike': True, 'bear_rsi_required': False, 'sideways_strategy': 'mean_reversion', 'sideways_bb_std_mult': 0.5006299416950188, 'sideways_rsi_os': 39, 'sideways_rsi_ob': 61, 'sideways_adx_thresh': 23.40873352115577, 'sideways_atr_min_pct': 0.02016754085185208, 'sideways_atr_max_pct': 0.03849065863628224, 'sideways_tp_mult': 2.015379981949035, 'sideways_tsl_mult': 0.8985815075693333, 'sideways_time_stop': 79, 'sideways_use_sma': True, 'sideways_use_ema': True, 'sideways_use_atr': False, 'sideways_use_adx': True, 'sideways_use_spike': True, 'sideways_rsi_required': True}.
[I 2025-08-30 16:33:38,498] Trial 794 finished with values: [-1000000000.0, 1000000000.0] and parameters: {'p_sma': 5, 'p_std': 54, 'p_atr': 27, 'p_adx': 12, 'rsi_period': 79, 'ema1': 23, 'ema2': 15, 'slip_atr_k': 0.07715953572951445, 'slip_spread_k': 0.9597982233094478, 'spread_hl_frac': 0.02522817048287739, 'bb_std_mult': 2.412748191669492, 'rsi_os': 40, 'rsi_ob': 62, 'vol_spike': 0.15754077126618254, 'adx_thresh': 33.92384484769492, 'atr_min_pct': 0.0006900075563732143, 'atr_max_pct': 0.07373595173157028, 'tp_mult': 1.7626110808188191, 'tsl_mult': 0.8987129581503732, 'strategy': 'mean_reversion', 'time_stop': 228, 'use_sma': True, 'use_atr': False, 'use_adx': False, 'use_ema': True, 'use_spike': True, 'rsi_required': False, 'edge_k': 0.5126716380891684, 'edge_cap': 0.6113977930961212, 'bull_strategy': 'breakout', 'bull_bb_std_mult': 2.0170219827630294, 'bull_rsi_os': 42, 'bull_rsi_ob': 57, 'bull_adx_thresh': 5.038330705386537, 'bull_atr_min_pct': 0.021862000573245475, 'bull_atr_max_pct': 0.09625043107959914, 'bull_tp_mult': 1.151040558266362, 'bull_tsl_mult': 0.044391867301698855, 'bull_time_stop': 24, 'bull_use_sma': True, 'bull_use_ema': True, 'bull_use_atr': True, 'bull_use_adx': True, 'bull_use_spike': True, 'bull_rsi_required': True, 'bear_strategy': 'mean_reversion', 'bear_bb_std_mult': 2.3762006554200235, 'bear_rsi_os': 31, 'bear_rsi_ob': 89, 'bear_adx_thresh': 33.09510259921335, 'bear_atr_min_pct': 0.020121659558622135, 'bear_atr_max_pct': 0.07339511337821701, 'bear_tp_mult': 1.076912823446151, 'bear_tsl_mult': 0.1902973194209025, 'bear_time_stop': 183, 'bear_use_sma': False, 'bear_use_ema': False, 'bear_use_atr': True, 'bear_use_adx': True, 'bear_use_spike': True, 'bear_rsi_required': True, 'sideways_strategy': 'breakout', 'sideways_bb_std_mult': 0.9049833501350263, 'sideways_rsi_os': 39, 'sideways_rsi_ob': 81, 'sideways_adx_thresh': 25.03548794565739, 'sideways_atr_min_pct': 4.257081275370182e-05, 'sideways_atr_max_pct': 0.034794062987254605, 'sideways_tp_mult': 1.7085322936972942, 'sideways_tsl_mult': 0.957520004518259, 'sideways_time_stop': 189, 'sideways_use_sma': True, 'sideways_use_ema': True, 'sideways_use_atr': False, 'sideways_use_adx': True, 'sideways_use_spike': True, 'sideways_rsi_required': True}.
[I 2025-08-30 16:33:39,043] Trial 796 finished with values: [-0.02776521049459535, 0.027719060971128084] and parameters: {'p_sma': 5, 'p_std': 17, 'p_atr': 27, 'p_adx': 20, 'rsi_period': 18, 'ema1': 24, 'ema2': 30, 'slip_atr_k': 0.06916816692306516, 'slip_spread_k': 0.13201743196016152, 'spread_hl_frac': 0.024906804676793216, 'bb_std_mult': 2.4066416484257935, 'rsi_os': 36, 'rsi_ob': 78, 'vol_spike': 0.18053045838106477, 'adx_thresh': 15.718509373469638, 'atr_min_pct': 0.021143831653811906, 'atr_max_pct': 0.08132304869875069, 'tp_mult': 1.7707648515260648, 'tsl_mult': 0.8545297975850545, 'strategy': 'mean_reversion', 'time_stop': 59, 'use_sma': True, 'use_atr': True, 'use_adx': False, 'use_ema': True, 'use_spike': False, 'rsi_required': False, 'edge_k': 0.5178550422770406, 'edge_cap': 0.40444509340137036, 'bull_strategy': 'breakout', 'bull_bb_std_mult': 0.8306561140276161, 'bull_rsi_os': 42, 'bull_rsi_ob': 81, 'bull_adx_thresh': 17.426295403576507, 'bull_atr_min_pct': 0.021937440979464626, 'bull_atr_max_pct': 0.13512469938432184, 'bull_tp_mult': 1.8959106598883557, 'bull_tsl_mult': 0.027166990918008525, 'bull_time_stop': 20, 'bull_use_sma': True, 'bull_use_ema': True, 'bull_use_atr': True, 'bull_use_adx': True, 'bull_use_spike': True, 'bull_rsi_required': True, 'bear_strategy': 'mean_reversion', 'bear_bb_std_mult': 2.5512476760227605, 'bear_rsi_os': 31, 'bear_rsi_ob': 62, 'bear_adx_thresh': 28.493860750533877, 'bear_atr_min_pct': 0.020177463720998982, 'bear_atr_max_pct': 0.0632724301160465, 'bear_tp_mult': 2.8357177416633608, 'bear_tsl_mult': 0.18987305955177836, 'bear_time_stop': 203, 'bear_use_sma': False, 'bear_use_ema': False, 'bear_use_atr': True, 'bear_use_adx': True, 'bear_use_spike': True, 'bear_rsi_required': False, 'sideways_strategy': 'breakout', 'sideways_bb_std_mult': 0.6593782168670987, 'sideways_rsi_os': 39, 'sideways_rsi_ob': 81, 'sideways_adx_thresh': 24.972903837708813, 'sideways_atr_min_pct': 0.0011974394732591294, 'sideways_atr_max_pct': 0.03810195784173584, 'sideways_tp_mult': 2.994356495295254, 'sideways_tsl_mult': 0.4170214226363853, 'sideways_time_stop': 188, 'sideways_use_sma': True, 'sideways_use_ema': True, 'sideways_use_atr': False, 'sideways_use_adx': True, 'sideways_use_spike': True, 'sideways_rsi_required': True}.
[I 2025-08-30 16:34:24,989] Trial 801 finished with values: [-1000000000.0, 1000000000.0] and parameters: {'p_sma': 39, 'p_std': 57, 'p_atr': 26, 'p_adx': 11, 'rsi_period': 69, 'ema1': 22, 'ema2': 56, 'slip_atr_k': 0.18630978692895458, 'slip_spread_k': 0.2951592061157616, 'spread_hl_frac': 0.026327713957025288, 'bb_std_mult': 2.2879123326595945, 'rsi_os': 42, 'rsi_ob': 74, 'vol_spike': 0.16732762480669672, 'adx_thresh': 14.80362302841823, 'atr_min_pct': 0.002854384081920968, 'atr_max_pct': 0.11999449419282365, 'tp_mult': 1.1422453597988231, 'tsl_mult': 0.24669456437357085, 'strategy': 'mean_reversion', 'time_stop': 217, 'use_sma': True, 'use_atr': True, 'use_adx': True, 'use_ema': False, 'use_spike': True, 'rsi_required': False, 'edge_k': 0.63754732226381, 'edge_cap': 0.23388421566745055, 'bull_strategy': 'breakout', 'bull_bb_std_mult': 0.9542846595975545, 'bull_rsi_os': 21, 'bull_rsi_ob': 94, 'bull_adx_thresh': 23.375492807614155, 'bull_atr_min_pct': 0.020969113448802243, 'bull_atr_max_pct': 0.044803145406139104, 'bull_tp_mult': 2.043123666377198, 'bull_tsl_mult': 0.16286045100473923, 'bull_time_stop': 36, 'bull_use_sma': True, 'bull_use_ema': True, 'bull_use_atr': True, 'bull_use_adx': True, 'bull_use_spike': False, 'bull_rsi_required': True, 'bear_strategy': 'breakout', 'bear_bb_std_mult': 2.207736285396979, 'bear_rsi_os': 33, 'bear_rsi_ob': 56, 'bear_adx_thresh': 29.314611305383405, 'bear_atr_min_pct': 0.021404652726570512, 'bear_atr_max_pct': 0.04621839424439062, 'bear_tp_mult': 2.2280018112332125, 'bear_tsl_mult': 0.305861184738928, 'bear_time_stop': 257, 'bear_use_sma': False, 'bear_use_ema': False, 'bear_use_atr': False, 'bear_use_adx': True, 'bear_use_spike': True, 'bear_rsi_required': True, 'sideways_strategy': 'mean_reversion', 'sideways_bb_std_mult': 1.0309756324552697, 'sideways_rsi_os': 41, 'sideways_rsi_ob': 70, 'sideways_adx_thresh': 19.42350547599164, 'sideways_atr_min_pct': 0.0011536715377570422, 'sideways_atr_max_pct': 0.06791142978975404, 'sideways_tp_mult': 2.8628739071950258, 'sideways_tsl_mult': 0.21007805174722777, 'sideways_time_stop': 101, 'sideways_use_sma': True, 'sideways_use_ema': True, 'sideways_use_atr': False, 'sideways_use_adx': True, 'sideways_use_spike': False, 'sideways_rsi_required': True}.
[I 2025-08-30 16:34:26,758] Trial 799 finished with values: [-1000000000.0, 1000000000.0] and parameters: {'p_sma': 5, 'p_std': 56, 'p_atr': 26, 'p_adx': 12, 'rsi_period': 77, 'ema1': 22, 'ema2': 30, 'slip_atr_k': 0.18362040539385138, 'slip_spread_k': 0.1290930453808316, 'spread_hl_frac': 0.025155223225036598, 'bb_std_mult': 2.8281331882720524, 'rsi_os': 36, 'rsi_ob': 72, 'vol_spike': 0.052487088825022885, 'adx_thresh': 15.569528967202718, 'atr_min_pct': 0.00297804023512006, 'atr_max_pct': 0.08524667109407076, 'tp_mult': 1.014233750623073, 'tsl_mult': 0.24920528658985996, 'strategy': 'mean_reversion', 'time_stop': 92, 'use_sma': True, 'use_atr': True, 'use_adx': False, 'use_ema': True, 'use_spike': True, 'rsi_required': False, 'edge_k': 0.6403620748391324, 'edge_cap': 0.5802630727398104, 'bull_strategy': 'breakout', 'bull_bb_std_mult': 0.5648714521873796, 'bull_rsi_os': 14, 'bull_rsi_ob': 60, 'bull_adx_thresh': 23.484169680740468, 'bull_atr_min_pct': 0.020122417427507876, 'bull_atr_max_pct': 0.0470412503125804, 'bull_tp_mult': 2.533496750530347, 'bull_tsl_mult': 0.9037632654240739, 'bull_time_stop': 5, 'bull_use_sma': True, 'bull_use_ema': True, 'bull_use_atr': True, 'bull_use_adx': True, 'bull_use_spike': False, 'bull_rsi_required': True, 'bear_strategy': 'breakout', 'bear_bb_std_mult': 3.3421426754769326, 'bear_rsi_os': 44, 'bear_rsi_ob': 90, 'bear_adx_thresh': 33.0596041652134, 'bear_atr_min_pct': 0.021189361414832155, 'bear_atr_max_pct': 0.07305471994943583, 'bear_tp_mult': 1.1778703480667199, 'bear_tsl_mult': 0.1550693410120582, 'bear_time_stop': 112, 'bear_use_sma': False, 'bear_use_ema': False, 'bear_use_atr': True, 'bear_use_adx': True, 'bear_use_spike': True, 'bear_rsi_required': True, 'sideways_strategy': 'breakout', 'sideways_bb_std_mult': 1.0484805043976322, 'sideways_rsi_os': 37, 'sideways_rsi_ob': 70, 'sideways_adx_thresh': 10.117804289201274, 'sideways_atr_min_pct': 0.022967586194770122, 'sideways_atr_max_pct': 0.14389852836680767, 'sideways_tp_mult': 1.562739943891591, 'sideways_tsl_mult': 0.9413860024964886, 'sideways_time_stop': 62, 'sideways_use_sma': True, 'sideways_use_ema': True, 'sideways_use_atr': False, 'sideways_use_adx': True, 'sideways_use_spike': True, 'sideways_rsi_required': True}.
[I 2025-08-30 16:34:27,051] Trial 798 finished with values: [-1000000000.0, 1000000000.0] and parameters: {'p_sma': 49, 'p_std': 54, 'p_atr': 26, 'p_adx': 17, 'rsi_period': 69, 'ema1': 24, 'ema2': 56, 'slip_atr_k': 0.06283403001402135, 'slip_spread_k': 0.4296053627302008, 'spread_hl_frac': 0.025304882125787315, 'bb_std_mult': 2.4291621935958894, 'rsi_os': 36, 'rsi_ob': 75, 'vol_spike': 0.10400245911433988, 'adx_thresh': 32.69002025113466, 'atr_min_pct': 0.0143394319470041, 'atr_max_pct': 0.08259538190419612, 'tp_mult': 1.7128823854595578, 'tsl_mult': 0.33500944754329065, 'strategy': 'mean_reversion', 'time_stop': 88, 'use_sma': True, 'use_atr': True, 'use_adx': False, 'use_ema': True, 'use_spike': True, 'rsi_required': False, 'edge_k': 0.8702695768542538, 'edge_cap': 0.6091127231402588, 'bull_strategy': 'breakout', 'bull_bb_std_mult': 0.91873719536952, 'bull_rsi_os': 34, 'bull_rsi_ob': 60, 'bull_adx_thresh': 23.632384037989002, 'bull_atr_min_pct': 0.020994583131474676, 'bull_atr_max_pct': 0.13475330716365036, 'bull_tp_mult': 1.8935845722159388, 'bull_tsl_mult': 0.14488325562645715, 'bull_time_stop': 23, 'bull_use_sma': True, 'bull_use_ema': True, 'bull_use_atr': True, 'bull_use_adx': True, 'bull_use_spike': True, 'bull_rsi_required': True, 'bear_strategy': 'breakout', 'bear_bb_std_mult': 2.5728692029059306, 'bear_rsi_os': 31, 'bear_rsi_ob': 93, 'bear_adx_thresh': 29.6869890166052, 'bear_atr_min_pct': 0.0210062091787293, 'bear_atr_max_pct': 0.07382714679897336, 'bear_tp_mult': 2.9543333797934683, 'bear_tsl_mult': 0.19462578311171935, 'bear_time_stop': 263, 'bear_use_sma': False, 'bear_use_ema': False, 'bear_use_atr': True, 'bear_use_adx': True, 'bear_use_spike': True, 'bear_rsi_required': True, 'sideways_strategy': 'mean_reversion', 'sideways_bb_std_mult': 1.0380604281846353, 'sideways_rsi_os': 37, 'sideways_rsi_ob': 79, 'sideways_adx_thresh': 23.192746047146407, 'sideways_atr_min_pct': 0.0011745067426102082, 'sideways_atr_max_pct': 0.1091273497537823, 'sideways_tp_mult': 2.031763870323578, 'sideways_tsl_mult': 0.9396961077818546, 'sideways_time_stop': 82, 'sideways_use_sma': True, 'sideways_use_ema': True, 'sideways_use_atr': False, 'sideways_use_adx': True, 'sideways_use_spike': True, 'sideways_rsi_required': True}.
