[I 2025-08-30 14:51:25,283] Trial 254 finished with values: [-1000000000.0, 1000000000.0] and parameters: {'p_sma': 29, 'p_std': 45, 'p_atr': 14, 'p_adx': 22, 'rsi_period': 48, 'ema1': 28, 'ema2': 30, 'slip_atr_k': 0.017432220703113874, 'slip_spread_k': 0.5447043045844235, 'spread_hl_frac': 0.038456915484491934, 'bb_std_mult': 2.601616985635449, 'rsi_os': 34, 'rsi_ob': 61, 'vol_spike': 0.2657332804823389, 'adx_thresh': 21.595351879940463, 'atr_min_pct': 7.924110100300877e-05, 'atr_max_pct': 0.10209014129237216, 'tp_mult': 1.7577861265933157, 'tsl_mult': 0.9994279739734855, 'strategy': 'mean_reversion', 'time_stop': 109, 'use_sma': True, 'use_atr': True, 'use_adx': False, 'use_ema': True, 'use_spike': False, 'rsi_required': False, 'edge_k': 1.866375717781683, 'edge_cap': 0.1402128450822579, 'bull_strategy': 'breakout', 'bull_bb_std_mult': 2.35302807760905, 'bull_rsi_os': 7, 'bull_rsi_ob': 78, 'bull_adx_thresh': 13.042691739738201, 'bull_atr_min_pct': 0.0159308549830802, 'bull_atr_max_pct': 0.13149197060721632, 'bull_tp_mult': 1.3570786037139482, 'bull_tsl_mult': 0.5577780773354194, 'bull_time_stop': 215, 'bull_use_sma': False, 'bull_use_ema': False, 'bull_use_atr': True, 'bull_use_adx': True, 'bull_use_spike': False, 'bull_rsi_required': True, 'bear_strategy': 'breakout', 'bear_bb_std_mult': 1.4899328845948419, 'bear_rsi_os': 32, 'bear_rsi_ob': 83, 'bear_adx_thresh': 9.324101538430533, 'bear_atr_min_pct': 0.0196947227242097, 'bear_atr_max_pct': 0.05294404190020591, 'bear_tp_mult': 2.0476219237160636, 'bear_tsl_mult': 0.1779416589571429, 'bear_time_stop': 38, 'bear_use_sma': False, 'bear_use_ema': False, 'bear_use_atr': False, 'bear_use_adx': False, 'bear_use_spike': True, 'bear_rsi_required': False, 'sideways_strategy': 'breakout', 'sideways_bb_std_mult': 3.0928542538148105, 'sideways_rsi_os': 54, 'sideways_rsi_ob': 89, 'sideways_adx_thresh': 15.735222708581984, 'sideways_atr_min_pct': 0.027760120373670975, 'sideways_atr_max_pct': 0.13746024932914028, 'sideways_tp_mult': 2.616094672298249, 'sideways_tsl_mult': 0.1080095813146677, 'sideways_time_stop': 220, 'sideways_use_sma': False, 'sideways_use_ema': True, 'sideways_use_atr': False, 'sideways_use_adx': True, 'sideways_use_spike': False, 'sideways_rsi_required': True}.
[I 2025-08-30 14:51:25,510] Trial 253 finished with values: [-1000000000.0, 1000000000.0] and parameters: {'p_sma': 31, 'p_std': 32, 'p_atr': 14, 'p_adx': 14, 'rsi_period': 46, 'ema1': 27, 'ema2': 20, 'slip_atr_k': 0.011043426742703005, 'slip_spread_k': 0.813981325477189, 'spread_hl_frac': 0.0032291213648862494, 'bb_std_mult': 2.172931688249589, 'rsi_os': 34, 'rsi_ob': 86, 'vol_spike': 0.0019031730926134527, 'adx_thresh': 17.409948168068397, 'atr_min_pct': 0.01836416727072367, 'atr_max_pct': 0.11702091757630007, 'tp_mult': 2.5669156844130407, 'tsl_mult': 0.9959325164909675, 'strategy': 'breakout', 'time_stop': 27, 'use_sma': True, 'use_atr': True, 'use_adx': False, 'use_ema': True, 'use_spike': False, 'rsi_required': False, 'edge_k': 0.9137122705052791, 'edge_cap': 0.828557173620402, 'bull_strategy': 'breakout', 'bull_bb_std_mult': 2.0634047878648683, 'bull_rsi_os': 18, 'bull_rsi_ob': 92, 'bull_adx_thresh': 24.100144527024405, 'bull_atr_min_pct': 0.003610061855918946, 'bull_atr_max_pct': 0.02295001591833764, 'bull_tp_mult': 1.0530195167162277, 'bull_tsl_mult': 0.27552496849685304, 'bull_time_stop': 271, 'bull_use_sma': False, 'bull_use_ema': False, 'bull_use_atr': True, 'bull_use_adx': True, 'bull_use_spike': False, 'bull_rsi_required': True, 'bear_strategy': 'breakout', 'bear_bb_std_mult': 1.2087561890039311, 'bear_rsi_os': 15, 'bear_rsi_ob': 65, 'bear_adx_thresh': 23.241496344998705, 'bear_atr_min_pct': 0.011895238387786385, 'bear_atr_max_pct': 0.026472301937446475, 'bear_tp_mult': 1.9976370940102843, 'bear_tsl_mult': 0.17956173684122145, 'bear_time_stop': 275, 'bear_use_sma': False, 'bear_use_ema': False, 'bear_use_atr': False, 'bear_use_adx': False, 'bear_use_spike': True, 'bear_rsi_required': False, 'sideways_strategy': 'breakout', 'sideways_bb_std_mult': 2.231849482009621, 'sideways_rsi_os': 54, 'sideways_rsi_ob': 90, 'sideways_adx_thresh': 16.595829066033005, 'sideways_atr_min_pct': 0.020361782730717065, 'sideways_atr_max_pct': 0.13772436229000076, 'sideways_tp_mult': 2.669967257449521, 'sideways_tsl_mult': 0.10317867498816276, 'sideways_time_stop': 229, 'sideways_use_sma': False, 'sideways_use_ema': True, 'sideways_use_atr': False, 'sideways_use_adx': True, 'sideways_use_spike': False, 'sideways_rsi_required': True}.
[I 2025-08-30 14:51:25,710] Trial 252 finished with values: [-0.022925168156000653, 0.022850131225954605] and parameters: {'p_sma': 31, 'p_std': 37, 'p_atr': 14, 'p_adx': 22, 'rsi_period': 52, 'ema1': 28, 'ema2': 53, 'slip_atr_k': 0.017003977821032534, 'slip_spread_k': 0.28516797417763207, 'spread_hl_frac': 0.004911507698021501, 'bb_std_mult': 2.209051332899866, 'rsi_os': 34, 'rsi_ob': 90, 'vol_spike': 0.0007084022025990455, 'adx_thresh': 19.896439920238688, 'atr_min_pct': 0.018195078277221884, 'atr_max_pct': 0.10951686324399347, 'tp_mult': 2.2103172679583767, 'tsl_mult': 0.9871014918483961, 'strategy': 'mean_reversion', 'time_stop': 29, 'use_sma': True, 'use_atr': True, 'use_adx': False, 'use_ema': True, 'use_spike': False, 'rsi_required': False, 'edge_k': 0.6880619223566706, 'edge_cap': 0.12218505462964036, 'bull_strategy': 'breakout', 'bull_bb_std_mult': 3.389821011854799, 'bull_rsi_os': 19, 'bull_rsi_ob': 77, 'bull_adx_thresh': 13.000705578509507, 'bull_atr_min_pct': 0.0016585882747445011, 'bull_atr_max_pct': 0.02162197342540862, 'bull_tp_mult': 1.514146192890434, 'bull_tsl_mult': 0.4971546893017521, 'bull_time_stop': 269, 'bull_use_sma': False, 'bull_use_ema': False, 'bull_use_atr': True, 'bull_use_adx': True, 'bull_use_spike': False, 'bull_rsi_required': True, 'bear_strategy': 'breakout', 'bear_bb_std_mult': 3.176043390343626, 'bear_rsi_os': 25, 'bear_rsi_ob': 46, 'bear_adx_thresh': 30.190494360608582, 'bear_atr_min_pct': 0.02050343173037056, 'bear_atr_max_pct': 0.026925063374004642, 'bear_tp_mult': 1.996197593513446, 'bear_tsl_mult': 0.1753868543791689, 'bear_time_stop': 113, 'bear_use_sma': False, 'bear_use_ema': False, 'bear_use_atr': False, 'bear_use_adx': False, 'bear_use_spike': True, 'bear_rsi_required': False, 'sideways_strategy': 'breakout', 'sideways_bb_std_mult': 3.094927837562979, 'sideways_rsi_os': 10, 'sideways_rsi_ob': 91, 'sideways_adx_thresh': 15.758839208341854, 'sideways_atr_min_pct': 0.026503389967132196, 'sideways_atr_max_pct': 0.14878029257892278, 'sideways_tp_mult': 2.6695478161602653, 'sideways_tsl_mult': 0.9780061757207108, 'sideways_time_stop': 229, 'sideways_use_sma': False, 'sideways_use_ema': True, 'sideways_use_atr': False, 'sideways_use_adx': True, 'sideways_use_spike': False, 'sideways_rsi_required': True}.
[I 2025-08-30 14:52:00,012] Trial 258 finished with values: [-1000000000.0, 1000000000.0] and parameters: {'p_sma': 30, 'p_std': 29, 'p_atr': 13, 'p_adx': 21, 'rsi_period': 56, 'ema1': 27, 'ema2': 49, 'slip_atr_k': 0.00741825841983928, 'slip_spread_k': 0.8884824682416552, 'spread_hl_frac': 0.03274277135636197, 'bb_std_mult': 2.0684734975627874, 'rsi_os': 36, 'rsi_ob': 89, 'vol_spike': 0.25608509094008935, 'adx_thresh': 21.427630478209192, 'atr_min_pct': 0.015374479832090185, 'atr_max_pct': 0.04755787647480844, 'tp_mult': 2.7923603220159188, 'tsl_mult': 0.9603333060919986, 'strategy': 'mean_reversion', 'time_stop': 34, 'use_sma': True, 'use_atr': False, 'use_adx': False, 'use_ema': False, 'use_spike': False, 'rsi_required': False, 'edge_k': 1.686951760520931, 'edge_cap': 0.7431554410129919, 'bull_strategy': 'breakout', 'bull_bb_std_mult': 3.356232088694393, 'bull_rsi_os': 43, 'bull_rsi_ob': 76, 'bull_adx_thresh': 12.14976648470063, 'bull_atr_min_pct': 0.014353091435286243, 'bull_atr_max_pct': 0.09381563561083525, 'bull_tp_mult': 2.0094925790639606, 'bull_tsl_mult': 0.9221817397000454, 'bull_time_stop': 220, 'bull_use_sma': False, 'bull_use_ema': False, 'bull_use_atr': True, 'bull_use_adx': False, 'bull_use_spike': False, 'bull_rsi_required': True, 'bear_strategy': 'mean_reversion', 'bear_bb_std_mult': 1.618491560525721, 'bear_rsi_os': 14, 'bear_rsi_ob': 47, 'bear_adx_thresh': 18.745670008854574, 'bear_atr_min_pct': 0.011867514436356547, 'bear_atr_max_pct': 0.10815436318377718, 'bear_tp_mult': 2.2673049175595734, 'bear_tsl_mult': 0.26173273350688964, 'bear_time_stop': 54, 'bear_use_sma': True, 'bear_use_ema': False, 'bear_use_atr': False, 'bear_use_adx': False, 'bear_use_spike': True, 'bear_rsi_required': True, 'sideways_strategy': 'breakout', 'sideways_bb_std_mult': 3.0087674231252093, 'sideways_rsi_os': 35, 'sideways_rsi_ob': 88, 'sideways_adx_thresh': 16.834122403832342, 'sideways_atr_min_pct': 0.003137483813930896, 'sideways_atr_max_pct': 0.07330721988090774, 'sideways_tp_mult': 1.794530926592476, 'sideways_tsl_mult': 0.09887397336426945, 'sideways_time_stop': 220, 'sideways_use_sma': False, 'sideways_use_ema': False, 'sideways_use_atr': False, 'sideways_use_adx': True, 'sideways_use_spike': True, 'sideways_rsi_required': True}.
[I 2025-08-30 14:52:00,472] Trial 256 finished with values: [-0.019132768772739284, 0.019251081694886263] and parameters: {'p_sma': 56, 'p_std': 29, 'p_atr': 13, 'p_adx': 14, 'rsi_period': 46, 'ema1': 27, 'ema2': 19, 'slip_atr_k': 0.0033369613540730567, 'slip_spread_k': 0.8245836489298075, 'spread_hl_frac': 0.015064075617607154, 'bb_std_mult': 2.1812625108481614, 'rsi_os': 20, 'rsi_ob': 89, 'vol_spike': 0.24900139261556578, 'adx_thresh': 21.20380997789713, 'atr_min_pct': 0.026280529065969616, 'atr_max_pct': 0.11684708996898852, 'tp_mult': 2.3472040613490672, 'tsl_mult': 0.9539405512185077, 'strategy': 'mean_reversion', 'time_stop': 99, 'use_sma': True, 'use_atr': False, 'use_adx': False, 'use_ema': False, 'use_spike': False, 'rsi_required': False, 'edge_k': 1.6784085168977179, 'edge_cap': 0.7356563163093457, 'bull_strategy': 'breakout', 'bull_bb_std_mult': 3.377478162431902, 'bull_rsi_os': 16, 'bull_rsi_ob': 76, 'bull_adx_thresh': 12.029433826501176, 'bull_atr_min_pct': 0.0036761942183810765, 'bull_atr_max_pct': 0.08979651832942936, 'bull_tp_mult': 2.009357012025156, 'bull_tsl_mult': 0.758003266911109, 'bull_time_stop': 300, 'bull_use_sma': False, 'bull_use_ema': False, 'bull_use_atr': True, 'bull_use_adx': True, 'bull_use_spike': False, 'bull_rsi_required': True, 'bear_strategy': 'breakout', 'bear_bb_std_mult': 1.21996650862102, 'bear_rsi_os': 15, 'bear_rsi_ob': 47, 'bear_adx_thresh': 23.960617965217587, 'bear_atr_min_pct': 0.023771154467897876, 'bear_atr_max_pct': 0.02255244132405986, 'bear_tp_mult': 1.9370140939592444, 'bear_tsl_mult': 0.20162782283469766, 'bear_time_stop': 242, 'bear_use_sma': False, 'bear_use_ema': False, 'bear_use_atr': False, 'bear_use_adx': False, 'bear_use_spike': True, 'bear_rsi_required': True, 'sideways_strategy': 'breakout', 'sideways_bb_std_mult': 1.2606637622123813, 'sideways_rsi_os': 34, 'sideways_rsi_ob': 92, 'sideways_adx_thresh': 16.903043005537693, 'sideways_atr_min_pct': 0.002900107887049286, 'sideways_atr_max_pct': 0.14969480135800903, 'sideways_tp_mult': 1.3013899614692983, 'sideways_tsl_mult': 0.09656130846458551, 'sideways_time_stop': 229, 'sideways_use_sma': False, 'sideways_use_ema': True, 'sideways_use_atr': False, 'sideways_use_adx': True, 'sideways_use_spike': True, 'sideways_rsi_required': True}.
[I 2025-08-30 14:52:00,610] Trial 255 finished with values: [-1000000000.0, 1000000000.0] and parameters: {'p_sma': 29, 'p_std': 5, 'p_atr': 13, 'p_adx': 29, 'rsi_period': 48, 'ema1': 27, 'ema2': 30, 'slip_atr_k': 0.015365746103716953, 'slip_spread_k': 0.5485661279789178, 'spread_hl_frac': 0.03267414365422974, 'bb_std_mult': 2.093587933525824, 'rsi_os': 36, 'rsi_ob': 77, 'vol_spike': 0.2477905060626227, 'adx_thresh': 21.49035240475114, 'atr_min_pct': 0.015482861844874466, 'atr_max_pct': 0.0432768264567589, 'tp_mult': 1.2442013034487491, 'tsl_mult': 0.9616643817807856, 'strategy': 'mean_reversion', 'time_stop': 28, 'use_sma': True, 'use_atr': True, 'use_adx': False, 'use_ema': True, 'use_spike': False, 'rsi_required': False, 'edge_k': 1.7102023475093588, 'edge_cap': 0.15012719102131655, 'bull_strategy': 'breakout', 'bull_bb_std_mult': 2.0433763989933618, 'bull_rsi_os': 28, 'bull_rsi_ob': 92, 'bull_adx_thresh': 27.24731140643606, 'bull_atr_min_pct': 0.020523253794136883, 'bull_atr_max_pct': 0.09089483152995625, 'bull_tp_mult': 1.3691773201462312, 'bull_tsl_mult': 0.5554006695484889, 'bull_time_stop': 300, 'bull_use_sma': False, 'bull_use_ema': False, 'bull_use_atr': True, 'bull_use_adx': True, 'bull_use_spike': False, 'bull_rsi_required': True, 'bear_strategy': 'breakout', 'bear_bb_std_mult': 3.1626547722606357, 'bear_rsi_os': 15, 'bear_rsi_ob': 47, 'bear_adx_thresh': 26.407328143595045, 'bear_atr_min_pct': 0.02473166289813102, 'bear_atr_max_pct': 0.021797654914425084, 'bear_tp_mult': 2.0360888023836456, 'bear_tsl_mult': 0.17347554863331074, 'bear_time_stop': 142, 'bear_use_sma': False, 'bear_use_ema': False, 'bear_use_atr': False, 'bear_use_adx': False, 'bear_use_spike': True, 'bear_rsi_required': False, 'sideways_strategy': 'breakout', 'sideways_bb_std_mult': 1.2607166984761884, 'sideways_rsi_os': 34, 'sideways_rsi_ob': 47, 'sideways_adx_thresh': 15.792568664841404, 'sideways_atr_min_pct': 0.002888998229727167, 'sideways_atr_max_pct': 0.13639871674622958, 'sideways_tp_mult': 1.992625726732346, 'sideways_tsl_mult': 0.10571343486612653, 'sideways_time_stop': 229, 'sideways_use_sma': False, 'sideways_use_ema': True, 'sideways_use_atr': False, 'sideways_use_adx': True, 'sideways_use_spike': False, 'sideways_rsi_required': True}.
[I 2025-08-30 14:52:00,690] Trial 257 finished with values: [-1000000000.0, 1000000000.0] and parameters: {'p_sma': 46, 'p_std': 29, 'p_atr': 25, 'p_adx': 21, 'rsi_period': 56, 'ema1': 30, 'ema2': 49, 'slip_atr_k': 0.24410039475379486, 'slip_spread_k': 0.13924311241423037, 'spread_hl_frac': 0.030312798298379146, 'bb_std_mult': 0.6879782862849335, 'rsi_os': 36, 'rsi_ob': 73, 'vol_spike': 0.2930812821665624, 'adx_thresh': 30.46361535817853, 'atr_min_pct': 0.015243378049061895, 'atr_max_pct': 0.06008207758247695, 'tp_mult': 2.7913678753434654, 'tsl_mult': 0.9718060277146797, 'strategy': 'mean_reversion', 'time_stop': 29, 'use_sma': True, 'use_atr': False, 'use_adx': False, 'use_ema': False, 'use_spike': False, 'rsi_required': False, 'edge_k': 1.6837454082332304, 'edge_cap': 0.7425130128445874, 'bull_strategy': 'breakout', 'bull_bb_std_mult': 1.5046672962464849, 'bull_rsi_os': 20, 'bull_rsi_ob': 76, 'bull_adx_thresh': 31.789738819294477, 'bull_atr_min_pct': 0.0016334532492109956, 'bull_atr_max_pct': 0.015319829967208855, 'bull_tp_mult': 2.0036425630744863, 'bull_tsl_mult': 0.495940146959728, 'bull_time_stop': 37, 'bull_use_sma': False, 'bull_use_ema': False, 'bull_use_atr': True, 'bull_use_adx': True, 'bull_use_spike': False, 'bull_rsi_required': True, 'bear_strategy': 'breakout', 'bear_bb_std_mult': 1.3977647641973696, 'bear_rsi_os': 18, 'bear_rsi_ob': 47, 'bear_adx_thresh': 19.15786415630339, 'bear_atr_min_pct': 0.024824755170674666, 'bear_atr_max_pct': 0.023385186802658244, 'bear_tp_mult': 1.9470776167865187, 'bear_tsl_mult': 0.26183174924271213, 'bear_time_stop': 154, 'bear_use_sma': False, 'bear_use_ema': False, 'bear_use_atr': False, 'bear_use_adx': False, 'bear_use_spike': True, 'bear_rsi_required': True, 'sideways_strategy': 'breakout', 'sideways_bb_std_mult': 3.0069520992657, 'sideways_rsi_os': 21, 'sideways_rsi_ob': 88, 'sideways_adx_thresh': 15.728414182636666, 'sideways_atr_min_pct': 0.0034200090684110072, 'sideways_atr_max_pct': 0.07764926541839605, 'sideways_tp_mult': 2.5634832512151884, 'sideways_tsl_mult': 0.9805649251488807, 'sideways_time_stop': 291, 'sideways_use_sma': False, 'sideways_use_ema': False, 'sideways_use_atr': False, 'sideways_use_adx': True, 'sideways_use_spike': True, 'sideways_rsi_required': True}.
[I 2025-08-30 14:52:33,328] Trial 259 finished with values: [-0.026226299911430773, 0.026391535804359847] and parameters: {'p_sma': 56, 'p_std': 33, 'p_atr': 13, 'p_adx': 18, 'rsi_period': 48, 'ema1': 30, 'ema2': 18, 'slip_atr_k': 0.0035819964445599015, 'slip_spread_k': 0.8323549853055237, 'spread_hl_frac': 0.02977769410611556, 'bb_std_mult': 1.5840414174301145, 'rsi_os': 33, 'rsi_ob': 95, 'vol_spike': 0.2480394772321317, 'adx_thresh': 20.86257423453075, 'atr_min_pct': 0.0055728228180024, 'atr_max_pct': 0.10715990828906738, 'tp_mult': 2.603992386058965, 'tsl_mult': 0.938228859413527, 'strategy': 'mean_reversion', 'time_stop': 283, 'use_sma': True, 'use_atr': False, 'use_adx': True, 'use_ema': False, 'use_spike': False, 'rsi_required': False, 'edge_k': 0.03880818770714045, 'edge_cap': 0.709200116084041, 'bull_strategy': 'breakout', 'bull_bb_std_mult': 2.590697906086746, 'bull_rsi_os': 16, 'bull_rsi_ob': 78, 'bull_adx_thresh': 15.404559515791206, 'bull_atr_min_pct': 0.0035911275558880226, 'bull_atr_max_pct': 0.014473988329728151, 'bull_tp_mult': 1.4549732316265345, 'bull_tsl_mult': 0.15554639710585133, 'bull_time_stop': 203, 'bull_use_sma': False, 'bull_use_ema': False, 'bull_use_atr': True, 'bull_use_adx': True, 'bull_use_spike': False, 'bull_rsi_required': True, 'bear_strategy': 'breakout', 'bear_bb_std_mult': 2.2150457886326937, 'bear_rsi_os': 30, 'bear_rsi_ob': 52, 'bear_adx_thresh': 17.19669376391524, 'bear_atr_min_pct': 0.024427872209892742, 'bear_atr_max_pct': 0.05786283542275011, 'bear_tp_mult': 1.9393192630569542, 'bear_tsl_mult': 0.20127925583980888, 'bear_time_stop': 152, 'bear_use_sma': False, 'bear_use_ema': False, 'bear_use_atr': False, 'bear_use_adx': False, 'bear_use_spike': True, 'bear_rsi_required': False, 'sideways_strategy': 'mean_reversion', 'sideways_bb_std_mult': 3.259984304209678, 'sideways_rsi_os': 21, 'sideways_rsi_ob': 59, 'sideways_adx_thresh': 15.75112354566788, 'sideways_atr_min_pct': 0.0028505658558364904, 'sideways_atr_max_pct': 0.07628052513976794, 'sideways_tp_mult': 2.539087903547705, 'sideways_tsl_mult': 0.5337633875679421, 'sideways_time_stop': 239, 'sideways_use_sma': False, 'sideways_use_ema': False, 'sideways_use_atr': False, 'sideways_use_adx': True, 'sideways_use_spike': True, 'sideways_rsi_required': True}.
[I 2025-08-30 14:52:33,608] Trial 262 finished with values: [-0.030094560373169377, 0.030005667936205935] and parameters: {'p_sma': 34, 'p_std': 34, 'p_atr': 12, 'p_adx': 27, 'rsi_period': 35, 'ema1': 26, 'ema2': 34, 'slip_atr_k': 0.0029310784040766386, 'slip_spread_k': 0.2047316884500032, 'spread_hl_frac': 0.015151026790459253, 'bb_std_mult': 1.537505970710153, 'rsi_os': 33, 'rsi_ob': 46, 'vol_spike': 0.11585636647281744, 'adx_thresh': 16.400024223687147, 'atr_min_pct': 0.0016100602534034909, 'atr_max_pct': 0.10721894744484556, 'tp_mult': 2.6189577801845045, 'tsl_mult': 0.6718752309337807, 'strategy': 'breakout', 'time_stop': 282, 'use_sma': True, 'use_atr': False, 'use_adx': True, 'use_ema': False, 'use_spike': False, 'rsi_required': True, 'edge_k': 0.504639295039014, 'edge_cap': 0.2687680482636747, 'bull_strategy': 'mean_reversion', 'bull_bb_std_mult': 1.8245693201823803, 'bull_rsi_os': 17, 'bull_rsi_ob': 79, 'bull_adx_thresh': 13.972101874452743, 'bull_atr_min_pct': 0.0006378273535796401, 'bull_atr_max_pct': 0.03005546112757576, 'bull_tp_mult': 1.6503858366616315, 'bull_tsl_mult': 0.5240336488451823, 'bull_time_stop': 149, 'bull_use_sma': False, 'bull_use_ema': False, 'bull_use_atr': True, 'bull_use_adx': True, 'bull_use_spike': True, 'bull_rsi_required': False, 'bear_strategy': 'mean_reversion', 'bear_bb_std_mult': 2.1863250108902403, 'bear_rsi_os': 18, 'bear_rsi_ob': 52, 'bear_adx_thresh': 24.435978989551593, 'bear_atr_min_pct': 0.023539789437906553, 'bear_atr_max_pct': 0.031231384240450202, 'bear_tp_mult': 2.0792544985608363, 'bear_tsl_mult': 0.20266568680987374, 'bear_time_stop': 126, 'bear_use_sma': True, 'bear_use_ema': False, 'bear_use_atr': False, 'bear_use_adx': True, 'bear_use_spike': True, 'bear_rsi_required': False, 'sideways_strategy': 'mean_reversion', 'sideways_bb_std_mult': 3.176269067412706, 'sideways_rsi_os': 14, 'sideways_rsi_ob': 86, 'sideways_adx_thresh': 16.98751408880472, 'sideways_atr_min_pct': 0.004666748285974586, 'sideways_atr_max_pct': 0.010241362722268929, 'sideways_tp_mult': 2.7538211637863754, 'sideways_tsl_mult': 0.12991652341763354, 'sideways_time_stop': 275, 'sideways_use_sma': False, 'sideways_use_ema': False, 'sideways_use_atr': True, 'sideways_use_adx': False, 'sideways_use_spike': True, 'sideways_rsi_required': False}.
