[I 2025-08-30 16:37:42,287] Trial 820 finished with values: [-1000000000.0, 1000000000.0] and parameters: {'p_sma': 55, 'p_std': 53, 'p_atr': 27, 'p_adx': 12, 'rsi_period': 11, 'ema1': 24, 'ema2': 32, 'slip_atr_k': 0.232228181811921, 'slip_spread_k': 0.1456019024479051, 'spread_hl_frac': 0.024298998901798523, 'bb_std_mult': 2.423185398154281, 'rsi_os': 35, 'rsi_ob': 74, 'vol_spike': 0.2136995201551042, 'adx_thresh': 15.893626941593554, 'atr_min_pct': 0.029974506662340986, 'atr_max_pct': 0.14366695626232207, 'tp_mult': 1.8184362811769248, 'tsl_mult': 0.5319437350457628, 'strategy': 'mean_reversion', 'time_stop': 45, 'use_sma': True, 'use_atr': False, 'use_adx': False, 'use_ema': False, 'use_spike': True, 'rsi_required': False, 'edge_k': 0.36562851419200554, 'edge_cap': 0.5623198949860689, 'bull_strategy': 'breakout', 'bull_bb_std_mult': 0.7210779105033917, 'bull_rsi_os': 50, 'bull_rsi_ob': 74, 'bull_adx_thresh': 28.014579017003584, 'bull_atr_min_pct': 0.01968844680289108, 'bull_atr_max_pct': 0.14454126799574332, 'bull_tp_mult': 2.3770901270126292, 'bull_tsl_mult': 0.18109199285661193, 'bull_time_stop': 25, 'bull_use_sma': True, 'bull_use_ema': True, 'bull_use_atr': True, 'bull_use_adx': True, 'bull_use_spike': True, 'bull_rsi_required': True, 'bear_strategy': 'breakout', 'bear_bb_std_mult': 2.5123492343314737, 'bear_rsi_os': 32, 'bear_rsi_ob': 57, 'bear_adx_thresh': 16.61833712418099, 'bear_atr_min_pct': 0.020808547274129553, 'bear_atr_max_pct': 0.1327864205883683, 'bear_tp_mult': 2.618411554470555, 'bear_tsl_mult': 0.7219760982821937, 'bear_time_stop': 5, 'bear_use_sma': False, 'bear_use_ema': False, 'bear_use_atr': True, 'bear_use_adx': True, 'bear_use_spike': True, 'bear_rsi_required': True, 'sideways_strategy': 'mean_reversion', 'sideways_bb_std_mult': 1.1202155401424492, 'sideways_rsi_os': 38, 'sideways_rsi_ob': 62, 'sideways_adx_thresh': 31.257788613259677, 'sideways_atr_min_pct': 0.027632400010337295, 'sideways_atr_max_pct': 0.014099581222164106, 'sideways_tp_mult': 2.886857056369445, 'sideways_tsl_mult': 0.2621608801288135, 'sideways_time_stop': 195, 'sideways_use_sma': True, 'sideways_use_ema': True, 'sideways_use_atr': False, 'sideways_use_adx': True, 'sideways_use_spike': True, 'sideways_rsi_required': True}.
[I 2025-08-30 16:37:42,899] Trial 819 finished with values: [-1000000000.0, 1000000000.0] and parameters: {'p_sma': 6, 'p_std': 52, 'p_atr': 28, 'p_adx': 15, 'rsi_period': 80, 'ema1': 11, 'ema2': 33, 'slip_atr_k': 0.0787619620912379, 'slip_spread_k': 0.14810679832879664, 'spread_hl_frac': 0.010316774280591074, 'bb_std_mult': 2.489399710185265, 'rsi_os': 16, 'rsi_ob': 77, 'vol_spike': 0.21375632106109183, 'adx_thresh': 14.604974903893343, 'atr_min_pct': 0.014945082998834062, 'atr_max_pct': 0.07465999810677194, 'tp_mult': 2.853167734858292, 'tsl_mult': 0.26670608620666314, 'strategy': 'mean_reversion', 'time_stop': 198, 'use_sma': True, 'use_atr': True, 'use_adx': False, 'use_ema': True, 'use_spike': True, 'rsi_required': False, 'edge_k': 0.35075149047453535, 'edge_cap': 0.5661508549101809, 'bull_strategy': 'breakout', 'bull_bb_std_mult': 0.7129880375728981, 'bull_rsi_os': 40, 'bull_rsi_ob': 67, 'bull_adx_thresh': 28.710529458869914, 'bull_atr_min_pct': 0.021468170169588737, 'bull_atr_max_pct': 0.08480753713894082, 'bull_tp_mult': 2.115222310904459, 'bull_tsl_mult': 0.21969055059270592, 'bull_time_stop': 30, 'bull_use_sma': True, 'bull_use_ema': True, 'bull_use_atr': True, 'bull_use_adx': True, 'bull_use_spike': True, 'bull_rsi_required': True, 'bear_strategy': 'breakout', 'bear_bb_std_mult': 2.655269400685922, 'bear_rsi_os': 53, 'bear_rsi_ob': 45, 'bear_adx_thresh': 5.024231973347831, 'bear_atr_min_pct': 0.018743258797159042, 'bear_atr_max_pct': 0.07547230404449434, 'bear_tp_mult': 1.9143164022477304, 'bear_tsl_mult': 0.4691900282328385, 'bear_time_stop': 258, 'bear_use_sma': False, 'bear_use_ema': False, 'bear_use_atr': True, 'bear_use_adx': True, 'bear_use_spike': True, 'bear_rsi_required': True, 'sideways_strategy': 'breakout', 'sideways_bb_std_mult': 1.3355290273029716, 'sideways_rsi_os': 50, 'sideways_rsi_ob': 62, 'sideways_adx_thresh': 34.94530443014685, 'sideways_atr_min_pct': 0.0016267436889552686, 'sideways_atr_max_pct': 0.10450409805019585, 'sideways_tp_mult': 2.888109336833328, 'sideways_tsl_mult': 0.5346613289252194, 'sideways_time_stop': 299, 'sideways_use_sma': True, 'sideways_use_ema': True, 'sideways_use_atr': False, 'sideways_use_adx': True, 'sideways_use_spike': True, 'sideways_rsi_required': True}.
[I 2025-08-30 16:37:44,563] Trial 823 finished with values: [-1000000000.0, 1000000000.0] and parameters: {'p_sma': 7, 'p_std': 56, 'p_atr': 8, 'p_adx': 15, 'rsi_period': 80, 'ema1': 12, 'ema2': 30, 'slip_atr_k': 0.07317140659273148, 'slip_spread_k': 0.12080920457269537, 'spread_hl_frac': 0.011245655402553779, 'bb_std_mult': 2.536906352497702, 'rsi_os': 42, 'rsi_ob': 48, 'vol_spike': 0.08270406573103754, 'adx_thresh': 15.327627967308457, 'atr_min_pct': 0.0038725843856877423, 'atr_max_pct': 0.06347762472671413, 'tp_mult': 1.9718116903643315, 'tsl_mult': 0.2663877870162377, 'strategy': 'mean_reversion', 'time_stop': 199, 'use_sma': True, 'use_atr': True, 'use_adx': False, 'use_ema': False, 'use_spike': True, 'rsi_required': False, 'edge_k': 0.7407062268546858, 'edge_cap': 0.865753027803351, 'bull_strategy': 'breakout', 'bull_bb_std_mult': 1.4038897590614818, 'bull_rsi_os': 19, 'bull_rsi_ob': 61, 'bull_adx_thresh': 31.792237102822703, 'bull_atr_min_pct': 0.025590083295199267, 'bull_atr_max_pct': 0.09010603675222442, 'bull_tp_mult': 1.9843519750103984, 'bull_tsl_mult': 0.09758634727172093, 'bull_time_stop': 251, 'bull_use_sma': True, 'bull_use_ema': True, 'bull_use_atr': True, 'bull_use_adx': True, 'bull_use_spike': True, 'bull_rsi_required': True, 'bear_strategy': 'mean_reversion', 'bear_bb_std_mult': 2.663180585946715, 'bear_rsi_os': 33, 'bear_rsi_ob': 69, 'bear_adx_thresh': 30.743113449434883, 'bear_atr_min_pct': 0.027358060239569215, 'bear_atr_max_pct': 0.060499050262149454, 'bear_tp_mult': 2.9227534275575513, 'bear_tsl_mult': 0.5562918708761608, 'bear_time_stop': 263, 'bear_use_sma': False, 'bear_use_ema': False, 'bear_use_atr': True, 'bear_use_adx': True, 'bear_use_spike': True, 'bear_rsi_required': False, 'sideways_strategy': 'mean_reversion', 'sideways_bb_std_mult': 1.290361510331036, 'sideways_rsi_os': 50, 'sideways_rsi_ob': 61, 'sideways_adx_thresh': 6.487357109314587, 'sideways_atr_min_pct': 0.00681765134310108, 'sideways_atr_max_pct': 0.10402035239484154, 'sideways_tp_mult': 1.4538290106873166, 'sideways_tsl_mult': 0.7249769001048886, 'sideways_time_stop': 300, 'sideways_use_sma': True, 'sideways_use_ema': True, 'sideways_use_atr': False, 'sideways_use_adx': True, 'sideways_use_spike': True, 'sideways_rsi_required': True}.
[I 2025-08-30 16:38:30,118] Trial 824 finished with values: [-1000000000.0, 1000000000.0] and parameters: {'p_sma': 7, 'p_std': 56, 'p_atr': 27, 'p_adx': 29, 'rsi_period': 63, 'ema1': 22, 'ema2': 25, 'slip_atr_k': 0.09382089666462021, 'slip_spread_k': 0.10940520762442911, 'spread_hl_frac': 0.023471821163342583, 'bb_std_mult': 0.5516726428565537, 'rsi_os': 42, 'rsi_ob': 75, 'vol_spike': 0.2330384768881824, 'adx_thresh': 15.220214538922614, 'atr_min_pct': 0.026196743165223482, 'atr_max_pct': 0.06283739406199233, 'tp_mult': 1.5205209628823213, 'tsl_mult': 0.3002342798188815, 'strategy': 'mean_reversion', 'time_stop': 191, 'use_sma': True, 'use_atr': False, 'use_adx': False, 'use_ema': False, 'use_spike': True, 'rsi_required': False, 'edge_k': 0.7582419472313136, 'edge_cap': 0.052511453485441506, 'bull_strategy': 'breakout', 'bull_bb_std_mult': 1.3850553736138504, 'bull_rsi_os': 18, 'bull_rsi_ob': 61, 'bull_adx_thresh': 15.298503859830646, 'bull_atr_min_pct': 0.019272199620484574, 'bull_atr_max_pct': 0.09245621108112452, 'bull_tp_mult': 1.9836825265645148, 'bull_tsl_mult': 0.4741135954951533, 'bull_time_stop': 290, 'bull_use_sma': True, 'bull_use_ema': True, 'bull_use_atr': True, 'bull_use_adx': True, 'bull_use_spike': True, 'bull_rsi_required': True, 'bear_strategy': 'mean_reversion', 'bear_bb_std_mult': 2.0541396020878073, 'bear_rsi_os': 33, 'bear_rsi_ob': 54, 'bear_adx_thresh': 30.391097731025738, 'bear_atr_min_pct': 0.01926205163821902, 'bear_atr_max_pct': 0.06539701014535892, 'bear_tp_mult': 2.337064499144637, 'bear_tsl_mult': 0.5458492990974833, 'bear_time_stop': 191, 'bear_use_sma': False, 'bear_use_ema': False, 'bear_use_atr': True, 'bear_use_adx': True, 'bear_use_spike': True, 'bear_rsi_required': False, 'sideways_strategy': 'mean_reversion', 'sideways_bb_std_mult': 0.888885410396546, 'sideways_rsi_os': 39, 'sideways_rsi_ob': 52, 'sideways_adx_thresh': 25.225413963599642, 'sideways_atr_min_pct': 0.000617868380349339, 'sideways_atr_max_pct': 0.04255044284882403, 'sideways_tp_mult': 1.6221647574751608, 'sideways_tsl_mult': 0.329924268650442, 'sideways_time_stop': 214, 'sideways_use_sma': True, 'sideways_use_ema': True, 'sideways_use_atr': False, 'sideways_use_adx': True, 'sideways_use_spike': False, 'sideways_rsi_required': True}.
[I 2025-08-30 16:38:32,519] Trial 821 finished with values: [-1000000000.0, 1000000000.0] and parameters: {'p_sma': 7, 'p_std': 37, 'p_atr': 27, 'p_adx': 15, 'rsi_period': 80, 'ema1': 11, 'ema2': 42, 'slip_atr_k': 0.06824048095681788, 'slip_spread_k': 0.5274484854156776, 'spread_hl_frac': 0.02430952917134686, 'bb_std_mult': 2.463384770841977, 'rsi_os': 5, 'rsi_ob': 77, 'vol_spike': 0.15463157439031477, 'adx_thresh': 15.177935292208339, 'atr_min_pct': 0.02995683132460013, 'atr_max_pct': 0.14669456364602923, 'tp_mult': 2.844180490789563, 'tsl_mult': 0.5281543213177526, 'strategy': 'mean_reversion', 'time_stop': 202, 'use_sma': True, 'use_atr': False, 'use_adx': False, 'use_ema': False, 'use_spike': True, 'rsi_required': False, 'edge_k': 0.43464405047535765, 'edge_cap': 0.5714475884057303, 'bull_strategy': 'breakout', 'bull_bb_std_mult': 0.6974180210925229, 'bull_rsi_os': 18, 'bull_rsi_ob': 61, 'bull_adx_thresh': 31.767369740045925, 'bull_atr_min_pct': 0.019519506260794385, 'bull_atr_max_pct': 0.10143877412818902, 'bull_tp_mult': 1.988805407188655, 'bull_tsl_mult': 0.2021067576613116, 'bull_time_stop': 27, 'bull_use_sma': True, 'bull_use_ema': True, 'bull_use_atr': True, 'bull_use_adx': True, 'bull_use_spike': True, 'bull_rsi_required': True, 'bear_strategy': 'breakout', 'bear_bb_std_mult': 2.6631798926375403, 'bear_rsi_os': 33, 'bear_rsi_ob': 69, 'bear_adx_thresh': 26.238410465769398, 'bear_atr_min_pct': 0.021772043961401193, 'bear_atr_max_pct': 0.1130456143261232, 'bear_tp_mult': 2.325842079181057, 'bear_tsl_mult': 0.5606722342743168, 'bear_time_stop': 257, 'bear_use_sma': False, 'bear_use_ema': False, 'bear_use_atr': True, 'bear_use_adx': True, 'bear_use_spike': True, 'bear_rsi_required': True, 'sideways_strategy': 'mean_reversion', 'sideways_bb_std_mult': 1.318728369238471, 'sideways_rsi_os': 39, 'sideways_rsi_ob': 62, 'sideways_adx_thresh': 31.32836474417354, 'sideways_atr_min_pct': 0.006724443428319831, 'sideways_atr_max_pct': 0.10428292954213053, 'sideways_tp_mult': 1.8868673870743229, 'sideways_tsl_mult': 0.7609521503379619, 'sideways_time_stop': 94, 'sideways_use_sma': True, 'sideways_use_ema': True, 'sideways_use_atr': False, 'sideways_use_adx': True, 'sideways_use_spike': True, 'sideways_rsi_required': True}.
[I 2025-08-30 16:38:34,201] Trial 822 finished with values: [-1000000000.0, 1000000000.0] and parameters: {'p_sma': 7, 'p_std': 54, 'p_atr': 27, 'p_adx': 10, 'rsi_period': 79, 'ema1': 23, 'ema2': 54, 'slip_atr_k': 0.0744599144028004, 'slip_spread_k': 0.7432695475187884, 'spread_hl_frac': 0.02413570162352368, 'bb_std_mult': 2.4627385577409666, 'rsi_os': 5, 'rsi_ob': 74, 'vol_spike': 0.1622922735181316, 'adx_thresh': 15.708473939920575, 'atr_min_pct': 0.015098538303622738, 'atr_max_pct': 0.06519902351836175, 'tp_mult': 2.11872760654887, 'tsl_mult': 0.2974378647167262, 'strategy': 'mean_reversion', 'time_stop': 190, 'use_sma': True, 'use_atr': False, 'use_adx': False, 'use_ema': False, 'use_spike': True, 'rsi_required': False, 'edge_k': 1.2228994445704633, 'edge_cap': 0.869148352215243, 'bull_strategy': 'breakout', 'bull_bb_std_mult': 1.424825499248276, 'bull_rsi_os': 18, 'bull_rsi_ob': 58, 'bull_adx_thresh': 27.92135441311894, 'bull_atr_min_pct': 0.011075670628765775, 'bull_atr_max_pct': 0.09159838999239754, 'bull_tp_mult': 1.9658137264043782, 'bull_tsl_mult': 0.08891447242775004, 'bull_time_stop': 31, 'bull_use_sma': True, 'bull_use_ema': True, 'bull_use_atr': True, 'bull_use_adx': True, 'bull_use_spike': True, 'bull_rsi_required': True, 'bear_strategy': 'mean_reversion', 'bear_bb_std_mult': 2.4565449076969186, 'bear_rsi_os': 33, 'bear_rsi_ob': 83, 'bear_adx_thresh': 30.42475573576618, 'bear_atr_min_pct': 0.019164360477277487, 'bear_atr_max_pct': 0.13269659731322597, 'bear_tp_mult': 2.916806810659322, 'bear_tsl_mult': 0.22464202073122966, 'bear_time_stop': 262, 'bear_use_sma': False, 'bear_use_ema': False, 'bear_use_atr': True, 'bear_use_adx': True, 'bear_use_spike': True, 'bear_rsi_required': False, 'sideways_strategy': 'mean_reversion', 'sideways_bb_std_mult': 1.284091114228779, 'sideways_rsi_os': 24, 'sideways_rsi_ob': 61, 'sideways_adx_thresh': 25.138824310755066, 'sideways_atr_min_pct': 0.0016316300108457616, 'sideways_atr_max_pct': 0.029064460514300776, 'sideways_tp_mult': 1.4494994830804555, 'sideways_tsl_mult': 0.7334678934433548, 'sideways_time_stop': 88, 'sideways_use_sma': True, 'sideways_use_ema': True, 'sideways_use_atr': False, 'sideways_use_adx': True, 'sideways_use_spike': True, 'sideways_rsi_required': True}.
[I 2025-08-30 16:38:36,034] Trial 825 finished with values: [-0.04183096478714399, 0.041752358088614876] and parameters: {'p_sma': 5, 'p_std': 54, 'p_atr': 26, 'p_adx': 10, 'rsi_period': 27, 'ema1': 22, 'ema2': 48, 'slip_atr_k': 0.06763310678736954, 'slip_spread_k': 0.8048948307247406, 'spread_hl_frac': 0.03215182801229651, 'bb_std_mult': 2.263424106758074, 'rsi_os': 15, 'rsi_ob': 75, 'vol_spike': 0.1219433916835276, 'adx_thresh': 22.340722568829026, 'atr_min_pct': 0.015459437348090355, 'atr_max_pct': 0.0682067819412869, 'tp_mult': 2.0244686666092453, 'tsl_mult': 0.2988691005273511, 'strategy': 'mean_reversion', 'time_stop': 222, 'use_sma': True, 'use_atr': False, 'use_adx': False, 'use_ema': True, 'use_spike': False, 'rsi_required': False, 'edge_k': 0.46982328230240133, 'edge_cap': 0.588855653032844, 'bull_strategy': 'breakout', 'bull_bb_std_mult': 0.8617058496518196, 'bull_rsi_os': 47, 'bull_rsi_ob': 63, 'bull_adx_thresh': 23.973397564336796, 'bull_atr_min_pct': 0.013781271211399061, 'bull_atr_max_pct': 0.09276212589205142, 'bull_tp_mult': 2.0640508065371375, 'bull_tsl_mult': 0.8094282245404639, 'bull_time_stop': 291, 'bull_use_sma': True, 'bull_use_ema': True, 'bull_use_atr': True, 'bull_use_adx': True, 'bull_use_spike': True, 'bull_rsi_required': True, 'bear_strategy': 'mean_reversion', 'bear_bb_std_mult': 2.452059836023152, 'bear_rsi_os': 31, 'bear_rsi_ob': 88, 'bear_adx_thresh': 30.405245008541648, 'bear_atr_min_pct': 0.019346331542121467, 'bear_atr_max_pct': 0.09011387548289901, 'bear_tp_mult': 2.791950444035523, 'bear_tsl_mult': 0.3589872120027153, 'bear_time_stop': 249, 'bear_use_sma': False, 'bear_use_ema': False, 'bear_use_atr': True, 'bear_use_adx': True, 'bear_use_spike': True, 'bear_rsi_required': False, 'sideways_strategy': 'breakout', 'sideways_bb_std_mult': 1.4769069996390547, 'sideways_rsi_os': 39, 'sideways_rsi_ob': 60, 'sideways_adx_thresh': 25.137967946154294, 'sideways_atr_min_pct': 0.0005782474776277741, 'sideways_atr_max_pct': 0.1109845795852888, 'sideways_tp_mult': 2.9995972284481773, 'sideways_tsl_mult': 0.9657321006203893, 'sideways_time_stop': 276, 'sideways_use_sma': False, 'sideways_use_ema': True, 'sideways_use_atr': False, 'sideways_use_adx': True, 'sideways_use_spike': False, 'sideways_rsi_required': True}.
[I 2025-08-30 16:39:18,405] Trial 827 finished with values: [-1000000000.0, 1000000000.0] and parameters: {'p_sma': 5, 'p_std': 54, 'p_atr': 26, 'p_adx': 10, 'rsi_period': 27, 'ema1': 23, 'ema2': 48, 'slip_atr_k': 0.16128266776866015, 'slip_spread_k': 0.11948567867553025, 'spread_hl_frac': 0.02599547818593956, 'bb_std_mult': 2.2725554833790786, 'rsi_os': 14, 'rsi_ob': 73, 'vol_spike': 0.007656834363590825, 'adx_thresh': 26.54719951725712, 'atr_min_pct': 0.004946051186225918, 'atr_max_pct': 0.06706959687319013, 'tp_mult': 2.040503458528482, 'tsl_mult': 0.1698416875157846, 'strategy': 'mean_reversion', 'time_stop': 68, 'use_sma': True, 'use_atr': True, 'use_adx': False, 'use_ema': True, 'use_spike': False, 'rsi_required': False, 'edge_k': 0.48010454889851634, 'edge_cap': 0.5985822957399426, 'bull_strategy': 'breakout', 'bull_bb_std_mult': 2.121701311825847, 'bull_rsi_os': 41, 'bull_rsi_ob': 82, 'bull_adx_thresh': 23.209745978404747, 'bull_atr_min_pct': 0.009271287270779601, 'bull_atr_max_pct': 0.12257671860966633, 'bull_tp_mult': 2.060643796883705, 'bull_tsl_mult': 0.1257826391794742, 'bull_time_stop': 239, 'bull_use_sma': True, 'bull_use_ema': True, 'bull_use_atr': True, 'bull_use_adx': True, 'bull_use_spike': True, 'bull_rsi_required': True, 'bear_strategy': 'mean_reversion', 'bear_bb_std_mult': 2.4655160935824667, 'bear_rsi_os': 31, 'bear_rsi_ob': 88, 'bear_adx_thresh': 28.67921666166236, 'bear_atr_min_pct': 0.01994222518216185, 'bear_atr_max_pct': 0.08995421559186895, 'bear_tp_mult': 2.771454475730479, 'bear_tsl_mult': 0.23290117303021424, 'bear_time_stop': 270, 'bear_use_sma': False, 'bear_use_ema': False, 'bear_use_atr': True, 'bear_use_adx': True, 'bear_use_spike': True, 'bear_rsi_required': True, 'sideways_strategy': 'breakout', 'sideways_bb_std_mult': 1.4203983747884275, 'sideways_rsi_os': 16, 'sideways_rsi_ob': 61, 'sideways_adx_thresh': 24.546830053625754, 'sideways_atr_min_pct': 0.0010015109228457724, 'sideways_atr_max_pct': 0.10225727758910148, 'sideways_tp_mult': 2.9986969829119428, 'sideways_tsl_mult': 0.8752645269475001, 'sideways_time_stop': 160, 'sideways_use_sma': False, 'sideways_use_ema': False, 'sideways_use_atr': False, 'sideways_use_adx': True, 'sideways_use_spike': False, 'sideways_rsi_required': True}.
[I 2025-08-30 16:39:19,027] Trial 826 finished with values: [-1000000000.0, 1000000000.0] and parameters: {'p_sma': 5, 'p_std': 36, 'p_atr': 26, 'p_adx': 10, 'rsi_period': 78, 'ema1': 23, 'ema2': 49, 'slip_atr_k': 0.0687289386225104, 'slip_spread_k': 0.5391792740212942, 'spread_hl_frac': 0.024519094803922267, 'bb_std_mult': 2.265669250201148, 'rsi_os': 40, 'rsi_ob': 73, 'vol_spike': 0.15555835780095748, 'adx_thresh': 14.421171728281584, 'atr_min_pct': 0.02281382106244056, 'atr_max_pct': 0.0667608412156577, 'tp_mult': 2.043574572947191, 'tsl_mult': 0.8705903489915899, 'strategy': 'mean_reversion', 'time_stop': 233, 'use_sma': True, 'use_atr': True, 'use_adx': False, 'use_ema': True, 'use_spike': False, 'rsi_required': False, 'edge_k': 0.49046957270398905, 'edge_cap': 0.6525129524925201, 'bull_strategy': 'breakout', 'bull_bb_std_mult': 0.8560584518774993, 'bull_rsi_os': 40, 'bull_rsi_ob': 56, 'bull_adx_thresh': 24.02836537462036, 'bull_atr_min_pct': 0.013456906116292524, 'bull_atr_max_pct': 0.0924886469008186, 'bull_tp_mult': 2.068059765195823, 'bull_tsl_mult': 0.12533336111776353, 'bull_time_stop': 244, 'bull_use_sma': True, 'bull_use_ema': True, 'bull_use_atr': True, 'bull_use_adx': True, 'bull_use_spike': True, 'bull_rsi_required': True, 'bear_strategy': 'mean_reversion', 'bear_bb_std_mult': 2.445330973861189, 'bear_rsi_os': 32, 'bear_rsi_ob': 82, 'bear_adx_thresh': 26.47906641600614, 'bear_atr_min_pct': 0.020161040385754617, 'bear_atr_max_pct': 0.07977286996774546, 'bear_tp_mult': 2.7876426482288235, 'bear_tsl_mult': 0.11003330766710939, 'bear_time_stop': 269, 'bear_use_sma': False, 'bear_use_ema': False, 'bear_use_atr': True, 'bear_use_adx': True, 'bear_use_spike': True, 'bear_rsi_required': True, 'sideways_strategy': 'breakout', 'sideways_bb_std_mult': 0.99554299944272, 'sideways_rsi_os': 19, 'sideways_rsi_ob': 60, 'sideways_adx_thresh': 23.397484713759766, 'sideways_atr_min_pct': 0.001033462434672559, 'sideways_atr_max_pct': 0.11148245232066284, 'sideways_tp_mult': 2.077099274785507, 'sideways_tsl_mult': 0.3967613432355426, 'sideways_time_stop': 53, 'sideways_use_sma': False, 'sideways_use_ema': False, 'sideways_use_atr': False, 'sideways_use_adx': True, 'sideways_use_spike': True, 'sideways_rsi_required': True}.
