[I 2025-08-30 15:17:37,867] Trial 416 finished with values: [-1000000000.0, 1000000000.0] and parameters: {'p_sma': 6, 'p_std': 58, 'p_atr': 15, 'p_adx': 26, 'rsi_period': 78, 'ema1': 13, 'ema2': 29, 'slip_atr_k': 0.14576961814777437, 'slip_spread_k': 0.12759641107715347, 'spread_hl_frac': 0.026127013082752323, 'bb_std_mult': 0.804534086733522, 'rsi_os': 51, 'rsi_ob': 73, 'vol_spike': 0.13607074836934663, 'adx_thresh': 13.515718106491178, 'atr_min_pct': 0.013389966366825726, 'atr_max_pct': 0.07535274711080946, 'tp_mult': 1.8560018530446023, 'tsl_mult': 0.6347847360763481, 'strategy': 'breakout', 'time_stop': 138, 'use_sma': False, 'use_atr': True, 'use_adx': False, 'use_ema': True, 'use_spike': True, 'rsi_required': True, 'edge_k': 0.13138754551687823, 'edge_cap': 0.812686337144362, 'bull_strategy': 'mean_reversion', 'bull_bb_std_mult': 1.9909735182407826, 'bull_rsi_os': 40, 'bull_rsi_ob': 52, 'bull_adx_thresh': 19.630040386736304, 'bull_atr_min_pct': 0.025186383092087983, 'bull_atr_max_pct': 0.14756189234270195, 'bull_tp_mult': 2.1645223450211533, 'bull_tsl_mult': 0.33247391633542334, 'bull_time_stop': 202, 'bull_use_sma': False, 'bull_use_ema': True, 'bull_use_atr': False, 'bull_use_adx': False, 'bull_use_spike': True, 'bull_rsi_required': False, 'bear_strategy': 'mean_reversion', 'bear_bb_std_mult': 0.7365462855400888, 'bear_rsi_os': 28, 'bear_rsi_ob': 80, 'bear_adx_thresh': 26.382756734322736, 'bear_atr_min_pct': 0.02270086484343012, 'bear_atr_max_pct': 0.06721970375898081, 'bear_tp_mult': 1.5141729573095302, 'bear_tsl_mult': 0.967238926622485, 'bear_time_stop': 156, 'bear_use_sma': True, 'bear_use_ema': True, 'bear_use_atr': True, 'bear_use_adx': True, 'bear_use_spike': False, 'bear_rsi_required': True, 'sideways_strategy': 'breakout', 'sideways_bb_std_mult': 1.031641293471363, 'sideways_rsi_os': 46, 'sideways_rsi_ob': 59, 'sideways_adx_thresh': 27.418866214988892, 'sideways_atr_min_pct': 0.018577320370692926, 'sideways_atr_max_pct': 0.1088360571737781, 'sideways_tp_mult': 2.446537906226643, 'sideways_tsl_mult': 0.9537055823788013, 'sideways_time_stop': 71, 'sideways_use_sma': True, 'sideways_use_ema': True, 'sideways_use_atr': True, 'sideways_use_adx': False, 'sideways_use_spike': True, 'sideways_rsi_required': False}.
[I 2025-08-30 15:17:38,992] Trial 415 finished with values: [-1000000000.0, 1000000000.0] and parameters: {'p_sma': 5, 'p_std': 58, 'p_atr': 15, 'p_adx': 25, 'rsi_period': 78, 'ema1': 30, 'ema2': 29, 'slip_atr_k': 0.11261573725833136, 'slip_spread_k': 0.11507374241076089, 'spread_hl_frac': 0.0260368392542796, 'bb_std_mult': 1.0787974398667302, 'rsi_os': 12, 'rsi_ob': 73, 'vol_spike': 0.16499288760728895, 'adx_thresh': 13.481184175773226, 'atr_min_pct': 0.01341589243021755, 'atr_max_pct': 0.13675732134314994, 'tp_mult': 1.8343837529259504, 'tsl_mult': 0.6256384315653617, 'strategy': 'breakout', 'time_stop': 130, 'use_sma': False, 'use_atr': True, 'use_adx': False, 'use_ema': True, 'use_spike': True, 'rsi_required': True, 'edge_k': 0.5359362855472929, 'edge_cap': 0.46234915058252357, 'bull_strategy': 'mean_reversion', 'bull_bb_std_mult': 1.3811032640455776, 'bull_rsi_os': 36, 'bull_rsi_ob': 49, 'bull_adx_thresh': 19.885604158202817, 'bull_atr_min_pct': 0.028464864152059656, 'bull_atr_max_pct': 0.06353498244856716, 'bull_tp_mult': 2.179475705658333, 'bull_tsl_mult': 0.361346932754402, 'bull_time_stop': 188, 'bull_use_sma': False, 'bull_use_ema': False, 'bull_use_atr': False, 'bull_use_adx': False, 'bull_use_spike': True, 'bull_rsi_required': False, 'bear_strategy': 'mean_reversion', 'bear_bb_std_mult': 3.5874530047604773, 'bear_rsi_os': 28, 'bear_rsi_ob': 80, 'bear_adx_thresh': 28.987425140268883, 'bear_atr_min_pct': 0.02880778935424749, 'bear_atr_max_pct': 0.06819259719513672, 'bear_tp_mult': 1.5293082842148487, 'bear_tsl_mult': 0.8753610247841906, 'bear_time_stop': 280, 'bear_use_sma': True, 'bear_use_ema': True, 'bear_use_atr': True, 'bear_use_adx': False, 'bear_use_spike': False, 'bear_rsi_required': True, 'sideways_strategy': 'breakout', 'sideways_bb_std_mult': 0.9887153766352461, 'sideways_rsi_os': 46, 'sideways_rsi_ob': 59, 'sideways_adx_thresh': 27.27154134344369, 'sideways_atr_min_pct': 0.027003923539581746, 'sideways_atr_max_pct': 0.10826929436860935, 'sideways_tp_mult': 1.5726804714369844, 'sideways_tsl_mult': 0.9999545366980496, 'sideways_time_stop': 91, 'sideways_use_sma': True, 'sideways_use_ema': True, 'sideways_use_atr': True, 'sideways_use_adx': False, 'sideways_use_spike': True, 'sideways_rsi_required': False}.
[I 2025-08-30 15:17:39,482] Trial 414 finished with values: [-0.013548744368382049, 0.013475942387124878] and parameters: {'p_sma': 5, 'p_std': 58, 'p_atr': 15, 'p_adx': 25, 'rsi_period': 78, 'ema1': 30, 'ema2': 35, 'slip_atr_k': 0.10740337187697974, 'slip_spread_k': 0.1265091806980027, 'spread_hl_frac': 0.02610080096274365, 'bb_std_mult': 1.0617000298804866, 'rsi_os': 25, 'rsi_ob': 73, 'vol_spike': 0.1665178581192682, 'adx_thresh': 11.01106313253177, 'atr_min_pct': 0.013298761513870539, 'atr_max_pct': 0.12855356062512746, 'tp_mult': 1.8642799544237514, 'tsl_mult': 0.6346259038289866, 'strategy': 'breakout', 'time_stop': 159, 'use_sma': False, 'use_atr': True, 'use_adx': False, 'use_ema': True, 'use_spike': True, 'rsi_required': True, 'edge_k': 0.5104351645679281, 'edge_cap': 0.12025050736863346, 'bull_strategy': 'mean_reversion', 'bull_bb_std_mult': 2.2639989410555064, 'bull_rsi_os': 36, 'bull_rsi_ob': 52, 'bull_adx_thresh': 21.40033739852471, 'bull_atr_min_pct': 0.023139248360735172, 'bull_atr_max_pct': 0.059599875206882674, 'bull_tp_mult': 2.184309531771475, 'bull_tsl_mult': 0.4113280156990289, 'bull_time_stop': 205, 'bull_use_sma': False, 'bull_use_ema': False, 'bull_use_atr': False, 'bull_use_adx': False, 'bull_use_spike': True, 'bull_rsi_required': False, 'bear_strategy': 'mean_reversion', 'bear_bb_std_mult': 0.7225812112892367, 'bear_rsi_os': 31, 'bear_rsi_ob': 80, 'bear_adx_thresh': 28.762070304771786, 'bear_atr_min_pct': 0.024825737668771348, 'bear_atr_max_pct': 0.06877131245905323, 'bear_tp_mult': 1.5388622747017096, 'bear_tsl_mult': 0.8722993547886709, 'bear_time_stop': 197, 'bear_use_sma': True, 'bear_use_ema': True, 'bear_use_atr': True, 'bear_use_adx': False, 'bear_use_spike': False, 'bear_rsi_required': True, 'sideways_strategy': 'breakout', 'sideways_bb_std_mult': 1.020225117812145, 'sideways_rsi_os': 45, 'sideways_rsi_ob': 59, 'sideways_adx_thresh': 27.373783566626543, 'sideways_atr_min_pct': 0.0009731293219701062, 'sideways_atr_max_pct': 0.013443599920599084, 'sideways_tp_mult': 2.450194864051241, 'sideways_tsl_mult': 0.9482617035522877, 'sideways_time_stop': 71, 'sideways_use_sma': True, 'sideways_use_ema': True, 'sideways_use_atr': True, 'sideways_use_adx': False, 'sideways_use_spike': True, 'sideways_rsi_required': False}.
[I 2025-08-30 15:17:39,787] Trial 417 finished with values: [-1000000000.0, 1000000000.0] and parameters: {'p_sma': 5, 'p_std': 7, 'p_atr': 27, 'p_adx': 26, 'rsi_period': 78, 'ema1': 29, 'ema2': 32, 'slip_atr_k': 0.10680468473039946, 'slip_spread_k': 0.11295464420583001, 'spread_hl_frac': 0.025871450232657717, 'bb_std_mult': 1.059931685973143, 'rsi_os': 53, 'rsi_ob': 50, 'vol_spike': 0.15246899399825317, 'adx_thresh': 10.938705881306545, 'atr_min_pct': 0.01362679641013415, 'atr_max_pct': 0.14311448299222645, 'tp_mult': 1.849707334097409, 'tsl_mult': 0.6340162487728029, 'strategy': 'breakout', 'time_stop': 129, 'use_sma': False, 'use_atr': True, 'use_adx': True, 'use_ema': True, 'use_spike': True, 'rsi_required': True, 'edge_k': 0.5882083366952366, 'edge_cap': 0.12830339923348189, 'bull_strategy': 'mean_reversion', 'bull_bb_std_mult': 2.4843249762603357, 'bull_rsi_os': 45, 'bull_rsi_ob': 52, 'bull_adx_thresh': 26.33453827772847, 'bull_atr_min_pct': 0.018695200773299774, 'bull_atr_max_pct': 0.06352470231045974, 'bull_tp_mult': 2.1351075731276565, 'bull_tsl_mult': 0.3442054789977776, 'bull_time_stop': 187, 'bull_use_sma': False, 'bull_use_ema': True, 'bull_use_atr': False, 'bull_use_adx': False, 'bull_use_spike': True, 'bull_rsi_required': False, 'bear_strategy': 'mean_reversion', 'bear_bb_std_mult': 0.7273613560782856, 'bear_rsi_os': 28, 'bear_rsi_ob': 76, 'bear_adx_thresh': 28.936027919963465, 'bear_atr_min_pct': 0.01866805491042535, 'bear_atr_max_pct': 0.06816948656732481, 'bear_tp_mult': 1.5114743425448667, 'bear_tsl_mult': 0.8669013474909104, 'bear_time_stop': 66, 'bear_use_sma': True, 'bear_use_ema': True, 'bear_use_atr': True, 'bear_use_adx': True, 'bear_use_spike': False, 'bear_rsi_required': True, 'sideways_strategy': 'breakout', 'sideways_bb_std_mult': 2.326900377223832, 'sideways_rsi_os': 43, 'sideways_rsi_ob': 64, 'sideways_adx_thresh': 27.336829385286176, 'sideways_atr_min_pct': 0.02786551793158404, 'sideways_atr_max_pct': 0.10288188091906292, 'sideways_tp_mult': 2.439425523698083, 'sideways_tsl_mult': 0.958096895375341, 'sideways_time_stop': 69, 'sideways_use_sma': True, 'sideways_use_ema': True, 'sideways_use_atr': True, 'sideways_use_adx': False, 'sideways_use_spike': True, 'sideways_rsi_required': False}.
[I 2025-08-30 15:18:28,337] Trial 421 finished with values: [-1000000000.0, 1000000000.0] and parameters: {'p_sma': 6, 'p_std': 60, 'p_atr': 23, 'p_adx': 25, 'rsi_period': 77, 'ema1': 30, 'ema2': 40, 'slip_atr_k': 0.0840031171761861, 'slip_spread_k': 0.1439233621592853, 'spread_hl_frac': 0.026712338658722492, 'bb_std_mult': 1.2947358878850526, 'rsi_os': 26, 'rsi_ob': 72, 'vol_spike': 0.17951212205978398, 'adx_thresh': 11.265789695788897, 'atr_min_pct': 0.012649910533280464, 'atr_max_pct': 0.08089922384648388, 'tp_mult': 1.7599331008456138, 'tsl_mult': 0.8145449346001259, 'strategy': 'breakout', 'time_stop': 160, 'use_sma': False, 'use_atr': True, 'use_adx': False, 'use_ema': True, 'use_spike': True, 'rsi_required': True, 'edge_k': 0.23243544752009726, 'edge_cap': 0.48078436811433606, 'bull_strategy': 'mean_reversion', 'bull_bb_std_mult': 2.088322245663835, 'bull_rsi_os': 37, 'bull_rsi_ob': 50, 'bull_adx_thresh': 21.552783873958145, 'bull_atr_min_pct': 0.020796372190037188, 'bull_atr_max_pct': 0.10419723458072044, 'bull_tp_mult': 2.244999719418221, 'bull_tsl_mult': 0.3044662973504633, 'bull_time_stop': 176, 'bull_use_sma': False, 'bull_use_ema': False, 'bull_use_atr': False, 'bull_use_adx': False, 'bull_use_spike': True, 'bull_rsi_required': False, 'bear_strategy': 'mean_reversion', 'bear_bb_std_mult': 2.7404244736655476, 'bear_rsi_os': 25, 'bear_rsi_ob': 74, 'bear_adx_thresh': 28.800011085976298, 'bear_atr_min_pct': 0.019824845079880443, 'bear_atr_max_pct': 0.07274792388258515, 'bear_tp_mult': 1.600741515988077, 'bear_tsl_mult': 0.9983604221779763, 'bear_time_stop': 63, 'bear_use_sma': True, 'bear_use_ema': True, 'bear_use_atr': True, 'bear_use_adx': False, 'bear_use_spike': False, 'bear_rsi_required': True, 'sideways_strategy': 'breakout', 'sideways_bb_std_mult': 1.1700862003562542, 'sideways_rsi_os': 45, 'sideways_rsi_ob': 61, 'sideways_adx_thresh': 9.731156352972393, 'sideways_atr_min_pct': 0.02100378428938383, 'sideways_atr_max_pct': 0.01377476541929254, 'sideways_tp_mult': 1.7150676395618247, 'sideways_tsl_mult': 0.9786649915546323, 'sideways_time_stop': 95, 'sideways_use_sma': True, 'sideways_use_ema': True, 'sideways_use_atr': True, 'sideways_use_adx': False, 'sideways_use_spike': False, 'sideways_rsi_required': False}.
[I 2025-08-30 15:18:29,199] Trial 418 finished with values: [-1000000000.0, 1000000000.0] and parameters: {'p_sma': 5, 'p_std': 7, 'p_atr': 7, 'p_adx': 27, 'rsi_period': 71, 'ema1': 10, 'ema2': 30, 'slip_atr_k': 0.11137500753001259, 'slip_spread_k': 0.08229438498910005, 'spread_hl_frac': 0.02597653754123253, 'bb_std_mult': 1.0838074894037792, 'rsi_os': 21, 'rsi_ob': 69, 'vol_spike': 0.1647387352750917, 'adx_thresh': 10.823689123808025, 'atr_min_pct': 0.012867252176735332, 'atr_max_pct': 0.07494057378444635, 'tp_mult': 1.7803427353053778, 'tsl_mult': 0.7504254437227089, 'strategy': 'breakout', 'time_stop': 275, 'use_sma': False, 'use_atr': True, 'use_adx': True, 'use_ema': True, 'use_spike': True, 'rsi_required': True, 'edge_k': 0.7192263521318166, 'edge_cap': 0.4634691022731231, 'bull_strategy': 'mean_reversion', 'bull_bb_std_mult': 0.6241210855139243, 'bull_rsi_os': 46, 'bull_rsi_ob': 51, 'bull_adx_thresh': 21.486266261608847, 'bull_atr_min_pct': 0.028427843503367994, 'bull_atr_max_pct': 0.11696864791374784, 'bull_tp_mult': 2.2451945780604956, 'bull_tsl_mult': 0.3665725609920127, 'bull_time_stop': 179, 'bull_use_sma': False, 'bull_use_ema': False, 'bull_use_atr': False, 'bull_use_adx': False, 'bull_use_spike': True, 'bull_rsi_required': False, 'bear_strategy': 'mean_reversion', 'bear_bb_std_mult': 2.7204274617316897, 'bear_rsi_os': 28, 'bear_rsi_ob': 76, 'bear_adx_thresh': 28.69862303268023, 'bear_atr_min_pct': 0.01951214815580671, 'bear_atr_max_pct': 0.07245589625138671, 'bear_tp_mult': 1.6017334781409653, 'bear_tsl_mult': 0.880381964035101, 'bear_time_stop': 66, 'bear_use_sma': True, 'bear_use_ema': True, 'bear_use_atr': True, 'bear_use_adx': False, 'bear_use_spike': False, 'bear_rsi_required': True, 'sideways_strategy': 'breakout', 'sideways_bb_std_mult': 2.7815751947027407, 'sideways_rsi_os': 45, 'sideways_rsi_ob': 61, 'sideways_adx_thresh': 27.368230119599744, 'sideways_atr_min_pct': 0.021251518963855215, 'sideways_atr_max_pct': 0.10188940295623036, 'sideways_tp_mult': 1.96653264197074, 'sideways_tsl_mult': 0.9701325929642928, 'sideways_time_stop': 66, 'sideways_use_sma': True, 'sideways_use_ema': True, 'sideways_use_atr': True, 'sideways_use_adx': False, 'sideways_use_spike': True, 'sideways_rsi_required': False}.
[I 2025-08-30 15:18:29,815] Trial 420 finished with values: [-1000000000.0, 1000000000.0] and parameters: {'p_sma': 5, 'p_std': 21, 'p_atr': 25, 'p_adx': 27, 'rsi_period': 76, 'ema1': 10, 'ema2': 46, 'slip_atr_k': 0.10788804746590297, 'slip_spread_k': 0.08328244966510362, 'spread_hl_frac': 0.026760834417776422, 'bb_std_mult': 1.3211191188161409, 'rsi_os': 26, 'rsi_ob': 72, 'vol_spike': 0.1794955317853905, 'adx_thresh': 12.435113953903919, 'atr_min_pct': 0.012895573678580421, 'atr_max_pct': 0.12748895687771392, 'tp_mult': 1.7753761274459088, 'tsl_mult': 0.6969458246771891, 'strategy': 'breakout', 'time_stop': 162, 'use_sma': False, 'use_atr': True, 'use_adx': True, 'use_ema': True, 'use_spike': True, 'rsi_required': True, 'edge_k': 0.21285627580290487, 'edge_cap': 0.8491852854216597, 'bull_strategy': 'mean_reversion', 'bull_bb_std_mult': 2.507952204178992, 'bull_rsi_os': 38, 'bull_rsi_ob': 51, 'bull_adx_thresh': 21.445632725887, 'bull_atr_min_pct': 0.016967176900655582, 'bull_atr_max_pct': 0.14350921236475617, 'bull_tp_mult': 2.123322401043435, 'bull_tsl_mult': 0.41543328478282154, 'bull_time_stop': 171, 'bull_use_sma': False, 'bull_use_ema': False, 'bull_use_atr': False, 'bull_use_adx': False, 'bull_use_spike': True, 'bull_rsi_required': False, 'bear_strategy': 'mean_reversion', 'bear_bb_std_mult': 2.2717433414245574, 'bear_rsi_os': 29, 'bear_rsi_ob': 76, 'bear_adx_thresh': 28.83293060476612, 'bear_atr_min_pct': 0.025024388806925903, 'bear_atr_max_pct': 0.07165339641588946, 'bear_tp_mult': 1.608348412276806, 'bear_tsl_mult': 0.9726958804242315, 'bear_time_stop': 65, 'bear_use_sma': True, 'bear_use_ema': True, 'bear_use_atr': True, 'bear_use_adx': False, 'bear_use_spike': False, 'bear_rsi_required': True, 'sideways_strategy': 'breakout', 'sideways_bb_std_mult': 1.3305696215857643, 'sideways_rsi_os': 44, 'sideways_rsi_ob': 57, 'sideways_adx_thresh': 27.2514844026228, 'sideways_atr_min_pct': 0.02116880410860144, 'sideways_atr_max_pct': 0.035726341321264274, 'sideways_tp_mult': 1.8251082538164969, 'sideways_tsl_mult': 0.9752193938677111, 'sideways_time_stop': 99, 'sideways_use_sma': True, 'sideways_use_ema': True, 'sideways_use_atr': True, 'sideways_use_adx': False, 'sideways_use_spike': False, 'sideways_rsi_required': False}.
[I 2025-08-30 15:18:32,070] Trial 419 finished with values: [-0.04070065099256959, 0.04061248208739548] and parameters: {'p_sma': 5, 'p_std': 8, 'p_atr': 25, 'p_adx': 26, 'rsi_period': 71, 'ema1': 29, 'ema2': 46, 'slip_atr_k': 0.16384069270764795, 'slip_spread_k': 0.07740947100932902, 'spread_hl_frac': 0.026531553223836272, 'bb_std_mult': 0.9281511711256, 'rsi_os': 21, 'rsi_ob': 72, 'vol_spike': 0.1790633049952673, 'adx_thresh': 10.722234119847412, 'atr_min_pct': 0.013053599673332483, 'atr_max_pct': 0.14432295506395007, 'tp_mult': 1.7452025621258658, 'tsl_mult': 0.7065346267482583, 'strategy': 'breakout', 'time_stop': 159, 'use_sma': False, 'use_atr': True, 'use_adx': True, 'use_ema': True, 'use_spike': True, 'rsi_required': True, 'edge_k': 0.59667614784237, 'edge_cap': 0.5312868312533862, 'bull_strategy': 'mean_reversion', 'bull_bb_std_mult': 0.6397083922341733, 'bull_rsi_os': 45, 'bull_rsi_ob': 47, 'bull_adx_thresh': 21.4369485951439, 'bull_atr_min_pct': 0.02318103702474964, 'bull_atr_max_pct': 0.14308010506944635, 'bull_tp_mult': 2.1310992525156207, 'bull_tsl_mult': 0.30731934384493464, 'bull_time_stop': 180, 'bull_use_sma': False, 'bull_use_ema': False, 'bull_use_atr': False, 'bull_use_adx': False, 'bull_use_spike': True, 'bull_rsi_required': False, 'bear_strategy': 'mean_reversion', 'bear_bb_std_mult': 2.7024580408900456, 'bear_rsi_os': 31, 'bear_rsi_ob': 76, 'bear_adx_thresh': 28.64090459881128, 'bear_atr_min_pct': 0.025824431628970995, 'bear_atr_max_pct': 0.07227796579242858, 'bear_tp_mult': 1.5832401063159265, 'bear_tsl_mult': 0.9986516293727784, 'bear_time_stop': 66, 'bear_use_sma': True, 'bear_use_ema': True, 'bear_use_atr': True, 'bear_use_adx': False, 'bear_use_spike': False, 'bear_rsi_required': True, 'sideways_strategy': 'breakout', 'sideways_bb_std_mult': 0.6835703267570556, 'sideways_rsi_os': 44, 'sideways_rsi_ob': 57, 'sideways_adx_thresh': 27.297353152319157, 'sideways_atr_min_pct': 0.0010409225725602732, 'sideways_atr_max_pct': 0.03651349412121434, 'sideways_tp_mult': 1.8153372310387776, 'sideways_tsl_mult': 0.9723927640654249, 'sideways_time_stop': 98, 'sideways_use_sma': True, 'sideways_use_ema': True, 'sideways_use_atr': True, 'sideways_use_adx': False, 'sideways_use_spike': False, 'sideways_rsi_required': False}.
[I 2025-08-30 15:19:19,162] Trial 423 finished with values: [-1000000000.0, 1000000000.0] and parameters: {'p_sma': 6, 'p_std': 57, 'p_atr': 14, 'p_adx': 26, 'rsi_period': 75, 'ema1': 21, 'ema2': 45, 'slip_atr_k': 0.1649137308736533, 'slip_spread_k': 0.08619040544300224, 'spread_hl_frac': 0.027082401241575144, 'bb_std_mult': 1.3671762732302988, 'rsi_os': 25, 'rsi_ob': 54, 'vol_spike': 0.17031458191513574, 'adx_thresh': 13.037439608855815, 'atr_min_pct': 0.013391985846861059, 'atr_max_pct': 0.07682123243875671, 'tp_mult': 1.7786281811756968, 'tsl_mult': 0.7960723425324937, 'strategy': 'breakout', 'time_stop': 247, 'use_sma': False, 'use_atr': True, 'use_adx': False, 'use_ema': True, 'use_spike': True, 'rsi_required': True, 'edge_k': 0.0035918274257049077, 'edge_cap': 0.5713718272563684, 'bull_strategy': 'mean_reversion', 'bull_bb_std_mult': 2.6080223434754584, 'bull_rsi_os': 38, 'bull_rsi_ob': 49, 'bull_adx_thresh': 21.915087488037774, 'bull_atr_min_pct': 0.02323951739863461, 'bull_atr_max_pct': 0.07085792873414333, 'bull_tp_mult': 2.1034203694173277, 'bull_tsl_mult': 0.25610738729161125, 'bull_time_stop': 204, 'bull_use_sma': True, 'bull_use_ema': False, 'bull_use_atr': False, 'bull_use_adx': False, 'bull_use_spike': True, 'bull_rsi_required': False, 'bear_strategy': 'mean_reversion', 'bear_bb_std_mult': 0.6388437703541323, 'bear_rsi_os': 32, 'bear_rsi_ob': 79, 'bear_adx_thresh': 29.504048671234933, 'bear_atr_min_pct': 0.025899322890998607, 'bear_atr_max_pct': 0.07923240875316391, 'bear_tp_mult': 1.5347496288399014, 'bear_tsl_mult': 0.9044100994655234, 'bear_time_stop': 57, 'bear_use_sma': True, 'bear_use_ema': True, 'bear_use_atr': True, 'bear_use_adx': False, 'bear_use_spike': False, 'bear_rsi_required': True, 'sideways_strategy': 'breakout', 'sideways_bb_std_mult': 0.6520208475408433, 'sideways_rsi_os': 44, 'sideways_rsi_ob': 57, 'sideways_adx_thresh': 27.10581707364293, 'sideways_atr_min_pct': 0.020042568498522807, 'sideways_atr_max_pct': 0.14092623366259507, 'sideways_tp_mult': 2.5074756934250173, 'sideways_tsl_mult': 0.9982154411111671, 'sideways_time_stop': 112, 'sideways_use_sma': True, 'sideways_use_ema': True, 'sideways_use_atr': True, 'sideways_use_adx': False, 'sideways_use_spike': False, 'sideways_rsi_required': False}.
