[I 2025-08-30 15:46:03,641] Trial 549 finished with values: [-1000000000.0, 1000000000.0] and parameters: {'p_sma': 24, 'p_std': 57, 'p_atr': 19, 'p_adx': 16, 'rsi_period': 31, 'ema1': 30, 'ema2': 59, 'slip_atr_k': 0.07096437950247017, 'slip_spread_k': 0.12797050039993613, 'spread_hl_frac': 0.013715539297635849, 'bb_std_mult': 1.1434101084858828, 'rsi_os': 24, 'rsi_ob': 75, 'vol_spike': 0.025147194523405803, 'adx_thresh': 18.379665102985143, 'atr_min_pct': 0.029784121552401906, 'atr_max_pct': 0.07485748624044795, 'tp_mult': 1.8650337075642398, 'tsl_mult': 0.7067888067272838, 'strategy': 'breakout', 'time_stop': 114, 'use_sma': False, 'use_atr': True, 'use_adx': False, 'use_ema': True, 'use_spike': False, 'rsi_required': False, 'edge_k': 0.23482549672514486, 'edge_cap': 0.5626562333051661, 'bull_strategy': 'mean_reversion', 'bull_bb_std_mult': 1.587379718556996, 'bull_rsi_os': 39, 'bull_rsi_ob': 81, 'bull_adx_thresh': 28.105151170508947, 'bull_atr_min_pct': 0.01979898156800629, 'bull_atr_max_pct': 0.060014048235319896, 'bull_tp_mult': 2.7361939600965344, 'bull_tsl_mult': 0.2732716496424511, 'bull_time_stop': 162, 'bull_use_sma': False, 'bull_use_ema': False, 'bull_use_atr': False, 'bull_use_adx': False, 'bull_use_spike': True, 'bull_rsi_required': False, 'bear_strategy': 'mean_reversion', 'bear_bb_std_mult': 2.30151708569692, 'bear_rsi_os': 31, 'bear_rsi_ob': 92, 'bear_adx_thresh': 28.38816555299952, 'bear_atr_min_pct': 0.021525137142494426, 'bear_atr_max_pct': 0.06804177663365359, 'bear_tp_mult': 1.5516406837250447, 'bear_tsl_mult': 0.9331295857219278, 'bear_time_stop': 52, 'bear_use_sma': True, 'bear_use_ema': True, 'bear_use_atr': True, 'bear_use_adx': False, 'bear_use_spike': True, 'bear_rsi_required': True, 'sideways_strategy': 'breakout', 'sideways_bb_std_mult': 2.390505188230706, 'sideways_rsi_os': 6, 'sideways_rsi_ob': 80, 'sideways_adx_thresh': 27.737927722472612, 'sideways_atr_min_pct': 0.000827690166454348, 'sideways_atr_max_pct': 0.10631971107270509, 'sideways_tp_mult': 1.5434137237018466, 'sideways_tsl_mult': 0.3404405834924016, 'sideways_time_stop': 65, 'sideways_use_sma': True, 'sideways_use_ema': True, 'sideways_use_atr': True, 'sideways_use_adx': False, 'sideways_use_spike': False, 'sideways_rsi_required': True}.
[I 2025-08-30 15:46:06,985] Trial 551 finished with values: [-1000000000.0, 1000000000.0] and parameters: {'p_sma': 6, 'p_std': 22, 'p_atr': 15, 'p_adx': 24, 'rsi_period': 71, 'ema1': 12, 'ema2': 34, 'slip_atr_k': 0.0710051183832913, 'slip_spread_k': 0.34684882979610865, 'spread_hl_frac': 0.032161425592944076, 'bb_std_mult': 1.170977138311666, 'rsi_os': 20, 'rsi_ob': 70, 'vol_spike': 0.1754216946447542, 'adx_thresh': 13.181919589907993, 'atr_min_pct': 0.01348120197945124, 'atr_max_pct': 0.07187707974740715, 'tp_mult': 1.6625884967095594, 'tsl_mult': 0.7120633337643572, 'strategy': 'mean_reversion', 'time_stop': 137, 'use_sma': True, 'use_atr': True, 'use_adx': True, 'use_ema': True, 'use_spike': False, 'rsi_required': False, 'edge_k': 0.14336626118523066, 'edge_cap': 0.43842330746765834, 'bull_strategy': 'breakout', 'bull_bb_std_mult': 3.0871692625836364, 'bull_rsi_os': 39, 'bull_rsi_ob': 47, 'bull_adx_thresh': 30.982435392596223, 'bull_atr_min_pct': 0.02111019599740608, 'bull_atr_max_pct': 0.1159649344215904, 'bull_tp_mult': 2.203437207002174, 'bull_tsl_mult': 0.8788373299076753, 'bull_time_stop': 164, 'bull_use_sma': False, 'bull_use_ema': False, 'bull_use_atr': False, 'bull_use_adx': False, 'bull_use_spike': True, 'bull_rsi_required': False, 'bear_strategy': 'breakout', 'bear_bb_std_mult': 0.560435254872614, 'bear_rsi_os': 31, 'bear_rsi_ob': 72, 'bear_adx_thresh': 24.712903476698315, 'bear_atr_min_pct': 0.02191766569155204, 'bear_atr_max_pct': 0.06683237116802924, 'bear_tp_mult': 2.8257963881415438, 'bear_tsl_mult': 0.38760415612222426, 'bear_time_stop': 51, 'bear_use_sma': True, 'bear_use_ema': True, 'bear_use_atr': True, 'bear_use_adx': False, 'bear_use_spike': True, 'bear_rsi_required': True, 'sideways_strategy': 'breakout', 'sideways_bb_std_mult': 2.259187615125613, 'sideways_rsi_os': 40, 'sideways_rsi_ob': 57, 'sideways_adx_thresh': 27.813079061184595, 'sideways_atr_min_pct': 0.01895882646406743, 'sideways_atr_max_pct': 0.09355399039069053, 'sideways_tp_mult': 2.4203564109975395, 'sideways_tsl_mult': 0.962581496866974, 'sideways_time_stop': 65, 'sideways_use_sma': True, 'sideways_use_ema': True, 'sideways_use_atr': False, 'sideways_use_adx': True, 'sideways_use_spike': True, 'sideways_rsi_required': True}.
[I 2025-08-30 15:46:07,933] Trial 550 finished with values: [-1000000000.0, 1000000000.0] and parameters: {'p_sma': 23, 'p_std': 57, 'p_atr': 11, 'p_adx': 30, 'rsi_period': 77, 'ema1': 30, 'ema2': 34, 'slip_atr_k': 0.0782715489099233, 'slip_spread_k': 0.12508785932819333, 'spread_hl_frac': 0.02529450297196502, 'bb_std_mult': 0.7527783001366044, 'rsi_os': 24, 'rsi_ob': 73, 'vol_spike': 0.17393769218518276, 'adx_thresh': 13.194087088307528, 'atr_min_pct': 0.013544196079810257, 'atr_max_pct': 0.13968842752041094, 'tp_mult': 1.8206951121399142, 'tsl_mult': 0.710756770709956, 'strategy': 'mean_reversion', 'time_stop': 157, 'use_sma': True, 'use_atr': True, 'use_adx': False, 'use_ema': True, 'use_spike': False, 'rsi_required': False, 'edge_k': 0.14758600092127896, 'edge_cap': 0.9767195344165547, 'bull_strategy': 'breakout', 'bull_bb_std_mult': 2.5302187935967377, 'bull_rsi_os': 39, 'bull_rsi_ob': 48, 'bull_adx_thresh': 28.026065401695913, 'bull_atr_min_pct': 0.019831567992120897, 'bull_atr_max_pct': 0.11684915792079059, 'bull_tp_mult': 2.748910543866799, 'bull_tsl_mult': 0.27746102576321796, 'bull_time_stop': 163, 'bull_use_sma': False, 'bull_use_ema': False, 'bull_use_atr': False, 'bull_use_adx': False, 'bull_use_spike': True, 'bull_rsi_required': False, 'bear_strategy': 'mean_reversion', 'bear_bb_std_mult': 0.5622036024904092, 'bear_rsi_os': 22, 'bear_rsi_ob': 72, 'bear_adx_thresh': 27.453977177843978, 'bear_atr_min_pct': 0.018704089415676632, 'bear_atr_max_pct': 0.11259916817459445, 'bear_tp_mult': 1.5354572121423546, 'bear_tsl_mult': 0.9341770155816861, 'bear_time_stop': 53, 'bear_use_sma': True, 'bear_use_ema': False, 'bear_use_atr': True, 'bear_use_adx': True, 'bear_use_spike': True, 'bear_rsi_required': True, 'sideways_strategy': 'breakout', 'sideways_bb_std_mult': 1.8289876304065542, 'sideways_rsi_os': 40, 'sideways_rsi_ob': 57, 'sideways_adx_thresh': 27.52514458423598, 'sideways_atr_min_pct': 0.028078646733880504, 'sideways_atr_max_pct': 0.09340710253312344, 'sideways_tp_mult': 2.5700733115126964, 'sideways_tsl_mult': 0.6675703436738515, 'sideways_time_stop': 65, 'sideways_use_sma': True, 'sideways_use_ema': True, 'sideways_use_atr': False, 'sideways_use_adx': True, 'sideways_use_spike': True, 'sideways_rsi_required': True}.
[I 2025-08-30 15:46:08,677] Trial 552 finished with values: [-1000000000.0, 1000000000.0] and parameters: {'p_sma': 7, 'p_std': 57, 'p_atr': 15, 'p_adx': 14, 'rsi_period': 71, 'ema1': 30, 'ema2': 30, 'slip_atr_k': 0.16870328963181352, 'slip_spread_k': 0.3260229808881683, 'spread_hl_frac': 0.025217228790641266, 'bb_std_mult': 0.6460718346072473, 'rsi_os': 24, 'rsi_ob': 73, 'vol_spike': 0.17541974092747792, 'adx_thresh': 13.013580953806091, 'atr_min_pct': 0.01337269703333325, 'atr_max_pct': 0.07060493347586769, 'tp_mult': 1.6674088353650691, 'tsl_mult': 0.738273691920574, 'strategy': 'mean_reversion', 'time_stop': 138, 'use_sma': True, 'use_atr': True, 'use_adx': True, 'use_ema': True, 'use_spike': False, 'rsi_required': False, 'edge_k': 0.128929469761223, 'edge_cap': 0.8980950938987174, 'bull_strategy': 'breakout', 'bull_bb_std_mult': 2.7285979416924877, 'bull_rsi_os': 35, 'bull_rsi_ob': 50, 'bull_adx_thresh': 22.583460736284064, 'bull_atr_min_pct': 0.01982085873966265, 'bull_atr_max_pct': 0.04702082632239284, 'bull_tp_mult': 2.946152120627693, 'bull_tsl_mult': 0.8027788451468327, 'bull_time_stop': 160, 'bull_use_sma': False, 'bull_use_ema': False, 'bull_use_atr': False, 'bull_use_adx': False, 'bull_use_spike': True, 'bull_rsi_required': False, 'bear_strategy': 'breakout', 'bear_bb_std_mult': 2.6679346088774287, 'bear_rsi_os': 27, 'bear_rsi_ob': 76, 'bear_adx_thresh': 28.426150904212648, 'bear_atr_min_pct': 0.0032493120590057975, 'bear_atr_max_pct': 0.08579684548737396, 'bear_tp_mult': 1.5509980675523487, 'bear_tsl_mult': 0.3908501762062849, 'bear_time_stop': 285, 'bear_use_sma': True, 'bear_use_ema': True, 'bear_use_atr': False, 'bear_use_adx': False, 'bear_use_spike': True, 'bear_rsi_required': True, 'sideways_strategy': 'mean_reversion', 'sideways_bb_std_mult': 1.8224934027481101, 'sideways_rsi_os': 40, 'sideways_rsi_ob': 54, 'sideways_adx_thresh': 5.7173997105769345, 'sideways_atr_min_pct': 0.007930154377310358, 'sideways_atr_max_pct': 0.04684206621049517, 'sideways_tp_mult': 2.41870043633193, 'sideways_tsl_mult': 0.9610867413717443, 'sideways_time_stop': 66, 'sideways_use_sma': True, 'sideways_use_ema': True, 'sideways_use_atr': False, 'sideways_use_adx': True, 'sideways_use_spike': True, 'sideways_rsi_required': True}.
[I 2025-08-30 15:47:14,419] Trial 556 finished with values: [-1000000000.0, 1000000000.0] and parameters: {'p_sma': 6, 'p_std': 35, 'p_atr': 28, 'p_adx': 26, 'rsi_period': 79, 'ema1': 25, 'ema2': 35, 'slip_atr_k': 0.05339434339235952, 'slip_spread_k': 0.10767682288989759, 'spread_hl_frac': 0.023757580067686346, 'bb_std_mult': 1.5240697111924166, 'rsi_os': 27, 'rsi_ob': 71, 'vol_spike': 0.16044243041999745, 'adx_thresh': 12.36422640847518, 'atr_min_pct': 0.004188674070721146, 'atr_max_pct': 0.0843149800638052, 'tp_mult': 1.7622625948722752, 'tsl_mult': 0.6755536422268233, 'strategy': 'breakout', 'time_stop': 97, 'use_sma': False, 'use_atr': True, 'use_adx': False, 'use_ema': True, 'use_spike': True, 'rsi_required': True, 'edge_k': 0.17779964519991784, 'edge_cap': 0.29718887486282575, 'bull_strategy': 'mean_reversion', 'bull_bb_std_mult': 1.7174686988561296, 'bull_rsi_os': 38, 'bull_rsi_ob': 66, 'bull_adx_thresh': 21.126923185548307, 'bull_atr_min_pct': 0.021401614478945303, 'bull_atr_max_pct': 0.03403459266494395, 'bull_tp_mult': 2.2879654469243644, 'bull_tsl_mult': 0.041137919264397305, 'bull_time_stop': 153, 'bull_use_sma': False, 'bull_use_ema': False, 'bull_use_atr': False, 'bull_use_adx': False, 'bull_use_spike': True, 'bull_rsi_required': False, 'bear_strategy': 'mean_reversion', 'bear_bb_std_mult': 0.6833051985072103, 'bear_rsi_os': 29, 'bear_rsi_ob': 74, 'bear_adx_thresh': 29.238237666637556, 'bear_atr_min_pct': 0.024097290203320583, 'bear_atr_max_pct': 0.06975705933128429, 'bear_tp_mult': 2.63589687636585, 'bear_tsl_mult': 0.4806381037750432, 'bear_time_stop': 64, 'bear_use_sma': True, 'bear_use_ema': True, 'bear_use_atr': False, 'bear_use_adx': False, 'bear_use_spike': False, 'bear_rsi_required': True, 'sideways_strategy': 'mean_reversion', 'sideways_bb_std_mult': 2.180816739132623, 'sideways_rsi_os': 9, 'sideways_rsi_ob': 94, 'sideways_adx_thresh': 28.76922498192176, 'sideways_atr_min_pct': 0.0007640705486588596, 'sideways_atr_max_pct': 0.09944426781130879, 'sideways_tp_mult': 1.6615879570313845, 'sideways_tsl_mult': 0.9648209644748859, 'sideways_time_stop': 89, 'sideways_use_sma': True, 'sideways_use_ema': True, 'sideways_use_atr': True, 'sideways_use_adx': False, 'sideways_use_spike': True, 'sideways_rsi_required': False}.
[I 2025-08-30 15:47:15,321] Trial 554 finished with values: [-1000000000.0, 1000000000.0] and parameters: {'p_sma': 26, 'p_std': 35, 'p_atr': 15, 'p_adx': 14, 'rsi_period': 77, 'ema1': 30, 'ema2': 30, 'slip_atr_k': 0.16888918616498125, 'slip_spread_k': 0.10936391059303809, 'spread_hl_frac': 0.025564397094191695, 'bb_std_mult': 1.5107533881278223, 'rsi_os': 49, 'rsi_ob': 57, 'vol_spike': 0.1760966643431775, 'adx_thresh': 32.99261607874836, 'atr_min_pct': 0.007487778345931245, 'atr_max_pct': 0.13923202929167872, 'tp_mult': 1.7669882638309218, 'tsl_mult': 0.7294691245010585, 'strategy': 'mean_reversion', 'time_stop': 198, 'use_sma': True, 'use_atr': True, 'use_adx': False, 'use_ema': True, 'use_spike': True, 'rsi_required': True, 'edge_k': 0.1601347300574257, 'edge_cap': 0.5756954319506726, 'bull_strategy': 'breakout', 'bull_bb_std_mult': 2.559853851469763, 'bull_rsi_os': 35, 'bull_rsi_ob': 50, 'bull_adx_thresh': 22.786355311767725, 'bull_atr_min_pct': 0.02095148000001771, 'bull_atr_max_pct': 0.06486814594348832, 'bull_tp_mult': 1.019234906590312, 'bull_tsl_mult': 0.2936163449558493, 'bull_time_stop': 153, 'bull_use_sma': False, 'bull_use_ema': False, 'bull_use_atr': False, 'bull_use_adx': False, 'bull_use_spike': True, 'bull_rsi_required': False, 'bear_strategy': 'breakout', 'bear_bb_std_mult': 0.6744341083968365, 'bear_rsi_os': 22, 'bear_rsi_ob': 59, 'bear_adx_thresh': 29.10590318478095, 'bear_atr_min_pct': 0.019189711097069056, 'bear_atr_max_pct': 0.06420855764159523, 'bear_tp_mult': 1.4492319450941489, 'bear_tsl_mult': 0.9975444077988257, 'bear_time_stop': 153, 'bear_use_sma': True, 'bear_use_ema': False, 'bear_use_atr': False, 'bear_use_adx': True, 'bear_use_spike': False, 'bear_rsi_required': True, 'sideways_strategy': 'mean_reversion', 'sideways_bb_std_mult': 1.6151570275434026, 'sideways_rsi_os': 28, 'sideways_rsi_ob': 59, 'sideways_adx_thresh': 29.127728270028516, 'sideways_atr_min_pct': 0.0059647654696648195, 'sideways_atr_max_pct': 0.06849706269818717, 'sideways_tp_mult': 2.5820907439109893, 'sideways_tsl_mult': 0.7816318105838886, 'sideways_time_stop': 90, 'sideways_use_sma': True, 'sideways_use_ema': True, 'sideways_use_atr': False, 'sideways_use_adx': True, 'sideways_use_spike': True, 'sideways_rsi_required': False}.
[I 2025-08-30 15:47:16,479] Trial 553 finished with values: [-1000000000.0, 1000000000.0] and parameters: {'p_sma': 7, 'p_std': 58, 'p_atr': 15, 'p_adx': 17, 'rsi_period': 79, 'ema1': 30, 'ema2': 35, 'slip_atr_k': 0.2280453635566508, 'slip_spread_k': 0.32288146320284805, 'spread_hl_frac': 0.025325918694229146, 'bb_std_mult': 0.9828874135030594, 'rsi_os': 20, 'rsi_ob': 70, 'vol_spike': 0.17424235811993563, 'adx_thresh': 32.9699781403412, 'atr_min_pct': 0.013323680701094302, 'atr_max_pct': 0.07209036581973596, 'tp_mult': 1.6767111332713527, 'tsl_mult': 0.47635110788361046, 'strategy': 'mean_reversion', 'time_stop': 210, 'use_sma': True, 'use_atr': True, 'use_adx': True, 'use_ema': True, 'use_spike': True, 'rsi_required': True, 'edge_k': 0.14488887014220359, 'edge_cap': 0.5772041441282764, 'bull_strategy': 'breakout', 'bull_bb_std_mult': 2.7368802616627983, 'bull_rsi_os': 42, 'bull_rsi_ob': 95, 'bull_adx_thresh': 21.256063823392463, 'bull_atr_min_pct': 0.02883933029189361, 'bull_atr_max_pct': 0.06534793624551731, 'bull_tp_mult': 2.197112943586065, 'bull_tsl_mult': 0.0395387508237135, 'bull_time_stop': 153, 'bull_use_sma': False, 'bull_use_ema': False, 'bull_use_atr': False, 'bull_use_adx': False, 'bull_use_spike': True, 'bull_rsi_required': False, 'bear_strategy': 'breakout', 'bear_bb_std_mult': 0.6766026007355541, 'bear_rsi_os': 28, 'bear_rsi_ob': 68, 'bear_adx_thresh': 29.189626963329527, 'bear_atr_min_pct': 0.021841510399493384, 'bear_atr_max_pct': 0.06549421435990654, 'bear_tp_mult': 1.503846732123274, 'bear_tsl_mult': 0.9869585094837863, 'bear_time_stop': 154, 'bear_use_sma': True, 'bear_use_ema': True, 'bear_use_atr': False, 'bear_use_adx': True, 'bear_use_spike': False, 'bear_rsi_required': True, 'sideways_strategy': 'mean_reversion', 'sideways_bb_std_mult': 1.6602323109591386, 'sideways_rsi_os': 52, 'sideways_rsi_ob': 94, 'sideways_adx_thresh': 28.69939224503814, 'sideways_atr_min_pct': 0.01907791351466226, 'sideways_atr_max_pct': 0.04637593920238734, 'sideways_tp_mult': 2.5596805777169602, 'sideways_tsl_mult': 0.9628103148940826, 'sideways_time_stop': 71, 'sideways_use_sma': True, 'sideways_use_ema': True, 'sideways_use_atr': False, 'sideways_use_adx': True, 'sideways_use_spike': True, 'sideways_rsi_required': False}.
[I 2025-08-30 15:47:17,069] Trial 555 finished with values: [-1000000000.0, 1000000000.0] and parameters: {'p_sma': 7, 'p_std': 58, 'p_atr': 8, 'p_adx': 26, 'rsi_period': 80, 'ema1': 30, 'ema2': 35, 'slip_atr_k': 0.16909852523654484, 'slip_spread_k': 0.10806199119131521, 'spread_hl_frac': 0.025802283174032183, 'bb_std_mult': 2.987808012146897, 'rsi_os': 25, 'rsi_ob': 51, 'vol_spike': 0.17643355302010652, 'adx_thresh': 11.165353699693943, 'atr_min_pct': 0.014927106704632528, 'atr_max_pct': 0.14378264953496578, 'tp_mult': 1.7330620774610177, 'tsl_mult': 0.7359121326061019, 'strategy': 'breakout', 'time_stop': 194, 'use_sma': False, 'use_atr': True, 'use_adx': True, 'use_ema': True, 'use_spike': True, 'rsi_required': True, 'edge_k': 0.7775351576337459, 'edge_cap': 0.5806480429205213, 'bull_strategy': 'mean_reversion', 'bull_bb_std_mult': 2.6970005332437594, 'bull_rsi_os': 42, 'bull_rsi_ob': 71, 'bull_adx_thresh': 22.66549883057232, 'bull_atr_min_pct': 0.02102449518206835, 'bull_atr_max_pct': 0.03377811723281274, 'bull_tp_mult': 2.17513371865822, 'bull_tsl_mult': 0.33853616661615876, 'bull_time_stop': 152, 'bull_use_sma': False, 'bull_use_ema': False, 'bull_use_atr': False, 'bull_use_adx': False, 'bull_use_spike': True, 'bull_rsi_required': False, 'bear_strategy': 'breakout', 'bear_bb_std_mult': 0.6809313926685078, 'bear_rsi_os': 27, 'bear_rsi_ob': 82, 'bear_adx_thresh': 8.453830253804133, 'bear_atr_min_pct': 0.020409803406029294, 'bear_atr_max_pct': 0.06279151529577662, 'bear_tp_mult': 1.445903926340317, 'bear_tsl_mult': 0.7055729476063188, 'bear_time_stop': 65, 'bear_use_sma': True, 'bear_use_ema': True, 'bear_use_atr': False, 'bear_use_adx': False, 'bear_use_spike': False, 'bear_rsi_required': True, 'sideways_strategy': 'mean_reversion', 'sideways_bb_std_mult': 1.6550788094148379, 'sideways_rsi_os': 28, 'sideways_rsi_ob': 59, 'sideways_adx_thresh': 29.418108197737766, 'sideways_atr_min_pct': 0.0060458018165618094, 'sideways_atr_max_pct': 0.0689986326585883, 'sideways_tp_mult': 2.4441582926151413, 'sideways_tsl_mult': 0.9612985850814681, 'sideways_time_stop': 256, 'sideways_use_sma': True, 'sideways_use_ema': True, 'sideways_use_atr': True, 'sideways_use_adx': False, 'sideways_use_spike': True, 'sideways_rsi_required': False}.
[I 2025-08-30 15:48:12,027] Trial 560 finished with values: [-1000000000.0, 1000000000.0] and parameters: {'p_sma': 37, 'p_std': 59, 'p_atr': 29, 'p_adx': 25, 'rsi_period': 16, 'ema1': 21, 'ema2': 33, 'slip_atr_k': 0.09947812642783861, 'slip_spread_k': 0.9089922922512915, 'spread_hl_frac': 0.03786027044502775, 'bb_std_mult': 1.069829278407667, 'rsi_os': 28, 'rsi_ob': 86, 'vol_spike': 0.16003024654054618, 'adx_thresh': 14.31401749760481, 'atr_min_pct': 0.026239259740569204, 'atr_max_pct': 0.12362803646826723, 'tp_mult': 1.7930391297715833, 'tsl_mult': 0.31801994687722, 'strategy': 'breakout', 'time_stop': 131, 'use_sma': False, 'use_atr': True, 'use_adx': False, 'use_ema': True, 'use_spike': True, 'rsi_required': True, 'edge_k': 0.26959915427711034, 'edge_cap': 0.5490791580213642, 'bull_strategy': 'mean_reversion', 'bull_bb_std_mult': 2.492403511790445, 'bull_rsi_os': 37, 'bull_rsi_ob': 52, 'bull_adx_thresh': 21.98691812285681, 'bull_atr_min_pct': 0.02180805618644969, 'bull_atr_max_pct': 0.07382273613869476, 'bull_tp_mult': 2.82776329023292, 'bull_tsl_mult': 0.2596861781958355, 'bull_time_stop': 158, 'bull_use_sma': False, 'bull_use_ema': False, 'bull_use_atr': False, 'bull_use_adx': True, 'bull_use_spike': True, 'bull_rsi_required': False, 'bear_strategy': 'mean_reversion', 'bear_bb_std_mult': 0.7611898429240066, 'bear_rsi_os': 29, 'bear_rsi_ob': 76, 'bear_adx_thresh': 20.20474470964478, 'bear_atr_min_pct': 0.0010295693019633633, 'bear_atr_max_pct': 0.13315920567103393, 'bear_tp_mult': 1.6033123836046737, 'bear_tsl_mult': 0.981002433369951, 'bear_time_stop': 76, 'bear_use_sma': True, 'bear_use_ema': True, 'bear_use_atr': True, 'bear_use_adx': False, 'bear_use_spike': False, 'bear_rsi_required': True, 'sideways_strategy': 'breakout', 'sideways_bb_std_mult': 0.847792248464311, 'sideways_rsi_os': 15, 'sideways_rsi_ob': 49, 'sideways_adx_thresh': 26.458528291886434, 'sideways_atr_min_pct': 0.0013343227693718776, 'sideways_atr_max_pct': 0.052638342859084725, 'sideways_tp_mult': 2.9422240944102054, 'sideways_tsl_mult': 0.9997080523062832, 'sideways_time_stop': 98, 'sideways_use_sma': True, 'sideways_use_ema': False, 'sideways_use_atr': True, 'sideways_use_adx': False, 'sideways_use_spike': False, 'sideways_rsi_required': False}.
