[I 2025-08-30 15:06:13,691] Trial 361 finished with values: [-1000000000.0, 1000000000.0] and parameters: {'p_sma': 8, 'p_std': 58, 'p_atr': 16, 'p_adx': 25, 'rsi_period': 80, 'ema1': 30, 'ema2': 20, 'slip_atr_k': 0.06483339431999201, 'slip_spread_k': 0.5769914063275463, 'spread_hl_frac': 0.03648189317655836, 'bb_std_mult': 3.5959966251941373, 'rsi_os': 24, 'rsi_ob': 73, 'vol_spike': 0.18369242151990234, 'adx_thresh': 27.998744928831925, 'atr_min_pct': 0.012645187931546124, 'atr_max_pct': 0.08143530646047223, 'tp_mult': 1.6914053530440858, 'tsl_mult': 0.10927618671344844, 'strategy': 'breakout', 'time_stop': 120, 'use_sma': False, 'use_atr': False, 'use_adx': False, 'use_ema': True, 'use_spike': True, 'rsi_required': True, 'edge_k': 0.9097140999860381, 'edge_cap': 0.5641578876526677, 'bull_strategy': 'mean_reversion', 'bull_bb_std_mult': 2.517342101995674, 'bull_rsi_os': 32, 'bull_rsi_ob': 91, 'bull_adx_thresh': 22.96229282019023, 'bull_atr_min_pct': 0.008952682202107072, 'bull_atr_max_pct': 0.06714488563686252, 'bull_tp_mult': 1.8056937217598672, 'bull_tsl_mult': 0.6350669364695087, 'bull_time_stop': 138, 'bull_use_sma': True, 'bull_use_ema': False, 'bull_use_atr': False, 'bull_use_adx': False, 'bull_use_spike': False, 'bull_rsi_required': False, 'bear_strategy': 'mean_reversion', 'bear_bb_std_mult': 0.6697257812000555, 'bear_rsi_os': 5, 'bear_rsi_ob': 77, 'bear_adx_thresh': 27.414904435655, 'bear_atr_min_pct': 0.020902708710783854, 'bear_atr_max_pct': 0.10597747265774017, 'bear_tp_mult': 1.5154166736160783, 'bear_tsl_mult': 0.11583817677001293, 'bear_time_stop': 72, 'bear_use_sma': True, 'bear_use_ema': True, 'bear_use_atr': True, 'bear_use_adx': False, 'bear_use_spike': False, 'bear_rsi_required': True, 'sideways_strategy': 'breakout', 'sideways_bb_std_mult': 1.8669401505622587, 'sideways_rsi_os': 40, 'sideways_rsi_ob': 61, 'sideways_adx_thresh': 26.487130334737376, 'sideways_atr_min_pct': 0.0010723498083683757, 'sideways_atr_max_pct': 0.1045248843996963, 'sideways_tp_mult': 2.48965377992224, 'sideways_tsl_mult': 0.840038489108625, 'sideways_time_stop': 28, 'sideways_use_sma': False, 'sideways_use_ema': True, 'sideways_use_atr': True, 'sideways_use_adx': False, 'sideways_use_spike': True, 'sideways_rsi_required': False}.
[I 2025-08-30 15:06:13,814] Trial 359 finished with values: [-1000000000.0, 1000000000.0] and parameters: {'p_sma': 8, 'p_std': 54, 'p_atr': 16, 'p_adx': 24, 'rsi_period': 79, 'ema1': 30, 'ema2': 20, 'slip_atr_k': 0.06086864506827862, 'slip_spread_k': 0.6266751653859317, 'spread_hl_frac': 0.00405000372582463, 'bb_std_mult': 2.655783606081881, 'rsi_os': 27, 'rsi_ob': 76, 'vol_spike': 0.03808439437046919, 'adx_thresh': 29.276894616945963, 'atr_min_pct': 0.014542854504002483, 'atr_max_pct': 0.07566056427791894, 'tp_mult': 1.502888955689815, 'tsl_mult': 0.042467875938439884, 'strategy': 'breakout', 'time_stop': 93, 'use_sma': False, 'use_atr': False, 'use_adx': False, 'use_ema': False, 'use_spike': True, 'rsi_required': True, 'edge_k': 1.0531887807652802, 'edge_cap': 0.5911866783433719, 'bull_strategy': 'mean_reversion', 'bull_bb_std_mult': 2.7648420218978385, 'bull_rsi_os': 32, 'bull_rsi_ob': 90, 'bull_adx_thresh': 25.709812899054022, 'bull_atr_min_pct': 0.006873537647942446, 'bull_atr_max_pct': 0.07720540236280408, 'bull_tp_mult': 1.8968362167787183, 'bull_tsl_mult': 0.6339408061438148, 'bull_time_stop': 124, 'bull_use_sma': False, 'bull_use_ema': False, 'bull_use_atr': False, 'bull_use_adx': False, 'bull_use_spike': False, 'bull_rsi_required': True, 'bear_strategy': 'mean_reversion', 'bear_bb_std_mult': 0.7549429610262497, 'bear_rsi_os': 7, 'bear_rsi_ob': 76, 'bear_adx_thresh': 30.3861844758987, 'bear_atr_min_pct': 0.015579108237432804, 'bear_atr_max_pct': 0.013984959906067924, 'bear_tp_mult': 1.3824102424617644, 'bear_tsl_mult': 0.09694204688168145, 'bear_time_stop': 84, 'bear_use_sma': True, 'bear_use_ema': True, 'bear_use_atr': True, 'bear_use_adx': False, 'bear_use_spike': False, 'bear_rsi_required': False, 'sideways_strategy': 'breakout', 'sideways_bb_std_mult': 3.596606404241603, 'sideways_rsi_os': 40, 'sideways_rsi_ob': 56, 'sideways_adx_thresh': 26.184722496393032, 'sideways_atr_min_pct': 0.023443759153532757, 'sideways_atr_max_pct': 0.09369602063895029, 'sideways_tp_mult': 2.4038960060905175, 'sideways_tsl_mult': 0.5159149805012109, 'sideways_time_stop': 187, 'sideways_use_sma': False, 'sideways_use_ema': True, 'sideways_use_atr': True, 'sideways_use_adx': False, 'sideways_use_spike': True, 'sideways_rsi_required': False}.
[I 2025-08-30 15:06:51,102] Trial 364 finished with values: [-1000000000.0, 1000000000.0] and parameters: {'p_sma': 5, 'p_std': 58, 'p_atr': 16, 'p_adx': 25, 'rsi_period': 84, 'ema1': 30, 'ema2': 21, 'slip_atr_k': 0.058926008512418415, 'slip_spread_k': 0.5825708067910448, 'spread_hl_frac': 0.031464950866204905, 'bb_std_mult': 3.5993718288276413, 'rsi_os': 23, 'rsi_ob': 72, 'vol_spike': 0.1589075207796139, 'adx_thresh': 27.372661645521013, 'atr_min_pct': 0.01551103312443431, 'atr_max_pct': 0.0796005920400013, 'tp_mult': 1.6302272112294254, 'tsl_mult': 0.11025251039935509, 'strategy': 'breakout', 'time_stop': 120, 'use_sma': False, 'use_atr': False, 'use_adx': False, 'use_ema': True, 'use_spike': True, 'rsi_required': True, 'edge_k': 0.9678982714241592, 'edge_cap': 0.5585165029904737, 'bull_strategy': 'mean_reversion', 'bull_bb_std_mult': 2.5731507202119013, 'bull_rsi_os': 31, 'bull_rsi_ob': 92, 'bull_adx_thresh': 23.174992686860513, 'bull_atr_min_pct': 0.008768248737285718, 'bull_atr_max_pct': 0.06745338536068272, 'bull_tp_mult': 1.7957767953691073, 'bull_tsl_mult': 0.631618999198929, 'bull_time_stop': 155, 'bull_use_sma': False, 'bull_use_ema': True, 'bull_use_atr': False, 'bull_use_adx': False, 'bull_use_spike': False, 'bull_rsi_required': False, 'bear_strategy': 'mean_reversion', 'bear_bb_std_mult': 0.5425581766944088, 'bear_rsi_os': 5, 'bear_rsi_ob': 77, 'bear_adx_thresh': 27.881064712374084, 'bear_atr_min_pct': 0.022333761574009365, 'bear_atr_max_pct': 0.13020588379842543, 'bear_tp_mult': 1.5629752291073498, 'bear_tsl_mult': 0.11832557585584151, 'bear_time_stop': 74, 'bear_use_sma': True, 'bear_use_ema': True, 'bear_use_atr': True, 'bear_use_adx': True, 'bear_use_spike': False, 'bear_rsi_required': True, 'sideways_strategy': 'breakout', 'sideways_bb_std_mult': 1.5899646692037221, 'sideways_rsi_os': 23, 'sideways_rsi_ob': 60, 'sideways_adx_thresh': 26.13133334043377, 'sideways_atr_min_pct': 0.0005258693510893483, 'sideways_atr_max_pct': 0.09899445881163463, 'sideways_tp_mult': 2.462534085883165, 'sideways_tsl_mult': 0.5939187903613122, 'sideways_time_stop': 24, 'sideways_use_sma': False, 'sideways_use_ema': True, 'sideways_use_atr': True, 'sideways_use_adx': False, 'sideways_use_spike': True, 'sideways_rsi_required': False}.
[I 2025-08-30 15:06:51,593] Trial 362 finished with values: [-1000000000.0, 1000000000.0] and parameters: {'p_sma': 8, 'p_std': 57, 'p_atr': 16, 'p_adx': 25, 'rsi_period': 80, 'ema1': 30, 'ema2': 20, 'slip_atr_k': 0.06112818352297156, 'slip_spread_k': 0.5764973449919376, 'spread_hl_frac': 0.03135849729380564, 'bb_std_mult': 3.596055388850067, 'rsi_os': 24, 'rsi_ob': 73, 'vol_spike': 0.1788328582364109, 'adx_thresh': 27.57997089001264, 'atr_min_pct': 0.012727653320981613, 'atr_max_pct': 0.07953131301980425, 'tp_mult': 1.6888875263051648, 'tsl_mult': 0.10886057169811401, 'strategy': 'breakout', 'time_stop': 119, 'use_sma': False, 'use_atr': False, 'use_adx': False, 'use_ema': True, 'use_spike': True, 'rsi_required': True, 'edge_k': 0.8944784041476226, 'edge_cap': 0.561804573925493, 'bull_strategy': 'mean_reversion', 'bull_bb_std_mult': 2.5686491332039294, 'bull_rsi_os': 32, 'bull_rsi_ob': 92, 'bull_adx_thresh': 22.97743655779686, 'bull_atr_min_pct': 0.008714869741406889, 'bull_atr_max_pct': 0.06646846243813842, 'bull_tp_mult': 1.787219847323355, 'bull_tsl_mult': 0.6284174883182367, 'bull_time_stop': 137, 'bull_use_sma': True, 'bull_use_ema': False, 'bull_use_atr': False, 'bull_use_adx': False, 'bull_use_spike': False, 'bull_rsi_required': False, 'bear_strategy': 'mean_reversion', 'bear_bb_std_mult': 0.6806666989653559, 'bear_rsi_os': 5, 'bear_rsi_ob': 77, 'bear_adx_thresh': 27.32466377901392, 'bear_atr_min_pct': 0.021020406141320197, 'bear_atr_max_pct': 0.01640133601902543, 'bear_tp_mult': 1.5135520243852392, 'bear_tsl_mult': 0.12708942219173458, 'bear_time_stop': 74, 'bear_use_sma': True, 'bear_use_ema': True, 'bear_use_atr': True, 'bear_use_adx': False, 'bear_use_spike': False, 'bear_rsi_required': True, 'sideways_strategy': 'breakout', 'sideways_bb_std_mult': 1.8058732089281413, 'sideways_rsi_os': 40, 'sideways_rsi_ob': 60, 'sideways_adx_thresh': 26.171801611692704, 'sideways_atr_min_pct': 0.02885396714861696, 'sideways_atr_max_pct': 0.10343693066396799, 'sideways_tp_mult': 2.488509652075112, 'sideways_tsl_mult': 0.7378342509070799, 'sideways_time_stop': 24, 'sideways_use_sma': False, 'sideways_use_ema': True, 'sideways_use_atr': True, 'sideways_use_adx': False, 'sideways_use_spike': True, 'sideways_rsi_required': False}.
[I 2025-08-30 15:06:51,776] Trial 365 finished with values: [-1000000000.0, 1000000000.0] and parameters: {'p_sma': 6, 'p_std': 57, 'p_atr': 16, 'p_adx': 25, 'rsi_period': 83, 'ema1': 29, 'ema2': 21, 'slip_atr_k': 0.058751101179363996, 'slip_spread_k': 0.5842806698683909, 'spread_hl_frac': 0.035502032353922755, 'bb_std_mult': 3.577293617917129, 'rsi_os': 23, 'rsi_ob': 73, 'vol_spike': 0.15424721837445757, 'adx_thresh': 27.962818701588375, 'atr_min_pct': 0.015543684161618151, 'atr_max_pct': 0.07941111519532065, 'tp_mult': 1.6381174971896508, 'tsl_mult': 0.10816898426673226, 'strategy': 'breakout', 'time_stop': 119, 'use_sma': False, 'use_atr': False, 'use_adx': True, 'use_ema': True, 'use_spike': True, 'rsi_required': True, 'edge_k': 0.9471106808565691, 'edge_cap': 0.5624223346056176, 'bull_strategy': 'mean_reversion', 'bull_bb_std_mult': 2.587717525103844, 'bull_rsi_os': 31, 'bull_rsi_ob': 92, 'bull_adx_thresh': 23.058484418105852, 'bull_atr_min_pct': 0.008327856789662594, 'bull_atr_max_pct': 0.0700367289560486, 'bull_tp_mult': 1.7875580822019501, 'bull_tsl_mult': 0.6137301514413009, 'bull_time_stop': 145, 'bull_use_sma': True, 'bull_use_ema': True, 'bull_use_atr': False, 'bull_use_adx': False, 'bull_use_spike': False, 'bull_rsi_required': False, 'bear_strategy': 'mean_reversion', 'bear_bb_std_mult': 0.6823126293069814, 'bear_rsi_os': 5, 'bear_rsi_ob': 78, 'bear_adx_thresh': 27.847065638714554, 'bear_atr_min_pct': 0.01759761308874979, 'bear_atr_max_pct': 0.016038084668029497, 'bear_tp_mult': 1.5723437174334398, 'bear_tsl_mult': 0.12453409126160957, 'bear_time_stop': 70, 'bear_use_sma': True, 'bear_use_ema': True, 'bear_use_atr': True, 'bear_use_adx': True, 'bear_use_spike': False, 'bear_rsi_required': True, 'sideways_strategy': 'breakout', 'sideways_bb_std_mult': 1.5801700332527229, 'sideways_rsi_os': 40, 'sideways_rsi_ob': 60, 'sideways_adx_thresh': 24.951598448953334, 'sideways_atr_min_pct': 0.0004903287128022256, 'sideways_atr_max_pct': 0.10000930237758845, 'sideways_tp_mult': 2.4522629602830417, 'sideways_tsl_mult': 0.7168338531689114, 'sideways_time_stop': 23, 'sideways_use_sma': False, 'sideways_use_ema': True, 'sideways_use_atr': True, 'sideways_use_adx': False, 'sideways_use_spike': True, 'sideways_rsi_required': False}.
[I 2025-08-30 15:06:51,996] Trial 363 finished with values: [-1000000000.0, 1000000000.0] and parameters: {'p_sma': 5, 'p_std': 59, 'p_atr': 16, 'p_adx': 25, 'rsi_period': 80, 'ema1': 30, 'ema2': 20, 'slip_atr_k': 0.062352386761183425, 'slip_spread_k': 0.5819477550120515, 'spread_hl_frac': 0.03680692579052174, 'bb_std_mult': 3.598340838981582, 'rsi_os': 24, 'rsi_ob': 72, 'vol_spike': 0.18734595879518054, 'adx_thresh': 27.71671892627364, 'atr_min_pct': 0.01552818400274507, 'atr_max_pct': 0.08029183055622581, 'tp_mult': 1.6802547120761604, 'tsl_mult': 0.10960857016819889, 'strategy': 'breakout', 'time_stop': 117, 'use_sma': False, 'use_atr': False, 'use_adx': False, 'use_ema': True, 'use_spike': True, 'rsi_required': True, 'edge_k': 0.9534502881368501, 'edge_cap': 0.5647825110179785, 'bull_strategy': 'mean_reversion', 'bull_bb_std_mult': 2.5858901452281593, 'bull_rsi_os': 31, 'bull_rsi_ob': 91, 'bull_adx_thresh': 22.931700600128007, 'bull_atr_min_pct': 0.008690148366421149, 'bull_atr_max_pct': 0.06793693186078358, 'bull_tp_mult': 1.7921570026715148, 'bull_tsl_mult': 0.6330769260122567, 'bull_time_stop': 144, 'bull_use_sma': True, 'bull_use_ema': True, 'bull_use_atr': False, 'bull_use_adx': False, 'bull_use_spike': False, 'bull_rsi_required': False, 'bear_strategy': 'mean_reversion', 'bear_bb_std_mult': 0.6557653827830775, 'bear_rsi_os': 5, 'bear_rsi_ob': 77, 'bear_adx_thresh': 27.093745162351567, 'bear_atr_min_pct': 0.02151964237373153, 'bear_atr_max_pct': 0.0160837867034221, 'bear_tp_mult': 1.5148975165587837, 'bear_tsl_mult': 0.11387363939439478, 'bear_time_stop': 70, 'bear_use_sma': True, 'bear_use_ema': True, 'bear_use_atr': True, 'bear_use_adx': True, 'bear_use_spike': False, 'bear_rsi_required': True, 'sideways_strategy': 'breakout', 'sideways_bb_std_mult': 1.6321953707072314, 'sideways_rsi_os': 5, 'sideways_rsi_ob': 60, 'sideways_adx_thresh': 26.20258170377334, 'sideways_atr_min_pct': 0.001129648557843995, 'sideways_atr_max_pct': 0.10449603495325302, 'sideways_tp_mult': 2.475248468000248, 'sideways_tsl_mult': 0.7363975720437802, 'sideways_time_stop': 26, 'sideways_use_sma': False, 'sideways_use_ema': True, 'sideways_use_atr': True, 'sideways_use_adx': False, 'sideways_use_spike': True, 'sideways_rsi_required': False}.
[I 2025-08-30 15:07:35,004] Trial 368 finished with values: [-1000000000.0, 1000000000.0] and parameters: {'p_sma': 9, 'p_std': 58, 'p_atr': 17, 'p_adx': 25, 'rsi_period': 81, 'ema1': 29, 'ema2': 20, 'slip_atr_k': 0.049383753111895176, 'slip_spread_k': 0.5949345571673559, 'spread_hl_frac': 0.029513736357810603, 'bb_std_mult': 3.5935033004191963, 'rsi_os': 24, 'rsi_ob': 74, 'vol_spike': 0.18817506908845374, 'adx_thresh': 27.586476002224316, 'atr_min_pct': 0.014721935887714763, 'atr_max_pct': 0.08460529424083729, 'tp_mult': 1.6813452408915794, 'tsl_mult': 0.09415968649682936, 'strategy': 'breakout', 'time_stop': 124, 'use_sma': False, 'use_atr': True, 'use_adx': False, 'use_ema': True, 'use_spike': True, 'rsi_required': True, 'edge_k': 1.001857599787451, 'edge_cap': 0.5746282588574207, 'bull_strategy': 'mean_reversion', 'bull_bb_std_mult': 2.598819988090561, 'bull_rsi_os': 35, 'bull_rsi_ob': 91, 'bull_adx_thresh': 23.358639938960817, 'bull_atr_min_pct': 0.007579266585136153, 'bull_atr_max_pct': 0.06876373461343974, 'bull_tp_mult': 1.8347113763834912, 'bull_tsl_mult': 0.5748172513565866, 'bull_time_stop': 146, 'bull_use_sma': False, 'bull_use_ema': False, 'bull_use_atr': False, 'bull_use_adx': False, 'bull_use_spike': True, 'bull_rsi_required': False, 'bear_strategy': 'mean_reversion', 'bear_bb_std_mult': 0.6170892693817814, 'bear_rsi_os': 5, 'bear_rsi_ob': 75, 'bear_adx_thresh': 27.969028217581165, 'bear_atr_min_pct': 0.018566916856731393, 'bear_atr_max_pct': 0.04658941739001298, 'bear_tp_mult': 1.4801298980745552, 'bear_tsl_mult': 0.07153212838295299, 'bear_time_stop': 67, 'bear_use_sma': True, 'bear_use_ema': True, 'bear_use_atr': True, 'bear_use_adx': False, 'bear_use_spike': False, 'bear_rsi_required': True, 'sideways_strategy': 'mean_reversion', 'sideways_bb_std_mult': 2.10855554259036, 'sideways_rsi_os': 52, 'sideways_rsi_ob': 58, 'sideways_adx_thresh': 23.93098997814873, 'sideways_atr_min_pct': 0.0013928833248081213, 'sideways_atr_max_pct': 0.09985542406771515, 'sideways_tp_mult': 2.4305956463361587, 'sideways_tsl_mult': 0.6645999492589798, 'sideways_time_stop': 31, 'sideways_use_sma': False, 'sideways_use_ema': True, 'sideways_use_atr': True, 'sideways_use_adx': False, 'sideways_use_spike': False, 'sideways_rsi_required': False}.
[I 2025-08-30 15:07:35,480] Trial 366 finished with values: [-1000000000.0, 1000000000.0] and parameters: {'p_sma': 9, 'p_std': 58, 'p_atr': 16, 'p_adx': 25, 'rsi_period': 81, 'ema1': 29, 'ema2': 20, 'slip_atr_k': 0.04829599303915245, 'slip_spread_k': 0.5813313221823031, 'spread_hl_frac': 0.04069819515352632, 'bb_std_mult': 3.5846622062430495, 'rsi_os': 24, 'rsi_ob': 73, 'vol_spike': 0.18890769027911128, 'adx_thresh': 27.505098325657606, 'atr_min_pct': 0.014872427671374866, 'atr_max_pct': 0.0789086100517418, 'tp_mult': 1.687899219288383, 'tsl_mult': 0.09515598407431601, 'strategy': 'breakout', 'time_stop': 167, 'use_sma': False, 'use_atr': True, 'use_adx': True, 'use_ema': True, 'use_spike': True, 'rsi_required': True, 'edge_k': 0.9977063628106381, 'edge_cap': 0.5626778942215495, 'bull_strategy': 'mean_reversion', 'bull_bb_std_mult': 2.5912066679818806, 'bull_rsi_os': 35, 'bull_rsi_ob': 92, 'bull_adx_thresh': 22.918916941865284, 'bull_atr_min_pct': 0.00832056686163848, 'bull_atr_max_pct': 0.06941995528516139, 'bull_tp_mult': 1.8393906487133524, 'bull_tsl_mult': 0.5794239842982594, 'bull_time_stop': 145, 'bull_use_sma': True, 'bull_use_ema': False, 'bull_use_atr': False, 'bull_use_adx': False, 'bull_use_spike': True, 'bull_rsi_required': False, 'bear_strategy': 'mean_reversion', 'bear_bb_std_mult': 0.6836214510038259, 'bear_rsi_os': 5, 'bear_rsi_ob': 78, 'bear_adx_thresh': 26.992946975280486, 'bear_atr_min_pct': 0.019855820699609554, 'bear_atr_max_pct': 0.11078195301381474, 'bear_tp_mult': 1.506310218889382, 'bear_tsl_mult': 0.7919916843689874, 'bear_time_stop': 68, 'bear_use_sma': True, 'bear_use_ema': True, 'bear_use_atr': True, 'bear_use_adx': False, 'bear_use_spike': False, 'bear_rsi_required': True, 'sideways_strategy': 'breakout', 'sideways_bb_std_mult': 1.8260602541319562, 'sideways_rsi_os': 41, 'sideways_rsi_ob': 60, 'sideways_adx_thresh': 24.093470624702533, 'sideways_atr_min_pct': 0.009755822276164599, 'sideways_atr_max_pct': 0.09862769129847741, 'sideways_tp_mult': 2.443483282242165, 'sideways_tsl_mult': 0.7197722998355096, 'sideways_time_stop': 24, 'sideways_use_sma': False, 'sideways_use_ema': True, 'sideways_use_atr': True, 'sideways_use_adx': False, 'sideways_use_spike': True, 'sideways_rsi_required': False}.
[I 2025-08-30 15:07:35,961] Trial 367 finished with values: [-1000000000.0, 1000000000.0] and parameters: {'p_sma': 9, 'p_std': 59, 'p_atr': 17, 'p_adx': 25, 'rsi_period': 81, 'ema1': 29, 'ema2': 21, 'slip_atr_k': 0.04913807382580389, 'slip_spread_k': 0.5927461421922255, 'spread_hl_frac': 0.03723741459928803, 'bb_std_mult': 3.548697166402857, 'rsi_os': 25, 'rsi_ob': 74, 'vol_spike': 0.1638854514969168, 'adx_thresh': 27.75223496442896, 'atr_min_pct': 0.015390666356511472, 'atr_max_pct': 0.07784135111702369, 'tp_mult': 1.622027650599795, 'tsl_mult': 0.09198809822499791, 'strategy': 'breakout', 'time_stop': 123, 'use_sma': False, 'use_atr': True, 'use_adx': True, 'use_ema': True, 'use_spike': True, 'rsi_required': True, 'edge_k': 0.9980601867530112, 'edge_cap': 0.5497488410845089, 'bull_strategy': 'mean_reversion', 'bull_bb_std_mult': 2.594711864157056, 'bull_rsi_os': 35, 'bull_rsi_ob': 91, 'bull_adx_thresh': 23.27084300408628, 'bull_atr_min_pct': 0.008314645516999555, 'bull_atr_max_pct': 0.07080083317044052, 'bull_tp_mult': 1.8589309928457238, 'bull_tsl_mult': 0.5724706256645993, 'bull_time_stop': 146, 'bull_use_sma': False, 'bull_use_ema': True, 'bull_use_atr': False, 'bull_use_adx': False, 'bull_use_spike': True, 'bull_rsi_required': False, 'bear_strategy': 'mean_reversion', 'bear_bb_std_mult': 0.6311016581660336, 'bear_rsi_os': 5, 'bear_rsi_ob': 78, 'bear_adx_thresh': 28.074674797089774, 'bear_atr_min_pct': 0.0196721664292988, 'bear_atr_max_pct': 0.044083901151485465, 'bear_tp_mult': 1.4989273286286564, 'bear_tsl_mult': 0.07541611582905215, 'bear_time_stop': 66, 'bear_use_sma': True, 'bear_use_ema': True, 'bear_use_atr': True, 'bear_use_adx': True, 'bear_use_spike': False, 'bear_rsi_required': True, 'sideways_strategy': 'mean_reversion', 'sideways_bb_std_mult': 2.116447677372443, 'sideways_rsi_os': 52, 'sideways_rsi_ob': 58, 'sideways_adx_thresh': 24.145186547907358, 'sideways_atr_min_pct': 0.0012193719808266971, 'sideways_atr_max_pct': 0.09927709362940401, 'sideways_tp_mult': 2.4322827379054868, 'sideways_tsl_mult': 0.7192326360209991, 'sideways_time_stop': 23, 'sideways_use_sma': False, 'sideways_use_ema': True, 'sideways_use_atr': True, 'sideways_use_adx': False, 'sideways_use_spike': True, 'sideways_rsi_required': False}.
