[I 2025-08-30 14:28:33,946] Trial 61 finished with values: [-1000000000.0, 1000000000.0] and parameters: {'p_sma': 21, 'p_std': 18, 'p_atr': 16, 'p_adx': 17, 'rsi_period': 26, 'ema1': 26, 'ema2': 37, 'slip_atr_k': 0.007847621270087118, 'slip_spread_k': 0.26368997296182073, 'spread_hl_frac': 0.005700760865363412, 'bb_std_mult': 3.018548024975472, 'rsi_os': 8, 'rsi_ob': 69, 'vol_spike': 0.13152966912958722, 'adx_thresh': 13.670145253937996, 'atr_min_pct': 0.02783899895044797, 'atr_max_pct': 0.06864690673588189, 'tp_mult': 2.4109666508302317, 'tsl_mult': 0.7808726995299873, 'strategy': 'breakout', 'time_stop': 243, 'use_sma': True, 'use_atr': False, 'use_adx': True, 'use_ema': False, 'use_spike': False, 'rsi_required': False, 'edge_k': 1.3794908146075755, 'edge_cap': 0.1777634772417807, 'bull_strategy': 'mean_reversion', 'bull_bb_std_mult': 2.727540826668824, 'bull_rsi_os': 46, 'bull_rsi_ob': 71, 'bull_adx_thresh': 17.546612760016735, 'bull_atr_min_pct': 0.013962961128625112, 'bull_atr_max_pct': 0.022707089424622143, 'bull_tp_mult': 2.1651544341246183, 'bull_tsl_mult': 0.7667644794399054, 'bull_time_stop': 277, 'bull_use_sma': False, 'bull_use_ema': False, 'bull_use_atr': True, 'bull_use_adx': False, 'bull_use_spike': True, 'bull_rsi_required': False, 'bear_strategy': 'breakout', 'bear_bb_std_mult': 1.3182396487434165, 'bear_rsi_os': 28, 'bear_rsi_ob': 52, 'bear_adx_thresh': 13.806618587040582, 'bear_atr_min_pct': 0.014334447372796202, 'bear_atr_max_pct': 0.13249873756914468, 'bear_tp_mult': 1.70126678796594, 'bear_tsl_mult': 0.23624440790022416, 'bear_time_stop': 261, 'bear_use_sma': False, 'bear_use_ema': False, 'bear_use_atr': False, 'bear_use_adx': False, 'bear_use_spike': True, 'bear_rsi_required': True, 'sideways_strategy': 'breakout', 'sideways_bb_std_mult': 0.7067291444298024, 'sideways_rsi_os': 14, 'sideways_rsi_ob': 91, 'sideways_adx_thresh': 28.13146738361373, 'sideways_atr_min_pct': 0.018706063914602687, 'sideways_atr_max_pct': 0.05275011044451966, 'sideways_tp_mult': 1.529193118650036, 'sideways_tsl_mult': 0.05292499687943626, 'sideways_time_stop': 270, 'sideways_use_sma': True, 'sideways_use_ema': False, 'sideways_use_atr': True, 'sideways_use_adx': False, 'sideways_use_spike': True, 'sideways_rsi_required': False}.
[I 2025-08-30 14:28:34,115] Trial 64 finished with values: [-0.016503845177426202, 0.016461093135271665] and parameters: {'p_sma': 40, 'p_std': 60, 'p_atr': 16, 'p_adx': 20, 'rsi_period': 64, 'ema1': 28, 'ema2': 52, 'slip_atr_k': 0.03195889222161383, 'slip_spread_k': 0.26621413552541967, 'spread_hl_frac': 0.006170004148533892, 'bb_std_mult': 2.970259293150392, 'rsi_os': 39, 'rsi_ob': 87, 'vol_spike': 0.26642770575492397, 'adx_thresh': 18.462588491145503, 'atr_min_pct': 0.021168148915870703, 'atr_max_pct': 0.07046673247689378, 'tp_mult': 2.6977936067421764, 'tsl_mult': 0.9556294196497254, 'strategy': 'mean_reversion', 'time_stop': 229, 'use_sma': True, 'use_atr': False, 'use_adx': False, 'use_ema': False, 'use_spike': False, 'rsi_required': False, 'edge_k': 1.5323590109604235, 'edge_cap': 0.10158992924407584, 'bull_strategy': 'mean_reversion', 'bull_bb_std_mult': 3.3628504308702016, 'bull_rsi_os': 9, 'bull_rsi_ob': 72, 'bull_adx_thresh': 12.310495603998463, 'bull_atr_min_pct': 0.0018275773385751598, 'bull_atr_max_pct': 0.016819317263594896, 'bull_tp_mult': 1.0854372170749282, 'bull_tsl_mult': 0.7804535788898765, 'bull_time_stop': 280, 'bull_use_sma': False, 'bull_use_ema': False, 'bull_use_atr': True, 'bull_use_adx': False, 'bull_use_spike': True, 'bull_rsi_required': False, 'bear_strategy': 'breakout', 'bear_bb_std_mult': 1.3023399005129324, 'bear_rsi_os': 18, 'bear_rsi_ob': 54, 'bear_adx_thresh': 22.215852181967627, 'bear_atr_min_pct': 0.015116854373834095, 'bear_atr_max_pct': 0.03185608761689403, 'bear_tp_mult': 2.2276107443539703, 'bear_tsl_mult': 0.14327727046993072, 'bear_time_stop': 262, 'bear_use_sma': False, 'bear_use_ema': False, 'bear_use_atr': False, 'bear_use_adx': False, 'bear_use_spike': True, 'bear_rsi_required': True, 'sideways_strategy': 'breakout', 'sideways_bb_std_mult': 0.7172123255297106, 'sideways_rsi_os': 13, 'sideways_rsi_ob': 88, 'sideways_adx_thresh': 27.981574823105422, 'sideways_atr_min_pct': 0.026707565067489194, 'sideways_atr_max_pct': 0.0675710409805902, 'sideways_tp_mult': 1.465649943550506, 'sideways_tsl_mult': 0.1902761009492021, 'sideways_time_stop': 249, 'sideways_use_sma': True, 'sideways_use_ema': False, 'sideways_use_atr': True, 'sideways_use_adx': False, 'sideways_use_spike': True, 'sideways_rsi_required': False}.
[I 2025-08-30 14:29:04,941] Trial 68 finished with values: [-1000000000.0, 1000000000.0] and parameters: {'p_sma': 38, 'p_std': 60, 'p_atr': 18, 'p_adx': 20, 'rsi_period': 63, 'ema1': 27, 'ema2': 41, 'slip_atr_k': 0.023036339900898387, 'slip_spread_k': 0.20393041857507854, 'spread_hl_frac': 0.009938120811457405, 'bb_std_mult': 2.1957930909452483, 'rsi_os': 45, 'rsi_ob': 92, 'vol_spike': 0.2694681257021703, 'adx_thresh': 18.465483798813835, 'atr_min_pct': 0.021334418436391674, 'atr_max_pct': 0.07593154902182751, 'tp_mult': 2.6689319890957397, 'tsl_mult': 0.9493626857715808, 'strategy': 'mean_reversion', 'time_stop': 5, 'use_sma': True, 'use_atr': False, 'use_adx': False, 'use_ema': False, 'use_spike': False, 'rsi_required': False, 'edge_k': 1.5466676526718595, 'edge_cap': 0.769682191247833, 'bull_strategy': 'breakout', 'bull_bb_std_mult': 3.39770755581077, 'bull_rsi_os': 10, 'bull_rsi_ob': 78, 'bull_adx_thresh': 12.723572371009912, 'bull_atr_min_pct': 0.002974935977539565, 'bull_atr_max_pct': 0.031285881949314635, 'bull_tp_mult': 1.047786879720094, 'bull_tsl_mult': 0.671298041331631, 'bull_time_stop': 237, 'bull_use_sma': False, 'bull_use_ema': False, 'bull_use_atr': True, 'bull_use_adx': True, 'bull_use_spike': True, 'bull_rsi_required': False, 'bear_strategy': 'breakout', 'bear_bb_std_mult': 1.2654577313648048, 'bear_rsi_os': 18, 'bear_rsi_ob': 51, 'bear_adx_thresh': 22.27212333072966, 'bear_atr_min_pct': 0.0030514462040934533, 'bear_atr_max_pct': 0.018725755534587107, 'bear_tp_mult': 2.1280841821853653, 'bear_tsl_mult': 0.1752961356824993, 'bear_time_stop': 216, 'bear_use_sma': False, 'bear_use_ema': False, 'bear_use_atr': False, 'bear_use_adx': False, 'bear_use_spike': True, 'bear_rsi_required': True, 'sideways_strategy': 'breakout', 'sideways_bb_std_mult': 0.6119331973974471, 'sideways_rsi_os': 31, 'sideways_rsi_ob': 88, 'sideways_adx_thresh': 30.93571952286002, 'sideways_atr_min_pct': 0.02986718872119409, 'sideways_atr_max_pct': 0.06253561201788847, 'sideways_tp_mult': 1.4325068502138159, 'sideways_tsl_mult': 0.6920213986032135, 'sideways_time_stop': 223, 'sideways_use_sma': True, 'sideways_use_ema': False, 'sideways_use_atr': False, 'sideways_use_adx': True, 'sideways_use_spike': True, 'sideways_rsi_required': True}.
[I 2025-08-30 14:29:05,511] Trial 65 finished with values: [-0.015857420818385815, 0.015754871748063764] and parameters: {'p_sma': 40, 'p_std': 60, 'p_atr': 16, 'p_adx': 20, 'rsi_period': 61, 'ema1': 27, 'ema2': 52, 'slip_atr_k': 0.025848084176493914, 'slip_spread_k': 0.2039704096784456, 'spread_hl_frac': 0.007065892230983065, 'bb_std_mult': 3.167592732038886, 'rsi_os': 40, 'rsi_ob': 87, 'vol_spike': 0.2651637999826646, 'adx_thresh': 15.145301523992677, 'atr_min_pct': 0.008975359346069028, 'atr_max_pct': 0.07458445692627265, 'tp_mult': 2.654037119078644, 'tsl_mult': 0.9512208752832227, 'strategy': 'mean_reversion', 'time_stop': 8, 'use_sma': True, 'use_atr': False, 'use_adx': False, 'use_ema': False, 'use_spike': False, 'rsi_required': False, 'edge_k': 1.4317217258732498, 'edge_cap': 0.4722504062166161, 'bull_strategy': 'mean_reversion', 'bull_bb_std_mult': 0.9456638898729146, 'bull_rsi_os': 12, 'bull_rsi_ob': 72, 'bull_adx_thresh': 12.11951268637851, 'bull_atr_min_pct': 0.0019213400105665742, 'bull_atr_max_pct': 0.024036285534380853, 'bull_tp_mult': 1.129239562307331, 'bull_tsl_mult': 0.7608526512873373, 'bull_time_stop': 274, 'bull_use_sma': False, 'bull_use_ema': False, 'bull_use_atr': True, 'bull_use_adx': False, 'bull_use_spike': True, 'bull_rsi_required': False, 'bear_strategy': 'breakout', 'bear_bb_std_mult': 1.3429407014728831, 'bear_rsi_os': 18, 'bear_rsi_ob': 51, 'bear_adx_thresh': 21.726479927063547, 'bear_atr_min_pct': 0.01462697372503395, 'bear_atr_max_pct': 0.030919273935989585, 'bear_tp_mult': 2.2572819736014638, 'bear_tsl_mult': 0.24865595686489206, 'bear_time_stop': 210, 'bear_use_sma': False, 'bear_use_ema': False, 'bear_use_atr': False, 'bear_use_adx': False, 'bear_use_spike': True, 'bear_rsi_required': True, 'sideways_strategy': 'breakout', 'sideways_bb_std_mult': 0.6862222909163342, 'sideways_rsi_os': 12, 'sideways_rsi_ob': 90, 'sideways_adx_thresh': 20.541288042320136, 'sideways_atr_min_pct': 0.029831067888992324, 'sideways_atr_max_pct': 0.05624137381019015, 'sideways_tp_mult': 1.4735003666944664, 'sideways_tsl_mult': 0.18950654254518234, 'sideways_time_stop': 251, 'sideways_use_sma': True, 'sideways_use_ema': False, 'sideways_use_atr': True, 'sideways_use_adx': False, 'sideways_use_spike': True, 'sideways_rsi_required': False}.
[I 2025-08-30 14:29:05,711] Trial 66 finished with values: [-1000000000.0, 1000000000.0] and parameters: {'p_sma': 39, 'p_std': 60, 'p_atr': 18, 'p_adx': 20, 'rsi_period': 62, 'ema1': 28, 'ema2': 52, 'slip_atr_k': 0.023102705506826617, 'slip_spread_k': 0.2678838005102382, 'spread_hl_frac': 0.006531116974159595, 'bb_std_mult': 3.187590455144279, 'rsi_os': 38, 'rsi_ob': 94, 'vol_spike': 0.26960186466570285, 'adx_thresh': 15.415727749638627, 'atr_min_pct': 0.0024562064491767243, 'atr_max_pct': 0.07108173801914691, 'tp_mult': 2.6550100705303006, 'tsl_mult': 0.9518218553861493, 'strategy': 'mean_reversion', 'time_stop': 7, 'use_sma': True, 'use_atr': False, 'use_adx': True, 'use_ema': False, 'use_spike': False, 'rsi_required': False, 'edge_k': 0.45061425884551776, 'edge_cap': 0.4553486013117943, 'bull_strategy': 'mean_reversion', 'bull_bb_std_mult': 3.4191751562237025, 'bull_rsi_os': 10, 'bull_rsi_ob': 72, 'bull_adx_thresh': 19.455844832878462, 'bull_atr_min_pct': 0.0017891623730185544, 'bull_atr_max_pct': 0.010946804286113051, 'bull_tp_mult': 1.0250954169846995, 'bull_tsl_mult': 0.7617654479837142, 'bull_time_stop': 235, 'bull_use_sma': False, 'bull_use_ema': False, 'bull_use_atr': True, 'bull_use_adx': False, 'bull_use_spike': True, 'bull_rsi_required': False, 'bear_strategy': 'breakout', 'bear_bb_std_mult': 1.2693928212034884, 'bear_rsi_os': 19, 'bear_rsi_ob': 54, 'bear_adx_thresh': 20.645892588497837, 'bear_atr_min_pct': 0.0034371916967602424, 'bear_atr_max_pct': 0.017371695522015493, 'bear_tp_mult': 2.239173616030421, 'bear_tsl_mult': 0.21201937319074332, 'bear_time_stop': 213, 'bear_use_sma': False, 'bear_use_ema': False, 'bear_use_atr': False, 'bear_use_adx': False, 'bear_use_spike': True, 'bear_rsi_required': True, 'sideways_strategy': 'breakout', 'sideways_bb_std_mult': 0.6461470222111898, 'sideways_rsi_os': 31, 'sideways_rsi_ob': 87, 'sideways_adx_thresh': 20.433252244006855, 'sideways_atr_min_pct': 0.02919098741872074, 'sideways_atr_max_pct': 0.05649686103620638, 'sideways_tp_mult': 1.4482204260899199, 'sideways_tsl_mult': 0.14343125371003237, 'sideways_time_stop': 270, 'sideways_use_sma': True, 'sideways_use_ema': False, 'sideways_use_atr': True, 'sideways_use_adx': False, 'sideways_use_spike': True, 'sideways_rsi_required': False}.
[I 2025-08-30 14:29:05,785] Trial 67 finished with values: [-0.014497732298323851, 0.014953948637077578] and parameters: {'p_sma': 39, 'p_std': 60, 'p_atr': 15, 'p_adx': 22, 'rsi_period': 61, 'ema1': 28, 'ema2': 52, 'slip_atr_k': 0.01991404921968484, 'slip_spread_k': 0.2086394986199769, 'spread_hl_frac': 0.0020822012010110634, 'bb_std_mult': 2.1639973224016624, 'rsi_os': 38, 'rsi_ob': 92, 'vol_spike': 0.2282347006199844, 'adx_thresh': 14.66124953737944, 'atr_min_pct': 0.021076629755536522, 'atr_max_pct': 0.07591445616326754, 'tp_mult': 2.6752878243118507, 'tsl_mult': 0.9517239136240736, 'strategy': 'mean_reversion', 'time_stop': 6, 'use_sma': True, 'use_atr': False, 'use_adx': False, 'use_ema': False, 'use_spike': False, 'rsi_required': False, 'edge_k': 1.6076064503288787, 'edge_cap': 0.44763132407326994, 'bull_strategy': 'breakout', 'bull_bb_std_mult': 3.4095244858278955, 'bull_rsi_os': 11, 'bull_rsi_ob': 78, 'bull_adx_thresh': 12.928410082685362, 'bull_atr_min_pct': 0.0018237116755420789, 'bull_atr_max_pct': 0.012390268225414391, 'bull_tp_mult': 1.1437911968033523, 'bull_tsl_mult': 0.5672600863639472, 'bull_time_stop': 269, 'bull_use_sma': False, 'bull_use_ema': False, 'bull_use_atr': True, 'bull_use_adx': False, 'bull_use_spike': True, 'bull_rsi_required': False, 'bear_strategy': 'breakout', 'bear_bb_std_mult': 1.261225475145817, 'bear_rsi_os': 17, 'bear_rsi_ob': 51, 'bear_adx_thresh': 20.68099185362263, 'bear_atr_min_pct': 0.012463128191801265, 'bear_atr_max_pct': 0.020071776856554934, 'bear_tp_mult': 2.1260320276973763, 'bear_tsl_mult': 0.16356271996145866, 'bear_time_stop': 237, 'bear_use_sma': False, 'bear_use_ema': False, 'bear_use_atr': False, 'bear_use_adx': False, 'bear_use_spike': True, 'bear_rsi_required': True, 'sideways_strategy': 'breakout', 'sideways_bb_std_mult': 0.6852019551792707, 'sideways_rsi_os': 31, 'sideways_rsi_ob': 87, 'sideways_adx_thresh': 25.767275419901807, 'sideways_atr_min_pct': 0.029300638954987298, 'sideways_atr_max_pct': 0.0640428351003522, 'sideways_tp_mult': 1.4648663891016858, 'sideways_tsl_mult': 0.13053253841112722, 'sideways_time_stop': 228, 'sideways_use_sma': True, 'sideways_use_ema': False, 'sideways_use_atr': False, 'sideways_use_adx': True, 'sideways_use_spike': True, 'sideways_rsi_required': True}.
[I 2025-08-30 14:29:36,639] Trial 70 finished with values: [-1000000000.0, 1000000000.0] and parameters: {'p_sma': 39, 'p_std': 60, 'p_atr': 15, 'p_adx': 22, 'rsi_period': 54, 'ema1': 28, 'ema2': 52, 'slip_atr_k': 0.039677716738967334, 'slip_spread_k': 0.20226612767390845, 'spread_hl_frac': 0.006698686338507454, 'bb_std_mult': 3.2144148038014055, 'rsi_os': 39, 'rsi_ob': 94, 'vol_spike': 0.27168406680626495, 'adx_thresh': 15.936053221185727, 'atr_min_pct': 0.0097941514642719, 'atr_max_pct': 0.07216020867573074, 'tp_mult': 2.6447572424905514, 'tsl_mult': 0.9537992797989444, 'strategy': 'mean_reversion', 'time_stop': 45, 'use_sma': True, 'use_atr': True, 'use_adx': False, 'use_ema': True, 'use_spike': False, 'rsi_required': False, 'edge_k': 1.3384110402366538, 'edge_cap': 0.47133274916137297, 'bull_strategy': 'mean_reversion', 'bull_bb_std_mult': 0.9041752079432476, 'bull_rsi_os': 12, 'bull_rsi_ob': 73, 'bull_adx_thresh': 11.262791104161153, 'bull_atr_min_pct': 0.020737816889714482, 'bull_atr_max_pct': 0.014970433762936615, 'bull_tp_mult': 1.0912109172760645, 'bull_tsl_mult': 0.7406162815748967, 'bull_time_stop': 284, 'bull_use_sma': True, 'bull_use_ema': False, 'bull_use_atr': True, 'bull_use_adx': False, 'bull_use_spike': True, 'bull_rsi_required': False, 'bear_strategy': 'breakout', 'bear_bb_std_mult': 0.9996204924120531, 'bear_rsi_os': 55, 'bear_rsi_ob': 54, 'bear_adx_thresh': 20.35172335237928, 'bear_atr_min_pct': 0.008502657387713046, 'bear_atr_max_pct': 0.018388023197370568, 'bear_tp_mult': 2.244944997225487, 'bear_tsl_mult': 0.2684736103253574, 'bear_time_stop': 182, 'bear_use_sma': False, 'bear_use_ema': False, 'bear_use_atr': False, 'bear_use_adx': False, 'bear_use_spike': True, 'bear_rsi_required': True, 'sideways_strategy': 'breakout', 'sideways_bb_std_mult': 0.9785003229513709, 'sideways_rsi_os': 12, 'sideways_rsi_ob': 86, 'sideways_adx_thresh': 19.879862215665764, 'sideways_atr_min_pct': 0.029018804263945798, 'sideways_atr_max_pct': 0.05605522365990717, 'sideways_tp_mult': 1.036824367396921, 'sideways_tsl_mult': 0.9252080917094809, 'sideways_time_stop': 249, 'sideways_use_sma': True, 'sideways_use_ema': True, 'sideways_use_atr': True, 'sideways_use_adx': False, 'sideways_use_spike': True, 'sideways_rsi_required': False}.
[I 2025-08-30 14:29:37,441] Trial 69 finished with values: [-0.015499564346194927, 0.016009658466147166] and parameters: {'p_sma': 40, 'p_std': 60, 'p_atr': 17, 'p_adx': 22, 'rsi_period': 83, 'ema1': 28, 'ema2': 47, 'slip_atr_k': 0.03794640550969133, 'slip_spread_k': 0.25773969313924805, 'spread_hl_frac': 0.0027203966040397097, 'bb_std_mult': 3.154013717689897, 'rsi_os': 38, 'rsi_ob': 59, 'vol_spike': 0.22550783503260358, 'adx_thresh': 15.310092044460236, 'atr_min_pct': 0.02912513438102892, 'atr_max_pct': 0.0612471646683217, 'tp_mult': 2.6890149807263013, 'tsl_mult': 0.8883210729945137, 'strategy': 'mean_reversion', 'time_stop': 270, 'use_sma': True, 'use_atr': True, 'use_adx': True, 'use_ema': True, 'use_spike': False, 'rsi_required': False, 'edge_k': 1.4201255566902116, 'edge_cap': 0.475463827012984, 'bull_strategy': 'breakout', 'bull_bb_std_mult': 3.1315742228279153, 'bull_rsi_os': 12, 'bull_rsi_ob': 73, 'bull_adx_thresh': 13.770126337965586, 'bull_atr_min_pct': 0.0017090126226715083, 'bull_atr_max_pct': 0.0649189121833916, 'bull_tp_mult': 1.1039337659532469, 'bull_tsl_mult': 0.5657721726318289, 'bull_time_stop': 268, 'bull_use_sma': False, 'bull_use_ema': False, 'bull_use_atr': True, 'bull_use_adx': False, 'bull_use_spike': True, 'bull_rsi_required': False, 'bear_strategy': 'breakout', 'bear_bb_std_mult': 0.8982243421092138, 'bear_rsi_os': 18, 'bear_rsi_ob': 54, 'bear_adx_thresh': 20.573881809810715, 'bear_atr_min_pct': 0.024350560845433557, 'bear_atr_max_pct': 0.014854575629812735, 'bear_tp_mult': 2.2446588916737378, 'bear_tsl_mult': 0.13577752942120463, 'bear_time_stop': 239, 'bear_use_sma': False, 'bear_use_ema': False, 'bear_use_atr': False, 'bear_use_adx': False, 'bear_use_spike': True, 'bear_rsi_required': True, 'sideways_strategy': 'breakout', 'sideways_bb_std_mult': 0.9740654777487632, 'sideways_rsi_os': 27, 'sideways_rsi_ob': 86, 'sideways_adx_thresh': 25.813421579468272, 'sideways_atr_min_pct': 0.02222501812813607, 'sideways_atr_max_pct': 0.05615048980484482, 'sideways_tp_mult': 2.2508920874227734, 'sideways_tsl_mult': 0.14341456651929302, 'sideways_time_stop': 252, 'sideways_use_sma': True, 'sideways_use_ema': True, 'sideways_use_atr': False, 'sideways_use_adx': True, 'sideways_use_spike': True, 'sideways_rsi_required': True}.
[I 2025-08-30 14:29:37,465] Trial 72 finished with values: [-1000000000.0, 1000000000.0] and parameters: {'p_sma': 42, 'p_std': 55, 'p_atr': 15, 'p_adx': 26, 'rsi_period': 56, 'ema1': 29, 'ema2': 48, 'slip_atr_k': 0.03873655210293868, 'slip_spread_k': 0.1859430679189524, 'spread_hl_frac': 0.0024764497950659874, 'bb_std_mult': 2.3468376927401637, 'rsi_os': 39, 'rsi_ob': 93, 'vol_spike': 0.22840052587257026, 'adx_thresh': 15.132430973276218, 'atr_min_pct': 0.02105535887677752, 'atr_max_pct': 0.08597018934780044, 'tp_mult': 2.7182350677973255, 'tsl_mult': 0.8933758091563883, 'strategy': 'mean_reversion', 'time_stop': 127, 'use_sma': True, 'use_atr': True, 'use_adx': False, 'use_ema': True, 'use_spike': False, 'rsi_required': False, 'edge_k': 1.775106420967103, 'edge_cap': 0.860630141709736, 'bull_strategy': 'breakout', 'bull_bb_std_mult': 3.5492336761916072, 'bull_rsi_os': 14, 'bull_rsi_ob': 81, 'bull_adx_thresh': 13.77621864453725, 'bull_atr_min_pct': 0.027420076807821197, 'bull_atr_max_pct': 0.0166689884304214, 'bull_tp_mult': 1.1233056713291896, 'bull_tsl_mult': 0.5661369731475377, 'bull_time_stop': 284, 'bull_use_sma': True, 'bull_use_ema': False, 'bull_use_atr': True, 'bull_use_adx': False, 'bull_use_spike': True, 'bull_rsi_required': False, 'bear_strategy': 'mean_reversion', 'bear_bb_std_mult': 0.84570664562221, 'bear_rsi_os': 17, 'bear_rsi_ob': 58, 'bear_adx_thresh': 21.536900726322582, 'bear_atr_min_pct': 0.008210983895215369, 'bear_atr_max_pct': 0.012413389853920223, 'bear_tp_mult': 2.0989524182780683, 'bear_tsl_mult': 0.14595228681913563, 'bear_time_stop': 240, 'bear_use_sma': False, 'bear_use_ema': True, 'bear_use_atr': False, 'bear_use_adx': False, 'bear_use_spike': False, 'bear_rsi_required': True, 'sideways_strategy': 'breakout', 'sideways_bb_std_mult': 0.9448318520249238, 'sideways_rsi_os': 35, 'sideways_rsi_ob': 85, 'sideways_adx_thresh': 22.61556241712615, 'sideways_atr_min_pct': 0.026375521715570036, 'sideways_atr_max_pct': 0.06936019587479843, 'sideways_tp_mult': 1.0639791340689329, 'sideways_tsl_mult': 0.11958804871982807, 'sideways_time_stop': 169, 'sideways_use_sma': True, 'sideways_use_ema': True, 'sideways_use_atr': False, 'sideways_use_adx': True, 'sideways_use_spike': True, 'sideways_rsi_required': True}.
