[I 2025-08-30 15:56:59,862] Trial 603 finished with values: [-1000000000.0, 1000000000.0] and parameters: {'p_sma': 7, 'p_std': 58, 'p_atr': 15, 'p_adx': 25, 'rsi_period': 78, 'ema1': 23, 'ema2': 31, 'slip_atr_k': 0.08954812324616163, 'slip_spread_k': 0.10591104366040893, 'spread_hl_frac': 0.024812496241241676, 'bb_std_mult': 0.8770173775514372, 'rsi_os': 26, 'rsi_ob': 87, 'vol_spike': 0.16531881875044918, 'adx_thresh': 32.05983754171468, 'atr_min_pct': 0.013855065320468896, 'atr_max_pct': 0.09476675753593689, 'tp_mult': 1.732167987210201, 'tsl_mult': 0.47234223414130483, 'strategy': 'mean_reversion', 'time_stop': 115, 'use_sma': True, 'use_atr': True, 'use_adx': True, 'use_ema': True, 'use_spike': True, 'rsi_required': True, 'edge_k': 0.1815140999746745, 'edge_cap': 0.5811188702026319, 'bull_strategy': 'mean_reversion', 'bull_bb_std_mult': 1.743392293326552, 'bull_rsi_os': 35, 'bull_rsi_ob': 50, 'bull_adx_thresh': 23.373336354065245, 'bull_atr_min_pct': 0.02045997398779956, 'bull_atr_max_pct': 0.06797620316641147, 'bull_tp_mult': 2.077881383938939, 'bull_tsl_mult': 0.2521239063086795, 'bull_time_stop': 61, 'bull_use_sma': False, 'bull_use_ema': False, 'bull_use_atr': False, 'bull_use_adx': True, 'bull_use_spike': True, 'bull_rsi_required': False, 'bear_strategy': 'mean_reversion', 'bear_bb_std_mult': 2.6332969305940903, 'bear_rsi_os': 30, 'bear_rsi_ob': 73, 'bear_adx_thresh': 34.99846132528732, 'bear_atr_min_pct': 0.028314749603785723, 'bear_atr_max_pct': 0.14852890087731224, 'bear_tp_mult': 1.5281831776509363, 'bear_tsl_mult': 0.4961896873244428, 'bear_time_stop': 57, 'bear_use_sma': True, 'bear_use_ema': True, 'bear_use_atr': True, 'bear_use_adx': False, 'bear_use_spike': False, 'bear_rsi_required': True, 'sideways_strategy': 'breakout', 'sideways_bb_std_mult': 2.201268558507796, 'sideways_rsi_os': 42, 'sideways_rsi_ob': 60, 'sideways_adx_thresh': 5.000454915655441, 'sideways_atr_min_pct': 0.027405867815873272, 'sideways_atr_max_pct': 0.10951772422256462, 'sideways_tp_mult': 1.0499580600501854, 'sideways_tsl_mult': 0.5761974746954858, 'sideways_time_stop': 98, 'sideways_use_sma': True, 'sideways_use_ema': False, 'sideways_use_atr': True, 'sideways_use_adx': False, 'sideways_use_spike': True, 'sideways_rsi_required': True}.
[I 2025-08-30 15:57:00,561] Trial 604 finished with values: [-1000000000.0, 1000000000.0] and parameters: {'p_sma': 7, 'p_std': 59, 'p_atr': 19, 'p_adx': 7, 'rsi_period': 14, 'ema1': 15, 'ema2': 35, 'slip_atr_k': 0.0909792586864344, 'slip_spread_k': 0.44819655836263705, 'spread_hl_frac': 0.024767553551682513, 'bb_std_mult': 1.5323407713374104, 'rsi_os': 26, 'rsi_ob': 87, 'vol_spike': 0.16640805931092928, 'adx_thresh': 14.014010655023041, 'atr_min_pct': 0.013167240825967675, 'atr_max_pct': 0.0745250836033164, 'tp_mult': 1.740890927476085, 'tsl_mult': 0.740268110365315, 'strategy': 'mean_reversion', 'time_stop': 111, 'use_sma': True, 'use_atr': True, 'use_adx': False, 'use_ema': True, 'use_spike': False, 'rsi_required': False, 'edge_k': 0.18548443206055953, 'edge_cap': 0.3103059290772297, 'bull_strategy': 'mean_reversion', 'bull_bb_std_mult': 2.5619109756009295, 'bull_rsi_os': 50, 'bull_rsi_ob': 50, 'bull_adx_thresh': 22.713714268588312, 'bull_atr_min_pct': 0.022389107067414295, 'bull_atr_max_pct': 0.06894085616595727, 'bull_tp_mult': 2.031194322298733, 'bull_tsl_mult': 0.2541405344381379, 'bull_time_stop': 22, 'bull_use_sma': False, 'bull_use_ema': False, 'bull_use_atr': False, 'bull_use_adx': True, 'bull_use_spike': True, 'bull_rsi_required': True, 'bear_strategy': 'mean_reversion', 'bear_bb_std_mult': 3.3557933520374856, 'bear_rsi_os': 19, 'bear_rsi_ob': 74, 'bear_adx_thresh': 27.443939815866486, 'bear_atr_min_pct': 0.022596289155830993, 'bear_atr_max_pct': 0.09360865272719304, 'bear_tp_mult': 1.2471666745186436, 'bear_tsl_mult': 0.9023740862263591, 'bear_time_stop': 214, 'bear_use_sma': False, 'bear_use_ema': True, 'bear_use_atr': True, 'bear_use_adx': False, 'bear_use_spike': True, 'bear_rsi_required': True, 'sideways_strategy': 'breakout', 'sideways_bb_std_mult': 0.9612843488051073, 'sideways_rsi_os': 42, 'sideways_rsi_ob': 58, 'sideways_adx_thresh': 27.5838377399133, 'sideways_atr_min_pct': 0.015390610574937794, 'sideways_atr_max_pct': 0.1090802687140568, 'sideways_tp_mult': 2.4823588816476554, 'sideways_tsl_mult': 0.9448021639935178, 'sideways_time_stop': 86, 'sideways_use_sma': True, 'sideways_use_ema': False, 'sideways_use_atr': True, 'sideways_use_adx': False, 'sideways_use_spike': True, 'sideways_rsi_required': True}.
[I 2025-08-30 15:57:00,877] Trial 602 finished with values: [-1000000000.0, 1000000000.0] and parameters: {'p_sma': 6, 'p_std': 41, 'p_atr': 15, 'p_adx': 25, 'rsi_period': 25, 'ema1': 12, 'ema2': 31, 'slip_atr_k': 0.06472696448951258, 'slip_spread_k': 0.12810810541987433, 'spread_hl_frac': 0.020992885217347816, 'bb_std_mult': 0.8479879384782758, 'rsi_os': 24, 'rsi_ob': 47, 'vol_spike': 0.101776112242317, 'adx_thresh': 14.477217171192802, 'atr_min_pct': 0.01515262352646187, 'atr_max_pct': 0.07502717807827766, 'tp_mult': 1.7300696087599086, 'tsl_mult': 0.800805970616031, 'strategy': 'breakout', 'time_stop': 110, 'use_sma': True, 'use_atr': True, 'use_adx': False, 'use_ema': True, 'use_spike': True, 'rsi_required': True, 'edge_k': 0.19512933542691727, 'edge_cap': 0.7620240303857108, 'bull_strategy': 'breakout', 'bull_bb_std_mult': 1.6827823360351606, 'bull_rsi_os': 38, 'bull_rsi_ob': 50, 'bull_adx_thresh': 23.254079286276234, 'bull_atr_min_pct': 0.022364496623739856, 'bull_atr_max_pct': 0.030263403016691753, 'bull_tp_mult': 1.5822679772800623, 'bull_tsl_mult': 0.017958811300789468, 'bull_time_stop': 149, 'bull_use_sma': False, 'bull_use_ema': False, 'bull_use_atr': False, 'bull_use_adx': False, 'bull_use_spike': True, 'bull_rsi_required': False, 'bear_strategy': 'mean_reversion', 'bear_bb_std_mult': 1.997748096778093, 'bear_rsi_os': 45, 'bear_rsi_ob': 73, 'bear_adx_thresh': 28.518972856969533, 'bear_atr_min_pct': 0.027915418111104068, 'bear_atr_max_pct': 0.13118854060178556, 'bear_tp_mult': 1.5320772191526815, 'bear_tsl_mult': 0.46783928261053165, 'bear_time_stop': 222, 'bear_use_sma': True, 'bear_use_ema': False, 'bear_use_atr': True, 'bear_use_adx': True, 'bear_use_spike': False, 'bear_rsi_required': True, 'sideways_strategy': 'breakout', 'sideways_bb_std_mult': 2.2293665758599244, 'sideways_rsi_os': 24, 'sideways_rsi_ob': 50, 'sideways_adx_thresh': 27.795357068656177, 'sideways_atr_min_pct': 0.00043658089163061607, 'sideways_atr_max_pct': 0.09855978462770586, 'sideways_tp_mult': 1.695337210035785, 'sideways_tsl_mult': 0.6785953176261407, 'sideways_time_stop': 98, 'sideways_use_sma': True, 'sideways_use_ema': True, 'sideways_use_atr': False, 'sideways_use_adx': True, 'sideways_use_spike': True, 'sideways_rsi_required': False}.
[I 2025-08-30 15:57:44,507] Trial 609 finished with values: [-1000000000.0, 1000000000.0] and parameters: {'p_sma': 53, 'p_std': 23, 'p_atr': 14, 'p_adx': 13, 'rsi_period': 34, 'ema1': 30, 'ema2': 38, 'slip_atr_k': 0.11600533578938767, 'slip_spread_k': 0.16196507410258726, 'spread_hl_frac': 0.038759791701747294, 'bb_std_mult': 1.4088328748667136, 'rsi_os': 50, 'rsi_ob': 48, 'vol_spike': 0.1567617984891605, 'adx_thresh': 12.685789055135569, 'atr_min_pct': 0.011615146645924756, 'atr_max_pct': 0.08175007346549196, 'tp_mult': 2.8632163755432796, 'tsl_mult': 0.748447994517554, 'strategy': 'breakout', 'time_stop': 49, 'use_sma': False, 'use_atr': True, 'use_adx': False, 'use_ema': False, 'use_spike': True, 'rsi_required': True, 'edge_k': 0.13666826082600436, 'edge_cap': 0.7926970692669932, 'bull_strategy': 'mean_reversion', 'bull_bb_std_mult': 1.9654015856601237, 'bull_rsi_os': 53, 'bull_rsi_ob': 48, 'bull_adx_thresh': 21.98650485904985, 'bull_atr_min_pct': 0.010171745637029769, 'bull_atr_max_pct': 0.13094773193702713, 'bull_tp_mult': 2.1661371265913054, 'bull_tsl_mult': 0.3680123894725723, 'bull_time_stop': 5, 'bull_use_sma': True, 'bull_use_ema': True, 'bull_use_atr': True, 'bull_use_adx': False, 'bull_use_spike': True, 'bull_rsi_required': False, 'bear_strategy': 'mean_reversion', 'bear_bb_std_mult': 0.6847083095243133, 'bear_rsi_os': 29, 'bear_rsi_ob': 60, 'bear_adx_thresh': 26.179739762115744, 'bear_atr_min_pct': 0.02020307334292301, 'bear_atr_max_pct': 0.06614550966954463, 'bear_tp_mult': 2.1443613201603124, 'bear_tsl_mult': 0.5516534654876312, 'bear_time_stop': 145, 'bear_use_sma': True, 'bear_use_ema': True, 'bear_use_atr': False, 'bear_use_adx': False, 'bear_use_spike': False, 'bear_rsi_required': False, 'sideways_strategy': 'mean_reversion', 'sideways_bb_std_mult': 1.6855434593839451, 'sideways_rsi_os': 40, 'sideways_rsi_ob': 67, 'sideways_adx_thresh': 11.562627941010868, 'sideways_atr_min_pct': 0.0013401108630469837, 'sideways_atr_max_pct': 0.10294269165979703, 'sideways_tp_mult': 2.4448161030248245, 'sideways_tsl_mult': 0.9791834112980958, 'sideways_time_stop': 78, 'sideways_use_sma': True, 'sideways_use_ema': True, 'sideways_use_atr': True, 'sideways_use_adx': False, 'sideways_use_spike': False, 'sideways_rsi_required': False}.
[I 2025-08-30 15:57:45,268] Trial 607 finished with values: [-1000000000.0, 1000000000.0] and parameters: {'p_sma': 9, 'p_std': 60, 'p_atr': 14, 'p_adx': 26, 'rsi_period': 74, 'ema1': 30, 'ema2': 47, 'slip_atr_k': 0.06440967125082533, 'slip_spread_k': 0.49358270446027286, 'spread_hl_frac': 0.033220351830634355, 'bb_std_mult': 1.410834848268648, 'rsi_os': 42, 'rsi_ob': 75, 'vol_spike': 0.15426225294162924, 'adx_thresh': 12.928469187239907, 'atr_min_pct': 0.012858453150498748, 'atr_max_pct': 0.08088549493727722, 'tp_mult': 2.8074033721854024, 'tsl_mult': 0.7423546282487663, 'strategy': 'breakout', 'time_stop': 119, 'use_sma': False, 'use_atr': True, 'use_adx': False, 'use_ema': True, 'use_spike': False, 'rsi_required': False, 'edge_k': 0.15233740534367077, 'edge_cap': 0.7610390728888319, 'bull_strategy': 'mean_reversion', 'bull_bb_std_mult': 1.6611845616612788, 'bull_rsi_os': 53, 'bull_rsi_ob': 48, 'bull_adx_thresh': 22.640993824024903, 'bull_atr_min_pct': 0.02079330742089237, 'bull_atr_max_pct': 0.12994864449966445, 'bull_tp_mult': 2.023980956108904, 'bull_tsl_mult': 0.3264757268652119, 'bull_time_stop': 153, 'bull_use_sma': True, 'bull_use_ema': True, 'bull_use_atr': True, 'bull_use_adx': False, 'bull_use_spike': True, 'bull_rsi_required': False, 'bear_strategy': 'mean_reversion', 'bear_bb_std_mult': 2.90675792071994, 'bear_rsi_os': 47, 'bear_rsi_ob': 74, 'bear_adx_thresh': 27.637580940185245, 'bear_atr_min_pct': 0.02242618427725593, 'bear_atr_max_pct': 0.062347842762880516, 'bear_tp_mult': 2.180728367547602, 'bear_tsl_mult': 0.30482258924779926, 'bear_time_stop': 73, 'bear_use_sma': True, 'bear_use_ema': True, 'bear_use_atr': True, 'bear_use_adx': False, 'bear_use_spike': True, 'bear_rsi_required': True, 'sideways_strategy': 'breakout', 'sideways_bb_std_mult': 2.064871538566334, 'sideways_rsi_os': 24, 'sideways_rsi_ob': 60, 'sideways_adx_thresh': 27.300706421443234, 'sideways_atr_min_pct': 0.0013182438533599523, 'sideways_atr_max_pct': 0.10440923694858158, 'sideways_tp_mult': 2.5275342382494674, 'sideways_tsl_mult': 0.9541098789824868, 'sideways_time_stop': 87, 'sideways_use_sma': True, 'sideways_use_ema': True, 'sideways_use_atr': True, 'sideways_use_adx': False, 'sideways_use_spike': True, 'sideways_rsi_required': False}.
[I 2025-08-30 15:57:45,809] Trial 608 finished with values: [-0.06356816309776026, 0.06351223200934321] and parameters: {'p_sma': 9, 'p_std': 34, 'p_atr': 14, 'p_adx': 25, 'rsi_period': 31, 'ema1': 30, 'ema2': 60, 'slip_atr_k': 0.13895720071401796, 'slip_spread_k': 0.13451880183402512, 'spread_hl_frac': 0.032992632146980866, 'bb_std_mult': 1.4155880803483591, 'rsi_os': 24, 'rsi_ob': 75, 'vol_spike': 0.15421805100945266, 'adx_thresh': 12.696547933760716, 'atr_min_pct': 0.015272473909417062, 'atr_max_pct': 0.08365702057012438, 'tp_mult': 1.7803913484384088, 'tsl_mult': 0.7440340454846638, 'strategy': 'breakout', 'time_stop': 118, 'use_sma': False, 'use_atr': True, 'use_adx': False, 'use_ema': False, 'use_spike': True, 'rsi_required': True, 'edge_k': 0.153268768333496, 'edge_cap': 0.12430807314161885, 'bull_strategy': 'mean_reversion', 'bull_bb_std_mult': 2.716193095111263, 'bull_rsi_os': 39, 'bull_rsi_ob': 57, 'bull_adx_thresh': 32.854107956667, 'bull_atr_min_pct': 0.021898167861542757, 'bull_atr_max_pct': 0.1381400864485488, 'bull_tp_mult': 1.1587000577827467, 'bull_tsl_mult': 0.09451039325674293, 'bull_time_stop': 153, 'bull_use_sma': True, 'bull_use_ema': True, 'bull_use_atr': True, 'bull_use_adx': False, 'bull_use_spike': True, 'bull_rsi_required': False, 'bear_strategy': 'mean_reversion', 'bear_bb_std_mult': 0.6703488475053386, 'bear_rsi_os': 46, 'bear_rsi_ob': 60, 'bear_adx_thresh': 10.723620426198423, 'bear_atr_min_pct': 0.029376958257603288, 'bear_atr_max_pct': 0.047305172987287064, 'bear_tp_mult': 1.1431463506047443, 'bear_tsl_mult': 0.9294439697754577, 'bear_time_stop': 72, 'bear_use_sma': True, 'bear_use_ema': True, 'bear_use_atr': False, 'bear_use_adx': False, 'bear_use_spike': False, 'bear_rsi_required': False, 'sideways_strategy': 'mean_reversion', 'sideways_bb_std_mult': 2.059571742070841, 'sideways_rsi_os': 41, 'sideways_rsi_ob': 56, 'sideways_adx_thresh': 11.171614511460671, 'sideways_atr_min_pct': 6.760529836551989e-06, 'sideways_atr_max_pct': 0.10300833854780159, 'sideways_tp_mult': 2.439211599656084, 'sideways_tsl_mult': 0.9999198184088401, 'sideways_time_stop': 188, 'sideways_use_sma': True, 'sideways_use_ema': True, 'sideways_use_atr': True, 'sideways_use_adx': False, 'sideways_use_spike': True, 'sideways_rsi_required': False}.
[I 2025-08-30 15:57:45,825] Trial 606 finished with values: [-1000000000.0, 0.19960539122177923] and parameters: {'p_sma': 40, 'p_std': 17, 'p_atr': 15, 'p_adx': 7, 'rsi_period': 35, 'ema1': 30, 'ema2': 31, 'slip_atr_k': 0.09351276128556837, 'slip_spread_k': 0.4918755376119283, 'spread_hl_frac': 0.033302026837868336, 'bb_std_mult': 1.4008431578525444, 'rsi_os': 19, 'rsi_ob': 87, 'vol_spike': 0.16555800406920135, 'adx_thresh': 12.687567594936569, 'atr_min_pct': 0.02998580457095381, 'atr_max_pct': 0.08215858203065952, 'tp_mult': 1.7653414322623733, 'tsl_mult': 0.7197241793578137, 'strategy': 'mean_reversion', 'time_stop': 119, 'use_sma': True, 'use_atr': True, 'use_adx': False, 'use_ema': True, 'use_spike': True, 'rsi_required': True, 'edge_k': 0.16510182846181967, 'edge_cap': 0.5794039860169049, 'bull_strategy': 'mean_reversion', 'bull_bb_std_mult': 2.749122439783381, 'bull_rsi_os': 37, 'bull_rsi_ob': 48, 'bull_adx_thresh': 22.66651246704196, 'bull_atr_min_pct': 0.021934622691229016, 'bull_atr_max_pct': 0.13225632162764173, 'bull_tp_mult': 1.1590206463971535, 'bull_tsl_mult': 0.9715644571299928, 'bull_time_stop': 5, 'bull_use_sma': False, 'bull_use_ema': False, 'bull_use_atr': False, 'bull_use_adx': True, 'bull_use_spike': True, 'bull_rsi_required': False, 'bear_strategy': 'mean_reversion', 'bear_bb_std_mult': 0.6874595597566255, 'bear_rsi_os': 53, 'bear_rsi_ob': 60, 'bear_adx_thresh': 27.457695843009436, 'bear_atr_min_pct': 0.020302169811855786, 'bear_atr_max_pct': 0.06477373840081191, 'bear_tp_mult': 2.192816645394407, 'bear_tsl_mult': 0.31294549586953346, 'bear_time_stop': 73, 'bear_use_sma': True, 'bear_use_ema': True, 'bear_use_atr': True, 'bear_use_adx': False, 'bear_use_spike': False, 'bear_rsi_required': True, 'sideways_strategy': 'breakout', 'sideways_bb_std_mult': 2.9586530398771336, 'sideways_rsi_os': 40, 'sideways_rsi_ob': 60, 'sideways_adx_thresh': 27.34046342283082, 'sideways_atr_min_pct': 3.1063749027968567e-05, 'sideways_atr_max_pct': 0.10327051814525963, 'sideways_tp_mult': 1.0540058790512452, 'sideways_tsl_mult': 0.9423002334291293, 'sideways_time_stop': 87, 'sideways_use_sma': True, 'sideways_use_ema': False, 'sideways_use_atr': True, 'sideways_use_adx': False, 'sideways_use_spike': True, 'sideways_rsi_required': False}.
[I 2025-08-30 15:58:32,785] Trial 611 finished with values: [-0.015428187823870343, 0.015296836151156791] and parameters: {'p_sma': 25, 'p_std': 56, 'p_atr': 11, 'p_adx': 10, 'rsi_period': 81, 'ema1': 29, 'ema2': 33, 'slip_atr_k': 0.08292700370241939, 'slip_spread_k': 0.10130461189471344, 'spread_hl_frac': 0.027404139385710697, 'bb_std_mult': 1.1054380409449673, 'rsi_os': 28, 'rsi_ob': 73, 'vol_spike': 0.16467787706996556, 'adx_thresh': 33.90166812951026, 'atr_min_pct': 0.013188044117786525, 'atr_max_pct': 0.08472424062578451, 'tp_mult': 1.792780910297042, 'tsl_mult': 0.25056515385274813, 'strategy': 'breakout', 'time_stop': 131, 'use_sma': False, 'use_atr': True, 'use_adx': True, 'use_ema': True, 'use_spike': True, 'rsi_required': True, 'edge_k': 0.36596377136908675, 'edge_cap': 0.5611300459601558, 'bull_strategy': 'mean_reversion', 'bull_bb_std_mult': 2.6065652481349293, 'bull_rsi_os': 37, 'bull_rsi_ob': 52, 'bull_adx_thresh': 5.021483689928644, 'bull_atr_min_pct': 0.0194484567051265, 'bull_atr_max_pct': 0.11337581014572956, 'bull_tp_mult': 2.3046742498985764, 'bull_tsl_mult': 0.8850313287574696, 'bull_time_stop': 54, 'bull_use_sma': False, 'bull_use_ema': False, 'bull_use_atr': False, 'bull_use_adx': False, 'bull_use_spike': True, 'bull_rsi_required': True, 'bear_strategy': 'mean_reversion', 'bear_bb_std_mult': 0.8032502736913294, 'bear_rsi_os': 32, 'bear_rsi_ob': 77, 'bear_adx_thresh': 29.022854930004556, 'bear_atr_min_pct': 0.02992231879543241, 'bear_atr_max_pct': 0.13661698927998753, 'bear_tp_mult': 1.844031809434982, 'bear_tsl_mult': 0.6433776897640203, 'bear_time_stop': 64, 'bear_use_sma': False, 'bear_use_ema': True, 'bear_use_atr': True, 'bear_use_adx': False, 'bear_use_spike': False, 'bear_rsi_required': True, 'sideways_strategy': 'breakout', 'sideways_bb_std_mult': 2.2939189295875066, 'sideways_rsi_os': 39, 'sideways_rsi_ob': 57, 'sideways_adx_thresh': 26.38166680135542, 'sideways_atr_min_pct': 0.002475560536493907, 'sideways_atr_max_pct': 0.12918172629131308, 'sideways_tp_mult': 2.411479563016257, 'sideways_tsl_mult': 0.9998183589483867, 'sideways_time_stop': 92, 'sideways_use_sma': True, 'sideways_use_ema': True, 'sideways_use_atr': True, 'sideways_use_adx': False, 'sideways_use_spike': True, 'sideways_rsi_required': False}.
[I 2025-08-30 15:58:33,861] Trial 612 finished with values: [-1000000000.0, 1000000000.0] and parameters: {'p_sma': 8, 'p_std': 56, 'p_atr': 15, 'p_adx': 29, 'rsi_period': 37, 'ema1': 22, 'ema2': 33, 'slip_atr_k': 0.12440584070594937, 'slip_spread_k': 0.7539320074279694, 'spread_hl_frac': 0.027473883431266048, 'bb_std_mult': 1.114609004105491, 'rsi_os': 53, 'rsi_ob': 57, 'vol_spike': 0.01613806715494029, 'adx_thresh': 13.725360956261952, 'atr_min_pct': 0.013092016110031997, 'atr_max_pct': 0.025355124024403597, 'tp_mult': 1.7767264260360955, 'tsl_mult': 0.7226957045841543, 'strategy': 'breakout', 'time_stop': 132, 'use_sma': False, 'use_atr': True, 'use_adx': True, 'use_ema': True, 'use_spike': True, 'rsi_required': True, 'edge_k': 1.4857597219031422, 'edge_cap': 0.5582976388660896, 'bull_strategy': 'mean_reversion', 'bull_bb_std_mult': 2.5899824554684625, 'bull_rsi_os': 8, 'bull_rsi_ob': 81, 'bull_adx_thresh': 31.58006331941929, 'bull_atr_min_pct': 0.012739717867612316, 'bull_atr_max_pct': 0.07327870768334765, 'bull_tp_mult': 2.1681536265425607, 'bull_tsl_mult': 0.31758198109016456, 'bull_time_stop': 176, 'bull_use_sma': False, 'bull_use_ema': False, 'bull_use_atr': False, 'bull_use_adx': False, 'bull_use_spike': True, 'bull_rsi_required': True, 'bear_strategy': 'mean_reversion', 'bear_bb_std_mult': 0.5000360933145094, 'bear_rsi_os': 53, 'bear_rsi_ob': 77, 'bear_adx_thresh': 28.998879967826177, 'bear_atr_min_pct': 0.024704218228964393, 'bear_atr_max_pct': 0.13742965132596366, 'bear_tp_mult': 2.8842895082537328, 'bear_tsl_mult': 0.6444672801342302, 'bear_time_stop': 67, 'bear_use_sma': False, 'bear_use_ema': True, 'bear_use_atr': True, 'bear_use_adx': False, 'bear_use_spike': False, 'bear_rsi_required': True, 'sideways_strategy': 'breakout', 'sideways_bb_std_mult': 2.400928437000224, 'sideways_rsi_os': 39, 'sideways_rsi_ob': 46, 'sideways_adx_thresh': 6.0793392964951956, 'sideways_atr_min_pct': 0.02558815681911754, 'sideways_atr_max_pct': 0.12873010256457865, 'sideways_tp_mult': 2.537838883944774, 'sideways_tsl_mult': 0.31263954799534693, 'sideways_time_stop': 92, 'sideways_use_sma': True, 'sideways_use_ema': True, 'sideways_use_atr': True, 'sideways_use_adx': False, 'sideways_use_spike': False, 'sideways_rsi_required': False}.
