[I 2025-08-30 15:11:39,122] Trial 387 finished with values: [-1000000000.0, 1000000000.0] and parameters: {'p_sma': 10, 'p_std': 58, 'p_atr': 17, 'p_adx': 24, 'rsi_period': 79, 'ema1': 18, 'ema2': 19, 'slip_atr_k': 0.05127716152111267, 'slip_spread_k': 0.5366724086706259, 'spread_hl_frac': 0.02623724877543953, 'bb_std_mult': 1.6614176579821833, 'rsi_os': 25, 'rsi_ob': 73, 'vol_spike': 0.21394199028680333, 'adx_thresh': 27.891743285804953, 'atr_min_pct': 0.025614688405691137, 'atr_max_pct': 0.08066571055485826, 'tp_mult': 1.765157863665006, 'tsl_mult': 0.06499602243315958, 'strategy': 'breakout', 'time_stop': 121, 'use_sma': False, 'use_atr': True, 'use_adx': False, 'use_ema': True, 'use_spike': True, 'rsi_required': True, 'edge_k': 0.8564632022759933, 'edge_cap': 0.605529473534094, 'bull_strategy': 'mean_reversion', 'bull_bb_std_mult': 2.6290530363359923, 'bull_rsi_os': 32, 'bull_rsi_ob': 91, 'bull_adx_thresh': 23.117683792662117, 'bull_atr_min_pct': 0.009611039110360238, 'bull_atr_max_pct': 0.06934622969205606, 'bull_tp_mult': 1.9517351021378047, 'bull_tsl_mult': 0.1119426005389969, 'bull_time_stop': 158, 'bull_use_sma': False, 'bull_use_ema': False, 'bull_use_atr': False, 'bull_use_adx': False, 'bull_use_spike': True, 'bull_rsi_required': False, 'bear_strategy': 'mean_reversion', 'bear_bb_std_mult': 0.6806989774712131, 'bear_rsi_os': 22, 'bear_rsi_ob': 76, 'bear_adx_thresh': 27.74405044210736, 'bear_atr_min_pct': 0.022933400809229322, 'bear_atr_max_pct': 0.08736958701100285, 'bear_tp_mult': 1.3844739802381767, 'bear_tsl_mult': 0.7160306472956807, 'bear_time_stop': 65, 'bear_use_sma': True, 'bear_use_ema': True, 'bear_use_atr': True, 'bear_use_adx': False, 'bear_use_spike': False, 'bear_rsi_required': True, 'sideways_strategy': 'breakout', 'sideways_bb_std_mult': 1.6592017760275515, 'sideways_rsi_os': 25, 'sideways_rsi_ob': 58, 'sideways_adx_thresh': 25.830170060817373, 'sideways_atr_min_pct': 0.0013655537395969404, 'sideways_atr_max_pct': 0.10081149349870196, 'sideways_tp_mult': 2.4131590870316852, 'sideways_tsl_mult': 0.6827817281359068, 'sideways_time_stop': 85, 'sideways_use_sma': False, 'sideways_use_ema': True, 'sideways_use_atr': True, 'sideways_use_adx': False, 'sideways_use_spike': True, 'sideways_rsi_required': False}.
[I 2025-08-30 15:11:40,339] Trial 389 finished with values: [-0.11257613132971478, 0.11248755618169673] and parameters: {'p_sma': 51, 'p_std': 58, 'p_atr': 17, 'p_adx': 25, 'rsi_period': 77, 'ema1': 11, 'ema2': 18, 'slip_atr_k': 0.06505913201639073, 'slip_spread_k': 0.9771576128414758, 'spread_hl_frac': 0.026340251651049452, 'bb_std_mult': 3.5016625997633968, 'rsi_os': 25, 'rsi_ob': 73, 'vol_spike': 0.2170512259718182, 'adx_thresh': 12.923474484987747, 'atr_min_pct': 0.028528903583439697, 'atr_max_pct': 0.0785067581394241, 'tp_mult': 1.6571284949495326, 'tsl_mult': 0.0694742048169734, 'strategy': 'breakout', 'time_stop': 119, 'use_sma': False, 'use_atr': True, 'use_adx': False, 'use_ema': True, 'use_spike': True, 'rsi_required': True, 'edge_k': 0.9824584960613354, 'edge_cap': 0.5694038738828029, 'bull_strategy': 'mean_reversion', 'bull_bb_std_mult': 2.5892164858517748, 'bull_rsi_os': 31, 'bull_rsi_ob': 67, 'bull_adx_thresh': 22.082654208423385, 'bull_atr_min_pct': 0.009192148834708388, 'bull_atr_max_pct': 0.0691006729455397, 'bull_tp_mult': 1.8651688142752514, 'bull_tsl_mult': 0.29685700994950537, 'bull_time_stop': 141, 'bull_use_sma': False, 'bull_use_ema': False, 'bull_use_atr': False, 'bull_use_adx': False, 'bull_use_spike': True, 'bull_rsi_required': False, 'bear_strategy': 'mean_reversion', 'bear_bb_std_mult': 0.6907502807024756, 'bear_rsi_os': 24, 'bear_rsi_ob': 76, 'bear_adx_thresh': 28.708454752623872, 'bear_atr_min_pct': 0.02288231557436869, 'bear_atr_max_pct': 0.013882204834261004, 'bear_tp_mult': 1.5500933543833801, 'bear_tsl_mult': 0.4880327641985926, 'bear_time_stop': 68, 'bear_use_sma': True, 'bear_use_ema': True, 'bear_use_atr': True, 'bear_use_adx': False, 'bear_use_spike': False, 'bear_rsi_required': True, 'sideways_strategy': 'breakout', 'sideways_bb_std_mult': 1.4598781155530904, 'sideways_rsi_os': 55, 'sideways_rsi_ob': 58, 'sideways_adx_thresh': 10.895144182717655, 'sideways_atr_min_pct': 0.0014027994714629652, 'sideways_atr_max_pct': 0.10237508951130021, 'sideways_tp_mult': 2.410536701043693, 'sideways_tsl_mult': 0.6421212558995488, 'sideways_time_stop': 87, 'sideways_use_sma': True, 'sideways_use_ema': True, 'sideways_use_atr': True, 'sideways_use_adx': False, 'sideways_use_spike': True, 'sideways_rsi_required': False}.
[I 2025-08-30 15:11:41,894] Trial 388 finished with values: [-0.04624026770315537, 0.04614569919806567] and parameters: {'p_sma': 52, 'p_std': 58, 'p_atr': 16, 'p_adx': 25, 'rsi_period': 77, 'ema1': 18, 'ema2': 58, 'slip_atr_k': 0.0648474364222186, 'slip_spread_k': 0.1117845950622195, 'spread_hl_frac': 0.02316637762740288, 'bb_std_mult': 3.512339965687365, 'rsi_os': 26, 'rsi_ob': 73, 'vol_spike': 0.21667038717611772, 'adx_thresh': 12.956192389332502, 'atr_min_pct': 0.025344593564502214, 'atr_max_pct': 0.07916222661489421, 'tp_mult': 1.632680578377224, 'tsl_mult': 0.06481400305641016, 'strategy': 'breakout', 'time_stop': 211, 'use_sma': False, 'use_atr': True, 'use_adx': False, 'use_ema': True, 'use_spike': True, 'rsi_required': True, 'edge_k': 0.853273632525509, 'edge_cap': 0.5616407786397819, 'bull_strategy': 'mean_reversion', 'bull_bb_std_mult': 2.615205739733717, 'bull_rsi_os': 5, 'bull_rsi_ob': 91, 'bull_adx_thresh': 23.260679521865864, 'bull_atr_min_pct': 0.01758456923411372, 'bull_atr_max_pct': 0.06865050980143302, 'bull_tp_mult': 1.8482156321984202, 'bull_tsl_mult': 0.10776212163083204, 'bull_time_stop': 158, 'bull_use_sma': False, 'bull_use_ema': False, 'bull_use_atr': False, 'bull_use_adx': False, 'bull_use_spike': True, 'bull_rsi_required': False, 'bear_strategy': 'mean_reversion', 'bear_bb_std_mult': 0.6937581069131814, 'bear_rsi_os': 23, 'bear_rsi_ob': 76, 'bear_adx_thresh': 28.269130717047375, 'bear_atr_min_pct': 0.028053031520956548, 'bear_atr_max_pct': 0.1377106326051045, 'bear_tp_mult': 1.381030909933116, 'bear_tsl_mult': 0.4820222036986716, 'bear_time_stop': 64, 'bear_use_sma': True, 'bear_use_ema': True, 'bear_use_atr': True, 'bear_use_adx': False, 'bear_use_spike': False, 'bear_rsi_required': True, 'sideways_strategy': 'breakout', 'sideways_bb_std_mult': 1.7819060082986211, 'sideways_rsi_os': 42, 'sideways_rsi_ob': 56, 'sideways_adx_thresh': 25.878183964631653, 'sideways_atr_min_pct': 0.0012698193144439064, 'sideways_atr_max_pct': 0.10264366482361299, 'sideways_tp_mult': 2.420641641659527, 'sideways_tsl_mult': 0.9964855935782653, 'sideways_time_stop': 24, 'sideways_use_sma': False, 'sideways_use_ema': True, 'sideways_use_atr': True, 'sideways_use_adx': False, 'sideways_use_spike': True, 'sideways_rsi_required': False}.
[I 2025-08-30 15:12:30,122] Trial 393 finished with values: [-1000000000.0, 1000000000.0] and parameters: {'p_sma': 9, 'p_std': 55, 'p_atr': 15, 'p_adx': 27, 'rsi_period': 77, 'ema1': 30, 'ema2': 18, 'slip_atr_k': 0.04141966650321016, 'slip_spread_k': 0.5779556405112012, 'spread_hl_frac': 0.02862843000530762, 'bb_std_mult': 3.5330273406480344, 'rsi_os': 25, 'rsi_ob': 75, 'vol_spike': 0.1693602450635611, 'adx_thresh': 27.087050754536065, 'atr_min_pct': 0.01361828604992378, 'atr_max_pct': 0.07615796454031451, 'tp_mult': 1.606199393643402, 'tsl_mult': 0.6181643770988976, 'strategy': 'breakout', 'time_stop': 235, 'use_sma': False, 'use_atr': False, 'use_adx': True, 'use_ema': True, 'use_spike': True, 'rsi_required': True, 'edge_k': 0.5630821718851682, 'edge_cap': 0.5719443038629993, 'bull_strategy': 'mean_reversion', 'bull_bb_std_mult': 2.6979553852343243, 'bull_rsi_os': 41, 'bull_rsi_ob': 91, 'bull_adx_thresh': 24.167517304259153, 'bull_atr_min_pct': 0.024783077576478352, 'bull_atr_max_pct': 0.07532694732265412, 'bull_tp_mult': 2.7144862273718244, 'bull_tsl_mult': 0.6261143143350959, 'bull_time_stop': 130, 'bull_use_sma': False, 'bull_use_ema': False, 'bull_use_atr': False, 'bull_use_adx': False, 'bull_use_spike': False, 'bull_rsi_required': False, 'bear_strategy': 'mean_reversion', 'bear_bb_std_mult': 0.6355366708077015, 'bear_rsi_os': 41, 'bear_rsi_ob': 73, 'bear_adx_thresh': 29.528603823112416, 'bear_atr_min_pct': 0.021399250621157245, 'bear_atr_max_pct': 0.040053275270133165, 'bear_tp_mult': 1.445775740420074, 'bear_tsl_mult': 0.3259670549978684, 'bear_time_stop': 73, 'bear_use_sma': True, 'bear_use_ema': True, 'bear_use_atr': True, 'bear_use_adx': False, 'bear_use_spike': False, 'bear_rsi_required': True, 'sideways_strategy': 'breakout', 'sideways_bb_std_mult': 1.3450613818204573, 'sideways_rsi_os': 41, 'sideways_rsi_ob': 59, 'sideways_adx_thresh': 27.436396740730338, 'sideways_atr_min_pct': 0.017651248064250502, 'sideways_atr_max_pct': 0.0959967044278387, 'sideways_tp_mult': 1.2557948139604036, 'sideways_tsl_mult': 0.3016820025558313, 'sideways_time_stop': 17, 'sideways_use_sma': True, 'sideways_use_ema': True, 'sideways_use_atr': True, 'sideways_use_adx': False, 'sideways_use_spike': False, 'sideways_rsi_required': False}.
[I 2025-08-30 15:12:32,040] Trial 392 finished with values: [-1000000000.0, 1000000000.0] and parameters: {'p_sma': 5, 'p_std': 55, 'p_atr': 16, 'p_adx': 25, 'rsi_period': 76, 'ema1': 30, 'ema2': 34, 'slip_atr_k': 0.058910061531444124, 'slip_spread_k': 0.9999025498754643, 'spread_hl_frac': 0.021569430469951086, 'bb_std_mult': 3.5141745494835637, 'rsi_os': 26, 'rsi_ob': 70, 'vol_spike': 0.1683141487868529, 'adx_thresh': 9.975936010595102, 'atr_min_pct': 0.0135957871375886, 'atr_max_pct': 0.07641600522501887, 'tp_mult': 1.6045600455429367, 'tsl_mult': 0.09767272789853694, 'strategy': 'breakout', 'time_stop': 212, 'use_sma': False, 'use_atr': False, 'use_adx': True, 'use_ema': True, 'use_spike': True, 'rsi_required': True, 'edge_k': 0.20056429025685552, 'edge_cap': 0.526609733765981, 'bull_strategy': 'mean_reversion', 'bull_bb_std_mult': 2.734088888204425, 'bull_rsi_os': 33, 'bull_rsi_ob': 91, 'bull_adx_thresh': 34.97606963607534, 'bull_atr_min_pct': 0.02032841910494675, 'bull_atr_max_pct': 0.07390646997098631, 'bull_tp_mult': 1.821336795701982, 'bull_tsl_mult': 0.9777257724266053, 'bull_time_stop': 135, 'bull_use_sma': False, 'bull_use_ema': False, 'bull_use_atr': False, 'bull_use_adx': False, 'bull_use_spike': False, 'bull_rsi_required': False, 'bear_strategy': 'mean_reversion', 'bear_bb_std_mult': 0.6373606292640699, 'bear_rsi_os': 5, 'bear_rsi_ob': 73, 'bear_adx_thresh': 25.89355408437629, 'bear_atr_min_pct': 0.0216809567778181, 'bear_atr_max_pct': 0.14296495449765095, 'bear_tp_mult': 1.4647916190616546, 'bear_tsl_mult': 0.08064125458763695, 'bear_time_stop': 252, 'bear_use_sma': True, 'bear_use_ema': True, 'bear_use_atr': True, 'bear_use_adx': False, 'bear_use_spike': False, 'bear_rsi_required': True, 'sideways_strategy': 'breakout', 'sideways_bb_std_mult': 1.9733437622670265, 'sideways_rsi_os': 9, 'sideways_rsi_ob': 59, 'sideways_adx_thresh': 27.27808664251051, 'sideways_atr_min_pct': 0.0006001704730420692, 'sideways_atr_max_pct': 0.04369855876579879, 'sideways_tp_mult': 2.4595644321964927, 'sideways_tsl_mult': 0.9988150105043719, 'sideways_time_stop': 23, 'sideways_use_sma': False, 'sideways_use_ema': True, 'sideways_use_atr': True, 'sideways_use_adx': False, 'sideways_use_spike': False, 'sideways_rsi_required': False}.
[I 2025-08-30 15:12:32,923] Trial 391 finished with values: [-1000000000.0, 1000000000.0] and parameters: {'p_sma': 5, 'p_std': 55, 'p_atr': 15, 'p_adx': 28, 'rsi_period': 77, 'ema1': 30, 'ema2': 18, 'slip_atr_k': 0.060955603643462725, 'slip_spread_k': 0.578994909505942, 'spread_hl_frac': 0.03372380981482917, 'bb_std_mult': 3.507834123661145, 'rsi_os': 26, 'rsi_ob': 73, 'vol_spike': 0.16975134759586108, 'adx_thresh': 9.12027667153506, 'atr_min_pct': 0.028505556541202764, 'atr_max_pct': 0.07736148280302285, 'tp_mult': 1.6344770394697654, 'tsl_mult': 0.5360540425008145, 'strategy': 'breakout', 'time_stop': 240, 'use_sma': False, 'use_atr': False, 'use_adx': False, 'use_ema': True, 'use_spike': True, 'rsi_required': True, 'edge_k': 0.9762243848066908, 'edge_cap': 0.5729713139029926, 'bull_strategy': 'mean_reversion', 'bull_bb_std_mult': 2.574688839071152, 'bull_rsi_os': 5, 'bull_rsi_ob': 67, 'bull_adx_thresh': 6.089779510210667, 'bull_atr_min_pct': 0.0176956348045997, 'bull_atr_max_pct': 0.06794238688744761, 'bull_tp_mult': 1.8608008622150976, 'bull_tsl_mult': 0.23007894293914188, 'bull_time_stop': 154, 'bull_use_sma': False, 'bull_use_ema': False, 'bull_use_atr': False, 'bull_use_adx': False, 'bull_use_spike': False, 'bull_rsi_required': False, 'bear_strategy': 'mean_reversion', 'bear_bb_std_mult': 0.6487581297245094, 'bear_rsi_os': 39, 'bear_rsi_ob': 77, 'bear_adx_thresh': 25.63500611493142, 'bear_atr_min_pct': 0.00787883868737036, 'bear_atr_max_pct': 0.0138386988842152, 'bear_tp_mult': 1.5351443325785339, 'bear_tsl_mult': 0.59267024174641, 'bear_time_stop': 249, 'bear_use_sma': True, 'bear_use_ema': True, 'bear_use_atr': True, 'bear_use_adx': False, 'bear_use_spike': False, 'bear_rsi_required': True, 'sideways_strategy': 'breakout', 'sideways_bb_std_mult': 2.170370014647467, 'sideways_rsi_os': 8, 'sideways_rsi_ob': 58, 'sideways_adx_thresh': 31.810986409934475, 'sideways_atr_min_pct': 0.0006650395729001519, 'sideways_atr_max_pct': 0.05339539512459254, 'sideways_tp_mult': 2.4068742365608875, 'sideways_tsl_mult': 0.8946726212692948, 'sideways_time_stop': 17, 'sideways_use_sma': True, 'sideways_use_ema': True, 'sideways_use_atr': True, 'sideways_use_adx': False, 'sideways_use_spike': False, 'sideways_rsi_required': False}.
[I 2025-08-30 15:12:34,011] Trial 390 finished with values: [-0.00977839160524796, 0.009700786361771447] and parameters: {'p_sma': 5, 'p_std': 58, 'p_atr': 15, 'p_adx': 25, 'rsi_period': 77, 'ema1': 30, 'ema2': 34, 'slip_atr_k': 0.06447770886328423, 'slip_spread_k': 0.11899667099219219, 'spread_hl_frac': 0.026280543694169996, 'bb_std_mult': 1.2193756683993477, 'rsi_os': 25, 'rsi_ob': 73, 'vol_spike': 0.16832422078774714, 'adx_thresh': 13.02060893398976, 'atr_min_pct': 0.013611211391068431, 'atr_max_pct': 0.07685027237370849, 'tp_mult': 1.7639427851584168, 'tsl_mult': 0.7366200181042588, 'strategy': 'breakout', 'time_stop': 129, 'use_sma': False, 'use_atr': True, 'use_adx': False, 'use_ema': True, 'use_spike': True, 'rsi_required': True, 'edge_k': 0.1746330938523778, 'edge_cap': 0.5663246959076265, 'bull_strategy': 'mean_reversion', 'bull_bb_std_mult': 2.6017543062032495, 'bull_rsi_os': 39, 'bull_rsi_ob': 50, 'bull_adx_thresh': 22.127090927568904, 'bull_atr_min_pct': 0.0209825607249375, 'bull_atr_max_pct': 0.06704540544877267, 'bull_tp_mult': 2.161801715770466, 'bull_tsl_mult': 0.2926225986711428, 'bull_time_stop': 158, 'bull_use_sma': False, 'bull_use_ema': False, 'bull_use_atr': False, 'bull_use_adx': False, 'bull_use_spike': True, 'bull_rsi_required': False, 'bear_strategy': 'mean_reversion', 'bear_bb_std_mult': 0.6826922926540063, 'bear_rsi_os': 29, 'bear_rsi_ob': 76, 'bear_adx_thresh': 28.638994692330474, 'bear_atr_min_pct': 0.021549080578558623, 'bear_atr_max_pct': 0.0713751252334691, 'bear_tp_mult': 1.5390653212215586, 'bear_tsl_mult': 0.96110374088453, 'bear_time_stop': 65, 'bear_use_sma': True, 'bear_use_ema': True, 'bear_use_atr': True, 'bear_use_adx': False, 'bear_use_spike': False, 'bear_rsi_required': True, 'sideways_strategy': 'breakout', 'sideways_bb_std_mult': 2.17485410157389, 'sideways_rsi_os': 42, 'sideways_rsi_ob': 58, 'sideways_adx_thresh': 27.40073581419241, 'sideways_atr_min_pct': 0.0006573664302110094, 'sideways_atr_max_pct': 0.10132940945061464, 'sideways_tp_mult': 2.4164471891809463, 'sideways_tsl_mult': 0.9973418152589316, 'sideways_time_stop': 82, 'sideways_use_sma': True, 'sideways_use_ema': True, 'sideways_use_atr': True, 'sideways_use_adx': False, 'sideways_use_spike': True, 'sideways_rsi_required': False}.
[I 2025-08-30 15:13:22,472] Trial 394 finished with values: [-1000000000.0, 1000000000.0] and parameters: {'p_sma': 6, 'p_std': 40, 'p_atr': 16, 'p_adx': 24, 'rsi_period': 81, 'ema1': 30, 'ema2': 21, 'slip_atr_k': 0.05963762858917116, 'slip_spread_k': 0.06300591147707746, 'spread_hl_frac': 0.03949142345757993, 'bb_std_mult': 2.5548876344054223, 'rsi_os': 23, 'rsi_ob': 74, 'vol_spike': 0.18290311671776754, 'adx_thresh': 9.607575486836035, 'atr_min_pct': 0.015291608073593416, 'atr_max_pct': 0.020085520367283394, 'tp_mult': 1.6145661552310435, 'tsl_mult': 0.5328147296716914, 'strategy': 'breakout', 'time_stop': 113, 'use_sma': False, 'use_atr': False, 'use_adx': False, 'use_ema': True, 'use_spike': True, 'rsi_required': True, 'edge_k': 1.0130237498283108, 'edge_cap': 0.974829529668388, 'bull_strategy': 'mean_reversion', 'bull_bb_std_mult': 0.9111785962570011, 'bull_rsi_os': 29, 'bull_rsi_ob': 64, 'bull_adx_thresh': 24.200277320074026, 'bull_atr_min_pct': 0.006604039031753408, 'bull_atr_max_pct': 0.06710972309802708, 'bull_tp_mult': 1.8081621010533075, 'bull_tsl_mult': 0.8083662734759098, 'bull_time_stop': 126, 'bull_use_sma': False, 'bull_use_ema': True, 'bull_use_atr': False, 'bull_use_adx': False, 'bull_use_spike': False, 'bull_rsi_required': False, 'bear_strategy': 'mean_reversion', 'bear_bb_std_mult': 0.7599973071160095, 'bear_rsi_os': 39, 'bear_rsi_ob': 77, 'bear_adx_thresh': 12.750291656192262, 'bear_atr_min_pct': 0.017221651323911194, 'bear_atr_max_pct': 0.13374638944523393, 'bear_tp_mult': 1.4993519899576206, 'bear_tsl_mult': 0.0584057272973465, 'bear_time_stop': 84, 'bear_use_sma': True, 'bear_use_ema': True, 'bear_use_atr': True, 'bear_use_adx': True, 'bear_use_spike': False, 'bear_rsi_required': True, 'sideways_strategy': 'mean_reversion', 'sideways_bb_std_mult': 2.1733854644502, 'sideways_rsi_os': 46, 'sideways_rsi_ob': 60, 'sideways_adx_thresh': 26.804653199342496, 'sideways_atr_min_pct': 0.0006396974828247429, 'sideways_atr_max_pct': 0.05399222592896542, 'sideways_tp_mult': 2.3515550687226376, 'sideways_tsl_mult': 0.569223856806971, 'sideways_time_stop': 17, 'sideways_use_sma': False, 'sideways_use_ema': True, 'sideways_use_atr': True, 'sideways_use_adx': False, 'sideways_use_spike': True, 'sideways_rsi_required': False}.
[I 2025-08-30 15:13:23,349] Trial 396 finished with values: [-1000000000.0, 1000000000.0] and parameters: {'p_sma': 41, 'p_std': 41, 'p_atr': 16, 'p_adx': 24, 'rsi_period': 81, 'ema1': 8, 'ema2': 36, 'slip_atr_k': 0.052936150609108536, 'slip_spread_k': 0.7992444726042975, 'spread_hl_frac': 0.039655946541225826, 'bb_std_mult': 3.588661709713049, 'rsi_os': 23, 'rsi_ob': 74, 'vol_spike': 0.20444314742448108, 'adx_thresh': 28.783725862080445, 'atr_min_pct': 0.015071139167918208, 'atr_max_pct': 0.07255946709490235, 'tp_mult': 1.8149692699150273, 'tsl_mult': 0.7043502971339639, 'strategy': 'breakout', 'time_stop': 295, 'use_sma': False, 'use_atr': False, 'use_adx': False, 'use_ema': True, 'use_spike': True, 'rsi_required': True, 'edge_k': 1.0778275427280204, 'edge_cap': 0.5928990416054883, 'bull_strategy': 'mean_reversion', 'bull_bb_std_mult': 1.556687643362855, 'bull_rsi_os': 34, 'bull_rsi_ob': 71, 'bull_adx_thresh': 24.23694569790855, 'bull_atr_min_pct': 0.021428930339197502, 'bull_atr_max_pct': 0.06611773294450538, 'bull_tp_mult': 2.215475616792363, 'bull_tsl_mult': 0.5815480295301382, 'bull_time_stop': 127, 'bull_use_sma': False, 'bull_use_ema': True, 'bull_use_atr': False, 'bull_use_adx': False, 'bull_use_spike': False, 'bull_rsi_required': False, 'bear_strategy': 'mean_reversion', 'bear_bb_std_mult': 0.7681178547380195, 'bear_rsi_os': 7, 'bear_rsi_ob': 78, 'bear_adx_thresh': 28.73440890106525, 'bear_atr_min_pct': 0.02434882438537144, 'bear_atr_max_pct': 0.07082525595421937, 'bear_tp_mult': 1.4177841757635898, 'bear_tsl_mult': 0.06136114139539009, 'bear_time_stop': 81, 'bear_use_sma': True, 'bear_use_ema': True, 'bear_use_atr': True, 'bear_use_adx': True, 'bear_use_spike': False, 'bear_rsi_required': True, 'sideways_strategy': 'mean_reversion', 'sideways_bb_std_mult': 1.8427677252652879, 'sideways_rsi_os': 41, 'sideways_rsi_ob': 60, 'sideways_adx_thresh': 26.407623991742696, 'sideways_atr_min_pct': 0.013761088737784987, 'sideways_atr_max_pct': 0.12419182653661043, 'sideways_tp_mult': 2.379520540203985, 'sideways_tsl_mult': 0.25117168261048467, 'sideways_time_stop': 35, 'sideways_use_sma': False, 'sideways_use_ema': True, 'sideways_use_atr': True, 'sideways_use_adx': False, 'sideways_use_spike': True, 'sideways_rsi_required': False}.
