[I 2025-08-30 15:58:34,542] Trial 613 finished with values: [-0.027062861475658395, 0.02706533667934639] and parameters: {'p_sma': 19, 'p_std': 7, 'p_atr': 16, 'p_adx': 18, 'rsi_period': 80, 'ema1': 29, 'ema2': 58, 'slip_atr_k': 0.051799252876681745, 'slip_spread_k': 0.10379442929008348, 'spread_hl_frac': 0.023779845865346462, 'bb_std_mult': 1.1104388120013844, 'rsi_os': 28, 'rsi_ob': 73, 'vol_spike': 0.1744255923837672, 'adx_thresh': 33.73324908465117, 'atr_min_pct': 0.014055271571449701, 'atr_max_pct': 0.023799555373131713, 'tp_mult': 1.6549658858055054, 'tsl_mult': 0.25445048941316406, 'strategy': 'breakout', 'time_stop': 139, 'use_sma': False, 'use_atr': True, 'use_adx': True, 'use_ema': True, 'use_spike': True, 'rsi_required': True, 'edge_k': 0.237149118131665, 'edge_cap': 0.3544030106345486, 'bull_strategy': 'mean_reversion', 'bull_bb_std_mult': 2.5957412199547196, 'bull_rsi_os': 40, 'bull_rsi_ob': 45, 'bull_adx_thresh': 25.22013823964217, 'bull_atr_min_pct': 0.01972194318034775, 'bull_atr_max_pct': 0.0791999151220833, 'bull_tp_mult': 2.3005926413500983, 'bull_tsl_mult': 0.35175778747339015, 'bull_time_stop': 174, 'bull_use_sma': False, 'bull_use_ema': False, 'bull_use_atr': False, 'bull_use_adx': False, 'bull_use_spike': True, 'bull_rsi_required': True, 'bear_strategy': 'mean_reversion', 'bear_bb_std_mult': 0.8145689639543074, 'bear_rsi_os': 27, 'bear_rsi_ob': 77, 'bear_adx_thresh': 25.178795395117884, 'bear_atr_min_pct': 0.006371237724760592, 'bear_atr_max_pct': 0.1379432289706662, 'bear_tp_mult': 1.5818578478625716, 'bear_tsl_mult': 0.7931194733571031, 'bear_time_stop': 62, 'bear_use_sma': False, 'bear_use_ema': True, 'bear_use_atr': True, 'bear_use_adx': False, 'bear_use_spike': False, 'bear_rsi_required': True, 'sideways_strategy': 'breakout', 'sideways_bb_std_mult': 2.4148725753788316, 'sideways_rsi_os': 44, 'sideways_rsi_ob': 71, 'sideways_adx_thresh': 26.354595891870176, 'sideways_atr_min_pct': 0.0026072740269909096, 'sideways_atr_max_pct': 0.09718395594444092, 'sideways_tp_mult': 2.3846634246147684, 'sideways_tsl_mult': 0.977859217045796, 'sideways_time_stop': 76, 'sideways_use_sma': True, 'sideways_use_ema': True, 'sideways_use_atr': True, 'sideways_use_adx': False, 'sideways_use_spike': False, 'sideways_rsi_required': False}.
[I 2025-08-30 15:58:35,153] Trial 610 finished with values: [-0.03457707360060791, 0.03447713702913131] and parameters: {'p_sma': 8, 'p_std': 17, 'p_atr': 16, 'p_adx': 10, 'rsi_period': 74, 'ema1': 8, 'ema2': 33, 'slip_atr_k': 0.10499346866175327, 'slip_spread_k': 0.8982576553108533, 'spread_hl_frac': 0.032886831094207106, 'bb_std_mult': 1.0092800958944652, 'rsi_os': 24, 'rsi_ob': 56, 'vol_spike': 0.029791030587576775, 'adx_thresh': 12.149273532270804, 'atr_min_pct': 0.012969090873330317, 'atr_max_pct': 0.11523549249219685, 'tp_mult': 1.769777274544651, 'tsl_mult': 0.4055008430259501, 'strategy': 'breakout', 'time_stop': 120, 'use_sma': False, 'use_atr': True, 'use_adx': False, 'use_ema': True, 'use_spike': True, 'rsi_required': True, 'edge_k': 0.12620446240142874, 'edge_cap': 0.35935963986532793, 'bull_strategy': 'mean_reversion', 'bull_bb_std_mult': 2.7210987252488232, 'bull_rsi_os': 37, 'bull_rsi_ob': 57, 'bull_adx_thresh': 32.76397516303652, 'bull_atr_min_pct': 0.0009554451835514302, 'bull_atr_max_pct': 0.1118658448641886, 'bull_tp_mult': 2.3052277618496424, 'bull_tsl_mult': 0.8890243079279165, 'bull_time_stop': 162, 'bull_use_sma': False, 'bull_use_ema': False, 'bull_use_atr': False, 'bull_use_adx': False, 'bull_use_spike': True, 'bull_rsi_required': False, 'bear_strategy': 'mean_reversion', 'bear_bb_std_mult': 0.7802145298419969, 'bear_rsi_os': 46, 'bear_rsi_ob': 80, 'bear_adx_thresh': 25.288581429202516, 'bear_atr_min_pct': 0.02214431427023869, 'bear_atr_max_pct': 0.052737783960700724, 'bear_tp_mult': 1.1337948555335773, 'bear_tsl_mult': 0.7936420486249911, 'bear_time_stop': 66, 'bear_use_sma': True, 'bear_use_ema': True, 'bear_use_atr': True, 'bear_use_adx': False, 'bear_use_spike': False, 'bear_rsi_required': True, 'sideways_strategy': 'breakout', 'sideways_bb_std_mult': 2.39337830069445, 'sideways_rsi_os': 39, 'sideways_rsi_ob': 57, 'sideways_adx_thresh': 13.947358083231508, 'sideways_atr_min_pct': 0.001432302493026102, 'sideways_atr_max_pct': 0.10348529146998656, 'sideways_tp_mult': 2.5408804308770003, 'sideways_tsl_mult': 0.7552514729954517, 'sideways_time_stop': 263, 'sideways_use_sma': True, 'sideways_use_ema': True, 'sideways_use_atr': True, 'sideways_use_adx': False, 'sideways_use_spike': True, 'sideways_rsi_required': False}.
[I 2025-08-30 15:59:23,194] Trial 617 finished with values: [-1000000000.0, 1000000000.0] and parameters: {'p_sma': 6, 'p_std': 58, 'p_atr': 15, 'p_adx': 24, 'rsi_period': 63, 'ema1': 11, 'ema2': 36, 'slip_atr_k': 0.18047713600503967, 'slip_spread_k': 0.8204251300139416, 'spread_hl_frac': 0.026037797121310564, 'bb_std_mult': 1.2011487519480422, 'rsi_os': 21, 'rsi_ob': 63, 'vol_spike': 0.16016966005719072, 'adx_thresh': 24.541485870244877, 'atr_min_pct': 0.004957807598678841, 'atr_max_pct': 0.07703729871431328, 'tp_mult': 1.8510693549603794, 'tsl_mult': 0.4272555746920885, 'strategy': 'mean_reversion', 'time_stop': 96, 'use_sma': False, 'use_atr': True, 'use_adx': False, 'use_ema': False, 'use_spike': False, 'rsi_required': False, 'edge_k': 0.24193970089036232, 'edge_cap': 0.5289787329651402, 'bull_strategy': 'breakout', 'bull_bb_std_mult': 2.4523963445916657, 'bull_rsi_os': 42, 'bull_rsi_ob': 51, 'bull_adx_thresh': 16.274002768925744, 'bull_atr_min_pct': 0.021375089946044146, 'bull_atr_max_pct': 0.10071279604697603, 'bull_tp_mult': 2.4530229881960346, 'bull_tsl_mult': 0.8229627771100472, 'bull_time_stop': 164, 'bull_use_sma': False, 'bull_use_ema': False, 'bull_use_atr': False, 'bull_use_adx': False, 'bull_use_spike': True, 'bull_rsi_required': False, 'bear_strategy': 'breakout', 'bear_bb_std_mult': 0.5960694302610515, 'bear_rsi_os': 24, 'bear_rsi_ob': 75, 'bear_adx_thresh': 5.962820453478411, 'bear_atr_min_pct': 0.023831326580461835, 'bear_atr_max_pct': 0.07077712459219038, 'bear_tp_mult': 1.5710096112838892, 'bear_tsl_mult': 0.9827117610317659, 'bear_time_stop': 174, 'bear_use_sma': True, 'bear_use_ema': False, 'bear_use_atr': False, 'bear_use_adx': True, 'bear_use_spike': True, 'bear_rsi_required': False, 'sideways_strategy': 'mean_reversion', 'sideways_bb_std_mult': 1.876093422854897, 'sideways_rsi_os': 43, 'sideways_rsi_ob': 58, 'sideways_adx_thresh': 20.735690172883423, 'sideways_atr_min_pct': 0.028687924227188286, 'sideways_atr_max_pct': 0.09211132340670584, 'sideways_tp_mult': 2.485526447639893, 'sideways_tsl_mult': 0.19689140085228374, 'sideways_time_stop': 77, 'sideways_use_sma': True, 'sideways_use_ema': True, 'sideways_use_atr': False, 'sideways_use_adx': True, 'sideways_use_spike': True, 'sideways_rsi_required': True}.
[I 2025-08-30 15:59:24,051] Trial 614 finished with values: [-1000000000.0, 1000000000.0] and parameters: {'p_sma': 6, 'p_std': 57, 'p_atr': 16, 'p_adx': 28, 'rsi_period': 37, 'ema1': 29, 'ema2': 35, 'slip_atr_k': 0.24044572645754805, 'slip_spread_k': 0.8922841025018402, 'spread_hl_frac': 0.03707752071601688, 'bb_std_mult': 1.0298300355214514, 'rsi_os': 21, 'rsi_ob': 72, 'vol_spike': 0.17678588872818007, 'adx_thresh': 24.70503936506655, 'atr_min_pct': 0.008518140839664744, 'atr_max_pct': 0.07759077180027224, 'tp_mult': 1.0564672888512043, 'tsl_mult': 0.5521571016802331, 'strategy': 'breakout', 'time_stop': 138, 'use_sma': False, 'use_atr': True, 'use_adx': True, 'use_ema': True, 'use_spike': True, 'rsi_required': True, 'edge_k': 0.24046313359826157, 'edge_cap': 0.5277483617766922, 'bull_strategy': 'mean_reversion', 'bull_bb_std_mult': 2.151233205499735, 'bull_rsi_os': 42, 'bull_rsi_ob': 53, 'bull_adx_thresh': 21.6243003188677, 'bull_atr_min_pct': 0.021226145132437098, 'bull_atr_max_pct': 0.05446028604048542, 'bull_tp_mult': 2.424225028717465, 'bull_tsl_mult': 0.3504305254425302, 'bull_time_stop': 174, 'bull_use_sma': False, 'bull_use_ema': False, 'bull_use_atr': False, 'bull_use_adx': False, 'bull_use_spike': True, 'bull_rsi_required': False, 'bear_strategy': 'breakout', 'bear_bb_std_mult': 0.6033880266335695, 'bear_rsi_os': 27, 'bear_rsi_ob': 45, 'bear_adx_thresh': 30.00649439204392, 'bear_atr_min_pct': 0.02177041586699653, 'bear_atr_max_pct': 0.07109932162342962, 'bear_tp_mult': 2.8797387583908254, 'bear_tsl_mult': 0.9822278873996234, 'bear_time_stop': 255, 'bear_use_sma': True, 'bear_use_ema': True, 'bear_use_atr': True, 'bear_use_adx': False, 'bear_use_spike': False, 'bear_rsi_required': True, 'sideways_strategy': 'breakout', 'sideways_bb_std_mult': 2.40339523745442, 'sideways_rsi_os': 44, 'sideways_rsi_ob': 74, 'sideways_adx_thresh': 28.137522641691472, 'sideways_atr_min_pct': 0.02989894916984481, 'sideways_atr_max_pct': 0.06513012265705032, 'sideways_tp_mult': 2.5326692277366156, 'sideways_tsl_mult': 0.9692603179324499, 'sideways_time_stop': 247, 'sideways_use_sma': True, 'sideways_use_ema': True, 'sideways_use_atr': True, 'sideways_use_adx': False, 'sideways_use_spike': False, 'sideways_rsi_required': False}.
[I 2025-08-30 15:59:24,799] Trial 615 finished with values: [-1000000000.0, 1000000000.0] and parameters: {'p_sma': 42, 'p_std': 58, 'p_atr': 16, 'p_adx': 24, 'rsi_period': 74, 'ema1': 8, 'ema2': 36, 'slip_atr_k': 0.05874028953255359, 'slip_spread_k': 0.8116675828330598, 'spread_hl_frac': 0.024109535817816254, 'bb_std_mult': 2.9618182407501106, 'rsi_os': 22, 'rsi_ob': 67, 'vol_spike': 0.176517818965581, 'adx_thresh': 24.540926945225614, 'atr_min_pct': 0.014100103773260545, 'atr_max_pct': 0.0767532237889005, 'tp_mult': 1.6516016665449025, 'tsl_mult': 0.7715594435382407, 'strategy': 'breakout', 'time_stop': 138, 'use_sma': False, 'use_atr': True, 'use_adx': False, 'use_ema': True, 'use_spike': False, 'rsi_required': False, 'edge_k': 0.2395330527039189, 'edge_cap': 0.8298464380967547, 'bull_strategy': 'mean_reversion', 'bull_bb_std_mult': 2.661340492266094, 'bull_rsi_os': 42, 'bull_rsi_ob': 51, 'bull_adx_thresh': 34.91811272694938, 'bull_atr_min_pct': 0.02008395002801818, 'bull_atr_max_pct': 0.07866377429361855, 'bull_tp_mult': 2.237121969000983, 'bull_tsl_mult': 0.8222612810524776, 'bull_time_stop': 163, 'bull_use_sma': False, 'bull_use_ema': False, 'bull_use_atr': False, 'bull_use_adx': False, 'bull_use_spike': True, 'bull_rsi_required': False, 'bear_strategy': 'breakout', 'bear_bb_std_mult': 0.5845034620026455, 'bear_rsi_os': 29, 'bear_rsi_ob': 75, 'bear_adx_thresh': 29.602878839990378, 'bear_atr_min_pct': 0.020973624127752808, 'bear_atr_max_pct': 0.07113416035142421, 'bear_tp_mult': 1.5919004945188904, 'bear_tsl_mult': 0.9816756713007734, 'bear_time_stop': 80, 'bear_use_sma': True, 'bear_use_ema': True, 'bear_use_atr': True, 'bear_use_adx': False, 'bear_use_spike': True, 'bear_rsi_required': True, 'sideways_strategy': 'breakout', 'sideways_bb_std_mult': 1.9022927765829891, 'sideways_rsi_os': 44, 'sideways_rsi_ob': 58, 'sideways_adx_thresh': 13.698155715419194, 'sideways_atr_min_pct': 0.01706365827198024, 'sideways_atr_max_pct': 0.09833584913765801, 'sideways_tp_mult': 2.3921881465050627, 'sideways_tsl_mult': 0.967345662849378, 'sideways_time_stop': 78, 'sideways_use_sma': True, 'sideways_use_ema': True, 'sideways_use_atr': True, 'sideways_use_adx': False, 'sideways_use_spike': True, 'sideways_rsi_required': True}.
[I 2025-08-30 15:59:25,153] Trial 616 finished with values: [-1000000000.0, 1000000000.0] and parameters: {'p_sma': 48, 'p_std': 58, 'p_atr': 16, 'p_adx': 27, 'rsi_period': 77, 'ema1': 25, 'ema2': 36, 'slip_atr_k': 0.2224534011041325, 'slip_spread_k': 0.14852337241512173, 'spread_hl_frac': 0.036847974840133156, 'bb_std_mult': 1.2174511743948946, 'rsi_os': 21, 'rsi_ob': 67, 'vol_spike': 0.17621111123137517, 'adx_thresh': 11.859958835696643, 'atr_min_pct': 0.0002794002976197075, 'atr_max_pct': 0.07828798128797008, 'tp_mult': 1.7056184051841976, 'tsl_mult': 0.8225225737565132, 'strategy': 'breakout', 'time_stop': 66, 'use_sma': False, 'use_atr': True, 'use_adx': False, 'use_ema': False, 'use_spike': False, 'rsi_required': False, 'edge_k': 0.11693038783867069, 'edge_cap': 0.512468200740188, 'bull_strategy': 'mean_reversion', 'bull_bb_std_mult': 2.1711087541347, 'bull_rsi_os': 42, 'bull_rsi_ob': 59, 'bull_adx_thresh': 21.946451261436867, 'bull_atr_min_pct': 0.021217001915731365, 'bull_atr_max_pct': 0.10032762794600092, 'bull_tp_mult': 2.903290182355227, 'bull_tsl_mult': 0.2722163188316856, 'bull_time_stop': 165, 'bull_use_sma': False, 'bull_use_ema': False, 'bull_use_atr': False, 'bull_use_adx': False, 'bull_use_spike': True, 'bull_rsi_required': False, 'bear_strategy': 'breakout', 'bear_bb_std_mult': 0.6082674069090366, 'bear_rsi_os': 25, 'bear_rsi_ob': 70, 'bear_adx_thresh': 6.160630126132935, 'bear_atr_min_pct': 0.021922127692412197, 'bear_atr_max_pct': 0.03815082812543684, 'bear_tp_mult': 1.5543969549997185, 'bear_tsl_mult': 0.981776263372578, 'bear_time_stop': 80, 'bear_use_sma': True, 'bear_use_ema': True, 'bear_use_atr': False, 'bear_use_adx': False, 'bear_use_spike': True, 'bear_rsi_required': False, 'sideways_strategy': 'mean_reversion', 'sideways_bb_std_mult': 1.8969420532222083, 'sideways_rsi_os': 43, 'sideways_rsi_ob': 58, 'sideways_adx_thresh': 10.220007450606982, 'sideways_atr_min_pct': 0.001254707209655564, 'sideways_atr_max_pct': 0.10138214058379968, 'sideways_tp_mult': 2.495150031938972, 'sideways_tsl_mult': 0.9650259303193587, 'sideways_time_stop': 199, 'sideways_use_sma': True, 'sideways_use_ema': True, 'sideways_use_atr': True, 'sideways_use_adx': False, 'sideways_use_spike': True, 'sideways_rsi_required': True}.
[I 2025-08-30 16:00:17,933] Trial 620 finished with values: [-1000000000.0, 1000000000.0] and parameters: {'p_sma': 45, 'p_std': 21, 'p_atr': 25, 'p_adx': 25, 'rsi_period': 7, 'ema1': 17, 'ema2': 32, 'slip_atr_k': 0.06652743984822293, 'slip_spread_k': 0.3864404391122175, 'spread_hl_frac': 0.030815343615283923, 'bb_std_mult': 1.2562610296726127, 'rsi_os': 46, 'rsi_ob': 72, 'vol_spike': 0.169854729098702, 'adx_thresh': 11.301533168070387, 'atr_min_pct': 0.02734867874964337, 'atr_max_pct': 0.06828799514858436, 'tp_mult': 1.705117353677657, 'tsl_mult': 0.8182470681062396, 'strategy': 'breakout', 'time_stop': 128, 'use_sma': False, 'use_atr': True, 'use_adx': False, 'use_ema': False, 'use_spike': True, 'rsi_required': True, 'edge_k': 0.47585678417665955, 'edge_cap': 0.06979675081636927, 'bull_strategy': 'mean_reversion', 'bull_bb_std_mult': 2.324671013541832, 'bull_rsi_os': 41, 'bull_rsi_ob': 59, 'bull_adx_thresh': 20.794205024328665, 'bull_atr_min_pct': 0.02081511228570348, 'bull_atr_max_pct': 0.08549676078433256, 'bull_tp_mult': 2.154062325693274, 'bull_tsl_mult': 0.2750646831013929, 'bull_time_stop': 153, 'bull_use_sma': True, 'bull_use_ema': True, 'bull_use_atr': True, 'bull_use_adx': True, 'bull_use_spike': True, 'bull_rsi_required': False, 'bear_strategy': 'mean_reversion', 'bear_bb_std_mult': 0.7180533388055299, 'bear_rsi_os': 25, 'bear_rsi_ob': 62, 'bear_adx_thresh': 33.208481901058065, 'bear_atr_min_pct': 0.023084707406164327, 'bear_atr_max_pct': 0.037869878025939684, 'bear_tp_mult': 2.7681247471067536, 'bear_tsl_mult': 0.9543950391776058, 'bear_time_stop': 194, 'bear_use_sma': True, 'bear_use_ema': True, 'bear_use_atr': False, 'bear_use_adx': False, 'bear_use_spike': False, 'bear_rsi_required': False, 'sideways_strategy': 'mean_reversion', 'sideways_bb_std_mult': 1.6215295075026392, 'sideways_rsi_os': 41, 'sideways_rsi_ob': 62, 'sideways_adx_thresh': 22.662147856389982, 'sideways_atr_min_pct': 0.012972483841879753, 'sideways_atr_max_pct': 0.1060806243910279, 'sideways_tp_mult': 2.340686501597413, 'sideways_tsl_mult': 0.3470471323218711, 'sideways_time_stop': 206, 'sideways_use_sma': True, 'sideways_use_ema': False, 'sideways_use_atr': True, 'sideways_use_adx': False, 'sideways_use_spike': True, 'sideways_rsi_required': False}.
[I 2025-08-30 16:00:17,987] Trial 618 finished with values: [-1000000000.0, 1000000000.0] and parameters: {'p_sma': 21, 'p_std': 58, 'p_atr': 16, 'p_adx': 26, 'rsi_period': 77, 'ema1': 25, 'ema2': 35, 'slip_atr_k': 0.22174604836181927, 'slip_spread_k': 0.6855307111596757, 'spread_hl_frac': 0.028468092672783673, 'bb_std_mult': 1.3009619666182801, 'rsi_os': 13, 'rsi_ob': 67, 'vol_spike': 0.1756027280015487, 'adx_thresh': 10.364135250598812, 'atr_min_pct': 0.02709299679704848, 'atr_max_pct': 0.1452644992670129, 'tp_mult': 1.7135271956361602, 'tsl_mult': 0.7704165461749064, 'strategy': 'breakout', 'time_stop': 209, 'use_sma': False, 'use_atr': True, 'use_adx': False, 'use_ema': True, 'use_spike': True, 'rsi_required': False, 'edge_k': 0.11371463721528274, 'edge_cap': 0.5166419045051185, 'bull_strategy': 'mean_reversion', 'bull_bb_std_mult': 2.6680405544684596, 'bull_rsi_os': 41, 'bull_rsi_ob': 49, 'bull_adx_thresh': 21.698606664365936, 'bull_atr_min_pct': 0.02100936624266066, 'bull_atr_max_pct': 0.06653480114921845, 'bull_tp_mult': 2.7964069198050043, 'bull_tsl_mult': 0.2763399352308047, 'bull_time_stop': 157, 'bull_use_sma': False, 'bull_use_ema': True, 'bull_use_atr': True, 'bull_use_adx': True, 'bull_use_spike': True, 'bull_rsi_required': False, 'bear_strategy': 'breakout', 'bear_bb_std_mult': 0.6174214485197402, 'bear_rsi_os': 29, 'bear_rsi_ob': 56, 'bear_adx_thresh': 28.239803432348666, 'bear_atr_min_pct': 0.021037688085714473, 'bear_atr_max_pct': 0.07321608706751115, 'bear_tp_mult': 2.593000593898778, 'bear_tsl_mult': 0.9676590068553693, 'bear_time_stop': 81, 'bear_use_sma': True, 'bear_use_ema': True, 'bear_use_atr': True, 'bear_use_adx': False, 'bear_use_spike': True, 'bear_rsi_required': True, 'sideways_strategy': 'breakout', 'sideways_bb_std_mult': 1.6317280223151651, 'sideways_rsi_os': 41, 'sideways_rsi_ob': 83, 'sideways_adx_thresh': 25.328963967043794, 'sideways_atr_min_pct': 0.011966434421764325, 'sideways_atr_max_pct': 0.1069733504121379, 'sideways_tp_mult': 2.3536590090337715, 'sideways_tsl_mult': 0.34934400297212675, 'sideways_time_stop': 205, 'sideways_use_sma': True, 'sideways_use_ema': False, 'sideways_use_atr': True, 'sideways_use_adx': False, 'sideways_use_spike': True, 'sideways_rsi_required': True}.
[I 2025-08-30 16:00:18,918] Trial 619 finished with values: [-0.036917657041668606, 0.03686005792875787] and parameters: {'p_sma': 5, 'p_std': 11, 'p_atr': 27, 'p_adx': 26, 'rsi_period': 77, 'ema1': 25, 'ema2': 23, 'slip_atr_k': 0.22654439687962208, 'slip_spread_k': 0.125677532660917, 'spread_hl_frac': 0.03047875212235512, 'bb_std_mult': 1.2514149654177502, 'rsi_os': 46, 'rsi_ob': 65, 'vol_spike': 0.1865178883013281, 'adx_thresh': 12.052063051420525, 'atr_min_pct': 0.00952423916108493, 'atr_max_pct': 0.06975464658147447, 'tp_mult': 1.6993158441860816, 'tsl_mult': 0.6370751994977051, 'strategy': 'breakout', 'time_stop': 240, 'use_sma': False, 'use_atr': True, 'use_adx': False, 'use_ema': False, 'use_spike': False, 'rsi_required': False, 'edge_k': 0.48129349780459885, 'edge_cap': 0.9827660365670907, 'bull_strategy': 'mean_reversion', 'bull_bb_std_mult': 2.671129378948019, 'bull_rsi_os': 39, 'bull_rsi_ob': 59, 'bull_adx_thresh': 20.58591927985254, 'bull_atr_min_pct': 0.0201193465601239, 'bull_atr_max_pct': 0.0636134989301706, 'bull_tp_mult': 2.2151132652749506, 'bull_tsl_mult': 0.9427619806494806, 'bull_time_stop': 155, 'bull_use_sma': True, 'bull_use_ema': True, 'bull_use_atr': True, 'bull_use_adx': True, 'bull_use_spike': True, 'bull_rsi_required': False, 'bear_strategy': 'mean_reversion', 'bear_bb_std_mult': 0.7221504299902861, 'bear_rsi_os': 51, 'bear_rsi_ob': 69, 'bear_adx_thresh': 28.15875647951717, 'bear_atr_min_pct': 0.018911369295369424, 'bear_atr_max_pct': 0.03748648195285872, 'bear_tp_mult': 2.611176856657851, 'bear_tsl_mult': 0.9584041709353764, 'bear_time_stop': 118, 'bear_use_sma': True, 'bear_use_ema': True, 'bear_use_atr': False, 'bear_use_adx': False, 'bear_use_spike': True, 'bear_rsi_required': False, 'sideways_strategy': 'breakout', 'sideways_bb_std_mult': 1.9436878459137612, 'sideways_rsi_os': 42, 'sideways_rsi_ob': 59, 'sideways_adx_thresh': 9.13356220978206, 'sideways_atr_min_pct': 0.0009550264643876416, 'sideways_atr_max_pct': 0.015019636671918649, 'sideways_tp_mult': 1.466014190405033, 'sideways_tsl_mult': 0.9798759169791771, 'sideways_time_stop': 84, 'sideways_use_sma': True, 'sideways_use_ema': False, 'sideways_use_atr': True, 'sideways_use_adx': False, 'sideways_use_spike': True, 'sideways_rsi_required': True}.
