[I 2025-08-30 16:10:57,035] Trial 676 finished with values: [-1000000000.0, 1000000000.0] and parameters: {'p_sma': 9, 'p_std': 55, 'p_atr': 24, 'p_adx': 10, 'rsi_period': 79, 'ema1': 25, 'ema2': 32, 'slip_atr_k': 0.071360101496345, 'slip_spread_k': 0.3417449081716337, 'spread_hl_frac': 0.024430262153466484, 'bb_std_mult': 2.289701553073664, 'rsi_os': 38, 'rsi_ob': 72, 'vol_spike': 0.053454003457392485, 'adx_thresh': 15.648543450122167, 'atr_min_pct': 0.016458249900408006, 'atr_max_pct': 0.07644022990498128, 'tp_mult': 2.054674655249912, 'tsl_mult': 0.4567367906374155, 'strategy': 'mean_reversion', 'time_stop': 225, 'use_sma': True, 'use_atr': True, 'use_adx': True, 'use_ema': False, 'use_spike': True, 'rsi_required': False, 'edge_k': 0.4556119323947336, 'edge_cap': 0.590649853304385, 'bull_strategy': 'breakout', 'bull_bb_std_mult': 0.82535278758953, 'bull_rsi_os': 43, 'bull_rsi_ob': 60, 'bull_adx_thresh': 23.559345468171777, 'bull_atr_min_pct': 0.017086011046647552, 'bull_atr_max_pct': 0.0940620063682582, 'bull_tp_mult': 1.9515245366014178, 'bull_tsl_mult': 0.1205992442774531, 'bull_time_stop': 41, 'bull_use_sma': True, 'bull_use_ema': True, 'bull_use_atr': True, 'bull_use_adx': True, 'bull_use_spike': True, 'bull_rsi_required': True, 'bear_strategy': 'mean_reversion', 'bear_bb_std_mult': 2.642648968046651, 'bear_rsi_os': 36, 'bear_rsi_ob': 87, 'bear_adx_thresh': 29.739500443948053, 'bear_atr_min_pct': 0.019661156176216332, 'bear_atr_max_pct': 0.07977478536974841, 'bear_tp_mult': 2.756724585985176, 'bear_tsl_mult': 0.367667957774039, 'bear_time_stop': 246, 'bear_use_sma': False, 'bear_use_ema': False, 'bear_use_atr': False, 'bear_use_adx': True, 'bear_use_spike': True, 'bear_rsi_required': True, 'sideways_strategy': 'breakout', 'sideways_bb_std_mult': 0.6667703897500192, 'sideways_rsi_os': 40, 'sideways_rsi_ob': 61, 'sideways_adx_thresh': 24.858863354447816, 'sideways_atr_min_pct': 0.02228882621370383, 'sideways_atr_max_pct': 0.06330929166248742, 'sideways_tp_mult': 2.8650182415298353, 'sideways_tsl_mult': 0.919099060656117, 'sideways_time_stop': 164, 'sideways_use_sma': True, 'sideways_use_ema': True, 'sideways_use_atr': False, 'sideways_use_adx': True, 'sideways_use_spike': True, 'sideways_rsi_required': True}.
[I 2025-08-30 16:10:57,037] Trial 673 finished with values: [-1000000000.0, 1000000000.0] and parameters: {'p_sma': 9, 'p_std': 53, 'p_atr': 26, 'p_adx': 10, 'rsi_period': 59, 'ema1': 22, 'ema2': 31, 'slip_atr_k': 0.07150715121312098, 'slip_spread_k': 0.1552219335362728, 'spread_hl_frac': 0.02213249516723056, 'bb_std_mult': 2.388234544352186, 'rsi_os': 39, 'rsi_ob': 72, 'vol_spike': 0.160934201304632, 'adx_thresh': 16.0652293391086, 'atr_min_pct': 0.015002318634084199, 'atr_max_pct': 0.1492871818637569, 'tp_mult': 1.6151696342000952, 'tsl_mult': 0.338306211152987, 'strategy': 'mean_reversion', 'time_stop': 232, 'use_sma': True, 'use_atr': True, 'use_adx': True, 'use_ema': False, 'use_spike': True, 'rsi_required': False, 'edge_k': 0.4730638422971101, 'edge_cap': 0.6312172158072379, 'bull_strategy': 'breakout', 'bull_bb_std_mult': 0.7629712883132177, 'bull_rsi_os': 42, 'bull_rsi_ob': 64, 'bull_adx_thresh': 24.179145382524055, 'bull_atr_min_pct': 0.015510588501248266, 'bull_atr_max_pct': 0.08814403996855144, 'bull_tp_mult': 1.9616491532392655, 'bull_tsl_mult': 0.1179794902892334, 'bull_time_stop': 51, 'bull_use_sma': True, 'bull_use_ema': True, 'bull_use_atr': True, 'bull_use_adx': True, 'bull_use_spike': True, 'bull_rsi_required': True, 'bear_strategy': 'mean_reversion', 'bear_bb_std_mult': 2.543684539643043, 'bear_rsi_os': 36, 'bear_rsi_ob': 83, 'bear_adx_thresh': 29.58388649515648, 'bear_atr_min_pct': 0.020962409207836423, 'bear_atr_max_pct': 0.14524362896746512, 'bear_tp_mult': 2.9152256492440145, 'bear_tsl_mult': 0.32064274623605726, 'bear_time_stop': 264, 'bear_use_sma': False, 'bear_use_ema': False, 'bear_use_atr': False, 'bear_use_adx': True, 'bear_use_spike': True, 'bear_rsi_required': True, 'sideways_strategy': 'mean_reversion', 'sideways_bb_std_mult': 0.7362563636601265, 'sideways_rsi_os': 39, 'sideways_rsi_ob': 63, 'sideways_adx_thresh': 23.88139113450466, 'sideways_atr_min_pct': 0.0222794634747243, 'sideways_atr_max_pct': 0.10521064585835149, 'sideways_tp_mult': 2.8989542791200757, 'sideways_tsl_mult': 0.9151958923853759, 'sideways_time_stop': 77, 'sideways_use_sma': True, 'sideways_use_ema': True, 'sideways_use_atr': False, 'sideways_use_adx': True, 'sideways_use_spike': True, 'sideways_rsi_required': True}.
[I 2025-08-30 16:11:44,730] Trial 679 finished with values: [-1000000000.0, 1000000000.0] and parameters: {'p_sma': 5, 'p_std': 55, 'p_atr': 27, 'p_adx': 11, 'rsi_period': 56, 'ema1': 26, 'ema2': 32, 'slip_atr_k': 0.07873873781986143, 'slip_spread_k': 0.17412622794602162, 'spread_hl_frac': 0.023345519654289257, 'bb_std_mult': 2.269335113121357, 'rsi_os': 40, 'rsi_ob': 68, 'vol_spike': 0.1532011381869539, 'adx_thresh': 14.678652455778577, 'atr_min_pct': 0.015904706051911313, 'atr_max_pct': 0.07784583133602771, 'tp_mult': 1.7592287399645443, 'tsl_mult': 0.16238711045670373, 'strategy': 'mean_reversion', 'time_stop': 219, 'use_sma': True, 'use_atr': False, 'use_adx': False, 'use_ema': True, 'use_spike': True, 'rsi_required': False, 'edge_k': 0.3699031537897731, 'edge_cap': 0.5902641671523726, 'bull_strategy': 'breakout', 'bull_bb_std_mult': 0.8760108880557862, 'bull_rsi_os': 44, 'bull_rsi_ob': 56, 'bull_adx_thresh': 23.476082331735153, 'bull_atr_min_pct': 0.020154271014397065, 'bull_atr_max_pct': 0.10181332429189568, 'bull_tp_mult': 2.071247492704693, 'bull_tsl_mult': 0.0880124778486758, 'bull_time_stop': 9, 'bull_use_sma': True, 'bull_use_ema': True, 'bull_use_atr': True, 'bull_use_adx': True, 'bull_use_spike': False, 'bull_rsi_required': True, 'bear_strategy': 'mean_reversion', 'bear_bb_std_mult': 2.604840994535347, 'bear_rsi_os': 35, 'bear_rsi_ob': 85, 'bear_adx_thresh': 29.098488811287744, 'bear_atr_min_pct': 0.020467931550222217, 'bear_atr_max_pct': 0.0730274431746619, 'bear_tp_mult': 2.84322455825673, 'bear_tsl_mult': 0.2769468379723999, 'bear_time_stop': 272, 'bear_use_sma': False, 'bear_use_ema': False, 'bear_use_atr': True, 'bear_use_adx': True, 'bear_use_spike': True, 'bear_rsi_required': True, 'sideways_strategy': 'breakout', 'sideways_bb_std_mult': 1.3729954518116743, 'sideways_rsi_os': 38, 'sideways_rsi_ob': 61, 'sideways_adx_thresh': 22.998143976689462, 'sideways_atr_min_pct': 0.0015186162620802403, 'sideways_atr_max_pct': 0.1077865542133248, 'sideways_tp_mult': 2.975861639716522, 'sideways_tsl_mult': 0.9474627075484234, 'sideways_time_stop': 148, 'sideways_use_sma': False, 'sideways_use_ema': True, 'sideways_use_atr': False, 'sideways_use_adx': True, 'sideways_use_spike': False, 'sideways_rsi_required': True}.
[I 2025-08-30 16:11:45,334] Trial 680 finished with values: [-1000000000.0, 1000000000.0] and parameters: {'p_sma': 5, 'p_std': 55, 'p_atr': 27, 'p_adx': 11, 'rsi_period': 82, 'ema1': 20, 'ema2': 32, 'slip_atr_k': 0.07571018958232538, 'slip_spread_k': 0.18010652624069717, 'spread_hl_frac': 0.023233117688737717, 'bb_std_mult': 2.268773672578907, 'rsi_os': 40, 'rsi_ob': 65, 'vol_spike': 0.15283298050966268, 'adx_thresh': 14.45864340825304, 'atr_min_pct': 0.01641205206465848, 'atr_max_pct': 0.04744893756953115, 'tp_mult': 1.7654428520210124, 'tsl_mult': 0.2993509752361895, 'strategy': 'mean_reversion', 'time_stop': 210, 'use_sma': True, 'use_atr': False, 'use_adx': False, 'use_ema': True, 'use_spike': True, 'rsi_required': False, 'edge_k': 0.3679149331560021, 'edge_cap': 0.5886557506673399, 'bull_strategy': 'breakout', 'bull_bb_std_mult': 0.861856480784473, 'bull_rsi_os': 44, 'bull_rsi_ob': 56, 'bull_adx_thresh': 23.088061538958616, 'bull_atr_min_pct': 0.019575998440779632, 'bull_atr_max_pct': 0.10236783353777479, 'bull_tp_mult': 2.0601302761455433, 'bull_tsl_mult': 0.0908179370936801, 'bull_time_stop': 17, 'bull_use_sma': True, 'bull_use_ema': True, 'bull_use_atr': True, 'bull_use_adx': True, 'bull_use_spike': False, 'bull_rsi_required': True, 'bear_strategy': 'mean_reversion', 'bear_bb_std_mult': 2.478491991828111, 'bear_rsi_os': 39, 'bear_rsi_ob': 85, 'bear_adx_thresh': 12.450133921423577, 'bear_atr_min_pct': 0.008536968255913664, 'bear_atr_max_pct': 0.07333891254592022, 'bear_tp_mult': 2.840025764729102, 'bear_tsl_mult': 0.256977682819508, 'bear_time_stop': 255, 'bear_use_sma': False, 'bear_use_ema': False, 'bear_use_atr': True, 'bear_use_adx': True, 'bear_use_spike': True, 'bear_rsi_required': True, 'sideways_strategy': 'breakout', 'sideways_bb_std_mult': 0.8471808059585342, 'sideways_rsi_os': 38, 'sideways_rsi_ob': 61, 'sideways_adx_thresh': 22.944596694256262, 'sideways_atr_min_pct': 0.025176783014396728, 'sideways_atr_max_pct': 0.11620147623554264, 'sideways_tp_mult': 2.9952763660161774, 'sideways_tsl_mult': 0.9460126527747118, 'sideways_time_stop': 56, 'sideways_use_sma': False, 'sideways_use_ema': True, 'sideways_use_atr': False, 'sideways_use_adx': True, 'sideways_use_spike': False, 'sideways_rsi_required': True}.
[I 2025-08-30 16:11:46,339] Trial 678 finished with values: [-0.06414875801397935, 0.06404718289990367] and parameters: {'p_sma': 24, 'p_std': 55, 'p_atr': 26, 'p_adx': 11, 'rsi_period': 17, 'ema1': 20, 'ema2': 29, 'slip_atr_k': 0.07802126447579905, 'slip_spread_k': 0.40536085095238916, 'spread_hl_frac': 0.023537033860602682, 'bb_std_mult': 2.256202311547534, 'rsi_os': 38, 'rsi_ob': 69, 'vol_spike': 0.16204950713587649, 'adx_thresh': 14.626537341191039, 'atr_min_pct': 0.016716332961546048, 'atr_max_pct': 0.07796486183128411, 'tp_mult': 1.7604126335773513, 'tsl_mult': 0.29788962836679367, 'strategy': 'mean_reversion', 'time_stop': 219, 'use_sma': True, 'use_atr': True, 'use_adx': False, 'use_ema': True, 'use_spike': True, 'rsi_required': False, 'edge_k': 0.3558655686179799, 'edge_cap': 0.5879879158768634, 'bull_strategy': 'breakout', 'bull_bb_std_mult': 0.8239738781144269, 'bull_rsi_os': 43, 'bull_rsi_ob': 60, 'bull_adx_thresh': 23.64273550301141, 'bull_atr_min_pct': 0.019799718681255574, 'bull_atr_max_pct': 0.09486953363761057, 'bull_tp_mult': 2.0412377284297483, 'bull_tsl_mult': 0.10224588261331069, 'bull_time_stop': 15, 'bull_use_sma': True, 'bull_use_ema': True, 'bull_use_atr': True, 'bull_use_adx': True, 'bull_use_spike': False, 'bull_rsi_required': True, 'bear_strategy': 'mean_reversion', 'bear_bb_std_mult': 2.6321025053538514, 'bear_rsi_os': 36, 'bear_rsi_ob': 83, 'bear_adx_thresh': 20.002426058506146, 'bear_atr_min_pct': 0.00856047076049616, 'bear_atr_max_pct': 0.0795684670501114, 'bear_tp_mult': 2.844266891941674, 'bear_tsl_mult': 0.35580669399187104, 'bear_time_stop': 270, 'bear_use_sma': False, 'bear_use_ema': False, 'bear_use_atr': True, 'bear_use_adx': True, 'bear_use_spike': True, 'bear_rsi_required': True, 'sideways_strategy': 'breakout', 'sideways_bb_std_mult': 0.8343892075081488, 'sideways_rsi_os': 38, 'sideways_rsi_ob': 61, 'sideways_adx_thresh': 24.99379948292225, 'sideways_atr_min_pct': 0.0015445993321802987, 'sideways_atr_max_pct': 0.11666682821591964, 'sideways_tp_mult': 2.9932645155924567, 'sideways_tsl_mult': 0.9157731260027442, 'sideways_time_stop': 77, 'sideways_use_sma': False, 'sideways_use_ema': True, 'sideways_use_atr': False, 'sideways_use_adx': True, 'sideways_use_spike': False, 'sideways_rsi_required': True}.
[I 2025-08-30 16:11:47,316] Trial 677 finished with values: [-0.03728279768768494, 0.037261737932526524] and parameters: {'p_sma': 9, 'p_std': 55, 'p_atr': 24, 'p_adx': 10, 'rsi_period': 32, 'ema1': 23, 'ema2': 32, 'slip_atr_k': 0.07089543949622587, 'slip_spread_k': 0.4024682500630784, 'spread_hl_frac': 0.024418950591488582, 'bb_std_mult': 2.2959939261263336, 'rsi_os': 38, 'rsi_ob': 73, 'vol_spike': 0.1636559923449208, 'adx_thresh': 14.828091455238408, 'atr_min_pct': 0.014907905262973845, 'atr_max_pct': 0.046598954464695246, 'tp_mult': 1.7561078263271583, 'tsl_mult': 0.3327828384443762, 'strategy': 'mean_reversion', 'time_stop': 224, 'use_sma': True, 'use_atr': True, 'use_adx': False, 'use_ema': True, 'use_spike': True, 'rsi_required': False, 'edge_k': 0.3595457240283854, 'edge_cap': 0.5946371759288336, 'bull_strategy': 'breakout', 'bull_bb_std_mult': 0.8399707443535702, 'bull_rsi_os': 41, 'bull_rsi_ob': 63, 'bull_adx_thresh': 23.61381671322453, 'bull_atr_min_pct': 0.01951780464183527, 'bull_atr_max_pct': 0.09426757069294467, 'bull_tp_mult': 2.0658723160419257, 'bull_tsl_mult': 0.19082140702379213, 'bull_time_stop': 16, 'bull_use_sma': True, 'bull_use_ema': True, 'bull_use_atr': True, 'bull_use_adx': True, 'bull_use_spike': False, 'bull_rsi_required': True, 'bear_strategy': 'mean_reversion', 'bear_bb_std_mult': 2.6208307585980086, 'bear_rsi_os': 39, 'bear_rsi_ob': 83, 'bear_adx_thresh': 29.194519541028164, 'bear_atr_min_pct': 0.01961355822310746, 'bear_atr_max_pct': 0.043968278178231034, 'bear_tp_mult': 2.8436711470211926, 'bear_tsl_mult': 0.36988659570850885, 'bear_time_stop': 255, 'bear_use_sma': False, 'bear_use_ema': False, 'bear_use_atr': False, 'bear_use_adx': True, 'bear_use_spike': True, 'bear_rsi_required': True, 'sideways_strategy': 'breakout', 'sideways_bb_std_mult': 0.6818500815336914, 'sideways_rsi_os': 40, 'sideways_rsi_ob': 61, 'sideways_adx_thresh': 23.072318790986383, 'sideways_atr_min_pct': 0.001362845386209364, 'sideways_atr_max_pct': 0.11506005397496635, 'sideways_tp_mult': 2.997031154153872, 'sideways_tsl_mult': 0.9166608914264665, 'sideways_time_stop': 274, 'sideways_use_sma': False, 'sideways_use_ema': True, 'sideways_use_atr': False, 'sideways_use_adx': True, 'sideways_use_spike': True, 'sideways_rsi_required': True}.
[I 2025-08-30 16:12:35,089] Trial 682 finished with values: [-1000000000.0, 1000000000.0] and parameters: {'p_sma': 7, 'p_std': 56, 'p_atr': 25, 'p_adx': 10, 'rsi_period': 79, 'ema1': 23, 'ema2': 29, 'slip_atr_k': 0.07932980624985492, 'slip_spread_k': 0.1377260554050004, 'spread_hl_frac': 0.024413073049746235, 'bb_std_mult': 2.370237530854114, 'rsi_os': 38, 'rsi_ob': 74, 'vol_spike': 0.1427378418692734, 'adx_thresh': 14.929223815350916, 'atr_min_pct': 0.01479752755442939, 'atr_max_pct': 0.07775415211180635, 'tp_mult': 1.5704724953785973, 'tsl_mult': 0.3662480341428575, 'strategy': 'mean_reversion', 'time_stop': 219, 'use_sma': True, 'use_atr': True, 'use_adx': False, 'use_ema': True, 'use_spike': True, 'rsi_required': False, 'edge_k': 0.41283057713035437, 'edge_cap': 0.6033077741905869, 'bull_strategy': 'breakout', 'bull_bb_std_mult': 0.6899968178607058, 'bull_rsi_os': 41, 'bull_rsi_ob': 59, 'bull_adx_thresh': 25.737452520868626, 'bull_atr_min_pct': 0.010455737537131214, 'bull_atr_max_pct': 0.09382460116467513, 'bull_tp_mult': 2.0105221578185497, 'bull_tsl_mult': 0.06101097455676616, 'bull_time_stop': 89, 'bull_use_sma': True, 'bull_use_ema': True, 'bull_use_atr': True, 'bull_use_adx': True, 'bull_use_spike': True, 'bull_rsi_required': True, 'bear_strategy': 'mean_reversion', 'bear_bb_std_mult': 2.605870589590118, 'bear_rsi_os': 34, 'bear_rsi_ob': 88, 'bear_adx_thresh': 32.245016561455635, 'bear_atr_min_pct': 0.01858398758014566, 'bear_atr_max_pct': 0.11057843519895319, 'bear_tp_mult': 2.7195584131705997, 'bear_tsl_mult': 0.412691112930186, 'bear_time_stop': 270, 'bear_use_sma': False, 'bear_use_ema': False, 'bear_use_atr': True, 'bear_use_adx': True, 'bear_use_spike': True, 'bear_rsi_required': True, 'sideways_strategy': 'breakout', 'sideways_bb_std_mult': 1.3393440187735948, 'sideways_rsi_os': 40, 'sideways_rsi_ob': 62, 'sideways_adx_thresh': 25.152283088563983, 'sideways_atr_min_pct': 0.0014363042763995259, 'sideways_atr_max_pct': 0.12244669146852571, 'sideways_tp_mult': 2.9423509849357434, 'sideways_tsl_mult': 0.9507954257945447, 'sideways_time_stop': 78, 'sideways_use_sma': True, 'sideways_use_ema': True, 'sideways_use_atr': False, 'sideways_use_adx': True, 'sideways_use_spike': True, 'sideways_rsi_required': True}.
[I 2025-08-30 16:12:35,799] Trial 681 finished with values: [-0.027038424193862598, 0.026962117841239582] and parameters: {'p_sma': 7, 'p_std': 56, 'p_atr': 27, 'p_adx': 11, 'rsi_period': 17, 'ema1': 20, 'ema2': 30, 'slip_atr_k': 0.07607379858975025, 'slip_spread_k': 0.3963621162086586, 'spread_hl_frac': 0.01869680375711758, 'bb_std_mult': 2.3377706875028577, 'rsi_os': 38, 'rsi_ob': 65, 'vol_spike': 0.16356439186689256, 'adx_thresh': 14.554956040054137, 'atr_min_pct': 0.01570270327588097, 'atr_max_pct': 0.062011428877082185, 'tp_mult': 1.5383625592992116, 'tsl_mult': 0.3066785576051154, 'strategy': 'mean_reversion', 'time_stop': 214, 'use_sma': True, 'use_atr': True, 'use_adx': False, 'use_ema': True, 'use_spike': True, 'rsi_required': False, 'edge_k': 0.3557768697709521, 'edge_cap': 0.9963533153469915, 'bull_strategy': 'breakout', 'bull_bb_std_mult': 0.6817353248038088, 'bull_rsi_os': 41, 'bull_rsi_ob': 59, 'bull_adx_thresh': 23.373940103377315, 'bull_atr_min_pct': 0.01962700069620038, 'bull_atr_max_pct': 0.0950447460542549, 'bull_tp_mult': 2.0491864898670524, 'bull_tsl_mult': 0.14091687873890285, 'bull_time_stop': 94, 'bull_use_sma': True, 'bull_use_ema': True, 'bull_use_atr': True, 'bull_use_adx': True, 'bull_use_spike': False, 'bull_rsi_required': True, 'bear_strategy': 'mean_reversion', 'bear_bb_std_mult': 2.4829987206555733, 'bear_rsi_os': 40, 'bear_rsi_ob': 84, 'bear_adx_thresh': 12.389848336901228, 'bear_atr_min_pct': 0.018880919768009367, 'bear_atr_max_pct': 0.1101702789856981, 'bear_tp_mult': 2.8461956182686365, 'bear_tsl_mult': 0.2579532311520183, 'bear_time_stop': 254, 'bear_use_sma': False, 'bear_use_ema': False, 'bear_use_atr': True, 'bear_use_adx': True, 'bear_use_spike': True, 'bear_rsi_required': True, 'sideways_strategy': 'breakout', 'sideways_bb_std_mult': 0.8384258391852686, 'sideways_rsi_os': 40, 'sideways_rsi_ob': 65, 'sideways_adx_thresh': 25.33725008467037, 'sideways_atr_min_pct': 0.0014380662958497796, 'sideways_atr_max_pct': 0.03556503726957497, 'sideways_tp_mult': 2.9533451959925525, 'sideways_tsl_mult': 0.9420301360723431, 'sideways_time_stop': 59, 'sideways_use_sma': False, 'sideways_use_ema': True, 'sideways_use_atr': False, 'sideways_use_adx': True, 'sideways_use_spike': False, 'sideways_rsi_required': True}.
[I 2025-08-30 16:12:36,349] Trial 683 finished with values: [-1000000000.0, 1000000000.0] and parameters: {'p_sma': 27, 'p_std': 56, 'p_atr': 25, 'p_adx': 12, 'rsi_period': 78, 'ema1': 23, 'ema2': 29, 'slip_atr_k': 0.06937231071177637, 'slip_spread_k': 0.0006673346215616549, 'spread_hl_frac': 0.024849648318194167, 'bb_std_mult': 2.3538921758086917, 'rsi_os': 38, 'rsi_ob': 78, 'vol_spike': 0.07924340636735616, 'adx_thresh': 15.44863586692217, 'atr_min_pct': 0.015696451097870212, 'atr_max_pct': 0.06736878742684364, 'tp_mult': 1.5867243245071494, 'tsl_mult': 0.3563190520210534, 'strategy': 'mean_reversion', 'time_stop': 209, 'use_sma': True, 'use_atr': True, 'use_adx': False, 'use_ema': True, 'use_spike': True, 'rsi_required': False, 'edge_k': 0.4201373720951541, 'edge_cap': 0.32756334238059265, 'bull_strategy': 'breakout', 'bull_bb_std_mult': 0.6723239985697633, 'bull_rsi_os': 48, 'bull_rsi_ob': 63, 'bull_adx_thresh': 24.927378211183235, 'bull_atr_min_pct': 0.009731254494673994, 'bull_atr_max_pct': 0.09195805652648126, 'bull_tp_mult': 1.997066237613131, 'bull_tsl_mult': 0.0589753754458015, 'bull_time_stop': 70, 'bull_use_sma': True, 'bull_use_ema': True, 'bull_use_atr': True, 'bull_use_adx': True, 'bull_use_spike': True, 'bull_rsi_required': True, 'bear_strategy': 'mean_reversion', 'bear_bb_std_mult': 2.474587847949538, 'bear_rsi_os': 34, 'bear_rsi_ob': 82, 'bear_adx_thresh': 24.37623638830188, 'bear_atr_min_pct': 0.018302393086906444, 'bear_atr_max_pct': 0.04422895956867952, 'bear_tp_mult': 2.712948760673687, 'bear_tsl_mult': 0.45096608803226473, 'bear_time_stop': 290, 'bear_use_sma': False, 'bear_use_ema': False, 'bear_use_atr': True, 'bear_use_adx': True, 'bear_use_spike': True, 'bear_rsi_required': True, 'sideways_strategy': 'breakout', 'sideways_bb_std_mult': 1.1854358895175514, 'sideways_rsi_os': 39, 'sideways_rsi_ob': 62, 'sideways_adx_thresh': 25.267703660947976, 'sideways_atr_min_pct': 0.016765961611225205, 'sideways_atr_max_pct': 0.12570577933748373, 'sideways_tp_mult': 2.9428065403372576, 'sideways_tsl_mult': 0.9372155216568657, 'sideways_time_stop': 300, 'sideways_use_sma': True, 'sideways_use_ema': True, 'sideways_use_atr': False, 'sideways_use_adx': True, 'sideways_use_spike': True, 'sideways_rsi_required': True}.
