[I 2025-08-30 14:27:30,533] Trial 56 finished with values: [-1000000000.0, 1000000000.0] and parameters: {'p_sma': 44, 'p_std': 57, 'p_atr': 18, 'p_adx': 12, 'rsi_period': 19, 'ema1': 8, 'ema2': 26, 'slip_atr_k': 0.23294631202637112, 'slip_spread_k': 0.15134709078723618, 'spread_hl_frac': 0.018080975239420524, 'bb_std_mult': 1.7441525448293018, 'rsi_os': 31, 'rsi_ob': 76, 'vol_spike': 0.14045984568166114, 'adx_thresh': 11.883936006850604, 'atr_min_pct': 0.02409665495903175, 'atr_max_pct': 0.13652241644459456, 'tp_mult': 2.961766754747836, 'tsl_mult': 0.5333358750402706, 'strategy': 'mean_reversion', 'time_stop': 56, 'use_sma': False, 'use_atr': False, 'use_adx': True, 'use_ema': False, 'use_spike': True, 'rsi_required': True, 'edge_k': 0.7215385616358481, 'edge_cap': 0.8194580289114678, 'bull_strategy': 'breakout', 'bull_bb_std_mult': 1.162039515329183, 'bull_rsi_os': 40, 'bull_rsi_ob': 57, 'bull_adx_thresh': 22.238919561849556, 'bull_atr_min_pct': 0.0296182685434093, 'bull_atr_max_pct': 0.10333001599599713, 'bull_tp_mult': 1.2126378986996906, 'bull_tsl_mult': 0.28106233237839473, 'bull_time_stop': 257, 'bull_use_sma': False, 'bull_use_ema': True, 'bull_use_atr': True, 'bull_use_adx': True, 'bull_use_spike': True, 'bull_rsi_required': True, 'bear_strategy': 'breakout', 'bear_bb_std_mult': 2.492072793628112, 'bear_rsi_os': 33, 'bear_rsi_ob': 47, 'bear_adx_thresh': 23.96374956919218, 'bear_atr_min_pct': 0.02171165508861889, 'bear_atr_max_pct': 0.09979569636218592, 'bear_tp_mult': 1.950596659689272, 'bear_tsl_mult': 0.6068637392354931, 'bear_time_stop': 77, 'bear_use_sma': True, 'bear_use_ema': False, 'bear_use_atr': True, 'bear_use_adx': False, 'bear_use_spike': False, 'bear_rsi_required': True, 'sideways_strategy': 'mean_reversion', 'sideways_bb_std_mult': 1.241890238166327, 'sideways_rsi_os': 18, 'sideways_rsi_ob': 72, 'sideways_adx_thresh': 10.972568501274818, 'sideways_atr_min_pct': 0.015535906615478452, 'sideways_atr_max_pct': 0.03757857932097488, 'sideways_tp_mult': 1.2862055457460428, 'sideways_tsl_mult': 0.32154270883014335, 'sideways_time_stop': 295, 'sideways_use_sma': True, 'sideways_use_ema': False, 'sideways_use_atr': False, 'sideways_use_adx': True, 'sideways_use_spike': True, 'sideways_rsi_required': True}.
[I 2025-08-30 14:27:30,727] Trial 54 finished with values: [-1000000000.0, 1000000000.0] and parameters: {'p_sma': 44, 'p_std': 57, 'p_atr': 12, 'p_adx': 11, 'rsi_period': 17, 'ema1': 8, 'ema2': 57, 'slip_atr_k': 0.13680737403209225, 'slip_spread_k': 0.13862116691670084, 'spread_hl_frac': 0.019223829570150966, 'bb_std_mult': 3.5890694059777566, 'rsi_os': 14, 'rsi_ob': 76, 'vol_spike': 0.016381732565688673, 'adx_thresh': 12.141044984210495, 'atr_min_pct': 0.0247576683244834, 'atr_max_pct': 0.110475421097566, 'tp_mult': 2.533219144960127, 'tsl_mult': 0.29665313028678697, 'strategy': 'breakout', 'time_stop': 68, 'use_sma': False, 'use_atr': False, 'use_adx': True, 'use_ema': False, 'use_spike': True, 'rsi_required': True, 'edge_k': 0.14142767127606826, 'edge_cap': 0.10231061409048176, 'bull_strategy': 'breakout', 'bull_bb_std_mult': 1.145432069598865, 'bull_rsi_os': 19, 'bull_rsi_ob': 57, 'bull_adx_thresh': 33.24879606645704, 'bull_atr_min_pct': 0.01037505335177416, 'bull_atr_max_pct': 0.0735945668990042, 'bull_tp_mult': 1.2423363039203614, 'bull_tsl_mult': 0.26241168469341614, 'bull_time_stop': 256, 'bull_use_sma': False, 'bull_use_ema': True, 'bull_use_atr': True, 'bull_use_adx': False, 'bull_use_spike': True, 'bull_rsi_required': True, 'bear_strategy': 'breakout', 'bear_bb_std_mult': 0.6758309462625085, 'bear_rsi_os': 34, 'bear_rsi_ob': 46, 'bear_adx_thresh': 23.549629049866265, 'bear_atr_min_pct': 0.020895769777298977, 'bear_atr_max_pct': 0.09902465854543299, 'bear_tp_mult': 2.4213431405088808, 'bear_tsl_mult': 0.054668139819041284, 'bear_time_stop': 61, 'bear_use_sma': True, 'bear_use_ema': False, 'bear_use_atr': True, 'bear_use_adx': False, 'bear_use_spike': False, 'bear_rsi_required': True, 'sideways_strategy': 'mean_reversion', 'sideways_bb_std_mult': 2.5850449867347205, 'sideways_rsi_os': 17, 'sideways_rsi_ob': 73, 'sideways_adx_thresh': 31.661050612828024, 'sideways_atr_min_pct': 0.010677515192872425, 'sideways_atr_max_pct': 0.0904486015940959, 'sideways_tp_mult': 2.4169162729257865, 'sideways_tsl_mult': 0.31028615891678196, 'sideways_time_stop': 300, 'sideways_use_sma': True, 'sideways_use_ema': False, 'sideways_use_atr': False, 'sideways_use_adx': True, 'sideways_use_spike': True, 'sideways_rsi_required': True}.
[I 2025-08-30 14:27:30,928] Trial 55 finished with values: [-1000000000.0, 1000000000.0] and parameters: {'p_sma': 45, 'p_std': 57, 'p_atr': 11, 'p_adx': 14, 'rsi_period': 19, 'ema1': 8, 'ema2': 26, 'slip_atr_k': 0.1393204811777451, 'slip_spread_k': 0.09416964842684483, 'spread_hl_frac': 0.022169852322497116, 'bb_std_mult': 1.6735469662847184, 'rsi_os': 14, 'rsi_ob': 76, 'vol_spike': 0.1805716124119528, 'adx_thresh': 12.269182823743902, 'atr_min_pct': 0.02485025441117369, 'atr_max_pct': 0.11085556546868686, 'tp_mult': 2.175509651122097, 'tsl_mult': 0.17026710346439372, 'strategy': 'breakout', 'time_stop': 180, 'use_sma': False, 'use_atr': False, 'use_adx': True, 'use_ema': False, 'use_spike': True, 'rsi_required': True, 'edge_k': 0.6815284876658363, 'edge_cap': 0.9306784136137014, 'bull_strategy': 'breakout', 'bull_bb_std_mult': 1.0878065394557863, 'bull_rsi_os': 39, 'bull_rsi_ob': 58, 'bull_adx_thresh': 25.81441628061208, 'bull_atr_min_pct': 0.006484285800250716, 'bull_atr_max_pct': 0.10488140459347571, 'bull_tp_mult': 1.1950705406904185, 'bull_tsl_mult': 0.8689838692701396, 'bull_time_stop': 256, 'bull_use_sma': False, 'bull_use_ema': True, 'bull_use_atr': True, 'bull_use_adx': True, 'bull_use_spike': True, 'bull_rsi_required': True, 'bear_strategy': 'breakout', 'bear_bb_std_mult': 2.4095535269049337, 'bear_rsi_os': 33, 'bear_rsi_ob': 45, 'bear_adx_thresh': 5.38043022440406, 'bear_atr_min_pct': 0.021041939497154032, 'bear_atr_max_pct': 0.07082309528928936, 'bear_tp_mult': 1.934124465141909, 'bear_tsl_mult': 0.09342694102419025, 'bear_time_stop': 182, 'bear_use_sma': True, 'bear_use_ema': False, 'bear_use_atr': True, 'bear_use_adx': False, 'bear_use_spike': False, 'bear_rsi_required': True, 'sideways_strategy': 'mean_reversion', 'sideways_bb_std_mult': 1.8039936175082045, 'sideways_rsi_os': 19, 'sideways_rsi_ob': 72, 'sideways_adx_thresh': 32.671087952106035, 'sideways_atr_min_pct': 0.015345234682769708, 'sideways_atr_max_pct': 0.09016260929217933, 'sideways_tp_mult': 1.3186773075221132, 'sideways_tsl_mult': 0.30943222712365126, 'sideways_time_stop': 298, 'sideways_use_sma': True, 'sideways_use_ema': False, 'sideways_use_atr': False, 'sideways_use_adx': True, 'sideways_use_spike': True, 'sideways_rsi_required': True}.
[I 2025-08-30 14:28:01,098] Trial 57 finished with values: [-1000000000.0, 1000000000.0] and parameters: {'p_sma': 45, 'p_std': 57, 'p_atr': 11, 'p_adx': 14, 'rsi_period': 73, 'ema1': 8, 'ema2': 57, 'slip_atr_k': 0.23569747653356657, 'slip_spread_k': 0.1590632614744384, 'spread_hl_frac': 0.010205632240542864, 'bb_std_mult': 2.3703385442181726, 'rsi_os': 14, 'rsi_ob': 84, 'vol_spike': 0.02219711865359253, 'adx_thresh': 11.50472155700208, 'atr_min_pct': 0.02433259314779264, 'atr_max_pct': 0.06550429837718537, 'tp_mult': 2.1665261658588286, 'tsl_mult': 0.31658403636921134, 'strategy': 'mean_reversion', 'time_stop': 174, 'use_sma': True, 'use_atr': False, 'use_adx': True, 'use_ema': False, 'use_spike': True, 'rsi_required': False, 'edge_k': 0.7292819428584141, 'edge_cap': 0.9371144821059224, 'bull_strategy': 'breakout', 'bull_bb_std_mult': 3.253758291761177, 'bull_rsi_os': 35, 'bull_rsi_ob': 57, 'bull_adx_thresh': 32.477473280269, 'bull_atr_min_pct': 0.029802417189505617, 'bull_atr_max_pct': 0.10350723518657232, 'bull_tp_mult': 1.2199091386941068, 'bull_tsl_mult': 0.28045380286593047, 'bull_time_stop': 253, 'bull_use_sma': False, 'bull_use_ema': False, 'bull_use_atr': True, 'bull_use_adx': False, 'bull_use_spike': True, 'bull_rsi_required': False, 'bear_strategy': 'breakout', 'bear_bb_std_mult': 2.369990639529742, 'bear_rsi_os': 47, 'bear_rsi_ob': 45, 'bear_adx_thresh': 24.67730144525925, 'bear_atr_min_pct': 0.023209881515227203, 'bear_atr_max_pct': 0.0712577412103168, 'bear_tp_mult': 2.6028639736749764, 'bear_tsl_mult': 0.8649623145705938, 'bear_time_stop': 68, 'bear_use_sma': False, 'bear_use_ema': False, 'bear_use_atr': False, 'bear_use_adx': False, 'bear_use_spike': False, 'bear_rsi_required': True, 'sideways_strategy': 'mean_reversion', 'sideways_bb_std_mult': 2.7762760468087717, 'sideways_rsi_os': 22, 'sideways_rsi_ob': 72, 'sideways_adx_thresh': 10.758214633950287, 'sideways_atr_min_pct': 0.01540695101132163, 'sideways_atr_max_pct': 0.08922472337591014, 'sideways_tp_mult': 1.2958371705523397, 'sideways_tsl_mult': 0.2979259721276142, 'sideways_time_stop': 203, 'sideways_use_sma': True, 'sideways_use_ema': False, 'sideways_use_atr': False, 'sideways_use_adx': True, 'sideways_use_spike': True, 'sideways_rsi_required': True}.
[I 2025-08-30 14:28:01,707] Trial 59 finished with values: [-1000000000.0, 1000000000.0] and parameters: {'p_sma': 40, 'p_std': 57, 'p_atr': 11, 'p_adx': 14, 'rsi_period': 14, 'ema1': 26, 'ema2': 33, 'slip_atr_k': 0.0005191064176756632, 'slip_spread_k': 0.6027371361300781, 'spread_hl_frac': 0.01413829287108873, 'bb_std_mult': 2.280893264262168, 'rsi_os': 25, 'rsi_ob': 84, 'vol_spike': 0.23372911902511723, 'adx_thresh': 13.400436314462542, 'atr_min_pct': 0.027619658962628503, 'atr_max_pct': 0.06483571533497874, 'tp_mult': 2.1785561058576435, 'tsl_mult': 0.9167667865363461, 'strategy': 'breakout', 'time_stop': 188, 'use_sma': True, 'use_atr': False, 'use_adx': True, 'use_ema': False, 'use_spike': True, 'rsi_required': False, 'edge_k': 1.5977121259425417, 'edge_cap': 0.1739007719193151, 'bull_strategy': 'breakout', 'bull_bb_std_mult': 3.2397541886552386, 'bull_rsi_os': 35, 'bull_rsi_ob': 70, 'bull_adx_thresh': 24.350207562633408, 'bull_atr_min_pct': 0.005733238311933419, 'bull_atr_max_pct': 0.027963333277137153, 'bull_tp_mult': 1.1078101071003537, 'bull_tsl_mult': 0.6782112940160576, 'bull_time_stop': 278, 'bull_use_sma': False, 'bull_use_ema': False, 'bull_use_atr': True, 'bull_use_adx': False, 'bull_use_spike': True, 'bull_rsi_required': False, 'bear_strategy': 'breakout', 'bear_bb_std_mult': 2.3354790105145957, 'bear_rsi_os': 48, 'bear_rsi_ob': 52, 'bear_adx_thresh': 12.206233086240234, 'bear_atr_min_pct': 0.02275455383673328, 'bear_atr_max_pct': 0.02134988093883857, 'bear_tp_mult': 2.613605184241386, 'bear_tsl_mult': 0.8246840770105204, 'bear_time_stop': 236, 'bear_use_sma': False, 'bear_use_ema': False, 'bear_use_atr': False, 'bear_use_adx': False, 'bear_use_spike': True, 'bear_rsi_required': True, 'sideways_strategy': 'breakout', 'sideways_bb_std_mult': 1.7263581172819682, 'sideways_rsi_os': 23, 'sideways_rsi_ob': 91, 'sideways_adx_thresh': 23.726282023060126, 'sideways_atr_min_pct': 0.021953071010561886, 'sideways_atr_max_pct': 0.09851021078481423, 'sideways_tp_mult': 1.838964957224274, 'sideways_tsl_mult': 0.05040701640354693, 'sideways_time_stop': 202, 'sideways_use_sma': True, 'sideways_use_ema': False, 'sideways_use_atr': False, 'sideways_use_adx': True, 'sideways_use_spike': True, 'sideways_rsi_required': True}.
[I 2025-08-30 14:28:01,974] Trial 58 finished with values: [-0.017370293860779595, 0.01776520119920088] and parameters: {'p_sma': 41, 'p_std': 57, 'p_atr': 11, 'p_adx': 14, 'rsi_period': 70, 'ema1': 26, 'ema2': 57, 'slip_atr_k': 0.005616007960101949, 'slip_spread_k': 0.4974183158511481, 'spread_hl_frac': 0.01943473756682271, 'bb_std_mult': 2.959460663321851, 'rsi_os': 8, 'rsi_ob': 69, 'vol_spike': 0.029125950336063952, 'adx_thresh': 13.677439945024265, 'atr_min_pct': 0.02806283702758861, 'atr_max_pct': 0.11251241522295893, 'tp_mult': 2.6328247770001316, 'tsl_mult': 0.9238017390786516, 'strategy': 'breakout', 'time_stop': 253, 'use_sma': True, 'use_atr': False, 'use_adx': True, 'use_ema': False, 'use_spike': True, 'rsi_required': False, 'edge_k': 0.4758978825424731, 'edge_cap': 0.9319294849792525, 'bull_strategy': 'breakout', 'bull_bb_std_mult': 0.9592320390819733, 'bull_rsi_os': 34, 'bull_rsi_ob': 47, 'bull_adx_thresh': 17.81030304470566, 'bull_atr_min_pct': 0.0017639508877310512, 'bull_atr_max_pct': 0.025231740940553707, 'bull_tp_mult': 1.0227577070128282, 'bull_tsl_mult': 0.8531563171560823, 'bull_time_stop': 246, 'bull_use_sma': False, 'bull_use_ema': False, 'bull_use_atr': True, 'bull_use_adx': False, 'bull_use_spike': True, 'bull_rsi_required': False, 'bear_strategy': 'breakout', 'bear_bb_std_mult': 1.333815045888314, 'bear_rsi_os': 48, 'bear_rsi_ob': 52, 'bear_adx_thresh': 13.098798638496497, 'bear_atr_min_pct': 0.022864250907924336, 'bear_atr_max_pct': 0.06999463692304923, 'bear_tp_mult': 2.6578714171334834, 'bear_tsl_mult': 0.8950323904421116, 'bear_time_stop': 184, 'bear_use_sma': False, 'bear_use_ema': False, 'bear_use_atr': False, 'bear_use_adx': False, 'bear_use_spike': False, 'bear_rsi_required': True, 'sideways_strategy': 'breakout', 'sideways_bb_std_mult': 3.2006508016693784, 'sideways_rsi_os': 13, 'sideways_rsi_ob': 45, 'sideways_adx_thresh': 30.90946205841841, 'sideways_atr_min_pct': 0.008598657415361182, 'sideways_atr_max_pct': 0.08685323059675248, 'sideways_tp_mult': 1.530832101733061, 'sideways_tsl_mult': 0.03766346347813865, 'sideways_time_stop': 201, 'sideways_use_sma': True, 'sideways_use_ema': False, 'sideways_use_atr': False, 'sideways_use_adx': True, 'sideways_use_spike': True, 'sideways_rsi_required': True}.
[I 2025-08-30 14:28:01,976] Trial 60 finished with values: [-0.01584937805785014, 0.0163298306124865] and parameters: {'p_sma': 40, 'p_std': 60, 'p_atr': 16, 'p_adx': 20, 'rsi_period': 69, 'ema1': 26, 'ema2': 52, 'slip_atr_k': 0.015937349356162117, 'slip_spread_k': 0.2607251741377913, 'spread_hl_frac': 0.006499580654486942, 'bb_std_mult': 2.336064364576787, 'rsi_os': 43, 'rsi_ob': 84, 'vol_spike': 0.22960340929778275, 'adx_thresh': 13.679688547900273, 'atr_min_pct': 0.0278333697006978, 'atr_max_pct': 0.06702401529232, 'tp_mult': 2.6820111501899175, 'tsl_mult': 0.9312674544676214, 'strategy': 'mean_reversion', 'time_stop': 7, 'use_sma': True, 'use_atr': False, 'use_adx': True, 'use_ema': False, 'use_spike': False, 'rsi_required': False, 'edge_k': 1.3994174716970016, 'edge_cap': 0.16827909345881203, 'bull_strategy': 'breakout', 'bull_bb_std_mult': 3.2263979372569116, 'bull_rsi_os': 11, 'bull_rsi_ob': 71, 'bull_adx_thresh': 17.39930458254788, 'bull_atr_min_pct': 0.0015627089564499803, 'bull_atr_max_pct': 0.03061505416221135, 'bull_tp_mult': 1.0590959227854322, 'bull_tsl_mult': 0.6661671468269454, 'bull_time_stop': 278, 'bull_use_sma': False, 'bull_use_ema': False, 'bull_use_atr': True, 'bull_use_adx': False, 'bull_use_spike': True, 'bull_rsi_required': False, 'bear_strategy': 'breakout', 'bear_bb_std_mult': 1.34383818137289, 'bear_rsi_os': 18, 'bear_rsi_ob': 52, 'bear_adx_thresh': 21.98099186393932, 'bear_atr_min_pct': 0.022678937446676452, 'bear_atr_max_pct': 0.029548097313133674, 'bear_tp_mult': 2.246522048700134, 'bear_tsl_mult': 0.2472867794941402, 'bear_time_stop': 238, 'bear_use_sma': False, 'bear_use_ema': False, 'bear_use_atr': False, 'bear_use_adx': False, 'bear_use_spike': True, 'bear_rsi_required': True, 'sideways_strategy': 'breakout', 'sideways_bb_std_mult': 0.6607248618452328, 'sideways_rsi_os': 23, 'sideways_rsi_ob': 91, 'sideways_adx_thresh': 28.244732374245608, 'sideways_atr_min_pct': 0.02214045573371637, 'sideways_atr_max_pct': 0.051761372398834965, 'sideways_tp_mult': 1.525180894743668, 'sideways_tsl_mult': 0.12730547329852765, 'sideways_time_stop': 250, 'sideways_use_sma': True, 'sideways_use_ema': False, 'sideways_use_atr': False, 'sideways_use_adx': True, 'sideways_use_spike': True, 'sideways_rsi_required': True}.
[I 2025-08-30 14:28:33,623] Trial 63 finished with values: [-0.01673083675388376, 0.016688094574450932] and parameters: {'p_sma': 39, 'p_std': 60, 'p_atr': 16, 'p_adx': 20, 'rsi_period': 63, 'ema1': 27, 'ema2': 37, 'slip_atr_k': 0.032309831420697335, 'slip_spread_k': 0.2579015651738644, 'spread_hl_frac': 0.002566917589436826, 'bb_std_mult': 3.0864274561458562, 'rsi_os': 39, 'rsi_ob': 86, 'vol_spike': 0.2629035922321313, 'adx_thresh': 15.596507304976852, 'atr_min_pct': 0.01032498472368017, 'atr_max_pct': 0.0732845591836081, 'tp_mult': 2.4436138985973486, 'tsl_mult': 0.9427585805072934, 'strategy': 'mean_reversion', 'time_stop': 228, 'use_sma': True, 'use_atr': False, 'use_adx': False, 'use_ema': False, 'use_spike': False, 'rsi_required': False, 'edge_k': 1.3589799574847612, 'edge_cap': 0.4721844453446094, 'bull_strategy': 'mean_reversion', 'bull_bb_std_mult': 3.3812326679727187, 'bull_rsi_os': 12, 'bull_rsi_ob': 74, 'bull_adx_thresh': 12.490137901152838, 'bull_atr_min_pct': 0.0017563125933300068, 'bull_atr_max_pct': 0.014842757778384244, 'bull_tp_mult': 1.0513269699002703, 'bull_tsl_mult': 0.7477525500791495, 'bull_time_stop': 275, 'bull_use_sma': False, 'bull_use_ema': False, 'bull_use_atr': True, 'bull_use_adx': False, 'bull_use_spike': True, 'bull_rsi_required': False, 'bear_strategy': 'breakout', 'bear_bb_std_mult': 1.3451956683752695, 'bear_rsi_os': 19, 'bear_rsi_ob': 51, 'bear_adx_thresh': 22.502838038421682, 'bear_atr_min_pct': 0.002020146477445438, 'bear_atr_max_pct': 0.028364933244108815, 'bear_tp_mult': 2.2290684629179136, 'bear_tsl_mult': 0.2382153087650572, 'bear_time_stop': 260, 'bear_use_sma': False, 'bear_use_ema': False, 'bear_use_atr': False, 'bear_use_adx': False, 'bear_use_spike': True, 'bear_rsi_required': True, 'sideways_strategy': 'breakout', 'sideways_bb_std_mult': 0.7777989248553835, 'sideways_rsi_os': 15, 'sideways_rsi_ob': 81, 'sideways_adx_thresh': 27.895287211076454, 'sideways_atr_min_pct': 0.029541928582598513, 'sideways_atr_max_pct': 0.0535815694072397, 'sideways_tp_mult': 1.5093788682546478, 'sideways_tsl_mult': 0.12882729013817973, 'sideways_time_stop': 248, 'sideways_use_sma': True, 'sideways_use_ema': False, 'sideways_use_atr': True, 'sideways_use_adx': False, 'sideways_use_spike': True, 'sideways_rsi_required': False}.
[I 2025-08-30 14:28:33,850] Trial 62 finished with values: [-1000000000.0, 1000000000.0] and parameters: {'p_sma': 22, 'p_std': 19, 'p_atr': 16, 'p_adx': 20, 'rsi_period': 68, 'ema1': 5, 'ema2': 37, 'slip_atr_k': 0.03485901837210997, 'slip_spread_k': 0.48895662393661804, 'spread_hl_frac': 0.005813698162255821, 'bb_std_mult': 2.9510316839381967, 'rsi_os': 8, 'rsi_ob': 86, 'vol_spike': 0.13138748715575732, 'adx_thresh': 9.57963336929852, 'atr_min_pct': 0.026117245806815192, 'atr_max_pct': 0.042190383394121164, 'tp_mult': 2.417364210964439, 'tsl_mult': 0.7823066912798844, 'strategy': 'breakout', 'time_stop': 224, 'use_sma': True, 'use_atr': False, 'use_adx': False, 'use_ema': False, 'use_spike': False, 'rsi_required': True, 'edge_k': 1.3836247175768348, 'edge_cap': 0.10274056335601967, 'bull_strategy': 'mean_reversion', 'bull_bb_std_mult': 0.7215785942936626, 'bull_rsi_os': 45, 'bull_rsi_ob': 47, 'bull_adx_thresh': 11.89304898357951, 'bull_atr_min_pct': 0.01989675109315591, 'bull_atr_max_pct': 0.1478622939889812, 'bull_tp_mult': 2.1831197930568518, 'bull_tsl_mult': 0.9902793087295593, 'bull_time_stop': 276, 'bull_use_sma': False, 'bull_use_ema': False, 'bull_use_atr': True, 'bull_use_adx': False, 'bull_use_spike': True, 'bull_rsi_required': False, 'bear_strategy': 'breakout', 'bear_bb_std_mult': 1.4313699818342727, 'bear_rsi_os': 28, 'bear_rsi_ob': 74, 'bear_adx_thresh': 21.695517817131357, 'bear_atr_min_pct': 0.014627228980400997, 'bear_atr_max_pct': 0.031515195743304046, 'bear_tp_mult': 2.2378229603976143, 'bear_tsl_mult': 0.25091396923134823, 'bear_time_stop': 265, 'bear_use_sma': True, 'bear_use_ema': True, 'bear_use_atr': True, 'bear_use_adx': False, 'bear_use_spike': True, 'bear_rsi_required': True, 'sideways_strategy': 'breakout', 'sideways_bb_std_mult': 0.7032734894901694, 'sideways_rsi_os': 14, 'sideways_rsi_ob': 82, 'sideways_adx_thresh': 27.961781790260773, 'sideways_atr_min_pct': 0.018639320469433857, 'sideways_atr_max_pct': 0.08283767998072253, 'sideways_tp_mult': 1.5329265179398843, 'sideways_tsl_mult': 0.19188981931635413, 'sideways_time_stop': 250, 'sideways_use_sma': True, 'sideways_use_ema': False, 'sideways_use_atr': True, 'sideways_use_adx': False, 'sideways_use_spike': True, 'sideways_rsi_required': False}.
