[I 2025-08-30 15:19:20,822] Trial 422 finished with values: [-1000000000.0, 1000000000.0] and parameters: {'p_sma': 5, 'p_std': 21, 'p_atr': 14, 'p_adx': 25, 'rsi_period': 71, 'ema1': 30, 'ema2': 46, 'slip_atr_k': 0.16401775625662954, 'slip_spread_k': 0.07665000834865884, 'spread_hl_frac': 0.026812507164620133, 'bb_std_mult': 0.86279581228871, 'rsi_os': 24, 'rsi_ob': 83, 'vol_spike': 0.17023739445472624, 'adx_thresh': 12.415743168207015, 'atr_min_pct': 0.013053471894795735, 'atr_max_pct': 0.07530516372151033, 'tp_mult': 1.794494265561683, 'tsl_mult': 0.6967024287309074, 'strategy': 'breakout', 'time_stop': 137, 'use_sma': False, 'use_atr': True, 'use_adx': False, 'use_ema': True, 'use_spike': True, 'rsi_required': True, 'edge_k': 0.0015306643801124842, 'edge_cap': 0.9374343846709928, 'bull_strategy': 'mean_reversion', 'bull_bb_std_mult': 3.0213757978212423, 'bull_rsi_os': 39, 'bull_rsi_ob': 51, 'bull_adx_thresh': 22.326245032391316, 'bull_atr_min_pct': 0.023080865469344618, 'bull_atr_max_pct': 0.05552332145127355, 'bull_tp_mult': 2.117709810635689, 'bull_tsl_mult': 0.4065243351233201, 'bull_time_stop': 169, 'bull_use_sma': False, 'bull_use_ema': False, 'bull_use_atr': False, 'bull_use_adx': False, 'bull_use_spike': True, 'bull_rsi_required': False, 'bear_strategy': 'mean_reversion', 'bear_bb_std_mult': 0.6173083976608642, 'bear_rsi_os': 31, 'bear_rsi_ob': 58, 'bear_adx_thresh': 28.559617931056508, 'bear_atr_min_pct': 0.0247052348041071, 'bear_atr_max_pct': 0.07836366524634715, 'bear_tp_mult': 1.5874133728230333, 'bear_tsl_mult': 0.9437109452389827, 'bear_time_stop': 56, 'bear_use_sma': True, 'bear_use_ema': True, 'bear_use_atr': True, 'bear_use_adx': False, 'bear_use_spike': False, 'bear_rsi_required': True, 'sideways_strategy': 'breakout', 'sideways_bb_std_mult': 0.6939427683385155, 'sideways_rsi_os': 44, 'sideways_rsi_ob': 57, 'sideways_adx_thresh': 27.498116995502276, 'sideways_atr_min_pct': 0.01294884692682129, 'sideways_atr_max_pct': 0.10098639229717114, 'sideways_tp_mult': 2.483825420340906, 'sideways_tsl_mult': 0.9733199093547921, 'sideways_time_stop': 109, 'sideways_use_sma': True, 'sideways_use_ema': True, 'sideways_use_atr': True, 'sideways_use_adx': False, 'sideways_use_spike': True, 'sideways_rsi_required': False}.
[I 2025-08-30 15:19:21,921] Trial 424 finished with values: [-0.010019447079450905, 0.010038636675456835] and parameters: {'p_sma': 7, 'p_std': 38, 'p_atr': 30, 'p_adx': 25, 'rsi_period': 30, 'ema1': 15, 'ema2': 36, 'slip_atr_k': 0.06953947414490919, 'slip_spread_k': 0.14129530629353934, 'spread_hl_frac': 0.025110403257618836, 'bb_std_mult': 0.9253206427391314, 'rsi_os': 24, 'rsi_ob': 73, 'vol_spike': 0.18840466889795582, 'adx_thresh': 13.443718737453953, 'atr_min_pct': 0.010711586995853156, 'atr_max_pct': 0.07696672697775203, 'tp_mult': 1.8023764426547209, 'tsl_mult': 0.607884642088871, 'strategy': 'breakout', 'time_stop': 140, 'use_sma': False, 'use_atr': True, 'use_adx': False, 'use_ema': True, 'use_spike': True, 'rsi_required': True, 'edge_k': 0.03023382952394643, 'edge_cap': 0.5689872362031775, 'bull_strategy': 'mean_reversion', 'bull_bb_std_mult': 3.0317039387432514, 'bull_rsi_os': 39, 'bull_rsi_ob': 49, 'bull_adx_thresh': 22.12936614010615, 'bull_atr_min_pct': 0.015860633801207863, 'bull_atr_max_pct': 0.0697741555783481, 'bull_tp_mult': 2.083568784596071, 'bull_tsl_mult': 0.21725274850259382, 'bull_time_stop': 194, 'bull_use_sma': True, 'bull_use_ema': True, 'bull_use_atr': False, 'bull_use_adx': False, 'bull_use_spike': True, 'bull_rsi_required': False, 'bear_strategy': 'mean_reversion', 'bear_bb_std_mult': 0.6172565833576623, 'bear_rsi_os': 26, 'bear_rsi_ob': 78, 'bear_adx_thresh': 29.354219155224577, 'bear_atr_min_pct': 0.020808563377744612, 'bear_atr_max_pct': 0.0786320375034581, 'bear_tp_mult': 1.5284134363842867, 'bear_tsl_mult': 0.9489310443324896, 'bear_time_stop': 183, 'bear_use_sma': True, 'bear_use_ema': True, 'bear_use_atr': True, 'bear_use_adx': True, 'bear_use_spike': False, 'bear_rsi_required': True, 'sideways_strategy': 'breakout', 'sideways_bb_std_mult': 0.6652379969174935, 'sideways_rsi_os': 43, 'sideways_rsi_ob': 56, 'sideways_adx_thresh': 28.4951484754362, 'sideways_atr_min_pct': 0.0013913817626914132, 'sideways_atr_max_pct': 0.10403980790816027, 'sideways_tp_mult': 2.4913921442953595, 'sideways_tsl_mult': 0.9940189706536124, 'sideways_time_stop': 115, 'sideways_use_sma': True, 'sideways_use_ema': True, 'sideways_use_atr': True, 'sideways_use_adx': False, 'sideways_use_spike': True, 'sideways_rsi_required': False}.
[I 2025-08-30 15:19:22,696] Trial 425 finished with values: [-1000000000.0, 1000000000.0] and parameters: {'p_sma': 6, 'p_std': 36, 'p_atr': 28, 'p_adx': 25, 'rsi_period': 78, 'ema1': 21, 'ema2': 38, 'slip_atr_k': 0.12788139551544095, 'slip_spread_k': 0.13889173163435936, 'spread_hl_frac': 0.025335409521237962, 'bb_std_mult': 0.8634107293185469, 'rsi_os': 14, 'rsi_ob': 45, 'vol_spike': 0.1712421173607437, 'adx_thresh': 13.162762359982256, 'atr_min_pct': 0.010868849089014462, 'atr_max_pct': 0.07644116064214097, 'tp_mult': 1.8273985895907894, 'tsl_mult': 0.7940931880608592, 'strategy': 'breakout', 'time_stop': 142, 'use_sma': False, 'use_atr': True, 'use_adx': False, 'use_ema': True, 'use_spike': True, 'rsi_required': True, 'edge_k': 0.0060081901478410416, 'edge_cap': 0.5714279706795143, 'bull_strategy': 'mean_reversion', 'bull_bb_std_mult': 2.6050028569512196, 'bull_rsi_os': 40, 'bull_rsi_ob': 49, 'bull_adx_thresh': 22.05378028537842, 'bull_atr_min_pct': 0.018035946924493, 'bull_atr_max_pct': 0.07016277435793003, 'bull_tp_mult': 2.0672243009258593, 'bull_tsl_mult': 0.24817741062862483, 'bull_time_stop': 213, 'bull_use_sma': True, 'bull_use_ema': True, 'bull_use_atr': False, 'bull_use_adx': False, 'bull_use_spike': True, 'bull_rsi_required': False, 'bear_strategy': 'mean_reversion', 'bear_bb_std_mult': 0.6258395304685508, 'bear_rsi_os': 31, 'bear_rsi_ob': 85, 'bear_adx_thresh': 6.2764852129376045, 'bear_atr_min_pct': 0.02093126220956598, 'bear_atr_max_pct': 0.07883261231712797, 'bear_tp_mult': 1.5383746783069543, 'bear_tsl_mult': 0.9112399349222553, 'bear_time_stop': 59, 'bear_use_sma': True, 'bear_use_ema': True, 'bear_use_atr': True, 'bear_use_adx': True, 'bear_use_spike': False, 'bear_rsi_required': True, 'sideways_strategy': 'breakout', 'sideways_bb_std_mult': 1.2227606396214958, 'sideways_rsi_os': 43, 'sideways_rsi_ob': 56, 'sideways_adx_thresh': 27.993599371198897, 'sideways_atr_min_pct': 0.010880688924240588, 'sideways_atr_max_pct': 0.10018111060646183, 'sideways_tp_mult': 2.489641093703625, 'sideways_tsl_mult': 0.9958778551311397, 'sideways_time_stop': 86, 'sideways_use_sma': True, 'sideways_use_ema': True, 'sideways_use_atr': True, 'sideways_use_adx': False, 'sideways_use_spike': True, 'sideways_rsi_required': False}.
[I 2025-08-30 15:20:11,225] Trial 426 finished with values: [-1000000000.0, 1000000000.0] and parameters: {'p_sma': 7, 'p_std': 59, 'p_atr': 30, 'p_adx': 25, 'rsi_period': 78, 'ema1': 30, 'ema2': 38, 'slip_atr_k': 0.07056403770174992, 'slip_spread_k': 0.1352734219831517, 'spread_hl_frac': 0.024961727667038292, 'bb_std_mult': 1.5438918796181496, 'rsi_os': 43, 'rsi_ob': 73, 'vol_spike': 0.189220227160748, 'adx_thresh': 17.17917285143243, 'atr_min_pct': 0.013709884440022016, 'atr_max_pct': 0.0806435426297803, 'tp_mult': 1.8004141388397281, 'tsl_mult': 0.4408932988636381, 'strategy': 'breakout', 'time_stop': 173, 'use_sma': False, 'use_atr': True, 'use_adx': False, 'use_ema': True, 'use_spike': True, 'rsi_required': True, 'edge_k': 0.11028510400096991, 'edge_cap': 0.8938252705168243, 'bull_strategy': 'mean_reversion', 'bull_bb_std_mult': 3.0224289737981698, 'bull_rsi_os': 40, 'bull_rsi_ob': 49, 'bull_adx_thresh': 22.05136588760707, 'bull_atr_min_pct': 0.013627219597322361, 'bull_atr_max_pct': 0.13860164150685642, 'bull_tp_mult': 2.077494826581108, 'bull_tsl_mult': 0.17066226189057637, 'bull_time_stop': 194, 'bull_use_sma': True, 'bull_use_ema': True, 'bull_use_atr': False, 'bull_use_adx': False, 'bull_use_spike': True, 'bull_rsi_required': False, 'bear_strategy': 'mean_reversion', 'bear_bb_std_mult': 0.704964183363477, 'bear_rsi_os': 26, 'bear_rsi_ob': 77, 'bear_adx_thresh': 27.32031249281055, 'bear_atr_min_pct': 0.02724180283507107, 'bear_atr_max_pct': 0.06445775525514746, 'bear_tp_mult': 1.5497754217127546, 'bear_tsl_mult': 0.9469866181987519, 'bear_time_stop': 265, 'bear_use_sma': True, 'bear_use_ema': True, 'bear_use_atr': True, 'bear_use_adx': True, 'bear_use_spike': False, 'bear_rsi_required': True, 'sideways_strategy': 'mean_reversion', 'sideways_bb_std_mult': 1.2941117126129593, 'sideways_rsi_os': 43, 'sideways_rsi_ob': 84, 'sideways_adx_thresh': 28.607713885372252, 'sideways_atr_min_pct': 0.011169231856661497, 'sideways_atr_max_pct': 0.10435857563663228, 'sideways_tp_mult': 2.4162981613588355, 'sideways_tsl_mult': 0.9919852940645565, 'sideways_time_stop': 49, 'sideways_use_sma': True, 'sideways_use_ema': True, 'sideways_use_atr': True, 'sideways_use_adx': False, 'sideways_use_spike': True, 'sideways_rsi_required': False}.
[I 2025-08-30 15:20:13,064] Trial 427 finished with values: [-1000000000.0, 1000000000.0] and parameters: {'p_sma': 7, 'p_std': 58, 'p_atr': 22, 'p_adx': 25, 'rsi_period': 30, 'ema1': 30, 'ema2': 42, 'slip_atr_k': 0.12833229463243384, 'slip_spread_k': 0.13981047394958834, 'spread_hl_frac': 0.02503261081108074, 'bb_std_mult': 0.5666404379877243, 'rsi_os': 24, 'rsi_ob': 73, 'vol_spike': 0.19182021625846638, 'adx_thresh': 16.88745197253544, 'atr_min_pct': 0.013926455719126787, 'atr_max_pct': 0.08114162447518569, 'tp_mult': 1.8189800936657021, 'tsl_mult': 0.44599138653328396, 'strategy': 'breakout', 'time_stop': 132, 'use_sma': False, 'use_atr': True, 'use_adx': False, 'use_ema': True, 'use_spike': True, 'rsi_required': True, 'edge_k': 0.12098927737322243, 'edge_cap': 0.18224923974921392, 'bull_strategy': 'mean_reversion', 'bull_bb_std_mult': 2.6583304769962792, 'bull_rsi_os': 40, 'bull_rsi_ob': 50, 'bull_adx_thresh': 20.792892199054794, 'bull_atr_min_pct': 0.024518891696913556, 'bull_atr_max_pct': 0.06893264672922049, 'bull_tp_mult': 2.0574441455100025, 'bull_tsl_mult': 0.21047422598875748, 'bull_time_stop': 226, 'bull_use_sma': True, 'bull_use_ema': True, 'bull_use_atr': False, 'bull_use_adx': False, 'bull_use_spike': True, 'bull_rsi_required': False, 'bear_strategy': 'mean_reversion', 'bear_bb_std_mult': 0.7928300323759379, 'bear_rsi_os': 26, 'bear_rsi_ob': 78, 'bear_adx_thresh': 27.31405247409648, 'bear_atr_min_pct': 0.020709944592237385, 'bear_atr_max_pct': 0.06568018218431881, 'bear_tp_mult': 1.5300756011841987, 'bear_tsl_mult': 0.951484951698211, 'bear_time_stop': 182, 'bear_use_sma': True, 'bear_use_ema': True, 'bear_use_atr': True, 'bear_use_adx': True, 'bear_use_spike': False, 'bear_rsi_required': True, 'sideways_strategy': 'mean_reversion', 'sideways_bb_std_mult': 0.5654479609004028, 'sideways_rsi_os': 43, 'sideways_rsi_ob': 66, 'sideways_adx_thresh': 28.35800939829037, 'sideways_atr_min_pct': 0.011022684114497753, 'sideways_atr_max_pct': 0.10397953745284488, 'sideways_tp_mult': 2.4158906840819965, 'sideways_tsl_mult': 0.999171338035221, 'sideways_time_stop': 77, 'sideways_use_sma': True, 'sideways_use_ema': True, 'sideways_use_atr': True, 'sideways_use_adx': False, 'sideways_use_spike': True, 'sideways_rsi_required': False}.
[I 2025-08-30 15:20:13,994] Trial 429 finished with values: [-1000000000.0, 1000000000.0] and parameters: {'p_sma': 7, 'p_std': 38, 'p_atr': 15, 'p_adx': 25, 'rsi_period': 26, 'ema1': 30, 'ema2': 36, 'slip_atr_k': 0.06958273197725441, 'slip_spread_k': 0.11100558843834728, 'spread_hl_frac': 0.02474542614785405, 'bb_std_mult': 0.5868746333145909, 'rsi_os': 24, 'rsi_ob': 85, 'vol_spike': 0.18957514777703474, 'adx_thresh': 16.500781276903222, 'atr_min_pct': 0.007351423925348125, 'atr_max_pct': 0.012884241408800526, 'tp_mult': 1.7422869630551432, 'tsl_mult': 0.8550260924089351, 'strategy': 'breakout', 'time_stop': 171, 'use_sma': False, 'use_atr': True, 'use_adx': False, 'use_ema': True, 'use_spike': True, 'rsi_required': True, 'edge_k': 0.2736134698997733, 'edge_cap': 0.07426721517923524, 'bull_strategy': 'mean_reversion', 'bull_bb_std_mult': 2.2737367819700514, 'bull_rsi_os': 41, 'bull_rsi_ob': 49, 'bull_adx_thresh': 21.947093869929965, 'bull_atr_min_pct': 0.027653192065692903, 'bull_atr_max_pct': 0.059822275289946915, 'bull_tp_mult': 2.1838107326136376, 'bull_tsl_mult': 0.22029972033454454, 'bull_time_stop': 161, 'bull_use_sma': False, 'bull_use_ema': True, 'bull_use_atr': False, 'bull_use_adx': False, 'bull_use_spike': True, 'bull_rsi_required': False, 'bear_strategy': 'mean_reversion', 'bear_bb_std_mult': 0.7879883014327351, 'bear_rsi_os': 27, 'bear_rsi_ob': 77, 'bear_adx_thresh': 27.160517961264137, 'bear_atr_min_pct': 0.022147955610147887, 'bear_atr_max_pct': 0.06396071961279762, 'bear_tp_mult': 1.7233875389357247, 'bear_tsl_mult': 0.9512729573038499, 'bear_time_stop': 227, 'bear_use_sma': True, 'bear_use_ema': True, 'bear_use_atr': True, 'bear_use_adx': True, 'bear_use_spike': False, 'bear_rsi_required': True, 'sideways_strategy': 'mean_reversion', 'sideways_bb_std_mult': 2.3725252722528265, 'sideways_rsi_os': 43, 'sideways_rsi_ob': 82, 'sideways_adx_thresh': 28.48719558393605, 'sideways_atr_min_pct': 0.0015661964479917055, 'sideways_atr_max_pct': 0.10424185119003222, 'sideways_tp_mult': 2.5780920685905615, 'sideways_tsl_mult': 0.9933293400046984, 'sideways_time_stop': 50, 'sideways_use_sma': True, 'sideways_use_ema': True, 'sideways_use_atr': True, 'sideways_use_adx': False, 'sideways_use_spike': True, 'sideways_rsi_required': False}.
[I 2025-08-30 15:20:14,491] Trial 428 finished with values: [-1000000000.0, 1000000000.0] and parameters: {'p_sma': 7, 'p_std': 58, 'p_atr': 30, 'p_adx': 25, 'rsi_period': 77, 'ema1': 30, 'ema2': 38, 'slip_atr_k': 0.07150105980444611, 'slip_spread_k': 0.14528784871466974, 'spread_hl_frac': 0.024945147120907993, 'bb_std_mult': 1.5859649948411199, 'rsi_os': 48, 'rsi_ob': 73, 'vol_spike': 0.008804306636204379, 'adx_thresh': 11.590378291799317, 'atr_min_pct': 0.01385152693405817, 'atr_max_pct': 0.08016421576946903, 'tp_mult': 1.7483051691747893, 'tsl_mult': 0.6009071701516683, 'strategy': 'breakout', 'time_stop': 74, 'use_sma': False, 'use_atr': True, 'use_adx': False, 'use_ema': True, 'use_spike': True, 'rsi_required': True, 'edge_k': 0.17680187891881016, 'edge_cap': 0.06321391941781618, 'bull_strategy': 'mean_reversion', 'bull_bb_std_mult': 2.266730616510184, 'bull_rsi_os': 41, 'bull_rsi_ob': 49, 'bull_adx_thresh': 22.05986403344557, 'bull_atr_min_pct': 0.018046656723838872, 'bull_atr_max_pct': 0.046156066207996886, 'bull_tp_mult': 2.0669201749087316, 'bull_tsl_mult': 0.16206984184793358, 'bull_time_stop': 164, 'bull_use_sma': True, 'bull_use_ema': True, 'bull_use_atr': False, 'bull_use_adx': False, 'bull_use_spike': True, 'bull_rsi_required': False, 'bear_strategy': 'mean_reversion', 'bear_bb_std_mult': 0.7873659395407364, 'bear_rsi_os': 26, 'bear_rsi_ob': 85, 'bear_adx_thresh': 6.321568270924974, 'bear_atr_min_pct': 0.02174411477545771, 'bear_atr_max_pct': 0.06396174882269398, 'bear_tp_mult': 1.7208891156962884, 'bear_tsl_mult': 0.9573490890918914, 'bear_time_stop': 149, 'bear_use_sma': True, 'bear_use_ema': True, 'bear_use_atr': True, 'bear_use_adx': True, 'bear_use_spike': False, 'bear_rsi_required': True, 'sideways_strategy': 'mean_reversion', 'sideways_bb_std_mult': 2.590727330760317, 'sideways_rsi_os': 43, 'sideways_rsi_ob': 54, 'sideways_adx_thresh': 28.46607697812475, 'sideways_atr_min_pct': 0.0014773019140656984, 'sideways_atr_max_pct': 0.10378423262168253, 'sideways_tp_mult': 2.4068043946998725, 'sideways_tsl_mult': 0.9960476703053162, 'sideways_time_stop': 87, 'sideways_use_sma': True, 'sideways_use_ema': True, 'sideways_use_atr': True, 'sideways_use_adx': False, 'sideways_use_spike': True, 'sideways_rsi_required': False}.
[I 2025-08-30 15:21:00,998] Trial 430 finished with values: [-1000000000.0, 1000000000.0] and parameters: {'p_sma': 7, 'p_std': 58, 'p_atr': 22, 'p_adx': 25, 'rsi_period': 30, 'ema1': 29, 'ema2': 36, 'slip_atr_k': 0.06974939239322805, 'slip_spread_k': 0.10686087941644959, 'spread_hl_frac': 0.029042230309637547, 'bb_std_mult': 0.5762924431517484, 'rsi_os': 7, 'rsi_ob': 74, 'vol_spike': 0.14068393916669325, 'adx_thresh': 11.606083937113686, 'atr_min_pct': 0.014081757040883103, 'atr_max_pct': 0.08228306130091763, 'tp_mult': 1.7427415448537718, 'tsl_mult': 0.8287428632141873, 'strategy': 'breakout', 'time_stop': 141, 'use_sma': False, 'use_atr': True, 'use_adx': False, 'use_ema': True, 'use_spike': True, 'rsi_required': True, 'edge_k': 0.15704387024696004, 'edge_cap': 0.5433431654383186, 'bull_strategy': 'mean_reversion', 'bull_bb_std_mult': 2.659572314795683, 'bull_rsi_os': 41, 'bull_rsi_ob': 50, 'bull_adx_thresh': 21.816100367795954, 'bull_atr_min_pct': 0.027341849288658418, 'bull_atr_max_pct': 0.060809160432263885, 'bull_tp_mult': 2.170846911188922, 'bull_tsl_mult': 0.33764539017501877, 'bull_time_stop': 161, 'bull_use_sma': False, 'bull_use_ema': False, 'bull_use_atr': False, 'bull_use_adx': False, 'bull_use_spike': True, 'bull_rsi_required': False, 'bear_strategy': 'mean_reversion', 'bear_bb_std_mult': 0.789005293776309, 'bear_rsi_os': 33, 'bear_rsi_ob': 78, 'bear_adx_thresh': 23.50605574420103, 'bear_atr_min_pct': 0.021727918666717968, 'bear_atr_max_pct': 0.07514719826972927, 'bear_tp_mult': 1.634270832683839, 'bear_tsl_mult': 0.9713838698882205, 'bear_time_stop': 72, 'bear_use_sma': True, 'bear_use_ema': True, 'bear_use_atr': True, 'bear_use_adx': False, 'bear_use_spike': False, 'bear_rsi_required': True, 'sideways_strategy': 'mean_reversion', 'sideways_bb_std_mult': 0.5603461738742839, 'sideways_rsi_os': 42, 'sideways_rsi_ob': 73, 'sideways_adx_thresh': 26.838943981409255, 'sideways_atr_min_pct': 0.001484267206379745, 'sideways_atr_max_pct': 0.11452885975039623, 'sideways_tp_mult': 2.579529222185658, 'sideways_tsl_mult': 0.9980321391597465, 'sideways_time_stop': 132, 'sideways_use_sma': True, 'sideways_use_ema': True, 'sideways_use_atr': True, 'sideways_use_adx': False, 'sideways_use_spike': True, 'sideways_rsi_required': False}.
[I 2025-08-30 15:21:01,833] Trial 431 finished with values: [-0.0406942940834113, 0.040677385772440136] and parameters: {'p_sma': 55, 'p_std': 13, 'p_atr': 29, 'p_adx': 8, 'rsi_period': 77, 'ema1': 29, 'ema2': 34, 'slip_atr_k': 0.06986607091231263, 'slip_spread_k': 0.1095632694133262, 'spread_hl_frac': 0.028897434638829815, 'bb_std_mult': 1.7293044543859677, 'rsi_os': 27, 'rsi_ob': 74, 'vol_spike': 0.024036572993553607, 'adx_thresh': 11.50699122098398, 'atr_min_pct': 0.010974161596892835, 'atr_max_pct': 0.12455381967001936, 'tp_mult': 1.7444983055482415, 'tsl_mult': 0.6028664600913262, 'strategy': 'breakout', 'time_stop': 72, 'use_sma': False, 'use_atr': True, 'use_adx': False, 'use_ema': True, 'use_spike': True, 'rsi_required': True, 'edge_k': 0.39367532402781324, 'edge_cap': 0.5445342129803517, 'bull_strategy': 'mean_reversion', 'bull_bb_std_mult': 2.292144957025025, 'bull_rsi_os': 43, 'bull_rsi_ob': 49, 'bull_adx_thresh': 21.900521844223515, 'bull_atr_min_pct': 0.012178685520434888, 'bull_atr_max_pct': 0.05798989150634461, 'bull_tp_mult': 2.203803295528496, 'bull_tsl_mult': 0.2169413556408571, 'bull_time_stop': 162, 'bull_use_sma': False, 'bull_use_ema': False, 'bull_use_atr': False, 'bull_use_adx': False, 'bull_use_spike': True, 'bull_rsi_required': False, 'bear_strategy': 'mean_reversion', 'bear_bb_std_mult': 0.777661097818866, 'bear_rsi_os': 29, 'bear_rsi_ob': 75, 'bear_adx_thresh': 5.337126958391096, 'bear_atr_min_pct': 0.021768657652112625, 'bear_atr_max_pct': 0.06978343634841214, 'bear_tp_mult': 2.294737742272902, 'bear_tsl_mult': 0.9748725096002918, 'bear_time_stop': 224, 'bear_use_sma': True, 'bear_use_ema': True, 'bear_use_atr': True, 'bear_use_adx': False, 'bear_use_spike': False, 'bear_rsi_required': True, 'sideways_strategy': 'breakout', 'sideways_bb_std_mult': 2.3632059015538087, 'sideways_rsi_os': 42, 'sideways_rsi_ob': 54, 'sideways_adx_thresh': 26.762220715396705, 'sideways_atr_min_pct': 0.001570380954845686, 'sideways_atr_max_pct': 0.11444894417322218, 'sideways_tp_mult': 2.551576077111713, 'sideways_tsl_mult': 0.9862245252864382, 'sideways_time_stop': 120, 'sideways_use_sma': True, 'sideways_use_ema': True, 'sideways_use_atr': True, 'sideways_use_adx': False, 'sideways_use_spike': True, 'sideways_rsi_required': False}.
