[I 2025-08-30 14:26:24,822] Trial 47 finished with values: [-0.029185565702437244, 0.029072571113138598] and parameters: {'p_sma': 22, 'p_std': 52, 'p_atr': 7, 'p_adx': 10, 'rsi_period': 69, 'ema1': 5, 'ema2': 16, 'slip_atr_k': 0.1665266900255233, 'slip_spread_k': 0.6906160624980078, 'spread_hl_frac': 0.019906279743353822, 'bb_std_mult': 0.7026253797178368, 'rsi_os': 43, 'rsi_ob': 80, 'vol_spike': 0.16445969732274923, 'adx_thresh': 12.050549559043935, 'atr_min_pct': 0.024429685381872183, 'atr_max_pct': 0.052724460396154936, 'tp_mult': 1.052001569346237, 'tsl_mult': 0.012317799604142421, 'strategy': 'mean_reversion', 'time_stop': 20, 'use_sma': False, 'use_atr': True, 'use_adx': True, 'use_ema': True, 'use_spike': True, 'rsi_required': True, 'edge_k': 1.967676189025899, 'edge_cap': 0.9246529106028007, 'bull_strategy': 'breakout', 'bull_bb_std_mult': 2.295198832537591, 'bull_rsi_os': 7, 'bull_rsi_ob': 61, 'bull_adx_thresh': 17.71822742529602, 'bull_atr_min_pct': 5.064486618895658e-05, 'bull_atr_max_pct': 0.14174269710409393, 'bull_tp_mult': 1.2859420236633219, 'bull_tsl_mult': 0.9077453767427986, 'bull_time_stop': 255, 'bull_use_sma': True, 'bull_use_ema': False, 'bull_use_atr': True, 'bull_use_adx': False, 'bull_use_spike': True, 'bull_rsi_required': True, 'bear_strategy': 'breakout', 'bear_bb_std_mult': 2.439881093287323, 'bear_rsi_os': 5, 'bear_rsi_ob': 45, 'bear_adx_thresh': 17.52687337283595, 'bear_atr_min_pct': 0.017488669080935108, 'bear_atr_max_pct': 0.04107909150327316, 'bear_tp_mult': 1.2593972645928107, 'bear_tsl_mult': 0.6445790828484137, 'bear_time_stop': 110, 'bear_use_sma': True, 'bear_use_ema': True, 'bear_use_atr': False, 'bear_use_adx': False, 'bear_use_spike': False, 'bear_rsi_required': True, 'sideways_strategy': 'mean_reversion', 'sideways_bb_std_mult': 2.859160610208693, 'sideways_rsi_os': 9, 'sideways_rsi_ob': 71, 'sideways_adx_thresh': 24.757176135632825, 'sideways_atr_min_pct': 0.014206111593807748, 'sideways_atr_max_pct': 0.0871996578672925, 'sideways_tp_mult': 1.7825981064201064, 'sideways_tsl_mult': 0.3067033680735516, 'sideways_time_stop': 234, 'sideways_use_sma': True, 'sideways_use_ema': False, 'sideways_use_atr': False, 'sideways_use_adx': True, 'sideways_use_spike': True, 'sideways_rsi_required': True}.
[I 2025-08-30 14:26:24,849] Trial 45 finished with values: [-0.03235019635440728, 0.03224923660805123] and parameters: {'p_sma': 44, 'p_std': 51, 'p_atr': 8, 'p_adx': 17, 'rsi_period': 74, 'ema1': 5, 'ema2': 17, 'slip_atr_k': 0.16312415445905915, 'slip_spread_k': 0.695708095808518, 'spread_hl_frac': 0.005086970749259579, 'bb_std_mult': 0.8048508500524387, 'rsi_os': 8, 'rsi_ob': 81, 'vol_spike': 0.16631817930550757, 'adx_thresh': 34.075305878266484, 'atr_min_pct': 0.02732008050584808, 'atr_max_pct': 0.05261928791234868, 'tp_mult': 1.576319055970786, 'tsl_mult': 0.9220406367865522, 'strategy': 'mean_reversion', 'time_stop': 22, 'use_sma': True, 'use_atr': False, 'use_adx': False, 'use_ema': False, 'use_spike': False, 'rsi_required': True, 'edge_k': 1.2268501809776422, 'edge_cap': 0.6612750630216616, 'bull_strategy': 'mean_reversion', 'bull_bb_std_mult': 3.3788944957752625, 'bull_rsi_os': 6, 'bull_rsi_ob': 61, 'bull_adx_thresh': 15.961401135789028, 'bull_atr_min_pct': 0.0009097537059503267, 'bull_atr_max_pct': 0.13787432653894763, 'bull_tp_mult': 1.3555584984120068, 'bull_tsl_mult': 0.19490472890012256, 'bull_time_stop': 294, 'bull_use_sma': False, 'bull_use_ema': False, 'bull_use_atr': True, 'bull_use_adx': False, 'bull_use_spike': True, 'bull_rsi_required': False, 'bear_strategy': 'breakout', 'bear_bb_std_mult': 2.0645461636305082, 'bear_rsi_os': 5, 'bear_rsi_ob': 65, 'bear_adx_thresh': 28.33134850512893, 'bear_atr_min_pct': 0.017766672229898584, 'bear_atr_max_pct': 0.04226523695775588, 'bear_tp_mult': 1.2361104090224821, 'bear_tsl_mult': 0.6579949431777655, 'bear_time_stop': 107, 'bear_use_sma': True, 'bear_use_ema': False, 'bear_use_atr': False, 'bear_use_adx': False, 'bear_use_spike': True, 'bear_rsi_required': True, 'sideways_strategy': 'mean_reversion', 'sideways_bb_std_mult': 0.7767974149536562, 'sideways_rsi_os': 8, 'sideways_rsi_ob': 69, 'sideways_adx_thresh': 25.00817621527568, 'sideways_atr_min_pct': 0.013737495060925493, 'sideways_atr_max_pct': 0.031193617216670008, 'sideways_tp_mult': 1.73104226648859, 'sideways_tsl_mult': 0.7711457337256702, 'sideways_time_stop': 234, 'sideways_use_sma': True, 'sideways_use_ema': False, 'sideways_use_atr': True, 'sideways_use_adx': False, 'sideways_use_spike': True, 'sideways_rsi_required': False}.
[I 2025-08-30 14:26:24,959] Trial 46 finished with values: [-0.03501261563728253, 0.034911502750018926] and parameters: {'p_sma': 49, 'p_std': 51, 'p_atr': 8, 'p_adx': 10, 'rsi_period': 66, 'ema1': 7, 'ema2': 18, 'slip_atr_k': 0.17031337221556714, 'slip_spread_k': 0.6959496345996041, 'spread_hl_frac': 0.004036634263019532, 'bb_std_mult': 0.7171656688463718, 'rsi_os': 42, 'rsi_ob': 80, 'vol_spike': 0.15695547594727022, 'adx_thresh': 12.19162904573699, 'atr_min_pct': 0.0270794840905168, 'atr_max_pct': 0.056957283147827914, 'tp_mult': 1.5804551623437384, 'tsl_mult': 0.004795820851533239, 'strategy': 'mean_reversion', 'time_stop': 23, 'use_sma': True, 'use_atr': False, 'use_adx': False, 'use_ema': False, 'use_spike': False, 'rsi_required': True, 'edge_k': 1.9737779590688476, 'edge_cap': 0.6692003094314248, 'bull_strategy': 'mean_reversion', 'bull_bb_std_mult': 2.297270473573417, 'bull_rsi_os': 6, 'bull_rsi_ob': 61, 'bull_adx_thresh': 16.331799121418612, 'bull_atr_min_pct': 0.00023733380599252093, 'bull_atr_max_pct': 0.1318597313256677, 'bull_tp_mult': 2.528810772369239, 'bull_tsl_mult': 0.9178208556479126, 'bull_time_stop': 294, 'bull_use_sma': False, 'bull_use_ema': False, 'bull_use_atr': True, 'bull_use_adx': False, 'bull_use_spike': True, 'bull_rsi_required': False, 'bear_strategy': 'breakout', 'bear_bb_std_mult': 2.101525953447331, 'bear_rsi_os': 50, 'bear_rsi_ob': 65, 'bear_adx_thresh': 17.786764064869093, 'bear_atr_min_pct': 0.01759356103570465, 'bear_atr_max_pct': 0.037676495961245504, 'bear_tp_mult': 1.3043489943344377, 'bear_tsl_mult': 0.6909346956886939, 'bear_time_stop': 101, 'bear_use_sma': True, 'bear_use_ema': False, 'bear_use_atr': False, 'bear_use_adx': False, 'bear_use_spike': True, 'bear_rsi_required': True, 'sideways_strategy': 'mean_reversion', 'sideways_bb_std_mult': 2.8947642718108484, 'sideways_rsi_os': 9, 'sideways_rsi_ob': 69, 'sideways_adx_thresh': 24.903469934095135, 'sideways_atr_min_pct': 0.013549012040972568, 'sideways_atr_max_pct': 0.011282783602460933, 'sideways_tp_mult': 1.746103869786737, 'sideways_tsl_mult': 0.49543897055473135, 'sideways_time_stop': 239, 'sideways_use_sma': True, 'sideways_use_ema': False, 'sideways_use_atr': True, 'sideways_use_adx': False, 'sideways_use_spike': True, 'sideways_rsi_required': False}.
[I 2025-08-30 14:26:25,254] Trial 48 finished with values: [-1000000000.0, 1000000000.0] and parameters: {'p_sma': 22, 'p_std': 23, 'p_atr': 8, 'p_adx': 17, 'rsi_period': 81, 'ema1': 5, 'ema2': 60, 'slip_atr_k': 0.19366881701488547, 'slip_spread_k': 0.8536607983504874, 'spread_hl_frac': 0.03563043260210935, 'bb_std_mult': 0.7498943828615988, 'rsi_os': 22, 'rsi_ob': 50, 'vol_spike': 0.0920840925970959, 'adx_thresh': 8.596743810558468, 'atr_min_pct': 0.024976175538511693, 'atr_max_pct': 0.05626460631820275, 'tp_mult': 1.0386071514412705, 'tsl_mult': 0.6370105071649201, 'strategy': 'mean_reversion', 'time_stop': 104, 'use_sma': True, 'use_atr': True, 'use_adx': True, 'use_ema': True, 'use_spike': True, 'rsi_required': True, 'edge_k': 1.786425105590853, 'edge_cap': 0.6184639719793193, 'bull_strategy': 'breakout', 'bull_bb_std_mult': 3.4844784161209312, 'bull_rsi_os': 23, 'bull_rsi_ob': 62, 'bull_adx_thresh': 7.119427263225431, 'bull_atr_min_pct': 0.013437727113071396, 'bull_atr_max_pct': 0.13597532227036035, 'bull_tp_mult': 2.5295787423026033, 'bull_tsl_mult': 0.1678837764119297, 'bull_time_stop': 5, 'bull_use_sma': True, 'bull_use_ema': False, 'bull_use_atr': True, 'bull_use_adx': False, 'bull_use_spike': True, 'bull_rsi_required': False, 'bear_strategy': 'breakout', 'bear_bb_std_mult': 2.0623177737975604, 'bear_rsi_os': 22, 'bear_rsi_ob': 65, 'bear_adx_thresh': 28.872929285067507, 'bear_atr_min_pct': 0.013415587495496695, 'bear_atr_max_pct': 0.086210509480654, 'bear_tp_mult': 2.7910899392963664, 'bear_tsl_mult': 0.6659918834084586, 'bear_time_stop': 291, 'bear_use_sma': True, 'bear_use_ema': True, 'bear_use_atr': False, 'bear_use_adx': False, 'bear_use_spike': True, 'bear_rsi_required': True, 'sideways_strategy': 'mean_reversion', 'sideways_bb_std_mult': 3.0046755621018217, 'sideways_rsi_os': 40, 'sideways_rsi_ob': 71, 'sideways_adx_thresh': 26.707293933131886, 'sideways_atr_min_pct': 0.014746482505276312, 'sideways_atr_max_pct': 0.011290157824968514, 'sideways_tp_mult': 1.730468017477945, 'sideways_tsl_mult': 0.7755001316973735, 'sideways_time_stop': 5, 'sideways_use_sma': True, 'sideways_use_ema': True, 'sideways_use_atr': False, 'sideways_use_adx': True, 'sideways_use_spike': True, 'sideways_rsi_required': True}.
[I 2025-08-30 14:26:56,944] Trial 50 finished with values: [-1000000000.0, 1000000000.0] and parameters: {'p_sma': 59, 'p_std': 23, 'p_atr': 15, 'p_adx': 7, 'rsi_period': 40, 'ema1': 11, 'ema2': 49, 'slip_atr_k': 0.1088903237369255, 'slip_spread_k': 0.004734481869394069, 'spread_hl_frac': 0.03582859702011944, 'bb_std_mult': 2.5722882288853537, 'rsi_os': 22, 'rsi_ob': 51, 'vol_spike': 0.09385342176567422, 'adx_thresh': 27.22220165174027, 'atr_min_pct': 0.013815809404925142, 'atr_max_pct': 0.016920306901449328, 'tp_mult': 1.9134256147933257, 'tsl_mult': 0.6394356437509816, 'strategy': 'breakout', 'time_stop': 105, 'use_sma': True, 'use_atr': True, 'use_adx': True, 'use_ema': True, 'use_spike': True, 'rsi_required': True, 'edge_k': 0.923581634107084, 'edge_cap': 0.5108240269753377, 'bull_strategy': 'breakout', 'bull_bb_std_mult': 3.0165445854147506, 'bull_rsi_os': 24, 'bull_rsi_ob': 45, 'bull_adx_thresh': 7.511920193265304, 'bull_atr_min_pct': 0.003949246620264763, 'bull_atr_max_pct': 0.06347706188278725, 'bull_tp_mult': 2.0255324166195408, 'bull_tsl_mult': 0.14460937890165315, 'bull_time_stop': 205, 'bull_use_sma': True, 'bull_use_ema': True, 'bull_use_atr': False, 'bull_use_adx': False, 'bull_use_spike': False, 'bull_rsi_required': False, 'bear_strategy': 'mean_reversion', 'bear_bb_std_mult': 2.623353630615375, 'bear_rsi_os': 22, 'bear_rsi_ob': 69, 'bear_adx_thresh': 33.30911620329692, 'bear_atr_min_pct': 0.005612567715967583, 'bear_atr_max_pct': 0.09037059602511148, 'bear_tp_mult': 2.81578384527844, 'bear_tsl_mult': 0.3702280012826654, 'bear_time_stop': 215, 'bear_use_sma': True, 'bear_use_ema': True, 'bear_use_atr': True, 'bear_use_adx': True, 'bear_use_spike': True, 'bear_rsi_required': False, 'sideways_strategy': 'mean_reversion', 'sideways_bb_std_mult': 1.4662135795363578, 'sideways_rsi_os': 37, 'sideways_rsi_ob': 77, 'sideways_adx_thresh': 27.299537057076947, 'sideways_atr_min_pct': 0.012197024174358953, 'sideways_atr_max_pct': 0.12870338061397857, 'sideways_tp_mult': 1.2215890626342414, 'sideways_tsl_mult': 0.279389316617081, 'sideways_time_stop': 137, 'sideways_use_sma': False, 'sideways_use_ema': True, 'sideways_use_atr': False, 'sideways_use_adx': True, 'sideways_use_spike': False, 'sideways_rsi_required': True}.
[I 2025-08-30 14:26:57,116] Trial 49 finished with values: [-1000000000.0, 1000000000.0] and parameters: {'p_sma': 50, 'p_std': 22, 'p_atr': 21, 'p_adx': 23, 'rsi_period': 43, 'ema1': 20, 'ema2': 43, 'slip_atr_k': 0.19260725407453216, 'slip_spread_k': 0.7969362343921742, 'spread_hl_frac': 0.0355722902114392, 'bb_std_mult': 2.5877671334103303, 'rsi_os': 19, 'rsi_ob': 90, 'vol_spike': 0.2510678367804761, 'adx_thresh': 8.2397815280816, 'atr_min_pct': 0.013855605956448195, 'atr_max_pct': 0.08297931150791077, 'tp_mult': 1.6048362112191208, 'tsl_mult': 0.6257688566075279, 'strategy': 'breakout', 'time_stop': 111, 'use_sma': True, 'use_atr': True, 'use_adx': True, 'use_ema': True, 'use_spike': True, 'rsi_required': True, 'edge_k': 0.9240990034712542, 'edge_cap': 0.2720381179565753, 'bull_strategy': 'breakout', 'bull_bb_std_mult': 3.5020059871709277, 'bull_rsi_os': 23, 'bull_rsi_ob': 53, 'bull_adx_thresh': 10.168764527137776, 'bull_atr_min_pct': 0.003990674675189202, 'bull_atr_max_pct': 0.13126845667400996, 'bull_tp_mult': 2.5492513844417815, 'bull_tsl_mult': 0.9401478457944048, 'bull_time_stop': 210, 'bull_use_sma': True, 'bull_use_ema': True, 'bull_use_atr': False, 'bull_use_adx': False, 'bull_use_spike': False, 'bull_rsi_required': False, 'bear_strategy': 'mean_reversion', 'bear_bb_std_mult': 1.7396811401912724, 'bear_rsi_os': 22, 'bear_rsi_ob': 68, 'bear_adx_thresh': 29.93967386427002, 'bear_atr_min_pct': 0.006566456948845927, 'bear_atr_max_pct': 0.08715784970642033, 'bear_tp_mult': 2.781152121809426, 'bear_tsl_mult': 0.36481784075423906, 'bear_time_stop': 297, 'bear_use_sma': True, 'bear_use_ema': True, 'bear_use_atr': True, 'bear_use_adx': True, 'bear_use_spike': True, 'bear_rsi_required': False, 'sideways_strategy': 'mean_reversion', 'sideways_bb_std_mult': 1.4724241283603008, 'sideways_rsi_os': 39, 'sideways_rsi_ob': 77, 'sideways_adx_thresh': 26.9943824454447, 'sideways_atr_min_pct': 0.01253645215941698, 'sideways_atr_max_pct': 0.012315022998425615, 'sideways_tp_mult': 2.6682012873426295, 'sideways_tsl_mult': 0.4769978451897418, 'sideways_time_stop': 15, 'sideways_use_sma': False, 'sideways_use_ema': True, 'sideways_use_atr': False, 'sideways_use_adx': True, 'sideways_use_spike': False, 'sideways_rsi_required': True}.
[I 2025-08-30 14:26:57,471] Trial 51 finished with values: [-1000000000.0, 1000000000.0] and parameters: {'p_sma': 34, 'p_std': 13, 'p_atr': 20, 'p_adx': 7, 'rsi_period': 40, 'ema1': 11, 'ema2': 60, 'slip_atr_k': 0.19185102168855556, 'slip_spread_k': 0.8137409394803576, 'spread_hl_frac': 0.03572797915649446, 'bb_std_mult': 2.5449514373690247, 'rsi_os': 19, 'rsi_ob': 89, 'vol_spike': 0.09268239796759932, 'adx_thresh': 8.647179840908251, 'atr_min_pct': 0.013968620918926916, 'atr_max_pct': 0.017199413679455003, 'tp_mult': 1.9342340378966805, 'tsl_mult': 0.6449453513146167, 'strategy': 'breakout', 'time_stop': 120, 'use_sma': True, 'use_atr': True, 'use_adx': True, 'use_ema': True, 'use_spike': True, 'rsi_required': True, 'edge_k': 0.9468122893385812, 'edge_cap': 0.5161955091213074, 'bull_strategy': 'breakout', 'bull_bb_std_mult': 3.024421920130241, 'bull_rsi_os': 23, 'bull_rsi_ob': 54, 'bull_adx_thresh': 8.730429594959265, 'bull_atr_min_pct': 0.010433872440907363, 'bull_atr_max_pct': 0.07577592549933666, 'bull_tp_mult': 2.839558759625502, 'bull_tsl_mult': 0.5013038926615004, 'bull_time_stop': 29, 'bull_use_sma': True, 'bull_use_ema': True, 'bull_use_atr': False, 'bull_use_adx': False, 'bull_use_spike': False, 'bull_rsi_required': False, 'bear_strategy': 'mean_reversion', 'bear_bb_std_mult': 2.597686951461138, 'bear_rsi_os': 22, 'bear_rsi_ob': 68, 'bear_adx_thresh': 30.059632945122647, 'bear_atr_min_pct': 0.006610895856851387, 'bear_atr_max_pct': 0.08812974077728185, 'bear_tp_mult': 2.7612080340206964, 'bear_tsl_mult': 0.3730947217768671, 'bear_time_stop': 296, 'bear_use_sma': True, 'bear_use_ema': True, 'bear_use_atr': True, 'bear_use_adx': True, 'bear_use_spike': True, 'bear_rsi_required': False, 'sideways_strategy': 'mean_reversion', 'sideways_bb_std_mult': 2.4941396531493285, 'sideways_rsi_os': 37, 'sideways_rsi_ob': 64, 'sideways_adx_thresh': 27.014198368229504, 'sideways_atr_min_pct': 0.011906051814650312, 'sideways_atr_max_pct': 0.12334080178430674, 'sideways_tp_mult': 2.479212654242388, 'sideways_tsl_mult': 0.7836740118211485, 'sideways_time_stop': 5, 'sideways_use_sma': False, 'sideways_use_ema': True, 'sideways_use_atr': False, 'sideways_use_adx': True, 'sideways_use_spike': False, 'sideways_rsi_required': True}.
[I 2025-08-30 14:26:57,618] Trial 52 finished with values: [-1000000000.0, 1000000000.0] and parameters: {'p_sma': 34, 'p_std': 14, 'p_atr': 21, 'p_adx': 7, 'rsi_period': 10, 'ema1': 11, 'ema2': 49, 'slip_atr_k': 0.13780614040881414, 'slip_spread_k': 0.049858420291308714, 'spread_hl_frac': 0.049030483392860064, 'bb_std_mult': 2.5175418298799612, 'rsi_os': 19, 'rsi_ob': 89, 'vol_spike': 0.1903349966627947, 'adx_thresh': 15.495051135265006, 'atr_min_pct': 0.014202273084581298, 'atr_max_pct': 0.08091444293555072, 'tp_mult': 1.9117850443508817, 'tsl_mult': 0.6188267689742392, 'strategy': 'breakout', 'time_stop': 76, 'use_sma': False, 'use_atr': False, 'use_adx': True, 'use_ema': False, 'use_spike': True, 'rsi_required': True, 'edge_k': 0.1847125596660084, 'edge_cap': 0.5171013995333912, 'bull_strategy': 'breakout', 'bull_bb_std_mult': 3.0304060358008873, 'bull_rsi_os': 18, 'bull_rsi_ob': 58, 'bull_adx_thresh': 25.980519948896937, 'bull_atr_min_pct': 0.003885706253893853, 'bull_atr_max_pct': 0.07599532203259889, 'bull_tp_mult': 1.9878667339207217, 'bull_tsl_mult': 0.4998996129810498, 'bull_time_stop': 210, 'bull_use_sma': False, 'bull_use_ema': True, 'bull_use_atr': False, 'bull_use_adx': False, 'bull_use_spike': False, 'bull_rsi_required': True, 'bear_strategy': 'mean_reversion', 'bear_bb_std_mult': 1.7464152891254767, 'bear_rsi_os': 42, 'bear_rsi_ob': 82, 'bear_adx_thresh': 30.528724191562517, 'bear_atr_min_pct': 0.006311104364651132, 'bear_atr_max_pct': 0.09258922239655094, 'bear_tp_mult': 2.4218125008776274, 'bear_tsl_mult': 0.3699209191193029, 'bear_time_stop': 181, 'bear_use_sma': True, 'bear_use_ema': False, 'bear_use_atr': True, 'bear_use_adx': True, 'bear_use_spike': True, 'bear_rsi_required': False, 'sideways_strategy': 'mean_reversion', 'sideways_bb_std_mult': 1.428217916691396, 'sideways_rsi_os': 36, 'sideways_rsi_ob': 64, 'sideways_adx_thresh': 32.54427914449632, 'sideways_atr_min_pct': 0.01080498002696734, 'sideways_atr_max_pct': 0.12518685556196923, 'sideways_tp_mult': 2.5415087596965287, 'sideways_tsl_mult': 0.4652204259516669, 'sideways_time_stop': 138, 'sideways_use_sma': False, 'sideways_use_ema': True, 'sideways_use_atr': False, 'sideways_use_adx': True, 'sideways_use_spike': False, 'sideways_rsi_required': True}.
[I 2025-08-30 14:27:30,332] Trial 53 finished with values: [-0.1229395909251707, 0.12332362635584244] and parameters: {'p_sma': 34, 'p_std': 14, 'p_atr': 21, 'p_adx': 23, 'rsi_period': 18, 'ema1': 8, 'ema2': 44, 'slip_atr_k': 0.18696688628964592, 'slip_spread_k': 0.8089692205347347, 'spread_hl_frac': 0.00047834597966660633, 'bb_std_mult': 1.779325491641368, 'rsi_os': 19, 'rsi_ob': 76, 'vol_spike': 0.18694791439668937, 'adx_thresh': 5.658871993716005, 'atr_min_pct': 0.0016590699255136024, 'atr_max_pct': 0.08152120988445899, 'tp_mult': 2.5018782583404886, 'tsl_mult': 0.14950946322434022, 'strategy': 'breakout', 'time_stop': 62, 'use_sma': False, 'use_atr': False, 'use_adx': True, 'use_ema': False, 'use_spike': True, 'rsi_required': True, 'edge_k': 0.14315435298171564, 'edge_cap': 0.26644786623103767, 'bull_strategy': 'breakout', 'bull_bb_std_mult': 1.1852716478449392, 'bull_rsi_os': 40, 'bull_rsi_ob': 54, 'bull_adx_thresh': 26.18151301805023, 'bull_atr_min_pct': 0.007177794425349707, 'bull_atr_max_pct': 0.07695902372307256, 'bull_tp_mult': 2.859813280490112, 'bull_tsl_mult': 0.9543982141244547, 'bull_time_stop': 228, 'bull_use_sma': False, 'bull_use_ema': True, 'bull_use_atr': False, 'bull_use_adx': True, 'bull_use_spike': False, 'bull_rsi_required': True, 'bear_strategy': 'mean_reversion', 'bear_bb_std_mult': 1.6721073167711222, 'bear_rsi_os': 34, 'bear_rsi_ob': 59, 'bear_adx_thresh': 27.251379641913676, 'bear_atr_min_pct': 0.021196046185339025, 'bear_atr_max_pct': 0.10933498252156003, 'bear_tp_mult': 2.438922761132277, 'bear_tsl_mult': 0.0729925427313502, 'bear_time_stop': 24, 'bear_use_sma': True, 'bear_use_ema': False, 'bear_use_atr': True, 'bear_use_adx': True, 'bear_use_spike': True, 'bear_rsi_required': False, 'sideways_strategy': 'mean_reversion', 'sideways_bb_std_mult': 1.386664891274528, 'sideways_rsi_os': 17, 'sideways_rsi_ob': 64, 'sideways_adx_thresh': 32.95370830989696, 'sideways_atr_min_pct': 0.0005656693913701719, 'sideways_atr_max_pct': 0.06713871122081053, 'sideways_tp_mult': 2.4942415208749273, 'sideways_tsl_mult': 0.46666596245114483, 'sideways_time_stop': 295, 'sideways_use_sma': False, 'sideways_use_ema': False, 'sideways_use_atr': False, 'sideways_use_adx': True, 'sideways_use_spike': False, 'sideways_rsi_required': True}.
