[I 2025-08-30 14:25:19,870] Trial 36 finished with values: [-1000000000.0, 1000000000.0] and parameters: {'p_sma': 53, 'p_std': 38, 'p_atr': 23, 'p_adx': 19, 'rsi_period': 23, 'ema1': 6, 'ema2': 55, 'slip_atr_k': 0.20503503967739176, 'slip_spread_k': 0.6387207639902486, 'spread_hl_frac': 0.01229898108081498, 'bb_std_mult': 1.355404354598547, 'rsi_os': 21, 'rsi_ob': 78, 'vol_spike': 0.18407781066292145, 'adx_thresh': 7.068481863174952, 'atr_min_pct': 0.004517112621866862, 'atr_max_pct': 0.04837408538213017, 'tp_mult': 1.2051956478027228, 'tsl_mult': 0.6661927032846456, 'strategy': 'breakout', 'time_stop': 36, 'use_sma': True, 'use_atr': True, 'use_adx': True, 'use_ema': True, 'use_spike': True, 'rsi_required': True, 'edge_k': 1.4695362174177478, 'edge_cap': 0.9972195504768377, 'bull_strategy': 'breakout', 'bull_bb_std_mult': 2.5828452793607912, 'bull_rsi_os': 37, 'bull_rsi_ob': 51, 'bull_adx_thresh': 23.358478212409914, 'bull_atr_min_pct': 0.002698673070093311, 'bull_atr_max_pct': 0.05613433155399068, 'bull_tp_mult': 1.6941423832082647, 'bull_tsl_mult': 0.5576023834995997, 'bull_time_stop': 171, 'bull_use_sma': True, 'bull_use_ema': True, 'bull_use_atr': False, 'bull_use_adx': False, 'bull_use_spike': False, 'bull_rsi_required': False, 'bear_strategy': 'mean_reversion', 'bear_bb_std_mult': 2.7470038731182584, 'bear_rsi_os': 10, 'bear_rsi_ob': 82, 'bear_adx_thresh': 6.288808850601544, 'bear_atr_min_pct': 0.01075615717622473, 'bear_atr_max_pct': 0.07834908989885195, 'bear_tp_mult': 2.346965218841602, 'bear_tsl_mult': 0.30457635669260485, 'bear_time_stop': 247, 'bear_use_sma': True, 'bear_use_ema': False, 'bear_use_atr': True, 'bear_use_adx': True, 'bear_use_spike': True, 'bear_rsi_required': False, 'sideways_strategy': 'mean_reversion', 'sideways_bb_std_mult': 2.0647320825846274, 'sideways_rsi_os': 48, 'sideways_rsi_ob': 58, 'sideways_adx_thresh': 29.044716558567096, 'sideways_atr_min_pct': 0.017808159193243592, 'sideways_atr_max_pct': 0.07416597425057625, 'sideways_tp_mult': 1.7544689209773934, 'sideways_tsl_mult': 0.09319378530488726, 'sideways_time_stop': 152, 'sideways_use_sma': False, 'sideways_use_ema': False, 'sideways_use_atr': False, 'sideways_use_adx': True, 'sideways_use_spike': False, 'sideways_rsi_required': True}.
[I 2025-08-30 14:25:19,985] Trial 39 finished with values: [-1000000000.0, 1000000000.0] and parameters: {'p_sma': 56, 'p_std': 41, 'p_atr': 14, 'p_adx': 12, 'rsi_period': 12, 'ema1': 30, 'ema2': 23, 'slip_atr_k': 0.21154787117863932, 'slip_spread_k': 0.6032095712958975, 'spread_hl_frac': 0.011454113836956907, 'bb_std_mult': 1.4132412044764253, 'rsi_os': 51, 'rsi_ob': 89, 'vol_spike': 0.29675077938770733, 'adx_thresh': 16.57051120622356, 'atr_min_pct': 0.022727602171891088, 'atr_max_pct': 0.04729513135652316, 'tp_mult': 2.091777771158696, 'tsl_mult': 0.7360253505292134, 'strategy': 'breakout', 'time_stop': 8, 'use_sma': True, 'use_atr': False, 'use_adx': True, 'use_ema': False, 'use_spike': True, 'rsi_required': True, 'edge_k': 1.8886604608000501, 'edge_cap': 0.42676859005925993, 'bull_strategy': 'breakout', 'bull_bb_std_mult': 2.5113861131289665, 'bull_rsi_os': 8, 'bull_rsi_ob': 65, 'bull_adx_thresh': 23.195050597742195, 'bull_atr_min_pct': 0.008344855490823585, 'bull_atr_max_pct': 0.1115821998757226, 'bull_tp_mult': 1.5145068965672532, 'bull_tsl_mult': 0.8961168995388872, 'bull_time_stop': 44, 'bull_use_sma': False, 'bull_use_ema': True, 'bull_use_atr': True, 'bull_use_adx': True, 'bull_use_spike': False, 'bull_rsi_required': False, 'bear_strategy': 'mean_reversion', 'bear_bb_std_mult': 2.674234735951484, 'bear_rsi_os': 40, 'bear_rsi_ob': 56, 'bear_adx_thresh': 7.7755815333822085, 'bear_atr_min_pct': 0.01917355380883778, 'bear_atr_max_pct': 0.10453334146242635, 'bear_tp_mult': 2.5347603980371383, 'bear_tsl_mult': 0.8809024636750789, 'bear_time_stop': 214, 'bear_use_sma': True, 'bear_use_ema': False, 'bear_use_atr': True, 'bear_use_adx': False, 'bear_use_spike': True, 'bear_rsi_required': False, 'sideways_strategy': 'mean_reversion', 'sideways_bb_std_mult': 2.117474130114089, 'sideways_rsi_os': 26, 'sideways_rsi_ob': 52, 'sideways_adx_thresh': 18.90865433766274, 'sideways_atr_min_pct': 0.016636829308753657, 'sideways_atr_max_pct': 0.041753585459457565, 'sideways_tp_mult': 1.1537225665097615, 'sideways_tsl_mult': 0.22462162166845068, 'sideways_time_stop': 138, 'sideways_use_sma': True, 'sideways_use_ema': False, 'sideways_use_atr': False, 'sideways_use_adx': True, 'sideways_use_spike': True, 'sideways_rsi_required': True}.
[I 2025-08-30 14:25:20,236] Trial 38 finished with values: [-0.07730992734248288, 0.07708185575260866] and parameters: {'p_sma': 53, 'p_std': 6, 'p_atr': 14, 'p_adx': 19, 'rsi_period': 23, 'ema1': 30, 'ema2': 23, 'slip_atr_k': 0.21617295571901549, 'slip_spread_k': 0.6616184939626437, 'spread_hl_frac': 0.012620737552109717, 'bb_std_mult': 1.3887300614944649, 'rsi_os': 51, 'rsi_ob': 67, 'vol_spike': 0.11536411908888822, 'adx_thresh': 17.748423774631515, 'atr_min_pct': 0.02231738108935069, 'atr_max_pct': 0.05098516545534454, 'tp_mult': 1.1496270234000878, 'tsl_mult': 0.4975389272692976, 'strategy': 'breakout', 'time_stop': 46, 'use_sma': True, 'use_atr': False, 'use_adx': True, 'use_ema': False, 'use_spike': True, 'rsi_required': True, 'edge_k': 0.3633792300764137, 'edge_cap': 0.38434932267926536, 'bull_strategy': 'breakout', 'bull_bb_std_mult': 2.474216952070739, 'bull_rsi_os': 27, 'bull_rsi_ob': 63, 'bull_adx_thresh': 27.256108712343217, 'bull_atr_min_pct': 0.008782525145544303, 'bull_atr_max_pct': 0.10949889297153916, 'bull_tp_mult': 1.5967787813177035, 'bull_tsl_mult': 0.4553753244287301, 'bull_time_stop': 191, 'bull_use_sma': False, 'bull_use_ema': True, 'bull_use_atr': True, 'bull_use_adx': True, 'bull_use_spike': False, 'bull_rsi_required': False, 'bear_strategy': 'mean_reversion', 'bear_bb_std_mult': 1.1707461353186603, 'bear_rsi_os': 34, 'bear_rsi_ob': 56, 'bear_adx_thresh': 9.832331806220074, 'bear_atr_min_pct': 0.0024855801097999827, 'bear_atr_max_pct': 0.11942529162669294, 'bear_tp_mult': 2.541928660873633, 'bear_tsl_mult': 0.16938098026503018, 'bear_time_stop': 248, 'bear_use_sma': True, 'bear_use_ema': False, 'bear_use_atr': True, 'bear_use_adx': False, 'bear_use_spike': True, 'bear_rsi_required': False, 'sideways_strategy': 'mean_reversion', 'sideways_bb_std_mult': 1.9753121677418726, 'sideways_rsi_os': 25, 'sideways_rsi_ob': 53, 'sideways_adx_thresh': 17.579349873571754, 'sideways_atr_min_pct': 0.017174916424695486, 'sideways_atr_max_pct': 0.04204585080561865, 'sideways_tp_mult': 1.4118639129127182, 'sideways_tsl_mult': 0.22580158117845406, 'sideways_time_stop': 159, 'sideways_use_sma': True, 'sideways_use_ema': False, 'sideways_use_atr': False, 'sideways_use_adx': True, 'sideways_use_spike': True, 'sideways_rsi_required': True}.
[I 2025-08-30 14:25:20,369] Trial 37 finished with values: [-1000000000.0, 1000000000.0] and parameters: {'p_sma': 55, 'p_std': 5, 'p_atr': 14, 'p_adx': 19, 'rsi_period': 22, 'ema1': 6, 'ema2': 54, 'slip_atr_k': 0.20841205337752972, 'slip_spread_k': 0.6529272682750237, 'spread_hl_frac': 0.01217464138526801, 'bb_std_mult': 1.360170142132007, 'rsi_os': 28, 'rsi_ob': 66, 'vol_spike': 0.2986355452449039, 'adx_thresh': 24.505511959326338, 'atr_min_pct': 0.022391885020849156, 'atr_max_pct': 0.028287861322269008, 'tp_mult': 1.2034438074689917, 'tsl_mult': 0.7244698687312131, 'strategy': 'breakout', 'time_stop': 35, 'use_sma': True, 'use_atr': True, 'use_adx': True, 'use_ema': True, 'use_spike': True, 'rsi_required': True, 'edge_k': 1.8788395904781343, 'edge_cap': 0.40533868963064057, 'bull_strategy': 'breakout', 'bull_bb_std_mult': 1.5069877719046372, 'bull_rsi_os': 51, 'bull_rsi_ob': 64, 'bull_adx_thresh': 19.214196634467772, 'bull_atr_min_pct': 0.003340847644425696, 'bull_atr_max_pct': 0.11018680407231608, 'bull_tp_mult': 1.5651447723178897, 'bull_tsl_mult': 0.44808822404442555, 'bull_time_stop': 191, 'bull_use_sma': False, 'bull_use_ema': True, 'bull_use_atr': True, 'bull_use_adx': True, 'bull_use_spike': False, 'bull_rsi_required': False, 'bear_strategy': 'mean_reversion', 'bear_bb_std_mult': 2.7540523751971944, 'bear_rsi_os': 9, 'bear_rsi_ob': 57, 'bear_adx_thresh': 10.73556819281588, 'bear_atr_min_pct': 0.01952743665393355, 'bear_atr_max_pct': 0.05914771111496066, 'bear_tp_mult': 2.5247074079825786, 'bear_tsl_mult': 0.30346397030485656, 'bear_time_stop': 129, 'bear_use_sma': True, 'bear_use_ema': False, 'bear_use_atr': True, 'bear_use_adx': False, 'bear_use_spike': True, 'bear_rsi_required': False, 'sideways_strategy': 'mean_reversion', 'sideways_bb_std_mult': 2.1405126611074063, 'sideways_rsi_os': 48, 'sideways_rsi_ob': 58, 'sideways_adx_thresh': 17.591872617711253, 'sideways_atr_min_pct': 0.016121571047334932, 'sideways_atr_max_pct': 0.023861628113833765, 'sideways_tp_mult': 1.385957890207906, 'sideways_tsl_mult': 0.08280685740260424, 'sideways_time_stop': 153, 'sideways_use_sma': True, 'sideways_use_ema': False, 'sideways_use_atr': False, 'sideways_use_adx': True, 'sideways_use_spike': True, 'sideways_rsi_required': True}.
[I 2025-08-30 14:25:52,305] Trial 40 finished with values: [-1000000000.0, 1000000000.0] and parameters: {'p_sma': 56, 'p_std': 44, 'p_atr': 13, 'p_adx': 13, 'rsi_period': 13, 'ema1': 5, 'ema2': 22, 'slip_atr_k': 0.1302183507903894, 'slip_spread_k': 0.5575677522307729, 'spread_hl_frac': 0.039580139742303594, 'bb_std_mult': 1.9235600870049228, 'rsi_os': 48, 'rsi_ob': 66, 'vol_spike': 0.11097519860516114, 'adx_thresh': 16.863689875038794, 'atr_min_pct': 0.022637228698140152, 'atr_max_pct': 0.0907595966586136, 'tp_mult': 2.0436904913009015, 'tsl_mult': 0.48042139011014984, 'strategy': 'breakout', 'time_stop': 8, 'use_sma': True, 'use_atr': False, 'use_adx': True, 'use_ema': False, 'use_spike': True, 'rsi_required': True, 'edge_k': 1.8877421532646488, 'edge_cap': 0.3515347429249116, 'bull_strategy': 'breakout', 'bull_bb_std_mult': 1.5623204207449781, 'bull_rsi_os': 51, 'bull_rsi_ob': 66, 'bull_adx_thresh': 23.64059312530158, 'bull_atr_min_pct': 0.009028465544244475, 'bull_atr_max_pct': 0.04139790165192531, 'bull_tp_mult': 1.5495247919209458, 'bull_tsl_mult': 0.45492891789387263, 'bull_time_stop': 52, 'bull_use_sma': False, 'bull_use_ema': True, 'bull_use_atr': True, 'bull_use_adx': True, 'bull_use_spike': False, 'bull_rsi_required': False, 'bear_strategy': 'mean_reversion', 'bear_bb_std_mult': 0.9939552408137673, 'bear_rsi_os': 38, 'bear_rsi_ob': 56, 'bear_adx_thresh': 9.785951595989564, 'bear_atr_min_pct': 0.01936306742159402, 'bear_atr_max_pct': 0.12497170155893808, 'bear_tp_mult': 2.5061197407665823, 'bear_tsl_mult': 0.12173857283280315, 'bear_time_stop': 139, 'bear_use_sma': True, 'bear_use_ema': False, 'bear_use_atr': True, 'bear_use_adx': False, 'bear_use_spike': True, 'bear_rsi_required': False, 'sideways_strategy': 'mean_reversion', 'sideways_bb_std_mult': 2.284139528358833, 'sideways_rsi_os': 29, 'sideways_rsi_ob': 50, 'sideways_adx_thresh': 18.070236649312257, 'sideways_atr_min_pct': 0.027402783861393942, 'sideways_atr_max_pct': 0.04432147827661525, 'sideways_tp_mult': 1.1546438431745552, 'sideways_tsl_mult': 0.21856805810975122, 'sideways_time_stop': 122, 'sideways_use_sma': True, 'sideways_use_ema': False, 'sideways_use_atr': False, 'sideways_use_adx': True, 'sideways_use_spike': True, 'sideways_rsi_required': True}.
[I 2025-08-30 14:25:52,633] Trial 41 finished with values: [-1000000000.0, 1000000000.0] and parameters: {'p_sma': 14, 'p_std': 44, 'p_atr': 28, 'p_adx': 19, 'rsi_period': 29, 'ema1': 16, 'ema2': 51, 'slip_atr_k': 0.1253886097520386, 'slip_spread_k': 0.5603146124496585, 'spread_hl_frac': 0.040979963828589636, 'bb_std_mult': 2.083417970313299, 'rsi_os': 11, 'rsi_ob': 66, 'vol_spike': 0.1093751414927942, 'adx_thresh': 24.57625580439595, 'atr_min_pct': 0.01687066255794597, 'atr_max_pct': 0.09028114961024765, 'tp_mult': 1.374886753938823, 'tsl_mult': 0.46513404282110615, 'strategy': 'breakout', 'time_stop': 53, 'use_sma': True, 'use_atr': False, 'use_adx': True, 'use_ema': False, 'use_spike': True, 'rsi_required': True, 'edge_k': 0.3518020772311623, 'edge_cap': 0.34540805232795546, 'bull_strategy': 'breakout', 'bull_bb_std_mult': 2.1531757629707013, 'bull_rsi_os': 51, 'bull_rsi_ob': 48, 'bull_adx_thresh': 27.82715037421243, 'bull_atr_min_pct': 0.00672728144900969, 'bull_atr_max_pct': 0.08762244996284754, 'bull_tp_mult': 1.7838076859137304, 'bull_tsl_mult': 0.4403094214098362, 'bull_time_stop': 131, 'bull_use_sma': False, 'bull_use_ema': True, 'bull_use_atr': True, 'bull_use_adx': True, 'bull_use_spike': True, 'bull_rsi_required': False, 'bear_strategy': 'breakout', 'bear_bb_std_mult': 3.3667700321259786, 'bear_rsi_os': 20, 'bear_rsi_ob': 53, 'bear_adx_thresh': 11.181479931698853, 'bear_atr_min_pct': 0.027941990957030607, 'bear_atr_max_pct': 0.059613972738416024, 'bear_tp_mult': 2.188697047095232, 'bear_tsl_mult': 0.481338267715696, 'bear_time_stop': 140, 'bear_use_sma': False, 'bear_use_ema': False, 'bear_use_atr': True, 'bear_use_adx': False, 'bear_use_spike': True, 'bear_rsi_required': True, 'sideways_strategy': 'breakout', 'sideways_bb_std_mult': 1.8923895362979037, 'sideways_rsi_os': 29, 'sideways_rsi_ob': 63, 'sideways_adx_thresh': 13.90943960222922, 'sideways_atr_min_pct': 0.010072304329542089, 'sideways_atr_max_pct': 0.024832440363431435, 'sideways_tp_mult': 1.3744857560543462, 'sideways_tsl_mult': 0.6331084277190142, 'sideways_time_stop': 116, 'sideways_use_sma': True, 'sideways_use_ema': False, 'sideways_use_atr': False, 'sideways_use_adx': True, 'sideways_use_spike': True, 'sideways_rsi_required': True}.
[I 2025-08-30 14:25:52,745] Trial 43 finished with values: [-1000000000.0, 1000000000.0] and parameters: {'p_sma': 14, 'p_std': 44, 'p_atr': 27, 'p_adx': 28, 'rsi_period': 29, 'ema1': 16, 'ema2': 35, 'slip_atr_k': 0.12143343702841969, 'slip_spread_k': 0.310756514441099, 'spread_hl_frac': 0.04082688231456372, 'bb_std_mult': 0.5196967219532034, 'rsi_os': 12, 'rsi_ob': 71, 'vol_spike': 0.05685776738641535, 'adx_thresh': 19.560784699320692, 'atr_min_pct': 0.016591467108010977, 'atr_max_pct': 0.08910378369048969, 'tp_mult': 1.827350090898755, 'tsl_mult': 0.7906964708120203, 'strategy': 'breakout', 'time_stop': 78, 'use_sma': False, 'use_atr': False, 'use_adx': False, 'use_ema': False, 'use_spike': False, 'rsi_required': False, 'edge_k': 1.2984904586426036, 'edge_cap': 0.31205238142562386, 'bull_strategy': 'mean_reversion', 'bull_bb_std_mult': 2.1339673398074543, 'bull_rsi_os': 43, 'bull_rsi_ob': 83, 'bull_adx_thresh': 14.494710570291977, 'bull_atr_min_pct': 0.0011675046058745313, 'bull_atr_max_pct': 0.0410011526241654, 'bull_tp_mult': 1.7830478929781395, 'bull_tsl_mult': 0.632559146406829, 'bull_time_stop': 285, 'bull_use_sma': False, 'bull_use_ema': True, 'bull_use_atr': True, 'bull_use_adx': False, 'bull_use_spike': True, 'bull_rsi_required': True, 'bear_strategy': 'breakout', 'bear_bb_std_mult': 2.4152369575336783, 'bear_rsi_os': 20, 'bear_rsi_ob': 72, 'bear_adx_thresh': 19.536970797395423, 'bear_atr_min_pct': 0.02798250544591037, 'bear_atr_max_pct': 0.04471414979011813, 'bear_tp_mult': 1.0287062622441838, 'bear_tsl_mult': 0.5017233448418242, 'bear_time_stop': 146, 'bear_use_sma': False, 'bear_use_ema': True, 'bear_use_atr': True, 'bear_use_adx': False, 'bear_use_spike': False, 'bear_rsi_required': True, 'sideways_strategy': 'breakout', 'sideways_bb_std_mult': 0.9444600949284954, 'sideways_rsi_os': 29, 'sideways_rsi_ob': 61, 'sideways_adx_thresh': 13.546764885427006, 'sideways_atr_min_pct': 0.02796301672018041, 'sideways_atr_max_pct': 0.052586754359445584, 'sideways_tp_mult': 1.5714501441967728, 'sideways_tsl_mult': 0.6401955149063889, 'sideways_time_stop': 102, 'sideways_use_sma': True, 'sideways_use_ema': True, 'sideways_use_atr': True, 'sideways_use_adx': False, 'sideways_use_spike': True, 'sideways_rsi_required': False}.
[I 2025-08-30 14:25:52,814] Trial 42 finished with values: [-1000000000.0, 1000000000.0] and parameters: {'p_sma': 15, 'p_std': 43, 'p_atr': 12, 'p_adx': 13, 'rsi_period': 30, 'ema1': 16, 'ema2': 35, 'slip_atr_k': 0.12650535952665914, 'slip_spread_k': 0.546895506396202, 'spread_hl_frac': 0.041059578384055245, 'bb_std_mult': 1.9376935101673747, 'rsi_os': 11, 'rsi_ob': 71, 'vol_spike': 0.059661732173668006, 'adx_thresh': 19.947858443277262, 'atr_min_pct': 0.016694053385027677, 'atr_max_pct': 0.09084061737638391, 'tp_mult': 1.3374559836200228, 'tsl_mult': 0.7956575820267643, 'strategy': 'breakout', 'time_stop': 22, 'use_sma': True, 'use_atr': False, 'use_adx': False, 'use_ema': False, 'use_spike': False, 'rsi_required': False, 'edge_k': 1.250121851430154, 'edge_cap': 0.6581732875457528, 'bull_strategy': 'mean_reversion', 'bull_bb_std_mult': 1.5407814634568664, 'bull_rsi_os': 51, 'bull_rsi_ob': 83, 'bull_adx_thresh': 15.53737382208271, 'bull_atr_min_pct': 0.0012369174538879295, 'bull_atr_max_pct': 0.08676039397894603, 'bull_tp_mult': 1.7872729255944146, 'bull_tsl_mult': 0.606152776017763, 'bull_time_stop': 290, 'bull_use_sma': False, 'bull_use_ema': True, 'bull_use_atr': True, 'bull_use_adx': False, 'bull_use_spike': True, 'bull_rsi_required': False, 'bear_strategy': 'breakout', 'bear_bb_std_mult': 3.3171640712733517, 'bear_rsi_os': 51, 'bear_rsi_ob': 72, 'bear_adx_thresh': 19.175173858197056, 'bear_atr_min_pct': 0.027548446303467863, 'bear_atr_max_pct': 0.05702475197936131, 'bear_tp_mult': 2.176378839131567, 'bear_tsl_mult': 0.47548227623878686, 'bear_time_stop': 97, 'bear_use_sma': False, 'bear_use_ema': False, 'bear_use_atr': True, 'bear_use_adx': False, 'bear_use_spike': True, 'bear_rsi_required': True, 'sideways_strategy': 'breakout', 'sideways_bb_std_mult': 0.9239217726660482, 'sideways_rsi_os': 29, 'sideways_rsi_ob': 61, 'sideways_adx_thresh': 14.804479208417785, 'sideways_atr_min_pct': 0.027604221485779096, 'sideways_atr_max_pct': 0.02556858967540128, 'sideways_tp_mult': 1.6415973272724709, 'sideways_tsl_mult': 0.546229233286177, 'sideways_time_stop': 241, 'sideways_use_sma': True, 'sideways_use_ema': False, 'sideways_use_atr': True, 'sideways_use_adx': False, 'sideways_use_spike': True, 'sideways_rsi_required': False}.
[I 2025-08-30 14:26:24,345] Trial 44 finished with values: [-1000000000.0, 1000000000.0] and parameters: {'p_sma': 11, 'p_std': 52, 'p_atr': 7, 'p_adx': 28, 'rsi_period': 30, 'ema1': 17, 'ema2': 17, 'slip_atr_k': 0.16486559043532606, 'slip_spread_k': 0.32280083532587556, 'spread_hl_frac': 0.003906598330980535, 'bb_std_mult': 2.164809148802859, 'rsi_os': 11, 'rsi_ob': 72, 'vol_spike': 0.16524736500500992, 'adx_thresh': 12.114326020085763, 'atr_min_pct': 0.01663251219867733, 'atr_max_pct': 0.12555789700649173, 'tp_mult': 1.8468128233650942, 'tsl_mult': 0.9834912645906564, 'strategy': 'breakout', 'time_stop': 22, 'use_sma': False, 'use_atr': False, 'use_adx': False, 'use_ema': False, 'use_spike': False, 'rsi_required': False, 'edge_k': 1.177360230842746, 'edge_cap': 0.31243510171492916, 'bull_strategy': 'mean_reversion', 'bull_bb_std_mult': 2.304077294060754, 'bull_rsi_os': 44, 'bull_rsi_ob': 87, 'bull_adx_thresh': 15.289072410298026, 'bull_atr_min_pct': 7.247702496658223e-06, 'bull_atr_max_pct': 0.08659510189781722, 'bull_tp_mult': 1.785673079204357, 'bull_tsl_mult': 0.6027994278196025, 'bull_time_stop': 297, 'bull_use_sma': False, 'bull_use_ema': True, 'bull_use_atr': True, 'bull_use_adx': False, 'bull_use_spike': True, 'bull_rsi_required': True, 'bear_strategy': 'breakout', 'bear_bb_std_mult': 2.4219261154923766, 'bear_rsi_os': 6, 'bear_rsi_ob': 71, 'bear_adx_thresh': 19.013189937169734, 'bear_atr_min_pct': 0.017327724526963368, 'bear_atr_max_pct': 0.04264376772174411, 'bear_tp_mult': 1.0418368399247115, 'bear_tsl_mult': 0.4502455385104569, 'bear_time_stop': 93, 'bear_use_sma': False, 'bear_use_ema': False, 'bear_use_atr': True, 'bear_use_adx': False, 'bear_use_spike': False, 'bear_rsi_required': True, 'sideways_strategy': 'breakout', 'sideways_bb_std_mult': 0.8349878578872467, 'sideways_rsi_os': 9, 'sideways_rsi_ob': 62, 'sideways_adx_thresh': 24.749448299004555, 'sideways_atr_min_pct': 0.013849615047513147, 'sideways_atr_max_pct': 0.030623549288217672, 'sideways_tp_mult': 1.6122659246174773, 'sideways_tsl_mult': 0.6073531058603724, 'sideways_time_stop': 281, 'sideways_use_sma': True, 'sideways_use_ema': False, 'sideways_use_atr': True, 'sideways_use_adx': False, 'sideways_use_spike': True, 'sideways_rsi_required': False}.
