[I 2025-08-30 15:55:31,620] Trial 594 finished with values: [-0.02930420463617267, 0.02927395739083294] and parameters: {'p_sma': 6, 'p_std': 37, 'p_atr': 14, 'p_adx': 24, 'rsi_period': 76, 'ema1': 29, 'ema2': 29, 'slip_atr_k': 0.23662600560992392, 'slip_spread_k': 0.19320988757023977, 'spread_hl_frac': 0.026003881854222703, 'bb_std_mult': 1.2831492830483406, 'rsi_os': 25, 'rsi_ob': 58, 'vol_spike': 0.09661741650965502, 'adx_thresh': 13.242489120298783, 'atr_min_pct': 0.002622483113134672, 'atr_max_pct': 0.04109559594248346, 'tp_mult': 1.6974982552237297, 'tsl_mult': 0.765251247616296, 'strategy': 'breakout', 'time_stop': 142, 'use_sma': False, 'use_atr': True, 'use_adx': False, 'use_ema': True, 'use_spike': True, 'rsi_required': True, 'edge_k': 0.08948923933659939, 'edge_cap': 0.5692806048901591, 'bull_strategy': 'mean_reversion', 'bull_bb_std_mult': 2.551630945527374, 'bull_rsi_os': 10, 'bull_rsi_ob': 68, 'bull_adx_thresh': 22.060815019277758, 'bull_atr_min_pct': 0.029312796798365463, 'bull_atr_max_pct': 0.07138453738510228, 'bull_tp_mult': 2.188822701582616, 'bull_tsl_mult': 0.2683066909565887, 'bull_time_stop': 163, 'bull_use_sma': False, 'bull_use_ema': False, 'bull_use_atr': False, 'bull_use_adx': False, 'bull_use_spike': True, 'bull_rsi_required': False, 'bear_strategy': 'mean_reversion', 'bear_bb_std_mult': 0.5424582767094333, 'bear_rsi_os': 31, 'bear_rsi_ob': 76, 'bear_adx_thresh': 12.873075833572303, 'bear_atr_min_pct': 0.01771984395087738, 'bear_atr_max_pct': 0.06877317152415896, 'bear_tp_mult': 1.0636499318360644, 'bear_tsl_mult': 0.8339771693246525, 'bear_time_stop': 103, 'bear_use_sma': True, 'bear_use_ema': True, 'bear_use_atr': True, 'bear_use_adx': False, 'bear_use_spike': False, 'bear_rsi_required': True, 'sideways_strategy': 'breakout', 'sideways_bb_std_mult': 2.504549952449292, 'sideways_rsi_os': 43, 'sideways_rsi_ob': 57, 'sideways_adx_thresh': 26.663323074933928, 'sideways_atr_min_pct': 4.569215111006398e-05, 'sideways_atr_max_pct': 0.1027484361431929, 'sideways_tp_mult': 1.7535445719916125, 'sideways_tsl_mult': 0.6276589838961558, 'sideways_time_stop': 124, 'sideways_use_sma': True, 'sideways_use_ema': True, 'sideways_use_atr': True, 'sideways_use_adx': False, 'sideways_use_spike': True, 'sideways_rsi_required': False}.
[I 2025-08-30 15:55:31,886] Trial 596 finished with values: [-0.07314038195547223, 0.0730664852637897] and parameters: {'p_sma': 50, 'p_std': 56, 'p_atr': 14, 'p_adx': 8, 'rsi_period': 78, 'ema1': 29, 'ema2': 38, 'slip_atr_k': 0.15283763245937357, 'slip_spread_k': 0.5228696935546178, 'spread_hl_frac': 0.0259296306333427, 'bb_std_mult': 1.138798986509601, 'rsi_os': 25, 'rsi_ob': 70, 'vol_spike': 0.20913248885695956, 'adx_thresh': 23.123590603488708, 'atr_min_pct': 0.012142531103507253, 'atr_max_pct': 0.0768383538648437, 'tp_mult': 1.8998133358266238, 'tsl_mult': 0.3063998320610521, 'strategy': 'breakout', 'time_stop': 125, 'use_sma': False, 'use_atr': True, 'use_adx': False, 'use_ema': True, 'use_spike': True, 'rsi_required': True, 'edge_k': 0.08292324497875023, 'edge_cap': 0.5661202256320031, 'bull_strategy': 'mean_reversion', 'bull_bb_std_mult': 1.4599900286477934, 'bull_rsi_os': 23, 'bull_rsi_ob': 53, 'bull_adx_thresh': 22.230757308015825, 'bull_atr_min_pct': 0.02114685334686259, 'bull_atr_max_pct': 0.1067753903817348, 'bull_tp_mult': 2.221615745785411, 'bull_tsl_mult': 0.27661122763446966, 'bull_time_stop': 167, 'bull_use_sma': False, 'bull_use_ema': False, 'bull_use_atr': False, 'bull_use_adx': False, 'bull_use_spike': True, 'bull_rsi_required': False, 'bear_strategy': 'mean_reversion', 'bear_bb_std_mult': 2.353940492785765, 'bear_rsi_os': 31, 'bear_rsi_ob': 76, 'bear_adx_thresh': 19.719694787449306, 'bear_atr_min_pct': 0.021744249113519156, 'bear_atr_max_pct': 0.06870723805444719, 'bear_tp_mult': 2.998466835419178, 'bear_tsl_mult': 0.8871068934098578, 'bear_time_stop': 68, 'bear_use_sma': True, 'bear_use_ema': True, 'bear_use_atr': True, 'bear_use_adx': False, 'bear_use_spike': False, 'bear_rsi_required': True, 'sideways_strategy': 'breakout', 'sideways_bb_std_mult': 2.4828985899992806, 'sideways_rsi_os': 42, 'sideways_rsi_ob': 57, 'sideways_adx_thresh': 27.35430867783857, 'sideways_atr_min_pct': 0.000967676307605876, 'sideways_atr_max_pct': 0.03990014314816661, 'sideways_tp_mult': 1.2126776965441017, 'sideways_tsl_mult': 0.9761597262470854, 'sideways_time_stop': 125, 'sideways_use_sma': True, 'sideways_use_ema': True, 'sideways_use_atr': True, 'sideways_use_adx': False, 'sideways_use_spike': True, 'sideways_rsi_required': False}.
[I 2025-08-30 15:55:32,248] Trial 595 finished with values: [-1000000000.0, 1000000000.0] and parameters: {'p_sma': 58, 'p_std': 57, 'p_atr': 30, 'p_adx': 19, 'rsi_period': 76, 'ema1': 10, 'ema2': 11, 'slip_atr_k': 0.07096724334784694, 'slip_spread_k': 0.7674030644441894, 'spread_hl_frac': 0.008926470359293014, 'bb_std_mult': 1.7214029858672637, 'rsi_os': 25, 'rsi_ob': 71, 'vol_spike': 0.04198023522679961, 'adx_thresh': 13.11557097572155, 'atr_min_pct': 0.012281042276029571, 'atr_max_pct': 0.06773902839644706, 'tp_mult': 1.9073156910058808, 'tsl_mult': 0.30366091222826497, 'strategy': 'breakout', 'time_stop': 125, 'use_sma': False, 'use_atr': True, 'use_adx': False, 'use_ema': True, 'use_spike': True, 'rsi_required': True, 'edge_k': 0.08434463436710334, 'edge_cap': 0.5704192038794961, 'bull_strategy': 'mean_reversion', 'bull_bb_std_mult': 3.0594863721754315, 'bull_rsi_os': 47, 'bull_rsi_ob': 68, 'bull_adx_thresh': 18.966776105151617, 'bull_atr_min_pct': 0.0211312935583749, 'bull_atr_max_pct': 0.07073664099172326, 'bull_tp_mult': 2.5226351713012063, 'bull_tsl_mult': 0.11796021627706654, 'bull_time_stop': 166, 'bull_use_sma': False, 'bull_use_ema': False, 'bull_use_atr': False, 'bull_use_adx': False, 'bull_use_spike': True, 'bull_rsi_required': False, 'bear_strategy': 'mean_reversion', 'bear_bb_std_mult': 1.7496710501828179, 'bear_rsi_os': 31, 'bear_rsi_ob': 93, 'bear_adx_thresh': 31.89827578385244, 'bear_atr_min_pct': 0.021499192321730084, 'bear_atr_max_pct': 0.0689101716617451, 'bear_tp_mult': 1.4888111922432972, 'bear_tsl_mult': 0.9576525309496734, 'bear_time_stop': 67, 'bear_use_sma': True, 'bear_use_ema': True, 'bear_use_atr': True, 'bear_use_adx': False, 'bear_use_spike': False, 'bear_rsi_required': True, 'sideways_strategy': 'breakout', 'sideways_bb_std_mult': 1.3987421217853502, 'sideways_rsi_os': 51, 'sideways_rsi_ob': 65, 'sideways_adx_thresh': 27.03900961360933, 'sideways_atr_min_pct': 0.013756623075353771, 'sideways_atr_max_pct': 0.03983553613244407, 'sideways_tp_mult': 1.745250083055244, 'sideways_tsl_mult': 0.9991434792175148, 'sideways_time_stop': 124, 'sideways_use_sma': True, 'sideways_use_ema': True, 'sideways_use_atr': True, 'sideways_use_adx': False, 'sideways_use_spike': True, 'sideways_rsi_required': False}.
[I 2025-08-30 15:55:32,963] Trial 597 finished with values: [-0.09539439425655294, 0.09529520825768498] and parameters: {'p_sma': 55, 'p_std': 57, 'p_atr': 18, 'p_adx': 8, 'rsi_period': 76, 'ema1': 29, 'ema2': 33, 'slip_atr_k': 0.2089744034131676, 'slip_spread_k': 0.9727342799689285, 'spread_hl_frac': 0.02594368819843697, 'bb_std_mult': 1.1509750259929967, 'rsi_os': 28, 'rsi_ob': 71, 'vol_spike': 0.17300080220755645, 'adx_thresh': 23.25063514604212, 'atr_min_pct': 0.02262484702875573, 'atr_max_pct': 0.054454621143301754, 'tp_mult': 1.8228952896630617, 'tsl_mult': 0.6615697431353178, 'strategy': 'breakout', 'time_stop': 125, 'use_sma': False, 'use_atr': True, 'use_adx': False, 'use_ema': True, 'use_spike': True, 'rsi_required': True, 'edge_k': 0.28637164258769987, 'edge_cap': 0.27950570587722035, 'bull_strategy': 'mean_reversion', 'bull_bb_std_mult': 2.487912663747395, 'bull_rsi_os': 40, 'bull_rsi_ob': 67, 'bull_adx_thresh': 18.89256065684468, 'bull_atr_min_pct': 0.029291781753687803, 'bull_atr_max_pct': 0.07213046296029332, 'bull_tp_mult': 2.1997173232789273, 'bull_tsl_mult': 0.2764258367489412, 'bull_time_stop': 167, 'bull_use_sma': False, 'bull_use_ema': False, 'bull_use_atr': False, 'bull_use_adx': False, 'bull_use_spike': True, 'bull_rsi_required': False, 'bear_strategy': 'mean_reversion', 'bear_bb_std_mult': 1.7475141211322507, 'bear_rsi_os': 37, 'bear_rsi_ob': 76, 'bear_adx_thresh': 31.876856189111834, 'bear_atr_min_pct': 0.02126360761282354, 'bear_atr_max_pct': 0.06782883502174857, 'bear_tp_mult': 1.499035760672016, 'bear_tsl_mult': 0.59435305457731, 'bear_time_stop': 68, 'bear_use_sma': True, 'bear_use_ema': True, 'bear_use_atr': True, 'bear_use_adx': False, 'bear_use_spike': False, 'bear_rsi_required': True, 'sideways_strategy': 'breakout', 'sideways_bb_std_mult': 2.480713015820307, 'sideways_rsi_os': 43, 'sideways_rsi_ob': 55, 'sideways_adx_thresh': 34.939938141195604, 'sideways_atr_min_pct': 0.0008409490612552304, 'sideways_atr_max_pct': 0.022530483892146597, 'sideways_tp_mult': 1.7925042213588618, 'sideways_tsl_mult': 0.980186135728565, 'sideways_time_stop': 71, 'sideways_use_sma': True, 'sideways_use_ema': True, 'sideways_use_atr': True, 'sideways_use_adx': False, 'sideways_use_spike': True, 'sideways_rsi_required': False}.
[I 2025-08-30 15:56:17,564] Trial 601 finished with values: [-1000000000.0, 1000000000.0] and parameters: {'p_sma': 5, 'p_std': 60, 'p_atr': 16, 'p_adx': 30, 'rsi_period': 78, 'ema1': 30, 'ema2': 45, 'slip_atr_k': 0.07349603870826803, 'slip_spread_k': 0.07833927920899755, 'spread_hl_frac': 0.027706954677906903, 'bb_std_mult': 1.6519843399314018, 'rsi_os': 23, 'rsi_ob': 74, 'vol_spike': 0.07179762086853396, 'adx_thresh': 26.290558335552465, 'atr_min_pct': 0.028320171675852625, 'atr_max_pct': 0.08560579966701673, 'tp_mult': 1.2218550569820545, 'tsl_mult': 0.7075654856328606, 'strategy': 'breakout', 'time_stop': 223, 'use_sma': False, 'use_atr': True, 'use_adx': True, 'use_ema': False, 'use_spike': True, 'rsi_required': True, 'edge_k': 0.21382308324466448, 'edge_cap': 0.5460405713522689, 'bull_strategy': 'breakout', 'bull_bb_std_mult': 2.6791660776295614, 'bull_rsi_os': 40, 'bull_rsi_ob': 47, 'bull_adx_thresh': 19.795322029696504, 'bull_atr_min_pct': 0.0110190103460023, 'bull_atr_max_pct': 0.0648060472239005, 'bull_tp_mult': 2.1182315523270026, 'bull_tsl_mult': 0.2999022298766838, 'bull_time_stop': 142, 'bull_use_sma': True, 'bull_use_ema': True, 'bull_use_atr': True, 'bull_use_adx': False, 'bull_use_spike': True, 'bull_rsi_required': False, 'bear_strategy': 'breakout', 'bear_bb_std_mult': 0.6816968125766717, 'bear_rsi_os': 40, 'bear_rsi_ob': 78, 'bear_adx_thresh': 29.34859237223735, 'bear_atr_min_pct': 0.0270442026104893, 'bear_atr_max_pct': 0.07585977562997723, 'bear_tp_mult': 1.5615138236314505, 'bear_tsl_mult': 0.9515278437496534, 'bear_time_stop': 59, 'bear_use_sma': True, 'bear_use_ema': False, 'bear_use_atr': False, 'bear_use_adx': True, 'bear_use_spike': False, 'bear_rsi_required': False, 'sideways_strategy': 'mean_reversion', 'sideways_bb_std_mult': 1.7839918690804644, 'sideways_rsi_os': 22, 'sideways_rsi_ob': 95, 'sideways_adx_thresh': 28.76854652507674, 'sideways_atr_min_pct': 0.009999154850871272, 'sideways_atr_max_pct': 0.14629682079799672, 'sideways_tp_mult': 2.327918969492288, 'sideways_tsl_mult': 0.235821808489307, 'sideways_time_stop': 160, 'sideways_use_sma': True, 'sideways_use_ema': True, 'sideways_use_atr': False, 'sideways_use_adx': True, 'sideways_use_spike': True, 'sideways_rsi_required': False}.
[I 2025-08-30 15:56:17,805] Trial 598 finished with values: [-0.06377270402495727, 0.06370474996501078] and parameters: {'p_sma': 5, 'p_std': 41, 'p_atr': 16, 'p_adx': 15, 'rsi_period': 24, 'ema1': 30, 'ema2': 45, 'slip_atr_k': 0.07325107713568546, 'slip_spread_k': 0.08138273317356357, 'spread_hl_frac': 0.022170048605684542, 'bb_std_mult': 1.640305127945099, 'rsi_os': 23, 'rsi_ob': 53, 'vol_spike': 0.1735148471895612, 'adx_thresh': 11.141465525148783, 'atr_min_pct': 0.013545161584398632, 'atr_max_pct': 0.12684068489036435, 'tp_mult': 2.0404947060237895, 'tsl_mult': 0.6599833582018507, 'strategy': 'breakout', 'time_stop': 163, 'use_sma': False, 'use_atr': True, 'use_adx': False, 'use_ema': True, 'use_spike': True, 'rsi_required': True, 'edge_k': 0.2638013153675195, 'edge_cap': 0.5359455992693741, 'bull_strategy': 'breakout', 'bull_bb_std_mult': 1.3947801658586458, 'bull_rsi_os': 44, 'bull_rsi_ob': 50, 'bull_adx_thresh': 18.86530193167882, 'bull_atr_min_pct': 0.016362021350152772, 'bull_atr_max_pct': 0.06431039532764378, 'bull_tp_mult': 2.3722121881754994, 'bull_tsl_mult': 0.2941885007273199, 'bull_time_stop': 142, 'bull_use_sma': False, 'bull_use_ema': False, 'bull_use_atr': False, 'bull_use_adx': False, 'bull_use_spike': True, 'bull_rsi_required': False, 'bear_strategy': 'breakout', 'bear_bb_std_mult': 2.4898704032071963, 'bear_rsi_os': 21, 'bear_rsi_ob': 78, 'bear_adx_thresh': 23.20391948264981, 'bear_atr_min_pct': 0.026624589652513984, 'bear_atr_max_pct': 0.07608164584600517, 'bear_tp_mult': 1.1993670942082597, 'bear_tsl_mult': 0.9497405127491763, 'bear_time_stop': 300, 'bear_use_sma': True, 'bear_use_ema': False, 'bear_use_atr': True, 'bear_use_adx': True, 'bear_use_spike': False, 'bear_rsi_required': True, 'sideways_strategy': 'breakout', 'sideways_bb_std_mult': 2.632534646267996, 'sideways_rsi_os': 45, 'sideways_rsi_ob': 50, 'sideways_adx_thresh': 6.686395417937263, 'sideways_atr_min_pct': 0.00063411332146264, 'sideways_atr_max_pct': 0.10084644622156484, 'sideways_tp_mult': 2.90771545657979, 'sideways_tsl_mult': 0.6784292359970001, 'sideways_time_stop': 70, 'sideways_use_sma': True, 'sideways_use_ema': True, 'sideways_use_atr': False, 'sideways_use_adx': True, 'sideways_use_spike': True, 'sideways_rsi_required': False}.
[I 2025-08-30 15:56:18,126] Trial 600 finished with values: [-1000000000.0, 1000000000.0] and parameters: {'p_sma': 5, 'p_std': 58, 'p_atr': 18, 'p_adx': 25, 'rsi_period': 78, 'ema1': 12, 'ema2': 45, 'slip_atr_k': 0.073623505543087, 'slip_spread_k': 0.08019854029199902, 'spread_hl_frac': 0.010183046563489992, 'bb_std_mult': 0.8570641775724726, 'rsi_os': 23, 'rsi_ob': 74, 'vol_spike': 0.17283569814004895, 'adx_thresh': 17.207588733581808, 'atr_min_pct': 0.013652577853013402, 'atr_max_pct': 0.12159441924946829, 'tp_mult': 1.8159929952216871, 'tsl_mult': 0.7066722297496495, 'strategy': 'breakout', 'time_stop': 131, 'use_sma': False, 'use_atr': True, 'use_adx': True, 'use_ema': True, 'use_spike': True, 'rsi_required': True, 'edge_k': 0.20209369817556505, 'edge_cap': 0.5359205538891134, 'bull_strategy': 'breakout', 'bull_bb_std_mult': 1.3564471815290882, 'bull_rsi_os': 39, 'bull_rsi_ob': 94, 'bull_adx_thresh': 23.308412653342916, 'bull_atr_min_pct': 0.020459869187083663, 'bull_atr_max_pct': 0.07550025828068994, 'bull_tp_mult': 2.1193399233992616, 'bull_tsl_mult': 0.3024910967979316, 'bull_time_stop': 293, 'bull_use_sma': True, 'bull_use_ema': True, 'bull_use_atr': True, 'bull_use_adx': False, 'bull_use_spike': True, 'bull_rsi_required': False, 'bear_strategy': 'breakout', 'bear_bb_std_mult': 3.5456165887783113, 'bear_rsi_os': 40, 'bear_rsi_ob': 84, 'bear_adx_thresh': 29.50065545085837, 'bear_atr_min_pct': 0.02827156289159838, 'bear_atr_max_pct': 0.1160797146798799, 'bear_tp_mult': 1.510733806062328, 'bear_tsl_mult': 0.588293834865208, 'bear_time_stop': 58, 'bear_use_sma': True, 'bear_use_ema': False, 'bear_use_atr': True, 'bear_use_adx': True, 'bear_use_spike': False, 'bear_rsi_required': True, 'sideways_strategy': 'breakout', 'sideways_bb_std_mult': 2.607719130823074, 'sideways_rsi_os': 45, 'sideways_rsi_ob': 55, 'sideways_adx_thresh': 28.854730859105196, 'sideways_atr_min_pct': 0.009883184890286657, 'sideways_atr_max_pct': 0.09981857753867047, 'sideways_tp_mult': 2.907410485840704, 'sideways_tsl_mult': 0.9633880553507341, 'sideways_time_stop': 73, 'sideways_use_sma': True, 'sideways_use_ema': True, 'sideways_use_atr': False, 'sideways_use_adx': True, 'sideways_use_spike': True, 'sideways_rsi_required': False}.
[I 2025-08-30 15:56:18,349] Trial 599 finished with values: [-0.01980190233410506, 0.019678518480609742] and parameters: {'p_sma': 5, 'p_std': 57, 'p_atr': 18, 'p_adx': 19, 'rsi_period': 76, 'ema1': 10, 'ema2': 33, 'slip_atr_k': 0.0729496427340954, 'slip_spread_k': 0.45204516500299263, 'spread_hl_frac': 0.021996557468814893, 'bb_std_mult': 1.5441712169323067, 'rsi_os': 40, 'rsi_ob': 53, 'vol_spike': 0.16920039351993954, 'adx_thresh': 31.986985098914516, 'atr_min_pct': 0.006729992404503183, 'atr_max_pct': 0.06598216300726212, 'tp_mult': 1.8209504844811215, 'tsl_mult': 0.707247646017189, 'strategy': 'breakout', 'time_stop': 164, 'use_sma': False, 'use_atr': True, 'use_adx': False, 'use_ema': True, 'use_spike': True, 'rsi_required': True, 'edge_k': 0.2640766015611241, 'edge_cap': 0.48435287809473976, 'bull_strategy': 'breakout', 'bull_bb_std_mult': 2.488368497850625, 'bull_rsi_os': 44, 'bull_rsi_ob': 66, 'bull_adx_thresh': 19.81397529453375, 'bull_atr_min_pct': 0.011258732291133784, 'bull_atr_max_pct': 0.06568332703437092, 'bull_tp_mult': 2.113854862237937, 'bull_tsl_mult': 0.2939646737544431, 'bull_time_stop': 151, 'bull_use_sma': False, 'bull_use_ema': False, 'bull_use_atr': False, 'bull_use_adx': False, 'bull_use_spike': True, 'bull_rsi_required': False, 'bear_strategy': 'breakout', 'bear_bb_std_mult': 1.9970786203085196, 'bear_rsi_os': 30, 'bear_rsi_ob': 91, 'bear_adx_thresh': 30.23810601289253, 'bear_atr_min_pct': 0.021226209711615814, 'bear_atr_max_pct': 0.09271914578830173, 'bear_tp_mult': 1.492535791507659, 'bear_tsl_mult': 0.9540786400703017, 'bear_time_stop': 59, 'bear_use_sma': True, 'bear_use_ema': False, 'bear_use_atr': True, 'bear_use_adx': True, 'bear_use_spike': False, 'bear_rsi_required': True, 'sideways_strategy': 'breakout', 'sideways_bb_std_mult': 2.837134605105736, 'sideways_rsi_os': 45, 'sideways_rsi_ob': 55, 'sideways_adx_thresh': 28.867746087313403, 'sideways_atr_min_pct': 0.0006224441687436537, 'sideways_atr_max_pct': 0.09948558046457623, 'sideways_tp_mult': 2.328807783366458, 'sideways_tsl_mult': 0.6855072953143457, 'sideways_time_stop': 70, 'sideways_use_sma': True, 'sideways_use_ema': True, 'sideways_use_atr': False, 'sideways_use_adx': True, 'sideways_use_spike': True, 'sideways_rsi_required': False}.
[I 2025-08-30 15:56:59,551] Trial 605 finished with values: [-1000000000.0, 1000000000.0] and parameters: {'p_sma': 37, 'p_std': 59, 'p_atr': 19, 'p_adx': 25, 'rsi_period': 14, 'ema1': 30, 'ema2': 35, 'slip_atr_k': 0.0664407670489519, 'slip_spread_k': 0.8431280812704629, 'spread_hl_frac': 0.042671692514854406, 'bb_std_mult': 1.2287554236818692, 'rsi_os': 26, 'rsi_ob': 73, 'vol_spike': 0.16024056073644546, 'adx_thresh': 14.518303817457063, 'atr_min_pct': 0.013775892819875426, 'atr_max_pct': 0.07390435659064674, 'tp_mult': 2.9195186011863283, 'tsl_mult': 0.7997099638972501, 'strategy': 'mean_reversion', 'time_stop': 252, 'use_sma': True, 'use_atr': True, 'use_adx': False, 'use_ema': False, 'use_spike': False, 'rsi_required': False, 'edge_k': 0.19268306159074244, 'edge_cap': 0.09836392055047877, 'bull_strategy': 'mean_reversion', 'bull_bb_std_mult': 1.223602782763825, 'bull_rsi_os': 38, 'bull_rsi_ob': 51, 'bull_adx_thresh': 20.7643541027515, 'bull_atr_min_pct': 0.022610959602430328, 'bull_atr_max_pct': 0.030456871322437212, 'bull_tp_mult': 2.9705106375622683, 'bull_tsl_mult': 0.26302628920945786, 'bull_time_stop': 147, 'bull_use_sma': False, 'bull_use_ema': False, 'bull_use_atr': False, 'bull_use_adx': True, 'bull_use_spike': True, 'bull_rsi_required': True, 'bear_strategy': 'mean_reversion', 'bear_bb_std_mult': 0.6216881945393065, 'bear_rsi_os': 35, 'bear_rsi_ob': 73, 'bear_adx_thresh': 28.698246526885207, 'bear_atr_min_pct': 0.022606609575689964, 'bear_atr_max_pct': 0.13211837133835289, 'bear_tp_mult': 1.2365551347981798, 'bear_tsl_mult': 0.9186035119315774, 'bear_time_stop': 88, 'bear_use_sma': False, 'bear_use_ema': True, 'bear_use_atr': False, 'bear_use_adx': False, 'bear_use_spike': True, 'bear_rsi_required': False, 'sideways_strategy': 'mean_reversion', 'sideways_bb_std_mult': 2.2121888656774313, 'sideways_rsi_os': 42, 'sideways_rsi_ob': 58, 'sideways_adx_thresh': 27.695359446646297, 'sideways_atr_min_pct': 0.027214644350819953, 'sideways_atr_max_pct': 0.10949340182112327, 'sideways_tp_mult': 2.401944534569241, 'sideways_tsl_mult': 0.9992093889946191, 'sideways_time_stop': 98, 'sideways_use_sma': True, 'sideways_use_ema': False, 'sideways_use_atr': True, 'sideways_use_adx': False, 'sideways_use_spike': False, 'sideways_rsi_required': True}.
