[I 2025-08-30 14:22:41,849] Trial 21 finished with values: [-1000000000.0, 1000000000.0] and parameters: {'p_sma': 52, 'p_std': 49, 'p_atr': 30, 'p_adx': 15, 'rsi_period': 61, 'ema1': 9, 'ema2': 29, 'slip_atr_k': 0.0539249055166162, 'slip_spread_k': 0.9503822178150103, 'spread_hl_frac': 0.0495773068788975, 'bb_std_mult': 1.591934816010466, 'rsi_os': 36, 'rsi_ob': 74, 'vol_spike': 0.00014232197224245402, 'adx_thresh': 13.788463373800887, 'atr_min_pct': 0.018638713592526383, 'atr_max_pct': 0.011675007022195899, 'tp_mult': 1.464454845567309, 'tsl_mult': 0.3698047254051738, 'strategy': 'breakout', 'time_stop': 142, 'use_sma': True, 'use_atr': False, 'use_adx': True, 'use_ema': False, 'use_spike': True, 'rsi_required': False, 'edge_k': 0.8337378968260879, 'edge_cap': 0.4606508593175175, 'bull_strategy': 'mean_reversion', 'bull_bb_std_mult': 3.1434176839754855, 'bull_rsi_os': 48, 'bull_rsi_ob': 69, 'bull_adx_thresh': 24.848247930236216, 'bull_atr_min_pct': 0.017318993641313028, 'bull_atr_max_pct': 0.09939988970589292, 'bull_tp_mult': 1.0583207801649799, 'bull_tsl_mult': 0.7822862239925684, 'bull_time_stop': 243, 'bull_use_sma': False, 'bull_use_ema': False, 'bull_use_atr': True, 'bull_use_adx': False, 'bull_use_spike': True, 'bull_rsi_required': False, 'bear_strategy': 'breakout', 'bear_bb_std_mult': 1.5564465333331485, 'bear_rsi_os': 37, 'bear_rsi_ob': 77, 'bear_adx_thresh': 18.717503080742354, 'bear_atr_min_pct': 0.029785236932766967, 'bear_atr_max_pct': 0.0697971794693592, 'bear_tp_mult': 1.95952632125437, 'bear_tsl_mult': 0.21457718383500807, 'bear_time_stop': 228, 'bear_use_sma': True, 'bear_use_ema': False, 'bear_use_atr': True, 'bear_use_adx': False, 'bear_use_spike': True, 'bear_rsi_required': True, 'sideways_strategy': 'mean_reversion', 'sideways_bb_std_mult': 3.4690616635448306, 'sideways_rsi_os': 15, 'sideways_rsi_ob': 83, 'sideways_adx_thresh': 34.088180386507844, 'sideways_atr_min_pct': 0.013864077782027905, 'sideways_atr_max_pct': 0.11154766679879344, 'sideways_tp_mult': 2.8174906149103975, 'sideways_tsl_mult': 0.423043925645763, 'sideways_time_stop': 186, 'sideways_use_sma': True, 'sideways_use_ema': True, 'sideways_use_atr': True, 'sideways_use_adx': False, 'sideways_use_spike': True, 'sideways_rsi_required': True}.
[I 2025-08-30 14:23:10,919] Trial 18 finished with values: [-1000000000.0, 1000000000.0] and parameters: {'p_sma': 58, 'p_std': 45, 'p_atr': 30, 'p_adx': 8, 'rsi_period': 7, 'ema1': 8, 'ema2': 29, 'slip_atr_k': 0.17969361711942533, 'slip_spread_k': 0.9985769188396341, 'spread_hl_frac': 0.031954618411028514, 'bb_std_mult': 1.4817667228355016, 'rsi_os': 37, 'rsi_ob': 76, 'vol_spike': 0.167918828610953, 'adx_thresh': 14.356570738993296, 'atr_min_pct': 0.0002803607572874067, 'atr_max_pct': 0.06130897336490064, 'tp_mult': 1.4916115095560711, 'tsl_mult': 0.3310916984239154, 'strategy': 'breakout', 'time_stop': 290, 'use_sma': True, 'use_atr': False, 'use_adx': True, 'use_ema': False, 'use_spike': True, 'rsi_required': True, 'edge_k': 0.8120967336058803, 'edge_cap': 0.5669811329204281, 'bull_strategy': 'breakout', 'bull_bb_std_mult': 2.9464259733146507, 'bull_rsi_os': 53, 'bull_rsi_ob': 67, 'bull_adx_thresh': 24.911001124345677, 'bull_atr_min_pct': 0.015397673997080918, 'bull_atr_max_pct': 0.02743329733238007, 'bull_tp_mult': 2.129570089010917, 'bull_tsl_mult': 0.9826510817844252, 'bull_time_stop': 245, 'bull_use_sma': False, 'bull_use_ema': False, 'bull_use_atr': False, 'bull_use_adx': False, 'bull_use_spike': True, 'bull_rsi_required': False, 'bear_strategy': 'breakout', 'bear_bb_std_mult': 1.5329432524891549, 'bear_rsi_os': 31, 'bear_rsi_ob': 78, 'bear_adx_thresh': 34.155073430378444, 'bear_atr_min_pct': 0.029549625896854732, 'bear_atr_max_pct': 0.035487844754388376, 'bear_tp_mult': 1.8039835976496807, 'bear_tsl_mult': 0.9801861677462158, 'bear_time_stop': 223, 'bear_use_sma': True, 'bear_use_ema': False, 'bear_use_atr': True, 'bear_use_adx': True, 'bear_use_spike': True, 'bear_rsi_required': True, 'sideways_strategy': 'breakout', 'sideways_bb_std_mult': 2.3630442923518107, 'sideways_rsi_os': 5, 'sideways_rsi_ob': 87, 'sideways_adx_thresh': 26.203968383573244, 'sideways_atr_min_pct': 0.010754239772643663, 'sideways_atr_max_pct': 0.10564150889663146, 'sideways_tp_mult': 2.9716127202669207, 'sideways_tsl_mult': 0.0430987893133109, 'sideways_time_stop': 191, 'sideways_use_sma': False, 'sideways_use_ema': False, 'sideways_use_atr': False, 'sideways_use_adx': True, 'sideways_use_spike': False, 'sideways_rsi_required': False}.
[I 2025-08-30 14:23:12,039] Trial 19 finished with values: [-0.056433836731548004, 0.05633507933675396] and parameters: {'p_sma': 52, 'p_std': 48, 'p_atr': 30, 'p_adx': 15, 'rsi_period': 27, 'ema1': 9, 'ema2': 31, 'slip_atr_k': 0.1745118432772563, 'slip_spread_k': 0.9397837746815543, 'spread_hl_frac': 0.030537468081831526, 'bb_std_mult': 1.5739312003689205, 'rsi_os': 55, 'rsi_ob': 75, 'vol_spike': 0.000717632933779494, 'adx_thresh': 15.027835518700531, 'atr_min_pct': 0.029794560109370545, 'atr_max_pct': 0.06431159778205071, 'tp_mult': 1.438429685355264, 'tsl_mult': 0.3853545981810465, 'strategy': 'breakout', 'time_stop': 154, 'use_sma': True, 'use_atr': False, 'use_adx': True, 'use_ema': False, 'use_spike': True, 'rsi_required': True, 'edge_k': 0.8113877650119998, 'edge_cap': 0.5520426828397667, 'bull_strategy': 'breakout', 'bull_bb_std_mult': 3.0062252457422667, 'bull_rsi_os': 48, 'bull_rsi_ob': 68, 'bull_adx_thresh': 25.885987136797596, 'bull_atr_min_pct': 0.016558322217735996, 'bull_atr_max_pct': 0.017863898019135703, 'bull_tp_mult': 1.2312127781582927, 'bull_tsl_mult': 0.8125970606205029, 'bull_time_stop': 111, 'bull_use_sma': False, 'bull_use_ema': True, 'bull_use_atr': False, 'bull_use_adx': False, 'bull_use_spike': True, 'bull_rsi_required': False, 'bear_strategy': 'breakout', 'bear_bb_std_mult': 1.4255644034521953, 'bear_rsi_os': 30, 'bear_rsi_ob': 76, 'bear_adx_thresh': 34.40231348860975, 'bear_atr_min_pct': 0.00041935477659556936, 'bear_atr_max_pct': 0.06396775991179882, 'bear_tp_mult': 1.8280600608170183, 'bear_tsl_mult': 0.999835350365547, 'bear_time_stop': 227, 'bear_use_sma': True, 'bear_use_ema': False, 'bear_use_atr': True, 'bear_use_adx': False, 'bear_use_spike': True, 'bear_rsi_required': True, 'sideways_strategy': 'mean_reversion', 'sideways_bb_std_mult': 3.5426798260357986, 'sideways_rsi_os': 12, 'sideways_rsi_ob': 84, 'sideways_adx_thresh': 27.237422928507563, 'sideways_atr_min_pct': 0.01204899347230291, 'sideways_atr_max_pct': 0.10385665465297914, 'sideways_tp_mult': 1.6762142032911644, 'sideways_tsl_mult': 0.030276300269455436, 'sideways_time_stop': 187, 'sideways_use_sma': True, 'sideways_use_ema': False, 'sideways_use_atr': False, 'sideways_use_adx': True, 'sideways_use_spike': False, 'sideways_rsi_required': True}.
[I 2025-08-30 14:23:12,577] Trial 20 finished with values: [-1000000000.0, 1000000000.0] and parameters: {'p_sma': 53, 'p_std': 48, 'p_atr': 16, 'p_adx': 15, 'rsi_period': 60, 'ema1': 9, 'ema2': 30, 'slip_atr_k': 0.05486411418774963, 'slip_spread_k': 0.9648921149793885, 'spread_hl_frac': 0.028950263958841725, 'bb_std_mult': 1.566646042381914, 'rsi_os': 55, 'rsi_ob': 73, 'vol_spike': 0.11442972331023823, 'adx_thresh': 14.293507958193622, 'atr_min_pct': 0.028735580466108454, 'atr_max_pct': 0.06637400081368283, 'tp_mult': 1.5227004674015283, 'tsl_mult': 0.41621050214154565, 'strategy': 'breakout', 'time_stop': 148, 'use_sma': True, 'use_atr': False, 'use_adx': True, 'use_ema': False, 'use_spike': True, 'rsi_required': True, 'edge_k': 0.7849893972355759, 'edge_cap': 0.47138998229761553, 'bull_strategy': 'breakout', 'bull_bb_std_mult': 3.177408859902262, 'bull_rsi_os': 47, 'bull_rsi_ob': 70, 'bull_adx_thresh': 25.156561231254813, 'bull_atr_min_pct': 0.018271604664740752, 'bull_atr_max_pct': 0.10175503187595993, 'bull_tp_mult': 1.1511050243799295, 'bull_tsl_mult': 0.7644853776160022, 'bull_time_stop': 244, 'bull_use_sma': False, 'bull_use_ema': True, 'bull_use_atr': True, 'bull_use_adx': False, 'bull_use_spike': True, 'bull_rsi_required': False, 'bear_strategy': 'breakout', 'bear_bb_std_mult': 1.5239702915690712, 'bear_rsi_os': 30, 'bear_rsi_ob': 77, 'bear_adx_thresh': 22.0853547934256, 'bear_atr_min_pct': 0.009014832839736303, 'bear_atr_max_pct': 0.071184364565044, 'bear_tp_mult': 1.8590774004926789, 'bear_tsl_mult': 0.18517555306957337, 'bear_time_stop': 233, 'bear_use_sma': True, 'bear_use_ema': False, 'bear_use_atr': True, 'bear_use_adx': False, 'bear_use_spike': True, 'bear_rsi_required': True, 'sideways_strategy': 'mean_reversion', 'sideways_bb_std_mult': 3.397242262487934, 'sideways_rsi_os': 15, 'sideways_rsi_ob': 84, 'sideways_adx_thresh': 33.54727363531304, 'sideways_atr_min_pct': 0.012321690441042348, 'sideways_atr_max_pct': 0.11566367418472692, 'sideways_tp_mult': 2.867514284207701, 'sideways_tsl_mult': 0.005155358084863573, 'sideways_time_stop': 193, 'sideways_use_sma': True, 'sideways_use_ema': False, 'sideways_use_atr': False, 'sideways_use_adx': True, 'sideways_use_spike': True, 'sideways_rsi_required': True}.
[I 2025-08-30 14:23:13,189] Trial 22 finished with values: [-0.08863077972347, 0.08855791090062247] and parameters: {'p_sma': 25, 'p_std': 27, 'p_atr': 16, 'p_adx': 16, 'rsi_period': 8, 'ema1': 9, 'ema2': 32, 'slip_atr_k': 0.07101718758947345, 'slip_spread_k': 0.4724127388277772, 'spread_hl_frac': 0.016127125940804093, 'bb_std_mult': 1.1748935863931487, 'rsi_os': 36, 'rsi_ob': 65, 'vol_spike': 0.1290800596297344, 'adx_thresh': 22.585718970721537, 'atr_min_pct': 0.02884879170489021, 'atr_max_pct': 0.0700908443495236, 'tp_mult': 2.298377697806551, 'tsl_mult': 0.5549528634117418, 'strategy': 'breakout', 'time_stop': 145, 'use_sma': True, 'use_atr': False, 'use_adx': True, 'use_ema': False, 'use_spike': True, 'rsi_required': True, 'edge_k': 0.8817178630032195, 'edge_cap': 0.7315929476487241, 'bull_strategy': 'breakout', 'bull_bb_std_mult': 1.746461152310932, 'bull_rsi_os': 48, 'bull_rsi_ob': 54, 'bull_adx_thresh': 28.09499279409694, 'bull_atr_min_pct': 0.016322224350493488, 'bull_atr_max_pct': 0.095448040792329, 'bull_tp_mult': 2.1516693687893795, 'bull_tsl_mult': 0.8191864806233038, 'bull_time_stop': 117, 'bull_use_sma': False, 'bull_use_ema': True, 'bull_use_atr': True, 'bull_use_adx': False, 'bull_use_spike': True, 'bull_rsi_required': False, 'bear_strategy': 'breakout', 'bear_bb_std_mult': 1.6280154576922166, 'bear_rsi_os': 29, 'bear_rsi_ob': 90, 'bear_adx_thresh': 26.32683457074239, 'bear_atr_min_pct': 0.00014655527159517304, 'bear_atr_max_pct': 0.06346625961724477, 'bear_tp_mult': 2.8664418103157785, 'bear_tsl_mult': 0.5651058227571684, 'bear_time_stop': 11, 'bear_use_sma': True, 'bear_use_ema': False, 'bear_use_atr': True, 'bear_use_adx': False, 'bear_use_spike': True, 'bear_rsi_required': True, 'sideways_strategy': 'mean_reversion', 'sideways_bb_std_mult': 1.3003120270644155, 'sideways_rsi_os': 54, 'sideways_rsi_ob': 78, 'sideways_adx_thresh': 28.56921177509883, 'sideways_atr_min_pct': 0.02046358739909932, 'sideways_atr_max_pct': 0.06313901365104828, 'sideways_tp_mult': 1.565230501900086, 'sideways_tsl_mult': 0.13186705324396766, 'sideways_time_stop': 173, 'sideways_use_sma': True, 'sideways_use_ema': False, 'sideways_use_atr': False, 'sideways_use_adx': True, 'sideways_use_spike': True, 'sideways_rsi_required': True}.
[I 2025-08-30 14:23:42,782] Trial 23 finished with values: [-1000000000.0, 1000000000.0] and parameters: {'p_sma': 38, 'p_std': 28, 'p_atr': 17, 'p_adx': 16, 'rsi_period': 20, 'ema1': 13, 'ema2': 22, 'slip_atr_k': 0.06453508349866888, 'slip_spread_k': 0.4769310205008045, 'spread_hl_frac': 0.016679311175682148, 'bb_std_mult': 1.1386473711843503, 'rsi_os': 55, 'rsi_ob': 62, 'vol_spike': 0.12750159808824627, 'adx_thresh': 22.15919345245991, 'atr_min_pct': 0.02900596987026493, 'atr_max_pct': 0.037076857567304874, 'tp_mult': 2.4187010142759138, 'tsl_mult': 0.5755574383146298, 'strategy': 'breakout', 'time_stop': 138, 'use_sma': True, 'use_atr': False, 'use_adx': True, 'use_ema': False, 'use_spike': True, 'rsi_required': True, 'edge_k': 1.5896380895187514, 'edge_cap': 0.7188032092918629, 'bull_strategy': 'breakout', 'bull_bb_std_mult': 3.258736865126189, 'bull_rsi_os': 47, 'bull_rsi_ob': 54, 'bull_adx_thresh': 30.47285086753328, 'bull_atr_min_pct': 0.006953091431977417, 'bull_atr_max_pct': 0.09272234788161701, 'bull_tp_mult': 1.3078188343483494, 'bull_tsl_mult': 0.8267204702943276, 'bull_time_stop': 111, 'bull_use_sma': False, 'bull_use_ema': True, 'bull_use_atr': True, 'bull_use_adx': False, 'bull_use_spike': True, 'bull_rsi_required': False, 'bear_strategy': 'breakout', 'bear_bb_std_mult': 0.9856170888048705, 'bear_rsi_os': 44, 'bear_rsi_ob': 89, 'bear_adx_thresh': 25.136675994382642, 'bear_atr_min_pct': 0.008764605729640855, 'bear_atr_max_pct': 0.1478193696263826, 'bear_tp_mult': 2.9572444215716067, 'bear_tsl_mult': 0.5503654926658366, 'bear_time_stop': 6, 'bear_use_sma': True, 'bear_use_ema': False, 'bear_use_atr': True, 'bear_use_adx': False, 'bear_use_spike': True, 'bear_rsi_required': True, 'sideways_strategy': 'mean_reversion', 'sideways_bb_std_mult': 0.5990241348099046, 'sideways_rsi_os': 55, 'sideways_rsi_ob': 78, 'sideways_adx_thresh': 28.46911100389307, 'sideways_atr_min_pct': 0.020624508236333, 'sideways_atr_max_pct': 0.05909915120913534, 'sideways_tp_mult': 1.495210842144472, 'sideways_tsl_mult': 0.3947667397024469, 'sideways_time_stop': 184, 'sideways_use_sma': True, 'sideways_use_ema': False, 'sideways_use_atr': False, 'sideways_use_adx': True, 'sideways_use_spike': True, 'sideways_rsi_required': True}.
[I 2025-08-30 14:23:43,483] Trial 24 finished with values: [-1000000000.0, 1000000000.0] and parameters: {'p_sma': 26, 'p_std': 27, 'p_atr': 17, 'p_adx': 21, 'rsi_period': 15, 'ema1': 12, 'ema2': 39, 'slip_atr_k': 0.06354483996445548, 'slip_spread_k': 0.7551043811394991, 'spread_hl_frac': 0.016060720493932118, 'bb_std_mult': 1.042630002189326, 'rsi_os': 15, 'rsi_ob': 86, 'vol_spike': 0.1262049943698243, 'adx_thresh': 21.934810915983462, 'atr_min_pct': 0.026455507508576566, 'atr_max_pct': 0.1445971503213645, 'tp_mult': 2.2865590933319644, 'tsl_mult': 0.5887619943051783, 'strategy': 'breakout', 'time_stop': 205, 'use_sma': True, 'use_atr': False, 'use_adx': True, 'use_ema': False, 'use_spike': True, 'rsi_required': True, 'edge_k': 1.6694382907585796, 'edge_cap': 0.7370211354754561, 'bull_strategy': 'breakout', 'bull_bb_std_mult': 1.7825277569614888, 'bull_rsi_os': 55, 'bull_rsi_ob': 56, 'bull_adx_thresh': 30.23560092334759, 'bull_atr_min_pct': 0.005766847354162151, 'bull_atr_max_pct': 0.09699962906177315, 'bull_tp_mult': 1.8815174282720695, 'bull_tsl_mult': 0.8236758827977182, 'bull_time_stop': 76, 'bull_use_sma': False, 'bull_use_ema': True, 'bull_use_atr': True, 'bull_use_adx': False, 'bull_use_spike': True, 'bull_rsi_required': False, 'bear_strategy': 'breakout', 'bear_bb_std_mult': 2.198957180362255, 'bear_rsi_os': 12, 'bear_rsi_ob': 91, 'bear_adx_thresh': 24.912417662758443, 'bear_atr_min_pct': 0.01496303066987371, 'bear_atr_max_pct': 0.09967227909812143, 'bear_tp_mult': 1.4917502505731504, 'bear_tsl_mult': 0.5539901125104241, 'bear_time_stop': 166, 'bear_use_sma': True, 'bear_use_ema': False, 'bear_use_atr': True, 'bear_use_adx': False, 'bear_use_spike': True, 'bear_rsi_required': True, 'sideways_strategy': 'mean_reversion', 'sideways_bb_std_mult': 1.1757078827978769, 'sideways_rsi_os': 54, 'sideways_rsi_ob': 95, 'sideways_adx_thresh': 21.779977352178562, 'sideways_atr_min_pct': 0.019950233060234145, 'sideways_atr_max_pct': 0.0689046922693486, 'sideways_tp_mult': 1.5108662542285705, 'sideways_tsl_mult': 0.15810525082479793, 'sideways_time_stop': 260, 'sideways_use_sma': True, 'sideways_use_ema': False, 'sideways_use_atr': False, 'sideways_use_adx': True, 'sideways_use_spike': True, 'sideways_rsi_required': True}.
[I 2025-08-30 14:23:44,351] Trial 25 finished with values: [-1000000000.0, 1000000000.0] and parameters: {'p_sma': 37, 'p_std': 26, 'p_atr': 10, 'p_adx': 21, 'rsi_period': 18, 'ema1': 13, 'ema2': 38, 'slip_atr_k': 0.14378252687931065, 'slip_spread_k': 0.741824711768909, 'spread_hl_frac': 0.016367069683792437, 'bb_std_mult': 1.0216230450106245, 'rsi_os': 16, 'rsi_ob': 85, 'vol_spike': 0.2077407082038996, 'adx_thresh': 21.308826111815215, 'atr_min_pct': 0.019513126047504607, 'atr_max_pct': 0.04112432715670768, 'tp_mult': 2.2493378318422086, 'tsl_mult': 0.5662040661451919, 'strategy': 'breakout', 'time_stop': 195, 'use_sma': True, 'use_atr': False, 'use_adx': True, 'use_ema': False, 'use_spike': True, 'rsi_required': True, 'edge_k': 1.6847859296850785, 'edge_cap': 0.7330116445489759, 'bull_strategy': 'breakout', 'bull_bb_std_mult': 1.8631400685132264, 'bull_rsi_os': 55, 'bull_rsi_ob': 56, 'bull_adx_thresh': 30.12490926525746, 'bull_atr_min_pct': 0.004903865262868345, 'bull_atr_max_pct': 0.08962147099683568, 'bull_tp_mult': 1.8779025578250246, 'bull_tsl_mult': 0.3801196655405602, 'bull_time_stop': 89, 'bull_use_sma': False, 'bull_use_ema': True, 'bull_use_atr': True, 'bull_use_adx': False, 'bull_use_spike': True, 'bull_rsi_required': False, 'bear_strategy': 'breakout', 'bear_bb_std_mult': 2.1739779415126463, 'bear_rsi_os': 13, 'bear_rsi_ob': 85, 'bear_adx_thresh': 26.38876109061666, 'bear_atr_min_pct': 0.0163448181770883, 'bear_atr_max_pct': 0.14808280710959792, 'bear_tp_mult': 1.51899828760063, 'bear_tsl_mult': 0.5797392517976455, 'bear_time_stop': 92, 'bear_use_sma': True, 'bear_use_ema': False, 'bear_use_atr': True, 'bear_use_adx': False, 'bear_use_spike': True, 'bear_rsi_required': True, 'sideways_strategy': 'mean_reversion', 'sideways_bb_std_mult': 0.5695607056673582, 'sideways_rsi_os': 55, 'sideways_rsi_ob': 95, 'sideways_adx_thresh': 5.307555018783091, 'sideways_atr_min_pct': 0.02003792536591857, 'sideways_atr_max_pct': 0.14968372911880223, 'sideways_tp_mult': 1.460871106997202, 'sideways_tsl_mult': 0.16307815574747472, 'sideways_time_stop': 263, 'sideways_use_sma': True, 'sideways_use_ema': False, 'sideways_use_atr': False, 'sideways_use_adx': True, 'sideways_use_spike': True, 'sideways_rsi_required': True}.
[I 2025-08-30 14:23:45,100] Trial 26 finished with values: [-1000000000.0, 1000000000.0] and parameters: {'p_sma': 41, 'p_std': 59, 'p_atr': 10, 'p_adx': 21, 'rsi_period': 16, 'ema1': 13, 'ema2': 40, 'slip_atr_k': 0.15223046252938963, 'slip_spread_k': 0.7476360516107687, 'spread_hl_frac': 0.007746759371444504, 'bb_std_mult': 3.3335843390231403, 'rsi_os': 5, 'rsi_ob': 86, 'vol_spike': 0.21386242351403378, 'adx_thresh': 9.966348825516938, 'atr_min_pct': 0.01855604162626952, 'atr_max_pct': 0.1478418846224471, 'tp_mult': 2.242995424080017, 'tsl_mult': 0.2646646392634667, 'strategy': 'breakout', 'time_stop': 213, 'use_sma': True, 'use_atr': False, 'use_adx': True, 'use_ema': False, 'use_spike': False, 'rsi_required': False, 'edge_k': 1.7117733308558105, 'edge_cap': 0.25321001116119995, 'bull_strategy': 'mean_reversion', 'bull_bb_std_mult': 0.5325132776366723, 'bull_rsi_os': 54, 'bull_rsi_ob': 58, 'bull_adx_thresh': 31.380554201815116, 'bull_atr_min_pct': 0.005201769031470772, 'bull_atr_max_pct': 0.12451303203752065, 'bull_tp_mult': 1.8305252601691195, 'bull_tsl_mult': 0.32021906575657166, 'bull_time_stop': 80, 'bull_use_sma': False, 'bull_use_ema': False, 'bull_use_atr': True, 'bull_use_adx': False, 'bull_use_spike': True, 'bull_rsi_required': True, 'bear_strategy': 'breakout', 'bear_bb_std_mult': 2.250965700196713, 'bear_rsi_os': 13, 'bear_rsi_ob': 61, 'bear_adx_thresh': 31.697263080855013, 'bear_atr_min_pct': 0.016160496751642165, 'bear_atr_max_pct': 0.14759016956319154, 'bear_tp_mult': 1.4699334289550245, 'bear_tsl_mult': 0.7832986947324214, 'bear_time_stop': 164, 'bear_use_sma': False, 'bear_use_ema': True, 'bear_use_atr': True, 'bear_use_adx': False, 'bear_use_spike': False, 'bear_rsi_required': True, 'sideways_strategy': 'breakout', 'sideways_bb_std_mult': 0.5108862253929729, 'sideways_rsi_os': 42, 'sideways_rsi_ob': 95, 'sideways_adx_thresh': 21.798995870185436, 'sideways_atr_min_pct': 0.019448498357257066, 'sideways_atr_max_pct': 0.1498376423863632, 'sideways_tp_mult': 1.9134435927548628, 'sideways_tsl_mult': 0.1379157409778306, 'sideways_time_stop': 254, 'sideways_use_sma': True, 'sideways_use_ema': True, 'sideways_use_atr': True, 'sideways_use_adx': False, 'sideways_use_spike': True, 'sideways_rsi_required': False}.
