[I 2025-08-30 14:35:57,867] Trial 126 finished with values: [-1000000000.0, 1000000000.0] and parameters: {'p_sma': 38, 'p_std': 47, 'p_atr': 14, 'p_adx': 22, 'rsi_period': 40, 'ema1': 22, 'ema2': 50, 'slip_atr_k': 0.23970969489566757, 'slip_spread_k': 0.4349329762254687, 'spread_hl_frac': 0.03735285854830653, 'bb_std_mult': 2.872606083321775, 'rsi_os': 35, 'rsi_ob': 90, 'vol_spike': 0.17567789077966245, 'adx_thresh': 29.945302980862373, 'atr_min_pct': 0.008945962999663992, 'atr_max_pct': 0.10545530706613765, 'tp_mult': 2.2199336282982016, 'tsl_mult': 0.2938602518108909, 'strategy': 'mean_reversion', 'time_stop': 42, 'use_sma': False, 'use_atr': True, 'use_adx': True, 'use_ema': True, 'use_spike': False, 'rsi_required': False, 'edge_k': 0.34238174716919967, 'edge_cap': 0.3592036477329004, 'bull_strategy': 'breakout', 'bull_bb_std_mult': 3.5104685225714243, 'bull_rsi_os': 38, 'bull_rsi_ob': 77, 'bull_adx_thresh': 23.93297068218722, 'bull_atr_min_pct': 0.0037491579420202677, 'bull_atr_max_pct': 0.01657878556870601, 'bull_tp_mult': 1.4811995245032188, 'bull_tsl_mult': 0.5294138386926316, 'bull_time_stop': 261, 'bull_use_sma': False, 'bull_use_ema': True, 'bull_use_atr': False, 'bull_use_adx': False, 'bull_use_spike': False, 'bull_rsi_required': False, 'bear_strategy': 'breakout', 'bear_bb_std_mult': 1.0956738619603656, 'bear_rsi_os': 55, 'bear_rsi_ob': 77, 'bear_adx_thresh': 29.514403776133214, 'bear_atr_min_pct': 0.012031760344257675, 'bear_atr_max_pct': 0.09549490349428888, 'bear_tp_mult': 1.9958869061657694, 'bear_tsl_mult': 0.9985866366744629, 'bear_time_stop': 42, 'bear_use_sma': False, 'bear_use_ema': True, 'bear_use_atr': False, 'bear_use_adx': True, 'bear_use_spike': True, 'bear_rsi_required': False, 'sideways_strategy': 'mean_reversion', 'sideways_bb_std_mult': 3.0591467213348382, 'sideways_rsi_os': 34, 'sideways_rsi_ob': 60, 'sideways_adx_thresh': 17.902224873550132, 'sideways_atr_min_pct': 0.0032476431979726883, 'sideways_atr_max_pct': 0.035747003430568774, 'sideways_tp_mult': 2.449496202765847, 'sideways_tsl_mult': 0.11038013314682349, 'sideways_time_stop': 225, 'sideways_use_sma': False, 'sideways_use_ema': True, 'sideways_use_atr': False, 'sideways_use_adx': True, 'sideways_use_spike': True, 'sideways_rsi_required': False}.
[I 2025-08-30 14:35:58,215] Trial 130 finished with values: [-1000000000.0, 1000000000.0] and parameters: {'p_sma': 32, 'p_std': 30, 'p_atr': 19, 'p_adx': 21, 'rsi_period': 9, 'ema1': 19, 'ema2': 52, 'slip_atr_k': 0.013862678712483102, 'slip_spread_k': 0.1621526299527714, 'spread_hl_frac': 0.00013340179778856568, 'bb_std_mult': 3.5961499291516352, 'rsi_os': 54, 'rsi_ob': 64, 'vol_spike': 0.2239873538665727, 'adx_thresh': 5.05730107394643, 'atr_min_pct': 0.006821375978129625, 'atr_max_pct': 0.07338560376561376, 'tp_mult': 1.5261178139826885, 'tsl_mult': 0.14211344268279902, 'strategy': 'mean_reversion', 'time_stop': 36, 'use_sma': True, 'use_atr': False, 'use_adx': False, 'use_ema': False, 'use_spike': True, 'rsi_required': False, 'edge_k': 1.507211284585221, 'edge_cap': 0.7842103113611052, 'bull_strategy': 'mean_reversion', 'bull_bb_std_mult': 3.2921863383174643, 'bull_rsi_os': 27, 'bull_rsi_ob': 63, 'bull_adx_thresh': 12.338488271385485, 'bull_atr_min_pct': 0.002605107907736082, 'bull_atr_max_pct': 0.03269496265635413, 'bull_tp_mult': 2.9415716934039873, 'bull_tsl_mult': 0.5893149385696662, 'bull_time_stop': 182, 'bull_use_sma': True, 'bull_use_ema': False, 'bull_use_atr': True, 'bull_use_adx': True, 'bull_use_spike': True, 'bull_rsi_required': True, 'bear_strategy': 'mean_reversion', 'bear_bb_std_mult': 1.3608720998260302, 'bear_rsi_os': 27, 'bear_rsi_ob': 49, 'bear_adx_thresh': 30.831411568029665, 'bear_atr_min_pct': 0.01295881659307667, 'bear_atr_max_pct': 0.12836100782001264, 'bear_tp_mult': 2.8459794542089445, 'bear_tsl_mult': 0.3324572330203112, 'bear_time_stop': 30, 'bear_use_sma': True, 'bear_use_ema': False, 'bear_use_atr': True, 'bear_use_adx': False, 'bear_use_spike': False, 'bear_rsi_required': True, 'sideways_strategy': 'breakout', 'sideways_bb_std_mult': 3.275219400846842, 'sideways_rsi_os': 30, 'sideways_rsi_ob': 90, 'sideways_adx_thresh': 11.52423390083508, 'sideways_atr_min_pct': 0.004657006705047503, 'sideways_atr_max_pct': 0.08389651021074906, 'sideways_tp_mult': 2.703048633237283, 'sideways_tsl_mult': 0.12980909844558847, 'sideways_time_stop': 237, 'sideways_use_sma': True, 'sideways_use_ema': False, 'sideways_use_atr': True, 'sideways_use_adx': False, 'sideways_use_spike': True, 'sideways_rsi_required': True}.
[I 2025-08-30 14:36:28,878] Trial 128 finished with values: [-1000000000.0, 1000000000.0] and parameters: {'p_sma': 38, 'p_std': 33, 'p_atr': 30, 'p_adx': 21, 'rsi_period': 36, 'ema1': 27, 'ema2': 48, 'slip_atr_k': 0.01532014348649675, 'slip_spread_k': 0.25321844368697566, 'spread_hl_frac': 0.03712766933672625, 'bb_std_mult': 3.4602055830742944, 'rsi_os': 36, 'rsi_ob': 94, 'vol_spike': 0.2232001933414004, 'adx_thresh': 29.68276443194791, 'atr_min_pct': 0.018523831125850928, 'atr_max_pct': 0.11269679805210382, 'tp_mult': 1.5434894763346505, 'tsl_mult': 0.1982255641186506, 'strategy': 'mean_reversion', 'time_stop': 25, 'use_sma': True, 'use_atr': True, 'use_adx': False, 'use_ema': True, 'use_spike': False, 'rsi_required': False, 'edge_k': 1.498251184847729, 'edge_cap': 0.2937152102004531, 'bull_strategy': 'breakout', 'bull_bb_std_mult': 3.1409434575019115, 'bull_rsi_os': 26, 'bull_rsi_ob': 77, 'bull_adx_thresh': 12.48736920054093, 'bull_atr_min_pct': 0.0037370712068770413, 'bull_atr_max_pct': 0.08149520906592352, 'bull_tp_mult': 1.9712824956219883, 'bull_tsl_mult': 0.5284362178198385, 'bull_time_stop': 265, 'bull_use_sma': False, 'bull_use_ema': False, 'bull_use_atr': True, 'bull_use_adx': True, 'bull_use_spike': False, 'bull_rsi_required': True, 'bear_strategy': 'mean_reversion', 'bear_bb_std_mult': 1.3780277497168867, 'bear_rsi_os': 15, 'bear_rsi_ob': 77, 'bear_adx_thresh': 10.727492606225278, 'bear_atr_min_pct': 0.012104271441430637, 'bear_atr_max_pct': 0.1292061611778753, 'bear_tp_mult': 1.984047842672385, 'bear_tsl_mult': 0.17553971043417782, 'bear_time_stop': 39, 'bear_use_sma': True, 'bear_use_ema': False, 'bear_use_atr': False, 'bear_use_adx': False, 'bear_use_spike': False, 'bear_rsi_required': False, 'sideways_strategy': 'breakout', 'sideways_bb_std_mult': 3.0489691452054646, 'sideways_rsi_os': 34, 'sideways_rsi_ob': 89, 'sideways_adx_thresh': 17.068062962970654, 'sideways_atr_min_pct': 0.01776996205997806, 'sideways_atr_max_pct': 0.08801655729335787, 'sideways_tp_mult': 1.6041640370014183, 'sideways_tsl_mult': 0.09626634172887133, 'sideways_time_stop': 239, 'sideways_use_sma': False, 'sideways_use_ema': False, 'sideways_use_atr': False, 'sideways_use_adx': True, 'sideways_use_spike': True, 'sideways_rsi_required': True}.
[I 2025-08-30 14:36:29,549] Trial 129 finished with values: [-1000000000.0, 1000000000.0] and parameters: {'p_sma': 38, 'p_std': 32, 'p_atr': 12, 'p_adx': 21, 'rsi_period': 67, 'ema1': 26, 'ema2': 54, 'slip_atr_k': 0.014502738560029944, 'slip_spread_k': 0.16483604234887295, 'spread_hl_frac': 0.03766993285128491, 'bb_std_mult': 1.6152720212741964, 'rsi_os': 39, 'rsi_ob': 94, 'vol_spike': 0.2267211206378194, 'adx_thresh': 30.074142495426592, 'atr_min_pct': 0.018494964125498694, 'atr_max_pct': 0.07486706780154309, 'tp_mult': 2.815355983321938, 'tsl_mult': 0.935880154190258, 'strategy': 'mean_reversion', 'time_stop': 38, 'use_sma': True, 'use_atr': False, 'use_adx': False, 'use_ema': False, 'use_spike': True, 'rsi_required': False, 'edge_k': 1.4970189895180799, 'edge_cap': 0.2879027299535144, 'bull_strategy': 'breakout', 'bull_bb_std_mult': 1.2617610779952328, 'bull_rsi_os': 27, 'bull_rsi_ob': 71, 'bull_adx_thresh': 12.38998568676494, 'bull_atr_min_pct': 0.0035299815533901954, 'bull_atr_max_pct': 0.08060832069880433, 'bull_tp_mult': 1.2651242119692905, 'bull_tsl_mult': 0.5881253325066581, 'bull_time_stop': 83, 'bull_use_sma': True, 'bull_use_ema': False, 'bull_use_atr': True, 'bull_use_adx': True, 'bull_use_spike': True, 'bull_rsi_required': False, 'bear_strategy': 'mean_reversion', 'bear_bb_std_mult': 0.6431751313726766, 'bear_rsi_os': 15, 'bear_rsi_ob': 78, 'bear_adx_thresh': 11.450173398805914, 'bear_atr_min_pct': 0.011829924992148754, 'bear_atr_max_pct': 0.03517185693691485, 'bear_tp_mult': 2.8413342719652968, 'bear_tsl_mult': 0.25471581071614136, 'bear_time_stop': 40, 'bear_use_sma': True, 'bear_use_ema': False, 'bear_use_atr': True, 'bear_use_adx': False, 'bear_use_spike': False, 'bear_rsi_required': True, 'sideways_strategy': 'breakout', 'sideways_bb_std_mult': 3.0594423272562787, 'sideways_rsi_os': 34, 'sideways_rsi_ob': 82, 'sideways_adx_thresh': 30.08699609100284, 'sideways_atr_min_pct': 0.004527553799262977, 'sideways_atr_max_pct': 0.08423714164311646, 'sideways_tp_mult': 1.6015420783036611, 'sideways_tsl_mult': 0.09181543213868662, 'sideways_time_stop': 236, 'sideways_use_sma': False, 'sideways_use_ema': False, 'sideways_use_atr': False, 'sideways_use_adx': True, 'sideways_use_spike': True, 'sideways_rsi_required': True}.
[I 2025-08-30 14:36:29,656] Trial 127 finished with values: [-1000000000.0, 1000000000.0] and parameters: {'p_sma': 29, 'p_std': 33, 'p_atr': 19, 'p_adx': 21, 'rsi_period': 10, 'ema1': 25, 'ema2': 50, 'slip_atr_k': 0.01856699135349551, 'slip_spread_k': 0.5860567595141755, 'spread_hl_frac': 0.0070275458758730005, 'bb_std_mult': 3.0341223963075636, 'rsi_os': 35, 'rsi_ob': 64, 'vol_spike': 0.15506121121527028, 'adx_thresh': 30.47983055043408, 'atr_min_pct': 0.006529424718360396, 'atr_max_pct': 0.07417706928069483, 'tp_mult': 2.621948756456139, 'tsl_mult': 0.9737344862973335, 'strategy': 'mean_reversion', 'time_stop': 39, 'use_sma': True, 'use_atr': True, 'use_adx': True, 'use_ema': True, 'use_spike': False, 'rsi_required': False, 'edge_k': 1.5976591569995073, 'edge_cap': 0.133258699006228, 'bull_strategy': 'breakout', 'bull_bb_std_mult': 3.5967664837277535, 'bull_rsi_os': 39, 'bull_rsi_ob': 46, 'bull_adx_thresh': 12.264981226371106, 'bull_atr_min_pct': 0.0026766382641509783, 'bull_atr_max_pct': 0.08218397574391141, 'bull_tp_mult': 2.8003507672577177, 'bull_tsl_mult': 0.5863977514210672, 'bull_time_stop': 150, 'bull_use_sma': False, 'bull_use_ema': False, 'bull_use_atr': False, 'bull_use_adx': False, 'bull_use_spike': False, 'bull_rsi_required': False, 'bear_strategy': 'breakout', 'bear_bb_std_mult': 2.6839659035228483, 'bear_rsi_os': 17, 'bear_rsi_ob': 48, 'bear_adx_thresh': 10.87468078984578, 'bear_atr_min_pct': 0.012002153533731809, 'bear_atr_max_pct': 0.03845742774468238, 'bear_tp_mult': 1.9898252263585727, 'bear_tsl_mult': 0.1859386138562179, 'bear_time_stop': 39, 'bear_use_sma': False, 'bear_use_ema': False, 'bear_use_atr': False, 'bear_use_adx': False, 'bear_use_spike': True, 'bear_rsi_required': False, 'sideways_strategy': 'mean_reversion', 'sideways_bb_std_mult': 3.068570401851671, 'sideways_rsi_os': 30, 'sideways_rsi_ob': 59, 'sideways_adx_thresh': 17.726924818978702, 'sideways_atr_min_pct': 0.0032843933009474944, 'sideways_atr_max_pct': 0.02846652153183435, 'sideways_tp_mult': 2.467204819972391, 'sideways_tsl_mult': 0.11529300730137895, 'sideways_time_stop': 208, 'sideways_use_sma': False, 'sideways_use_ema': True, 'sideways_use_atr': False, 'sideways_use_adx': True, 'sideways_use_spike': True, 'sideways_rsi_required': True}.
[I 2025-08-30 14:36:30,008] Trial 131 finished with values: [-1000000000.0, 1000000000.0] and parameters: {'p_sma': 13, 'p_std': 7, 'p_atr': 16, 'p_adx': 21, 'rsi_period': 53, 'ema1': 28, 'ema2': 35, 'slip_atr_k': 0.05801912911019827, 'slip_spread_k': 0.2502208891981998, 'spread_hl_frac': 0.017478447556172953, 'bb_std_mult': 3.4931008654942124, 'rsi_os': 30, 'rsi_ob': 94, 'vol_spike': 0.2531992071993973, 'adx_thresh': 32.86345497621222, 'atr_min_pct': 0.003556845289034114, 'atr_max_pct': 0.0369714271046698, 'tp_mult': 2.390473149702106, 'tsl_mult': 0.9432865289056419, 'strategy': 'mean_reversion', 'time_stop': 51, 'use_sma': True, 'use_atr': False, 'use_adx': False, 'use_ema': False, 'use_spike': False, 'rsi_required': False, 'edge_k': 1.741676665955915, 'edge_cap': 0.7447157559413549, 'bull_strategy': 'breakout', 'bull_bb_std_mult': 3.585027031046957, 'bull_rsi_os': 42, 'bull_rsi_ob': 76, 'bull_adx_thresh': 12.854489350600412, 'bull_atr_min_pct': 0.004300562017145055, 'bull_atr_max_pct': 0.07973847083733444, 'bull_tp_mult': 1.2432868234463677, 'bull_tsl_mult': 0.4725875629633759, 'bull_time_stop': 241, 'bull_use_sma': False, 'bull_use_ema': False, 'bull_use_atr': True, 'bull_use_adx': True, 'bull_use_spike': False, 'bull_rsi_required': True, 'bear_strategy': 'mean_reversion', 'bear_bb_std_mult': 0.8827243600769465, 'bear_rsi_os': 15, 'bear_rsi_ob': 47, 'bear_adx_thresh': 10.921540582065532, 'bear_atr_min_pct': 0.011388255214785691, 'bear_atr_max_pct': 0.035852327281969174, 'bear_tp_mult': 1.966575802858942, 'bear_tsl_mult': 0.2838419980208378, 'bear_time_stop': 55, 'bear_use_sma': False, 'bear_use_ema': False, 'bear_use_atr': False, 'bear_use_adx': False, 'bear_use_spike': True, 'bear_rsi_required': False, 'sideways_strategy': 'breakout', 'sideways_bb_std_mult': 3.1638456580620584, 'sideways_rsi_os': 32, 'sideways_rsi_ob': 68, 'sideways_adx_thresh': 17.053323457264543, 'sideways_atr_min_pct': 0.01745276615688996, 'sideways_atr_max_pct': 0.08965831202466479, 'sideways_tp_mult': 2.950109042673138, 'sideways_tsl_mult': 0.5910076412149208, 'sideways_time_stop': 188, 'sideways_use_sma': False, 'sideways_use_ema': False, 'sideways_use_atr': False, 'sideways_use_adx': True, 'sideways_use_spike': False, 'sideways_rsi_required': True}.
[I 2025-08-30 14:36:59,913] Trial 135 finished with values: [-1000000000.0, 1000000000.0] and parameters: {'p_sma': 59, 'p_std': 26, 'p_atr': 28, 'p_adx': 22, 'rsi_period': 30, 'ema1': 23, 'ema2': 52, 'slip_atr_k': 0.18612507754535615, 'slip_spread_k': 0.634369514294207, 'spread_hl_frac': 0.014501091342985516, 'bb_std_mult': 1.9310376694413203, 'rsi_os': 32, 'rsi_ob': 92, 'vol_spike': 0.2410574582096336, 'adx_thresh': 21.095572046040754, 'atr_min_pct': 0.017562316968410555, 'atr_max_pct': 0.06758189191254231, 'tp_mult': 1.2774398030655838, 'tsl_mult': 0.9998831811221315, 'strategy': 'breakout', 'time_stop': 18, 'use_sma': True, 'use_atr': False, 'use_adx': False, 'use_ema': False, 'use_spike': True, 'rsi_required': True, 'edge_k': 1.919375662629574, 'edge_cap': 0.6895835562351302, 'bull_strategy': 'mean_reversion', 'bull_bb_std_mult': 3.3565418822152298, 'bull_rsi_os': 11, 'bull_rsi_ob': 79, 'bull_adx_thresh': 6.583238543577684, 'bull_atr_min_pct': 0.005309497746178707, 'bull_atr_max_pct': 0.013162962936595541, 'bull_tp_mult': 1.6720593447525203, 'bull_tsl_mult': 0.9614111401855261, 'bull_time_stop': 120, 'bull_use_sma': False, 'bull_use_ema': False, 'bull_use_atr': True, 'bull_use_adx': True, 'bull_use_spike': True, 'bull_rsi_required': True, 'bear_strategy': 'breakout', 'bear_bb_std_mult': 2.2670683560581186, 'bear_rsi_os': 12, 'bear_rsi_ob': 49, 'bear_adx_thresh': 25.8256242123506, 'bear_atr_min_pct': 0.01004555690446363, 'bear_atr_max_pct': 0.11951484962866157, 'bear_tp_mult': 2.703974998737173, 'bear_tsl_mult': 0.22237367545285283, 'bear_time_stop': 48, 'bear_use_sma': False, 'bear_use_ema': False, 'bear_use_atr': False, 'bear_use_adx': False, 'bear_use_spike': True, 'bear_rsi_required': True, 'sideways_strategy': 'breakout', 'sideways_bb_std_mult': 1.5495912229635669, 'sideways_rsi_os': 36, 'sideways_rsi_ob': 91, 'sideways_adx_thresh': 16.141520734105946, 'sideways_atr_min_pct': 0.011540404836921423, 'sideways_atr_max_pct': 0.1077727670762235, 'sideways_tp_mult': 2.647575571343523, 'sideways_tsl_mult': 0.14169980522046055, 'sideways_time_stop': 144, 'sideways_use_sma': True, 'sideways_use_ema': False, 'sideways_use_atr': True, 'sideways_use_adx': False, 'sideways_use_spike': False, 'sideways_rsi_required': True}.
[I 2025-08-30 14:37:01,060] Trial 132 finished with values: [-1000000000.0, 1000000000.0] and parameters: {'p_sma': 41, 'p_std': 32, 'p_atr': 28, 'p_adx': 22, 'rsi_period': 66, 'ema1': 26, 'ema2': 54, 'slip_atr_k': 0.022396653215417724, 'slip_spread_k': 0.2324980907703048, 'spread_hl_frac': 0.002644794938740702, 'bb_std_mult': 1.9571108682046057, 'rsi_os': 39, 'rsi_ob': 92, 'vol_spike': 0.2395514170792964, 'adx_thresh': 21.007818748559533, 'atr_min_pct': 0.00549351045285563, 'atr_max_pct': 0.06716577421314329, 'tp_mult': 2.6238597645794512, 'tsl_mult': 0.9339436702095536, 'strategy': 'breakout', 'time_stop': 19, 'use_sma': True, 'use_atr': False, 'use_adx': False, 'use_ema': False, 'use_spike': True, 'rsi_required': True, 'edge_k': 0.3918382279178766, 'edge_cap': 0.08351037275035439, 'bull_strategy': 'breakout', 'bull_bb_std_mult': 3.5840662376531522, 'bull_rsi_os': 42, 'bull_rsi_ob': 72, 'bull_adx_thresh': 26.59648962262841, 'bull_atr_min_pct': 0.00425592422574826, 'bull_atr_max_pct': 0.02800934859448669, 'bull_tp_mult': 1.2515617948143316, 'bull_tsl_mult': 0.35205229856986664, 'bull_time_stop': 85, 'bull_use_sma': False, 'bull_use_ema': False, 'bull_use_atr': True, 'bull_use_adx': True, 'bull_use_spike': True, 'bull_rsi_required': False, 'bear_strategy': 'breakout', 'bear_bb_std_mult': 2.6788300060875576, 'bear_rsi_os': 12, 'bear_rsi_ob': 47, 'bear_adx_thresh': 20.93667179687824, 'bear_atr_min_pct': 0.011120971269193506, 'bear_atr_max_pct': 0.01869812401578611, 'bear_tp_mult': 2.7451778691983257, 'bear_tsl_mult': 0.5822083215427938, 'bear_time_stop': 56, 'bear_use_sma': False, 'bear_use_ema': False, 'bear_use_atr': False, 'bear_use_adx': False, 'bear_use_spike': True, 'bear_rsi_required': True, 'sideways_strategy': 'breakout', 'sideways_bb_std_mult': 3.168409256557786, 'sideways_rsi_os': 32, 'sideways_rsi_ob': 85, 'sideways_adx_thresh': 20.49433163074371, 'sideways_atr_min_pct': 0.00981236558368101, 'sideways_atr_max_pct': 0.027679330007013905, 'sideways_tp_mult': 2.958337755819433, 'sideways_tsl_mult': 0.08713634625666095, 'sideways_time_stop': 143, 'sideways_use_sma': True, 'sideways_use_ema': False, 'sideways_use_atr': False, 'sideways_use_adx': True, 'sideways_use_spike': False, 'sideways_rsi_required': True}.
[I 2025-08-30 14:37:01,228] Trial 134 finished with values: [-1000000000.0, 1000000000.0] and parameters: {'p_sma': 27, 'p_std': 26, 'p_atr': 11, 'p_adx': 11, 'rsi_period': 53, 'ema1': 28, 'ema2': 51, 'slip_atr_k': 0.2022265310127645, 'slip_spread_k': 0.22386409727971218, 'spread_hl_frac': 0.014047526984511323, 'bb_std_mult': 1.9758142941562824, 'rsi_os': 30, 'rsi_ob': 92, 'vol_spike': 0.20821429198564087, 'adx_thresh': 28.288631086347536, 'atr_min_pct': 0.013486078495390056, 'atr_max_pct': 0.036931714222637316, 'tp_mult': 2.382270220133495, 'tsl_mult': 0.988421100587536, 'strategy': 'breakout', 'time_stop': 46, 'use_sma': True, 'use_atr': False, 'use_adx': False, 'use_ema': False, 'use_spike': False, 'rsi_required': True, 'edge_k': 1.5522197033537988, 'edge_cap': 0.6489625715914549, 'bull_strategy': 'mean_reversion', 'bull_bb_std_mult': 1.973166258032715, 'bull_rsi_os': 42, 'bull_rsi_ob': 69, 'bull_adx_thresh': 18.031271634275374, 'bull_atr_min_pct': 0.004152910370385945, 'bull_atr_max_pct': 0.026996691271937955, 'bull_tp_mult': 1.4032686472616984, 'bull_tsl_mult': 0.96315904440108, 'bull_time_stop': 244, 'bull_use_sma': False, 'bull_use_ema': False, 'bull_use_atr': True, 'bull_use_adx': True, 'bull_use_spike': False, 'bull_rsi_required': True, 'bear_strategy': 'breakout', 'bear_bb_std_mult': 1.469867353228456, 'bear_rsi_os': 13, 'bear_rsi_ob': 47, 'bear_adx_thresh': 13.13951808308719, 'bear_atr_min_pct': 0.010027973579212292, 'bear_atr_max_pct': 0.12029003531043196, 'bear_tp_mult': 2.677535976802731, 'bear_tsl_mult': 0.21929648046232264, 'bear_time_stop': 56, 'bear_use_sma': False, 'bear_use_ema': False, 'bear_use_atr': False, 'bear_use_adx': False, 'bear_use_spike': True, 'bear_rsi_required': False, 'sideways_strategy': 'breakout', 'sideways_bb_std_mult': 3.1719499374035083, 'sideways_rsi_os': 32, 'sideways_rsi_ob': 68, 'sideways_adx_thresh': 21.182205635891698, 'sideways_atr_min_pct': 0.011113847486276316, 'sideways_atr_max_pct': 0.10740049257174315, 'sideways_tp_mult': 2.9408894099547345, 'sideways_tsl_mult': 0.44887439503840537, 'sideways_time_stop': 217, 'sideways_use_sma': True, 'sideways_use_ema': False, 'sideways_use_atr': True, 'sideways_use_adx': False, 'sideways_use_spike': False, 'sideways_rsi_required': True}.
