[I 2025-08-30 14:50:18,340] Trial 243 finished with values: [-1000000000.0, 1000000000.0] and parameters: {'p_sma': 12, 'p_std': 30, 'p_atr': 12, 'p_adx': 9, 'rsi_period': 17, 'ema1': 11, 'ema2': 24, 'slip_atr_k': 0.11201551426333081, 'slip_spread_k': 0.501333843466805, 'spread_hl_frac': 0.001863535191186639, 'bb_std_mult': 3.277593806763109, 'rsi_os': 7, 'rsi_ob': 88, 'vol_spike': 0.23578586803186752, 'adx_thresh': 8.593126246159096, 'atr_min_pct': 0.009019301492532114, 'atr_max_pct': 0.09654952172166376, 'tp_mult': 2.556292866677066, 'tsl_mult': 0.9473516988350241, 'strategy': 'mean_reversion', 'time_stop': 177, 'use_sma': False, 'use_atr': False, 'use_adx': True, 'use_ema': False, 'use_spike': False, 'rsi_required': False, 'edge_k': 1.7353548731362565, 'edge_cap': 0.7176236301296918, 'bull_strategy': 'breakout', 'bull_bb_std_mult': 3.1953469463664024, 'bull_rsi_os': 45, 'bull_rsi_ob': 76, 'bull_adx_thresh': 13.711120561793619, 'bull_atr_min_pct': 0.007956214924317685, 'bull_atr_max_pct': 0.025381422705542514, 'bull_tp_mult': 2.3199909876624303, 'bull_tsl_mult': 0.5329711766383343, 'bull_time_stop': 278, 'bull_use_sma': False, 'bull_use_ema': False, 'bull_use_atr': True, 'bull_use_adx': False, 'bull_use_spike': True, 'bull_rsi_required': False, 'bear_strategy': 'breakout', 'bear_bb_std_mult': 1.0506082505044936, 'bear_rsi_os': 43, 'bear_rsi_ob': 49, 'bear_adx_thresh': 16.73561936387334, 'bear_atr_min_pct': 0.011470139858217486, 'bear_atr_max_pct': 0.04555738471747006, 'bear_tp_mult': 2.9298536196993554, 'bear_tsl_mult': 0.9370151955955952, 'bear_time_stop': 32, 'bear_use_sma': True, 'bear_use_ema': True, 'bear_use_atr': True, 'bear_use_adx': True, 'bear_use_spike': False, 'bear_rsi_required': True, 'sideways_strategy': 'mean_reversion', 'sideways_bb_std_mult': 2.9075075180002217, 'sideways_rsi_os': 25, 'sideways_rsi_ob': 88, 'sideways_adx_thresh': 13.17543530529958, 'sideways_atr_min_pct': 0.006429212751548915, 'sideways_atr_max_pct': 0.06217453272375703, 'sideways_tp_mult': 2.761396385504208, 'sideways_tsl_mult': 0.0597960994819148, 'sideways_time_stop': 230, 'sideways_use_sma': False, 'sideways_use_ema': False, 'sideways_use_atr': False, 'sideways_use_adx': True, 'sideways_use_spike': True, 'sideways_rsi_required': False}.
[I 2025-08-30 14:50:18,745] Trial 246 finished with values: [-1000000000.0, 1000000000.0] and parameters: {'p_sma': 14, 'p_std': 47, 'p_atr': 26, 'p_adx': 12, 'rsi_period': 14, 'ema1': 22, 'ema2': 49, 'slip_atr_k': 0.22226962228877153, 'slip_spread_k': 0.24943329155654212, 'spread_hl_frac': 0.003423977080534857, 'bb_std_mult': 2.4711623027480347, 'rsi_os': 33, 'rsi_ob': 90, 'vol_spike': 0.14477924003504955, 'adx_thresh': 21.118875356292495, 'atr_min_pct': 0.01771726960348456, 'atr_max_pct': 0.12800673206236515, 'tp_mult': 2.6149332656489888, 'tsl_mult': 0.9852037103022432, 'strategy': 'mean_reversion', 'time_stop': 219, 'use_sma': True, 'use_atr': True, 'use_adx': False, 'use_ema': True, 'use_spike': False, 'rsi_required': False, 'edge_k': 0.4074182815569577, 'edge_cap': 0.7137932149447187, 'bull_strategy': 'breakout', 'bull_bb_std_mult': 3.251089238512761, 'bull_rsi_os': 15, 'bull_rsi_ob': 78, 'bull_adx_thresh': 13.766921959958825, 'bull_atr_min_pct': 0.021598456155394408, 'bull_atr_max_pct': 0.06569324903350644, 'bull_tp_mult': 1.3832847658558765, 'bull_tsl_mult': 0.5137866187644611, 'bull_time_stop': 265, 'bull_use_sma': True, 'bull_use_ema': False, 'bull_use_atr': False, 'bull_use_adx': True, 'bull_use_spike': False, 'bull_rsi_required': True, 'bear_strategy': 'mean_reversion', 'bear_bb_std_mult': 3.347778519117423, 'bear_rsi_os': 40, 'bear_rsi_ob': 49, 'bear_adx_thresh': 16.92073398946572, 'bear_atr_min_pct': 0.011368185832641294, 'bear_atr_max_pct': 0.023064342400411067, 'bear_tp_mult': 2.0505838545979893, 'bear_tsl_mult': 0.7498807503816929, 'bear_time_stop': 169, 'bear_use_sma': False, 'bear_use_ema': False, 'bear_use_atr': False, 'bear_use_adx': False, 'bear_use_spike': True, 'bear_rsi_required': True, 'sideways_strategy': 'breakout', 'sideways_bb_std_mult': 2.5401306168600533, 'sideways_rsi_os': 30, 'sideways_rsi_ob': 90, 'sideways_adx_thresh': 17.52747599500116, 'sideways_atr_min_pct': 0.005097246273215318, 'sideways_atr_max_pct': 0.07918844621332637, 'sideways_tp_mult': 2.712772072441098, 'sideways_tsl_mult': 0.4521323827163227, 'sideways_time_stop': 229, 'sideways_use_sma': True, 'sideways_use_ema': False, 'sideways_use_atr': False, 'sideways_use_adx': True, 'sideways_use_spike': False, 'sideways_rsi_required': True}.
[I 2025-08-30 14:50:18,956] Trial 244 finished with values: [-1000000000.0, 1000000000.0] and parameters: {'p_sma': 43, 'p_std': 30, 'p_atr': 26, 'p_adx': 8, 'rsi_period': 75, 'ema1': 27, 'ema2': 52, 'slip_atr_k': 0.07429633529315713, 'slip_spread_k': 0.8738436770679934, 'spread_hl_frac': 0.02867112253847666, 'bb_std_mult': 2.0364085267634975, 'rsi_os': 33, 'rsi_ob': 90, 'vol_spike': 0.24553773201885035, 'adx_thresh': 8.243277308390013, 'atr_min_pct': 0.016479387096755706, 'atr_max_pct': 0.10969267738877739, 'tp_mult': 2.60674285171808, 'tsl_mult': 0.9782337099832987, 'strategy': 'mean_reversion', 'time_stop': 235, 'use_sma': False, 'use_atr': False, 'use_adx': True, 'use_ema': False, 'use_spike': False, 'rsi_required': False, 'edge_k': 0.999760211571359, 'edge_cap': 0.722982151709074, 'bull_strategy': 'breakout', 'bull_bb_std_mult': 3.239977699922707, 'bull_rsi_os': 15, 'bull_rsi_ob': 76, 'bull_adx_thresh': 13.0001190316266, 'bull_atr_min_pct': 0.004425661845856429, 'bull_atr_max_pct': 0.02436358574016418, 'bull_tp_mult': 1.1684212856611689, 'bull_tsl_mult': 0.5361807757147988, 'bull_time_stop': 281, 'bull_use_sma': False, 'bull_use_ema': False, 'bull_use_atr': True, 'bull_use_adx': False, 'bull_use_spike': False, 'bull_rsi_required': False, 'bear_strategy': 'breakout', 'bear_bb_std_mult': 3.3522109613246247, 'bear_rsi_os': 15, 'bear_rsi_ob': 49, 'bear_adx_thresh': 18.464523913706426, 'bear_atr_min_pct': 7.765413408113847e-05, 'bear_atr_max_pct': 0.12640629118135088, 'bear_tp_mult': 1.1436849763546797, 'bear_tsl_mult': 0.9161596683247396, 'bear_time_stop': 60, 'bear_use_sma': True, 'bear_use_ema': True, 'bear_use_atr': True, 'bear_use_adx': True, 'bear_use_spike': False, 'bear_rsi_required': True, 'sideways_strategy': 'breakout', 'sideways_bb_std_mult': 2.163112720164892, 'sideways_rsi_os': 30, 'sideways_rsi_ob': 88, 'sideways_adx_thresh': 19.239739804545774, 'sideways_atr_min_pct': 0.00498073690573857, 'sideways_atr_max_pct': 0.061680344184714034, 'sideways_tp_mult': 2.7226515018492785, 'sideways_tsl_mult': 0.2974926868903607, 'sideways_time_stop': 213, 'sideways_use_sma': False, 'sideways_use_ema': False, 'sideways_use_atr': False, 'sideways_use_adx': True, 'sideways_use_spike': True, 'sideways_rsi_required': False}.
[I 2025-08-30 14:50:19,066] Trial 245 finished with values: [-0.018858949728093877, 0.018968016723532863] and parameters: {'p_sma': 32, 'p_std': 29, 'p_atr': 11, 'p_adx': 22, 'rsi_period': 55, 'ema1': 28, 'ema2': 39, 'slip_atr_k': 0.020121135940686874, 'slip_spread_k': 0.8817578247732085, 'spread_hl_frac': 0.005741569786401988, 'bb_std_mult': 1.5693002865016306, 'rsi_os': 33, 'rsi_ob': 90, 'vol_spike': 0.23860568829451673, 'adx_thresh': 8.408116788475121, 'atr_min_pct': 0.01652089741934338, 'atr_max_pct': 0.10976091337614677, 'tp_mult': 2.2624304992364737, 'tsl_mult': 0.4160138458408653, 'strategy': 'mean_reversion', 'time_stop': 25, 'use_sma': True, 'use_atr': False, 'use_adx': False, 'use_ema': False, 'use_spike': False, 'rsi_required': False, 'edge_k': 1.6414665878054868, 'edge_cap': 0.7118724748509853, 'bull_strategy': 'breakout', 'bull_bb_std_mult': 3.2518708873357913, 'bull_rsi_os': 22, 'bull_rsi_ob': 76, 'bull_adx_thresh': 13.859859944515653, 'bull_atr_min_pct': 0.0024987818729069037, 'bull_atr_max_pct': 0.13222776715829218, 'bull_tp_mult': 1.3724578799715157, 'bull_tsl_mult': 0.5269536217857493, 'bull_time_stop': 282, 'bull_use_sma': True, 'bull_use_ema': False, 'bull_use_atr': False, 'bull_use_adx': False, 'bull_use_spike': False, 'bull_rsi_required': True, 'bear_strategy': 'breakout', 'bear_bb_std_mult': 1.487210513288042, 'bear_rsi_os': 40, 'bear_rsi_ob': 49, 'bear_adx_thresh': 17.091871015370618, 'bear_atr_min_pct': 0.011438827876186271, 'bear_atr_max_pct': 0.025923556765626236, 'bear_tp_mult': 2.0568714686037537, 'bear_tsl_mult': 0.5051442227377229, 'bear_time_stop': 61, 'bear_use_sma': True, 'bear_use_ema': False, 'bear_use_atr': False, 'bear_use_adx': False, 'bear_use_spike': True, 'bear_rsi_required': True, 'sideways_strategy': 'breakout', 'sideways_bb_std_mult': 2.2202425820033365, 'sideways_rsi_os': 30, 'sideways_rsi_ob': 88, 'sideways_adx_thresh': 17.463869944926273, 'sideways_atr_min_pct': 0.003614387419308048, 'sideways_atr_max_pct': 0.07895013246085154, 'sideways_tp_mult': 2.7155434447059648, 'sideways_tsl_mult': 0.06328290902218897, 'sideways_time_stop': 216, 'sideways_use_sma': True, 'sideways_use_ema': False, 'sideways_use_atr': False, 'sideways_use_adx': True, 'sideways_use_spike': True, 'sideways_rsi_required': True}.
[I 2025-08-30 14:50:50,740] Trial 247 finished with values: [-0.015660063464395524, 0.015573537304643467] and parameters: {'p_sma': 51, 'p_std': 29, 'p_atr': 25, 'p_adx': 12, 'rsi_period': 53, 'ema1': 27, 'ema2': 52, 'slip_atr_k': 0.05992352144433785, 'slip_spread_k': 0.8116828506249523, 'spread_hl_frac': 0.0035251005797130746, 'bb_std_mult': 3.136492448785485, 'rsi_os': 33, 'rsi_ob': 80, 'vol_spike': 0.2458007545311779, 'adx_thresh': 21.01256621021127, 'atr_min_pct': 0.01661943248216069, 'atr_max_pct': 0.12847074780789752, 'tp_mult': 2.1915121508303654, 'tsl_mult': 0.41163476523993237, 'strategy': 'mean_reversion', 'time_stop': 134, 'use_sma': True, 'use_atr': True, 'use_adx': False, 'use_ema': True, 'use_spike': False, 'rsi_required': False, 'edge_k': 0.9144358158710996, 'edge_cap': 0.689491265082949, 'bull_strategy': 'breakout', 'bull_bb_std_mult': 2.824518430298153, 'bull_rsi_os': 43, 'bull_rsi_ob': 78, 'bull_adx_thresh': 12.884585644681646, 'bull_atr_min_pct': 0.0017867397473944728, 'bull_atr_max_pct': 0.019874746908000257, 'bull_tp_mult': 1.365103857477324, 'bull_tsl_mult': 0.6647081499453336, 'bull_time_stop': 269, 'bull_use_sma': True, 'bull_use_ema': True, 'bull_use_atr': False, 'bull_use_adx': True, 'bull_use_spike': False, 'bull_rsi_required': True, 'bear_strategy': 'mean_reversion', 'bear_bb_std_mult': 1.4670770455962374, 'bear_rsi_os': 15, 'bear_rsi_ob': 50, 'bear_adx_thresh': 17.596669530696545, 'bear_atr_min_pct': 0.011703002621596882, 'bear_atr_max_pct': 0.02608755293150147, 'bear_tp_mult': 2.0506649650820497, 'bear_tsl_mult': 0.5088168478416225, 'bear_time_stop': 41, 'bear_use_sma': False, 'bear_use_ema': False, 'bear_use_atr': False, 'bear_use_adx': False, 'bear_use_spike': True, 'bear_rsi_required': True, 'sideways_strategy': 'breakout', 'sideways_bb_std_mult': 3.161800864713537, 'sideways_rsi_os': 40, 'sideways_rsi_ob': 90, 'sideways_adx_thresh': 17.376521531620533, 'sideways_atr_min_pct': 0.0048489257749155575, 'sideways_atr_max_pct': 0.14674032578121593, 'sideways_tp_mult': 2.713629547461141, 'sideways_tsl_mult': 0.43261889456710606, 'sideways_time_stop': 239, 'sideways_use_sma': True, 'sideways_use_ema': False, 'sideways_use_atr': False, 'sideways_use_adx': True, 'sideways_use_spike': False, 'sideways_rsi_required': True}.
[I 2025-08-30 14:50:51,425] Trial 250 finished with values: [-1000000000.0, 1000000000.0] and parameters: {'p_sma': 52, 'p_std': 28, 'p_atr': 14, 'p_adx': 23, 'rsi_period': 72, 'ema1': 5, 'ema2': 38, 'slip_atr_k': 0.06102930521235342, 'slip_spread_k': 0.3743370081526133, 'spread_hl_frac': 0.005768857485033864, 'bb_std_mult': 3.1376923866275996, 'rsi_os': 32, 'rsi_ob': 91, 'vol_spike': 0.2401539883536753, 'adx_thresh': 13.944529097564349, 'atr_min_pct': 0.02001948396924242, 'atr_max_pct': 0.1042990958524554, 'tp_mult': 2.9027469812167728, 'tsl_mult': 0.42158350278153633, 'strategy': 'mean_reversion', 'time_stop': 134, 'use_sma': True, 'use_atr': False, 'use_adx': False, 'use_ema': False, 'use_spike': True, 'rsi_required': True, 'edge_k': 1.6312222384837238, 'edge_cap': 0.6929518949654021, 'bull_strategy': 'mean_reversion', 'bull_bb_std_mult': 0.6785261974028909, 'bull_rsi_os': 34, 'bull_rsi_ob': 55, 'bull_adx_thresh': 30.79900999205912, 'bull_atr_min_pct': 0.002534789300297791, 'bull_atr_max_pct': 0.019959146798949376, 'bull_tp_mult': 1.487713400476865, 'bull_tsl_mult': 0.5170498869955996, 'bull_time_stop': 67, 'bull_use_sma': True, 'bull_use_ema': True, 'bull_use_atr': False, 'bull_use_adx': True, 'bull_use_spike': False, 'bull_rsi_required': True, 'bear_strategy': 'mean_reversion', 'bear_bb_std_mult': 0.8365796952376563, 'bear_rsi_os': 14, 'bear_rsi_ob': 50, 'bear_adx_thresh': 17.600414713918735, 'bear_atr_min_pct': 0.0034477589911127687, 'bear_atr_max_pct': 0.026731099264868097, 'bear_tp_mult': 2.1284272422212354, 'bear_tsl_mult': 0.5060591409193161, 'bear_time_stop': 42, 'bear_use_sma': False, 'bear_use_ema': False, 'bear_use_atr': False, 'bear_use_adx': False, 'bear_use_spike': True, 'bear_rsi_required': False, 'sideways_strategy': 'breakout', 'sideways_bb_std_mult': 3.1893191935300242, 'sideways_rsi_os': 33, 'sideways_rsi_ob': 83, 'sideways_adx_thresh': 16.69265715532515, 'sideways_atr_min_pct': 0.0037208645116685013, 'sideways_atr_max_pct': 0.03767106212727434, 'sideways_tp_mult': 2.3427827318604137, 'sideways_tsl_mult': 0.5782927046060282, 'sideways_time_stop': 224, 'sideways_use_sma': True, 'sideways_use_ema': False, 'sideways_use_atr': True, 'sideways_use_adx': False, 'sideways_use_spike': True, 'sideways_rsi_required': True}.
[I 2025-08-30 14:50:51,639] Trial 248 finished with values: [-1000000000.0, 1000000000.0] and parameters: {'p_sma': 33, 'p_std': 37, 'p_atr': 8, 'p_adx': 23, 'rsi_period': 52, 'ema1': 28, 'ema2': 52, 'slip_atr_k': 0.05994204078109744, 'slip_spread_k': 0.37088501672407304, 'spread_hl_frac': 0.004819890560235086, 'bb_std_mult': 3.1074573379947275, 'rsi_os': 33, 'rsi_ob': 91, 'vol_spike': 0.24468631613506645, 'adx_thresh': 19.8379386133345, 'atr_min_pct': 0.020006203856616035, 'atr_max_pct': 0.10913326163214541, 'tp_mult': 2.2737678735048186, 'tsl_mult': 0.4123765437688591, 'strategy': 'mean_reversion', 'time_stop': 258, 'use_sma': True, 'use_atr': False, 'use_adx': False, 'use_ema': False, 'use_spike': True, 'rsi_required': False, 'edge_k': 1.6369252424414797, 'edge_cap': 0.6887315427779426, 'bull_strategy': 'breakout', 'bull_bb_std_mult': 2.8185959497150064, 'bull_rsi_os': 34, 'bull_rsi_ob': 55, 'bull_adx_thresh': 8.678865736985435, 'bull_atr_min_pct': 0.002497014863511187, 'bull_atr_max_pct': 0.02019754477474516, 'bull_tp_mult': 1.885464183959947, 'bull_tsl_mult': 0.6509231959360833, 'bull_time_stop': 247, 'bull_use_sma': False, 'bull_use_ema': True, 'bull_use_atr': True, 'bull_use_adx': True, 'bull_use_spike': False, 'bull_rsi_required': True, 'bear_strategy': 'breakout', 'bear_bb_std_mult': 0.8139331666749741, 'bear_rsi_os': 13, 'bear_rsi_ob': 50, 'bear_adx_thresh': 17.722042016032017, 'bear_atr_min_pct': 0.003383809415771436, 'bear_atr_max_pct': 0.12749430840355297, 'bear_tp_mult': 1.903021083659478, 'bear_tsl_mult': 0.9114801393832276, 'bear_time_stop': 220, 'bear_use_sma': False, 'bear_use_ema': False, 'bear_use_atr': False, 'bear_use_adx': False, 'bear_use_spike': True, 'bear_rsi_required': False, 'sideways_strategy': 'breakout', 'sideways_bb_std_mult': 0.6097516565403029, 'sideways_rsi_os': 10, 'sideways_rsi_ob': 83, 'sideways_adx_thresh': 14.786685636859428, 'sideways_atr_min_pct': 0.026394537728387707, 'sideways_atr_max_pct': 0.08276617540041256, 'sideways_tp_mult': 2.712995796366938, 'sideways_tsl_mult': 0.5852970532925333, 'sideways_time_stop': 240, 'sideways_use_sma': False, 'sideways_use_ema': False, 'sideways_use_atr': False, 'sideways_use_adx': True, 'sideways_use_spike': True, 'sideways_rsi_required': True}.
[I 2025-08-30 14:50:51,775] Trial 249 finished with values: [-1000000000.0, 1000000000.0] and parameters: {'p_sma': 32, 'p_std': 58, 'p_atr': 23, 'p_adx': 23, 'rsi_period': 53, 'ema1': 5, 'ema2': 53, 'slip_atr_k': 0.010408128211478202, 'slip_spread_k': 0.9837408376126787, 'spread_hl_frac': 0.003607079159759494, 'bb_std_mult': 3.1127531561269994, 'rsi_os': 32, 'rsi_ob': 80, 'vol_spike': 0.0009641973042136542, 'adx_thresh': 20.232196692135158, 'atr_min_pct': 0.020221039612373076, 'atr_max_pct': 0.10417565037754539, 'tp_mult': 2.8954850520106117, 'tsl_mult': 0.9859904237843763, 'strategy': 'breakout', 'time_stop': 78, 'use_sma': True, 'use_atr': False, 'use_adx': False, 'use_ema': False, 'use_spike': True, 'rsi_required': True, 'edge_k': 0.9125431128767124, 'edge_cap': 0.6914501496361924, 'bull_strategy': 'mean_reversion', 'bull_bb_std_mult': 0.7158604957030548, 'bull_rsi_os': 18, 'bull_rsi_ob': 77, 'bull_adx_thresh': 8.750015089806823, 'bull_atr_min_pct': 0.0024948319009330446, 'bull_atr_max_pct': 0.06177826081115979, 'bull_tp_mult': 1.5040211310483258, 'bull_tsl_mult': 0.5005598762633661, 'bull_time_stop': 268, 'bull_use_sma': True, 'bull_use_ema': True, 'bull_use_atr': False, 'bull_use_adx': True, 'bull_use_spike': False, 'bull_rsi_required': True, 'bear_strategy': 'breakout', 'bear_bb_std_mult': 0.8346951002575078, 'bear_rsi_os': 12, 'bear_rsi_ob': 66, 'bear_adx_thresh': 17.51689028816506, 'bear_atr_min_pct': 0.003226972232338631, 'bear_atr_max_pct': 0.025544042872437674, 'bear_tp_mult': 2.003492476592327, 'bear_tsl_mult': 0.5092193087624585, 'bear_time_stop': 115, 'bear_use_sma': False, 'bear_use_ema': False, 'bear_use_atr': False, 'bear_use_adx': False, 'bear_use_spike': True, 'bear_rsi_required': False, 'sideways_strategy': 'breakout', 'sideways_bb_std_mult': 0.6203676837224292, 'sideways_rsi_os': 41, 'sideways_rsi_ob': 91, 'sideways_adx_thresh': 25.209875661054824, 'sideways_atr_min_pct': 0.0037339063466014857, 'sideways_atr_max_pct': 0.08290106626395184, 'sideways_tp_mult': 2.678791788505714, 'sideways_tsl_mult': 0.13554145514763627, 'sideways_time_stop': 119, 'sideways_use_sma': True, 'sideways_use_ema': False, 'sideways_use_atr': True, 'sideways_use_adx': False, 'sideways_use_spike': True, 'sideways_rsi_required': True}.
[I 2025-08-30 14:51:24,948] Trial 251 finished with values: [-1000000000.0, 1000000000.0] and parameters: {'p_sma': 32, 'p_std': 28, 'p_atr': 14, 'p_adx': 25, 'rsi_period': 52, 'ema1': 5, 'ema2': 40, 'slip_atr_k': 0.23471821632197765, 'slip_spread_k': 0.3778522034978873, 'spread_hl_frac': 0.011937712537301835, 'bb_std_mult': 1.4182466750487843, 'rsi_os': 34, 'rsi_ob': 91, 'vol_spike': 0.23890898279497566, 'adx_thresh': 20.53101567896301, 'atr_min_pct': 0.00021234105402967267, 'atr_max_pct': 0.10459761417472432, 'tp_mult': 2.8874470294941434, 'tsl_mult': 0.9985440946970593, 'strategy': 'mean_reversion', 'time_stop': 77, 'use_sma': True, 'use_atr': True, 'use_adx': False, 'use_ema': True, 'use_spike': True, 'rsi_required': False, 'edge_k': 1.6338204611632634, 'edge_cap': 0.6930084112146214, 'bull_strategy': 'mean_reversion', 'bull_bb_std_mult': 2.863879311094583, 'bull_rsi_os': 18, 'bull_rsi_ob': 47, 'bull_adx_thresh': 12.926235543569698, 'bull_atr_min_pct': 0.0026575668080182266, 'bull_atr_max_pct': 0.019916061828293065, 'bull_tp_mult': 1.5038677296004708, 'bull_tsl_mult': 0.05166359878625282, 'bull_time_stop': 67, 'bull_use_sma': True, 'bull_use_ema': True, 'bull_use_atr': False, 'bull_use_adx': True, 'bull_use_spike': False, 'bull_rsi_required': True, 'bear_strategy': 'mean_reversion', 'bear_bb_std_mult': 0.8362730189590224, 'bear_rsi_os': 52, 'bear_rsi_ob': 66, 'bear_adx_thresh': 17.66845769774394, 'bear_atr_min_pct': 0.026600375653028203, 'bear_atr_max_pct': 0.02629944421720344, 'bear_tp_mult': 2.13637854320913, 'bear_tsl_mult': 0.5012148052598914, 'bear_time_stop': 43, 'bear_use_sma': False, 'bear_use_ema': False, 'bear_use_atr': False, 'bear_use_adx': False, 'bear_use_spike': True, 'bear_rsi_required': False, 'sideways_strategy': 'breakout', 'sideways_bb_std_mult': 3.0849882087669673, 'sideways_rsi_os': 31, 'sideways_rsi_ob': 83, 'sideways_adx_thresh': 16.52341018280197, 'sideways_atr_min_pct': 0.024890924259586132, 'sideways_atr_max_pct': 0.08213716589587917, 'sideways_tp_mult': 2.666231099671478, 'sideways_tsl_mult': 0.13851080400650512, 'sideways_time_stop': 118, 'sideways_use_sma': False, 'sideways_use_ema': False, 'sideways_use_atr': True, 'sideways_use_adx': False, 'sideways_use_spike': False, 'sideways_rsi_required': True}.
