[I 2025-08-30 15:01:59,466] Trial 331 finished with values: [-0.024648553065253487, 0.024606521594514857] and parameters: {'p_sma': 9, 'p_std': 54, 'p_atr': 16, 'p_adx': 29, 'rsi_period': 47, 'ema1': 30, 'ema2': 17, 'slip_atr_k': 0.0468053037925144, 'slip_spread_k': 0.6148593906032291, 'spread_hl_frac': 0.021853487183678917, 'bb_std_mult': 3.406203765504662, 'rsi_os': 28, 'rsi_ob': 81, 'vol_spike': 0.29783961386606966, 'adx_thresh': 28.96206182338169, 'atr_min_pct': 0.014812443464985557, 'atr_max_pct': 0.06964136749396516, 'tp_mult': 1.6267944195916844, 'tsl_mult': 0.03078067453590929, 'strategy': 'breakout', 'time_stop': 114, 'use_sma': False, 'use_atr': True, 'use_adx': False, 'use_ema': True, 'use_spike': True, 'rsi_required': True, 'edge_k': 1.1762888438782013, 'edge_cap': 0.6070250101137007, 'bull_strategy': 'mean_reversion', 'bull_bb_std_mult': 2.5676124473789312, 'bull_rsi_os': 31, 'bull_rsi_ob': 87, 'bull_adx_thresh': 24.99868886972498, 'bull_atr_min_pct': 0.006393189121684971, 'bull_atr_max_pct': 0.07880638891480973, 'bull_tp_mult': 1.6315924015348886, 'bull_tsl_mult': 0.6203876002399222, 'bull_time_stop': 106, 'bull_use_sma': False, 'bull_use_ema': False, 'bull_use_atr': False, 'bull_use_adx': False, 'bull_use_spike': False, 'bull_rsi_required': True, 'bear_strategy': 'mean_reversion', 'bear_bb_std_mult': 0.9499221209322264, 'bear_rsi_os': 8, 'bear_rsi_ob': 75, 'bear_adx_thresh': 31.268053802923795, 'bear_atr_min_pct': 0.015654663459745793, 'bear_atr_max_pct': 0.010204936967778341, 'bear_tp_mult': 1.3020623776683804, 'bear_tsl_mult': 0.01936845595352982, 'bear_time_stop': 99, 'bear_use_sma': True, 'bear_use_ema': True, 'bear_use_atr': True, 'bear_use_adx': False, 'bear_use_spike': False, 'bear_rsi_required': False, 'sideways_strategy': 'breakout', 'sideways_bb_std_mult': 3.574061922125393, 'sideways_rsi_os': 42, 'sideways_rsi_ob': 57, 'sideways_adx_thresh': 26.475725612774745, 'sideways_atr_min_pct': 0.0008411170919273142, 'sideways_atr_max_pct': 0.08878870886559868, 'sideways_tp_mult': 2.2908663833859153, 'sideways_tsl_mult': 0.4657662679900451, 'sideways_time_stop': 5, 'sideways_use_sma': True, 'sideways_use_ema': True, 'sideways_use_atr': True, 'sideways_use_adx': False, 'sideways_use_spike': True, 'sideways_rsi_required': False}.
[I 2025-08-30 15:02:35,725] Trial 337 finished with values: [-1000000000.0, 1000000000.0] and parameters: {'p_sma': 11, 'p_std': 53, 'p_atr': 15, 'p_adx': 19, 'rsi_period': 43, 'ema1': 30, 'ema2': 18, 'slip_atr_k': 0.03526875399727727, 'slip_spread_k': 0.6472174158719143, 'spread_hl_frac': 0.0018796997006077655, 'bb_std_mult': 3.50739034426554, 'rsi_os': 28, 'rsi_ob': 79, 'vol_spike': 0.28946346944841034, 'adx_thresh': 29.807719974766012, 'atr_min_pct': 0.015047179251624975, 'atr_max_pct': 0.06554215288087906, 'tp_mult': 1.0999615848808202, 'tsl_mult': 0.003763310413581241, 'strategy': 'breakout', 'time_stop': 117, 'use_sma': False, 'use_atr': False, 'use_adx': False, 'use_ema': False, 'use_spike': True, 'rsi_required': True, 'edge_k': 1.1080745130802423, 'edge_cap': 0.6312290967655096, 'bull_strategy': 'mean_reversion', 'bull_bb_std_mult': 2.6649766879316807, 'bull_rsi_os': 30, 'bull_rsi_ob': 88, 'bull_adx_thresh': 23.821669263850342, 'bull_atr_min_pct': 0.006161163963704321, 'bull_atr_max_pct': 0.08180856104405503, 'bull_tp_mult': 1.7441156285144468, 'bull_tsl_mult': 0.605409279446837, 'bull_time_stop': 110, 'bull_use_sma': False, 'bull_use_ema': False, 'bull_use_atr': False, 'bull_use_adx': False, 'bull_use_spike': False, 'bull_rsi_required': False, 'bear_strategy': 'mean_reversion', 'bear_bb_std_mult': 0.8681977979601678, 'bear_rsi_os': 9, 'bear_rsi_ob': 74, 'bear_adx_thresh': 30.19851990945783, 'bear_atr_min_pct': 0.014071190929592964, 'bear_atr_max_pct': 0.01104961103723421, 'bear_tp_mult': 1.2715194744323801, 'bear_tsl_mult': 0.019181520426935925, 'bear_time_stop': 119, 'bear_use_sma': False, 'bear_use_ema': True, 'bear_use_atr': True, 'bear_use_adx': False, 'bear_use_spike': False, 'bear_rsi_required': False, 'sideways_strategy': 'mean_reversion', 'sideways_bb_std_mult': 3.598016461431747, 'sideways_rsi_os': 40, 'sideways_rsi_ob': 58, 'sideways_adx_thresh': 27.26204091196383, 'sideways_atr_min_pct': 0.0012575627692545796, 'sideways_atr_max_pct': 0.09290725189482488, 'sideways_tp_mult': 2.252159905533936, 'sideways_tsl_mult': 0.44170335830159163, 'sideways_time_stop': 7, 'sideways_use_sma': False, 'sideways_use_ema': True, 'sideways_use_atr': True, 'sideways_use_adx': False, 'sideways_use_spike': True, 'sideways_rsi_required': False}.
[I 2025-08-30 15:02:36,027] Trial 336 finished with values: [-1000000000.0, 1000000000.0] and parameters: {'p_sma': 10, 'p_std': 53, 'p_atr': 16, 'p_adx': 19, 'rsi_period': 44, 'ema1': 30, 'ema2': 17, 'slip_atr_k': 0.03550780875541173, 'slip_spread_k': 0.6500913549597926, 'spread_hl_frac': 0.00207356935570808, 'bb_std_mult': 3.468622293360465, 'rsi_os': 29, 'rsi_ob': 95, 'vol_spike': 0.28955115509208, 'adx_thresh': 29.67572589544168, 'atr_min_pct': 0.014895441541577445, 'atr_max_pct': 0.06550000984484498, 'tp_mult': 1.4011133512439249, 'tsl_mult': 0.045310332578211494, 'strategy': 'breakout', 'time_stop': 116, 'use_sma': False, 'use_atr': False, 'use_adx': False, 'use_ema': False, 'use_spike': True, 'rsi_required': True, 'edge_k': 1.1274471620654398, 'edge_cap': 0.603261603774176, 'bull_strategy': 'mean_reversion', 'bull_bb_std_mult': 2.682743316203091, 'bull_rsi_os': 30, 'bull_rsi_ob': 88, 'bull_adx_thresh': 23.864368743935692, 'bull_atr_min_pct': 0.006247215540780777, 'bull_atr_max_pct': 0.08245555109991842, 'bull_tp_mult': 1.7458096885422094, 'bull_tsl_mult': 0.6066371076890977, 'bull_time_stop': 109, 'bull_use_sma': False, 'bull_use_ema': False, 'bull_use_atr': False, 'bull_use_adx': False, 'bull_use_spike': False, 'bull_rsi_required': False, 'bear_strategy': 'mean_reversion', 'bear_bb_std_mult': 0.8793882292631314, 'bear_rsi_os': 7, 'bear_rsi_ob': 77, 'bear_adx_thresh': 30.391165364550485, 'bear_atr_min_pct': 0.01490351791995311, 'bear_atr_max_pct': 0.010216449558915708, 'bear_tp_mult': 1.3711934129904968, 'bear_tsl_mult': 0.018828150799018117, 'bear_time_stop': 164, 'bear_use_sma': False, 'bear_use_ema': True, 'bear_use_atr': True, 'bear_use_adx': False, 'bear_use_spike': False, 'bear_rsi_required': False, 'sideways_strategy': 'mean_reversion', 'sideways_bb_std_mult': 3.5984979720094494, 'sideways_rsi_os': 40, 'sideways_rsi_ob': 57, 'sideways_adx_thresh': 27.225429951465454, 'sideways_atr_min_pct': 0.0010138633686502334, 'sideways_atr_max_pct': 0.09203387149683692, 'sideways_tp_mult': 2.2561358262818705, 'sideways_tsl_mult': 0.45752516519613445, 'sideways_time_stop': 6, 'sideways_use_sma': False, 'sideways_use_ema': True, 'sideways_use_atr': True, 'sideways_use_adx': False, 'sideways_use_spike': True, 'sideways_rsi_required': False}.
[I 2025-08-30 15:02:36,452] Trial 335 finished with values: [-1000000000.0, 1000000000.0] and parameters: {'p_sma': 11, 'p_std': 53, 'p_atr': 16, 'p_adx': 23, 'rsi_period': 44, 'ema1': 30, 'ema2': 18, 'slip_atr_k': 0.03510914468168451, 'slip_spread_k': 0.6406885314952527, 'spread_hl_frac': 0.0018386649626784754, 'bb_std_mult': 3.4752986600393223, 'rsi_os': 29, 'rsi_ob': 79, 'vol_spike': 0.2875542916744506, 'adx_thresh': 29.823544812862416, 'atr_min_pct': 0.014881926853444902, 'atr_max_pct': 0.06563535824937738, 'tp_mult': 1.1113551128620154, 'tsl_mult': 0.04786740483162697, 'strategy': 'breakout', 'time_stop': 117, 'use_sma': False, 'use_atr': False, 'use_adx': False, 'use_ema': False, 'use_spike': True, 'rsi_required': True, 'edge_k': 1.0985394510765576, 'edge_cap': 0.605693530569255, 'bull_strategy': 'mean_reversion', 'bull_bb_std_mult': 2.786421642939196, 'bull_rsi_os': 30, 'bull_rsi_ob': 88, 'bull_adx_thresh': 23.836137144076744, 'bull_atr_min_pct': 0.0062954301326853725, 'bull_atr_max_pct': 0.08289439706324729, 'bull_tp_mult': 1.732213917888956, 'bull_tsl_mult': 0.6214294884137954, 'bull_time_stop': 111, 'bull_use_sma': False, 'bull_use_ema': False, 'bull_use_atr': False, 'bull_use_adx': False, 'bull_use_spike': False, 'bull_rsi_required': False, 'bear_strategy': 'mean_reversion', 'bear_bb_std_mult': 0.8716523956488915, 'bear_rsi_os': 7, 'bear_rsi_ob': 77, 'bear_adx_thresh': 30.017336593603208, 'bear_atr_min_pct': 0.014931156770813359, 'bear_atr_max_pct': 0.010727900653810154, 'bear_tp_mult': 1.3544046959757996, 'bear_tsl_mult': 0.020823951887977383, 'bear_time_stop': 117, 'bear_use_sma': False, 'bear_use_ema': True, 'bear_use_atr': True, 'bear_use_adx': False, 'bear_use_spike': False, 'bear_rsi_required': False, 'sideways_strategy': 'mean_reversion', 'sideways_bb_std_mult': 3.599682828512204, 'sideways_rsi_os': 40, 'sideways_rsi_ob': 57, 'sideways_adx_thresh': 27.000284443047, 'sideways_atr_min_pct': 0.0011458832734925688, 'sideways_atr_max_pct': 0.09157641239284077, 'sideways_tp_mult': 2.252135462187987, 'sideways_tsl_mult': 0.46108957435337483, 'sideways_time_stop': 5, 'sideways_use_sma': False, 'sideways_use_ema': True, 'sideways_use_atr': True, 'sideways_use_adx': False, 'sideways_use_spike': True, 'sideways_rsi_required': False}.
[I 2025-08-30 15:02:36,577] Trial 334 finished with values: [-0.010144468045410915, 0.010137126539894703] and parameters: {'p_sma': 8, 'p_std': 53, 'p_atr': 16, 'p_adx': 23, 'rsi_period': 76, 'ema1': 30, 'ema2': 17, 'slip_atr_k': 0.0482361135381536, 'slip_spread_k': 0.6271235259374658, 'spread_hl_frac': 0.002104405331316451, 'bb_std_mult': 3.446031394190692, 'rsi_os': 28, 'rsi_ob': 75, 'vol_spike': 0.2897897700320444, 'adx_thresh': 29.46027300620146, 'atr_min_pct': 0.014881734830611658, 'atr_max_pct': 0.06978915059046925, 'tp_mult': 1.5725137862418275, 'tsl_mult': 0.04235252635449332, 'strategy': 'breakout', 'time_stop': 115, 'use_sma': False, 'use_atr': False, 'use_adx': False, 'use_ema': False, 'use_spike': True, 'rsi_required': True, 'edge_k': 1.0789353134813842, 'edge_cap': 0.6143367330626758, 'bull_strategy': 'mean_reversion', 'bull_bb_std_mult': 2.652587965439194, 'bull_rsi_os': 31, 'bull_rsi_ob': 88, 'bull_adx_thresh': 24.212615747895, 'bull_atr_min_pct': 0.006680943381790118, 'bull_atr_max_pct': 0.07740809627106779, 'bull_tp_mult': 1.8546364386623972, 'bull_tsl_mult': 0.6074580438137547, 'bull_time_stop': 115, 'bull_use_sma': False, 'bull_use_ema': False, 'bull_use_atr': False, 'bull_use_adx': False, 'bull_use_spike': False, 'bull_rsi_required': True, 'bear_strategy': 'mean_reversion', 'bear_bb_std_mult': 0.9305269860725518, 'bear_rsi_os': 8, 'bear_rsi_ob': 75, 'bear_adx_thresh': 29.88948574441319, 'bear_atr_min_pct': 0.015246405732602216, 'bear_atr_max_pct': 0.011619020087000213, 'bear_tp_mult': 1.3884274408469928, 'bear_tsl_mult': 0.059608428154622695, 'bear_time_stop': 79, 'bear_use_sma': True, 'bear_use_ema': True, 'bear_use_atr': True, 'bear_use_adx': False, 'bear_use_spike': False, 'bear_rsi_required': False, 'sideways_strategy': 'breakout', 'sideways_bb_std_mult': 3.5828452399012174, 'sideways_rsi_os': 40, 'sideways_rsi_ob': 57, 'sideways_adx_thresh': 26.279489890114178, 'sideways_atr_min_pct': 0.0008880387491681085, 'sideways_atr_max_pct': 0.09103158949921637, 'sideways_tp_mult': 2.2870580377503464, 'sideways_tsl_mult': 0.46889939748107834, 'sideways_time_stop': 5, 'sideways_use_sma': False, 'sideways_use_ema': True, 'sideways_use_atr': True, 'sideways_use_adx': False, 'sideways_use_spike': True, 'sideways_rsi_required': False}.
[I 2025-08-30 15:03:11,044] Trial 339 finished with values: [-0.016291054156979956, 0.016196849616192558] and parameters: {'p_sma': 11, 'p_std': 53, 'p_atr': 15, 'p_adx': 15, 'rsi_period': 82, 'ema1': 30, 'ema2': 18, 'slip_atr_k': 0.031182079096752104, 'slip_spread_k': 0.631678804246884, 'spread_hl_frac': 0.012538702924613655, 'bb_std_mult': 3.5527831787338786, 'rsi_os': 29, 'rsi_ob': 76, 'vol_spike': 0.28539984330173773, 'adx_thresh': 29.642963786223163, 'atr_min_pct': 0.014161502082029955, 'atr_max_pct': 0.07340210226210128, 'tp_mult': 1.2513737779745702, 'tsl_mult': 0.06015058599217914, 'strategy': 'breakout', 'time_stop': 122, 'use_sma': False, 'use_atr': False, 'use_adx': False, 'use_ema': False, 'use_spike': True, 'rsi_required': True, 'edge_k': 1.0752377440857062, 'edge_cap': 0.6410801702018807, 'bull_strategy': 'mean_reversion', 'bull_bb_std_mult': 2.762110735229749, 'bull_rsi_os': 32, 'bull_rsi_ob': 86, 'bull_adx_thresh': 23.226396819251352, 'bull_atr_min_pct': 0.005946034245615886, 'bull_atr_max_pct': 0.08350020784683462, 'bull_tp_mult': 1.8224775324897344, 'bull_tsl_mult': 0.6320278602668008, 'bull_time_stop': 122, 'bull_use_sma': True, 'bull_use_ema': True, 'bull_use_atr': False, 'bull_use_adx': False, 'bull_use_spike': False, 'bull_rsi_required': True, 'bear_strategy': 'mean_reversion', 'bear_bb_std_mult': 0.941121098498561, 'bear_rsi_os': 9, 'bear_rsi_ob': 78, 'bear_adx_thresh': 29.94548736566662, 'bear_atr_min_pct': 0.013539425003274872, 'bear_atr_max_pct': 0.013852918208298018, 'bear_tp_mult': 1.3950718209655015, 'bear_tsl_mult': 0.04478562996245121, 'bear_time_stop': 86, 'bear_use_sma': False, 'bear_use_ema': True, 'bear_use_atr': True, 'bear_use_adx': True, 'bear_use_spike': False, 'bear_rsi_required': False, 'sideways_strategy': 'breakout', 'sideways_bb_std_mult': 3.5284708421320783, 'sideways_rsi_os': 39, 'sideways_rsi_ob': 56, 'sideways_adx_thresh': 27.731640922437013, 'sideways_atr_min_pct': 3.535479290796284e-05, 'sideways_atr_max_pct': 0.08763444717943872, 'sideways_tp_mult': 2.2149429484774883, 'sideways_tsl_mult': 0.4754585377378274, 'sideways_time_stop': 13, 'sideways_use_sma': False, 'sideways_use_ema': True, 'sideways_use_atr': True, 'sideways_use_adx': False, 'sideways_use_spike': False, 'sideways_rsi_required': False}.
[I 2025-08-30 15:03:11,238] Trial 341 finished with values: [-0.03394535941232646, 0.033923156108915546] and parameters: {'p_sma': 8, 'p_std': 54, 'p_atr': 17, 'p_adx': 11, 'rsi_period': 79, 'ema1': 30, 'ema2': 16, 'slip_atr_k': 0.05557487153718034, 'slip_spread_k': 0.6254846513648742, 'spread_hl_frac': 0.002777441618679189, 'bb_std_mult': 3.402478442659771, 'rsi_os': 23, 'rsi_ob': 75, 'vol_spike': 0.29942839872313665, 'adx_thresh': 28.57191580459816, 'atr_min_pct': 0.013180368241729617, 'atr_max_pct': 0.0733738222774511, 'tp_mult': 1.5587523017572138, 'tsl_mult': 0.0681064933773536, 'strategy': 'breakout', 'time_stop': 108, 'use_sma': False, 'use_atr': False, 'use_adx': True, 'use_ema': True, 'use_spike': True, 'rsi_required': True, 'edge_k': 0.8742390775259149, 'edge_cap': 0.5678375685086745, 'bull_strategy': 'mean_reversion', 'bull_bb_std_mult': 2.7402369113615803, 'bull_rsi_os': 33, 'bull_rsi_ob': 88, 'bull_adx_thresh': 25.330687378317904, 'bull_atr_min_pct': 0.00762053265629889, 'bull_atr_max_pct': 0.072248371707387, 'bull_tp_mult': 1.9251322210587951, 'bull_tsl_mult': 0.5952359582113191, 'bull_time_stop': 120, 'bull_use_sma': True, 'bull_use_ema': True, 'bull_use_atr': False, 'bull_use_adx': False, 'bull_use_spike': False, 'bull_rsi_required': True, 'bear_strategy': 'mean_reversion', 'bear_bb_std_mult': 0.811507714392677, 'bear_rsi_os': 5, 'bear_rsi_ob': 73, 'bear_adx_thresh': 29.16499823568911, 'bear_atr_min_pct': 0.01650192718021043, 'bear_atr_max_pct': 0.0128085026239636, 'bear_tp_mult': 1.4087644407174755, 'bear_tsl_mult': 0.09502546557998146, 'bear_time_stop': 78, 'bear_use_sma': True, 'bear_use_ema': True, 'bear_use_atr': True, 'bear_use_adx': True, 'bear_use_spike': False, 'bear_rsi_required': False, 'sideways_strategy': 'breakout', 'sideways_bb_std_mult': 3.5227225385179817, 'sideways_rsi_os': 42, 'sideways_rsi_ob': 53, 'sideways_adx_thresh': 25.503972594767745, 'sideways_atr_min_pct': 8.064196613887583e-05, 'sideways_atr_max_pct': 0.09759522214564828, 'sideways_tp_mult': 2.360828901781369, 'sideways_tsl_mult': 0.5265208166989094, 'sideways_time_stop': 5, 'sideways_use_sma': False, 'sideways_use_ema': True, 'sideways_use_atr': True, 'sideways_use_adx': False, 'sideways_use_spike': False, 'sideways_rsi_required': False}.
[I 2025-08-30 15:03:11,635] Trial 340 finished with values: [-0.020135476491844884, 0.020136058593863883] and parameters: {'p_sma': 8, 'p_std': 52, 'p_atr': 15, 'p_adx': 12, 'rsi_period': 72, 'ema1': 29, 'ema2': 16, 'slip_atr_k': 0.030868856249590737, 'slip_spread_k': 0.6020500878898583, 'spread_hl_frac': 0.027606958073327206, 'bb_std_mult': 3.572541409909752, 'rsi_os': 30, 'rsi_ob': 95, 'vol_spike': 0.2923448094171707, 'adx_thresh': 29.631336303908427, 'atr_min_pct': 0.013291275491954914, 'atr_max_pct': 0.06810306403688794, 'tp_mult': 1.244474004723583, 'tsl_mult': 0.05151814284758377, 'strategy': 'breakout', 'time_stop': 124, 'use_sma': False, 'use_atr': False, 'use_adx': True, 'use_ema': False, 'use_spike': True, 'rsi_required': True, 'edge_k': 1.2145520614304302, 'edge_cap': 0.6399068322864309, 'bull_strategy': 'mean_reversion', 'bull_bb_std_mult': 2.4364793938282445, 'bull_rsi_os': 32, 'bull_rsi_ob': 86, 'bull_adx_thresh': 23.258473710092506, 'bull_atr_min_pct': 0.007334171449510583, 'bull_atr_max_pct': 0.0740549849665332, 'bull_tp_mult': 1.80188955065276, 'bull_tsl_mult': 0.6393998446046846, 'bull_time_stop': 102, 'bull_use_sma': True, 'bull_use_ema': True, 'bull_use_atr': False, 'bull_use_adx': False, 'bull_use_spike': False, 'bull_rsi_required': True, 'bear_strategy': 'mean_reversion', 'bear_bb_std_mult': 0.9649792983289442, 'bear_rsi_os': 9, 'bear_rsi_ob': 79, 'bear_adx_thresh': 29.555375936677482, 'bear_atr_min_pct': 0.01661327571059845, 'bear_atr_max_pct': 0.013526829982123283, 'bear_tp_mult': 1.368834626432518, 'bear_tsl_mult': 0.04747968798238017, 'bear_time_stop': 82, 'bear_use_sma': False, 'bear_use_ema': True, 'bear_use_atr': True, 'bear_use_adx': True, 'bear_use_spike': False, 'bear_rsi_required': False, 'sideways_strategy': 'breakout', 'sideways_bb_std_mult': 3.5258231881582756, 'sideways_rsi_os': 39, 'sideways_rsi_ob': 56, 'sideways_adx_thresh': 27.85652833397169, 'sideways_atr_min_pct': 7.333297037630791e-05, 'sideways_atr_max_pct': 0.10422792577414412, 'sideways_tp_mult': 2.311078738420213, 'sideways_tsl_mult': 0.49180068681931594, 'sideways_time_stop': 14, 'sideways_use_sma': False, 'sideways_use_ema': True, 'sideways_use_atr': True, 'sideways_use_adx': False, 'sideways_use_spike': False, 'sideways_rsi_required': False}.
[I 2025-08-30 15:03:11,978] Trial 338 finished with values: [-0.05656549182562487, 0.056498075784936805] and parameters: {'p_sma': 10, 'p_std': 53, 'p_atr': 15, 'p_adx': 11, 'rsi_period': 44, 'ema1': 30, 'ema2': 18, 'slip_atr_k': 0.03346527155637187, 'slip_spread_k': 0.6346127392701455, 'spread_hl_frac': 0.024117137049647644, 'bb_std_mult': 3.461648885104924, 'rsi_os': 29, 'rsi_ob': 95, 'vol_spike': 0.2876152145153901, 'adx_thresh': 29.6595564422973, 'atr_min_pct': 0.014955751955450751, 'atr_max_pct': 0.07342736223267272, 'tp_mult': 1.261694130678187, 'tsl_mult': 0.05238530887059761, 'strategy': 'breakout', 'time_stop': 125, 'use_sma': False, 'use_atr': False, 'use_adx': False, 'use_ema': False, 'use_spike': True, 'rsi_required': True, 'edge_k': 1.1383553530888775, 'edge_cap': 0.6357207243002663, 'bull_strategy': 'mean_reversion', 'bull_bb_std_mult': 2.7674156765065825, 'bull_rsi_os': 31, 'bull_rsi_ob': 86, 'bull_adx_thresh': 23.781068592521564, 'bull_atr_min_pct': 0.0061211686770347344, 'bull_atr_max_pct': 0.07498233981587465, 'bull_tp_mult': 1.7114486457643991, 'bull_tsl_mult': 0.6014928849452464, 'bull_time_stop': 121, 'bull_use_sma': True, 'bull_use_ema': True, 'bull_use_atr': False, 'bull_use_adx': False, 'bull_use_spike': False, 'bull_rsi_required': True, 'bear_strategy': 'mean_reversion', 'bear_bb_std_mult': 0.9349074408804622, 'bear_rsi_os': 9, 'bear_rsi_ob': 77, 'bear_adx_thresh': 30.45874996225521, 'bear_atr_min_pct': 0.01490665118414914, 'bear_atr_max_pct': 0.01021854683928568, 'bear_tp_mult': 1.3965566824271194, 'bear_tsl_mult': 0.03853122051473132, 'bear_time_stop': 116, 'bear_use_sma': False, 'bear_use_ema': True, 'bear_use_atr': True, 'bear_use_adx': True, 'bear_use_spike': False, 'bear_rsi_required': False, 'sideways_strategy': 'breakout', 'sideways_bb_std_mult': 3.527013517796382, 'sideways_rsi_os': 39, 'sideways_rsi_ob': 56, 'sideways_adx_thresh': 27.18647787343595, 'sideways_atr_min_pct': 4.037121635293967e-05, 'sideways_atr_max_pct': 0.09192121889419994, 'sideways_tp_mult': 2.244120738110104, 'sideways_tsl_mult': 0.4576151941188685, 'sideways_time_stop': 5, 'sideways_use_sma': False, 'sideways_use_ema': True, 'sideways_use_atr': True, 'sideways_use_adx': False, 'sideways_use_spike': True, 'sideways_rsi_required': False}.
