[I 2025-08-30 16:26:31,352] Trial 759 finished with values: [-1000000000.0, 1000000000.0] and parameters: {'p_sma': 5, 'p_std': 55, 'p_atr': 25, 'p_adx': 11, 'rsi_period': 79, 'ema1': 24, 'ema2': 31, 'slip_atr_k': 0.08005013115531359, 'slip_spread_k': 0.17415254517915763, 'spread_hl_frac': 0.016766567142812633, 'bb_std_mult': 2.4247826460782433, 'rsi_os': 39, 'rsi_ob': 59, 'vol_spike': 0.1417620640172, 'adx_thresh': 13.821001176422131, 'atr_min_pct': 0.00971415421691755, 'atr_max_pct': 0.08055682628973915, 'tp_mult': 1.2552738440536015, 'tsl_mult': 0.23450041290040127, 'strategy': 'mean_reversion', 'time_stop': 187, 'use_sma': True, 'use_atr': True, 'use_adx': False, 'use_ema': False, 'use_spike': True, 'rsi_required': False, 'edge_k': 0.7047325978951242, 'edge_cap': 0.5670749435834742, 'bull_strategy': 'breakout', 'bull_bb_std_mult': 0.9174620555604489, 'bull_rsi_os': 44, 'bull_rsi_ob': 66, 'bull_adx_thresh': 29.352919867350312, 'bull_atr_min_pct': 0.0145879288590391, 'bull_atr_max_pct': 0.09853084724416353, 'bull_tp_mult': 1.0504366079463754, 'bull_tsl_mult': 0.18903343721671134, 'bull_time_stop': 16, 'bull_use_sma': True, 'bull_use_ema': True, 'bull_use_atr': True, 'bull_use_adx': True, 'bull_use_spike': False, 'bull_rsi_required': True, 'bear_strategy': 'mean_reversion', 'bear_bb_std_mult': 2.530127964696215, 'bear_rsi_os': 32, 'bear_rsi_ob': 88, 'bear_adx_thresh': 29.195430308835665, 'bear_atr_min_pct': 0.021261697878257085, 'bear_atr_max_pct': 0.0688370193767439, 'bear_tp_mult': 2.6554084934968376, 'bear_tsl_mult': 0.5447232696059564, 'bear_time_stop': 290, 'bear_use_sma': False, 'bear_use_ema': False, 'bear_use_atr': True, 'bear_use_adx': True, 'bear_use_spike': True, 'bear_rsi_required': True, 'sideways_strategy': 'breakout', 'sideways_bb_std_mult': 0.6735080577142531, 'sideways_rsi_os': 39, 'sideways_rsi_ob': 62, 'sideways_adx_thresh': 24.344094049184736, 'sideways_atr_min_pct': 0.0023428079793921326, 'sideways_atr_max_pct': 0.12592453649298044, 'sideways_tp_mult': 2.994346302703833, 'sideways_tsl_mult': 0.700451977832683, 'sideways_time_stop': 156, 'sideways_use_sma': False, 'sideways_use_ema': True, 'sideways_use_atr': False, 'sideways_use_adx': True, 'sideways_use_spike': True, 'sideways_rsi_required': True}.
[I 2025-08-30 16:26:32,146] Trial 758 finished with values: [-1000000000.0, 1000000000.0] and parameters: {'p_sma': 13, 'p_std': 53, 'p_atr': 25, 'p_adx': 11, 'rsi_period': 28, 'ema1': 24, 'ema2': 40, 'slip_atr_k': 0.07753013953468692, 'slip_spread_k': 0.17297269696846135, 'spread_hl_frac': 0.024441972930511657, 'bb_std_mult': 2.4228749048590656, 'rsi_os': 40, 'rsi_ob': 76, 'vol_spike': 0.15371479425827939, 'adx_thresh': 14.003218568558573, 'atr_min_pct': 0.015157453356412014, 'atr_max_pct': 0.08001242738879843, 'tp_mult': 1.4554954763983607, 'tsl_mult': 0.8836550510382916, 'strategy': 'mean_reversion', 'time_stop': 220, 'use_sma': True, 'use_atr': True, 'use_adx': False, 'use_ema': False, 'use_spike': True, 'rsi_required': False, 'edge_k': 0.831363008389633, 'edge_cap': 0.7914987686552764, 'bull_strategy': 'breakout', 'bull_bb_std_mult': 0.9277719041711807, 'bull_rsi_os': 24, 'bull_rsi_ob': 64, 'bull_adx_thresh': 24.020106214083807, 'bull_atr_min_pct': 0.014270723338770889, 'bull_atr_max_pct': 0.10065634488753265, 'bull_tp_mult': 2.0910116102355976, 'bull_tsl_mult': 0.05615468530915314, 'bull_time_stop': 31, 'bull_use_sma': True, 'bull_use_ema': True, 'bull_use_atr': True, 'bull_use_adx': True, 'bull_use_spike': False, 'bull_rsi_required': True, 'bear_strategy': 'breakout', 'bear_bb_std_mult': 2.5351877022990412, 'bear_rsi_os': 32, 'bear_rsi_ob': 81, 'bear_adx_thresh': 13.858144991179461, 'bear_atr_min_pct': 0.017412291933040232, 'bear_atr_max_pct': 0.06920096749019447, 'bear_tp_mult': 2.8016730761823827, 'bear_tsl_mult': 0.6404308778577832, 'bear_time_stop': 288, 'bear_use_sma': False, 'bear_use_ema': False, 'bear_use_atr': True, 'bear_use_adx': True, 'bear_use_spike': True, 'bear_rsi_required': False, 'sideways_strategy': 'breakout', 'sideways_bb_std_mult': 0.6972693085899402, 'sideways_rsi_os': 7, 'sideways_rsi_ob': 60, 'sideways_adx_thresh': 24.595710468020584, 'sideways_atr_min_pct': 0.001289705148771871, 'sideways_atr_max_pct': 0.1319817967192252, 'sideways_tp_mult': 2.9995620240420284, 'sideways_tsl_mult': 0.9590411053141488, 'sideways_time_stop': 73, 'sideways_use_sma': False, 'sideways_use_ema': True, 'sideways_use_atr': False, 'sideways_use_adx': True, 'sideways_use_spike': True, 'sideways_rsi_required': True}.
[I 2025-08-30 16:26:32,767] Trial 757 finished with values: [-1000000000.0, 1000000000.0] and parameters: {'p_sma': 20, 'p_std': 53, 'p_atr': 27, 'p_adx': 9, 'rsi_period': 70, 'ema1': 24, 'ema2': 40, 'slip_atr_k': 0.0768440504896772, 'slip_spread_k': 0.12561495557025854, 'spread_hl_frac': 0.02463966927017589, 'bb_std_mult': 2.115780518672598, 'rsi_os': 40, 'rsi_ob': 69, 'vol_spike': 0.09572331881106619, 'adx_thresh': 13.899730021516513, 'atr_min_pct': 0.001974561201716152, 'atr_max_pct': 0.07930796722782228, 'tp_mult': 1.4288802765384552, 'tsl_mult': 0.24146864620452663, 'strategy': 'mean_reversion', 'time_stop': 218, 'use_sma': True, 'use_atr': True, 'use_adx': False, 'use_ema': False, 'use_spike': True, 'rsi_required': False, 'edge_k': 1.8374657010271704, 'edge_cap': 0.5701588827215983, 'bull_strategy': 'breakout', 'bull_bb_std_mult': 0.5926582992496106, 'bull_rsi_os': 24, 'bull_rsi_ob': 67, 'bull_adx_thresh': 15.575759834782824, 'bull_atr_min_pct': 0.019645248120041012, 'bull_atr_max_pct': 0.09750453257380753, 'bull_tp_mult': 1.063222311858547, 'bull_tsl_mult': 0.4581426590927046, 'bull_time_stop': 47, 'bull_use_sma': True, 'bull_use_ema': True, 'bull_use_atr': True, 'bull_use_adx': True, 'bull_use_spike': False, 'bull_rsi_required': True, 'bear_strategy': 'breakout', 'bear_bb_std_mult': 2.7620041697550133, 'bear_rsi_os': 32, 'bear_rsi_ob': 91, 'bear_adx_thresh': 14.32668577482297, 'bear_atr_min_pct': 0.02128862152391784, 'bear_atr_max_pct': 0.13969029632497876, 'bear_tp_mult': 2.7990971353355096, 'bear_tsl_mult': 0.5087505361823933, 'bear_time_stop': 256, 'bear_use_sma': False, 'bear_use_ema': False, 'bear_use_atr': True, 'bear_use_adx': True, 'bear_use_spike': True, 'bear_rsi_required': True, 'sideways_strategy': 'breakout', 'sideways_bb_std_mult': 1.4658370104378293, 'sideways_rsi_os': 26, 'sideways_rsi_ob': 65, 'sideways_adx_thresh': 24.31263585458888, 'sideways_atr_min_pct': 0.0010878773922149954, 'sideways_atr_max_pct': 0.106612356247709, 'sideways_tp_mult': 2.9692711940432326, 'sideways_tsl_mult': 0.6129292317167488, 'sideways_time_stop': 157, 'sideways_use_sma': True, 'sideways_use_ema': True, 'sideways_use_atr': False, 'sideways_use_adx': True, 'sideways_use_spike': True, 'sideways_rsi_required': True}.
[I 2025-08-30 16:26:32,949] Trial 756 finished with values: [-1000000000.0, 1000000000.0] and parameters: {'p_sma': 13, 'p_std': 55, 'p_atr': 26, 'p_adx': 10, 'rsi_period': 82, 'ema1': 23, 'ema2': 31, 'slip_atr_k': 0.07586436337543656, 'slip_spread_k': 0.12207818613675618, 'spread_hl_frac': 0.025706075016485204, 'bb_std_mult': 2.399477171356762, 'rsi_os': 39, 'rsi_ob': 73, 'vol_spike': 0.15400232081022808, 'adx_thresh': 13.839460345638933, 'atr_min_pct': 0.015205625662504522, 'atr_max_pct': 0.09224731446164632, 'tp_mult': 1.8333693395434802, 'tsl_mult': 0.27989961822892107, 'strategy': 'mean_reversion', 'time_stop': 258, 'use_sma': True, 'use_atr': True, 'use_adx': False, 'use_ema': False, 'use_spike': True, 'rsi_required': False, 'edge_k': 0.4229331471205554, 'edge_cap': 0.5662006857046212, 'bull_strategy': 'breakout', 'bull_bb_std_mult': 0.8443114557458091, 'bull_rsi_os': 39, 'bull_rsi_ob': 70, 'bull_adx_thresh': 29.76021549445569, 'bull_atr_min_pct': 0.01080687725322014, 'bull_atr_max_pct': 0.09514830092048325, 'bull_tp_mult': 2.0869156088845653, 'bull_tsl_mult': 0.08341228438913592, 'bull_time_stop': 15, 'bull_use_sma': True, 'bull_use_ema': True, 'bull_use_atr': True, 'bull_use_adx': True, 'bull_use_spike': True, 'bull_rsi_required': True, 'bear_strategy': 'breakout', 'bear_bb_std_mult': 2.705106103619376, 'bear_rsi_os': 32, 'bear_rsi_ob': 91, 'bear_adx_thresh': 29.28447303189507, 'bear_atr_min_pct': 0.019040809370642647, 'bear_atr_max_pct': 0.06834670803822784, 'bear_tp_mult': 2.6385098232312107, 'bear_tsl_mult': 0.703373179411004, 'bear_time_stop': 268, 'bear_use_sma': False, 'bear_use_ema': False, 'bear_use_atr': False, 'bear_use_adx': True, 'bear_use_spike': True, 'bear_rsi_required': False, 'sideways_strategy': 'mean_reversion', 'sideways_bb_std_mult': 0.7022742314706807, 'sideways_rsi_os': 28, 'sideways_rsi_ob': 48, 'sideways_adx_thresh': 12.837685164523561, 'sideways_atr_min_pct': 0.002432542165885654, 'sideways_atr_max_pct': 0.10586556901361932, 'sideways_tp_mult': 2.967612335839293, 'sideways_tsl_mult': 0.6987812536986147, 'sideways_time_stop': 133, 'sideways_use_sma': True, 'sideways_use_ema': True, 'sideways_use_atr': False, 'sideways_use_adx': True, 'sideways_use_spike': True, 'sideways_rsi_required': True}.
[I 2025-08-30 16:27:18,251] Trial 763 finished with values: [-0.07115223884888056, 0.07112592386639528] and parameters: {'p_sma': 59, 'p_std': 56, 'p_atr': 27, 'p_adx': 12, 'rsi_period': 77, 'ema1': 23, 'ema2': 33, 'slip_atr_k': 0.06974722875479866, 'slip_spread_k': 0.13831904032088518, 'spread_hl_frac': 0.039660643530264564, 'bb_std_mult': 2.3247651493872272, 'rsi_os': 38, 'rsi_ob': 73, 'vol_spike': 0.17158128733809674, 'adx_thresh': 15.252235127605683, 'atr_min_pct': 0.02954547212496854, 'atr_max_pct': 0.11692958613251322, 'tp_mult': 1.757010024360966, 'tsl_mult': 0.5228744995521223, 'strategy': 'mean_reversion', 'time_stop': 205, 'use_sma': True, 'use_atr': True, 'use_adx': False, 'use_ema': True, 'use_spike': True, 'rsi_required': False, 'edge_k': 0.5290842178133397, 'edge_cap': 0.3136298138880112, 'bull_strategy': 'breakout', 'bull_bb_std_mult': 0.7171048416353183, 'bull_rsi_os': 40, 'bull_rsi_ob': 80, 'bull_adx_thresh': 18.302463924855243, 'bull_atr_min_pct': 0.009956419108593621, 'bull_atr_max_pct': 0.10445991826325224, 'bull_tp_mult': 2.0472560423615462, 'bull_tsl_mult': 0.7515718427532724, 'bull_time_stop': 25, 'bull_use_sma': True, 'bull_use_ema': True, 'bull_use_atr': True, 'bull_use_adx': True, 'bull_use_spike': True, 'bull_rsi_required': True, 'bear_strategy': 'mean_reversion', 'bear_bb_std_mult': 2.6461665701068386, 'bear_rsi_os': 33, 'bear_rsi_ob': 93, 'bear_adx_thresh': 7.047457928434216, 'bear_atr_min_pct': 0.020475305081340038, 'bear_atr_max_pct': 0.12980011016432727, 'bear_tp_mult': 2.8426564368486487, 'bear_tsl_mult': 0.3973751495139613, 'bear_time_stop': 248, 'bear_use_sma': False, 'bear_use_ema': False, 'bear_use_atr': True, 'bear_use_adx': True, 'bear_use_spike': True, 'bear_rsi_required': True, 'sideways_strategy': 'breakout', 'sideways_bb_std_mult': 1.3058117861277259, 'sideways_rsi_os': 41, 'sideways_rsi_ob': 75, 'sideways_adx_thresh': 7.975067147696281, 'sideways_atr_min_pct': 4.609148598346555e-06, 'sideways_atr_max_pct': 0.10269802995551336, 'sideways_tp_mult': 2.913295503424633, 'sideways_tsl_mult': 0.2498169859355911, 'sideways_time_stop': 253, 'sideways_use_sma': True, 'sideways_use_ema': False, 'sideways_use_atr': False, 'sideways_use_adx': True, 'sideways_use_spike': False, 'sideways_rsi_required': True}.
[I 2025-08-30 16:27:18,263] Trial 762 finished with values: [-0.05895129934501986, 0.058873731757440186] and parameters: {'p_sma': 45, 'p_std': 56, 'p_atr': 27, 'p_adx': 12, 'rsi_period': 80, 'ema1': 23, 'ema2': 33, 'slip_atr_k': 0.2240521963556798, 'slip_spread_k': 0.21812869683737174, 'spread_hl_frac': 0.01178543759542193, 'bb_std_mult': 2.3232265875209035, 'rsi_os': 38, 'rsi_ob': 75, 'vol_spike': 0.17210091671392203, 'adx_thresh': 15.336657805405835, 'atr_min_pct': 0.01592780379904657, 'atr_max_pct': 0.11611706737411409, 'tp_mult': 1.7665669995234774, 'tsl_mult': 0.5963031650494539, 'strategy': 'mean_reversion', 'time_stop': 176, 'use_sma': True, 'use_atr': True, 'use_adx': False, 'use_ema': True, 'use_spike': True, 'rsi_required': False, 'edge_k': 0.33822936459959546, 'edge_cap': 0.16511037844897908, 'bull_strategy': 'breakout', 'bull_bb_std_mult': 0.688032592807877, 'bull_rsi_os': 40, 'bull_rsi_ob': 62, 'bull_adx_thresh': 24.153928781626746, 'bull_atr_min_pct': 0.009929743594302577, 'bull_atr_max_pct': 0.08917142073011057, 'bull_tp_mult': 2.048669818828289, 'bull_tsl_mult': 0.9323889830231917, 'bull_time_stop': 24, 'bull_use_sma': True, 'bull_use_ema': True, 'bull_use_atr': True, 'bull_use_adx': True, 'bull_use_spike': True, 'bull_rsi_required': True, 'bear_strategy': 'mean_reversion', 'bear_bb_std_mult': 2.3409431664034974, 'bear_rsi_os': 33, 'bear_rsi_ob': 89, 'bear_adx_thresh': 7.334836231261665, 'bear_atr_min_pct': 0.020468800273510876, 'bear_atr_max_pct': 0.07645275384268703, 'bear_tp_mult': 2.849747857013534, 'bear_tsl_mult': 0.40592697098572333, 'bear_time_stop': 267, 'bear_use_sma': False, 'bear_use_ema': False, 'bear_use_atr': True, 'bear_use_adx': True, 'bear_use_spike': True, 'bear_rsi_required': True, 'sideways_strategy': 'breakout', 'sideways_bb_std_mult': 1.0117192374925548, 'sideways_rsi_os': 41, 'sideways_rsi_ob': 60, 'sideways_adx_thresh': 33.09571187441787, 'sideways_atr_min_pct': 0.0004900339909154862, 'sideways_atr_max_pct': 0.016129514307134482, 'sideways_tp_mult': 2.9104901306937356, 'sideways_tsl_mult': 0.9404985980724662, 'sideways_time_stop': 183, 'sideways_use_sma': True, 'sideways_use_ema': False, 'sideways_use_atr': False, 'sideways_use_adx': True, 'sideways_use_spike': False, 'sideways_rsi_required': True}.
[I 2025-08-30 16:27:19,212] Trial 760 finished with values: [-1000000000.0, 1000000000.0] and parameters: {'p_sma': 20, 'p_std': 53, 'p_atr': 25, 'p_adx': 11, 'rsi_period': 28, 'ema1': 23, 'ema2': 33, 'slip_atr_k': 0.0737351880349039, 'slip_spread_k': 0.13182833605918837, 'spread_hl_frac': 0.0485437757861748, 'bb_std_mult': 2.399329148920227, 'rsi_os': 40, 'rsi_ob': 75, 'vol_spike': 0.23258548099721255, 'adx_thresh': 15.507808420036612, 'atr_min_pct': 0.025747379334571066, 'atr_max_pct': 0.07600716716802498, 'tp_mult': 1.4214698386205462, 'tsl_mult': 0.3697188557146432, 'strategy': 'mean_reversion', 'time_stop': 246, 'use_sma': True, 'use_atr': True, 'use_adx': False, 'use_ema': False, 'use_spike': True, 'rsi_required': False, 'edge_k': 0.32479098450521127, 'edge_cap': 0.6418240130434767, 'bull_strategy': 'breakout', 'bull_bb_std_mult': 0.7343280836942525, 'bull_rsi_os': 43, 'bull_rsi_ob': 69, 'bull_adx_thresh': 23.703360736645692, 'bull_atr_min_pct': 0.01967883462596459, 'bull_atr_max_pct': 0.09439113357205683, 'bull_tp_mult': 2.062187085662675, 'bull_tsl_mult': 0.08307342821922249, 'bull_time_stop': 25, 'bull_use_sma': True, 'bull_use_ema': True, 'bull_use_atr': True, 'bull_use_adx': True, 'bull_use_spike': True, 'bull_rsi_required': True, 'bear_strategy': 'mean_reversion', 'bear_bb_std_mult': 2.747349871078299, 'bear_rsi_os': 32, 'bear_rsi_ob': 91, 'bear_adx_thresh': 25.715304480199897, 'bear_atr_min_pct': 0.0275306609160405, 'bear_atr_max_pct': 0.07571960837414846, 'bear_tp_mult': 2.790704504732077, 'bear_tsl_mult': 0.6300380959885038, 'bear_time_stop': 245, 'bear_use_sma': False, 'bear_use_ema': False, 'bear_use_atr': True, 'bear_use_adx': True, 'bear_use_spike': True, 'bear_rsi_required': True, 'sideways_strategy': 'breakout', 'sideways_bb_std_mult': 1.4801655869895907, 'sideways_rsi_os': 41, 'sideways_rsi_ob': 60, 'sideways_adx_thresh': 10.664612651637475, 'sideways_atr_min_pct': 0.01482677687658199, 'sideways_atr_max_pct': 0.1310970000172451, 'sideways_tp_mult': 2.9145511089691647, 'sideways_tsl_mult': 0.6214379865971198, 'sideways_time_stop': 178, 'sideways_use_sma': True, 'sideways_use_ema': True, 'sideways_use_atr': False, 'sideways_use_adx': True, 'sideways_use_spike': False, 'sideways_rsi_required': True}.
[I 2025-08-30 16:27:19,442] Trial 761 finished with values: [-1000000000.0, 1000000000.0] and parameters: {'p_sma': 45, 'p_std': 56, 'p_atr': 27, 'p_adx': 9, 'rsi_period': 62, 'ema1': 23, 'ema2': 33, 'slip_atr_k': 0.1169448109278618, 'slip_spread_k': 0.7144370030945004, 'spread_hl_frac': 0.039345424409213604, 'bb_std_mult': 2.1318447292261204, 'rsi_os': 39, 'rsi_ob': 75, 'vol_spike': 0.09478844855518334, 'adx_thresh': 14.96987298850512, 'atr_min_pct': 4.888990101727282e-05, 'atr_max_pct': 0.14615203112859915, 'tp_mult': 1.7975072568646766, 'tsl_mult': 0.4487459583984328, 'strategy': 'mean_reversion', 'time_stop': 205, 'use_sma': True, 'use_atr': True, 'use_adx': False, 'use_ema': True, 'use_spike': True, 'rsi_required': False, 'edge_k': 0.7660797696034486, 'edge_cap': 0.645155882843438, 'bull_strategy': 'breakout', 'bull_bb_std_mult': 0.7121767907982535, 'bull_rsi_os': 39, 'bull_rsi_ob': 62, 'bull_adx_thresh': 33.439709997252955, 'bull_atr_min_pct': 0.019736908735189167, 'bull_atr_max_pct': 0.08218289683512106, 'bull_tp_mult': 1.0137339400071188, 'bull_tsl_mult': 0.4559304540466096, 'bull_time_stop': 48, 'bull_use_sma': True, 'bull_use_ema': True, 'bull_use_atr': True, 'bull_use_adx': True, 'bull_use_spike': True, 'bull_rsi_required': True, 'bear_strategy': 'mean_reversion', 'bear_bb_std_mult': 2.6517582013476053, 'bear_rsi_os': 32, 'bear_rsi_ob': 89, 'bear_adx_thresh': 6.973809313530076, 'bear_atr_min_pct': 0.020540087613046206, 'bear_atr_max_pct': 0.1281783245473909, 'bear_tp_mult': 2.808773513239295, 'bear_tsl_mult': 0.4018807706435251, 'bear_time_stop': 245, 'bear_use_sma': False, 'bear_use_ema': False, 'bear_use_atr': True, 'bear_use_adx': True, 'bear_use_spike': True, 'bear_rsi_required': True, 'sideways_strategy': 'breakout', 'sideways_bb_std_mult': 1.2736946268616274, 'sideways_rsi_os': 41, 'sideways_rsi_ob': 61, 'sideways_adx_thresh': 12.731372669413718, 'sideways_atr_min_pct': 0.019500189454600435, 'sideways_atr_max_pct': 0.10460486215617562, 'sideways_tp_mult': 2.9268870187767946, 'sideways_tsl_mult': 0.6129682286340641, 'sideways_time_stop': 85, 'sideways_use_sma': True, 'sideways_use_ema': True, 'sideways_use_atr': False, 'sideways_use_adx': True, 'sideways_use_spike': False, 'sideways_rsi_required': True}.
[I 2025-08-30 16:27:20,613] Trial 766 finished with values: [-1000000000.0, 1000000000.0] and parameters: {'p_sma': 5, 'p_std': 8, 'p_atr': 26, 'p_adx': 11, 'rsi_period': 31, 'ema1': 22, 'ema2': 24, 'slip_atr_k': 0.24416948732753402, 'slip_spread_k': 0.7199927856543406, 'spread_hl_frac': 0.02011111365157849, 'bb_std_mult': 3.087149160134187, 'rsi_os': 41, 'rsi_ob': 49, 'vol_spike': 0.26979764874020795, 'adx_thresh': 14.76556964430212, 'atr_min_pct': 0.0038584433376070044, 'atr_max_pct': 0.12752335917241509, 'tp_mult': 1.796244592619531, 'tsl_mult': 0.4395399505568092, 'strategy': 'mean_reversion', 'time_stop': 236, 'use_sma': True, 'use_atr': False, 'use_adx': True, 'use_ema': True, 'use_spike': True, 'rsi_required': False, 'edge_k': 0.6189388387566876, 'edge_cap': 0.5962345731169317, 'bull_strategy': 'breakout', 'bull_bb_std_mult': 0.879619904708778, 'bull_rsi_os': 42, 'bull_rsi_ob': 65, 'bull_adx_thresh': 25.474664050508913, 'bull_atr_min_pct': 0.021476512484370786, 'bull_atr_max_pct': 0.09387032970421488, 'bull_tp_mult': 2.0252753935176737, 'bull_tsl_mult': 0.1777391188834802, 'bull_time_stop': 31, 'bull_use_sma': True, 'bull_use_ema': True, 'bull_use_atr': True, 'bull_use_adx': True, 'bull_use_spike': True, 'bull_rsi_required': True, 'bear_strategy': 'mean_reversion', 'bear_bb_std_mult': 2.4257328959009516, 'bear_rsi_os': 31, 'bear_rsi_ob': 95, 'bear_adx_thresh': 5.647824246647653, 'bear_atr_min_pct': 0.020851451503610396, 'bear_atr_max_pct': 0.12754096131981785, 'bear_tp_mult': 2.902300500466209, 'bear_tsl_mult': 0.4612388411259801, 'bear_time_stop': 281, 'bear_use_sma': False, 'bear_use_ema': False, 'bear_use_atr': True, 'bear_use_adx': True, 'bear_use_spike': True, 'bear_rsi_required': True, 'sideways_strategy': 'breakout', 'sideways_bb_std_mult': 1.1051917285782848, 'sideways_rsi_os': 39, 'sideways_rsi_ob': 77, 'sideways_adx_thresh': 25.03203648807037, 'sideways_atr_min_pct': 0.005160183626452744, 'sideways_atr_max_pct': 0.0200920278586514, 'sideways_tp_mult': 2.8566313793937232, 'sideways_tsl_mult': 0.9571685252420824, 'sideways_time_stop': 87, 'sideways_use_sma': False, 'sideways_use_ema': True, 'sideways_use_atr': False, 'sideways_use_adx': True, 'sideways_use_spike': True, 'sideways_rsi_required': True}.
