[I 2025-08-30 16:20:03,030] Trial 723 finished with values: [-1000000000.0, 1000000000.0] and parameters: {'p_sma': 5, 'p_std': 48, 'p_atr': 22, 'p_adx': 11, 'rsi_period': 35, 'ema1': 23, 'ema2': 31, 'slip_atr_k': 0.10016951955320016, 'slip_spread_k': 0.9080145296752256, 'spread_hl_frac': 0.04639922299778597, 'bb_std_mult': 2.5167754954643087, 'rsi_os': 39, 'rsi_ob': 76, 'vol_spike': 0.16416613945833772, 'adx_thresh': 30.975434136445347, 'atr_min_pct': 0.004362698149194913, 'atr_max_pct': 0.1293813398406655, 'tp_mult': 1.757967391622887, 'tsl_mult': 0.3013043186605824, 'strategy': 'mean_reversion', 'time_stop': 204, 'use_sma': True, 'use_atr': False, 'use_adx': True, 'use_ema': False, 'use_spike': True, 'rsi_required': False, 'edge_k': 0.3973184201868637, 'edge_cap': 0.8323986414448586, 'bull_strategy': 'breakout', 'bull_bb_std_mult': 0.7972862580543715, 'bull_rsi_os': 39, 'bull_rsi_ob': 67, 'bull_adx_thresh': 28.318504472405053, 'bull_atr_min_pct': 0.019232370600775855, 'bull_atr_max_pct': 0.09353126198558767, 'bull_tp_mult': 2.853989710691976, 'bull_tsl_mult': 0.08662369060447178, 'bull_time_stop': 86, 'bull_use_sma': True, 'bull_use_ema': True, 'bull_use_atr': True, 'bull_use_adx': True, 'bull_use_spike': True, 'bull_rsi_required': True, 'bear_strategy': 'breakout', 'bear_bb_std_mult': 2.5848214208945115, 'bear_rsi_os': 35, 'bear_rsi_ob': 83, 'bear_adx_thresh': 31.348334097044514, 'bear_atr_min_pct': 0.02153895699435668, 'bear_atr_max_pct': 0.1073280176697563, 'bear_tp_mult': 2.8384131206603738, 'bear_tsl_mult': 0.5005610063265193, 'bear_time_stop': 268, 'bear_use_sma': False, 'bear_use_ema': False, 'bear_use_atr': False, 'bear_use_adx': True, 'bear_use_spike': True, 'bear_rsi_required': True, 'sideways_strategy': 'breakout', 'sideways_bb_std_mult': 1.0620536497077508, 'sideways_rsi_os': 40, 'sideways_rsi_ob': 69, 'sideways_adx_thresh': 25.039866576577413, 'sideways_atr_min_pct': 0.00963531558173462, 'sideways_atr_max_pct': 0.10235446401059256, 'sideways_tp_mult': 2.8734730925653578, 'sideways_tsl_mult': 0.8969929598219578, 'sideways_time_stop': 209, 'sideways_use_sma': True, 'sideways_use_ema': False, 'sideways_use_atr': False, 'sideways_use_adx': True, 'sideways_use_spike': True, 'sideways_rsi_required': True}.
[I 2025-08-30 16:20:03,946] Trial 720 finished with values: [-1000000000.0, 1000000000.0] and parameters: {'p_sma': 53, 'p_std': 16, 'p_atr': 25, 'p_adx': 11, 'rsi_period': 81, 'ema1': 17, 'ema2': 31, 'slip_atr_k': 0.07954166554950078, 'slip_spread_k': 0.1220110610843825, 'spread_hl_frac': 0.01927146020107421, 'bb_std_mult': 2.4992729293914375, 'rsi_os': 43, 'rsi_ob': 86, 'vol_spike': 0.1644518594674006, 'adx_thresh': 8.736231748833987, 'atr_min_pct': 0.026597981945971252, 'atr_max_pct': 0.09644737176912191, 'tp_mult': 1.7766743943336407, 'tsl_mult': 0.2918130904076717, 'strategy': 'mean_reversion', 'time_stop': 223, 'use_sma': True, 'use_atr': True, 'use_adx': False, 'use_ema': True, 'use_spike': False, 'rsi_required': False, 'edge_k': 0.5325160781704235, 'edge_cap': 0.5809998307752534, 'bull_strategy': 'breakout', 'bull_bb_std_mult': 0.9831682316685322, 'bull_rsi_os': 40, 'bull_rsi_ob': 62, 'bull_adx_thresh': 31.945350175903954, 'bull_atr_min_pct': 0.01981376081690691, 'bull_atr_max_pct': 0.09343265599247899, 'bull_tp_mult': 1.5994133339872312, 'bull_tsl_mult': 0.1012442935165772, 'bull_time_stop': 35, 'bull_use_sma': True, 'bull_use_ema': True, 'bull_use_atr': True, 'bull_use_adx': True, 'bull_use_spike': True, 'bull_rsi_required': True, 'bear_strategy': 'breakout', 'bear_bb_std_mult': 2.5042664848477845, 'bear_rsi_os': 36, 'bear_rsi_ob': 85, 'bear_adx_thresh': 29.44361352137694, 'bear_atr_min_pct': 0.0067246272746125275, 'bear_atr_max_pct': 0.14301433631884355, 'bear_tp_mult': 2.7850500939335543, 'bear_tsl_mult': 0.32945115850962853, 'bear_time_stop': 241, 'bear_use_sma': False, 'bear_use_ema': False, 'bear_use_atr': True, 'bear_use_adx': True, 'bear_use_spike': True, 'bear_rsi_required': True, 'sideways_strategy': 'breakout', 'sideways_bb_std_mult': 0.8122805779887541, 'sideways_rsi_os': 9, 'sideways_rsi_ob': 60, 'sideways_adx_thresh': 24.540158522774714, 'sideways_atr_min_pct': 0.013686574726059851, 'sideways_atr_max_pct': 0.04375347211878823, 'sideways_tp_mult': 2.8702363728260725, 'sideways_tsl_mult': 0.3031771810926407, 'sideways_time_stop': 84, 'sideways_use_sma': True, 'sideways_use_ema': False, 'sideways_use_atr': False, 'sideways_use_adx': True, 'sideways_use_spike': True, 'sideways_rsi_required': True}.
[I 2025-08-30 16:20:05,370] Trial 721 finished with values: [-0.0561847318858234, 0.056106689337100814] and parameters: {'p_sma': 53, 'p_std': 54, 'p_atr': 20, 'p_adx': 10, 'rsi_period': 78, 'ema1': 23, 'ema2': 57, 'slip_atr_k': 0.1756914095509389, 'slip_spread_k': 0.7503997951128907, 'spread_hl_frac': 0.02476573872330417, 'bb_std_mult': 2.4923873738733255, 'rsi_os': 43, 'rsi_ob': 86, 'vol_spike': 0.263579685036845, 'adx_thresh': 14.206878253682467, 'atr_min_pct': 0.014575404249196544, 'atr_max_pct': 0.056348774745277996, 'tp_mult': 1.7808483282032663, 'tsl_mult': 0.3216528655243967, 'strategy': 'mean_reversion', 'time_stop': 230, 'use_sma': True, 'use_atr': False, 'use_adx': True, 'use_ema': False, 'use_spike': True, 'rsi_required': False, 'edge_k': 0.4188201600659071, 'edge_cap': 0.8304554925715018, 'bull_strategy': 'breakout', 'bull_bb_std_mult': 0.9327542632255346, 'bull_rsi_os': 40, 'bull_rsi_ob': 61, 'bull_adx_thresh': 28.33348309464457, 'bull_atr_min_pct': 0.01636957059405634, 'bull_atr_max_pct': 0.09346253809747539, 'bull_tp_mult': 2.045716086238306, 'bull_tsl_mult': 0.09124841412106653, 'bull_time_stop': 77, 'bull_use_sma': True, 'bull_use_ema': True, 'bull_use_atr': True, 'bull_use_adx': True, 'bull_use_spike': True, 'bull_rsi_required': True, 'bear_strategy': 'breakout', 'bear_bb_std_mult': 2.572494590871316, 'bear_rsi_os': 43, 'bear_rsi_ob': 85, 'bear_adx_thresh': 19.509515174064955, 'bear_atr_min_pct': 0.021421659105664764, 'bear_atr_max_pct': 0.10642550859009886, 'bear_tp_mult': 2.823633897551657, 'bear_tsl_mult': 0.5272369677339686, 'bear_time_stop': 247, 'bear_use_sma': False, 'bear_use_ema': False, 'bear_use_atr': False, 'bear_use_adx': True, 'bear_use_spike': True, 'bear_rsi_required': True, 'sideways_strategy': 'breakout', 'sideways_bb_std_mult': 0.8451862905105916, 'sideways_rsi_os': 40, 'sideways_rsi_ob': 69, 'sideways_adx_thresh': 24.73376312065864, 'sideways_atr_min_pct': 0.0005237736324316164, 'sideways_atr_max_pct': 0.10243992070585266, 'sideways_tp_mult': 2.861866834709072, 'sideways_tsl_mult': 0.20574862574408387, 'sideways_time_stop': 130, 'sideways_use_sma': True, 'sideways_use_ema': False, 'sideways_use_atr': False, 'sideways_use_adx': True, 'sideways_use_spike': True, 'sideways_rsi_required': True}.
[I 2025-08-30 16:20:05,376] Trial 722 finished with values: [-0.03810134315153957, 0.038017582469044374] and parameters: {'p_sma': 5, 'p_std': 34, 'p_atr': 25, 'p_adx': 11, 'rsi_period': 53, 'ema1': 24, 'ema2': 57, 'slip_atr_k': 0.23583517887016797, 'slip_spread_k': 0.47698594660124394, 'spread_hl_frac': 0.006832650970980226, 'bb_std_mult': 2.2347158444560167, 'rsi_os': 43, 'rsi_ob': 75, 'vol_spike': 0.1664469726100109, 'adx_thresh': 14.049274810047395, 'atr_min_pct': 0.004421322120524655, 'atr_max_pct': 0.09441371160235171, 'tp_mult': 1.7840284691052872, 'tsl_mult': 0.3009372742736688, 'strategy': 'mean_reversion', 'time_stop': 212, 'use_sma': True, 'use_atr': False, 'use_adx': True, 'use_ema': False, 'use_spike': True, 'rsi_required': False, 'edge_k': 0.4919850085797699, 'edge_cap': 0.602677350888787, 'bull_strategy': 'breakout', 'bull_bb_std_mult': 0.9091008766497807, 'bull_rsi_os': 51, 'bull_rsi_ob': 68, 'bull_adx_thresh': 8.261704020409276, 'bull_atr_min_pct': 0.01943698254200997, 'bull_atr_max_pct': 0.09438528301282946, 'bull_tp_mult': 2.9261424082055374, 'bull_tsl_mult': 0.17590527796636224, 'bull_time_stop': 38, 'bull_use_sma': True, 'bull_use_ema': True, 'bull_use_atr': True, 'bull_use_adx': True, 'bull_use_spike': True, 'bull_rsi_required': True, 'bear_strategy': 'breakout', 'bear_bb_std_mult': 2.5852363690991695, 'bear_rsi_os': 48, 'bear_rsi_ob': 85, 'bear_adx_thresh': 20.368469239001513, 'bear_atr_min_pct': 0.0215501115152745, 'bear_atr_max_pct': 0.14271554788715207, 'bear_tp_mult': 2.820399288002444, 'bear_tsl_mult': 0.30825023335615975, 'bear_time_stop': 242, 'bear_use_sma': False, 'bear_use_ema': False, 'bear_use_atr': False, 'bear_use_adx': True, 'bear_use_spike': True, 'bear_rsi_required': True, 'sideways_strategy': 'breakout', 'sideways_bb_std_mult': 1.1631590655181931, 'sideways_rsi_os': 40, 'sideways_rsi_ob': 60, 'sideways_adx_thresh': 24.921430249645827, 'sideways_atr_min_pct': 4.854387107786247e-06, 'sideways_atr_max_pct': 0.10143071105915899, 'sideways_tp_mult': 2.8572553268416705, 'sideways_tsl_mult': 0.37305617902354077, 'sideways_time_stop': 173, 'sideways_use_sma': True, 'sideways_use_ema': False, 'sideways_use_atr': False, 'sideways_use_adx': True, 'sideways_use_spike': True, 'sideways_rsi_required': True}.
[I 2025-08-30 16:20:06,937] Trial 724 finished with values: [-1000000000.0, 1000000000.0] and parameters: {'p_sma': 5, 'p_std': 55, 'p_atr': 25, 'p_adx': 11, 'rsi_period': 81, 'ema1': 17, 'ema2': 46, 'slip_atr_k': 0.08682276862895744, 'slip_spread_k': 0.756613120951974, 'spread_hl_frac': 0.024695722070637124, 'bb_std_mult': 2.2155696515832637, 'rsi_os': 36, 'rsi_ob': 75, 'vol_spike': 0.2656033709583906, 'adx_thresh': 14.19210698116337, 'atr_min_pct': 0.02657868313988186, 'atr_max_pct': 0.013775551724276566, 'tp_mult': 1.061589444474335, 'tsl_mult': 0.1420482988130713, 'strategy': 'mean_reversion', 'time_stop': 224, 'use_sma': True, 'use_atr': True, 'use_adx': False, 'use_ema': False, 'use_spike': False, 'rsi_required': False, 'edge_k': 0.49062487327249876, 'edge_cap': 0.6240406799509186, 'bull_strategy': 'breakout', 'bull_bb_std_mult': 0.934065925565591, 'bull_rsi_os': 42, 'bull_rsi_ob': 58, 'bull_adx_thresh': 23.32940090595776, 'bull_atr_min_pct': 0.013275903077108011, 'bull_atr_max_pct': 0.09585511314047925, 'bull_tp_mult': 2.0447778222250914, 'bull_tsl_mult': 0.20496482428558505, 'bull_time_stop': 76, 'bull_use_sma': True, 'bull_use_ema': True, 'bull_use_atr': True, 'bull_use_adx': True, 'bull_use_spike': True, 'bull_rsi_required': True, 'bear_strategy': 'breakout', 'bear_bb_std_mult': 2.5640282889590353, 'bear_rsi_os': 32, 'bear_rsi_ob': 85, 'bear_adx_thresh': 28.804133491042084, 'bear_atr_min_pct': 0.007889328467340351, 'bear_atr_max_pct': 0.0716553374554574, 'bear_tp_mult': 2.962979820490812, 'bear_tsl_mult': 0.3343800247173175, 'bear_time_stop': 281, 'bear_use_sma': False, 'bear_use_ema': False, 'bear_use_atr': True, 'bear_use_adx': True, 'bear_use_spike': True, 'bear_rsi_required': True, 'sideways_strategy': 'breakout', 'sideways_bb_std_mult': 1.430222683455301, 'sideways_rsi_os': 39, 'sideways_rsi_ob': 61, 'sideways_adx_thresh': 24.95694094640688, 'sideways_atr_min_pct': 0.0004906856428963254, 'sideways_atr_max_pct': 0.04360037187199419, 'sideways_tp_mult': 2.8906771500904007, 'sideways_tsl_mult': 0.8219379242791421, 'sideways_time_stop': 74, 'sideways_use_sma': True, 'sideways_use_ema': True, 'sideways_use_atr': False, 'sideways_use_adx': True, 'sideways_use_spike': True, 'sideways_rsi_required': True}.
[I 2025-08-30 16:20:53,004] Trial 727 finished with values: [-1000000000.0, 1000000000.0] and parameters: {'p_sma': 5, 'p_std': 55, 'p_atr': 26, 'p_adx': 11, 'rsi_period': 41, 'ema1': 17, 'ema2': 33, 'slip_atr_k': 0.08506308827107184, 'slip_spread_k': 0.9502803800647868, 'spread_hl_frac': 0.024372379918859047, 'bb_std_mult': 2.434276783174353, 'rsi_os': 37, 'rsi_ob': 73, 'vol_spike': 0.174138796341459, 'adx_thresh': 5.059071665633443, 'atr_min_pct': 0.008846467354322289, 'atr_max_pct': 0.07737277398520358, 'tp_mult': 1.054987511615085, 'tsl_mult': 0.23948680978504502, 'strategy': 'mean_reversion', 'time_stop': 224, 'use_sma': True, 'use_atr': True, 'use_adx': False, 'use_ema': True, 'use_spike': True, 'rsi_required': False, 'edge_k': 0.378050948222135, 'edge_cap': 0.6203286837604745, 'bull_strategy': 'breakout', 'bull_bb_std_mult': 0.7363122610421065, 'bull_rsi_os': 42, 'bull_rsi_ob': 63, 'bull_adx_thresh': 22.906236298217372, 'bull_atr_min_pct': 0.013935687349626415, 'bull_atr_max_pct': 0.08582038666201292, 'bull_tp_mult': 2.7018196250891875, 'bull_tsl_mult': 0.2042234553966011, 'bull_time_stop': 43, 'bull_use_sma': True, 'bull_use_ema': True, 'bull_use_atr': True, 'bull_use_adx': True, 'bull_use_spike': False, 'bull_rsi_required': True, 'bear_strategy': 'mean_reversion', 'bear_bb_std_mult': 2.457186739588771, 'bear_rsi_os': 20, 'bear_rsi_ob': 86, 'bear_adx_thresh': 28.67463347859599, 'bear_atr_min_pct': 0.0253626989914724, 'bear_atr_max_pct': 0.06986279403439194, 'bear_tp_mult': 2.725850080005091, 'bear_tsl_mult': 0.27089715067007986, 'bear_time_stop': 281, 'bear_use_sma': False, 'bear_use_ema': False, 'bear_use_atr': True, 'bear_use_adx': True, 'bear_use_spike': True, 'bear_rsi_required': True, 'sideways_strategy': 'breakout', 'sideways_bb_std_mult': 1.4083695572637054, 'sideways_rsi_os': 38, 'sideways_rsi_ob': 66, 'sideways_adx_thresh': 23.77026180304794, 'sideways_atr_min_pct': 0.002898591475123922, 'sideways_atr_max_pct': 0.037304122701173774, 'sideways_tp_mult': 2.9677796301338955, 'sideways_tsl_mult': 0.9380145036065201, 'sideways_time_stop': 74, 'sideways_use_sma': False, 'sideways_use_ema': True, 'sideways_use_atr': False, 'sideways_use_adx': True, 'sideways_use_spike': True, 'sideways_rsi_required': True}.
[I 2025-08-30 16:20:53,331] Trial 725 finished with values: [-0.009774502273777186, 0.00998095156945168] and parameters: {'p_sma': 5, 'p_std': 55, 'p_atr': 26, 'p_adx': 11, 'rsi_period': 78, 'ema1': 24, 'ema2': 44, 'slip_atr_k': 0.12735798859096872, 'slip_spread_k': 0.5372917140607695, 'spread_hl_frac': 0.02464497955734515, 'bb_std_mult': 2.193968859555946, 'rsi_os': 37, 'rsi_ob': 54, 'vol_spike': 0.17218773668392, 'adx_thresh': 14.099056992692438, 'atr_min_pct': 0.01539059987137419, 'atr_max_pct': 0.07382037556814092, 'tp_mult': 1.8724992312114048, 'tsl_mult': 0.5446609658006303, 'strategy': 'mean_reversion', 'time_stop': 232, 'use_sma': True, 'use_atr': False, 'use_adx': True, 'use_ema': False, 'use_spike': True, 'rsi_required': False, 'edge_k': 0.4832645780866328, 'edge_cap': 0.7508997719060186, 'bull_strategy': 'breakout', 'bull_bb_std_mult': 0.9136959829106954, 'bull_rsi_os': 42, 'bull_rsi_ob': 68, 'bull_adx_thresh': 6.86176299599245, 'bull_atr_min_pct': 0.02553255655135521, 'bull_atr_max_pct': 0.09594996314283905, 'bull_tp_mult': 2.643325609285963, 'bull_tsl_mult': 0.023539931843666824, 'bull_time_stop': 40, 'bull_use_sma': True, 'bull_use_ema': True, 'bull_use_atr': True, 'bull_use_adx': True, 'bull_use_spike': True, 'bull_rsi_required': True, 'bear_strategy': 'mean_reversion', 'bear_bb_std_mult': 2.5804133412816133, 'bear_rsi_os': 32, 'bear_rsi_ob': 86, 'bear_adx_thresh': 28.939164965546833, 'bear_atr_min_pct': 0.02071972469729711, 'bear_atr_max_pct': 0.07105168671269689, 'bear_tp_mult': 2.8174063213148055, 'bear_tsl_mult': 0.16291086748045924, 'bear_time_stop': 280, 'bear_use_sma': False, 'bear_use_ema': False, 'bear_use_atr': False, 'bear_use_adx': True, 'bear_use_spike': True, 'bear_rsi_required': True, 'sideways_strategy': 'breakout', 'sideways_bb_std_mult': 1.4281316811844496, 'sideways_rsi_os': 39, 'sideways_rsi_ob': 66, 'sideways_adx_thresh': 23.49130954001946, 'sideways_atr_min_pct': 6.788897230397485e-06, 'sideways_atr_max_pct': 0.1059333118658357, 'sideways_tp_mult': 2.966720914719964, 'sideways_tsl_mult': 0.9386046480078751, 'sideways_time_stop': 74, 'sideways_use_sma': True, 'sideways_use_ema': True, 'sideways_use_atr': False, 'sideways_use_adx': True, 'sideways_use_spike': True, 'sideways_rsi_required': True}.
[I 2025-08-30 16:20:55,315] Trial 726 finished with values: [-1000000000.0, 1000000000.0] and parameters: {'p_sma': 23, 'p_std': 55, 'p_atr': 26, 'p_adx': 11, 'rsi_period': 81, 'ema1': 15, 'ema2': 33, 'slip_atr_k': 0.08627144018894367, 'slip_spread_k': 0.12094685452733323, 'spread_hl_frac': 0.04967585243369707, 'bb_std_mult': 2.4238267609587063, 'rsi_os': 37, 'rsi_ob': 56, 'vol_spike': 0.17277819053709026, 'adx_thresh': 15.147776942665091, 'atr_min_pct': 0.028537417596370605, 'atr_max_pct': 0.08855414711617536, 'tp_mult': 1.8659633088532965, 'tsl_mult': 0.5419569883131483, 'strategy': 'mean_reversion', 'time_stop': 225, 'use_sma': True, 'use_atr': True, 'use_adx': False, 'use_ema': True, 'use_spike': True, 'rsi_required': False, 'edge_k': 0.4807446926015834, 'edge_cap': 0.6231329192032145, 'bull_strategy': 'breakout', 'bull_bb_std_mult': 0.5977380346097618, 'bull_rsi_os': 42, 'bull_rsi_ob': 70, 'bull_adx_thresh': 22.992441288053367, 'bull_atr_min_pct': 0.013121989358009603, 'bull_atr_max_pct': 0.08633499401729816, 'bull_tp_mult': 1.974150488729898, 'bull_tsl_mult': 0.023389336933298317, 'bull_time_stop': 9, 'bull_use_sma': True, 'bull_use_ema': True, 'bull_use_atr': True, 'bull_use_adx': True, 'bull_use_spike': False, 'bull_rsi_required': True, 'bear_strategy': 'mean_reversion', 'bear_bb_std_mult': 2.430153145338501, 'bear_rsi_os': 32, 'bear_rsi_ob': 86, 'bear_adx_thresh': 6.59782612991591, 'bear_atr_min_pct': 0.025203309578641666, 'bear_atr_max_pct': 0.0705488650511476, 'bear_tp_mult': 2.960859586430096, 'bear_tsl_mult': 0.1588195384953282, 'bear_time_stop': 280, 'bear_use_sma': False, 'bear_use_ema': False, 'bear_use_atr': True, 'bear_use_adx': True, 'bear_use_spike': True, 'bear_rsi_required': True, 'sideways_strategy': 'breakout', 'sideways_bb_std_mult': 1.3089908717551118, 'sideways_rsi_os': 6, 'sideways_rsi_ob': 66, 'sideways_adx_thresh': 23.687277915480482, 'sideways_atr_min_pct': 0.0029671517227590565, 'sideways_atr_max_pct': 0.07113277892162743, 'sideways_tp_mult': 2.9031652429509975, 'sideways_tsl_mult': 0.9371545258279496, 'sideways_time_stop': 48, 'sideways_use_sma': False, 'sideways_use_ema': True, 'sideways_use_atr': False, 'sideways_use_adx': True, 'sideways_use_spike': True, 'sideways_rsi_required': True}.
[I 2025-08-30 16:20:56,338] Trial 728 finished with values: [-1000000000.0, 1000000000.0] and parameters: {'p_sma': 17, 'p_std': 19, 'p_atr': 26, 'p_adx': 10, 'rsi_period': 78, 'ema1': 22, 'ema2': 33, 'slip_atr_k': 0.1264943267024536, 'slip_spread_k': 0.14356641195503925, 'spread_hl_frac': 0.024136993739122717, 'bb_std_mult': 2.420829981145805, 'rsi_os': 40, 'rsi_ob': 53, 'vol_spike': 0.17275034616255983, 'adx_thresh': 6.237609026252816, 'atr_min_pct': 0.028855485416979867, 'atr_max_pct': 0.07733618127615052, 'tp_mult': 2.2142116229903186, 'tsl_mult': 0.24890805193386012, 'strategy': 'mean_reversion', 'time_stop': 201, 'use_sma': True, 'use_atr': True, 'use_adx': False, 'use_ema': True, 'use_spike': True, 'rsi_required': False, 'edge_k': 0.3720863636298555, 'edge_cap': 0.5971223259165106, 'bull_strategy': 'breakout', 'bull_bb_std_mult': 0.7390565091841573, 'bull_rsi_os': 42, 'bull_rsi_ob': 60, 'bull_adx_thresh': 22.909660816069266, 'bull_atr_min_pct': 0.017384876536278737, 'bull_atr_max_pct': 0.08523082378602624, 'bull_tp_mult': 2.080722114601352, 'bull_tsl_mult': 0.028015229149193077, 'bull_time_stop': 43, 'bull_use_sma': True, 'bull_use_ema': True, 'bull_use_atr': True, 'bull_use_adx': True, 'bull_use_spike': False, 'bull_rsi_required': True, 'bear_strategy': 'mean_reversion', 'bear_bb_std_mult': 2.4478340725138903, 'bear_rsi_os': 20, 'bear_rsi_ob': 86, 'bear_adx_thresh': 28.84993868161438, 'bear_atr_min_pct': 0.020648007017207426, 'bear_atr_max_pct': 0.07735624019745743, 'bear_tp_mult': 2.7272037408082253, 'bear_tsl_mult': 0.3837077204153209, 'bear_time_stop': 278, 'bear_use_sma': False, 'bear_use_ema': False, 'bear_use_atr': True, 'bear_use_adx': True, 'bear_use_spike': True, 'bear_rsi_required': True, 'sideways_strategy': 'breakout', 'sideways_bb_std_mult': 0.7112652837639913, 'sideways_rsi_os': 35, 'sideways_rsi_ob': 66, 'sideways_adx_thresh': 23.647737265821576, 'sideways_atr_min_pct': 0.0030031669267802617, 'sideways_atr_max_pct': 0.10870981816040261, 'sideways_tp_mult': 2.9659091720702353, 'sideways_tsl_mult': 0.6419354379538715, 'sideways_time_stop': 47, 'sideways_use_sma': False, 'sideways_use_ema': True, 'sideways_use_atr': False, 'sideways_use_adx': True, 'sideways_use_spike': True, 'sideways_rsi_required': True}.
