[I 2025-08-30 14:21:39,535] Trial 8 finished with values: [-1000000000.0, 1000000000.0] and parameters: {'p_sma': 31, 'p_std': 21, 'p_atr': 14, 'p_adx': 11, 'rsi_period': 52, 'ema1': 12, 'ema2': 14, 'slip_atr_k': 0.24693392156562843, 'slip_spread_k': 0.8414638790693938, 'spread_hl_frac': 0.021619784810818245, 'bb_std_mult': 1.1779233014518085, 'rsi_os': 10, 'rsi_ob': 91, 'vol_spike': 0.03494653462990547, 'adx_thresh': 17.58031923310973, 'atr_min_pct': 0.0038688136052720877, 'atr_max_pct': 0.08850431735708662, 'tp_mult': 2.59753741184527, 'tsl_mult': 0.5699534833387442, 'strategy': 'breakout', 'time_stop': 203, 'use_sma': True, 'use_atr': False, 'use_adx': False, 'use_ema': False, 'use_spike': False, 'rsi_required': False, 'edge_k': 1.3244520821953398, 'edge_cap': 0.31840240485381593, 'bull_strategy': 'breakout', 'bull_bb_std_mult': 0.8932877084895474, 'bull_rsi_os': 14, 'bull_rsi_ob': 91, 'bull_adx_thresh': 33.8447015155426, 'bull_atr_min_pct': 0.028845393867788168, 'bull_atr_max_pct': 0.07527280024505124, 'bull_tp_mult': 2.8154981169861193, 'bull_tsl_mult': 0.4152560049877473, 'bull_time_stop': 136, 'bull_use_sma': False, 'bull_use_ema': False, 'bull_use_atr': True, 'bull_use_adx': False, 'bull_use_spike': False, 'bull_rsi_required': True, 'bear_strategy': 'mean_reversion', 'bear_bb_std_mult': 2.994730065475049, 'bear_rsi_os': 18, 'bear_rsi_ob': 52, 'bear_adx_thresh': 27.9176636539423, 'bear_atr_min_pct': 0.022227892893825606, 'bear_atr_max_pct': 0.013248079479429098, 'bear_tp_mult': 2.2895504551043717, 'bear_tsl_mult': 0.40511250682639, 'bear_time_stop': 252, 'bear_use_sma': True, 'bear_use_ema': True, 'bear_use_atr': False, 'bear_use_adx': False, 'bear_use_spike': True, 'bear_rsi_required': False, 'sideways_strategy': 'breakout', 'sideways_bb_std_mult': 3.2214520507272035, 'sideways_rsi_os': 49, 'sideways_rsi_ob': 71, 'sideways_adx_thresh': 8.349088094381843, 'sideways_atr_min_pct': 0.017862485084989162, 'sideways_atr_max_pct': 0.12368064675078612, 'sideways_tp_mult': 2.346401992809364, 'sideways_tsl_mult': 0.6948925757630975, 'sideways_time_stop': 227, 'sideways_use_sma': True, 'sideways_use_ema': False, 'sideways_use_atr': False, 'sideways_use_adx': True, 'sideways_use_spike': False, 'sideways_rsi_required': False}.
[I 2025-08-30 14:22:09,810] Trial 11 finished with values: [-1000000000.0, 1000000000.0] and parameters: {'p_sma': 42, 'p_std': 55, 'p_atr': 20, 'p_adx': 12, 'rsi_period': 11, 'ema1': 9, 'ema2': 42, 'slip_atr_k': 0.11552349809157617, 'slip_spread_k': 0.025810437749929416, 'spread_hl_frac': 0.01983220221972843, 'bb_std_mult': 2.824410948791541, 'rsi_os': 12, 'rsi_ob': 84, 'vol_spike': 0.04006287040255869, 'adx_thresh': 10.771567772143847, 'atr_min_pct': 0.025055916600241087, 'atr_max_pct': 0.10183555508234361, 'tp_mult': 1.6831471532429847, 'tsl_mult': 0.6893372322959976, 'strategy': 'mean_reversion', 'time_stop': 89, 'use_sma': True, 'use_atr': False, 'use_adx': False, 'use_ema': False, 'use_spike': True, 'rsi_required': True, 'edge_k': 1.3904386533120592, 'edge_cap': 0.067211634216073, 'bull_strategy': 'breakout', 'bull_bb_std_mult': 1.0719810095181475, 'bull_rsi_os': 45, 'bull_rsi_ob': 52, 'bull_adx_thresh': 34.73301598796981, 'bull_atr_min_pct': 0.027367728588168713, 'bull_atr_max_pct': 0.07892260633752614, 'bull_tp_mult': 2.7053394592535756, 'bull_tsl_mult': 0.2732041322539742, 'bull_time_stop': 172, 'bull_use_sma': False, 'bull_use_ema': False, 'bull_use_atr': True, 'bull_use_adx': False, 'bull_use_spike': False, 'bull_rsi_required': False, 'bear_strategy': 'mean_reversion', 'bear_bb_std_mult': 3.1720533536634488, 'bear_rsi_os': 23, 'bear_rsi_ob': 67, 'bear_adx_thresh': 16.430515479816552, 'bear_atr_min_pct': 0.0200811427293015, 'bear_atr_max_pct': 0.0901000598744086, 'bear_tp_mult': 1.7903293057100154, 'bear_tsl_mult': 0.08641806738351931, 'bear_time_stop': 198, 'bear_use_sma': False, 'bear_use_ema': True, 'bear_use_atr': False, 'bear_use_adx': False, 'bear_use_spike': True, 'bear_rsi_required': False, 'sideways_strategy': 'mean_reversion', 'sideways_bb_std_mult': 1.3374643337626593, 'sideways_rsi_os': 27, 'sideways_rsi_ob': 46, 'sideways_adx_thresh': 10.853731700361674, 'sideways_atr_min_pct': 0.01630666702757576, 'sideways_atr_max_pct': 0.03435815402799027, 'sideways_tp_mult': 1.2598443059305644, 'sideways_tsl_mult': 0.26636156824419954, 'sideways_time_stop': 123, 'sideways_use_sma': False, 'sideways_use_ema': False, 'sideways_use_atr': True, 'sideways_use_adx': True, 'sideways_use_spike': True, 'sideways_rsi_required': True}.
[I 2025-08-30 14:22:10,569] Trial 10 finished with values: [-1000000000.0, 1000000000.0] and parameters: {'p_sma': 21, 'p_std': 15, 'p_atr': 7, 'p_adx': 27, 'rsi_period': 76, 'ema1': 27, 'ema2': 57, 'slip_atr_k': 0.009111138681393488, 'slip_spread_k': 0.14410628911825552, 'spread_hl_frac': 0.002367627992029564, 'bb_std_mult': 3.4921928278672527, 'rsi_os': 10, 'rsi_ob': 88, 'vol_spike': 0.2405497882881219, 'adx_thresh': 12.957416677447908, 'atr_min_pct': 0.011279637827843155, 'atr_max_pct': 0.13140999407285986, 'tp_mult': 2.549788770491357, 'tsl_mult': 0.10646881478506476, 'strategy': 'mean_reversion', 'time_stop': 61, 'use_sma': False, 'use_atr': True, 'use_adx': True, 'use_ema': True, 'use_spike': False, 'rsi_required': True, 'edge_k': 0.28723833284264044, 'edge_cap': 0.8040274675320718, 'bull_strategy': 'mean_reversion', 'bull_bb_std_mult': 1.9177019467298804, 'bull_rsi_os': 13, 'bull_rsi_ob': 79, 'bull_adx_thresh': 12.145248666518984, 'bull_atr_min_pct': 0.012637222674878223, 'bull_atr_max_pct': 0.12055711405670387, 'bull_tp_mult': 2.677604293424878, 'bull_tsl_mult': 0.592675296460462, 'bull_time_stop': 15, 'bull_use_sma': False, 'bull_use_ema': True, 'bull_use_atr': False, 'bull_use_adx': True, 'bull_use_spike': True, 'bull_rsi_required': True, 'bear_strategy': 'mean_reversion', 'bear_bb_std_mult': 3.1798068143946456, 'bear_rsi_os': 5, 'bear_rsi_ob': 65, 'bear_adx_thresh': 23.554044022989544, 'bear_atr_min_pct': 0.012723531093570816, 'bear_atr_max_pct': 0.11152494000833275, 'bear_tp_mult': 2.6759516400444143, 'bear_tsl_mult': 0.23834927316494892, 'bear_time_stop': 43, 'bear_use_sma': True, 'bear_use_ema': False, 'bear_use_atr': True, 'bear_use_adx': True, 'bear_use_spike': False, 'bear_rsi_required': True, 'sideways_strategy': 'mean_reversion', 'sideways_bb_std_mult': 1.7127559216575716, 'sideways_rsi_os': 33, 'sideways_rsi_ob': 49, 'sideways_adx_thresh': 19.969576735214908, 'sideways_atr_min_pct': 0.002605769267305865, 'sideways_atr_max_pct': 0.08921317298135738, 'sideways_tp_mult': 2.3397176746934734, 'sideways_tsl_mult': 0.8980858813930428, 'sideways_time_stop': 82, 'sideways_use_sma': True, 'sideways_use_ema': True, 'sideways_use_atr': False, 'sideways_use_adx': False, 'sideways_use_spike': True, 'sideways_rsi_required': True}.
[I 2025-08-30 14:22:10,970] Trial 12 finished with values: [-1000000000.0, 1000000000.0] and parameters: {'p_sma': 47, 'p_std': 17, 'p_atr': 12, 'p_adx': 27, 'rsi_period': 37, 'ema1': 11, 'ema2': 49, 'slip_atr_k': 0.13479016576520825, 'slip_spread_k': 0.22416054927377016, 'spread_hl_frac': 0.026128858251464954, 'bb_std_mult': 2.34709908414954, 'rsi_os': 16, 'rsi_ob': 93, 'vol_spike': 0.13668853114130167, 'adx_thresh': 28.176044850553296, 'atr_min_pct': 0.014722980812050784, 'atr_max_pct': 0.05879975822031643, 'tp_mult': 1.317009703981142, 'tsl_mult': 0.18580553505214714, 'strategy': 'mean_reversion', 'time_stop': 9, 'use_sma': False, 'use_atr': True, 'use_adx': False, 'use_ema': True, 'use_spike': True, 'rsi_required': True, 'edge_k': 0.5328494659812453, 'edge_cap': 0.212872485744543, 'bull_strategy': 'breakout', 'bull_bb_std_mult': 3.565794685066527, 'bull_rsi_os': 29, 'bull_rsi_ob': 49, 'bull_adx_thresh': 20.697267927069277, 'bull_atr_min_pct': 0.0024146772793405546, 'bull_atr_max_pct': 0.1421946278190869, 'bull_tp_mult': 2.0612580709573285, 'bull_tsl_mult': 0.10143353329561722, 'bull_time_stop': 211, 'bull_use_sma': True, 'bull_use_ema': True, 'bull_use_atr': False, 'bull_use_adx': True, 'bull_use_spike': True, 'bull_rsi_required': True, 'bear_strategy': 'breakout', 'bear_bb_std_mult': 2.5191346594390667, 'bear_rsi_os': 19, 'bear_rsi_ob': 60, 'bear_adx_thresh': 13.150965504775314, 'bear_atr_min_pct': 0.02159012512861097, 'bear_atr_max_pct': 0.011924141147338555, 'bear_tp_mult': 1.2501266707808676, 'bear_tsl_mult': 0.39670945895473886, 'bear_time_stop': 123, 'bear_use_sma': False, 'bear_use_ema': False, 'bear_use_atr': True, 'bear_use_adx': True, 'bear_use_spike': True, 'bear_rsi_required': False, 'sideways_strategy': 'breakout', 'sideways_bb_std_mult': 1.8591068523011645, 'sideways_rsi_os': 24, 'sideways_rsi_ob': 70, 'sideways_adx_thresh': 14.864662700100169, 'sideways_atr_min_pct': 0.007885616317127447, 'sideways_atr_max_pct': 0.08342364606701821, 'sideways_tp_mult': 1.308021545410296, 'sideways_tsl_mult': 0.29237666548487573, 'sideways_time_stop': 40, 'sideways_use_sma': True, 'sideways_use_ema': False, 'sideways_use_atr': False, 'sideways_use_adx': True, 'sideways_use_spike': True, 'sideways_rsi_required': False}.
[I 2025-08-30 14:22:11,257] Trial 13 finished with values: [-0.027695869805771878, 0.027597905439794998] and parameters: {'p_sma': 59, 'p_std': 39, 'p_atr': 7, 'p_adx': 7, 'rsi_period': 13, 'ema1': 5, 'ema2': 39, 'slip_atr_k': 0.0071852519107204055, 'slip_spread_k': 0.6986101506473034, 'spread_hl_frac': 0.0010883209108888056, 'bb_std_mult': 3.506302418712302, 'rsi_os': 18, 'rsi_ob': 81, 'vol_spike': 0.17215793980297647, 'adx_thresh': 8.110158567275667, 'atr_min_pct': 0.001690230387428793, 'atr_max_pct': 0.1486207067778209, 'tp_mult': 1.0858636259507797, 'tsl_mult': 0.9731562636159794, 'strategy': 'breakout', 'time_stop': 288, 'use_sma': True, 'use_atr': False, 'use_adx': True, 'use_ema': False, 'use_spike': True, 'rsi_required': True, 'edge_k': 1.9594131148615128, 'edge_cap': 0.05156878461868922, 'bull_strategy': 'breakout', 'bull_bb_std_mult': 2.306557763570215, 'bull_rsi_os': 55, 'bull_rsi_ob': 58, 'bull_adx_thresh': 9.525701028260084, 'bull_atr_min_pct': 0.00011301898051460472, 'bull_atr_max_pct': 0.14961442899676722, 'bull_tp_mult': 1.9549952604844045, 'bull_tsl_mult': 0.9956590514944674, 'bull_time_stop': 299, 'bull_use_sma': False, 'bull_use_ema': False, 'bull_use_atr': False, 'bull_use_adx': False, 'bull_use_spike': True, 'bull_rsi_required': False, 'bear_strategy': 'breakout', 'bear_bb_std_mult': 2.656704212664321, 'bear_rsi_os': 10, 'bear_rsi_ob': 45, 'bear_adx_thresh': 34.56943121761983, 'bear_atr_min_pct': 0.01256042392822572, 'bear_atr_max_pct': 0.03383733111164255, 'bear_tp_mult': 1.5626960070090794, 'bear_tsl_mult': 0.03401858932572133, 'bear_time_stop': 213, 'bear_use_sma': True, 'bear_use_ema': False, 'bear_use_atr': True, 'bear_use_adx': True, 'bear_use_spike': True, 'bear_rsi_required': True, 'sideways_strategy': 'breakout', 'sideways_bb_std_mult': 2.6442478839748995, 'sideways_rsi_os': 6, 'sideways_rsi_ob': 93, 'sideways_adx_thresh': 24.04882975066079, 'sideways_atr_min_pct': 0.009348543562496574, 'sideways_atr_max_pct': 0.0947918210099997, 'sideways_tp_mult': 1.7936163548272606, 'sideways_tsl_mult': 0.17536561448442428, 'sideways_time_stop': 298, 'sideways_use_sma': False, 'sideways_use_ema': False, 'sideways_use_atr': False, 'sideways_use_adx': True, 'sideways_use_spike': False, 'sideways_rsi_required': False}.
[I 2025-08-30 14:22:39,950] Trial 14 finished with values: [-0.028403121647545104, 0.028356741259975383] and parameters: {'p_sma': 60, 'p_std': 40, 'p_atr': 8, 'p_adx': 22, 'rsi_period': 67, 'ema1': 5, 'ema2': 60, 'slip_atr_k': 0.0052536721502791095, 'slip_spread_k': 0.6624646066111026, 'spread_hl_frac': 0.0017596957974827382, 'bb_std_mult': 0.7214210430977285, 'rsi_os': 22, 'rsi_ob': 80, 'vol_spike': 0.17024537450528682, 'adx_thresh': 8.811847084959153, 'atr_min_pct': 0.005351376820499541, 'atr_max_pct': 0.05073560291004416, 'tp_mult': 1.0979703929413558, 'tsl_mult': 0.9656446636212811, 'strategy': 'breakout', 'time_stop': 18, 'use_sma': True, 'use_atr': False, 'use_adx': True, 'use_ema': False, 'use_spike': True, 'rsi_required': True, 'edge_k': 1.9670691117152104, 'edge_cap': 0.6020966419923819, 'bull_strategy': 'breakout', 'bull_bb_std_mult': 2.295183787639056, 'bull_rsi_os': 36, 'bull_rsi_ob': 61, 'bull_adx_thresh': 7.421058586526325, 'bull_atr_min_pct': 0.00019725802755634052, 'bull_atr_max_pct': 0.13488005456313845, 'bull_tp_mult': 1.6401228754330397, 'bull_tsl_mult': 0.9141724705647285, 'bull_time_stop': 297, 'bull_use_sma': False, 'bull_use_ema': True, 'bull_use_atr': False, 'bull_use_adx': False, 'bull_use_spike': True, 'bull_rsi_required': False, 'bear_strategy': 'breakout', 'bear_bb_std_mult': 2.5185982225286274, 'bear_rsi_os': 6, 'bear_rsi_ob': 45, 'bear_adx_thresh': 23.01119131983694, 'bear_atr_min_pct': 0.005069591526238286, 'bear_atr_max_pct': 0.04079699923143777, 'bear_tp_mult': 1.163654413084, 'bear_tsl_mult': 0.07061390824000419, 'bear_time_stop': 298, 'bear_use_sma': True, 'bear_use_ema': False, 'bear_use_atr': True, 'bear_use_adx': True, 'bear_use_spike': True, 'bear_rsi_required': True, 'sideways_strategy': 'mean_reversion', 'sideways_bb_std_mult': 2.719216143323987, 'sideways_rsi_os': 9, 'sideways_rsi_ob': 63, 'sideways_adx_thresh': 25.00006693680263, 'sideways_atr_min_pct': 0.007133815121131891, 'sideways_atr_max_pct': 0.013740423413606958, 'sideways_tp_mult': 1.7394355523506528, 'sideways_tsl_mult': 0.25979117621918735, 'sideways_time_stop': 294, 'sideways_use_sma': True, 'sideways_use_ema': False, 'sideways_use_atr': False, 'sideways_use_adx': True, 'sideways_use_spike': False, 'sideways_rsi_required': True}.
[I 2025-08-30 14:22:41,423] Trial 17 finished with values: [-0.023073060948658908, 0.02297168318080423] and parameters: {'p_sma': 60, 'p_std': 42, 'p_atr': 17, 'p_adx': 22, 'rsi_period': 63, 'ema1': 5, 'ema2': 30, 'slip_atr_k': 0.1778773132851612, 'slip_spread_k': 0.6483318527361153, 'spread_hl_frac': 0.032480703777311784, 'bb_std_mult': 0.5114129547123314, 'rsi_os': 54, 'rsi_ob': 78, 'vol_spike': 0.18323961302885716, 'adx_thresh': 6.289760338402, 'atr_min_pct': 0.0005612593468100856, 'atr_max_pct': 0.05640692536684934, 'tp_mult': 1.029629776563985, 'tsl_mult': 0.45585630487939444, 'strategy': 'breakout', 'time_stop': 295, 'use_sma': True, 'use_atr': False, 'use_adx': True, 'use_ema': False, 'use_spike': True, 'rsi_required': True, 'edge_k': 1.985982656130433, 'edge_cap': 0.6160425309199143, 'bull_strategy': 'breakout', 'bull_bb_std_mult': 2.6473356123689853, 'bull_rsi_os': 53, 'bull_rsi_ob': 61, 'bull_adx_thresh': 25.289788162997336, 'bull_atr_min_pct': 1.1607838835044461e-05, 'bull_atr_max_pct': 0.011553890729939509, 'bull_tp_mult': 1.7035491507439042, 'bull_tsl_mult': 0.9781666499332409, 'bull_time_stop': 291, 'bull_use_sma': False, 'bull_use_ema': True, 'bull_use_atr': False, 'bull_use_adx': False, 'bull_use_spike': True, 'bull_rsi_required': False, 'bear_strategy': 'breakout', 'bear_bb_std_mult': 1.5642711827215532, 'bear_rsi_os': 14, 'bear_rsi_ob': 46, 'bear_adx_thresh': 34.1987160933811, 'bear_atr_min_pct': 0.0004940086242305967, 'bear_atr_max_pct': 0.042310303381486065, 'bear_tp_mult': 1.8167573591513957, 'bear_tsl_mult': 0.9415430756896734, 'bear_time_stop': 226, 'bear_use_sma': True, 'bear_use_ema': False, 'bear_use_atr': True, 'bear_use_adx': True, 'bear_use_spike': True, 'bear_rsi_required': True, 'sideways_strategy': 'mean_reversion', 'sideways_bb_std_mult': 2.4930654324222434, 'sideways_rsi_os': 5, 'sideways_rsi_ob': 63, 'sideways_adx_thresh': 25.518228800940033, 'sideways_atr_min_pct': 0.01015134619686536, 'sideways_atr_max_pct': 0.010083604225070791, 'sideways_tp_mult': 1.7147996447266975, 'sideways_tsl_mult': 0.011598341140015941, 'sideways_time_stop': 282, 'sideways_use_sma': True, 'sideways_use_ema': False, 'sideways_use_atr': False, 'sideways_use_adx': True, 'sideways_use_spike': False, 'sideways_rsi_required': True}.
[I 2025-08-30 14:22:41,536] Trial 15 finished with values: [-0.028411073153408184, 0.028310534186772755] and parameters: {'p_sma': 60, 'p_std': 38, 'p_atr': 17, 'p_adx': 21, 'rsi_period': 28, 'ema1': 6, 'ema2': 59, 'slip_atr_k': 0.17308847957185783, 'slip_spread_k': 0.6206823805001491, 'spread_hl_frac': 0.03505911447845516, 'bb_std_mult': 0.5055984498409642, 'rsi_os': 20, 'rsi_ob': 80, 'vol_spike': 0.16925162234584837, 'adx_thresh': 6.370324484307224, 'atr_min_pct': 0.005880084758855113, 'atr_max_pct': 0.05366974610181074, 'tp_mult': 1.0840690471642505, 'tsl_mult': 0.9942775247362565, 'strategy': 'breakout', 'time_stop': 15, 'use_sma': True, 'use_atr': False, 'use_adx': True, 'use_ema': False, 'use_spike': True, 'rsi_required': True, 'edge_k': 1.9791512000038172, 'edge_cap': 0.6188380878647123, 'bull_strategy': 'breakout', 'bull_bb_std_mult': 2.6035167794344427, 'bull_rsi_os': 37, 'bull_rsi_ob': 65, 'bull_adx_thresh': 6.5953466178833136, 'bull_atr_min_pct': 0.0014658893749935123, 'bull_atr_max_pct': 0.012507694525983326, 'bull_tp_mult': 1.6622324477113959, 'bull_tsl_mult': 0.9737469241305339, 'bull_time_stop': 299, 'bull_use_sma': False, 'bull_use_ema': True, 'bull_use_atr': False, 'bull_use_adx': False, 'bull_use_spike': True, 'bull_rsi_required': False, 'bear_strategy': 'breakout', 'bear_bb_std_mult': 2.599453054874448, 'bear_rsi_os': 14, 'bear_rsi_ob': 45, 'bear_adx_thresh': 34.45662580893281, 'bear_atr_min_pct': 0.0045884297561369965, 'bear_atr_max_pct': 0.03124111338052664, 'bear_tp_mult': 1.0402750125433269, 'bear_tsl_mult': 0.940620917629582, 'bear_time_stop': 116, 'bear_use_sma': True, 'bear_use_ema': False, 'bear_use_atr': True, 'bear_use_adx': True, 'bear_use_spike': True, 'bear_rsi_required': True, 'sideways_strategy': 'breakout', 'sideways_bb_std_mult': 2.4371517228414534, 'sideways_rsi_os': 7, 'sideways_rsi_ob': 62, 'sideways_adx_thresh': 26.526309329880718, 'sideways_atr_min_pct': 0.009315761855417954, 'sideways_atr_max_pct': 0.0127111758379069, 'sideways_tp_mult': 1.6917935793747356, 'sideways_tsl_mult': 0.26908165384676846, 'sideways_time_stop': 294, 'sideways_use_sma': False, 'sideways_use_ema': False, 'sideways_use_atr': False, 'sideways_use_adx': True, 'sideways_use_spike': False, 'sideways_rsi_required': False}.
[I 2025-08-30 14:22:41,632] Trial 16 finished with values: [-0.053255227010722384, 0.05315714540635061] and parameters: {'p_sma': 60, 'p_std': 41, 'p_atr': 17, 'p_adx': 7, 'rsi_period': 26, 'ema1': 5, 'ema2': 60, 'slip_atr_k': 0.1776678043319302, 'slip_spread_k': 0.6044605989493478, 'spread_hl_frac': 0.032507522642950364, 'bb_std_mult': 0.6569071750218072, 'rsi_os': 22, 'rsi_ob': 81, 'vol_spike': 0.17695153129624142, 'adx_thresh': 5.782235363412706, 'atr_min_pct': 0.00012591076779339822, 'atr_max_pct': 0.05957917301256851, 'tp_mult': 1.0381447475025416, 'tsl_mult': 0.9763993835723311, 'strategy': 'breakout', 'time_stop': 162, 'use_sma': True, 'use_atr': False, 'use_adx': True, 'use_ema': False, 'use_spike': True, 'rsi_required': True, 'edge_k': 1.8795536701467035, 'edge_cap': 0.5812933820160353, 'bull_strategy': 'breakout', 'bull_bb_std_mult': 2.60970233468659, 'bull_rsi_os': 39, 'bull_rsi_ob': 61, 'bull_adx_thresh': 5.2207570315958325, 'bull_atr_min_pct': 0.0001261228587112358, 'bull_atr_max_pct': 0.01116487757788591, 'bull_tp_mult': 1.48068614504047, 'bull_tsl_mult': 0.9908446909344008, 'bull_time_stop': 296, 'bull_use_sma': False, 'bull_use_ema': True, 'bull_use_atr': False, 'bull_use_adx': False, 'bull_use_spike': True, 'bull_rsi_required': False, 'bear_strategy': 'breakout', 'bear_bb_std_mult': 2.570302193868365, 'bear_rsi_os': 29, 'bear_rsi_ob': 45, 'bear_adx_thresh': 22.693512397925193, 'bear_atr_min_pct': 0.004719800408410604, 'bear_atr_max_pct': 0.04808460077919316, 'bear_tp_mult': 1.6907584410240188, 'bear_tsl_mult': 0.9507729242502221, 'bear_time_stop': 296, 'bear_use_sma': True, 'bear_use_ema': False, 'bear_use_atr': True, 'bear_use_adx': True, 'bear_use_spike': True, 'bear_rsi_required': True, 'sideways_strategy': 'mean_reversion', 'sideways_bb_std_mult': 2.5649861304537436, 'sideways_rsi_os': 5, 'sideways_rsi_ob': 60, 'sideways_adx_thresh': 25.024465547275653, 'sideways_atr_min_pct': 0.008954703216630491, 'sideways_atr_max_pct': 0.011351893084822484, 'sideways_tp_mult': 1.6573224183157507, 'sideways_tsl_mult': 0.00562405511288, 'sideways_time_stop': 272, 'sideways_use_sma': False, 'sideways_use_ema': False, 'sideways_use_atr': False, 'sideways_use_adx': True, 'sideways_use_spike': False, 'sideways_rsi_required': True}.
