[I 2025-08-30 14:53:41,230] Trial 268 finished with values: [-1000000000.0, 1000000000.0] and parameters: {'p_sma': 32, 'p_std': 30, 'p_atr': 27, 'p_adx': 22, 'rsi_period': 39, 'ema1': 9, 'ema2': 47, 'slip_atr_k': 0.02592817996598462, 'slip_spread_k': 0.23553753683983722, 'spread_hl_frac': 0.048621471093642156, 'bb_std_mult': 1.836338341883441, 'rsi_os': 35, 'rsi_ob': 88, 'vol_spike': 0.23911676168636212, 'adx_thresh': 23.190669005189797, 'atr_min_pct': 0.00292225174271034, 'atr_max_pct': 0.016170227127844355, 'tp_mult': 2.354181174442643, 'tsl_mult': 0.11682202983093182, 'strategy': 'mean_reversion', 'time_stop': 201, 'use_sma': True, 'use_atr': False, 'use_adx': False, 'use_ema': False, 'use_spike': False, 'rsi_required': False, 'edge_k': 1.5451036290258255, 'edge_cap': 0.6214859245177933, 'bull_strategy': 'breakout', 'bull_bb_std_mult': 3.2824403404454716, 'bull_rsi_os': 13, 'bull_rsi_ob': 57, 'bull_adx_thresh': 33.15670785196854, 'bull_atr_min_pct': 0.002981524441881471, 'bull_atr_max_pct': 0.12320439237679065, 'bull_tp_mult': 1.2066991789107067, 'bull_tsl_mult': 0.5816015331565321, 'bull_time_stop': 263, 'bull_use_sma': False, 'bull_use_ema': False, 'bull_use_atr': True, 'bull_use_adx': True, 'bull_use_spike': False, 'bull_rsi_required': True, 'bear_strategy': 'mean_reversion', 'bear_bb_std_mult': 1.2066937411830059, 'bear_rsi_os': 37, 'bear_rsi_ob': 55, 'bear_adx_thresh': 18.17213201096973, 'bear_atr_min_pct': 0.010866060741517079, 'bear_atr_max_pct': 0.029650516957733415, 'bear_tp_mult': 1.8170501283379854, 'bear_tsl_mult': 0.10619957659358109, 'bear_time_stop': 181, 'bear_use_sma': False, 'bear_use_ema': False, 'bear_use_atr': False, 'bear_use_adx': False, 'bear_use_spike': True, 'bear_rsi_required': False, 'sideways_strategy': 'breakout', 'sideways_bb_std_mult': 0.512634847242591, 'sideways_rsi_os': 31, 'sideways_rsi_ob': 87, 'sideways_adx_thresh': 17.39138196496622, 'sideways_atr_min_pct': 0.003741637549526844, 'sideways_atr_max_pct': 0.0737191613172092, 'sideways_tp_mult': 1.8637433125081069, 'sideways_tsl_mult': 0.14138345229907257, 'sideways_time_stop': 219, 'sideways_use_sma': True, 'sideways_use_ema': True, 'sideways_use_atr': False, 'sideways_use_adx': True, 'sideways_use_spike': True, 'sideways_rsi_required': True}.
[I 2025-08-30 14:53:41,695] Trial 267 finished with values: [-1000000000.0, 1000000000.0] and parameters: {'p_sma': 33, 'p_std': 30, 'p_atr': 27, 'p_adx': 22, 'rsi_period': 67, 'ema1': 25, 'ema2': 32, 'slip_atr_k': 0.026155286617119956, 'slip_spread_k': 0.2511716809720941, 'spread_hl_frac': 0.04541907446749181, 'bb_std_mult': 2.370735698403878, 'rsi_os': 35, 'rsi_ob': 88, 'vol_spike': 0.2388060839780042, 'adx_thresh': 19.15029609737354, 'atr_min_pct': 0.026541019565716514, 'atr_max_pct': 0.10050016851786743, 'tp_mult': 2.3410317139552537, 'tsl_mult': 0.292736494421277, 'strategy': 'mean_reversion', 'time_stop': 45, 'use_sma': False, 'use_atr': False, 'use_adx': False, 'use_ema': False, 'use_spike': True, 'rsi_required': False, 'edge_k': 1.6614235094983831, 'edge_cap': 0.6504728235431237, 'bull_strategy': 'breakout', 'bull_bb_std_mult': 3.2832221012222975, 'bull_rsi_os': 15, 'bull_rsi_ob': 88, 'bull_adx_thresh': 12.072203548691778, 'bull_atr_min_pct': 0.026736423238542216, 'bull_atr_max_pct': 0.0223728175771275, 'bull_tp_mult': 1.3932430988037874, 'bull_tsl_mult': 0.7525648462531762, 'bull_time_stop': 262, 'bull_use_sma': True, 'bull_use_ema': True, 'bull_use_atr': False, 'bull_use_adx': False, 'bull_use_spike': False, 'bull_rsi_required': True, 'bear_strategy': 'mean_reversion', 'bear_bb_std_mult': 1.1770933833842376, 'bear_rsi_os': 37, 'bear_rsi_ob': 50, 'bear_adx_thresh': 18.23947403517386, 'bear_atr_min_pct': 0.026019524493271592, 'bear_atr_max_pct': 0.034859674000448565, 'bear_tp_mult': 2.038921465137191, 'bear_tsl_mult': 0.11529421501796334, 'bear_time_stop': 35, 'bear_use_sma': False, 'bear_use_ema': True, 'bear_use_atr': False, 'bear_use_adx': False, 'bear_use_spike': False, 'bear_rsi_required': False, 'sideways_strategy': 'breakout', 'sideways_bb_std_mult': 1.9925389761149999, 'sideways_rsi_os': 31, 'sideways_rsi_ob': 81, 'sideways_adx_thresh': 17.31051178723671, 'sideways_atr_min_pct': 0.005484580637274169, 'sideways_atr_max_pct': 0.07971766203300223, 'sideways_tp_mult': 1.3119106356886183, 'sideways_tsl_mult': 0.0922522005436444, 'sideways_time_stop': 219, 'sideways_use_sma': True, 'sideways_use_ema': True, 'sideways_use_atr': False, 'sideways_use_adx': True, 'sideways_use_spike': True, 'sideways_rsi_required': True}.
[I 2025-08-30 14:53:42,839] Trial 272 finished with values: [-1000000000.0, 1000000000.0] and parameters: {'p_sma': 32, 'p_std': 26, 'p_atr': 14, 'p_adx': 20, 'rsi_period': 45, 'ema1': 27, 'ema2': 55, 'slip_atr_k': 0.047476275024138176, 'slip_spread_k': 0.7015200044735416, 'spread_hl_frac': 0.006075992288143008, 'bb_std_mult': 2.141278140965458, 'rsi_os': 47, 'rsi_ob': 90, 'vol_spike': 0.231571752348318, 'adx_thresh': 20.721790072589492, 'atr_min_pct': 0.0024694215292581836, 'atr_max_pct': 0.1101695698673429, 'tp_mult': 2.4078624617482407, 'tsl_mult': 0.9808820114814855, 'strategy': 'mean_reversion', 'time_stop': 189, 'use_sma': True, 'use_atr': False, 'use_adx': True, 'use_ema': False, 'use_spike': False, 'rsi_required': False, 'edge_k': 1.0635682497972079, 'edge_cap': 0.6464163763781468, 'bull_strategy': 'breakout', 'bull_bb_std_mult': 3.129585091068357, 'bull_rsi_os': 52, 'bull_rsi_ob': 62, 'bull_adx_thresh': 17.40274343716645, 'bull_atr_min_pct': 0.007044775995300715, 'bull_atr_max_pct': 0.14447043836167953, 'bull_tp_mult': 1.753875494762255, 'bull_tsl_mult': 0.7524003958860251, 'bull_time_stop': 274, 'bull_use_sma': False, 'bull_use_ema': False, 'bull_use_atr': True, 'bull_use_adx': True, 'bull_use_spike': False, 'bull_rsi_required': True, 'bear_strategy': 'breakout', 'bear_bb_std_mult': 1.123999896163857, 'bear_rsi_os': 46, 'bear_rsi_ob': 48, 'bear_adx_thresh': 17.059165770843855, 'bear_atr_min_pct': 0.009036567351349934, 'bear_atr_max_pct': 0.028880702965623804, 'bear_tp_mult': 2.027482007186652, 'bear_tsl_mult': 0.833340438933359, 'bear_time_stop': 50, 'bear_use_sma': False, 'bear_use_ema': False, 'bear_use_atr': False, 'bear_use_adx': False, 'bear_use_spike': True, 'bear_rsi_required': False, 'sideways_strategy': 'breakout', 'sideways_bb_std_mult': 3.1136752584247556, 'sideways_rsi_os': 33, 'sideways_rsi_ob': 54, 'sideways_adx_thresh': 17.537779308447885, 'sideways_atr_min_pct': 0.016514222044907288, 'sideways_atr_max_pct': 0.07408826674518762, 'sideways_tp_mult': 2.8459101704357463, 'sideways_tsl_mult': 0.11317666347541296, 'sideways_time_stop': 139, 'sideways_use_sma': False, 'sideways_use_ema': False, 'sideways_use_atr': False, 'sideways_use_adx': True, 'sideways_use_spike': True, 'sideways_rsi_required': True}.
[I 2025-08-30 14:54:14,006] Trial 275 finished with values: [-1000000000.0, 1000000000.0] and parameters: {'p_sma': 17, 'p_std': 26, 'p_atr': 14, 'p_adx': 16, 'rsi_period': 29, 'ema1': 27, 'ema2': 50, 'slip_atr_k': 0.01100549920639184, 'slip_spread_k': 0.21931331179541558, 'spread_hl_frac': 0.00600740670473247, 'bb_std_mult': 2.0080053469400823, 'rsi_os': 32, 'rsi_ob': 91, 'vol_spike': 0.0798031642246342, 'adx_thresh': 21.776431288323764, 'atr_min_pct': 0.021459403974997113, 'atr_max_pct': 0.08891057122786555, 'tp_mult': 2.6332521152699004, 'tsl_mult': 0.9815479932986835, 'strategy': 'mean_reversion', 'time_stop': 38, 'use_sma': True, 'use_atr': False, 'use_adx': True, 'use_ema': False, 'use_spike': False, 'rsi_required': False, 'edge_k': 0.3658325191263203, 'edge_cap': 0.8757497265462428, 'bull_strategy': 'breakout', 'bull_bb_std_mult': 3.138493106022021, 'bull_rsi_os': 48, 'bull_rsi_ob': 83, 'bull_adx_thresh': 14.407308571609068, 'bull_atr_min_pct': 0.02807737253693377, 'bull_atr_max_pct': 0.035910868249803954, 'bull_tp_mult': 1.2939239074657136, 'bull_tsl_mult': 0.5445767612554467, 'bull_time_stop': 274, 'bull_use_sma': False, 'bull_use_ema': False, 'bull_use_atr': True, 'bull_use_adx': True, 'bull_use_spike': True, 'bull_rsi_required': True, 'bear_strategy': 'breakout', 'bear_bb_std_mult': 1.1157292634407707, 'bear_rsi_os': 54, 'bear_rsi_ob': 76, 'bear_adx_thresh': 31.368723413605586, 'bear_atr_min_pct': 0.009198371187007968, 'bear_atr_max_pct': 0.10268502206063745, 'bear_tp_mult': 2.650201504126372, 'bear_tsl_mult': 0.22706300520251518, 'bear_time_stop': 259, 'bear_use_sma': False, 'bear_use_ema': False, 'bear_use_atr': False, 'bear_use_adx': False, 'bear_use_spike': True, 'bear_rsi_required': True, 'sideways_strategy': 'breakout', 'sideways_bb_std_mult': 3.090505903821277, 'sideways_rsi_os': 27, 'sideways_rsi_ob': 94, 'sideways_adx_thresh': 15.229065393152627, 'sideways_atr_min_pct': 0.016286453866360205, 'sideways_atr_max_pct': 0.08050533233946472, 'sideways_tp_mult': 1.5216229674526718, 'sideways_tsl_mult': 0.43524477749535495, 'sideways_time_stop': 231, 'sideways_use_sma': False, 'sideways_use_ema': False, 'sideways_use_atr': False, 'sideways_use_adx': True, 'sideways_use_spike': False, 'sideways_rsi_required': True}.
[I 2025-08-30 14:54:14,944] Trial 274 finished with values: [-1000000000.0, 1000000000.0] and parameters: {'p_sma': 30, 'p_std': 27, 'p_atr': 14, 'p_adx': 20, 'rsi_period': 50, 'ema1': 27, 'ema2': 50, 'slip_atr_k': 0.010474314881004566, 'slip_spread_k': 0.2119606906159858, 'spread_hl_frac': 0.006047385957751998, 'bb_std_mult': 2.0246775878862127, 'rsi_os': 47, 'rsi_ob': 91, 'vol_spike': 0.2535792289434031, 'adx_thresh': 21.82442905791129, 'atr_min_pct': 0.021614859528979347, 'atr_max_pct': 0.10356587227245696, 'tp_mult': 2.637647387997073, 'tsl_mult': 0.9791435990343104, 'strategy': 'mean_reversion', 'time_stop': 44, 'use_sma': True, 'use_atr': False, 'use_adx': True, 'use_ema': False, 'use_spike': False, 'rsi_required': False, 'edge_k': 1.665695481408362, 'edge_cap': 0.6497875301161247, 'bull_strategy': 'breakout', 'bull_bb_std_mult': 1.404138756129632, 'bull_rsi_os': 16, 'bull_rsi_ob': 82, 'bull_adx_thresh': 14.415134432782828, 'bull_atr_min_pct': 0.007119198172238135, 'bull_atr_max_pct': 0.026562200811119974, 'bull_tp_mult': 1.4606867969300021, 'bull_tsl_mult': 0.8603092258459931, 'bull_time_stop': 272, 'bull_use_sma': True, 'bull_use_ema': True, 'bull_use_atr': True, 'bull_use_adx': False, 'bull_use_spike': False, 'bull_rsi_required': True, 'bear_strategy': 'breakout', 'bear_bb_std_mult': 1.1129482178803978, 'bear_rsi_os': 15, 'bear_rsi_ob': 76, 'bear_adx_thresh': 17.072223098594343, 'bear_atr_min_pct': 0.013598669463429143, 'bear_atr_max_pct': 0.1019594523125181, 'bear_tp_mult': 2.033594262822788, 'bear_tsl_mult': 0.21957486731891548, 'bear_time_stop': 54, 'bear_use_sma': False, 'bear_use_ema': False, 'bear_use_atr': False, 'bear_use_adx': False, 'bear_use_spike': True, 'bear_rsi_required': False, 'sideways_strategy': 'breakout', 'sideways_bb_std_mult': 3.1046150309865035, 'sideways_rsi_os': 33, 'sideways_rsi_ob': 94, 'sideways_adx_thresh': 7.650014700500803, 'sideways_atr_min_pct': 0.010244286332112221, 'sideways_atr_max_pct': 0.07998729122711275, 'sideways_tp_mult': 2.833071700224808, 'sideways_tsl_mult': 0.9273707529418042, 'sideways_time_stop': 226, 'sideways_use_sma': False, 'sideways_use_ema': False, 'sideways_use_atr': False, 'sideways_use_adx': True, 'sideways_use_spike': False, 'sideways_rsi_required': True}.
[I 2025-08-30 14:54:15,147] Trial 276 finished with values: [-1000000000.0, 1000000000.0] and parameters: {'p_sma': 30, 'p_std': 19, 'p_atr': 22, 'p_adx': 30, 'rsi_period': 50, 'ema1': 27, 'ema2': 48, 'slip_atr_k': 0.011916012187663546, 'slip_spread_k': 0.21435717286700318, 'spread_hl_frac': 0.022753900574488964, 'bb_std_mult': 1.9998424639316563, 'rsi_os': 32, 'rsi_ob': 91, 'vol_spike': 0.2620574299360666, 'adx_thresh': 21.585244602342016, 'atr_min_pct': 0.021594448793760847, 'atr_max_pct': 0.028981364930231242, 'tp_mult': 2.633259098139477, 'tsl_mult': 0.9839573620779787, 'strategy': 'breakout', 'time_stop': 37, 'use_sma': True, 'use_atr': False, 'use_adx': True, 'use_ema': False, 'use_spike': False, 'rsi_required': True, 'edge_k': 1.6084598811789876, 'edge_cap': 0.5529220758544475, 'bull_strategy': 'breakout', 'bull_bb_std_mult': 0.8037622565793072, 'bull_rsi_os': 40, 'bull_rsi_ob': 80, 'bull_adx_thresh': 23.302369905249236, 'bull_atr_min_pct': 0.017082251326584558, 'bull_atr_max_pct': 0.10657480929277371, 'bull_tp_mult': 1.4581445269606064, 'bull_tsl_mult': 0.8567728624991244, 'bull_time_stop': 295, 'bull_use_sma': False, 'bull_use_ema': False, 'bull_use_atr': True, 'bull_use_adx': True, 'bull_use_spike': True, 'bull_rsi_required': False, 'bear_strategy': 'breakout', 'bear_bb_std_mult': 1.240020352915938, 'bear_rsi_os': 13, 'bear_rsi_ob': 49, 'bear_adx_thresh': 18.849246836457098, 'bear_atr_min_pct': 0.013712153754254297, 'bear_atr_max_pct': 0.1019191198167764, 'bear_tp_mult': 2.633522743073815, 'bear_tsl_mult': 0.8730277558996838, 'bear_time_stop': 74, 'bear_use_sma': False, 'bear_use_ema': False, 'bear_use_atr': True, 'bear_use_adx': False, 'bear_use_spike': True, 'bear_rsi_required': True, 'sideways_strategy': 'breakout', 'sideways_bb_std_mult': 3.2456374555333034, 'sideways_rsi_os': 28, 'sideways_rsi_ob': 66, 'sideways_adx_thresh': 15.10297789389191, 'sideways_atr_min_pct': 0.004543967489541467, 'sideways_atr_max_pct': 0.04762296000669485, 'sideways_tp_mult': 2.7093098337868367, 'sideways_tsl_mult': 0.1022140048901991, 'sideways_time_stop': 89, 'sideways_use_sma': False, 'sideways_use_ema': False, 'sideways_use_atr': False, 'sideways_use_adx': True, 'sideways_use_spike': False, 'sideways_rsi_required': True}.
[I 2025-08-30 14:54:15,319] Trial 273 finished with values: [-1000000000.0, 1000000000.0] and parameters: {'p_sma': 32, 'p_std': 19, 'p_atr': 14, 'p_adx': 13, 'rsi_period': 50, 'ema1': 27, 'ema2': 48, 'slip_atr_k': 0.051237422104721236, 'slip_spread_k': 0.21544675102739574, 'spread_hl_frac': 0.042335590005609616, 'bb_std_mult': 2.0020019856272153, 'rsi_os': 46, 'rsi_ob': 65, 'vol_spike': 0.25327086566376594, 'adx_thresh': 20.424568639463967, 'atr_min_pct': 0.0028856024496442777, 'atr_max_pct': 0.140871494173691, 'tp_mult': 2.6387952393010163, 'tsl_mult': 0.944771733283431, 'strategy': 'mean_reversion', 'time_stop': 38, 'use_sma': True, 'use_atr': False, 'use_adx': True, 'use_ema': False, 'use_spike': False, 'rsi_required': False, 'edge_k': 1.0773997857442044, 'edge_cap': 0.20011483713679373, 'bull_strategy': 'breakout', 'bull_bb_std_mult': 0.8702424645010745, 'bull_rsi_os': 16, 'bull_rsi_ob': 82, 'bull_adx_thresh': 23.381141641368195, 'bull_atr_min_pct': 0.0031368278760631656, 'bull_atr_max_pct': 0.03598007068951104, 'bull_tp_mult': 1.3512120310859224, 'bull_tsl_mult': 0.5400078280964279, 'bull_time_stop': 61, 'bull_use_sma': False, 'bull_use_ema': False, 'bull_use_atr': True, 'bull_use_adx': True, 'bull_use_spike': False, 'bull_rsi_required': True, 'bear_strategy': 'breakout', 'bear_bb_std_mult': 1.2412966131916974, 'bear_rsi_os': 15, 'bear_rsi_ob': 48, 'bear_adx_thresh': 17.302921483556638, 'bear_atr_min_pct': 0.013332610763968428, 'bear_atr_max_pct': 0.0907056425309021, 'bear_tp_mult': 2.030781751579573, 'bear_tsl_mult': 0.13023666190852495, 'bear_time_stop': 200, 'bear_use_sma': False, 'bear_use_ema': False, 'bear_use_atr': False, 'bear_use_adx': False, 'bear_use_spike': True, 'bear_rsi_required': False, 'sideways_strategy': 'breakout', 'sideways_bb_std_mult': 1.9927864459514524, 'sideways_rsi_os': 34, 'sideways_rsi_ob': 80, 'sideways_adx_thresh': 30.79933006783273, 'sideways_atr_min_pct': 0.01189692992189449, 'sideways_atr_max_pct': 0.0792707663654291, 'sideways_tp_mult': 2.855469747744066, 'sideways_tsl_mult': 0.771111428031342, 'sideways_time_stop': 220, 'sideways_use_sma': False, 'sideways_use_ema': False, 'sideways_use_atr': False, 'sideways_use_adx': True, 'sideways_use_spike': True, 'sideways_rsi_required': True}.
[I 2025-08-30 14:54:47,626] Trial 279 finished with values: [-1000000000.0, 1000000000.0] and parameters: {'p_sma': 39, 'p_std': 23, 'p_atr': 23, 'p_adx': 13, 'rsi_period': 48, 'ema1': 11, 'ema2': 51, 'slip_atr_k': 0.03683136362434146, 'slip_spread_k': 0.2824426786362191, 'spread_hl_frac': 0.04226187586995685, 'bb_std_mult': 2.0635091799629492, 'rsi_os': 6, 'rsi_ob': 52, 'vol_spike': 0.047735378171510204, 'adx_thresh': 20.219116070111053, 'atr_min_pct': 0.019751372054430567, 'atr_max_pct': 0.14793293123856924, 'tp_mult': 2.539173671874984, 'tsl_mult': 0.645929105129718, 'strategy': 'mean_reversion', 'time_stop': 24, 'use_sma': True, 'use_atr': True, 'use_adx': False, 'use_ema': True, 'use_spike': False, 'rsi_required': False, 'edge_k': 1.4726014961229426, 'edge_cap': 0.18039222836049246, 'bull_strategy': 'mean_reversion', 'bull_bb_std_mult': 3.442999678738176, 'bull_rsi_os': 17, 'bull_rsi_ob': 77, 'bull_adx_thresh': 29.009440570440862, 'bull_atr_min_pct': 0.0033120821010619536, 'bull_atr_max_pct': 0.04895198365462969, 'bull_tp_mult': 2.622050633437761, 'bull_tsl_mult': 0.1303265176561738, 'bull_time_stop': 117, 'bull_use_sma': False, 'bull_use_ema': False, 'bull_use_atr': True, 'bull_use_adx': True, 'bull_use_spike': False, 'bull_rsi_required': False, 'bear_strategy': 'breakout', 'bear_bb_std_mult': 1.2429715817543796, 'bear_rsi_os': 16, 'bear_rsi_ob': 58, 'bear_adx_thresh': 16.366642880552273, 'bear_atr_min_pct': 0.012940017105318493, 'bear_atr_max_pct': 0.049408153895372196, 'bear_tp_mult': 2.102329746462874, 'bear_tsl_mult': 0.24753651841207916, 'bear_time_stop': 40, 'bear_use_sma': True, 'bear_use_ema': False, 'bear_use_atr': False, 'bear_use_adx': True, 'bear_use_spike': True, 'bear_rsi_required': False, 'sideways_strategy': 'mean_reversion', 'sideways_bb_std_mult': 1.3764516947580456, 'sideways_rsi_os': 19, 'sideways_rsi_ob': 89, 'sideways_adx_thresh': 16.20079845841913, 'sideways_atr_min_pct': 0.01814150445759218, 'sideways_atr_max_pct': 0.05107979906440717, 'sideways_tp_mult': 1.1886049817592141, 'sideways_tsl_mult': 0.3534621730718529, 'sideways_time_stop': 211, 'sideways_use_sma': False, 'sideways_use_ema': False, 'sideways_use_atr': True, 'sideways_use_adx': False, 'sideways_use_spike': True, 'sideways_rsi_required': False}.
[I 2025-08-30 14:54:47,887] Trial 277 finished with values: [-1000000000.0, 1000000000.0] and parameters: {'p_sma': 30, 'p_std': 19, 'p_atr': 23, 'p_adx': 13, 'rsi_period': 50, 'ema1': 28, 'ema2': 51, 'slip_atr_k': 0.17731408260285514, 'slip_spread_k': 0.2809818142687845, 'spread_hl_frac': 0.0014916895476162887, 'bb_std_mult': 3.3665911802111372, 'rsi_os': 13, 'rsi_ob': 65, 'vol_spike': 0.2522836503285024, 'adx_thresh': 21.251764010027347, 'atr_min_pct': 0.010353899101540371, 'atr_max_pct': 0.10256590131345691, 'tp_mult': 2.5894892239219547, 'tsl_mult': 0.9997433730116584, 'strategy': 'breakout', 'time_stop': 24, 'use_sma': True, 'use_atr': False, 'use_adx': False, 'use_ema': False, 'use_spike': False, 'rsi_required': True, 'edge_k': 1.3102578969607315, 'edge_cap': 0.6830480202449594, 'bull_strategy': 'mean_reversion', 'bull_bb_std_mult': 0.7835052508667517, 'bull_rsi_os': 32, 'bull_rsi_ob': 60, 'bull_adx_thresh': 29.123476044263228, 'bull_atr_min_pct': 0.02927122055506984, 'bull_atr_max_pct': 0.02605087743917797, 'bull_tp_mult': 1.4501706069899203, 'bull_tsl_mult': 0.5427253844814302, 'bull_time_stop': 250, 'bull_use_sma': False, 'bull_use_ema': False, 'bull_use_atr': True, 'bull_use_adx': True, 'bull_use_spike': False, 'bull_rsi_required': False, 'bear_strategy': 'breakout', 'bear_bb_std_mult': 1.258078378604465, 'bear_rsi_os': 13, 'bear_rsi_ob': 49, 'bear_adx_thresh': 32.238261615821784, 'bear_atr_min_pct': 0.007850768180879618, 'bear_atr_max_pct': 0.023785696318457693, 'bear_tp_mult': 2.090711055749924, 'bear_tsl_mult': 0.05234300019577259, 'bear_time_stop': 202, 'bear_use_sma': False, 'bear_use_ema': False, 'bear_use_atr': True, 'bear_use_adx': False, 'bear_use_spike': True, 'bear_rsi_required': False, 'sideways_strategy': 'breakout', 'sideways_bb_std_mult': 3.27735667790996, 'sideways_rsi_os': 19, 'sideways_rsi_ob': 89, 'sideways_adx_thresh': 15.305655347982723, 'sideways_atr_min_pct': 0.0020619859004340907, 'sideways_atr_max_pct': 0.047355721997783935, 'sideways_tp_mult': 2.7200456917133846, 'sideways_tsl_mult': 0.647719197220198, 'sideways_time_stop': 155, 'sideways_use_sma': False, 'sideways_use_ema': False, 'sideways_use_atr': True, 'sideways_use_adx': False, 'sideways_use_spike': True, 'sideways_rsi_required': True}.
