[I 2025-08-30 15:03:44,568] Trial 343 finished with values: [-0.025100707346396134, 0.025101269555287714] and parameters: {'p_sma': 6, 'p_std': 55, 'p_atr': 17, 'p_adx': 23, 'rsi_period': 72, 'ema1': 30, 'ema2': 18, 'slip_atr_k': 0.05101430994254018, 'slip_spread_k': 0.6988458387203393, 'spread_hl_frac': 0.02775379212188596, 'bb_std_mult': 3.3442337269480165, 'rsi_os': 24, 'rsi_ob': 77, 'vol_spike': 0.2938850423871607, 'adx_thresh': 29.41379635517999, 'atr_min_pct': 0.014139625698920659, 'atr_max_pct': 0.07542182716073814, 'tp_mult': 1.5057015400497546, 'tsl_mult': 0.04615398729331973, 'strategy': 'breakout', 'time_stop': 109, 'use_sma': False, 'use_atr': False, 'use_adx': True, 'use_ema': False, 'use_spike': True, 'rsi_required': True, 'edge_k': 0.9788143657671563, 'edge_cap': 0.5475155040732722, 'bull_strategy': 'mean_reversion', 'bull_bb_std_mult': 2.6554578123540895, 'bull_rsi_os': 32, 'bull_rsi_ob': 89, 'bull_adx_thresh': 24.600225595754914, 'bull_atr_min_pct': 0.007324951425953989, 'bull_atr_max_pct': 0.07553767629871257, 'bull_tp_mult': 1.9053961718722854, 'bull_tsl_mult': 0.5997661862089992, 'bull_time_stop': 120, 'bull_use_sma': False, 'bull_use_ema': True, 'bull_use_atr': False, 'bull_use_adx': False, 'bull_use_spike': False, 'bull_rsi_required': True, 'bear_strategy': 'mean_reversion', 'bear_bb_std_mult': 0.7825162059971337, 'bear_rsi_os': 6, 'bear_rsi_ob': 79, 'bear_adx_thresh': 28.98363504891321, 'bear_atr_min_pct': 0.01612218507816916, 'bear_atr_max_pct': 0.01093142576086887, 'bear_tp_mult': 1.3928956584021182, 'bear_tsl_mult': 0.09275216523251342, 'bear_time_stop': 79, 'bear_use_sma': True, 'bear_use_ema': True, 'bear_use_atr': True, 'bear_use_adx': True, 'bear_use_spike': False, 'bear_rsi_required': False, 'sideways_strategy': 'breakout', 'sideways_bb_std_mult': 3.5211403509405828, 'sideways_rsi_os': 43, 'sideways_rsi_ob': 55, 'sideways_adx_thresh': 25.543508845408745, 'sideways_atr_min_pct': 0.00022481696314721712, 'sideways_atr_max_pct': 0.09511510419469196, 'sideways_tp_mult': 2.326804745419231, 'sideways_tsl_mult': 0.487599074027101, 'sideways_time_stop': 13, 'sideways_use_sma': False, 'sideways_use_ema': True, 'sideways_use_atr': True, 'sideways_use_adx': False, 'sideways_use_spike': False, 'sideways_rsi_required': False}.
[I 2025-08-30 15:03:45,571] Trial 342 finished with values: [-0.043571090180990035, 0.04353733461570495] and parameters: {'p_sma': 8, 'p_std': 55, 'p_atr': 17, 'p_adx': 12, 'rsi_period': 72, 'ema1': 30, 'ema2': 17, 'slip_atr_k': 0.0466892929153037, 'slip_spread_k': 0.6562798596701275, 'spread_hl_frac': 0.027272647550872123, 'bb_std_mult': 3.3745393096222815, 'rsi_os': 24, 'rsi_ob': 76, 'vol_spike': 0.2938048372998969, 'adx_thresh': 28.414243214227035, 'atr_min_pct': 0.013071344402344467, 'atr_max_pct': 0.07382746802243066, 'tp_mult': 1.4669469783786007, 'tsl_mult': 0.08278659657591343, 'strategy': 'breakout', 'time_stop': 108, 'use_sma': False, 'use_atr': False, 'use_adx': True, 'use_ema': False, 'use_spike': True, 'rsi_required': True, 'edge_k': 0.8602337453158214, 'edge_cap': 0.5688737635312101, 'bull_strategy': 'mean_reversion', 'bull_bb_std_mult': 2.6279163120315094, 'bull_rsi_os': 32, 'bull_rsi_ob': 89, 'bull_adx_thresh': 25.438518834179547, 'bull_atr_min_pct': 0.00739029801057193, 'bull_atr_max_pct': 0.07572294683875214, 'bull_tp_mult': 1.9184341368571478, 'bull_tsl_mult': 0.6097568796200713, 'bull_time_stop': 122, 'bull_use_sma': True, 'bull_use_ema': True, 'bull_use_atr': False, 'bull_use_adx': False, 'bull_use_spike': False, 'bull_rsi_required': True, 'bear_strategy': 'mean_reversion', 'bear_bb_std_mult': 0.8121599247058472, 'bear_rsi_os': 6, 'bear_rsi_ob': 74, 'bear_adx_thresh': 29.053442033932825, 'bear_atr_min_pct': 0.016705277365452516, 'bear_atr_max_pct': 0.010916187490380105, 'bear_tp_mult': 1.402431583007673, 'bear_tsl_mult': 0.0970696470745081, 'bear_time_stop': 85, 'bear_use_sma': True, 'bear_use_ema': True, 'bear_use_atr': True, 'bear_use_adx': True, 'bear_use_spike': False, 'bear_rsi_required': False, 'sideways_strategy': 'breakout', 'sideways_bb_std_mult': 3.519919658523602, 'sideways_rsi_os': 42, 'sideways_rsi_ob': 55, 'sideways_adx_thresh': 25.847004958368977, 'sideways_atr_min_pct': 3.257689286140914e-05, 'sideways_atr_max_pct': 0.0991294730703915, 'sideways_tp_mult': 2.3796421302169475, 'sideways_tsl_mult': 0.5236289681604971, 'sideways_time_stop': 12, 'sideways_use_sma': False, 'sideways_use_ema': True, 'sideways_use_atr': True, 'sideways_use_adx': False, 'sideways_use_spike': False, 'sideways_rsi_required': False}.
[I 2025-08-30 15:03:45,788] Trial 344 finished with values: [-0.01702672369720548, 0.016947938684155343] and parameters: {'p_sma': 7, 'p_std': 55, 'p_atr': 17, 'p_adx': 15, 'rsi_period': 82, 'ema1': 30, 'ema2': 18, 'slip_atr_k': 0.05262405739841801, 'slip_spread_k': 0.6987550080605904, 'spread_hl_frac': 0.011086545822201475, 'bb_std_mult': 3.333908871857612, 'rsi_os': 25, 'rsi_ob': 76, 'vol_spike': 0.2935139169742659, 'adx_thresh': 28.614895349267645, 'atr_min_pct': 0.014274309044675845, 'atr_max_pct': 0.07525218864904441, 'tp_mult': 1.4755009021679053, 'tsl_mult': 0.08404365110133648, 'strategy': 'breakout', 'time_stop': 109, 'use_sma': False, 'use_atr': False, 'use_adx': False, 'use_ema': False, 'use_spike': True, 'rsi_required': True, 'edge_k': 0.9350434436702899, 'edge_cap': 0.49667492294809557, 'bull_strategy': 'mean_reversion', 'bull_bb_std_mult': 2.6543929657605845, 'bull_rsi_os': 33, 'bull_rsi_ob': 90, 'bull_adx_thresh': 24.35471854543801, 'bull_atr_min_pct': 0.007201124295545151, 'bull_atr_max_pct': 0.0631816795032075, 'bull_tp_mult': 1.8941960362743453, 'bull_tsl_mult': 0.59919069978312, 'bull_time_stop': 119, 'bull_use_sma': False, 'bull_use_ema': False, 'bull_use_atr': False, 'bull_use_adx': False, 'bull_use_spike': False, 'bull_rsi_required': True, 'bear_strategy': 'mean_reversion', 'bear_bb_std_mult': 0.8300848598326497, 'bear_rsi_os': 6, 'bear_rsi_ob': 76, 'bear_adx_thresh': 28.67771890625192, 'bear_atr_min_pct': 0.015865678446335345, 'bear_atr_max_pct': 0.010716379216970565, 'bear_tp_mult': 1.3981744068241098, 'bear_tsl_mult': 0.09096723368739323, 'bear_time_stop': 86, 'bear_use_sma': True, 'bear_use_ema': True, 'bear_use_atr': True, 'bear_use_adx': False, 'bear_use_spike': False, 'bear_rsi_required': False, 'sideways_strategy': 'breakout', 'sideways_bb_std_mult': 3.5396476452947105, 'sideways_rsi_os': 41, 'sideways_rsi_ob': 55, 'sideways_adx_thresh': 25.49922864092593, 'sideways_atr_min_pct': 0.0005192613487424009, 'sideways_atr_max_pct': 0.09526744867160188, 'sideways_tp_mult': 2.4058235897802183, 'sideways_tsl_mult': 0.4857877142644474, 'sideways_time_stop': 12, 'sideways_use_sma': False, 'sideways_use_ema': True, 'sideways_use_atr': True, 'sideways_use_adx': False, 'sideways_use_spike': True, 'sideways_rsi_required': False}.
[I 2025-08-30 15:03:45,899] Trial 345 finished with values: [-0.012256781105498327, 0.012158748666259685] and parameters: {'p_sma': 6, 'p_std': 57, 'p_atr': 17, 'p_adx': 23, 'rsi_period': 73, 'ema1': 30, 'ema2': 18, 'slip_atr_k': 0.05093566495500374, 'slip_spread_k': 0.6586548107749753, 'spread_hl_frac': 0.00336081228510897, 'bb_std_mult': 3.335130881904694, 'rsi_os': 24, 'rsi_ob': 76, 'vol_spike': 0.2935074848032647, 'adx_thresh': 28.556955429519743, 'atr_min_pct': 0.01384725150346676, 'atr_max_pct': 0.07656716698087211, 'tp_mult': 1.4596149730328019, 'tsl_mult': 0.08337502086232751, 'strategy': 'breakout', 'time_stop': 108, 'use_sma': False, 'use_atr': True, 'use_adx': False, 'use_ema': False, 'use_spike': True, 'rsi_required': True, 'edge_k': 0.946050274414076, 'edge_cap': 0.547940162000695, 'bull_strategy': 'mean_reversion', 'bull_bb_std_mult': 2.6434617382847962, 'bull_rsi_os': 33, 'bull_rsi_ob': 89, 'bull_adx_thresh': 24.53565512767969, 'bull_atr_min_pct': 0.00798910106881566, 'bull_atr_max_pct': 0.06174218728548167, 'bull_tp_mult': 1.8958705052439597, 'bull_tsl_mult': 0.601268343836132, 'bull_time_stop': 122, 'bull_use_sma': False, 'bull_use_ema': False, 'bull_use_atr': False, 'bull_use_adx': False, 'bull_use_spike': False, 'bull_rsi_required': True, 'bear_strategy': 'mean_reversion', 'bear_bb_std_mult': 0.7992287026920797, 'bear_rsi_os': 7, 'bear_rsi_ob': 76, 'bear_adx_thresh': 29.147587807879347, 'bear_atr_min_pct': 0.016139997319843363, 'bear_atr_max_pct': 0.010154616145234554, 'bear_tp_mult': 1.4188727409012576, 'bear_tsl_mult': 0.09423227011456557, 'bear_time_stop': 85, 'bear_use_sma': True, 'bear_use_ema': True, 'bear_use_atr': True, 'bear_use_adx': False, 'bear_use_spike': False, 'bear_rsi_required': False, 'sideways_strategy': 'breakout', 'sideways_bb_std_mult': 3.5230178604058042, 'sideways_rsi_os': 41, 'sideways_rsi_ob': 55, 'sideways_adx_thresh': 25.737393032649077, 'sideways_atr_min_pct': 0.000704618212146047, 'sideways_atr_max_pct': 0.09549569945072231, 'sideways_tp_mult': 2.3153000387955056, 'sideways_tsl_mult': 0.47877173147206753, 'sideways_time_stop': 13, 'sideways_use_sma': False, 'sideways_use_ema': True, 'sideways_use_atr': True, 'sideways_use_adx': False, 'sideways_use_spike': True, 'sideways_rsi_required': False}.
[I 2025-08-30 15:04:20,916] Trial 346 finished with values: [-0.010523240095505537, 0.010483141049401368] and parameters: {'p_sma': 7, 'p_std': 55, 'p_atr': 17, 'p_adx': 30, 'rsi_period': 74, 'ema1': 30, 'ema2': 17, 'slip_atr_k': 0.05157270284759548, 'slip_spread_k': 0.661635176454041, 'spread_hl_frac': 0.01131190093667575, 'bb_std_mult': 3.38799779045479, 'rsi_os': 22, 'rsi_ob': 72, 'vol_spike': 0.29315583405022916, 'adx_thresh': 28.79544251845721, 'atr_min_pct': 0.013884421887163234, 'atr_max_pct': 0.0721760764265984, 'tp_mult': 1.68577501196051, 'tsl_mult': 0.0911358477573162, 'strategy': 'breakout', 'time_stop': 108, 'use_sma': False, 'use_atr': True, 'use_adx': False, 'use_ema': False, 'use_spike': True, 'rsi_required': True, 'edge_k': 1.049887953558864, 'edge_cap': 0.5231359326755799, 'bull_strategy': 'mean_reversion', 'bull_bb_std_mult': 2.7278971789377278, 'bull_rsi_os': 33, 'bull_rsi_ob': 89, 'bull_adx_thresh': 24.505926481404266, 'bull_atr_min_pct': 0.007930042968427432, 'bull_atr_max_pct': 0.06828981943811491, 'bull_tp_mult': 1.9792942875440067, 'bull_tsl_mult': 0.5950341461966967, 'bull_time_stop': 116, 'bull_use_sma': False, 'bull_use_ema': False, 'bull_use_atr': False, 'bull_use_adx': False, 'bull_use_spike': False, 'bull_rsi_required': True, 'bear_strategy': 'mean_reversion', 'bear_bb_std_mult': 0.767327719922734, 'bear_rsi_os': 8, 'bear_rsi_ob': 74, 'bear_adx_thresh': 28.724973816891456, 'bear_atr_min_pct': 0.016396219217118483, 'bear_atr_max_pct': 0.014082259184345011, 'bear_tp_mult': 1.4937492010226598, 'bear_tsl_mult': 0.07134700076930141, 'bear_time_stop': 84, 'bear_use_sma': True, 'bear_use_ema': True, 'bear_use_atr': True, 'bear_use_adx': False, 'bear_use_spike': False, 'bear_rsi_required': False, 'sideways_strategy': 'breakout', 'sideways_bb_std_mult': 3.5094400371886763, 'sideways_rsi_os': 41, 'sideways_rsi_ob': 59, 'sideways_adx_thresh': 25.897590550601862, 'sideways_atr_min_pct': 0.0007459781249484814, 'sideways_atr_max_pct': 0.09856715205486187, 'sideways_tp_mult': 2.3152829707997546, 'sideways_tsl_mult': 0.48661958316213527, 'sideways_time_stop': 13, 'sideways_use_sma': False, 'sideways_use_ema': True, 'sideways_use_atr': True, 'sideways_use_adx': False, 'sideways_use_spike': True, 'sideways_rsi_required': False}.
[I 2025-08-30 15:04:21,387] Trial 349 finished with values: [-1000000000.0, 1000000000.0] and parameters: {'p_sma': 7, 'p_std': 55, 'p_atr': 17, 'p_adx': 24, 'rsi_period': 78, 'ema1': 30, 'ema2': 17, 'slip_atr_k': 0.050542541725739985, 'slip_spread_k': 0.6549409620556297, 'spread_hl_frac': 0.003213984842273039, 'bb_std_mult': 3.422862551618206, 'rsi_os': 26, 'rsi_ob': 71, 'vol_spike': 0.29115752065444084, 'adx_thresh': 30.147590173370993, 'atr_min_pct': 0.01418067117189024, 'atr_max_pct': 0.07175578576869772, 'tp_mult': 1.7562814608538315, 'tsl_mult': 0.014782985191547339, 'strategy': 'breakout', 'time_stop': 101, 'use_sma': False, 'use_atr': True, 'use_adx': False, 'use_ema': False, 'use_spike': True, 'rsi_required': True, 'edge_k': 0.9413575473433516, 'edge_cap': 0.5115052421873607, 'bull_strategy': 'mean_reversion', 'bull_bb_std_mult': 2.705329634536975, 'bull_rsi_os': 33, 'bull_rsi_ob': 91, 'bull_adx_thresh': 24.440047087404594, 'bull_atr_min_pct': 0.007970504160892965, 'bull_atr_max_pct': 0.06343667244697747, 'bull_tp_mult': 1.8828008744182796, 'bull_tsl_mult': 0.5899236169301878, 'bull_time_stop': 114, 'bull_use_sma': False, 'bull_use_ema': False, 'bull_use_atr': False, 'bull_use_adx': False, 'bull_use_spike': True, 'bull_rsi_required': True, 'bear_strategy': 'mean_reversion', 'bear_bb_std_mult': 0.8752779780267219, 'bear_rsi_os': 7, 'bear_rsi_ob': 76, 'bear_adx_thresh': 29.543851009664657, 'bear_atr_min_pct': 0.01582666033655392, 'bear_atr_max_pct': 0.013613779074599234, 'bear_tp_mult': 1.4757901558381181, 'bear_tsl_mult': 0.08021587002428787, 'bear_time_stop': 93, 'bear_use_sma': True, 'bear_use_ema': True, 'bear_use_atr': True, 'bear_use_adx': False, 'bear_use_spike': False, 'bear_rsi_required': False, 'sideways_strategy': 'mean_reversion', 'sideways_bb_std_mult': 3.4843414380363256, 'sideways_rsi_os': 41, 'sideways_rsi_ob': 59, 'sideways_adx_thresh': 25.238272347559157, 'sideways_atr_min_pct': 0.0006676706791384102, 'sideways_atr_max_pct': 0.09363260133470534, 'sideways_tp_mult': 2.3177691848932205, 'sideways_tsl_mult': 0.48770628275450334, 'sideways_time_stop': 12, 'sideways_use_sma': True, 'sideways_use_ema': True, 'sideways_use_atr': True, 'sideways_use_adx': False, 'sideways_use_spike': True, 'sideways_rsi_required': False}.
[I 2025-08-30 15:04:21,542] Trial 347 finished with values: [-1000000000.0, 1000000000.0] and parameters: {'p_sma': 7, 'p_std': 55, 'p_atr': 17, 'p_adx': 29, 'rsi_period': 74, 'ema1': 30, 'ema2': 17, 'slip_atr_k': 0.05643397074480998, 'slip_spread_k': 0.6323937545950229, 'spread_hl_frac': 0.0028823958066362975, 'bb_std_mult': 3.4134654295126468, 'rsi_os': 22, 'rsi_ob': 71, 'vol_spike': 0.29171760374958716, 'adx_thresh': 30.16224714094365, 'atr_min_pct': 0.013822735864725986, 'atr_max_pct': 0.07098614636356447, 'tp_mult': 1.595321776519144, 'tsl_mult': 0.0003302030299254591, 'strategy': 'breakout', 'time_stop': 100, 'use_sma': False, 'use_atr': True, 'use_adx': False, 'use_ema': False, 'use_spike': True, 'rsi_required': True, 'edge_k': 0.7826511490781867, 'edge_cap': 0.5236461001692986, 'bull_strategy': 'mean_reversion', 'bull_bb_std_mult': 2.6955056126083563, 'bull_rsi_os': 33, 'bull_rsi_ob': 91, 'bull_adx_thresh': 24.872858751997786, 'bull_atr_min_pct': 0.00782755340374091, 'bull_atr_max_pct': 0.061062301529648935, 'bull_tp_mult': 1.8319012806663557, 'bull_tsl_mult': 0.5870956679780338, 'bull_time_stop': 117, 'bull_use_sma': False, 'bull_use_ema': False, 'bull_use_atr': False, 'bull_use_adx': False, 'bull_use_spike': True, 'bull_rsi_required': True, 'bear_strategy': 'mean_reversion', 'bear_bb_std_mult': 0.873445060469959, 'bear_rsi_os': 7, 'bear_rsi_ob': 78, 'bear_adx_thresh': 29.53137354342593, 'bear_atr_min_pct': 0.01596326866788325, 'bear_atr_max_pct': 0.010210246268384847, 'bear_tp_mult': 1.4290304615658884, 'bear_tsl_mult': 0.07771364746397921, 'bear_time_stop': 86, 'bear_use_sma': True, 'bear_use_ema': True, 'bear_use_atr': True, 'bear_use_adx': False, 'bear_use_spike': False, 'bear_rsi_required': False, 'sideways_strategy': 'mean_reversion', 'sideways_bb_std_mult': 3.4881738416579777, 'sideways_rsi_os': 41, 'sideways_rsi_ob': 59, 'sideways_adx_thresh': 24.971016276319162, 'sideways_atr_min_pct': 0.0007989978664737281, 'sideways_atr_max_pct': 0.0953510487366588, 'sideways_tp_mult': 2.319545401588329, 'sideways_tsl_mult': 0.4861334800153174, 'sideways_time_stop': 12, 'sideways_use_sma': True, 'sideways_use_ema': True, 'sideways_use_atr': True, 'sideways_use_adx': False, 'sideways_use_spike': True, 'sideways_rsi_required': False}.
[I 2025-08-30 15:04:21,798] Trial 348 finished with values: [-1000000000.0, 1000000000.0] and parameters: {'p_sma': 7, 'p_std': 53, 'p_atr': 17, 'p_adx': 15, 'rsi_period': 74, 'ema1': 30, 'ema2': 16, 'slip_atr_k': 0.053656435805812086, 'slip_spread_k': 0.6816246521677243, 'spread_hl_frac': 0.003063020866553771, 'bb_std_mult': 3.432702773466712, 'rsi_os': 26, 'rsi_ob': 73, 'vol_spike': 0.2894060287026441, 'adx_thresh': 30.02754070234704, 'atr_min_pct': 0.014008678340599559, 'atr_max_pct': 0.07220300066526122, 'tp_mult': 1.7390009365235053, 'tsl_mult': 0.007965654591123535, 'strategy': 'breakout', 'time_stop': 113, 'use_sma': False, 'use_atr': True, 'use_adx': False, 'use_ema': False, 'use_spike': True, 'rsi_required': True, 'edge_k': 1.0645064971754021, 'edge_cap': 0.5252830149688326, 'bull_strategy': 'mean_reversion', 'bull_bb_std_mult': 2.7167124226891386, 'bull_rsi_os': 33, 'bull_rsi_ob': 90, 'bull_adx_thresh': 24.475179800784428, 'bull_atr_min_pct': 0.007969051799303649, 'bull_atr_max_pct': 0.06427818643710825, 'bull_tp_mult': 1.8575586351388949, 'bull_tsl_mult': 0.5845123583158861, 'bull_time_stop': 118, 'bull_use_sma': False, 'bull_use_ema': False, 'bull_use_atr': False, 'bull_use_adx': False, 'bull_use_spike': True, 'bull_rsi_required': True, 'bear_strategy': 'mean_reversion', 'bear_bb_std_mult': 0.8637511215216476, 'bear_rsi_os': 7, 'bear_rsi_ob': 76, 'bear_adx_thresh': 29.642436937372104, 'bear_atr_min_pct': 0.016040187281056485, 'bear_atr_max_pct': 0.010007968757366236, 'bear_tp_mult': 1.4996654998785055, 'bear_tsl_mult': 0.08528915361325573, 'bear_time_stop': 94, 'bear_use_sma': True, 'bear_use_ema': True, 'bear_use_atr': True, 'bear_use_adx': False, 'bear_use_spike': False, 'bear_rsi_required': False, 'sideways_strategy': 'mean_reversion', 'sideways_bb_std_mult': 3.5264023529097246, 'sideways_rsi_os': 42, 'sideways_rsi_ob': 57, 'sideways_adx_thresh': 25.142022198298196, 'sideways_atr_min_pct': 0.0006845085273731093, 'sideways_atr_max_pct': 0.09623392958213074, 'sideways_tp_mult': 2.3079021680767426, 'sideways_tsl_mult': 0.4861890137631675, 'sideways_time_stop': 11, 'sideways_use_sma': True, 'sideways_use_ema': True, 'sideways_use_atr': True, 'sideways_use_adx': False, 'sideways_use_spike': True, 'sideways_rsi_required': False}.
[I 2025-08-30 15:04:56,042] Trial 350 finished with values: [-1000000000.0, 1000000000.0] and parameters: {'p_sma': 6, 'p_std': 55, 'p_atr': 17, 'p_adx': 15, 'rsi_period': 82, 'ema1': 30, 'ema2': 16, 'slip_atr_k': 0.052368820258833756, 'slip_spread_k': 0.6537004521483906, 'spread_hl_frac': 0.0034040424707668607, 'bb_std_mult': 3.3285284727719286, 'rsi_os': 26, 'rsi_ob': 76, 'vol_spike': 0.2919516604259949, 'adx_thresh': 30.078374592480692, 'atr_min_pct': 0.014444748364178188, 'atr_max_pct': 0.07300401269692414, 'tp_mult': 1.5873171018785577, 'tsl_mult': 0.01982508621918766, 'strategy': 'breakout', 'time_stop': 104, 'use_sma': False, 'use_atr': True, 'use_adx': False, 'use_ema': False, 'use_spike': True, 'rsi_required': True, 'edge_k': 0.944680263825293, 'edge_cap': 0.5374654497780431, 'bull_strategy': 'mean_reversion', 'bull_bb_std_mult': 2.7373822379826613, 'bull_rsi_os': 33, 'bull_rsi_ob': 91, 'bull_adx_thresh': 24.529994281218947, 'bull_atr_min_pct': 0.00797040430061456, 'bull_atr_max_pct': 0.06900069304124869, 'bull_tp_mult': 1.8707612142011185, 'bull_tsl_mult': 0.5924923450787455, 'bull_time_stop': 116, 'bull_use_sma': False, 'bull_use_ema': False, 'bull_use_atr': False, 'bull_use_adx': False, 'bull_use_spike': False, 'bull_rsi_required': True, 'bear_strategy': 'mean_reversion', 'bear_bb_std_mult': 0.8631942877979257, 'bear_rsi_os': 6, 'bear_rsi_ob': 74, 'bear_adx_thresh': 29.174595707431955, 'bear_atr_min_pct': 0.01602932736389243, 'bear_atr_max_pct': 0.013957826117873814, 'bear_tp_mult': 1.474289128930427, 'bear_tsl_mult': 0.07965871501743474, 'bear_time_stop': 89, 'bear_use_sma': True, 'bear_use_ema': True, 'bear_use_atr': True, 'bear_use_adx': False, 'bear_use_spike': False, 'bear_rsi_required': False, 'sideways_strategy': 'mean_reversion', 'sideways_bb_std_mult': 3.521461931556191, 'sideways_rsi_os': 41, 'sideways_rsi_ob': 59, 'sideways_adx_thresh': 24.549566731268122, 'sideways_atr_min_pct': 0.0006489407457903924, 'sideways_atr_max_pct': 0.0946385476345998, 'sideways_tp_mult': 2.4191680359945495, 'sideways_tsl_mult': 0.5002616166437249, 'sideways_time_stop': 13, 'sideways_use_sma': False, 'sideways_use_ema': True, 'sideways_use_atr': True, 'sideways_use_adx': False, 'sideways_use_spike': True, 'sideways_rsi_required': False}.
