[I 2025-08-30 15:15:04,021] Trial 403 finished with values: [-0.02721489256691112, 0.02714371928869113] and parameters: {'p_sma': 5, 'p_std': 59, 'p_atr': 15, 'p_adx': 26, 'rsi_period': 73, 'ema1': 20, 'ema2': 33, 'slip_atr_k': 0.0927860767670888, 'slip_spread_k': 0.013743529540609423, 'spread_hl_frac': 0.022803896485238423, 'bb_std_mult': 1.4663116086552157, 'rsi_os': 27, 'rsi_ob': 70, 'vol_spike': 0.1603613449093483, 'adx_thresh': 15.239151831909084, 'atr_min_pct': 0.012714883935321194, 'atr_max_pct': 0.08392131892323441, 'tp_mult': 1.9658698715053895, 'tsl_mult': 0.7753536248373258, 'strategy': 'breakout', 'time_stop': 132, 'use_sma': False, 'use_atr': True, 'use_adx': True, 'use_ema': True, 'use_spike': True, 'rsi_required': True, 'edge_k': 0.44829567270678417, 'edge_cap': 0.5178910139370031, 'bull_strategy': 'mean_reversion', 'bull_bb_std_mult': 2.5684991831438033, 'bull_rsi_os': 38, 'bull_rsi_ob': 54, 'bull_adx_thresh': 19.309185600104687, 'bull_atr_min_pct': 0.024097352553276476, 'bull_atr_max_pct': 0.0609776290477127, 'bull_tp_mult': 2.102341904439365, 'bull_tsl_mult': 0.26988840123559854, 'bull_time_stop': 230, 'bull_use_sma': True, 'bull_use_ema': False, 'bull_use_atr': False, 'bull_use_adx': False, 'bull_use_spike': True, 'bull_rsi_required': False, 'bear_strategy': 'mean_reversion', 'bear_bb_std_mult': 0.6029503130499546, 'bear_rsi_os': 35, 'bear_rsi_ob': 73, 'bear_adx_thresh': 9.302346537714996, 'bear_atr_min_pct': 0.022221159285863944, 'bear_atr_max_pct': 0.09525412214733892, 'bear_tp_mult': 1.5633733198753617, 'bear_tsl_mult': 0.9864217640698438, 'bear_time_stop': 12, 'bear_use_sma': True, 'bear_use_ema': True, 'bear_use_atr': True, 'bear_use_adx': False, 'bear_use_spike': False, 'bear_rsi_required': True, 'sideways_strategy': 'breakout', 'sideways_bb_std_mult': 0.9209500201537735, 'sideways_rsi_os': 50, 'sideways_rsi_ob': 58, 'sideways_adx_thresh': 28.319900683744635, 'sideways_atr_min_pct': 2.2652289087844442e-05, 'sideways_atr_max_pct': 0.10586106473346918, 'sideways_tp_mult': 1.0489380036223594, 'sideways_tsl_mult': 0.9295867298559963, 'sideways_time_stop': 80, 'sideways_use_sma': True, 'sideways_use_ema': True, 'sideways_use_atr': True, 'sideways_use_adx': False, 'sideways_use_spike': True, 'sideways_rsi_required': False}.
[I 2025-08-30 15:15:52,555] Trial 408 finished with values: [-1000000000.0, 1000000000.0] and parameters: {'p_sma': 6, 'p_std': 58, 'p_atr': 15, 'p_adx': 25, 'rsi_period': 76, 'ema1': 19, 'ema2': 43, 'slip_atr_k': 0.12008303900678549, 'slip_spread_k': 0.15249742786951215, 'spread_hl_frac': 0.028143495820946423, 'bb_std_mult': 0.5108351479362299, 'rsi_os': 45, 'rsi_ob': 70, 'vol_spike': 0.14822500467698838, 'adx_thresh': 12.695497627954355, 'atr_min_pct': 0.011784727361074913, 'atr_max_pct': 0.0827233966103329, 'tp_mult': 1.9730042022169334, 'tsl_mult': 0.5906440813407225, 'strategy': 'breakout', 'time_stop': 140, 'use_sma': False, 'use_atr': True, 'use_adx': False, 'use_ema': True, 'use_spike': True, 'rsi_required': True, 'edge_k': 0.08141688066697961, 'edge_cap': 0.5488442635916233, 'bull_strategy': 'mean_reversion', 'bull_bb_std_mult': 2.556739742187188, 'bull_rsi_os': 38, 'bull_rsi_ob': 51, 'bull_adx_thresh': 18.85352757033992, 'bull_atr_min_pct': 0.02015448365065369, 'bull_atr_max_pct': 0.06500852855838785, 'bull_tp_mult': 2.23237235126902, 'bull_tsl_mult': 0.2328832619648722, 'bull_time_stop': 176, 'bull_use_sma': False, 'bull_use_ema': False, 'bull_use_atr': False, 'bull_use_adx': False, 'bull_use_spike': True, 'bull_rsi_required': False, 'bear_strategy': 'mean_reversion', 'bear_bb_std_mult': 0.7017346498568944, 'bear_rsi_os': 26, 'bear_rsi_ob': 75, 'bear_adx_thresh': 27.87739129549345, 'bear_atr_min_pct': 0.027852990654377848, 'bear_atr_max_pct': 0.09369186656428372, 'bear_tp_mult': 1.5694506645557118, 'bear_tsl_mult': 0.9031281666258549, 'bear_time_stop': 235, 'bear_use_sma': True, 'bear_use_ema': True, 'bear_use_atr': True, 'bear_use_adx': False, 'bear_use_spike': False, 'bear_rsi_required': True, 'sideways_strategy': 'breakout', 'sideways_bb_std_mult': 0.8885861422312429, 'sideways_rsi_os': 45, 'sideways_rsi_ob': 58, 'sideways_adx_thresh': 30.179571473319765, 'sideways_atr_min_pct': 0.02869285773507233, 'sideways_atr_max_pct': 0.10231993059744145, 'sideways_tp_mult': 1.0688878578603582, 'sideways_tsl_mult': 0.898702743504221, 'sideways_time_stop': 81, 'sideways_use_sma': True, 'sideways_use_ema': True, 'sideways_use_atr': True, 'sideways_use_adx': False, 'sideways_use_spike': False, 'sideways_rsi_required': False}.
[I 2025-08-30 15:15:53,548] Trial 409 finished with values: [-1000000000.0, 1000000000.0] and parameters: {'p_sma': 6, 'p_std': 59, 'p_atr': 15, 'p_adx': 25, 'rsi_period': 76, 'ema1': 30, 'ema2': 43, 'slip_atr_k': 0.12076440492580004, 'slip_spread_k': 0.15541829806834476, 'spread_hl_frac': 0.02721052454738288, 'bb_std_mult': 1.730715974591258, 'rsi_os': 45, 'rsi_ob': 72, 'vol_spike': 0.16683346723873754, 'adx_thresh': 12.631399802591504, 'atr_min_pct': 0.01179951675028878, 'atr_max_pct': 0.09090231121714945, 'tp_mult': 1.8004871622574115, 'tsl_mult': 0.6862390396127775, 'strategy': 'breakout', 'time_stop': 140, 'use_sma': False, 'use_atr': True, 'use_adx': False, 'use_ema': True, 'use_spike': True, 'rsi_required': True, 'edge_k': 0.0656411562811597, 'edge_cap': 0.5480306462307639, 'bull_strategy': 'mean_reversion', 'bull_bb_std_mult': 1.8455715850318102, 'bull_rsi_os': 41, 'bull_rsi_ob': 52, 'bull_adx_thresh': 17.822379236118902, 'bull_atr_min_pct': 0.01992626079393134, 'bull_atr_max_pct': 0.06471068726491604, 'bull_tp_mult': 2.222689647196001, 'bull_tsl_mult': 0.23772720606887443, 'bull_time_stop': 219, 'bull_use_sma': False, 'bull_use_ema': False, 'bull_use_atr': False, 'bull_use_adx': False, 'bull_use_spike': True, 'bull_rsi_required': False, 'bear_strategy': 'mean_reversion', 'bear_bb_std_mult': 0.6771654858627114, 'bear_rsi_os': 27, 'bear_rsi_ob': 90, 'bear_adx_thresh': 28.0034732202759, 'bear_atr_min_pct': 0.021065580012551093, 'bear_atr_max_pct': 0.09060211483902676, 'bear_tp_mult': 1.580669862636209, 'bear_tsl_mult': 0.893608198030404, 'bear_time_stop': 273, 'bear_use_sma': True, 'bear_use_ema': True, 'bear_use_atr': True, 'bear_use_adx': False, 'bear_use_spike': False, 'bear_rsi_required': True, 'sideways_strategy': 'breakout', 'sideways_bb_std_mult': 2.7056078711337292, 'sideways_rsi_os': 45, 'sideways_rsi_ob': 59, 'sideways_adx_thresh': 29.940827750520338, 'sideways_atr_min_pct': 0.02367471404749969, 'sideways_atr_max_pct': 0.11105638937846336, 'sideways_tp_mult': 2.46733695831844, 'sideways_tsl_mult': 0.9045483870227635, 'sideways_time_stop': 124, 'sideways_use_sma': True, 'sideways_use_ema': True, 'sideways_use_atr': True, 'sideways_use_adx': False, 'sideways_use_spike': False, 'sideways_rsi_required': False}.
[I 2025-08-30 15:15:54,030] Trial 406 finished with values: [-0.013947175662367584, 0.013883696248217392] and parameters: {'p_sma': 5, 'p_std': 59, 'p_atr': 15, 'p_adx': 26, 'rsi_period': 76, 'ema1': 30, 'ema2': 41, 'slip_atr_k': 0.11601612882471704, 'slip_spread_k': 0.1554458808941157, 'spread_hl_frac': 0.026874915160403003, 'bb_std_mult': 1.1279091515571946, 'rsi_os': 25, 'rsi_ob': 70, 'vol_spike': 0.1680359650291442, 'adx_thresh': 15.574380384804162, 'atr_min_pct': 0.012938629149268063, 'atr_max_pct': 0.08208593612934013, 'tp_mult': 1.9256260914043204, 'tsl_mult': 0.6834170862086922, 'strategy': 'breakout', 'time_stop': 130, 'use_sma': False, 'use_atr': True, 'use_adx': True, 'use_ema': True, 'use_spike': True, 'rsi_required': True, 'edge_k': 0.10585909027501368, 'edge_cap': 0.5395357582049174, 'bull_strategy': 'mean_reversion', 'bull_bb_std_mult': 2.2635934342009616, 'bull_rsi_os': 45, 'bull_rsi_ob': 54, 'bull_adx_thresh': 18.89075417709406, 'bull_atr_min_pct': 0.0259223064696483, 'bull_atr_max_pct': 0.06136340928306987, 'bull_tp_mult': 2.2389188239397573, 'bull_tsl_mult': 0.27053813067762866, 'bull_time_stop': 227, 'bull_use_sma': True, 'bull_use_ema': False, 'bull_use_atr': False, 'bull_use_adx': False, 'bull_use_spike': True, 'bull_rsi_required': False, 'bear_strategy': 'mean_reversion', 'bear_bb_std_mult': 0.6242141374894535, 'bear_rsi_os': 26, 'bear_rsi_ob': 75, 'bear_adx_thresh': 27.996683441929772, 'bear_atr_min_pct': 0.027934881733561276, 'bear_atr_max_pct': 0.06680384899321923, 'bear_tp_mult': 1.5700216338207336, 'bear_tsl_mult': 0.9026205724643266, 'bear_time_stop': 195, 'bear_use_sma': True, 'bear_use_ema': True, 'bear_use_atr': True, 'bear_use_adx': False, 'bear_use_spike': False, 'bear_rsi_required': True, 'sideways_strategy': 'breakout', 'sideways_bb_std_mult': 0.907106549345237, 'sideways_rsi_os': 45, 'sideways_rsi_ob': 58, 'sideways_adx_thresh': 28.85820499726092, 'sideways_atr_min_pct': 0.0007609076376147984, 'sideways_atr_max_pct': 0.10906208893174474, 'sideways_tp_mult': 1.5870429773054435, 'sideways_tsl_mult': 0.9302098962443043, 'sideways_time_stop': 76, 'sideways_use_sma': True, 'sideways_use_ema': True, 'sideways_use_atr': True, 'sideways_use_adx': False, 'sideways_use_spike': True, 'sideways_rsi_required': False}.
[I 2025-08-30 15:15:54,557] Trial 407 finished with values: [-0.018676174087190467, 0.018603275816917515] and parameters: {'p_sma': 6, 'p_std': 59, 'p_atr': 15, 'p_adx': 26, 'rsi_period': 76, 'ema1': 30, 'ema2': 44, 'slip_atr_k': 0.11819160428044967, 'slip_spread_k': 0.03931019388470329, 'spread_hl_frac': 0.02783365875786416, 'bb_std_mult': 0.9992575816294471, 'rsi_os': 26, 'rsi_ob': 63, 'vol_spike': 0.14786431760384697, 'adx_thresh': 14.317272108889188, 'atr_min_pct': 0.012356605074666427, 'atr_max_pct': 0.09102289814134054, 'tp_mult': 1.916399812226893, 'tsl_mult': 0.6565727611264903, 'strategy': 'breakout', 'time_stop': 130, 'use_sma': False, 'use_atr': True, 'use_adx': False, 'use_ema': True, 'use_spike': True, 'rsi_required': True, 'edge_k': 0.07739640267185899, 'edge_cap': 0.5515042476155569, 'bull_strategy': 'mean_reversion', 'bull_bb_std_mult': 1.090897164485041, 'bull_rsi_os': 37, 'bull_rsi_ob': 58, 'bull_adx_thresh': 18.634524424605573, 'bull_atr_min_pct': 0.022130189139224682, 'bull_atr_max_pct': 0.06523237921043062, 'bull_tp_mult': 2.205533508799169, 'bull_tsl_mult': 0.26794972922024, 'bull_time_stop': 6, 'bull_use_sma': False, 'bull_use_ema': False, 'bull_use_atr': False, 'bull_use_adx': False, 'bull_use_spike': True, 'bull_rsi_required': False, 'bear_strategy': 'mean_reversion', 'bear_bb_std_mult': 3.0746358846657182, 'bear_rsi_os': 34, 'bear_rsi_ob': 75, 'bear_adx_thresh': 27.978382155889975, 'bear_atr_min_pct': 0.02757762879826601, 'bear_atr_max_pct': 0.0903361017829346, 'bear_tp_mult': 1.5614364302547872, 'bear_tsl_mult': 0.9246208402764715, 'bear_time_stop': 294, 'bear_use_sma': True, 'bear_use_ema': True, 'bear_use_atr': True, 'bear_use_adx': False, 'bear_use_spike': False, 'bear_rsi_required': True, 'sideways_strategy': 'breakout', 'sideways_bb_std_mult': 0.9095652786845396, 'sideways_rsi_os': 50, 'sideways_rsi_ob': 50, 'sideways_adx_thresh': 30.244476118497076, 'sideways_atr_min_pct': 0.0008648400603107887, 'sideways_atr_max_pct': 0.11234033589105247, 'sideways_tp_mult': 1.4375570621363325, 'sideways_tsl_mult': 0.9080504704894934, 'sideways_time_stop': 82, 'sideways_use_sma': True, 'sideways_use_ema': True, 'sideways_use_atr': True, 'sideways_use_adx': False, 'sideways_use_spike': True, 'sideways_rsi_required': False}.
[I 2025-08-30 15:16:45,047] Trial 413 finished with values: [-1000000000.0, 1000000000.0] and parameters: {'p_sma': 5, 'p_std': 59, 'p_atr': 14, 'p_adx': 25, 'rsi_period': 74, 'ema1': 30, 'ema2': 35, 'slip_atr_k': 0.0857998494209618, 'slip_spread_k': 0.10190077783318272, 'spread_hl_frac': 0.02676143672620854, 'bb_std_mult': 0.6224394240101189, 'rsi_os': 24, 'rsi_ob': 47, 'vol_spike': 0.17778455565917572, 'adx_thresh': 15.848938322148253, 'atr_min_pct': 0.013439899341131135, 'atr_max_pct': 0.14934512553675033, 'tp_mult': 1.7900992822961208, 'tsl_mult': 0.8486122098191834, 'strategy': 'breakout', 'time_stop': 127, 'use_sma': False, 'use_atr': True, 'use_adx': False, 'use_ema': True, 'use_spike': True, 'rsi_required': True, 'edge_k': 0.2692856320063445, 'edge_cap': 0.5572445188079668, 'bull_strategy': 'mean_reversion', 'bull_bb_std_mult': 2.629124885237529, 'bull_rsi_os': 42, 'bull_rsi_ob': 48, 'bull_adx_thresh': 20.97383077838787, 'bull_atr_min_pct': 0.02609441706149232, 'bull_atr_max_pct': 0.06703577207194075, 'bull_tp_mult': 2.0662210984609373, 'bull_tsl_mult': 0.17956303187925532, 'bull_time_stop': 239, 'bull_use_sma': False, 'bull_use_ema': False, 'bull_use_atr': False, 'bull_use_adx': False, 'bull_use_spike': True, 'bull_rsi_required': False, 'bear_strategy': 'mean_reversion', 'bear_bb_std_mult': 2.8152393831990565, 'bear_rsi_os': 30, 'bear_rsi_ob': 89, 'bear_adx_thresh': 14.358352250699378, 'bear_atr_min_pct': 0.01909520872079446, 'bear_atr_max_pct': 0.07611425444237868, 'bear_tp_mult': 1.6757009656291022, 'bear_tsl_mult': 0.9474432942919396, 'bear_time_stop': 60, 'bear_use_sma': True, 'bear_use_ema': True, 'bear_use_atr': True, 'bear_use_adx': False, 'bear_use_spike': False, 'bear_rsi_required': True, 'sideways_strategy': 'mean_reversion', 'sideways_bb_std_mult': 1.1297695065534867, 'sideways_rsi_os': 44, 'sideways_rsi_ob': 80, 'sideways_adx_thresh': 28.572088581661696, 'sideways_atr_min_pct': 0.0016494381258831394, 'sideways_atr_max_pct': 0.10241960881367189, 'sideways_tp_mult': 1.7562571630823278, 'sideways_tsl_mult': 0.9834428287456703, 'sideways_time_stop': 57, 'sideways_use_sma': True, 'sideways_use_ema': True, 'sideways_use_atr': True, 'sideways_use_adx': False, 'sideways_use_spike': True, 'sideways_rsi_required': False}.
[I 2025-08-30 15:16:45,039] Trial 412 finished with values: [-1000000000.0, 1000000000.0] and parameters: {'p_sma': 6, 'p_std': 59, 'p_atr': 14, 'p_adx': 27, 'rsi_period': 74, 'ema1': 7, 'ema2': 41, 'slip_atr_k': 0.0776893462212806, 'slip_spread_k': 0.11382348083942208, 'spread_hl_frac': 0.02518406833731329, 'bb_std_mult': 0.6921157360143819, 'rsi_os': 22, 'rsi_ob': 63, 'vol_spike': 0.17327748762593598, 'adx_thresh': 15.95158004120644, 'atr_min_pct': 0.012317991950042786, 'atr_max_pct': 0.07826818971685816, 'tp_mult': 1.905424151566057, 'tsl_mult': 0.6549550557333929, 'strategy': 'breakout', 'time_stop': 126, 'use_sma': False, 'use_atr': True, 'use_adx': False, 'use_ema': True, 'use_spike': True, 'rsi_required': True, 'edge_k': 0.3731105899367408, 'edge_cap': 0.5616564101851241, 'bull_strategy': 'mean_reversion', 'bull_bb_std_mult': 1.047726181545347, 'bull_rsi_os': 43, 'bull_rsi_ob': 48, 'bull_adx_thresh': 20.927246014276445, 'bull_atr_min_pct': 0.016525678563532282, 'bull_atr_max_pct': 0.06765827771198867, 'bull_tp_mult': 2.279144087303092, 'bull_tsl_mult': 0.3815960822095385, 'bull_time_stop': 222, 'bull_use_sma': False, 'bull_use_ema': False, 'bull_use_atr': False, 'bull_use_adx': False, 'bull_use_spike': True, 'bull_rsi_required': False, 'bear_strategy': 'mean_reversion', 'bear_bb_std_mult': 0.6367338706418674, 'bear_rsi_os': 30, 'bear_rsi_ob': 76, 'bear_adx_thresh': 22.97765533623972, 'bear_atr_min_pct': 0.023521275937631536, 'bear_atr_max_pct': 0.0750141333628132, 'bear_tp_mult': 1.6457350951098724, 'bear_tsl_mult': 0.929518963797494, 'bear_time_stop': 58, 'bear_use_sma': True, 'bear_use_ema': True, 'bear_use_atr': True, 'bear_use_adx': False, 'bear_use_spike': False, 'bear_rsi_required': True, 'sideways_strategy': 'mean_reversion', 'sideways_bb_std_mult': 1.4269343242819006, 'sideways_rsi_os': 44, 'sideways_rsi_ob': 58, 'sideways_adx_thresh': 28.923159930289938, 'sideways_atr_min_pct': 0.026020585509597044, 'sideways_atr_max_pct': 0.10128238567349172, 'sideways_tp_mult': 2.446981104456226, 'sideways_tsl_mult': 0.9838344208210583, 'sideways_time_stop': 56, 'sideways_use_sma': True, 'sideways_use_ema': True, 'sideways_use_atr': True, 'sideways_use_adx': False, 'sideways_use_spike': True, 'sideways_rsi_required': False}.
[I 2025-08-30 15:16:46,333] Trial 410 finished with values: [-1000000000.0, 1000000000.0] and parameters: {'p_sma': 5, 'p_std': 59, 'p_atr': 15, 'p_adx': 25, 'rsi_period': 76, 'ema1': 16, 'ema2': 41, 'slip_atr_k': 0.07683830608419845, 'slip_spread_k': 0.0406079585971859, 'spread_hl_frac': 0.027469098040200413, 'bb_std_mult': 0.6982145869353956, 'rsi_os': 25, 'rsi_ob': 73, 'vol_spike': 0.16754039895050174, 'adx_thresh': 14.323417048285423, 'atr_min_pct': 0.012347156927647294, 'atr_max_pct': 0.03725805422399426, 'tp_mult': 1.944376633657708, 'tsl_mult': 0.5619736157662013, 'strategy': 'breakout', 'time_stop': 128, 'use_sma': False, 'use_atr': True, 'use_adx': False, 'use_ema': True, 'use_spike': True, 'rsi_required': True, 'edge_k': 0.5301728444946281, 'edge_cap': 0.4400485653443365, 'bull_strategy': 'mean_reversion', 'bull_bb_std_mult': 1.076985418595204, 'bull_rsi_os': 36, 'bull_rsi_ob': 60, 'bull_adx_thresh': 17.85965794165687, 'bull_atr_min_pct': 0.026005857990468714, 'bull_atr_max_pct': 0.06557886799931979, 'bull_tp_mult': 2.203605868302475, 'bull_tsl_mult': 0.38877684232326576, 'bull_time_stop': 235, 'bull_use_sma': False, 'bull_use_ema': False, 'bull_use_atr': False, 'bull_use_adx': False, 'bull_use_spike': True, 'bull_rsi_required': False, 'bear_strategy': 'mean_reversion', 'bear_bb_std_mult': 0.6647035857734658, 'bear_rsi_os': 27, 'bear_rsi_ob': 83, 'bear_adx_thresh': 21.08655703565899, 'bear_atr_min_pct': 0.028833818357911337, 'bear_atr_max_pct': 0.09035547104145625, 'bear_tp_mult': 1.6690531473706616, 'bear_tsl_mult': 0.9274165899646839, 'bear_time_stop': 282, 'bear_use_sma': True, 'bear_use_ema': True, 'bear_use_atr': True, 'bear_use_adx': False, 'bear_use_spike': False, 'bear_rsi_required': True, 'sideways_strategy': 'mean_reversion', 'sideways_bb_std_mult': 2.701375517241479, 'sideways_rsi_os': 23, 'sideways_rsi_ob': 95, 'sideways_adx_thresh': 28.91084908507115, 'sideways_atr_min_pct': 0.029974835495121668, 'sideways_atr_max_pct': 0.11171423417227723, 'sideways_tp_mult': 2.449590792971637, 'sideways_tsl_mult': 0.8738577674372994, 'sideways_time_stop': 58, 'sideways_use_sma': True, 'sideways_use_ema': True, 'sideways_use_atr': True, 'sideways_use_adx': False, 'sideways_use_spike': True, 'sideways_rsi_required': False}.
[I 2025-08-30 15:16:47,989] Trial 411 finished with values: [-1000000000.0, 1000000000.0] and parameters: {'p_sma': 6, 'p_std': 58, 'p_atr': 15, 'p_adx': 25, 'rsi_period': 74, 'ema1': 30, 'ema2': 35, 'slip_atr_k': 0.07586336264544083, 'slip_spread_k': 0.051070876597531706, 'spread_hl_frac': 0.017368727139919826, 'bb_std_mult': 0.726196194339495, 'rsi_os': 25, 'rsi_ob': 73, 'vol_spike': 0.1748989408067487, 'adx_thresh': 14.234127156648533, 'atr_min_pct': 0.013593597129913574, 'atr_max_pct': 0.07842925581161282, 'tp_mult': 1.9063082569864838, 'tsl_mult': 0.5623233414312049, 'strategy': 'breakout', 'time_stop': 131, 'use_sma': False, 'use_atr': True, 'use_adx': False, 'use_ema': True, 'use_spike': True, 'rsi_required': True, 'edge_k': 0.5193460341134324, 'edge_cap': 0.28034184065400436, 'bull_strategy': 'mean_reversion', 'bull_bb_std_mult': 1.0465370202627786, 'bull_rsi_os': 36, 'bull_rsi_ob': 58, 'bull_adx_thresh': 21.092291087017202, 'bull_atr_min_pct': 0.02600272132224268, 'bull_atr_max_pct': 0.06688897612381645, 'bull_tp_mult': 2.186553354280132, 'bull_tsl_mult': 0.18370589796882536, 'bull_time_stop': 26, 'bull_use_sma': False, 'bull_use_ema': False, 'bull_use_atr': False, 'bull_use_adx': False, 'bull_use_spike': True, 'bull_rsi_required': False, 'bear_strategy': 'mean_reversion', 'bear_bb_std_mult': 3.084359914056585, 'bear_rsi_os': 34, 'bear_rsi_ob': 83, 'bear_adx_thresh': 26.29255998661501, 'bear_atr_min_pct': 0.028500152569739912, 'bear_atr_max_pct': 0.08157736813356026, 'bear_tp_mult': 1.5495256411190343, 'bear_tsl_mult': 0.9307077475602619, 'bear_time_stop': 193, 'bear_use_sma': True, 'bear_use_ema': True, 'bear_use_atr': True, 'bear_use_adx': False, 'bear_use_spike': False, 'bear_rsi_required': True, 'sideways_strategy': 'mean_reversion', 'sideways_bb_std_mult': 1.4135738680975516, 'sideways_rsi_os': 49, 'sideways_rsi_ob': 58, 'sideways_adx_thresh': 28.801209858733383, 'sideways_atr_min_pct': 0.000943436998268407, 'sideways_atr_max_pct': 0.10922061200243113, 'sideways_tp_mult': 2.443850584122079, 'sideways_tsl_mult': 0.8574570849729681, 'sideways_time_stop': 55, 'sideways_use_sma': True, 'sideways_use_ema': True, 'sideways_use_atr': True, 'sideways_use_adx': False, 'sideways_use_spike': True, 'sideways_rsi_required': False}.
