[I 2025-08-30 14:30:40,312] Trial 78 finished with values: [-1000000000.0, 1000000000.0] and parameters: {'p_sma': 30, 'p_std': 30, 'p_atr': 13, 'p_adx': 22, 'rsi_period': 46, 'ema1': 25, 'ema2': 50, 'slip_atr_k': 0.01480755072745585, 'slip_spread_k': 0.3437470338173517, 'spread_hl_frac': 0.0008910972421248696, 'bb_std_mult': 2.0302717305058273, 'rsi_os': 31, 'rsi_ob': 87, 'vol_spike': 0.2509340766981583, 'adx_thresh': 22.93912910830297, 'atr_min_pct': 0.019846359447031146, 'atr_max_pct': 0.11734853887779216, 'tp_mult': 2.6034600935711008, 'tsl_mult': 0.9262144107066412, 'strategy': 'mean_reversion', 'time_stop': 162, 'use_sma': False, 'use_atr': False, 'use_adx': False, 'use_ema': False, 'use_spike': False, 'rsi_required': False, 'edge_k': 1.5319364024918822, 'edge_cap': 0.6982565157337961, 'bull_strategy': 'breakout', 'bull_bb_std_mult': 3.1335182116243105, 'bull_rsi_os': 28, 'bull_rsi_ob': 76, 'bull_adx_thresh': 10.913759549357692, 'bull_atr_min_pct': 0.022413706634758928, 'bull_atr_max_pct': 0.03033185022135433, 'bull_tp_mult': 2.349378877725731, 'bull_tsl_mult': 0.5183975514947771, 'bull_time_stop': 140, 'bull_use_sma': False, 'bull_use_ema': False, 'bull_use_atr': False, 'bull_use_adx': True, 'bull_use_spike': False, 'bull_rsi_required': True, 'bear_strategy': 'breakout', 'bear_bb_std_mult': 1.3620945544271192, 'bear_rsi_os': 15, 'bear_rsi_ob': 48, 'bear_adx_thresh': 16.37413811993301, 'bear_atr_min_pct': 0.011569792857239422, 'bear_atr_max_pct': 0.031173381069110342, 'bear_tp_mult': 1.8993683965739374, 'bear_tsl_mult': 0.19461706524313108, 'bear_time_stop': 48, 'bear_use_sma': False, 'bear_use_ema': False, 'bear_use_atr': False, 'bear_use_adx': True, 'bear_use_spike': True, 'bear_rsi_required': False, 'sideways_strategy': 'breakout', 'sideways_bb_std_mult': 3.2502490593029765, 'sideways_rsi_os': 33, 'sideways_rsi_ob': 90, 'sideways_adx_thresh': 11.977629500665373, 'sideways_atr_min_pct': 0.0037219854024668816, 'sideways_atr_max_pct': 0.07818729392911361, 'sideways_tp_mult': 2.728493730847178, 'sideways_tsl_mult': 0.12324540383190224, 'sideways_time_stop': 66, 'sideways_use_sma': False, 'sideways_use_ema': False, 'sideways_use_atr': False, 'sideways_use_adx': True, 'sideways_use_spike': True, 'sideways_rsi_required': True}.
[I 2025-08-30 14:31:10,607] Trial 84 finished with values: [-0.05282853738893134, 0.05275151183039847] and parameters: {'p_sma': 26, 'p_std': 33, 'p_atr': 29, 'p_adx': 24, 'rsi_period': 43, 'ema1': 20, 'ema2': 55, 'slip_atr_k': 0.0012856277447412853, 'slip_spread_k': 0.29688240319246945, 'spread_hl_frac': 0.008776240323072275, 'bb_std_mult': 2.255163674386552, 'rsi_os': 36, 'rsi_ob': 62, 'vol_spike': 0.29187139570788473, 'adx_thresh': 20.858209937184004, 'atr_min_pct': 0.012929431365083049, 'atr_max_pct': 0.13006612269954332, 'tp_mult': 2.4670157052936212, 'tsl_mult': 0.07027012820557521, 'strategy': 'mean_reversion', 'time_stop': 73, 'use_sma': True, 'use_atr': False, 'use_adx': False, 'use_ema': False, 'use_spike': False, 'rsi_required': False, 'edge_k': 1.448565392367808, 'edge_cap': 0.8867398613425865, 'bull_strategy': 'mean_reversion', 'bull_bb_std_mult': 3.324859538896318, 'bull_rsi_os': 20, 'bull_rsi_ob': 78, 'bull_adx_thresh': 9.070500240117914, 'bull_atr_min_pct': 0.015067335879051602, 'bull_atr_max_pct': 0.02308018995102887, 'bull_tp_mult': 2.080334464586024, 'bull_tsl_mult': 0.4216918757857814, 'bull_time_stop': 124, 'bull_use_sma': True, 'bull_use_ema': False, 'bull_use_atr': True, 'bull_use_adx': True, 'bull_use_spike': False, 'bull_rsi_required': True, 'bear_strategy': 'breakout', 'bear_bb_std_mult': 1.2127585749033234, 'bear_rsi_os': 18, 'bear_rsi_ob': 94, 'bear_adx_thresh': 13.867998781585868, 'bear_atr_min_pct': 0.013781436840285344, 'bear_atr_max_pct': 0.02371629566739717, 'bear_tp_mult': 2.0185853497252464, 'bear_tsl_mult': 0.7162171913074532, 'bear_time_stop': 16, 'bear_use_sma': False, 'bear_use_ema': False, 'bear_use_atr': False, 'bear_use_adx': False, 'bear_use_spike': True, 'bear_rsi_required': False, 'sideways_strategy': 'breakout', 'sideways_bb_std_mult': 3.021758367694643, 'sideways_rsi_os': 52, 'sideways_rsi_ob': 93, 'sideways_adx_thresh': 15.044463981231528, 'sideways_atr_min_pct': 0.001720343123498462, 'sideways_atr_max_pct': 0.08468953959991463, 'sideways_tp_mult': 2.922748446649455, 'sideways_tsl_mult': 0.0090284146585944, 'sideways_time_stop': 215, 'sideways_use_sma': False, 'sideways_use_ema': False, 'sideways_use_atr': True, 'sideways_use_adx': False, 'sideways_use_spike': False, 'sideways_rsi_required': False}.
[I 2025-08-30 14:31:10,784] Trial 85 finished with values: [-0.04202338274042827, 0.04195270308153648] and parameters: {'p_sma': 27, 'p_std': 25, 'p_atr': 29, 'p_adx': 24, 'rsi_period': 38, 'ema1': 20, 'ema2': 55, 'slip_atr_k': 0.002580827519025712, 'slip_spread_k': 0.09211666899497173, 'spread_hl_frac': 0.04529647193827048, 'bb_std_mult': 2.240181858922772, 'rsi_os': 35, 'rsi_ob': 62, 'vol_spike': 0.24164017808561672, 'adx_thresh': 21.123606291621922, 'atr_min_pct': 0.0063257723626083, 'atr_max_pct': 0.13713071373171662, 'tp_mult': 2.898458536518761, 'tsl_mult': 0.9989057543317896, 'strategy': 'mean_reversion', 'time_stop': 233, 'use_sma': True, 'use_atr': False, 'use_adx': False, 'use_ema': False, 'use_spike': False, 'rsi_required': False, 'edge_k': 1.4408874345216498, 'edge_cap': 0.8910278986856756, 'bull_strategy': 'mean_reversion', 'bull_bb_std_mult': 2.9264762512627196, 'bull_rsi_os': 20, 'bull_rsi_ob': 86, 'bull_adx_thresh': 8.556981352155674, 'bull_atr_min_pct': 0.014659755978861278, 'bull_atr_max_pct': 0.027151645262042223, 'bull_tp_mult': 2.0793239098103147, 'bull_tsl_mult': 0.3958417950952349, 'bull_time_stop': 222, 'bull_use_sma': True, 'bull_use_ema': False, 'bull_use_atr': True, 'bull_use_adx': True, 'bull_use_spike': False, 'bull_rsi_required': True, 'bear_strategy': 'breakout', 'bear_bb_std_mult': 1.2246247127068763, 'bear_rsi_os': 10, 'bear_rsi_ob': 94, 'bear_adx_thresh': 19.56225366726748, 'bear_atr_min_pct': 0.013415410456943881, 'bear_atr_max_pct': 0.02330399563866578, 'bear_tp_mult': 2.0434555868871316, 'bear_tsl_mult': 0.27257626899378495, 'bear_time_stop': 16, 'bear_use_sma': False, 'bear_use_ema': False, 'bear_use_atr': False, 'bear_use_adx': False, 'bear_use_spike': True, 'bear_rsi_required': False, 'sideways_strategy': 'breakout', 'sideways_bb_std_mult': 3.5966973706925462, 'sideways_rsi_os': 52, 'sideways_rsi_ob': 93, 'sideways_adx_thresh': 9.395797210644439, 'sideways_atr_min_pct': 0.0020154127643376325, 'sideways_atr_max_pct': 0.08509020830232417, 'sideways_tp_mult': 2.9318160152655386, 'sideways_tsl_mult': 0.8439662951322341, 'sideways_time_stop': 213, 'sideways_use_sma': False, 'sideways_use_ema': False, 'sideways_use_atr': True, 'sideways_use_adx': False, 'sideways_use_spike': False, 'sideways_rsi_required': False}.
[I 2025-08-30 14:31:10,807] Trial 83 finished with values: [-0.11980417461847226, 0.1197205231449899] and parameters: {'p_sma': 26, 'p_std': 25, 'p_atr': 12, 'p_adx': 24, 'rsi_period': 46, 'ema1': 27, 'ema2': 55, 'slip_atr_k': 0.00028437923102881194, 'slip_spread_k': 0.9004443129474521, 'spread_hl_frac': 0.04631831052601536, 'bb_std_mult': 2.236167723971056, 'rsi_os': 36, 'rsi_ob': 90, 'vol_spike': 0.28561293062243753, 'adx_thresh': 20.52937583680795, 'atr_min_pct': 0.023560770558707096, 'atr_max_pct': 0.13547589458013978, 'tp_mult': 2.4742286741837156, 'tsl_mult': 0.10078397342184836, 'strategy': 'mean_reversion', 'time_stop': 239, 'use_sma': True, 'use_atr': False, 'use_adx': False, 'use_ema': False, 'use_spike': False, 'rsi_required': False, 'edge_k': 1.444393267424974, 'edge_cap': 0.7579879182561498, 'bull_strategy': 'mean_reversion', 'bull_bb_std_mult': 3.3131026177443452, 'bull_rsi_os': 21, 'bull_rsi_ob': 78, 'bull_adx_thresh': 9.149730730199927, 'bull_atr_min_pct': 0.015651724677583172, 'bull_atr_max_pct': 0.0246990585052317, 'bull_tp_mult': 2.074286795030666, 'bull_tsl_mult': 0.41248473171800326, 'bull_time_stop': 269, 'bull_use_sma': False, 'bull_use_ema': False, 'bull_use_atr': True, 'bull_use_adx': True, 'bull_use_spike': False, 'bull_rsi_required': True, 'bear_strategy': 'breakout', 'bear_bb_std_mult': 1.2161156012384096, 'bear_rsi_os': 11, 'bear_rsi_ob': 86, 'bear_adx_thresh': 16.908567294994953, 'bear_atr_min_pct': 0.013685192930251751, 'bear_atr_max_pct': 0.030498237109035653, 'bear_tp_mult': 1.7472204279660848, 'bear_tsl_mult': 0.7300123612747387, 'bear_time_stop': 25, 'bear_use_sma': False, 'bear_use_ema': False, 'bear_use_atr': False, 'bear_use_adx': False, 'bear_use_spike': True, 'bear_rsi_required': False, 'sideways_strategy': 'breakout', 'sideways_bb_std_mult': 2.7162483682361134, 'sideways_rsi_os': 46, 'sideways_rsi_ob': 45, 'sideways_adx_thresh': 8.548430055289264, 'sideways_atr_min_pct': 0.0012911277233198198, 'sideways_atr_max_pct': 0.0858288420381358, 'sideways_tp_mult': 2.9197392637209822, 'sideways_tsl_mult': 0.028985388590092948, 'sideways_time_stop': 214, 'sideways_use_sma': False, 'sideways_use_ema': False, 'sideways_use_atr': True, 'sideways_use_adx': False, 'sideways_use_spike': False, 'sideways_rsi_required': False}.
[I 2025-08-30 14:31:11,077] Trial 82 finished with values: [-0.06949855297736207, 0.06945436096534015] and parameters: {'p_sma': 27, 'p_std': 29, 'p_atr': 29, 'p_adx': 24, 'rsi_period': 46, 'ema1': 23, 'ema2': 53, 'slip_atr_k': 0.01771440215608585, 'slip_spread_k': 0.3735401138871711, 'spread_hl_frac': 0.044575673307300376, 'bb_std_mult': 1.826876517735014, 'rsi_os': 35, 'rsi_ob': 61, 'vol_spike': 0.24302055669929085, 'adx_thresh': 21.008722789813092, 'atr_min_pct': 0.010153677418367917, 'atr_max_pct': 0.1389264798235492, 'tp_mult': 2.595491362525113, 'tsl_mult': 0.07354697322781317, 'strategy': 'mean_reversion', 'time_stop': 240, 'use_sma': True, 'use_atr': False, 'use_adx': False, 'use_ema': False, 'use_spike': False, 'rsi_required': False, 'edge_k': 1.5543909058650642, 'edge_cap': 0.8799165540938102, 'bull_strategy': 'mean_reversion', 'bull_bb_std_mult': 2.9249914854974692, 'bull_rsi_os': 26, 'bull_rsi_ob': 87, 'bull_adx_thresh': 8.179634136655082, 'bull_atr_min_pct': 0.014765927408960624, 'bull_atr_max_pct': 0.027532838538099083, 'bull_tp_mult': 2.3384742090614603, 'bull_tsl_mult': 0.38071745794048983, 'bull_time_stop': 220, 'bull_use_sma': False, 'bull_use_ema': False, 'bull_use_atr': True, 'bull_use_adx': True, 'bull_use_spike': False, 'bull_rsi_required': True, 'bear_strategy': 'breakout', 'bear_bb_std_mult': 1.3456789644379972, 'bear_rsi_os': 15, 'bear_rsi_ob': 95, 'bear_adx_thresh': 13.999893473356572, 'bear_atr_min_pct': 0.013922810695083191, 'bear_atr_max_pct': 0.03419641187573462, 'bear_tp_mult': 2.99187366219808, 'bear_tsl_mult': 0.2752247986093668, 'bear_time_stop': 21, 'bear_use_sma': False, 'bear_use_ema': False, 'bear_use_atr': False, 'bear_use_adx': False, 'bear_use_spike': True, 'bear_rsi_required': False, 'sideways_strategy': 'breakout', 'sideways_bb_std_mult': 3.064267057891864, 'sideways_rsi_os': 45, 'sideways_rsi_ob': 93, 'sideways_adx_thresh': 9.368179122583573, 'sideways_atr_min_pct': 0.00142760678003114, 'sideways_atr_max_pct': 0.10406612279893708, 'sideways_tp_mult': 2.996035312988169, 'sideways_tsl_mult': 0.18212331735942588, 'sideways_time_stop': 213, 'sideways_use_sma': False, 'sideways_use_ema': False, 'sideways_use_atr': True, 'sideways_use_adx': False, 'sideways_use_spike': True, 'sideways_rsi_required': True}.
[I 2025-08-30 14:31:11,375] Trial 88 finished with values: [-1000000000.0, 1000000000.0] and parameters: {'p_sma': 32, 'p_std': 34, 'p_atr': 14, 'p_adx': 23, 'rsi_period': 54, 'ema1': 24, 'ema2': 53, 'slip_atr_k': 0.07291705663555056, 'slip_spread_k': 0.44449751933317405, 'spread_hl_frac': 0.004223021212931201, 'bb_std_mult': 2.107856502658594, 'rsi_os': 27, 'rsi_ob': 47, 'vol_spike': 0.2636036600442801, 'adx_thresh': 18.836541430392536, 'atr_min_pct': 0.009999027063052342, 'atr_max_pct': 0.1433313241268489, 'tp_mult': 2.3299873396713795, 'tsl_mult': 0.9398304562476725, 'strategy': 'mean_reversion', 'time_stop': 300, 'use_sma': True, 'use_atr': True, 'use_adx': False, 'use_ema': True, 'use_spike': False, 'rsi_required': False, 'edge_k': 1.6371320870618495, 'edge_cap': 0.6335821693001671, 'bull_strategy': 'breakout', 'bull_bb_std_mult': 1.6271026961897563, 'bull_rsi_os': 10, 'bull_rsi_ob': 90, 'bull_adx_thresh': 12.575321128077137, 'bull_atr_min_pct': 0.017666599996043572, 'bull_atr_max_pct': 0.044093961545971797, 'bull_tp_mult': 2.2395562824070456, 'bull_tsl_mult': 0.48629739367176916, 'bull_time_stop': 63, 'bull_use_sma': False, 'bull_use_ema': False, 'bull_use_atr': True, 'bull_use_adx': True, 'bull_use_spike': False, 'bull_rsi_required': True, 'bear_strategy': 'breakout', 'bear_bb_std_mult': 1.0510549868187433, 'bear_rsi_os': 8, 'bear_rsi_ob': 47, 'bear_adx_thresh': 19.92834238120521, 'bear_atr_min_pct': 0.01537151926304549, 'bear_atr_max_pct': 0.016113910301975592, 'bear_tp_mult': 1.8540459133434959, 'bear_tsl_mult': 0.16018942378391848, 'bear_time_stop': 157, 'bear_use_sma': False, 'bear_use_ema': False, 'bear_use_atr': False, 'bear_use_adx': False, 'bear_use_spike': True, 'bear_rsi_required': False, 'sideways_strategy': 'breakout', 'sideways_bb_std_mult': 2.280798609331062, 'sideways_rsi_os': 40, 'sideways_rsi_ob': 48, 'sideways_adx_thresh': 16.367952055122004, 'sideways_atr_min_pct': 0.007815617245322953, 'sideways_atr_max_pct': 0.0723007652803008, 'sideways_tp_mult': 2.6127808794686023, 'sideways_tsl_mult': 0.10709032167743636, 'sideways_time_stop': 180, 'sideways_use_sma': False, 'sideways_use_ema': True, 'sideways_use_atr': False, 'sideways_use_adx': True, 'sideways_use_spike': True, 'sideways_rsi_required': True}.
[I 2025-08-30 14:31:42,497] Trial 86 finished with values: [-1000000000.0, 1000000000.0] and parameters: {'p_sma': 32, 'p_std': 25, 'p_atr': 12, 'p_adx': 23, 'rsi_period': 52, 'ema1': 24, 'ema2': 46, 'slip_atr_k': 0.028224172842176078, 'slip_spread_k': 0.8907401414216833, 'spread_hl_frac': 0.04364216093419815, 'bb_std_mult': 2.099952186406996, 'rsi_os': 35, 'rsi_ob': 90, 'vol_spike': 0.24181245508055377, 'adx_thresh': 18.915974653961644, 'atr_min_pct': 0.02176545560035217, 'atr_max_pct': 0.1375752190450787, 'tp_mult': 2.894748132571153, 'tsl_mult': 0.9515234572576902, 'strategy': 'mean_reversion', 'time_stop': 241, 'use_sma': True, 'use_atr': False, 'use_adx': False, 'use_ema': False, 'use_spike': False, 'rsi_required': False, 'edge_k': 1.6415549048009055, 'edge_cap': 0.7560704111021832, 'bull_strategy': 'mean_reversion', 'bull_bb_std_mult': 3.187499546308377, 'bull_rsi_os': 17, 'bull_rsi_ob': 87, 'bull_adx_thresh': 5.154668349612093, 'bull_atr_min_pct': 0.01743223357411975, 'bull_atr_max_pct': 0.04694460404515052, 'bull_tp_mult': 2.2839375186262543, 'bull_tsl_mult': 0.4089175180026645, 'bull_time_stop': 67, 'bull_use_sma': False, 'bull_use_ema': False, 'bull_use_atr': True, 'bull_use_adx': True, 'bull_use_spike': False, 'bull_rsi_required': True, 'bear_strategy': 'breakout', 'bear_bb_std_mult': 1.028437806139388, 'bear_rsi_os': 11, 'bear_rsi_ob': 85, 'bear_adx_thresh': 16.97758187662423, 'bear_atr_min_pct': 0.015615411682865997, 'bear_atr_max_pct': 0.029485207455893978, 'bear_tp_mult': 2.0071831619635327, 'bear_tsl_mult': 0.16074250585851962, 'bear_time_stop': 29, 'bear_use_sma': False, 'bear_use_ema': False, 'bear_use_atr': False, 'bear_use_adx': False, 'bear_use_spike': True, 'bear_rsi_required': False, 'sideways_strategy': 'breakout', 'sideways_bb_std_mult': 2.3310628290594875, 'sideways_rsi_os': 45, 'sideways_rsi_ob': 93, 'sideways_adx_thresh': 7.4358634293584025, 'sideways_atr_min_pct': 0.007664999519428995, 'sideways_atr_max_pct': 0.07301480663786027, 'sideways_tp_mult': 2.6346885507900346, 'sideways_tsl_mult': 0.8529656328672035, 'sideways_time_stop': 90, 'sideways_use_sma': False, 'sideways_use_ema': False, 'sideways_use_atr': True, 'sideways_use_adx': False, 'sideways_use_spike': True, 'sideways_rsi_required': True}.
[I 2025-08-30 14:31:42,509] Trial 90 finished with values: [-1000000000.0, 1000000000.0] and parameters: {'p_sma': 24, 'p_std': 27, 'p_atr': 11, 'p_adx': 29, 'rsi_period': 77, 'ema1': 28, 'ema2': 13, 'slip_atr_k': 0.029583453227865205, 'slip_spread_k': 0.26818621432470385, 'spread_hl_frac': 0.006608732224013264, 'bb_std_mult': 1.9674730917481105, 'rsi_os': 33, 'rsi_ob': 90, 'vol_spike': 0.27753405779928764, 'adx_thresh': 21.969505046048404, 'atr_min_pct': 0.021708966097408248, 'atr_max_pct': 0.03092666825351198, 'tp_mult': 2.7775285363270967, 'tsl_mult': 0.9596639504111751, 'strategy': 'mean_reversion', 'time_stop': 214, 'use_sma': True, 'use_atr': False, 'use_adx': False, 'use_ema': False, 'use_spike': False, 'rsi_required': False, 'edge_k': 1.7086202321943944, 'edge_cap': 0.593114674682148, 'bull_strategy': 'breakout', 'bull_bb_std_mult': 3.197640881275591, 'bull_rsi_os': 18, 'bull_rsi_ob': 79, 'bull_adx_thresh': 34.62703837227729, 'bull_atr_min_pct': 0.00958548652221669, 'bull_atr_max_pct': 0.08256255613391636, 'bull_tp_mult': 1.610446570318698, 'bull_tsl_mult': 0.6307679515201143, 'bull_time_stop': 286, 'bull_use_sma': False, 'bull_use_ema': False, 'bull_use_atr': True, 'bull_use_adx': True, 'bull_use_spike': False, 'bull_rsi_required': True, 'bear_strategy': 'mean_reversion', 'bear_bb_std_mult': 0.7295423506914169, 'bear_rsi_os': 17, 'bear_rsi_ob': 80, 'bear_adx_thresh': 14.80728504257649, 'bear_atr_min_pct': 0.004105023174009002, 'bear_atr_max_pct': 0.0491375176450541, 'bear_tp_mult': 1.39246447020574, 'bear_tsl_mult': 0.23693678006434812, 'bear_time_stop': 35, 'bear_use_sma': False, 'bear_use_ema': False, 'bear_use_atr': False, 'bear_use_adx': False, 'bear_use_spike': True, 'bear_rsi_required': False, 'sideways_strategy': 'breakout', 'sideways_bb_std_mult': 2.3833727167043186, 'sideways_rsi_os': 11, 'sideways_rsi_ob': 88, 'sideways_adx_thresh': 18.66722930267372, 'sideways_atr_min_pct': 0.004743452473858846, 'sideways_atr_max_pct': 0.09477142218941786, 'sideways_tp_mult': 2.372297073389124, 'sideways_tsl_mult': 0.4261823450742612, 'sideways_time_stop': 37, 'sideways_use_sma': False, 'sideways_use_ema': False, 'sideways_use_atr': False, 'sideways_use_adx': True, 'sideways_use_spike': True, 'sideways_rsi_required': True}.
[I 2025-08-30 14:31:42,932] Trial 87 finished with values: [-1000000000.0, 1000000000.0] and parameters: {'p_sma': 32, 'p_std': 34, 'p_atr': 14, 'p_adx': 23, 'rsi_period': 48, 'ema1': 24, 'ema2': 46, 'slip_atr_k': 0.07535707112769688, 'slip_spread_k': 0.2656989485713683, 'spread_hl_frac': 0.004059170021657924, 'bb_std_mult': 2.1069724713565354, 'rsi_os': 28, 'rsi_ob': 91, 'vol_spike': 0.2419251795791904, 'adx_thresh': 18.767204236958264, 'atr_min_pct': 0.021849564149216807, 'atr_max_pct': 0.10620040896944179, 'tp_mult': 2.3600741799254474, 'tsl_mult': 0.9462303994380376, 'strategy': 'mean_reversion', 'time_stop': 121, 'use_sma': True, 'use_atr': True, 'use_adx': False, 'use_ema': True, 'use_spike': False, 'rsi_required': False, 'edge_k': 1.6415053377985218, 'edge_cap': 0.5891273735072559, 'bull_strategy': 'breakout', 'bull_bb_std_mult': 3.431044950913199, 'bull_rsi_os': 17, 'bull_rsi_ob': 79, 'bull_adx_thresh': 12.383332316757986, 'bull_atr_min_pct': 0.017650087339135177, 'bull_atr_max_pct': 0.041204427515068684, 'bull_tp_mult': 2.282249758987563, 'bull_tsl_mult': 0.632292407560521, 'bull_time_stop': 94, 'bull_use_sma': False, 'bull_use_ema': False, 'bull_use_atr': True, 'bull_use_adx': True, 'bull_use_spike': False, 'bull_rsi_required': True, 'bear_strategy': 'breakout', 'bear_bb_std_mult': 1.0684426937186056, 'bear_rsi_os': 7, 'bear_rsi_ob': 53, 'bear_adx_thresh': 17.43162083081957, 'bear_atr_min_pct': 0.015558546000406483, 'bear_atr_max_pct': 0.048158573011023456, 'bear_tp_mult': 1.3882799750852581, 'bear_tsl_mult': 0.15772405720689997, 'bear_time_stop': 155, 'bear_use_sma': False, 'bear_use_ema': False, 'bear_use_atr': False, 'bear_use_adx': False, 'bear_use_spike': True, 'bear_rsi_required': False, 'sideways_strategy': 'breakout', 'sideways_bb_std_mult': 2.299134347045052, 'sideways_rsi_os': 41, 'sideways_rsi_ob': 92, 'sideways_adx_thresh': 16.54904643199872, 'sideways_atr_min_pct': 0.005066522213966095, 'sideways_atr_max_pct': 0.07389982277673632, 'sideways_tp_mult': 2.603633254889396, 'sideways_tsl_mult': 0.10034271133888588, 'sideways_time_stop': 180, 'sideways_use_sma': False, 'sideways_use_ema': True, 'sideways_use_atr': False, 'sideways_use_adx': True, 'sideways_use_spike': True, 'sideways_rsi_required': True}.
