[I 2025-08-30 14:46:35,731] Trial 215 finished with values: [-1000000000.0, 1000000000.0] and parameters: {'p_sma': 30, 'p_std': 28, 'p_atr': 13, 'p_adx': 11, 'rsi_period': 63, 'ema1': 26, 'ema2': 16, 'slip_atr_k': 0.02202660065621582, 'slip_spread_k': 0.3022636597074221, 'spread_hl_frac': 0.0034765940657085384, 'bb_std_mult': 2.0664010807548063, 'rsi_os': 33, 'rsi_ob': 92, 'vol_spike': 0.24553562142731392, 'adx_thresh': 19.701272161252938, 'atr_min_pct': 0.020119454624503298, 'atr_max_pct': 0.10610442337716647, 'tp_mult': 2.5375499029930824, 'tsl_mult': 0.9966538299555163, 'strategy': 'mean_reversion', 'time_stop': 90, 'use_sma': True, 'use_atr': True, 'use_adx': False, 'use_ema': True, 'use_spike': False, 'rsi_required': False, 'edge_k': 0.8314739423714385, 'edge_cap': 0.6615966891885637, 'bull_strategy': 'breakout', 'bull_bb_std_mult': 1.9100364922569835, 'bull_rsi_os': 15, 'bull_rsi_ob': 65, 'bull_adx_thresh': 12.670636865421795, 'bull_atr_min_pct': 0.026745633170841263, 'bull_atr_max_pct': 0.025952049405102068, 'bull_tp_mult': 1.483350650026385, 'bull_tsl_mult': 0.5173079096270778, 'bull_time_stop': 264, 'bull_use_sma': False, 'bull_use_ema': False, 'bull_use_atr': False, 'bull_use_adx': True, 'bull_use_spike': True, 'bull_rsi_required': False, 'bear_strategy': 'breakout', 'bear_bb_std_mult': 1.3863614407517943, 'bear_rsi_os': 14, 'bear_rsi_ob': 79, 'bear_adx_thresh': 18.078234363061274, 'bear_atr_min_pct': 0.012136325322381767, 'bear_atr_max_pct': 0.13127384304170014, 'bear_tp_mult': 2.076815880006757, 'bear_tsl_mult': 0.16660731655091354, 'bear_time_stop': 54, 'bear_use_sma': False, 'bear_use_ema': False, 'bear_use_atr': True, 'bear_use_adx': True, 'bear_use_spike': True, 'bear_rsi_required': True, 'sideways_strategy': 'breakout', 'sideways_bb_std_mult': 3.080680476742615, 'sideways_rsi_os': 29, 'sideways_rsi_ob': 61, 'sideways_adx_thresh': 24.570112325818847, 'sideways_atr_min_pct': 0.00323455444135341, 'sideways_atr_max_pct': 0.07435222503340193, 'sideways_tp_mult': 2.701833560169333, 'sideways_tsl_mult': 0.8817138363404753, 'sideways_time_stop': 223, 'sideways_use_sma': True, 'sideways_use_ema': True, 'sideways_use_atr': False, 'sideways_use_adx': True, 'sideways_use_spike': True, 'sideways_rsi_required': True}.
[I 2025-08-30 14:46:35,878] Trial 217 finished with values: [-1000000000.0, 1000000000.0] and parameters: {'p_sma': 32, 'p_std': 18, 'p_atr': 13, 'p_adx': 22, 'rsi_period': 81, 'ema1': 26, 'ema2': 51, 'slip_atr_k': 0.1542679190745316, 'slip_spread_k': 0.6627680270155692, 'spread_hl_frac': 0.021105557873014463, 'bb_std_mult': 1.952438240010249, 'rsi_os': 33, 'rsi_ob': 90, 'vol_spike': 0.09598717619072905, 'adx_thresh': 21.179393209004456, 'atr_min_pct': 0.02011669853942509, 'atr_max_pct': 0.1063904978648629, 'tp_mult': 2.941931335093886, 'tsl_mult': 0.9985785571942882, 'strategy': 'mean_reversion', 'time_stop': 83, 'use_sma': True, 'use_atr': False, 'use_adx': True, 'use_ema': False, 'use_spike': False, 'rsi_required': False, 'edge_k': 1.575071238362971, 'edge_cap': 0.6559982423192551, 'bull_strategy': 'mean_reversion', 'bull_bb_std_mult': 3.3366917768159765, 'bull_rsi_os': 15, 'bull_rsi_ob': 53, 'bull_adx_thresh': 9.864011750020891, 'bull_atr_min_pct': 0.02784190350368218, 'bull_atr_max_pct': 0.025428713070019298, 'bull_tp_mult': 2.1847611724661635, 'bull_tsl_mult': 0.5434940247300415, 'bull_time_stop': 264, 'bull_use_sma': False, 'bull_use_ema': False, 'bull_use_atr': False, 'bull_use_adx': True, 'bull_use_spike': False, 'bull_rsi_required': True, 'bear_strategy': 'breakout', 'bear_bb_std_mult': 1.0879708945595796, 'bear_rsi_os': 14, 'bear_rsi_ob': 69, 'bear_adx_thresh': 13.329587210589718, 'bear_atr_min_pct': 0.012033699261524347, 'bear_atr_max_pct': 0.030664087613151786, 'bear_tp_mult': 2.079685052206873, 'bear_tsl_mult': 0.45405366318950036, 'bear_time_stop': 209, 'bear_use_sma': False, 'bear_use_ema': False, 'bear_use_atr': False, 'bear_use_adx': False, 'bear_use_spike': True, 'bear_rsi_required': False, 'sideways_strategy': 'breakout', 'sideways_bb_std_mult': 1.4231578054490532, 'sideways_rsi_os': 31, 'sideways_rsi_ob': 88, 'sideways_adx_thresh': 32.91180228865642, 'sideways_atr_min_pct': 0.0032125864817853732, 'sideways_atr_max_pct': 0.08487705414354078, 'sideways_tp_mult': 2.6898975771304316, 'sideways_tsl_mult': 0.6976773165695254, 'sideways_time_stop': 135, 'sideways_use_sma': True, 'sideways_use_ema': False, 'sideways_use_atr': True, 'sideways_use_adx': False, 'sideways_use_spike': True, 'sideways_rsi_required': True}.
[I 2025-08-30 14:47:06,784] Trial 218 finished with values: [-1000000000.0, 1000000000.0] and parameters: {'p_sma': 48, 'p_std': 54, 'p_atr': 21, 'p_adx': 22, 'rsi_period': 27, 'ema1': 26, 'ema2': 16, 'slip_atr_k': 0.1690953174023245, 'slip_spread_k': 0.07133691329623748, 'spread_hl_frac': 0.02041914483055728, 'bb_std_mult': 1.9474732075881371, 'rsi_os': 28, 'rsi_ob': 73, 'vol_spike': 0.24323782404867403, 'adx_thresh': 31.044399704399304, 'atr_min_pct': 0.029305802789947023, 'atr_max_pct': 0.1065830001423697, 'tp_mult': 2.948370134139919, 'tsl_mult': 0.37805598380093985, 'strategy': 'mean_reversion', 'time_stop': 93, 'use_sma': True, 'use_atr': True, 'use_adx': False, 'use_ema': True, 'use_spike': False, 'rsi_required': False, 'edge_k': 0.14015694588897054, 'edge_cap': 0.6538941271461786, 'bull_strategy': 'mean_reversion', 'bull_bb_std_mult': 3.3604837118170416, 'bull_rsi_os': 15, 'bull_rsi_ob': 53, 'bull_adx_thresh': 11.611704957931137, 'bull_atr_min_pct': 0.01413510241279958, 'bull_atr_max_pct': 0.05395956759303784, 'bull_tp_mult': 1.4117551831802788, 'bull_tsl_mult': 0.7363949436702913, 'bull_time_stop': 265, 'bull_use_sma': False, 'bull_use_ema': False, 'bull_use_atr': True, 'bull_use_adx': True, 'bull_use_spike': False, 'bull_rsi_required': True, 'bear_strategy': 'breakout', 'bear_bb_std_mult': 1.5779663792583412, 'bear_rsi_os': 33, 'bear_rsi_ob': 84, 'bear_adx_thresh': 10.190321175769077, 'bear_atr_min_pct': 0.011571863128665788, 'bear_atr_max_pct': 0.0343896713286372, 'bear_tp_mult': 1.35551025601583, 'bear_tsl_mult': 0.18607906819824727, 'bear_time_stop': 233, 'bear_use_sma': False, 'bear_use_ema': False, 'bear_use_atr': False, 'bear_use_adx': False, 'bear_use_spike': True, 'bear_rsi_required': False, 'sideways_strategy': 'mean_reversion', 'sideways_bb_std_mult': 1.0389336911883766, 'sideways_rsi_os': 20, 'sideways_rsi_ob': 88, 'sideways_adx_thresh': 24.584895248204152, 'sideways_atr_min_pct': 0.003242195088614486, 'sideways_atr_max_pct': 0.08568293625778885, 'sideways_tp_mult': 2.648976106117589, 'sideways_tsl_mult': 0.6944396728875972, 'sideways_time_stop': 216, 'sideways_use_sma': False, 'sideways_use_ema': False, 'sideways_use_atr': True, 'sideways_use_adx': False, 'sideways_use_spike': True, 'sideways_rsi_required': True}.
[I 2025-08-30 14:47:07,739] Trial 219 finished with values: [-1000000000.0, 1000000000.0] and parameters: {'p_sma': 48, 'p_std': 54, 'p_atr': 10, 'p_adx': 11, 'rsi_period': 64, 'ema1': 15, 'ema2': 51, 'slip_atr_k': 0.06488259461357977, 'slip_spread_k': 0.6579139561082622, 'spread_hl_frac': 0.020436961897058535, 'bb_std_mult': 2.1441480469140464, 'rsi_os': 30, 'rsi_ob': 92, 'vol_spike': 0.24371353652328528, 'adx_thresh': 15.82218717359363, 'atr_min_pct': 0.017298022223250067, 'atr_max_pct': 0.10750190989712716, 'tp_mult': 2.5187806082940414, 'tsl_mult': 0.9987055883809048, 'strategy': 'mean_reversion', 'time_stop': 40, 'use_sma': True, 'use_atr': False, 'use_adx': False, 'use_ema': False, 'use_spike': False, 'rsi_required': False, 'edge_k': 0.7245705995638759, 'edge_cap': 0.5643125834320899, 'bull_strategy': 'mean_reversion', 'bull_bb_std_mult': 0.5062309297056529, 'bull_rsi_os': 15, 'bull_rsi_ob': 78, 'bull_adx_thresh': 11.4843375719788, 'bull_atr_min_pct': 0.004755846559565815, 'bull_atr_max_pct': 0.1214527200197259, 'bull_tp_mult': 1.4168104798774477, 'bull_tsl_mult': 0.5347488980679348, 'bull_time_stop': 265, 'bull_use_sma': False, 'bull_use_ema': False, 'bull_use_atr': True, 'bull_use_adx': True, 'bull_use_spike': True, 'bull_rsi_required': False, 'bear_strategy': 'breakout', 'bear_bb_std_mult': 1.544067555694284, 'bear_rsi_os': 16, 'bear_rsi_ob': 70, 'bear_adx_thresh': 13.638356093176988, 'bear_atr_min_pct': 0.015980123590598666, 'bear_atr_max_pct': 0.03321961282601159, 'bear_tp_mult': 2.350418929475064, 'bear_tsl_mult': 0.19009810533850047, 'bear_time_stop': 36, 'bear_use_sma': False, 'bear_use_ema': False, 'bear_use_atr': False, 'bear_use_adx': False, 'bear_use_spike': True, 'bear_rsi_required': True, 'sideways_strategy': 'mean_reversion', 'sideways_bb_std_mult': 2.9825953585006246, 'sideways_rsi_os': 31, 'sideways_rsi_ob': 61, 'sideways_adx_thresh': 16.535805509058083, 'sideways_atr_min_pct': 0.0034494410123292185, 'sideways_atr_max_pct': 0.0325688019019463, 'sideways_tp_mult': 1.3352175885339048, 'sideways_tsl_mult': 0.15164677496690815, 'sideways_time_stop': 216, 'sideways_use_sma': True, 'sideways_use_ema': True, 'sideways_use_atr': True, 'sideways_use_adx': False, 'sideways_use_spike': True, 'sideways_rsi_required': True}.
[I 2025-08-30 14:47:07,944] Trial 220 finished with values: [-1000000000.0, 1000000000.0] and parameters: {'p_sma': 32, 'p_std': 6, 'p_atr': 20, 'p_adx': 22, 'rsi_period': 27, 'ema1': 17, 'ema2': 51, 'slip_atr_k': 0.16894924988396406, 'slip_spread_k': 0.07635174369590186, 'spread_hl_frac': 0.020751339797578774, 'bb_std_mult': 1.962483102024562, 'rsi_os': 30, 'rsi_ob': 90, 'vol_spike': 0.15171666909777695, 'adx_thresh': 6.7448598391518395, 'atr_min_pct': 0.017037320566595925, 'atr_max_pct': 0.10635787383754663, 'tp_mult': 1.9427836303925254, 'tsl_mult': 0.9599959740094332, 'strategy': 'breakout', 'time_stop': 39, 'use_sma': True, 'use_atr': False, 'use_adx': False, 'use_ema': False, 'use_spike': True, 'rsi_required': True, 'edge_k': 1.5650939854345391, 'edge_cap': 0.4961782095388522, 'bull_strategy': 'mean_reversion', 'bull_bb_std_mult': 0.5111104948149019, 'bull_rsi_os': 18, 'bull_rsi_ob': 53, 'bull_adx_thresh': 11.678554797793852, 'bull_atr_min_pct': 0.02527889820352592, 'bull_atr_max_pct': 0.1196356934250071, 'bull_tp_mult': 1.4129165295793373, 'bull_tsl_mult': 0.942048315076253, 'bull_time_stop': 276, 'bull_use_sma': False, 'bull_use_ema': False, 'bull_use_atr': True, 'bull_use_adx': True, 'bull_use_spike': False, 'bull_rsi_required': True, 'bear_strategy': 'breakout', 'bear_bb_std_mult': 0.7705218077832586, 'bear_rsi_os': 17, 'bear_rsi_ob': 71, 'bear_adx_thresh': 13.510634581756506, 'bear_atr_min_pct': 0.01810521332658349, 'bear_atr_max_pct': 0.0322053998831573, 'bear_tp_mult': 2.3836997669377284, 'bear_tsl_mult': 0.19106880486411215, 'bear_time_stop': 232, 'bear_use_sma': False, 'bear_use_ema': False, 'bear_use_atr': False, 'bear_use_adx': False, 'bear_use_spike': True, 'bear_rsi_required': False, 'sideways_strategy': 'mean_reversion', 'sideways_bb_std_mult': 2.987082528256281, 'sideways_rsi_os': 42, 'sideways_rsi_ob': 88, 'sideways_adx_thresh': 32.33489399723636, 'sideways_atr_min_pct': 0.0036761013843369587, 'sideways_atr_max_pct': 0.032618452032985495, 'sideways_tp_mult': 2.644177747300996, 'sideways_tsl_mult': 0.5068829748542063, 'sideways_time_stop': 11, 'sideways_use_sma': False, 'sideways_use_ema': False, 'sideways_use_atr': True, 'sideways_use_adx': False, 'sideways_use_spike': True, 'sideways_rsi_required': True}.
[I 2025-08-30 14:47:08,162] Trial 221 finished with values: [-1000000000.0, 1000000000.0] and parameters: {'p_sma': 48, 'p_std': 53, 'p_atr': 21, 'p_adx': 17, 'rsi_period': 78, 'ema1': 15, 'ema2': 49, 'slip_atr_k': 0.06772150271903371, 'slip_spread_k': 0.5658865352883794, 'spread_hl_frac': 0.002250084853847229, 'bb_std_mult': 2.15485226707267, 'rsi_os': 37, 'rsi_ob': 70, 'vol_spike': 0.24140204870003623, 'adx_thresh': 6.93804434895935, 'atr_min_pct': 0.013388176263041302, 'atr_max_pct': 0.0781506238389869, 'tp_mult': 1.4378642665552355, 'tsl_mult': 0.37639112100276595, 'strategy': 'breakout', 'time_stop': 40, 'use_sma': True, 'use_atr': False, 'use_adx': False, 'use_ema': False, 'use_spike': True, 'rsi_required': True, 'edge_k': 1.6943604680092839, 'edge_cap': 0.16123314846402287, 'bull_strategy': 'mean_reversion', 'bull_bb_std_mult': 3.0446290485058607, 'bull_rsi_os': 17, 'bull_rsi_ob': 81, 'bull_adx_thresh': 11.472274289098673, 'bull_atr_min_pct': 0.004976704378269086, 'bull_atr_max_pct': 0.05478193563878575, 'bull_tp_mult': 2.7444200621334183, 'bull_tsl_mult': 0.594480787024936, 'bull_time_stop': 175, 'bull_use_sma': False, 'bull_use_ema': False, 'bull_use_atr': True, 'bull_use_adx': True, 'bull_use_spike': False, 'bull_rsi_required': True, 'bear_strategy': 'breakout', 'bear_bb_std_mult': 0.60305467394497, 'bear_rsi_os': 16, 'bear_rsi_ob': 90, 'bear_adx_thresh': 19.212718024992892, 'bear_atr_min_pct': 0.016065043806724508, 'bear_atr_max_pct': 0.0329704306041266, 'bear_tp_mult': 1.5905983349555213, 'bear_tsl_mult': 0.1934912749873962, 'bear_time_stop': 98, 'bear_use_sma': True, 'bear_use_ema': False, 'bear_use_atr': False, 'bear_use_adx': False, 'bear_use_spike': True, 'bear_rsi_required': False, 'sideways_strategy': 'mean_reversion', 'sideways_bb_std_mult': 0.9921757286035244, 'sideways_rsi_os': 33, 'sideways_rsi_ob': 91, 'sideways_adx_thresh': 19.88209782856393, 'sideways_atr_min_pct': 0.013306624652512557, 'sideways_atr_max_pct': 0.040679586528653784, 'sideways_tp_mult': 2.7405382155753633, 'sideways_tsl_mult': 0.3343226734241842, 'sideways_time_stop': 7, 'sideways_use_sma': False, 'sideways_use_ema': False, 'sideways_use_atr': True, 'sideways_use_adx': False, 'sideways_use_spike': True, 'sideways_rsi_required': True}.
[I 2025-08-30 14:47:38,951] Trial 224 finished with values: [-1000000000.0, 1000000000.0] and parameters: {'p_sma': 58, 'p_std': 26, 'p_atr': 16, 'p_adx': 17, 'rsi_period': 51, 'ema1': 28, 'ema2': 26, 'slip_atr_k': 0.010775773210650014, 'slip_spread_k': 0.5920292455100353, 'spread_hl_frac': 0.0001855955936112142, 'bb_std_mult': 0.6112903513821417, 'rsi_os': 34, 'rsi_ob': 91, 'vol_spike': 0.25119863465123005, 'adx_thresh': 20.373925764508826, 'atr_min_pct': 0.009546958977595454, 'atr_max_pct': 0.139308970765885, 'tp_mult': 1.4224800189252074, 'tsl_mult': 0.9783586841986033, 'strategy': 'mean_reversion', 'time_stop': 22, 'use_sma': False, 'use_atr': False, 'use_adx': True, 'use_ema': False, 'use_spike': False, 'rsi_required': False, 'edge_k': 1.7006898201810297, 'edge_cap': 0.2745249873868904, 'bull_strategy': 'breakout', 'bull_bb_std_mult': 1.253992488121054, 'bull_rsi_os': 17, 'bull_rsi_ob': 59, 'bull_adx_thresh': 13.302272557345391, 'bull_atr_min_pct': 0.0026085456600308844, 'bull_atr_max_pct': 0.02139349219985176, 'bull_tp_mult': 2.1010468599637844, 'bull_tsl_mult': 0.5098126949688907, 'bull_time_stop': 227, 'bull_use_sma': True, 'bull_use_ema': True, 'bull_use_atr': True, 'bull_use_adx': False, 'bull_use_spike': False, 'bull_rsi_required': True, 'bear_strategy': 'breakout', 'bear_bb_std_mult': 0.5951774374775629, 'bear_rsi_os': 7, 'bear_rsi_ob': 89, 'bear_adx_thresh': 5.885757921868468, 'bear_atr_min_pct': 0.016987028164850277, 'bear_atr_max_pct': 0.1178631514930408, 'bear_tp_mult': 2.022681441996697, 'bear_tsl_mult': 0.24084267720907787, 'bear_time_stop': 33, 'bear_use_sma': True, 'bear_use_ema': True, 'bear_use_atr': True, 'bear_use_adx': False, 'bear_use_spike': False, 'bear_rsi_required': False, 'sideways_strategy': 'breakout', 'sideways_bb_std_mult': 3.141855432912161, 'sideways_rsi_os': 32, 'sideways_rsi_ob': 91, 'sideways_adx_thresh': 19.890228465077602, 'sideways_atr_min_pct': 0.013383788064759952, 'sideways_atr_max_pct': 0.07774836259947694, 'sideways_tp_mult': 2.729503226635938, 'sideways_tsl_mult': 0.8413555122448286, 'sideways_time_stop': 234, 'sideways_use_sma': False, 'sideways_use_ema': False, 'sideways_use_atr': False, 'sideways_use_adx': True, 'sideways_use_spike': True, 'sideways_rsi_required': False}.
[I 2025-08-30 14:47:39,451] Trial 222 finished with values: [-1000000000.0, 1000000000.0] and parameters: {'p_sma': 10, 'p_std': 32, 'p_atr': 24, 'p_adx': 17, 'rsi_period': 8, 'ema1': 27, 'ema2': 27, 'slip_atr_k': 0.013948285100661536, 'slip_spread_k': 0.24382216562423464, 'spread_hl_frac': 0.0033180608367608774, 'bb_std_mult': 2.7178085033894677, 'rsi_os': 37, 'rsi_ob': 71, 'vol_spike': 0.2732487510474887, 'adx_thresh': 20.386405902030205, 'atr_min_pct': 0.012282027979189316, 'atr_max_pct': 0.07811842153730526, 'tp_mult': 2.639345938776544, 'tsl_mult': 0.9604760074803688, 'strategy': 'breakout', 'time_stop': 40, 'use_sma': True, 'use_atr': False, 'use_adx': False, 'use_ema': False, 'use_spike': True, 'rsi_required': True, 'edge_k': 1.6944481251260384, 'edge_cap': 0.1032064822520033, 'bull_strategy': 'breakout', 'bull_bb_std_mult': 0.5115733282391914, 'bull_rsi_os': 17, 'bull_rsi_ob': 59, 'bull_adx_thresh': 13.404484073176944, 'bull_atr_min_pct': 0.025308340941672294, 'bull_atr_max_pct': 0.021532931289869838, 'bull_tp_mult': 2.7814841392733443, 'bull_tsl_mult': 0.5341841054396758, 'bull_time_stop': 77, 'bull_use_sma': False, 'bull_use_ema': False, 'bull_use_atr': True, 'bull_use_adx': True, 'bull_use_spike': False, 'bull_rsi_required': True, 'bear_strategy': 'breakout', 'bear_bb_std_mult': 1.78622049334763, 'bear_rsi_os': 17, 'bear_rsi_ob': 49, 'bear_adx_thresh': 19.198049161748834, 'bear_atr_min_pct': 0.01815330258647223, 'bear_atr_max_pct': 0.14645960757733023, 'bear_tp_mult': 2.0234853021101964, 'bear_tsl_mult': 0.19860622836473174, 'bear_time_stop': 123, 'bear_use_sma': True, 'bear_use_ema': False, 'bear_use_atr': False, 'bear_use_adx': False, 'bear_use_spike': False, 'bear_rsi_required': False, 'sideways_strategy': 'mean_reversion', 'sideways_bb_std_mult': 3.1276343406566682, 'sideways_rsi_os': 33, 'sideways_rsi_ob': 51, 'sideways_adx_thresh': 11.273268183590792, 'sideways_atr_min_pct': 0.029051112114413094, 'sideways_atr_max_pct': 0.03314181483991475, 'sideways_tp_mult': 2.7413575889902737, 'sideways_tsl_mult': 0.16001402956179436, 'sideways_time_stop': 234, 'sideways_use_sma': False, 'sideways_use_ema': True, 'sideways_use_atr': False, 'sideways_use_adx': True, 'sideways_use_spike': True, 'sideways_rsi_required': True}.
[I 2025-08-30 14:47:39,551] Trial 225 finished with values: [-1000000000.0, 1000000000.0] and parameters: {'p_sma': 9, 'p_std': 26, 'p_atr': 9, 'p_adx': 28, 'rsi_period': 7, 'ema1': 28, 'ema2': 27, 'slip_atr_k': 0.09802876791163137, 'slip_spread_k': 0.23906865829958987, 'spread_hl_frac': 0.0043421310532476744, 'bb_std_mult': 2.0263203486815784, 'rsi_os': 34, 'rsi_ob': 91, 'vol_spike': 0.10393849365534763, 'adx_thresh': 20.313498642236766, 'atr_min_pct': 0.02076957040029881, 'atr_max_pct': 0.11200476614796828, 'tp_mult': 1.6649168007287234, 'tsl_mult': 0.575014875727778, 'strategy': 'mean_reversion', 'time_stop': 20, 'use_sma': False, 'use_atr': False, 'use_adx': True, 'use_ema': False, 'use_spike': False, 'rsi_required': False, 'edge_k': 1.6598965485931496, 'edge_cap': 0.7227836041873749, 'bull_strategy': 'breakout', 'bull_bb_std_mult': 1.2891040209834261, 'bull_rsi_os': 41, 'bull_rsi_ob': 67, 'bull_adx_thresh': 13.31934838843477, 'bull_atr_min_pct': 0.0026377768202989326, 'bull_atr_max_pct': 0.021081968208211708, 'bull_tp_mult': 1.4746571693936432, 'bull_tsl_mult': 0.5138245939809286, 'bull_time_stop': 275, 'bull_use_sma': True, 'bull_use_ema': True, 'bull_use_atr': True, 'bull_use_adx': False, 'bull_use_spike': False, 'bull_rsi_required': True, 'bear_strategy': 'breakout', 'bear_bb_std_mult': 2.8376760981022344, 'bear_rsi_os': 7, 'bear_rsi_ob': 49, 'bear_adx_thresh': 17.72689567532018, 'bear_atr_min_pct': 0.010771176268101323, 'bear_atr_max_pct': 0.09883889128986578, 'bear_tp_mult': 2.0193812413073142, 'bear_tsl_mult': 0.24339490284853182, 'bear_time_stop': 31, 'bear_use_sma': True, 'bear_use_ema': True, 'bear_use_atr': True, 'bear_use_adx': False, 'bear_use_spike': False, 'bear_rsi_required': False, 'sideways_strategy': 'breakout', 'sideways_bb_std_mult': 3.1292460322045867, 'sideways_rsi_os': 32, 'sideways_rsi_ob': 48, 'sideways_adx_thresh': 11.821806043601457, 'sideways_atr_min_pct': 0.0044659876164333135, 'sideways_atr_max_pct': 0.08058426727981614, 'sideways_tp_mult': 1.2322828687460736, 'sideways_tsl_mult': 0.25653629728771066, 'sideways_time_stop': 235, 'sideways_use_sma': False, 'sideways_use_ema': False, 'sideways_use_atr': False, 'sideways_use_adx': True, 'sideways_use_spike': True, 'sideways_rsi_required': False}.
