[I 2025-08-30 15:48:15,487] Trial 557 finished with values: [-1000000000.0, 1000000000.0] and parameters: {'p_sma': 5, 'p_std': 16, 'p_atr': 14, 'p_adx': 25, 'rsi_period': 16, 'ema1': 21, 'ema2': 33, 'slip_atr_k': 0.17644122348573732, 'slip_spread_k': 0.062290505058324876, 'spread_hl_frac': 0.0279874492865476, 'bb_std_mult': 0.9812464989715851, 'rsi_os': 25, 'rsi_ob': 74, 'vol_spike': 0.16206393886732873, 'adx_thresh': 5.99453571441471, 'atr_min_pct': 0.01246675550607188, 'atr_max_pct': 0.13493891354582532, 'tp_mult': 1.7313402701575182, 'tsl_mult': 0.7318051861429312, 'strategy': 'breakout', 'time_stop': 129, 'use_sma': False, 'use_atr': True, 'use_adx': False, 'use_ema': True, 'use_spike': True, 'rsi_required': True, 'edge_k': 0.18365907910322138, 'edge_cap': 0.5203140463033338, 'bull_strategy': 'mean_reversion', 'bull_bb_std_mult': 2.575915674395633, 'bull_rsi_os': 37, 'bull_rsi_ob': 50, 'bull_adx_thresh': 5.746686159764062, 'bull_atr_min_pct': 0.02077668623011707, 'bull_atr_max_pct': 0.0657453571588974, 'bull_tp_mult': 2.407771249023284, 'bull_tsl_mult': 0.3381543612982146, 'bull_time_stop': 153, 'bull_use_sma': False, 'bull_use_ema': False, 'bull_use_atr': False, 'bull_use_adx': False, 'bull_use_spike': True, 'bull_rsi_required': False, 'bear_strategy': 'mean_reversion', 'bear_bb_std_mult': 0.7646931014422178, 'bear_rsi_os': 28, 'bear_rsi_ob': 59, 'bear_adx_thresh': 28.864422269602382, 'bear_atr_min_pct': 0.019970660574831336, 'bear_atr_max_pct': 0.06487640272068283, 'bear_tp_mult': 2.6953814839528287, 'bear_tsl_mult': 0.9829475037039052, 'bear_time_stop': 65, 'bear_use_sma': True, 'bear_use_ema': True, 'bear_use_atr': True, 'bear_use_adx': True, 'bear_use_spike': False, 'bear_rsi_required': True, 'sideways_strategy': 'breakout', 'sideways_bb_std_mult': 2.4620879781818457, 'sideways_rsi_os': 23, 'sideways_rsi_ob': 48, 'sideways_adx_thresh': 26.221276567049376, 'sideways_atr_min_pct': 0.0015865848145277675, 'sideways_atr_max_pct': 0.09947017859782745, 'sideways_tp_mult': 1.3288026958647654, 'sideways_tsl_mult': 0.9963124204618816, 'sideways_time_stop': 256, 'sideways_use_sma': True, 'sideways_use_ema': True, 'sideways_use_atr': True, 'sideways_use_adx': False, 'sideways_use_spike': False, 'sideways_rsi_required': False}.
[I 2025-08-30 15:48:15,526] Trial 558 finished with values: [-0.09413991299201385, 0.094096049629635] and parameters: {'p_sma': 39, 'p_std': 59, 'p_atr': 14, 'p_adx': 17, 'rsi_period': 36, 'ema1': 13, 'ema2': 33, 'slip_atr_k': 0.1859048524131921, 'slip_spread_k': 0.9413517797174017, 'spread_hl_frac': 0.028065057336443964, 'bb_std_mult': 0.9964139450733889, 'rsi_os': 6, 'rsi_ob': 74, 'vol_spike': 0.16050810254395326, 'adx_thresh': 11.332902014897794, 'atr_min_pct': 0.01485389446208334, 'atr_max_pct': 0.026990279556484753, 'tp_mult': 1.7226638963373955, 'tsl_mult': 0.7857571988227802, 'strategy': 'breakout', 'time_stop': 71, 'use_sma': False, 'use_atr': True, 'use_adx': True, 'use_ema': True, 'use_spike': True, 'rsi_required': True, 'edge_k': 0.8035946176653027, 'edge_cap': 0.5164285573455918, 'bull_strategy': 'mean_reversion', 'bull_bb_std_mult': 2.6813291711541423, 'bull_rsi_os': 51, 'bull_rsi_ob': 48, 'bull_adx_thresh': 21.916261602541002, 'bull_atr_min_pct': 0.02207477955474348, 'bull_atr_max_pct': 0.11007571750716355, 'bull_tp_mult': 2.1756098140181814, 'bull_tsl_mult': 0.8454013604139514, 'bull_time_stop': 170, 'bull_use_sma': False, 'bull_use_ema': False, 'bull_use_atr': False, 'bull_use_adx': True, 'bull_use_spike': True, 'bull_rsi_required': False, 'bear_strategy': 'mean_reversion', 'bear_bb_std_mult': 0.7281261911923802, 'bear_rsi_os': 36, 'bear_rsi_ob': 76, 'bear_adx_thresh': 29.914095266812442, 'bear_atr_min_pct': 0.02029094857394445, 'bear_atr_max_pct': 0.07539600579568226, 'bear_tp_mult': 1.4969140332633182, 'bear_tsl_mult': 0.7034546425001184, 'bear_time_stop': 65, 'bear_use_sma': True, 'bear_use_ema': True, 'bear_use_atr': True, 'bear_use_adx': False, 'bear_use_spike': False, 'bear_rsi_required': True, 'sideways_strategy': 'breakout', 'sideways_bb_std_mult': 0.9329052256368611, 'sideways_rsi_os': 44, 'sideways_rsi_ob': 59, 'sideways_adx_thresh': 26.881420841327333, 'sideways_atr_min_pct': 0.0016434886055656695, 'sideways_atr_max_pct': 0.051788194227528755, 'sideways_tp_mult': 1.3394050693115602, 'sideways_tsl_mult': 0.9830265733337656, 'sideways_time_stop': 71, 'sideways_use_sma': True, 'sideways_use_ema': False, 'sideways_use_atr': True, 'sideways_use_adx': False, 'sideways_use_spike': False, 'sideways_rsi_required': False}.
[I 2025-08-30 15:48:16,438] Trial 559 finished with values: [-0.09097165889324643, 0.09094395693211856] and parameters: {'p_sma': 47, 'p_std': 59, 'p_atr': 24, 'p_adx': 26, 'rsi_period': 76, 'ema1': 21, 'ema2': 33, 'slip_atr_k': 0.10139786616258978, 'slip_spread_k': 0.16698408105210555, 'spread_hl_frac': 0.02803025245685168, 'bb_std_mult': 1.6705699059364574, 'rsi_os': 7, 'rsi_ob': 74, 'vol_spike': 0.15975126249511043, 'adx_thresh': 13.995987288452737, 'atr_min_pct': 0.022933564102983854, 'atr_max_pct': 0.13433488115523462, 'tp_mult': 1.7310631202110742, 'tsl_mult': 0.2807684505958108, 'strategy': 'breakout', 'time_stop': 129, 'use_sma': False, 'use_atr': True, 'use_adx': False, 'use_ema': True, 'use_spike': True, 'rsi_required': True, 'edge_k': 0.8088478755793249, 'edge_cap': 0.520857801796194, 'bull_strategy': 'mean_reversion', 'bull_bb_std_mult': 0.812011802327411, 'bull_rsi_os': 37, 'bull_rsi_ob': 48, 'bull_adx_thresh': 21.958703341313182, 'bull_atr_min_pct': 0.010594683032719487, 'bull_atr_max_pct': 0.09532129328600258, 'bull_tp_mult': 2.0692490467948863, 'bull_tsl_mult': 0.34130230327321176, 'bull_time_stop': 168, 'bull_use_sma': False, 'bull_use_ema': False, 'bull_use_atr': False, 'bull_use_adx': True, 'bull_use_spike': True, 'bull_rsi_required': False, 'bear_strategy': 'mean_reversion', 'bear_bb_std_mult': 0.7904949900082037, 'bear_rsi_os': 25, 'bear_rsi_ob': 76, 'bear_adx_thresh': 29.82827842238414, 'bear_atr_min_pct': 0.020308495788114788, 'bear_atr_max_pct': 0.07426254511796448, 'bear_tp_mult': 1.6376259872622914, 'bear_tsl_mult': 0.9792099946323336, 'bear_time_stop': 62, 'bear_use_sma': True, 'bear_use_ema': True, 'bear_use_atr': True, 'bear_use_adx': False, 'bear_use_spike': False, 'bear_rsi_required': True, 'sideways_strategy': 'breakout', 'sideways_bb_std_mult': 2.4596700561316798, 'sideways_rsi_os': 44, 'sideways_rsi_ob': 53, 'sideways_adx_thresh': 26.853493916084847, 'sideways_atr_min_pct': 1.2706907837632675e-05, 'sideways_atr_max_pct': 0.0610459200366989, 'sideways_tp_mult': 2.461097552179825, 'sideways_tsl_mult': 0.9866578982593153, 'sideways_time_stop': 97, 'sideways_use_sma': True, 'sideways_use_ema': False, 'sideways_use_atr': True, 'sideways_use_adx': False, 'sideways_use_spike': False, 'sideways_rsi_required': False}.
[I 2025-08-30 15:48:17,831] Trial 561 finished with values: [-1000000000.0, 1000000000.0] and parameters: {'p_sma': 5, 'p_std': 56, 'p_atr': 16, 'p_adx': 25, 'rsi_period': 75, 'ema1': 29, 'ema2': 56, 'slip_atr_k': 0.185891086610435, 'slip_spread_k': 0.05636154541079763, 'spread_hl_frac': 0.028185683359983296, 'bb_std_mult': 1.363047559711001, 'rsi_os': 7, 'rsi_ob': 74, 'vol_spike': 0.05792460611625094, 'adx_thresh': 12.490653837758016, 'atr_min_pct': 0.024309920535788655, 'atr_max_pct': 0.013860503369321445, 'tp_mult': 1.7171491581564444, 'tsl_mult': 0.791839923546056, 'strategy': 'breakout', 'time_stop': 293, 'use_sma': False, 'use_atr': True, 'use_adx': False, 'use_ema': True, 'use_spike': True, 'rsi_required': True, 'edge_k': 0.18617742720213046, 'edge_cap': 0.5155474097191561, 'bull_strategy': 'mean_reversion', 'bull_bb_std_mult': 2.577930335200574, 'bull_rsi_os': 45, 'bull_rsi_ob': 49, 'bull_adx_thresh': 21.84249024179255, 'bull_atr_min_pct': 0.020251336973591567, 'bull_atr_max_pct': 0.06730880076262342, 'bull_tp_mult': 2.246753517148056, 'bull_tsl_mult': 0.8490516313625346, 'bull_time_stop': 147, 'bull_use_sma': False, 'bull_use_ema': False, 'bull_use_atr': False, 'bull_use_adx': False, 'bull_use_spike': True, 'bull_rsi_required': False, 'bear_strategy': 'mean_reversion', 'bear_bb_std_mult': 0.7317452429813475, 'bear_rsi_os': 44, 'bear_rsi_ob': 74, 'bear_adx_thresh': 28.128739953386223, 'bear_atr_min_pct': 0.0072430199322275615, 'bear_atr_max_pct': 0.07461792650195065, 'bear_tp_mult': 2.2582466307799764, 'bear_tsl_mult': 0.8068330825296273, 'bear_time_stop': 65, 'bear_use_sma': True, 'bear_use_ema': False, 'bear_use_atr': True, 'bear_use_adx': False, 'bear_use_spike': False, 'bear_rsi_required': True, 'sideways_strategy': 'breakout', 'sideways_bb_std_mult': 2.0448127337206143, 'sideways_rsi_os': 44, 'sideways_rsi_ob': 52, 'sideways_adx_thresh': 26.97207408208504, 'sideways_atr_min_pct': 0.00038218446173725166, 'sideways_atr_max_pct': 0.0611752190734139, 'sideways_tp_mult': 2.3343548523355167, 'sideways_tsl_mult': 0.9978706921004253, 'sideways_time_stop': 103, 'sideways_use_sma': True, 'sideways_use_ema': True, 'sideways_use_atr': True, 'sideways_use_adx': False, 'sideways_use_spike': False, 'sideways_rsi_required': False}.
[I 2025-08-30 15:49:13,898] Trial 562 finished with values: [-0.017454719583358425, 0.01745561893468213] and parameters: {'p_sma': 5, 'p_std': 56, 'p_atr': 14, 'p_adx': 24, 'rsi_period': 75, 'ema1': 8, 'ema2': 44, 'slip_atr_k': 0.11484560795789009, 'slip_spread_k': 0.13671867986475011, 'spread_hl_frac': 0.02784558924801074, 'bb_std_mult': 1.3628729332841483, 'rsi_os': 12, 'rsi_ob': 55, 'vol_spike': 0.16606369971493787, 'adx_thresh': 12.36318727062026, 'atr_min_pct': 0.024418295322826432, 'atr_max_pct': 0.0754600518758968, 'tp_mult': 2.9882254439115945, 'tsl_mult': 0.7693467949182353, 'strategy': 'breakout', 'time_stop': 186, 'use_sma': False, 'use_atr': True, 'use_adx': False, 'use_ema': True, 'use_spike': True, 'rsi_required': True, 'edge_k': 0.19869891474324428, 'edge_cap': 0.11234141734091668, 'bull_strategy': 'mean_reversion', 'bull_bb_std_mult': 2.663394406405902, 'bull_rsi_os': 40, 'bull_rsi_ob': 48, 'bull_adx_thresh': 21.842425302162905, 'bull_atr_min_pct': 0.02018160315358919, 'bull_atr_max_pct': 0.14350708019340366, 'bull_tp_mult': 2.0714132610662754, 'bull_tsl_mult': 0.31210823428580975, 'bull_time_stop': 146, 'bull_use_sma': False, 'bull_use_ema': False, 'bull_use_atr': False, 'bull_use_adx': True, 'bull_use_spike': True, 'bull_rsi_required': False, 'bear_strategy': 'mean_reversion', 'bear_bb_std_mult': 0.5704701912210373, 'bear_rsi_os': 30, 'bear_rsi_ob': 76, 'bear_adx_thresh': 29.984833427619314, 'bear_atr_min_pct': 0.022539323435346013, 'bear_atr_max_pct': 0.07453766779644698, 'bear_tp_mult': 1.640715656837823, 'bear_tsl_mult': 0.869631481264003, 'bear_time_stop': 246, 'bear_use_sma': True, 'bear_use_ema': False, 'bear_use_atr': True, 'bear_use_adx': False, 'bear_use_spike': False, 'bear_rsi_required': True, 'sideways_strategy': 'breakout', 'sideways_bb_std_mult': 2.0031594171757234, 'sideways_rsi_os': 44, 'sideways_rsi_ob': 52, 'sideways_adx_thresh': 26.987932761190752, 'sideways_atr_min_pct': 0.000522826560443963, 'sideways_atr_max_pct': 0.13580209570039586, 'sideways_tp_mult': 2.468344929361699, 'sideways_tsl_mult': 0.9994905245131047, 'sideways_time_stop': 75, 'sideways_use_sma': True, 'sideways_use_ema': False, 'sideways_use_atr': True, 'sideways_use_adx': False, 'sideways_use_spike': True, 'sideways_rsi_required': False}.
[I 2025-08-30 15:49:15,055] Trial 564 finished with values: [-1000000000.0, 1000000000.0] and parameters: {'p_sma': 5, 'p_std': 56, 'p_atr': 20, 'p_adx': 12, 'rsi_period': 75, 'ema1': 9, 'ema2': 56, 'slip_atr_k': 0.06262618681189146, 'slip_spread_k': 0.1381564197396356, 'spread_hl_frac': 0.02634648196365505, 'bb_std_mult': 1.3548872021355847, 'rsi_os': 22, 'rsi_ob': 73, 'vol_spike': 0.10813911921809163, 'adx_thresh': 12.287242649179348, 'atr_min_pct': 0.0015496483405699393, 'atr_max_pct': 0.07545411889120714, 'tp_mult': 2.741109800240736, 'tsl_mult': 0.6899959792414896, 'strategy': 'breakout', 'time_stop': 122, 'use_sma': False, 'use_atr': True, 'use_adx': False, 'use_ema': True, 'use_spike': True, 'rsi_required': True, 'edge_k': 0.3436015021485115, 'edge_cap': 0.8724076934356872, 'bull_strategy': 'mean_reversion', 'bull_bb_std_mult': 2.414207089200105, 'bull_rsi_os': 40, 'bull_rsi_ob': 51, 'bull_adx_thresh': 19.442552063978603, 'bull_atr_min_pct': 0.020133855934649256, 'bull_atr_max_pct': 0.14198524104785365, 'bull_tp_mult': 2.141216361780518, 'bull_tsl_mult': 0.3105872531268044, 'bull_time_stop': 147, 'bull_use_sma': True, 'bull_use_ema': True, 'bull_use_atr': True, 'bull_use_adx': False, 'bull_use_spike': True, 'bull_rsi_required': False, 'bear_strategy': 'mean_reversion', 'bear_bb_std_mult': 0.5686858530180873, 'bear_rsi_os': 30, 'bear_rsi_ob': 74, 'bear_adx_thresh': 27.96103248974945, 'bear_atr_min_pct': 0.006692166642560643, 'bear_atr_max_pct': 0.10463177605345395, 'bear_tp_mult': 2.165152276325113, 'bear_tsl_mult': 0.8663292337311126, 'bear_time_stop': 163, 'bear_use_sma': True, 'bear_use_ema': False, 'bear_use_atr': True, 'bear_use_adx': False, 'bear_use_spike': False, 'bear_rsi_required': True, 'sideways_strategy': 'breakout', 'sideways_bb_std_mult': 2.9002056810168875, 'sideways_rsi_os': 41, 'sideways_rsi_ob': 58, 'sideways_adx_thresh': 28.42444353599035, 'sideways_atr_min_pct': 0.024569773145104647, 'sideways_atr_max_pct': 0.03778996062701381, 'sideways_tp_mult': 2.3634239137393585, 'sideways_tsl_mult': 0.9992833444433583, 'sideways_time_stop': 78, 'sideways_use_sma': True, 'sideways_use_ema': True, 'sideways_use_atr': True, 'sideways_use_adx': False, 'sideways_use_spike': True, 'sideways_rsi_required': False}.
[I 2025-08-30 15:49:16,334] Trial 563 finished with values: [-0.02962255237628053, 0.02961059422919037] and parameters: {'p_sma': 5, 'p_std': 13, 'p_atr': 24, 'p_adx': 12, 'rsi_period': 75, 'ema1': 29, 'ema2': 13, 'slip_atr_k': 0.06573116610910479, 'slip_spread_k': 0.16986595787548736, 'spread_hl_frac': 0.03583993947531492, 'bb_std_mult': 2.4018752546881252, 'rsi_os': 45, 'rsi_ob': 73, 'vol_spike': 0.055551891461276356, 'adx_thresh': 13.842630630281265, 'atr_min_pct': 0.001525674274477435, 'atr_max_pct': 0.075671116038429, 'tp_mult': 1.125751405480241, 'tsl_mult': 0.7622784941612417, 'strategy': 'breakout', 'time_stop': 122, 'use_sma': False, 'use_atr': True, 'use_adx': False, 'use_ema': True, 'use_spike': True, 'rsi_required': True, 'edge_k': 0.324056019511152, 'edge_cap': 0.8757167381564153, 'bull_strategy': 'mean_reversion', 'bull_bb_std_mult': 2.4231144838594756, 'bull_rsi_os': 40, 'bull_rsi_ob': 51, 'bull_adx_thresh': 20.750622027603985, 'bull_atr_min_pct': 0.02026612323915508, 'bull_atr_max_pct': 0.09601377105057032, 'bull_tp_mult': 1.2842502163064569, 'bull_tsl_mult': 0.3179740428684888, 'bull_time_stop': 170, 'bull_use_sma': True, 'bull_use_ema': True, 'bull_use_atr': True, 'bull_use_adx': False, 'bull_use_spike': True, 'bull_rsi_required': False, 'bear_strategy': 'mean_reversion', 'bear_bb_std_mult': 0.5958691759498315, 'bear_rsi_os': 44, 'bear_rsi_ob': 74, 'bear_adx_thresh': 27.668432851125097, 'bear_atr_min_pct': 0.022652693178096713, 'bear_atr_max_pct': 0.10442547339020986, 'bear_tp_mult': 2.2423624745269417, 'bear_tsl_mult': 0.9574249947969502, 'bear_time_stop': 72, 'bear_use_sma': True, 'bear_use_ema': False, 'bear_use_atr': True, 'bear_use_adx': False, 'bear_use_spike': False, 'bear_rsi_required': True, 'sideways_strategy': 'breakout', 'sideways_bb_std_mult': 2.042694010919307, 'sideways_rsi_os': 42, 'sideways_rsi_ob': 52, 'sideways_adx_thresh': 33.655880004120164, 'sideways_atr_min_pct': 0.00040038413739458453, 'sideways_atr_max_pct': 0.0267589840470817, 'sideways_tp_mult': 2.3483294488984003, 'sideways_tsl_mult': 0.9458786463324436, 'sideways_time_stop': 103, 'sideways_use_sma': True, 'sideways_use_ema': True, 'sideways_use_atr': True, 'sideways_use_adx': False, 'sideways_use_spike': True, 'sideways_rsi_required': False}.
[I 2025-08-30 15:49:17,805] Trial 565 finished with values: [-1000000000.0, 1000000000.0] and parameters: {'p_sma': 45, 'p_std': 13, 'p_atr': 15, 'p_adx': 12, 'rsi_period': 22, 'ema1': 30, 'ema2': 37, 'slip_atr_k': 0.06279625892010335, 'slip_spread_k': 0.7351178840121009, 'spread_hl_frac': 0.034769802208058934, 'bb_std_mult': 2.3831505713632524, 'rsi_os': 9, 'rsi_ob': 72, 'vol_spike': 0.16619177003380434, 'adx_thresh': 14.896634363218467, 'atr_min_pct': 0.0013882771047457887, 'atr_max_pct': 0.07573670595237834, 'tp_mult': 1.8881612059615365, 'tsl_mult': 0.3525298892558979, 'strategy': 'breakout', 'time_stop': 168, 'use_sma': False, 'use_atr': True, 'use_adx': False, 'use_ema': True, 'use_spike': True, 'rsi_required': True, 'edge_k': 1.9945476228649308, 'edge_cap': 0.8158514469599216, 'bull_strategy': 'mean_reversion', 'bull_bb_std_mult': 2.4432189107355233, 'bull_rsi_os': 40, 'bull_rsi_ob': 51, 'bull_adx_thresh': 20.77298799400062, 'bull_atr_min_pct': 0.01526025982635344, 'bull_atr_max_pct': 0.07242866093693753, 'bull_tp_mult': 2.1311808388743954, 'bull_tsl_mult': 0.30827187068097345, 'bull_time_stop': 159, 'bull_use_sma': True, 'bull_use_ema': True, 'bull_use_atr': True, 'bull_use_adx': False, 'bull_use_spike': True, 'bull_rsi_required': False, 'bear_strategy': 'mean_reversion', 'bear_bb_std_mult': 0.5854449802243026, 'bear_rsi_os': 42, 'bear_rsi_ob': 77, 'bear_adx_thresh': 6.976666183755942, 'bear_atr_min_pct': 0.022720582028760605, 'bear_atr_max_pct': 0.0697689777942923, 'bear_tp_mult': 1.5699132136316285, 'bear_tsl_mult': 0.7763084170270422, 'bear_time_stop': 179, 'bear_use_sma': True, 'bear_use_ema': False, 'bear_use_atr': True, 'bear_use_adx': False, 'bear_use_spike': False, 'bear_rsi_required': True, 'sideways_strategy': 'breakout', 'sideways_bb_std_mult': 2.893126765190101, 'sideways_rsi_os': 42, 'sideways_rsi_ob': 64, 'sideways_adx_thresh': 28.206169589684553, 'sideways_atr_min_pct': 0.016476331155985322, 'sideways_atr_max_pct': 0.10449150816755702, 'sideways_tp_mult': 1.4959270272331837, 'sideways_tsl_mult': 0.8845661320806537, 'sideways_time_stop': 87, 'sideways_use_sma': True, 'sideways_use_ema': True, 'sideways_use_atr': True, 'sideways_use_adx': False, 'sideways_use_spike': True, 'sideways_rsi_required': False}.
[I 2025-08-30 15:50:01,258] Trial 568 finished with values: [-1000000000.0, 1000000000.0] and parameters: {'p_sma': 7, 'p_std': 60, 'p_atr': 15, 'p_adx': 10, 'rsi_period': 77, 'ema1': 30, 'ema2': 37, 'slip_atr_k': 0.05576891705847899, 'slip_spread_k': 0.8692085285849253, 'spread_hl_frac': 0.023861171751294003, 'bb_std_mult': 0.5012459755009779, 'rsi_os': 23, 'rsi_ob': 72, 'vol_spike': 0.16772658114549743, 'adx_thresh': 14.968430791476813, 'atr_min_pct': 0.012044631483800354, 'atr_max_pct': 0.06507934028450833, 'tp_mult': 2.1037765451800987, 'tsl_mult': 0.3521180570224153, 'strategy': 'breakout', 'time_stop': 136, 'use_sma': False, 'use_atr': True, 'use_adx': False, 'use_ema': True, 'use_spike': False, 'rsi_required': False, 'edge_k': 0.2574965287979448, 'edge_cap': 0.6208986584139333, 'bull_strategy': 'breakout', 'bull_bb_std_mult': 0.9150465110160484, 'bull_rsi_os': 41, 'bull_rsi_ob': 55, 'bull_adx_thresh': 7.791729183365732, 'bull_atr_min_pct': 0.013491249516070227, 'bull_atr_max_pct': 0.07291222081036233, 'bull_tp_mult': 1.9827338251496294, 'bull_tsl_mult': 0.24750113134674195, 'bull_time_stop': 162, 'bull_use_sma': False, 'bull_use_ema': False, 'bull_use_atr': False, 'bull_use_adx': False, 'bull_use_spike': True, 'bull_rsi_required': False, 'bear_strategy': 'mean_reversion', 'bear_bb_std_mult': 2.172652464992258, 'bear_rsi_os': 29, 'bear_rsi_ob': 77, 'bear_adx_thresh': 5.150242151930035, 'bear_atr_min_pct': 0.0038295248427212374, 'bear_atr_max_pct': 0.07033881660213381, 'bear_tp_mult': 1.7038504034414754, 'bear_tsl_mult': 0.9532372473819922, 'bear_time_stop': 111, 'bear_use_sma': True, 'bear_use_ema': True, 'bear_use_atr': True, 'bear_use_adx': True, 'bear_use_spike': True, 'bear_rsi_required': True, 'sideways_strategy': 'breakout', 'sideways_bb_std_mult': 1.7357043824484766, 'sideways_rsi_os': 41, 'sideways_rsi_ob': 85, 'sideways_adx_thresh': 27.810715894617413, 'sideways_atr_min_pct': 0.01058582175969203, 'sideways_atr_max_pct': 0.10309735897758923, 'sideways_tp_mult': 1.8355311223491155, 'sideways_tsl_mult': 0.9743542491719761, 'sideways_time_stop': 87, 'sideways_use_sma': True, 'sideways_use_ema': True, 'sideways_use_atr': False, 'sideways_use_adx': True, 'sideways_use_spike': True, 'sideways_rsi_required': True}.
