[I 2025-08-30 15:22:42,169] Trial 439 finished with values: [-0.011823540274201516, 0.011744620009468661] and parameters: {'p_sma': 6, 'p_std': 60, 'p_atr': 14, 'p_adx': 26, 'rsi_period': 75, 'ema1': 12, 'ema2': 10, 'slip_atr_k': 0.06403029057835745, 'slip_spread_k': 0.11888480753219931, 'spread_hl_frac': 0.025809599506337697, 'bb_std_mult': 1.5029565007557304, 'rsi_os': 50, 'rsi_ob': 72, 'vol_spike': 0.15996350648026733, 'adx_thresh': 14.754574232681657, 'atr_min_pct': 0.006230629683356723, 'atr_max_pct': 0.010089817003099383, 'tp_mult': 1.7802232071541382, 'tsl_mult': 0.7267132655361489, 'strategy': 'breakout', 'time_stop': 56, 'use_sma': False, 'use_atr': True, 'use_adx': False, 'use_ema': True, 'use_spike': True, 'rsi_required': True, 'edge_k': 0.2607635211623748, 'edge_cap': 0.5247151347774489, 'bull_strategy': 'mean_reversion', 'bull_bb_std_mult': 1.6920253580486393, 'bull_rsi_os': 37, 'bull_rsi_ob': 48, 'bull_adx_thresh': 21.10053883914166, 'bull_atr_min_pct': 0.01911336199718703, 'bull_atr_max_pct': 0.12814389718749708, 'bull_tp_mult': 2.129102484632997, 'bull_tsl_mult': 0.4278564143869813, 'bull_time_stop': 153, 'bull_use_sma': False, 'bull_use_ema': False, 'bull_use_atr': False, 'bull_use_adx': False, 'bull_use_spike': True, 'bull_rsi_required': False, 'bear_strategy': 'mean_reversion', 'bear_bb_std_mult': 2.3667889918959792, 'bear_rsi_os': 27, 'bear_rsi_ob': 72, 'bear_adx_thresh': 29.424440790447427, 'bear_atr_min_pct': 0.022786274130856245, 'bear_atr_max_pct': 0.07591378768462423, 'bear_tp_mult': 1.4985377988001813, 'bear_tsl_mult': 0.9358027950301469, 'bear_time_stop': 70, 'bear_use_sma': True, 'bear_use_ema': True, 'bear_use_atr': True, 'bear_use_adx': False, 'bear_use_spike': False, 'bear_rsi_required': True, 'sideways_strategy': 'breakout', 'sideways_bb_std_mult': 2.0878531371351823, 'sideways_rsi_os': 42, 'sideways_rsi_ob': 61, 'sideways_adx_thresh': 27.96775265656786, 'sideways_atr_min_pct': 0.0006242903400284916, 'sideways_atr_max_pct': 0.09934720299978703, 'sideways_tp_mult': 2.9556767757835063, 'sideways_tsl_mult': 0.9711953742425726, 'sideways_time_stop': 91, 'sideways_use_sma': True, 'sideways_use_ema': True, 'sideways_use_atr': True, 'sideways_use_adx': False, 'sideways_use_spike': True, 'sideways_rsi_required': False}.
[I 2025-08-30 15:23:31,574] Trial 444 finished with values: [-1000000000.0, 1000000000.0] and parameters: {'p_sma': 6, 'p_std': 60, 'p_atr': 15, 'p_adx': 17, 'rsi_period': 79, 'ema1': 22, 'ema2': 35, 'slip_atr_k': 0.0720265932918097, 'slip_spread_k': 0.08605479545853373, 'spread_hl_frac': 0.02585263065247442, 'bb_std_mult': 0.7608312151108978, 'rsi_os': 25, 'rsi_ob': 60, 'vol_spike': 0.07128104721746892, 'adx_thresh': 13.07993287478924, 'atr_min_pct': 0.013352622752361487, 'atr_max_pct': 0.1199506089196737, 'tp_mult': 1.716313131061878, 'tsl_mult': 0.3973030563043279, 'strategy': 'breakout', 'time_stop': 270, 'use_sma': False, 'use_atr': True, 'use_adx': False, 'use_ema': True, 'use_spike': True, 'rsi_required': True, 'edge_k': 0.05805494597652755, 'edge_cap': 0.20669866563681755, 'bull_strategy': 'mean_reversion', 'bull_bb_std_mult': 2.6772758069331495, 'bull_rsi_os': 37, 'bull_rsi_ob': 48, 'bull_adx_thresh': 22.38552529110664, 'bull_atr_min_pct': 0.020634560710825863, 'bull_atr_max_pct': 0.07081707467949967, 'bull_tp_mult': 2.1304751405954994, 'bull_tsl_mult': 0.32317013099021247, 'bull_time_stop': 153, 'bull_use_sma': True, 'bull_use_ema': True, 'bull_use_atr': False, 'bull_use_adx': False, 'bull_use_spike': True, 'bull_rsi_required': False, 'bear_strategy': 'mean_reversion', 'bear_bb_std_mult': 0.5983836345036471, 'bear_rsi_os': 28, 'bear_rsi_ob': 77, 'bear_adx_thresh': 24.743588170758535, 'bear_atr_min_pct': 0.020568990706512493, 'bear_atr_max_pct': 0.0733852187848063, 'bear_tp_mult': 2.607274323616367, 'bear_tsl_mult': 0.999816540611342, 'bear_time_stop': 63, 'bear_use_sma': True, 'bear_use_ema': True, 'bear_use_atr': True, 'bear_use_adx': True, 'bear_use_spike': False, 'bear_rsi_required': True, 'sideways_strategy': 'breakout', 'sideways_bb_std_mult': 2.0837468121069387, 'sideways_rsi_os': 11, 'sideways_rsi_ob': 56, 'sideways_adx_thresh': 34.99630412633147, 'sideways_atr_min_pct': 0.0019768152770195135, 'sideways_atr_max_pct': 0.030793799746290547, 'sideways_tp_mult': 2.429852871829391, 'sideways_tsl_mult': 0.9799574527923882, 'sideways_time_stop': 84, 'sideways_use_sma': True, 'sideways_use_ema': True, 'sideways_use_atr': True, 'sideways_use_adx': False, 'sideways_use_spike': True, 'sideways_rsi_required': False}.
[I 2025-08-30 15:23:32,035] Trial 445 finished with values: [-1000000000.0, 1000000000.0] and parameters: {'p_sma': 6, 'p_std': 60, 'p_atr': 9, 'p_adx': 26, 'rsi_period': 79, 'ema1': 22, 'ema2': 34, 'slip_atr_k': 0.074419782762845, 'slip_spread_k': 0.13278616056040066, 'spread_hl_frac': 0.025786641511079605, 'bb_std_mult': 1.276890443931442, 'rsi_os': 8, 'rsi_ob': 60, 'vol_spike': 0.08969545764755085, 'adx_thresh': 12.84249439043201, 'atr_min_pct': 0.023962767359113818, 'atr_max_pct': 0.07569354173217556, 'tp_mult': 1.7162904387130056, 'tsl_mult': 0.6792634481259823, 'strategy': 'breakout', 'time_stop': 204, 'use_sma': False, 'use_atr': True, 'use_adx': False, 'use_ema': True, 'use_spike': True, 'rsi_required': True, 'edge_k': 0.1900984390623282, 'edge_cap': 0.37670451556009366, 'bull_strategy': 'mean_reversion', 'bull_bb_std_mult': 0.7605332749023241, 'bull_rsi_os': 39, 'bull_rsi_ob': 48, 'bull_adx_thresh': 33.93798022862667, 'bull_atr_min_pct': 0.020710986527442635, 'bull_atr_max_pct': 0.07106322837972191, 'bull_tp_mult': 2.1134436447747422, 'bull_tsl_mult': 0.3054017694243364, 'bull_time_stop': 154, 'bull_use_sma': True, 'bull_use_ema': False, 'bull_use_atr': False, 'bull_use_adx': False, 'bull_use_spike': True, 'bull_rsi_required': False, 'bear_strategy': 'mean_reversion', 'bear_bb_std_mult': 1.8684574598332802, 'bear_rsi_os': 28, 'bear_rsi_ob': 75, 'bear_adx_thresh': 28.219476499820246, 'bear_atr_min_pct': 0.02097401499009414, 'bear_atr_max_pct': 0.0731249774837035, 'bear_tp_mult': 1.5538344016294052, 'bear_tsl_mult': 0.9806474083475478, 'bear_time_stop': 62, 'bear_use_sma': True, 'bear_use_ema': True, 'bear_use_atr': True, 'bear_use_adx': False, 'bear_use_spike': False, 'bear_rsi_required': True, 'sideways_strategy': 'breakout', 'sideways_bb_std_mult': 2.1047594186150205, 'sideways_rsi_os': 43, 'sideways_rsi_ob': 56, 'sideways_adx_thresh': 27.69316588823561, 'sideways_atr_min_pct': 0.02921731294989173, 'sideways_atr_max_pct': 0.09881239076163778, 'sideways_tp_mult': 2.3999620971246856, 'sideways_tsl_mult': 0.9740551433847294, 'sideways_time_stop': 82, 'sideways_use_sma': True, 'sideways_use_ema': True, 'sideways_use_atr': True, 'sideways_use_adx': False, 'sideways_use_spike': True, 'sideways_rsi_required': False}.
[I 2025-08-30 15:23:32,307] Trial 442 finished with values: [-1000000000.0, 1000000000.0] and parameters: {'p_sma': 6, 'p_std': 60, 'p_atr': 15, 'p_adx': 26, 'rsi_period': 79, 'ema1': 23, 'ema2': 11, 'slip_atr_k': 0.06157969423276451, 'slip_spread_k': 0.12654761840854942, 'spread_hl_frac': 0.026138806204562045, 'bb_std_mult': 1.3983625744934263, 'rsi_os': 22, 'rsi_ob': 75, 'vol_spike': 0.07592802677882539, 'adx_thresh': 14.819096286189989, 'atr_min_pct': 0.013177786912796153, 'atr_max_pct': 0.0838164453704146, 'tp_mult': 1.774267648404257, 'tsl_mult': 0.7292573122853884, 'strategy': 'breakout', 'time_stop': 134, 'use_sma': False, 'use_atr': True, 'use_adx': False, 'use_ema': True, 'use_spike': True, 'rsi_required': True, 'edge_k': 0.31232067500397476, 'edge_cap': 0.9122748574764377, 'bull_strategy': 'mean_reversion', 'bull_bb_std_mult': 0.7339847935221584, 'bull_rsi_os': 36, 'bull_rsi_ob': 48, 'bull_adx_thresh': 22.178210628451577, 'bull_atr_min_pct': 0.01711567820134563, 'bull_atr_max_pct': 0.07217082169225096, 'bull_tp_mult': 2.141136602242521, 'bull_tsl_mult': 0.3239990615921392, 'bull_time_stop': 188, 'bull_use_sma': True, 'bull_use_ema': False, 'bull_use_atr': False, 'bull_use_adx': False, 'bull_use_spike': True, 'bull_rsi_required': False, 'bear_strategy': 'mean_reversion', 'bear_bb_std_mult': 0.7157311461218793, 'bear_rsi_os': 25, 'bear_rsi_ob': 72, 'bear_adx_thresh': 29.448762039594243, 'bear_atr_min_pct': 0.02265459253487298, 'bear_atr_max_pct': 0.07639768677753142, 'bear_tp_mult': 1.7862378129344623, 'bear_tsl_mult': 0.9451534740650208, 'bear_time_stop': 61, 'bear_use_sma': True, 'bear_use_ema': True, 'bear_use_atr': True, 'bear_use_adx': False, 'bear_use_spike': False, 'bear_rsi_required': True, 'sideways_strategy': 'breakout', 'sideways_bb_std_mult': 2.6455963280443107, 'sideways_rsi_os': 11, 'sideways_rsi_ob': 63, 'sideways_adx_thresh': 7.619477292904643, 'sideways_atr_min_pct': 0.0004559486548778016, 'sideways_atr_max_pct': 0.12226707801666295, 'sideways_tp_mult': 1.917258141749618, 'sideways_tsl_mult': 0.9732521602532727, 'sideways_time_stop': 92, 'sideways_use_sma': True, 'sideways_use_ema': True, 'sideways_use_atr': True, 'sideways_use_adx': False, 'sideways_use_spike': True, 'sideways_rsi_required': False}.
[I 2025-08-30 15:23:32,568] Trial 443 finished with values: [-1000000000.0, 1000000000.0] and parameters: {'p_sma': 46, 'p_std': 16, 'p_atr': 14, 'p_adx': 26, 'rsi_period': 68, 'ema1': 19, 'ema2': 34, 'slip_atr_k': 0.07481303615307552, 'slip_spread_k': 0.12804194201947416, 'spread_hl_frac': 0.026231433375135133, 'bb_std_mult': 0.7923151965165189, 'rsi_os': 27, 'rsi_ob': 72, 'vol_spike': 0.1828701035812342, 'adx_thresh': 34.98595058158189, 'atr_min_pct': 0.001991721647113741, 'atr_max_pct': 0.08768543017161662, 'tp_mult': 1.7085932085325468, 'tsl_mult': 0.7221336848823688, 'strategy': 'breakout', 'time_stop': 151, 'use_sma': False, 'use_atr': True, 'use_adx': False, 'use_ema': True, 'use_spike': True, 'rsi_required': True, 'edge_k': 0.2820592263642833, 'edge_cap': 0.951135674723901, 'bull_strategy': 'mean_reversion', 'bull_bb_std_mult': 0.7554035278657265, 'bull_rsi_os': 37, 'bull_rsi_ob': 48, 'bull_adx_thresh': 22.488761778838985, 'bull_atr_min_pct': 0.019125880211785545, 'bull_atr_max_pct': 0.07218983847309998, 'bull_tp_mult': 2.128764672871913, 'bull_tsl_mult': 0.427343590738853, 'bull_time_stop': 156, 'bull_use_sma': True, 'bull_use_ema': False, 'bull_use_atr': False, 'bull_use_adx': False, 'bull_use_spike': True, 'bull_rsi_required': False, 'bear_strategy': 'mean_reversion', 'bear_bb_std_mult': 2.353057299892678, 'bear_rsi_os': 28, 'bear_rsi_ob': 73, 'bear_adx_thresh': 29.497195110299252, 'bear_atr_min_pct': 0.022381896128509545, 'bear_atr_max_pct': 0.07396241457107222, 'bear_tp_mult': 1.5230878831489414, 'bear_tsl_mult': 0.940378281869423, 'bear_time_stop': 62, 'bear_use_sma': True, 'bear_use_ema': True, 'bear_use_atr': True, 'bear_use_adx': False, 'bear_use_spike': False, 'bear_rsi_required': True, 'sideways_strategy': 'breakout', 'sideways_bb_std_mult': 2.1060106732034343, 'sideways_rsi_os': 22, 'sideways_rsi_ob': 48, 'sideways_adx_thresh': 8.121587802355506, 'sideways_atr_min_pct': 0.008100227340705327, 'sideways_atr_max_pct': 0.12087868745390265, 'sideways_tp_mult': 2.4342229423525605, 'sideways_tsl_mult': 0.9781934307615793, 'sideways_time_stop': 91, 'sideways_use_sma': True, 'sideways_use_ema': True, 'sideways_use_atr': True, 'sideways_use_adx': False, 'sideways_use_spike': True, 'sideways_rsi_required': False}.
[I 2025-08-30 15:24:31,916] Trial 448 finished with values: [-1000000000.0, 1000000000.0] and parameters: {'p_sma': 46, 'p_std': 59, 'p_atr': 15, 'p_adx': 27, 'rsi_period': 76, 'ema1': 30, 'ema2': 34, 'slip_atr_k': 0.07532085205956646, 'slip_spread_k': 0.1008382092879846, 'spread_hl_frac': 0.027687514595462263, 'bb_std_mult': 1.1403134289679715, 'rsi_os': 23, 'rsi_ob': 71, 'vol_spike': 0.06005313463378076, 'adx_thresh': 12.303263106136374, 'atr_min_pct': 0.01414618847704055, 'atr_max_pct': 0.13934471168241425, 'tp_mult': 1.8748403226027655, 'tsl_mult': 0.7163128301706309, 'strategy': 'breakout', 'time_stop': 130, 'use_sma': False, 'use_atr': True, 'use_adx': True, 'use_ema': True, 'use_spike': True, 'rsi_required': True, 'edge_k': 0.16069380913346312, 'edge_cap': 0.4213237623689017, 'bull_strategy': 'mean_reversion', 'bull_bb_std_mult': 2.185605056444631, 'bull_rsi_os': 39, 'bull_rsi_ob': 50, 'bull_adx_thresh': 21.278051005448756, 'bull_atr_min_pct': 0.021719152457748983, 'bull_atr_max_pct': 0.10802594357223594, 'bull_tp_mult': 2.190415425745479, 'bull_tsl_mult': 0.24630904363833866, 'bull_time_stop': 201, 'bull_use_sma': False, 'bull_use_ema': False, 'bull_use_atr': False, 'bull_use_adx': False, 'bull_use_spike': True, 'bull_rsi_required': False, 'bear_strategy': 'mean_reversion', 'bear_bb_std_mult': 2.0957668786333827, 'bear_rsi_os': 29, 'bear_rsi_ob': 88, 'bear_adx_thresh': 12.271464980233866, 'bear_atr_min_pct': 0.021333377208953376, 'bear_atr_max_pct': 0.0699069988442285, 'bear_tp_mult': 1.5939743714033021, 'bear_tsl_mult': 0.9644175796630288, 'bear_time_stop': 67, 'bear_use_sma': True, 'bear_use_ema': True, 'bear_use_atr': True, 'bear_use_adx': False, 'bear_use_spike': False, 'bear_rsi_required': True, 'sideways_strategy': 'mean_reversion', 'sideways_bb_std_mult': 2.1673372518866136, 'sideways_rsi_os': 43, 'sideways_rsi_ob': 70, 'sideways_adx_thresh': 10.451139114523722, 'sideways_atr_min_pct': 0.0011143306921820586, 'sideways_atr_max_pct': 0.14694307355790978, 'sideways_tp_mult': 2.361013993892441, 'sideways_tsl_mult': 0.9982998467652595, 'sideways_time_stop': 78, 'sideways_use_sma': True, 'sideways_use_ema': True, 'sideways_use_atr': True, 'sideways_use_adx': False, 'sideways_use_spike': False, 'sideways_rsi_required': False}.
[I 2025-08-30 15:24:31,919] Trial 447 finished with values: [-1000000000.0, 1000000000.0] and parameters: {'p_sma': 42, 'p_std': 5, 'p_atr': 24, 'p_adx': 28, 'rsi_period': 73, 'ema1': 30, 'ema2': 34, 'slip_atr_k': 0.061708725014909885, 'slip_spread_k': 0.12601439305717055, 'spread_hl_frac': 0.02687240207484661, 'bb_std_mult': 1.1951408194358946, 'rsi_os': 50, 'rsi_ob': 75, 'vol_spike': 0.05786255576501008, 'adx_thresh': 14.677530967052906, 'atr_min_pct': 0.014113161857017437, 'atr_max_pct': 0.08883834437413725, 'tp_mult': 1.7749364025571468, 'tsl_mult': 0.36524887415102736, 'strategy': 'breakout', 'time_stop': 130, 'use_sma': False, 'use_atr': True, 'use_adx': False, 'use_ema': True, 'use_spike': True, 'rsi_required': True, 'edge_k': 0.1616378486008977, 'edge_cap': 0.5937461299226797, 'bull_strategy': 'mean_reversion', 'bull_bb_std_mult': 1.7224911020655034, 'bull_rsi_os': 39, 'bull_rsi_ob': 53, 'bull_adx_thresh': 21.088735843728188, 'bull_atr_min_pct': 0.021394923760368736, 'bull_atr_max_pct': 0.10868936050640524, 'bull_tp_mult': 2.2088233849330794, 'bull_tsl_mult': 0.3687977666778598, 'bull_time_stop': 188, 'bull_use_sma': False, 'bull_use_ema': False, 'bull_use_atr': False, 'bull_use_adx': False, 'bull_use_spike': True, 'bull_rsi_required': False, 'bear_strategy': 'mean_reversion', 'bear_bb_std_mult': 3.279637477992857, 'bear_rsi_os': 29, 'bear_rsi_ob': 76, 'bear_adx_thresh': 29.83321119539521, 'bear_atr_min_pct': 0.022218456605619826, 'bear_atr_max_pct': 0.06942196040161121, 'bear_tp_mult': 2.509375241158683, 'bear_tsl_mult': 0.9517754975693344, 'bear_time_stop': 61, 'bear_use_sma': True, 'bear_use_ema': True, 'bear_use_atr': True, 'bear_use_adx': False, 'bear_use_spike': False, 'bear_rsi_required': True, 'sideways_strategy': 'mean_reversion', 'sideways_bb_std_mult': 2.5522020531833176, 'sideways_rsi_os': 43, 'sideways_rsi_ob': 61, 'sideways_adx_thresh': 27.688134343970887, 'sideways_atr_min_pct': 0.00046320764881151557, 'sideways_atr_max_pct': 0.10237762533007985, 'sideways_tp_mult': 2.5234421309595136, 'sideways_tsl_mult': 0.9987104610785478, 'sideways_time_stop': 89, 'sideways_use_sma': True, 'sideways_use_ema': True, 'sideways_use_atr': True, 'sideways_use_adx': False, 'sideways_use_spike': True, 'sideways_rsi_required': False}.
[I 2025-08-30 15:24:32,321] Trial 449 finished with values: [-1000000000.0, 1000000000.0] and parameters: {'p_sma': 26, 'p_std': 5, 'p_atr': 24, 'p_adx': 10, 'rsi_period': 75, 'ema1': 5, 'ema2': 33, 'slip_atr_k': 0.0631356721768296, 'slip_spread_k': 0.09108992172014521, 'spread_hl_frac': 0.026935322249210105, 'bb_std_mult': 1.198424277434248, 'rsi_os': 23, 'rsi_ob': 71, 'vol_spike': 0.1731912615829487, 'adx_thresh': 14.692339949648899, 'atr_min_pct': 0.013955326389560036, 'atr_max_pct': 0.1342764788381654, 'tp_mult': 1.8594298369497713, 'tsl_mult': 0.3649862185776066, 'strategy': 'breakout', 'time_stop': 130, 'use_sma': False, 'use_atr': True, 'use_adx': True, 'use_ema': True, 'use_spike': True, 'rsi_required': True, 'edge_k': 0.13997063546863245, 'edge_cap': 0.1521583031254834, 'bull_strategy': 'mean_reversion', 'bull_bb_std_mult': 2.1787362931064695, 'bull_rsi_os': 39, 'bull_rsi_ob': 53, 'bull_adx_thresh': 5.084987702670695, 'bull_atr_min_pct': 0.021789023020434752, 'bull_atr_max_pct': 0.10235406955322487, 'bull_tp_mult': 2.553703544169366, 'bull_tsl_mult': 0.23545367068538978, 'bull_time_stop': 202, 'bull_use_sma': False, 'bull_use_ema': False, 'bull_use_atr': False, 'bull_use_adx': False, 'bull_use_spike': True, 'bull_rsi_required': False, 'bear_strategy': 'mean_reversion', 'bear_bb_std_mult': 0.653744077164021, 'bear_rsi_os': 30, 'bear_rsi_ob': 77, 'bear_adx_thresh': 22.391032958748834, 'bear_atr_min_pct': 0.02124968862425567, 'bear_atr_max_pct': 0.06838003490664618, 'bear_tp_mult': 2.6808417748185085, 'bear_tsl_mult': 0.9642622914372248, 'bear_time_stop': 68, 'bear_use_sma': True, 'bear_use_ema': True, 'bear_use_atr': True, 'bear_use_adx': False, 'bear_use_spike': False, 'bear_rsi_required': True, 'sideways_strategy': 'mean_reversion', 'sideways_bb_std_mult': 2.2190473735122778, 'sideways_rsi_os': 44, 'sideways_rsi_ob': 68, 'sideways_adx_thresh': 5.5749243215204025, 'sideways_atr_min_pct': 0.0011663236808527617, 'sideways_atr_max_pct': 0.059110647443864614, 'sideways_tp_mult': 2.9353122257034947, 'sideways_tsl_mult': 0.9952216784179673, 'sideways_time_stop': 80, 'sideways_use_sma': True, 'sideways_use_ema': True, 'sideways_use_atr': True, 'sideways_use_adx': False, 'sideways_use_spike': False, 'sideways_rsi_required': False}.
[I 2025-08-30 15:24:32,924] Trial 446 finished with values: [-0.05558968041573609, 0.05551138511953924] and parameters: {'p_sma': 46, 'p_std': 5, 'p_atr': 19, 'p_adx': 26, 'rsi_period': 28, 'ema1': 30, 'ema2': 34, 'slip_atr_k': 0.07696986201887271, 'slip_spread_k': 0.12599022965633788, 'spread_hl_frac': 0.027013701844244054, 'bb_std_mult': 1.2725856568595493, 'rsi_os': 5, 'rsi_ob': 71, 'vol_spike': 0.18387455660141777, 'adx_thresh': 14.801118039290905, 'atr_min_pct': 0.014195088627106342, 'atr_max_pct': 0.08866264733679906, 'tp_mult': 1.7577676603741141, 'tsl_mult': 0.3434547453472325, 'strategy': 'breakout', 'time_stop': 135, 'use_sma': False, 'use_atr': True, 'use_adx': False, 'use_ema': True, 'use_spike': True, 'rsi_required': True, 'edge_k': 0.1681808707622373, 'edge_cap': 0.4197808571508146, 'bull_strategy': 'mean_reversion', 'bull_bb_std_mult': 0.7271345890760303, 'bull_rsi_os': 39, 'bull_rsi_ob': 53, 'bull_adx_thresh': 33.12455274853535, 'bull_atr_min_pct': 0.021655067810745273, 'bull_atr_max_pct': 0.11328033062402329, 'bull_tp_mult': 2.3654449417170027, 'bull_tsl_mult': 0.2405990653979279, 'bull_time_stop': 209, 'bull_use_sma': False, 'bull_use_ema': False, 'bull_use_atr': False, 'bull_use_adx': False, 'bull_use_spike': True, 'bull_rsi_required': False, 'bear_strategy': 'mean_reversion', 'bear_bb_std_mult': 1.8697678971295293, 'bear_rsi_os': 28, 'bear_rsi_ob': 59, 'bear_adx_thresh': 28.291559895137404, 'bear_atr_min_pct': 0.02232302265087576, 'bear_atr_max_pct': 0.07055126200320853, 'bear_tp_mult': 1.5396788602102374, 'bear_tsl_mult': 0.9547773629513204, 'bear_time_stop': 61, 'bear_use_sma': True, 'bear_use_ema': True, 'bear_use_atr': True, 'bear_use_adx': False, 'bear_use_spike': False, 'bear_rsi_required': True, 'sideways_strategy': 'mean_reversion', 'sideways_bb_std_mult': 2.1494294948645067, 'sideways_rsi_os': 43, 'sideways_rsi_ob': 48, 'sideways_adx_thresh': 33.55823412097128, 'sideways_atr_min_pct': 0.0004014376184084053, 'sideways_atr_max_pct': 0.06605647669610204, 'sideways_tp_mult': 2.3519393040281074, 'sideways_tsl_mult': 0.9745744626494315, 'sideways_time_stop': 81, 'sideways_use_sma': True, 'sideways_use_ema': True, 'sideways_use_atr': True, 'sideways_use_adx': False, 'sideways_use_spike': True, 'sideways_rsi_required': False}.
