[I 2025-08-30 16:07:42,147] Trial 658 finished with values: [-1000000000.0, 1000000000.0] and parameters: {'p_sma': 54, 'p_std': 55, 'p_atr': 29, 'p_adx': 10, 'rsi_period': 83, 'ema1': 25, 'ema2': 31, 'slip_atr_k': 0.07568337969051564, 'slip_spread_k': 0.16609561589029015, 'spread_hl_frac': 0.023742979423654036, 'bb_std_mult': 2.4691182978858963, 'rsi_os': 42, 'rsi_ob': 73, 'vol_spike': 0.15796049208829122, 'adx_thresh': 14.965779855984081, 'atr_min_pct': 0.015303900396508963, 'atr_max_pct': 0.07504737783591194, 'tp_mult': 2.720893801680586, 'tsl_mult': 0.2604521928028666, 'strategy': 'mean_reversion', 'time_stop': 227, 'use_sma': True, 'use_atr': False, 'use_adx': True, 'use_ema': True, 'use_spike': True, 'rsi_required': False, 'edge_k': 0.5387303672759384, 'edge_cap': 0.6099368102410001, 'bull_strategy': 'breakout', 'bull_bb_std_mult': 0.5117809179116279, 'bull_rsi_os': 41, 'bull_rsi_ob': 64, 'bull_adx_thresh': 23.715838935745182, 'bull_atr_min_pct': 0.01823416727640752, 'bull_atr_max_pct': 0.08951396187042547, 'bull_tp_mult': 2.0343834995459216, 'bull_tsl_mult': 0.09994726615030157, 'bull_time_stop': 73, 'bull_use_sma': True, 'bull_use_ema': True, 'bull_use_atr': True, 'bull_use_adx': True, 'bull_use_spike': True, 'bull_rsi_required': True, 'bear_strategy': 'mean_reversion', 'bear_bb_std_mult': 2.712383562197738, 'bear_rsi_os': 34, 'bear_rsi_ob': 86, 'bear_adx_thresh': 29.923983073563527, 'bear_atr_min_pct': 0.020623552091735026, 'bear_atr_max_pct': 0.07579601083977322, 'bear_tp_mult': 2.863574384600253, 'bear_tsl_mult': 0.2700131565325564, 'bear_time_stop': 278, 'bear_use_sma': False, 'bear_use_ema': False, 'bear_use_atr': True, 'bear_use_adx': True, 'bear_use_spike': True, 'bear_rsi_required': True, 'sideways_strategy': 'breakout', 'sideways_bb_std_mult': 1.1519817990982042, 'sideways_rsi_os': 39, 'sideways_rsi_ob': 62, 'sideways_adx_thresh': 23.686774847242233, 'sideways_atr_min_pct': 0.008784655487505153, 'sideways_atr_max_pct': 0.10716294237124524, 'sideways_tp_mult': 2.920811022775602, 'sideways_tsl_mult': 0.9233362731605482, 'sideways_time_stop': 71, 'sideways_use_sma': True, 'sideways_use_ema': True, 'sideways_use_atr': False, 'sideways_use_adx': True, 'sideways_use_spike': False, 'sideways_rsi_required': True}.
[I 2025-08-30 16:07:43,065] Trial 657 finished with values: [-1000000000.0, 1000000000.0] and parameters: {'p_sma': 7, 'p_std': 55, 'p_atr': 27, 'p_adx': 10, 'rsi_period': 83, 'ema1': 24, 'ema2': 31, 'slip_atr_k': 0.07579446299685005, 'slip_spread_k': 0.16657576809881383, 'spread_hl_frac': 0.023787824294031146, 'bb_std_mult': 2.2678782212420407, 'rsi_os': 42, 'rsi_ob': 73, 'vol_spike': 0.15963028828015438, 'adx_thresh': 15.019049310703519, 'atr_min_pct': 0.01663439259872528, 'atr_max_pct': 0.14184303147153837, 'tp_mult': 2.733308696222042, 'tsl_mult': 0.2897985079418521, 'strategy': 'mean_reversion', 'time_stop': 206, 'use_sma': True, 'use_atr': True, 'use_adx': True, 'use_ema': True, 'use_spike': True, 'rsi_required': False, 'edge_k': 0.5216097844039211, 'edge_cap': 0.6097120475311069, 'bull_strategy': 'breakout', 'bull_bb_std_mult': 1.1661351913228848, 'bull_rsi_os': 41, 'bull_rsi_ob': 64, 'bull_adx_thresh': 23.907459181459576, 'bull_atr_min_pct': 0.018412537605027833, 'bull_atr_max_pct': 0.08836477066601306, 'bull_tp_mult': 2.0231067444408883, 'bull_tsl_mult': 0.0972246007304532, 'bull_time_stop': 23, 'bull_use_sma': True, 'bull_use_ema': True, 'bull_use_atr': True, 'bull_use_adx': True, 'bull_use_spike': True, 'bull_rsi_required': True, 'bear_strategy': 'mean_reversion', 'bear_bb_std_mult': 2.6823543984080276, 'bear_rsi_os': 34, 'bear_rsi_ob': 87, 'bear_adx_thresh': 30.190515504797503, 'bear_atr_min_pct': 0.020610377859545337, 'bear_atr_max_pct': 0.07764148618575208, 'bear_tp_mult': 2.8559852090549285, 'bear_tsl_mult': 0.46267886955651544, 'bear_time_stop': 269, 'bear_use_sma': False, 'bear_use_ema': False, 'bear_use_atr': True, 'bear_use_adx': True, 'bear_use_spike': True, 'bear_rsi_required': True, 'sideways_strategy': 'breakout', 'sideways_bb_std_mult': 1.0048500970048182, 'sideways_rsi_os': 39, 'sideways_rsi_ob': 62, 'sideways_adx_thresh': 23.425867818706397, 'sideways_atr_min_pct': 0.0011670160340414527, 'sideways_atr_max_pct': 0.10838363790509073, 'sideways_tp_mult': 2.876665303355653, 'sideways_tsl_mult': 0.9207675039226932, 'sideways_time_stop': 70, 'sideways_use_sma': True, 'sideways_use_ema': True, 'sideways_use_atr': False, 'sideways_use_adx': True, 'sideways_use_spike': True, 'sideways_rsi_required': True}.
[I 2025-08-30 16:07:43,107] Trial 656 finished with values: [-1000000000.0, 1000000000.0] and parameters: {'p_sma': 7, 'p_std': 55, 'p_atr': 27, 'p_adx': 11, 'rsi_period': 80, 'ema1': 24, 'ema2': 31, 'slip_atr_k': 0.07831669783245572, 'slip_spread_k': 0.1630484810877021, 'spread_hl_frac': 0.023629483776517576, 'bb_std_mult': 2.472519413994705, 'rsi_os': 40, 'rsi_ob': 61, 'vol_spike': 0.1557992241280181, 'adx_thresh': 15.065882372971185, 'atr_min_pct': 0.01615714713661264, 'atr_max_pct': 0.07509068773990377, 'tp_mult': 1.3394167115245763, 'tsl_mult': 0.3175969057695489, 'strategy': 'mean_reversion', 'time_stop': 227, 'use_sma': True, 'use_atr': True, 'use_adx': True, 'use_ema': True, 'use_spike': True, 'rsi_required': False, 'edge_k': 0.3731352659909703, 'edge_cap': 0.6140305313095761, 'bull_strategy': 'breakout', 'bull_bb_std_mult': 0.7706789695030518, 'bull_rsi_os': 43, 'bull_rsi_ob': 60, 'bull_adx_thresh': 24.05040501102995, 'bull_atr_min_pct': 0.019643853605662457, 'bull_atr_max_pct': 0.09242376301257943, 'bull_tp_mult': 2.017616951395376, 'bull_tsl_mult': 0.1519226747389285, 'bull_time_stop': 26, 'bull_use_sma': True, 'bull_use_ema': True, 'bull_use_atr': True, 'bull_use_adx': True, 'bull_use_spike': True, 'bull_rsi_required': True, 'bear_strategy': 'mean_reversion', 'bear_bb_std_mult': 2.6916289023934508, 'bear_rsi_os': 34, 'bear_rsi_ob': 86, 'bear_adx_thresh': 29.849052635951953, 'bear_atr_min_pct': 0.01917396036606565, 'bear_atr_max_pct': 0.07806444456120885, 'bear_tp_mult': 2.766502268389584, 'bear_tsl_mult': 0.46704056949417344, 'bear_time_stop': 268, 'bear_use_sma': False, 'bear_use_ema': False, 'bear_use_atr': True, 'bear_use_adx': True, 'bear_use_spike': True, 'bear_rsi_required': True, 'sideways_strategy': 'breakout', 'sideways_bb_std_mult': 0.9849490821087332, 'sideways_rsi_os': 39, 'sideways_rsi_ob': 62, 'sideways_adx_thresh': 23.590462181438113, 'sideways_atr_min_pct': 0.026378375802558654, 'sideways_atr_max_pct': 0.10766151636084527, 'sideways_tp_mult': 2.889354305635795, 'sideways_tsl_mult': 0.9192178334615895, 'sideways_time_stop': 69, 'sideways_use_sma': True, 'sideways_use_ema': True, 'sideways_use_atr': False, 'sideways_use_adx': True, 'sideways_use_spike': True, 'sideways_rsi_required': True}.
[I 2025-08-30 16:08:30,246] Trial 663 finished with values: [-1000000000.0, 1000000000.0] and parameters: {'p_sma': 60, 'p_std': 55, 'p_atr': 20, 'p_adx': 12, 'rsi_period': 79, 'ema1': 19, 'ema2': 29, 'slip_atr_k': 0.07284757387027874, 'slip_spread_k': 0.14537662507665727, 'spread_hl_frac': 0.024151946163134385, 'bb_std_mult': 2.606049719653902, 'rsi_os': 41, 'rsi_ob': 72, 'vol_spike': 0.15867829503666883, 'adx_thresh': 15.53260831396183, 'atr_min_pct': 0.015388816740883939, 'atr_max_pct': 0.09646450301197457, 'tp_mult': 2.322451987128174, 'tsl_mult': 0.3997152006288948, 'strategy': 'mean_reversion', 'time_stop': 216, 'use_sma': True, 'use_atr': True, 'use_adx': False, 'use_ema': False, 'use_spike': True, 'rsi_required': False, 'edge_k': 0.4633028647540537, 'edge_cap': 0.6093688480064934, 'bull_strategy': 'breakout', 'bull_bb_std_mult': 1.0513835403325449, 'bull_rsi_os': 41, 'bull_rsi_ob': 65, 'bull_adx_thresh': 24.72120530704777, 'bull_atr_min_pct': 0.02009375632963109, 'bull_atr_max_pct': 0.09314460341074127, 'bull_tp_mult': 1.973553226485943, 'bull_tsl_mult': 0.04441385155465832, 'bull_time_stop': 55, 'bull_use_sma': True, 'bull_use_ema': True, 'bull_use_atr': True, 'bull_use_adx': True, 'bull_use_spike': False, 'bull_rsi_required': True, 'bear_strategy': 'breakout', 'bear_bb_std_mult': 2.533512995392689, 'bear_rsi_os': 35, 'bear_rsi_ob': 83, 'bear_adx_thresh': 29.298552495011933, 'bear_atr_min_pct': 0.020792709049286335, 'bear_atr_max_pct': 0.07605143595567307, 'bear_tp_mult': 2.9061223496740314, 'bear_tsl_mult': 0.3945629946622903, 'bear_time_stop': 252, 'bear_use_sma': False, 'bear_use_ema': False, 'bear_use_atr': False, 'bear_use_adx': True, 'bear_use_spike': True, 'bear_rsi_required': False, 'sideways_strategy': 'mean_reversion', 'sideways_bb_std_mult': 1.0795968730731584, 'sideways_rsi_os': 38, 'sideways_rsi_ob': 62, 'sideways_adx_thresh': 24.859859388578297, 'sideways_atr_min_pct': 0.024426470444119067, 'sideways_atr_max_pct': 0.1059182898319522, 'sideways_tp_mult': 2.935561365458445, 'sideways_tsl_mult': 0.895143792760607, 'sideways_time_stop': 73, 'sideways_use_sma': False, 'sideways_use_ema': False, 'sideways_use_atr': False, 'sideways_use_adx': True, 'sideways_use_spike': True, 'sideways_rsi_required': True}.
[I 2025-08-30 16:08:32,155] Trial 662 finished with values: [-1000000000.0, 1000000000.0] and parameters: {'p_sma': 56, 'p_std': 55, 'p_atr': 30, 'p_adx': 12, 'rsi_period': 79, 'ema1': 19, 'ema2': 30, 'slip_atr_k': 0.08919424633154296, 'slip_spread_k': 0.14707950925199595, 'spread_hl_frac': 0.02400398724605331, 'bb_std_mult': 2.64510746612557, 'rsi_os': 40, 'rsi_ob': 74, 'vol_spike': 0.13810012173351374, 'adx_thresh': 15.429316437326996, 'atr_min_pct': 0.01529254519977965, 'atr_max_pct': 0.12483709187802744, 'tp_mult': 2.013459579597432, 'tsl_mult': 0.32201541273754786, 'strategy': 'mean_reversion', 'time_stop': 216, 'use_sma': True, 'use_atr': True, 'use_adx': False, 'use_ema': False, 'use_spike': True, 'rsi_required': False, 'edge_k': 0.4493907654986591, 'edge_cap': 0.6005593845210909, 'bull_strategy': 'breakout', 'bull_bb_std_mult': 0.7700966946580046, 'bull_rsi_os': 41, 'bull_rsi_ob': 66, 'bull_adx_thresh': 25.23181576634158, 'bull_atr_min_pct': 0.019927881308172052, 'bull_atr_max_pct': 0.09344210102267447, 'bull_tp_mult': 1.9522096725898106, 'bull_tsl_mult': 0.030503560356599013, 'bull_time_stop': 47, 'bull_use_sma': True, 'bull_use_ema': True, 'bull_use_atr': True, 'bull_use_adx': True, 'bull_use_spike': True, 'bull_rsi_required': True, 'bear_strategy': 'mean_reversion', 'bear_bb_std_mult': 2.3666281113413055, 'bear_rsi_os': 35, 'bear_rsi_ob': 83, 'bear_adx_thresh': 29.47940096933634, 'bear_atr_min_pct': 0.01911680755628688, 'bear_atr_max_pct': 0.07662288980591692, 'bear_tp_mult': 2.747744820405263, 'bear_tsl_mult': 0.3979398033278827, 'bear_time_stop': 253, 'bear_use_sma': False, 'bear_use_ema': False, 'bear_use_atr': False, 'bear_use_adx': True, 'bear_use_spike': True, 'bear_rsi_required': True, 'sideways_strategy': 'mean_reversion', 'sideways_bb_std_mult': 1.099817907610781, 'sideways_rsi_os': 38, 'sideways_rsi_ob': 62, 'sideways_adx_thresh': 25.12780047728882, 'sideways_atr_min_pct': 0.01503042939198849, 'sideways_atr_max_pct': 0.10588416544033598, 'sideways_tp_mult': 2.933043237682296, 'sideways_tsl_mult': 0.9304498017473918, 'sideways_time_stop': 71, 'sideways_use_sma': True, 'sideways_use_ema': True, 'sideways_use_atr': False, 'sideways_use_adx': True, 'sideways_use_spike': True, 'sideways_rsi_required': True}.
[I 2025-08-30 16:08:32,466] Trial 661 finished with values: [-1000000000.0, 1000000000.0] and parameters: {'p_sma': 6, 'p_std': 55, 'p_atr': 30, 'p_adx': 12, 'rsi_period': 83, 'ema1': 24, 'ema2': 31, 'slip_atr_k': 0.08017435457573235, 'slip_spread_k': 0.16863604707171295, 'spread_hl_frac': 0.02417203166527077, 'bb_std_mult': 2.6620486951803652, 'rsi_os': 41, 'rsi_ob': 74, 'vol_spike': 0.15868195225428847, 'adx_thresh': 15.172499654427664, 'atr_min_pct': 0.015350684092395534, 'atr_max_pct': 0.11743836639771965, 'tp_mult': 1.727284658315922, 'tsl_mult': 0.40353969929620215, 'strategy': 'mean_reversion', 'time_stop': 215, 'use_sma': True, 'use_atr': True, 'use_adx': False, 'use_ema': False, 'use_spike': True, 'rsi_required': False, 'edge_k': 0.46071003911955627, 'edge_cap': 0.600987803548656, 'bull_strategy': 'breakout', 'bull_bb_std_mult': 1.0401943475945008, 'bull_rsi_os': 41, 'bull_rsi_ob': 66, 'bull_adx_thresh': 24.857336721983145, 'bull_atr_min_pct': 0.019938613798667702, 'bull_atr_max_pct': 0.09267503876398131, 'bull_tp_mult': 2.0357904880131925, 'bull_tsl_mult': 0.04797423664376743, 'bull_time_stop': 23, 'bull_use_sma': True, 'bull_use_ema': True, 'bull_use_atr': True, 'bull_use_adx': True, 'bull_use_spike': True, 'bull_rsi_required': True, 'bear_strategy': 'mean_reversion', 'bear_bb_std_mult': 2.3814710095584886, 'bear_rsi_os': 38, 'bear_rsi_ob': 86, 'bear_adx_thresh': 31.486735759544928, 'bear_atr_min_pct': 0.02036135368304175, 'bear_atr_max_pct': 0.07782195647945298, 'bear_tp_mult': 2.814156693088943, 'bear_tsl_mult': 0.392814652957833, 'bear_time_stop': 269, 'bear_use_sma': False, 'bear_use_ema': False, 'bear_use_atr': False, 'bear_use_adx': True, 'bear_use_spike': True, 'bear_rsi_required': True, 'sideways_strategy': 'breakout', 'sideways_bb_std_mult': 1.0242400888138534, 'sideways_rsi_os': 39, 'sideways_rsi_ob': 62, 'sideways_adx_thresh': 24.910334875646, 'sideways_atr_min_pct': 0.0011235478859384558, 'sideways_atr_max_pct': 0.10640913992325536, 'sideways_tp_mult': 2.9983014523415, 'sideways_tsl_mult': 0.8801050221618855, 'sideways_time_stop': 71, 'sideways_use_sma': True, 'sideways_use_ema': True, 'sideways_use_atr': False, 'sideways_use_adx': True, 'sideways_use_spike': True, 'sideways_rsi_required': True}.
[I 2025-08-30 16:08:33,276] Trial 660 finished with values: [-1000000000.0, 1000000000.0] and parameters: {'p_sma': 56, 'p_std': 55, 'p_atr': 30, 'p_adx': 10, 'rsi_period': 79, 'ema1': 25, 'ema2': 30, 'slip_atr_k': 0.0752715412339132, 'slip_spread_k': 0.1631506833887498, 'spread_hl_frac': 0.024023907659889286, 'bb_std_mult': 2.459019410497859, 'rsi_os': 41, 'rsi_ob': 83, 'vol_spike': 0.15832315722124934, 'adx_thresh': 15.063861075495026, 'atr_min_pct': 0.015186816790038162, 'atr_max_pct': 0.07591378962137912, 'tp_mult': 1.7298541669510668, 'tsl_mult': 0.2977958657251426, 'strategy': 'mean_reversion', 'time_stop': 204, 'use_sma': True, 'use_atr': True, 'use_adx': False, 'use_ema': True, 'use_spike': True, 'rsi_required': False, 'edge_k': 0.5473675704146563, 'edge_cap': 0.6060395179909547, 'bull_strategy': 'breakout', 'bull_bb_std_mult': 0.5059006031519682, 'bull_rsi_os': 41, 'bull_rsi_ob': 66, 'bull_adx_thresh': 23.700131271256733, 'bull_atr_min_pct': 0.01991648610735789, 'bull_atr_max_pct': 0.08993484025512588, 'bull_tp_mult': 2.039826071321627, 'bull_tsl_mult': 0.04863498785974443, 'bull_time_stop': 74, 'bull_use_sma': True, 'bull_use_ema': True, 'bull_use_atr': True, 'bull_use_adx': True, 'bull_use_spike': True, 'bull_rsi_required': True, 'bear_strategy': 'mean_reversion', 'bear_bb_std_mult': 2.3810917035161157, 'bear_rsi_os': 35, 'bear_rsi_ob': 86, 'bear_adx_thresh': 29.77825289907931, 'bear_atr_min_pct': 0.020499684680168814, 'bear_atr_max_pct': 0.07672072320822365, 'bear_tp_mult': 2.8093850867923096, 'bear_tsl_mult': 0.461680110671996, 'bear_time_stop': 276, 'bear_use_sma': False, 'bear_use_ema': False, 'bear_use_atr': True, 'bear_use_adx': True, 'bear_use_spike': True, 'bear_rsi_required': True, 'sideways_strategy': 'breakout', 'sideways_bb_std_mult': 1.090767743171811, 'sideways_rsi_os': 39, 'sideways_rsi_ob': 62, 'sideways_adx_thresh': 23.42130882410128, 'sideways_atr_min_pct': 0.011273130022748573, 'sideways_atr_max_pct': 0.10668461880949423, 'sideways_tp_mult': 2.9270921352371224, 'sideways_tsl_mult': 0.8804960312330978, 'sideways_time_stop': 70, 'sideways_use_sma': True, 'sideways_use_ema': True, 'sideways_use_atr': False, 'sideways_use_adx': True, 'sideways_use_spike': True, 'sideways_rsi_required': True}.
[I 2025-08-30 16:09:19,789] Trial 667 finished with values: [-0.011042280806112248, 0.010936298449556474] and parameters: {'p_sma': 5, 'p_std': 53, 'p_atr': 22, 'p_adx': 11, 'rsi_period': 65, 'ema1': 21, 'ema2': 31, 'slip_atr_k': 0.08320610539963824, 'slip_spread_k': 0.30101625391618364, 'spread_hl_frac': 0.022479864567768734, 'bb_std_mult': 2.3941051741594035, 'rsi_os': 37, 'rsi_ob': 71, 'vol_spike': 0.16379403802896852, 'adx_thresh': 14.807446829952546, 'atr_min_pct': 0.015487201015818809, 'atr_max_pct': 0.0696054844186404, 'tp_mult': 1.7029630866781411, 'tsl_mult': 0.23326428892496406, 'strategy': 'mean_reversion', 'time_stop': 233, 'use_sma': True, 'use_atr': False, 'use_adx': False, 'use_ema': True, 'use_spike': True, 'rsi_required': False, 'edge_k': 0.4098389435945387, 'edge_cap': 0.6303530941192225, 'bull_strategy': 'breakout', 'bull_bb_std_mult': 0.918781268028858, 'bull_rsi_os': 40, 'bull_rsi_ob': 58, 'bull_adx_thresh': 23.60132034688826, 'bull_atr_min_pct': 0.018585467093768678, 'bull_atr_max_pct': 0.09948467045464453, 'bull_tp_mult': 1.9961758436997563, 'bull_tsl_mult': 0.01093935806789377, 'bull_time_stop': 79, 'bull_use_sma': True, 'bull_use_ema': True, 'bull_use_atr': True, 'bull_use_adx': True, 'bull_use_spike': False, 'bull_rsi_required': True, 'bear_strategy': 'breakout', 'bear_bb_std_mult': 2.4635153773421465, 'bear_rsi_os': 38, 'bear_rsi_ob': 85, 'bear_adx_thresh': 29.416873298368383, 'bear_atr_min_pct': 0.020948873924950207, 'bear_atr_max_pct': 0.0851127467184971, 'bear_tp_mult': 2.747055989649847, 'bear_tsl_mult': 0.4919606462797247, 'bear_time_stop': 283, 'bear_use_sma': False, 'bear_use_ema': False, 'bear_use_atr': True, 'bear_use_adx': True, 'bear_use_spike': True, 'bear_rsi_required': False, 'sideways_strategy': 'breakout', 'sideways_bb_std_mult': 1.191345440329486, 'sideways_rsi_os': 38, 'sideways_rsi_ob': 61, 'sideways_adx_thresh': 24.9293931098687, 'sideways_atr_min_pct': 0.0004930657466452889, 'sideways_atr_max_pct': 0.11122448189379262, 'sideways_tp_mult': 2.967683141243774, 'sideways_tsl_mult': 0.9345856528973828, 'sideways_time_stop': 63, 'sideways_use_sma': False, 'sideways_use_ema': False, 'sideways_use_atr': False, 'sideways_use_adx': True, 'sideways_use_spike': False, 'sideways_rsi_required': True}.
[I 2025-08-30 16:09:20,271] Trial 666 finished with values: [-0.025471492121221462, 0.025373408443833415] and parameters: {'p_sma': 17, 'p_std': 53, 'p_atr': 22, 'p_adx': 11, 'rsi_period': 66, 'ema1': 21, 'ema2': 30, 'slip_atr_k': 0.07407721986545442, 'slip_spread_k': 0.19541378021276198, 'spread_hl_frac': 0.022836200528428767, 'bb_std_mult': 2.186566372709802, 'rsi_os': 39, 'rsi_ob': 71, 'vol_spike': 0.15058556124289854, 'adx_thresh': 15.114449319716599, 'atr_min_pct': 0.015846919956616762, 'atr_max_pct': 0.016300963317443837, 'tp_mult': 2.998350247266192, 'tsl_mult': 0.43849340092274147, 'strategy': 'mean_reversion', 'time_stop': 203, 'use_sma': True, 'use_atr': False, 'use_adx': False, 'use_ema': True, 'use_spike': True, 'rsi_required': False, 'edge_k': 0.41751169146566913, 'edge_cap': 0.6036587816523401, 'bull_strategy': 'breakout', 'bull_bb_std_mult': 0.8902824315530152, 'bull_rsi_os': 40, 'bull_rsi_ob': 62, 'bull_adx_thresh': 23.451695207680768, 'bull_atr_min_pct': 0.01834783614706888, 'bull_atr_max_pct': 0.09738195573330677, 'bull_tp_mult': 2.0525803771325384, 'bull_tsl_mult': 0.0670754581365047, 'bull_time_stop': 63, 'bull_use_sma': True, 'bull_use_ema': True, 'bull_use_atr': True, 'bull_use_adx': True, 'bull_use_spike': False, 'bull_rsi_required': True, 'bear_strategy': 'mean_reversion', 'bear_bb_std_mult': 2.449920237094145, 'bear_rsi_os': 33, 'bear_rsi_ob': 85, 'bear_adx_thresh': 30.87282407993542, 'bear_atr_min_pct': 0.01998644785119536, 'bear_atr_max_pct': 0.07442857766676622, 'bear_tp_mult': 2.8055958073395706, 'bear_tsl_mult': 0.2874676381731223, 'bear_time_stop': 276, 'bear_use_sma': False, 'bear_use_ema': False, 'bear_use_atr': True, 'bear_use_adx': True, 'bear_use_spike': True, 'bear_rsi_required': True, 'sideways_strategy': 'breakout', 'sideways_bb_std_mult': 0.9444967678467643, 'sideways_rsi_os': 37, 'sideways_rsi_ob': 61, 'sideways_adx_thresh': 24.915117082460085, 'sideways_atr_min_pct': 9.931626300229503e-05, 'sideways_atr_max_pct': 0.1133272990381464, 'sideways_tp_mult': 2.9578894885678784, 'sideways_tsl_mult': 0.9350340137549276, 'sideways_time_stop': 64, 'sideways_use_sma': False, 'sideways_use_ema': True, 'sideways_use_atr': False, 'sideways_use_adx': True, 'sideways_use_spike': False, 'sideways_rsi_required': True}.
