[I 2025-08-30 15:13:24,044] Trial 395 finished with values: [-1000000000.0, 1000000000.0] and parameters: {'p_sma': 8, 'p_std': 15, 'p_atr': 22, 'p_adx': 24, 'rsi_period': 84, 'ema1': 30, 'ema2': 21, 'slip_atr_k': 0.056628059591041446, 'slip_spread_k': 0.9361790200020108, 'spread_hl_frac': 0.039792350300606724, 'bb_std_mult': 2.5462965296846156, 'rsi_os': 23, 'rsi_ob': 74, 'vol_spike': 0.1828408369613267, 'adx_thresh': 12.118554018712116, 'atr_min_pct': 0.02989157233783892, 'atr_max_pct': 0.0731191180513521, 'tp_mult': 1.6447338537224447, 'tsl_mult': 0.5269279211954093, 'strategy': 'breakout', 'time_stop': 257, 'use_sma': False, 'use_atr': False, 'use_adx': False, 'use_ema': True, 'use_spike': True, 'rsi_required': True, 'edge_k': 1.0817297456175508, 'edge_cap': 0.587822021457779, 'bull_strategy': 'mean_reversion', 'bull_bb_std_mult': 2.8516439131029454, 'bull_rsi_os': 34, 'bull_rsi_ob': 49, 'bull_adx_thresh': 6.2405953960090095, 'bull_atr_min_pct': 0.006563535190238592, 'bull_atr_max_pct': 0.06610992330123595, 'bull_tp_mult': 1.791377593657716, 'bull_tsl_mult': 0.5861968316921802, 'bull_time_stop': 128, 'bull_use_sma': False, 'bull_use_ema': True, 'bull_use_atr': False, 'bull_use_adx': False, 'bull_use_spike': False, 'bull_rsi_required': False, 'bear_strategy': 'mean_reversion', 'bear_bb_std_mult': 2.6262179772403376, 'bear_rsi_os': 52, 'bear_rsi_ob': 77, 'bear_adx_thresh': 28.593634949077302, 'bear_atr_min_pct': 0.018279661333701874, 'bear_atr_max_pct': 0.013003522603344161, 'bear_tp_mult': 2.763424138518082, 'bear_tsl_mult': 0.05562811418619066, 'bear_time_stop': 80, 'bear_use_sma': True, 'bear_use_ema': True, 'bear_use_atr': True, 'bear_use_adx': True, 'bear_use_spike': False, 'bear_rsi_required': True, 'sideways_strategy': 'mean_reversion', 'sideways_bb_std_mult': 2.439408596649236, 'sideways_rsi_os': 47, 'sideways_rsi_ob': 60, 'sideways_adx_thresh': 32.300716921792215, 'sideways_atr_min_pct': 0.011794853278265198, 'sideways_atr_max_pct': 0.09916933439912812, 'sideways_tp_mult': 2.382400289502691, 'sideways_tsl_mult': 0.5701474849390283, 'sideways_time_stop': 35, 'sideways_use_sma': False, 'sideways_use_ema': True, 'sideways_use_atr': True, 'sideways_use_adx': False, 'sideways_use_spike': True, 'sideways_rsi_required': False}.
[I 2025-08-30 15:13:24,719] Trial 397 finished with values: [-1000000000.0, 1000000000.0] and parameters: {'p_sma': 5, 'p_std': 60, 'p_atr': 15, 'p_adx': 26, 'rsi_period': 75, 'ema1': 29, 'ema2': 37, 'slip_atr_k': 0.07886743135456944, 'slip_spread_k': 0.06509147854082757, 'spread_hl_frac': 0.02443295254046545, 'bb_std_mult': 1.4093738427251712, 'rsi_os': 23, 'rsi_ob': 70, 'vol_spike': 0.18269264048190315, 'adx_thresh': 11.924975972917034, 'atr_min_pct': 0.012464376720665107, 'atr_max_pct': 0.07257918785974038, 'tp_mult': 1.839063750497583, 'tsl_mult': 0.7273526398505761, 'strategy': 'breakout', 'time_stop': 135, 'use_sma': False, 'use_atr': True, 'use_adx': False, 'use_ema': True, 'use_spike': True, 'rsi_required': True, 'edge_k': 0.3082662520547256, 'edge_cap': 0.5010361800270825, 'bull_strategy': 'mean_reversion', 'bull_bb_std_mult': 2.447422177392492, 'bull_rsi_os': 40, 'bull_rsi_ob': 46, 'bull_adx_thresh': 20.65929112495244, 'bull_atr_min_pct': 0.021044954453811552, 'bull_atr_max_pct': 0.06567225336523642, 'bull_tp_mult': 2.180970186134881, 'bull_tsl_mult': 0.35376945405480853, 'bull_time_stop': 192, 'bull_use_sma': False, 'bull_use_ema': True, 'bull_use_atr': False, 'bull_use_adx': False, 'bull_use_spike': True, 'bull_rsi_required': False, 'bear_strategy': 'mean_reversion', 'bear_bb_std_mult': 0.5661492069668155, 'bear_rsi_os': 27, 'bear_rsi_ob': 77, 'bear_adx_thresh': 26.92215337586212, 'bear_atr_min_pct': 0.02428831362996047, 'bear_atr_max_pct': 0.07330073986298692, 'bear_tp_mult': 1.5964737996824576, 'bear_tsl_mult': 0.9745638092480786, 'bear_time_stop': 60, 'bear_use_sma': True, 'bear_use_ema': True, 'bear_use_atr': True, 'bear_use_adx': True, 'bear_use_spike': False, 'bear_rsi_required': True, 'sideways_strategy': 'mean_reversion', 'sideways_bb_std_mult': 2.439888345168278, 'sideways_rsi_os': 45, 'sideways_rsi_ob': 60, 'sideways_adx_thresh': 27.79102682308436, 'sideways_atr_min_pct': 0.007035588673408914, 'sideways_atr_max_pct': 0.10627548653813366, 'sideways_tp_mult': 2.5223182979025514, 'sideways_tsl_mult': 0.943862396982062, 'sideways_time_stop': 79, 'sideways_use_sma': True, 'sideways_use_ema': True, 'sideways_use_atr': True, 'sideways_use_adx': False, 'sideways_use_spike': True, 'sideways_rsi_required': False}.
[I 2025-08-30 15:14:13,383] Trial 401 finished with values: [-1000000000.0, 1000000000.0] and parameters: {'p_sma': 5, 'p_std': 60, 'p_atr': 15, 'p_adx': 26, 'rsi_period': 75, 'ema1': 29, 'ema2': 39, 'slip_atr_k': 0.1007448209322785, 'slip_spread_k': 0.09372841585004471, 'spread_hl_frac': 0.01948331042136771, 'bb_std_mult': 1.224538468562848, 'rsi_os': 24, 'rsi_ob': 71, 'vol_spike': 0.15604972358223615, 'adx_thresh': 13.790706157330856, 'atr_min_pct': 0.012156240322371132, 'atr_max_pct': 0.02405797899197456, 'tp_mult': 1.916495165121323, 'tsl_mult': 0.8513496792735236, 'strategy': 'breakout', 'time_stop': 135, 'use_sma': False, 'use_atr': True, 'use_adx': False, 'use_ema': True, 'use_spike': True, 'rsi_required': True, 'edge_k': 0.15963415491911348, 'edge_cap': 0.5325746163239246, 'bull_strategy': 'mean_reversion', 'bull_bb_std_mult': 2.4289732984852517, 'bull_rsi_os': 39, 'bull_rsi_ob': 50, 'bull_adx_thresh': 20.103993942154858, 'bull_atr_min_pct': 0.01954090140328429, 'bull_atr_max_pct': 0.05880941991507134, 'bull_tp_mult': 2.141909487771192, 'bull_tsl_mult': 0.3182952577437107, 'bull_time_stop': 185, 'bull_use_sma': False, 'bull_use_ema': False, 'bull_use_atr': False, 'bull_use_adx': False, 'bull_use_spike': True, 'bull_rsi_required': False, 'bear_strategy': 'mean_reversion', 'bear_bb_std_mult': 0.5840592828744702, 'bear_rsi_os': 29, 'bear_rsi_ob': 76, 'bear_adx_thresh': 28.17163815289848, 'bear_atr_min_pct': 0.026372413921690364, 'bear_atr_max_pct': 0.06246706379960579, 'bear_tp_mult': 1.6407774146799743, 'bear_tsl_mult': 0.9504012314277912, 'bear_time_stop': 59, 'bear_use_sma': True, 'bear_use_ema': True, 'bear_use_atr': True, 'bear_use_adx': False, 'bear_use_spike': False, 'bear_rsi_required': True, 'sideways_strategy': 'breakout', 'sideways_bb_std_mult': 2.5677661276944055, 'sideways_rsi_os': 47, 'sideways_rsi_ob': 56, 'sideways_adx_thresh': 28.097971574857358, 'sideways_atr_min_pct': 0.015713123406351392, 'sideways_atr_max_pct': 0.10648520195472645, 'sideways_tp_mult': 2.494246315687455, 'sideways_tsl_mult': 0.9786674764590367, 'sideways_time_stop': 93, 'sideways_use_sma': True, 'sideways_use_ema': True, 'sideways_use_atr': True, 'sideways_use_adx': False, 'sideways_use_spike': True, 'sideways_rsi_required': False}.
[I 2025-08-30 15:14:14,286] Trial 399 finished with values: [-0.024924845267254914, 0.024862143491755] and parameters: {'p_sma': 5, 'p_std': 60, 'p_atr': 15, 'p_adx': 26, 'rsi_period': 75, 'ema1': 29, 'ema2': 38, 'slip_atr_k': 0.13561339262340147, 'slip_spread_k': 0.12962255645036075, 'spread_hl_frac': 0.01915066089149175, 'bb_std_mult': 1.2302052615393548, 'rsi_os': 25, 'rsi_ob': 71, 'vol_spike': 0.1572788253046821, 'adx_thresh': 11.702764783807643, 'atr_min_pct': 0.01213824785631664, 'atr_max_pct': 0.07366735979471266, 'tp_mult': 2.015873733213664, 'tsl_mult': 0.8034427707755514, 'strategy': 'breakout', 'time_stop': 136, 'use_sma': False, 'use_atr': True, 'use_adx': False, 'use_ema': True, 'use_spike': True, 'rsi_required': True, 'edge_k': 0.23941229606746678, 'edge_cap': 0.5289670794190655, 'bull_strategy': 'mean_reversion', 'bull_bb_std_mult': 2.422479693255482, 'bull_rsi_os': 41, 'bull_rsi_ob': 50, 'bull_adx_thresh': 20.6409288502482, 'bull_atr_min_pct': 0.022580344840511836, 'bull_atr_max_pct': 0.058647926893493664, 'bull_tp_mult': 2.1567955621882136, 'bull_tsl_mult': 0.3242694778833036, 'bull_time_stop': 195, 'bull_use_sma': False, 'bull_use_ema': False, 'bull_use_atr': False, 'bull_use_adx': False, 'bull_use_spike': True, 'bull_rsi_required': False, 'bear_strategy': 'mean_reversion', 'bear_bb_std_mult': 0.5153255855500244, 'bear_rsi_os': 29, 'bear_rsi_ob': 56, 'bear_adx_thresh': 28.371345557864533, 'bear_atr_min_pct': 0.026385307175261656, 'bear_atr_max_pct': 0.06226278274674598, 'bear_tp_mult': 1.6072550350511348, 'bear_tsl_mult': 0.9632998543861929, 'bear_time_stop': 65, 'bear_use_sma': True, 'bear_use_ema': True, 'bear_use_atr': True, 'bear_use_adx': False, 'bear_use_spike': False, 'bear_rsi_required': True, 'sideways_strategy': 'breakout', 'sideways_bb_std_mult': 2.446384708943096, 'sideways_rsi_os': 47, 'sideways_rsi_ob': 54, 'sideways_adx_thresh': 27.791756376868616, 'sideways_atr_min_pct': 8.858400547878545e-06, 'sideways_atr_max_pct': 0.10667857772306083, 'sideways_tp_mult': 2.472849885589513, 'sideways_tsl_mult': 0.9614483590645913, 'sideways_time_stop': 103, 'sideways_use_sma': True, 'sideways_use_ema': True, 'sideways_use_atr': True, 'sideways_use_adx': False, 'sideways_use_spike': True, 'sideways_rsi_required': False}.
[I 2025-08-30 15:14:14,952] Trial 400 finished with values: [-0.024915753367825033, 0.024844413709151345] and parameters: {'p_sma': 5, 'p_std': 60, 'p_atr': 15, 'p_adx': 26, 'rsi_period': 73, 'ema1': 29, 'ema2': 39, 'slip_atr_k': 0.08972002714716625, 'slip_spread_k': 0.0954628751703639, 'spread_hl_frac': 0.024360711097048092, 'bb_std_mult': 1.4458994705354207, 'rsi_os': 17, 'rsi_ob': 71, 'vol_spike': 0.15704626502442273, 'adx_thresh': 13.661022508218975, 'atr_min_pct': 0.012992997048242805, 'atr_max_pct': 0.024991778090667265, 'tp_mult': 1.84851091308192, 'tsl_mult': 0.7374181036167053, 'strategy': 'breakout', 'time_stop': 136, 'use_sma': False, 'use_atr': True, 'use_adx': False, 'use_ema': True, 'use_spike': True, 'rsi_required': True, 'edge_k': 0.442934458036232, 'edge_cap': 0.5037822167328682, 'bull_strategy': 'mean_reversion', 'bull_bb_std_mult': 2.4045606646550834, 'bull_rsi_os': 39, 'bull_rsi_ob': 47, 'bull_adx_thresh': 20.371483200513918, 'bull_atr_min_pct': 0.01918829835066963, 'bull_atr_max_pct': 0.06366184352525224, 'bull_tp_mult': 2.1567282106452685, 'bull_tsl_mult': 0.31583713631655846, 'bull_time_stop': 198, 'bull_use_sma': False, 'bull_use_ema': False, 'bull_use_atr': False, 'bull_use_adx': False, 'bull_use_spike': True, 'bull_rsi_required': False, 'bear_strategy': 'mean_reversion', 'bear_bb_std_mult': 0.5860984821953621, 'bear_rsi_os': 30, 'bear_rsi_ob': 81, 'bear_adx_thresh': 7.376089678555175, 'bear_atr_min_pct': 0.022347102565124503, 'bear_atr_max_pct': 0.09779728465101031, 'bear_tp_mult': 1.6084664977320566, 'bear_tsl_mult': 0.958357969452482, 'bear_time_stop': 60, 'bear_use_sma': True, 'bear_use_ema': True, 'bear_use_atr': True, 'bear_use_adx': False, 'bear_use_spike': False, 'bear_rsi_required': True, 'sideways_strategy': 'breakout', 'sideways_bb_std_mult': 2.5099723733492745, 'sideways_rsi_os': 48, 'sideways_rsi_ob': 57, 'sideways_adx_thresh': 27.67807058770063, 'sideways_atr_min_pct': 3.942447881708736e-05, 'sideways_atr_max_pct': 0.10445098423715293, 'sideways_tp_mult': 2.4754847569411926, 'sideways_tsl_mult': 0.9635268558120685, 'sideways_time_stop': 92, 'sideways_use_sma': True, 'sideways_use_ema': True, 'sideways_use_atr': True, 'sideways_use_adx': False, 'sideways_use_spike': True, 'sideways_rsi_required': False}.
[I 2025-08-30 15:14:15,434] Trial 398 finished with values: [-0.024828622104283937, 0.02474404521572041] and parameters: {'p_sma': 5, 'p_std': 60, 'p_atr': 15, 'p_adx': 26, 'rsi_period': 74, 'ema1': 8, 'ema2': 37, 'slip_atr_k': 0.10201306054060118, 'slip_spread_k': 0.13148833314896716, 'spread_hl_frac': 0.02476254030151978, 'bb_std_mult': 1.2289082019936248, 'rsi_os': 27, 'rsi_ob': 71, 'vol_spike': 0.15831278589379416, 'adx_thresh': 11.857447565114137, 'atr_min_pct': 0.013289870932734406, 'atr_max_pct': 0.07247772095781285, 'tp_mult': 2.006255046238446, 'tsl_mult': 0.7339713266390244, 'strategy': 'breakout', 'time_stop': 136, 'use_sma': False, 'use_atr': True, 'use_adx': False, 'use_ema': True, 'use_spike': True, 'rsi_required': True, 'edge_k': 0.32271306168410474, 'edge_cap': 0.5373493897025329, 'bull_strategy': 'mean_reversion', 'bull_bb_std_mult': 2.4746713832115685, 'bull_rsi_os': 39, 'bull_rsi_ob': 50, 'bull_adx_thresh': 20.518218504018023, 'bull_atr_min_pct': 0.02135549837293909, 'bull_atr_max_pct': 0.05906220441466656, 'bull_tp_mult': 2.1578346234400168, 'bull_tsl_mult': 0.35049883974497636, 'bull_time_stop': 184, 'bull_use_sma': False, 'bull_use_ema': True, 'bull_use_atr': False, 'bull_use_adx': False, 'bull_use_spike': True, 'bull_rsi_required': False, 'bear_strategy': 'mean_reversion', 'bear_bb_std_mult': 0.5064077609133106, 'bear_rsi_os': 29, 'bear_rsi_ob': 78, 'bear_adx_thresh': 26.935351261855853, 'bear_atr_min_pct': 0.023980169837404273, 'bear_atr_max_pct': 0.06997084972345441, 'bear_tp_mult': 1.6279823436033347, 'bear_tsl_mult': 0.9613810533814765, 'bear_time_stop': 63, 'bear_use_sma': True, 'bear_use_ema': True, 'bear_use_atr': True, 'bear_use_adx': True, 'bear_use_spike': False, 'bear_rsi_required': True, 'sideways_strategy': 'breakout', 'sideways_bb_std_mult': 2.376174599002951, 'sideways_rsi_os': 47, 'sideways_rsi_ob': 57, 'sideways_adx_thresh': 28.03494401140852, 'sideways_atr_min_pct': 5.322961937395828e-06, 'sideways_atr_max_pct': 0.10643968115073495, 'sideways_tp_mult': 2.527035928886577, 'sideways_tsl_mult': 0.9646517789318675, 'sideways_time_stop': 103, 'sideways_use_sma': True, 'sideways_use_ema': True, 'sideways_use_atr': True, 'sideways_use_adx': False, 'sideways_use_spike': True, 'sideways_rsi_required': False}.
[I 2025-08-30 15:15:02,040] Trial 405 finished with values: [-0.020152395355830577, 0.020081568867024297] and parameters: {'p_sma': 5, 'p_std': 58, 'p_atr': 15, 'p_adx': 27, 'rsi_period': 77, 'ema1': 14, 'ema2': 33, 'slip_atr_k': 0.09312079448123321, 'slip_spread_k': 0.017165696322786847, 'spread_hl_frac': 0.021861781145629266, 'bb_std_mult': 1.3255040094999104, 'rsi_os': 21, 'rsi_ob': 72, 'vol_spike': 0.16695674128588453, 'adx_thresh': 14.939105162500088, 'atr_min_pct': 0.01302269106364328, 'atr_max_pct': 0.07706643263790126, 'tp_mult': 2.096761142874164, 'tsl_mult': 0.7802436359777625, 'strategy': 'breakout', 'time_stop': 131, 'use_sma': False, 'use_atr': True, 'use_adx': True, 'use_ema': True, 'use_spike': True, 'rsi_required': True, 'edge_k': 0.01409343150589315, 'edge_cap': 0.5199450404175108, 'bull_strategy': 'mean_reversion', 'bull_bb_std_mult': 2.553227718028167, 'bull_rsi_os': 44, 'bull_rsi_ob': 61, 'bull_adx_thresh': 19.66157081436951, 'bull_atr_min_pct': 0.01864969867267844, 'bull_atr_max_pct': 0.06268848461196992, 'bull_tp_mult': 2.0891160192104885, 'bull_tsl_mult': 0.27945740564851174, 'bull_time_stop': 171, 'bull_use_sma': True, 'bull_use_ema': False, 'bull_use_atr': False, 'bull_use_adx': False, 'bull_use_spike': True, 'bull_rsi_required': False, 'bear_strategy': 'mean_reversion', 'bear_bb_std_mult': 2.128190944290096, 'bear_rsi_os': 33, 'bear_rsi_ob': 74, 'bear_adx_thresh': 29.322071831165392, 'bear_atr_min_pct': 0.025462510177497566, 'bear_atr_max_pct': 0.04879578005137289, 'bear_tp_mult': 1.5435689284672085, 'bear_tsl_mult': 0.9903505752020149, 'bear_time_stop': 169, 'bear_use_sma': True, 'bear_use_ema': True, 'bear_use_atr': True, 'bear_use_adx': False, 'bear_use_spike': False, 'bear_rsi_required': True, 'sideways_strategy': 'breakout', 'sideways_bb_std_mult': 2.756351421612621, 'sideways_rsi_os': 51, 'sideways_rsi_ob': 55, 'sideways_adx_thresh': 28.138613396670213, 'sideways_atr_min_pct': 0.0006638446551436861, 'sideways_atr_max_pct': 0.104915076594135, 'sideways_tp_mult': 2.426912529433456, 'sideways_tsl_mult': 0.8634680303065392, 'sideways_time_stop': 72, 'sideways_use_sma': True, 'sideways_use_ema': True, 'sideways_use_atr': True, 'sideways_use_adx': False, 'sideways_use_spike': False, 'sideways_rsi_required': False}.
[I 2025-08-30 15:15:03,271] Trial 402 finished with values: [-0.023626596193563665, 0.023563814489556297] and parameters: {'p_sma': 5, 'p_std': 60, 'p_atr': 15, 'p_adx': 26, 'rsi_period': 76, 'ema1': 29, 'ema2': 33, 'slip_atr_k': 0.13488066054822995, 'slip_spread_k': 0.12760742098999223, 'spread_hl_frac': 0.022078192604766768, 'bb_std_mult': 1.1353163229505694, 'rsi_os': 17, 'rsi_ob': 71, 'vol_spike': 0.1587893012574688, 'adx_thresh': 15.099240935918814, 'atr_min_pct': 0.013069145989563881, 'atr_max_pct': 0.04018667406040832, 'tp_mult': 1.8705215170846468, 'tsl_mult': 0.7721599443276745, 'strategy': 'breakout', 'time_stop': 134, 'use_sma': False, 'use_atr': True, 'use_adx': True, 'use_ema': True, 'use_spike': True, 'rsi_required': True, 'edge_k': 0.4334366481241316, 'edge_cap': 0.5100935626180977, 'bull_strategy': 'mean_reversion', 'bull_bb_std_mult': 2.5309358907254005, 'bull_rsi_os': 42, 'bull_rsi_ob': 54, 'bull_adx_thresh': 20.806650052615765, 'bull_atr_min_pct': 0.0237890050205286, 'bull_atr_max_pct': 0.061726947971747215, 'bull_tp_mult': 2.1334062710573334, 'bull_tsl_mult': 0.29089648868043405, 'bull_time_stop': 208, 'bull_use_sma': True, 'bull_use_ema': False, 'bull_use_atr': False, 'bull_use_adx': False, 'bull_use_spike': True, 'bull_rsi_required': False, 'bear_strategy': 'mean_reversion', 'bear_bb_std_mult': 0.5059034306226771, 'bear_rsi_os': 31, 'bear_rsi_ob': 57, 'bear_adx_thresh': 9.287610009249768, 'bear_atr_min_pct': 0.023329001896606257, 'bear_atr_max_pct': 0.09945678904480729, 'bear_tp_mult': 1.556254712670725, 'bear_tsl_mult': 0.9878571722196382, 'bear_time_stop': 176, 'bear_use_sma': True, 'bear_use_ema': True, 'bear_use_atr': True, 'bear_use_adx': False, 'bear_use_spike': False, 'bear_rsi_required': True, 'sideways_strategy': 'breakout', 'sideways_bb_std_mult': 2.505164447898623, 'sideways_rsi_os': 48, 'sideways_rsi_ob': 55, 'sideways_adx_thresh': 28.075019587994344, 'sideways_atr_min_pct': 0.00032685494638228364, 'sideways_atr_max_pct': 0.10507944607459399, 'sideways_tp_mult': 2.9948389283714123, 'sideways_tsl_mult': 0.9347014544623499, 'sideways_time_stop': 103, 'sideways_use_sma': True, 'sideways_use_ema': True, 'sideways_use_atr': True, 'sideways_use_adx': False, 'sideways_use_spike': True, 'sideways_rsi_required': False}.
[I 2025-08-30 15:15:03,617] Trial 404 finished with values: [-0.025276397846982768, 0.025204929577492957] and parameters: {'p_sma': 5, 'p_std': 58, 'p_atr': 15, 'p_adx': 26, 'rsi_period': 76, 'ema1': 6, 'ema2': 33, 'slip_atr_k': 0.09624968051540783, 'slip_spread_k': 0.011564916359782351, 'spread_hl_frac': 0.02267476420101349, 'bb_std_mult': 0.9663078623485621, 'rsi_os': 27, 'rsi_ob': 71, 'vol_spike': 0.1614375267760563, 'adx_thresh': 15.16129257152848, 'atr_min_pct': 0.0131711810705277, 'atr_max_pct': 0.08336948983347486, 'tp_mult': 2.0814205395340366, 'tsl_mult': 0.6631456053454952, 'strategy': 'breakout', 'time_stop': 133, 'use_sma': False, 'use_atr': True, 'use_adx': True, 'use_ema': True, 'use_spike': True, 'rsi_required': True, 'edge_k': 0.6870240272446184, 'edge_cap': 0.538915626737145, 'bull_strategy': 'mean_reversion', 'bull_bb_std_mult': 2.508420768077907, 'bull_rsi_os': 44, 'bull_rsi_ob': 54, 'bull_adx_thresh': 19.28913317632027, 'bull_atr_min_pct': 0.0218977977210805, 'bull_atr_max_pct': 0.061214401749148994, 'bull_tp_mult': 2.104498265307651, 'bull_tsl_mult': 0.27981548408589846, 'bull_time_stop': 209, 'bull_use_sma': True, 'bull_use_ema': False, 'bull_use_atr': False, 'bull_use_adx': False, 'bull_use_spike': True, 'bull_rsi_required': False, 'bear_strategy': 'mean_reversion', 'bear_bb_std_mult': 0.5995962156124721, 'bear_rsi_os': 35, 'bear_rsi_ob': 74, 'bear_adx_thresh': 27.307611548793336, 'bear_atr_min_pct': 0.02548088017092972, 'bear_atr_max_pct': 0.0663464947582317, 'bear_tp_mult': 1.5524821244251985, 'bear_tsl_mult': 0.9899282595135978, 'bear_time_stop': 297, 'bear_use_sma': True, 'bear_use_ema': True, 'bear_use_atr': True, 'bear_use_adx': False, 'bear_use_spike': False, 'bear_rsi_required': True, 'sideways_strategy': 'breakout', 'sideways_bb_std_mult': 2.637041448207473, 'sideways_rsi_os': 50, 'sideways_rsi_ob': 76, 'sideways_adx_thresh': 28.002719651629356, 'sideways_atr_min_pct': 0.0004953021750353537, 'sideways_atr_max_pct': 0.10522184938723479, 'sideways_tp_mult': 2.5297032532245494, 'sideways_tsl_mult': 0.9080896413485062, 'sideways_time_stop': 75, 'sideways_use_sma': True, 'sideways_use_ema': True, 'sideways_use_atr': True, 'sideways_use_adx': False, 'sideways_use_spike': True, 'sideways_rsi_required': False}.
