[I 2025-08-30 14:31:43,114] Trial 89 finished with values: [-1000000000.0, 1000000000.0] and parameters: {'p_sma': 31, 'p_std': 34, 'p_atr': 14, 'p_adx': 23, 'rsi_period': 52, 'ema1': 24, 'ema2': 45, 'slip_atr_k': 0.03268336835498312, 'slip_spread_k': 0.27436630293473174, 'spread_hl_frac': 0.004586278820940854, 'bb_std_mult': 2.1196835828580416, 'rsi_os': 28, 'rsi_ob': 95, 'vol_spike': 0.23714044338061274, 'adx_thresh': 19.360267728799734, 'atr_min_pct': 0.02167542812927609, 'atr_max_pct': 0.13041910102822457, 'tp_mult': 2.3247728513128205, 'tsl_mult': 0.23110309108701588, 'strategy': 'mean_reversion', 'time_stop': 151, 'use_sma': True, 'use_atr': True, 'use_adx': False, 'use_ema': True, 'use_spike': False, 'rsi_required': False, 'edge_k': 0.06765870063111623, 'edge_cap': 0.6419710348435719, 'bull_strategy': 'breakout', 'bull_bb_std_mult': 1.3638231780863799, 'bull_rsi_os': 17, 'bull_rsi_ob': 93, 'bull_adx_thresh': 12.670849136938164, 'bull_atr_min_pct': 0.017740357333858252, 'bull_atr_max_pct': 0.046012932711897526, 'bull_tp_mult': 1.8649291653660611, 'bull_tsl_mult': 0.6329253288246905, 'bull_time_stop': 182, 'bull_use_sma': False, 'bull_use_ema': False, 'bull_use_atr': True, 'bull_use_adx': True, 'bull_use_spike': False, 'bull_rsi_required': True, 'bear_strategy': 'breakout', 'bear_bb_std_mult': 1.0388470504232579, 'bear_rsi_os': 44, 'bear_rsi_ob': 81, 'bear_adx_thresh': 14.578572923286755, 'bear_atr_min_pct': 0.010015665808944666, 'bear_atr_max_pct': 0.03823932296798963, 'bear_tp_mult': 1.3751483354494674, 'bear_tsl_mult': 0.16038292454629363, 'bear_time_stop': 34, 'bear_use_sma': False, 'bear_use_ema': False, 'bear_use_atr': False, 'bear_use_adx': False, 'bear_use_spike': True, 'bear_rsi_required': False, 'sideways_strategy': 'breakout', 'sideways_bb_std_mult': 2.268116941812133, 'sideways_rsi_os': 43, 'sideways_rsi_ob': 84, 'sideways_adx_thresh': 16.54116943887988, 'sideways_atr_min_pct': 0.005025368456683825, 'sideways_atr_max_pct': 0.0757752437990174, 'sideways_tp_mult': 2.5932981289207975, 'sideways_tsl_mult': 0.10076020990408355, 'sideways_time_stop': 89, 'sideways_use_sma': False, 'sideways_use_ema': True, 'sideways_use_atr': False, 'sideways_use_adx': True, 'sideways_use_spike': True, 'sideways_rsi_required': True}.
[I 2025-08-30 14:32:14,372] Trial 94 finished with values: [-1000000000.0, 1000000000.0] and parameters: {'p_sma': 17, 'p_std': 8, 'p_atr': 27, 'p_adx': 21, 'rsi_period': 32, 'ema1': 15, 'ema2': 57, 'slip_atr_k': 0.00892407418220155, 'slip_spread_k': 0.12233351788624636, 'spread_hl_frac': 0.026832835655104994, 'bb_std_mult': 1.6882398640141354, 'rsi_os': 32, 'rsi_ob': 88, 'vol_spike': 0.2616963961022693, 'adx_thresh': 25.646874645392707, 'atr_min_pct': 0.015923069262681933, 'atr_max_pct': 0.10026889334163175, 'tp_mult': 2.5334962577169415, 'tsl_mult': 0.8249263834186009, 'strategy': 'mean_reversion', 'time_stop': 254, 'use_sma': False, 'use_atr': False, 'use_adx': False, 'use_ema': False, 'use_spike': False, 'rsi_required': False, 'edge_k': 1.7213631059054921, 'edge_cap': 0.7951532923816838, 'bull_strategy': 'breakout', 'bull_bb_std_mult': 0.9334823842416531, 'bull_rsi_os': 12, 'bull_rsi_ob': 80, 'bull_adx_thresh': 16.76057226463008, 'bull_atr_min_pct': 0.007428909791506644, 'bull_atr_max_pct': 0.1167692832043471, 'bull_tp_mult': 1.3372746163853095, 'bull_tsl_mult': 0.06482031989057702, 'bull_time_stop': 104, 'bull_use_sma': True, 'bull_use_ema': False, 'bull_use_atr': False, 'bull_use_adx': True, 'bull_use_spike': False, 'bull_rsi_required': True, 'bear_strategy': 'mean_reversion', 'bear_bb_std_mult': 0.8972018066279328, 'bear_rsi_os': 20, 'bear_rsi_ob': 88, 'bear_adx_thresh': 18.63280568811273, 'bear_atr_min_pct': 0.0013366064748474328, 'bear_atr_max_pct': 0.0206675409598759, 'bear_tp_mult': 1.9715501480135955, 'bear_tsl_mult': 0.09770246141037983, 'bear_time_stop': 119, 'bear_use_sma': False, 'bear_use_ema': True, 'bear_use_atr': False, 'bear_use_adx': True, 'bear_use_spike': False, 'bear_rsi_required': False, 'sideways_strategy': 'breakout', 'sideways_bb_std_mult': 3.3241119351556208, 'sideways_rsi_os': 25, 'sideways_rsi_ob': 56, 'sideways_adx_thresh': 15.335832967501673, 'sideways_atr_min_pct': 0.0030970781179119992, 'sideways_atr_max_pct': 0.11686765115409031, 'sideways_tp_mult': 2.8343562284073496, 'sideways_tsl_mult': 0.5577180712094889, 'sideways_time_stop': 246, 'sideways_use_sma': False, 'sideways_use_ema': False, 'sideways_use_atr': False, 'sideways_use_adx': True, 'sideways_use_spike': False, 'sideways_rsi_required': False}.
[I 2025-08-30 14:32:14,820] Trial 93 finished with values: [-0.047985387359265275, 0.04791007118693267] and parameters: {'p_sma': 18, 'p_std': 32, 'p_atr': 26, 'p_adx': 21, 'rsi_period': 39, 'ema1': 30, 'ema2': 51, 'slip_atr_k': 0.009994694127645042, 'slip_spread_k': 0.11515629902803809, 'spread_hl_frac': 0.014466657600412079, 'bb_std_mult': 1.6916957551794565, 'rsi_os': 37, 'rsi_ob': 95, 'vol_spike': 0.19731440001092654, 'adx_thresh': 25.226271159063604, 'atr_min_pct': 0.01732899419988975, 'atr_max_pct': 0.09290017617455631, 'tp_mult': 2.532785437740448, 'tsl_mult': 0.9997171302831568, 'strategy': 'mean_reversion', 'time_stop': 83, 'use_sma': True, 'use_atr': False, 'use_adx': False, 'use_ema': False, 'use_spike': False, 'rsi_required': False, 'edge_k': 0.03706107840177841, 'edge_cap': 0.6489043930143791, 'bull_strategy': 'breakout', 'bull_bb_std_mult': 1.3360486132218017, 'bull_rsi_os': 12, 'bull_rsi_ob': 85, 'bull_adx_thresh': 16.670897562443262, 'bull_atr_min_pct': 0.007879221493815257, 'bull_atr_max_pct': 0.014323547029063202, 'bull_tp_mult': 1.3082511073986989, 'bull_tsl_mult': 0.09759130485550743, 'bull_time_stop': 106, 'bull_use_sma': True, 'bull_use_ema': False, 'bull_use_atr': False, 'bull_use_adx': True, 'bull_use_spike': False, 'bull_rsi_required': True, 'bear_strategy': 'mean_reversion', 'bear_bb_std_mult': 0.9311720069087646, 'bear_rsi_os': 43, 'bear_rsi_ob': 51, 'bear_adx_thresh': 18.515973246625318, 'bear_atr_min_pct': 0.0013853368780064566, 'bear_atr_max_pct': 0.037964726743606084, 'bear_tp_mult': 1.7705402981448117, 'bear_tsl_mult': 0.3083485847951055, 'bear_time_stop': 128, 'bear_use_sma': False, 'bear_use_ema': True, 'bear_use_atr': False, 'bear_use_adx': True, 'bear_use_spike': False, 'bear_rsi_required': False, 'sideways_strategy': 'breakout', 'sideways_bb_std_mult': 3.490903789083693, 'sideways_rsi_os': 24, 'sideways_rsi_ob': 84, 'sideways_adx_thresh': 15.510230251132008, 'sideways_atr_min_pct': 0.006888645697565963, 'sideways_atr_max_pct': 0.11120243969008199, 'sideways_tp_mult': 2.8131249200697117, 'sideways_tsl_mult': 0.160563881428784, 'sideways_time_stop': 233, 'sideways_use_sma': False, 'sideways_use_ema': False, 'sideways_use_atr': False, 'sideways_use_adx': True, 'sideways_use_spike': True, 'sideways_rsi_required': True}.
[I 2025-08-30 14:32:15,389] Trial 91 finished with values: [-1000000000.0, 1000000000.0] and parameters: {'p_sma': 35, 'p_std': 37, 'p_atr': 27, 'p_adx': 21, 'rsi_period': 32, 'ema1': 28, 'ema2': 57, 'slip_atr_k': 0.011547021459197056, 'slip_spread_k': 0.1154897827575932, 'spread_hl_frac': 0.027019135480512147, 'bb_std_mult': 1.2584991411012396, 'rsi_os': 29, 'rsi_ob': 95, 'vol_spike': 0.19835758869043293, 'adx_thresh': 26.111533141364966, 'atr_min_pct': 0.020658748822223093, 'atr_max_pct': 0.12787596455243838, 'tp_mult': 2.5258199162992505, 'tsl_mult': 0.8226475008466141, 'strategy': 'mean_reversion', 'time_stop': 253, 'use_sma': True, 'use_atr': True, 'use_adx': False, 'use_ema': True, 'use_spike': False, 'rsi_required': False, 'edge_k': 0.0027536408758683795, 'edge_cap': 0.8171855914231702, 'bull_strategy': 'breakout', 'bull_bb_std_mult': 1.3516435108371514, 'bull_rsi_os': 5, 'bull_rsi_ob': 68, 'bull_adx_thresh': 16.715728988884425, 'bull_atr_min_pct': 0.01164484326953374, 'bull_atr_max_pct': 0.013431345351049484, 'bull_tp_mult': 1.3057428170452694, 'bull_tsl_mult': 0.46583719542436813, 'bull_time_stop': 94, 'bull_use_sma': True, 'bull_use_ema': False, 'bull_use_atr': True, 'bull_use_adx': True, 'bull_use_spike': False, 'bull_rsi_required': True, 'bear_strategy': 'breakout', 'bear_bb_std_mult': 3.04530859905797, 'bear_rsi_os': 45, 'bear_rsi_ob': 53, 'bear_adx_thresh': 12.565824671122506, 'bear_atr_min_pct': 0.00957797385899041, 'bear_atr_max_pct': 0.020835034315496714, 'bear_tp_mult': 1.9765751849023296, 'bear_tsl_mult': 0.10499167383984359, 'bear_time_stop': 119, 'bear_use_sma': False, 'bear_use_ema': True, 'bear_use_atr': False, 'bear_use_adx': True, 'bear_use_spike': False, 'bear_rsi_required': False, 'sideways_strategy': 'breakout', 'sideways_bb_std_mult': 3.4732608821889706, 'sideways_rsi_os': 24, 'sideways_rsi_ob': 84, 'sideways_adx_thresh': 15.03237013072456, 'sideways_atr_min_pct': 0.0028777778817393675, 'sideways_atr_max_pct': 0.14001739941111105, 'sideways_tp_mult': 2.807074006240839, 'sideways_tsl_mult': 0.9971478502437805, 'sideways_time_stop': 196, 'sideways_use_sma': False, 'sideways_use_ema': True, 'sideways_use_atr': False, 'sideways_use_adx': True, 'sideways_use_spike': True, 'sideways_rsi_required': True}.
[I 2025-08-30 14:32:15,404] Trial 92 finished with values: [-1000000000.0, 1000000000.0] and parameters: {'p_sma': 7, 'p_std': 37, 'p_atr': 26, 'p_adx': 21, 'rsi_period': 65, 'ema1': 14, 'ema2': 46, 'slip_atr_k': 0.24774689999239402, 'slip_spread_k': 0.12643771437700013, 'spread_hl_frac': 0.03771057786333078, 'bb_std_mult': 1.2756261808028946, 'rsi_os': 29, 'rsi_ob': 95, 'vol_spike': 0.21232419285167137, 'adx_thresh': 25.661579436614513, 'atr_min_pct': 0.01595228866878933, 'atr_max_pct': 0.13110774874662548, 'tp_mult': 2.523688793660296, 'tsl_mult': 0.4422735941275095, 'strategy': 'mean_reversion', 'time_stop': 116, 'use_sma': True, 'use_atr': True, 'use_adx': False, 'use_ema': True, 'use_spike': False, 'rsi_required': False, 'edge_k': 0.00392427754122493, 'edge_cap': 0.9594489715118488, 'bull_strategy': 'breakout', 'bull_bb_std_mult': 3.072036457064406, 'bull_rsi_os': 12, 'bull_rsi_ob': 80, 'bull_adx_thresh': 13.045249992248822, 'bull_atr_min_pct': 0.0075566118678915516, 'bull_atr_max_pct': 0.012875639500191846, 'bull_tp_mult': 1.3352684579531118, 'bull_tsl_mult': 0.47587899690427227, 'bull_time_stop': 94, 'bull_use_sma': True, 'bull_use_ema': False, 'bull_use_atr': True, 'bull_use_adx': True, 'bull_use_spike': False, 'bull_rsi_required': True, 'bear_strategy': 'breakout', 'bear_bb_std_mult': 0.9431499245984531, 'bear_rsi_os': 13, 'bear_rsi_ob': 54, 'bear_adx_thresh': 18.554536252159707, 'bear_atr_min_pct': 0.024240773442490017, 'bear_atr_max_pct': 0.12373298856021164, 'bear_tp_mult': 1.7835173912679525, 'bear_tsl_mult': 0.30098078126573463, 'bear_time_stop': 118, 'bear_use_sma': False, 'bear_use_ema': True, 'bear_use_atr': False, 'bear_use_adx': True, 'bear_use_spike': False, 'bear_rsi_required': False, 'sideways_strategy': 'breakout', 'sideways_bb_std_mult': 3.2986215592737564, 'sideways_rsi_os': 43, 'sideways_rsi_ob': 85, 'sideways_adx_thresh': 14.77688052265927, 'sideways_atr_min_pct': 0.0031113484064392224, 'sideways_atr_max_pct': 0.1121349142011174, 'sideways_tp_mult': 2.1875179978593025, 'sideways_tsl_mult': 0.5594823912584601, 'sideways_time_stop': 196, 'sideways_use_sma': False, 'sideways_use_ema': True, 'sideways_use_atr': False, 'sideways_use_adx': True, 'sideways_use_spike': True, 'sideways_rsi_required': True}.
[I 2025-08-30 14:32:15,850] Trial 98 finished with values: [-1000000000.0, 1000000000.0] and parameters: {'p_sma': 33, 'p_std': 28, 'p_atr': 9, 'p_adx': 27, 'rsi_period': 84, 'ema1': 18, 'ema2': 20, 'slip_atr_k': 0.2203672400780898, 'slip_spread_k': 0.179199894943756, 'spread_hl_frac': 0.00756044598731774, 'bb_std_mult': 1.4947058387198444, 'rsi_os': 51, 'rsi_ob': 55, 'vol_spike': 0.05104235502866743, 'adx_thresh': 29.317662222500132, 'atr_min_pct': 0.019129202608779497, 'atr_max_pct': 0.1187867110364791, 'tp_mult': 2.828491821959664, 'tsl_mult': 0.9755889540261178, 'strategy': 'mean_reversion', 'time_stop': 99, 'use_sma': False, 'use_atr': False, 'use_adx': False, 'use_ema': False, 'use_spike': False, 'rsi_required': False, 'edge_k': 1.8298813323841179, 'edge_cap': 0.49750334292951615, 'bull_strategy': 'breakout', 'bull_bb_std_mult': 0.6683604485937129, 'bull_rsi_os': 9, 'bull_rsi_ob': 77, 'bull_adx_thresh': 29.047560356672182, 'bull_atr_min_pct': 0.011008201381951542, 'bull_atr_max_pct': 0.06760584725506112, 'bull_tp_mult': 1.4459371743263594, 'bull_tsl_mult': 0.5410383659228416, 'bull_time_stop': 36, 'bull_use_sma': False, 'bull_use_ema': False, 'bull_use_atr': True, 'bull_use_adx': True, 'bull_use_spike': False, 'bull_rsi_required': True, 'bear_strategy': 'breakout', 'bear_bb_std_mult': 0.5304303283482086, 'bear_rsi_os': 52, 'bear_rsi_ob': 49, 'bear_adx_thresh': 8.012321434733671, 'bear_atr_min_pct': 0.018285630679854135, 'bear_atr_max_pct': 0.0251810224628557, 'bear_tp_mult': 1.6296366285651334, 'bear_tsl_mult': 0.4137811003667428, 'bear_time_stop': 71, 'bear_use_sma': False, 'bear_use_ema': False, 'bear_use_atr': False, 'bear_use_adx': False, 'bear_use_spike': True, 'bear_rsi_required': False, 'sideways_strategy': 'breakout', 'sideways_bb_std_mult': 1.9182847995551087, 'sideways_rsi_os': 50, 'sideways_rsi_ob': 88, 'sideways_adx_thresh': 17.31360154902934, 'sideways_atr_min_pct': 0.00033726423256991893, 'sideways_atr_max_pct': 0.09417072101678642, 'sideways_tp_mult': 2.0624531292302644, 'sideways_tsl_mult': 0.14913627637971932, 'sideways_time_stop': 262, 'sideways_use_sma': False, 'sideways_use_ema': False, 'sideways_use_atr': False, 'sideways_use_adx': True, 'sideways_use_spike': False, 'sideways_rsi_required': False}.
[I 2025-08-30 14:32:15,850] Trial 97 finished with values: [-1000000000.0, 1000000000.0] and parameters: {'p_sma': 11, 'p_std': 28, 'p_atr': 9, 'p_adx': 18, 'rsi_period': 82, 'ema1': 18, 'ema2': 20, 'slip_atr_k': 0.021413477398705, 'slip_spread_k': 0.3127493370925902, 'spread_hl_frac': 0.033779564604944336, 'bb_std_mult': 1.982181941291957, 'rsi_os': 53, 'rsi_ob': 55, 'vol_spike': 0.2210459535178057, 'adx_thresh': 29.332120943801993, 'atr_min_pct': 0.019095556096135485, 'atr_max_pct': 0.11974228766246227, 'tp_mult': 2.646644929891172, 'tsl_mult': 0.9709623226929074, 'strategy': 'mean_reversion', 'time_stop': 172, 'use_sma': False, 'use_atr': False, 'use_adx': False, 'use_ema': False, 'use_spike': False, 'rsi_required': False, 'edge_k': 1.8309532778594584, 'edge_cap': 0.49271871868965184, 'bull_strategy': 'breakout', 'bull_bb_std_mult': 3.315492768713976, 'bull_rsi_os': 8, 'bull_rsi_ob': 77, 'bull_adx_thresh': 5.911543875732246, 'bull_atr_min_pct': 0.024542740697541268, 'bull_atr_max_pct': 0.06590075414492282, 'bull_tp_mult': 1.425561374694308, 'bull_tsl_mult': 0.5410837424027118, 'bull_time_stop': 271, 'bull_use_sma': False, 'bull_use_ema': False, 'bull_use_atr': True, 'bull_use_adx': True, 'bull_use_spike': False, 'bull_rsi_required': True, 'bear_strategy': 'breakout', 'bear_bb_std_mult': 0.5749833079426785, 'bear_rsi_os': 40, 'bear_rsi_ob': 75, 'bear_adx_thresh': 17.837081759226066, 'bear_atr_min_pct': 0.01845038802119707, 'bear_atr_max_pct': 0.025324092536064626, 'bear_tp_mult': 1.5741007060953072, 'bear_tsl_mult': 0.34211466690332193, 'bear_time_stop': 82, 'bear_use_sma': False, 'bear_use_ema': False, 'bear_use_atr': False, 'bear_use_adx': False, 'bear_use_spike': True, 'bear_rsi_required': False, 'sideways_strategy': 'breakout', 'sideways_bb_std_mult': 3.1048992089083645, 'sideways_rsi_os': 19, 'sideways_rsi_ob': 88, 'sideways_adx_thresh': 17.24044021957845, 'sideways_atr_min_pct': 0.00882798250668042, 'sideways_atr_max_pct': 0.09402894210433246, 'sideways_tp_mult': 2.4317659567621175, 'sideways_tsl_mult': 0.7369145114179352, 'sideways_time_stop': 238, 'sideways_use_sma': False, 'sideways_use_ema': False, 'sideways_use_atr': False, 'sideways_use_adx': True, 'sideways_use_spike': False, 'sideways_rsi_required': False}.
[I 2025-08-30 14:32:45,582] Trial 95 finished with values: [-1000000000.0, 1000000000.0] and parameters: {'p_sma': 35, 'p_std': 32, 'p_atr': 26, 'p_adx': 20, 'rsi_period': 38, 'ema1': 26, 'ema2': 58, 'slip_atr_k': 0.011179163866824597, 'slip_spread_k': 0.2185011490268791, 'spread_hl_frac': 0.034293459633448764, 'bb_std_mult': 1.2512774386013383, 'rsi_os': 38, 'rsi_ob': 58, 'vol_spike': 0.26240644558820747, 'adx_thresh': 20.02399748252558, 'atr_min_pct': 0.020624056518903238, 'atr_max_pct': 0.11938409829290918, 'tp_mult': 2.634285010392682, 'tsl_mult': 0.35925259597845716, 'strategy': 'mean_reversion', 'time_stop': 82, 'use_sma': True, 'use_atr': False, 'use_adx': False, 'use_ema': False, 'use_spike': False, 'rsi_required': False, 'edge_k': 1.83743402594436, 'edge_cap': 0.8222222271640687, 'bull_strategy': 'breakout', 'bull_bb_std_mult': 3.4564264403022285, 'bull_rsi_os': 11, 'bull_rsi_ob': 77, 'bull_adx_thresh': 29.452769568780468, 'bull_atr_min_pct': 0.024828939256765964, 'bull_atr_max_pct': 0.06358977341179145, 'bull_tp_mult': 1.5046279289181381, 'bull_tsl_mult': 0.4826730284710569, 'bull_time_stop': 25, 'bull_use_sma': True, 'bull_use_ema': False, 'bull_use_atr': True, 'bull_use_adx': True, 'bull_use_spike': False, 'bull_rsi_required': True, 'bear_strategy': 'breakout', 'bear_bb_std_mult': 0.9454575578357121, 'bear_rsi_os': 13, 'bear_rsi_ob': 50, 'bear_adx_thresh': 7.6247135783813995, 'bear_atr_min_pct': 0.024152150323600623, 'bear_atr_max_pct': 0.12380930413205057, 'bear_tp_mult': 1.7982928689747264, 'bear_tsl_mult': 0.43535032106235083, 'bear_time_stop': 130, 'bear_use_sma': False, 'bear_use_ema': True, 'bear_use_atr': False, 'bear_use_adx': False, 'bear_use_spike': False, 'bear_rsi_required': False, 'sideways_strategy': 'breakout', 'sideways_bb_std_mult': 3.4641338024035515, 'sideways_rsi_os': 20, 'sideways_rsi_ob': 88, 'sideways_adx_thresh': 14.415323201649306, 'sideways_atr_min_pct': 0.0069217335034724055, 'sideways_atr_max_pct': 0.14043217500826716, 'sideways_tp_mult': 2.1704904505422435, 'sideways_tsl_mult': 0.15774428673694352, 'sideways_time_stop': 195, 'sideways_use_sma': False, 'sideways_use_ema': False, 'sideways_use_atr': False, 'sideways_use_adx': True, 'sideways_use_spike': True, 'sideways_rsi_required': True}.
[I 2025-08-30 14:32:45,737] Trial 96 finished with values: [-0.06774640991709935, 0.06761270049909632] and parameters: {'p_sma': 35, 'p_std': 28, 'p_atr': 9, 'p_adx': 20, 'rsi_period': 64, 'ema1': 27, 'ema2': 33, 'slip_atr_k': 0.2492434099482162, 'slip_spread_k': 0.16953689732632127, 'spread_hl_frac': 0.030444570107252083, 'bb_std_mult': 1.4808466033563463, 'rsi_os': 49, 'rsi_ob': 55, 'vol_spike': 0.21754300738831145, 'adx_thresh': 23.964686147555884, 'atr_min_pct': 0.007932905128015012, 'atr_max_pct': 0.10818056194977019, 'tp_mult': 1.2771804732841567, 'tsl_mult': 0.9696708127989714, 'strategy': 'mean_reversion', 'time_stop': 96, 'use_sma': True, 'use_atr': False, 'use_adx': False, 'use_ema': False, 'use_spike': False, 'rsi_required': False, 'edge_k': 1.8551640650652412, 'edge_cap': 0.8097757120782628, 'bull_strategy': 'breakout', 'bull_bb_std_mult': 3.4350678933939762, 'bull_rsi_os': 8, 'bull_rsi_ob': 73, 'bull_adx_thresh': 29.215539364574838, 'bull_atr_min_pct': 0.02462165067965005, 'bull_atr_max_pct': 0.02528084234363276, 'bull_tp_mult': 1.4595243192258776, 'bull_tsl_mult': 0.0002467445150929892, 'bull_time_stop': 30, 'bull_use_sma': False, 'bull_use_ema': False, 'bull_use_atr': True, 'bull_use_adx': True, 'bull_use_spike': False, 'bull_rsi_required': True, 'bear_strategy': 'breakout', 'bear_bb_std_mult': 3.135959504948553, 'bear_rsi_os': 13, 'bear_rsi_ob': 49, 'bear_adx_thresh': 12.011638177801107, 'bear_atr_min_pct': 0.02440005527707044, 'bear_atr_max_pct': 0.12602549044261524, 'bear_tp_mult': 1.105652919659823, 'bear_tsl_mult': 0.4425044636893335, 'bear_time_stop': 148, 'bear_use_sma': False, 'bear_use_ema': False, 'bear_use_atr': False, 'bear_use_adx': False, 'bear_use_spike': True, 'bear_rsi_required': False, 'sideways_strategy': 'breakout', 'sideways_bb_std_mult': 2.8183892158915436, 'sideways_rsi_os': 51, 'sideways_rsi_ob': 87, 'sideways_adx_thresh': 19.32847002758185, 'sideways_atr_min_pct': 0.0026979463805585453, 'sideways_atr_max_pct': 0.09241699194913362, 'sideways_tp_mult': 2.184845992671884, 'sideways_tsl_mult': 0.035385953494193004, 'sideways_time_stop': 206, 'sideways_use_sma': False, 'sideways_use_ema': False, 'sideways_use_atr': False, 'sideways_use_adx': True, 'sideways_use_spike': True, 'sideways_rsi_required': True}.
