[I 2025-08-30 14:47:39,717] Trial 223 finished with values: [-1000000000.0, 1000000000.0] and parameters: {'p_sma': 9, 'p_std': 56, 'p_atr': 14, 'p_adx': 17, 'rsi_period': 51, 'ema1': 28, 'ema2': 32, 'slip_atr_k': 0.006200599042224739, 'slip_spread_k': 0.5805217796778872, 'spread_hl_frac': 0.04885851507899915, 'bb_std_mult': 0.9043593873317244, 'rsi_os': 37, 'rsi_ob': 91, 'vol_spike': 0.26045040277896414, 'adx_thresh': 10.264019455040861, 'atr_min_pct': 0.020949089199649187, 'atr_max_pct': 0.07782878692197036, 'tp_mult': 1.9331148039208357, 'tsl_mult': 0.961957832208877, 'strategy': 'breakout', 'time_stop': 20, 'use_sma': True, 'use_atr': False, 'use_adx': False, 'use_ema': False, 'use_spike': True, 'rsi_required': True, 'edge_k': 1.9308364079082632, 'edge_cap': 0.7034859156492812, 'bull_strategy': 'breakout', 'bull_bb_std_mult': 3.1112262342157937, 'bull_rsi_os': 17, 'bull_rsi_ob': 95, 'bull_adx_thresh': 13.368659047787684, 'bull_atr_min_pct': 0.0030763732651775838, 'bull_atr_max_pct': 0.11042856518714383, 'bull_tp_mult': 1.8265946803266657, 'bull_tsl_mult': 0.3382994967010991, 'bull_time_stop': 231, 'bull_use_sma': False, 'bull_use_ema': True, 'bull_use_atr': True, 'bull_use_adx': False, 'bull_use_spike': False, 'bull_rsi_required': True, 'bear_strategy': 'breakout', 'bear_bb_std_mult': 0.6118815533093773, 'bear_rsi_os': 7, 'bear_rsi_ob': 49, 'bear_adx_thresh': 19.033335879492856, 'bear_atr_min_pct': 0.014156749639117219, 'bear_atr_max_pct': 0.09741661473720611, 'bear_tp_mult': 2.026975988507439, 'bear_tsl_mult': 0.23354820957431516, 'bear_time_stop': 196, 'bear_use_sma': True, 'bear_use_ema': False, 'bear_use_atr': False, 'bear_use_adx': False, 'bear_use_spike': False, 'bear_rsi_required': False, 'sideways_strategy': 'breakout', 'sideways_bb_std_mult': 3.1412528379639766, 'sideways_rsi_os': 32, 'sideways_rsi_ob': 73, 'sideways_adx_thresh': 27.907756986135574, 'sideways_atr_min_pct': 0.0051841304946075115, 'sideways_atr_max_pct': 0.08081063316683858, 'sideways_tp_mult': 1.4328838889375106, 'sideways_tsl_mult': 0.01824310769846571, 'sideways_time_stop': 234, 'sideways_use_sma': False, 'sideways_use_ema': False, 'sideways_use_atr': False, 'sideways_use_adx': True, 'sideways_use_spike': True, 'sideways_rsi_required': False}.
[I 2025-08-30 14:47:40,254] Trial 228 finished with values: [-1000000000.0, 1000000000.0] and parameters: {'p_sma': 31, 'p_std': 29, 'p_atr': 7, 'p_adx': 21, 'rsi_period': 50, 'ema1': 21, 'ema2': 53, 'slip_atr_k': 0.12250620864379833, 'slip_spread_k': 0.2714692991766589, 'spread_hl_frac': 0.040522559348185785, 'bb_std_mult': 2.2705171546091227, 'rsi_os': 13, 'rsi_ob': 48, 'vol_spike': 0.28555985626846636, 'adx_thresh': 25.096149961216323, 'atr_min_pct': 0.022325930937250955, 'atr_max_pct': 0.025761158180467356, 'tp_mult': 2.606468131973742, 'tsl_mult': 0.8345580645730735, 'strategy': 'mean_reversion', 'time_stop': 27, 'use_sma': True, 'use_atr': False, 'use_adx': False, 'use_ema': False, 'use_spike': False, 'rsi_required': False, 'edge_k': 1.2532555095002538, 'edge_cap': 0.6972858455873994, 'bull_strategy': 'breakout', 'bull_bb_std_mult': 3.2903368769538326, 'bull_rsi_os': 14, 'bull_rsi_ob': 79, 'bull_adx_thresh': 12.473597706260776, 'bull_atr_min_pct': 0.0032465989847387518, 'bull_atr_max_pct': 0.11082934041740547, 'bull_tp_mult': 1.364923903580422, 'bull_tsl_mult': 0.3683555896197457, 'bull_time_stop': 249, 'bull_use_sma': False, 'bull_use_ema': False, 'bull_use_atr': False, 'bull_use_adx': True, 'bull_use_spike': True, 'bull_rsi_required': False, 'bear_strategy': 'mean_reversion', 'bear_bb_std_mult': 1.457193569356055, 'bear_rsi_os': 15, 'bear_rsi_ob': 50, 'bear_adx_thresh': 7.083973325261383, 'bear_atr_min_pct': 0.010456845302593583, 'bear_atr_max_pct': 0.02467827871309189, 'bear_tp_mult': 1.9603338916784818, 'bear_tsl_mult': 0.8058248377454738, 'bear_time_stop': 42, 'bear_use_sma': False, 'bear_use_ema': False, 'bear_use_atr': False, 'bear_use_adx': True, 'bear_use_spike': True, 'bear_rsi_required': True, 'sideways_strategy': 'breakout', 'sideways_bb_std_mult': 0.8380094136772902, 'sideways_rsi_os': 31, 'sideways_rsi_ob': 63, 'sideways_adx_thresh': 15.015510760182321, 'sideways_atr_min_pct': 0.012244908222356674, 'sideways_atr_max_pct': 0.07676445764303286, 'sideways_tp_mult': 2.808905306093563, 'sideways_tsl_mult': 0.019135003478963214, 'sideways_time_stop': 243, 'sideways_use_sma': True, 'sideways_use_ema': False, 'sideways_use_atr': False, 'sideways_use_adx': True, 'sideways_use_spike': False, 'sideways_rsi_required': True}.
[I 2025-08-30 14:48:10,549] Trial 226 finished with values: [-0.02464371513812258, 0.025225155279002348] and parameters: {'p_sma': 31, 'p_std': 12, 'p_atr': 9, 'p_adx': 21, 'rsi_period': 49, 'ema1': 27, 'ema2': 36, 'slip_atr_k': 0.09696565854176079, 'slip_spread_k': 0.24475734456761877, 'spread_hl_frac': 0.036413301414447125, 'bb_std_mult': 2.2904081970915575, 'rsi_os': 35, 'rsi_ob': 58, 'vol_spike': 0.10588236375915028, 'adx_thresh': 21.31946938781507, 'atr_min_pct': 0.020863335787309444, 'atr_max_pct': 0.1128335568651039, 'tp_mult': 2.5867051197696256, 'tsl_mult': 0.7905337884875667, 'strategy': 'mean_reversion', 'time_stop': 19, 'use_sma': True, 'use_atr': False, 'use_adx': True, 'use_ema': False, 'use_spike': False, 'rsi_required': False, 'edge_k': 1.6497327711316376, 'edge_cap': 0.7062993732565489, 'bull_strategy': 'breakout', 'bull_bb_std_mult': 2.141283997263325, 'bull_rsi_os': 14, 'bull_rsi_ob': 68, 'bull_adx_thresh': 13.563334498202908, 'bull_atr_min_pct': 0.003112300965798825, 'bull_atr_max_pct': 0.11159083271301118, 'bull_tp_mult': 1.4749732418626669, 'bull_tsl_mult': 0.3342841736500915, 'bull_time_stop': 274, 'bull_use_sma': True, 'bull_use_ema': False, 'bull_use_atr': False, 'bull_use_adx': False, 'bull_use_spike': False, 'bull_rsi_required': True, 'bear_strategy': 'mean_reversion', 'bear_bb_std_mult': 1.2311163968511893, 'bear_rsi_os': 13, 'bear_rsi_ob': 50, 'bear_adx_thresh': 17.69977737288409, 'bear_atr_min_pct': 0.010777028619365955, 'bear_atr_max_pct': 0.0250231933231917, 'bear_tp_mult': 2.0153916855918284, 'bear_tsl_mult': 0.5490254147365903, 'bear_time_stop': 38, 'bear_use_sma': False, 'bear_use_ema': False, 'bear_use_atr': False, 'bear_use_adx': False, 'bear_use_spike': False, 'bear_rsi_required': False, 'sideways_strategy': 'breakout', 'sideways_bb_std_mult': 3.139286270746011, 'sideways_rsi_os': 33, 'sideways_rsi_ob': 52, 'sideways_adx_thresh': 29.011487568559797, 'sideways_atr_min_pct': 0.0045089408054400535, 'sideways_atr_max_pct': 0.10261316110520541, 'sideways_tp_mult': 2.8125318766502243, 'sideways_tsl_mult': 0.11568881207746091, 'sideways_time_stop': 36, 'sideways_use_sma': False, 'sideways_use_ema': False, 'sideways_use_atr': False, 'sideways_use_adx': True, 'sideways_use_spike': True, 'sideways_rsi_required': True}.
[I 2025-08-30 14:48:11,225] Trial 229 finished with values: [-1000000000.0, 1000000000.0] and parameters: {'p_sma': 19, 'p_std': 29, 'p_atr': 12, 'p_adx': 10, 'rsi_period': 49, 'ema1': 27, 'ema2': 36, 'slip_atr_k': 0.025413987646838478, 'slip_spread_k': 0.2827611780676861, 'spread_hl_frac': 0.0030420008032253417, 'bb_std_mult': 2.084526898294531, 'rsi_os': 35, 'rsi_ob': 56, 'vol_spike': 0.20690040094303305, 'adx_thresh': 21.253706320358575, 'atr_min_pct': 0.027025749269017657, 'atr_max_pct': 0.063196982284909, 'tp_mult': 1.551859417204667, 'tsl_mult': 0.8374797777781219, 'strategy': 'mean_reversion', 'time_stop': 148, 'use_sma': True, 'use_atr': False, 'use_adx': False, 'use_ema': False, 'use_spike': False, 'rsi_required': False, 'edge_k': 1.6492384721783344, 'edge_cap': 0.5344286601142441, 'bull_strategy': 'breakout', 'bull_bb_std_mult': 2.168253527971615, 'bull_rsi_os': 14, 'bull_rsi_ob': 79, 'bull_adx_thresh': 12.530720984678204, 'bull_atr_min_pct': 0.0032834306855466077, 'bull_atr_max_pct': 0.024081675628912426, 'bull_tp_mult': 2.267723217060181, 'bull_tsl_mult': 0.7883076149780393, 'bull_time_stop': 257, 'bull_use_sma': True, 'bull_use_ema': False, 'bull_use_atr': False, 'bull_use_adx': True, 'bull_use_spike': True, 'bull_rsi_required': False, 'bear_strategy': 'mean_reversion', 'bear_bb_std_mult': 0.916837436550453, 'bear_rsi_os': 30, 'bear_rsi_ob': 45, 'bear_adx_thresh': 18.174648953322997, 'bear_atr_min_pct': 0.012752107864283184, 'bear_atr_max_pct': 0.024944794079370648, 'bear_tp_mult': 1.9682346671195634, 'bear_tsl_mult': 0.5705884869848563, 'bear_time_stop': 39, 'bear_use_sma': False, 'bear_use_ema': False, 'bear_use_atr': False, 'bear_use_adx': True, 'bear_use_spike': True, 'bear_rsi_required': True, 'sideways_strategy': 'breakout', 'sideways_bb_std_mult': 3.2214278607277618, 'sideways_rsi_os': 48, 'sideways_rsi_ob': 63, 'sideways_adx_thresh': 29.731282430174993, 'sideways_atr_min_pct': 0.011369159945842209, 'sideways_atr_max_pct': 0.10710559287918732, 'sideways_tp_mult': 2.800730968182305, 'sideways_tsl_mult': 0.6231951775087928, 'sideways_time_stop': 249, 'sideways_use_sma': True, 'sideways_use_ema': False, 'sideways_use_atr': False, 'sideways_use_adx': True, 'sideways_use_spike': False, 'sideways_rsi_required': True}.
[I 2025-08-30 14:48:11,238] Trial 227 finished with values: [-1000000000.0, 1000000000.0] and parameters: {'p_sma': 31, 'p_std': 12, 'p_atr': 7, 'p_adx': 28, 'rsi_period': 49, 'ema1': 27, 'ema2': 53, 'slip_atr_k': 0.024109102150708384, 'slip_spread_k': 0.2412260102652534, 'spread_hl_frac': 0.041558302219584176, 'bb_std_mult': 2.0155296422367512, 'rsi_os': 35, 'rsi_ob': 58, 'vol_spike': 0.23618054043589387, 'adx_thresh': 5.612668445426904, 'atr_min_pct': 0.020371237397202792, 'atr_max_pct': 0.11260735567515075, 'tp_mult': 1.6728728760909402, 'tsl_mult': 0.8261178918395324, 'strategy': 'mean_reversion', 'time_stop': 146, 'use_sma': False, 'use_atr': False, 'use_adx': True, 'use_ema': False, 'use_spike': False, 'rsi_required': False, 'edge_k': 1.2727728683310435, 'edge_cap': 0.7015534725895173, 'bull_strategy': 'breakout', 'bull_bb_std_mult': 2.1487830824651373, 'bull_rsi_os': 16, 'bull_rsi_ob': 78, 'bull_adx_thresh': 26.502051061344723, 'bull_atr_min_pct': 0.00320368313502565, 'bull_atr_max_pct': 0.11024800104008467, 'bull_tp_mult': 1.8151939765992107, 'bull_tsl_mult': 0.3687493095869488, 'bull_time_stop': 274, 'bull_use_sma': True, 'bull_use_ema': False, 'bull_use_atr': False, 'bull_use_adx': False, 'bull_use_spike': False, 'bull_rsi_required': True, 'bear_strategy': 'mean_reversion', 'bear_bb_std_mult': 1.2936656479960458, 'bear_rsi_os': 14, 'bear_rsi_ob': 49, 'bear_adx_thresh': 17.81374538080579, 'bear_atr_min_pct': 0.010750120856596438, 'bear_atr_max_pct': 0.1133380407772406, 'bear_tp_mult': 1.9764081498021246, 'bear_tsl_mult': 0.23220736528866248, 'bear_time_stop': 40, 'bear_use_sma': False, 'bear_use_ema': True, 'bear_use_atr': True, 'bear_use_adx': False, 'bear_use_spike': True, 'bear_rsi_required': True, 'sideways_strategy': 'breakout', 'sideways_bb_std_mult': 3.2085745799850818, 'sideways_rsi_os': 6, 'sideways_rsi_ob': 45, 'sideways_adx_thresh': 15.151570129324078, 'sideways_atr_min_pct': 0.004220001176831685, 'sideways_atr_max_pct': 0.10224686373586789, 'sideways_tp_mult': 1.4899478093270075, 'sideways_tsl_mult': 0.12156063535617383, 'sideways_time_stop': 28, 'sideways_use_sma': False, 'sideways_use_ema': False, 'sideways_use_atr': False, 'sideways_use_adx': True, 'sideways_use_spike': False, 'sideways_rsi_required': False}.
[I 2025-08-30 14:48:12,084] Trial 230 finished with values: [-1000000000.0, 1000000000.0] and parameters: {'p_sma': 19, 'p_std': 28, 'p_atr': 12, 'p_adx': 22, 'rsi_period': 49, 'ema1': 27, 'ema2': 13, 'slip_atr_k': 0.023429321667408354, 'slip_spread_k': 0.2476863022061031, 'spread_hl_frac': 0.001868847338712742, 'bb_std_mult': 2.095875216571964, 'rsi_os': 35, 'rsi_ob': 59, 'vol_spike': 0.20395003158133415, 'adx_thresh': 21.004067072570507, 'atr_min_pct': 0.01941928413361233, 'atr_max_pct': 0.11325448061654739, 'tp_mult': 2.7242902288520088, 'tsl_mult': 0.9760723349270265, 'strategy': 'mean_reversion', 'time_stop': 265, 'use_sma': True, 'use_atr': True, 'use_adx': True, 'use_ema': True, 'use_spike': False, 'rsi_required': False, 'edge_k': 1.6540513731321846, 'edge_cap': 0.4182563745147043, 'bull_strategy': 'breakout', 'bull_bb_std_mult': 3.5009001404868494, 'bull_rsi_os': 49, 'bull_rsi_ob': 75, 'bull_adx_thresh': 27.91419036331928, 'bull_atr_min_pct': 0.011083027605824705, 'bull_atr_max_pct': 0.039117972622277314, 'bull_tp_mult': 2.258257007348682, 'bull_tsl_mult': 0.5672407872193115, 'bull_time_stop': 256, 'bull_use_sma': True, 'bull_use_ema': False, 'bull_use_atr': False, 'bull_use_adx': True, 'bull_use_spike': False, 'bull_rsi_required': True, 'bear_strategy': 'mean_reversion', 'bear_bb_std_mult': 0.6934897270615057, 'bear_rsi_os': 13, 'bear_rsi_ob': 76, 'bear_adx_thresh': 12.60181080563742, 'bear_atr_min_pct': 0.011170709528212957, 'bear_atr_max_pct': 0.02933744012847685, 'bear_tp_mult': 1.963689921383571, 'bear_tsl_mult': 0.6045740180289534, 'bear_time_stop': 293, 'bear_use_sma': False, 'bear_use_ema': False, 'bear_use_atr': True, 'bear_use_adx': False, 'bear_use_spike': True, 'bear_rsi_required': False, 'sideways_strategy': 'breakout', 'sideways_bb_std_mult': 1.4921723082489915, 'sideways_rsi_os': 49, 'sideways_rsi_ob': 45, 'sideways_adx_thresh': 18.224419939168797, 'sideways_atr_min_pct': 0.00430471452009113, 'sideways_atr_max_pct': 0.10701009161742528, 'sideways_tp_mult': 2.798950281068, 'sideways_tsl_mult': 0.12117713709805475, 'sideways_time_stop': 65, 'sideways_use_sma': False, 'sideways_use_ema': False, 'sideways_use_atr': False, 'sideways_use_adx': True, 'sideways_use_spike': False, 'sideways_rsi_required': True}.
[I 2025-08-30 14:48:42,822] Trial 232 finished with values: [-1000000000.0, 1000000000.0] and parameters: {'p_sma': 35, 'p_std': 49, 'p_atr': 14, 'p_adx': 22, 'rsi_period': 69, 'ema1': 8, 'ema2': 14, 'slip_atr_k': 0.1825080424986428, 'slip_spread_k': 0.02109056597296466, 'spread_hl_frac': 0.00860242441533816, 'bb_std_mult': 2.1260428362235353, 'rsi_os': 34, 'rsi_ob': 65, 'vol_spike': 0.033658337762350554, 'adx_thresh': 19.230250269555672, 'atr_min_pct': 0.019423132691327127, 'atr_max_pct': 0.03325565069027823, 'tp_mult': 2.4611795082158956, 'tsl_mult': 0.8081784440169326, 'strategy': 'mean_reversion', 'time_stop': 26, 'use_sma': True, 'use_atr': True, 'use_adx': False, 'use_ema': True, 'use_spike': False, 'rsi_required': False, 'edge_k': 1.3378942729093448, 'edge_cap': 0.3785533324430308, 'bull_strategy': 'breakout', 'bull_bb_std_mult': 3.2926392429616325, 'bull_rsi_os': 19, 'bull_rsi_ob': 75, 'bull_adx_thresh': 18.723972312071098, 'bull_atr_min_pct': 0.010016350745065315, 'bull_atr_max_pct': 0.10276537874730125, 'bull_tp_mult': 2.457321305241332, 'bull_tsl_mult': 0.556119585947018, 'bull_time_stop': 258, 'bull_use_sma': False, 'bull_use_ema': False, 'bull_use_atr': True, 'bull_use_adx': True, 'bull_use_spike': False, 'bull_rsi_required': True, 'bear_strategy': 'breakout', 'bear_bb_std_mult': 1.1231899134443528, 'bear_rsi_os': 55, 'bear_rsi_ob': 48, 'bear_adx_thresh': 16.31188740610684, 'bear_atr_min_pct': 0.011321137086195079, 'bear_atr_max_pct': 0.04124000688830309, 'bear_tp_mult': 2.08399483085734, 'bear_tsl_mult': 0.5978605042386873, 'bear_time_stop': 28, 'bear_use_sma': False, 'bear_use_ema': False, 'bear_use_atr': False, 'bear_use_adx': False, 'bear_use_spike': True, 'bear_rsi_required': False, 'sideways_strategy': 'breakout', 'sideways_bb_std_mult': 1.747854060853362, 'sideways_rsi_os': 23, 'sideways_rsi_ob': 75, 'sideways_adx_thresh': 18.203808251729864, 'sideways_atr_min_pct': 0.0038873245919219647, 'sideways_atr_max_pct': 0.07777405488471582, 'sideways_tp_mult': 2.185073790215976, 'sideways_tsl_mult': 0.08212450139318739, 'sideways_time_stop': 205, 'sideways_use_sma': False, 'sideways_use_ema': True, 'sideways_use_atr': False, 'sideways_use_adx': True, 'sideways_use_spike': True, 'sideways_rsi_required': True}.
[I 2025-08-30 14:48:43,286] Trial 234 finished with values: [-1000000000.0, 1000000000.0] and parameters: {'p_sma': 33, 'p_std': 29, 'p_atr': 13, 'p_adx': 16, 'rsi_period': 47, 'ema1': 8, 'ema2': 60, 'slip_atr_k': 0.1601209431585059, 'slip_spread_k': 0.9551081415980057, 'spread_hl_frac': 0.00415692471599613, 'bb_std_mult': 1.172031654481804, 'rsi_os': 27, 'rsi_ob': 68, 'vol_spike': 0.24967740169887243, 'adx_thresh': 22.549142342033125, 'atr_min_pct': 0.01851560325706472, 'atr_max_pct': 0.03244476394007764, 'tp_mult': 2.512347029413429, 'tsl_mult': 0.4617005672697897, 'strategy': 'breakout', 'time_stop': 27, 'use_sma': True, 'use_atr': False, 'use_adx': False, 'use_ema': False, 'use_spike': False, 'rsi_required': True, 'edge_k': 1.1088643521411277, 'edge_cap': 0.6841791990204226, 'bull_strategy': 'breakout', 'bull_bb_std_mult': 3.420250699698028, 'bull_rsi_os': 24, 'bull_rsi_ob': 63, 'bull_adx_thresh': 18.33651773398189, 'bull_atr_min_pct': 0.012819762566657952, 'bull_atr_max_pct': 0.015180722989413298, 'bull_tp_mult': 2.8494536891551054, 'bull_tsl_mult': 0.08935391808666909, 'bull_time_stop': 48, 'bull_use_sma': False, 'bull_use_ema': False, 'bull_use_atr': True, 'bull_use_adx': True, 'bull_use_spike': False, 'bull_rsi_required': True, 'bear_strategy': 'breakout', 'bear_bb_std_mult': 1.3269410474137122, 'bear_rsi_os': 15, 'bear_rsi_ob': 87, 'bear_adx_thresh': 25.240815597229727, 'bear_atr_min_pct': 0.00677202550903583, 'bear_atr_max_pct': 0.021476574943375265, 'bear_tp_mult': 1.063101834025367, 'bear_tsl_mult': 0.2085523851599697, 'bear_time_stop': 27, 'bear_use_sma': False, 'bear_use_ema': False, 'bear_use_atr': False, 'bear_use_adx': False, 'bear_use_spike': True, 'bear_rsi_required': False, 'sideways_strategy': 'breakout', 'sideways_bb_std_mult': 3.0566230528581504, 'sideways_rsi_os': 15, 'sideways_rsi_ob': 90, 'sideways_adx_thresh': 20.920436964434934, 'sideways_atr_min_pct': 0.0027921410039676055, 'sideways_atr_max_pct': 0.07350221113148721, 'sideways_tp_mult': 1.089491725413593, 'sideways_tsl_mult': 0.07899585195449088, 'sideways_time_stop': 227, 'sideways_use_sma': True, 'sideways_use_ema': True, 'sideways_use_atr': False, 'sideways_use_adx': True, 'sideways_use_spike': True, 'sideways_rsi_required': True}.
[I 2025-08-30 14:48:43,363] Trial 231 finished with values: [-1000000000.0, 1000000000.0] and parameters: {'p_sma': 34, 'p_std': 28, 'p_atr': 17, 'p_adx': 22, 'rsi_period': 79, 'ema1': 27, 'ema2': 60, 'slip_atr_k': 0.14943414188672224, 'slip_spread_k': 0.4350508816277977, 'spread_hl_frac': 0.008589493501690706, 'bb_std_mult': 2.0769172541640613, 'rsi_os': 35, 'rsi_ob': 68, 'vol_spike': 0.14528582816061503, 'adx_thresh': 26.154067408500843, 'atr_min_pct': 0.01913492938475448, 'atr_max_pct': 0.032857045328223165, 'tp_mult': 2.1316970929698895, 'tsl_mult': 0.2542722093360456, 'strategy': 'mean_reversion', 'time_stop': 34, 'use_sma': False, 'use_atr': True, 'use_adx': False, 'use_ema': True, 'use_spike': False, 'rsi_required': False, 'edge_k': 1.792584559582327, 'edge_cap': 0.4098924745129865, 'bull_strategy': 'breakout', 'bull_bb_std_mult': 3.5134474075830977, 'bull_rsi_os': 53, 'bull_rsi_ob': 63, 'bull_adx_thresh': 12.69680750070073, 'bull_atr_min_pct': 0.012720679613878424, 'bull_atr_max_pct': 0.07706215505298877, 'bull_tp_mult': 2.533069654553402, 'bull_tsl_mult': 0.18515251973067204, 'bull_time_stop': 258, 'bull_use_sma': False, 'bull_use_ema': False, 'bull_use_atr': True, 'bull_use_adx': True, 'bull_use_spike': True, 'bull_rsi_required': False, 'bear_strategy': 'breakout', 'bear_bb_std_mult': 0.9135201549920553, 'bear_rsi_os': 14, 'bear_rsi_ob': 46, 'bear_adx_thresh': 25.13495949630528, 'bear_atr_min_pct': 0.012933377001167172, 'bear_atr_max_pct': 0.08461086311397922, 'bear_tp_mult': 1.968228794982867, 'bear_tsl_mult': 0.21199836698640812, 'bear_time_stop': 90, 'bear_use_sma': False, 'bear_use_ema': True, 'bear_use_atr': True, 'bear_use_adx': True, 'bear_use_spike': True, 'bear_rsi_required': True, 'sideways_strategy': 'breakout', 'sideways_bb_std_mult': 1.4907742071920769, 'sideways_rsi_os': 6, 'sideways_rsi_ob': 87, 'sideways_adx_thresh': 9.482995300627255, 'sideways_atr_min_pct': 0.004140597296542067, 'sideways_atr_max_pct': 0.04992671335462033, 'sideways_tp_mult': 2.200533269718708, 'sideways_tsl_mult': 0.08998725381190442, 'sideways_time_stop': 203, 'sideways_use_sma': True, 'sideways_use_ema': True, 'sideways_use_atr': False, 'sideways_use_adx': True, 'sideways_use_spike': False, 'sideways_rsi_required': True}.
