[I 2025-08-30 16:23:25,597] Trial 741 finished with values: [-0.03452828693583376, 0.034432324782112056] and parameters: {'p_sma': 11, 'p_std': 47, 'p_atr': 27, 'p_adx': 11, 'rsi_period': 82, 'ema1': 24, 'ema2': 30, 'slip_atr_k': 0.23065300145807505, 'slip_spread_k': 0.5289192817988971, 'spread_hl_frac': 0.04077581513426905, 'bb_std_mult': 2.4416541023759644, 'rsi_os': 36, 'rsi_ob': 54, 'vol_spike': 0.1165301449746432, 'adx_thresh': 14.293590200889293, 'atr_min_pct': 0.014682834901618286, 'atr_max_pct': 0.07815801238177156, 'tp_mult': 1.6489378910327674, 'tsl_mult': 0.2085311781622903, 'strategy': 'mean_reversion', 'time_stop': 232, 'use_sma': True, 'use_atr': True, 'use_adx': False, 'use_ema': False, 'use_spike': False, 'rsi_required': False, 'edge_k': 0.3300910363498405, 'edge_cap': 0.6505507260281193, 'bull_strategy': 'breakout', 'bull_bb_std_mult': 0.9965595617350601, 'bull_rsi_os': 41, 'bull_rsi_ob': 68, 'bull_adx_thresh': 23.856829009583727, 'bull_atr_min_pct': 0.020661959525409817, 'bull_atr_max_pct': 0.092211623494592, 'bull_tp_mult': 1.1149655941045737, 'bull_tsl_mult': 0.096577080626093, 'bull_time_stop': 20, 'bull_use_sma': True, 'bull_use_ema': True, 'bull_use_atr': True, 'bull_use_adx': True, 'bull_use_spike': True, 'bull_rsi_required': True, 'bear_strategy': 'breakout', 'bear_bb_std_mult': 2.5242843391471967, 'bear_rsi_os': 32, 'bear_rsi_ob': 89, 'bear_adx_thresh': 29.342174174119542, 'bear_atr_min_pct': 0.021617562431034427, 'bear_atr_max_pct': 0.07167229682457142, 'bear_tp_mult': 2.84391507919619, 'bear_tsl_mult': 0.38819236927312917, 'bear_time_stop': 274, 'bear_use_sma': False, 'bear_use_ema': False, 'bear_use_atr': True, 'bear_use_adx': True, 'bear_use_spike': True, 'bear_rsi_required': True, 'sideways_strategy': 'breakout', 'sideways_bb_std_mult': 1.1032184850717495, 'sideways_rsi_os': 41, 'sideways_rsi_ob': 82, 'sideways_adx_thresh': 24.84131975317474, 'sideways_atr_min_pct': 0.000558119957809603, 'sideways_atr_max_pct': 0.10588492725185572, 'sideways_tp_mult': 2.8230001478213698, 'sideways_tsl_mult': 0.9551663761225716, 'sideways_time_stop': 69, 'sideways_use_sma': True, 'sideways_use_ema': False, 'sideways_use_atr': False, 'sideways_use_adx': True, 'sideways_use_spike': True, 'sideways_rsi_required': True}.
[I 2025-08-30 16:23:26,491] Trial 740 finished with values: [-1000000000.0, 1000000000.0] and parameters: {'p_sma': 5, 'p_std': 41, 'p_atr': 27, 'p_adx': 11, 'rsi_period': 75, 'ema1': 23, 'ema2': 12, 'slip_atr_k': 0.09681347320678917, 'slip_spread_k': 0.31405515441786946, 'spread_hl_frac': 0.02555143751224415, 'bb_std_mult': 2.3610659822034985, 'rsi_os': 36, 'rsi_ob': 74, 'vol_spike': 0.16764128035119724, 'adx_thresh': 14.575525128752336, 'atr_min_pct': 0.0031854476268091316, 'atr_max_pct': 0.0847831418487502, 'tp_mult': 1.6661411635984407, 'tsl_mult': 0.21896001275743063, 'strategy': 'mean_reversion', 'time_stop': 232, 'use_sma': True, 'use_atr': True, 'use_adx': False, 'use_ema': False, 'use_spike': False, 'rsi_required': False, 'edge_k': 0.3395468155747073, 'edge_cap': 0.4008618142206329, 'bull_strategy': 'breakout', 'bull_bb_std_mult': 1.0033028795204149, 'bull_rsi_os': 7, 'bull_rsi_ob': 58, 'bull_adx_thresh': 7.0041782584739884, 'bull_atr_min_pct': 0.02566715446115655, 'bull_atr_max_pct': 0.08845186329165225, 'bull_tp_mult': 2.384350582745451, 'bull_tsl_mult': 0.17344461785497012, 'bull_time_stop': 20, 'bull_use_sma': True, 'bull_use_ema': True, 'bull_use_atr': True, 'bull_use_adx': True, 'bull_use_spike': True, 'bull_rsi_required': True, 'bear_strategy': 'breakout', 'bear_bb_std_mult': 2.524280797965919, 'bear_rsi_os': 32, 'bear_rsi_ob': 81, 'bear_adx_thresh': 32.25876376841117, 'bear_atr_min_pct': 0.021386598226695627, 'bear_atr_max_pct': 0.07197904516915965, 'bear_tp_mult': 2.929549038140713, 'bear_tsl_mult': 0.5821987696842951, 'bear_time_stop': 265, 'bear_use_sma': False, 'bear_use_ema': False, 'bear_use_atr': True, 'bear_use_adx': True, 'bear_use_spike': True, 'bear_rsi_required': True, 'sideways_strategy': 'breakout', 'sideways_bb_std_mult': 0.8640519914809812, 'sideways_rsi_os': 40, 'sideways_rsi_ob': 73, 'sideways_adx_thresh': 25.003927530660103, 'sideways_atr_min_pct': 0.015716466835565608, 'sideways_atr_max_pct': 0.10380084999265321, 'sideways_tp_mult': 2.9354273982454218, 'sideways_tsl_mult': 0.959792774630463, 'sideways_time_stop': 78, 'sideways_use_sma': True, 'sideways_use_ema': False, 'sideways_use_atr': False, 'sideways_use_adx': True, 'sideways_use_spike': True, 'sideways_rsi_required': True}.
[I 2025-08-30 16:23:27,450] Trial 739 finished with values: [-1000000000.0, 1000000000.0] and parameters: {'p_sma': 5, 'p_std': 57, 'p_atr': 26, 'p_adx': 11, 'rsi_period': 80, 'ema1': 23, 'ema2': 11, 'slip_atr_k': 0.15715464307673715, 'slip_spread_k': 0.8580591208954085, 'spread_hl_frac': 0.04395830932877821, 'bb_std_mult': 2.4433236812593764, 'rsi_os': 36, 'rsi_ob': 74, 'vol_spike': 0.16879171436514406, 'adx_thresh': 22.721353543921452, 'atr_min_pct': 0.01883785016529084, 'atr_max_pct': 0.07182570218279677, 'tp_mult': 2.704440884673443, 'tsl_mult': 0.2136085692745835, 'strategy': 'mean_reversion', 'time_stop': 232, 'use_sma': True, 'use_atr': True, 'use_adx': False, 'use_ema': False, 'use_spike': False, 'rsi_required': False, 'edge_k': 0.3657270732579684, 'edge_cap': 0.18295305900453496, 'bull_strategy': 'breakout', 'bull_bb_std_mult': 0.9764179198396424, 'bull_rsi_os': 41, 'bull_rsi_ob': 58, 'bull_adx_thresh': 14.896005215975576, 'bull_atr_min_pct': 0.01910466493204175, 'bull_atr_max_pct': 0.08894126165420363, 'bull_tp_mult': 2.8212067216408916, 'bull_tsl_mult': 0.17389978596936706, 'bull_time_stop': 21, 'bull_use_sma': True, 'bull_use_ema': True, 'bull_use_atr': True, 'bull_use_adx': True, 'bull_use_spike': True, 'bull_rsi_required': True, 'bear_strategy': 'breakout', 'bear_bb_std_mult': 2.5042428500126817, 'bear_rsi_os': 32, 'bear_rsi_ob': 94, 'bear_adx_thresh': 32.44638875339453, 'bear_atr_min_pct': 0.021611851693644955, 'bear_atr_max_pct': 0.0705694310736659, 'bear_tp_mult': 2.847346478150014, 'bear_tsl_mult': 0.2280313164855982, 'bear_time_stop': 263, 'bear_use_sma': False, 'bear_use_ema': False, 'bear_use_atr': True, 'bear_use_adx': True, 'bear_use_spike': True, 'bear_rsi_required': True, 'sideways_strategy': 'breakout', 'sideways_bb_std_mult': 1.122210084802004, 'sideways_rsi_os': 40, 'sideways_rsi_ob': 51, 'sideways_adx_thresh': 24.74529479202308, 'sideways_atr_min_pct': 0.015578624359617606, 'sideways_atr_max_pct': 0.033237560952428344, 'sideways_tp_mult': 2.947498448958314, 'sideways_tsl_mult': 0.9557744664145342, 'sideways_time_stop': 88, 'sideways_use_sma': True, 'sideways_use_ema': True, 'sideways_use_atr': False, 'sideways_use_adx': True, 'sideways_use_spike': True, 'sideways_rsi_required': True}.
[I 2025-08-30 16:23:28,841] Trial 738 finished with values: [-1000000000.0, 1000000000.0] and parameters: {'p_sma': 10, 'p_std': 42, 'p_atr': 26, 'p_adx': 11, 'rsi_period': 37, 'ema1': 23, 'ema2': 31, 'slip_atr_k': 0.09667898043743536, 'slip_spread_k': 0.3322766130157082, 'spread_hl_frac': 0.02166809315689302, 'bb_std_mult': 2.2113408950125057, 'rsi_os': 36, 'rsi_ob': 74, 'vol_spike': 0.048034552618685236, 'adx_thresh': 26.395009098560312, 'atr_min_pct': 0.016358908577124527, 'atr_max_pct': 0.07141434444461137, 'tp_mult': 1.3198187539294397, 'tsl_mult': 0.26393482793590173, 'strategy': 'mean_reversion', 'time_stop': 228, 'use_sma': True, 'use_atr': False, 'use_adx': False, 'use_ema': False, 'use_spike': True, 'rsi_required': False, 'edge_k': 0.3824624113116669, 'edge_cap': 0.7496863684288595, 'bull_strategy': 'breakout', 'bull_bb_std_mult': 0.9179528907470533, 'bull_rsi_os': 41, 'bull_rsi_ob': 57, 'bull_adx_thresh': 24.211797531884937, 'bull_atr_min_pct': 0.01893006550282903, 'bull_atr_max_pct': 0.10050593086885848, 'bull_tp_mult': 2.0411148247780817, 'bull_tsl_mult': 0.10824023707958452, 'bull_time_stop': 21, 'bull_use_sma': True, 'bull_use_ema': True, 'bull_use_atr': True, 'bull_use_adx': True, 'bull_use_spike': True, 'bull_rsi_required': True, 'bear_strategy': 'mean_reversion', 'bear_bb_std_mult': 2.549362482582081, 'bear_rsi_os': 32, 'bear_rsi_ob': 94, 'bear_adx_thresh': 32.4609120478239, 'bear_atr_min_pct': 0.0008322088171086178, 'bear_atr_max_pct': 0.10287837012573599, 'bear_tp_mult': 2.9209138394311354, 'bear_tsl_mult': 0.22394339774673777, 'bear_time_stop': 261, 'bear_use_sma': False, 'bear_use_ema': False, 'bear_use_atr': True, 'bear_use_adx': True, 'bear_use_spike': True, 'bear_rsi_required': True, 'sideways_strategy': 'mean_reversion', 'sideways_bb_std_mult': 0.7693964657816929, 'sideways_rsi_os': 40, 'sideways_rsi_ob': 62, 'sideways_adx_thresh': 24.858950910303342, 'sideways_atr_min_pct': 0.0006192334750387275, 'sideways_atr_max_pct': 0.1032887435149407, 'sideways_tp_mult': 2.959707091274948, 'sideways_tsl_mult': 0.5167546463308131, 'sideways_time_stop': 292, 'sideways_use_sma': True, 'sideways_use_ema': True, 'sideways_use_atr': False, 'sideways_use_adx': True, 'sideways_use_spike': True, 'sideways_rsi_required': True}.
[I 2025-08-30 16:24:14,744] Trial 743 finished with values: [-1000000000.0, 1000000000.0] and parameters: {'p_sma': 5, 'p_std': 18, 'p_atr': 26, 'p_adx': 9, 'rsi_period': 80, 'ema1': 23, 'ema2': 60, 'slip_atr_k': 0.07146785910715381, 'slip_spread_k': 0.37918339984489874, 'spread_hl_frac': 0.023880121043331873, 'bb_std_mult': 2.357195725327354, 'rsi_os': 38, 'rsi_ob': 66, 'vol_spike': 0.1568356645519652, 'adx_thresh': 31.680329329237928, 'atr_min_pct': 0.016654261714502246, 'atr_max_pct': 0.07235869526132355, 'tp_mult': 2.8698866373108176, 'tsl_mult': 0.45293132852098855, 'strategy': 'mean_reversion', 'time_stop': 222, 'use_sma': True, 'use_atr': True, 'use_adx': False, 'use_ema': True, 'use_spike': True, 'rsi_required': False, 'edge_k': 0.380062623809079, 'edge_cap': 0.5747364488849844, 'bull_strategy': 'breakout', 'bull_bb_std_mult': 0.8659649087259832, 'bull_rsi_os': 41, 'bull_rsi_ob': 63, 'bull_adx_thresh': 26.245547643657183, 'bull_atr_min_pct': 0.019204918968698317, 'bull_atr_max_pct': 0.09661241718065869, 'bull_tp_mult': 2.064628789592322, 'bull_tsl_mult': 0.005232583863660489, 'bull_time_stop': 29, 'bull_use_sma': True, 'bull_use_ema': True, 'bull_use_atr': True, 'bull_use_adx': True, 'bull_use_spike': False, 'bull_rsi_required': True, 'bear_strategy': 'mean_reversion', 'bear_bb_std_mult': 2.743300481245038, 'bear_rsi_os': 33, 'bear_rsi_ob': 94, 'bear_adx_thresh': 28.45415839211669, 'bear_atr_min_pct': 0.020046855756793717, 'bear_atr_max_pct': 0.07049904638469705, 'bear_tp_mult': 2.6690294058547304, 'bear_tsl_mult': 0.6018503700454737, 'bear_time_stop': 272, 'bear_use_sma': False, 'bear_use_ema': False, 'bear_use_atr': True, 'bear_use_adx': True, 'bear_use_spike': True, 'bear_rsi_required': False, 'sideways_strategy': 'breakout', 'sideways_bb_std_mult': 1.3536238463192183, 'sideways_rsi_os': 14, 'sideways_rsi_ob': 61, 'sideways_adx_thresh': 21.31479981815328, 'sideways_atr_min_pct': 0.028099672950446818, 'sideways_atr_max_pct': 0.11895672283680214, 'sideways_tp_mult': 2.8964826401519552, 'sideways_tsl_mult': 0.5213941363867659, 'sideways_time_stop': 89, 'sideways_use_sma': False, 'sideways_use_ema': True, 'sideways_use_atr': False, 'sideways_use_adx': True, 'sideways_use_spike': False, 'sideways_rsi_required': True}.
[I 2025-08-30 16:24:15,848] Trial 745 finished with values: [-1000000000.0, 1000000000.0] and parameters: {'p_sma': 6, 'p_std': 54, 'p_atr': 25, 'p_adx': 13, 'rsi_period': 76, 'ema1': 24, 'ema2': 32, 'slip_atr_k': 0.06953866611838648, 'slip_spread_k': 0.9254203219520605, 'spread_hl_frac': 0.02424440662423676, 'bb_std_mult': 2.3398930222021628, 'rsi_os': 42, 'rsi_ob': 61, 'vol_spike': 0.1234191057691197, 'adx_thresh': 33.24713222826967, 'atr_min_pct': 0.023775297609279253, 'atr_max_pct': 0.07912446799336043, 'tp_mult': 2.904002809701758, 'tsl_mult': 0.3513301882486085, 'strategy': 'mean_reversion', 'time_stop': 221, 'use_sma': True, 'use_atr': True, 'use_adx': False, 'use_ema': True, 'use_spike': True, 'rsi_required': False, 'edge_k': 0.5063331230734526, 'edge_cap': 0.5783340411973399, 'bull_strategy': 'breakout', 'bull_bb_std_mult': 0.8694502334860938, 'bull_rsi_os': 40, 'bull_rsi_ob': 61, 'bull_adx_thresh': 17.312893410536073, 'bull_atr_min_pct': 0.015196937436955008, 'bull_atr_max_pct': 0.0962254116951044, 'bull_tp_mult': 1.929183131391794, 'bull_tsl_mult': 0.05066721733187957, 'bull_time_stop': 29, 'bull_use_sma': True, 'bull_use_ema': True, 'bull_use_atr': True, 'bull_use_adx': True, 'bull_use_spike': False, 'bull_rsi_required': True, 'bear_strategy': 'mean_reversion', 'bear_bb_std_mult': 2.6175073499784434, 'bear_rsi_os': 33, 'bear_rsi_ob': 90, 'bear_adx_thresh': 28.418635850377896, 'bear_atr_min_pct': 0.020196224134195265, 'bear_atr_max_pct': 0.09671895822987067, 'bear_tp_mult': 2.8792880590123313, 'bear_tsl_mult': 0.18029432174906074, 'bear_time_stop': 267, 'bear_use_sma': False, 'bear_use_ema': False, 'bear_use_atr': True, 'bear_use_adx': True, 'bear_use_spike': True, 'bear_rsi_required': False, 'sideways_strategy': 'breakout', 'sideways_bb_std_mult': 1.388488932206775, 'sideways_rsi_os': 11, 'sideways_rsi_ob': 95, 'sideways_adx_thresh': 21.498924477459454, 'sideways_atr_min_pct': 0.008926209760362954, 'sideways_atr_max_pct': 0.051845046429918405, 'sideways_tp_mult': 2.908074940147729, 'sideways_tsl_mult': 0.9292017316287493, 'sideways_time_stop': 268, 'sideways_use_sma': False, 'sideways_use_ema': True, 'sideways_use_atr': False, 'sideways_use_adx': True, 'sideways_use_spike': False, 'sideways_rsi_required': True}.
[I 2025-08-30 16:24:16,451] Trial 744 finished with values: [-1000000000.0, 1000000000.0] and parameters: {'p_sma': 6, 'p_std': 38, 'p_atr': 25, 'p_adx': 13, 'rsi_period': 76, 'ema1': 24, 'ema2': 32, 'slip_atr_k': 0.0704404363830194, 'slip_spread_k': 0.9257969577016003, 'spread_hl_frac': 0.02431868565599318, 'bb_std_mult': 2.347163873144999, 'rsi_os': 42, 'rsi_ob': 66, 'vol_spike': 0.15470443126012604, 'adx_thresh': 7.560652535249838, 'atr_min_pct': 0.016590721283282598, 'atr_max_pct': 0.09882520376071069, 'tp_mult': 1.7433560963639039, 'tsl_mult': 0.1544466790317564, 'strategy': 'mean_reversion', 'time_stop': 221, 'use_sma': True, 'use_atr': True, 'use_adx': False, 'use_ema': True, 'use_spike': True, 'rsi_required': False, 'edge_k': 0.40531157833008963, 'edge_cap': 0.5722534613287847, 'bull_strategy': 'breakout', 'bull_bb_std_mult': 0.8937013497045863, 'bull_rsi_os': 40, 'bull_rsi_ob': 63, 'bull_adx_thresh': 11.037903921042307, 'bull_atr_min_pct': 0.01997215539811195, 'bull_atr_max_pct': 0.0939419436711218, 'bull_tp_mult': 1.9277846120915885, 'bull_tsl_mult': 0.1065199335679658, 'bull_time_stop': 29, 'bull_use_sma': True, 'bull_use_ema': True, 'bull_use_atr': True, 'bull_use_adx': True, 'bull_use_spike': False, 'bull_rsi_required': True, 'bear_strategy': 'mean_reversion', 'bear_bb_std_mult': 2.5764070864620923, 'bear_rsi_os': 33, 'bear_rsi_ob': 95, 'bear_adx_thresh': 28.728695217677735, 'bear_atr_min_pct': 0.019810728899623115, 'bear_atr_max_pct': 0.09628046184624402, 'bear_tp_mult': 2.8679424869993815, 'bear_tsl_mult': 0.27768464473999327, 'bear_time_stop': 235, 'bear_use_sma': False, 'bear_use_ema': False, 'bear_use_atr': True, 'bear_use_adx': True, 'bear_use_spike': True, 'bear_rsi_required': False, 'sideways_strategy': 'breakout', 'sideways_bb_std_mult': 1.3753883991920266, 'sideways_rsi_os': 11, 'sideways_rsi_ob': 60, 'sideways_adx_thresh': 23.377066994630926, 'sideways_atr_min_pct': 0.0016542999515616165, 'sideways_atr_max_pct': 0.048881546516655494, 'sideways_tp_mult': 2.895327884824382, 'sideways_tsl_mult': 0.7634468015753841, 'sideways_time_stop': 75, 'sideways_use_sma': False, 'sideways_use_ema': True, 'sideways_use_atr': False, 'sideways_use_adx': True, 'sideways_use_spike': False, 'sideways_rsi_required': True}.
[I 2025-08-30 16:24:17,109] Trial 742 finished with values: [-1000000000.0, 1000000000.0] and parameters: {'p_sma': 5, 'p_std': 54, 'p_atr': 26, 'p_adx': 13, 'rsi_period': 75, 'ema1': 23, 'ema2': 32, 'slip_atr_k': 0.20599545265454336, 'slip_spread_k': 0.31061023666701437, 'spread_hl_frac': 0.043373320515701155, 'bb_std_mult': 2.3672521766340715, 'rsi_os': 39, 'rsi_ob': 74, 'vol_spike': 0.17086282708621622, 'adx_thresh': 33.206001326896306, 'atr_min_pct': 0.023777124660820166, 'atr_max_pct': 0.07125748116707543, 'tp_mult': 1.733513644099367, 'tsl_mult': 0.2634918673458055, 'strategy': 'mean_reversion', 'time_stop': 229, 'use_sma': True, 'use_atr': True, 'use_adx': False, 'use_ema': False, 'use_spike': True, 'rsi_required': False, 'edge_k': 0.3756173816266159, 'edge_cap': 0.1311855132017728, 'bull_strategy': 'breakout', 'bull_bb_std_mult': 0.9121634594491195, 'bull_rsi_os': 8, 'bull_rsi_ob': 58, 'bull_adx_thresh': 26.21490984050696, 'bull_atr_min_pct': 0.018973647755615514, 'bull_atr_max_pct': 0.08902733749146396, 'bull_tp_mult': 1.9367533079730763, 'bull_tsl_mult': 0.11039219848602354, 'bull_time_stop': 19, 'bull_use_sma': True, 'bull_use_ema': True, 'bull_use_atr': True, 'bull_use_adx': True, 'bull_use_spike': True, 'bull_rsi_required': True, 'bear_strategy': 'breakout', 'bear_bb_std_mult': 2.5747359784735666, 'bear_rsi_os': 33, 'bear_rsi_ob': 94, 'bear_adx_thresh': 28.451421482727383, 'bear_atr_min_pct': 0.000596468916641852, 'bear_atr_max_pct': 0.05724291938520114, 'bear_tp_mult': 2.926226406788132, 'bear_tsl_mult': 0.5974061487469366, 'bear_time_stop': 263, 'bear_use_sma': False, 'bear_use_ema': False, 'bear_use_atr': True, 'bear_use_adx': True, 'bear_use_spike': True, 'bear_rsi_required': True, 'sideways_strategy': 'breakout', 'sideways_bb_std_mult': 0.8466261722390518, 'sideways_rsi_os': 14, 'sideways_rsi_ob': 61, 'sideways_adx_thresh': 23.411745458283658, 'sideways_atr_min_pct': 0.0017460859626141443, 'sideways_atr_max_pct': 0.10291178836157379, 'sideways_tp_mult': 2.9376383220740117, 'sideways_tsl_mult': 0.9292630823982173, 'sideways_time_stop': 88, 'sideways_use_sma': True, 'sideways_use_ema': True, 'sideways_use_atr': False, 'sideways_use_adx': True, 'sideways_use_spike': False, 'sideways_rsi_required': True}.
[I 2025-08-30 16:24:18,360] Trial 748 finished with values: [-1000000000.0, 1000000000.0] and parameters: {'p_sma': 7, 'p_std': 57, 'p_atr': 27, 'p_adx': 11, 'rsi_period': 78, 'ema1': 22, 'ema2': 28, 'slip_atr_k': 0.08026254113441615, 'slip_spread_k': 0.13457450385672964, 'spread_hl_frac': 0.01815747656311805, 'bb_std_mult': 2.5390148114616933, 'rsi_os': 39, 'rsi_ob': 68, 'vol_spike': 0.07814199102102166, 'adx_thresh': 15.72087631874542, 'atr_min_pct': 0.022242613012079818, 'atr_max_pct': 0.018367791975852532, 'tp_mult': 1.8149507651280847, 'tsl_mult': 0.18912229970224106, 'strategy': 'mean_reversion', 'time_stop': 196, 'use_sma': True, 'use_atr': True, 'use_adx': False, 'use_ema': True, 'use_spike': True, 'rsi_required': False, 'edge_k': 0.4611101522871625, 'edge_cap': 0.5961122093669156, 'bull_strategy': 'breakout', 'bull_bb_std_mult': 0.7769620536875645, 'bull_rsi_os': 8, 'bull_rsi_ob': 61, 'bull_adx_thresh': 22.881083012317944, 'bull_atr_min_pct': 0.02104186419586898, 'bull_atr_max_pct': 0.08308760371255983, 'bull_tp_mult': 1.9805741994691937, 'bull_tsl_mult': 0.12136491943388852, 'bull_time_stop': 41, 'bull_use_sma': True, 'bull_use_ema': True, 'bull_use_atr': True, 'bull_use_adx': True, 'bull_use_spike': True, 'bull_rsi_required': True, 'bear_strategy': 'mean_reversion', 'bear_bb_std_mult': 2.394897738092856, 'bear_rsi_os': 31, 'bear_rsi_ob': 90, 'bear_adx_thresh': 29.904079151112256, 'bear_atr_min_pct': 0.0019259584614569041, 'bear_atr_max_pct': 0.04723350571166601, 'bear_tp_mult': 2.824336373441697, 'bear_tsl_mult': 0.3690425997719482, 'bear_time_stop': 287, 'bear_use_sma': False, 'bear_use_ema': False, 'bear_use_atr': True, 'bear_use_adx': True, 'bear_use_spike': True, 'bear_rsi_required': True, 'sideways_strategy': 'breakout', 'sideways_bb_std_mult': 1.1752190318530322, 'sideways_rsi_os': 38, 'sideways_rsi_ob': 72, 'sideways_adx_thresh': 23.995325470165117, 'sideways_atr_min_pct': 2.754616247454037e-05, 'sideways_atr_max_pct': 0.10929247614632426, 'sideways_tp_mult': 2.9326725570213354, 'sideways_tsl_mult': 0.5836424158206375, 'sideways_time_stop': 111, 'sideways_use_sma': True, 'sideways_use_ema': False, 'sideways_use_atr': False, 'sideways_use_adx': True, 'sideways_use_spike': True, 'sideways_rsi_required': True}.
