[I 2025-08-30 15:36:02,589] Trial 504 finished with values: [-1000000000.0, 1000000000.0] and parameters: {'p_sma': 5, 'p_std': 18, 'p_atr': 15, 'p_adx': 19, 'rsi_period': 33, 'ema1': 29, 'ema2': 34, 'slip_atr_k': 0.1937010612620863, 'slip_spread_k': 0.7890674754768173, 'spread_hl_frac': 0.025817671826352563, 'bb_std_mult': 3.0372657954588433, 'rsi_os': 27, 'rsi_ob': 67, 'vol_spike': 0.008157766536080718, 'adx_thresh': 11.978901948048446, 'atr_min_pct': 0.003392108638367728, 'atr_max_pct': 0.08330601985923362, 'tp_mult': 2.7596560174964058, 'tsl_mult': 0.7619998397627674, 'strategy': 'breakout', 'time_stop': 53, 'use_sma': False, 'use_atr': True, 'use_adx': False, 'use_ema': True, 'use_spike': True, 'rsi_required': True, 'edge_k': 0.1438965876336532, 'edge_cap': 0.588992607450499, 'bull_strategy': 'mean_reversion', 'bull_bb_std_mult': 2.3751891518603765, 'bull_rsi_os': 52, 'bull_rsi_ob': 48, 'bull_adx_thresh': 27.5665232324017, 'bull_atr_min_pct': 0.02211176920695839, 'bull_atr_max_pct': 0.06717239907145625, 'bull_tp_mult': 2.193120970679906, 'bull_tsl_mult': 0.3130644446703475, 'bull_time_stop': 132, 'bull_use_sma': False, 'bull_use_ema': False, 'bull_use_atr': False, 'bull_use_adx': False, 'bull_use_spike': True, 'bull_rsi_required': False, 'bear_strategy': 'mean_reversion', 'bear_bb_std_mult': 2.803607535695146, 'bear_rsi_os': 26, 'bear_rsi_ob': 77, 'bear_adx_thresh': 27.94677710770272, 'bear_atr_min_pct': 0.019289126619809402, 'bear_atr_max_pct': 0.07279728896715416, 'bear_tp_mult': 1.5420069625390127, 'bear_tsl_mult': 0.9481194682898805, 'bear_time_stop': 271, 'bear_use_sma': True, 'bear_use_ema': True, 'bear_use_atr': True, 'bear_use_adx': False, 'bear_use_spike': False, 'bear_rsi_required': True, 'sideways_strategy': 'breakout', 'sideways_bb_std_mult': 1.9349007322645362, 'sideways_rsi_os': 42, 'sideways_rsi_ob': 58, 'sideways_adx_thresh': 27.875890359121094, 'sideways_atr_min_pct': 0.015888088696048294, 'sideways_atr_max_pct': 0.05593806948933306, 'sideways_tp_mult': 1.1724699423211409, 'sideways_tsl_mult': 0.796650683139678, 'sideways_time_stop': 168, 'sideways_use_sma': True, 'sideways_use_ema': True, 'sideways_use_atr': True, 'sideways_use_adx': False, 'sideways_use_spike': True, 'sideways_rsi_required': False}.
[I 2025-08-30 15:36:47,754] Trial 505 finished with values: [-1000000000.0, 1000000000.0] and parameters: {'p_sma': 5, 'p_std': 59, 'p_atr': 21, 'p_adx': 26, 'rsi_period': 78, 'ema1': 30, 'ema2': 34, 'slip_atr_k': 0.19890369728115415, 'slip_spread_k': 0.10788488819312383, 'spread_hl_frac': 0.026483858807942146, 'bb_std_mult': 1.2264979935155171, 'rsi_os': 25, 'rsi_ob': 76, 'vol_spike': 0.1763041377002723, 'adx_thresh': 6.511821608489431, 'atr_min_pct': 0.012504650797761044, 'atr_max_pct': 0.08380361799266929, 'tp_mult': 1.77390499783669, 'tsl_mult': 0.7018552885024778, 'strategy': 'breakout', 'time_stop': 215, 'use_sma': False, 'use_atr': True, 'use_adx': True, 'use_ema': True, 'use_spike': True, 'rsi_required': True, 'edge_k': 0.14263515704856466, 'edge_cap': 0.5941022377697148, 'bull_strategy': 'mean_reversion', 'bull_bb_std_mult': 1.358619240462422, 'bull_rsi_os': 38, 'bull_rsi_ob': 54, 'bull_adx_thresh': 27.396426476416096, 'bull_atr_min_pct': 0.0206831900978702, 'bull_atr_max_pct': 0.06727145440180958, 'bull_tp_mult': 2.1916527435757316, 'bull_tsl_mult': 0.841464429267686, 'bull_time_stop': 14, 'bull_use_sma': False, 'bull_use_ema': False, 'bull_use_atr': True, 'bull_use_adx': False, 'bull_use_spike': True, 'bull_rsi_required': False, 'bear_strategy': 'mean_reversion', 'bear_bb_std_mult': 2.8084804601534246, 'bear_rsi_os': 26, 'bear_rsi_ob': 77, 'bear_adx_thresh': 27.89348304819427, 'bear_atr_min_pct': 0.029928378236422436, 'bear_atr_max_pct': 0.0739123723084265, 'bear_tp_mult': 1.5347096716345148, 'bear_tsl_mult': 0.3406959935187752, 'bear_time_stop': 271, 'bear_use_sma': True, 'bear_use_ema': True, 'bear_use_atr': True, 'bear_use_adx': False, 'bear_use_spike': False, 'bear_rsi_required': True, 'sideways_strategy': 'breakout', 'sideways_bb_std_mult': 1.6878826964937372, 'sideways_rsi_os': 42, 'sideways_rsi_ob': 57, 'sideways_adx_thresh': 27.21002628329074, 'sideways_atr_min_pct': 0.02504135323389815, 'sideways_atr_max_pct': 0.10043621745937929, 'sideways_tp_mult': 2.330109799658168, 'sideways_tsl_mult': 0.00169166553493183, 'sideways_time_stop': 76, 'sideways_use_sma': True, 'sideways_use_ema': True, 'sideways_use_atr': True, 'sideways_use_adx': False, 'sideways_use_spike': False, 'sideways_rsi_required': False}.
[I 2025-08-30 15:36:48,868] Trial 506 finished with values: [-1000000000.0, 1000000000.0] and parameters: {'p_sma': 6, 'p_std': 11, 'p_atr': 14, 'p_adx': 26, 'rsi_period': 54, 'ema1': 30, 'ema2': 34, 'slip_atr_k': 0.06321866038015625, 'slip_spread_k': 0.7884195183877616, 'spread_hl_frac': 0.02674096299225532, 'bb_std_mult': 1.1818699802342585, 'rsi_os': 26, 'rsi_ob': 72, 'vol_spike': 0.13526930139431884, 'adx_thresh': 12.822513050167734, 'atr_min_pct': 0.012451154768153465, 'atr_max_pct': 0.1258705344707825, 'tp_mult': 2.0639942154072384, 'tsl_mult': 0.7032370493350601, 'strategy': 'breakout', 'time_stop': 53, 'use_sma': False, 'use_atr': True, 'use_adx': False, 'use_ema': True, 'use_spike': True, 'rsi_required': True, 'edge_k': 0.13901502084802572, 'edge_cap': 0.7732516864823087, 'bull_strategy': 'mean_reversion', 'bull_bb_std_mult': 2.365867473558981, 'bull_rsi_os': 41, 'bull_rsi_ob': 61, 'bull_adx_thresh': 21.627132296486042, 'bull_atr_min_pct': 0.020916410372898785, 'bull_atr_max_pct': 0.06875882037222994, 'bull_tp_mult': 2.195016227313774, 'bull_tsl_mult': 0.30978143802232266, 'bull_time_stop': 150, 'bull_use_sma': False, 'bull_use_ema': False, 'bull_use_atr': True, 'bull_use_adx': False, 'bull_use_spike': True, 'bull_rsi_required': False, 'bear_strategy': 'mean_reversion', 'bear_bb_std_mult': 3.2325348617302856, 'bear_rsi_os': 26, 'bear_rsi_ob': 61, 'bear_adx_thresh': 8.676729210536752, 'bear_atr_min_pct': 0.02098616323576105, 'bear_atr_max_pct': 0.11543841205993673, 'bear_tp_mult': 1.5405535241490012, 'bear_tsl_mult': 0.3353979618729707, 'bear_time_stop': 75, 'bear_use_sma': True, 'bear_use_ema': True, 'bear_use_atr': True, 'bear_use_adx': False, 'bear_use_spike': False, 'bear_rsi_required': True, 'sideways_strategy': 'breakout', 'sideways_bb_std_mult': 1.0995841850967794, 'sideways_rsi_os': 40, 'sideways_rsi_ob': 72, 'sideways_adx_thresh': 29.810467299330288, 'sideways_atr_min_pct': 0.010259168387310473, 'sideways_atr_max_pct': 0.05894727969253682, 'sideways_tp_mult': 1.786008870493506, 'sideways_tsl_mult': 0.21267894660530362, 'sideways_time_stop': 75, 'sideways_use_sma': True, 'sideways_use_ema': True, 'sideways_use_atr': True, 'sideways_use_adx': False, 'sideways_use_spike': True, 'sideways_rsi_required': False}.
[I 2025-08-30 15:36:50,009] Trial 508 finished with values: [-0.019550048185683178, 0.019433217450920724] and parameters: {'p_sma': 6, 'p_std': 17, 'p_atr': 14, 'p_adx': 26, 'rsi_period': 9, 'ema1': 16, 'ema2': 33, 'slip_atr_k': 0.06228213447592769, 'slip_spread_k': 0.10771942178172907, 'spread_hl_frac': 0.02706301107442802, 'bb_std_mult': 1.2187186646455863, 'rsi_os': 25, 'rsi_ob': 72, 'vol_spike': 0.20276006590088122, 'adx_thresh': 12.77810199235675, 'atr_min_pct': 0.012484065202601058, 'atr_max_pct': 0.07578369015849766, 'tp_mult': 1.7783350237563345, 'tsl_mult': 0.6941934506315274, 'strategy': 'breakout', 'time_stop': 66, 'use_sma': False, 'use_atr': True, 'use_adx': False, 'use_ema': True, 'use_spike': True, 'rsi_required': True, 'edge_k': 0.21520118597840784, 'edge_cap': 0.5398614972134705, 'bull_strategy': 'mean_reversion', 'bull_bb_std_mult': 2.463974685934918, 'bull_rsi_os': 40, 'bull_rsi_ob': 49, 'bull_adx_thresh': 8.256587226237768, 'bull_atr_min_pct': 0.020797472738855, 'bull_atr_max_pct': 0.04902203636853569, 'bull_tp_mult': 2.1620399821572502, 'bull_tsl_mult': 0.2840285038115382, 'bull_time_stop': 158, 'bull_use_sma': True, 'bull_use_ema': False, 'bull_use_atr': True, 'bull_use_adx': False, 'bull_use_spike': True, 'bull_rsi_required': False, 'bear_strategy': 'mean_reversion', 'bear_bb_std_mult': 0.6043800494170758, 'bear_rsi_os': 38, 'bear_rsi_ob': 77, 'bear_adx_thresh': 30.091076085817097, 'bear_atr_min_pct': 0.023086987461996614, 'bear_atr_max_pct': 0.12938630800591405, 'bear_tp_mult': 1.5607760424023207, 'bear_tsl_mult': 0.9826809277370261, 'bear_time_stop': 76, 'bear_use_sma': True, 'bear_use_ema': True, 'bear_use_atr': True, 'bear_use_adx': False, 'bear_use_spike': False, 'bear_rsi_required': True, 'sideways_strategy': 'breakout', 'sideways_bb_std_mult': 1.8489526962108078, 'sideways_rsi_os': 40, 'sideways_rsi_ob': 72, 'sideways_adx_thresh': 27.138346353090085, 'sideways_atr_min_pct': 0.001571061068384603, 'sideways_atr_max_pct': 0.04858368107156197, 'sideways_tp_mult': 1.8865723070101637, 'sideways_tsl_mult': 0.9999585119108262, 'sideways_time_stop': 77, 'sideways_use_sma': True, 'sideways_use_ema': True, 'sideways_use_atr': True, 'sideways_use_adx': False, 'sideways_use_spike': True, 'sideways_rsi_required': False}.
[I 2025-08-30 15:36:50,659] Trial 507 finished with values: [-1000000000.0, 1000000000.0] and parameters: {'p_sma': 26, 'p_std': 18, 'p_atr': 14, 'p_adx': 26, 'rsi_period': 33, 'ema1': 30, 'ema2': 12, 'slip_atr_k': 0.19190817779967703, 'slip_spread_k': 0.40993859285351963, 'spread_hl_frac': 0.018179703154128212, 'bb_std_mult': 1.1975483885714913, 'rsi_os': 25, 'rsi_ob': 72, 'vol_spike': 0.17439846043133234, 'adx_thresh': 12.751201117807682, 'atr_min_pct': 0.012589243030959879, 'atr_max_pct': 0.06841669811777289, 'tp_mult': 1.7803126894076755, 'tsl_mult': 0.6958866945832304, 'strategy': 'breakout', 'time_stop': 127, 'use_sma': False, 'use_atr': True, 'use_adx': False, 'use_ema': True, 'use_spike': True, 'rsi_required': True, 'edge_k': 1.947314976348258, 'edge_cap': 0.7699976842807681, 'bull_strategy': 'mean_reversion', 'bull_bb_std_mult': 2.467491237311282, 'bull_rsi_os': 39, 'bull_rsi_ob': 72, 'bull_adx_thresh': 21.835902341018894, 'bull_atr_min_pct': 0.020740448374735265, 'bull_atr_max_pct': 0.0688680763819812, 'bull_tp_mult': 2.1988968640269175, 'bull_tsl_mult': 0.295230218484516, 'bull_time_stop': 243, 'bull_use_sma': True, 'bull_use_ema': False, 'bull_use_atr': True, 'bull_use_adx': False, 'bull_use_spike': True, 'bull_rsi_required': False, 'bear_strategy': 'mean_reversion', 'bear_bb_std_mult': 0.7723487328478762, 'bear_rsi_os': 30, 'bear_rsi_ob': 91, 'bear_adx_thresh': 27.972775453400757, 'bear_atr_min_pct': 0.007496482475095687, 'bear_atr_max_pct': 0.14723471209652322, 'bear_tp_mult': 2.6695301058917043, 'bear_tsl_mult': 0.7750568775315021, 'bear_time_stop': 131, 'bear_use_sma': True, 'bear_use_ema': True, 'bear_use_atr': True, 'bear_use_adx': False, 'bear_use_spike': False, 'bear_rsi_required': True, 'sideways_strategy': 'breakout', 'sideways_bb_std_mult': 1.1111597629604333, 'sideways_rsi_os': 40, 'sideways_rsi_ob': 55, 'sideways_adx_thresh': 29.75174117584106, 'sideways_atr_min_pct': 0.025298677372299804, 'sideways_atr_max_pct': 0.13799237292180724, 'sideways_tp_mult': 2.0011328606956433, 'sideways_tsl_mult': 0.21757294408381278, 'sideways_time_stop': 74, 'sideways_use_sma': True, 'sideways_use_ema': True, 'sideways_use_atr': True, 'sideways_use_adx': False, 'sideways_use_spike': True, 'sideways_rsi_required': False}.
[I 2025-08-30 15:37:35,762] Trial 510 finished with values: [-1000000000.0, 1000000000.0] and parameters: {'p_sma': 6, 'p_std': 57, 'p_atr': 16, 'p_adx': 30, 'rsi_period': 74, 'ema1': 30, 'ema2': 12, 'slip_atr_k': 0.06639758873648377, 'slip_spread_k': 0.7496920031328325, 'spread_hl_frac': 0.016602020534204998, 'bb_std_mult': 1.658982662696415, 'rsi_os': 24, 'rsi_ob': 71, 'vol_spike': 0.03948109565630786, 'adx_thresh': 13.617915958248117, 'atr_min_pct': 0.013148915504024892, 'atr_max_pct': 0.06869051426536381, 'tp_mult': 1.7967737038375409, 'tsl_mult': 0.7411474980806391, 'strategy': 'breakout', 'time_stop': 129, 'use_sma': True, 'use_atr': True, 'use_adx': False, 'use_ema': True, 'use_spike': True, 'rsi_required': True, 'edge_k': 0.22234281716092305, 'edge_cap': 0.5243860909639142, 'bull_strategy': 'mean_reversion', 'bull_bb_std_mult': 2.4630415166698487, 'bull_rsi_os': 40, 'bull_rsi_ob': 50, 'bull_adx_thresh': 22.565069710288398, 'bull_atr_min_pct': 0.011620600888151308, 'bull_atr_max_pct': 0.07289599143520452, 'bull_tp_mult': 2.153204709471129, 'bull_tsl_mult': 0.24449810779486414, 'bull_time_stop': 243, 'bull_use_sma': True, 'bull_use_ema': False, 'bull_use_atr': False, 'bull_use_adx': False, 'bull_use_spike': True, 'bull_rsi_required': False, 'bear_strategy': 'mean_reversion', 'bear_bb_std_mult': 0.7614951166354564, 'bear_rsi_os': 30, 'bear_rsi_ob': 94, 'bear_adx_thresh': 11.526963565531238, 'bear_atr_min_pct': 0.021574671152927, 'bear_atr_max_pct': 0.06786885097825764, 'bear_tp_mult': 2.2264039503089874, 'bear_tsl_mult': 0.9814848889724898, 'bear_time_stop': 52, 'bear_use_sma': True, 'bear_use_ema': False, 'bear_use_atr': True, 'bear_use_adx': False, 'bear_use_spike': True, 'bear_rsi_required': True, 'sideways_strategy': 'mean_reversion', 'sideways_bb_std_mult': 1.2745652345086835, 'sideways_rsi_os': 43, 'sideways_rsi_ob': 55, 'sideways_adx_thresh': 26.574192694215977, 'sideways_atr_min_pct': 0.0015238114174759242, 'sideways_atr_max_pct': 0.1389479605997325, 'sideways_tp_mult': 2.0011865856473747, 'sideways_tsl_mult': 0.9636523016680004, 'sideways_time_stop': 100, 'sideways_use_sma': True, 'sideways_use_ema': True, 'sideways_use_atr': True, 'sideways_use_adx': False, 'sideways_use_spike': True, 'sideways_rsi_required': False}.
[I 2025-08-30 15:37:35,779] Trial 509 finished with values: [-1000000000.0, 0.16263242125201985] and parameters: {'p_sma': 41, 'p_std': 57, 'p_atr': 14, 'p_adx': 10, 'rsi_period': 35, 'ema1': 30, 'ema2': 36, 'slip_atr_k': 0.06354118707571653, 'slip_spread_k': 0.0009022470755900569, 'spread_hl_frac': 0.018483446376231952, 'bb_std_mult': 1.4326340674986868, 'rsi_os': 18, 'rsi_ob': 86, 'vol_spike': 0.0869709657440176, 'adx_thresh': 12.599366955683921, 'atr_min_pct': 0.013104901122300554, 'atr_max_pct': 0.06798477181628303, 'tp_mult': 1.792802632416038, 'tsl_mult': 0.7196578968260849, 'strategy': 'breakout', 'time_stop': 266, 'use_sma': True, 'use_atr': True, 'use_adx': False, 'use_ema': True, 'use_spike': True, 'rsi_required': True, 'edge_k': 0.19717469244112482, 'edge_cap': 0.36666706733512044, 'bull_strategy': 'mean_reversion', 'bull_bb_std_mult': 1.139751284070527, 'bull_rsi_os': 42, 'bull_rsi_ob': 50, 'bull_adx_thresh': 21.697669182379645, 'bull_atr_min_pct': 0.023249843338892726, 'bull_atr_max_pct': 0.0729304512577227, 'bull_tp_mult': 2.149548995437967, 'bull_tsl_mult': 0.2824194511073884, 'bull_time_stop': 160, 'bull_use_sma': True, 'bull_use_ema': False, 'bull_use_atr': True, 'bull_use_adx': False, 'bull_use_spike': True, 'bull_rsi_required': False, 'bear_strategy': 'mean_reversion', 'bear_bb_std_mult': 3.227453023730993, 'bear_rsi_os': 47, 'bear_rsi_ob': 82, 'bear_adx_thresh': 30.048347092335526, 'bear_atr_min_pct': 0.02149137635913543, 'bear_atr_max_pct': 0.12839496437640396, 'bear_tp_mult': 2.7447190858553125, 'bear_tsl_mult': 0.9739283475731388, 'bear_time_stop': 54, 'bear_use_sma': True, 'bear_use_ema': False, 'bear_use_atr': True, 'bear_use_adx': False, 'bear_use_spike': False, 'bear_rsi_required': True, 'sideways_strategy': 'breakout', 'sideways_bb_std_mult': 1.2472991147277352, 'sideways_rsi_os': 40, 'sideways_rsi_ob': 55, 'sideways_adx_thresh': 27.211659446765065, 'sideways_atr_min_pct': 2.7074330935545005e-05, 'sideways_atr_max_pct': 0.13896827860118374, 'sideways_tp_mult': 2.3992608961387805, 'sideways_tsl_mult': 0.21856786801401928, 'sideways_time_stop': 271, 'sideways_use_sma': True, 'sideways_use_ema': True, 'sideways_use_atr': True, 'sideways_use_adx': False, 'sideways_use_spike': True, 'sideways_rsi_required': False}.
[I 2025-08-30 15:37:36,679] Trial 512 finished with values: [-1000000000.0, 1000000000.0] and parameters: {'p_sma': 54, 'p_std': 57, 'p_atr': 29, 'p_adx': 25, 'rsi_period': 75, 'ema1': 29, 'ema2': 36, 'slip_atr_k': 0.05756757288178091, 'slip_spread_k': 0.07726515546795992, 'spread_hl_frac': 0.0249748153301424, 'bb_std_mult': 1.414970580911384, 'rsi_os': 18, 'rsi_ob': 54, 'vol_spike': 0.18608709625029218, 'adx_thresh': 13.436663429788796, 'atr_min_pct': 0.013617334456661044, 'atr_max_pct': 0.11876018991347062, 'tp_mult': 1.750371822679172, 'tsl_mult': 0.7456691853335293, 'strategy': 'breakout', 'time_stop': 130, 'use_sma': True, 'use_atr': True, 'use_adx': False, 'use_ema': True, 'use_spike': True, 'rsi_required': True, 'edge_k': 0.20481611941643357, 'edge_cap': 0.8824749995654817, 'bull_strategy': 'breakout', 'bull_bb_std_mult': 2.6942479870606366, 'bull_rsi_os': 42, 'bull_rsi_ob': 50, 'bull_adx_thresh': 22.51409967263562, 'bull_atr_min_pct': 0.019559158514732465, 'bull_atr_max_pct': 0.0736714325669063, 'bull_tp_mult': 2.103261638534258, 'bull_tsl_mult': 0.2467091038114683, 'bull_time_stop': 294, 'bull_use_sma': False, 'bull_use_ema': True, 'bull_use_atr': False, 'bull_use_adx': False, 'bull_use_spike': True, 'bull_rsi_required': False, 'bear_strategy': 'mean_reversion', 'bear_bb_std_mult': 0.7370929626442794, 'bear_rsi_os': 28, 'bear_rsi_ob': 73, 'bear_adx_thresh': 29.733882082416073, 'bear_atr_min_pct': 0.02262060825741945, 'bear_atr_max_pct': 0.06797097696592345, 'bear_tp_mult': 2.740304780696653, 'bear_tsl_mult': 0.9211410209851895, 'bear_time_stop': 54, 'bear_use_sma': True, 'bear_use_ema': False, 'bear_use_atr': True, 'bear_use_adx': True, 'bear_use_spike': True, 'bear_rsi_required': True, 'sideways_strategy': 'mean_reversion', 'sideways_bb_std_mult': 2.0593710196847, 'sideways_rsi_os': 44, 'sideways_rsi_ob': 49, 'sideways_adx_thresh': 26.466609759757795, 'sideways_atr_min_pct': 0.0005195871701193465, 'sideways_atr_max_pct': 0.033457326087099865, 'sideways_tp_mult': 2.4087835111878024, 'sideways_tsl_mult': 0.9671871262590487, 'sideways_time_stop': 300, 'sideways_use_sma': True, 'sideways_use_ema': True, 'sideways_use_atr': False, 'sideways_use_adx': True, 'sideways_use_spike': True, 'sideways_rsi_required': False}.
[I 2025-08-30 15:37:36,679] Trial 511 finished with values: [-0.07997158573970242, 0.0799033257067852] and parameters: {'p_sma': 41, 'p_std': 57, 'p_atr': 16, 'p_adx': 25, 'rsi_period': 15, 'ema1': 30, 'ema2': 36, 'slip_atr_k': 0.06747652331705671, 'slip_spread_k': 0.4438148114431839, 'spread_hl_frac': 0.04527344934110575, 'bb_std_mult': 1.2690377867294709, 'rsi_os': 22, 'rsi_ob': 54, 'vol_spike': 0.09037394709308753, 'adx_thresh': 13.506928489556062, 'atr_min_pct': 0.013151329654720784, 'atr_max_pct': 0.06821693593358186, 'tp_mult': 1.7467331562289141, 'tsl_mult': 0.7402403794987452, 'strategy': 'breakout', 'time_stop': 265, 'use_sma': True, 'use_atr': True, 'use_adx': False, 'use_ema': True, 'use_spike': True, 'rsi_required': True, 'edge_k': 0.22108357638618784, 'edge_cap': 0.35088973426293524, 'bull_strategy': 'mean_reversion', 'bull_bb_std_mult': 2.7094016766513507, 'bull_rsi_os': 39, 'bull_rsi_ob': 72, 'bull_adx_thresh': 22.239090916390992, 'bull_atr_min_pct': 0.02322170255919801, 'bull_atr_max_pct': 0.12188117690541589, 'bull_tp_mult': 2.131188604382175, 'bull_tsl_mult': 0.25695554208480725, 'bull_time_stop': 162, 'bull_use_sma': True, 'bull_use_ema': True, 'bull_use_atr': False, 'bull_use_adx': False, 'bull_use_spike': True, 'bull_rsi_required': False, 'bear_strategy': 'mean_reversion', 'bear_bb_std_mult': 2.5748729876682956, 'bear_rsi_os': 30, 'bear_rsi_ob': 94, 'bear_adx_thresh': 28.703123983186902, 'bear_atr_min_pct': 0.021491974893834507, 'bear_atr_max_pct': 0.10527970004821627, 'bear_tp_mult': 2.5746680981856507, 'bear_tsl_mult': 0.9768163975931912, 'bear_time_stop': 171, 'bear_use_sma': True, 'bear_use_ema': False, 'bear_use_atr': True, 'bear_use_adx': True, 'bear_use_spike': True, 'bear_rsi_required': True, 'sideways_strategy': 'mean_reversion', 'sideways_bb_std_mult': 1.5717606360648406, 'sideways_rsi_os': 43, 'sideways_rsi_ob': 55, 'sideways_adx_thresh': 5.135857153791363, 'sideways_atr_min_pct': 4.277058325866166e-05, 'sideways_atr_max_pct': 0.03220211971784817, 'sideways_tp_mult': 2.9009155038070573, 'sideways_tsl_mult': 0.9597930450862016, 'sideways_time_stop': 101, 'sideways_use_sma': True, 'sideways_use_ema': True, 'sideways_use_atr': True, 'sideways_use_adx': False, 'sideways_use_spike': True, 'sideways_rsi_required': False}.
