[I 2025-08-30 16:04:22,885] Trial 638 finished with values: [-1000000000.0, 1000000000.0] and parameters: {'p_sma': 5, 'p_std': 57, 'p_atr': 28, 'p_adx': 25, 'rsi_period': 81, 'ema1': 30, 'ema2': 34, 'slip_atr_k': 0.16091233311570968, 'slip_spread_k': 0.11027264781875866, 'spread_hl_frac': 0.024764982135133996, 'bb_std_mult': 0.6252664705537894, 'rsi_os': 12, 'rsi_ob': 72, 'vol_spike': 0.045966728574462434, 'adx_thresh': 14.570599368889349, 'atr_min_pct': 0.013476024294900904, 'atr_max_pct': 0.043596281638984984, 'tp_mult': 1.7382160055279268, 'tsl_mult': 0.7346406323273713, 'strategy': 'breakout', 'time_stop': 275, 'use_sma': False, 'use_atr': True, 'use_adx': False, 'use_ema': True, 'use_spike': True, 'rsi_required': False, 'edge_k': 0.07493418419385302, 'edge_cap': 0.2710328174925899, 'bull_strategy': 'mean_reversion', 'bull_bb_std_mult': 1.1020754272970863, 'bull_rsi_os': 24, 'bull_rsi_ob': 50, 'bull_adx_thresh': 14.821012641299614, 'bull_atr_min_pct': 0.026265567890613066, 'bull_atr_max_pct': 0.0927498068321737, 'bull_tp_mult': 2.181243138400883, 'bull_tsl_mult': 0.2898341526976177, 'bull_time_stop': 297, 'bull_use_sma': True, 'bull_use_ema': True, 'bull_use_atr': True, 'bull_use_adx': False, 'bull_use_spike': True, 'bull_rsi_required': False, 'bear_strategy': 'mean_reversion', 'bear_bb_std_mult': 0.7158168288271353, 'bear_rsi_os': 27, 'bear_rsi_ob': 74, 'bear_adx_thresh': 30.164624923098597, 'bear_atr_min_pct': 0.02014375150648583, 'bear_atr_max_pct': 0.08728200440277169, 'bear_tp_mult': 1.5857848219632342, 'bear_tsl_mult': 0.9139111440625629, 'bear_time_stop': 267, 'bear_use_sma': True, 'bear_use_ema': True, 'bear_use_atr': True, 'bear_use_adx': False, 'bear_use_spike': True, 'bear_rsi_required': True, 'sideways_strategy': 'breakout', 'sideways_bb_std_mult': 0.6029600775961883, 'sideways_rsi_os': 43, 'sideways_rsi_ob': 61, 'sideways_adx_thresh': 26.78827808403375, 'sideways_atr_min_pct': 0.018470657302096516, 'sideways_atr_max_pct': 0.10720401876887792, 'sideways_tp_mult': 2.3481952121382137, 'sideways_tsl_mult': 0.7767089248100354, 'sideways_time_stop': 77, 'sideways_use_sma': True, 'sideways_use_ema': True, 'sideways_use_atr': True, 'sideways_use_adx': False, 'sideways_use_spike': True, 'sideways_rsi_required': True}.
[I 2025-08-30 16:04:23,924] Trial 639 finished with values: [-1000000000.0, 1000000000.0] and parameters: {'p_sma': 6, 'p_std': 19, 'p_atr': 15, 'p_adx': 25, 'rsi_period': 82, 'ema1': 30, 'ema2': 32, 'slip_atr_k': 0.23150908426693972, 'slip_spread_k': 0.14134598574253093, 'spread_hl_frac': 0.02494895523037738, 'bb_std_mult': 0.9771480738365486, 'rsi_os': 24, 'rsi_ob': 71, 'vol_spike': 0.16611973919971929, 'adx_thresh': 14.64260852114952, 'atr_min_pct': 0.013394625010310805, 'atr_max_pct': 0.13702038649634865, 'tp_mult': 1.2850763045022786, 'tsl_mult': 0.2784322885762034, 'strategy': 'mean_reversion', 'time_stop': 142, 'use_sma': True, 'use_atr': True, 'use_adx': False, 'use_ema': True, 'use_spike': True, 'rsi_required': True, 'edge_k': 1.765543101857273, 'edge_cap': 0.4875901375970046, 'bull_strategy': 'breakout', 'bull_bb_std_mult': 3.594343433024381, 'bull_rsi_os': 22, 'bull_rsi_ob': 47, 'bull_adx_thresh': 16.84160657797755, 'bull_atr_min_pct': 0.014044026450098368, 'bull_atr_max_pct': 0.09275056137992639, 'bull_tp_mult': 2.1806598969999405, 'bull_tsl_mult': 0.37741776947204486, 'bull_time_stop': 30, 'bull_use_sma': False, 'bull_use_ema': False, 'bull_use_atr': False, 'bull_use_adx': True, 'bull_use_spike': True, 'bull_rsi_required': False, 'bear_strategy': 'mean_reversion', 'bear_bb_std_mult': 0.5447887113410415, 'bear_rsi_os': 21, 'bear_rsi_ob': 77, 'bear_adx_thresh': 29.498455937035374, 'bear_atr_min_pct': 0.007259314537078629, 'bear_atr_max_pct': 0.07311913225484984, 'bear_tp_mult': 1.4272721654602347, 'bear_tsl_mult': 0.35522736577546465, 'bear_time_stop': 68, 'bear_use_sma': True, 'bear_use_ema': False, 'bear_use_atr': True, 'bear_use_adx': True, 'bear_use_spike': False, 'bear_rsi_required': True, 'sideways_strategy': 'breakout', 'sideways_bb_std_mult': 0.8073729439139188, 'sideways_rsi_os': 43, 'sideways_rsi_ob': 61, 'sideways_adx_thresh': 24.65840274364002, 'sideways_atr_min_pct': 0.021550154952309705, 'sideways_atr_max_pct': 0.025421372791726543, 'sideways_tp_mult': 1.8771502529725552, 'sideways_tsl_mult': 0.9996234925029567, 'sideways_time_stop': 179, 'sideways_use_sma': True, 'sideways_use_ema': True, 'sideways_use_atr': False, 'sideways_use_adx': True, 'sideways_use_spike': True, 'sideways_rsi_required': False}.
[I 2025-08-30 16:04:24,472] Trial 641 finished with values: [-0.009488307001653595, 0.00943006484317877] and parameters: {'p_sma': 5, 'p_std': 56, 'p_atr': 26, 'p_adx': 11, 'rsi_period': 78, 'ema1': 23, 'ema2': 32, 'slip_atr_k': 0.07024850512438918, 'slip_spread_k': 0.13736293484519568, 'spread_hl_frac': 0.0248979171356632, 'bb_std_mult': 2.3479382695974915, 'rsi_os': 39, 'rsi_ob': 73, 'vol_spike': 0.16454499876570025, 'adx_thresh': 14.563915808564447, 'atr_min_pct': 0.014943606480586263, 'atr_max_pct': 0.07610189325290279, 'tp_mult': 1.7522238457639805, 'tsl_mult': 0.28089569101536577, 'strategy': 'mean_reversion', 'time_stop': 218, 'use_sma': True, 'use_atr': True, 'use_adx': False, 'use_ema': True, 'use_spike': True, 'rsi_required': False, 'edge_k': 0.4202958648712005, 'edge_cap': 0.589607831552138, 'bull_strategy': 'breakout', 'bull_bb_std_mult': 0.8046501937034665, 'bull_rsi_os': 40, 'bull_rsi_ob': 62, 'bull_adx_thresh': 23.30623190195314, 'bull_atr_min_pct': 0.02043554959807606, 'bull_atr_max_pct': 0.09329404171657603, 'bull_tp_mult': 2.05641754122399, 'bull_tsl_mult': 0.0835488550548582, 'bull_time_stop': 30, 'bull_use_sma': True, 'bull_use_ema': True, 'bull_use_atr': True, 'bull_use_adx': True, 'bull_use_spike': True, 'bull_rsi_required': True, 'bear_strategy': 'mean_reversion', 'bear_bb_std_mult': 2.5466187448651807, 'bear_rsi_os': 32, 'bear_rsi_ob': 85, 'bear_adx_thresh': 29.133765699618188, 'bear_atr_min_pct': 0.020948463433544316, 'bear_atr_max_pct': 0.07347897635647144, 'bear_tp_mult': 2.813841589236452, 'bear_tsl_mult': 0.3590618306086253, 'bear_time_stop': 268, 'bear_use_sma': False, 'bear_use_ema': False, 'bear_use_atr': True, 'bear_use_adx': True, 'bear_use_spike': True, 'bear_rsi_required': True, 'sideways_strategy': 'breakout', 'sideways_bb_std_mult': 1.0650429236293784, 'sideways_rsi_os': 40, 'sideways_rsi_ob': 61, 'sideways_adx_thresh': 24.604504251092315, 'sideways_atr_min_pct': 0.000549137971222382, 'sideways_atr_max_pct': 0.10398175145931762, 'sideways_tp_mult': 2.956989697047607, 'sideways_tsl_mult': 0.9564222478852483, 'sideways_time_stop': 78, 'sideways_use_sma': True, 'sideways_use_ema': True, 'sideways_use_atr': False, 'sideways_use_adx': True, 'sideways_use_spike': True, 'sideways_rsi_required': True}.
[I 2025-08-30 16:05:12,461] Trial 645 finished with values: [-0.013250279327128411, 0.013172973584915428] and parameters: {'p_sma': 39, 'p_std': 54, 'p_atr': 29, 'p_adx': 11, 'rsi_period': 81, 'ema1': 23, 'ema2': 30, 'slip_atr_k': 0.08278965948596315, 'slip_spread_k': 0.15576937733243829, 'spread_hl_frac': 0.02221267192173877, 'bb_std_mult': 2.6377469394893494, 'rsi_os': 39, 'rsi_ob': 74, 'vol_spike': 0.15233021722122783, 'adx_thresh': 15.732269771502171, 'atr_min_pct': 0.015778848756948384, 'atr_max_pct': 0.06637283300200689, 'tp_mult': 1.6646940973444393, 'tsl_mult': 0.4065772309541917, 'strategy': 'mean_reversion', 'time_stop': 220, 'use_sma': True, 'use_atr': True, 'use_adx': True, 'use_ema': True, 'use_spike': True, 'rsi_required': False, 'edge_k': 0.42747547003350317, 'edge_cap': 0.6304104574771482, 'bull_strategy': 'breakout', 'bull_bb_std_mult': 1.3021715973951289, 'bull_rsi_os': 43, 'bull_rsi_ob': 61, 'bull_adx_thresh': 24.743031083642357, 'bull_atr_min_pct': 0.018938884418672468, 'bull_atr_max_pct': 0.09722788334192431, 'bull_tp_mult': 1.99885481856028, 'bull_tsl_mult': 0.05487547449523404, 'bull_time_stop': 13, 'bull_use_sma': True, 'bull_use_ema': True, 'bull_use_atr': True, 'bull_use_adx': True, 'bull_use_spike': True, 'bull_rsi_required': True, 'bear_strategy': 'breakout', 'bear_bb_std_mult': 2.5825500814692646, 'bear_rsi_os': 38, 'bear_rsi_ob': 85, 'bear_adx_thresh': 30.61445507646532, 'bear_atr_min_pct': 0.01897231071454384, 'bear_atr_max_pct': 0.08125095154450232, 'bear_tp_mult': 2.8024381546816577, 'bear_tsl_mult': 0.370373923195888, 'bear_time_stop': 286, 'bear_use_sma': False, 'bear_use_ema': False, 'bear_use_atr': True, 'bear_use_adx': True, 'bear_use_spike': True, 'bear_rsi_required': True, 'sideways_strategy': 'breakout', 'sideways_bb_std_mult': 1.0960276894491379, 'sideways_rsi_os': 37, 'sideways_rsi_ob': 63, 'sideways_adx_thresh': 21.930960381217627, 'sideways_atr_min_pct': 0.0005072206309612973, 'sideways_atr_max_pct': 0.11080880079993086, 'sideways_tp_mult': 2.9709125453039906, 'sideways_tsl_mult': 0.9243227069607342, 'sideways_time_stop': 60, 'sideways_use_sma': True, 'sideways_use_ema': False, 'sideways_use_atr': False, 'sideways_use_adx': True, 'sideways_use_spike': False, 'sideways_rsi_required': True}.
[I 2025-08-30 16:05:14,094] Trial 644 finished with values: [-0.03226699703014113, 0.03217484267111804] and parameters: {'p_sma': 8, 'p_std': 56, 'p_atr': 16, 'p_adx': 27, 'rsi_period': 77, 'ema1': 29, 'ema2': 35, 'slip_atr_k': 0.10957110467753949, 'slip_spread_k': 0.08160659589225328, 'spread_hl_frac': 0.028775950838473195, 'bb_std_mult': 1.3294405099624176, 'rsi_os': 25, 'rsi_ob': 73, 'vol_spike': 0.0625606804938966, 'adx_thresh': 7.601476240633275, 'atr_min_pct': 0.012875923354350872, 'atr_max_pct': 0.051643812089428906, 'tp_mult': 1.7831088123466496, 'tsl_mult': 0.723591261135912, 'strategy': 'breakout', 'time_stop': 183, 'use_sma': False, 'use_atr': True, 'use_adx': True, 'use_ema': True, 'use_spike': True, 'rsi_required': True, 'edge_k': 1.9414983237745016, 'edge_cap': 0.5855146599641413, 'bull_strategy': 'mean_reversion', 'bull_bb_std_mult': 2.4911718191789576, 'bull_rsi_os': 52, 'bull_rsi_ob': 95, 'bull_adx_thresh': 26.839206243807382, 'bull_atr_min_pct': 0.02497594271834684, 'bull_atr_max_pct': 0.14979068789155384, 'bull_tp_mult': 1.3044201854479345, 'bull_tsl_mult': 0.8604020401618807, 'bull_time_stop': 171, 'bull_use_sma': False, 'bull_use_ema': False, 'bull_use_atr': False, 'bull_use_adx': False, 'bull_use_spike': True, 'bull_rsi_required': True, 'bear_strategy': 'breakout', 'bear_bb_std_mult': 0.7814872482728672, 'bear_rsi_os': 54, 'bear_rsi_ob': 80, 'bear_adx_thresh': 11.63437788397839, 'bear_atr_min_pct': 0.0029130360050693693, 'bear_atr_max_pct': 0.07061112377904936, 'bear_tp_mult': 1.5183706766455438, 'bear_tsl_mult': 0.5193611600223562, 'bear_time_stop': 250, 'bear_use_sma': False, 'bear_use_ema': True, 'bear_use_atr': True, 'bear_use_adx': False, 'bear_use_spike': False, 'bear_rsi_required': True, 'sideways_strategy': 'breakout', 'sideways_bb_std_mult': 2.5976504934512334, 'sideways_rsi_os': 41, 'sideways_rsi_ob': 47, 'sideways_adx_thresh': 27.54756660408299, 'sideways_atr_min_pct': 0.0005337306537734563, 'sideways_atr_max_pct': 0.09616757193632215, 'sideways_tp_mult': 2.4810763922128305, 'sideways_tsl_mult': 0.9642561077243872, 'sideways_time_stop': 85, 'sideways_use_sma': True, 'sideways_use_ema': False, 'sideways_use_atr': True, 'sideways_use_adx': False, 'sideways_use_spike': False, 'sideways_rsi_required': False}.
[I 2025-08-30 16:05:14,942] Trial 643 finished with values: [-0.017028957527913224, 0.01692719317977295] and parameters: {'p_sma': 8, 'p_std': 56, 'p_atr': 10, 'p_adx': 27, 'rsi_period': 78, 'ema1': 29, 'ema2': 59, 'slip_atr_k': 0.07914482287382356, 'slip_spread_k': 0.13243230754036767, 'spread_hl_frac': 0.028309982386717225, 'bb_std_mult': 1.712128413753116, 'rsi_os': 26, 'rsi_ob': 74, 'vol_spike': 0.16360764645672074, 'adx_thresh': 12.662730362323636, 'atr_min_pct': 0.013104657167767183, 'atr_max_pct': 0.07351961027994122, 'tp_mult': 1.2831021499077009, 'tsl_mult': 0.280938913812487, 'strategy': 'breakout', 'time_stop': 141, 'use_sma': True, 'use_atr': True, 'use_adx': False, 'use_ema': True, 'use_spike': True, 'rsi_required': True, 'edge_k': 0.2535997003552329, 'edge_cap': 0.8990144209944319, 'bull_strategy': 'breakout', 'bull_bb_std_mult': 2.4791499553617045, 'bull_rsi_os': 9, 'bull_rsi_ob': 47, 'bull_adx_thresh': 23.217210907153678, 'bull_atr_min_pct': 0.025037685507762864, 'bull_atr_max_pct': 0.0653654355959033, 'bull_tp_mult': 2.057102537353123, 'bull_tsl_mult': 0.2647505580826996, 'bull_time_stop': 170, 'bull_use_sma': False, 'bull_use_ema': False, 'bull_use_atr': False, 'bull_use_adx': False, 'bull_use_spike': True, 'bull_rsi_required': True, 'bear_strategy': 'mean_reversion', 'bear_bb_std_mult': 0.5393390540623741, 'bear_rsi_os': 29, 'bear_rsi_ob': 77, 'bear_adx_thresh': 29.297745491414542, 'bear_atr_min_pct': 0.007418204192690546, 'bear_atr_max_pct': 0.0711217084093075, 'bear_tp_mult': 1.5109739535419995, 'bear_tsl_mult': 0.5155921474416651, 'bear_time_stop': 285, 'bear_use_sma': False, 'bear_use_ema': False, 'bear_use_atr': True, 'bear_use_adx': True, 'bear_use_spike': False, 'bear_rsi_required': True, 'sideways_strategy': 'breakout', 'sideways_bb_std_mult': 2.5874917520214287, 'sideways_rsi_os': 41, 'sideways_rsi_ob': 59, 'sideways_adx_thresh': 27.591736258192086, 'sideways_atr_min_pct': 2.005894514917853e-05, 'sideways_atr_max_pct': 0.10465349146990684, 'sideways_tp_mult': 1.247807222118995, 'sideways_tsl_mult': 0.5315095251946338, 'sideways_time_stop': 85, 'sideways_use_sma': True, 'sideways_use_ema': True, 'sideways_use_atr': False, 'sideways_use_adx': True, 'sideways_use_spike': False, 'sideways_rsi_required': False}.
[I 2025-08-30 16:05:15,409] Trial 642 finished with values: [-0.01615834793702564, 0.016067687883313652] and parameters: {'p_sma': 8, 'p_std': 56, 'p_atr': 15, 'p_adx': 26, 'rsi_period': 77, 'ema1': 30, 'ema2': 32, 'slip_atr_k': 0.053130658086128754, 'slip_spread_k': 0.9245240608158364, 'spread_hl_frac': 0.02873977156424098, 'bb_std_mult': 2.358665946227242, 'rsi_os': 25, 'rsi_ob': 72, 'vol_spike': 0.1641118246164624, 'adx_thresh': 5.78008519159933, 'atr_min_pct': 0.011519586669317223, 'atr_max_pct': 0.08935677897701874, 'tp_mult': 1.750481097043545, 'tsl_mult': 0.7233971551880598, 'strategy': 'breakout', 'time_stop': 267, 'use_sma': False, 'use_atr': True, 'use_adx': False, 'use_ema': True, 'use_spike': True, 'rsi_required': False, 'edge_k': 0.4237049604416122, 'edge_cap': 0.5851755814492796, 'bull_strategy': 'mean_reversion', 'bull_bb_std_mult': 2.468259471947775, 'bull_rsi_os': 11, 'bull_rsi_ob': 50, 'bull_adx_thresh': 26.832363391805885, 'bull_atr_min_pct': 0.026234487060090524, 'bull_atr_max_pct': 0.09224292821373872, 'bull_tp_mult': 2.163729075232362, 'bull_tsl_mult': 0.1721859521289693, 'bull_time_stop': 34, 'bull_use_sma': True, 'bull_use_ema': True, 'bull_use_atr': True, 'bull_use_adx': False, 'bull_use_spike': True, 'bull_rsi_required': True, 'bear_strategy': 'mean_reversion', 'bear_bb_std_mult': 0.7495807713835885, 'bear_rsi_os': 28, 'bear_rsi_ob': 77, 'bear_adx_thresh': 29.140633644210787, 'bear_atr_min_pct': 0.020931141514543332, 'bear_atr_max_pct': 0.06304399549910145, 'bear_tp_mult': 2.655710082383639, 'bear_tsl_mult': 0.4416698791994599, 'bear_time_stop': 58, 'bear_use_sma': False, 'bear_use_ema': True, 'bear_use_atr': True, 'bear_use_adx': False, 'bear_use_spike': True, 'bear_rsi_required': True, 'sideways_strategy': 'breakout', 'sideways_bb_std_mult': 2.589746360823343, 'sideways_rsi_os': 41, 'sideways_rsi_ob': 59, 'sideways_adx_thresh': 27.656462542192752, 'sideways_atr_min_pct': 0.000575643810885831, 'sideways_atr_max_pct': 0.10439440242115461, 'sideways_tp_mult': 2.3635335283062995, 'sideways_tsl_mult': 0.9991227566098712, 'sideways_time_stop': 172, 'sideways_use_sma': True, 'sideways_use_ema': True, 'sideways_use_atr': True, 'sideways_use_adx': False, 'sideways_use_spike': False, 'sideways_rsi_required': True}.
[I 2025-08-30 16:06:03,353] Trial 646 finished with values: [-0.010853335505795259, 0.010965257072087072] and parameters: {'p_sma': 8, 'p_std': 54, 'p_atr': 27, 'p_adx': 11, 'rsi_period': 80, 'ema1': 22, 'ema2': 30, 'slip_atr_k': 0.07952275637717542, 'slip_spread_k': 0.19733864820855215, 'spread_hl_frac': 0.021636612147337433, 'bb_std_mult': 2.2507437984058423, 'rsi_os': 39, 'rsi_ob': 84, 'vol_spike': 0.14648063000559697, 'adx_thresh': 15.631280434756391, 'atr_min_pct': 0.015834078446313897, 'atr_max_pct': 0.07242430490243129, 'tp_mult': 1.645587333435209, 'tsl_mult': 0.19436534979389408, 'strategy': 'mean_reversion', 'time_stop': 220, 'use_sma': True, 'use_atr': True, 'use_adx': False, 'use_ema': False, 'use_spike': True, 'rsi_required': False, 'edge_k': 0.42603490885185846, 'edge_cap': 0.6113069901684192, 'bull_strategy': 'breakout', 'bull_bb_std_mult': 0.6906248542197404, 'bull_rsi_os': 43, 'bull_rsi_ob': 61, 'bull_adx_thresh': 24.637179123612604, 'bull_atr_min_pct': 0.019386445276056166, 'bull_atr_max_pct': 0.0966951542514197, 'bull_tp_mult': 2.018995078160081, 'bull_tsl_mult': 0.05313137791729994, 'bull_time_stop': 13, 'bull_use_sma': True, 'bull_use_ema': True, 'bull_use_atr': True, 'bull_use_adx': True, 'bull_use_spike': True, 'bull_rsi_required': True, 'bear_strategy': 'breakout', 'bear_bb_std_mult': 2.5923012372966188, 'bear_rsi_os': 36, 'bear_rsi_ob': 85, 'bear_adx_thresh': 31.028152151248776, 'bear_atr_min_pct': 0.019485063195232064, 'bear_atr_max_pct': 0.07979095335742586, 'bear_tp_mult': 2.814566288367404, 'bear_tsl_mult': 0.3768172457268922, 'bear_time_stop': 252, 'bear_use_sma': False, 'bear_use_ema': False, 'bear_use_atr': False, 'bear_use_adx': True, 'bear_use_spike': True, 'bear_rsi_required': True, 'sideways_strategy': 'breakout', 'sideways_bb_std_mult': 1.0759153241623314, 'sideways_rsi_os': 38, 'sideways_rsi_ob': 63, 'sideways_adx_thresh': 23.648428227556156, 'sideways_atr_min_pct': 4.1009325975059716e-05, 'sideways_atr_max_pct': 0.11202797720041009, 'sideways_tp_mult': 2.9744821961542947, 'sideways_tsl_mult': 0.901292792535937, 'sideways_time_stop': 59, 'sideways_use_sma': True, 'sideways_use_ema': False, 'sideways_use_atr': False, 'sideways_use_adx': True, 'sideways_use_spike': False, 'sideways_rsi_required': True}.
[I 2025-08-30 16:06:04,745] Trial 647 finished with values: [-1000000000.0, 1000000000.0] and parameters: {'p_sma': 26, 'p_std': 54, 'p_atr': 24, 'p_adx': 11, 'rsi_period': 81, 'ema1': 23, 'ema2': 30, 'slip_atr_k': 0.0802984606252023, 'slip_spread_k': 0.15707853824476822, 'spread_hl_frac': 0.02294813814934917, 'bb_std_mult': 2.344298800614247, 'rsi_os': 39, 'rsi_ob': 74, 'vol_spike': 0.15682301453186878, 'adx_thresh': 15.679700278006566, 'atr_min_pct': 0.015881605896592123, 'atr_max_pct': 0.0715305112143629, 'tp_mult': 1.6387844129217832, 'tsl_mult': 0.23225232337140767, 'strategy': 'mean_reversion', 'time_stop': 222, 'use_sma': True, 'use_atr': True, 'use_adx': False, 'use_ema': False, 'use_spike': True, 'rsi_required': False, 'edge_k': 0.4314094898515094, 'edge_cap': 0.6375934640965748, 'bull_strategy': 'breakout', 'bull_bb_std_mult': 0.6482875608803456, 'bull_rsi_os': 42, 'bull_rsi_ob': 61, 'bull_adx_thresh': 24.814022127543303, 'bull_atr_min_pct': 0.01894846564705024, 'bull_atr_max_pct': 0.09593886866667378, 'bull_tp_mult': 1.9969127873211017, 'bull_tsl_mult': 0.05533735524372396, 'bull_time_stop': 19, 'bull_use_sma': True, 'bull_use_ema': True, 'bull_use_atr': True, 'bull_use_adx': True, 'bull_use_spike': True, 'bull_rsi_required': True, 'bear_strategy': 'mean_reversion', 'bear_bb_std_mult': 2.597066515287223, 'bear_rsi_os': 35, 'bear_rsi_ob': 85, 'bear_adx_thresh': 30.562212698455294, 'bear_atr_min_pct': 0.019520643203302934, 'bear_atr_max_pct': 0.0822379901594888, 'bear_tp_mult': 2.8116701559251416, 'bear_tsl_mult': 0.3805243168272355, 'bear_time_stop': 287, 'bear_use_sma': False, 'bear_use_ema': False, 'bear_use_atr': False, 'bear_use_adx': True, 'bear_use_spike': True, 'bear_rsi_required': True, 'sideways_strategy': 'mean_reversion', 'sideways_bb_std_mult': 1.0465610197126325, 'sideways_rsi_os': 38, 'sideways_rsi_ob': 62, 'sideways_adx_thresh': 24.008975680641772, 'sideways_atr_min_pct': 0.00028146304273878275, 'sideways_atr_max_pct': 0.11196153984648342, 'sideways_tp_mult': 2.9451987258307697, 'sideways_tsl_mult': 0.9093548032999103, 'sideways_time_stop': 60, 'sideways_use_sma': True, 'sideways_use_ema': True, 'sideways_use_atr': False, 'sideways_use_adx': True, 'sideways_use_spike': False, 'sideways_rsi_required': True}.
