[I 2025-08-29 19:56:35,602] Trial 169 finished with values: [-1000000000.0, 1000000000.0] and parameters: {'p_sma': 39, 'p_std': 51, 'p_atr': 16, 'p_adx': 17, 'rsi_period': 17, 'ema1': 10, 'ema2': 53, 'slip_atr_k': 0.04024126540913121, 'slip_spread_k': 0.9130408718413936, 'spread_hl_frac': 0.003575241712139535, 'bb_std_mult': 3.0511925363912504, 'rsi_os': 23, 'rsi_ob': 72, 'vol_spike': 0.26960154148181964, 'adx_thresh': 33.86055821396201, 'atr_min_pct': 0.014601859456271052, 'atr_max_pct': 0.09374719342538011, 'tp_mult': 2.5119553579491685, 'tsl_mult': 0.5820768019201514, 'strategy': 'mean_reversion', 'time_stop': 5, 'use_sma': False, 'use_atr': True, 'use_adx': False, 'use_ema': False, 'use_spike': False, 'rsi_required': True, 'edge_k': 1.3811236444637687, 'edge_cap': 0.4532522282432836, 'bull_strategy': 'breakout', 'bull_bb_std_mult': 2.9640895574350523, 'bull_rsi_os': 41, 'bull_rsi_ob': 93, 'bull_adx_thresh': 19.254170330913386, 'bull_atr_min_pct': 0.006251441929880853, 'bull_atr_max_pct': 0.05157153889105314, 'bull_tp_mult': 1.8962586636186383, 'bull_tsl_mult': 0.1473512203901296, 'bull_time_stop': 94, 'bull_use_sma': False, 'bull_use_ema': True, 'bull_use_atr': False, 'bull_use_adx': True, 'bull_use_spike': False, 'bull_rsi_required': True, 'bear_strategy': 'mean_reversion', 'bear_bb_std_mult': 1.0280147314566015, 'bear_rsi_os': 28, 'bear_rsi_ob': 65, 'bear_adx_thresh': 5.670335535444662, 'bear_atr_min_pct': 0.01482795236659712, 'bear_atr_max_pct': 0.10740315566886684, 'bear_tp_mult': 1.7975913949223603, 'bear_tsl_mult': 0.32055303505965804, 'bear_time_stop': 12, 'bear_use_sma': False, 'bear_use_ema': False, 'bear_use_atr': False, 'bear_use_adx': False, 'bear_use_spike': False, 'bear_rsi_required': False, 'sideways_strategy': 'breakout', 'sideways_bb_std_mult': 2.123697514966058, 'sideways_rsi_os': 27, 'sideways_rsi_ob': 89, 'sideways_adx_thresh': 30.78540655200399, 'sideways_atr_min_pct': 0.01729436383604752, 'sideways_atr_max_pct': 0.12227376638250705, 'sideways_tp_mult': 2.039882652721558, 'sideways_tsl_mult': 0.21856714595672372, 'sideways_time_stop': 233, 'sideways_use_sma': False, 'sideways_use_ema': True, 'sideways_use_atr': True, 'sideways_use_adx': False, 'sideways_use_spike': True, 'sideways_rsi_required': True}.
[I 2025-08-29 19:56:37,214] Trial 172 finished with values: [-0.008533470531940646, 0.008514195538990021] and parameters: {'p_sma': 37, 'p_std': 52, 'p_atr': 25, 'p_adx': 7, 'rsi_period': 41, 'ema1': 19, 'ema2': 31, 'slip_atr_k': 0.05753972368936652, 'slip_spread_k': 0.8128350931594737, 'spread_hl_frac': 0.006738581390232412, 'bb_std_mult': 1.3933050691834206, 'rsi_os': 14, 'rsi_ob': 64, 'vol_spike': 0.0680722947399611, 'adx_thresh': 32.469414668985934, 'atr_min_pct': 0.014978060074089918, 'atr_max_pct': 0.09499795018278538, 'tp_mult': 2.121763003059805, 'tsl_mult': 0.22973584814377818, 'strategy': 'mean_reversion', 'time_stop': 92, 'use_sma': False, 'use_atr': True, 'use_adx': False, 'use_ema': False, 'use_spike': False, 'rsi_required': True, 'edge_k': 1.393229400957124, 'edge_cap': 0.476252174286274, 'bull_strategy': 'breakout', 'bull_bb_std_mult': 2.618907726154817, 'bull_rsi_os': 40, 'bull_rsi_ob': 79, 'bull_adx_thresh': 18.960778317443996, 'bull_atr_min_pct': 0.011250833857791387, 'bull_atr_max_pct': 0.11981840914588748, 'bull_tp_mult': 2.3528813655004814, 'bull_tsl_mult': 0.1341326233094833, 'bull_time_stop': 263, 'bull_use_sma': False, 'bull_use_ema': True, 'bull_use_atr': False, 'bull_use_adx': True, 'bull_use_spike': False, 'bull_rsi_required': True, 'bear_strategy': 'mean_reversion', 'bear_bb_std_mult': 1.1466135878877644, 'bear_rsi_os': 28, 'bear_rsi_ob': 51, 'bear_adx_thresh': 23.15210231957859, 'bear_atr_min_pct': 0.004800880996652898, 'bear_atr_max_pct': 0.10399015989866536, 'bear_tp_mult': 1.8220170251875398, 'bear_tsl_mult': 0.6874314562675354, 'bear_time_stop': 264, 'bear_use_sma': False, 'bear_use_ema': False, 'bear_use_atr': True, 'bear_use_adx': False, 'bear_use_spike': False, 'bear_rsi_required': False, 'sideways_strategy': 'breakout', 'sideways_bb_std_mult': 2.248780626939807, 'sideways_rsi_os': 29, 'sideways_rsi_ob': 90, 'sideways_adx_thresh': 30.786280892840338, 'sideways_atr_min_pct': 0.015324777460933631, 'sideways_atr_max_pct': 0.12122220835944927, 'sideways_tp_mult': 2.9578988995169384, 'sideways_tsl_mult': 0.27473734772207453, 'sideways_time_stop': 242, 'sideways_use_sma': False, 'sideways_use_ema': True, 'sideways_use_atr': True, 'sideways_use_adx': False, 'sideways_use_spike': False, 'sideways_rsi_required': True}.
[I 2025-08-29 19:56:37,295] Trial 173 finished with values: [-1000000000.0, 1000000000.0] and parameters: {'p_sma': 37, 'p_std': 36, 'p_atr': 21, 'p_adx': 17, 'rsi_period': 60, 'ema1': 11, 'ema2': 39, 'slip_atr_k': 0.05642563276170782, 'slip_spread_k': 0.25735149123278284, 'spread_hl_frac': 0.005280966163656366, 'bb_std_mult': 2.727024302362593, 'rsi_os': 25, 'rsi_ob': 76, 'vol_spike': 0.06774515191521878, 'adx_thresh': 9.205615133314543, 'atr_min_pct': 0.015231858586706209, 'atr_max_pct': 0.09734514464892, 'tp_mult': 1.5891661681839855, 'tsl_mult': 0.5970420313439229, 'strategy': 'mean_reversion', 'time_stop': 61, 'use_sma': True, 'use_atr': False, 'use_adx': False, 'use_ema': False, 'use_spike': False, 'rsi_required': True, 'edge_k': 1.3934270129095352, 'edge_cap': 0.4753659666042067, 'bull_strategy': 'breakout', 'bull_bb_std_mult': 2.591195557666508, 'bull_rsi_os': 28, 'bull_rsi_ob': 79, 'bull_adx_thresh': 18.977944534214533, 'bull_atr_min_pct': 0.02366251923338456, 'bull_atr_max_pct': 0.06657607779658395, 'bull_tp_mult': 1.887271168861978, 'bull_tsl_mult': 0.14092414596945485, 'bull_time_stop': 123, 'bull_use_sma': False, 'bull_use_ema': True, 'bull_use_atr': False, 'bull_use_adx': True, 'bull_use_spike': False, 'bull_rsi_required': True, 'bear_strategy': 'breakout', 'bear_bb_std_mult': 1.0379204586267445, 'bear_rsi_os': 27, 'bear_rsi_ob': 71, 'bear_adx_thresh': 20.241008945624007, 'bear_atr_min_pct': 0.005710079122498331, 'bear_atr_max_pct': 0.036210454430782, 'bear_tp_mult': 2.1720846774422733, 'bear_tsl_mult': 0.44288992785896575, 'bear_time_stop': 236, 'bear_use_sma': False, 'bear_use_ema': False, 'bear_use_atr': True, 'bear_use_adx': False, 'bear_use_spike': False, 'bear_rsi_required': False, 'sideways_strategy': 'mean_reversion', 'sideways_bb_std_mult': 2.243428707664212, 'sideways_rsi_os': 34, 'sideways_rsi_ob': 74, 'sideways_adx_thresh': 30.884303423787173, 'sideways_atr_min_pct': 0.02232311629464455, 'sideways_atr_max_pct': 0.13646563758422406, 'sideways_tp_mult': 2.0469415896420204, 'sideways_tsl_mult': 0.22370676668640366, 'sideways_time_stop': 189, 'sideways_use_sma': False, 'sideways_use_ema': True, 'sideways_use_atr': True, 'sideways_use_adx': False, 'sideways_use_spike': False, 'sideways_rsi_required': True}.
[I 2025-08-29 19:56:37,557] Trial 174 finished with values: [-1000000000.0, 1000000000.0] and parameters: {'p_sma': 37, 'p_std': 56, 'p_atr': 21, 'p_adx': 16, 'rsi_period': 41, 'ema1': 7, 'ema2': 41, 'slip_atr_k': 0.03302885211696446, 'slip_spread_k': 0.25558969859680314, 'spread_hl_frac': 0.005441231532422437, 'bb_std_mult': 1.1944287969593657, 'rsi_os': 19, 'rsi_ob': 68, 'vol_spike': 0.18855491878344113, 'adx_thresh': 32.05355849043385, 'atr_min_pct': 0.01528580492381247, 'atr_max_pct': 0.010214725971416191, 'tp_mult': 2.524540390781573, 'tsl_mult': 0.8221389001397053, 'strategy': 'mean_reversion', 'time_stop': 136, 'use_sma': False, 'use_atr': True, 'use_adx': False, 'use_ema': False, 'use_spike': False, 'rsi_required': True, 'edge_k': 1.394087644055215, 'edge_cap': 0.48785788744107556, 'bull_strategy': 'breakout', 'bull_bb_std_mult': 0.8283384108148284, 'bull_rsi_os': 40, 'bull_rsi_ob': 79, 'bull_adx_thresh': 18.940261428049865, 'bull_atr_min_pct': 0.007980456930657114, 'bull_atr_max_pct': 0.12031075648925138, 'bull_tp_mult': 1.8767306218765825, 'bull_tsl_mult': 0.1546042433510156, 'bull_time_stop': 121, 'bull_use_sma': False, 'bull_use_ema': True, 'bull_use_atr': False, 'bull_use_adx': True, 'bull_use_spike': False, 'bull_rsi_required': True, 'bear_strategy': 'breakout', 'bear_bb_std_mult': 1.2680128501222439, 'bear_rsi_os': 29, 'bear_rsi_ob': 60, 'bear_adx_thresh': 20.65690588983035, 'bear_atr_min_pct': 0.005629123290372427, 'bear_atr_max_pct': 0.11219010810014889, 'bear_tp_mult': 2.1999629836786148, 'bear_tsl_mult': 0.23870490047705623, 'bear_time_stop': 13, 'bear_use_sma': False, 'bear_use_ema': False, 'bear_use_atr': True, 'bear_use_adx': False, 'bear_use_spike': False, 'bear_rsi_required': False, 'sideways_strategy': 'mean_reversion', 'sideways_bb_std_mult': 2.1359232427817094, 'sideways_rsi_os': 29, 'sideways_rsi_ob': 91, 'sideways_adx_thresh': 30.834754580200293, 'sideways_atr_min_pct': 0.022052848434554757, 'sideways_atr_max_pct': 0.1268011114090483, 'sideways_tp_mult': 1.0283945118073516, 'sideways_tsl_mult': 0.7933897172959037, 'sideways_time_stop': 250, 'sideways_use_sma': False, 'sideways_use_ema': True, 'sideways_use_atr': True, 'sideways_use_adx': False, 'sideways_use_spike': False, 'sideways_rsi_required': True}.
[I 2025-08-29 19:57:06,047] Trial 176 finished with values: [-1000000000.0, 1000000000.0] and parameters: {'p_sma': 54, 'p_std': 57, 'p_atr': 7, 'p_adx': 26, 'rsi_period': 60, 'ema1': 13, 'ema2': 39, 'slip_atr_k': 0.03427464820265537, 'slip_spread_k': 0.2581707911977568, 'spread_hl_frac': 0.0056001927560183915, 'bb_std_mult': 2.726410455782603, 'rsi_os': 19, 'rsi_ob': 68, 'vol_spike': 0.18984328751003557, 'adx_thresh': 8.938940801016045, 'atr_min_pct': 0.012669300835889998, 'atr_max_pct': 0.0820479534490397, 'tp_mult': 2.4239723092873837, 'tsl_mult': 0.671853665937234, 'strategy': 'mean_reversion', 'time_stop': 45, 'use_sma': True, 'use_atr': False, 'use_adx': False, 'use_ema': False, 'use_spike': False, 'rsi_required': True, 'edge_k': 0.7232548916939638, 'edge_cap': 0.43361112348106035, 'bull_strategy': 'breakout', 'bull_bb_std_mult': 1.0827269598877063, 'bull_rsi_os': 45, 'bull_rsi_ob': 95, 'bull_adx_thresh': 16.926304528741447, 'bull_atr_min_pct': 0.02281917262373987, 'bull_atr_max_pct': 0.0776827672423955, 'bull_tp_mult': 1.0713351565245919, 'bull_tsl_mult': 0.1575250825554438, 'bull_time_stop': 271, 'bull_use_sma': False, 'bull_use_ema': True, 'bull_use_atr': False, 'bull_use_adx': True, 'bull_use_spike': False, 'bull_rsi_required': True, 'bear_strategy': 'breakout', 'bear_bb_std_mult': 1.2707834626239634, 'bear_rsi_os': 31, 'bear_rsi_ob': 89, 'bear_adx_thresh': 6.75163416099057, 'bear_atr_min_pct': 0.007428713474302733, 'bear_atr_max_pct': 0.10978211752442647, 'bear_tp_mult': 2.3319950325688845, 'bear_tsl_mult': 0.6267978716122892, 'bear_time_stop': 278, 'bear_use_sma': False, 'bear_use_ema': False, 'bear_use_atr': True, 'bear_use_adx': False, 'bear_use_spike': False, 'bear_rsi_required': False, 'sideways_strategy': 'mean_reversion', 'sideways_bb_std_mult': 1.8495413653346, 'sideways_rsi_os': 29, 'sideways_rsi_ob': 79, 'sideways_adx_thresh': 28.19625057037975, 'sideways_atr_min_pct': 0.016233182876987353, 'sideways_atr_max_pct': 0.03143783102001426, 'sideways_tp_mult': 1.0228961148921225, 'sideways_tsl_mult': 0.8241071358070925, 'sideways_time_stop': 250, 'sideways_use_sma': False, 'sideways_use_ema': False, 'sideways_use_atr': False, 'sideways_use_adx': False, 'sideways_use_spike': False, 'sideways_rsi_required': True}.
[I 2025-08-29 19:57:06,890] Trial 175 finished with values: [-1000000000.0, 1000000000.0] and parameters: {'p_sma': 37, 'p_std': 53, 'p_atr': 22, 'p_adx': 16, 'rsi_period': 23, 'ema1': 13, 'ema2': 39, 'slip_atr_k': 0.05567255953998167, 'slip_spread_k': 0.25198990026179907, 'spread_hl_frac': 0.004915717037905963, 'bb_std_mult': 2.7532436755153946, 'rsi_os': 32, 'rsi_ob': 68, 'vol_spike': 0.18994821646523197, 'adx_thresh': 32.18835182616483, 'atr_min_pct': 0.012707016160718093, 'atr_max_pct': 0.0142159395713964, 'tp_mult': 2.4043380550123414, 'tsl_mult': 0.22476024982906911, 'strategy': 'mean_reversion', 'time_stop': 253, 'use_sma': True, 'use_atr': False, 'use_adx': False, 'use_ema': False, 'use_spike': False, 'rsi_required': True, 'edge_k': 1.2217228329839789, 'edge_cap': 0.47083922488109936, 'bull_strategy': 'breakout', 'bull_bb_std_mult': 1.0564181259596188, 'bull_rsi_os': 40, 'bull_rsi_ob': 95, 'bull_adx_thresh': 17.01657787343316, 'bull_atr_min_pct': 0.023506840073181934, 'bull_atr_max_pct': 0.015215364731323164, 'bull_tp_mult': 1.0699393246632523, 'bull_tsl_mult': 0.16055457533590153, 'bull_time_stop': 272, 'bull_use_sma': False, 'bull_use_ema': True, 'bull_use_atr': False, 'bull_use_adx': True, 'bull_use_spike': False, 'bull_rsi_required': True, 'bear_strategy': 'breakout', 'bear_bb_std_mult': 0.9273894269460399, 'bear_rsi_os': 5, 'bear_rsi_ob': 71, 'bear_adx_thresh': 20.769074089143718, 'bear_atr_min_pct': 0.005594104477277443, 'bear_atr_max_pct': 0.10333397963844203, 'bear_tp_mult': 2.2099978270900285, 'bear_tsl_mult': 0.13404116731859383, 'bear_time_stop': 236, 'bear_use_sma': False, 'bear_use_ema': False, 'bear_use_atr': True, 'bear_use_adx': False, 'bear_use_spike': False, 'bear_rsi_required': False, 'sideways_strategy': 'mean_reversion', 'sideways_bb_std_mult': 2.0160981481569524, 'sideways_rsi_os': 29, 'sideways_rsi_ob': 94, 'sideways_adx_thresh': 6.311315771899636, 'sideways_atr_min_pct': 0.018731437752160223, 'sideways_atr_max_pct': 0.031541564862697685, 'sideways_tp_mult': 2.9393216614586355, 'sideways_tsl_mult': 0.2676577692072386, 'sideways_time_stop': 273, 'sideways_use_sma': False, 'sideways_use_ema': True, 'sideways_use_atr': True, 'sideways_use_adx': False, 'sideways_use_spike': False, 'sideways_rsi_required': True}.
[I 2025-08-29 19:57:07,214] Trial 177 finished with values: [-1000000000.0, 1000000000.0] and parameters: {'p_sma': 41, 'p_std': 24, 'p_atr': 22, 'p_adx': 16, 'rsi_period': 64, 'ema1': 12, 'ema2': 41, 'slip_atr_k': 0.24933093648496096, 'slip_spread_k': 0.08815215279577515, 'spread_hl_frac': 0.002200273599190259, 'bb_std_mult': 1.207330714038073, 'rsi_os': 19, 'rsi_ob': 66, 'vol_spike': 0.18958159544079428, 'adx_thresh': 32.13687523220213, 'atr_min_pct': 0.013187665004905168, 'atr_max_pct': 0.03122507208513728, 'tp_mult': 2.4076363096028177, 'tsl_mult': 0.8144292728862415, 'strategy': 'mean_reversion', 'time_stop': 106, 'use_sma': False, 'use_atr': True, 'use_adx': False, 'use_ema': False, 'use_spike': False, 'rsi_required': True, 'edge_k': 0.6115946340830927, 'edge_cap': 0.4069331904312293, 'bull_strategy': 'breakout', 'bull_bb_std_mult': 1.0472756161466656, 'bull_rsi_os': 15, 'bull_rsi_ob': 95, 'bull_adx_thresh': 16.87567393178665, 'bull_atr_min_pct': 0.022735945796872364, 'bull_atr_max_pct': 0.07002833079504617, 'bull_tp_mult': 1.3499423307730705, 'bull_tsl_mult': 0.16183077441482135, 'bull_time_stop': 272, 'bull_use_sma': False, 'bull_use_ema': False, 'bull_use_atr': True, 'bull_use_adx': True, 'bull_use_spike': False, 'bull_rsi_required': True, 'bear_strategy': 'breakout', 'bear_bb_std_mult': 1.2609269656456636, 'bear_rsi_os': 31, 'bear_rsi_ob': 60, 'bear_adx_thresh': 6.615759092776941, 'bear_atr_min_pct': 0.005761628988120407, 'bear_atr_max_pct': 0.11113853418409511, 'bear_tp_mult': 1.3484195054523047, 'bear_tsl_mult': 0.24231799041196778, 'bear_time_stop': 210, 'bear_use_sma': False, 'bear_use_ema': True, 'bear_use_atr': True, 'bear_use_adx': False, 'bear_use_spike': True, 'bear_rsi_required': False, 'sideways_strategy': 'mean_reversion', 'sideways_bb_std_mult': 0.6545248213859676, 'sideways_rsi_os': 37, 'sideways_rsi_ob': 50, 'sideways_adx_thresh': 28.098168629815827, 'sideways_atr_min_pct': 0.016214232252832653, 'sideways_atr_max_pct': 0.06529692282646814, 'sideways_tp_mult': 1.790487240665086, 'sideways_tsl_mult': 0.7832129632635093, 'sideways_time_stop': 273, 'sideways_use_sma': False, 'sideways_use_ema': False, 'sideways_use_atr': False, 'sideways_use_adx': True, 'sideways_use_spike': False, 'sideways_rsi_required': True}.
[I 2025-08-29 19:57:07,528] Trial 178 finished with values: [-1000000000.0, 1000000000.0] and parameters: {'p_sma': 33, 'p_std': 52, 'p_atr': 22, 'p_adx': 18, 'rsi_period': 44, 'ema1': 12, 'ema2': 29, 'slip_atr_k': 0.20746827141006957, 'slip_spread_k': 0.29010646622247566, 'spread_hl_frac': 0.03296031864374471, 'bb_std_mult': 1.953168449227209, 'rsi_os': 47, 'rsi_ob': 68, 'vol_spike': 0.14761245520908442, 'adx_thresh': 34.66994787551516, 'atr_min_pct': 0.013072054103937313, 'atr_max_pct': 0.09029172314193666, 'tp_mult': 2.4069037120581727, 'tsl_mult': 0.6153745389481452, 'strategy': 'mean_reversion', 'time_stop': 28, 'use_sma': True, 'use_atr': True, 'use_adx': False, 'use_ema': False, 'use_spike': False, 'rsi_required': False, 'edge_k': 0.363045888065212, 'edge_cap': 0.2317742032772077, 'bull_strategy': 'breakout', 'bull_bb_std_mult': 1.8757925990943, 'bull_rsi_os': 15, 'bull_rsi_ob': 95, 'bull_adx_thresh': 16.945188543281375, 'bull_atr_min_pct': 0.02069284821339246, 'bull_atr_max_pct': 0.07887595081722397, 'bull_tp_mult': 1.3780290628891794, 'bull_tsl_mult': 0.17454080004258773, 'bull_time_stop': 172, 'bull_use_sma': False, 'bull_use_ema': False, 'bull_use_atr': True, 'bull_use_adx': True, 'bull_use_spike': False, 'bull_rsi_required': True, 'bear_strategy': 'breakout', 'bear_bb_std_mult': 3.265370035503231, 'bear_rsi_os': 30, 'bear_rsi_ob': 67, 'bear_adx_thresh': 21.446777651068302, 'bear_atr_min_pct': 0.013365083562987308, 'bear_atr_max_pct': 0.07832828937848081, 'bear_tp_mult': 2.1252499187449034, 'bear_tsl_mult': 0.8462794454919174, 'bear_time_stop': 66, 'bear_use_sma': False, 'bear_use_ema': True, 'bear_use_atr': True, 'bear_use_adx': False, 'bear_use_spike': True, 'bear_rsi_required': False, 'sideways_strategy': 'mean_reversion', 'sideways_bb_std_mult': 1.8374902821832924, 'sideways_rsi_os': 47, 'sideways_rsi_ob': 46, 'sideways_adx_thresh': 19.097624439310028, 'sideways_atr_min_pct': 0.013719294821935152, 'sideways_atr_max_pct': 0.06594749595494065, 'sideways_tp_mult': 2.1278091358359967, 'sideways_tsl_mult': 0.2778306799882095, 'sideways_time_stop': 256, 'sideways_use_sma': False, 'sideways_use_ema': False, 'sideways_use_atr': False, 'sideways_use_adx': True, 'sideways_use_spike': False, 'sideways_rsi_required': True}.
[I 2025-08-29 19:57:36,735] Trial 180 finished with values: [-1000000000.0, 1000000000.0] and parameters: {'p_sma': 33, 'p_std': 18, 'p_atr': 17, 'p_adx': 18, 'rsi_period': 44, 'ema1': 12, 'ema2': 60, 'slip_atr_k': 0.16516589318681632, 'slip_spread_k': 0.2260370543317372, 'spread_hl_frac': 2.8916762372591196e-05, 'bb_std_mult': 1.117570976269265, 'rsi_os': 46, 'rsi_ob': 61, 'vol_spike': 0.16224236629398459, 'adx_thresh': 34.888943416904766, 'atr_min_pct': 0.021726973864591, 'atr_max_pct': 0.07906870137703892, 'tp_mult': 2.3372776301913922, 'tsl_mult': 0.6190487200740996, 'strategy': 'mean_reversion', 'time_stop': 115, 'use_sma': False, 'use_atr': True, 'use_adx': False, 'use_ema': True, 'use_spike': False, 'rsi_required': False, 'edge_k': 1.248775906134882, 'edge_cap': 0.13534735988826574, 'bull_strategy': 'breakout', 'bull_bb_std_mult': 1.3031657532861844, 'bull_rsi_os': 44, 'bull_rsi_ob': 68, 'bull_adx_thresh': 17.85422604223384, 'bull_atr_min_pct': 0.02095693955352562, 'bull_atr_max_pct': 0.09468436959334631, 'bull_tp_mult': 1.3890417244880255, 'bull_tsl_mult': 0.19999492961900173, 'bull_time_stop': 286, 'bull_use_sma': False, 'bull_use_ema': False, 'bull_use_atr': True, 'bull_use_adx': False, 'bull_use_spike': False, 'bull_rsi_required': True, 'bear_strategy': 'breakout', 'bear_bb_std_mult': 1.4548787745808438, 'bear_rsi_os': 54, 'bear_rsi_ob': 67, 'bear_adx_thresh': 12.96673636663117, 'bear_atr_min_pct': 0.008774967844444717, 'bear_atr_max_pct': 0.08148968021543596, 'bear_tp_mult': 1.995347166619796, 'bear_tsl_mult': 0.6687628312653762, 'bear_time_stop': 23, 'bear_use_sma': False, 'bear_use_ema': True, 'bear_use_atr': True, 'bear_use_adx': True, 'bear_use_spike': True, 'bear_rsi_required': True, 'sideways_strategy': 'mean_reversion', 'sideways_bb_std_mult': 1.92580836515709, 'sideways_rsi_os': 7, 'sideways_rsi_ob': 51, 'sideways_adx_thresh': 11.974563859894193, 'sideways_atr_min_pct': 0.013811454655222016, 'sideways_atr_max_pct': 0.06443221638934454, 'sideways_tp_mult': 1.774975922113633, 'sideways_tsl_mult': 0.9980108197688374, 'sideways_time_stop': 257, 'sideways_use_sma': False, 'sideways_use_ema': False, 'sideways_use_atr': False, 'sideways_use_adx': True, 'sideways_use_spike': False, 'sideways_rsi_required': True}.
