[I 2025-08-29 20:16:41,586] Trial 333 finished with values: [-0.0007012944996047654, 0.0014616854709350764] and parameters: {'p_sma': 21, 'p_std': 57, 'p_atr': 25, 'p_adx': 14, 'rsi_period': 37, 'ema1': 18, 'ema2': 49, 'slip_atr_k': 0.01144294459297574, 'slip_spread_k': 0.19989634578888155, 'spread_hl_frac': 0.04798424804913073, 'bb_std_mult': 1.3929273498617283, 'rsi_os': 8, 'rsi_ob': 80, 'vol_spike': 0.19143768418444163, 'adx_thresh': 8.841274930521962, 'atr_min_pct': 0.020928409441241757, 'atr_max_pct': 0.035459768209320314, 'tp_mult': 1.559866179065832, 'tsl_mult': 0.8541911880223267, 'strategy': 'mean_reversion', 'time_stop': 178, 'use_sma': True, 'use_atr': False, 'use_adx': False, 'use_ema': True, 'use_spike': False, 'rsi_required': False, 'edge_k': 1.100746383433504, 'edge_cap': 0.5292387199328631, 'bull_strategy': 'mean_reversion', 'bull_bb_std_mult': 2.6774231755300053, 'bull_rsi_os': 37, 'bull_rsi_ob': 73, 'bull_adx_thresh': 11.188346851884585, 'bull_atr_min_pct': 0.015718061108656315, 'bull_atr_max_pct': 0.04824772696364835, 'bull_tp_mult': 2.6739217456911657, 'bull_tsl_mult': 0.9586380626290087, 'bull_time_stop': 51, 'bull_use_sma': True, 'bull_use_ema': False, 'bull_use_atr': True, 'bull_use_adx': False, 'bull_use_spike': True, 'bull_rsi_required': False, 'bear_strategy': 'breakout', 'bear_bb_std_mult': 2.730215419691224, 'bear_rsi_os': 26, 'bear_rsi_ob': 64, 'bear_adx_thresh': 21.84620474327784, 'bear_atr_min_pct': 0.0075168138828856645, 'bear_atr_max_pct': 0.0319456161532579, 'bear_tp_mult': 2.664024759418557, 'bear_tsl_mult': 0.4334474408178155, 'bear_time_stop': 31, 'bear_use_sma': False, 'bear_use_ema': True, 'bear_use_atr': False, 'bear_use_adx': True, 'bear_use_spike': True, 'bear_rsi_required': False, 'sideways_strategy': 'breakout', 'sideways_bb_std_mult': 2.2800210608232923, 'sideways_rsi_os': 46, 'sideways_rsi_ob': 80, 'sideways_adx_thresh': 33.163865700188694, 'sideways_atr_min_pct': 0.00391394886499885, 'sideways_atr_max_pct': 0.020047477450066603, 'sideways_tp_mult': 1.0728592306445777, 'sideways_tsl_mult': 0.6953588770805186, 'sideways_time_stop': 216, 'sideways_use_sma': False, 'sideways_use_ema': True, 'sideways_use_atr': False, 'sideways_use_adx': False, 'sideways_use_spike': False, 'sideways_rsi_required': False}.
[I 2025-08-29 20:16:41,992] Trial 334 finished with values: [-0.0007027478525606368, 0.0014821863215019404] and parameters: {'p_sma': 20, 'p_std': 57, 'p_atr': 30, 'p_adx': 14, 'rsi_period': 38, 'ema1': 18, 'ema2': 49, 'slip_atr_k': 0.010781176282209193, 'slip_spread_k': 0.2002087161420425, 'spread_hl_frac': 0.04834195643785176, 'bb_std_mult': 1.3909862427567794, 'rsi_os': 8, 'rsi_ob': 80, 'vol_spike': 0.19215353537307575, 'adx_thresh': 16.29832744390374, 'atr_min_pct': 0.020719840039837498, 'atr_max_pct': 0.03241420780897009, 'tp_mult': 1.6805401777885203, 'tsl_mult': 0.8466113061524642, 'strategy': 'mean_reversion', 'time_stop': 176, 'use_sma': True, 'use_atr': False, 'use_adx': False, 'use_ema': True, 'use_spike': False, 'rsi_required': False, 'edge_k': 1.0896827009676384, 'edge_cap': 0.5381395855184289, 'bull_strategy': 'mean_reversion', 'bull_bb_std_mult': 3.212050395480157, 'bull_rsi_os': 37, 'bull_rsi_ob': 73, 'bull_adx_thresh': 13.594355669422084, 'bull_atr_min_pct': 0.01588219006181786, 'bull_atr_max_pct': 0.04293219336105907, 'bull_tp_mult': 2.638641506319645, 'bull_tsl_mult': 0.8909860777769274, 'bull_time_stop': 65, 'bull_use_sma': True, 'bull_use_ema': False, 'bull_use_atr': True, 'bull_use_adx': False, 'bull_use_spike': True, 'bull_rsi_required': False, 'bear_strategy': 'breakout', 'bear_bb_std_mult': 2.7282557028286947, 'bear_rsi_os': 26, 'bear_rsi_ob': 64, 'bear_adx_thresh': 21.782190795950626, 'bear_atr_min_pct': 0.007482239981306441, 'bear_atr_max_pct': 0.031186372421166786, 'bear_tp_mult': 2.680061732660254, 'bear_tsl_mult': 0.43468529957491003, 'bear_time_stop': 31, 'bear_use_sma': False, 'bear_use_ema': True, 'bear_use_atr': False, 'bear_use_adx': True, 'bear_use_spike': True, 'bear_rsi_required': False, 'sideways_strategy': 'breakout', 'sideways_bb_std_mult': 2.3023139215883814, 'sideways_rsi_os': 50, 'sideways_rsi_ob': 80, 'sideways_adx_thresh': 33.15517836892812, 'sideways_atr_min_pct': 0.0038272682447890467, 'sideways_atr_max_pct': 0.01953272056843408, 'sideways_tp_mult': 1.0718289253717388, 'sideways_tsl_mult': 0.6917160892095717, 'sideways_time_stop': 190, 'sideways_use_sma': False, 'sideways_use_ema': True, 'sideways_use_atr': False, 'sideways_use_adx': False, 'sideways_use_spike': False, 'sideways_rsi_required': False}.
[I 2025-08-29 20:16:41,993] Trial 335 finished with values: [-0.0003511626600715134, 0.001260534219738404] and parameters: {'p_sma': 20, 'p_std': 57, 'p_atr': 25, 'p_adx': 14, 'rsi_period': 37, 'ema1': 19, 'ema2': 49, 'slip_atr_k': 0.0030101888665944824, 'slip_spread_k': 0.19453206945450813, 'spread_hl_frac': 0.04833972037236779, 'bb_std_mult': 1.5574425583289497, 'rsi_os': 7, 'rsi_ob': 80, 'vol_spike': 0.190308312500819, 'adx_thresh': 15.389795959899043, 'atr_min_pct': 0.02083294451728549, 'atr_max_pct': 0.029576164111081618, 'tp_mult': 1.6720023256433114, 'tsl_mult': 0.8575423169133725, 'strategy': 'mean_reversion', 'time_stop': 184, 'use_sma': True, 'use_atr': False, 'use_adx': False, 'use_ema': True, 'use_spike': False, 'rsi_required': False, 'edge_k': 1.0965763223082745, 'edge_cap': 0.5306960151806088, 'bull_strategy': 'mean_reversion', 'bull_bb_std_mult': 3.228940400915333, 'bull_rsi_os': 37, 'bull_rsi_ob': 73, 'bull_adx_thresh': 13.775051300564458, 'bull_atr_min_pct': 0.015742274102369027, 'bull_atr_max_pct': 0.04099683876627505, 'bull_tp_mult': 2.591369281760553, 'bull_tsl_mult': 0.9102159631296997, 'bull_time_stop': 62, 'bull_use_sma': True, 'bull_use_ema': False, 'bull_use_atr': True, 'bull_use_adx': False, 'bull_use_spike': True, 'bull_rsi_required': False, 'bear_strategy': 'breakout', 'bear_bb_std_mult': 2.74968402370925, 'bear_rsi_os': 27, 'bear_rsi_ob': 64, 'bear_adx_thresh': 21.884688235967005, 'bear_atr_min_pct': 0.007469434555676508, 'bear_atr_max_pct': 0.026303038714604737, 'bear_tp_mult': 2.674619901841524, 'bear_tsl_mult': 0.4293372025395097, 'bear_time_stop': 30, 'bear_use_sma': False, 'bear_use_ema': True, 'bear_use_atr': False, 'bear_use_adx': True, 'bear_use_spike': True, 'bear_rsi_required': False, 'sideways_strategy': 'breakout', 'sideways_bb_std_mult': 2.300048142835895, 'sideways_rsi_os': 47, 'sideways_rsi_ob': 80, 'sideways_adx_thresh': 33.236210898394056, 'sideways_atr_min_pct': 0.003920820482009685, 'sideways_atr_max_pct': 0.026326472507380426, 'sideways_tp_mult': 1.0648577273823274, 'sideways_tsl_mult': 0.7004198790884413, 'sideways_time_stop': 215, 'sideways_use_sma': False, 'sideways_use_ema': True, 'sideways_use_atr': False, 'sideways_use_adx': False, 'sideways_use_spike': False, 'sideways_rsi_required': False}.
[I 2025-08-29 20:16:42,199] Trial 336 finished with values: [-0.016254450604341164, 0.016238319845209324] and parameters: {'p_sma': 21, 'p_std': 56, 'p_atr': 17, 'p_adx': 12, 'rsi_period': 37, 'ema1': 18, 'ema2': 47, 'slip_atr_k': 0.015819844374098654, 'slip_spread_k': 0.22287153472518428, 'spread_hl_frac': 0.048258980332416025, 'bb_std_mult': 1.6111238185363979, 'rsi_os': 9, 'rsi_ob': 80, 'vol_spike': 0.18779390717200117, 'adx_thresh': 16.770600132897883, 'atr_min_pct': 0.02091412730541613, 'atr_max_pct': 0.029691544110727375, 'tp_mult': 1.50892588486119, 'tsl_mult': 0.8503122611872687, 'strategy': 'mean_reversion', 'time_stop': 192, 'use_sma': True, 'use_atr': False, 'use_adx': False, 'use_ema': True, 'use_spike': False, 'rsi_required': False, 'edge_k': 1.1069118662523616, 'edge_cap': 0.5199991264601443, 'bull_strategy': 'mean_reversion', 'bull_bb_std_mult': 3.209889899800804, 'bull_rsi_os': 36, 'bull_rsi_ob': 73, 'bull_adx_thresh': 13.584143057431584, 'bull_atr_min_pct': 0.015423204848803643, 'bull_atr_max_pct': 0.04741462179275721, 'bull_tp_mult': 2.627876089288502, 'bull_tsl_mult': 0.8983037558708195, 'bull_time_stop': 64, 'bull_use_sma': True, 'bull_use_ema': False, 'bull_use_atr': True, 'bull_use_adx': False, 'bull_use_spike': True, 'bull_rsi_required': False, 'bear_strategy': 'breakout', 'bear_bb_std_mult': 2.738741697992472, 'bear_rsi_os': 25, 'bear_rsi_ob': 65, 'bear_adx_thresh': 17.0622998626216, 'bear_atr_min_pct': 0.006990526260608484, 'bear_atr_max_pct': 0.03778202152362446, 'bear_tp_mult': 2.7686439936366343, 'bear_tsl_mult': 0.4513650444751624, 'bear_time_stop': 31, 'bear_use_sma': False, 'bear_use_ema': True, 'bear_use_atr': False, 'bear_use_adx': True, 'bear_use_spike': True, 'bear_rsi_required': False, 'sideways_strategy': 'breakout', 'sideways_bb_std_mult': 2.2005505853959457, 'sideways_rsi_os': 47, 'sideways_rsi_ob': 81, 'sideways_adx_thresh': 33.26967185925332, 'sideways_atr_min_pct': 0.0024906692825408076, 'sideways_atr_max_pct': 0.011710489144989233, 'sideways_tp_mult': 1.1356753880494943, 'sideways_tsl_mult': 0.6981116290735503, 'sideways_time_stop': 210, 'sideways_use_sma': False, 'sideways_use_ema': True, 'sideways_use_atr': False, 'sideways_use_adx': False, 'sideways_use_spike': False, 'sideways_rsi_required': False}.
[I 2025-08-29 20:17:12,652] Trial 338 finished with values: [-0.0011512537912061749, 0.001955535171544379] and parameters: {'p_sma': 21, 'p_std': 57, 'p_atr': 25, 'p_adx': 13, 'rsi_period': 37, 'ema1': 17, 'ema2': 47, 'slip_atr_k': 0.00031517764322024425, 'slip_spread_k': 0.21968424350945454, 'spread_hl_frac': 0.0484253037257362, 'bb_std_mult': 1.2813402658917634, 'rsi_os': 5, 'rsi_ob': 79, 'vol_spike': 0.18855895128533445, 'adx_thresh': 11.314919103661577, 'atr_min_pct': 0.0212738212965717, 'atr_max_pct': 0.02931738281467254, 'tp_mult': 1.5159951671979839, 'tsl_mult': 0.8427025242427438, 'strategy': 'mean_reversion', 'time_stop': 191, 'use_sma': True, 'use_atr': False, 'use_adx': False, 'use_ema': True, 'use_spike': False, 'rsi_required': False, 'edge_k': 1.0987935904968535, 'edge_cap': 0.5170360991859125, 'bull_strategy': 'mean_reversion', 'bull_bb_std_mult': 3.227898032043608, 'bull_rsi_os': 33, 'bull_rsi_ob': 73, 'bull_adx_thresh': 13.522136851645895, 'bull_atr_min_pct': 0.015326278337006283, 'bull_atr_max_pct': 0.048809375071383304, 'bull_tp_mult': 2.638883547927453, 'bull_tsl_mult': 0.8997571988225412, 'bull_time_stop': 63, 'bull_use_sma': True, 'bull_use_ema': False, 'bull_use_atr': True, 'bull_use_adx': False, 'bull_use_spike': True, 'bull_rsi_required': False, 'bear_strategy': 'breakout', 'bear_bb_std_mult': 2.7290068992914254, 'bear_rsi_os': 24, 'bear_rsi_ob': 64, 'bear_adx_thresh': 22.43329064578717, 'bear_atr_min_pct': 0.007151117571737137, 'bear_atr_max_pct': 0.04390203466846107, 'bear_tp_mult': 2.7736200824339314, 'bear_tsl_mult': 0.42459876142298086, 'bear_time_stop': 28, 'bear_use_sma': False, 'bear_use_ema': True, 'bear_use_atr': False, 'bear_use_adx': True, 'bear_use_spike': True, 'bear_rsi_required': False, 'sideways_strategy': 'breakout', 'sideways_bb_std_mult': 2.3046230037543025, 'sideways_rsi_os': 47, 'sideways_rsi_ob': 81, 'sideways_adx_thresh': 33.201634693593185, 'sideways_atr_min_pct': 0.0037287163625743655, 'sideways_atr_max_pct': 0.01129585740890058, 'sideways_tp_mult': 1.1405327748921372, 'sideways_tsl_mult': 0.6977393799043379, 'sideways_time_stop': 208, 'sideways_use_sma': False, 'sideways_use_ema': True, 'sideways_use_atr': False, 'sideways_use_adx': False, 'sideways_use_spike': False, 'sideways_rsi_required': False}.
[I 2025-08-29 20:17:12,853] Trial 337 finished with values: [-0.016164191435238506, 0.016137944866868127] and parameters: {'p_sma': 21, 'p_std': 57, 'p_atr': 17, 'p_adx': 13, 'rsi_period': 37, 'ema1': 17, 'ema2': 47, 'slip_atr_k': 0.005390813478024295, 'slip_spread_k': 0.22171325423755467, 'spread_hl_frac': 0.049684664808925465, 'bb_std_mult': 2.08739066780515, 'rsi_os': 8, 'rsi_ob': 80, 'vol_spike': 0.189052767391391, 'adx_thresh': 11.983303148280344, 'atr_min_pct': 0.02101625527864114, 'atr_max_pct': 0.031698369283775056, 'tp_mult': 1.5939571336826754, 'tsl_mult': 0.8519392983095941, 'strategy': 'mean_reversion', 'time_stop': 187, 'use_sma': True, 'use_atr': False, 'use_adx': False, 'use_ema': True, 'use_spike': False, 'rsi_required': False, 'edge_k': 1.0985366880115262, 'edge_cap': 0.5235242639898792, 'bull_strategy': 'mean_reversion', 'bull_bb_std_mult': 3.221480024639867, 'bull_rsi_os': 31, 'bull_rsi_ob': 73, 'bull_adx_thresh': 13.802382814925592, 'bull_atr_min_pct': 0.015420657386212977, 'bull_atr_max_pct': 0.0345994212286166, 'bull_tp_mult': 2.681680413089387, 'bull_tsl_mult': 0.8829038981647991, 'bull_time_stop': 65, 'bull_use_sma': True, 'bull_use_ema': False, 'bull_use_atr': True, 'bull_use_adx': False, 'bull_use_spike': True, 'bull_rsi_required': False, 'bear_strategy': 'breakout', 'bear_bb_std_mult': 2.7668135130228806, 'bear_rsi_os': 25, 'bear_rsi_ob': 64, 'bear_adx_thresh': 23.064958158136236, 'bear_atr_min_pct': 0.007175078687350008, 'bear_atr_max_pct': 0.03724169036657, 'bear_tp_mult': 2.7419016395548264, 'bear_tsl_mult': 0.43514748721778923, 'bear_time_stop': 31, 'bear_use_sma': False, 'bear_use_ema': True, 'bear_use_atr': False, 'bear_use_adx': True, 'bear_use_spike': True, 'bear_rsi_required': False, 'sideways_strategy': 'breakout', 'sideways_bb_std_mult': 2.2075748789937286, 'sideways_rsi_os': 47, 'sideways_rsi_ob': 80, 'sideways_adx_thresh': 33.28340228594727, 'sideways_atr_min_pct': 0.0023900919429863717, 'sideways_atr_max_pct': 0.017721479930067834, 'sideways_tp_mult': 1.1384774462703373, 'sideways_tsl_mult': 0.6945965464084602, 'sideways_time_stop': 207, 'sideways_use_sma': False, 'sideways_use_ema': True, 'sideways_use_atr': False, 'sideways_use_adx': False, 'sideways_use_spike': False, 'sideways_rsi_required': False}.
[I 2025-08-29 20:17:13,337] Trial 339 finished with values: [-0.0091199063764128, 0.009089939694611568] and parameters: {'p_sma': 21, 'p_std': 59, 'p_atr': 25, 'p_adx': 12, 'rsi_period': 37, 'ema1': 18, 'ema2': 47, 'slip_atr_k': 0.0028483228316260045, 'slip_spread_k': 0.20763009028369858, 'spread_hl_frac': 0.04973772534082141, 'bb_std_mult': 2.1513440486867372, 'rsi_os': 5, 'rsi_ob': 79, 'vol_spike': 0.18740247982227162, 'adx_thresh': 11.574406265089808, 'atr_min_pct': 0.021294094361362127, 'atr_max_pct': 0.027175430578162664, 'tp_mult': 1.4934770062691505, 'tsl_mult': 0.847246847770258, 'strategy': 'mean_reversion', 'time_stop': 194, 'use_sma': True, 'use_atr': False, 'use_adx': False, 'use_ema': True, 'use_spike': False, 'rsi_required': False, 'edge_k': 1.0987394872764218, 'edge_cap': 0.5173436174249345, 'bull_strategy': 'mean_reversion', 'bull_bb_std_mult': 3.221204024336037, 'bull_rsi_os': 28, 'bull_rsi_ob': 73, 'bull_adx_thresh': 13.316583509154203, 'bull_atr_min_pct': 0.01833675847393598, 'bull_atr_max_pct': 0.04858053607588193, 'bull_tp_mult': 2.6485371125375234, 'bull_tsl_mult': 0.8897658211699143, 'bull_time_stop': 64, 'bull_use_sma': True, 'bull_use_ema': False, 'bull_use_atr': True, 'bull_use_adx': False, 'bull_use_spike': True, 'bull_rsi_required': False, 'bear_strategy': 'breakout', 'bear_bb_std_mult': 2.733492209165811, 'bear_rsi_os': 23, 'bear_rsi_ob': 64, 'bear_adx_thresh': 22.836261192639604, 'bear_atr_min_pct': 0.0072140178888367296, 'bear_atr_max_pct': 0.0443242606407648, 'bear_tp_mult': 2.7622034647429596, 'bear_tsl_mult': 0.4314113017584726, 'bear_time_stop': 29, 'bear_use_sma': False, 'bear_use_ema': True, 'bear_use_atr': False, 'bear_use_adx': True, 'bear_use_spike': True, 'bear_rsi_required': False, 'sideways_strategy': 'breakout', 'sideways_bb_std_mult': 2.2012294064705826, 'sideways_rsi_os': 47, 'sideways_rsi_ob': 81, 'sideways_adx_thresh': 33.31956110172995, 'sideways_atr_min_pct': 0.0026260455766302588, 'sideways_atr_max_pct': 0.012137043555231812, 'sideways_tp_mult': 1.0696044441943715, 'sideways_tsl_mult': 0.6493696642159051, 'sideways_time_stop': 209, 'sideways_use_sma': False, 'sideways_use_ema': True, 'sideways_use_atr': False, 'sideways_use_adx': False, 'sideways_use_spike': False, 'sideways_rsi_required': False}.
[I 2025-08-29 20:17:13,519] Trial 340 finished with values: [-0.0005025478016476015, 0.0014117412735621044] and parameters: {'p_sma': 20, 'p_std': 59, 'p_atr': 25, 'p_adx': 12, 'rsi_period': 37, 'ema1': 17, 'ema2': 47, 'slip_atr_k': 0.0004659552158571361, 'slip_spread_k': 0.2016523222152681, 'spread_hl_frac': 0.049780816986241164, 'bb_std_mult': 1.69889266418258, 'rsi_os': 8, 'rsi_ob': 80, 'vol_spike': 0.185941409428246, 'adx_thresh': 12.607934359489708, 'atr_min_pct': 0.019880371526576086, 'atr_max_pct': 0.031069417613886048, 'tp_mult': 1.4826872054145357, 'tsl_mult': 0.8497785398252349, 'strategy': 'mean_reversion', 'time_stop': 191, 'use_sma': True, 'use_atr': False, 'use_adx': False, 'use_ema': True, 'use_spike': False, 'rsi_required': False, 'edge_k': 1.1159361413544622, 'edge_cap': 0.5084420011964753, 'bull_strategy': 'mean_reversion', 'bull_bb_std_mult': 3.1174064467975846, 'bull_rsi_os': 39, 'bull_rsi_ob': 75, 'bull_adx_thresh': 12.582154446453483, 'bull_atr_min_pct': 0.015236597268164979, 'bull_atr_max_pct': 0.09312667443203627, 'bull_tp_mult': 2.6505607063230987, 'bull_tsl_mult': 0.8839965276691255, 'bull_time_stop': 65, 'bull_use_sma': True, 'bull_use_ema': False, 'bull_use_atr': True, 'bull_use_adx': False, 'bull_use_spike': True, 'bull_rsi_required': False, 'bear_strategy': 'breakout', 'bear_bb_std_mult': 2.7768821976403926, 'bear_rsi_os': 26, 'bear_rsi_ob': 64, 'bear_adx_thresh': 22.56752405719075, 'bear_atr_min_pct': 0.007223486595547345, 'bear_atr_max_pct': 0.044445114753741626, 'bear_tp_mult': 2.717803084399013, 'bear_tsl_mult': 0.4306906597785236, 'bear_time_stop': 30, 'bear_use_sma': False, 'bear_use_ema': True, 'bear_use_atr': False, 'bear_use_adx': True, 'bear_use_spike': True, 'bear_rsi_required': False, 'sideways_strategy': 'breakout', 'sideways_bb_std_mult': 2.3073156904762997, 'sideways_rsi_os': 46, 'sideways_rsi_ob': 80, 'sideways_adx_thresh': 33.17142146307592, 'sideways_atr_min_pct': 0.0037844088635073355, 'sideways_atr_max_pct': 0.016873185050646992, 'sideways_tp_mult': 1.0732344742702271, 'sideways_tsl_mult': 0.6476391379393478, 'sideways_time_stop': 217, 'sideways_use_sma': False, 'sideways_use_ema': True, 'sideways_use_atr': False, 'sideways_use_adx': False, 'sideways_use_spike': False, 'sideways_rsi_required': False}.
[I 2025-08-29 20:17:43,320] Trial 341 finished with values: [-1000000000.0, 1000000000.0] and parameters: {'p_sma': 19, 'p_std': 59, 'p_atr': 25, 'p_adx': 12, 'rsi_period': 36, 'ema1': 17, 'ema2': 47, 'slip_atr_k': 0.003728094288074418, 'slip_spread_k': 0.22064368987871674, 'spread_hl_frac': 0.049359801881948814, 'bb_std_mult': 1.2952336995901592, 'rsi_os': 8, 'rsi_ob': 80, 'vol_spike': 0.2134711114729827, 'adx_thresh': 12.619791166738997, 'atr_min_pct': 0.021484206491808575, 'atr_max_pct': 0.03270511027732462, 'tp_mult': 1.5343554178901684, 'tsl_mult': 0.8870564618935496, 'strategy': 'mean_reversion', 'time_stop': 190, 'use_sma': True, 'use_atr': False, 'use_adx': False, 'use_ema': True, 'use_spike': False, 'rsi_required': False, 'edge_k': 1.1020965365665105, 'edge_cap': 0.5158952236401299, 'bull_strategy': 'mean_reversion', 'bull_bb_std_mult': 3.0943371434854505, 'bull_rsi_os': 31, 'bull_rsi_ob': 75, 'bull_adx_thresh': 11.088347324418294, 'bull_atr_min_pct': 0.018288122438671943, 'bull_atr_max_pct': 0.12676752607978486, 'bull_tp_mult': 2.651319709287976, 'bull_tsl_mult': 0.8341985709215716, 'bull_time_stop': 64, 'bull_use_sma': True, 'bull_use_ema': False, 'bull_use_atr': True, 'bull_use_adx': False, 'bull_use_spike': True, 'bull_rsi_required': False, 'bear_strategy': 'breakout', 'bear_bb_std_mult': 2.79110571168944, 'bear_rsi_os': 24, 'bear_rsi_ob': 64, 'bear_adx_thresh': 23.815803258646646, 'bear_atr_min_pct': 0.007071121349503641, 'bear_atr_max_pct': 0.04346273180294982, 'bear_tp_mult': 2.678845772401282, 'bear_tsl_mult': 0.43815265813078796, 'bear_time_stop': 31, 'bear_use_sma': False, 'bear_use_ema': True, 'bear_use_atr': False, 'bear_use_adx': True, 'bear_use_spike': True, 'bear_rsi_required': False, 'sideways_strategy': 'breakout', 'sideways_bb_std_mult': 2.3099783671107406, 'sideways_rsi_os': 46, 'sideways_rsi_ob': 80, 'sideways_adx_thresh': 33.359523870263146, 'sideways_atr_min_pct': 0.021604924870907594, 'sideways_atr_max_pct': 0.017900409040641656, 'sideways_tp_mult': 1.0645912896416478, 'sideways_tsl_mult': 0.6407690608093838, 'sideways_time_stop': 204, 'sideways_use_sma': False, 'sideways_use_ema': True, 'sideways_use_atr': False, 'sideways_use_adx': False, 'sideways_use_spike': False, 'sideways_rsi_required': False}.
