[I 2025-08-29 21:16:15,964] Trial 856 finished with values: [-1000000000.0, 1000000000.0] and parameters: {'p_sma': 50, 'p_std': 44, 'p_atr': 16, 'p_adx': 8, 'rsi_period': 81, 'ema1': 24, 'ema2': 24, 'slip_atr_k': 0.21676852776496036, 'slip_spread_k': 0.12018481066541918, 'spread_hl_frac': 0.02300897771288565, 'bb_std_mult': 0.7010262876905795, 'rsi_os': 6, 'rsi_ob': 57, 'vol_spike': 0.28818130931326996, 'adx_thresh': 8.521595514488173, 'atr_min_pct': 0.010843483697557795, 'atr_max_pct': 0.0394183920861102, 'tp_mult': 2.3508766323661563, 'tsl_mult': 0.8002254631566652, 'strategy': 'mean_reversion', 'time_stop': 213, 'use_sma': False, 'use_atr': False, 'use_adx': True, 'use_ema': False, 'use_spike': True, 'rsi_required': True, 'edge_k': 0.9521999071095497, 'edge_cap': 0.29522154147423335, 'bull_strategy': 'breakout', 'bull_bb_std_mult': 2.688136439044044, 'bull_rsi_os': 21, 'bull_rsi_ob': 60, 'bull_adx_thresh': 32.847215194629854, 'bull_atr_min_pct': 0.01776264120606885, 'bull_atr_max_pct': 0.10325755230714567, 'bull_tp_mult': 2.469252961116939, 'bull_tsl_mult': 0.9855418153878807, 'bull_time_stop': 214, 'bull_use_sma': True, 'bull_use_ema': True, 'bull_use_atr': False, 'bull_use_adx': True, 'bull_use_spike': False, 'bull_rsi_required': True, 'bear_strategy': 'mean_reversion', 'bear_bb_std_mult': 2.508482412608214, 'bear_rsi_os': 41, 'bear_rsi_ob': 87, 'bear_adx_thresh': 9.14078177575297, 'bear_atr_min_pct': 0.006296074650213674, 'bear_atr_max_pct': 0.077987419487122, 'bear_tp_mult': 2.846738286728009, 'bear_tsl_mult': 0.09543842754576866, 'bear_time_stop': 216, 'bear_use_sma': True, 'bear_use_ema': False, 'bear_use_atr': True, 'bear_use_adx': False, 'bear_use_spike': False, 'bear_rsi_required': True, 'sideways_strategy': 'mean_reversion', 'sideways_bb_std_mult': 3.5282908171475627, 'sideways_rsi_os': 20, 'sideways_rsi_ob': 84, 'sideways_adx_thresh': 11.825798136406206, 'sideways_atr_min_pct': 0.011849338801287412, 'sideways_atr_max_pct': 0.04019923567368537, 'sideways_tp_mult': 2.376446705249331, 'sideways_tsl_mult': 0.6302314320729016, 'sideways_time_stop': 126, 'sideways_use_sma': True, 'sideways_use_ema': False, 'sideways_use_atr': True, 'sideways_use_adx': True, 'sideways_use_spike': True, 'sideways_rsi_required': True}.
[I 2025-08-29 21:16:16,133] Trial 854 finished with values: [-1000000000.0, 1000000000.0] and parameters: {'p_sma': 44, 'p_std': 36, 'p_atr': 16, 'p_adx': 8, 'rsi_period': 76, 'ema1': 24, 'ema2': 27, 'slip_atr_k': 0.09242666853346412, 'slip_spread_k': 0.028413571241861668, 'spread_hl_frac': 0.022922443493961026, 'bb_std_mult': 0.6796584863980139, 'rsi_os': 45, 'rsi_ob': 78, 'vol_spike': 0.2737879222634958, 'adx_thresh': 8.598831740057932, 'atr_min_pct': 0.010318212459549031, 'atr_max_pct': 0.03907158088779119, 'tp_mult': 2.338748446345722, 'tsl_mult': 0.7937264857736782, 'strategy': 'mean_reversion', 'time_stop': 212, 'use_sma': False, 'use_atr': False, 'use_adx': True, 'use_ema': False, 'use_spike': True, 'rsi_required': True, 'edge_k': 1.5782307466376615, 'edge_cap': 0.2992776523927459, 'bull_strategy': 'breakout', 'bull_bb_std_mult': 2.7549532481894583, 'bull_rsi_os': 23, 'bull_rsi_ob': 59, 'bull_adx_thresh': 25.317635755203128, 'bull_atr_min_pct': 0.01797363868675279, 'bull_atr_max_pct': 0.1036483141532103, 'bull_tp_mult': 2.400564490307316, 'bull_tsl_mult': 0.9853401184004429, 'bull_time_stop': 214, 'bull_use_sma': True, 'bull_use_ema': True, 'bull_use_atr': False, 'bull_use_adx': True, 'bull_use_spike': False, 'bull_rsi_required': True, 'bear_strategy': 'mean_reversion', 'bear_bb_std_mult': 2.5090695411485764, 'bear_rsi_os': 43, 'bear_rsi_ob': 87, 'bear_adx_thresh': 8.528654204705063, 'bear_atr_min_pct': 0.022948854278382187, 'bear_atr_max_pct': 0.07771682480243032, 'bear_tp_mult': 2.8488242479850845, 'bear_tsl_mult': 0.044192528366892525, 'bear_time_stop': 244, 'bear_use_sma': True, 'bear_use_ema': False, 'bear_use_atr': True, 'bear_use_adx': False, 'bear_use_spike': False, 'bear_rsi_required': True, 'sideways_strategy': 'mean_reversion', 'sideways_bb_std_mult': 3.523903367073151, 'sideways_rsi_os': 20, 'sideways_rsi_ob': 84, 'sideways_adx_thresh': 11.765881153676654, 'sideways_atr_min_pct': 0.011980576434753643, 'sideways_atr_max_pct': 0.04158882527675145, 'sideways_tp_mult': 2.374593230712179, 'sideways_tsl_mult': 0.6220621457986261, 'sideways_time_stop': 127, 'sideways_use_sma': False, 'sideways_use_ema': False, 'sideways_use_atr': True, 'sideways_use_adx': True, 'sideways_use_spike': True, 'sideways_rsi_required': True}.
[I 2025-08-29 21:16:45,906] Trial 857 finished with values: [-1000000000.0, 1000000000.0] and parameters: {'p_sma': 7, 'p_std': 36, 'p_atr': 14, 'p_adx': 8, 'rsi_period': 76, 'ema1': 9, 'ema2': 24, 'slip_atr_k': 0.0231796823349711, 'slip_spread_k': 0.1213038021531324, 'spread_hl_frac': 0.023043475006803912, 'bb_std_mult': 0.8023212105238929, 'rsi_os': 24, 'rsi_ob': 78, 'vol_spike': 0.294110583457108, 'adx_thresh': 6.217866989064213, 'atr_min_pct': 0.010774260027372713, 'atr_max_pct': 0.03940672457762947, 'tp_mult': 2.3519469410147518, 'tsl_mult': 0.8111396078804691, 'strategy': 'mean_reversion', 'time_stop': 213, 'use_sma': False, 'use_atr': False, 'use_adx': True, 'use_ema': False, 'use_spike': True, 'rsi_required': True, 'edge_k': 0.9539223427780515, 'edge_cap': 0.2943581568808368, 'bull_strategy': 'mean_reversion', 'bull_bb_std_mult': 2.6722389651788734, 'bull_rsi_os': 23, 'bull_rsi_ob': 70, 'bull_adx_thresh': 26.82538051531304, 'bull_atr_min_pct': 0.017931714230866133, 'bull_atr_max_pct': 0.1331181167579431, 'bull_tp_mult': 2.4676196669000783, 'bull_tsl_mult': 0.9832780832111234, 'bull_time_stop': 223, 'bull_use_sma': True, 'bull_use_ema': True, 'bull_use_atr': False, 'bull_use_adx': True, 'bull_use_spike': False, 'bull_rsi_required': True, 'bear_strategy': 'breakout', 'bear_bb_std_mult': 0.6218319699092674, 'bear_rsi_os': 43, 'bear_rsi_ob': 89, 'bear_adx_thresh': 9.206609372380104, 'bear_atr_min_pct': 0.008183790626634614, 'bear_atr_max_pct': 0.07768994127863457, 'bear_tp_mult': 2.8413706259249065, 'bear_tsl_mult': 0.08064699703915418, 'bear_time_stop': 230, 'bear_use_sma': False, 'bear_use_ema': False, 'bear_use_atr': True, 'bear_use_adx': False, 'bear_use_spike': False, 'bear_rsi_required': True, 'sideways_strategy': 'mean_reversion', 'sideways_bb_std_mult': 3.53071522403145, 'sideways_rsi_os': 21, 'sideways_rsi_ob': 84, 'sideways_adx_thresh': 11.89297596971101, 'sideways_atr_min_pct': 0.012677745591042318, 'sideways_atr_max_pct': 0.04013113920990697, 'sideways_tp_mult': 2.3759462449656636, 'sideways_tsl_mult': 0.628599483818134, 'sideways_time_stop': 157, 'sideways_use_sma': False, 'sideways_use_ema': False, 'sideways_use_atr': True, 'sideways_use_adx': True, 'sideways_use_spike': True, 'sideways_rsi_required': True}.
[I 2025-08-29 21:16:46,639] Trial 859 finished with values: [-1000000000.0, 1000000000.0] and parameters: {'p_sma': 15, 'p_std': 35, 'p_atr': 15, 'p_adx': 9, 'rsi_period': 33, 'ema1': 9, 'ema2': 25, 'slip_atr_k': 0.013832464700661781, 'slip_spread_k': 0.07741837384187983, 'spread_hl_frac': 0.021348578573871405, 'bb_std_mult': 0.8003475911686128, 'rsi_os': 34, 'rsi_ob': 78, 'vol_spike': 0.2945846582212781, 'adx_thresh': 7.345208367523008, 'atr_min_pct': 0.011531551587797534, 'atr_max_pct': 0.11644319849428211, 'tp_mult': 2.5084957193001434, 'tsl_mult': 0.7199037221061388, 'strategy': 'mean_reversion', 'time_stop': 218, 'use_sma': True, 'use_atr': False, 'use_adx': False, 'use_ema': False, 'use_spike': True, 'rsi_required': False, 'edge_k': 0.5452881640659026, 'edge_cap': 0.3437832736614688, 'bull_strategy': 'mean_reversion', 'bull_bb_std_mult': 2.7602475366780665, 'bull_rsi_os': 23, 'bull_rsi_ob': 62, 'bull_adx_thresh': 27.22927910214829, 'bull_atr_min_pct': 0.019597126045974463, 'bull_atr_max_pct': 0.015971752268531147, 'bull_tp_mult': 2.3935144020270047, 'bull_tsl_mult': 0.9382781184977019, 'bull_time_stop': 221, 'bull_use_sma': True, 'bull_use_ema': False, 'bull_use_atr': False, 'bull_use_adx': True, 'bull_use_spike': True, 'bull_rsi_required': False, 'bear_strategy': 'breakout', 'bear_bb_std_mult': 0.6933969439374361, 'bear_rsi_os': 39, 'bear_rsi_ob': 89, 'bear_adx_thresh': 15.886709520882992, 'bear_atr_min_pct': 0.008108755004404203, 'bear_atr_max_pct': 0.07344206676193278, 'bear_tp_mult': 2.953069816156474, 'bear_tsl_mult': 0.04580984527729257, 'bear_time_stop': 256, 'bear_use_sma': False, 'bear_use_ema': False, 'bear_use_atr': False, 'bear_use_adx': False, 'bear_use_spike': True, 'bear_rsi_required': False, 'sideways_strategy': 'breakout', 'sideways_bb_std_mult': 3.598233841438214, 'sideways_rsi_os': 22, 'sideways_rsi_ob': 90, 'sideways_adx_thresh': 10.381027606369315, 'sideways_atr_min_pct': 0.01267893920372421, 'sideways_atr_max_pct': 0.0470868797866751, 'sideways_tp_mult': 2.2262426733068876, 'sideways_tsl_mult': 0.6103214725606754, 'sideways_time_stop': 160, 'sideways_use_sma': False, 'sideways_use_ema': True, 'sideways_use_atr': True, 'sideways_use_adx': False, 'sideways_use_spike': False, 'sideways_rsi_required': True}.
[I 2025-08-29 21:16:46,735] Trial 860 finished with values: [-1000000000.0, 1000000000.0] and parameters: {'p_sma': 15, 'p_std': 47, 'p_atr': 14, 'p_adx': 9, 'rsi_period': 17, 'ema1': 23, 'ema2': 25, 'slip_atr_k': 0.011954623815626007, 'slip_spread_k': 0.07503276611167252, 'spread_hl_frac': 0.02177773333885168, 'bb_std_mult': 0.8022856154302184, 'rsi_os': 25, 'rsi_ob': 76, 'vol_spike': 0.2808777399472422, 'adx_thresh': 7.002423563288721, 'atr_min_pct': 0.011632225536638084, 'atr_max_pct': 0.1299004709884475, 'tp_mult': 2.497151443306643, 'tsl_mult': 0.7243943674832958, 'strategy': 'mean_reversion', 'time_stop': 218, 'use_sma': True, 'use_atr': False, 'use_adx': False, 'use_ema': False, 'use_spike': True, 'rsi_required': False, 'edge_k': 1.9012052983498227, 'edge_cap': 0.250428329923809, 'bull_strategy': 'mean_reversion', 'bull_bb_std_mult': 2.8086493822750365, 'bull_rsi_os': 23, 'bull_rsi_ob': 82, 'bull_adx_thresh': 27.226283079142345, 'bull_atr_min_pct': 0.020142160295044873, 'bull_atr_max_pct': 0.11299598120155063, 'bull_tp_mult': 2.5094806049893927, 'bull_tsl_mult': 0.9465528444483975, 'bull_time_stop': 197, 'bull_use_sma': True, 'bull_use_ema': False, 'bull_use_atr': False, 'bull_use_adx': True, 'bull_use_spike': True, 'bull_rsi_required': False, 'bear_strategy': 'breakout', 'bear_bb_std_mult': 2.1695492394901885, 'bear_rsi_os': 39, 'bear_rsi_ob': 89, 'bear_adx_thresh': 15.676048261922396, 'bear_atr_min_pct': 0.022242107981839496, 'bear_atr_max_pct': 0.0811216723196132, 'bear_tp_mult': 2.8317579180983445, 'bear_tsl_mult': 0.054336454046760074, 'bear_time_stop': 256, 'bear_use_sma': False, 'bear_use_ema': False, 'bear_use_atr': False, 'bear_use_adx': False, 'bear_use_spike': True, 'bear_rsi_required': False, 'sideways_strategy': 'breakout', 'sideways_bb_std_mult': 3.3929145525293607, 'sideways_rsi_os': 22, 'sideways_rsi_ob': 49, 'sideways_adx_thresh': 10.301385466076557, 'sideways_atr_min_pct': 0.013531435970452583, 'sideways_atr_max_pct': 0.03841803857504366, 'sideways_tp_mult': 2.20587595996267, 'sideways_tsl_mult': 0.58703309140276, 'sideways_time_stop': 158, 'sideways_use_sma': False, 'sideways_use_ema': True, 'sideways_use_atr': True, 'sideways_use_adx': False, 'sideways_use_spike': False, 'sideways_rsi_required': True}.
[I 2025-08-29 21:16:46,813] Trial 858 finished with values: [-1000000000.0, 1000000000.0] and parameters: {'p_sma': 44, 'p_std': 35, 'p_atr': 14, 'p_adx': 8, 'rsi_period': 84, 'ema1': 23, 'ema2': 24, 'slip_atr_k': 0.013788904348978313, 'slip_spread_k': 0.00956116106674021, 'spread_hl_frac': 0.02305765625774253, 'bb_std_mult': 0.8300539800575427, 'rsi_os': 42, 'rsi_ob': 76, 'vol_spike': 0.2941297815113217, 'adx_thresh': 8.520718474326014, 'atr_min_pct': 0.010997437356151806, 'atr_max_pct': 0.11752006030407142, 'tp_mult': 2.3230922461178767, 'tsl_mult': 0.7991481222323626, 'strategy': 'mean_reversion', 'time_stop': 216, 'use_sma': False, 'use_atr': False, 'use_adx': True, 'use_ema': False, 'use_spike': True, 'rsi_required': False, 'edge_k': 0.9565017544289041, 'edge_cap': 0.2592153904025812, 'bull_strategy': 'mean_reversion', 'bull_bb_std_mult': 2.761787109084226, 'bull_rsi_os': 23, 'bull_rsi_ob': 62, 'bull_adx_thresh': 26.943525885006082, 'bull_atr_min_pct': 0.020143694417226448, 'bull_atr_max_pct': 0.07258244642592569, 'bull_tp_mult': 2.473965396496898, 'bull_tsl_mult': 0.9424696002147904, 'bull_time_stop': 222, 'bull_use_sma': True, 'bull_use_ema': False, 'bull_use_atr': False, 'bull_use_adx': True, 'bull_use_spike': False, 'bull_rsi_required': True, 'bear_strategy': 'breakout', 'bear_bb_std_mult': 2.5172147984050635, 'bear_rsi_os': 39, 'bear_rsi_ob': 89, 'bear_adx_thresh': 8.177354781848187, 'bear_atr_min_pct': 0.027898903076462644, 'bear_atr_max_pct': 0.0721721447424018, 'bear_tp_mult': 2.835603173447476, 'bear_tsl_mult': 0.0007662718126469278, 'bear_time_stop': 232, 'bear_use_sma': False, 'bear_use_ema': False, 'bear_use_atr': False, 'bear_use_adx': False, 'bear_use_spike': False, 'bear_rsi_required': True, 'sideways_strategy': 'breakout', 'sideways_bb_std_mult': 3.531800436310534, 'sideways_rsi_os': 22, 'sideways_rsi_ob': 84, 'sideways_adx_thresh': 10.475164455867755, 'sideways_atr_min_pct': 0.012890945842655963, 'sideways_atr_max_pct': 0.03940857227011354, 'sideways_tp_mult': 2.220917967577076, 'sideways_tsl_mult': 0.6226989433451553, 'sideways_time_stop': 159, 'sideways_use_sma': False, 'sideways_use_ema': True, 'sideways_use_atr': True, 'sideways_use_adx': True, 'sideways_use_spike': True, 'sideways_rsi_required': True}.
[I 2025-08-29 21:17:16,332] Trial 864 finished with values: [-1000000000.0, 1000000000.0] and parameters: {'p_sma': 35, 'p_std': 34, 'p_atr': 15, 'p_adx': 7, 'rsi_period': 23, 'ema1': 23, 'ema2': 26, 'slip_atr_k': 0.1508670035644799, 'slip_spread_k': 0.09063814222652042, 'spread_hl_frac': 0.024084360515317663, 'bb_std_mult': 0.8657476793381751, 'rsi_os': 8, 'rsi_ob': 80, 'vol_spike': 0.28066526417847737, 'adx_thresh': 8.976868868079691, 'atr_min_pct': 0.012153398060625176, 'atr_max_pct': 0.03509362632394289, 'tp_mult': 2.4027555797369082, 'tsl_mult': 0.7820893326956471, 'strategy': 'breakout', 'time_stop': 225, 'use_sma': True, 'use_atr': False, 'use_adx': False, 'use_ema': False, 'use_spike': True, 'rsi_required': False, 'edge_k': 0.6777522327442584, 'edge_cap': 0.26903483644221293, 'bull_strategy': 'mean_reversion', 'bull_bb_std_mult': 2.583260626323029, 'bull_rsi_os': 50, 'bull_rsi_ob': 68, 'bull_adx_thresh': 24.051312738846445, 'bull_atr_min_pct': 0.010570235590887768, 'bull_atr_max_pct': 0.10121879521489952, 'bull_tp_mult': 2.4261333002086167, 'bull_tsl_mult': 0.9687216792367715, 'bull_time_stop': 183, 'bull_use_sma': False, 'bull_use_ema': False, 'bull_use_atr': False, 'bull_use_adx': True, 'bull_use_spike': True, 'bull_rsi_required': False, 'bear_strategy': 'breakout', 'bear_bb_std_mult': 2.350414386778173, 'bear_rsi_os': 40, 'bear_rsi_ob': 86, 'bear_adx_thresh': 17.086657503484602, 'bear_atr_min_pct': 0.012232012056464542, 'bear_atr_max_pct': 0.08682481606931437, 'bear_tp_mult': 2.8955190593918343, 'bear_tsl_mult': 0.020451583683965498, 'bear_time_stop': 290, 'bear_use_sma': False, 'bear_use_ema': False, 'bear_use_atr': False, 'bear_use_adx': False, 'bear_use_spike': True, 'bear_rsi_required': False, 'sideways_strategy': 'breakout', 'sideways_bb_std_mult': 3.432080743649766, 'sideways_rsi_os': 24, 'sideways_rsi_ob': 82, 'sideways_adx_thresh': 12.573754939899878, 'sideways_atr_min_pct': 0.013352988493512966, 'sideways_atr_max_pct': 0.043471148441369206, 'sideways_tp_mult': 2.4126931657781827, 'sideways_tsl_mult': 0.5753734156788368, 'sideways_time_stop': 142, 'sideways_use_sma': False, 'sideways_use_ema': False, 'sideways_use_atr': True, 'sideways_use_adx': False, 'sideways_use_spike': False, 'sideways_rsi_required': True}.
[I 2025-08-29 21:17:16,649] Trial 863 finished with values: [-0.0032856450128349035, 0.0032166991784102227] and parameters: {'p_sma': 36, 'p_std': 40, 'p_atr': 14, 'p_adx': 8, 'rsi_period': 19, 'ema1': 11, 'ema2': 26, 'slip_atr_k': 0.07299838997581184, 'slip_spread_k': 0.09187440977949665, 'spread_hl_frac': 0.024076599366327233, 'bb_std_mult': 0.8634868284247206, 'rsi_os': 42, 'rsi_ob': 80, 'vol_spike': 0.2864703816766124, 'adx_thresh': 10.031762375992477, 'atr_min_pct': 0.012075849117192993, 'atr_max_pct': 0.034677207335296605, 'tp_mult': 2.394423355686091, 'tsl_mult': 0.7802850346026721, 'strategy': 'breakout', 'time_stop': 225, 'use_sma': True, 'use_atr': False, 'use_adx': False, 'use_ema': False, 'use_spike': True, 'rsi_required': False, 'edge_k': 0.9067200774589554, 'edge_cap': 0.2675326390594191, 'bull_strategy': 'mean_reversion', 'bull_bb_std_mult': 2.600183764182747, 'bull_rsi_os': 45, 'bull_rsi_ob': 68, 'bull_adx_thresh': 30.9606195459791, 'bull_atr_min_pct': 0.019186250457268107, 'bull_atr_max_pct': 0.10062622455905598, 'bull_tp_mult': 2.4582351136871172, 'bull_tsl_mult': 0.9444311854724668, 'bull_time_stop': 209, 'bull_use_sma': True, 'bull_use_ema': False, 'bull_use_atr': False, 'bull_use_adx': True, 'bull_use_spike': True, 'bull_rsi_required': False, 'bear_strategy': 'breakout', 'bear_bb_std_mult': 2.3615327814935525, 'bear_rsi_os': 41, 'bear_rsi_ob': 84, 'bear_adx_thresh': 16.8856364195983, 'bear_atr_min_pct': 0.006957847317053114, 'bear_atr_max_pct': 0.09203813916590521, 'bear_tp_mult': 2.800695255987046, 'bear_tsl_mult': 3.4000909738214624e-05, 'bear_time_stop': 269, 'bear_use_sma': False, 'bear_use_ema': False, 'bear_use_atr': False, 'bear_use_adx': False, 'bear_use_spike': True, 'bear_rsi_required': False, 'sideways_strategy': 'breakout', 'sideways_bb_std_mult': 3.432794361177669, 'sideways_rsi_os': 23, 'sideways_rsi_ob': 82, 'sideways_adx_thresh': 12.747670110904455, 'sideways_atr_min_pct': 0.013413867717783657, 'sideways_atr_max_pct': 0.036392113857970775, 'sideways_tp_mult': 2.2829389090200167, 'sideways_tsl_mult': 0.5793356795615929, 'sideways_time_stop': 143, 'sideways_use_sma': False, 'sideways_use_ema': False, 'sideways_use_atr': True, 'sideways_use_adx': False, 'sideways_use_spike': False, 'sideways_rsi_required': True}.
[I 2025-08-29 21:17:16,892] Trial 862 finished with values: [-1000000000.0, 1000000000.0] and parameters: {'p_sma': 17, 'p_std': 22, 'p_atr': 14, 'p_adx': 9, 'rsi_period': 34, 'ema1': 23, 'ema2': 26, 'slip_atr_k': 0.012077641990931243, 'slip_spread_k': 0.07392991845924277, 'spread_hl_frac': 0.021528732670444004, 'bb_std_mult': 0.8686644184826022, 'rsi_os': 8, 'rsi_ob': 94, 'vol_spike': 0.2829661745408873, 'adx_thresh': 10.005373463052418, 'atr_min_pct': 0.01207377592914115, 'atr_max_pct': 0.1335069023948325, 'tp_mult': 2.50038195127338, 'tsl_mult': 0.7788795188036217, 'strategy': 'mean_reversion', 'time_stop': 226, 'use_sma': True, 'use_atr': False, 'use_adx': False, 'use_ema': False, 'use_spike': True, 'rsi_required': False, 'edge_k': 0.9208878835225804, 'edge_cap': 0.2554908942731996, 'bull_strategy': 'mean_reversion', 'bull_bb_std_mult': 2.58693585183837, 'bull_rsi_os': 23, 'bull_rsi_ob': 68, 'bull_adx_thresh': 33.4870813100383, 'bull_atr_min_pct': 0.019996888324058926, 'bull_atr_max_pct': 0.10027305125559931, 'bull_tp_mult': 2.50257139639382, 'bull_tsl_mult': 0.9432150992624605, 'bull_time_stop': 197, 'bull_use_sma': True, 'bull_use_ema': False, 'bull_use_atr': False, 'bull_use_adx': True, 'bull_use_spike': True, 'bull_rsi_required': False, 'bear_strategy': 'breakout', 'bear_bb_std_mult': 2.0956195554844452, 'bear_rsi_os': 40, 'bear_rsi_ob': 86, 'bear_adx_thresh': 16.781200389382676, 'bear_atr_min_pct': 0.007034817310431727, 'bear_atr_max_pct': 0.08763602222021613, 'bear_tp_mult': 2.7968371223678905, 'bear_tsl_mult': 0.014349754973178475, 'bear_time_stop': 279, 'bear_use_sma': False, 'bear_use_ema': False, 'bear_use_atr': False, 'bear_use_adx': False, 'bear_use_spike': True, 'bear_rsi_required': False, 'sideways_strategy': 'breakout', 'sideways_bb_std_mult': 3.3561966716234686, 'sideways_rsi_os': 23, 'sideways_rsi_ob': 82, 'sideways_adx_thresh': 12.806356867138843, 'sideways_atr_min_pct': 0.013427527980184612, 'sideways_atr_max_pct': 0.037540746030977366, 'sideways_tp_mult': 2.4261268764616473, 'sideways_tsl_mult': 0.5762923000808949, 'sideways_time_stop': 150, 'sideways_use_sma': False, 'sideways_use_ema': True, 'sideways_use_atr': True, 'sideways_use_adx': False, 'sideways_use_spike': False, 'sideways_rsi_required': True}.
