[I 2025-08-29 20:06:18,962] Trial 250 finished with values: [-0.003164361034622365, 0.0031481657650619444] and parameters: {'p_sma': 42, 'p_std': 24, 'p_atr': 24, 'p_adx': 17, 'rsi_period': 50, 'ema1': 21, 'ema2': 47, 'slip_atr_k': 0.1636982285590176, 'slip_spread_k': 0.0794829767169567, 'spread_hl_frac': 0.001344644225070836, 'bb_std_mult': 2.3714035341734077, 'rsi_os': 45, 'rsi_ob': 87, 'vol_spike': 0.17610301748325138, 'adx_thresh': 29.980409298692884, 'atr_min_pct': 0.004860075069299157, 'atr_max_pct': 0.047973478987425405, 'tp_mult': 1.5812348755060188, 'tsl_mult': 0.6199702545029856, 'strategy': 'mean_reversion', 'time_stop': 162, 'use_sma': True, 'use_atr': True, 'use_adx': True, 'use_ema': False, 'use_spike': True, 'rsi_required': True, 'edge_k': 1.2351163695117808, 'edge_cap': 0.5290139218941554, 'bull_strategy': 'mean_reversion', 'bull_bb_std_mult': 1.5488442366959534, 'bull_rsi_os': 34, 'bull_rsi_ob': 49, 'bull_adx_thresh': 17.305062084059987, 'bull_atr_min_pct': 0.0010742659610186679, 'bull_atr_max_pct': 0.024902714807496427, 'bull_tp_mult': 1.4966992076246093, 'bull_tsl_mult': 0.1383539107025438, 'bull_time_stop': 184, 'bull_use_sma': True, 'bull_use_ema': True, 'bull_use_atr': False, 'bull_use_adx': False, 'bull_use_spike': True, 'bull_rsi_required': False, 'bear_strategy': 'breakout', 'bear_bb_std_mult': 2.6294124295395815, 'bear_rsi_os': 30, 'bear_rsi_ob': 81, 'bear_adx_thresh': 10.772956465281258, 'bear_atr_min_pct': 0.0060615373165492665, 'bear_atr_max_pct': 0.12358091021705792, 'bear_tp_mult': 1.07155105193133, 'bear_tsl_mult': 0.5042489851924354, 'bear_time_stop': 13, 'bear_use_sma': False, 'bear_use_ema': True, 'bear_use_atr': False, 'bear_use_adx': False, 'bear_use_spike': True, 'bear_rsi_required': True, 'sideways_strategy': 'mean_reversion', 'sideways_bb_std_mult': 3.010380439709437, 'sideways_rsi_os': 15, 'sideways_rsi_ob': 80, 'sideways_adx_thresh': 19.33485417545677, 'sideways_atr_min_pct': 0.006017690760658338, 'sideways_atr_max_pct': 0.06336901687970115, 'sideways_tp_mult': 2.6887644443267504, 'sideways_tsl_mult': 0.8382101227228549, 'sideways_time_stop': 236, 'sideways_use_sma': True, 'sideways_use_ema': False, 'sideways_use_atr': True, 'sideways_use_adx': False, 'sideways_use_spike': False, 'sideways_rsi_required': False}.
[I 2025-08-29 20:06:19,452] Trial 252 finished with values: [-1000000000.0, 1000000000.0] and parameters: {'p_sma': 44, 'p_std': 23, 'p_atr': 24, 'p_adx': 17, 'rsi_period': 29, 'ema1': 22, 'ema2': 46, 'slip_atr_k': 0.16290751294176486, 'slip_spread_k': 0.42320091238002927, 'spread_hl_frac': 0.0027569515287704607, 'bb_std_mult': 2.396015230315566, 'rsi_os': 15, 'rsi_ob': 87, 'vol_spike': 0.1753495409915864, 'adx_thresh': 29.734672691228035, 'atr_min_pct': 0.012176684884092894, 'atr_max_pct': 0.05413026106661644, 'tp_mult': 1.584327789515893, 'tsl_mult': 0.9818092318624607, 'strategy': 'breakout', 'time_stop': 223, 'use_sma': True, 'use_atr': False, 'use_adx': True, 'use_ema': False, 'use_spike': False, 'rsi_required': True, 'edge_k': 1.1224621104983181, 'edge_cap': 0.784345060554068, 'bull_strategy': 'mean_reversion', 'bull_bb_std_mult': 1.5332529484779498, 'bull_rsi_os': 34, 'bull_rsi_ob': 93, 'bull_adx_thresh': 17.290249717822068, 'bull_atr_min_pct': 0.0011064710941879699, 'bull_atr_max_pct': 0.019667039438115982, 'bull_tp_mult': 1.544182136715602, 'bull_tsl_mult': 0.14638485328246992, 'bull_time_stop': 201, 'bull_use_sma': True, 'bull_use_ema': True, 'bull_use_atr': False, 'bull_use_adx': True, 'bull_use_spike': True, 'bull_rsi_required': False, 'bear_strategy': 'mean_reversion', 'bear_bb_std_mult': 2.6133679177553724, 'bear_rsi_os': 55, 'bear_rsi_ob': 87, 'bear_adx_thresh': 7.055515749482073, 'bear_atr_min_pct': 0.0016777780798102899, 'bear_atr_max_pct': 0.12393961504171747, 'bear_tp_mult': 1.070254648943606, 'bear_tsl_mult': 0.48929215282524186, 'bear_time_stop': 10, 'bear_use_sma': False, 'bear_use_ema': True, 'bear_use_atr': True, 'bear_use_adx': False, 'bear_use_spike': True, 'bear_rsi_required': True, 'sideways_strategy': 'mean_reversion', 'sideways_bb_std_mult': 1.5095078908424855, 'sideways_rsi_os': 15, 'sideways_rsi_ob': 83, 'sideways_adx_thresh': 20.86916293339481, 'sideways_atr_min_pct': 0.0060498894722151135, 'sideways_atr_max_pct': 0.06274365830444704, 'sideways_tp_mult': 2.755653690002104, 'sideways_tsl_mult': 0.7157039321252707, 'sideways_time_stop': 236, 'sideways_use_sma': True, 'sideways_use_ema': True, 'sideways_use_atr': False, 'sideways_use_adx': False, 'sideways_use_spike': True, 'sideways_rsi_required': False}.
[I 2025-08-29 20:06:19,915] Trial 257 finished with values: [-1000000000.0, 1000000000.0] and parameters: {'p_sma': 42, 'p_std': 52, 'p_atr': 28, 'p_adx': 16, 'rsi_period': 50, 'ema1': 20, 'ema2': 47, 'slip_atr_k': 0.24430409216594126, 'slip_spread_k': 0.4834134410688148, 'spread_hl_frac': 0.028238776591585964, 'bb_std_mult': 0.9744590276869158, 'rsi_os': 18, 'rsi_ob': 46, 'vol_spike': 0.12304972700718396, 'adx_thresh': 31.92183600414609, 'atr_min_pct': 0.013489213551464256, 'atr_max_pct': 0.040752050284224385, 'tp_mult': 1.9780087531637005, 'tsl_mult': 0.6157980162821455, 'strategy': 'mean_reversion', 'time_stop': 154, 'use_sma': True, 'use_atr': True, 'use_adx': False, 'use_ema': False, 'use_spike': False, 'rsi_required': True, 'edge_k': 0.6021602086274946, 'edge_cap': 0.4987281607817404, 'bull_strategy': 'mean_reversion', 'bull_bb_std_mult': 1.4501755708968962, 'bull_rsi_os': 41, 'bull_rsi_ob': 73, 'bull_adx_thresh': 18.435550248105777, 'bull_atr_min_pct': 1.4673695651786054e-05, 'bull_atr_max_pct': 0.024961043408386775, 'bull_tp_mult': 1.4474502309665465, 'bull_tsl_mult': 0.44458634429675176, 'bull_time_stop': 171, 'bull_use_sma': True, 'bull_use_ema': False, 'bull_use_atr': False, 'bull_use_adx': True, 'bull_use_spike': False, 'bull_rsi_required': True, 'bear_strategy': 'breakout', 'bear_bb_std_mult': 1.062187069615825, 'bear_rsi_os': 29, 'bear_rsi_ob': 89, 'bear_adx_thresh': 29.683049978844533, 'bear_atr_min_pct': 0.0054246226358939794, 'bear_atr_max_pct': 0.11149055575459316, 'bear_tp_mult': 1.0188586290962665, 'bear_tsl_mult': 0.5166647216535909, 'bear_time_stop': 16, 'bear_use_sma': False, 'bear_use_ema': True, 'bear_use_atr': True, 'bear_use_adx': False, 'bear_use_spike': True, 'bear_rsi_required': False, 'sideways_strategy': 'mean_reversion', 'sideways_bb_std_mult': 3.0481247959178184, 'sideways_rsi_os': 16, 'sideways_rsi_ob': 80, 'sideways_adx_thresh': 19.489348078670997, 'sideways_atr_min_pct': 0.004612512745048879, 'sideways_atr_max_pct': 0.059118694262780866, 'sideways_tp_mult': 2.736977690243572, 'sideways_tsl_mult': 0.5462449703155785, 'sideways_time_stop': 242, 'sideways_use_sma': False, 'sideways_use_ema': False, 'sideways_use_atr': True, 'sideways_use_adx': False, 'sideways_use_spike': False, 'sideways_rsi_required': False}.
[I 2025-08-29 20:06:49,256] Trial 255 finished with values: [-1000000000.0, 1000000000.0] and parameters: {'p_sma': 41, 'p_std': 53, 'p_atr': 24, 'p_adx': 9, 'rsi_period': 50, 'ema1': 20, 'ema2': 47, 'slip_atr_k': 0.1692931871516884, 'slip_spread_k': 0.6139753585039397, 'spread_hl_frac': 0.03588679490328188, 'bb_std_mult': 0.9724240435219907, 'rsi_os': 15, 'rsi_ob': 66, 'vol_spike': 0.07842941785732559, 'adx_thresh': 32.08483532032327, 'atr_min_pct': 0.004183831588345956, 'atr_max_pct': 0.04139346821144559, 'tp_mult': 1.6633426229793753, 'tsl_mult': 0.6110042420050914, 'strategy': 'mean_reversion', 'time_stop': 199, 'use_sma': True, 'use_atr': True, 'use_adx': False, 'use_ema': False, 'use_spike': False, 'rsi_required': True, 'edge_k': 1.010015844725394, 'edge_cap': 0.490137466843168, 'bull_strategy': 'mean_reversion', 'bull_bb_std_mult': 1.4236169097172535, 'bull_rsi_os': 41, 'bull_rsi_ob': 93, 'bull_adx_thresh': 32.153316461031295, 'bull_atr_min_pct': 9.01952745757153e-05, 'bull_atr_max_pct': 0.023965403460748845, 'bull_tp_mult': 1.5397538256738605, 'bull_tsl_mult': 0.4483975779634703, 'bull_time_stop': 230, 'bull_use_sma': True, 'bull_use_ema': True, 'bull_use_atr': False, 'bull_use_adx': True, 'bull_use_spike': False, 'bull_rsi_required': True, 'bear_strategy': 'breakout', 'bear_bb_std_mult': 1.0165909420744064, 'bear_rsi_os': 39, 'bear_rsi_ob': 68, 'bear_adx_thresh': 24.09990370338081, 'bear_atr_min_pct': 0.020548022738563647, 'bear_atr_max_pct': 0.1122002288911119, 'bear_tp_mult': 1.013966350436705, 'bear_tsl_mult': 0.5210149796426684, 'bear_time_stop': 240, 'bear_use_sma': False, 'bear_use_ema': True, 'bear_use_atr': True, 'bear_use_adx': False, 'bear_use_spike': True, 'bear_rsi_required': False, 'sideways_strategy': 'mean_reversion', 'sideways_bb_std_mult': 3.513681985067713, 'sideways_rsi_os': 15, 'sideways_rsi_ob': 80, 'sideways_adx_thresh': 19.527039867632727, 'sideways_atr_min_pct': 0.0034752343107693133, 'sideways_atr_max_pct': 0.053564673766786024, 'sideways_tp_mult': 2.76393896023631, 'sideways_tsl_mult': 0.7456446485256711, 'sideways_time_stop': 237, 'sideways_use_sma': False, 'sideways_use_ema': True, 'sideways_use_atr': True, 'sideways_use_adx': False, 'sideways_use_spike': False, 'sideways_rsi_required': False}.
[I 2025-08-29 20:06:50,130] Trial 254 finished with values: [-0.01082983087379763, 0.010852928889271897] and parameters: {'p_sma': 41, 'p_std': 46, 'p_atr': 25, 'p_adx': 17, 'rsi_period': 46, 'ema1': 22, 'ema2': 47, 'slip_atr_k': 0.03503895287398665, 'slip_spread_k': 0.5496264526591614, 'spread_hl_frac': 0.036063797214716274, 'bb_std_mult': 3.1979345465722666, 'rsi_os': 6, 'rsi_ob': 66, 'vol_spike': 0.17642017013761968, 'adx_thresh': 32.17508247550039, 'atr_min_pct': 0.012280691912018318, 'atr_max_pct': 0.04682498684747127, 'tp_mult': 1.9739369061740744, 'tsl_mult': 0.9793940966944179, 'strategy': 'mean_reversion', 'time_stop': 222, 'use_sma': True, 'use_atr': True, 'use_adx': True, 'use_ema': False, 'use_spike': True, 'rsi_required': True, 'edge_k': 1.1378409743619666, 'edge_cap': 0.501325679644379, 'bull_strategy': 'mean_reversion', 'bull_bb_std_mult': 1.5136005798988978, 'bull_rsi_os': 40, 'bull_rsi_ob': 94, 'bull_adx_thresh': 28.889740937028563, 'bull_atr_min_pct': 6.972358829091603e-06, 'bull_atr_max_pct': 0.01990600973408526, 'bull_tp_mult': 1.5361070542084003, 'bull_tsl_mult': 0.13487345163973516, 'bull_time_stop': 159, 'bull_use_sma': True, 'bull_use_ema': True, 'bull_use_atr': False, 'bull_use_adx': False, 'bull_use_spike': True, 'bull_rsi_required': False, 'bear_strategy': 'breakout', 'bear_bb_std_mult': 2.152423921737796, 'bear_rsi_os': 29, 'bear_rsi_ob': 69, 'bear_adx_thresh': 7.338141729760087, 'bear_atr_min_pct': 6.70355539341503e-05, 'bear_atr_max_pct': 0.07322870946503081, 'bear_tp_mult': 1.0495419130883088, 'bear_tsl_mult': 0.4991485041349845, 'bear_time_stop': 242, 'bear_use_sma': False, 'bear_use_ema': True, 'bear_use_atr': True, 'bear_use_adx': False, 'bear_use_spike': True, 'bear_rsi_required': True, 'sideways_strategy': 'mean_reversion', 'sideways_bb_std_mult': 1.626766910297365, 'sideways_rsi_os': 15, 'sideways_rsi_ob': 49, 'sideways_adx_thresh': 19.517015284959363, 'sideways_atr_min_pct': 0.004607992126210696, 'sideways_atr_max_pct': 0.06679354066259217, 'sideways_tp_mult': 2.7202832910501984, 'sideways_tsl_mult': 0.7417179545436038, 'sideways_time_stop': 236, 'sideways_use_sma': True, 'sideways_use_ema': False, 'sideways_use_atr': True, 'sideways_use_adx': False, 'sideways_use_spike': True, 'sideways_rsi_required': False}.
[I 2025-08-29 20:06:50,215] Trial 256 finished with values: [-1000000000.0, 1000000000.0] and parameters: {'p_sma': 40, 'p_std': 52, 'p_atr': 24, 'p_adx': 16, 'rsi_period': 51, 'ema1': 24, 'ema2': 47, 'slip_atr_k': 0.09561843304233172, 'slip_spread_k': 0.42842368986210133, 'spread_hl_frac': 0.03228395667552426, 'bb_std_mult': 0.9562463761651978, 'rsi_os': 29, 'rsi_ob': 82, 'vol_spike': 0.12376031952086852, 'adx_thresh': 32.21928911166339, 'atr_min_pct': 0.013553359822993475, 'atr_max_pct': 0.040712527466549575, 'tp_mult': 1.6580355708606456, 'tsl_mult': 0.3419479111429856, 'strategy': 'mean_reversion', 'time_stop': 158, 'use_sma': True, 'use_atr': True, 'use_adx': False, 'use_ema': False, 'use_spike': False, 'rsi_required': True, 'edge_k': 1.1713973008899483, 'edge_cap': 0.4967280142238928, 'bull_strategy': 'mean_reversion', 'bull_bb_std_mult': 1.4873516678623242, 'bull_rsi_os': 25, 'bull_rsi_ob': 93, 'bull_adx_thresh': 8.45527017499253, 'bull_atr_min_pct': 0.0005732685679408454, 'bull_atr_max_pct': 0.02380902854067, 'bull_tp_mult': 1.4513314314308297, 'bull_tsl_mult': 0.09976252156534202, 'bull_time_stop': 199, 'bull_use_sma': True, 'bull_use_ema': True, 'bull_use_atr': False, 'bull_use_adx': True, 'bull_use_spike': False, 'bull_rsi_required': True, 'bear_strategy': 'breakout', 'bear_bb_std_mult': 1.063842935048239, 'bear_rsi_os': 29, 'bear_rsi_ob': 89, 'bear_adx_thresh': 5.000935948375842, 'bear_atr_min_pct': 0.02047262655286226, 'bear_atr_max_pct': 0.111611027880349, 'bear_tp_mult': 1.093882440419675, 'bear_tsl_mult': 0.4947459040593306, 'bear_time_stop': 60, 'bear_use_sma': False, 'bear_use_ema': True, 'bear_use_atr': True, 'bear_use_adx': False, 'bear_use_spike': True, 'bear_rsi_required': False, 'sideways_strategy': 'mean_reversion', 'sideways_bb_std_mult': 3.043856282033233, 'sideways_rsi_os': 15, 'sideways_rsi_ob': 79, 'sideways_adx_thresh': 19.59862013905225, 'sideways_atr_min_pct': 0.004490323120126368, 'sideways_atr_max_pct': 0.05850525517261958, 'sideways_tp_mult': 2.7384944114826832, 'sideways_tsl_mult': 0.7954346551026504, 'sideways_time_stop': 237, 'sideways_use_sma': False, 'sideways_use_ema': True, 'sideways_use_atr': True, 'sideways_use_adx': False, 'sideways_use_spike': True, 'sideways_rsi_required': False}.
[I 2025-08-29 20:06:50,870] Trial 258 finished with values: [-1000000000.0, 1000000000.0] and parameters: {'p_sma': 41, 'p_std': 53, 'p_atr': 24, 'p_adx': 11, 'rsi_period': 45, 'ema1': 19, 'ema2': 45, 'slip_atr_k': 0.041567800210211885, 'slip_spread_k': 0.1591570389522099, 'spread_hl_frac': 0.012061610301042986, 'bb_std_mult': 3.3415659371874655, 'rsi_os': 39, 'rsi_ob': 65, 'vol_spike': 0.25527239461044954, 'adx_thresh': 30.83228102409124, 'atr_min_pct': 0.0042117541256759886, 'atr_max_pct': 0.04115094555019076, 'tp_mult': 1.677294927292464, 'tsl_mult': 0.6065313411449219, 'strategy': 'mean_reversion', 'time_stop': 155, 'use_sma': True, 'use_atr': True, 'use_adx': False, 'use_ema': False, 'use_spike': True, 'rsi_required': True, 'edge_k': 1.0434935059717565, 'edge_cap': 0.4966882997826564, 'bull_strategy': 'mean_reversion', 'bull_bb_std_mult': 1.6461257598837604, 'bull_rsi_os': 25, 'bull_rsi_ob': 95, 'bull_adx_thresh': 9.08151546789474, 'bull_atr_min_pct': 0.0006161216901848255, 'bull_atr_max_pct': 0.028661025254490605, 'bull_tp_mult': 1.9789566868636939, 'bull_tsl_mult': 0.5467571207949029, 'bull_time_stop': 232, 'bull_use_sma': True, 'bull_use_ema': True, 'bull_use_atr': False, 'bull_use_adx': False, 'bull_use_spike': False, 'bull_rsi_required': True, 'bear_strategy': 'breakout', 'bear_bb_std_mult': 1.2205442123737273, 'bear_rsi_os': 30, 'bear_rsi_ob': 68, 'bear_adx_thresh': 5.959356016057012, 'bear_atr_min_pct': 0.02020901695323564, 'bear_atr_max_pct': 0.05652906745931522, 'bear_tp_mult': 1.0979668544230998, 'bear_tsl_mult': 0.497277542014826, 'bear_time_stop': 5, 'bear_use_sma': False, 'bear_use_ema': True, 'bear_use_atr': False, 'bear_use_adx': False, 'bear_use_spike': True, 'bear_rsi_required': False, 'sideways_strategy': 'mean_reversion', 'sideways_bb_std_mult': 1.6484729473960082, 'sideways_rsi_os': 17, 'sideways_rsi_ob': 88, 'sideways_adx_thresh': 18.709645782253492, 'sideways_atr_min_pct': 0.0037739902773731206, 'sideways_atr_max_pct': 0.06177398856970871, 'sideways_tp_mult': 2.691362387619809, 'sideways_tsl_mult': 0.7505960966773526, 'sideways_time_stop': 151, 'sideways_use_sma': False, 'sideways_use_ema': True, 'sideways_use_atr': True, 'sideways_use_adx': False, 'sideways_use_spike': False, 'sideways_rsi_required': False}.
[I 2025-08-29 20:06:51,344] Trial 262 finished with values: [-1000000000.0, 1000000000.0] and parameters: {'p_sma': 48, 'p_std': 52, 'p_atr': 25, 'p_adx': 18, 'rsi_period': 43, 'ema1': 21, 'ema2': 50, 'slip_atr_k': 0.03632292502948087, 'slip_spread_k': 0.3913339099593037, 'spread_hl_frac': 0.024768988815176324, 'bb_std_mult': 1.903712083064305, 'rsi_os': 51, 'rsi_ob': 63, 'vol_spike': 0.20478375343487581, 'adx_thresh': 30.880435130283292, 'atr_min_pct': 0.014418609906869563, 'atr_max_pct': 0.04482874957009142, 'tp_mult': 1.7630890423795476, 'tsl_mult': 0.5643540781686042, 'strategy': 'mean_reversion', 'time_stop': 164, 'use_sma': True, 'use_atr': True, 'use_adx': False, 'use_ema': True, 'use_spike': False, 'rsi_required': False, 'edge_k': 0.18887806610130176, 'edge_cap': 0.5318087721374868, 'bull_strategy': 'mean_reversion', 'bull_bb_std_mult': 1.7633063703868461, 'bull_rsi_os': 50, 'bull_rsi_ob': 59, 'bull_adx_thresh': 19.461842709612068, 'bull_atr_min_pct': 0.0015238424365772215, 'bull_atr_max_pct': 0.02735187896788586, 'bull_tp_mult': 2.6181849080805297, 'bull_tsl_mult': 0.5186399186080362, 'bull_time_stop': 144, 'bull_use_sma': True, 'bull_use_ema': False, 'bull_use_atr': True, 'bull_use_adx': True, 'bull_use_spike': False, 'bull_rsi_required': True, 'bear_strategy': 'breakout', 'bear_bb_std_mult': 2.8769332687836235, 'bear_rsi_os': 6, 'bear_rsi_ob': 59, 'bear_adx_thresh': 6.397013328799001, 'bear_atr_min_pct': 0.006236027933127561, 'bear_atr_max_pct': 0.11664579326600633, 'bear_tp_mult': 1.0436369255636986, 'bear_tsl_mult': 0.35780640123410323, 'bear_time_stop': 295, 'bear_use_sma': True, 'bear_use_ema': True, 'bear_use_atr': False, 'bear_use_adx': True, 'bear_use_spike': True, 'bear_rsi_required': False, 'sideways_strategy': 'breakout', 'sideways_bb_std_mult': 3.223548858230741, 'sideways_rsi_os': 16, 'sideways_rsi_ob': 84, 'sideways_adx_thresh': 20.16878299087211, 'sideways_atr_min_pct': 0.005377896249904127, 'sideways_atr_max_pct': 0.06222307965072548, 'sideways_tp_mult': 2.7968277625172835, 'sideways_tsl_mult': 0.8975915267085635, 'sideways_time_stop': 250, 'sideways_use_sma': False, 'sideways_use_ema': True, 'sideways_use_atr': True, 'sideways_use_adx': True, 'sideways_use_spike': False, 'sideways_rsi_required': False}.
[I 2025-08-29 20:07:20,662] Trial 261 finished with values: [-0.019136370600281172, 0.01911127498952177] and parameters: {'p_sma': 47, 'p_std': 51, 'p_atr': 24, 'p_adx': 12, 'rsi_period': 43, 'ema1': 23, 'ema2': 45, 'slip_atr_k': 0.040048995031511, 'slip_spread_k': 0.15938536113726082, 'spread_hl_frac': 1.807619203573552e-05, 'bb_std_mult': 3.3969184735582343, 'rsi_os': 39, 'rsi_ob': 63, 'vol_spike': 0.25557015176961384, 'adx_thresh': 31.06931276242875, 'atr_min_pct': 0.014467539115795685, 'atr_max_pct': 0.043977260660271765, 'tp_mult': 1.921389072677105, 'tsl_mult': 0.4548398960072111, 'strategy': 'mean_reversion', 'time_stop': 163, 'use_sma': True, 'use_atr': True, 'use_adx': False, 'use_ema': True, 'use_spike': False, 'rsi_required': False, 'edge_k': 0.7139688440008256, 'edge_cap': 0.5353723156112556, 'bull_strategy': 'mean_reversion', 'bull_bb_std_mult': 1.747388174305732, 'bull_rsi_os': 50, 'bull_rsi_ob': 80, 'bull_adx_thresh': 11.437797551622179, 'bull_atr_min_pct': 0.0015512853391677936, 'bull_atr_max_pct': 0.02818255231500838, 'bull_tp_mult': 2.4420278306113876, 'bull_tsl_mult': 0.5340652265547733, 'bull_time_stop': 219, 'bull_use_sma': True, 'bull_use_ema': False, 'bull_use_atr': True, 'bull_use_adx': False, 'bull_use_spike': False, 'bull_rsi_required': True, 'bear_strategy': 'breakout', 'bear_bb_std_mult': 1.1845730113158683, 'bear_rsi_os': 31, 'bear_rsi_ob': 59, 'bear_adx_thresh': 10.211275052919248, 'bear_atr_min_pct': 0.006216135296326656, 'bear_atr_max_pct': 0.1499306287765626, 'bear_tp_mult': 1.1661044986884457, 'bear_tsl_mult': 0.37002862001057873, 'bear_time_stop': 179, 'bear_use_sma': True, 'bear_use_ema': True, 'bear_use_atr': False, 'bear_use_adx': True, 'bear_use_spike': True, 'bear_rsi_required': False, 'sideways_strategy': 'breakout', 'sideways_bb_std_mult': 3.23056768569886, 'sideways_rsi_os': 17, 'sideways_rsi_ob': 88, 'sideways_adx_thresh': 18.288923797057812, 'sideways_atr_min_pct': 0.005336818430363605, 'sideways_atr_max_pct': 0.06268163282475676, 'sideways_tp_mult': 2.6751111754581443, 'sideways_tsl_mult': 0.9680789300574746, 'sideways_time_stop': 182, 'sideways_use_sma': False, 'sideways_use_ema': True, 'sideways_use_atr': True, 'sideways_use_adx': True, 'sideways_use_spike': False, 'sideways_rsi_required': False}.
