[I 2025-08-29 20:56:09,729] Trial 685 finished with values: [-1000000000.0, 1000000000.0] and parameters: {'p_sma': 43, 'p_std': 55, 'p_atr': 21, 'p_adx': 13, 'rsi_period': 36, 'ema1': 16, 'ema2': 47, 'slip_atr_k': 0.0003270209314698931, 'slip_spread_k': 0.39760362066445815, 'spread_hl_frac': 0.005601813168094161, 'bb_std_mult': 1.7172603769067647, 'rsi_os': 11, 'rsi_ob': 80, 'vol_spike': 0.18087915373041308, 'adx_thresh': 16.933879214403028, 'atr_min_pct': 0.004379583861051563, 'atr_max_pct': 0.026070714758905475, 'tp_mult': 2.9972006722888613, 'tsl_mult': 0.8514288721163771, 'strategy': 'mean_reversion', 'time_stop': 165, 'use_sma': True, 'use_atr': False, 'use_adx': False, 'use_ema': True, 'use_spike': False, 'rsi_required': False, 'edge_k': 0.33870236502005346, 'edge_cap': 0.20153096685224547, 'bull_strategy': 'mean_reversion', 'bull_bb_std_mult': 3.182836380823219, 'bull_rsi_os': 28, 'bull_rsi_ob': 72, 'bull_adx_thresh': 20.38230333582522, 'bull_atr_min_pct': 0.015464776556418848, 'bull_atr_max_pct': 0.09914353843348192, 'bull_tp_mult': 2.2675436232414974, 'bull_tsl_mult': 0.8616314540722347, 'bull_time_stop': 6, 'bull_use_sma': True, 'bull_use_ema': False, 'bull_use_atr': True, 'bull_use_adx': False, 'bull_use_spike': True, 'bull_rsi_required': False, 'bear_strategy': 'breakout', 'bear_bb_std_mult': 2.781978611850461, 'bear_rsi_os': 25, 'bear_rsi_ob': 68, 'bear_adx_thresh': 21.367507417581837, 'bear_atr_min_pct': 0.005620617796138891, 'bear_atr_max_pct': 0.08702998848192835, 'bear_tp_mult': 2.7038325640469836, 'bear_tsl_mult': 0.5488202900969509, 'bear_time_stop': 80, 'bear_use_sma': True, 'bear_use_ema': True, 'bear_use_atr': False, 'bear_use_adx': True, 'bear_use_spike': True, 'bear_rsi_required': False, 'sideways_strategy': 'breakout', 'sideways_bb_std_mult': 2.4611055961956274, 'sideways_rsi_os': 21, 'sideways_rsi_ob': 79, 'sideways_adx_thresh': 5.101238291278955, 'sideways_atr_min_pct': 0.02104885266347156, 'sideways_atr_max_pct': 0.020373983646042763, 'sideways_tp_mult': 1.8700657072545745, 'sideways_tsl_mult': 0.4269971404494533, 'sideways_time_stop': 183, 'sideways_use_sma': False, 'sideways_use_ema': False, 'sideways_use_atr': False, 'sideways_use_adx': True, 'sideways_use_spike': False, 'sideways_rsi_required': False}.
[I 2025-08-29 20:56:10,011] Trial 684 finished with values: [-0.025527762983032387, 0.02563600227314787] and parameters: {'p_sma': 50, 'p_std': 56, 'p_atr': 26, 'p_adx': 20, 'rsi_period': 36, 'ema1': 16, 'ema2': 47, 'slip_atr_k': 0.00010278260069961933, 'slip_spread_k': 0.15865093192719615, 'spread_hl_frac': 0.04565753999917366, 'bb_std_mult': 1.7166759970809713, 'rsi_os': 11, 'rsi_ob': 81, 'vol_spike': 0.11413658733672813, 'adx_thresh': 29.65638331980749, 'atr_min_pct': 0.027003562855455472, 'atr_max_pct': 0.031842903093498555, 'tp_mult': 2.0912004820610957, 'tsl_mult': 0.1466283686760309, 'strategy': 'mean_reversion', 'time_stop': 167, 'use_sma': True, 'use_atr': False, 'use_adx': False, 'use_ema': True, 'use_spike': False, 'rsi_required': False, 'edge_k': 0.9500940499174918, 'edge_cap': 0.6150564862550616, 'bull_strategy': 'mean_reversion', 'bull_bb_std_mult': 3.206839129296671, 'bull_rsi_os': 21, 'bull_rsi_ob': 75, 'bull_adx_thresh': 34.2660631491466, 'bull_atr_min_pct': 0.0054169365836886155, 'bull_atr_max_pct': 0.14134884201423983, 'bull_tp_mult': 2.755677630321522, 'bull_tsl_mult': 0.8605564408522862, 'bull_time_stop': 209, 'bull_use_sma': True, 'bull_use_ema': False, 'bull_use_atr': True, 'bull_use_adx': False, 'bull_use_spike': True, 'bull_rsi_required': False, 'bear_strategy': 'breakout', 'bear_bb_std_mult': 2.7725592139886097, 'bear_rsi_os': 55, 'bear_rsi_ob': 68, 'bear_adx_thresh': 22.307228408251984, 'bear_atr_min_pct': 0.0034232930174579144, 'bear_atr_max_pct': 0.1376481737242089, 'bear_tp_mult': 1.7147437719071683, 'bear_tsl_mult': 0.14267097256069672, 'bear_time_stop': 126, 'bear_use_sma': False, 'bear_use_ema': True, 'bear_use_atr': False, 'bear_use_adx': True, 'bear_use_spike': True, 'bear_rsi_required': False, 'sideways_strategy': 'breakout', 'sideways_bb_std_mult': 2.3898499457111604, 'sideways_rsi_os': 26, 'sideways_rsi_ob': 45, 'sideways_adx_thresh': 34.47879265582611, 'sideways_atr_min_pct': 0.015048079300251274, 'sideways_atr_max_pct': 0.08210716279223364, 'sideways_tp_mult': 1.0101258526122892, 'sideways_tsl_mult': 0.7020839870832166, 'sideways_time_stop': 183, 'sideways_use_sma': False, 'sideways_use_ema': False, 'sideways_use_atr': False, 'sideways_use_adx': True, 'sideways_use_spike': False, 'sideways_rsi_required': False}.
[I 2025-08-29 20:56:10,214] Trial 686 finished with values: [-1000000000.0, 1000000000.0] and parameters: {'p_sma': 7, 'p_std': 56, 'p_atr': 11, 'p_adx': 24, 'rsi_period': 77, 'ema1': 22, 'ema2': 47, 'slip_atr_k': 0.010584951460851528, 'slip_spread_k': 0.1584158493911025, 'spread_hl_frac': 0.007078915745183809, 'bb_std_mult': 3.2043062850161252, 'rsi_os': 9, 'rsi_ob': 76, 'vol_spike': 0.14684279800846262, 'adx_thresh': 12.790821681152831, 'atr_min_pct': 0.010820708523285686, 'atr_max_pct': 0.08125197101706697, 'tp_mult': 1.4704514225353527, 'tsl_mult': 0.5341612767902455, 'strategy': 'mean_reversion', 'time_stop': 169, 'use_sma': True, 'use_atr': False, 'use_adx': False, 'use_ema': True, 'use_spike': False, 'rsi_required': False, 'edge_k': 1.8715635268888762, 'edge_cap': 0.6116855715636609, 'bull_strategy': 'mean_reversion', 'bull_bb_std_mult': 1.9211339910651843, 'bull_rsi_os': 9, 'bull_rsi_ob': 87, 'bull_adx_thresh': 29.16872081454138, 'bull_atr_min_pct': 0.016087679129161717, 'bull_atr_max_pct': 0.08861553125382711, 'bull_tp_mult': 2.6749766157486508, 'bull_tsl_mult': 0.9176199232901675, 'bull_time_stop': 36, 'bull_use_sma': True, 'bull_use_ema': False, 'bull_use_atr': True, 'bull_use_adx': False, 'bull_use_spike': True, 'bull_rsi_required': False, 'bear_strategy': 'breakout', 'bear_bb_std_mult': 3.5310330140378996, 'bear_rsi_os': 7, 'bear_rsi_ob': 61, 'bear_adx_thresh': 8.321822659290238, 'bear_atr_min_pct': 0.0057040182305994995, 'bear_atr_max_pct': 0.04732188775692638, 'bear_tp_mult': 1.583823964235516, 'bear_tsl_mult': 0.5450263663048778, 'bear_time_stop': 31, 'bear_use_sma': True, 'bear_use_ema': True, 'bear_use_atr': False, 'bear_use_adx': True, 'bear_use_spike': True, 'bear_rsi_required': False, 'sideways_strategy': 'breakout', 'sideways_bb_std_mult': 2.29149142583085, 'sideways_rsi_os': 19, 'sideways_rsi_ob': 77, 'sideways_adx_thresh': 34.41849016531925, 'sideways_atr_min_pct': 0.005921958241706005, 'sideways_atr_max_pct': 0.10874535453602047, 'sideways_tp_mult': 1.0462917681092294, 'sideways_tsl_mult': 0.7303142722245359, 'sideways_time_stop': 183, 'sideways_use_sma': False, 'sideways_use_ema': False, 'sideways_use_atr': False, 'sideways_use_adx': True, 'sideways_use_spike': False, 'sideways_rsi_required': False}.
[I 2025-08-29 20:56:10,221] Trial 687 finished with values: [-0.003875895919384087, 0.003849585501507889] and parameters: {'p_sma': 43, 'p_std': 35, 'p_atr': 11, 'p_adx': 12, 'rsi_period': 35, 'ema1': 16, 'ema2': 47, 'slip_atr_k': 0.13053546321266374, 'slip_spread_k': 0.627821054168355, 'spread_hl_frac': 0.04536800157258709, 'bb_std_mult': 3.449077412522556, 'rsi_os': 28, 'rsi_ob': 82, 'vol_spike': 0.1845264039756733, 'adx_thresh': 16.72170346435071, 'atr_min_pct': 0.023912747237613406, 'atr_max_pct': 0.0316903090214622, 'tp_mult': 1.4750786757556038, 'tsl_mult': 0.1845213564760243, 'strategy': 'mean_reversion', 'time_stop': 168, 'use_sma': True, 'use_atr': False, 'use_adx': False, 'use_ema': True, 'use_spike': False, 'rsi_required': False, 'edge_k': 1.9958055231223488, 'edge_cap': 0.6156896984692181, 'bull_strategy': 'mean_reversion', 'bull_bb_std_mult': 3.16167609140592, 'bull_rsi_os': 21, 'bull_rsi_ob': 89, 'bull_adx_thresh': 13.782130342100718, 'bull_atr_min_pct': 0.01617344751965386, 'bull_atr_max_pct': 0.09913215810810948, 'bull_tp_mult': 1.9224243072002885, 'bull_tsl_mult': 0.5941696741504696, 'bull_time_stop': 5, 'bull_use_sma': True, 'bull_use_ema': False, 'bull_use_atr': True, 'bull_use_adx': False, 'bull_use_spike': True, 'bull_rsi_required': False, 'bear_strategy': 'breakout', 'bear_bb_std_mult': 2.4913125117597676, 'bear_rsi_os': 27, 'bear_rsi_ob': 68, 'bear_adx_thresh': 22.304863799788468, 'bear_atr_min_pct': 0.02931622914215776, 'bear_atr_max_pct': 0.13673378810884151, 'bear_tp_mult': 2.707461858847576, 'bear_tsl_mult': 0.5349708281985702, 'bear_time_stop': 29, 'bear_use_sma': True, 'bear_use_ema': True, 'bear_use_atr': False, 'bear_use_adx': True, 'bear_use_spike': True, 'bear_rsi_required': False, 'sideways_strategy': 'breakout', 'sideways_bb_std_mult': 2.4676346264206934, 'sideways_rsi_os': 46, 'sideways_rsi_ob': 45, 'sideways_adx_thresh': 11.221088550909732, 'sideways_atr_min_pct': 0.005937559144367286, 'sideways_atr_max_pct': 0.029003753080072088, 'sideways_tp_mult': 1.043203564172492, 'sideways_tsl_mult': 0.5637957314972458, 'sideways_time_stop': 184, 'sideways_use_sma': False, 'sideways_use_ema': False, 'sideways_use_atr': False, 'sideways_use_adx': True, 'sideways_use_spike': False, 'sideways_rsi_required': False}.
[I 2025-08-29 20:56:38,707] Trial 688 finished with values: [-0.013079223261645678, 0.013069858203230414] and parameters: {'p_sma': 19, 'p_std': 35, 'p_atr': 24, 'p_adx': 20, 'rsi_period': 53, 'ema1': 25, 'ema2': 45, 'slip_atr_k': 0.12945662938524147, 'slip_spread_k': 0.15595298749643724, 'spread_hl_frac': 0.046083625270509555, 'bb_std_mult': 1.5422674793616933, 'rsi_os': 9, 'rsi_ob': 59, 'vol_spike': 0.018950829554251758, 'adx_thresh': 10.903485822594682, 'atr_min_pct': 0.010895604044224155, 'atr_max_pct': 0.03178468842913445, 'tp_mult': 1.324735545908692, 'tsl_mult': 0.8948508266171995, 'strategy': 'mean_reversion', 'time_stop': 171, 'use_sma': True, 'use_atr': False, 'use_adx': False, 'use_ema': True, 'use_spike': False, 'rsi_required': False, 'edge_k': 1.199891812761604, 'edge_cap': 0.6154928561056223, 'bull_strategy': 'mean_reversion', 'bull_bb_std_mult': 3.10152673594794, 'bull_rsi_os': 21, 'bull_rsi_ob': 75, 'bull_adx_thresh': 13.763117145943333, 'bull_atr_min_pct': 0.01649131011804816, 'bull_atr_max_pct': 0.06500903330214583, 'bull_tp_mult': 2.691641877869367, 'bull_tsl_mult': 0.9445575439615974, 'bull_time_stop': 149, 'bull_use_sma': True, 'bull_use_ema': False, 'bull_use_atr': True, 'bull_use_adx': False, 'bull_use_spike': True, 'bull_rsi_required': False, 'bear_strategy': 'breakout', 'bear_bb_std_mult': 2.4443812186555762, 'bear_rsi_os': 44, 'bear_rsi_ob': 66, 'bear_adx_thresh': 22.143260098444777, 'bear_atr_min_pct': 0.004259293361658751, 'bear_atr_max_pct': 0.13813375637583647, 'bear_tp_mult': 2.5698507081230324, 'bear_tsl_mult': 0.9833481157322693, 'bear_time_stop': 29, 'bear_use_sma': False, 'bear_use_ema': True, 'bear_use_atr': True, 'bear_use_adx': True, 'bear_use_spike': True, 'bear_rsi_required': False, 'sideways_strategy': 'breakout', 'sideways_bb_std_mult': 2.290714845899457, 'sideways_rsi_os': 47, 'sideways_rsi_ob': 74, 'sideways_adx_thresh': 16.79779398483853, 'sideways_atr_min_pct': 0.007759842351658955, 'sideways_atr_max_pct': 0.02757051353918781, 'sideways_tp_mult': 1.0136476972793167, 'sideways_tsl_mult': 0.30215514576523883, 'sideways_time_stop': 196, 'sideways_use_sma': False, 'sideways_use_ema': False, 'sideways_use_atr': False, 'sideways_use_adx': True, 'sideways_use_spike': False, 'sideways_rsi_required': False}.
[I 2025-08-29 20:56:39,253] Trial 689 finished with values: [-1000000000.0, 1000000000.0] and parameters: {'p_sma': 8, 'p_std': 58, 'p_atr': 24, 'p_adx': 24, 'rsi_period': 8, 'ema1': 25, 'ema2': 45, 'slip_atr_k': 0.011516343398127474, 'slip_spread_k': 0.6244132219133582, 'spread_hl_frac': 0.04901293984368215, 'bb_std_mult': 2.4359819642902734, 'rsi_os': 28, 'rsi_ob': 87, 'vol_spike': 0.1864591814012304, 'adx_thresh': 28.292870172581793, 'atr_min_pct': 0.01941412605616986, 'atr_max_pct': 0.06588588547416205, 'tp_mult': 1.4686017911476088, 'tsl_mult': 0.03568417656172285, 'strategy': 'mean_reversion', 'time_stop': 170, 'use_sma': True, 'use_atr': False, 'use_adx': False, 'use_ema': True, 'use_spike': False, 'rsi_required': False, 'edge_k': 1.09773349804503, 'edge_cap': 0.24372341654789664, 'bull_strategy': 'mean_reversion', 'bull_bb_std_mult': 2.936783032496431, 'bull_rsi_os': 20, 'bull_rsi_ob': 86, 'bull_adx_thresh': 13.856099013957197, 'bull_atr_min_pct': 0.01621812244625618, 'bull_atr_max_pct': 0.04191835877894045, 'bull_tp_mult': 1.3301954798676885, 'bull_tsl_mult': 0.21689741512591026, 'bull_time_stop': 34, 'bull_use_sma': True, 'bull_use_ema': False, 'bull_use_atr': True, 'bull_use_adx': False, 'bull_use_spike': True, 'bull_rsi_required': False, 'bear_strategy': 'breakout', 'bear_bb_std_mult': 2.450089900683091, 'bear_rsi_os': 22, 'bear_rsi_ob': 47, 'bear_adx_thresh': 20.35207513139056, 'bear_atr_min_pct': 0.006785105100847605, 'bear_atr_max_pct': 0.04695104984852021, 'bear_tp_mult': 2.7971747800086275, 'bear_tsl_mult': 0.9096415789937906, 'bear_time_stop': 61, 'bear_use_sma': True, 'bear_use_ema': True, 'bear_use_atr': True, 'bear_use_adx': True, 'bear_use_spike': True, 'bear_rsi_required': False, 'sideways_strategy': 'breakout', 'sideways_bb_std_mult': 2.2924114111428615, 'sideways_rsi_os': 13, 'sideways_rsi_ob': 77, 'sideways_adx_thresh': 30.84818340795612, 'sideways_atr_min_pct': 0.005349162000798199, 'sideways_atr_max_pct': 0.03950309077637449, 'sideways_tp_mult': 2.8861048440171313, 'sideways_tsl_mult': 0.29922003495122396, 'sideways_time_stop': 198, 'sideways_use_sma': False, 'sideways_use_ema': True, 'sideways_use_atr': False, 'sideways_use_adx': False, 'sideways_use_spike': False, 'sideways_rsi_required': False}.
[I 2025-08-29 20:56:39,525] Trial 690 finished with values: [-0.004623495533978894, 0.004579327158385242] and parameters: {'p_sma': 27, 'p_std': 54, 'p_atr': 27, 'p_adx': 14, 'rsi_period': 41, 'ema1': 5, 'ema2': 45, 'slip_atr_k': 0.011341377201882311, 'slip_spread_k': 0.37907171918756805, 'spread_hl_frac': 0.04888563383029525, 'bb_std_mult': 1.561091774885607, 'rsi_os': 33, 'rsi_ob': 59, 'vol_spike': 0.04743390893266146, 'adx_thresh': 15.266383259695765, 'atr_min_pct': 0.01940531003431092, 'atr_max_pct': 0.10460647532739993, 'tp_mult': 1.3325939421540949, 'tsl_mult': 0.902321045874558, 'strategy': 'mean_reversion', 'time_stop': 32, 'use_sma': True, 'use_atr': False, 'use_adx': True, 'use_ema': False, 'use_spike': True, 'rsi_required': False, 'edge_k': 1.1995523059925772, 'edge_cap': 0.5650832034309039, 'bull_strategy': 'mean_reversion', 'bull_bb_std_mult': 2.9407291431456564, 'bull_rsi_os': 32, 'bull_rsi_ob': 83, 'bull_adx_thresh': 13.787892614417188, 'bull_atr_min_pct': 0.008009426860278498, 'bull_atr_max_pct': 0.09620789944724185, 'bull_tp_mult': 1.6404083866950652, 'bull_tsl_mult': 0.5290404691146431, 'bull_time_stop': 102, 'bull_use_sma': True, 'bull_use_ema': True, 'bull_use_atr': True, 'bull_use_adx': False, 'bull_use_spike': False, 'bull_rsi_required': False, 'bear_strategy': 'breakout', 'bear_bb_std_mult': 3.15913112667855, 'bear_rsi_os': 37, 'bear_rsi_ob': 66, 'bear_adx_thresh': 21.233621260179763, 'bear_atr_min_pct': 0.004456034301571387, 'bear_atr_max_pct': 0.04446497767887171, 'bear_tp_mult': 1.2280656613855423, 'bear_tsl_mult': 0.7226202312141243, 'bear_time_stop': 62, 'bear_use_sma': False, 'bear_use_ema': True, 'bear_use_atr': True, 'bear_use_adx': False, 'bear_use_spike': True, 'bear_rsi_required': False, 'sideways_strategy': 'mean_reversion', 'sideways_bb_std_mult': 2.3345443313799676, 'sideways_rsi_os': 7, 'sideways_rsi_ob': 75, 'sideways_adx_thresh': 20.582472790449163, 'sideways_atr_min_pct': 0.0048903263418714725, 'sideways_atr_max_pct': 0.027197644022866695, 'sideways_tp_mult': 2.383830412349016, 'sideways_tsl_mult': 0.3091168182715811, 'sideways_time_stop': 195, 'sideways_use_sma': False, 'sideways_use_ema': True, 'sideways_use_atr': False, 'sideways_use_adx': False, 'sideways_use_spike': False, 'sideways_rsi_required': True}.
[I 2025-08-29 20:56:39,585] Trial 691 finished with values: [0.0008074407075047141, 0.0007631899444332243] and parameters: {'p_sma': 34, 'p_std': 58, 'p_atr': 27, 'p_adx': 15, 'rsi_period': 41, 'ema1': 13, 'ema2': 45, 'slip_atr_k': 0.008703992810744979, 'slip_spread_k': 0.1907403266265828, 'spread_hl_frac': 0.04912154422611741, 'bb_std_mult': 1.5619860970378687, 'rsi_os': 7, 'rsi_ob': 59, 'vol_spike': 0.010327090642692383, 'adx_thresh': 18.79678606856545, 'atr_min_pct': 0.019471554651621963, 'atr_max_pct': 0.12676693237414008, 'tp_mult': 2.7322599059030708, 'tsl_mult': 0.8945665038403943, 'strategy': 'mean_reversion', 'time_stop': 31, 'use_sma': True, 'use_atr': False, 'use_adx': True, 'use_ema': False, 'use_spike': True, 'rsi_required': False, 'edge_k': 1.1895608711955874, 'edge_cap': 0.5924136283810212, 'bull_strategy': 'mean_reversion', 'bull_bb_std_mult': 2.9209248046054985, 'bull_rsi_os': 25, 'bull_rsi_ob': 91, 'bull_adx_thresh': 15.898563345065556, 'bull_atr_min_pct': 0.016646524852169484, 'bull_atr_max_pct': 0.0961937864225207, 'bull_tp_mult': 2.628254762205808, 'bull_tsl_mult': 0.9383792118051049, 'bull_time_stop': 23, 'bull_use_sma': True, 'bull_use_ema': True, 'bull_use_atr': True, 'bull_use_adx': False, 'bull_use_spike': False, 'bull_rsi_required': False, 'bear_strategy': 'breakout', 'bear_bb_std_mult': 3.1660266360533473, 'bear_rsi_os': 27, 'bear_rsi_ob': 66, 'bear_adx_thresh': 20.409476822524102, 'bear_atr_min_pct': 0.0041199811245816904, 'bear_atr_max_pct': 0.02294413658998109, 'bear_tp_mult': 2.615894947748025, 'bear_tsl_mult': 0.08552308763794914, 'bear_time_stop': 269, 'bear_use_sma': False, 'bear_use_ema': True, 'bear_use_atr': True, 'bear_use_adx': False, 'bear_use_spike': True, 'bear_rsi_required': False, 'sideways_strategy': 'mean_reversion', 'sideways_bb_std_mult': 2.320281532809218, 'sideways_rsi_os': 23, 'sideways_rsi_ob': 75, 'sideways_adx_thresh': 30.91662688027848, 'sideways_atr_min_pct': 0.007619759025730689, 'sideways_atr_max_pct': 0.02627907918643292, 'sideways_tp_mult': 1.5798836077689604, 'sideways_tsl_mult': 0.8087382676987331, 'sideways_time_stop': 195, 'sideways_use_sma': False, 'sideways_use_ema': True, 'sideways_use_atr': False, 'sideways_use_adx': False, 'sideways_use_spike': False, 'sideways_rsi_required': True}.
[I 2025-08-29 20:56:40,278] Trial 695 finished with values: [-1000000000.0, 1000000000.0] and parameters: {'p_sma': 29, 'p_std': 56, 'p_atr': 7, 'p_adx': 13, 'rsi_period': 37, 'ema1': 24, 'ema2': 21, 'slip_atr_k': 0.2272956083415852, 'slip_spread_k': 0.1967983654926309, 'spread_hl_frac': 0.008447937495020291, 'bb_std_mult': 1.7994901874950113, 'rsi_os': 7, 'rsi_ob': 83, 'vol_spike': 0.1703463151823045, 'adx_thresh': 13.51075641915659, 'atr_min_pct': 0.020202489911026574, 'atr_max_pct': 0.019578876386804875, 'tp_mult': 2.83703450672255, 'tsl_mult': 0.9289564248838931, 'strategy': 'breakout', 'time_stop': 251, 'use_sma': True, 'use_atr': True, 'use_adx': True, 'use_ema': False, 'use_spike': True, 'rsi_required': False, 'edge_k': 0.8932609524358592, 'edge_cap': 0.5906845113404648, 'bull_strategy': 'mean_reversion', 'bull_bb_std_mult': 1.0946437041750352, 'bull_rsi_os': 13, 'bull_rsi_ob': 71, 'bull_adx_thresh': 15.484585843366613, 'bull_atr_min_pct': 0.014905911693190395, 'bull_atr_max_pct': 0.07744020871951429, 'bull_tp_mult': 2.6996604271667795, 'bull_tsl_mult': 0.9340012356395873, 'bull_time_stop': 293, 'bull_use_sma': True, 'bull_use_ema': True, 'bull_use_atr': False, 'bull_use_adx': True, 'bull_use_spike': False, 'bull_rsi_required': True, 'bear_strategy': 'mean_reversion', 'bear_bb_std_mult': 2.6738822616025297, 'bear_rsi_os': 27, 'bear_rsi_ob': 64, 'bear_adx_thresh': 17.782446758076567, 'bear_atr_min_pct': 0.024312200020656934, 'bear_atr_max_pct': 0.06346501497153667, 'bear_tp_mult': 2.64823455269131, 'bear_tsl_mult': 0.939125226118623, 'bear_time_stop': 40, 'bear_use_sma': False, 'bear_use_ema': False, 'bear_use_atr': False, 'bear_use_adx': False, 'bear_use_spike': True, 'bear_rsi_required': True, 'sideways_strategy': 'mean_reversion', 'sideways_bb_std_mult': 2.181774816229085, 'sideways_rsi_os': 50, 'sideways_rsi_ob': 83, 'sideways_adx_thresh': 32.06261512196496, 'sideways_atr_min_pct': 0.023491219854547475, 'sideways_atr_max_pct': 0.01894612256643656, 'sideways_tp_mult': 1.1493671413372448, 'sideways_tsl_mult': 0.04710990241613855, 'sideways_time_stop': 154, 'sideways_use_sma': True, 'sideways_use_ema': False, 'sideways_use_atr': True, 'sideways_use_adx': False, 'sideways_use_spike': False, 'sideways_rsi_required': True}.
