[I 2025-08-29 20:51:06,814] Trial 642 finished with values: [-1000000000.0, 1000000000.0] and parameters: {'p_sma': 46, 'p_std': 55, 'p_atr': 17, 'p_adx': 13, 'rsi_period': 45, 'ema1': 10, 'ema2': 47, 'slip_atr_k': 0.010358016103365177, 'slip_spread_k': 0.6401248271821128, 'spread_hl_frac': 0.04827495343944467, 'bb_std_mult': 3.3150607598261255, 'rsi_os': 39, 'rsi_ob': 54, 'vol_spike': 0.17155238363841566, 'adx_thresh': 10.978872602584092, 'atr_min_pct': 0.022046266236861567, 'atr_max_pct': 0.07076208522230917, 'tp_mult': 2.6878028639469553, 'tsl_mult': 0.9040243059825032, 'strategy': 'mean_reversion', 'time_stop': 154, 'use_sma': False, 'use_atr': False, 'use_adx': False, 'use_ema': False, 'use_spike': False, 'rsi_required': True, 'edge_k': 1.061913052888891, 'edge_cap': 0.9401011746757066, 'bull_strategy': 'breakout', 'bull_bb_std_mult': 3.085703828468193, 'bull_rsi_os': 21, 'bull_rsi_ob': 71, 'bull_adx_thresh': 15.111951514556214, 'bull_atr_min_pct': 0.020738828902639655, 'bull_atr_max_pct': 0.09343303700003742, 'bull_tp_mult': 1.1311806608764794, 'bull_tsl_mult': 0.869087520229154, 'bull_time_stop': 245, 'bull_use_sma': False, 'bull_use_ema': False, 'bull_use_atr': True, 'bull_use_adx': True, 'bull_use_spike': True, 'bull_rsi_required': True, 'bear_strategy': 'breakout', 'bear_bb_std_mult': 1.5451999621027142, 'bear_rsi_os': 27, 'bear_rsi_ob': 88, 'bear_adx_thresh': 13.726394447401693, 'bear_atr_min_pct': 0.025533401766801966, 'bear_atr_max_pct': 0.054456044980126274, 'bear_tp_mult': 2.5630889036776816, 'bear_tsl_mult': 0.9239090145169466, 'bear_time_stop': 189, 'bear_use_sma': False, 'bear_use_ema': False, 'bear_use_atr': True, 'bear_use_adx': False, 'bear_use_spike': False, 'bear_rsi_required': False, 'sideways_strategy': 'mean_reversion', 'sideways_bb_std_mult': 1.50878507029655, 'sideways_rsi_os': 37, 'sideways_rsi_ob': 50, 'sideways_adx_thresh': 33.33004452625133, 'sideways_atr_min_pct': 0.022744349329825417, 'sideways_atr_max_pct': 0.02521885389600539, 'sideways_tp_mult': 1.1229071196950768, 'sideways_tsl_mult': 0.6925538156025526, 'sideways_time_stop': 195, 'sideways_use_sma': True, 'sideways_use_ema': False, 'sideways_use_atr': False, 'sideways_use_adx': True, 'sideways_use_spike': True, 'sideways_rsi_required': True}.
[I 2025-08-29 20:51:07,899] Trial 640 finished with values: [-1000000000.0, 1000000000.0] and parameters: {'p_sma': 21, 'p_std': 55, 'p_atr': 27, 'p_adx': 13, 'rsi_period': 26, 'ema1': 27, 'ema2': 11, 'slip_atr_k': 0.011461285700639373, 'slip_spread_k': 0.1621158804392511, 'spread_hl_frac': 0.0499947645414082, 'bb_std_mult': 1.6029428093060527, 'rsi_os': 12, 'rsi_ob': 84, 'vol_spike': 0.2734062691687412, 'adx_thresh': 13.28800943387465, 'atr_min_pct': 0.02092604973579102, 'atr_max_pct': 0.03627487947416518, 'tp_mult': 1.3296305582444847, 'tsl_mult': 0.898701137836238, 'strategy': 'mean_reversion', 'time_stop': 154, 'use_sma': False, 'use_atr': False, 'use_adx': True, 'use_ema': False, 'use_spike': False, 'rsi_required': True, 'edge_k': 1.0491399409227435, 'edge_cap': 0.26201004216929286, 'bull_strategy': 'breakout', 'bull_bb_std_mult': 1.135075955232155, 'bull_rsi_os': 25, 'bull_rsi_ob': 71, 'bull_adx_thresh': 11.546379133954408, 'bull_atr_min_pct': 0.01531877174021081, 'bull_atr_max_pct': 0.09391188151206901, 'bull_tp_mult': 2.570528078152711, 'bull_tsl_mult': 0.022567780054351838, 'bull_time_stop': 23, 'bull_use_sma': False, 'bull_use_ema': False, 'bull_use_atr': True, 'bull_use_adx': True, 'bull_use_spike': False, 'bull_rsi_required': True, 'bear_strategy': 'breakout', 'bear_bb_std_mult': 2.6249123029891823, 'bear_rsi_os': 32, 'bear_rsi_ob': 60, 'bear_adx_thresh': 21.692423359209492, 'bear_atr_min_pct': 0.010546704203214512, 'bear_atr_max_pct': 0.04325188181153773, 'bear_tp_mult': 2.760373989753928, 'bear_tsl_mult': 0.22310105225505822, 'bear_time_stop': 58, 'bear_use_sma': False, 'bear_use_ema': False, 'bear_use_atr': True, 'bear_use_adx': False, 'bear_use_spike': False, 'bear_rsi_required': False, 'sideways_strategy': 'mean_reversion', 'sideways_bb_std_mult': 2.5380522260446217, 'sideways_rsi_os': 46, 'sideways_rsi_ob': 82, 'sideways_adx_thresh': 33.43336315649286, 'sideways_atr_min_pct': 0.000892798159631036, 'sideways_atr_max_pct': 0.02156289832203203, 'sideways_tp_mult': 2.336369805563462, 'sideways_tsl_mult': 0.944814251835985, 'sideways_time_stop': 178, 'sideways_use_sma': True, 'sideways_use_ema': True, 'sideways_use_atr': False, 'sideways_use_adx': False, 'sideways_use_spike': True, 'sideways_rsi_required': False}.
[I 2025-08-29 20:51:08,016] Trial 641 finished with values: [-0.03816605961373609, 0.038179921680061506] and parameters: {'p_sma': 18, 'p_std': 10, 'p_atr': 27, 'p_adx': 13, 'rsi_period': 26, 'ema1': 25, 'ema2': 33, 'slip_atr_k': 0.009731571255010509, 'slip_spread_k': 0.12836283676524207, 'spread_hl_frac': 0.009825164769831042, 'bb_std_mult': 1.632191017783689, 'rsi_os': 12, 'rsi_ob': 84, 'vol_spike': 0.29467262624162616, 'adx_thresh': 12.975337188175914, 'atr_min_pct': 0.022054767707364167, 'atr_max_pct': 0.037909425800399243, 'tp_mult': 1.3174045182683924, 'tsl_mult': 0.8999090799890189, 'strategy': 'mean_reversion', 'time_stop': 186, 'use_sma': False, 'use_atr': False, 'use_adx': False, 'use_ema': False, 'use_spike': False, 'rsi_required': True, 'edge_k': 0.986425971361941, 'edge_cap': 0.6013134225556629, 'bull_strategy': 'breakout', 'bull_bb_std_mult': 3.1257310517302948, 'bull_rsi_os': 47, 'bull_rsi_ob': 72, 'bull_adx_thresh': 14.962391004270188, 'bull_atr_min_pct': 0.026994832288703426, 'bull_atr_max_pct': 0.0937923927765139, 'bull_tp_mult': 2.0086863113709157, 'bull_tsl_mult': 0.8926676019510242, 'bull_time_stop': 24, 'bull_use_sma': False, 'bull_use_ema': False, 'bull_use_atr': True, 'bull_use_adx': True, 'bull_use_spike': True, 'bull_rsi_required': True, 'bear_strategy': 'breakout', 'bear_bb_std_mult': 1.4541250187766783, 'bear_rsi_os': 32, 'bear_rsi_ob': 60, 'bear_adx_thresh': 13.867824237929078, 'bear_atr_min_pct': 0.000945161087584731, 'bear_atr_max_pct': 0.04304545893497149, 'bear_tp_mult': 2.7565226865648893, 'bear_tsl_mult': 0.9285245567771865, 'bear_time_stop': 59, 'bear_use_sma': False, 'bear_use_ema': False, 'bear_use_atr': True, 'bear_use_adx': False, 'bear_use_spike': False, 'bear_rsi_required': False, 'sideways_strategy': 'mean_reversion', 'sideways_bb_std_mult': 2.547725160992842, 'sideways_rsi_os': 48, 'sideways_rsi_ob': 81, 'sideways_adx_thresh': 10.330811056550756, 'sideways_atr_min_pct': 0.02756237161269015, 'sideways_atr_max_pct': 0.014402128630299984, 'sideways_tp_mult': 2.0342125466631633, 'sideways_tsl_mult': 0.004273906630605784, 'sideways_time_stop': 197, 'sideways_use_sma': True, 'sideways_use_ema': True, 'sideways_use_atr': False, 'sideways_use_adx': False, 'sideways_use_spike': True, 'sideways_rsi_required': True}.
[I 2025-08-29 20:51:08,142] Trial 639 finished with values: [-1000000000.0, 0.13169531753525135] and parameters: {'p_sma': 20, 'p_std': 55, 'p_atr': 26, 'p_adx': 9, 'rsi_period': 26, 'ema1': 10, 'ema2': 33, 'slip_atr_k': 0.2048498840780732, 'slip_spread_k': 0.15572590609422815, 'spread_hl_frac': 0.010127723297321334, 'bb_std_mult': 3.2806511177513715, 'rsi_os': 12, 'rsi_ob': 78, 'vol_spike': 0.17316314723094386, 'adx_thresh': 6.565237738723267, 'atr_min_pct': 0.022012450432739993, 'atr_max_pct': 0.060566364084303784, 'tp_mult': 1.3324727546031339, 'tsl_mult': 0.9046367432258517, 'strategy': 'mean_reversion', 'time_stop': 174, 'use_sma': False, 'use_atr': False, 'use_adx': False, 'use_ema': True, 'use_spike': False, 'rsi_required': True, 'edge_k': 1.0625504685695302, 'edge_cap': 0.6014606754598117, 'bull_strategy': 'breakout', 'bull_bb_std_mult': 3.0126198046518904, 'bull_rsi_os': 16, 'bull_rsi_ob': 71, 'bull_adx_thresh': 9.912002210224088, 'bull_atr_min_pct': 0.016283686747641735, 'bull_atr_max_pct': 0.09396149554797249, 'bull_tp_mult': 2.93914739516224, 'bull_tsl_mult': 0.46946133023204667, 'bull_time_stop': 23, 'bull_use_sma': False, 'bull_use_ema': False, 'bull_use_atr': True, 'bull_use_adx': True, 'bull_use_spike': True, 'bull_rsi_required': True, 'bear_strategy': 'breakout', 'bear_bb_std_mult': 0.9406149507710744, 'bear_rsi_os': 28, 'bear_rsi_ob': 60, 'bear_adx_thresh': 13.631428265833751, 'bear_atr_min_pct': 0.02236014459863295, 'bear_atr_max_pct': 0.042880506422121885, 'bear_tp_mult': 2.6816641602818763, 'bear_tsl_mult': 0.2262307868330904, 'bear_time_stop': 57, 'bear_use_sma': False, 'bear_use_ema': False, 'bear_use_atr': True, 'bear_use_adx': True, 'bear_use_spike': False, 'bear_rsi_required': False, 'sideways_strategy': 'breakout', 'sideways_bb_std_mult': 2.555049616432967, 'sideways_rsi_os': 48, 'sideways_rsi_ob': 82, 'sideways_adx_thresh': 32.49258132950999, 'sideways_atr_min_pct': 0.0007574196771892375, 'sideways_atr_max_pct': 0.03621167925658223, 'sideways_tp_mult': 1.1239879252701044, 'sideways_tsl_mult': 0.7368148026033908, 'sideways_time_stop': 53, 'sideways_use_sma': False, 'sideways_use_ema': True, 'sideways_use_atr': False, 'sideways_use_adx': False, 'sideways_use_spike': True, 'sideways_rsi_required': False}.
[I 2025-08-29 20:51:37,655] Trial 646 finished with values: [-1000000000.0, 1000000000.0] and parameters: {'p_sma': 9, 'p_std': 59, 'p_atr': 9, 'p_adx': 12, 'rsi_period': 35, 'ema1': 26, 'ema2': 18, 'slip_atr_k': 0.0037950490361223746, 'slip_spread_k': 0.23891881227382253, 'spread_hl_frac': 0.03886040243085519, 'bb_std_mult': 1.5317250634597688, 'rsi_os': 10, 'rsi_ob': 88, 'vol_spike': 0.18004666401243355, 'adx_thresh': 15.825641130407439, 'atr_min_pct': 0.026197368998602897, 'atr_max_pct': 0.031999296864791034, 'tp_mult': 1.5235144499109505, 'tsl_mult': 0.8537967099891236, 'strategy': 'breakout', 'time_stop': 11, 'use_sma': True, 'use_atr': True, 'use_adx': False, 'use_ema': True, 'use_spike': False, 'rsi_required': False, 'edge_k': 1.1666123182572146, 'edge_cap': 0.6362207641012546, 'bull_strategy': 'mean_reversion', 'bull_bb_std_mult': 2.9117019632633157, 'bull_rsi_os': 12, 'bull_rsi_ob': 74, 'bull_adx_thresh': 31.09149602960906, 'bull_atr_min_pct': 0.007323946317644683, 'bull_atr_max_pct': 0.10271515500272438, 'bull_tp_mult': 2.661624345710751, 'bull_tsl_mult': 0.9018299858258434, 'bull_time_stop': 10, 'bull_use_sma': True, 'bull_use_ema': False, 'bull_use_atr': True, 'bull_use_adx': False, 'bull_use_spike': True, 'bull_rsi_required': False, 'bear_strategy': 'mean_reversion', 'bear_bb_std_mult': 3.45698366416515, 'bear_rsi_os': 29, 'bear_rsi_ob': 69, 'bear_adx_thresh': 16.45161500518455, 'bear_atr_min_pct': 0.004065542611741584, 'bear_atr_max_pct': 0.14322603015977875, 'bear_tp_mult': 1.6532737184548831, 'bear_tsl_mult': 0.15958662296373738, 'bear_time_stop': 33, 'bear_use_sma': True, 'bear_use_ema': True, 'bear_use_atr': False, 'bear_use_adx': True, 'bear_use_spike': True, 'bear_rsi_required': True, 'sideways_strategy': 'breakout', 'sideways_bb_std_mult': 0.9408637983920296, 'sideways_rsi_os': 47, 'sideways_rsi_ob': 79, 'sideways_adx_thresh': 14.84430140878976, 'sideways_atr_min_pct': 0.02828140824378257, 'sideways_atr_max_pct': 0.031065778433408985, 'sideways_tp_mult': 2.529893152795651, 'sideways_tsl_mult': 0.7202094423872788, 'sideways_time_stop': 105, 'sideways_use_sma': False, 'sideways_use_ema': False, 'sideways_use_atr': False, 'sideways_use_adx': True, 'sideways_use_spike': False, 'sideways_rsi_required': False}.
[I 2025-08-29 20:51:37,899] Trial 645 finished with values: [-1000000000.0, 1000000000.0] and parameters: {'p_sma': 22, 'p_std': 55, 'p_atr': 26, 'p_adx': 12, 'rsi_period': 35, 'ema1': 28, 'ema2': 52, 'slip_atr_k': 0.004747629764001229, 'slip_spread_k': 0.2379140350734935, 'spread_hl_frac': 0.027090518284990133, 'bb_std_mult': 1.5195357281230748, 'rsi_os': 8, 'rsi_ob': 60, 'vol_spike': 0.22407406073353478, 'adx_thresh': 6.347583810539218, 'atr_min_pct': 0.018335221570117327, 'atr_max_pct': 0.031628732938151986, 'tp_mult': 2.957697272060267, 'tsl_mult': 0.8637708941794442, 'strategy': 'breakout', 'time_stop': 161, 'use_sma': True, 'use_atr': True, 'use_adx': False, 'use_ema': True, 'use_spike': False, 'rsi_required': False, 'edge_k': 1.1738592214463452, 'edge_cap': 0.6335384648862563, 'bull_strategy': 'mean_reversion', 'bull_bb_std_mult': 3.2449478034891763, 'bull_rsi_os': 14, 'bull_rsi_ob': 74, 'bull_adx_thresh': 28.778178494167012, 'bull_atr_min_pct': 0.016165183307623926, 'bull_atr_max_pct': 0.06912126810494516, 'bull_tp_mult': 2.7691735882955837, 'bull_tsl_mult': 0.4741431238215278, 'bull_time_stop': 48, 'bull_use_sma': True, 'bull_use_ema': False, 'bull_use_atr': True, 'bull_use_adx': False, 'bull_use_spike': True, 'bull_rsi_required': False, 'bear_strategy': 'mean_reversion', 'bear_bb_std_mult': 2.3585921945182604, 'bear_rsi_os': 38, 'bear_rsi_ob': 76, 'bear_adx_thresh': 21.109760006963892, 'bear_atr_min_pct': 3.4204246121077864e-05, 'bear_atr_max_pct': 0.14394786238196183, 'bear_tp_mult': 1.420847261384656, 'bear_tsl_mult': 0.885463960735667, 'bear_time_stop': 242, 'bear_use_sma': True, 'bear_use_ema': True, 'bear_use_atr': False, 'bear_use_adx': True, 'bear_use_spike': True, 'bear_rsi_required': True, 'sideways_strategy': 'breakout', 'sideways_bb_std_mult': 2.2670986550026293, 'sideways_rsi_os': 28, 'sideways_rsi_ob': 79, 'sideways_adx_thresh': 28.109832584648167, 'sideways_atr_min_pct': 0.02054202964123985, 'sideways_atr_max_pct': 0.0156009109486123, 'sideways_tp_mult': 1.0837844687868599, 'sideways_tsl_mult': 0.668378796845251, 'sideways_time_stop': 184, 'sideways_use_sma': False, 'sideways_use_ema': False, 'sideways_use_atr': False, 'sideways_use_adx': False, 'sideways_use_spike': False, 'sideways_rsi_required': False}.
[I 2025-08-29 20:51:37,900] Trial 644 finished with values: [-1000000000.0, 1000000000.0] and parameters: {'p_sma': 18, 'p_std': 59, 'p_atr': 7, 'p_adx': 12, 'rsi_period': 17, 'ema1': 28, 'ema2': 57, 'slip_atr_k': 0.20526330433522025, 'slip_spread_k': 0.24108276512248394, 'spread_hl_frac': 0.00990633125581268, 'bb_std_mult': 3.5883735936568115, 'rsi_os': 8, 'rsi_ob': 88, 'vol_spike': 0.1797946552061231, 'adx_thresh': 13.515921557383807, 'atr_min_pct': 0.018788930030815096, 'atr_max_pct': 0.061463721125909185, 'tp_mult': 2.862920849764199, 'tsl_mult': 0.8580415362559906, 'strategy': 'breakout', 'time_stop': 90, 'use_sma': True, 'use_atr': True, 'use_adx': False, 'use_ema': True, 'use_spike': False, 'rsi_required': False, 'edge_k': 1.0839818772939915, 'edge_cap': 0.5987807691088157, 'bull_strategy': 'mean_reversion', 'bull_bb_std_mult': 2.9028030287759017, 'bull_rsi_os': 14, 'bull_rsi_ob': 74, 'bull_adx_thresh': 13.416602788469758, 'bull_atr_min_pct': 0.026505453574927212, 'bull_atr_max_pct': 0.09278217777553717, 'bull_tp_mult': 2.77286556177111, 'bull_tsl_mult': 0.9690502103316639, 'bull_time_stop': 52, 'bull_use_sma': True, 'bull_use_ema': False, 'bull_use_atr': True, 'bull_use_adx': False, 'bull_use_spike': True, 'bull_rsi_required': False, 'bear_strategy': 'mean_reversion', 'bear_bb_std_mult': 2.354225362621439, 'bear_rsi_os': 29, 'bear_rsi_ob': 69, 'bear_adx_thresh': 21.15494153249669, 'bear_atr_min_pct': 0.009111367135331118, 'bear_atr_max_pct': 0.03685652081581925, 'bear_tp_mult': 1.637546767132831, 'bear_tsl_mult': 0.9988718744862983, 'bear_time_stop': 63, 'bear_use_sma': True, 'bear_use_ema': True, 'bear_use_atr': False, 'bear_use_adx': True, 'bear_use_spike': True, 'bear_rsi_required': True, 'sideways_strategy': 'breakout', 'sideways_bb_std_mult': 2.3185239456096447, 'sideways_rsi_os': 48, 'sideways_rsi_ob': 52, 'sideways_adx_thresh': 32.18022822637495, 'sideways_atr_min_pct': 0.02836548512331165, 'sideways_atr_max_pct': 0.016636126970481876, 'sideways_tp_mult': 1.0979102798023272, 'sideways_tsl_mult': 0.8476048866713186, 'sideways_time_stop': 157, 'sideways_use_sma': False, 'sideways_use_ema': False, 'sideways_use_atr': False, 'sideways_use_adx': False, 'sideways_use_spike': False, 'sideways_rsi_required': True}.
[I 2025-08-29 20:51:38,057] Trial 643 finished with values: [-1000000000.0, 1000000000.0] and parameters: {'p_sma': 21, 'p_std': 55, 'p_atr': 9, 'p_adx': 12, 'rsi_period': 82, 'ema1': 25, 'ema2': 48, 'slip_atr_k': 0.20594150030871355, 'slip_spread_k': 0.7769469049425601, 'spread_hl_frac': 0.03940724506585082, 'bb_std_mult': 2.0113581027837624, 'rsi_os': 10, 'rsi_ob': 82, 'vol_spike': 0.18090015693893405, 'adx_thresh': 13.027504707491442, 'atr_min_pct': 0.026314519831455753, 'atr_max_pct': 0.03732371544355338, 'tp_mult': 1.180608073217746, 'tsl_mult': 0.8596252210330213, 'strategy': 'breakout', 'time_stop': 77, 'use_sma': True, 'use_atr': True, 'use_adx': False, 'use_ema': True, 'use_spike': False, 'rsi_required': False, 'edge_k': 1.179431293950885, 'edge_cap': 0.5971369505654703, 'bull_strategy': 'mean_reversion', 'bull_bb_std_mult': 3.2537534620164443, 'bull_rsi_os': 14, 'bull_rsi_ob': 74, 'bull_adx_thresh': 5.429405589952916, 'bull_atr_min_pct': 0.01504193820645794, 'bull_atr_max_pct': 0.09389741600754972, 'bull_tp_mult': 2.0035629823436056, 'bull_tsl_mult': 0.902184425004796, 'bull_time_stop': 40, 'bull_use_sma': True, 'bull_use_ema': False, 'bull_use_atr': True, 'bull_use_adx': False, 'bull_use_spike': True, 'bull_rsi_required': True, 'bear_strategy': 'breakout', 'bear_bb_std_mult': 1.4673526976855555, 'bear_rsi_os': 38, 'bear_rsi_ob': 75, 'bear_adx_thresh': 21.230707400998156, 'bear_atr_min_pct': 0.007308794472994361, 'bear_atr_max_pct': 0.020635756399520873, 'bear_tp_mult': 1.6512499432799004, 'bear_tsl_mult': 0.8722430383211824, 'bear_time_stop': 241, 'bear_use_sma': True, 'bear_use_ema': True, 'bear_use_atr': True, 'bear_use_adx': True, 'bear_use_spike': True, 'bear_rsi_required': False, 'sideways_strategy': 'breakout', 'sideways_bb_std_mult': 2.528571113168345, 'sideways_rsi_os': 48, 'sideways_rsi_ob': 52, 'sideways_adx_thresh': 32.32669246404755, 'sideways_atr_min_pct': 0.008601427742019802, 'sideways_atr_max_pct': 0.07494631376567087, 'sideways_tp_mult': 1.6157654139924527, 'sideways_tsl_mult': 0.8468293923748419, 'sideways_time_stop': 179, 'sideways_use_sma': True, 'sideways_use_ema': False, 'sideways_use_atr': False, 'sideways_use_adx': False, 'sideways_use_spike': False, 'sideways_rsi_required': False}.
[I 2025-08-29 20:52:07,819] Trial 650 finished with values: [-1000000000.0, 1000000000.0] and parameters: {'p_sma': 23, 'p_std': 26, 'p_atr': 24, 'p_adx': 14, 'rsi_period': 41, 'ema1': 26, 'ema2': 48, 'slip_atr_k': 0.11128382487382765, 'slip_spread_k': 0.199011155473451, 'spread_hl_frac': 0.01416464158484931, 'bb_std_mult': 1.845564871990475, 'rsi_os': 30, 'rsi_ob': 83, 'vol_spike': 0.18684543710886425, 'adx_thresh': 25.29884981678695, 'atr_min_pct': 0.01971354413753081, 'atr_max_pct': 0.026920682220049424, 'tp_mult': 1.212537888969131, 'tsl_mult': 0.9197043420533467, 'strategy': 'mean_reversion', 'time_stop': 132, 'use_sma': True, 'use_atr': False, 'use_adx': False, 'use_ema': True, 'use_spike': False, 'rsi_required': False, 'edge_k': 0.2763428147343586, 'edge_cap': 0.5524961186067913, 'bull_strategy': 'mean_reversion', 'bull_bb_std_mult': 3.135853728941948, 'bull_rsi_os': 31, 'bull_rsi_ob': 79, 'bull_adx_thresh': 13.674942652844647, 'bull_atr_min_pct': 0.014219943294935467, 'bull_atr_max_pct': 0.1010672515453292, 'bull_tp_mult': 1.7031523217302524, 'bull_tsl_mult': 0.9337827742516422, 'bull_time_stop': 31, 'bull_use_sma': True, 'bull_use_ema': False, 'bull_use_atr': False, 'bull_use_adx': False, 'bull_use_spike': True, 'bull_rsi_required': False, 'bear_strategy': 'breakout', 'bear_bb_std_mult': 2.5587052349035453, 'bear_rsi_os': 36, 'bear_rsi_ob': 85, 'bear_adx_thresh': 30.047380199401406, 'bear_atr_min_pct': 0.00766330001532451, 'bear_atr_max_pct': 0.06887828994386067, 'bear_tp_mult': 2.6482844966400885, 'bear_tsl_mult': 0.572177730630142, 'bear_time_stop': 47, 'bear_use_sma': False, 'bear_use_ema': True, 'bear_use_atr': False, 'bear_use_adx': True, 'bear_use_spike': True, 'bear_rsi_required': False, 'sideways_strategy': 'breakout', 'sideways_bb_std_mult': 2.2836652985925507, 'sideways_rsi_os': 40, 'sideways_rsi_ob': 95, 'sideways_adx_thresh': 31.091258183356693, 'sideways_atr_min_pct': 0.004930245096787108, 'sideways_atr_max_pct': 0.02787897614142123, 'sideways_tp_mult': 1.678322554486386, 'sideways_tsl_mult': 0.6376505595926529, 'sideways_time_stop': 187, 'sideways_use_sma': False, 'sideways_use_ema': False, 'sideways_use_atr': True, 'sideways_use_adx': True, 'sideways_use_spike': False, 'sideways_rsi_required': False}.
