[I 2025-08-29 20:58:23,779] Trial 711 finished with values: [-1000000000.0, 1000000000.0] and parameters: {'p_sma': 19, 'p_std': 56, 'p_atr': 25, 'p_adx': 29, 'rsi_period': 38, 'ema1': 25, 'ema2': 18, 'slip_atr_k': 0.1006076543708734, 'slip_spread_k': 0.17160355459976853, 'spread_hl_frac': 0.031514602435373254, 'bb_std_mult': 1.7581473467234958, 'rsi_os': 9, 'rsi_ob': 85, 'vol_spike': 0.0847935256646217, 'adx_thresh': 17.526537743016313, 'atr_min_pct': 0.020129658123884182, 'atr_max_pct': 0.10099478866913039, 'tp_mult': 1.896072169994692, 'tsl_mult': 0.8647277651553462, 'strategy': 'mean_reversion', 'time_stop': 97, 'use_sma': True, 'use_atr': False, 'use_adx': False, 'use_ema': True, 'use_spike': False, 'rsi_required': False, 'edge_k': 1.144141582041318, 'edge_cap': 0.5995876699254243, 'bull_strategy': 'mean_reversion', 'bull_bb_std_mult': 2.7661888175873566, 'bull_rsi_os': 17, 'bull_rsi_ob': 74, 'bull_adx_thresh': 5.831482766895659, 'bull_atr_min_pct': 0.01642078572714343, 'bull_atr_max_pct': 0.09209411730698194, 'bull_tp_mult': 2.6876829604371633, 'bull_tsl_mult': 0.4499917400418325, 'bull_time_stop': 13, 'bull_use_sma': True, 'bull_use_ema': False, 'bull_use_atr': True, 'bull_use_adx': True, 'bull_use_spike': True, 'bull_rsi_required': False, 'bear_strategy': 'breakout', 'bear_bb_std_mult': 2.7567740902906075, 'bear_rsi_os': 27, 'bear_rsi_ob': 72, 'bear_adx_thresh': 28.851126423870596, 'bear_atr_min_pct': 0.023366171798382428, 'bear_atr_max_pct': 0.05689538530762989, 'bear_tp_mult': 2.683038772275472, 'bear_tsl_mult': 0.05768762179966841, 'bear_time_stop': 105, 'bear_use_sma': False, 'bear_use_ema': False, 'bear_use_atr': False, 'bear_use_adx': True, 'bear_use_spike': True, 'bear_rsi_required': False, 'sideways_strategy': 'breakout', 'sideways_bb_std_mult': 2.2430888150294552, 'sideways_rsi_os': 27, 'sideways_rsi_ob': 80, 'sideways_adx_thresh': 31.315471693850338, 'sideways_atr_min_pct': 0.009983960018412768, 'sideways_atr_max_pct': 0.0663954751343088, 'sideways_tp_mult': 1.0466837567976173, 'sideways_tsl_mult': 0.8175900428675507, 'sideways_time_stop': 30, 'sideways_use_sma': False, 'sideways_use_ema': False, 'sideways_use_atr': False, 'sideways_use_adx': False, 'sideways_use_spike': False, 'sideways_rsi_required': False}.
[I 2025-08-29 20:58:51,800] Trial 714 finished with values: [-1000000000.0, 1000000000.0] and parameters: {'p_sma': 19, 'p_std': 56, 'p_atr': 19, 'p_adx': 22, 'rsi_period': 42, 'ema1': 25, 'ema2': 56, 'slip_atr_k': 6.371826665762072e-05, 'slip_spread_k': 0.16332398796226405, 'spread_hl_frac': 0.046775642171468276, 'bb_std_mult': 1.646118675804413, 'rsi_os': 7, 'rsi_ob': 87, 'vol_spike': 0.2085074316670158, 'adx_thresh': 11.900698141388563, 'atr_min_pct': 0.007038222594720528, 'atr_max_pct': 0.027902008147764452, 'tp_mult': 1.5795584332394181, 'tsl_mult': 0.42660401211724197, 'strategy': 'mean_reversion', 'time_stop': 182, 'use_sma': True, 'use_atr': False, 'use_adx': False, 'use_ema': True, 'use_spike': True, 'rsi_required': False, 'edge_k': 0.9513055762955726, 'edge_cap': 0.60243249135345, 'bull_strategy': 'mean_reversion', 'bull_bb_std_mult': 3.558810724712944, 'bull_rsi_os': 27, 'bull_rsi_ob': 72, 'bull_adx_thresh': 13.401038457727195, 'bull_atr_min_pct': 0.016733902285970353, 'bull_atr_max_pct': 0.09624098918807103, 'bull_tp_mult': 2.7989078570128267, 'bull_tsl_mult': 0.49578451697119086, 'bull_time_stop': 40, 'bull_use_sma': True, 'bull_use_ema': False, 'bull_use_atr': False, 'bull_use_adx': True, 'bull_use_spike': True, 'bull_rsi_required': False, 'bear_strategy': 'mean_reversion', 'bear_bb_std_mult': 2.777660190897625, 'bear_rsi_os': 49, 'bear_rsi_ob': 72, 'bear_adx_thresh': 14.516346481500559, 'bear_atr_min_pct': 0.023281502344163152, 'bear_atr_max_pct': 0.030771815923592117, 'bear_tp_mult': 2.685833985814006, 'bear_tsl_mult': 0.48232604541961077, 'bear_time_stop': 121, 'bear_use_sma': False, 'bear_use_ema': False, 'bear_use_atr': False, 'bear_use_adx': True, 'bear_use_spike': True, 'bear_rsi_required': True, 'sideways_strategy': 'breakout', 'sideways_bb_std_mult': 2.102159878279961, 'sideways_rsi_os': 47, 'sideways_rsi_ob': 89, 'sideways_adx_thresh': 22.213195546199703, 'sideways_atr_min_pct': 0.02449235481772176, 'sideways_atr_max_pct': 0.14265076394934198, 'sideways_tp_mult': 1.1165460421729343, 'sideways_tsl_mult': 0.17998552297587528, 'sideways_time_stop': 189, 'sideways_use_sma': False, 'sideways_use_ema': False, 'sideways_use_atr': True, 'sideways_use_adx': False, 'sideways_use_spike': False, 'sideways_rsi_required': True}.
[I 2025-08-29 20:58:51,900] Trial 712 finished with values: [-1000000000.0, 1000000000.0] and parameters: {'p_sma': 5, 'p_std': 42, 'p_atr': 29, 'p_adx': 12, 'rsi_period': 42, 'ema1': 25, 'ema2': 56, 'slip_atr_k': 0.00011615509978856711, 'slip_spread_k': 0.16660663541058293, 'spread_hl_frac': 0.04675837137768447, 'bb_std_mult': 1.5027092666519333, 'rsi_os': 9, 'rsi_ob': 62, 'vol_spike': 0.08513475406847706, 'adx_thresh': 13.66892740807402, 'atr_min_pct': 0.01980057787859865, 'atr_max_pct': 0.028910510300712247, 'tp_mult': 1.5986790769865786, 'tsl_mult': 0.9401456753283364, 'strategy': 'breakout', 'time_stop': 175, 'use_sma': True, 'use_atr': True, 'use_adx': False, 'use_ema': True, 'use_spike': False, 'rsi_required': False, 'edge_k': 0.9436665799849242, 'edge_cap': 0.5966317412248189, 'bull_strategy': 'mean_reversion', 'bull_bb_std_mult': 2.782716567134075, 'bull_rsi_os': 17, 'bull_rsi_ob': 54, 'bull_adx_thresh': 13.217077697538727, 'bull_atr_min_pct': 0.015904013744741253, 'bull_atr_max_pct': 0.09841164882302399, 'bull_tp_mult': 1.8133343159718824, 'bull_tsl_mult': 0.49342192263273515, 'bull_time_stop': 39, 'bull_use_sma': True, 'bull_use_ema': False, 'bull_use_atr': True, 'bull_use_adx': True, 'bull_use_spike': True, 'bull_rsi_required': True, 'bear_strategy': 'breakout', 'bear_bb_std_mult': 2.9618531306994003, 'bear_rsi_os': 28, 'bear_rsi_ob': 65, 'bear_adx_thresh': 20.37193685377904, 'bear_atr_min_pct': 0.005529359350973557, 'bear_atr_max_pct': 0.05720589309706486, 'bear_tp_mult': 1.9016991249518431, 'bear_tsl_mult': 0.896175512463816, 'bear_time_stop': 70, 'bear_use_sma': True, 'bear_use_ema': False, 'bear_use_atr': False, 'bear_use_adx': True, 'bear_use_spike': True, 'bear_rsi_required': False, 'sideways_strategy': 'breakout', 'sideways_bb_std_mult': 2.1058202339552645, 'sideways_rsi_os': 28, 'sideways_rsi_ob': 65, 'sideways_adx_thresh': 24.051447245278457, 'sideways_atr_min_pct': 0.029967946753677963, 'sideways_atr_max_pct': 0.13456258340275512, 'sideways_tp_mult': 2.2146751209988427, 'sideways_tsl_mult': 0.7306468381363485, 'sideways_time_stop': 193, 'sideways_use_sma': False, 'sideways_use_ema': False, 'sideways_use_atr': False, 'sideways_use_adx': False, 'sideways_use_spike': False, 'sideways_rsi_required': False}.
[I 2025-08-29 20:58:52,246] Trial 713 finished with values: [-1000000000.0, 1000000000.0] and parameters: {'p_sma': 5, 'p_std': 56, 'p_atr': 25, 'p_adx': 28, 'rsi_period': 42, 'ema1': 25, 'ema2': 49, 'slip_atr_k': 0.00036459950549366446, 'slip_spread_k': 0.17582830231255098, 'spread_hl_frac': 0.04017786111305305, 'bb_std_mult': 0.7079440671721544, 'rsi_os': 26, 'rsi_ob': 56, 'vol_spike': 0.1841114710431149, 'adx_thresh': 34.41493207057508, 'atr_min_pct': 0.019633516792387506, 'atr_max_pct': 0.028055141179386883, 'tp_mult': 1.344405493236281, 'tsl_mult': 0.9015832183509663, 'strategy': 'mean_reversion', 'time_stop': 176, 'use_sma': True, 'use_atr': False, 'use_adx': True, 'use_ema': False, 'use_spike': True, 'rsi_required': False, 'edge_k': 0.9555639780564538, 'edge_cap': 0.6046456081195968, 'bull_strategy': 'mean_reversion', 'bull_bb_std_mult': 1.4157410520305034, 'bull_rsi_os': 51, 'bull_rsi_ob': 72, 'bull_adx_thresh': 32.495695945242964, 'bull_atr_min_pct': 0.009379052558973967, 'bull_atr_max_pct': 0.09585925239536276, 'bull_tp_mult': 2.7897867407522092, 'bull_tsl_mult': 0.4900584227914517, 'bull_time_stop': 74, 'bull_use_sma': True, 'bull_use_ema': True, 'bull_use_atr': True, 'bull_use_adx': True, 'bull_use_spike': False, 'bull_rsi_required': False, 'bear_strategy': 'mean_reversion', 'bear_bb_std_mult': 2.78927425952372, 'bear_rsi_os': 28, 'bear_rsi_ob': 65, 'bear_adx_thresh': 11.572319304564878, 'bear_atr_min_pct': 0.020557032659851836, 'bear_atr_max_pct': 0.03181036866104792, 'bear_tp_mult': 2.691603496384769, 'bear_tsl_mult': 0.058253781999909326, 'bear_time_stop': 109, 'bear_use_sma': False, 'bear_use_ema': False, 'bear_use_atr': False, 'bear_use_adx': False, 'bear_use_spike': True, 'bear_rsi_required': True, 'sideways_strategy': 'mean_reversion', 'sideways_bb_std_mult': 2.072229639571407, 'sideways_rsi_os': 47, 'sideways_rsi_ob': 62, 'sideways_adx_thresh': 24.205309196244, 'sideways_atr_min_pct': 0.01893201958347629, 'sideways_atr_max_pct': 0.14418875959087965, 'sideways_tp_mult': 1.1199255450799195, 'sideways_tsl_mult': 0.4026475890842418, 'sideways_time_stop': 34, 'sideways_use_sma': True, 'sideways_use_ema': False, 'sideways_use_atr': False, 'sideways_use_adx': False, 'sideways_use_spike': False, 'sideways_rsi_required': False}.
[I 2025-08-29 20:58:52,515] Trial 715 finished with values: [-1000000000.0, 1000000000.0] and parameters: {'p_sma': 20, 'p_std': 54, 'p_atr': 24, 'p_adx': 28, 'rsi_period': 42, 'ema1': 26, 'ema2': 16, 'slip_atr_k': 0.0002149136241968039, 'slip_spread_k': 0.17411849411030117, 'spread_hl_frac': 0.04711912907741893, 'bb_std_mult': 1.5170430123553036, 'rsi_os': 5, 'rsi_ob': 55, 'vol_spike': 0.21056449496050442, 'adx_thresh': 11.881332737540792, 'atr_min_pct': 0.020961479600868943, 'atr_max_pct': 0.0327037731105359, 'tp_mult': 1.8126849230817201, 'tsl_mult': 0.9014682503145706, 'strategy': 'mean_reversion', 'time_stop': 23, 'use_sma': False, 'use_atr': False, 'use_adx': False, 'use_ema': True, 'use_spike': True, 'rsi_required': True, 'edge_k': 1.0167328224765255, 'edge_cap': 0.6273003781819843, 'bull_strategy': 'breakout', 'bull_bb_std_mult': 3.165463074354764, 'bull_rsi_os': 19, 'bull_rsi_ob': 72, 'bull_adx_thresh': 13.2998125636678, 'bull_atr_min_pct': 0.011845187979320625, 'bull_atr_max_pct': 0.0971560054800615, 'bull_tp_mult': 2.7910998700939462, 'bull_tsl_mult': 0.8737737161323739, 'bull_time_stop': 43, 'bull_use_sma': False, 'bull_use_ema': False, 'bull_use_atr': False, 'bull_use_adx': True, 'bull_use_spike': True, 'bull_rsi_required': False, 'bear_strategy': 'mean_reversion', 'bear_bb_std_mult': 2.822157961880903, 'bear_rsi_os': 49, 'bear_rsi_ob': 64, 'bear_adx_thresh': 22.728350302179255, 'bear_atr_min_pct': 0.005486404931152445, 'bear_atr_max_pct': 0.03983553496640148, 'bear_tp_mult': 2.7496282400204954, 'bear_tsl_mult': 0.8888372656591274, 'bear_time_stop': 118, 'bear_use_sma': False, 'bear_use_ema': False, 'bear_use_atr': False, 'bear_use_adx': True, 'bear_use_spike': False, 'bear_rsi_required': True, 'sideways_strategy': 'breakout', 'sideways_bb_std_mult': 2.1732607793012546, 'sideways_rsi_os': 31, 'sideways_rsi_ob': 51, 'sideways_adx_thresh': 24.241576792082277, 'sideways_atr_min_pct': 0.018883173637496024, 'sideways_atr_max_pct': 0.0340929629474523, 'sideways_tp_mult': 1.120915760921341, 'sideways_tsl_mult': 0.07102108953270364, 'sideways_time_stop': 188, 'sideways_use_sma': False, 'sideways_use_ema': False, 'sideways_use_atr': True, 'sideways_use_adx': False, 'sideways_use_spike': True, 'sideways_rsi_required': True}.
[I 2025-08-29 20:59:21,991] Trial 716 finished with values: [-1000000000.0, 1000000000.0] and parameters: {'p_sma': 5, 'p_std': 54, 'p_atr': 30, 'p_adx': 14, 'rsi_period': 13, 'ema1': 17, 'ema2': 49, 'slip_atr_k': 0.01647188826395376, 'slip_spread_k': 0.21654696978217783, 'spread_hl_frac': 0.04818311881838481, 'bb_std_mult': 0.8833302943204031, 'rsi_os': 8, 'rsi_ob': 56, 'vol_spike': 0.2999192185712173, 'adx_thresh': 34.434201415212286, 'atr_min_pct': 0.02085374893461346, 'atr_max_pct': 0.032993649744815244, 'tp_mult': 1.8146730525376575, 'tsl_mult': 0.9056093790377399, 'strategy': 'mean_reversion', 'time_stop': 124, 'use_sma': False, 'use_atr': False, 'use_adx': False, 'use_ema': True, 'use_spike': False, 'rsi_required': True, 'edge_k': 1.0163618416686415, 'edge_cap': 0.6058255986364011, 'bull_strategy': 'breakout', 'bull_bb_std_mult': 3.0631566120169365, 'bull_rsi_os': 20, 'bull_rsi_ob': 72, 'bull_adx_thresh': 31.79622575886123, 'bull_atr_min_pct': 0.01393466164743484, 'bull_atr_max_pct': 0.09976728156073011, 'bull_tp_mult': 1.1104241762455112, 'bull_tsl_mult': 0.8760808510776585, 'bull_time_stop': 26, 'bull_use_sma': False, 'bull_use_ema': False, 'bull_use_atr': True, 'bull_use_adx': False, 'bull_use_spike': False, 'bull_rsi_required': False, 'bear_strategy': 'breakout', 'bear_bb_std_mult': 2.5472553809320777, 'bear_rsi_os': 25, 'bear_rsi_ob': 70, 'bear_adx_thresh': 11.899516410905917, 'bear_atr_min_pct': 0.028733633249470383, 'bear_atr_max_pct': 0.018013822440067696, 'bear_tp_mult': 2.6196271077103837, 'bear_tsl_mult': 0.8880369691898994, 'bear_time_stop': 40, 'bear_use_sma': False, 'bear_use_ema': True, 'bear_use_atr': False, 'bear_use_adx': True, 'bear_use_spike': False, 'bear_rsi_required': False, 'sideways_strategy': 'breakout', 'sideways_bb_std_mult': 2.3581582609731027, 'sideways_rsi_os': 48, 'sideways_rsi_ob': 82, 'sideways_adx_thresh': 28.41773707007801, 'sideways_atr_min_pct': 0.0047766465865584735, 'sideways_atr_max_pct': 0.11385150915557007, 'sideways_tp_mult': 1.5004834522539672, 'sideways_tsl_mult': 0.7382400358372514, 'sideways_time_stop': 198, 'sideways_use_sma': True, 'sideways_use_ema': False, 'sideways_use_atr': False, 'sideways_use_adx': False, 'sideways_use_spike': True, 'sideways_rsi_required': False}.
[I 2025-08-29 20:59:22,133] Trial 717 finished with values: [-1000000000.0, 1000000000.0] and parameters: {'p_sma': 24, 'p_std': 54, 'p_atr': 24, 'p_adx': 11, 'rsi_period': 18, 'ema1': 10, 'ema2': 46, 'slip_atr_k': 0.13573185367158588, 'slip_spread_k': 0.21674658189134213, 'spread_hl_frac': 0.03004366063724072, 'bb_std_mult': 1.5554836242547159, 'rsi_os': 5, 'rsi_ob': 80, 'vol_spike': 0.15880546828108547, 'adx_thresh': 10.638383244971585, 'atr_min_pct': 0.020842951198143098, 'atr_max_pct': 0.033246174813116605, 'tp_mult': 1.3446106217007, 'tsl_mult': 0.34425844640402226, 'strategy': 'mean_reversion', 'time_stop': 167, 'use_sma': False, 'use_atr': False, 'use_adx': True, 'use_ema': False, 'use_spike': True, 'rsi_required': True, 'edge_k': 0.039536938722476656, 'edge_cap': 0.6144209875095579, 'bull_strategy': 'breakout', 'bull_bb_std_mult': 3.1726300181973732, 'bull_rsi_os': 34, 'bull_rsi_ob': 72, 'bull_adx_thresh': 32.516499572318374, 'bull_atr_min_pct': 0.014579726716005525, 'bull_atr_max_pct': 0.08522572047849794, 'bull_tp_mult': 2.95566271988074, 'bull_tsl_mult': 0.8757190277563386, 'bull_time_stop': 89, 'bull_use_sma': False, 'bull_use_ema': True, 'bull_use_atr': False, 'bull_use_adx': False, 'bull_use_spike': False, 'bull_rsi_required': False, 'bear_strategy': 'mean_reversion', 'bear_bb_std_mult': 2.5292423223246447, 'bear_rsi_os': 30, 'bear_rsi_ob': 70, 'bear_adx_thresh': 22.60177870104586, 'bear_atr_min_pct': 0.0055271124538338, 'bear_atr_max_pct': 0.03921610203095299, 'bear_tp_mult': 2.6169776214167215, 'bear_tsl_mult': 0.9127966287569209, 'bear_time_stop': 234, 'bear_use_sma': False, 'bear_use_ema': True, 'bear_use_atr': False, 'bear_use_adx': False, 'bear_use_spike': False, 'bear_rsi_required': True, 'sideways_strategy': 'mean_reversion', 'sideways_bb_std_mult': 2.3412188695516236, 'sideways_rsi_os': 48, 'sideways_rsi_ob': 82, 'sideways_adx_thresh': 33.19629254901375, 'sideways_atr_min_pct': 0.004677237113255966, 'sideways_atr_max_pct': 0.029857718998003005, 'sideways_tp_mult': 1.0102408950384005, 'sideways_tsl_mult': 0.682683086197596, 'sideways_time_stop': 90, 'sideways_use_sma': True, 'sideways_use_ema': False, 'sideways_use_atr': False, 'sideways_use_adx': False, 'sideways_use_spike': True, 'sideways_rsi_required': True}.
[I 2025-08-29 20:59:22,230] Trial 719 finished with values: [-1000000000.0, 1000000000.0] and parameters: {'p_sma': 10, 'p_std': 37, 'p_atr': 12, 'p_adx': 14, 'rsi_period': 45, 'ema1': 26, 'ema2': 42, 'slip_atr_k': 0.017266576428436344, 'slip_spread_k': 0.22111771928419066, 'spread_hl_frac': 0.038081425345505224, 'bb_std_mult': 3.522089450303998, 'rsi_os': 12, 'rsi_ob': 70, 'vol_spike': 0.1652602770364312, 'adx_thresh': 12.16446617727344, 'atr_min_pct': 0.02069827146753057, 'atr_max_pct': 0.03396110909889063, 'tp_mult': 2.002453282358406, 'tsl_mult': 0.8816048802850024, 'strategy': 'mean_reversion', 'time_stop': 168, 'use_sma': False, 'use_atr': False, 'use_adx': False, 'use_ema': True, 'use_spike': False, 'rsi_required': True, 'edge_k': 1.0830880939784162, 'edge_cap': 0.9026453662493288, 'bull_strategy': 'breakout', 'bull_bb_std_mult': 3.069400318917555, 'bull_rsi_os': 43, 'bull_rsi_ob': 47, 'bull_adx_thresh': 15.374895249295728, 'bull_atr_min_pct': 0.0143100903217944, 'bull_atr_max_pct': 0.07086022970025527, 'bull_tp_mult': 2.436827012962082, 'bull_tsl_mult': 0.925864808021659, 'bull_time_stop': 136, 'bull_use_sma': False, 'bull_use_ema': False, 'bull_use_atr': True, 'bull_use_adx': False, 'bull_use_spike': True, 'bull_rsi_required': False, 'bear_strategy': 'breakout', 'bear_bb_std_mult': 2.635506019933978, 'bear_rsi_os': 30, 'bear_rsi_ob': 70, 'bear_adx_thresh': 30.306837140699102, 'bear_atr_min_pct': 0.011597146731457612, 'bear_atr_max_pct': 0.022507223990025693, 'bear_tp_mult': 2.1679050030215268, 'bear_tsl_mult': 0.9419379242451892, 'bear_time_stop': 41, 'bear_use_sma': False, 'bear_use_ema': True, 'bear_use_atr': False, 'bear_use_adx': True, 'bear_use_spike': False, 'bear_rsi_required': False, 'sideways_strategy': 'breakout', 'sideways_bb_std_mult': 1.0247301003053795, 'sideways_rsi_os': 33, 'sideways_rsi_ob': 57, 'sideways_adx_thresh': 28.39683717998673, 'sideways_atr_min_pct': 0.020252480201960393, 'sideways_atr_max_pct': 0.018525860100685528, 'sideways_tp_mult': 1.371376561017614, 'sideways_tsl_mult': 0.09603163124490316, 'sideways_time_stop': 108, 'sideways_use_sma': False, 'sideways_use_ema': False, 'sideways_use_atr': False, 'sideways_use_adx': False, 'sideways_use_spike': True, 'sideways_rsi_required': False}.
[I 2025-08-29 20:59:22,333] Trial 718 finished with values: [-1000000000.0, 1000000000.0] and parameters: {'p_sma': 20, 'p_std': 46, 'p_atr': 24, 'p_adx': 27, 'rsi_period': 46, 'ema1': 26, 'ema2': 46, 'slip_atr_k': 0.016762163468491836, 'slip_spread_k': 0.2148429679850733, 'spread_hl_frac': 0.030153255344315573, 'bb_std_mult': 0.8701915157325539, 'rsi_os': 12, 'rsi_ob': 81, 'vol_spike': 0.16418178086661883, 'adx_thresh': 25.11396432449512, 'atr_min_pct': 0.02099043687152075, 'atr_max_pct': 0.030595274753417577, 'tp_mult': 2.0036204734136875, 'tsl_mult': 0.33460941510783415, 'strategy': 'mean_reversion', 'time_stop': 166, 'use_sma': False, 'use_atr': False, 'use_adx': False, 'use_ema': True, 'use_spike': False, 'rsi_required': True, 'edge_k': 1.0160672994435669, 'edge_cap': 0.6231608214075716, 'bull_strategy': 'breakout', 'bull_bb_std_mult': 3.148598285016173, 'bull_rsi_os': 34, 'bull_rsi_ob': 47, 'bull_adx_thresh': 34.99312741517466, 'bull_atr_min_pct': 0.01394660564521065, 'bull_atr_max_pct': 0.0851265284194729, 'bull_tp_mult': 2.050414031860299, 'bull_tsl_mult': 0.03168886884799371, 'bull_time_stop': 26, 'bull_use_sma': False, 'bull_use_ema': False, 'bull_use_atr': False, 'bull_use_adx': False, 'bull_use_spike': True, 'bull_rsi_required': False, 'bear_strategy': 'breakout', 'bear_bb_std_mult': 0.8586361852994469, 'bear_rsi_os': 34, 'bear_rsi_ob': 55, 'bear_adx_thresh': 22.726136696986224, 'bear_atr_min_pct': 0.013465336098687603, 'bear_atr_max_pct': 0.039383614941327715, 'bear_tp_mult': 2.623305133821764, 'bear_tsl_mult': 0.5849947533471961, 'bear_time_stop': 38, 'bear_use_sma': False, 'bear_use_ema': True, 'bear_use_atr': False, 'bear_use_adx': True, 'bear_use_spike': False, 'bear_rsi_required': False, 'sideways_strategy': 'breakout', 'sideways_bb_std_mult': 2.329317423953539, 'sideways_rsi_os': 49, 'sideways_rsi_ob': 57, 'sideways_adx_thresh': 33.16161547735875, 'sideways_atr_min_pct': 0.005023733269784423, 'sideways_atr_max_pct': 0.02977647454488757, 'sideways_tp_mult': 1.014565403661972, 'sideways_tsl_mult': 0.6847353325089697, 'sideways_time_stop': 160, 'sideways_use_sma': False, 'sideways_use_ema': False, 'sideways_use_atr': True, 'sideways_use_adx': False, 'sideways_use_spike': True, 'sideways_rsi_required': True}.
