[I 2025-08-29 19:37:40,297] Trial 12 finished with values: [-1000000000.0, 1000000000.0] and parameters: {'p_sma': 28, 'p_std': 15, 'p_atr': 16, 'p_adx': 10, 'rsi_period': 57, 'ema1': 27, 'ema2': 34, 'slip_atr_k': 0.22839173378845823, 'slip_spread_k': 0.352796092833094, 'spread_hl_frac': 0.0403136107751438, 'bb_std_mult': 1.136478832325073, 'rsi_os': 31, 'rsi_ob': 74, 'vol_spike': 0.12702410050301619, 'adx_thresh': 33.86531387778577, 'atr_min_pct': 0.023169759275386954, 'atr_max_pct': 0.022518014319619736, 'tp_mult': 1.6139532551389735, 'tsl_mult': 0.5196829510808283, 'strategy': 'mean_reversion', 'time_stop': 295, 'use_sma': True, 'use_atr': True, 'use_adx': False, 'use_ema': True, 'use_spike': True, 'rsi_required': True, 'edge_k': 1.0950133376352258, 'edge_cap': 0.3786959928098187, 'bull_strategy': 'breakout', 'bull_bb_std_mult': 0.911185357878204, 'bull_rsi_os': 52, 'bull_rsi_ob': 95, 'bull_adx_thresh': 17.471788857716838, 'bull_atr_min_pct': 0.024667691187945595, 'bull_atr_max_pct': 0.010976659385123938, 'bull_tp_mult': 1.809072451522669, 'bull_tsl_mult': 0.11105488733729585, 'bull_time_stop': 109, 'bull_use_sma': True, 'bull_use_ema': False, 'bull_use_atr': True, 'bull_use_adx': True, 'bull_use_spike': True, 'bull_rsi_required': False, 'bear_strategy': 'breakout', 'bear_bb_std_mult': 3.447874175827377, 'bear_rsi_os': 15, 'bear_rsi_ob': 63, 'bear_adx_thresh': 30.346576980503905, 'bear_atr_min_pct': 0.027399516564170997, 'bear_atr_max_pct': 0.10734606593501292, 'bear_tp_mult': 1.0696704393439795, 'bear_tsl_mult': 0.7895203327993413, 'bear_time_stop': 21, 'bear_use_sma': True, 'bear_use_ema': True, 'bear_use_atr': True, 'bear_use_adx': True, 'bear_use_spike': False, 'bear_rsi_required': False, 'sideways_strategy': 'mean_reversion', 'sideways_bb_std_mult': 0.7284937206959377, 'sideways_rsi_os': 22, 'sideways_rsi_ob': 63, 'sideways_adx_thresh': 24.72263206696302, 'sideways_atr_min_pct': 0.007881953498233337, 'sideways_atr_max_pct': 0.0931153121591786, 'sideways_tp_mult': 2.3318647108674924, 'sideways_tsl_mult': 0.11323252912363935, 'sideways_time_stop': 127, 'sideways_use_sma': False, 'sideways_use_ema': True, 'sideways_use_atr': True, 'sideways_use_adx': False, 'sideways_use_spike': False, 'sideways_rsi_required': False}.
[I 2025-08-29 19:37:40,441] Trial 8 finished with values: [-1000000000.0, 1000000000.0] and parameters: {'p_sma': 12, 'p_std': 59, 'p_atr': 24, 'p_adx': 7, 'rsi_period': 32, 'ema1': 22, 'ema2': 42, 'slip_atr_k': 0.01583430251466264, 'slip_spread_k': 0.3488294659617499, 'spread_hl_frac': 0.020678646395715268, 'bb_std_mult': 3.5373171314476224, 'rsi_os': 23, 'rsi_ob': 92, 'vol_spike': 0.01828817271530626, 'adx_thresh': 20.20264045029729, 'atr_min_pct': 0.013711829750861194, 'atr_max_pct': 0.03070204658742029, 'tp_mult': 2.7282006274272397, 'tsl_mult': 0.6213246689332033, 'strategy': 'breakout', 'time_stop': 163, 'use_sma': True, 'use_atr': False, 'use_adx': False, 'use_ema': False, 'use_spike': False, 'rsi_required': True, 'edge_k': 0.48637815826097097, 'edge_cap': 0.5672298837876899, 'bull_strategy': 'mean_reversion', 'bull_bb_std_mult': 0.7147442115979263, 'bull_rsi_os': 13, 'bull_rsi_ob': 66, 'bull_adx_thresh': 9.813404160890292, 'bull_atr_min_pct': 0.022783982281231265, 'bull_atr_max_pct': 0.012930868782439013, 'bull_tp_mult': 1.5282543929985137, 'bull_tsl_mult': 0.8180299667575299, 'bull_time_stop': 7, 'bull_use_sma': False, 'bull_use_ema': True, 'bull_use_atr': False, 'bull_use_adx': True, 'bull_use_spike': True, 'bull_rsi_required': True, 'bear_strategy': 'breakout', 'bear_bb_std_mult': 3.297965143732371, 'bear_rsi_os': 26, 'bear_rsi_ob': 62, 'bear_adx_thresh': 13.616828969928562, 'bear_atr_min_pct': 0.005609368646173313, 'bear_atr_max_pct': 0.016486180090407542, 'bear_tp_mult': 2.639027442180165, 'bear_tsl_mult': 0.6106478647174971, 'bear_time_stop': 249, 'bear_use_sma': False, 'bear_use_ema': False, 'bear_use_atr': False, 'bear_use_adx': True, 'bear_use_spike': False, 'bear_rsi_required': True, 'sideways_strategy': 'breakout', 'sideways_bb_std_mult': 2.5799346397823912, 'sideways_rsi_os': 17, 'sideways_rsi_ob': 46, 'sideways_adx_thresh': 34.54995016209008, 'sideways_atr_min_pct': 0.006270041992805495, 'sideways_atr_max_pct': 0.04079408904940278, 'sideways_tp_mult': 1.9432555860505505, 'sideways_tsl_mult': 0.5232898223336105, 'sideways_time_stop': 33, 'sideways_use_sma': True, 'sideways_use_ema': True, 'sideways_use_atr': False, 'sideways_use_adx': False, 'sideways_use_spike': True, 'sideways_rsi_required': True}.
[I 2025-08-29 19:38:09,511] Trial 10 finished with values: [-1000000000.0, 1000000000.0] and parameters: {'p_sma': 18, 'p_std': 35, 'p_atr': 8, 'p_adx': 21, 'rsi_period': 24, 'ema1': 10, 'ema2': 37, 'slip_atr_k': 0.24695895751408933, 'slip_spread_k': 0.4196486482356204, 'spread_hl_frac': 0.01594896194354689, 'bb_std_mult': 2.20622956332592, 'rsi_os': 22, 'rsi_ob': 59, 'vol_spike': 0.07511020507037813, 'adx_thresh': 26.28697778453643, 'atr_min_pct': 0.010364692424595425, 'atr_max_pct': 0.033245602397447734, 'tp_mult': 2.9062278177356022, 'tsl_mult': 0.23062682118512545, 'strategy': 'mean_reversion', 'time_stop': 74, 'use_sma': True, 'use_atr': True, 'use_adx': False, 'use_ema': True, 'use_spike': True, 'rsi_required': False, 'edge_k': 0.3101167445478381, 'edge_cap': 0.1736631576705139, 'bull_strategy': 'mean_reversion', 'bull_bb_std_mult': 1.6887425879870246, 'bull_rsi_os': 53, 'bull_rsi_ob': 64, 'bull_adx_thresh': 18.008203415635993, 'bull_atr_min_pct': 0.02745473243010551, 'bull_atr_max_pct': 0.0420690403311386, 'bull_tp_mult': 1.445274618957321, 'bull_tsl_mult': 0.6589249792690385, 'bull_time_stop': 176, 'bull_use_sma': True, 'bull_use_ema': True, 'bull_use_atr': True, 'bull_use_adx': True, 'bull_use_spike': False, 'bull_rsi_required': True, 'bear_strategy': 'breakout', 'bear_bb_std_mult': 0.5443649187386663, 'bear_rsi_os': 52, 'bear_rsi_ob': 94, 'bear_adx_thresh': 30.88452550414069, 'bear_atr_min_pct': 0.020657414459244572, 'bear_atr_max_pct': 0.027329085021250095, 'bear_tp_mult': 1.218670761280802, 'bear_tsl_mult': 0.002118469353271646, 'bear_time_stop': 142, 'bear_use_sma': True, 'bear_use_ema': False, 'bear_use_atr': False, 'bear_use_adx': True, 'bear_use_spike': True, 'bear_rsi_required': False, 'sideways_strategy': 'mean_reversion', 'sideways_bb_std_mult': 2.131541169013557, 'sideways_rsi_os': 8, 'sideways_rsi_ob': 67, 'sideways_adx_thresh': 11.36163697026285, 'sideways_atr_min_pct': 0.017545995474019013, 'sideways_atr_max_pct': 0.0544880790778183, 'sideways_tp_mult': 2.889321738393948, 'sideways_tsl_mult': 0.9497823106389144, 'sideways_time_stop': 174, 'sideways_use_sma': True, 'sideways_use_ema': False, 'sideways_use_atr': False, 'sideways_use_adx': False, 'sideways_use_spike': False, 'sideways_rsi_required': False}.
[I 2025-08-29 19:38:10,845] Trial 11 finished with values: [-0.018560895438505365, 0.0185306160605363] and parameters: {'p_sma': 20, 'p_std': 44, 'p_atr': 8, 'p_adx': 7, 'rsi_period': 15, 'ema1': 26, 'ema2': 19, 'slip_atr_k': 0.03354770878972535, 'slip_spread_k': 0.3373925804509603, 'spread_hl_frac': 0.020062725319759497, 'bb_std_mult': 0.5492354897062356, 'rsi_os': 14, 'rsi_ob': 66, 'vol_spike': 0.08415534452581397, 'adx_thresh': 11.936216654456986, 'atr_min_pct': 0.015439872101293899, 'atr_max_pct': 0.09421684410254451, 'tp_mult': 1.208226912613967, 'tsl_mult': 0.5033443039172174, 'strategy': 'breakout', 'time_stop': 264, 'use_sma': False, 'use_atr': False, 'use_adx': False, 'use_ema': False, 'use_spike': False, 'rsi_required': True, 'edge_k': 0.4272209939473526, 'edge_cap': 0.45049467591369197, 'bull_strategy': 'breakout', 'bull_bb_std_mult': 3.4184973140794304, 'bull_rsi_os': 45, 'bull_rsi_ob': 65, 'bull_adx_thresh': 32.245060300086706, 'bull_atr_min_pct': 0.01948726673528354, 'bull_atr_max_pct': 0.13246420103226952, 'bull_tp_mult': 2.1691632719950857, 'bull_tsl_mult': 0.04824997158997879, 'bull_time_stop': 131, 'bull_use_sma': False, 'bull_use_ema': False, 'bull_use_atr': True, 'bull_use_adx': True, 'bull_use_spike': True, 'bull_rsi_required': True, 'bear_strategy': 'breakout', 'bear_bb_std_mult': 1.0733735070945187, 'bear_rsi_os': 26, 'bear_rsi_ob': 66, 'bear_adx_thresh': 31.664655030708953, 'bear_atr_min_pct': 0.0028583308256232873, 'bear_atr_max_pct': 0.09342049603275428, 'bear_tp_mult': 1.759899530912952, 'bear_tsl_mult': 0.5643628434418112, 'bear_time_stop': 167, 'bear_use_sma': True, 'bear_use_ema': True, 'bear_use_atr': True, 'bear_use_adx': False, 'bear_use_spike': False, 'bear_rsi_required': True, 'sideways_strategy': 'mean_reversion', 'sideways_bb_std_mult': 0.9824506360280605, 'sideways_rsi_os': 37, 'sideways_rsi_ob': 85, 'sideways_adx_thresh': 18.92669886732847, 'sideways_atr_min_pct': 0.006170430621752559, 'sideways_atr_max_pct': 0.13010482233085102, 'sideways_tp_mult': 1.9400338136492243, 'sideways_tsl_mult': 0.30096256809667654, 'sideways_time_stop': 289, 'sideways_use_sma': False, 'sideways_use_ema': True, 'sideways_use_atr': False, 'sideways_use_adx': True, 'sideways_use_spike': True, 'sideways_rsi_required': True}.
[I 2025-08-29 19:38:11,856] Trial 14 finished with values: [-1000000000.0, 1000000000.0] and parameters: {'p_sma': 23, 'p_std': 27, 'p_atr': 7, 'p_adx': 18, 'rsi_period': 8, 'ema1': 5, 'ema2': 12, 'slip_atr_k': 0.07713138889348739, 'slip_spread_k': 0.7324147758471665, 'spread_hl_frac': 0.049855696951075966, 'bb_std_mult': 0.6621307802246552, 'rsi_os': 7, 'rsi_ob': 79, 'vol_spike': 0.07491812673706903, 'adx_thresh': 15.578267847643321, 'atr_min_pct': 0.0022115982950686765, 'atr_max_pct': 0.06249553277248941, 'tp_mult': 2.4932346775046095, 'tsl_mult': 0.8805326554703367, 'strategy': 'breakout', 'time_stop': 185, 'use_sma': False, 'use_atr': True, 'use_adx': True, 'use_ema': False, 'use_spike': True, 'rsi_required': True, 'edge_k': 0.21613853556020302, 'edge_cap': 0.637953138086034, 'bull_strategy': 'mean_reversion', 'bull_bb_std_mult': 3.5101709643323438, 'bull_rsi_os': 39, 'bull_rsi_ob': 48, 'bull_adx_thresh': 34.06560068843782, 'bull_atr_min_pct': 0.02968213150107506, 'bull_atr_max_pct': 0.12400998220866, 'bull_tp_mult': 2.462594139212797, 'bull_tsl_mult': 0.5568292887129326, 'bull_time_stop': 294, 'bull_use_sma': True, 'bull_use_ema': True, 'bull_use_atr': False, 'bull_use_adx': True, 'bull_use_spike': True, 'bull_rsi_required': False, 'bear_strategy': 'breakout', 'bear_bb_std_mult': 1.0492479767605243, 'bear_rsi_os': 43, 'bear_rsi_ob': 77, 'bear_adx_thresh': 5.591692400209551, 'bear_atr_min_pct': 0.02192010932030673, 'bear_atr_max_pct': 0.07491063671054767, 'bear_tp_mult': 2.987339764531078, 'bear_tsl_mult': 0.1091654771694563, 'bear_time_stop': 199, 'bear_use_sma': True, 'bear_use_ema': False, 'bear_use_atr': True, 'bear_use_adx': False, 'bear_use_spike': False, 'bear_rsi_required': False, 'sideways_strategy': 'mean_reversion', 'sideways_bb_std_mult': 1.4092666097863122, 'sideways_rsi_os': 36, 'sideways_rsi_ob': 94, 'sideways_adx_thresh': 32.1051648236344, 'sideways_atr_min_pct': 0.026163704302667748, 'sideways_atr_max_pct': 0.13098623643830865, 'sideways_tp_mult': 1.210534128844568, 'sideways_tsl_mult': 0.7165310478531797, 'sideways_time_stop': 6, 'sideways_use_sma': True, 'sideways_use_ema': True, 'sideways_use_atr': True, 'sideways_use_adx': False, 'sideways_use_spike': False, 'sideways_rsi_required': False}.
[I 2025-08-29 19:38:11,938] Trial 13 finished with values: [-1000000000.0, 1000000000.0] and parameters: {'p_sma': 12, 'p_std': 60, 'p_atr': 28, 'p_adx': 17, 'rsi_period': 7, 'ema1': 20, 'ema2': 10, 'slip_atr_k': 0.002422042189118713, 'slip_spread_k': 0.7186920787407945, 'spread_hl_frac': 0.0018117770366890273, 'bb_std_mult': 0.7083256754244724, 'rsi_os': 9, 'rsi_ob': 86, 'vol_spike': 0.04151367125041455, 'adx_thresh': 17.463270558958968, 'atr_min_pct': 0.009777472840163651, 'atr_max_pct': 0.060215712614013636, 'tp_mult': 2.6756344858135868, 'tsl_mult': 0.9857246987421271, 'strategy': 'breakout', 'time_stop': 185, 'use_sma': False, 'use_atr': True, 'use_adx': True, 'use_ema': False, 'use_spike': False, 'rsi_required': True, 'edge_k': 0.03174119005465992, 'edge_cap': 0.5868807401230467, 'bull_strategy': 'mean_reversion', 'bull_bb_std_mult': 3.5769219548974442, 'bull_rsi_os': 40, 'bull_rsi_ob': 45, 'bull_adx_thresh': 33.099411821680036, 'bull_atr_min_pct': 0.029884607801600294, 'bull_atr_max_pct': 0.09290233775115819, 'bull_tp_mult': 2.326296492317966, 'bull_tsl_mult': 0.005292824502898585, 'bull_time_stop': 289, 'bull_use_sma': False, 'bull_use_ema': True, 'bull_use_atr': False, 'bull_use_adx': True, 'bull_use_spike': True, 'bull_rsi_required': False, 'bear_strategy': 'breakout', 'bear_bb_std_mult': 1.6422561049569853, 'bear_rsi_os': 42, 'bear_rsi_ob': 78, 'bear_adx_thresh': 5.998468760349781, 'bear_atr_min_pct': 0.01997339437703423, 'bear_atr_max_pct': 0.06747084822026658, 'bear_tp_mult': 2.992663034726969, 'bear_tsl_mult': 0.03827972346152497, 'bear_time_stop': 98, 'bear_use_sma': True, 'bear_use_ema': False, 'bear_use_atr': True, 'bear_use_adx': False, 'bear_use_spike': False, 'bear_rsi_required': False, 'sideways_strategy': 'breakout', 'sideways_bb_std_mult': 1.407393186434942, 'sideways_rsi_os': 38, 'sideways_rsi_ob': 47, 'sideways_adx_thresh': 33.86751927409884, 'sideways_atr_min_pct': 0.025959899622698214, 'sideways_atr_max_pct': 0.1391284671669574, 'sideways_tp_mult': 1.0776888892422156, 'sideways_tsl_mult': 0.6687017712087329, 'sideways_time_stop': 8, 'sideways_use_sma': True, 'sideways_use_ema': True, 'sideways_use_atr': False, 'sideways_use_adx': False, 'sideways_use_spike': False, 'sideways_rsi_required': True}.
[I 2025-08-29 19:38:42,293] Trial 15 finished with values: [-1000000000.0, 1000000000.0] and parameters: {'p_sma': 30, 'p_std': 26, 'p_atr': 11, 'p_adx': 15, 'rsi_period': 9, 'ema1': 19, 'ema2': 19, 'slip_atr_k': 0.06624723899532797, 'slip_spread_k': 0.7146818329632819, 'spread_hl_frac': 0.04984044348821198, 'bb_std_mult': 0.7707166317479697, 'rsi_os': 9, 'rsi_ob': 79, 'vol_spike': 0.18400314784845037, 'adx_thresh': 14.979493688577826, 'atr_min_pct': 0.0014607882033737625, 'atr_max_pct': 0.06831174366123519, 'tp_mult': 2.4302899686254973, 'tsl_mult': 0.9767096926113508, 'strategy': 'breakout', 'time_stop': 188, 'use_sma': False, 'use_atr': True, 'use_adx': True, 'use_ema': False, 'use_spike': True, 'rsi_required': True, 'edge_k': 1.8948229027584225, 'edge_cap': 0.6423858632262319, 'bull_strategy': 'mean_reversion', 'bull_bb_std_mult': 3.2783050555750535, 'bull_rsi_os': 39, 'bull_rsi_ob': 45, 'bull_adx_thresh': 5.312841888558321, 'bull_atr_min_pct': 0.012899277489427766, 'bull_atr_max_pct': 0.12382912156609355, 'bull_tp_mult': 2.4880453166684786, 'bull_tsl_mult': 0.44506863193132, 'bull_time_stop': 290, 'bull_use_sma': False, 'bull_use_ema': True, 'bull_use_atr': False, 'bull_use_adx': True, 'bull_use_spike': True, 'bull_rsi_required': False, 'bear_strategy': 'breakout', 'bear_bb_std_mult': 1.3203628476427696, 'bear_rsi_os': 40, 'bear_rsi_ob': 75, 'bear_adx_thresh': 7.8538736364045665, 'bear_atr_min_pct': 0.02060960912846163, 'bear_atr_max_pct': 0.0707204043816799, 'bear_tp_mult': 2.921431659115743, 'bear_tsl_mult': 0.17207264066342648, 'bear_time_stop': 208, 'bear_use_sma': True, 'bear_use_ema': True, 'bear_use_atr': True, 'bear_use_adx': False, 'bear_use_spike': False, 'bear_rsi_required': False, 'sideways_strategy': 'breakout', 'sideways_bb_std_mult': 1.1391840236754545, 'sideways_rsi_os': 36, 'sideways_rsi_ob': 93, 'sideways_adx_thresh': 33.0211992291599, 'sideways_atr_min_pct': 0.029552431023146024, 'sideways_atr_max_pct': 0.13019669835991443, 'sideways_tp_mult': 1.1671871333723112, 'sideways_tsl_mult': 0.6390100741581594, 'sideways_time_stop': 7, 'sideways_use_sma': True, 'sideways_use_ema': True, 'sideways_use_atr': True, 'sideways_use_adx': False, 'sideways_use_spike': False, 'sideways_rsi_required': True}.
[I 2025-08-29 19:38:42,391] Trial 16 finished with values: [-1000000000.0, 1000000000.0] and parameters: {'p_sma': 28, 'p_std': 28, 'p_atr': 29, 'p_adx': 16, 'rsi_period': 7, 'ema1': 5, 'ema2': 10, 'slip_atr_k': 0.05581293987037908, 'slip_spread_k': 0.6659936356454201, 'spread_hl_frac': 0.0018420746215469866, 'bb_std_mult': 0.6643523877228784, 'rsi_os': 6, 'rsi_ob': 83, 'vol_spike': 0.19285062758544125, 'adx_thresh': 14.597878095117295, 'atr_min_pct': 0.00018851509468238888, 'atr_max_pct': 0.0634449206283424, 'tp_mult': 2.4614271557122898, 'tsl_mult': 0.9972942087922927, 'strategy': 'breakout', 'time_stop': 192, 'use_sma': False, 'use_atr': True, 'use_adx': True, 'use_ema': False, 'use_spike': True, 'rsi_required': True, 'edge_k': 1.9440869838244423, 'edge_cap': 0.6066378921150805, 'bull_strategy': 'mean_reversion', 'bull_bb_std_mult': 3.15768683022252, 'bull_rsi_os': 38, 'bull_rsi_ob': 52, 'bull_adx_thresh': 33.3671176480562, 'bull_atr_min_pct': 0.012915854534604754, 'bull_atr_max_pct': 0.09349011067373067, 'bull_tp_mult': 2.2762814390062815, 'bull_tsl_mult': 0.19928796105582336, 'bull_time_stop': 286, 'bull_use_sma': False, 'bull_use_ema': True, 'bull_use_atr': False, 'bull_use_adx': True, 'bull_use_spike': True, 'bull_rsi_required': False, 'bear_strategy': 'breakout', 'bear_bb_std_mult': 1.5015490939052651, 'bear_rsi_os': 40, 'bear_rsi_ob': 76, 'bear_adx_thresh': 5.690327891029812, 'bear_atr_min_pct': 0.019604567584585373, 'bear_atr_max_pct': 0.07138114777299699, 'bear_tp_mult': 1.7605824798016185, 'bear_tsl_mult': 0.3294860568558544, 'bear_time_stop': 103, 'bear_use_sma': True, 'bear_use_ema': False, 'bear_use_atr': True, 'bear_use_adx': False, 'bear_use_spike': False, 'bear_rsi_required': False, 'sideways_strategy': 'mean_reversion', 'sideways_bb_std_mult': 1.4627918849958395, 'sideways_rsi_os': 38, 'sideways_rsi_ob': 95, 'sideways_adx_thresh': 31.820053437676428, 'sideways_atr_min_pct': 0.029056035685020548, 'sideways_atr_max_pct': 0.12903392399498187, 'sideways_tp_mult': 1.0551187306288132, 'sideways_tsl_mult': 0.7083467505268516, 'sideways_time_stop': 19, 'sideways_use_sma': True, 'sideways_use_ema': True, 'sideways_use_atr': True, 'sideways_use_adx': False, 'sideways_use_spike': False, 'sideways_rsi_required': True}.
[I 2025-08-29 19:38:42,857] Trial 17 finished with values: [-1000000000.0, 1000000000.0] and parameters: {'p_sma': 30, 'p_std': 51, 'p_atr': 12, 'p_adx': 25, 'rsi_period': 75, 'ema1': 5, 'ema2': 45, 'slip_atr_k': 0.04932691162783866, 'slip_spread_k': 0.6362797930536299, 'spread_hl_frac': 0.00646315500874917, 'bb_std_mult': 2.80612195856729, 'rsi_os': 36, 'rsi_ob': 67, 'vol_spike': 0.18581402730330002, 'adx_thresh': 5.564776924032927, 'atr_min_pct': 0.000617208955808574, 'atr_max_pct': 0.0827626688169869, 'tp_mult': 2.2476004818444073, 'tsl_mult': 0.034353424554259215, 'strategy': 'breakout', 'time_stop': 206, 'use_sma': False, 'use_atr': True, 'use_adx': True, 'use_ema': False, 'use_spike': True, 'rsi_required': True, 'edge_k': 1.7147062202690824, 'edge_cap': 0.9847973509957859, 'bull_strategy': 'mean_reversion', 'bull_bb_std_mult': 2.839424002958304, 'bull_rsi_os': 38, 'bull_rsi_ob': 86, 'bull_adx_thresh': 14.648444141113018, 'bull_atr_min_pct': 0.013513584313036196, 'bull_atr_max_pct': 0.1054667708560701, 'bull_tp_mult': 2.1192412175687254, 'bull_tsl_mult': 0.3458879290303819, 'bull_time_stop': 205, 'bull_use_sma': False, 'bull_use_ema': True, 'bull_use_atr': False, 'bull_use_adx': True, 'bull_use_spike': True, 'bull_rsi_required': False, 'bear_strategy': 'mean_reversion', 'bear_bb_std_mult': 1.7782176703787007, 'bear_rsi_os': 6, 'bear_rsi_ob': 56, 'bear_adx_thresh': 11.963516665658927, 'bear_atr_min_pct': 0.009609243748367795, 'bear_atr_max_pct': 0.0946352513449107, 'bear_tp_mult': 1.7850757576931047, 'bear_tsl_mult': 0.3352838601065102, 'bear_time_stop': 86, 'bear_use_sma': True, 'bear_use_ema': True, 'bear_use_atr': True, 'bear_use_adx': False, 'bear_use_spike': False, 'bear_rsi_required': False, 'sideways_strategy': 'mean_reversion', 'sideways_bb_std_mult': 1.445781461702759, 'sideways_rsi_os': 17, 'sideways_rsi_ob': 88, 'sideways_adx_thresh': 27.492223624185495, 'sideways_atr_min_pct': 0.011894020553104552, 'sideways_atr_max_pct': 0.10988560129732677, 'sideways_tp_mult': 2.4848355307762047, 'sideways_tsl_mult': 0.28170293999093365, 'sideways_time_stop': 206, 'sideways_use_sma': False, 'sideways_use_ema': True, 'sideways_use_atr': True, 'sideways_use_adx': False, 'sideways_use_spike': False, 'sideways_rsi_required': True}.
