[I 2025-08-29 19:53:32,556] Trial 145 finished with values: [-0.005078044723099473, 0.005283124745592386] and parameters: {'p_sma': 39, 'p_std': 11, 'p_atr': 24, 'p_adx': 15, 'rsi_period': 83, 'ema1': 28, 'ema2': 41, 'slip_atr_k': 0.05161035355819838, 'slip_spread_k': 0.11060528303228917, 'spread_hl_frac': 0.014914712227911039, 'bb_std_mult': 1.2402817172993745, 'rsi_os': 19, 'rsi_ob': 52, 'vol_spike': 0.06598269295841887, 'adx_thresh': 31.163151014280572, 'atr_min_pct': 0.010921513152097113, 'atr_max_pct': 0.09361003336496274, 'tp_mult': 2.4476492142554434, 'tsl_mult': 0.5523079828831512, 'strategy': 'mean_reversion', 'time_stop': 84, 'use_sma': False, 'use_atr': True, 'use_adx': False, 'use_ema': False, 'use_spike': False, 'rsi_required': True, 'edge_k': 1.4084313810828972, 'edge_cap': 0.47249450620288935, 'bull_strategy': 'breakout', 'bull_bb_std_mult': 0.998540146797704, 'bull_rsi_os': 32, 'bull_rsi_ob': 95, 'bull_adx_thresh': 15.742752530628405, 'bull_atr_min_pct': 0.004360399629909886, 'bull_atr_max_pct': 0.09117480254690072, 'bull_tp_mult': 1.6343629179145376, 'bull_tsl_mult': 0.8590645617267646, 'bull_time_stop': 272, 'bull_use_sma': False, 'bull_use_ema': True, 'bull_use_atr': False, 'bull_use_adx': True, 'bull_use_spike': False, 'bull_rsi_required': True, 'bear_strategy': 'breakout', 'bear_bb_std_mult': 3.3755611915923307, 'bear_rsi_os': 33, 'bear_rsi_ob': 70, 'bear_adx_thresh': 5.546156409398025, 'bear_atr_min_pct': 0.004367053624796078, 'bear_atr_max_pct': 0.11736749851016988, 'bear_tp_mult': 1.9452765899290945, 'bear_tsl_mult': 0.6278020462059949, 'bear_time_stop': 20, 'bear_use_sma': False, 'bear_use_ema': False, 'bear_use_atr': True, 'bear_use_adx': False, 'bear_use_spike': False, 'bear_rsi_required': False, 'sideways_strategy': 'mean_reversion', 'sideways_bb_std_mult': 1.8946063133796625, 'sideways_rsi_os': 27, 'sideways_rsi_ob': 62, 'sideways_adx_thresh': 30.74486514755101, 'sideways_atr_min_pct': 0.00944136037700604, 'sideways_atr_max_pct': 0.12121852342993386, 'sideways_tp_mult': 2.2438865257135947, 'sideways_tsl_mult': 0.05715242077098581, 'sideways_time_stop': 217, 'sideways_use_sma': False, 'sideways_use_ema': True, 'sideways_use_atr': True, 'sideways_use_adx': False, 'sideways_use_spike': False, 'sideways_rsi_required': True}.
[I 2025-08-29 19:53:32,855] Trial 143 finished with values: [-0.0068035059508906315, 0.006929293113182044] and parameters: {'p_sma': 40, 'p_std': 54, 'p_atr': 7, 'p_adx': 17, 'rsi_period': 29, 'ema1': 12, 'ema2': 22, 'slip_atr_k': 0.04660836259680725, 'slip_spread_k': 0.12110511098583543, 'spread_hl_frac': 0.014996204310121877, 'bb_std_mult': 3.4893368262081346, 'rsi_os': 19, 'rsi_ob': 61, 'vol_spike': 0.1956970323011143, 'adx_thresh': 31.13277151780886, 'atr_min_pct': 0.011746722288393947, 'atr_max_pct': 0.08561324442139465, 'tp_mult': 2.4545203987867192, 'tsl_mult': 0.06568398598204789, 'strategy': 'mean_reversion', 'time_stop': 86, 'use_sma': False, 'use_atr': True, 'use_adx': False, 'use_ema': False, 'use_spike': False, 'rsi_required': True, 'edge_k': 1.3463665814528607, 'edge_cap': 0.05392764413975132, 'bull_strategy': 'breakout', 'bull_bb_std_mult': 0.8759566678208175, 'bull_rsi_os': 7, 'bull_rsi_ob': 95, 'bull_adx_thresh': 17.529184876760812, 'bull_atr_min_pct': 0.003973463777845092, 'bull_atr_max_pct': 0.061371112782099835, 'bull_tp_mult': 2.0170340226172674, 'bull_tsl_mult': 0.8582699334419222, 'bull_time_stop': 38, 'bull_use_sma': False, 'bull_use_ema': True, 'bull_use_atr': False, 'bull_use_adx': False, 'bull_use_spike': False, 'bull_rsi_required': True, 'bear_strategy': 'breakout', 'bear_bb_std_mult': 2.419874073361781, 'bear_rsi_os': 30, 'bear_rsi_ob': 68, 'bear_adx_thresh': 25.18676094033801, 'bear_atr_min_pct': 0.0083451144269092, 'bear_atr_max_pct': 0.09719258293605323, 'bear_tp_mult': 1.8611566582535486, 'bear_tsl_mult': 0.627694427543195, 'bear_time_stop': 11, 'bear_use_sma': False, 'bear_use_ema': False, 'bear_use_atr': True, 'bear_use_adx': False, 'bear_use_spike': True, 'bear_rsi_required': True, 'sideways_strategy': 'mean_reversion', 'sideways_bb_std_mult': 2.001483682180838, 'sideways_rsi_os': 37, 'sideways_rsi_ob': 61, 'sideways_adx_thresh': 6.322868622739531, 'sideways_atr_min_pct': 0.019221100362817677, 'sideways_atr_max_pct': 0.10027607743590328, 'sideways_tp_mult': 2.1455966861887585, 'sideways_tsl_mult': 0.9341718996216024, 'sideways_time_stop': 246, 'sideways_use_sma': False, 'sideways_use_ema': False, 'sideways_use_atr': False, 'sideways_use_adx': True, 'sideways_use_spike': False, 'sideways_rsi_required': True}.
[I 2025-08-29 19:53:33,056] Trial 146 finished with values: [-0.004081407939493187, 0.0048615612285989075] and parameters: {'p_sma': 35, 'p_std': 54, 'p_atr': 23, 'p_adx': 30, 'rsi_period': 21, 'ema1': 27, 'ema2': 41, 'slip_atr_k': 0.051799580902269673, 'slip_spread_k': 0.26931194085804244, 'spread_hl_frac': 0.006020981182246082, 'bb_std_mult': 1.2837533043542426, 'rsi_os': 19, 'rsi_ob': 52, 'vol_spike': 0.2992407618129634, 'adx_thresh': 33.418595602244345, 'atr_min_pct': 0.01985568009819079, 'atr_max_pct': 0.09268610133601454, 'tp_mult': 2.4537747819756865, 'tsl_mult': 0.5538731775802174, 'strategy': 'mean_reversion', 'time_stop': 85, 'use_sma': True, 'use_atr': True, 'use_adx': False, 'use_ema': True, 'use_spike': False, 'rsi_required': True, 'edge_k': 0.29302117442269926, 'edge_cap': 0.2871797571525113, 'bull_strategy': 'breakout', 'bull_bb_std_mult': 0.9963554313039819, 'bull_rsi_os': 7, 'bull_rsi_ob': 84, 'bull_adx_thresh': 7.219119643584927, 'bull_atr_min_pct': 0.0043218835605862045, 'bull_atr_max_pct': 0.07417340994615905, 'bull_tp_mult': 1.6257898086721458, 'bull_tsl_mult': 0.25149216807260943, 'bull_time_stop': 271, 'bull_use_sma': False, 'bull_use_ema': True, 'bull_use_atr': False, 'bull_use_adx': True, 'bull_use_spike': False, 'bull_rsi_required': True, 'bear_strategy': 'breakout', 'bear_bb_std_mult': 1.0435463775730636, 'bear_rsi_os': 23, 'bear_rsi_ob': 70, 'bear_adx_thresh': 5.441772504477767, 'bear_atr_min_pct': 0.004212065560749867, 'bear_atr_max_pct': 0.015664329944459668, 'bear_tp_mult': 1.8449665202728396, 'bear_tsl_mult': 0.6345748665758295, 'bear_time_stop': 21, 'bear_use_sma': False, 'bear_use_ema': False, 'bear_use_atr': True, 'bear_use_adx': True, 'bear_use_spike': False, 'bear_rsi_required': False, 'sideways_strategy': 'mean_reversion', 'sideways_bb_std_mult': 1.8790833597026673, 'sideways_rsi_os': 44, 'sideways_rsi_ob': 62, 'sideways_adx_thresh': 29.101143064773634, 'sideways_atr_min_pct': 0.016078586625571267, 'sideways_atr_max_pct': 0.11430547702507061, 'sideways_tp_mult': 2.0711605375707998, 'sideways_tsl_mult': 0.2031691869256379, 'sideways_time_stop': 212, 'sideways_use_sma': False, 'sideways_use_ema': True, 'sideways_use_atr': True, 'sideways_use_adx': False, 'sideways_use_spike': False, 'sideways_rsi_required': True}.
[I 2025-08-29 19:53:33,427] Trial 150 finished with values: [-1000000000.0, 1000000000.0] and parameters: {'p_sma': 35, 'p_std': 51, 'p_atr': 29, 'p_adx': 18, 'rsi_period': 56, 'ema1': 27, 'ema2': 38, 'slip_atr_k': 0.05234383410513496, 'slip_spread_k': 0.3958953337248427, 'spread_hl_frac': 0.023521517495802967, 'bb_std_mult': 1.3553043844052306, 'rsi_os': 54, 'rsi_ob': 95, 'vol_spike': 0.0029257075516295195, 'adx_thresh': 32.493147437166556, 'atr_min_pct': 0.009092903522076007, 'atr_max_pct': 0.08843444191549114, 'tp_mult': 1.9677690116963278, 'tsl_mult': 0.5407189411782974, 'strategy': 'mean_reversion', 'time_stop': 58, 'use_sma': True, 'use_atr': False, 'use_adx': False, 'use_ema': True, 'use_spike': False, 'rsi_required': False, 'edge_k': 1.409029141776186, 'edge_cap': 0.49086712527900633, 'bull_strategy': 'breakout', 'bull_bb_std_mult': 3.500768203177982, 'bull_rsi_os': 10, 'bull_rsi_ob': 84, 'bull_adx_thresh': 19.071225705008832, 'bull_atr_min_pct': 0.0010518257922867598, 'bull_atr_max_pct': 0.07430773040017831, 'bull_tp_mult': 1.4118831231191897, 'bull_tsl_mult': 0.30492094320416685, 'bull_time_stop': 107, 'bull_use_sma': False, 'bull_use_ema': True, 'bull_use_atr': False, 'bull_use_adx': True, 'bull_use_spike': False, 'bull_rsi_required': True, 'bear_strategy': 'breakout', 'bear_bb_std_mult': 2.7824444876358605, 'bear_rsi_os': 53, 'bear_rsi_ob': 47, 'bear_adx_thresh': 30.14052645542034, 'bear_atr_min_pct': 0.004389735460328493, 'bear_atr_max_pct': 0.11750616578565343, 'bear_tp_mult': 1.845564019389106, 'bear_tsl_mult': 0.9959337363215899, 'bear_time_stop': 20, 'bear_use_sma': False, 'bear_use_ema': False, 'bear_use_atr': True, 'bear_use_adx': True, 'bear_use_spike': False, 'bear_rsi_required': False, 'sideways_strategy': 'mean_reversion', 'sideways_bb_std_mult': 1.856915779497189, 'sideways_rsi_os': 54, 'sideways_rsi_ob': 85, 'sideways_adx_thresh': 17.492096417536402, 'sideways_atr_min_pct': 0.01116236089907701, 'sideways_atr_max_pct': 0.1205566374417789, 'sideways_tp_mult': 2.2359420525894858, 'sideways_tsl_mult': 0.41431248004330223, 'sideways_time_stop': 194, 'sideways_use_sma': False, 'sideways_use_ema': True, 'sideways_use_atr': True, 'sideways_use_adx': False, 'sideways_use_spike': True, 'sideways_rsi_required': True}.
[I 2025-08-29 19:54:02,380] Trial 149 finished with values: [-1000000000.0, 1000000000.0] and parameters: {'p_sma': 35, 'p_std': 51, 'p_atr': 23, 'p_adx': 30, 'rsi_period': 76, 'ema1': 13, 'ema2': 26, 'slip_atr_k': 0.12907550416140282, 'slip_spread_k': 0.05310340661423213, 'spread_hl_frac': 0.015075733597452281, 'bb_std_mult': 1.5765718046246304, 'rsi_os': 7, 'rsi_ob': 67, 'vol_spike': 0.1789101710322104, 'adx_thresh': 32.37898877931693, 'atr_min_pct': 0.013867349737391522, 'atr_max_pct': 0.0912404192718918, 'tp_mult': 1.4556392268533918, 'tsl_mult': 0.8965427873297356, 'strategy': 'mean_reversion', 'time_stop': 87, 'use_sma': False, 'use_atr': False, 'use_adx': False, 'use_ema': False, 'use_spike': False, 'rsi_required': False, 'edge_k': 0.5210896155375923, 'edge_cap': 0.4826974745869687, 'bull_strategy': 'breakout', 'bull_bb_std_mult': 1.174531800667811, 'bull_rsi_os': 41, 'bull_rsi_ob': 93, 'bull_adx_thresh': 19.194509588251204, 'bull_atr_min_pct': 0.022547291904094442, 'bull_atr_max_pct': 0.06181214273244915, 'bull_tp_mult': 1.6314509596480065, 'bull_tsl_mult': 0.9151244282242735, 'bull_time_stop': 291, 'bull_use_sma': False, 'bull_use_ema': True, 'bull_use_atr': False, 'bull_use_adx': True, 'bull_use_spike': False, 'bull_rsi_required': True, 'bear_strategy': 'breakout', 'bear_bb_std_mult': 1.0595386706656735, 'bear_rsi_os': 33, 'bear_rsi_ob': 65, 'bear_adx_thresh': 6.302583180711744, 'bear_atr_min_pct': 0.0057765093202429285, 'bear_atr_max_pct': 0.11452934082204391, 'bear_tp_mult': 1.9257026584669756, 'bear_tsl_mult': 0.6352519460785464, 'bear_time_stop': 20, 'bear_use_sma': False, 'bear_use_ema': False, 'bear_use_atr': True, 'bear_use_adx': False, 'bear_use_spike': False, 'bear_rsi_required': False, 'sideways_strategy': 'mean_reversion', 'sideways_bb_std_mult': 1.8891307612274684, 'sideways_rsi_os': 53, 'sideways_rsi_ob': 85, 'sideways_adx_thresh': 29.808124152926414, 'sideways_atr_min_pct': 0.01598643727318301, 'sideways_atr_max_pct': 0.1208106233147993, 'sideways_tp_mult': 2.229067980450897, 'sideways_tsl_mult': 0.8876196656970675, 'sideways_time_stop': 256, 'sideways_use_sma': False, 'sideways_use_ema': True, 'sideways_use_atr': True, 'sideways_use_adx': False, 'sideways_use_spike': False, 'sideways_rsi_required': True}.
[I 2025-08-29 19:54:02,931] Trial 147 finished with values: [-0.006028736648276745, 0.005977004891978803] and parameters: {'p_sma': 35, 'p_std': 51, 'p_atr': 23, 'p_adx': 15, 'rsi_period': 21, 'ema1': 13, 'ema2': 41, 'slip_atr_k': 0.12816057202723516, 'slip_spread_k': 0.39829145325518467, 'spread_hl_frac': 0.0236382728087636, 'bb_std_mult': 1.061249405064605, 'rsi_os': 18, 'rsi_ob': 52, 'vol_spike': 0.06029420182207615, 'adx_thresh': 32.2579228388379, 'atr_min_pct': 0.00918515852505217, 'atr_max_pct': 0.09083665971644007, 'tp_mult': 2.4542983089997947, 'tsl_mult': 0.5954478515963587, 'strategy': 'mean_reversion', 'time_stop': 150, 'use_sma': True, 'use_atr': True, 'use_adx': False, 'use_ema': True, 'use_spike': False, 'rsi_required': False, 'edge_k': 1.4807287029988698, 'edge_cap': 0.46941256587474034, 'bull_strategy': 'breakout', 'bull_bb_std_mult': 0.5882917237333198, 'bull_rsi_os': 30, 'bull_rsi_ob': 72, 'bull_adx_thresh': 15.662045046540872, 'bull_atr_min_pct': 0.02253855617801117, 'bull_atr_max_pct': 0.06405365593748774, 'bull_tp_mult': 1.8891000952527381, 'bull_tsl_mult': 0.26562177709560764, 'bull_time_stop': 291, 'bull_use_sma': False, 'bull_use_ema': True, 'bull_use_atr': False, 'bull_use_adx': True, 'bull_use_spike': False, 'bull_rsi_required': True, 'bear_strategy': 'breakout', 'bear_bb_std_mult': 1.0486003751069373, 'bear_rsi_os': 33, 'bear_rsi_ob': 68, 'bear_adx_thresh': 5.6060243250365325, 'bear_atr_min_pct': 0.005827717348875102, 'bear_atr_max_pct': 0.14403188413350826, 'bear_tp_mult': 1.858222120562423, 'bear_tsl_mult': 0.9769931455103296, 'bear_time_stop': 21, 'bear_use_sma': False, 'bear_use_ema': False, 'bear_use_atr': True, 'bear_use_adx': True, 'bear_use_spike': False, 'bear_rsi_required': False, 'sideways_strategy': 'mean_reversion', 'sideways_bb_std_mult': 2.0755543997648718, 'sideways_rsi_os': 54, 'sideways_rsi_ob': 61, 'sideways_adx_thresh': 27.396889107012207, 'sideways_atr_min_pct': 0.01599513870168965, 'sideways_atr_max_pct': 0.12449265449429206, 'sideways_tp_mult': 1.8532535523232234, 'sideways_tsl_mult': 0.2975533797465813, 'sideways_time_stop': 28, 'sideways_use_sma': False, 'sideways_use_ema': True, 'sideways_use_atr': True, 'sideways_use_adx': False, 'sideways_use_spike': False, 'sideways_rsi_required': True}.
[I 2025-08-29 19:54:03,110] Trial 148 finished with values: [-0.015777812974253957, 0.01574867452647256] and parameters: {'p_sma': 35, 'p_std': 56, 'p_atr': 29, 'p_adx': 30, 'rsi_period': 29, 'ema1': 13, 'ema2': 41, 'slip_atr_k': 0.12720289947019878, 'slip_spread_k': 0.24332115371132818, 'spread_hl_frac': 0.005981688967806043, 'bb_std_mult': 1.2876938263870432, 'rsi_os': 19, 'rsi_ob': 52, 'vol_spike': 0.06252068668512055, 'adx_thresh': 32.24242092473122, 'atr_min_pct': 0.02248984179366635, 'atr_max_pct': 0.09134572360010086, 'tp_mult': 2.4495040586797674, 'tsl_mult': 0.5397492059509525, 'strategy': 'mean_reversion', 'time_stop': 120, 'use_sma': True, 'use_atr': True, 'use_adx': False, 'use_ema': True, 'use_spike': False, 'rsi_required': False, 'edge_k': 1.4939249979859937, 'edge_cap': 0.29032764678294387, 'bull_strategy': 'breakout', 'bull_bb_std_mult': 1.2087855980392272, 'bull_rsi_os': 43, 'bull_rsi_ob': 66, 'bull_adx_thresh': 17.958166992447723, 'bull_atr_min_pct': 0.02266191535082013, 'bull_atr_max_pct': 0.06429151360028615, 'bull_tp_mult': 1.4004441251196045, 'bull_tsl_mult': 0.2684578685337487, 'bull_time_stop': 280, 'bull_use_sma': False, 'bull_use_ema': True, 'bull_use_atr': False, 'bull_use_adx': True, 'bull_use_spike': False, 'bull_rsi_required': True, 'bear_strategy': 'breakout', 'bear_bb_std_mult': 2.7848104586224096, 'bear_rsi_os': 38, 'bear_rsi_ob': 88, 'bear_adx_thresh': 5.531951560182312, 'bear_atr_min_pct': 0.004286450419258948, 'bear_atr_max_pct': 0.11399695347420424, 'bear_tp_mult': 1.8419288542470644, 'bear_tsl_mult': 0.19581341004950026, 'bear_time_stop': 19, 'bear_use_sma': False, 'bear_use_ema': False, 'bear_use_atr': True, 'bear_use_adx': True, 'bear_use_spike': False, 'bear_rsi_required': False, 'sideways_strategy': 'mean_reversion', 'sideways_bb_std_mult': 1.8925073793286509, 'sideways_rsi_os': 53, 'sideways_rsi_ob': 61, 'sideways_adx_thresh': 13.679934733171265, 'sideways_atr_min_pct': 0.01338868337211393, 'sideways_atr_max_pct': 0.11433391647207762, 'sideways_tp_mult': 2.245826786252332, 'sideways_tsl_mult': 0.8865758068080494, 'sideways_time_stop': 178, 'sideways_use_sma': False, 'sideways_use_ema': True, 'sideways_use_atr': True, 'sideways_use_adx': False, 'sideways_use_spike': False, 'sideways_rsi_required': True}.
[I 2025-08-29 19:54:03,186] Trial 151 finished with values: [-1000000000.0, 1000000000.0] and parameters: {'p_sma': 42, 'p_std': 11, 'p_atr': 23, 'p_adx': 15, 'rsi_period': 23, 'ema1': 13, 'ema2': 34, 'slip_atr_k': 0.0392210821888685, 'slip_spread_k': 0.2386426391909532, 'spread_hl_frac': 0.005911271841240561, 'bb_std_mult': 1.238428473710086, 'rsi_os': 22, 'rsi_ob': 67, 'vol_spike': 0.20312291748365446, 'adx_thresh': 34.974005812474424, 'atr_min_pct': 0.01988884320661503, 'atr_max_pct': 0.09223278574712918, 'tp_mult': 1.478060556082974, 'tsl_mult': 0.11949171605440873, 'strategy': 'mean_reversion', 'time_stop': 119, 'use_sma': False, 'use_atr': True, 'use_adx': False, 'use_ema': False, 'use_spike': False, 'rsi_required': True, 'edge_k': 1.4779385152775801, 'edge_cap': 0.40213488334408687, 'bull_strategy': 'breakout', 'bull_bb_std_mult': 1.1717458603271544, 'bull_rsi_os': 25, 'bull_rsi_ob': 50, 'bull_adx_thresh': 18.358136985462963, 'bull_atr_min_pct': 0.02255486297094475, 'bull_atr_max_pct': 0.06883092646536045, 'bull_tp_mult': 1.5933769559040902, 'bull_tsl_mult': 0.8227751691780627, 'bull_time_stop': 24, 'bull_use_sma': False, 'bull_use_ema': True, 'bull_use_atr': False, 'bull_use_adx': True, 'bull_use_spike': False, 'bull_rsi_required': True, 'bear_strategy': 'mean_reversion', 'bear_bb_std_mult': 1.115286816807256, 'bear_rsi_os': 33, 'bear_rsi_ob': 70, 'bear_adx_thresh': 5.364016999184772, 'bear_atr_min_pct': 0.026002880395069525, 'bear_atr_max_pct': 0.11409684416771859, 'bear_tp_mult': 2.051554393668261, 'bear_tsl_mult': 0.6467645900008347, 'bear_time_stop': 22, 'bear_use_sma': False, 'bear_use_ema': False, 'bear_use_atr': True, 'bear_use_adx': False, 'bear_use_spike': False, 'bear_rsi_required': False, 'sideways_strategy': 'mean_reversion', 'sideways_bb_std_mult': 2.0665041457514706, 'sideways_rsi_os': 51, 'sideways_rsi_ob': 85, 'sideways_adx_thresh': 27.41706396823954, 'sideways_atr_min_pct': 0.009458531970469194, 'sideways_atr_max_pct': 0.12452843099353816, 'sideways_tp_mult': 1.0900316530221918, 'sideways_tsl_mult': 0.1516903497788809, 'sideways_time_stop': 176, 'sideways_use_sma': False, 'sideways_use_ema': True, 'sideways_use_atr': True, 'sideways_use_adx': False, 'sideways_use_spike': False, 'sideways_rsi_required': True}.
[I 2025-08-29 19:54:33,851] Trial 152 finished with values: [-1000000000.0, 1000000000.0] and parameters: {'p_sma': 42, 'p_std': 11, 'p_atr': 22, 'p_adx': 15, 'rsi_period': 14, 'ema1': 11, 'ema2': 56, 'slip_atr_k': 0.03853351519280063, 'slip_spread_k': 0.2417954295460079, 'spread_hl_frac': 0.03407036846102808, 'bb_std_mult': 1.2399202392444508, 'rsi_os': 34, 'rsi_ob': 52, 'vol_spike': 0.058295766268063626, 'adx_thresh': 34.33536619912227, 'atr_min_pct': 0.01978951609423489, 'atr_max_pct': 0.09664678067676837, 'tp_mult': 2.3775094962651284, 'tsl_mult': 0.5974833786362317, 'strategy': 'mean_reversion', 'time_stop': 100, 'use_sma': False, 'use_atr': True, 'use_adx': False, 'use_ema': False, 'use_spike': False, 'rsi_required': True, 'edge_k': 1.499578816542901, 'edge_cap': 0.8892230629729039, 'bull_strategy': 'breakout', 'bull_bb_std_mult': 0.588707264964138, 'bull_rsi_os': 43, 'bull_rsi_ob': 92, 'bull_adx_thresh': 18.101714802432703, 'bull_atr_min_pct': 0.02398303159926723, 'bull_atr_max_pct': 0.06479421058004364, 'bull_tp_mult': 1.4871061411084214, 'bull_tsl_mult': 0.25981702863000145, 'bull_time_stop': 283, 'bull_use_sma': False, 'bull_use_ema': True, 'bull_use_atr': False, 'bull_use_adx': True, 'bull_use_spike': False, 'bull_rsi_required': True, 'bear_strategy': 'mean_reversion', 'bear_bb_std_mult': 1.108371772578372, 'bear_rsi_os': 26, 'bear_rsi_ob': 57, 'bear_adx_thresh': 26.010001539823627, 'bear_atr_min_pct': 0.011629956840629759, 'bear_atr_max_pct': 0.10541470141413223, 'bear_tp_mult': 2.0287781382106655, 'bear_tsl_mult': 0.7604101532351194, 'bear_time_stop': 82, 'bear_use_sma': False, 'bear_use_ema': False, 'bear_use_atr': False, 'bear_use_adx': False, 'bear_use_spike': False, 'bear_rsi_required': False, 'sideways_strategy': 'breakout', 'sideways_bb_std_mult': 2.045220710093681, 'sideways_rsi_os': 31, 'sideways_rsi_ob': 49, 'sideways_adx_thresh': 27.23912954625024, 'sideways_atr_min_pct': 0.018423734792743677, 'sideways_atr_max_pct': 0.11453632866868893, 'sideways_tp_mult': 1.8320803425544268, 'sideways_tsl_mult': 0.29579077748919724, 'sideways_time_stop': 276, 'sideways_use_sma': False, 'sideways_use_ema': True, 'sideways_use_atr': True, 'sideways_use_adx': False, 'sideways_use_spike': False, 'sideways_rsi_required': True}.
