[I 2025-08-29 19:40:45,202] Trial 36 finished with values: [-1000000000.0, 1000000000.0] and parameters: {'p_sma': 47, 'p_std': 54, 'p_atr': 27, 'p_adx': 14, 'rsi_period': 13, 'ema1': 17, 'ema2': 60, 'slip_atr_k': 0.018522528560472193, 'slip_spread_k': 0.5395352551440864, 'spread_hl_frac': 0.025353549432259488, 'bb_std_mult': 3.134888076306488, 'rsi_os': 29, 'rsi_ob': 78, 'vol_spike': 0.2180010168639941, 'adx_thresh': 16.863895900358024, 'atr_min_pct': 0.0034588058539884708, 'atr_max_pct': 0.07298475809157867, 'tp_mult': 2.0980237959028196, 'tsl_mult': 0.45168082290846484, 'strategy': 'mean_reversion', 'time_stop': 207, 'use_sma': True, 'use_atr': True, 'use_adx': False, 'use_ema': False, 'use_spike': True, 'rsi_required': True, 'edge_k': 1.7116461526642741, 'edge_cap': 0.6988897043542973, 'bull_strategy': 'mean_reversion', 'bull_bb_std_mult': 1.9295807014289181, 'bull_rsi_os': 55, 'bull_rsi_ob': 95, 'bull_adx_thresh': 12.445865574981632, 'bull_atr_min_pct': 0.016208925149362008, 'bull_atr_max_pct': 0.04480957571750657, 'bull_tp_mult': 1.9314516548688272, 'bull_tsl_mult': 0.8771466475704841, 'bull_time_stop': 238, 'bull_use_sma': False, 'bull_use_ema': False, 'bull_use_atr': True, 'bull_use_adx': True, 'bull_use_spike': True, 'bull_rsi_required': False, 'bear_strategy': 'mean_reversion', 'bear_bb_std_mult': 2.3810119567176127, 'bear_rsi_os': 35, 'bear_rsi_ob': 50, 'bear_adx_thresh': 9.747244438770771, 'bear_atr_min_pct': 0.0067690570042587845, 'bear_atr_max_pct': 0.08266947183569846, 'bear_tp_mult': 2.110468214281536, 'bear_tsl_mult': 0.42204690895857444, 'bear_time_stop': 157, 'bear_use_sma': False, 'bear_use_ema': False, 'bear_use_atr': True, 'bear_use_adx': False, 'bear_use_spike': False, 'bear_rsi_required': False, 'sideways_strategy': 'mean_reversion', 'sideways_bb_std_mult': 2.762055688494531, 'sideways_rsi_os': 5, 'sideways_rsi_ob': 90, 'sideways_adx_thresh': 15.168822780298694, 'sideways_atr_min_pct': 0.02310659899805216, 'sideways_atr_max_pct': 0.1389390252397532, 'sideways_tp_mult': 2.2900833357918904, 'sideways_tsl_mult': 0.18398501512171572, 'sideways_time_stop': 42, 'sideways_use_sma': True, 'sideways_use_ema': False, 'sideways_use_atr': True, 'sideways_use_adx': False, 'sideways_use_spike': True, 'sideways_rsi_required': False}.
[I 2025-08-29 19:41:14,830] Trial 37 finished with values: [-1000000000.0, 1000000000.0] and parameters: {'p_sma': 47, 'p_std': 54, 'p_atr': 13, 'p_adx': 22, 'rsi_period': 39, 'ema1': 17, 'ema2': 60, 'slip_atr_k': 0.08018339307975403, 'slip_spread_k': 0.5114981094020616, 'spread_hl_frac': 0.012344641228726526, 'bb_std_mult': 2.017592741988125, 'rsi_os': 45, 'rsi_ob': 78, 'vol_spike': 0.21975950811248818, 'adx_thresh': 16.57022635694833, 'atr_min_pct': 0.0034665039997635967, 'atr_max_pct': 0.13255071455217704, 'tp_mult': 2.157743472633486, 'tsl_mult': 0.6878669211689012, 'strategy': 'mean_reversion', 'time_stop': 205, 'use_sma': True, 'use_atr': True, 'use_adx': True, 'use_ema': False, 'use_spike': True, 'rsi_required': True, 'edge_k': 1.811148266243449, 'edge_cap': 0.6906884867896579, 'bull_strategy': 'mean_reversion', 'bull_bb_std_mult': 1.9687138266109083, 'bull_rsi_os': 55, 'bull_rsi_ob': 95, 'bull_adx_thresh': 21.937540078164403, 'bull_atr_min_pct': 0.01565836512344474, 'bull_atr_max_pct': 0.07456582542579522, 'bull_tp_mult': 2.857265163738165, 'bull_tsl_mult': 0.46949462381793133, 'bull_time_stop': 237, 'bull_use_sma': True, 'bull_use_ema': False, 'bull_use_atr': True, 'bull_use_adx': True, 'bull_use_spike': False, 'bull_rsi_required': False, 'bear_strategy': 'mean_reversion', 'bear_bb_std_mult': 2.30506464689903, 'bear_rsi_os': 14, 'bear_rsi_ob': 59, 'bear_adx_thresh': 9.47084937182798, 'bear_atr_min_pct': 0.006917131412551271, 'bear_atr_max_pct': 0.04357281890810673, 'bear_tp_mult': 1.5355871805180972, 'bear_tsl_mult': 0.4202149540992878, 'bear_time_stop': 133, 'bear_use_sma': False, 'bear_use_ema': False, 'bear_use_atr': False, 'bear_use_adx': False, 'bear_use_spike': False, 'bear_rsi_required': False, 'sideways_strategy': 'mean_reversion', 'sideways_bb_std_mult': 2.900753229918549, 'sideways_rsi_os': 5, 'sideways_rsi_ob': 90, 'sideways_adx_thresh': 5.665877940891109, 'sideways_atr_min_pct': 0.02321811434433295, 'sideways_atr_max_pct': 0.11985321748040977, 'sideways_tp_mult': 2.372736961153453, 'sideways_tsl_mult': 0.18359607270977574, 'sideways_time_stop': 34, 'sideways_use_sma': True, 'sideways_use_ema': False, 'sideways_use_atr': True, 'sideways_use_adx': False, 'sideways_use_spike': False, 'sideways_rsi_required': False}.
[I 2025-08-29 19:41:15,492] Trial 38 finished with values: [-1000000000.0, 1000000000.0] and parameters: {'p_sma': 54, 'p_std': 54, 'p_atr': 12, 'p_adx': 22, 'rsi_period': 49, 'ema1': 16, 'ema2': 54, 'slip_atr_k': 0.08260172295367671, 'slip_spread_k': 0.4183475001475662, 'spread_hl_frac': 0.012761012945004995, 'bb_std_mult': 3.1934898257535527, 'rsi_os': 29, 'rsi_ob': 84, 'vol_spike': 0.17245520161895259, 'adx_thresh': 16.596134629909987, 'atr_min_pct': 0.0029528202679676807, 'atr_max_pct': 0.1295551763805564, 'tp_mult': 2.123049584959543, 'tsl_mult': 0.7666017825959413, 'strategy': 'mean_reversion', 'time_stop': 7, 'use_sma': True, 'use_atr': True, 'use_adx': True, 'use_ema': True, 'use_spike': True, 'rsi_required': True, 'edge_k': 1.7520681616954168, 'edge_cap': 0.864155107696614, 'bull_strategy': 'mean_reversion', 'bull_bb_std_mult': 2.0125280542561397, 'bull_rsi_os': 49, 'bull_rsi_ob': 72, 'bull_adx_thresh': 11.836813292968364, 'bull_atr_min_pct': 0.02322216375014066, 'bull_atr_max_pct': 0.03051564301468758, 'bull_tp_mult': 2.8489693024214784, 'bull_tsl_mult': 0.4673177110054523, 'bull_time_stop': 233, 'bull_use_sma': True, 'bull_use_ema': False, 'bull_use_atr': False, 'bull_use_adx': True, 'bull_use_spike': False, 'bull_rsi_required': False, 'bear_strategy': 'mean_reversion', 'bear_bb_std_mult': 0.7519085641992007, 'bear_rsi_os': 14, 'bear_rsi_ob': 59, 'bear_adx_thresh': 10.493177799661423, 'bear_atr_min_pct': 0.007030685224469101, 'bear_atr_max_pct': 0.10943677865178468, 'bear_tp_mult': 2.090758813218531, 'bear_tsl_mult': 0.8685766230184424, 'bear_time_stop': 154, 'bear_use_sma': True, 'bear_use_ema': False, 'bear_use_atr': True, 'bear_use_adx': True, 'bear_use_spike': False, 'bear_rsi_required': False, 'sideways_strategy': 'mean_reversion', 'sideways_bb_std_mult': 2.907138317913013, 'sideways_rsi_os': 31, 'sideways_rsi_ob': 77, 'sideways_adx_thresh': 30.016385739752533, 'sideways_atr_min_pct': 0.018827181892090063, 'sideways_atr_max_pct': 0.03387669027618736, 'sideways_tp_mult': 2.311567754424036, 'sideways_tsl_mult': 0.46475038745791647, 'sideways_time_stop': 111, 'sideways_use_sma': True, 'sideways_use_ema': False, 'sideways_use_atr': True, 'sideways_use_adx': False, 'sideways_use_spike': True, 'sideways_rsi_required': False}.
[I 2025-08-29 19:41:15,518] Trial 39 finished with values: [-1000000000.0, 0.12282298987372176] and parameters: {'p_sma': 55, 'p_std': 47, 'p_atr': 27, 'p_adx': 22, 'rsi_period': 49, 'ema1': 29, 'ema2': 37, 'slip_atr_k': 0.12225274542218922, 'slip_spread_k': 0.4210869005504896, 'spread_hl_frac': 0.012133990159911137, 'bb_std_mult': 3.2942025337370566, 'rsi_os': 29, 'rsi_ob': 86, 'vol_spike': 0.17342732581368703, 'adx_thresh': 16.13298220696351, 'atr_min_pct': 0.002518056256909681, 'atr_max_pct': 0.07453890670152635, 'tp_mult': 2.147509825521531, 'tsl_mult': 0.6754962186254874, 'strategy': 'breakout', 'time_stop': 240, 'use_sma': False, 'use_atr': True, 'use_adx': True, 'use_ema': True, 'use_spike': True, 'rsi_required': False, 'edge_k': 1.9922611413973215, 'edge_cap': 0.8721542413283694, 'bull_strategy': 'mean_reversion', 'bull_bb_std_mult': 2.0745409677015294, 'bull_rsi_os': 49, 'bull_rsi_ob': 95, 'bull_adx_thresh': 12.264121530512433, 'bull_atr_min_pct': 0.0232521191540761, 'bull_atr_max_pct': 0.02801105075781324, 'bull_tp_mult': 2.5503429631165395, 'bull_tsl_mult': 0.848071574614415, 'bull_time_stop': 234, 'bull_use_sma': True, 'bull_use_ema': True, 'bull_use_atr': False, 'bull_use_adx': False, 'bull_use_spike': False, 'bull_rsi_required': False, 'bear_strategy': 'breakout', 'bear_bb_std_mult': 2.7506179948532687, 'bear_rsi_os': 47, 'bear_rsi_ob': 60, 'bear_adx_thresh': 7.31020992940289, 'bear_atr_min_pct': 0.0012235075178866146, 'bear_atr_max_pct': 0.08371362081395654, 'bear_tp_mult': 2.093035820508871, 'bear_tsl_mult': 0.8925963169617338, 'bear_time_stop': 143, 'bear_use_sma': True, 'bear_use_ema': False, 'bear_use_atr': True, 'bear_use_adx': True, 'bear_use_spike': True, 'bear_rsi_required': False, 'sideways_strategy': 'mean_reversion', 'sideways_bb_std_mult': 2.754715692646153, 'sideways_rsi_os': 20, 'sideways_rsi_ob': 77, 'sideways_adx_thresh': 14.661946224533683, 'sideways_atr_min_pct': 0.016660270474856232, 'sideways_atr_max_pct': 0.1389476641087497, 'sideways_tp_mult': 2.645913685236432, 'sideways_tsl_mult': 0.4692874442640295, 'sideways_time_stop': 36, 'sideways_use_sma': True, 'sideways_use_ema': False, 'sideways_use_atr': True, 'sideways_use_adx': True, 'sideways_use_spike': True, 'sideways_rsi_required': False}.
[I 2025-08-29 19:41:15,712] Trial 40 finished with values: [-1000000000.0, 1000000000.0] and parameters: {'p_sma': 53, 'p_std': 47, 'p_atr': 11, 'p_adx': 22, 'rsi_period': 40, 'ema1': 28, 'ema2': 39, 'slip_atr_k': 0.07929125153727548, 'slip_spread_k': 0.4235207504446154, 'spread_hl_frac': 0.04795210478546171, 'bb_std_mult': 2.1319835769891196, 'rsi_os': 48, 'rsi_ob': 85, 'vol_spike': 0.17361486706693752, 'adx_thresh': 22.73745442270896, 'atr_min_pct': 0.002236136378906064, 'atr_max_pct': 0.13691142534181525, 'tp_mult': 2.14777371663936, 'tsl_mult': 0.6783768653567894, 'strategy': 'breakout', 'time_stop': 236, 'use_sma': False, 'use_atr': True, 'use_adx': True, 'use_ema': True, 'use_spike': True, 'rsi_required': False, 'edge_k': 1.8765945720176402, 'edge_cap': 0.8319104296846173, 'bull_strategy': 'breakout', 'bull_bb_std_mult': 2.295855796227792, 'bull_rsi_os': 31, 'bull_rsi_ob': 70, 'bull_adx_thresh': 22.41514438875343, 'bull_atr_min_pct': 0.0236057827270528, 'bull_atr_max_pct': 0.02638708727774987, 'bull_tp_mult': 2.524999402935643, 'bull_tsl_mult': 0.4577940634564317, 'bull_time_stop': 226, 'bull_use_sma': True, 'bull_use_ema': True, 'bull_use_atr': False, 'bull_use_adx': False, 'bull_use_spike': False, 'bull_rsi_required': False, 'bear_strategy': 'breakout', 'bear_bb_std_mult': 0.760524702515452, 'bear_rsi_os': 14, 'bear_rsi_ob': 60, 'bear_adx_thresh': 5.050486506369381, 'bear_atr_min_pct': 0.0017896891101161394, 'bear_atr_max_pct': 0.03988900365784334, 'bear_tp_mult': 1.5914459504817622, 'bear_tsl_mult': 0.7343733708775348, 'bear_time_stop': 143, 'bear_use_sma': True, 'bear_use_ema': False, 'bear_use_atr': True, 'bear_use_adx': True, 'bear_use_spike': True, 'bear_rsi_required': True, 'sideways_strategy': 'mean_reversion', 'sideways_bb_std_mult': 3.017727840168888, 'sideways_rsi_os': 20, 'sideways_rsi_ob': 76, 'sideways_adx_thresh': 8.114881287218934, 'sideways_atr_min_pct': 0.018964750364211143, 'sideways_atr_max_pct': 0.11904358247193683, 'sideways_tp_mult': 2.6771360226474834, 'sideways_tsl_mult': 0.6113732273134811, 'sideways_time_stop': 246, 'sideways_use_sma': False, 'sideways_use_ema': False, 'sideways_use_atr': True, 'sideways_use_adx': True, 'sideways_use_spike': True, 'sideways_rsi_required': False}.
[I 2025-08-29 19:41:45,501] Trial 41 finished with values: [-1000000000.0, 0.1577177217393238] and parameters: {'p_sma': 57, 'p_std': 22, 'p_atr': 10, 'p_adx': 25, 'rsi_period': 50, 'ema1': 13, 'ema2': 38, 'slip_atr_k': 0.12206858778452132, 'slip_spread_k': 0.9495118965548326, 'spread_hl_frac': 0.04845411173534575, 'bb_std_mult': 2.5141503294509593, 'rsi_os': 12, 'rsi_ob': 87, 'vol_spike': 0.1728598853471891, 'adx_thresh': 9.304929215363174, 'atr_min_pct': 0.0021900614069071435, 'atr_max_pct': 0.07508099651376296, 'tp_mult': 1.8395048608666615, 'tsl_mult': 0.5773053950438258, 'strategy': 'breakout', 'time_stop': 9, 'use_sma': False, 'use_atr': True, 'use_adx': True, 'use_ema': True, 'use_spike': True, 'rsi_required': False, 'edge_k': 1.979650572027394, 'edge_cap': 0.8473224427404416, 'bull_strategy': 'breakout', 'bull_bb_std_mult': 2.3560726095846447, 'bull_rsi_os': 48, 'bull_rsi_ob': 71, 'bull_adx_thresh': 7.891069157903891, 'bull_atr_min_pct': 0.02263358658797521, 'bull_atr_max_pct': 0.025919309851184354, 'bull_tp_mult': 2.523409518077526, 'bull_tsl_mult': 0.7293595034093567, 'bull_time_stop': 218, 'bull_use_sma': True, 'bull_use_ema': True, 'bull_use_atr': False, 'bull_use_adx': False, 'bull_use_spike': False, 'bull_rsi_required': False, 'bear_strategy': 'breakout', 'bear_bb_std_mult': 0.7689646747250782, 'bear_rsi_os': 47, 'bear_rsi_ob': 83, 'bear_adx_thresh': 7.355609221701525, 'bear_atr_min_pct': 0.0014130577379203569, 'bear_atr_max_pct': 0.11098008979212727, 'bear_tp_mult': 2.4967491399557953, 'bear_tsl_mult': 0.9124997758242686, 'bear_time_stop': 150, 'bear_use_sma': True, 'bear_use_ema': False, 'bear_use_atr': True, 'bear_use_adx': True, 'bear_use_spike': True, 'bear_rsi_required': True, 'sideways_strategy': 'breakout', 'sideways_bb_std_mult': 1.869436427759536, 'sideways_rsi_os': 13, 'sideways_rsi_ob': 76, 'sideways_adx_thresh': 27.322330063712794, 'sideways_atr_min_pct': 0.018591689840168468, 'sideways_atr_max_pct': 0.0762470413044972, 'sideways_tp_mult': 2.6354898448475597, 'sideways_tsl_mult': 0.4577251316896541, 'sideways_time_stop': 86, 'sideways_use_sma': False, 'sideways_use_ema': False, 'sideways_use_atr': True, 'sideways_use_adx': True, 'sideways_use_spike': True, 'sideways_rsi_required': False}.
[I 2025-08-29 19:41:45,785] Trial 43 finished with values: [-1000000000.0, 0.11655829234520253] and parameters: {'p_sma': 60, 'p_std': 39, 'p_atr': 10, 'p_adx': 25, 'rsi_period': 28, 'ema1': 7, 'ema2': 40, 'slip_atr_k': 0.20427802156088237, 'slip_spread_k': 0.9367813994562522, 'spread_hl_frac': 0.035160213527990536, 'bb_std_mult': 1.3454978813738394, 'rsi_os': 12, 'rsi_ob': 92, 'vol_spike': 0.14499420468751148, 'adx_thresh': 23.472122661648083, 'atr_min_pct': 0.0054036287821699214, 'atr_max_pct': 0.11293883204794136, 'tp_mult': 2.536600051943527, 'tsl_mult': 0.5732551033399639, 'strategy': 'breakout', 'time_stop': 131, 'use_sma': False, 'use_atr': True, 'use_adx': True, 'use_ema': True, 'use_spike': True, 'rsi_required': False, 'edge_k': 1.8916882960222507, 'edge_cap': 0.5595430593670093, 'bull_strategy': 'breakout', 'bull_bb_std_mult': 2.3504827508641193, 'bull_rsi_os': 31, 'bull_rsi_ob': 82, 'bull_adx_thresh': 8.338497685275822, 'bull_atr_min_pct': 0.027047851922667884, 'bull_atr_max_pct': 0.05947069063219425, 'bull_tp_mult': 2.729735322489243, 'bull_tsl_mult': 0.7501578649613416, 'bull_time_stop': 26, 'bull_use_sma': True, 'bull_use_ema': True, 'bull_use_atr': False, 'bull_use_adx': False, 'bull_use_spike': True, 'bull_rsi_required': True, 'bear_strategy': 'breakout', 'bear_bb_std_mult': 1.4853249096148464, 'bear_rsi_os': 19, 'bear_rsi_ob': 45, 'bear_adx_thresh': 27.775951818726277, 'bear_atr_min_pct': 0.0019798749316739857, 'bear_atr_max_pct': 0.12692685632017028, 'bear_tp_mult': 2.4687422672929693, 'bear_tsl_mult': 0.6681234673539658, 'bear_time_stop': 255, 'bear_use_sma': True, 'bear_use_ema': True, 'bear_use_atr': True, 'bear_use_adx': True, 'bear_use_spike': True, 'bear_rsi_required': True, 'sideways_strategy': 'breakout', 'sideways_bb_std_mult': 1.2644504737117432, 'sideways_rsi_os': 51, 'sideways_rsi_ob': 67, 'sideways_adx_thresh': 27.456116596590746, 'sideways_atr_min_pct': 0.0011943757996998056, 'sideways_atr_max_pct': 0.12226803765408017, 'sideways_tp_mult': 2.052037405187347, 'sideways_tsl_mult': 0.5985337488485233, 'sideways_time_stop': 259, 'sideways_use_sma': False, 'sideways_use_ema': True, 'sideways_use_atr': True, 'sideways_use_adx': True, 'sideways_use_spike': False, 'sideways_rsi_required': False}.
[I 2025-08-29 19:41:46,195] Trial 44 finished with values: [-1000000000.0, 0.2777215774856417] and parameters: {'p_sma': 57, 'p_std': 22, 'p_atr': 9, 'p_adx': 9, 'rsi_period': 30, 'ema1': 25, 'ema2': 22, 'slip_atr_k': 0.2080190085414763, 'slip_spread_k': 0.03493607147675981, 'spread_hl_frac': 0.025177538376553565, 'bb_std_mult': 2.4359969000442985, 'rsi_os': 12, 'rsi_ob': 92, 'vol_spike': 0.136196663058216, 'adx_thresh': 18.93862178128861, 'atr_min_pct': 0.005337542457727147, 'atr_max_pct': 0.09713426757261046, 'tp_mult': 1.8362180700233295, 'tsl_mult': 0.5574595187592873, 'strategy': 'breakout', 'time_stop': 35, 'use_sma': False, 'use_atr': False, 'use_adx': False, 'use_ema': False, 'use_spike': True, 'rsi_required': False, 'edge_k': 0.5738918256357698, 'edge_cap': 0.557316927418065, 'bull_strategy': 'breakout', 'bull_bb_std_mult': 1.7438520564803146, 'bull_rsi_os': 47, 'bull_rsi_ob': 82, 'bull_adx_thresh': 8.123783306748425, 'bull_atr_min_pct': 0.003133244569351455, 'bull_atr_max_pct': 0.05994449835648645, 'bull_tp_mult': 2.7506474071286675, 'bull_tsl_mult': 0.7323210220908896, 'bull_time_stop': 33, 'bull_use_sma': True, 'bull_use_ema': True, 'bull_use_atr': False, 'bull_use_adx': True, 'bull_use_spike': True, 'bull_rsi_required': True, 'bear_strategy': 'breakout', 'bear_bb_std_mult': 1.4118765574772683, 'bear_rsi_os': 19, 'bear_rsi_ob': 66, 'bear_adx_thresh': 28.150027504360892, 'bear_atr_min_pct': 0.002812986190786037, 'bear_atr_max_pct': 0.12939699277600267, 'bear_tp_mult': 2.7169519606513486, 'bear_tsl_mult': 0.6466855442369344, 'bear_time_stop': 266, 'bear_use_sma': True, 'bear_use_ema': True, 'bear_use_atr': True, 'bear_use_adx': False, 'bear_use_spike': True, 'bear_rsi_required': True, 'sideways_strategy': 'breakout', 'sideways_bb_std_mult': 2.2696883586145025, 'sideways_rsi_os': 53, 'sideways_rsi_ob': 68, 'sideways_adx_thresh': 27.586737590629237, 'sideways_atr_min_pct': 0.00023722036179873486, 'sideways_atr_max_pct': 0.12759291642102083, 'sideways_tp_mult': 2.107634855408642, 'sideways_tsl_mult': 0.31142615189028283, 'sideways_time_stop': 151, 'sideways_use_sma': False, 'sideways_use_ema': True, 'sideways_use_atr': True, 'sideways_use_adx': True, 'sideways_use_spike': False, 'sideways_rsi_required': False}.
[I 2025-08-29 19:41:46,214] Trial 42 finished with values: [-1000000000.0, 0.1472376095355355] and parameters: {'p_sma': 55, 'p_std': 46, 'p_atr': 10, 'p_adx': 25, 'rsi_period': 28, 'ema1': 29, 'ema2': 40, 'slip_atr_k': 0.12502527977195926, 'slip_spread_k': 0.9945670072391216, 'spread_hl_frac': 0.04777860534881586, 'bb_std_mult': 2.439549344075295, 'rsi_os': 50, 'rsi_ob': 60, 'vol_spike': 0.14637357110304788, 'adx_thresh': 9.510240722365957, 'atr_min_pct': 0.012529730600540093, 'atr_max_pct': 0.07770125921634626, 'tp_mult': 2.54623367644276, 'tsl_mult': 0.5661020302044641, 'strategy': 'breakout', 'time_stop': 234, 'use_sma': False, 'use_atr': True, 'use_adx': True, 'use_ema': True, 'use_spike': True, 'rsi_required': False, 'edge_k': 0.8800525544315319, 'edge_cap': 0.855908878590834, 'bull_strategy': 'breakout', 'bull_bb_std_mult': 2.30642850115631, 'bull_rsi_os': 31, 'bull_rsi_ob': 83, 'bull_adx_thresh': 25.780776050217373, 'bull_atr_min_pct': 0.0034877642603572453, 'bull_atr_max_pct': 0.06100390004472861, 'bull_tp_mult': 2.5297187326367254, 'bull_tsl_mult': 0.7358097233255433, 'bull_time_stop': 12, 'bull_use_sma': True, 'bull_use_ema': True, 'bull_use_atr': False, 'bull_use_adx': False, 'bull_use_spike': False, 'bull_rsi_required': True, 'bear_strategy': 'breakout', 'bear_bb_std_mult': 2.6713179383864745, 'bear_rsi_os': 47, 'bear_rsi_ob': 80, 'bear_adx_thresh': 7.379525546039723, 'bear_atr_min_pct': 0.0014716665578805486, 'bear_atr_max_pct': 0.1258230544599593, 'bear_tp_mult': 2.4864726954959315, 'bear_tsl_mult': 0.6260669228962883, 'bear_time_stop': 243, 'bear_use_sma': True, 'bear_use_ema': True, 'bear_use_atr': True, 'bear_use_adx': True, 'bear_use_spike': True, 'bear_rsi_required': True, 'sideways_strategy': 'breakout', 'sideways_bb_std_mult': 1.254354760196347, 'sideways_rsi_os': 51, 'sideways_rsi_ob': 67, 'sideways_adx_thresh': 27.675740127626373, 'sideways_atr_min_pct': 0.002484033607642884, 'sideways_atr_max_pct': 0.07036664495329144, 'sideways_tp_mult': 2.140975025169407, 'sideways_tsl_mult': 0.3303892881357525, 'sideways_time_stop': 80, 'sideways_use_sma': False, 'sideways_use_ema': True, 'sideways_use_atr': True, 'sideways_use_adx': True, 'sideways_use_spike': True, 'sideways_rsi_required': False}.
