[I 2025-08-29 19:55:36,003] Trial 161 finished with values: [-1000000000.0, 1000000000.0] and parameters: {'p_sma': 36, 'p_std': 49, 'p_atr': 20, 'p_adx': 18, 'rsi_period': 24, 'ema1': 14, 'ema2': 43, 'slip_atr_k': 0.15356542524038871, 'slip_spread_k': 0.9552464468671383, 'spread_hl_frac': 0.0012383499944715547, 'bb_std_mult': 3.2607515100861786, 'rsi_os': 20, 'rsi_ob': 74, 'vol_spike': 0.21373994393260037, 'adx_thresh': 34.33604149401654, 'atr_min_pct': 0.012463652516122088, 'atr_max_pct': 0.0874460553600113, 'tp_mult': 1.241645943938786, 'tsl_mult': 0.5219354267705462, 'strategy': 'mean_reversion', 'time_stop': 106, 'use_sma': False, 'use_atr': False, 'use_adx': False, 'use_ema': True, 'use_spike': False, 'rsi_required': False, 'edge_k': 0.27620494045502075, 'edge_cap': 0.9659708037918211, 'bull_strategy': 'breakout', 'bull_bb_std_mult': 3.211506248574901, 'bull_rsi_os': 32, 'bull_rsi_ob': 64, 'bull_adx_thresh': 15.019477544081202, 'bull_atr_min_pct': 0.013711738504412447, 'bull_atr_max_pct': 0.058385824911010006, 'bull_tp_mult': 1.6619925027085416, 'bull_tsl_mult': 0.5275339061079006, 'bull_time_stop': 158, 'bull_use_sma': False, 'bull_use_ema': True, 'bull_use_atr': True, 'bull_use_adx': True, 'bull_use_spike': False, 'bull_rsi_required': True, 'bear_strategy': 'breakout', 'bear_bb_std_mult': 3.3919469629123027, 'bear_rsi_os': 51, 'bear_rsi_ob': 67, 'bear_adx_thresh': 13.636188378286647, 'bear_atr_min_pct': 0.02403919935876947, 'bear_atr_max_pct': 0.14864545075553898, 'bear_tp_mult': 1.878667110256351, 'bear_tsl_mult': 0.5836281290733203, 'bear_time_stop': 29, 'bear_use_sma': False, 'bear_use_ema': False, 'bear_use_atr': True, 'bear_use_adx': True, 'bear_use_spike': True, 'bear_rsi_required': True, 'sideways_strategy': 'mean_reversion', 'sideways_bb_std_mult': 1.964280040233739, 'sideways_rsi_os': 31, 'sideways_rsi_ob': 84, 'sideways_adx_thresh': 29.790861019619022, 'sideways_atr_min_pct': 0.007524086392922482, 'sideways_atr_max_pct': 0.12891257225425107, 'sideways_tp_mult': 2.1946532954175773, 'sideways_tsl_mult': 0.24881723509064335, 'sideways_time_stop': 294, 'sideways_use_sma': False, 'sideways_use_ema': True, 'sideways_use_atr': False, 'sideways_use_adx': True, 'sideways_use_spike': False, 'sideways_rsi_required': True}.
[I 2025-08-29 19:55:36,255] Trial 160 finished with values: [-1000000000.0, 1000000000.0] and parameters: {'p_sma': 36, 'p_std': 54, 'p_atr': 24, 'p_adx': 9, 'rsi_period': 24, 'ema1': 12, 'ema2': 16, 'slip_atr_k': 0.19661538835109413, 'slip_spread_k': 0.3123432581568444, 'spread_hl_frac': 0.002334181976048729, 'bb_std_mult': 2.391448343511956, 'rsi_os': 18, 'rsi_ob': 74, 'vol_spike': 0.21576804368613356, 'adx_thresh': 34.055061591441245, 'atr_min_pct': 0.016389092664922115, 'atr_max_pct': 0.08033000799963372, 'tp_mult': 1.7140219432755595, 'tsl_mult': 0.28677670841276787, 'strategy': 'mean_reversion', 'time_stop': 76, 'use_sma': True, 'use_atr': False, 'use_adx': False, 'use_ema': True, 'use_spike': False, 'rsi_required': False, 'edge_k': 0.258464131392093, 'edge_cap': 0.4198288385327795, 'bull_strategy': 'breakout', 'bull_bb_std_mult': 0.7823765603793578, 'bull_rsi_os': 46, 'bull_rsi_ob': 95, 'bull_adx_thresh': 20.073761176984718, 'bull_atr_min_pct': 0.004495910227651941, 'bull_atr_max_pct': 0.05833510627509346, 'bull_tp_mult': 1.7374285431720022, 'bull_tsl_mult': 0.1837578893872711, 'bull_time_stop': 300, 'bull_use_sma': False, 'bull_use_ema': False, 'bull_use_atr': True, 'bull_use_adx': False, 'bull_use_spike': False, 'bull_rsi_required': True, 'bear_strategy': 'breakout', 'bear_bb_std_mult': 3.3726498286366926, 'bear_rsi_os': 41, 'bear_rsi_ob': 83, 'bear_adx_thresh': 14.385097656117395, 'bear_atr_min_pct': 0.024474604653252394, 'bear_atr_max_pct': 0.11867158851525926, 'bear_tp_mult': 1.8943730730051698, 'bear_tsl_mult': 0.9701783606688137, 'bear_time_stop': 91, 'bear_use_sma': False, 'bear_use_ema': True, 'bear_use_atr': True, 'bear_use_adx': True, 'bear_use_spike': True, 'bear_rsi_required': True, 'sideways_strategy': 'mean_reversion', 'sideways_bb_std_mult': 3.32981373939727, 'sideways_rsi_os': 30, 'sideways_rsi_ob': 81, 'sideways_adx_thresh': 8.170085726932363, 'sideways_atr_min_pct': 0.005001159802184496, 'sideways_atr_max_pct': 0.05306610669120994, 'sideways_tp_mult': 2.1894934747452046, 'sideways_tsl_mult': 0.24936144371165916, 'sideways_time_stop': 36, 'sideways_use_sma': False, 'sideways_use_ema': True, 'sideways_use_atr': False, 'sideways_use_adx': True, 'sideways_use_spike': False, 'sideways_rsi_required': True}.
[I 2025-08-29 19:56:05,438] Trial 164 finished with values: [-1000000000.0, 1000000000.0] and parameters: {'p_sma': 36, 'p_std': 54, 'p_atr': 20, 'p_adx': 19, 'rsi_period': 69, 'ema1': 12, 'ema2': 42, 'slip_atr_k': 0.0480207885223463, 'slip_spread_k': 0.9717647458057929, 'spread_hl_frac': 0.0012204182696390477, 'bb_std_mult': 2.236540952501422, 'rsi_os': 21, 'rsi_ob': 61, 'vol_spike': 0.15483398500716575, 'adx_thresh': 31.362875555809197, 'atr_min_pct': 0.013673037920768731, 'atr_max_pct': 0.08624501994432525, 'tp_mult': 2.4114610520041126, 'tsl_mult': 0.772122127837423, 'strategy': 'mean_reversion', 'time_stop': 82, 'use_sma': False, 'use_atr': True, 'use_adx': False, 'use_ema': False, 'use_spike': False, 'rsi_required': True, 'edge_k': 1.3378456186082168, 'edge_cap': 0.5047888185103523, 'bull_strategy': 'breakout', 'bull_bb_std_mult': 2.874824429177388, 'bull_rsi_os': 32, 'bull_rsi_ob': 95, 'bull_adx_thresh': 17.465764630450135, 'bull_atr_min_pct': 0.01427938092842311, 'bull_atr_max_pct': 0.06081547766614765, 'bull_tp_mult': 1.559298707201588, 'bull_tsl_mult': 0.1361788405712304, 'bull_time_stop': 101, 'bull_use_sma': False, 'bull_use_ema': True, 'bull_use_atr': False, 'bull_use_adx': False, 'bull_use_spike': False, 'bull_rsi_required': True, 'bear_strategy': 'breakout', 'bear_bb_std_mult': 1.2294809880215394, 'bear_rsi_os': 32, 'bear_rsi_ob': 68, 'bear_adx_thresh': 6.13375421506277, 'bear_atr_min_pct': 0.017786243304195513, 'bear_atr_max_pct': 0.09753961878112048, 'bear_tp_mult': 1.8788054145198376, 'bear_tsl_mult': 0.6479063989777059, 'bear_time_stop': 286, 'bear_use_sma': False, 'bear_use_ema': False, 'bear_use_atr': True, 'bear_use_adx': False, 'bear_use_spike': True, 'bear_rsi_required': True, 'sideways_strategy': 'mean_reversion', 'sideways_bb_std_mult': 1.972878948848638, 'sideways_rsi_os': 30, 'sideways_rsi_ob': 61, 'sideways_adx_thresh': 29.95447724666557, 'sideways_atr_min_pct': 0.02723150849353798, 'sideways_atr_max_pct': 0.11741362892401185, 'sideways_tp_mult': 2.149006805187149, 'sideways_tsl_mult': 0.20595084975162836, 'sideways_time_stop': 256, 'sideways_use_sma': False, 'sideways_use_ema': False, 'sideways_use_atr': False, 'sideways_use_adx': True, 'sideways_use_spike': False, 'sideways_rsi_required': True}.
[I 2025-08-29 19:56:05,955] Trial 165 finished with values: [-0.0018306217813369718, 0.002486738909081453] and parameters: {'p_sma': 39, 'p_std': 54, 'p_atr': 16, 'p_adx': 17, 'rsi_period': 84, 'ema1': 12, 'ema2': 42, 'slip_atr_k': 0.04179147513763652, 'slip_spread_k': 0.31981314318329646, 'spread_hl_frac': 0.001034895074598697, 'bb_std_mult': 1.3216355761023277, 'rsi_os': 21, 'rsi_ob': 74, 'vol_spike': 0.15714159847675285, 'adx_thresh': 32.56699949823791, 'atr_min_pct': 0.01355352447519023, 'atr_max_pct': 0.08496581151917701, 'tp_mult': 2.4281172848917776, 'tsl_mult': 0.7833966370538397, 'strategy': 'mean_reversion', 'time_stop': 104, 'use_sma': False, 'use_atr': True, 'use_adx': False, 'use_ema': False, 'use_spike': False, 'rsi_required': True, 'edge_k': 1.3553459737584583, 'edge_cap': 0.49934516843591537, 'bull_strategy': 'breakout', 'bull_bb_std_mult': 2.9827849110526676, 'bull_rsi_os': 40, 'bull_rsi_ob': 95, 'bull_adx_thresh': 17.57099873479634, 'bull_atr_min_pct': 0.014483571573614403, 'bull_atr_max_pct': 0.06052887283978265, 'bull_tp_mult': 1.5621719456426677, 'bull_tsl_mult': 0.1431495562792621, 'bull_time_stop': 95, 'bull_use_sma': False, 'bull_use_ema': True, 'bull_use_atr': False, 'bull_use_adx': False, 'bull_use_spike': False, 'bull_rsi_required': True, 'bear_strategy': 'breakout', 'bear_bb_std_mult': 1.2524879721120397, 'bear_rsi_os': 49, 'bear_rsi_ob': 68, 'bear_adx_thresh': 5.882082161142994, 'bear_atr_min_pct': 0.007520958431317254, 'bear_atr_max_pct': 0.10404383612856669, 'bear_tp_mult': 1.8596427367962851, 'bear_tsl_mult': 0.65228974513015, 'bear_time_stop': 208, 'bear_use_sma': False, 'bear_use_ema': False, 'bear_use_atr': True, 'bear_use_adx': False, 'bear_use_spike': True, 'bear_rsi_required': False, 'sideways_strategy': 'mean_reversion', 'sideways_bb_std_mult': 1.9919297550004216, 'sideways_rsi_os': 29, 'sideways_rsi_ob': 61, 'sideways_adx_thresh': 22.667381004751032, 'sideways_atr_min_pct': 0.027081643849312262, 'sideways_atr_max_pct': 0.12337793258992562, 'sideways_tp_mult': 2.1440274255362217, 'sideways_tsl_mult': 0.21370631101570994, 'sideways_time_stop': 264, 'sideways_use_sma': False, 'sideways_use_ema': True, 'sideways_use_atr': False, 'sideways_use_adx': True, 'sideways_use_spike': False, 'sideways_rsi_required': True}.
[I 2025-08-29 19:56:06,330] Trial 166 finished with values: [-1000000000.0, 1000000000.0] and parameters: {'p_sma': 40, 'p_std': 54, 'p_atr': 23, 'p_adx': 17, 'rsi_period': 17, 'ema1': 17, 'ema2': 11, 'slip_atr_k': 0.04784357768593772, 'slip_spread_k': 0.1660001271159021, 'spread_hl_frac': 0.0031988677567738747, 'bb_std_mult': 1.3145302184086578, 'rsi_os': 23, 'rsi_ob': 66, 'vol_spike': 0.17150673667453334, 'adx_thresh': 31.165496354322404, 'atr_min_pct': 0.013422811226699412, 'atr_max_pct': 0.08574586041346449, 'tp_mult': 2.457208431727594, 'tsl_mult': 0.7829476212220898, 'strategy': 'mean_reversion', 'time_stop': 83, 'use_sma': True, 'use_atr': True, 'use_adx': False, 'use_ema': False, 'use_spike': False, 'rsi_required': True, 'edge_k': 1.3422849645533308, 'edge_cap': 0.7205282169510823, 'bull_strategy': 'breakout', 'bull_bb_std_mult': 0.895790951079328, 'bull_rsi_os': 48, 'bull_rsi_ob': 54, 'bull_adx_thresh': 17.594147874793475, 'bull_atr_min_pct': 0.014617680760551834, 'bull_atr_max_pct': 0.06088419309184614, 'bull_tp_mult': 1.5430996460436013, 'bull_tsl_mult': 0.18181862196924709, 'bull_time_stop': 282, 'bull_use_sma': False, 'bull_use_ema': True, 'bull_use_atr': False, 'bull_use_adx': False, 'bull_use_spike': False, 'bull_rsi_required': True, 'bear_strategy': 'breakout', 'bear_bb_std_mult': 1.0348754706756378, 'bear_rsi_os': 32, 'bear_rsi_ob': 68, 'bear_adx_thresh': 5.801174742343245, 'bear_atr_min_pct': 0.015354918471868767, 'bear_atr_max_pct': 0.06331004761431162, 'bear_tp_mult': 1.8499509173232451, 'bear_tsl_mult': 0.6614710940358587, 'bear_time_stop': 90, 'bear_use_sma': False, 'bear_use_ema': False, 'bear_use_atr': True, 'bear_use_adx': False, 'bear_use_spike': False, 'bear_rsi_required': False, 'sideways_strategy': 'mean_reversion', 'sideways_bb_std_mult': 1.9808597820301381, 'sideways_rsi_os': 36, 'sideways_rsi_ob': 69, 'sideways_adx_thresh': 16.117943165620307, 'sideways_atr_min_pct': 0.012141045367609168, 'sideways_atr_max_pct': 0.12476829120700784, 'sideways_tp_mult': 2.156256020975133, 'sideways_tsl_mult': 0.6662218658237578, 'sideways_time_stop': 264, 'sideways_use_sma': False, 'sideways_use_ema': True, 'sideways_use_atr': True, 'sideways_use_adx': False, 'sideways_use_spike': False, 'sideways_rsi_required': True}.
[I 2025-08-29 19:56:06,480] Trial 167 finished with values: [-1000000000.0, 1000000000.0] and parameters: {'p_sma': 40, 'p_std': 54, 'p_atr': 16, 'p_adx': 17, 'rsi_period': 71, 'ema1': 12, 'ema2': 42, 'slip_atr_k': 0.04592710558130234, 'slip_spread_k': 0.16810202961939924, 'spread_hl_frac': 0.004070618109031364, 'bb_std_mult': 2.216285951676354, 'rsi_os': 23, 'rsi_ob': 72, 'vol_spike': 0.15784116851348293, 'adx_thresh': 31.095923503346526, 'atr_min_pct': 0.013499688588909459, 'atr_max_pct': 0.08446098678397473, 'tp_mult': 1.015063430896872, 'tsl_mult': 0.06399098189380409, 'strategy': 'mean_reversion', 'time_stop': 169, 'use_sma': False, 'use_atr': True, 'use_adx': False, 'use_ema': False, 'use_spike': False, 'rsi_required': True, 'edge_k': 1.3428063635672438, 'edge_cap': 0.5027018234899507, 'bull_strategy': 'breakout', 'bull_bb_std_mult': 0.8838322758031099, 'bull_rsi_os': 50, 'bull_rsi_ob': 93, 'bull_adx_thresh': 19.40180962517959, 'bull_atr_min_pct': 0.009889090332750622, 'bull_atr_max_pct': 0.061495148282254296, 'bull_tp_mult': 1.558149475525409, 'bull_tsl_mult': 0.9436963652571967, 'bull_time_stop': 186, 'bull_use_sma': False, 'bull_use_ema': True, 'bull_use_atr': False, 'bull_use_adx': False, 'bull_use_spike': False, 'bull_rsi_required': True, 'bear_strategy': 'breakout', 'bear_bb_std_mult': 0.5064793786669561, 'bear_rsi_os': 32, 'bear_rsi_ob': 68, 'bear_adx_thresh': 6.041225473586472, 'bear_atr_min_pct': 0.01483432918574887, 'bear_atr_max_pct': 0.12159841441023894, 'bear_tp_mult': 1.8587943043907962, 'bear_tsl_mult': 0.6556896714120232, 'bear_time_stop': 9, 'bear_use_sma': False, 'bear_use_ema': False, 'bear_use_atr': True, 'bear_use_adx': False, 'bear_use_spike': False, 'bear_rsi_required': False, 'sideways_strategy': 'mean_reversion', 'sideways_bb_std_mult': 3.5843789932230825, 'sideways_rsi_os': 5, 'sideways_rsi_ob': 60, 'sideways_adx_thresh': 16.099881608721947, 'sideways_atr_min_pct': 0.017372237286358935, 'sideways_atr_max_pct': 0.022175787888826348, 'sideways_tp_mult': 2.1248747170970295, 'sideways_tsl_mult': 0.2079206320428244, 'sideways_time_stop': 265, 'sideways_use_sma': False, 'sideways_use_ema': False, 'sideways_use_atr': True, 'sideways_use_adx': False, 'sideways_use_spike': True, 'sideways_rsi_required': True}.
[I 2025-08-29 19:56:06,944] Trial 170 finished with values: [-1000000000.0, 1000000000.0] and parameters: {'p_sma': 39, 'p_std': 51, 'p_atr': 23, 'p_adx': 17, 'rsi_period': 19, 'ema1': 10, 'ema2': 53, 'slip_atr_k': 0.020093432675252505, 'slip_spread_k': 0.27564106700407925, 'spread_hl_frac': 0.003964542111540095, 'bb_std_mult': 0.6466029247905423, 'rsi_os': 22, 'rsi_ob': 49, 'vol_spike': 0.029421421501287487, 'adx_thresh': 32.79588194956903, 'atr_min_pct': 0.014289133228047089, 'atr_max_pct': 0.0928841286273887, 'tp_mult': 2.8746451151884584, 'tsl_mult': 0.566768998937632, 'strategy': 'mean_reversion', 'time_stop': 143, 'use_sma': False, 'use_atr': True, 'use_adx': False, 'use_ema': False, 'use_spike': False, 'rsi_required': True, 'edge_k': 1.2665446036594448, 'edge_cap': 0.4552815151131894, 'bull_strategy': 'breakout', 'bull_bb_std_mult': 2.9937832118873158, 'bull_rsi_os': 41, 'bull_rsi_ob': 93, 'bull_adx_thresh': 18.340181085556587, 'bull_atr_min_pct': 0.002486839956407574, 'bull_atr_max_pct': 0.13688829736344815, 'bull_tp_mult': 1.2558816247919349, 'bull_tsl_mult': 0.21917180956701307, 'bull_time_stop': 191, 'bull_use_sma': False, 'bull_use_ema': True, 'bull_use_atr': False, 'bull_use_adx': True, 'bull_use_spike': False, 'bull_rsi_required': True, 'bear_strategy': 'mean_reversion', 'bear_bb_std_mult': 1.2342344724811867, 'bear_rsi_os': 36, 'bear_rsi_ob': 65, 'bear_adx_thresh': 7.039492692594504, 'bear_atr_min_pct': 0.007695829042644118, 'bear_atr_max_pct': 0.10754404790841077, 'bear_tp_mult': 1.7295062727626531, 'bear_tsl_mult': 0.7320780984968369, 'bear_time_stop': 222, 'bear_use_sma': False, 'bear_use_ema': False, 'bear_use_atr': False, 'bear_use_adx': False, 'bear_use_spike': False, 'bear_rsi_required': False, 'sideways_strategy': 'breakout', 'sideways_bb_std_mult': 3.5909969161329602, 'sideways_rsi_os': 27, 'sideways_rsi_ob': 54, 'sideways_adx_thresh': 22.6322747207416, 'sideways_atr_min_pct': 0.017440380541807354, 'sideways_atr_max_pct': 0.021104874486342393, 'sideways_tp_mult': 1.1804555873457758, 'sideways_tsl_mult': 0.30949635857440017, 'sideways_time_stop': 233, 'sideways_use_sma': False, 'sideways_use_ema': True, 'sideways_use_atr': True, 'sideways_use_adx': False, 'sideways_use_spike': True, 'sideways_rsi_required': True}.
[I 2025-08-29 19:56:06,958] Trial 171 finished with values: [-1000000000.0, 1000000000.0] and parameters: {'p_sma': 18, 'p_std': 51, 'p_atr': 23, 'p_adx': 7, 'rsi_period': 84, 'ema1': 13, 'ema2': 31, 'slip_atr_k': 0.03944004707968814, 'slip_spread_k': 0.8193108884760384, 'spread_hl_frac': 0.006533094000606579, 'bb_std_mult': 1.4021421669715153, 'rsi_os': 22, 'rsi_ob': 50, 'vol_spike': 0.03151746029844259, 'adx_thresh': 32.900347638220104, 'atr_min_pct': 0.014532406941568102, 'atr_max_pct': 0.09362771566706632, 'tp_mult': 1.8222031508891319, 'tsl_mult': 0.6234570399650778, 'strategy': 'mean_reversion', 'time_stop': 279, 'use_sma': False, 'use_atr': True, 'use_adx': False, 'use_ema': False, 'use_spike': False, 'rsi_required': True, 'edge_k': 1.2763003512980176, 'edge_cap': 0.45690157474566206, 'bull_strategy': 'breakout', 'bull_bb_std_mult': 2.9413908565004268, 'bull_rsi_os': 41, 'bull_rsi_ob': 49, 'bull_adx_thresh': 5.025800783023088, 'bull_atr_min_pct': 0.010875697036257037, 'bull_atr_max_pct': 0.05149531538588878, 'bull_tp_mult': 2.3527039868364064, 'bull_tsl_mult': 0.202300065906528, 'bull_time_stop': 262, 'bull_use_sma': False, 'bull_use_ema': True, 'bull_use_atr': False, 'bull_use_adx': True, 'bull_use_spike': False, 'bull_rsi_required': True, 'bear_strategy': 'mean_reversion', 'bear_bb_std_mult': 1.1573380248541973, 'bear_rsi_os': 48, 'bear_rsi_ob': 69, 'bear_adx_thresh': 28.72727088898472, 'bear_atr_min_pct': 0.005042013733470936, 'bear_atr_max_pct': 0.10731079945382622, 'bear_tp_mult': 1.7987327371424082, 'bear_tsl_mult': 0.6877910673460164, 'bear_time_stop': 77, 'bear_use_sma': False, 'bear_use_ema': False, 'bear_use_atr': False, 'bear_use_adx': False, 'bear_use_spike': False, 'bear_rsi_required': False, 'sideways_strategy': 'breakout', 'sideways_bb_std_mult': 1.7454917621070611, 'sideways_rsi_os': 27, 'sideways_rsi_ob': 54, 'sideways_adx_thresh': 22.887998283998286, 'sideways_atr_min_pct': 0.015349020725673478, 'sideways_atr_max_pct': 0.12139103859548404, 'sideways_tp_mult': 2.0261861282561413, 'sideways_tsl_mult': 0.5967612940239311, 'sideways_time_stop': 26, 'sideways_use_sma': False, 'sideways_use_ema': True, 'sideways_use_atr': True, 'sideways_use_adx': False, 'sideways_use_spike': True, 'sideways_rsi_required': True}.
[I 2025-08-29 19:56:34,877] Trial 168 finished with values: [-1000000000.0, 1000000000.0] and parameters: {'p_sma': 40, 'p_std': 51, 'p_atr': 23, 'p_adx': 12, 'rsi_period': 17, 'ema1': 19, 'ema2': 53, 'slip_atr_k': 0.22192018145883835, 'slip_spread_k': 0.8156165329391563, 'spread_hl_frac': 0.0035291919821280318, 'bb_std_mult': 1.3034999733488017, 'rsi_os': 23, 'rsi_ob': 64, 'vol_spike': 0.17109017696906878, 'adx_thresh': 32.57911474751765, 'atr_min_pct': 0.014507394086510498, 'atr_max_pct': 0.09194490699945933, 'tp_mult': 2.4410088776502854, 'tsl_mult': 0.5849901485639125, 'strategy': 'mean_reversion', 'time_stop': 91, 'use_sma': False, 'use_atr': True, 'use_adx': False, 'use_ema': False, 'use_spike': False, 'rsi_required': True, 'edge_k': 1.3552222736248463, 'edge_cap': 0.1939532447148734, 'bull_strategy': 'breakout', 'bull_bb_std_mult': 0.8858083420815107, 'bull_rsi_os': 51, 'bull_rsi_ob': 93, 'bull_adx_thresh': 17.671495207142932, 'bull_atr_min_pct': 0.022114831594492724, 'bull_atr_max_pct': 0.0657450306474047, 'bull_tp_mult': 1.8118906160089328, 'bull_tsl_mult': 0.019383969249995026, 'bull_time_stop': 263, 'bull_use_sma': False, 'bull_use_ema': True, 'bull_use_atr': False, 'bull_use_adx': True, 'bull_use_spike': False, 'bull_rsi_required': True, 'bear_strategy': 'mean_reversion', 'bear_bb_std_mult': 1.036059414460639, 'bear_rsi_os': 28, 'bear_rsi_ob': 68, 'bear_adx_thresh': 7.012380938324582, 'bear_atr_min_pct': 0.015139089946506343, 'bear_atr_max_pct': 0.06436152332152656, 'bear_tp_mult': 1.8454828745001401, 'bear_tsl_mult': 0.6263811889490095, 'bear_time_stop': 219, 'bear_use_sma': False, 'bear_use_ema': False, 'bear_use_atr': True, 'bear_use_adx': False, 'bear_use_spike': False, 'bear_rsi_required': False, 'sideways_strategy': 'mean_reversion', 'sideways_bb_std_mult': 1.7041937996640641, 'sideways_rsi_os': 34, 'sideways_rsi_ob': 69, 'sideways_adx_thresh': 22.630384960126175, 'sideways_atr_min_pct': 0.01757179969584107, 'sideways_atr_max_pct': 0.12355710542837528, 'sideways_tp_mult': 2.043675223927406, 'sideways_tsl_mult': 0.6728565387862582, 'sideways_time_stop': 265, 'sideways_use_sma': False, 'sideways_use_ema': True, 'sideways_use_atr': True, 'sideways_use_adx': False, 'sideways_use_spike': True, 'sideways_rsi_required': True}.
