[I 2025-08-29 20:17:44,051] Trial 342 finished with values: [-1000000000.0, 1000000000.0] and parameters: {'p_sma': 19, 'p_std': 58, 'p_atr': 25, 'p_adx': 12, 'rsi_period': 36, 'ema1': 18, 'ema2': 47, 'slip_atr_k': 0.0028518290214002845, 'slip_spread_k': 0.2107326676311699, 'spread_hl_frac': 0.04534152033379857, 'bb_std_mult': 1.3032478625793664, 'rsi_os': 40, 'rsi_ob': 79, 'vol_spike': 0.18601893310508516, 'adx_thresh': 9.82479306393996, 'atr_min_pct': 0.019961722720333648, 'atr_max_pct': 0.027533663753471743, 'tp_mult': 1.4573500639014334, 'tsl_mult': 0.8899837514731826, 'strategy': 'mean_reversion', 'time_stop': 189, 'use_sma': True, 'use_atr': False, 'use_adx': False, 'use_ema': True, 'use_spike': False, 'rsi_required': False, 'edge_k': 1.1305670384815012, 'edge_cap': 0.5130574948192738, 'bull_strategy': 'mean_reversion', 'bull_bb_std_mult': 3.1011308176566947, 'bull_rsi_os': 33, 'bull_rsi_ob': 75, 'bull_adx_thresh': 12.11814705892355, 'bull_atr_min_pct': 0.014754973036586117, 'bull_atr_max_pct': 0.028304291893462435, 'bull_tp_mult': 2.636899286143722, 'bull_tsl_mult': 0.8884844260654942, 'bull_time_stop': 64, 'bull_use_sma': True, 'bull_use_ema': False, 'bull_use_atr': True, 'bull_use_adx': False, 'bull_use_spike': True, 'bull_rsi_required': False, 'bear_strategy': 'breakout', 'bear_bb_std_mult': 2.8562548145549593, 'bear_rsi_os': 23, 'bear_rsi_ob': 62, 'bear_adx_thresh': 20.72067229529278, 'bear_atr_min_pct': 0.0067819559440012896, 'bear_atr_max_pct': 0.0436533959922019, 'bear_tp_mult': 2.700616038528214, 'bear_tsl_mult': 0.4217375089746344, 'bear_time_stop': 26, 'bear_use_sma': False, 'bear_use_ema': True, 'bear_use_atr': False, 'bear_use_adx': True, 'bear_use_spike': True, 'bear_rsi_required': False, 'sideways_strategy': 'breakout', 'sideways_bb_std_mult': 2.4575875729983787, 'sideways_rsi_os': 46, 'sideways_rsi_ob': 81, 'sideways_adx_thresh': 33.522696577117756, 'sideways_atr_min_pct': 0.004676855292348673, 'sideways_atr_max_pct': 0.017913824366536865, 'sideways_tp_mult': 1.0688367042243827, 'sideways_tsl_mult': 0.6454498670723812, 'sideways_time_stop': 217, 'sideways_use_sma': False, 'sideways_use_ema': True, 'sideways_use_atr': False, 'sideways_use_adx': False, 'sideways_use_spike': False, 'sideways_rsi_required': False}.
[I 2025-08-29 20:17:44,188] Trial 343 finished with values: [-1000000000.0, 1000000000.0] and parameters: {'p_sma': 19, 'p_std': 58, 'p_atr': 25, 'p_adx': 12, 'rsi_period': 34, 'ema1': 9, 'ema2': 47, 'slip_atr_k': 0.0023012048945780382, 'slip_spread_k': 0.21920514559298188, 'spread_hl_frac': 0.048710037649527874, 'bb_std_mult': 1.6964479971825293, 'rsi_os': 12, 'rsi_ob': 79, 'vol_spike': 0.18547450620871003, 'adx_thresh': 12.73476735478383, 'atr_min_pct': 0.01983432052148553, 'atr_max_pct': 0.031649614149905365, 'tp_mult': 1.5207817282660923, 'tsl_mult': 0.8952269765704, 'strategy': 'mean_reversion', 'time_stop': 183, 'use_sma': True, 'use_atr': False, 'use_adx': False, 'use_ema': True, 'use_spike': False, 'rsi_required': False, 'edge_k': 1.151196895613761, 'edge_cap': 0.5113037013417666, 'bull_strategy': 'mean_reversion', 'bull_bb_std_mult': 3.0916314753488434, 'bull_rsi_os': 32, 'bull_rsi_ob': 76, 'bull_adx_thresh': 12.443103668265858, 'bull_atr_min_pct': 0.01585044174802131, 'bull_atr_max_pct': 0.02883486358046482, 'bull_tp_mult': 2.645508847129507, 'bull_tsl_mult': 0.9181344676697353, 'bull_time_stop': 51, 'bull_use_sma': True, 'bull_use_ema': False, 'bull_use_atr': True, 'bull_use_adx': False, 'bull_use_spike': True, 'bull_rsi_required': False, 'bear_strategy': 'breakout', 'bear_bb_std_mult': 2.8670141865840315, 'bear_rsi_os': 26, 'bear_rsi_ob': 61, 'bear_adx_thresh': 22.355354861488944, 'bear_atr_min_pct': 0.006670324474686441, 'bear_atr_max_pct': 0.04210219514520886, 'bear_tp_mult': 2.6860264276505466, 'bear_tsl_mult': 0.43174321406337596, 'bear_time_stop': 26, 'bear_use_sma': False, 'bear_use_ema': True, 'bear_use_atr': False, 'bear_use_adx': True, 'bear_use_spike': True, 'bear_rsi_required': False, 'sideways_strategy': 'breakout', 'sideways_bb_std_mult': 2.3044954198537186, 'sideways_rsi_os': 46, 'sideways_rsi_ob': 80, 'sideways_adx_thresh': 31.810764426066406, 'sideways_atr_min_pct': 0.021721482511269975, 'sideways_atr_max_pct': 0.017649120723001847, 'sideways_tp_mult': 1.1904243418046745, 'sideways_tsl_mult': 0.6531846912620601, 'sideways_time_stop': 190, 'sideways_use_sma': False, 'sideways_use_ema': True, 'sideways_use_atr': False, 'sideways_use_adx': False, 'sideways_use_spike': False, 'sideways_rsi_required': False}.
[I 2025-08-29 20:17:44,376] Trial 344 finished with values: [-0.0005951583475536371, 0.0017262572167550565] and parameters: {'p_sma': 19, 'p_std': 59, 'p_atr': 25, 'p_adx': 12, 'rsi_period': 36, 'ema1': 17, 'ema2': 47, 'slip_atr_k': 0.012058707115761947, 'slip_spread_k': 0.22106583615214112, 'spread_hl_frac': 0.04806641114699647, 'bb_std_mult': 1.5893822340123096, 'rsi_os': 8, 'rsi_ob': 79, 'vol_spike': 0.21160048858146535, 'adx_thresh': 15.542151199753164, 'atr_min_pct': 0.019713083538256133, 'atr_max_pct': 0.03170002246037345, 'tp_mult': 1.5317040139727887, 'tsl_mult': 0.8894607267524098, 'strategy': 'mean_reversion', 'time_stop': 182, 'use_sma': True, 'use_atr': False, 'use_adx': False, 'use_ema': True, 'use_spike': False, 'rsi_required': False, 'edge_k': 1.144711437178063, 'edge_cap': 0.49938571708439927, 'bull_strategy': 'mean_reversion', 'bull_bb_std_mult': 3.121294686159043, 'bull_rsi_os': 32, 'bull_rsi_ob': 75, 'bull_adx_thresh': 11.774194778293024, 'bull_atr_min_pct': 0.01326821587806383, 'bull_atr_max_pct': 0.029682632310820693, 'bull_tp_mult': 2.6605087137267267, 'bull_tsl_mult': 0.8347922632893047, 'bull_time_stop': 81, 'bull_use_sma': True, 'bull_use_ema': False, 'bull_use_atr': True, 'bull_use_adx': False, 'bull_use_spike': True, 'bull_rsi_required': False, 'bear_strategy': 'breakout', 'bear_bb_std_mult': 2.875925296250617, 'bear_rsi_os': 26, 'bear_rsi_ob': 62, 'bear_adx_thresh': 21.39787023852108, 'bear_atr_min_pct': 0.0067913745073468175, 'bear_atr_max_pct': 0.040872034527319974, 'bear_tp_mult': 2.691819978116571, 'bear_tsl_mult': 0.4328614597907886, 'bear_time_stop': 34, 'bear_use_sma': False, 'bear_use_ema': True, 'bear_use_atr': False, 'bear_use_adx': True, 'bear_use_spike': True, 'bear_rsi_required': False, 'sideways_strategy': 'breakout', 'sideways_bb_std_mult': 2.4387793679424803, 'sideways_rsi_os': 46, 'sideways_rsi_ob': 80, 'sideways_adx_thresh': 33.56327022610951, 'sideways_atr_min_pct': 0.0037811868050612444, 'sideways_atr_max_pct': 0.017830703500419813, 'sideways_tp_mult': 1.070619654052583, 'sideways_tsl_mult': 0.6194801506405319, 'sideways_time_stop': 218, 'sideways_use_sma': False, 'sideways_use_ema': True, 'sideways_use_atr': False, 'sideways_use_adx': False, 'sideways_use_spike': False, 'sideways_rsi_required': False}.
[I 2025-08-29 20:18:14,969] Trial 345 finished with values: [-0.0005668496743146401, 0.0015995385593122764] and parameters: {'p_sma': 20, 'p_std': 58, 'p_atr': 25, 'p_adx': 13, 'rsi_period': 34, 'ema1': 18, 'ema2': 47, 'slip_atr_k': 0.009805206705897206, 'slip_spread_k': 0.1941004800213901, 'spread_hl_frac': 0.047757943261081924, 'bb_std_mult': 1.6764221039243652, 'rsi_os': 8, 'rsi_ob': 79, 'vol_spike': 0.1936316769627886, 'adx_thresh': 15.558740052555077, 'atr_min_pct': 0.020083892230448278, 'atr_max_pct': 0.025387533434002553, 'tp_mult': 1.5527886115203962, 'tsl_mult': 0.8979224046016454, 'strategy': 'mean_reversion', 'time_stop': 182, 'use_sma': True, 'use_atr': False, 'use_adx': False, 'use_ema': True, 'use_spike': False, 'rsi_required': False, 'edge_k': 1.1468588133687359, 'edge_cap': 0.5552133792875756, 'bull_strategy': 'mean_reversion', 'bull_bb_std_mult': 3.1254119171816113, 'bull_rsi_os': 39, 'bull_rsi_ob': 75, 'bull_adx_thresh': 12.41614192764567, 'bull_atr_min_pct': 0.014732430524962491, 'bull_atr_max_pct': 0.029690008986028183, 'bull_tp_mult': 2.7002845818443517, 'bull_tsl_mult': 0.8314865291640195, 'bull_time_stop': 53, 'bull_use_sma': True, 'bull_use_ema': False, 'bull_use_atr': True, 'bull_use_adx': False, 'bull_use_spike': True, 'bull_rsi_required': False, 'bear_strategy': 'breakout', 'bear_bb_std_mult': 2.8607724227203666, 'bear_rsi_os': 26, 'bear_rsi_ob': 66, 'bear_adx_thresh': 21.78317397888094, 'bear_atr_min_pct': 0.006459589685053681, 'bear_atr_max_pct': 0.042262249849153624, 'bear_tp_mult': 2.7178484654622515, 'bear_tsl_mult': 0.4333727629232222, 'bear_time_stop': 24, 'bear_use_sma': False, 'bear_use_ema': True, 'bear_use_atr': False, 'bear_use_adx': True, 'bear_use_spike': True, 'bear_rsi_required': False, 'sideways_strategy': 'breakout', 'sideways_bb_std_mult': 2.4180622626103716, 'sideways_rsi_os': 46, 'sideways_rsi_ob': 81, 'sideways_adx_thresh': 31.92583096956717, 'sideways_atr_min_pct': 0.003700680113165406, 'sideways_atr_max_pct': 0.017296906397792987, 'sideways_tp_mult': 1.1817207122577638, 'sideways_tsl_mult': 0.6101830553564811, 'sideways_time_stop': 189, 'sideways_use_sma': False, 'sideways_use_ema': True, 'sideways_use_atr': False, 'sideways_use_adx': False, 'sideways_use_spike': False, 'sideways_rsi_required': False}.
[I 2025-08-29 20:18:14,980] Trial 347 finished with values: [-0.0024581034706178118, 0.0025167300742872743] and parameters: {'p_sma': 20, 'p_std': 57, 'p_atr': 25, 'p_adx': 13, 'rsi_period': 34, 'ema1': 15, 'ema2': 17, 'slip_atr_k': 0.02402116082101497, 'slip_spread_k': 0.19223904109372003, 'spread_hl_frac': 0.04782339166498548, 'bb_std_mult': 1.623764650100462, 'rsi_os': 8, 'rsi_ob': 80, 'vol_spike': 0.19538830095901247, 'adx_thresh': 14.855039829515079, 'atr_min_pct': 0.020443030674173614, 'atr_max_pct': 0.03427745596423294, 'tp_mult': 2.8957393571030106, 'tsl_mult': 0.8595413843538744, 'strategy': 'mean_reversion', 'time_stop': 180, 'use_sma': True, 'use_atr': False, 'use_adx': False, 'use_ema': True, 'use_spike': False, 'rsi_required': False, 'edge_k': 1.1535446594458059, 'edge_cap': 0.5542467250362683, 'bull_strategy': 'mean_reversion', 'bull_bb_std_mult': 3.1240170100977505, 'bull_rsi_os': 39, 'bull_rsi_ob': 73, 'bull_adx_thresh': 9.710835841848414, 'bull_atr_min_pct': 0.014983079765240997, 'bull_atr_max_pct': 0.04198069868940458, 'bull_tp_mult': 2.703824894160338, 'bull_tsl_mult': 0.8255009484010573, 'bull_time_stop': 82, 'bull_use_sma': True, 'bull_use_ema': False, 'bull_use_atr': True, 'bull_use_adx': False, 'bull_use_spike': True, 'bull_rsi_required': False, 'bear_strategy': 'breakout', 'bear_bb_std_mult': 2.690916383991601, 'bear_rsi_os': 10, 'bear_rsi_ob': 66, 'bear_adx_thresh': 21.728048978828006, 'bear_atr_min_pct': 0.011452655353811415, 'bear_atr_max_pct': 0.03553014823774334, 'bear_tp_mult': 2.65501394248472, 'bear_tsl_mult': 0.37735773297559183, 'bear_time_stop': 23, 'bear_use_sma': False, 'bear_use_ema': True, 'bear_use_atr': False, 'bear_use_adx': True, 'bear_use_spike': True, 'bear_rsi_required': False, 'sideways_strategy': 'breakout', 'sideways_bb_std_mult': 2.4883608675407123, 'sideways_rsi_os': 50, 'sideways_rsi_ob': 81, 'sideways_adx_thresh': 32.71295349946736, 'sideways_atr_min_pct': 0.003726983436440611, 'sideways_atr_max_pct': 0.013528834245113624, 'sideways_tp_mult': 1.111312953935648, 'sideways_tsl_mult': 0.6238172513223595, 'sideways_time_stop': 203, 'sideways_use_sma': False, 'sideways_use_ema': True, 'sideways_use_atr': False, 'sideways_use_adx': False, 'sideways_use_spike': False, 'sideways_rsi_required': False}.
[I 2025-08-29 20:18:15,343] Trial 348 finished with values: [-0.0007782031075864726, 0.001327954001613115] and parameters: {'p_sma': 20, 'p_std': 57, 'p_atr': 25, 'p_adx': 14, 'rsi_period': 35, 'ema1': 15, 'ema2': 47, 'slip_atr_k': 0.0004529104512951026, 'slip_spread_k': 0.1894693222963876, 'spread_hl_frac': 0.047950365185545823, 'bb_std_mult': 1.6535216972387947, 'rsi_os': 12, 'rsi_ob': 80, 'vol_spike': 0.1933865756258615, 'adx_thresh': 15.858463959713538, 'atr_min_pct': 0.020531024231833523, 'atr_max_pct': 0.030989649461430437, 'tp_mult': 1.5350113934592906, 'tsl_mult': 0.8639547712297837, 'strategy': 'mean_reversion', 'time_stop': 181, 'use_sma': True, 'use_atr': False, 'use_adx': False, 'use_ema': True, 'use_spike': False, 'rsi_required': False, 'edge_k': 1.07948288690727, 'edge_cap': 0.5446757696794291, 'bull_strategy': 'mean_reversion', 'bull_bb_std_mult': 3.148391757835642, 'bull_rsi_os': 33, 'bull_rsi_ob': 75, 'bull_adx_thresh': 12.683991968902276, 'bull_atr_min_pct': 0.01749653069468618, 'bull_atr_max_pct': 0.04034453294212433, 'bull_tp_mult': 2.5958105213365847, 'bull_tsl_mult': 0.913770943127943, 'bull_time_stop': 57, 'bull_use_sma': True, 'bull_use_ema': False, 'bull_use_atr': True, 'bull_use_adx': False, 'bull_use_spike': True, 'bull_rsi_required': False, 'bear_strategy': 'breakout', 'bear_bb_std_mult': 2.6677145593714315, 'bear_rsi_os': 24, 'bear_rsi_ob': 65, 'bear_adx_thresh': 21.626703838720427, 'bear_atr_min_pct': 0.009171728636326142, 'bear_atr_max_pct': 0.0331557126726951, 'bear_tp_mult': 2.802907143062945, 'bear_tsl_mult': 0.391586970219967, 'bear_time_stop': 30, 'bear_use_sma': False, 'bear_use_ema': True, 'bear_use_atr': False, 'bear_use_adx': True, 'bear_use_spike': True, 'bear_rsi_required': False, 'sideways_strategy': 'breakout', 'sideways_bb_std_mult': 2.433087843503129, 'sideways_rsi_os': 49, 'sideways_rsi_ob': 81, 'sideways_adx_thresh': 32.65942835147394, 'sideways_atr_min_pct': 0.0038273992534597102, 'sideways_atr_max_pct': 0.026736524884280695, 'sideways_tp_mult': 1.1008290576844095, 'sideways_tsl_mult': 0.6178579104135549, 'sideways_time_stop': 202, 'sideways_use_sma': False, 'sideways_use_ema': True, 'sideways_use_atr': False, 'sideways_use_adx': False, 'sideways_use_spike': False, 'sideways_rsi_required': False}.
[I 2025-08-29 20:18:15,343] Trial 346 finished with values: [-0.001991899196474689, 0.0021128936057194124] and parameters: {'p_sma': 18, 'p_std': 57, 'p_atr': 25, 'p_adx': 13, 'rsi_period': 34, 'ema1': 18, 'ema2': 34, 'slip_atr_k': 0.020374123085095446, 'slip_spread_k': 0.18959665359834044, 'spread_hl_frac': 0.047688606519314135, 'bb_std_mult': 1.619770633575791, 'rsi_os': 7, 'rsi_ob': 80, 'vol_spike': 0.19496004709027906, 'adx_thresh': 11.220123469602369, 'atr_min_pct': 0.02021417052404568, 'atr_max_pct': 0.12014458062617944, 'tp_mult': 1.493224528520157, 'tsl_mult': 0.8636877213521317, 'strategy': 'mean_reversion', 'time_stop': 180, 'use_sma': True, 'use_atr': False, 'use_adx': False, 'use_ema': True, 'use_spike': False, 'rsi_required': False, 'edge_k': 1.1530734124454538, 'edge_cap': 0.5477164878536709, 'bull_strategy': 'mean_reversion', 'bull_bb_std_mult': 3.12015947752541, 'bull_rsi_os': 39, 'bull_rsi_ob': 76, 'bull_adx_thresh': 13.084901427261181, 'bull_atr_min_pct': 0.012914373308637834, 'bull_atr_max_pct': 0.02914202698663511, 'bull_tp_mult': 2.6872950623218714, 'bull_tsl_mult': 0.9195488621930172, 'bull_time_stop': 53, 'bull_use_sma': True, 'bull_use_ema': False, 'bull_use_atr': True, 'bull_use_adx': False, 'bull_use_spike': True, 'bull_rsi_required': False, 'bear_strategy': 'breakout', 'bear_bb_std_mult': 2.669164359048585, 'bear_rsi_os': 26, 'bear_rsi_ob': 66, 'bear_adx_thresh': 19.432302300176367, 'bear_atr_min_pct': 0.024971800707320115, 'bear_atr_max_pct': 0.035390977722274085, 'bear_tp_mult': 2.66292763873253, 'bear_tsl_mult': 0.38758109411558106, 'bear_time_stop': 37, 'bear_use_sma': False, 'bear_use_ema': True, 'bear_use_atr': False, 'bear_use_adx': True, 'bear_use_spike': True, 'bear_rsi_required': False, 'sideways_strategy': 'breakout', 'sideways_bb_std_mult': 2.3103953334630347, 'sideways_rsi_os': 49, 'sideways_rsi_ob': 80, 'sideways_adx_thresh': 31.80676813224142, 'sideways_atr_min_pct': 0.003697577244856745, 'sideways_atr_max_pct': 0.02623469217546618, 'sideways_tp_mult': 1.2021917283810568, 'sideways_tsl_mult': 0.6076543157434695, 'sideways_time_stop': 192, 'sideways_use_sma': False, 'sideways_use_ema': True, 'sideways_use_atr': False, 'sideways_use_adx': False, 'sideways_use_spike': False, 'sideways_rsi_required': False}.
[I 2025-08-29 20:18:45,196] Trial 350 finished with values: [-0.0010220081495563305, 0.0011714402447334786] and parameters: {'p_sma': 18, 'p_std': 57, 'p_atr': 24, 'p_adx': 14, 'rsi_period': 36, 'ema1': 28, 'ema2': 47, 'slip_atr_k': 0.0002486911111179019, 'slip_spread_k': 0.23650629799863293, 'spread_hl_frac': 0.045261004963282433, 'bb_std_mult': 1.6715652132452241, 'rsi_os': 12, 'rsi_ob': 78, 'vol_spike': 0.13288587749321973, 'adx_thresh': 7.685203892474878, 'atr_min_pct': 0.020355742948379277, 'atr_max_pct': 0.030185003984128298, 'tp_mult': 1.5607221803962488, 'tsl_mult': 0.8139815365927981, 'strategy': 'mean_reversion', 'time_stop': 194, 'use_sma': True, 'use_atr': False, 'use_adx': False, 'use_ema': True, 'use_spike': False, 'rsi_required': False, 'edge_k': 1.1684158974972636, 'edge_cap': 0.5056784493265112, 'bull_strategy': 'mean_reversion', 'bull_bb_std_mult': 3.145133845681271, 'bull_rsi_os': 35, 'bull_rsi_ob': 75, 'bull_adx_thresh': 12.530343338603538, 'bull_atr_min_pct': 0.0131746113548737, 'bull_atr_max_pct': 0.09331560744338735, 'bull_tp_mult': 2.6868759382189302, 'bull_tsl_mult': 0.9216947854678326, 'bull_time_stop': 57, 'bull_use_sma': True, 'bull_use_ema': False, 'bull_use_atr': True, 'bull_use_adx': False, 'bull_use_spike': True, 'bull_rsi_required': False, 'bear_strategy': 'breakout', 'bear_bb_std_mult': 2.7967217568395313, 'bear_rsi_os': 26, 'bear_rsi_ob': 45, 'bear_adx_thresh': 21.720314580920835, 'bear_atr_min_pct': 0.018197842796109632, 'bear_atr_max_pct': 0.03274683108199118, 'bear_tp_mult': 2.817986897011613, 'bear_tsl_mult': 0.3937121981723315, 'bear_time_stop': 34, 'bear_use_sma': False, 'bear_use_ema': True, 'bear_use_atr': False, 'bear_use_adx': True, 'bear_use_spike': True, 'bear_rsi_required': False, 'sideways_strategy': 'breakout', 'sideways_bb_std_mult': 2.319707763544702, 'sideways_rsi_os': 49, 'sideways_rsi_ob': 81, 'sideways_adx_thresh': 34.98905259716635, 'sideways_atr_min_pct': 0.0038945702131485144, 'sideways_atr_max_pct': 0.02702516963479896, 'sideways_tp_mult': 1.1644721168120733, 'sideways_tsl_mult': 0.668379041747595, 'sideways_time_stop': 190, 'sideways_use_sma': False, 'sideways_use_ema': True, 'sideways_use_atr': False, 'sideways_use_adx': False, 'sideways_use_spike': False, 'sideways_rsi_required': False}.
[I 2025-08-29 20:18:45,940] Trial 351 finished with values: [-1000000000.0, 1000000000.0] and parameters: {'p_sma': 17, 'p_std': 59, 'p_atr': 24, 'p_adx': 14, 'rsi_period': 36, 'ema1': 18, 'ema2': 20, 'slip_atr_k': 0.010106849203796058, 'slip_spread_k': 0.23808876130989814, 'spread_hl_frac': 0.04728828359608393, 'bb_std_mult': 1.5672108338540847, 'rsi_os': 12, 'rsi_ob': 78, 'vol_spike': 0.13321016871541166, 'adx_thresh': 15.607586042389265, 'atr_min_pct': 0.019696240913016572, 'atr_max_pct': 0.03322902513753968, 'tp_mult': 1.5757003552034234, 'tsl_mult': 0.8170433124040885, 'strategy': 'mean_reversion', 'time_stop': 181, 'use_sma': True, 'use_atr': False, 'use_adx': False, 'use_ema': True, 'use_spike': False, 'rsi_required': False, 'edge_k': 1.1707479978070807, 'edge_cap': 0.508532213749488, 'bull_strategy': 'mean_reversion', 'bull_bb_std_mult': 3.1516540900085452, 'bull_rsi_os': 35, 'bull_rsi_ob': 72, 'bull_adx_thresh': 13.243922166766446, 'bull_atr_min_pct': 0.017536252402204376, 'bull_atr_max_pct': 0.026408661717381494, 'bull_tp_mult': 2.6653002527928473, 'bull_tsl_mult': 0.9664306455685981, 'bull_time_stop': 56, 'bull_use_sma': True, 'bull_use_ema': False, 'bull_use_atr': True, 'bull_use_adx': False, 'bull_use_spike': True, 'bull_rsi_required': False, 'bear_strategy': 'breakout', 'bear_bb_std_mult': 2.8229919160811714, 'bear_rsi_os': 26, 'bear_rsi_ob': 78, 'bear_adx_thresh': 20.28698167474857, 'bear_atr_min_pct': 0.0061914657338626835, 'bear_atr_max_pct': 0.031139249820031807, 'bear_tp_mult': 2.7121366274733885, 'bear_tsl_mult': 0.4426180321125406, 'bear_time_stop': 37, 'bear_use_sma': False, 'bear_use_ema': True, 'bear_use_atr': False, 'bear_use_adx': True, 'bear_use_spike': True, 'bear_rsi_required': False, 'sideways_strategy': 'breakout', 'sideways_bb_std_mult': 2.403548420370104, 'sideways_rsi_os': 45, 'sideways_rsi_ob': 72, 'sideways_adx_thresh': 33.826561986568805, 'sideways_atr_min_pct': 0.004854572080429249, 'sideways_atr_max_pct': 0.02026306945957195, 'sideways_tp_mult': 1.0632180163543756, 'sideways_tsl_mult': 0.6676429761842865, 'sideways_time_stop': 201, 'sideways_use_sma': False, 'sideways_use_ema': True, 'sideways_use_atr': False, 'sideways_use_adx': False, 'sideways_use_spike': False, 'sideways_rsi_required': False}.
