[I 2025-08-29 20:27:32,732] Trial 426 finished with values: [-0.0016178554590952077, 0.0023967990939366395] and parameters: {'p_sma': 19, 'p_std': 59, 'p_atr': 26, 'p_adx': 13, 'rsi_period': 42, 'ema1': 23, 'ema2': 43, 'slip_atr_k': 0.000285759020977572, 'slip_spread_k': 0.19637814626647665, 'spread_hl_frac': 0.047672404576297386, 'bb_std_mult': 2.508178729177576, 'rsi_os': 34, 'rsi_ob': 81, 'vol_spike': 0.10518946722889366, 'adx_thresh': 12.955787509170172, 'atr_min_pct': 0.021317820996540747, 'atr_max_pct': 0.029181859806713756, 'tp_mult': 1.010404576083653, 'tsl_mult': 0.9563367600147331, 'strategy': 'mean_reversion', 'time_stop': 6, 'use_sma': True, 'use_atr': False, 'use_adx': False, 'use_ema': True, 'use_spike': True, 'rsi_required': False, 'edge_k': 0.14567486517836437, 'edge_cap': 0.6908278581327003, 'bull_strategy': 'mean_reversion', 'bull_bb_std_mult': 1.131514898372159, 'bull_rsi_os': 13, 'bull_rsi_ob': 60, 'bull_adx_thresh': 12.521760742212233, 'bull_atr_min_pct': 0.014844642207062414, 'bull_atr_max_pct': 0.09327086926341206, 'bull_tp_mult': 2.691365259034466, 'bull_tsl_mult': 0.8923364676569535, 'bull_time_stop': 30, 'bull_use_sma': True, 'bull_use_ema': False, 'bull_use_atr': True, 'bull_use_adx': False, 'bull_use_spike': True, 'bull_rsi_required': False, 'bear_strategy': 'breakout', 'bear_bb_std_mult': 2.682277298013748, 'bear_rsi_os': 28, 'bear_rsi_ob': 66, 'bear_adx_thresh': 26.988377394392643, 'bear_atr_min_pct': 0.006783185747113705, 'bear_atr_max_pct': 0.061072991637200855, 'bear_tp_mult': 1.667289571264171, 'bear_tsl_mult': 0.9004592493466081, 'bear_time_stop': 52, 'bear_use_sma': False, 'bear_use_ema': True, 'bear_use_atr': False, 'bear_use_adx': True, 'bear_use_spike': True, 'bear_rsi_required': False, 'sideways_strategy': 'breakout', 'sideways_bb_std_mult': 2.2654047435902647, 'sideways_rsi_os': 47, 'sideways_rsi_ob': 53, 'sideways_adx_thresh': 33.26463365057553, 'sideways_atr_min_pct': 0.0034185314810662466, 'sideways_atr_max_pct': 0.09586254625133277, 'sideways_tp_mult': 1.074204601648538, 'sideways_tsl_mult': 0.7213402373523142, 'sideways_time_stop': 194, 'sideways_use_sma': False, 'sideways_use_ema': False, 'sideways_use_atr': False, 'sideways_use_adx': False, 'sideways_use_spike': False, 'sideways_rsi_required': False}.
[I 2025-08-29 20:27:33,205] Trial 424 finished with values: [-1000000000.0, 1000000000.0] and parameters: {'p_sma': 18, 'p_std': 59, 'p_atr': 26, 'p_adx': 8, 'rsi_period': 43, 'ema1': 28, 'ema2': 20, 'slip_atr_k': 0.0001654747753360447, 'slip_spread_k': 0.1916448868966657, 'spread_hl_frac': 0.02450481696190171, 'bb_std_mult': 3.1086992702553102, 'rsi_os': 11, 'rsi_ob': 56, 'vol_spike': 0.10408660600198719, 'adx_thresh': 13.306912068968446, 'atr_min_pct': 0.0006620217493045286, 'atr_max_pct': 0.03061017724492799, 'tp_mult': 1.3246247255637595, 'tsl_mult': 0.8835176279654515, 'strategy': 'breakout', 'time_stop': 204, 'use_sma': True, 'use_atr': False, 'use_adx': True, 'use_ema': True, 'use_spike': True, 'rsi_required': False, 'edge_k': 1.0465375894850708, 'edge_cap': 0.6899841281577305, 'bull_strategy': 'mean_reversion', 'bull_bb_std_mult': 1.1472478108211637, 'bull_rsi_os': 10, 'bull_rsi_ob': 78, 'bull_adx_thresh': 26.312832100853946, 'bull_atr_min_pct': 0.01623748039725769, 'bull_atr_max_pct': 0.08389404115020009, 'bull_tp_mult': 2.639865583107349, 'bull_tsl_mult': 0.9120863392349216, 'bull_time_stop': 29, 'bull_use_sma': True, 'bull_use_ema': False, 'bull_use_atr': True, 'bull_use_adx': False, 'bull_use_spike': True, 'bull_rsi_required': False, 'bear_strategy': 'breakout', 'bear_bb_std_mult': 2.671663754008009, 'bear_rsi_os': 26, 'bear_rsi_ob': 89, 'bear_adx_thresh': 19.591657030643017, 'bear_atr_min_pct': 0.0044946209473326025, 'bear_atr_max_pct': 0.060920140237401596, 'bear_tp_mult': 2.862292362383557, 'bear_tsl_mult': 0.2244245976755741, 'bear_time_stop': 80, 'bear_use_sma': True, 'bear_use_ema': True, 'bear_use_atr': False, 'bear_use_adx': True, 'bear_use_spike': True, 'bear_rsi_required': False, 'sideways_strategy': 'breakout', 'sideways_bb_std_mult': 2.6887336413179574, 'sideways_rsi_os': 47, 'sideways_rsi_ob': 60, 'sideways_adx_thresh': 25.218398827639895, 'sideways_atr_min_pct': 0.020320239752470312, 'sideways_atr_max_pct': 0.021645917399938576, 'sideways_tp_mult': 1.0105042215860145, 'sideways_tsl_mult': 0.6905645306714856, 'sideways_time_stop': 194, 'sideways_use_sma': False, 'sideways_use_ema': False, 'sideways_use_atr': False, 'sideways_use_adx': False, 'sideways_use_spike': True, 'sideways_rsi_required': False}.
[I 2025-08-29 20:27:33,565] Trial 425 finished with values: [-1000000000.0, 1000000000.0] and parameters: {'p_sma': 19, 'p_std': 9, 'p_atr': 26, 'p_adx': 13, 'rsi_period': 45, 'ema1': 24, 'ema2': 21, 'slip_atr_k': 0.1896419224501798, 'slip_spread_k': 0.13842671846503596, 'spread_hl_frac': 0.04774264431988333, 'bb_std_mult': 3.515543999627041, 'rsi_os': 11, 'rsi_ob': 59, 'vol_spike': 0.036598292400012375, 'adx_thresh': 13.089481541712573, 'atr_min_pct': 0.0005227100136902026, 'atr_max_pct': 0.1089350669746288, 'tp_mult': 2.929568418076413, 'tsl_mult': 0.3640374569426781, 'strategy': 'mean_reversion', 'time_stop': 5, 'use_sma': True, 'use_atr': False, 'use_adx': False, 'use_ema': True, 'use_spike': True, 'rsi_required': False, 'edge_k': 1.049883054669195, 'edge_cap': 0.868393060771732, 'bull_strategy': 'mean_reversion', 'bull_bb_std_mult': 3.079000723581351, 'bull_rsi_os': 10, 'bull_rsi_ob': 74, 'bull_adx_thresh': 28.494682301312235, 'bull_atr_min_pct': 0.014596681692890686, 'bull_atr_max_pct': 0.08358850583173807, 'bull_tp_mult': 2.839395625198273, 'bull_tsl_mult': 0.6849618110301728, 'bull_time_stop': 29, 'bull_use_sma': True, 'bull_use_ema': False, 'bull_use_atr': True, 'bull_use_adx': False, 'bull_use_spike': True, 'bull_rsi_required': False, 'bear_strategy': 'breakout', 'bear_bb_std_mult': 1.7060235036084108, 'bear_rsi_os': 24, 'bear_rsi_ob': 82, 'bear_adx_thresh': 26.927963987122062, 'bear_atr_min_pct': 0.004785387777412116, 'bear_atr_max_pct': 0.06672832277512561, 'bear_tp_mult': 2.537219689949843, 'bear_tsl_mult': 0.18926332553506459, 'bear_time_stop': 48, 'bear_use_sma': False, 'bear_use_ema': True, 'bear_use_atr': False, 'bear_use_adx': True, 'bear_use_spike': True, 'bear_rsi_required': False, 'sideways_strategy': 'breakout', 'sideways_bb_std_mult': 2.2415924861466685, 'sideways_rsi_os': 47, 'sideways_rsi_ob': 80, 'sideways_adx_thresh': 8.25260960676195, 'sideways_atr_min_pct': 0.02018314886975934, 'sideways_atr_max_pct': 0.0215897404383679, 'sideways_tp_mult': 1.0451624161367636, 'sideways_tsl_mult': 0.6904645623479981, 'sideways_time_stop': 146, 'sideways_use_sma': False, 'sideways_use_ema': False, 'sideways_use_atr': False, 'sideways_use_adx': False, 'sideways_use_spike': False, 'sideways_rsi_required': False}.
[I 2025-08-29 20:27:33,577] Trial 423 finished with values: [-1000000000.0, 1000000000.0] and parameters: {'p_sma': 18, 'p_std': 59, 'p_atr': 26, 'p_adx': 12, 'rsi_period': 52, 'ema1': 28, 'ema2': 44, 'slip_atr_k': 0.00010929208995487806, 'slip_spread_k': 0.20159939729682852, 'spread_hl_frac': 0.04800992170305312, 'bb_std_mult': 2.8938727087436087, 'rsi_os': 11, 'rsi_ob': 83, 'vol_spike': 0.13583757744367, 'adx_thresh': 13.155128403642495, 'atr_min_pct': 0.017703001359442166, 'atr_max_pct': 0.03077354501638038, 'tp_mult': 1.3275026788563244, 'tsl_mult': 0.9024376134563262, 'strategy': 'breakout', 'time_stop': 7, 'use_sma': True, 'use_atr': False, 'use_adx': True, 'use_ema': True, 'use_spike': True, 'rsi_required': False, 'edge_k': 1.05758424177753, 'edge_cap': 0.7198064162117914, 'bull_strategy': 'mean_reversion', 'bull_bb_std_mult': 3.066142832726328, 'bull_rsi_os': 19, 'bull_rsi_ob': 69, 'bull_adx_thresh': 5.100533497402457, 'bull_atr_min_pct': 0.00596487796351357, 'bull_atr_max_pct': 0.10169803282988824, 'bull_tp_mult': 1.8596005729557183, 'bull_tsl_mult': 0.9086010190900154, 'bull_time_stop': 29, 'bull_use_sma': True, 'bull_use_ema': False, 'bull_use_atr': True, 'bull_use_adx': False, 'bull_use_spike': True, 'bull_rsi_required': False, 'bear_strategy': 'breakout', 'bear_bb_std_mult': 3.1568314553458148, 'bear_rsi_os': 26, 'bear_rsi_ob': 92, 'bear_adx_thresh': 19.423914472437033, 'bear_atr_min_pct': 0.006684384794958519, 'bear_atr_max_pct': 0.0673039006430324, 'bear_tp_mult': 2.5477378886582978, 'bear_tsl_mult': 0.898671457395291, 'bear_time_stop': 81, 'bear_use_sma': True, 'bear_use_ema': True, 'bear_use_atr': False, 'bear_use_adx': True, 'bear_use_spike': True, 'bear_rsi_required': False, 'sideways_strategy': 'breakout', 'sideways_bb_std_mult': 2.6395067517265227, 'sideways_rsi_os': 47, 'sideways_rsi_ob': 50, 'sideways_adx_thresh': 8.194508630032232, 'sideways_atr_min_pct': 0.0201098698419136, 'sideways_atr_max_pct': 0.02151918862811473, 'sideways_tp_mult': 1.010836434555829, 'sideways_tsl_mult': 0.702041869634686, 'sideways_time_stop': 52, 'sideways_use_sma': False, 'sideways_use_ema': False, 'sideways_use_atr': False, 'sideways_use_adx': False, 'sideways_use_spike': True, 'sideways_rsi_required': False}.
[I 2025-08-29 20:27:34,186] Trial 427 finished with values: [-1000000000.0, 1000000000.0] and parameters: {'p_sma': 7, 'p_std': 57, 'p_atr': 19, 'p_adx': 9, 'rsi_period': 64, 'ema1': 28, 'ema2': 11, 'slip_atr_k': 8.108880739254995e-05, 'slip_spread_k': 0.6412748180452965, 'spread_hl_frac': 0.04998632346907516, 'bb_std_mult': 1.747889504260004, 'rsi_os': 10, 'rsi_ob': 88, 'vol_spike': 0.21478750544193037, 'adx_thresh': 13.884325800977212, 'atr_min_pct': 0.02490833312636352, 'atr_max_pct': 0.023075633114509896, 'tp_mult': 2.6179937075826807, 'tsl_mult': 0.9054807292555856, 'strategy': 'mean_reversion', 'time_stop': 21, 'use_sma': True, 'use_atr': False, 'use_adx': False, 'use_ema': True, 'use_spike': True, 'rsi_required': False, 'edge_k': 1.0765489430940423, 'edge_cap': 0.6598093311467907, 'bull_strategy': 'mean_reversion', 'bull_bb_std_mult': 0.5081390060118129, 'bull_rsi_os': 28, 'bull_rsi_ob': 74, 'bull_adx_thresh': 33.244541007462985, 'bull_atr_min_pct': 0.016788702638794957, 'bull_atr_max_pct': 0.09229265142828781, 'bull_tp_mult': 1.9973258301419832, 'bull_tsl_mult': 0.9886937938334408, 'bull_time_stop': 223, 'bull_use_sma': True, 'bull_use_ema': False, 'bull_use_atr': True, 'bull_use_adx': False, 'bull_use_spike': True, 'bull_rsi_required': False, 'bear_strategy': 'breakout', 'bear_bb_std_mult': 1.7085607081701903, 'bear_rsi_os': 27, 'bear_rsi_ob': 87, 'bear_adx_thresh': 19.49136442974667, 'bear_atr_min_pct': 0.024148131577906486, 'bear_atr_max_pct': 0.04146681645773849, 'bear_tp_mult': 2.6934501334918513, 'bear_tsl_mult': 0.8717072163641336, 'bear_time_stop': 48, 'bear_use_sma': False, 'bear_use_ema': False, 'bear_use_atr': False, 'bear_use_adx': True, 'bear_use_spike': True, 'bear_rsi_required': False, 'sideways_strategy': 'breakout', 'sideways_bb_std_mult': 2.1945031630716, 'sideways_rsi_os': 46, 'sideways_rsi_ob': 80, 'sideways_adx_thresh': 11.467918100440748, 'sideways_atr_min_pct': 0.004650692055821762, 'sideways_atr_max_pct': 0.021411067421036385, 'sideways_tp_mult': 2.4698268644308725, 'sideways_tsl_mult': 0.9170366107943385, 'sideways_time_stop': 141, 'sideways_use_sma': False, 'sideways_use_ema': False, 'sideways_use_atr': False, 'sideways_use_adx': False, 'sideways_use_spike': False, 'sideways_rsi_required': False}.
[I 2025-08-29 20:27:34,261] Trial 430 finished with values: [-1000000000.0, 1000000000.0] and parameters: {'p_sma': 20, 'p_std': 57, 'p_atr': 29, 'p_adx': 24, 'rsi_period': 32, 'ema1': 26, 'ema2': 46, 'slip_atr_k': 0.16961914962984811, 'slip_spread_k': 0.2176378600649228, 'spread_hl_frac': 0.021901509370660144, 'bb_std_mult': 1.7274690550225362, 'rsi_os': 9, 'rsi_ob': 47, 'vol_spike': 0.1895173715978709, 'adx_thresh': 12.385880798165397, 'atr_min_pct': 0.01950078961644857, 'atr_max_pct': 0.023143667066175426, 'tp_mult': 1.4894847197792063, 'tsl_mult': 0.857168343155307, 'strategy': 'mean_reversion', 'time_stop': 22, 'use_sma': False, 'use_atr': False, 'use_adx': False, 'use_ema': True, 'use_spike': False, 'rsi_required': False, 'edge_k': 1.1008580738913858, 'edge_cap': 0.6500513575790117, 'bull_strategy': 'mean_reversion', 'bull_bb_std_mult': 3.4548984200484183, 'bull_rsi_os': 28, 'bull_rsi_ob': 71, 'bull_adx_thresh': 14.635420032893885, 'bull_atr_min_pct': 0.017011949936959515, 'bull_atr_max_pct': 0.09236973123395, 'bull_tp_mult': 2.779390537919169, 'bull_tsl_mult': 0.0016468488672489734, 'bull_time_stop': 91, 'bull_use_sma': True, 'bull_use_ema': False, 'bull_use_atr': True, 'bull_use_adx': False, 'bull_use_spike': True, 'bull_rsi_required': False, 'bear_strategy': 'breakout', 'bear_bb_std_mult': 1.9017244509290383, 'bear_rsi_os': 6, 'bear_rsi_ob': 54, 'bear_adx_thresh': 29.23511265653105, 'bear_atr_min_pct': 0.009118768503905991, 'bear_atr_max_pct': 0.08724575243322218, 'bear_tp_mult': 2.6975002443343823, 'bear_tsl_mult': 0.8784598086370271, 'bear_time_stop': 255, 'bear_use_sma': False, 'bear_use_ema': False, 'bear_use_atr': False, 'bear_use_adx': True, 'bear_use_spike': False, 'bear_rsi_required': False, 'sideways_strategy': 'breakout', 'sideways_bb_std_mult': 1.2076281726962108, 'sideways_rsi_os': 49, 'sideways_rsi_ob': 67, 'sideways_adx_thresh': 33.14377226488191, 'sideways_atr_min_pct': 0.025750708817533947, 'sideways_atr_max_pct': 0.04018559605129353, 'sideways_tp_mult': 1.6022491259558453, 'sideways_tsl_mult': 0.7559967256161283, 'sideways_time_stop': 185, 'sideways_use_sma': False, 'sideways_use_ema': False, 'sideways_use_atr': False, 'sideways_use_adx': False, 'sideways_use_spike': False, 'sideways_rsi_required': True}.
[I 2025-08-29 20:27:34,923] Trial 431 finished with values: [-1000000000.0, 1000000000.0] and parameters: {'p_sma': 28, 'p_std': 25, 'p_atr': 27, 'p_adx': 10, 'rsi_period': 37, 'ema1': 26, 'ema2': 46, 'slip_atr_k': 0.00960204468564099, 'slip_spread_k': 0.8294321902964525, 'spread_hl_frac': 0.049985564769621314, 'bb_std_mult': 1.6545743835686766, 'rsi_os': 47, 'rsi_ob': 45, 'vol_spike': 0.02430363168499075, 'adx_thresh': 12.185033086134167, 'atr_min_pct': 0.01697433350299806, 'atr_max_pct': 0.03547464673087769, 'tp_mult': 1.4466145541059865, 'tsl_mult': 0.18261367054220734, 'strategy': 'mean_reversion', 'time_stop': 174, 'use_sma': False, 'use_atr': False, 'use_adx': False, 'use_ema': True, 'use_spike': False, 'rsi_required': False, 'edge_k': 0.7436387665647101, 'edge_cap': 0.5829664649259578, 'bull_strategy': 'mean_reversion', 'bull_bb_std_mult': 3.1152827654410906, 'bull_rsi_os': 6, 'bull_rsi_ob': 73, 'bull_adx_thresh': 14.847447181313623, 'bull_atr_min_pct': 0.027761737615908992, 'bull_atr_max_pct': 0.09565827495804448, 'bull_tp_mult': 2.7225617140826177, 'bull_tsl_mult': 0.8502431177396363, 'bull_time_stop': 36, 'bull_use_sma': True, 'bull_use_ema': False, 'bull_use_atr': True, 'bull_use_adx': False, 'bull_use_spike': True, 'bull_rsi_required': False, 'bear_strategy': 'breakout', 'bear_bb_std_mult': 1.4227988690979512, 'bear_rsi_os': 28, 'bear_rsi_ob': 65, 'bear_adx_thresh': 29.32413004116272, 'bear_atr_min_pct': 0.006218599846493791, 'bear_atr_max_pct': 0.05836276880219856, 'bear_tp_mult': 2.178789097484527, 'bear_tsl_mult': 0.9133832991192631, 'bear_time_stop': 61, 'bear_use_sma': False, 'bear_use_ema': False, 'bear_use_atr': False, 'bear_use_adx': True, 'bear_use_spike': False, 'bear_rsi_required': False, 'sideways_strategy': 'breakout', 'sideways_bb_std_mult': 2.7629584290599567, 'sideways_rsi_os': 49, 'sideways_rsi_ob': 77, 'sideways_adx_thresh': 26.376587955675838, 'sideways_atr_min_pct': 0.025928085809304925, 'sideways_atr_max_pct': 0.08628510689954608, 'sideways_tp_mult': 1.1234651294640863, 'sideways_tsl_mult': 0.7235482683298918, 'sideways_time_stop': 207, 'sideways_use_sma': False, 'sideways_use_ema': False, 'sideways_use_atr': False, 'sideways_use_adx': False, 'sideways_use_spike': False, 'sideways_rsi_required': True}.
[I 2025-08-29 20:27:39,324] Trial 433 finished with values: [-1000000000.0, 1000000000.0] and parameters: {'p_sma': 56, 'p_std': 30, 'p_atr': 17, 'p_adx': 14, 'rsi_period': 37, 'ema1': 8, 'ema2': 44, 'slip_atr_k': 0.008432663997655781, 'slip_spread_k': 0.16034364132591455, 'spread_hl_frac': 0.046092262998724216, 'bb_std_mult': 1.8458176831275641, 'rsi_os': 38, 'rsi_ob': 95, 'vol_spike': 0.1873965959439725, 'adx_thresh': 13.7778268473616, 'atr_min_pct': 0.02070921039185396, 'atr_max_pct': 0.01624275531833548, 'tp_mult': 1.2462033113985096, 'tsl_mult': 0.1281866070082105, 'strategy': 'mean_reversion', 'time_stop': 163, 'use_sma': True, 'use_atr': False, 'use_adx': False, 'use_ema': True, 'use_spike': False, 'rsi_required': False, 'edge_k': 1.0982169252845402, 'edge_cap': 0.2609764633191901, 'bull_strategy': 'mean_reversion', 'bull_bb_std_mult': 3.0029791876243834, 'bull_rsi_os': 12, 'bull_rsi_ob': 71, 'bull_adx_thresh': 11.909985180023348, 'bull_atr_min_pct': 0.015214101852006095, 'bull_atr_max_pct': 0.08971164853078017, 'bull_tp_mult': 2.507990807416463, 'bull_tsl_mult': 0.9428695814580906, 'bull_time_stop': 21, 'bull_use_sma': True, 'bull_use_ema': False, 'bull_use_atr': True, 'bull_use_adx': False, 'bull_use_spike': True, 'bull_rsi_required': False, 'bear_strategy': 'breakout', 'bear_bb_std_mult': 2.9006944213037635, 'bear_rsi_os': 54, 'bear_rsi_ob': 65, 'bear_adx_thresh': 20.97882676111317, 'bear_atr_min_pct': 0.010115809570945981, 'bear_atr_max_pct': 0.13666063481238214, 'bear_tp_mult': 2.671953691439379, 'bear_tsl_mult': 0.1399032047493486, 'bear_time_stop': 43, 'bear_use_sma': False, 'bear_use_ema': True, 'bear_use_atr': False, 'bear_use_adx': True, 'bear_use_spike': True, 'bear_rsi_required': False, 'sideways_strategy': 'breakout', 'sideways_bb_std_mult': 2.3358242444705932, 'sideways_rsi_os': 46, 'sideways_rsi_ob': 47, 'sideways_adx_thresh': 31.480995370094142, 'sideways_atr_min_pct': 0.005629378586270464, 'sideways_atr_max_pct': 0.045888788021153565, 'sideways_tp_mult': 1.3216190825656973, 'sideways_tsl_mult': 0.7357175685012797, 'sideways_time_stop': 98, 'sideways_use_sma': False, 'sideways_use_ema': False, 'sideways_use_atr': False, 'sideways_use_adx': True, 'sideways_use_spike': False, 'sideways_rsi_required': False}.
[I 2025-08-29 20:27:54,870] Trial 429 finished with values: [-0.006289211742631751, 0.006643207034051598] and parameters: {'p_sma': 28, 'p_std': 43, 'p_atr': 25, 'p_adx': 9, 'rsi_period': 37, 'ema1': 26, 'ema2': 46, 'slip_atr_k': 0.008644389960774199, 'slip_spread_k': 0.04385600020796954, 'spread_hl_frac': 0.049941423584861526, 'bb_std_mult': 2.7568244033897935, 'rsi_os': 9, 'rsi_ob': 85, 'vol_spike': 0.21769576122651252, 'adx_thresh': 12.246017832280428, 'atr_min_pct': 0.019454437893162632, 'atr_max_pct': 0.022964960479126623, 'tp_mult': 2.62257427751529, 'tsl_mult': 0.8579885227363105, 'strategy': 'mean_reversion', 'time_stop': 22, 'use_sma': False, 'use_atr': False, 'use_adx': False, 'use_ema': True, 'use_spike': False, 'rsi_required': False, 'edge_k': 1.818357783955642, 'edge_cap': 0.6554623139374751, 'bull_strategy': 'mean_reversion', 'bull_bb_std_mult': 3.1313960998441597, 'bull_rsi_os': 7, 'bull_rsi_ob': 74, 'bull_adx_thresh': 11.454156004248354, 'bull_atr_min_pct': 0.016909610064274282, 'bull_atr_max_pct': 0.09148257387374581, 'bull_tp_mult': 2.7077431029438404, 'bull_tsl_mult': 0.9962276589892943, 'bull_time_stop': 224, 'bull_use_sma': True, 'bull_use_ema': False, 'bull_use_atr': True, 'bull_use_adx': False, 'bull_use_spike': True, 'bull_rsi_required': False, 'bear_strategy': 'breakout', 'bear_bb_std_mult': 2.685152992036287, 'bear_rsi_os': 28, 'bear_rsi_ob': 65, 'bear_adx_thresh': 21.12339885502145, 'bear_atr_min_pct': 0.00152537829541605, 'bear_atr_max_pct': 0.02023254421962696, 'bear_tp_mult': 2.6927554941873053, 'bear_tsl_mult': 0.8607000073637152, 'bear_time_stop': 46, 'bear_use_sma': False, 'bear_use_ema': False, 'bear_use_atr': False, 'bear_use_adx': True, 'bear_use_spike': False, 'bear_rsi_required': False, 'sideways_strategy': 'breakout', 'sideways_bb_std_mult': 2.3449249790386264, 'sideways_rsi_os': 10, 'sideways_rsi_ob': 78, 'sideways_adx_thresh': 23.078210016282043, 'sideways_atr_min_pct': 0.004729789285850983, 'sideways_atr_max_pct': 0.027820916794191367, 'sideways_tp_mult': 1.2279092708048642, 'sideways_tsl_mult': 0.7596558503761093, 'sideways_time_stop': 207, 'sideways_use_sma': False, 'sideways_use_ema': False, 'sideways_use_atr': False, 'sideways_use_adx': False, 'sideways_use_spike': False, 'sideways_rsi_required': True}.
