[I 2025-08-29 21:13:16,719] Trial 830 finished with values: [-0.00523849002163701, 0.005131431162273575] and parameters: {'p_sma': 18, 'p_std': 43, 'p_atr': 13, 'p_adx': 8, 'rsi_period': 31, 'ema1': 24, 'ema2': 28, 'slip_atr_k': 0.22562700450495915, 'slip_spread_k': 0.11482223919790872, 'spread_hl_frac': 0.024986633008581276, 'bb_std_mult': 0.7658614469816412, 'rsi_os': 32, 'rsi_ob': 78, 'vol_spike': 0.2810704864725341, 'adx_thresh': 6.996664146752483, 'atr_min_pct': 0.012270250842098276, 'atr_max_pct': 0.09786613940538086, 'tp_mult': 2.479446440140227, 'tsl_mult': 0.7414181246052134, 'strategy': 'mean_reversion', 'time_stop': 216, 'use_sma': True, 'use_atr': False, 'use_adx': False, 'use_ema': False, 'use_spike': True, 'rsi_required': False, 'edge_k': 0.848206643973992, 'edge_cap': 0.3195027478293961, 'bull_strategy': 'mean_reversion', 'bull_bb_std_mult': 2.6377424546180586, 'bull_rsi_os': 23, 'bull_rsi_ob': 68, 'bull_adx_thresh': 25.315037908218173, 'bull_atr_min_pct': 0.018012856370372695, 'bull_atr_max_pct': 0.11335388031400333, 'bull_tp_mult': 2.4451613059626545, 'bull_tsl_mult': 0.9563922190385487, 'bull_time_stop': 198, 'bull_use_sma': True, 'bull_use_ema': False, 'bull_use_atr': False, 'bull_use_adx': True, 'bull_use_spike': True, 'bull_rsi_required': False, 'bear_strategy': 'breakout', 'bear_bb_std_mult': 2.403331944829304, 'bear_rsi_os': 41, 'bear_rsi_ob': 89, 'bear_adx_thresh': 16.67253751894691, 'bear_atr_min_pct': 0.006463557678367092, 'bear_atr_max_pct': 0.07232369239027554, 'bear_tp_mult': 2.8152602337543784, 'bear_tsl_mult': 0.06820765843992556, 'bear_time_stop': 271, 'bear_use_sma': False, 'bear_use_ema': False, 'bear_use_atr': False, 'bear_use_adx': False, 'bear_use_spike': True, 'bear_rsi_required': False, 'sideways_strategy': 'breakout', 'sideways_bb_std_mult': 3.4574993783950947, 'sideways_rsi_os': 22, 'sideways_rsi_ob': 84, 'sideways_adx_thresh': 12.661457879186523, 'sideways_atr_min_pct': 0.013778512434322423, 'sideways_atr_max_pct': 0.04217675874938156, 'sideways_tp_mult': 2.2962325060752886, 'sideways_tsl_mult': 0.5896517131711325, 'sideways_time_stop': 144, 'sideways_use_sma': False, 'sideways_use_ema': False, 'sideways_use_atr': True, 'sideways_use_adx': False, 'sideways_use_spike': False, 'sideways_rsi_required': True}.
[I 2025-08-29 21:13:16,858] Trial 828 finished with values: [-1000000000.0, 1000000000.0] and parameters: {'p_sma': 15, 'p_std': 27, 'p_atr': 13, 'p_adx': 8, 'rsi_period': 33, 'ema1': 24, 'ema2': 29, 'slip_atr_k': 0.22889530503144373, 'slip_spread_k': 0.10432428837553546, 'spread_hl_frac': 0.024753609847403907, 'bb_std_mult': 0.7752073829079892, 'rsi_os': 32, 'rsi_ob': 79, 'vol_spike': 0.28292454515160353, 'adx_thresh': 6.907089000089361, 'atr_min_pct': 0.010935296119262238, 'atr_max_pct': 0.035536035120410724, 'tp_mult': 2.4378235686708147, 'tsl_mult': 0.7330517768155704, 'strategy': 'mean_reversion', 'time_stop': 216, 'use_sma': True, 'use_atr': False, 'use_adx': False, 'use_ema': False, 'use_spike': True, 'rsi_required': False, 'edge_k': 0.9302698119445528, 'edge_cap': 0.2637666071805018, 'bull_strategy': 'mean_reversion', 'bull_bb_std_mult': 2.7623053727766327, 'bull_rsi_os': 23, 'bull_rsi_ob': 68, 'bull_adx_thresh': 31.17452596356447, 'bull_atr_min_pct': 0.017903638055537643, 'bull_atr_max_pct': 0.10449005388450704, 'bull_tp_mult': 2.298250815735064, 'bull_tsl_mult': 0.9550854271272481, 'bull_time_stop': 205, 'bull_use_sma': True, 'bull_use_ema': False, 'bull_use_atr': False, 'bull_use_adx': True, 'bull_use_spike': True, 'bull_rsi_required': False, 'bear_strategy': 'breakout', 'bear_bb_std_mult': 2.3875432774243217, 'bear_rsi_os': 39, 'bear_rsi_ob': 87, 'bear_adx_thresh': 16.342433180698524, 'bear_atr_min_pct': 0.007068640897116859, 'bear_atr_max_pct': 0.08492533689380383, 'bear_tp_mult': 2.8164473591213177, 'bear_tsl_mult': 0.02938884204595562, 'bear_time_stop': 247, 'bear_use_sma': False, 'bear_use_ema': False, 'bear_use_atr': False, 'bear_use_adx': False, 'bear_use_spike': True, 'bear_rsi_required': False, 'sideways_strategy': 'breakout', 'sideways_bb_std_mult': 3.4678160791821298, 'sideways_rsi_os': 23, 'sideways_rsi_ob': 84, 'sideways_adx_thresh': 10.762003118561953, 'sideways_atr_min_pct': 0.012865155050324092, 'sideways_atr_max_pct': 0.040577831630649874, 'sideways_tp_mult': 2.2925257935380947, 'sideways_tsl_mult': 0.5728858797630695, 'sideways_time_stop': 145, 'sideways_use_sma': False, 'sideways_use_ema': False, 'sideways_use_atr': True, 'sideways_use_adx': False, 'sideways_use_spike': False, 'sideways_rsi_required': True}.
[I 2025-08-29 21:13:17,101] Trial 829 finished with values: [-1000000000.0, 1000000000.0] and parameters: {'p_sma': 18, 'p_std': 41, 'p_atr': 14, 'p_adx': 7, 'rsi_period': 31, 'ema1': 24, 'ema2': 28, 'slip_atr_k': 0.2311260871132088, 'slip_spread_k': 0.11529865486787054, 'spread_hl_frac': 0.024397220558388742, 'bb_std_mult': 0.7716233540416428, 'rsi_os': 8, 'rsi_ob': 76, 'vol_spike': 0.28324550378296814, 'adx_thresh': 6.720920133520888, 'atr_min_pct': 0.010850419709470024, 'atr_max_pct': 0.04839485270130439, 'tp_mult': 2.4808116606814536, 'tsl_mult': 0.7447513276646062, 'strategy': 'mean_reversion', 'time_stop': 217, 'use_sma': True, 'use_atr': False, 'use_adx': False, 'use_ema': False, 'use_spike': True, 'rsi_required': False, 'edge_k': 0.8590294960910908, 'edge_cap': 0.25786104187075987, 'bull_strategy': 'mean_reversion', 'bull_bb_std_mult': 2.6283424319139677, 'bull_rsi_os': 23, 'bull_rsi_ob': 68, 'bull_adx_thresh': 24.59840249470657, 'bull_atr_min_pct': 0.019408923120204768, 'bull_atr_max_pct': 0.10511826926213849, 'bull_tp_mult': 2.458699052522387, 'bull_tsl_mult': 0.9552140386368679, 'bull_time_stop': 205, 'bull_use_sma': True, 'bull_use_ema': False, 'bull_use_atr': False, 'bull_use_adx': True, 'bull_use_spike': True, 'bull_rsi_required': False, 'bear_strategy': 'breakout', 'bear_bb_std_mult': 2.382561519957007, 'bear_rsi_os': 41, 'bear_rsi_ob': 89, 'bear_adx_thresh': 25.4958497567283, 'bear_atr_min_pct': 0.024233261214790254, 'bear_atr_max_pct': 0.07246007839677611, 'bear_tp_mult': 2.8078978687059313, 'bear_tsl_mult': 0.021969978532846664, 'bear_time_stop': 272, 'bear_use_sma': False, 'bear_use_ema': False, 'bear_use_atr': False, 'bear_use_adx': False, 'bear_use_spike': True, 'bear_rsi_required': False, 'sideways_strategy': 'breakout', 'sideways_bb_std_mult': 3.4676813025654236, 'sideways_rsi_os': 23, 'sideways_rsi_ob': 84, 'sideways_adx_thresh': 12.633553975565064, 'sideways_atr_min_pct': 0.013546802440165586, 'sideways_atr_max_pct': 0.04174069266602477, 'sideways_tp_mult': 2.371517988316104, 'sideways_tsl_mult': 0.5722297576954016, 'sideways_time_stop': 146, 'sideways_use_sma': False, 'sideways_use_ema': False, 'sideways_use_atr': True, 'sideways_use_adx': False, 'sideways_use_spike': False, 'sideways_rsi_required': True}.
[I 2025-08-29 21:13:17,104] Trial 831 finished with values: [-0.004420807985458519, 0.00431427780507373] and parameters: {'p_sma': 18, 'p_std': 43, 'p_atr': 13, 'p_adx': 7, 'rsi_period': 31, 'ema1': 23, 'ema2': 29, 'slip_atr_k': 0.2230577297038086, 'slip_spread_k': 0.11800010208933774, 'spread_hl_frac': 0.024744455751665957, 'bb_std_mult': 0.7653214488642761, 'rsi_os': 37, 'rsi_ob': 76, 'vol_spike': 0.2831909999414345, 'adx_thresh': 7.119584040138514, 'atr_min_pct': 0.010470102758548046, 'atr_max_pct': 0.03884902440816298, 'tp_mult': 2.485225687941208, 'tsl_mult': 0.7306808817010524, 'strategy': 'mean_reversion', 'time_stop': 216, 'use_sma': True, 'use_atr': False, 'use_adx': False, 'use_ema': False, 'use_spike': True, 'rsi_required': False, 'edge_k': 0.7809722790384616, 'edge_cap': 0.3150836810809618, 'bull_strategy': 'mean_reversion', 'bull_bb_std_mult': 2.8070930919304717, 'bull_rsi_os': 22, 'bull_rsi_ob': 68, 'bull_adx_thresh': 25.483964141615452, 'bull_atr_min_pct': 0.018069566727166884, 'bull_atr_max_pct': 0.10416409586862174, 'bull_tp_mult': 2.4579906086361807, 'bull_tsl_mult': 0.9505056879715924, 'bull_time_stop': 196, 'bull_use_sma': True, 'bull_use_ema': False, 'bull_use_atr': False, 'bull_use_adx': True, 'bull_use_spike': True, 'bull_rsi_required': False, 'bear_strategy': 'breakout', 'bear_bb_std_mult': 2.378140179992179, 'bear_rsi_os': 41, 'bear_rsi_ob': 85, 'bear_adx_thresh': 16.535513527854047, 'bear_atr_min_pct': 0.006712291890492034, 'bear_atr_max_pct': 0.07288581717087382, 'bear_tp_mult': 2.9275668991505777, 'bear_tsl_mult': 0.017657876233985847, 'bear_time_stop': 234, 'bear_use_sma': False, 'bear_use_ema': False, 'bear_use_atr': False, 'bear_use_adx': False, 'bear_use_spike': True, 'bear_rsi_required': False, 'sideways_strategy': 'breakout', 'sideways_bb_std_mult': 3.5990625429355765, 'sideways_rsi_os': 22, 'sideways_rsi_ob': 84, 'sideways_adx_thresh': 10.69334446608201, 'sideways_atr_min_pct': 0.01364970338079948, 'sideways_atr_max_pct': 0.040772836856866876, 'sideways_tp_mult': 2.292204512697923, 'sideways_tsl_mult': 0.579433000194603, 'sideways_time_stop': 147, 'sideways_use_sma': False, 'sideways_use_ema': False, 'sideways_use_atr': True, 'sideways_use_adx': False, 'sideways_use_spike': False, 'sideways_rsi_required': True}.
[I 2025-08-29 21:13:46,180] Trial 832 finished with values: [-1000000000.0, 1000000000.0] and parameters: {'p_sma': 15, 'p_std': 35, 'p_atr': 15, 'p_adx': 7, 'rsi_period': 30, 'ema1': 23, 'ema2': 25, 'slip_atr_k': 0.232762262389142, 'slip_spread_k': 0.059747959620096, 'spread_hl_frac': 0.023700929699379994, 'bb_std_mult': 0.9930191052074042, 'rsi_os': 52, 'rsi_ob': 80, 'vol_spike': 0.2838650150291733, 'adx_thresh': 7.797255665512774, 'atr_min_pct': 0.010833011447927457, 'atr_max_pct': 0.09417686432675647, 'tp_mult': 2.338661412305764, 'tsl_mult': 0.7597364133415359, 'strategy': 'breakout', 'time_stop': 226, 'use_sma': True, 'use_atr': False, 'use_adx': False, 'use_ema': False, 'use_spike': True, 'rsi_required': False, 'edge_k': 0.7701460662281574, 'edge_cap': 0.31036391130634583, 'bull_strategy': 'mean_reversion', 'bull_bb_std_mult': 2.821291811739643, 'bull_rsi_os': 22, 'bull_rsi_ob': 68, 'bull_adx_thresh': 24.52109840063785, 'bull_atr_min_pct': 0.017904955374550245, 'bull_atr_max_pct': 0.10472960640410767, 'bull_tp_mult': 2.4626043720847686, 'bull_tsl_mult': 0.9484931703706856, 'bull_time_stop': 205, 'bull_use_sma': True, 'bull_use_ema': False, 'bull_use_atr': False, 'bull_use_adx': True, 'bull_use_spike': True, 'bull_rsi_required': False, 'bear_strategy': 'breakout', 'bear_bb_std_mult': 2.501708065609144, 'bear_rsi_os': 44, 'bear_rsi_ob': 85, 'bear_adx_thresh': 10.643955485895159, 'bear_atr_min_pct': 0.006765941692268905, 'bear_atr_max_pct': 0.07621886922931644, 'bear_tp_mult': 2.9480190122581025, 'bear_tsl_mult': 0.03295004347610323, 'bear_time_stop': 219, 'bear_use_sma': False, 'bear_use_ema': False, 'bear_use_atr': False, 'bear_use_adx': False, 'bear_use_spike': True, 'bear_rsi_required': False, 'sideways_strategy': 'breakout', 'sideways_bb_std_mult': 3.388157161315354, 'sideways_rsi_os': 23, 'sideways_rsi_ob': 85, 'sideways_adx_thresh': 10.945553039089514, 'sideways_atr_min_pct': 0.014897449778857787, 'sideways_atr_max_pct': 0.04095592387143087, 'sideways_tp_mult': 2.193392494444285, 'sideways_tsl_mult': 0.5837210805812996, 'sideways_time_stop': 148, 'sideways_use_sma': False, 'sideways_use_ema': False, 'sideways_use_atr': True, 'sideways_use_adx': False, 'sideways_use_spike': False, 'sideways_rsi_required': True}.
[I 2025-08-29 21:13:46,451] Trial 834 finished with values: [-1000000000.0, 1000000000.0] and parameters: {'p_sma': 17, 'p_std': 35, 'p_atr': 15, 'p_adx': 7, 'rsi_period': 34, 'ema1': 23, 'ema2': 25, 'slip_atr_k': 0.23747451517316615, 'slip_spread_k': 0.05388346226470927, 'spread_hl_frac': 0.023384377810504557, 'bb_std_mult': 0.9814180694426604, 'rsi_os': 6, 'rsi_ob': 75, 'vol_spike': 0.29267559747164285, 'adx_thresh': 9.800629932734543, 'atr_min_pct': 0.012944713867376972, 'atr_max_pct': 0.039031614542549525, 'tp_mult': 2.3574947924190033, 'tsl_mult': 0.7601976854666803, 'strategy': 'breakout', 'time_stop': 224, 'use_sma': True, 'use_atr': True, 'use_adx': False, 'use_ema': False, 'use_spike': True, 'rsi_required': False, 'edge_k': 0.8044419550057014, 'edge_cap': 0.31173051340010655, 'bull_strategy': 'breakout', 'bull_bb_std_mult': 2.699747359994661, 'bull_rsi_os': 22, 'bull_rsi_ob': 66, 'bull_adx_thresh': 33.56254996071191, 'bull_atr_min_pct': 0.018565318851528678, 'bull_atr_max_pct': 0.10167614167352494, 'bull_tp_mult': 2.355666147795747, 'bull_tsl_mult': 0.9489605429198384, 'bull_time_stop': 213, 'bull_use_sma': False, 'bull_use_ema': False, 'bull_use_atr': False, 'bull_use_adx': True, 'bull_use_spike': True, 'bull_rsi_required': False, 'bear_strategy': 'mean_reversion', 'bear_bb_std_mult': 1.9934373043648907, 'bear_rsi_os': 44, 'bear_rsi_ob': 85, 'bear_adx_thresh': 8.03331385427382, 'bear_atr_min_pct': 0.000668184867693454, 'bear_atr_max_pct': 0.0759652617449946, 'bear_tp_mult': 2.909567119570309, 'bear_tsl_mult': 0.01955561963951521, 'bear_time_stop': 236, 'bear_use_sma': True, 'bear_use_ema': False, 'bear_use_atr': True, 'bear_use_adx': False, 'bear_use_spike': True, 'bear_rsi_required': False, 'sideways_strategy': 'breakout', 'sideways_bb_std_mult': 3.3989798928575934, 'sideways_rsi_os': 21, 'sideways_rsi_ob': 85, 'sideways_adx_thresh': 10.830778553477662, 'sideways_atr_min_pct': 0.014721074614982592, 'sideways_atr_max_pct': 0.03610963664327843, 'sideways_tp_mult': 2.3200366640917105, 'sideways_tsl_mult': 0.5372538497906529, 'sideways_time_stop': 150, 'sideways_use_sma': True, 'sideways_use_ema': False, 'sideways_use_atr': True, 'sideways_use_adx': False, 'sideways_use_spike': False, 'sideways_rsi_required': True}.
[I 2025-08-29 21:13:46,663] Trial 833 finished with values: [-1000000000.0, 1000000000.0] and parameters: {'p_sma': 17, 'p_std': 36, 'p_atr': 15, 'p_adx': 7, 'rsi_period': 31, 'ema1': 23, 'ema2': 25, 'slip_atr_k': 0.014302755937907802, 'slip_spread_k': 0.08343046806814033, 'spread_hl_frac': 0.02335800875832676, 'bb_std_mult': 0.9961413956037655, 'rsi_os': 51, 'rsi_ob': 80, 'vol_spike': 0.2854789569760856, 'adx_thresh': 7.873915360578808, 'atr_min_pct': 0.010860033147613796, 'atr_max_pct': 0.06385213718873552, 'tp_mult': 2.315265021614035, 'tsl_mult': 0.7616740951691333, 'strategy': 'breakout', 'time_stop': 223, 'use_sma': True, 'use_atr': False, 'use_adx': False, 'use_ema': False, 'use_spike': True, 'rsi_required': False, 'edge_k': 0.8813768348046032, 'edge_cap': 0.30613715480074305, 'bull_strategy': 'breakout', 'bull_bb_std_mult': 2.80172348220936, 'bull_rsi_os': 22, 'bull_rsi_ob': 69, 'bull_adx_thresh': 32.11324653774251, 'bull_atr_min_pct': 0.018610670523876126, 'bull_atr_max_pct': 0.10447025596659705, 'bull_tp_mult': 2.506476814853465, 'bull_tsl_mult': 0.9512240718681237, 'bull_time_stop': 210, 'bull_use_sma': True, 'bull_use_ema': False, 'bull_use_atr': False, 'bull_use_adx': True, 'bull_use_spike': True, 'bull_rsi_required': False, 'bear_strategy': 'mean_reversion', 'bear_bb_std_mult': 2.130719862894332, 'bear_rsi_os': 44, 'bear_rsi_ob': 85, 'bear_adx_thresh': 25.360132074804728, 'bear_atr_min_pct': 0.00664271021689501, 'bear_atr_max_pct': 0.07618125131362967, 'bear_tp_mult': 2.9053631015833186, 'bear_tsl_mult': 0.015287368806615183, 'bear_time_stop': 235, 'bear_use_sma': True, 'bear_use_ema': False, 'bear_use_atr': False, 'bear_use_adx': False, 'bear_use_spike': True, 'bear_rsi_required': False, 'sideways_strategy': 'breakout', 'sideways_bb_std_mult': 3.3877312425837967, 'sideways_rsi_os': 22, 'sideways_rsi_ob': 83, 'sideways_adx_thresh': 12.56163939326791, 'sideways_atr_min_pct': 0.013828703181907993, 'sideways_atr_max_pct': 0.0358770453534723, 'sideways_tp_mult': 2.331265528563799, 'sideways_tsl_mult': 0.5375197530264096, 'sideways_time_stop': 149, 'sideways_use_sma': False, 'sideways_use_ema': False, 'sideways_use_atr': True, 'sideways_use_adx': False, 'sideways_use_spike': False, 'sideways_rsi_required': True}.
[I 2025-08-29 21:13:46,794] Trial 835 finished with values: [-1000000000.0, 1000000000.0] and parameters: {'p_sma': 15, 'p_std': 35, 'p_atr': 15, 'p_adx': 8, 'rsi_period': 27, 'ema1': 23, 'ema2': 25, 'slip_atr_k': 0.1888623465137742, 'slip_spread_k': 0.0817381881983206, 'spread_hl_frac': 0.023726902394861277, 'bb_std_mult': 0.9174415654968804, 'rsi_os': 51, 'rsi_ob': 80, 'vol_spike': 0.27069846973238143, 'adx_thresh': 9.699178772293687, 'atr_min_pct': 0.012927596981158382, 'atr_max_pct': 0.09395090256543905, 'tp_mult': 2.318653512229143, 'tsl_mult': 0.7704841405019678, 'strategy': 'breakout', 'time_stop': 227, 'use_sma': False, 'use_atr': True, 'use_adx': True, 'use_ema': False, 'use_spike': True, 'rsi_required': False, 'edge_k': 0.8819226824764328, 'edge_cap': 0.28849884650684343, 'bull_strategy': 'breakout', 'bull_bb_std_mult': 2.6915766932212577, 'bull_rsi_os': 21, 'bull_rsi_ob': 66, 'bull_adx_thresh': 32.25981983759179, 'bull_atr_min_pct': 0.018819524199363624, 'bull_atr_max_pct': 0.10133219866221384, 'bull_tp_mult': 2.3677967945727927, 'bull_tsl_mult': 0.9576320212738363, 'bull_time_stop': 208, 'bull_use_sma': False, 'bull_use_ema': False, 'bull_use_atr': False, 'bull_use_adx': True, 'bull_use_spike': False, 'bull_rsi_required': True, 'bear_strategy': 'mean_reversion', 'bear_bb_std_mult': 1.787108785447757, 'bear_rsi_os': 42, 'bear_rsi_ob': 85, 'bear_adx_thresh': 24.514311011382816, 'bear_atr_min_pct': 0.007387060750747778, 'bear_atr_max_pct': 0.07597550979496273, 'bear_tp_mult': 2.8726645253854883, 'bear_tsl_mult': 0.048345394986561555, 'bear_time_stop': 238, 'bear_use_sma': True, 'bear_use_ema': False, 'bear_use_atr': True, 'bear_use_adx': False, 'bear_use_spike': False, 'bear_rsi_required': True, 'sideways_strategy': 'breakout', 'sideways_bb_std_mult': 3.4024556002393673, 'sideways_rsi_os': 20, 'sideways_rsi_ob': 83, 'sideways_adx_thresh': 12.187874344143793, 'sideways_atr_min_pct': 0.014807531269386175, 'sideways_atr_max_pct': 0.037273782015808735, 'sideways_tp_mult': 2.2084032880962114, 'sideways_tsl_mult': 0.5333044811075768, 'sideways_time_stop': 162, 'sideways_use_sma': True, 'sideways_use_ema': False, 'sideways_use_atr': True, 'sideways_use_adx': False, 'sideways_use_spike': True, 'sideways_rsi_required': True}.
[I 2025-08-29 21:14:16,245] Trial 837 finished with values: [-1000000000.0, 1000000000.0] and parameters: {'p_sma': 9, 'p_std': 39, 'p_atr': 14, 'p_adx': 8, 'rsi_period': 28, 'ema1': 24, 'ema2': 27, 'slip_atr_k': 0.1893038916777901, 'slip_spread_k': 0.08078525063789324, 'spread_hl_frac': 0.023634744528281675, 'bb_std_mult': 0.8813955753639108, 'rsi_os': 6, 'rsi_ob': 78, 'vol_spike': 0.2727481551136664, 'adx_thresh': 8.826437962332964, 'atr_min_pct': 0.012195001785731437, 'atr_max_pct': 0.052301587373233246, 'tp_mult': 2.4001258203336193, 'tsl_mult': 0.7979773059197272, 'strategy': 'mean_reversion', 'time_stop': 229, 'use_sma': False, 'use_atr': False, 'use_adx': True, 'use_ema': False, 'use_spike': True, 'rsi_required': False, 'edge_k': 0.8869282204668578, 'edge_cap': 0.28265199976183153, 'bull_strategy': 'breakout', 'bull_bb_std_mult': 2.531508870630442, 'bull_rsi_os': 21, 'bull_rsi_ob': 69, 'bull_adx_thresh': 20.095791418875375, 'bull_atr_min_pct': 0.019564460052069025, 'bull_atr_max_pct': 0.11139857827830948, 'bull_tp_mult': 2.3971745528301254, 'bull_tsl_mult': 0.9967214516825883, 'bull_time_stop': 200, 'bull_use_sma': True, 'bull_use_ema': True, 'bull_use_atr': False, 'bull_use_adx': True, 'bull_use_spike': False, 'bull_rsi_required': True, 'bear_strategy': 'mean_reversion', 'bear_bb_std_mult': 1.7795853522241258, 'bear_rsi_os': 42, 'bear_rsi_ob': 87, 'bear_adx_thresh': 24.326539931652658, 'bear_atr_min_pct': 0.007507372594587923, 'bear_atr_max_pct': 0.07923734535933555, 'bear_tp_mult': 2.85263664161495, 'bear_tsl_mult': 0.08802501642873933, 'bear_time_stop': 227, 'bear_use_sma': True, 'bear_use_ema': False, 'bear_use_atr': True, 'bear_use_adx': False, 'bear_use_spike': False, 'bear_rsi_required': True, 'sideways_strategy': 'mean_reversion', 'sideways_bb_std_mult': 3.552004538783672, 'sideways_rsi_os': 20, 'sideways_rsi_ob': 83, 'sideways_adx_thresh': 12.150065135197543, 'sideways_atr_min_pct': 0.013973719722769276, 'sideways_atr_max_pct': 0.03676753992873809, 'sideways_tp_mult': 2.3372296335791787, 'sideways_tsl_mult': 0.6141375352680181, 'sideways_time_stop': 165, 'sideways_use_sma': True, 'sideways_use_ema': False, 'sideways_use_atr': True, 'sideways_use_adx': True, 'sideways_use_spike': True, 'sideways_rsi_required': True}.
