[I 2025-08-29 19:52:29,354] Trial 133 finished with values: [-0.018199268629671472, 0.01817873776132317] and parameters: {'p_sma': 22, 'p_std': 59, 'p_atr': 23, 'p_adx': 10, 'rsi_period': 37, 'ema1': 11, 'ema2': 39, 'slip_atr_k': 0.03007227734213055, 'slip_spread_k': 0.3557133324890298, 'spread_hl_frac': 0.003418683870591733, 'bb_std_mult': 1.7878866415400196, 'rsi_os': 37, 'rsi_ob': 75, 'vol_spike': 0.24550506915520082, 'adx_thresh': 5.978923341169175, 'atr_min_pct': 0.018170882021231384, 'atr_max_pct': 0.057045920466496654, 'tp_mult': 2.5198342656014994, 'tsl_mult': 0.5824677004135648, 'strategy': 'mean_reversion', 'time_stop': 113, 'use_sma': False, 'use_atr': False, 'use_adx': False, 'use_ema': False, 'use_spike': False, 'rsi_required': True, 'edge_k': 1.2498388417793134, 'edge_cap': 0.44050293055325723, 'bull_strategy': 'breakout', 'bull_bb_std_mult': 0.6732725730844094, 'bull_rsi_os': 46, 'bull_rsi_ob': 91, 'bull_adx_thresh': 23.138021503654585, 'bull_atr_min_pct': 0.02297944244118197, 'bull_atr_max_pct': 0.14081182084197186, 'bull_tp_mult': 1.1730901038623471, 'bull_tsl_mult': 0.16091948390695954, 'bull_time_stop': 132, 'bull_use_sma': False, 'bull_use_ema': True, 'bull_use_atr': False, 'bull_use_adx': True, 'bull_use_spike': False, 'bull_rsi_required': True, 'bear_strategy': 'breakout', 'bear_bb_std_mult': 3.039577404918777, 'bear_rsi_os': 28, 'bear_rsi_ob': 66, 'bear_adx_thresh': 34.03488879778573, 'bear_atr_min_pct': 0.007300162054640975, 'bear_atr_max_pct': 0.12481277656477663, 'bear_tp_mult': 1.8159091313961766, 'bear_tsl_mult': 0.8687542919921591, 'bear_time_stop': 33, 'bear_use_sma': False, 'bear_use_ema': False, 'bear_use_atr': False, 'bear_use_adx': False, 'bear_use_spike': False, 'bear_rsi_required': False, 'sideways_strategy': 'breakout', 'sideways_bb_std_mult': 0.7701764056513565, 'sideways_rsi_os': 32, 'sideways_rsi_ob': 79, 'sideways_adx_thresh': 33.636408733188816, 'sideways_atr_min_pct': 0.000651151676249892, 'sideways_atr_max_pct': 0.12778771239472209, 'sideways_tp_mult': 2.0257586372394534, 'sideways_tsl_mult': 0.01897736330482469, 'sideways_time_stop': 230, 'sideways_use_sma': False, 'sideways_use_ema': True, 'sideways_use_atr': True, 'sideways_use_adx': False, 'sideways_use_spike': True, 'sideways_rsi_required': True}.
[I 2025-08-29 19:52:32,513] Trial 137 finished with values: [-1000000000.0, 1000000000.0] and parameters: {'p_sma': 37, 'p_std': 52, 'p_atr': 22, 'p_adx': 10, 'rsi_period': 24, 'ema1': 15, 'ema2': 42, 'slip_atr_k': 0.04374087775227071, 'slip_spread_k': 0.3015165240234644, 'spread_hl_frac': 0.005194977486772252, 'bb_std_mult': 2.905002146508073, 'rsi_os': 22, 'rsi_ob': 55, 'vol_spike': 0.03584146136438156, 'adx_thresh': 30.072132884603526, 'atr_min_pct': 0.013936025060902735, 'atr_max_pct': 0.14727392581095775, 'tp_mult': 2.5263852908861333, 'tsl_mult': 0.7220252257642698, 'strategy': 'mean_reversion', 'time_stop': 94, 'use_sma': False, 'use_atr': True, 'use_adx': False, 'use_ema': False, 'use_spike': False, 'rsi_required': False, 'edge_k': 1.2279044244233568, 'edge_cap': 0.4206682891498667, 'bull_strategy': 'breakout', 'bull_bb_std_mult': 0.9952760619198411, 'bull_rsi_os': 42, 'bull_rsi_ob': 52, 'bull_adx_thresh': 11.324100630842551, 'bull_atr_min_pct': 0.006464479699290402, 'bull_atr_max_pct': 0.140675539109281, 'bull_tp_mult': 2.466993665226808, 'bull_tsl_mult': 0.16780319655512765, 'bull_time_stop': 172, 'bull_use_sma': False, 'bull_use_ema': False, 'bull_use_atr': True, 'bull_use_adx': True, 'bull_use_spike': False, 'bull_rsi_required': True, 'bear_strategy': 'mean_reversion', 'bear_bb_std_mult': 2.6127735936669567, 'bear_rsi_os': 28, 'bear_rsi_ob': 85, 'bear_adx_thresh': 16.808401150850553, 'bear_atr_min_pct': 0.02107606303287845, 'bear_atr_max_pct': 0.104874825846662, 'bear_tp_mult': 1.9576837271587535, 'bear_tsl_mult': 0.5954705708188891, 'bear_time_stop': 33, 'bear_use_sma': False, 'bear_use_ema': True, 'bear_use_atr': True, 'bear_use_adx': False, 'bear_use_spike': False, 'bear_rsi_required': False, 'sideways_strategy': 'mean_reversion', 'sideways_bb_std_mult': 0.7874631277931923, 'sideways_rsi_os': 29, 'sideways_rsi_ob': 93, 'sideways_adx_thresh': 26.03577027818477, 'sideways_atr_min_pct': 0.0055527902545357225, 'sideways_atr_max_pct': 0.13796112655867154, 'sideways_tp_mult': 1.5703228937664337, 'sideways_tsl_mult': 0.6319264257744548, 'sideways_time_stop': 228, 'sideways_use_sma': False, 'sideways_use_ema': True, 'sideways_use_atr': True, 'sideways_use_adx': False, 'sideways_use_spike': False, 'sideways_rsi_required': True}.
[I 2025-08-29 19:52:32,587] Trial 138 finished with values: [-0.0037500706395203753, 0.003917945224650169] and parameters: {'p_sma': 37, 'p_std': 11, 'p_atr': 22, 'p_adx': 16, 'rsi_period': 24, 'ema1': 12, 'ema2': 42, 'slip_atr_k': 0.12734714938069713, 'slip_spread_k': 0.3059619718739042, 'spread_hl_frac': 0.010348811705219006, 'bb_std_mult': 2.80929745748876, 'rsi_os': 22, 'rsi_ob': 55, 'vol_spike': 0.011847556271710469, 'adx_thresh': 20.225820618455934, 'atr_min_pct': 0.014203406535903197, 'atr_max_pct': 0.09896179460414153, 'tp_mult': 1.5746068176266688, 'tsl_mult': 0.6096216318078727, 'strategy': 'mean_reversion', 'time_stop': 97, 'use_sma': False, 'use_atr': True, 'use_adx': False, 'use_ema': False, 'use_spike': False, 'rsi_required': False, 'edge_k': 1.216335032456949, 'edge_cap': 0.4181784663460715, 'bull_strategy': 'breakout', 'bull_bb_std_mult': 1.0009780954482048, 'bull_rsi_os': 39, 'bull_rsi_ob': 52, 'bull_adx_thresh': 20.07477994127307, 'bull_atr_min_pct': 0.004770804166028229, 'bull_atr_max_pct': 0.14116162095924378, 'bull_tp_mult': 2.024049555372539, 'bull_tsl_mult': 0.1731106337953291, 'bull_time_stop': 271, 'bull_use_sma': False, 'bull_use_ema': False, 'bull_use_atr': True, 'bull_use_adx': True, 'bull_use_spike': False, 'bull_rsi_required': True, 'bear_strategy': 'mean_reversion', 'bear_bb_std_mult': 2.6195329751251744, 'bear_rsi_os': 28, 'bear_rsi_ob': 83, 'bear_adx_thresh': 6.727429229883522, 'bear_atr_min_pct': 0.00687191605361648, 'bear_atr_max_pct': 0.10120946234362208, 'bear_tp_mult': 1.9545239295741068, 'bear_tsl_mult': 0.5945066583816915, 'bear_time_stop': 33, 'bear_use_sma': False, 'bear_use_ema': True, 'bear_use_atr': True, 'bear_use_adx': False, 'bear_use_spike': False, 'bear_rsi_required': False, 'sideways_strategy': 'mean_reversion', 'sideways_bb_std_mult': 1.7012301324061632, 'sideways_rsi_os': 30, 'sideways_rsi_ob': 62, 'sideways_adx_thresh': 33.3820300577073, 'sideways_atr_min_pct': 0.019362770319389867, 'sideways_atr_max_pct': 0.13821439607172403, 'sideways_tp_mult': 1.858776652732952, 'sideways_tsl_mult': 0.06464546499033752, 'sideways_time_stop': 158, 'sideways_use_sma': False, 'sideways_use_ema': True, 'sideways_use_atr': True, 'sideways_use_adx': False, 'sideways_use_spike': False, 'sideways_rsi_required': True}.
[I 2025-08-29 19:52:32,721] Trial 136 finished with values: [-1000000000.0, 1000000000.0] and parameters: {'p_sma': 37, 'p_std': 52, 'p_atr': 22, 'p_adx': 16, 'rsi_period': 51, 'ema1': 18, 'ema2': 42, 'slip_atr_k': 0.1098297522624762, 'slip_spread_k': 0.2992241989670977, 'spread_hl_frac': 0.02838591370307673, 'bb_std_mult': 2.828215425269601, 'rsi_os': 47, 'rsi_ob': 77, 'vol_spike': 0.2466124127644953, 'adx_thresh': 21.842139647074568, 'atr_min_pct': 0.01418500771799019, 'atr_max_pct': 0.14742784505181877, 'tp_mult': 2.624981650688097, 'tsl_mult': 0.6166226241358318, 'strategy': 'mean_reversion', 'time_stop': 96, 'use_sma': False, 'use_atr': True, 'use_adx': False, 'use_ema': False, 'use_spike': False, 'rsi_required': False, 'edge_k': 1.2377739279267175, 'edge_cap': 0.8271732305082625, 'bull_strategy': 'breakout', 'bull_bb_std_mult': 0.8841277365627517, 'bull_rsi_os': 39, 'bull_rsi_ob': 62, 'bull_adx_thresh': 20.0143543286657, 'bull_atr_min_pct': 0.02498515581184324, 'bull_atr_max_pct': 0.14171865263731753, 'bull_tp_mult': 2.398013356373786, 'bull_tsl_mult': 0.2065163993885092, 'bull_time_stop': 45, 'bull_use_sma': False, 'bull_use_ema': False, 'bull_use_atr': True, 'bull_use_adx': True, 'bull_use_spike': False, 'bull_rsi_required': True, 'bear_strategy': 'mean_reversion', 'bear_bb_std_mult': 2.65225101575796, 'bear_rsi_os': 28, 'bear_rsi_ob': 69, 'bear_adx_thresh': 12.292399098660002, 'bear_atr_min_pct': 0.007149487935515923, 'bear_atr_max_pct': 0.10209352821716532, 'bear_tp_mult': 1.9737004146100368, 'bear_tsl_mult': 0.5948597364492616, 'bear_time_stop': 34, 'bear_use_sma': False, 'bear_use_ema': True, 'bear_use_atr': True, 'bear_use_adx': False, 'bear_use_spike': False, 'bear_rsi_required': False, 'sideways_strategy': 'mean_reversion', 'sideways_bb_std_mult': 1.7315117362891541, 'sideways_rsi_os': 29, 'sideways_rsi_ob': 78, 'sideways_adx_thresh': 25.826879412370666, 'sideways_atr_min_pct': 0.0020737764547989566, 'sideways_atr_max_pct': 0.1331985726638663, 'sideways_tp_mult': 2.3139609010518543, 'sideways_tsl_mult': 0.19123793939479822, 'sideways_time_stop': 295, 'sideways_use_sma': False, 'sideways_use_ema': True, 'sideways_use_atr': True, 'sideways_use_adx': False, 'sideways_use_spike': False, 'sideways_rsi_required': True}.
[I 2025-08-29 19:53:01,645] Trial 139 finished with values: [-0.003880486460883348, 0.0038743724423107966] and parameters: {'p_sma': 37, 'p_std': 52, 'p_atr': 7, 'p_adx': 16, 'rsi_period': 23, 'ema1': 27, 'ema2': 22, 'slip_atr_k': 0.04331113303680145, 'slip_spread_k': 0.30616173049219864, 'spread_hl_frac': 0.01045270880109412, 'bb_std_mult': 2.8606636669364334, 'rsi_os': 20, 'rsi_ob': 55, 'vol_spike': 0.03578760402709741, 'adx_thresh': 29.830335916343476, 'atr_min_pct': 0.015174938086946147, 'atr_max_pct': 0.042770693276750565, 'tp_mult': 2.449039945652249, 'tsl_mult': 0.718917345114678, 'strategy': 'mean_reversion', 'time_stop': 96, 'use_sma': False, 'use_atr': True, 'use_adx': False, 'use_ema': False, 'use_spike': False, 'rsi_required': False, 'edge_k': 1.222520070858952, 'edge_cap': 0.4179095434375042, 'bull_strategy': 'breakout', 'bull_bb_std_mult': 0.9783933989619812, 'bull_rsi_os': 39, 'bull_rsi_ob': 95, 'bull_adx_thresh': 7.731412906924655, 'bull_atr_min_pct': 0.01988741478898238, 'bull_atr_max_pct': 0.05198377222749269, 'bull_tp_mult': 1.2380022745193404, 'bull_tsl_mult': 0.8321194613334232, 'bull_time_stop': 271, 'bull_use_sma': False, 'bull_use_ema': False, 'bull_use_atr': True, 'bull_use_adx': False, 'bull_use_spike': False, 'bull_rsi_required': True, 'bear_strategy': 'mean_reversion', 'bear_bb_std_mult': 1.677409339364239, 'bear_rsi_os': 30, 'bear_rsi_ob': 62, 'bear_adx_thresh': 12.354246162266145, 'bear_atr_min_pct': 0.006668276538265707, 'bear_atr_max_pct': 0.10037117242860916, 'bear_tp_mult': 1.962603003226452, 'bear_tsl_mult': 0.6108145582508953, 'bear_time_stop': 11, 'bear_use_sma': False, 'bear_use_ema': True, 'bear_use_atr': True, 'bear_use_adx': False, 'bear_use_spike': False, 'bear_rsi_required': True, 'sideways_strategy': 'mean_reversion', 'sideways_bb_std_mult': 1.7383991885699266, 'sideways_rsi_os': 29, 'sideways_rsi_ob': 81, 'sideways_adx_thresh': 26.107965216051397, 'sideways_atr_min_pct': 0.0038315715364058527, 'sideways_atr_max_pct': 0.11444011529473412, 'sideways_tp_mult': 2.3195329807078577, 'sideways_tsl_mult': 0.08301562607152196, 'sideways_time_stop': 197, 'sideways_use_sma': False, 'sideways_use_ema': False, 'sideways_use_atr': False, 'sideways_use_adx': False, 'sideways_use_spike': False, 'sideways_rsi_required': True}.
[I 2025-08-29 19:53:01,973] Trial 141 finished with values: [-1000000000.0, 1000000000.0] and parameters: {'p_sma': 36, 'p_std': 34, 'p_atr': 7, 'p_adx': 16, 'rsi_period': 18, 'ema1': 18, 'ema2': 37, 'slip_atr_k': 0.14306454038567754, 'slip_spread_k': 0.3116415127482772, 'spread_hl_frac': 0.0304187822764112, 'bb_std_mult': 1.1393353421458676, 'rsi_os': 20, 'rsi_ob': 60, 'vol_spike': 0.26178896000694807, 'adx_thresh': 21.855332028181987, 'atr_min_pct': 0.011541239523855053, 'atr_max_pct': 0.08527054771090779, 'tp_mult': 2.611751516546187, 'tsl_mult': 0.6138860156805926, 'strategy': 'mean_reversion', 'time_stop': 101, 'use_sma': False, 'use_atr': True, 'use_adx': False, 'use_ema': False, 'use_spike': False, 'rsi_required': True, 'edge_k': 1.349920390064089, 'edge_cap': 0.060205068750576074, 'bull_strategy': 'breakout', 'bull_bb_std_mult': 0.8716778008585835, 'bull_rsi_os': 40, 'bull_rsi_ob': 58, 'bull_adx_thresh': 17.64384927856325, 'bull_atr_min_pct': 0.019950481686019216, 'bull_atr_max_pct': 0.061496977408150445, 'bull_tp_mult': 2.034396715850314, 'bull_tsl_mult': 0.06983282190734366, 'bull_time_stop': 35, 'bull_use_sma': False, 'bull_use_ema': False, 'bull_use_atr': True, 'bull_use_adx': False, 'bull_use_spike': False, 'bull_rsi_required': True, 'bear_strategy': 'mean_reversion', 'bear_bb_std_mult': 1.2770498911789252, 'bear_rsi_os': 30, 'bear_rsi_ob': 69, 'bear_adx_thresh': 6.682141397641477, 'bear_atr_min_pct': 0.006357259887423892, 'bear_atr_max_pct': 0.09651216991402475, 'bear_tp_mult': 1.9092767256320973, 'bear_tsl_mult': 0.09189881152768442, 'bear_time_stop': 251, 'bear_use_sma': False, 'bear_use_ema': True, 'bear_use_atr': True, 'bear_use_adx': False, 'bear_use_spike': False, 'bear_rsi_required': True, 'sideways_strategy': 'mean_reversion', 'sideways_bb_std_mult': 2.017697677441375, 'sideways_rsi_os': 29, 'sideways_rsi_ob': 78, 'sideways_adx_thresh': 15.643166157241168, 'sideways_atr_min_pct': 0.016945261805425615, 'sideways_atr_max_pct': 0.13255768884343638, 'sideways_tp_mult': 2.141327808161861, 'sideways_tsl_mult': 0.9343058313466002, 'sideways_time_stop': 157, 'sideways_use_sma': False, 'sideways_use_ema': False, 'sideways_use_atr': False, 'sideways_use_adx': False, 'sideways_use_spike': False, 'sideways_rsi_required': True}.
[I 2025-08-29 19:53:02,266] Trial 142 finished with values: [-1000000000.0, 1000000000.0] and parameters: {'p_sma': 40, 'p_std': 46, 'p_atr': 19, 'p_adx': 16, 'rsi_period': 18, 'ema1': 12, 'ema2': 22, 'slip_atr_k': 0.1198625310746104, 'slip_spread_k': 0.9022613472796231, 'spread_hl_frac': 0.018270323945073715, 'bb_std_mult': 1.153607364268656, 'rsi_os': 23, 'rsi_ob': 63, 'vol_spike': 0.017123586553393827, 'adx_thresh': 19.700557904339064, 'atr_min_pct': 0.011745575896406958, 'atr_max_pct': 0.09872948090822758, 'tp_mult': 1.5758117475402451, 'tsl_mult': 0.6406281796539663, 'strategy': 'mean_reversion', 'time_stop': 76, 'use_sma': False, 'use_atr': True, 'use_adx': False, 'use_ema': False, 'use_spike': False, 'rsi_required': True, 'edge_k': 0.3950541659582365, 'edge_cap': 0.757842215957298, 'bull_strategy': 'breakout', 'bull_bb_std_mult': 0.8130535559771516, 'bull_rsi_os': 36, 'bull_rsi_ob': 95, 'bull_adx_thresh': 21.16658380230194, 'bull_atr_min_pct': 0.01996306360187259, 'bull_atr_max_pct': 0.05357975000293276, 'bull_tp_mult': 2.009656853619743, 'bull_tsl_mult': 0.06843877020023334, 'bull_time_stop': 37, 'bull_use_sma': False, 'bull_use_ema': True, 'bull_use_atr': False, 'bull_use_adx': False, 'bull_use_spike': False, 'bull_rsi_required': True, 'bear_strategy': 'breakout', 'bear_bb_std_mult': 1.7571115031284694, 'bear_rsi_os': 30, 'bear_rsi_ob': 62, 'bear_adx_thresh': 25.243280552238357, 'bear_atr_min_pct': 0.00833470293570055, 'bear_atr_max_pct': 0.030266446426940895, 'bear_tp_mult': 1.720589169467237, 'bear_tsl_mult': 0.6673480035976987, 'bear_time_stop': 11, 'bear_use_sma': False, 'bear_use_ema': False, 'bear_use_atr': True, 'bear_use_adx': False, 'bear_use_spike': True, 'bear_rsi_required': True, 'sideways_strategy': 'mean_reversion', 'sideways_bb_std_mult': 1.9998205357595653, 'sideways_rsi_os': 34, 'sideways_rsi_ob': 83, 'sideways_adx_thresh': 6.749305327217938, 'sideways_atr_min_pct': 0.016705092979342112, 'sideways_atr_max_pct': 0.096227593592103, 'sideways_tp_mult': 2.1329921400440637, 'sideways_tsl_mult': 0.08631007040296576, 'sideways_time_stop': 153, 'sideways_use_sma': False, 'sideways_use_ema': False, 'sideways_use_atr': False, 'sideways_use_adx': True, 'sideways_use_spike': False, 'sideways_rsi_required': True}.
[I 2025-08-29 19:53:02,502] Trial 140 finished with values: [-1000000000.0, 1000000000.0] and parameters: {'p_sma': 5, 'p_std': 52, 'p_atr': 24, 'p_adx': 14, 'rsi_period': 52, 'ema1': 28, 'ema2': 21, 'slip_atr_k': 0.18364740130918947, 'slip_spread_k': 0.12521020556966755, 'spread_hl_frac': 0.010733149508691697, 'bb_std_mult': 1.1638248098713635, 'rsi_os': 20, 'rsi_ob': 77, 'vol_spike': 0.1977611760698663, 'adx_thresh': 21.722267679626988, 'atr_min_pct': 0.015348604555619877, 'atr_max_pct': 0.11483078115538975, 'tp_mult': 1.3940448438952808, 'tsl_mult': 0.6134677698783082, 'strategy': 'mean_reversion', 'time_stop': 88, 'use_sma': False, 'use_atr': True, 'use_adx': False, 'use_ema': False, 'use_spike': False, 'rsi_required': True, 'edge_k': 1.3488422531235764, 'edge_cap': 0.05956252982477772, 'bull_strategy': 'breakout', 'bull_bb_std_mult': 0.8827073230744038, 'bull_rsi_os': 39, 'bull_rsi_ob': 61, 'bull_adx_thresh': 5.70593786549699, 'bull_atr_min_pct': 0.020247628535821967, 'bull_atr_max_pct': 0.06763981373076902, 'bull_tp_mult': 1.2390928819214637, 'bull_tsl_mult': 0.0701695643778338, 'bull_time_stop': 44, 'bull_use_sma': False, 'bull_use_ema': False, 'bull_use_atr': True, 'bull_use_adx': False, 'bull_use_spike': False, 'bull_rsi_required': True, 'bear_strategy': 'breakout', 'bear_bb_std_mult': 2.449691691898228, 'bear_rsi_os': 30, 'bear_rsi_ob': 62, 'bear_adx_thresh': 24.906217381246073, 'bear_atr_min_pct': 0.008204420651412418, 'bear_atr_max_pct': 0.10090454485341799, 'bear_tp_mult': 1.7384241856032485, 'bear_tsl_mult': 0.669070137519542, 'bear_time_stop': 248, 'bear_use_sma': False, 'bear_use_ema': True, 'bear_use_atr': True, 'bear_use_adx': False, 'bear_use_spike': True, 'bear_rsi_required': True, 'sideways_strategy': 'mean_reversion', 'sideways_bb_std_mult': 2.348695364565891, 'sideways_rsi_os': 27, 'sideways_rsi_ob': 81, 'sideways_adx_thresh': 28.465344023352458, 'sideways_atr_min_pct': 0.01941088020825542, 'sideways_atr_max_pct': 0.1329768303017347, 'sideways_tp_mult': 1.2402090315610694, 'sideways_tsl_mult': 0.9483811034580285, 'sideways_time_stop': 245, 'sideways_use_sma': False, 'sideways_use_ema': False, 'sideways_use_atr': False, 'sideways_use_adx': True, 'sideways_use_spike': False, 'sideways_rsi_required': True}.
[I 2025-08-29 19:53:32,280] Trial 144 finished with values: [-1000000000.0, 1000000000.0] and parameters: {'p_sma': 39, 'p_std': 54, 'p_atr': 24, 'p_adx': 17, 'rsi_period': 82, 'ema1': 12, 'ema2': 22, 'slip_atr_k': 0.045070243408303026, 'slip_spread_k': 0.26874589791076664, 'spread_hl_frac': 0.01886315927609602, 'bb_std_mult': 3.512192421798881, 'rsi_os': 23, 'rsi_ob': 63, 'vol_spike': 0.19010307039067673, 'adx_thresh': 33.26682964610122, 'atr_min_pct': 0.010775485720715879, 'atr_max_pct': 0.09365129903877659, 'tp_mult': 2.4374484002359607, 'tsl_mult': 0.5573069947896677, 'strategy': 'mean_reversion', 'time_stop': 71, 'use_sma': False, 'use_atr': True, 'use_adx': False, 'use_ema': False, 'use_spike': False, 'rsi_required': True, 'edge_k': 1.421031115735702, 'edge_cap': 0.7770454527571393, 'bull_strategy': 'breakout', 'bull_bb_std_mult': 0.970734514674582, 'bull_rsi_os': 8, 'bull_rsi_ob': 95, 'bull_adx_thresh': 7.262255234742785, 'bull_atr_min_pct': 0.02794472553063085, 'bull_atr_max_pct': 0.0544335511751486, 'bull_tp_mult': 1.2376425732474594, 'bull_tsl_mult': 0.8603342852427536, 'bull_time_stop': 270, 'bull_use_sma': False, 'bull_use_ema': True, 'bull_use_atr': False, 'bull_use_adx': True, 'bull_use_spike': False, 'bull_rsi_required': True, 'bear_strategy': 'breakout', 'bear_bb_std_mult': 1.7061457282884216, 'bear_rsi_os': 30, 'bear_rsi_ob': 70, 'bear_adx_thresh': 24.92518965649159, 'bear_atr_min_pct': 0.008231215534228373, 'bear_atr_max_pct': 0.031551419887094596, 'bear_tp_mult': 1.8680754142307272, 'bear_tsl_mult': 0.6176750420270581, 'bear_time_stop': 9, 'bear_use_sma': False, 'bear_use_ema': False, 'bear_use_atr': True, 'bear_use_adx': False, 'bear_use_spike': True, 'bear_rsi_required': False, 'sideways_strategy': 'mean_reversion', 'sideways_bb_std_mult': 1.9595350503302638, 'sideways_rsi_os': 45, 'sideways_rsi_ob': 81, 'sideways_adx_thresh': 30.667546623744354, 'sideways_atr_min_pct': 0.019614416791595223, 'sideways_atr_max_pct': 0.09828101550372292, 'sideways_tp_mult': 2.0649291874467144, 'sideways_tsl_mult': 0.0682604528467502, 'sideways_time_stop': 217, 'sideways_use_sma': False, 'sideways_use_ema': True, 'sideways_use_atr': True, 'sideways_use_adx': True, 'sideways_use_spike': False, 'sideways_rsi_required': True}.
