[I 2025-08-29 20:37:46,367] Trial 523 finished with values: [-1000000000.0, 1000000000.0] and parameters: {'p_sma': 23, 'p_std': 55, 'p_atr': 10, 'p_adx': 9, 'rsi_period': 72, 'ema1': 27, 'ema2': 55, 'slip_atr_k': 0.09086847610080906, 'slip_spread_k': 0.17937087633687437, 'spread_hl_frac': 0.048827964060872614, 'bb_std_mult': 1.6574574751468396, 'rsi_os': 40, 'rsi_ob': 87, 'vol_spike': 0.11530642663916287, 'adx_thresh': 12.180038030124193, 'atr_min_pct': 0.02054149079656093, 'atr_max_pct': 0.025519731143100653, 'tp_mult': 1.4283041281704034, 'tsl_mult': 0.048326642095039285, 'strategy': 'mean_reversion', 'time_stop': 153, 'use_sma': False, 'use_atr': False, 'use_adx': False, 'use_ema': False, 'use_spike': False, 'rsi_required': True, 'edge_k': 0.027417507692941934, 'edge_cap': 0.9191137875799444, 'bull_strategy': 'mean_reversion', 'bull_bb_std_mult': 1.3049823718853775, 'bull_rsi_os': 16, 'bull_rsi_ob': 69, 'bull_adx_thresh': 14.326494022666681, 'bull_atr_min_pct': 0.015417620273589425, 'bull_atr_max_pct': 0.09950194772616194, 'bull_tp_mult': 1.8476289553771612, 'bull_tsl_mult': 0.860553795724017, 'bull_time_stop': 89, 'bull_use_sma': False, 'bull_use_ema': False, 'bull_use_atr': True, 'bull_use_adx': False, 'bull_use_spike': True, 'bull_rsi_required': True, 'bear_strategy': 'breakout', 'bear_bb_std_mult': 1.3735811270308855, 'bear_rsi_os': 29, 'bear_rsi_ob': 63, 'bear_adx_thresh': 23.651425785202584, 'bear_atr_min_pct': 0.005370564063598226, 'bear_atr_max_pct': 0.04577498884672373, 'bear_tp_mult': 2.6234287121881845, 'bear_tsl_mult': 0.8985748861697316, 'bear_time_stop': 59, 'bear_use_sma': False, 'bear_use_ema': True, 'bear_use_atr': False, 'bear_use_adx': False, 'bear_use_spike': False, 'bear_rsi_required': False, 'sideways_strategy': 'breakout', 'sideways_bb_std_mult': 1.1863981439951279, 'sideways_rsi_os': 46, 'sideways_rsi_ob': 75, 'sideways_adx_thresh': 22.532393616688175, 'sideways_atr_min_pct': 0.026387540938755057, 'sideways_atr_max_pct': 0.025192799808570778, 'sideways_tp_mult': 1.1178329714016995, 'sideways_tsl_mult': 0.37602362187982075, 'sideways_time_stop': 179, 'sideways_use_sma': False, 'sideways_use_ema': False, 'sideways_use_atr': True, 'sideways_use_adx': False, 'sideways_use_spike': True, 'sideways_rsi_required': False}.
[I 2025-08-29 20:37:46,549] Trial 522 finished with values: [-0.025021486142543625, 0.02499301893485667] and parameters: {'p_sma': 22, 'p_std': 28, 'p_atr': 24, 'p_adx': 13, 'rsi_period': 30, 'ema1': 26, 'ema2': 49, 'slip_atr_k': 0.005864796527607746, 'slip_spread_k': 0.43818775626955686, 'spread_hl_frac': 0.04840791837780053, 'bb_std_mult': 1.6423509536430523, 'rsi_os': 9, 'rsi_ob': 87, 'vol_spike': 0.18242600370788734, 'adx_thresh': 11.795720704219107, 'atr_min_pct': 0.020441481688003763, 'atr_max_pct': 0.10109609142095893, 'tp_mult': 2.054463307909998, 'tsl_mult': 0.828618660242378, 'strategy': 'mean_reversion', 'time_stop': 13, 'use_sma': True, 'use_atr': False, 'use_adx': False, 'use_ema': False, 'use_spike': False, 'rsi_required': False, 'edge_k': 1.1276413882506455, 'edge_cap': 0.8464110549336186, 'bull_strategy': 'mean_reversion', 'bull_bb_std_mult': 1.7810078016685877, 'bull_rsi_os': 16, 'bull_rsi_ob': 56, 'bull_adx_thresh': 14.3538829800769, 'bull_atr_min_pct': 0.018493842101210238, 'bull_atr_max_pct': 0.09458190420912622, 'bull_tp_mult': 2.8207049000323625, 'bull_tsl_mult': 0.053952091514058886, 'bull_time_stop': 86, 'bull_use_sma': True, 'bull_use_ema': False, 'bull_use_atr': True, 'bull_use_adx': False, 'bull_use_spike': True, 'bull_rsi_required': True, 'bear_strategy': 'breakout', 'bear_bb_std_mult': 2.6376860582449853, 'bear_rsi_os': 10, 'bear_rsi_ob': 53, 'bear_adx_thresh': 33.98559996875137, 'bear_atr_min_pct': 0.013095789750117534, 'bear_atr_max_pct': 0.14935065167209455, 'bear_tp_mult': 2.6257493749150336, 'bear_tsl_mult': 0.9388745932739004, 'bear_time_stop': 56, 'bear_use_sma': False, 'bear_use_ema': True, 'bear_use_atr': False, 'bear_use_adx': False, 'bear_use_spike': True, 'bear_rsi_required': False, 'sideways_strategy': 'breakout', 'sideways_bb_std_mult': 2.1837140765948653, 'sideways_rsi_os': 54, 'sideways_rsi_ob': 75, 'sideways_adx_thresh': 30.568259175233408, 'sideways_atr_min_pct': 0.002151950023933133, 'sideways_atr_max_pct': 0.043231982385264184, 'sideways_tp_mult': 1.1168516095345795, 'sideways_tsl_mult': 0.6957652341194618, 'sideways_time_stop': 225, 'sideways_use_sma': False, 'sideways_use_ema': False, 'sideways_use_atr': True, 'sideways_use_adx': False, 'sideways_use_spike': True, 'sideways_rsi_required': False}.
[I 2025-08-29 20:37:47,363] Trial 526 finished with values: [-1000000000.0, 1000000000.0] and parameters: {'p_sma': 10, 'p_std': 57, 'p_atr': 25, 'p_adx': 14, 'rsi_period': 46, 'ema1': 15, 'ema2': 46, 'slip_atr_k': 0.06637838488615332, 'slip_spread_k': 0.332420096521806, 'spread_hl_frac': 0.022265563411198452, 'bb_std_mult': 1.7010484322603827, 'rsi_os': 8, 'rsi_ob': 85, 'vol_spike': 0.19335573569463657, 'adx_thresh': 6.386662004466235, 'atr_min_pct': 0.020360439545752097, 'atr_max_pct': 0.01995911017171502, 'tp_mult': 1.0964704378935723, 'tsl_mult': 0.841305216072536, 'strategy': 'mean_reversion', 'time_stop': 185, 'use_sma': False, 'use_atr': False, 'use_adx': False, 'use_ema': True, 'use_spike': True, 'rsi_required': False, 'edge_k': 1.5808760508440034, 'edge_cap': 0.6492726679774132, 'bull_strategy': 'mean_reversion', 'bull_bb_std_mult': 2.9443321448035498, 'bull_rsi_os': 18, 'bull_rsi_ob': 72, 'bull_adx_thresh': 28.84592937149951, 'bull_atr_min_pct': 0.015385368959259748, 'bull_atr_max_pct': 0.09545818708541501, 'bull_tp_mult': 2.6096151365028963, 'bull_tsl_mult': 0.759356682053419, 'bull_time_stop': 42, 'bull_use_sma': True, 'bull_use_ema': True, 'bull_use_atr': False, 'bull_use_adx': False, 'bull_use_spike': True, 'bull_rsi_required': False, 'bear_strategy': 'mean_reversion', 'bear_bb_std_mult': 0.8505062810739175, 'bear_rsi_os': 8, 'bear_rsi_ob': 67, 'bear_adx_thresh': 20.523140460866603, 'bear_atr_min_pct': 0.019115099933187902, 'bear_atr_max_pct': 0.05085864910630046, 'bear_tp_mult': 1.4396198556950068, 'bear_tsl_mult': 0.9405458687614059, 'bear_time_stop': 44, 'bear_use_sma': True, 'bear_use_ema': True, 'bear_use_atr': False, 'bear_use_adx': True, 'bear_use_spike': True, 'bear_rsi_required': False, 'sideways_strategy': 'mean_reversion', 'sideways_bb_std_mult': 2.1904531349442355, 'sideways_rsi_os': 53, 'sideways_rsi_ob': 80, 'sideways_adx_thresh': 30.49745920108897, 'sideways_atr_min_pct': 0.005465563840963213, 'sideways_atr_max_pct': 0.04292617238789488, 'sideways_tp_mult': 1.0908174126379249, 'sideways_tsl_mult': 0.6965889655817447, 'sideways_time_stop': 205, 'sideways_use_sma': True, 'sideways_use_ema': False, 'sideways_use_atr': True, 'sideways_use_adx': False, 'sideways_use_spike': False, 'sideways_rsi_required': False}.
[I 2025-08-29 20:38:15,577] Trial 524 finished with values: [-1000000000.0, 1000000000.0] and parameters: {'p_sma': 60, 'p_std': 5, 'p_atr': 10, 'p_adx': 14, 'rsi_period': 46, 'ema1': 27, 'ema2': 46, 'slip_atr_k': 0.005691077199182599, 'slip_spread_k': 0.18151001442268405, 'spread_hl_frac': 0.038292790467703806, 'bb_std_mult': 1.639523524966593, 'rsi_os': 9, 'rsi_ob': 70, 'vol_spike': 0.19222597272319009, 'adx_thresh': 12.849859437135487, 'atr_min_pct': 0.02062500478106847, 'atr_max_pct': 0.10059115782916293, 'tp_mult': 1.445662164347778, 'tsl_mult': 0.8354758367668297, 'strategy': 'mean_reversion', 'time_stop': 184, 'use_sma': False, 'use_atr': False, 'use_adx': False, 'use_ema': False, 'use_spike': False, 'rsi_required': True, 'edge_k': 0.2572362666445387, 'edge_cap': 0.7267750437642563, 'bull_strategy': 'mean_reversion', 'bull_bb_std_mult': 2.0368206666811024, 'bull_rsi_os': 19, 'bull_rsi_ob': 85, 'bull_adx_thresh': 14.087102412477424, 'bull_atr_min_pct': 0.015261239751078556, 'bull_atr_max_pct': 0.10044078332935709, 'bull_tp_mult': 2.623685625208544, 'bull_tsl_mult': 0.27389032358904547, 'bull_time_stop': 123, 'bull_use_sma': False, 'bull_use_ema': False, 'bull_use_atr': True, 'bull_use_adx': False, 'bull_use_spike': True, 'bull_rsi_required': True, 'bear_strategy': 'mean_reversion', 'bear_bb_std_mult': 2.488564187615684, 'bear_rsi_os': 9, 'bear_rsi_ob': 67, 'bear_adx_thresh': 23.780552129382915, 'bear_atr_min_pct': 0.025298690053438173, 'bear_atr_max_pct': 0.045422457864116486, 'bear_tp_mult': 2.6395957946984847, 'bear_tsl_mult': 0.15719495341570844, 'bear_time_stop': 225, 'bear_use_sma': True, 'bear_use_ema': True, 'bear_use_atr': False, 'bear_use_adx': False, 'bear_use_spike': False, 'bear_rsi_required': False, 'sideways_strategy': 'breakout', 'sideways_bb_std_mult': 1.1628470374853759, 'sideways_rsi_os': 54, 'sideways_rsi_ob': 68, 'sideways_adx_thresh': 21.785031444163128, 'sideways_atr_min_pct': 0.017784406535821286, 'sideways_atr_max_pct': 0.04294505935131551, 'sideways_tp_mult': 1.4979516665018378, 'sideways_tsl_mult': 0.6968173336107907, 'sideways_time_stop': 177, 'sideways_use_sma': True, 'sideways_use_ema': False, 'sideways_use_atr': True, 'sideways_use_adx': False, 'sideways_use_spike': False, 'sideways_rsi_required': False}.
[I 2025-08-29 20:38:15,577] Trial 525 finished with values: [-1000000000.0, 1000000000.0] and parameters: {'p_sma': 15, 'p_std': 55, 'p_atr': 16, 'p_adx': 14, 'rsi_period': 72, 'ema1': 27, 'ema2': 26, 'slip_atr_k': 0.004531595250596302, 'slip_spread_k': 0.18653698196682267, 'spread_hl_frac': 0.048200102192037145, 'bb_std_mult': 1.674789699923795, 'rsi_os': 38, 'rsi_ob': 87, 'vol_spike': 0.19197087779614705, 'adx_thresh': 5.992303178229143, 'atr_min_pct': 0.020405980317316313, 'atr_max_pct': 0.02672394667239991, 'tp_mult': 1.4628157031012181, 'tsl_mult': 0.8317322403263483, 'strategy': 'mean_reversion', 'time_stop': 249, 'use_sma': False, 'use_atr': False, 'use_adx': False, 'use_ema': False, 'use_spike': True, 'rsi_required': True, 'edge_k': 1.941111620789084, 'edge_cap': 0.3155768542685592, 'bull_strategy': 'mean_reversion', 'bull_bb_std_mult': 1.323585665006273, 'bull_rsi_os': 19, 'bull_rsi_ob': 56, 'bull_adx_thresh': 24.434367440361918, 'bull_atr_min_pct': 0.018746759582675576, 'bull_atr_max_pct': 0.09964741068157051, 'bull_tp_mult': 2.628345477174718, 'bull_tsl_mult': 0.452165974266609, 'bull_time_stop': 88, 'bull_use_sma': False, 'bull_use_ema': True, 'bull_use_atr': True, 'bull_use_adx': False, 'bull_use_spike': True, 'bull_rsi_required': True, 'bear_strategy': 'mean_reversion', 'bear_bb_std_mult': 2.4557881710914407, 'bear_rsi_os': 29, 'bear_rsi_ob': 64, 'bear_adx_thresh': 20.64790690886457, 'bear_atr_min_pct': 0.0129815072177949, 'bear_atr_max_pct': 0.14934042038786666, 'bear_tp_mult': 1.4540336091003088, 'bear_tsl_mult': 0.940738101488623, 'bear_time_stop': 62, 'bear_use_sma': True, 'bear_use_ema': True, 'bear_use_atr': False, 'bear_use_adx': False, 'bear_use_spike': False, 'bear_rsi_required': False, 'sideways_strategy': 'mean_reversion', 'sideways_bb_std_mult': 2.178963075301544, 'sideways_rsi_os': 34, 'sideways_rsi_ob': 76, 'sideways_adx_thresh': 22.392248866229522, 'sideways_atr_min_pct': 0.02757939227795363, 'sideways_atr_max_pct': 0.08237966241545575, 'sideways_tp_mult': 1.1229868483442065, 'sideways_tsl_mult': 0.08429283778995483, 'sideways_time_stop': 291, 'sideways_use_sma': True, 'sideways_use_ema': False, 'sideways_use_atr': True, 'sideways_use_adx': False, 'sideways_use_spike': False, 'sideways_rsi_required': False}.
[I 2025-08-29 20:38:16,066] Trial 527 finished with values: [-1000000000.0, 1000000000.0] and parameters: {'p_sma': 21, 'p_std': 13, 'p_atr': 25, 'p_adx': 28, 'rsi_period': 37, 'ema1': 15, 'ema2': 46, 'slip_atr_k': 0.18755146777030346, 'slip_spread_k': 0.2405882305916362, 'spread_hl_frac': 0.03815470709091665, 'bb_std_mult': 1.4964329122615445, 'rsi_os': 8, 'rsi_ob': 70, 'vol_spike': 0.19592045902640712, 'adx_thresh': 12.75687988905281, 'atr_min_pct': 0.016409983137793634, 'atr_max_pct': 0.019454001013871347, 'tp_mult': 1.1082539898023582, 'tsl_mult': 0.8369875493851552, 'strategy': 'breakout', 'time_stop': 183, 'use_sma': False, 'use_atr': False, 'use_adx': False, 'use_ema': True, 'use_spike': True, 'rsi_required': True, 'edge_k': 0.24492043982576361, 'edge_cap': 0.40328963222728115, 'bull_strategy': 'mean_reversion', 'bull_bb_std_mult': 2.9395463059960147, 'bull_rsi_os': 12, 'bull_rsi_ob': 82, 'bull_adx_thresh': 11.546311778252276, 'bull_atr_min_pct': 0.014391481450993459, 'bull_atr_max_pct': 0.12901639516597488, 'bull_tp_mult': 2.5940261031843517, 'bull_tsl_mult': 0.7625781878387283, 'bull_time_stop': 44, 'bull_use_sma': False, 'bull_use_ema': True, 'bull_use_atr': False, 'bull_use_adx': False, 'bull_use_spike': True, 'bull_rsi_required': False, 'bear_strategy': 'mean_reversion', 'bear_bb_std_mult': 0.5094016992651851, 'bear_rsi_os': 36, 'bear_rsi_ob': 64, 'bear_adx_thresh': 20.664306009087465, 'bear_atr_min_pct': 0.007454946020411033, 'bear_atr_max_pct': 0.04509986856292245, 'bear_tp_mult': 2.584956911294936, 'bear_tsl_mult': 0.9743904850802976, 'bear_time_stop': 42, 'bear_use_sma': True, 'bear_use_ema': False, 'bear_use_atr': False, 'bear_use_adx': True, 'bear_use_spike': False, 'bear_rsi_required': False, 'sideways_strategy': 'mean_reversion', 'sideways_bb_std_mult': 2.508396851275302, 'sideways_rsi_os': 47, 'sideways_rsi_ob': 77, 'sideways_adx_thresh': 33.3829423736425, 'sideways_atr_min_pct': 0.017663272355616984, 'sideways_atr_max_pct': 0.09723920339639427, 'sideways_tp_mult': 1.0919828221746861, 'sideways_tsl_mult': 0.6551098243941708, 'sideways_time_stop': 291, 'sideways_use_sma': True, 'sideways_use_ema': False, 'sideways_use_atr': False, 'sideways_use_adx': True, 'sideways_use_spike': False, 'sideways_rsi_required': False}.
[I 2025-08-29 20:38:17,416] Trial 528 finished with values: [-0.009125103392950584, 0.009081715919728065] and parameters: {'p_sma': 15, 'p_std': 55, 'p_atr': 17, 'p_adx': 19, 'rsi_period': 37, 'ema1': 27, 'ema2': 47, 'slip_atr_k': 0.15756536129978077, 'slip_spread_k': 0.18170749831813582, 'spread_hl_frac': 0.047631165437318684, 'bb_std_mult': 2.55254588472579, 'rsi_os': 11, 'rsi_ob': 72, 'vol_spike': 0.16080200410894147, 'adx_thresh': 10.573776892303801, 'atr_min_pct': 0.018200023972102648, 'atr_max_pct': 0.029724479602730277, 'tp_mult': 1.5030852137539692, 'tsl_mult': 0.9348640294457036, 'strategy': 'breakout', 'time_stop': 250, 'use_sma': True, 'use_atr': False, 'use_adx': False, 'use_ema': True, 'use_spike': True, 'rsi_required': True, 'edge_k': 1.6741946771655196, 'edge_cap': 0.6699067811857223, 'bull_strategy': 'mean_reversion', 'bull_bb_std_mult': 3.1139943438094475, 'bull_rsi_os': 20, 'bull_rsi_ob': 84, 'bull_adx_thresh': 11.198643027915915, 'bull_atr_min_pct': 0.01456644802565749, 'bull_atr_max_pct': 0.13053723069752535, 'bull_tp_mult': 2.7412035443352414, 'bull_tsl_mult': 0.45743708782485454, 'bull_time_stop': 117, 'bull_use_sma': False, 'bull_use_ema': False, 'bull_use_atr': True, 'bull_use_adx': False, 'bull_use_spike': True, 'bull_rsi_required': False, 'bear_strategy': 'mean_reversion', 'bear_bb_std_mult': 0.646198214801351, 'bear_rsi_os': 18, 'bear_rsi_ob': 64, 'bear_adx_thresh': 20.974296453792, 'bear_atr_min_pct': 0.0015166509824011826, 'bear_atr_max_pct': 0.04492381145342736, 'bear_tp_mult': 2.588031911830527, 'bear_tsl_mult': 0.9679986060577733, 'bear_time_stop': 41, 'bear_use_sma': True, 'bear_use_ema': False, 'bear_use_atr': False, 'bear_use_adx': True, 'bear_use_spike': False, 'bear_rsi_required': False, 'sideways_strategy': 'breakout', 'sideways_bb_std_mult': 2.512434278047927, 'sideways_rsi_os': 47, 'sideways_rsi_ob': 68, 'sideways_adx_thresh': 21.5384162750838, 'sideways_atr_min_pct': 0.0045393220470414134, 'sideways_atr_max_pct': 0.04877310864023934, 'sideways_tp_mult': 2.4779130928222193, 'sideways_tsl_mult': 0.656570327169501, 'sideways_time_stop': 188, 'sideways_use_sma': True, 'sideways_use_ema': False, 'sideways_use_atr': False, 'sideways_use_adx': True, 'sideways_use_spike': False, 'sideways_rsi_required': False}.
[I 2025-08-29 20:38:47,246] Trial 529 finished with values: [-0.01314694135621397, 0.013074266550357943] and parameters: {'p_sma': 21, 'p_std': 13, 'p_atr': 26, 'p_adx': 12, 'rsi_period': 37, 'ema1': 25, 'ema2': 45, 'slip_atr_k': 0.1754484394941396, 'slip_spread_k': 0.5276345429386632, 'spread_hl_frac': 0.049918510567386366, 'bb_std_mult': 2.265001899607608, 'rsi_os': 7, 'rsi_ob': 72, 'vol_spike': 0.15868528745495838, 'adx_thresh': 29.210526680394388, 'atr_min_pct': 0.01582175898366005, 'atr_max_pct': 0.030085497416366482, 'tp_mult': 1.5158885522523207, 'tsl_mult': 0.9372516529824872, 'strategy': 'breakout', 'time_stop': 178, 'use_sma': True, 'use_atr': False, 'use_adx': False, 'use_ema': True, 'use_spike': False, 'rsi_required': False, 'edge_k': 1.0847536105291344, 'edge_cap': 0.9751270392710331, 'bull_strategy': 'mean_reversion', 'bull_bb_std_mult': 3.121182828198754, 'bull_rsi_os': 12, 'bull_rsi_ob': 88, 'bull_adx_thresh': 13.311801713289192, 'bull_atr_min_pct': 0.007616824530350065, 'bull_atr_max_pct': 0.09682798051886103, 'bull_tp_mult': 2.7449816873339223, 'bull_tsl_mult': 0.8244373352167288, 'bull_time_stop': 129, 'bull_use_sma': True, 'bull_use_ema': False, 'bull_use_atr': False, 'bull_use_adx': False, 'bull_use_spike': False, 'bull_rsi_required': False, 'bear_strategy': 'breakout', 'bear_bb_std_mult': 0.6487570271084293, 'bear_rsi_os': 26, 'bear_rsi_ob': 65, 'bear_adx_thresh': 19.918604196182816, 'bear_atr_min_pct': 0.0013285977400681829, 'bear_atr_max_pct': 0.041602685758196666, 'bear_tp_mult': 2.580613227590073, 'bear_tsl_mult': 0.973950586548387, 'bear_time_stop': 83, 'bear_use_sma': False, 'bear_use_ema': False, 'bear_use_atr': False, 'bear_use_adx': True, 'bear_use_spike': True, 'bear_rsi_required': True, 'sideways_strategy': 'breakout', 'sideways_bb_std_mult': 2.5116370526483234, 'sideways_rsi_os': 21, 'sideways_rsi_ob': 78, 'sideways_adx_thresh': 12.362780124096224, 'sideways_atr_min_pct': 0.009558726336440546, 'sideways_atr_max_pct': 0.02288771054609991, 'sideways_tp_mult': 1.013003882182519, 'sideways_tsl_mult': 0.26526486442218244, 'sideways_time_stop': 62, 'sideways_use_sma': False, 'sideways_use_ema': False, 'sideways_use_atr': False, 'sideways_use_adx': True, 'sideways_use_spike': False, 'sideways_rsi_required': False}.
[I 2025-08-29 20:38:47,703] Trial 530 finished with values: [-0.005511275526203785, 0.005563809033942528] and parameters: {'p_sma': 21, 'p_std': 13, 'p_atr': 17, 'p_adx': 19, 'rsi_period': 36, 'ema1': 25, 'ema2': 45, 'slip_atr_k': 0.15741689526863328, 'slip_spread_k': 0.15330021933093024, 'spread_hl_frac': 0.04737030543978427, 'bb_std_mult': 3.0643712034256, 'rsi_os': 11, 'rsi_ob': 72, 'vol_spike': 0.03471956744239327, 'adx_thresh': 12.724789383944008, 'atr_min_pct': 0.015803360345924364, 'atr_max_pct': 0.03015635111545759, 'tp_mult': 1.506950145802218, 'tsl_mult': 0.13998701974228017, 'strategy': 'breakout', 'time_stop': 225, 'use_sma': True, 'use_atr': False, 'use_adx': False, 'use_ema': True, 'use_spike': False, 'rsi_required': False, 'edge_k': 1.656217333417405, 'edge_cap': 0.7097309442791502, 'bull_strategy': 'mean_reversion', 'bull_bb_std_mult': 3.134227078176929, 'bull_rsi_os': 12, 'bull_rsi_ob': 52, 'bull_adx_thresh': 13.43615047343791, 'bull_atr_min_pct': 0.0066921542734644495, 'bull_atr_max_pct': 0.09709090874578281, 'bull_tp_mult': 1.1308822600614596, 'bull_tsl_mult': 0.8215671255191299, 'bull_time_stop': 119, 'bull_use_sma': True, 'bull_use_ema': False, 'bull_use_atr': False, 'bull_use_adx': False, 'bull_use_spike': False, 'bull_rsi_required': False, 'bear_strategy': 'breakout', 'bear_bb_std_mult': 2.7120284141313786, 'bear_rsi_os': 26, 'bear_rsi_ob': 65, 'bear_adx_thresh': 19.67124849596657, 'bear_atr_min_pct': 0.004379781499648849, 'bear_atr_max_pct': 0.09225380607294778, 'bear_tp_mult': 2.3640378000588593, 'bear_tsl_mult': 0.9744881073661229, 'bear_time_stop': 267, 'bear_use_sma': False, 'bear_use_ema': False, 'bear_use_atr': False, 'bear_use_adx': True, 'bear_use_spike': True, 'bear_rsi_required': True, 'sideways_strategy': 'breakout', 'sideways_bb_std_mult': 2.4427188773572177, 'sideways_rsi_os': 22, 'sideways_rsi_ob': 77, 'sideways_adx_thresh': 25.03201578325494, 'sideways_atr_min_pct': 0.004627183175401309, 'sideways_atr_max_pct': 0.02288917534580002, 'sideways_tp_mult': 1.4291584835196574, 'sideways_tsl_mult': 0.6626528019808581, 'sideways_time_stop': 57, 'sideways_use_sma': False, 'sideways_use_ema': False, 'sideways_use_atr': False, 'sideways_use_adx': True, 'sideways_use_spike': False, 'sideways_rsi_required': False}.
