[I 2025-08-29 20:53:42,669] Trial 668 finished with values: [-1000000000.0, 1000000000.0] and parameters: {'p_sma': 17, 'p_std': 56, 'p_atr': 24, 'p_adx': 14, 'rsi_period': 64, 'ema1': 24, 'ema2': 47, 'slip_atr_k': 0.18858005711847659, 'slip_spread_k': 0.5642375575951388, 'spread_hl_frac': 0.049166005039965065, 'bb_std_mult': 1.5811289891418083, 'rsi_os': 50, 'rsi_ob': 86, 'vol_spike': 0.17472490071733243, 'adx_thresh': 13.351876133018735, 'atr_min_pct': 0.018531374705864467, 'atr_max_pct': 0.07456471788450994, 'tp_mult': 2.5088473311666664, 'tsl_mult': 0.8476336075620979, 'strategy': 'mean_reversion', 'time_stop': 173, 'use_sma': True, 'use_atr': False, 'use_adx': True, 'use_ema': True, 'use_spike': False, 'rsi_required': False, 'edge_k': 0.4405309158651779, 'edge_cap': 0.5381275077742919, 'bull_strategy': 'mean_reversion', 'bull_bb_std_mult': 1.737872311801679, 'bull_rsi_os': 45, 'bull_rsi_ob': 70, 'bull_adx_thresh': 14.122402136153507, 'bull_atr_min_pct': 0.004270974247130261, 'bull_atr_max_pct': 0.09645224197857133, 'bull_tp_mult': 2.6035545348962654, 'bull_tsl_mult': 0.34398750429610436, 'bull_time_stop': 203, 'bull_use_sma': True, 'bull_use_ema': False, 'bull_use_atr': True, 'bull_use_adx': False, 'bull_use_spike': True, 'bull_rsi_required': False, 'bear_strategy': 'breakout', 'bear_bb_std_mult': 0.6796729227858918, 'bear_rsi_os': 48, 'bear_rsi_ob': 67, 'bear_adx_thresh': 28.516723046335926, 'bear_atr_min_pct': 0.008441700988514517, 'bear_atr_max_pct': 0.03945505702960221, 'bear_tp_mult': 2.4865710612036716, 'bear_tsl_mult': 0.9743413859121264, 'bear_time_stop': 212, 'bear_use_sma': False, 'bear_use_ema': True, 'bear_use_atr': False, 'bear_use_adx': True, 'bear_use_spike': True, 'bear_rsi_required': False, 'sideways_strategy': 'mean_reversion', 'sideways_bb_std_mult': 2.044147451015371, 'sideways_rsi_os': 47, 'sideways_rsi_ob': 49, 'sideways_adx_thresh': 22.68735172941351, 'sideways_atr_min_pct': 0.005518516453950019, 'sideways_atr_max_pct': 0.08863909676553179, 'sideways_tp_mult': 1.3003626668000505, 'sideways_tsl_mult': 0.2747350198683338, 'sideways_time_stop': 180, 'sideways_use_sma': False, 'sideways_use_ema': False, 'sideways_use_atr': False, 'sideways_use_adx': False, 'sideways_use_spike': False, 'sideways_rsi_required': False}.
[I 2025-08-29 20:54:10,106] Trial 667 finished with values: [-1000000000.0, 1000000000.0] and parameters: {'p_sma': 32, 'p_std': 57, 'p_atr': 24, 'p_adx': 14, 'rsi_period': 64, 'ema1': 25, 'ema2': 47, 'slip_atr_k': 0.014042198088084126, 'slip_spread_k': 0.469057738696624, 'spread_hl_frac': 0.04922807816011583, 'bb_std_mult': 1.821950672323047, 'rsi_os': 49, 'rsi_ob': 86, 'vol_spike': 0.18691112412352096, 'adx_thresh': 12.583425750394316, 'atr_min_pct': 0.008645849226284615, 'atr_max_pct': 0.11056819505817769, 'tp_mult': 2.5036794109684823, 'tsl_mult': 0.4478062288592116, 'strategy': 'mean_reversion', 'time_stop': 49, 'use_sma': True, 'use_atr': False, 'use_adx': True, 'use_ema': True, 'use_spike': False, 'rsi_required': False, 'edge_k': 0.4270133223063167, 'edge_cap': 0.5760820622818577, 'bull_strategy': 'mean_reversion', 'bull_bb_std_mult': 3.2187430363755944, 'bull_rsi_os': 13, 'bull_rsi_ob': 49, 'bull_adx_thresh': 14.23685268395038, 'bull_atr_min_pct': 0.01765275261846803, 'bull_atr_max_pct': 0.045707771460347595, 'bull_tp_mult': 2.5808968360624767, 'bull_tsl_mult': 0.33936017829964793, 'bull_time_stop': 58, 'bull_use_sma': True, 'bull_use_ema': False, 'bull_use_atr': True, 'bull_use_adx': False, 'bull_use_spike': True, 'bull_rsi_required': False, 'bear_strategy': 'breakout', 'bear_bb_std_mult': 2.8149753070948833, 'bear_rsi_os': 48, 'bear_rsi_ob': 67, 'bear_adx_thresh': 20.792058561647007, 'bear_atr_min_pct': 0.008314250318105232, 'bear_atr_max_pct': 0.039797551040786285, 'bear_tp_mult': 2.500271747428308, 'bear_tsl_mult': 0.8246421356498901, 'bear_time_stop': 253, 'bear_use_sma': False, 'bear_use_ema': True, 'bear_use_atr': False, 'bear_use_adx': True, 'bear_use_spike': True, 'bear_rsi_required': False, 'sideways_strategy': 'mean_reversion', 'sideways_bb_std_mult': 1.1574874077169577, 'sideways_rsi_os': 47, 'sideways_rsi_ob': 76, 'sideways_adx_thresh': 31.624088582703138, 'sideways_atr_min_pct': 0.003186580040910067, 'sideways_atr_max_pct': 0.04654802839291187, 'sideways_tp_mult': 1.1086858562511206, 'sideways_tsl_mult': 0.7603792387311927, 'sideways_time_stop': 205, 'sideways_use_sma': False, 'sideways_use_ema': False, 'sideways_use_atr': False, 'sideways_use_adx': False, 'sideways_use_spike': False, 'sideways_rsi_required': False}.
[I 2025-08-29 20:54:10,291] Trial 666 finished with values: [-0.00650741146634104, 0.00648043287964368] and parameters: {'p_sma': 32, 'p_std': 57, 'p_atr': 23, 'p_adx': 14, 'rsi_period': 28, 'ema1': 26, 'ema2': 39, 'slip_atr_k': 0.05413781605455564, 'slip_spread_k': 0.2790078288217509, 'spread_hl_frac': 0.032870076020598084, 'bb_std_mult': 2.5426000566478235, 'rsi_os': 10, 'rsi_ob': 81, 'vol_spike': 0.17478112320011127, 'adx_thresh': 20.753734121506554, 'atr_min_pct': 0.019075224829876523, 'atr_max_pct': 0.07560361953846177, 'tp_mult': 2.5402509130693747, 'tsl_mult': 0.4470086595058518, 'strategy': 'mean_reversion', 'time_stop': 49, 'use_sma': True, 'use_atr': False, 'use_adx': False, 'use_ema': True, 'use_spike': False, 'rsi_required': False, 'edge_k': 1.4618998101890628, 'edge_cap': 0.5419578880362245, 'bull_strategy': 'mean_reversion', 'bull_bb_std_mult': 1.3604311553333877, 'bull_rsi_os': 12, 'bull_rsi_ob': 49, 'bull_adx_thresh': 14.19409315138698, 'bull_atr_min_pct': 0.002516603035723628, 'bull_atr_max_pct': 0.09524709250030737, 'bull_tp_mult': 1.2577762960383638, 'bull_tsl_mult': 0.1914278009769314, 'bull_time_stop': 82, 'bull_use_sma': True, 'bull_use_ema': False, 'bull_use_atr': True, 'bull_use_adx': False, 'bull_use_spike': True, 'bull_rsi_required': False, 'bear_strategy': 'breakout', 'bear_bb_std_mult': 3.3567693475638785, 'bear_rsi_os': 8, 'bear_rsi_ob': 66, 'bear_adx_thresh': 20.756626151342218, 'bear_atr_min_pct': 0.008377872887974466, 'bear_atr_max_pct': 0.048702944628467346, 'bear_tp_mult': 2.614804129841956, 'bear_tsl_mult': 0.03458474785601667, 'bear_time_stop': 296, 'bear_use_sma': False, 'bear_use_ema': True, 'bear_use_atr': False, 'bear_use_adx': True, 'bear_use_spike': True, 'bear_rsi_required': False, 'sideways_strategy': 'breakout', 'sideways_bb_std_mult': 2.224216911837072, 'sideways_rsi_os': 39, 'sideways_rsi_ob': 81, 'sideways_adx_thresh': 31.641481990812203, 'sideways_atr_min_pct': 0.01939184909172493, 'sideways_atr_max_pct': 0.024143640960523988, 'sideways_tp_mult': 1.116743660557724, 'sideways_tsl_mult': 0.7467168836796035, 'sideways_time_stop': 191, 'sideways_use_sma': False, 'sideways_use_ema': False, 'sideways_use_atr': False, 'sideways_use_adx': False, 'sideways_use_spike': False, 'sideways_rsi_required': False}.
[I 2025-08-29 20:54:11,226] Trial 669 finished with values: [-1000000000.0, 1000000000.0] and parameters: {'p_sma': 17, 'p_std': 24, 'p_atr': 24, 'p_adx': 14, 'rsi_period': 14, 'ema1': 25, 'ema2': 14, 'slip_atr_k': 0.013990042520967643, 'slip_spread_k': 0.7142606044565769, 'spread_hl_frac': 0.0223486374257751, 'bb_std_mult': 1.5644255135934908, 'rsi_os': 43, 'rsi_ob': 71, 'vol_spike': 0.17166768466815632, 'adx_thresh': 12.763266270487023, 'atr_min_pct': 0.018196063378539958, 'atr_max_pct': 0.028502225462190264, 'tp_mult': 1.3615585151479277, 'tsl_mult': 0.9192358795305497, 'strategy': 'mean_reversion', 'time_stop': 172, 'use_sma': True, 'use_atr': False, 'use_adx': True, 'use_ema': True, 'use_spike': False, 'rsi_required': False, 'edge_k': 1.9462712340038022, 'edge_cap': 0.5339853629294451, 'bull_strategy': 'mean_reversion', 'bull_bb_std_mult': 1.7095430206907742, 'bull_rsi_os': 16, 'bull_rsi_ob': 49, 'bull_adx_thresh': 14.190318888258727, 'bull_atr_min_pct': 0.019739820700859157, 'bull_atr_max_pct': 0.09074956002739736, 'bull_tp_mult': 2.7122443532074665, 'bull_tsl_mult': 0.8300393393775907, 'bull_time_stop': 60, 'bull_use_sma': True, 'bull_use_ema': False, 'bull_use_atr': True, 'bull_use_adx': False, 'bull_use_spike': True, 'bull_rsi_required': False, 'bear_strategy': 'breakout', 'bear_bb_std_mult': 2.8225945548683136, 'bear_rsi_os': 23, 'bear_rsi_ob': 67, 'bear_adx_thresh': 20.807905550723497, 'bear_atr_min_pct': 0.00830568195933551, 'bear_atr_max_pct': 0.04930829656782007, 'bear_tp_mult': 2.6282886172011506, 'bear_tsl_mult': 0.8185308561058426, 'bear_time_stop': 224, 'bear_use_sma': False, 'bear_use_ema': True, 'bear_use_atr': False, 'bear_use_adx': True, 'bear_use_spike': True, 'bear_rsi_required': False, 'sideways_strategy': 'mean_reversion', 'sideways_bb_std_mult': 2.2232310418312635, 'sideways_rsi_os': 45, 'sideways_rsi_ob': 76, 'sideways_adx_thresh': 7.165748369568657, 'sideways_atr_min_pct': 0.004302546140057732, 'sideways_atr_max_pct': 0.031220665388314382, 'sideways_tp_mult': 1.3202391026802598, 'sideways_tsl_mult': 0.7654113737221198, 'sideways_time_stop': 19, 'sideways_use_sma': False, 'sideways_use_ema': False, 'sideways_use_atr': False, 'sideways_use_adx': False, 'sideways_use_spike': False, 'sideways_rsi_required': False}.
[I 2025-08-29 20:54:12,377] Trial 670 finished with values: [-0.004298261551617499, 0.004349704393541868] and parameters: {'p_sma': 52, 'p_std': 57, 'p_atr': 22, 'p_adx': 11, 'rsi_period': 15, 'ema1': 25, 'ema2': 58, 'slip_atr_k': 0.013357287288140349, 'slip_spread_k': 0.7108087548482678, 'spread_hl_frac': 0.04999425604424501, 'bb_std_mult': 1.7937563562988075, 'rsi_os': 40, 'rsi_ob': 79, 'vol_spike': 0.07282373954727826, 'adx_thresh': 20.56822498816175, 'atr_min_pct': 0.0015357172156449574, 'atr_max_pct': 0.02900571700896692, 'tp_mult': 1.3696381514609097, 'tsl_mult': 0.9071534981365128, 'strategy': 'mean_reversion', 'time_stop': 180, 'use_sma': True, 'use_atr': False, 'use_adx': False, 'use_ema': False, 'use_spike': False, 'rsi_required': False, 'edge_k': 1.9431827909166575, 'edge_cap': 0.2289725745981246, 'bull_strategy': 'mean_reversion', 'bull_bb_std_mult': 3.1896335674894285, 'bull_rsi_os': 16, 'bull_rsi_ob': 49, 'bull_adx_thresh': 15.273385979247733, 'bull_atr_min_pct': 0.024607981758389692, 'bull_atr_max_pct': 0.0911726991311681, 'bull_tp_mult': 2.7129837030503197, 'bull_tsl_mult': 0.8300152533220622, 'bull_time_stop': 58, 'bull_use_sma': True, 'bull_use_ema': False, 'bull_use_atr': True, 'bull_use_adx': False, 'bull_use_spike': False, 'bull_rsi_required': False, 'bear_strategy': 'breakout', 'bear_bb_std_mult': 2.2747664515947017, 'bear_rsi_os': 13, 'bear_rsi_ob': 67, 'bear_adx_thresh': 20.73775701467332, 'bear_atr_min_pct': 0.017878575839379, 'bear_atr_max_pct': 0.04852582509078284, 'bear_tp_mult': 2.6214330585771273, 'bear_tsl_mult': 0.8357878561207878, 'bear_time_stop': 194, 'bear_use_sma': False, 'bear_use_ema': True, 'bear_use_atr': False, 'bear_use_adx': False, 'bear_use_spike': True, 'bear_rsi_required': False, 'sideways_strategy': 'breakout', 'sideways_bb_std_mult': 2.2181342728611053, 'sideways_rsi_os': 45, 'sideways_rsi_ob': 76, 'sideways_adx_thresh': 33.401661876855876, 'sideways_atr_min_pct': 0.004293813475929791, 'sideways_atr_max_pct': 0.03138383654290857, 'sideways_tp_mult': 1.1097822257538512, 'sideways_tsl_mult': 0.7487979799092718, 'sideways_time_stop': 20, 'sideways_use_sma': False, 'sideways_use_ema': False, 'sideways_use_atr': False, 'sideways_use_adx': False, 'sideways_use_spike': False, 'sideways_rsi_required': False}.
[I 2025-08-29 20:54:13,057] Trial 673 finished with values: [-1000000000.0, 1000000000.0] and parameters: {'p_sma': 48, 'p_std': 40, 'p_atr': 25, 'p_adx': 11, 'rsi_period': 10, 'ema1': 27, 'ema2': 49, 'slip_atr_k': 0.12150928657740621, 'slip_spread_k': 0.8826045894771394, 'spread_hl_frac': 0.016458049652460935, 'bb_std_mult': 2.3650277685507497, 'rsi_os': 52, 'rsi_ob': 84, 'vol_spike': 0.07459066776331777, 'adx_thresh': 26.545532669880945, 'atr_min_pct': 0.015479745694513401, 'atr_max_pct': 0.031914820688576456, 'tp_mult': 1.140015672689133, 'tsl_mult': 0.8707587947158996, 'strategy': 'mean_reversion', 'time_stop': 62, 'use_sma': True, 'use_atr': False, 'use_adx': False, 'use_ema': False, 'use_spike': True, 'rsi_required': False, 'edge_k': 0.9878816616640113, 'edge_cap': 0.8676722501597958, 'bull_strategy': 'mean_reversion', 'bull_bb_std_mult': 2.3927274107822, 'bull_rsi_os': 15, 'bull_rsi_ob': 72, 'bull_adx_thresh': 13.352867804859091, 'bull_atr_min_pct': 0.02469990655511554, 'bull_atr_max_pct': 0.09210399049043697, 'bull_tp_mult': 1.1935313034812742, 'bull_tsl_mult': 0.5112411469458198, 'bull_time_stop': 35, 'bull_use_sma': True, 'bull_use_ema': True, 'bull_use_atr': True, 'bull_use_adx': False, 'bull_use_spike': False, 'bull_rsi_required': False, 'bear_strategy': 'breakout', 'bear_bb_std_mult': 2.2017618293371664, 'bear_rsi_os': 27, 'bear_rsi_ob': 69, 'bear_adx_thresh': 19.141729227629803, 'bear_atr_min_pct': 0.009821143692298162, 'bear_atr_max_pct': 0.045571020021931447, 'bear_tp_mult': 2.000074096532632, 'bear_tsl_mult': 0.9589948526978326, 'bear_time_stop': 55, 'bear_use_sma': True, 'bear_use_ema': True, 'bear_use_atr': False, 'bear_use_adx': False, 'bear_use_spike': True, 'bear_rsi_required': False, 'sideways_strategy': 'breakout', 'sideways_bb_std_mult': 2.425535891084887, 'sideways_rsi_os': 48, 'sideways_rsi_ob': 85, 'sideways_adx_thresh': 33.506711406349, 'sideways_atr_min_pct': 0.0016553333119754023, 'sideways_atr_max_pct': 0.016594314041029054, 'sideways_tp_mult': 1.97485996642943, 'sideways_tsl_mult': 0.6531972637709696, 'sideways_time_stop': 204, 'sideways_use_sma': False, 'sideways_use_ema': True, 'sideways_use_atr': False, 'sideways_use_adx': True, 'sideways_use_spike': False, 'sideways_rsi_required': True}.
[I 2025-08-29 20:54:39,598] Trial 671 finished with values: [-0.004927338960644789, 0.004973736771732755] and parameters: {'p_sma': 48, 'p_std': 57, 'p_atr': 25, 'p_adx': 13, 'rsi_period': 44, 'ema1': 27, 'ema2': 49, 'slip_atr_k': 0.1406915395281773, 'slip_spread_k': 0.8788822216886985, 'spread_hl_frac': 0.016359047874421433, 'bb_std_mult': 1.4611468071603912, 'rsi_os': 32, 'rsi_ob': 63, 'vol_spike': 0.2603926208628442, 'adx_thresh': 13.334897131194172, 'atr_min_pct': 0.015559978853944416, 'atr_max_pct': 0.02890503144576382, 'tp_mult': 1.3702521827194298, 'tsl_mult': 0.9125573887759645, 'strategy': 'mean_reversion', 'time_stop': 137, 'use_sma': True, 'use_atr': False, 'use_adx': False, 'use_ema': False, 'use_spike': True, 'rsi_required': False, 'edge_k': 1.9257358614343492, 'edge_cap': 0.5497544103695738, 'bull_strategy': 'mean_reversion', 'bull_bb_std_mult': 3.103779029159705, 'bull_rsi_os': 16, 'bull_rsi_ob': 76, 'bull_adx_thresh': 15.268341677419656, 'bull_atr_min_pct': 0.016331690618004553, 'bull_atr_max_pct': 0.13474484943213555, 'bull_tp_mult': 1.1733781301432866, 'bull_tsl_mult': 0.6476352560240941, 'bull_time_stop': 18, 'bull_use_sma': True, 'bull_use_ema': True, 'bull_use_atr': True, 'bull_use_adx': False, 'bull_use_spike': False, 'bull_rsi_required': False, 'bear_strategy': 'breakout', 'bear_bb_std_mult': 2.838405179481839, 'bear_rsi_os': 13, 'bear_rsi_ob': 69, 'bear_adx_thresh': 18.9919488781175, 'bear_atr_min_pct': 0.005332694542811607, 'bear_atr_max_pct': 0.049761716628641865, 'bear_tp_mult': 2.9321410054460966, 'bear_tsl_mult': 0.027553799825457914, 'bear_time_stop': 295, 'bear_use_sma': False, 'bear_use_ema': True, 'bear_use_atr': False, 'bear_use_adx': False, 'bear_use_spike': True, 'bear_rsi_required': False, 'sideways_strategy': 'breakout', 'sideways_bb_std_mult': 2.6791566148501635, 'sideways_rsi_os': 45, 'sideways_rsi_ob': 85, 'sideways_adx_thresh': 12.541787428288497, 'sideways_atr_min_pct': 0.004151090926272943, 'sideways_atr_max_pct': 0.032302506164569866, 'sideways_tp_mult': 1.0464487772723639, 'sideways_tsl_mult': 0.7374525769834066, 'sideways_time_stop': 219, 'sideways_use_sma': False, 'sideways_use_ema': False, 'sideways_use_atr': False, 'sideways_use_adx': False, 'sideways_use_spike': False, 'sideways_rsi_required': True}.
[I 2025-08-29 20:54:40,801] Trial 672 finished with values: [-0.0021605310611381157, 0.003956013293792918] and parameters: {'p_sma': 18, 'p_std': 39, 'p_atr': 25, 'p_adx': 13, 'rsi_period': 10, 'ema1': 27, 'ema2': 15, 'slip_atr_k': 0.00786558556323913, 'slip_spread_k': 0.1867395032980895, 'spread_hl_frac': 0.028573641639677405, 'bb_std_mult': 2.769282513539473, 'rsi_os': 9, 'rsi_ob': 63, 'vol_spike': 0.07421990282943337, 'adx_thresh': 13.165435511074543, 'atr_min_pct': 0.019919786004497054, 'atr_max_pct': 0.030631388143240745, 'tp_mult': 1.3803647764616356, 'tsl_mult': 0.908564339701645, 'strategy': 'mean_reversion', 'time_stop': 180, 'use_sma': True, 'use_atr': False, 'use_adx': False, 'use_ema': False, 'use_spike': True, 'rsi_required': False, 'edge_k': 0.09105388146607807, 'edge_cap': 0.8811612870285425, 'bull_strategy': 'mean_reversion', 'bull_bb_std_mult': 2.385987752557661, 'bull_rsi_os': 15, 'bull_rsi_ob': 76, 'bull_adx_thresh': 13.404979302589698, 'bull_atr_min_pct': 0.0276449937056105, 'bull_atr_max_pct': 0.1301107042592443, 'bull_tp_mult': 2.7177604793619268, 'bull_tsl_mult': 0.8892953901747315, 'bull_time_stop': 18, 'bull_use_sma': True, 'bull_use_ema': True, 'bull_use_atr': True, 'bull_use_adx': False, 'bull_use_spike': False, 'bull_rsi_required': False, 'bear_strategy': 'breakout', 'bear_bb_std_mult': 2.8306973502754453, 'bear_rsi_os': 52, 'bear_rsi_ob': 69, 'bear_adx_thresh': 19.05479850737424, 'bear_atr_min_pct': 0.0050967164401184645, 'bear_atr_max_pct': 0.05078053558509219, 'bear_tp_mult': 2.67982798409233, 'bear_tsl_mult': 0.9538174901892456, 'bear_time_stop': 55, 'bear_use_sma': False, 'bear_use_ema': True, 'bear_use_atr': False, 'bear_use_adx': False, 'bear_use_spike': True, 'bear_rsi_required': False, 'sideways_strategy': 'breakout', 'sideways_bb_std_mult': 2.2710449981218037, 'sideways_rsi_os': 45, 'sideways_rsi_ob': 56, 'sideways_adx_thresh': 25.565801723859522, 'sideways_atr_min_pct': 0.004198859871378175, 'sideways_atr_max_pct': 0.015851620706068163, 'sideways_tp_mult': 1.0606624878820785, 'sideways_tsl_mult': 0.38402046479622964, 'sideways_time_stop': 18, 'sideways_use_sma': False, 'sideways_use_ema': True, 'sideways_use_atr': False, 'sideways_use_adx': False, 'sideways_use_spike': False, 'sideways_rsi_required': True}.
[I 2025-08-29 20:54:41,707] Trial 674 finished with values: [-0.0486772001191732, 0.04865499115476632] and parameters: {'p_sma': 54, 'p_std': 18, 'p_atr': 25, 'p_adx': 13, 'rsi_period': 71, 'ema1': 27, 'ema2': 36, 'slip_atr_k': 0.14103969129014565, 'slip_spread_k': 0.8869680100463736, 'spread_hl_frac': 0.04846992150989522, 'bb_std_mult': 1.6395949143669073, 'rsi_os': 10, 'rsi_ob': 84, 'vol_spike': 0.19859456523856098, 'adx_thresh': 13.246725903447613, 'atr_min_pct': 0.009397995755782266, 'atr_max_pct': 0.14989342693019386, 'tp_mult': 1.1357809762863413, 'tsl_mult': 0.8705741613780482, 'strategy': 'breakout', 'time_stop': 161, 'use_sma': True, 'use_atr': True, 'use_adx': False, 'use_ema': False, 'use_spike': True, 'rsi_required': False, 'edge_k': 0.6113200330419761, 'edge_cap': 0.06845517672377893, 'bull_strategy': 'mean_reversion', 'bull_bb_std_mult': 2.408501699221781, 'bull_rsi_os': 10, 'bull_rsi_ob': 61, 'bull_adx_thresh': 13.519365274278446, 'bull_atr_min_pct': 0.014301626347133655, 'bull_atr_max_pct': 0.13014363651335886, 'bull_tp_mult': 1.2031971694548362, 'bull_tsl_mult': 0.8924972558183027, 'bull_time_stop': 116, 'bull_use_sma': True, 'bull_use_ema': True, 'bull_use_atr': True, 'bull_use_adx': False, 'bull_use_spike': False, 'bull_rsi_required': False, 'bear_strategy': 'breakout', 'bear_bb_std_mult': 2.8716123691323077, 'bear_rsi_os': 28, 'bear_rsi_ob': 69, 'bear_adx_thresh': 19.944147996333562, 'bear_atr_min_pct': 0.005562236058835286, 'bear_atr_max_pct': 0.1037172536373704, 'bear_tp_mult': 2.8804092409423863, 'bear_tsl_mult': 0.9529159067652802, 'bear_time_stop': 54, 'bear_use_sma': True, 'bear_use_ema': True, 'bear_use_atr': False, 'bear_use_adx': False, 'bear_use_spike': True, 'bear_rsi_required': False, 'sideways_strategy': 'breakout', 'sideways_bb_std_mult': 2.672166013722589, 'sideways_rsi_os': 43, 'sideways_rsi_ob': 63, 'sideways_adx_thresh': 32.241655491192475, 'sideways_atr_min_pct': 0.0016500715083608963, 'sideways_atr_max_pct': 0.017555313594759047, 'sideways_tp_mult': 1.7287144880136742, 'sideways_tsl_mult': 0.7896708162169808, 'sideways_time_stop': 213, 'sideways_use_sma': True, 'sideways_use_ema': True, 'sideways_use_atr': False, 'sideways_use_adx': True, 'sideways_use_spike': False, 'sideways_rsi_required': True}.
