[I 2025-08-29 21:18:16,162] Trial 873 finished with values: [-1000000000.0, 1000000000.0] and parameters: {'p_sma': 11, 'p_std': 37, 'p_atr': 16, 'p_adx': 7, 'rsi_period': 30, 'ema1': 15, 'ema2': 25, 'slip_atr_k': 0.08726266455171157, 'slip_spread_k': 0.040230096169860174, 'spread_hl_frac': 0.02251678092245548, 'bb_std_mult': 0.7738387626202433, 'rsi_os': 23, 'rsi_ob': 89, 'vol_spike': 0.2776964992128984, 'adx_thresh': 9.233370390426838, 'atr_min_pct': 0.011042061639962136, 'atr_max_pct': 0.03690065240292565, 'tp_mult': 2.4397156636333466, 'tsl_mult': 0.7347669458579391, 'strategy': 'breakout', 'time_stop': 216, 'use_sma': False, 'use_atr': False, 'use_adx': True, 'use_ema': False, 'use_spike': True, 'rsi_required': True, 'edge_k': 0.46221427102352997, 'edge_cap': 0.24083783179830284, 'bull_strategy': 'breakout', 'bull_bb_std_mult': 2.7114043159203978, 'bull_rsi_os': 43, 'bull_rsi_ob': 65, 'bull_adx_thresh': 19.494123546709915, 'bull_atr_min_pct': 0.009476626511929409, 'bull_atr_max_pct': 0.10900078334654545, 'bull_tp_mult': 2.4506446355141565, 'bull_tsl_mult': 0.9655229672426017, 'bull_time_stop': 217, 'bull_use_sma': True, 'bull_use_ema': True, 'bull_use_atr': False, 'bull_use_adx': True, 'bull_use_spike': False, 'bull_rsi_required': True, 'bear_strategy': 'mean_reversion', 'bear_bb_std_mult': 1.9984244509912579, 'bear_rsi_os': 40, 'bear_rsi_ob': 88, 'bear_adx_thresh': 24.04631473866698, 'bear_atr_min_pct': 0.005871813332385236, 'bear_atr_max_pct': 0.07764520589861731, 'bear_tp_mult': 2.88616545269101, 'bear_tsl_mult': 0.03449953630925478, 'bear_time_stop': 265, 'bear_use_sma': True, 'bear_use_ema': False, 'bear_use_atr': True, 'bear_use_adx': False, 'bear_use_spike': False, 'bear_rsi_required': True, 'sideways_strategy': 'mean_reversion', 'sideways_bb_std_mult': 3.503229374917961, 'sideways_rsi_os': 22, 'sideways_rsi_ob': 48, 'sideways_adx_thresh': 11.370608960401057, 'sideways_atr_min_pct': 0.012461213223517972, 'sideways_atr_max_pct': 0.048788819052714705, 'sideways_tp_mult': 2.2852044171432424, 'sideways_tsl_mult': 0.634226332287303, 'sideways_time_stop': 149, 'sideways_use_sma': False, 'sideways_use_ema': False, 'sideways_use_atr': True, 'sideways_use_adx': True, 'sideways_use_spike': True, 'sideways_rsi_required': True}.
[I 2025-08-29 21:18:44,851] Trial 874 finished with values: [-1000000000.0, 1000000000.0] and parameters: {'p_sma': 11, 'p_std': 37, 'p_atr': 15, 'p_adx': 9, 'rsi_period': 30, 'ema1': 25, 'ema2': 24, 'slip_atr_k': 0.01112515819255071, 'slip_spread_k': 0.046780931914209505, 'spread_hl_frac': 0.023785012062049467, 'bb_std_mult': 0.6128801679846092, 'rsi_os': 14, 'rsi_ob': 69, 'vol_spike': 0.2943927529046335, 'adx_thresh': 7.478371971248791, 'atr_min_pct': 0.009980851149775089, 'atr_max_pct': 0.03707420453337787, 'tp_mult': 2.423289324225912, 'tsl_mult': 0.8064833618060194, 'strategy': 'breakout', 'time_stop': 219, 'use_sma': False, 'use_atr': False, 'use_adx': True, 'use_ema': False, 'use_spike': True, 'rsi_required': True, 'edge_k': 0.9526611669555413, 'edge_cap': 0.23485714651455103, 'bull_strategy': 'breakout', 'bull_bb_std_mult': 2.7138240799944424, 'bull_rsi_os': 43, 'bull_rsi_ob': 86, 'bull_adx_thresh': 21.82568282340783, 'bull_atr_min_pct': 0.017674106639295965, 'bull_atr_max_pct': 0.10867525899461362, 'bull_tp_mult': 2.260508547131374, 'bull_tsl_mult': 0.31929765979109537, 'bull_time_stop': 214, 'bull_use_sma': True, 'bull_use_ema': True, 'bull_use_atr': False, 'bull_use_adx': True, 'bull_use_spike': False, 'bull_rsi_required': True, 'bear_strategy': 'mean_reversion', 'bear_bb_std_mult': 2.4242420214776703, 'bear_rsi_os': 42, 'bear_rsi_ob': 87, 'bear_adx_thresh': 23.956756665494567, 'bear_atr_min_pct': 0.005904842251185101, 'bear_atr_max_pct': 0.07641904030597871, 'bear_tp_mult': 2.8859445753674895, 'bear_tsl_mult': 0.03206830021245716, 'bear_time_stop': 260, 'bear_use_sma': True, 'bear_use_ema': False, 'bear_use_atr': False, 'bear_use_adx': False, 'bear_use_spike': False, 'bear_rsi_required': True, 'sideways_strategy': 'mean_reversion', 'sideways_bb_std_mult': 3.478110954514785, 'sideways_rsi_os': 21, 'sideways_rsi_ob': 83, 'sideways_adx_thresh': 9.204773868996273, 'sideways_atr_min_pct': 0.012239607646975228, 'sideways_atr_max_pct': 0.05117602656897112, 'sideways_tp_mult': 2.3066529014335533, 'sideways_tsl_mult': 0.6441293209228344, 'sideways_time_stop': 144, 'sideways_use_sma': False, 'sideways_use_ema': False, 'sideways_use_atr': True, 'sideways_use_adx': True, 'sideways_use_spike': True, 'sideways_rsi_required': True}.
[I 2025-08-29 21:18:45,083] Trial 875 finished with values: [-1000000000.0, 1000000000.0] and parameters: {'p_sma': 54, 'p_std': 43, 'p_atr': 16, 'p_adx': 8, 'rsi_period': 70, 'ema1': 25, 'ema2': 24, 'slip_atr_k': 0.1686695736492468, 'slip_spread_k': 0.5946716699791843, 'spread_hl_frac': 0.0236576857034631, 'bb_std_mult': 1.025129391052417, 'rsi_os': 30, 'rsi_ob': 80, 'vol_spike': 0.29432061972044327, 'adx_thresh': 7.45007616022046, 'atr_min_pct': 0.009894938336468193, 'atr_max_pct': 0.03692762854259583, 'tp_mult': 2.509822359860538, 'tsl_mult': 0.8008602707785581, 'strategy': 'mean_reversion', 'time_stop': 219, 'use_sma': False, 'use_atr': False, 'use_adx': True, 'use_ema': False, 'use_spike': True, 'rsi_required': True, 'edge_k': 1.6374859343531993, 'edge_cap': 0.28353346820494435, 'bull_strategy': 'mean_reversion', 'bull_bb_std_mult': 2.551253500229171, 'bull_rsi_os': 43, 'bull_rsi_ob': 65, 'bull_adx_thresh': 31.07647621703779, 'bull_atr_min_pct': 0.028965648513144183, 'bull_atr_max_pct': 0.13813977078962203, 'bull_tp_mult': 2.4743919222717694, 'bull_tsl_mult': 0.36603554165919266, 'bull_time_stop': 216, 'bull_use_sma': True, 'bull_use_ema': False, 'bull_use_atr': False, 'bull_use_adx': True, 'bull_use_spike': False, 'bull_rsi_required': True, 'bear_strategy': 'breakout', 'bear_bb_std_mult': 2.4516793069655334, 'bear_rsi_os': 42, 'bear_rsi_ob': 87, 'bear_adx_thresh': 7.685838807203504, 'bear_atr_min_pct': 0.02881618897813962, 'bear_atr_max_pct': 0.0762454063252703, 'bear_tp_mult': 1.4215517518951868, 'bear_tsl_mult': 0.024607622800967534, 'bear_time_stop': 250, 'bear_use_sma': False, 'bear_use_ema': False, 'bear_use_atr': True, 'bear_use_adx': False, 'bear_use_spike': False, 'bear_rsi_required': True, 'sideways_strategy': 'breakout', 'sideways_bb_std_mult': 3.5492192244343803, 'sideways_rsi_os': 21, 'sideways_rsi_ob': 86, 'sideways_adx_thresh': 11.062391553318312, 'sideways_atr_min_pct': 0.016292440744387952, 'sideways_atr_max_pct': 0.03446855664432459, 'sideways_tp_mult': 2.2788396439870464, 'sideways_tsl_mult': 0.5515572855182612, 'sideways_time_stop': 146, 'sideways_use_sma': True, 'sideways_use_ema': False, 'sideways_use_atr': True, 'sideways_use_adx': True, 'sideways_use_spike': True, 'sideways_rsi_required': True}.
[I 2025-08-29 21:18:45,839] Trial 876 finished with values: [-1000000000.0, 1000000000.0] and parameters: {'p_sma': 17, 'p_std': 44, 'p_atr': 16, 'p_adx': 8, 'rsi_period': 31, 'ema1': 25, 'ema2': 26, 'slip_atr_k': 0.1311652524675507, 'slip_spread_k': 0.12346351778878446, 'spread_hl_frac': 0.023774871720559667, 'bb_std_mult': 1.0643151759987708, 'rsi_os': 23, 'rsi_ob': 78, 'vol_spike': 0.2785410520199357, 'adx_thresh': 7.597073629217936, 'atr_min_pct': 0.0099272852452391, 'atr_max_pct': 0.06187501821960579, 'tp_mult': 2.292820881934953, 'tsl_mult': 0.8028985135188976, 'strategy': 'mean_reversion', 'time_stop': 220, 'use_sma': False, 'use_atr': False, 'use_adx': True, 'use_ema': False, 'use_spike': True, 'rsi_required': True, 'edge_k': 1.4684839832719052, 'edge_cap': 0.23440222094047442, 'bull_strategy': 'mean_reversion', 'bull_bb_std_mult': 2.617950001668042, 'bull_rsi_os': 22, 'bull_rsi_ob': 69, 'bull_adx_thresh': 31.493442866069074, 'bull_atr_min_pct': 0.005821130932970691, 'bull_atr_max_pct': 0.06312176708946682, 'bull_tp_mult': 2.32541512056477, 'bull_tsl_mult': 0.9701477927668625, 'bull_time_stop': 217, 'bull_use_sma': True, 'bull_use_ema': False, 'bull_use_atr': False, 'bull_use_adx': True, 'bull_use_spike': False, 'bull_rsi_required': True, 'bear_strategy': 'breakout', 'bear_bb_std_mult': 1.8880210710408818, 'bear_rsi_os': 42, 'bear_rsi_ob': 87, 'bear_adx_thresh': 24.809413982827138, 'bear_atr_min_pct': 0.007753813698764608, 'bear_atr_max_pct': 0.07671387306645615, 'bear_tp_mult': 2.819229704666942, 'bear_tsl_mult': 0.027148201504956983, 'bear_time_stop': 250, 'bear_use_sma': False, 'bear_use_ema': False, 'bear_use_atr': False, 'bear_use_adx': False, 'bear_use_spike': False, 'bear_rsi_required': True, 'sideways_strategy': 'breakout', 'sideways_bb_std_mult': 3.598865151005085, 'sideways_rsi_os': 24, 'sideways_rsi_ob': 54, 'sideways_adx_thresh': 10.9591193353814, 'sideways_atr_min_pct': 0.014065960158509172, 'sideways_atr_max_pct': 0.033710867583811026, 'sideways_tp_mult': 2.2504735053247567, 'sideways_tsl_mult': 0.5473785382797449, 'sideways_time_stop': 143, 'sideways_use_sma': True, 'sideways_use_ema': False, 'sideways_use_atr': True, 'sideways_use_adx': True, 'sideways_use_spike': True, 'sideways_rsi_required': True}.
[I 2025-08-29 21:18:45,902] Trial 877 finished with values: [-0.05503687897955656, 0.05497195245357898] and parameters: {'p_sma': 28, 'p_std': 39, 'p_atr': 16, 'p_adx': 8, 'rsi_period': 34, 'ema1': 10, 'ema2': 27, 'slip_atr_k': 0.012530703722413317, 'slip_spread_k': 0.10166555718530489, 'spread_hl_frac': 0.024188250706497577, 'bb_std_mult': 1.0579755005360605, 'rsi_os': 8, 'rsi_ob': 80, 'vol_spike': 0.2796721017547447, 'adx_thresh': 7.483804595360654, 'atr_min_pct': 0.009963899489289302, 'atr_max_pct': 0.06252459436003578, 'tp_mult': 2.4970702229600636, 'tsl_mult': 0.8071641463474917, 'strategy': 'mean_reversion', 'time_stop': 222, 'use_sma': True, 'use_atr': False, 'use_adx': True, 'use_ema': False, 'use_spike': True, 'rsi_required': False, 'edge_k': 0.870541610960147, 'edge_cap': 0.2770553211182458, 'bull_strategy': 'mean_reversion', 'bull_bb_std_mult': 2.6274578251067737, 'bull_rsi_os': 22, 'bull_rsi_ob': 69, 'bull_adx_thresh': 31.68018301734864, 'bull_atr_min_pct': 0.018457156149971732, 'bull_atr_max_pct': 0.10000552631358023, 'bull_tp_mult': 2.470979266861629, 'bull_tsl_mult': 0.32691037769591635, 'bull_time_stop': 230, 'bull_use_sma': True, 'bull_use_ema': False, 'bull_use_atr': False, 'bull_use_adx': True, 'bull_use_spike': False, 'bull_rsi_required': True, 'bear_strategy': 'breakout', 'bear_bb_std_mult': 2.141934374388247, 'bear_rsi_os': 42, 'bear_rsi_ob': 90, 'bear_adx_thresh': 28.068538758016928, 'bear_atr_min_pct': 0.001050550122347265, 'bear_atr_max_pct': 0.08503056435130146, 'bear_tp_mult': 2.8059782551294252, 'bear_tsl_mult': 0.07854953564398118, 'bear_time_stop': 249, 'bear_use_sma': False, 'bear_use_ema': False, 'bear_use_atr': False, 'bear_use_adx': False, 'bear_use_spike': True, 'bear_rsi_required': True, 'sideways_strategy': 'breakout', 'sideways_bb_std_mult': 3.4490814050714, 'sideways_rsi_os': 24, 'sideways_rsi_ob': 92, 'sideways_adx_thresh': 9.009964222371332, 'sideways_atr_min_pct': 0.014078055598952803, 'sideways_atr_max_pct': 0.033659595635658554, 'sideways_tp_mult': 2.406284315114744, 'sideways_tsl_mult': 0.5463716532630755, 'sideways_time_stop': 142, 'sideways_use_sma': True, 'sideways_use_ema': True, 'sideways_use_atr': True, 'sideways_use_adx': True, 'sideways_use_spike': True, 'sideways_rsi_required': True}.
[I 2025-08-29 21:19:15,011] Trial 879 finished with values: [-0.03290334644553916, 0.032847453603536136] and parameters: {'p_sma': 31, 'p_std': 20, 'p_atr': 14, 'p_adx': 8, 'rsi_period': 34, 'ema1': 6, 'ema2': 27, 'slip_atr_k': 0.012221935729974777, 'slip_spread_k': 0.9564602571053555, 'spread_hl_frac': 0.021023923443621348, 'bb_std_mult': 0.9034397357706215, 'rsi_os': 8, 'rsi_ob': 51, 'vol_spike': 0.2813201359799195, 'adx_thresh': 8.666768461090816, 'atr_min_pct': 0.010404441480864507, 'atr_max_pct': 0.06160942747190369, 'tp_mult': 2.2922773535973597, 'tsl_mult': 0.8095382217449112, 'strategy': 'mean_reversion', 'time_stop': 224, 'use_sma': True, 'use_atr': False, 'use_adx': False, 'use_ema': False, 'use_spike': True, 'rsi_required': False, 'edge_k': 0.8554581733029843, 'edge_cap': 0.33247788088468055, 'bull_strategy': 'mean_reversion', 'bull_bb_std_mult': 2.628201102961722, 'bull_rsi_os': 24, 'bull_rsi_ob': 70, 'bull_adx_thresh': 26.305375534471775, 'bull_atr_min_pct': 0.018468821279320986, 'bull_atr_max_pct': 0.10056331022461444, 'bull_tp_mult': 2.323407842791188, 'bull_tsl_mult': 0.9647092054837619, 'bull_time_stop': 189, 'bull_use_sma': True, 'bull_use_ema': False, 'bull_use_atr': False, 'bull_use_adx': True, 'bull_use_spike': True, 'bull_rsi_required': False, 'bear_strategy': 'breakout', 'bear_bb_std_mult': 0.7843537129571487, 'bear_rsi_os': 39, 'bear_rsi_ob': 90, 'bear_adx_thresh': 25.089140899176755, 'bear_atr_min_pct': 0.003178732213751801, 'bear_atr_max_pct': 0.07316532469226758, 'bear_tp_mult': 2.8227770958364915, 'bear_tsl_mult': 0.08214978079693658, 'bear_time_stop': 280, 'bear_use_sma': False, 'bear_use_ema': False, 'bear_use_atr': False, 'bear_use_adx': False, 'bear_use_spike': True, 'bear_rsi_required': False, 'sideways_strategy': 'breakout', 'sideways_bb_std_mult': 3.465147407811922, 'sideways_rsi_os': 24, 'sideways_rsi_ob': 54, 'sideways_adx_thresh': 13.074092905496158, 'sideways_atr_min_pct': 0.013942767647737796, 'sideways_atr_max_pct': 0.040721236411720325, 'sideways_tp_mult': 2.410187414216712, 'sideways_tsl_mult': 0.5834445626088619, 'sideways_time_stop': 141, 'sideways_use_sma': True, 'sideways_use_ema': True, 'sideways_use_atr': True, 'sideways_use_adx': False, 'sideways_use_spike': False, 'sideways_rsi_required': True}.
