[I 2025-08-29 20:18:45,974] Trial 352 finished with values: [-1000000000.0, 0.10542770960701565] and parameters: {'p_sma': 17, 'p_std': 60, 'p_atr': 24, 'p_adx': 14, 'rsi_period': 36, 'ema1': 18, 'ema2': 25, 'slip_atr_k': 0.0011173593664347103, 'slip_spread_k': 0.2289548255579739, 'spread_hl_frac': 0.04896552907532411, 'bb_std_mult': 1.681266636329783, 'rsi_os': 10, 'rsi_ob': 78, 'vol_spike': 0.20653752405101897, 'adx_thresh': 15.465722644181213, 'atr_min_pct': 0.022022853667914136, 'atr_max_pct': 0.06486996060379324, 'tp_mult': 1.5422544253544874, 'tsl_mult': 0.8003685563212203, 'strategy': 'mean_reversion', 'time_stop': 10, 'use_sma': True, 'use_atr': False, 'use_adx': False, 'use_ema': True, 'use_spike': False, 'rsi_required': False, 'edge_k': 1.1712584902858354, 'edge_cap': 0.24723662693243792, 'bull_strategy': 'mean_reversion', 'bull_bb_std_mult': 3.158130564686578, 'bull_rsi_os': 35, 'bull_rsi_ob': 72, 'bull_adx_thresh': 12.655221196420536, 'bull_atr_min_pct': 0.017532659217533445, 'bull_atr_max_pct': 0.05124299164404576, 'bull_tp_mult': 2.6031116193016355, 'bull_tsl_mult': 0.9687411427145435, 'bull_time_stop': 46, 'bull_use_sma': True, 'bull_use_ema': False, 'bull_use_atr': True, 'bull_use_adx': False, 'bull_use_spike': True, 'bull_rsi_required': False, 'bear_strategy': 'breakout', 'bear_bb_std_mult': 2.811444072049706, 'bear_rsi_os': 26, 'bear_rsi_ob': 62, 'bear_adx_thresh': 22.096737632031964, 'bear_atr_min_pct': 0.01811545411769136, 'bear_atr_max_pct': 0.03210368162647691, 'bear_tp_mult': 2.7161417769306855, 'bear_tsl_mult': 0.44255605505361806, 'bear_time_stop': 36, 'bear_use_sma': False, 'bear_use_ema': True, 'bear_use_atr': False, 'bear_use_adx': True, 'bear_use_spike': True, 'bear_rsi_required': False, 'sideways_strategy': 'breakout', 'sideways_bb_std_mult': 2.4320774098094082, 'sideways_rsi_os': 49, 'sideways_rsi_ob': 80, 'sideways_adx_thresh': 33.884658436361754, 'sideways_atr_min_pct': 0.00012978768666662387, 'sideways_atr_max_pct': 0.01982422756331109, 'sideways_tp_mult': 1.0549450866608492, 'sideways_tsl_mult': 0.732408771458591, 'sideways_time_stop': 202, 'sideways_use_sma': False, 'sideways_use_ema': True, 'sideways_use_atr': False, 'sideways_use_adx': False, 'sideways_use_spike': False, 'sideways_rsi_required': False}.
[I 2025-08-29 20:18:46,068] Trial 349 finished with values: [-1000000000.0, 1000000000.0] and parameters: {'p_sma': 18, 'p_std': 5, 'p_atr': 24, 'p_adx': 14, 'rsi_period': 36, 'ema1': 18, 'ema2': 25, 'slip_atr_k': 0.01136734573210101, 'slip_spread_k': 0.23417672025351594, 'spread_hl_frac': 0.04774812625830928, 'bb_std_mult': 1.6397676013150457, 'rsi_os': 10, 'rsi_ob': 80, 'vol_spike': 0.19195133844772574, 'adx_thresh': 15.519488371535267, 'atr_min_pct': 0.020468704664825307, 'atr_max_pct': 0.12085480861398601, 'tp_mult': 1.5569817191213642, 'tsl_mult': 0.8532921801885973, 'strategy': 'mean_reversion', 'time_stop': 36, 'use_sma': True, 'use_atr': False, 'use_adx': False, 'use_ema': True, 'use_spike': False, 'rsi_required': False, 'edge_k': 1.1525369159377497, 'edge_cap': 0.24606390233340902, 'bull_strategy': 'mean_reversion', 'bull_bb_std_mult': 3.1470446682632214, 'bull_rsi_os': 35, 'bull_rsi_ob': 75, 'bull_adx_thresh': 13.28410204591335, 'bull_atr_min_pct': 0.012971363165948543, 'bull_atr_max_pct': 0.08289923628082696, 'bull_tp_mult': 2.587624929591641, 'bull_tsl_mult': 0.9177621680120098, 'bull_time_stop': 57, 'bull_use_sma': True, 'bull_use_ema': False, 'bull_use_atr': True, 'bull_use_adx': False, 'bull_use_spike': True, 'bull_rsi_required': False, 'bear_strategy': 'breakout', 'bear_bb_std_mult': 2.802205383806252, 'bear_rsi_os': 26, 'bear_rsi_ob': 54, 'bear_adx_thresh': 21.79115717890316, 'bear_atr_min_pct': 0.024994953765513805, 'bear_atr_max_pct': 0.03234497939914475, 'bear_tp_mult': 2.7092441675904304, 'bear_tsl_mult': 0.7834949907106628, 'bear_time_stop': 35, 'bear_use_sma': False, 'bear_use_ema': True, 'bear_use_atr': False, 'bear_use_adx': True, 'bear_use_spike': True, 'bear_rsi_required': False, 'sideways_strategy': 'breakout', 'sideways_bb_std_mult': 2.4311548337298268, 'sideways_rsi_os': 46, 'sideways_rsi_ob': 69, 'sideways_adx_thresh': 34.632075857506024, 'sideways_atr_min_pct': 0.025131185486768085, 'sideways_atr_max_pct': 0.026400448563302613, 'sideways_tp_mult': 1.1509825368684392, 'sideways_tsl_mult': 0.6660658460551631, 'sideways_time_stop': 190, 'sideways_use_sma': False, 'sideways_use_ema': True, 'sideways_use_atr': False, 'sideways_use_adx': False, 'sideways_use_spike': False, 'sideways_rsi_required': False}.
[I 2025-08-29 20:19:17,380] Trial 355 finished with values: [-1000000000.0, 1000000000.0] and parameters: {'p_sma': 18, 'p_std': 55, 'p_atr': 24, 'p_adx': 15, 'rsi_period': 35, 'ema1': 8, 'ema2': 32, 'slip_atr_k': 0.006719855344461283, 'slip_spread_k': 0.5657307474779675, 'spread_hl_frac': 0.04721404682257737, 'bb_std_mult': 1.5873643501808854, 'rsi_os': 9, 'rsi_ob': 81, 'vol_spike': 0.1828207353452817, 'adx_thresh': 13.476496556445623, 'atr_min_pct': 0.020331343274259565, 'atr_max_pct': 0.1497361081643273, 'tp_mult': 2.0436430169789763, 'tsl_mult': 0.8255117652683495, 'strategy': 'mean_reversion', 'time_stop': 21, 'use_sma': True, 'use_atr': False, 'use_adx': False, 'use_ema': True, 'use_spike': False, 'rsi_required': False, 'edge_k': 1.1303231262194693, 'edge_cap': 0.5059880742521754, 'bull_strategy': 'mean_reversion', 'bull_bb_std_mult': 3.073134815241406, 'bull_rsi_os': 36, 'bull_rsi_ob': 75, 'bull_adx_thresh': 12.142136708823243, 'bull_atr_min_pct': 0.017977863731606047, 'bull_atr_max_pct': 0.12160794481501747, 'bull_tp_mult': 2.791293790918538, 'bull_tsl_mult': 0.9421150236263395, 'bull_time_stop': 60, 'bull_use_sma': True, 'bull_use_ema': False, 'bull_use_atr': True, 'bull_use_adx': False, 'bull_use_spike': True, 'bull_rsi_required': False, 'bear_strategy': 'breakout', 'bear_bb_std_mult': 2.652057102907018, 'bear_rsi_os': 24, 'bear_rsi_ob': 65, 'bear_adx_thresh': 22.238173909182674, 'bear_atr_min_pct': 0.00950788409034535, 'bear_atr_max_pct': 0.033797898621982486, 'bear_tp_mult': 2.6177995269799887, 'bear_tsl_mult': 0.20876399021437853, 'bear_time_stop': 146, 'bear_use_sma': False, 'bear_use_ema': True, 'bear_use_atr': False, 'bear_use_adx': True, 'bear_use_spike': True, 'bear_rsi_required': False, 'sideways_strategy': 'breakout', 'sideways_bb_std_mult': 2.1672839872609098, 'sideways_rsi_os': 46, 'sideways_rsi_ob': 81, 'sideways_adx_thresh': 34.8063065972881, 'sideways_atr_min_pct': 0.02446575938496109, 'sideways_atr_max_pct': 0.013876220731185232, 'sideways_tp_mult': 1.1637205640872421, 'sideways_tsl_mult': 0.6633812847658351, 'sideways_time_stop': 218, 'sideways_use_sma': False, 'sideways_use_ema': True, 'sideways_use_atr': False, 'sideways_use_adx': False, 'sideways_use_spike': False, 'sideways_rsi_required': False}.
[I 2025-08-29 20:19:17,381] Trial 353 finished with values: [-1000000000.0, 1000000000.0] and parameters: {'p_sma': 17, 'p_std': 58, 'p_atr': 24, 'p_adx': 14, 'rsi_period': 36, 'ema1': 17, 'ema2': 46, 'slip_atr_k': 0.01014061730152881, 'slip_spread_k': 0.23283564046502153, 'spread_hl_frac': 0.04763069205473707, 'bb_std_mult': 1.6565394726098057, 'rsi_os': 9, 'rsi_ob': 78, 'vol_spike': 0.07355348252255825, 'adx_thresh': 10.464809456423929, 'atr_min_pct': 0.02207463906466703, 'atr_max_pct': 0.034138928317506055, 'tp_mult': 1.579757585341854, 'tsl_mult': 0.7965183975068342, 'strategy': 'mean_reversion', 'time_stop': 180, 'use_sma': True, 'use_atr': False, 'use_adx': False, 'use_ema': True, 'use_spike': False, 'rsi_required': False, 'edge_k': 1.1307202816512583, 'edge_cap': 0.5028144743202739, 'bull_strategy': 'mean_reversion', 'bull_bb_std_mult': 3.149904380355934, 'bull_rsi_os': 35, 'bull_rsi_ob': 75, 'bull_adx_thresh': 12.667983207380153, 'bull_atr_min_pct': 0.017627551815277444, 'bull_atr_max_pct': 0.03991159895593177, 'bull_tp_mult': 2.6094051775111593, 'bull_tsl_mult': 0.9662842615689589, 'bull_time_stop': 45, 'bull_use_sma': True, 'bull_use_ema': False, 'bull_use_atr': True, 'bull_use_adx': False, 'bull_use_spike': True, 'bull_rsi_required': False, 'bear_strategy': 'breakout', 'bear_bb_std_mult': 2.6422995892518513, 'bear_rsi_os': 27, 'bear_rsi_ob': 62, 'bear_adx_thresh': 21.78939153566255, 'bear_atr_min_pct': 0.005654886153455192, 'bear_atr_max_pct': 0.03387691036152545, 'bear_tp_mult': 2.806991931517709, 'bear_tsl_mult': 0.3958523547666681, 'bear_time_stop': 35, 'bear_use_sma': False, 'bear_use_ema': True, 'bear_use_atr': False, 'bear_use_adx': True, 'bear_use_spike': True, 'bear_rsi_required': False, 'sideways_strategy': 'breakout', 'sideways_bb_std_mult': 2.403561615500558, 'sideways_rsi_os': 45, 'sideways_rsi_ob': 72, 'sideways_adx_thresh': 34.781310481571886, 'sideways_atr_min_pct': 0.005106929820724353, 'sideways_atr_max_pct': 0.019188860204747762, 'sideways_tp_mult': 1.0630003407659454, 'sideways_tsl_mult': 0.6700842728137255, 'sideways_time_stop': 201, 'sideways_use_sma': False, 'sideways_use_ema': True, 'sideways_use_atr': False, 'sideways_use_adx': False, 'sideways_use_spike': False, 'sideways_rsi_required': False}.
[I 2025-08-29 20:19:17,770] Trial 354 finished with values: [-1000000000.0, 1000000000.0] and parameters: {'p_sma': 22, 'p_std': 5, 'p_atr': 24, 'p_adx': 14, 'rsi_period': 35, 'ema1': 28, 'ema2': 49, 'slip_atr_k': 0.012132778541685502, 'slip_spread_k': 0.9386964765005921, 'spread_hl_frac': 0.04775299381183348, 'bb_std_mult': 1.5808303879272454, 'rsi_os': 8, 'rsi_ob': 81, 'vol_spike': 0.20514714901480838, 'adx_thresh': 8.848094579548228, 'atr_min_pct': 0.022190040803599643, 'atr_max_pct': 0.1134621471486325, 'tp_mult': 1.5684427978932265, 'tsl_mult': 0.8003161687609929, 'strategy': 'mean_reversion', 'time_stop': 12, 'use_sma': True, 'use_atr': False, 'use_adx': False, 'use_ema': True, 'use_spike': False, 'rsi_required': False, 'edge_k': 1.1255142318290206, 'edge_cap': 0.4983468037881889, 'bull_strategy': 'mean_reversion', 'bull_bb_std_mult': 3.292374233783205, 'bull_rsi_os': 35, 'bull_rsi_ob': 75, 'bull_adx_thresh': 12.883777325207038, 'bull_atr_min_pct': 0.013457645980905006, 'bull_atr_max_pct': 0.1238341333062578, 'bull_tp_mult': 2.7507669039220994, 'bull_tsl_mult': 0.9423769593694178, 'bull_time_stop': 41, 'bull_use_sma': True, 'bull_use_ema': False, 'bull_use_atr': True, 'bull_use_adx': False, 'bull_use_spike': True, 'bull_rsi_required': False, 'bear_strategy': 'breakout', 'bear_bb_std_mult': 2.6604532557307925, 'bear_rsi_os': 27, 'bear_rsi_ob': 62, 'bear_adx_thresh': 21.91698746457868, 'bear_atr_min_pct': 0.005435893269088292, 'bear_atr_max_pct': 0.0380627532274258, 'bear_tp_mult': 2.8003205775176023, 'bear_tsl_mult': 0.40141594458865176, 'bear_time_stop': 33, 'bear_use_sma': False, 'bear_use_ema': True, 'bear_use_atr': False, 'bear_use_adx': True, 'bear_use_spike': True, 'bear_rsi_required': False, 'sideways_strategy': 'breakout', 'sideways_bb_std_mult': 2.1452012524293385, 'sideways_rsi_os': 49, 'sideways_rsi_ob': 81, 'sideways_adx_thresh': 34.83799601097115, 'sideways_atr_min_pct': 0.025454060574300275, 'sideways_atr_max_pct': 0.01605416490052535, 'sideways_tp_mult': 1.1623237682289873, 'sideways_tsl_mult': 0.6704021336131907, 'sideways_time_stop': 188, 'sideways_use_sma': False, 'sideways_use_ema': True, 'sideways_use_atr': False, 'sideways_use_adx': False, 'sideways_use_spike': False, 'sideways_rsi_required': False}.
[I 2025-08-29 20:19:17,849] Trial 356 finished with values: [-1000000000.0, 1000000000.0] and parameters: {'p_sma': 22, 'p_std': 55, 'p_atr': 24, 'p_adx': 15, 'rsi_period': 38, 'ema1': 17, 'ema2': 16, 'slip_atr_k': 0.008917607240119106, 'slip_spread_k': 0.18621140827915372, 'spread_hl_frac': 0.047630785091586865, 'bb_std_mult': 1.5728969436138651, 'rsi_os': 8, 'rsi_ob': 81, 'vol_spike': 0.18389297619616923, 'adx_thresh': 13.66845841566166, 'atr_min_pct': 0.019634339360768104, 'atr_max_pct': 0.11375997314524468, 'tp_mult': 1.2203370935429003, 'tsl_mult': 0.8257681720850637, 'strategy': 'mean_reversion', 'time_stop': 198, 'use_sma': True, 'use_atr': False, 'use_adx': False, 'use_ema': True, 'use_spike': False, 'rsi_required': False, 'edge_k': 1.1225121529655209, 'edge_cap': 0.532081710906316, 'bull_strategy': 'mean_reversion', 'bull_bb_std_mult': 3.3085595228514237, 'bull_rsi_os': 37, 'bull_rsi_ob': 71, 'bull_adx_thresh': 15.788335316635465, 'bull_atr_min_pct': 0.017129585542978006, 'bull_atr_max_pct': 0.12284946852724254, 'bull_tp_mult': 2.59184343169163, 'bull_tsl_mult': 0.9370608684159912, 'bull_time_stop': 43, 'bull_use_sma': True, 'bull_use_ema': False, 'bull_use_atr': True, 'bull_use_adx': False, 'bull_use_spike': True, 'bull_rsi_required': False, 'bear_strategy': 'breakout', 'bear_bb_std_mult': 2.661885380835182, 'bear_rsi_os': 27, 'bear_rsi_ob': 47, 'bear_adx_thresh': 22.33782566012129, 'bear_atr_min_pct': 0.009484398955969604, 'bear_atr_max_pct': 0.038824504628759963, 'bear_tp_mult': 2.613748962783207, 'bear_tsl_mult': 0.40183390996280793, 'bear_time_stop': 263, 'bear_use_sma': False, 'bear_use_ema': True, 'bear_use_atr': False, 'bear_use_adx': True, 'bear_use_spike': True, 'bear_rsi_required': False, 'sideways_strategy': 'breakout', 'sideways_bb_std_mult': 2.1502798198473823, 'sideways_rsi_os': 45, 'sideways_rsi_ob': 81, 'sideways_adx_thresh': 32.198604538605224, 'sideways_atr_min_pct': 0.026103373659306123, 'sideways_atr_max_pct': 0.014708072207439084, 'sideways_tp_mult': 1.0889939981915269, 'sideways_tsl_mult': 0.6828526723681754, 'sideways_time_stop': 218, 'sideways_use_sma': False, 'sideways_use_ema': True, 'sideways_use_atr': False, 'sideways_use_adx': False, 'sideways_use_spike': False, 'sideways_rsi_required': False}.
[I 2025-08-29 20:19:48,273] Trial 360 finished with values: [0.0012481955475465156, 0.0006491092581166888] and parameters: {'p_sma': 20, 'p_std': 56, 'p_atr': 25, 'p_adx': 13, 'rsi_period': 38, 'ema1': 26, 'ema2': 46, 'slip_atr_k': 0.0008413261013704675, 'slip_spread_k': 0.18228533957922705, 'spread_hl_frac': 0.04984039610424175, 'bb_std_mult': 1.6956668806516413, 'rsi_os': 9, 'rsi_ob': 83, 'vol_spike': 0.1832820014007345, 'adx_thresh': 12.994792181056672, 'atr_min_pct': 0.02000390801266182, 'atr_max_pct': 0.030203098537605187, 'tp_mult': 1.3755178945342967, 'tsl_mult': 0.8873492372437555, 'strategy': 'mean_reversion', 'time_stop': 167, 'use_sma': True, 'use_atr': False, 'use_adx': False, 'use_ema': True, 'use_spike': False, 'rsi_required': False, 'edge_k': 1.0707612838393752, 'edge_cap': 0.5926101514977745, 'bull_strategy': 'mean_reversion', 'bull_bb_std_mult': 3.064308751178315, 'bull_rsi_os': 18, 'bull_rsi_ob': 73, 'bull_adx_thresh': 13.948661217693711, 'bull_atr_min_pct': 0.01595173178752606, 'bull_atr_max_pct': 0.09416264003260867, 'bull_tp_mult': 2.6993921533808134, 'bull_tsl_mult': 0.8834092404547879, 'bull_time_stop': 32, 'bull_use_sma': True, 'bull_use_ema': False, 'bull_use_atr': True, 'bull_use_adx': False, 'bull_use_spike': True, 'bull_rsi_required': False, 'bear_strategy': 'breakout', 'bear_bb_std_mult': 2.7144914446383566, 'bear_rsi_os': 28, 'bear_rsi_ob': 67, 'bear_adx_thresh': 21.138272686770655, 'bear_atr_min_pct': 0.006339128666251985, 'bear_atr_max_pct': 0.04827314724980125, 'bear_tp_mult': 2.653850371804507, 'bear_tsl_mult': 0.9267980711219213, 'bear_time_stop': 51, 'bear_use_sma': False, 'bear_use_ema': True, 'bear_use_atr': False, 'bear_use_adx': True, 'bear_use_spike': True, 'bear_rsi_required': False, 'sideways_strategy': 'breakout', 'sideways_bb_std_mult': 2.3418484319837205, 'sideways_rsi_os': 47, 'sideways_rsi_ob': 79, 'sideways_adx_thresh': 32.670263943817645, 'sideways_atr_min_pct': 0.004702190232763016, 'sideways_atr_max_pct': 0.022512292897818715, 'sideways_tp_mult': 1.0505195383357364, 'sideways_tsl_mult': 0.7185673757309092, 'sideways_time_stop': 194, 'sideways_use_sma': False, 'sideways_use_ema': False, 'sideways_use_atr': False, 'sideways_use_adx': False, 'sideways_use_spike': False, 'sideways_rsi_required': False}.
[I 2025-08-29 20:19:48,451] Trial 359 finished with values: [-0.0006742940189086166, 0.0010873611782251387] and parameters: {'p_sma': 22, 'p_std': 7, 'p_atr': 25, 'p_adx': 13, 'rsi_period': 77, 'ema1': 5, 'ema2': 46, 'slip_atr_k': 0.006294320778100406, 'slip_spread_k': 0.1929451753705786, 'spread_hl_frac': 0.0497056017236754, 'bb_std_mult': 1.7329282104400163, 'rsi_os': 9, 'rsi_ob': 82, 'vol_spike': 0.18341120335527716, 'adx_thresh': 13.58450306725025, 'atr_min_pct': 0.019690930434899407, 'atr_max_pct': 0.03588691328461122, 'tp_mult': 1.4031579689870302, 'tsl_mult': 0.868967259786725, 'strategy': 'mean_reversion', 'time_stop': 197, 'use_sma': True, 'use_atr': False, 'use_adx': False, 'use_ema': True, 'use_spike': False, 'rsi_required': False, 'edge_k': 1.040968276687937, 'edge_cap': 0.528237163741522, 'bull_strategy': 'mean_reversion', 'bull_bb_std_mult': 2.915977625664126, 'bull_rsi_os': 37, 'bull_rsi_ob': 73, 'bull_adx_thresh': 13.891499515894195, 'bull_atr_min_pct': 0.016092809283176465, 'bull_atr_max_pct': 0.09460314566747938, 'bull_tp_mult': 2.695340448695747, 'bull_tsl_mult': 0.8778788171380606, 'bull_time_stop': 28, 'bull_use_sma': True, 'bull_use_ema': False, 'bull_use_atr': True, 'bull_use_adx': False, 'bull_use_spike': True, 'bull_rsi_required': False, 'bear_strategy': 'breakout', 'bear_bb_std_mult': 2.764498913447053, 'bear_rsi_os': 28, 'bear_rsi_ob': 67, 'bear_adx_thresh': 22.664899364895845, 'bear_atr_min_pct': 0.00802713463219001, 'bear_atr_max_pct': 0.03754297592377439, 'bear_tp_mult': 2.6404100994267528, 'bear_tsl_mult': 0.961354059965342, 'bear_time_stop': 56, 'bear_use_sma': False, 'bear_use_ema': True, 'bear_use_atr': False, 'bear_use_adx': True, 'bear_use_spike': True, 'bear_rsi_required': False, 'sideways_strategy': 'breakout', 'sideways_bb_std_mult': 2.349083996663605, 'sideways_rsi_os': 44, 'sideways_rsi_ob': 65, 'sideways_adx_thresh': 32.65811610226273, 'sideways_atr_min_pct': 0.004662667509011291, 'sideways_atr_max_pct': 0.022805828151920022, 'sideways_tp_mult': 1.1001218446412446, 'sideways_tsl_mult': 0.6925147949684256, 'sideways_time_stop': 194, 'sideways_use_sma': False, 'sideways_use_ema': True, 'sideways_use_atr': False, 'sideways_use_adx': False, 'sideways_use_spike': False, 'sideways_rsi_required': False}.
[I 2025-08-29 20:19:48,814] Trial 358 finished with values: [-1000000000.0, 1000000000.0] and parameters: {'p_sma': 22, 'p_std': 56, 'p_atr': 25, 'p_adx': 9, 'rsi_period': 37, 'ema1': 30, 'ema2': 49, 'slip_atr_k': 0.005915321040658393, 'slip_spread_k': 0.18748660844798143, 'spread_hl_frac': 0.049054214001724786, 'bb_std_mult': 1.5711832823711562, 'rsi_os': 8, 'rsi_ob': 82, 'vol_spike': 0.18524497573823115, 'adx_thresh': 13.895040850311853, 'atr_min_pct': 0.019706136047496735, 'atr_max_pct': 0.03042757005099466, 'tp_mult': 1.692818494254499, 'tsl_mult': 0.8825905873585163, 'strategy': 'mean_reversion', 'time_stop': 197, 'use_sma': True, 'use_atr': False, 'use_adx': False, 'use_ema': True, 'use_spike': False, 'rsi_required': False, 'edge_k': 1.069865797311838, 'edge_cap': 0.5317728775544834, 'bull_strategy': 'mean_reversion', 'bull_bb_std_mult': 3.2945589885967235, 'bull_rsi_os': 37, 'bull_rsi_ob': 73, 'bull_adx_thresh': 13.820561811842774, 'bull_atr_min_pct': 0.013326219043934363, 'bull_atr_max_pct': 0.038094220879557134, 'bull_tp_mult': 2.7214764886188525, 'bull_tsl_mult': 0.8858966630251702, 'bull_time_stop': 30, 'bull_use_sma': True, 'bull_use_ema': False, 'bull_use_atr': True, 'bull_use_adx': False, 'bull_use_spike': True, 'bull_rsi_required': False, 'bear_strategy': 'breakout', 'bear_bb_std_mult': 2.7185602495710257, 'bear_rsi_os': 12, 'bear_rsi_ob': 49, 'bear_adx_thresh': 22.526397259540882, 'bear_atr_min_pct': 0.006336145542971831, 'bear_atr_max_pct': 0.03891379930878928, 'bear_tp_mult': 2.638491665380384, 'bear_tsl_mult': 0.39891117974457346, 'bear_time_stop': 23, 'bear_use_sma': False, 'bear_use_ema': True, 'bear_use_atr': False, 'bear_use_adx': True, 'bear_use_spike': True, 'bear_rsi_required': False, 'sideways_strategy': 'breakout', 'sideways_bb_std_mult': 2.153848262311273, 'sideways_rsi_os': 44, 'sideways_rsi_ob': 65, 'sideways_adx_thresh': 32.173937256075305, 'sideways_atr_min_pct': 0.004711825256787212, 'sideways_atr_max_pct': 0.01652255095549326, 'sideways_tp_mult': 1.086976026886383, 'sideways_tsl_mult': 0.6910350031270842, 'sideways_time_stop': 196, 'sideways_use_sma': False, 'sideways_use_ema': True, 'sideways_use_atr': False, 'sideways_use_adx': False, 'sideways_use_spike': False, 'sideways_rsi_required': False}.
