[I 2025-08-29 20:43:54,625] Trial 578 finished with values: [-1000000000.0, 1000000000.0] and parameters: {'p_sma': 47, 'p_std': 53, 'p_atr': 24, 'p_adx': 9, 'rsi_period': 62, 'ema1': 26, 'ema2': 52, 'slip_atr_k': 0.00855367294091252, 'slip_spread_k': 0.08206911691780205, 'spread_hl_frac': 0.007042160935996539, 'bb_std_mult': 2.525227647176342, 'rsi_os': 6, 'rsi_ob': 83, 'vol_spike': 0.17500318013355995, 'adx_thresh': 28.245621259958046, 'atr_min_pct': 0.018236536715527826, 'atr_max_pct': 0.028795044109710042, 'tp_mult': 2.219786988000525, 'tsl_mult': 0.8779718766880554, 'strategy': 'mean_reversion', 'time_stop': 166, 'use_sma': True, 'use_atr': False, 'use_adx': False, 'use_ema': True, 'use_spike': False, 'rsi_required': False, 'edge_k': 1.1087003529512738, 'edge_cap': 0.5685145190260152, 'bull_strategy': 'mean_reversion', 'bull_bb_std_mult': 2.4439790126696828, 'bull_rsi_os': 11, 'bull_rsi_ob': 72, 'bull_adx_thresh': 13.04731851194567, 'bull_atr_min_pct': 0.027420874887179415, 'bull_atr_max_pct': 0.09630510595934123, 'bull_tp_mult': 2.651199638123653, 'bull_tsl_mult': 0.8570543336900291, 'bull_time_stop': 41, 'bull_use_sma': True, 'bull_use_ema': False, 'bull_use_atr': False, 'bull_use_adx': False, 'bull_use_spike': True, 'bull_rsi_required': False, 'bear_strategy': 'breakout', 'bear_bb_std_mult': 2.4996567246613206, 'bear_rsi_os': 27, 'bear_rsi_ob': 56, 'bear_adx_thresh': 20.098348838339327, 'bear_atr_min_pct': 0.00377220420245965, 'bear_atr_max_pct': 0.05123825735004763, 'bear_tp_mult': 2.543655515138695, 'bear_tsl_mult': 0.8839903702868739, 'bear_time_stop': 197, 'bear_use_sma': False, 'bear_use_ema': True, 'bear_use_atr': False, 'bear_use_adx': True, 'bear_use_spike': True, 'bear_rsi_required': False, 'sideways_strategy': 'breakout', 'sideways_bb_std_mult': 2.9928560637638317, 'sideways_rsi_os': 33, 'sideways_rsi_ob': 72, 'sideways_adx_thresh': 33.62615363915802, 'sideways_atr_min_pct': 0.005561606782482832, 'sideways_atr_max_pct': 0.021546004629620627, 'sideways_tp_mult': 1.6736950680217109, 'sideways_tsl_mult': 0.14482684062376833, 'sideways_time_stop': 184, 'sideways_use_sma': False, 'sideways_use_ema': False, 'sideways_use_atr': True, 'sideways_use_adx': False, 'sideways_use_spike': False, 'sideways_rsi_required': False}.
[I 2025-08-29 20:43:54,669] Trial 576 finished with values: [-0.0015068243502927015, 0.002116197364445542] and parameters: {'p_sma': 33, 'p_std': 36, 'p_atr': 23, 'p_adx': 9, 'rsi_period': 41, 'ema1': 26, 'ema2': 47, 'slip_atr_k': 0.01954107987779258, 'slip_spread_k': 0.23608771655563848, 'spread_hl_frac': 0.04906061426234865, 'bb_std_mult': 3.4056097165650763, 'rsi_os': 9, 'rsi_ob': 83, 'vol_spike': 0.17579870289476546, 'adx_thresh': 24.743130611189457, 'atr_min_pct': 0.011169966004112387, 'atr_max_pct': 0.14579726415076866, 'tp_mult': 1.2445903238939888, 'tsl_mult': 0.9386113741581208, 'strategy': 'mean_reversion', 'time_stop': 165, 'use_sma': True, 'use_atr': True, 'use_adx': False, 'use_ema': True, 'use_spike': False, 'rsi_required': False, 'edge_k': 1.1033840814313067, 'edge_cap': 0.5942685266803405, 'bull_strategy': 'mean_reversion', 'bull_bb_std_mult': 1.0680226651175477, 'bull_rsi_os': 24, 'bull_rsi_ob': 73, 'bull_adx_thresh': 28.118054313459346, 'bull_atr_min_pct': 0.01551362095923511, 'bull_atr_max_pct': 0.07779965216140838, 'bull_tp_mult': 2.664543551999007, 'bull_tsl_mult': 0.937467005190309, 'bull_time_stop': 44, 'bull_use_sma': True, 'bull_use_ema': False, 'bull_use_atr': False, 'bull_use_adx': False, 'bull_use_spike': True, 'bull_rsi_required': True, 'bear_strategy': 'breakout', 'bear_bb_std_mult': 1.6508184041764955, 'bear_rsi_os': 27, 'bear_rsi_ob': 68, 'bear_adx_thresh': 24.387069822136446, 'bear_atr_min_pct': 0.0074537289035847085, 'bear_atr_max_pct': 0.07448177058237909, 'bear_tp_mult': 2.087781152623513, 'bear_tsl_mult': 0.8921342176288979, 'bear_time_stop': 44, 'bear_use_sma': False, 'bear_use_ema': True, 'bear_use_atr': False, 'bear_use_adx': True, 'bear_use_spike': True, 'bear_rsi_required': False, 'sideways_strategy': 'breakout', 'sideways_bb_std_mult': 2.300153561077769, 'sideways_rsi_os': 42, 'sideways_rsi_ob': 82, 'sideways_adx_thresh': 33.27969202261747, 'sideways_atr_min_pct': 0.004334503663114204, 'sideways_atr_max_pct': 0.021174713085177918, 'sideways_tp_mult': 1.2623602742808464, 'sideways_tsl_mult': 0.7023449361602236, 'sideways_time_stop': 211, 'sideways_use_sma': False, 'sideways_use_ema': False, 'sideways_use_atr': True, 'sideways_use_adx': False, 'sideways_use_spike': False, 'sideways_rsi_required': False}.
[I 2025-08-29 20:43:54,804] Trial 577 finished with values: [-1000000000.0, 1000000000.0] and parameters: {'p_sma': 22, 'p_std': 55, 'p_atr': 23, 'p_adx': 12, 'rsi_period': 61, 'ema1': 26, 'ema2': 44, 'slip_atr_k': 0.020328374428329042, 'slip_spread_k': 0.6027834249033109, 'spread_hl_frac': 0.043385158927803036, 'bb_std_mult': 1.7289251081047812, 'rsi_os': 40, 'rsi_ob': 81, 'vol_spike': 0.17618556647370648, 'adx_thresh': 12.287724311189638, 'atr_min_pct': 0.01016027288258645, 'atr_max_pct': 0.025101864132887182, 'tp_mult': 1.368304604890547, 'tsl_mult': 0.26913634307931966, 'strategy': 'mean_reversion', 'time_stop': 231, 'use_sma': True, 'use_atr': True, 'use_adx': False, 'use_ema': True, 'use_spike': False, 'rsi_required': False, 'edge_k': 0.05185336813647656, 'edge_cap': 0.5983335348566297, 'bull_strategy': 'mean_reversion', 'bull_bb_std_mult': 2.9419011194424356, 'bull_rsi_os': 23, 'bull_rsi_ob': 73, 'bull_adx_thresh': 13.108827241591637, 'bull_atr_min_pct': 0.004766191507204302, 'bull_atr_max_pct': 0.13507903393669646, 'bull_tp_mult': 2.55853714118251, 'bull_tsl_mult': 0.0023313407099024297, 'bull_time_stop': 43, 'bull_use_sma': True, 'bull_use_ema': False, 'bull_use_atr': False, 'bull_use_adx': False, 'bull_use_spike': True, 'bull_rsi_required': True, 'bear_strategy': 'breakout', 'bear_bb_std_mult': 3.0661776135486476, 'bear_rsi_os': 27, 'bear_rsi_ob': 87, 'bear_adx_thresh': 19.48804043679325, 'bear_atr_min_pct': 0.0037420419298393576, 'bear_atr_max_pct': 0.12438505317516624, 'bear_tp_mult': 2.6333506891914706, 'bear_tsl_mult': 0.8891981472131149, 'bear_time_stop': 46, 'bear_use_sma': False, 'bear_use_ema': True, 'bear_use_atr': False, 'bear_use_adx': True, 'bear_use_spike': True, 'bear_rsi_required': False, 'sideways_strategy': 'breakout', 'sideways_bb_std_mult': 2.2894791548661035, 'sideways_rsi_os': 33, 'sideways_rsi_ob': 82, 'sideways_adx_thresh': 33.77361926201637, 'sideways_atr_min_pct': 0.013603438461212312, 'sideways_atr_max_pct': 0.022110774047750914, 'sideways_tp_mult': 1.1267283498533545, 'sideways_tsl_mult': 0.14313465973094947, 'sideways_time_stop': 182, 'sideways_use_sma': False, 'sideways_use_ema': False, 'sideways_use_atr': True, 'sideways_use_adx': False, 'sideways_use_spike': False, 'sideways_rsi_required': False}.
[I 2025-08-29 20:44:24,557] Trial 579 finished with values: [-1000000000.0, 1000000000.0] and parameters: {'p_sma': 51, 'p_std': 59, 'p_atr': 23, 'p_adx': 22, 'rsi_period': 61, 'ema1': 26, 'ema2': 58, 'slip_atr_k': 0.1438166639423307, 'slip_spread_k': 0.16281650584445834, 'spread_hl_frac': 0.006262929984832653, 'bb_std_mult': 3.3904139230366654, 'rsi_os': 9, 'rsi_ob': 56, 'vol_spike': 0.2779132637819818, 'adx_thresh': 10.0218478789276, 'atr_min_pct': 0.01024293698535577, 'atr_max_pct': 0.1457109699820926, 'tp_mult': 1.479514411988132, 'tsl_mult': 0.877888708641122, 'strategy': 'mean_reversion', 'time_stop': 281, 'use_sma': True, 'use_atr': False, 'use_adx': False, 'use_ema': True, 'use_spike': False, 'rsi_required': False, 'edge_k': 1.6048733255177599, 'edge_cap': 0.5694165967982974, 'bull_strategy': 'mean_reversion', 'bull_bb_std_mult': 1.0549741016583338, 'bull_rsi_os': 23, 'bull_rsi_ob': 59, 'bull_adx_thresh': 14.773265190783954, 'bull_atr_min_pct': 0.01611590524497523, 'bull_atr_max_pct': 0.07911859934812555, 'bull_tp_mult': 2.643002084113919, 'bull_tsl_mult': 0.877705049458795, 'bull_time_stop': 23, 'bull_use_sma': True, 'bull_use_ema': False, 'bull_use_atr': True, 'bull_use_adx': False, 'bull_use_spike': True, 'bull_rsi_required': False, 'bear_strategy': 'breakout', 'bear_bb_std_mult': 2.7200840151447783, 'bear_rsi_os': 28, 'bear_rsi_ob': 67, 'bear_adx_thresh': 19.574624872414038, 'bear_atr_min_pct': 0.02759647035528641, 'bear_atr_max_pct': 0.010065056295606334, 'bear_tp_mult': 2.6256687734906525, 'bear_tsl_mult': 0.8903829240826142, 'bear_time_stop': 45, 'bear_use_sma': False, 'bear_use_ema': True, 'bear_use_atr': False, 'bear_use_adx': True, 'bear_use_spike': True, 'bear_rsi_required': False, 'sideways_strategy': 'breakout', 'sideways_bb_std_mult': 2.1531661482095172, 'sideways_rsi_os': 47, 'sideways_rsi_ob': 72, 'sideways_adx_thresh': 33.66280036493044, 'sideways_atr_min_pct': 0.013720780437537163, 'sideways_atr_max_pct': 0.016988226269408956, 'sideways_tp_mult': 1.013023514883116, 'sideways_tsl_mult': 0.701569311514631, 'sideways_time_stop': 183, 'sideways_use_sma': False, 'sideways_use_ema': False, 'sideways_use_atr': False, 'sideways_use_adx': False, 'sideways_use_spike': False, 'sideways_rsi_required': False}.
[I 2025-08-29 20:44:25,106] Trial 581 finished with values: [-1000000000.0, 1000000000.0] and parameters: {'p_sma': 53, 'p_std': 19, 'p_atr': 25, 'p_adx': 29, 'rsi_period': 79, 'ema1': 26, 'ema2': 17, 'slip_atr_k': 0.21166221190791198, 'slip_spread_k': 0.7256891394457045, 'spread_hl_frac': 0.04915305126223477, 'bb_std_mult': 1.8382248079211796, 'rsi_os': 8, 'rsi_ob': 74, 'vol_spike': 0.052270912339896586, 'adx_thresh': 22.928909181481895, 'atr_min_pct': 0.029146672796376453, 'atr_max_pct': 0.08130248904124769, 'tp_mult': 1.3816371236636646, 'tsl_mult': 0.3505386431962457, 'strategy': 'breakout', 'time_stop': 212, 'use_sma': True, 'use_atr': False, 'use_adx': True, 'use_ema': False, 'use_spike': True, 'rsi_required': False, 'edge_k': 0.06420908810313286, 'edge_cap': 0.6278744718192054, 'bull_strategy': 'mean_reversion', 'bull_bb_std_mult': 3.2168876321883073, 'bull_rsi_os': 23, 'bull_rsi_ob': 69, 'bull_adx_thresh': 14.757555335197868, 'bull_atr_min_pct': 0.0028539294615435844, 'bull_atr_max_pct': 0.14627218873085468, 'bull_tp_mult': 2.7364692867774005, 'bull_tsl_mult': 0.8855991337930045, 'bull_time_stop': 25, 'bull_use_sma': True, 'bull_use_ema': True, 'bull_use_atr': True, 'bull_use_adx': False, 'bull_use_spike': False, 'bull_rsi_required': False, 'bear_strategy': 'mean_reversion', 'bear_bb_std_mult': 2.7247956400913247, 'bear_rsi_os': 29, 'bear_rsi_ob': 94, 'bear_adx_thresh': 22.72205656948305, 'bear_atr_min_pct': 0.00503813377951539, 'bear_atr_max_pct': 0.1252213090039917, 'bear_tp_mult': 2.632032588069979, 'bear_tsl_mult': 0.9322654626962843, 'bear_time_stop': 61, 'bear_use_sma': False, 'bear_use_ema': True, 'bear_use_atr': False, 'bear_use_adx': False, 'bear_use_spike': True, 'bear_rsi_required': True, 'sideways_strategy': 'mean_reversion', 'sideways_bb_std_mult': 2.150066855199031, 'sideways_rsi_os': 47, 'sideways_rsi_ob': 54, 'sideways_adx_thresh': 26.661425034886577, 'sideways_atr_min_pct': 0.005100865090669163, 'sideways_atr_max_pct': 0.015781623368435173, 'sideways_tp_mult': 1.0102837489746856, 'sideways_tsl_mult': 0.6740496167171536, 'sideways_time_stop': 147, 'sideways_use_sma': False, 'sideways_use_ema': False, 'sideways_use_atr': False, 'sideways_use_adx': False, 'sideways_use_spike': False, 'sideways_rsi_required': False}.
[I 2025-08-29 20:44:25,259] Trial 580 finished with values: [-1000000000.0, 1000000000.0] and parameters: {'p_sma': 19, 'p_std': 56, 'p_atr': 23, 'p_adx': 13, 'rsi_period': 39, 'ema1': 26, 'ema2': 17, 'slip_atr_k': 0.11620859132393284, 'slip_spread_k': 0.6065652630146772, 'spread_hl_frac': 0.04906358532965086, 'bb_std_mult': 1.7682739393902245, 'rsi_os': 49, 'rsi_ob': 82, 'vol_spike': 0.0508561033933308, 'adx_thresh': 11.920886637695514, 'atr_min_pct': 0.010100042015068167, 'atr_max_pct': 0.14536142078574787, 'tp_mult': 1.4535746453091947, 'tsl_mult': 0.3439974586036516, 'strategy': 'breakout', 'time_stop': 280, 'use_sma': True, 'use_atr': False, 'use_adx': False, 'use_ema': True, 'use_spike': False, 'rsi_required': False, 'edge_k': 0.0022363242666050276, 'edge_cap': 0.625784979907156, 'bull_strategy': 'mean_reversion', 'bull_bb_std_mult': 0.636666304593501, 'bull_rsi_os': 50, 'bull_rsi_ob': 67, 'bull_adx_thresh': 14.755961718353666, 'bull_atr_min_pct': 0.016124691981792325, 'bull_atr_max_pct': 0.09400966852920756, 'bull_tp_mult': 2.7363092611083224, 'bull_tsl_mult': 0.8775536507876102, 'bull_time_stop': 77, 'bull_use_sma': True, 'bull_use_ema': False, 'bull_use_atr': True, 'bull_use_adx': False, 'bull_use_spike': True, 'bull_rsi_required': False, 'bear_strategy': 'breakout', 'bear_bb_std_mult': 3.0713620916435636, 'bear_rsi_os': 28, 'bear_rsi_ob': 68, 'bear_adx_thresh': 19.193322751842917, 'bear_atr_min_pct': 0.00547274432798856, 'bear_atr_max_pct': 0.04462013848983752, 'bear_tp_mult': 2.6279999059967096, 'bear_tsl_mult': 0.9045350539974956, 'bear_time_stop': 45, 'bear_use_sma': False, 'bear_use_ema': True, 'bear_use_atr': False, 'bear_use_adx': True, 'bear_use_spike': True, 'bear_rsi_required': False, 'sideways_strategy': 'breakout', 'sideways_bb_std_mult': 3.375284033582995, 'sideways_rsi_os': 47, 'sideways_rsi_ob': 80, 'sideways_adx_thresh': 33.391868369537114, 'sideways_atr_min_pct': 0.004966032601189851, 'sideways_atr_max_pct': 0.05166103748998068, 'sideways_tp_mult': 1.3908927273311926, 'sideways_tsl_mult': 0.7660434418583846, 'sideways_time_stop': 147, 'sideways_use_sma': False, 'sideways_use_ema': False, 'sideways_use_atr': False, 'sideways_use_adx': False, 'sideways_use_spike': False, 'sideways_rsi_required': False}.
[I 2025-08-29 20:44:25,273] Trial 582 finished with values: [-1000000000.0, 1000000000.0] and parameters: {'p_sma': 20, 'p_std': 59, 'p_atr': 25, 'p_adx': 13, 'rsi_period': 36, 'ema1': 25, 'ema2': 34, 'slip_atr_k': 0.005672772675176657, 'slip_spread_k': 0.1504256205710569, 'spread_hl_frac': 0.048852912594626006, 'bb_std_mult': 1.7933851502917204, 'rsi_os': 8, 'rsi_ob': 77, 'vol_spike': 0.18366129331502917, 'adx_thresh': 11.162637057551342, 'atr_min_pct': 0.01964923016167555, 'atr_max_pct': 0.03413633555867654, 'tp_mult': 1.4747848117831817, 'tsl_mult': 0.9106450248200324, 'strategy': 'breakout', 'time_stop': 202, 'use_sma': True, 'use_atr': False, 'use_adx': True, 'use_ema': False, 'use_spike': True, 'rsi_required': False, 'edge_k': 0.997593254546432, 'edge_cap': 0.628867497539714, 'bull_strategy': 'mean_reversion', 'bull_bb_std_mult': 3.23513683848086, 'bull_rsi_os': 46, 'bull_rsi_ob': 69, 'bull_adx_thresh': 14.76619668950873, 'bull_atr_min_pct': 0.0161622495572539, 'bull_atr_max_pct': 0.08812016489055127, 'bull_tp_mult': 2.7404835706720245, 'bull_tsl_mult': 0.8756778569294436, 'bull_time_stop': 25, 'bull_use_sma': True, 'bull_use_ema': True, 'bull_use_atr': True, 'bull_use_adx': False, 'bull_use_spike': False, 'bull_rsi_required': False, 'bear_strategy': 'mean_reversion', 'bear_bb_std_mult': 2.727246237421306, 'bear_rsi_os': 14, 'bear_rsi_ob': 67, 'bear_adx_thresh': 23.152422577897084, 'bear_atr_min_pct': 0.0051663889179998385, 'bear_atr_max_pct': 0.04509802739288149, 'bear_tp_mult': 2.6239810706776163, 'bear_tsl_mult': 0.9260961216551642, 'bear_time_stop': 58, 'bear_use_sma': False, 'bear_use_ema': True, 'bear_use_atr': False, 'bear_use_adx': False, 'bear_use_spike': True, 'bear_rsi_required': True, 'sideways_strategy': 'mean_reversion', 'sideways_bb_std_mult': 2.531313062287865, 'sideways_rsi_os': 47, 'sideways_rsi_ob': 78, 'sideways_adx_thresh': 32.44214019360041, 'sideways_atr_min_pct': 0.004930878313626442, 'sideways_atr_max_pct': 0.018102694104884635, 'sideways_tp_mult': 1.613276341034123, 'sideways_tsl_mult': 0.6705016157910733, 'sideways_time_stop': 152, 'sideways_use_sma': False, 'sideways_use_ema': False, 'sideways_use_atr': False, 'sideways_use_adx': False, 'sideways_use_spike': False, 'sideways_rsi_required': True}.
[I 2025-08-29 20:44:26,017] Trial 586 finished with values: [-1000000000.0, 1000000000.0] and parameters: {'p_sma': 16, 'p_std': 58, 'p_atr': 26, 'p_adx': 13, 'rsi_period': 31, 'ema1': 27, 'ema2': 45, 'slip_atr_k': 0.012216712941455106, 'slip_spread_k': 0.3664504348947397, 'spread_hl_frac': 0.04713713526470366, 'bb_std_mult': 1.5773467544331816, 'rsi_os': 10, 'rsi_ob': 89, 'vol_spike': 0.02824653219379694, 'adx_thresh': 13.056804833151618, 'atr_min_pct': 0.029925418932481903, 'atr_max_pct': 0.01771643763889788, 'tp_mult': 1.2225572147516788, 'tsl_mult': 0.4898081673897555, 'strategy': 'mean_reversion', 'time_stop': 173, 'use_sma': False, 'use_atr': False, 'use_adx': False, 'use_ema': True, 'use_spike': False, 'rsi_required': True, 'edge_k': 1.0064098861223123, 'edge_cap': 0.5747510363927901, 'bull_strategy': 'breakout', 'bull_bb_std_mult': 1.2599830331578339, 'bull_rsi_os': 13, 'bull_rsi_ob': 74, 'bull_adx_thresh': 31.83439182552776, 'bull_atr_min_pct': 0.023568059453421244, 'bull_atr_max_pct': 0.1397920789455835, 'bull_tp_mult': 1.3052108312789281, 'bull_tsl_mult': 0.8281566714969941, 'bull_time_stop': 35, 'bull_use_sma': False, 'bull_use_ema': False, 'bull_use_atr': True, 'bull_use_adx': True, 'bull_use_spike': True, 'bull_rsi_required': False, 'bear_strategy': 'breakout', 'bear_bb_std_mult': 1.435496362926553, 'bear_rsi_os': 6, 'bear_rsi_ob': 66, 'bear_adx_thresh': 21.77638433704758, 'bear_atr_min_pct': 0.02637522523040718, 'bear_atr_max_pct': 0.05577640885506452, 'bear_tp_mult': 2.7337131621767714, 'bear_tsl_mult': 0.9556751789255199, 'bear_time_stop': 243, 'bear_use_sma': True, 'bear_use_ema': False, 'bear_use_atr': True, 'bear_use_adx': True, 'bear_use_spike': False, 'bear_rsi_required': False, 'sideways_strategy': 'breakout', 'sideways_bb_std_mult': 2.236384128901164, 'sideways_rsi_os': 49, 'sideways_rsi_ob': 50, 'sideways_adx_thresh': 24.424765096592335, 'sideways_atr_min_pct': 0.02476524201145512, 'sideways_atr_max_pct': 0.09871204693727578, 'sideways_tp_mult': 1.0742591920662365, 'sideways_tsl_mult': 0.7286292558238673, 'sideways_time_stop': 195, 'sideways_use_sma': True, 'sideways_use_ema': False, 'sideways_use_atr': False, 'sideways_use_adx': True, 'sideways_use_spike': True, 'sideways_rsi_required': True}.
[I 2025-08-29 20:44:54,983] Trial 585 finished with values: [-1000000000.0, 1000000000.0] and parameters: {'p_sma': 11, 'p_std': 58, 'p_atr': 25, 'p_adx': 13, 'rsi_period': 36, 'ema1': 25, 'ema2': 45, 'slip_atr_k': 0.006257468363775284, 'slip_spread_k': 0.7893671598959017, 'spread_hl_frac': 0.009272671625212937, 'bb_std_mult': 1.5825066781337642, 'rsi_os': 10, 'rsi_ob': 86, 'vol_spike': 0.1830789643481112, 'adx_thresh': 13.007051303598539, 'atr_min_pct': 0.019756835548046817, 'atr_max_pct': 0.13812564844713818, 'tp_mult': 1.2067774441533334, 'tsl_mult': 0.9055393776924094, 'strategy': 'mean_reversion', 'time_stop': 173, 'use_sma': False, 'use_atr': False, 'use_adx': True, 'use_ema': False, 'use_spike': True, 'rsi_required': True, 'edge_k': 1.0140854258482903, 'edge_cap': 0.5594515065285675, 'bull_strategy': 'breakout', 'bull_bb_std_mult': 3.0827612251692607, 'bull_rsi_os': 51, 'bull_rsi_ob': 74, 'bull_adx_thresh': 14.085332815655232, 'bull_atr_min_pct': 0.008927973681599451, 'bull_atr_max_pct': 0.0890828069291328, 'bull_tp_mult': 1.3016594272930773, 'bull_tsl_mult': 0.401636901335674, 'bull_time_stop': 6, 'bull_use_sma': False, 'bull_use_ema': True, 'bull_use_atr': True, 'bull_use_adx': True, 'bull_use_spike': False, 'bull_rsi_required': False, 'bear_strategy': 'mean_reversion', 'bear_bb_std_mult': 3.2450630042402855, 'bear_rsi_os': 19, 'bear_rsi_ob': 66, 'bear_adx_thresh': 29.035565505121134, 'bear_atr_min_pct': 0.006745433502023581, 'bear_atr_max_pct': 0.056002059086660574, 'bear_tp_mult': 2.7166690933928495, 'bear_tsl_mult': 0.960749200126112, 'bear_time_stop': 74, 'bear_use_sma': True, 'bear_use_ema': False, 'bear_use_atr': True, 'bear_use_adx': False, 'bear_use_spike': False, 'bear_rsi_required': True, 'sideways_strategy': 'mean_reversion', 'sideways_bb_std_mult': 2.2085526702659033, 'sideways_rsi_os': 49, 'sideways_rsi_ob': 78, 'sideways_adx_thresh': 32.1275957082625, 'sideways_atr_min_pct': 0.019723397943183778, 'sideways_atr_max_pct': 0.02507101833657509, 'sideways_tp_mult': 2.9456371023501227, 'sideways_tsl_mult': 0.7222451669950877, 'sideways_time_stop': 194, 'sideways_use_sma': True, 'sideways_use_ema': False, 'sideways_use_atr': False, 'sideways_use_adx': True, 'sideways_use_spike': True, 'sideways_rsi_required': True}.
