[I 2025-08-29 20:36:11,842] Trial 505 finished with values: [-0.002532275656549565, 0.003147625776663098] and parameters: {'p_sma': 8, 'p_std': 57, 'p_atr': 30, 'p_adx': 12, 'rsi_period': 38, 'ema1': 27, 'ema2': 46, 'slip_atr_k': 0.1358203159080735, 'slip_spread_k': 0.08260199551015907, 'spread_hl_frac': 0.04994812390959547, 'bb_std_mult': 2.893354239686963, 'rsi_os': 28, 'rsi_ob': 82, 'vol_spike': 0.08348335006287859, 'adx_thresh': 22.84517415590757, 'atr_min_pct': 0.021492207499644842, 'atr_max_pct': 0.03186995609307057, 'tp_mult': 2.9261934236120983, 'tsl_mult': 0.8828362809680145, 'strategy': 'mean_reversion', 'time_stop': 53, 'use_sma': True, 'use_atr': False, 'use_adx': False, 'use_ema': True, 'use_spike': False, 'rsi_required': False, 'edge_k': 0.32822656083262736, 'edge_cap': 0.41393520601383377, 'bull_strategy': 'breakout', 'bull_bb_std_mult': 3.0537103291700536, 'bull_rsi_os': 20, 'bull_rsi_ob': 71, 'bull_adx_thresh': 34.29953158863546, 'bull_atr_min_pct': 0.01763425323210379, 'bull_atr_max_pct': 0.0734415799230288, 'bull_tp_mult': 1.0284284084724824, 'bull_tsl_mult': 0.8773595832049971, 'bull_time_stop': 42, 'bull_use_sma': True, 'bull_use_ema': False, 'bull_use_atr': True, 'bull_use_adx': False, 'bull_use_spike': True, 'bull_rsi_required': False, 'bear_strategy': 'breakout', 'bear_bb_std_mult': 2.727130879772832, 'bear_rsi_os': 46, 'bear_rsi_ob': 65, 'bear_adx_thresh': 16.638889396948613, 'bear_atr_min_pct': 0.005878813726837042, 'bear_atr_max_pct': 0.05017929430510284, 'bear_tp_mult': 2.7607368011201845, 'bear_tsl_mult': 0.9573487385769185, 'bear_time_stop': 163, 'bear_use_sma': False, 'bear_use_ema': True, 'bear_use_atr': False, 'bear_use_adx': True, 'bear_use_spike': True, 'bear_rsi_required': False, 'sideways_strategy': 'breakout', 'sideways_bb_std_mult': 2.401442144588909, 'sideways_rsi_os': 48, 'sideways_rsi_ob': 81, 'sideways_adx_thresh': 32.975295611633335, 'sideways_atr_min_pct': 0.0033752420327614364, 'sideways_atr_max_pct': 0.09017529312079074, 'sideways_tp_mult': 1.0917490227094588, 'sideways_tsl_mult': 0.16327002280696779, 'sideways_time_stop': 96, 'sideways_use_sma': False, 'sideways_use_ema': False, 'sideways_use_atr': False, 'sideways_use_adx': False, 'sideways_use_spike': False, 'sideways_rsi_required': False}.
[I 2025-08-29 20:36:12,009] Trial 504 finished with values: [-0.0012649878412055449, 0.0019961532812888334] and parameters: {'p_sma': 55, 'p_std': 7, 'p_atr': 21, 'p_adx': 12, 'rsi_period': 39, 'ema1': 27, 'ema2': 47, 'slip_atr_k': 2.4227564278983386e-05, 'slip_spread_k': 0.10774538247858662, 'spread_hl_frac': 0.04995038340201154, 'bb_std_mult': 1.6892328761781117, 'rsi_os': 7, 'rsi_ob': 82, 'vol_spike': 0.1770751086260873, 'adx_thresh': 12.480634356250667, 'atr_min_pct': 0.0247762721937681, 'atr_max_pct': 0.031398073420875264, 'tp_mult': 2.562036476140472, 'tsl_mult': 0.7201813643832593, 'strategy': 'mean_reversion', 'time_stop': 123, 'use_sma': True, 'use_atr': False, 'use_adx': False, 'use_ema': True, 'use_spike': False, 'rsi_required': False, 'edge_k': 1.8172048842131554, 'edge_cap': 0.5624326049961459, 'bull_strategy': 'breakout', 'bull_bb_std_mult': 3.0176914968522586, 'bull_rsi_os': 20, 'bull_rsi_ob': 76, 'bull_adx_thresh': 34.74587863043615, 'bull_atr_min_pct': 0.01748658789216352, 'bull_atr_max_pct': 0.09630880668312733, 'bull_tp_mult': 2.5478279884499697, 'bull_tsl_mult': 0.8784092701130035, 'bull_time_stop': 259, 'bull_use_sma': True, 'bull_use_ema': False, 'bull_use_atr': True, 'bull_use_adx': False, 'bull_use_spike': True, 'bull_rsi_required': False, 'bear_strategy': 'breakout', 'bear_bb_std_mult': 2.728192618586247, 'bear_rsi_os': 23, 'bear_rsi_ob': 82, 'bear_adx_thresh': 20.210282540989038, 'bear_atr_min_pct': 0.0057722239259167755, 'bear_atr_max_pct': 0.05135589416467146, 'bear_tp_mult': 2.7642145304380636, 'bear_tsl_mult': 0.32095321325087195, 'bear_time_stop': 37, 'bear_use_sma': False, 'bear_use_ema': True, 'bear_use_atr': False, 'bear_use_adx': True, 'bear_use_spike': True, 'bear_rsi_required': False, 'sideways_strategy': 'breakout', 'sideways_bb_std_mult': 2.139625713336143, 'sideways_rsi_os': 48, 'sideways_rsi_ob': 81, 'sideways_adx_thresh': 31.428103308331806, 'sideways_atr_min_pct': 0.00485448148276454, 'sideways_atr_max_pct': 0.01525648182989162, 'sideways_tp_mult': 1.089008416633693, 'sideways_tsl_mult': 0.6758768492793693, 'sideways_time_stop': 200, 'sideways_use_sma': False, 'sideways_use_ema': False, 'sideways_use_atr': False, 'sideways_use_adx': False, 'sideways_use_spike': False, 'sideways_rsi_required': False}.
[I 2025-08-29 20:36:12,138] Trial 507 finished with values: [-1000000000.0, 1000000000.0] and parameters: {'p_sma': 55, 'p_std': 10, 'p_atr': 26, 'p_adx': 14, 'rsi_period': 45, 'ema1': 26, 'ema2': 47, 'slip_atr_k': 0.0038478399763456302, 'slip_spread_k': 0.8622848110500416, 'spread_hl_frac': 0.04052565269796844, 'bb_std_mult': 3.373396731324137, 'rsi_os': 7, 'rsi_ob': 80, 'vol_spike': 0.08302142668763587, 'adx_thresh': 17.794998947388535, 'atr_min_pct': 0.021415907450471203, 'atr_max_pct': 0.13870538940421695, 'tp_mult': 2.557145376158829, 'tsl_mult': 0.8843129893107962, 'strategy': 'mean_reversion', 'time_stop': 195, 'use_sma': True, 'use_atr': False, 'use_adx': False, 'use_ema': True, 'use_spike': False, 'rsi_required': False, 'edge_k': 1.1454635295772708, 'edge_cap': 0.6959755106761083, 'bull_strategy': 'mean_reversion', 'bull_bb_std_mult': 2.999645900905652, 'bull_rsi_os': 14, 'bull_rsi_ob': 73, 'bull_adx_thresh': 33.09400732271495, 'bull_atr_min_pct': 0.014999818954278104, 'bull_atr_max_pct': 0.0972095501900825, 'bull_tp_mult': 2.7133359764439193, 'bull_tsl_mult': 0.9108634976945966, 'bull_time_stop': 135, 'bull_use_sma': True, 'bull_use_ema': False, 'bull_use_atr': True, 'bull_use_adx': False, 'bull_use_spike': True, 'bull_rsi_required': False, 'bear_strategy': 'breakout', 'bear_bb_std_mult': 2.6121337622566196, 'bear_rsi_os': 17, 'bear_rsi_ob': 93, 'bear_adx_thresh': 20.654328375851453, 'bear_atr_min_pct': 0.005750865523734515, 'bear_atr_max_pct': 0.12725305049829688, 'bear_tp_mult': 2.8416632709324348, 'bear_tsl_mult': 0.3237232620052753, 'bear_time_stop': 38, 'bear_use_sma': False, 'bear_use_ema': True, 'bear_use_atr': False, 'bear_use_adx': True, 'bear_use_spike': True, 'bear_rsi_required': False, 'sideways_strategy': 'breakout', 'sideways_bb_std_mult': 2.903783625355782, 'sideways_rsi_os': 11, 'sideways_rsi_ob': 63, 'sideways_adx_thresh': 33.25261031279726, 'sideways_atr_min_pct': 0.0032537908602686856, 'sideways_atr_max_pct': 0.09063517673371788, 'sideways_tp_mult': 1.087109184328552, 'sideways_tsl_mult': 0.8620063577594058, 'sideways_time_stop': 103, 'sideways_use_sma': False, 'sideways_use_ema': False, 'sideways_use_atr': False, 'sideways_use_adx': False, 'sideways_use_spike': False, 'sideways_rsi_required': False}.
[I 2025-08-29 20:36:12,275] Trial 506 finished with values: [-0.00024778407299475, 0.0019385022715400016] and parameters: {'p_sma': 59, 'p_std': 10, 'p_atr': 30, 'p_adx': 14, 'rsi_period': 39, 'ema1': 26, 'ema2': 57, 'slip_atr_k': 0.00023173130710078978, 'slip_spread_k': 0.17253546730913588, 'spread_hl_frac': 0.042654938980922624, 'bb_std_mult': 0.8899657201678921, 'rsi_os': 36, 'rsi_ob': 80, 'vol_spike': 0.08258824865188398, 'adx_thresh': 12.631626097998126, 'atr_min_pct': 0.017825043765466342, 'atr_max_pct': 0.03182609230010269, 'tp_mult': 2.7172048147683814, 'tsl_mult': 0.8843977523442812, 'strategy': 'mean_reversion', 'time_stop': 87, 'use_sma': True, 'use_atr': False, 'use_adx': False, 'use_ema': True, 'use_spike': False, 'rsi_required': False, 'edge_k': 1.8178247414206667, 'edge_cap': 0.24973202291550956, 'bull_strategy': 'mean_reversion', 'bull_bb_std_mult': 2.9829010560288496, 'bull_rsi_os': 14, 'bull_rsi_ob': 47, 'bull_adx_thresh': 34.98903866041047, 'bull_atr_min_pct': 0.016862815566243118, 'bull_atr_max_pct': 0.09674983717784186, 'bull_tp_mult': 2.720106439142863, 'bull_tsl_mult': 0.905336264333585, 'bull_time_stop': 233, 'bull_use_sma': True, 'bull_use_ema': False, 'bull_use_atr': True, 'bull_use_adx': False, 'bull_use_spike': True, 'bull_rsi_required': False, 'bear_strategy': 'breakout', 'bear_bb_std_mult': 2.6244471914545193, 'bear_rsi_os': 23, 'bear_rsi_ob': 65, 'bear_adx_thresh': 16.515498102698746, 'bear_atr_min_pct': 0.005476866432596161, 'bear_atr_max_pct': 0.04861680242733986, 'bear_tp_mult': 2.7362765160511486, 'bear_tsl_mult': 0.9515240563584804, 'bear_time_stop': 38, 'bear_use_sma': False, 'bear_use_ema': True, 'bear_use_atr': False, 'bear_use_adx': True, 'bear_use_spike': True, 'bear_rsi_required': False, 'sideways_strategy': 'breakout', 'sideways_bb_std_mult': 2.1721801749844523, 'sideways_rsi_os': 47, 'sideways_rsi_ob': 63, 'sideways_adx_thresh': 17.093348344282532, 'sideways_atr_min_pct': 0.004971134933247842, 'sideways_atr_max_pct': 0.014463148958778933, 'sideways_tp_mult': 1.102265992708851, 'sideways_tsl_mult': 0.0023583659153744163, 'sideways_time_stop': 199, 'sideways_use_sma': False, 'sideways_use_ema': False, 'sideways_use_atr': False, 'sideways_use_adx': False, 'sideways_use_spike': False, 'sideways_rsi_required': False}.
[I 2025-08-29 20:36:13,082] Trial 509 finished with values: [-1000000000.0, 1000000000.0] and parameters: {'p_sma': 54, 'p_std': 54, 'p_atr': 26, 'p_adx': 20, 'rsi_period': 35, 'ema1': 26, 'ema2': 43, 'slip_atr_k': 0.004547830227299612, 'slip_spread_k': 0.17335008193584045, 'spread_hl_frac': 0.04036093011868709, 'bb_std_mult': 0.8515003194743598, 'rsi_os': 36, 'rsi_ob': 80, 'vol_spike': 0.17748534397385032, 'adx_thresh': 11.15295830141436, 'atr_min_pct': 0.027804845529157497, 'atr_max_pct': 0.02280706355686964, 'tp_mult': 2.7090656446083092, 'tsl_mult': 0.9069166906368572, 'strategy': 'mean_reversion', 'time_stop': 134, 'use_sma': True, 'use_atr': False, 'use_adx': False, 'use_ema': True, 'use_spike': False, 'rsi_required': False, 'edge_k': 0.37730063603025554, 'edge_cap': 0.6845344663845521, 'bull_strategy': 'mean_reversion', 'bull_bb_std_mult': 2.984153989083393, 'bull_rsi_os': 13, 'bull_rsi_ob': 73, 'bull_adx_thresh': 7.153680034775631, 'bull_atr_min_pct': 0.014974419378764182, 'bull_atr_max_pct': 0.09127441110646367, 'bull_tp_mult': 1.8974588581623217, 'bull_tsl_mult': 0.39563999394875704, 'bull_time_stop': 22, 'bull_use_sma': True, 'bull_use_ema': False, 'bull_use_atr': True, 'bull_use_adx': False, 'bull_use_spike': True, 'bull_rsi_required': False, 'bear_strategy': 'breakout', 'bear_bb_std_mult': 2.9209895979509737, 'bear_rsi_os': 30, 'bear_rsi_ob': 65, 'bear_adx_thresh': 14.75210315627511, 'bear_atr_min_pct': 0.00705356116701952, 'bear_atr_max_pct': 0.1261086804940006, 'bear_tp_mult': 2.7218610722422696, 'bear_tsl_mult': 0.7763808299378827, 'bear_time_stop': 231, 'bear_use_sma': True, 'bear_use_ema': True, 'bear_use_atr': False, 'bear_use_adx': True, 'bear_use_spike': True, 'bear_rsi_required': False, 'sideways_strategy': 'breakout', 'sideways_bb_std_mult': 2.4129223061501888, 'sideways_rsi_os': 50, 'sideways_rsi_ob': 51, 'sideways_adx_thresh': 33.27245769353661, 'sideways_atr_min_pct': 0.005166878822609779, 'sideways_atr_max_pct': 0.02895698765318693, 'sideways_tp_mult': 1.1651483648439704, 'sideways_tsl_mult': 0.7275675176418199, 'sideways_time_stop': 198, 'sideways_use_sma': False, 'sideways_use_ema': False, 'sideways_use_atr': False, 'sideways_use_adx': False, 'sideways_use_spike': False, 'sideways_rsi_required': False}.
[I 2025-08-29 20:36:13,128] Trial 511 finished with values: [-1000000000.0, 1000000000.0] and parameters: {'p_sma': 22, 'p_std': 54, 'p_atr': 12, 'p_adx': 13, 'rsi_period': 35, 'ema1': 26, 'ema2': 43, 'slip_atr_k': 0.05866782969851235, 'slip_spread_k': 0.4804708923724373, 'spread_hl_frac': 0.04223483906138771, 'bb_std_mult': 1.7205074635760016, 'rsi_os': 50, 'rsi_ob': 84, 'vol_spike': 0.17653814709220586, 'adx_thresh': 14.147374708443005, 'atr_min_pct': 0.02769127466754797, 'atr_max_pct': 0.03500837981716755, 'tp_mult': 1.1585625893690885, 'tsl_mult': 0.9490818251471436, 'strategy': 'mean_reversion', 'time_stop': 264, 'use_sma': False, 'use_atr': False, 'use_adx': False, 'use_ema': True, 'use_spike': True, 'rsi_required': False, 'edge_k': 1.0119975145710756, 'edge_cap': 0.6887692931355222, 'bull_strategy': 'mean_reversion', 'bull_bb_std_mult': 2.25855363435221, 'bull_rsi_os': 13, 'bull_rsi_ob': 73, 'bull_adx_thresh': 13.936818733983339, 'bull_atr_min_pct': 0.01602047045395647, 'bull_atr_max_pct': 0.091045650682555, 'bull_tp_mult': 2.303950533323042, 'bull_tsl_mult': 0.9789142626755378, 'bull_time_stop': 20, 'bull_use_sma': False, 'bull_use_ema': False, 'bull_use_atr': True, 'bull_use_adx': False, 'bull_use_spike': True, 'bull_rsi_required': False, 'bear_strategy': 'mean_reversion', 'bear_bb_std_mult': 2.6650673447971696, 'bear_rsi_os': 30, 'bear_rsi_ob': 67, 'bear_adx_thresh': 27.712021247416445, 'bear_atr_min_pct': 0.0071802484252745736, 'bear_atr_max_pct': 0.04752715623770885, 'bear_tp_mult': 2.640038184719315, 'bear_tsl_mult': 0.7717441646946035, 'bear_time_stop': 200, 'bear_use_sma': True, 'bear_use_ema': True, 'bear_use_atr': False, 'bear_use_adx': True, 'bear_use_spike': False, 'bear_rsi_required': True, 'sideways_strategy': 'breakout', 'sideways_bb_std_mult': 2.2534016506640273, 'sideways_rsi_os': 50, 'sideways_rsi_ob': 51, 'sideways_adx_thresh': 5.375920220732397, 'sideways_atr_min_pct': 0.006792022387099373, 'sideways_atr_max_pct': 0.028043284844575224, 'sideways_tp_mult': 1.0454064784960806, 'sideways_tsl_mult': 0.7318972739839498, 'sideways_time_stop': 199, 'sideways_use_sma': True, 'sideways_use_ema': False, 'sideways_use_atr': False, 'sideways_use_adx': False, 'sideways_use_spike': True, 'sideways_rsi_required': False}.
[I 2025-08-29 20:36:39,280] Trial 510 finished with values: [-1000000000.0, 1000000000.0] and parameters: {'p_sma': 50, 'p_std': 54, 'p_atr': 25, 'p_adx': 24, 'rsi_period': 35, 'ema1': 26, 'ema2': 43, 'slip_atr_k': 0.006695568024707364, 'slip_spread_k': 0.16403440336194297, 'spread_hl_frac': 0.04250944035971517, 'bb_std_mult': 0.9052018338386678, 'rsi_os': 11, 'rsi_ob': 80, 'vol_spike': 0.17561173918795964, 'adx_thresh': 14.350312938330163, 'atr_min_pct': 0.02076728360310927, 'atr_max_pct': 0.02395117064087754, 'tp_mult': 1.8966641828847282, 'tsl_mult': 0.9583949569543689, 'strategy': 'mean_reversion', 'time_stop': 238, 'use_sma': True, 'use_atr': False, 'use_adx': False, 'use_ema': True, 'use_spike': True, 'rsi_required': False, 'edge_k': 1.0106789473833893, 'edge_cap': 0.15675579807790618, 'bull_strategy': 'mean_reversion', 'bull_bb_std_mult': 3.217530769591754, 'bull_rsi_os': 22, 'bull_rsi_ob': 74, 'bull_adx_thresh': 12.418476199528033, 'bull_atr_min_pct': 0.01581366368750466, 'bull_atr_max_pct': 0.09105424793279142, 'bull_tp_mult': 1.9887292574260464, 'bull_tsl_mult': 0.9085176689347473, 'bull_time_stop': 26, 'bull_use_sma': True, 'bull_use_ema': False, 'bull_use_atr': True, 'bull_use_adx': False, 'bull_use_spike': True, 'bull_rsi_required': False, 'bear_strategy': 'mean_reversion', 'bear_bb_std_mult': 2.9084445064624163, 'bear_rsi_os': 43, 'bear_rsi_ob': 65, 'bear_adx_thresh': 8.957996248093474, 'bear_atr_min_pct': 0.007119199149696481, 'bear_atr_max_pct': 0.04788300910293678, 'bear_tp_mult': 2.2152285017410387, 'bear_tsl_mult': 0.8773213266462372, 'bear_time_stop': 140, 'bear_use_sma': True, 'bear_use_ema': True, 'bear_use_atr': False, 'bear_use_adx': True, 'bear_use_spike': True, 'bear_rsi_required': False, 'sideways_strategy': 'breakout', 'sideways_bb_std_mult': 0.5661163223606342, 'sideways_rsi_os': 50, 'sideways_rsi_ob': 52, 'sideways_adx_thresh': 24.290850830129987, 'sideways_atr_min_pct': 0.020944713674459117, 'sideways_atr_max_pct': 0.027703278492784124, 'sideways_tp_mult': 1.1643217657792104, 'sideways_tsl_mult': 0.41746811336757106, 'sideways_time_stop': 198, 'sideways_use_sma': True, 'sideways_use_ema': False, 'sideways_use_atr': False, 'sideways_use_adx': False, 'sideways_use_spike': False, 'sideways_rsi_required': False}.
[I 2025-08-29 20:36:39,470] Trial 508 finished with values: [-0.0009154464159996101, 0.002137491827335882] and parameters: {'p_sma': 55, 'p_std': 54, 'p_atr': 26, 'p_adx': 14, 'rsi_period': 35, 'ema1': 26, 'ema2': 22, 'slip_atr_k': 9.298956372559054e-05, 'slip_spread_k': 0.859210674358832, 'spread_hl_frac': 0.04996893630401646, 'bb_std_mult': 1.6913526943728854, 'rsi_os': 7, 'rsi_ob': 80, 'vol_spike': 0.09985582521389752, 'adx_thresh': 12.65916906112164, 'atr_min_pct': 0.020603200153608694, 'atr_max_pct': 0.02237572264472084, 'tp_mult': 1.4367307766277466, 'tsl_mult': 0.9063135159110588, 'strategy': 'mean_reversion', 'time_stop': 236, 'use_sma': True, 'use_atr': False, 'use_adx': False, 'use_ema': True, 'use_spike': False, 'rsi_required': False, 'edge_k': 1.0010194788892057, 'edge_cap': 0.5556711334620127, 'bull_strategy': 'mean_reversion', 'bull_bb_std_mult': 2.9752975339588987, 'bull_rsi_os': 14, 'bull_rsi_ob': 73, 'bull_adx_thresh': 12.309286573725895, 'bull_atr_min_pct': 0.014946849410670118, 'bull_atr_max_pct': 0.09146639942218936, 'bull_tp_mult': 2.70758093622479, 'bull_tsl_mult': 0.9795726373855415, 'bull_time_stop': 19, 'bull_use_sma': True, 'bull_use_ema': False, 'bull_use_atr': True, 'bull_use_adx': False, 'bull_use_spike': True, 'bull_rsi_required': False, 'bear_strategy': 'breakout', 'bear_bb_std_mult': 2.9358793897596773, 'bear_rsi_os': 30, 'bear_rsi_ob': 93, 'bear_adx_thresh': 11.757044125574431, 'bear_atr_min_pct': 0.006645355411871736, 'bear_atr_max_pct': 0.04761174949830776, 'bear_tp_mult': 2.842881859555375, 'bear_tsl_mult': 0.8885537622742737, 'bear_time_stop': 37, 'bear_use_sma': False, 'bear_use_ema': True, 'bear_use_atr': False, 'bear_use_adx': True, 'bear_use_spike': True, 'bear_rsi_required': False, 'sideways_strategy': 'breakout', 'sideways_bb_std_mult': 0.5662751605649876, 'sideways_rsi_os': 47, 'sideways_rsi_ob': 79, 'sideways_adx_thresh': 31.83288162281122, 'sideways_atr_min_pct': 0.005146500717102846, 'sideways_atr_max_pct': 0.014822030877627557, 'sideways_tp_mult': 1.0430135351192193, 'sideways_tsl_mult': 0.4517662787166541, 'sideways_time_stop': 201, 'sideways_use_sma': False, 'sideways_use_ema': False, 'sideways_use_atr': False, 'sideways_use_adx': False, 'sideways_use_spike': False, 'sideways_rsi_required': False}.
[I 2025-08-29 20:36:43,532] Trial 512 finished with values: [-1000000000.0, 1000000000.0] and parameters: {'p_sma': 23, 'p_std': 15, 'p_atr': 12, 'p_adx': 13, 'rsi_period': 38, 'ema1': 26, 'ema2': 34, 'slip_atr_k': 0.10115544738113594, 'slip_spread_k': 0.4843598657267857, 'spread_hl_frac': 0.03652671552325412, 'bb_std_mult': 3.1795150266472527, 'rsi_os': 11, 'rsi_ob': 84, 'vol_spike': 0.25916775018025145, 'adx_thresh': 14.347545063576893, 'atr_min_pct': 0.0030217109269190037, 'atr_max_pct': 0.03402994515586666, 'tp_mult': 1.1635935052937587, 'tsl_mult': 0.9759473927409652, 'strategy': 'breakout', 'time_stop': 158, 'use_sma': False, 'use_atr': False, 'use_adx': False, 'use_ema': True, 'use_spike': True, 'rsi_required': False, 'edge_k': 0.18990713012931226, 'edge_cap': 0.998642625411585, 'bull_strategy': 'mean_reversion', 'bull_bb_std_mult': 3.208715436830833, 'bull_rsi_os': 23, 'bull_rsi_ob': 54, 'bull_adx_thresh': 13.779187345757268, 'bull_atr_min_pct': 0.015845266398815335, 'bull_atr_max_pct': 0.09971141095776817, 'bull_tp_mult': 2.8693245632738287, 'bull_tsl_mult': 0.8984420401541636, 'bull_time_stop': 36, 'bull_use_sma': False, 'bull_use_ema': False, 'bull_use_atr': True, 'bull_use_adx': False, 'bull_use_spike': True, 'bull_rsi_required': False, 'bear_strategy': 'mean_reversion', 'bear_bb_std_mult': 2.6648289580535836, 'bear_rsi_os': 29, 'bear_rsi_ob': 67, 'bear_adx_thresh': 20.70465732213867, 'bear_atr_min_pct': 0.006665803780898312, 'bear_atr_max_pct': 0.14069632917170038, 'bear_tp_mult': 1.5088515237548086, 'bear_tsl_mult': 0.9378185712178028, 'bear_time_stop': 142, 'bear_use_sma': True, 'bear_use_ema': False, 'bear_use_atr': False, 'bear_use_adx': True, 'bear_use_spike': False, 'bear_rsi_required': True, 'sideways_strategy': 'breakout', 'sideways_bb_std_mult': 2.236933290670409, 'sideways_rsi_os': 45, 'sideways_rsi_ob': 79, 'sideways_adx_thresh': 32.594839345218496, 'sideways_atr_min_pct': 0.0066151209270877386, 'sideways_atr_max_pct': 0.023707181849828812, 'sideways_tp_mult': 1.0521850737343974, 'sideways_tsl_mult': 0.4451979375114099, 'sideways_time_stop': 128, 'sideways_use_sma': True, 'sideways_use_ema': False, 'sideways_use_atr': False, 'sideways_use_adx': True, 'sideways_use_spike': True, 'sideways_rsi_required': False}.
