[I 2025-08-29 20:57:24,673] Trial 698 finished with values: [-1000000000.0, 1000000000.0] and parameters: {'p_sma': 16, 'p_std': 17, 'p_atr': 25, 'p_adx': 30, 'rsi_period': 40, 'ema1': 7, 'ema2': 46, 'slip_atr_k': 0.00530267149271901, 'slip_spread_k': 0.9838202956767521, 'spread_hl_frac': 0.04910337502235245, 'bb_std_mult': 3.3449639813271963, 'rsi_os': 10, 'rsi_ob': 82, 'vol_spike': 0.1992885119534528, 'adx_thresh': 7.706712353759848, 'atr_min_pct': 0.016669653980381657, 'atr_max_pct': 0.022204062229507673, 'tp_mult': 2.2148241824616366, 'tsl_mult': 0.3944221117672952, 'strategy': 'mean_reversion', 'time_stop': 241, 'use_sma': False, 'use_atr': False, 'use_adx': False, 'use_ema': True, 'use_spike': False, 'rsi_required': True, 'edge_k': 1.0177028033974944, 'edge_cap': 0.3109367590859616, 'bull_strategy': 'breakout', 'bull_bb_std_mult': 3.0762251555084323, 'bull_rsi_os': 35, 'bull_rsi_ob': 72, 'bull_adx_thresh': 26.397932314559796, 'bull_atr_min_pct': 0.0063119897928981, 'bull_atr_max_pct': 0.1031576405013108, 'bull_tp_mult': 1.0121024984273022, 'bull_tsl_mult': 0.8439982490374369, 'bull_time_stop': 41, 'bull_use_sma': False, 'bull_use_ema': False, 'bull_use_atr': False, 'bull_use_adx': False, 'bull_use_spike': True, 'bull_rsi_required': False, 'bear_strategy': 'mean_reversion', 'bear_bb_std_mult': 1.3675003150471154, 'bear_rsi_os': 31, 'bear_rsi_ob': 63, 'bear_adx_thresh': 21.108378571242575, 'bear_atr_min_pct': 0.006154063989623466, 'bear_atr_max_pct': 0.06562954663643383, 'bear_tp_mult': 2.057642686440878, 'bear_tsl_mult': 0.8571859192434843, 'bear_time_stop': 54, 'bear_use_sma': False, 'bear_use_ema': True, 'bear_use_atr': False, 'bear_use_adx': True, 'bear_use_spike': False, 'bear_rsi_required': True, 'sideways_strategy': 'breakout', 'sideways_bb_std_mult': 0.5827625856877534, 'sideways_rsi_os': 5, 'sideways_rsi_ob': 78, 'sideways_adx_thresh': 32.8121775306069, 'sideways_atr_min_pct': 0.011948367209910568, 'sideways_atr_max_pct': 0.026520564426843966, 'sideways_tp_mult': 1.0747835089302233, 'sideways_tsl_mult': 0.88689806093112, 'sideways_time_stop': 204, 'sideways_use_sma': False, 'sideways_use_ema': False, 'sideways_use_atr': True, 'sideways_use_adx': False, 'sideways_use_spike': True, 'sideways_rsi_required': False}.
[I 2025-08-29 20:57:48,634] Trial 703 finished with values: [-0.022890059732707635, 0.022888069052009158] and parameters: {'p_sma': 34, 'p_std': 11, 'p_atr': 24, 'p_adx': 13, 'rsi_period': 35, 'ema1': 25, 'ema2': 50, 'slip_atr_k': 0.18481379558266006, 'slip_spread_k': 0.1346860621756118, 'spread_hl_frac': 0.010881599152326785, 'bb_std_mult': 1.6124290639427512, 'rsi_os': 8, 'rsi_ob': 79, 'vol_spike': 0.15571235177608445, 'adx_thresh': 14.529783290384833, 'atr_min_pct': 0.021096706057153844, 'atr_max_pct': 0.12710440945603155, 'tp_mult': 2.302344563923123, 'tsl_mult': 0.39954503523237506, 'strategy': 'mean_reversion', 'time_stop': 267, 'use_sma': True, 'use_atr': False, 'use_adx': False, 'use_ema': True, 'use_spike': False, 'rsi_required': False, 'edge_k': 1.3935903891761887, 'edge_cap': 0.6406186261703966, 'bull_strategy': 'mean_reversion', 'bull_bb_std_mult': 3.4242058700470737, 'bull_rsi_os': 22, 'bull_rsi_ob': 51, 'bull_adx_thresh': 14.678586574808175, 'bull_atr_min_pct': 0.00327986531110447, 'bull_atr_max_pct': 0.0890521940217702, 'bull_tp_mult': 2.738786251616799, 'bull_tsl_mult': 0.8380616060262975, 'bull_time_stop': 31, 'bull_use_sma': True, 'bull_use_ema': False, 'bull_use_atr': False, 'bull_use_adx': False, 'bull_use_spike': True, 'bull_rsi_required': False, 'bear_strategy': 'mean_reversion', 'bear_bb_std_mult': 2.6159152505698993, 'bear_rsi_os': 29, 'bear_rsi_ob': 66, 'bear_adx_thresh': 21.669546786499662, 'bear_atr_min_pct': 0.007821447274543378, 'bear_atr_max_pct': 0.05981692205415047, 'bear_tp_mult': 2.12444584640903, 'bear_tsl_mult': 0.19715318600984966, 'bear_time_stop': 58, 'bear_use_sma': False, 'bear_use_ema': True, 'bear_use_atr': False, 'bear_use_adx': True, 'bear_use_spike': True, 'bear_rsi_required': True, 'sideways_strategy': 'breakout', 'sideways_bb_std_mult': 1.5743618930713703, 'sideways_rsi_os': 44, 'sideways_rsi_ob': 78, 'sideways_adx_thresh': 32.56911131580803, 'sideways_atr_min_pct': 0.022018179837736913, 'sideways_atr_max_pct': 0.022371420035985825, 'sideways_tp_mult': 1.0679608509123057, 'sideways_tsl_mult': 0.7095476631406971, 'sideways_time_stop': 116, 'sideways_use_sma': False, 'sideways_use_ema': False, 'sideways_use_atr': True, 'sideways_use_adx': False, 'sideways_use_spike': False, 'sideways_rsi_required': False}.
[I 2025-08-29 20:57:50,273] Trial 704 finished with values: [-0.002003327796944898, 0.0021019132287907138] and parameters: {'p_sma': 22, 'p_std': 21, 'p_atr': 26, 'p_adx': 13, 'rsi_period': 48, 'ema1': 24, 'ema2': 26, 'slip_atr_k': 0.005397938236673958, 'slip_spread_k': 0.3190386153678557, 'spread_hl_frac': 0.03540763015374617, 'bb_std_mult': 2.164798967878371, 'rsi_os': 36, 'rsi_ob': 82, 'vol_spike': 0.1754322449809567, 'adx_thresh': 9.997345691749942, 'atr_min_pct': 0.017406859892744347, 'atr_max_pct': 0.03814977817921683, 'tp_mult': 2.2691362428137722, 'tsl_mult': 0.3877773255599146, 'strategy': 'mean_reversion', 'time_stop': 160, 'use_sma': True, 'use_atr': False, 'use_adx': False, 'use_ema': True, 'use_spike': False, 'rsi_required': False, 'edge_k': 1.6607378179524885, 'edge_cap': 0.6533038028029945, 'bull_strategy': 'mean_reversion', 'bull_bb_std_mult': 3.1082871203976787, 'bull_rsi_os': 22, 'bull_rsi_ob': 91, 'bull_adx_thresh': 14.7313486778547, 'bull_atr_min_pct': 0.020299709563160535, 'bull_atr_max_pct': 0.01013778655724508, 'bull_tp_mult': 2.649586330591755, 'bull_tsl_mult': 0.9072648756102792, 'bull_time_stop': 30, 'bull_use_sma': True, 'bull_use_ema': False, 'bull_use_atr': True, 'bull_use_adx': False, 'bull_use_spike': True, 'bull_rsi_required': False, 'bear_strategy': 'breakout', 'bear_bb_std_mult': 2.592366334747892, 'bear_rsi_os': 29, 'bear_rsi_ob': 84, 'bear_adx_thresh': 21.66814685901808, 'bear_atr_min_pct': 0.017417394439198312, 'bear_atr_max_pct': 0.033902868811132095, 'bear_tp_mult': 1.3757192093955233, 'bear_tsl_mult': 0.24811512476962694, 'bear_time_stop': 57, 'bear_use_sma': False, 'bear_use_ema': True, 'bear_use_atr': True, 'bear_use_adx': True, 'bear_use_spike': True, 'bear_rsi_required': False, 'sideways_strategy': 'breakout', 'sideways_bb_std_mult': 1.5235046772561243, 'sideways_rsi_os': 44, 'sideways_rsi_ob': 81, 'sideways_adx_thresh': 34.0302538876081, 'sideways_atr_min_pct': 0.0037147468351874575, 'sideways_atr_max_pct': 0.021924322778939437, 'sideways_tp_mult': 1.0672906660114243, 'sideways_tsl_mult': 0.5210459625665304, 'sideways_time_stop': 177, 'sideways_use_sma': False, 'sideways_use_ema': False, 'sideways_use_atr': False, 'sideways_use_adx': True, 'sideways_use_spike': False, 'sideways_rsi_required': False}.
[I 2025-08-29 20:57:53,964] Trial 706 finished with values: [-1000000000.0, 1000000000.0] and parameters: {'p_sma': 22, 'p_std': 25, 'p_atr': 26, 'p_adx': 13, 'rsi_period': 70, 'ema1': 24, 'ema2': 44, 'slip_atr_k': 0.0045283598062181, 'slip_spread_k': 0.2540864632360242, 'spread_hl_frac': 0.026025179995979857, 'bb_std_mult': 1.693123791730103, 'rsi_os': 29, 'rsi_ob': 83, 'vol_spike': 0.17818053273001727, 'adx_thresh': 12.062463747339882, 'atr_min_pct': 0.021678828514234742, 'atr_max_pct': 0.037197350961554965, 'tp_mult': 1.4076772719987936, 'tsl_mult': 0.8556196625548341, 'strategy': 'mean_reversion', 'time_stop': 160, 'use_sma': True, 'use_atr': False, 'use_adx': False, 'use_ema': True, 'use_spike': False, 'rsi_required': False, 'edge_k': 1.0740803061069615, 'edge_cap': 0.6446118711964597, 'bull_strategy': 'mean_reversion', 'bull_bb_std_mult': 3.1379218789590246, 'bull_rsi_os': 28, 'bull_rsi_ob': 81, 'bull_adx_thresh': 15.967873324237418, 'bull_atr_min_pct': 0.029504548479806984, 'bull_atr_max_pct': 0.011948995053379124, 'bull_tp_mult': 2.646395520930859, 'bull_tsl_mult': 0.9082879240185073, 'bull_time_stop': 32, 'bull_use_sma': True, 'bull_use_ema': False, 'bull_use_atr': True, 'bull_use_adx': False, 'bull_use_spike': True, 'bull_rsi_required': False, 'bear_strategy': 'breakout', 'bear_bb_std_mult': 2.682840365402153, 'bear_rsi_os': 26, 'bear_rsi_ob': 94, 'bear_adx_thresh': 10.004619632755544, 'bear_atr_min_pct': 0.025637202722768527, 'bear_atr_max_pct': 0.03421449024413886, 'bear_tp_mult': 2.744158292015089, 'bear_tsl_mult': 0.9723234997362913, 'bear_time_stop': 218, 'bear_use_sma': False, 'bear_use_ema': True, 'bear_use_atr': True, 'bear_use_adx': True, 'bear_use_spike': True, 'bear_rsi_required': False, 'sideways_strategy': 'breakout', 'sideways_bb_std_mult': 3.5220104343747507, 'sideways_rsi_os': 44, 'sideways_rsi_ob': 60, 'sideways_adx_thresh': 27.341033596520695, 'sideways_atr_min_pct': 0.0056080339658901406, 'sideways_atr_max_pct': 0.02148979510163771, 'sideways_tp_mult': 1.225626805973714, 'sideways_tsl_mult': 0.7130412583342666, 'sideways_time_stop': 300, 'sideways_use_sma': False, 'sideways_use_ema': True, 'sideways_use_atr': False, 'sideways_use_adx': True, 'sideways_use_spike': False, 'sideways_rsi_required': False}.
[I 2025-08-29 20:57:54,094] Trial 705 finished with values: [-1000000000.0, 1000000000.0] and parameters: {'p_sma': 34, 'p_std': 7, 'p_atr': 26, 'p_adx': 13, 'rsi_period': 48, 'ema1': 24, 'ema2': 10, 'slip_atr_k': 0.00458654499941567, 'slip_spread_k': 0.6700155440985573, 'spread_hl_frac': 0.049940571030715385, 'bb_std_mult': 1.7104874807453057, 'rsi_os': 8, 'rsi_ob': 95, 'vol_spike': 0.1751188531790787, 'adx_thresh': 13.0563954366005, 'atr_min_pct': 0.017479628623724628, 'atr_max_pct': 0.03706950059741736, 'tp_mult': 1.4050801789837069, 'tsl_mult': 0.09950243206739184, 'strategy': 'mean_reversion', 'time_stop': 162, 'use_sma': True, 'use_atr': False, 'use_adx': False, 'use_ema': True, 'use_spike': False, 'rsi_required': False, 'edge_k': 1.0708916062361504, 'edge_cap': 0.1805395459603225, 'bull_strategy': 'mean_reversion', 'bull_bb_std_mult': 3.416736186927488, 'bull_rsi_os': 7, 'bull_rsi_ob': 81, 'bull_adx_thresh': 14.620345661127905, 'bull_atr_min_pct': 0.015814211323693025, 'bull_atr_max_pct': 0.08719101669265149, 'bull_tp_mult': 2.643842531202512, 'bull_tsl_mult': 0.9047741491833469, 'bull_time_stop': 33, 'bull_use_sma': True, 'bull_use_ema': False, 'bull_use_atr': True, 'bull_use_adx': False, 'bull_use_spike': True, 'bull_rsi_required': False, 'bear_strategy': 'breakout', 'bear_bb_std_mult': 2.6920608938079997, 'bear_rsi_os': 20, 'bear_rsi_ob': 94, 'bear_adx_thresh': 21.889812304737024, 'bear_atr_min_pct': 0.0068247360878559045, 'bear_atr_max_pct': 0.0369838887088316, 'bear_tp_mult': 1.5069520721976462, 'bear_tsl_mult': 0.9704612969496397, 'bear_time_stop': 205, 'bear_use_sma': False, 'bear_use_ema': True, 'bear_use_atr': True, 'bear_use_adx': True, 'bear_use_spike': True, 'bear_rsi_required': False, 'sideways_strategy': 'breakout', 'sideways_bb_std_mult': 0.7047437621835724, 'sideways_rsi_os': 44, 'sideways_rsi_ob': 47, 'sideways_adx_thresh': 31.90152865894081, 'sideways_atr_min_pct': 0.005655628938277788, 'sideways_atr_max_pct': 0.020674344785679286, 'sideways_tp_mult': 1.1306640559323362, 'sideways_tsl_mult': 0.3509518249083441, 'sideways_time_stop': 175, 'sideways_use_sma': False, 'sideways_use_ema': True, 'sideways_use_atr': False, 'sideways_use_adx': True, 'sideways_use_spike': False, 'sideways_rsi_required': False}.
[I 2025-08-29 20:57:55,010] Trial 710 finished with values: [-1000000000.0, 1000000000.0] and parameters: {'p_sma': 18, 'p_std': 49, 'p_atr': 25, 'p_adx': 12, 'rsi_period': 31, 'ema1': 27, 'ema2': 34, 'slip_atr_k': 0.011582020076940964, 'slip_spread_k': 0.8532803330364511, 'spread_hl_frac': 0.04825493725559507, 'bb_std_mult': 1.892301385864731, 'rsi_os': 51, 'rsi_ob': 91, 'vol_spike': 0.19170613827820596, 'adx_thresh': 12.828101882364937, 'atr_min_pct': 0.02449194788449045, 'atr_max_pct': 0.01003157834929512, 'tp_mult': 2.149183442852284, 'tsl_mult': 0.9095871528986261, 'strategy': 'breakout', 'time_stop': 174, 'use_sma': True, 'use_atr': True, 'use_adx': True, 'use_ema': False, 'use_spike': True, 'rsi_required': False, 'edge_k': 0.8477633972374029, 'edge_cap': 0.5851714540820634, 'bull_strategy': 'mean_reversion', 'bull_bb_std_mult': 3.010441382620072, 'bull_rsi_os': 15, 'bull_rsi_ob': 65, 'bull_adx_thresh': 14.047142328946867, 'bull_atr_min_pct': 0.017287728982831357, 'bull_atr_max_pct': 0.09227708271429756, 'bull_tp_mult': 2.6924131059668874, 'bull_tsl_mult': 0.9603602502978166, 'bull_time_stop': 48, 'bull_use_sma': True, 'bull_use_ema': True, 'bull_use_atr': True, 'bull_use_adx': False, 'bull_use_spike': False, 'bull_rsi_required': True, 'bear_strategy': 'breakout', 'bear_bb_std_mult': 0.7511285083300581, 'bear_rsi_os': 27, 'bear_rsi_ob': 67, 'bear_adx_thresh': 19.593588125746866, 'bear_atr_min_pct': 0.005936705603575849, 'bear_atr_max_pct': 0.05901325542205768, 'bear_tp_mult': 2.6913939256896224, 'bear_tsl_mult': 0.9183049767236209, 'bear_time_stop': 46, 'bear_use_sma': True, 'bear_use_ema': True, 'bear_use_atr': False, 'bear_use_adx': False, 'bear_use_spike': True, 'bear_rsi_required': False, 'sideways_strategy': 'mean_reversion', 'sideways_bb_std_mult': 2.489692998055003, 'sideways_rsi_os': 46, 'sideways_rsi_ob': 73, 'sideways_adx_thresh': 31.946684059503134, 'sideways_atr_min_pct': 0.009135744458327367, 'sideways_atr_max_pct': 0.08495640585321938, 'sideways_tp_mult': 1.443890931820294, 'sideways_tsl_mult': 0.6897659468434747, 'sideways_time_stop': 193, 'sideways_use_sma': True, 'sideways_use_ema': False, 'sideways_use_atr': False, 'sideways_use_adx': False, 'sideways_use_spike': False, 'sideways_rsi_required': True}.
[I 2025-08-29 20:58:20,836] Trial 707 finished with values: [-1000000000.0, 1000000000.0] and parameters: {'p_sma': 30, 'p_std': 49, 'p_atr': 26, 'p_adx': 13, 'rsi_period': 48, 'ema1': 27, 'ema2': 10, 'slip_atr_k': 0.005531725329036815, 'slip_spread_k': 0.25358323861497906, 'spread_hl_frac': 0.049963392555840765, 'bb_std_mult': 1.7071381469010813, 'rsi_os': 44, 'rsi_ob': 83, 'vol_spike': 0.17739483215892848, 'adx_thresh': 12.810295832190375, 'atr_min_pct': 0.01764576315625204, 'atr_max_pct': 0.03722574221833162, 'tp_mult': 1.3994735631497712, 'tsl_mult': 0.8600529028155136, 'strategy': 'mean_reversion', 'time_stop': 160, 'use_sma': True, 'use_atr': False, 'use_adx': False, 'use_ema': True, 'use_spike': False, 'rsi_required': False, 'edge_k': 1.1216908680368756, 'edge_cap': 0.5765045679782899, 'bull_strategy': 'mean_reversion', 'bull_bb_std_mult': 1.1861399513320827, 'bull_rsi_os': 15, 'bull_rsi_ob': 74, 'bull_adx_thresh': 5.71904346768029, 'bull_atr_min_pct': 0.02033103124552624, 'bull_atr_max_pct': 0.09194405080681245, 'bull_tp_mult': 2.680652722484309, 'bull_tsl_mult': 0.9030461654086077, 'bull_time_stop': 33, 'bull_use_sma': True, 'bull_use_ema': False, 'bull_use_atr': True, 'bull_use_adx': False, 'bull_use_spike': True, 'bull_rsi_required': False, 'bear_strategy': 'breakout', 'bear_bb_std_mult': 2.691386612036741, 'bear_rsi_os': 26, 'bear_rsi_ob': 85, 'bear_adx_thresh': 19.476179643695726, 'bear_atr_min_pct': 0.006846969524500831, 'bear_atr_max_pct': 0.03423944694735174, 'bear_tp_mult': 1.3718108132188402, 'bear_tsl_mult': 0.9787889460148442, 'bear_time_stop': 215, 'bear_use_sma': False, 'bear_use_ema': True, 'bear_use_atr': True, 'bear_use_adx': True, 'bear_use_spike': True, 'bear_rsi_required': False, 'sideways_strategy': 'breakout', 'sideways_bb_std_mult': 2.2511080997933557, 'sideways_rsi_os': 36, 'sideways_rsi_ob': 47, 'sideways_adx_thresh': 11.871549758369463, 'sideways_atr_min_pct': 0.005723983989255549, 'sideways_atr_max_pct': 0.09139555589076884, 'sideways_tp_mult': 1.222240456330958, 'sideways_tsl_mult': 0.7286127040606512, 'sideways_time_stop': 178, 'sideways_use_sma': False, 'sideways_use_ema': True, 'sideways_use_atr': False, 'sideways_use_adx': True, 'sideways_use_spike': False, 'sideways_rsi_required': False}.
[I 2025-08-29 20:58:21,630] Trial 708 finished with values: [-1000000000.0, 1000000000.0] and parameters: {'p_sma': 53, 'p_std': 19, 'p_atr': 26, 'p_adx': 13, 'rsi_period': 38, 'ema1': 27, 'ema2': 10, 'slip_atr_k': 0.1564040945328423, 'slip_spread_k': 0.6611985089472512, 'spread_hl_frac': 0.025410385095262954, 'bb_std_mult': 1.7128112475805837, 'rsi_os': 9, 'rsi_ob': 83, 'vol_spike': 0.19134899599728236, 'adx_thresh': 13.128550773821074, 'atr_min_pct': 0.02020643939807408, 'atr_max_pct': 0.05739032254226477, 'tp_mult': 1.8922262667824163, 'tsl_mult': 0.8563090706236735, 'strategy': 'breakout', 'time_stop': 83, 'use_sma': True, 'use_atr': True, 'use_adx': False, 'use_ema': True, 'use_spike': False, 'rsi_required': False, 'edge_k': 1.0720683499097559, 'edge_cap': 0.580916080925547, 'bull_strategy': 'mean_reversion', 'bull_bb_std_mult': 2.9929294345184045, 'bull_rsi_os': 17, 'bull_rsi_ob': 54, 'bull_adx_thresh': 10.816161731448588, 'bull_atr_min_pct': 0.01576656915248939, 'bull_atr_max_pct': 0.09830007207737623, 'bull_tp_mult': 2.630328668581369, 'bull_tsl_mult': 0.8860595230871463, 'bull_time_stop': 35, 'bull_use_sma': True, 'bull_use_ema': False, 'bull_use_atr': True, 'bull_use_adx': False, 'bull_use_spike': True, 'bull_rsi_required': True, 'bear_strategy': 'breakout', 'bear_bb_std_mult': 2.7117952685740754, 'bear_rsi_os': 27, 'bear_rsi_ob': 67, 'bear_adx_thresh': 20.467835485522503, 'bear_atr_min_pct': 0.006920931005328477, 'bear_atr_max_pct': 0.057837526078165044, 'bear_tp_mult': 1.5119241863418336, 'bear_tsl_mult': 0.9725905048509657, 'bear_time_stop': 136, 'bear_use_sma': True, 'bear_use_ema': True, 'bear_use_atr': True, 'bear_use_adx': True, 'bear_use_spike': True, 'bear_rsi_required': False, 'sideways_strategy': 'breakout', 'sideways_bb_std_mult': 2.2398381617328917, 'sideways_rsi_os': 28, 'sideways_rsi_ob': 80, 'sideways_adx_thresh': 31.77841027391314, 'sideways_atr_min_pct': 0.027309097975899022, 'sideways_atr_max_pct': 0.0851608758326415, 'sideways_tp_mult': 1.2305800124465205, 'sideways_tsl_mult': 0.8080434066859981, 'sideways_time_stop': 194, 'sideways_use_sma': False, 'sideways_use_ema': True, 'sideways_use_atr': False, 'sideways_use_adx': True, 'sideways_use_spike': False, 'sideways_rsi_required': False}.
[I 2025-08-29 20:58:22,134] Trial 709 finished with values: [-0.001515048917720363, 0.0023710425798200542] and parameters: {'p_sma': 30, 'p_std': 49, 'p_atr': 20, 'p_adx': 12, 'rsi_period': 38, 'ema1': 27, 'ema2': 20, 'slip_atr_k': 0.012441454821499356, 'slip_spread_k': 0.8266258960060486, 'spread_hl_frac': 0.04989054226690921, 'bb_std_mult': 1.7327276264975853, 'rsi_os': 9, 'rsi_ob': 95, 'vol_spike': 0.19069290852217666, 'adx_thresh': 12.97363491618154, 'atr_min_pct': 0.020074656877335628, 'atr_max_pct': 0.10110456539634434, 'tp_mult': 1.9118909646834905, 'tsl_mult': 0.9401092863226441, 'strategy': 'breakout', 'time_stop': 177, 'use_sma': True, 'use_atr': True, 'use_adx': True, 'use_ema': False, 'use_spike': False, 'rsi_required': False, 'edge_k': 0.8322786223414514, 'edge_cap': 0.18862424863905952, 'bull_strategy': 'mean_reversion', 'bull_bb_std_mult': 2.795919194430232, 'bull_rsi_os': 17, 'bull_rsi_ob': 53, 'bull_adx_thresh': 14.295457040626076, 'bull_atr_min_pct': 0.013151758281242952, 'bull_atr_max_pct': 0.09211654341263179, 'bull_tp_mult': 1.821474422127662, 'bull_tsl_mult': 0.884309829197703, 'bull_time_stop': 14, 'bull_use_sma': True, 'bull_use_ema': True, 'bull_use_atr': True, 'bull_use_adx': False, 'bull_use_spike': False, 'bull_rsi_required': True, 'bear_strategy': 'breakout', 'bear_bb_std_mult': 2.9536115958958042, 'bear_rsi_os': 47, 'bear_rsi_ob': 67, 'bear_adx_thresh': 20.530433588842612, 'bear_atr_min_pct': 0.006577530619902603, 'bear_atr_max_pct': 0.03657385592885365, 'bear_tp_mult': 1.967691036743008, 'bear_tsl_mult': 0.28985108929600895, 'bear_time_stop': 137, 'bear_use_sma': True, 'bear_use_ema': True, 'bear_use_atr': False, 'bear_use_adx': False, 'bear_use_spike': True, 'bear_rsi_required': False, 'sideways_strategy': 'mean_reversion', 'sideways_bb_std_mult': 2.473524301861395, 'sideways_rsi_os': 28, 'sideways_rsi_ob': 80, 'sideways_adx_thresh': 12.073899655527491, 'sideways_atr_min_pct': 0.004622804053311722, 'sideways_atr_max_pct': 0.09125427223643587, 'sideways_tp_mult': 1.0385055965646475, 'sideways_tsl_mult': 0.818636688324796, 'sideways_time_stop': 33, 'sideways_use_sma': True, 'sideways_use_ema': True, 'sideways_use_atr': False, 'sideways_use_adx': False, 'sideways_use_spike': False, 'sideways_rsi_required': False}.
