[I 2025-08-29 20:46:57,262] Trial 605 finished with values: [-1000000000.0, 1000000000.0] and parameters: {'p_sma': 21, 'p_std': 57, 'p_atr': 25, 'p_adx': 13, 'rsi_period': 39, 'ema1': 26, 'ema2': 46, 'slip_atr_k': 0.12995261046165255, 'slip_spread_k': 0.1470794627141729, 'spread_hl_frac': 0.04542053030957596, 'bb_std_mult': 1.5319074873038774, 'rsi_os': 36, 'rsi_ob': 90, 'vol_spike': 0.14299164462592295, 'adx_thresh': 14.30934671343701, 'atr_min_pct': 0.021596808078560806, 'atr_max_pct': 0.027216257980176118, 'tp_mult': 2.182001099385058, 'tsl_mult': 0.18664785754416552, 'strategy': 'mean_reversion', 'time_stop': 273, 'use_sma': False, 'use_atr': False, 'use_adx': False, 'use_ema': True, 'use_spike': False, 'rsi_required': True, 'edge_k': 0.49494299027910915, 'edge_cap': 0.6185414734796509, 'bull_strategy': 'breakout', 'bull_bb_std_mult': 3.177637870716021, 'bull_rsi_os': 15, 'bull_rsi_ob': 77, 'bull_adx_thresh': 14.431964126631065, 'bull_atr_min_pct': 0.0061706544003320984, 'bull_atr_max_pct': 0.10099192729406604, 'bull_tp_mult': 2.710367545046549, 'bull_tsl_mult': 0.5547255055762963, 'bull_time_stop': 44, 'bull_use_sma': False, 'bull_use_ema': False, 'bull_use_atr': True, 'bull_use_adx': True, 'bull_use_spike': True, 'bull_rsi_required': False, 'bear_strategy': 'breakout', 'bear_bb_std_mult': 0.8680639153142049, 'bear_rsi_os': 29, 'bear_rsi_ob': 80, 'bear_adx_thresh': 20.22520681105243, 'bear_atr_min_pct': 0.005617135506175667, 'bear_atr_max_pct': 0.026355659915936455, 'bear_tp_mult': 2.522177162197087, 'bear_tsl_mult': 0.5472726074497033, 'bear_time_stop': 111, 'bear_use_sma': False, 'bear_use_ema': False, 'bear_use_atr': False, 'bear_use_adx': True, 'bear_use_spike': False, 'bear_rsi_required': False, 'sideways_strategy': 'breakout', 'sideways_bb_std_mult': 2.934100636106418, 'sideways_rsi_os': 25, 'sideways_rsi_ob': 79, 'sideways_adx_thresh': 32.69191000289037, 'sideways_atr_min_pct': 0.0049180309559293525, 'sideways_atr_max_pct': 0.022046933193344994, 'sideways_tp_mult': 1.9383813583384302, 'sideways_tsl_mult': 0.040408939992648885, 'sideways_time_stop': 138, 'sideways_use_sma': False, 'sideways_use_ema': True, 'sideways_use_atr': False, 'sideways_use_adx': False, 'sideways_use_spike': True, 'sideways_rsi_required': True}.
[I 2025-08-29 20:46:57,658] Trial 603 finished with values: [-1000000000.0, 1000000000.0] and parameters: {'p_sma': 59, 'p_std': 57, 'p_atr': 29, 'p_adx': 13, 'rsi_period': 16, 'ema1': 26, 'ema2': 46, 'slip_atr_k': 0.10792196147002427, 'slip_spread_k': 0.45499583390630477, 'spread_hl_frac': 0.034335698630131584, 'bb_std_mult': 2.265334269982738, 'rsi_os': 7, 'rsi_ob': 86, 'vol_spike': 0.06877507570015896, 'adx_thresh': 12.772413019177263, 'atr_min_pct': 0.025657901000151487, 'atr_max_pct': 0.026933400921656508, 'tp_mult': 1.3227774703812074, 'tsl_mult': 0.3160378871130616, 'strategy': 'mean_reversion', 'time_stop': 155, 'use_sma': False, 'use_atr': False, 'use_adx': False, 'use_ema': False, 'use_spike': False, 'rsi_required': True, 'edge_k': 1.0920224492409176, 'edge_cap': 0.627150437906319, 'bull_strategy': 'breakout', 'bull_bb_std_mult': 1.7496293615880671, 'bull_rsi_os': 15, 'bull_rsi_ob': 75, 'bull_adx_thresh': 9.019635547930042, 'bull_atr_min_pct': 0.015656199411130355, 'bull_atr_max_pct': 0.03769347766067458, 'bull_tp_mult': 1.7440511521128788, 'bull_tsl_mult': 0.3186060936739533, 'bull_time_stop': 46, 'bull_use_sma': False, 'bull_use_ema': False, 'bull_use_atr': True, 'bull_use_adx': True, 'bull_use_spike': True, 'bull_rsi_required': False, 'bear_strategy': 'breakout', 'bear_bb_std_mult': 2.8077808024817923, 'bear_rsi_os': 29, 'bear_rsi_ob': 83, 'bear_adx_thresh': 20.220860641790427, 'bear_atr_min_pct': 0.017202855525498315, 'bear_atr_max_pct': 0.042398743026919594, 'bear_tp_mult': 2.5277693009869493, 'bear_tsl_mult': 0.18396939901785347, 'bear_time_stop': 59, 'bear_use_sma': False, 'bear_use_ema': False, 'bear_use_atr': False, 'bear_use_adx': False, 'bear_use_spike': False, 'bear_rsi_required': True, 'sideways_strategy': 'mean_reversion', 'sideways_bb_std_mult': 2.9327743619407896, 'sideways_rsi_os': 25, 'sideways_rsi_ob': 87, 'sideways_adx_thresh': 32.51282121560471, 'sideways_atr_min_pct': 0.00521972062553403, 'sideways_atr_max_pct': 0.022124960309358472, 'sideways_tp_mult': 1.1983543559670935, 'sideways_tsl_mult': 0.33666383495011876, 'sideways_time_stop': 84, 'sideways_use_sma': True, 'sideways_use_ema': True, 'sideways_use_atr': False, 'sideways_use_adx': False, 'sideways_use_spike': True, 'sideways_rsi_required': True}.
[I 2025-08-29 20:46:57,748] Trial 604 finished with values: [-1000000000.0, 1000000000.0] and parameters: {'p_sma': 7, 'p_std': 56, 'p_atr': 29, 'p_adx': 19, 'rsi_period': 32, 'ema1': 26, 'ema2': 54, 'slip_atr_k': 0.004364204790430926, 'slip_spread_k': 0.1418567704294923, 'spread_hl_frac': 0.04910584959095448, 'bb_std_mult': 2.2776378538281326, 'rsi_os': 7, 'rsi_ob': 53, 'vol_spike': 0.26441731664020984, 'adx_thresh': 12.543695944877225, 'atr_min_pct': 0.019539134305255473, 'atr_max_pct': 0.028401428270026376, 'tp_mult': 1.1385941627701646, 'tsl_mult': 0.9513625312520961, 'strategy': 'mean_reversion', 'time_stop': 160, 'use_sma': False, 'use_atr': False, 'use_adx': False, 'use_ema': False, 'use_spike': False, 'rsi_required': True, 'edge_k': 1.03548303687115, 'edge_cap': 0.6291429633761587, 'bull_strategy': 'breakout', 'bull_bb_std_mult': 3.1658419478958084, 'bull_rsi_os': 34, 'bull_rsi_ob': 75, 'bull_adx_thresh': 9.159162014116381, 'bull_atr_min_pct': 0.015136927854934973, 'bull_atr_max_pct': 0.09958220984717964, 'bull_tp_mult': 2.7147819097371038, 'bull_tsl_mult': 0.8459258165124831, 'bull_time_stop': 41, 'bull_use_sma': False, 'bull_use_ema': False, 'bull_use_atr': True, 'bull_use_adx': True, 'bull_use_spike': True, 'bull_rsi_required': False, 'bear_strategy': 'breakout', 'bear_bb_std_mult': 2.7842372873377967, 'bear_rsi_os': 29, 'bear_rsi_ob': 83, 'bear_adx_thresh': 25.047271370630625, 'bear_atr_min_pct': 0.016722874023772615, 'bear_atr_max_pct': 0.041980298865216745, 'bear_tp_mult': 2.2579224740552317, 'bear_tsl_mult': 0.00015242411158206126, 'bear_time_stop': 59, 'bear_use_sma': False, 'bear_use_ema': False, 'bear_use_atr': False, 'bear_use_adx': False, 'bear_use_spike': False, 'bear_rsi_required': True, 'sideways_strategy': 'mean_reversion', 'sideways_bb_std_mult': 2.2654887323775865, 'sideways_rsi_os': 48, 'sideways_rsi_ob': 79, 'sideways_adx_thresh': 23.711426302915545, 'sideways_atr_min_pct': 0.006530872918337791, 'sideways_atr_max_pct': 0.022294731455553652, 'sideways_tp_mult': 1.0400836737263701, 'sideways_tsl_mult': 0.7506135147131122, 'sideways_time_stop': 216, 'sideways_use_sma': True, 'sideways_use_ema': True, 'sideways_use_atr': False, 'sideways_use_adx': False, 'sideways_use_spike': True, 'sideways_rsi_required': True}.
[I 2025-08-29 20:46:58,816] Trial 606 finished with values: [-1000000000.0, 1000000000.0] and parameters: {'p_sma': 19, 'p_std': 57, 'p_atr': 25, 'p_adx': 19, 'rsi_period': 32, 'ema1': 9, 'ema2': 50, 'slip_atr_k': 0.014230742736817863, 'slip_spread_k': 0.9647213842532782, 'spread_hl_frac': 0.04634515312003654, 'bb_std_mult': 1.8851116858865367, 'rsi_os': 46, 'rsi_ob': 90, 'vol_spike': 0.17283541494552235, 'adx_thresh': 26.58840583913765, 'atr_min_pct': 0.008952685898500344, 'atr_max_pct': 0.02724095586570922, 'tp_mult': 1.3290221871572236, 'tsl_mult': 0.3975802618236583, 'strategy': 'mean_reversion', 'time_stop': 273, 'use_sma': False, 'use_atr': False, 'use_adx': False, 'use_ema': True, 'use_spike': False, 'rsi_required': True, 'edge_k': 1.7781334860499955, 'edge_cap': 0.5844165844094831, 'bull_strategy': 'breakout', 'bull_bb_std_mult': 3.3317254982793756, 'bull_rsi_os': 15, 'bull_rsi_ob': 79, 'bull_adx_thresh': 8.840532203156108, 'bull_atr_min_pct': 0.015150286472268838, 'bull_atr_max_pct': 0.06693942910277907, 'bull_tp_mult': 2.6561483323540327, 'bull_tsl_mult': 0.30907205103222546, 'bull_time_stop': 44, 'bull_use_sma': False, 'bull_use_ema': False, 'bull_use_atr': True, 'bull_use_adx': True, 'bull_use_spike': True, 'bull_rsi_required': False, 'bear_strategy': 'breakout', 'bear_bb_std_mult': 2.7699101153188392, 'bear_rsi_os': 28, 'bear_rsi_ob': 67, 'bear_adx_thresh': 18.669539245081143, 'bear_atr_min_pct': 0.023740072090362746, 'bear_atr_max_pct': 0.05328009173078554, 'bear_tp_mult': 2.541084756028264, 'bear_tsl_mult': 0.18098538165289751, 'bear_time_stop': 32, 'bear_use_sma': False, 'bear_use_ema': False, 'bear_use_atr': False, 'bear_use_adx': True, 'bear_use_spike': False, 'bear_rsi_required': False, 'sideways_strategy': 'breakout', 'sideways_bb_std_mult': 2.2730254526389615, 'sideways_rsi_os': 50, 'sideways_rsi_ob': 79, 'sideways_adx_thresh': 32.69253100292052, 'sideways_atr_min_pct': 0.005249169084253687, 'sideways_atr_max_pct': 0.020883871689759106, 'sideways_tp_mult': 1.1935764933353938, 'sideways_tsl_mult': 0.33386998065752593, 'sideways_time_stop': 196, 'sideways_use_sma': False, 'sideways_use_ema': True, 'sideways_use_atr': False, 'sideways_use_adx': False, 'sideways_use_spike': True, 'sideways_rsi_required': False}.
[I 2025-08-29 20:46:59,470] Trial 608 finished with values: [-1000000000.0, 1000000000.0] and parameters: {'p_sma': 19, 'p_std': 54, 'p_atr': 25, 'p_adx': 13, 'rsi_period': 56, 'ema1': 9, 'ema2': 45, 'slip_atr_k': 0.00021381325059522164, 'slip_spread_k': 0.23726408740610422, 'spread_hl_frac': 0.046318029607845916, 'bb_std_mult': 1.8739623146374678, 'rsi_os': 32, 'rsi_ob': 49, 'vol_spike': 0.2020527813236681, 'adx_thresh': 13.881654720919098, 'atr_min_pct': 0.004678290732373061, 'atr_max_pct': 0.07932056407853573, 'tp_mult': 1.3596283379081477, 'tsl_mult': 0.9301524038886563, 'strategy': 'mean_reversion', 'time_stop': 82, 'use_sma': True, 'use_atr': False, 'use_adx': False, 'use_ema': True, 'use_spike': False, 'rsi_required': False, 'edge_k': 1.193673572075006, 'edge_cap': 0.585615076527094, 'bull_strategy': 'mean_reversion', 'bull_bb_std_mult': 3.3315518784952944, 'bull_rsi_os': 13, 'bull_rsi_ob': 83, 'bull_adx_thresh': 30.03080944817507, 'bull_atr_min_pct': 0.016475590632561387, 'bull_atr_max_pct': 0.0906257671774978, 'bull_tp_mult': 2.6457285250745968, 'bull_tsl_mult': 0.05350664204597805, 'bull_time_stop': 109, 'bull_use_sma': True, 'bull_use_ema': False, 'bull_use_atr': True, 'bull_use_adx': False, 'bull_use_spike': True, 'bull_rsi_required': True, 'bear_strategy': 'breakout', 'bear_bb_std_mult': 2.418415219464677, 'bear_rsi_os': 55, 'bear_rsi_ob': 67, 'bear_adx_thresh': 22.28752469457236, 'bear_atr_min_pct': 0.023834680445356943, 'bear_atr_max_pct': 0.05274359362820831, 'bear_tp_mult': 1.5487338775672317, 'bear_tsl_mult': 0.9188127283841031, 'bear_time_stop': 32, 'bear_use_sma': True, 'bear_use_ema': True, 'bear_use_atr': False, 'bear_use_adx': True, 'bear_use_spike': True, 'bear_rsi_required': False, 'sideways_strategy': 'breakout', 'sideways_bb_std_mult': 0.8522164504782135, 'sideways_rsi_os': 46, 'sideways_rsi_ob': 48, 'sideways_adx_thresh': 17.135243289964933, 'sideways_atr_min_pct': 0.007637724136029815, 'sideways_atr_max_pct': 0.11626433388169971, 'sideways_tp_mult': 1.5350087089557052, 'sideways_tsl_mult': 0.7319878394133987, 'sideways_time_stop': 198, 'sideways_use_sma': False, 'sideways_use_ema': False, 'sideways_use_atr': False, 'sideways_use_adx': False, 'sideways_use_spike': False, 'sideways_rsi_required': False}.
[I 2025-08-29 20:47:28,926] Trial 609 finished with values: [-1000000000.0, 1000000000.0] and parameters: {'p_sma': 50, 'p_std': 54, 'p_atr': 25, 'p_adx': 13, 'rsi_period': 71, 'ema1': 9, 'ema2': 19, 'slip_atr_k': 0.01596506858002024, 'slip_spread_k': 0.26342467261537683, 'spread_hl_frac': 0.04994958418119088, 'bb_std_mult': 1.6942727875989274, 'rsi_os': 9, 'rsi_ob': 80, 'vol_spike': 0.1755096575628905, 'adx_thresh': 10.760515117455071, 'atr_min_pct': 0.01681237235009956, 'atr_max_pct': 0.022139108157925618, 'tp_mult': 1.5573602666639712, 'tsl_mult': 0.6829500724088413, 'strategy': 'mean_reversion', 'time_stop': 123, 'use_sma': True, 'use_atr': False, 'use_adx': False, 'use_ema': True, 'use_spike': False, 'rsi_required': False, 'edge_k': 1.035173915642391, 'edge_cap': 0.5896859921082602, 'bull_strategy': 'mean_reversion', 'bull_bb_std_mult': 3.3279857247350817, 'bull_rsi_os': 13, 'bull_rsi_ob': 72, 'bull_adx_thresh': 30.01646227394636, 'bull_atr_min_pct': 0.016455418828083365, 'bull_atr_max_pct': 0.09611895384766335, 'bull_tp_mult': 2.8050064272907846, 'bull_tsl_mult': 0.49777580738176724, 'bull_time_stop': 107, 'bull_use_sma': True, 'bull_use_ema': False, 'bull_use_atr': True, 'bull_use_adx': False, 'bull_use_spike': True, 'bull_rsi_required': True, 'bear_strategy': 'breakout', 'bear_bb_std_mult': 3.593105131842089, 'bear_rsi_os': 10, 'bear_rsi_ob': 48, 'bear_adx_thresh': 30.45912164475375, 'bear_atr_min_pct': 0.02815430349978041, 'bear_atr_max_pct': 0.05326397456404703, 'bear_tp_mult': 1.535977886829567, 'bear_tsl_mult': 0.9096243530406654, 'bear_time_stop': 49, 'bear_use_sma': True, 'bear_use_ema': True, 'bear_use_atr': False, 'bear_use_adx': True, 'bear_use_spike': True, 'bear_rsi_required': False, 'sideways_strategy': 'breakout', 'sideways_bb_std_mult': 2.2985121322640794, 'sideways_rsi_os': 46, 'sideways_rsi_ob': 80, 'sideways_adx_thresh': 31.633525056677428, 'sideways_atr_min_pct': 0.023511559385448872, 'sideways_atr_max_pct': 0.02631410549079836, 'sideways_tp_mult': 1.0452123568332836, 'sideways_tsl_mult': 0.6485030491913486, 'sideways_time_stop': 200, 'sideways_use_sma': False, 'sideways_use_ema': False, 'sideways_use_atr': False, 'sideways_use_adx': False, 'sideways_use_spike': False, 'sideways_rsi_required': False}.
[I 2025-08-29 20:47:29,326] Trial 610 finished with values: [-1000000000.0, 1000000000.0] and parameters: {'p_sma': 35, 'p_std': 54, 'p_atr': 14, 'p_adx': 15, 'rsi_period': 56, 'ema1': 27, 'ema2': 45, 'slip_atr_k': 0.004260886615906519, 'slip_spread_k': 0.5088578468436263, 'spread_hl_frac': 0.04996411150816229, 'bb_std_mult': 1.7227728774291724, 'rsi_os': 9, 'rsi_ob': 58, 'vol_spike': 0.20512440873225352, 'adx_thresh': 7.69462956325043, 'atr_min_pct': 0.0205143653984536, 'atr_max_pct': 0.021659139949456042, 'tp_mult': 1.5572172419247754, 'tsl_mult': 0.8594003251342583, 'strategy': 'mean_reversion', 'time_stop': 163, 'use_sma': True, 'use_atr': False, 'use_adx': False, 'use_ema': True, 'use_spike': False, 'rsi_required': False, 'edge_k': 0.30257222521974325, 'edge_cap': 0.5831379147473009, 'bull_strategy': 'mean_reversion', 'bull_bb_std_mult': 3.0127208034914768, 'bull_rsi_os': 53, 'bull_rsi_ob': 72, 'bull_adx_thresh': 13.402900119763776, 'bull_atr_min_pct': 0.016146926698939024, 'bull_atr_max_pct': 0.10901400262497833, 'bull_tp_mult': 2.8096933976134237, 'bull_tsl_mult': 0.06100743950260051, 'bull_time_stop': 21, 'bull_use_sma': True, 'bull_use_ema': False, 'bull_use_atr': True, 'bull_use_adx': False, 'bull_use_spike': True, 'bull_rsi_required': True, 'bear_strategy': 'breakout', 'bear_bb_std_mult': 2.1520660045074744, 'bear_rsi_os': 28, 'bear_rsi_ob': 65, 'bear_adx_thresh': 21.019208920756125, 'bear_atr_min_pct': 0.005921424100016772, 'bear_atr_max_pct': 0.049801885217447765, 'bear_tp_mult': 1.6107891511476113, 'bear_tsl_mult': 0.24860653389687798, 'bear_time_stop': 49, 'bear_use_sma': True, 'bear_use_ema': True, 'bear_use_atr': True, 'bear_use_adx': True, 'bear_use_spike': True, 'bear_rsi_required': False, 'sideways_strategy': 'breakout', 'sideways_bb_std_mult': 2.3268562326910507, 'sideways_rsi_os': 9, 'sideways_rsi_ob': 80, 'sideways_adx_thresh': 31.455369679365774, 'sideways_atr_min_pct': 0.002607062925633983, 'sideways_atr_max_pct': 0.1060214905158932, 'sideways_tp_mult': 1.5175555789567903, 'sideways_tsl_mult': 0.7294491310966631, 'sideways_time_stop': 67, 'sideways_use_sma': False, 'sideways_use_ema': False, 'sideways_use_atr': False, 'sideways_use_adx': True, 'sideways_use_spike': False, 'sideways_rsi_required': False}.
[I 2025-08-29 20:47:29,349] Trial 607 finished with values: [-1000000000.0, 1000000000.0] and parameters: {'p_sma': 30, 'p_std': 57, 'p_atr': 24, 'p_adx': 13, 'rsi_period': 56, 'ema1': 27, 'ema2': 13, 'slip_atr_k': 0.014212443257184022, 'slip_spread_k': 0.5521897337057068, 'spread_hl_frac': 0.04889830196366743, 'bb_std_mult': 1.8825533611762075, 'rsi_os': 46, 'rsi_ob': 80, 'vol_spike': 0.21715129464248853, 'adx_thresh': 12.912730169001108, 'atr_min_pct': 0.019261478398915934, 'atr_max_pct': 0.10551532001338772, 'tp_mult': 1.5562337492197578, 'tsl_mult': 0.9340287531064237, 'strategy': 'mean_reversion', 'time_stop': 158, 'use_sma': True, 'use_atr': False, 'use_adx': False, 'use_ema': False, 'use_spike': False, 'rsi_required': False, 'edge_k': 1.0370763708654258, 'edge_cap': 0.583766692913302, 'bull_strategy': 'mean_reversion', 'bull_bb_std_mult': 3.3382248103623793, 'bull_rsi_os': 53, 'bull_rsi_ob': 84, 'bull_adx_thresh': 8.529042304759441, 'bull_atr_min_pct': 0.015149281858946774, 'bull_atr_max_pct': 0.0898947608586137, 'bull_tp_mult': 2.6438352831177614, 'bull_tsl_mult': 0.05008946737018116, 'bull_time_stop': 40, 'bull_use_sma': True, 'bull_use_ema': False, 'bull_use_atr': True, 'bull_use_adx': False, 'bull_use_spike': True, 'bull_rsi_required': True, 'bear_strategy': 'breakout', 'bear_bb_std_mult': 2.7571814932967547, 'bear_rsi_os': 28, 'bear_rsi_ob': 67, 'bear_adx_thresh': 18.50501940631326, 'bear_atr_min_pct': 0.028169223255132263, 'bear_atr_max_pct': 0.05279119803649497, 'bear_tp_mult': 2.591024825850527, 'bear_tsl_mult': 0.5924021905587067, 'bear_time_stop': 170, 'bear_use_sma': True, 'bear_use_ema': True, 'bear_use_atr': False, 'bear_use_adx': False, 'bear_use_spike': True, 'bear_rsi_required': False, 'sideways_strategy': 'breakout', 'sideways_bb_std_mult': 2.3123109801649138, 'sideways_rsi_os': 12, 'sideways_rsi_ob': 74, 'sideways_adx_thresh': 32.25287071194651, 'sideways_atr_min_pct': 0.006596551528357249, 'sideways_atr_max_pct': 0.10619752766380548, 'sideways_tp_mult': 1.0461467705855474, 'sideways_tsl_mult': 0.7478343959727279, 'sideways_time_stop': 198, 'sideways_use_sma': True, 'sideways_use_ema': False, 'sideways_use_atr': False, 'sideways_use_adx': False, 'sideways_use_spike': False, 'sideways_rsi_required': False}.
[I 2025-08-29 20:47:30,679] Trial 611 finished with values: [-1000000000.0, 1000000000.0] and parameters: {'p_sma': 35, 'p_std': 17, 'p_atr': 24, 'p_adx': 13, 'rsi_period': 36, 'ema1': 27, 'ema2': 31, 'slip_atr_k': 0.005158842711110025, 'slip_spread_k': 0.19977557850292757, 'spread_hl_frac': 0.04888328076725564, 'bb_std_mult': 0.545637784403544, 'rsi_os': 9, 'rsi_ob': 81, 'vol_spike': 0.16405084026864392, 'adx_thresh': 13.060923937182666, 'atr_min_pct': 0.020607345418172274, 'atr_max_pct': 0.02122291675588428, 'tp_mult': 1.5679202869936488, 'tsl_mult': 0.6772206154336338, 'strategy': 'breakout', 'time_stop': 178, 'use_sma': True, 'use_atr': True, 'use_adx': False, 'use_ema': True, 'use_spike': False, 'rsi_required': False, 'edge_k': 0.7699448513665208, 'edge_cap': 0.6077162022172066, 'bull_strategy': 'mean_reversion', 'bull_bb_std_mult': 3.0119251386551933, 'bull_rsi_os': 9, 'bull_rsi_ob': 72, 'bull_adx_thresh': 13.284406790501375, 'bull_atr_min_pct': 0.01576326665130549, 'bull_atr_max_pct': 0.09508959853306967, 'bull_tp_mult': 2.8106086784299333, 'bull_tsl_mult': 0.9518237753378473, 'bull_time_stop': 25, 'bull_use_sma': True, 'bull_use_ema': False, 'bull_use_atr': True, 'bull_use_adx': False, 'bull_use_spike': True, 'bull_rsi_required': True, 'bear_strategy': 'breakout', 'bear_bb_std_mult': 2.3052056145251667, 'bear_rsi_os': 27, 'bear_rsi_ob': 72, 'bear_adx_thresh': 21.040920613568662, 'bear_atr_min_pct': 0.005897906154472664, 'bear_atr_max_pct': 0.05889430174078331, 'bear_tp_mult': 2.9058235674837998, 'bear_tsl_mult': 0.9036164108418203, 'bear_time_stop': 47, 'bear_use_sma': True, 'bear_use_ema': True, 'bear_use_atr': True, 'bear_use_adx': True, 'bear_use_spike': True, 'bear_rsi_required': False, 'sideways_strategy': 'breakout', 'sideways_bb_std_mult': 2.325264656437213, 'sideways_rsi_os': 9, 'sideways_rsi_ob': 46, 'sideways_adx_thresh': 31.661264151597877, 'sideways_atr_min_pct': 0.026071032230865775, 'sideways_atr_max_pct': 0.04010858605984586, 'sideways_tp_mult': 1.0444504752410155, 'sideways_tsl_mult': 0.06579151488330703, 'sideways_time_stop': 65, 'sideways_use_sma': False, 'sideways_use_ema': False, 'sideways_use_atr': False, 'sideways_use_adx': True, 'sideways_use_spike': False, 'sideways_rsi_required': False}.
