[I 2025-08-29 19:38:43,186] Trial 18 finished with values: [-1000000000.0, 1000000000.0] and parameters: {'p_sma': 30, 'p_std': 6, 'p_atr': 12, 'p_adx': 24, 'rsi_period': 84, 'ema1': 18, 'ema2': 47, 'slip_atr_k': 0.04391038531087246, 'slip_spread_k': 0.6038588816811967, 'spread_hl_frac': 0.005648245899746031, 'bb_std_mult': 2.8122011580163413, 'rsi_os': 36, 'rsi_ob': 66, 'vol_spike': 0.19096906774099537, 'adx_thresh': 8.707694110760878, 'atr_min_pct': 4.373949393979835e-05, 'atr_max_pct': 0.08551520727226788, 'tp_mult': 2.3140227151965544, 'tsl_mult': 0.7835582904419014, 'strategy': 'breakout', 'time_stop': 215, 'use_sma': False, 'use_atr': True, 'use_adx': True, 'use_ema': False, 'use_spike': True, 'rsi_required': True, 'edge_k': 1.9864797920723434, 'edge_cap': 0.4596819664452103, 'bull_strategy': 'mean_reversion', 'bull_bb_std_mult': 2.973063065516765, 'bull_rsi_os': 37, 'bull_rsi_ob': 86, 'bull_adx_thresh': 14.690769795867318, 'bull_atr_min_pct': 0.011759037014271006, 'bull_atr_max_pct': 0.10792394432448826, 'bull_tp_mult': 2.17145966635739, 'bull_tsl_mult': 0.2647868432246342, 'bull_time_stop': 207, 'bull_use_sma': False, 'bull_use_ema': True, 'bull_use_atr': False, 'bull_use_adx': True, 'bull_use_spike': True, 'bull_rsi_required': False, 'bear_strategy': 'mean_reversion', 'bear_bb_std_mult': 1.7298525360319124, 'bear_rsi_os': 7, 'bear_rsi_ob': 57, 'bear_adx_thresh': 11.529229614461508, 'bear_atr_min_pct': 0.010118652880174751, 'bear_atr_max_pct': 0.09513795207274028, 'bear_tp_mult': 1.8259687215314249, 'bear_tsl_mult': 0.2802074549200364, 'bear_time_stop': 88, 'bear_use_sma': True, 'bear_use_ema': True, 'bear_use_atr': True, 'bear_use_adx': False, 'bear_use_spike': False, 'bear_rsi_required': False, 'sideways_strategy': 'mean_reversion', 'sideways_bb_std_mult': 1.4882046481233548, 'sideways_rsi_os': 16, 'sideways_rsi_ob': 85, 'sideways_adx_thresh': 29.318323729119776, 'sideways_atr_min_pct': 0.011733638166757734, 'sideways_atr_max_pct': 0.11329610412181534, 'sideways_tp_mult': 2.4994254397065183, 'sideways_tsl_mult': 0.2641754661929202, 'sideways_time_stop': 207, 'sideways_use_sma': False, 'sideways_use_ema': True, 'sideways_use_atr': True, 'sideways_use_adx': False, 'sideways_use_spike': False, 'sideways_rsi_required': True}.
[I 2025-08-29 19:39:13,405] Trial 20 finished with values: [-1000000000.0, 1000000000.0] and parameters: {'p_sma': 51, 'p_std': 50, 'p_atr': 19, 'p_adx': 23, 'rsi_period': 83, 'ema1': 15, 'ema2': 44, 'slip_atr_k': 0.03148303864917883, 'slip_spread_k': 0.5677910791335541, 'spread_hl_frac': 0.03808511185815955, 'bb_std_mult': 2.7812943085091706, 'rsi_os': 37, 'rsi_ob': 65, 'vol_spike': 0.2795192218440914, 'adx_thresh': 7.2249308012217455, 'atr_min_pct': 0.01931812562829504, 'atr_max_pct': 0.08666661530555242, 'tp_mult': 1.9993997484931985, 'tsl_mult': 0.021333800099499145, 'strategy': 'breakout', 'time_stop': 53, 'use_sma': False, 'use_atr': True, 'use_adx': True, 'use_ema': False, 'use_spike': True, 'rsi_required': True, 'edge_k': 1.5937133617065722, 'edge_cap': 0.9943249925203735, 'bull_strategy': 'mean_reversion', 'bull_bb_std_mult': 2.643088253479426, 'bull_rsi_os': 34, 'bull_rsi_ob': 85, 'bull_adx_thresh': 15.201820985788235, 'bull_atr_min_pct': 0.018354404646530827, 'bull_atr_max_pct': 0.06795391243922105, 'bull_tp_mult': 2.0786160325758094, 'bull_tsl_mult': 0.38598152113247614, 'bull_time_stop': 195, 'bull_use_sma': True, 'bull_use_ema': True, 'bull_use_atr': False, 'bull_use_adx': True, 'bull_use_spike': True, 'bull_rsi_required': False, 'bear_strategy': 'mean_reversion', 'bear_bb_std_mult': 1.907004847245516, 'bear_rsi_os': 22, 'bear_rsi_ob': 57, 'bear_adx_thresh': 14.875378900063662, 'bear_atr_min_pct': 0.009360493481138137, 'bear_atr_max_pct': 0.10102863806854198, 'bear_tp_mult': 1.8654190370451758, 'bear_tsl_mult': 0.5976000777303929, 'bear_time_stop': 295, 'bear_use_sma': True, 'bear_use_ema': False, 'bear_use_atr': True, 'bear_use_adx': False, 'bear_use_spike': False, 'bear_rsi_required': False, 'sideways_strategy': 'mean_reversion', 'sideways_bb_std_mult': 1.6801178427536596, 'sideways_rsi_os': 15, 'sideways_rsi_ob': 83, 'sideways_adx_thresh': 5.376582048645503, 'sideways_atr_min_pct': 0.011323909120755402, 'sideways_atr_max_pct': 0.1060574849543001, 'sideways_tp_mult': 2.4684981020813703, 'sideways_tsl_mult': 0.24793898899342354, 'sideways_time_stop': 206, 'sideways_use_sma': False, 'sideways_use_ema': True, 'sideways_use_atr': True, 'sideways_use_adx': False, 'sideways_use_spike': False, 'sideways_rsi_required': False}.
[I 2025-08-29 19:39:13,779] Trial 19 finished with values: [-1000000000.0, 1000000000.0] and parameters: {'p_sma': 52, 'p_std': 6, 'p_atr': 19, 'p_adx': 24, 'rsi_period': 84, 'ema1': 6, 'ema2': 46, 'slip_atr_k': 0.041911797732838194, 'slip_spread_k': 0.567348250587296, 'spread_hl_frac': 0.005917154639588439, 'bb_std_mult': 2.7185934286587288, 'rsi_os': 34, 'rsi_ob': 68, 'vol_spike': 0.23826534768600122, 'adx_thresh': 5.809658114827151, 'atr_min_pct': 0.017463975432999754, 'atr_max_pct': 0.09006436326854424, 'tp_mult': 1.9494221369366953, 'tsl_mult': 0.09077132011438321, 'strategy': 'breakout', 'time_stop': 224, 'use_sma': False, 'use_atr': True, 'use_adx': True, 'use_ema': False, 'use_spike': True, 'rsi_required': True, 'edge_k': 1.6170572681063362, 'edge_cap': 0.9958875943359136, 'bull_strategy': 'mean_reversion', 'bull_bb_std_mult': 2.6443225474034207, 'bull_rsi_os': 35, 'bull_rsi_ob': 86, 'bull_adx_thresh': 15.02775956339265, 'bull_atr_min_pct': 0.014386884820083823, 'bull_atr_max_pct': 0.10290091510279457, 'bull_tp_mult': 2.0929293236682076, 'bull_tsl_mult': 0.272672438149541, 'bull_time_stop': 196, 'bull_use_sma': True, 'bull_use_ema': True, 'bull_use_atr': False, 'bull_use_adx': True, 'bull_use_spike': True, 'bull_rsi_required': False, 'bear_strategy': 'mean_reversion', 'bear_bb_std_mult': 1.8972707932046549, 'bear_rsi_os': 5, 'bear_rsi_ob': 55, 'bear_adx_thresh': 11.716165144143915, 'bear_atr_min_pct': 0.009310665220543426, 'bear_atr_max_pct': 0.09574333078620226, 'bear_tp_mult': 1.7417935480479287, 'bear_tsl_mult': 0.33435772186312435, 'bear_time_stop': 90, 'bear_use_sma': True, 'bear_use_ema': False, 'bear_use_atr': True, 'bear_use_adx': False, 'bear_use_spike': False, 'bear_rsi_required': False, 'sideways_strategy': 'mean_reversion', 'sideways_bb_std_mult': 1.6152161292133767, 'sideways_rsi_os': 17, 'sideways_rsi_ob': 85, 'sideways_adx_thresh': 28.8864769384175, 'sideways_atr_min_pct': 0.01173483141730708, 'sideways_atr_max_pct': 0.11057603548611923, 'sideways_tp_mult': 2.5187038995251894, 'sideways_tsl_mult': 0.003840656107839041, 'sideways_time_stop': 207, 'sideways_use_sma': False, 'sideways_use_ema': True, 'sideways_use_atr': True, 'sideways_use_adx': False, 'sideways_use_spike': False, 'sideways_rsi_required': False}.
[I 2025-08-29 19:39:13,786] Trial 21 finished with values: [-1000000000.0, 1000000000.0] and parameters: {'p_sma': 5, 'p_std': 9, 'p_atr': 19, 'p_adx': 30, 'rsi_period': 35, 'ema1': 15, 'ema2': 50, 'slip_atr_k': 0.10524186410672806, 'slip_spread_k': 0.5554848349247149, 'spread_hl_frac': 0.034791305682834124, 'bb_std_mult': 2.730951027255325, 'rsi_os': 18, 'rsi_ob': 89, 'vol_spike': 0.252778902571166, 'adx_thresh': 20.813157726658368, 'atr_min_pct': 0.016759751771294136, 'atr_max_pct': 0.0860018997015922, 'tp_mult': 1.964261265951889, 'tsl_mult': 0.15489957701184048, 'strategy': 'breakout', 'time_stop': 287, 'use_sma': False, 'use_atr': True, 'use_adx': True, 'use_ema': False, 'use_spike': False, 'rsi_required': True, 'edge_k': 0.7480175415347847, 'edge_cap': 0.417565587605497, 'bull_strategy': 'mean_reversion', 'bull_bb_std_mult': 2.2696114649546404, 'bull_rsi_os': 33, 'bull_rsi_ob': 87, 'bull_adx_thresh': 29.27583242410884, 'bull_atr_min_pct': 0.01795365599323268, 'bull_atr_max_pct': 0.07000638176224772, 'bull_tp_mult': 1.02759668429149, 'bull_tsl_mult': 0.13231415186341133, 'bull_time_stop': 115, 'bull_use_sma': True, 'bull_use_ema': True, 'bull_use_atr': True, 'bull_use_adx': False, 'bull_use_spike': True, 'bull_rsi_required': False, 'bear_strategy': 'mean_reversion', 'bear_bb_std_mult': 1.9744284687967517, 'bear_rsi_os': 21, 'bear_rsi_ob': 55, 'bear_adx_thresh': 15.120431553699653, 'bear_atr_min_pct': 0.016435993850109867, 'bear_atr_max_pct': 0.12189131561627134, 'bear_tp_mult': 1.9609077781328, 'bear_tsl_mult': 0.976436195984187, 'bear_time_stop': 290, 'bear_use_sma': True, 'bear_use_ema': False, 'bear_use_atr': True, 'bear_use_adx': False, 'bear_use_spike': False, 'bear_rsi_required': False, 'sideways_strategy': 'mean_reversion', 'sideways_bb_std_mult': 1.8651088218597036, 'sideways_rsi_os': 21, 'sideways_rsi_ob': 84, 'sideways_adx_thresh': 21.01732525241123, 'sideways_atr_min_pct': 0.010926782624864562, 'sideways_atr_max_pct': 0.100529429128172, 'sideways_tp_mult': 2.596276190514036, 'sideways_tsl_mult': 0.2541741695717432, 'sideways_time_stop': 61, 'sideways_use_sma': False, 'sideways_use_ema': True, 'sideways_use_atr': True, 'sideways_use_adx': False, 'sideways_use_spike': False, 'sideways_rsi_required': False}.
[I 2025-08-29 19:39:14,117] Trial 22 finished with values: [-1000000000.0, 1000000000.0] and parameters: {'p_sma': 49, 'p_std': 51, 'p_atr': 18, 'p_adx': 30, 'rsi_period': 31, 'ema1': 14, 'ema2': 33, 'slip_atr_k': 0.09688416651337127, 'slip_spread_k': 0.8358120029027055, 'spread_hl_frac': 0.03798166648873358, 'bb_std_mult': 1.0951113193979758, 'rsi_os': 15, 'rsi_ob': 88, 'vol_spike': 0.2652839710783196, 'adx_thresh': 21.001381573040845, 'atr_min_pct': 0.00723253360374134, 'atr_max_pct': 0.09240641401916594, 'tp_mult': 1.9987209528813417, 'tsl_mult': 0.12087130681618236, 'strategy': 'breakout', 'time_stop': 288, 'use_sma': False, 'use_atr': True, 'use_adx': True, 'use_ema': False, 'use_spike': False, 'rsi_required': True, 'edge_k': 0.7311436439004593, 'edge_cap': 0.05912354040229767, 'bull_strategy': 'mean_reversion', 'bull_bb_std_mult': 2.5171517761620796, 'bull_rsi_os': 20, 'bull_rsi_ob': 75, 'bull_adx_thresh': 28.107637566773484, 'bull_atr_min_pct': 0.018025246162217533, 'bull_atr_max_pct': 0.06593859006538996, 'bull_tp_mult': 2.6298275297607363, 'bull_tsl_mult': 0.12740468792200838, 'bull_time_stop': 124, 'bull_use_sma': True, 'bull_use_ema': True, 'bull_use_atr': True, 'bull_use_adx': False, 'bull_use_spike': True, 'bull_rsi_required': False, 'bear_strategy': 'breakout', 'bear_bb_std_mult': 1.0269892858194243, 'bear_rsi_os': 22, 'bear_rsi_ob': 70, 'bear_adx_thresh': 15.996185049409783, 'bear_atr_min_pct': 0.015686942185699007, 'bear_atr_max_pct': 0.12128872983896549, 'bear_tp_mult': 2.6688757273721064, 'bear_tsl_mult': 0.9930504929298001, 'bear_time_stop': 191, 'bear_use_sma': True, 'bear_use_ema': False, 'bear_use_atr': True, 'bear_use_adx': False, 'bear_use_spike': False, 'bear_rsi_required': False, 'sideways_strategy': 'mean_reversion', 'sideways_bb_std_mult': 3.53182296323406, 'sideways_rsi_os': 24, 'sideways_rsi_ob': 51, 'sideways_adx_thresh': 22.52817325197207, 'sideways_atr_min_pct': 0.02194096843149068, 'sideways_atr_max_pct': 0.10138322025484957, 'sideways_tp_mult': 2.9835852129153446, 'sideways_tsl_mult': 0.04294588931043386, 'sideways_time_stop': 60, 'sideways_use_sma': True, 'sideways_use_ema': True, 'sideways_use_atr': True, 'sideways_use_adx': False, 'sideways_use_spike': False, 'sideways_rsi_required': False}.
[I 2025-08-29 19:39:43,498] Trial 24 finished with values: [-1000000000.0, 1000000000.0] and parameters: {'p_sma': 37, 'p_std': 43, 'p_atr': 15, 'p_adx': 20, 'rsi_period': 18, 'ema1': 11, 'ema2': 30, 'slip_atr_k': 0.10232195588836054, 'slip_spread_k': 0.8078633267313979, 'spread_hl_frac': 0.04404496541521357, 'bb_std_mult': 1.6631955206262985, 'rsi_os': 27, 'rsi_ob': 75, 'vol_spike': 0.15974432202496266, 'adx_thresh': 18.391636414768392, 'atr_min_pct': 0.00701339706907312, 'atr_max_pct': 0.045689994892317835, 'tp_mult': 2.689067850756438, 'tsl_mult': 0.39008844134449855, 'strategy': 'breakout', 'time_stop': 153, 'use_sma': False, 'use_atr': True, 'use_adx': True, 'use_ema': False, 'use_spike': True, 'rsi_required': False, 'edge_k': 0.7940299560004529, 'edge_cap': 0.7638450360932628, 'bull_strategy': 'mean_reversion', 'bull_bb_std_mult': 0.549063267026602, 'bull_rsi_os': 44, 'bull_rsi_ob': 79, 'bull_adx_thresh': 20.515403181668, 'bull_atr_min_pct': 0.02088477017697143, 'bull_atr_max_pct': 0.0763820166922276, 'bull_tp_mult': 2.715576425015835, 'bull_tsl_mult': 0.6511101825324097, 'bull_time_stop': 128, 'bull_use_sma': True, 'bull_use_ema': True, 'bull_use_atr': False, 'bull_use_adx': False, 'bull_use_spike': False, 'bull_rsi_required': True, 'bear_strategy': 'breakout', 'bear_bb_std_mult': 1.1669640417682208, 'bear_rsi_os': 11, 'bear_rsi_ob': 68, 'bear_adx_thresh': 23.924986173060553, 'bear_atr_min_pct': 0.02982882601389621, 'bear_atr_max_pct': 0.1480386445073205, 'bear_tp_mult': 2.626562983238723, 'bear_tsl_mult': 0.6681730040921785, 'bear_time_stop': 183, 'bear_use_sma': True, 'bear_use_ema': False, 'bear_use_atr': True, 'bear_use_adx': False, 'bear_use_spike': False, 'bear_rsi_required': False, 'sideways_strategy': 'breakout', 'sideways_bb_std_mult': 1.0558704559659113, 'sideways_rsi_os': 28, 'sideways_rsi_ob': 55, 'sideways_adx_thresh': 22.296980337665506, 'sideways_atr_min_pct': 0.020591866024896148, 'sideways_atr_max_pct': 0.0878894385878311, 'sideways_tp_mult': 2.752391514126878, 'sideways_tsl_mult': 0.39015222918506465, 'sideways_time_stop': 62, 'sideways_use_sma': True, 'sideways_use_ema': False, 'sideways_use_atr': True, 'sideways_use_adx': True, 'sideways_use_spike': False, 'sideways_rsi_required': False}.
[I 2025-08-29 19:39:43,827] Trial 25 finished with values: [-1000000000.0, 1000000000.0] and parameters: {'p_sma': 37, 'p_std': 43, 'p_atr': 16, 'p_adx': 20, 'rsi_period': 15, 'ema1': 12, 'ema2': 26, 'slip_atr_k': 0.10193971085466803, 'slip_spread_k': 0.865173787821156, 'spread_hl_frac': 0.044114422974741566, 'bb_std_mult': 1.763655277090426, 'rsi_os': 15, 'rsi_ob': 73, 'vol_spike': 0.15843527957174014, 'adx_thresh': 18.479432185991836, 'atr_min_pct': 0.006653076330171948, 'atr_max_pct': 0.04547464249614171, 'tp_mult': 2.6325248336177287, 'tsl_mult': 0.3822609757148493, 'strategy': 'breakout', 'time_stop': 152, 'use_sma': False, 'use_atr': True, 'use_adx': True, 'use_ema': False, 'use_spike': True, 'rsi_required': False, 'edge_k': 0.7365168120387074, 'edge_cap': 0.7431156135078534, 'bull_strategy': 'mean_reversion', 'bull_bb_std_mult': 0.514587430725286, 'bull_rsi_os': 45, 'bull_rsi_ob': 77, 'bull_adx_thresh': 20.1309440351515, 'bull_atr_min_pct': 0.0211818759036531, 'bull_atr_max_pct': 0.14689775012332779, 'bull_tp_mult': 2.680250762147582, 'bull_tsl_mult': 0.5566129105620495, 'bull_time_stop': 123, 'bull_use_sma': True, 'bull_use_ema': True, 'bull_use_atr': False, 'bull_use_adx': False, 'bull_use_spike': False, 'bull_rsi_required': True, 'bear_strategy': 'breakout', 'bear_bb_std_mult': 1.1030412146023731, 'bear_rsi_os': 12, 'bear_rsi_ob': 68, 'bear_adx_thresh': 24.063154890120433, 'bear_atr_min_pct': 0.027146014545778172, 'bear_atr_max_pct': 0.14611812576900662, 'bear_tp_mult': 2.559280369495548, 'bear_tsl_mult': 0.5648091357096411, 'bear_time_stop': 185, 'bear_use_sma': True, 'bear_use_ema': False, 'bear_use_atr': True, 'bear_use_adx': False, 'bear_use_spike': False, 'bear_rsi_required': False, 'sideways_strategy': 'breakout', 'sideways_bb_std_mult': 1.0528224071816146, 'sideways_rsi_os': 27, 'sideways_rsi_ob': 55, 'sideways_adx_thresh': 21.131400318537597, 'sideways_atr_min_pct': 0.020792530100352247, 'sideways_atr_max_pct': 0.08756399563490935, 'sideways_tp_mult': 2.9808283116702574, 'sideways_tsl_mult': 0.38062066134115335, 'sideways_time_stop': 55, 'sideways_use_sma': True, 'sideways_use_ema': False, 'sideways_use_atr': True, 'sideways_use_adx': True, 'sideways_use_spike': False, 'sideways_rsi_required': False}.
[I 2025-08-29 19:39:44,219] Trial 23 finished with values: [-1000000000.0, 1000000000.0] and parameters: {'p_sma': 39, 'p_std': 42, 'p_atr': 16, 'p_adx': 29, 'rsi_period': 34, 'ema1': 13, 'ema2': 32, 'slip_atr_k': 0.10209902134556557, 'slip_spread_k': 0.8068090195889053, 'spread_hl_frac': 0.029516380208189683, 'bb_std_mult': 1.1484166307319221, 'rsi_os': 16, 'rsi_ob': 89, 'vol_spike': 0.24657339059849442, 'adx_thresh': 21.011607166110682, 'atr_min_pct': 0.006938649751451089, 'atr_max_pct': 0.04173486504329484, 'tp_mult': 2.01156785522893, 'tsl_mult': 0.181727742197347, 'strategy': 'breakout', 'time_stop': 278, 'use_sma': False, 'use_atr': True, 'use_adx': True, 'use_ema': False, 'use_spike': False, 'rsi_required': True, 'edge_k': 1.4279092641305873, 'edge_cap': 0.3306032645551432, 'bull_strategy': 'mean_reversion', 'bull_bb_std_mult': 2.2068133837813573, 'bull_rsi_os': 44, 'bull_rsi_ob': 77, 'bull_adx_thresh': 20.003218818338198, 'bull_atr_min_pct': 0.01972886476311056, 'bull_atr_max_pct': 0.1428887462409545, 'bull_tp_mult': 2.6002709006442655, 'bull_tsl_mult': 0.1513372580013645, 'bull_time_stop': 127, 'bull_use_sma': True, 'bull_use_ema': True, 'bull_use_atr': True, 'bull_use_adx': False, 'bull_use_spike': True, 'bull_rsi_required': False, 'bear_strategy': 'breakout', 'bear_bb_std_mult': 0.9530570069179793, 'bear_rsi_os': 21, 'bear_rsi_ob': 70, 'bear_adx_thresh': 22.73968332216293, 'bear_atr_min_pct': 0.01541337355198058, 'bear_atr_max_pct': 0.11982257826907285, 'bear_tp_mult': 2.6593176599347057, 'bear_tsl_mult': 0.9949750393983149, 'bear_time_stop': 170, 'bear_use_sma': True, 'bear_use_ema': False, 'bear_use_atr': True, 'bear_use_adx': False, 'bear_use_spike': False, 'bear_rsi_required': False, 'sideways_strategy': 'mean_reversion', 'sideways_bb_std_mult': 3.5552904172498936, 'sideways_rsi_os': 23, 'sideways_rsi_ob': 51, 'sideways_adx_thresh': 20.870658259870744, 'sideways_atr_min_pct': 0.021341221619585377, 'sideways_atr_max_pct': 0.09244461102254896, 'sideways_tp_mult': 2.172078591304162, 'sideways_tsl_mult': 0.00026537930694447986, 'sideways_time_stop': 78, 'sideways_use_sma': True, 'sideways_use_ema': True, 'sideways_use_atr': True, 'sideways_use_adx': False, 'sideways_use_spike': False, 'sideways_rsi_required': False}.
[I 2025-08-29 19:39:44,416] Trial 26 finished with values: [-1000000000.0, 1000000000.0] and parameters: {'p_sma': 39, 'p_std': 43, 'p_atr': 10, 'p_adx': 20, 'rsi_period': 16, 'ema1': 11, 'ema2': 29, 'slip_atr_k': 0.10567479189673606, 'slip_spread_k': 0.8316841810574684, 'spread_hl_frac': 0.045164550854035826, 'bb_std_mult': 1.774212342977178, 'rsi_os': 26, 'rsi_ob': 74, 'vol_spike': 0.16235453869275748, 'adx_thresh': 10.687955205034601, 'atr_min_pct': 0.008130984591516559, 'atr_max_pct': 0.050379340089585806, 'tp_mult': 2.6644200941911405, 'tsl_mult': 0.38254359529849424, 'strategy': 'breakout', 'time_stop': 149, 'use_sma': False, 'use_atr': False, 'use_adx': True, 'use_ema': True, 'use_spike': True, 'rsi_required': False, 'edge_k': 1.409729582425849, 'edge_cap': 0.7699927220675191, 'bull_strategy': 'breakout', 'bull_bb_std_mult': 1.9011692920600272, 'bull_rsi_os': 43, 'bull_rsi_ob': 79, 'bull_adx_thresh': 20.2153500794254, 'bull_atr_min_pct': 0.02083072717015465, 'bull_atr_max_pct': 0.14645885472593684, 'bull_tp_mult': 2.940549007134274, 'bull_tsl_mult': 0.5661469202423742, 'bull_time_stop': 260, 'bull_use_sma': True, 'bull_use_ema': True, 'bull_use_atr': False, 'bull_use_adx': False, 'bull_use_spike': False, 'bull_rsi_required': True, 'bear_strategy': 'breakout', 'bear_bb_std_mult': 1.245470599708938, 'bear_rsi_os': 11, 'bear_rsi_ob': 67, 'bear_adx_thresh': 23.64752908107726, 'bear_atr_min_pct': 0.026375777115966857, 'bear_atr_max_pct': 0.14972242126848617, 'bear_tp_mult': 2.478297724026265, 'bear_tsl_mult': 0.533268918147056, 'bear_time_stop': 175, 'bear_use_sma': False, 'bear_use_ema': True, 'bear_use_atr': False, 'bear_use_adx': True, 'bear_use_spike': True, 'bear_rsi_required': True, 'sideways_strategy': 'breakout', 'sideways_bb_std_mult': 0.508426761697555, 'sideways_rsi_os': 31, 'sideways_rsi_ob': 55, 'sideways_adx_thresh': 18.91672918366983, 'sideways_atr_min_pct': 0.015358910457171391, 'sideways_atr_max_pct': 0.0872864418809168, 'sideways_tp_mult': 2.1644078270224, 'sideways_tsl_mult': 0.3624684362450118, 'sideways_time_stop': 64, 'sideways_use_sma': True, 'sideways_use_ema': False, 'sideways_use_atr': False, 'sideways_use_adx': True, 'sideways_use_spike': True, 'sideways_rsi_required': False}.
