[I 2025-08-29 19:59:37,746] Trial 198 finished with values: [-0.0051730274545774835, 0.005369492916098588] and parameters: {'p_sma': 39, 'p_std': 50, 'p_atr': 15, 'p_adx': 15, 'rsi_period': 25, 'ema1': 13, 'ema2': 42, 'slip_atr_k': 0.08509758351232763, 'slip_spread_k': 0.22724477645229277, 'spread_hl_frac': 0.002782598250392323, 'bb_std_mult': 1.2574324757863615, 'rsi_os': 20, 'rsi_ob': 68, 'vol_spike': 0.1564167103589094, 'adx_thresh': 20.894323991074366, 'atr_min_pct': 0.011190254866037194, 'atr_max_pct': 0.08138648676995494, 'tp_mult': 2.2948621424613993, 'tsl_mult': 0.7077537454031259, 'strategy': 'mean_reversion', 'time_stop': 103, 'use_sma': False, 'use_atr': True, 'use_adx': False, 'use_ema': True, 'use_spike': False, 'rsi_required': False, 'edge_k': 0.9110882429062819, 'edge_cap': 0.627510277401553, 'bull_strategy': 'breakout', 'bull_bb_std_mult': 3.5225000315090864, 'bull_rsi_os': 42, 'bull_rsi_ob': 94, 'bull_adx_thresh': 18.24217281949633, 'bull_atr_min_pct': 0.023164599676890822, 'bull_atr_max_pct': 0.055796733164401986, 'bull_tp_mult': 2.2952746761212897, 'bull_tsl_mult': 0.17521282460087917, 'bull_time_stop': 292, 'bull_use_sma': False, 'bull_use_ema': False, 'bull_use_atr': True, 'bull_use_adx': True, 'bull_use_spike': False, 'bull_rsi_required': True, 'bear_strategy': 'breakout', 'bear_bb_std_mult': 1.1947635014488658, 'bear_rsi_os': 27, 'bear_rsi_ob': 48, 'bear_adx_thresh': 5.960958517271892, 'bear_atr_min_pct': 0.004876622197776997, 'bear_atr_max_pct': 0.03973720352384227, 'bear_tp_mult': 1.8162408257373186, 'bear_tsl_mult': 0.05196586070478837, 'bear_time_stop': 24, 'bear_use_sma': False, 'bear_use_ema': True, 'bear_use_atr': True, 'bear_use_adx': True, 'bear_use_spike': False, 'bear_rsi_required': False, 'sideways_strategy': 'mean_reversion', 'sideways_bb_std_mult': 1.8473128674810628, 'sideways_rsi_os': 42, 'sideways_rsi_ob': 82, 'sideways_adx_thresh': 28.614044006340137, 'sideways_atr_min_pct': 0.020731086343443495, 'sideways_atr_max_pct': 0.12393898511715476, 'sideways_tp_mult': 2.100275981577844, 'sideways_tsl_mult': 0.13037194026574084, 'sideways_time_stop': 279, 'sideways_use_sma': False, 'sideways_use_ema': True, 'sideways_use_atr': True, 'sideways_use_adx': False, 'sideways_use_spike': False, 'sideways_rsi_required': True}.
[I 2025-08-29 19:59:40,427] Trial 199 finished with values: [-1000000000.0, 1000000000.0] and parameters: {'p_sma': 39, 'p_std': 13, 'p_atr': 23, 'p_adx': 15, 'rsi_period': 22, 'ema1': 13, 'ema2': 42, 'slip_atr_k': 0.10785511319227181, 'slip_spread_k': 0.23658693633625263, 'spread_hl_frac': 0.016751658566742426, 'bb_std_mult': 1.4217344235099911, 'rsi_os': 43, 'rsi_ob': 68, 'vol_spike': 0.17285657944088864, 'adx_thresh': 32.80997523624527, 'atr_min_pct': 0.027468497308074435, 'atr_max_pct': 0.051198938559478865, 'tp_mult': 1.0640802773785678, 'tsl_mult': 0.5989594682095303, 'strategy': 'mean_reversion', 'time_stop': 117, 'use_sma': False, 'use_atr': True, 'use_adx': False, 'use_ema': True, 'use_spike': False, 'rsi_required': False, 'edge_k': 0.8592829775644542, 'edge_cap': 0.41298857684182255, 'bull_strategy': 'breakout', 'bull_bb_std_mult': 0.9272809868915634, 'bull_rsi_os': 42, 'bull_rsi_ob': 82, 'bull_adx_thresh': 18.127297790741924, 'bull_atr_min_pct': 0.026771291206504604, 'bull_atr_max_pct': 0.028966870086321074, 'bull_tp_mult': 1.216813985881519, 'bull_tsl_mult': 0.21536843694319935, 'bull_time_stop': 269, 'bull_use_sma': False, 'bull_use_ema': False, 'bull_use_atr': True, 'bull_use_adx': True, 'bull_use_spike': False, 'bull_rsi_required': True, 'bear_strategy': 'breakout', 'bear_bb_std_mult': 1.1888778601738645, 'bear_rsi_os': 28, 'bear_rsi_ob': 70, 'bear_adx_thresh': 32.83083785360593, 'bear_atr_min_pct': 0.01813680087789401, 'bear_atr_max_pct': 0.10609112148343154, 'bear_tp_mult': 1.8790987999804702, 'bear_tsl_mult': 0.723585314456943, 'bear_time_stop': 5, 'bear_use_sma': False, 'bear_use_ema': True, 'bear_use_atr': True, 'bear_use_adx': True, 'bear_use_spike': False, 'bear_rsi_required': False, 'sideways_strategy': 'mean_reversion', 'sideways_bb_std_mult': 1.8287452300473606, 'sideways_rsi_os': 13, 'sideways_rsi_ob': 71, 'sideways_adx_thresh': 27.919496900115938, 'sideways_atr_min_pct': 0.02575636844549048, 'sideways_atr_max_pct': 0.1311012157143101, 'sideways_tp_mult': 1.733148289244074, 'sideways_tsl_mult': 0.11073944367632198, 'sideways_time_stop': 276, 'sideways_use_sma': False, 'sideways_use_ema': True, 'sideways_use_atr': True, 'sideways_use_adx': False, 'sideways_use_spike': False, 'sideways_rsi_required': True}.
[I 2025-08-29 19:59:40,489] Trial 200 finished with values: [-1000000000.0, 1000000000.0] and parameters: {'p_sma': 35, 'p_std': 14, 'p_atr': 19, 'p_adx': 13, 'rsi_period': 22, 'ema1': 27, 'ema2': 40, 'slip_atr_k': 0.051109249789691204, 'slip_spread_k': 0.2971685367095417, 'spread_hl_frac': 0.0026096926933786117, 'bb_std_mult': 1.4423477526216593, 'rsi_os': 22, 'rsi_ob': 65, 'vol_spike': 0.17314079012975978, 'adx_thresh': 34.439379445127415, 'atr_min_pct': 0.012787434417356275, 'atr_max_pct': 0.10720195336728724, 'tp_mult': 1.0847676571916975, 'tsl_mult': 0.0033611822753863985, 'strategy': 'mean_reversion', 'time_stop': 114, 'use_sma': False, 'use_atr': True, 'use_adx': False, 'use_ema': True, 'use_spike': False, 'rsi_required': True, 'edge_k': 1.3168696131410063, 'edge_cap': 0.4128890888655431, 'bull_strategy': 'breakout', 'bull_bb_std_mult': 0.9125362525109124, 'bull_rsi_os': 5, 'bull_rsi_ob': 82, 'bull_adx_thresh': 18.646141950677332, 'bull_atr_min_pct': 0.021061924208042766, 'bull_atr_max_pct': 0.05550205443592416, 'bull_tp_mult': 1.7240685687237116, 'bull_tsl_mult': 0.14516468030808427, 'bull_time_stop': 66, 'bull_use_sma': False, 'bull_use_ema': False, 'bull_use_atr': True, 'bull_use_adx': False, 'bull_use_spike': False, 'bull_rsi_required': True, 'bear_strategy': 'breakout', 'bear_bb_std_mult': 1.2064078543649437, 'bear_rsi_os': 51, 'bear_rsi_ob': 76, 'bear_adx_thresh': 5.5881462573411, 'bear_atr_min_pct': 0.027763733013402396, 'bear_atr_max_pct': 0.01004317503542429, 'bear_tp_mult': 1.970688251184144, 'bear_tsl_mult': 0.6513790888967576, 'bear_time_stop': 15, 'bear_use_sma': False, 'bear_use_ema': False, 'bear_use_atr': True, 'bear_use_adx': True, 'bear_use_spike': False, 'bear_rsi_required': True, 'sideways_strategy': 'mean_reversion', 'sideways_bb_std_mult': 1.8343960827151018, 'sideways_rsi_os': 13, 'sideways_rsi_ob': 82, 'sideways_adx_thresh': 27.62139697793338, 'sideways_atr_min_pct': 0.018302130550960458, 'sideways_atr_max_pct': 0.12508014879569074, 'sideways_tp_mult': 2.5256236209459124, 'sideways_tsl_mult': 0.6152126266931391, 'sideways_time_stop': 28, 'sideways_use_sma': False, 'sideways_use_ema': False, 'sideways_use_atr': True, 'sideways_use_adx': False, 'sideways_use_spike': False, 'sideways_rsi_required': True}.
[I 2025-08-29 20:00:08,222] Trial 201 finished with values: [-0.0066063308636126195, 0.006769684768724586] and parameters: {'p_sma': 24, 'p_std': 12, 'p_atr': 26, 'p_adx': 25, 'rsi_period': 34, 'ema1': 21, 'ema2': 38, 'slip_atr_k': 0.18569921383035715, 'slip_spread_k': 0.4455455625902827, 'spread_hl_frac': 0.0023805268067115335, 'bb_std_mult': 3.12126854691934, 'rsi_os': 5, 'rsi_ob': 65, 'vol_spike': 0.17215513460051393, 'adx_thresh': 32.802697143454225, 'atr_min_pct': 0.02059018020039701, 'atr_max_pct': 0.09692792130730692, 'tp_mult': 2.522919658884558, 'tsl_mult': 0.11964510325082861, 'strategy': 'mean_reversion', 'time_stop': 116, 'use_sma': False, 'use_atr': True, 'use_adx': False, 'use_ema': False, 'use_spike': False, 'rsi_required': True, 'edge_k': 1.2499185553161816, 'edge_cap': 0.4160087717835876, 'bull_strategy': 'breakout', 'bull_bb_std_mult': 0.930781979560451, 'bull_rsi_os': 22, 'bull_rsi_ob': 82, 'bull_adx_thresh': 16.417079770262017, 'bull_atr_min_pct': 0.021018142564406834, 'bull_atr_max_pct': 0.05477170255589633, 'bull_tp_mult': 1.7189960766173331, 'bull_tsl_mult': 0.7106738436541153, 'bull_time_stop': 80, 'bull_use_sma': False, 'bull_use_ema': False, 'bull_use_atr': True, 'bull_use_adx': False, 'bull_use_spike': False, 'bull_rsi_required': True, 'bear_strategy': 'breakout', 'bear_bb_std_mult': 1.2301327763381131, 'bear_rsi_os': 29, 'bear_rsi_ob': 70, 'bear_adx_thresh': 28.286512708506017, 'bear_atr_min_pct': 0.004921626033185226, 'bear_atr_max_pct': 0.10517112284388325, 'bear_tp_mult': 1.410941635968051, 'bear_tsl_mult': 0.7170932893021861, 'bear_time_stop': 13, 'bear_use_sma': False, 'bear_use_ema': True, 'bear_use_atr': True, 'bear_use_adx': False, 'bear_use_spike': True, 'bear_rsi_required': True, 'sideways_strategy': 'mean_reversion', 'sideways_bb_std_mult': 1.817826844544925, 'sideways_rsi_os': 31, 'sideways_rsi_ob': 82, 'sideways_adx_thresh': 28.872641249618564, 'sideways_atr_min_pct': 0.006427994955364424, 'sideways_atr_max_pct': 0.12696249181861935, 'sideways_tp_mult': 1.2170183262007916, 'sideways_tsl_mult': 0.11516807589312578, 'sideways_time_stop': 252, 'sideways_use_sma': False, 'sideways_use_ema': False, 'sideways_use_atr': False, 'sideways_use_adx': True, 'sideways_use_spike': False, 'sideways_rsi_required': True}.
[I 2025-08-29 20:00:09,334] Trial 202 finished with values: [-1000000000.0, 1000000000.0] and parameters: {'p_sma': 37, 'p_std': 50, 'p_atr': 15, 'p_adx': 27, 'rsi_period': 57, 'ema1': 26, 'ema2': 38, 'slip_atr_k': 0.1845870240926044, 'slip_spread_k': 0.24406740671518082, 'spread_hl_frac': 0.017017463462783287, 'bb_std_mult': 1.1377341420587093, 'rsi_os': 24, 'rsi_ob': 68, 'vol_spike': 0.1649720889396135, 'adx_thresh': 34.43127311403714, 'atr_min_pct': 0.02627929373857482, 'atr_max_pct': 0.09614233904546353, 'tp_mult': 2.2910744669593877, 'tsl_mult': 0.27795586942526684, 'strategy': 'mean_reversion', 'time_stop': 117, 'use_sma': False, 'use_atr': True, 'use_adx': False, 'use_ema': False, 'use_spike': False, 'rsi_required': True, 'edge_k': 0.5464386494741387, 'edge_cap': 0.1590663463037425, 'bull_strategy': 'breakout', 'bull_bb_std_mult': 0.9101818992720668, 'bull_rsi_os': 22, 'bull_rsi_ob': 83, 'bull_adx_thresh': 18.746928362395813, 'bull_atr_min_pct': 0.02087740927404517, 'bull_atr_max_pct': 0.05492119354910491, 'bull_tp_mult': 1.7781521295711247, 'bull_tsl_mult': 0.7034454675362605, 'bull_time_stop': 71, 'bull_use_sma': False, 'bull_use_ema': False, 'bull_use_atr': True, 'bull_use_adx': False, 'bull_use_spike': False, 'bull_rsi_required': True, 'bear_strategy': 'breakout', 'bear_bb_std_mult': 2.533159220135076, 'bear_rsi_os': 51, 'bear_rsi_ob': 70, 'bear_adx_thresh': 6.7595901133349265, 'bear_atr_min_pct': 0.010935894750441311, 'bear_atr_max_pct': 0.10692959205277626, 'bear_tp_mult': 1.5667981590205664, 'bear_tsl_mult': 0.6550768481146624, 'bear_time_stop': 205, 'bear_use_sma': False, 'bear_use_ema': True, 'bear_use_atr': True, 'bear_use_adx': False, 'bear_use_spike': True, 'bear_rsi_required': True, 'sideways_strategy': 'mean_reversion', 'sideways_bb_std_mult': 2.686874080569276, 'sideways_rsi_os': 31, 'sideways_rsi_ob': 82, 'sideways_adx_thresh': 28.600567553851565, 'sideways_atr_min_pct': 0.02050561911974273, 'sideways_atr_max_pct': 0.09364757975700641, 'sideways_tp_mult': 1.4208310683791865, 'sideways_tsl_mult': 0.05139536480519885, 'sideways_time_stop': 251, 'sideways_use_sma': False, 'sideways_use_ema': False, 'sideways_use_atr': False, 'sideways_use_adx': True, 'sideways_use_spike': False, 'sideways_rsi_required': True}.
[I 2025-08-29 20:00:10,876] Trial 204 finished with values: [-0.007911173023051776, 0.007942038301233023] and parameters: {'p_sma': 37, 'p_std': 28, 'p_atr': 22, 'p_adx': 16, 'rsi_period': 20, 'ema1': 21, 'ema2': 40, 'slip_atr_k': 0.03990289845515311, 'slip_spread_k': 0.9251967194355133, 'spread_hl_frac': 0.0010462046955659193, 'bb_std_mult': 1.1355969109912716, 'rsi_os': 20, 'rsi_ob': 68, 'vol_spike': 0.1643781352612781, 'adx_thresh': 32.614667358909834, 'atr_min_pct': 0.014293871961729005, 'atr_max_pct': 0.08705598339883885, 'tp_mult': 1.5469683452445624, 'tsl_mult': 0.27154497064764443, 'strategy': 'mean_reversion', 'time_stop': 96, 'use_sma': False, 'use_atr': True, 'use_adx': False, 'use_ema': False, 'use_spike': False, 'rsi_required': True, 'edge_k': 1.2436524024825764, 'edge_cap': 0.4482401476782588, 'bull_strategy': 'breakout', 'bull_bb_std_mult': 2.080220029550606, 'bull_rsi_os': 39, 'bull_rsi_ob': 76, 'bull_adx_thresh': 11.95387524821527, 'bull_atr_min_pct': 0.02010191024958529, 'bull_atr_max_pct': 0.0604487519300594, 'bull_tp_mult': 1.42124832060244, 'bull_tsl_mult': 0.6890056915742513, 'bull_time_stop': 156, 'bull_use_sma': False, 'bull_use_ema': True, 'bull_use_atr': False, 'bull_use_adx': True, 'bull_use_spike': False, 'bull_rsi_required': False, 'bear_strategy': 'breakout', 'bear_bb_std_mult': 1.242042457852259, 'bear_rsi_os': 47, 'bear_rsi_ob': 67, 'bear_adx_thresh': 28.257352648129064, 'bear_atr_min_pct': 0.005217724643044475, 'bear_atr_max_pct': 0.013806761278484667, 'bear_tp_mult': 1.8924855589556595, 'bear_tsl_mult': 0.4248512471393908, 'bear_time_stop': 22, 'bear_use_sma': False, 'bear_use_ema': False, 'bear_use_atr': False, 'bear_use_adx': False, 'bear_use_spike': True, 'bear_rsi_required': False, 'sideways_strategy': 'mean_reversion', 'sideways_bb_std_mult': 0.8495224903103413, 'sideways_rsi_os': 31, 'sideways_rsi_ob': 95, 'sideways_adx_thresh': 28.6996109369865, 'sideways_atr_min_pct': 0.020788511665016066, 'sideways_atr_max_pct': 0.12380458473454106, 'sideways_tp_mult': 1.6165711251929094, 'sideways_tsl_mult': 0.17427664278353558, 'sideways_time_stop': 252, 'sideways_use_sma': False, 'sideways_use_ema': True, 'sideways_use_atr': False, 'sideways_use_adx': True, 'sideways_use_spike': False, 'sideways_rsi_required': True}.
[I 2025-08-29 20:00:10,983] Trial 203 finished with values: [-0.0022841707548212353, 0.00250054444080959] and parameters: {'p_sma': 37, 'p_std': 50, 'p_atr': 18, 'p_adx': 25, 'rsi_period': 18, 'ema1': 12, 'ema2': 38, 'slip_atr_k': 0.040696935779087694, 'slip_spread_k': 0.2547023699058313, 'spread_hl_frac': 0.00451035285780644, 'bb_std_mult': 3.057440105677963, 'rsi_os': 20, 'rsi_ob': 68, 'vol_spike': 0.1624721065744949, 'adx_thresh': 32.656350249312275, 'atr_min_pct': 0.014426821064181663, 'atr_max_pct': 0.08734869421068042, 'tp_mult': 2.4238975071788302, 'tsl_mult': 0.14792847732509823, 'strategy': 'mean_reversion', 'time_stop': 94, 'use_sma': False, 'use_atr': True, 'use_adx': False, 'use_ema': False, 'use_spike': False, 'rsi_required': True, 'edge_k': 1.2349952594260418, 'edge_cap': 0.4586819560367699, 'bull_strategy': 'breakout', 'bull_bb_std_mult': 0.7230485828119512, 'bull_rsi_os': 41, 'bull_rsi_ob': 95, 'bull_adx_thresh': 16.301174183071126, 'bull_atr_min_pct': 0.02262684729061847, 'bull_atr_max_pct': 0.14852023787841911, 'bull_tp_mult': 1.2821076619311171, 'bull_tsl_mult': 0.15000310122787033, 'bull_time_stop': 17, 'bull_use_sma': False, 'bull_use_ema': True, 'bull_use_atr': False, 'bull_use_adx': True, 'bull_use_spike': False, 'bull_rsi_required': False, 'bear_strategy': 'breakout', 'bear_bb_std_mult': 1.2595169627618854, 'bear_rsi_os': 29, 'bear_rsi_ob': 68, 'bear_adx_thresh': 28.245549895830152, 'bear_atr_min_pct': 0.005193889517812623, 'bear_atr_max_pct': 0.08440255437906857, 'bear_tp_mult': 1.2463704141633283, 'bear_tsl_mult': 0.047615896381326295, 'bear_time_stop': 245, 'bear_use_sma': False, 'bear_use_ema': False, 'bear_use_atr': False, 'bear_use_adx': False, 'bear_use_spike': True, 'bear_rsi_required': False, 'sideways_strategy': 'mean_reversion', 'sideways_bb_std_mult': 2.705796535010123, 'sideways_rsi_os': 31, 'sideways_rsi_ob': 83, 'sideways_adx_thresh': 28.629969466704228, 'sideways_atr_min_pct': 0.010187329979819588, 'sideways_atr_max_pct': 0.12333847458609835, 'sideways_tp_mult': 2.0001261020032235, 'sideways_tsl_mult': 0.23393913764026855, 'sideways_time_stop': 253, 'sideways_use_sma': False, 'sideways_use_ema': True, 'sideways_use_atr': False, 'sideways_use_adx': True, 'sideways_use_spike': False, 'sideways_rsi_required': True}.
[I 2025-08-29 20:00:39,990] Trial 205 finished with values: [-1000000000.0, 1000000000.0] and parameters: {'p_sma': 37, 'p_std': 50, 'p_atr': 15, 'p_adx': 27, 'rsi_period': 77, 'ema1': 12, 'ema2': 41, 'slip_atr_k': 0.04006246784511677, 'slip_spread_k': 0.6370267209173084, 'spread_hl_frac': 0.004092684342746946, 'bb_std_mult': 2.657681512075108, 'rsi_os': 24, 'rsi_ob': 68, 'vol_spike': 0.1666433176569291, 'adx_thresh': 29.84558665880104, 'atr_min_pct': 0.02627784841244448, 'atr_max_pct': 0.08655304066700518, 'tp_mult': 1.52974552847976, 'tsl_mult': 0.7440054432576472, 'strategy': 'mean_reversion', 'time_stop': 94, 'use_sma': False, 'use_atr': True, 'use_adx': True, 'use_ema': False, 'use_spike': True, 'rsi_required': True, 'edge_k': 1.21488577359447, 'edge_cap': 0.4583530955912479, 'bull_strategy': 'breakout', 'bull_bb_std_mult': 0.7551028088755115, 'bull_rsi_os': 41, 'bull_rsi_ob': 76, 'bull_adx_thresh': 25.7390690494369, 'bull_atr_min_pct': 0.022628449175830477, 'bull_atr_max_pct': 0.1498358027867064, 'bull_tp_mult': 1.6240617203299692, 'bull_tsl_mult': 0.14289779104910666, 'bull_time_stop': 50, 'bull_use_sma': False, 'bull_use_ema': True, 'bull_use_atr': False, 'bull_use_adx': True, 'bull_use_spike': False, 'bull_rsi_required': False, 'bear_strategy': 'breakout', 'bear_bb_std_mult': 1.289326058034656, 'bear_rsi_os': 18, 'bear_rsi_ob': 67, 'bear_adx_thresh': 6.856136118852901, 'bear_atr_min_pct': 0.006387983711272626, 'bear_atr_max_pct': 0.11316076895719648, 'bear_tp_mult': 1.8937983309265443, 'bear_tsl_mult': 0.5149694195786898, 'bear_time_stop': 129, 'bear_use_sma': True, 'bear_use_ema': False, 'bear_use_atr': False, 'bear_use_adx': False, 'bear_use_spike': False, 'bear_rsi_required': False, 'sideways_strategy': 'mean_reversion', 'sideways_bb_std_mult': 2.6938341454654755, 'sideways_rsi_os': 30, 'sideways_rsi_ob': 83, 'sideways_adx_thresh': 8.75209910943451, 'sideways_atr_min_pct': 0.01021967356629929, 'sideways_atr_max_pct': 0.12026547908908622, 'sideways_tp_mult': 1.9431995011875416, 'sideways_tsl_mult': 0.23592785764085836, 'sideways_time_stop': 160, 'sideways_use_sma': False, 'sideways_use_ema': True, 'sideways_use_atr': False, 'sideways_use_adx': False, 'sideways_use_spike': False, 'sideways_rsi_required': True}.
[I 2025-08-29 20:00:40,916] Trial 206 finished with values: [-0.004434928933099047, 0.004541036709246921] and parameters: {'p_sma': 38, 'p_std': 55, 'p_atr': 22, 'p_adx': 28, 'rsi_period': 20, 'ema1': 12, 'ema2': 42, 'slip_atr_k': 0.03957157230210276, 'slip_spread_k': 0.4729747188737525, 'spread_hl_frac': 0.004155176846862656, 'bb_std_mult': 0.5706777635697633, 'rsi_os': 11, 'rsi_ob': 67, 'vol_spike': 0.16283556515031697, 'adx_thresh': 10.102732591454707, 'atr_min_pct': 0.025389195331600237, 'atr_max_pct': 0.08666038175789825, 'tp_mult': 1.3336700990686547, 'tsl_mult': 0.659577531841296, 'strategy': 'mean_reversion', 'time_stop': 94, 'use_sma': False, 'use_atr': True, 'use_adx': True, 'use_ema': False, 'use_spike': True, 'rsi_required': True, 'edge_k': 1.3180887637290757, 'edge_cap': 0.4654765423596074, 'bull_strategy': 'breakout', 'bull_bb_std_mult': 0.7312075246024697, 'bull_rsi_os': 27, 'bull_rsi_ob': 65, 'bull_adx_thresh': 25.70409559859868, 'bull_atr_min_pct': 0.002767486292286521, 'bull_atr_max_pct': 0.06077608415581244, 'bull_tp_mult': 1.6226401298228814, 'bull_tsl_mult': 0.14178218675003726, 'bull_time_stop': 51, 'bull_use_sma': False, 'bull_use_ema': True, 'bull_use_atr': False, 'bull_use_adx': True, 'bull_use_spike': False, 'bull_rsi_required': False, 'bear_strategy': 'mean_reversion', 'bear_bb_std_mult': 0.6809753361938327, 'bear_rsi_os': 31, 'bear_rsi_ob': 67, 'bear_adx_thresh': 5.054939371589626, 'bear_atr_min_pct': 0.006069890550506861, 'bear_atr_max_pct': 0.08488262810877822, 'bear_tp_mult': 1.863403604193396, 'bear_tsl_mult': 0.805119792366795, 'bear_time_stop': 243, 'bear_use_sma': True, 'bear_use_ema': False, 'bear_use_atr': False, 'bear_use_adx': False, 'bear_use_spike': False, 'bear_rsi_required': False, 'sideways_strategy': 'mean_reversion', 'sideways_bb_std_mult': 1.956313402340021, 'sideways_rsi_os': 9, 'sideways_rsi_ob': 83, 'sideways_adx_thresh': 29.187060613892143, 'sideways_atr_min_pct': 0.010348183796318494, 'sideways_atr_max_pct': 0.1235070513117738, 'sideways_tp_mult': 1.9404566929769664, 'sideways_tsl_mult': 0.1694414219445894, 'sideways_time_stop': 261, 'sideways_use_sma': False, 'sideways_use_ema': True, 'sideways_use_atr': True, 'sideways_use_adx': False, 'sideways_use_spike': False, 'sideways_rsi_required': True}.
