[I 2025-08-29 21:15:16,075] Trial 846 finished with values: [-1000000000.0, 1000000000.0] and parameters: {'p_sma': 16, 'p_std': 28, 'p_atr': 15, 'p_adx': 10, 'rsi_period': 31, 'ema1': 14, 'ema2': 29, 'slip_atr_k': 0.20122818752513763, 'slip_spread_k': 0.05339951047446151, 'spread_hl_frac': 0.02296754712991077, 'bb_std_mult': 1.0516903424642208, 'rsi_os': 8, 'rsi_ob': 79, 'vol_spike': 0.2663741023131003, 'adx_thresh': 7.937739361993977, 'atr_min_pct': 0.011142762256100695, 'atr_max_pct': 0.03555305487984634, 'tp_mult': 2.485586960789742, 'tsl_mult': 0.7461796768050603, 'strategy': 'mean_reversion', 'time_stop': 221, 'use_sma': True, 'use_atr': False, 'use_adx': False, 'use_ema': False, 'use_spike': True, 'rsi_required': False, 'edge_k': 0.8411553997443336, 'edge_cap': 0.2603193140370733, 'bull_strategy': 'mean_reversion', 'bull_bb_std_mult': 2.674847936376688, 'bull_rsi_os': 24, 'bull_rsi_ob': 69, 'bull_adx_thresh': 31.741394883802347, 'bull_atr_min_pct': 0.019094396360154413, 'bull_atr_max_pct': 0.10201215407023304, 'bull_tp_mult': 2.4187340192237508, 'bull_tsl_mult': 0.9389867578239012, 'bull_time_stop': 186, 'bull_use_sma': True, 'bull_use_ema': False, 'bull_use_atr': False, 'bull_use_adx': True, 'bull_use_spike': True, 'bull_rsi_required': False, 'bear_strategy': 'breakout', 'bear_bb_std_mult': 2.2080947949483822, 'bear_rsi_os': 40, 'bear_rsi_ob': 88, 'bear_adx_thresh': 11.551626356703093, 'bear_atr_min_pct': 0.027105133008887335, 'bear_atr_max_pct': 0.08361959607010225, 'bear_tp_mult': 2.9218568058402465, 'bear_tsl_mult': 0.03445028821984314, 'bear_time_stop': 244, 'bear_use_sma': False, 'bear_use_ema': False, 'bear_use_atr': False, 'bear_use_adx': False, 'bear_use_spike': True, 'bear_rsi_required': False, 'sideways_strategy': 'breakout', 'sideways_bb_std_mult': 3.472166260307742, 'sideways_rsi_os': 23, 'sideways_rsi_ob': 84, 'sideways_adx_thresh': 9.602846424289144, 'sideways_atr_min_pct': 0.014037580664674424, 'sideways_atr_max_pct': 0.04527881654981606, 'sideways_tp_mult': 2.2569121229401765, 'sideways_tsl_mult': 0.5640069151377656, 'sideways_time_stop': 152, 'sideways_use_sma': False, 'sideways_use_ema': False, 'sideways_use_atr': True, 'sideways_use_adx': False, 'sideways_use_spike': False, 'sideways_rsi_required': True}.
[I 2025-08-29 21:15:16,384] Trial 847 finished with values: [-1000000000.0, 1000000000.0] and parameters: {'p_sma': 18, 'p_std': 28, 'p_atr': 15, 'p_adx': 8, 'rsi_period': 31, 'ema1': 24, 'ema2': 29, 'slip_atr_k': 0.11880586067338876, 'slip_spread_k': 0.06183463745536973, 'spread_hl_frac': 0.025166109362852924, 'bb_std_mult': 1.061063558877894, 'rsi_os': 8, 'rsi_ob': 79, 'vol_spike': 0.2638293638763598, 'adx_thresh': 7.586289113292928, 'atr_min_pct': 0.0112751544070149, 'atr_max_pct': 0.013062296241147492, 'tp_mult': 2.4766834711681383, 'tsl_mult': 0.7549620689980225, 'strategy': 'mean_reversion', 'time_stop': 222, 'use_sma': True, 'use_atr': False, 'use_adx': False, 'use_ema': False, 'use_spike': True, 'rsi_required': False, 'edge_k': 0.8269459339336328, 'edge_cap': 0.32151018893030126, 'bull_strategy': 'mean_reversion', 'bull_bb_std_mult': 2.7572842472000576, 'bull_rsi_os': 22, 'bull_rsi_ob': 64, 'bull_adx_thresh': 30.637492053533315, 'bull_atr_min_pct': 0.01904484871274896, 'bull_atr_max_pct': 0.10736250030569176, 'bull_tp_mult': 2.4333271123622207, 'bull_tsl_mult': 0.9422729425448567, 'bull_time_stop': 203, 'bull_use_sma': True, 'bull_use_ema': False, 'bull_use_atr': False, 'bull_use_adx': True, 'bull_use_spike': True, 'bull_rsi_required': False, 'bear_strategy': 'breakout', 'bear_bb_std_mult': 2.2943630094133516, 'bear_rsi_os': 40, 'bear_rsi_ob': 88, 'bear_adx_thresh': 11.53623129834252, 'bear_atr_min_pct': 0.01943616549761068, 'bear_atr_max_pct': 0.08239939228157506, 'bear_tp_mult': 2.918051804807111, 'bear_tsl_mult': 0.0003649466897831938, 'bear_time_stop': 251, 'bear_use_sma': False, 'bear_use_ema': False, 'bear_use_atr': False, 'bear_use_adx': False, 'bear_use_spike': True, 'bear_rsi_required': False, 'sideways_strategy': 'breakout', 'sideways_bb_std_mult': 3.466104098150826, 'sideways_rsi_os': 26, 'sideways_rsi_ob': 85, 'sideways_adx_thresh': 12.643899670548757, 'sideways_atr_min_pct': 0.013913354497902151, 'sideways_atr_max_pct': 0.034865170668395985, 'sideways_tp_mult': 2.3457610114355933, 'sideways_tsl_mult': 0.555955469101757, 'sideways_time_stop': 155, 'sideways_use_sma': False, 'sideways_use_ema': False, 'sideways_use_atr': True, 'sideways_use_adx': False, 'sideways_use_spike': False, 'sideways_rsi_required': True}.
[I 2025-08-29 21:15:16,579] Trial 848 finished with values: [-1000000000.0, 1000000000.0] and parameters: {'p_sma': 18, 'p_std': 42, 'p_atr': 15, 'p_adx': 8, 'rsi_period': 31, 'ema1': 23, 'ema2': 29, 'slip_atr_k': 0.17913793304227357, 'slip_spread_k': 0.06291827489614654, 'spread_hl_frac': 0.024977356740036254, 'bb_std_mult': 1.0350638927333056, 'rsi_os': 44, 'rsi_ob': 80, 'vol_spike': 0.267350735182384, 'adx_thresh': 9.528675860216048, 'atr_min_pct': 0.01149944030168393, 'atr_max_pct': 0.035006094453643714, 'tp_mult': 2.467481898389489, 'tsl_mult': 0.7494635703457774, 'strategy': 'mean_reversion', 'time_stop': 222, 'use_sma': True, 'use_atr': False, 'use_adx': False, 'use_ema': False, 'use_spike': True, 'rsi_required': False, 'edge_k': 0.8360457374876993, 'edge_cap': 0.26752934155808855, 'bull_strategy': 'mean_reversion', 'bull_bb_std_mult': 2.8037359637890518, 'bull_rsi_os': 22, 'bull_rsi_ob': 70, 'bull_adx_thresh': 26.194984384729114, 'bull_atr_min_pct': 0.018601687954935817, 'bull_atr_max_pct': 0.10798284568129088, 'bull_tp_mult': 2.4357866286280307, 'bull_tsl_mult': 0.9599042461566656, 'bull_time_stop': 201, 'bull_use_sma': True, 'bull_use_ema': False, 'bull_use_atr': False, 'bull_use_adx': True, 'bull_use_spike': True, 'bull_rsi_required': False, 'bear_strategy': 'breakout', 'bear_bb_std_mult': 2.30172120726736, 'bear_rsi_os': 41, 'bear_rsi_ob': 88, 'bear_adx_thresh': 11.2804145631072, 'bear_atr_min_pct': 0.009381795907894667, 'bear_atr_max_pct': 0.08081120889600506, 'bear_tp_mult': 2.920790920033732, 'bear_tsl_mult': 0.035534018311709215, 'bear_time_stop': 251, 'bear_use_sma': False, 'bear_use_ema': False, 'bear_use_atr': False, 'bear_use_adx': False, 'bear_use_spike': True, 'bear_rsi_required': False, 'sideways_strategy': 'breakout', 'sideways_bb_std_mult': 3.452322646867694, 'sideways_rsi_os': 23, 'sideways_rsi_ob': 85, 'sideways_adx_thresh': 12.600356756770504, 'sideways_atr_min_pct': 0.014382629885709923, 'sideways_atr_max_pct': 0.0344384241706809, 'sideways_tp_mult': 2.331827432657158, 'sideways_tsl_mult': 0.5566755919456741, 'sideways_time_stop': 150, 'sideways_use_sma': False, 'sideways_use_ema': False, 'sideways_use_atr': True, 'sideways_use_adx': False, 'sideways_use_spike': False, 'sideways_rsi_required': True}.
[I 2025-08-29 21:15:44,697] Trial 850 finished with values: [-0.0034765086154345815, 0.0033857234409082277] and parameters: {'p_sma': 18, 'p_std': 42, 'p_atr': 15, 'p_adx': 8, 'rsi_period': 30, 'ema1': 24, 'ema2': 30, 'slip_atr_k': 0.1720267622248015, 'slip_spread_k': 0.09999585286216536, 'spread_hl_frac': 0.02508833295537606, 'bb_std_mult': 0.9555181089876239, 'rsi_os': 7, 'rsi_ob': 61, 'vol_spike': 0.28462547548148487, 'adx_thresh': 9.29277333100288, 'atr_min_pct': 0.012428943306484077, 'atr_max_pct': 0.11174843227281464, 'tp_mult': 2.464941785725831, 'tsl_mult': 0.7510010846347436, 'strategy': 'mean_reversion', 'time_stop': 240, 'use_sma': True, 'use_atr': True, 'use_adx': False, 'use_ema': False, 'use_spike': True, 'rsi_required': False, 'edge_k': 0.9030893120442941, 'edge_cap': 0.32563699458398115, 'bull_strategy': 'mean_reversion', 'bull_bb_std_mult': 2.550131716056371, 'bull_rsi_os': 22, 'bull_rsi_ob': 70, 'bull_adx_thresh': 19.675770488729217, 'bull_atr_min_pct': 0.018608575037849625, 'bull_atr_max_pct': 0.10746074358694788, 'bull_tp_mult': 2.4475654220101233, 'bull_tsl_mult': 0.9593985106898575, 'bull_time_stop': 201, 'bull_use_sma': False, 'bull_use_ema': False, 'bull_use_atr': False, 'bull_use_adx': True, 'bull_use_spike': True, 'bull_rsi_required': False, 'bear_strategy': 'breakout', 'bear_bb_std_mult': 2.296790478764478, 'bear_rsi_os': 36, 'bear_rsi_ob': 90, 'bear_adx_thresh': 10.389507953593762, 'bear_atr_min_pct': 0.006255672651349169, 'bear_atr_max_pct': 0.0820717427881771, 'bear_tp_mult': 2.9293571052454146, 'bear_tsl_mult': 0.01663160786500084, 'bear_time_stop': 209, 'bear_use_sma': False, 'bear_use_ema': False, 'bear_use_atr': False, 'bear_use_adx': False, 'bear_use_spike': True, 'bear_rsi_required': False, 'sideways_strategy': 'breakout', 'sideways_bb_std_mult': 3.591001714533468, 'sideways_rsi_os': 26, 'sideways_rsi_ob': 83, 'sideways_adx_thresh': 10.947361904801639, 'sideways_atr_min_pct': 0.014657054385837545, 'sideways_atr_max_pct': 0.03594757863438511, 'sideways_tp_mult': 2.3354787209999563, 'sideways_tsl_mult': 0.5973986617950959, 'sideways_time_stop': 146, 'sideways_use_sma': False, 'sideways_use_ema': False, 'sideways_use_atr': True, 'sideways_use_adx': False, 'sideways_use_spike': False, 'sideways_rsi_required': True}.
[I 2025-08-29 21:15:45,246] Trial 852 finished with values: [-1000000000.0, 1000000000.0] and parameters: {'p_sma': 32, 'p_std': 24, 'p_atr': 16, 'p_adx': 7, 'rsi_period': 55, 'ema1': 11, 'ema2': 25, 'slip_atr_k': 0.014449435158125856, 'slip_spread_k': 0.10013881575829857, 'spread_hl_frac': 0.024002027233288797, 'bb_std_mult': 0.9690488439189916, 'rsi_os': 6, 'rsi_ob': 50, 'vol_spike': 0.28367988382412884, 'adx_thresh': 9.320959977430542, 'atr_min_pct': 0.012473264746466267, 'atr_max_pct': 0.0846874520530642, 'tp_mult': 2.4180932122855405, 'tsl_mult': 0.7670039199831467, 'strategy': 'breakout', 'time_stop': 242, 'use_sma': True, 'use_atr': True, 'use_adx': False, 'use_ema': False, 'use_spike': True, 'rsi_required': False, 'edge_k': 0.9238360761382819, 'edge_cap': 0.319840184598359, 'bull_strategy': 'breakout', 'bull_bb_std_mult': 2.5601077897674998, 'bull_rsi_os': 47, 'bull_rsi_ob': 68, 'bull_adx_thresh': 20.5893997241966, 'bull_atr_min_pct': 0.018368159813464922, 'bull_atr_max_pct': 0.10578347149471304, 'bull_tp_mult': 2.350558774056544, 'bull_tsl_mult': 0.9640310551924898, 'bull_time_stop': 207, 'bull_use_sma': False, 'bull_use_ema': False, 'bull_use_atr': False, 'bull_use_adx': True, 'bull_use_spike': True, 'bull_rsi_required': False, 'bear_strategy': 'mean_reversion', 'bear_bb_std_mult': 2.42746127687794, 'bear_rsi_os': 36, 'bear_rsi_ob': 86, 'bear_adx_thresh': 13.82952088130991, 'bear_atr_min_pct': 0.025294203903802978, 'bear_atr_max_pct': 0.07521677971732359, 'bear_tp_mult': 2.8576229516240086, 'bear_tsl_mult': 0.02615465894226631, 'bear_time_stop': 224, 'bear_use_sma': True, 'bear_use_ema': False, 'bear_use_atr': False, 'bear_use_adx': False, 'bear_use_spike': True, 'bear_rsi_required': False, 'sideways_strategy': 'breakout', 'sideways_bb_std_mult': 3.287184162913166, 'sideways_rsi_os': 22, 'sideways_rsi_ob': 83, 'sideways_adx_thresh': 11.193558298070059, 'sideways_atr_min_pct': 0.01542521431064908, 'sideways_atr_max_pct': 0.035368882568750176, 'sideways_tp_mult': 2.311163059155018, 'sideways_tsl_mult': 0.5960089000152785, 'sideways_time_stop': 144, 'sideways_use_sma': True, 'sideways_use_ema': False, 'sideways_use_atr': True, 'sideways_use_adx': False, 'sideways_use_spike': False, 'sideways_rsi_required': True}.
[I 2025-08-29 21:15:45,260] Trial 851 finished with values: [-1000000000.0, 1000000000.0] and parameters: {'p_sma': 18, 'p_std': 45, 'p_atr': 15, 'p_adx': 7, 'rsi_period': 29, 'ema1': 21, 'ema2': 27, 'slip_atr_k': 0.17499188354708092, 'slip_spread_k': 0.09967214452391926, 'spread_hl_frac': 0.024507656919283447, 'bb_std_mult': 0.9396443100686223, 'rsi_os': 27, 'rsi_ob': 80, 'vol_spike': 0.28358444174474673, 'adx_thresh': 9.572053603805063, 'atr_min_pct': 0.01229857334354705, 'atr_max_pct': 0.1257864193990559, 'tp_mult': 2.4280522728798606, 'tsl_mult': 0.771033143966418, 'strategy': 'breakout', 'time_stop': 234, 'use_sma': True, 'use_atr': True, 'use_adx': False, 'use_ema': False, 'use_spike': True, 'rsi_required': False, 'edge_k': 0.8935681691927098, 'edge_cap': 0.3270980249942479, 'bull_strategy': 'mean_reversion', 'bull_bb_std_mult': 2.543458920167855, 'bull_rsi_os': 22, 'bull_rsi_ob': 70, 'bull_adx_thresh': 26.377008805190563, 'bull_atr_min_pct': 0.018409576037204053, 'bull_atr_max_pct': 0.10900499857092945, 'bull_tp_mult': 2.3393563514124787, 'bull_tsl_mult': 0.9654932885092766, 'bull_time_stop': 206, 'bull_use_sma': False, 'bull_use_ema': False, 'bull_use_atr': False, 'bull_use_adx': True, 'bull_use_spike': True, 'bull_rsi_required': False, 'bear_strategy': 'breakout', 'bear_bb_std_mult': 2.487183749792805, 'bear_rsi_os': 36, 'bear_rsi_ob': 90, 'bear_adx_thresh': 10.090429539134215, 'bear_atr_min_pct': 0.00949424031427501, 'bear_atr_max_pct': 0.07506963761832472, 'bear_tp_mult': 2.8680617398288226, 'bear_tsl_mult': 0.019095871907786638, 'bear_time_stop': 287, 'bear_use_sma': False, 'bear_use_ema': False, 'bear_use_atr': False, 'bear_use_adx': False, 'bear_use_spike': True, 'bear_rsi_required': False, 'sideways_strategy': 'breakout', 'sideways_bb_std_mult': 3.3026954828914854, 'sideways_rsi_os': 25, 'sideways_rsi_ob': 83, 'sideways_adx_thresh': 11.287309172402896, 'sideways_atr_min_pct': 0.0144839210226122, 'sideways_atr_max_pct': 0.05000575907819319, 'sideways_tp_mult': 2.3073052991434384, 'sideways_tsl_mult': 0.5982757247733522, 'sideways_time_stop': 145, 'sideways_use_sma': False, 'sideways_use_ema': False, 'sideways_use_atr': True, 'sideways_use_adx': False, 'sideways_use_spike': False, 'sideways_rsi_required': True}.
[I 2025-08-29 21:15:45,360] Trial 849 finished with values: [-1000000000.0, 1000000000.0] and parameters: {'p_sma': 18, 'p_std': 42, 'p_atr': 15, 'p_adx': 7, 'rsi_period': 29, 'ema1': 24, 'ema2': 28, 'slip_atr_k': 0.11834606984785102, 'slip_spread_k': 0.10296525860634456, 'spread_hl_frac': 0.025246123304703657, 'bb_std_mult': 0.9557338345535891, 'rsi_os': 45, 'rsi_ob': 61, 'vol_spike': 0.2743841858904104, 'adx_thresh': 9.760210145191092, 'atr_min_pct': 0.010463042763939813, 'atr_max_pct': 0.034693103037493955, 'tp_mult': 2.456878477980377, 'tsl_mult': 0.747475687300165, 'strategy': 'mean_reversion', 'time_stop': 233, 'use_sma': True, 'use_atr': True, 'use_adx': False, 'use_ema': False, 'use_spike': True, 'rsi_required': False, 'edge_k': 0.8304500921537985, 'edge_cap': 0.32359902904717985, 'bull_strategy': 'mean_reversion', 'bull_bb_std_mult': 2.769898507284469, 'bull_rsi_os': 22, 'bull_rsi_ob': 65, 'bull_adx_thresh': 25.25584436559911, 'bull_atr_min_pct': 0.018486955039700624, 'bull_atr_max_pct': 0.10719925939569769, 'bull_tp_mult': 2.4071237857063124, 'bull_tsl_mult': 0.9636419214002993, 'bull_time_stop': 203, 'bull_use_sma': True, 'bull_use_ema': False, 'bull_use_atr': False, 'bull_use_adx': True, 'bull_use_spike': True, 'bull_rsi_required': False, 'bear_strategy': 'breakout', 'bear_bb_std_mult': 2.428125188896853, 'bear_rsi_os': 36, 'bear_rsi_ob': 86, 'bear_adx_thresh': 13.851881031084854, 'bear_atr_min_pct': 0.02297308986813204, 'bear_atr_max_pct': 0.08009111324587286, 'bear_tp_mult': 2.908723315365245, 'bear_tsl_mult': 0.03551216550624455, 'bear_time_stop': 245, 'bear_use_sma': False, 'bear_use_ema': False, 'bear_use_atr': False, 'bear_use_adx': False, 'bear_use_spike': True, 'bear_rsi_required': False, 'sideways_strategy': 'breakout', 'sideways_bb_std_mult': 3.289248337176061, 'sideways_rsi_os': 24, 'sideways_rsi_ob': 85, 'sideways_adx_thresh': 11.183117292000622, 'sideways_atr_min_pct': 0.014349251827485004, 'sideways_atr_max_pct': 0.03511928421368089, 'sideways_tp_mult': 2.3337219087611825, 'sideways_tsl_mult': 0.5631219113045778, 'sideways_time_stop': 151, 'sideways_use_sma': False, 'sideways_use_ema': False, 'sideways_use_atr': True, 'sideways_use_adx': False, 'sideways_use_spike': False, 'sideways_rsi_required': True}.
[I 2025-08-29 21:16:15,370] Trial 853 finished with values: [-1000000000.0, 1000000000.0] and parameters: {'p_sma': 49, 'p_std': 45, 'p_atr': 16, 'p_adx': 7, 'rsi_period': 79, 'ema1': 21, 'ema2': 27, 'slip_atr_k': 0.08299202825428888, 'slip_spread_k': 0.1168234753765808, 'spread_hl_frac': 0.02434586504556531, 'bb_std_mult': 0.9235387803839454, 'rsi_os': 6, 'rsi_ob': 80, 'vol_spike': 0.27539265881649, 'adx_thresh': 8.487956459514697, 'atr_min_pct': 0.010244595838502644, 'atr_max_pct': 0.03873170768650072, 'tp_mult': 2.4103192430805938, 'tsl_mult': 0.7760164070356325, 'strategy': 'breakout', 'time_stop': 230, 'use_sma': True, 'use_atr': True, 'use_adx': False, 'use_ema': False, 'use_spike': True, 'rsi_required': True, 'edge_k': 0.8850340608483673, 'edge_cap': 0.2901550687430347, 'bull_strategy': 'breakout', 'bull_bb_std_mult': 2.7088702899306463, 'bull_rsi_os': 21, 'bull_rsi_ob': 68, 'bull_adx_thresh': 32.7106226680027, 'bull_atr_min_pct': 0.01836603657153321, 'bull_atr_max_pct': 0.10467995619319836, 'bull_tp_mult': 2.3468818777071423, 'bull_tsl_mult': 0.9972596767763484, 'bull_time_stop': 213, 'bull_use_sma': False, 'bull_use_ema': False, 'bull_use_atr': False, 'bull_use_adx': True, 'bull_use_spike': True, 'bull_rsi_required': False, 'bear_strategy': 'mean_reversion', 'bear_bb_std_mult': 1.6903848851641765, 'bear_rsi_os': 41, 'bear_rsi_ob': 87, 'bear_adx_thresh': 15.168200897145189, 'bear_atr_min_pct': 0.006418101999229323, 'bear_atr_max_pct': 0.07465362781017065, 'bear_tp_mult': 2.8572027595485587, 'bear_tsl_mult': 0.044852938138702225, 'bear_time_stop': 223, 'bear_use_sma': True, 'bear_use_ema': False, 'bear_use_atr': True, 'bear_use_adx': False, 'bear_use_spike': True, 'bear_rsi_required': False, 'sideways_strategy': 'breakout', 'sideways_bb_std_mult': 3.5947479836644685, 'sideways_rsi_os': 25, 'sideways_rsi_ob': 82, 'sideways_adx_thresh': 11.340394218803352, 'sideways_atr_min_pct': 0.01576790043803784, 'sideways_atr_max_pct': 0.04246569374389824, 'sideways_tp_mult': 2.292742994980545, 'sideways_tsl_mult': 0.5853001636102573, 'sideways_time_stop': 128, 'sideways_use_sma': True, 'sideways_use_ema': False, 'sideways_use_atr': True, 'sideways_use_adx': False, 'sideways_use_spike': False, 'sideways_rsi_required': True}.
[I 2025-08-29 21:16:15,632] Trial 855 finished with values: [-1000000000.0, 1000000000.0] and parameters: {'p_sma': 47, 'p_std': 25, 'p_atr': 16, 'p_adx': 8, 'rsi_period': 33, 'ema1': 24, 'ema2': 27, 'slip_atr_k': 0.09337161972712207, 'slip_spread_k': 0.035207999365101605, 'spread_hl_frac': 0.02290087267832592, 'bb_std_mult': 0.7147198130310667, 'rsi_os': 7, 'rsi_ob': 78, 'vol_spike': 0.2886210367066245, 'adx_thresh': 6.029824381074915, 'atr_min_pct': 0.010399511531465084, 'atr_max_pct': 0.03909152021543926, 'tp_mult': 2.3533921133554467, 'tsl_mult': 0.8052172093323939, 'strategy': 'mean_reversion', 'time_stop': 212, 'use_sma': False, 'use_atr': False, 'use_adx': True, 'use_ema': False, 'use_spike': True, 'rsi_required': True, 'edge_k': 0.7484864439543245, 'edge_cap': 0.2899783575794499, 'bull_strategy': 'breakout', 'bull_bb_std_mult': 2.697590066562444, 'bull_rsi_os': 21, 'bull_rsi_ob': 59, 'bull_adx_thresh': 32.760821009759454, 'bull_atr_min_pct': 0.017715109617454556, 'bull_atr_max_pct': 0.1495159780611035, 'bull_tp_mult': 2.486832497709248, 'bull_tsl_mult': 0.9874570179139157, 'bull_time_stop': 214, 'bull_use_sma': True, 'bull_use_ema': True, 'bull_use_atr': False, 'bull_use_adx': True, 'bull_use_spike': False, 'bull_rsi_required': True, 'bear_strategy': 'mean_reversion', 'bear_bb_std_mult': 2.0423428191147264, 'bear_rsi_os': 43, 'bear_rsi_ob': 87, 'bear_adx_thresh': 29.352724550878634, 'bear_atr_min_pct': 0.006158573049433307, 'bear_atr_max_pct': 0.07786426031343618, 'bear_tp_mult': 2.852029390283356, 'bear_tsl_mult': 0.09480270757630035, 'bear_time_stop': 275, 'bear_use_sma': True, 'bear_use_ema': False, 'bear_use_atr': True, 'bear_use_adx': False, 'bear_use_spike': False, 'bear_rsi_required': True, 'sideways_strategy': 'mean_reversion', 'sideways_bb_std_mult': 3.521541814217182, 'sideways_rsi_os': 20, 'sideways_rsi_ob': 82, 'sideways_adx_thresh': 11.786319029030722, 'sideways_atr_min_pct': 0.011834984142685134, 'sideways_atr_max_pct': 0.03993533300143705, 'sideways_tp_mult': 2.427732978797635, 'sideways_tsl_mult': 0.6235688975653404, 'sideways_time_stop': 128, 'sideways_use_sma': True, 'sideways_use_ema': False, 'sideways_use_atr': True, 'sideways_use_adx': True, 'sideways_use_spike': True, 'sideways_rsi_required': True}.
