[I 2025-08-29 20:39:49,566] Trial 538 finished with values: [-0.046914457232897666, 0.046897023352594616] and parameters: {'p_sma': 20, 'p_std': 39, 'p_atr': 24, 'p_adx': 14, 'rsi_period': 39, 'ema1': 26, 'ema2': 51, 'slip_atr_k': 0.0037396490421691014, 'slip_spread_k': 0.2279317796817416, 'spread_hl_frac': 0.028117507067286204, 'bb_std_mult': 1.588714648669839, 'rsi_os': 8, 'rsi_ob': 82, 'vol_spike': 0.12854367718473678, 'adx_thresh': 12.25278758096963, 'atr_min_pct': 0.021501830628983094, 'atr_max_pct': 0.034239314198131095, 'tp_mult': 1.341249232228388, 'tsl_mult': 0.9747854718704282, 'strategy': 'mean_reversion', 'time_stop': 151, 'use_sma': True, 'use_atr': False, 'use_adx': False, 'use_ema': True, 'use_spike': False, 'rsi_required': False, 'edge_k': 1.4375535046795167, 'edge_cap': 0.6427094524957754, 'bull_strategy': 'breakout', 'bull_bb_std_mult': 2.983127182260074, 'bull_rsi_os': 14, 'bull_rsi_ob': 72, 'bull_adx_thresh': 15.096649521855397, 'bull_atr_min_pct': 0.01597995192368172, 'bull_atr_max_pct': 0.045141657625974406, 'bull_tp_mult': 2.657516834123262, 'bull_tsl_mult': 0.9037491219238483, 'bull_time_stop': 141, 'bull_use_sma': True, 'bull_use_ema': True, 'bull_use_atr': True, 'bull_use_adx': True, 'bull_use_spike': True, 'bull_rsi_required': False, 'bear_strategy': 'breakout', 'bear_bb_std_mult': 2.0313564425916426, 'bear_rsi_os': 24, 'bear_rsi_ob': 55, 'bear_adx_thresh': 21.372014140070434, 'bear_atr_min_pct': 0.019860285841686337, 'bear_atr_max_pct': 0.05256095855005548, 'bear_tp_mult': 2.975650993213204, 'bear_tsl_mult': 0.8739854618280756, 'bear_time_stop': 170, 'bear_use_sma': False, 'bear_use_ema': True, 'bear_use_atr': False, 'bear_use_adx': True, 'bear_use_spike': True, 'bear_rsi_required': False, 'sideways_strategy': 'mean_reversion', 'sideways_bb_std_mult': 2.256735782555289, 'sideways_rsi_os': 48, 'sideways_rsi_ob': 53, 'sideways_adx_thresh': 33.63102826297563, 'sideways_atr_min_pct': 0.0012560868776341823, 'sideways_atr_max_pct': 0.10241022621032983, 'sideways_tp_mult': 1.1424481955872976, 'sideways_tsl_mult': 0.8812998353690253, 'sideways_time_stop': 112, 'sideways_use_sma': False, 'sideways_use_ema': False, 'sideways_use_atr': False, 'sideways_use_adx': False, 'sideways_use_spike': True, 'sideways_rsi_required': False}.
[I 2025-08-29 20:39:50,253] Trial 543 finished with values: [-1000000000.0, 1000000000.0] and parameters: {'p_sma': 25, 'p_std': 58, 'p_atr': 26, 'p_adx': 7, 'rsi_period': 49, 'ema1': 10, 'ema2': 47, 'slip_atr_k': 0.13213080027497312, 'slip_spread_k': 0.1664305311949804, 'spread_hl_frac': 0.045745359382070416, 'bb_std_mult': 2.7899173828966166, 'rsi_os': 53, 'rsi_ob': 83, 'vol_spike': 0.1990432517644169, 'adx_thresh': 14.948529834609579, 'atr_min_pct': 0.009449607434522209, 'atr_max_pct': 0.03399863446064327, 'tp_mult': 1.29149652225843, 'tsl_mult': 0.24873106890205, 'strategy': 'mean_reversion', 'time_stop': 170, 'use_sma': False, 'use_atr': False, 'use_adx': False, 'use_ema': True, 'use_spike': False, 'rsi_required': True, 'edge_k': 1.1199356301438534, 'edge_cap': 0.8076719545223481, 'bull_strategy': 'mean_reversion', 'bull_bb_std_mult': 3.1879377277515353, 'bull_rsi_os': 55, 'bull_rsi_ob': 48, 'bull_adx_thresh': 13.79165116710219, 'bull_atr_min_pct': 0.028685810504431586, 'bull_atr_max_pct': 0.07090868443343273, 'bull_tp_mult': 2.1758282896077263, 'bull_tsl_mult': 0.8491658361936492, 'bull_time_stop': 13, 'bull_use_sma': False, 'bull_use_ema': False, 'bull_use_atr': False, 'bull_use_adx': False, 'bull_use_spike': True, 'bull_rsi_required': True, 'bear_strategy': 'breakout', 'bear_bb_std_mult': 2.7641845071965396, 'bear_rsi_os': 44, 'bear_rsi_ob': 79, 'bear_adx_thresh': 28.550011445981653, 'bear_atr_min_pct': 0.005517561925039434, 'bear_atr_max_pct': 0.04712469687644826, 'bear_tp_mult': 1.261773741111188, 'bear_tsl_mult': 0.585507322696503, 'bear_time_stop': 60, 'bear_use_sma': True, 'bear_use_ema': True, 'bear_use_atr': False, 'bear_use_adx': True, 'bear_use_spike': False, 'bear_rsi_required': False, 'sideways_strategy': 'breakout', 'sideways_bb_std_mult': 2.35496253699588, 'sideways_rsi_os': 47, 'sideways_rsi_ob': 63, 'sideways_adx_thresh': 8.503810709337046, 'sideways_atr_min_pct': 0.028103545646575866, 'sideways_atr_max_pct': 0.11328131018576215, 'sideways_tp_mult': 1.080676828343273, 'sideways_tsl_mult': 0.7739854726918876, 'sideways_time_stop': 193, 'sideways_use_sma': False, 'sideways_use_ema': False, 'sideways_use_atr': True, 'sideways_use_adx': False, 'sideways_use_spike': False, 'sideways_rsi_required': False}.
[I 2025-08-29 20:40:18,010] Trial 544 finished with values: [-1000000000.0, 1000000000.0] and parameters: {'p_sma': 6, 'p_std': 58, 'p_atr': 26, 'p_adx': 24, 'rsi_period': 36, 'ema1': 27, 'ema2': 37, 'slip_atr_k': 0.14067356907441997, 'slip_spread_k': 0.0636233605604144, 'spread_hl_frac': 0.04572143213525981, 'bb_std_mult': 3.546722820800572, 'rsi_os': 10, 'rsi_ob': 85, 'vol_spike': 0.019497830843492242, 'adx_thresh': 14.248110706807179, 'atr_min_pct': 0.018753959349266047, 'atr_max_pct': 0.026401995483336382, 'tp_mult': 1.9842089401410157, 'tsl_mult': 0.2919925069651653, 'strategy': 'mean_reversion', 'time_stop': 164, 'use_sma': False, 'use_atr': False, 'use_adx': False, 'use_ema': False, 'use_spike': True, 'rsi_required': True, 'edge_k': 1.1174928071840846, 'edge_cap': 0.4447248135602303, 'bull_strategy': 'mean_reversion', 'bull_bb_std_mult': 3.1872242618464837, 'bull_rsi_os': 25, 'bull_rsi_ob': 66, 'bull_adx_thresh': 5.08404007293753, 'bull_atr_min_pct': 0.016487385009390305, 'bull_atr_max_pct': 0.07063037013884578, 'bull_tp_mult': 1.7170644812335496, 'bull_tsl_mult': 0.8418880746879988, 'bull_time_stop': 13, 'bull_use_sma': False, 'bull_use_ema': False, 'bull_use_atr': False, 'bull_use_adx': False, 'bull_use_spike': True, 'bull_rsi_required': True, 'bear_strategy': 'mean_reversion', 'bear_bb_std_mult': 3.302756818128233, 'bear_rsi_os': 31, 'bear_rsi_ob': 47, 'bear_adx_thresh': 23.177370257987977, 'bear_atr_min_pct': 0.005412979068857204, 'bear_atr_max_pct': 0.047052228613645636, 'bear_tp_mult': 2.7981551625892496, 'bear_tsl_mult': 0.9521970342437007, 'bear_time_stop': 220, 'bear_use_sma': True, 'bear_use_ema': True, 'bear_use_atr': False, 'bear_use_adx': False, 'bear_use_spike': False, 'bear_rsi_required': False, 'sideways_strategy': 'breakout', 'sideways_bb_std_mult': 3.058276024355411, 'sideways_rsi_os': 47, 'sideways_rsi_ob': 81, 'sideways_adx_thresh': 9.89391697584555, 'sideways_atr_min_pct': 0.005316933178056172, 'sideways_atr_max_pct': 0.030361341595757617, 'sideways_tp_mult': 1.0765135041706377, 'sideways_tsl_mult': 0.7599624660802088, 'sideways_time_stop': 194, 'sideways_use_sma': True, 'sideways_use_ema': False, 'sideways_use_atr': True, 'sideways_use_adx': False, 'sideways_use_spike': False, 'sideways_rsi_required': False}.
[I 2025-08-29 20:40:18,019] Trial 541 finished with values: [-1000000000.0, 1000000000.0] and parameters: {'p_sma': 25, 'p_std': 40, 'p_atr': 21, 'p_adx': 7, 'rsi_period': 10, 'ema1': 7, 'ema2': 36, 'slip_atr_k': 0.24675403201184148, 'slip_spread_k': 0.16735256743995833, 'spread_hl_frac': 0.04801594789376822, 'bb_std_mult': 2.752713677912606, 'rsi_os': 8, 'rsi_ob': 89, 'vol_spike': 0.24892288688336642, 'adx_thresh': 12.331643576269444, 'atr_min_pct': 0.021147648230819667, 'atr_max_pct': 0.06301611450599365, 'tp_mult': 2.279896381914548, 'tsl_mult': 0.32242308538613834, 'strategy': 'mean_reversion', 'time_stop': 166, 'use_sma': True, 'use_atr': False, 'use_adx': False, 'use_ema': False, 'use_spike': True, 'rsi_required': False, 'edge_k': 1.1244791920563468, 'edge_cap': 0.6069981350897755, 'bull_strategy': 'mean_reversion', 'bull_bb_std_mult': 2.9557230878820393, 'bull_rsi_os': 17, 'bull_rsi_ob': 73, 'bull_adx_thresh': 12.779127852715787, 'bull_atr_min_pct': 0.01643858560974097, 'bull_atr_max_pct': 0.0458331881504865, 'bull_tp_mult': 2.1850499267606622, 'bull_tsl_mult': 0.922493826058342, 'bull_time_stop': 204, 'bull_use_sma': True, 'bull_use_ema': False, 'bull_use_atr': False, 'bull_use_adx': False, 'bull_use_spike': True, 'bull_rsi_required': True, 'bear_strategy': 'breakout', 'bear_bb_std_mult': 1.8551383786035442, 'bear_rsi_os': 29, 'bear_rsi_ob': 79, 'bear_adx_thresh': 21.166319039607465, 'bear_atr_min_pct': 0.021931433045178667, 'bear_atr_max_pct': 0.08700447920993713, 'bear_tp_mult': 2.805264786658578, 'bear_tsl_mult': 0.9514338422690485, 'bear_time_stop': 63, 'bear_use_sma': False, 'bear_use_ema': True, 'bear_use_atr': False, 'bear_use_adx': False, 'bear_use_spike': True, 'bear_rsi_required': False, 'sideways_strategy': 'breakout', 'sideways_bb_std_mult': 2.2529920738141156, 'sideways_rsi_os': 47, 'sideways_rsi_ob': 53, 'sideways_adx_thresh': 33.60153643185277, 'sideways_atr_min_pct': 0.02545618780065704, 'sideways_atr_max_pct': 0.010038297488089168, 'sideways_tp_mult': 1.148326607168378, 'sideways_tsl_mult': 0.8801132208995883, 'sideways_time_stop': 170, 'sideways_use_sma': False, 'sideways_use_ema': False, 'sideways_use_atr': True, 'sideways_use_adx': False, 'sideways_use_spike': False, 'sideways_rsi_required': False}.
[I 2025-08-29 20:40:18,442] Trial 542 finished with values: [-0.015479686584276342, 0.01543997491592565] and parameters: {'p_sma': 45, 'p_std': 58, 'p_atr': 26, 'p_adx': 7, 'rsi_period': 34, 'ema1': 7, 'ema2': 29, 'slip_atr_k': 0.10913198336949505, 'slip_spread_k': 0.6291540535303708, 'spread_hl_frac': 0.048039735053426146, 'bb_std_mult': 3.5410604634044347, 'rsi_os': 8, 'rsi_ob': 91, 'vol_spike': 0.22233700908151785, 'adx_thresh': 8.33733740408659, 'atr_min_pct': 0.02128316323048613, 'atr_max_pct': 0.03478470453286338, 'tp_mult': 2.003547119901307, 'tsl_mult': 0.23366578855738468, 'strategy': 'mean_reversion', 'time_stop': 167, 'use_sma': False, 'use_atr': False, 'use_adx': False, 'use_ema': False, 'use_spike': True, 'rsi_required': True, 'edge_k': 1.133619311188505, 'edge_cap': 0.7413723626519354, 'bull_strategy': 'mean_reversion', 'bull_bb_std_mult': 3.1707093139013605, 'bull_rsi_os': 25, 'bull_rsi_ob': 89, 'bull_adx_thresh': 15.111546540761108, 'bull_atr_min_pct': 0.01637712625590995, 'bull_atr_max_pct': 0.093570762948511, 'bull_tp_mult': 1.2679167851518511, 'bull_tsl_mult': 0.8706203161893026, 'bull_time_stop': 17, 'bull_use_sma': False, 'bull_use_ema': False, 'bull_use_atr': False, 'bull_use_adx': False, 'bull_use_spike': True, 'bull_rsi_required': True, 'bear_strategy': 'breakout', 'bear_bb_std_mult': 2.774673075252378, 'bear_rsi_os': 52, 'bear_rsi_ob': 84, 'bear_adx_thresh': 21.069591604009144, 'bear_atr_min_pct': 0.005167090978767932, 'bear_atr_max_pct': 0.13021915968799927, 'bear_tp_mult': 2.960414040107711, 'bear_tsl_mult': 0.9508377123823408, 'bear_time_stop': 74, 'bear_use_sma': False, 'bear_use_ema': True, 'bear_use_atr': False, 'bear_use_adx': False, 'bear_use_spike': False, 'bear_rsi_required': False, 'sideways_strategy': 'breakout', 'sideways_bb_std_mult': 0.638583961543894, 'sideways_rsi_os': 51, 'sideways_rsi_ob': 78, 'sideways_adx_thresh': 9.709293381828731, 'sideways_atr_min_pct': 0.005053556091369561, 'sideways_atr_max_pct': 0.010115810809480819, 'sideways_tp_mult': 1.8983463124777238, 'sideways_tsl_mult': 0.5900760152702279, 'sideways_time_stop': 113, 'sideways_use_sma': False, 'sideways_use_ema': False, 'sideways_use_atr': True, 'sideways_use_adx': False, 'sideways_use_spike': False, 'sideways_rsi_required': False}.
[I 2025-08-29 20:40:19,589] Trial 545 finished with values: [-1000000000.0, 1000000000.0] and parameters: {'p_sma': 49, 'p_std': 54, 'p_atr': 25, 'p_adx': 13, 'rsi_period': 36, 'ema1': 25, 'ema2': 44, 'slip_atr_k': 0.23781306618483172, 'slip_spread_k': 0.1716007185546869, 'spread_hl_frac': 0.04998363902888324, 'bb_std_mult': 0.6063253726298894, 'rsi_os': 30, 'rsi_ob': 91, 'vol_spike': 0.18862233277612994, 'adx_thresh': 8.497162959828385, 'atr_min_pct': 0.021085712167909273, 'atr_max_pct': 0.027032632926916628, 'tp_mult': 2.2821523896274085, 'tsl_mult': 0.08701850993449417, 'strategy': 'mean_reversion', 'time_stop': 166, 'use_sma': True, 'use_atr': False, 'use_adx': False, 'use_ema': False, 'use_spike': True, 'rsi_required': False, 'edge_k': 1.171000632764462, 'edge_cap': 0.6731011115888369, 'bull_strategy': 'mean_reversion', 'bull_bb_std_mult': 1.9333534159229728, 'bull_rsi_os': 25, 'bull_rsi_ob': 65, 'bull_adx_thresh': 10.088114130850267, 'bull_atr_min_pct': 0.016616644798569183, 'bull_atr_max_pct': 0.09788879587468177, 'bull_tp_mult': 2.782361681515904, 'bull_tsl_mult': 0.9415344892985612, 'bull_time_stop': 49, 'bull_use_sma': True, 'bull_use_ema': False, 'bull_use_atr': False, 'bull_use_adx': False, 'bull_use_spike': True, 'bull_rsi_required': False, 'bear_strategy': 'mean_reversion', 'bear_bb_std_mult': 2.730320133386444, 'bear_rsi_os': 16, 'bear_rsi_ob': 67, 'bear_adx_thresh': 25.388230058715955, 'bear_atr_min_pct': 0.028604792159017227, 'bear_atr_max_pct': 0.04453970128143934, 'bear_tp_mult': 2.6514496675989148, 'bear_tsl_mult': 0.9541218953861623, 'bear_time_stop': 53, 'bear_use_sma': False, 'bear_use_ema': True, 'bear_use_atr': False, 'bear_use_adx': False, 'bear_use_spike': True, 'bear_rsi_required': False, 'sideways_strategy': 'breakout', 'sideways_bb_std_mult': 0.6557447142276311, 'sideways_rsi_os': 7, 'sideways_rsi_ob': 82, 'sideways_adx_thresh': 31.06760833835464, 'sideways_atr_min_pct': 0.02294411254703395, 'sideways_atr_max_pct': 0.02606331578559371, 'sideways_tp_mult': 1.0396786812942516, 'sideways_tsl_mult': 0.7423071686287332, 'sideways_time_stop': 201, 'sideways_use_sma': True, 'sideways_use_ema': False, 'sideways_use_atr': True, 'sideways_use_adx': False, 'sideways_use_spike': False, 'sideways_rsi_required': False}.
[I 2025-08-29 20:40:20,196] Trial 547 finished with values: [-1000000000.0, 1000000000.0] and parameters: {'p_sma': 34, 'p_std': 55, 'p_atr': 25, 'p_adx': 12, 'rsi_period': 33, 'ema1': 27, 'ema2': 29, 'slip_atr_k': 0.2405319120700452, 'slip_spread_k': 0.19771879977608145, 'spread_hl_frac': 0.048998182766933865, 'bb_std_mult': 0.5948368823170138, 'rsi_os': 29, 'rsi_ob': 45, 'vol_spike': 0.18733092613985414, 'adx_thresh': 13.15608107146972, 'atr_min_pct': 0.019787560940735756, 'atr_max_pct': 0.015223728078581175, 'tp_mult': 1.2372749153177776, 'tsl_mult': 0.16962656149443134, 'strategy': 'breakout', 'time_stop': 177, 'use_sma': True, 'use_atr': True, 'use_adx': False, 'use_ema': True, 'use_spike': False, 'rsi_required': False, 'edge_k': 1.524908234597343, 'edge_cap': 0.6753698042767968, 'bull_strategy': 'mean_reversion', 'bull_bb_std_mult': 1.1827957190488254, 'bull_rsi_os': 10, 'bull_rsi_ob': 74, 'bull_adx_thresh': 21.74747664154632, 'bull_atr_min_pct': 0.017680720630666627, 'bull_atr_max_pct': 0.07482493136051119, 'bull_tp_mult': 2.786859852861878, 'bull_tsl_mult': 0.541300070837245, 'bull_time_stop': 20, 'bull_use_sma': True, 'bull_use_ema': False, 'bull_use_atr': True, 'bull_use_adx': False, 'bull_use_spike': True, 'bull_rsi_required': False, 'bear_strategy': 'breakout', 'bear_bb_std_mult': 2.6545874569236805, 'bear_rsi_os': 31, 'bear_rsi_ob': 67, 'bear_adx_thresh': 32.197011541551745, 'bear_atr_min_pct': 0.007862298609064544, 'bear_atr_max_pct': 0.10002578002703162, 'bear_tp_mult': 2.6317857801628346, 'bear_tsl_mult': 0.19135233044863204, 'bear_time_stop': 135, 'bear_use_sma': False, 'bear_use_ema': False, 'bear_use_atr': False, 'bear_use_adx': True, 'bear_use_spike': True, 'bear_rsi_required': False, 'sideways_strategy': 'breakout', 'sideways_bb_std_mult': 1.514028254400256, 'sideways_rsi_os': 23, 'sideways_rsi_ob': 77, 'sideways_adx_thresh': 10.944447126020146, 'sideways_atr_min_pct': 0.0070807027187923186, 'sideways_atr_max_pct': 0.02589590181002, 'sideways_tp_mult': 1.0136369919518549, 'sideways_tsl_mult': 0.6843120335945684, 'sideways_time_stop': 203, 'sideways_use_sma': True, 'sideways_use_ema': False, 'sideways_use_atr': False, 'sideways_use_adx': True, 'sideways_use_spike': False, 'sideways_rsi_required': False}.
[I 2025-08-29 20:40:48,142] Trial 548 finished with values: [-1000000000.0, 1000000000.0] and parameters: {'p_sma': 20, 'p_std': 56, 'p_atr': 30, 'p_adx': 12, 'rsi_period': 68, 'ema1': 27, 'ema2': 44, 'slip_atr_k': 0.12357389655664812, 'slip_spread_k': 0.19519579009608906, 'spread_hl_frac': 0.049974596044179184, 'bb_std_mult': 1.7167033352373342, 'rsi_os': 11, 'rsi_ob': 81, 'vol_spike': 0.27107655195354957, 'adx_thresh': 13.70225509941761, 'atr_min_pct': 0.023047110140943607, 'atr_max_pct': 0.02480012082313876, 'tp_mult': 1.5566566436615692, 'tsl_mult': 0.4368986223904159, 'strategy': 'breakout', 'time_stop': 177, 'use_sma': True, 'use_atr': True, 'use_adx': True, 'use_ema': True, 'use_spike': False, 'rsi_required': False, 'edge_k': 1.728216342804088, 'edge_cap': 0.6748127373945547, 'bull_strategy': 'mean_reversion', 'bull_bb_std_mult': 1.9658109430803878, 'bull_rsi_os': 19, 'bull_rsi_ob': 74, 'bull_adx_thresh': 32.534303643375424, 'bull_atr_min_pct': 0.017340342641824893, 'bull_atr_max_pct': 0.09722419698583486, 'bull_tp_mult': 2.7899505245957075, 'bull_tsl_mult': 0.5396674779061458, 'bull_time_stop': 40, 'bull_use_sma': True, 'bull_use_ema': False, 'bull_use_atr': True, 'bull_use_adx': False, 'bull_use_spike': False, 'bull_rsi_required': False, 'bear_strategy': 'mean_reversion', 'bear_bb_std_mult': 2.660756855380454, 'bear_rsi_os': 16, 'bear_rsi_ob': 67, 'bear_adx_thresh': 22.363751524616625, 'bear_atr_min_pct': 0.0070129798028550384, 'bear_atr_max_pct': 0.043769708173181265, 'bear_tp_mult': 1.6633099229777966, 'bear_tsl_mult': 0.8983393618300292, 'bear_time_stop': 53, 'bear_use_sma': False, 'bear_use_ema': False, 'bear_use_atr': False, 'bear_use_adx': True, 'bear_use_spike': True, 'bear_rsi_required': True, 'sideways_strategy': 'breakout', 'sideways_bb_std_mult': 2.3830665194267504, 'sideways_rsi_os': 9, 'sideways_rsi_ob': 90, 'sideways_adx_thresh': 23.518030221637787, 'sideways_atr_min_pct': 0.022037658271852025, 'sideways_atr_max_pct': 0.026165599751794666, 'sideways_tp_mult': 1.061342942595664, 'sideways_tsl_mult': 0.681714286938877, 'sideways_time_stop': 138, 'sideways_use_sma': True, 'sideways_use_ema': False, 'sideways_use_atr': False, 'sideways_use_adx': True, 'sideways_use_spike': False, 'sideways_rsi_required': False}.
[I 2025-08-29 20:40:48,483] Trial 549 finished with values: [0.0009186131661507169, 0.000707573007844788] and parameters: {'p_sma': 20, 'p_std': 56, 'p_atr': 8, 'p_adx': 12, 'rsi_period': 84, 'ema1': 27, 'ema2': 46, 'slip_atr_k': 0.004697800014220002, 'slip_spread_k': 0.11150360074295179, 'spread_hl_frac': 0.015104994889904029, 'bb_std_mult': 1.7371538720539303, 'rsi_os': 11, 'rsi_ob': 45, 'vol_spike': 0.1666755362694732, 'adx_thresh': 13.907716055782057, 'atr_min_pct': 0.01997609122774191, 'atr_max_pct': 0.02202148000198622, 'tp_mult': 1.1993364322929687, 'tsl_mult': 0.43679374034494584, 'strategy': 'breakout', 'time_stop': 176, 'use_sma': True, 'use_atr': True, 'use_adx': True, 'use_ema': True, 'use_spike': False, 'rsi_required': False, 'edge_k': 1.0737433786105728, 'edge_cap': 0.6180681645212017, 'bull_strategy': 'mean_reversion', 'bull_bb_std_mult': 2.8824921585252, 'bull_rsi_os': 18, 'bull_rsi_ob': 70, 'bull_adx_thresh': 13.945867764475707, 'bull_atr_min_pct': 0.017656931391147167, 'bull_atr_max_pct': 0.08857373524201118, 'bull_tp_mult': 2.232859503568128, 'bull_tsl_mult': 0.3742843130366684, 'bull_time_stop': 110, 'bull_use_sma': True, 'bull_use_ema': False, 'bull_use_atr': True, 'bull_use_adx': False, 'bull_use_spike': False, 'bull_rsi_required': False, 'bear_strategy': 'breakout', 'bear_bb_std_mult': 2.6392913730195984, 'bear_rsi_os': 31, 'bear_rsi_ob': 66, 'bear_adx_thresh': 17.426255759643244, 'bear_atr_min_pct': 0.008056278487896092, 'bear_atr_max_pct': 0.08270219097027907, 'bear_tp_mult': 2.080282601513855, 'bear_tsl_mult': 0.7238999222163285, 'bear_time_stop': 133, 'bear_use_sma': False, 'bear_use_ema': False, 'bear_use_atr': False, 'bear_use_adx': True, 'bear_use_spike': True, 'bear_rsi_required': True, 'sideways_strategy': 'breakout', 'sideways_bb_std_mult': 2.5859824684014465, 'sideways_rsi_os': 45, 'sideways_rsi_ob': 49, 'sideways_adx_thresh': 23.541738341614717, 'sideways_atr_min_pct': 0.006182419199428203, 'sideways_atr_max_pct': 0.025640715115585393, 'sideways_tp_mult': 1.3359848517579405, 'sideways_tsl_mult': 0.6810683645367025, 'sideways_time_stop': 38, 'sideways_use_sma': False, 'sideways_use_ema': False, 'sideways_use_atr': False, 'sideways_use_adx': True, 'sideways_use_spike': False, 'sideways_rsi_required': False}.
