[I 2025-08-29 19:51:30,588] Trial 126 finished with values: [-1000000000.0, 1000000000.0] and parameters: {'p_sma': 52, 'p_std': 30, 'p_atr': 24, 'p_adx': 19, 'rsi_period': 25, 'ema1': 14, 'ema2': 40, 'slip_atr_k': 0.19688798763657073, 'slip_spread_k': 0.23306202442281182, 'spread_hl_frac': 0.001697113057479278, 'bb_std_mult': 1.1917279068341402, 'rsi_os': 11, 'rsi_ob': 71, 'vol_spike': 0.26827236051488534, 'adx_thresh': 31.818978683095054, 'atr_min_pct': 0.016997155398110166, 'atr_max_pct': 0.11853301879794109, 'tp_mult': 2.5666640566294006, 'tsl_mult': 0.9633307536859141, 'strategy': 'mean_reversion', 'time_stop': 123, 'use_sma': True, 'use_atr': True, 'use_adx': False, 'use_ema': False, 'use_spike': False, 'rsi_required': True, 'edge_k': 0.814015347997562, 'edge_cap': 0.18246838064207227, 'bull_strategy': 'breakout', 'bull_bb_std_mult': 1.1191694562634473, 'bull_rsi_os': 19, 'bull_rsi_ob': 94, 'bull_adx_thresh': 20.638560245968833, 'bull_atr_min_pct': 0.01784875068996756, 'bull_atr_max_pct': 0.06354843616190227, 'bull_tp_mult': 1.5702043417173968, 'bull_tsl_mult': 0.03815285945421332, 'bull_time_stop': 288, 'bull_use_sma': False, 'bull_use_ema': True, 'bull_use_atr': False, 'bull_use_adx': True, 'bull_use_spike': False, 'bull_rsi_required': True, 'bear_strategy': 'breakout', 'bear_bb_std_mult': 2.194269068545329, 'bear_rsi_os': 30, 'bear_rsi_ob': 81, 'bear_adx_thresh': 19.158290174411107, 'bear_atr_min_pct': 0.016365708994725205, 'bear_atr_max_pct': 0.1203949464763838, 'bear_tp_mult': 1.995970795151311, 'bear_tsl_mult': 0.16435289615630277, 'bear_time_stop': 43, 'bear_use_sma': False, 'bear_use_ema': False, 'bear_use_atr': True, 'bear_use_adx': False, 'bear_use_spike': False, 'bear_rsi_required': False, 'sideways_strategy': 'mean_reversion', 'sideways_bb_std_mult': 3.1679154311464757, 'sideways_rsi_os': 30, 'sideways_rsi_ob': 53, 'sideways_adx_thresh': 28.996844182193463, 'sideways_atr_min_pct': 0.015300554774760252, 'sideways_atr_max_pct': 0.09057363924235663, 'sideways_tp_mult': 1.9571066847931649, 'sideways_tsl_mult': 0.23364761865303688, 'sideways_time_stop': 215, 'sideways_use_sma': False, 'sideways_use_ema': True, 'sideways_use_atr': True, 'sideways_use_adx': False, 'sideways_use_spike': False, 'sideways_rsi_required': True}.
[I 2025-08-29 19:51:31,085] Trial 127 finished with values: [-1000000000.0, 1000000000.0] and parameters: {'p_sma': 16, 'p_std': 31, 'p_atr': 24, 'p_adx': 17, 'rsi_period': 63, 'ema1': 21, 'ema2': 43, 'slip_atr_k': 0.04286468517941028, 'slip_spread_k': 0.21914372765999965, 'spread_hl_frac': 0.0016268415273098876, 'bb_std_mult': 3.0483011992312483, 'rsi_os': 40, 'rsi_ob': 75, 'vol_spike': 0.044608156157069936, 'adx_thresh': 31.742287517809, 'atr_min_pct': 0.016883530881968895, 'atr_max_pct': 0.038818246648202374, 'tp_mult': 2.557903778599791, 'tsl_mult': 0.927942616401284, 'strategy': 'mean_reversion', 'time_stop': 124, 'use_sma': True, 'use_atr': True, 'use_adx': False, 'use_ema': False, 'use_spike': False, 'rsi_required': True, 'edge_k': 1.3825422588039322, 'edge_cap': 0.41669757671800944, 'bull_strategy': 'breakout', 'bull_bb_std_mult': 0.6298830044682826, 'bull_rsi_os': 28, 'bull_rsi_ob': 76, 'bull_adx_thresh': 34.55837597630311, 'bull_atr_min_pct': 0.02973565389311103, 'bull_atr_max_pct': 0.11788349420999147, 'bull_tp_mult': 2.0760837419164346, 'bull_tsl_mult': 0.22100779828552025, 'bull_time_stop': 288, 'bull_use_sma': False, 'bull_use_ema': True, 'bull_use_atr': False, 'bull_use_adx': True, 'bull_use_spike': False, 'bull_rsi_required': True, 'bear_strategy': 'breakout', 'bear_bb_std_mult': 1.545681982462563, 'bear_rsi_os': 34, 'bear_rsi_ob': 53, 'bear_adx_thresh': 7.384196110777421, 'bear_atr_min_pct': 0.005978468820018778, 'bear_atr_max_pct': 0.05874604934325225, 'bear_tp_mult': 2.4095754068173747, 'bear_tsl_mult': 0.34878990745615646, 'bear_time_stop': 20, 'bear_use_sma': False, 'bear_use_ema': False, 'bear_use_atr': True, 'bear_use_adx': False, 'bear_use_spike': False, 'bear_rsi_required': False, 'sideways_strategy': 'mean_reversion', 'sideways_bb_std_mult': 3.1081861615377937, 'sideways_rsi_os': 25, 'sideways_rsi_ob': 80, 'sideways_adx_thresh': 8.549880551290343, 'sideways_atr_min_pct': 0.01566646104711044, 'sideways_atr_max_pct': 0.02340320503080339, 'sideways_tp_mult': 1.976207202076228, 'sideways_tsl_mult': 0.2271570316515977, 'sideways_time_stop': 269, 'sideways_use_sma': False, 'sideways_use_ema': True, 'sideways_use_atr': True, 'sideways_use_adx': False, 'sideways_use_spike': False, 'sideways_rsi_required': True}.
[I 2025-08-29 19:52:01,027] Trial 128 finished with values: [-0.0004760893741880823, 0.0012650987283172005] and parameters: {'p_sma': 52, 'p_std': 28, 'p_atr': 24, 'p_adx': 15, 'rsi_period': 61, 'ema1': 13, 'ema2': 44, 'slip_atr_k': 0.04360316790651679, 'slip_spread_k': 0.3747384549513393, 'spread_hl_frac': 0.0015214943365266138, 'bb_std_mult': 3.495578968112334, 'rsi_os': 40, 'rsi_ob': 71, 'vol_spike': 0.04934844322464456, 'adx_thresh': 33.992262949905445, 'atr_min_pct': 0.014929275286532257, 'atr_max_pct': 0.03757825341733435, 'tp_mult': 2.4420161126815856, 'tsl_mult': 0.9730490856039314, 'strategy': 'mean_reversion', 'time_stop': 134, 'use_sma': False, 'use_atr': True, 'use_adx': False, 'use_ema': True, 'use_spike': False, 'rsi_required': True, 'edge_k': 1.2579725508349668, 'edge_cap': 0.4130153657768152, 'bull_strategy': 'breakout', 'bull_bb_std_mult': 1.095016230220974, 'bull_rsi_os': 40, 'bull_rsi_ob': 91, 'bull_adx_thresh': 11.424337749278905, 'bull_atr_min_pct': 0.01914611981008647, 'bull_atr_max_pct': 0.11981722158608753, 'bull_tp_mult': 2.0219090754640106, 'bull_tsl_mult': 0.21969449114183964, 'bull_time_stop': 291, 'bull_use_sma': False, 'bull_use_ema': True, 'bull_use_atr': False, 'bull_use_adx': True, 'bull_use_spike': False, 'bull_rsi_required': True, 'bear_strategy': 'breakout', 'bear_bb_std_mult': 2.260149042390516, 'bear_rsi_os': 34, 'bear_rsi_ob': 51, 'bear_adx_thresh': 34.05309746632478, 'bear_atr_min_pct': 0.00598866702932471, 'bear_atr_max_pct': 0.0403186399715551, 'bear_tp_mult': 1.783502482832309, 'bear_tsl_mult': 0.8770048464209175, 'bear_time_stop': 17, 'bear_use_sma': False, 'bear_use_ema': False, 'bear_use_atr': True, 'bear_use_adx': True, 'bear_use_spike': False, 'bear_rsi_required': False, 'sideways_strategy': 'mean_reversion', 'sideways_bb_std_mult': 0.7949259633870243, 'sideways_rsi_os': 27, 'sideways_rsi_ob': 56, 'sideways_adx_thresh': 27.528357992681162, 'sideways_atr_min_pct': 0.005144091948295739, 'sideways_atr_max_pct': 0.12173963679582143, 'sideways_tp_mult': 2.0266727074775828, 'sideways_tsl_mult': 0.21603651277307756, 'sideways_time_stop': 273, 'sideways_use_sma': False, 'sideways_use_ema': True, 'sideways_use_atr': True, 'sideways_use_adx': False, 'sideways_use_spike': False, 'sideways_rsi_required': True}.
[I 2025-08-29 19:52:01,336] Trial 131 finished with values: [-1000000000.0, 1000000000.0] and parameters: {'p_sma': 38, 'p_std': 48, 'p_atr': 26, 'p_adx': 15, 'rsi_period': 38, 'ema1': 13, 'ema2': 44, 'slip_atr_k': 0.03721829411406738, 'slip_spread_k': 0.257916641932272, 'spread_hl_frac': 0.008955927049991597, 'bb_std_mult': 2.4587826214548163, 'rsi_os': 17, 'rsi_ob': 64, 'vol_spike': 0.22367330783842607, 'adx_thresh': 5.227004679913485, 'atr_min_pct': 0.014779676064113269, 'atr_max_pct': 0.018360112088187018, 'tp_mult': 2.303750137357486, 'tsl_mult': 0.1614865907225892, 'strategy': 'mean_reversion', 'time_stop': 25, 'use_sma': False, 'use_atr': False, 'use_adx': False, 'use_ema': True, 'use_spike': False, 'rsi_required': True, 'edge_k': 1.2803272344522396, 'edge_cap': 0.45066107671066513, 'bull_strategy': 'breakout', 'bull_bb_std_mult': 0.8447539471805172, 'bull_rsi_os': 17, 'bull_rsi_ob': 56, 'bull_adx_thresh': 31.783748386851435, 'bull_atr_min_pct': 0.02450785218912387, 'bull_atr_max_pct': 0.11043674418848161, 'bull_tp_mult': 1.4463604259832754, 'bull_tsl_mult': 0.18850894052497966, 'bull_time_stop': 300, 'bull_use_sma': False, 'bull_use_ema': True, 'bull_use_atr': False, 'bull_use_adx': False, 'bull_use_spike': False, 'bull_rsi_required': True, 'bear_strategy': 'breakout', 'bear_bb_std_mult': 1.3010175395673143, 'bear_rsi_os': 28, 'bear_rsi_ob': 94, 'bear_adx_thresh': 18.289368126714866, 'bear_atr_min_pct': 0.028674396539052856, 'bear_atr_max_pct': 0.04135438658097432, 'bear_tp_mult': 1.7699931396273176, 'bear_tsl_mult': 0.39611833140879726, 'bear_time_stop': 11, 'bear_use_sma': False, 'bear_use_ema': False, 'bear_use_atr': True, 'bear_use_adx': True, 'bear_use_spike': False, 'bear_rsi_required': True, 'sideways_strategy': 'mean_reversion', 'sideways_bb_std_mult': 2.6404303702195047, 'sideways_rsi_os': 27, 'sideways_rsi_ob': 66, 'sideways_adx_thresh': 27.078645860623823, 'sideways_atr_min_pct': 0.02008570427518689, 'sideways_atr_max_pct': 0.12275811462268865, 'sideways_tp_mult': 2.252092398150431, 'sideways_tsl_mult': 0.269160238218556, 'sideways_time_stop': 252, 'sideways_use_sma': False, 'sideways_use_ema': False, 'sideways_use_atr': True, 'sideways_use_adx': False, 'sideways_use_spike': True, 'sideways_rsi_required': True}.
[I 2025-08-29 19:52:01,789] Trial 130 finished with values: [-0.00199498442364221, 0.0026141742793560595] and parameters: {'p_sma': 38, 'p_std': 48, 'p_atr': 23, 'p_adx': 13, 'rsi_period': 24, 'ema1': 13, 'ema2': 44, 'slip_atr_k': 0.03578181359204004, 'slip_spread_k': 0.26303015994164974, 'spread_hl_frac': 0.009080368887754825, 'bb_std_mult': 1.757356991941603, 'rsi_os': 36, 'rsi_ob': 74, 'vol_spike': 0.07859801961639049, 'adx_thresh': 34.04384871299484, 'atr_min_pct': 0.009225731926182033, 'atr_max_pct': 0.05542347763296929, 'tp_mult': 2.5252953707588146, 'tsl_mult': 0.536035356096311, 'strategy': 'mean_reversion', 'time_stop': 132, 'use_sma': False, 'use_atr': False, 'use_adx': False, 'use_ema': True, 'use_spike': False, 'rsi_required': True, 'edge_k': 0.7691759005844945, 'edge_cap': 0.41852885275436696, 'bull_strategy': 'breakout', 'bull_bb_std_mult': 0.7310681081380311, 'bull_rsi_os': 25, 'bull_rsi_ob': 91, 'bull_adx_thresh': 25.140847623055638, 'bull_atr_min_pct': 0.02439095059975498, 'bull_atr_max_pct': 0.11776866368376224, 'bull_tp_mult': 2.0851528350020314, 'bull_tsl_mult': 0.22030628936176455, 'bull_time_stop': 280, 'bull_use_sma': False, 'bull_use_ema': True, 'bull_use_atr': False, 'bull_use_adx': True, 'bull_use_spike': False, 'bull_rsi_required': True, 'bear_strategy': 'breakout', 'bear_bb_std_mult': 0.5662917457544496, 'bear_rsi_os': 41, 'bear_rsi_ob': 62, 'bear_adx_thresh': 7.838267438029111, 'bear_atr_min_pct': 0.006281060287441676, 'bear_atr_max_pct': 0.032741395121293156, 'bear_tp_mult': 2.202573550473131, 'bear_tsl_mult': 0.625781082654603, 'bear_time_stop': 18, 'bear_use_sma': False, 'bear_use_ema': False, 'bear_use_atr': True, 'bear_use_adx': True, 'bear_use_spike': False, 'bear_rsi_required': False, 'sideways_strategy': 'mean_reversion', 'sideways_bb_std_mult': 2.0891332401815044, 'sideways_rsi_os': 32, 'sideways_rsi_ob': 66, 'sideways_adx_thresh': 27.1730507887019, 'sideways_atr_min_pct': 0.0010730850382486157, 'sideways_atr_max_pct': 0.022168244347743934, 'sideways_tp_mult': 2.23350533833222, 'sideways_tsl_mult': 0.21243614191472454, 'sideways_time_stop': 268, 'sideways_use_sma': False, 'sideways_use_ema': True, 'sideways_use_atr': True, 'sideways_use_adx': False, 'sideways_use_spike': True, 'sideways_rsi_required': True}.
[I 2025-08-29 19:52:01,958] Trial 129 finished with values: [-0.02099946100072414, 0.02099745529180053] and parameters: {'p_sma': 39, 'p_std': 30, 'p_atr': 26, 'p_adx': 17, 'rsi_period': 42, 'ema1': 29, 'ema2': 36, 'slip_atr_k': 0.035216725753618325, 'slip_spread_k': 0.2666336983973769, 'spread_hl_frac': 0.0016983491205851686, 'bb_std_mult': 1.753205302483978, 'rsi_os': 40, 'rsi_ob': 72, 'vol_spike': 0.22786595112940822, 'adx_thresh': 31.82595735103453, 'atr_min_pct': 0.008874690773809021, 'atr_max_pct': 0.0185783529721648, 'tp_mult': 2.4511704581333156, 'tsl_mult': 0.9630332650012778, 'strategy': 'mean_reversion', 'time_stop': 113, 'use_sma': False, 'use_atr': True, 'use_adx': False, 'use_ema': True, 'use_spike': False, 'rsi_required': True, 'edge_k': 0.785762094138853, 'edge_cap': 0.4720134044841522, 'bull_strategy': 'breakout', 'bull_bb_std_mult': 0.6462750045191468, 'bull_rsi_os': 24, 'bull_rsi_ob': 94, 'bull_adx_thresh': 8.755757720259767, 'bull_atr_min_pct': 3.0373326622545188e-05, 'bull_atr_max_pct': 0.11453823083906063, 'bull_tp_mult': 2.1127612663862707, 'bull_tsl_mult': 0.22661951827980276, 'bull_time_stop': 135, 'bull_use_sma': False, 'bull_use_ema': True, 'bull_use_atr': False, 'bull_use_adx': True, 'bull_use_spike': False, 'bull_rsi_required': True, 'bear_strategy': 'breakout', 'bear_bb_std_mult': 1.9618879343672357, 'bear_rsi_os': 34, 'bear_rsi_ob': 74, 'bear_adx_thresh': 7.572227187920316, 'bear_atr_min_pct': 0.028247845664586803, 'bear_atr_max_pct': 0.13107434295582907, 'bear_tp_mult': 1.7934861251851257, 'bear_tsl_mult': 0.40011094466066477, 'bear_time_stop': 19, 'bear_use_sma': False, 'bear_use_ema': False, 'bear_use_atr': True, 'bear_use_adx': True, 'bear_use_spike': False, 'bear_rsi_required': False, 'sideways_strategy': 'mean_reversion', 'sideways_bb_std_mult': 2.153046467312944, 'sideways_rsi_os': 32, 'sideways_rsi_ob': 65, 'sideways_adx_thresh': 11.940796219091748, 'sideways_atr_min_pct': 0.004320880754665598, 'sideways_atr_max_pct': 0.0578529728016855, 'sideways_tp_mult': 1.370499389016939, 'sideways_tsl_mult': 0.22210218481391547, 'sideways_time_stop': 271, 'sideways_use_sma': False, 'sideways_use_ema': True, 'sideways_use_atr': True, 'sideways_use_adx': False, 'sideways_use_spike': True, 'sideways_rsi_required': True}.
[I 2025-08-29 19:52:02,305] Trial 134 finished with values: [-1000000000.0, 1000000000.0] and parameters: {'p_sma': 22, 'p_std': 20, 'p_atr': 23, 'p_adx': 14, 'rsi_period': 46, 'ema1': 11, 'ema2': 36, 'slip_atr_k': 0.03161637357963907, 'slip_spread_k': 0.3515463624141968, 'spread_hl_frac': 0.0035401269703643702, 'bb_std_mult': 1.532283291769744, 'rsi_os': 36, 'rsi_ob': 47, 'vol_spike': 0.08034449956415118, 'adx_thresh': 33.902799209697456, 'atr_min_pct': 0.028992896203413797, 'atr_max_pct': 0.056431610061794764, 'tp_mult': 2.4722184084148107, 'tsl_mult': 0.2214471657829406, 'strategy': 'mean_reversion', 'time_stop': 113, 'use_sma': False, 'use_atr': True, 'use_adx': False, 'use_ema': False, 'use_spike': False, 'rsi_required': True, 'edge_k': 1.302607728022861, 'edge_cap': 0.47978346963201784, 'bull_strategy': 'breakout', 'bull_bb_std_mult': 0.7077390689995323, 'bull_rsi_os': 41, 'bull_rsi_ob': 94, 'bull_adx_thresh': 22.12856929726251, 'bull_atr_min_pct': 0.023233500974221166, 'bull_atr_max_pct': 0.12999032104209846, 'bull_tp_mult': 1.1841258137062742, 'bull_tsl_mult': 0.15267199421435276, 'bull_time_stop': 279, 'bull_use_sma': False, 'bull_use_ema': True, 'bull_use_atr': False, 'bull_use_adx': True, 'bull_use_spike': False, 'bull_rsi_required': True, 'bear_strategy': 'breakout', 'bear_bb_std_mult': 0.5748552369732218, 'bear_rsi_os': 40, 'bear_rsi_ob': 66, 'bear_adx_thresh': 6.321063146121574, 'bear_atr_min_pct': 0.022506256305416646, 'bear_atr_max_pct': 0.10948478012137353, 'bear_tp_mult': 1.8149382940010248, 'bear_tsl_mult': 0.8834164584817097, 'bear_time_stop': 18, 'bear_use_sma': False, 'bear_use_ema': False, 'bear_use_atr': False, 'bear_use_adx': False, 'bear_use_spike': False, 'bear_rsi_required': False, 'sideways_strategy': 'breakout', 'sideways_bb_std_mult': 2.1072803451669473, 'sideways_rsi_os': 32, 'sideways_rsi_ob': 72, 'sideways_adx_thresh': 15.259672249442692, 'sideways_atr_min_pct': 0.00025141229613861484, 'sideways_atr_max_pct': 0.12607278222991253, 'sideways_tp_mult': 1.3293354900984398, 'sideways_tsl_mult': 0.013619222597094027, 'sideways_time_stop': 286, 'sideways_use_sma': False, 'sideways_use_ema': True, 'sideways_use_atr': True, 'sideways_use_adx': False, 'sideways_use_spike': False, 'sideways_rsi_required': True}.
[I 2025-08-29 19:52:02,306] Trial 135 finished with values: [-1000000000.0, 1000000000.0] and parameters: {'p_sma': 21, 'p_std': 27, 'p_atr': 23, 'p_adx': 13, 'rsi_period': 37, 'ema1': 22, 'ema2': 39, 'slip_atr_k': 0.02349320367098223, 'slip_spread_k': 0.360776348630322, 'spread_hl_frac': 0.003551078383845796, 'bb_std_mult': 1.3667570524923263, 'rsi_os': 20, 'rsi_ob': 46, 'vol_spike': 0.24131755645885133, 'adx_thresh': 34.095958979905184, 'atr_min_pct': 0.01813209421653924, 'atr_max_pct': 0.05393945996815735, 'tp_mult': 2.3196628383178646, 'tsl_mult': 0.5822426517757958, 'strategy': 'mean_reversion', 'time_stop': 134, 'use_sma': False, 'use_atr': False, 'use_adx': False, 'use_ema': False, 'use_spike': False, 'rsi_required': True, 'edge_k': 1.3170727128741582, 'edge_cap': 0.4372619779584056, 'bull_strategy': 'breakout', 'bull_bb_std_mult': 0.7376539503480646, 'bull_rsi_os': 43, 'bull_rsi_ob': 91, 'bull_adx_thresh': 25.205863220434995, 'bull_atr_min_pct': 0.023164090168232596, 'bull_atr_max_pct': 0.0686740803056917, 'bull_tp_mult': 2.2450073548916007, 'bull_tsl_mult': 0.08384281721072595, 'bull_time_stop': 275, 'bull_use_sma': False, 'bull_use_ema': True, 'bull_use_atr': False, 'bull_use_adx': True, 'bull_use_spike': False, 'bull_rsi_required': True, 'bear_strategy': 'breakout', 'bear_bb_std_mult': 2.9115784725289897, 'bear_rsi_os': 45, 'bear_rsi_ob': 66, 'bear_adx_thresh': 34.16297098190937, 'bear_atr_min_pct': 0.02259491613133019, 'bear_atr_max_pct': 0.10815073921849198, 'bear_tp_mult': 1.887128522401155, 'bear_tsl_mult': 0.6299765730911205, 'bear_time_stop': 230, 'bear_use_sma': False, 'bear_use_ema': False, 'bear_use_atr': False, 'bear_use_adx': False, 'bear_use_spike': False, 'bear_rsi_required': False, 'sideways_strategy': 'breakout', 'sideways_bb_std_mult': 3.484605271595148, 'sideways_rsi_os': 32, 'sideways_rsi_ob': 56, 'sideways_adx_thresh': 5.032087074125103, 'sideways_atr_min_pct': 0.01654447985365686, 'sideways_atr_max_pct': 0.014411419108159934, 'sideways_tp_mult': 2.0234105120842476, 'sideways_tsl_mult': 0.1632972854579252, 'sideways_time_stop': 287, 'sideways_use_sma': False, 'sideways_use_ema': True, 'sideways_use_atr': True, 'sideways_use_adx': False, 'sideways_use_spike': False, 'sideways_rsi_required': True}.
[I 2025-08-29 19:52:02,306] Trial 132 finished with values: [-1000000000.0, 1000000000.0] and parameters: {'p_sma': 38, 'p_std': 27, 'p_atr': 25, 'p_adx': 13, 'rsi_period': 47, 'ema1': 13, 'ema2': 44, 'slip_atr_k': 0.03526424428075117, 'slip_spread_k': 0.15267634920631437, 'spread_hl_frac': 0.008629563208592058, 'bb_std_mult': 1.7377981889063114, 'rsi_os': 17, 'rsi_ob': 47, 'vol_spike': 0.22417640515999185, 'adx_thresh': 25.062098728421432, 'atr_min_pct': 0.018328096669611632, 'atr_max_pct': 0.12313320311742634, 'tp_mult': 2.313013143648807, 'tsl_mult': 0.15127972650532556, 'strategy': 'mean_reversion', 'time_stop': 134, 'use_sma': False, 'use_atr': False, 'use_adx': False, 'use_ema': True, 'use_spike': False, 'rsi_required': True, 'edge_k': 1.2777949316661865, 'edge_cap': 0.4424815828382509, 'bull_strategy': 'breakout', 'bull_bb_std_mult': 0.6947203770970212, 'bull_rsi_os': 43, 'bull_rsi_ob': 91, 'bull_adx_thresh': 31.748949964298877, 'bull_atr_min_pct': 0.0235356720997081, 'bull_atr_max_pct': 0.023602234562475143, 'bull_tp_mult': 1.3183687354254545, 'bull_tsl_mult': 0.1899437936503489, 'bull_time_stop': 139, 'bull_use_sma': False, 'bull_use_ema': True, 'bull_use_atr': False, 'bull_use_adx': True, 'bull_use_spike': False, 'bull_rsi_required': True, 'bear_strategy': 'breakout', 'bear_bb_std_mult': 0.574889922706445, 'bear_rsi_os': 45, 'bear_rsi_ob': 74, 'bear_adx_thresh': 23.40153172806338, 'bear_atr_min_pct': 0.029124729883475954, 'bear_atr_max_pct': 0.04347911375695297, 'bear_tp_mult': 1.8118963523968639, 'bear_tsl_mult': 0.12857936485242905, 'bear_time_stop': 12, 'bear_use_sma': False, 'bear_use_ema': False, 'bear_use_atr': False, 'bear_use_adx': True, 'bear_use_spike': False, 'bear_rsi_required': False, 'sideways_strategy': 'breakout', 'sideways_bb_std_mult': 2.614696531236236, 'sideways_rsi_os': 32, 'sideways_rsi_ob': 66, 'sideways_adx_thresh': 27.787284005274604, 'sideways_atr_min_pct': 0.000642343523060699, 'sideways_atr_max_pct': 0.1219176819911693, 'sideways_tp_mult': 1.2770327309164498, 'sideways_tsl_mult': 0.12829827473163097, 'sideways_time_stop': 252, 'sideways_use_sma': False, 'sideways_use_ema': True, 'sideways_use_atr': True, 'sideways_use_adx': False, 'sideways_use_spike': True, 'sideways_rsi_required': True}.
