[I 2025-08-29 20:13:02,151] Trial 307 finished with values: [-0.007833085892937963, 0.007832022525008375] and parameters: {'p_sma': 17, 'p_std': 58, 'p_atr': 13, 'p_adx': 15, 'rsi_period': 38, 'ema1': 18, 'ema2': 49, 'slip_atr_k': 0.028274017037698513, 'slip_spread_k': 0.19565115114429973, 'spread_hl_frac': 0.0038021790473256197, 'bb_std_mult': 1.3310924219708633, 'rsi_os': 51, 'rsi_ob': 80, 'vol_spike': 0.19524833544269019, 'adx_thresh': 32.65740273088823, 'atr_min_pct': 0.018533630886273248, 'atr_max_pct': 0.036185278340328794, 'tp_mult': 1.5576768997372923, 'tsl_mult': 0.8141154687112024, 'strategy': 'breakout', 'time_stop': 177, 'use_sma': True, 'use_atr': False, 'use_adx': True, 'use_ema': True, 'use_spike': False, 'rsi_required': False, 'edge_k': 1.009134499271815, 'edge_cap': 0.5424687419359959, 'bull_strategy': 'mean_reversion', 'bull_bb_std_mult': 3.173973680535002, 'bull_rsi_os': 35, 'bull_rsi_ob': 64, 'bull_adx_thresh': 16.383660929964574, 'bull_atr_min_pct': 0.015639149002812477, 'bull_atr_max_pct': 0.02824208596236234, 'bull_tp_mult': 1.3719487931272634, 'bull_tsl_mult': 0.8089483265427423, 'bull_time_stop': 56, 'bull_use_sma': True, 'bull_use_ema': False, 'bull_use_atr': True, 'bull_use_adx': False, 'bull_use_spike': True, 'bull_rsi_required': False, 'bear_strategy': 'breakout', 'bear_bb_std_mult': 2.660980125501043, 'bear_rsi_os': 27, 'bear_rsi_ob': 65, 'bear_adx_thresh': 7.183158983066001, 'bear_atr_min_pct': 0.027316922552761455, 'bear_atr_max_pct': 0.0343787360624566, 'bear_tp_mult': 2.697907552765306, 'bear_tsl_mult': 0.3906510071475349, 'bear_time_stop': 88, 'bear_use_sma': False, 'bear_use_ema': True, 'bear_use_atr': False, 'bear_use_adx': True, 'bear_use_spike': True, 'bear_rsi_required': False, 'sideways_strategy': 'breakout', 'sideways_bb_std_mult': 2.2529590051808435, 'sideways_rsi_os': 45, 'sideways_rsi_ob': 77, 'sideways_adx_thresh': 34.40046077665458, 'sideways_atr_min_pct': 0.0032002564938573568, 'sideways_atr_max_pct': 0.01534856003320249, 'sideways_tp_mult': 1.0684713703931628, 'sideways_tsl_mult': 0.6960146169657115, 'sideways_time_stop': 183, 'sideways_use_sma': True, 'sideways_use_ema': False, 'sideways_use_atr': False, 'sideways_use_adx': False, 'sideways_use_spike': False, 'sideways_rsi_required': False}.
[I 2025-08-29 20:13:02,350] Trial 306 finished with values: [-0.003911743998871509, 0.0039044873603650406] and parameters: {'p_sma': 16, 'p_std': 58, 'p_atr': 18, 'p_adx': 15, 'rsi_period': 66, 'ema1': 18, 'ema2': 49, 'slip_atr_k': 0.026108763366323076, 'slip_spread_k': 0.7704582512252462, 'spread_hl_frac': 0.044522737877658446, 'bb_std_mult': 1.340147249097397, 'rsi_os': 21, 'rsi_ob': 79, 'vol_spike': 0.19587536255346422, 'adx_thresh': 7.236675211895069, 'atr_min_pct': 0.020157950570641497, 'atr_max_pct': 0.035368416952193504, 'tp_mult': 1.6289453628431254, 'tsl_mult': 0.8095258843739066, 'strategy': 'breakout', 'time_stop': 176, 'use_sma': True, 'use_atr': False, 'use_adx': True, 'use_ema': True, 'use_spike': False, 'rsi_required': False, 'edge_k': 1.0552385637867985, 'edge_cap': 0.5321802305500056, 'bull_strategy': 'mean_reversion', 'bull_bb_std_mult': 3.1609361553464796, 'bull_rsi_os': 36, 'bull_rsi_ob': 67, 'bull_adx_thresh': 16.174750397607454, 'bull_atr_min_pct': 0.01560068775705268, 'bull_atr_max_pct': 0.039592785739012724, 'bull_tp_mult': 1.369353467149377, 'bull_tsl_mult': 0.8805467938383011, 'bull_time_stop': 54, 'bull_use_sma': True, 'bull_use_ema': False, 'bull_use_atr': True, 'bull_use_adx': False, 'bull_use_spike': True, 'bull_rsi_required': False, 'bear_strategy': 'mean_reversion', 'bear_bb_std_mult': 2.518431791201204, 'bear_rsi_os': 27, 'bear_rsi_ob': 65, 'bear_adx_thresh': 7.397423594352947, 'bear_atr_min_pct': 0.0238147485351839, 'bear_atr_max_pct': 0.0338697106587388, 'bear_tp_mult': 2.977828032183313, 'bear_tsl_mult': 0.3547345287252824, 'bear_time_stop': 67, 'bear_use_sma': False, 'bear_use_ema': True, 'bear_use_atr': False, 'bear_use_adx': True, 'bear_use_spike': True, 'bear_rsi_required': False, 'sideways_strategy': 'breakout', 'sideways_bb_std_mult': 2.4462390031833334, 'sideways_rsi_os': 45, 'sideways_rsi_ob': 77, 'sideways_adx_thresh': 34.238462941496834, 'sideways_atr_min_pct': 0.003428991071041963, 'sideways_atr_max_pct': 0.015125806730313083, 'sideways_tp_mult': 1.0471793040889767, 'sideways_tsl_mult': 0.6942560268454526, 'sideways_time_stop': 177, 'sideways_use_sma': True, 'sideways_use_ema': False, 'sideways_use_atr': False, 'sideways_use_adx': False, 'sideways_use_spike': False, 'sideways_rsi_required': False}.
[I 2025-08-29 20:13:02,719] Trial 308 finished with values: [-0.0027168986251805416, 0.002777748463397223] and parameters: {'p_sma': 19, 'p_std': 54, 'p_atr': 15, 'p_adx': 15, 'rsi_period': 38, 'ema1': 19, 'ema2': 49, 'slip_atr_k': 0.029839993145385428, 'slip_spread_k': 0.20024577213568995, 'spread_hl_frac': 0.025790575861424123, 'bb_std_mult': 1.5299353178911048, 'rsi_os': 29, 'rsi_ob': 81, 'vol_spike': 0.1952280297670521, 'adx_thresh': 5.4945224776630095, 'atr_min_pct': 0.020254543857834553, 'atr_max_pct': 0.03640173363471232, 'tp_mult': 1.6415343521998034, 'tsl_mult': 0.8757257610783816, 'strategy': 'breakout', 'time_stop': 175, 'use_sma': True, 'use_atr': False, 'use_adx': True, 'use_ema': True, 'use_spike': False, 'rsi_required': False, 'edge_k': 1.0320774047336085, 'edge_cap': 0.5350968800174687, 'bull_strategy': 'mean_reversion', 'bull_bb_std_mult': 3.188819222626597, 'bull_rsi_os': 35, 'bull_rsi_ob': 61, 'bull_adx_thresh': 16.552205579183425, 'bull_atr_min_pct': 0.014178883327758936, 'bull_atr_max_pct': 0.02842228008613623, 'bull_tp_mult': 1.377239119413013, 'bull_tsl_mult': 0.8104271240230114, 'bull_time_stop': 69, 'bull_use_sma': True, 'bull_use_ema': False, 'bull_use_atr': True, 'bull_use_adx': False, 'bull_use_spike': True, 'bull_rsi_required': False, 'bear_strategy': 'mean_reversion', 'bear_bb_std_mult': 2.5127507446880424, 'bear_rsi_os': 27, 'bear_rsi_ob': 66, 'bear_adx_thresh': 31.331653688715388, 'bear_atr_min_pct': 0.007894222813111088, 'bear_atr_max_pct': 0.03973091014653926, 'bear_tp_mult': 2.562327271763428, 'bear_tsl_mult': 0.36329898471892336, 'bear_time_stop': 92, 'bear_use_sma': True, 'bear_use_ema': True, 'bear_use_atr': False, 'bear_use_adx': True, 'bear_use_spike': True, 'bear_rsi_required': False, 'sideways_strategy': 'breakout', 'sideways_bb_std_mult': 2.235336345870316, 'sideways_rsi_os': 48, 'sideways_rsi_ob': 78, 'sideways_adx_thresh': 34.277275116941084, 'sideways_atr_min_pct': 0.0042132668625256935, 'sideways_atr_max_pct': 0.02040995549709584, 'sideways_tp_mult': 1.3333993210875033, 'sideways_tsl_mult': 0.6937771055498281, 'sideways_time_stop': 173, 'sideways_use_sma': True, 'sideways_use_ema': False, 'sideways_use_atr': False, 'sideways_use_adx': False, 'sideways_use_spike': True, 'sideways_rsi_required': False}.
[I 2025-08-29 20:13:32,540] Trial 309 finished with values: [-0.0005479994298400737, 0.0013637565097456917] and parameters: {'p_sma': 19, 'p_std': 54, 'p_atr': 24, 'p_adx': 15, 'rsi_period': 28, 'ema1': 19, 'ema2': 49, 'slip_atr_k': 0.024965728732770323, 'slip_spread_k': 0.1910822968939837, 'spread_hl_frac': 0.025631865402256374, 'bb_std_mult': 1.3198035577748868, 'rsi_os': 46, 'rsi_ob': 81, 'vol_spike': 0.1943673140930642, 'adx_thresh': 18.573207697631027, 'atr_min_pct': 0.020230375863524087, 'atr_max_pct': 0.03657477625580988, 'tp_mult': 1.6523853119189256, 'tsl_mult': 0.8232783049490136, 'strategy': 'breakout', 'time_stop': 174, 'use_sma': True, 'use_atr': False, 'use_adx': True, 'use_ema': True, 'use_spike': True, 'rsi_required': False, 'edge_k': 1.0518626100276776, 'edge_cap': 0.5229859632524553, 'bull_strategy': 'mean_reversion', 'bull_bb_std_mult': 3.1712996604256487, 'bull_rsi_os': 38, 'bull_rsi_ob': 76, 'bull_adx_thresh': 16.63112762410898, 'bull_atr_min_pct': 0.013973018460154956, 'bull_atr_max_pct': 0.09889998347922002, 'bull_tp_mult': 1.383311723715176, 'bull_tsl_mult': 0.860654953809408, 'bull_time_stop': 52, 'bull_use_sma': True, 'bull_use_ema': False, 'bull_use_atr': True, 'bull_use_adx': False, 'bull_use_spike': True, 'bull_rsi_required': False, 'bear_strategy': 'breakout', 'bear_bb_std_mult': 2.5839585577952207, 'bear_rsi_os': 25, 'bear_rsi_ob': 66, 'bear_adx_thresh': 30.431599485418534, 'bear_atr_min_pct': 0.008108853259699698, 'bear_atr_max_pct': 0.039444499277737695, 'bear_tp_mult': 2.7319472666800957, 'bear_tsl_mult': 0.344950221395043, 'bear_time_stop': 5, 'bear_use_sma': True, 'bear_use_ema': True, 'bear_use_atr': False, 'bear_use_adx': True, 'bear_use_spike': True, 'bear_rsi_required': False, 'sideways_strategy': 'breakout', 'sideways_bb_std_mult': 2.2526526697356366, 'sideways_rsi_os': 47, 'sideways_rsi_ob': 78, 'sideways_adx_thresh': 34.09371254217268, 'sideways_atr_min_pct': 0.004121448983614711, 'sideways_atr_max_pct': 0.021404481955929946, 'sideways_tp_mult': 1.010682639878686, 'sideways_tsl_mult': 0.7017660681007534, 'sideways_time_stop': 181, 'sideways_use_sma': True, 'sideways_use_ema': False, 'sideways_use_atr': False, 'sideways_use_adx': False, 'sideways_use_spike': True, 'sideways_rsi_required': False}.
[I 2025-08-29 20:13:33,452] Trial 312 finished with values: [-0.00025078973761916146, 0.0011840059930440727] and parameters: {'p_sma': 19, 'p_std': 54, 'p_atr': 24, 'p_adx': 15, 'rsi_period': 39, 'ema1': 19, 'ema2': 51, 'slip_atr_k': 0.0289332674820962, 'slip_spread_k': 0.19451433836245913, 'spread_hl_frac': 0.025183591970133812, 'bb_std_mult': 1.491883243537596, 'rsi_os': 46, 'rsi_ob': 82, 'vol_spike': 0.194448521733189, 'adx_thresh': 16.504440406088563, 'atr_min_pct': 0.019231508785611844, 'atr_max_pct': 0.0387360504531415, 'tp_mult': 1.644369670255824, 'tsl_mult': 0.8279561776477218, 'strategy': 'mean_reversion', 'time_stop': 185, 'use_sma': True, 'use_atr': False, 'use_adx': False, 'use_ema': True, 'use_spike': True, 'rsi_required': False, 'edge_k': 1.063639797644211, 'edge_cap': 0.5371172669056621, 'bull_strategy': 'mean_reversion', 'bull_bb_std_mult': 3.0169276555465703, 'bull_rsi_os': 37, 'bull_rsi_ob': 74, 'bull_adx_thresh': 16.67136896029798, 'bull_atr_min_pct': 0.01409132236351149, 'bull_atr_max_pct': 0.030163813905973086, 'bull_tp_mult': 1.4926119255228707, 'bull_tsl_mult': 0.8623770623149114, 'bull_time_stop': 70, 'bull_use_sma': True, 'bull_use_ema': False, 'bull_use_atr': True, 'bull_use_adx': False, 'bull_use_spike': True, 'bull_rsi_required': False, 'bear_strategy': 'breakout', 'bear_bb_std_mult': 2.5510578403076236, 'bear_rsi_os': 27, 'bear_rsi_ob': 67, 'bear_adx_thresh': 18.890635873949083, 'bear_atr_min_pct': 0.0073120948515332075, 'bear_atr_max_pct': 0.029459006134519426, 'bear_tp_mult': 2.5562991335138596, 'bear_tsl_mult': 0.422594401796772, 'bear_time_stop': 5, 'bear_use_sma': True, 'bear_use_ema': True, 'bear_use_atr': False, 'bear_use_adx': True, 'bear_use_spike': True, 'bear_rsi_required': False, 'sideways_strategy': 'breakout', 'sideways_bb_std_mult': 2.280869620263023, 'sideways_rsi_os': 48, 'sideways_rsi_ob': 80, 'sideways_adx_thresh': 33.910546167911576, 'sideways_atr_min_pct': 0.0041454270932368585, 'sideways_atr_max_pct': 0.022679710669300843, 'sideways_tp_mult': 1.0989322851533008, 'sideways_tsl_mult': 0.6507746102508414, 'sideways_time_stop': 170, 'sideways_use_sma': True, 'sideways_use_ema': True, 'sideways_use_atr': False, 'sideways_use_adx': True, 'sideways_use_spike': True, 'sideways_rsi_required': False}.
[I 2025-08-29 20:13:33,884] Trial 310 finished with values: [-0.0018409603884445014, 0.0018959997863694478] and parameters: {'p_sma': 19, 'p_std': 55, 'p_atr': 18, 'p_adx': 16, 'rsi_period': 67, 'ema1': 19, 'ema2': 51, 'slip_atr_k': 0.014804725459181423, 'slip_spread_k': 0.2047730510812006, 'spread_hl_frac': 0.046572950371214644, 'bb_std_mult': 1.5390640061650855, 'rsi_os': 20, 'rsi_ob': 82, 'vol_spike': 0.19512862416757865, 'adx_thresh': 16.335192176021714, 'atr_min_pct': 0.020662967637249105, 'atr_max_pct': 0.0376056886173133, 'tp_mult': 1.6278638245834005, 'tsl_mult': 0.8704801389264885, 'strategy': 'breakout', 'time_stop': 174, 'use_sma': True, 'use_atr': False, 'use_adx': True, 'use_ema': True, 'use_spike': True, 'rsi_required': False, 'edge_k': 0.9546805331662847, 'edge_cap': 0.5358663884167412, 'bull_strategy': 'mean_reversion', 'bull_bb_std_mult': 3.019353768808746, 'bull_rsi_os': 38, 'bull_rsi_ob': 74, 'bull_adx_thresh': 16.731649618282848, 'bull_atr_min_pct': 0.014098217556588619, 'bull_atr_max_pct': 0.09834482806406847, 'bull_tp_mult': 1.4993920729145573, 'bull_tsl_mult': 0.8634605633015814, 'bull_time_stop': 73, 'bull_use_sma': True, 'bull_use_ema': False, 'bull_use_atr': True, 'bull_use_adx': False, 'bull_use_spike': True, 'bull_rsi_required': False, 'bear_strategy': 'mean_reversion', 'bear_bb_std_mult': 2.5162534608983913, 'bear_rsi_os': 25, 'bear_rsi_ob': 64, 'bear_adx_thresh': 7.881466737895508, 'bear_atr_min_pct': 0.007600847279373463, 'bear_atr_max_pct': 0.02940304828064821, 'bear_tp_mult': 2.562142133141232, 'bear_tsl_mult': 0.3444438480961973, 'bear_time_stop': 44, 'bear_use_sma': True, 'bear_use_ema': True, 'bear_use_atr': False, 'bear_use_adx': True, 'bear_use_spike': True, 'bear_rsi_required': False, 'sideways_strategy': 'breakout', 'sideways_bb_std_mult': 2.238846035857549, 'sideways_rsi_os': 48, 'sideways_rsi_ob': 78, 'sideways_adx_thresh': 34.02162959336814, 'sideways_atr_min_pct': 0.004263281155280338, 'sideways_atr_max_pct': 0.021516741006636277, 'sideways_tp_mult': 1.1155913822412358, 'sideways_tsl_mult': 0.7036191607071401, 'sideways_time_stop': 172, 'sideways_use_sma': True, 'sideways_use_ema': True, 'sideways_use_atr': False, 'sideways_use_adx': False, 'sideways_use_spike': True, 'sideways_rsi_required': False}.
[I 2025-08-29 20:13:33,979] Trial 311 finished with values: [-0.0005518116386945549, 0.001180173948698213] and parameters: {'p_sma': 20, 'p_std': 54, 'p_atr': 24, 'p_adx': 16, 'rsi_period': 44, 'ema1': 19, 'ema2': 51, 'slip_atr_k': 0.02855227383329941, 'slip_spread_k': 0.19063297498562604, 'spread_hl_frac': 0.002862617637803205, 'bb_std_mult': 1.5161728544972581, 'rsi_os': 6, 'rsi_ob': 82, 'vol_spike': 0.19249949464237193, 'adx_thresh': 32.49922565776298, 'atr_min_pct': 0.019326967858054787, 'atr_max_pct': 0.03813727090298263, 'tp_mult': 1.6381667383673364, 'tsl_mult': 0.8778570813628394, 'strategy': 'mean_reversion', 'time_stop': 184, 'use_sma': True, 'use_atr': False, 'use_adx': False, 'use_ema': True, 'use_spike': True, 'rsi_required': False, 'edge_k': 0.918547936103958, 'edge_cap': 0.5367789921620867, 'bull_strategy': 'mean_reversion', 'bull_bb_std_mult': 3.0385118691715807, 'bull_rsi_os': 38, 'bull_rsi_ob': 74, 'bull_adx_thresh': 16.814966482065394, 'bull_atr_min_pct': 0.01373579986312985, 'bull_atr_max_pct': 0.09912167561476817, 'bull_tp_mult': 1.5179500799980796, 'bull_tsl_mult': 0.8557428474111483, 'bull_time_stop': 71, 'bull_use_sma': True, 'bull_use_ema': False, 'bull_use_atr': True, 'bull_use_adx': False, 'bull_use_spike': True, 'bull_rsi_required': False, 'bear_strategy': 'breakout', 'bear_bb_std_mult': 2.5540940551918077, 'bear_rsi_os': 25, 'bear_rsi_ob': 66, 'bear_adx_thresh': 18.550139246744074, 'bear_atr_min_pct': 0.007891847909982357, 'bear_atr_max_pct': 0.04057582064528632, 'bear_tp_mult': 2.5625612581127295, 'bear_tsl_mult': 0.4061540766248654, 'bear_time_stop': 166, 'bear_use_sma': True, 'bear_use_ema': True, 'bear_use_atr': False, 'bear_use_adx': True, 'bear_use_spike': True, 'bear_rsi_required': False, 'sideways_strategy': 'breakout', 'sideways_bb_std_mult': 2.289112098813076, 'sideways_rsi_os': 48, 'sideways_rsi_ob': 79, 'sideways_adx_thresh': 33.89554926101713, 'sideways_atr_min_pct': 0.004236268001435383, 'sideways_atr_max_pct': 0.022077876539384488, 'sideways_tp_mult': 1.2406468236020067, 'sideways_tsl_mult': 0.6350352700785116, 'sideways_time_stop': 216, 'sideways_use_sma': False, 'sideways_use_ema': True, 'sideways_use_atr': False, 'sideways_use_adx': False, 'sideways_use_spike': True, 'sideways_rsi_required': False}.
[I 2025-08-29 20:14:04,935] Trial 314 finished with values: [-0.0012760269271211433, 0.0014417528643808522] and parameters: {'p_sma': 19, 'p_std': 54, 'p_atr': 24, 'p_adx': 14, 'rsi_period': 39, 'ema1': 19, 'ema2': 52, 'slip_atr_k': 0.016320551928615257, 'slip_spread_k': 0.20306311899256932, 'spread_hl_frac': 0.0030113078127204152, 'bb_std_mult': 1.5086914015727562, 'rsi_os': 29, 'rsi_ob': 82, 'vol_spike': 0.19660313491308898, 'adx_thresh': 16.604057382625683, 'atr_min_pct': 0.019226635470406126, 'atr_max_pct': 0.03866623465107761, 'tp_mult': 1.644682376769284, 'tsl_mult': 0.8745154145831604, 'strategy': 'mean_reversion', 'time_stop': 186, 'use_sma': True, 'use_atr': False, 'use_adx': False, 'use_ema': True, 'use_spike': True, 'rsi_required': False, 'edge_k': 1.0615983406666663, 'edge_cap': 0.5451488480035892, 'bull_strategy': 'mean_reversion', 'bull_bb_std_mult': 3.0300170002226103, 'bull_rsi_os': 38, 'bull_rsi_ob': 74, 'bull_adx_thresh': 16.77837832954864, 'bull_atr_min_pct': 0.014017825675857873, 'bull_atr_max_pct': 0.11792867220215722, 'bull_tp_mult': 2.1927051649850844, 'bull_tsl_mult': 0.8616897387452627, 'bull_time_stop': 69, 'bull_use_sma': True, 'bull_use_ema': False, 'bull_use_atr': True, 'bull_use_adx': False, 'bull_use_spike': True, 'bull_rsi_required': False, 'bear_strategy': 'breakout', 'bear_bb_std_mult': 2.5786273567880365, 'bear_rsi_os': 27, 'bear_rsi_ob': 67, 'bear_adx_thresh': 18.530655125976704, 'bear_atr_min_pct': 0.02484616631836413, 'bear_atr_max_pct': 0.039197915033080344, 'bear_tp_mult': 2.5690152033827447, 'bear_tsl_mult': 0.42009784861198457, 'bear_time_stop': 6, 'bear_use_sma': True, 'bear_use_ema': True, 'bear_use_atr': False, 'bear_use_adx': True, 'bear_use_spike': True, 'bear_rsi_required': False, 'sideways_strategy': 'breakout', 'sideways_bb_std_mult': 2.285715863794536, 'sideways_rsi_os': 48, 'sideways_rsi_ob': 79, 'sideways_adx_thresh': 32.85570330240112, 'sideways_atr_min_pct': 0.004135821891061333, 'sideways_atr_max_pct': 0.022016003878883236, 'sideways_tp_mult': 1.1116619800613912, 'sideways_tsl_mult': 0.6379762437956127, 'sideways_time_stop': 171, 'sideways_use_sma': True, 'sideways_use_ema': True, 'sideways_use_atr': False, 'sideways_use_adx': True, 'sideways_use_spike': True, 'sideways_rsi_required': False}.
[I 2025-08-29 20:14:05,281] Trial 316 finished with values: [-0.0013508187739343924, 0.0014019957512334522] and parameters: {'p_sma': 19, 'p_std': 54, 'p_atr': 24, 'p_adx': 16, 'rsi_period': 39, 'ema1': 19, 'ema2': 48, 'slip_atr_k': 0.019330481670005804, 'slip_spread_k': 0.19864144075040852, 'spread_hl_frac': 0.02512705044222491, 'bb_std_mult': 1.3105955434831857, 'rsi_os': 6, 'rsi_ob': 81, 'vol_spike': 0.19395112817281257, 'adx_thresh': 5.667126340516992, 'atr_min_pct': 0.019168651850642787, 'atr_max_pct': 0.03820004496101999, 'tp_mult': 1.655253562972839, 'tsl_mult': 0.8804940811127444, 'strategy': 'breakout', 'time_stop': 185, 'use_sma': True, 'use_atr': False, 'use_adx': False, 'use_ema': True, 'use_spike': False, 'rsi_required': False, 'edge_k': 1.0536607711353898, 'edge_cap': 0.5428224708760665, 'bull_strategy': 'mean_reversion', 'bull_bb_std_mult': 3.025411795931799, 'bull_rsi_os': 38, 'bull_rsi_ob': 74, 'bull_adx_thresh': 16.693819042320406, 'bull_atr_min_pct': 0.01421496305803134, 'bull_atr_max_pct': 0.030131309822299692, 'bull_tp_mult': 2.824960621539658, 'bull_tsl_mult': 0.8592972986714873, 'bull_time_stop': 71, 'bull_use_sma': True, 'bull_use_ema': False, 'bull_use_atr': True, 'bull_use_adx': False, 'bull_use_spike': True, 'bull_rsi_required': False, 'bear_strategy': 'mean_reversion', 'bear_bb_std_mult': 2.5810659651122654, 'bear_rsi_os': 27, 'bear_rsi_ob': 66, 'bear_adx_thresh': 6.71831471525712, 'bear_atr_min_pct': 0.00737209676962319, 'bear_atr_max_pct': 0.04037897455014096, 'bear_tp_mult': 2.558502694122517, 'bear_tsl_mult': 0.4258147958826184, 'bear_time_stop': 5, 'bear_use_sma': True, 'bear_use_ema': True, 'bear_use_atr': False, 'bear_use_adx': True, 'bear_use_spike': True, 'bear_rsi_required': False, 'sideways_strategy': 'breakout', 'sideways_bb_std_mult': 2.2717486096955266, 'sideways_rsi_os': 48, 'sideways_rsi_ob': 79, 'sideways_adx_thresh': 32.828417016706815, 'sideways_atr_min_pct': 0.004094406076836301, 'sideways_atr_max_pct': 0.02092329537673924, 'sideways_tp_mult': 1.1047370344364282, 'sideways_tsl_mult': 0.6268849815214819, 'sideways_time_stop': 212, 'sideways_use_sma': False, 'sideways_use_ema': True, 'sideways_use_atr': False, 'sideways_use_adx': True, 'sideways_use_spike': True, 'sideways_rsi_required': False}.
