[I 2025-08-29 20:59:51,198] Trial 721 finished with values: [-0.007438214585038794, 0.00748392811338804] and parameters: {'p_sma': 21, 'p_std': 37, 'p_atr': 23, 'p_adx': 8, 'rsi_period': 60, 'ema1': 26, 'ema2': 44, 'slip_atr_k': 0.2208883686571367, 'slip_spread_k': 0.13824904930336027, 'spread_hl_frac': 0.03332878259505178, 'bb_std_mult': 1.6438852946700833, 'rsi_os': 12, 'rsi_ob': 83, 'vol_spike': 0.16566025696485442, 'adx_thresh': 14.04770306299148, 'atr_min_pct': 0.01896485061744413, 'atr_max_pct': 0.025657283329752496, 'tp_mult': 1.1104197208910869, 'tsl_mult': 0.12347418444793029, 'strategy': 'mean_reversion', 'time_stop': 153, 'use_sma': True, 'use_atr': False, 'use_adx': False, 'use_ema': True, 'use_spike': False, 'rsi_required': False, 'edge_k': 1.0846692099303392, 'edge_cap': 0.568001022806511, 'bull_strategy': 'mean_reversion', 'bull_bb_std_mult': 3.089591752824758, 'bull_rsi_os': 5, 'bull_rsi_ob': 76, 'bull_adx_thresh': 15.3993968150161, 'bull_atr_min_pct': 0.018064511614425717, 'bull_atr_max_pct': 0.06808119616268668, 'bull_tp_mult': 1.7406013702418512, 'bull_tsl_mult': 0.6919870930015961, 'bull_time_stop': 23, 'bull_use_sma': True, 'bull_use_ema': False, 'bull_use_atr': True, 'bull_use_adx': False, 'bull_use_spike': True, 'bull_rsi_required': False, 'bear_strategy': 'breakout', 'bear_bb_std_mult': 0.8586546054748019, 'bear_rsi_os': 41, 'bear_rsi_ob': 55, 'bear_adx_thresh': 21.05042266452488, 'bear_atr_min_pct': 0.018939304094832236, 'bear_atr_max_pct': 0.023877191572514417, 'bear_tp_mult': 2.4306580233991086, 'bear_tsl_mult': 0.9364391258474042, 'bear_time_stop': 48, 'bear_use_sma': False, 'bear_use_ema': True, 'bear_use_atr': False, 'bear_use_adx': True, 'bear_use_spike': True, 'bear_rsi_required': False, 'sideways_strategy': 'breakout', 'sideways_bb_std_mult': 2.452403369486193, 'sideways_rsi_os': 46, 'sideways_rsi_ob': 79, 'sideways_adx_thresh': 32.5266356663041, 'sideways_atr_min_pct': 0.0034573164382325234, 'sideways_atr_max_pct': 0.020042304262709133, 'sideways_tp_mult': 2.0690997114620586, 'sideways_tsl_mult': 0.9398961818775244, 'sideways_time_stop': 213, 'sideways_use_sma': False, 'sideways_use_ema': False, 'sideways_use_atr': True, 'sideways_use_adx': False, 'sideways_use_spike': False, 'sideways_rsi_required': False}.
[I 2025-08-29 20:59:51,524] Trial 720 finished with values: [-1000000000.0, 1000000000.0] and parameters: {'p_sma': 10, 'p_std': 46, 'p_atr': 23, 'p_adx': 14, 'rsi_period': 39, 'ema1': 26, 'ema2': 25, 'slip_atr_k': 0.13594050539607677, 'slip_spread_k': 0.5756740647770263, 'spread_hl_frac': 0.04832112454979512, 'bb_std_mult': 1.575218255089754, 'rsi_os': 12, 'rsi_ob': 70, 'vol_spike': 0.16622954552060942, 'adx_thresh': 8.778590224696801, 'atr_min_pct': 0.01908505008851839, 'atr_max_pct': 0.054243093080018345, 'tp_mult': 1.3055473112461131, 'tsl_mult': 0.16312850204186247, 'strategy': 'mean_reversion', 'time_stop': 150, 'use_sma': True, 'use_atr': False, 'use_adx': False, 'use_ema': False, 'use_spike': False, 'rsi_required': False, 'edge_k': 0.38640139428030207, 'edge_cap': 0.5356267005020529, 'bull_strategy': 'mean_reversion', 'bull_bb_std_mult': 2.486754815832704, 'bull_rsi_os': 11, 'bull_rsi_ob': 47, 'bull_adx_thresh': 15.26433988553843, 'bull_atr_min_pct': 0.014399685113691581, 'bull_atr_max_pct': 0.06824320508904802, 'bull_tp_mult': 2.0485576032959356, 'bull_tsl_mult': 0.9319163773620074, 'bull_time_stop': 133, 'bull_use_sma': True, 'bull_use_ema': False, 'bull_use_atr': True, 'bull_use_adx': False, 'bull_use_spike': True, 'bull_rsi_required': False, 'bear_strategy': 'breakout', 'bear_bb_std_mult': 3.033471295271898, 'bear_rsi_os': 6, 'bear_rsi_ob': 68, 'bear_adx_thresh': 21.009459370841363, 'bear_atr_min_pct': 0.011725943892296142, 'bear_atr_max_pct': 0.0398506804704839, 'bear_tp_mult': 2.6073354342515365, 'bear_tsl_mult': 0.919556662245032, 'bear_time_stop': 47, 'bear_use_sma': False, 'bear_use_ema': True, 'bear_use_atr': False, 'bear_use_adx': False, 'bear_use_spike': True, 'bear_rsi_required': False, 'sideways_strategy': 'breakout', 'sideways_bb_std_mult': 2.42826351938656, 'sideways_rsi_os': 49, 'sideways_rsi_ob': 79, 'sideways_adx_thresh': 23.221746895076713, 'sideways_atr_min_pct': 0.004311651547720244, 'sideways_atr_max_pct': 0.017407036506007112, 'sideways_tp_mult': 1.0106000908979345, 'sideways_tsl_mult': 0.6833248307270893, 'sideways_time_stop': 288, 'sideways_use_sma': False, 'sideways_use_ema': False, 'sideways_use_atr': False, 'sideways_use_adx': False, 'sideways_use_spike': False, 'sideways_rsi_required': False}.
[I 2025-08-29 20:59:51,648] Trial 722 finished with values: [-1000000000.0, 1000000000.0] and parameters: {'p_sma': 18, 'p_std': 58, 'p_atr': 23, 'p_adx': 13, 'rsi_period': 39, 'ema1': 26, 'ema2': 45, 'slip_atr_k': 0.11418352142627138, 'slip_spread_k': 0.13512913911633037, 'spread_hl_frac': 0.048112359631029514, 'bb_std_mult': 1.8675989263854944, 'rsi_os': 11, 'rsi_ob': 81, 'vol_spike': 0.2781857333025366, 'adx_thresh': 16.102431383683754, 'atr_min_pct': 0.024968281326481198, 'atr_max_pct': 0.10884650659203776, 'tp_mult': 1.2703571819482284, 'tsl_mult': 0.8240713825435972, 'strategy': 'mean_reversion', 'time_stop': 150, 'use_sma': True, 'use_atr': False, 'use_adx': False, 'use_ema': True, 'use_spike': False, 'rsi_required': False, 'edge_k': 1.1151456031379865, 'edge_cap': 0.3635858393892156, 'bull_strategy': 'mean_reversion', 'bull_bb_std_mult': 2.849056499810532, 'bull_rsi_os': 9, 'bull_rsi_ob': 76, 'bull_adx_thresh': 12.625160584129844, 'bull_atr_min_pct': 0.018142611861964687, 'bull_atr_max_pct': 0.08966735637877474, 'bull_tp_mult': 2.7344703151286076, 'bull_tsl_mult': 0.997520738820544, 'bull_time_stop': 20, 'bull_use_sma': True, 'bull_use_ema': False, 'bull_use_atr': True, 'bull_use_adx': False, 'bull_use_spike': True, 'bull_rsi_required': False, 'bear_strategy': 'breakout', 'bear_bb_std_mult': 3.050267852499107, 'bear_rsi_os': 8, 'bear_rsi_ob': 62, 'bear_adx_thresh': 16.418607130899343, 'bear_atr_min_pct': 0.019042876421451797, 'bear_atr_max_pct': 0.05597377927576336, 'bear_tp_mult': 2.651406349331476, 'bear_tsl_mult': 0.9162498414296543, 'bear_time_stop': 46, 'bear_use_sma': False, 'bear_use_ema': True, 'bear_use_atr': False, 'bear_use_adx': True, 'bear_use_spike': True, 'bear_rsi_required': False, 'sideways_strategy': 'breakout', 'sideways_bb_std_mult': 2.4330256617358508, 'sideways_rsi_os': 18, 'sideways_rsi_ob': 69, 'sideways_adx_thresh': 34.93873868297687, 'sideways_atr_min_pct': 0.02294637499685472, 'sideways_atr_max_pct': 0.02475806411994464, 'sideways_tp_mult': 1.010098024282331, 'sideways_tsl_mult': 0.9813687595746521, 'sideways_time_stop': 211, 'sideways_use_sma': False, 'sideways_use_ema': False, 'sideways_use_atr': True, 'sideways_use_adx': False, 'sideways_use_spike': False, 'sideways_rsi_required': False}.
[I 2025-08-29 20:59:52,033] Trial 723 finished with values: [-1000000000.0, 1000000000.0] and parameters: {'p_sma': 17, 'p_std': 60, 'p_atr': 23, 'p_adx': 8, 'rsi_period': 24, 'ema1': 15, 'ema2': 29, 'slip_atr_k': 0.009648525737403926, 'slip_spread_k': 0.14584229126915366, 'spread_hl_frac': 0.017874092360229833, 'bb_std_mult': 1.6299130523919358, 'rsi_os': 47, 'rsi_ob': 78, 'vol_spike': 0.18463367725505736, 'adx_thresh': 5.816528873251675, 'atr_min_pct': 0.021731533315725766, 'atr_max_pct': 0.07133730941511285, 'tp_mult': 1.3106680539976159, 'tsl_mult': 0.9226932809662959, 'strategy': 'mean_reversion', 'time_stop': 153, 'use_sma': True, 'use_atr': False, 'use_adx': False, 'use_ema': True, 'use_spike': False, 'rsi_required': False, 'edge_k': 0.3901201992788591, 'edge_cap': 0.3466043125237594, 'bull_strategy': 'mean_reversion', 'bull_bb_std_mult': 2.851138852612188, 'bull_rsi_os': 22, 'bull_rsi_ob': 77, 'bull_adx_thresh': 23.637663427064666, 'bull_atr_min_pct': 0.017202760702463637, 'bull_atr_max_pct': 0.03546365319442695, 'bull_tp_mult': 2.7363329464764528, 'bull_tsl_mult': 0.6986088247768061, 'bull_time_stop': 21, 'bull_use_sma': True, 'bull_use_ema': False, 'bull_use_atr': True, 'bull_use_adx': False, 'bull_use_spike': True, 'bull_rsi_required': False, 'bear_strategy': 'breakout', 'bear_bb_std_mult': 2.6769912545229833, 'bear_rsi_os': 42, 'bear_rsi_ob': 81, 'bear_adx_thresh': 16.50236654830549, 'bear_atr_min_pct': 0.009599828168785218, 'bear_atr_max_pct': 0.06374182640807151, 'bear_tp_mult': 2.5783755633692094, 'bear_tsl_mult': 0.9311205479153027, 'bear_time_stop': 47, 'bear_use_sma': False, 'bear_use_ema': True, 'bear_use_atr': True, 'bear_use_adx': True, 'bear_use_spike': True, 'bear_rsi_required': False, 'sideways_strategy': 'breakout', 'sideways_bb_std_mult': 2.432293231897435, 'sideways_rsi_os': 46, 'sideways_rsi_ob': 79, 'sideways_adx_thresh': 32.539911093356075, 'sideways_atr_min_pct': 0.016899800585085126, 'sideways_atr_max_pct': 0.023948452535371118, 'sideways_tp_mult': 1.090859298531147, 'sideways_tsl_mult': 0.7785383453655197, 'sideways_time_stop': 211, 'sideways_use_sma': False, 'sideways_use_ema': True, 'sideways_use_atr': False, 'sideways_use_adx': True, 'sideways_use_spike': False, 'sideways_rsi_required': False}.
[I 2025-08-29 21:00:21,166] Trial 724 finished with values: [-0.021587890609712113, 0.02151378240974537] and parameters: {'p_sma': 46, 'p_std': 60, 'p_atr': 21, 'p_adx': 13, 'rsi_period': 40, 'ema1': 28, 'ema2': 47, 'slip_atr_k': 0.17563545425049987, 'slip_spread_k': 0.09270800427432324, 'spread_hl_frac': 0.04840179285602171, 'bb_std_mult': 1.858771597448015, 'rsi_os': 10, 'rsi_ob': 86, 'vol_spike': 0.18387653514785712, 'adx_thresh': 8.716953523272238, 'atr_min_pct': 0.021640300293859695, 'atr_max_pct': 0.07078154583309977, 'tp_mult': 1.301444462333677, 'tsl_mult': 0.7078075042207608, 'strategy': 'breakout', 'time_stop': 285, 'use_sma': True, 'use_atr': True, 'use_adx': False, 'use_ema': False, 'use_spike': False, 'rsi_required': False, 'edge_k': 1.1532594238172709, 'edge_cap': 0.5384532000346124, 'bull_strategy': 'mean_reversion', 'bull_bb_std_mult': 1.2908756832451096, 'bull_rsi_os': 8, 'bull_rsi_ob': 75, 'bull_adx_thresh': 12.711698332727012, 'bull_atr_min_pct': 0.01722613037561469, 'bull_atr_max_pct': 0.08999490356615221, 'bull_tp_mult': 2.7292645074413735, 'bull_tsl_mult': 0.06936601780749241, 'bull_time_stop': 18, 'bull_use_sma': True, 'bull_use_ema': False, 'bull_use_atr': True, 'bull_use_adx': False, 'bull_use_spike': True, 'bull_rsi_required': True, 'bear_strategy': 'breakout', 'bear_bb_std_mult': 3.02031234038897, 'bear_rsi_os': 29, 'bear_rsi_ob': 68, 'bear_adx_thresh': 15.878813414714006, 'bear_atr_min_pct': 0.001138218566748353, 'bear_atr_max_pct': 0.09472214294396473, 'bear_tp_mult': 2.573608964015444, 'bear_tsl_mult': 0.6321805626577639, 'bear_time_stop': 49, 'bear_use_sma': True, 'bear_use_ema': True, 'bear_use_atr': True, 'bear_use_adx': False, 'bear_use_spike': True, 'bear_rsi_required': False, 'sideways_strategy': 'breakout', 'sideways_bb_std_mult': 2.4117216081380777, 'sideways_rsi_os': 45, 'sideways_rsi_ob': 77, 'sideways_adx_thresh': 15.636588050510426, 'sideways_atr_min_pct': 0.006329111463944857, 'sideways_atr_max_pct': 0.0962277406623683, 'sideways_tp_mult': 1.4137691085755941, 'sideways_tsl_mult': 0.7082379717793648, 'sideways_time_stop': 129, 'sideways_use_sma': False, 'sideways_use_ema': True, 'sideways_use_atr': False, 'sideways_use_adx': True, 'sideways_use_spike': False, 'sideways_rsi_required': False}.
[I 2025-08-29 21:00:22,094] Trial 725 finished with values: [-1000000000.0, 1000000000.0] and parameters: {'p_sma': 17, 'p_std': 57, 'p_atr': 21, 'p_adx': 25, 'rsi_period': 58, 'ema1': 22, 'ema2': 51, 'slip_atr_k': 0.19476339223115352, 'slip_spread_k': 0.19164088882655456, 'spread_hl_frac': 0.04913067950662762, 'bb_std_mult': 2.4846406191334216, 'rsi_os': 10, 'rsi_ob': 85, 'vol_spike': 0.1836661994126081, 'adx_thresh': 13.851914406555446, 'atr_min_pct': 0.018144407056406707, 'atr_max_pct': 0.0711477703628806, 'tp_mult': 1.4448216585391775, 'tsl_mult': 0.8346863320865712, 'strategy': 'breakout', 'time_stop': 172, 'use_sma': True, 'use_atr': True, 'use_adx': True, 'use_ema': True, 'use_spike': False, 'rsi_required': False, 'edge_k': 1.1547513557762776, 'edge_cap': 0.5785411587755138, 'bull_strategy': 'mean_reversion', 'bull_bb_std_mult': 2.904835538983323, 'bull_rsi_os': 32, 'bull_rsi_ob': 77, 'bull_adx_thresh': 5.016446513657112, 'bull_atr_min_pct': 0.017344923272717194, 'bull_atr_max_pct': 0.08975852910307805, 'bull_tp_mult': 2.166153513089717, 'bull_tsl_mult': 0.999104614477407, 'bull_time_stop': 46, 'bull_use_sma': True, 'bull_use_ema': True, 'bull_use_atr': True, 'bull_use_adx': False, 'bull_use_spike': True, 'bull_rsi_required': True, 'bear_strategy': 'breakout', 'bear_bb_std_mult': 3.42249093980685, 'bear_rsi_os': 28, 'bear_rsi_ob': 62, 'bear_adx_thresh': 21.67821739689362, 'bear_atr_min_pct': 0.006213987660402497, 'bear_atr_max_pct': 0.03642626017708996, 'bear_tp_mult': 2.546539270132434, 'bear_tsl_mult': 0.7054733901050425, 'bear_time_stop': 63, 'bear_use_sma': True, 'bear_use_ema': True, 'bear_use_atr': True, 'bear_use_adx': True, 'bear_use_spike': True, 'bear_rsi_required': False, 'sideways_strategy': 'mean_reversion', 'sideways_bb_std_mult': 3.2393650205816837, 'sideways_rsi_os': 39, 'sideways_rsi_ob': 77, 'sideways_adx_thresh': 15.545627363970096, 'sideways_atr_min_pct': 0.026178497486915763, 'sideways_atr_max_pct': 0.025100484060591167, 'sideways_tp_mult': 1.0568224666350776, 'sideways_tsl_mult': 0.7781548826749157, 'sideways_time_stop': 41, 'sideways_use_sma': False, 'sideways_use_ema': True, 'sideways_use_atr': False, 'sideways_use_adx': True, 'sideways_use_spike': False, 'sideways_rsi_required': False}.
[I 2025-08-29 21:00:22,306] Trial 727 finished with values: [-1000000000.0, 1000000000.0] and parameters: {'p_sma': 46, 'p_std': 57, 'p_atr': 25, 'p_adx': 13, 'rsi_period': 50, 'ema1': 28, 'ema2': 47, 'slip_atr_k': 0.008508848848513485, 'slip_spread_k': 0.18992030431206347, 'spread_hl_frac': 0.049159502982603756, 'bb_std_mult': 2.5779492802849737, 'rsi_os': 25, 'rsi_ob': 92, 'vol_spike': 0.1814588736280144, 'adx_thresh': 13.62461660472961, 'atr_min_pct': 0.0023944210941691108, 'atr_max_pct': 0.043463884789417116, 'tp_mult': 1.4376625014871829, 'tsl_mult': 0.20481248515682476, 'strategy': 'breakout', 'time_stop': 42, 'use_sma': True, 'use_atr': True, 'use_adx': True, 'use_ema': True, 'use_spike': False, 'rsi_required': False, 'edge_k': 1.157330242286864, 'edge_cap': 0.050171399748482115, 'bull_strategy': 'mean_reversion', 'bull_bb_std_mult': 2.9971822647954016, 'bull_rsi_os': 52, 'bull_rsi_ob': 74, 'bull_adx_thresh': 14.087814821337343, 'bull_atr_min_pct': 0.015558119538201238, 'bull_atr_max_pct': 0.12146917145636177, 'bull_tp_mult': 2.3676493601005397, 'bull_tsl_mult': 0.8546666845636189, 'bull_time_stop': 156, 'bull_use_sma': True, 'bull_use_ema': True, 'bull_use_atr': True, 'bull_use_adx': False, 'bull_use_spike': True, 'bull_rsi_required': True, 'bear_strategy': 'breakout', 'bear_bb_std_mult': 3.2861773678519186, 'bear_rsi_os': 28, 'bear_rsi_ob': 48, 'bear_adx_thresh': 21.720352197998253, 'bear_atr_min_pct': 0.015437343960389836, 'bear_atr_max_pct': 0.06584865160586076, 'bear_tp_mult': 2.305528447605635, 'bear_tsl_mult': 0.9578251727567154, 'bear_time_stop': 55, 'bear_use_sma': True, 'bear_use_ema': True, 'bear_use_atr': True, 'bear_use_adx': True, 'bear_use_spike': True, 'bear_rsi_required': False, 'sideways_strategy': 'mean_reversion', 'sideways_bb_std_mult': 3.2283699226813045, 'sideways_rsi_os': 47, 'sideways_rsi_ob': 77, 'sideways_adx_thresh': 10.22732209351304, 'sideways_atr_min_pct': 0.008425683369887436, 'sideways_atr_max_pct': 0.10493027083491957, 'sideways_tp_mult': 1.4060563638957593, 'sideways_tsl_mult': 0.7240527541774077, 'sideways_time_stop': 200, 'sideways_use_sma': False, 'sideways_use_ema': True, 'sideways_use_atr': False, 'sideways_use_adx': True, 'sideways_use_spike': False, 'sideways_rsi_required': False}.
[I 2025-08-29 21:00:22,421] Trial 726 finished with values: [-1000000000.0, 1000000000.0] and parameters: {'p_sma': 17, 'p_std': 57, 'p_atr': 10, 'p_adx': 13, 'rsi_period': 36, 'ema1': 28, 'ema2': 48, 'slip_atr_k': 0.009529523949195574, 'slip_spread_k': 0.08894756245998231, 'spread_hl_frac': 0.049979996083786976, 'bb_std_mult': 1.7572899841407115, 'rsi_os': 10, 'rsi_ob': 79, 'vol_spike': 0.18530798906995186, 'adx_thresh': 13.688785679315556, 'atr_min_pct': 0.021822954339449734, 'atr_max_pct': 0.07803827762223786, 'tp_mult': 1.4497910103936762, 'tsl_mult': 0.9239237758603716, 'strategy': 'breakout', 'time_stop': 184, 'use_sma': True, 'use_atr': True, 'use_adx': True, 'use_ema': True, 'use_spike': False, 'rsi_required': False, 'edge_k': 1.5435172528749679, 'edge_cap': 0.5721819149761073, 'bull_strategy': 'mean_reversion', 'bull_bb_std_mult': 2.917297960687846, 'bull_rsi_os': 32, 'bull_rsi_ob': 45, 'bull_adx_thresh': 5.020502494326095, 'bull_atr_min_pct': 0.024091180909699465, 'bull_atr_max_pct': 0.035952635712846896, 'bull_tp_mult': 1.6840487581153862, 'bull_tsl_mult': 0.731187618127737, 'bull_time_stop': 36, 'bull_use_sma': True, 'bull_use_ema': True, 'bull_use_atr': True, 'bull_use_adx': False, 'bull_use_spike': True, 'bull_rsi_required': True, 'bear_strategy': 'breakout', 'bear_bb_std_mult': 2.7376772778278227, 'bear_rsi_os': 28, 'bear_rsi_ob': 45, 'bear_adx_thresh': 21.80266495983845, 'bear_atr_min_pct': 0.00740945767238498, 'bear_atr_max_pct': 0.06487992481119725, 'bear_tp_mult': 2.572830256390535, 'bear_tsl_mult': 0.9536445489997978, 'bear_time_stop': 65, 'bear_use_sma': True, 'bear_use_ema': True, 'bear_use_atr': True, 'bear_use_adx': True, 'bear_use_spike': True, 'bear_rsi_required': False, 'sideways_strategy': 'mean_reversion', 'sideways_bb_std_mult': 2.2945342032021565, 'sideways_rsi_os': 41, 'sideways_rsi_ob': 77, 'sideways_adx_thresh': 33.9825206354011, 'sideways_atr_min_pct': 0.0021841441212567987, 'sideways_atr_max_pct': 0.07199009773748194, 'sideways_tp_mult': 1.0835332196905672, 'sideways_tsl_mult': 0.7759165112884356, 'sideways_time_stop': 200, 'sideways_use_sma': False, 'sideways_use_ema': True, 'sideways_use_atr': False, 'sideways_use_adx': True, 'sideways_use_spike': False, 'sideways_rsi_required': False}.
[I 2025-08-29 21:00:51,523] Trial 729 finished with values: [-1000000000.0, 1000000000.0] and parameters: {'p_sma': 20, 'p_std': 55, 'p_atr': 25, 'p_adx': 12, 'rsi_period': 36, 'ema1': 27, 'ema2': 48, 'slip_atr_k': 0.008629867401320712, 'slip_spread_k': 0.18480137937417668, 'spread_hl_frac': 0.021232171289926473, 'bb_std_mult': 1.7788944688766222, 'rsi_os': 8, 'rsi_ob': 76, 'vol_spike': 0.17191775129061782, 'adx_thresh': 12.484253740686249, 'atr_min_pct': 0.019612628818011766, 'atr_max_pct': 0.14047295057493536, 'tp_mult': 1.0115478390808197, 'tsl_mult': 0.8820202919737227, 'strategy': 'mean_reversion', 'time_stop': 60, 'use_sma': True, 'use_atr': False, 'use_adx': True, 'use_ema': True, 'use_spike': True, 'rsi_required': False, 'edge_k': 1.2020484518898171, 'edge_cap': 0.5667756086839562, 'bull_strategy': 'mean_reversion', 'bull_bb_std_mult': 0.9345618625911092, 'bull_rsi_os': 29, 'bull_rsi_ob': 69, 'bull_adx_thresh': 14.118582498870754, 'bull_atr_min_pct': 0.02542816137373081, 'bull_atr_max_pct': 0.14439132426718276, 'bull_tp_mult': 2.3485100578762212, 'bull_tsl_mult': 0.8589666532473039, 'bull_time_stop': 53, 'bull_use_sma': True, 'bull_use_ema': True, 'bull_use_atr': False, 'bull_use_adx': False, 'bull_use_spike': False, 'bull_rsi_required': False, 'bear_strategy': 'mean_reversion', 'bear_bb_std_mult': 2.725213313814152, 'bear_rsi_os': 26, 'bear_rsi_ob': 50, 'bear_adx_thresh': 10.802519428671651, 'bear_atr_min_pct': 0.0071302429508897916, 'bear_atr_max_pct': 0.055864687904177285, 'bear_tp_mult': 2.3119154991381072, 'bear_tsl_mult': 0.9983240132843825, 'bear_time_stop': 185, 'bear_use_sma': False, 'bear_use_ema': True, 'bear_use_atr': False, 'bear_use_adx': True, 'bear_use_spike': True, 'bear_rsi_required': True, 'sideways_strategy': 'mean_reversion', 'sideways_bb_std_mult': 2.2811854534098814, 'sideways_rsi_os': 47, 'sideways_rsi_ob': 81, 'sideways_adx_thresh': 34.1745377256039, 'sideways_atr_min_pct': 0.0026133543876361524, 'sideways_atr_max_pct': 0.021383927910829763, 'sideways_tp_mult': 1.6234441397407404, 'sideways_tsl_mult': 0.7457391429936207, 'sideways_time_stop': 101, 'sideways_use_sma': True, 'sideways_use_ema': False, 'sideways_use_atr': False, 'sideways_use_adx': False, 'sideways_use_spike': False, 'sideways_rsi_required': True}.
