[I 2025-08-29 20:41:41,659] Trial 557 finished with values: [-0.0013588799408267294, 0.003092006398782377] and parameters: {'p_sma': 17, 'p_std': 21, 'p_atr': 13, 'p_adx': 30, 'rsi_period': 81, 'ema1': 26, 'ema2': 46, 'slip_atr_k': 0.0005468143755628595, 'slip_spread_k': 0.024567793783354552, 'spread_hl_frac': 0.03576752464280532, 'bb_std_mult': 1.4903234728721935, 'rsi_os': 10, 'rsi_ob': 85, 'vol_spike': 0.17854448908111403, 'adx_thresh': 27.19019605055747, 'atr_min_pct': 0.008088487857619925, 'atr_max_pct': 0.13124024678974888, 'tp_mult': 1.41806487589318, 'tsl_mult': 0.7027431917881661, 'strategy': 'mean_reversion', 'time_stop': 170, 'use_sma': False, 'use_atr': True, 'use_adx': False, 'use_ema': True, 'use_spike': False, 'rsi_required': False, 'edge_k': 0.7543356209661828, 'edge_cap': 0.6069646625135201, 'bull_strategy': 'mean_reversion', 'bull_bb_std_mult': 2.894783018892751, 'bull_rsi_os': 17, 'bull_rsi_ob': 77, 'bull_adx_thresh': 14.539566874379224, 'bull_atr_min_pct': 0.014780790088602056, 'bull_atr_max_pct': 0.09336418798191909, 'bull_tp_mult': 2.1152090870063103, 'bull_tsl_mult': 0.37013787447861823, 'bull_time_stop': 38, 'bull_use_sma': False, 'bull_use_ema': False, 'bull_use_atr': True, 'bull_use_adx': False, 'bull_use_spike': True, 'bull_rsi_required': True, 'bear_strategy': 'breakout', 'bear_bb_std_mult': 2.726225438164493, 'bear_rsi_os': 33, 'bear_rsi_ob': 69, 'bear_adx_thresh': 26.188985100819348, 'bear_atr_min_pct': 0.0020660308582194295, 'bear_atr_max_pct': 0.05706487560347795, 'bear_tp_mult': 2.582601415676367, 'bear_tsl_mult': 0.09943965765603219, 'bear_time_stop': 293, 'bear_use_sma': False, 'bear_use_ema': True, 'bear_use_atr': False, 'bear_use_adx': True, 'bear_use_spike': False, 'bear_rsi_required': False, 'sideways_strategy': 'breakout', 'sideways_bb_std_mult': 3.137091642824133, 'sideways_rsi_os': 46, 'sideways_rsi_ob': 69, 'sideways_adx_thresh': 31.31966414758728, 'sideways_atr_min_pct': 0.017058072059756155, 'sideways_atr_max_pct': 0.0198514082216996, 'sideways_tp_mult': 2.581217395530893, 'sideways_tsl_mult': 0.3564525058789715, 'sideways_time_stop': 77, 'sideways_use_sma': False, 'sideways_use_ema': False, 'sideways_use_atr': False, 'sideways_use_adx': False, 'sideways_use_spike': False, 'sideways_rsi_required': False}.
[I 2025-08-29 20:41:42,041] Trial 556 finished with values: [-1000000000.0, 1000000000.0] and parameters: {'p_sma': 18, 'p_std': 57, 'p_atr': 24, 'p_adx': 30, 'rsi_period': 29, 'ema1': 26, 'ema2': 46, 'slip_atr_k': 0.014030506679457558, 'slip_spread_k': 0.13440093551679583, 'spread_hl_frac': 0.048277644624852095, 'bb_std_mult': 2.8409750216023477, 'rsi_os': 9, 'rsi_ob': 85, 'vol_spike': 0.15231595719826882, 'adx_thresh': 11.675781859421742, 'atr_min_pct': 0.017753869789808453, 'atr_max_pct': 0.02136975343172154, 'tp_mult': 1.4338984685246485, 'tsl_mult': 0.9617596613046842, 'strategy': 'mean_reversion', 'time_stop': 242, 'use_sma': False, 'use_atr': True, 'use_adx': False, 'use_ema': True, 'use_spike': False, 'rsi_required': False, 'edge_k': 0.8145375816048481, 'edge_cap': 0.6059190098504504, 'bull_strategy': 'mean_reversion', 'bull_bb_std_mult': 2.8868700606276128, 'bull_rsi_os': 17, 'bull_rsi_ob': 73, 'bull_adx_thresh': 27.256446597942716, 'bull_atr_min_pct': 0.014602857295490212, 'bull_atr_max_pct': 0.09419763480944983, 'bull_tp_mult': 2.994551783923015, 'bull_tsl_mult': 0.8440772879139236, 'bull_time_stop': 39, 'bull_use_sma': False, 'bull_use_ema': False, 'bull_use_atr': True, 'bull_use_adx': False, 'bull_use_spike': True, 'bull_rsi_required': True, 'bear_strategy': 'breakout', 'bear_bb_std_mult': 2.236872813666328, 'bear_rsi_os': 46, 'bear_rsi_ob': 69, 'bear_adx_thresh': 20.504974468750305, 'bear_atr_min_pct': 0.005933950548237062, 'bear_atr_max_pct': 0.053360365790543686, 'bear_tp_mult': 2.6025332181761245, 'bear_tsl_mult': 0.12138722960100762, 'bear_time_stop': 34, 'bear_use_sma': False, 'bear_use_ema': True, 'bear_use_atr': False, 'bear_use_adx': True, 'bear_use_spike': False, 'bear_rsi_required': False, 'sideways_strategy': 'breakout', 'sideways_bb_std_mult': 2.396829577070636, 'sideways_rsi_os': 20, 'sideways_rsi_ob': 78, 'sideways_adx_thresh': 16.308524420696838, 'sideways_atr_min_pct': 0.0049321140791302115, 'sideways_atr_max_pct': 0.020760860071617416, 'sideways_tp_mult': 1.0962232564489125, 'sideways_tsl_mult': 0.8134472674483049, 'sideways_time_stop': 79, 'sideways_use_sma': False, 'sideways_use_ema': False, 'sideways_use_atr': False, 'sideways_use_adx': False, 'sideways_use_spike': False, 'sideways_rsi_required': False}.
[I 2025-08-29 20:41:44,592] Trial 560 finished with values: [-1000000000.0, 1000000000.0] and parameters: {'p_sma': 17, 'p_std': 41, 'p_atr': 24, 'p_adx': 28, 'rsi_period': 39, 'ema1': 26, 'ema2': 23, 'slip_atr_k': 0.014607811195235923, 'slip_spread_k': 0.15098869750108296, 'spread_hl_frac': 0.047974610602068715, 'bb_std_mult': 1.4934961103560827, 'rsi_os': 10, 'rsi_ob': 85, 'vol_spike': 0.06026397461371287, 'adx_thresh': 9.276988916672346, 'atr_min_pct': 0.01895874926041448, 'atr_max_pct': 0.032521506595688025, 'tp_mult': 1.4331640711984264, 'tsl_mult': 0.014975726581642312, 'strategy': 'mean_reversion', 'time_stop': 138, 'use_sma': True, 'use_atr': False, 'use_adx': False, 'use_ema': True, 'use_spike': False, 'rsi_required': False, 'edge_k': 1.0139385675476102, 'edge_cap': 0.5836720315829868, 'bull_strategy': 'mean_reversion', 'bull_bb_std_mult': 3.0953839717177583, 'bull_rsi_os': 19, 'bull_rsi_ob': 80, 'bull_adx_thresh': 14.546466164919025, 'bull_atr_min_pct': 0.011952311523703012, 'bull_atr_max_pct': 0.11778955607882761, 'bull_tp_mult': 2.019411110984852, 'bull_tsl_mult': 0.8711072617638517, 'bull_time_stop': 22, 'bull_use_sma': True, 'bull_use_ema': False, 'bull_use_atr': False, 'bull_use_adx': False, 'bull_use_spike': True, 'bull_rsi_required': False, 'bear_strategy': 'breakout', 'bear_bb_std_mult': 2.3894976510146497, 'bear_rsi_os': 33, 'bear_rsi_ob': 69, 'bear_adx_thresh': 10.969999888451845, 'bear_atr_min_pct': 0.0057834754127094115, 'bear_atr_max_pct': 0.054119313764543334, 'bear_tp_mult': 2.8780714945630144, 'bear_tsl_mult': 0.9091414968076283, 'bear_time_stop': 36, 'bear_use_sma': False, 'bear_use_ema': True, 'bear_use_atr': False, 'bear_use_adx': True, 'bear_use_spike': True, 'bear_rsi_required': False, 'sideways_strategy': 'breakout', 'sideways_bb_std_mult': 2.3991663071835787, 'sideways_rsi_os': 20, 'sideways_rsi_ob': 61, 'sideways_adx_thresh': 31.143288973002196, 'sideways_atr_min_pct': 0.015528889797034385, 'sideways_atr_max_pct': 0.018939737260785423, 'sideways_tp_mult': 1.8267558310331404, 'sideways_tsl_mult': 0.8521038677358679, 'sideways_time_stop': 196, 'sideways_use_sma': False, 'sideways_use_ema': False, 'sideways_use_atr': True, 'sideways_use_adx': False, 'sideways_use_spike': False, 'sideways_rsi_required': False}.
[I 2025-08-29 20:41:52,493] Trial 561 finished with values: [-0.020734458433501635, 0.020735097729308524] and parameters: {'p_sma': 58, 'p_std': 57, 'p_atr': 18, 'p_adx': 13, 'rsi_period': 84, 'ema1': 27, 'ema2': 45, 'slip_atr_k': 0.15064679658315797, 'slip_spread_k': 0.23925497371935428, 'spread_hl_frac': 0.04831144682290034, 'bb_std_mult': 1.6324880144985991, 'rsi_os': 9, 'rsi_ob': 76, 'vol_spike': 0.23529153723947757, 'adx_thresh': 12.207055405304196, 'atr_min_pct': 0.019227412475063217, 'atr_max_pct': 0.030778635241851704, 'tp_mult': 2.9923600830638835, 'tsl_mult': 0.9578959277318242, 'strategy': 'breakout', 'time_stop': 219, 'use_sma': True, 'use_atr': True, 'use_adx': False, 'use_ema': False, 'use_spike': False, 'rsi_required': False, 'edge_k': 0.5295584807928885, 'edge_cap': 0.572247972977329, 'bull_strategy': 'mean_reversion', 'bull_bb_std_mult': 2.1812781009396764, 'bull_rsi_os': 19, 'bull_rsi_ob': 72, 'bull_adx_thresh': 7.989526020478891, 'bull_atr_min_pct': 0.010119319328864004, 'bull_atr_max_pct': 0.09686021822578879, 'bull_tp_mult': 2.9695487466920465, 'bull_tsl_mult': 0.9041434152697574, 'bull_time_stop': 246, 'bull_use_sma': True, 'bull_use_ema': False, 'bull_use_atr': True, 'bull_use_adx': False, 'bull_use_spike': True, 'bull_rsi_required': True, 'bear_strategy': 'breakout', 'bear_bb_std_mult': 1.5973216575700282, 'bear_rsi_os': 39, 'bear_rsi_ob': 69, 'bear_adx_thresh': 12.215543664314785, 'bear_atr_min_pct': 0.004507542304492045, 'bear_atr_max_pct': 0.017296922735540413, 'bear_tp_mult': 2.2864405386859974, 'bear_tsl_mult': 0.2744445969602669, 'bear_time_stop': 58, 'bear_use_sma': False, 'bear_use_ema': True, 'bear_use_atr': False, 'bear_use_adx': False, 'bear_use_spike': True, 'bear_rsi_required': False, 'sideways_strategy': 'breakout', 'sideways_bb_std_mult': 2.405510841088598, 'sideways_rsi_os': 48, 'sideways_rsi_ob': 79, 'sideways_adx_thresh': 33.0425078444258, 'sideways_atr_min_pct': 0.008796354281204549, 'sideways_atr_max_pct': 0.013054128085198173, 'sideways_tp_mult': 1.826142721784073, 'sideways_tsl_mult': 0.39074673566241097, 'sideways_time_stop': 191, 'sideways_use_sma': False, 'sideways_use_ema': False, 'sideways_use_atr': False, 'sideways_use_adx': False, 'sideways_use_spike': False, 'sideways_rsi_required': False}.
[I 2025-08-29 20:42:12,573] Trial 562 finished with values: [-1000000000.0, 1000000000.0] and parameters: {'p_sma': 19, 'p_std': 57, 'p_atr': 18, 'p_adx': 23, 'rsi_period': 29, 'ema1': 9, 'ema2': 23, 'slip_atr_k': 0.0001734533861157822, 'slip_spread_k': 0.1508447766869864, 'spread_hl_frac': 0.013620084083262126, 'bb_std_mult': 1.6301944296750621, 'rsi_os': 7, 'rsi_ob': 50, 'vol_spike': 0.20075019700052824, 'adx_thresh': 20.475394915427582, 'atr_min_pct': 0.0189876370249971, 'atr_max_pct': 0.09591077015322534, 'tp_mult': 1.2859930975365752, 'tsl_mult': 0.025054721139473546, 'strategy': 'breakout', 'time_stop': 16, 'use_sma': True, 'use_atr': False, 'use_adx': False, 'use_ema': False, 'use_spike': True, 'rsi_required': False, 'edge_k': 0.5455482371322068, 'edge_cap': 0.5868943223227686, 'bull_strategy': 'mean_reversion', 'bull_bb_std_mult': 2.198559014208023, 'bull_rsi_os': 19, 'bull_rsi_ob': 80, 'bull_adx_thresh': 26.45941992849915, 'bull_atr_min_pct': 0.015815851797934453, 'bull_atr_max_pct': 0.09797796604875816, 'bull_tp_mult': 2.7005790532988243, 'bull_tsl_mult': 0.9017308714343487, 'bull_time_stop': 46, 'bull_use_sma': True, 'bull_use_ema': True, 'bull_use_atr': False, 'bull_use_adx': False, 'bull_use_spike': True, 'bull_rsi_required': False, 'bear_strategy': 'mean_reversion', 'bear_bb_std_mult': 2.6238913491296887, 'bear_rsi_os': 29, 'bear_rsi_ob': 65, 'bear_adx_thresh': 10.219938120470983, 'bear_atr_min_pct': 0.016164853123869744, 'bear_atr_max_pct': 0.05404152851956333, 'bear_tp_mult': 2.6750068728512217, 'bear_tsl_mult': 0.9061021908964008, 'bear_time_stop': 37, 'bear_use_sma': False, 'bear_use_ema': True, 'bear_use_atr': False, 'bear_use_adx': False, 'bear_use_spike': True, 'bear_rsi_required': True, 'sideways_strategy': 'mean_reversion', 'sideways_bb_std_mult': 3.593382025371743, 'sideways_rsi_os': 48, 'sideways_rsi_ob': 81, 'sideways_adx_thresh': 32.01741555915268, 'sideways_atr_min_pct': 0.015372515444826599, 'sideways_atr_max_pct': 0.02834014591838668, 'sideways_tp_mult': 1.8235055904142083, 'sideways_tsl_mult': 0.7453775578475799, 'sideways_time_stop': 189, 'sideways_use_sma': False, 'sideways_use_ema': False, 'sideways_use_atr': False, 'sideways_use_adx': False, 'sideways_use_spike': False, 'sideways_rsi_required': True}.
[I 2025-08-29 20:42:14,126] Trial 563 finished with values: [-1000000000.0, 1000000000.0] and parameters: {'p_sma': 21, 'p_std': 57, 'p_atr': 9, 'p_adx': 10, 'rsi_period': 65, 'ema1': 27, 'ema2': 45, 'slip_atr_k': 0.07213176119812162, 'slip_spread_k': 0.17588270800683856, 'spread_hl_frac': 0.01984374598344022, 'bb_std_mult': 1.6373163838120133, 'rsi_os': 7, 'rsi_ob': 83, 'vol_spike': 0.28865507032178994, 'adx_thresh': 22.26488696742263, 'atr_min_pct': 0.01920299316668619, 'atr_max_pct': 0.14161208573586595, 'tp_mult': 1.301385669792689, 'tsl_mult': 0.8406685551171642, 'strategy': 'breakout', 'time_stop': 142, 'use_sma': True, 'use_atr': False, 'use_adx': False, 'use_ema': False, 'use_spike': True, 'rsi_required': False, 'edge_k': 1.8866306975677047, 'edge_cap': 0.5884469398927655, 'bull_strategy': 'breakout', 'bull_bb_std_mult': 2.985081531342, 'bull_rsi_os': 19, 'bull_rsi_ob': 63, 'bull_adx_thresh': 13.472971820449274, 'bull_atr_min_pct': 0.01968806822020362, 'bull_atr_max_pct': 0.11997367640145823, 'bull_tp_mult': 2.692260767807507, 'bull_tsl_mult': 0.9048588128815096, 'bull_time_stop': 145, 'bull_use_sma': True, 'bull_use_ema': True, 'bull_use_atr': False, 'bull_use_adx': False, 'bull_use_spike': True, 'bull_rsi_required': False, 'bear_strategy': 'mean_reversion', 'bear_bb_std_mult': 2.642826693777538, 'bear_rsi_os': 28, 'bear_rsi_ob': 65, 'bear_adx_thresh': 27.433017626336632, 'bear_atr_min_pct': 0.007138682567447578, 'bear_atr_max_pct': 0.05047055327954658, 'bear_tp_mult': 2.676575604781922, 'bear_tsl_mult': 0.794716498971358, 'bear_time_stop': 162, 'bear_use_sma': False, 'bear_use_ema': True, 'bear_use_atr': False, 'bear_use_adx': False, 'bear_use_spike': True, 'bear_rsi_required': True, 'sideways_strategy': 'mean_reversion', 'sideways_bb_std_mult': 2.438763533351602, 'sideways_rsi_os': 48, 'sideways_rsi_ob': 61, 'sideways_adx_thresh': 27.752216009768457, 'sideways_atr_min_pct': 0.0055490653449715484, 'sideways_atr_max_pct': 0.014383815492959862, 'sideways_tp_mult': 1.1783460006823956, 'sideways_tsl_mult': 0.7503097050221013, 'sideways_time_stop': 284, 'sideways_use_sma': False, 'sideways_use_ema': False, 'sideways_use_atr': True, 'sideways_use_adx': False, 'sideways_use_spike': True, 'sideways_rsi_required': True}.
[I 2025-08-29 20:42:17,061] Trial 564 finished with values: [-1000000000.0, 1000000000.0] and parameters: {'p_sma': 24, 'p_std': 7, 'p_atr': 15, 'p_adx': 14, 'rsi_period': 84, 'ema1': 10, 'ema2': 25, 'slip_atr_k': 0.0001294952184121012, 'slip_spread_k': 0.2509510666171988, 'spread_hl_frac': 0.017535847659893376, 'bb_std_mult': 1.6358648499930315, 'rsi_os': 7, 'rsi_ob': 47, 'vol_spike': 0.22924231324539993, 'adx_thresh': 14.188727098822024, 'atr_min_pct': 0.01954763605987876, 'atr_max_pct': 0.11190485800449923, 'tp_mult': 1.2875988391638995, 'tsl_mult': 0.8474147286471811, 'strategy': 'breakout', 'time_stop': 195, 'use_sma': True, 'use_atr': False, 'use_adx': False, 'use_ema': False, 'use_spike': True, 'rsi_required': True, 'edge_k': 1.1760160798123274, 'edge_cap': 0.5905958385816837, 'bull_strategy': 'breakout', 'bull_bb_std_mult': 2.211122867285872, 'bull_rsi_os': 19, 'bull_rsi_ob': 87, 'bull_adx_thresh': 13.567878535928745, 'bull_atr_min_pct': 0.016099435832749108, 'bull_atr_max_pct': 0.09805286119585607, 'bull_tp_mult': 1.0126773984288935, 'bull_tsl_mult': 0.9092605124175639, 'bull_time_stop': 228, 'bull_use_sma': True, 'bull_use_ema': True, 'bull_use_atr': True, 'bull_use_adx': True, 'bull_use_spike': True, 'bull_rsi_required': False, 'bear_strategy': 'mean_reversion', 'bear_bb_std_mult': 1.5814350812413873, 'bear_rsi_os': 39, 'bear_rsi_ob': 65, 'bear_adx_thresh': 10.320382461968784, 'bear_atr_min_pct': 0.004801025584038098, 'bear_atr_max_pct': 0.01909361406579644, 'bear_tp_mult': 2.6895799049218003, 'bear_tsl_mult': 0.7212567972187288, 'bear_time_stop': 58, 'bear_use_sma': True, 'bear_use_ema': False, 'bear_use_atr': False, 'bear_use_adx': False, 'bear_use_spike': True, 'bear_rsi_required': True, 'sideways_strategy': 'mean_reversion', 'sideways_bb_std_mult': 2.4456432006040316, 'sideways_rsi_os': 48, 'sideways_rsi_ob': 81, 'sideways_adx_thresh': 33.12687293880328, 'sideways_atr_min_pct': 0.02892766526964025, 'sideways_atr_max_pct': 0.013822700639364615, 'sideways_tp_mult': 1.0399341716101866, 'sideways_tsl_mult': 0.9639756411763302, 'sideways_time_stop': 189, 'sideways_use_sma': False, 'sideways_use_ema': False, 'sideways_use_atr': False, 'sideways_use_adx': True, 'sideways_use_spike': True, 'sideways_rsi_required': True}.
[I 2025-08-29 20:42:22,982] Trial 565 finished with values: [-1000000000.0, 1000000000.0] and parameters: {'p_sma': 19, 'p_std': 60, 'p_atr': 16, 'p_adx': 26, 'rsi_period': 37, 'ema1': 10, 'ema2': 27, 'slip_atr_k': 9.974256189926333e-05, 'slip_spread_k': 0.18333119016505586, 'spread_hl_frac': 0.04914823140528291, 'bb_std_mult': 2.6195769234181836, 'rsi_os': 12, 'rsi_ob': 82, 'vol_spike': 0.1990892177461369, 'adx_thresh': 13.998548069590573, 'atr_min_pct': 0.0207249971579443, 'atr_max_pct': 0.027740480377051468, 'tp_mult': 1.293011608401596, 'tsl_mult': 0.8396031899837495, 'strategy': 'breakout', 'time_stop': 158, 'use_sma': True, 'use_atr': False, 'use_adx': False, 'use_ema': False, 'use_spike': True, 'rsi_required': True, 'edge_k': 0.1243944257541838, 'edge_cap': 0.5872318710906401, 'bull_strategy': 'breakout', 'bull_bb_std_mult': 2.999879458763355, 'bull_rsi_os': 18, 'bull_rsi_ob': 71, 'bull_adx_thresh': 26.18180471338018, 'bull_atr_min_pct': 0.01701097088834426, 'bull_atr_max_pct': 0.10110067930620878, 'bull_tp_mult': 1.9678710132633717, 'bull_tsl_mult': 0.4794678291431449, 'bull_time_stop': 29, 'bull_use_sma': True, 'bull_use_ema': True, 'bull_use_atr': True, 'bull_use_adx': True, 'bull_use_spike': True, 'bull_rsi_required': False, 'bear_strategy': 'mean_reversion', 'bear_bb_std_mult': 2.6144329092646306, 'bear_rsi_os': 28, 'bear_rsi_ob': 73, 'bear_adx_thresh': 21.988792445654543, 'bear_atr_min_pct': 0.00044167688536239473, 'bear_atr_max_pct': 0.04870092413371133, 'bear_tp_mult': 2.682109927931448, 'bear_tsl_mult': 0.7292187772982137, 'bear_time_stop': 237, 'bear_use_sma': True, 'bear_use_ema': False, 'bear_use_atr': False, 'bear_use_adx': False, 'bear_use_spike': True, 'bear_rsi_required': True, 'sideways_strategy': 'mean_reversion', 'sideways_bb_std_mult': 2.086570825168571, 'sideways_rsi_os': 52, 'sideways_rsi_ob': 66, 'sideways_adx_thresh': 32.00072164473837, 'sideways_atr_min_pct': 0.0036162666485554896, 'sideways_atr_max_pct': 0.07145805330292633, 'sideways_tp_mult': 2.8967708373628414, 'sideways_tsl_mult': 0.7413332432610898, 'sideways_time_stop': 221, 'sideways_use_sma': True, 'sideways_use_ema': False, 'sideways_use_atr': False, 'sideways_use_adx': True, 'sideways_use_spike': True, 'sideways_rsi_required': True}.
[I 2025-08-29 20:42:50,546] Trial 566 finished with values: [-1000000000.0, 1000000000.0] and parameters: {'p_sma': 24, 'p_std': 29, 'p_atr': 28, 'p_adx': 10, 'rsi_period': 65, 'ema1': 27, 'ema2': 47, 'slip_atr_k': 0.0005101750997295441, 'slip_spread_k': 0.18300375259663335, 'spread_hl_frac': 0.010912063427192784, 'bb_std_mult': 1.9908202907782921, 'rsi_os': 24, 'rsi_ob': 83, 'vol_spike': 0.29062615632517125, 'adx_thresh': 19.576254904076574, 'atr_min_pct': 0.0052103880941663985, 'atr_max_pct': 0.0268589277688118, 'tp_mult': 1.3152349864441983, 'tsl_mult': 0.8518101010681405, 'strategy': 'mean_reversion', 'time_stop': 159, 'use_sma': True, 'use_atr': False, 'use_adx': True, 'use_ema': True, 'use_spike': True, 'rsi_required': True, 'edge_k': 0.11561792646994107, 'edge_cap': 0.5700116174636736, 'bull_strategy': 'breakout', 'bull_bb_std_mult': 3.470186462597267, 'bull_rsi_os': 18, 'bull_rsi_ob': 71, 'bull_adx_thresh': 13.53362987240943, 'bull_atr_min_pct': 0.017081311668193197, 'bull_atr_max_pct': 0.12267063123516635, 'bull_tp_mult': 1.945229662897907, 'bull_tsl_mult': 0.3286473387087657, 'bull_time_stop': 31, 'bull_use_sma': True, 'bull_use_ema': True, 'bull_use_atr': True, 'bull_use_adx': True, 'bull_use_spike': False, 'bull_rsi_required': False, 'bear_strategy': 'mean_reversion', 'bear_bb_std_mult': 2.6703525325585584, 'bear_rsi_os': 37, 'bear_rsi_ob': 66, 'bear_adx_thresh': 21.86849194540841, 'bear_atr_min_pct': 0.007067858051650557, 'bear_atr_max_pct': 0.04197575117830885, 'bear_tp_mult': 2.6982767515986437, 'bear_tsl_mult': 0.04801184497540889, 'bear_time_stop': 161, 'bear_use_sma': True, 'bear_use_ema': False, 'bear_use_atr': False, 'bear_use_adx': True, 'bear_use_spike': True, 'bear_rsi_required': True, 'sideways_strategy': 'mean_reversion', 'sideways_bb_std_mult': 2.097800159024163, 'sideways_rsi_os': 52, 'sideways_rsi_ob': 77, 'sideways_adx_thresh': 27.540288913056536, 'sideways_atr_min_pct': 0.029109425148967263, 'sideways_atr_max_pct': 0.07395546764547853, 'sideways_tp_mult': 1.0352030570225796, 'sideways_tsl_mult': 0.7292948910458091, 'sideways_time_stop': 221, 'sideways_use_sma': True, 'sideways_use_ema': False, 'sideways_use_atr': True, 'sideways_use_adx': True, 'sideways_use_spike': True, 'sideways_rsi_required': True}.
