[I 2025-08-29 20:22:25,580] Trial 379 finished with values: [-1000000000.0, 1000000000.0] and parameters: {'p_sma': 21, 'p_std': 56, 'p_atr': 8, 'p_adx': 13, 'rsi_period': 41, 'ema1': 24, 'ema2': 35, 'slip_atr_k': 0.005667670630584608, 'slip_spread_k': 0.17163878919215095, 'spread_hl_frac': 0.04888820044463012, 'bb_std_mult': 1.6465606270851971, 'rsi_os': 11, 'rsi_ob': 83, 'vol_spike': 0.13009587268954043, 'adx_thresh': 14.332049354635497, 'atr_min_pct': 0.020257328682459264, 'atr_max_pct': 0.02517736282206466, 'tp_mult': 1.3512814284451193, 'tsl_mult': 0.8886032549548674, 'strategy': 'mean_reversion', 'time_stop': 162, 'use_sma': True, 'use_atr': False, 'use_adx': False, 'use_ema': True, 'use_spike': False, 'rsi_required': False, 'edge_k': 0.9381810739832324, 'edge_cap': 0.6081305115796966, 'bull_strategy': 'mean_reversion', 'bull_bb_std_mult': 3.064940035341016, 'bull_rsi_os': 15, 'bull_rsi_ob': 75, 'bull_adx_thresh': 13.841653884535353, 'bull_atr_min_pct': 0.005846642042482144, 'bull_atr_max_pct': 0.0949915936533392, 'bull_tp_mult': 2.726464076350336, 'bull_tsl_mult': 0.878912783883043, 'bull_time_stop': 37, 'bull_use_sma': True, 'bull_use_ema': False, 'bull_use_atr': True, 'bull_use_adx': False, 'bull_use_spike': True, 'bull_rsi_required': False, 'bear_strategy': 'breakout', 'bear_bb_std_mult': 2.663856475344055, 'bear_rsi_os': 7, 'bear_rsi_ob': 84, 'bear_adx_thresh': 20.007597196975397, 'bear_atr_min_pct': 0.029870961817830742, 'bear_atr_max_pct': 0.0598079411843108, 'bear_tp_mult': 1.5742051333324651, 'bear_tsl_mult': 0.8999608830674668, 'bear_time_stop': 63, 'bear_use_sma': False, 'bear_use_ema': True, 'bear_use_atr': False, 'bear_use_adx': True, 'bear_use_spike': True, 'bear_rsi_required': False, 'sideways_strategy': 'breakout', 'sideways_bb_std_mult': 0.7138085951181663, 'sideways_rsi_os': 52, 'sideways_rsi_ob': 74, 'sideways_adx_thresh': 32.50226248927227, 'sideways_atr_min_pct': 0.02954502937737411, 'sideways_atr_max_pct': 0.09513630360957254, 'sideways_tp_mult': 1.0126122675547278, 'sideways_tsl_mult': 0.7239339969027446, 'sideways_time_stop': 58, 'sideways_use_sma': False, 'sideways_use_ema': False, 'sideways_use_atr': False, 'sideways_use_adx': False, 'sideways_use_spike': False, 'sideways_rsi_required': False}.
[I 2025-08-29 20:22:25,868] Trial 378 finished with values: [-1000000000.0, 1000000000.0] and parameters: {'p_sma': 21, 'p_std': 7, 'p_atr': 8, 'p_adx': 13, 'rsi_period': 41, 'ema1': 24, 'ema2': 15, 'slip_atr_k': 0.0002696620968725918, 'slip_spread_k': 0.800846775663387, 'spread_hl_frac': 0.04878082394131554, 'bb_std_mult': 1.760542475958501, 'rsi_os': 12, 'rsi_ob': 83, 'vol_spike': 0.22751251616526968, 'adx_thresh': 14.371125450917798, 'atr_min_pct': 0.019974826898306722, 'atr_max_pct': 0.02285941852211023, 'tp_mult': 1.3786051945886963, 'tsl_mult': 0.8873880122942572, 'strategy': 'mean_reversion', 'time_stop': 169, 'use_sma': True, 'use_atr': False, 'use_adx': False, 'use_ema': True, 'use_spike': False, 'rsi_required': False, 'edge_k': 0.9824220917729432, 'edge_cap': 0.6118360022008538, 'bull_strategy': 'mean_reversion', 'bull_bb_std_mult': 3.0763514225531035, 'bull_rsi_os': 13, 'bull_rsi_ob': 74, 'bull_adx_thresh': 14.011579401548097, 'bull_atr_min_pct': 0.008505566306729672, 'bull_atr_max_pct': 0.10163237409995853, 'bull_tp_mult': 2.8238931896145605, 'bull_tsl_mult': 0.8767521600766699, 'bull_time_stop': 31, 'bull_use_sma': True, 'bull_use_ema': False, 'bull_use_atr': True, 'bull_use_adx': False, 'bull_use_spike': True, 'bull_rsi_required': False, 'bear_strategy': 'breakout', 'bear_bb_std_mult': 2.005816412278128, 'bear_rsi_os': 7, 'bear_rsi_ob': 68, 'bear_adx_thresh': 21.39259012890633, 'bear_atr_min_pct': 0.025844091359644175, 'bear_atr_max_pct': 0.052785732639499254, 'bear_tp_mult': 1.5840069334235696, 'bear_tsl_mult': 0.8640377868049994, 'bear_time_stop': 54, 'bear_use_sma': False, 'bear_use_ema': True, 'bear_use_atr': False, 'bear_use_adx': True, 'bear_use_spike': True, 'bear_rsi_required': False, 'sideways_strategy': 'breakout', 'sideways_bb_std_mult': 0.7236700510663394, 'sideways_rsi_os': 39, 'sideways_rsi_ob': 79, 'sideways_adx_thresh': 32.508537011235305, 'sideways_atr_min_pct': 0.029390657883927057, 'sideways_atr_max_pct': 0.022325366894833137, 'sideways_tp_mult': 1.7402344785211992, 'sideways_tsl_mult': 0.7251668790728069, 'sideways_time_stop': 179, 'sideways_use_sma': False, 'sideways_use_ema': False, 'sideways_use_atr': False, 'sideways_use_adx': False, 'sideways_use_spike': False, 'sideways_rsi_required': False}.
[I 2025-08-29 20:22:26,131] Trial 380 finished with values: [-1000000000.0, 1000000000.0] and parameters: {'p_sma': 21, 'p_std': 56, 'p_atr': 8, 'p_adx': 13, 'rsi_period': 80, 'ema1': 27, 'ema2': 23, 'slip_atr_k': 0.006231702712090378, 'slip_spread_k': 0.16269604288398218, 'spread_hl_frac': 0.04905982431579214, 'bb_std_mult': 1.7738969489851695, 'rsi_os': 12, 'rsi_ob': 84, 'vol_spike': 0.1805375139793568, 'adx_thresh': 14.573907644309136, 'atr_min_pct': 0.006501011073824236, 'atr_max_pct': 0.02614417443592446, 'tp_mult': 1.3596478395432516, 'tsl_mult': 0.920303504839838, 'strategy': 'mean_reversion', 'time_stop': 32, 'use_sma': True, 'use_atr': False, 'use_adx': False, 'use_ema': True, 'use_spike': False, 'rsi_required': False, 'edge_k': 0.987291998040789, 'edge_cap': 0.6085133097915681, 'bull_strategy': 'mean_reversion', 'bull_bb_std_mult': 2.9751072666035068, 'bull_rsi_os': 16, 'bull_rsi_ob': 72, 'bull_adx_thresh': 14.10293973281841, 'bull_atr_min_pct': 0.016015567716268244, 'bull_atr_max_pct': 0.10177031974064982, 'bull_tp_mult': 2.671108949499599, 'bull_tsl_mult': 0.878758766946064, 'bull_time_stop': 28, 'bull_use_sma': True, 'bull_use_ema': False, 'bull_use_atr': True, 'bull_use_adx': False, 'bull_use_spike': True, 'bull_rsi_required': False, 'bear_strategy': 'breakout', 'bear_bb_std_mult': 2.6492057467978416, 'bear_rsi_os': 29, 'bear_rsi_ob': 66, 'bear_adx_thresh': 21.269328224745376, 'bear_atr_min_pct': 0.026015834566189017, 'bear_atr_max_pct': 0.047895852067466084, 'bear_tp_mult': 2.6400144746067626, 'bear_tsl_mult': 0.9018992167846148, 'bear_time_stop': 62, 'bear_use_sma': False, 'bear_use_ema': True, 'bear_use_atr': False, 'bear_use_adx': True, 'bear_use_spike': True, 'bear_rsi_required': False, 'sideways_strategy': 'breakout', 'sideways_bb_std_mult': 2.8094769284355987, 'sideways_rsi_os': 51, 'sideways_rsi_ob': 74, 'sideways_adx_thresh': 9.251329243688737, 'sideways_atr_min_pct': 0.028420700323583528, 'sideways_atr_max_pct': 0.1496432342856709, 'sideways_tp_mult': 1.0822769465520683, 'sideways_tsl_mult': 0.7183283742294951, 'sideways_time_stop': 180, 'sideways_use_sma': False, 'sideways_use_ema': False, 'sideways_use_atr': False, 'sideways_use_adx': False, 'sideways_use_spike': False, 'sideways_rsi_required': False}.
[I 2025-08-29 20:22:26,141] Trial 381 finished with values: [-1000000000.0, 1000000000.0] and parameters: {'p_sma': 21, 'p_std': 56, 'p_atr': 26, 'p_adx': 13, 'rsi_period': 80, 'ema1': 27, 'ema2': 36, 'slip_atr_k': 0.004326224065887025, 'slip_spread_k': 0.9165189954942632, 'spread_hl_frac': 0.049049821341639446, 'bb_std_mult': 1.7782087657972259, 'rsi_os': 12, 'rsi_ob': 84, 'vol_spike': 0.04531922282712725, 'adx_thresh': 11.72295567159878, 'atr_min_pct': 0.018742429542745846, 'atr_max_pct': 0.025279937590956605, 'tp_mult': 1.3604607441682266, 'tsl_mult': 0.9212383530561283, 'strategy': 'mean_reversion', 'time_stop': 257, 'use_sma': True, 'use_atr': False, 'use_adx': True, 'use_ema': True, 'use_spike': False, 'rsi_required': False, 'edge_k': 0.5339155887320387, 'edge_cap': 0.6096100702859482, 'bull_strategy': 'mean_reversion', 'bull_bb_std_mult': 3.0992632071719943, 'bull_rsi_os': 13, 'bull_rsi_ob': 77, 'bull_adx_thresh': 14.058754810294527, 'bull_atr_min_pct': 0.025250904618194236, 'bull_atr_max_pct': 0.10050102721330673, 'bull_tp_mult': 2.6714818243327394, 'bull_tsl_mult': 0.30946454060188355, 'bull_time_stop': 24, 'bull_use_sma': True, 'bull_use_ema': False, 'bull_use_atr': True, 'bull_use_adx': False, 'bull_use_spike': True, 'bull_rsi_required': False, 'bear_strategy': 'breakout', 'bear_bb_std_mult': 1.934869897765142, 'bear_rsi_os': 29, 'bear_rsi_ob': 68, 'bear_adx_thresh': 20.372581545311593, 'bear_atr_min_pct': 0.019818249499030136, 'bear_atr_max_pct': 0.04812533767746807, 'bear_tp_mult': 2.6366745879360414, 'bear_tsl_mult': 0.9033102228651466, 'bear_time_stop': 61, 'bear_use_sma': False, 'bear_use_ema': True, 'bear_use_atr': False, 'bear_use_adx': True, 'bear_use_spike': True, 'bear_rsi_required': False, 'sideways_strategy': 'breakout', 'sideways_bb_std_mult': 0.7442333532776868, 'sideways_rsi_os': 40, 'sideways_rsi_ob': 70, 'sideways_adx_thresh': 11.984245745348876, 'sideways_atr_min_pct': 0.005181273715401377, 'sideways_atr_max_pct': 0.1465024484744153, 'sideways_tp_mult': 1.7308416876974362, 'sideways_tsl_mult': 0.44578079972424717, 'sideways_time_stop': 181, 'sideways_use_sma': False, 'sideways_use_ema': False, 'sideways_use_atr': False, 'sideways_use_adx': False, 'sideways_use_spike': False, 'sideways_rsi_required': False}.
[I 2025-08-29 20:22:26,682] Trial 382 finished with values: [-1000000000.0, 1000000000.0] and parameters: {'p_sma': 23, 'p_std': 36, 'p_atr': 27, 'p_adx': 11, 'rsi_period': 38, 'ema1': 27, 'ema2': 18, 'slip_atr_k': 0.0012735123963473853, 'slip_spread_k': 0.7971891817931588, 'spread_hl_frac': 0.04908629543382307, 'bb_std_mult': 1.7786235700829625, 'rsi_os': 12, 'rsi_ob': 85, 'vol_spike': 0.2681980312378641, 'adx_thresh': 14.661553957506353, 'atr_min_pct': 0.01887148954826739, 'atr_max_pct': 0.01771462810695907, 'tp_mult': 1.3560748003927747, 'tsl_mult': 0.9211905864018904, 'strategy': 'mean_reversion', 'time_stop': 169, 'use_sma': True, 'use_atr': False, 'use_adx': True, 'use_ema': True, 'use_spike': False, 'rsi_required': False, 'edge_k': 0.9754579373400092, 'edge_cap': 0.778702822466116, 'bull_strategy': 'mean_reversion', 'bull_bb_std_mult': 3.0963152997171544, 'bull_rsi_os': 12, 'bull_rsi_ob': 72, 'bull_adx_thresh': 11.778889998708477, 'bull_atr_min_pct': 0.016100088661499094, 'bull_atr_max_pct': 0.10038146317874475, 'bull_tp_mult': 2.6674356591616073, 'bull_tsl_mult': 0.3056973593101525, 'bull_time_stop': 21, 'bull_use_sma': True, 'bull_use_ema': False, 'bull_use_atr': True, 'bull_use_adx': False, 'bull_use_spike': True, 'bull_rsi_required': False, 'bear_strategy': 'mean_reversion', 'bear_bb_std_mult': 2.031868285682801, 'bear_rsi_os': 50, 'bear_rsi_ob': 68, 'bear_adx_thresh': 21.41655936746683, 'bear_atr_min_pct': 0.007224747262653724, 'bear_atr_max_pct': 0.049960961792629384, 'bear_tp_mult': 2.675366293886713, 'bear_tsl_mult': 0.8359069691201493, 'bear_time_stop': 70, 'bear_use_sma': True, 'bear_use_ema': True, 'bear_use_atr': False, 'bear_use_adx': True, 'bear_use_spike': True, 'bear_rsi_required': False, 'sideways_strategy': 'breakout', 'sideways_bb_std_mult': 1.2851294669994906, 'sideways_rsi_os': 36, 'sideways_rsi_ob': 79, 'sideways_adx_thresh': 12.162403861237863, 'sideways_atr_min_pct': 0.012125815272109116, 'sideways_atr_max_pct': 0.14404439407693503, 'sideways_tp_mult': 1.0796341028612115, 'sideways_tsl_mult': 0.7463744433025542, 'sideways_time_stop': 181, 'sideways_use_sma': False, 'sideways_use_ema': False, 'sideways_use_atr': False, 'sideways_use_adx': False, 'sideways_use_spike': True, 'sideways_rsi_required': False}.
[I 2025-08-29 20:22:55,792] Trial 385 finished with values: [-1000000000.0, 1000000000.0] and parameters: {'p_sma': 25, 'p_std': 21, 'p_atr': 27, 'p_adx': 12, 'rsi_period': 44, 'ema1': 25, 'ema2': 45, 'slip_atr_k': 0.011363469057637174, 'slip_spread_k': 0.6231099956033403, 'spread_hl_frac': 0.04968281050332991, 'bb_std_mult': 1.8753543583600827, 'rsi_os': 9, 'rsi_ob': 85, 'vol_spike': 0.1698663404406441, 'adx_thresh': 12.923123766004444, 'atr_min_pct': 0.001906577123599507, 'atr_max_pct': 0.030391751880074775, 'tp_mult': 1.303075736960329, 'tsl_mult': 0.8717809974292852, 'strategy': 'breakout', 'time_stop': 266, 'use_sma': True, 'use_atr': False, 'use_adx': True, 'use_ema': True, 'use_spike': True, 'rsi_required': False, 'edge_k': 1.0606447550298441, 'edge_cap': 0.7674007430390033, 'bull_strategy': 'mean_reversion', 'bull_bb_std_mult': 2.5564199863951806, 'bull_rsi_os': 20, 'bull_rsi_ob': 72, 'bull_adx_thresh': 14.575583631927984, 'bull_atr_min_pct': 0.016313554112989966, 'bull_atr_max_pct': 0.09121612122858451, 'bull_tp_mult': 2.7257234999764965, 'bull_tsl_mult': 0.3864272000451113, 'bull_time_stop': 19, 'bull_use_sma': True, 'bull_use_ema': False, 'bull_use_atr': True, 'bull_use_adx': False, 'bull_use_spike': True, 'bull_rsi_required': False, 'bear_strategy': 'mean_reversion', 'bear_bb_std_mult': 2.8046096886140357, 'bear_rsi_os': 28, 'bear_rsi_ob': 65, 'bear_adx_thresh': 19.23698049502281, 'bear_atr_min_pct': 0.008013731718997467, 'bear_atr_max_pct': 0.07028779390073793, 'bear_tp_mult': 1.491359968450079, 'bear_tsl_mult': 0.9469395616577501, 'bear_time_stop': 46, 'bear_use_sma': True, 'bear_use_ema': True, 'bear_use_atr': False, 'bear_use_adx': True, 'bear_use_spike': True, 'bear_rsi_required': False, 'sideways_strategy': 'breakout', 'sideways_bb_std_mult': 0.5889732083931805, 'sideways_rsi_os': 46, 'sideways_rsi_ob': 54, 'sideways_adx_thresh': 31.163194812398388, 'sideways_atr_min_pct': 0.0047067878626783615, 'sideways_atr_max_pct': 0.10623243036720609, 'sideways_tp_mult': 1.0641908607334596, 'sideways_tsl_mult': 0.7418587144752085, 'sideways_time_stop': 197, 'sideways_use_sma': False, 'sideways_use_ema': False, 'sideways_use_atr': False, 'sideways_use_adx': False, 'sideways_use_spike': True, 'sideways_rsi_required': False}.
[I 2025-08-29 20:22:55,909] Trial 383 finished with values: [-1000000000.0, 1000000000.0] and parameters: {'p_sma': 59, 'p_std': 14, 'p_atr': 26, 'p_adx': 12, 'rsi_period': 83, 'ema1': 25, 'ema2': 45, 'slip_atr_k': 0.0047179630392425245, 'slip_spread_k': 0.17000538596313794, 'spread_hl_frac': 0.04995631532796279, 'bb_std_mult': 1.8690997903369344, 'rsi_os': 10, 'rsi_ob': 84, 'vol_spike': 0.17200173078094783, 'adx_thresh': 13.035260642091144, 'atr_min_pct': 0.006538397872453257, 'atr_max_pct': 0.026027066322209965, 'tp_mult': 1.301256906411813, 'tsl_mult': 0.9148039755549271, 'strategy': 'mean_reversion', 'time_stop': 33, 'use_sma': True, 'use_atr': False, 'use_adx': True, 'use_ema': True, 'use_spike': False, 'rsi_required': False, 'edge_k': 1.0289547981889735, 'edge_cap': 0.7757674977000699, 'bull_strategy': 'mean_reversion', 'bull_bb_std_mult': 2.979120840674832, 'bull_rsi_os': 16, 'bull_rsi_ob': 72, 'bull_adx_thresh': 14.489057935595902, 'bull_atr_min_pct': 0.01619161773357809, 'bull_atr_max_pct': 0.09133670015070272, 'bull_tp_mult': 2.688364184237105, 'bull_tsl_mult': 0.820765563522038, 'bull_time_stop': 21, 'bull_use_sma': True, 'bull_use_ema': False, 'bull_use_atr': True, 'bull_use_adx': False, 'bull_use_spike': True, 'bull_rsi_required': False, 'bear_strategy': 'mean_reversion', 'bear_bb_std_mult': 0.5112166956410773, 'bear_rsi_os': 50, 'bear_rsi_ob': 65, 'bear_adx_thresh': 20.312398932311766, 'bear_atr_min_pct': 0.007242156708605635, 'bear_atr_max_pct': 0.04691931982524705, 'bear_tp_mult': 1.3460814466292816, 'bear_tsl_mult': 0.9418434625830654, 'bear_time_stop': 69, 'bear_use_sma': True, 'bear_use_ema': True, 'bear_use_atr': False, 'bear_use_adx': True, 'bear_use_spike': True, 'bear_rsi_required': False, 'sideways_strategy': 'breakout', 'sideways_bb_std_mult': 1.2979051895269995, 'sideways_rsi_os': 36, 'sideways_rsi_ob': 48, 'sideways_adx_thresh': 24.744731549619257, 'sideways_atr_min_pct': 0.028358212770623642, 'sideways_atr_max_pct': 0.03818020480770327, 'sideways_tp_mult': 1.0651055225394364, 'sideways_tsl_mult': 0.7481003549793234, 'sideways_time_stop': 196, 'sideways_use_sma': False, 'sideways_use_ema': False, 'sideways_use_atr': False, 'sideways_use_adx': False, 'sideways_use_spike': True, 'sideways_rsi_required': False}.
[I 2025-08-29 20:22:56,627] Trial 384 finished with values: [-1000000000.0, 1000000000.0] and parameters: {'p_sma': 19, 'p_std': 14, 'p_atr': 27, 'p_adx': 12, 'rsi_period': 82, 'ema1': 25, 'ema2': 46, 'slip_atr_k': 0.01211647247946326, 'slip_spread_k': 0.8321852236625282, 'spread_hl_frac': 0.047897108833495364, 'bb_std_mult': 1.8843318758025813, 'rsi_os': 9, 'rsi_ob': 85, 'vol_spike': 0.2761413332668181, 'adx_thresh': 12.990127298785739, 'atr_min_pct': 0.0017131872607785755, 'atr_max_pct': 0.03144653772431823, 'tp_mult': 1.2726438862198004, 'tsl_mult': 0.8741659132607438, 'strategy': 'breakout', 'time_stop': 169, 'use_sma': True, 'use_atr': False, 'use_adx': True, 'use_ema': True, 'use_spike': True, 'rsi_required': False, 'edge_k': 1.069574209540592, 'edge_cap': 0.8366499784429876, 'bull_strategy': 'mean_reversion', 'bull_bb_std_mult': 2.977419971310818, 'bull_rsi_os': 20, 'bull_rsi_ob': 69, 'bull_adx_thresh': 12.693215302144303, 'bull_atr_min_pct': 0.028379149040910642, 'bull_atr_max_pct': 0.09192872923327489, 'bull_tp_mult': 2.739262181903643, 'bull_tsl_mult': 0.7809340429179646, 'bull_time_stop': 22, 'bull_use_sma': True, 'bull_use_ema': False, 'bull_use_atr': True, 'bull_use_adx': False, 'bull_use_spike': True, 'bull_rsi_required': False, 'bear_strategy': 'mean_reversion', 'bear_bb_std_mult': 2.8385860033628045, 'bear_rsi_os': 50, 'bear_rsi_ob': 65, 'bear_adx_thresh': 23.292419823311754, 'bear_atr_min_pct': 0.007190446042344846, 'bear_atr_max_pct': 0.0712198472616136, 'bear_tp_mult': 2.68801458600047, 'bear_tsl_mult': 0.9390454179353701, 'bear_time_stop': 44, 'bear_use_sma': True, 'bear_use_ema': True, 'bear_use_atr': False, 'bear_use_adx': True, 'bear_use_spike': True, 'bear_rsi_required': False, 'sideways_strategy': 'breakout', 'sideways_bb_std_mult': 2.2550992406011, 'sideways_rsi_os': 8, 'sideways_rsi_ob': 90, 'sideways_adx_thresh': 24.621077083479545, 'sideways_atr_min_pct': 0.004565450962281107, 'sideways_atr_max_pct': 0.09939675710147967, 'sideways_tp_mult': 1.0735994152623523, 'sideways_tsl_mult': 0.7455456061547953, 'sideways_time_stop': 198, 'sideways_use_sma': False, 'sideways_use_ema': False, 'sideways_use_atr': False, 'sideways_use_adx': False, 'sideways_use_spike': True, 'sideways_rsi_required': False}.
[I 2025-08-29 20:22:57,299] Trial 386 finished with values: [-0.0028814891699846523, 0.0029820478035031024] and parameters: {'p_sma': 58, 'p_std': 21, 'p_atr': 26, 'p_adx': 12, 'rsi_period': 73, 'ema1': 26, 'ema2': 12, 'slip_atr_k': 0.0001277272921332551, 'slip_spread_k': 0.5251593441937249, 'spread_hl_frac': 0.049978678370325644, 'bb_std_mult': 1.867149435977133, 'rsi_os': 7, 'rsi_ob': 83, 'vol_spike': 0.2740707180486149, 'adx_thresh': 11.954687799372879, 'atr_min_pct': 0.010258499311664952, 'atr_max_pct': 0.03135710869891845, 'tp_mult': 1.3077633583863215, 'tsl_mult': 0.9604707272462265, 'strategy': 'breakout', 'time_stop': 164, 'use_sma': True, 'use_atr': False, 'use_adx': False, 'use_ema': True, 'use_spike': True, 'rsi_required': False, 'edge_k': 1.8516157318844872, 'edge_cap': 0.8321021554755479, 'bull_strategy': 'mean_reversion', 'bull_bb_std_mult': 2.3634195433299556, 'bull_rsi_os': 22, 'bull_rsi_ob': 73, 'bull_adx_thresh': 24.00849418773152, 'bull_atr_min_pct': 0.018828307408499778, 'bull_atr_max_pct': 0.09226359685255207, 'bull_tp_mult': 2.738134978407266, 'bull_tsl_mult': 0.49283613235817814, 'bull_time_stop': 29, 'bull_use_sma': True, 'bull_use_ema': False, 'bull_use_atr': True, 'bull_use_adx': False, 'bull_use_spike': True, 'bull_rsi_required': False, 'bear_strategy': 'mean_reversion', 'bear_bb_std_mult': 3.4487851109162904, 'bear_rsi_os': 28, 'bear_rsi_ob': 65, 'bear_adx_thresh': 22.676234833664946, 'bear_atr_min_pct': 0.007888554149549675, 'bear_atr_max_pct': 0.07052457606904534, 'bear_tp_mult': 2.7098093148895344, 'bear_tsl_mult': 0.9455738225049561, 'bear_time_stop': 46, 'bear_use_sma': True, 'bear_use_ema': True, 'bear_use_atr': False, 'bear_use_adx': True, 'bear_use_spike': True, 'bear_rsi_required': True, 'sideways_strategy': 'breakout', 'sideways_bb_std_mult': 2.4468572970145885, 'sideways_rsi_os': 47, 'sideways_rsi_ob': 60, 'sideways_adx_thresh': 30.984867828621503, 'sideways_atr_min_pct': 0.004501247390496945, 'sideways_atr_max_pct': 0.025503237024050506, 'sideways_tp_mult': 1.0651806690276977, 'sideways_tsl_mult': 0.7671024049216146, 'sideways_time_stop': 198, 'sideways_use_sma': True, 'sideways_use_ema': False, 'sideways_use_atr': False, 'sideways_use_adx': False, 'sideways_use_spike': True, 'sideways_rsi_required': False}.
