[I 2025-08-29 20:26:29,416] Trial 413 finished with values: [-0.006485834914774724, 0.006499821559888004] and parameters: {'p_sma': 55, 'p_std': 29, 'p_atr': 10, 'p_adx': 14, 'rsi_period': 58, 'ema1': 5, 'ema2': 14, 'slip_atr_k': 0.10815786859070069, 'slip_spread_k': 0.18686671583307984, 'spread_hl_frac': 0.04811321571987652, 'bb_std_mult': 1.55280734357481, 'rsi_os': 8, 'rsi_ob': 84, 'vol_spike': 0.1202021150398229, 'adx_thresh': 24.206636938212874, 'atr_min_pct': 0.027161473612641297, 'atr_max_pct': 0.02800501499596968, 'tp_mult': 1.1042697851636054, 'tsl_mult': 0.30086334212023114, 'strategy': 'mean_reversion', 'time_stop': 61, 'use_sma': False, 'use_atr': False, 'use_adx': False, 'use_ema': True, 'use_spike': False, 'rsi_required': False, 'edge_k': 0.9884222212211026, 'edge_cap': 0.1065890717664586, 'bull_strategy': 'mean_reversion', 'bull_bb_std_mult': 2.9414646785929945, 'bull_rsi_os': 25, 'bull_rsi_ob': 48, 'bull_adx_thresh': 13.941964267982366, 'bull_atr_min_pct': 0.015703660536328098, 'bull_atr_max_pct': 0.09695048750197346, 'bull_tp_mult': 2.295116194780208, 'bull_tsl_mult': 0.6466279431830414, 'bull_time_stop': 7, 'bull_use_sma': True, 'bull_use_ema': False, 'bull_use_atr': True, 'bull_use_adx': False, 'bull_use_spike': True, 'bull_rsi_required': False, 'bear_strategy': 'breakout', 'bear_bb_std_mult': 2.625402605511389, 'bear_rsi_os': 11, 'bear_rsi_ob': 66, 'bear_adx_thresh': 13.272475152722503, 'bear_atr_min_pct': 0.007519101698140931, 'bear_atr_max_pct': 0.14250668394002897, 'bear_tp_mult': 2.630231480781128, 'bear_tsl_mult': 0.9997445387496351, 'bear_time_stop': 72, 'bear_use_sma': False, 'bear_use_ema': True, 'bear_use_atr': False, 'bear_use_adx': True, 'bear_use_spike': False, 'bear_rsi_required': False, 'sideways_strategy': 'breakout', 'sideways_bb_std_mult': 2.3506111811291754, 'sideways_rsi_os': 50, 'sideways_rsi_ob': 75, 'sideways_adx_thresh': 33.716742481470185, 'sideways_atr_min_pct': 0.005063735068352881, 'sideways_atr_max_pct': 0.08017920144871817, 'sideways_tp_mult': 1.0451507043186596, 'sideways_tsl_mult': 0.7324669425809057, 'sideways_time_stop': 106, 'sideways_use_sma': False, 'sideways_use_ema': False, 'sideways_use_atr': False, 'sideways_use_adx': False, 'sideways_use_spike': False, 'sideways_rsi_required': False}.
[I 2025-08-29 20:26:29,917] Trial 415 finished with values: [-1000000000.0, 1000000000.0] and parameters: {'p_sma': 21, 'p_std': 41, 'p_atr': 10, 'p_adx': 14, 'rsi_period': 55, 'ema1': 30, 'ema2': 24, 'slip_atr_k': 0.0003659765010171338, 'slip_spread_k': 0.8603848641559023, 'spread_hl_frac': 0.01728117735273394, 'bb_std_mult': 2.583829459120442, 'rsi_os': 12, 'rsi_ob': 76, 'vol_spike': 0.17259628298028118, 'adx_thresh': 15.069345612570856, 'atr_min_pct': 0.0199727657172938, 'atr_max_pct': 0.03420258774477232, 'tp_mult': 1.1904415892504183, 'tsl_mult': 0.8563833389002907, 'strategy': 'mean_reversion', 'time_stop': 166, 'use_sma': False, 'use_atr': False, 'use_adx': False, 'use_ema': True, 'use_spike': True, 'rsi_required': False, 'edge_k': 1.5389446825408009, 'edge_cap': 0.7327421407131443, 'bull_strategy': 'breakout', 'bull_bb_std_mult': 2.9473107486428023, 'bull_rsi_os': 49, 'bull_rsi_ob': 88, 'bull_adx_thresh': 13.939415740738449, 'bull_atr_min_pct': 0.017395191124745583, 'bull_atr_max_pct': 0.09813023269977687, 'bull_tp_mult': 2.7343946330316786, 'bull_tsl_mult': 0.6067188458360921, 'bull_time_stop': 6, 'bull_use_sma': True, 'bull_use_ema': False, 'bull_use_atr': True, 'bull_use_adx': False, 'bull_use_spike': True, 'bull_rsi_required': False, 'bear_strategy': 'breakout', 'bear_bb_std_mult': 2.61108970715101, 'bear_rsi_os': 29, 'bear_rsi_ob': 58, 'bear_adx_thresh': 21.723894489924092, 'bear_atr_min_pct': 0.007462130257728325, 'bear_atr_max_pct': 0.046253381610733675, 'bear_tp_mult': 2.633763698058915, 'bear_tsl_mult': 0.9973145904172269, 'bear_time_stop': 40, 'bear_use_sma': False, 'bear_use_ema': True, 'bear_use_atr': False, 'bear_use_adx': True, 'bear_use_spike': False, 'bear_rsi_required': False, 'sideways_strategy': 'breakout', 'sideways_bb_std_mult': 2.3302670640776237, 'sideways_rsi_os': 50, 'sideways_rsi_ob': 68, 'sideways_adx_thresh': 31.238842657105774, 'sideways_atr_min_pct': 0.02330369947664357, 'sideways_atr_max_pct': 0.02455709657086754, 'sideways_tp_mult': 1.1639626010272832, 'sideways_tsl_mult': 0.9938466317008527, 'sideways_time_stop': 107, 'sideways_use_sma': False, 'sideways_use_ema': False, 'sideways_use_atr': False, 'sideways_use_adx': True, 'sideways_use_spike': False, 'sideways_rsi_required': True}.
[I 2025-08-29 20:26:30,232] Trial 416 finished with values: [-0.001938258294116535, 0.002199020452473877] and parameters: {'p_sma': 26, 'p_std': 56, 'p_atr': 9, 'p_adx': 13, 'rsi_period': 35, 'ema1': 5, 'ema2': 45, 'slip_atr_k': 0.06606642916708469, 'slip_spread_k': 0.17463883872356262, 'spread_hl_frac': 0.017012903841320197, 'bb_std_mult': 0.8311913343921933, 'rsi_os': 8, 'rsi_ob': 84, 'vol_spike': 0.0704105795906254, 'adx_thresh': 15.05338380111148, 'atr_min_pct': 0.019955728103867063, 'atr_max_pct': 0.1173087400082681, 'tp_mult': 1.1920886638163404, 'tsl_mult': 0.2631011171666, 'strategy': 'mean_reversion', 'time_stop': 166, 'use_sma': False, 'use_atr': False, 'use_adx': False, 'use_ema': True, 'use_spike': False, 'rsi_required': False, 'edge_k': 0.0045713266591000945, 'edge_cap': 0.13893155903108184, 'bull_strategy': 'breakout', 'bull_bb_std_mult': 2.848978270314211, 'bull_rsi_os': 25, 'bull_rsi_ob': 63, 'bull_adx_thresh': 13.515068226567374, 'bull_atr_min_pct': 0.01749958421557063, 'bull_atr_max_pct': 0.09937757602619238, 'bull_tp_mult': 2.6741442793531736, 'bull_tsl_mult': 0.8330759145252267, 'bull_time_stop': 24, 'bull_use_sma': False, 'bull_use_ema': False, 'bull_use_atr': True, 'bull_use_adx': False, 'bull_use_spike': True, 'bull_rsi_required': False, 'bear_strategy': 'breakout', 'bear_bb_std_mult': 0.7071299870461127, 'bear_rsi_os': 29, 'bear_rsi_ob': 67, 'bear_adx_thresh': 13.316199391138833, 'bear_atr_min_pct': 0.00735263434697632, 'bear_atr_max_pct': 0.13296518976845745, 'bear_tp_mult': 2.6563998127814807, 'bear_tsl_mult': 0.9993920186549378, 'bear_time_stop': 215, 'bear_use_sma': False, 'bear_use_ema': True, 'bear_use_atr': False, 'bear_use_adx': True, 'bear_use_spike': False, 'bear_rsi_required': False, 'sideways_strategy': 'breakout', 'sideways_bb_std_mult': 2.501474127633074, 'sideways_rsi_os': 45, 'sideways_rsi_ob': 75, 'sideways_adx_thresh': 33.657964873456635, 'sideways_atr_min_pct': 0.005857805548700173, 'sideways_atr_max_pct': 0.019356879627290012, 'sideways_tp_mult': 1.09467727021457, 'sideways_tsl_mult': 0.7476221181338737, 'sideways_time_stop': 201, 'sideways_use_sma': False, 'sideways_use_ema': False, 'sideways_use_atr': False, 'sideways_use_adx': True, 'sideways_use_spike': False, 'sideways_rsi_required': True}.
[I 2025-08-29 20:26:31,081] Trial 417 finished with values: [-1000000000.0, 1000000000.0] and parameters: {'p_sma': 21, 'p_std': 38, 'p_atr': 25, 'p_adx': 14, 'rsi_period': 35, 'ema1': 30, 'ema2': 45, 'slip_atr_k': 0.004997831374162486, 'slip_spread_k': 0.1729950117949098, 'spread_hl_frac': 0.014326917157515238, 'bb_std_mult': 1.5457966461724464, 'rsi_os': 32, 'rsi_ob': 84, 'vol_spike': 0.1752777347789039, 'adx_thresh': 20.312440498871794, 'atr_min_pct': 0.020256400940021704, 'atr_max_pct': 0.034033458647253004, 'tp_mult': 1.166120149386904, 'tsl_mult': 0.3003579690246527, 'strategy': 'mean_reversion', 'time_stop': 271, 'use_sma': True, 'use_atr': False, 'use_adx': False, 'use_ema': True, 'use_spike': False, 'rsi_required': False, 'edge_k': 0.4957956078592457, 'edge_cap': 0.9331341092206502, 'bull_strategy': 'breakout', 'bull_bb_std_mult': 2.9741058314857494, 'bull_rsi_os': 25, 'bull_rsi_ob': 73, 'bull_adx_thresh': 7.295458731828925, 'bull_atr_min_pct': 0.009075820207588375, 'bull_atr_max_pct': 0.1048904563974693, 'bull_tp_mult': 2.9072018811907103, 'bull_tsl_mult': 0.4763516386838329, 'bull_time_stop': 44, 'bull_use_sma': False, 'bull_use_ema': False, 'bull_use_atr': True, 'bull_use_adx': False, 'bull_use_spike': True, 'bull_rsi_required': False, 'bear_strategy': 'mean_reversion', 'bear_bb_std_mult': 2.648605013867688, 'bear_rsi_os': 29, 'bear_rsi_ob': 67, 'bear_adx_thresh': 17.912732161732407, 'bear_atr_min_pct': 0.008236932717782728, 'bear_atr_max_pct': 0.13187304920128978, 'bear_tp_mult': 1.2966604992915167, 'bear_tsl_mult': 0.9963708301189013, 'bear_time_stop': 189, 'bear_use_sma': False, 'bear_use_ema': True, 'bear_use_atr': False, 'bear_use_adx': True, 'bear_use_spike': True, 'bear_rsi_required': False, 'sideways_strategy': 'breakout', 'sideways_bb_std_mult': 2.4822936235718385, 'sideways_rsi_os': 50, 'sideways_rsi_ob': 78, 'sideways_adx_thresh': 33.49841342979208, 'sideways_atr_min_pct': 0.00501548238515548, 'sideways_atr_max_pct': 0.024702184790255974, 'sideways_tp_mult': 1.1441234028208154, 'sideways_tsl_mult': 0.7191353026405038, 'sideways_time_stop': 185, 'sideways_use_sma': True, 'sideways_use_ema': False, 'sideways_use_atr': False, 'sideways_use_adx': True, 'sideways_use_spike': False, 'sideways_rsi_required': False}.
[I 2025-08-29 20:26:31,548] Trial 419 finished with values: [-1000000000.0, 1000000000.0] and parameters: {'p_sma': 30, 'p_std': 38, 'p_atr': 9, 'p_adx': 26, 'rsi_period': 13, 'ema1': 22, 'ema2': 16, 'slip_atr_k': 0.004916453406767199, 'slip_spread_k': 0.169858819550364, 'spread_hl_frac': 0.04898790395033048, 'bb_std_mult': 3.328633488242639, 'rsi_os': 52, 'rsi_ob': 53, 'vol_spike': 0.24053056296927344, 'adx_thresh': 12.483918577958834, 'atr_min_pct': 0.0035757186970721555, 'atr_max_pct': 0.10250883641057537, 'tp_mult': 1.16003739065889, 'tsl_mult': 0.8784350775005488, 'strategy': 'mean_reversion', 'time_stop': 171, 'use_sma': True, 'use_atr': False, 'use_adx': False, 'use_ema': True, 'use_spike': False, 'rsi_required': False, 'edge_k': 0.5952423197880468, 'edge_cap': 0.1506399005701456, 'bull_strategy': 'breakout', 'bull_bb_std_mult': 2.4600231256760496, 'bull_rsi_os': 55, 'bull_rsi_ob': 54, 'bull_adx_thresh': 29.364407061897715, 'bull_atr_min_pct': 0.008165111505794041, 'bull_atr_max_pct': 0.0891455370130625, 'bull_tp_mult': 2.6613422118041967, 'bull_tsl_mult': 0.36088478039494015, 'bull_time_stop': 41, 'bull_use_sma': False, 'bull_use_ema': False, 'bull_use_atr': True, 'bull_use_adx': False, 'bull_use_spike': True, 'bull_rsi_required': False, 'bear_strategy': 'mean_reversion', 'bear_bb_std_mult': 2.5499482140251515, 'bear_rsi_os': 25, 'bear_rsi_ob': 67, 'bear_adx_thresh': 22.565724531697096, 'bear_atr_min_pct': 0.008319696764026972, 'bear_atr_max_pct': 0.1474506843797394, 'bear_tp_mult': 1.2268536197010782, 'bear_tsl_mult': 0.9364069321902282, 'bear_time_stop': 157, 'bear_use_sma': False, 'bear_use_ema': True, 'bear_use_atr': False, 'bear_use_adx': True, 'bear_use_spike': True, 'bear_rsi_required': True, 'sideways_strategy': 'breakout', 'sideways_bb_std_mult': 2.4916264434083493, 'sideways_rsi_os': 45, 'sideways_rsi_ob': 71, 'sideways_adx_thresh': 32.31865278752316, 'sideways_atr_min_pct': 0.005848308086907735, 'sideways_atr_max_pct': 0.018333860149770266, 'sideways_tp_mult': 1.0990175259597303, 'sideways_tsl_mult': 0.4627460585814238, 'sideways_time_stop': 202, 'sideways_use_sma': True, 'sideways_use_ema': False, 'sideways_use_atr': False, 'sideways_use_adx': False, 'sideways_use_spike': False, 'sideways_rsi_required': False}.
[I 2025-08-29 20:27:00,547] Trial 418 finished with values: [-1000000000.0, 1000000000.0] and parameters: {'p_sma': 21, 'p_std': 55, 'p_atr': 25, 'p_adx': 13, 'rsi_period': 39, 'ema1': 15, 'ema2': 24, 'slip_atr_k': 0.07135810918232288, 'slip_spread_k': 0.17143861075931965, 'spread_hl_frac': 0.04879808455243055, 'bb_std_mult': 0.7353982212743113, 'rsi_os': 31, 'rsi_ob': 76, 'vol_spike': 0.17471146188499598, 'adx_thresh': 28.64691726360107, 'atr_min_pct': 0.02026903294592167, 'atr_max_pct': 0.13430043659105745, 'tp_mult': 1.041450033450347, 'tsl_mult': 0.4133908301300535, 'strategy': 'mean_reversion', 'time_stop': 167, 'use_sma': True, 'use_atr': False, 'use_adx': False, 'use_ema': True, 'use_spike': False, 'rsi_required': False, 'edge_k': 0.5803412052208108, 'edge_cap': 0.96012912101209, 'bull_strategy': 'breakout', 'bull_bb_std_mult': 2.4666827633084663, 'bull_rsi_os': 22, 'bull_rsi_ob': 73, 'bull_adx_thresh': 24.84657786536196, 'bull_atr_min_pct': 0.008079429136905496, 'bull_atr_max_pct': 0.08961896618992346, 'bull_tp_mult': 1.7820546012759972, 'bull_tsl_mult': 0.8248467970941004, 'bull_time_stop': 43, 'bull_use_sma': False, 'bull_use_ema': False, 'bull_use_atr': True, 'bull_use_adx': False, 'bull_use_spike': True, 'bull_rsi_required': False, 'bear_strategy': 'mean_reversion', 'bear_bb_std_mult': 2.5606703058450466, 'bear_rsi_os': 22, 'bear_rsi_ob': 67, 'bear_adx_thresh': 23.67361112325214, 'bear_atr_min_pct': 0.00605858044051006, 'bear_atr_max_pct': 0.13254370308681357, 'bear_tp_mult': 2.755886565033527, 'bear_tsl_mult': 0.9361071557290719, 'bear_time_stop': 156, 'bear_use_sma': False, 'bear_use_ema': True, 'bear_use_atr': False, 'bear_use_adx': True, 'bear_use_spike': True, 'bear_rsi_required': True, 'sideways_strategy': 'breakout', 'sideways_bb_std_mult': 2.495477743062945, 'sideways_rsi_os': 45, 'sideways_rsi_ob': 76, 'sideways_adx_thresh': 32.24852820759676, 'sideways_atr_min_pct': 0.00621523016620968, 'sideways_atr_max_pct': 0.02539576503607839, 'sideways_tp_mult': 1.15909755150485, 'sideways_tsl_mult': 0.46458669062130564, 'sideways_time_stop': 288, 'sideways_use_sma': True, 'sideways_use_ema': False, 'sideways_use_atr': False, 'sideways_use_adx': True, 'sideways_use_spike': False, 'sideways_rsi_required': True}.
[I 2025-08-29 20:27:00,548] Trial 420 finished with values: [-1000000000.0, 1000000000.0] and parameters: {'p_sma': 12, 'p_std': 27, 'p_atr': 25, 'p_adx': 12, 'rsi_period': 39, 'ema1': 22, 'ema2': 37, 'slip_atr_k': 0.0046030996840761545, 'slip_spread_k': 0.9350141331627899, 'spread_hl_frac': 0.04888463521556827, 'bb_std_mult': 0.7076550029613344, 'rsi_os': 50, 'rsi_ob': 92, 'vol_spike': 0.2581224487955696, 'adx_thresh': 7.860741737383275, 'atr_min_pct': 0.0035138647058326235, 'atr_max_pct': 0.023570563937729112, 'tp_mult': 2.6917942223239057, 'tsl_mult': 0.4734409545207431, 'strategy': 'breakout', 'time_stop': 269, 'use_sma': True, 'use_atr': False, 'use_adx': True, 'use_ema': True, 'use_spike': False, 'rsi_required': False, 'edge_k': 0.3331541536664917, 'edge_cap': 0.9001699730997417, 'bull_strategy': 'mean_reversion', 'bull_bb_std_mult': 2.6398143917202783, 'bull_rsi_os': 22, 'bull_rsi_ob': 51, 'bull_adx_thresh': 12.903162408959737, 'bull_atr_min_pct': 0.008047621079109463, 'bull_atr_max_pct': 0.10495186191079613, 'bull_tp_mult': 2.8020593293419322, 'bull_tsl_mult': 0.958258210215562, 'bull_time_stop': 45, 'bull_use_sma': False, 'bull_use_ema': False, 'bull_use_atr': True, 'bull_use_adx': False, 'bull_use_spike': True, 'bull_rsi_required': False, 'bear_strategy': 'mean_reversion', 'bear_bb_std_mult': 2.7733459891167502, 'bear_rsi_os': 35, 'bear_rsi_ob': 67, 'bear_adx_thresh': 11.556040960255231, 'bear_atr_min_pct': 0.005853988623031703, 'bear_atr_max_pct': 0.052426050882181344, 'bear_tp_mult': 2.7576421894859977, 'bear_tsl_mult': 0.9404898406673965, 'bear_time_stop': 57, 'bear_use_sma': True, 'bear_use_ema': True, 'bear_use_atr': False, 'bear_use_adx': True, 'bear_use_spike': True, 'bear_rsi_required': True, 'sideways_strategy': 'breakout', 'sideways_bb_std_mult': 2.461522970389771, 'sideways_rsi_os': 8, 'sideways_rsi_ob': 92, 'sideways_adx_thresh': 32.358853001252456, 'sideways_atr_min_pct': 0.006831980053294372, 'sideways_atr_max_pct': 0.02683962101817442, 'sideways_tp_mult': 1.524084461431562, 'sideways_tsl_mult': 0.7026442414238708, 'sideways_time_stop': 289, 'sideways_use_sma': True, 'sideways_use_ema': False, 'sideways_use_atr': False, 'sideways_use_adx': False, 'sideways_use_spike': True, 'sideways_rsi_required': False}.
[I 2025-08-29 20:27:01,482] Trial 421 finished with values: [-1000000000.0, 1000000000.0] and parameters: {'p_sma': 18, 'p_std': 55, 'p_atr': 26, 'p_adx': 13, 'rsi_period': 39, 'ema1': 9, 'ema2': 20, 'slip_atr_k': 0.2062315162687298, 'slip_spread_k': 0.19545100798273993, 'spread_hl_frac': 0.048866547171195415, 'bb_std_mult': 1.6606960773836785, 'rsi_os': 9, 'rsi_ob': 83, 'vol_spike': 0.18131267372133472, 'adx_thresh': 28.700560422550602, 'atr_min_pct': 0.00805271215298202, 'atr_max_pct': 0.031091340401230638, 'tp_mult': 1.2709932178382188, 'tsl_mult': 0.4625739176202362, 'strategy': 'breakout', 'time_stop': 173, 'use_sma': True, 'use_atr': False, 'use_adx': True, 'use_ema': True, 'use_spike': False, 'rsi_required': False, 'edge_k': 0.5690617264314412, 'edge_cap': 0.390086696819128, 'bull_strategy': 'mean_reversion', 'bull_bb_std_mult': 2.6417604874710445, 'bull_rsi_os': 19, 'bull_rsi_ob': 69, 'bull_adx_thresh': 8.398404355250324, 'bull_atr_min_pct': 0.01627151713550817, 'bull_atr_max_pct': 0.13860309538382548, 'bull_tp_mult': 2.6427706170245964, 'bull_tsl_mult': 0.9004062120562645, 'bull_time_stop': 37, 'bull_use_sma': True, 'bull_use_ema': False, 'bull_use_atr': True, 'bull_use_adx': False, 'bull_use_spike': True, 'bull_rsi_required': False, 'bear_strategy': 'mean_reversion', 'bear_bb_std_mult': 2.7673679272492513, 'bear_rsi_os': 35, 'bear_rsi_ob': 68, 'bear_adx_thresh': 23.690476310086744, 'bear_atr_min_pct': 0.005980556544685284, 'bear_atr_max_pct': 0.05344384901659313, 'bear_tp_mult': 1.2395541499963278, 'bear_tsl_mult': 0.07804209048708866, 'bear_time_stop': 59, 'bear_use_sma': True, 'bear_use_ema': True, 'bear_use_atr': False, 'bear_use_adx': True, 'bear_use_spike': True, 'bear_rsi_required': True, 'sideways_strategy': 'breakout', 'sideways_bb_std_mult': 2.6519834931658033, 'sideways_rsi_os': 47, 'sideways_rsi_ob': 93, 'sideways_adx_thresh': 32.09536607276892, 'sideways_atr_min_pct': 0.009373554166644912, 'sideways_atr_max_pct': 0.017385371301564728, 'sideways_tp_mult': 1.5140271029635617, 'sideways_tsl_mult': 0.9429392788562068, 'sideways_time_stop': 51, 'sideways_use_sma': True, 'sideways_use_ema': False, 'sideways_use_atr': False, 'sideways_use_adx': False, 'sideways_use_spike': True, 'sideways_rsi_required': False}.
[I 2025-08-29 20:27:02,456] Trial 422 finished with values: [-0.002203114719691035, 0.0023497241372374845] and parameters: {'p_sma': 18, 'p_std': 55, 'p_atr': 25, 'p_adx': 12, 'rsi_period': 39, 'ema1': 15, 'ema2': 21, 'slip_atr_k': 0.07245788033079467, 'slip_spread_k': 0.12652641590518304, 'spread_hl_frac': 0.024550073877085667, 'bb_std_mult': 3.1256278206998136, 'rsi_os': 11, 'rsi_ob': 72, 'vol_spike': 0.18275323169693455, 'adx_thresh': 28.630721487676993, 'atr_min_pct': 0.01777498067208062, 'atr_max_pct': 0.11043305561188252, 'tp_mult': 1.3274099741471572, 'tsl_mult': 0.47674972653826175, 'strategy': 'breakout', 'time_stop': 163, 'use_sma': True, 'use_atr': False, 'use_adx': True, 'use_ema': True, 'use_spike': False, 'rsi_required': False, 'edge_k': 1.0480321350939772, 'edge_cap': 0.7221717089766488, 'bull_strategy': 'mean_reversion', 'bull_bb_std_mult': 3.066764523487459, 'bull_rsi_os': 22, 'bull_rsi_ob': 51, 'bull_adx_thresh': 24.503396892211914, 'bull_atr_min_pct': 0.005688818158963467, 'bull_atr_max_pct': 0.08325113595242978, 'bull_tp_mult': 2.820280985810771, 'bull_tsl_mult': 0.9158427954586519, 'bull_time_stop': 248, 'bull_use_sma': True, 'bull_use_ema': False, 'bull_use_atr': True, 'bull_use_adx': False, 'bull_use_spike': True, 'bull_rsi_required': False, 'bear_strategy': 'breakout', 'bear_bb_std_mult': 2.7739057395200306, 'bear_rsi_os': 26, 'bear_rsi_ob': 68, 'bear_adx_thresh': 14.360944816691877, 'bear_atr_min_pct': 0.0027189378553242414, 'bear_atr_max_pct': 0.051769286297544084, 'bear_tp_mult': 2.5361602293379293, 'bear_tsl_mult': 0.0844254542782733, 'bear_time_stop': 234, 'bear_use_sma': True, 'bear_use_ema': True, 'bear_use_atr': False, 'bear_use_adx': True, 'bear_use_spike': True, 'bear_rsi_required': True, 'sideways_strategy': 'breakout', 'sideways_bb_std_mult': 2.2696350243761994, 'sideways_rsi_os': 35, 'sideways_rsi_ob': 60, 'sideways_adx_thresh': 32.52606822531103, 'sideways_atr_min_pct': 0.004221306096159316, 'sideways_atr_max_pct': 0.02129849277090397, 'sideways_tp_mult': 1.0106056503426786, 'sideways_tsl_mult': 0.6948423587633434, 'sideways_time_stop': 67, 'sideways_use_sma': False, 'sideways_use_ema': False, 'sideways_use_atr': False, 'sideways_use_adx': False, 'sideways_use_spike': True, 'sideways_rsi_required': False}.
