[I 2025-08-29 21:01:50,697] Trial 736 finished with values: [0.00020330395506684695, 0.0017211128290839555] and parameters: {'p_sma': 16, 'p_std': 30, 'p_atr': 18, 'p_adx': 7, 'rsi_period': 32, 'ema1': 23, 'ema2': 19, 'slip_atr_k': 0.003330049867854234, 'slip_spread_k': 0.1197476357049792, 'spread_hl_frac': 0.019012540121206355, 'bb_std_mult': 0.9949310157393854, 'rsi_os': 5, 'rsi_ob': 80, 'vol_spike': 0.2668314114238272, 'adx_thresh': 9.428752963460546, 'atr_min_pct': 0.009366447620231515, 'atr_max_pct': 0.030525041478190754, 'tp_mult': 2.5791817508546138, 'tsl_mult': 0.8046187790825601, 'strategy': 'mean_reversion', 'time_stop': 210, 'use_sma': True, 'use_atr': False, 'use_adx': False, 'use_ema': False, 'use_spike': True, 'rsi_required': False, 'edge_k': 0.9266271946159339, 'edge_cap': 0.266525285323989, 'bull_strategy': 'mean_reversion', 'bull_bb_std_mult': 2.518273444976452, 'bull_rsi_os': 21, 'bull_rsi_ob': 68, 'bull_adx_thresh': 30.3335017180651, 'bull_atr_min_pct': 0.017581951911917366, 'bull_atr_max_pct': 0.10102491497142642, 'bull_tp_mult': 2.5143672510630792, 'bull_tsl_mult': 0.9554192073054893, 'bull_time_stop': 196, 'bull_use_sma': True, 'bull_use_ema': False, 'bull_use_atr': False, 'bull_use_adx': True, 'bull_use_spike': True, 'bull_rsi_required': False, 'bear_strategy': 'breakout', 'bear_bb_std_mult': 2.180151787173188, 'bear_rsi_os': 37, 'bear_rsi_ob': 88, 'bear_adx_thresh': 20.75707996124309, 'bear_atr_min_pct': 0.005394511934567137, 'bear_atr_max_pct': 0.0688392745314656, 'bear_tp_mult': 2.83022084181024, 'bear_tsl_mult': 0.07410391989339957, 'bear_time_stop': 281, 'bear_use_sma': False, 'bear_use_ema': False, 'bear_use_atr': False, 'bear_use_adx': False, 'bear_use_spike': True, 'bear_rsi_required': False, 'sideways_strategy': 'breakout', 'sideways_bb_std_mult': 3.560424398675781, 'sideways_rsi_os': 24, 'sideways_rsi_ob': 83, 'sideways_adx_thresh': 14.648826404944057, 'sideways_atr_min_pct': 0.014764564713989738, 'sideways_atr_max_pct': 0.03390918204165459, 'sideways_tp_mult': 2.4278916882471138, 'sideways_tsl_mult': 0.6337460807099913, 'sideways_time_stop': 153, 'sideways_use_sma': False, 'sideways_use_ema': False, 'sideways_use_atr': True, 'sideways_use_adx': False, 'sideways_use_spike': False, 'sideways_rsi_required': True}.
[I 2025-08-29 21:01:50,831] Trial 739 finished with values: [-0.001518690410185486, 0.002868116916462316] and parameters: {'p_sma': 16, 'p_std': 30, 'p_atr': 17, 'p_adx': 7, 'rsi_period': 34, 'ema1': 23, 'ema2': 23, 'slip_atr_k': 0.00027106612068930754, 'slip_spread_k': 0.1154598168627275, 'spread_hl_frac': 0.018626293149177728, 'bb_std_mult': 1.0227423130191682, 'rsi_os': 5, 'rsi_ob': 80, 'vol_spike': 0.2682079943769763, 'adx_thresh': 10.064830572967901, 'atr_min_pct': 0.008844680190507395, 'atr_max_pct': 0.030333511523989595, 'tp_mult': 2.556781482332382, 'tsl_mult': 0.7959484269676003, 'strategy': 'mean_reversion', 'time_stop': 222, 'use_sma': True, 'use_atr': False, 'use_adx': False, 'use_ema': False, 'use_spike': True, 'rsi_required': False, 'edge_k': 0.9718487050504541, 'edge_cap': 0.22392972428650953, 'bull_strategy': 'mean_reversion', 'bull_bb_std_mult': 2.604528958019157, 'bull_rsi_os': 20, 'bull_rsi_ob': 69, 'bull_adx_thresh': 27.702878517247534, 'bull_atr_min_pct': 0.01717096417655462, 'bull_atr_max_pct': 0.09974370367585117, 'bull_tp_mult': 2.5361503659523517, 'bull_tsl_mult': 0.9536148428076816, 'bull_time_stop': 195, 'bull_use_sma': True, 'bull_use_ema': False, 'bull_use_atr': False, 'bull_use_adx': True, 'bull_use_spike': True, 'bull_rsi_required': False, 'bear_strategy': 'breakout', 'bear_bb_std_mult': 2.168619355224317, 'bear_rsi_os': 37, 'bear_rsi_ob': 88, 'bear_adx_thresh': 34.34826285549563, 'bear_atr_min_pct': 0.004824049124438592, 'bear_atr_max_pct': 0.07157077992317429, 'bear_tp_mult': 2.8259986611256775, 'bear_tsl_mult': 0.0794100243230761, 'bear_time_stop': 279, 'bear_use_sma': False, 'bear_use_ema': False, 'bear_use_atr': False, 'bear_use_adx': False, 'bear_use_spike': True, 'bear_rsi_required': False, 'sideways_strategy': 'breakout', 'sideways_bb_std_mult': 3.590164642524598, 'sideways_rsi_os': 24, 'sideways_rsi_ob': 83, 'sideways_adx_thresh': 14.726327748509283, 'sideways_atr_min_pct': 0.014708217582341483, 'sideways_atr_max_pct': 0.0335152932765382, 'sideways_tp_mult': 2.3415108813595817, 'sideways_tsl_mult': 0.6442513119916448, 'sideways_time_stop': 120, 'sideways_use_sma': False, 'sideways_use_ema': False, 'sideways_use_atr': True, 'sideways_use_adx': False, 'sideways_use_spike': False, 'sideways_rsi_required': True}.
[I 2025-08-29 21:02:20,073] Trial 741 finished with values: [0.00018733880937560343, 0.0017810954117174916] and parameters: {'p_sma': 16, 'p_std': 30, 'p_atr': 17, 'p_adx': 7, 'rsi_period': 32, 'ema1': 23, 'ema2': 23, 'slip_atr_k': 0.0042679965840764595, 'slip_spread_k': 0.12239856347067118, 'spread_hl_frac': 0.01922400868294211, 'bb_std_mult': 1.0174761328865511, 'rsi_os': 5, 'rsi_ob': 80, 'vol_spike': 0.29030976033034833, 'adx_thresh': 9.705434202753814, 'atr_min_pct': 0.00834047376035987, 'atr_max_pct': 0.02272580331979935, 'tp_mult': 2.6144759299952325, 'tsl_mult': 0.8070805164150601, 'strategy': 'mean_reversion', 'time_stop': 222, 'use_sma': True, 'use_atr': False, 'use_adx': False, 'use_ema': False, 'use_spike': True, 'rsi_required': False, 'edge_k': 0.9752915050143898, 'edge_cap': 0.2681777341544671, 'bull_strategy': 'mean_reversion', 'bull_bb_std_mult': 2.5447507684937385, 'bull_rsi_os': 19, 'bull_rsi_ob': 69, 'bull_adx_thresh': 29.602096218799762, 'bull_atr_min_pct': 0.017965052412381586, 'bull_atr_max_pct': 0.09840181790865847, 'bull_tp_mult': 2.534193388628219, 'bull_tsl_mult': 0.9074867053217748, 'bull_time_stop': 199, 'bull_use_sma': True, 'bull_use_ema': False, 'bull_use_atr': False, 'bull_use_adx': True, 'bull_use_spike': True, 'bull_rsi_required': False, 'bear_strategy': 'breakout', 'bear_bb_std_mult': 2.1739719349207585, 'bear_rsi_os': 39, 'bear_rsi_ob': 88, 'bear_adx_thresh': 21.332202959479172, 'bear_atr_min_pct': 0.005059894810028675, 'bear_atr_max_pct': 0.07128798895750771, 'bear_tp_mult': 2.7580062134200243, 'bear_tsl_mult': 0.07828973339699372, 'bear_time_stop': 276, 'bear_use_sma': False, 'bear_use_ema': False, 'bear_use_atr': False, 'bear_use_adx': False, 'bear_use_spike': True, 'bear_rsi_required': False, 'sideways_strategy': 'breakout', 'sideways_bb_std_mult': 3.5986888554952507, 'sideways_rsi_os': 24, 'sideways_rsi_ob': 84, 'sideways_adx_thresh': 14.659913475989333, 'sideways_atr_min_pct': 0.014059095853697441, 'sideways_atr_max_pct': 0.03073374866638998, 'sideways_tp_mult': 2.4851124381426635, 'sideways_tsl_mult': 0.6394523024726346, 'sideways_time_stop': 133, 'sideways_use_sma': False, 'sideways_use_ema': False, 'sideways_use_atr': True, 'sideways_use_adx': False, 'sideways_use_spike': False, 'sideways_rsi_required': True}.
[I 2025-08-29 21:02:20,321] Trial 743 finished with values: [0.00041960699726129036, 0.0021197480999216763] and parameters: {'p_sma': 16, 'p_std': 30, 'p_atr': 17, 'p_adx': 7, 'rsi_period': 34, 'ema1': 23, 'ema2': 22, 'slip_atr_k': 0.004904001712545171, 'slip_spread_k': 0.09958339811981695, 'spread_hl_frac': 0.01870343525759293, 'bb_std_mult': 0.9940392712821917, 'rsi_os': 6, 'rsi_ob': 80, 'vol_spike': 0.2883453845536905, 'adx_thresh': 9.68248846854501, 'atr_min_pct': 0.01158201923340583, 'atr_max_pct': 0.026047731551204358, 'tp_mult': 2.5975788541718323, 'tsl_mult': 0.8109527301010953, 'strategy': 'mean_reversion', 'time_stop': 213, 'use_sma': True, 'use_atr': False, 'use_adx': False, 'use_ema': False, 'use_spike': True, 'rsi_required': False, 'edge_k': 0.8868613176745895, 'edge_cap': 0.26946067323428907, 'bull_strategy': 'mean_reversion', 'bull_bb_std_mult': 2.541749609779131, 'bull_rsi_os': 20, 'bull_rsi_ob': 68, 'bull_adx_thresh': 29.642607591692002, 'bull_atr_min_pct': 0.017035533116945212, 'bull_atr_max_pct': 0.09683067193923448, 'bull_tp_mult': 2.551993553558563, 'bull_tsl_mult': 0.8991250044501717, 'bull_time_stop': 201, 'bull_use_sma': True, 'bull_use_ema': False, 'bull_use_atr': False, 'bull_use_adx': True, 'bull_use_spike': True, 'bull_rsi_required': False, 'bear_strategy': 'breakout', 'bear_bb_std_mult': 2.195398716178461, 'bear_rsi_os': 39, 'bear_rsi_ob': 86, 'bear_adx_thresh': 21.409578021255843, 'bear_atr_min_pct': 0.00517954571851362, 'bear_atr_max_pct': 0.06984920440125966, 'bear_tp_mult': 2.797862443451639, 'bear_tsl_mult': 0.08407142396125418, 'bear_time_stop': 276, 'bear_use_sma': False, 'bear_use_ema': False, 'bear_use_atr': False, 'bear_use_adx': False, 'bear_use_spike': True, 'bear_rsi_required': False, 'sideways_strategy': 'breakout', 'sideways_bb_std_mult': 3.592517185235666, 'sideways_rsi_os': 25, 'sideways_rsi_ob': 83, 'sideways_adx_thresh': 14.792417562097558, 'sideways_atr_min_pct': 0.01389199759890867, 'sideways_atr_max_pct': 0.032089016971021345, 'sideways_tp_mult': 2.4495301781549426, 'sideways_tsl_mult': 0.6201775442559783, 'sideways_time_stop': 143, 'sideways_use_sma': False, 'sideways_use_ema': False, 'sideways_use_atr': True, 'sideways_use_adx': False, 'sideways_use_spike': False, 'sideways_rsi_required': True}.
[I 2025-08-29 21:02:20,492] Trial 742 finished with values: [-0.0016181210705622506, 0.0037866995398416602] and parameters: {'p_sma': 16, 'p_std': 30, 'p_atr': 17, 'p_adx': 7, 'rsi_period': 34, 'ema1': 23, 'ema2': 22, 'slip_atr_k': 0.004048163638870825, 'slip_spread_k': 0.11570910880922164, 'spread_hl_frac': 0.019347521131896427, 'bb_std_mult': 1.006219353947745, 'rsi_os': 5, 'rsi_ob': 80, 'vol_spike': 0.2890091849728027, 'adx_thresh': 9.766996766594469, 'atr_min_pct': 0.01037282353784218, 'atr_max_pct': 0.022897775433693392, 'tp_mult': 2.5772459929412213, 'tsl_mult': 0.8051530820126638, 'strategy': 'mean_reversion', 'time_stop': 212, 'use_sma': True, 'use_atr': False, 'use_adx': False, 'use_ema': False, 'use_spike': True, 'rsi_required': False, 'edge_k': 0.897826829077973, 'edge_cap': 0.26660619836807176, 'bull_strategy': 'mean_reversion', 'bull_bb_std_mult': 2.514711776078305, 'bull_rsi_os': 20, 'bull_rsi_ob': 69, 'bull_adx_thresh': 29.56262668346873, 'bull_atr_min_pct': 0.0172100749575676, 'bull_atr_max_pct': 0.10075593247527699, 'bull_tp_mult': 2.544117441980109, 'bull_tsl_mult': 0.9458883201156727, 'bull_time_stop': 196, 'bull_use_sma': True, 'bull_use_ema': False, 'bull_use_atr': False, 'bull_use_adx': True, 'bull_use_spike': True, 'bull_rsi_required': False, 'bear_strategy': 'breakout', 'bear_bb_std_mult': 2.166032772424025, 'bear_rsi_os': 39, 'bear_rsi_ob': 88, 'bear_adx_thresh': 21.25455368188223, 'bear_atr_min_pct': 0.004232364279774902, 'bear_atr_max_pct': 0.0677917417427932, 'bear_tp_mult': 2.8265521013152406, 'bear_tsl_mult': 0.08107843951098324, 'bear_time_stop': 279, 'bear_use_sma': False, 'bear_use_ema': False, 'bear_use_atr': False, 'bear_use_adx': False, 'bear_use_spike': True, 'bear_rsi_required': False, 'sideways_strategy': 'breakout', 'sideways_bb_std_mult': 3.5972610018623543, 'sideways_rsi_os': 24, 'sideways_rsi_ob': 83, 'sideways_adx_thresh': 14.481166346443226, 'sideways_atr_min_pct': 0.01477524678486737, 'sideways_atr_max_pct': 0.0333033534767888, 'sideways_tp_mult': 2.4584075788740734, 'sideways_tsl_mult': 0.6344236870086915, 'sideways_time_stop': 72, 'sideways_use_sma': False, 'sideways_use_ema': False, 'sideways_use_atr': True, 'sideways_use_adx': False, 'sideways_use_spike': False, 'sideways_rsi_required': True}.
[I 2025-08-29 21:02:20,502] Trial 740 finished with values: [-0.0006372093656824562, 0.0037815246473873873] and parameters: {'p_sma': 17, 'p_std': 29, 'p_atr': 18, 'p_adx': 7, 'rsi_period': 33, 'ema1': 23, 'ema2': 23, 'slip_atr_k': 0.00388536756895865, 'slip_spread_k': 0.11395420588119631, 'spread_hl_frac': 0.019635882859484, 'bb_std_mult': 1.0600762206716674, 'rsi_os': 5, 'rsi_ob': 79, 'vol_spike': 0.29092712555757605, 'adx_thresh': 9.929350948287388, 'atr_min_pct': 0.008627563547380306, 'atr_max_pct': 0.027996112906156622, 'tp_mult': 2.5965832711984493, 'tsl_mult': 0.8055453160507751, 'strategy': 'mean_reversion', 'time_stop': 226, 'use_sma': True, 'use_atr': False, 'use_adx': False, 'use_ema': False, 'use_spike': True, 'rsi_required': False, 'edge_k': 0.9158588469912132, 'edge_cap': 0.2974824458070888, 'bull_strategy': 'mean_reversion', 'bull_bb_std_mult': 2.5534379582464006, 'bull_rsi_os': 20, 'bull_rsi_ob': 69, 'bull_adx_thresh': 29.527973252587984, 'bull_atr_min_pct': 0.017596671451878508, 'bull_atr_max_pct': 0.1002582511863855, 'bull_tp_mult': 2.568094943203645, 'bull_tsl_mult': 0.9565839052096032, 'bull_time_stop': 200, 'bull_use_sma': True, 'bull_use_ema': False, 'bull_use_atr': False, 'bull_use_adx': True, 'bull_use_spike': True, 'bull_rsi_required': False, 'bear_strategy': 'breakout', 'bear_bb_std_mult': 2.1772715352860135, 'bear_rsi_os': 39, 'bear_rsi_ob': 90, 'bear_adx_thresh': 21.188760922678853, 'bear_atr_min_pct': 0.004345994494823214, 'bear_atr_max_pct': 0.06687364381825885, 'bear_tp_mult': 2.830351094515531, 'bear_tsl_mult': 0.07754304396599199, 'bear_time_stop': 277, 'bear_use_sma': False, 'bear_use_ema': False, 'bear_use_atr': False, 'bear_use_adx': False, 'bear_use_spike': True, 'bear_rsi_required': False, 'sideways_strategy': 'breakout', 'sideways_bb_std_mult': 3.5952973741255545, 'sideways_rsi_os': 24, 'sideways_rsi_ob': 83, 'sideways_adx_thresh': 14.725270358813209, 'sideways_atr_min_pct': 0.01456764382184147, 'sideways_atr_max_pct': 0.034682998505331714, 'sideways_tp_mult': 2.5138201166060834, 'sideways_tsl_mult': 0.6335920991412062, 'sideways_time_stop': 135, 'sideways_use_sma': False, 'sideways_use_ema': False, 'sideways_use_atr': True, 'sideways_use_adx': False, 'sideways_use_spike': False, 'sideways_rsi_required': True}.
[I 2025-08-29 21:02:50,318] Trial 745 finished with values: [-0.0013825244143689241, 0.0036101881254074065] and parameters: {'p_sma': 16, 'p_std': 30, 'p_atr': 17, 'p_adx': 7, 'rsi_period': 33, 'ema1': 23, 'ema2': 22, 'slip_atr_k': 0.005770853950387733, 'slip_spread_k': 0.12019690845022829, 'spread_hl_frac': 0.019031190571832838, 'bb_std_mult': 0.99665387496674, 'rsi_os': 5, 'rsi_ob': 80, 'vol_spike': 0.28915292934428705, 'adx_thresh': 9.66430962597379, 'atr_min_pct': 0.010055193375936982, 'atr_max_pct': 0.022924782799563212, 'tp_mult': 2.60947694765953, 'tsl_mult': 0.8174350734107292, 'strategy': 'mean_reversion', 'time_stop': 213, 'use_sma': True, 'use_atr': False, 'use_adx': False, 'use_ema': False, 'use_spike': True, 'rsi_required': False, 'edge_k': 0.8858865651319119, 'edge_cap': 0.27293461984856426, 'bull_strategy': 'mean_reversion', 'bull_bb_std_mult': 2.5651221507239983, 'bull_rsi_os': 20, 'bull_rsi_ob': 69, 'bull_adx_thresh': 29.551173102558625, 'bull_atr_min_pct': 0.01797559692171738, 'bull_atr_max_pct': 0.09575232588757687, 'bull_tp_mult': 2.5566625301744583, 'bull_tsl_mult': 0.9077346731111152, 'bull_time_stop': 200, 'bull_use_sma': True, 'bull_use_ema': False, 'bull_use_atr': False, 'bull_use_adx': True, 'bull_use_spike': True, 'bull_rsi_required': False, 'bear_strategy': 'breakout', 'bear_bb_std_mult': 2.1830759020408115, 'bear_rsi_os': 39, 'bear_rsi_ob': 86, 'bear_adx_thresh': 22.248040830136137, 'bear_atr_min_pct': 0.0040615946186867025, 'bear_atr_max_pct': 0.07008595259650974, 'bear_tp_mult': 2.81992830022852, 'bear_tsl_mult': 0.08037433384450826, 'bear_time_stop': 277, 'bear_use_sma': False, 'bear_use_ema': False, 'bear_use_atr': False, 'bear_use_adx': False, 'bear_use_spike': True, 'bear_rsi_required': False, 'sideways_strategy': 'breakout', 'sideways_bb_std_mult': 3.537447448341262, 'sideways_rsi_os': 25, 'sideways_rsi_ob': 83, 'sideways_adx_thresh': 14.479692237827807, 'sideways_atr_min_pct': 0.013816990432968464, 'sideways_atr_max_pct': 0.031984505102815884, 'sideways_tp_mult': 2.460272902635276, 'sideways_tsl_mult': 0.6382799575741073, 'sideways_time_stop': 133, 'sideways_use_sma': False, 'sideways_use_ema': False, 'sideways_use_atr': True, 'sideways_use_adx': False, 'sideways_use_spike': False, 'sideways_rsi_required': True}.
[I 2025-08-29 21:02:50,479] Trial 747 finished with values: [2.5403304821480788e-05, 0.0019101113758348246] and parameters: {'p_sma': 16, 'p_std': 30, 'p_atr': 17, 'p_adx': 7, 'rsi_period': 32, 'ema1': 22, 'ema2': 23, 'slip_atr_k': 0.004851012760693701, 'slip_spread_k': 0.1284355309088992, 'spread_hl_frac': 0.01855159476283973, 'bb_std_mult': 1.027750032292352, 'rsi_os': 5, 'rsi_ob': 79, 'vol_spike': 0.28531482872404823, 'adx_thresh': 10.155047280690338, 'atr_min_pct': 0.00951225738536025, 'atr_max_pct': 0.02743398235998888, 'tp_mult': 2.6169944518623436, 'tsl_mult': 0.8213228164251813, 'strategy': 'mean_reversion', 'time_stop': 217, 'use_sma': True, 'use_atr': False, 'use_adx': False, 'use_ema': False, 'use_spike': True, 'rsi_required': False, 'edge_k': 0.9701804051158609, 'edge_cap': 0.2694475420248381, 'bull_strategy': 'mean_reversion', 'bull_bb_std_mult': 2.668155858434248, 'bull_rsi_os': 20, 'bull_rsi_ob': 68, 'bull_adx_thresh': 30.002311454199173, 'bull_atr_min_pct': 0.017985461942341918, 'bull_atr_max_pct': 0.09553531442714402, 'bull_tp_mult': 2.563238734184258, 'bull_tsl_mult': 0.9143113743552042, 'bull_time_stop': 204, 'bull_use_sma': True, 'bull_use_ema': False, 'bull_use_atr': False, 'bull_use_adx': True, 'bull_use_spike': True, 'bull_rsi_required': False, 'bear_strategy': 'breakout', 'bear_bb_std_mult': 2.2365887898738217, 'bear_rsi_os': 39, 'bear_rsi_ob': 86, 'bear_adx_thresh': 20.590621920532904, 'bear_atr_min_pct': 0.005131778715712384, 'bear_atr_max_pct': 0.06966672355247808, 'bear_tp_mult': 2.792683808198911, 'bear_tsl_mult': 0.10832911204985307, 'bear_time_stop': 273, 'bear_use_sma': False, 'bear_use_ema': False, 'bear_use_atr': False, 'bear_use_adx': False, 'bear_use_spike': True, 'bear_rsi_required': False, 'sideways_strategy': 'breakout', 'sideways_bb_std_mult': 3.5223132038139866, 'sideways_rsi_os': 25, 'sideways_rsi_ob': 84, 'sideways_adx_thresh': 15.216470701868895, 'sideways_atr_min_pct': 0.013893771460632313, 'sideways_atr_max_pct': 0.03385825727817873, 'sideways_tp_mult': 2.427499820451057, 'sideways_tsl_mult': 0.651344534552613, 'sideways_time_stop': 132, 'sideways_use_sma': False, 'sideways_use_ema': False, 'sideways_use_atr': True, 'sideways_use_adx': False, 'sideways_use_spike': False, 'sideways_rsi_required': True}.
[I 2025-08-29 21:02:50,507] Trial 746 finished with values: [2.533014912264875e-06, 0.0022218815481498894] and parameters: {'p_sma': 15, 'p_std': 29, 'p_atr': 17, 'p_adx': 7, 'rsi_period': 32, 'ema1': 22, 'ema2': 24, 'slip_atr_k': 0.006158563449807822, 'slip_spread_k': 0.1007666158854624, 'spread_hl_frac': 0.020587602909421323, 'bb_std_mult': 0.9894517126566563, 'rsi_os': 5, 'rsi_ob': 79, 'vol_spike': 0.28325706640392373, 'adx_thresh': 10.26844865305204, 'atr_min_pct': 0.009352433287811096, 'atr_max_pct': 0.02700689880917497, 'tp_mult': 2.6043052344987165, 'tsl_mult': 0.8140908274076601, 'strategy': 'mean_reversion', 'time_stop': 216, 'use_sma': True, 'use_atr': False, 'use_adx': False, 'use_ema': False, 'use_spike': True, 'rsi_required': False, 'edge_k': 0.9248478179389523, 'edge_cap': 0.27623973986992584, 'bull_strategy': 'mean_reversion', 'bull_bb_std_mult': 2.633476382483095, 'bull_rsi_os': 20, 'bull_rsi_ob': 69, 'bull_adx_thresh': 30.239715079733077, 'bull_atr_min_pct': 0.01784023327747069, 'bull_atr_max_pct': 0.09584764863484793, 'bull_tp_mult': 2.5634930238786646, 'bull_tsl_mult': 0.9101876698332191, 'bull_time_stop': 203, 'bull_use_sma': True, 'bull_use_ema': False, 'bull_use_atr': False, 'bull_use_adx': True, 'bull_use_spike': True, 'bull_rsi_required': False, 'bear_strategy': 'breakout', 'bear_bb_std_mult': 2.2236111444808153, 'bear_rsi_os': 39, 'bear_rsi_ob': 86, 'bear_adx_thresh': 22.24099594436876, 'bear_atr_min_pct': 0.005234231786498114, 'bear_atr_max_pct': 0.06845065474055889, 'bear_tp_mult': 2.7895543833670766, 'bear_tsl_mult': 0.1060314564974073, 'bear_time_stop': 274, 'bear_use_sma': False, 'bear_use_ema': False, 'bear_use_atr': False, 'bear_use_adx': False, 'bear_use_spike': True, 'bear_rsi_required': False, 'sideways_strategy': 'breakout', 'sideways_bb_std_mult': 3.530783857935762, 'sideways_rsi_os': 23, 'sideways_rsi_ob': 84, 'sideways_adx_thresh': 14.884077104511146, 'sideways_atr_min_pct': 0.013594538336240301, 'sideways_atr_max_pct': 0.031242139865336378, 'sideways_tp_mult': 2.4409497102728874, 'sideways_tsl_mult': 0.6371792951758332, 'sideways_time_stop': 131, 'sideways_use_sma': False, 'sideways_use_ema': False, 'sideways_use_atr': True, 'sideways_use_adx': False, 'sideways_use_spike': False, 'sideways_rsi_required': True}.
