[I 2025-08-29 20:23:27,899] Trial 390 finished with values: [-1000000000.0, 1000000000.0] and parameters: {'p_sma': 19, 'p_std': 58, 'p_atr': 25, 'p_adx': 14, 'rsi_period': 38, 'ema1': 26, 'ema2': 46, 'slip_atr_k': 0.10050400508346086, 'slip_spread_k': 0.138373007007269, 'spread_hl_frac': 0.047995078468385625, 'bb_std_mult': 1.626603563967783, 'rsi_os': 10, 'rsi_ob': 83, 'vol_spike': 0.21988605957598034, 'adx_thresh': 12.362803495319227, 'atr_min_pct': 0.020976773390954714, 'atr_max_pct': 0.1406624127441577, 'tp_mult': 1.4410312017070512, 'tsl_mult': 0.9452276566118236, 'strategy': 'mean_reversion', 'time_stop': 43, 'use_sma': True, 'use_atr': False, 'use_adx': False, 'use_ema': True, 'use_spike': False, 'rsi_required': False, 'edge_k': 1.6297661649785102, 'edge_cap': 0.712425163018033, 'bull_strategy': 'mean_reversion', 'bull_bb_std_mult': 2.0580308014504864, 'bull_rsi_os': 23, 'bull_rsi_ob': 70, 'bull_adx_thresh': 12.332019524839469, 'bull_atr_min_pct': 0.01738650861834142, 'bull_atr_max_pct': 0.09677347853368726, 'bull_tp_mult': 2.607733927562145, 'bull_tsl_mult': 0.8998822454977478, 'bull_time_stop': 40, 'bull_use_sma': True, 'bull_use_ema': False, 'bull_use_atr': True, 'bull_use_adx': False, 'bull_use_spike': True, 'bull_rsi_required': False, 'bear_strategy': 'breakout', 'bear_bb_std_mult': 2.6003378056355033, 'bear_rsi_os': 29, 'bear_rsi_ob': 67, 'bear_adx_thresh': 21.873121818038857, 'bear_atr_min_pct': 0.02314530172029676, 'bear_atr_max_pct': 0.05524207914442808, 'bear_tp_mult': 2.618822795722055, 'bear_tsl_mult': 0.9697373477126731, 'bear_time_stop': 56, 'bear_use_sma': False, 'bear_use_ema': True, 'bear_use_atr': False, 'bear_use_adx': True, 'bear_use_spike': True, 'bear_rsi_required': True, 'sideways_strategy': 'breakout', 'sideways_bb_std_mult': 2.936430590558773, 'sideways_rsi_os': 47, 'sideways_rsi_ob': 78, 'sideways_adx_thresh': 32.06921488656693, 'sideways_atr_min_pct': 0.006090213449038172, 'sideways_atr_max_pct': 0.030054207539651594, 'sideways_tp_mult': 1.145054393854112, 'sideways_tsl_mult': 0.7131825727911851, 'sideways_time_stop': 189, 'sideways_use_sma': True, 'sideways_use_ema': False, 'sideways_use_atr': False, 'sideways_use_adx': True, 'sideways_use_spike': False, 'sideways_rsi_required': False}.
[I 2025-08-29 20:23:28,105] Trial 388 finished with values: [0.0006693413453697783, 0.0009034762436727138] and parameters: {'p_sma': 19, 'p_std': 58, 'p_atr': 25, 'p_adx': 14, 'rsi_period': 38, 'ema1': 26, 'ema2': 46, 'slip_atr_k': 0.00023890207688068697, 'slip_spread_k': 0.13409586016376268, 'spread_hl_frac': 0.047708120916491965, 'bb_std_mult': 1.6859588897625066, 'rsi_os': 7, 'rsi_ob': 83, 'vol_spike': 0.1414017105406553, 'adx_thresh': 12.037542857938256, 'atr_min_pct': 0.025824010687249325, 'atr_max_pct': 0.14310646591306847, 'tp_mult': 1.2356999486772904, 'tsl_mult': 0.056215351852227646, 'strategy': 'mean_reversion', 'time_stop': 159, 'use_sma': True, 'use_atr': False, 'use_adx': False, 'use_ema': True, 'use_spike': True, 'rsi_required': False, 'edge_k': 1.8450530864731631, 'edge_cap': 0.7109447239327343, 'bull_strategy': 'mean_reversion', 'bull_bb_std_mult': 2.3046666720585014, 'bull_rsi_os': 11, 'bull_rsi_ob': 76, 'bull_adx_thresh': 12.333507223309734, 'bull_atr_min_pct': 0.007006959314473643, 'bull_atr_max_pct': 0.09254684721168374, 'bull_tp_mult': 2.7339206747125613, 'bull_tsl_mult': 0.4856036150745269, 'bull_time_stop': 38, 'bull_use_sma': True, 'bull_use_ema': False, 'bull_use_atr': True, 'bull_use_adx': False, 'bull_use_spike': True, 'bull_rsi_required': False, 'bear_strategy': 'breakout', 'bear_bb_std_mult': 0.6370914245608865, 'bear_rsi_os': 28, 'bear_rsi_ob': 91, 'bear_adx_thresh': 22.66445744168574, 'bear_atr_min_pct': 0.006455089627042236, 'bear_atr_max_pct': 0.06539248027793305, 'bear_tp_mult': 2.714832003025138, 'bear_tsl_mult': 0.9625109598088788, 'bear_time_stop': 44, 'bear_use_sma': False, 'bear_use_ema': True, 'bear_use_atr': False, 'bear_use_adx': True, 'bear_use_spike': True, 'bear_rsi_required': True, 'sideways_strategy': 'breakout', 'sideways_bb_std_mult': 2.2499630987497112, 'sideways_rsi_os': 47, 'sideways_rsi_ob': 79, 'sideways_adx_thresh': 15.401188703639411, 'sideways_atr_min_pct': 0.004328795868587522, 'sideways_atr_max_pct': 0.025545936632693955, 'sideways_tp_mult': 1.444330890235961, 'sideways_tsl_mult': 0.7090585586005423, 'sideways_time_stop': 189, 'sideways_use_sma': True, 'sideways_use_ema': False, 'sideways_use_atr': False, 'sideways_use_adx': True, 'sideways_use_spike': False, 'sideways_rsi_required': False}.
[I 2025-08-29 20:23:28,239] Trial 389 finished with values: [-1000000000.0, 1000000000.0] and parameters: {'p_sma': 19, 'p_std': 44, 'p_atr': 25, 'p_adx': 14, 'rsi_period': 40, 'ema1': 26, 'ema2': 44, 'slip_atr_k': 0.000802160617429806, 'slip_spread_k': 0.14015165695185852, 'spread_hl_frac': 0.04995566286896509, 'bb_std_mult': 1.7021570470843999, 'rsi_os': 10, 'rsi_ob': 83, 'vol_spike': 0.18611327082604476, 'adx_thresh': 11.811930358989638, 'atr_min_pct': 0.02049996659170489, 'atr_max_pct': 0.0302200048194777, 'tp_mult': 1.401916145007217, 'tsl_mult': 0.9014992091635321, 'strategy': 'mean_reversion', 'time_stop': 161, 'use_sma': True, 'use_atr': False, 'use_adx': False, 'use_ema': True, 'use_spike': False, 'rsi_required': False, 'edge_k': 0.3928314352228054, 'edge_cap': 0.28247280542600883, 'bull_strategy': 'mean_reversion', 'bull_bb_std_mult': 2.0917777923252703, 'bull_rsi_os': 23, 'bull_rsi_ob': 73, 'bull_adx_thresh': 13.656169608951354, 'bull_atr_min_pct': 0.01732315881345679, 'bull_atr_max_pct': 0.09693699091696213, 'bull_tp_mult': 2.613518297236139, 'bull_tsl_mult': 0.9081244968985716, 'bull_time_stop': 38, 'bull_use_sma': True, 'bull_use_ema': False, 'bull_use_atr': True, 'bull_use_adx': False, 'bull_use_spike': True, 'bull_rsi_required': False, 'bear_strategy': 'breakout', 'bear_bb_std_mult': 1.77402492067424, 'bear_rsi_os': 29, 'bear_rsi_ob': 94, 'bear_adx_thresh': 22.801102046958512, 'bear_atr_min_pct': 0.006357995209559463, 'bear_atr_max_pct': 0.05467962395132154, 'bear_tp_mult': 2.723581118870759, 'bear_tsl_mult': 0.9639772017658585, 'bear_time_stop': 57, 'bear_use_sma': False, 'bear_use_ema': True, 'bear_use_atr': False, 'bear_use_adx': True, 'bear_use_spike': True, 'bear_rsi_required': True, 'sideways_strategy': 'breakout', 'sideways_bb_std_mult': 3.1030926324122383, 'sideways_rsi_os': 47, 'sideways_rsi_ob': 89, 'sideways_adx_thresh': 32.138759851851816, 'sideways_atr_min_pct': 0.006261298846916102, 'sideways_atr_max_pct': 0.027811601052225438, 'sideways_tp_mult': 1.6762781470451997, 'sideways_tsl_mult': 0.7660515943894806, 'sideways_time_stop': 187, 'sideways_use_sma': True, 'sideways_use_ema': False, 'sideways_use_atr': False, 'sideways_use_adx': True, 'sideways_use_spike': False, 'sideways_rsi_required': False}.
[I 2025-08-29 20:23:28,319] Trial 387 finished with values: [-0.010341659384906055, 0.010305603939444423] and parameters: {'p_sma': 31, 'p_std': 14, 'p_atr': 11, 'p_adx': 14, 'rsi_period': 40, 'ema1': 26, 'ema2': 46, 'slip_atr_k': 0.01211316374665635, 'slip_spread_k': 0.18280616552104426, 'spread_hl_frac': 0.04991470910720266, 'bb_std_mult': 1.6862267450025454, 'rsi_os': 10, 'rsi_ob': 83, 'vol_spike': 0.1405692358097492, 'adx_thresh': 11.80598140509532, 'atr_min_pct': 0.021004452112532254, 'atr_max_pct': 0.1432597371224536, 'tp_mult': 1.2804081032163201, 'tsl_mult': 0.9442713325359875, 'strategy': 'mean_reversion', 'time_stop': 162, 'use_sma': True, 'use_atr': False, 'use_adx': False, 'use_ema': True, 'use_spike': False, 'rsi_required': False, 'edge_k': 1.9850311448231333, 'edge_cap': 0.7443753837905582, 'bull_strategy': 'mean_reversion', 'bull_bb_std_mult': 2.9847506959862065, 'bull_rsi_os': 19, 'bull_rsi_ob': 70, 'bull_adx_thresh': 13.478966544390167, 'bull_atr_min_pct': 0.01868201198597371, 'bull_atr_max_pct': 0.09292765660587503, 'bull_tp_mult': 2.7436478615856092, 'bull_tsl_mult': 0.9004038773629166, 'bull_time_stop': 39, 'bull_use_sma': True, 'bull_use_ema': False, 'bull_use_atr': True, 'bull_use_adx': False, 'bull_use_spike': True, 'bull_rsi_required': False, 'bear_strategy': 'breakout', 'bear_bb_std_mult': 3.471020211536917, 'bear_rsi_os': 55, 'bear_rsi_ob': 77, 'bear_adx_thresh': 23.019614022832968, 'bear_atr_min_pct': 0.0068475098716378364, 'bear_atr_max_pct': 0.06124891752864545, 'bear_tp_mult': 2.4412930004875277, 'bear_tsl_mult': 0.9586281951892437, 'bear_time_stop': 58, 'bear_use_sma': False, 'bear_use_ema': True, 'bear_use_atr': False, 'bear_use_adx': True, 'bear_use_spike': True, 'bear_rsi_required': True, 'sideways_strategy': 'breakout', 'sideways_bb_std_mult': 2.8946611250625853, 'sideways_rsi_os': 47, 'sideways_rsi_ob': 48, 'sideways_adx_thresh': 15.702633876796984, 'sideways_atr_min_pct': 0.004346552082784309, 'sideways_atr_max_pct': 0.02579028762001606, 'sideways_tp_mult': 1.812095818901792, 'sideways_tsl_mult': 0.751405859179504, 'sideways_time_stop': 189, 'sideways_use_sma': True, 'sideways_use_ema': False, 'sideways_use_atr': False, 'sideways_use_adx': True, 'sideways_use_spike': False, 'sideways_rsi_required': False}.
[I 2025-08-29 20:23:58,618] Trial 391 finished with values: [-1000000000.0, 1000000000.0] and parameters: {'p_sma': 18, 'p_std': 45, 'p_atr': 28, 'p_adx': 11, 'rsi_period': 43, 'ema1': 28, 'ema2': 44, 'slip_atr_k': 0.012044522301162194, 'slip_spread_k': 0.18791960189136198, 'spread_hl_frac': 0.04750619110084237, 'bb_std_mult': 1.702022914474309, 'rsi_os': 7, 'rsi_ob': 82, 'vol_spike': 0.1837241043284746, 'adx_thresh': 13.917879098613676, 'atr_min_pct': 0.01927777144923763, 'atr_max_pct': 0.028607092401504598, 'tp_mult': 1.3961609197567362, 'tsl_mult': 0.8763222044078921, 'strategy': 'mean_reversion', 'time_stop': 160, 'use_sma': True, 'use_atr': False, 'use_adx': False, 'use_ema': True, 'use_spike': False, 'rsi_required': False, 'edge_k': 1.9726105102236242, 'edge_cap': 0.7477133824729394, 'bull_strategy': 'mean_reversion', 'bull_bb_std_mult': 2.2840944811881827, 'bull_rsi_os': 6, 'bull_rsi_ob': 76, 'bull_adx_thresh': 15.223787123531554, 'bull_atr_min_pct': 0.01500686741083249, 'bull_atr_max_pct': 0.09683901266034196, 'bull_tp_mult': 2.6638779012849865, 'bull_tsl_mult': 0.8415194782707067, 'bull_time_stop': 34, 'bull_use_sma': True, 'bull_use_ema': False, 'bull_use_atr': True, 'bull_use_adx': False, 'bull_use_spike': True, 'bull_rsi_required': False, 'bear_strategy': 'breakout', 'bear_bb_std_mult': 1.815293957338132, 'bear_rsi_os': 16, 'bear_rsi_ob': 93, 'bear_adx_thresh': 20.55539591813494, 'bear_atr_min_pct': 0.006594506452826208, 'bear_atr_max_pct': 0.05916385657809675, 'bear_tp_mult': 2.732563724043409, 'bear_tsl_mult': 0.9999262441051817, 'bear_time_stop': 58, 'bear_use_sma': False, 'bear_use_ema': True, 'bear_use_atr': False, 'bear_use_adx': True, 'bear_use_spike': True, 'bear_rsi_required': False, 'sideways_strategy': 'breakout', 'sideways_bb_std_mult': 3.1539535049613656, 'sideways_rsi_os': 49, 'sideways_rsi_ob': 79, 'sideways_adx_thresh': 33.532420085142114, 'sideways_atr_min_pct': 0.005368386607250482, 'sideways_atr_max_pct': 0.02472444294087292, 'sideways_tp_mult': 1.0179893746244923, 'sideways_tsl_mult': 0.7045885677303233, 'sideways_time_stop': 91, 'sideways_use_sma': False, 'sideways_use_ema': False, 'sideways_use_atr': False, 'sideways_use_adx': True, 'sideways_use_spike': False, 'sideways_rsi_required': False}.
[I 2025-08-29 20:23:59,212] Trial 392 finished with values: [-1000000000.0, 1000000000.0] and parameters: {'p_sma': 18, 'p_std': 44, 'p_atr': 25, 'p_adx': 14, 'rsi_period': 43, 'ema1': 30, 'ema2': 44, 'slip_atr_k': 1.355715633346937e-06, 'slip_spread_k': 0.1888676040355648, 'spread_hl_frac': 0.04805326072741853, 'bb_std_mult': 1.698549615621213, 'rsi_os': 14, 'rsi_ob': 82, 'vol_spike': 0.09418748024198038, 'adx_thresh': 13.969082148120957, 'atr_min_pct': 0.025924427655732607, 'atr_max_pct': 0.027698650183949566, 'tp_mult': 1.1790369933773794, 'tsl_mult': 0.9050358758688499, 'strategy': 'mean_reversion', 'time_stop': 160, 'use_sma': True, 'use_atr': False, 'use_adx': False, 'use_ema': True, 'use_spike': False, 'rsi_required': False, 'edge_k': 0.3569640884010431, 'edge_cap': 0.6696299247104932, 'bull_strategy': 'mean_reversion', 'bull_bb_std_mult': 2.7904641663209073, 'bull_rsi_os': 8, 'bull_rsi_ob': 73, 'bull_adx_thresh': 15.434938623811266, 'bull_atr_min_pct': 0.014915266836951706, 'bull_atr_max_pct': 0.09443456345474943, 'bull_tp_mult': 2.662086278418071, 'bull_tsl_mult': 0.40751786891446334, 'bull_time_stop': 38, 'bull_use_sma': True, 'bull_use_ema': False, 'bull_use_atr': True, 'bull_use_adx': False, 'bull_use_spike': True, 'bull_rsi_required': False, 'bear_strategy': 'breakout', 'bear_bb_std_mult': 0.6274044219579815, 'bear_rsi_os': 9, 'bear_rsi_ob': 83, 'bear_adx_thresh': 20.50309737299319, 'bear_atr_min_pct': 0.006394345762821696, 'bear_atr_max_pct': 0.08153959270957936, 'bear_tp_mult': 2.737220618274625, 'bear_tsl_mult': 0.909772311050282, 'bear_time_stop': 57, 'bear_use_sma': False, 'bear_use_ema': True, 'bear_use_atr': False, 'bear_use_adx': True, 'bear_use_spike': True, 'bear_rsi_required': False, 'sideways_strategy': 'breakout', 'sideways_bb_std_mult': 2.5586290434205736, 'sideways_rsi_os': 49, 'sideways_rsi_ob': 79, 'sideways_adx_thresh': 33.56764471281562, 'sideways_atr_min_pct': 0.005310841528330965, 'sideways_atr_max_pct': 0.0919828527349063, 'sideways_tp_mult': 1.417385679414013, 'sideways_tsl_mult': 0.7011715538482453, 'sideways_time_stop': 22, 'sideways_use_sma': False, 'sideways_use_ema': False, 'sideways_use_atr': False, 'sideways_use_adx': True, 'sideways_use_spike': False, 'sideways_rsi_required': False}.
[I 2025-08-29 20:23:59,340] Trial 393 finished with values: [-1000000000.0, 1000000000.0] and parameters: {'p_sma': 18, 'p_std': 55, 'p_atr': 28, 'p_adx': 13, 'rsi_period': 60, 'ema1': 30, 'ema2': 10, 'slip_atr_k': 0.21983368539017883, 'slip_spread_k': 0.187431998593578, 'spread_hl_frac': 0.04736824529138577, 'bb_std_mult': 1.6345441885869159, 'rsi_os': 14, 'rsi_ob': 89, 'vol_spike': 0.18158497855477918, 'adx_thresh': 13.872186309439975, 'atr_min_pct': 0.019480087912467376, 'atr_max_pct': 0.06847040392642093, 'tp_mult': 1.1457864586390625, 'tsl_mult': 0.8810701932492985, 'strategy': 'mean_reversion', 'time_stop': 171, 'use_sma': True, 'use_atr': False, 'use_adx': False, 'use_ema': True, 'use_spike': False, 'rsi_required': False, 'edge_k': 0.2199388656422988, 'edge_cap': 0.6723401317658553, 'bull_strategy': 'mean_reversion', 'bull_bb_std_mult': 3.557781428152137, 'bull_rsi_os': 5, 'bull_rsi_ob': 77, 'bull_adx_thresh': 15.46780001735244, 'bull_atr_min_pct': 0.01486127733326497, 'bull_atr_max_pct': 0.08633210653099484, 'bull_tp_mult': 2.6737820741041465, 'bull_tsl_mult': 0.4129119929976009, 'bull_time_stop': 29, 'bull_use_sma': True, 'bull_use_ema': False, 'bull_use_atr': True, 'bull_use_adx': False, 'bull_use_spike': True, 'bull_rsi_required': False, 'bear_strategy': 'breakout', 'bear_bb_std_mult': 2.706028704410832, 'bear_rsi_os': 36, 'bear_rsi_ob': 55, 'bear_adx_thresh': 21.033292178988983, 'bear_atr_min_pct': 0.027150062335710448, 'bear_atr_max_pct': 0.025362195976128012, 'bear_tp_mult': 2.293457854226852, 'bear_tsl_mult': 0.9089465970236527, 'bear_time_stop': 46, 'bear_use_sma': False, 'bear_use_ema': True, 'bear_use_atr': False, 'bear_use_adx': True, 'bear_use_spike': True, 'bear_rsi_required': False, 'sideways_strategy': 'breakout', 'sideways_bb_std_mult': 2.289774438200504, 'sideways_rsi_os': 49, 'sideways_rsi_ob': 79, 'sideways_adx_thresh': 6.994534857934754, 'sideways_atr_min_pct': 0.02646373316838287, 'sideways_atr_max_pct': 0.0892306812326622, 'sideways_tp_mult': 1.0196820843168688, 'sideways_tsl_mult': 0.7087858626897584, 'sideways_time_stop': 90, 'sideways_use_sma': False, 'sideways_use_ema': False, 'sideways_use_atr': False, 'sideways_use_adx': False, 'sideways_use_spike': False, 'sideways_rsi_required': False}.
[I 2025-08-29 20:23:59,451] Trial 394 finished with values: [-0.0021198802767208313, 0.002164919968177256] and parameters: {'p_sma': 49, 'p_std': 55, 'p_atr': 12, 'p_adx': 13, 'rsi_period': 38, 'ema1': 28, 'ema2': 34, 'slip_atr_k': 0.005575077566785769, 'slip_spread_k': 0.09906275107390292, 'spread_hl_frac': 0.04700230540417322, 'bb_std_mult': 1.6093971235508084, 'rsi_os': 14, 'rsi_ob': 82, 'vol_spike': 0.17774985104396618, 'adx_thresh': 12.538706611171813, 'atr_min_pct': 0.01933816077028923, 'atr_max_pct': 0.10635668039102528, 'tp_mult': 1.1923163525289469, 'tsl_mult': 0.05499184707810223, 'strategy': 'mean_reversion', 'time_stop': 169, 'use_sma': True, 'use_atr': False, 'use_adx': False, 'use_ema': True, 'use_spike': False, 'rsi_required': False, 'edge_k': 1.0723698672572732, 'edge_cap': 0.6664114783833501, 'bull_strategy': 'mean_reversion', 'bull_bb_std_mult': 3.128864804793734, 'bull_rsi_os': 6, 'bull_rsi_ob': 76, 'bull_adx_thresh': 15.32131700079739, 'bull_atr_min_pct': 0.009653888481301068, 'bull_atr_max_pct': 0.08712392174495512, 'bull_tp_mult': 2.869131138600834, 'bull_tsl_mult': 0.845052863174882, 'bull_time_stop': 29, 'bull_use_sma': True, 'bull_use_ema': False, 'bull_use_atr': True, 'bull_use_adx': False, 'bull_use_spike': True, 'bull_rsi_required': False, 'bear_strategy': 'breakout', 'bear_bb_std_mult': 0.599905828413714, 'bear_rsi_os': 9, 'bear_rsi_ob': 83, 'bear_adx_thresh': 20.597077076159128, 'bear_atr_min_pct': 0.006024307026533269, 'bear_atr_max_pct': 0.02474325981830416, 'bear_tp_mult': 2.6674472252269905, 'bear_tsl_mult': 0.924290410361118, 'bear_time_stop': 54, 'bear_use_sma': False, 'bear_use_ema': True, 'bear_use_atr': False, 'bear_use_adx': True, 'bear_use_spike': True, 'bear_rsi_required': False, 'sideways_strategy': 'breakout', 'sideways_bb_std_mult': 2.3144921216204493, 'sideways_rsi_os': 50, 'sideways_rsi_ob': 79, 'sideways_adx_thresh': 33.25339460532249, 'sideways_atr_min_pct': 0.005389510899848476, 'sideways_atr_max_pct': 0.01995093010665335, 'sideways_tp_mult': 1.0148892307921373, 'sideways_tsl_mult': 0.7060433352227033, 'sideways_time_stop': 10, 'sideways_use_sma': False, 'sideways_use_ema': False, 'sideways_use_atr': False, 'sideways_use_adx': False, 'sideways_use_spike': False, 'sideways_rsi_required': False}.
[I 2025-08-29 20:24:00,014] Trial 397 finished with values: [-1000000000.0, 1000000000.0] and parameters: {'p_sma': 51, 'p_std': 57, 'p_atr': 12, 'p_adx': 13, 'rsi_period': 37, 'ema1': 29, 'ema2': 29, 'slip_atr_k': 0.23984049543898653, 'slip_spread_k': 0.09603503225374393, 'spread_hl_frac': 0.04886058449289146, 'bb_std_mult': 1.6064958119497494, 'rsi_os': 13, 'rsi_ob': 46, 'vol_spike': 0.1774046018361369, 'adx_thresh': 12.794088824864518, 'atr_min_pct': 0.02199785936908784, 'atr_max_pct': 0.01363681929210693, 'tp_mult': 1.2158276662834033, 'tsl_mult': 0.8644769173703983, 'strategy': 'breakout', 'time_stop': 229, 'use_sma': True, 'use_atr': False, 'use_adx': False, 'use_ema': True, 'use_spike': True, 'rsi_required': False, 'edge_k': 1.0832373592776505, 'edge_cap': 0.5959320383932106, 'bull_strategy': 'mean_reversion', 'bull_bb_std_mult': 1.9387442310657708, 'bull_rsi_os': 11, 'bull_rsi_ob': 57, 'bull_adx_thresh': 14.490290465687533, 'bull_atr_min_pct': 0.009759520157805894, 'bull_atr_max_pct': 0.0882936202593113, 'bull_tp_mult': 2.8766503844176734, 'bull_tsl_mult': 0.8560025570546297, 'bull_time_stop': 28, 'bull_use_sma': True, 'bull_use_ema': False, 'bull_use_atr': True, 'bull_use_adx': False, 'bull_use_spike': True, 'bull_rsi_required': False, 'bear_strategy': 'breakout', 'bear_bb_std_mult': 2.937955063810874, 'bear_rsi_os': 27, 'bear_rsi_ob': 91, 'bear_adx_thresh': 22.02111220504188, 'bear_atr_min_pct': 0.016431792952356892, 'bear_atr_max_pct': 0.06834914407326154, 'bear_tp_mult': 2.6657713466760615, 'bear_tsl_mult': 0.926750637363258, 'bear_time_stop': 42, 'bear_use_sma': False, 'bear_use_ema': True, 'bear_use_atr': False, 'bear_use_adx': True, 'bear_use_spike': True, 'bear_rsi_required': False, 'sideways_strategy': 'breakout', 'sideways_bb_std_mult': 2.4667844989557217, 'sideways_rsi_os': 46, 'sideways_rsi_ob': 45, 'sideways_adx_thresh': 33.01806104966875, 'sideways_atr_min_pct': 0.0039031221674097824, 'sideways_atr_max_pct': 0.01843643628180839, 'sideways_tp_mult': 1.1251308740328267, 'sideways_tsl_mult': 0.7326487523813935, 'sideways_time_stop': 203, 'sideways_use_sma': False, 'sideways_use_ema': False, 'sideways_use_atr': False, 'sideways_use_adx': False, 'sideways_use_spike': False, 'sideways_rsi_required': False}.
