[I 2025-08-29 19:58:39,129] Trial 189 finished with values: [-1000000000.0, 1000000000.0] and parameters: {'p_sma': 39, 'p_std': 53, 'p_atr': 30, 'p_adx': 29, 'rsi_period': 49, 'ema1': 29, 'ema2': 40, 'slip_atr_k': 0.07014218582813359, 'slip_spread_k': 0.7501306529705543, 'spread_hl_frac': 0.0291249860694811, 'bb_std_mult': 1.3511420387976707, 'rsi_os': 41, 'rsi_ob': 66, 'vol_spike': 0.16896412556219387, 'adx_thresh': 6.696137618323744, 'atr_min_pct': 0.013607274421005577, 'atr_max_pct': 0.13717079915146935, 'tp_mult': 2.675411319154851, 'tsl_mult': 0.3133047378761725, 'strategy': 'mean_reversion', 'time_stop': 96, 'use_sma': False, 'use_atr': False, 'use_adx': True, 'use_ema': False, 'use_spike': False, 'rsi_required': True, 'edge_k': 0.4561945036604861, 'edge_cap': 0.9157324216152982, 'bull_strategy': 'mean_reversion', 'bull_bb_std_mult': 0.8244109146388688, 'bull_rsi_os': 44, 'bull_rsi_ob': 92, 'bull_adx_thresh': 19.779973752285027, 'bull_atr_min_pct': 0.02226570919271282, 'bull_atr_max_pct': 0.06971536977417275, 'bull_tp_mult': 1.6072363562167862, 'bull_tsl_mult': 0.6154851782011352, 'bull_time_stop': 144, 'bull_use_sma': True, 'bull_use_ema': True, 'bull_use_atr': False, 'bull_use_adx': True, 'bull_use_spike': True, 'bull_rsi_required': False, 'bear_strategy': 'mean_reversion', 'bear_bb_std_mult': 1.9884745912931137, 'bear_rsi_os': 37, 'bear_rsi_ob': 54, 'bear_adx_thresh': 24.19607073385956, 'bear_atr_min_pct': 0.006599739676998852, 'bear_atr_max_pct': 0.11635274471605028, 'bear_tp_mult': 1.761389100675392, 'bear_tsl_mult': 0.28743101317336517, 'bear_time_stop': 16, 'bear_use_sma': False, 'bear_use_ema': False, 'bear_use_atr': True, 'bear_use_adx': False, 'bear_use_spike': False, 'bear_rsi_required': False, 'sideways_strategy': 'breakout', 'sideways_bb_std_mult': 3.046557288127546, 'sideways_rsi_os': 31, 'sideways_rsi_ob': 83, 'sideways_adx_thresh': 29.44630090162616, 'sideways_atr_min_pct': 0.014459264858129808, 'sideways_atr_max_pct': 0.08427653894341239, 'sideways_tp_mult': 2.1973880410908793, 'sideways_tsl_mult': 0.22844588670026236, 'sideways_time_stop': 166, 'sideways_use_sma': True, 'sideways_use_ema': True, 'sideways_use_atr': True, 'sideways_use_adx': False, 'sideways_use_spike': True, 'sideways_rsi_required': True}.
[I 2025-08-29 19:58:39,326] Trial 190 finished with values: [-1000000000.0, 1000000000.0] and parameters: {'p_sma': 58, 'p_std': 32, 'p_atr': 27, 'p_adx': 20, 'rsi_period': 20, 'ema1': 11, 'ema2': 24, 'slip_atr_k': 0.1173631193995468, 'slip_spread_k': 0.2818247111296823, 'spread_hl_frac': 0.02954032176341593, 'bb_std_mult': 1.1556918133376444, 'rsi_os': 41, 'rsi_ob': 67, 'vol_spike': 0.16754515550605928, 'adx_thresh': 33.72143719158669, 'atr_min_pct': 0.029083214712137345, 'atr_max_pct': 0.13637271635077272, 'tp_mult': 2.7260041275874918, 'tsl_mult': 0.583884877512595, 'strategy': 'breakout', 'time_stop': 111, 'use_sma': False, 'use_atr': False, 'use_adx': True, 'use_ema': False, 'use_spike': False, 'rsi_required': True, 'edge_k': 1.4399575413593408, 'edge_cap': 0.43633729041639563, 'bull_strategy': 'mean_reversion', 'bull_bb_std_mult': 2.7070942046964475, 'bull_rsi_os': 43, 'bull_rsi_ob': 92, 'bull_adx_thresh': 19.714325198079028, 'bull_atr_min_pct': 0.019453826207110683, 'bull_atr_max_pct': 0.06814354788062256, 'bull_tp_mult': 2.2118773744707725, 'bull_tsl_mult': 0.23393295106596193, 'bull_time_stop': 146, 'bull_use_sma': True, 'bull_use_ema': True, 'bull_use_atr': False, 'bull_use_adx': True, 'bull_use_spike': True, 'bull_rsi_required': False, 'bear_strategy': 'mean_reversion', 'bear_bb_std_mult': 1.1031865436210833, 'bear_rsi_os': 43, 'bear_rsi_ob': 66, 'bear_adx_thresh': 11.356570248149852, 'bear_atr_min_pct': 0.0194574632259866, 'bear_atr_max_pct': 0.11574593265807488, 'bear_tp_mult': 1.7483760740363672, 'bear_tsl_mult': 0.35964668857952836, 'bear_time_stop': 18, 'bear_use_sma': False, 'bear_use_ema': False, 'bear_use_atr': True, 'bear_use_adx': False, 'bear_use_spike': False, 'bear_rsi_required': False, 'sideways_strategy': 'breakout', 'sideways_bb_std_mult': 3.2648556805715403, 'sideways_rsi_os': 55, 'sideways_rsi_ob': 80, 'sideways_adx_thresh': 29.30255744800543, 'sideways_atr_min_pct': 0.014473194818925478, 'sideways_atr_max_pct': 0.047871494131405054, 'sideways_tp_mult': 2.229007073991932, 'sideways_tsl_mult': 0.517427059179262, 'sideways_time_stop': 263, 'sideways_use_sma': True, 'sideways_use_ema': True, 'sideways_use_atr': True, 'sideways_use_adx': False, 'sideways_use_spike': True, 'sideways_rsi_required': False}.
[I 2025-08-29 19:59:09,454] Trial 193 finished with values: [-0.002449593744083156, 0.0024311798804838923] and parameters: {'p_sma': 39, 'p_std': 40, 'p_atr': 24, 'p_adx': 20, 'rsi_period': 19, 'ema1': 23, 'ema2': 13, 'slip_atr_k': 0.1459025236737634, 'slip_spread_k': 0.2771387678730438, 'spread_hl_frac': 0.023093076833029143, 'bb_std_mult': 1.1513826490015335, 'rsi_os': 53, 'rsi_ob': 69, 'vol_spike': 0.15357599358217017, 'adx_thresh': 32.98101467164981, 'atr_min_pct': 0.008423053904850784, 'atr_max_pct': 0.07729707092698707, 'tp_mult': 2.7592937071245474, 'tsl_mult': 0.0005115399499927009, 'strategy': 'breakout', 'time_stop': 116, 'use_sma': True, 'use_atr': True, 'use_adx': True, 'use_ema': False, 'use_spike': True, 'rsi_required': True, 'edge_k': 1.3172412487365, 'edge_cap': 0.6221830905231172, 'bull_strategy': 'breakout', 'bull_bb_std_mult': 0.9415914500261864, 'bull_rsi_os': 53, 'bull_rsi_ob': 94, 'bull_adx_thresh': 6.3583631650743655, 'bull_atr_min_pct': 0.02909456104012021, 'bull_atr_max_pct': 0.1095982899889473, 'bull_tp_mult': 1.4691631327694141, 'bull_tsl_mult': 0.23059783018006574, 'bull_time_stop': 252, 'bull_use_sma': False, 'bull_use_ema': True, 'bull_use_atr': False, 'bull_use_adx': True, 'bull_use_spike': False, 'bull_rsi_required': True, 'bear_strategy': 'mean_reversion', 'bear_bb_std_mult': 1.5788251422451944, 'bear_rsi_os': 27, 'bear_rsi_ob': 86, 'bear_adx_thresh': 6.242702554074698, 'bear_atr_min_pct': 0.007381358265445474, 'bear_atr_max_pct': 0.10985859901229385, 'bear_tp_mult': 1.4022889622611487, 'bear_tsl_mult': 0.6872900438738855, 'bear_time_stop': 5, 'bear_use_sma': True, 'bear_use_ema': False, 'bear_use_atr': True, 'bear_use_adx': False, 'bear_use_spike': False, 'bear_rsi_required': False, 'sideways_strategy': 'mean_reversion', 'sideways_bb_std_mult': 3.380442424397941, 'sideways_rsi_os': 42, 'sideways_rsi_ob': 58, 'sideways_adx_thresh': 30.086913425701958, 'sideways_atr_min_pct': 0.0013367397235684395, 'sideways_atr_max_pct': 0.07495023390688679, 'sideways_tp_mult': 2.0900856498030698, 'sideways_tsl_mult': 0.5052587506473982, 'sideways_time_stop': 282, 'sideways_use_sma': False, 'sideways_use_ema': True, 'sideways_use_atr': True, 'sideways_use_adx': False, 'sideways_use_spike': False, 'sideways_rsi_required': False}.
[I 2025-08-29 19:59:09,823] Trial 192 finished with values: [-1000000000.0, 1000000000.0] and parameters: {'p_sma': 7, 'p_std': 32, 'p_atr': 8, 'p_adx': 29, 'rsi_period': 19, 'ema1': 11, 'ema2': 58, 'slip_atr_k': 0.06762074457441015, 'slip_spread_k': 0.2724402548070803, 'spread_hl_frac': 0.022764511494520245, 'bb_std_mult': 2.331768642275476, 'rsi_os': 50, 'rsi_ob': 66, 'vol_spike': 0.1668351456758229, 'adx_thresh': 32.96815600301027, 'atr_min_pct': 0.013706981522975628, 'atr_max_pct': 0.07720038497427956, 'tp_mult': 2.0112892522908536, 'tsl_mult': 0.5662442756332517, 'strategy': 'breakout', 'time_stop': 111, 'use_sma': True, 'use_atr': True, 'use_adx': True, 'use_ema': False, 'use_spike': True, 'rsi_required': True, 'edge_k': 1.185050733795991, 'edge_cap': 0.522053985259774, 'bull_strategy': 'mean_reversion', 'bull_bb_std_mult': 0.8187773810656376, 'bull_rsi_os': 12, 'bull_rsi_ob': 92, 'bull_adx_thresh': 6.3363740159809865, 'bull_atr_min_pct': 0.028905313013574706, 'bull_atr_max_pct': 0.017671534328247265, 'bull_tp_mult': 2.4293925138051176, 'bull_tsl_mult': 0.6257546442959377, 'bull_time_stop': 252, 'bull_use_sma': True, 'bull_use_ema': True, 'bull_use_atr': False, 'bull_use_adx': True, 'bull_use_spike': True, 'bull_rsi_required': False, 'bear_strategy': 'mean_reversion', 'bear_bb_std_mult': 1.1042742085246262, 'bear_rsi_os': 43, 'bear_rsi_ob': 86, 'bear_adx_thresh': 6.441618759072178, 'bear_atr_min_pct': 0.007520185972617509, 'bear_atr_max_pct': 0.06816640443143009, 'bear_tp_mult': 1.7553676213136489, 'bear_tsl_mult': 0.902081893017449, 'bear_time_stop': 5, 'bear_use_sma': True, 'bear_use_ema': False, 'bear_use_atr': True, 'bear_use_adx': False, 'bear_use_spike': False, 'bear_rsi_required': False, 'sideways_strategy': 'mean_reversion', 'sideways_bb_std_mult': 3.4031734354215772, 'sideways_rsi_os': 28, 'sideways_rsi_ob': 84, 'sideways_adx_thresh': 30.10335037184827, 'sideways_atr_min_pct': 0.012287792512375623, 'sideways_atr_max_pct': 0.07525041686337662, 'sideways_tp_mult': 2.207772880576816, 'sideways_tsl_mult': 0.5082896854895835, 'sideways_time_stop': 262, 'sideways_use_sma': True, 'sideways_use_ema': True, 'sideways_use_atr': True, 'sideways_use_adx': False, 'sideways_use_spike': False, 'sideways_rsi_required': False}.
[I 2025-08-29 19:59:10,108] Trial 194 finished with values: [-1000000000.0, 1000000000.0] and parameters: {'p_sma': 38, 'p_std': 38, 'p_atr': 24, 'p_adx': 14, 'rsi_period': 23, 'ema1': 25, 'ema2': 58, 'slip_atr_k': 0.1437816587080949, 'slip_spread_k': 0.2747230427826274, 'spread_hl_frac': 0.011908725847769428, 'bb_std_mult': 2.0494976010594352, 'rsi_os': 53, 'rsi_ob': 69, 'vol_spike': 0.1521239681320232, 'adx_thresh': 33.37077699676809, 'atr_min_pct': 0.01409431801717499, 'atr_max_pct': 0.08398735901836506, 'tp_mult': 2.36762502267346, 'tsl_mult': 0.06629749004837043, 'strategy': 'breakout', 'time_stop': 298, 'use_sma': True, 'use_atr': True, 'use_adx': False, 'use_ema': False, 'use_spike': True, 'rsi_required': True, 'edge_k': 0.1737282128944745, 'edge_cap': 0.9467244099307017, 'bull_strategy': 'breakout', 'bull_bb_std_mult': 0.7748600735608513, 'bull_rsi_os': 13, 'bull_rsi_ob': 94, 'bull_adx_thresh': 6.15817809561946, 'bull_atr_min_pct': 0.012291005250507065, 'bull_atr_max_pct': 0.11048805649944794, 'bull_tp_mult': 1.4925778674739432, 'bull_tsl_mult': 0.18503886513364606, 'bull_time_stop': 286, 'bull_use_sma': False, 'bull_use_ema': True, 'bull_use_atr': False, 'bull_use_adx': True, 'bull_use_spike': False, 'bull_rsi_required': True, 'bear_strategy': 'breakout', 'bear_bb_std_mult': 3.00905739087309, 'bear_rsi_os': 30, 'bear_rsi_ob': 86, 'bear_adx_thresh': 29.767160420890274, 'bear_atr_min_pct': 0.021181970038255424, 'bear_atr_max_pct': 0.11175343582126113, 'bear_tp_mult': 2.4655378107569383, 'bear_tsl_mult': 0.1774715612695848, 'bear_time_stop': 9, 'bear_use_sma': True, 'bear_use_ema': False, 'bear_use_atr': True, 'bear_use_adx': False, 'bear_use_spike': False, 'bear_rsi_required': False, 'sideways_strategy': 'mean_reversion', 'sideways_bb_std_mult': 2.0739122871729903, 'sideways_rsi_os': 28, 'sideways_rsi_ob': 57, 'sideways_adx_thresh': 30.23000742330819, 'sideways_atr_min_pct': 0.01583893829167943, 'sideways_atr_max_pct': 0.013922911217604514, 'sideways_tp_mult': 2.1450538055843986, 'sideways_tsl_mult': 0.3543548502416904, 'sideways_time_stop': 246, 'sideways_use_sma': False, 'sideways_use_ema': True, 'sideways_use_atr': False, 'sideways_use_adx': False, 'sideways_use_spike': False, 'sideways_rsi_required': False}.
[I 2025-08-29 19:59:10,204] Trial 191 finished with values: [-1000000000.0, 1000000000.0] and parameters: {'p_sma': 26, 'p_std': 37, 'p_atr': 24, 'p_adx': 20, 'rsi_period': 19, 'ema1': 11, 'ema2': 49, 'slip_atr_k': 0.036065799409224504, 'slip_spread_k': 0.1958065953384249, 'spread_hl_frac': 0.03062768326908708, 'bb_std_mult': 2.0667076606467045, 'rsi_os': 41, 'rsi_ob': 66, 'vol_spike': 0.16761030283346004, 'adx_thresh': 33.87493728340534, 'atr_min_pct': 0.007454062088356919, 'atr_max_pct': 0.13687053185111292, 'tp_mult': 2.6646618630077574, 'tsl_mult': 0.8653307831846802, 'strategy': 'breakout', 'time_stop': 111, 'use_sma': True, 'use_atr': False, 'use_adx': True, 'use_ema': False, 'use_spike': False, 'rsi_required': True, 'edge_k': 1.1818683631755815, 'edge_cap': 0.9481755260734873, 'bull_strategy': 'mean_reversion', 'bull_bb_std_mult': 2.326398757752862, 'bull_rsi_os': 11, 'bull_rsi_ob': 94, 'bull_adx_thresh': 6.418747602654948, 'bull_atr_min_pct': 0.029111560999109942, 'bull_atr_max_pct': 0.01897832096728165, 'bull_tp_mult': 1.4671039441282065, 'bull_tsl_mult': 0.23152022379919227, 'bull_time_stop': 294, 'bull_use_sma': True, 'bull_use_ema': True, 'bull_use_atr': False, 'bull_use_adx': True, 'bull_use_spike': True, 'bull_rsi_required': True, 'bear_strategy': 'mean_reversion', 'bear_bb_std_mult': 1.0974326548704865, 'bear_rsi_os': 20, 'bear_rsi_ob': 54, 'bear_adx_thresh': 6.218475723547294, 'bear_atr_min_pct': 0.02101666061470921, 'bear_atr_max_pct': 0.06917594635403673, 'bear_tp_mult': 1.7622757712883337, 'bear_tsl_mult': 0.2832638559743001, 'bear_time_stop': 106, 'bear_use_sma': False, 'bear_use_ema': False, 'bear_use_atr': True, 'bear_use_adx': False, 'bear_use_spike': False, 'bear_rsi_required': False, 'sideways_strategy': 'mean_reversion', 'sideways_bb_std_mult': 0.5184562771647021, 'sideways_rsi_os': 55, 'sideways_rsi_ob': 80, 'sideways_adx_thresh': 29.50723659294634, 'sideways_atr_min_pct': 0.0016759030826915145, 'sideways_atr_max_pct': 0.07352426223617928, 'sideways_tp_mult': 2.20454650059328, 'sideways_tsl_mult': 0.3511546894184169, 'sideways_time_stop': 261, 'sideways_use_sma': True, 'sideways_use_ema': True, 'sideways_use_atr': True, 'sideways_use_adx': False, 'sideways_use_spike': True, 'sideways_rsi_required': False}.
[I 2025-08-29 19:59:10,674] Trial 196 finished with values: [-1000000000.0, 1000000000.0] and parameters: {'p_sma': 50, 'p_std': 37, 'p_atr': 24, 'p_adx': 14, 'rsi_period': 23, 'ema1': 25, 'ema2': 41, 'slip_atr_k': 0.1463293893121635, 'slip_spread_k': 0.2126363846258896, 'spread_hl_frac': 0.024195900881801194, 'bb_std_mult': 1.2196348740401435, 'rsi_os': 53, 'rsi_ob': 69, 'vol_spike': 0.15635938839800567, 'adx_thresh': 20.89186582870832, 'atr_min_pct': 0.00782038623895, 'atr_max_pct': 0.08336862085419067, 'tp_mult': 2.3630499635751576, 'tsl_mult': 0.6300133292647436, 'strategy': 'mean_reversion', 'time_stop': 103, 'use_sma': True, 'use_atr': True, 'use_adx': False, 'use_ema': False, 'use_spike': False, 'rsi_required': False, 'edge_k': 0.06177654129105192, 'edge_cap': 0.6273928639192881, 'bull_strategy': 'breakout', 'bull_bb_std_mult': 0.7585676739676986, 'bull_rsi_os': 43, 'bull_rsi_ob': 94, 'bull_adx_thresh': 7.956851973346813, 'bull_atr_min_pct': 0.016685686677960377, 'bull_atr_max_pct': 0.057761909486339684, 'bull_tp_mult': 2.285137904664725, 'bull_tsl_mult': 0.1754123386969499, 'bull_time_stop': 290, 'bull_use_sma': False, 'bull_use_ema': True, 'bull_use_atr': False, 'bull_use_adx': True, 'bull_use_spike': False, 'bull_rsi_required': True, 'bear_strategy': 'breakout', 'bear_bb_std_mult': 2.891297732309628, 'bear_rsi_os': 26, 'bear_rsi_ob': 64, 'bear_adx_thresh': 6.05288506037195, 'bear_atr_min_pct': 0.007170231013883918, 'bear_atr_max_pct': 0.10952465056962071, 'bear_tp_mult': 1.8192882960958408, 'bear_tsl_mult': 0.683946051859077, 'bear_time_stop': 24, 'bear_use_sma': False, 'bear_use_ema': False, 'bear_use_atr': True, 'bear_use_adx': False, 'bear_use_spike': False, 'bear_rsi_required': False, 'sideways_strategy': 'mean_reversion', 'sideways_bb_std_mult': 2.0870122622901386, 'sideways_rsi_os': 42, 'sideways_rsi_ob': 63, 'sideways_adx_thresh': 13.393341510084, 'sideways_atr_min_pct': 0.015794717037555042, 'sideways_atr_max_pct': 0.014482492771332178, 'sideways_tp_mult': 2.092298866928505, 'sideways_tsl_mult': 0.30714237272610656, 'sideways_time_stop': 283, 'sideways_use_sma': False, 'sideways_use_ema': True, 'sideways_use_atr': True, 'sideways_use_adx': False, 'sideways_use_spike': False, 'sideways_rsi_required': True}.
[I 2025-08-29 19:59:10,705] Trial 197 finished with values: [-1000000000.0, 1000000000.0] and parameters: {'p_sma': 39, 'p_std': 52, 'p_atr': 24, 'p_adx': 26, 'rsi_period': 25, 'ema1': 23, 'ema2': 42, 'slip_atr_k': 0.14955699457271382, 'slip_spread_k': 0.23446881994573288, 'spread_hl_frac': 0.03122667646900544, 'bb_std_mult': 1.2314195241904056, 'rsi_os': 20, 'rsi_ob': 67, 'vol_spike': 0.1578364429277277, 'adx_thresh': 11.095535317382287, 'atr_min_pct': 0.02756605821359345, 'atr_max_pct': 0.021908497953747663, 'tp_mult': 2.3662502277066446, 'tsl_mult': 0.600282287877971, 'strategy': 'mean_reversion', 'time_stop': 107, 'use_sma': False, 'use_atr': True, 'use_adx': False, 'use_ema': True, 'use_spike': False, 'rsi_required': False, 'edge_k': 1.2981753442649648, 'edge_cap': 0.9966818377837429, 'bull_strategy': 'breakout', 'bull_bb_std_mult': 0.9598364453716223, 'bull_rsi_os': 53, 'bull_rsi_ob': 94, 'bull_adx_thresh': 17.992907115842975, 'bull_atr_min_pct': 0.02299743402937923, 'bull_atr_max_pct': 0.05759958446676216, 'bull_tp_mult': 1.4585169114891303, 'bull_tsl_mult': 0.17602211216685099, 'bull_time_stop': 293, 'bull_use_sma': False, 'bull_use_ema': True, 'bull_use_atr': False, 'bull_use_adx': True, 'bull_use_spike': False, 'bull_rsi_required': True, 'bear_strategy': 'breakout', 'bear_bb_std_mult': 1.1955283853613767, 'bear_rsi_os': 27, 'bear_rsi_ob': 49, 'bear_adx_thresh': 6.037171557134684, 'bear_atr_min_pct': 0.015975833084549442, 'bear_atr_max_pct': 0.0392890140299586, 'bear_tp_mult': 1.8337822107642303, 'bear_tsl_mult': 0.6748830296362189, 'bear_time_stop': 5, 'bear_use_sma': False, 'bear_use_ema': True, 'bear_use_atr': True, 'bear_use_adx': True, 'bear_use_spike': False, 'bear_rsi_required': False, 'sideways_strategy': 'mean_reversion', 'sideways_bb_std_mult': 0.5382556562971756, 'sideways_rsi_os': 40, 'sideways_rsi_ob': 81, 'sideways_adx_thresh': 24.275190889668227, 'sideways_atr_min_pct': 0.016790923821469777, 'sideways_atr_max_pct': 0.1075797001839442, 'sideways_tp_mult': 2.093269879765424, 'sideways_tsl_mult': 0.12893432474839212, 'sideways_time_stop': 276, 'sideways_use_sma': False, 'sideways_use_ema': True, 'sideways_use_atr': True, 'sideways_use_adx': False, 'sideways_use_spike': False, 'sideways_rsi_required': True}.
[I 2025-08-29 19:59:37,734] Trial 195 finished with values: [-1000000000.0, 1000000000.0] and parameters: {'p_sma': 50, 'p_std': 37, 'p_atr': 24, 'p_adx': 14, 'rsi_period': 23, 'ema1': 23, 'ema2': 58, 'slip_atr_k': 0.0810586490301822, 'slip_spread_k': 0.2781397717282795, 'spread_hl_frac': 0.03131987345460511, 'bb_std_mult': 1.2315978103641685, 'rsi_os': 53, 'rsi_ob': 66, 'vol_spike': 0.15520219750408717, 'adx_thresh': 33.08074778489327, 'atr_min_pct': 0.007604576049374855, 'atr_max_pct': 0.08182341049111065, 'tp_mult': 2.0062697865120427, 'tsl_mult': 0.8665983004562512, 'strategy': 'breakout', 'time_stop': 106, 'use_sma': True, 'use_atr': True, 'use_adx': False, 'use_ema': False, 'use_spike': True, 'rsi_required': False, 'edge_k': 0.8534156437569405, 'edge_cap': 0.9465815748219608, 'bull_strategy': 'breakout', 'bull_bb_std_mult': 0.8355893579464164, 'bull_rsi_os': 42, 'bull_rsi_ob': 56, 'bull_adx_thresh': 7.62833296068591, 'bull_atr_min_pct': 0.026698309284936272, 'bull_atr_max_pct': 0.10959022361513637, 'bull_tp_mult': 1.526247504652558, 'bull_tsl_mult': 0.17894086951020627, 'bull_time_stop': 294, 'bull_use_sma': False, 'bull_use_ema': True, 'bull_use_atr': False, 'bull_use_adx': True, 'bull_use_spike': False, 'bull_rsi_required': True, 'bear_strategy': 'breakout', 'bear_bb_std_mult': 1.1955269746215327, 'bear_rsi_os': 27, 'bear_rsi_ob': 58, 'bear_adx_thresh': 32.60424579560364, 'bear_atr_min_pct': 0.007747596447538003, 'bear_atr_max_pct': 0.1106304369218638, 'bear_tp_mult': 1.8093855651919708, 'bear_tsl_mult': 0.6854903320809419, 'bear_time_stop': 5, 'bear_use_sma': True, 'bear_use_ema': False, 'bear_use_atr': True, 'bear_use_adx': False, 'bear_use_spike': False, 'bear_rsi_required': False, 'sideways_strategy': 'mean_reversion', 'sideways_bb_std_mult': 0.5152692332568904, 'sideways_rsi_os': 41, 'sideways_rsi_ob': 71, 'sideways_adx_thresh': 30.252892195534645, 'sideways_atr_min_pct': 0.024240675477565605, 'sideways_atr_max_pct': 0.07379743964408507, 'sideways_tp_mult': 2.097544509804236, 'sideways_tsl_mult': 0.3083700003077954, 'sideways_time_stop': 276, 'sideways_use_sma': False, 'sideways_use_ema': True, 'sideways_use_atr': True, 'sideways_use_adx': False, 'sideways_use_spike': False, 'sideways_rsi_required': False}.
