[I 2025-08-29 20:57:07,202] Trial 692 finished with values: [-1000000000.0, 1000000000.0] and parameters: {'p_sma': 56, 'p_std': 58, 'p_atr': 7, 'p_adx': 9, 'rsi_period': 73, 'ema1': 26, 'ema2': 45, 'slip_atr_k': 0.21237176755521076, 'slip_spread_k': 0.19264920729132584, 'spread_hl_frac': 0.013259540795737662, 'bb_std_mult': 1.806463409932522, 'rsi_os': 38, 'rsi_ob': 84, 'vol_spike': 0.0463795079210481, 'adx_thresh': 15.522376503146115, 'atr_min_pct': 0.019325427955259662, 'atr_max_pct': 0.10504025616145167, 'tp_mult': 2.720938778484918, 'tsl_mult': 0.059562785289644815, 'strategy': 'mean_reversion', 'time_stop': 156, 'use_sma': True, 'use_atr': False, 'use_adx': True, 'use_ema': False, 'use_spike': True, 'rsi_required': False, 'edge_k': 1.097986216861328, 'edge_cap': 0.5911953852917282, 'bull_strategy': 'mean_reversion', 'bull_bb_std_mult': 2.9378691893798994, 'bull_rsi_os': 12, 'bull_rsi_ob': 73, 'bull_adx_thresh': 11.717280420880545, 'bull_atr_min_pct': 0.01498862434517668, 'bull_atr_max_pct': 0.09439224202358239, 'bull_tp_mult': 2.61488280880887, 'bull_tsl_mult': 0.5336012520392538, 'bull_time_stop': 24, 'bull_use_sma': True, 'bull_use_ema': True, 'bull_use_atr': True, 'bull_use_adx': True, 'bull_use_spike': False, 'bull_rsi_required': False, 'bear_strategy': 'breakout', 'bear_bb_std_mult': 1.8370669986006303, 'bear_rsi_os': 24, 'bear_rsi_ob': 66, 'bear_adx_thresh': 20.249931299159133, 'bear_atr_min_pct': 0.014039344130933816, 'bear_atr_max_pct': 0.043959810861369734, 'bear_tp_mult': 2.651022609358211, 'bear_tsl_mult': 0.9158484071772538, 'bear_time_stop': 62, 'bear_use_sma': False, 'bear_use_ema': False, 'bear_use_atr': True, 'bear_use_adx': False, 'bear_use_spike': True, 'bear_rsi_required': False, 'sideways_strategy': 'mean_reversion', 'sideways_bb_std_mult': 0.8897061136209603, 'sideways_rsi_os': 50, 'sideways_rsi_ob': 77, 'sideways_adx_thresh': 30.99965147041503, 'sideways_atr_min_pct': 0.004976580261008618, 'sideways_atr_max_pct': 0.12958789702083992, 'sideways_tp_mult': 2.493329541862461, 'sideways_tsl_mult': 0.6780224906330934, 'sideways_time_stop': 199, 'sideways_use_sma': False, 'sideways_use_ema': True, 'sideways_use_atr': False, 'sideways_use_adx': False, 'sideways_use_spike': False, 'sideways_rsi_required': True}.
[I 2025-08-29 20:57:07,509] Trial 693 finished with values: [-1000000000.0, 1000000000.0] and parameters: {'p_sma': 26, 'p_std': 53, 'p_atr': 27, 'p_adx': 15, 'rsi_period': 37, 'ema1': 26, 'ema2': 41, 'slip_atr_k': 0.1663270817876181, 'slip_spread_k': 0.5431209661169216, 'spread_hl_frac': 0.014722310804904935, 'bb_std_mult': 1.8201787987690372, 'rsi_os': 7, 'rsi_ob': 84, 'vol_spike': 0.04834434588397708, 'adx_thresh': 13.611019370078585, 'atr_min_pct': 0.0031862388018359857, 'atr_max_pct': 0.018071946505795702, 'tp_mult': 2.7452704811221396, 'tsl_mult': 0.8907728903550871, 'strategy': 'breakout', 'time_stop': 34, 'use_sma': True, 'use_atr': True, 'use_adx': True, 'use_ema': False, 'use_spike': True, 'rsi_required': False, 'edge_k': 1.7419879446551914, 'edge_cap': 0.5696257720563911, 'bull_strategy': 'mean_reversion', 'bull_bb_std_mult': 3.017539226721941, 'bull_rsi_os': 13, 'bull_rsi_ob': 73, 'bull_adx_thresh': 11.729618130651652, 'bull_atr_min_pct': 0.01479851334591113, 'bull_atr_max_pct': 0.09537882985035277, 'bull_tp_mult': 2.621310899247021, 'bull_tsl_mult': 0.5324313009899164, 'bull_time_stop': 26, 'bull_use_sma': True, 'bull_use_ema': True, 'bull_use_atr': True, 'bull_use_adx': True, 'bull_use_spike': False, 'bull_rsi_required': True, 'bear_strategy': 'breakout', 'bear_bb_std_mult': 1.8739386450749982, 'bear_rsi_os': 27, 'bear_rsi_ob': 78, 'bear_adx_thresh': 13.073352145827208, 'bear_atr_min_pct': 0.004744205751391705, 'bear_atr_max_pct': 0.04334914145361393, 'bear_tp_mult': 2.655263580180371, 'bear_tsl_mult': 0.9416182203943281, 'bear_time_stop': 49, 'bear_use_sma': False, 'bear_use_ema': False, 'bear_use_atr': False, 'bear_use_adx': False, 'bear_use_spike': True, 'bear_rsi_required': False, 'sideways_strategy': 'mean_reversion', 'sideways_bb_std_mult': 2.3442919458187355, 'sideways_rsi_os': 49, 'sideways_rsi_ob': 83, 'sideways_adx_thresh': 26.471434374216855, 'sideways_atr_min_pct': 0.004797497030862963, 'sideways_atr_max_pct': 0.018477542739272722, 'sideways_tp_mult': 1.1685697485550686, 'sideways_tsl_mult': 0.6577609493470596, 'sideways_time_stop': 10, 'sideways_use_sma': True, 'sideways_use_ema': True, 'sideways_use_atr': False, 'sideways_use_adx': False, 'sideways_use_spike': False, 'sideways_rsi_required': True}.
[I 2025-08-29 20:57:07,568] Trial 694 finished with values: [-1000000000.0, 1000000000.0] and parameters: {'p_sma': 24, 'p_std': 58, 'p_atr': 7, 'p_adx': 19, 'rsi_period': 37, 'ema1': 26, 'ema2': 46, 'slip_atr_k': 0.00020520645502839548, 'slip_spread_k': 0.19697003516902153, 'spread_hl_frac': 0.013402534348687703, 'bb_std_mult': 1.8223774498240737, 'rsi_os': 45, 'rsi_ob': 84, 'vol_spike': 0.19971347066564174, 'adx_thresh': 23.230721393283453, 'atr_min_pct': 0.016519751410871034, 'atr_max_pct': 0.02928037838754103, 'tp_mult': 1.4173882362861583, 'tsl_mult': 0.8403218527168488, 'strategy': 'breakout', 'time_stop': 177, 'use_sma': True, 'use_atr': True, 'use_adx': True, 'use_ema': False, 'use_spike': True, 'rsi_required': False, 'edge_k': 1.0015717119596612, 'edge_cap': 0.5953985733780162, 'bull_strategy': 'mean_reversion', 'bull_bb_std_mult': 1.1019434246428788, 'bull_rsi_os': 13, 'bull_rsi_ob': 73, 'bull_adx_thresh': 11.799022540652283, 'bull_atr_min_pct': 0.01509365179408973, 'bull_atr_max_pct': 0.07871850054219699, 'bull_tp_mult': 2.5295826537936947, 'bull_tsl_mult': 0.9359224937667667, 'bull_time_stop': 20, 'bull_use_sma': True, 'bull_use_ema': True, 'bull_use_atr': False, 'bull_use_adx': True, 'bull_use_spike': False, 'bull_rsi_required': True, 'bear_strategy': 'mean_reversion', 'bear_bb_std_mult': 1.3458805169191899, 'bear_rsi_os': 24, 'bear_rsi_ob': 79, 'bear_adx_thresh': 23.109641050976972, 'bear_atr_min_pct': 0.016287592179368416, 'bear_atr_max_pct': 0.028781860739660624, 'bear_tp_mult': 2.64826054645341, 'bear_tsl_mult': 0.942048637039242, 'bear_time_stop': 38, 'bear_use_sma': False, 'bear_use_ema': False, 'bear_use_atr': False, 'bear_use_adx': False, 'bear_use_spike': True, 'bear_rsi_required': True, 'sideways_strategy': 'mean_reversion', 'sideways_bb_std_mult': 1.668324719089032, 'sideways_rsi_os': 54, 'sideways_rsi_ob': 68, 'sideways_adx_thresh': 29.97629395415621, 'sideways_atr_min_pct': 0.011704083159926718, 'sideways_atr_max_pct': 0.01915241540454979, 'sideways_tp_mult': 1.1563700215233195, 'sideways_tsl_mult': 0.0417969886871537, 'sideways_time_stop': 205, 'sideways_use_sma': True, 'sideways_use_ema': False, 'sideways_use_atr': True, 'sideways_use_adx': False, 'sideways_use_spike': False, 'sideways_rsi_required': True}.
[I 2025-08-29 20:57:08,979] Trial 696 finished with values: [-1000000000.0, 1000000000.0] and parameters: {'p_sma': 56, 'p_std': 53, 'p_atr': 22, 'p_adx': 12, 'rsi_period': 73, 'ema1': 7, 'ema2': 13, 'slip_atr_k': 0.2157639784850362, 'slip_spread_k': 0.9703103801162102, 'spread_hl_frac': 0.049196813120280125, 'bb_std_mult': 1.6104167645500251, 'rsi_os': 41, 'rsi_ob': 84, 'vol_spike': 0.19849941375427482, 'adx_thresh': 11.645117297144216, 'atr_min_pct': 0.021460944536672903, 'atr_max_pct': 0.13562696880933228, 'tp_mult': 1.2306503901733845, 'tsl_mult': 0.8285766872063769, 'strategy': 'mean_reversion', 'time_stop': 155, 'use_sma': False, 'use_atr': False, 'use_adx': False, 'use_ema': True, 'use_spike': False, 'rsi_required': True, 'edge_k': 1.7368926671138303, 'edge_cap': 0.9601373325635196, 'bull_strategy': 'breakout', 'bull_bb_std_mult': 0.6781573995343118, 'bull_rsi_os': 25, 'bull_rsi_ob': 73, 'bull_adx_thresh': 26.863510244906507, 'bull_atr_min_pct': 0.01676812442643159, 'bull_atr_max_pct': 0.10284918781498825, 'bull_tp_mult': 1.9606352424057132, 'bull_tsl_mult': 0.3892448882350863, 'bull_time_stop': 24, 'bull_use_sma': False, 'bull_use_ema': False, 'bull_use_atr': True, 'bull_use_adx': True, 'bull_use_spike': True, 'bull_rsi_required': False, 'bear_strategy': 'breakout', 'bear_bb_std_mult': 1.880195065006422, 'bear_rsi_os': 11, 'bear_rsi_ob': 65, 'bear_adx_thresh': 20.36776219547053, 'bear_atr_min_pct': 0.0047918448294570525, 'bear_atr_max_pct': 0.03916457131352277, 'bear_tp_mult': 2.603494595138809, 'bear_tsl_mult': 0.9229006069910327, 'bear_time_stop': 87, 'bear_use_sma': False, 'bear_use_ema': False, 'bear_use_atr': False, 'bear_use_adx': True, 'bear_use_spike': False, 'bear_rsi_required': False, 'sideways_strategy': 'breakout', 'sideways_bb_std_mult': 2.391364982161197, 'sideways_rsi_os': 55, 'sideways_rsi_ob': 82, 'sideways_adx_thresh': 30.254290220222686, 'sideways_atr_min_pct': 0.013297210598329575, 'sideways_atr_max_pct': 0.02555894406794177, 'sideways_tp_mult': 1.0871895340026752, 'sideways_tsl_mult': 0.8682778823448001, 'sideways_time_stop': 207, 'sideways_use_sma': False, 'sideways_use_ema': False, 'sideways_use_atr': False, 'sideways_use_adx': False, 'sideways_use_spike': True, 'sideways_rsi_required': False}.
[I 2025-08-29 20:57:09,730] Trial 699 finished with values: [-1000000000.0, 1000000000.0] and parameters: {'p_sma': 16, 'p_std': 17, 'p_atr': 8, 'p_adx': 14, 'rsi_period': 40, 'ema1': 28, 'ema2': 43, 'slip_atr_k': 0.007543435632266732, 'slip_spread_k': 0.7529104388699265, 'spread_hl_frac': 0.04906621623152192, 'bb_std_mult': 2.962542818348288, 'rsi_os': 54, 'rsi_ob': 81, 'vol_spike': 0.18954282514110515, 'adx_thresh': 7.777791609497342, 'atr_min_pct': 0.018678191504673206, 'atr_max_pct': 0.050929507078222, 'tp_mult': 1.2137176154945524, 'tsl_mult': 0.48422479100690996, 'strategy': 'mean_reversion', 'time_stop': 202, 'use_sma': False, 'use_atr': False, 'use_adx': False, 'use_ema': True, 'use_spike': False, 'rsi_required': True, 'edge_k': 1.0551438535922955, 'edge_cap': 0.5519768692964035, 'bull_strategy': 'breakout', 'bull_bb_std_mult': 3.2576348674357374, 'bull_rsi_os': 10, 'bull_rsi_ob': 70, 'bull_adx_thresh': 26.797094865703567, 'bull_atr_min_pct': 0.01794090338419075, 'bull_atr_max_pct': 0.10339476681255182, 'bull_tp_mult': 2.850312749234677, 'bull_tsl_mult': 0.7949185108107184, 'bull_time_stop': 49, 'bull_use_sma': False, 'bull_use_ema': False, 'bull_use_atr': True, 'bull_use_adx': False, 'bull_use_spike': True, 'bull_rsi_required': False, 'bear_strategy': 'breakout', 'bear_bb_std_mult': 2.101407555020549, 'bear_rsi_os': 15, 'bear_rsi_ob': 63, 'bear_adx_thresh': 24.88432687495155, 'bear_atr_min_pct': 0.027277675564631974, 'bear_atr_max_pct': 0.03827102890610851, 'bear_tp_mult': 2.601170167738862, 'bear_tsl_mult': 0.8627466628330317, 'bear_time_stop': 90, 'bear_use_sma': False, 'bear_use_ema': True, 'bear_use_atr': False, 'bear_use_adx': True, 'bear_use_spike': False, 'bear_rsi_required': False, 'sideways_strategy': 'breakout', 'sideways_bb_std_mult': 2.4037480683084147, 'sideways_rsi_os': 37, 'sideways_rsi_ob': 94, 'sideways_adx_thresh': 33.566619572751996, 'sideways_atr_min_pct': 0.00528811465306888, 'sideways_atr_max_pct': 0.02466426123168491, 'sideways_tp_mult': 1.0761395124542898, 'sideways_tsl_mult': 0.733779145860468, 'sideways_time_stop': 187, 'sideways_use_sma': False, 'sideways_use_ema': False, 'sideways_use_atr': False, 'sideways_use_adx': False, 'sideways_use_spike': True, 'sideways_rsi_required': False}.
[I 2025-08-29 20:57:09,822] Trial 700 finished with values: [-1000000000.0, 1000000000.0] and parameters: {'p_sma': 51, 'p_std': 57, 'p_atr': 25, 'p_adx': 14, 'rsi_period': 40, 'ema1': 28, 'ema2': 48, 'slip_atr_k': 0.007566653620270088, 'slip_spread_k': 0.7532219526033146, 'spread_hl_frac': 0.04909616727808637, 'bb_std_mult': 1.6766011857378373, 'rsi_os': 54, 'rsi_ob': 82, 'vol_spike': 0.17881949400434988, 'adx_thresh': 27.449908660738636, 'atr_min_pct': 0.01874032730515624, 'atr_max_pct': 0.12026886327647754, 'tp_mult': 1.175526665468968, 'tsl_mult': 0.8856195630933181, 'strategy': 'mean_reversion', 'time_stop': 5, 'use_sma': False, 'use_atr': False, 'use_adx': False, 'use_ema': True, 'use_spike': False, 'rsi_required': True, 'edge_k': 1.0458819394052268, 'edge_cap': 0.5530962540272447, 'bull_strategy': 'breakout', 'bull_bb_std_mult': 3.069220493775513, 'bull_rsi_os': 11, 'bull_rsi_ob': 70, 'bull_adx_thresh': 13.028789709519973, 'bull_atr_min_pct': 0.02114258173872838, 'bull_atr_max_pct': 0.047237280328634015, 'bull_tp_mult': 1.588493448508252, 'bull_tsl_mult': 0.7868866373209266, 'bull_time_stop': 251, 'bull_use_sma': False, 'bull_use_ema': False, 'bull_use_atr': True, 'bull_use_adx': False, 'bull_use_spike': True, 'bull_rsi_required': False, 'bear_strategy': 'breakout', 'bear_bb_std_mult': 2.1016341400143235, 'bear_rsi_os': 16, 'bear_rsi_ob': 65, 'bear_adx_thresh': 33.05605225985206, 'bear_atr_min_pct': 0.006269001064928633, 'bear_atr_max_pct': 0.05960324584632039, 'bear_tp_mult': 2.826304949654128, 'bear_tsl_mult': 0.8838564638736809, 'bear_time_stop': 49, 'bear_use_sma': False, 'bear_use_ema': True, 'bear_use_atr': False, 'bear_use_adx': True, 'bear_use_spike': False, 'bear_rsi_required': False, 'sideways_strategy': 'breakout', 'sideways_bb_std_mult': 1.2660279431004715, 'sideways_rsi_os': 42, 'sideways_rsi_ob': 79, 'sideways_adx_thresh': 17.858794944933514, 'sideways_atr_min_pct': 0.0038348226125915173, 'sideways_atr_max_pct': 0.1495478478953084, 'sideways_tp_mult': 1.0100178380745388, 'sideways_tsl_mult': 0.8920164646599418, 'sideways_time_stop': 190, 'sideways_use_sma': False, 'sideways_use_ema': False, 'sideways_use_atr': False, 'sideways_use_adx': False, 'sideways_use_spike': True, 'sideways_rsi_required': False}.
[I 2025-08-29 20:57:11,759] Trial 701 finished with values: [-1000000000.0, 1000000000.0] and parameters: {'p_sma': 21, 'p_std': 57, 'p_atr': 25, 'p_adx': 26, 'rsi_period': 34, 'ema1': 13, 'ema2': 48, 'slip_atr_k': 0.016466739755531715, 'slip_spread_k': 0.2259972820892212, 'spread_hl_frac': 0.04823266696755849, 'bb_std_mult': 1.489433231778278, 'rsi_os': 10, 'rsi_ob': 45, 'vol_spike': 0.009312626148575753, 'adx_thresh': 18.715895694455863, 'atr_min_pct': 0.020361390386514185, 'atr_max_pct': 0.11968225385873818, 'tp_mult': 2.2193739723379493, 'tsl_mult': 0.8870156344279575, 'strategy': 'mean_reversion', 'time_stop': 74, 'use_sma': True, 'use_atr': False, 'use_adx': False, 'use_ema': True, 'use_spike': False, 'rsi_required': False, 'edge_k': 1.1388746787720307, 'edge_cap': 0.31664808878573475, 'bull_strategy': 'mean_reversion', 'bull_bb_std_mult': 1.8097830214101527, 'bull_rsi_os': 24, 'bull_rsi_ob': 56, 'bull_adx_thresh': 13.073947033296747, 'bull_atr_min_pct': 0.0063610801173454735, 'bull_atr_max_pct': 0.04734911143803032, 'bull_tp_mult': 2.688219020723881, 'bull_tsl_mult': 0.8750155368440771, 'bull_time_stop': 41, 'bull_use_sma': True, 'bull_use_ema': False, 'bull_use_atr': True, 'bull_use_adx': False, 'bull_use_spike': True, 'bull_rsi_required': False, 'bear_strategy': 'breakout', 'bear_bb_std_mult': 2.8812941970209778, 'bear_rsi_os': 31, 'bear_rsi_ob': 53, 'bear_adx_thresh': 21.17453024542733, 'bear_atr_min_pct': 0.0026282611277081303, 'bear_atr_max_pct': 0.06223068037338929, 'bear_tp_mult': 2.54161948905905, 'bear_tsl_mult': 0.09930460822176929, 'bear_time_stop': 272, 'bear_use_sma': True, 'bear_use_ema': True, 'bear_use_atr': False, 'bear_use_adx': True, 'bear_use_spike': True, 'bear_rsi_required': False, 'sideways_strategy': 'breakout', 'sideways_bb_std_mult': 3.426314319459012, 'sideways_rsi_os': 47, 'sideways_rsi_ob': 79, 'sideways_adx_thresh': 17.85114457474527, 'sideways_atr_min_pct': 0.025625174822927928, 'sideways_atr_max_pct': 0.014145688270589943, 'sideways_tp_mult': 1.1059935826501186, 'sideways_tsl_mult': 0.7568255331203051, 'sideways_time_stop': 47, 'sideways_use_sma': False, 'sideways_use_ema': False, 'sideways_use_atr': False, 'sideways_use_adx': False, 'sideways_use_spike': False, 'sideways_rsi_required': False}.
[I 2025-08-29 20:57:13,759] Trial 702 finished with values: [-1000000000.0, 1000000000.0] and parameters: {'p_sma': 20, 'p_std': 55, 'p_atr': 24, 'p_adx': 30, 'rsi_period': 35, 'ema1': 13, 'ema2': 46, 'slip_atr_k': 0.09150135264888286, 'slip_spread_k': 0.11717826656221916, 'spread_hl_frac': 0.041773298280286156, 'bb_std_mult': 1.598015453822246, 'rsi_os': 10, 'rsi_ob': 46, 'vol_spike': 0.031230257533341743, 'adx_thresh': 14.623505157084907, 'atr_min_pct': 0.029999914141356533, 'atr_max_pct': 0.023752181546879785, 'tp_mult': 1.298656663569588, 'tsl_mult': 0.9253431135240271, 'strategy': 'mean_reversion', 'time_stop': 91, 'use_sma': True, 'use_atr': False, 'use_adx': False, 'use_ema': True, 'use_spike': False, 'rsi_required': False, 'edge_k': 1.161435484078155, 'edge_cap': 0.2740681521344783, 'bull_strategy': 'mean_reversion', 'bull_bb_std_mult': 3.019262994038113, 'bull_rsi_os': 19, 'bull_rsi_ob': 63, 'bull_adx_thresh': 30.847167032256436, 'bull_atr_min_pct': 0.015691392782290547, 'bull_atr_max_pct': 0.08878610157780584, 'bull_tp_mult': 2.721775356965117, 'bull_tsl_mult': 0.8434864827943963, 'bull_time_stop': 192, 'bull_use_sma': True, 'bull_use_ema': False, 'bull_use_atr': False, 'bull_use_adx': False, 'bull_use_spike': True, 'bull_rsi_required': False, 'bear_strategy': 'mean_reversion', 'bear_bb_std_mult': 2.870249213614596, 'bear_rsi_os': 29, 'bear_rsi_ob': 67, 'bear_adx_thresh': 21.131682812701534, 'bear_atr_min_pct': 0.007805283372087669, 'bear_atr_max_pct': 0.05992166662133096, 'bear_tp_mult': 2.387938183279082, 'bear_tsl_mult': 0.09985085181574643, 'bear_time_stop': 54, 'bear_use_sma': True, 'bear_use_ema': True, 'bear_use_atr': False, 'bear_use_adx': True, 'bear_use_spike': True, 'bear_rsi_required': True, 'sideways_strategy': 'breakout', 'sideways_bb_std_mult': 3.0926248110732586, 'sideways_rsi_os': 23, 'sideways_rsi_ob': 78, 'sideways_adx_thresh': 32.79204804457351, 'sideways_atr_min_pct': 0.004398498495451186, 'sideways_atr_max_pct': 0.014210946405026653, 'sideways_tp_mult': 1.5769638309311882, 'sideways_tsl_mult': 0.7610953275679712, 'sideways_time_stop': 202, 'sideways_use_sma': False, 'sideways_use_ema': False, 'sideways_use_atr': True, 'sideways_use_adx': False, 'sideways_use_spike': False, 'sideways_rsi_required': False}.
[I 2025-08-29 20:57:24,568] Trial 697 finished with values: [-1000000000.0, 1000000000.0] and parameters: {'p_sma': 21, 'p_std': 53, 'p_atr': 28, 'p_adx': 15, 'rsi_period': 67, 'ema1': 13, 'ema2': 40, 'slip_atr_k': 0.16627259739733657, 'slip_spread_k': 0.11240047586453616, 'spread_hl_frac': 0.014696142677597066, 'bb_std_mult': 2.824731485468095, 'rsi_os': 24, 'rsi_ob': 82, 'vol_spike': 0.011220968238227047, 'adx_thresh': 23.111647800513833, 'atr_min_pct': 0.018557056794477677, 'atr_max_pct': 0.11956349853217187, 'tp_mult': 1.2159280972964557, 'tsl_mult': 0.8886029866252702, 'strategy': 'breakout', 'time_stop': 181, 'use_sma': False, 'use_atr': True, 'use_adx': False, 'use_ema': True, 'use_spike': False, 'rsi_required': True, 'edge_k': 0.9830349212221737, 'edge_cap': 0.561344566702656, 'bull_strategy': 'breakout', 'bull_bb_std_mult': 3.257008772169739, 'bull_rsi_os': 25, 'bull_rsi_ob': 58, 'bull_adx_thresh': 26.71798878187858, 'bull_atr_min_pct': 0.01682323448512871, 'bull_atr_max_pct': 0.10388029170626327, 'bull_tp_mult': 2.544407217030442, 'bull_tsl_mult': 0.8365223352012618, 'bull_time_stop': 252, 'bull_use_sma': False, 'bull_use_ema': False, 'bull_use_atr': True, 'bull_use_adx': False, 'bull_use_spike': True, 'bull_rsi_required': True, 'bear_strategy': 'breakout', 'bear_bb_std_mult': 2.5989468383084913, 'bear_rsi_os': 29, 'bear_rsi_ob': 63, 'bear_adx_thresh': 23.330959865210524, 'bear_atr_min_pct': 0.005053973290298667, 'bear_atr_max_pct': 0.06105815520110613, 'bear_tp_mult': 2.5961017447293377, 'bear_tsl_mult': 0.858569936001278, 'bear_time_stop': 268, 'bear_use_sma': False, 'bear_use_ema': True, 'bear_use_atr': False, 'bear_use_adx': True, 'bear_use_spike': False, 'bear_rsi_required': False, 'sideways_strategy': 'breakout', 'sideways_bb_std_mult': 2.3634606762021577, 'sideways_rsi_os': 10, 'sideways_rsi_ob': 94, 'sideways_adx_thresh': 33.62731582136356, 'sideways_atr_min_pct': 0.003800554652873839, 'sideways_atr_max_pct': 0.026126461473776598, 'sideways_tp_mult': 1.0709978338518265, 'sideways_tsl_mult': 0.8759549978654617, 'sideways_time_stop': 205, 'sideways_use_sma': True, 'sideways_use_ema': False, 'sideways_use_atr': False, 'sideways_use_adx': False, 'sideways_use_spike': True, 'sideways_rsi_required': False}.
