[I 2025-08-29 20:14:05,441] Trial 313 finished with values: [-0.02022325685941928, 0.02019625499950307] and parameters: {'p_sma': 19, 'p_std': 54, 'p_atr': 24, 'p_adx': 16, 'rsi_period': 39, 'ema1': 19, 'ema2': 52, 'slip_atr_k': 0.016736702720628095, 'slip_spread_k': 0.20246843466273431, 'spread_hl_frac': 0.0030337234731336576, 'bb_std_mult': 1.3045173604450109, 'rsi_os': 20, 'rsi_ob': 81, 'vol_spike': 0.19380123550593362, 'adx_thresh': 14.71806753369206, 'atr_min_pct': 0.019481165910819744, 'atr_max_pct': 0.03849365793031278, 'tp_mult': 1.6431523504861505, 'tsl_mult': 0.8786020712075497, 'strategy': 'mean_reversion', 'time_stop': 185, 'use_sma': True, 'use_atr': False, 'use_adx': False, 'use_ema': True, 'use_spike': True, 'rsi_required': False, 'edge_k': 1.0630456381390467, 'edge_cap': 0.5447136244910165, 'bull_strategy': 'mean_reversion', 'bull_bb_std_mult': 3.036186840205539, 'bull_rsi_os': 38, 'bull_rsi_ob': 74, 'bull_adx_thresh': 16.78525616141681, 'bull_atr_min_pct': 0.014082132446451293, 'bull_atr_max_pct': 0.09787343615702791, 'bull_tp_mult': 2.1939107727800082, 'bull_tsl_mult': 0.8538988096866034, 'bull_time_stop': 45, 'bull_use_sma': True, 'bull_use_ema': False, 'bull_use_atr': True, 'bull_use_adx': False, 'bull_use_spike': True, 'bull_rsi_required': False, 'bear_strategy': 'breakout', 'bear_bb_std_mult': 2.571101704739591, 'bear_rsi_os': 27, 'bear_rsi_ob': 67, 'bear_adx_thresh': 20.36615218404243, 'bear_atr_min_pct': 0.008145580084657928, 'bear_atr_max_pct': 0.03967528222126952, 'bear_tp_mult': 2.557801599629804, 'bear_tsl_mult': 0.41841900576492974, 'bear_time_stop': 5, 'bear_use_sma': True, 'bear_use_ema': True, 'bear_use_atr': False, 'bear_use_adx': True, 'bear_use_spike': True, 'bear_rsi_required': False, 'sideways_strategy': 'breakout', 'sideways_bb_std_mult': 2.2645917504955704, 'sideways_rsi_os': 48, 'sideways_rsi_ob': 79, 'sideways_adx_thresh': 33.90879556560328, 'sideways_atr_min_pct': 0.0018037814438883887, 'sideways_atr_max_pct': 0.02139784663468702, 'sideways_tp_mult': 1.113022075609365, 'sideways_tsl_mult': 0.6357644546305212, 'sideways_time_stop': 171, 'sideways_use_sma': False, 'sideways_use_ema': True, 'sideways_use_atr': False, 'sideways_use_adx': True, 'sideways_use_spike': True, 'sideways_rsi_required': False}.
[I 2025-08-29 20:14:05,587] Trial 315 finished with values: [-0.0019393317024383183, 0.0019988398468633014] and parameters: {'p_sma': 20, 'p_std': 54, 'p_atr': 16, 'p_adx': 16, 'rsi_period': 39, 'ema1': 19, 'ema2': 48, 'slip_atr_k': 0.019149949058784345, 'slip_spread_k': 0.2044916703061968, 'spread_hl_frac': 0.0028914928880624524, 'bb_std_mult': 1.3874320660376203, 'rsi_os': 7, 'rsi_ob': 81, 'vol_spike': 0.19102177964971687, 'adx_thresh': 19.496889933621308, 'atr_min_pct': 0.01899401601593303, 'atr_max_pct': 0.03920500507818067, 'tp_mult': 1.6306829800243, 'tsl_mult': 0.8735514210887594, 'strategy': 'breakout', 'time_stop': 185, 'use_sma': True, 'use_atr': False, 'use_adx': True, 'use_ema': True, 'use_spike': True, 'rsi_required': False, 'edge_k': 1.0650897466199443, 'edge_cap': 0.5378742426527527, 'bull_strategy': 'mean_reversion', 'bull_bb_std_mult': 3.0261643592790115, 'bull_rsi_os': 23, 'bull_rsi_ob': 74, 'bull_adx_thresh': 16.90636450151269, 'bull_atr_min_pct': 0.014063009996957691, 'bull_atr_max_pct': 0.09896609725031327, 'bull_tp_mult': 1.0183764638331199, 'bull_tsl_mult': 0.8606371499214552, 'bull_time_stop': 70, 'bull_use_sma': True, 'bull_use_ema': False, 'bull_use_atr': True, 'bull_use_adx': False, 'bull_use_spike': True, 'bull_rsi_required': False, 'bear_strategy': 'mean_reversion', 'bear_bb_std_mult': 2.5732699268859105, 'bear_rsi_os': 27, 'bear_rsi_ob': 66, 'bear_adx_thresh': 25.86263829723157, 'bear_atr_min_pct': 0.008039646565533097, 'bear_atr_max_pct': 0.03963252791337961, 'bear_tp_mult': 2.562500298805879, 'bear_tsl_mult': 0.41479653965198165, 'bear_time_stop': 5, 'bear_use_sma': True, 'bear_use_ema': True, 'bear_use_atr': False, 'bear_use_adx': True, 'bear_use_spike': True, 'bear_rsi_required': False, 'sideways_strategy': 'breakout', 'sideways_bb_std_mult': 2.2768221964841215, 'sideways_rsi_os': 48, 'sideways_rsi_ob': 79, 'sideways_adx_thresh': 33.92503947659784, 'sideways_atr_min_pct': 0.0042621605870583786, 'sideways_atr_max_pct': 0.02068606672757214, 'sideways_tp_mult': 1.106988717452441, 'sideways_tsl_mult': 0.640208112235247, 'sideways_time_stop': 214, 'sideways_use_sma': True, 'sideways_use_ema': True, 'sideways_use_atr': False, 'sideways_use_adx': True, 'sideways_use_spike': True, 'sideways_rsi_required': False}.
[I 2025-08-29 20:14:37,741] Trial 319 finished with values: [-0.001807737345109306, 0.0019048630087851787] and parameters: {'p_sma': 20, 'p_std': 54, 'p_atr': 19, 'p_adx': 16, 'rsi_period': 38, 'ema1': 19, 'ema2': 48, 'slip_atr_k': 0.029071945826892244, 'slip_spread_k': 0.2020130911121947, 'spread_hl_frac': 0.045993321739796415, 'bb_std_mult': 1.384778677955904, 'rsi_os': 6, 'rsi_ob': 81, 'vol_spike': 0.18984433873898193, 'adx_thresh': 22.38319748609467, 'atr_min_pct': 0.01934219738367285, 'atr_max_pct': 0.03731134093166607, 'tp_mult': 1.6454589411479095, 'tsl_mult': 0.8354611879423863, 'strategy': 'breakout', 'time_stop': 174, 'use_sma': True, 'use_atr': False, 'use_adx': True, 'use_ema': True, 'use_spike': False, 'rsi_required': False, 'edge_k': 1.0464814507494644, 'edge_cap': 0.5235782899859827, 'bull_strategy': 'mean_reversion', 'bull_bb_std_mult': 3.004453686239626, 'bull_rsi_os': 38, 'bull_rsi_ob': 72, 'bull_adx_thresh': 16.558734623945984, 'bull_atr_min_pct': 0.014076069504252497, 'bull_atr_max_pct': 0.03545768482445712, 'bull_tp_mult': 1.9352476388972915, 'bull_tsl_mult': 0.8704197935005563, 'bull_time_stop': 71, 'bull_use_sma': True, 'bull_use_ema': False, 'bull_use_atr': True, 'bull_use_adx': False, 'bull_use_spike': True, 'bull_rsi_required': False, 'bear_strategy': 'mean_reversion', 'bear_bb_std_mult': 2.6936851330629574, 'bear_rsi_os': 27, 'bear_rsi_ob': 64, 'bear_adx_thresh': 6.862946560186277, 'bear_atr_min_pct': 0.007455520987073026, 'bear_atr_max_pct': 0.029605862255578305, 'bear_tp_mult': 2.7424357608767074, 'bear_tsl_mult': 0.41929541524314906, 'bear_time_stop': 20, 'bear_use_sma': True, 'bear_use_ema': True, 'bear_use_atr': False, 'bear_use_adx': True, 'bear_use_spike': True, 'bear_rsi_required': False, 'sideways_strategy': 'breakout', 'sideways_bb_std_mult': 2.3789645388927143, 'sideways_rsi_os': 48, 'sideways_rsi_ob': 78, 'sideways_adx_thresh': 32.75085145144103, 'sideways_atr_min_pct': 0.004090322928619781, 'sideways_atr_max_pct': 0.023539796672143266, 'sideways_tp_mult': 1.0158561721960062, 'sideways_tsl_mult': 0.7045127683132677, 'sideways_time_stop': 211, 'sideways_use_sma': False, 'sideways_use_ema': True, 'sideways_use_atr': False, 'sideways_use_adx': True, 'sideways_use_spike': True, 'sideways_rsi_required': False}.
[I 2025-08-29 20:14:38,008] Trial 317 finished with values: [-0.0016405950408994174, 0.0017108917402522386] and parameters: {'p_sma': 19, 'p_std': 54, 'p_atr': 25, 'p_adx': 16, 'rsi_period': 39, 'ema1': 19, 'ema2': 48, 'slip_atr_k': 0.029437769807306217, 'slip_spread_k': 0.2073663523923002, 'spread_hl_frac': 0.037338080097876196, 'bb_std_mult': 1.4866644400837898, 'rsi_os': 20, 'rsi_ob': 81, 'vol_spike': 0.19410872271708923, 'adx_thresh': 32.22428224758955, 'atr_min_pct': 0.019266417008991312, 'atr_max_pct': 0.038485182155942335, 'tp_mult': 1.5237547050342801, 'tsl_mult': 0.8695317113411684, 'strategy': 'breakout', 'time_stop': 186, 'use_sma': True, 'use_atr': False, 'use_adx': False, 'use_ema': True, 'use_spike': True, 'rsi_required': False, 'edge_k': 1.068454882873512, 'edge_cap': 0.5414313335574715, 'bull_strategy': 'mean_reversion', 'bull_bb_std_mult': 3.0306836868518117, 'bull_rsi_os': 38, 'bull_rsi_ob': 74, 'bull_adx_thresh': 16.813645804634508, 'bull_atr_min_pct': 0.014197876415413433, 'bull_atr_max_pct': 0.09792637569338869, 'bull_tp_mult': 2.2028565796137634, 'bull_tsl_mult': 0.8407287729106937, 'bull_time_stop': 68, 'bull_use_sma': True, 'bull_use_ema': False, 'bull_use_atr': True, 'bull_use_adx': False, 'bull_use_spike': True, 'bull_rsi_required': False, 'bear_strategy': 'mean_reversion', 'bear_bb_std_mult': 2.5513553936684543, 'bear_rsi_os': 25, 'bear_rsi_ob': 66, 'bear_adx_thresh': 21.285579383876385, 'bear_atr_min_pct': 0.008686957852191363, 'bear_atr_max_pct': 0.04051160020210719, 'bear_tp_mult': 2.7438751719514443, 'bear_tsl_mult': 0.4152200605534277, 'bear_time_stop': 5, 'bear_use_sma': True, 'bear_use_ema': True, 'bear_use_atr': False, 'bear_use_adx': True, 'bear_use_spike': True, 'bear_rsi_required': False, 'sideways_strategy': 'breakout', 'sideways_bb_std_mult': 2.265151553699154, 'sideways_rsi_os': 48, 'sideways_rsi_ob': 79, 'sideways_adx_thresh': 32.99943912739671, 'sideways_atr_min_pct': 0.003981187941959974, 'sideways_atr_max_pct': 0.022698945899810915, 'sideways_tp_mult': 1.103862532581593, 'sideways_tsl_mult': 0.6799132473447135, 'sideways_time_stop': 214, 'sideways_use_sma': False, 'sideways_use_ema': True, 'sideways_use_atr': False, 'sideways_use_adx': True, 'sideways_use_spike': True, 'sideways_rsi_required': False}.
[I 2025-08-29 20:14:38,009] Trial 320 finished with values: [-0.006404161711375478, 0.006384434827930763] and parameters: {'p_sma': 20, 'p_std': 55, 'p_atr': 28, 'p_adx': 16, 'rsi_period': 37, 'ema1': 19, 'ema2': 48, 'slip_atr_k': 0.2343484050122932, 'slip_spread_k': 0.2076413231687424, 'spread_hl_frac': 0.022582128860674604, 'bb_std_mult': 1.3068581132902954, 'rsi_os': 54, 'rsi_ob': 82, 'vol_spike': 0.20738517716960836, 'adx_thresh': 32.30423463633572, 'atr_min_pct': 0.01922463768072961, 'atr_max_pct': 0.10962948473311457, 'tp_mult': 1.5131977325875927, 'tsl_mult': 0.8305250263579157, 'strategy': 'breakout', 'time_stop': 185, 'use_sma': True, 'use_atr': False, 'use_adx': False, 'use_ema': True, 'use_spike': False, 'rsi_required': False, 'edge_k': 1.1303270281090503, 'edge_cap': 0.5835813556732187, 'bull_strategy': 'mean_reversion', 'bull_bb_std_mult': 3.0999545376760613, 'bull_rsi_os': 38, 'bull_rsi_ob': 72, 'bull_adx_thresh': 16.81134683783839, 'bull_atr_min_pct': 0.013763656563062599, 'bull_atr_max_pct': 0.035033853385213365, 'bull_tp_mult': 2.8091201773256023, 'bull_tsl_mult': 0.8638453257031399, 'bull_time_stop': 75, 'bull_use_sma': True, 'bull_use_ema': False, 'bull_use_atr': True, 'bull_use_adx': False, 'bull_use_spike': True, 'bull_rsi_required': False, 'bear_strategy': 'mean_reversion', 'bear_bb_std_mult': 2.7079088782931438, 'bear_rsi_os': 25, 'bear_rsi_ob': 51, 'bear_adx_thresh': 6.79845124175938, 'bear_atr_min_pct': 0.005354569822737914, 'bear_atr_max_pct': 0.03594344604324817, 'bear_tp_mult': 2.7376850902036654, 'bear_tsl_mult': 0.42372738813100436, 'bear_time_stop': 45, 'bear_use_sma': True, 'bear_use_ema': True, 'bear_use_atr': False, 'bear_use_adx': True, 'bear_use_spike': True, 'bear_rsi_required': False, 'sideways_strategy': 'breakout', 'sideways_bb_std_mult': 2.367188221682045, 'sideways_rsi_os': 47, 'sideways_rsi_ob': 80, 'sideways_adx_thresh': 32.52421793828646, 'sideways_atr_min_pct': 0.004037995501498666, 'sideways_atr_max_pct': 0.011498053861482418, 'sideways_tp_mult': 1.088753770876258, 'sideways_tsl_mult': 0.7069710593396166, 'sideways_time_stop': 212, 'sideways_use_sma': False, 'sideways_use_ema': True, 'sideways_use_atr': False, 'sideways_use_adx': True, 'sideways_use_spike': False, 'sideways_rsi_required': False}.
[I 2025-08-29 20:14:38,206] Trial 318 finished with values: [-1000000000.0, 1000000000.0] and parameters: {'p_sma': 19, 'p_std': 54, 'p_atr': 29, 'p_adx': 16, 'rsi_period': 38, 'ema1': 19, 'ema2': 51, 'slip_atr_k': 0.016910959560547754, 'slip_spread_k': 0.19770704130652433, 'spread_hl_frac': 0.003178465009901914, 'bb_std_mult': 1.517924113576926, 'rsi_os': 20, 'rsi_ob': 81, 'vol_spike': 0.19274230402098397, 'adx_thresh': 5.926407006992232, 'atr_min_pct': 0.01922018212077095, 'atr_max_pct': 0.13120266346680468, 'tp_mult': 1.5334090630222552, 'tsl_mult': 0.8660997638924988, 'strategy': 'breakout', 'time_stop': 174, 'use_sma': True, 'use_atr': False, 'use_adx': True, 'use_ema': True, 'use_spike': True, 'rsi_required': False, 'edge_k': 1.0825382918253974, 'edge_cap': 0.548514895346243, 'bull_strategy': 'mean_reversion', 'bull_bb_std_mult': 3.025295497329854, 'bull_rsi_os': 38, 'bull_rsi_ob': 74, 'bull_adx_thresh': 16.979663428292447, 'bull_atr_min_pct': 0.01388040978341078, 'bull_atr_max_pct': 0.09813803501290672, 'bull_tp_mult': 1.9605065644759603, 'bull_tsl_mult': 0.8598209207578902, 'bull_time_stop': 70, 'bull_use_sma': True, 'bull_use_ema': False, 'bull_use_atr': True, 'bull_use_adx': False, 'bull_use_spike': True, 'bull_rsi_required': False, 'bear_strategy': 'mean_reversion', 'bear_bb_std_mult': 2.7071872067973892, 'bear_rsi_os': 27, 'bear_rsi_ob': 66, 'bear_adx_thresh': 25.55209080469527, 'bear_atr_min_pct': 0.007894726573960325, 'bear_atr_max_pct': 0.03980810182509739, 'bear_tp_mult': 2.550123659960415, 'bear_tsl_mult': 0.41839204840315564, 'bear_time_stop': 167, 'bear_use_sma': True, 'bear_use_ema': True, 'bear_use_atr': False, 'bear_use_adx': True, 'bear_use_spike': True, 'bear_rsi_required': False, 'sideways_strategy': 'breakout', 'sideways_bb_std_mult': 2.2625001330378898, 'sideways_rsi_os': 48, 'sideways_rsi_ob': 79, 'sideways_adx_thresh': 34.03181996924533, 'sideways_atr_min_pct': 0.004107373219327561, 'sideways_atr_max_pct': 0.020808899980567706, 'sideways_tp_mult': 1.1172867449856272, 'sideways_tsl_mult': 0.6769407936382975, 'sideways_time_stop': 212, 'sideways_use_sma': False, 'sideways_use_ema': True, 'sideways_use_atr': False, 'sideways_use_adx': True, 'sideways_use_spike': True, 'sideways_rsi_required': False}.
[I 2025-08-29 20:15:08,774] Trial 324 finished with values: [0.0003068440736493372, 0.0006999893976304709] and parameters: {'p_sma': 18, 'p_std': 55, 'p_atr': 25, 'p_adx': 14, 'rsi_period': 39, 'ema1': 19, 'ema2': 48, 'slip_atr_k': 0.008930491272944822, 'slip_spread_k': 0.18095738576446466, 'spread_hl_frac': 0.0466404617422127, 'bb_std_mult': 1.4007246758114693, 'rsi_os': 6, 'rsi_ob': 82, 'vol_spike': 0.19265131285298714, 'adx_thresh': 12.73392815253111, 'atr_min_pct': 0.018088920149518708, 'atr_max_pct': 0.03879816869763331, 'tp_mult': 1.6557736280804818, 'tsl_mult': 0.8299884572280204, 'strategy': 'mean_reversion', 'time_stop': 171, 'use_sma': True, 'use_atr': False, 'use_adx': False, 'use_ema': True, 'use_spike': False, 'rsi_required': False, 'edge_k': 1.1380946584145255, 'edge_cap': 0.5353100735219412, 'bull_strategy': 'mean_reversion', 'bull_bb_std_mult': 2.9531245374822674, 'bull_rsi_os': 38, 'bull_rsi_ob': 72, 'bull_adx_thresh': 14.396319113385974, 'bull_atr_min_pct': 0.016237333203526067, 'bull_atr_max_pct': 0.043435057354827375, 'bull_tp_mult': 2.54702488952101, 'bull_tsl_mult': 0.920539083047416, 'bull_time_stop': 48, 'bull_use_sma': True, 'bull_use_ema': False, 'bull_use_atr': True, 'bull_use_adx': False, 'bull_use_spike': True, 'bull_rsi_required': False, 'bear_strategy': 'breakout', 'bear_bb_std_mult': 2.6471155462468117, 'bear_rsi_os': 28, 'bear_rsi_ob': 64, 'bear_adx_thresh': 21.293531303279682, 'bear_atr_min_pct': 0.007321196835844224, 'bear_atr_max_pct': 0.03010120711009638, 'bear_tp_mult': 2.622624192797432, 'bear_tsl_mult': 0.413058867369481, 'bear_time_stop': 23, 'bear_use_sma': False, 'bear_use_ema': True, 'bear_use_atr': False, 'bear_use_adx': True, 'bear_use_spike': True, 'bear_rsi_required': False, 'sideways_strategy': 'breakout', 'sideways_bb_std_mult': 2.3298855085087546, 'sideways_rsi_os': 44, 'sideways_rsi_ob': 80, 'sideways_adx_thresh': 32.974813013162006, 'sideways_atr_min_pct': 0.004319301157720437, 'sideways_atr_max_pct': 0.02328310119797112, 'sideways_tp_mult': 1.038243047888553, 'sideways_tsl_mult': 0.699144884079521, 'sideways_time_stop': 202, 'sideways_use_sma': False, 'sideways_use_ema': True, 'sideways_use_atr': False, 'sideways_use_adx': False, 'sideways_use_spike': False, 'sideways_rsi_required': False}.
[I 2025-08-29 20:15:09,508] Trial 322 finished with values: [-1000000000.0, 1000000000.0] and parameters: {'p_sma': 18, 'p_std': 55, 'p_atr': 25, 'p_adx': 14, 'rsi_period': 39, 'ema1': 19, 'ema2': 48, 'slip_atr_k': 0.029782675304655767, 'slip_spread_k': 0.18222813479455321, 'spread_hl_frac': 0.0032266217981614317, 'bb_std_mult': 1.4968720367270414, 'rsi_os': 22, 'rsi_ob': 82, 'vol_spike': 0.1893232225184111, 'adx_thresh': 26.708840661191676, 'atr_min_pct': 0.018777506132127867, 'atr_max_pct': 0.039051024320765265, 'tp_mult': 1.2796406274425762, 'tsl_mult': 0.8602262957527681, 'strategy': 'breakout', 'time_stop': 172, 'use_sma': True, 'use_atr': False, 'use_adx': True, 'use_ema': True, 'use_spike': True, 'rsi_required': False, 'edge_k': 1.0603033020611352, 'edge_cap': 0.5211822238408098, 'bull_strategy': 'mean_reversion', 'bull_bb_std_mult': 3.012437731361617, 'bull_rsi_os': 5, 'bull_rsi_ob': 74, 'bull_adx_thresh': 16.898687793502212, 'bull_atr_min_pct': 0.01611625006133515, 'bull_atr_max_pct': 0.1008601456722387, 'bull_tp_mult': 1.9321639303250604, 'bull_tsl_mult': 0.8457618970580336, 'bull_time_stop': 49, 'bull_use_sma': True, 'bull_use_ema': False, 'bull_use_atr': True, 'bull_use_adx': False, 'bull_use_spike': True, 'bull_rsi_required': False, 'bear_strategy': 'mean_reversion', 'bear_bb_std_mult': 2.6784347803027417, 'bear_rsi_os': 28, 'bear_rsi_ob': 90, 'bear_adx_thresh': 6.328909933862726, 'bear_atr_min_pct': 0.019371812915155873, 'bear_atr_max_pct': 0.031481752819217196, 'bear_tp_mult': 2.6271990945573007, 'bear_tsl_mult': 0.41260070929417997, 'bear_time_stop': 19, 'bear_use_sma': True, 'bear_use_ema': True, 'bear_use_atr': False, 'bear_use_adx': True, 'bear_use_spike': True, 'bear_rsi_required': False, 'sideways_strategy': 'breakout', 'sideways_bb_std_mult': 2.3277236646763924, 'sideways_rsi_os': 44, 'sideways_rsi_ob': 80, 'sideways_adx_thresh': 33.72378196328131, 'sideways_atr_min_pct': 0.004379698600901279, 'sideways_atr_max_pct': 0.024720108787759883, 'sideways_tp_mult': 1.013238896209235, 'sideways_tsl_mult': 0.6715375462244638, 'sideways_time_stop': 201, 'sideways_use_sma': False, 'sideways_use_ema': True, 'sideways_use_atr': False, 'sideways_use_adx': False, 'sideways_use_spike': True, 'sideways_rsi_required': False}.
[I 2025-08-29 20:15:09,647] Trial 321 finished with values: [-0.0009715350694685654, 0.0011347017672234698] and parameters: {'p_sma': 20, 'p_std': 55, 'p_atr': 25, 'p_adx': 16, 'rsi_period': 37, 'ema1': 19, 'ema2': 48, 'slip_atr_k': 0.019220149059640118, 'slip_spread_k': 0.20932494706008267, 'spread_hl_frac': 0.004652612091312314, 'bb_std_mult': 1.3203206035823765, 'rsi_os': 54, 'rsi_ob': 82, 'vol_spike': 0.2083756304466681, 'adx_thresh': 16.257280769772635, 'atr_min_pct': 0.019077190947144083, 'atr_max_pct': 0.13202684423918054, 'tp_mult': 1.659612600092833, 'tsl_mult': 0.8364826109630303, 'strategy': 'breakout', 'time_stop': 185, 'use_sma': True, 'use_atr': False, 'use_adx': False, 'use_ema': True, 'use_spike': True, 'rsi_required': False, 'edge_k': 1.0712183958755606, 'edge_cap': 0.5188121326787628, 'bull_strategy': 'mean_reversion', 'bull_bb_std_mult': 2.9870315675047907, 'bull_rsi_os': 38, 'bull_rsi_ob': 72, 'bull_adx_thresh': 16.999733069652095, 'bull_atr_min_pct': 0.01640470242719416, 'bull_atr_max_pct': 0.1237719773805419, 'bull_tp_mult': 2.767524918385846, 'bull_tsl_mult': 0.8520949899628402, 'bull_time_stop': 66, 'bull_use_sma': True, 'bull_use_ema': False, 'bull_use_atr': True, 'bull_use_adx': False, 'bull_use_spike': True, 'bull_rsi_required': False, 'bear_strategy': 'mean_reversion', 'bear_bb_std_mult': 2.706232965136203, 'bear_rsi_os': 25, 'bear_rsi_ob': 67, 'bear_adx_thresh': 6.724007992936877, 'bear_atr_min_pct': 0.011517881021442277, 'bear_atr_max_pct': 0.03823043396586265, 'bear_tp_mult': 2.7415309870172138, 'bear_tsl_mult': 0.4234029622607181, 'bear_time_stop': 146, 'bear_use_sma': True, 'bear_use_ema': True, 'bear_use_atr': False, 'bear_use_adx': True, 'bear_use_spike': True, 'bear_rsi_required': False, 'sideways_strategy': 'breakout', 'sideways_bb_std_mult': 2.3527451221435975, 'sideways_rsi_os': 47, 'sideways_rsi_ob': 80, 'sideways_adx_thresh': 32.8734332797642, 'sideways_atr_min_pct': 0.004208093304633047, 'sideways_atr_max_pct': 0.011408166388615328, 'sideways_tp_mult': 1.0938676489848704, 'sideways_tsl_mult': 0.709728214454818, 'sideways_time_stop': 211, 'sideways_use_sma': False, 'sideways_use_ema': True, 'sideways_use_atr': False, 'sideways_use_adx': True, 'sideways_use_spike': True, 'sideways_rsi_required': False}.
