[I 2025-08-29 20:45:50,478] Trial 592 finished with values: [-1000000000.0, 1000000000.0] and parameters: {'p_sma': 18, 'p_std': 55, 'p_atr': 27, 'p_adx': 14, 'rsi_period': 59, 'ema1': 27, 'ema2': 47, 'slip_atr_k': 0.0005441833339782868, 'slip_spread_k': 0.22175472051251313, 'spread_hl_frac': 0.030689549316072366, 'bb_std_mult': 2.1061531684429466, 'rsi_os': 42, 'rsi_ob': 83, 'vol_spike': 0.19569722304696885, 'adx_thresh': 16.333085036809912, 'atr_min_pct': 0.0066306163561550314, 'atr_max_pct': 0.03215102651627335, 'tp_mult': 1.2553897745977396, 'tsl_mult': 0.8238316102055283, 'strategy': 'mean_reversion', 'time_stop': 171, 'use_sma': True, 'use_atr': True, 'use_adx': False, 'use_ema': True, 'use_spike': False, 'rsi_required': False, 'edge_k': 1.1488268663805283, 'edge_cap': 0.5871228145722295, 'bull_strategy': 'mean_reversion', 'bull_bb_std_mult': 2.064438853620931, 'bull_rsi_os': 21, 'bull_rsi_ob': 71, 'bull_adx_thresh': 12.566269116807069, 'bull_atr_min_pct': 0.01675702872042485, 'bull_atr_max_pct': 0.09587086490309742, 'bull_tp_mult': 1.8947294894314306, 'bull_tsl_mult': 0.6660040281910752, 'bull_time_stop': 16, 'bull_use_sma': True, 'bull_use_ema': False, 'bull_use_atr': True, 'bull_use_adx': False, 'bull_use_spike': True, 'bull_rsi_required': True, 'bear_strategy': 'breakout', 'bear_bb_std_mult': 2.615217515479003, 'bear_rsi_os': 35, 'bear_rsi_ob': 77, 'bear_adx_thresh': 32.65397911688323, 'bear_atr_min_pct': 0.01570945942467099, 'bear_atr_max_pct': 0.03806804987971269, 'bear_tp_mult': 2.3667005896310975, 'bear_tsl_mult': 0.14884709475073216, 'bear_time_stop': 229, 'bear_use_sma': False, 'bear_use_ema': True, 'bear_use_atr': False, 'bear_use_adx': True, 'bear_use_spike': True, 'bear_rsi_required': False, 'sideways_strategy': 'breakout', 'sideways_bb_std_mult': 2.4688436386517076, 'sideways_rsi_os': 6, 'sideways_rsi_ob': 58, 'sideways_adx_thresh': 5.486770479682294, 'sideways_atr_min_pct': 0.014449770044098021, 'sideways_atr_max_pct': 0.11109446162970946, 'sideways_tp_mult': 2.4501404657583423, 'sideways_tsl_mult': 0.7113795178646418, 'sideways_time_stop': 203, 'sideways_use_sma': False, 'sideways_use_ema': False, 'sideways_use_atr': False, 'sideways_use_adx': False, 'sideways_use_spike': False, 'sideways_rsi_required': False}.
[I 2025-08-29 20:45:50,802] Trial 594 finished with values: [-1000000000.0, 1000000000.0] and parameters: {'p_sma': 18, 'p_std': 55, 'p_atr': 26, 'p_adx': 24, 'rsi_period': 34, 'ema1': 8, 'ema2': 44, 'slip_atr_k': 0.18299465417849034, 'slip_spread_k': 0.17449466864127278, 'spread_hl_frac': 0.021245042977646834, 'bb_std_mult': 1.7780003209970683, 'rsi_os': 35, 'rsi_ob': 83, 'vol_spike': 0.18957339097622866, 'adx_thresh': 13.553760475816485, 'atr_min_pct': 0.020244029052293316, 'atr_max_pct': 0.033342324773073126, 'tp_mult': 1.0254348286582384, 'tsl_mult': 0.1591729291540181, 'strategy': 'mean_reversion', 'time_stop': 177, 'use_sma': True, 'use_atr': True, 'use_adx': False, 'use_ema': True, 'use_spike': False, 'rsi_required': False, 'edge_k': 1.1463514493887623, 'edge_cap': 0.5558059689771299, 'bull_strategy': 'mean_reversion', 'bull_bb_std_mult': 3.0493311331167594, 'bull_rsi_os': 21, 'bull_rsi_ob': 74, 'bull_adx_thresh': 24.239286055422006, 'bull_atr_min_pct': 0.017218789670235865, 'bull_atr_max_pct': 0.09285261388328184, 'bull_tp_mult': 2.6272490485716693, 'bull_tsl_mult': 0.6689916473800416, 'bull_time_stop': 11, 'bull_use_sma': True, 'bull_use_ema': False, 'bull_use_atr': False, 'bull_use_adx': False, 'bull_use_spike': True, 'bull_rsi_required': False, 'bear_strategy': 'breakout', 'bear_bb_std_mult': 0.5773795533410113, 'bear_rsi_os': 43, 'bear_rsi_ob': 64, 'bear_adx_thresh': 21.550063519578313, 'bear_atr_min_pct': 0.0082938968472206, 'bear_atr_max_pct': 0.12957312612257002, 'bear_tp_mult': 2.661469294450571, 'bear_tsl_mult': 0.9834907780495632, 'bear_time_stop': 181, 'bear_use_sma': False, 'bear_use_ema': True, 'bear_use_atr': False, 'bear_use_adx': True, 'bear_use_spike': True, 'bear_rsi_required': False, 'sideways_strategy': 'breakout', 'sideways_bb_std_mult': 2.370867075129916, 'sideways_rsi_os': 6, 'sideways_rsi_ob': 93, 'sideways_adx_thresh': 33.094657356976455, 'sideways_atr_min_pct': 0.02157888101407891, 'sideways_atr_max_pct': 0.09310371468283608, 'sideways_tp_mult': 1.0670452645627504, 'sideways_tsl_mult': 0.7129588492268384, 'sideways_time_stop': 201, 'sideways_use_sma': False, 'sideways_use_ema': False, 'sideways_use_atr': True, 'sideways_use_adx': False, 'sideways_use_spike': False, 'sideways_rsi_required': False}.
[I 2025-08-29 20:45:51,291] Trial 595 finished with values: [-1000000000.0, 1000000000.0] and parameters: {'p_sma': 27, 'p_std': 53, 'p_atr': 26, 'p_adx': 24, 'rsi_period': 34, 'ema1': 26, 'ema2': 44, 'slip_atr_k': 0.010530414127843665, 'slip_spread_k': 0.17440337624694457, 'spread_hl_frac': 0.04831952605371462, 'bb_std_mult': 2.11171304655495, 'rsi_os': 26, 'rsi_ob': 83, 'vol_spike': 0.1881873264651745, 'adx_thresh': 11.66299814122333, 'atr_min_pct': 0.0030394395075249436, 'atr_max_pct': 0.03346926043116415, 'tp_mult': 1.019355643344403, 'tsl_mult': 0.4617706265231242, 'strategy': 'mean_reversion', 'time_stop': 170, 'use_sma': True, 'use_atr': True, 'use_adx': False, 'use_ema': True, 'use_spike': False, 'rsi_required': False, 'edge_k': 1.1398741627710927, 'edge_cap': 0.5608240803127368, 'bull_strategy': 'mean_reversion', 'bull_bb_std_mult': 3.055185269784088, 'bull_rsi_os': 27, 'bull_rsi_ob': 74, 'bull_adx_thresh': 19.920905154782968, 'bull_atr_min_pct': 0.01706953938489684, 'bull_atr_max_pct': 0.09247393364779792, 'bull_tp_mult': 2.6043113726877762, 'bull_tsl_mult': 0.6759017449365526, 'bull_time_stop': 157, 'bull_use_sma': True, 'bull_use_ema': False, 'bull_use_atr': False, 'bull_use_adx': False, 'bull_use_spike': True, 'bull_rsi_required': True, 'bear_strategy': 'breakout', 'bear_bb_std_mult': 2.677812981542939, 'bear_rsi_os': 31, 'bear_rsi_ob': 63, 'bear_adx_thresh': 16.161853278211606, 'bear_atr_min_pct': 0.00862450729068155, 'bear_atr_max_pct': 0.039733386466599005, 'bear_tp_mult': 2.6662992168168103, 'bear_tsl_mult': 0.9393938373080608, 'bear_time_stop': 182, 'bear_use_sma': True, 'bear_use_ema': True, 'bear_use_atr': False, 'bear_use_adx': True, 'bear_use_spike': True, 'bear_rsi_required': False, 'sideways_strategy': 'breakout', 'sideways_bb_std_mult': 2.372820963761591, 'sideways_rsi_os': 6, 'sideways_rsi_ob': 76, 'sideways_adx_thresh': 5.430742581086202, 'sideways_atr_min_pct': 0.004175980137986918, 'sideways_atr_max_pct': 0.030755714319948835, 'sideways_tp_mult': 1.071725126069764, 'sideways_tsl_mult': 0.9086533270491293, 'sideways_time_stop': 189, 'sideways_use_sma': False, 'sideways_use_ema': False, 'sideways_use_atr': True, 'sideways_use_adx': False, 'sideways_use_spike': False, 'sideways_rsi_required': False}.
[I 2025-08-29 20:45:57,044] Trial 597 finished with values: [-0.07508156131915511, 0.07506470223463668] and parameters: {'p_sma': 23, 'p_std': 34, 'p_atr': 12, 'p_adx': 12, 'rsi_period': 48, 'ema1': 25, 'ema2': 48, 'slip_atr_k': 0.19178238356515293, 'slip_spread_k': 0.4136908556363555, 'spread_hl_frac': 0.04804833223294204, 'bb_std_mult': 0.6904002162082965, 'rsi_os': 9, 'rsi_ob': 82, 'vol_spike': 0.17965604125011114, 'adx_thresh': 11.665160595670724, 'atr_min_pct': 0.018545142746099582, 'atr_max_pct': 0.033331054036343594, 'tp_mult': 1.4486022043003564, 'tsl_mult': 0.7652948424544501, 'strategy': 'mean_reversion', 'time_stop': 173, 'use_sma': True, 'use_atr': False, 'use_adx': True, 'use_ema': True, 'use_spike': True, 'rsi_required': False, 'edge_k': 0.7180834801246089, 'edge_cap': 0.5583167636006579, 'bull_strategy': 'mean_reversion', 'bull_bb_std_mult': 2.0381269301246636, 'bull_rsi_os': 21, 'bull_rsi_ob': 73, 'bull_adx_thresh': 19.738928501797254, 'bull_atr_min_pct': 0.00546076361327367, 'bull_atr_max_pct': 0.0929190318018957, 'bull_tp_mult': 2.762432673735059, 'bull_tsl_mult': 0.8647008808308597, 'bull_time_stop': 19, 'bull_use_sma': True, 'bull_use_ema': True, 'bull_use_atr': False, 'bull_use_adx': False, 'bull_use_spike': False, 'bull_rsi_required': False, 'bear_strategy': 'mean_reversion', 'bear_bb_std_mult': 2.670122881700561, 'bear_rsi_os': 43, 'bear_rsi_ob': 64, 'bear_adx_thresh': 21.807487900585077, 'bear_atr_min_pct': 0.007348790317740786, 'bear_atr_max_pct': 0.04787666118440794, 'bear_tp_mult': 1.2987554964478942, 'bear_tsl_mult': 0.9467467079951571, 'bear_time_stop': 149, 'bear_use_sma': False, 'bear_use_ema': True, 'bear_use_atr': False, 'bear_use_adx': True, 'bear_use_spike': True, 'bear_rsi_required': False, 'sideways_strategy': 'breakout', 'sideways_bb_std_mult': 2.5952762391621294, 'sideways_rsi_os': 46, 'sideways_rsi_ob': 80, 'sideways_adx_thresh': 14.313723402450561, 'sideways_atr_min_pct': 0.0016173020828832325, 'sideways_atr_max_pct': 0.08327499336845119, 'sideways_tp_mult': 2.472941163689824, 'sideways_tsl_mult': 0.9148975136744993, 'sideways_time_stop': 201, 'sideways_use_sma': False, 'sideways_use_ema': False, 'sideways_use_atr': True, 'sideways_use_adx': False, 'sideways_use_spike': False, 'sideways_rsi_required': False}.
[I 2025-08-29 20:46:25,636] Trial 600 finished with values: [-1000000000.0, 1000000000.0] and parameters: {'p_sma': 20, 'p_std': 22, 'p_atr': 25, 'p_adx': 12, 'rsi_period': 8, 'ema1': 25, 'ema2': 46, 'slip_atr_k': 0.16355939514161563, 'slip_spread_k': 0.19384694890985818, 'spread_hl_frac': 0.047163936405960484, 'bb_std_mult': 1.9459437495658607, 'rsi_os': 11, 'rsi_ob': 62, 'vol_spike': 0.042764968324283587, 'adx_thresh': 29.29172844189882, 'atr_min_pct': 0.018504306131731662, 'atr_max_pct': 0.06887760907276945, 'tp_mult': 1.9113070291270122, 'tsl_mult': 0.21304408850506779, 'strategy': 'breakout', 'time_stop': 294, 'use_sma': True, 'use_atr': False, 'use_adx': True, 'use_ema': False, 'use_spike': True, 'rsi_required': False, 'edge_k': 1.0384085776905383, 'edge_cap': 0.6125340569378652, 'bull_strategy': 'mean_reversion', 'bull_bb_std_mult': 2.9516533951916575, 'bull_rsi_os': 31, 'bull_rsi_ob': 73, 'bull_adx_thresh': 13.945682809017928, 'bull_atr_min_pct': 0.014263973669884288, 'bull_atr_max_pct': 0.10473066236145255, 'bull_tp_mult': 2.2303687417039617, 'bull_tsl_mult': 0.8547545184316578, 'bull_time_stop': 234, 'bull_use_sma': True, 'bull_use_ema': True, 'bull_use_atr': True, 'bull_use_adx': False, 'bull_use_spike': False, 'bull_rsi_required': False, 'bear_strategy': 'mean_reversion', 'bear_bb_std_mult': 2.816111325196432, 'bear_rsi_os': 26, 'bear_rsi_ob': 53, 'bear_adx_thresh': 26.77619861594534, 'bear_atr_min_pct': 0.007162634919761556, 'bear_atr_max_pct': 0.04791977460691578, 'bear_tp_mult': 2.478531843908721, 'bear_tsl_mult': 0.9047042501228988, 'bear_time_stop': 266, 'bear_use_sma': False, 'bear_use_ema': True, 'bear_use_atr': True, 'bear_use_adx': False, 'bear_use_spike': True, 'bear_rsi_required': True, 'sideways_strategy': 'mean_reversion', 'sideways_bb_std_mult': 2.6318055145344945, 'sideways_rsi_os': 43, 'sideways_rsi_ob': 81, 'sideways_adx_thresh': 31.44194043401126, 'sideways_atr_min_pct': 0.016174756497670327, 'sideways_atr_max_pct': 0.017835335287736273, 'sideways_tp_mult': 1.132409145954136, 'sideways_tsl_mult': 0.5356871971129626, 'sideways_time_stop': 190, 'sideways_use_sma': True, 'sideways_use_ema': False, 'sideways_use_atr': False, 'sideways_use_adx': True, 'sideways_use_spike': False, 'sideways_rsi_required': False}.
[I 2025-08-29 20:46:25,861] Trial 599 finished with values: [-0.004083302059194049, 0.004142435675434391] and parameters: {'p_sma': 20, 'p_std': 45, 'p_atr': 28, 'p_adx': 12, 'rsi_period': 42, 'ema1': 25, 'ema2': 48, 'slip_atr_k': 0.006859540292492409, 'slip_spread_k': 0.19401703892447253, 'spread_hl_frac': 0.04803461608917791, 'bb_std_mult': 1.676906050917626, 'rsi_os': 26, 'rsi_ob': 82, 'vol_spike': 0.1809189280781312, 'adx_thresh': 11.592427157235354, 'atr_min_pct': 0.02237690091540384, 'atr_max_pct': 0.03590765304299953, 'tp_mult': 1.9282227555355687, 'tsl_mult': 0.7782306642577388, 'strategy': 'breakout', 'time_stop': 260, 'use_sma': True, 'use_atr': False, 'use_adx': True, 'use_ema': True, 'use_spike': True, 'rsi_required': False, 'edge_k': 1.0837051174026586, 'edge_cap': 0.5756062092981892, 'bull_strategy': 'mean_reversion', 'bull_bb_std_mult': 3.1038068862623716, 'bull_rsi_os': 27, 'bull_rsi_ob': 73, 'bull_adx_thresh': 15.830636384893522, 'bull_atr_min_pct': 0.011301685904157812, 'bull_atr_max_pct': 0.10480260779274864, 'bull_tp_mult': 2.766473683685408, 'bull_tsl_mult': 0.35305633314353, 'bull_time_stop': 207, 'bull_use_sma': True, 'bull_use_ema': True, 'bull_use_atr': True, 'bull_use_adx': False, 'bull_use_spike': False, 'bull_rsi_required': False, 'bear_strategy': 'mean_reversion', 'bear_bb_std_mult': 2.6851495682760667, 'bear_rsi_os': 31, 'bear_rsi_ob': 68, 'bear_adx_thresh': 21.512453767907918, 'bear_atr_min_pct': 0.019395885541214825, 'bear_atr_max_pct': 0.04720726523063848, 'bear_tp_mult': 2.7789710193903936, 'bear_tsl_mult': 0.9423897855702028, 'bear_time_stop': 61, 'bear_use_sma': True, 'bear_use_ema': True, 'bear_use_atr': True, 'bear_use_adx': True, 'bear_use_spike': True, 'bear_rsi_required': False, 'sideways_strategy': 'breakout', 'sideways_bb_std_mult': 2.6008423538648673, 'sideways_rsi_os': 51, 'sideways_rsi_ob': 81, 'sideways_adx_thresh': 34.141971110135295, 'sideways_atr_min_pct': 0.0032917741484763097, 'sideways_atr_max_pct': 0.13600034998838828, 'sideways_tp_mult': 1.1203905641994156, 'sideways_tsl_mult': 0.6921164818458998, 'sideways_time_stop': 189, 'sideways_use_sma': False, 'sideways_use_ema': False, 'sideways_use_atr': False, 'sideways_use_adx': True, 'sideways_use_spike': False, 'sideways_rsi_required': False}.
[I 2025-08-29 20:46:25,935] Trial 598 finished with values: [-0.005159557193720854, 0.005161508463513613] and parameters: {'p_sma': 23, 'p_std': 34, 'p_atr': 12, 'p_adx': 12, 'rsi_period': 34, 'ema1': 24, 'ema2': 48, 'slip_atr_k': 0.05699901727510949, 'slip_spread_k': 0.17291189392111742, 'spread_hl_frac': 0.04144302995391687, 'bb_std_mult': 1.652620994035125, 'rsi_os': 11, 'rsi_ob': 88, 'vol_spike': 0.18226769975837778, 'adx_thresh': 11.457827322276142, 'atr_min_pct': 0.02002542630287402, 'atr_max_pct': 0.0368705673495208, 'tp_mult': 2.0790175339564105, 'tsl_mult': 0.8785070370197932, 'strategy': 'mean_reversion', 'time_stop': 263, 'use_sma': True, 'use_atr': False, 'use_adx': True, 'use_ema': True, 'use_spike': True, 'rsi_required': False, 'edge_k': 1.8589077040371182, 'edge_cap': 0.5661490427202732, 'bull_strategy': 'mean_reversion', 'bull_bb_std_mult': 3.597334200525805, 'bull_rsi_os': 27, 'bull_rsi_ob': 64, 'bull_adx_thresh': 7.3996767572848245, 'bull_atr_min_pct': 0.011418100361553326, 'bull_atr_max_pct': 0.08772223694236465, 'bull_tp_mult': 1.233062874218854, 'bull_tsl_mult': 0.9982802140261104, 'bull_time_stop': 33, 'bull_use_sma': True, 'bull_use_ema': True, 'bull_use_atr': False, 'bull_use_adx': False, 'bull_use_spike': False, 'bull_rsi_required': False, 'bear_strategy': 'mean_reversion', 'bear_bb_std_mult': 2.6893207309132343, 'bear_rsi_os': 31, 'bear_rsi_ob': 64, 'bear_adx_thresh': 15.666359946048557, 'bear_atr_min_pct': 0.019398635560848074, 'bear_atr_max_pct': 0.0987382371102161, 'bear_tp_mult': 1.29061443171663, 'bear_tsl_mult': 0.8695680676738022, 'bear_time_stop': 218, 'bear_use_sma': False, 'bear_use_ema': True, 'bear_use_atr': False, 'bear_use_adx': True, 'bear_use_spike': True, 'bear_rsi_required': False, 'sideways_strategy': 'breakout', 'sideways_bb_std_mult': 2.373003842313384, 'sideways_rsi_os': 36, 'sideways_rsi_ob': 93, 'sideways_adx_thresh': 25.159858636334764, 'sideways_atr_min_pct': 0.0038930888603128156, 'sideways_atr_max_pct': 0.09261091696398376, 'sideways_tp_mult': 1.118370991231222, 'sideways_tsl_mult': 0.9196335037522363, 'sideways_time_stop': 187, 'sideways_use_sma': False, 'sideways_use_ema': False, 'sideways_use_atr': True, 'sideways_use_adx': False, 'sideways_use_spike': False, 'sideways_rsi_required': False}.
[I 2025-08-29 20:46:26,623] Trial 601 finished with values: [-1000000000.0, 1000000000.0] and parameters: {'p_sma': 20, 'p_std': 45, 'p_atr': 24, 'p_adx': 21, 'rsi_period': 44, 'ema1': 26, 'ema2': 54, 'slip_atr_k': 0.16204779767145067, 'slip_spread_k': 0.44885958637914447, 'spread_hl_frac': 0.03428116176618433, 'bb_std_mult': 2.26277982016073, 'rsi_os': 11, 'rsi_ob': 86, 'vol_spike': 0.18174728806424056, 'adx_thresh': 12.524436872837896, 'atr_min_pct': 0.01984453823859221, 'atr_max_pct': 0.037204055911609246, 'tp_mult': 2.047344575236233, 'tsl_mult': 0.8900578462885078, 'strategy': 'breakout', 'time_stop': 156, 'use_sma': True, 'use_atr': False, 'use_adx': True, 'use_ema': False, 'use_spike': True, 'rsi_required': False, 'edge_k': 1.0787329948561275, 'edge_cap': 0.6183246697634188, 'bull_strategy': 'mean_reversion', 'bull_bb_std_mult': 2.9354367502945, 'bull_rsi_os': 34, 'bull_rsi_ob': 72, 'bull_adx_thresh': 7.472816334863719, 'bull_atr_min_pct': 0.01919671913843305, 'bull_atr_max_pct': 0.09922722623093935, 'bull_tp_mult': 2.7250099446606177, 'bull_tsl_mult': 0.8446706698515574, 'bull_time_stop': 32, 'bull_use_sma': True, 'bull_use_ema': True, 'bull_use_atr': True, 'bull_use_adx': False, 'bull_use_spike': False, 'bull_rsi_required': False, 'bear_strategy': 'mean_reversion', 'bear_bb_std_mult': 2.85107983648024, 'bear_rsi_os': 26, 'bear_rsi_ob': 68, 'bear_adx_thresh': 26.705744977846024, 'bear_atr_min_pct': 0.0030574949697104985, 'bear_atr_max_pct': 0.04189033178653095, 'bear_tp_mult': 1.6802010654392987, 'bear_tsl_mult': 0.7589404830468257, 'bear_time_stop': 61, 'bear_use_sma': False, 'bear_use_ema': True, 'bear_use_atr': True, 'bear_use_adx': False, 'bear_use_spike': True, 'bear_rsi_required': True, 'sideways_strategy': 'mean_reversion', 'sideways_bb_std_mult': 3.5279397694533614, 'sideways_rsi_os': 43, 'sideways_rsi_ob': 81, 'sideways_adx_thresh': 34.03555342177125, 'sideways_atr_min_pct': 0.01639571600718223, 'sideways_atr_max_pct': 0.017654286916540956, 'sideways_tp_mult': 1.1426797020459065, 'sideways_tsl_mult': 0.5335513475887081, 'sideways_time_stop': 164, 'sideways_use_sma': True, 'sideways_use_ema': False, 'sideways_use_atr': False, 'sideways_use_adx': True, 'sideways_use_spike': False, 'sideways_rsi_required': True}.
[I 2025-08-29 20:46:27,252] Trial 602 finished with values: [-1000000000.0, 1000000000.0] and parameters: {'p_sma': 56, 'p_std': 45, 'p_atr': 28, 'p_adx': 25, 'rsi_period': 41, 'ema1': 26, 'ema2': 46, 'slip_atr_k': 0.13644630976502062, 'slip_spread_k': 0.14103980773658212, 'spread_hl_frac': 0.049934692667218186, 'bb_std_mult': 1.6532439428902361, 'rsi_os': 50, 'rsi_ob': 86, 'vol_spike': 0.16926371650390512, 'adx_thresh': 12.504756346981317, 'atr_min_pct': 0.025352110106606866, 'atr_max_pct': 0.09765251457638113, 'tp_mult': 1.1673946132976518, 'tsl_mult': 0.8876804644054423, 'strategy': 'mean_reversion', 'time_stop': 187, 'use_sma': False, 'use_atr': False, 'use_adx': False, 'use_ema': True, 'use_spike': False, 'rsi_required': True, 'edge_k': 1.9600736621150168, 'edge_cap': 0.6282075680688638, 'bull_strategy': 'breakout', 'bull_bb_std_mult': 3.098723758466902, 'bull_rsi_os': 34, 'bull_rsi_ob': 77, 'bull_adx_thresh': 15.373359943044436, 'bull_atr_min_pct': 0.01113506936666988, 'bull_atr_max_pct': 0.10015942367831057, 'bull_tp_mult': 2.709663012833309, 'bull_tsl_mult': 0.8875066326969782, 'bull_time_stop': 254, 'bull_use_sma': False, 'bull_use_ema': False, 'bull_use_atr': True, 'bull_use_adx': True, 'bull_use_spike': True, 'bull_rsi_required': False, 'bear_strategy': 'breakout', 'bear_bb_std_mult': 0.7259682915292265, 'bear_rsi_os': 29, 'bear_rsi_ob': 52, 'bear_adx_thresh': 20.128233740970778, 'bear_atr_min_pct': 0.02916315843497108, 'bear_atr_max_pct': 0.09515875713602324, 'bear_tp_mult': 2.771607590066734, 'bear_tsl_mult': 0.7609572473879826, 'bear_time_stop': 63, 'bear_use_sma': False, 'bear_use_ema': False, 'bear_use_atr': False, 'bear_use_adx': True, 'bear_use_spike': False, 'bear_rsi_required': False, 'sideways_strategy': 'breakout', 'sideways_bb_std_mult': 1.3805431947079643, 'sideways_rsi_os': 48, 'sideways_rsi_ob': 77, 'sideways_adx_thresh': 23.864624451078083, 'sideways_atr_min_pct': 0.0032751423889693996, 'sideways_atr_max_pct': 0.023403711732419487, 'sideways_tp_mult': 1.9466335957477967, 'sideways_tsl_mult': 0.6939579572746455, 'sideways_time_stop': 187, 'sideways_use_sma': False, 'sideways_use_ema': True, 'sideways_use_atr': False, 'sideways_use_adx': False, 'sideways_use_spike': True, 'sideways_rsi_required': True}.
