[I 2025-08-29 20:10:29,475] Trial 287 finished with values: [-1000000000.0, 1000000000.0] and parameters: {'p_sma': 27, 'p_std': 49, 'p_atr': 26, 'p_adx': 18, 'rsi_period': 47, 'ema1': 20, 'ema2': 33, 'slip_atr_k': 0.01959126167459169, 'slip_spread_k': 0.13965806197992503, 'spread_hl_frac': 0.03860196903766998, 'bb_std_mult': 1.8371476191573024, 'rsi_os': 16, 'rsi_ob': 64, 'vol_spike': 0.28269296866861954, 'adx_thresh': 31.917124202545118, 'atr_min_pct': 0.011711626177987175, 'atr_max_pct': 0.04887378189383418, 'tp_mult': 2.8431434830053304, 'tsl_mult': 0.24514964315584192, 'strategy': 'breakout', 'time_stop': 243, 'use_sma': True, 'use_atr': True, 'use_adx': False, 'use_ema': False, 'use_spike': False, 'rsi_required': True, 'edge_k': 1.098752520727794, 'edge_cap': 0.4808238965556282, 'bull_strategy': 'mean_reversion', 'bull_bb_std_mult': 3.2522390197380933, 'bull_rsi_os': 10, 'bull_rsi_ob': 94, 'bull_adx_thresh': 16.413746758023592, 'bull_atr_min_pct': 0.0014701015313839149, 'bull_atr_max_pct': 0.025116159300163636, 'bull_tp_mult': 2.4029086348579445, 'bull_tsl_mult': 0.9776217455274983, 'bull_time_stop': 186, 'bull_use_sma': True, 'bull_use_ema': True, 'bull_use_atr': False, 'bull_use_adx': True, 'bull_use_spike': False, 'bull_rsi_required': True, 'bear_strategy': 'mean_reversion', 'bear_bb_std_mult': 3.063949445060469, 'bear_rsi_os': 8, 'bear_rsi_ob': 69, 'bear_adx_thresh': 15.351715547226645, 'bear_atr_min_pct': 0.0049856003925610294, 'bear_atr_max_pct': 0.06115984292059543, 'bear_tp_mult': 1.0434701334228678, 'bear_tsl_mult': 0.26260988600351837, 'bear_time_stop': 252, 'bear_use_sma': False, 'bear_use_ema': True, 'bear_use_atr': True, 'bear_use_adx': False, 'bear_use_spike': True, 'bear_rsi_required': False, 'sideways_strategy': 'mean_reversion', 'sideways_bb_std_mult': 1.862779181385163, 'sideways_rsi_os': 47, 'sideways_rsi_ob': 94, 'sideways_adx_thresh': 16.746750928981612, 'sideways_atr_min_pct': 0.008897812916169123, 'sideways_atr_max_pct': 0.0674774474476929, 'sideways_tp_mult': 2.831971700747125, 'sideways_tsl_mult': 0.7251964169568735, 'sideways_time_stop': 254, 'sideways_use_sma': True, 'sideways_use_ema': True, 'sideways_use_atr': True, 'sideways_use_adx': False, 'sideways_use_spike': True, 'sideways_rsi_required': False}.
[I 2025-08-29 20:10:59,165] Trial 290 finished with values: [-1000000000.0, 1000000000.0] and parameters: {'p_sma': 39, 'p_std': 42, 'p_atr': 17, 'p_adx': 17, 'rsi_period': 35, 'ema1': 20, 'ema2': 49, 'slip_atr_k': 0.0179969529152265, 'slip_spread_k': 0.9549381177559119, 'spread_hl_frac': 2.0119193724407475e-05, 'bb_std_mult': 1.0549330349386872, 'rsi_os': 44, 'rsi_ob': 68, 'vol_spike': 0.08495561545416097, 'adx_thresh': 23.389356871560786, 'atr_min_pct': 0.002574792483662139, 'atr_max_pct': 0.02050577588257161, 'tp_mult': 1.719917801604528, 'tsl_mult': 0.8893361635182411, 'strategy': 'breakout', 'time_stop': 154, 'use_sma': True, 'use_atr': True, 'use_adx': True, 'use_ema': False, 'use_spike': False, 'rsi_required': True, 'edge_k': 0.48195664953089834, 'edge_cap': 0.8540938300312666, 'bull_strategy': 'mean_reversion', 'bull_bb_std_mult': 1.5613667152452788, 'bull_rsi_os': 37, 'bull_rsi_ob': 94, 'bull_adx_thresh': 12.208326830085014, 'bull_atr_min_pct': 0.00046846169216787996, 'bull_atr_max_pct': 0.02423690455218271, 'bull_tp_mult': 2.376469924047939, 'bull_tsl_mult': 0.07798217227970738, 'bull_time_stop': 188, 'bull_use_sma': True, 'bull_use_ema': True, 'bull_use_atr': False, 'bull_use_adx': True, 'bull_use_spike': False, 'bull_rsi_required': True, 'bear_strategy': 'mean_reversion', 'bear_bb_std_mult': 2.2585516160510006, 'bear_rsi_os': 30, 'bear_rsi_ob': 69, 'bear_adx_thresh': 15.384834031835783, 'bear_atr_min_pct': 0.01716233548482145, 'bear_atr_max_pct': 0.13583651502401808, 'bear_tp_mult': 1.041159673825836, 'bear_tsl_mult': 0.4513303909742612, 'bear_time_stop': 223, 'bear_use_sma': True, 'bear_use_ema': True, 'bear_use_atr': True, 'bear_use_adx': False, 'bear_use_spike': True, 'bear_rsi_required': False, 'sideways_strategy': 'mean_reversion', 'sideways_bb_std_mult': 1.8841633880924085, 'sideways_rsi_os': 6, 'sideways_rsi_ob': 83, 'sideways_adx_thresh': 16.550715993187048, 'sideways_atr_min_pct': 0.005754405567523581, 'sideways_atr_max_pct': 0.06932237076580923, 'sideways_tp_mult': 2.6268759448094667, 'sideways_tsl_mult': 0.6876828256693648, 'sideways_time_stop': 36, 'sideways_use_sma': False, 'sideways_use_ema': False, 'sideways_use_atr': True, 'sideways_use_adx': True, 'sideways_use_spike': False, 'sideways_rsi_required': False}.
[I 2025-08-29 20:10:59,372] Trial 291 finished with values: [-1000000000.0, 1000000000.0] and parameters: {'p_sma': 16, 'p_std': 51, 'p_atr': 25, 'p_adx': 8, 'rsi_period': 36, 'ema1': 19, 'ema2': 28, 'slip_atr_k': 0.1549619696379774, 'slip_spread_k': 0.3172542431530341, 'spread_hl_frac': 0.0006953466118691989, 'bb_std_mult': 1.0456320657466003, 'rsi_os': 42, 'rsi_ob': 68, 'vol_spike': 0.1780468953895626, 'adx_thresh': 23.58177491928539, 'atr_min_pct': 0.01179598051729318, 'atr_max_pct': 0.045552478483622205, 'tp_mult': 2.843681422498995, 'tsl_mult': 0.5767873788655443, 'strategy': 'mean_reversion', 'time_stop': 153, 'use_sma': True, 'use_atr': True, 'use_adx': True, 'use_ema': False, 'use_spike': False, 'rsi_required': True, 'edge_k': 1.2244511250706769, 'edge_cap': 0.1716018690780799, 'bull_strategy': 'mean_reversion', 'bull_bb_std_mult': 1.5770372887044282, 'bull_rsi_os': 11, 'bull_rsi_ob': 94, 'bull_adx_thresh': 19.03370038523093, 'bull_atr_min_pct': 0.0005991335390107923, 'bull_atr_max_pct': 0.025863913078860563, 'bull_tp_mult': 2.3422994406218276, 'bull_tsl_mult': 0.07886428864122927, 'bull_time_stop': 185, 'bull_use_sma': True, 'bull_use_ema': True, 'bull_use_atr': False, 'bull_use_adx': True, 'bull_use_spike': False, 'bull_rsi_required': True, 'bear_strategy': 'mean_reversion', 'bear_bb_std_mult': 1.1066015106797038, 'bear_rsi_os': 29, 'bear_rsi_ob': 69, 'bear_adx_thresh': 15.22807705934379, 'bear_atr_min_pct': 0.021544832072433788, 'bear_atr_max_pct': 0.10825086225146868, 'bear_tp_mult': 1.0133185817274517, 'bear_tsl_mult': 0.47309552105488545, 'bear_time_stop': 224, 'bear_use_sma': True, 'bear_use_ema': True, 'bear_use_atr': True, 'bear_use_adx': False, 'bear_use_spike': True, 'bear_rsi_required': False, 'sideways_strategy': 'mean_reversion', 'sideways_bb_std_mult': 2.0050202897656035, 'sideways_rsi_os': 13, 'sideways_rsi_ob': 94, 'sideways_adx_thresh': 16.696953528682425, 'sideways_atr_min_pct': 0.005624016486036561, 'sideways_atr_max_pct': 0.06931451672666815, 'sideways_tp_mult': 1.6479936730288092, 'sideways_tsl_mult': 0.7291341012606585, 'sideways_time_stop': 255, 'sideways_use_sma': False, 'sideways_use_ema': False, 'sideways_use_atr': True, 'sideways_use_adx': True, 'sideways_use_spike': False, 'sideways_rsi_required': False}.
[I 2025-08-29 20:10:59,654] Trial 292 finished with values: [-1000000000.0, 1000000000.0] and parameters: {'p_sma': 41, 'p_std': 51, 'p_atr': 24, 'p_adx': 17, 'rsi_period': 36, 'ema1': 19, 'ema2': 10, 'slip_atr_k': 0.02388087010032934, 'slip_spread_k': 0.18302110564417864, 'spread_hl_frac': 4.629334338610491e-05, 'bb_std_mult': 1.039123228135296, 'rsi_os': 43, 'rsi_ob': 66, 'vol_spike': 0.23236009028543214, 'adx_thresh': 17.78272637609969, 'atr_min_pct': 0.02114958980114645, 'atr_max_pct': 0.044907946886792345, 'tp_mult': 1.7256687531359367, 'tsl_mult': 0.43072433402409116, 'strategy': 'mean_reversion', 'time_stop': 154, 'use_sma': True, 'use_atr': True, 'use_adx': True, 'use_ema': False, 'use_spike': False, 'rsi_required': True, 'edge_k': 1.7725431504603155, 'edge_cap': 0.16046555147761465, 'bull_strategy': 'mean_reversion', 'bull_bb_std_mult': 1.9774583036163391, 'bull_rsi_os': 38, 'bull_rsi_ob': 95, 'bull_adx_thresh': 18.754992107691073, 'bull_atr_min_pct': 0.0004138191701579598, 'bull_atr_max_pct': 0.04691874977195699, 'bull_tp_mult': 2.5848659899155657, 'bull_tsl_mult': 0.04474588193352297, 'bull_time_stop': 173, 'bull_use_sma': True, 'bull_use_ema': True, 'bull_use_atr': False, 'bull_use_adx': True, 'bull_use_spike': False, 'bull_rsi_required': True, 'bear_strategy': 'breakout', 'bear_bb_std_mult': 1.0896851581410256, 'bear_rsi_os': 30, 'bear_rsi_ob': 81, 'bear_adx_thresh': 7.700139287755122, 'bear_atr_min_pct': 0.022767154384116226, 'bear_atr_max_pct': 0.10782611899401676, 'bear_tp_mult': 1.010553439574844, 'bear_tsl_mult': 0.482522185558219, 'bear_time_stop': 206, 'bear_use_sma': True, 'bear_use_ema': True, 'bear_use_atr': True, 'bear_use_adx': False, 'bear_use_spike': True, 'bear_rsi_required': False, 'sideways_strategy': 'breakout', 'sideways_bb_std_mult': 1.9977651122825362, 'sideways_rsi_os': 18, 'sideways_rsi_ob': 83, 'sideways_adx_thresh': 19.558149536947834, 'sideways_atr_min_pct': 0.005650846308218049, 'sideways_atr_max_pct': 0.02539438685481093, 'sideways_tp_mult': 2.639177963922711, 'sideways_tsl_mult': 0.6824551775944014, 'sideways_time_stop': 241, 'sideways_use_sma': False, 'sideways_use_ema': False, 'sideways_use_atr': True, 'sideways_use_adx': True, 'sideways_use_spike': False, 'sideways_rsi_required': False}.
[I 2025-08-29 20:10:59,888] Trial 289 finished with values: [-1000000000.0, 1000000000.0] and parameters: {'p_sma': 41, 'p_std': 29, 'p_atr': 27, 'p_adx': 18, 'rsi_period': 48, 'ema1': 20, 'ema2': 27, 'slip_atr_k': 0.024622263188868822, 'slip_spread_k': 0.17401226371082984, 'spread_hl_frac': 0.0027976630477385108, 'bb_std_mult': 2.9914567360734736, 'rsi_os': 13, 'rsi_ob': 68, 'vol_spike': 0.08737626969254636, 'adx_thresh': 23.26816728485796, 'atr_min_pct': 0.013140192506184468, 'atr_max_pct': 0.02205702491047075, 'tp_mult': 1.8139478280472041, 'tsl_mult': 0.5778075875661768, 'strategy': 'mean_reversion', 'time_stop': 154, 'use_sma': True, 'use_atr': True, 'use_adx': False, 'use_ema': False, 'use_spike': False, 'rsi_required': True, 'edge_k': 0.441276997456473, 'edge_cap': 0.8469185046295888, 'bull_strategy': 'mean_reversion', 'bull_bb_std_mult': 3.258853970054962, 'bull_rsi_os': 14, 'bull_rsi_ob': 70, 'bull_adx_thresh': 18.942240827081097, 'bull_atr_min_pct': 0.0014174156552190713, 'bull_atr_max_pct': 0.014065954326979338, 'bull_tp_mult': 2.2591525140101796, 'bull_tsl_mult': 0.7722574814168446, 'bull_time_stop': 188, 'bull_use_sma': True, 'bull_use_ema': True, 'bull_use_atr': False, 'bull_use_adx': True, 'bull_use_spike': False, 'bull_rsi_required': True, 'bear_strategy': 'mean_reversion', 'bear_bb_std_mult': 3.101327036711636, 'bear_rsi_os': 30, 'bear_rsi_ob': 56, 'bear_adx_thresh': 28.99461320371171, 'bear_atr_min_pct': 0.010923374165729062, 'bear_atr_max_pct': 0.11901116390436829, 'bear_tp_mult': 1.0123618606860079, 'bear_tsl_mult': 0.45292698153064875, 'bear_time_stop': 15, 'bear_use_sma': True, 'bear_use_ema': True, 'bear_use_atr': True, 'bear_use_adx': False, 'bear_use_spike': True, 'bear_rsi_required': False, 'sideways_strategy': 'mean_reversion', 'sideways_bb_std_mult': 1.8513987889325756, 'sideways_rsi_os': 52, 'sideways_rsi_ob': 94, 'sideways_adx_thresh': 19.304844030656934, 'sideways_atr_min_pct': 0.005613210557725909, 'sideways_atr_max_pct': 0.06741330532843405, 'sideways_tp_mult': 2.8105054140455947, 'sideways_tsl_mult': 0.7295407445072593, 'sideways_time_stop': 241, 'sideways_use_sma': False, 'sideways_use_ema': True, 'sideways_use_atr': True, 'sideways_use_adx': True, 'sideways_use_spike': False, 'sideways_rsi_required': False}.
[I 2025-08-29 20:11:30,476] Trial 293 finished with values: [-1000000000.0, 1000000000.0] and parameters: {'p_sma': 45, 'p_std': 51, 'p_atr': 25, 'p_adx': 21, 'rsi_period': 36, 'ema1': 19, 'ema2': 28, 'slip_atr_k': 0.028988871424624654, 'slip_spread_k': 0.30919067836691133, 'spread_hl_frac': 0.0023181418418246275, 'bb_std_mult': 0.5123920497806067, 'rsi_os': 42, 'rsi_ob': 66, 'vol_spike': 0.23437114568102388, 'adx_thresh': 32.25150033787784, 'atr_min_pct': 0.024547708982653217, 'atr_max_pct': 0.1282257794940239, 'tp_mult': 1.650961376699601, 'tsl_mult': 0.5754806967932401, 'strategy': 'mean_reversion', 'time_stop': 171, 'use_sma': True, 'use_atr': True, 'use_adx': False, 'use_ema': False, 'use_spike': False, 'rsi_required': False, 'edge_k': 1.2306662067092704, 'edge_cap': 0.5861955918063863, 'bull_strategy': 'mean_reversion', 'bull_bb_std_mult': 1.454181017322066, 'bull_rsi_os': 41, 'bull_rsi_ob': 45, 'bull_adx_thresh': 34.976171977319645, 'bull_atr_min_pct': 2.9146430039112578e-05, 'bull_atr_max_pct': 0.14404375413851533, 'bull_tp_mult': 1.8312027150928958, 'bull_tsl_mult': 0.8755578938430211, 'bull_time_stop': 174, 'bull_use_sma': True, 'bull_use_ema': True, 'bull_use_atr': False, 'bull_use_adx': True, 'bull_use_spike': False, 'bull_rsi_required': True, 'bear_strategy': 'breakout', 'bear_bb_std_mult': 0.8853742177830721, 'bear_rsi_os': 28, 'bear_rsi_ob': 56, 'bear_adx_thresh': 7.207886353514179, 'bear_atr_min_pct': 0.005989108166444956, 'bear_atr_max_pct': 0.1085394263997377, 'bear_tp_mult': 1.0131172156406443, 'bear_tsl_mult': 0.4791580849193555, 'bear_time_stop': 17, 'bear_use_sma': True, 'bear_use_ema': True, 'bear_use_atr': True, 'bear_use_adx': False, 'bear_use_spike': True, 'bear_rsi_required': False, 'sideways_strategy': 'breakout', 'sideways_bb_std_mult': 1.5551985452325225, 'sideways_rsi_os': 13, 'sideways_rsi_ob': 81, 'sideways_adx_thresh': 9.865897316930884, 'sideways_atr_min_pct': 0.0010308939329820369, 'sideways_atr_max_pct': 0.08197459740682214, 'sideways_tp_mult': 2.684996245982966, 'sideways_tsl_mult': 0.6414816792346341, 'sideways_time_stop': 201, 'sideways_use_sma': False, 'sideways_use_ema': True, 'sideways_use_atr': True, 'sideways_use_adx': True, 'sideways_use_spike': False, 'sideways_rsi_required': False}.
[I 2025-08-29 20:11:30,802] Trial 294 finished with values: [-0.0012064127849438222, 0.0024623205039970807] and parameters: {'p_sma': 41, 'p_std': 39, 'p_atr': 30, 'p_adx': 16, 'rsi_period': 37, 'ema1': 19, 'ema2': 46, 'slip_atr_k': 0.03050420409802344, 'slip_spread_k': 0.20649195067895398, 'spread_hl_frac': 0.0024645432093060183, 'bb_std_mult': 1.180014480257095, 'rsi_os': 20, 'rsi_ob': 66, 'vol_spike': 0.23496127000458666, 'adx_thresh': 22.504965598029642, 'atr_min_pct': 0.016178121267374085, 'atr_max_pct': 0.12618696275904406, 'tp_mult': 1.6640947679451332, 'tsl_mult': 0.842836838743422, 'strategy': 'mean_reversion', 'time_stop': 173, 'use_sma': True, 'use_atr': True, 'use_adx': False, 'use_ema': True, 'use_spike': False, 'rsi_required': False, 'edge_k': 0.11165840815548644, 'edge_cap': 0.5641792103833997, 'bull_strategy': 'mean_reversion', 'bull_bb_std_mult': 1.337813989581704, 'bull_rsi_os': 38, 'bull_rsi_ob': 95, 'bull_adx_thresh': 17.50138315099264, 'bull_atr_min_pct': 1.4475854847977032e-07, 'bull_atr_max_pct': 0.1446781653569352, 'bull_tp_mult': 1.446022860758769, 'bull_tsl_mult': 0.15315922011272187, 'bull_time_stop': 176, 'bull_use_sma': True, 'bull_use_ema': True, 'bull_use_atr': False, 'bull_use_adx': False, 'bull_use_spike': False, 'bull_rsi_required': False, 'bear_strategy': 'breakout', 'bear_bb_std_mult': 1.181207453859566, 'bear_rsi_os': 28, 'bear_rsi_ob': 81, 'bear_adx_thresh': 7.662186605209919, 'bear_atr_min_pct': 0.006629382579917715, 'bear_atr_max_pct': 0.11554429857628702, 'bear_tp_mult': 2.659880622199429, 'bear_tsl_mult': 0.4845815259205114, 'bear_time_stop': 88, 'bear_use_sma': False, 'bear_use_ema': True, 'bear_use_atr': False, 'bear_use_adx': True, 'bear_use_spike': True, 'bear_rsi_required': False, 'sideways_strategy': 'breakout', 'sideways_bb_std_mult': 1.6772044023232198, 'sideways_rsi_os': 45, 'sideways_rsi_ob': 84, 'sideways_adx_thresh': 19.656574001108417, 'sideways_atr_min_pct': 0.004505655687947943, 'sideways_atr_max_pct': 0.017720532537815026, 'sideways_tp_mult': 2.684977580705067, 'sideways_tsl_mult': 0.6825833656565401, 'sideways_time_stop': 233, 'sideways_use_sma': False, 'sideways_use_ema': True, 'sideways_use_atr': True, 'sideways_use_adx': False, 'sideways_use_spike': False, 'sideways_rsi_required': False}.
[I 2025-08-29 20:11:30,814] Trial 295 finished with values: [-1000000000.0, 1000000000.0] and parameters: {'p_sma': 19, 'p_std': 53, 'p_atr': 24, 'p_adx': 25, 'rsi_period': 37, 'ema1': 20, 'ema2': 47, 'slip_atr_k': 0.031989457369100166, 'slip_spread_k': 0.19103925027879035, 'spread_hl_frac': 0.03374541419181238, 'bb_std_mult': 0.9129391223823009, 'rsi_os': 20, 'rsi_ob': 81, 'vol_spike': 0.18869331179117926, 'adx_thresh': 27.33532714474771, 'atr_min_pct': 0.022969496015788134, 'atr_max_pct': 0.04082292249990579, 'tp_mult': 1.6712560874127185, 'tsl_mult': 0.9143818207997569, 'strategy': 'mean_reversion', 'time_stop': 172, 'use_sma': True, 'use_atr': True, 'use_adx': False, 'use_ema': True, 'use_spike': False, 'rsi_required': False, 'edge_k': 1.6965501962639815, 'edge_cap': 0.5639836908317472, 'bull_strategy': 'mean_reversion', 'bull_bb_std_mult': 2.8223185521723857, 'bull_rsi_os': 41, 'bull_rsi_ob': 95, 'bull_adx_thresh': 17.484255641095913, 'bull_atr_min_pct': 0.0017844906857270948, 'bull_atr_max_pct': 0.10722856658510717, 'bull_tp_mult': 1.5697397678768583, 'bull_tsl_mult': 0.1484761032646028, 'bull_time_stop': 93, 'bull_use_sma': True, 'bull_use_ema': True, 'bull_use_atr': True, 'bull_use_adx': False, 'bull_use_spike': False, 'bull_rsi_required': False, 'bear_strategy': 'breakout', 'bear_bb_std_mult': 0.7670409610877724, 'bear_rsi_os': 28, 'bear_rsi_ob': 68, 'bear_adx_thresh': 22.52217008766914, 'bear_atr_min_pct': 0.005956751551566797, 'bear_atr_max_pct': 0.11593151452431091, 'bear_tp_mult': 1.6213753269986184, 'bear_tsl_mult': 0.8863087812900479, 'bear_time_stop': 15, 'bear_use_sma': False, 'bear_use_ema': True, 'bear_use_atr': False, 'bear_use_adx': True, 'bear_use_spike': True, 'bear_rsi_required': False, 'sideways_strategy': 'mean_reversion', 'sideways_bb_std_mult': 1.5693570696790387, 'sideways_rsi_os': 45, 'sideways_rsi_ob': 92, 'sideways_adx_thresh': 21.057960619706073, 'sideways_atr_min_pct': 0.0037664094896585213, 'sideways_atr_max_pct': 0.06465141085460166, 'sideways_tp_mult': 2.712703941944291, 'sideways_tsl_mult': 0.6391866396624092, 'sideways_time_stop': 158, 'sideways_use_sma': False, 'sideways_use_ema': True, 'sideways_use_atr': True, 'sideways_use_adx': False, 'sideways_use_spike': False, 'sideways_rsi_required': False}.
[I 2025-08-29 20:11:30,896] Trial 296 finished with values: [0.000799096013905265, 0.0010442187363466963] and parameters: {'p_sma': 19, 'p_std': 53, 'p_atr': 24, 'p_adx': 16, 'rsi_period': 37, 'ema1': 19, 'ema2': 47, 'slip_atr_k': 0.032111763863840695, 'slip_spread_k': 0.20394194965577644, 'spread_hl_frac': 0.002218709278038315, 'bb_std_mult': 1.295762500292748, 'rsi_os': 20, 'rsi_ob': 81, 'vol_spike': 0.18824834378337388, 'adx_thresh': 32.32859203647415, 'atr_min_pct': 0.01939233517618749, 'atr_max_pct': 0.039951713469465286, 'tp_mult': 1.6688470765575882, 'tsl_mult': 0.8414066036036845, 'strategy': 'mean_reversion', 'time_stop': 173, 'use_sma': True, 'use_atr': False, 'use_adx': False, 'use_ema': True, 'use_spike': False, 'rsi_required': False, 'edge_k': 1.1540730195063853, 'edge_cap': 0.5170505225165238, 'bull_strategy': 'mean_reversion', 'bull_bb_std_mult': 3.117420365963123, 'bull_rsi_os': 39, 'bull_rsi_ob': 73, 'bull_adx_thresh': 17.445345688344798, 'bull_atr_min_pct': 0.014786956561744507, 'bull_atr_max_pct': 0.027400025588646834, 'bull_tp_mult': 1.4571374591600241, 'bull_tsl_mult': 0.8706727063843915, 'bull_time_stop': 58, 'bull_use_sma': True, 'bull_use_ema': False, 'bull_use_atr': True, 'bull_use_adx': False, 'bull_use_spike': True, 'bull_rsi_required': False, 'bear_strategy': 'breakout', 'bear_bb_std_mult': 2.6790734944387227, 'bear_rsi_os': 28, 'bear_rsi_ob': 68, 'bear_adx_thresh': 6.099979922212871, 'bear_atr_min_pct': 0.005945610912306968, 'bear_atr_max_pct': 0.03713097495305965, 'bear_tp_mult': 2.657126870755513, 'bear_tsl_mult': 0.4156202092874122, 'bear_time_stop': 10, 'bear_use_sma': False, 'bear_use_ema': True, 'bear_use_atr': False, 'bear_use_adx': True, 'bear_use_spike': True, 'bear_rsi_required': False, 'sideways_strategy': 'breakout', 'sideways_bb_std_mult': 2.3091264572765358, 'sideways_rsi_os': 46, 'sideways_rsi_ob': 81, 'sideways_adx_thresh': 33.339850535108525, 'sideways_atr_min_pct': 0.00440039875500426, 'sideways_atr_max_pct': 0.018937015221998685, 'sideways_tp_mult': 1.0738204385074521, 'sideways_tsl_mult': 0.6810896228541872, 'sideways_time_stop': 204, 'sideways_use_sma': False, 'sideways_use_ema': True, 'sideways_use_atr': False, 'sideways_use_adx': False, 'sideways_use_spike': False, 'sideways_rsi_required': False}.
