[I 2025-08-29 19:57:36,899] Trial 179 finished with values: [-1000000000.0, 1000000000.0] and parameters: {'p_sma': 41, 'p_std': 53, 'p_atr': 22, 'p_adx': 18, 'rsi_period': 64, 'ema1': 12, 'ema2': 41, 'slip_atr_k': 0.1000260651297665, 'slip_spread_k': 0.2908422038827334, 'spread_hl_frac': 0.037339701200497434, 'bb_std_mult': 2.541128077827218, 'rsi_os': 21, 'rsi_ob': 71, 'vol_spike': 0.16181380248838803, 'adx_thresh': 9.787304312679773, 'atr_min_pct': 0.013064519767955163, 'atr_max_pct': 0.08598717889433291, 'tp_mult': 2.3388516565552004, 'tsl_mult': 0.6214487234198741, 'strategy': 'mean_reversion', 'time_stop': 29, 'use_sma': False, 'use_atr': True, 'use_adx': False, 'use_ema': True, 'use_spike': False, 'rsi_required': False, 'edge_k': 0.35956427187435536, 'edge_cap': 0.2331301586302767, 'bull_strategy': 'breakout', 'bull_bb_std_mult': 0.7051746583981757, 'bull_rsi_os': 7, 'bull_rsi_ob': 68, 'bull_adx_thresh': 28.240746519537268, 'bull_atr_min_pct': 0.008638765278629635, 'bull_atr_max_pct': 0.09059883702728048, 'bull_tp_mult': 1.3382365377856986, 'bull_tsl_mult': 0.19536029969086502, 'bull_time_stop': 58, 'bull_use_sma': False, 'bull_use_ema': False, 'bull_use_atr': True, 'bull_use_adx': False, 'bull_use_spike': False, 'bull_rsi_required': True, 'bear_strategy': 'breakout', 'bear_bb_std_mult': 1.8211884023173024, 'bear_rsi_os': 6, 'bear_rsi_ob': 79, 'bear_adx_thresh': 12.849530640382454, 'bear_atr_min_pct': 0.01354953466044072, 'bear_atr_max_pct': 0.023973963098340843, 'bear_tp_mult': 2.1004355771842653, 'bear_tsl_mult': 0.662996363587524, 'bear_time_stop': 5, 'bear_use_sma': False, 'bear_use_ema': True, 'bear_use_atr': True, 'bear_use_adx': True, 'bear_use_spike': True, 'bear_rsi_required': False, 'sideways_strategy': 'mean_reversion', 'sideways_bb_std_mult': 1.9100092904443833, 'sideways_rsi_os': 32, 'sideways_rsi_ob': 51, 'sideways_adx_thresh': 34.79749643133036, 'sideways_atr_min_pct': 0.01374045605648029, 'sideways_atr_max_pct': 0.10159343069052318, 'sideways_tp_mult': 2.3044289996864418, 'sideways_tsl_mult': 0.7290789952132586, 'sideways_time_stop': 257, 'sideways_use_sma': False, 'sideways_use_ema': False, 'sideways_use_atr': True, 'sideways_use_adx': True, 'sideways_use_spike': False, 'sideways_rsi_required': True}.
[I 2025-08-29 19:57:37,192] Trial 182 finished with values: [-0.0047218167202496275, 0.005053536843413082] and parameters: {'p_sma': 58, 'p_std': 55, 'p_atr': 24, 'p_adx': 11, 'rsi_period': 20, 'ema1': 24, 'ema2': 44, 'slip_atr_k': 0.04324097969085628, 'slip_spread_k': 0.0005857696619885888, 'spread_hl_frac': 0.022747319893960175, 'bb_std_mult': 2.5408791338489083, 'rsi_os': 21, 'rsi_ob': 60, 'vol_spike': 0.1803965425546183, 'adx_thresh': 8.235370724539877, 'atr_min_pct': 0.021741092237073427, 'atr_max_pct': 0.13672618498710876, 'tp_mult': 2.3238232518389608, 'tsl_mult': 0.5615303973268425, 'strategy': 'mean_reversion', 'time_stop': 300, 'use_sma': False, 'use_atr': True, 'use_adx': False, 'use_ema': True, 'use_spike': False, 'rsi_required': False, 'edge_k': 1.246849125361347, 'edge_cap': 0.5528212279081387, 'bull_strategy': 'breakout', 'bull_bb_std_mult': 1.3258552713334635, 'bull_rsi_os': 42, 'bull_rsi_ob': 68, 'bull_adx_thresh': 28.02809547678047, 'bull_atr_min_pct': 0.021857344969375556, 'bull_atr_max_pct': 0.019117708864029345, 'bull_tp_mult': 1.6091817302327245, 'bull_tsl_mult': 0.18341379434527227, 'bull_time_stop': 285, 'bull_use_sma': False, 'bull_use_ema': True, 'bull_use_atr': False, 'bull_use_adx': False, 'bull_use_spike': False, 'bull_rsi_required': True, 'bear_strategy': 'breakout', 'bear_bb_std_mult': 3.510386910822496, 'bear_rsi_os': 54, 'bear_rsi_ob': 95, 'bear_adx_thresh': 16.066125381127137, 'bear_atr_min_pct': 0.006420534655615369, 'bear_atr_max_pct': 0.08354442754689663, 'bear_tp_mult': 1.9878715096288881, 'bear_tsl_mult': 0.6692276009796844, 'bear_time_stop': 5, 'bear_use_sma': False, 'bear_use_ema': False, 'bear_use_atr': False, 'bear_use_adx': True, 'bear_use_spike': False, 'bear_rsi_required': True, 'sideways_strategy': 'mean_reversion', 'sideways_bb_std_mult': 3.410107352665351, 'sideways_rsi_os': 32, 'sideways_rsi_ob': 84, 'sideways_adx_thresh': 20.92120616390965, 'sideways_atr_min_pct': 0.014762989637641282, 'sideways_atr_max_pct': 0.0569480508388587, 'sideways_tp_mult': 1.883189157023862, 'sideways_tsl_mult': 0.9841289397894613, 'sideways_time_stop': 257, 'sideways_use_sma': False, 'sideways_use_ema': True, 'sideways_use_atr': True, 'sideways_use_adx': False, 'sideways_use_spike': False, 'sideways_rsi_required': True}.
[I 2025-08-29 19:57:37,505] Trial 181 finished with values: [-1000000000.0, 1000000000.0] and parameters: {'p_sma': 33, 'p_std': 55, 'p_atr': 17, 'p_adx': 18, 'rsi_period': 44, 'ema1': 5, 'ema2': 28, 'slip_atr_k': 0.04196816552838943, 'slip_spread_k': 0.21955559139714556, 'spread_hl_frac': 0.010281751476338294, 'bb_std_mult': 3.469999694650568, 'rsi_os': 21, 'rsi_ob': 60, 'vol_spike': 0.16197137573803058, 'adx_thresh': 34.87873154599531, 'atr_min_pct': 0.014003186269708147, 'atr_max_pct': 0.12979276400828735, 'tp_mult': 2.3186910154288953, 'tsl_mult': 0.6133952926059437, 'strategy': 'mean_reversion', 'time_stop': 24, 'use_sma': False, 'use_atr': True, 'use_adx': False, 'use_ema': True, 'use_spike': False, 'rsi_required': False, 'edge_k': 1.2584081536677127, 'edge_cap': 0.8426127426591012, 'bull_strategy': 'breakout', 'bull_bb_std_mult': 1.9171922708141271, 'bull_rsi_os': 7, 'bull_rsi_ob': 58, 'bull_adx_thresh': 17.678943347023694, 'bull_atr_min_pct': 0.020686551957734823, 'bull_atr_max_pct': 0.06355957268349467, 'bull_tp_mult': 1.398456758165315, 'bull_tsl_mult': 0.20061149198698686, 'bull_time_stop': 286, 'bull_use_sma': False, 'bull_use_ema': False, 'bull_use_atr': True, 'bull_use_adx': False, 'bull_use_spike': False, 'bull_rsi_required': True, 'bear_strategy': 'breakout', 'bear_bb_std_mult': 1.468479866413743, 'bear_rsi_os': 24, 'bear_rsi_ob': 79, 'bear_adx_thresh': 5.015156086001799, 'bear_atr_min_pct': 0.013320521088451519, 'bear_atr_max_pct': 0.07554271700263987, 'bear_tp_mult': 1.0505156420425315, 'bear_tsl_mult': 0.48770903721049513, 'bear_time_stop': 198, 'bear_use_sma': False, 'bear_use_ema': True, 'bear_use_atr': True, 'bear_use_adx': True, 'bear_use_spike': True, 'bear_rsi_required': True, 'sideways_strategy': 'mean_reversion', 'sideways_bb_std_mult': 1.9253424180493806, 'sideways_rsi_os': 7, 'sideways_rsi_ob': 84, 'sideways_adx_thresh': 34.550087500867505, 'sideways_atr_min_pct': 0.013747738403932374, 'sideways_atr_max_pct': 0.05665673137378786, 'sideways_tp_mult': 1.55675753507252, 'sideways_tsl_mult': 0.16076869427563772, 'sideways_time_stop': 257, 'sideways_use_sma': False, 'sideways_use_ema': True, 'sideways_use_atr': True, 'sideways_use_adx': True, 'sideways_use_spike': False, 'sideways_rsi_required': True}.
[I 2025-08-29 19:58:07,859] Trial 184 finished with values: [-1000000000.0, 1000000000.0] and parameters: {'p_sma': 60, 'p_std': 8, 'p_atr': 23, 'p_adx': 11, 'rsi_period': 27, 'ema1': 5, 'ema2': 43, 'slip_atr_k': 0.04193819312928751, 'slip_spread_k': 0.853721913477746, 'spread_hl_frac': 0.0027420341482751608, 'bb_std_mult': 1.2974563248572477, 'rsi_os': 21, 'rsi_ob': 65, 'vol_spike': 0.1820920646348514, 'adx_thresh': 7.5501161232296035, 'atr_min_pct': 0.013918421808928303, 'atr_max_pct': 0.08945641545981146, 'tp_mult': 2.480206196290224, 'tsl_mult': 0.5540358821303872, 'strategy': 'mean_reversion', 'time_stop': 127, 'use_sma': False, 'use_atr': True, 'use_adx': False, 'use_ema': False, 'use_spike': True, 'rsi_required': True, 'edge_k': 1.3092130046152144, 'edge_cap': 0.44383098231299645, 'bull_strategy': 'breakout', 'bull_bb_std_mult': 1.6127264386573699, 'bull_rsi_os': 37, 'bull_rsi_ob': 52, 'bull_adx_thresh': 9.669230730828916, 'bull_atr_min_pct': 0.02174614326925472, 'bull_atr_max_pct': 0.06363568403833691, 'bull_tp_mult': 1.691691443549604, 'bull_tsl_mult': 0.9998964024251585, 'bull_time_stop': 278, 'bull_use_sma': False, 'bull_use_ema': True, 'bull_use_atr': False, 'bull_use_adx': True, 'bull_use_spike': False, 'bull_rsi_required': True, 'bear_strategy': 'breakout', 'bear_bb_std_mult': 1.160855210261279, 'bear_rsi_os': 24, 'bear_rsi_ob': 69, 'bear_adx_thresh': 5.393940867672135, 'bear_atr_min_pct': 0.0061991550417439594, 'bear_atr_max_pct': 0.04945349215975777, 'bear_tp_mult': 1.9289658292144347, 'bear_tsl_mult': 0.7017990201832996, 'bear_time_stop': 11, 'bear_use_sma': True, 'bear_use_ema': False, 'bear_use_atr': False, 'bear_use_adx': False, 'bear_use_spike': False, 'bear_rsi_required': True, 'sideways_strategy': 'mean_reversion', 'sideways_bb_std_mult': 2.0148039056599867, 'sideways_rsi_os': 25, 'sideways_rsi_ob': 82, 'sideways_adx_thresh': 14.488283821589405, 'sideways_atr_min_pct': 0.01992880508672228, 'sideways_atr_max_pct': 0.11872796978060503, 'sideways_tp_mult': 2.109244461268524, 'sideways_tsl_mult': 0.1919507078022964, 'sideways_time_stop': 267, 'sideways_use_sma': False, 'sideways_use_ema': True, 'sideways_use_atr': True, 'sideways_use_adx': False, 'sideways_use_spike': False, 'sideways_rsi_required': True}.
[I 2025-08-29 19:58:08,026] Trial 185 finished with values: [-0.0022569434089305673, 0.002447272090975189] and parameters: {'p_sma': 39, 'p_std': 55, 'p_atr': 23, 'p_adx': 20, 'rsi_period': 20, 'ema1': 11, 'ema2': 43, 'slip_atr_k': 0.11667421405112725, 'slip_spread_k': 0.43845605844308144, 'spread_hl_frac': 0.028613570814286636, 'bb_std_mult': 1.334841570460615, 'rsi_os': 21, 'rsi_ob': 65, 'vol_spike': 0.18055972181750354, 'adx_thresh': 6.601924589907215, 'atr_min_pct': 0.013928880884149852, 'atr_max_pct': 0.08995374180242705, 'tp_mult': 2.4610345933101634, 'tsl_mult': 0.8507800832642616, 'strategy': 'mean_reversion', 'time_stop': 127, 'use_sma': False, 'use_atr': True, 'use_adx': False, 'use_ema': False, 'use_spike': False, 'rsi_required': True, 'edge_k': 1.3077801621529852, 'edge_cap': 0.9091317982231077, 'bull_strategy': 'breakout', 'bull_bb_std_mult': 0.7733980632979872, 'bull_rsi_os': 42, 'bull_rsi_ob': 60, 'bull_adx_thresh': 29.815724649446803, 'bull_atr_min_pct': 0.02177896724038702, 'bull_atr_max_pct': 0.06353842833319595, 'bull_tp_mult': 1.1559657598118813, 'bull_tsl_mult': 0.23051232146251918, 'bull_time_stop': 278, 'bull_use_sma': False, 'bull_use_ema': True, 'bull_use_atr': False, 'bull_use_adx': True, 'bull_use_spike': False, 'bull_rsi_required': True, 'bear_strategy': 'breakout', 'bear_bb_std_mult': 1.1095910380756782, 'bear_rsi_os': 29, 'bear_rsi_ob': 69, 'bear_adx_thresh': 5.383553010823408, 'bear_atr_min_pct': 0.0063381509077313, 'bear_atr_max_pct': 0.06878364244056923, 'bear_tp_mult': 1.9394678657880147, 'bear_tsl_mult': 0.28029613377709456, 'bear_time_stop': 11, 'bear_use_sma': False, 'bear_use_ema': False, 'bear_use_atr': False, 'bear_use_adx': False, 'bear_use_spike': False, 'bear_rsi_required': True, 'sideways_strategy': 'mean_reversion', 'sideways_bb_std_mult': 1.9773607855038036, 'sideways_rsi_os': 30, 'sideways_rsi_ob': 82, 'sideways_adx_thresh': 29.28904702773665, 'sideways_atr_min_pct': 0.014641798671636255, 'sideways_atr_max_pct': 0.08418236194528561, 'sideways_tp_mult': 1.545901667659182, 'sideways_tsl_mult': 0.7557661354534913, 'sideways_time_stop': 262, 'sideways_use_sma': False, 'sideways_use_ema': True, 'sideways_use_atr': True, 'sideways_use_adx': False, 'sideways_use_spike': False, 'sideways_rsi_required': True}.
[I 2025-08-29 19:58:08,124] Trial 186 finished with values: [-1000000000.0, 1000000000.0] and parameters: {'p_sma': 17, 'p_std': 20, 'p_atr': 23, 'p_adx': 19, 'rsi_period': 22, 'ema1': 24, 'ema2': 44, 'slip_atr_k': 0.027169825594964038, 'slip_spread_k': 0.3113138928890236, 'spread_hl_frac': 0.026354325444426015, 'bb_std_mult': 1.2706905464384843, 'rsi_os': 38, 'rsi_ob': 70, 'vol_spike': 0.17813018209717169, 'adx_thresh': 7.944192013847072, 'atr_min_pct': 0.01189500172454271, 'atr_max_pct': 0.09057223344741556, 'tp_mult': 2.4714464944280947, 'tsl_mult': 0.5507461895510071, 'strategy': 'mean_reversion', 'time_stop': 102, 'use_sma': False, 'use_atr': True, 'use_adx': False, 'use_ema': False, 'use_spike': True, 'rsi_required': True, 'edge_k': 1.2920738810837087, 'edge_cap': 0.5565895904029368, 'bull_strategy': 'breakout', 'bull_bb_std_mult': 3.3424743834196082, 'bull_rsi_os': 42, 'bull_rsi_ob': 71, 'bull_adx_thresh': 18.394905607751276, 'bull_atr_min_pct': 0.021826933025172662, 'bull_atr_max_pct': 0.09798155346652528, 'bull_tp_mult': 1.2748825977695235, 'bull_tsl_mult': 0.12036028074510888, 'bull_time_stop': 279, 'bull_use_sma': False, 'bull_use_ema': True, 'bull_use_atr': False, 'bull_use_adx': True, 'bull_use_spike': False, 'bull_rsi_required': True, 'bear_strategy': 'breakout', 'bear_bb_std_mult': 3.5185927555007215, 'bear_rsi_os': 29, 'bear_rsi_ob': 69, 'bear_adx_thresh': 5.444094569348517, 'bear_atr_min_pct': 0.02319068362487844, 'bear_atr_max_pct': 0.017968343279554426, 'bear_tp_mult': 1.912897613991767, 'bear_tsl_mult': 0.21445123451133175, 'bear_time_stop': 50, 'bear_use_sma': True, 'bear_use_ema': False, 'bear_use_atr': False, 'bear_use_adx': False, 'bear_use_spike': False, 'bear_rsi_required': False, 'sideways_strategy': 'breakout', 'sideways_bb_std_mult': 2.8662195239078367, 'sideways_rsi_os': 30, 'sideways_rsi_ob': 82, 'sideways_adx_thresh': 31.68591862909217, 'sideways_atr_min_pct': 0.008148948700475573, 'sideways_atr_max_pct': 0.1467453836200357, 'sideways_tp_mult': 1.8695818595286415, 'sideways_tsl_mult': 0.1884260993771377, 'sideways_time_stop': 269, 'sideways_use_sma': False, 'sideways_use_ema': True, 'sideways_use_atr': True, 'sideways_use_adx': False, 'sideways_use_spike': False, 'sideways_rsi_required': True}.
[I 2025-08-29 19:58:08,273] Trial 183 finished with values: [-1000000000.0, 1000000000.0] and parameters: {'p_sma': 60, 'p_std': 55, 'p_atr': 23, 'p_adx': 17, 'rsi_period': 27, 'ema1': 14, 'ema2': 44, 'slip_atr_k': 0.027753602732557156, 'slip_spread_k': 0.31990872556130723, 'spread_hl_frac': 0.03769291642861062, 'bb_std_mult': 1.3419459633252344, 'rsi_os': 21, 'rsi_ob': 71, 'vol_spike': 0.18048190207789155, 'adx_thresh': 6.185043254039298, 'atr_min_pct': 0.012139108573005434, 'atr_max_pct': 0.09019228254326402, 'tp_mult': 2.475421455732887, 'tsl_mult': 0.8997979220961428, 'strategy': 'mean_reversion', 'time_stop': 97, 'use_sma': False, 'use_atr': True, 'use_adx': False, 'use_ema': True, 'use_spike': False, 'rsi_required': True, 'edge_k': 0.4947376559866712, 'edge_cap': 0.9185678430254782, 'bull_strategy': 'breakout', 'bull_bb_std_mult': 1.7659051106444192, 'bull_rsi_os': 7, 'bull_rsi_ob': 59, 'bull_adx_thresh': 18.451241291216544, 'bull_atr_min_pct': 0.021856636361675473, 'bull_atr_max_pct': 0.06351744882149107, 'bull_tp_mult': 1.1432108437368378, 'bull_tsl_mult': 0.9873193258353778, 'bull_time_stop': 280, 'bull_use_sma': False, 'bull_use_ema': True, 'bull_use_atr': False, 'bull_use_adx': False, 'bull_use_spike': False, 'bull_rsi_required': True, 'bear_strategy': 'breakout', 'bear_bb_std_mult': 3.530015533147268, 'bear_rsi_os': 24, 'bear_rsi_ob': 69, 'bear_adx_thresh': 16.110256759839153, 'bear_atr_min_pct': 0.023146149691122768, 'bear_atr_max_pct': 0.04613525670119117, 'bear_tp_mult': 1.95161032361061, 'bear_tsl_mult': 0.637071148091351, 'bear_time_stop': 10, 'bear_use_sma': False, 'bear_use_ema': False, 'bear_use_atr': False, 'bear_use_adx': True, 'bear_use_spike': False, 'bear_rsi_required': True, 'sideways_strategy': 'mean_reversion', 'sideways_bb_std_mult': 1.9219742074777275, 'sideways_rsi_os': 32, 'sideways_rsi_ob': 82, 'sideways_adx_thresh': 14.436415775842217, 'sideways_atr_min_pct': 0.01472684466660358, 'sideways_atr_max_pct': 0.1020330303008401, 'sideways_tp_mult': 1.5681384525743005, 'sideways_tsl_mult': 0.7276860257090794, 'sideways_time_stop': 168, 'sideways_use_sma': False, 'sideways_use_ema': True, 'sideways_use_atr': True, 'sideways_use_adx': False, 'sideways_use_spike': False, 'sideways_rsi_required': True}.
[I 2025-08-29 19:58:38,845] Trial 188 finished with values: [-1000000000.0, 1000000000.0] and parameters: {'p_sma': 13, 'p_std': 56, 'p_atr': 27, 'p_adx': 19, 'rsi_period': 21, 'ema1': 29, 'ema2': 24, 'slip_atr_k': 0.02820426261526971, 'slip_spread_k': 0.4056103315169037, 'spread_hl_frac': 0.029174108368858802, 'bb_std_mult': 1.3382540951406305, 'rsi_os': 8, 'rsi_ob': 67, 'vol_spike': 0.17639126567052826, 'adx_thresh': 33.63756430414827, 'atr_min_pct': 0.028694984116308234, 'atr_max_pct': 0.08925085943095712, 'tp_mult': 1.8621917541933855, 'tsl_mult': 0.5815392881475954, 'strategy': 'mean_reversion', 'time_stop': 101, 'use_sma': False, 'use_atr': False, 'use_adx': False, 'use_ema': False, 'use_spike': False, 'rsi_required': True, 'edge_k': 1.429869361932164, 'edge_cap': 0.9085299169114006, 'bull_strategy': 'mean_reversion', 'bull_bb_std_mult': 0.9427816307974171, 'bull_rsi_os': 35, 'bull_rsi_ob': 71, 'bull_adx_thresh': 30.15226210559828, 'bull_atr_min_pct': 0.021977153568931013, 'bull_atr_max_pct': 0.06757161390596941, 'bull_tp_mult': 1.5897813499204865, 'bull_tsl_mult': 0.11650914835824897, 'bull_time_stop': 280, 'bull_use_sma': True, 'bull_use_ema': True, 'bull_use_atr': False, 'bull_use_adx': True, 'bull_use_spike': True, 'bull_rsi_required': False, 'bear_strategy': 'breakout', 'bear_bb_std_mult': 2.006674193452711, 'bear_rsi_os': 39, 'bear_rsi_ob': 66, 'bear_adx_thresh': 7.434019556184634, 'bear_atr_min_pct': 0.019901610214781526, 'bear_atr_max_pct': 0.11455518328472673, 'bear_tp_mult': 2.5419525600890953, 'bear_tsl_mult': 0.9448966741537719, 'bear_time_stop': 17, 'bear_use_sma': False, 'bear_use_ema': False, 'bear_use_atr': False, 'bear_use_adx': False, 'bear_use_spike': False, 'bear_rsi_required': False, 'sideways_strategy': 'breakout', 'sideways_bb_std_mult': 2.8678157594820166, 'sideways_rsi_os': 30, 'sideways_rsi_ob': 83, 'sideways_adx_thresh': 21.12254528554578, 'sideways_atr_min_pct': 0.014461638875536042, 'sideways_atr_max_pct': 0.12773351044644526, 'sideways_tp_mult': 2.3611092184059195, 'sideways_tsl_mult': 0.75570231213291, 'sideways_time_stop': 270, 'sideways_use_sma': True, 'sideways_use_ema': True, 'sideways_use_atr': True, 'sideways_use_adx': False, 'sideways_use_spike': True, 'sideways_rsi_required': True}.
[I 2025-08-29 19:58:38,957] Trial 187 finished with values: [-1000000000.0, 1000000000.0] and parameters: {'p_sma': 17, 'p_std': 53, 'p_atr': 23, 'p_adx': 19, 'rsi_period': 20, 'ema1': 11, 'ema2': 44, 'slip_atr_k': 0.045727354424825874, 'slip_spread_k': 0.1901311981975969, 'spread_hl_frac': 0.025906227122993793, 'bb_std_mult': 2.8587030224819356, 'rsi_os': 8, 'rsi_ob': 63, 'vol_spike': 0.17512030742553988, 'adx_thresh': 33.9646802596104, 'atr_min_pct': 0.012060310100059719, 'atr_max_pct': 0.04441092419619959, 'tp_mult': 2.455290889563069, 'tsl_mult': 0.305449321020916, 'strategy': 'mean_reversion', 'time_stop': 85, 'use_sma': False, 'use_atr': False, 'use_adx': False, 'use_ema': False, 'use_spike': False, 'rsi_required': True, 'edge_k': 0.00031045936940143903, 'edge_cap': 0.43541864945982933, 'bull_strategy': 'breakout', 'bull_bb_std_mult': 2.7361829818218264, 'bull_rsi_os': 42, 'bull_rsi_ob': 71, 'bull_adx_thresh': 33.031953216764144, 'bull_atr_min_pct': 0.022159263833703705, 'bull_atr_max_pct': 0.06885433493266067, 'bull_tp_mult': 1.1494356975831441, 'bull_tsl_mult': 0.11721163985564664, 'bull_time_stop': 279, 'bull_use_sma': False, 'bull_use_ema': True, 'bull_use_atr': False, 'bull_use_adx': True, 'bull_use_spike': False, 'bull_rsi_required': True, 'bear_strategy': 'breakout', 'bear_bb_std_mult': 2.4089124842470615, 'bear_rsi_os': 29, 'bear_rsi_ob': 95, 'bear_adx_thresh': 7.464348283171859, 'bear_atr_min_pct': 0.006663634646933095, 'bear_atr_max_pct': 0.14263694962921603, 'bear_tp_mult': 1.9085988203552005, 'bear_tsl_mult': 0.6323621912261321, 'bear_time_stop': 107, 'bear_use_sma': False, 'bear_use_ema': False, 'bear_use_atr': False, 'bear_use_adx': False, 'bear_use_spike': False, 'bear_rsi_required': False, 'sideways_strategy': 'breakout', 'sideways_bb_std_mult': 2.0168651149230845, 'sideways_rsi_os': 30, 'sideways_rsi_ob': 80, 'sideways_adx_thresh': 29.28908588635954, 'sideways_atr_min_pct': 0.018173827155618202, 'sideways_atr_max_pct': 0.0905235207531301, 'sideways_tp_mult': 2.228980573835204, 'sideways_tsl_mult': 0.5309140909353891, 'sideways_time_stop': 270, 'sideways_use_sma': False, 'sideways_use_ema': True, 'sideways_use_atr': True, 'sideways_use_adx': False, 'sideways_use_spike': True, 'sideways_rsi_required': True}.
