[I 2025-08-29 21:08:43,167] Trial 792 finished with values: [0.0022978700527778173, 0.0006610613836971239] and parameters: {'p_sma': 17, 'p_std': 35, 'p_atr': 15, 'p_adx': 8, 'rsi_period': 33, 'ema1': 24, 'ema2': 25, 'slip_atr_k': 0.02097293428998097, 'slip_spread_k': 0.10401810001582422, 'spread_hl_frac': 0.023284259497766174, 'bb_std_mult': 1.0239299331792855, 'rsi_os': 6, 'rsi_ob': 79, 'vol_spike': 0.29000992532435854, 'adx_thresh': 8.475904116125708, 'atr_min_pct': 0.010025142818056054, 'atr_max_pct': 0.035577641810178105, 'tp_mult': 2.3633874731090407, 'tsl_mult': 0.7792484456800234, 'strategy': 'mean_reversion', 'time_stop': 214, 'use_sma': True, 'use_atr': False, 'use_adx': False, 'use_ema': False, 'use_spike': True, 'rsi_required': False, 'edge_k': 0.8378291673237501, 'edge_cap': 0.2835901730856958, 'bull_strategy': 'mean_reversion', 'bull_bb_std_mult': 2.683967707019496, 'bull_rsi_os': 22, 'bull_rsi_ob': 69, 'bull_adx_thresh': 28.139414501571288, 'bull_atr_min_pct': 0.018370951968525805, 'bull_atr_max_pct': 0.10272984668001561, 'bull_tp_mult': 2.4361959154158277, 'bull_tsl_mult': 0.9715901400907508, 'bull_time_stop': 206, 'bull_use_sma': True, 'bull_use_ema': False, 'bull_use_atr': False, 'bull_use_adx': True, 'bull_use_spike': True, 'bull_rsi_required': False, 'bear_strategy': 'breakout', 'bear_bb_std_mult': 2.374548438628788, 'bear_rsi_os': 40, 'bear_rsi_ob': 86, 'bear_adx_thresh': 18.310500869582974, 'bear_atr_min_pct': 0.006651116354274952, 'bear_atr_max_pct': 0.08670233740659339, 'bear_tp_mult': 2.8516408978892254, 'bear_tsl_mult': 0.00013642376655139538, 'bear_time_stop': 260, 'bear_use_sma': False, 'bear_use_ema': False, 'bear_use_atr': False, 'bear_use_adx': False, 'bear_use_spike': True, 'bear_rsi_required': False, 'sideways_strategy': 'breakout', 'sideways_bb_std_mult': 3.520580558202845, 'sideways_rsi_os': 23, 'sideways_rsi_ob': 83, 'sideways_adx_thresh': 13.027268496010224, 'sideways_atr_min_pct': 0.013654095893873603, 'sideways_atr_max_pct': 0.03344606435200345, 'sideways_tp_mult': 2.335967440689961, 'sideways_tsl_mult': 0.5632530541510871, 'sideways_time_stop': 148, 'sideways_use_sma': False, 'sideways_use_ema': False, 'sideways_use_atr': True, 'sideways_use_adx': False, 'sideways_use_spike': False, 'sideways_rsi_required': True}.
[I 2025-08-29 21:08:43,879] Trial 793 finished with values: [0.0019424828464744692, 0.0005681719837020994] and parameters: {'p_sma': 17, 'p_std': 35, 'p_atr': 16, 'p_adx': 8, 'rsi_period': 29, 'ema1': 23, 'ema2': 19, 'slip_atr_k': 0.00442695672963353, 'slip_spread_k': 0.10762432048005077, 'spread_hl_frac': 0.022767386592961365, 'bb_std_mult': 1.0404385467168564, 'rsi_os': 6, 'rsi_ob': 75, 'vol_spike': 0.2909563737679839, 'adx_thresh': 8.358579944488698, 'atr_min_pct': 0.01025846185013666, 'atr_max_pct': 0.040387984279006854, 'tp_mult': 2.3551339581298434, 'tsl_mult': 0.47673806763726834, 'strategy': 'mean_reversion', 'time_stop': 216, 'use_sma': True, 'use_atr': False, 'use_adx': False, 'use_ema': False, 'use_spike': True, 'rsi_required': False, 'edge_k': 0.9457683378214374, 'edge_cap': 0.34917475383081725, 'bull_strategy': 'mean_reversion', 'bull_bb_std_mult': 2.6858370035709416, 'bull_rsi_os': 21, 'bull_rsi_ob': 66, 'bull_adx_thresh': 29.38163293365831, 'bull_atr_min_pct': 0.01838227039043976, 'bull_atr_max_pct': 0.10287928121616464, 'bull_tp_mult': 2.439064864790183, 'bull_tsl_mult': 0.9708923147240671, 'bull_time_stop': 204, 'bull_use_sma': True, 'bull_use_ema': False, 'bull_use_atr': False, 'bull_use_adx': True, 'bull_use_spike': True, 'bull_rsi_required': False, 'bear_strategy': 'breakout', 'bear_bb_std_mult': 2.3785545964263295, 'bear_rsi_os': 40, 'bear_rsi_ob': 86, 'bear_adx_thresh': 17.328058409720665, 'bear_atr_min_pct': 0.006579620813532002, 'bear_atr_max_pct': 0.07998271792103456, 'bear_tp_mult': 2.860911477544273, 'bear_tsl_mult': 0.024499379644506943, 'bear_time_stop': 260, 'bear_use_sma': False, 'bear_use_ema': False, 'bear_use_atr': False, 'bear_use_adx': False, 'bear_use_spike': True, 'bear_rsi_required': False, 'sideways_strategy': 'breakout', 'sideways_bb_std_mult': 3.5423670022051787, 'sideways_rsi_os': 23, 'sideways_rsi_ob': 85, 'sideways_adx_thresh': 13.05720152704001, 'sideways_atr_min_pct': 0.013578268468808578, 'sideways_atr_max_pct': 0.03885960030252008, 'sideways_tp_mult': 2.3594853879013575, 'sideways_tsl_mult': 0.6058927912540459, 'sideways_time_stop': 148, 'sideways_use_sma': False, 'sideways_use_ema': False, 'sideways_use_atr': True, 'sideways_use_adx': False, 'sideways_use_spike': False, 'sideways_rsi_required': True}.
[I 2025-08-29 21:08:44,180] Trial 795 finished with values: [0.002546064338612153, 0.0005295658975427402] and parameters: {'p_sma': 17, 'p_std': 35, 'p_atr': 15, 'p_adx': 8, 'rsi_period': 33, 'ema1': 24, 'ema2': 26, 'slip_atr_k': 0.005514899771430069, 'slip_spread_k': 0.10073151020752888, 'spread_hl_frac': 0.022966036353832958, 'bb_std_mult': 0.900083828090043, 'rsi_os': 7, 'rsi_ob': 79, 'vol_spike': 0.2881796791359169, 'adx_thresh': 8.68321942311867, 'atr_min_pct': 0.011309356573390661, 'atr_max_pct': 0.035963331528545195, 'tp_mult': 2.4361079061435555, 'tsl_mult': 0.7803024412404104, 'strategy': 'mean_reversion', 'time_stop': 219, 'use_sma': True, 'use_atr': False, 'use_adx': False, 'use_ema': False, 'use_spike': True, 'rsi_required': False, 'edge_k': 0.9417949959189263, 'edge_cap': 0.29001854725916454, 'bull_strategy': 'mean_reversion', 'bull_bb_std_mult': 2.6892890500793056, 'bull_rsi_os': 22, 'bull_rsi_ob': 69, 'bull_adx_thresh': 28.099212548966673, 'bull_atr_min_pct': 0.01824965054088985, 'bull_atr_max_pct': 0.1025488317567366, 'bull_tp_mult': 2.441358810163466, 'bull_tsl_mult': 0.9618251612929629, 'bull_time_stop': 206, 'bull_use_sma': True, 'bull_use_ema': False, 'bull_use_atr': False, 'bull_use_adx': True, 'bull_use_spike': True, 'bull_rsi_required': False, 'bear_strategy': 'breakout', 'bear_bb_std_mult': 2.3911679901870424, 'bear_rsi_os': 40, 'bear_rsi_ob': 87, 'bear_adx_thresh': 16.840933099689973, 'bear_atr_min_pct': 0.006598572730966639, 'bear_atr_max_pct': 0.0792810582837728, 'bear_tp_mult': 2.8547041923611323, 'bear_tsl_mult': 0.036293636996213505, 'bear_time_stop': 256, 'bear_use_sma': False, 'bear_use_ema': False, 'bear_use_atr': False, 'bear_use_adx': False, 'bear_use_spike': True, 'bear_rsi_required': False, 'sideways_strategy': 'breakout', 'sideways_bb_std_mult': 3.533701267618917, 'sideways_rsi_os': 22, 'sideways_rsi_ob': 83, 'sideways_adx_thresh': 11.946080492708463, 'sideways_atr_min_pct': 0.013617187308526856, 'sideways_atr_max_pct': 0.03825247323455894, 'sideways_tp_mult': 2.342136439252253, 'sideways_tsl_mult': 0.6045583887703557, 'sideways_time_stop': 148, 'sideways_use_sma': False, 'sideways_use_ema': False, 'sideways_use_atr': True, 'sideways_use_adx': False, 'sideways_use_spike': False, 'sideways_rsi_required': True}.
[I 2025-08-29 21:08:44,367] Trial 794 finished with values: [-1000000000.0, 1000000000.0] and parameters: {'p_sma': 17, 'p_std': 35, 'p_atr': 15, 'p_adx': 8, 'rsi_period': 32, 'ema1': 24, 'ema2': 26, 'slip_atr_k': 0.005446592380815177, 'slip_spread_k': 0.10621937548388735, 'spread_hl_frac': 0.02287624313980462, 'bb_std_mult': 0.8484521289210023, 'rsi_os': 7, 'rsi_ob': 79, 'vol_spike': 0.2867240447820311, 'adx_thresh': 8.467418566600207, 'atr_min_pct': 0.01005356570260845, 'atr_max_pct': 0.03531428093637385, 'tp_mult': 2.4315036969745027, 'tsl_mult': 0.7863833863756523, 'strategy': 'mean_reversion', 'time_stop': 216, 'use_sma': True, 'use_atr': False, 'use_adx': False, 'use_ema': False, 'use_spike': True, 'rsi_required': False, 'edge_k': 0.9463188054839836, 'edge_cap': 0.2883507515716121, 'bull_strategy': 'mean_reversion', 'bull_bb_std_mult': 2.6873555283042263, 'bull_rsi_os': 22, 'bull_rsi_ob': 69, 'bull_adx_thresh': 28.123902159585136, 'bull_atr_min_pct': 0.018278091353299268, 'bull_atr_max_pct': 0.10293025553281185, 'bull_tp_mult': 2.4518892697673143, 'bull_tsl_mult': 0.9693792005508011, 'bull_time_stop': 208, 'bull_use_sma': True, 'bull_use_ema': False, 'bull_use_atr': False, 'bull_use_adx': True, 'bull_use_spike': True, 'bull_rsi_required': False, 'bear_strategy': 'breakout', 'bear_bb_std_mult': 2.341208920552339, 'bear_rsi_os': 40, 'bear_rsi_ob': 87, 'bear_adx_thresh': 16.984260749563543, 'bear_atr_min_pct': 0.006763520600220414, 'bear_atr_max_pct': 0.07920027756272335, 'bear_tp_mult': 2.8587132112605262, 'bear_tsl_mult': 0.039119024512472386, 'bear_time_stop': 260, 'bear_use_sma': False, 'bear_use_ema': False, 'bear_use_atr': False, 'bear_use_adx': False, 'bear_use_spike': True, 'bear_rsi_required': False, 'sideways_strategy': 'breakout', 'sideways_bb_std_mult': 3.5437839456009184, 'sideways_rsi_os': 20, 'sideways_rsi_ob': 83, 'sideways_adx_thresh': 11.929388390937476, 'sideways_atr_min_pct': 0.013307600316174242, 'sideways_atr_max_pct': 0.039641640757238535, 'sideways_tp_mult': 2.3308571350445964, 'sideways_tsl_mult': 0.6041964231063586, 'sideways_time_stop': 150, 'sideways_use_sma': False, 'sideways_use_ema': False, 'sideways_use_atr': True, 'sideways_use_adx': False, 'sideways_use_spike': False, 'sideways_rsi_required': True}.
[I 2025-08-29 21:09:12,580] Trial 797 finished with values: [-1000000000.0, 1000000000.0] and parameters: {'p_sma': 15, 'p_std': 36, 'p_atr': 15, 'p_adx': 8, 'rsi_period': 27, 'ema1': 24, 'ema2': 17, 'slip_atr_k': 0.022570680269054802, 'slip_spread_k': 0.10137110097003496, 'spread_hl_frac': 0.023987661181294834, 'bb_std_mult': 1.09143757946125, 'rsi_os': 6, 'rsi_ob': 75, 'vol_spike': 0.282189916043668, 'adx_thresh': 7.453946052078333, 'atr_min_pct': 0.009633590600450027, 'atr_max_pct': 0.047608490384350124, 'tp_mult': 2.3583058775162797, 'tsl_mult': 0.48159057630582897, 'strategy': 'mean_reversion', 'time_stop': 220, 'use_sma': True, 'use_atr': False, 'use_adx': False, 'use_ema': False, 'use_spike': True, 'rsi_required': False, 'edge_k': 0.8511158430398853, 'edge_cap': 0.246073510733654, 'bull_strategy': 'mean_reversion', 'bull_bb_std_mult': 2.6684123480640296, 'bull_rsi_os': 22, 'bull_rsi_ob': 65, 'bull_adx_thresh': 30.47982549404137, 'bull_atr_min_pct': 0.018767813272732733, 'bull_atr_max_pct': 0.10697374691743405, 'bull_tp_mult': 2.403648068565413, 'bull_tsl_mult': 0.9909824007942081, 'bull_time_stop': 204, 'bull_use_sma': True, 'bull_use_ema': False, 'bull_use_atr': False, 'bull_use_adx': True, 'bull_use_spike': True, 'bull_rsi_required': False, 'bear_strategy': 'breakout', 'bear_bb_std_mult': 2.417339297252722, 'bear_rsi_os': 40, 'bear_rsi_ob': 85, 'bear_adx_thresh': 17.450238317828266, 'bear_atr_min_pct': 0.006506948653092514, 'bear_atr_max_pct': 0.08237562203455297, 'bear_tp_mult': 2.8642603795566304, 'bear_tsl_mult': 0.00288427356230022, 'bear_time_stop': 261, 'bear_use_sma': False, 'bear_use_ema': False, 'bear_use_atr': False, 'bear_use_adx': False, 'bear_use_spike': True, 'bear_rsi_required': False, 'sideways_strategy': 'breakout', 'sideways_bb_std_mult': 3.538276573351985, 'sideways_rsi_os': 23, 'sideways_rsi_ob': 86, 'sideways_adx_thresh': 11.936294761927442, 'sideways_atr_min_pct': 0.01441871725486401, 'sideways_atr_max_pct': 0.0438384694750249, 'sideways_tp_mult': 2.311870507456651, 'sideways_tsl_mult': 0.5546032747877427, 'sideways_time_stop': 150, 'sideways_use_sma': False, 'sideways_use_ema': False, 'sideways_use_atr': True, 'sideways_use_adx': False, 'sideways_use_spike': False, 'sideways_rsi_required': True}.
[I 2025-08-29 21:09:13,010] Trial 796 finished with values: [-1000000000.0, 1000000000.0] and parameters: {'p_sma': 14, 'p_std': 33, 'p_atr': 15, 'p_adx': 8, 'rsi_period': 32, 'ema1': 24, 'ema2': 27, 'slip_atr_k': 0.02339340360534635, 'slip_spread_k': 0.07218298248402572, 'spread_hl_frac': 0.023694387052569234, 'bb_std_mult': 1.1094570324047002, 'rsi_os': 6, 'rsi_ob': 78, 'vol_spike': 0.2835957439425374, 'adx_thresh': 7.9018370325483485, 'atr_min_pct': 0.00986039420563275, 'atr_max_pct': 0.042510163794715575, 'tp_mult': 2.4172231560243964, 'tsl_mult': 0.769836606460845, 'strategy': 'mean_reversion', 'time_stop': 221, 'use_sma': True, 'use_atr': False, 'use_adx': False, 'use_ema': False, 'use_spike': True, 'rsi_required': False, 'edge_k': 0.6314317623962789, 'edge_cap': 0.24832894281091994, 'bull_strategy': 'mean_reversion', 'bull_bb_std_mult': 2.6752720986937546, 'bull_rsi_os': 23, 'bull_rsi_ob': 66, 'bull_adx_thresh': 30.3309040439025, 'bull_atr_min_pct': 0.01887898120361059, 'bull_atr_max_pct': 0.10699447077647282, 'bull_tp_mult': 2.401742407556915, 'bull_tsl_mult': 0.9739425453745483, 'bull_time_stop': 206, 'bull_use_sma': True, 'bull_use_ema': False, 'bull_use_atr': False, 'bull_use_adx': True, 'bull_use_spike': True, 'bull_rsi_required': False, 'bear_strategy': 'breakout', 'bear_bb_std_mult': 2.3957457622745184, 'bear_rsi_os': 40, 'bear_rsi_ob': 91, 'bear_adx_thresh': 17.100087729784672, 'bear_atr_min_pct': 0.006593270974686627, 'bear_atr_max_pct': 0.08886948642023129, 'bear_tp_mult': 2.868834381644505, 'bear_tsl_mult': 0.0046896607777704566, 'bear_time_stop': 262, 'bear_use_sma': False, 'bear_use_ema': False, 'bear_use_atr': False, 'bear_use_adx': False, 'bear_use_spike': True, 'bear_rsi_required': False, 'sideways_strategy': 'breakout', 'sideways_bb_std_mult': 3.5122441050044317, 'sideways_rsi_os': 23, 'sideways_rsi_ob': 85, 'sideways_adx_thresh': 12.026726714527902, 'sideways_atr_min_pct': 0.013586160864401595, 'sideways_atr_max_pct': 0.03853379788995175, 'sideways_tp_mult': 2.2674670163661528, 'sideways_tsl_mult': 0.5658814890282784, 'sideways_time_stop': 149, 'sideways_use_sma': False, 'sideways_use_ema': False, 'sideways_use_atr': True, 'sideways_use_adx': False, 'sideways_use_spike': False, 'sideways_rsi_required': True}.
[I 2025-08-29 21:09:13,742] Trial 799 finished with values: [-1000000000.0, 1000000000.0] and parameters: {'p_sma': 13, 'p_std': 39, 'p_atr': 14, 'p_adx': 8, 'rsi_period': 33, 'ema1': 24, 'ema2': 27, 'slip_atr_k': 0.1065472302597815, 'slip_spread_k': 0.0724617898186575, 'spread_hl_frac': 0.02398202197755107, 'bb_std_mult': 0.7261909187554897, 'rsi_os': 7, 'rsi_ob': 79, 'vol_spike': 0.2789989344894872, 'adx_thresh': 7.112378722153078, 'atr_min_pct': 0.0124300382117041, 'atr_max_pct': 0.04390314986045371, 'tp_mult': 2.403608935690588, 'tsl_mult': 0.7664173519548998, 'strategy': 'breakout', 'time_stop': 221, 'use_sma': False, 'use_atr': True, 'use_adx': True, 'use_ema': False, 'use_spike': True, 'rsi_required': True, 'edge_k': 0.8473052028589255, 'edge_cap': 0.25710516672207695, 'bull_strategy': 'breakout', 'bull_bb_std_mult': 2.6293188879484206, 'bull_rsi_os': 23, 'bull_rsi_ob': 65, 'bull_adx_thresh': 31.52824035346179, 'bull_atr_min_pct': 0.01934064933874875, 'bull_atr_max_pct': 0.10234866564520996, 'bull_tp_mult': 2.40722622665649, 'bull_tsl_mult': 0.972925747127632, 'bull_time_stop': 203, 'bull_use_sma': False, 'bull_use_ema': True, 'bull_use_atr': False, 'bull_use_adx': True, 'bull_use_spike': False, 'bull_rsi_required': True, 'bear_strategy': 'mean_reversion', 'bear_bb_std_mult': 2.439649114994001, 'bear_rsi_os': 39, 'bear_rsi_ob': 86, 'bear_adx_thresh': 15.312783834101438, 'bear_atr_min_pct': 0.016832054359961088, 'bear_atr_max_pct': 0.08021639794773175, 'bear_tp_mult': 2.8507293646852307, 'bear_tsl_mult': 0.00027591383345592496, 'bear_time_stop': 241, 'bear_use_sma': True, 'bear_use_ema': False, 'bear_use_atr': True, 'bear_use_adx': False, 'bear_use_spike': False, 'bear_rsi_required': True, 'sideways_strategy': 'mean_reversion', 'sideways_bb_std_mult': 3.5314894299838597, 'sideways_rsi_os': 22, 'sideways_rsi_ob': 85, 'sideways_adx_thresh': 11.301002700090391, 'sideways_atr_min_pct': 0.01503205263084286, 'sideways_atr_max_pct': 0.04474819989666902, 'sideways_tp_mult': 2.226389495436673, 'sideways_tsl_mult': 0.5827130536614603, 'sideways_time_stop': 151, 'sideways_use_sma': True, 'sideways_use_ema': True, 'sideways_use_atr': True, 'sideways_use_adx': True, 'sideways_use_spike': True, 'sideways_rsi_required': True}.
[I 2025-08-29 21:09:14,008] Trial 798 finished with values: [-1000000000.0, 1000000000.0] and parameters: {'p_sma': 14, 'p_std': 37, 'p_atr': 14, 'p_adx': 8, 'rsi_period': 33, 'ema1': 24, 'ema2': 27, 'slip_atr_k': 0.024953852100550556, 'slip_spread_k': 0.08022760555808844, 'spread_hl_frac': 0.02405431751626577, 'bb_std_mult': 0.8185252016571811, 'rsi_os': 7, 'rsi_ob': 79, 'vol_spike': 0.281446116152787, 'adx_thresh': 7.236159159164995, 'atr_min_pct': 0.012325927973417646, 'atr_max_pct': 0.04300543306991938, 'tp_mult': 2.42249413892311, 'tsl_mult': 0.7637233291741579, 'strategy': 'breakout', 'time_stop': 225, 'use_sma': False, 'use_atr': True, 'use_adx': True, 'use_ema': False, 'use_spike': True, 'rsi_required': True, 'edge_k': 0.8573492103319437, 'edge_cap': 0.2535067535935678, 'bull_strategy': 'breakout', 'bull_bb_std_mult': 2.6255718632261527, 'bull_rsi_os': 24, 'bull_rsi_ob': 68, 'bull_adx_thresh': 25.673704191157825, 'bull_atr_min_pct': 0.01839247025405291, 'bull_atr_max_pct': 0.10232620936523128, 'bull_tp_mult': 2.430992831149681, 'bull_tsl_mult': 0.9883102292245541, 'bull_time_stop': 204, 'bull_use_sma': False, 'bull_use_ema': True, 'bull_use_atr': False, 'bull_use_adx': True, 'bull_use_spike': False, 'bull_rsi_required': True, 'bear_strategy': 'mean_reversion', 'bear_bb_std_mult': 2.426763467434232, 'bear_rsi_os': 39, 'bear_rsi_ob': 85, 'bear_adx_thresh': 14.326935973385176, 'bear_atr_min_pct': 0.012431105942083895, 'bear_atr_max_pct': 0.0796250659516152, 'bear_tp_mult': 2.8732043194146546, 'bear_tsl_mult': 0.004638893623183572, 'bear_time_stop': 236, 'bear_use_sma': True, 'bear_use_ema': False, 'bear_use_atr': True, 'bear_use_adx': False, 'bear_use_spike': False, 'bear_rsi_required': True, 'sideways_strategy': 'mean_reversion', 'sideways_bb_std_mult': 3.5330698628101613, 'sideways_rsi_os': 22, 'sideways_rsi_ob': 85, 'sideways_adx_thresh': 11.356735447730367, 'sideways_atr_min_pct': 0.014820857200337417, 'sideways_atr_max_pct': 0.0449619499981355, 'sideways_tp_mult': 2.2591351064083316, 'sideways_tsl_mult': 0.566802938080766, 'sideways_time_stop': 159, 'sideways_use_sma': True, 'sideways_use_ema': True, 'sideways_use_atr': True, 'sideways_use_adx': True, 'sideways_use_spike': True, 'sideways_rsi_required': True}.
[I 2025-08-29 21:09:43,898] Trial 801 finished with values: [-1000000000.0, 1000000000.0] and parameters: {'p_sma': 15, 'p_std': 39, 'p_atr': 14, 'p_adx': 9, 'rsi_period': 33, 'ema1': 24, 'ema2': 27, 'slip_atr_k': 0.021050727660050644, 'slip_spread_k': 0.08642588729385063, 'spread_hl_frac': 0.02463788811562181, 'bb_std_mult': 0.792469279149036, 'rsi_os': 7, 'rsi_ob': 79, 'vol_spike': 0.2750381189716009, 'adx_thresh': 6.9924568255879676, 'atr_min_pct': 0.012260290707334913, 'atr_max_pct': 0.04625482942364655, 'tp_mult': 2.4422540265992656, 'tsl_mult': 0.766375687876555, 'strategy': 'breakout', 'time_stop': 229, 'use_sma': False, 'use_atr': True, 'use_adx': True, 'use_ema': False, 'use_spike': True, 'rsi_required': True, 'edge_k': 0.8455500975435875, 'edge_cap': 0.25837103927681127, 'bull_strategy': 'breakout', 'bull_bb_std_mult': 2.616626894831498, 'bull_rsi_os': 24, 'bull_rsi_ob': 66, 'bull_adx_thresh': 25.57061986052438, 'bull_atr_min_pct': 0.01819242796274016, 'bull_atr_max_pct': 0.1023033184802494, 'bull_tp_mult': 2.3384722673276346, 'bull_tsl_mult': 0.998762618927094, 'bull_time_stop': 201, 'bull_use_sma': False, 'bull_use_ema': True, 'bull_use_atr': False, 'bull_use_adx': True, 'bull_use_spike': False, 'bull_rsi_required': True, 'bear_strategy': 'mean_reversion', 'bear_bb_std_mult': 2.437383753406517, 'bear_rsi_os': 39, 'bear_rsi_ob': 84, 'bear_adx_thresh': 15.008438124958884, 'bear_atr_min_pct': 0.02668014944401624, 'bear_atr_max_pct': 0.07866379018555346, 'bear_tp_mult': 2.843997064142502, 'bear_tsl_mult': 0.02122395923887366, 'bear_time_stop': 242, 'bear_use_sma': True, 'bear_use_ema': False, 'bear_use_atr': True, 'bear_use_adx': False, 'bear_use_spike': False, 'bear_rsi_required': True, 'sideways_strategy': 'mean_reversion', 'sideways_bb_std_mult': 3.538228806343107, 'sideways_rsi_os': 22, 'sideways_rsi_ob': 85, 'sideways_adx_thresh': 11.12315652653574, 'sideways_atr_min_pct': 0.014912588704014698, 'sideways_atr_max_pct': 0.04239077323622872, 'sideways_tp_mult': 2.250578013953887, 'sideways_tsl_mult': 0.5757173039715044, 'sideways_time_stop': 161, 'sideways_use_sma': True, 'sideways_use_ema': True, 'sideways_use_atr': True, 'sideways_use_adx': True, 'sideways_use_spike': True, 'sideways_rsi_required': True}.
