[I 2025-08-29 20:48:33,156] Trial 621 finished with values: [-1000000000.0, 1000000000.0] and parameters: {'p_sma': 21, 'p_std': 43, 'p_atr': 22, 'p_adx': 28, 'rsi_period': 36, 'ema1': 25, 'ema2': 44, 'slip_atr_k': 0.005218614369561222, 'slip_spread_k': 0.22112654096306808, 'spread_hl_frac': 0.007876033006796204, 'bb_std_mult': 1.614063367672235, 'rsi_os': 13, 'rsi_ob': 82, 'vol_spike': 0.19242606221560477, 'adx_thresh': 14.189981801584262, 'atr_min_pct': 0.021312573776484302, 'atr_max_pct': 0.024386511086458708, 'tp_mult': 1.4414125352763603, 'tsl_mult': 0.10772908396982395, 'strategy': 'mean_reversion', 'time_stop': 162, 'use_sma': True, 'use_atr': False, 'use_adx': True, 'use_ema': False, 'use_spike': True, 'rsi_required': False, 'edge_k': 1.4896458790759366, 'edge_cap': 0.5717180803360273, 'bull_strategy': 'mean_reversion', 'bull_bb_std_mult': 3.0976823404632423, 'bull_rsi_os': 22, 'bull_rsi_ob': 74, 'bull_adx_thresh': 33.15966584734118, 'bull_atr_min_pct': 0.023957578500293966, 'bull_atr_max_pct': 0.08773138368122646, 'bull_tp_mult': 2.5871764886826014, 'bull_tsl_mult': 0.8614329527981758, 'bull_time_stop': 57, 'bull_use_sma': True, 'bull_use_ema': True, 'bull_use_atr': True, 'bull_use_adx': False, 'bull_use_spike': False, 'bull_rsi_required': False, 'bear_strategy': 'breakout', 'bear_bb_std_mult': 1.7339328234213092, 'bear_rsi_os': 26, 'bear_rsi_ob': 68, 'bear_adx_thresh': 19.571053804426406, 'bear_atr_min_pct': 0.008061929125050094, 'bear_atr_max_pct': 0.13493603928410902, 'bear_tp_mult': 2.704546714641366, 'bear_tsl_mult': 0.9478011131820121, 'bear_time_stop': 120, 'bear_use_sma': False, 'bear_use_ema': True, 'bear_use_atr': False, 'bear_use_adx': False, 'bear_use_spike': True, 'bear_rsi_required': False, 'sideways_strategy': 'mean_reversion', 'sideways_bb_std_mult': 2.225423615917385, 'sideways_rsi_os': 19, 'sideways_rsi_ob': 57, 'sideways_adx_thresh': 26.006989524523526, 'sideways_atr_min_pct': 0.0037113321495526874, 'sideways_atr_max_pct': 0.07034710516911183, 'sideways_tp_mult': 1.0144666118963683, 'sideways_tsl_mult': 0.700367363342699, 'sideways_time_stop': 191, 'sideways_use_sma': False, 'sideways_use_ema': True, 'sideways_use_atr': False, 'sideways_use_adx': False, 'sideways_use_spike': False, 'sideways_rsi_required': True}.
[I 2025-08-29 20:49:04,331] Trial 623 finished with values: [0.0009467346562712642, 0.001292359877941572] and parameters: {'p_sma': 48, 'p_std': 43, 'p_atr': 15, 'p_adx': 15, 'rsi_period': 36, 'ema1': 15, 'ema2': 44, 'slip_atr_k': 0.00042360271706202925, 'slip_spread_k': 0.84455518482545, 'spread_hl_frac': 0.01431151966388413, 'bb_std_mult': 1.6186211799998682, 'rsi_os': 10, 'rsi_ob': 75, 'vol_spike': 0.1186883341082281, 'adx_thresh': 13.65898020974884, 'atr_min_pct': 0.021295155105018414, 'atr_max_pct': 0.06632934746140527, 'tp_mult': 1.4174995489628377, 'tsl_mult': 0.10810478415730296, 'strategy': 'mean_reversion', 'time_stop': 161, 'use_sma': False, 'use_atr': False, 'use_adx': False, 'use_ema': False, 'use_spike': False, 'rsi_required': True, 'edge_k': 0.670014217406774, 'edge_cap': 0.12097433049826378, 'bull_strategy': 'breakout', 'bull_bb_std_mult': 3.1084604624544503, 'bull_rsi_os': 26, 'bull_rsi_ob': 59, 'bull_adx_thresh': 23.4105968481461, 'bull_atr_min_pct': 0.015784383302785154, 'bull_atr_max_pct': 0.015895719737096595, 'bull_tp_mult': 2.689861709361913, 'bull_tsl_mult': 0.8546986269610433, 'bull_time_stop': 39, 'bull_use_sma': False, 'bull_use_ema': False, 'bull_use_atr': True, 'bull_use_adx': True, 'bull_use_spike': True, 'bull_rsi_required': False, 'bear_strategy': 'breakout', 'bear_bb_std_mult': 3.319523139766715, 'bear_rsi_os': 30, 'bear_rsi_ob': 78, 'bear_adx_thresh': 34.15919076421877, 'bear_atr_min_pct': 0.00590505085820048, 'bear_atr_max_pct': 0.14630214385195944, 'bear_tp_mult': 2.049033328317493, 'bear_tsl_mult': 0.8603227985920786, 'bear_time_stop': 117, 'bear_use_sma': False, 'bear_use_ema': False, 'bear_use_atr': False, 'bear_use_adx': False, 'bear_use_spike': False, 'bear_rsi_required': False, 'sideways_strategy': 'mean_reversion', 'sideways_bb_std_mult': 1.2469301252334533, 'sideways_rsi_os': 45, 'sideways_rsi_ob': 79, 'sideways_adx_thresh': 32.16376076524852, 'sideways_atr_min_pct': 0.02532735587475981, 'sideways_atr_max_pct': 0.02746951628712096, 'sideways_tp_mult': 2.6200956934992554, 'sideways_tsl_mult': 0.3086180715890386, 'sideways_time_stop': 194, 'sideways_use_sma': False, 'sideways_use_ema': True, 'sideways_use_atr': False, 'sideways_use_adx': False, 'sideways_use_spike': True, 'sideways_rsi_required': True}.
[I 2025-08-29 20:49:04,525] Trial 622 finished with values: [-0.0007266908659631088, 0.0016861236827761168] and parameters: {'p_sma': 48, 'p_std': 43, 'p_atr': 10, 'p_adx': 13, 'rsi_period': 36, 'ema1': 25, 'ema2': 43, 'slip_atr_k': 0.004495405429566401, 'slip_spread_k': 0.17908400518672987, 'spread_hl_frac': 0.012044827761967926, 'bb_std_mult': 1.6116035879332553, 'rsi_os': 13, 'rsi_ob': 51, 'vol_spike': 0.19456063329854192, 'adx_thresh': 14.025072402240419, 'atr_min_pct': 0.0010194308293155659, 'atr_max_pct': 0.024807258752109054, 'tp_mult': 1.1126591907465966, 'tsl_mult': 0.9726775185546644, 'strategy': 'mean_reversion', 'time_stop': 145, 'use_sma': False, 'use_atr': False, 'use_adx': False, 'use_ema': False, 'use_spike': False, 'rsi_required': False, 'edge_k': 0.6693248175986164, 'edge_cap': 0.5767374309085236, 'bull_strategy': 'breakout', 'bull_bb_std_mult': 3.0918840101281253, 'bull_rsi_os': 22, 'bull_rsi_ob': 48, 'bull_adx_thresh': 34.8381447359576, 'bull_atr_min_pct': 0.015747947674278905, 'bull_atr_max_pct': 0.08814781303234695, 'bull_tp_mult': 2.678838618130809, 'bull_tsl_mult': 0.4327465950116325, 'bull_time_stop': 34, 'bull_use_sma': False, 'bull_use_ema': False, 'bull_use_atr': True, 'bull_use_adx': False, 'bull_use_spike': True, 'bull_rsi_required': False, 'bear_strategy': 'breakout', 'bear_bb_std_mult': 2.5099837655707318, 'bear_rsi_os': 41, 'bear_rsi_ob': 66, 'bear_adx_thresh': 34.009911015372396, 'bear_atr_min_pct': 0.0075259287902390394, 'bear_atr_max_pct': 0.049419753544340986, 'bear_tp_mult': 2.7212327578100943, 'bear_tsl_mult': 0.9425086898849788, 'bear_time_stop': 39, 'bear_use_sma': False, 'bear_use_ema': True, 'bear_use_atr': False, 'bear_use_adx': False, 'bear_use_spike': True, 'bear_rsi_required': False, 'sideways_strategy': 'mean_reversion', 'sideways_bb_std_mult': 2.226483513164075, 'sideways_rsi_os': 45, 'sideways_rsi_ob': 77, 'sideways_adx_thresh': 34.44373160042058, 'sideways_atr_min_pct': 0.005239499192009425, 'sideways_atr_max_pct': 0.02802969732027696, 'sideways_tp_mult': 1.8610169552957845, 'sideways_tsl_mult': 0.6021921960181713, 'sideways_time_stop': 192, 'sideways_use_sma': False, 'sideways_use_ema': True, 'sideways_use_atr': False, 'sideways_use_adx': False, 'sideways_use_spike': True, 'sideways_rsi_required': True}.
[I 2025-08-29 20:49:04,908] Trial 624 finished with values: [-1000000000.0, 1000000000.0] and parameters: {'p_sma': 21, 'p_std': 53, 'p_atr': 24, 'p_adx': 13, 'rsi_period': 40, 'ema1': 26, 'ema2': 50, 'slip_atr_k': 0.005271353013101726, 'slip_spread_k': 0.00178693911058464, 'spread_hl_frac': 0.012495685769286329, 'bb_std_mult': 0.888412993234621, 'rsi_os': 10, 'rsi_ob': 82, 'vol_spike': 0.1791650078238896, 'adx_thresh': 13.730935362892687, 'atr_min_pct': 0.0213472785314104, 'atr_max_pct': 0.051391377334776084, 'tp_mult': 2.247538262198839, 'tsl_mult': 0.8973676922220186, 'strategy': 'mean_reversion', 'time_stop': 161, 'use_sma': False, 'use_atr': False, 'use_adx': False, 'use_ema': False, 'use_spike': False, 'rsi_required': True, 'edge_k': 1.700742714026338, 'edge_cap': 0.07222679697187173, 'bull_strategy': 'breakout', 'bull_bb_std_mult': 3.0425019897389634, 'bull_rsi_os': 22, 'bull_rsi_ob': 59, 'bull_adx_thresh': 32.93708176167508, 'bull_atr_min_pct': 0.015845018072307093, 'bull_atr_max_pct': 0.09089080529247343, 'bull_tp_mult': 2.5293466090115166, 'bull_tsl_mult': 0.8606135298711145, 'bull_time_stop': 126, 'bull_use_sma': False, 'bull_use_ema': False, 'bull_use_atr': True, 'bull_use_adx': True, 'bull_use_spike': True, 'bull_rsi_required': False, 'bear_strategy': 'breakout', 'bear_bb_std_mult': 2.724144426910031, 'bear_rsi_os': 28, 'bear_rsi_ob': 66, 'bear_adx_thresh': 19.737498771677057, 'bear_atr_min_pct': 0.024690843912368976, 'bear_atr_max_pct': 0.04972443131835652, 'bear_tp_mult': 2.7180070513096606, 'bear_tsl_mult': 0.9483805769208298, 'bear_time_stop': 274, 'bear_use_sma': False, 'bear_use_ema': False, 'bear_use_atr': False, 'bear_use_adx': False, 'bear_use_spike': False, 'bear_rsi_required': False, 'sideways_strategy': 'mean_reversion', 'sideways_bb_std_mult': 2.2494861641247734, 'sideways_rsi_os': 45, 'sideways_rsi_ob': 80, 'sideways_adx_thresh': 32.15088696427644, 'sideways_atr_min_pct': 0.0053435842508646764, 'sideways_atr_max_pct': 0.06938454947481083, 'sideways_tp_mult': 2.6167650397674223, 'sideways_tsl_mult': 0.7132059018754242, 'sideways_time_stop': 192, 'sideways_use_sma': True, 'sideways_use_ema': True, 'sideways_use_atr': False, 'sideways_use_adx': False, 'sideways_use_spike': True, 'sideways_rsi_required': True}.
[I 2025-08-29 20:49:04,984] Trial 625 finished with values: [-1000000000.0, 1000000000.0] and parameters: {'p_sma': 26, 'p_std': 53, 'p_atr': 24, 'p_adx': 20, 'rsi_period': 40, 'ema1': 15, 'ema2': 50, 'slip_atr_k': 0.2163627829796107, 'slip_spread_k': 0.3266911181735299, 'spread_hl_frac': 0.012374957195999911, 'bb_std_mult': 3.4921974784838308, 'rsi_os': 37, 'rsi_ob': 85, 'vol_spike': 0.03855897685044801, 'adx_thresh': 13.364229975449668, 'atr_min_pct': 0.020583277722426817, 'atr_max_pct': 0.030344699223488442, 'tp_mult': 1.8281687232519268, 'tsl_mult': 0.910323810332424, 'strategy': 'mean_reversion', 'time_stop': 146, 'use_sma': False, 'use_atr': False, 'use_adx': False, 'use_ema': False, 'use_spike': False, 'rsi_required': True, 'edge_k': 0.9487421585344554, 'edge_cap': 0.6411146039580601, 'bull_strategy': 'breakout', 'bull_bb_std_mult': 3.0323488131049086, 'bull_rsi_os': 6, 'bull_rsi_ob': 53, 'bull_adx_thresh': 21.0379026752502, 'bull_atr_min_pct': 0.015660783127477873, 'bull_atr_max_pct': 0.0909325820899892, 'bull_tp_mult': 2.6849080483067675, 'bull_tsl_mult': 0.42933810022485897, 'bull_time_stop': 126, 'bull_use_sma': False, 'bull_use_ema': False, 'bull_use_atr': True, 'bull_use_adx': True, 'bull_use_spike': True, 'bull_rsi_required': False, 'bear_strategy': 'breakout', 'bear_bb_std_mult': 3.3109886817944885, 'bear_rsi_os': 14, 'bear_rsi_ob': 65, 'bear_adx_thresh': 17.903184038606167, 'bear_atr_min_pct': 0.02707640545677971, 'bear_atr_max_pct': 0.050242452473158346, 'bear_tp_mult': 2.1316785083156504, 'bear_tsl_mult': 0.851211777059225, 'bear_time_stop': 54, 'bear_use_sma': False, 'bear_use_ema': False, 'bear_use_atr': False, 'bear_use_adx': False, 'bear_use_spike': False, 'bear_rsi_required': False, 'sideways_strategy': 'mean_reversion', 'sideways_bb_std_mult': 3.2850522049391535, 'sideways_rsi_os': 44, 'sideways_rsi_ob': 79, 'sideways_adx_thresh': 31.99698274899121, 'sideways_atr_min_pct': 0.005450276890631956, 'sideways_atr_max_pct': 0.028521569590055876, 'sideways_tp_mult': 1.0117182185423672, 'sideways_tsl_mult': 0.36456716323857424, 'sideways_time_stop': 43, 'sideways_use_sma': True, 'sideways_use_ema': True, 'sideways_use_atr': False, 'sideways_use_adx': False, 'sideways_use_spike': True, 'sideways_rsi_required': True}.
[I 2025-08-29 20:49:34,529] Trial 627 finished with values: [0.00014977475998723122, 0.0007828865329253617] and parameters: {'p_sma': 19, 'p_std': 41, 'p_atr': 11, 'p_adx': 12, 'rsi_period': 82, 'ema1': 26, 'ema2': 33, 'slip_atr_k': 0.00015502967967346648, 'slip_spread_k': 0.8434859376297612, 'spread_hl_frac': 0.04912371348662601, 'bb_std_mult': 0.9001255212925765, 'rsi_os': 6, 'rsi_ob': 83, 'vol_spike': 0.11776918900441409, 'adx_thresh': 13.094150009768878, 'atr_min_pct': 0.01925881916386813, 'atr_max_pct': 0.02952155684027264, 'tp_mult': 2.7947777407429717, 'tsl_mult': 0.8981458968171693, 'strategy': 'mean_reversion', 'time_stop': 225, 'use_sma': False, 'use_atr': False, 'use_adx': False, 'use_ema': True, 'use_spike': False, 'rsi_required': True, 'edge_k': 1.0551971956723025, 'edge_cap': 0.6418374180116277, 'bull_strategy': 'breakout', 'bull_bb_std_mult': 1.1732096842770732, 'bull_rsi_os': 28, 'bull_rsi_ob': 73, 'bull_adx_thresh': 12.780195217350443, 'bull_atr_min_pct': 0.013191092071127897, 'bull_atr_max_pct': 0.09287448009891643, 'bull_tp_mult': 2.137271690233503, 'bull_tsl_mult': 0.2574134226893825, 'bull_time_stop': 225, 'bull_use_sma': False, 'bull_use_ema': False, 'bull_use_atr': True, 'bull_use_adx': True, 'bull_use_spike': True, 'bull_rsi_required': False, 'bear_strategy': 'breakout', 'bear_bb_std_mult': 3.1500339259844132, 'bear_rsi_os': 30, 'bear_rsi_ob': 65, 'bear_adx_thresh': 20.46366653679354, 'bear_atr_min_pct': 0.005546621615158218, 'bear_atr_max_pct': 0.014084645877048246, 'bear_tp_mult': 2.2206196638691833, 'bear_tsl_mult': 0.2893401957552527, 'bear_time_stop': 54, 'bear_use_sma': True, 'bear_use_ema': False, 'bear_use_atr': True, 'bear_use_adx': True, 'bear_use_spike': False, 'bear_rsi_required': False, 'sideways_strategy': 'breakout', 'sideways_bb_std_mult': 2.0560466302167537, 'sideways_rsi_os': 44, 'sideways_rsi_ob': 79, 'sideways_adx_thresh': 32.0455928813308, 'sideways_atr_min_pct': 0.006225797063196866, 'sideways_atr_max_pct': 0.07714728555512537, 'sideways_tp_mult': 2.5438268726207145, 'sideways_tsl_mult': 0.9736076830974425, 'sideways_time_stop': 213, 'sideways_use_sma': True, 'sideways_use_ema': False, 'sideways_use_atr': False, 'sideways_use_adx': True, 'sideways_use_spike': True, 'sideways_rsi_required': False}.
[I 2025-08-29 20:49:34,655] Trial 628 finished with values: [-0.006650680656024477, 0.006655053382963899] and parameters: {'p_sma': 19, 'p_std': 56, 'p_atr': 26, 'p_adx': 12, 'rsi_period': 75, 'ema1': 26, 'ema2': 45, 'slip_atr_k': 0.00024355665984664122, 'slip_spread_k': 0.9038228016950081, 'spread_hl_frac': 0.03205669037813291, 'bb_std_mult': 1.5179731220197845, 'rsi_os': 10, 'rsi_ob': 85, 'vol_spike': 0.1846294017677275, 'adx_thresh': 13.011519958701635, 'atr_min_pct': 0.017810894754886092, 'atr_max_pct': 0.02970813773630101, 'tp_mult': 1.3819866413384438, 'tsl_mult': 0.9265460796229662, 'strategy': 'mean_reversion', 'time_stop': 38, 'use_sma': True, 'use_atr': False, 'use_adx': False, 'use_ema': True, 'use_spike': False, 'rsi_required': True, 'edge_k': 0.9470788971424534, 'edge_cap': 0.5924866610798967, 'bull_strategy': 'mean_reversion', 'bull_bb_std_mult': 2.955038220739122, 'bull_rsi_os': 26, 'bull_rsi_ob': 62, 'bull_adx_thresh': 23.22789539385834, 'bull_atr_min_pct': 0.013033088913277703, 'bull_atr_max_pct': 0.05303093061567076, 'bull_tp_mult': 2.692251054250889, 'bull_tsl_mult': 0.9176438557224793, 'bull_time_stop': 224, 'bull_use_sma': True, 'bull_use_ema': False, 'bull_use_atr': True, 'bull_use_adx': True, 'bull_use_spike': True, 'bull_rsi_required': True, 'bear_strategy': 'breakout', 'bear_bb_std_mult': 2.6870786771602235, 'bear_rsi_os': 17, 'bear_rsi_ob': 68, 'bear_adx_thresh': 14.59154100287247, 'bear_atr_min_pct': 0.0024256537004896436, 'bear_atr_max_pct': 0.08268088907269665, 'bear_tp_mult': 1.7871176428943842, 'bear_tsl_mult': 0.8999392706430608, 'bear_time_stop': 77, 'bear_use_sma': True, 'bear_use_ema': False, 'bear_use_atr': True, 'bear_use_adx': True, 'bear_use_spike': False, 'bear_rsi_required': False, 'sideways_strategy': 'breakout', 'sideways_bb_std_mult': 3.4686956714218216, 'sideways_rsi_os': 55, 'sideways_rsi_ob': 55, 'sideways_adx_thresh': 33.73157688802527, 'sideways_atr_min_pct': 0.002915120933219168, 'sideways_atr_max_pct': 0.012432710970159784, 'sideways_tp_mult': 2.215416929920599, 'sideways_tsl_mult': 0.9759071334508667, 'sideways_time_stop': 26, 'sideways_use_sma': True, 'sideways_use_ema': False, 'sideways_use_atr': False, 'sideways_use_adx': True, 'sideways_use_spike': False, 'sideways_rsi_required': False}.
[I 2025-08-29 20:49:34,839] Trial 629 finished with values: [-1000000000.0, 1000000000.0] and parameters: {'p_sma': 18, 'p_std': 56, 'p_atr': 26, 'p_adx': 12, 'rsi_period': 11, 'ema1': 26, 'ema2': 45, 'slip_atr_k': 6.785448529513915e-06, 'slip_spread_k': 0.8466909390485013, 'spread_hl_frac': 0.01806282288982794, 'bb_std_mult': 1.8186342995316545, 'rsi_os': 6, 'rsi_ob': 83, 'vol_spike': 0.18551716856269881, 'adx_thresh': 15.034235717585725, 'atr_min_pct': 0.01899101107991902, 'atr_max_pct': 0.03547989543121899, 'tp_mult': 1.209229808897281, 'tsl_mult': 0.87883963749365, 'strategy': 'mean_reversion', 'time_stop': 193, 'use_sma': True, 'use_atr': False, 'use_adx': False, 'use_ema': True, 'use_spike': False, 'rsi_required': False, 'edge_k': 1.8030155773487695, 'edge_cap': 0.5948860876203698, 'bull_strategy': 'mean_reversion', 'bull_bb_std_mult': 3.1918346705347744, 'bull_rsi_os': 10, 'bull_rsi_ob': 67, 'bull_adx_thresh': 23.588068122056455, 'bull_atr_min_pct': 0.024963921591393483, 'bull_atr_max_pct': 0.0744038900314873, 'bull_tp_mult': 1.056234547891461, 'bull_tsl_mult': 0.6190053417735992, 'bull_time_stop': 37, 'bull_use_sma': True, 'bull_use_ema': False, 'bull_use_atr': False, 'bull_use_adx': False, 'bull_use_spike': True, 'bull_rsi_required': True, 'bear_strategy': 'breakout', 'bear_bb_std_mult': 2.694660048604786, 'bear_rsi_os': 18, 'bear_rsi_ob': 68, 'bear_adx_thresh': 23.139875611855818, 'bear_atr_min_pct': 0.005477266217974338, 'bear_atr_max_pct': 0.14668728112049406, 'bear_tp_mult': 2.2078895490662998, 'bear_tsl_mult': 0.29706352532493796, 'bear_time_stop': 48, 'bear_use_sma': True, 'bear_use_ema': True, 'bear_use_atr': True, 'bear_use_adx': True, 'bear_use_spike': True, 'bear_rsi_required': False, 'sideways_strategy': 'breakout', 'sideways_bb_std_mult': 2.1270121558397403, 'sideways_rsi_os': 46, 'sideways_rsi_ob': 55, 'sideways_adx_thresh': 33.76048616135398, 'sideways_atr_min_pct': 0.029771758727895233, 'sideways_atr_max_pct': 0.1450307233031093, 'sideways_tp_mult': 1.1603539386467303, 'sideways_tsl_mult': 0.31440801433208043, 'sideways_time_stop': 207, 'sideways_use_sma': False, 'sideways_use_ema': False, 'sideways_use_atr': True, 'sideways_use_adx': True, 'sideways_use_spike': False, 'sideways_rsi_required': False}.
[I 2025-08-29 20:49:35,130] Trial 626 finished with values: [-1000000000.0, 1000000000.0] and parameters: {'p_sma': 54, 'p_std': 56, 'p_atr': 24, 'p_adx': 11, 'rsi_period': 42, 'ema1': 26, 'ema2': 20, 'slip_atr_k': 0.004391341218594172, 'slip_spread_k': 0.8138008131244954, 'spread_hl_frac': 0.018722157616238987, 'bb_std_mult': 1.5572519609273279, 'rsi_os': 37, 'rsi_ob': 75, 'vol_spike': 0.28287193817836254, 'adx_thresh': 23.748997525889227, 'atr_min_pct': 0.019519936224335312, 'atr_max_pct': 0.0295214441725453, 'tp_mult': 1.3749893031235267, 'tsl_mult': 0.8981272928552833, 'strategy': 'mean_reversion', 'time_stop': 146, 'use_sma': False, 'use_atr': False, 'use_adx': False, 'use_ema': False, 'use_spike': False, 'rsi_required': True, 'edge_k': 0.6572686911005192, 'edge_cap': 0.641740427680875, 'bull_strategy': 'breakout', 'bull_bb_std_mult': 3.166165407476023, 'bull_rsi_os': 28, 'bull_rsi_ob': 73, 'bull_adx_thresh': 13.051154256191293, 'bull_atr_min_pct': 0.009968249649146211, 'bull_atr_max_pct': 0.08238605300247177, 'bull_tp_mult': 2.6890785492210325, 'bull_tsl_mult': 0.8149876157359955, 'bull_time_stop': 39, 'bull_use_sma': False, 'bull_use_ema': False, 'bull_use_atr': True, 'bull_use_adx': True, 'bull_use_spike': True, 'bull_rsi_required': False, 'bear_strategy': 'breakout', 'bear_bb_std_mult': 2.7099143198953515, 'bear_rsi_os': 18, 'bear_rsi_ob': 78, 'bear_adx_thresh': 23.324964488654953, 'bear_atr_min_pct': 0.005597676545371198, 'bear_atr_max_pct': 0.05003464723627386, 'bear_tp_mult': 2.0476278960228687, 'bear_tsl_mult': 0.8609192358024506, 'bear_time_stop': 54, 'bear_use_sma': False, 'bear_use_ema': False, 'bear_use_atr': False, 'bear_use_adx': False, 'bear_use_spike': False, 'bear_rsi_required': False, 'sideways_strategy': 'mean_reversion', 'sideways_bb_std_mult': 3.298047104777052, 'sideways_rsi_os': 45, 'sideways_rsi_ob': 79, 'sideways_adx_thresh': 31.951898384805137, 'sideways_atr_min_pct': 0.005337978754107183, 'sideways_atr_max_pct': 0.049355441538902645, 'sideways_tp_mult': 2.601696009286298, 'sideways_tsl_mult': 0.7094234695336716, 'sideways_time_stop': 225, 'sideways_use_sma': True, 'sideways_use_ema': False, 'sideways_use_atr': False, 'sideways_use_adx': False, 'sideways_use_spike': True, 'sideways_rsi_required': True}.
