[I 2025-08-29 20:08:23,430] Trial 268 finished with values: [-1000000000.0, 1000000000.0] and parameters: {'p_sma': 31, 'p_std': 60, 'p_atr': 25, 'p_adx': 23, 'rsi_period': 40, 'ema1': 19, 'ema2': 48, 'slip_atr_k': 0.07673253247691078, 'slip_spread_k': 0.3678698505640348, 'spread_hl_frac': 0.018006013429542694, 'bb_std_mult': 0.6646127741525694, 'rsi_os': 17, 'rsi_ob': 65, 'vol_spike': 0.1831660680921843, 'adx_thresh': 30.302164114521425, 'atr_min_pct': 0.014921702174078498, 'atr_max_pct': 0.037951387155114744, 'tp_mult': 1.702332304842166, 'tsl_mult': 0.5949910312831178, 'strategy': 'mean_reversion', 'time_stop': 150, 'use_sma': True, 'use_atr': True, 'use_adx': True, 'use_ema': False, 'use_spike': True, 'rsi_required': True, 'edge_k': 1.174455973371206, 'edge_cap': 0.4611472771522025, 'bull_strategy': 'mean_reversion', 'bull_bb_std_mult': 1.5755154211920297, 'bull_rsi_os': 53, 'bull_rsi_ob': 94, 'bull_adx_thresh': 20.244825775898846, 'bull_atr_min_pct': 0.0009673575441473507, 'bull_atr_max_pct': 0.02413334363360449, 'bull_tp_mult': 1.486828011008378, 'bull_tsl_mult': 0.8368934805427273, 'bull_time_stop': 179, 'bull_use_sma': True, 'bull_use_ema': True, 'bull_use_atr': False, 'bull_use_adx': True, 'bull_use_spike': False, 'bull_rsi_required': False, 'bear_strategy': 'breakout', 'bear_bb_std_mult': 1.2767204388355833, 'bear_rsi_os': 30, 'bear_rsi_ob': 92, 'bear_adx_thresh': 5.536985387595772, 'bear_atr_min_pct': 0.009611396153841316, 'bear_atr_max_pct': 0.1406360133462335, 'bear_tp_mult': 1.0578328885236794, 'bear_tsl_mult': 0.4111282664960749, 'bear_time_stop': 34, 'bear_use_sma': True, 'bear_use_ema': True, 'bear_use_atr': True, 'bear_use_adx': False, 'bear_use_spike': True, 'bear_rsi_required': False, 'sideways_strategy': 'mean_reversion', 'sideways_bb_std_mult': 1.848602250731707, 'sideways_rsi_os': 12, 'sideways_rsi_ob': 76, 'sideways_adx_thresh': 20.379142627718913, 'sideways_atr_min_pct': 0.00410090486602582, 'sideways_atr_max_pct': 0.060337751506849356, 'sideways_tp_mult': 2.7812553574557346, 'sideways_tsl_mult': 0.9281936972620066, 'sideways_time_stop': 222, 'sideways_use_sma': False, 'sideways_use_ema': True, 'sideways_use_atr': True, 'sideways_use_adx': False, 'sideways_use_spike': True, 'sideways_rsi_required': False}.
[I 2025-08-29 20:08:23,649] Trial 271 finished with values: [-1000000000.0, 0.11853055242728913] and parameters: {'p_sma': 42, 'p_std': 26, 'p_atr': 9, 'p_adx': 23, 'rsi_period': 56, 'ema1': 17, 'ema2': 48, 'slip_atr_k': 0.037980377463279265, 'slip_spread_k': 0.5054494381394821, 'spread_hl_frac': 0.00346740130126083, 'bb_std_mult': 0.585287050234514, 'rsi_os': 49, 'rsi_ob': 65, 'vol_spike': 0.17196166032681595, 'adx_thresh': 25.803055229521433, 'atr_min_pct': 0.029947900832796012, 'atr_max_pct': 0.04554996642718705, 'tp_mult': 1.7465310203929618, 'tsl_mult': 0.5902951551307204, 'strategy': 'mean_reversion', 'time_stop': 167, 'use_sma': True, 'use_atr': True, 'use_adx': True, 'use_ema': False, 'use_spike': False, 'rsi_required': True, 'edge_k': 1.1980773946498486, 'edge_cap': 0.8841453775184049, 'bull_strategy': 'mean_reversion', 'bull_bb_std_mult': 1.6180530850435813, 'bull_rsi_os': 36, 'bull_rsi_ob': 57, 'bull_adx_thresh': 33.00771931231088, 'bull_atr_min_pct': 0.0007923228065464035, 'bull_atr_max_pct': 0.02533152289921943, 'bull_tp_mult': 1.4116439196595396, 'bull_tsl_mult': 0.8449076494111942, 'bull_time_stop': 183, 'bull_use_sma': True, 'bull_use_ema': True, 'bull_use_atr': False, 'bull_use_adx': True, 'bull_use_spike': False, 'bull_rsi_required': False, 'bear_strategy': 'breakout', 'bear_bb_std_mult': 1.018705069134477, 'bear_rsi_os': 49, 'bear_rsi_ob': 68, 'bear_adx_thresh': 5.545152261541331, 'bear_atr_min_pct': 0.0009958809371907532, 'bear_atr_max_pct': 0.06594705600406199, 'bear_tp_mult': 1.0635701038348913, 'bear_tsl_mult': 0.3377177300088108, 'bear_time_stop': 26, 'bear_use_sma': True, 'bear_use_ema': True, 'bear_use_atr': True, 'bear_use_adx': False, 'bear_use_spike': True, 'bear_rsi_required': True, 'sideways_strategy': 'mean_reversion', 'sideways_bb_std_mult': 1.9460604289755072, 'sideways_rsi_os': 19, 'sideways_rsi_ob': 57, 'sideways_adx_thresh': 21.41318208253165, 'sideways_atr_min_pct': 0.004263083548203891, 'sideways_atr_max_pct': 0.06649743895044158, 'sideways_tp_mult': 2.7611108910819953, 'sideways_tsl_mult': 0.6695125508551141, 'sideways_time_stop': 189, 'sideways_use_sma': False, 'sideways_use_ema': True, 'sideways_use_atr': True, 'sideways_use_adx': False, 'sideways_use_spike': True, 'sideways_rsi_required': False}.
[I 2025-08-29 20:08:54,309] Trial 275 finished with values: [-0.0016768953490893246, 0.001788303548232225] and parameters: {'p_sma': 23, 'p_std': 52, 'p_atr': 16, 'p_adx': 25, 'rsi_period': 33, 'ema1': 21, 'ema2': 46, 'slip_atr_k': 0.04600744851991405, 'slip_spread_k': 0.3546325338456262, 'spread_hl_frac': 0.002157482163637123, 'bb_std_mult': 2.9971392853315963, 'rsi_os': 37, 'rsi_ob': 85, 'vol_spike': 0.18677944309694505, 'adx_thresh': 32.43466505096992, 'atr_min_pct': 0.012346831497581505, 'atr_max_pct': 0.04177449328705875, 'tp_mult': 1.7827717274792387, 'tsl_mult': 0.7560826371063829, 'strategy': 'mean_reversion', 'time_stop': 161, 'use_sma': True, 'use_atr': True, 'use_adx': False, 'use_ema': True, 'use_spike': False, 'rsi_required': True, 'edge_k': 1.6835573000866646, 'edge_cap': 0.7487373654132874, 'bull_strategy': 'mean_reversion', 'bull_bb_std_mult': 3.2369835299192156, 'bull_rsi_os': 29, 'bull_rsi_ob': 92, 'bull_adx_thresh': 18.113366087251844, 'bull_atr_min_pct': 0.0036414095288914315, 'bull_atr_max_pct': 0.022807900414245776, 'bull_tp_mult': 2.1378012134266005, 'bull_tsl_mult': 0.14616540980980886, 'bull_time_stop': 160, 'bull_use_sma': True, 'bull_use_ema': False, 'bull_use_atr': True, 'bull_use_adx': False, 'bull_use_spike': False, 'bull_rsi_required': True, 'bear_strategy': 'breakout', 'bear_bb_std_mult': 2.3799655556512525, 'bear_rsi_os': 15, 'bear_rsi_ob': 61, 'bear_adx_thresh': 6.542270631928426, 'bear_atr_min_pct': 0.018969255442956752, 'bear_atr_max_pct': 0.019266040838028194, 'bear_tp_mult': 1.0982642035122627, 'bear_tsl_mult': 0.5104518252000042, 'bear_time_stop': 278, 'bear_use_sma': False, 'bear_use_ema': True, 'bear_use_atr': True, 'bear_use_adx': True, 'bear_use_spike': True, 'bear_rsi_required': False, 'sideways_strategy': 'breakout', 'sideways_bb_std_mult': 1.7284738101900303, 'sideways_rsi_os': 16, 'sideways_rsi_ob': 85, 'sideways_adx_thresh': 18.847088719969783, 'sideways_atr_min_pct': 0.006329525215585854, 'sideways_atr_max_pct': 0.05920137154694658, 'sideways_tp_mult': 1.3598605080989605, 'sideways_tsl_mult': 0.538622786324003, 'sideways_time_stop': 250, 'sideways_use_sma': False, 'sideways_use_ema': True, 'sideways_use_atr': True, 'sideways_use_adx': True, 'sideways_use_spike': False, 'sideways_rsi_required': False}.
[I 2025-08-29 20:08:54,591] Trial 272 finished with values: [-0.0037953925987416204, 0.0038951774188470496] and parameters: {'p_sma': 10, 'p_std': 53, 'p_atr': 9, 'p_adx': 23, 'rsi_period': 56, 'ema1': 19, 'ema2': 48, 'slip_atr_k': 0.03513096896976421, 'slip_spread_k': 0.06543464646287805, 'spread_hl_frac': 0.002167614865438178, 'bb_std_mult': 1.1398217475577062, 'rsi_os': 43, 'rsi_ob': 85, 'vol_spike': 0.18252532999761292, 'adx_thresh': 32.42623521712572, 'atr_min_pct': 0.017465011612515208, 'atr_max_pct': 0.04223691139795745, 'tp_mult': 1.6932183157733158, 'tsl_mult': 0.5283632931547199, 'strategy': 'mean_reversion', 'time_stop': 159, 'use_sma': True, 'use_atr': True, 'use_adx': True, 'use_ema': True, 'use_spike': False, 'rsi_required': True, 'edge_k': 0.7867343656093244, 'edge_cap': 0.46277296682158203, 'bull_strategy': 'mean_reversion', 'bull_bb_std_mult': 1.713005309617626, 'bull_rsi_os': 40, 'bull_rsi_ob': 92, 'bull_adx_thresh': 18.10236476854462, 'bull_atr_min_pct': 0.0004619761781754187, 'bull_atr_max_pct': 0.02085621661678769, 'bull_tp_mult': 1.4576009105053864, 'bull_tsl_mult': 0.15172950354044204, 'bull_time_stop': 168, 'bull_use_sma': True, 'bull_use_ema': False, 'bull_use_atr': False, 'bull_use_adx': False, 'bull_use_spike': False, 'bull_rsi_required': False, 'bear_strategy': 'breakout', 'bear_bb_std_mult': 1.268958128213757, 'bear_rsi_os': 14, 'bear_rsi_ob': 75, 'bear_adx_thresh': 17.472930130304558, 'bear_atr_min_pct': 0.012145596013332548, 'bear_atr_max_pct': 0.07798315075468402, 'bear_tp_mult': 1.0668186212459287, 'bear_tsl_mult': 0.5661326496924474, 'bear_time_stop': 24, 'bear_use_sma': False, 'bear_use_ema': True, 'bear_use_atr': True, 'bear_use_adx': True, 'bear_use_spike': True, 'bear_rsi_required': False, 'sideways_strategy': 'mean_reversion', 'sideways_bb_std_mult': 2.5585321095905713, 'sideways_rsi_os': 12, 'sideways_rsi_ob': 52, 'sideways_adx_thresh': 18.98911516780313, 'sideways_atr_min_pct': 0.005098623999163599, 'sideways_atr_max_pct': 0.05855697691354816, 'sideways_tp_mult': 2.751924594019747, 'sideways_tsl_mult': 0.8036092635635202, 'sideways_time_stop': 251, 'sideways_use_sma': False, 'sideways_use_ema': True, 'sideways_use_atr': True, 'sideways_use_adx': False, 'sideways_use_spike': True, 'sideways_rsi_required': False}.
[I 2025-08-29 20:08:54,952] Trial 274 finished with values: [-0.010273596641424465, 0.010247173941561607] and parameters: {'p_sma': 39, 'p_std': 25, 'p_atr': 12, 'p_adx': 22, 'rsi_period': 57, 'ema1': 17, 'ema2': 46, 'slip_atr_k': 0.035630160891603, 'slip_spread_k': 0.0643663261640752, 'spread_hl_frac': 0.002353854581261928, 'bb_std_mult': 1.982361714480474, 'rsi_os': 10, 'rsi_ob': 83, 'vol_spike': 0.1806438618115734, 'adx_thresh': 11.533001495737471, 'atr_min_pct': 0.012542163127294056, 'atr_max_pct': 0.045584683480129104, 'tp_mult': 1.771219264718648, 'tsl_mult': 0.20235869827255593, 'strategy': 'mean_reversion', 'time_stop': 160, 'use_sma': True, 'use_atr': True, 'use_adx': True, 'use_ema': True, 'use_spike': False, 'rsi_required': True, 'edge_k': 1.2605971276770496, 'edge_cap': 0.7688942972816728, 'bull_strategy': 'mean_reversion', 'bull_bb_std_mult': 1.4701768120637362, 'bull_rsi_os': 29, 'bull_rsi_ob': 78, 'bull_adx_thresh': 17.994351573903003, 'bull_atr_min_pct': 0.0033834242174527306, 'bull_atr_max_pct': 0.032680835615751296, 'bull_tp_mult': 2.2241491640946696, 'bull_tsl_mult': 0.1469451866998632, 'bull_time_stop': 161, 'bull_use_sma': True, 'bull_use_ema': False, 'bull_use_atr': True, 'bull_use_adx': False, 'bull_use_spike': False, 'bull_rsi_required': False, 'bear_strategy': 'breakout', 'bear_bb_std_mult': 1.027016760661418, 'bear_rsi_os': 15, 'bear_rsi_ob': 75, 'bear_adx_thresh': 34.446287124353205, 'bear_atr_min_pct': 0.004834934092608382, 'bear_atr_max_pct': 0.07157859158763485, 'bear_tp_mult': 1.0802999666289819, 'bear_tsl_mult': 0.4687045911980593, 'bear_time_stop': 122, 'bear_use_sma': False, 'bear_use_ema': True, 'bear_use_atr': True, 'bear_use_adx': True, 'bear_use_spike': True, 'bear_rsi_required': False, 'sideways_strategy': 'mean_reversion', 'sideways_bb_std_mult': 1.9574731015465974, 'sideways_rsi_os': 16, 'sideways_rsi_ob': 85, 'sideways_adx_thresh': 19.271931715798637, 'sideways_atr_min_pct': 0.0049687020908631046, 'sideways_atr_max_pct': 0.058913192244873534, 'sideways_tp_mult': 2.7580683047749974, 'sideways_tsl_mult': 0.6700298155947777, 'sideways_time_stop': 251, 'sideways_use_sma': False, 'sideways_use_ema': True, 'sideways_use_atr': True, 'sideways_use_adx': True, 'sideways_use_spike': False, 'sideways_rsi_required': False}.
[I 2025-08-29 20:08:55,083] Trial 273 finished with values: [-0.017152273692361275, 0.017123566976947252] and parameters: {'p_sma': 10, 'p_std': 26, 'p_atr': 24, 'p_adx': 24, 'rsi_period': 28, 'ema1': 17, 'ema2': 48, 'slip_atr_k': 0.2116390611346241, 'slip_spread_k': 0.3603577643331634, 'spread_hl_frac': 0.04101165973001288, 'bb_std_mult': 2.8190841083890885, 'rsi_os': 20, 'rsi_ob': 85, 'vol_spike': 0.2752974185749403, 'adx_thresh': 30.255631122600217, 'atr_min_pct': 0.005086894317537151, 'atr_max_pct': 0.04662674606858418, 'tp_mult': 1.7046113591261634, 'tsl_mult': 0.5216844594356658, 'strategy': 'mean_reversion', 'time_stop': 159, 'use_sma': True, 'use_atr': True, 'use_adx': True, 'use_ema': True, 'use_spike': False, 'rsi_required': True, 'edge_k': 1.1893668959367774, 'edge_cap': 0.46012199226422695, 'bull_strategy': 'mean_reversion', 'bull_bb_std_mult': 1.6571303714122136, 'bull_rsi_os': 53, 'bull_rsi_ob': 95, 'bull_adx_thresh': 18.14502991064559, 'bull_atr_min_pct': 0.0006821915376983022, 'bull_atr_max_pct': 0.022112374156155225, 'bull_tp_mult': 1.4582541632847432, 'bull_tsl_mult': 0.14872483196617062, 'bull_time_stop': 163, 'bull_use_sma': True, 'bull_use_ema': False, 'bull_use_atr': False, 'bull_use_adx': False, 'bull_use_spike': False, 'bull_rsi_required': False, 'bear_strategy': 'breakout', 'bear_bb_std_mult': 1.0221431743199267, 'bear_rsi_os': 34, 'bear_rsi_ob': 77, 'bear_adx_thresh': 34.33265430415241, 'bear_atr_min_pct': 0.00957718331208032, 'bear_atr_max_pct': 0.11734224502681473, 'bear_tp_mult': 1.065212665731395, 'bear_tsl_mult': 0.5687709865596304, 'bear_time_stop': 23, 'bear_use_sma': False, 'bear_use_ema': True, 'bear_use_atr': True, 'bear_use_adx': True, 'bear_use_spike': True, 'bear_rsi_required': False, 'sideways_strategy': 'mean_reversion', 'sideways_bb_std_mult': 2.4824065780262354, 'sideways_rsi_os': 12, 'sideways_rsi_ob': 85, 'sideways_adx_thresh': 18.845669618519423, 'sideways_atr_min_pct': 0.0065688721693409596, 'sideways_atr_max_pct': 0.05924119957555011, 'sideways_tp_mult': 2.777399472014597, 'sideways_tsl_mult': 0.666945694109216, 'sideways_time_stop': 49, 'sideways_use_sma': False, 'sideways_use_ema': True, 'sideways_use_atr': True, 'sideways_use_adx': False, 'sideways_use_spike': True, 'sideways_rsi_required': False}.
[I 2025-08-29 20:08:55,531] Trial 277 finished with values: [-1000000000.0, 1000000000.0] and parameters: {'p_sma': 9, 'p_std': 52, 'p_atr': 16, 'p_adx': 17, 'rsi_period': 33, 'ema1': 20, 'ema2': 47, 'slip_atr_k': 0.21086909494639539, 'slip_spread_k': 0.35034099981067013, 'spread_hl_frac': 0.0022617833800502546, 'bb_std_mult': 1.9877996834686733, 'rsi_os': 20, 'rsi_ob': 50, 'vol_spike': 0.024094976237418603, 'adx_thresh': 32.337205092048464, 'atr_min_pct': 0.023643155712258758, 'atr_max_pct': 0.042679575950043944, 'tp_mult': 1.7696942256958528, 'tsl_mult': 0.5708820566041674, 'strategy': 'mean_reversion', 'time_stop': 159, 'use_sma': True, 'use_atr': True, 'use_adx': False, 'use_ema': True, 'use_spike': False, 'rsi_required': True, 'edge_k': 1.604861391884795, 'edge_cap': 0.7577536340079795, 'bull_strategy': 'mean_reversion', 'bull_bb_std_mult': 1.2716023675413597, 'bull_rsi_os': 39, 'bull_rsi_ob': 92, 'bull_adx_thresh': 18.11642683742958, 'bull_atr_min_pct': 3.864543063260967e-05, 'bull_atr_max_pct': 0.021064550693080195, 'bull_tp_mult': 1.4557447998808848, 'bull_tsl_mult': 0.3412619957569878, 'bull_time_stop': 171, 'bull_use_sma': True, 'bull_use_ema': False, 'bull_use_atr': True, 'bull_use_adx': False, 'bull_use_spike': False, 'bull_rsi_required': True, 'bear_strategy': 'breakout', 'bear_bb_std_mult': 1.2503729632143592, 'bear_rsi_os': 16, 'bear_rsi_ob': 74, 'bear_adx_thresh': 26.71619784697035, 'bear_atr_min_pct': 0.014176400556363164, 'bear_atr_max_pct': 0.018581681927128356, 'bear_tp_mult': 2.607562394309186, 'bear_tsl_mult': 0.5074256064129525, 'bear_time_stop': 121, 'bear_use_sma': False, 'bear_use_ema': True, 'bear_use_atr': True, 'bear_use_adx': True, 'bear_use_spike': True, 'bear_rsi_required': False, 'sideways_strategy': 'breakout', 'sideways_bb_std_mult': 2.815924315097701, 'sideways_rsi_os': 16, 'sideways_rsi_ob': 52, 'sideways_adx_thresh': 19.003064444624098, 'sideways_atr_min_pct': 0.027929369373004186, 'sideways_atr_max_pct': 0.05852103024437713, 'sideways_tp_mult': 2.4431015386015686, 'sideways_tsl_mult': 0.7828938494141525, 'sideways_time_stop': 249, 'sideways_use_sma': False, 'sideways_use_ema': False, 'sideways_use_atr': True, 'sideways_use_adx': True, 'sideways_use_spike': False, 'sideways_rsi_required': False}.
[I 2025-08-29 20:09:24,188] Trial 279 finished with values: [-1000000000.0, 1000000000.0] and parameters: {'p_sma': 12, 'p_std': 34, 'p_atr': 10, 'p_adx': 27, 'rsi_period': 33, 'ema1': 20, 'ema2': 55, 'slip_atr_k': 0.046980082545818674, 'slip_spread_k': 0.40223563151972797, 'spread_hl_frac': 0.0018573154120885814, 'bb_std_mult': 1.1505599188600304, 'rsi_os': 18, 'rsi_ob': 94, 'vol_spike': 0.006660225564191186, 'adx_thresh': 14.014916234463236, 'atr_min_pct': 0.017559284768397094, 'atr_max_pct': 0.04256333547061063, 'tp_mult': 1.6372932017122588, 'tsl_mult': 0.5736313924797289, 'strategy': 'mean_reversion', 'time_stop': 140, 'use_sma': True, 'use_atr': True, 'use_adx': False, 'use_ema': False, 'use_spike': False, 'rsi_required': False, 'edge_k': 0.5705836007099507, 'edge_cap': 0.5051460058718699, 'bull_strategy': 'mean_reversion', 'bull_bb_std_mult': 1.716632322564576, 'bull_rsi_os': 39, 'bull_rsi_ob': 92, 'bull_adx_thresh': 5.616952975321226, 'bull_atr_min_pct': 0.0019495253722736062, 'bull_atr_max_pct': 0.020716554141635566, 'bull_tp_mult': 2.149677455971128, 'bull_tsl_mult': 0.0936372084213995, 'bull_time_stop': 170, 'bull_use_sma': True, 'bull_use_ema': True, 'bull_use_atr': True, 'bull_use_adx': True, 'bull_use_spike': True, 'bull_rsi_required': True, 'bear_strategy': 'breakout', 'bear_bb_std_mult': 2.8261963527806406, 'bear_rsi_os': 29, 'bear_rsi_ob': 74, 'bear_adx_thresh': 17.97868678045961, 'bear_atr_min_pct': 0.006783626935394068, 'bear_atr_max_pct': 0.01311935187723838, 'bear_tp_mult': 2.5944839253836633, 'bear_tsl_mult': 0.5095959164890763, 'bear_time_stop': 11, 'bear_use_sma': False, 'bear_use_ema': True, 'bear_use_atr': True, 'bear_use_adx': False, 'bear_use_spike': True, 'bear_rsi_required': False, 'sideways_strategy': 'breakout', 'sideways_bb_std_mult': 1.7439254763672973, 'sideways_rsi_os': 16, 'sideways_rsi_ob': 52, 'sideways_adx_thresh': 19.7020576211238, 'sideways_atr_min_pct': 0.005430465433835067, 'sideways_atr_max_pct': 0.06359595385019828, 'sideways_tp_mult': 2.734247508496118, 'sideways_tsl_mult': 0.7992172578709411, 'sideways_time_stop': 246, 'sideways_use_sma': True, 'sideways_use_ema': False, 'sideways_use_atr': True, 'sideways_use_adx': False, 'sideways_use_spike': False, 'sideways_rsi_required': False}.
[I 2025-08-29 20:09:24,825] Trial 278 finished with values: [-1000000000.0, 1000000000.0] and parameters: {'p_sma': 23, 'p_std': 34, 'p_atr': 24, 'p_adx': 27, 'rsi_period': 34, 'ema1': 20, 'ema2': 45, 'slip_atr_k': 0.045366185781961194, 'slip_spread_k': 0.028027712843146202, 'spread_hl_frac': 0.0017263816279875265, 'bb_std_mult': 1.1446449160465326, 'rsi_os': 18, 'rsi_ob': 93, 'vol_spike': 0.10026063549421124, 'adx_thresh': 14.181082270998768, 'atr_min_pct': 0.02365343462072339, 'atr_max_pct': 0.04157000302638925, 'tp_mult': 1.686768385846018, 'tsl_mult': 0.4851776165369052, 'strategy': 'mean_reversion', 'time_stop': 159, 'use_sma': True, 'use_atr': True, 'use_adx': False, 'use_ema': True, 'use_spike': False, 'rsi_required': False, 'edge_k': 0.0449002960553786, 'edge_cap': 0.12373510713398389, 'bull_strategy': 'mean_reversion', 'bull_bb_std_mult': 1.2683664934148808, 'bull_rsi_os': 16, 'bull_rsi_ob': 75, 'bull_adx_thresh': 17.110497297980913, 'bull_atr_min_pct': 0.013109369671622703, 'bull_atr_max_pct': 0.021066465139749326, 'bull_tp_mult': 2.149762303528994, 'bull_tsl_mult': 0.3387535877706893, 'bull_time_stop': 170, 'bull_use_sma': True, 'bull_use_ema': False, 'bull_use_atr': True, 'bull_use_adx': False, 'bull_use_spike': False, 'bull_rsi_required': True, 'bear_strategy': 'breakout', 'bear_bb_std_mult': 3.3093692675518493, 'bear_rsi_os': 20, 'bear_rsi_ob': 63, 'bear_adx_thresh': 6.516484899389839, 'bear_atr_min_pct': 0.012299620976793876, 'bear_atr_max_pct': 0.0783926095509934, 'bear_tp_mult': 1.0503676502280954, 'bear_tsl_mult': 0.5126867908593702, 'bear_time_stop': 11, 'bear_use_sma': False, 'bear_use_ema': True, 'bear_use_atr': True, 'bear_use_adx': True, 'bear_use_spike': True, 'bear_rsi_required': False, 'sideways_strategy': 'breakout', 'sideways_bb_std_mult': 2.5415430847217326, 'sideways_rsi_os': 16, 'sideways_rsi_ob': 81, 'sideways_adx_thresh': 19.592925047219676, 'sideways_atr_min_pct': 0.006513489613216978, 'sideways_atr_max_pct': 0.06201973347429147, 'sideways_tp_mult': 2.7280474206295247, 'sideways_tsl_mult': 0.7938097773153283, 'sideways_time_stop': 245, 'sideways_use_sma': False, 'sideways_use_ema': False, 'sideways_use_atr': True, 'sideways_use_adx': False, 'sideways_use_spike': False, 'sideways_rsi_required': False}.
