[I 2025-08-29 20:31:38,285] Trial 468 finished with values: [-1000000000.0, 1000000000.0] and parameters: {'p_sma': 20, 'p_std': 59, 'p_atr': 25, 'p_adx': 14, 'rsi_period': 38, 'ema1': 27, 'ema2': 47, 'slip_atr_k': 0.009230052229617043, 'slip_spread_k': 0.23406211180858172, 'spread_hl_frac': 0.02352245451392904, 'bb_std_mult': 2.8038292462043657, 'rsi_os': 5, 'rsi_ob': 48, 'vol_spike': 0.1879241695472306, 'adx_thresh': 12.537708974359429, 'atr_min_pct': 0.02102619207057668, 'atr_max_pct': 0.02599768969476749, 'tp_mult': 2.770238606442766, 'tsl_mult': 0.03665225008905798, 'strategy': 'mean_reversion', 'time_stop': 155, 'use_sma': True, 'use_atr': False, 'use_adx': False, 'use_ema': True, 'use_spike': True, 'rsi_required': False, 'edge_k': 1.0751953478553928, 'edge_cap': 0.27734448260721145, 'bull_strategy': 'mean_reversion', 'bull_bb_std_mult': 3.5889133946183778, 'bull_rsi_os': 18, 'bull_rsi_ob': 77, 'bull_adx_thresh': 14.554026686909568, 'bull_atr_min_pct': 0.01586886379649139, 'bull_atr_max_pct': 0.09937480820876209, 'bull_tp_mult': 1.7351457928584915, 'bull_tsl_mult': 0.8696089230271683, 'bull_time_stop': 105, 'bull_use_sma': True, 'bull_use_ema': False, 'bull_use_atr': True, 'bull_use_adx': False, 'bull_use_spike': True, 'bull_rsi_required': False, 'bear_strategy': 'mean_reversion', 'bear_bb_std_mult': 2.745349914935527, 'bear_rsi_os': 51, 'bear_rsi_ob': 95, 'bear_adx_thresh': 17.475786944086803, 'bear_atr_min_pct': 0.00653571618098685, 'bear_atr_max_pct': 0.04286620057564226, 'bear_tp_mult': 2.6804282204811014, 'bear_tsl_mult': 0.9262773873976934, 'bear_time_stop': 50, 'bear_use_sma': False, 'bear_use_ema': True, 'bear_use_atr': False, 'bear_use_adx': True, 'bear_use_spike': True, 'bear_rsi_required': False, 'sideways_strategy': 'breakout', 'sideways_bb_std_mult': 3.4510638560298856, 'sideways_rsi_os': 49, 'sideways_rsi_ob': 80, 'sideways_adx_thresh': 33.955268529600524, 'sideways_atr_min_pct': 0.0049079803294151715, 'sideways_atr_max_pct': 0.013499790811839246, 'sideways_tp_mult': 1.1785636764180558, 'sideways_tsl_mult': 0.7073011144958624, 'sideways_time_stop': 14, 'sideways_use_sma': False, 'sideways_use_ema': False, 'sideways_use_atr': False, 'sideways_use_adx': False, 'sideways_use_spike': False, 'sideways_rsi_required': False}.
[I 2025-08-29 20:31:38,359] Trial 469 finished with values: [-1000000000.0, 1000000000.0] and parameters: {'p_sma': 17, 'p_std': 12, 'p_atr': 28, 'p_adx': 14, 'rsi_period': 44, 'ema1': 9, 'ema2': 46, 'slip_atr_k': 0.17290124666909987, 'slip_spread_k': 0.7395692283847727, 'spread_hl_frac': 0.0490306146423816, 'bb_std_mult': 3.004220006491674, 'rsi_os': 46, 'rsi_ob': 48, 'vol_spike': 0.07567681521551432, 'adx_thresh': 12.057770781721358, 'atr_min_pct': 0.02588975503420112, 'atr_max_pct': 0.07100136239725095, 'tp_mult': 2.7671252369251595, 'tsl_mult': 0.7589776035673825, 'strategy': 'mean_reversion', 'time_stop': 279, 'use_sma': True, 'use_atr': False, 'use_adx': False, 'use_ema': True, 'use_spike': True, 'rsi_required': False, 'edge_k': 0.218481246121089, 'edge_cap': 0.2769697976831523, 'bull_strategy': 'mean_reversion', 'bull_bb_std_mult': 3.05666597290486, 'bull_rsi_os': 19, 'bull_rsi_ob': 71, 'bull_adx_thresh': 13.682016969493977, 'bull_atr_min_pct': 0.016473176670713734, 'bull_atr_max_pct': 0.0986257349449495, 'bull_tp_mult': 1.7658757483898067, 'bull_tsl_mult': 0.8650661941263, 'bull_time_stop': 12, 'bull_use_sma': False, 'bull_use_ema': False, 'bull_use_atr': True, 'bull_use_adx': False, 'bull_use_spike': True, 'bull_rsi_required': False, 'bear_strategy': 'mean_reversion', 'bear_bb_std_mult': 2.73721117108392, 'bear_rsi_os': 34, 'bear_rsi_ob': 64, 'bear_adx_thresh': 26.32053130342123, 'bear_atr_min_pct': 0.021741277784465725, 'bear_atr_max_pct': 0.04379311339254174, 'bear_tp_mult': 2.561348825505096, 'bear_tsl_mult': 0.9227233487324195, 'bear_time_stop': 94, 'bear_use_sma': False, 'bear_use_ema': False, 'bear_use_atr': False, 'bear_use_adx': True, 'bear_use_spike': True, 'bear_rsi_required': False, 'sideways_strategy': 'breakout', 'sideways_bb_std_mult': 2.3851315840536875, 'sideways_rsi_os': 45, 'sideways_rsi_ob': 80, 'sideways_adx_thresh': 9.778981580759003, 'sideways_atr_min_pct': 0.022540920713983316, 'sideways_atr_max_pct': 0.02626052138424853, 'sideways_tp_mult': 1.921630700250824, 'sideways_tsl_mult': 0.7591072249342716, 'sideways_time_stop': 189, 'sideways_use_sma': False, 'sideways_use_ema': False, 'sideways_use_atr': False, 'sideways_use_adx': False, 'sideways_use_spike': False, 'sideways_rsi_required': False}.
[I 2025-08-29 20:32:08,219] Trial 470 finished with values: [-1000000000.0, 1000000000.0] and parameters: {'p_sma': 17, 'p_std': 12, 'p_atr': 28, 'p_adx': 14, 'rsi_period': 40, 'ema1': 28, 'ema2': 46, 'slip_atr_k': 0.23611086322949987, 'slip_spread_k': 0.7480471707332033, 'spread_hl_frac': 0.018059280610861532, 'bb_std_mult': 1.8709842746770196, 'rsi_os': 8, 'rsi_ob': 81, 'vol_spike': 0.26900623989508843, 'adx_thresh': 12.913663132065823, 'atr_min_pct': 0.021008930187198085, 'atr_max_pct': 0.09920025674159451, 'tp_mult': 1.3550502264062774, 'tsl_mult': 0.772248615494447, 'strategy': 'mean_reversion', 'time_stop': 156, 'use_sma': True, 'use_atr': False, 'use_adx': False, 'use_ema': True, 'use_spike': True, 'rsi_required': False, 'edge_k': 0.29080715364454635, 'edge_cap': 0.8576283401910196, 'bull_strategy': 'mean_reversion', 'bull_bb_std_mult': 2.3881898688247425, 'bull_rsi_os': 21, 'bull_rsi_ob': 63, 'bull_adx_thresh': 13.664984678951361, 'bull_atr_min_pct': 0.010641301975326005, 'bull_atr_max_pct': 0.08986447345800035, 'bull_tp_mult': 1.7891944526902384, 'bull_tsl_mult': 0.8551007344821753, 'bull_time_stop': 148, 'bull_use_sma': True, 'bull_use_ema': False, 'bull_use_atr': True, 'bull_use_adx': False, 'bull_use_spike': True, 'bull_rsi_required': False, 'bear_strategy': 'mean_reversion', 'bear_bb_std_mult': 2.7575118340944957, 'bear_rsi_os': 27, 'bear_rsi_ob': 66, 'bear_adx_thresh': 21.97800932533699, 'bear_atr_min_pct': 0.003933284822234276, 'bear_atr_max_pct': 0.04379270773200271, 'bear_tp_mult': 2.5646271051195275, 'bear_tsl_mult': 0.9155621104226473, 'bear_time_stop': 51, 'bear_use_sma': False, 'bear_use_ema': True, 'bear_use_atr': False, 'bear_use_adx': True, 'bear_use_spike': True, 'bear_rsi_required': False, 'sideways_strategy': 'breakout', 'sideways_bb_std_mult': 1.4321857881567848, 'sideways_rsi_os': 49, 'sideways_rsi_ob': 80, 'sideways_adx_thresh': 32.18741490632464, 'sideways_atr_min_pct': 0.004931949693569411, 'sideways_atr_max_pct': 0.01331137926839672, 'sideways_tp_mult': 1.9526668718031859, 'sideways_tsl_mult': 0.6992640453559203, 'sideways_time_stop': 183, 'sideways_use_sma': False, 'sideways_use_ema': False, 'sideways_use_atr': False, 'sideways_use_adx': False, 'sideways_use_spike': False, 'sideways_rsi_required': False}.
[I 2025-08-29 20:32:08,757] Trial 473 finished with values: [-0.0016952761049782161, 0.0031354388250464777] and parameters: {'p_sma': 18, 'p_std': 54, 'p_atr': 24, 'p_adx': 13, 'rsi_period': 40, 'ema1': 28, 'ema2': 44, 'slip_atr_k': 1.1666109233359574e-05, 'slip_spread_k': 0.18203869032476394, 'spread_hl_frac': 0.04621142745743461, 'bb_std_mult': 1.8632440591568198, 'rsi_os': 32, 'rsi_ob': 85, 'vol_spike': 0.1778018918542153, 'adx_thresh': 13.152275477425437, 'atr_min_pct': 0.0012842818415485235, 'atr_max_pct': 0.06051478034264565, 'tp_mult': 1.2972200181937625, 'tsl_mult': 0.15744586661421628, 'strategy': 'mean_reversion', 'time_stop': 170, 'use_sma': False, 'use_atr': False, 'use_adx': False, 'use_ema': True, 'use_spike': False, 'rsi_required': False, 'edge_k': 0.9949696066995116, 'edge_cap': 0.7634210305420567, 'bull_strategy': 'breakout', 'bull_bb_std_mult': 2.4074419676236225, 'bull_rsi_os': 46, 'bull_rsi_ob': 86, 'bull_adx_thresh': 20.78047777667012, 'bull_atr_min_pct': 0.014870541361008174, 'bull_atr_max_pct': 0.09106006442013255, 'bull_tp_mult': 1.8252696576227956, 'bull_tsl_mult': 0.9433823999653401, 'bull_time_stop': 21, 'bull_use_sma': True, 'bull_use_ema': False, 'bull_use_atr': True, 'bull_use_adx': False, 'bull_use_spike': True, 'bull_rsi_required': False, 'bear_strategy': 'breakout', 'bear_bb_std_mult': 2.8433537370704864, 'bear_rsi_os': 41, 'bear_rsi_ob': 67, 'bear_adx_thresh': 22.080200936039887, 'bear_atr_min_pct': 0.0049090547832655144, 'bear_atr_max_pct': 0.0514824228913484, 'bear_tp_mult': 2.7644610930854325, 'bear_tsl_mult': 0.2915696179988345, 'bear_time_stop': 125, 'bear_use_sma': False, 'bear_use_ema': True, 'bear_use_atr': False, 'bear_use_adx': True, 'bear_use_spike': False, 'bear_rsi_required': False, 'sideways_strategy': 'breakout', 'sideways_bb_std_mult': 1.4136992790301277, 'sideways_rsi_os': 44, 'sideways_rsi_ob': 78, 'sideways_adx_thresh': 32.23578910966284, 'sideways_atr_min_pct': 0.0037252632312829376, 'sideways_atr_max_pct': 0.1347436827398154, 'sideways_tp_mult': 1.047983691474585, 'sideways_tsl_mult': 0.3242846074830297, 'sideways_time_stop': 175, 'sideways_use_sma': False, 'sideways_use_ema': False, 'sideways_use_atr': False, 'sideways_use_adx': False, 'sideways_use_spike': False, 'sideways_rsi_required': False}.
[I 2025-08-29 20:32:08,775] Trial 472 finished with values: [-0.0019260714541438073, 0.002009728738322263] and parameters: {'p_sma': 17, 'p_std': 54, 'p_atr': 24, 'p_adx': 13, 'rsi_period': 40, 'ema1': 24, 'ema2': 44, 'slip_atr_k': 0.01741646809051565, 'slip_spread_k': 0.1541244442300959, 'spread_hl_frac': 0.04901053454116256, 'bb_std_mult': 2.9905492939780562, 'rsi_os': 9, 'rsi_ob': 90, 'vol_spike': 0.2105317730331135, 'adx_thresh': 20.90527245449596, 'atr_min_pct': 0.028865066595710254, 'atr_max_pct': 0.06990279124014617, 'tp_mult': 1.3020830676556128, 'tsl_mult': 0.9137940343164572, 'strategy': 'mean_reversion', 'time_stop': 170, 'use_sma': True, 'use_atr': False, 'use_adx': False, 'use_ema': True, 'use_spike': True, 'rsi_required': False, 'edge_k': 1.7117307773730117, 'edge_cap': 0.7691180601350613, 'bull_strategy': 'breakout', 'bull_bb_std_mult': 1.8183914591045955, 'bull_rsi_os': 21, 'bull_rsi_ob': 71, 'bull_adx_thresh': 13.494228181244843, 'bull_atr_min_pct': 0.01653624679920509, 'bull_atr_max_pct': 0.09492916329752728, 'bull_tp_mult': 2.6017971690631914, 'bull_tsl_mult': 0.8873497872839433, 'bull_time_stop': 12, 'bull_use_sma': True, 'bull_use_ema': False, 'bull_use_atr': True, 'bull_use_adx': False, 'bull_use_spike': True, 'bull_rsi_required': False, 'bear_strategy': 'breakout', 'bear_bb_std_mult': 2.8918024425365987, 'bear_rsi_os': 27, 'bear_rsi_ob': 67, 'bear_adx_thresh': 22.04390524954033, 'bear_atr_min_pct': 0.02047585045607551, 'bear_atr_max_pct': 0.050969982882520054, 'bear_tp_mult': 2.5675587942046203, 'bear_tsl_mult': 0.906515597384799, 'bear_time_stop': 124, 'bear_use_sma': False, 'bear_use_ema': True, 'bear_use_atr': False, 'bear_use_adx': True, 'bear_use_spike': True, 'bear_rsi_required': False, 'sideways_strategy': 'breakout', 'sideways_bb_std_mult': 2.8354732265670237, 'sideways_rsi_os': 44, 'sideways_rsi_ob': 86, 'sideways_adx_thresh': 32.283900003793704, 'sideways_atr_min_pct': 0.0037532847374710508, 'sideways_atr_max_pct': 0.02527052077825634, 'sideways_tp_mult': 1.046018962125443, 'sideways_tsl_mult': 0.7688945722145113, 'sideways_time_stop': 173, 'sideways_use_sma': False, 'sideways_use_ema': False, 'sideways_use_atr': False, 'sideways_use_adx': False, 'sideways_use_spike': False, 'sideways_rsi_required': False}.
[I 2025-08-29 20:32:09,007] Trial 471 finished with values: [-1000000000.0, 1000000000.0] and parameters: {'p_sma': 17, 'p_std': 35, 'p_atr': 9, 'p_adx': 8, 'rsi_period': 43, 'ema1': 28, 'ema2': 44, 'slip_atr_k': 0.016578736247153086, 'slip_spread_k': 0.9767681241613329, 'spread_hl_frac': 0.049029763481063145, 'bb_std_mult': 3.4652186499265447, 'rsi_os': 9, 'rsi_ob': 81, 'vol_spike': 0.1814398821099992, 'adx_thresh': 20.29328193514917, 'atr_min_pct': 0.021022671264553962, 'atr_max_pct': 0.057815791656515285, 'tp_mult': 1.5271499195747094, 'tsl_mult': 0.9057733201852958, 'strategy': 'mean_reversion', 'time_stop': 141, 'use_sma': True, 'use_atr': False, 'use_adx': False, 'use_ema': True, 'use_spike': True, 'rsi_required': False, 'edge_k': 1.5621127517079205, 'edge_cap': 0.7609779762743212, 'bull_strategy': 'mean_reversion', 'bull_bb_std_mult': 3.0390475206808767, 'bull_rsi_os': 21, 'bull_rsi_ob': 75, 'bull_adx_thresh': 7.856247271484843, 'bull_atr_min_pct': 0.01564163264353943, 'bull_atr_max_pct': 0.010330286173500847, 'bull_tp_mult': 2.6776355630755027, 'bull_tsl_mult': 0.03529924128878387, 'bull_time_stop': 97, 'bull_use_sma': True, 'bull_use_ema': False, 'bull_use_atr': True, 'bull_use_adx': False, 'bull_use_spike': True, 'bull_rsi_required': False, 'bear_strategy': 'mean_reversion', 'bear_bb_std_mult': 2.6494263310613944, 'bear_rsi_os': 27, 'bear_rsi_ob': 76, 'bear_adx_thresh': 21.903909537395236, 'bear_atr_min_pct': 0.018486405255843705, 'bear_atr_max_pct': 0.05154603276621202, 'bear_tp_mult': 2.723398823217073, 'bear_tsl_mult': 0.28289772959840975, 'bear_time_stop': 52, 'bear_use_sma': False, 'bear_use_ema': True, 'bear_use_atr': False, 'bear_use_adx': True, 'bear_use_spike': True, 'bear_rsi_required': False, 'sideways_strategy': 'breakout', 'sideways_bb_std_mult': 1.1241786866042478, 'sideways_rsi_os': 45, 'sideways_rsi_ob': 45, 'sideways_adx_thresh': 25.682952556584297, 'sideways_atr_min_pct': 0.022459461706393333, 'sideways_atr_max_pct': 0.01405280435246819, 'sideways_tp_mult': 1.14615753896428, 'sideways_tsl_mult': 0.0589837766300641, 'sideways_time_stop': 174, 'sideways_use_sma': False, 'sideways_use_ema': False, 'sideways_use_atr': False, 'sideways_use_adx': False, 'sideways_use_spike': False, 'sideways_rsi_required': False}.
[I 2025-08-29 20:32:39,205] Trial 476 finished with values: [-1000000000.0, 1000000000.0] and parameters: {'p_sma': 6, 'p_std': 56, 'p_atr': 26, 'p_adx': 13, 'rsi_period': 36, 'ema1': 23, 'ema2': 48, 'slip_atr_k': 0.005685060223097556, 'slip_spread_k': 0.2033352835392396, 'spread_hl_frac': 0.047430334126079624, 'bb_std_mult': 0.502351200890484, 'rsi_os': 15, 'rsi_ob': 84, 'vol_spike': 0.1928884415976311, 'adx_thresh': 5.093784096062503, 'atr_min_pct': 0.01858609979225754, 'atr_max_pct': 0.05794294296313496, 'tp_mult': 1.5365382097048064, 'tsl_mult': 0.8691116561265568, 'strategy': 'mean_reversion', 'time_stop': 158, 'use_sma': True, 'use_atr': False, 'use_adx': False, 'use_ema': True, 'use_spike': False, 'rsi_required': False, 'edge_k': 1.023429906049492, 'edge_cap': 0.6363634846728703, 'bull_strategy': 'mean_reversion', 'bull_bb_std_mult': 3.006410253663929, 'bull_rsi_os': 48, 'bull_rsi_ob': 73, 'bull_adx_thresh': 10.215127812908792, 'bull_atr_min_pct': 0.015515064865836713, 'bull_atr_max_pct': 0.09432022126609857, 'bull_tp_mult': 2.845102910334463, 'bull_tsl_mult': 0.033625589788754184, 'bull_time_stop': 32, 'bull_use_sma': True, 'bull_use_ema': False, 'bull_use_atr': True, 'bull_use_adx': False, 'bull_use_spike': True, 'bull_rsi_required': False, 'bear_strategy': 'breakout', 'bear_bb_std_mult': 2.6446009989381207, 'bear_rsi_os': 23, 'bear_rsi_ob': 66, 'bear_adx_thresh': 20.76986767672736, 'bear_atr_min_pct': 0.023338280472717614, 'bear_atr_max_pct': 0.05582988086664063, 'bear_tp_mult': 2.6173082967715664, 'bear_tsl_mult': 0.7465282202256579, 'bear_time_stop': 55, 'bear_use_sma': True, 'bear_use_ema': True, 'bear_use_atr': False, 'bear_use_adx': True, 'bear_use_spike': True, 'bear_rsi_required': True, 'sideways_strategy': 'breakout', 'sideways_bb_std_mult': 2.2543082136602886, 'sideways_rsi_os': 47, 'sideways_rsi_ob': 59, 'sideways_adx_thresh': 32.918840383933436, 'sideways_atr_min_pct': 0.004209907771203999, 'sideways_atr_max_pct': 0.022580062592839893, 'sideways_tp_mult': 1.1413758772495404, 'sideways_tsl_mult': 0.9749787964815022, 'sideways_time_stop': 119, 'sideways_use_sma': True, 'sideways_use_ema': False, 'sideways_use_atr': False, 'sideways_use_adx': True, 'sideways_use_spike': False, 'sideways_rsi_required': False}.
[I 2025-08-29 20:32:39,338] Trial 477 finished with values: [-0.001269735209298628, 0.0013714102480293124] and parameters: {'p_sma': 22, 'p_std': 56, 'p_atr': 26, 'p_adx': 12, 'rsi_period': 36, 'ema1': 16, 'ema2': 48, 'slip_atr_k': 0.004639033382014946, 'slip_spread_k': 0.9451567916953616, 'spread_hl_frac': 0.029313552832228678, 'bb_std_mult': 1.7154142430132189, 'rsi_os': 25, 'rsi_ob': 61, 'vol_spike': 0.19336694805499235, 'adx_thresh': 17.30425545137246, 'atr_min_pct': 0.007262117165607735, 'atr_max_pct': 0.07684965394333101, 'tp_mult': 1.4710393504792894, 'tsl_mult': 0.8672916517765885, 'strategy': 'mean_reversion', 'time_stop': 161, 'use_sma': False, 'use_atr': False, 'use_adx': False, 'use_ema': True, 'use_spike': False, 'rsi_required': False, 'edge_k': 1.044475798218488, 'edge_cap': 0.33121966893709465, 'bull_strategy': 'mean_reversion', 'bull_bb_std_mult': 3.1228381748776144, 'bull_rsi_os': 29, 'bull_rsi_ob': 73, 'bull_adx_thresh': 12.744575593283301, 'bull_atr_min_pct': 0.017995077864166258, 'bull_atr_max_pct': 0.1322384696870422, 'bull_tp_mult': 2.5042938255359646, 'bull_tsl_mult': 0.8899531747284225, 'bull_time_stop': 30, 'bull_use_sma': False, 'bull_use_ema': False, 'bull_use_atr': True, 'bull_use_adx': False, 'bull_use_spike': True, 'bull_rsi_required': False, 'bear_strategy': 'breakout', 'bear_bb_std_mult': 2.5748224307046192, 'bear_rsi_os': 29, 'bear_rsi_ob': 66, 'bear_adx_thresh': 18.232875735162974, 'bear_atr_min_pct': 0.0177628876982817, 'bear_atr_max_pct': 0.046162600390252, 'bear_tp_mult': 1.3336288823679674, 'bear_tsl_mult': 0.9499246184366634, 'bear_time_stop': 104, 'bear_use_sma': True, 'bear_use_ema': False, 'bear_use_atr': False, 'bear_use_adx': True, 'bear_use_spike': False, 'bear_rsi_required': True, 'sideways_strategy': 'breakout', 'sideways_bb_std_mult': 2.263716109624901, 'sideways_rsi_os': 47, 'sideways_rsi_ob': 59, 'sideways_adx_thresh': 32.84494253608138, 'sideways_atr_min_pct': 0.004156371343895701, 'sideways_atr_max_pct': 0.023205457013754774, 'sideways_tp_mult': 2.994047338927749, 'sideways_tsl_mult': 0.43342394767562, 'sideways_time_stop': 202, 'sideways_use_sma': True, 'sideways_use_ema': False, 'sideways_use_atr': False, 'sideways_use_adx': True, 'sideways_use_spike': False, 'sideways_rsi_required': False}.
[I 2025-08-29 20:32:39,575] Trial 474 finished with values: [-0.0005426159598141966, 0.0017818338401534013] and parameters: {'p_sma': 22, 'p_std': 42, 'p_atr': 26, 'p_adx': 8, 'rsi_period': 28, 'ema1': 24, 'ema2': 44, 'slip_atr_k': 1.25067508163284e-05, 'slip_spread_k': 0.9838547728446545, 'spread_hl_frac': 0.04606590229826008, 'bb_std_mult': 2.115172678384668, 'rsi_os': 9, 'rsi_ob': 61, 'vol_spike': 0.18026943942490464, 'adx_thresh': 5.049008880222132, 'atr_min_pct': 0.01707440916581132, 'atr_max_pct': 0.05850073270848745, 'tp_mult': 1.3070322150952194, 'tsl_mult': 0.915217561956339, 'strategy': 'mean_reversion', 'time_stop': 171, 'use_sma': False, 'use_atr': False, 'use_adx': False, 'use_ema': True, 'use_spike': False, 'rsi_required': False, 'edge_k': 0.982573766819557, 'edge_cap': 0.6379139054103593, 'bull_strategy': 'breakout', 'bull_bb_std_mult': 2.8204713811227746, 'bull_rsi_os': 29, 'bull_rsi_ob': 71, 'bull_adx_thresh': 29.888342425240985, 'bull_atr_min_pct': 0.014468047861256784, 'bull_atr_max_pct': 0.09452855310438117, 'bull_tp_mult': 2.5873509320900414, 'bull_tsl_mult': 0.9515935002749402, 'bull_time_stop': 22, 'bull_use_sma': True, 'bull_use_ema': False, 'bull_use_atr': True, 'bull_use_adx': False, 'bull_use_spike': True, 'bull_rsi_required': False, 'bear_strategy': 'breakout', 'bear_bb_std_mult': 2.8514916147486478, 'bear_rsi_os': 29, 'bear_rsi_ob': 67, 'bear_adx_thresh': 29.851451185021276, 'bear_atr_min_pct': 0.00499038476560356, 'bear_atr_max_pct': 0.0502685003451941, 'bear_tp_mult': 1.7129535287955624, 'bear_tsl_mult': 0.745147892864257, 'bear_time_stop': 247, 'bear_use_sma': True, 'bear_use_ema': True, 'bear_use_atr': False, 'bear_use_adx': True, 'bear_use_spike': False, 'bear_rsi_required': False, 'sideways_strategy': 'breakout', 'sideways_bb_std_mult': 1.1060485682467789, 'sideways_rsi_os': 24, 'sideways_rsi_ob': 86, 'sideways_adx_thresh': 13.692772114588587, 'sideways_atr_min_pct': 0.0038610377129512773, 'sideways_atr_max_pct': 0.08467551847371696, 'sideways_tp_mult': 1.0437475748046963, 'sideways_tsl_mult': 0.057250651483768844, 'sideways_time_stop': 198, 'sideways_use_sma': False, 'sideways_use_ema': False, 'sideways_use_atr': False, 'sideways_use_adx': True, 'sideways_use_spike': False, 'sideways_rsi_required': False}.
