[I 2025-08-29 20:30:05,922] Trial 448 finished with values: [-0.00684010722044337, 0.006813134310556435] and parameters: {'p_sma': 21, 'p_std': 57, 'p_atr': 25, 'p_adx': 7, 'rsi_period': 41, 'ema1': 29, 'ema2': 26, 'slip_atr_k': 0.005355513727722426, 'slip_spread_k': 0.17328720866554115, 'spread_hl_frac': 0.0436676450025487, 'bb_std_mult': 2.327251472713667, 'rsi_os': 8, 'rsi_ob': 83, 'vol_spike': 0.1975488338629545, 'adx_thresh': 11.642984267627794, 'atr_min_pct': 0.004540706891999244, 'atr_max_pct': 0.029369670567563656, 'tp_mult': 1.270060009743553, 'tsl_mult': 0.9105038900462101, 'strategy': 'mean_reversion', 'time_stop': 168, 'use_sma': True, 'use_atr': False, 'use_adx': False, 'use_ema': True, 'use_spike': False, 'rsi_required': False, 'edge_k': 1.015389302847928, 'edge_cap': 0.7432813595657314, 'bull_strategy': 'mean_reversion', 'bull_bb_std_mult': 2.3155757980014178, 'bull_rsi_os': 27, 'bull_rsi_ob': 75, 'bull_adx_thresh': 13.451110754006677, 'bull_atr_min_pct': 0.016452732801418436, 'bull_atr_max_pct': 0.09339521212501702, 'bull_tp_mult': 1.677762016386287, 'bull_tsl_mult': 0.8357746904317226, 'bull_time_stop': 27, 'bull_use_sma': True, 'bull_use_ema': False, 'bull_use_atr': True, 'bull_use_adx': False, 'bull_use_spike': True, 'bull_rsi_required': False, 'bear_strategy': 'mean_reversion', 'bear_bb_std_mult': 0.8338592434696375, 'bear_rsi_os': 21, 'bear_rsi_ob': 63, 'bear_adx_thresh': 21.66670525022414, 'bear_atr_min_pct': 0.0070385487973474645, 'bear_atr_max_pct': 0.05082952993984095, 'bear_tp_mult': 2.7213435796865157, 'bear_tsl_mult': 0.9109628602386222, 'bear_time_stop': 273, 'bear_use_sma': False, 'bear_use_ema': True, 'bear_use_atr': False, 'bear_use_adx': True, 'bear_use_spike': True, 'bear_rsi_required': False, 'sideways_strategy': 'breakout', 'sideways_bb_std_mult': 2.36647686105181, 'sideways_rsi_os': 46, 'sideways_rsi_ob': 77, 'sideways_adx_thresh': 9.03132678631482, 'sideways_atr_min_pct': 0.0029558999533053996, 'sideways_atr_max_pct': 0.019046980319687046, 'sideways_tp_mult': 1.4698916240744624, 'sideways_tsl_mult': 0.8312133550723357, 'sideways_time_stop': 165, 'sideways_use_sma': False, 'sideways_use_ema': False, 'sideways_use_atr': False, 'sideways_use_adx': False, 'sideways_use_spike': False, 'sideways_rsi_required': False}.
[I 2025-08-29 20:30:06,625] Trial 454 finished with values: [-1000000000.0, 1000000000.0] and parameters: {'p_sma': 19, 'p_std': 58, 'p_atr': 26, 'p_adx': 12, 'rsi_period': 38, 'ema1': 28, 'ema2': 46, 'slip_atr_k': 0.08429770124245035, 'slip_spread_k': 0.455937676459444, 'spread_hl_frac': 0.047789318198112496, 'bb_std_mult': 1.6007223221532798, 'rsi_os': 55, 'rsi_ob': 84, 'vol_spike': 0.09198799452031067, 'adx_thresh': 26.491945207444342, 'atr_min_pct': 0.020583415812995994, 'atr_max_pct': 0.1285429541604054, 'tp_mult': 2.8060923709233805, 'tsl_mult': 0.872098810633991, 'strategy': 'mean_reversion', 'time_stop': 78, 'use_sma': True, 'use_atr': False, 'use_adx': False, 'use_ema': True, 'use_spike': True, 'rsi_required': False, 'edge_k': 1.8769477344052845, 'edge_cap': 0.8858565905791048, 'bull_strategy': 'mean_reversion', 'bull_bb_std_mult': 3.3724528799591846, 'bull_rsi_os': 21, 'bull_rsi_ob': 62, 'bull_adx_thresh': 13.335094215496223, 'bull_atr_min_pct': 0.015228242653284664, 'bull_atr_max_pct': 0.09742723159881142, 'bull_tp_mult': 2.6517249304409414, 'bull_tsl_mult': 0.8943072060281044, 'bull_time_stop': 38, 'bull_use_sma': False, 'bull_use_ema': False, 'bull_use_atr': True, 'bull_use_adx': False, 'bull_use_spike': True, 'bull_rsi_required': False, 'bear_strategy': 'breakout', 'bear_bb_std_mult': 2.583107460771671, 'bear_rsi_os': 29, 'bear_rsi_ob': 56, 'bear_adx_thresh': 20.631774562056652, 'bear_atr_min_pct': 0.019691094619116854, 'bear_atr_max_pct': 0.046022645322709436, 'bear_tp_mult': 1.6370833057583543, 'bear_tsl_mult': 0.7902064995438312, 'bear_time_stop': 116, 'bear_use_sma': False, 'bear_use_ema': False, 'bear_use_atr': False, 'bear_use_adx': True, 'bear_use_spike': True, 'bear_rsi_required': False, 'sideways_strategy': 'breakout', 'sideways_bb_std_mult': 2.110280453195965, 'sideways_rsi_os': 22, 'sideways_rsi_ob': 46, 'sideways_adx_thresh': 33.514771706371825, 'sideways_atr_min_pct': 0.003651578564568118, 'sideways_atr_max_pct': 0.03700190283139669, 'sideways_tp_mult': 2.2978115594910298, 'sideways_tsl_mult': 0.7151121836038158, 'sideways_time_stop': 202, 'sideways_use_sma': False, 'sideways_use_ema': False, 'sideways_use_atr': False, 'sideways_use_adx': False, 'sideways_use_spike': False, 'sideways_rsi_required': False}.
[I 2025-08-29 20:30:33,844] Trial 451 finished with values: [-1000000000.0, 1000000000.0] and parameters: {'p_sma': 21, 'p_std': 57, 'p_atr': 26, 'p_adx': 14, 'rsi_period': 38, 'ema1': 22, 'ema2': 35, 'slip_atr_k': 0.01264282467861598, 'slip_spread_k': 0.18601403944928782, 'spread_hl_frac': 0.04676467661736643, 'bb_std_mult': 1.7434819014537783, 'rsi_os': 10, 'rsi_ob': 84, 'vol_spike': 0.1790197063406601, 'adx_thresh': 11.417489470052914, 'atr_min_pct': 0.020489436928236248, 'atr_max_pct': 0.03139340604982011, 'tp_mult': 1.3295964628696684, 'tsl_mult': 0.336237320357316, 'strategy': 'mean_reversion', 'time_stop': 170, 'use_sma': True, 'use_atr': False, 'use_adx': False, 'use_ema': True, 'use_spike': False, 'rsi_required': False, 'edge_k': 1.0750488800809008, 'edge_cap': 0.8222029278288969, 'bull_strategy': 'breakout', 'bull_bb_std_mult': 2.945469300468058, 'bull_rsi_os': 27, 'bull_rsi_ob': 73, 'bull_adx_thresh': 12.128082033311932, 'bull_atr_min_pct': 0.016404596334661844, 'bull_atr_max_pct': 0.09269026313511207, 'bull_tp_mult': 2.6507799526922198, 'bull_tsl_mult': 0.9018002361811112, 'bull_time_stop': 141, 'bull_use_sma': False, 'bull_use_ema': False, 'bull_use_atr': True, 'bull_use_adx': False, 'bull_use_spike': True, 'bull_rsi_required': False, 'bear_strategy': 'mean_reversion', 'bear_bb_std_mult': 3.3362705328631446, 'bear_rsi_os': 26, 'bear_rsi_ob': 45, 'bear_adx_thresh': 21.528484937709553, 'bear_atr_min_pct': 0.022703434757018682, 'bear_atr_max_pct': 0.04635175214739292, 'bear_tp_mult': 2.6344015478267706, 'bear_tsl_mult': 0.9124579276780014, 'bear_time_stop': 69, 'bear_use_sma': False, 'bear_use_ema': False, 'bear_use_atr': False, 'bear_use_adx': True, 'bear_use_spike': True, 'bear_rsi_required': False, 'sideways_strategy': 'breakout', 'sideways_bb_std_mult': 0.9889558673603493, 'sideways_rsi_os': 46, 'sideways_rsi_ob': 77, 'sideways_adx_thresh': 31.756304540752165, 'sideways_atr_min_pct': 0.00436726443355146, 'sideways_atr_max_pct': 0.03475735494674488, 'sideways_tp_mult': 2.9102214161903395, 'sideways_tsl_mult': 0.8249623081033602, 'sideways_time_stop': 202, 'sideways_use_sma': False, 'sideways_use_ema': False, 'sideways_use_atr': False, 'sideways_use_adx': False, 'sideways_use_spike': False, 'sideways_rsi_required': False}.
[I 2025-08-29 20:30:34,697] Trial 452 finished with values: [-1000000000.0, 0.1388538255013371] and parameters: {'p_sma': 19, 'p_std': 58, 'p_atr': 7, 'p_adx': 14, 'rsi_period': 41, 'ema1': 28, 'ema2': 48, 'slip_atr_k': 0.2184559092273069, 'slip_spread_k': 0.9107107124646999, 'spread_hl_frac': 0.049992986137676255, 'bb_std_mult': 2.318363147083049, 'rsi_os': 39, 'rsi_ob': 51, 'vol_spike': 0.09207680553913938, 'adx_thresh': 11.29505496737954, 'atr_min_pct': 0.020487222256268502, 'atr_max_pct': 0.14804119528028908, 'tp_mult': 1.328922178197485, 'tsl_mult': 0.9179318411221025, 'strategy': 'mean_reversion', 'time_stop': 248, 'use_sma': True, 'use_atr': False, 'use_adx': False, 'use_ema': True, 'use_spike': False, 'rsi_required': False, 'edge_k': 0.9578288482840421, 'edge_cap': 0.8267535168624565, 'bull_strategy': 'mean_reversion', 'bull_bb_std_mult': 2.9440977052727253, 'bull_rsi_os': 12, 'bull_rsi_ob': 72, 'bull_adx_thresh': 12.173192650397262, 'bull_atr_min_pct': 0.01523682568511987, 'bull_atr_max_pct': 0.13534557939489156, 'bull_tp_mult': 2.639599558484257, 'bull_tsl_mult': 0.8927157785602577, 'bull_time_stop': 40, 'bull_use_sma': False, 'bull_use_ema': False, 'bull_use_atr': True, 'bull_use_adx': False, 'bull_use_spike': True, 'bull_rsi_required': False, 'bear_strategy': 'mean_reversion', 'bear_bb_std_mult': 2.1290120778822277, 'bear_rsi_os': 26, 'bear_rsi_ob': 57, 'bear_adx_thresh': 20.655789926475624, 'bear_atr_min_pct': 0.02663395222138054, 'bear_atr_max_pct': 0.04670801885515144, 'bear_tp_mult': 2.6672879061780135, 'bear_tsl_mult': 0.25576232330494175, 'bear_time_stop': 38, 'bear_use_sma': False, 'bear_use_ema': False, 'bear_use_atr': False, 'bear_use_adx': True, 'bear_use_spike': True, 'bear_rsi_required': False, 'sideways_strategy': 'breakout', 'sideways_bb_std_mult': 0.9886942062469599, 'sideways_rsi_os': 46, 'sideways_rsi_ob': 76, 'sideways_adx_thresh': 31.867453771571594, 'sideways_atr_min_pct': 0.0002962016589815944, 'sideways_atr_max_pct': 0.03533388237596731, 'sideways_tp_mult': 1.0109801566757408, 'sideways_tsl_mult': 0.8326418028619978, 'sideways_time_stop': 206, 'sideways_use_sma': False, 'sideways_use_ema': False, 'sideways_use_atr': False, 'sideways_use_adx': False, 'sideways_use_spike': False, 'sideways_rsi_required': False}.
[I 2025-08-29 20:30:35,043] Trial 453 finished with values: [-1000000000.0, 1000000000.0] and parameters: {'p_sma': 19, 'p_std': 57, 'p_atr': 26, 'p_adx': 22, 'rsi_period': 42, 'ema1': 30, 'ema2': 46, 'slip_atr_k': 0.2243674834272791, 'slip_spread_k': 0.45962801876559717, 'spread_hl_frac': 0.038976270673863216, 'bb_std_mult': 1.6177187533149822, 'rsi_os': 27, 'rsi_ob': 84, 'vol_spike': 0.19960941257559017, 'adx_thresh': 7.200884113288762, 'atr_min_pct': 0.02060956529043929, 'atr_max_pct': 0.1472140218728678, 'tp_mult': 2.195034196367284, 'tsl_mult': 0.8737328113398707, 'strategy': 'mean_reversion', 'time_stop': 210, 'use_sma': True, 'use_atr': False, 'use_adx': False, 'use_ema': True, 'use_spike': True, 'rsi_required': False, 'edge_k': 0.9471959918887991, 'edge_cap': 0.978772127836504, 'bull_strategy': 'mean_reversion', 'bull_bb_std_mult': 2.3321862747983992, 'bull_rsi_os': 5, 'bull_rsi_ob': 72, 'bull_adx_thresh': 13.235129152133648, 'bull_atr_min_pct': 0.015226566795343984, 'bull_atr_max_pct': 0.08965365416509422, 'bull_tp_mult': 2.6405999316884494, 'bull_tsl_mult': 0.7722279996385165, 'bull_time_stop': 18, 'bull_use_sma': True, 'bull_use_ema': False, 'bull_use_atr': True, 'bull_use_adx': False, 'bull_use_spike': True, 'bull_rsi_required': False, 'bear_strategy': 'breakout', 'bear_bb_std_mult': 3.3797052588085035, 'bear_rsi_os': 10, 'bear_rsi_ob': 57, 'bear_adx_thresh': 21.70940747908698, 'bear_atr_min_pct': 0.006297953533363288, 'bear_atr_max_pct': 0.0443351273255314, 'bear_tp_mult': 2.7323786796595093, 'bear_tsl_mult': 0.25653755891289687, 'bear_time_stop': 219, 'bear_use_sma': False, 'bear_use_ema': True, 'bear_use_atr': False, 'bear_use_adx': True, 'bear_use_spike': True, 'bear_rsi_required': False, 'sideways_strategy': 'breakout', 'sideways_bb_std_mult': 2.5525203191627015, 'sideways_rsi_os': 46, 'sideways_rsi_ob': 76, 'sideways_adx_thresh': 31.83629039723321, 'sideways_atr_min_pct': 0.004897702000895048, 'sideways_atr_max_pct': 0.010071594460252643, 'sideways_tp_mult': 1.3913879439440788, 'sideways_tsl_mult': 0.827054600984855, 'sideways_time_stop': 202, 'sideways_use_sma': False, 'sideways_use_ema': False, 'sideways_use_atr': False, 'sideways_use_adx': False, 'sideways_use_spike': False, 'sideways_rsi_required': False}.
[I 2025-08-29 20:30:35,878] Trial 455 finished with values: [-1000000000.0, 1000000000.0] and parameters: {'p_sma': 19, 'p_std': 28, 'p_atr': 21, 'p_adx': 23, 'rsi_period': 34, 'ema1': 16, 'ema2': 17, 'slip_atr_k': 0.062459586417108456, 'slip_spread_k': 0.91780661773101, 'spread_hl_frac': 0.01155211873216741, 'bb_std_mult': 1.7167715831784758, 'rsi_os': 10, 'rsi_ob': 57, 'vol_spike': 0.14908707263982882, 'adx_thresh': 14.441241571944229, 'atr_min_pct': 0.01921796400391257, 'atr_max_pct': 0.03287740388144281, 'tp_mult': 2.8850686424915053, 'tsl_mult': 0.9043824396569091, 'strategy': 'mean_reversion', 'time_stop': 163, 'use_sma': True, 'use_atr': False, 'use_adx': False, 'use_ema': True, 'use_spike': False, 'rsi_required': False, 'edge_k': 0.45789737836636213, 'edge_cap': 0.8266065850121198, 'bull_strategy': 'mean_reversion', 'bull_bb_std_mult': 2.970240561625848, 'bull_rsi_os': 52, 'bull_rsi_ob': 72, 'bull_adx_thresh': 5.949791879369208, 'bull_atr_min_pct': 0.01746354256977904, 'bull_atr_max_pct': 0.09006381514829334, 'bull_tp_mult': 2.099622601019074, 'bull_tsl_mult': 0.8963598158340098, 'bull_time_stop': 39, 'bull_use_sma': True, 'bull_use_ema': False, 'bull_use_atr': True, 'bull_use_adx': False, 'bull_use_spike': True, 'bull_rsi_required': False, 'bear_strategy': 'breakout', 'bear_bb_std_mult': 2.7114980830550386, 'bear_rsi_os': 27, 'bear_rsi_ob': 59, 'bear_adx_thresh': 22.292878637111606, 'bear_atr_min_pct': 0.006403012838108061, 'bear_atr_max_pct': 0.04467211975984882, 'bear_tp_mult': 2.32879846558353, 'bear_tsl_mult': 0.10434381959331274, 'bear_time_stop': 64, 'bear_use_sma': True, 'bear_use_ema': True, 'bear_use_atr': False, 'bear_use_adx': True, 'bear_use_spike': True, 'bear_rsi_required': False, 'sideways_strategy': 'breakout', 'sideways_bb_std_mult': 2.189336121729299, 'sideways_rsi_os': 26, 'sideways_rsi_ob': 76, 'sideways_adx_thresh': 6.821678891466657, 'sideways_atr_min_pct': 0.008224968494932056, 'sideways_atr_max_pct': 0.09900037593979924, 'sideways_tp_mult': 1.0359243669363747, 'sideways_tsl_mult': 0.10490957165337766, 'sideways_time_stop': 210, 'sideways_use_sma': False, 'sideways_use_ema': False, 'sideways_use_atr': False, 'sideways_use_adx': True, 'sideways_use_spike': False, 'sideways_rsi_required': False}.
[I 2025-08-29 20:31:05,928] Trial 456 finished with values: [-0.00315890259819096, 0.004612957947516082] and parameters: {'p_sma': 19, 'p_std': 56, 'p_atr': 13, 'p_adx': 23, 'rsi_period': 81, 'ema1': 30, 'ema2': 15, 'slip_atr_k': 0.00504914834411117, 'slip_spread_k': 0.12414312570799801, 'spread_hl_frac': 0.036584727916979455, 'bb_std_mult': 1.667831758825565, 'rsi_os': 48, 'rsi_ob': 59, 'vol_spike': 0.18735926599938985, 'adx_thresh': 14.546243380335397, 'atr_min_pct': 0.021184243286938034, 'atr_max_pct': 0.034954814254329655, 'tp_mult': 1.4878286865680557, 'tsl_mult': 0.3781406282946293, 'strategy': 'mean_reversion', 'time_stop': 164, 'use_sma': True, 'use_atr': False, 'use_adx': False, 'use_ema': True, 'use_spike': True, 'rsi_required': False, 'edge_k': 0.8761663642222978, 'edge_cap': 0.22033405345322277, 'bull_strategy': 'mean_reversion', 'bull_bb_std_mult': 2.987471075655436, 'bull_rsi_os': 5, 'bull_rsi_ob': 55, 'bull_adx_thresh': 13.605209542028078, 'bull_atr_min_pct': 0.015569712758306972, 'bull_atr_max_pct': 0.14240315773223583, 'bull_tp_mult': 2.7014957899283782, 'bull_tsl_mult': 0.957598129652309, 'bull_time_stop': 237, 'bull_use_sma': True, 'bull_use_ema': False, 'bull_use_atr': True, 'bull_use_adx': False, 'bull_use_spike': True, 'bull_rsi_required': False, 'bear_strategy': 'breakout', 'bear_bb_std_mult': 2.1305949825186814, 'bear_rsi_os': 47, 'bear_rsi_ob': 59, 'bear_adx_thresh': 9.820431059126857, 'bear_atr_min_pct': 0.004621938850226208, 'bear_atr_max_pct': 0.044654080616538715, 'bear_tp_mult': 2.3183711598138883, 'bear_tsl_mult': 0.9231139451482572, 'bear_time_stop': 40, 'bear_use_sma': True, 'bear_use_ema': True, 'bear_use_atr': False, 'bear_use_adx': True, 'bear_use_spike': True, 'bear_rsi_required': False, 'sideways_strategy': 'breakout', 'sideways_bb_std_mult': 2.2084774518564814, 'sideways_rsi_os': 42, 'sideways_rsi_ob': 79, 'sideways_adx_thresh': 32.521834014812256, 'sideways_atr_min_pct': 0.01009778388418111, 'sideways_atr_max_pct': 0.1423293602441962, 'sideways_tp_mult': 1.0437955173508646, 'sideways_tsl_mult': 0.01753029810280382, 'sideways_time_stop': 211, 'sideways_use_sma': True, 'sideways_use_ema': False, 'sideways_use_atr': False, 'sideways_use_adx': True, 'sideways_use_spike': False, 'sideways_rsi_required': False}.
[I 2025-08-29 20:31:06,239] Trial 458 finished with values: [-1000000000.0, 1000000000.0] and parameters: {'p_sma': 57, 'p_std': 27, 'p_atr': 25, 'p_adx': 23, 'rsi_period': 82, 'ema1': 27, 'ema2': 45, 'slip_atr_k': 0.00018238693353770914, 'slip_spread_k': 0.1238514564887967, 'spread_hl_frac': 0.049100446414537084, 'bb_std_mult': 1.7074927554658974, 'rsi_os': 13, 'rsi_ob': 57, 'vol_spike': 0.14832388765347673, 'adx_thresh': 14.258035426063733, 'atr_min_pct': 0.019255532357877195, 'atr_max_pct': 0.032669602017948635, 'tp_mult': 1.5028801162987695, 'tsl_mult': 0.23851208518163686, 'strategy': 'mean_reversion', 'time_stop': 164, 'use_sma': True, 'use_atr': False, 'use_adx': False, 'use_ema': True, 'use_spike': False, 'rsi_required': False, 'edge_k': 1.4461433686511966, 'edge_cap': 0.788374273945895, 'bull_strategy': 'mean_reversion', 'bull_bb_std_mult': 3.139165057615825, 'bull_rsi_os': 52, 'bull_rsi_ob': 55, 'bull_adx_thresh': 23.771998126022254, 'bull_atr_min_pct': 0.024951047675444343, 'bull_atr_max_pct': 0.09662832641182462, 'bull_tp_mult': 2.712543992409596, 'bull_tsl_mult': 0.6321297943282322, 'bull_time_stop': 31, 'bull_use_sma': True, 'bull_use_ema': False, 'bull_use_atr': True, 'bull_use_adx': False, 'bull_use_spike': True, 'bull_rsi_required': False, 'bear_strategy': 'breakout', 'bear_bb_std_mult': 2.710074628578898, 'bear_rsi_os': 30, 'bear_rsi_ob': 67, 'bear_adx_thresh': 22.57731379848922, 'bear_atr_min_pct': 0.004626461115064981, 'bear_atr_max_pct': 0.054124090897870625, 'bear_tp_mult': 2.3167730647158162, 'bear_tsl_mult': 0.10899700034657622, 'bear_time_stop': 194, 'bear_use_sma': True, 'bear_use_ema': True, 'bear_use_atr': False, 'bear_use_adx': True, 'bear_use_spike': True, 'bear_rsi_required': True, 'sideways_strategy': 'breakout', 'sideways_bb_std_mult': 2.2062510601579666, 'sideways_rsi_os': 41, 'sideways_rsi_ob': 65, 'sideways_adx_thresh': 22.231882321071556, 'sideways_atr_min_pct': 0.008060441668467665, 'sideways_atr_max_pct': 0.14354418190591428, 'sideways_tp_mult': 1.0584196724089616, 'sideways_tsl_mult': 0.9032975334457114, 'sideways_time_stop': 211, 'sideways_use_sma': True, 'sideways_use_ema': False, 'sideways_use_atr': False, 'sideways_use_adx': True, 'sideways_use_spike': False, 'sideways_rsi_required': False}.
[I 2025-08-29 20:31:06,572] Trial 457 finished with values: [-1000000000.0, 1000000000.0] and parameters: {'p_sma': 57, 'p_std': 8, 'p_atr': 25, 'p_adx': 12, 'rsi_period': 84, 'ema1': 25, 'ema2': 27, 'slip_atr_k': 0.15865388814452114, 'slip_spread_k': 0.12442278641670507, 'spread_hl_frac': 0.011426394847501723, 'bb_std_mult': 1.6641967302763752, 'rsi_os': 10, 'rsi_ob': 86, 'vol_spike': 0.12812204387824916, 'adx_thresh': 14.629351906444839, 'atr_min_pct': 0.01946232958174975, 'atr_max_pct': 0.03243586012944741, 'tp_mult': 2.2592267620092947, 'tsl_mult': 0.8943261537942174, 'strategy': 'mean_reversion', 'time_stop': 163, 'use_sma': True, 'use_atr': False, 'use_adx': False, 'use_ema': True, 'use_spike': True, 'rsi_required': False, 'edge_k': 1.1217874440807485, 'edge_cap': 0.7074621029288405, 'bull_strategy': 'mean_reversion', 'bull_bb_std_mult': 1.8847118119434323, 'bull_rsi_os': 12, 'bull_rsi_ob': 89, 'bull_adx_thresh': 14.323257829934601, 'bull_atr_min_pct': 0.017617624665004425, 'bull_atr_max_pct': 0.10195469156576949, 'bull_tp_mult': 2.2679355446395726, 'bull_tsl_mult': 0.7805329637524836, 'bull_time_stop': 19, 'bull_use_sma': True, 'bull_use_ema': False, 'bull_use_atr': True, 'bull_use_adx': False, 'bull_use_spike': True, 'bull_rsi_required': False, 'bear_strategy': 'breakout', 'bear_bb_std_mult': 2.7056258867906156, 'bear_rsi_os': 28, 'bear_rsi_ob': 67, 'bear_adx_thresh': 9.490567573565395, 'bear_atr_min_pct': 2.243816230989952e-05, 'bear_atr_max_pct': 0.05265250016912568, 'bear_tp_mult': 2.576117139216534, 'bear_tsl_mult': 0.8877724837463238, 'bear_time_stop': 64, 'bear_use_sma': True, 'bear_use_ema': True, 'bear_use_atr': False, 'bear_use_adx': True, 'bear_use_spike': True, 'bear_rsi_required': True, 'sideways_strategy': 'breakout', 'sideways_bb_std_mult': 2.2082231287436738, 'sideways_rsi_os': 42, 'sideways_rsi_ob': 79, 'sideways_adx_thresh': 32.47353700596898, 'sideways_atr_min_pct': 0.024705738446273294, 'sideways_atr_max_pct': 0.14206501940625155, 'sideways_tp_mult': 1.0565183472270883, 'sideways_tsl_mult': 0.6872118215785061, 'sideways_time_stop': 127, 'sideways_use_sma': True, 'sideways_use_ema': False, 'sideways_use_atr': False, 'sideways_use_adx': True, 'sideways_use_spike': False, 'sideways_rsi_required': False}.
