[I 2025-08-29 20:04:16,204] Trial 237 finished with values: [-0.022924710855361297, 0.02289984419853558] and parameters: {'p_sma': 41, 'p_std': 51, 'p_atr': 24, 'p_adx': 17, 'rsi_period': 40, 'ema1': 19, 'ema2': 48, 'slip_atr_k': 0.03264377402562084, 'slip_spread_k': 0.22164663060280068, 'spread_hl_frac': 0.0012896640311125915, 'bb_std_mult': 1.1143663052061594, 'rsi_os': 17, 'rsi_ob': 65, 'vol_spike': 0.18808235878633828, 'adx_thresh': 31.42469032375866, 'atr_min_pct': 0.013436144221236693, 'atr_max_pct': 0.04970793728040633, 'tp_mult': 1.6654283026160168, 'tsl_mult': 0.5803376519561577, 'strategy': 'breakout', 'time_stop': 163, 'use_sma': True, 'use_atr': True, 'use_adx': False, 'use_ema': True, 'use_spike': True, 'rsi_required': True, 'edge_k': 1.207432913781788, 'edge_cap': 0.49380197470760206, 'bull_strategy': 'mean_reversion', 'bull_bb_std_mult': 1.4444710626776973, 'bull_rsi_os': 40, 'bull_rsi_ob': 94, 'bull_adx_thresh': 12.885412823216916, 'bull_atr_min_pct': 3.2160171678568975e-05, 'bull_atr_max_pct': 0.021514599060649484, 'bull_tp_mult': 1.5165800329335608, 'bull_tsl_mult': 0.1239879858034758, 'bull_time_stop': 178, 'bull_use_sma': True, 'bull_use_ema': False, 'bull_use_atr': True, 'bull_use_adx': False, 'bull_use_spike': False, 'bull_rsi_required': True, 'bear_strategy': 'breakout', 'bear_bb_std_mult': 0.8924390263775449, 'bear_rsi_os': 30, 'bear_rsi_ob': 70, 'bear_adx_thresh': 22.965919447764698, 'bear_atr_min_pct': 0.004958532134914461, 'bear_atr_max_pct': 0.11799576241479981, 'bear_tp_mult': 1.015902109944583, 'bear_tsl_mult': 0.45622321157739393, 'bear_time_stop': 29, 'bear_use_sma': False, 'bear_use_ema': True, 'bear_use_atr': False, 'bear_use_adx': True, 'bear_use_spike': True, 'bear_rsi_required': False, 'sideways_strategy': 'mean_reversion', 'sideways_bb_std_mult': 1.7760154056392903, 'sideways_rsi_os': 18, 'sideways_rsi_ob': 81, 'sideways_adx_thresh': 12.403081986781201, 'sideways_atr_min_pct': 0.004726176167893869, 'sideways_atr_max_pct': 0.05694013693961083, 'sideways_tp_mult': 2.632922177707924, 'sideways_tsl_mult': 0.8572899409884179, 'sideways_time_stop': 238, 'sideways_use_sma': False, 'sideways_use_ema': False, 'sideways_use_atr': True, 'sideways_use_adx': False, 'sideways_use_spike': False, 'sideways_rsi_required': False}.
[I 2025-08-29 20:04:16,538] Trial 234 finished with values: [-0.025603641460231086, 0.025578848322260136] and parameters: {'p_sma': 42, 'p_std': 48, 'p_atr': 25, 'p_adx': 28, 'rsi_period': 39, 'ema1': 19, 'ema2': 47, 'slip_atr_k': 0.03226575253324539, 'slip_spread_k': 0.234214020788009, 'spread_hl_frac': 0.0006370667824213041, 'bb_std_mult': 1.0855292816594542, 'rsi_os': 17, 'rsi_ob': 64, 'vol_spike': 0.18530526821790075, 'adx_thresh': 30.632032977695026, 'atr_min_pct': 0.013346426571126505, 'atr_max_pct': 0.04529439847073566, 'tp_mult': 1.611325230040626, 'tsl_mult': 0.2497365425963366, 'strategy': 'mean_reversion', 'time_stop': 170, 'use_sma': True, 'use_atr': True, 'use_adx': False, 'use_ema': False, 'use_spike': False, 'rsi_required': True, 'edge_k': 1.1583349167130788, 'edge_cap': 0.5159241276326845, 'bull_strategy': 'mean_reversion', 'bull_bb_std_mult': 1.5285739705161676, 'bull_rsi_os': 39, 'bull_rsi_ob': 95, 'bull_adx_thresh': 13.003345449241225, 'bull_atr_min_pct': 0.0005359422058225957, 'bull_atr_max_pct': 0.02241209936823244, 'bull_tp_mult': 1.4563646488602622, 'bull_tsl_mult': 0.10416353703798997, 'bull_time_stop': 163, 'bull_use_sma': True, 'bull_use_ema': False, 'bull_use_atr': False, 'bull_use_adx': True, 'bull_use_spike': False, 'bull_rsi_required': True, 'bear_strategy': 'breakout', 'bear_bb_std_mult': 0.9506414207331565, 'bear_rsi_os': 33, 'bear_rsi_ob': 70, 'bear_adx_thresh': 5.449807271225313, 'bear_atr_min_pct': 0.004796548543470407, 'bear_atr_max_pct': 0.11820916095151725, 'bear_tp_mult': 1.0593567477626036, 'bear_tsl_mult': 0.451849611428329, 'bear_time_stop': 18, 'bear_use_sma': False, 'bear_use_ema': True, 'bear_use_atr': True, 'bear_use_adx': False, 'bear_use_spike': True, 'bear_rsi_required': True, 'sideways_strategy': 'mean_reversion', 'sideways_bb_std_mult': 1.7073244840998199, 'sideways_rsi_os': 14, 'sideways_rsi_ob': 81, 'sideways_adx_thresh': 19.52136635297437, 'sideways_atr_min_pct': 0.0039233024216027874, 'sideways_atr_max_pct': 0.05753141106431943, 'sideways_tp_mult': 2.6596003940153716, 'sideways_tsl_mult': 0.6482986423741203, 'sideways_time_stop': 239, 'sideways_use_sma': False, 'sideways_use_ema': True, 'sideways_use_atr': True, 'sideways_use_adx': False, 'sideways_use_spike': False, 'sideways_rsi_required': False}.
[I 2025-08-29 20:04:16,763] Trial 235 finished with values: [-0.01695875258166668, 0.016947717922209816] and parameters: {'p_sma': 41, 'p_std': 50, 'p_atr': 25, 'p_adx': 17, 'rsi_period': 38, 'ema1': 19, 'ema2': 48, 'slip_atr_k': 0.030326704770030896, 'slip_spread_k': 0.2266841971043827, 'spread_hl_frac': 0.0009017232396314574, 'bb_std_mult': 1.094261591958926, 'rsi_os': 17, 'rsi_ob': 65, 'vol_spike': 0.18322500434779668, 'adx_thresh': 31.457758968729273, 'atr_min_pct': 0.006883183756040611, 'atr_max_pct': 0.050846642399054946, 'tp_mult': 1.7316191123369127, 'tsl_mult': 0.5837099950107184, 'strategy': 'breakout', 'time_stop': 173, 'use_sma': True, 'use_atr': True, 'use_adx': False, 'use_ema': False, 'use_spike': False, 'rsi_required': True, 'edge_k': 1.1629409690215782, 'edge_cap': 0.5221614971754114, 'bull_strategy': 'mean_reversion', 'bull_bb_std_mult': 1.5059423325605825, 'bull_rsi_os': 39, 'bull_rsi_ob': 95, 'bull_adx_thresh': 31.062105634435827, 'bull_atr_min_pct': 0.00017430630347007984, 'bull_atr_max_pct': 0.021841567516798777, 'bull_tp_mult': 1.5116837785498438, 'bull_tsl_mult': 0.10845298065917945, 'bull_time_stop': 176, 'bull_use_sma': True, 'bull_use_ema': False, 'bull_use_atr': True, 'bull_use_adx': True, 'bull_use_spike': False, 'bull_rsi_required': True, 'bear_strategy': 'breakout', 'bear_bb_std_mult': 3.2071804586167048, 'bear_rsi_os': 32, 'bear_rsi_ob': 71, 'bear_adx_thresh': 5.008314169096421, 'bear_atr_min_pct': 0.0050810970762003, 'bear_atr_max_pct': 0.11981917452432082, 'bear_tp_mult': 1.0106422782155708, 'bear_tsl_mult': 0.45945157169921685, 'bear_time_stop': 288, 'bear_use_sma': False, 'bear_use_ema': True, 'bear_use_atr': True, 'bear_use_adx': False, 'bear_use_spike': True, 'bear_rsi_required': True, 'sideways_strategy': 'mean_reversion', 'sideways_bb_std_mult': 1.7929165363112887, 'sideways_rsi_os': 18, 'sideways_rsi_ob': 68, 'sideways_adx_thresh': 20.700178535155885, 'sideways_atr_min_pct': 0.004566894788177775, 'sideways_atr_max_pct': 0.055882245580553346, 'sideways_tp_mult': 2.6185377759033166, 'sideways_tsl_mult': 0.6571764552194076, 'sideways_time_stop': 244, 'sideways_use_sma': False, 'sideways_use_ema': True, 'sideways_use_atr': True, 'sideways_use_adx': False, 'sideways_use_spike': False, 'sideways_rsi_required': False}.
[I 2025-08-29 20:04:16,764] Trial 236 finished with values: [-0.02402979443242015, 0.02400496256459602] and parameters: {'p_sma': 41, 'p_std': 50, 'p_atr': 25, 'p_adx': 10, 'rsi_period': 40, 'ema1': 19, 'ema2': 48, 'slip_atr_k': 0.03229181676572875, 'slip_spread_k': 0.22597224523107454, 'spread_hl_frac': 0.0001780147007282018, 'bb_std_mult': 1.1133836694074446, 'rsi_os': 17, 'rsi_ob': 65, 'vol_spike': 0.18523339060105923, 'adx_thresh': 31.482673229737838, 'atr_min_pct': 0.013814358625762782, 'atr_max_pct': 0.05091697469810158, 'tp_mult': 1.6671176342862455, 'tsl_mult': 0.9057644545905091, 'strategy': 'breakout', 'time_stop': 176, 'use_sma': True, 'use_atr': True, 'use_adx': False, 'use_ema': False, 'use_spike': False, 'rsi_required': True, 'edge_k': 1.1964830479829083, 'edge_cap': 0.49805110979459477, 'bull_strategy': 'mean_reversion', 'bull_bb_std_mult': 1.4876909199684833, 'bull_rsi_os': 39, 'bull_rsi_ob': 94, 'bull_adx_thresh': 17.819444758328277, 'bull_atr_min_pct': 0.0002140393856937473, 'bull_atr_max_pct': 0.023024233569622785, 'bull_tp_mult': 1.520513729630225, 'bull_tsl_mult': 0.08552388230721014, 'bull_time_stop': 177, 'bull_use_sma': True, 'bull_use_ema': False, 'bull_use_atr': True, 'bull_use_adx': True, 'bull_use_spike': False, 'bull_rsi_required': True, 'bear_strategy': 'breakout', 'bear_bb_std_mult': 1.0637105347478832, 'bear_rsi_os': 32, 'bear_rsi_ob': 70, 'bear_adx_thresh': 6.70802751719948, 'bear_atr_min_pct': 0.005298492791387319, 'bear_atr_max_pct': 0.11735499898191683, 'bear_tp_mult': 1.0455378456377404, 'bear_tsl_mult': 0.4500714344154409, 'bear_time_stop': 96, 'bear_use_sma': False, 'bear_use_ema': True, 'bear_use_atr': True, 'bear_use_adx': False, 'bear_use_spike': True, 'bear_rsi_required': False, 'sideways_strategy': 'mean_reversion', 'sideways_bb_std_mult': 1.766105035666871, 'sideways_rsi_os': 17, 'sideways_rsi_ob': 81, 'sideways_adx_thresh': 21.998814337540107, 'sideways_atr_min_pct': 0.006736721960533857, 'sideways_atr_max_pct': 0.05589437796559327, 'sideways_tp_mult': 2.642177744378695, 'sideways_tsl_mult': 0.7631555520615645, 'sideways_time_stop': 241, 'sideways_use_sma': False, 'sideways_use_ema': True, 'sideways_use_atr': True, 'sideways_use_adx': False, 'sideways_use_spike': False, 'sideways_rsi_required': False}.
[I 2025-08-29 20:04:46,381] Trial 240 finished with values: [-1000000000.0, 1000000000.0] and parameters: {'p_sma': 42, 'p_std': 26, 'p_atr': 26, 'p_adx': 18, 'rsi_period': 42, 'ema1': 21, 'ema2': 46, 'slip_atr_k': 0.223829321837413, 'slip_spread_k': 0.2068802717668106, 'spread_hl_frac': 0.0019378118134515036, 'bb_std_mult': 1.1979266111544504, 'rsi_os': 18, 'rsi_ob': 62, 'vol_spike': 0.20386917218499298, 'adx_thresh': 31.81939225297922, 'atr_min_pct': 0.008613946465546349, 'atr_max_pct': 0.03813372189685812, 'tp_mult': 1.8061950693902806, 'tsl_mult': 0.5942904700299696, 'strategy': 'mean_reversion', 'time_stop': 209, 'use_sma': True, 'use_atr': True, 'use_adx': False, 'use_ema': True, 'use_spike': True, 'rsi_required': False, 'edge_k': 1.2071998605271426, 'edge_cap': 0.544896491062924, 'bull_strategy': 'mean_reversion', 'bull_bb_std_mult': 1.4416201643078603, 'bull_rsi_os': 40, 'bull_rsi_ob': 85, 'bull_adx_thresh': 23.77110546174987, 'bull_atr_min_pct': 0.0022051279746802942, 'bull_atr_max_pct': 0.03199039374308397, 'bull_tp_mult': 1.398214343931211, 'bull_tsl_mult': 0.14241038159247066, 'bull_time_stop': 193, 'bull_use_sma': True, 'bull_use_ema': True, 'bull_use_atr': False, 'bull_use_adx': False, 'bull_use_spike': False, 'bull_rsi_required': True, 'bear_strategy': 'breakout', 'bear_bb_std_mult': 3.5966190374925535, 'bear_rsi_os': 30, 'bear_rsi_ob': 84, 'bear_adx_thresh': 6.335873432007537, 'bear_atr_min_pct': 0.0057670564214951855, 'bear_atr_max_pct': 0.11593877720199688, 'bear_tp_mult': 1.0430206577616759, 'bear_tsl_mult': 0.41564794150142653, 'bear_time_stop': 50, 'bear_use_sma': False, 'bear_use_ema': True, 'bear_use_atr': False, 'bear_use_adx': True, 'bear_use_spike': True, 'bear_rsi_required': False, 'sideways_strategy': 'mean_reversion', 'sideways_bb_std_mult': 1.8332608303603273, 'sideways_rsi_os': 16, 'sideways_rsi_ob': 84, 'sideways_adx_thresh': 17.310859269821727, 'sideways_atr_min_pct': 0.005286563249478555, 'sideways_atr_max_pct': 0.06353068965596285, 'sideways_tp_mult': 2.860754147571731, 'sideways_tsl_mult': 0.8145585732093921, 'sideways_time_stop': 248, 'sideways_use_sma': False, 'sideways_use_ema': False, 'sideways_use_atr': False, 'sideways_use_adx': True, 'sideways_use_spike': False, 'sideways_rsi_required': False}.
[I 2025-08-29 20:04:46,629] Trial 241 finished with values: [-0.003879820515249932, 0.004051910083755154] and parameters: {'p_sma': 42, 'p_std': 52, 'p_atr': 26, 'p_adx': 18, 'rsi_period': 35, 'ema1': 21, 'ema2': 45, 'slip_atr_k': 0.16257414446147167, 'slip_spread_k': 0.6699289570912405, 'spread_hl_frac': 0.0020250134018977963, 'bb_std_mult': 1.181226170194903, 'rsi_os': 18, 'rsi_ob': 87, 'vol_spike': 0.17612594157023925, 'adx_thresh': 31.89932686818616, 'atr_min_pct': 0.023084425034838, 'atr_max_pct': 0.03856779176043583, 'tp_mult': 1.799539120776104, 'tsl_mult': 0.5926892640496001, 'strategy': 'mean_reversion', 'time_stop': 208, 'use_sma': True, 'use_atr': True, 'use_adx': False, 'use_ema': True, 'use_spike': True, 'rsi_required': False, 'edge_k': 1.0945177283801042, 'edge_cap': 0.5461015037311583, 'bull_strategy': 'mean_reversion', 'bull_bb_std_mult': 1.366438413521524, 'bull_rsi_os': 40, 'bull_rsi_ob': 69, 'bull_adx_thresh': 17.366248573296954, 'bull_atr_min_pct': 0.0016392227449607776, 'bull_atr_max_pct': 0.03433125224580687, 'bull_tp_mult': 1.4009846328263513, 'bull_tsl_mult': 0.12889580588812752, 'bull_time_stop': 187, 'bull_use_sma': True, 'bull_use_ema': True, 'bull_use_atr': False, 'bull_use_adx': False, 'bull_use_spike': False, 'bull_rsi_required': True, 'bear_strategy': 'breakout', 'bear_bb_std_mult': 1.1509508629661314, 'bear_rsi_os': 30, 'bear_rsi_ob': 81, 'bear_adx_thresh': 6.414815327017928, 'bear_atr_min_pct': 0.005835687225135999, 'bear_atr_max_pct': 0.11554173396616024, 'bear_tp_mult': 1.0504311600856058, 'bear_tsl_mult': 0.4101587345638716, 'bear_time_stop': 50, 'bear_use_sma': False, 'bear_use_ema': True, 'bear_use_atr': False, 'bear_use_adx': True, 'bear_use_spike': True, 'bear_rsi_required': False, 'sideways_strategy': 'mean_reversion', 'sideways_bb_std_mult': 1.8091020574136736, 'sideways_rsi_os': 16, 'sideways_rsi_ob': 59, 'sideways_adx_thresh': 17.439331786687262, 'sideways_atr_min_pct': 0.0052720348797239466, 'sideways_atr_max_pct': 0.05110330015677896, 'sideways_tp_mult': 2.8414725882792684, 'sideways_tsl_mult': 0.8111834675705335, 'sideways_time_stop': 233, 'sideways_use_sma': False, 'sideways_use_ema': False, 'sideways_use_atr': False, 'sideways_use_adx': True, 'sideways_use_spike': False, 'sideways_rsi_required': False}.
[I 2025-08-29 20:04:47,098] Trial 238 finished with values: [-0.023231935838812556, 0.023205570253737474] and parameters: {'p_sma': 41, 'p_std': 51, 'p_atr': 25, 'p_adx': 18, 'rsi_period': 38, 'ema1': 21, 'ema2': 47, 'slip_atr_k': 0.11435286867986746, 'slip_spread_k': 0.24187688190828924, 'spread_hl_frac': 6.690169203743329e-05, 'bb_std_mult': 1.1625816443742347, 'rsi_os': 18, 'rsi_ob': 65, 'vol_spike': 0.1851943051595496, 'adx_thresh': 31.269789510557757, 'atr_min_pct': 0.008484994432018222, 'atr_max_pct': 0.0597142458038996, 'tp_mult': 1.6201772848113118, 'tsl_mult': 0.5840946027320916, 'strategy': 'mean_reversion', 'time_stop': 176, 'use_sma': True, 'use_atr': True, 'use_adx': False, 'use_ema': False, 'use_spike': False, 'rsi_required': False, 'edge_k': 1.1609982437904718, 'edge_cap': 0.49709746309966363, 'bull_strategy': 'mean_reversion', 'bull_bb_std_mult': 1.5017720835725303, 'bull_rsi_os': 39, 'bull_rsi_ob': 69, 'bull_adx_thresh': 17.907712773053834, 'bull_atr_min_pct': 0.0005195753515761081, 'bull_atr_max_pct': 0.03611312713059765, 'bull_tp_mult': 1.5014692459323706, 'bull_tsl_mult': 0.10791407168585443, 'bull_time_stop': 195, 'bull_use_sma': True, 'bull_use_ema': False, 'bull_use_atr': True, 'bull_use_adx': True, 'bull_use_spike': False, 'bull_rsi_required': True, 'bear_strategy': 'breakout', 'bear_bb_std_mult': 3.199074738195114, 'bear_rsi_os': 32, 'bear_rsi_ob': 70, 'bear_adx_thresh': 6.598513672700138, 'bear_atr_min_pct': 0.02944376273045259, 'bear_atr_max_pct': 0.11627214657793009, 'bear_tp_mult': 1.0531349463577966, 'bear_tsl_mult': 0.41190359958862677, 'bear_time_stop': 25, 'bear_use_sma': False, 'bear_use_ema': True, 'bear_use_atr': True, 'bear_use_adx': False, 'bear_use_spike': True, 'bear_rsi_required': False, 'sideways_strategy': 'mean_reversion', 'sideways_bb_std_mult': 1.79139032490057, 'sideways_rsi_os': 17, 'sideways_rsi_ob': 68, 'sideways_adx_thresh': 21.85255886220537, 'sideways_atr_min_pct': 0.0068697750090174516, 'sideways_atr_max_pct': 0.05053161362729475, 'sideways_tp_mult': 2.8796328880642355, 'sideways_tsl_mult': 0.7593087655847323, 'sideways_time_stop': 247, 'sideways_use_sma': False, 'sideways_use_ema': True, 'sideways_use_atr': True, 'sideways_use_adx': True, 'sideways_use_spike': False, 'sideways_rsi_required': False}.
[I 2025-08-29 20:04:47,186] Trial 239 finished with values: [-0.005394760505354701, 0.005528894246001971] and parameters: {'p_sma': 40, 'p_std': 50, 'p_atr': 26, 'p_adx': 18, 'rsi_period': 38, 'ema1': 18, 'ema2': 45, 'slip_atr_k': 0.2237975009441744, 'slip_spread_k': 0.22962907129395013, 'spread_hl_frac': 0.0020672402404467403, 'bb_std_mult': 1.1694122676615968, 'rsi_os': 18, 'rsi_ob': 63, 'vol_spike': 0.1822378749118486, 'adx_thresh': 31.336254952415192, 'atr_min_pct': 0.012801676578779184, 'atr_max_pct': 0.037566931661971774, 'tp_mult': 1.8003283445492049, 'tsl_mult': 0.5885955149265889, 'strategy': 'breakout', 'time_stop': 206, 'use_sma': True, 'use_atr': True, 'use_adx': False, 'use_ema': False, 'use_spike': False, 'rsi_required': False, 'edge_k': 1.197411513581633, 'edge_cap': 0.5481854085259567, 'bull_strategy': 'mean_reversion', 'bull_bb_std_mult': 1.4742570981903649, 'bull_rsi_os': 40, 'bull_rsi_ob': 94, 'bull_adx_thresh': 17.92863822771464, 'bull_atr_min_pct': 0.0015649428532828016, 'bull_atr_max_pct': 0.0367586638681402, 'bull_tp_mult': 1.400520894254261, 'bull_tsl_mult': 0.12395187170196985, 'bull_time_stop': 192, 'bull_use_sma': True, 'bull_use_ema': True, 'bull_use_atr': True, 'bull_use_adx': True, 'bull_use_spike': False, 'bull_rsi_required': True, 'bear_strategy': 'breakout', 'bear_bb_std_mult': 1.0755229943266686, 'bear_rsi_os': 32, 'bear_rsi_ob': 72, 'bear_adx_thresh': 6.503487483450145, 'bear_atr_min_pct': 0.005700914016889762, 'bear_atr_max_pct': 0.11582511035270286, 'bear_tp_mult': 1.040538787030459, 'bear_tsl_mult': 0.38157681312172365, 'bear_time_stop': 284, 'bear_use_sma': False, 'bear_use_ema': True, 'bear_use_atr': True, 'bear_use_adx': False, 'bear_use_spike': True, 'bear_rsi_required': False, 'sideways_strategy': 'mean_reversion', 'sideways_bb_std_mult': 1.8581443323926912, 'sideways_rsi_os': 16, 'sideways_rsi_ob': 55, 'sideways_adx_thresh': 21.946213902414822, 'sideways_atr_min_pct': 0.007011612398372824, 'sideways_atr_max_pct': 0.05202098442385304, 'sideways_tp_mult': 2.816022269188652, 'sideways_tsl_mult': 0.770357693858752, 'sideways_time_stop': 232, 'sideways_use_sma': False, 'sideways_use_ema': True, 'sideways_use_atr': False, 'sideways_use_adx': True, 'sideways_use_spike': False, 'sideways_rsi_required': False}.
[I 2025-08-29 20:05:17,941] Trial 242 finished with values: [-1000000000.0, 1000000000.0] and parameters: {'p_sma': 41, 'p_std': 51, 'p_atr': 24, 'p_adx': 18, 'rsi_period': 36, 'ema1': 18, 'ema2': 45, 'slip_atr_k': 0.03718666792204516, 'slip_spread_k': 0.18841672620797228, 'spread_hl_frac': 0.0020868261761084945, 'bb_std_mult': 1.188246477752405, 'rsi_os': 19, 'rsi_ob': 95, 'vol_spike': 0.17765036968623563, 'adx_thresh': 31.0299692327638, 'atr_min_pct': 0.025053558961391584, 'atr_max_pct': 0.05953603416594308, 'tp_mult': 1.8437376299508037, 'tsl_mult': 0.08927024854526527, 'strategy': 'mean_reversion', 'time_stop': 147, 'use_sma': True, 'use_atr': True, 'use_adx': False, 'use_ema': False, 'use_spike': False, 'rsi_required': False, 'edge_k': 1.0889190589554327, 'edge_cap': 0.48444157638057994, 'bull_strategy': 'mean_reversion', 'bull_bb_std_mult': 1.3866160468867688, 'bull_rsi_os': 40, 'bull_rsi_ob': 51, 'bull_adx_thresh': 18.011189022953133, 'bull_atr_min_pct': 0.0018820935298079443, 'bull_atr_max_pct': 0.034522379565776945, 'bull_tp_mult': 1.4183708541736422, 'bull_tsl_mult': 0.12084123287230668, 'bull_time_stop': 214, 'bull_use_sma': True, 'bull_use_ema': True, 'bull_use_atr': False, 'bull_use_adx': True, 'bull_use_spike': False, 'bull_rsi_required': True, 'bear_strategy': 'breakout', 'bear_bb_std_mult': 1.1727077248193256, 'bear_rsi_os': 22, 'bear_rsi_ob': 72, 'bear_adx_thresh': 21.771704198867678, 'bear_atr_min_pct': 0.024879655043028408, 'bear_atr_max_pct': 0.1151021777801758, 'bear_tp_mult': 1.1223611098588715, 'bear_tsl_mult': 0.5163221891790206, 'bear_time_stop': 137, 'bear_use_sma': False, 'bear_use_ema': True, 'bear_use_atr': True, 'bear_use_adx': False, 'bear_use_spike': True, 'bear_rsi_required': False, 'sideways_strategy': 'mean_reversion', 'sideways_bb_std_mult': 3.397829591129545, 'sideways_rsi_os': 16, 'sideways_rsi_ob': 82, 'sideways_adx_thresh': 15.13157260555196, 'sideways_atr_min_pct': 0.007341840144444644, 'sideways_atr_max_pct': 0.049712021988656915, 'sideways_tp_mult': 2.8034745026736334, 'sideways_tsl_mult': 0.6885301391842202, 'sideways_time_stop': 229, 'sideways_use_sma': False, 'sideways_use_ema': True, 'sideways_use_atr': True, 'sideways_use_adx': True, 'sideways_use_spike': False, 'sideways_rsi_required': False}.
