[I 2025-08-29 20:02:43,511] Trial 227 finished with values: [-1000000000.0, 1000000000.0] and parameters: {'p_sma': 40, 'p_std': 52, 'p_atr': 24, 'p_adx': 17, 'rsi_period': 36, 'ema1': 20, 'ema2': 39, 'slip_atr_k': 0.20238075949016582, 'slip_spread_k': 0.6971617492203794, 'spread_hl_frac': 0.006362340987770755, 'bb_std_mult': 0.730933880185566, 'rsi_os': 55, 'rsi_ob': 66, 'vol_spike': 0.17802024509409475, 'adx_thresh': 20.300691032747952, 'atr_min_pct': 0.013906669892828858, 'atr_max_pct': 0.08439791035052757, 'tp_mult': 2.3459818323447386, 'tsl_mult': 0.5930940060322692, 'strategy': 'mean_reversion', 'time_stop': 96, 'use_sma': True, 'use_atr': True, 'use_adx': False, 'use_ema': False, 'use_spike': False, 'rsi_required': True, 'edge_k': 1.252789283323907, 'edge_cap': 0.483049894463163, 'bull_strategy': 'breakout', 'bull_bb_std_mult': 2.391182412516862, 'bull_rsi_os': 24, 'bull_rsi_ob': 95, 'bull_adx_thresh': 17.86472966015711, 'bull_atr_min_pct': 0.0006509193410515219, 'bull_atr_max_pct': 0.022303112871395116, 'bull_tp_mult': 1.4781462331568807, 'bull_tsl_mult': 0.1276154368307097, 'bull_time_stop': 181, 'bull_use_sma': True, 'bull_use_ema': True, 'bull_use_atr': False, 'bull_use_adx': True, 'bull_use_spike': False, 'bull_rsi_required': True, 'bear_strategy': 'breakout', 'bear_bb_std_mult': 1.1140893670677776, 'bear_rsi_os': 30, 'bear_rsi_ob': 51, 'bear_adx_thresh': 6.04317063846389, 'bear_atr_min_pct': 0.005887660081442796, 'bear_atr_max_pct': 0.02138504716431351, 'bear_tp_mult': 1.8811681383195433, 'bear_tsl_mult': 0.07026194990427781, 'bear_time_stop': 9, 'bear_use_sma': False, 'bear_use_ema': True, 'bear_use_atr': True, 'bear_use_adx': False, 'bear_use_spike': True, 'bear_rsi_required': False, 'sideways_strategy': 'mean_reversion', 'sideways_bb_std_mult': 1.871597960801211, 'sideways_rsi_os': 16, 'sideways_rsi_ob': 73, 'sideways_adx_thresh': 29.888836274000667, 'sideways_atr_min_pct': 0.023108551752571437, 'sideways_atr_max_pct': 0.12695082630400917, 'sideways_tp_mult': 2.1166551844364756, 'sideways_tsl_mult': 0.6997172015731727, 'sideways_time_stop': 134, 'sideways_use_sma': False, 'sideways_use_ema': True, 'sideways_use_atr': True, 'sideways_use_adx': False, 'sideways_use_spike': False, 'sideways_rsi_required': False}.
[I 2025-08-29 20:03:12,497] Trial 226 finished with values: [4.172541906766192e-05, 0.0010497587338672153] and parameters: {'p_sma': 40, 'p_std': 52, 'p_atr': 24, 'p_adx': 17, 'rsi_period': 36, 'ema1': 20, 'ema2': 46, 'slip_atr_k': 0.038161090717647866, 'slip_spread_k': 0.24765043562388095, 'spread_hl_frac': 0.0021510981871239454, 'bb_std_mult': 1.1899991603911897, 'rsi_os': 19, 'rsi_ob': 66, 'vol_spike': 0.17899436913802877, 'adx_thresh': 31.740994287417884, 'atr_min_pct': 0.013627098671961936, 'atr_max_pct': 0.04303028347792729, 'tp_mult': 1.7234107577727018, 'tsl_mult': 0.5943208926942964, 'strategy': 'mean_reversion', 'time_stop': 158, 'use_sma': True, 'use_atr': True, 'use_adx': False, 'use_ema': False, 'use_spike': False, 'rsi_required': True, 'edge_k': 1.2234811242078174, 'edge_cap': 0.4839947021393487, 'bull_strategy': 'mean_reversion', 'bull_bb_std_mult': 1.5435926284229091, 'bull_rsi_os': 40, 'bull_rsi_ob': 95, 'bull_adx_thresh': 17.95863487302897, 'bull_atr_min_pct': 0.0006752944495736091, 'bull_atr_max_pct': 0.02471282459612817, 'bull_tp_mult': 1.4656258161145006, 'bull_tsl_mult': 0.1291202898693087, 'bull_time_stop': 178, 'bull_use_sma': True, 'bull_use_ema': True, 'bull_use_atr': False, 'bull_use_adx': True, 'bull_use_spike': False, 'bull_rsi_required': True, 'bear_strategy': 'breakout', 'bear_bb_std_mult': 1.13878625443271, 'bear_rsi_os': 30, 'bear_rsi_ob': 69, 'bear_adx_thresh': 5.843469242223407, 'bear_atr_min_pct': 0.00581043668494141, 'bear_atr_max_pct': 0.11342728862377972, 'bear_tp_mult': 1.0186512551463727, 'bear_tsl_mult': 0.4734832156378113, 'bear_time_stop': 10, 'bear_use_sma': False, 'bear_use_ema': True, 'bear_use_atr': True, 'bear_use_adx': False, 'bear_use_spike': True, 'bear_rsi_required': False, 'sideways_strategy': 'mean_reversion', 'sideways_bb_std_mult': 1.8743035297163424, 'sideways_rsi_os': 16, 'sideways_rsi_ob': 82, 'sideways_adx_thresh': 19.535638556045846, 'sideways_atr_min_pct': 0.0051959093153169725, 'sideways_atr_max_pct': 0.06058549216454877, 'sideways_tp_mult': 2.7443324624582788, 'sideways_tsl_mult': 0.6958448664771147, 'sideways_time_stop': 246, 'sideways_use_sma': False, 'sideways_use_ema': True, 'sideways_use_atr': True, 'sideways_use_adx': False, 'sideways_use_spike': False, 'sideways_rsi_required': False}.
[I 2025-08-29 20:03:13,331] Trial 225 finished with values: [-0.0034136426911720585, 0.003683953176734835] and parameters: {'p_sma': 40, 'p_std': 52, 'p_atr': 24, 'p_adx': 17, 'rsi_period': 22, 'ema1': 13, 'ema2': 13, 'slip_atr_k': 0.04040337045922934, 'slip_spread_k': 0.2520989348038469, 'spread_hl_frac': 0.027482867404201732, 'bb_std_mult': 3.558899205704553, 'rsi_os': 45, 'rsi_ob': 66, 'vol_spike': 0.17555677459506597, 'adx_thresh': 31.67469925035704, 'atr_min_pct': 0.01376064847391013, 'atr_max_pct': 0.08459026697131615, 'tp_mult': 2.172313330790201, 'tsl_mult': 0.592077107090686, 'strategy': 'mean_reversion', 'time_stop': 200, 'use_sma': True, 'use_atr': True, 'use_adx': False, 'use_ema': False, 'use_spike': False, 'rsi_required': True, 'edge_k': 1.2432540010798891, 'edge_cap': 0.6032831388259162, 'bull_strategy': 'mean_reversion', 'bull_bb_std_mult': 1.5210859553225058, 'bull_rsi_os': 40, 'bull_rsi_ob': 95, 'bull_adx_thresh': 13.116114348987193, 'bull_atr_min_pct': 0.010184399573565652, 'bull_atr_max_pct': 0.08906641834224632, 'bull_tp_mult': 1.4572907818443612, 'bull_tsl_mult': 0.5830052545279815, 'bull_time_stop': 201, 'bull_use_sma': True, 'bull_use_ema': True, 'bull_use_atr': False, 'bull_use_adx': True, 'bull_use_spike': False, 'bull_rsi_required': True, 'bear_strategy': 'breakout', 'bear_bb_std_mult': 2.2360399328488407, 'bear_rsi_os': 49, 'bear_rsi_ob': 69, 'bear_adx_thresh': 16.00036281747821, 'bear_atr_min_pct': 0.005809147457364113, 'bear_atr_max_pct': 0.10591450945803901, 'bear_tp_mult': 1.0934455770426736, 'bear_tsl_mult': 0.1593022656576576, 'bear_time_stop': 10, 'bear_use_sma': False, 'bear_use_ema': True, 'bear_use_atr': True, 'bear_use_adx': False, 'bear_use_spike': True, 'bear_rsi_required': False, 'sideways_strategy': 'mean_reversion', 'sideways_bb_std_mult': 1.8793552652491805, 'sideways_rsi_os': 29, 'sideways_rsi_ob': 82, 'sideways_adx_thresh': 30.01093100051991, 'sideways_atr_min_pct': 0.019518738574795604, 'sideways_atr_max_pct': 0.12617641048134848, 'sideways_tp_mult': 2.785271912477681, 'sideways_tsl_mult': 0.14161231194945245, 'sideways_time_stop': 132, 'sideways_use_sma': False, 'sideways_use_ema': True, 'sideways_use_atr': True, 'sideways_use_adx': False, 'sideways_use_spike': False, 'sideways_rsi_required': False}.
[I 2025-08-29 20:03:13,525] Trial 228 finished with values: [-1000000000.0, 1000000000.0] and parameters: {'p_sma': 9, 'p_std': 43, 'p_atr': 19, 'p_adx': 16, 'rsi_period': 22, 'ema1': 20, 'ema2': 39, 'slip_atr_k': 0.039169007072751776, 'slip_spread_k': 0.4282963922489377, 'spread_hl_frac': 0.004843173792779069, 'bb_std_mult': 1.3577486532856888, 'rsi_os': 48, 'rsi_ob': 67, 'vol_spike': 0.17944867718377136, 'adx_thresh': 31.82808255481424, 'atr_min_pct': 0.014546304398373287, 'atr_max_pct': 0.08504012645671308, 'tp_mult': 1.8740669723462338, 'tsl_mult': 0.9442820626737716, 'strategy': 'mean_reversion', 'time_stop': 158, 'use_sma': True, 'use_atr': True, 'use_adx': True, 'use_ema': False, 'use_spike': False, 'rsi_required': True, 'edge_k': 1.2396760285469144, 'edge_cap': 0.6523357940043099, 'bull_strategy': 'mean_reversion', 'bull_bb_std_mult': 0.8052975809530338, 'bull_rsi_os': 41, 'bull_rsi_ob': 61, 'bull_adx_thresh': 16.685846245382017, 'bull_atr_min_pct': 0.0064556796357953476, 'bull_atr_max_pct': 0.01153606286175747, 'bull_tp_mult': 1.4803227428378811, 'bull_tsl_mult': 0.5774226833411931, 'bull_time_stop': 171, 'bull_use_sma': True, 'bull_use_ema': True, 'bull_use_atr': False, 'bull_use_adx': True, 'bull_use_spike': False, 'bull_rsi_required': False, 'bear_strategy': 'breakout', 'bear_bb_std_mult': 3.4440732549541204, 'bear_rsi_os': 46, 'bear_rsi_ob': 50, 'bear_adx_thresh': 5.809045036437571, 'bear_atr_min_pct': 0.02629724852828961, 'bear_atr_max_pct': 0.11409762625519104, 'bear_tp_mult': 1.8037028516920481, 'bear_tsl_mult': 0.1497810533446775, 'bear_time_stop': 10, 'bear_use_sma': False, 'bear_use_ema': True, 'bear_use_atr': True, 'bear_use_adx': False, 'bear_use_spike': True, 'bear_rsi_required': False, 'sideways_strategy': 'mean_reversion', 'sideways_bb_std_mult': 1.8758919807153642, 'sideways_rsi_os': 16, 'sideways_rsi_ob': 83, 'sideways_adx_thresh': 29.710879761480836, 'sideways_atr_min_pct': 0.02325633629652584, 'sideways_atr_max_pct': 0.12719828268099032, 'sideways_tp_mult': 2.7730941910633726, 'sideways_tsl_mult': 0.5551545651537443, 'sideways_time_stop': 66, 'sideways_use_sma': False, 'sideways_use_ema': True, 'sideways_use_atr': True, 'sideways_use_adx': False, 'sideways_use_spike': True, 'sideways_rsi_required': False}.
[I 2025-08-29 20:03:14,468] Trial 229 finished with values: [-1000000000.0, 1000000000.0] and parameters: {'p_sma': 54, 'p_std': 53, 'p_atr': 19, 'p_adx': 16, 'rsi_period': 23, 'ema1': 13, 'ema2': 40, 'slip_atr_k': 0.03780451220747879, 'slip_spread_k': 0.2566731126609387, 'spread_hl_frac': 0.003588954150343036, 'bb_std_mult': 1.3927247611188274, 'rsi_os': 20, 'rsi_ob': 67, 'vol_spike': 0.16908877747708762, 'adx_thresh': 32.558649979181375, 'atr_min_pct': 0.014785278630843475, 'atr_max_pct': 0.04264243336767135, 'tp_mult': 2.456206152066354, 'tsl_mult': 0.6047984299086693, 'strategy': 'mean_reversion', 'time_stop': 199, 'use_sma': False, 'use_atr': False, 'use_adx': True, 'use_ema': False, 'use_spike': False, 'rsi_required': False, 'edge_k': 1.327498829089565, 'edge_cap': 0.6017126506477254, 'bull_strategy': 'mean_reversion', 'bull_bb_std_mult': 0.8829048839347138, 'bull_rsi_os': 40, 'bull_rsi_ob': 94, 'bull_adx_thresh': 16.697464011414805, 'bull_atr_min_pct': 0.029985184349347275, 'bull_atr_max_pct': 0.13821856336518198, 'bull_tp_mult': 1.451292106970358, 'bull_tsl_mult': 0.4963612040231862, 'bull_time_stop': 279, 'bull_use_sma': False, 'bull_use_ema': True, 'bull_use_atr': False, 'bull_use_adx': True, 'bull_use_spike': True, 'bull_rsi_required': False, 'bear_strategy': 'mean_reversion', 'bear_bb_std_mult': 2.2424291460991133, 'bear_rsi_os': 46, 'bear_rsi_ob': 69, 'bear_adx_thresh': 11.735133445925015, 'bear_atr_min_pct': 0.02689808194970089, 'bear_atr_max_pct': 0.11282297056406383, 'bear_tp_mult': 1.318848660899368, 'bear_tsl_mult': 0.6721470359536542, 'bear_time_stop': 5, 'bear_use_sma': False, 'bear_use_ema': True, 'bear_use_atr': True, 'bear_use_adx': False, 'bear_use_spike': True, 'bear_rsi_required': False, 'sideways_strategy': 'mean_reversion', 'sideways_bb_std_mult': 1.7781611012778311, 'sideways_rsi_os': 32, 'sideways_rsi_ob': 83, 'sideways_adx_thresh': 29.61566327205928, 'sideways_atr_min_pct': 0.019659610895154833, 'sideways_atr_max_pct': 0.0687309964400498, 'sideways_tp_mult': 2.7433180063571747, 'sideways_tsl_mult': 0.14788256335093997, 'sideways_time_stop': 265, 'sideways_use_sma': True, 'sideways_use_ema': True, 'sideways_use_atr': True, 'sideways_use_adx': False, 'sideways_use_spike': True, 'sideways_rsi_required': True}.
[I 2025-08-29 20:03:45,067] Trial 230 finished with values: [-1000000000.0, 1000000000.0] and parameters: {'p_sma': 43, 'p_std': 50, 'p_atr': 25, 'p_adx': 16, 'rsi_period': 32, 'ema1': 18, 'ema2': 46, 'slip_atr_k': 0.025020537820544503, 'slip_spread_k': 0.2120246041523189, 'spread_hl_frac': 0.0016821193797508615, 'bb_std_mult': 1.0236635464316703, 'rsi_os': 16, 'rsi_ob': 64, 'vol_spike': 0.1970199852901381, 'adx_thresh': 30.61008819632967, 'atr_min_pct': 0.01546461174709013, 'atr_max_pct': 0.04034480389651421, 'tp_mult': 1.7160594566174319, 'tsl_mult': 0.544898136854015, 'strategy': 'mean_reversion', 'time_stop': 188, 'use_sma': True, 'use_atr': False, 'use_adx': True, 'use_ema': False, 'use_spike': False, 'rsi_required': False, 'edge_k': 1.1204783780303011, 'edge_cap': 0.5084760229935421, 'bull_strategy': 'mean_reversion', 'bull_bb_std_mult': 1.5670386628334798, 'bull_rsi_os': 39, 'bull_rsi_ob': 87, 'bull_adx_thresh': 16.848444573274794, 'bull_atr_min_pct': 0.0011673528309002956, 'bull_atr_max_pct': 0.027274672375514678, 'bull_tp_mult': 2.072159160448845, 'bull_tsl_mult': 0.08761604526574235, 'bull_time_stop': 201, 'bull_use_sma': True, 'bull_use_ema': True, 'bull_use_atr': False, 'bull_use_adx': True, 'bull_use_spike': True, 'bull_rsi_required': False, 'bear_strategy': 'mean_reversion', 'bear_bb_std_mult': 1.06923126618824, 'bear_rsi_os': 32, 'bear_rsi_ob': 71, 'bear_adx_thresh': 15.939042796610721, 'bear_atr_min_pct': 0.004523732275768931, 'bear_atr_max_pct': 0.12223354039811114, 'bear_tp_mult': 1.0959790472084816, 'bear_tsl_mult': 0.47940553545333525, 'bear_time_stop': 20, 'bear_use_sma': True, 'bear_use_ema': True, 'bear_use_atr': True, 'bear_use_adx': False, 'bear_use_spike': True, 'bear_rsi_required': False, 'sideways_strategy': 'breakout', 'sideways_bb_std_mult': 1.737772559121538, 'sideways_rsi_os': 15, 'sideways_rsi_ob': 93, 'sideways_adx_thresh': 20.092957233848058, 'sideways_atr_min_pct': 0.005844094601288143, 'sideways_atr_max_pct': 0.05981792404678551, 'sideways_tp_mult': 2.769046888482898, 'sideways_tsl_mult': 0.5883013424556606, 'sideways_time_stop': 245, 'sideways_use_sma': True, 'sideways_use_ema': True, 'sideways_use_atr': True, 'sideways_use_adx': False, 'sideways_use_spike': False, 'sideways_rsi_required': False}.
[I 2025-08-29 20:03:45,547] Trial 231 finished with values: [-1000000000.0, 1000000000.0] and parameters: {'p_sma': 43, 'p_std': 48, 'p_atr': 25, 'p_adx': 16, 'rsi_period': 33, 'ema1': 20, 'ema2': 46, 'slip_atr_k': 0.025409296292212433, 'slip_spread_k': 0.10950231910744379, 'spread_hl_frac': 0.000786128836047709, 'bb_std_mult': 1.045182308791272, 'rsi_os': 17, 'rsi_ob': 64, 'vol_spike': 0.1951343261166686, 'adx_thresh': 30.821560641521522, 'atr_min_pct': 0.014697004134455648, 'atr_max_pct': 0.044574612762093485, 'tp_mult': 1.6288191054899368, 'tsl_mult': 0.5468498316040135, 'strategy': 'mean_reversion', 'time_stop': 156, 'use_sma': True, 'use_atr': False, 'use_adx': True, 'use_ema': False, 'use_spike': False, 'rsi_required': True, 'edge_k': 1.1224201045255062, 'edge_cap': 0.51357876895966, 'bull_strategy': 'mean_reversion', 'bull_bb_std_mult': 1.5898671783448242, 'bull_rsi_os': 38, 'bull_rsi_ob': 87, 'bull_adx_thresh': 16.54026049165465, 'bull_atr_min_pct': 0.0006341954536639922, 'bull_atr_max_pct': 0.026482416062196, 'bull_tp_mult': 1.449097303678045, 'bull_tsl_mult': 0.11243865065002495, 'bull_time_stop': 167, 'bull_use_sma': True, 'bull_use_ema': True, 'bull_use_atr': False, 'bull_use_adx': True, 'bull_use_spike': True, 'bull_rsi_required': False, 'bear_strategy': 'mean_reversion', 'bear_bb_std_mult': 0.9795432164019395, 'bear_rsi_os': 33, 'bear_rsi_ob': 73, 'bear_adx_thresh': 5.172977908049729, 'bear_atr_min_pct': 0.0044030954458896985, 'bear_atr_max_pct': 0.12007873986320214, 'bear_tp_mult': 1.0967449151322486, 'bear_tsl_mult': 0.48039694571315156, 'bear_time_stop': 70, 'bear_use_sma': True, 'bear_use_ema': True, 'bear_use_atr': True, 'bear_use_adx': False, 'bear_use_spike': True, 'bear_rsi_required': False, 'sideways_strategy': 'breakout', 'sideways_bb_std_mult': 1.7340630157812926, 'sideways_rsi_os': 15, 'sideways_rsi_ob': 83, 'sideways_adx_thresh': 19.951782543078235, 'sideways_atr_min_pct': 0.005996437600331416, 'sideways_atr_max_pct': 0.06005435739493514, 'sideways_tp_mult': 2.7347978161518314, 'sideways_tsl_mult': 0.5736840211317461, 'sideways_time_stop': 237, 'sideways_use_sma': True, 'sideways_use_ema': True, 'sideways_use_atr': True, 'sideways_use_adx': False, 'sideways_use_spike': True, 'sideways_rsi_required': False}.
[I 2025-08-29 20:03:45,653] Trial 233 finished with values: [-1000000000.0, 1000000000.0] and parameters: {'p_sma': 43, 'p_std': 49, 'p_atr': 25, 'p_adx': 25, 'rsi_period': 32, 'ema1': 22, 'ema2': 47, 'slip_atr_k': 0.020799263185082153, 'slip_spread_k': 0.13709255789374436, 'spread_hl_frac': 0.0006111360250508086, 'bb_std_mult': 1.049150866349918, 'rsi_os': 16, 'rsi_ob': 64, 'vol_spike': 0.18609615550473038, 'adx_thresh': 30.514516632369357, 'atr_min_pct': 0.01575080839643593, 'atr_max_pct': 0.028935277003740014, 'tp_mult': 1.715163903781433, 'tsl_mult': 0.5441056171578795, 'strategy': 'mean_reversion', 'time_stop': 168, 'use_sma': True, 'use_atr': False, 'use_adx': False, 'use_ema': False, 'use_spike': False, 'rsi_required': True, 'edge_k': 1.1467913999832509, 'edge_cap': 0.5107373142249735, 'bull_strategy': 'mean_reversion', 'bull_bb_std_mult': 1.565994839542961, 'bull_rsi_os': 39, 'bull_rsi_ob': 95, 'bull_adx_thresh': 17.38872713317098, 'bull_atr_min_pct': 0.0012969667035617656, 'bull_atr_max_pct': 0.025839819477880298, 'bull_tp_mult': 1.46002321420735, 'bull_tsl_mult': 0.09791795731399854, 'bull_time_stop': 167, 'bull_use_sma': True, 'bull_use_ema': True, 'bull_use_atr': False, 'bull_use_adx': True, 'bull_use_spike': True, 'bull_rsi_required': True, 'bear_strategy': 'mean_reversion', 'bear_bb_std_mult': 0.9895559088922866, 'bear_rsi_os': 31, 'bear_rsi_ob': 71, 'bear_adx_thresh': 16.332911233805085, 'bear_atr_min_pct': 0.00432586838078001, 'bear_atr_max_pct': 0.11897846064154581, 'bear_tp_mult': 1.086720773989503, 'bear_tsl_mult': 0.47780206100017375, 'bear_time_stop': 18, 'bear_use_sma': True, 'bear_use_ema': True, 'bear_use_atr': True, 'bear_use_adx': False, 'bear_use_spike': True, 'bear_rsi_required': True, 'sideways_strategy': 'breakout', 'sideways_bb_std_mult': 1.7091139131297786, 'sideways_rsi_os': 14, 'sideways_rsi_ob': 47, 'sideways_adx_thresh': 19.7676940202297, 'sideways_atr_min_pct': 0.004015220770466449, 'sideways_atr_max_pct': 0.060560989499704274, 'sideways_tp_mult': 2.6733226312581184, 'sideways_tsl_mult': 0.65125351285175, 'sideways_time_stop': 242, 'sideways_use_sma': True, 'sideways_use_ema': True, 'sideways_use_atr': True, 'sideways_use_adx': False, 'sideways_use_spike': False, 'sideways_rsi_required': False}.
[I 2025-08-29 20:03:45,935] Trial 232 finished with values: [-1000000000.0, 1000000000.0] and parameters: {'p_sma': 43, 'p_std': 50, 'p_atr': 25, 'p_adx': 28, 'rsi_period': 32, 'ema1': 22, 'ema2': 46, 'slip_atr_k': 0.023235121580347406, 'slip_spread_k': 0.11498449074623535, 'spread_hl_frac': 0.0007847932934250173, 'bb_std_mult': 1.0148843562846732, 'rsi_os': 16, 'rsi_ob': 64, 'vol_spike': 0.19830158961531838, 'adx_thresh': 30.578502128990053, 'atr_min_pct': 0.021817427765432235, 'atr_max_pct': 0.043131909333180694, 'tp_mult': 1.714989010678459, 'tsl_mult': 0.5479483145938208, 'strategy': 'mean_reversion', 'time_stop': 183, 'use_sma': True, 'use_atr': False, 'use_adx': True, 'use_ema': False, 'use_spike': False, 'rsi_required': True, 'edge_k': 1.1737088899849109, 'edge_cap': 0.5128848824174951, 'bull_strategy': 'mean_reversion', 'bull_bb_std_mult': 1.5576888574766024, 'bull_rsi_os': 39, 'bull_rsi_ob': 95, 'bull_adx_thresh': 16.262323226964007, 'bull_atr_min_pct': 0.0012095267976042366, 'bull_atr_max_pct': 0.02606799019360199, 'bull_tp_mult': 1.448886331235667, 'bull_tsl_mult': 0.09143341563588288, 'bull_time_stop': 165, 'bull_use_sma': True, 'bull_use_ema': True, 'bull_use_atr': False, 'bull_use_adx': True, 'bull_use_spike': True, 'bull_rsi_required': False, 'bear_strategy': 'mean_reversion', 'bear_bb_std_mult': 0.9818959431075992, 'bear_rsi_os': 33, 'bear_rsi_ob': 71, 'bear_adx_thresh': 30.75898123821785, 'bear_atr_min_pct': 0.003950306053912509, 'bear_atr_max_pct': 0.1202037179191025, 'bear_tp_mult': 1.0833656208425477, 'bear_tsl_mult': 0.47490225813735887, 'bear_time_stop': 19, 'bear_use_sma': True, 'bear_use_ema': True, 'bear_use_atr': True, 'bear_use_adx': False, 'bear_use_spike': True, 'bear_rsi_required': True, 'sideways_strategy': 'breakout', 'sideways_bb_std_mult': 1.6740616200764677, 'sideways_rsi_os': 15, 'sideways_rsi_ob': 81, 'sideways_adx_thresh': 20.15882661696245, 'sideways_atr_min_pct': 0.004222073870032577, 'sideways_atr_max_pct': 0.06876582388253902, 'sideways_tp_mult': 2.73180496590512, 'sideways_tsl_mult': 0.5882179953230912, 'sideways_time_stop': 244, 'sideways_use_sma': True, 'sideways_use_ema': True, 'sideways_use_atr': True, 'sideways_use_adx': False, 'sideways_use_spike': False, 'sideways_rsi_required': False}.
