[I 2025-08-29 19:47:54,982] Trial 92 finished with values: [-1000000000.0, 1000000000.0] and parameters: {'p_sma': 36, 'p_std': 47, 'p_atr': 10, 'p_adx': 15, 'rsi_period': 20, 'ema1': 11, 'ema2': 48, 'slip_atr_k': 0.03281195117648133, 'slip_spread_k': 0.6352312939074544, 'spread_hl_frac': 0.01762447050235637, 'bb_std_mult': 1.635945360986701, 'rsi_os': 14, 'rsi_ob': 71, 'vol_spike': 0.23029171848332242, 'adx_thresh': 17.084497009451685, 'atr_min_pct': 0.02973170580019889, 'atr_max_pct': 0.07535384055107504, 'tp_mult': 1.7751028057926177, 'tsl_mult': 0.5449451706087478, 'strategy': 'mean_reversion', 'time_stop': 144, 'use_sma': False, 'use_atr': True, 'use_adx': True, 'use_ema': False, 'use_spike': True, 'rsi_required': True, 'edge_k': 1.9023470391866233, 'edge_cap': 0.48118028285372916, 'bull_strategy': 'mean_reversion', 'bull_bb_std_mult': 0.6004401473435919, 'bull_rsi_os': 5, 'bull_rsi_ob': 95, 'bull_adx_thresh': 32.70481917072155, 'bull_atr_min_pct': 0.016790557791153907, 'bull_atr_max_pct': 0.07668482659524281, 'bull_tp_mult': 1.839288667001806, 'bull_tsl_mult': 0.4560629845400458, 'bull_time_stop': 227, 'bull_use_sma': True, 'bull_use_ema': True, 'bull_use_atr': False, 'bull_use_adx': True, 'bull_use_spike': False, 'bull_rsi_required': False, 'bear_strategy': 'breakout', 'bear_bb_std_mult': 1.1315624039427803, 'bear_rsi_os': 23, 'bear_rsi_ob': 65, 'bear_adx_thresh': 7.820233723655877, 'bear_atr_min_pct': 0.025497480965861012, 'bear_atr_max_pct': 0.11303850027539446, 'bear_tp_mult': 2.52618490526231, 'bear_tsl_mult': 0.3013691052611033, 'bear_time_stop': 98, 'bear_use_sma': False, 'bear_use_ema': False, 'bear_use_atr': True, 'bear_use_adx': False, 'bear_use_spike': False, 'bear_rsi_required': False, 'sideways_strategy': 'mean_reversion', 'sideways_bb_std_mult': 1.297376792548971, 'sideways_rsi_os': 39, 'sideways_rsi_ob': 83, 'sideways_adx_thresh': 17.986540618163417, 'sideways_atr_min_pct': 0.017382420721334946, 'sideways_atr_max_pct': 0.12306864992192247, 'sideways_tp_mult': 2.9900066575148925, 'sideways_tsl_mult': 0.6455534322158334, 'sideways_time_stop': 69, 'sideways_use_sma': False, 'sideways_use_ema': True, 'sideways_use_atr': True, 'sideways_use_adx': False, 'sideways_use_spike': False, 'sideways_rsi_required': False}.
[I 2025-08-29 19:47:55,291] Trial 93 finished with values: [-1000000000.0, 1000000000.0] and parameters: {'p_sma': 35, 'p_std': 47, 'p_atr': 17, 'p_adx': 14, 'rsi_period': 18, 'ema1': 11, 'ema2': 39, 'slip_atr_k': 0.11277425691611631, 'slip_spread_k': 0.5861754905695831, 'spread_hl_frac': 0.04349882072773048, 'bb_std_mult': 1.6693453452155127, 'rsi_os': 28, 'rsi_ob': 82, 'vol_spike': 0.2317068101084479, 'adx_thresh': 18.46392748445829, 'atr_min_pct': 0.008167133770026515, 'atr_max_pct': 0.12682103209744935, 'tp_mult': 2.707097404793803, 'tsl_mult': 0.3828561118994272, 'strategy': 'breakout', 'time_stop': 144, 'use_sma': False, 'use_atr': True, 'use_adx': True, 'use_ema': True, 'use_spike': True, 'rsi_required': True, 'edge_k': 0.8343563754653126, 'edge_cap': 0.4903435637722595, 'bull_strategy': 'mean_reversion', 'bull_bb_std_mult': 2.602300628771664, 'bull_rsi_os': 40, 'bull_rsi_ob': 89, 'bull_adx_thresh': 32.47637378342665, 'bull_atr_min_pct': 0.01526853847873969, 'bull_atr_max_pct': 0.07744461150818911, 'bull_tp_mult': 2.7609066922627505, 'bull_tsl_mult': 0.3763655268857228, 'bull_time_stop': 295, 'bull_use_sma': True, 'bull_use_ema': True, 'bull_use_atr': True, 'bull_use_adx': False, 'bull_use_spike': False, 'bull_rsi_required': False, 'bear_strategy': 'breakout', 'bear_bb_std_mult': 2.0612961031060375, 'bear_rsi_os': 10, 'bear_rsi_ob': 58, 'bear_adx_thresh': 9.793320192596617, 'bear_atr_min_pct': 0.0007264314008257194, 'bear_atr_max_pct': 0.06310171730496913, 'bear_tp_mult': 2.7014976514695417, 'bear_tsl_mult': 0.7684454923682387, 'bear_time_stop': 99, 'bear_use_sma': False, 'bear_use_ema': False, 'bear_use_atr': True, 'bear_use_adx': True, 'bear_use_spike': True, 'bear_rsi_required': False, 'sideways_strategy': 'breakout', 'sideways_bb_std_mult': 1.2360156372307698, 'sideways_rsi_os': 48, 'sideways_rsi_ob': 53, 'sideways_adx_thresh': 23.692882369547654, 'sideways_atr_min_pct': 0.02380043331373904, 'sideways_atr_max_pct': 0.13483297475537093, 'sideways_tp_mult': 2.6575046493122185, 'sideways_tsl_mult': 0.4157495265448853, 'sideways_time_stop': 69, 'sideways_use_sma': False, 'sideways_use_ema': False, 'sideways_use_atr': True, 'sideways_use_adx': True, 'sideways_use_spike': False, 'sideways_rsi_required': False}.
[I 2025-08-29 19:47:55,561] Trial 91 finished with values: [-0.004843232588254254, 0.005082531571046519] and parameters: {'p_sma': 49, 'p_std': 47, 'p_atr': 11, 'p_adx': 19, 'rsi_period': 26, 'ema1': 11, 'ema2': 48, 'slip_atr_k': 0.03309174660617017, 'slip_spread_k': 0.6350700641114448, 'spread_hl_frac': 0.048589186789855986, 'bb_std_mult': 1.601247300989495, 'rsi_os': 28, 'rsi_ob': 69, 'vol_spike': 0.2798714981651297, 'adx_thresh': 17.16996927798496, 'atr_min_pct': 0.0008575625841748463, 'atr_max_pct': 0.07459409313250233, 'tp_mult': 1.773877613748592, 'tsl_mult': 0.37211117359268525, 'strategy': 'mean_reversion', 'time_stop': 74, 'use_sma': False, 'use_atr': True, 'use_adx': True, 'use_ema': False, 'use_spike': True, 'rsi_required': True, 'edge_k': 1.8869573048159185, 'edge_cap': 0.47761281724534804, 'bull_strategy': 'mean_reversion', 'bull_bb_std_mult': 0.5668847587013033, 'bull_rsi_os': 34, 'bull_rsi_ob': 89, 'bull_adx_thresh': 13.358721899752219, 'bull_atr_min_pct': 0.017126023882909194, 'bull_atr_max_pct': 0.07631426424172255, 'bull_tp_mult': 1.1483449944849347, 'bull_tsl_mult': 0.37231874086603883, 'bull_time_stop': 229, 'bull_use_sma': True, 'bull_use_ema': True, 'bull_use_atr': False, 'bull_use_adx': True, 'bull_use_spike': False, 'bull_rsi_required': False, 'bear_strategy': 'breakout', 'bear_bb_std_mult': 0.9624442335604788, 'bear_rsi_os': 21, 'bear_rsi_ob': 57, 'bear_adx_thresh': 18.891608971664255, 'bear_atr_min_pct': 0.0022613637333287074, 'bear_atr_max_pct': 0.09197368124366272, 'bear_tp_mult': 2.834335868756117, 'bear_tsl_mult': 0.7571279697034852, 'bear_time_stop': 269, 'bear_use_sma': True, 'bear_use_ema': False, 'bear_use_atr': True, 'bear_use_adx': False, 'bear_use_spike': False, 'bear_rsi_required': False, 'sideways_strategy': 'mean_reversion', 'sideways_bb_std_mult': 0.9553814001048919, 'sideways_rsi_os': 9, 'sideways_rsi_ob': 53, 'sideways_adx_thresh': 32.63040069927525, 'sideways_atr_min_pct': 0.024481967858440278, 'sideways_atr_max_pct': 0.12377919014723301, 'sideways_tp_mult': 2.9927947962108035, 'sideways_tsl_mult': 0.20526091861123247, 'sideways_time_stop': 66, 'sideways_use_sma': False, 'sideways_use_ema': True, 'sideways_use_atr': True, 'sideways_use_adx': False, 'sideways_use_spike': False, 'sideways_rsi_required': False}.
[I 2025-08-29 19:47:55,575] Trial 90 finished with values: [-1000000000.0, 1000000000.0] and parameters: {'p_sma': 49, 'p_std': 51, 'p_atr': 11, 'p_adx': 23, 'rsi_period': 53, 'ema1': 10, 'ema2': 39, 'slip_atr_k': 0.027749312246761623, 'slip_spread_k': 0.586762503755335, 'spread_hl_frac': 0.03950857894146099, 'bb_std_mult': 1.6278163008858826, 'rsi_os': 28, 'rsi_ob': 69, 'vol_spike': 0.27292474203302314, 'adx_thresh': 7.398104113431739, 'atr_min_pct': 0.0245664672750127, 'atr_max_pct': 0.0757222127546792, 'tp_mult': 1.756873699209002, 'tsl_mult': 0.44422439418155546, 'strategy': 'mean_reversion', 'time_stop': 140, 'use_sma': True, 'use_atr': True, 'use_adx': True, 'use_ema': False, 'use_spike': True, 'rsi_required': True, 'edge_k': 1.8490402510232793, 'edge_cap': 0.35441777656507656, 'bull_strategy': 'mean_reversion', 'bull_bb_std_mult': 2.4399352010390345, 'bull_rsi_os': 33, 'bull_rsi_ob': 74, 'bull_adx_thresh': 13.362234978314858, 'bull_atr_min_pct': 0.025979382576873024, 'bull_atr_max_pct': 0.057966059882030074, 'bull_tp_mult': 1.2160444185695325, 'bull_tsl_mult': 0.7048753479424734, 'bull_time_stop': 227, 'bull_use_sma': False, 'bull_use_ema': True, 'bull_use_atr': False, 'bull_use_adx': True, 'bull_use_spike': False, 'bull_rsi_required': False, 'bear_strategy': 'breakout', 'bear_bb_std_mult': 0.9795445418952672, 'bear_rsi_os': 17, 'bear_rsi_ob': 67, 'bear_adx_thresh': 28.979943619188056, 'bear_atr_min_pct': 0.0008513068276011799, 'bear_atr_max_pct': 0.04691993121596176, 'bear_tp_mult': 2.819157692344281, 'bear_tsl_mult': 0.26696511210960505, 'bear_time_stop': 173, 'bear_use_sma': True, 'bear_use_ema': False, 'bear_use_atr': True, 'bear_use_adx': False, 'bear_use_spike': False, 'bear_rsi_required': False, 'sideways_strategy': 'mean_reversion', 'sideways_bb_std_mult': 1.3111736416846156, 'sideways_rsi_os': 37, 'sideways_rsi_ob': 83, 'sideways_adx_thresh': 18.132532222321817, 'sideways_atr_min_pct': 0.026374487576863264, 'sideways_atr_max_pct': 0.11910236669834667, 'sideways_tp_mult': 1.506345499066176, 'sideways_tsl_mult': 0.5721674720092129, 'sideways_time_stop': 53, 'sideways_use_sma': False, 'sideways_use_ema': True, 'sideways_use_atr': True, 'sideways_use_adx': False, 'sideways_use_spike': False, 'sideways_rsi_required': True}.
[I 2025-08-29 19:47:55,961] Trial 97 finished with values: [-1000000000.0, 1000000000.0] and parameters: {'p_sma': 59, 'p_std': 17, 'p_atr': 28, 'p_adx': 21, 'rsi_period': 14, 'ema1': 16, 'ema2': 58, 'slip_atr_k': 0.13738104045594604, 'slip_spread_k': 0.7897845774992247, 'spread_hl_frac': 0.04900010955998076, 'bb_std_mult': 0.985085910843888, 'rsi_os': 24, 'rsi_ob': 91, 'vol_spike': 0.1268339211476403, 'adx_thresh': 25.84119039791211, 'atr_min_pct': 0.017955323622976065, 'atr_max_pct': 0.012079399737067634, 'tp_mult': 2.9382356901879976, 'tsl_mult': 0.5042669938503429, 'strategy': 'breakout', 'time_stop': 129, 'use_sma': False, 'use_atr': False, 'use_adx': True, 'use_ema': False, 'use_spike': True, 'rsi_required': False, 'edge_k': 1.7693419865208733, 'edge_cap': 0.42653457936609773, 'bull_strategy': 'mean_reversion', 'bull_bb_std_mult': 3.4332829921643584, 'bull_rsi_os': 40, 'bull_rsi_ob': 65, 'bull_adx_thresh': 22.464595039305028, 'bull_atr_min_pct': 0.029066792872432662, 'bull_atr_max_pct': 0.06915588332878786, 'bull_tp_mult': 2.9495144865714127, 'bull_tsl_mult': 0.3124546114985831, 'bull_time_stop': 115, 'bull_use_sma': True, 'bull_use_ema': False, 'bull_use_atr': False, 'bull_use_adx': True, 'bull_use_spike': True, 'bull_rsi_required': False, 'bear_strategy': 'mean_reversion', 'bear_bb_std_mult': 0.6884561432925953, 'bear_rsi_os': 12, 'bear_rsi_ob': 65, 'bear_adx_thresh': 8.818709727913635, 'bear_atr_min_pct': 0.0022006686294554507, 'bear_atr_max_pct': 0.09895866147939794, 'bear_tp_mult': 1.4794495481671275, 'bear_tsl_mult': 0.9340636615367995, 'bear_time_stop': 152, 'bear_use_sma': True, 'bear_use_ema': False, 'bear_use_atr': True, 'bear_use_adx': False, 'bear_use_spike': False, 'bear_rsi_required': True, 'sideways_strategy': 'mean_reversion', 'sideways_bb_std_mult': 1.0731024269410718, 'sideways_rsi_os': 27, 'sideways_rsi_ob': 92, 'sideways_adx_thresh': 20.325988801507982, 'sideways_atr_min_pct': 0.020944129338832048, 'sideways_atr_max_pct': 0.1304443637603059, 'sideways_tp_mult': 2.338640819206666, 'sideways_tsl_mult': 0.10639652423703559, 'sideways_time_stop': 246, 'sideways_use_sma': True, 'sideways_use_ema': True, 'sideways_use_atr': False, 'sideways_use_adx': False, 'sideways_use_spike': False, 'sideways_rsi_required': False}.
[I 2025-08-29 19:48:24,149] Trial 94 finished with values: [-0.09021704680466902, 0.09024684682887568] and parameters: {'p_sma': 59, 'p_std': 15, 'p_atr': 9, 'p_adx': 25, 'rsi_period': 12, 'ema1': 26, 'ema2': 39, 'slip_atr_k': 0.025776406974457086, 'slip_spread_k': 0.5837584223924577, 'spread_hl_frac': 0.039852917030782115, 'bb_std_mult': 1.8840493879289555, 'rsi_os': 24, 'rsi_ob': 73, 'vol_spike': 0.28030889672657106, 'adx_thresh': 30.65298660695141, 'atr_min_pct': 0.007604711467154549, 'atr_max_pct': 0.12740404952778067, 'tp_mult': 2.3446527955924945, 'tsl_mult': 0.5039752212302644, 'strategy': 'breakout', 'time_stop': 180, 'use_sma': False, 'use_atr': False, 'use_adx': True, 'use_ema': True, 'use_spike': True, 'rsi_required': True, 'edge_k': 1.4435955304006094, 'edge_cap': 0.43403303983237335, 'bull_strategy': 'mean_reversion', 'bull_bb_std_mult': 3.4105612791023576, 'bull_rsi_os': 41, 'bull_rsi_ob': 89, 'bull_adx_thresh': 17.091108925154415, 'bull_atr_min_pct': 0.015259669403211292, 'bull_atr_max_pct': 0.07390409200835532, 'bull_tp_mult': 2.93477800645921, 'bull_tsl_mult': 0.38050184954487964, 'bull_time_stop': 256, 'bull_use_sma': True, 'bull_use_ema': False, 'bull_use_atr': True, 'bull_use_adx': True, 'bull_use_spike': True, 'bull_rsi_required': False, 'bear_strategy': 'breakout', 'bear_bb_std_mult': 0.9646357156027745, 'bear_rsi_os': 32, 'bear_rsi_ob': 65, 'bear_adx_thresh': 9.920306313172603, 'bear_atr_min_pct': 0.0005783491281273192, 'bear_atr_max_pct': 0.02059303841860461, 'bear_tp_mult': 2.7046908458901404, 'bear_tsl_mult': 0.6157256773943935, 'bear_time_stop': 268, 'bear_use_sma': True, 'bear_use_ema': False, 'bear_use_atr': True, 'bear_use_adx': True, 'bear_use_spike': False, 'bear_rsi_required': True, 'sideways_strategy': 'mean_reversion', 'sideways_bb_std_mult': 1.2900308206285662, 'sideways_rsi_os': 26, 'sideways_rsi_ob': 85, 'sideways_adx_thresh': 23.69994253916463, 'sideways_atr_min_pct': 0.02379932291417892, 'sideways_atr_max_pct': 0.12899423020800982, 'sideways_tp_mult': 2.8727320783522874, 'sideways_tsl_mult': 0.5667815382787796, 'sideways_time_stop': 120, 'sideways_use_sma': True, 'sideways_use_ema': False, 'sideways_use_atr': False, 'sideways_use_adx': False, 'sideways_use_spike': False, 'sideways_rsi_required': False}.
[I 2025-08-29 19:48:25,091] Trial 98 finished with values: [-1000000000.0, 1000000000.0] and parameters: {'p_sma': 10, 'p_std': 44, 'p_atr': 9, 'p_adx': 8, 'rsi_period': 11, 'ema1': 18, 'ema2': 44, 'slip_atr_k': 0.2148351614514173, 'slip_spread_k': 0.9806446258002135, 'spread_hl_frac': 0.04864220595306851, 'bb_std_mult': 1.8701888459558105, 'rsi_os': 24, 'rsi_ob': 73, 'vol_spike': 0.19302680681749385, 'adx_thresh': 30.488756307414725, 'atr_min_pct': 0.0011534351651469102, 'atr_max_pct': 0.06587510133513008, 'tp_mult': 2.65345068760936, 'tsl_mult': 0.32602708787248674, 'strategy': 'breakout', 'time_stop': 218, 'use_sma': False, 'use_atr': True, 'use_adx': True, 'use_ema': True, 'use_spike': True, 'rsi_required': True, 'edge_k': 1.4539253333818911, 'edge_cap': 0.5737970125539801, 'bull_strategy': 'mean_reversion', 'bull_bb_std_mult': 2.7108212294827654, 'bull_rsi_os': 13, 'bull_rsi_ob': 93, 'bull_adx_thresh': 16.976681634291655, 'bull_atr_min_pct': 0.0070350481990357604, 'bull_atr_max_pct': 0.0712784917925606, 'bull_tp_mult': 2.31445476365468, 'bull_tsl_mult': 0.776010307999863, 'bull_time_stop': 256, 'bull_use_sma': True, 'bull_use_ema': True, 'bull_use_atr': True, 'bull_use_adx': False, 'bull_use_spike': True, 'bull_rsi_required': False, 'bear_strategy': 'breakout', 'bear_bb_std_mult': 1.3707321282250922, 'bear_rsi_os': 33, 'bear_rsi_ob': 73, 'bear_adx_thresh': 24.544078885925963, 'bear_atr_min_pct': 0.012878678780713219, 'bear_atr_max_pct': 0.1449401132284595, 'bear_tp_mult': 2.837279853652103, 'bear_tsl_mult': 0.5787925851590484, 'bear_time_stop': 275, 'bear_use_sma': True, 'bear_use_ema': True, 'bear_use_atr': True, 'bear_use_adx': True, 'bear_use_spike': True, 'bear_rsi_required': False, 'sideways_strategy': 'breakout', 'sideways_bb_std_mult': 0.9561424110771615, 'sideways_rsi_os': 17, 'sideways_rsi_ob': 85, 'sideways_adx_thresh': 14.0954385582833, 'sideways_atr_min_pct': 0.01917391995266668, 'sideways_atr_max_pct': 0.12924387701578816, 'sideways_tp_mult': 2.7762141095463635, 'sideways_tsl_mult': 0.5182352602921765, 'sideways_time_stop': 120, 'sideways_use_sma': True, 'sideways_use_ema': False, 'sideways_use_atr': True, 'sideways_use_adx': True, 'sideways_use_spike': False, 'sideways_rsi_required': False}.
[I 2025-08-29 19:48:25,392] Trial 96 finished with values: [-1000000000.0, 1000000000.0] and parameters: {'p_sma': 46, 'p_std': 51, 'p_atr': 9, 'p_adx': 21, 'rsi_period': 12, 'ema1': 21, 'ema2': 59, 'slip_atr_k': 0.218649493673708, 'slip_spread_k': 0.7826996517941371, 'spread_hl_frac': 0.03988864046639046, 'bb_std_mult': 0.9786415254310066, 'rsi_os': 24, 'rsi_ob': 73, 'vol_spike': 0.12706652938804192, 'adx_thresh': 25.151908650747238, 'atr_min_pct': 0.0010794962716831635, 'atr_max_pct': 0.08287108446359362, 'tp_mult': 2.9115431845133473, 'tsl_mult': 0.49735357430405763, 'strategy': 'breakout', 'time_stop': 285, 'use_sma': False, 'use_atr': False, 'use_adx': True, 'use_ema': False, 'use_spike': True, 'rsi_required': False, 'edge_k': 1.4605247080977997, 'edge_cap': 0.42971695657616243, 'bull_strategy': 'mean_reversion', 'bull_bb_std_mult': 2.433837958651367, 'bull_rsi_os': 34, 'bull_rsi_ob': 93, 'bull_adx_thresh': 22.684539272074474, 'bull_atr_min_pct': 0.025667550161102552, 'bull_atr_max_pct': 0.07207097711365447, 'bull_tp_mult': 2.9642680095280136, 'bull_tsl_mult': 0.31452623538069757, 'bull_time_stop': 258, 'bull_use_sma': True, 'bull_use_ema': False, 'bull_use_atr': False, 'bull_use_adx': True, 'bull_use_spike': True, 'bull_rsi_required': False, 'bear_strategy': 'mean_reversion', 'bear_bb_std_mult': 0.9938684565191962, 'bear_rsi_os': 10, 'bear_rsi_ob': 91, 'bear_adx_thresh': 22.378872109398436, 'bear_atr_min_pct': 0.002182391682280335, 'bear_atr_max_pct': 0.07293819951610629, 'bear_tp_mult': 1.0767723597092347, 'bear_tsl_mult': 0.2545689505155764, 'bear_time_stop': 153, 'bear_use_sma': True, 'bear_use_ema': False, 'bear_use_atr': True, 'bear_use_adx': False, 'bear_use_spike': False, 'bear_rsi_required': False, 'sideways_strategy': 'mean_reversion', 'sideways_bb_std_mult': 1.0617832005139154, 'sideways_rsi_os': 17, 'sideways_rsi_ob': 65, 'sideways_adx_thresh': 19.91916709693978, 'sideways_atr_min_pct': 0.014722112018518025, 'sideways_atr_max_pct': 0.12942288443552405, 'sideways_tp_mult': 2.871047025801061, 'sideways_tsl_mult': 0.5512240879272234, 'sideways_time_stop': 121, 'sideways_use_sma': True, 'sideways_use_ema': True, 'sideways_use_atr': True, 'sideways_use_adx': False, 'sideways_use_spike': False, 'sideways_rsi_required': False}.
[I 2025-08-29 19:48:25,483] Trial 95 finished with values: [-1000000000.0, 1000000000.0] and parameters: {'p_sma': 21, 'p_std': 50, 'p_atr': 29, 'p_adx': 21, 'rsi_period': 72, 'ema1': 26, 'ema2': 18, 'slip_atr_k': 0.13432992110431136, 'slip_spread_k': 0.7850085607922231, 'spread_hl_frac': 0.048639950913808884, 'bb_std_mult': 1.4186551446935733, 'rsi_os': 24, 'rsi_ob': 91, 'vol_spike': 0.27648946126460716, 'adx_thresh': 21.833493701891207, 'atr_min_pct': 0.0008037410624680066, 'atr_max_pct': 0.08104304879551306, 'tp_mult': 2.2803515810753034, 'tsl_mult': 0.49907950539468493, 'strategy': 'breakout', 'time_stop': 290, 'use_sma': False, 'use_atr': False, 'use_adx': True, 'use_ema': False, 'use_spike': True, 'rsi_required': True, 'edge_k': 1.8723323503115001, 'edge_cap': 0.694305900136131, 'bull_strategy': 'mean_reversion', 'bull_bb_std_mult': 2.414907684453695, 'bull_rsi_os': 41, 'bull_rsi_ob': 89, 'bull_adx_thresh': 16.995992014614032, 'bull_atr_min_pct': 0.025483924367270122, 'bull_atr_max_pct': 0.07083819643022554, 'bull_tp_mult': 2.9386877551846893, 'bull_tsl_mult': 0.8136552831556298, 'bull_time_stop': 116, 'bull_use_sma': True, 'bull_use_ema': False, 'bull_use_atr': False, 'bull_use_adx': True, 'bull_use_spike': True, 'bull_rsi_required': False, 'bear_strategy': 'breakout', 'bear_bb_std_mult': 1.0010583459697553, 'bear_rsi_os': 32, 'bear_rsi_ob': 90, 'bear_adx_thresh': 21.933936749899956, 'bear_atr_min_pct': 0.0036047125333747085, 'bear_atr_max_pct': 0.022745116059703564, 'bear_tp_mult': 2.8255540838638376, 'bear_tsl_mult': 0.6143636255250374, 'bear_time_stop': 113, 'bear_use_sma': True, 'bear_use_ema': True, 'bear_use_atr': True, 'bear_use_adx': False, 'bear_use_spike': False, 'bear_rsi_required': True, 'sideways_strategy': 'mean_reversion', 'sideways_bb_std_mult': 0.9563879000707872, 'sideways_rsi_os': 26, 'sideways_rsi_ob': 80, 'sideways_adx_thresh': 20.30168417850889, 'sideways_atr_min_pct': 0.00851903256752174, 'sideways_atr_max_pct': 0.13047981308639484, 'sideways_tp_mult': 1.8394849668724633, 'sideways_tsl_mult': 0.11321108339725287, 'sideways_time_stop': 120, 'sideways_use_sma': True, 'sideways_use_ema': True, 'sideways_use_atr': False, 'sideways_use_adx': False, 'sideways_use_spike': False, 'sideways_rsi_required': False}.
