[I 2025-08-29 20:52:08,369] Trial 648 finished with values: [-0.0031184649686525345, 0.003730608304195885] and parameters: {'p_sma': 23, 'p_std': 57, 'p_atr': 24, 'p_adx': 14, 'rsi_period': 41, 'ema1': 26, 'ema2': 48, 'slip_atr_k': 0.014479822649874722, 'slip_spread_k': 0.2030692354128805, 'spread_hl_frac': 0.0484513974008618, 'bb_std_mult': 1.974494867658756, 'rsi_os': 30, 'rsi_ob': 82, 'vol_spike': 0.18368546547534215, 'adx_thresh': 19.793698348221724, 'atr_min_pct': 0.019762566514674174, 'atr_max_pct': 0.09536817512096486, 'tp_mult': 1.1876461781817564, 'tsl_mult': 0.24730147368437738, 'strategy': 'mean_reversion', 'time_stop': 206, 'use_sma': True, 'use_atr': False, 'use_adx': False, 'use_ema': True, 'use_spike': False, 'rsi_required': False, 'edge_k': 1.0296263992573542, 'edge_cap': 0.9826127841510633, 'bull_strategy': 'mean_reversion', 'bull_bb_std_mult': 3.148581353296083, 'bull_rsi_os': 5, 'bull_rsi_ob': 64, 'bull_adx_thresh': 13.821594771894409, 'bull_atr_min_pct': 0.015014086192099329, 'bull_atr_max_pct': 0.0892143116119369, 'bull_tp_mult': 2.8534427063677157, 'bull_tsl_mult': 0.9234571858792884, 'bull_time_stop': 34, 'bull_use_sma': True, 'bull_use_ema': False, 'bull_use_atr': False, 'bull_use_adx': False, 'bull_use_spike': True, 'bull_rsi_required': False, 'bear_strategy': 'breakout', 'bear_bb_std_mult': 2.7991421796574625, 'bear_rsi_os': 51, 'bear_rsi_ob': 56, 'bear_adx_thresh': 24.24461730659912, 'bear_atr_min_pct': 0.00482377331898919, 'bear_atr_max_pct': 0.07042613959195879, 'bear_tp_mult': 2.646522939874733, 'bear_tsl_mult': 0.9538303254974357, 'bear_time_stop': 44, 'bear_use_sma': False, 'bear_use_ema': True, 'bear_use_atr': False, 'bear_use_adx': True, 'bear_use_spike': True, 'bear_rsi_required': False, 'sideways_strategy': 'breakout', 'sideways_bb_std_mult': 1.0630618899767375, 'sideways_rsi_os': 35, 'sideways_rsi_ob': 89, 'sideways_adx_thresh': 9.478767673460021, 'sideways_atr_min_pct': 0.011308795241198589, 'sideways_atr_max_pct': 0.02716631724854594, 'sideways_tp_mult': 1.4599189492451972, 'sideways_tsl_mult': 0.45747451748219126, 'sideways_time_stop': 171, 'sideways_use_sma': False, 'sideways_use_ema': False, 'sideways_use_atr': True, 'sideways_use_adx': False, 'sideways_use_spike': False, 'sideways_rsi_required': False}.
[I 2025-08-29 20:52:08,381] Trial 647 finished with values: [-1000000000.0, 1000000000.0] and parameters: {'p_sma': 23, 'p_std': 57, 'p_atr': 13, 'p_adx': 25, 'rsi_period': 82, 'ema1': 28, 'ema2': 26, 'slip_atr_k': 0.007677540328452691, 'slip_spread_k': 0.22442059900960157, 'spread_hl_frac': 0.027163694730386177, 'bb_std_mult': 1.8205311195606853, 'rsi_os': 8, 'rsi_ob': 82, 'vol_spike': 0.10146456804311088, 'adx_thresh': 13.66303058812437, 'atr_min_pct': 0.018828448822201263, 'atr_max_pct': 0.02771437563456816, 'tp_mult': 1.2339038596053802, 'tsl_mult': 0.8723376511417678, 'strategy': 'breakout', 'time_stop': 162, 'use_sma': True, 'use_atr': True, 'use_adx': False, 'use_ema': True, 'use_spike': False, 'rsi_required': False, 'edge_k': 1.1090180033608763, 'edge_cap': 0.9851930771838879, 'bull_strategy': 'mean_reversion', 'bull_bb_std_mult': 3.1316458035683588, 'bull_rsi_os': 14, 'bull_rsi_ob': 68, 'bull_adx_thresh': 13.662053342960403, 'bull_atr_min_pct': 0.0150250090972457, 'bull_atr_max_pct': 0.0998690107420984, 'bull_tp_mult': 2.780787319304461, 'bull_tsl_mult': 0.9755963444677167, 'bull_time_stop': 53, 'bull_use_sma': True, 'bull_use_ema': False, 'bull_use_atr': True, 'bull_use_adx': False, 'bull_use_spike': True, 'bull_rsi_required': False, 'bear_strategy': 'breakout', 'bear_bb_std_mult': 2.5438198368460108, 'bear_rsi_os': 25, 'bear_rsi_ob': 66, 'bear_adx_thresh': 29.490452990232257, 'bear_atr_min_pct': 0.008914046493552756, 'bear_atr_max_pct': 0.04778938260498612, 'bear_tp_mult': 2.6493569056721036, 'bear_tsl_mult': 0.8804021478885172, 'bear_time_stop': 241, 'bear_use_sma': True, 'bear_use_ema': True, 'bear_use_atr': False, 'bear_use_adx': True, 'bear_use_spike': True, 'bear_rsi_required': False, 'sideways_strategy': 'breakout', 'sideways_bb_std_mult': 2.2721776602020283, 'sideways_rsi_os': 21, 'sideways_rsi_ob': 79, 'sideways_adx_thresh': 32.129634740101864, 'sideways_atr_min_pct': 0.006302572579096234, 'sideways_atr_max_pct': 0.07448520860853848, 'sideways_tp_mult': 1.0117980117885106, 'sideways_tsl_mult': 0.463975683055513, 'sideways_time_stop': 185, 'sideways_use_sma': False, 'sideways_use_ema': False, 'sideways_use_atr': False, 'sideways_use_adx': False, 'sideways_use_spike': False, 'sideways_rsi_required': False}.
[I 2025-08-29 20:52:08,606] Trial 649 finished with values: [-1000000000.0, 1000000000.0] and parameters: {'p_sma': 23, 'p_std': 29, 'p_atr': 24, 'p_adx': 14, 'rsi_period': 41, 'ema1': 26, 'ema2': 48, 'slip_atr_k': 0.1799306644751702, 'slip_spread_k': 0.19550765434519118, 'spread_hl_frac': 0.04842057862928128, 'bb_std_mult': 2.0320254890832286, 'rsi_os': 7, 'rsi_ob': 82, 'vol_spike': 0.18593698101776823, 'adx_thresh': 10.29808508717563, 'atr_min_pct': 0.01987812574687372, 'atr_max_pct': 0.09858740381244319, 'tp_mult': 1.6107572443958411, 'tsl_mult': 0.9210655672834933, 'strategy': 'mean_reversion', 'time_stop': 289, 'use_sma': True, 'use_atr': False, 'use_adx': False, 'use_ema': True, 'use_spike': False, 'rsi_required': False, 'edge_k': 1.0222743545703887, 'edge_cap': 0.5584931605741881, 'bull_strategy': 'mean_reversion', 'bull_bb_std_mult': 3.140772457245779, 'bull_rsi_os': 23, 'bull_rsi_ob': 73, 'bull_adx_thresh': 16.03722026284494, 'bull_atr_min_pct': 0.014876565909644599, 'bull_atr_max_pct': 0.10111779536056942, 'bull_tp_mult': 2.703736088875037, 'bull_tsl_mult': 0.9436338503735191, 'bull_time_stop': 39, 'bull_use_sma': True, 'bull_use_ema': False, 'bull_use_atr': False, 'bull_use_adx': False, 'bull_use_spike': True, 'bull_rsi_required': False, 'bear_strategy': 'breakout', 'bear_bb_std_mult': 2.5458837268589116, 'bear_rsi_os': 25, 'bear_rsi_ob': 56, 'bear_adx_thresh': 19.808661396828114, 'bear_atr_min_pct': 0.004995071526955734, 'bear_atr_max_pct': 0.04771136110273563, 'bear_tp_mult': 2.6517978501634785, 'bear_tsl_mult': 0.9539491465979594, 'bear_time_stop': 48, 'bear_use_sma': False, 'bear_use_ema': True, 'bear_use_atr': False, 'bear_use_adx': True, 'bear_use_spike': True, 'bear_rsi_required': False, 'sideways_strategy': 'breakout', 'sideways_bb_std_mult': 2.473629952041174, 'sideways_rsi_os': 46, 'sideways_rsi_ob': 77, 'sideways_adx_thresh': 31.10869752329825, 'sideways_atr_min_pct': 0.006116303362950475, 'sideways_atr_max_pct': 0.027615397461151454, 'sideways_tp_mult': 1.6631373289114475, 'sideways_tsl_mult': 0.47391384285340465, 'sideways_time_stop': 186, 'sideways_use_sma': False, 'sideways_use_ema': False, 'sideways_use_atr': True, 'sideways_use_adx': False, 'sideways_use_spike': False, 'sideways_rsi_required': False}.
[I 2025-08-29 20:52:09,372] Trial 653 finished with values: [-1000000000.0, 1000000000.0] and parameters: {'p_sma': 6, 'p_std': 28, 'p_atr': 25, 'p_adx': 13, 'rsi_period': 47, 'ema1': 25, 'ema2': 45, 'slip_atr_k': 0.0003431511689993977, 'slip_spread_k': 0.3579750838992446, 'spread_hl_frac': 0.04451478888803976, 'bb_std_mult': 1.4491730786277837, 'rsi_os': 7, 'rsi_ob': 52, 'vol_spike': 0.19603898927136132, 'adx_thresh': 14.50231399182792, 'atr_min_pct': 0.016251756502801036, 'atr_max_pct': 0.014602170363232511, 'tp_mult': 1.4760589809478333, 'tsl_mult': 0.8846282530170384, 'strategy': 'mean_reversion', 'time_stop': 173, 'use_sma': True, 'use_atr': False, 'use_adx': True, 'use_ema': False, 'use_spike': True, 'rsi_required': False, 'edge_k': 0.7885101723469115, 'edge_cap': 0.5612676029989164, 'bull_strategy': 'mean_reversion', 'bull_bb_std_mult': 3.0706578298051186, 'bull_rsi_os': 24, 'bull_rsi_ob': 69, 'bull_adx_thresh': 12.364021411230528, 'bull_atr_min_pct': 0.01580815194050217, 'bull_atr_max_pct': 0.1476368007159636, 'bull_tp_mult': 1.8329329809601835, 'bull_tsl_mult': 0.7020527365311781, 'bull_time_stop': 158, 'bull_use_sma': True, 'bull_use_ema': True, 'bull_use_atr': True, 'bull_use_adx': False, 'bull_use_spike': False, 'bull_rsi_required': False, 'bear_strategy': 'breakout', 'bear_bb_std_mult': 1.3193475751879122, 'bear_rsi_os': 27, 'bear_rsi_ob': 65, 'bear_adx_thresh': 12.09666861030514, 'bear_atr_min_pct': 0.006854025846857651, 'bear_atr_max_pct': 0.08021609196191756, 'bear_tp_mult': 2.3414096895090317, 'bear_tsl_mult': 0.9065830980244803, 'bear_time_stop': 174, 'bear_use_sma': False, 'bear_use_ema': True, 'bear_use_atr': False, 'bear_use_adx': False, 'bear_use_spike': True, 'bear_rsi_required': False, 'sideways_strategy': 'mean_reversion', 'sideways_bb_std_mult': 2.4658155370637362, 'sideways_rsi_os': 11, 'sideways_rsi_ob': 80, 'sideways_adx_thresh': 33.90327093983903, 'sideways_atr_min_pct': 0.0025592804221956965, 'sideways_atr_max_pct': 0.023614171869661135, 'sideways_tp_mult': 1.0492869455992198, 'sideways_tsl_mult': 0.7696645911066348, 'sideways_time_stop': 196, 'sideways_use_sma': False, 'sideways_use_ema': False, 'sideways_use_atr': False, 'sideways_use_adx': False, 'sideways_use_spike': False, 'sideways_rsi_required': True}.
[I 2025-08-29 20:52:09,375] Trial 654 finished with values: [-1000000000.0, 1000000000.0] and parameters: {'p_sma': 15, 'p_std': 14, 'p_atr': 25, 'p_adx': 13, 'rsi_period': 37, 'ema1': 25, 'ema2': 44, 'slip_atr_k': 0.0007888581415710144, 'slip_spread_k': 0.1549862672220748, 'spread_hl_frac': 0.044188918672353375, 'bb_std_mult': 1.6243670701718536, 'rsi_os': 10, 'rsi_ob': 77, 'vol_spike': 0.08077105432183795, 'adx_thresh': 14.734865005268095, 'atr_min_pct': 0.021340571538345347, 'atr_max_pct': 0.01519321582423147, 'tp_mult': 1.4184920570877926, 'tsl_mult': 0.8950448958704402, 'strategy': 'mean_reversion', 'time_stop': 300, 'use_sma': True, 'use_atr': False, 'use_adx': True, 'use_ema': False, 'use_spike': True, 'rsi_required': False, 'edge_k': 0.9162994854637776, 'edge_cap': 0.9104483880050561, 'bull_strategy': 'mean_reversion', 'bull_bb_std_mult': 2.535127750367648, 'bull_rsi_os': 24, 'bull_rsi_ob': 85, 'bull_adx_thresh': 14.670612646452183, 'bull_atr_min_pct': 0.01564225098910524, 'bull_atr_max_pct': 0.11179760440009823, 'bull_tp_mult': 2.210884369477714, 'bull_tsl_mult': 0.8759285507948565, 'bull_time_stop': 163, 'bull_use_sma': True, 'bull_use_ema': True, 'bull_use_atr': True, 'bull_use_adx': False, 'bull_use_spike': False, 'bull_rsi_required': False, 'bear_strategy': 'breakout', 'bear_bb_std_mult': 2.6435827696590373, 'bear_rsi_os': 28, 'bear_rsi_ob': 65, 'bear_adx_thresh': 31.642733914861502, 'bear_atr_min_pct': 0.006771356658442738, 'bear_atr_max_pct': 0.05168417394860301, 'bear_tp_mult': 2.5958375710189387, 'bear_tsl_mult': 0.9137377201842783, 'bear_time_stop': 67, 'bear_use_sma': False, 'bear_use_ema': True, 'bear_use_atr': False, 'bear_use_adx': False, 'bear_use_spike': True, 'bear_rsi_required': False, 'sideways_strategy': 'mean_reversion', 'sideways_bb_std_mult': 0.5134047385542349, 'sideways_rsi_os': 53, 'sideways_rsi_ob': 59, 'sideways_adx_thresh': 33.84196661380598, 'sideways_atr_min_pct': 0.002246706867563576, 'sideways_atr_max_pct': 0.09550271840938265, 'sideways_tp_mult': 1.3841175528543102, 'sideways_tsl_mult': 0.687177575724375, 'sideways_time_stop': 295, 'sideways_use_sma': False, 'sideways_use_ema': True, 'sideways_use_atr': False, 'sideways_use_adx': True, 'sideways_use_spike': False, 'sideways_rsi_required': True}.
[I 2025-08-29 20:52:33,912] Trial 652 finished with values: [-1000000000.0, 1000000000.0] and parameters: {'p_sma': 19, 'p_std': 14, 'p_atr': 25, 'p_adx': 26, 'rsi_period': 37, 'ema1': 25, 'ema2': 45, 'slip_atr_k': 0.23550584817927073, 'slip_spread_k': 0.3564800488779607, 'spread_hl_frac': 0.04869559400493456, 'bb_std_mult': 1.6143849258715088, 'rsi_os': 7, 'rsi_ob': 52, 'vol_spike': 0.19486980060495002, 'adx_thresh': 12.769468262692524, 'atr_min_pct': 0.021309740063444747, 'atr_max_pct': 0.1422388480689688, 'tp_mult': 1.4391220776269957, 'tsl_mult': 0.9153295195586475, 'strategy': 'mean_reversion', 'time_stop': 171, 'use_sma': True, 'use_atr': False, 'use_adx': True, 'use_ema': False, 'use_spike': True, 'rsi_required': False, 'edge_k': 1.4098368946235293, 'edge_cap': 0.577969562832096, 'bull_strategy': 'mean_reversion', 'bull_bb_std_mult': 2.144461699693398, 'bull_rsi_os': 23, 'bull_rsi_ob': 66, 'bull_adx_thresh': 32.16843784875622, 'bull_atr_min_pct': 0.015596144543107255, 'bull_atr_max_pct': 0.14804275186295046, 'bull_tp_mult': 2.6967007263012888, 'bull_tsl_mult': 0.869822485334118, 'bull_time_stop': 38, 'bull_use_sma': True, 'bull_use_ema': True, 'bull_use_atr': True, 'bull_use_adx': False, 'bull_use_spike': False, 'bull_rsi_required': False, 'bear_strategy': 'breakout', 'bear_bb_std_mult': 2.640233999729435, 'bear_rsi_os': 27, 'bear_rsi_ob': 51, 'bear_adx_thresh': 31.909158124112064, 'bear_atr_min_pct': 0.0067589311738066715, 'bear_atr_max_pct': 0.06440053467022022, 'bear_tp_mult': 2.5790101403110453, 'bear_tsl_mult': 0.46581570127846683, 'bear_time_stop': 67, 'bear_use_sma': False, 'bear_use_ema': True, 'bear_use_atr': False, 'bear_use_adx': False, 'bear_use_spike': True, 'bear_rsi_required': False, 'sideways_strategy': 'mean_reversion', 'sideways_bb_std_mult': 2.142463337818249, 'sideways_rsi_os': 8, 'sideways_rsi_ob': 70, 'sideways_adx_thresh': 33.744249102393894, 'sideways_atr_min_pct': 0.0034138620532637564, 'sideways_atr_max_pct': 0.1144839639142492, 'sideways_tp_mult': 1.0522240879565115, 'sideways_tsl_mult': 0.11813438058017134, 'sideways_time_stop': 200, 'sideways_use_sma': False, 'sideways_use_ema': False, 'sideways_use_atr': False, 'sideways_use_adx': False, 'sideways_use_spike': False, 'sideways_rsi_required': True}.
[I 2025-08-29 20:52:34,336] Trial 651 finished with values: [-1000000000.0, 1000000000.0] and parameters: {'p_sma': 19, 'p_std': 14, 'p_atr': 13, 'p_adx': 14, 'rsi_period': 37, 'ema1': 26, 'ema2': 45, 'slip_atr_k': 0.00012662233983527413, 'slip_spread_k': 0.06269363585939536, 'spread_hl_frac': 0.01985782282085984, 'bb_std_mult': 1.952780557116327, 'rsi_os': 7, 'rsi_ob': 52, 'vol_spike': 0.10009457408761827, 'adx_thresh': 19.451444535145882, 'atr_min_pct': 0.021317029480076962, 'atr_max_pct': 0.029481578689688745, 'tp_mult': 1.4593250768512025, 'tsl_mult': 0.2586113522179777, 'strategy': 'mean_reversion', 'time_stop': 211, 'use_sma': True, 'use_atr': False, 'use_adx': False, 'use_ema': False, 'use_spike': False, 'rsi_required': False, 'edge_k': 1.019974765599469, 'edge_cap': 0.5654507471267523, 'bull_strategy': 'mean_reversion', 'bull_bb_std_mult': 2.788291880352623, 'bull_rsi_os': 23, 'bull_rsi_ob': 68, 'bull_adx_thresh': 15.801747078339591, 'bull_atr_min_pct': 0.01572445851766458, 'bull_atr_max_pct': 0.11143094923485075, 'bull_tp_mult': 2.2184114212288604, 'bull_tsl_mult': 0.5641157248000106, 'bull_time_stop': 37, 'bull_use_sma': True, 'bull_use_ema': False, 'bull_use_atr': True, 'bull_use_adx': False, 'bull_use_spike': False, 'bull_rsi_required': False, 'bear_strategy': 'breakout', 'bear_bb_std_mult': 2.6331394360672835, 'bear_rsi_os': 26, 'bear_rsi_ob': 81, 'bear_adx_thresh': 24.07172972836711, 'bear_atr_min_pct': 0.011449046962799955, 'bear_atr_max_pct': 0.07930987504723246, 'bear_tp_mult': 2.6095177459577856, 'bear_tsl_mult': 0.9603703933063364, 'bear_time_stop': 50, 'bear_use_sma': False, 'bear_use_ema': True, 'bear_use_atr': False, 'bear_use_adx': False, 'bear_use_spike': True, 'bear_rsi_required': False, 'sideways_strategy': 'breakout', 'sideways_bb_std_mult': 2.148627771423541, 'sideways_rsi_os': 53, 'sideways_rsi_ob': 79, 'sideways_adx_thresh': 32.960932166076546, 'sideways_atr_min_pct': 0.006098917505596362, 'sideways_atr_max_pct': 0.025111575992848283, 'sideways_tp_mult': 1.0402982530396778, 'sideways_tsl_mult': 0.480055691058068, 'sideways_time_stop': 198, 'sideways_use_sma': False, 'sideways_use_ema': False, 'sideways_use_atr': False, 'sideways_use_adx': False, 'sideways_use_spike': False, 'sideways_rsi_required': False}.
[I 2025-08-29 20:52:39,159] Trial 656 finished with values: [-1000000000.0, 1000000000.0] and parameters: {'p_sma': 19, 'p_std': 12, 'p_atr': 21, 'p_adx': 29, 'rsi_period': 59, 'ema1': 16, 'ema2': 22, 'slip_atr_k': 0.2318328588409466, 'slip_spread_k': 0.17868871214472132, 'spread_hl_frac': 0.042872866456526965, 'bb_std_mult': 1.7410701404367697, 'rsi_os': 11, 'rsi_ob': 58, 'vol_spike': 0.19115121104845323, 'adx_thresh': 28.914158207105075, 'atr_min_pct': 0.017243865798604114, 'atr_max_pct': 0.028994912264441994, 'tp_mult': 1.5983086527243264, 'tsl_mult': 0.6587243646554715, 'strategy': 'mean_reversion', 'time_stop': 256, 'use_sma': True, 'use_atr': False, 'use_adx': False, 'use_ema': True, 'use_spike': False, 'rsi_required': False, 'edge_k': 1.1294216390748315, 'edge_cap': 0.6143341647958209, 'bull_strategy': 'mean_reversion', 'bull_bb_std_mult': 2.1397697110255844, 'bull_rsi_os': 55, 'bull_rsi_ob': 72, 'bull_adx_thresh': 12.827139831538204, 'bull_atr_min_pct': 0.012412838590831914, 'bull_atr_max_pct': 0.03768868232784204, 'bull_tp_mult': 2.664032084712789, 'bull_tsl_mult': 0.5644471925697219, 'bull_time_stop': 16, 'bull_use_sma': True, 'bull_use_ema': False, 'bull_use_atr': True, 'bull_use_adx': False, 'bull_use_spike': True, 'bull_rsi_required': False, 'bear_strategy': 'mean_reversion', 'bear_bb_std_mult': 2.7262489541072195, 'bear_rsi_os': 34, 'bear_rsi_ob': 62, 'bear_adx_thresh': 25.590521466675817, 'bear_atr_min_pct': 0.02144265676934795, 'bear_atr_max_pct': 0.054674907479978635, 'bear_tp_mult': 2.6961285405082136, 'bear_tsl_mult': 0.4645391928654956, 'bear_time_stop': 261, 'bear_use_sma': False, 'bear_use_ema': True, 'bear_use_atr': False, 'bear_use_adx': True, 'bear_use_spike': True, 'bear_rsi_required': True, 'sideways_strategy': 'breakout', 'sideways_bb_std_mult': 3.383583663786293, 'sideways_rsi_os': 44, 'sideways_rsi_ob': 67, 'sideways_adx_thresh': 33.07708430587713, 'sideways_atr_min_pct': 0.010480576303486942, 'sideways_atr_max_pct': 0.05308760916069171, 'sideways_tp_mult': 1.0110498930081393, 'sideways_tsl_mult': 0.11932632598481208, 'sideways_time_stop': 198, 'sideways_use_sma': True, 'sideways_use_ema': False, 'sideways_use_atr': False, 'sideways_use_adx': False, 'sideways_use_spike': False, 'sideways_rsi_required': False}.
[I 2025-08-29 20:52:39,496] Trial 655 finished with values: [-1000000000.0, 1000000000.0] and parameters: {'p_sma': 19, 'p_std': 14, 'p_atr': 25, 'p_adx': 13, 'rsi_period': 37, 'ema1': 14, 'ema2': 44, 'slip_atr_k': 0.0002812583986103439, 'slip_spread_k': 0.1463561977645261, 'spread_hl_frac': 0.046733136825402845, 'bb_std_mult': 0.6478998528956865, 'rsi_os': 10, 'rsi_ob': 80, 'vol_spike': 0.16565970834295582, 'adx_thresh': 12.731399680466586, 'atr_min_pct': 0.022732764185872997, 'atr_max_pct': 0.03387429394045376, 'tp_mult': 1.4398743778283174, 'tsl_mult': 0.4144516335622964, 'strategy': 'mean_reversion', 'time_stop': 166, 'use_sma': True, 'use_atr': False, 'use_adx': True, 'use_ema': False, 'use_spike': False, 'rsi_required': False, 'edge_k': 1.1290844877289061, 'edge_cap': 0.14768678106707223, 'bull_strategy': 'mean_reversion', 'bull_bb_std_mult': 1.9841782692791357, 'bull_rsi_os': 33, 'bull_rsi_ob': 85, 'bull_adx_thresh': 14.624922373339082, 'bull_atr_min_pct': 0.019174331242442017, 'bull_atr_max_pct': 0.09695301019763153, 'bull_tp_mult': 2.6621271326452223, 'bull_tsl_mult': 0.8771640007488977, 'bull_time_stop': 30, 'bull_use_sma': True, 'bull_use_ema': False, 'bull_use_atr': True, 'bull_use_adx': False, 'bull_use_spike': False, 'bull_rsi_required': False, 'bear_strategy': 'mean_reversion', 'bear_bb_std_mult': 2.6337690975797, 'bear_rsi_os': 28, 'bear_rsi_ob': 50, 'bear_adx_thresh': 25.737552625713626, 'bear_atr_min_pct': 0.021573468571262168, 'bear_atr_max_pct': 0.05237312198537767, 'bear_tp_mult': 2.5812987370689497, 'bear_tsl_mult': 0.7387690091021331, 'bear_time_stop': 65, 'bear_use_sma': False, 'bear_use_ema': True, 'bear_use_atr': False, 'bear_use_adx': False, 'bear_use_spike': True, 'bear_rsi_required': True, 'sideways_strategy': 'mean_reversion', 'sideways_bb_std_mult': 2.1543539485673184, 'sideways_rsi_os': 47, 'sideways_rsi_ob': 59, 'sideways_adx_thresh': 32.694678047996554, 'sideways_atr_min_pct': 0.004605926949448216, 'sideways_atr_max_pct': 0.14796336462101956, 'sideways_tp_mult': 1.0409962578623888, 'sideways_tsl_mult': 0.2211535134941976, 'sideways_time_stop': 201, 'sideways_use_sma': True, 'sideways_use_ema': True, 'sideways_use_atr': False, 'sideways_use_adx': True, 'sideways_use_spike': False, 'sideways_rsi_required': False}.
