[I 2025-08-29 20:40:48,606] Trial 546 finished with values: [-1000000000.0, 1000000000.0] and parameters: {'p_sma': 49, 'p_std': 55, 'p_atr': 25, 'p_adx': 12, 'rsi_period': 33, 'ema1': 6, 'ema2': 44, 'slip_atr_k': 0.123181944733589, 'slip_spread_k': 0.8799723104192468, 'spread_hl_frac': 0.04925035178193138, 'bb_std_mult': 1.72023163294704, 'rsi_os': 33, 'rsi_ob': 81, 'vol_spike': 0.18487029178488157, 'adx_thresh': 13.870608753432274, 'atr_min_pct': 0.01970405997201979, 'atr_max_pct': 0.10775301702117279, 'tp_mult': 1.8587026934950754, 'tsl_mult': 0.20390283669178355, 'strategy': 'breakout', 'time_stop': 175, 'use_sma': True, 'use_atr': True, 'use_adx': False, 'use_ema': True, 'use_spike': False, 'rsi_required': False, 'edge_k': 1.7542149108909708, 'edge_cap': 0.13711198140890507, 'bull_strategy': 'mean_reversion', 'bull_bb_std_mult': 2.6978902209998123, 'bull_rsi_os': 19, 'bull_rsi_ob': 74, 'bull_adx_thresh': 31.282032805296556, 'bull_atr_min_pct': 0.024408908944230777, 'bull_atr_max_pct': 0.04148628951801629, 'bull_tp_mult': 2.771672107089215, 'bull_tsl_mult': 0.9537718971871543, 'bull_time_stop': 299, 'bull_use_sma': True, 'bull_use_ema': False, 'bull_use_atr': True, 'bull_use_adx': False, 'bull_use_spike': True, 'bull_rsi_required': False, 'bear_strategy': 'breakout', 'bear_bb_std_mult': 2.6692573608387655, 'bear_rsi_os': 30, 'bear_rsi_ob': 67, 'bear_adx_thresh': 22.21379600516209, 'bear_atr_min_pct': 0.008081849643496909, 'bear_atr_max_pct': 0.0442765880695683, 'bear_tp_mult': 2.6522542623990994, 'bear_tsl_mult': 0.937372095470209, 'bear_time_stop': 153, 'bear_use_sma': False, 'bear_use_ema': False, 'bear_use_atr': False, 'bear_use_adx': True, 'bear_use_spike': True, 'bear_rsi_required': False, 'sideways_strategy': 'breakout', 'sideways_bb_std_mult': 0.6332326844303253, 'sideways_rsi_os': 36, 'sideways_rsi_ob': 49, 'sideways_adx_thresh': 10.842809114306363, 'sideways_atr_min_pct': 0.007170723629245364, 'sideways_atr_max_pct': 0.025347682104804287, 'sideways_tp_mult': 1.0426097245567993, 'sideways_tsl_mult': 0.6836859886133531, 'sideways_time_stop': 88, 'sideways_use_sma': True, 'sideways_use_ema': False, 'sideways_use_atr': False, 'sideways_use_adx': True, 'sideways_use_spike': False, 'sideways_rsi_required': False}.
[I 2025-08-29 20:40:49,716] Trial 550 finished with values: [-1000000000.0, 1000000000.0] and parameters: {'p_sma': 20, 'p_std': 56, 'p_atr': 25, 'p_adx': 21, 'rsi_period': 42, 'ema1': 25, 'ema2': 60, 'slip_atr_k': 0.0034929818804989546, 'slip_spread_k': 0.10662069163478301, 'spread_hl_frac': 0.049224331238393655, 'bb_std_mult': 1.7264376244233435, 'rsi_os': 42, 'rsi_ob': 81, 'vol_spike': 0.16849087663556517, 'adx_thresh': 7.33878924568611, 'atr_min_pct': 0.0013405519701868047, 'atr_max_pct': 0.010073849131854953, 'tp_mult': 1.8601570695624332, 'tsl_mult': 0.5188589862963167, 'strategy': 'breakout', 'time_stop': 176, 'use_sma': True, 'use_atr': False, 'use_adx': True, 'use_ema': True, 'use_spike': False, 'rsi_required': False, 'edge_k': 1.0777241478123758, 'edge_cap': 0.8904456815010426, 'bull_strategy': 'mean_reversion', 'bull_bb_std_mult': 2.7104750855993514, 'bull_rsi_os': 18, 'bull_rsi_ob': 70, 'bull_adx_thresh': 13.928193951326923, 'bull_atr_min_pct': 0.015066506141971194, 'bull_atr_max_pct': 0.10151630478303736, 'bull_tp_mult': 2.580950881555701, 'bull_tsl_mult': 0.7928484889899068, 'bull_time_stop': 101, 'bull_use_sma': True, 'bull_use_ema': False, 'bull_use_atr': True, 'bull_use_adx': False, 'bull_use_spike': False, 'bull_rsi_required': False, 'bear_strategy': 'breakout', 'bear_bb_std_mult': 2.84087244183248, 'bear_rsi_os': 27, 'bear_rsi_ob': 66, 'bear_adx_thresh': 22.60891961547398, 'bear_atr_min_pct': 0.006986701464636529, 'bear_atr_max_pct': 0.08300519643993927, 'bear_tp_mult': 2.6994734606169857, 'bear_tsl_mult': 0.8982826118139652, 'bear_time_stop': 191, 'bear_use_sma': False, 'bear_use_ema': False, 'bear_use_atr': True, 'bear_use_adx': True, 'bear_use_spike': True, 'bear_rsi_required': True, 'sideways_strategy': 'breakout', 'sideways_bb_std_mult': 2.5869338330807308, 'sideways_rsi_os': 49, 'sideways_rsi_ob': 79, 'sideways_adx_thresh': 32.617764034583224, 'sideways_atr_min_pct': 0.00610102255498005, 'sideways_atr_max_pct': 0.01980694989923546, 'sideways_tp_mult': 1.0136429555172264, 'sideways_tsl_mult': 0.6883568243185662, 'sideways_time_stop': 182, 'sideways_use_sma': False, 'sideways_use_ema': False, 'sideways_use_atr': False, 'sideways_use_adx': True, 'sideways_use_spike': False, 'sideways_rsi_required': False}.
[I 2025-08-29 20:41:20,584] Trial 553 finished with values: [-1000000000.0, 1000000000.0] and parameters: {'p_sma': 20, 'p_std': 11, 'p_atr': 11, 'p_adx': 20, 'rsi_period': 42, 'ema1': 14, 'ema2': 46, 'slip_atr_k': 0.004460370580242563, 'slip_spread_k': 0.11221704398439525, 'spread_hl_frac': 0.02405058420795398, 'bb_std_mult': 1.7733605199151892, 'rsi_os': 31, 'rsi_ob': 78, 'vol_spike': 0.16975958903386476, 'adx_thresh': 6.9850707259896705, 'atr_min_pct': 0.028566757829885405, 'atr_max_pct': 0.028678222955391745, 'tp_mult': 1.0505741991892301, 'tsl_mult': 0.9164317464377684, 'strategy': 'mean_reversion', 'time_stop': 131, 'use_sma': True, 'use_atr': False, 'use_adx': True, 'use_ema': True, 'use_spike': False, 'rsi_required': True, 'edge_k': 1.0774796743877773, 'edge_cap': 0.5925559187844306, 'bull_strategy': 'breakout', 'bull_bb_std_mult': 3.0631903345675067, 'bull_rsi_os': 18, 'bull_rsi_ob': 70, 'bull_adx_thresh': 20.807572083788685, 'bull_atr_min_pct': 0.015373128316034086, 'bull_atr_max_pct': 0.11159921117807393, 'bull_tp_mult': 1.6525441161173429, 'bull_tsl_mult': 0.8021819418458058, 'bull_time_stop': 111, 'bull_use_sma': True, 'bull_use_ema': False, 'bull_use_atr': True, 'bull_use_adx': True, 'bull_use_spike': False, 'bull_rsi_required': False, 'bear_strategy': 'breakout', 'bear_bb_std_mult': 0.7895026677308272, 'bear_rsi_os': 27, 'bear_rsi_ob': 68, 'bear_adx_thresh': 17.187300585682777, 'bear_atr_min_pct': 0.010551679435284853, 'bear_atr_max_pct': 0.04984944831219152, 'bear_tp_mult': 2.4522585234699026, 'bear_tsl_mult': 0.3040722022476914, 'bear_time_stop': 43, 'bear_use_sma': True, 'bear_use_ema': True, 'bear_use_atr': True, 'bear_use_adx': True, 'bear_use_spike': True, 'bear_rsi_required': False, 'sideways_strategy': 'breakout', 'sideways_bb_std_mult': 2.322913737173857, 'sideways_rsi_os': 45, 'sideways_rsi_ob': 76, 'sideways_adx_thresh': 32.331399534391466, 'sideways_atr_min_pct': 0.0061883965516420295, 'sideways_atr_max_pct': 0.03089933605633305, 'sideways_tp_mult': 1.3366326456392197, 'sideways_tsl_mult': 0.7350081983177963, 'sideways_time_stop': 39, 'sideways_use_sma': False, 'sideways_use_ema': False, 'sideways_use_atr': False, 'sideways_use_adx': False, 'sideways_use_spike': True, 'sideways_rsi_required': True}.
[I 2025-08-29 20:41:20,692] Trial 554 finished with values: [-0.0037061347721044635, 0.0036927877435208815] and parameters: {'p_sma': 22, 'p_std': 33, 'p_atr': 11, 'p_adx': 20, 'rsi_period': 38, 'ema1': 9, 'ema2': 56, 'slip_atr_k': 0.004516221340295671, 'slip_spread_k': 0.8990517014518693, 'spread_hl_frac': 0.015257938599279673, 'bb_std_mult': 0.7856804555134975, 'rsi_os': 39, 'rsi_ob': 83, 'vol_spike': 0.17398455055078874, 'adx_thresh': 18.201715094049828, 'atr_min_pct': 0.020174829593930174, 'atr_max_pct': 0.11985586660031022, 'tp_mult': 1.1751248675701074, 'tsl_mult': 0.9181387766343578, 'strategy': 'mean_reversion', 'time_stop': 158, 'use_sma': True, 'use_atr': False, 'use_adx': True, 'use_ema': True, 'use_spike': False, 'rsi_required': True, 'edge_k': 0.9720350167074807, 'edge_cap': 0.5949526984548754, 'bull_strategy': 'breakout', 'bull_bb_std_mult': 3.032259028622974, 'bull_rsi_os': 18, 'bull_rsi_ob': 76, 'bull_adx_thresh': 12.032114258077081, 'bull_atr_min_pct': 0.003977758636592058, 'bull_atr_max_pct': 0.08960498352640565, 'bull_tp_mult': 2.684417007208286, 'bull_tsl_mult': 0.8652737406308336, 'bull_time_stop': 32, 'bull_use_sma': True, 'bull_use_ema': True, 'bull_use_atr': True, 'bull_use_adx': True, 'bull_use_spike': False, 'bull_rsi_required': False, 'bear_strategy': 'mean_reversion', 'bear_bb_std_mult': 3.5481061356362766, 'bear_rsi_os': 54, 'bear_rsi_ob': 71, 'bear_adx_thresh': 16.99901187278025, 'bear_atr_min_pct': 0.021222973551594186, 'bear_atr_max_pct': 0.04930870359723305, 'bear_tp_mult': 1.3959457813208576, 'bear_tsl_mult': 0.8268352978562259, 'bear_time_stop': 94, 'bear_use_sma': True, 'bear_use_ema': True, 'bear_use_atr': True, 'bear_use_adx': True, 'bear_use_spike': True, 'bear_rsi_required': False, 'sideways_strategy': 'mean_reversion', 'sideways_bb_std_mult': 2.319719772152335, 'sideways_rsi_os': 45, 'sideways_rsi_ob': 71, 'sideways_adx_thresh': 32.23992652916854, 'sideways_atr_min_pct': 0.010147819470110621, 'sideways_atr_max_pct': 0.1456298355104207, 'sideways_tp_mult': 1.1042767073521234, 'sideways_tsl_mult': 0.7060743473176483, 'sideways_time_stop': 24, 'sideways_use_sma': False, 'sideways_use_ema': False, 'sideways_use_atr': False, 'sideways_use_adx': False, 'sideways_use_spike': True, 'sideways_rsi_required': True}.
[I 2025-08-29 20:41:20,718] Trial 551 finished with values: [-0.0014723327598945568, 0.00212342733747194] and parameters: {'p_sma': 22, 'p_std': 54, 'p_atr': 25, 'p_adx': 13, 'rsi_period': 43, 'ema1': 25, 'ema2': 60, 'slip_atr_k': 0.004625483606378645, 'slip_spread_k': 0.652518210578773, 'spread_hl_frac': 0.047049884881274526, 'bb_std_mult': 0.79572475359668, 'rsi_os': 9, 'rsi_ob': 52, 'vol_spike': 0.17066549985864524, 'adx_thresh': 12.93822069851335, 'atr_min_pct': 0.020009651237042268, 'atr_max_pct': 0.10824884731563847, 'tp_mult': 1.87448310684022, 'tsl_mult': 0.919761685305225, 'strategy': 'mean_reversion', 'time_stop': 288, 'use_sma': True, 'use_atr': False, 'use_adx': False, 'use_ema': True, 'use_spike': False, 'rsi_required': False, 'edge_k': 1.08146222032312, 'edge_cap': 0.3457602499918553, 'bull_strategy': 'mean_reversion', 'bull_bb_std_mult': 2.7045899463900818, 'bull_rsi_os': 18, 'bull_rsi_ob': 70, 'bull_adx_thresh': 11.874417117853735, 'bull_atr_min_pct': 0.013700023555197761, 'bull_atr_max_pct': 0.09029025027534643, 'bull_tp_mult': 1.07827941233694, 'bull_tsl_mult': 0.8678299108024157, 'bull_time_stop': 98, 'bull_use_sma': True, 'bull_use_ema': False, 'bull_use_atr': True, 'bull_use_adx': False, 'bull_use_spike': True, 'bull_rsi_required': False, 'bear_strategy': 'breakout', 'bear_bb_std_mult': 2.855186215998083, 'bear_rsi_os': 41, 'bear_rsi_ob': 75, 'bear_adx_thresh': 20.423273705083464, 'bear_atr_min_pct': 0.006341245435967717, 'bear_atr_max_pct': 0.13475489327874984, 'bear_tp_mult': 2.4223608326195496, 'bear_tsl_mult': 0.9362502541923922, 'bear_time_stop': 42, 'bear_use_sma': True, 'bear_use_ema': True, 'bear_use_atr': True, 'bear_use_adx': True, 'bear_use_spike': True, 'bear_rsi_required': False, 'sideways_strategy': 'breakout', 'sideways_bb_std_mult': 3.290662491208802, 'sideways_rsi_os': 49, 'sideways_rsi_ob': 79, 'sideways_adx_thresh': 32.556342295705186, 'sideways_atr_min_pct': 0.004188788146951649, 'sideways_atr_max_pct': 0.13805148326879724, 'sideways_tp_mult': 1.3391272640511571, 'sideways_tsl_mult': 0.9319495161900353, 'sideways_time_stop': 181, 'sideways_use_sma': False, 'sideways_use_ema': False, 'sideways_use_atr': False, 'sideways_use_adx': False, 'sideways_use_spike': False, 'sideways_rsi_required': False}.
[I 2025-08-29 20:41:20,993] Trial 552 finished with values: [-1000000000.0, 1000000000.0] and parameters: {'p_sma': 20, 'p_std': 10, 'p_atr': 25, 'p_adx': 21, 'rsi_period': 44, 'ema1': 25, 'ema2': 56, 'slip_atr_k': 0.004692359164456487, 'slip_spread_k': 0.6604488472158191, 'spread_hl_frac': 0.015264038760974423, 'bb_std_mult': 1.7550001775325768, 'rsi_os': 31, 'rsi_ob': 86, 'vol_spike': 0.16651143736587184, 'adx_thresh': 27.29386090261488, 'atr_min_pct': 0.017529363464271315, 'atr_max_pct': 0.03659371544434962, 'tp_mult': 1.1962952004534362, 'tsl_mult': 0.5136587030538609, 'strategy': 'mean_reversion', 'time_stop': 128, 'use_sma': True, 'use_atr': False, 'use_adx': True, 'use_ema': True, 'use_spike': False, 'rsi_required': True, 'edge_k': 0.8534739878087745, 'edge_cap': 0.6059799144834559, 'bull_strategy': 'breakout', 'bull_bb_std_mult': 3.06584247574676, 'bull_rsi_os': 18, 'bull_rsi_ob': 76, 'bull_adx_thresh': 20.372682789815144, 'bull_atr_min_pct': 0.013679338666695044, 'bull_atr_max_pct': 0.08815372909971761, 'bull_tp_mult': 1.2062889138450492, 'bull_tsl_mult': 0.7913639031819923, 'bull_time_stop': 32, 'bull_use_sma': True, 'bull_use_ema': False, 'bull_use_atr': True, 'bull_use_adx': True, 'bull_use_spike': False, 'bull_rsi_required': False, 'bear_strategy': 'breakout', 'bear_bb_std_mult': 2.227626295349892, 'bear_rsi_os': 22, 'bear_rsi_ob': 70, 'bear_adx_thresh': 17.403642346022416, 'bear_atr_min_pct': 0.006370951990178917, 'bear_atr_max_pct': 0.05128394755821184, 'bear_tp_mult': 2.4515937959419767, 'bear_tsl_mult': 0.9333340769891586, 'bear_time_stop': 43, 'bear_use_sma': False, 'bear_use_ema': True, 'bear_use_atr': True, 'bear_use_adx': True, 'bear_use_spike': True, 'bear_rsi_required': False, 'sideways_strategy': 'breakout', 'sideways_bb_std_mult': 2.3227597899304784, 'sideways_rsi_os': 45, 'sideways_rsi_ob': 55, 'sideways_adx_thresh': 25.771398398649154, 'sideways_atr_min_pct': 0.006250450412621734, 'sideways_atr_max_pct': 0.13376759205958866, 'sideways_tp_mult': 1.1027353263422237, 'sideways_tsl_mult': 0.0059624833562010315, 'sideways_time_stop': 37, 'sideways_use_sma': False, 'sideways_use_ema': False, 'sideways_use_atr': False, 'sideways_use_adx': False, 'sideways_use_spike': True, 'sideways_rsi_required': True}.
[I 2025-08-29 20:41:21,805] Trial 558 finished with values: [-1000000000.0, 1000000000.0] and parameters: {'p_sma': 31, 'p_std': 44, 'p_atr': 13, 'p_adx': 30, 'rsi_period': 77, 'ema1': 26, 'ema2': 47, 'slip_atr_k': 0.19483550089645782, 'slip_spread_k': 0.14375398324226277, 'spread_hl_frac': 0.03584641173098013, 'bb_std_mult': 3.2948115468002657, 'rsi_os': 55, 'rsi_ob': 83, 'vol_spike': 0.18342455982379732, 'adx_thresh': 13.221797630983222, 'atr_min_pct': 0.008178559185538201, 'atr_max_pct': 0.07289668734315052, 'tp_mult': 1.376768842315635, 'tsl_mult': 0.7053278059941865, 'strategy': 'mean_reversion', 'time_stop': 59, 'use_sma': False, 'use_atr': True, 'use_adx': False, 'use_ema': False, 'use_spike': True, 'rsi_required': False, 'edge_k': 0.9775454734823688, 'edge_cap': 0.579074435723467, 'bull_strategy': 'mean_reversion', 'bull_bb_std_mult': 2.897195244907453, 'bull_rsi_os': 17, 'bull_rsi_ob': 62, 'bull_adx_thresh': 6.791018745212147, 'bull_atr_min_pct': 0.01458638403122056, 'bull_atr_max_pct': 0.09450943284749337, 'bull_tp_mult': 2.6249100564335976, 'bull_tsl_mult': 0.8378562492674612, 'bull_time_stop': 39, 'bull_use_sma': False, 'bull_use_ema': True, 'bull_use_atr': True, 'bull_use_adx': False, 'bull_use_spike': True, 'bull_rsi_required': True, 'bear_strategy': 'mean_reversion', 'bear_bb_std_mult': 2.758186955209617, 'bear_rsi_os': 20, 'bear_rsi_ob': 95, 'bear_adx_thresh': 26.068871414962537, 'bear_atr_min_pct': 0.004327731576265174, 'bear_atr_max_pct': 0.040270133934892774, 'bear_tp_mult': 2.6041249673308218, 'bear_tsl_mult': 0.12483625515891456, 'bear_time_stop': 205, 'bear_use_sma': False, 'bear_use_ema': True, 'bear_use_atr': False, 'bear_use_adx': False, 'bear_use_spike': False, 'bear_rsi_required': True, 'sideways_strategy': 'mean_reversion', 'sideways_bb_std_mult': 1.26574247766548, 'sideways_rsi_os': 25, 'sideways_rsi_ob': 78, 'sideways_adx_thresh': 34.26709731621157, 'sideways_atr_min_pct': 0.005085324991593536, 'sideways_atr_max_pct': 0.037798443928919435, 'sideways_tp_mult': 1.7528390119311186, 'sideways_tsl_mult': 0.7873297632442515, 'sideways_time_stop': 211, 'sideways_use_sma': False, 'sideways_use_ema': False, 'sideways_use_atr': False, 'sideways_use_adx': False, 'sideways_use_spike': False, 'sideways_rsi_required': False}.
[I 2025-08-29 20:41:21,836] Trial 555 finished with values: [-1000000000.0, 1000000000.0] and parameters: {'p_sma': 31, 'p_std': 15, 'p_atr': 7, 'p_adx': 13, 'rsi_period': 38, 'ema1': 25, 'ema2': 46, 'slip_atr_k': 0.009632047365012525, 'slip_spread_k': 0.7099992580708296, 'spread_hl_frac': 0.02700853852168671, 'bb_std_mult': 1.6859895504715838, 'rsi_os': 55, 'rsi_ob': 94, 'vol_spike': 0.18016215180022285, 'adx_thresh': 13.027761943074514, 'atr_min_pct': 0.024302501206662865, 'atr_max_pct': 0.07433932779137847, 'tp_mult': 2.7159610249961363, 'tsl_mult': 0.8755115846949622, 'strategy': 'mean_reversion', 'time_stop': 56, 'use_sma': False, 'use_atr': False, 'use_adx': False, 'use_ema': True, 'use_spike': False, 'rsi_required': False, 'edge_k': 0.8410600127377171, 'edge_cap': 0.6111581269022699, 'bull_strategy': 'mean_reversion', 'bull_bb_std_mult': 2.8813710313439835, 'bull_rsi_os': 17, 'bull_rsi_ob': 68, 'bull_adx_thresh': 27.21655472111786, 'bull_atr_min_pct': 0.01451107826550482, 'bull_atr_max_pct': 0.09399455908339929, 'bull_tp_mult': 1.0951010516106103, 'bull_tsl_mult': 0.3842067130689645, 'bull_time_stop': 37, 'bull_use_sma': False, 'bull_use_ema': False, 'bull_use_atr': True, 'bull_use_adx': False, 'bull_use_spike': True, 'bull_rsi_required': False, 'bear_strategy': 'breakout', 'bear_bb_std_mult': 2.809988603430992, 'bear_rsi_os': 46, 'bear_rsi_ob': 90, 'bear_adx_thresh': 20.562703716475895, 'bear_atr_min_pct': 0.006222730424894742, 'bear_atr_max_pct': 0.05733678575518718, 'bear_tp_mult': 2.6132389877592606, 'bear_tsl_mult': 0.9321476126718719, 'bear_time_stop': 49, 'bear_use_sma': False, 'bear_use_ema': True, 'bear_use_atr': False, 'bear_use_adx': True, 'bear_use_spike': False, 'bear_rsi_required': False, 'sideways_strategy': 'breakout', 'sideways_bb_std_mult': 3.1493737655939484, 'sideways_rsi_os': 46, 'sideways_rsi_ob': 69, 'sideways_adx_thresh': 16.601000813095848, 'sideways_atr_min_pct': 0.0028386420320403167, 'sideways_atr_max_pct': 0.02044487887895694, 'sideways_tp_mult': 1.0910048022908565, 'sideways_tsl_mult': 0.7903473980579345, 'sideways_time_stop': 75, 'sideways_use_sma': False, 'sideways_use_ema': False, 'sideways_use_atr': False, 'sideways_use_adx': False, 'sideways_use_spike': False, 'sideways_rsi_required': False}.
[I 2025-08-29 20:41:22,612] Trial 559 finished with values: [-1000000000.0, 1000000000.0] and parameters: {'p_sma': 17, 'p_std': 21, 'p_atr': 7, 'p_adx': 13, 'rsi_period': 38, 'ema1': 26, 'ema2': 46, 'slip_atr_k': 0.012951793101384482, 'slip_spread_k': 0.34462920989002543, 'spread_hl_frac': 0.04831806317190036, 'bb_std_mult': 1.491970115944738, 'rsi_os': 10, 'rsi_ob': 85, 'vol_spike': 0.060924431643809104, 'adx_thresh': 11.328623970710584, 'atr_min_pct': 0.024259360245586913, 'atr_max_pct': 0.02280798863590723, 'tp_mult': 2.7386543445053695, 'tsl_mult': 0.8754574038717267, 'strategy': 'mean_reversion', 'time_stop': 171, 'use_sma': True, 'use_atr': False, 'use_adx': False, 'use_ema': True, 'use_spike': False, 'rsi_required': False, 'edge_k': 0.4021261167470007, 'edge_cap': 0.6043732372395679, 'bull_strategy': 'mean_reversion', 'bull_bb_std_mult': 3.086189069786155, 'bull_rsi_os': 17, 'bull_rsi_ob': 73, 'bull_adx_thresh': 14.342203986531942, 'bull_atr_min_pct': 0.012276308235730761, 'bull_atr_max_pct': 0.08197183781859065, 'bull_tp_mult': 2.2612471535809493, 'bull_tsl_mult': 0.3756670180810308, 'bull_time_stop': 23, 'bull_use_sma': True, 'bull_use_ema': False, 'bull_use_atr': False, 'bull_use_adx': False, 'bull_use_spike': True, 'bull_rsi_required': False, 'bear_strategy': 'breakout', 'bear_bb_std_mult': 2.7256803225624266, 'bear_rsi_os': 33, 'bear_rsi_ob': 61, 'bear_adx_thresh': 11.008903327859601, 'bear_atr_min_pct': 0.0056759151413054085, 'bear_atr_max_pct': 0.04723848548569511, 'bear_tp_mult': 2.7452970884754153, 'bear_tsl_mult': 0.9157616871727425, 'bear_time_stop': 47, 'bear_use_sma': False, 'bear_use_ema': True, 'bear_use_atr': False, 'bear_use_adx': True, 'bear_use_spike': True, 'bear_rsi_required': False, 'sideways_strategy': 'breakout', 'sideways_bb_std_mult': 3.1540689040652294, 'sideways_rsi_os': 46, 'sideways_rsi_ob': 76, 'sideways_adx_thresh': 31.24930263461881, 'sideways_atr_min_pct': 0.002774939606708453, 'sideways_atr_max_pct': 0.019378828790810886, 'sideways_tp_mult': 1.0854798411169755, 'sideways_tsl_mult': 0.7129184236965846, 'sideways_time_stop': 195, 'sideways_use_sma': False, 'sideways_use_ema': False, 'sideways_use_atr': True, 'sideways_use_adx': False, 'sideways_use_spike': False, 'sideways_rsi_required': False}.
