[I 2025-08-29 21:02:50,508] Trial 744 finished with values: [0.0005900850656996859, 0.001947999839476355] and parameters: {'p_sma': 15, 'p_std': 30, 'p_atr': 17, 'p_adx': 9, 'rsi_period': 34, 'ema1': 23, 'ema2': 22, 'slip_atr_k': 0.004403566759124867, 'slip_spread_k': 0.12333483901621609, 'spread_hl_frac': 0.019450780552329676, 'bb_std_mult': 1.0208744156485148, 'rsi_os': 5, 'rsi_ob': 80, 'vol_spike': 0.29187260421570166, 'adx_thresh': 9.780968443591116, 'atr_min_pct': 0.008105158330047737, 'atr_max_pct': 0.022992719518478585, 'tp_mult': 2.596381454940872, 'tsl_mult': 0.8237173852733387, 'strategy': 'mean_reversion', 'time_stop': 212, 'use_sma': True, 'use_atr': False, 'use_adx': False, 'use_ema': False, 'use_spike': True, 'rsi_required': False, 'edge_k': 0.9127026580394257, 'edge_cap': 0.2717757593994574, 'bull_strategy': 'mean_reversion', 'bull_bb_std_mult': 2.5452027159638675, 'bull_rsi_os': 20, 'bull_rsi_ob': 69, 'bull_adx_thresh': 29.75147827791388, 'bull_atr_min_pct': 0.017487240210023947, 'bull_atr_max_pct': 0.09529095059883282, 'bull_tp_mult': 2.55681421615237, 'bull_tsl_mult': 0.9164241998590921, 'bull_time_stop': 200, 'bull_use_sma': True, 'bull_use_ema': False, 'bull_use_atr': False, 'bull_use_adx': True, 'bull_use_spike': True, 'bull_rsi_required': False, 'bear_strategy': 'breakout', 'bear_bb_std_mult': 2.17843661609686, 'bear_rsi_os': 38, 'bear_rsi_ob': 86, 'bear_adx_thresh': 22.2467470463012, 'bear_atr_min_pct': 0.005443039846675757, 'bear_atr_max_pct': 0.0677702467505377, 'bear_tp_mult': 2.8121153282063354, 'bear_tsl_mult': 0.08062818975235092, 'bear_time_stop': 277, 'bear_use_sma': False, 'bear_use_ema': False, 'bear_use_atr': False, 'bear_use_adx': False, 'bear_use_spike': True, 'bear_rsi_required': False, 'sideways_strategy': 'breakout', 'sideways_bb_std_mult': 3.596773745318109, 'sideways_rsi_os': 24, 'sideways_rsi_ob': 84, 'sideways_adx_thresh': 14.413513436881361, 'sideways_atr_min_pct': 0.0139438069957972, 'sideways_atr_max_pct': 0.0331867854890986, 'sideways_tp_mult': 2.4588238834777254, 'sideways_tsl_mult': 0.6341395154736924, 'sideways_time_stop': 133, 'sideways_use_sma': False, 'sideways_use_ema': False, 'sideways_use_atr': True, 'sideways_use_adx': False, 'sideways_use_spike': False, 'sideways_rsi_required': True}.
[I 2025-08-29 21:03:19,095] Trial 751 finished with values: [0.0003883900701378007, 0.001427967104261677] and parameters: {'p_sma': 18, 'p_std': 32, 'p_atr': 16, 'p_adx': 7, 'rsi_period': 35, 'ema1': 22, 'ema2': 23, 'slip_atr_k': 0.00390628847840795, 'slip_spread_k': 0.13474393544890206, 'spread_hl_frac': 0.01780797122910199, 'bb_std_mult': 0.9452836216020126, 'rsi_os': 5, 'rsi_ob': 81, 'vol_spike': 0.29411786004734997, 'adx_thresh': 9.353737268480776, 'atr_min_pct': 0.008025063725933368, 'atr_max_pct': 0.03492536268662167, 'tp_mult': 2.5408054876206574, 'tsl_mult': 0.8347811632097683, 'strategy': 'mean_reversion', 'time_stop': 209, 'use_sma': True, 'use_atr': False, 'use_adx': False, 'use_ema': False, 'use_spike': True, 'rsi_required': False, 'edge_k': 0.9804964185858888, 'edge_cap': 0.3149030662312205, 'bull_strategy': 'mean_reversion', 'bull_bb_std_mult': 2.468671370979777, 'bull_rsi_os': 19, 'bull_rsi_ob': 70, 'bull_adx_thresh': 28.889069997759762, 'bull_atr_min_pct': 0.016793753063696387, 'bull_atr_max_pct': 0.09785477926986438, 'bull_tp_mult': 2.5767360620452915, 'bull_tsl_mult': 0.8778800989341973, 'bull_time_stop': 191, 'bull_use_sma': True, 'bull_use_ema': False, 'bull_use_atr': False, 'bull_use_adx': True, 'bull_use_spike': True, 'bull_rsi_required': False, 'bear_strategy': 'breakout', 'bear_bb_std_mult': 2.1279430016504803, 'bear_rsi_os': 38, 'bear_rsi_ob': 87, 'bear_adx_thresh': 20.629710130459845, 'bear_atr_min_pct': 0.005952361376072208, 'bear_atr_max_pct': 0.07639996019038484, 'bear_tp_mult': 2.779989593514749, 'bear_tsl_mult': 0.0626855029313953, 'bear_time_stop': 284, 'bear_use_sma': False, 'bear_use_ema': False, 'bear_use_atr': False, 'bear_use_adx': False, 'bear_use_spike': True, 'bear_rsi_required': False, 'sideways_strategy': 'breakout', 'sideways_bb_std_mult': 3.461195665633956, 'sideways_rsi_os': 23, 'sideways_rsi_ob': 82, 'sideways_adx_thresh': 13.886131814378771, 'sideways_atr_min_pct': 0.014190435458166733, 'sideways_atr_max_pct': 0.0304992829955758, 'sideways_tp_mult': 2.4833626845981667, 'sideways_tsl_mult': 0.650198372665947, 'sideways_time_stop': 141, 'sideways_use_sma': False, 'sideways_use_ema': False, 'sideways_use_atr': True, 'sideways_use_adx': False, 'sideways_use_spike': False, 'sideways_rsi_required': True}.
[I 2025-08-29 21:03:19,290] Trial 750 finished with values: [-0.001413585368000514, 0.0022230880987814563] and parameters: {'p_sma': 17, 'p_std': 32, 'p_atr': 16, 'p_adx': 7, 'rsi_period': 35, 'ema1': 23, 'ema2': 23, 'slip_atr_k': 0.05879352235428012, 'slip_spread_k': 0.10127795486343136, 'spread_hl_frac': 0.017611088311002786, 'bb_std_mult': 1.0962079169406966, 'rsi_os': 5, 'rsi_ob': 81, 'vol_spike': 0.27507879975251065, 'adx_thresh': 10.402034904978255, 'atr_min_pct': 0.008276406210043934, 'atr_max_pct': 0.03431214964469675, 'tp_mult': 2.5266094309680143, 'tsl_mult': 0.7908709156864935, 'strategy': 'mean_reversion', 'time_stop': 208, 'use_sma': True, 'use_atr': False, 'use_adx': False, 'use_ema': False, 'use_spike': True, 'rsi_required': False, 'edge_k': 0.9828347463899155, 'edge_cap': 0.3097748178088028, 'bull_strategy': 'mean_reversion', 'bull_bb_std_mult': 2.448325267255751, 'bull_rsi_os': 19, 'bull_rsi_ob': 70, 'bull_adx_thresh': 29.159698909673736, 'bull_atr_min_pct': 0.016725930106871557, 'bull_atr_max_pct': 0.09337742094600052, 'bull_tp_mult': 2.576847190190108, 'bull_tsl_mult': 0.8802199124016052, 'bull_time_stop': 192, 'bull_use_sma': True, 'bull_use_ema': False, 'bull_use_atr': False, 'bull_use_adx': True, 'bull_use_spike': True, 'bull_rsi_required': False, 'bear_strategy': 'breakout', 'bear_bb_std_mult': 2.1168310092353706, 'bear_rsi_os': 38, 'bear_rsi_ob': 87, 'bear_adx_thresh': 33.46459489239393, 'bear_atr_min_pct': 0.0058120124191809895, 'bear_atr_max_pct': 0.07748866276863928, 'bear_tp_mult': 2.7848771868073885, 'bear_tsl_mult': 0.05467966776180708, 'bear_time_stop': 284, 'bear_use_sma': False, 'bear_use_ema': False, 'bear_use_atr': False, 'bear_use_adx': False, 'bear_use_spike': True, 'bear_rsi_required': False, 'sideways_strategy': 'breakout', 'sideways_bb_std_mult': 3.4994700107459713, 'sideways_rsi_os': 23, 'sideways_rsi_ob': 82, 'sideways_adx_thresh': 14.030907501465538, 'sideways_atr_min_pct': 0.014152357856591793, 'sideways_atr_max_pct': 0.03665972619538844, 'sideways_tp_mult': 2.3873021172235314, 'sideways_tsl_mult': 0.5974691669010248, 'sideways_time_stop': 139, 'sideways_use_sma': False, 'sideways_use_ema': False, 'sideways_use_atr': True, 'sideways_use_adx': False, 'sideways_use_spike': False, 'sideways_rsi_required': True}.
[I 2025-08-29 21:03:19,437] Trial 749 finished with values: [-0.0001623185716034259, 0.0019198869054564455] and parameters: {'p_sma': 15, 'p_std': 31, 'p_atr': 17, 'p_adx': 7, 'rsi_period': 35, 'ema1': 23, 'ema2': 24, 'slip_atr_k': 0.004508620300806147, 'slip_spread_k': 0.09732866733154288, 'spread_hl_frac': 0.020258997170259984, 'bb_std_mult': 0.9852957363318076, 'rsi_os': 5, 'rsi_ob': 79, 'vol_spike': 0.28365583392204563, 'adx_thresh': 10.333225233902775, 'atr_min_pct': 0.009323921103259023, 'atr_max_pct': 0.026085305470285414, 'tp_mult': 2.5355075591714717, 'tsl_mult': 0.8185499523978701, 'strategy': 'mean_reversion', 'time_stop': 216, 'use_sma': True, 'use_atr': False, 'use_adx': False, 'use_ema': False, 'use_spike': True, 'rsi_required': False, 'edge_k': 0.9785226665148212, 'edge_cap': 0.3248995463504916, 'bull_strategy': 'mean_reversion', 'bull_bb_std_mult': 2.4808012665952095, 'bull_rsi_os': 19, 'bull_rsi_ob': 68, 'bull_adx_thresh': 29.906017914975852, 'bull_atr_min_pct': 0.017632282868866617, 'bull_atr_max_pct': 0.09626714393681837, 'bull_tp_mult': 2.5719295245283256, 'bull_tsl_mult': 0.9205153329098318, 'bull_time_stop': 205, 'bull_use_sma': True, 'bull_use_ema': False, 'bull_use_atr': False, 'bull_use_adx': True, 'bull_use_spike': True, 'bull_rsi_required': False, 'bear_strategy': 'breakout', 'bear_bb_std_mult': 2.25329906453829, 'bear_rsi_os': 40, 'bear_rsi_ob': 86, 'bear_adx_thresh': 20.838896224420637, 'bear_atr_min_pct': 0.0051034970862231755, 'bear_atr_max_pct': 0.07716960952680604, 'bear_tp_mult': 2.7741683217833946, 'bear_tsl_mult': 0.1154193271996136, 'bear_time_stop': 271, 'bear_use_sma': False, 'bear_use_ema': False, 'bear_use_atr': False, 'bear_use_adx': False, 'bear_use_spike': True, 'bear_rsi_required': False, 'sideways_strategy': 'breakout', 'sideways_bb_std_mult': 3.5031233303206024, 'sideways_rsi_os': 23, 'sideways_rsi_ob': 84, 'sideways_adx_thresh': 15.193226130018857, 'sideways_atr_min_pct': 0.014001910755827657, 'sideways_atr_max_pct': 0.03138453903227802, 'sideways_tp_mult': 2.4084808273284812, 'sideways_tsl_mult': 0.6434167223468807, 'sideways_time_stop': 133, 'sideways_use_sma': False, 'sideways_use_ema': False, 'sideways_use_atr': True, 'sideways_use_adx': False, 'sideways_use_spike': False, 'sideways_rsi_required': True}.
[I 2025-08-29 21:03:19,524] Trial 748 finished with values: [-0.0011849699172389316, 0.0027553187945462665] and parameters: {'p_sma': 17, 'p_std': 31, 'p_atr': 17, 'p_adx': 7, 'rsi_period': 32, 'ema1': 23, 'ema2': 24, 'slip_atr_k': 0.005245745618312213, 'slip_spread_k': 0.12801634729009978, 'spread_hl_frac': 0.020417525785214302, 'bb_std_mult': 0.9675843057017218, 'rsi_os': 5, 'rsi_ob': 79, 'vol_spike': 0.284188937557122, 'adx_thresh': 10.42881297308029, 'atr_min_pct': 0.00959940032492749, 'atr_max_pct': 0.027688105382086357, 'tp_mult': 2.5372077910554243, 'tsl_mult': 0.8280857727832646, 'strategy': 'mean_reversion', 'time_stop': 219, 'use_sma': True, 'use_atr': False, 'use_adx': False, 'use_ema': False, 'use_spike': True, 'rsi_required': False, 'edge_k': 1.031975866000779, 'edge_cap': 0.3221341857545059, 'bull_strategy': 'mean_reversion', 'bull_bb_std_mult': 2.486438391638836, 'bull_rsi_os': 21, 'bull_rsi_ob': 69, 'bull_adx_thresh': 29.987609309322877, 'bull_atr_min_pct': 0.016784822579045233, 'bull_atr_max_pct': 0.09658842086670158, 'bull_tp_mult': 2.5618969934279536, 'bull_tsl_mult': 0.8973261532759701, 'bull_time_stop': 205, 'bull_use_sma': True, 'bull_use_ema': False, 'bull_use_atr': False, 'bull_use_adx': True, 'bull_use_spike': True, 'bull_rsi_required': False, 'bear_strategy': 'breakout', 'bear_bb_std_mult': 2.248291300546346, 'bear_rsi_os': 38, 'bear_rsi_ob': 86, 'bear_adx_thresh': 20.580517601231723, 'bear_atr_min_pct': 0.005087595023523981, 'bear_atr_max_pct': 0.07668222370127466, 'bear_tp_mult': 2.790803571779662, 'bear_tsl_mult': 0.11051250825721626, 'bear_time_stop': 272, 'bear_use_sma': False, 'bear_use_ema': False, 'bear_use_atr': False, 'bear_use_adx': False, 'bear_use_spike': True, 'bear_rsi_required': False, 'sideways_strategy': 'breakout', 'sideways_bb_std_mult': 3.512656797666368, 'sideways_rsi_os': 23, 'sideways_rsi_ob': 84, 'sideways_adx_thresh': 15.325298639011782, 'sideways_atr_min_pct': 0.013803150687941551, 'sideways_atr_max_pct': 0.03335853524320023, 'sideways_tp_mult': 2.405650760633821, 'sideways_tsl_mult': 0.6537950492854326, 'sideways_time_stop': 130, 'sideways_use_sma': False, 'sideways_use_ema': False, 'sideways_use_atr': True, 'sideways_use_adx': False, 'sideways_use_spike': False, 'sideways_rsi_required': True}.
[I 2025-08-29 21:03:48,328] Trial 752 finished with values: [0.00017370283452589064, 0.001599812510515808] and parameters: {'p_sma': 17, 'p_std': 31, 'p_atr': 16, 'p_adx': 8, 'rsi_period': 34, 'ema1': 23, 'ema2': 24, 'slip_atr_k': 0.012561169617254585, 'slip_spread_k': 0.1326166847765175, 'spread_hl_frac': 0.017335593220545585, 'bb_std_mult': 1.0755804720456525, 'rsi_os': 6, 'rsi_ob': 81, 'vol_spike': 0.2775256024062139, 'adx_thresh': 10.20713685908326, 'atr_min_pct': 0.010900886875666035, 'atr_max_pct': 0.03319053587503938, 'tp_mult': 2.5275652628212635, 'tsl_mult': 0.8303244818975234, 'strategy': 'mean_reversion', 'time_stop': 206, 'use_sma': True, 'use_atr': False, 'use_adx': False, 'use_ema': False, 'use_spike': True, 'rsi_required': False, 'edge_k': 0.9773705253094609, 'edge_cap': 0.3067141371868861, 'bull_strategy': 'mean_reversion', 'bull_bb_std_mult': 2.4629931557318314, 'bull_rsi_os': 21, 'bull_rsi_ob': 70, 'bull_adx_thresh': 28.9505526072207, 'bull_atr_min_pct': 0.01689748387629517, 'bull_atr_max_pct': 0.09359767044553785, 'bull_tp_mult': 2.504430193007077, 'bull_tsl_mult': 0.8846735652436389, 'bull_time_stop': 192, 'bull_use_sma': True, 'bull_use_ema': False, 'bull_use_atr': False, 'bull_use_adx': True, 'bull_use_spike': True, 'bull_rsi_required': False, 'bear_strategy': 'breakout', 'bear_bb_std_mult': 2.1255485359486386, 'bear_rsi_os': 38, 'bear_rsi_ob': 87, 'bear_adx_thresh': 20.62308721804056, 'bear_atr_min_pct': 0.0061137783028529825, 'bear_atr_max_pct': 0.06332952026298508, 'bear_tp_mult': 2.7818997832364243, 'bear_tsl_mult': 0.05609944688851329, 'bear_time_stop': 283, 'bear_use_sma': False, 'bear_use_ema': False, 'bear_use_atr': False, 'bear_use_adx': False, 'bear_use_spike': True, 'bear_rsi_required': False, 'sideways_strategy': 'breakout', 'sideways_bb_std_mult': 3.4771244271255455, 'sideways_rsi_os': 23, 'sideways_rsi_ob': 82, 'sideways_adx_thresh': 14.297384355385802, 'sideways_atr_min_pct': 0.012919203738751849, 'sideways_atr_max_pct': 0.036853231796896695, 'sideways_tp_mult': 2.391227190918211, 'sideways_tsl_mult': 0.6538248968745276, 'sideways_time_stop': 142, 'sideways_use_sma': False, 'sideways_use_ema': False, 'sideways_use_atr': True, 'sideways_use_adx': False, 'sideways_use_spike': False, 'sideways_rsi_required': True}.
[I 2025-08-29 21:03:48,428] Trial 754 finished with values: [-1000000000.0, 1000000000.0] and parameters: {'p_sma': 18, 'p_std': 31, 'p_atr': 18, 'p_adx': 8, 'rsi_period': 35, 'ema1': 22, 'ema2': 21, 'slip_atr_k': 0.08111375863478418, 'slip_spread_k': 0.1367921856520324, 'spread_hl_frac': 0.018144595880394764, 'bb_std_mult': 0.9304032161764053, 'rsi_os': 6, 'rsi_ob': 80, 'vol_spike': 0.29525159216804114, 'adx_thresh': 10.62622154399381, 'atr_min_pct': 0.011403658688676162, 'atr_max_pct': 0.04072812222320882, 'tp_mult': 2.562697387246682, 'tsl_mult': 0.8349801928132585, 'strategy': 'mean_reversion', 'time_stop': 206, 'use_sma': True, 'use_atr': False, 'use_adx': False, 'use_ema': False, 'use_spike': True, 'rsi_required': False, 'edge_k': 0.9441594843645249, 'edge_cap': 0.29201785452731094, 'bull_strategy': 'mean_reversion', 'bull_bb_std_mult': 2.3475022860528356, 'bull_rsi_os': 21, 'bull_rsi_ob': 68, 'bull_adx_thresh': 30.660814887539498, 'bull_atr_min_pct': 0.01680512557704468, 'bull_atr_max_pct': 0.10173294375807569, 'bull_tp_mult': 2.5883440402307847, 'bull_tsl_mult': 0.8717000931800136, 'bull_time_stop': 194, 'bull_use_sma': True, 'bull_use_ema': False, 'bull_use_atr': False, 'bull_use_adx': True, 'bull_use_spike': True, 'bull_rsi_required': False, 'bear_strategy': 'breakout', 'bear_bb_std_mult': 2.079943512496001, 'bear_rsi_os': 38, 'bear_rsi_ob': 87, 'bear_adx_thresh': 19.462299530449492, 'bear_atr_min_pct': 0.006470845071486384, 'bear_atr_max_pct': 0.07381439128686858, 'bear_tp_mult': 2.8544923911588143, 'bear_tsl_mult': 0.0895022753446914, 'bear_time_stop': 284, 'bear_use_sma': False, 'bear_use_ema': False, 'bear_use_atr': False, 'bear_use_adx': False, 'bear_use_spike': True, 'bear_rsi_required': False, 'sideways_strategy': 'breakout', 'sideways_bb_std_mult': 3.472980653822002, 'sideways_rsi_os': 24, 'sideways_rsi_ob': 82, 'sideways_adx_thresh': 15.298264216615362, 'sideways_atr_min_pct': 0.012840338435457732, 'sideways_atr_max_pct': 0.03181679432502229, 'sideways_tp_mult': 2.492719606495507, 'sideways_tsl_mult': 0.6588359539853188, 'sideways_time_stop': 126, 'sideways_use_sma': False, 'sideways_use_ema': False, 'sideways_use_atr': True, 'sideways_use_adx': False, 'sideways_use_spike': False, 'sideways_rsi_required': True}.
[I 2025-08-29 21:03:48,445] Trial 753 finished with values: [0.0022529883044590804, 0.0006790397194877815] and parameters: {'p_sma': 18, 'p_std': 32, 'p_atr': 17, 'p_adx': 8, 'rsi_period': 35, 'ema1': 23, 'ema2': 24, 'slip_atr_k': 9.854480031838456e-05, 'slip_spread_k': 0.1307296266850117, 'spread_hl_frac': 0.02040494080690184, 'bb_std_mult': 0.9466470404370935, 'rsi_os': 6, 'rsi_ob': 80, 'vol_spike': 0.294375892392637, 'adx_thresh': 9.164033093247497, 'atr_min_pct': 0.010646425882839289, 'atr_max_pct': 0.030161332388963936, 'tp_mult': 2.5411273992764283, 'tsl_mult': 0.8258876206872013, 'strategy': 'mean_reversion', 'time_stop': 208, 'use_sma': True, 'use_atr': False, 'use_adx': False, 'use_ema': False, 'use_spike': True, 'rsi_required': False, 'edge_k': 1.0274589036075865, 'edge_cap': 0.29442554990223463, 'bull_strategy': 'mean_reversion', 'bull_bb_std_mult': 2.6974331470012554, 'bull_rsi_os': 21, 'bull_rsi_ob': 70, 'bull_adx_thresh': 28.749121283459957, 'bull_atr_min_pct': 0.016678943210756275, 'bull_atr_max_pct': 0.0973105779198849, 'bull_tp_mult': 2.496139149579053, 'bull_tsl_mult': 0.8878275524657566, 'bull_time_stop': 206, 'bull_use_sma': True, 'bull_use_ema': False, 'bull_use_atr': False, 'bull_use_adx': True, 'bull_use_spike': True, 'bull_rsi_required': False, 'bear_strategy': 'breakout', 'bear_bb_std_mult': 2.272731100423939, 'bear_rsi_os': 40, 'bear_rsi_ob': 87, 'bear_adx_thresh': 19.405453373309854, 'bear_atr_min_pct': 0.0063050118371151325, 'bear_atr_max_pct': 0.07573173022043078, 'bear_tp_mult': 2.867099000776714, 'bear_tsl_mult': 0.06048776640689407, 'bear_time_stop': 268, 'bear_use_sma': False, 'bear_use_ema': False, 'bear_use_atr': False, 'bear_use_adx': False, 'bear_use_spike': True, 'bear_rsi_required': False, 'sideways_strategy': 'breakout', 'sideways_bb_std_mult': 3.547044497353579, 'sideways_rsi_os': 22, 'sideways_rsi_ob': 82, 'sideways_adx_thresh': 13.781040671048672, 'sideways_atr_min_pct': 0.013200254157853827, 'sideways_atr_max_pct': 0.03047005068855629, 'sideways_tp_mult': 2.4016741083897672, 'sideways_tsl_mult': 0.6542581451490611, 'sideways_time_stop': 126, 'sideways_use_sma': False, 'sideways_use_ema': False, 'sideways_use_atr': True, 'sideways_use_adx': False, 'sideways_use_spike': False, 'sideways_rsi_required': True}.
[I 2025-08-29 21:03:48,543] Trial 755 finished with values: [0.00197292761618284, 0.0007665693404441524] and parameters: {'p_sma': 18, 'p_std': 29, 'p_atr': 16, 'p_adx': 8, 'rsi_period': 35, 'ema1': 23, 'ema2': 22, 'slip_atr_k': 1.13222957716977e-06, 'slip_spread_k': 0.13836872816649093, 'spread_hl_frac': 0.017535025674218243, 'bb_std_mult': 1.064760276526059, 'rsi_os': 6, 'rsi_ob': 81, 'vol_spike': 0.2968808680312283, 'adx_thresh': 10.791532045060569, 'atr_min_pct': 0.011194312589788001, 'atr_max_pct': 0.030730290352799658, 'tp_mult': 2.6603263650526006, 'tsl_mult': 0.8254154108918889, 'strategy': 'mean_reversion', 'time_stop': 209, 'use_sma': True, 'use_atr': False, 'use_adx': False, 'use_ema': False, 'use_spike': True, 'rsi_required': False, 'edge_k': 0.9993654729836984, 'edge_cap': 0.2927987431680131, 'bull_strategy': 'mean_reversion', 'bull_bb_std_mult': 2.334594168115451, 'bull_rsi_os': 21, 'bull_rsi_ob': 70, 'bull_adx_thresh': 28.782006798206798, 'bull_atr_min_pct': 0.016901416932327825, 'bull_atr_max_pct': 0.1017188820630501, 'bull_tp_mult': 2.5920571655428355, 'bull_tsl_mult': 0.8745116301514765, 'bull_time_stop': 190, 'bull_use_sma': True, 'bull_use_ema': False, 'bull_use_atr': False, 'bull_use_adx': True, 'bull_use_spike': True, 'bull_rsi_required': False, 'bear_strategy': 'breakout', 'bear_bb_std_mult': 2.059916434264487, 'bear_rsi_os': 40, 'bear_rsi_ob': 87, 'bear_adx_thresh': 19.426075225153358, 'bear_atr_min_pct': 0.006395200595352021, 'bear_atr_max_pct': 0.07314085147584877, 'bear_tp_mult': 2.758777059185707, 'bear_tsl_mult': 0.05779943144887551, 'bear_time_stop': 286, 'bear_use_sma': False, 'bear_use_ema': False, 'bear_use_atr': False, 'bear_use_adx': False, 'bear_use_spike': True, 'bear_rsi_required': False, 'sideways_strategy': 'breakout', 'sideways_bb_std_mult': 3.446339194139601, 'sideways_rsi_os': 25, 'sideways_rsi_ob': 82, 'sideways_adx_thresh': 13.806898648667914, 'sideways_atr_min_pct': 0.012960743303656954, 'sideways_atr_max_pct': 0.029952893845124215, 'sideways_tp_mult': 2.491240597542431, 'sideways_tsl_mult': 0.6576315046186265, 'sideways_time_stop': 142, 'sideways_use_sma': False, 'sideways_use_ema': False, 'sideways_use_atr': True, 'sideways_use_adx': False, 'sideways_use_spike': False, 'sideways_rsi_required': True}.
