[I 2025-08-29 21:17:17,027] Trial 861 finished with values: [-0.020706590636219935, 0.020884077838039045] and parameters: {'p_sma': 14, 'p_std': 34, 'p_atr': 14, 'p_adx': 8, 'rsi_period': 33, 'ema1': 23, 'ema2': 26, 'slip_atr_k': 0.012443024561458127, 'slip_spread_k': 0.07686545499909203, 'spread_hl_frac': 0.026343437813447685, 'bb_std_mult': 0.8322079592023489, 'rsi_os': 8, 'rsi_ob': 79, 'vol_spike': 0.2824144579169173, 'adx_thresh': 7.263139518633961, 'atr_min_pct': 0.011595194817257213, 'atr_max_pct': 0.11522920085425911, 'tp_mult': 2.389719759579745, 'tsl_mult': 0.779381724361087, 'strategy': 'mean_reversion', 'time_stop': 226, 'use_sma': True, 'use_atr': False, 'use_adx': False, 'use_ema': False, 'use_spike': True, 'rsi_required': False, 'edge_k': 1.4299062190134901, 'edge_cap': 0.2590289972710548, 'bull_strategy': 'mean_reversion', 'bull_bb_std_mult': 2.815548037030646, 'bull_rsi_os': 25, 'bull_rsi_ob': 68, 'bull_adx_thresh': 33.564544140942814, 'bull_atr_min_pct': 0.01970873710296221, 'bull_atr_max_pct': 0.10079711050748334, 'bull_tp_mult': 2.3899589422102245, 'bull_tsl_mult': 0.9388189260252364, 'bull_time_stop': 195, 'bull_use_sma': True, 'bull_use_ema': False, 'bull_use_atr': False, 'bull_use_adx': True, 'bull_use_spike': True, 'bull_rsi_required': False, 'bear_strategy': 'breakout', 'bear_bb_std_mult': 2.3427288486396907, 'bear_rsi_os': 39, 'bear_rsi_ob': 86, 'bear_adx_thresh': 16.061363168025963, 'bear_atr_min_pct': 0.0021808609589059145, 'bear_atr_max_pct': 0.0894205874309203, 'bear_tp_mult': 2.8942710682744397, 'bear_tsl_mult': 0.001959424258168689, 'bear_time_stop': 255, 'bear_use_sma': False, 'bear_use_ema': False, 'bear_use_atr': False, 'bear_use_adx': False, 'bear_use_spike': True, 'bear_rsi_required': False, 'sideways_strategy': 'breakout', 'sideways_bb_std_mult': 3.4120069968683278, 'sideways_rsi_os': 23, 'sideways_rsi_ob': 61, 'sideways_adx_thresh': 10.517335622488627, 'sideways_atr_min_pct': 0.013223655424627027, 'sideways_atr_max_pct': 0.038441216972296785, 'sideways_tp_mult': 2.443891385214327, 'sideways_tsl_mult': 0.5783780867965486, 'sideways_time_stop': 160, 'sideways_use_sma': False, 'sideways_use_ema': True, 'sideways_use_atr': True, 'sideways_use_adx': False, 'sideways_use_spike': False, 'sideways_rsi_required': True}.
[I 2025-08-29 21:17:17,736] Trial 867 finished with values: [-1000000000.0, 1000000000.0] and parameters: {'p_sma': 14, 'p_std': 38, 'p_atr': 13, 'p_adx': 8, 'rsi_period': 67, 'ema1': 24, 'ema2': 28, 'slip_atr_k': 0.020595632545012253, 'slip_spread_k': 0.11917747220593289, 'spread_hl_frac': 0.021871108999553433, 'bb_std_mult': 0.9257979308344458, 'rsi_os': 7, 'rsi_ob': 47, 'vol_spike': 0.2876665587225668, 'adx_thresh': 8.11888624556516, 'atr_min_pct': 0.01305825584225041, 'atr_max_pct': 0.04265742628466577, 'tp_mult': 2.3842490795440234, 'tsl_mult': 0.7554922287873647, 'strategy': 'mean_reversion', 'time_stop': 235, 'use_sma': True, 'use_atr': False, 'use_adx': False, 'use_ema': False, 'use_spike': True, 'rsi_required': False, 'edge_k': 0.8929132235946607, 'edge_cap': 0.34509630107377337, 'bull_strategy': 'mean_reversion', 'bull_bb_std_mult': 2.8205268448410106, 'bull_rsi_os': 25, 'bull_rsi_ob': 69, 'bull_adx_thresh': 22.623941734788453, 'bull_atr_min_pct': 0.02669793738847359, 'bull_atr_max_pct': 0.10376498775213655, 'bull_tp_mult': 2.381616148358823, 'bull_tsl_mult': 0.9978936484641656, 'bull_time_stop': 208, 'bull_use_sma': True, 'bull_use_ema': False, 'bull_use_atr': False, 'bull_use_adx': True, 'bull_use_spike': True, 'bull_rsi_required': False, 'bear_strategy': 'breakout', 'bear_bb_std_mult': 1.4229463506431779, 'bear_rsi_os': 38, 'bear_rsi_ob': 86, 'bear_adx_thresh': 28.665237715322323, 'bear_atr_min_pct': 0.006550084773252647, 'bear_atr_max_pct': 0.08258755417521531, 'bear_tp_mult': 2.966237162611884, 'bear_tsl_mult': 0.07059270561412148, 'bear_time_stop': 199, 'bear_use_sma': False, 'bear_use_ema': False, 'bear_use_atr': False, 'bear_use_adx': False, 'bear_use_spike': True, 'bear_rsi_required': False, 'sideways_strategy': 'breakout', 'sideways_bb_std_mult': 3.4882652072344547, 'sideways_rsi_os': 21, 'sideways_rsi_ob': 84, 'sideways_adx_thresh': 12.370844112697263, 'sideways_atr_min_pct': 0.015095967497066203, 'sideways_atr_max_pct': 0.034374158979768574, 'sideways_tp_mult': 2.3364525192464054, 'sideways_tsl_mult': 0.6037710162768358, 'sideways_time_stop': 167, 'sideways_use_sma': True, 'sideways_use_ema': False, 'sideways_use_atr': True, 'sideways_use_adx': False, 'sideways_use_spike': False, 'sideways_rsi_required': True}.
[I 2025-08-29 21:17:44,932] Trial 865 finished with values: [-1000000000.0, 1000000000.0] and parameters: {'p_sma': 17, 'p_std': 40, 'p_atr': 13, 'p_adx': 8, 'rsi_period': 65, 'ema1': 24, 'ema2': 28, 'slip_atr_k': 0.019164247001657808, 'slip_spread_k': 0.34110051085788984, 'spread_hl_frac': 0.026353462895406295, 'bb_std_mult': 0.9115163455989443, 'rsi_os': 7, 'rsi_ob': 79, 'vol_spike': 0.2875132139358148, 'adx_thresh': 10.178355942524735, 'atr_min_pct': 0.012767382454349671, 'atr_max_pct': 0.14787736427948575, 'tp_mult': 2.3778626547094035, 'tsl_mult': 0.7763718152757825, 'strategy': 'mean_reversion', 'time_stop': 228, 'use_sma': True, 'use_atr': False, 'use_adx': False, 'use_ema': False, 'use_spike': True, 'rsi_required': False, 'edge_k': 0.9131022998221285, 'edge_cap': 0.30713335653733737, 'bull_strategy': 'mean_reversion', 'bull_bb_std_mult': 2.653485303652514, 'bull_rsi_os': 21, 'bull_rsi_ob': 69, 'bull_adx_thresh': 33.765433876036376, 'bull_atr_min_pct': 0.01912365125864888, 'bull_atr_max_pct': 0.10407549427298142, 'bull_tp_mult': 2.3898568924385635, 'bull_tsl_mult': 0.9372353436773091, 'bull_time_stop': 209, 'bull_use_sma': True, 'bull_use_ema': False, 'bull_use_atr': False, 'bull_use_adx': True, 'bull_use_spike': True, 'bull_rsi_required': False, 'bear_strategy': 'breakout', 'bear_bb_std_mult': 3.192531908066573, 'bear_rsi_os': 41, 'bear_rsi_ob': 84, 'bear_adx_thresh': 13.267515145031975, 'bear_atr_min_pct': 0.006815576920828627, 'bear_atr_max_pct': 0.08970160844634308, 'bear_tp_mult': 2.7974461718127, 'bear_tsl_mult': 0.02052191313760446, 'bear_time_stop': 270, 'bear_use_sma': False, 'bear_use_ema': False, 'bear_use_atr': False, 'bear_use_adx': False, 'bear_use_spike': True, 'bear_rsi_required': False, 'sideways_strategy': 'breakout', 'sideways_bb_std_mult': 3.598472591585469, 'sideways_rsi_os': 23, 'sideways_rsi_ob': 82, 'sideways_adx_thresh': 12.929547421020322, 'sideways_atr_min_pct': 0.013741235183197947, 'sideways_atr_max_pct': 0.03646860401177638, 'sideways_tp_mult': 2.2784482608219223, 'sideways_tsl_mult': 0.5995242641273094, 'sideways_time_stop': 136, 'sideways_use_sma': False, 'sideways_use_ema': False, 'sideways_use_atr': True, 'sideways_use_adx': False, 'sideways_use_spike': False, 'sideways_rsi_required': True}.
[I 2025-08-29 21:17:45,149] Trial 868 finished with values: [-0.007481895113265136, 0.007380550122836249] and parameters: {'p_sma': 16, 'p_std': 26, 'p_atr': 15, 'p_adx': 10, 'rsi_period': 32, 'ema1': 12, 'ema2': 28, 'slip_atr_k': 0.24875068054766192, 'slip_spread_k': 0.1195057666070854, 'spread_hl_frac': 0.02603175223579533, 'bb_std_mult': 0.9416847684285949, 'rsi_os': 6, 'rsi_ob': 79, 'vol_spike': 0.2883522474458964, 'adx_thresh': 8.088556024119239, 'atr_min_pct': 0.012623215463025148, 'atr_max_pct': 0.04239851021165869, 'tp_mult': 2.4526662175385003, 'tsl_mult': 0.7537352860934947, 'strategy': 'mean_reversion', 'time_stop': 219, 'use_sma': True, 'use_atr': True, 'use_adx': False, 'use_ema': False, 'use_spike': True, 'rsi_required': False, 'edge_k': 0.31862593027912034, 'edge_cap': 0.3020303775769077, 'bull_strategy': 'mean_reversion', 'bull_bb_std_mult': 2.652980519609131, 'bull_rsi_os': 21, 'bull_rsi_ob': 70, 'bull_adx_thresh': 23.298309788433194, 'bull_atr_min_pct': 0.0049651272683778665, 'bull_atr_max_pct': 0.1042360627747262, 'bull_tp_mult': 2.4164087867522452, 'bull_tsl_mult': 0.9973951007300655, 'bull_time_stop': 206, 'bull_use_sma': False, 'bull_use_ema': False, 'bull_use_atr': False, 'bull_use_adx': True, 'bull_use_spike': True, 'bull_rsi_required': False, 'bear_strategy': 'breakout', 'bear_bb_std_mult': 3.115500243619488, 'bear_rsi_os': 37, 'bear_rsi_ob': 85, 'bear_adx_thresh': 13.332420444193847, 'bear_atr_min_pct': 0.006367015138707882, 'bear_atr_max_pct': 0.08086395294777757, 'bear_tp_mult': 2.9655613683113593, 'bear_tsl_mult': 0.06731447093402942, 'bear_time_stop': 241, 'bear_use_sma': False, 'bear_use_ema': False, 'bear_use_atr': False, 'bear_use_adx': False, 'bear_use_spike': True, 'bear_rsi_required': False, 'sideways_strategy': 'breakout', 'sideways_bb_std_mult': 3.48336974755813, 'sideways_rsi_os': 21, 'sideways_rsi_ob': 70, 'sideways_adx_thresh': 12.111431741674233, 'sideways_atr_min_pct': 0.01399010596815037, 'sideways_atr_max_pct': 0.04319359465563227, 'sideways_tp_mult': 2.352333179125494, 'sideways_tsl_mult': 0.6031940266499726, 'sideways_time_stop': 134, 'sideways_use_sma': True, 'sideways_use_ema': False, 'sideways_use_atr': True, 'sideways_use_adx': False, 'sideways_use_spike': False, 'sideways_rsi_required': True}.
[I 2025-08-29 21:17:45,322] Trial 866 finished with values: [-0.0025199583926381885, 0.002669876785161925] and parameters: {'p_sma': 58, 'p_std': 22, 'p_atr': 13, 'p_adx': 9, 'rsi_period': 34, 'ema1': 12, 'ema2': 28, 'slip_atr_k': 0.02018499817891571, 'slip_spread_k': 0.34503725629588944, 'spread_hl_frac': 0.02576277623189967, 'bb_std_mult': 0.9490482456400579, 'rsi_os': 7, 'rsi_ob': 79, 'vol_spike': 0.2869170802250054, 'adx_thresh': 8.210246445013455, 'atr_min_pct': 0.013058244655574858, 'atr_max_pct': 0.1347166016819186, 'tp_mult': 2.454076630348332, 'tsl_mult': 0.7577274777829667, 'strategy': 'mean_reversion', 'time_stop': 231, 'use_sma': True, 'use_atr': False, 'use_adx': False, 'use_ema': False, 'use_spike': True, 'rsi_required': False, 'edge_k': 1.8486147172144574, 'edge_cap': 0.297892479837926, 'bull_strategy': 'mean_reversion', 'bull_bb_std_mult': 2.8255005072700494, 'bull_rsi_os': 21, 'bull_rsi_ob': 83, 'bull_adx_thresh': 23.486819663571676, 'bull_atr_min_pct': 0.019030576519271272, 'bull_atr_max_pct': 0.10408412055603601, 'bull_tp_mult': 2.381420883048345, 'bull_tsl_mult': 0.19305471856938383, 'bull_time_stop': 199, 'bull_use_sma': True, 'bull_use_ema': False, 'bull_use_atr': False, 'bull_use_adx': True, 'bull_use_spike': True, 'bull_rsi_required': False, 'bear_strategy': 'breakout', 'bear_bb_std_mult': 3.11522046743309, 'bear_rsi_os': 37, 'bear_rsi_ob': 86, 'bear_adx_thresh': 13.526977486994483, 'bear_atr_min_pct': 0.006961923156091117, 'bear_atr_max_pct': 0.08932086188670019, 'bear_tp_mult': 2.96500956535958, 'bear_tsl_mult': 0.05978473659980699, 'bear_time_stop': 241, 'bear_use_sma': False, 'bear_use_ema': False, 'bear_use_atr': False, 'bear_use_adx': False, 'bear_use_spike': True, 'bear_rsi_required': False, 'sideways_strategy': 'breakout', 'sideways_bb_std_mult': 3.367791504542502, 'sideways_rsi_os': 19, 'sideways_rsi_ob': 83, 'sideways_adx_thresh': 12.345275824586833, 'sideways_atr_min_pct': 0.015126277536594342, 'sideways_atr_max_pct': 0.043874084176166776, 'sideways_tp_mult': 2.3539254468297712, 'sideways_tsl_mult': 0.6055298338573536, 'sideways_time_stop': 135, 'sideways_use_sma': False, 'sideways_use_ema': False, 'sideways_use_atr': True, 'sideways_use_adx': False, 'sideways_use_spike': False, 'sideways_rsi_required': True}.
[I 2025-08-29 21:17:46,697] Trial 869 finished with values: [-1000000000.0, 1000000000.0] and parameters: {'p_sma': 16, 'p_std': 41, 'p_atr': 15, 'p_adx': 7, 'rsi_period': 32, 'ema1': 8, 'ema2': 27, 'slip_atr_k': 0.12559793185532517, 'slip_spread_k': 0.10910819379498408, 'spread_hl_frac': 0.0259954115134282, 'bb_std_mult': 0.9831287813852114, 'rsi_os': 36, 'rsi_ob': 54, 'vol_spike': 0.2946247852988687, 'adx_thresh': 8.806198940197328, 'atr_min_pct': 0.012697219713027851, 'atr_max_pct': 0.05536553750240824, 'tp_mult': 2.4472732363154055, 'tsl_mult': 0.7581463678889266, 'strategy': 'mean_reversion', 'time_stop': 210, 'use_sma': True, 'use_atr': True, 'use_adx': False, 'use_ema': False, 'use_spike': True, 'rsi_required': False, 'edge_k': 1.8520177620902532, 'edge_cap': 0.37871075604035576, 'bull_strategy': 'mean_reversion', 'bull_bb_std_mult': 2.67342579982729, 'bull_rsi_os': 21, 'bull_rsi_ob': 55, 'bull_adx_thresh': 30.458176109690555, 'bull_atr_min_pct': 0.027768589248339765, 'bull_atr_max_pct': 0.10527366998834732, 'bull_tp_mult': 2.5132247338708433, 'bull_tsl_mult': 0.4193641493167233, 'bull_time_stop': 204, 'bull_use_sma': False, 'bull_use_ema': False, 'bull_use_atr': False, 'bull_use_adx': True, 'bull_use_spike': True, 'bull_rsi_required': False, 'bear_strategy': 'breakout', 'bear_bb_std_mult': 3.4795523793207224, 'bear_rsi_os': 41, 'bear_rsi_ob': 85, 'bear_adx_thresh': 13.233271090951218, 'bear_atr_min_pct': 0.01102242550815008, 'bear_atr_max_pct': 0.08037017786147736, 'bear_tp_mult': 2.793847412413952, 'bear_tsl_mult': 0.05070594485834486, 'bear_time_stop': 240, 'bear_use_sma': False, 'bear_use_ema': False, 'bear_use_atr': False, 'bear_use_adx': False, 'bear_use_spike': True, 'bear_rsi_required': False, 'sideways_strategy': 'breakout', 'sideways_bb_std_mult': 3.5946382853035495, 'sideways_rsi_os': 24, 'sideways_rsi_ob': 85, 'sideways_adx_thresh': 12.208296465837313, 'sideways_atr_min_pct': 0.010986859728346836, 'sideways_atr_max_pct': 0.044568665573469876, 'sideways_tp_mult': 2.3536800847611246, 'sideways_tsl_mult': 0.6087080675236052, 'sideways_time_stop': 134, 'sideways_use_sma': False, 'sideways_use_ema': False, 'sideways_use_atr': True, 'sideways_use_adx': False, 'sideways_use_spike': False, 'sideways_rsi_required': True}.
[I 2025-08-29 21:18:14,704] Trial 871 finished with values: [-1000000000.0, 1000000000.0] and parameters: {'p_sma': 58, 'p_std': 38, 'p_atr': 15, 'p_adx': 7, 'rsi_period': 25, 'ema1': 15, 'ema2': 25, 'slip_atr_k': 0.20760008632853977, 'slip_spread_k': 0.6938057617380574, 'spread_hl_frac': 0.02265788427226541, 'bb_std_mult': 0.7550835934481525, 'rsi_os': 17, 'rsi_ob': 49, 'vol_spike': 0.27428257937082384, 'adx_thresh': 9.259428348395092, 'atr_min_pct': 0.011190497615931773, 'atr_max_pct': 0.0361950611914151, 'tp_mult': 2.449297904553073, 'tsl_mult': 0.7369749701784513, 'strategy': 'breakout', 'time_stop': 209, 'use_sma': True, 'use_atr': False, 'use_adx': False, 'use_ema': False, 'use_spike': True, 'rsi_required': False, 'edge_k': 1.3586504724236688, 'edge_cap': 0.3785829813881976, 'bull_strategy': 'breakout', 'bull_bb_std_mult': 2.740130457376702, 'bull_rsi_os': 48, 'bull_rsi_ob': 67, 'bull_adx_thresh': 24.93112210594935, 'bull_atr_min_pct': 0.02763079329386587, 'bull_atr_max_pct': 0.10973962029590704, 'bull_tp_mult': 2.5125044639525993, 'bull_tsl_mult': 0.41580266102444235, 'bull_time_stop': 204, 'bull_use_sma': True, 'bull_use_ema': True, 'bull_use_atr': False, 'bull_use_adx': True, 'bull_use_spike': True, 'bull_rsi_required': False, 'bear_strategy': 'mean_reversion', 'bear_bb_std_mult': 0.972617038187187, 'bear_rsi_os': 40, 'bear_rsi_ob': 88, 'bear_adx_thresh': 15.059780325635963, 'bear_atr_min_pct': 0.011294586884614594, 'bear_atr_max_pct': 0.08041484083666449, 'bear_tp_mult': 2.8974236051845144, 'bear_tsl_mult': 0.04249930540262574, 'bear_time_stop': 242, 'bear_use_sma': True, 'bear_use_ema': False, 'bear_use_atr': True, 'bear_use_adx': False, 'bear_use_spike': True, 'bear_rsi_required': False, 'sideways_strategy': 'mean_reversion', 'sideways_bb_std_mult': 3.5346425342523577, 'sideways_rsi_os': 19, 'sideways_rsi_ob': 85, 'sideways_adx_thresh': 11.350709114474977, 'sideways_atr_min_pct': 0.011033911402300544, 'sideways_atr_max_pct': 0.047241377185115424, 'sideways_tp_mult': 2.3583417123713426, 'sideways_tsl_mult': 0.6335048811136815, 'sideways_time_stop': 150, 'sideways_use_sma': False, 'sideways_use_ema': False, 'sideways_use_atr': True, 'sideways_use_adx': False, 'sideways_use_spike': False, 'sideways_rsi_required': True}.
[I 2025-08-29 21:18:15,721] Trial 870 finished with values: [-1000000000.0, 1000000000.0] and parameters: {'p_sma': 16, 'p_std': 37, 'p_atr': 15, 'p_adx': 9, 'rsi_period': 25, 'ema1': 12, 'ema2': 25, 'slip_atr_k': 0.0984504707670746, 'slip_spread_k': 0.6957931174257915, 'spread_hl_frac': 0.022566406635873584, 'bb_std_mult': 0.7482710662420704, 'rsi_os': 53, 'rsi_ob': 54, 'vol_spike': 0.2717770009662165, 'adx_thresh': 9.24112808205489, 'atr_min_pct': 0.011094409295290849, 'atr_max_pct': 0.10771610011903343, 'tp_mult': 2.4446559911373673, 'tsl_mult': 0.8103975542328925, 'strategy': 'breakout', 'time_stop': 218, 'use_sma': True, 'use_atr': True, 'use_adx': False, 'use_ema': False, 'use_spike': True, 'rsi_required': False, 'edge_k': 0.9661691380070935, 'edge_cap': 0.3049335096106268, 'bull_strategy': 'breakout', 'bull_bb_std_mult': 2.7003572103535034, 'bull_rsi_os': 21, 'bull_rsi_ob': 70, 'bull_adx_thresh': 24.785412566818202, 'bull_atr_min_pct': 0.01764102263177382, 'bull_atr_max_pct': 0.11041833049769832, 'bull_tp_mult': 2.443091244081854, 'bull_tsl_mult': 0.4170208474517478, 'bull_time_stop': 200, 'bull_use_sma': False, 'bull_use_ema': True, 'bull_use_atr': False, 'bull_use_adx': True, 'bull_use_spike': True, 'bull_rsi_required': False, 'bear_strategy': 'mean_reversion', 'bear_bb_std_mult': 1.9799828751282578, 'bear_rsi_os': 37, 'bear_rsi_ob': 88, 'bear_adx_thresh': 14.896502722495358, 'bear_atr_min_pct': 0.026186004206244944, 'bear_atr_max_pct': 0.08099144940108514, 'bear_tp_mult': 2.8867714408200036, 'bear_tsl_mult': 0.05206347035838574, 'bear_time_stop': 265, 'bear_use_sma': True, 'bear_use_ema': False, 'bear_use_atr': False, 'bear_use_adx': False, 'bear_use_spike': True, 'bear_rsi_required': False, 'sideways_strategy': 'mean_reversion', 'sideways_bb_std_mult': 3.491121062320026, 'sideways_rsi_os': 19, 'sideways_rsi_ob': 83, 'sideways_adx_thresh': 12.08109376639381, 'sideways_atr_min_pct': 0.011099094520381316, 'sideways_atr_max_pct': 0.043335619242841635, 'sideways_tp_mult': 2.368332057484028, 'sideways_tsl_mult': 0.5293622969335832, 'sideways_time_stop': 151, 'sideways_use_sma': False, 'sideways_use_ema': False, 'sideways_use_atr': True, 'sideways_use_adx': False, 'sideways_use_spike': False, 'sideways_rsi_required': True}.
[I 2025-08-29 21:18:15,815] Trial 872 finished with values: [-1000000000.0, 1000000000.0] and parameters: {'p_sma': 16, 'p_std': 41, 'p_atr': 16, 'p_adx': 7, 'rsi_period': 70, 'ema1': 5, 'ema2': 24, 'slip_atr_k': 0.08660019171591829, 'slip_spread_k': 0.40831861628399185, 'spread_hl_frac': 0.02231429077400128, 'bb_std_mult': 0.7824288773441885, 'rsi_os': 6, 'rsi_ob': 77, 'vol_spike': 0.2946846713899744, 'adx_thresh': 9.265044266856002, 'atr_min_pct': 0.011106234609654254, 'atr_max_pct': 0.03695008288885088, 'tp_mult': 2.5100322456358195, 'tsl_mult': 0.7323830921980806, 'strategy': 'breakout', 'time_stop': 210, 'use_sma': False, 'use_atr': True, 'use_adx': False, 'use_ema': False, 'use_spike': True, 'rsi_required': True, 'edge_k': 0.001293898205126931, 'edge_cap': 0.277507272089383, 'bull_strategy': 'breakout', 'bull_bb_std_mult': 2.7140793708181516, 'bull_rsi_os': 48, 'bull_rsi_ob': 67, 'bull_adx_thresh': 24.869402269333996, 'bull_atr_min_pct': 0.007655080661480052, 'bull_atr_max_pct': 0.1083202416556061, 'bull_tp_mult': 2.251300949989667, 'bull_tsl_mult': 0.3641692144574512, 'bull_time_stop': 203, 'bull_use_sma': False, 'bull_use_ema': True, 'bull_use_atr': False, 'bull_use_adx': True, 'bull_use_spike': True, 'bull_rsi_required': False, 'bear_strategy': 'mean_reversion', 'bear_bb_std_mult': 2.4302126952194008, 'bear_rsi_os': 40, 'bear_rsi_ob': 88, 'bear_adx_thresh': 15.177412664383436, 'bear_atr_min_pct': 0.005979739180545923, 'bear_atr_max_pct': 0.07613608165036803, 'bear_tp_mult': 2.8863791948733617, 'bear_tsl_mult': 0.04324706644276484, 'bear_time_stop': 265, 'bear_use_sma': True, 'bear_use_ema': False, 'bear_use_atr': True, 'bear_use_adx': False, 'bear_use_spike': False, 'bear_rsi_required': False, 'sideways_strategy': 'mean_reversion', 'sideways_bb_std_mult': 3.5385128904105003, 'sideways_rsi_os': 22, 'sideways_rsi_ob': 85, 'sideways_adx_thresh': 11.329500532768044, 'sideways_atr_min_pct': 0.012484069424337153, 'sideways_atr_max_pct': 0.048457358186395454, 'sideways_tp_mult': 2.301635808735231, 'sideways_tsl_mult': 0.6402006414889674, 'sideways_time_stop': 153, 'sideways_use_sma': False, 'sideways_use_ema': False, 'sideways_use_atr': True, 'sideways_use_adx': False, 'sideways_use_spike': False, 'sideways_rsi_required': True}.
