[I 2025-08-29 19:39:44,617] Trial 30 finished with values: [-1000000000.0, 1000000000.0] and parameters: {'p_sma': 42, 'p_std': 56, 'p_atr': 21, 'p_adx': 27, 'rsi_period': 67, 'ema1': 8, 'ema2': 20, 'slip_atr_k': 0.134287594768038, 'slip_spread_k': 0.4765015217637435, 'spread_hl_frac': 0.04642042518383896, 'bb_std_mult': 0.919410815071722, 'rsi_os': 54, 'rsi_ob': 81, 'vol_spike': 0.10157525654803544, 'adx_thresh': 23.4248700083863, 'atr_min_pct': 0.020740310580061122, 'atr_max_pct': 0.14808220575799913, 'tp_mult': 1.7022826890963059, 'tsl_mult': 0.30203388180756624, 'strategy': 'mean_reversion', 'time_stop': 258, 'use_sma': True, 'use_atr': False, 'use_adx': True, 'use_ema': True, 'use_spike': True, 'rsi_required': True, 'edge_k': 1.1240046462707498, 'edge_cap': 0.5017810536546096, 'bull_strategy': 'breakout', 'bull_bb_std_mult': 1.1366393081685442, 'bull_rsi_os': 30, 'bull_rsi_ob': 92, 'bull_adx_thresh': 5.216334546909279, 'bull_atr_min_pct': 0.00937323495854217, 'bull_atr_max_pct': 0.0528368387222294, 'bull_tp_mult': 2.9774255125624274, 'bull_tsl_mult': 0.031623743828855244, 'bull_time_stop': 250, 'bull_use_sma': True, 'bull_use_ema': True, 'bull_use_atr': False, 'bull_use_adx': True, 'bull_use_spike': True, 'bull_rsi_required': False, 'bear_strategy': 'breakout', 'bear_bb_std_mult': 0.5924532275555487, 'bear_rsi_os': 17, 'bear_rsi_ob': 63, 'bear_adx_thresh': 17.647635672208846, 'bear_atr_min_pct': 0.004663802979824961, 'bear_atr_max_pct': 0.13384397656466887, 'bear_tp_mult': 2.239662405730649, 'bear_tsl_mult': 0.7033876038564605, 'bear_time_stop': 222, 'bear_use_sma': False, 'bear_use_ema': True, 'bear_use_atr': False, 'bear_use_adx': True, 'bear_use_spike': True, 'bear_rsi_required': True, 'sideways_strategy': 'mean_reversion', 'sideways_bb_std_mult': 1.8907933307136817, 'sideways_rsi_os': 6, 'sideways_rsi_ob': 80, 'sideways_adx_thresh': 30.737446354783277, 'sideways_atr_min_pct': 0.01819870781903015, 'sideways_atr_max_pct': 0.12062965237134071, 'sideways_tp_mult': 1.753805689269905, 'sideways_tsl_mult': 0.5244500917288984, 'sideways_time_stop': 127, 'sideways_use_sma': True, 'sideways_use_ema': True, 'sideways_use_atr': False, 'sideways_use_adx': False, 'sideways_use_spike': True, 'sideways_rsi_required': False}.
[I 2025-08-29 19:40:14,002] Trial 27 finished with values: [-0.008138342385929365, 0.008035732082883489] and parameters: {'p_sma': 40, 'p_std': 55, 'p_atr': 10, 'p_adx': 21, 'rsi_period': 16, 'ema1': 8, 'ema2': 17, 'slip_atr_k': 0.19039250902649285, 'slip_spread_k': 0.24682426144207997, 'spread_hl_frac': 0.04452197535170212, 'bb_std_mult': 1.7743246103370154, 'rsi_os': 55, 'rsi_ob': 79, 'vol_spike': 0.10193508104779314, 'adx_thresh': 11.135578413955715, 'atr_min_pct': 0.004654016122980182, 'atr_max_pct': 0.14373523163517435, 'tp_mult': 1.7678800427494834, 'tsl_mult': 0.32648253751826817, 'strategy': 'breakout', 'time_stop': 257, 'use_sma': False, 'use_atr': False, 'use_adx': True, 'use_ema': True, 'use_spike': True, 'rsi_required': False, 'edge_k': 1.4510355014738636, 'edge_cap': 0.7058707028310237, 'bull_strategy': 'breakout', 'bull_bb_std_mult': 2.10345523592995, 'bull_rsi_os': 44, 'bull_rsi_ob': 91, 'bull_adx_thresh': 5.727062975109703, 'bull_atr_min_pct': 0.009239419035410243, 'bull_atr_max_pct': 0.13613074263927438, 'bull_tp_mult': 2.983402079386244, 'bull_tsl_mult': 0.5136166083567794, 'bull_time_stop': 259, 'bull_use_sma': True, 'bull_use_ema': True, 'bull_use_atr': False, 'bull_use_adx': True, 'bull_use_spike': False, 'bull_rsi_required': True, 'bear_strategy': 'breakout', 'bear_bb_std_mult': 0.7679461748204147, 'bear_rsi_os': 19, 'bear_rsi_ob': 66, 'bear_adx_thresh': 8.985221783547384, 'bear_atr_min_pct': 0.005008335859973025, 'bear_atr_max_pct': 0.11147819268196472, 'bear_tp_mult': 2.36238817018806, 'bear_tsl_mult': 0.5514499931058521, 'bear_time_stop': 161, 'bear_use_sma': False, 'bear_use_ema': True, 'bear_use_atr': False, 'bear_use_adx': True, 'bear_use_spike': True, 'bear_rsi_required': True, 'sideways_strategy': 'breakout', 'sideways_bb_std_mult': 1.0236831332679917, 'sideways_rsi_os': 12, 'sideways_rsi_ob': 80, 'sideways_adx_thresh': 19.127960025541626, 'sideways_atr_min_pct': 0.014575109805127624, 'sideways_atr_max_pct': 0.07997552706518399, 'sideways_tp_mult': 2.2173397484005903, 'sideways_tsl_mult': 0.532096389049187, 'sideways_time_stop': 300, 'sideways_use_sma': True, 'sideways_use_ema': False, 'sideways_use_atr': False, 'sideways_use_adx': True, 'sideways_use_spike': True, 'sideways_rsi_required': False}.
[I 2025-08-29 19:40:14,029] Trial 29 finished with values: [-1000000000.0, 1000000000.0] and parameters: {'p_sma': 41, 'p_std': 54, 'p_atr': 10, 'p_adx': 22, 'rsi_period': 67, 'ema1': 8, 'ema2': 40, 'slip_atr_k': 0.1905130673233567, 'slip_spread_k': 0.21079126892282907, 'spread_hl_frac': 0.04438097708150217, 'bb_std_mult': 1.4768344449378876, 'rsi_os': 20, 'rsi_ob': 95, 'vol_spike': 0.10488653735162032, 'adx_thresh': 11.569380722436758, 'atr_min_pct': 0.021258159199069513, 'atr_max_pct': 0.14999866887348168, 'tp_mult': 1.711503615515297, 'tsl_mult': 0.29467129663116587, 'strategy': 'mean_reversion', 'time_stop': 255, 'use_sma': True, 'use_atr': False, 'use_adx': True, 'use_ema': True, 'use_spike': True, 'rsi_required': False, 'edge_k': 1.5154119254552043, 'edge_cap': 0.507239718996714, 'bull_strategy': 'breakout', 'bull_bb_std_mult': 1.9107643257723987, 'bull_rsi_os': 6, 'bull_rsi_ob': 91, 'bull_adx_thresh': 6.142391816374998, 'bull_atr_min_pct': 0.008214261838751142, 'bull_atr_max_pct': 0.05162664450363534, 'bull_tp_mult': 2.983752551428204, 'bull_tsl_mult': 0.04254609636786372, 'bull_time_stop': 256, 'bull_use_sma': True, 'bull_use_ema': True, 'bull_use_atr': False, 'bull_use_adx': True, 'bull_use_spike': False, 'bull_rsi_required': True, 'bear_strategy': 'breakout', 'bear_bb_std_mult': 0.5004886434031542, 'bear_rsi_os': 17, 'bear_rsi_ob': 64, 'bear_adx_thresh': 9.379793710577635, 'bear_atr_min_pct': 0.004589936317064268, 'bear_atr_max_pct': 0.08391016607587994, 'bear_tp_mult': 2.325249536827273, 'bear_tsl_mult': 0.7070232286992462, 'bear_time_stop': 226, 'bear_use_sma': False, 'bear_use_ema': True, 'bear_use_atr': False, 'bear_use_adx': True, 'bear_use_spike': True, 'bear_rsi_required': True, 'sideways_strategy': 'breakout', 'sideways_bb_std_mult': 0.6054805900740822, 'sideways_rsi_os': 12, 'sideways_rsi_ob': 80, 'sideways_adx_thresh': 25.196269375089923, 'sideways_atr_min_pct': 0.014811801457198206, 'sideways_atr_max_pct': 0.1498699743602181, 'sideways_tp_mult': 1.6958677472885828, 'sideways_tsl_mult': 0.5526836219350474, 'sideways_time_stop': 128, 'sideways_use_sma': True, 'sideways_use_ema': False, 'sideways_use_atr': False, 'sideways_use_adx': True, 'sideways_use_spike': True, 'sideways_rsi_required': False}.
[I 2025-08-29 19:40:14,805] Trial 31 finished with values: [-1000000000.0, 1000000000.0] and parameters: {'p_sma': 42, 'p_std': 31, 'p_atr': 14, 'p_adx': 13, 'rsi_period': 20, 'ema1': 21, 'ema2': 42, 'slip_atr_k': 0.19231513079700546, 'slip_spread_k': 0.17010061550590355, 'spread_hl_frac': 0.041147580135222524, 'bb_std_mult': 1.481139409232521, 'rsi_os': 20, 'rsi_ob': 94, 'vol_spike': 0.22024808442840949, 'adx_thresh': 13.703864618785376, 'atr_min_pct': 0.0039983676779500495, 'atr_max_pct': 0.12132726581770586, 'tp_mult': 2.406497949117979, 'tsl_mult': 0.4704845872362491, 'strategy': 'breakout', 'time_stop': 91, 'use_sma': False, 'use_atr': True, 'use_adx': True, 'use_ema': False, 'use_spike': True, 'rsi_required': True, 'edge_k': 1.4909586760063829, 'edge_cap': 0.523293653016965, 'bull_strategy': 'mean_reversion', 'bull_bb_std_mult': 1.4349101398126658, 'bull_rsi_os': 24, 'bull_rsi_ob': 60, 'bull_adx_thresh': 26.45731894689495, 'bull_atr_min_pct': 0.025759906294969413, 'bull_atr_max_pct': 0.07930821177900639, 'bull_tp_mult': 2.815868670320703, 'bull_tsl_mult': 0.7861426654595426, 'bull_time_stop': 89, 'bull_use_sma': True, 'bull_use_ema': True, 'bull_use_atr': False, 'bull_use_adx': True, 'bull_use_spike': True, 'bull_rsi_required': False, 'bear_strategy': 'breakout', 'bear_bb_std_mult': 2.2874872236935033, 'bear_rsi_os': 34, 'bear_rsi_ob': 82, 'bear_adx_thresh': 9.099130737826187, 'bear_atr_min_pct': 0.012166764449852308, 'bear_atr_max_pct': 0.10952783005091096, 'bear_tp_mult': 2.8144735883323246, 'bear_tsl_mult': 0.44996141388695826, 'bear_time_stop': 119, 'bear_use_sma': True, 'bear_use_ema': False, 'bear_use_atr': True, 'bear_use_adx': False, 'bear_use_spike': False, 'bear_rsi_required': False, 'sideways_strategy': 'mean_reversion', 'sideways_bb_std_mult': 1.180352436641933, 'sideways_rsi_os': 11, 'sideways_rsi_ob': 71, 'sideways_adx_thresh': 25.423679436913574, 'sideways_atr_min_pct': 0.02481134793018261, 'sideways_atr_max_pct': 0.149779397678812, 'sideways_tp_mult': 1.427779178873461, 'sideways_tsl_mult': 0.8415778906071053, 'sideways_time_stop': 285, 'sideways_use_sma': True, 'sideways_use_ema': True, 'sideways_use_atr': True, 'sideways_use_adx': False, 'sideways_use_spike': False, 'sideways_rsi_required': False}.
[I 2025-08-29 19:40:14,894] Trial 28 finished with values: [-0.00568352793886262, 0.005672166918824347] and parameters: {'p_sma': 41, 'p_std': 55, 'p_atr': 10, 'p_adx': 28, 'rsi_period': 67, 'ema1': 22, 'ema2': 21, 'slip_atr_k': 0.13211534614998566, 'slip_spread_k': 0.2574217297638476, 'spread_hl_frac': 0.04508294926006659, 'bb_std_mult': 1.0713661259605558, 'rsi_os': 27, 'rsi_ob': 79, 'vol_spike': 0.10001638524886289, 'adx_thresh': 10.877289667220236, 'atr_min_pct': 0.020884084598372255, 'atr_max_pct': 0.1495518013536783, 'tp_mult': 1.0266610837953187, 'tsl_mult': 0.29313008371997185, 'strategy': 'breakout', 'time_stop': 248, 'use_sma': False, 'use_atr': False, 'use_adx': True, 'use_ema': True, 'use_spike': True, 'rsi_required': True, 'edge_k': 1.4690832095863229, 'edge_cap': 0.5112797041985867, 'bull_strategy': 'breakout', 'bull_bb_std_mult': 1.9297365314576165, 'bull_rsi_os': 55, 'bull_rsi_ob': 92, 'bull_adx_thresh': 30.218377177922406, 'bull_atr_min_pct': 0.009392866995103898, 'bull_atr_max_pct': 0.05479279469993238, 'bull_tp_mult': 2.9908022887303414, 'bull_tsl_mult': 0.035694538470710024, 'bull_time_stop': 245, 'bull_use_sma': True, 'bull_use_ema': True, 'bull_use_atr': False, 'bull_use_adx': True, 'bull_use_spike': True, 'bull_rsi_required': False, 'bear_strategy': 'breakout', 'bear_bb_std_mult': 0.7888158650146202, 'bear_rsi_os': 35, 'bear_rsi_ob': 62, 'bear_adx_thresh': 8.474439002959022, 'bear_atr_min_pct': 0.0058848145424684655, 'bear_atr_max_pct': 0.11236685820826005, 'bear_tp_mult': 2.411984706863947, 'bear_tsl_mult': 0.5287279752275876, 'bear_time_stop': 167, 'bear_use_sma': False, 'bear_use_ema': True, 'bear_use_atr': False, 'bear_use_adx': True, 'bear_use_spike': True, 'bear_rsi_required': True, 'sideways_strategy': 'mean_reversion', 'sideways_bb_std_mult': 0.5772029681584937, 'sideways_rsi_os': 32, 'sideways_rsi_ob': 80, 'sideways_adx_thresh': 18.55486901365338, 'sideways_atr_min_pct': 0.014746933389519452, 'sideways_atr_max_pct': 0.11966862315950968, 'sideways_tp_mult': 2.1804065041893876, 'sideways_tsl_mult': 0.8413192235968134, 'sideways_time_stop': 128, 'sideways_use_sma': True, 'sideways_use_ema': True, 'sideways_use_atr': False, 'sideways_use_adx': False, 'sideways_use_spike': True, 'sideways_rsi_required': False}.
[I 2025-08-29 19:40:15,101] Trial 35 finished with values: [-1000000000.0, 1000000000.0] and parameters: {'p_sma': 34, 'p_std': 48, 'p_atr': 13, 'p_adx': 27, 'rsi_period': 13, 'ema1': 23, 'ema2': 52, 'slip_atr_k': 0.15540174812154758, 'slip_spread_k': 0.3023647007724014, 'spread_hl_frac': 0.047624683060732316, 'bb_std_mult': 0.5141073618209402, 'rsi_os': 42, 'rsi_ob': 47, 'vol_spike': 0.12411300591466448, 'adx_thresh': 29.343200257762803, 'atr_min_pct': 0.029602275066292264, 'atr_max_pct': 0.01133691488772648, 'tp_mult': 1.4499384382606992, 'tsl_mult': 0.5689856980085335, 'strategy': 'mean_reversion', 'time_stop': 171, 'use_sma': False, 'use_atr': False, 'use_adx': False, 'use_ema': False, 'use_spike': False, 'rsi_required': True, 'edge_k': 1.785916547357197, 'edge_cap': 0.6597701683271202, 'bull_strategy': 'mean_reversion', 'bull_bb_std_mult': 0.9850902182654107, 'bull_rsi_os': 16, 'bull_rsi_ob': 89, 'bull_adx_thresh': 30.74047212367685, 'bull_atr_min_pct': 0.0008458395644787564, 'bull_atr_max_pct': 0.08708099071367911, 'bull_tp_mult': 1.9343733857685068, 'bull_tsl_mult': 0.9708263269101252, 'bull_time_stop': 268, 'bull_use_sma': False, 'bull_use_ema': False, 'bull_use_atr': True, 'bull_use_adx': True, 'bull_use_spike': True, 'bull_rsi_required': False, 'bear_strategy': 'breakout', 'bear_bb_std_mult': 0.872890010755563, 'bear_rsi_os': 9, 'bear_rsi_ob': 73, 'bear_adx_thresh': 7.550258664609486, 'bear_atr_min_pct': 0.002686102105859149, 'bear_atr_max_pct': 0.059048288971987106, 'bear_tp_mult': 2.811640418716771, 'bear_tsl_mult': 0.5182299086195771, 'bear_time_stop': 55, 'bear_use_sma': False, 'bear_use_ema': False, 'bear_use_atr': False, 'bear_use_adx': False, 'bear_use_spike': False, 'bear_rsi_required': False, 'sideways_strategy': 'mean_reversion', 'sideways_bb_std_mult': 2.436056253246826, 'sideways_rsi_os': 46, 'sideways_rsi_ob': 72, 'sideways_adx_thresh': 18.525673831974466, 'sideways_atr_min_pct': 0.014672171719318002, 'sideways_atr_max_pct': 0.12176256214666617, 'sideways_tp_mult': 2.7042988498544043, 'sideways_tsl_mult': 0.18008163036739197, 'sideways_time_stop': 99, 'sideways_use_sma': True, 'sideways_use_ema': True, 'sideways_use_atr': False, 'sideways_use_adx': False, 'sideways_use_spike': False, 'sideways_rsi_required': True}.
[I 2025-08-29 19:40:44,581] Trial 34 finished with values: [-0.007525883951877255, 0.007429602841147528] and parameters: {'p_sma': 48, 'p_std': 47, 'p_atr': 13, 'p_adx': 22, 'rsi_period': 16, 'ema1': 24, 'ema2': 52, 'slip_atr_k': 0.024731394517406483, 'slip_spread_k': 0.677151674523043, 'spread_hl_frac': 0.047663566239771804, 'bb_std_mult': 0.9313372436962277, 'rsi_os': 12, 'rsi_ob': 45, 'vol_spike': 0.13819351910170885, 'adx_thresh': 16.701705914095868, 'atr_min_pct': 0.0035965503013647153, 'atr_max_pct': 0.07517363071275802, 'tp_mult': 1.3979359922178851, 'tsl_mult': 0.5737181487459971, 'strategy': 'breakout', 'time_stop': 14, 'use_sma': False, 'use_atr': True, 'use_adx': True, 'use_ema': False, 'use_spike': True, 'rsi_required': True, 'edge_k': 1.7357654184353049, 'edge_cap': 0.6937664922209781, 'bull_strategy': 'mean_reversion', 'bull_bb_std_mult': 0.8633384308162915, 'bull_rsi_os': 47, 'bull_rsi_ob': 90, 'bull_adx_thresh': 31.1404858266729, 'bull_atr_min_pct': 0.016179548004323398, 'bull_atr_max_pct': 0.09100457375628623, 'bull_tp_mult': 2.8431091405107063, 'bull_tsl_mult': 0.958375310676728, 'bull_time_stop': 265, 'bull_use_sma': False, 'bull_use_ema': False, 'bull_use_atr': True, 'bull_use_adx': True, 'bull_use_spike': True, 'bull_rsi_required': False, 'bear_strategy': 'breakout', 'bear_bb_std_mult': 1.3975985365352335, 'bear_rsi_os': 55, 'bear_rsi_ob': 73, 'bear_adx_thresh': 7.833429457882989, 'bear_atr_min_pct': 0.006787689762429208, 'bear_atr_max_pct': 0.04939777412443133, 'bear_tp_mult': 2.7422054551357142, 'bear_tsl_mult': 0.5405476232850747, 'bear_time_stop': 58, 'bear_use_sma': True, 'bear_use_ema': False, 'bear_use_atr': True, 'bear_use_adx': False, 'bear_use_spike': False, 'bear_rsi_required': False, 'sideways_strategy': 'mean_reversion', 'sideways_bb_std_mult': 0.8383805164660026, 'sideways_rsi_os': 47, 'sideways_rsi_ob': 89, 'sideways_adx_thresh': 6.843490172546263, 'sideways_atr_min_pct': 0.023594606570791987, 'sideways_atr_max_pct': 0.06895093199352427, 'sideways_tp_mult': 2.705962349884351, 'sideways_tsl_mult': 0.1689947746603248, 'sideways_time_stop': 96, 'sideways_use_sma': True, 'sideways_use_ema': True, 'sideways_use_atr': True, 'sideways_use_adx': False, 'sideways_use_spike': False, 'sideways_rsi_required': False}.
[I 2025-08-29 19:40:44,860] Trial 33 finished with values: [-0.05340795242693386, 0.05338187093471387] and parameters: {'p_sma': 48, 'p_std': 33, 'p_atr': 14, 'p_adx': 27, 'rsi_period': 19, 'ema1': 22, 'ema2': 53, 'slip_atr_k': 0.16652261310107463, 'slip_spread_k': 0.5241635883940527, 'spread_hl_frac': 0.040687760258252104, 'bb_std_mult': 0.8910356414310922, 'rsi_os': 42, 'rsi_ob': 80, 'vol_spike': 0.21841231319183174, 'adx_thresh': 29.92675325328713, 'atr_min_pct': 0.004045279130315542, 'atr_max_pct': 0.12127076679558822, 'tp_mult': 1.0795422226723765, 'tsl_mult': 0.4759041759619202, 'strategy': 'mean_reversion', 'time_stop': 91, 'use_sma': True, 'use_atr': False, 'use_adx': False, 'use_ema': False, 'use_spike': False, 'rsi_required': True, 'edge_k': 1.8111536904991534, 'edge_cap': 0.6608921897285681, 'bull_strategy': 'mean_reversion', 'bull_bb_std_mult': 0.9615073545375785, 'bull_rsi_os': 23, 'bull_rsi_ob': 90, 'bull_adx_thresh': 11.94780043121641, 'bull_atr_min_pct': 0.0002013407906732035, 'bull_atr_max_pct': 0.08022675754857517, 'bull_tp_mult': 1.88499576504016, 'bull_tsl_mult': 0.969307826306219, 'bull_time_stop': 271, 'bull_use_sma': False, 'bull_use_ema': False, 'bull_use_atr': True, 'bull_use_adx': True, 'bull_use_spike': True, 'bull_rsi_required': False, 'bear_strategy': 'mean_reversion', 'bear_bb_std_mult': 2.213112180024309, 'bear_rsi_os': 36, 'bear_rsi_ob': 50, 'bear_adx_thresh': 8.825008278779539, 'bear_atr_min_pct': 0.006856908892651769, 'bear_atr_max_pct': 0.05498230388073482, 'bear_tp_mult': 2.827169096820603, 'bear_tsl_mult': 0.4319968466435724, 'bear_time_stop': 121, 'bear_use_sma': False, 'bear_use_ema': False, 'bear_use_atr': False, 'bear_use_adx': False, 'bear_use_spike': False, 'bear_rsi_required': False, 'sideways_strategy': 'mean_reversion', 'sideways_bb_std_mult': 2.4310303125381703, 'sideways_rsi_os': 43, 'sideways_rsi_ob': 90, 'sideways_adx_thresh': 5.8226171237645215, 'sideways_atr_min_pct': 0.02381740743710277, 'sideways_atr_max_pct': 0.06275410802310162, 'sideways_tp_mult': 1.3775906935174345, 'sideways_tsl_mult': 0.7982546633617267, 'sideways_time_stop': 292, 'sideways_use_sma': True, 'sideways_use_ema': True, 'sideways_use_atr': False, 'sideways_use_adx': False, 'sideways_use_spike': False, 'sideways_rsi_required': True}.
[I 2025-08-29 19:40:45,023] Trial 32 finished with values: [-1000000000.0, 1000000000.0] and parameters: {'p_sma': 47, 'p_std': 31, 'p_atr': 14, 'p_adx': 14, 'rsi_period': 13, 'ema1': 17, 'ema2': 52, 'slip_atr_k': 0.17790562916411817, 'slip_spread_k': 0.22387174600940113, 'spread_hl_frac': 0.04063124813509187, 'bb_std_mult': 0.941642403444575, 'rsi_os': 41, 'rsi_ob': 78, 'vol_spike': 0.2099484021525566, 'adx_thresh': 13.809800798380644, 'atr_min_pct': 0.0038462303381850893, 'atr_max_pct': 0.10301573958658139, 'tp_mult': 1.4158938147887743, 'tsl_mult': 0.4755242277829439, 'strategy': 'mean_reversion', 'time_stop': 75, 'use_sma': True, 'use_atr': False, 'use_adx': False, 'use_ema': False, 'use_spike': False, 'rsi_required': True, 'edge_k': 1.7794375003459313, 'edge_cap': 0.6838972442870611, 'bull_strategy': 'mean_reversion', 'bull_bb_std_mult': 0.8812017723098602, 'bull_rsi_os': 55, 'bull_rsi_ob': 90, 'bull_adx_thresh': 30.63652287350165, 'bull_atr_min_pct': 0.01634275593696442, 'bull_atr_max_pct': 0.08538867506335736, 'bull_tp_mult': 1.752071530884904, 'bull_tsl_mult': 0.944908236960637, 'bull_time_stop': 262, 'bull_use_sma': False, 'bull_use_ema': False, 'bull_use_atr': True, 'bull_use_adx': True, 'bull_use_spike': True, 'bull_rsi_required': False, 'bear_strategy': 'mean_reversion', 'bear_bb_std_mult': 2.359532926162293, 'bear_rsi_os': 34, 'bear_rsi_ob': 74, 'bear_adx_thresh': 9.019751880154114, 'bear_atr_min_pct': 0.01249267423586575, 'bear_atr_max_pct': 0.054104085218992015, 'bear_tp_mult': 2.7986401890055386, 'bear_tsl_mult': 0.44317111812349586, 'bear_time_stop': 55, 'bear_use_sma': False, 'bear_use_ema': False, 'bear_use_atr': False, 'bear_use_adx': False, 'bear_use_spike': False, 'bear_rsi_required': False, 'sideways_strategy': 'mean_reversion', 'sideways_bb_std_mult': 0.866245032085633, 'sideways_rsi_os': 32, 'sideways_rsi_ob': 73, 'sideways_adx_thresh': 5.558544147459633, 'sideways_atr_min_pct': 0.024287402877660923, 'sideways_atr_max_pct': 0.033386716240218765, 'sideways_tp_mult': 2.3499130822964562, 'sideways_tsl_mult': 0.8303940800344574, 'sideways_time_stop': 97, 'sideways_use_sma': True, 'sideways_use_ema': True, 'sideways_use_atr': False, 'sideways_use_adx': False, 'sideways_use_spike': False, 'sideways_rsi_required': True}.
