[I 2025-08-29 20:49:35,812] Trial 632 finished with values: [-1000000000.0, 1000000000.0] and parameters: {'p_sma': 57, 'p_std': 48, 'p_atr': 15, 'p_adx': 15, 'rsi_period': 43, 'ema1': 26, 'ema2': 48, 'slip_atr_k': 0.07487349165283125, 'slip_spread_k': 0.15529329083811189, 'spread_hl_frac': 0.04903130334766809, 'bb_std_mult': 1.703581747424294, 'rsi_os': 15, 'rsi_ob': 81, 'vol_spike': 0.1173128822560133, 'adx_thresh': 5.682180193770849, 'atr_min_pct': 0.020086609406584615, 'atr_max_pct': 0.01833288785173231, 'tp_mult': 1.417292752326873, 'tsl_mult': 0.8880730613543926, 'strategy': 'breakout', 'time_stop': 53, 'use_sma': True, 'use_atr': True, 'use_adx': False, 'use_ema': True, 'use_spike': False, 'rsi_required': False, 'edge_k': 1.179432869757307, 'edge_cap': 0.5441474231859459, 'bull_strategy': 'mean_reversion', 'bull_bb_std_mult': 0.6666123533287118, 'bull_rsi_os': 14, 'bull_rsi_ob': 81, 'bull_adx_thresh': 12.920749641197283, 'bull_atr_min_pct': 0.014817054902981299, 'bull_atr_max_pct': 0.08280816834824928, 'bull_tp_mult': 2.616607144896296, 'bull_tsl_mult': 0.7472160273948489, 'bull_time_stop': 19, 'bull_use_sma': True, 'bull_use_ema': False, 'bull_use_atr': True, 'bull_use_adx': False, 'bull_use_spike': True, 'bull_rsi_required': False, 'bear_strategy': 'mean_reversion', 'bear_bb_std_mult': 2.8533388864692726, 'bear_rsi_os': 21, 'bear_rsi_ob': 82, 'bear_adx_thresh': 33.591798252496915, 'bear_atr_min_pct': 0.006288194735651129, 'bear_atr_max_pct': 0.1217731905644861, 'bear_tp_mult': 2.6230618183036607, 'bear_tsl_mult': 0.9201554159139674, 'bear_time_stop': 284, 'bear_use_sma': False, 'bear_use_ema': True, 'bear_use_atr': False, 'bear_use_adx': True, 'bear_use_spike': True, 'bear_rsi_required': True, 'sideways_strategy': 'breakout', 'sideways_bb_std_mult': 2.392037700319123, 'sideways_rsi_os': 22, 'sideways_rsi_ob': 78, 'sideways_adx_thresh': 32.515899261376006, 'sideways_atr_min_pct': 0.0059449380016252315, 'sideways_atr_max_pct': 0.07870317986273585, 'sideways_tp_mult': 2.8651524689460364, 'sideways_tsl_mult': 0.6594748358913547, 'sideways_time_stop': 226, 'sideways_use_sma': False, 'sideways_use_ema': False, 'sideways_use_atr': False, 'sideways_use_adx': False, 'sideways_use_spike': False, 'sideways_rsi_required': False}.
[I 2025-08-29 20:50:03,490] Trial 631 finished with values: [-1000000000.0, 1000000000.0] and parameters: {'p_sma': 19, 'p_std': 19, 'p_atr': 15, 'p_adx': 11, 'rsi_period': 37, 'ema1': 26, 'ema2': 27, 'slip_atr_k': 0.07664711979845645, 'slip_spread_k': 0.8111669924083339, 'spread_hl_frac': 0.049105557692431426, 'bb_std_mult': 1.6664898271933664, 'rsi_os': 6, 'rsi_ob': 75, 'vol_spike': 0.02393098105312877, 'adx_thresh': 23.83327786807742, 'atr_min_pct': 0.02835803501531234, 'atr_max_pct': 0.13026056355058382, 'tp_mult': 1.4097957867153958, 'tsl_mult': 0.8870509565101686, 'strategy': 'breakout', 'time_stop': 197, 'use_sma': True, 'use_atr': False, 'use_adx': False, 'use_ema': True, 'use_spike': False, 'rsi_required': False, 'edge_k': 1.8018114798072786, 'edge_cap': 0.21042218134007007, 'bull_strategy': 'mean_reversion', 'bull_bb_std_mult': 3.1751807091752084, 'bull_rsi_os': 54, 'bull_rsi_ob': 73, 'bull_adx_thresh': 13.61131687986317, 'bull_atr_min_pct': 0.00992109676392898, 'bull_atr_max_pct': 0.08255595063370173, 'bull_tp_mult': 2.6111766126983595, 'bull_tsl_mult': 0.6129997136809392, 'bull_time_stop': 265, 'bull_use_sma': True, 'bull_use_ema': False, 'bull_use_atr': False, 'bull_use_adx': False, 'bull_use_spike': True, 'bull_rsi_required': False, 'bear_strategy': 'breakout', 'bear_bb_std_mult': 2.0820541451383097, 'bear_rsi_os': 27, 'bear_rsi_ob': 70, 'bear_adx_thresh': 20.61057353435888, 'bear_atr_min_pct': 0.005528225397342706, 'bear_atr_max_pct': 0.014678335860980704, 'bear_tp_mult': 2.6394136999324416, 'bear_tsl_mult': 0.30792001178137224, 'bear_time_stop': 45, 'bear_use_sma': True, 'bear_use_ema': True, 'bear_use_atr': False, 'bear_use_adx': True, 'bear_use_spike': True, 'bear_rsi_required': False, 'sideways_strategy': 'breakout', 'sideways_bb_std_mult': 1.2367726826448717, 'sideways_rsi_os': 13, 'sideways_rsi_ob': 73, 'sideways_adx_thresh': 30.464390080595166, 'sideways_atr_min_pct': 0.025206820780971313, 'sideways_atr_max_pct': 0.04925840991782765, 'sideways_tp_mult': 1.1577569489686734, 'sideways_tsl_mult': 0.08638276427594405, 'sideways_time_stop': 206, 'sideways_use_sma': False, 'sideways_use_ema': False, 'sideways_use_atr': True, 'sideways_use_adx': True, 'sideways_use_spike': False, 'sideways_rsi_required': False}.
[I 2025-08-29 20:50:04,361] Trial 630 finished with values: [-0.0012785990267116798, 0.002295902341930634] and parameters: {'p_sma': 19, 'p_std': 41, 'p_atr': 15, 'p_adx': 23, 'rsi_period': 74, 'ema1': 26, 'ema2': 59, 'slip_atr_k': 0.0003461518812671732, 'slip_spread_k': 0.25143912929587053, 'spread_hl_frac': 0.04913134566366757, 'bb_std_mult': 1.6755100699354508, 'rsi_os': 6, 'rsi_ob': 83, 'vol_spike': 0.23741141547007133, 'adx_thresh': 9.441495675329879, 'atr_min_pct': 0.0177766861552881, 'atr_max_pct': 0.12952154439001065, 'tp_mult': 1.3693575182030135, 'tsl_mult': 0.8874262061994134, 'strategy': 'mean_reversion', 'time_stop': 195, 'use_sma': True, 'use_atr': False, 'use_adx': False, 'use_ema': True, 'use_spike': False, 'rsi_required': False, 'edge_k': 1.6358308751260788, 'edge_cap': 0.11841724816254773, 'bull_strategy': 'mean_reversion', 'bull_bb_std_mult': 2.9537205814553493, 'bull_rsi_os': 28, 'bull_rsi_ob': 73, 'bull_adx_thresh': 13.138022414248752, 'bull_atr_min_pct': 0.0035997531874447063, 'bull_atr_max_pct': 0.07471379286978101, 'bull_tp_mult': 2.1469124257787753, 'bull_tsl_mult': 0.9251104891036657, 'bull_time_stop': 79, 'bull_use_sma': True, 'bull_use_ema': False, 'bull_use_atr': False, 'bull_use_adx': False, 'bull_use_spike': True, 'bull_rsi_required': True, 'bear_strategy': 'breakout', 'bear_bb_std_mult': 3.1479110105762254, 'bear_rsi_os': 18, 'bear_rsi_ob': 68, 'bear_adx_thresh': 20.50381182247747, 'bear_atr_min_pct': 0.0055839810363134765, 'bear_atr_max_pct': 0.051685793975545916, 'bear_tp_mult': 2.6414432186830497, 'bear_tsl_mult': 0.7991553494885124, 'bear_time_stop': 202, 'bear_use_sma': True, 'bear_use_ema': True, 'bear_use_atr': False, 'bear_use_adx': True, 'bear_use_spike': True, 'bear_rsi_required': False, 'sideways_strategy': 'breakout', 'sideways_bb_std_mult': 2.0658421211080005, 'sideways_rsi_os': 46, 'sideways_rsi_ob': 86, 'sideways_adx_thresh': 30.284203142257766, 'sideways_atr_min_pct': 0.00924547693403607, 'sideways_atr_max_pct': 0.1322051941912002, 'sideways_tp_mult': 1.1632803070383235, 'sideways_tsl_mult': 0.7481497211741277, 'sideways_time_stop': 207, 'sideways_use_sma': False, 'sideways_use_ema': False, 'sideways_use_atr': True, 'sideways_use_adx': True, 'sideways_use_spike': False, 'sideways_rsi_required': False}.
[I 2025-08-29 20:50:04,716] Trial 633 finished with values: [-1000000000.0, 1000000000.0] and parameters: {'p_sma': 12, 'p_std': 58, 'p_atr': 11, 'p_adx': 15, 'rsi_period': 38, 'ema1': 27, 'ema2': 46, 'slip_atr_k': 0.07597594042830735, 'slip_spread_k': 0.2918031272325903, 'spread_hl_frac': 0.04923202309728127, 'bb_std_mult': 1.6893220832290572, 'rsi_os': 9, 'rsi_ob': 81, 'vol_spike': 0.16998212041772942, 'adx_thresh': 9.41417569439736, 'atr_min_pct': 0.020169287679258775, 'atr_max_pct': 0.026740070039585704, 'tp_mult': 1.4991219124226223, 'tsl_mult': 0.8822491679888768, 'strategy': 'breakout', 'time_stop': 244, 'use_sma': True, 'use_atr': True, 'use_adx': False, 'use_ema': True, 'use_spike': True, 'rsi_required': False, 'edge_k': 1.1157914121926593, 'edge_cap': 0.5429757358973365, 'bull_strategy': 'mean_reversion', 'bull_bb_std_mult': 2.2707356993982732, 'bull_rsi_os': 54, 'bull_rsi_ob': 74, 'bull_adx_thresh': 12.620620976464647, 'bull_atr_min_pct': 0.014743833941308921, 'bull_atr_max_pct': 0.09728921090417245, 'bull_tp_mult': 2.63013209842877, 'bull_tsl_mult': 0.7421332023595973, 'bull_time_stop': 299, 'bull_use_sma': True, 'bull_use_ema': True, 'bull_use_atr': False, 'bull_use_adx': False, 'bull_use_spike': True, 'bull_rsi_required': False, 'bear_strategy': 'mean_reversion', 'bear_bb_std_mult': 2.8416693797971684, 'bear_rsi_os': 30, 'bear_rsi_ob': 67, 'bear_adx_thresh': 20.61493521762211, 'bear_atr_min_pct': 0.006093878283991045, 'bear_atr_max_pct': 0.06056290640166777, 'bear_tp_mult': 1.3653458315367193, 'bear_tsl_mult': 0.27102729613422305, 'bear_time_stop': 284, 'bear_use_sma': False, 'bear_use_ema': True, 'bear_use_atr': False, 'bear_use_adx': True, 'bear_use_spike': True, 'bear_rsi_required': True, 'sideways_strategy': 'breakout', 'sideways_bb_std_mult': 2.366617159216705, 'sideways_rsi_os': 50, 'sideways_rsi_ob': 78, 'sideways_adx_thresh': 32.708240208477875, 'sideways_atr_min_pct': 0.017033798980797796, 'sideways_atr_max_pct': 0.07805393502299443, 'sideways_tp_mult': 1.0499939530807962, 'sideways_tsl_mult': 0.7922354320120187, 'sideways_time_stop': 214, 'sideways_use_sma': False, 'sideways_use_ema': False, 'sideways_use_atr': True, 'sideways_use_adx': False, 'sideways_use_spike': False, 'sideways_rsi_required': False}.
[I 2025-08-29 20:50:05,786] Trial 634 finished with values: [-1000000000.0, 1000000000.0] and parameters: {'p_sma': 23, 'p_std': 58, 'p_atr': 25, 'p_adx': 23, 'rsi_period': 38, 'ema1': 27, 'ema2': 44, 'slip_atr_k': 0.22376474119413423, 'slip_spread_k': 0.10321994892587524, 'spread_hl_frac': 0.04998109681445018, 'bb_std_mult': 1.6919023757107483, 'rsi_os': 9, 'rsi_ob': 70, 'vol_spike': 0.02459303901744797, 'adx_thresh': 11.995763902164995, 'atr_min_pct': 0.019390360435618488, 'atr_max_pct': 0.03348750038638059, 'tp_mult': 2.7972288056273493, 'tsl_mult': 0.8811984550869518, 'strategy': 'mean_reversion', 'time_stop': 224, 'use_sma': True, 'use_atr': False, 'use_adx': False, 'use_ema': True, 'use_spike': True, 'rsi_required': False, 'edge_k': 1.1271180970830692, 'edge_cap': 0.5793124453660848, 'bull_strategy': 'mean_reversion', 'bull_bb_std_mult': 2.2640292099566093, 'bull_rsi_os': 8, 'bull_rsi_ob': 46, 'bull_adx_thresh': 14.006099283046227, 'bull_atr_min_pct': 0.01670622132763695, 'bull_atr_max_pct': 0.09750006187766098, 'bull_tp_mult': 2.7317661629619443, 'bull_tsl_mult': 0.2518549531032099, 'bull_time_stop': 34, 'bull_use_sma': True, 'bull_use_ema': True, 'bull_use_atr': False, 'bull_use_adx': False, 'bull_use_spike': True, 'bull_rsi_required': False, 'bear_strategy': 'breakout', 'bear_bb_std_mult': 2.4717720568230304, 'bear_rsi_os': 9, 'bear_rsi_ob': 67, 'bear_adx_thresh': 20.742340604444017, 'bear_atr_min_pct': 0.006163030280072545, 'bear_atr_max_pct': 0.047085937346258544, 'bear_tp_mult': 2.405507313863954, 'bear_tsl_mult': 0.34730723929501717, 'bear_time_stop': 43, 'bear_use_sma': False, 'bear_use_ema': True, 'bear_use_atr': False, 'bear_use_adx': True, 'bear_use_spike': True, 'bear_rsi_required': False, 'sideways_strategy': 'breakout', 'sideways_bb_std_mult': 2.3679364611169094, 'sideways_rsi_os': 50, 'sideways_rsi_ob': 92, 'sideways_adx_thresh': 31.185785283917394, 'sideways_atr_min_pct': 0.0042852625780309675, 'sideways_atr_max_pct': 0.13164387012295842, 'sideways_tp_mult': 1.0449851825263616, 'sideways_tsl_mult': 0.17509674596311775, 'sideways_time_stop': 212, 'sideways_use_sma': False, 'sideways_use_ema': False, 'sideways_use_atr': True, 'sideways_use_adx': False, 'sideways_use_spike': False, 'sideways_rsi_required': False}.
[I 2025-08-29 20:50:35,610] Trial 636 finished with values: [-1000000000.0, 1000000000.0] and parameters: {'p_sma': 13, 'p_std': 58, 'p_atr': 25, 'p_adx': 27, 'rsi_period': 38, 'ema1': 8, 'ema2': 46, 'slip_atr_k': 0.019668596782598104, 'slip_spread_k': 0.1847126867299879, 'spread_hl_frac': 0.04999748994944233, 'bb_std_mult': 1.7580161539313661, 'rsi_os': 44, 'rsi_ob': 82, 'vol_spike': 0.17685347486485584, 'adx_thresh': 27.940321081064504, 'atr_min_pct': 0.02004992008249602, 'atr_max_pct': 0.12145782007009448, 'tp_mult': 2.7895638685656676, 'tsl_mult': 0.8772734462512662, 'strategy': 'mean_reversion', 'time_stop': 177, 'use_sma': True, 'use_atr': True, 'use_adx': True, 'use_ema': True, 'use_spike': True, 'rsi_required': False, 'edge_k': 1.0203145115850452, 'edge_cap': 0.5771459557290729, 'bull_strategy': 'mean_reversion', 'bull_bb_std_mult': 1.2110281632981508, 'bull_rsi_os': 8, 'bull_rsi_ob': 55, 'bull_adx_thresh': 14.25996017458742, 'bull_atr_min_pct': 0.016816728742823483, 'bull_atr_max_pct': 0.09804118974134536, 'bull_tp_mult': 2.7332347322629555, 'bull_tsl_mult': 0.24574059894564915, 'bull_time_stop': 213, 'bull_use_sma': True, 'bull_use_ema': True, 'bull_use_atr': True, 'bull_use_adx': False, 'bull_use_spike': False, 'bull_rsi_required': False, 'bear_strategy': 'mean_reversion', 'bear_bb_std_mult': 1.9457870722059227, 'bear_rsi_os': 11, 'bear_rsi_ob': 45, 'bear_adx_thresh': 22.00282977343855, 'bear_atr_min_pct': 0.006241340418341493, 'bear_atr_max_pct': 0.06214461243532669, 'bear_tp_mult': 2.8416825079245736, 'bear_tsl_mult': 0.9035521544873165, 'bear_time_stop': 154, 'bear_use_sma': False, 'bear_use_ema': True, 'bear_use_atr': False, 'bear_use_adx': True, 'bear_use_spike': True, 'bear_rsi_required': True, 'sideways_strategy': 'breakout', 'sideways_bb_std_mult': 3.0356194644193004, 'sideways_rsi_os': 49, 'sideways_rsi_ob': 78, 'sideways_adx_thresh': 27.02626251584598, 'sideways_atr_min_pct': 0.024317749093392488, 'sideways_atr_max_pct': 0.0193954904442151, 'sideways_tp_mult': 1.0579368270714262, 'sideways_tsl_mult': 0.40279229538332967, 'sideways_time_stop': 283, 'sideways_use_sma': False, 'sideways_use_ema': False, 'sideways_use_atr': False, 'sideways_use_adx': False, 'sideways_use_spike': False, 'sideways_rsi_required': False}.
[I 2025-08-29 20:50:36,032] Trial 635 finished with values: [-0.006189712760657717, 0.006196891806416356] and parameters: {'p_sma': 20, 'p_std': 16, 'p_atr': 25, 'p_adx': 23, 'rsi_period': 38, 'ema1': 8, 'ema2': 46, 'slip_atr_k': 0.1476531770483447, 'slip_spread_k': 0.10685781505912281, 'spread_hl_frac': 0.04987531425896788, 'bb_std_mult': 1.749677180378326, 'rsi_os': 9, 'rsi_ob': 83, 'vol_spike': 0.23870718144109287, 'adx_thresh': 12.239335774604788, 'atr_min_pct': 0.0202734005904021, 'atr_max_pct': 0.10282178092965447, 'tp_mult': 1.4929832151018958, 'tsl_mult': 0.8754626398882839, 'strategy': 'mean_reversion', 'time_stop': 68, 'use_sma': True, 'use_atr': False, 'use_adx': False, 'use_ema': True, 'use_spike': True, 'rsi_required': False, 'edge_k': 1.1230133297766294, 'edge_cap': 0.5769116329295259, 'bull_strategy': 'mean_reversion', 'bull_bb_std_mult': 2.2575690406634914, 'bull_rsi_os': 16, 'bull_rsi_ob': 88, 'bull_adx_thresh': 14.194248911222507, 'bull_atr_min_pct': 0.016742663608666556, 'bull_atr_max_pct': 0.09763562614838636, 'bull_tp_mult': 2.4039999624226867, 'bull_tsl_mult': 0.8966822086195222, 'bull_time_stop': 140, 'bull_use_sma': True, 'bull_use_ema': True, 'bull_use_atr': True, 'bull_use_adx': False, 'bull_use_spike': True, 'bull_rsi_required': False, 'bear_strategy': 'breakout', 'bear_bb_std_mult': 1.9584942020379663, 'bear_rsi_os': 30, 'bear_rsi_ob': 67, 'bear_adx_thresh': 11.528488744879047, 'bear_atr_min_pct': 0.01349308482538656, 'bear_atr_max_pct': 0.07399123203064674, 'bear_tp_mult': 1.4651696621435981, 'bear_tsl_mult': 0.618532508626017, 'bear_time_stop': 156, 'bear_use_sma': False, 'bear_use_ema': True, 'bear_use_atr': False, 'bear_use_adx': True, 'bear_use_spike': True, 'bear_rsi_required': False, 'sideways_strategy': 'breakout', 'sideways_bb_std_mult': 2.387942363700717, 'sideways_rsi_os': 49, 'sideways_rsi_ob': 91, 'sideways_adx_thresh': 13.373995036750525, 'sideways_atr_min_pct': 0.004043167948320445, 'sideways_atr_max_pct': 0.0360174931947792, 'sideways_tp_mult': 1.7641079987931105, 'sideways_tsl_mult': 0.7472253940992608, 'sideways_time_stop': 283, 'sideways_use_sma': False, 'sideways_use_ema': False, 'sideways_use_atr': False, 'sideways_use_adx': False, 'sideways_use_spike': False, 'sideways_rsi_required': False}.
[I 2025-08-29 20:50:36,511] Trial 637 finished with values: [-1000000000.0, 0.16389342806870724] and parameters: {'p_sma': 20, 'p_std': 36, 'p_atr': 25, 'p_adx': 27, 'rsi_period': 39, 'ema1': 27, 'ema2': 11, 'slip_atr_k': 0.09440392230122784, 'slip_spread_k': 0.17773387987592001, 'spread_hl_frac': 0.023150123423779527, 'bb_std_mult': 1.7725783738417502, 'rsi_os': 27, 'rsi_ob': 61, 'vol_spike': 0.27170550052844566, 'adx_thresh': 12.147802678505137, 'atr_min_pct': 0.019358603077538547, 'atr_max_pct': 0.05575995030749198, 'tp_mult': 2.1610828978264767, 'tsl_mult': 0.870753358659704, 'strategy': 'mean_reversion', 'time_stop': 175, 'use_sma': True, 'use_atr': False, 'use_adx': True, 'use_ema': True, 'use_spike': True, 'rsi_required': False, 'edge_k': 1.0586580105146655, 'edge_cap': 0.6105121387323277, 'bull_strategy': 'mean_reversion', 'bull_bb_std_mult': 2.997581227745933, 'bull_rsi_os': 9, 'bull_rsi_ob': 75, 'bull_adx_thresh': 14.477050502763094, 'bull_atr_min_pct': 0.016865059362553395, 'bull_atr_max_pct': 0.015305080942642088, 'bull_tp_mult': 2.3677903720937223, 'bull_tsl_mult': 0.8434623894256644, 'bull_time_stop': 141, 'bull_use_sma': True, 'bull_use_ema': True, 'bull_use_atr': True, 'bull_use_adx': False, 'bull_use_spike': False, 'bull_rsi_required': False, 'bear_strategy': 'breakout', 'bear_bb_std_mult': 0.9270545118393947, 'bear_rsi_os': 28, 'bear_rsi_ob': 66, 'bear_adx_thresh': 21.643233838879553, 'bear_atr_min_pct': 0.007014985813118975, 'bear_atr_max_pct': 0.07387407182036841, 'bear_tp_mult': 2.7936491572355124, 'bear_tsl_mult': 0.21087008171817934, 'bear_time_stop': 154, 'bear_use_sma': False, 'bear_use_ema': True, 'bear_use_atr': False, 'bear_use_adx': True, 'bear_use_spike': True, 'bear_rsi_required': False, 'sideways_strategy': 'breakout', 'sideways_bb_std_mult': 3.0376060853395748, 'sideways_rsi_os': 49, 'sideways_rsi_ob': 91, 'sideways_adx_thresh': 8.016773717561865, 'sideways_atr_min_pct': 0.0005793288464696188, 'sideways_atr_max_pct': 0.02140866547164094, 'sideways_tp_mult': 1.113075684355497, 'sideways_tsl_mult': 0.5537890186407404, 'sideways_time_stop': 33, 'sideways_use_sma': False, 'sideways_use_ema': True, 'sideways_use_atr': False, 'sideways_use_adx': False, 'sideways_use_spike': False, 'sideways_rsi_required': False}.
[I 2025-08-29 20:50:36,659] Trial 638 finished with values: [-1000000000.0, 1000000000.0] and parameters: {'p_sma': 28, 'p_std': 9, 'p_atr': 25, 'p_adx': 13, 'rsi_period': 25, 'ema1': 8, 'ema2': 46, 'slip_atr_k': 0.1483685821245405, 'slip_spread_k': 0.18336678194876838, 'spread_hl_frac': 0.049965610820733114, 'bb_std_mult': 2.706241891718604, 'rsi_os': 12, 'rsi_ob': 84, 'vol_spike': 0.2528957338530279, 'adx_thresh': 12.480649386310214, 'atr_min_pct': 0.02088137689850575, 'atr_max_pct': 0.12461864726061447, 'tp_mult': 1.3267076046090092, 'tsl_mult': 0.9043881569602438, 'strategy': 'mean_reversion', 'time_stop': 176, 'use_sma': False, 'use_atr': False, 'use_adx': True, 'use_ema': True, 'use_spike': False, 'rsi_required': True, 'edge_k': 0.9997514633481175, 'edge_cap': 0.609891123557412, 'bull_strategy': 'breakout', 'bull_bb_std_mult': 3.0227682483447875, 'bull_rsi_os': 26, 'bull_rsi_ob': 72, 'bull_adx_thresh': 10.184068057204302, 'bull_atr_min_pct': 0.01676666833930619, 'bull_atr_max_pct': 0.1160549013229654, 'bull_tp_mult': 2.5473565079675353, 'bull_tsl_mult': 0.8443375616735301, 'bull_time_stop': 22, 'bull_use_sma': False, 'bull_use_ema': False, 'bull_use_atr': True, 'bull_use_adx': True, 'bull_use_spike': False, 'bull_rsi_required': False, 'bear_strategy': 'breakout', 'bear_bb_std_mult': 2.7428742550190077, 'bear_rsi_os': 32, 'bear_rsi_ob': 54, 'bear_adx_thresh': 21.971066061629948, 'bear_atr_min_pct': 0.0106500022367757, 'bear_atr_max_pct': 0.04210072731527226, 'bear_tp_mult': 2.7643670315503424, 'bear_tsl_mult': 0.07156957821984078, 'bear_time_stop': 58, 'bear_use_sma': False, 'bear_use_ema': False, 'bear_use_atr': False, 'bear_use_adx': True, 'bear_use_spike': False, 'bear_rsi_required': False, 'sideways_strategy': 'breakout', 'sideways_bb_std_mult': 3.039591091993903, 'sideways_rsi_os': 49, 'sideways_rsi_ob': 81, 'sideways_adx_thresh': 13.386838065968316, 'sideways_atr_min_pct': 0.012402254141932042, 'sideways_atr_max_pct': 0.020862540940986735, 'sideways_tp_mult': 2.026194640479659, 'sideways_tsl_mult': 0.7369536310296066, 'sideways_time_stop': 54, 'sideways_use_sma': False, 'sideways_use_ema': True, 'sideways_use_atr': False, 'sideways_use_adx': False, 'sideways_use_spike': True, 'sideways_rsi_required': False}.
