[I 2025-08-29 19:50:30,389] Trial 117 finished with values: [-1000000000.0, 1000000000.0] and parameters: {'p_sma': 25, 'p_std': 55, 'p_atr': 21, 'p_adx': 18, 'rsi_period': 23, 'ema1': 12, 'ema2': 10, 'slip_atr_k': 0.23959212850368056, 'slip_spread_k': 0.2842376527663487, 'spread_hl_frac': 0.0068566310096388125, 'bb_std_mult': 1.3020493613131454, 'rsi_os': 21, 'rsi_ob': 65, 'vol_spike': 0.07133408434327888, 'adx_thresh': 32.901692776815885, 'atr_min_pct': 0.014646412725781302, 'atr_max_pct': 0.04773372900443084, 'tp_mult': 2.194854887317285, 'tsl_mult': 0.6358056209173142, 'strategy': 'mean_reversion', 'time_stop': 106, 'use_sma': False, 'use_atr': True, 'use_adx': False, 'use_ema': False, 'use_spike': False, 'rsi_required': False, 'edge_k': 1.0604587215994001, 'edge_cap': 0.3754797921942809, 'bull_strategy': 'breakout', 'bull_bb_std_mult': 0.936016015515062, 'bull_rsi_os': 14, 'bull_rsi_ob': 69, 'bull_adx_thresh': 18.327432190728214, 'bull_atr_min_pct': 0.02208275983125206, 'bull_atr_max_pct': 0.059732445929089814, 'bull_tp_mult': 1.3573838657845019, 'bull_tsl_mult': 0.1344698470376865, 'bull_time_stop': 275, 'bull_use_sma': False, 'bull_use_ema': False, 'bull_use_atr': False, 'bull_use_adx': True, 'bull_use_spike': False, 'bull_rsi_required': True, 'bear_strategy': 'mean_reversion', 'bear_bb_std_mult': 1.1360902915545914, 'bear_rsi_os': 27, 'bear_rsi_ob': 69, 'bear_adx_thresh': 6.572131439552777, 'bear_atr_min_pct': 0.00888731129098632, 'bear_atr_max_pct': 0.10934925719494124, 'bear_tp_mult': 2.26771046028546, 'bear_tsl_mult': 0.654074665038534, 'bear_time_stop': 25, 'bear_use_sma': False, 'bear_use_ema': True, 'bear_use_atr': True, 'bear_use_adx': False, 'bear_use_spike': False, 'bear_rsi_required': False, 'sideways_strategy': 'breakout', 'sideways_bb_std_mult': 2.510848499037238, 'sideways_rsi_os': 33, 'sideways_rsi_ob': 48, 'sideways_adx_thresh': 29.975922301481, 'sideways_atr_min_pct': 0.014210196098393404, 'sideways_atr_max_pct': 0.1169223270466814, 'sideways_tp_mult': 2.190725326681131, 'sideways_tsl_mult': 0.3353880460792136, 'sideways_time_stop': 237, 'sideways_use_sma': False, 'sideways_use_ema': True, 'sideways_use_atr': True, 'sideways_use_adx': False, 'sideways_use_spike': False, 'sideways_rsi_required': True}.
[I 2025-08-29 19:50:30,746] Trial 119 finished with values: [-1000000000.0, 1000000000.0] and parameters: {'p_sma': 26, 'p_std': 53, 'p_atr': 25, 'p_adx': 18, 'rsi_period': 22, 'ema1': 12, 'ema2': 45, 'slip_atr_k': 0.048886819330208435, 'slip_spread_k': 0.1459126223394649, 'spread_hl_frac': 0.0006578949954841118, 'bb_std_mult': 2.100421698187865, 'rsi_os': 17, 'rsi_ob': 50, 'vol_spike': 0.07670594681635991, 'adx_thresh': 32.96782170192058, 'atr_min_pct': 0.016168393463618418, 'atr_max_pct': 0.13279812543247968, 'tp_mult': 2.346344820183078, 'tsl_mult': 0.00011183815875642766, 'strategy': 'mean_reversion', 'time_stop': 95, 'use_sma': False, 'use_atr': True, 'use_adx': False, 'use_ema': True, 'use_spike': False, 'rsi_required': False, 'edge_k': 1.2316264692976278, 'edge_cap': 0.4928047570558431, 'bull_strategy': 'breakout', 'bull_bb_std_mult': 0.7738465377517996, 'bull_rsi_os': 44, 'bull_rsi_ob': 93, 'bull_adx_thresh': 14.469124252132382, 'bull_atr_min_pct': 0.020902964097872626, 'bull_atr_max_pct': 0.058906196290217976, 'bull_tp_mult': 1.774754246617019, 'bull_tsl_mult': 0.2156297860888786, 'bull_time_stop': 16, 'bull_use_sma': False, 'bull_use_ema': False, 'bull_use_atr': False, 'bull_use_adx': False, 'bull_use_spike': False, 'bull_rsi_required': True, 'bear_strategy': 'mean_reversion', 'bear_bb_std_mult': 1.3409356381812052, 'bear_rsi_os': 36, 'bear_rsi_ob': 69, 'bear_adx_thresh': 33.69335076707018, 'bear_atr_min_pct': 0.005351048462139084, 'bear_atr_max_pct': 0.08719502905919982, 'bear_tp_mult': 1.4505279355575236, 'bear_tsl_mult': 0.6414583461750556, 'bear_time_stop': 25, 'bear_use_sma': False, 'bear_use_ema': True, 'bear_use_atr': True, 'bear_use_adx': True, 'bear_use_spike': False, 'bear_rsi_required': True, 'sideways_strategy': 'mean_reversion', 'sideways_bb_std_mult': 1.8174740558420879, 'sideways_rsi_os': 33, 'sideways_rsi_ob': 47, 'sideways_adx_thresh': 28.13852519271048, 'sideways_atr_min_pct': 0.012806627107099441, 'sideways_atr_max_pct': 0.07552760862275268, 'sideways_tp_mult': 2.192180300459378, 'sideways_tsl_mult': 0.3332783201390145, 'sideways_time_stop': 236, 'sideways_use_sma': False, 'sideways_use_ema': False, 'sideways_use_atr': True, 'sideways_use_adx': False, 'sideways_use_spike': False, 'sideways_rsi_required': True}.
[I 2025-08-29 19:50:30,767] Trial 121 finished with values: [-1000000000.0, 1000000000.0] and parameters: {'p_sma': 32, 'p_std': 22, 'p_atr': 25, 'p_adx': 18, 'rsi_period': 22, 'ema1': 28, 'ema2': 27, 'slip_atr_k': 0.04808545127876572, 'slip_spread_k': 0.24653785958991217, 'spread_hl_frac': 0.00021407497276311515, 'bb_std_mult': 2.587439946833585, 'rsi_os': 16, 'rsi_ob': 49, 'vol_spike': 0.2858773902848667, 'adx_thresh': 27.62767717472812, 'atr_min_pct': 0.010453709129384002, 'atr_max_pct': 0.06277570744266382, 'tp_mult': 2.36190443087046, 'tsl_mult': 0.5776538365163586, 'strategy': 'mean_reversion', 'time_stop': 50, 'use_sma': False, 'use_atr': True, 'use_adx': False, 'use_ema': True, 'use_spike': False, 'rsi_required': False, 'edge_k': 1.5755007832713661, 'edge_cap': 0.10041778968322751, 'bull_strategy': 'breakout', 'bull_bb_std_mult': 0.5041022863371596, 'bull_rsi_os': 44, 'bull_rsi_ob': 93, 'bull_adx_thresh': 24.3662739155262, 'bull_atr_min_pct': 0.020899962985791144, 'bull_atr_max_pct': 0.04282294314145832, 'bull_tp_mult': 1.8157976670704743, 'bull_tsl_mult': 0.11688371875772785, 'bull_time_stop': 268, 'bull_use_sma': False, 'bull_use_ema': False, 'bull_use_atr': True, 'bull_use_adx': False, 'bull_use_spike': False, 'bull_rsi_required': True, 'bear_strategy': 'mean_reversion', 'bear_bb_std_mult': 1.0803208398202169, 'bear_rsi_os': 31, 'bear_rsi_ob': 45, 'bear_adx_thresh': 27.330669852769752, 'bear_atr_min_pct': 0.005319235113403697, 'bear_atr_max_pct': 0.05341154557851255, 'bear_tp_mult': 1.4635520829418063, 'bear_tsl_mult': 0.7747897982370247, 'bear_time_stop': 29, 'bear_use_sma': False, 'bear_use_ema': True, 'bear_use_atr': False, 'bear_use_adx': True, 'bear_use_spike': True, 'bear_rsi_required': True, 'sideways_strategy': 'mean_reversion', 'sideways_bb_std_mult': 2.819398517246393, 'sideways_rsi_os': 35, 'sideways_rsi_ob': 82, 'sideways_adx_thresh': 28.035725600378584, 'sideways_atr_min_pct': 0.016153921990767296, 'sideways_atr_max_pct': 0.07749189104467784, 'sideways_tp_mult': 1.911457943176893, 'sideways_tsl_mult': 0.28582441928102287, 'sideways_time_stop': 250, 'sideways_use_sma': False, 'sideways_use_ema': False, 'sideways_use_atr': True, 'sideways_use_adx': True, 'sideways_use_spike': False, 'sideways_rsi_required': True}.
[I 2025-08-29 19:50:57,194] Trial 120 finished with values: [-1000000000.0, 1000000000.0] and parameters: {'p_sma': 37, 'p_std': 53, 'p_atr': 21, 'p_adx': 18, 'rsi_period': 22, 'ema1': 12, 'ema2': 45, 'slip_atr_k': 0.05074108995885955, 'slip_spread_k': 0.2901442722683364, 'spread_hl_frac': 0.0001931472732361033, 'bb_std_mult': 2.1550221245441126, 'rsi_os': 22, 'rsi_ob': 59, 'vol_spike': 0.28779016491368803, 'adx_thresh': 28.17611806784109, 'atr_min_pct': 0.0158854126186174, 'atr_max_pct': 0.10399470113873543, 'tp_mult': 2.3391736242756145, 'tsl_mult': 0.6653888419326492, 'strategy': 'mean_reversion', 'time_stop': 50, 'use_sma': False, 'use_atr': True, 'use_adx': False, 'use_ema': True, 'use_spike': False, 'rsi_required': False, 'edge_k': 1.0590109527049227, 'edge_cap': 0.08777643835939836, 'bull_strategy': 'breakout', 'bull_bb_std_mult': 0.5473668342625648, 'bull_rsi_os': 39, 'bull_rsi_ob': 92, 'bull_adx_thresh': 33.76941163312458, 'bull_atr_min_pct': 0.02067139460181535, 'bull_atr_max_pct': 0.05889105770071213, 'bull_tp_mult': 1.3579233758548188, 'bull_tsl_mult': 0.11072209470261013, 'bull_time_stop': 266, 'bull_use_sma': False, 'bull_use_ema': False, 'bull_use_atr': True, 'bull_use_adx': False, 'bull_use_spike': False, 'bull_rsi_required': True, 'bear_strategy': 'mean_reversion', 'bear_bb_std_mult': 3.1802325916169165, 'bear_rsi_os': 31, 'bear_rsi_ob': 45, 'bear_adx_thresh': 8.499364190868596, 'bear_atr_min_pct': 0.005259277810192515, 'bear_atr_max_pct': 0.10363536225709377, 'bear_tp_mult': 2.2644255887093787, 'bear_tsl_mult': 0.6557737207370689, 'bear_time_stop': 27, 'bear_use_sma': False, 'bear_use_ema': True, 'bear_use_atr': False, 'bear_use_adx': True, 'bear_use_spike': True, 'bear_rsi_required': True, 'sideways_strategy': 'mean_reversion', 'sideways_bb_std_mult': 2.758973410689816, 'sideways_rsi_os': 33, 'sideways_rsi_ob': 82, 'sideways_adx_thresh': 29.61642180878704, 'sideways_atr_min_pct': 0.01320655513938996, 'sideways_atr_max_pct': 0.06815774356021509, 'sideways_tp_mult': 1.8945527403772933, 'sideways_tsl_mult': 0.32582652189166605, 'sideways_time_stop': 236, 'sideways_use_sma': False, 'sideways_use_ema': False, 'sideways_use_atr': True, 'sideways_use_adx': True, 'sideways_use_spike': False, 'sideways_rsi_required': True}.
[I 2025-08-29 19:50:58,189] Trial 118 finished with values: [-1000000000.0, 1000000000.0] and parameters: {'p_sma': 32, 'p_std': 22, 'p_atr': 21, 'p_adx': 18, 'rsi_period': 33, 'ema1': 12, 'ema2': 38, 'slip_atr_k': 0.24604894208943384, 'slip_spread_k': 0.2795280261921874, 'spread_hl_frac': 0.005560726191691774, 'bb_std_mult': 2.6603685969865443, 'rsi_os': 21, 'rsi_ob': 65, 'vol_spike': 0.061996908997824604, 'adx_thresh': 22.710327637252348, 'atr_min_pct': 0.01587434267458521, 'atr_max_pct': 0.13383457741483357, 'tp_mult': 2.392226764763264, 'tsl_mult': 0.631943690423358, 'strategy': 'mean_reversion', 'time_stop': 107, 'use_sma': False, 'use_atr': True, 'use_adx': False, 'use_ema': False, 'use_spike': False, 'rsi_required': False, 'edge_k': 1.5713572557043642, 'edge_cap': 0.5098794008300316, 'bull_strategy': 'breakout', 'bull_bb_std_mult': 0.7526578965651088, 'bull_rsi_os': 44, 'bull_rsi_ob': 93, 'bull_adx_thresh': 33.65426546504544, 'bull_atr_min_pct': 0.021151092470232894, 'bull_atr_max_pct': 0.04387580868847655, 'bull_tp_mult': 1.376147426620616, 'bull_tsl_mult': 0.1267835841373851, 'bull_time_stop': 11, 'bull_use_sma': False, 'bull_use_ema': False, 'bull_use_atr': False, 'bull_use_adx': True, 'bull_use_spike': False, 'bull_rsi_required': True, 'bear_strategy': 'mean_reversion', 'bear_bb_std_mult': 1.1403931945905328, 'bear_rsi_os': 27, 'bear_rsi_ob': 67, 'bear_adx_thresh': 5.039866904089898, 'bear_atr_min_pct': 0.010357743763080343, 'bear_atr_max_pct': 0.08709024467178224, 'bear_tp_mult': 1.43957952066321, 'bear_tsl_mult': 0.7003665917540185, 'bear_time_stop': 26, 'bear_use_sma': False, 'bear_use_ema': True, 'bear_use_atr': True, 'bear_use_adx': False, 'bear_use_spike': False, 'bear_rsi_required': False, 'sideways_strategy': 'mean_reversion', 'sideways_bb_std_mult': 1.8132487292707464, 'sideways_rsi_os': 33, 'sideways_rsi_ob': 82, 'sideways_adx_thresh': 29.70295211480115, 'sideways_atr_min_pct': 0.012818428098055654, 'sideways_atr_max_pct': 0.04586786190078913, 'sideways_tp_mult': 2.1658786074838092, 'sideways_tsl_mult': 0.3245871793537837, 'sideways_time_stop': 240, 'sideways_use_sma': False, 'sideways_use_ema': True, 'sideways_use_atr': True, 'sideways_use_adx': False, 'sideways_use_spike': False, 'sideways_rsi_required': True}.
[I 2025-08-29 19:50:59,972] Trial 122 finished with values: [-0.01757420355367978, 0.0175972556392967] and parameters: {'p_sma': 32, 'p_std': 22, 'p_atr': 21, 'p_adx': 16, 'rsi_period': 20, 'ema1': 24, 'ema2': 14, 'slip_atr_k': 0.0586476794963014, 'slip_spread_k': 0.3230003135981316, 'spread_hl_frac': 0.005756672388138144, 'bb_std_mult': 3.196114174136134, 'rsi_os': 43, 'rsi_ob': 69, 'vol_spike': 0.28658742353767774, 'adx_thresh': 26.49502984069525, 'atr_min_pct': 0.010342008675527587, 'atr_max_pct': 0.06406362853767722, 'tp_mult': 2.3636521148747556, 'tsl_mult': 0.5631707013208108, 'strategy': 'mean_reversion', 'time_stop': 42, 'use_sma': False, 'use_atr': True, 'use_adx': False, 'use_ema': False, 'use_spike': False, 'rsi_required': True, 'edge_k': 0.9606927616861394, 'edge_cap': 0.5369685574038127, 'bull_strategy': 'breakout', 'bull_bb_std_mult': 0.5203716339974893, 'bull_rsi_os': 38, 'bull_rsi_ob': 92, 'bull_adx_thresh': 24.44282406077735, 'bull_atr_min_pct': 0.0016418259910127332, 'bull_atr_max_pct': 0.04959166220621286, 'bull_tp_mult': 1.8699976191285437, 'bull_tsl_mult': 0.11251614578472299, 'bull_time_stop': 87, 'bull_use_sma': False, 'bull_use_ema': True, 'bull_use_atr': True, 'bull_use_adx': False, 'bull_use_spike': False, 'bull_rsi_required': True, 'bear_strategy': 'breakout', 'bear_bb_std_mult': 1.0474521001687378, 'bear_rsi_os': 32, 'bear_rsi_ob': 49, 'bear_adx_thresh': 30.984426871112355, 'bear_atr_min_pct': 0.020204769499809073, 'bear_atr_max_pct': 0.054317020576610545, 'bear_tp_mult': 1.8771275449462836, 'bear_tsl_mult': 0.7958054081666562, 'bear_time_stop': 49, 'bear_use_sma': False, 'bear_use_ema': False, 'bear_use_atr': False, 'bear_use_adx': False, 'bear_use_spike': True, 'bear_rsi_required': True, 'sideways_strategy': 'mean_reversion', 'sideways_bb_std_mult': 2.763708013205899, 'sideways_rsi_os': 35, 'sideways_rsi_ob': 82, 'sideways_adx_thresh': 32.01707298656048, 'sideways_atr_min_pct': 0.018700561631919087, 'sideways_atr_max_pct': 0.08534807798176328, 'sideways_tp_mult': 2.08108978904436, 'sideways_tsl_mult': 0.48646904024642273, 'sideways_time_stop': 291, 'sideways_use_sma': False, 'sideways_use_ema': False, 'sideways_use_atr': False, 'sideways_use_adx': True, 'sideways_use_spike': False, 'sideways_rsi_required': True}.
[I 2025-08-29 19:51:00,343] Trial 123 finished with values: [-1000000000.0, 1000000000.0] and parameters: {'p_sma': 13, 'p_std': 50, 'p_atr': 21, 'p_adx': 19, 'rsi_period': 19, 'ema1': 14, 'ema2': 40, 'slip_atr_k': 0.06050959132755973, 'slip_spread_k': 0.3348548171556093, 'spread_hl_frac': 0.003679387579139834, 'bb_std_mult': 2.301735518170471, 'rsi_os': 13, 'rsi_ob': 69, 'vol_spike': 0.023761451378042198, 'adx_thresh': 28.695558248088425, 'atr_min_pct': 0.01573566384470943, 'atr_max_pct': 0.027267259379633264, 'tp_mult': 1.1720885338106113, 'tsl_mult': 0.6574164554460362, 'strategy': 'mean_reversion', 'time_stop': 14, 'use_sma': True, 'use_atr': True, 'use_adx': False, 'use_ema': False, 'use_spike': False, 'rsi_required': True, 'edge_k': 0.978702457837791, 'edge_cap': 0.24358113164368456, 'bull_strategy': 'breakout', 'bull_bb_std_mult': 1.081808949436596, 'bull_rsi_os': 20, 'bull_rsi_ob': 52, 'bull_adx_thresh': 16.466962484443027, 'bull_atr_min_pct': 0.01930928348349782, 'bull_atr_max_pct': 0.013847991440136112, 'bull_tp_mult': 1.5205818770391333, 'bull_tsl_mult': 0.10276705341548999, 'bull_time_stop': 264, 'bull_use_sma': False, 'bull_use_ema': True, 'bull_use_atr': True, 'bull_use_adx': True, 'bull_use_spike': False, 'bull_rsi_required': True, 'bear_strategy': 'breakout', 'bear_bb_std_mult': 3.129711377099035, 'bear_rsi_os': 25, 'bear_rsi_ob': 67, 'bear_adx_thresh': 8.568715193359237, 'bear_atr_min_pct': 0.017064847512493743, 'bear_atr_max_pct': 0.0683102345460923, 'bear_tp_mult': 1.6637643410762981, 'bear_tsl_mult': 0.29941615329261717, 'bear_time_stop': 42, 'bear_use_sma': False, 'bear_use_ema': False, 'bear_use_atr': True, 'bear_use_adx': False, 'bear_use_spike': True, 'bear_rsi_required': False, 'sideways_strategy': 'mean_reversion', 'sideways_bb_std_mult': 1.833990998561159, 'sideways_rsi_os': 30, 'sideways_rsi_ob': 52, 'sideways_adx_thresh': 29.1641720978782, 'sideways_atr_min_pct': 0.019036750759017923, 'sideways_atr_max_pct': 0.04429265932857417, 'sideways_tp_mult': 2.0756024070431502, 'sideways_tsl_mult': 0.8106327246514123, 'sideways_time_stop': 215, 'sideways_use_sma': False, 'sideways_use_ema': True, 'sideways_use_atr': False, 'sideways_use_adx': True, 'sideways_use_spike': False, 'sideways_rsi_required': True}.
[I 2025-08-29 19:51:29,785] Trial 124 finished with values: [-1000000000.0, 1000000000.0] and parameters: {'p_sma': 15, 'p_std': 50, 'p_atr': 24, 'p_adx': 17, 'rsi_period': 20, 'ema1': 20, 'ema2': 40, 'slip_atr_k': 0.06167328774124854, 'slip_spread_k': 0.2235119230983841, 'spread_hl_frac': 0.004877948802278629, 'bb_std_mult': 1.2280053466524168, 'rsi_os': 44, 'rsi_ob': 69, 'vol_spike': 0.1115437261533706, 'adx_thresh': 23.014842905416977, 'atr_min_pct': 0.017187127542737306, 'atr_max_pct': 0.025257357095609445, 'tp_mult': 2.5665502133613343, 'tsl_mult': 0.5549279662527584, 'strategy': 'mean_reversion', 'time_stop': 17, 'use_sma': True, 'use_atr': True, 'use_adx': False, 'use_ema': False, 'use_spike': False, 'rsi_required': True, 'edge_k': 1.3873637641415675, 'edge_cap': 0.5350508424555303, 'bull_strategy': 'breakout', 'bull_bb_std_mult': 1.038598048405808, 'bull_rsi_os': 19, 'bull_rsi_ob': 46, 'bull_adx_thresh': 34.701328634131265, 'bull_atr_min_pct': 0.017825060088814026, 'bull_atr_max_pct': 0.031332566642362225, 'bull_tp_mult': 1.075569027388541, 'bull_tsl_mult': 0.030613163215274825, 'bull_time_stop': 86, 'bull_use_sma': False, 'bull_use_ema': True, 'bull_use_atr': False, 'bull_use_adx': True, 'bull_use_spike': False, 'bull_rsi_required': True, 'bear_strategy': 'breakout', 'bear_bb_std_mult': 0.9245769991898736, 'bear_rsi_os': 25, 'bear_rsi_ob': 80, 'bear_adx_thresh': 19.85221800036915, 'bear_atr_min_pct': 0.016872658216941738, 'bear_atr_max_pct': 0.05849964333483407, 'bear_tp_mult': 1.5176380703147478, 'bear_tsl_mult': 0.6886224541361978, 'bear_time_stop': 41, 'bear_use_sma': False, 'bear_use_ema': False, 'bear_use_atr': True, 'bear_use_adx': False, 'bear_use_spike': False, 'bear_rsi_required': False, 'sideways_strategy': 'mean_reversion', 'sideways_bb_std_mult': 3.1721211920841332, 'sideways_rsi_os': 25, 'sideways_rsi_ob': 80, 'sideways_adx_thresh': 31.78796694643401, 'sideways_atr_min_pct': 0.015409962713343607, 'sideways_atr_max_pct': 0.060132320884578344, 'sideways_tp_mult': 1.9777072526032062, 'sideways_tsl_mult': 0.2358007930958092, 'sideways_time_stop': 199, 'sideways_use_sma': False, 'sideways_use_ema': True, 'sideways_use_atr': False, 'sideways_use_adx': False, 'sideways_use_spike': False, 'sideways_rsi_required': True}.
[I 2025-08-29 19:51:30,322] Trial 125 finished with values: [-1000000000.0, 1000000000.0] and parameters: {'p_sma': 52, 'p_std': 7, 'p_atr': 24, 'p_adx': 19, 'rsi_period': 61, 'ema1': 20, 'ema2': 12, 'slip_atr_k': 0.06401260155389688, 'slip_spread_k': 0.3835167145868954, 'spread_hl_frac': 0.001771240808942156, 'bb_std_mult': 1.2340627895434793, 'rsi_os': 23, 'rsi_ob': 68, 'vol_spike': 0.047361719659993876, 'adx_thresh': 26.461081425019206, 'atr_min_pct': 0.017350356956976197, 'atr_max_pct': 0.036225495149546205, 'tp_mult': 1.1683856111389972, 'tsl_mult': 0.6083332461477987, 'strategy': 'mean_reversion', 'time_stop': 123, 'use_sma': True, 'use_atr': True, 'use_adx': False, 'use_ema': False, 'use_spike': False, 'rsi_required': True, 'edge_k': 0.9824477029943044, 'edge_cap': 0.5337822730541399, 'bull_strategy': 'breakout', 'bull_bb_std_mult': 1.047629806210499, 'bull_rsi_os': 40, 'bull_rsi_ob': 45, 'bull_adx_thresh': 16.569193751265697, 'bull_atr_min_pct': 0.01901040331170441, 'bull_atr_max_pct': 0.0629964084501703, 'bull_tp_mult': 1.5335741661178504, 'bull_tsl_mult': 0.2633886691257331, 'bull_time_stop': 87, 'bull_use_sma': False, 'bull_use_ema': True, 'bull_use_atr': False, 'bull_use_adx': True, 'bull_use_spike': False, 'bull_rsi_required': True, 'bear_strategy': 'breakout', 'bear_bb_std_mult': 2.2032544134248138, 'bear_rsi_os': 25, 'bear_rsi_ob': 52, 'bear_adx_thresh': 7.05210969844426, 'bear_atr_min_pct': 0.007607811106582317, 'bear_atr_max_pct': 0.11997641266520687, 'bear_tp_mult': 2.4085643504390895, 'bear_tsl_mult': 0.6838457550230501, 'bear_time_stop': 300, 'bear_use_sma': False, 'bear_use_ema': False, 'bear_use_atr': True, 'bear_use_adx': False, 'bear_use_spike': True, 'bear_rsi_required': False, 'sideways_strategy': 'mean_reversion', 'sideways_bb_std_mult': 3.1141698625186285, 'sideways_rsi_os': 30, 'sideways_rsi_ob': 80, 'sideways_adx_thresh': 28.90352186046418, 'sideways_atr_min_pct': 0.011796775017463932, 'sideways_atr_max_pct': 0.13428758946042624, 'sideways_tp_mult': 2.037271082203237, 'sideways_tsl_mult': 0.49023498037971835, 'sideways_time_stop': 266, 'sideways_use_sma': False, 'sideways_use_ema': True, 'sideways_use_atr': False, 'sideways_use_adx': True, 'sideways_use_spike': False, 'sideways_rsi_required': True}.
