[I 2025-08-29 20:25:30,627] Trial 404 finished with values: [-0.009220983368816826, 0.009212606135558424] and parameters: {'p_sma': 22, 'p_std': 56, 'p_atr': 26, 'p_adx': 14, 'rsi_period': 9, 'ema1': 6, 'ema2': 31, 'slip_atr_k': 0.0005356113099996239, 'slip_spread_k': 0.5386331016242225, 'spread_hl_frac': 0.0489215939630679, 'bb_std_mult': 3.429883279153805, 'rsi_os': 6, 'rsi_ob': 87, 'vol_spike': 0.16999483200561247, 'adx_thresh': 11.638492746182772, 'atr_min_pct': 0.0071144825146831105, 'atr_max_pct': 0.019899363689955388, 'tp_mult': 1.4651912390541182, 'tsl_mult': 0.869070367103559, 'strategy': 'breakout', 'time_stop': 157, 'use_sma': True, 'use_atr': False, 'use_adx': True, 'use_ema': True, 'use_spike': False, 'rsi_required': False, 'edge_k': 1.0247397264088167, 'edge_cap': 0.2193928381128608, 'bull_strategy': 'mean_reversion', 'bull_bb_std_mult': 3.0181580260203815, 'bull_rsi_os': 31, 'bull_rsi_ob': 75, 'bull_adx_thresh': 11.678123070880313, 'bull_atr_min_pct': 0.011145845885171382, 'bull_atr_max_pct': 0.09110702915264811, 'bull_tp_mult': 1.0939727878028833, 'bull_tsl_mult': 0.8765363326242928, 'bull_time_stop': 41, 'bull_use_sma': True, 'bull_use_ema': False, 'bull_use_atr': True, 'bull_use_adx': False, 'bull_use_spike': True, 'bull_rsi_required': False, 'bear_strategy': 'mean_reversion', 'bear_bb_std_mult': 2.715629526917035, 'bear_rsi_os': 45, 'bear_rsi_ob': 66, 'bear_adx_thresh': 21.298619639192115, 'bear_atr_min_pct': 0.005398537466175409, 'bear_atr_max_pct': 0.013498728098643512, 'bear_tp_mult': 2.60248480879278, 'bear_tsl_mult': 0.8937616369483473, 'bear_time_stop': 52, 'bear_use_sma': True, 'bear_use_ema': True, 'bear_use_atr': False, 'bear_use_adx': True, 'bear_use_spike': True, 'bear_rsi_required': True, 'sideways_strategy': 'breakout', 'sideways_bb_std_mult': 3.494001628320378, 'sideways_rsi_os': 48, 'sideways_rsi_ob': 51, 'sideways_adx_thresh': 10.38897569282337, 'sideways_atr_min_pct': 0.002919597690399166, 'sideways_atr_max_pct': 0.029113958555891606, 'sideways_tp_mult': 1.44841916668536, 'sideways_tsl_mult': 0.35896998312256856, 'sideways_time_stop': 200, 'sideways_use_sma': True, 'sideways_use_ema': False, 'sideways_use_atr': False, 'sideways_use_adx': False, 'sideways_use_spike': True, 'sideways_rsi_required': False}.
[I 2025-08-29 20:25:30,719] Trial 407 finished with values: [-0.00367968955345388, 0.0037248936368469293] and parameters: {'p_sma': 20, 'p_std': 56, 'p_atr': 25, 'p_adx': 11, 'rsi_period': 15, 'ema1': 27, 'ema2': 32, 'slip_atr_k': 0.18202430060827396, 'slip_spread_k': 0.9985604104436612, 'spread_hl_frac': 0.01569776955849203, 'bb_std_mult': 3.25446358440739, 'rsi_os': 26, 'rsi_ob': 82, 'vol_spike': 0.16868594825797192, 'adx_thresh': 11.666875388029489, 'atr_min_pct': 0.020889655246726285, 'atr_max_pct': 0.03138719836716289, 'tp_mult': 2.139015250990048, 'tsl_mult': 0.9951645299766454, 'strategy': 'mean_reversion', 'time_stop': 157, 'use_sma': True, 'use_atr': False, 'use_adx': False, 'use_ema': True, 'use_spike': False, 'rsi_required': False, 'edge_k': 1.923533698755794, 'edge_cap': 0.582837497795742, 'bull_strategy': 'mean_reversion', 'bull_bb_std_mult': 3.0112412813885636, 'bull_rsi_os': 14, 'bull_rsi_ob': 75, 'bull_adx_thresh': 32.387564375778446, 'bull_atr_min_pct': 0.025937819852568905, 'bull_atr_max_pct': 0.09187575963884571, 'bull_tp_mult': 2.657559115506271, 'bull_tsl_mult': 0.8625293910680404, 'bull_time_stop': 16, 'bull_use_sma': True, 'bull_use_ema': False, 'bull_use_atr': True, 'bull_use_adx': False, 'bull_use_spike': True, 'bull_rsi_required': False, 'bear_strategy': 'breakout', 'bear_bb_std_mult': 2.714234197527044, 'bear_rsi_os': 40, 'bear_rsi_ob': 66, 'bear_adx_thresh': 21.320050047246216, 'bear_atr_min_pct': 0.021034854180035728, 'bear_atr_max_pct': 0.021595811008446954, 'bear_tp_mult': 2.698642484821004, 'bear_tsl_mult': 0.9418240533490144, 'bear_time_stop': 53, 'bear_use_sma': False, 'bear_use_ema': True, 'bear_use_atr': False, 'bear_use_adx': True, 'bear_use_spike': True, 'bear_rsi_required': False, 'sideways_strategy': 'breakout', 'sideways_bb_std_mult': 0.8812866048285746, 'sideways_rsi_os': 45, 'sideways_rsi_ob': 95, 'sideways_adx_thresh': 31.912331853379264, 'sideways_atr_min_pct': 0.004048503156509803, 'sideways_atr_max_pct': 0.0250697388728531, 'sideways_tp_mult': 2.969092990676943, 'sideways_tsl_mult': 0.5764036009335352, 'sideways_time_stop': 201, 'sideways_use_sma': False, 'sideways_use_ema': False, 'sideways_use_atr': False, 'sideways_use_adx': True, 'sideways_use_spike': False, 'sideways_rsi_required': False}.
[I 2025-08-29 20:25:30,894] Trial 405 finished with values: [-0.02779021653028324, 0.027767179667247358] and parameters: {'p_sma': 20, 'p_std': 58, 'p_atr': 25, 'p_adx': 30, 'rsi_period': 41, 'ema1': 27, 'ema2': 54, 'slip_atr_k': 0.004146400744288323, 'slip_spread_k': 0.5762077387965105, 'spread_hl_frac': 0.0490311763341623, 'bb_std_mult': 2.437421498202145, 'rsi_os': 26, 'rsi_ob': 87, 'vol_spike': 0.19050917171377302, 'adx_thresh': 11.126405917739639, 'atr_min_pct': 0.0028260625229540263, 'atr_max_pct': 0.03161752635636705, 'tp_mult': 1.4683119377090514, 'tsl_mult': 0.8973375062551815, 'strategy': 'breakout', 'time_stop': 155, 'use_sma': True, 'use_atr': False, 'use_adx': True, 'use_ema': True, 'use_spike': False, 'rsi_required': False, 'edge_k': 1.9119797399383414, 'edge_cap': 0.996188089468337, 'bull_strategy': 'mean_reversion', 'bull_bb_std_mult': 3.026468770818529, 'bull_rsi_os': 14, 'bull_rsi_ob': 83, 'bull_adx_thresh': 13.325650917993404, 'bull_atr_min_pct': 0.01791196762794239, 'bull_atr_max_pct': 0.09396441832814616, 'bull_tp_mult': 2.7691541686991377, 'bull_tsl_mult': 0.8644126852167975, 'bull_time_stop': 126, 'bull_use_sma': True, 'bull_use_ema': False, 'bull_use_atr': True, 'bull_use_adx': False, 'bull_use_spike': True, 'bull_rsi_required': False, 'bear_strategy': 'breakout', 'bear_bb_std_mult': 2.7242617350217397, 'bear_rsi_os': 27, 'bear_rsi_ob': 68, 'bear_adx_thresh': 19.895674993588845, 'bear_atr_min_pct': 0.011798926004619415, 'bear_atr_max_pct': 0.07646700131101915, 'bear_tp_mult': 2.592444373164368, 'bear_tsl_mult': 0.8857326916241711, 'bear_time_stop': 51, 'bear_use_sma': True, 'bear_use_ema': True, 'bear_use_atr': False, 'bear_use_adx': True, 'bear_use_spike': True, 'bear_rsi_required': False, 'sideways_strategy': 'breakout', 'sideways_bb_std_mult': 3.289290786595363, 'sideways_rsi_os': 48, 'sideways_rsi_ob': 78, 'sideways_adx_thresh': 10.641132314313372, 'sideways_atr_min_pct': 0.0019030306766209676, 'sideways_atr_max_pct': 0.023960289748203915, 'sideways_tp_mult': 2.961914441423442, 'sideways_tsl_mult': 0.5761990619082127, 'sideways_time_stop': 296, 'sideways_use_sma': False, 'sideways_use_ema': False, 'sideways_use_atr': False, 'sideways_use_adx': False, 'sideways_use_spike': True, 'sideways_rsi_required': False}.
[I 2025-08-29 20:25:31,460] Trial 408 finished with values: [-1000000000.0, 1000000000.0] and parameters: {'p_sma': 20, 'p_std': 56, 'p_atr': 25, 'p_adx': 13, 'rsi_period': 39, 'ema1': 27, 'ema2': 45, 'slip_atr_k': 0.013569067987100327, 'slip_spread_k': 0.736425275135936, 'spread_hl_frac': 0.04811870630713592, 'bb_std_mult': 1.922894926994878, 'rsi_os': 7, 'rsi_ob': 82, 'vol_spike': 0.2825212986791111, 'adx_thresh': 11.938680855295026, 'atr_min_pct': 0.01882211996810334, 'atr_max_pct': 0.010216877108689681, 'tp_mult': 2.734019944654708, 'tsl_mult': 0.09152229079594848, 'strategy': 'breakout', 'time_stop': 158, 'use_sma': True, 'use_atr': False, 'use_adx': False, 'use_ema': True, 'use_spike': False, 'rsi_required': False, 'edge_k': 1.7621235142567726, 'edge_cap': 0.5934985190996891, 'bull_strategy': 'mean_reversion', 'bull_bb_std_mult': 3.088464968284767, 'bull_rsi_os': 17, 'bull_rsi_ob': 83, 'bull_adx_thresh': 14.66036620177579, 'bull_atr_min_pct': 0.010890550094722156, 'bull_atr_max_pct': 0.13112848473340202, 'bull_tp_mult': 2.564528648730507, 'bull_tsl_mult': 0.8646793384611001, 'bull_time_stop': 33, 'bull_use_sma': True, 'bull_use_ema': False, 'bull_use_atr': True, 'bull_use_adx': False, 'bull_use_spike': True, 'bull_rsi_required': False, 'bear_strategy': 'breakout', 'bear_bb_std_mult': 2.804516005170696, 'bear_rsi_os': 27, 'bear_rsi_ob': 66, 'bear_adx_thresh': 30.30693068255506, 'bear_atr_min_pct': 0.027950575863270856, 'bear_atr_max_pct': 0.07660151828979417, 'bear_tp_mult': 2.697743890695261, 'bear_tsl_mult': 0.9548493867311606, 'bear_time_stop': 295, 'bear_use_sma': False, 'bear_use_ema': False, 'bear_use_atr': False, 'bear_use_adx': True, 'bear_use_spike': True, 'bear_rsi_required': False, 'sideways_strategy': 'breakout', 'sideways_bb_std_mult': 2.424023472212676, 'sideways_rsi_os': 53, 'sideways_rsi_ob': 78, 'sideways_adx_thresh': 6.11997944149358, 'sideways_atr_min_pct': 0.0032707249959178586, 'sideways_atr_max_pct': 0.02113055557162944, 'sideways_tp_mult': 1.9041286331279386, 'sideways_tsl_mult': 0.5710785628481918, 'sideways_time_stop': 197, 'sideways_use_sma': False, 'sideways_use_ema': False, 'sideways_use_atr': False, 'sideways_use_adx': False, 'sideways_use_spike': False, 'sideways_rsi_required': False}.
[I 2025-08-29 20:25:59,984] Trial 411 finished with values: [-1000000000.0, 1000000000.0] and parameters: {'p_sma': 23, 'p_std': 57, 'p_atr': 14, 'p_adx': 29, 'rsi_period': 33, 'ema1': 25, 'ema2': 47, 'slip_atr_k': 0.01173463019874287, 'slip_spread_k': 0.7637732413439806, 'spread_hl_frac': 0.032449198644468186, 'bb_std_mult': 1.9520625095731843, 'rsi_os': 7, 'rsi_ob': 82, 'vol_spike': 0.1838495417149764, 'adx_thresh': 14.286747657355157, 'atr_min_pct': 0.018836836034830447, 'atr_max_pct': 0.026311073144803725, 'tp_mult': 2.993406428545563, 'tsl_mult': 0.2198861169179689, 'strategy': 'mean_reversion', 'time_stop': 176, 'use_sma': True, 'use_atr': False, 'use_adx': False, 'use_ema': True, 'use_spike': True, 'rsi_required': False, 'edge_k': 1.5870869745898464, 'edge_cap': 0.3482509947700624, 'bull_strategy': 'mean_reversion', 'bull_bb_std_mult': 2.1822066930867274, 'bull_rsi_os': 17, 'bull_rsi_ob': 72, 'bull_adx_thresh': 14.475827828904265, 'bull_atr_min_pct': 0.015462475007705024, 'bull_atr_max_pct': 0.11259173503259273, 'bull_tp_mult': 2.570066374919412, 'bull_tsl_mult': 0.02172732467927546, 'bull_time_stop': 35, 'bull_use_sma': True, 'bull_use_ema': False, 'bull_use_atr': True, 'bull_use_adx': False, 'bull_use_spike': True, 'bull_rsi_required': False, 'bear_strategy': 'breakout', 'bear_bb_std_mult': 2.843390067013636, 'bear_rsi_os': 18, 'bear_rsi_ob': 60, 'bear_adx_thresh': 20.854880565959675, 'bear_atr_min_pct': 0.028063042360942633, 'bear_atr_max_pct': 0.05801989960110435, 'bear_tp_mult': 2.377083661802648, 'bear_tsl_mult': 0.9647311549510919, 'bear_time_stop': 59, 'bear_use_sma': False, 'bear_use_ema': False, 'bear_use_atr': False, 'bear_use_adx': True, 'bear_use_spike': True, 'bear_rsi_required': False, 'sideways_strategy': 'breakout', 'sideways_bb_std_mult': 2.3838414694761267, 'sideways_rsi_os': 21, 'sideways_rsi_ob': 79, 'sideways_adx_thresh': 6.010679803386047, 'sideways_atr_min_pct': 0.022198748625703184, 'sideways_atr_max_pct': 0.03507896894217772, 'sideways_tp_mult': 2.33369934173656, 'sideways_tsl_mult': 0.9597460051656498, 'sideways_time_stop': 191, 'sideways_use_sma': False, 'sideways_use_ema': False, 'sideways_use_atr': False, 'sideways_use_adx': False, 'sideways_use_spike': False, 'sideways_rsi_required': False}.
[I 2025-08-29 20:26:00,114] Trial 410 finished with values: [-1000000000.0, 1000000000.0] and parameters: {'p_sma': 23, 'p_std': 58, 'p_atr': 14, 'p_adx': 30, 'rsi_period': 39, 'ema1': 25, 'ema2': 47, 'slip_atr_k': 0.012691297992108302, 'slip_spread_k': 0.5968603948422803, 'spread_hl_frac': 0.03470647853403108, 'bb_std_mult': 1.9276348161945525, 'rsi_os': 8, 'rsi_ob': 91, 'vol_spike': 0.1899166399755995, 'adx_thresh': 14.196452717411287, 'atr_min_pct': 0.018984492700856455, 'atr_max_pct': 0.028191865244685366, 'tp_mult': 2.0996022035296824, 'tsl_mult': 0.9004579940748869, 'strategy': 'mean_reversion', 'time_stop': 16, 'use_sma': True, 'use_atr': False, 'use_adx': False, 'use_ema': True, 'use_spike': False, 'rsi_required': False, 'edge_k': 1.736405393463253, 'edge_cap': 0.5962169915380412, 'bull_strategy': 'mean_reversion', 'bull_bb_std_mult': 2.923084089437918, 'bull_rsi_os': 15, 'bull_rsi_ob': 72, 'bull_adx_thresh': 14.265488314041585, 'bull_atr_min_pct': 0.015458122644841987, 'bull_atr_max_pct': 0.09566698713881541, 'bull_tp_mult': 2.560961652601619, 'bull_tsl_mult': 0.7523031637538709, 'bull_time_stop': 34, 'bull_use_sma': True, 'bull_use_ema': False, 'bull_use_atr': True, 'bull_use_adx': False, 'bull_use_spike': True, 'bull_rsi_required': False, 'bear_strategy': 'breakout', 'bear_bb_std_mult': 2.80824896379478, 'bear_rsi_os': 27, 'bear_rsi_ob': 68, 'bear_adx_thresh': 20.22800552411788, 'bear_atr_min_pct': 0.018095487119504237, 'bear_atr_max_pct': 0.14230363307387697, 'bear_tp_mult': 2.235508063915106, 'bear_tsl_mult': 0.9674002483573002, 'bear_time_stop': 179, 'bear_use_sma': False, 'bear_use_ema': False, 'bear_use_atr': False, 'bear_use_adx': True, 'bear_use_spike': True, 'bear_rsi_required': False, 'sideways_strategy': 'breakout', 'sideways_bb_std_mult': 2.4062201898125974, 'sideways_rsi_os': 21, 'sideways_rsi_ob': 79, 'sideways_adx_thresh': 34.13789626910955, 'sideways_atr_min_pct': 0.004936239660463561, 'sideways_atr_max_pct': 0.02095087296088453, 'sideways_tp_mult': 1.052361395907624, 'sideways_tsl_mult': 0.7332219902604672, 'sideways_time_stop': 190, 'sideways_use_sma': False, 'sideways_use_ema': False, 'sideways_use_atr': False, 'sideways_use_adx': False, 'sideways_use_spike': False, 'sideways_rsi_required': False}.
[I 2025-08-29 20:26:00,302] Trial 409 finished with values: [-1000000000.0, 1000000000.0] and parameters: {'p_sma': 20, 'p_std': 58, 'p_atr': 25, 'p_adx': 29, 'rsi_period': 58, 'ema1': 28, 'ema2': 54, 'slip_atr_k': 0.0817066738945654, 'slip_spread_k': 0.7216626881737597, 'spread_hl_frac': 0.01524613600779417, 'bb_std_mult': 3.227637110300337, 'rsi_os': 13, 'rsi_ob': 82, 'vol_spike': 0.11888259116569835, 'adx_thresh': 24.103475363380404, 'atr_min_pct': 0.021039943275058492, 'atr_max_pct': 0.025956674653178365, 'tp_mult': 2.131716994128592, 'tsl_mult': 0.10199002159522119, 'strategy': 'mean_reversion', 'time_stop': 283, 'use_sma': True, 'use_atr': False, 'use_adx': False, 'use_ema': True, 'use_spike': False, 'rsi_required': False, 'edge_k': 1.782956853791227, 'edge_cap': 0.587549567653079, 'bull_strategy': 'mean_reversion', 'bull_bb_std_mult': 2.1860542058412893, 'bull_rsi_os': 8, 'bull_rsi_ob': 72, 'bull_adx_thresh': 32.31826493095326, 'bull_atr_min_pct': 0.015867616110458525, 'bull_atr_max_pct': 0.09537455135276038, 'bull_tp_mult': 2.5607092445714588, 'bull_tsl_mult': 0.510147246968404, 'bull_time_stop': 17, 'bull_use_sma': True, 'bull_use_ema': False, 'bull_use_atr': True, 'bull_use_adx': False, 'bull_use_spike': True, 'bull_rsi_required': False, 'bear_strategy': 'breakout', 'bear_bb_std_mult': 2.850342763527724, 'bear_rsi_os': 40, 'bear_rsi_ob': 68, 'bear_adx_thresh': 30.481867758988294, 'bear_atr_min_pct': 0.020996221487707866, 'bear_atr_max_pct': 0.07621808947055414, 'bear_tp_mult': 2.9977398521839707, 'bear_tsl_mult': 0.9643572299374776, 'bear_time_stop': 51, 'bear_use_sma': False, 'bear_use_ema': False, 'bear_use_atr': False, 'bear_use_adx': True, 'bear_use_spike': True, 'bear_rsi_required': False, 'sideways_strategy': 'breakout', 'sideways_bb_std_mult': 2.385313099080229, 'sideways_rsi_os': 54, 'sideways_rsi_ob': 79, 'sideways_adx_thresh': 32.100702269656665, 'sideways_atr_min_pct': 0.0040204864514147235, 'sideways_atr_max_pct': 0.02216155448094166, 'sideways_tp_mult': 1.057839053824198, 'sideways_tsl_mult': 0.572878543308038, 'sideways_time_stop': 299, 'sideways_use_sma': False, 'sideways_use_ema': False, 'sideways_use_atr': False, 'sideways_use_adx': False, 'sideways_use_spike': False, 'sideways_rsi_required': False}.
[I 2025-08-29 20:26:00,890] Trial 412 finished with values: [-1000000000.0, 1000000000.0] and parameters: {'p_sma': 19, 'p_std': 58, 'p_atr': 14, 'p_adx': 22, 'rsi_period': 55, 'ema1': 25, 'ema2': 47, 'slip_atr_k': 0.009784175821775768, 'slip_spread_k': 0.762413510800355, 'spread_hl_frac': 0.03231894030118807, 'bb_std_mult': 2.5842200206638255, 'rsi_os': 48, 'rsi_ob': 84, 'vol_spike': 0.12281808166799793, 'adx_thresh': 24.438252789166697, 'atr_min_pct': 0.027101475421811922, 'atr_max_pct': 0.02722346694179326, 'tp_mult': 1.0931090671039887, 'tsl_mult': 0.21732892412884824, 'strategy': 'mean_reversion', 'time_stop': 177, 'use_sma': False, 'use_atr': False, 'use_adx': False, 'use_ema': True, 'use_spike': True, 'rsi_required': False, 'edge_k': 1.5125023646637203, 'edge_cap': 0.10857472478519004, 'bull_strategy': 'mean_reversion', 'bull_bb_std_mult': 2.930810944478948, 'bull_rsi_os': 8, 'bull_rsi_ob': 65, 'bull_adx_thresh': 14.187437947542616, 'bull_atr_min_pct': 0.015317064475404806, 'bull_atr_max_pct': 0.11272802378985251, 'bull_tp_mult': 2.732276787898792, 'bull_tsl_mult': 0.5999188089219153, 'bull_time_stop': 5, 'bull_use_sma': True, 'bull_use_ema': False, 'bull_use_atr': True, 'bull_use_adx': False, 'bull_use_spike': True, 'bull_rsi_required': False, 'bear_strategy': 'breakout', 'bear_bb_std_mult': 2.6244307760508394, 'bear_rsi_os': 29, 'bear_rsi_ob': 58, 'bear_adx_thresh': 20.66480976441133, 'bear_atr_min_pct': 0.0066140565204666005, 'bear_atr_max_pct': 0.04642364454452013, 'bear_tp_mult': 2.245774546679979, 'bear_tsl_mult': 0.9730609104245425, 'bear_time_stop': 41, 'bear_use_sma': False, 'bear_use_ema': False, 'bear_use_atr': False, 'bear_use_adx': True, 'bear_use_spike': False, 'bear_rsi_required': False, 'sideways_strategy': 'breakout', 'sideways_bb_std_mult': 2.365623742685768, 'sideways_rsi_os': 41, 'sideways_rsi_ob': 79, 'sideways_adx_thresh': 33.83541624649343, 'sideways_atr_min_pct': 0.023344842582780554, 'sideways_atr_max_pct': 0.08026880358640354, 'sideways_tp_mult': 1.0503086636941803, 'sideways_tsl_mult': 0.43490608541747916, 'sideways_time_stop': 192, 'sideways_use_sma': False, 'sideways_use_ema': False, 'sideways_use_atr': False, 'sideways_use_adx': False, 'sideways_use_spike': False, 'sideways_rsi_required': False}.
[I 2025-08-29 20:26:01,486] Trial 414 finished with values: [-1000000000.0, 1000000000.0] and parameters: {'p_sma': 25, 'p_std': 12, 'p_atr': 7, 'p_adx': 13, 'rsi_period': 36, 'ema1': 5, 'ema2': 45, 'slip_atr_k': 0.15066614584639199, 'slip_spread_k': 0.18682205526890044, 'spread_hl_frac': 0.04996222649142613, 'bb_std_mult': 1.7260209829646964, 'rsi_os': 13, 'rsi_ob': 49, 'vol_spike': 0.07919813677163683, 'adx_thresh': 12.67245982150385, 'atr_min_pct': 0.01990017236950934, 'atr_max_pct': 0.06260507436663527, 'tp_mult': 1.0882751113062739, 'tsl_mult': 0.264260321511625, 'strategy': 'mean_reversion', 'time_stop': 285, 'use_sma': False, 'use_atr': False, 'use_adx': False, 'use_ema': True, 'use_spike': False, 'rsi_required': False, 'edge_k': 1.0897761854443981, 'edge_cap': 0.10838588910954228, 'bull_strategy': 'mean_reversion', 'bull_bb_std_mult': 2.841799077962665, 'bull_rsi_os': 49, 'bull_rsi_ob': 74, 'bull_adx_thresh': 13.510780585306142, 'bull_atr_min_pct': 0.016129755455290835, 'bull_atr_max_pct': 0.09916425563990745, 'bull_tp_mult': 2.7495165401673836, 'bull_tsl_mult': 0.9025854865548393, 'bull_time_stop': 22, 'bull_use_sma': True, 'bull_use_ema': False, 'bull_use_atr': True, 'bull_use_adx': False, 'bull_use_spike': True, 'bull_rsi_required': False, 'bear_strategy': 'breakout', 'bear_bb_std_mult': 0.7201840621093332, 'bear_rsi_os': 47, 'bear_rsi_ob': 48, 'bear_adx_thresh': 13.55636069606442, 'bear_atr_min_pct': 0.028925131076719707, 'bear_atr_max_pct': 0.04524254562310252, 'bear_tp_mult': 2.634608016698785, 'bear_tsl_mult': 0.12119305372607048, 'bear_time_stop': 41, 'bear_use_sma': False, 'bear_use_ema': True, 'bear_use_atr': False, 'bear_use_adx': True, 'bear_use_spike': False, 'bear_rsi_required': False, 'sideways_strategy': 'breakout', 'sideways_bb_std_mult': 2.3047664146999374, 'sideways_rsi_os': 24, 'sideways_rsi_ob': 66, 'sideways_adx_thresh': 31.409697161394586, 'sideways_atr_min_pct': 0.024197212534851777, 'sideways_atr_max_pct': 0.08049712548605305, 'sideways_tp_mult': 1.0909506018430648, 'sideways_tsl_mult': 0.750627004600159, 'sideways_time_stop': 111, 'sideways_use_sma': False, 'sideways_use_ema': False, 'sideways_use_atr': False, 'sideways_use_adx': True, 'sideways_use_spike': False, 'sideways_rsi_required': True}.
