[I 2025-08-29 20:19:48,980] Trial 357 finished with values: [-1000000000.0, 1000000000.0] and parameters: {'p_sma': 22, 'p_std': 56, 'p_atr': 25, 'p_adx': 13, 'rsi_period': 78, 'ema1': 26, 'ema2': 48, 'slip_atr_k': 0.008257422132138995, 'slip_spread_k': 0.9784216323286304, 'spread_hl_frac': 0.04870498286102569, 'bb_std_mult': 1.7222469315885163, 'rsi_os': 7, 'rsi_ob': 82, 'vol_spike': 0.18313018264815162, 'adx_thresh': 8.905149152217614, 'atr_min_pct': 0.019890638481330002, 'atr_max_pct': 0.025700351182462396, 'tp_mult': 1.4656036744222294, 'tsl_mult': 0.9019389715763386, 'strategy': 'mean_reversion', 'time_stop': 177, 'use_sma': True, 'use_atr': False, 'use_adx': False, 'use_ema': True, 'use_spike': False, 'rsi_required': False, 'edge_k': 1.0354831562497915, 'edge_cap': 0.8149811104360589, 'bull_strategy': 'mean_reversion', 'bull_bb_std_mult': 3.317168398782023, 'bull_rsi_os': 37, 'bull_rsi_ob': 73, 'bull_adx_thresh': 14.218998191204902, 'bull_atr_min_pct': 0.013480597831528732, 'bull_atr_max_pct': 0.09481655753559057, 'bull_tp_mult': 2.741420133252135, 'bull_tsl_mult': 0.8933051597696603, 'bull_time_stop': 51, 'bull_use_sma': True, 'bull_use_ema': False, 'bull_use_atr': True, 'bull_use_adx': False, 'bull_use_spike': True, 'bull_rsi_required': False, 'bear_strategy': 'breakout', 'bear_bb_std_mult': 2.7359450744698957, 'bear_rsi_os': 28, 'bear_rsi_ob': 58, 'bear_adx_thresh': 21.57361739115652, 'bear_atr_min_pct': 0.0059697150272279235, 'bear_atr_max_pct': 0.03691672054831711, 'bear_tp_mult': 2.6493378272665464, 'bear_tsl_mult': 0.9597425539170373, 'bear_time_stop': 22, 'bear_use_sma': False, 'bear_use_ema': True, 'bear_use_atr': False, 'bear_use_adx': True, 'bear_use_spike': True, 'bear_rsi_required': False, 'sideways_strategy': 'breakout', 'sideways_bb_std_mult': 2.3281844244591254, 'sideways_rsi_os': 44, 'sideways_rsi_ob': 81, 'sideways_adx_thresh': 32.38959253460619, 'sideways_atr_min_pct': 0.004674316781776606, 'sideways_atr_max_pct': 0.016279863712580594, 'sideways_tp_mult': 1.1006071499973762, 'sideways_tsl_mult': 0.0001220909403236159, 'sideways_time_stop': 218, 'sideways_use_sma': False, 'sideways_use_ema': True, 'sideways_use_atr': False, 'sideways_use_adx': False, 'sideways_use_spike': False, 'sideways_rsi_required': False}.
[I 2025-08-29 20:20:21,035] Trial 361 finished with values: [-1000000000.0, 1000000000.0] and parameters: {'p_sma': 23, 'p_std': 58, 'p_atr': 26, 'p_adx': 13, 'rsi_period': 76, 'ema1': 26, 'ema2': 44, 'slip_atr_k': 0.004227947706662242, 'slip_spread_k': 0.15398159336130085, 'spread_hl_frac': 0.04991282306218242, 'bb_std_mult': 1.7323906752061986, 'rsi_os': 10, 'rsi_ob': 84, 'vol_spike': 0.2930924906332188, 'adx_thresh': 12.924150736486204, 'atr_min_pct': 0.020181436969541233, 'atr_max_pct': 0.02430955971106665, 'tp_mult': 1.392380220063836, 'tsl_mult': 0.9134480930625926, 'strategy': 'mean_reversion', 'time_stop': 164, 'use_sma': True, 'use_atr': False, 'use_adx': True, 'use_ema': True, 'use_spike': True, 'rsi_required': False, 'edge_k': 0.9785769816159807, 'edge_cap': 0.6820556836474322, 'bull_strategy': 'mean_reversion', 'bull_bb_std_mult': 2.9128151247482714, 'bull_rsi_os': 17, 'bull_rsi_ob': 73, 'bull_adx_thresh': 14.254315368376103, 'bull_atr_min_pct': 0.016126023152100512, 'bull_atr_max_pct': 0.09363849439826298, 'bull_tp_mult': 2.7566406551444396, 'bull_tsl_mult': 0.893034279822946, 'bull_time_stop': 27, 'bull_use_sma': True, 'bull_use_ema': False, 'bull_use_atr': True, 'bull_use_adx': False, 'bull_use_spike': True, 'bull_rsi_required': False, 'bear_strategy': 'breakout', 'bear_bb_std_mult': 2.9005390254994015, 'bear_rsi_os': 52, 'bear_rsi_ob': 66, 'bear_adx_thresh': 19.936504350221266, 'bear_atr_min_pct': 0.02645406216166479, 'bear_atr_max_pct': 0.05607783962661308, 'bear_tp_mult': 2.5892958742969894, 'bear_tsl_mult': 0.928913321658264, 'bear_time_stop': 57, 'bear_use_sma': True, 'bear_use_ema': True, 'bear_use_atr': False, 'bear_use_adx': True, 'bear_use_spike': True, 'bear_rsi_required': True, 'sideways_strategy': 'breakout', 'sideways_bb_std_mult': 2.4996518100174674, 'sideways_rsi_os': 50, 'sideways_rsi_ob': 77, 'sideways_adx_thresh': 32.65773022381029, 'sideways_atr_min_pct': 0.00485120228761023, 'sideways_atr_max_pct': 0.02502712289184612, 'sideways_tp_mult': 1.0354704678736275, 'sideways_tsl_mult': 0.7482032966530514, 'sideways_time_stop': 184, 'sideways_use_sma': True, 'sideways_use_ema': False, 'sideways_use_atr': False, 'sideways_use_adx': True, 'sideways_use_spike': True, 'sideways_rsi_required': False}.
[I 2025-08-29 20:20:21,425] Trial 364 finished with values: [-1000000000.0, 1000000000.0] and parameters: {'p_sma': 23, 'p_std': 59, 'p_atr': 26, 'p_adx': 13, 'rsi_period': 75, 'ema1': 26, 'ema2': 30, 'slip_atr_k': 0.0025636391456712983, 'slip_spread_k': 0.15544150629306214, 'spread_hl_frac': 0.049419417791429436, 'bb_std_mult': 1.7210311537016154, 'rsi_os': 10, 'rsi_ob': 84, 'vol_spike': 0.018198182498858295, 'adx_thresh': 13.031479405592545, 'atr_min_pct': 0.021364616888335852, 'atr_max_pct': 0.024381123135448962, 'tp_mult': 1.3608414816212235, 'tsl_mult': 0.9432195566455672, 'strategy': 'mean_reversion', 'time_stop': 165, 'use_sma': True, 'use_atr': False, 'use_adx': True, 'use_ema': True, 'use_spike': True, 'rsi_required': False, 'edge_k': 1.0038894867426476, 'edge_cap': 0.7036674199679311, 'bull_strategy': 'mean_reversion', 'bull_bb_std_mult': 2.9180138005454985, 'bull_rsi_os': 12, 'bull_rsi_ob': 70, 'bull_adx_thresh': 14.710925499621517, 'bull_atr_min_pct': 0.01610871228496829, 'bull_atr_max_pct': 0.09290730261204164, 'bull_tp_mult': 2.6938220238550716, 'bull_tsl_mult': 0.8768026055372744, 'bull_time_stop': 25, 'bull_use_sma': True, 'bull_use_ema': False, 'bull_use_atr': True, 'bull_use_adx': False, 'bull_use_spike': True, 'bull_rsi_required': False, 'bear_strategy': 'mean_reversion', 'bear_bb_std_mult': 2.9046331119934825, 'bear_rsi_os': 20, 'bear_rsi_ob': 66, 'bear_adx_thresh': 20.178583407175044, 'bear_atr_min_pct': 0.0010700845295681279, 'bear_atr_max_pct': 0.05827570889293264, 'bear_tp_mult': 2.589669280962426, 'bear_tsl_mult': 0.9186722332127133, 'bear_time_stop': 59, 'bear_use_sma': True, 'bear_use_ema': True, 'bear_use_atr': False, 'bear_use_adx': True, 'bear_use_spike': True, 'bear_rsi_required': True, 'sideways_strategy': 'breakout', 'sideways_bb_std_mult': 2.4990842969511267, 'sideways_rsi_os': 49, 'sideways_rsi_ob': 75, 'sideways_adx_thresh': 31.574079851425353, 'sideways_atr_min_pct': 0.005052296549346573, 'sideways_atr_max_pct': 0.030337920813979978, 'sideways_tp_mult': 1.041342126094002, 'sideways_tsl_mult': 0.7663999179087486, 'sideways_time_stop': 184, 'sideways_use_sma': True, 'sideways_use_ema': False, 'sideways_use_atr': False, 'sideways_use_adx': True, 'sideways_use_spike': True, 'sideways_rsi_required': False}.
[I 2025-08-29 20:20:21,588] Trial 363 finished with values: [-1000000000.0, 1000000000.0] and parameters: {'p_sma': 24, 'p_std': 59, 'p_atr': 26, 'p_adx': 13, 'rsi_period': 77, 'ema1': 26, 'ema2': 44, 'slip_atr_k': 0.001135552440690149, 'slip_spread_k': 0.1526146655927871, 'spread_hl_frac': 0.049722544509991494, 'bb_std_mult': 1.7442963534107125, 'rsi_os': 10, 'rsi_ob': 84, 'vol_spike': 0.00015074476011875393, 'adx_thresh': 12.81966302389941, 'atr_min_pct': 0.02068184605424219, 'atr_max_pct': 0.024527485414011597, 'tp_mult': 1.38895254134356, 'tsl_mult': 0.9133791907887934, 'strategy': 'mean_reversion', 'time_stop': 291, 'use_sma': True, 'use_atr': False, 'use_adx': True, 'use_ema': True, 'use_spike': True, 'rsi_required': False, 'edge_k': 0.9976644850603851, 'edge_cap': 0.6846649983387182, 'bull_strategy': 'mean_reversion', 'bull_bb_std_mult': 2.918899481156845, 'bull_rsi_os': 18, 'bull_rsi_ob': 72, 'bull_adx_thresh': 14.414731835035589, 'bull_atr_min_pct': 0.016176828647742, 'bull_atr_max_pct': 0.09317519736602109, 'bull_tp_mult': 2.7468262086467785, 'bull_tsl_mult': 0.8949752053454086, 'bull_time_stop': 26, 'bull_use_sma': True, 'bull_use_ema': False, 'bull_use_atr': True, 'bull_use_adx': False, 'bull_use_spike': True, 'bull_rsi_required': False, 'bear_strategy': 'breakout', 'bear_bb_std_mult': 2.8858590065233005, 'bear_rsi_os': 54, 'bear_rsi_ob': 67, 'bear_adx_thresh': 19.922977197647224, 'bear_atr_min_pct': 0.02865066219105407, 'bear_atr_max_pct': 0.05730609572336895, 'bear_tp_mult': 2.591798640337881, 'bear_tsl_mult': 0.9219356321699086, 'bear_time_stop': 59, 'bear_use_sma': True, 'bear_use_ema': True, 'bear_use_atr': False, 'bear_use_adx': True, 'bear_use_spike': True, 'bear_rsi_required': True, 'sideways_strategy': 'breakout', 'sideways_bb_std_mult': 2.5198361509952005, 'sideways_rsi_os': 48, 'sideways_rsi_ob': 76, 'sideways_adx_thresh': 31.68540332115122, 'sideways_atr_min_pct': 0.023789426157633478, 'sideways_atr_max_pct': 0.033497584840046, 'sideways_tp_mult': 1.0397265048675823, 'sideways_tsl_mult': 0.7750070169979085, 'sideways_time_stop': 185, 'sideways_use_sma': True, 'sideways_use_ema': False, 'sideways_use_atr': False, 'sideways_use_adx': True, 'sideways_use_spike': True, 'sideways_rsi_required': False}.
[I 2025-08-29 20:20:21,719] Trial 362 finished with values: [-1000000000.0, 1000000000.0] and parameters: {'p_sma': 24, 'p_std': 56, 'p_atr': 26, 'p_adx': 13, 'rsi_period': 7, 'ema1': 26, 'ema2': 45, 'slip_atr_k': 1.1372221204125274e-05, 'slip_spread_k': 0.15718660442011928, 'spread_hl_frac': 0.04933799336775292, 'bb_std_mult': 1.7439422148039276, 'rsi_os': 10, 'rsi_ob': 84, 'vol_spike': 0.10611744480097714, 'adx_thresh': 13.028465933878032, 'atr_min_pct': 0.02005445287062289, 'atr_max_pct': 0.024577359470420494, 'tp_mult': 1.376240279131738, 'tsl_mult': 0.9153563905272342, 'strategy': 'mean_reversion', 'time_stop': 164, 'use_sma': True, 'use_atr': False, 'use_adx': True, 'use_ema': True, 'use_spike': True, 'rsi_required': False, 'edge_k': 1.013500684082242, 'edge_cap': 0.6886659879792447, 'bull_strategy': 'mean_reversion', 'bull_bb_std_mult': 2.8883373914419472, 'bull_rsi_os': 18, 'bull_rsi_ob': 73, 'bull_adx_thresh': 14.323797217489334, 'bull_atr_min_pct': 0.01610021438366243, 'bull_atr_max_pct': 0.09360724840855143, 'bull_tp_mult': 2.7225911303072463, 'bull_tsl_mult': 0.8833609306117837, 'bull_time_stop': 27, 'bull_use_sma': True, 'bull_use_ema': False, 'bull_use_atr': True, 'bull_use_adx': False, 'bull_use_spike': True, 'bull_rsi_required': False, 'bear_strategy': 'breakout', 'bear_bb_std_mult': 2.866502549890198, 'bear_rsi_os': 12, 'bear_rsi_ob': 67, 'bear_adx_thresh': 19.9904451690234, 'bear_atr_min_pct': 0.006345542815138762, 'bear_atr_max_pct': 0.05607755609817692, 'bear_tp_mult': 2.5909665692564006, 'bear_tsl_mult': 0.9264068966881625, 'bear_time_stop': 56, 'bear_use_sma': True, 'bear_use_ema': True, 'bear_use_atr': False, 'bear_use_adx': True, 'bear_use_spike': True, 'bear_rsi_required': True, 'sideways_strategy': 'breakout', 'sideways_bb_std_mult': 2.477299458697634, 'sideways_rsi_os': 51, 'sideways_rsi_ob': 76, 'sideways_adx_thresh': 31.518680322361377, 'sideways_atr_min_pct': 0.027745360027820687, 'sideways_atr_max_pct': 0.03164442718284062, 'sideways_tp_mult': 1.0406991941647872, 'sideways_tsl_mult': 0.7635015850568624, 'sideways_time_stop': 185, 'sideways_use_sma': True, 'sideways_use_ema': False, 'sideways_use_atr': False, 'sideways_use_adx': True, 'sideways_use_spike': True, 'sideways_rsi_required': False}.
[I 2025-08-29 20:20:51,931] Trial 366 finished with values: [-1000000000.0, 1000000000.0] and parameters: {'p_sma': 21, 'p_std': 56, 'p_atr': 26, 'p_adx': 12, 'rsi_period': 42, 'ema1': 25, 'ema2': 44, 'slip_atr_k': 0.000535810450731126, 'slip_spread_k': 0.14844281405679421, 'spread_hl_frac': 0.04977557688793668, 'bb_std_mult': 1.8033804469572017, 'rsi_os': 9, 'rsi_ob': 84, 'vol_spike': 0.18148310038750462, 'adx_thresh': 12.465730954766883, 'atr_min_pct': 0.020676333423545246, 'atr_max_pct': 0.02758303353650947, 'tp_mult': 1.3782920591954322, 'tsl_mult': 0.9328150003956577, 'strategy': 'mean_reversion', 'time_stop': 251, 'use_sma': True, 'use_atr': False, 'use_adx': True, 'use_ema': True, 'use_spike': True, 'rsi_required': False, 'edge_k': 1.0118701343199574, 'edge_cap': 0.6412308346780198, 'bull_strategy': 'mean_reversion', 'bull_bb_std_mult': 2.8719052600153985, 'bull_rsi_os': 18, 'bull_rsi_ob': 72, 'bull_adx_thresh': 14.054565632784634, 'bull_atr_min_pct': 0.01683851568935132, 'bull_atr_max_pct': 0.08663627533032453, 'bull_tp_mult': 2.7168689296906527, 'bull_tsl_mult': 0.8677371692258514, 'bull_time_stop': 9, 'bull_use_sma': True, 'bull_use_ema': False, 'bull_use_atr': True, 'bull_use_adx': False, 'bull_use_spike': True, 'bull_rsi_required': False, 'bear_strategy': 'breakout', 'bear_bb_std_mult': 2.8434828790189117, 'bear_rsi_os': 38, 'bear_rsi_ob': 67, 'bear_adx_thresh': 20.913463680558188, 'bear_atr_min_pct': 0.006765871060738341, 'bear_atr_max_pct': 0.047942219448583547, 'bear_tp_mult': 2.6439930287204834, 'bear_tsl_mult': 0.8996655553279427, 'bear_time_stop': 52, 'bear_use_sma': False, 'bear_use_ema': True, 'bear_use_atr': False, 'bear_use_adx': True, 'bear_use_spike': True, 'bear_rsi_required': True, 'sideways_strategy': 'breakout', 'sideways_bb_std_mult': 2.3725936986922744, 'sideways_rsi_os': 47, 'sideways_rsi_ob': 76, 'sideways_adx_thresh': 31.488132244687502, 'sideways_atr_min_pct': 0.027741910701241105, 'sideways_atr_max_pct': 0.03205805699370738, 'sideways_tp_mult': 1.0466340277763249, 'sideways_tsl_mult': 0.7502043182584085, 'sideways_time_stop': 187, 'sideways_use_sma': True, 'sideways_use_ema': False, 'sideways_use_atr': False, 'sideways_use_adx': True, 'sideways_use_spike': False, 'sideways_rsi_required': False}.
[I 2025-08-29 20:20:52,134] Trial 367 finished with values: [-1000000000.0, 1000000000.0] and parameters: {'p_sma': 21, 'p_std': 56, 'p_atr': 26, 'p_adx': 12, 'rsi_period': 41, 'ema1': 27, 'ema2': 44, 'slip_atr_k': 2.7291463210105398e-05, 'slip_spread_k': 0.12314238876423339, 'spread_hl_frac': 0.049896554496812455, 'bb_std_mult': 1.7911592739361208, 'rsi_os': 9, 'rsi_ob': 85, 'vol_spike': 0.033026984942015794, 'adx_thresh': 12.19477978860481, 'atr_min_pct': 0.02070788647040562, 'atr_max_pct': 0.027577764348801683, 'tp_mult': 1.322421616340833, 'tsl_mult': 0.9347983406797263, 'strategy': 'breakout', 'time_stop': 167, 'use_sma': True, 'use_atr': False, 'use_adx': False, 'use_ema': True, 'use_spike': True, 'rsi_required': False, 'edge_k': 1.0134395876445867, 'edge_cap': 0.6394809767959282, 'bull_strategy': 'mean_reversion', 'bull_bb_std_mult': 2.8587789273417887, 'bull_rsi_os': 16, 'bull_rsi_ob': 74, 'bull_adx_thresh': 13.977953753704297, 'bull_atr_min_pct': 0.016778408124972635, 'bull_atr_max_pct': 0.09551858687275301, 'bull_tp_mult': 2.7006678165985063, 'bull_tsl_mult': 0.8487283565775644, 'bull_time_stop': 12, 'bull_use_sma': True, 'bull_use_ema': False, 'bull_use_atr': True, 'bull_use_adx': False, 'bull_use_spike': True, 'bull_rsi_required': False, 'bear_strategy': 'mean_reversion', 'bear_bb_std_mult': 2.7831294823175647, 'bear_rsi_os': 28, 'bear_rsi_ob': 45, 'bear_adx_thresh': 20.878655450625864, 'bear_atr_min_pct': 0.006915603193995618, 'bear_atr_max_pct': 0.0617768487985942, 'bear_tp_mult': 2.0722895427878893, 'bear_tsl_mult': 0.9436039596476593, 'bear_time_stop': 53, 'bear_use_sma': False, 'bear_use_ema': True, 'bear_use_atr': False, 'bear_use_adx': True, 'bear_use_spike': True, 'bear_rsi_required': True, 'sideways_strategy': 'breakout', 'sideways_bb_std_mult': 2.3598510632922713, 'sideways_rsi_os': 47, 'sideways_rsi_ob': 77, 'sideways_adx_thresh': 31.834706220772215, 'sideways_atr_min_pct': 0.011626525458905398, 'sideways_atr_max_pct': 0.02449884211912525, 'sideways_tp_mult': 1.6014565816793596, 'sideways_tsl_mult': 0.7544666025759832, 'sideways_time_stop': 193, 'sideways_use_sma': True, 'sideways_use_ema': False, 'sideways_use_atr': False, 'sideways_use_adx': True, 'sideways_use_spike': False, 'sideways_rsi_required': False}.
[I 2025-08-29 20:20:52,643] Trial 365 finished with values: [-1000000000.0, 1000000000.0] and parameters: {'p_sma': 24, 'p_std': 59, 'p_atr': 26, 'p_adx': 13, 'rsi_period': 41, 'ema1': 28, 'ema2': 44, 'slip_atr_k': 0.0004260774815831869, 'slip_spread_k': 0.14610195758637068, 'spread_hl_frac': 0.04998807091255949, 'bb_std_mult': 1.7277930490715243, 'rsi_os': 9, 'rsi_ob': 84, 'vol_spike': 0.01984489340049972, 'adx_thresh': 13.189939217178031, 'atr_min_pct': 0.020843857620729527, 'atr_max_pct': 0.02760815238117889, 'tp_mult': 1.3591263603685932, 'tsl_mult': 0.9436841260988349, 'strategy': 'mean_reversion', 'time_stop': 293, 'use_sma': True, 'use_atr': False, 'use_adx': True, 'use_ema': True, 'use_spike': True, 'rsi_required': False, 'edge_k': 1.032916580668989, 'edge_cap': 0.6460915296274385, 'bull_strategy': 'mean_reversion', 'bull_bb_std_mult': 2.8804961272230445, 'bull_rsi_os': 21, 'bull_rsi_ob': 70, 'bull_adx_thresh': 14.803756960494423, 'bull_atr_min_pct': 0.017014985744349443, 'bull_atr_max_pct': 0.09231202073239206, 'bull_tp_mult': 2.698806092625648, 'bull_tsl_mult': 0.8702705622749682, 'bull_time_stop': 23, 'bull_use_sma': True, 'bull_use_ema': False, 'bull_use_atr': True, 'bull_use_adx': False, 'bull_use_spike': True, 'bull_rsi_required': False, 'bear_strategy': 'mean_reversion', 'bear_bb_std_mult': 2.7819853351675494, 'bear_rsi_os': 44, 'bear_rsi_ob': 67, 'bear_adx_thresh': 20.95082357440687, 'bear_atr_min_pct': 0.01424912092680899, 'bear_atr_max_pct': 0.049728947146493716, 'bear_tp_mult': 2.6028811480895864, 'bear_tsl_mult': 0.9158381142230423, 'bear_time_stop': 63, 'bear_use_sma': True, 'bear_use_ema': True, 'bear_use_atr': False, 'bear_use_adx': True, 'bear_use_spike': True, 'bear_rsi_required': True, 'sideways_strategy': 'breakout', 'sideways_bb_std_mult': 2.383311957679057, 'sideways_rsi_os': 49, 'sideways_rsi_ob': 76, 'sideways_adx_thresh': 31.60301027904474, 'sideways_atr_min_pct': 0.022606605742595112, 'sideways_atr_max_pct': 0.03273643125855141, 'sideways_tp_mult': 1.0460283190406734, 'sideways_tsl_mult': 0.7671760245736161, 'sideways_time_stop': 185, 'sideways_use_sma': True, 'sideways_use_ema': False, 'sideways_use_atr': False, 'sideways_use_adx': True, 'sideways_use_spike': True, 'sideways_rsi_required': False}.
[I 2025-08-29 20:20:52,718] Trial 368 finished with values: [-1000000000.0, 1000000000.0] and parameters: {'p_sma': 21, 'p_std': 57, 'p_atr': 26, 'p_adx': 12, 'rsi_period': 42, 'ema1': 28, 'ema2': 45, 'slip_atr_k': 0.001459502815180843, 'slip_spread_k': 0.11652436546568366, 'spread_hl_frac': 0.04997368953127603, 'bb_std_mult': 1.7989621313801294, 'rsi_os': 9, 'rsi_ob': 86, 'vol_spike': 0.18069282207774084, 'adx_thresh': 12.09644167793651, 'atr_min_pct': 0.021193953661932306, 'atr_max_pct': 0.028151768315308533, 'tp_mult': 1.3152246667314915, 'tsl_mult': 0.9014499337369941, 'strategy': 'breakout', 'time_stop': 167, 'use_sma': True, 'use_atr': False, 'use_adx': False, 'use_ema': True, 'use_spike': False, 'rsi_required': False, 'edge_k': 1.0383721270588981, 'edge_cap': 0.6622478255288369, 'bull_strategy': 'mean_reversion', 'bull_bb_std_mult': 2.9498798930038634, 'bull_rsi_os': 9, 'bull_rsi_ob': 74, 'bull_adx_thresh': 14.800422710001111, 'bull_atr_min_pct': 0.016869087728189763, 'bull_atr_max_pct': 0.0869733314637424, 'bull_tp_mult': 2.6893545863067265, 'bull_tsl_mult': 0.8550200685552058, 'bull_time_stop': 12, 'bull_use_sma': True, 'bull_use_ema': False, 'bull_use_atr': True, 'bull_use_adx': False, 'bull_use_spike': True, 'bull_rsi_required': False, 'bear_strategy': 'mean_reversion', 'bear_bb_std_mult': 2.7686936270426044, 'bear_rsi_os': 39, 'bear_rsi_ob': 67, 'bear_adx_thresh': 20.898381854828866, 'bear_atr_min_pct': 0.014375320423304484, 'bear_atr_max_pct': 0.04704838526779446, 'bear_tp_mult': 2.649735601250544, 'bear_tsl_mult': 0.9864392280384854, 'bear_time_stop': 48, 'bear_use_sma': False, 'bear_use_ema': True, 'bear_use_atr': False, 'bear_use_adx': True, 'bear_use_spike': True, 'bear_rsi_required': True, 'sideways_strategy': 'breakout', 'sideways_bb_std_mult': 2.3660865602747196, 'sideways_rsi_os': 47, 'sideways_rsi_ob': 77, 'sideways_adx_thresh': 31.974153908265468, 'sideways_atr_min_pct': 0.011327216515403764, 'sideways_atr_max_pct': 0.027664344314440967, 'sideways_tp_mult': 1.0435968623023957, 'sideways_tsl_mult': 0.7463727200599797, 'sideways_time_stop': 191, 'sideways_use_sma': True, 'sideways_use_ema': False, 'sideways_use_atr': False, 'sideways_use_adx': True, 'sideways_use_spike': False, 'sideways_rsi_required': False}.
