[I 2025-08-29 21:04:18,001] Trial 756 finished with values: [0.0005429665594443023, 0.0017313362857371442] and parameters: {'p_sma': 17, 'p_std': 29, 'p_atr': 16, 'p_adx': 8, 'rsi_period': 35, 'ema1': 23, 'ema2': 22, 'slip_atr_k': 7.672220399644212e-05, 'slip_spread_k': 0.1361208261750778, 'spread_hl_frac': 0.017755331068325577, 'bb_std_mult': 0.9134044998149449, 'rsi_os': 6, 'rsi_ob': 81, 'vol_spike': 0.29554746762682665, 'adx_thresh': 10.894708340171647, 'atr_min_pct': 0.01022008917434533, 'atr_max_pct': 0.0401788579650007, 'tp_mult': 2.4858194124042168, 'tsl_mult': 0.8290901634198079, 'strategy': 'mean_reversion', 'time_stop': 206, 'use_sma': True, 'use_atr': False, 'use_adx': False, 'use_ema': False, 'use_spike': True, 'rsi_required': False, 'edge_k': 0.9319630234442912, 'edge_cap': 0.2996806785161393, 'bull_strategy': 'mean_reversion', 'bull_bb_std_mult': 2.3150057263719765, 'bull_rsi_os': 21, 'bull_rsi_ob': 70, 'bull_adx_thresh': 28.528585580116292, 'bull_atr_min_pct': 0.016856350149130686, 'bull_atr_max_pct': 0.09331337205228829, 'bull_tp_mult': 2.5076345168841274, 'bull_tsl_mult': 0.8688735569982035, 'bull_time_stop': 191, 'bull_use_sma': True, 'bull_use_ema': False, 'bull_use_atr': False, 'bull_use_adx': True, 'bull_use_spike': True, 'bull_rsi_required': False, 'bear_strategy': 'breakout', 'bear_bb_std_mult': 2.0526735798795186, 'bear_rsi_os': 40, 'bear_rsi_ob': 87, 'bear_adx_thresh': 19.277619731512917, 'bear_atr_min_pct': 0.005960950023244813, 'bear_atr_max_pct': 0.06311519668624782, 'bear_tp_mult': 2.848214022754971, 'bear_tsl_mult': 0.06320946813865266, 'bear_time_stop': 284, 'bear_use_sma': False, 'bear_use_ema': False, 'bear_use_atr': False, 'bear_use_adx': False, 'bear_use_spike': True, 'bear_rsi_required': False, 'sideways_strategy': 'breakout', 'sideways_bb_std_mult': 3.561365824658294, 'sideways_rsi_os': 25, 'sideways_rsi_ob': 82, 'sideways_adx_thresh': 13.790933241752096, 'sideways_atr_min_pct': 0.012847969544862562, 'sideways_atr_max_pct': 0.030926135423405696, 'sideways_tp_mult': 2.5004738811656004, 'sideways_tsl_mult': 0.617945507938809, 'sideways_time_stop': 143, 'sideways_use_sma': False, 'sideways_use_ema': False, 'sideways_use_atr': True, 'sideways_use_adx': False, 'sideways_use_spike': False, 'sideways_rsi_required': True}.
[I 2025-08-29 21:04:18,020] Trial 757 finished with values: [-0.014101453602079483, 0.014562716117115414] and parameters: {'p_sma': 18, 'p_std': 29, 'p_atr': 16, 'p_adx': 8, 'rsi_period': 35, 'ema1': 23, 'ema2': 22, 'slip_atr_k': 0.012396657576463783, 'slip_spread_k': 0.13891772046049009, 'spread_hl_frac': 0.017602381327180186, 'bb_std_mult': 1.0743143988574815, 'rsi_os': 6, 'rsi_ob': 81, 'vol_spike': 0.2800371776588451, 'adx_thresh': 10.889420620117468, 'atr_min_pct': 0.010507506862919977, 'atr_max_pct': 0.031216029097891736, 'tp_mult': 2.675344460083383, 'tsl_mult': 0.8344665919560836, 'strategy': 'mean_reversion', 'time_stop': 210, 'use_sma': True, 'use_atr': False, 'use_adx': False, 'use_ema': False, 'use_spike': True, 'rsi_required': False, 'edge_k': 0.9688854998480618, 'edge_cap': 0.3047405240411456, 'bull_strategy': 'mean_reversion', 'bull_bb_std_mult': 2.3049205846942353, 'bull_rsi_os': 21, 'bull_rsi_ob': 70, 'bull_adx_thresh': 28.75688469525331, 'bull_atr_min_pct': 0.01661855128583833, 'bull_atr_max_pct': 0.09202968902662283, 'bull_tp_mult': 2.592306144131799, 'bull_tsl_mult': 0.2324308736854343, 'bull_time_stop': 190, 'bull_use_sma': True, 'bull_use_ema': False, 'bull_use_atr': False, 'bull_use_adx': True, 'bull_use_spike': True, 'bull_rsi_required': False, 'bear_strategy': 'breakout', 'bear_bb_std_mult': 2.115296947151169, 'bear_rsi_os': 40, 'bear_rsi_ob': 88, 'bear_adx_thresh': 21.49650809139543, 'bear_atr_min_pct': 0.00324381114380672, 'bear_atr_max_pct': 0.0640586670573503, 'bear_tp_mult': 2.8684396236640257, 'bear_tsl_mult': 0.06001959016400077, 'bear_time_stop': 267, 'bear_use_sma': False, 'bear_use_ema': False, 'bear_use_atr': False, 'bear_use_adx': False, 'bear_use_spike': True, 'bear_rsi_required': False, 'sideways_strategy': 'breakout', 'sideways_bb_std_mult': 3.5524226574101334, 'sideways_rsi_os': 25, 'sideways_rsi_ob': 82, 'sideways_adx_thresh': 14.304903409831523, 'sideways_atr_min_pct': 0.013314615238518934, 'sideways_atr_max_pct': 0.03752828661693483, 'sideways_tp_mult': 2.4652559424658578, 'sideways_tsl_mult': 0.6097300807419769, 'sideways_time_stop': 142, 'sideways_use_sma': False, 'sideways_use_ema': False, 'sideways_use_atr': True, 'sideways_use_adx': False, 'sideways_use_spike': False, 'sideways_rsi_required': True}.
[I 2025-08-29 21:04:18,168] Trial 758 finished with values: [0.0024964087874821406, 0.0008042167617764919] and parameters: {'p_sma': 17, 'p_std': 32, 'p_atr': 16, 'p_adx': 8, 'rsi_period': 32, 'ema1': 23, 'ema2': 22, 'slip_atr_k': 0.0005000780511397934, 'slip_spread_k': 0.09578042793237279, 'spread_hl_frac': 0.021028875727610655, 'bb_std_mult': 0.9427620524429802, 'rsi_os': 6, 'rsi_ob': 78, 'vol_spike': 0.29956577718247507, 'adx_thresh': 8.97003126702205, 'atr_min_pct': 0.010579525406606704, 'atr_max_pct': 0.03504383573624845, 'tp_mult': 2.473665305316271, 'tsl_mult': 0.7759628435416082, 'strategy': 'mean_reversion', 'time_stop': 204, 'use_sma': True, 'use_atr': False, 'use_adx': False, 'use_ema': False, 'use_spike': True, 'rsi_required': False, 'edge_k': 0.9913898206024899, 'edge_cap': 0.31604010623568074, 'bull_strategy': 'mean_reversion', 'bull_bb_std_mult': 2.7174621987177967, 'bull_rsi_os': 21, 'bull_rsi_ob': 70, 'bull_adx_thresh': 28.69684004908594, 'bull_atr_min_pct': 0.01857664940292643, 'bull_atr_max_pct': 0.10381440766484869, 'bull_tp_mult': 2.4332436090760394, 'bull_tsl_mult': 0.936426279780775, 'bull_time_stop': 213, 'bull_use_sma': True, 'bull_use_ema': False, 'bull_use_atr': False, 'bull_use_adx': True, 'bull_use_spike': True, 'bull_rsi_required': False, 'bear_strategy': 'breakout', 'bear_bb_std_mult': 2.2770641735579966, 'bear_rsi_os': 41, 'bear_rsi_ob': 88, 'bear_adx_thresh': 18.49913935001923, 'bear_atr_min_pct': 0.00675333577767304, 'bear_atr_max_pct': 0.08107848705573172, 'bear_tp_mult': 2.9101352612165514, 'bear_tsl_mult': 0.04155896542006692, 'bear_time_stop': 267, 'bear_use_sma': False, 'bear_use_ema': False, 'bear_use_atr': False, 'bear_use_adx': False, 'bear_use_spike': True, 'bear_rsi_required': False, 'sideways_strategy': 'breakout', 'sideways_bb_std_mult': 3.439840450687708, 'sideways_rsi_os': 22, 'sideways_rsi_ob': 83, 'sideways_adx_thresh': 13.417839697388606, 'sideways_atr_min_pct': 0.013116106861678292, 'sideways_atr_max_pct': 0.03517335574989291, 'sideways_tp_mult': 2.3776504309338824, 'sideways_tsl_mult': 0.6267468709479783, 'sideways_time_stop': 142, 'sideways_use_sma': False, 'sideways_use_ema': False, 'sideways_use_atr': True, 'sideways_use_adx': False, 'sideways_use_spike': False, 'sideways_rsi_required': True}.
[I 2025-08-29 21:04:18,293] Trial 759 finished with values: [0.0008961543174541564, 0.0012293364398303938] and parameters: {'p_sma': 14, 'p_std': 32, 'p_atr': 16, 'p_adx': 8, 'rsi_period': 31, 'ema1': 23, 'ema2': 24, 'slip_atr_k': 0.012301154651510892, 'slip_spread_k': 0.0727849685808421, 'spread_hl_frac': 0.021217672403062982, 'bb_std_mult': 0.9301423647258643, 'rsi_os': 6, 'rsi_ob': 78, 'vol_spike': 0.2960565855229131, 'adx_thresh': 9.183660241217147, 'atr_min_pct': 0.01062571619937809, 'atr_max_pct': 0.03446741966184965, 'tp_mult': 2.5193727068396776, 'tsl_mult': 0.8093538625848585, 'strategy': 'mean_reversion', 'time_stop': 207, 'use_sma': True, 'use_atr': False, 'use_adx': False, 'use_ema': False, 'use_spike': True, 'rsi_required': False, 'edge_k': 0.9781571497537459, 'edge_cap': 0.30036003587725685, 'bull_strategy': 'mean_reversion', 'bull_bb_std_mult': 2.7057213881346565, 'bull_rsi_os': 21, 'bull_rsi_ob': 70, 'bull_adx_thresh': 28.70937873175458, 'bull_atr_min_pct': 0.018352031215501913, 'bull_atr_max_pct': 0.105043589589267, 'bull_tp_mult': 2.4079798217645796, 'bull_tsl_mult': 0.9302726482554042, 'bull_time_stop': 212, 'bull_use_sma': True, 'bull_use_ema': False, 'bull_use_atr': False, 'bull_use_adx': True, 'bull_use_spike': True, 'bull_rsi_required': False, 'bear_strategy': 'breakout', 'bear_bb_std_mult': 2.0402754109728414, 'bear_rsi_os': 41, 'bear_rsi_ob': 88, 'bear_adx_thresh': 18.16174729267876, 'bear_atr_min_pct': 0.006373575374194077, 'bear_atr_max_pct': 0.0765700042689282, 'bear_tp_mult': 2.8873235703996274, 'bear_tsl_mult': 0.04071112939018426, 'bear_time_stop': 267, 'bear_use_sma': False, 'bear_use_ema': False, 'bear_use_atr': False, 'bear_use_adx': False, 'bear_use_spike': True, 'bear_rsi_required': False, 'sideways_strategy': 'breakout', 'sideways_bb_std_mult': 3.446753092771161, 'sideways_rsi_os': 22, 'sideways_rsi_ob': 83, 'sideways_adx_thresh': 13.783012253364001, 'sideways_atr_min_pct': 0.01312228648259579, 'sideways_atr_max_pct': 0.03483511825794017, 'sideways_tp_mult': 2.399719891370134, 'sideways_tsl_mult': 0.6140212608660408, 'sideways_time_stop': 146, 'sideways_use_sma': False, 'sideways_use_ema': False, 'sideways_use_atr': True, 'sideways_use_adx': False, 'sideways_use_spike': False, 'sideways_rsi_required': True}.
[I 2025-08-29 21:04:47,013] Trial 760 finished with values: [0.0023791887728015215, 0.0008149074672800581] and parameters: {'p_sma': 17, 'p_std': 32, 'p_atr': 16, 'p_adx': 8, 'rsi_period': 31, 'ema1': 22, 'ema2': 25, 'slip_atr_k': 5.84863965217054e-05, 'slip_spread_k': 0.0901639464046983, 'spread_hl_frac': 0.021628680873956873, 'bb_std_mult': 0.9058703637173703, 'rsi_os': 6, 'rsi_ob': 78, 'vol_spike': 0.29558392844020553, 'adx_thresh': 8.651021964949102, 'atr_min_pct': 0.010739598006743614, 'atr_max_pct': 0.03470437289496234, 'tp_mult': 2.495178167520449, 'tsl_mult': 0.7980841979456984, 'strategy': 'mean_reversion', 'time_stop': 203, 'use_sma': True, 'use_atr': False, 'use_adx': False, 'use_ema': False, 'use_spike': True, 'rsi_required': False, 'edge_k': 0.9932849611006616, 'edge_cap': 0.3025033266304167, 'bull_strategy': 'mean_reversion', 'bull_bb_std_mult': 2.6991484840782296, 'bull_rsi_os': 21, 'bull_rsi_ob': 67, 'bull_adx_thresh': 28.599944401569818, 'bull_atr_min_pct': 0.017474980848772564, 'bull_atr_max_pct': 0.10490029624684516, 'bull_tp_mult': 2.4721518111208463, 'bull_tsl_mult': 0.9309332600521308, 'bull_time_stop': 213, 'bull_use_sma': True, 'bull_use_ema': False, 'bull_use_atr': False, 'bull_use_adx': True, 'bull_use_spike': True, 'bull_rsi_required': False, 'bear_strategy': 'breakout', 'bear_bb_std_mult': 2.293118317634239, 'bear_rsi_os': 41, 'bear_rsi_ob': 87, 'bear_adx_thresh': 18.612656294900525, 'bear_atr_min_pct': 0.006582893832563295, 'bear_atr_max_pct': 0.07544365852877664, 'bear_tp_mult': 2.9141958006312842, 'bear_tsl_mult': 0.046287937380894206, 'bear_time_stop': 291, 'bear_use_sma': False, 'bear_use_ema': False, 'bear_use_atr': False, 'bear_use_adx': False, 'bear_use_spike': True, 'bear_rsi_required': False, 'sideways_strategy': 'breakout', 'sideways_bb_std_mult': 3.431932759881837, 'sideways_rsi_os': 22, 'sideways_rsi_ob': 82, 'sideways_adx_thresh': 13.634825517892722, 'sideways_atr_min_pct': 0.012904917027440071, 'sideways_atr_max_pct': 0.03697919983519517, 'sideways_tp_mult': 2.3654376387835687, 'sideways_tsl_mult': 0.6126121589371253, 'sideways_time_stop': 127, 'sideways_use_sma': False, 'sideways_use_ema': False, 'sideways_use_atr': True, 'sideways_use_adx': False, 'sideways_use_spike': False, 'sideways_rsi_required': True}.
[I 2025-08-29 21:04:47,227] Trial 763 finished with values: [-1000000000.0, 1000000000.0] and parameters: {'p_sma': 15, 'p_std': 33, 'p_atr': 16, 'p_adx': 8, 'rsi_period': 29, 'ema1': 22, 'ema2': 25, 'slip_atr_k': 0.0002154914222257387, 'slip_spread_k': 0.06914698862795092, 'spread_hl_frac': 0.02141707547147296, 'bb_std_mult': 0.8315144366188186, 'rsi_os': 6, 'rsi_ob': 76, 'vol_spike': 0.29912604278669386, 'adx_thresh': 8.994259439706681, 'atr_min_pct': 0.010830581610357225, 'atr_max_pct': 0.04119523781129324, 'tp_mult': 2.454358144796988, 'tsl_mult': 0.7459783168040843, 'strategy': 'mean_reversion', 'time_stop': 198, 'use_sma': True, 'use_atr': False, 'use_adx': False, 'use_ema': False, 'use_spike': True, 'rsi_required': False, 'edge_k': 0.9284719798582678, 'edge_cap': 0.33485509758207843, 'bull_strategy': 'mean_reversion', 'bull_bb_std_mult': 2.703392404203486, 'bull_rsi_os': 23, 'bull_rsi_ob': 67, 'bull_adx_thresh': 28.390840712801182, 'bull_atr_min_pct': 0.01966835947332422, 'bull_atr_max_pct': 0.10639897416476601, 'bull_tp_mult': 2.4222095743623977, 'bull_tsl_mult': 0.9757313508477589, 'bull_time_stop': 213, 'bull_use_sma': True, 'bull_use_ema': False, 'bull_use_atr': False, 'bull_use_adx': True, 'bull_use_spike': True, 'bull_rsi_required': False, 'bear_strategy': 'breakout', 'bear_bb_std_mult': 2.3117667838510276, 'bear_rsi_os': 42, 'bear_rsi_ob': 89, 'bear_adx_thresh': 17.567037467979315, 'bear_atr_min_pct': 0.008698336694437345, 'bear_atr_max_pct': 0.08202189676079664, 'bear_tp_mult': 2.93446064733833, 'bear_tsl_mult': 0.027480343853689367, 'bear_time_stop': 263, 'bear_use_sma': False, 'bear_use_ema': False, 'bear_use_atr': False, 'bear_use_adx': False, 'bear_use_spike': True, 'bear_rsi_required': False, 'sideways_strategy': 'breakout', 'sideways_bb_std_mult': 3.4201105695047636, 'sideways_rsi_os': 22, 'sideways_rsi_ob': 85, 'sideways_adx_thresh': 13.121634858402706, 'sideways_atr_min_pct': 0.012739102212061232, 'sideways_atr_max_pct': 0.03855587920429001, 'sideways_tp_mult': 2.360882714775857, 'sideways_tsl_mult': 0.5941855956680856, 'sideways_time_stop': 148, 'sideways_use_sma': False, 'sideways_use_ema': False, 'sideways_use_atr': True, 'sideways_use_adx': False, 'sideways_use_spike': False, 'sideways_rsi_required': True}.
[I 2025-08-29 21:04:47,354] Trial 761 finished with values: [-1000000000.0, 1000000000.0] and parameters: {'p_sma': 15, 'p_std': 32, 'p_atr': 16, 'p_adx': 8, 'rsi_period': 34, 'ema1': 22, 'ema2': 25, 'slip_atr_k': 0.009374632794646353, 'slip_spread_k': 0.0916050153295973, 'spread_hl_frac': 0.021107955765336354, 'bb_std_mult': 0.9272738216797427, 'rsi_os': 6, 'rsi_ob': 78, 'vol_spike': 0.29475981353314173, 'adx_thresh': 9.212372806905432, 'atr_min_pct': 0.01084392248616422, 'atr_max_pct': 0.033947313950358805, 'tp_mult': 2.479974171228426, 'tsl_mult': 0.7847594778881039, 'strategy': 'mean_reversion', 'time_stop': 204, 'use_sma': True, 'use_atr': False, 'use_adx': False, 'use_ema': False, 'use_spike': True, 'rsi_required': False, 'edge_k': 0.9987365535705307, 'edge_cap': 0.2888347171840767, 'bull_strategy': 'mean_reversion', 'bull_bb_std_mult': 2.641237351785819, 'bull_rsi_os': 21, 'bull_rsi_ob': 70, 'bull_adx_thresh': 28.67036516884408, 'bull_atr_min_pct': 0.017443931347291358, 'bull_atr_max_pct': 0.10446365834026265, 'bull_tp_mult': 2.426113197699987, 'bull_tsl_mult': 0.9304433773529689, 'bull_time_stop': 211, 'bull_use_sma': True, 'bull_use_ema': False, 'bull_use_atr': False, 'bull_use_adx': True, 'bull_use_spike': True, 'bull_rsi_required': False, 'bear_strategy': 'breakout', 'bear_bb_std_mult': 2.3114899860436857, 'bear_rsi_os': 41, 'bear_rsi_ob': 87, 'bear_adx_thresh': 18.578480465290532, 'bear_atr_min_pct': 0.006595872695350932, 'bear_atr_max_pct': 0.07438286843310375, 'bear_tp_mult': 2.9062597726587462, 'bear_tsl_mult': 0.04214034734444777, 'bear_time_stop': 267, 'bear_use_sma': False, 'bear_use_ema': False, 'bear_use_atr': False, 'bear_use_adx': False, 'bear_use_spike': True, 'bear_rsi_required': False, 'sideways_strategy': 'breakout', 'sideways_bb_std_mult': 3.4696884988761343, 'sideways_rsi_os': 22, 'sideways_rsi_ob': 83, 'sideways_adx_thresh': 13.599250548445232, 'sideways_atr_min_pct': 0.012988257472885187, 'sideways_atr_max_pct': 0.03664358012169411, 'sideways_tp_mult': 2.360927020510851, 'sideways_tsl_mult': 0.6209555578362297, 'sideways_time_stop': 144, 'sideways_use_sma': False, 'sideways_use_ema': False, 'sideways_use_atr': True, 'sideways_use_adx': False, 'sideways_use_spike': False, 'sideways_rsi_required': True}.
[I 2025-08-29 21:04:47,451] Trial 762 finished with values: [-1000000000.0, 1000000000.0] and parameters: {'p_sma': 14, 'p_std': 32, 'p_atr': 16, 'p_adx': 8, 'rsi_period': 30, 'ema1': 22, 'ema2': 21, 'slip_atr_k': 0.012331966421439907, 'slip_spread_k': 0.06938803613998734, 'spread_hl_frac': 0.022554641400821245, 'bb_std_mult': 0.9008765700498508, 'rsi_os': 6, 'rsi_ob': 76, 'vol_spike': 0.29980972587012306, 'adx_thresh': 8.998641427586684, 'atr_min_pct': 0.010962568143544234, 'atr_max_pct': 0.0404164111160383, 'tp_mult': 2.4557983544341657, 'tsl_mult': 0.7764175624303117, 'strategy': 'mean_reversion', 'time_stop': 199, 'use_sma': True, 'use_atr': False, 'use_adx': False, 'use_ema': False, 'use_spike': True, 'rsi_required': False, 'edge_k': 0.8940485344332854, 'edge_cap': 0.3363933988719853, 'bull_strategy': 'mean_reversion', 'bull_bb_std_mult': 2.724708977308102, 'bull_rsi_os': 22, 'bull_rsi_ob': 67, 'bull_adx_thresh': 28.388086233259294, 'bull_atr_min_pct': 0.019132745220990014, 'bull_atr_max_pct': 0.11464071956235444, 'bull_tp_mult': 2.4679080995040956, 'bull_tsl_mult': 0.9611920903037008, 'bull_time_stop': 214, 'bull_use_sma': True, 'bull_use_ema': False, 'bull_use_atr': False, 'bull_use_adx': True, 'bull_use_spike': True, 'bull_rsi_required': False, 'bear_strategy': 'breakout', 'bear_bb_std_mult': 2.3007131614116916, 'bear_rsi_os': 42, 'bear_rsi_ob': 89, 'bear_adx_thresh': 18.178426564863784, 'bear_atr_min_pct': 0.007823700054576268, 'bear_atr_max_pct': 0.08180108905795724, 'bear_tp_mult': 2.924867811770426, 'bear_tsl_mult': 0.023665029466861897, 'bear_time_stop': 262, 'bear_use_sma': False, 'bear_use_ema': False, 'bear_use_atr': False, 'bear_use_adx': False, 'bear_use_spike': True, 'bear_rsi_required': False, 'sideways_strategy': 'breakout', 'sideways_bb_std_mult': 3.407258121148416, 'sideways_rsi_os': 22, 'sideways_rsi_ob': 84, 'sideways_adx_thresh': 13.01395932585638, 'sideways_atr_min_pct': 0.01290785381397968, 'sideways_atr_max_pct': 0.03876948732884936, 'sideways_tp_mult': 2.3631561985429657, 'sideways_tsl_mult': 0.6004268262358344, 'sideways_time_stop': 147, 'sideways_use_sma': False, 'sideways_use_ema': False, 'sideways_use_atr': True, 'sideways_use_adx': False, 'sideways_use_spike': False, 'sideways_rsi_required': True}.
[I 2025-08-29 21:05:16,376] Trial 766 finished with values: [-1000000000.0, 1000000000.0] and parameters: {'p_sma': 14, 'p_std': 33, 'p_atr': 16, 'p_adx': 9, 'rsi_period': 31, 'ema1': 23, 'ema2': 21, 'slip_atr_k': 7.4282805144592874e-06, 'slip_spread_k': 0.06883906741330793, 'spread_hl_frac': 0.022235203704074044, 'bb_std_mult': 0.8668140722768521, 'rsi_os': 6, 'rsi_ob': 77, 'vol_spike': 0.29954572029280174, 'adx_thresh': 8.511582044886467, 'atr_min_pct': 0.010208955212625844, 'atr_max_pct': 0.039554380444221326, 'tp_mult': 2.4853789527568604, 'tsl_mult': 0.7626769452362233, 'strategy': 'mean_reversion', 'time_stop': 200, 'use_sma': True, 'use_atr': False, 'use_adx': False, 'use_ema': False, 'use_spike': True, 'rsi_required': False, 'edge_k': 0.9157190581866956, 'edge_cap': 0.3442666035028727, 'bull_strategy': 'mean_reversion', 'bull_bb_std_mult': 2.723011951117393, 'bull_rsi_os': 22, 'bull_rsi_ob': 67, 'bull_adx_thresh': 28.06341312694505, 'bull_atr_min_pct': 0.018932229643550583, 'bull_atr_max_pct': 0.1087860725677457, 'bull_tp_mult': 2.460003156820006, 'bull_tsl_mult': 0.97978153273553, 'bull_time_stop': 218, 'bull_use_sma': True, 'bull_use_ema': False, 'bull_use_atr': False, 'bull_use_adx': True, 'bull_use_spike': True, 'bull_rsi_required': False, 'bear_strategy': 'breakout', 'bear_bb_std_mult': 2.3525363681385305, 'bear_rsi_os': 41, 'bear_rsi_ob': 89, 'bear_adx_thresh': 18.07879702975633, 'bear_atr_min_pct': 0.007970487016844476, 'bear_atr_max_pct': 0.0820355408129281, 'bear_tp_mult': 2.9083678454379664, 'bear_tsl_mult': 0.011999725241872806, 'bear_time_stop': 257, 'bear_use_sma': False, 'bear_use_ema': False, 'bear_use_atr': False, 'bear_use_adx': False, 'bear_use_spike': True, 'bear_rsi_required': False, 'sideways_strategy': 'breakout', 'sideways_bb_std_mult': 3.3674907372175116, 'sideways_rsi_os': 22, 'sideways_rsi_ob': 84, 'sideways_adx_thresh': 12.757168148024007, 'sideways_atr_min_pct': 0.012222386262032758, 'sideways_atr_max_pct': 0.04132948141142091, 'sideways_tp_mult': 2.3273206814916003, 'sideways_tsl_mult': 0.6186020969924277, 'sideways_time_stop': 149, 'sideways_use_sma': False, 'sideways_use_ema': False, 'sideways_use_atr': True, 'sideways_use_adx': False, 'sideways_use_spike': False, 'sideways_rsi_required': True}.
