[I 2025-08-29 20:36:43,533] Trial 513 finished with values: [-1000000000.0, 1000000000.0] and parameters: {'p_sma': 21, 'p_std': 56, 'p_atr': 25, 'p_adx': 22, 'rsi_period': 61, 'ema1': 25, 'ema2': 22, 'slip_atr_k': 0.0002545472199997475, 'slip_spread_k': 0.1650805196074842, 'spread_hl_frac': 0.02626436743640041, 'bb_std_mult': 1.9081906912410749, 'rsi_os': 10, 'rsi_ob': 93, 'vol_spike': 0.24028647525501784, 'adx_thresh': 27.832967981212125, 'atr_min_pct': 0.018893099900431837, 'atr_max_pct': 0.02864913918225368, 'tp_mult': 1.2490255204146277, 'tsl_mult': 0.9549257249188842, 'strategy': 'breakout', 'time_stop': 146, 'use_sma': True, 'use_atr': False, 'use_adx': True, 'use_ema': True, 'use_spike': True, 'rsi_required': False, 'edge_k': 0.9960308543851367, 'edge_cap': 0.6195246208864736, 'bull_strategy': 'mean_reversion', 'bull_bb_std_mult': 3.213501595128088, 'bull_rsi_os': 23, 'bull_rsi_ob': 54, 'bull_adx_thresh': 14.098768527923117, 'bull_atr_min_pct': 0.016748811654636105, 'bull_atr_max_pct': 0.08243704928581255, 'bull_tp_mult': 2.862907552844002, 'bull_tsl_mult': 0.9102888008341434, 'bull_time_stop': 35, 'bull_use_sma': True, 'bull_use_ema': False, 'bull_use_atr': True, 'bull_use_adx': False, 'bull_use_spike': True, 'bull_rsi_required': False, 'bear_strategy': 'mean_reversion', 'bear_bb_std_mult': 2.799226611896846, 'bear_rsi_os': 42, 'bear_rsi_ob': 69, 'bear_adx_thresh': 22.573977686316614, 'bear_atr_min_pct': 0.006378721074299795, 'bear_atr_max_pct': 0.13888527080082685, 'bear_tp_mult': 2.6149971182112846, 'bear_tsl_mult': 0.9359604268634546, 'bear_time_stop': 46, 'bear_use_sma': False, 'bear_use_ema': False, 'bear_use_atr': False, 'bear_use_adx': True, 'bear_use_spike': True, 'bear_rsi_required': True, 'sideways_strategy': 'breakout', 'sideways_bb_std_mult': 2.6199735369176924, 'sideways_rsi_os': 47, 'sideways_rsi_ob': 79, 'sideways_adx_thresh': 32.46506560324623, 'sideways_atr_min_pct': 0.02082519286500149, 'sideways_atr_max_pct': 0.07802803239637006, 'sideways_tp_mult': 1.049291117919454, 'sideways_tsl_mult': 0.416710265522379, 'sideways_time_stop': 127, 'sideways_use_sma': True, 'sideways_use_ema': False, 'sideways_use_atr': False, 'sideways_use_adx': True, 'sideways_use_spike': False, 'sideways_rsi_required': True}.
[I 2025-08-29 20:37:13,652] Trial 514 finished with values: [-0.00648411147361605, 0.00662013690836535] and parameters: {'p_sma': 20, 'p_std': 17, 'p_atr': 29, 'p_adx': 27, 'rsi_period': 38, 'ema1': 25, 'ema2': 57, 'slip_atr_k': 0.10381184381205993, 'slip_spread_k': 0.5851638015502043, 'spread_hl_frac': 0.03159988975923969, 'bb_std_mult': 1.9232550875150172, 'rsi_os': 10, 'rsi_ob': 83, 'vol_spike': 0.09776737415486056, 'adx_thresh': 12.743007375580873, 'atr_min_pct': 0.018890736760271195, 'atr_max_pct': 0.028374356617334045, 'tp_mult': 1.2982666504911986, 'tsl_mult': 0.9664456004576293, 'strategy': 'breakout', 'time_stop': 158, 'use_sma': True, 'use_atr': False, 'use_adx': True, 'use_ema': True, 'use_spike': False, 'rsi_required': False, 'edge_k': 0.9494518767700743, 'edge_cap': 0.6169470834046041, 'bull_strategy': 'mean_reversion', 'bull_bb_std_mult': 3.074578835050991, 'bull_rsi_os': 24, 'bull_rsi_ob': 47, 'bull_adx_thresh': 13.604434634410069, 'bull_atr_min_pct': 0.01679768395458211, 'bull_atr_max_pct': 0.14993635565645091, 'bull_tp_mult': 2.75957648099451, 'bull_tsl_mult': 0.793321771484321, 'bull_time_stop': 35, 'bull_use_sma': True, 'bull_use_ema': False, 'bull_use_atr': True, 'bull_use_adx': False, 'bull_use_spike': True, 'bull_rsi_required': False, 'bear_strategy': 'breakout', 'bear_bb_std_mult': 2.7959494562359026, 'bear_rsi_os': 53, 'bear_rsi_ob': 66, 'bear_adx_thresh': 22.33140095570904, 'bear_atr_min_pct': 0.006621183807827196, 'bear_atr_max_pct': 0.139422622222318, 'bear_tp_mult': 1.4988217924870337, 'bear_tsl_mult': 0.17565309287694542, 'bear_time_stop': 45, 'bear_use_sma': False, 'bear_use_ema': False, 'bear_use_atr': False, 'bear_use_adx': True, 'bear_use_spike': True, 'bear_rsi_required': True, 'sideways_strategy': 'breakout', 'sideways_bb_std_mult': 1.5897597543361415, 'sideways_rsi_os': 47, 'sideways_rsi_ob': 79, 'sideways_adx_thresh': 6.611622022478581, 'sideways_atr_min_pct': 0.004299185929771858, 'sideways_atr_max_pct': 0.07669667301277512, 'sideways_tp_mult': 1.048358720105698, 'sideways_tsl_mult': 0.6972241067716279, 'sideways_time_stop': 70, 'sideways_use_sma': False, 'sideways_use_ema': False, 'sideways_use_atr': False, 'sideways_use_adx': True, 'sideways_use_spike': False, 'sideways_rsi_required': True}.
[I 2025-08-29 20:37:14,215] Trial 515 finished with values: [-1000000000.0, 1000000000.0] and parameters: {'p_sma': 20, 'p_std': 18, 'p_atr': 25, 'p_adx': 27, 'rsi_period': 38, 'ema1': 25, 'ema2': 46, 'slip_atr_k': 0.00011081855654546298, 'slip_spread_k': 0.5877270770049605, 'spread_hl_frac': 0.0312408178876104, 'bb_std_mult': 1.5151244994824047, 'rsi_os': 44, 'rsi_ob': 83, 'vol_spike': 0.2570494616929781, 'adx_thresh': 13.505751648481775, 'atr_min_pct': 0.0191407832540057, 'atr_max_pct': 0.028576076843274605, 'tp_mult': 1.259729404196134, 'tsl_mult': 0.8166445259120412, 'strategy': 'breakout', 'time_stop': 144, 'use_sma': False, 'use_atr': False, 'use_adx': True, 'use_ema': True, 'use_spike': False, 'rsi_required': False, 'edge_k': 0.15903388996509393, 'edge_cap': 0.8693140704023439, 'bull_strategy': 'breakout', 'bull_bb_std_mult': 3.0547675397683904, 'bull_rsi_os': 17, 'bull_rsi_ob': 64, 'bull_adx_thresh': 15.688084920997486, 'bull_atr_min_pct': 0.0113573722094483, 'bull_atr_max_pct': 0.14019631810788058, 'bull_tp_mult': 2.8812365409250713, 'bull_tsl_mult': 0.8635250131541592, 'bull_time_stop': 35, 'bull_use_sma': False, 'bull_use_ema': False, 'bull_use_atr': True, 'bull_use_adx': False, 'bull_use_spike': True, 'bull_rsi_required': False, 'bear_strategy': 'breakout', 'bear_bb_std_mult': 2.7726877401284464, 'bear_rsi_os': 15, 'bear_rsi_ob': 66, 'bear_adx_thresh': 22.613405537697513, 'bear_atr_min_pct': 0.0026869829523199183, 'bear_atr_max_pct': 0.13971492951836023, 'bear_tp_mult': 2.5252488865612026, 'bear_tsl_mult': 0.01746782728783658, 'bear_time_stop': 48, 'bear_use_sma': False, 'bear_use_ema': False, 'bear_use_atr': False, 'bear_use_adx': True, 'bear_use_spike': False, 'bear_rsi_required': True, 'sideways_strategy': 'breakout', 'sideways_bb_std_mult': 1.57450670131431, 'sideways_rsi_os': 45, 'sideways_rsi_ob': 79, 'sideways_adx_thresh': 32.509117340613685, 'sideways_atr_min_pct': 0.006249720018168096, 'sideways_atr_max_pct': 0.02406311788122476, 'sideways_tp_mult': 2.2860694837074154, 'sideways_tsl_mult': 0.7565673646117531, 'sideways_time_stop': 185, 'sideways_use_sma': False, 'sideways_use_ema': False, 'sideways_use_atr': False, 'sideways_use_adx': True, 'sideways_use_spike': True, 'sideways_rsi_required': True}.
[I 2025-08-29 20:37:15,089] Trial 517 finished with values: [-1000000000.0, 1000000000.0] and parameters: {'p_sma': 19, 'p_std': 60, 'p_atr': 14, 'p_adx': 13, 'rsi_period': 57, 'ema1': 25, 'ema2': 48, 'slip_atr_k': 0.01584940775455013, 'slip_spread_k': 0.21105255578826312, 'spread_hl_frac': 0.04899586849386569, 'bb_std_mult': 1.7636380396610807, 'rsi_os': 45, 'rsi_ob': 86, 'vol_spike': 0.1698551555651221, 'adx_thresh': 9.670245172451708, 'atr_min_pct': 0.004089156839797943, 'atr_max_pct': 0.07936839738165738, 'tp_mult': 1.3185015531053936, 'tsl_mult': 0.8017536256676151, 'strategy': 'mean_reversion', 'time_stop': 87, 'use_sma': True, 'use_atr': False, 'use_adx': True, 'use_ema': True, 'use_spike': False, 'rsi_required': False, 'edge_k': 0.9604996269221644, 'edge_cap': 0.8010126966836053, 'bull_strategy': 'breakout', 'bull_bb_std_mult': 3.0706782780107305, 'bull_rsi_os': 17, 'bull_rsi_ob': 78, 'bull_adx_thresh': 15.809342858048927, 'bull_atr_min_pct': 0.020100008574796907, 'bull_atr_max_pct': 0.09476035219239987, 'bull_tp_mult': 2.7652868094669385, 'bull_tsl_mult': 0.6233276945050508, 'bull_time_stop': 152, 'bull_use_sma': True, 'bull_use_ema': False, 'bull_use_atr': True, 'bull_use_adx': True, 'bull_use_spike': True, 'bull_rsi_required': False, 'bear_strategy': 'breakout', 'bear_bb_std_mult': 2.6022641641904567, 'bear_rsi_os': 29, 'bear_rsi_ob': 66, 'bear_adx_thresh': 18.109496958461165, 'bear_atr_min_pct': 0.009254179733657048, 'bear_atr_max_pct': 0.05596477726207234, 'bear_tp_mult': 2.5135658680328072, 'bear_tsl_mult': 0.8586414617857014, 'bear_time_stop': 50, 'bear_use_sma': False, 'bear_use_ema': True, 'bear_use_atr': True, 'bear_use_adx': True, 'bear_use_spike': True, 'bear_rsi_required': False, 'sideways_strategy': 'breakout', 'sideways_bb_std_mult': 2.328070090560425, 'sideways_rsi_os': 45, 'sideways_rsi_ob': 57, 'sideways_adx_thresh': 6.619675664338876, 'sideways_atr_min_pct': 0.012907828624092982, 'sideways_atr_max_pct': 0.019598017912088782, 'sideways_tp_mult': 1.0100163827830375, 'sideways_tsl_mult': 0.7445098948344178, 'sideways_time_stop': 207, 'sideways_use_sma': False, 'sideways_use_ema': False, 'sideways_use_atr': False, 'sideways_use_adx': False, 'sideways_use_spike': False, 'sideways_rsi_required': True}.
[I 2025-08-29 20:37:15,178] Trial 516 finished with values: [-0.07520699759871552, 0.07518737803412089] and parameters: {'p_sma': 19, 'p_std': 37, 'p_atr': 29, 'p_adx': 13, 'rsi_period': 57, 'ema1': 25, 'ema2': 48, 'slip_atr_k': 0.015918783681055815, 'slip_spread_k': 0.5802910140947097, 'spread_hl_frac': 0.049050954956697854, 'bb_std_mult': 1.7717719580232676, 'rsi_os': 10, 'rsi_ob': 83, 'vol_spike': 0.1711006450923407, 'adx_thresh': 13.67648588092892, 'atr_min_pct': 0.019582612544468116, 'atr_max_pct': 0.14339744340981747, 'tp_mult': 1.2898473774158625, 'tsl_mult': 0.817204503487003, 'strategy': 'mean_reversion', 'time_stop': 174, 'use_sma': True, 'use_atr': False, 'use_adx': True, 'use_ema': True, 'use_spike': False, 'rsi_required': False, 'edge_k': 0.47027620301844586, 'edge_cap': 0.4328501819824878, 'bull_strategy': 'breakout', 'bull_bb_std_mult': 3.059629922395049, 'bull_rsi_os': 24, 'bull_rsi_ob': 78, 'bull_adx_thresh': 12.913335390501693, 'bull_atr_min_pct': 0.009471821075477116, 'bull_atr_max_pct': 0.10979642853760951, 'bull_tp_mult': 2.6675227371260775, 'bull_tsl_mult': 0.5094870291734889, 'bull_time_stop': 153, 'bull_use_sma': True, 'bull_use_ema': False, 'bull_use_atr': True, 'bull_use_adx': True, 'bull_use_spike': True, 'bull_rsi_required': False, 'bear_strategy': 'breakout', 'bear_bb_std_mult': 2.77803906455544, 'bear_rsi_os': 27, 'bear_rsi_ob': 46, 'bear_adx_thresh': 21.596828443572413, 'bear_atr_min_pct': 0.014688630781705935, 'bear_atr_max_pct': 0.0546498837462663, 'bear_tp_mult': 2.510462209072304, 'bear_tsl_mult': 0.017614716411113673, 'bear_time_stop': 106, 'bear_use_sma': False, 'bear_use_ema': True, 'bear_use_atr': True, 'bear_use_adx': True, 'bear_use_spike': True, 'bear_rsi_required': False, 'sideways_strategy': 'breakout', 'sideways_bb_std_mult': 1.3233938711918318, 'sideways_rsi_os': 43, 'sideways_rsi_ob': 78, 'sideways_adx_thresh': 6.744021379276196, 'sideways_atr_min_pct': 0.0006822088104626069, 'sideways_atr_max_pct': 0.019467051360839597, 'sideways_tp_mult': 1.7127705172458856, 'sideways_tsl_mult': 0.7621788567521923, 'sideways_time_stop': 207, 'sideways_use_sma': False, 'sideways_use_ema': False, 'sideways_use_atr': False, 'sideways_use_adx': False, 'sideways_use_spike': False, 'sideways_rsi_required': True}.
[I 2025-08-29 20:37:15,956] Trial 520 finished with values: [-1000000000.0, 1000000000.0] and parameters: {'p_sma': 21, 'p_std': 57, 'p_atr': 13, 'p_adx': 13, 'rsi_period': 42, 'ema1': 26, 'ema2': 45, 'slip_atr_k': 0.008772483241361744, 'slip_spread_k': 0.13313006100007763, 'spread_hl_frac': 0.04648640339789653, 'bb_std_mult': 1.8496728301761873, 'rsi_os': 51, 'rsi_ob': 81, 'vol_spike': 0.2059486861144027, 'adx_thresh': 13.68642960142573, 'atr_min_pct': 0.023775907450474497, 'atr_max_pct': 0.03307209961291722, 'tp_mult': 2.1845407662132184, 'tsl_mult': 0.7849501306274125, 'strategy': 'mean_reversion', 'time_stop': 165, 'use_sma': True, 'use_atr': False, 'use_adx': False, 'use_ema': True, 'use_spike': False, 'rsi_required': False, 'edge_k': 1.0546603758352862, 'edge_cap': 0.2528704424859028, 'bull_strategy': 'mean_reversion', 'bull_bb_std_mult': 3.510464444212567, 'bull_rsi_os': 11, 'bull_rsi_ob': 45, 'bull_adx_thresh': 13.07860629259153, 'bull_atr_min_pct': 0.016415827136956385, 'bull_atr_max_pct': 0.08562719012215059, 'bull_tp_mult': 2.6686695489057293, 'bull_tsl_mult': 0.5200121578016424, 'bull_time_stop': 48, 'bull_use_sma': True, 'bull_use_ema': False, 'bull_use_atr': True, 'bull_use_adx': True, 'bull_use_spike': True, 'bull_rsi_required': False, 'bear_strategy': 'breakout', 'bear_bb_std_mult': 2.706981667611435, 'bear_rsi_os': 27, 'bear_rsi_ob': 68, 'bear_adx_thresh': 21.52296774631828, 'bear_atr_min_pct': 0.005299048661222558, 'bear_atr_max_pct': 0.08087208303779422, 'bear_tp_mult': 2.687927003945629, 'bear_tsl_mult': 0.9073087717015591, 'bear_time_stop': 54, 'bear_use_sma': False, 'bear_use_ema': True, 'bear_use_atr': True, 'bear_use_adx': True, 'bear_use_spike': True, 'bear_rsi_required': False, 'sideways_strategy': 'breakout', 'sideways_bb_std_mult': 2.348972453707326, 'sideways_rsi_os': 49, 'sideways_rsi_ob': 47, 'sideways_adx_thresh': 34.24594720564162, 'sideways_atr_min_pct': 0.0042728734043182386, 'sideways_atr_max_pct': 0.020842810140018302, 'sideways_tp_mult': 2.012074883394259, 'sideways_tsl_mult': 0.8001848235657794, 'sideways_time_stop': 195, 'sideways_use_sma': False, 'sideways_use_ema': False, 'sideways_use_atr': False, 'sideways_use_adx': False, 'sideways_use_spike': False, 'sideways_rsi_required': False}.
[I 2025-08-29 20:37:15,977] Trial 519 finished with values: [-1000000000.0, 1000000000.0] and parameters: {'p_sma': 59, 'p_std': 24, 'p_atr': 24, 'p_adx': 13, 'rsi_period': 39, 'ema1': 26, 'ema2': 33, 'slip_atr_k': 0.01702786756669619, 'slip_spread_k': 0.4244231802983991, 'spread_hl_frac': 0.046540725183965785, 'bb_std_mult': 1.765838679458174, 'rsi_os': 9, 'rsi_ob': 49, 'vol_spike': 0.181995287811965, 'adx_thresh': 11.767904135852659, 'atr_min_pct': 0.019761095537798368, 'atr_max_pct': 0.03223999435587339, 'tp_mult': 1.3402109724500575, 'tsl_mult': 0.8159766939392479, 'strategy': 'mean_reversion', 'time_stop': 174, 'use_sma': True, 'use_atr': False, 'use_adx': False, 'use_ema': True, 'use_spike': False, 'rsi_required': False, 'edge_k': 0.4621416097794694, 'edge_cap': 0.23863661207218645, 'bull_strategy': 'breakout', 'bull_bb_std_mult': 1.104271508095188, 'bull_rsi_os': 54, 'bull_rsi_ob': 71, 'bull_adx_thresh': 5.675642945422567, 'bull_atr_min_pct': 0.02705189206764204, 'bull_atr_max_pct': 0.0945638537784865, 'bull_tp_mult': 2.6793999477274895, 'bull_tsl_mult': 0.6066829320177932, 'bull_time_stop': 236, 'bull_use_sma': True, 'bull_use_ema': False, 'bull_use_atr': True, 'bull_use_adx': True, 'bull_use_spike': True, 'bull_rsi_required': False, 'bear_strategy': 'breakout', 'bear_bb_std_mult': 2.616587576664344, 'bear_rsi_os': 40, 'bear_rsi_ob': 70, 'bear_adx_thresh': 15.871663069773822, 'bear_atr_min_pct': 0.009113332619596331, 'bear_atr_max_pct': 0.055327955178189205, 'bear_tp_mult': 2.1378378124049218, 'bear_tsl_mult': 0.8542279053399733, 'bear_time_stop': 54, 'bear_use_sma': False, 'bear_use_ema': True, 'bear_use_atr': True, 'bear_use_adx': True, 'bear_use_spike': True, 'bear_rsi_required': False, 'sideways_strategy': 'breakout', 'sideways_bb_std_mult': 2.2743224534688578, 'sideways_rsi_os': 48, 'sideways_rsi_ob': 88, 'sideways_adx_thresh': 34.29047467242519, 'sideways_atr_min_pct': 0.012544880228611202, 'sideways_atr_max_pct': 0.01986494617345018, 'sideways_tp_mult': 1.1187553250038076, 'sideways_tsl_mult': 0.024713026973259167, 'sideways_time_stop': 193, 'sideways_use_sma': False, 'sideways_use_ema': False, 'sideways_use_atr': False, 'sideways_use_adx': False, 'sideways_use_spike': False, 'sideways_rsi_required': False}.
[I 2025-08-29 20:37:42,144] Trial 518 finished with values: [-1000000000.0, 1000000000.0] and parameters: {'p_sma': 47, 'p_std': 37, 'p_atr': 14, 'p_adx': 13, 'rsi_period': 43, 'ema1': 26, 'ema2': 49, 'slip_atr_k': 0.016911918896207412, 'slip_spread_k': 0.045991901902381116, 'spread_hl_frac': 0.04896806580201349, 'bb_std_mult': 1.7677944234222545, 'rsi_os': 45, 'rsi_ob': 74, 'vol_spike': 0.18302312066399273, 'adx_thresh': 13.566119876769733, 'atr_min_pct': 0.01959808193496799, 'atr_max_pct': 0.03617763773798448, 'tp_mult': 2.651953899471365, 'tsl_mult': 0.8152603443579015, 'strategy': 'mean_reversion', 'time_stop': 87, 'use_sma': True, 'use_atr': False, 'use_adx': False, 'use_ema': True, 'use_spike': False, 'rsi_required': False, 'edge_k': 1.1196655693509772, 'edge_cap': 0.8467315302761346, 'bull_strategy': 'breakout', 'bull_bb_std_mult': 1.797176032676262, 'bull_rsi_os': 16, 'bull_rsi_ob': 45, 'bull_adx_thresh': 15.510295615433968, 'bull_atr_min_pct': 0.01647305960728108, 'bull_atr_max_pct': 0.10589708474458095, 'bull_tp_mult': 2.670410769835044, 'bull_tsl_mult': 0.8616039121532155, 'bull_time_stop': 30, 'bull_use_sma': True, 'bull_use_ema': False, 'bull_use_atr': True, 'bull_use_adx': True, 'bull_use_spike': True, 'bull_rsi_required': False, 'bear_strategy': 'breakout', 'bear_bb_std_mult': 1.393743176004174, 'bear_rsi_os': 27, 'bear_rsi_ob': 54, 'bear_adx_thresh': 21.572105366183223, 'bear_atr_min_pct': 0.014566780091340012, 'bear_atr_max_pct': 0.057664288198395905, 'bear_tp_mult': 2.6844813720270095, 'bear_tsl_mult': 0.851692611004166, 'bear_time_stop': 111, 'bear_use_sma': False, 'bear_use_ema': True, 'bear_use_atr': True, 'bear_use_adx': True, 'bear_use_spike': True, 'bear_rsi_required': False, 'sideways_strategy': 'breakout', 'sideways_bb_std_mult': 1.337748062816872, 'sideways_rsi_os': 43, 'sideways_rsi_ob': 92, 'sideways_adx_thresh': 32.2790918737087, 'sideways_atr_min_pct': 0.013023358918114927, 'sideways_atr_max_pct': 0.14962141811237928, 'sideways_tp_mult': 1.7060855587809047, 'sideways_tsl_mult': 0.7478564992977149, 'sideways_time_stop': 185, 'sideways_use_sma': False, 'sideways_use_ema': False, 'sideways_use_atr': False, 'sideways_use_adx': False, 'sideways_use_spike': True, 'sideways_rsi_required': False}.
[I 2025-08-29 20:37:42,515] Trial 521 finished with values: [-0.05069252711403405, 0.050662503682018675] and parameters: {'p_sma': 27, 'p_std': 56, 'p_atr': 9, 'p_adx': 13, 'rsi_period': 39, 'ema1': 27, 'ema2': 44, 'slip_atr_k': 0.09118409725863039, 'slip_spread_k': 0.14013732529528197, 'spread_hl_frac': 0.046756694754097716, 'bb_std_mult': 1.6372952276240296, 'rsi_os': 9, 'rsi_ob': 81, 'vol_spike': 0.204281040460405, 'adx_thresh': 11.792624065241329, 'atr_min_pct': 0.020097850525862274, 'atr_max_pct': 0.03609641681708601, 'tp_mult': 2.6545934231759976, 'tsl_mult': 0.7799028710705553, 'strategy': 'mean_reversion', 'time_stop': 165, 'use_sma': True, 'use_atr': False, 'use_adx': False, 'use_ema': False, 'use_spike': False, 'rsi_required': False, 'edge_k': 1.0494112515906104, 'edge_cap': 0.726403453046982, 'bull_strategy': 'mean_reversion', 'bull_bb_std_mult': 3.3539337788261054, 'bull_rsi_os': 21, 'bull_rsi_ob': 71, 'bull_adx_thresh': 14.358359150823105, 'bull_atr_min_pct': 0.028049965476664038, 'bull_atr_max_pct': 0.1068239222743978, 'bull_tp_mult': 2.8058364474921835, 'bull_tsl_mult': 0.26332057515611185, 'bull_time_stop': 231, 'bull_use_sma': True, 'bull_use_ema': False, 'bull_use_atr': True, 'bull_use_adx': False, 'bull_use_spike': True, 'bull_rsi_required': True, 'bear_strategy': 'breakout', 'bear_bb_std_mult': 3.2094511370383803, 'bear_rsi_os': 34, 'bear_rsi_ob': 69, 'bear_adx_thresh': 23.676033980648175, 'bear_atr_min_pct': 0.025237310112998488, 'bear_atr_max_pct': 0.04833053217715985, 'bear_tp_mult': 2.690721750939703, 'bear_tsl_mult': 0.8955088476351138, 'bear_time_stop': 57, 'bear_use_sma': False, 'bear_use_ema': True, 'bear_use_atr': False, 'bear_use_adx': False, 'bear_use_spike': True, 'bear_rsi_required': False, 'sideways_strategy': 'breakout', 'sideways_bb_std_mult': 2.3759526066564867, 'sideways_rsi_os': 49, 'sideways_rsi_ob': 47, 'sideways_adx_thresh': 17.047987861418633, 'sideways_atr_min_pct': 0.0021674591889163687, 'sideways_atr_max_pct': 0.09437986666275154, 'sideways_tp_mult': 1.555743059950239, 'sideways_tsl_mult': 0.025172643242465986, 'sideways_time_stop': 194, 'sideways_use_sma': False, 'sideways_use_ema': False, 'sideways_use_atr': False, 'sideways_use_adx': False, 'sideways_use_spike': False, 'sideways_rsi_required': False}.
