[I 2025-08-29 20:24:29,869] Trial 395 finished with values: [-0.010993022390363705, 0.010923034860093533] and parameters: {'p_sma': 49, 'p_std': 55, 'p_atr': 12, 'p_adx': 13, 'rsi_period': 38, 'ema1': 23, 'ema2': 10, 'slip_atr_k': 0.13786565797249906, 'slip_spread_k': 0.10114693526243074, 'spread_hl_frac': 0.04709837935120778, 'bb_std_mult': 1.619803426419681, 'rsi_os': 14, 'rsi_ob': 85, 'vol_spike': 0.17720755792047074, 'adx_thresh': 12.366313864492646, 'atr_min_pct': 0.021782538082992093, 'atr_max_pct': 0.10617867592998281, 'tp_mult': 1.1263113461626078, 'tsl_mult': 0.3171792513713656, 'strategy': 'mean_reversion', 'time_stop': 170, 'use_sma': True, 'use_atr': False, 'use_adx': False, 'use_ema': True, 'use_spike': False, 'rsi_required': False, 'edge_k': 1.0776174519736623, 'edge_cap': 0.6610498110034241, 'bull_strategy': 'mean_reversion', 'bull_bb_std_mult': 3.552167685096586, 'bull_rsi_os': 10, 'bull_rsi_ob': 73, 'bull_adx_thresh': 15.313458208371486, 'bull_atr_min_pct': 0.016545301293459026, 'bull_atr_max_pct': 0.0855748442163747, 'bull_tp_mult': 2.70001135592501, 'bull_tsl_mult': 0.4220779217194686, 'bull_time_stop': 30, 'bull_use_sma': True, 'bull_use_ema': False, 'bull_use_atr': True, 'bull_use_adx': False, 'bull_use_spike': True, 'bull_rsi_required': False, 'bear_strategy': 'breakout', 'bear_bb_std_mult': 2.950851937882117, 'bear_rsi_os': 37, 'bear_rsi_ob': 67, 'bear_adx_thresh': 22.073983096532434, 'bear_atr_min_pct': 0.0059060560258280695, 'bear_atr_max_pct': 0.06593256735622217, 'bear_tp_mult': 2.6561209734063085, 'bear_tsl_mult': 0.9127251541155148, 'bear_time_stop': 45, 'bear_use_sma': False, 'bear_use_ema': True, 'bear_use_atr': False, 'bear_use_adx': True, 'bear_use_spike': True, 'bear_rsi_required': False, 'sideways_strategy': 'breakout', 'sideways_bb_std_mult': 2.575343210606058, 'sideways_rsi_os': 25, 'sideways_rsi_ob': 75, 'sideways_adx_thresh': 32.91082916691822, 'sideways_atr_min_pct': 0.007514987697606728, 'sideways_atr_max_pct': 0.08852788376101614, 'sideways_tp_mult': 1.0137843023698672, 'sideways_tsl_mult': 0.7071375997906507, 'sideways_time_stop': 23, 'sideways_use_sma': False, 'sideways_use_ema': False, 'sideways_use_atr': False, 'sideways_use_adx': False, 'sideways_use_spike': False, 'sideways_rsi_required': False}.
[I 2025-08-29 20:24:29,926] Trial 396 finished with values: [-1000000000.0, 1000000000.0] and parameters: {'p_sma': 16, 'p_std': 55, 'p_atr': 12, 'p_adx': 13, 'rsi_period': 38, 'ema1': 29, 'ema2': 46, 'slip_atr_k': 0.2496444183126851, 'slip_spread_k': 0.11293964241360942, 'spread_hl_frac': 0.047186982812252226, 'bb_std_mult': 1.6016025293429803, 'rsi_os': 14, 'rsi_ob': 84, 'vol_spike': 0.1773386586036367, 'adx_thresh': 12.529092954383572, 'atr_min_pct': 0.02798952803745507, 'atr_max_pct': 0.06818574652666766, 'tp_mult': 1.2318276655200227, 'tsl_mult': 0.06354433013028715, 'strategy': 'mean_reversion', 'time_stop': 233, 'use_sma': True, 'use_atr': False, 'use_adx': False, 'use_ema': True, 'use_spike': True, 'rsi_required': False, 'edge_k': 1.0744779207839468, 'edge_cap': 0.6757455960670462, 'bull_strategy': 'mean_reversion', 'bull_bb_std_mult': 3.1180509403025605, 'bull_rsi_os': 11, 'bull_rsi_ob': 57, 'bull_adx_thresh': 12.617309957701721, 'bull_atr_min_pct': 0.01671368671268987, 'bull_atr_max_pct': 0.08723716335496223, 'bull_tp_mult': 2.7023232264274664, 'bull_tsl_mult': 0.932813620479891, 'bull_time_stop': 114, 'bull_use_sma': True, 'bull_use_ema': False, 'bull_use_atr': True, 'bull_use_adx': False, 'bull_use_spike': True, 'bull_rsi_required': False, 'bear_strategy': 'breakout', 'bear_bb_std_mult': 2.167578891542555, 'bear_rsi_os': 37, 'bear_rsi_ob': 46, 'bear_adx_thresh': 22.133841681213095, 'bear_atr_min_pct': 0.01502366583588797, 'bear_atr_max_pct': 0.024533613838754513, 'bear_tp_mult': 2.6652403106010283, 'bear_tsl_mult': 0.9191535915489242, 'bear_time_stop': 44, 'bear_use_sma': False, 'bear_use_ema': True, 'bear_use_atr': False, 'bear_use_adx': True, 'bear_use_spike': True, 'bear_rsi_required': False, 'sideways_strategy': 'breakout', 'sideways_bb_std_mult': 2.3038499434568855, 'sideways_rsi_os': 46, 'sideways_rsi_ob': 77, 'sideways_adx_thresh': 32.8323903686211, 'sideways_atr_min_pct': 0.010775241284351502, 'sideways_atr_max_pct': 0.01998035444029942, 'sideways_tp_mult': 1.113263080997001, 'sideways_tsl_mult': 0.7073903729654983, 'sideways_time_stop': 10, 'sideways_use_sma': False, 'sideways_use_ema': False, 'sideways_use_atr': False, 'sideways_use_adx': False, 'sideways_use_spike': False, 'sideways_rsi_required': False}.
[I 2025-08-29 20:24:30,167] Trial 398 finished with values: [-1000000000.0, 1000000000.0] and parameters: {'p_sma': 51, 'p_std': 57, 'p_atr': 21, 'p_adx': 12, 'rsi_period': 37, 'ema1': 29, 'ema2': 27, 'slip_atr_k': 0.008417796919272098, 'slip_spread_k': 0.15451900211855404, 'spread_hl_frac': 0.012892495411387575, 'bb_std_mult': 1.5985597076091154, 'rsi_os': 13, 'rsi_ob': 85, 'vol_spike': 0.06406762544707194, 'adx_thresh': 13.211788268640884, 'atr_min_pct': 0.02035972264965199, 'atr_max_pct': 0.14564964101021352, 'tp_mult': 1.24361865931183, 'tsl_mult': 0.9333016524784473, 'strategy': 'breakout', 'time_stop': 173, 'use_sma': True, 'use_atr': False, 'use_adx': False, 'use_ema': True, 'use_spike': True, 'rsi_required': False, 'edge_k': 1.0293047737537804, 'edge_cap': 0.6337963107478948, 'bull_strategy': 'mean_reversion', 'bull_bb_std_mult': 3.4064904073483655, 'bull_rsi_os': 29, 'bull_rsi_ob': 73, 'bull_adx_thresh': 21.348183698762682, 'bull_atr_min_pct': 0.0166234918723527, 'bull_atr_max_pct': 0.09925042584508822, 'bull_tp_mult': 2.7128616663832776, 'bull_tsl_mult': 0.934090428838678, 'bull_time_stop': 24, 'bull_use_sma': True, 'bull_use_ema': False, 'bull_use_atr': True, 'bull_use_adx': False, 'bull_use_spike': True, 'bull_rsi_required': False, 'bear_strategy': 'breakout', 'bear_bb_std_mult': 2.9553484970176385, 'bear_rsi_os': 27, 'bear_rsi_ob': 76, 'bear_adx_thresh': 22.16526847704618, 'bear_atr_min_pct': 0.015459313729277715, 'bear_atr_max_pct': 0.09281534238167712, 'bear_tp_mult': 2.7869088012192513, 'bear_tsl_mult': 0.9234133435816788, 'bear_time_stop': 42, 'bear_use_sma': False, 'bear_use_ema': True, 'bear_use_atr': False, 'bear_use_adx': True, 'bear_use_spike': True, 'bear_rsi_required': False, 'sideways_strategy': 'breakout', 'sideways_bb_std_mult': 1.4663782899424616, 'sideways_rsi_os': 46, 'sideways_rsi_ob': 76, 'sideways_adx_thresh': 32.85404890330386, 'sideways_atr_min_pct': 0.007369374615025192, 'sideways_atr_max_pct': 0.01994189124945353, 'sideways_tp_mult': 1.119401760326141, 'sideways_tsl_mult': 0.7790566067052629, 'sideways_time_stop': 151, 'sideways_use_sma': False, 'sideways_use_ema': False, 'sideways_use_atr': False, 'sideways_use_adx': False, 'sideways_use_spike': False, 'sideways_rsi_required': False}.
[I 2025-08-29 20:24:30,287] Trial 399 finished with values: [-1000000000.0, 1000000000.0] and parameters: {'p_sma': 53, 'p_std': 23, 'p_atr': 15, 'p_adx': 12, 'rsi_period': 37, 'ema1': 23, 'ema2': 45, 'slip_atr_k': 0.007476807125898365, 'slip_spread_k': 0.15598785141559135, 'spread_hl_frac': 0.04996874626165186, 'bb_std_mult': 1.8011244813740686, 'rsi_os': 5, 'rsi_ob': 58, 'vol_spike': 0.18714741946094102, 'adx_thresh': 21.48839326612285, 'atr_min_pct': 0.020317332001124063, 'atr_max_pct': 0.033034511021761005, 'tp_mult': 1.2292326512905227, 'tsl_mult': 0.9195942129244606, 'strategy': 'mean_reversion', 'time_stop': 173, 'use_sma': True, 'use_atr': False, 'use_adx': False, 'use_ema': True, 'use_spike': False, 'rsi_required': False, 'edge_k': 0.08206930607378216, 'edge_cap': 0.6387241402929348, 'bull_strategy': 'mean_reversion', 'bull_bb_std_mult': 3.1532984410654623, 'bull_rsi_os': 29, 'bull_rsi_ob': 86, 'bull_adx_thresh': 21.294116153767852, 'bull_atr_min_pct': 0.016690699450415646, 'bull_atr_max_pct': 0.09373486504151933, 'bull_tp_mult': 2.7112857339247665, 'bull_tsl_mult': 0.9310929197382118, 'bull_time_stop': 110, 'bull_use_sma': True, 'bull_use_ema': False, 'bull_use_atr': True, 'bull_use_adx': False, 'bull_use_spike': True, 'bull_rsi_required': False, 'bear_strategy': 'breakout', 'bear_bb_std_mult': 2.6420132265324443, 'bear_rsi_os': 52, 'bear_rsi_ob': 67, 'bear_adx_thresh': 24.538098202357844, 'bear_atr_min_pct': 0.015277775877555834, 'bear_atr_max_pct': 0.016689959905620694, 'bear_tp_mult': 2.93773027380945, 'bear_tsl_mult': 0.8401979804301549, 'bear_time_stop': 46, 'bear_use_sma': False, 'bear_use_ema': True, 'bear_use_atr': False, 'bear_use_adx': True, 'bear_use_spike': True, 'bear_rsi_required': False, 'sideways_strategy': 'breakout', 'sideways_bb_std_mult': 1.1288439174808258, 'sideways_rsi_os': 5, 'sideways_rsi_ob': 64, 'sideways_adx_thresh': 32.74362802601835, 'sideways_atr_min_pct': 0.007370721538067683, 'sideways_atr_max_pct': 0.10336254699648327, 'sideways_tp_mult': 1.1039417338516333, 'sideways_tsl_mult': 0.7812945356907246, 'sideways_time_stop': 81, 'sideways_use_sma': False, 'sideways_use_ema': False, 'sideways_use_atr': False, 'sideways_use_adx': False, 'sideways_use_spike': False, 'sideways_rsi_required': False}.
[I 2025-08-29 20:24:59,707] Trial 400 finished with values: [-1000000000.0, 1000000000.0] and parameters: {'p_sma': 16, 'p_std': 18, 'p_atr': 21, 'p_adx': 21, 'rsi_period': 37, 'ema1': 24, 'ema2': 46, 'slip_atr_k': 0.12181329016228898, 'slip_spread_k': 0.15431006968263533, 'spread_hl_frac': 0.0300634010067896, 'bb_std_mult': 1.8097147907177333, 'rsi_os': 5, 'rsi_ob': 51, 'vol_spike': 0.013312915003460934, 'adx_thresh': 13.274373024414105, 'atr_min_pct': 0.005627161921546511, 'atr_max_pct': 0.023227129854108717, 'tp_mult': 1.2571222807128803, 'tsl_mult': 0.9203939561787036, 'strategy': 'mean_reversion', 'time_stop': 136, 'use_sma': True, 'use_atr': False, 'use_adx': False, 'use_ema': True, 'use_spike': True, 'rsi_required': False, 'edge_k': 0.1735555276409505, 'edge_cap': 0.7029033670101694, 'bull_strategy': 'mean_reversion', 'bull_bb_std_mult': 3.1525554522362227, 'bull_rsi_os': 24, 'bull_rsi_ob': 71, 'bull_adx_thresh': 12.714800534049598, 'bull_atr_min_pct': 0.007123703872720504, 'bull_atr_max_pct': 0.10466210969226228, 'bull_tp_mult': 2.7090410568600136, 'bull_tsl_mult': 0.8842931191026586, 'bull_time_stop': 242, 'bull_use_sma': True, 'bull_use_ema': False, 'bull_use_atr': True, 'bull_use_adx': False, 'bull_use_spike': True, 'bull_rsi_required': False, 'bear_strategy': 'breakout', 'bear_bb_std_mult': 2.4558364407094535, 'bear_rsi_os': 28, 'bear_rsi_ob': 80, 'bear_adx_thresh': 21.30453645209822, 'bear_atr_min_pct': 0.015241221109184874, 'bear_atr_max_pct': 0.04505163374682906, 'bear_tp_mult': 2.7919145210174916, 'bear_tsl_mult': 0.843169568357226, 'bear_time_stop': 66, 'bear_use_sma': False, 'bear_use_ema': True, 'bear_use_atr': False, 'bear_use_adx': True, 'bear_use_spike': True, 'bear_rsi_required': False, 'sideways_strategy': 'breakout', 'sideways_bb_std_mult': 2.2174593042131927, 'sideways_rsi_os': 46, 'sideways_rsi_ob': 64, 'sideways_adx_thresh': 31.381759773886923, 'sideways_atr_min_pct': 0.008594518985689682, 'sideways_atr_max_pct': 0.04205473304666994, 'sideways_tp_mult': 2.5532960434246195, 'sideways_tsl_mult': 0.7742545816421746, 'sideways_time_stop': 42, 'sideways_use_sma': False, 'sideways_use_ema': False, 'sideways_use_atr': False, 'sideways_use_adx': False, 'sideways_use_spike': False, 'sideways_rsi_required': False}.
[I 2025-08-29 20:25:00,421] Trial 403 finished with values: [-0.015294697887387021, 0.015267461106452686] and parameters: {'p_sma': 22, 'p_std': 33, 'p_atr': 26, 'p_adx': 7, 'rsi_period': 9, 'ema1': 6, 'ema2': 46, 'slip_atr_k': 0.11951027737637794, 'slip_spread_k': 0.13690828512879, 'spread_hl_frac': 0.0485368619017642, 'bb_std_mult': 1.7495707117997696, 'rsi_os': 6, 'rsi_ob': 84, 'vol_spike': 0.008143979920250538, 'adx_thresh': 13.522342434587223, 'atr_min_pct': 0.018305035179846888, 'atr_max_pct': 0.019357782430814312, 'tp_mult': 1.0607375012050348, 'tsl_mult': 0.8675891068606124, 'strategy': 'mean_reversion', 'time_stop': 166, 'use_sma': True, 'use_atr': False, 'use_adx': True, 'use_ema': True, 'use_spike': False, 'rsi_required': False, 'edge_k': 1.0237819029499, 'edge_cap': 0.6238577448562673, 'bull_strategy': 'mean_reversion', 'bull_bb_std_mult': 1.841772592005305, 'bull_rsi_os': 27, 'bull_rsi_ob': 53, 'bull_adx_thresh': 23.178211048044925, 'bull_atr_min_pct': 0.006960964048819171, 'bull_atr_max_pct': 0.09077465567802404, 'bull_tp_mult': 2.6151462858297903, 'bull_tsl_mult': 0.8828971595199014, 'bull_time_stop': 240, 'bull_use_sma': True, 'bull_use_ema': False, 'bull_use_atr': True, 'bull_use_adx': False, 'bull_use_spike': True, 'bull_rsi_required': False, 'bear_strategy': 'mean_reversion', 'bear_bb_std_mult': 3.2597132091452234, 'bear_rsi_os': 29, 'bear_rsi_ob': 50, 'bear_adx_thresh': 19.61697252093034, 'bear_atr_min_pct': 0.010536518994520329, 'bear_atr_max_pct': 0.09513693184295141, 'bear_tp_mult': 2.6135113149496085, 'bear_tsl_mult': 0.821710378171523, 'bear_time_stop': 65, 'bear_use_sma': True, 'bear_use_ema': True, 'bear_use_atr': False, 'bear_use_adx': True, 'bear_use_spike': True, 'bear_rsi_required': True, 'sideways_strategy': 'breakout', 'sideways_bb_std_mult': 3.492561598483987, 'sideways_rsi_os': 47, 'sideways_rsi_ob': 77, 'sideways_adx_thresh': 14.87180827774431, 'sideways_atr_min_pct': 0.002873684729034899, 'sideways_atr_max_pct': 0.02834327373903338, 'sideways_tp_mult': 1.2022000307868597, 'sideways_tsl_mult': 0.030756576046598372, 'sideways_time_stop': 163, 'sideways_use_sma': True, 'sideways_use_ema': False, 'sideways_use_atr': False, 'sideways_use_adx': False, 'sideways_use_spike': True, 'sideways_rsi_required': False}.
[I 2025-08-29 20:25:00,714] Trial 401 finished with values: [-1000000000.0, 0.14455908560361908] and parameters: {'p_sma': 53, 'p_std': 60, 'p_atr': 26, 'p_adx': 12, 'rsi_period': 41, 'ema1': 24, 'ema2': 59, 'slip_atr_k': 0.09082350686374191, 'slip_spread_k': 0.1541451975566162, 'spread_hl_frac': 0.012698792706540271, 'bb_std_mult': 1.8013280690070255, 'rsi_os': 5, 'rsi_ob': 86, 'vol_spike': 0.053763545835055465, 'adx_thresh': 13.345540657690208, 'atr_min_pct': 0.005583594691409217, 'atr_max_pct': 0.07367563630254766, 'tp_mult': 1.4787954868196824, 'tsl_mult': 0.9230173161654613, 'strategy': 'breakout', 'time_stop': 70, 'use_sma': True, 'use_atr': False, 'use_adx': True, 'use_ema': True, 'use_spike': False, 'rsi_required': False, 'edge_k': 1.0335793238537059, 'edge_cap': 0.6363449314654452, 'bull_strategy': 'mean_reversion', 'bull_bb_std_mult': 3.1628272244343583, 'bull_rsi_os': 28, 'bull_rsi_ob': 81, 'bull_adx_thresh': 22.303664433495726, 'bull_atr_min_pct': 0.018023319146005447, 'bull_atr_max_pct': 0.09455911018741081, 'bull_tp_mult': 2.637846220368518, 'bull_tsl_mult': 0.8804661740896667, 'bull_time_stop': 26, 'bull_use_sma': True, 'bull_use_ema': False, 'bull_use_atr': True, 'bull_use_adx': False, 'bull_use_spike': True, 'bull_rsi_required': False, 'bear_strategy': 'breakout', 'bear_bb_std_mult': 1.5197268088769156, 'bear_rsi_os': 45, 'bear_rsi_ob': 50, 'bear_adx_thresh': 19.938940237094755, 'bear_atr_min_pct': 0.011822692292707606, 'bear_atr_max_pct': 0.01570290675836377, 'bear_tp_mult': 2.9399262803346184, 'bear_tsl_mult': 0.8895113556760276, 'bear_time_stop': 66, 'bear_use_sma': True, 'bear_use_ema': True, 'bear_use_atr': False, 'bear_use_adx': True, 'bear_use_spike': True, 'bear_rsi_required': False, 'sideways_strategy': 'breakout', 'sideways_bb_std_mult': 2.2337908026762494, 'sideways_rsi_os': 47, 'sideways_rsi_ob': 77, 'sideways_adx_thresh': 10.370469207750633, 'sideways_atr_min_pct': 0.0008722444653875058, 'sideways_atr_max_pct': 0.10923272929058224, 'sideways_tp_mult': 2.560647994695875, 'sideways_tsl_mult': 0.36635898590519567, 'sideways_time_stop': 31, 'sideways_use_sma': False, 'sideways_use_ema': False, 'sideways_use_atr': False, 'sideways_use_adx': False, 'sideways_use_spike': True, 'sideways_rsi_required': False}.
[I 2025-08-29 20:25:00,727] Trial 402 finished with values: [-0.030568877675559603, 0.030545010337874465] and parameters: {'p_sma': 22, 'p_std': 60, 'p_atr': 26, 'p_adx': 14, 'rsi_period': 41, 'ema1': 6, 'ema2': 31, 'slip_atr_k': 0.005507555979950257, 'slip_spread_k': 0.9641368640756982, 'spread_hl_frac': 0.04997188285047169, 'bb_std_mult': 1.7635595742804797, 'rsi_os': 5, 'rsi_ob': 86, 'vol_spike': 0.18787165726053429, 'adx_thresh': 13.300978627095105, 'atr_min_pct': 0.009321691451362057, 'atr_max_pct': 0.07247497819417861, 'tp_mult': 2.2231271675618602, 'tsl_mult': 0.8663158820962598, 'strategy': 'mean_reversion', 'time_stop': 165, 'use_sma': True, 'use_atr': False, 'use_adx': True, 'use_ema': True, 'use_spike': False, 'rsi_required': False, 'edge_k': 0.6810542246707134, 'edge_cap': 0.6285971428438548, 'bull_strategy': 'mean_reversion', 'bull_bb_std_mult': 3.1767892989432536, 'bull_rsi_os': 51, 'bull_rsi_ob': 71, 'bull_adx_thresh': 22.26146634838428, 'bull_atr_min_pct': 0.007321654732576984, 'bull_atr_max_pct': 0.0805937189829205, 'bull_tp_mult': 2.6140981716841623, 'bull_tsl_mult': 0.8833606215599775, 'bull_time_stop': 41, 'bull_use_sma': True, 'bull_use_ema': False, 'bull_use_atr': True, 'bull_use_adx': False, 'bull_use_spike': True, 'bull_rsi_required': False, 'bear_strategy': 'mean_reversion', 'bear_bb_std_mult': 3.2634985625847337, 'bear_rsi_os': 28, 'bear_rsi_ob': 50, 'bear_adx_thresh': 24.65497346874548, 'bear_atr_min_pct': 0.005303324921396922, 'bear_atr_max_pct': 0.010064802980333368, 'bear_tp_mult': 2.5963314014753993, 'bear_tsl_mult': 0.8508087427869405, 'bear_time_stop': 64, 'bear_use_sma': True, 'bear_use_ema': True, 'bear_use_atr': False, 'bear_use_adx': True, 'bear_use_spike': True, 'bear_rsi_required': True, 'sideways_strategy': 'breakout', 'sideways_bb_std_mult': 2.204905693358295, 'sideways_rsi_os': 48, 'sideways_rsi_ob': 63, 'sideways_adx_thresh': 14.951154566167489, 'sideways_atr_min_pct': 0.0019224940825562243, 'sideways_atr_max_pct': 0.029198682764176934, 'sideways_tp_mult': 1.1984276805102452, 'sideways_tsl_mult': 0.04667775548945208, 'sideways_time_stop': 123, 'sideways_use_sma': True, 'sideways_use_ema': False, 'sideways_use_atr': False, 'sideways_use_adx': False, 'sideways_use_spike': True, 'sideways_rsi_required': False}.
[I 2025-08-29 20:25:29,929] Trial 406 finished with values: [-1000000000.0, 1000000000.0] and parameters: {'p_sma': 47, 'p_std': 35, 'p_atr': 20, 'p_adx': 11, 'rsi_period': 70, 'ema1': 27, 'ema2': 32, 'slip_atr_k': 0.0005310756159292186, 'slip_spread_k': 0.537539320346945, 'spread_hl_frac': 0.04897644404014764, 'bb_std_mult': 1.7088036890471694, 'rsi_os': 7, 'rsi_ob': 73, 'vol_spike': 0.18406335803208096, 'adx_thresh': 11.26600627921386, 'atr_min_pct': 0.02263881252015815, 'atr_max_pct': 0.03109173619340367, 'tp_mult': 1.459362051729507, 'tsl_mult': 0.8928321079153206, 'strategy': 'mean_reversion', 'time_stop': 155, 'use_sma': True, 'use_atr': False, 'use_adx': False, 'use_ema': True, 'use_spike': False, 'rsi_required': False, 'edge_k': 1.9166329319051996, 'edge_cap': 0.7034821098172981, 'bull_strategy': 'mean_reversion', 'bull_bb_std_mult': 3.068847362659658, 'bull_rsi_os': 51, 'bull_rsi_ob': 75, 'bull_adx_thresh': 13.353808258583891, 'bull_atr_min_pct': 0.01572744350275663, 'bull_atr_max_pct': 0.09878896552825589, 'bull_tp_mult': 2.764157697274976, 'bull_tsl_mult': 0.8024284370841033, 'bull_time_stop': 121, 'bull_use_sma': True, 'bull_use_ema': False, 'bull_use_atr': True, 'bull_use_adx': False, 'bull_use_spike': True, 'bull_rsi_required': False, 'bear_strategy': 'mean_reversion', 'bear_bb_std_mult': 2.721600182729191, 'bear_rsi_os': 20, 'bear_rsi_ob': 79, 'bear_adx_thresh': 21.42773746396683, 'bear_atr_min_pct': 0.005226871935281695, 'bear_atr_max_pct': 0.04997488188207655, 'bear_tp_mult': 2.578058955656892, 'bear_tsl_mult': 0.02841085747827038, 'bear_time_stop': 52, 'bear_use_sma': False, 'bear_use_ema': True, 'bear_use_atr': False, 'bear_use_adx': True, 'bear_use_spike': True, 'bear_rsi_required': True, 'sideways_strategy': 'breakout', 'sideways_bb_std_mult': 0.9080409657874007, 'sideways_rsi_os': 48, 'sideways_rsi_ob': 87, 'sideways_adx_thresh': 32.16836024341099, 'sideways_atr_min_pct': 0.02115657492411556, 'sideways_atr_max_pct': 0.025512545068597972, 'sideways_tp_mult': 1.0556319291382876, 'sideways_tsl_mult': 0.7386468881752325, 'sideways_time_stop': 189, 'sideways_use_sma': True, 'sideways_use_ema': False, 'sideways_use_atr': False, 'sideways_use_adx': True, 'sideways_use_spike': False, 'sideways_rsi_required': False}.
