[I 2025-08-29 20:01:42,079] Trial 213 finished with values: [-1000000000.0, 1000000000.0] and parameters: {'p_sma': 38, 'p_std': 54, 'p_atr': 22, 'p_adx': 17, 'rsi_period': 48, 'ema1': 11, 'ema2': 40, 'slip_atr_k': 0.051142925000507176, 'slip_spread_k': 0.8744972275938939, 'spread_hl_frac': 0.0034420365591874592, 'bb_std_mult': 1.2758927530972828, 'rsi_os': 20, 'rsi_ob': 69, 'vol_spike': 0.16039620637272473, 'adx_thresh': 33.84151746979349, 'atr_min_pct': 0.018926659419617835, 'atr_max_pct': 0.08767242508536756, 'tp_mult': 2.7911553278231254, 'tsl_mult': 0.5741485623159778, 'strategy': 'mean_reversion', 'time_stop': 237, 'use_sma': False, 'use_atr': True, 'use_adx': False, 'use_ema': True, 'use_spike': False, 'rsi_required': True, 'edge_k': 1.300969356018517, 'edge_cap': 0.33745669502035436, 'bull_strategy': 'breakout', 'bull_bb_std_mult': 2.143940073255386, 'bull_rsi_os': 38, 'bull_rsi_ob': 53, 'bull_adx_thresh': 10.49539791912877, 'bull_atr_min_pct': 0.02145244987191618, 'bull_atr_max_pct': 0.06273361832321507, 'bull_tp_mult': 1.291511118313615, 'bull_tsl_mult': 0.1712455019565052, 'bull_time_stop': 283, 'bull_use_sma': False, 'bull_use_ema': True, 'bull_use_atr': False, 'bull_use_adx': False, 'bull_use_spike': False, 'bull_rsi_required': True, 'bear_strategy': 'breakout', 'bear_bb_std_mult': 1.6634982514471366, 'bear_rsi_os': 31, 'bear_rsi_ob': 66, 'bear_adx_thresh': 5.014450164637462, 'bear_atr_min_pct': 0.007037273601160084, 'bear_atr_max_pct': 0.08454418742793102, 'bear_tp_mult': 1.9232567804042202, 'bear_tsl_mult': 0.6485359496732778, 'bear_time_stop': 245, 'bear_use_sma': False, 'bear_use_ema': False, 'bear_use_atr': True, 'bear_use_adx': True, 'bear_use_spike': False, 'bear_rsi_required': True, 'sideways_strategy': 'mean_reversion', 'sideways_bb_std_mult': 0.6844895571604139, 'sideways_rsi_os': 49, 'sideways_rsi_ob': 67, 'sideways_adx_thresh': 7.8098323116778126, 'sideways_atr_min_pct': 0.016768650775046724, 'sideways_atr_max_pct': 0.1223212173680291, 'sideways_tp_mult': 2.5880652788129512, 'sideways_tsl_mult': 0.4170940262136599, 'sideways_time_stop': 269, 'sideways_use_sma': False, 'sideways_use_ema': False, 'sideways_use_atr': True, 'sideways_use_adx': False, 'sideways_use_spike': False, 'sideways_rsi_required': True}.
[I 2025-08-29 20:02:11,313] Trial 217 finished with values: [-1000000000.0, 1000000000.0] and parameters: {'p_sma': 38, 'p_std': 55, 'p_atr': 23, 'p_adx': 18, 'rsi_period': 21, 'ema1': 7, 'ema2': 26, 'slip_atr_k': 0.006587101229673986, 'slip_spread_k': 0.05642645193670198, 'spread_hl_frac': 0.03507442208098041, 'bb_std_mult': 1.8241258132851066, 'rsi_os': 35, 'rsi_ob': 66, 'vol_spike': 0.15543527608085977, 'adx_thresh': 8.427456348900694, 'atr_min_pct': 0.01893704853307622, 'atr_max_pct': 0.14453561667993095, 'tp_mult': 1.9375965934126225, 'tsl_mult': 0.6285372305590644, 'strategy': 'mean_reversion', 'time_stop': 263, 'use_sma': True, 'use_atr': True, 'use_adx': False, 'use_ema': True, 'use_spike': False, 'rsi_required': False, 'edge_k': 1.2772649984233897, 'edge_cap': 0.26183206998748826, 'bull_strategy': 'breakout', 'bull_bb_std_mult': 2.162330587662503, 'bull_rsi_os': 37, 'bull_rsi_ob': 47, 'bull_adx_thresh': 10.459674953215853, 'bull_atr_min_pct': 0.007504936289395848, 'bull_atr_max_pct': 0.07168593868362912, 'bull_tp_mult': 1.4173914070675173, 'bull_tsl_mult': 0.15820760860241212, 'bull_time_stop': 267, 'bull_use_sma': False, 'bull_use_ema': False, 'bull_use_atr': False, 'bull_use_adx': False, 'bull_use_spike': False, 'bull_rsi_required': False, 'bear_strategy': 'breakout', 'bear_bb_std_mult': 3.1151642325737052, 'bear_rsi_os': 35, 'bear_rsi_ob': 67, 'bear_adx_thresh': 5.308043842046182, 'bear_atr_min_pct': 0.007224866055319953, 'bear_atr_max_pct': 0.08490590735600963, 'bear_tp_mult': 1.5249958911038608, 'bear_tsl_mult': 0.6688078913176266, 'bear_time_stop': 260, 'bear_use_sma': False, 'bear_use_ema': False, 'bear_use_atr': True, 'bear_use_adx': True, 'bear_use_spike': False, 'bear_rsi_required': False, 'sideways_strategy': 'mean_reversion', 'sideways_bb_std_mult': 2.1572087368934802, 'sideways_rsi_os': 50, 'sideways_rsi_ob': 64, 'sideways_adx_thresh': 29.258272045935264, 'sideways_atr_min_pct': 0.01313292437856366, 'sideways_atr_max_pct': 0.12255560090462012, 'sideways_tp_mult': 2.5724563960054736, 'sideways_tsl_mult': 0.47632686090707116, 'sideways_time_stop': 256, 'sideways_use_sma': False, 'sideways_use_ema': False, 'sideways_use_atr': True, 'sideways_use_adx': False, 'sideways_use_spike': False, 'sideways_rsi_required': True}.
[I 2025-08-29 20:02:12,553] Trial 220 finished with values: [-0.0037279064747999247, 0.0037382535735081606] and parameters: {'p_sma': 9, 'p_std': 53, 'p_atr': 10, 'p_adx': 18, 'rsi_period': 36, 'ema1': 13, 'ema2': 42, 'slip_atr_k': 0.21358820019018876, 'slip_spread_k': 0.4769227441293512, 'spread_hl_frac': 0.019920675335404626, 'bb_std_mult': 1.8276299061946197, 'rsi_os': 11, 'rsi_ob': 66, 'vol_spike': 0.17519177301125274, 'adx_thresh': 33.00966468911424, 'atr_min_pct': 0.012541317427145987, 'atr_max_pct': 0.036463873161750426, 'tp_mult': 1.4258017223342083, 'tsl_mult': 0.6139764886540784, 'strategy': 'mean_reversion', 'time_stop': 244, 'use_sma': True, 'use_atr': True, 'use_adx': False, 'use_ema': False, 'use_spike': False, 'rsi_required': False, 'edge_k': 1.3585767433742113, 'edge_cap': 0.6556764464230763, 'bull_strategy': 'breakout', 'bull_bb_std_mult': 1.549833366451855, 'bull_rsi_os': 48, 'bull_rsi_ob': 94, 'bull_adx_thresh': 31.44867542368933, 'bull_atr_min_pct': 0.0016430438357430046, 'bull_atr_max_pct': 0.07236077322609259, 'bull_tp_mult': 1.571497491283294, 'bull_tsl_mult': 0.5482202023054119, 'bull_time_stop': 274, 'bull_use_sma': False, 'bull_use_ema': False, 'bull_use_atr': False, 'bull_use_adx': True, 'bull_use_spike': False, 'bull_rsi_required': False, 'bear_strategy': 'breakout', 'bear_bb_std_mult': 2.244669478720032, 'bear_rsi_os': 46, 'bear_rsi_ob': 72, 'bear_adx_thresh': 5.955655809350798, 'bear_atr_min_pct': 0.02945948690605931, 'bear_atr_max_pct': 0.10279407858911765, 'bear_tp_mult': 1.0100182854551942, 'bear_tsl_mult': 0.7035231797852356, 'bear_time_stop': 138, 'bear_use_sma': False, 'bear_use_ema': False, 'bear_use_atr': False, 'bear_use_adx': False, 'bear_use_spike': False, 'bear_rsi_required': False, 'sideways_strategy': 'mean_reversion', 'sideways_bb_std_mult': 2.1835247310964796, 'sideways_rsi_os': 32, 'sideways_rsi_ob': 56, 'sideways_adx_thresh': 11.023788389530692, 'sideways_atr_min_pct': 0.012871692374798566, 'sideways_atr_max_pct': 0.1176000363587206, 'sideways_tp_mult': 2.793303089435543, 'sideways_tsl_mult': 0.47348231148880926, 'sideways_time_stop': 242, 'sideways_use_sma': False, 'sideways_use_ema': True, 'sideways_use_atr': False, 'sideways_use_adx': False, 'sideways_use_spike': False, 'sideways_rsi_required': True}.
[I 2025-08-29 20:02:12,553] Trial 219 finished with values: [-0.015132366523492369, 0.015145683260784379] and parameters: {'p_sma': 56, 'p_std': 53, 'p_atr': 23, 'p_adx': 18, 'rsi_period': 80, 'ema1': 7, 'ema2': 41, 'slip_atr_k': 0.08762914476683653, 'slip_spread_k': 0.8919508100931957, 'spread_hl_frac': 0.039151468579400724, 'bb_std_mult': 1.2872740023291163, 'rsi_os': 31, 'rsi_ob': 89, 'vol_spike': 0.17440535503126095, 'adx_thresh': 33.1330960141039, 'atr_min_pct': 0.01421577891781454, 'atr_max_pct': 0.036646225677125756, 'tp_mult': 2.9614966596743666, 'tsl_mult': 0.6112557648455123, 'strategy': 'mean_reversion', 'time_stop': 263, 'use_sma': False, 'use_atr': True, 'use_adx': False, 'use_ema': False, 'use_spike': False, 'rsi_required': False, 'edge_k': 1.3600395613530205, 'edge_cap': 0.6735505694278588, 'bull_strategy': 'breakout', 'bull_bb_std_mult': 0.8633360567196904, 'bull_rsi_os': 47, 'bull_rsi_ob': 94, 'bull_adx_thresh': 19.03464140361191, 'bull_atr_min_pct': 0.001693804636784384, 'bull_atr_max_pct': 0.05895150687174381, 'bull_tp_mult': 1.3179254297588685, 'bull_tsl_mult': 0.10035296508156594, 'bull_time_stop': 267, 'bull_use_sma': False, 'bull_use_ema': False, 'bull_use_atr': False, 'bull_use_adx': True, 'bull_use_spike': False, 'bull_rsi_required': False, 'bear_strategy': 'breakout', 'bear_bb_std_mult': 0.635548182635719, 'bear_rsi_os': 27, 'bear_rsi_ob': 72, 'bear_adx_thresh': 31.517713113653805, 'bear_atr_min_pct': 0.014251864228211673, 'bear_atr_max_pct': 0.10387983174306044, 'bear_tp_mult': 2.0007099303806952, 'bear_tsl_mult': 0.7033991287246575, 'bear_time_stop': 258, 'bear_use_sma': False, 'bear_use_ema': False, 'bear_use_atr': True, 'bear_use_adx': False, 'bear_use_spike': False, 'bear_rsi_required': False, 'sideways_strategy': 'mean_reversion', 'sideways_bb_std_mult': 2.152560593883601, 'sideways_rsi_os': 32, 'sideways_rsi_ob': 86, 'sideways_adx_thresh': 28.324193229494835, 'sideways_atr_min_pct': 0.028628242624452092, 'sideways_atr_max_pct': 0.12640585222562992, 'sideways_tp_mult': 2.1285068595347467, 'sideways_tsl_mult': 0.47629223202116466, 'sideways_time_stop': 240, 'sideways_use_sma': False, 'sideways_use_ema': True, 'sideways_use_atr': False, 'sideways_use_adx': False, 'sideways_use_spike': False, 'sideways_rsi_required': True}.
[I 2025-08-29 20:02:12,732] Trial 218 finished with values: [-0.0042095778734082545, 0.004491451816028206] and parameters: {'p_sma': 9, 'p_std': 53, 'p_atr': 8, 'p_adx': 18, 'rsi_period': 22, 'ema1': 14, 'ema2': 26, 'slip_atr_k': 0.03953010723024806, 'slip_spread_k': 0.6948259681300828, 'spread_hl_frac': 0.01931048344503918, 'bb_std_mult': 1.8154140534813028, 'rsi_os': 11, 'rsi_ob': 66, 'vol_spike': 0.17346524902109817, 'adx_thresh': 33.11438982560043, 'atr_min_pct': 0.014319272061983284, 'atr_max_pct': 0.08393601698985079, 'tp_mult': 2.1641581381196717, 'tsl_mult': 0.6078224490441095, 'strategy': 'mean_reversion', 'time_stop': 241, 'use_sma': False, 'use_atr': True, 'use_adx': False, 'use_ema': False, 'use_spike': False, 'rsi_required': False, 'edge_k': 1.370373404011233, 'edge_cap': 0.3926870308252072, 'bull_strategy': 'breakout', 'bull_bb_std_mult': 3.472490474738836, 'bull_rsi_os': 34, 'bull_rsi_ob': 47, 'bull_adx_thresh': 31.208597256708565, 'bull_atr_min_pct': 0.0014846965329855886, 'bull_atr_max_pct': 0.022766167845242637, 'bull_tp_mult': 1.3315769000950861, 'bull_tsl_mult': 0.5554547878698626, 'bull_time_stop': 231, 'bull_use_sma': False, 'bull_use_ema': False, 'bull_use_atr': False, 'bull_use_adx': True, 'bull_use_spike': False, 'bull_rsi_required': False, 'bear_strategy': 'breakout', 'bear_bb_std_mult': 3.1908629157776307, 'bear_rsi_os': 27, 'bear_rsi_ob': 72, 'bear_adx_thresh': 19.804165774665865, 'bear_atr_min_pct': 0.004318592765490672, 'bear_atr_max_pct': 0.052427502871458975, 'bear_tp_mult': 1.9971967627325027, 'bear_tsl_mult': 0.6981191801329151, 'bear_time_stop': 26, 'bear_use_sma': False, 'bear_use_ema': False, 'bear_use_atr': True, 'bear_use_adx': False, 'bear_use_spike': False, 'bear_rsi_required': False, 'sideways_strategy': 'mean_reversion', 'sideways_bb_std_mult': 2.1581925374464332, 'sideways_rsi_os': 32, 'sideways_rsi_ob': 46, 'sideways_adx_thresh': 7.808842269402012, 'sideways_atr_min_pct': 0.015049327911120791, 'sideways_atr_max_pct': 0.11667889221747858, 'sideways_tp_mult': 2.7616752769293766, 'sideways_tsl_mult': 0.7024684843810307, 'sideways_time_stop': 241, 'sideways_use_sma': False, 'sideways_use_ema': True, 'sideways_use_atr': False, 'sideways_use_adx': False, 'sideways_use_spike': False, 'sideways_rsi_required': True}.
[I 2025-08-29 20:02:42,598] Trial 223 finished with values: [-1000000000.0, 1000000000.0] and parameters: {'p_sma': 36, 'p_std': 17, 'p_atr': 30, 'p_adx': 17, 'rsi_period': 54, 'ema1': 14, 'ema2': 42, 'slip_atr_k': 0.2333634567356881, 'slip_spread_k': 0.2947846989732269, 'spread_hl_frac': 0.021522688645489677, 'bb_std_mult': 1.3435057331204256, 'rsi_os': 21, 'rsi_ob': 65, 'vol_spike': 0.011222685278606925, 'adx_thresh': 22.59279208811785, 'atr_min_pct': 0.012725212946918921, 'atr_max_pct': 0.03297905007982562, 'tp_mult': 2.3802628376602852, 'tsl_mult': 0.5221169781425599, 'strategy': 'breakout', 'time_stop': 284, 'use_sma': False, 'use_atr': True, 'use_adx': False, 'use_ema': False, 'use_spike': True, 'rsi_required': True, 'edge_k': 0.1163679345868519, 'edge_cap': 0.8640568067384904, 'bull_strategy': 'breakout', 'bull_bb_std_mult': 2.2612044412300594, 'bull_rsi_os': 43, 'bull_rsi_ob': 93, 'bull_adx_thresh': 18.609375782813437, 'bull_atr_min_pct': 0.022414967733830192, 'bull_atr_max_pct': 0.11386688077278127, 'bull_tp_mult': 1.5792815087947472, 'bull_tsl_mult': 0.6591408234582956, 'bull_time_stop': 113, 'bull_use_sma': False, 'bull_use_ema': True, 'bull_use_atr': True, 'bull_use_adx': True, 'bull_use_spike': False, 'bull_rsi_required': True, 'bear_strategy': 'breakout', 'bear_bb_std_mult': 1.9267509787380197, 'bear_rsi_os': 28, 'bear_rsi_ob': 56, 'bear_adx_thresh': 19.646233472283008, 'bear_atr_min_pct': 0.0042409940137953985, 'bear_atr_max_pct': 0.12929072331621327, 'bear_tp_mult': 1.857297354780305, 'bear_tsl_mult': 0.10371806425673752, 'bear_time_stop': 228, 'bear_use_sma': False, 'bear_use_ema': False, 'bear_use_atr': False, 'bear_use_adx': False, 'bear_use_spike': False, 'bear_rsi_required': False, 'sideways_strategy': 'mean_reversion', 'sideways_bb_std_mult': 2.0170752433180303, 'sideways_rsi_os': 30, 'sideways_rsi_ob': 58, 'sideways_adx_thresh': 31.487143430808054, 'sideways_atr_min_pct': 0.015116275565670816, 'sideways_atr_max_pct': 0.03847712000484207, 'sideways_tp_mult': 2.840809247133942, 'sideways_tsl_mult': 0.034362070136923106, 'sideways_time_stop': 254, 'sideways_use_sma': False, 'sideways_use_ema': True, 'sideways_use_atr': False, 'sideways_use_adx': True, 'sideways_use_spike': False, 'sideways_rsi_required': True}.
[I 2025-08-29 20:02:42,653] Trial 222 finished with values: [-1000000000.0, 1000000000.0] and parameters: {'p_sma': 36, 'p_std': 6, 'p_atr': 10, 'p_adx': 17, 'rsi_period': 53, 'ema1': 14, 'ema2': 32, 'slip_atr_k': 0.21231155153504283, 'slip_spread_k': 0.296187938657118, 'spread_hl_frac': 0.01970022029724836, 'bb_std_mult': 1.7070908093881347, 'rsi_os': 13, 'rsi_ob': 65, 'vol_spike': 0.16958271170510453, 'adx_thresh': 5.045247974906486, 'atr_min_pct': 0.012539360204316575, 'atr_max_pct': 0.015029005890933214, 'tp_mult': 2.4964319924769898, 'tsl_mult': 0.36055729006198534, 'strategy': 'breakout', 'time_stop': 278, 'use_sma': False, 'use_atr': True, 'use_adx': False, 'use_ema': False, 'use_spike': True, 'rsi_required': True, 'edge_k': 0.6568950144594259, 'edge_cap': 0.4392529500069008, 'bull_strategy': 'breakout', 'bull_bb_std_mult': 3.5029748474190154, 'bull_rsi_os': 42, 'bull_rsi_ob': 93, 'bull_adx_thresh': 29.542403676938665, 'bull_atr_min_pct': 0.022288522519857443, 'bull_atr_max_pct': 0.1037781328947074, 'bull_tp_mult': 1.57924486311322, 'bull_tsl_mult': 0.9259116151021609, 'bull_time_stop': 276, 'bull_use_sma': False, 'bull_use_ema': True, 'bull_use_atr': True, 'bull_use_adx': True, 'bull_use_spike': False, 'bull_rsi_required': True, 'bear_strategy': 'breakout', 'bear_bb_std_mult': 0.9617042352003267, 'bear_rsi_os': 28, 'bear_rsi_ob': 91, 'bear_adx_thresh': 7.383435908388533, 'bear_atr_min_pct': 0.005255511768789746, 'bear_atr_max_pct': 0.028137545139214695, 'bear_tp_mult': 1.8373606250103023, 'bear_tsl_mult': 0.6886707301061322, 'bear_time_stop': 184, 'bear_use_sma': False, 'bear_use_ema': False, 'bear_use_atr': False, 'bear_use_adx': False, 'bear_use_spike': False, 'bear_rsi_required': False, 'sideways_strategy': 'mean_reversion', 'sideways_bb_std_mult': 2.066393364817838, 'sideways_rsi_os': 18, 'sideways_rsi_ob': 45, 'sideways_adx_thresh': 11.07297821707197, 'sideways_atr_min_pct': 0.017785780687850396, 'sideways_atr_max_pct': 0.11722923299555245, 'sideways_tp_mult': 2.2581309497907736, 'sideways_tsl_mult': 0.9767008262815025, 'sideways_time_stop': 281, 'sideways_use_sma': False, 'sideways_use_ema': True, 'sideways_use_atr': False, 'sideways_use_adx': True, 'sideways_use_spike': False, 'sideways_rsi_required': True}.
[I 2025-08-29 20:02:42,685] Trial 221 finished with values: [-0.001945118586865635, 0.001900397657207744] and parameters: {'p_sma': 5, 'p_std': 53, 'p_atr': 24, 'p_adx': 10, 'rsi_period': 53, 'ema1': 13, 'ema2': 42, 'slip_atr_k': 0.1324720577147578, 'slip_spread_k': 0.7063702956648364, 'spread_hl_frac': 0.005141263686269225, 'bb_std_mult': 1.178001368787566, 'rsi_os': 55, 'rsi_ob': 65, 'vol_spike': 0.17722610798004965, 'adx_thresh': 32.926944057092015, 'atr_min_pct': 0.014406432647232632, 'atr_max_pct': 0.03480324431966658, 'tp_mult': 2.959654211848566, 'tsl_mult': 0.6007892076633015, 'strategy': 'breakout', 'time_stop': 275, 'use_sma': False, 'use_atr': True, 'use_adx': False, 'use_ema': False, 'use_spike': False, 'rsi_required': True, 'edge_k': 1.3669550156557606, 'edge_cap': 0.6017303756543864, 'bull_strategy': 'breakout', 'bull_bb_std_mult': 0.8255026314820747, 'bull_rsi_os': 39, 'bull_rsi_ob': 94, 'bull_adx_thresh': 16.40098001642095, 'bull_atr_min_pct': 0.0008488951066365925, 'bull_atr_max_pct': 0.13511647601454455, 'bull_tp_mult': 2.071359893386751, 'bull_tsl_mult': 0.12923258893792344, 'bull_time_stop': 270, 'bull_use_sma': False, 'bull_use_ema': True, 'bull_use_atr': False, 'bull_use_adx': True, 'bull_use_spike': False, 'bull_rsi_required': False, 'bear_strategy': 'breakout', 'bear_bb_std_mult': 1.1349839146075529, 'bear_rsi_os': 22, 'bear_rsi_ob': 69, 'bear_adx_thresh': 31.171370055862006, 'bear_atr_min_pct': 0.017312758077576464, 'bear_atr_max_pct': 0.07237485482029178, 'bear_tp_mult': 1.8409325222325101, 'bear_tsl_mult': 0.6983473527201725, 'bear_time_stop': 137, 'bear_use_sma': False, 'bear_use_ema': False, 'bear_use_atr': False, 'bear_use_adx': False, 'bear_use_spike': False, 'bear_rsi_required': False, 'sideways_strategy': 'mean_reversion', 'sideways_bb_std_mult': 2.009928509718317, 'sideways_rsi_os': 16, 'sideways_rsi_ob': 83, 'sideways_adx_thresh': 19.80908846626535, 'sideways_atr_min_pct': 0.015114805727768478, 'sideways_atr_max_pct': 0.14047548620254133, 'sideways_tp_mult': 2.4431497784125487, 'sideways_tsl_mult': 0.32614806009361585, 'sideways_time_stop': 242, 'sideways_use_sma': False, 'sideways_use_ema': True, 'sideways_use_atr': False, 'sideways_use_adx': False, 'sideways_use_spike': False, 'sideways_rsi_required': True}.
[I 2025-08-29 20:02:42,838] Trial 224 finished with values: [-0.006137679746115232, 0.006119355195784223] and parameters: {'p_sma': 36, 'p_std': 52, 'p_atr': 24, 'p_adx': 17, 'rsi_period': 53, 'ema1': 12, 'ema2': 35, 'slip_atr_k': 0.040492390080980184, 'slip_spread_k': 0.47241473795642597, 'spread_hl_frac': 0.0020195608635141596, 'bb_std_mult': 1.183694879638459, 'rsi_os': 11, 'rsi_ob': 66, 'vol_spike': 0.23645546127701095, 'adx_thresh': 18.2545037232092, 'atr_min_pct': 0.013870497179665214, 'atr_max_pct': 0.015123940104966926, 'tp_mult': 2.3807801973324128, 'tsl_mult': 0.14049527658995936, 'strategy': 'mean_reversion', 'time_stop': 284, 'use_sma': False, 'use_atr': True, 'use_adx': False, 'use_ema': False, 'use_spike': False, 'rsi_required': True, 'edge_k': 1.3678247073035619, 'edge_cap': 0.44241507633026966, 'bull_strategy': 'breakout', 'bull_bb_std_mult': 0.8258234012961889, 'bull_rsi_os': 42, 'bull_rsi_ob': 95, 'bull_adx_thresh': 18.652886125192847, 'bull_atr_min_pct': 0.022259096387938663, 'bull_atr_max_pct': 0.08421276982087397, 'bull_tp_mult': 1.5652977783533493, 'bull_tsl_mult': 0.7535163015217731, 'bull_time_stop': 275, 'bull_use_sma': False, 'bull_use_ema': True, 'bull_use_atr': False, 'bull_use_adx': True, 'bull_use_spike': False, 'bull_rsi_required': True, 'bear_strategy': 'breakout', 'bear_bb_std_mult': 1.1413728356544317, 'bear_rsi_os': 49, 'bear_rsi_ob': 69, 'bear_adx_thresh': 6.137662632069719, 'bear_atr_min_pct': 0.005263504212365504, 'bear_atr_max_pct': 0.1277152277030445, 'bear_tp_mult': 1.016928070556951, 'bear_tsl_mult': 0.6956608341459749, 'bear_time_stop': 187, 'bear_use_sma': False, 'bear_use_ema': False, 'bear_use_atr': False, 'bear_use_adx': False, 'bear_use_spike': False, 'bear_rsi_required': False, 'sideways_strategy': 'mean_reversion', 'sideways_bb_std_mult': 2.946526987295623, 'sideways_rsi_os': 29, 'sideways_rsi_ob': 82, 'sideways_adx_thresh': 11.301538881182028, 'sideways_atr_min_pct': 0.005047546861422258, 'sideways_atr_max_pct': 0.11675421115500872, 'sideways_tp_mult': 2.1162575359200324, 'sideways_tsl_mult': 0.33803240258333045, 'sideways_time_stop': 254, 'sideways_use_sma': False, 'sideways_use_ema': True, 'sideways_use_atr': False, 'sideways_use_adx': True, 'sideways_use_spike': False, 'sideways_rsi_required': True}.
