[I 2025-08-29 20:53:09,291] Trial 657 finished with values: [-1000000000.0, 1000000000.0] and parameters: {'p_sma': 20, 'p_std': 47, 'p_atr': 26, 'p_adx': 13, 'rsi_period': 39, 'ema1': 27, 'ema2': 43, 'slip_atr_k': 0.19774002464281895, 'slip_spread_k': 0.12985735156257544, 'spread_hl_frac': 0.020096479287614478, 'bb_std_mult': 1.730427423318367, 'rsi_os': 11, 'rsi_ob': 85, 'vol_spike': 0.20672047423847928, 'adx_thresh': 18.360871191212343, 'atr_min_pct': 0.022670804695113674, 'atr_max_pct': 0.0342116594402872, 'tp_mult': 1.078550176625424, 'tsl_mult': 0.867826953432678, 'strategy': 'mean_reversion', 'time_stop': 18, 'use_sma': False, 'use_atr': False, 'use_adx': False, 'use_ema': True, 'use_spike': False, 'rsi_required': True, 'edge_k': 0.9778186634946325, 'edge_cap': 0.6226634060733678, 'bull_strategy': 'breakout', 'bull_bb_std_mult': 2.9654149730289023, 'bull_rsi_os': 20, 'bull_rsi_ob': 75, 'bull_adx_thresh': 13.045408626109017, 'bull_atr_min_pct': 0.013536454645427272, 'bull_atr_max_pct': 0.03910177532496389, 'bull_tp_mult': 2.657111850232929, 'bull_tsl_mult': 0.8515195861273726, 'bull_time_stop': 29, 'bull_use_sma': False, 'bull_use_ema': False, 'bull_use_atr': True, 'bull_use_adx': True, 'bull_use_spike': True, 'bull_rsi_required': False, 'bear_strategy': 'mean_reversion', 'bear_bb_std_mult': 2.780359672923262, 'bear_rsi_os': 45, 'bear_rsi_ob': 74, 'bear_adx_thresh': 20.24971042285628, 'bear_atr_min_pct': 0.00757229150395749, 'bear_atr_max_pct': 0.05700638781778328, 'bear_tp_mult': 2.7081062607668027, 'bear_tsl_mult': 0.93559997074209, 'bear_time_stop': 52, 'bear_use_sma': False, 'bear_use_ema': True, 'bear_use_atr': False, 'bear_use_adx': True, 'bear_use_spike': False, 'bear_rsi_required': True, 'sideways_strategy': 'breakout', 'sideways_bb_std_mult': 1.625374728170837, 'sideways_rsi_os': 44, 'sideways_rsi_ob': 80, 'sideways_adx_thresh': 32.74265291145194, 'sideways_atr_min_pct': 0.0071409485701255495, 'sideways_atr_max_pct': 0.020343916924638543, 'sideways_tp_mult': 1.0119097193619357, 'sideways_tsl_mult': 0.7206533416003476, 'sideways_time_stop': 193, 'sideways_use_sma': True, 'sideways_use_ema': False, 'sideways_use_atr': False, 'sideways_use_adx': False, 'sideways_use_spike': True, 'sideways_rsi_required': False}.
[I 2025-08-29 20:53:09,509] Trial 658 finished with values: [-0.0029128375838592957, 0.0029867937921330785] and parameters: {'p_sma': 21, 'p_std': 60, 'p_atr': 14, 'p_adx': 13, 'rsi_period': 39, 'ema1': 27, 'ema2': 47, 'slip_atr_k': 0.006723764078101249, 'slip_spread_k': 0.9340536858065214, 'spread_hl_frac': 0.046622265667621975, 'bb_std_mult': 1.744077507692245, 'rsi_os': 9, 'rsi_ob': 93, 'vol_spike': 0.16479232045693257, 'adx_thresh': 14.021019184902713, 'atr_min_pct': 0.02051471725981054, 'atr_max_pct': 0.033930241045494205, 'tp_mult': 1.976421324681736, 'tsl_mult': 0.6552795872510817, 'strategy': 'mean_reversion', 'time_stop': 164, 'use_sma': False, 'use_atr': False, 'use_adx': False, 'use_ema': True, 'use_spike': False, 'rsi_required': True, 'edge_k': 1.129069441219059, 'edge_cap': 0.615374417670592, 'bull_strategy': 'breakout', 'bull_bb_std_mult': 2.98073624524941, 'bull_rsi_os': 48, 'bull_rsi_ob': 57, 'bull_adx_thresh': 12.928664195951576, 'bull_atr_min_pct': 0.012495322732711, 'bull_atr_max_pct': 0.08550510664098213, 'bull_tp_mult': 2.6599369707800022, 'bull_tsl_mult': 0.852210250732437, 'bull_time_stop': 45, 'bull_use_sma': False, 'bull_use_ema': False, 'bull_use_atr': True, 'bull_use_adx': True, 'bull_use_spike': True, 'bull_rsi_required': False, 'bear_strategy': 'mean_reversion', 'bear_bb_std_mult': 0.8003985181348319, 'bear_rsi_os': 20, 'bear_rsi_ob': 68, 'bear_adx_thresh': 22.775256869668876, 'bear_atr_min_pct': 0.021443226659895405, 'bear_atr_max_pct': 0.05681443003999366, 'bear_tp_mult': 1.25669393710435, 'bear_tsl_mult': 0.9323581056391627, 'bear_time_stop': 261, 'bear_use_sma': False, 'bear_use_ema': False, 'bear_use_atr': True, 'bear_use_adx': True, 'bear_use_spike': False, 'bear_rsi_required': True, 'sideways_strategy': 'breakout', 'sideways_bb_std_mult': 3.203956800120652, 'sideways_rsi_os': 51, 'sideways_rsi_ob': 65, 'sideways_adx_thresh': 31.66376185963793, 'sideways_atr_min_pct': 0.0045953638449183, 'sideways_atr_max_pct': 0.0531149948312416, 'sideways_tp_mult': 1.083162796066732, 'sideways_tsl_mult': 0.21416996466382449, 'sideways_time_stop': 203, 'sideways_use_sma': True, 'sideways_use_ema': True, 'sideways_use_atr': False, 'sideways_use_adx': True, 'sideways_use_spike': True, 'sideways_rsi_required': False}.
[I 2025-08-29 20:53:10,750] Trial 660 finished with values: [-0.007952353686915714, 0.007995786791406539] and parameters: {'p_sma': 21, 'p_std': 54, 'p_atr': 26, 'p_adx': 10, 'rsi_period': 33, 'ema1': 27, 'ema2': 46, 'slip_atr_k': 0.2423373249403273, 'slip_spread_k': 0.13629716175915033, 'spread_hl_frac': 0.04897134521048221, 'bb_std_mult': 0.7500472198488468, 'rsi_os': 34, 'rsi_ob': 73, 'vol_spike': 0.001779776860944493, 'adx_thresh': 13.860250399755133, 'atr_min_pct': 0.020552230782332058, 'atr_max_pct': 0.024067000041524643, 'tp_mult': 2.641929612473643, 'tsl_mult': 0.3655134089019217, 'strategy': 'mean_reversion', 'time_stop': 184, 'use_sma': False, 'use_atr': False, 'use_adx': False, 'use_ema': True, 'use_spike': False, 'rsi_required': True, 'edge_k': 0.22463586694304782, 'edge_cap': 0.6268086679378438, 'bull_strategy': 'breakout', 'bull_bb_std_mult': 2.977741419437177, 'bull_rsi_os': 20, 'bull_rsi_ob': 73, 'bull_adx_thresh': 6.69020334603324, 'bull_atr_min_pct': 0.01629970601590274, 'bull_atr_max_pct': 0.10749881638287799, 'bull_tp_mult': 2.4885454405658423, 'bull_tsl_mult': 0.8149904666900487, 'bull_time_stop': 45, 'bull_use_sma': False, 'bull_use_ema': False, 'bull_use_atr': False, 'bull_use_adx': True, 'bull_use_spike': True, 'bull_rsi_required': True, 'bear_strategy': 'breakout', 'bear_bb_std_mult': 0.5036197457778073, 'bear_rsi_os': 40, 'bear_rsi_ob': 71, 'bear_adx_thresh': 22.372434032697, 'bear_atr_min_pct': 0.006092347278193753, 'bear_atr_max_pct': 0.058431048425910126, 'bear_tp_mult': 2.690076242370126, 'bear_tsl_mult': 0.9340858667807088, 'bear_time_stop': 145, 'bear_use_sma': False, 'bear_use_ema': False, 'bear_use_atr': True, 'bear_use_adx': True, 'bear_use_spike': False, 'bear_rsi_required': False, 'sideways_strategy': 'breakout', 'sideways_bb_std_mult': 2.321955984597427, 'sideways_rsi_os': 51, 'sideways_rsi_ob': 78, 'sideways_adx_thresh': 21.850837539377093, 'sideways_atr_min_pct': 0.0038873364225002318, 'sideways_atr_max_pct': 0.0190737588217139, 'sideways_tp_mult': 1.082299117462634, 'sideways_tsl_mult': 0.7151344497487755, 'sideways_time_stop': 72, 'sideways_use_sma': False, 'sideways_use_ema': False, 'sideways_use_atr': True, 'sideways_use_adx': False, 'sideways_use_spike': True, 'sideways_rsi_required': False}.
[I 2025-08-29 20:53:11,088] Trial 659 finished with values: [-0.0018861963752216937, 0.001961752022605467] and parameters: {'p_sma': 21, 'p_std': 56, 'p_atr': 14, 'p_adx': 10, 'rsi_period': 33, 'ema1': 15, 'ema2': 37, 'slip_atr_k': 0.0071358433777902125, 'slip_spread_k': 0.026360270832219646, 'spread_hl_frac': 0.046817944290679786, 'bb_std_mult': 1.700285619551055, 'rsi_os': 9, 'rsi_ob': 56, 'vol_spike': 0.20370713305723845, 'adx_thresh': 13.927552679888494, 'atr_min_pct': 0.02028261789637321, 'atr_max_pct': 0.03424031280234815, 'tp_mult': 1.0835457507472144, 'tsl_mult': 0.503764679360874, 'strategy': 'mean_reversion', 'time_stop': 166, 'use_sma': False, 'use_atr': False, 'use_adx': False, 'use_ema': True, 'use_spike': False, 'rsi_required': True, 'edge_k': 0.14558360598732212, 'edge_cap': 0.15788758428760385, 'bull_strategy': 'breakout', 'bull_bb_std_mult': 2.986072220745131, 'bull_rsi_os': 30, 'bull_rsi_ob': 75, 'bull_adx_thresh': 27.95280195974557, 'bull_atr_min_pct': 0.028617593667618162, 'bull_atr_max_pct': 0.10622152633605823, 'bull_tp_mult': 2.653342253543184, 'bull_tsl_mult': 0.855247325975336, 'bull_time_stop': 28, 'bull_use_sma': False, 'bull_use_ema': False, 'bull_use_atr': True, 'bull_use_adx': True, 'bull_use_spike': True, 'bull_rsi_required': True, 'bear_strategy': 'mean_reversion', 'bear_bb_std_mult': 0.5022952319695089, 'bear_rsi_os': 42, 'bear_rsi_ob': 71, 'bear_adx_thresh': 22.590193586657882, 'bear_atr_min_pct': 0.02006705596231822, 'bear_atr_max_pct': 0.045786033193692066, 'bear_tp_mult': 2.993710065550047, 'bear_tsl_mult': 0.9283207534052872, 'bear_time_stop': 114, 'bear_use_sma': False, 'bear_use_ema': False, 'bear_use_atr': True, 'bear_use_adx': True, 'bear_use_spike': False, 'bear_rsi_required': True, 'sideways_strategy': 'breakout', 'sideways_bb_std_mult': 2.344727255680585, 'sideways_rsi_os': 46, 'sideways_rsi_ob': 78, 'sideways_adx_thresh': 21.475742004361503, 'sideways_atr_min_pct': 0.00471435541316483, 'sideways_atr_max_pct': 0.01922447327834058, 'sideways_tp_mult': 1.077257588728352, 'sideways_tsl_mult': 0.7142424206176611, 'sideways_time_stop': 191, 'sideways_use_sma': True, 'sideways_use_ema': True, 'sideways_use_atr': False, 'sideways_use_adx': True, 'sideways_use_spike': True, 'sideways_rsi_required': False}.
[I 2025-08-29 20:53:11,833] Trial 664 finished with values: [-1000000000.0, 1000000000.0] and parameters: {'p_sma': 60, 'p_std': 31, 'p_atr': 30, 'p_adx': 12, 'rsi_period': 51, 'ema1': 7, 'ema2': 30, 'slip_atr_k': 0.1035885504127937, 'slip_spread_k': 0.21618399195106278, 'spread_hl_frac': 0.04805336321888299, 'bb_std_mult': 0.8323383743775814, 'rsi_os': 8, 'rsi_ob': 83, 'vol_spike': 0.12695419654612003, 'adx_thresh': 11.496710021700135, 'atr_min_pct': 0.02902151892647655, 'atr_max_pct': 0.02602612616071334, 'tp_mult': 1.2533177372900033, 'tsl_mult': 0.001821688012499767, 'strategy': 'breakout', 'time_stop': 155, 'use_sma': True, 'use_atr': True, 'use_adx': False, 'use_ema': True, 'use_spike': True, 'rsi_required': False, 'edge_k': 1.0789576785663246, 'edge_cap': 0.5978568017408152, 'bull_strategy': 'mean_reversion', 'bull_bb_std_mult': 3.0561558787306793, 'bull_rsi_os': 21, 'bull_rsi_ob': 46, 'bull_adx_thresh': 22.660037295411424, 'bull_atr_min_pct': 0.010583893661660905, 'bull_atr_max_pct': 0.09100903565859092, 'bull_tp_mult': 2.729017744214679, 'bull_tsl_mult': 0.89013723356417, 'bull_time_stop': 237, 'bull_use_sma': True, 'bull_use_ema': True, 'bull_use_atr': False, 'bull_use_adx': False, 'bull_use_spike': True, 'bull_rsi_required': False, 'bear_strategy': 'breakout', 'bear_bb_std_mult': 2.7121608592407354, 'bear_rsi_os': 30, 'bear_rsi_ob': 95, 'bear_adx_thresh': 21.765093410785894, 'bear_atr_min_pct': 0.014786549731138651, 'bear_atr_max_pct': 0.097549799750062, 'bear_tp_mult': 2.2868154323378804, 'bear_tsl_mult': 0.8965065319206912, 'bear_time_stop': 37, 'bear_use_sma': True, 'bear_use_ema': True, 'bear_use_atr': False, 'bear_use_adx': True, 'bear_use_spike': True, 'bear_rsi_required': False, 'sideways_strategy': 'breakout', 'sideways_bb_std_mult': 2.4051923027233006, 'sideways_rsi_os': 34, 'sideways_rsi_ob': 87, 'sideways_adx_thresh': 8.645656142981853, 'sideways_atr_min_pct': 0.018447771917077135, 'sideways_atr_max_pct': 0.022707608608899088, 'sideways_tp_mult': 1.1368116684620229, 'sideways_tsl_mult': 0.6746357937093955, 'sideways_time_stop': 167, 'sideways_use_sma': False, 'sideways_use_ema': False, 'sideways_use_atr': True, 'sideways_use_adx': False, 'sideways_use_spike': False, 'sideways_rsi_required': True}.
[I 2025-08-29 20:53:39,731] Trial 662 finished with values: [-0.003566260944001809, 0.0038463981433377076] and parameters: {'p_sma': 60, 'p_std': 54, 'p_atr': 18, 'p_adx': 12, 'rsi_period': 33, 'ema1': 26, 'ema2': 46, 'slip_atr_k': 0.02098430681346354, 'slip_spread_k': 0.030719533056260268, 'spread_hl_frac': 0.048897290017645825, 'bb_std_mult': 0.969244126517069, 'rsi_os': 23, 'rsi_ob': 73, 'vol_spike': 0.12686335291972073, 'adx_thresh': 11.359204617523686, 'atr_min_pct': 0.019204202680678878, 'atr_max_pct': 0.024403715570918656, 'tp_mult': 1.2628525541971196, 'tsl_mult': 0.890211658977455, 'strategy': 'breakout', 'time_stop': 232, 'use_sma': True, 'use_atr': True, 'use_adx': False, 'use_ema': True, 'use_spike': False, 'rsi_required': False, 'edge_k': 0.15989755602698164, 'edge_cap': 0.5886790290514773, 'bull_strategy': 'mean_reversion', 'bull_bb_std_mult': 3.500694605716027, 'bull_rsi_os': 44, 'bull_rsi_ob': 73, 'bull_adx_thresh': 11.528511571693777, 'bull_atr_min_pct': 0.01630567910821683, 'bull_atr_max_pct': 0.10776477364697415, 'bull_tp_mult': 2.4793473940687023, 'bull_tsl_mult': 0.9124095296847283, 'bull_time_stop': 237, 'bull_use_sma': True, 'bull_use_ema': False, 'bull_use_atr': False, 'bull_use_adx': False, 'bull_use_spike': True, 'bull_rsi_required': True, 'bear_strategy': 'breakout', 'bear_bb_std_mult': 2.71367613357461, 'bear_rsi_os': 30, 'bear_rsi_ob': 93, 'bear_adx_thresh': 27.293220602184764, 'bear_atr_min_pct': 0.00589398817353253, 'bear_atr_max_pct': 0.13216718208709138, 'bear_tp_mult': 1.1832717592206774, 'bear_tsl_mult': 0.8948357077405541, 'bear_time_stop': 143, 'bear_use_sma': True, 'bear_use_ema': False, 'bear_use_atr': True, 'bear_use_adx': True, 'bear_use_spike': True, 'bear_rsi_required': False, 'sideways_strategy': 'breakout', 'sideways_bb_std_mult': 2.3337463306460755, 'sideways_rsi_os': 34, 'sideways_rsi_ob': 78, 'sideways_adx_thresh': 24.783207034001453, 'sideways_atr_min_pct': 0.003902043912177897, 'sideways_atr_max_pct': 0.11858335620025079, 'sideways_tp_mult': 1.2038890426393842, 'sideways_tsl_mult': 0.6959763758699615, 'sideways_time_stop': 166, 'sideways_use_sma': False, 'sideways_use_ema': False, 'sideways_use_atr': True, 'sideways_use_adx': False, 'sideways_use_spike': False, 'sideways_rsi_required': False}.
[I 2025-08-29 20:53:39,911] Trial 663 finished with values: [-1000000000.0, 1000000000.0] and parameters: {'p_sma': 25, 'p_std': 31, 'p_atr': 23, 'p_adx': 28, 'rsi_period': 35, 'ema1': 26, 'ema2': 24, 'slip_atr_k': 0.019713784532057813, 'slip_spread_k': 0.16548982360610348, 'spread_hl_frac': 0.04821909522062237, 'bb_std_mult': 1.6615261017050182, 'rsi_os': 8, 'rsi_ob': 50, 'vol_spike': 0.17627426156245907, 'adx_thresh': 11.92212527132306, 'atr_min_pct': 0.019226080298734717, 'atr_max_pct': 0.03998825448465995, 'tp_mult': 1.2936196449144823, 'tsl_mult': 0.5019436216558146, 'strategy': 'breakout', 'time_stop': 219, 'use_sma': True, 'use_atr': True, 'use_adx': False, 'use_ema': True, 'use_spike': True, 'rsi_required': False, 'edge_k': 1.0734830551219356, 'edge_cap': 0.5860488179511121, 'bull_strategy': 'mean_reversion', 'bull_bb_std_mult': 3.057150602619269, 'bull_rsi_os': 11, 'bull_rsi_ob': 72, 'bull_adx_thresh': 25.750609303236853, 'bull_atr_min_pct': 0.028573301489743495, 'bull_atr_max_pct': 0.12384098722640749, 'bull_tp_mult': 2.736064361966688, 'bull_tsl_mult': 0.29328835904092926, 'bull_time_stop': 32, 'bull_use_sma': True, 'bull_use_ema': True, 'bull_use_atr': True, 'bull_use_adx': False, 'bull_use_spike': True, 'bull_rsi_required': True, 'bear_strategy': 'breakout', 'bear_bb_std_mult': 2.731706053110325, 'bear_rsi_os': 30, 'bear_rsi_ob': 66, 'bear_adx_thresh': 27.451132316493883, 'bear_atr_min_pct': 0.014823999786049796, 'bear_atr_max_pct': 0.02675826388395066, 'bear_tp_mult': 1.1695633775851877, 'bear_tsl_mult': 0.8997226529193246, 'bear_time_stop': 36, 'bear_use_sma': True, 'bear_use_ema': True, 'bear_use_atr': False, 'bear_use_adx': True, 'bear_use_spike': True, 'bear_rsi_required': False, 'sideways_strategy': 'breakout', 'sideways_bb_std_mult': 2.355754269274482, 'sideways_rsi_os': 46, 'sideways_rsi_ob': 81, 'sideways_adx_thresh': 34.47581058719954, 'sideways_atr_min_pct': 0.0049707025539077665, 'sideways_atr_max_pct': 0.022931173499887065, 'sideways_tp_mult': 1.1355321116266859, 'sideways_tsl_mult': 0.6930307614990232, 'sideways_time_stop': 191, 'sideways_use_sma': False, 'sideways_use_ema': False, 'sideways_use_atr': False, 'sideways_use_adx': False, 'sideways_use_spike': False, 'sideways_rsi_required': True}.
[I 2025-08-29 20:53:41,091] Trial 661 finished with values: [-0.010848786577830838, 0.010838040949167203] and parameters: {'p_sma': 21, 'p_std': 54, 'p_atr': 26, 'p_adx': 13, 'rsi_period': 28, 'ema1': 26, 'ema2': 53, 'slip_atr_k': 0.24170402754490877, 'slip_spread_k': 0.9366941240788045, 'spread_hl_frac': 0.04085938997157022, 'bb_std_mult': 1.6737505064376392, 'rsi_os': 9, 'rsi_ob': 93, 'vol_spike': 0.05540634976998182, 'adx_thresh': 11.193036686019004, 'atr_min_pct': 0.020584044150054798, 'atr_max_pct': 0.024247127275971392, 'tp_mult': 1.2606909560156565, 'tsl_mult': 0.8895367952273165, 'strategy': 'mean_reversion', 'time_stop': 232, 'use_sma': False, 'use_atr': False, 'use_adx': False, 'use_ema': True, 'use_spike': False, 'rsi_required': True, 'edge_k': 1.0760656758794225, 'edge_cap': 0.5923335779399332, 'bull_strategy': 'breakout', 'bull_bb_std_mult': 1.3533470250101614, 'bull_rsi_os': 30, 'bull_rsi_ob': 57, 'bull_adx_thresh': 6.567786539516792, 'bull_atr_min_pct': 0.0026705391789272146, 'bull_atr_max_pct': 0.08562880561419611, 'bull_tp_mult': 1.7709035591716011, 'bull_tsl_mult': 0.8121888749177844, 'bull_time_stop': 44, 'bull_use_sma': False, 'bull_use_ema': False, 'bull_use_atr': False, 'bull_use_adx': True, 'bull_use_spike': True, 'bull_rsi_required': True, 'bear_strategy': 'breakout', 'bear_bb_std_mult': 2.997693986952947, 'bear_rsi_os': 30, 'bear_rsi_ob': 68, 'bear_adx_thresh': 27.609320645819295, 'bear_atr_min_pct': 0.006090631442472895, 'bear_atr_max_pct': 0.13296524658107928, 'bear_tp_mult': 2.9901561939709866, 'bear_tsl_mult': 0.9291804724458517, 'bear_time_stop': 42, 'bear_use_sma': False, 'bear_use_ema': False, 'bear_use_atr': True, 'bear_use_adx': True, 'bear_use_spike': False, 'bear_rsi_required': False, 'sideways_strategy': 'breakout', 'sideways_bb_std_mult': 1.1620152325306115, 'sideways_rsi_os': 46, 'sideways_rsi_ob': 78, 'sideways_adx_thresh': 6.158999283490273, 'sideways_atr_min_pct': 0.019727254099448335, 'sideways_atr_max_pct': 0.045848406658366085, 'sideways_tp_mult': 2.9461209566424698, 'sideways_tsl_mult': 0.6970494633755371, 'sideways_time_stop': 190, 'sideways_use_sma': False, 'sideways_use_ema': True, 'sideways_use_atr': True, 'sideways_use_adx': True, 'sideways_use_spike': True, 'sideways_rsi_required': False}.
[I 2025-08-29 20:53:41,970] Trial 665 finished with values: [-1000000000.0, 1000000000.0] and parameters: {'p_sma': 45, 'p_std': 56, 'p_atr': 18, 'p_adx': 22, 'rsi_period': 63, 'ema1': 26, 'ema2': 39, 'slip_atr_k': 0.01955938073134148, 'slip_spread_k': 0.26984194575883647, 'spread_hl_frac': 0.04999097997187969, 'bb_std_mult': 0.952800539765065, 'rsi_os': 49, 'rsi_ob': 81, 'vol_spike': 0.1387252850269019, 'adx_thresh': 11.962730222764273, 'atr_min_pct': 0.0027006566438760957, 'atr_max_pct': 0.030990447167405354, 'tp_mult': 1.2866633845042386, 'tsl_mult': 0.8423004033649292, 'strategy': 'mean_reversion', 'time_stop': 158, 'use_sma': True, 'use_atr': False, 'use_adx': False, 'use_ema': True, 'use_spike': False, 'rsi_required': False, 'edge_k': 1.5165548343336326, 'edge_cap': 0.5867183849507511, 'bull_strategy': 'mean_reversion', 'bull_bb_std_mult': 3.061750767985277, 'bull_rsi_os': 44, 'bull_rsi_ob': 91, 'bull_adx_thresh': 25.831479205783612, 'bull_atr_min_pct': 0.017202796881891264, 'bull_atr_max_pct': 0.12391788515020817, 'bull_tp_mult': 2.59626256063439, 'bull_tsl_mult': 0.34935947304126935, 'bull_time_stop': 83, 'bull_use_sma': True, 'bull_use_ema': False, 'bull_use_atr': True, 'bull_use_adx': False, 'bull_use_spike': True, 'bull_rsi_required': False, 'bear_strategy': 'breakout', 'bear_bb_std_mult': 3.359535797471112, 'bear_rsi_os': 29, 'bear_rsi_ob': 89, 'bear_adx_thresh': 27.41748659456648, 'bear_atr_min_pct': 0.012786962239275872, 'bear_atr_max_pct': 0.13239385414234264, 'bear_tp_mult': 2.5015089162012676, 'bear_tsl_mult': 0.9041594009378593, 'bear_time_stop': 253, 'bear_use_sma': False, 'bear_use_ema': True, 'bear_use_atr': False, 'bear_use_adx': True, 'bear_use_spike': True, 'bear_rsi_required': False, 'sideways_strategy': 'breakout', 'sideways_bb_std_mult': 1.1343412595781412, 'sideways_rsi_os': 47, 'sideways_rsi_ob': 81, 'sideways_adx_thresh': 31.660254497855117, 'sideways_atr_min_pct': 0.005466420652624377, 'sideways_atr_max_pct': 0.11874963166354952, 'sideways_tp_mult': 2.9347142723521773, 'sideways_tsl_mult': 0.2735979230358466, 'sideways_time_stop': 191, 'sideways_use_sma': False, 'sideways_use_ema': False, 'sideways_use_atr': False, 'sideways_use_adx': False, 'sideways_use_spike': False, 'sideways_rsi_required': False}.
