[I 2025-08-29 20:07:20,891] Trial 260 finished with values: [-0.023017281103356435, 0.02299216972464686] and parameters: {'p_sma': 40, 'p_std': 51, 'p_atr': 24, 'p_adx': 11, 'rsi_period': 31, 'ema1': 23, 'ema2': 45, 'slip_atr_k': 0.04005550768268902, 'slip_spread_k': 0.1666700222687046, 'spread_hl_frac': 0.04303684244928211, 'bb_std_mult': 1.2139822241137828, 'rsi_os': 19, 'rsi_ob': 63, 'vol_spike': 0.18386858469286443, 'adx_thresh': 12.40712958191546, 'atr_min_pct': 0.014396388387442297, 'atr_max_pct': 0.043519125217239385, 'tp_mult': 1.9283980764836162, 'tsl_mult': 0.34430860867046464, 'strategy': 'mean_reversion', 'time_stop': 161, 'use_sma': True, 'use_atr': True, 'use_adx': False, 'use_ema': False, 'use_spike': False, 'rsi_required': False, 'edge_k': 0.704298252311254, 'edge_cap': 0.7070521924073494, 'bull_strategy': 'mean_reversion', 'bull_bb_std_mult': 1.659003465487625, 'bull_rsi_os': 55, 'bull_rsi_ob': 59, 'bull_adx_thresh': 9.145252242433436, 'bull_atr_min_pct': 0.0005569675248887167, 'bull_atr_max_pct': 0.02843777987027536, 'bull_tp_mult': 1.3649439836979562, 'bull_tsl_mult': 0.10187665673386267, 'bull_time_stop': 131, 'bull_use_sma': True, 'bull_use_ema': False, 'bull_use_atr': True, 'bull_use_adx': True, 'bull_use_spike': False, 'bull_rsi_required': True, 'bear_strategy': 'breakout', 'bear_bb_std_mult': 1.2205185125184863, 'bear_rsi_os': 35, 'bear_rsi_ob': 70, 'bear_adx_thresh': 6.301761391036122, 'bear_atr_min_pct': 0.006488713460775746, 'bear_atr_max_pct': 0.04245542244503047, 'bear_tp_mult': 1.0985014436426537, 'bear_tsl_mult': 0.4670995712898012, 'bear_time_stop': 5, 'bear_use_sma': False, 'bear_use_ema': True, 'bear_use_atr': False, 'bear_use_adx': False, 'bear_use_spike': True, 'bear_rsi_required': False, 'sideways_strategy': 'breakout', 'sideways_bb_std_mult': 1.1033473095091684, 'sideways_rsi_os': 17, 'sideways_rsi_ob': 78, 'sideways_adx_thresh': 18.037823325931072, 'sideways_atr_min_pct': 0.005586897710820785, 'sideways_atr_max_pct': 0.0618293240098743, 'sideways_tp_mult': 2.6875030154794564, 'sideways_tsl_mult': 0.9562257936102523, 'sideways_time_stop': 16, 'sideways_use_sma': False, 'sideways_use_ema': True, 'sideways_use_atr': True, 'sideways_use_adx': True, 'sideways_use_spike': False, 'sideways_rsi_required': False}.
[I 2025-08-29 20:07:21,051] Trial 259 finished with values: [-0.0006803045739779412, 0.0015047582598713889] and parameters: {'p_sma': 40, 'p_std': 52, 'p_atr': 24, 'p_adx': 16, 'rsi_period': 31, 'ema1': 23, 'ema2': 45, 'slip_atr_k': 0.036606510042198705, 'slip_spread_k': 0.5552862861866928, 'spread_hl_frac': 0.02510509202040315, 'bb_std_mult': 1.9601172095994273, 'rsi_os': 17, 'rsi_ob': 94, 'vol_spike': 0.25215988340172607, 'adx_thresh': 31.022967514126748, 'atr_min_pct': 0.014699842511033545, 'atr_max_pct': 0.04717189056634567, 'tp_mult': 1.6757785836348948, 'tsl_mult': 0.6447394933749685, 'strategy': 'mean_reversion', 'time_stop': 160, 'use_sma': True, 'use_atr': True, 'use_adx': False, 'use_ema': False, 'use_spike': True, 'rsi_required': False, 'edge_k': 1.1932825138165115, 'edge_cap': 0.7567019457936401, 'bull_strategy': 'mean_reversion', 'bull_bb_std_mult': 1.677741093141903, 'bull_rsi_os': 38, 'bull_rsi_ob': 60, 'bull_adx_thresh': 8.43280460740408, 'bull_atr_min_pct': 0.0006413313932082108, 'bull_atr_max_pct': 0.028305368033073458, 'bull_tp_mult': 2.4401367810599286, 'bull_tsl_mult': 0.0952564044575768, 'bull_time_stop': 161, 'bull_use_sma': True, 'bull_use_ema': True, 'bull_use_atr': True, 'bull_use_adx': False, 'bull_use_spike': False, 'bull_rsi_required': True, 'bear_strategy': 'breakout', 'bear_bb_std_mult': 1.154178286704831, 'bear_rsi_os': 30, 'bear_rsi_ob': 70, 'bear_adx_thresh': 6.368898978718841, 'bear_atr_min_pct': 0.006077145052961419, 'bear_atr_max_pct': 0.07205446371641985, 'bear_tp_mult': 1.0951432029957562, 'bear_tsl_mult': 0.5037172187176238, 'bear_time_stop': 8, 'bear_use_sma': False, 'bear_use_ema': True, 'bear_use_atr': False, 'bear_use_adx': False, 'bear_use_spike': True, 'bear_rsi_required': False, 'sideways_strategy': 'breakout', 'sideways_bb_std_mult': 3.208623530511103, 'sideways_rsi_os': 14, 'sideways_rsi_ob': 88, 'sideways_adx_thresh': 18.6434449779555, 'sideways_atr_min_pct': 0.0051959078807954605, 'sideways_atr_max_pct': 0.05884564809179191, 'sideways_tp_mult': 2.684583648345547, 'sideways_tsl_mult': 0.796956540769063, 'sideways_time_stop': 250, 'sideways_use_sma': False, 'sideways_use_ema': True, 'sideways_use_atr': True, 'sideways_use_adx': True, 'sideways_use_spike': False, 'sideways_rsi_required': False}.
[I 2025-08-29 20:07:21,740] Trial 263 finished with values: [-1000000000.0, 1000000000.0] and parameters: {'p_sma': 40, 'p_std': 19, 'p_atr': 27, 'p_adx': 16, 'rsi_period': 31, 'ema1': 23, 'ema2': 45, 'slip_atr_k': 0.12442928335147234, 'slip_spread_k': 0.6682132606178688, 'spread_hl_frac': 0.001259114307910187, 'bb_std_mult': 2.92572098429536, 'rsi_os': 33, 'rsi_ob': 67, 'vol_spike': 0.19337281510603668, 'adx_thresh': 31.468331400767756, 'atr_min_pct': 0.012883094336384368, 'atr_max_pct': 0.04382719629227901, 'tp_mult': 1.9313355928854867, 'tsl_mult': 0.6477445091463879, 'strategy': 'breakout', 'time_stop': 153, 'use_sma': True, 'use_atr': False, 'use_adx': False, 'use_ema': False, 'use_spike': False, 'rsi_required': False, 'edge_k': 1.2579016509559315, 'edge_cap': 0.5747307838949346, 'bull_strategy': 'mean_reversion', 'bull_bb_std_mult': 1.3925927380961576, 'bull_rsi_os': 38, 'bull_rsi_ob': 95, 'bull_adx_thresh': 18.576504409555174, 'bull_atr_min_pct': 0.0023997161256305083, 'bull_atr_max_pct': 0.03038787670684045, 'bull_tp_mult': 1.3556416651933394, 'bull_tsl_mult': 0.07303959791657344, 'bull_time_stop': 188, 'bull_use_sma': True, 'bull_use_ema': True, 'bull_use_atr': True, 'bull_use_adx': True, 'bull_use_spike': False, 'bull_rsi_required': True, 'bear_strategy': 'mean_reversion', 'bear_bb_std_mult': 1.1620566378874004, 'bear_rsi_os': 52, 'bear_rsi_ob': 70, 'bear_adx_thresh': 9.993716657253788, 'bear_atr_min_pct': 0.0055070445895551955, 'bear_atr_max_pct': 0.04273458955111774, 'bear_tp_mult': 1.1611912104048276, 'bear_tsl_mult': 0.433325809276198, 'bear_time_stop': 5, 'bear_use_sma': False, 'bear_use_ema': True, 'bear_use_atr': True, 'bear_use_adx': False, 'bear_use_spike': True, 'bear_rsi_required': False, 'sideways_strategy': 'breakout', 'sideways_bb_std_mult': 1.8084697307113815, 'sideways_rsi_os': 17, 'sideways_rsi_ob': 82, 'sideways_adx_thresh': 18.19905275249617, 'sideways_atr_min_pct': 0.005424233517534672, 'sideways_atr_max_pct': 0.05527783303994912, 'sideways_tp_mult': 2.6669018710142356, 'sideways_tsl_mult': 0.8424609827625268, 'sideways_time_stop': 244, 'sideways_use_sma': False, 'sideways_use_ema': True, 'sideways_use_atr': False, 'sideways_use_adx': True, 'sideways_use_spike': False, 'sideways_rsi_required': False}.
[I 2025-08-29 20:07:51,510] Trial 265 finished with values: [-1000000000.0, 1000000000.0] and parameters: {'p_sma': 24, 'p_std': 53, 'p_atr': 29, 'p_adx': 13, 'rsi_period': 34, 'ema1': 20, 'ema2': 13, 'slip_atr_k': 0.028229548145055114, 'slip_spread_k': 0.4452226493901885, 'spread_hl_frac': 0.0012922806059550702, 'bb_std_mult': 1.2035530095772617, 'rsi_os': 33, 'rsi_ob': 48, 'vol_spike': 0.19315327078625, 'adx_thresh': 28.186819498080865, 'atr_min_pct': 0.013128353491574821, 'atr_max_pct': 0.0470581290401295, 'tp_mult': 1.8632973808722852, 'tsl_mult': 0.6334283388579101, 'strategy': 'breakout', 'time_stop': 157, 'use_sma': True, 'use_atr': False, 'use_adx': False, 'use_ema': False, 'use_spike': False, 'rsi_required': True, 'edge_k': 1.2465998574855517, 'edge_cap': 0.20348489356152477, 'bull_strategy': 'mean_reversion', 'bull_bb_std_mult': 1.3960017142429257, 'bull_rsi_os': 38, 'bull_rsi_ob': 95, 'bull_adx_thresh': 24.894004396326253, 'bull_atr_min_pct': 0.0013233812145367024, 'bull_atr_max_pct': 0.016888686327379047, 'bull_tp_mult': 2.7160748966409543, 'bull_tsl_mult': 0.46965055438093106, 'bull_time_stop': 174, 'bull_use_sma': True, 'bull_use_ema': True, 'bull_use_atr': False, 'bull_use_adx': True, 'bull_use_spike': True, 'bull_rsi_required': True, 'bear_strategy': 'mean_reversion', 'bear_bb_std_mult': 1.1331043878559452, 'bear_rsi_os': 31, 'bear_rsi_ob': 95, 'bear_adx_thresh': 32.14264705986425, 'bear_atr_min_pct': 0.005595902890415798, 'bear_atr_max_pct': 0.09096937750906879, 'bear_tp_mult': 1.0137003623160894, 'bear_tsl_mult': 0.43969620394341274, 'bear_time_stop': 214, 'bear_use_sma': False, 'bear_use_ema': True, 'bear_use_atr': True, 'bear_use_adx': False, 'bear_use_spike': True, 'bear_rsi_required': False, 'sideways_strategy': 'mean_reversion', 'sideways_bb_std_mult': 1.7883946125397412, 'sideways_rsi_os': 14, 'sideways_rsi_ob': 82, 'sideways_adx_thresh': 18.855494072657677, 'sideways_atr_min_pct': 0.003068102872114148, 'sideways_atr_max_pct': 0.0545674466152659, 'sideways_tp_mult': 2.8400804003748212, 'sideways_tsl_mult': 0.8512540513382735, 'sideways_time_stop': 251, 'sideways_use_sma': True, 'sideways_use_ema': False, 'sideways_use_atr': False, 'sideways_use_adx': False, 'sideways_use_spike': False, 'sideways_rsi_required': False}.
[I 2025-08-29 20:07:52,120] Trial 267 finished with values: [-1000000000.0, 1000000000.0] and parameters: {'p_sma': 29, 'p_std': 44, 'p_atr': 29, 'p_adx': 18, 'rsi_period': 41, 'ema1': 18, 'ema2': 11, 'slip_atr_k': 0.00039451255915348704, 'slip_spread_k': 0.09756649674251441, 'spread_hl_frac': 0.016002590175917646, 'bb_std_mult': 1.0822846130014865, 'rsi_os': 17, 'rsi_ob': 78, 'vol_spike': 0.040256858931567954, 'adx_thresh': 28.15543148514533, 'atr_min_pct': 0.015368137195810849, 'atr_max_pct': 0.03910496359339333, 'tp_mult': 1.703237863914837, 'tsl_mult': 0.1797799009572722, 'strategy': 'breakout', 'time_stop': 150, 'use_sma': True, 'use_atr': False, 'use_adx': True, 'use_ema': False, 'use_spike': True, 'rsi_required': True, 'edge_k': 1.2265406596008086, 'edge_cap': 0.20567425293844332, 'bull_strategy': 'mean_reversion', 'bull_bb_std_mult': 1.576427221551806, 'bull_rsi_os': 20, 'bull_rsi_ob': 94, 'bull_adx_thresh': 20.542871014687773, 'bull_atr_min_pct': 0.0010400671665006622, 'bull_atr_max_pct': 0.01722529802828052, 'bull_tp_mult': 1.4824431336601729, 'bull_tsl_mult': 0.7334667974074779, 'bull_time_stop': 177, 'bull_use_sma': True, 'bull_use_ema': True, 'bull_use_atr': False, 'bull_use_adx': True, 'bull_use_spike': True, 'bull_rsi_required': False, 'bear_strategy': 'mean_reversion', 'bear_bb_std_mult': 1.114227052810887, 'bear_rsi_os': 31, 'bear_rsi_ob': 69, 'bear_adx_thresh': 12.115431557116851, 'bear_atr_min_pct': 0.005452710385055257, 'bear_atr_max_pct': 0.11419389281981862, 'bear_tp_mult': 1.0175899625976528, 'bear_tsl_mult': 0.39082561441753705, 'bear_time_stop': 38, 'bear_use_sma': False, 'bear_use_ema': True, 'bear_use_atr': True, 'bear_use_adx': False, 'bear_use_spike': True, 'bear_rsi_required': False, 'sideways_strategy': 'mean_reversion', 'sideways_bb_std_mult': 1.8184386960159529, 'sideways_rsi_os': 14, 'sideways_rsi_ob': 82, 'sideways_adx_thresh': 20.27008258279167, 'sideways_atr_min_pct': 0.0031567270860570797, 'sideways_atr_max_pct': 0.058241267370436264, 'sideways_tp_mult': 2.7893221248438373, 'sideways_tsl_mult': 0.9215119342651332, 'sideways_time_stop': 173, 'sideways_use_sma': True, 'sideways_use_ema': False, 'sideways_use_atr': False, 'sideways_use_adx': False, 'sideways_use_spike': True, 'sideways_rsi_required': False}.
[I 2025-08-29 20:07:52,133] Trial 266 finished with values: [-1000000000.0, 1000000000.0] and parameters: {'p_sma': 29, 'p_std': 49, 'p_atr': 26, 'p_adx': 18, 'rsi_period': 30, 'ema1': 19, 'ema2': 46, 'slip_atr_k': 0.07670670070058977, 'slip_spread_k': 0.46025474251997467, 'spread_hl_frac': 0.027411466193395934, 'bb_std_mult': 1.2218562163140512, 'rsi_os': 33, 'rsi_ob': 67, 'vol_spike': 0.04176563962803591, 'adx_thresh': 31.537765857212896, 'atr_min_pct': 0.026891847413946495, 'atr_max_pct': 0.047825628254323654, 'tp_mult': 1.7026810607212726, 'tsl_mult': 0.6333486961345796, 'strategy': 'breakout', 'time_stop': 151, 'use_sma': True, 'use_atr': False, 'use_adx': False, 'use_ema': False, 'use_spike': True, 'rsi_required': True, 'edge_k': 1.1897165222031034, 'edge_cap': 0.18778835500022822, 'bull_strategy': 'mean_reversion', 'bull_bb_std_mult': 1.5604443971223647, 'bull_rsi_os': 18, 'bull_rsi_ob': 84, 'bull_adx_thresh': 17.534852291841254, 'bull_atr_min_pct': 0.002350512833133372, 'bull_atr_max_pct': 0.02341054413289698, 'bull_tp_mult': 1.4827249531387028, 'bull_tsl_mult': 0.7240449453024214, 'bull_time_stop': 174, 'bull_use_sma': True, 'bull_use_ema': True, 'bull_use_atr': False, 'bull_use_adx': True, 'bull_use_spike': True, 'bull_rsi_required': True, 'bear_strategy': 'mean_reversion', 'bear_bb_std_mult': 1.1286476108220245, 'bear_rsi_os': 11, 'bear_rsi_ob': 70, 'bear_adx_thresh': 5.603204862993495, 'bear_atr_min_pct': 0.005519317374697894, 'bear_atr_max_pct': 0.11463391742019981, 'bear_tp_mult': 1.0148269356895363, 'bear_tsl_mult': 0.44062686410271357, 'bear_time_stop': 151, 'bear_use_sma': False, 'bear_use_ema': True, 'bear_use_atr': True, 'bear_use_adx': False, 'bear_use_spike': True, 'bear_rsi_required': False, 'sideways_strategy': 'mean_reversion', 'sideways_bb_std_mult': 1.802927815826225, 'sideways_rsi_os': 14, 'sideways_rsi_ob': 82, 'sideways_adx_thresh': 19.06190538133476, 'sideways_atr_min_pct': 0.006397049761571166, 'sideways_atr_max_pct': 0.059439633967205426, 'sideways_tp_mult': 2.790243684874684, 'sideways_tsl_mult': 0.49538673712779735, 'sideways_time_stop': 244, 'sideways_use_sma': True, 'sideways_use_ema': False, 'sideways_use_atr': False, 'sideways_use_adx': False, 'sideways_use_spike': False, 'sideways_rsi_required': False}.
[I 2025-08-29 20:07:52,223] Trial 264 finished with values: [-1000000000.0, 1000000000.0] and parameters: {'p_sma': 40, 'p_std': 51, 'p_atr': 26, 'p_adx': 16, 'rsi_period': 30, 'ema1': 20, 'ema2': 46, 'slip_atr_k': 0.029020039103114556, 'slip_spread_k': 0.6644871487427053, 'spread_hl_frac': 0.04341568961915862, 'bb_std_mult': 1.204214157553394, 'rsi_os': 19, 'rsi_ob': 48, 'vol_spike': 0.19240575870775872, 'adx_thresh': 31.678355029027173, 'atr_min_pct': 0.028485289590681896, 'atr_max_pct': 0.038734922934808014, 'tp_mult': 1.8483664657002694, 'tsl_mult': 0.6463618740192889, 'strategy': 'breakout', 'time_stop': 150, 'use_sma': True, 'use_atr': False, 'use_adx': False, 'use_ema': False, 'use_spike': False, 'rsi_required': True, 'edge_k': 1.2402393244387064, 'edge_cap': 0.7205637118440491, 'bull_strategy': 'mean_reversion', 'bull_bb_std_mult': 1.3986081390740603, 'bull_rsi_os': 20, 'bull_rsi_ob': 95, 'bull_adx_thresh': 22.796085978536336, 'bull_atr_min_pct': 0.002419459716123666, 'bull_atr_max_pct': 0.01759620194572624, 'bull_tp_mult': 2.702841279013604, 'bull_tsl_mult': 0.7301753539701069, 'bull_time_stop': 189, 'bull_use_sma': True, 'bull_use_ema': True, 'bull_use_atr': False, 'bull_use_adx': True, 'bull_use_spike': False, 'bull_rsi_required': True, 'bear_strategy': 'mean_reversion', 'bear_bb_std_mult': 2.4630243174274256, 'bear_rsi_os': 36, 'bear_rsi_ob': 70, 'bear_adx_thresh': 12.319604152812158, 'bear_atr_min_pct': 0.01579826888647959, 'bear_atr_max_pct': 0.11449578467606795, 'bear_tp_mult': 1.0124323471651249, 'bear_tsl_mult': 0.46437808326435875, 'bear_time_stop': 15, 'bear_use_sma': False, 'bear_use_ema': True, 'bear_use_atr': True, 'bear_use_adx': False, 'bear_use_spike': True, 'bear_rsi_required': False, 'sideways_strategy': 'mean_reversion', 'sideways_bb_std_mult': 1.8150008691876036, 'sideways_rsi_os': 14, 'sideways_rsi_ob': 83, 'sideways_adx_thresh': 20.320250225184687, 'sideways_atr_min_pct': 0.0029716435509956254, 'sideways_atr_max_pct': 0.054413952633596954, 'sideways_tp_mult': 2.8323434968210663, 'sideways_tsl_mult': 0.8687487907541871, 'sideways_time_stop': 223, 'sideways_use_sma': False, 'sideways_use_ema': True, 'sideways_use_atr': False, 'sideways_use_adx': False, 'sideways_use_spike': False, 'sideways_rsi_required': False}.
[I 2025-08-29 20:08:22,691] Trial 269 finished with values: [-1000000000.0, 1000000000.0] and parameters: {'p_sma': 42, 'p_std': 7, 'p_atr': 25, 'p_adx': 7, 'rsi_period': 48, 'ema1': 20, 'ema2': 50, 'slip_atr_k': 0.17488937472646043, 'slip_spread_k': 0.3721578205624455, 'spread_hl_frac': 0.003365284081133174, 'bb_std_mult': 0.6033772810207261, 'rsi_os': 19, 'rsi_ob': 65, 'vol_spike': 0.1716948727532371, 'adx_thresh': 24.692746549687953, 'atr_min_pct': 0.014988570906324692, 'atr_max_pct': 0.03849343067653941, 'tp_mult': 1.7545034050168087, 'tsl_mult': 0.5930001400783658, 'strategy': 'mean_reversion', 'time_stop': 165, 'use_sma': True, 'use_atr': True, 'use_adx': False, 'use_ema': False, 'use_spike': False, 'rsi_required': True, 'edge_k': 1.1876628539782506, 'edge_cap': 0.8769945333946786, 'bull_strategy': 'mean_reversion', 'bull_bb_std_mult': 1.6106015531218403, 'bull_rsi_os': 37, 'bull_rsi_ob': 55, 'bull_adx_thresh': 30.481504039135565, 'bull_atr_min_pct': 0.0016279709012133412, 'bull_atr_max_pct': 0.02553589164435118, 'bull_tp_mult': 1.4118022210191734, 'bull_tsl_mult': 0.12074579126938116, 'bull_time_stop': 182, 'bull_use_sma': True, 'bull_use_ema': True, 'bull_use_atr': False, 'bull_use_adx': True, 'bull_use_spike': False, 'bull_rsi_required': True, 'bear_strategy': 'breakout', 'bear_bb_std_mult': 1.744615032878098, 'bear_rsi_os': 30, 'bear_rsi_ob': 53, 'bear_adx_thresh': 5.568210902378327, 'bear_atr_min_pct': 0.027900375929404697, 'bear_atr_max_pct': 0.1214098800038073, 'bear_tp_mult': 1.0644298310370224, 'bear_tsl_mult': 0.5258438840978802, 'bear_time_stop': 16, 'bear_use_sma': True, 'bear_use_ema': True, 'bear_use_atr': True, 'bear_use_adx': False, 'bear_use_spike': True, 'bear_rsi_required': True, 'sideways_strategy': 'mean_reversion', 'sideways_bb_std_mult': 1.943431625268658, 'sideways_rsi_os': 18, 'sideways_rsi_ob': 57, 'sideways_adx_thresh': 21.273801565416655, 'sideways_atr_min_pct': 0.004173778578389952, 'sideways_atr_max_pct': 0.06467383466806469, 'sideways_tp_mult': 2.7144199674396527, 'sideways_tsl_mult': 0.8738887087511745, 'sideways_time_stop': 224, 'sideways_use_sma': False, 'sideways_use_ema': True, 'sideways_use_atr': True, 'sideways_use_adx': False, 'sideways_use_spike': False, 'sideways_rsi_required': False}.
[I 2025-08-29 20:08:22,705] Trial 270 finished with values: [-1000000000.0, 1000000000.0] and parameters: {'p_sma': 51, 'p_std': 60, 'p_atr': 25, 'p_adx': 10, 'rsi_period': 37, 'ema1': 16, 'ema2': 48, 'slip_atr_k': 0.17724412681281324, 'slip_spread_k': 0.5000031226824632, 'spread_hl_frac': 0.01867139063398492, 'bb_std_mult': 0.6297814996738944, 'rsi_os': 19, 'rsi_ob': 65, 'vol_spike': 0.172661753355327, 'adx_thresh': 26.059779294322034, 'atr_min_pct': 0.013802092538464796, 'atr_max_pct': 0.039364219350137855, 'tp_mult': 1.7438686815220237, 'tsl_mult': 0.5948854777045605, 'strategy': 'mean_reversion', 'time_stop': 168, 'use_sma': True, 'use_atr': True, 'use_adx': False, 'use_ema': False, 'use_spike': False, 'rsi_required': True, 'edge_k': 1.5505209256612127, 'edge_cap': 0.46557093936087973, 'bull_strategy': 'mean_reversion', 'bull_bb_std_mult': 1.8285692291513123, 'bull_rsi_os': 41, 'bull_rsi_ob': 94, 'bull_adx_thresh': 19.15684392289061, 'bull_atr_min_pct': 0.0008065192293155818, 'bull_atr_max_pct': 0.02632828570888795, 'bull_tp_mult': 1.4242852369374703, 'bull_tsl_mult': 0.5950680443119986, 'bull_time_stop': 183, 'bull_use_sma': True, 'bull_use_ema': True, 'bull_use_atr': False, 'bull_use_adx': True, 'bull_use_spike': False, 'bull_rsi_required': True, 'bear_strategy': 'breakout', 'bear_bb_std_mult': 2.481867746212049, 'bear_rsi_os': 44, 'bear_rsi_ob': 92, 'bear_adx_thresh': 5.549148304207484, 'bear_atr_min_pct': 0.015872166471492522, 'bear_atr_max_pct': 0.11022158736361361, 'bear_tp_mult': 1.1242947645537353, 'bear_tsl_mult': 0.34174954357393494, 'bear_time_stop': 16, 'bear_use_sma': True, 'bear_use_ema': True, 'bear_use_atr': True, 'bear_use_adx': False, 'bear_use_spike': True, 'bear_rsi_required': True, 'sideways_strategy': 'mean_reversion', 'sideways_bb_std_mult': 0.9144857753719056, 'sideways_rsi_os': 18, 'sideways_rsi_ob': 66, 'sideways_adx_thresh': 19.857667135778353, 'sideways_atr_min_pct': 0.004935189883129852, 'sideways_atr_max_pct': 0.06504318651167579, 'sideways_tp_mult': 2.7129293456628103, 'sideways_tsl_mult': 0.870775469169875, 'sideways_time_stop': 192, 'sideways_use_sma': False, 'sideways_use_ema': True, 'sideways_use_atr': True, 'sideways_use_adx': False, 'sideways_use_spike': False, 'sideways_rsi_required': False}.
