[I 2025-08-29 20:48:01,289] Trial 612 finished with values: [0.00043629970972314247, 0.0011630097096221991] and parameters: {'p_sma': 16, 'p_std': 24, 'p_atr': 14, 'p_adx': 23, 'rsi_period': 52, 'ema1': 27, 'ema2': 47, 'slip_atr_k': 0.00563034271648421, 'slip_spread_k': 0.5067298906081995, 'spread_hl_frac': 0.03730637531502789, 'bb_std_mult': 1.7221334108595483, 'rsi_os': 53, 'rsi_ob': 73, 'vol_spike': 0.21820139944512773, 'adx_thresh': 20.751719855186238, 'atr_min_pct': 0.020620857853560354, 'atr_max_pct': 0.10558824591216028, 'tp_mult': 1.4767780765794296, 'tsl_mult': 0.05372420699057623, 'strategy': 'breakout', 'time_stop': 180, 'use_sma': True, 'use_atr': True, 'use_adx': False, 'use_ema': True, 'use_spike': False, 'rsi_required': False, 'edge_k': 0.2750645426398627, 'edge_cap': 0.6034653003746273, 'bull_strategy': 'mean_reversion', 'bull_bb_std_mult': 3.007374192004043, 'bull_rsi_os': 53, 'bull_rsi_ob': 72, 'bull_adx_thresh': 23.345530615036274, 'bull_atr_min_pct': 0.01573409086367202, 'bull_atr_max_pct': 0.12749401177314526, 'bull_tp_mult': 2.5447046495061727, 'bull_tsl_mult': 0.8993830564329349, 'bull_time_stop': 26, 'bull_use_sma': True, 'bull_use_ema': False, 'bull_use_atr': False, 'bull_use_adx': False, 'bull_use_spike': True, 'bull_rsi_required': False, 'bear_strategy': 'breakout', 'bear_bb_std_mult': 3.325594587150994, 'bear_rsi_os': 27, 'bear_rsi_ob': 70, 'bear_adx_thresh': 21.21697839248573, 'bear_atr_min_pct': 0.005852305511842789, 'bear_atr_max_pct': 0.050063880898640195, 'bear_tp_mult': 2.5885969090410286, 'bear_tsl_mult': 0.9694426192548019, 'bear_time_stop': 47, 'bear_use_sma': False, 'bear_use_ema': True, 'bear_use_atr': True, 'bear_use_adx': True, 'bear_use_spike': True, 'bear_rsi_required': False, 'sideways_strategy': 'breakout', 'sideways_bb_std_mult': 2.4247535525818193, 'sideways_rsi_os': 47, 'sideways_rsi_ob': 67, 'sideways_adx_thresh': 32.13568749944994, 'sideways_atr_min_pct': 0.004610339350584069, 'sideways_atr_max_pct': 0.0277029753710362, 'sideways_tp_mult': 1.0120104650079809, 'sideways_tsl_mult': 0.6759162173513089, 'sideways_time_stop': 276, 'sideways_use_sma': False, 'sideways_use_ema': False, 'sideways_use_atr': True, 'sideways_use_adx': True, 'sideways_use_spike': False, 'sideways_rsi_required': False}.
[I 2025-08-29 20:48:01,680] Trial 615 finished with values: [-0.015890117263580028, 0.015822357334468146] and parameters: {'p_sma': 22, 'p_std': 32, 'p_atr': 8, 'p_adx': 22, 'rsi_period': 40, 'ema1': 17, 'ema2': 42, 'slip_atr_k': 0.15398203619957504, 'slip_spread_k': 0.745275751133583, 'spread_hl_frac': 0.04750425445838799, 'bb_std_mult': 2.8678332354183045, 'rsi_os': 10, 'rsi_ob': 84, 'vol_spike': 0.1867956477260977, 'adx_thresh': 12.107057399665706, 'atr_min_pct': 0.018893919986351673, 'atr_max_pct': 0.03083193285773048, 'tp_mult': 1.269513960453394, 'tsl_mult': 0.8638410738580724, 'strategy': 'breakout', 'time_stop': 26, 'use_sma': True, 'use_atr': True, 'use_adx': False, 'use_ema': True, 'use_spike': False, 'rsi_required': False, 'edge_k': 1.0995779448838696, 'edge_cap': 0.5559358805101106, 'bull_strategy': 'mean_reversion', 'bull_bb_std_mult': 2.480941268939546, 'bull_rsi_os': 16, 'bull_rsi_ob': 73, 'bull_adx_thresh': 14.387254043256506, 'bull_atr_min_pct': 0.029336319415351468, 'bull_atr_max_pct': 0.04314553084694901, 'bull_tp_mult': 1.66519973253479, 'bull_tsl_mult': 0.9122047907524898, 'bull_time_stop': 34, 'bull_use_sma': True, 'bull_use_ema': False, 'bull_use_atr': False, 'bull_use_adx': False, 'bull_use_spike': True, 'bull_rsi_required': False, 'bear_strategy': 'breakout', 'bear_bb_std_mult': 2.926693924820051, 'bear_rsi_os': 53, 'bear_rsi_ob': 69, 'bear_adx_thresh': 12.845902336177538, 'bear_atr_min_pct': 0.0068357506859852086, 'bear_atr_max_pct': 0.08487255307464037, 'bear_tp_mult': 2.6685713783901246, 'bear_tsl_mult': 0.9653946209759422, 'bear_time_stop': 134, 'bear_use_sma': False, 'bear_use_ema': True, 'bear_use_atr': False, 'bear_use_adx': True, 'bear_use_spike': True, 'bear_rsi_required': False, 'sideways_strategy': 'mean_reversion', 'sideways_bb_std_mult': 2.4333442897425384, 'sideways_rsi_os': 47, 'sideways_rsi_ob': 62, 'sideways_adx_thresh': 11.802465830239186, 'sideways_atr_min_pct': 0.004559375352402591, 'sideways_atr_max_pct': 0.02788116008181068, 'sideways_tp_mult': 1.010887941664099, 'sideways_tsl_mult': 0.676168190252223, 'sideways_time_stop': 183, 'sideways_use_sma': False, 'sideways_use_ema': False, 'sideways_use_atr': True, 'sideways_use_adx': False, 'sideways_use_spike': False, 'sideways_rsi_required': False}.
[I 2025-08-29 20:48:01,703] Trial 613 finished with values: [-1000000000.0, 1000000000.0] and parameters: {'p_sma': 22, 'p_std': 38, 'p_atr': 26, 'p_adx': 29, 'rsi_period': 13, 'ema1': 17, 'ema2': 31, 'slip_atr_k': 0.06799670073510522, 'slip_spread_k': 0.04555375371509518, 'spread_hl_frac': 0.048848381242029504, 'bb_std_mult': 0.5232586204549292, 'rsi_os': 8, 'rsi_ob': 45, 'vol_spike': 0.16202407673595012, 'adx_thresh': 13.344030378724916, 'atr_min_pct': 0.023551954481399913, 'atr_max_pct': 0.11755693981949011, 'tp_mult': 2.589935929753571, 'tsl_mult': 0.1322533374982175, 'strategy': 'breakout', 'time_stop': 178, 'use_sma': True, 'use_atr': True, 'use_adx': False, 'use_ema': True, 'use_spike': False, 'rsi_required': False, 'edge_k': 1.0930502143990959, 'edge_cap': 0.09326373617819178, 'bull_strategy': 'mean_reversion', 'bull_bb_std_mult': 2.3669732620677455, 'bull_rsi_os': 11, 'bull_rsi_ob': 71, 'bull_adx_thresh': 13.943639526224736, 'bull_atr_min_pct': 0.014183697317597258, 'bull_atr_max_pct': 0.12717205569371506, 'bull_tp_mult': 2.0826120466343947, 'bull_tsl_mult': 0.21824911410571213, 'bull_time_stop': 93, 'bull_use_sma': True, 'bull_use_ema': False, 'bull_use_atr': False, 'bull_use_adx': False, 'bull_use_spike': True, 'bull_rsi_required': False, 'bear_strategy': 'breakout', 'bear_bb_std_mult': 2.953304403537806, 'bear_rsi_os': 22, 'bear_rsi_ob': 91, 'bear_adx_thresh': 21.235858179432814, 'bear_atr_min_pct': 0.006644705228713402, 'bear_atr_max_pct': 0.04456427531289549, 'bear_tp_mult': 2.6757284270457533, 'bear_tsl_mult': 0.8816011271478351, 'bear_time_stop': 90, 'bear_use_sma': False, 'bear_use_ema': True, 'bear_use_atr': True, 'bear_use_adx': True, 'bear_use_spike': True, 'bear_rsi_required': False, 'sideways_strategy': 'breakout', 'sideways_bb_std_mult': 2.4295650693687203, 'sideways_rsi_os': 47, 'sideways_rsi_ob': 60, 'sideways_adx_thresh': 33.000425131404114, 'sideways_atr_min_pct': 0.004652277325191605, 'sideways_atr_max_pct': 0.018383291053724715, 'sideways_tp_mult': 1.092131691602413, 'sideways_tsl_mult': 0.811752027703787, 'sideways_time_stop': 183, 'sideways_use_sma': False, 'sideways_use_ema': False, 'sideways_use_atr': True, 'sideways_use_adx': True, 'sideways_use_spike': False, 'sideways_rsi_required': False}.
[I 2025-08-29 20:48:01,843] Trial 614 finished with values: [-0.014882554969238071, 0.014857860073767945] and parameters: {'p_sma': 22, 'p_std': 60, 'p_atr': 9, 'p_adx': 14, 'rsi_period': 37, 'ema1': 17, 'ema2': 47, 'slip_atr_k': 0.17339619012619567, 'slip_spread_k': 0.2027656741536415, 'spread_hl_frac': 0.04897365451880022, 'bb_std_mult': 2.9093624497390715, 'rsi_os': 8, 'rsi_ob': 73, 'vol_spike': 0.15403296534128902, 'adx_thresh': 21.93232415414718, 'atr_min_pct': 0.027367200863795745, 'atr_max_pct': 0.032005826574283, 'tp_mult': 1.2730305621735383, 'tsl_mult': 0.28719448325010155, 'strategy': 'breakout', 'time_stop': 181, 'use_sma': True, 'use_atr': True, 'use_adx': False, 'use_ema': True, 'use_spike': False, 'rsi_required': False, 'edge_k': 1.5547733759171298, 'edge_cap': 0.6081934323918354, 'bull_strategy': 'mean_reversion', 'bull_bb_std_mult': 0.575198049437385, 'bull_rsi_os': 11, 'bull_rsi_ob': 70, 'bull_adx_thresh': 22.043246788303108, 'bull_atr_min_pct': 0.01382746043045421, 'bull_atr_max_pct': 0.09434567954792494, 'bull_tp_mult': 2.060353692475472, 'bull_tsl_mult': 0.9441261157963142, 'bull_time_stop': 27, 'bull_use_sma': True, 'bull_use_ema': False, 'bull_use_atr': False, 'bull_use_adx': False, 'bull_use_spike': True, 'bull_rsi_required': False, 'bear_strategy': 'breakout', 'bear_bb_std_mult': 2.915886597616418, 'bear_rsi_os': 27, 'bear_rsi_ob': 91, 'bear_adx_thresh': 21.31783143183335, 'bear_atr_min_pct': 0.00461333214483026, 'bear_atr_max_pct': 0.044988561361607775, 'bear_tp_mult': 2.664748725190958, 'bear_tsl_mult': 0.9653811436982521, 'bear_time_stop': 53, 'bear_use_sma': False, 'bear_use_ema': True, 'bear_use_atr': True, 'bear_use_adx': True, 'bear_use_spike': True, 'bear_rsi_required': False, 'sideways_strategy': 'breakout', 'sideways_bb_std_mult': 2.433129510779105, 'sideways_rsi_os': 47, 'sideways_rsi_ob': 46, 'sideways_adx_thresh': 33.160462098408324, 'sideways_atr_min_pct': 0.004460507284520076, 'sideways_atr_max_pct': 0.019312158171647623, 'sideways_tp_mult': 1.0955282300533622, 'sideways_tsl_mult': 0.7729747756113018, 'sideways_time_stop': 13, 'sideways_use_sma': False, 'sideways_use_ema': False, 'sideways_use_atr': True, 'sideways_use_adx': True, 'sideways_use_spike': False, 'sideways_rsi_required': False}.
[I 2025-08-29 20:48:02,603] Trial 617 finished with values: [-1000000000.0, 1000000000.0] and parameters: {'p_sma': 16, 'p_std': 23, 'p_atr': 26, 'p_adx': 14, 'rsi_period': 68, 'ema1': 24, 'ema2': 38, 'slip_atr_k': 0.06839018089762619, 'slip_spread_k': 0.1658753677936442, 'spread_hl_frac': 0.0373193158994831, 'bb_std_mult': 1.7575946628468573, 'rsi_os': 8, 'rsi_ob': 47, 'vol_spike': 0.09153857006939684, 'adx_thresh': 20.96389670538823, 'atr_min_pct': 0.02320531678973166, 'atr_max_pct': 0.11504195482862517, 'tp_mult': 2.605415980289771, 'tsl_mult': 0.04735479735050396, 'strategy': 'mean_reversion', 'time_stop': 168, 'use_sma': True, 'use_atr': False, 'use_adx': True, 'use_ema': True, 'use_spike': True, 'rsi_required': False, 'edge_k': 0.9904588768185736, 'edge_cap': 0.6107600069489658, 'bull_strategy': 'mean_reversion', 'bull_bb_std_mult': 2.8506877751370405, 'bull_rsi_os': 12, 'bull_rsi_ob': 76, 'bull_adx_thresh': 25.141830891791297, 'bull_atr_min_pct': 0.028127607597566197, 'bull_atr_max_pct': 0.010510247730646183, 'bull_tp_mult': 2.767632139994628, 'bull_tsl_mult': 0.8759189824672994, 'bull_time_stop': 96, 'bull_use_sma': True, 'bull_use_ema': True, 'bull_use_atr': True, 'bull_use_adx': False, 'bull_use_spike': False, 'bull_rsi_required': False, 'bear_strategy': 'mean_reversion', 'bear_bb_std_mult': 2.6404772206253417, 'bear_rsi_os': 23, 'bear_rsi_ob': 91, 'bear_adx_thresh': 21.461781322305416, 'bear_atr_min_pct': 0.004579994238871427, 'bear_atr_max_pct': 0.04600578748916889, 'bear_tp_mult': 1.9684972989781533, 'bear_tsl_mult': 0.8848494888396381, 'bear_time_stop': 69, 'bear_use_sma': False, 'bear_use_ema': True, 'bear_use_atr': False, 'bear_use_adx': True, 'bear_use_spike': True, 'bear_rsi_required': True, 'sideways_strategy': 'breakout', 'sideways_bb_std_mult': 2.1980290147655395, 'sideways_rsi_os': 48, 'sideways_rsi_ob': 67, 'sideways_adx_thresh': 32.937453647205096, 'sideways_atr_min_pct': 0.0038976103526344834, 'sideways_atr_max_pct': 0.0158689710364437, 'sideways_tp_mult': 1.0983340557918524, 'sideways_tsl_mult': 0.68859157149235, 'sideways_time_stop': 206, 'sideways_use_sma': False, 'sideways_use_ema': False, 'sideways_use_atr': False, 'sideways_use_adx': False, 'sideways_use_spike': False, 'sideways_rsi_required': False}.
[I 2025-08-29 20:48:03,048] Trial 620 finished with values: [-1000000000.0, 1000000000.0] and parameters: {'p_sma': 19, 'p_std': 56, 'p_atr': 30, 'p_adx': 12, 'rsi_period': 39, 'ema1': 28, 'ema2': 24, 'slip_atr_k': 0.009949316268896072, 'slip_spread_k': 0.48999120949699976, 'spread_hl_frac': 0.047689839028018856, 'bb_std_mult': 3.021550547243478, 'rsi_os': 53, 'rsi_ob': 78, 'vol_spike': 0.13366827423261932, 'adx_thresh': 17.136162318681656, 'atr_min_pct': 0.001994806365277593, 'atr_max_pct': 0.030126066931448214, 'tp_mult': 1.4825319399319992, 'tsl_mult': 0.8445062480753908, 'strategy': 'mean_reversion', 'time_stop': 169, 'use_sma': True, 'use_atr': False, 'use_adx': False, 'use_ema': True, 'use_spike': False, 'rsi_required': False, 'edge_k': 0.37314110595147176, 'edge_cap': 0.5650106029413143, 'bull_strategy': 'mean_reversion', 'bull_bb_std_mult': 3.2588723364230074, 'bull_rsi_os': 24, 'bull_rsi_ob': 50, 'bull_adx_thresh': 15.1314616613311, 'bull_atr_min_pct': 0.017382794127924865, 'bull_atr_max_pct': 0.14304622306966533, 'bull_tp_mult': 2.313415470544791, 'bull_tsl_mult': 0.895587131683756, 'bull_time_stop': 31, 'bull_use_sma': True, 'bull_use_ema': False, 'bull_use_atr': True, 'bull_use_adx': False, 'bull_use_spike': True, 'bull_rsi_required': False, 'bear_strategy': 'mean_reversion', 'bear_bb_std_mult': 1.8278961424519722, 'bear_rsi_os': 25, 'bear_rsi_ob': 46, 'bear_adx_thresh': 22.38358912703233, 'bear_atr_min_pct': 0.020807086646041535, 'bear_atr_max_pct': 0.10209816129947123, 'bear_tp_mult': 2.5995673569098736, 'bear_tsl_mult': 0.9213077535606872, 'bear_time_stop': 101, 'bear_use_sma': False, 'bear_use_ema': True, 'bear_use_atr': False, 'bear_use_adx': True, 'bear_use_spike': True, 'bear_rsi_required': True, 'sideways_strategy': 'breakout', 'sideways_bb_std_mult': 1.0043928314816672, 'sideways_rsi_os': 49, 'sideways_rsi_ob': 76, 'sideways_adx_thresh': 23.069667129125417, 'sideways_atr_min_pct': 0.005691895332797273, 'sideways_atr_max_pct': 0.02508460325466826, 'sideways_tp_mult': 1.0715115518674774, 'sideways_tsl_mult': 0.7277728641042254, 'sideways_time_stop': 131, 'sideways_use_sma': True, 'sideways_use_ema': False, 'sideways_use_atr': False, 'sideways_use_adx': False, 'sideways_use_spike': False, 'sideways_rsi_required': False}.
[I 2025-08-29 20:48:30,415] Trial 618 finished with values: [-0.006557129133553663, 0.006541582705964021] and parameters: {'p_sma': 17, 'p_std': 23, 'p_atr': 25, 'p_adx': 14, 'rsi_period': 52, 'ema1': 24, 'ema2': 47, 'slip_atr_k': 0.17097280489789077, 'slip_spread_k': 0.2127801335476096, 'spread_hl_frac': 0.04803839492750478, 'bb_std_mult': 2.4685472899393814, 'rsi_os': 24, 'rsi_ob': 85, 'vol_spike': 0.09187888486763822, 'adx_thresh': 17.824951898709962, 'atr_min_pct': 5.200198032551638e-05, 'atr_max_pct': 0.11281615416440312, 'tp_mult': 1.4528930270915597, 'tsl_mult': 0.2877863963191528, 'strategy': 'mean_reversion', 'time_stop': 168, 'use_sma': True, 'use_atr': False, 'use_adx': True, 'use_ema': True, 'use_spike': True, 'rsi_required': False, 'edge_k': 0.5762170125815115, 'edge_cap': 0.6043211191456864, 'bull_strategy': 'mean_reversion', 'bull_bb_std_mult': 2.8315692786816222, 'bull_rsi_os': 24, 'bull_rsi_ob': 51, 'bull_adx_thresh': 15.000707538532108, 'bull_atr_min_pct': 0.017670321997136834, 'bull_atr_max_pct': 0.09724729093378363, 'bull_tp_mult': 2.3089798572897577, 'bull_tsl_mult': 0.8768861262828449, 'bull_time_stop': 27, 'bull_use_sma': True, 'bull_use_ema': True, 'bull_use_atr': True, 'bull_use_adx': False, 'bull_use_spike': False, 'bull_rsi_required': False, 'bear_strategy': 'mean_reversion', 'bear_bb_std_mult': 1.7403084753396147, 'bear_rsi_os': 12, 'bear_rsi_ob': 70, 'bear_adx_thresh': 9.494713266962838, 'bear_atr_min_pct': 0.007860810598970607, 'bear_atr_max_pct': 0.045723032931613436, 'bear_tp_mult': 2.596915207032981, 'bear_tsl_mult': 0.9308762138223206, 'bear_time_stop': 98, 'bear_use_sma': False, 'bear_use_ema': True, 'bear_use_atr': False, 'bear_use_adx': True, 'bear_use_spike': True, 'bear_rsi_required': True, 'sideways_strategy': 'breakout', 'sideways_bb_std_mult': 2.5112619844549924, 'sideways_rsi_os': 48, 'sideways_rsi_ob': 76, 'sideways_adx_thresh': 21.08299572724598, 'sideways_atr_min_pct': 0.0036287564449229612, 'sideways_atr_max_pct': 0.024060506707524274, 'sideways_tp_mult': 1.2504586727158573, 'sideways_tsl_mult': 0.7652629826072777, 'sideways_time_stop': 92, 'sideways_use_sma': False, 'sideways_use_ema': False, 'sideways_use_atr': False, 'sideways_use_adx': False, 'sideways_use_spike': False, 'sideways_rsi_required': False}.
[I 2025-08-29 20:48:30,659] Trial 616 finished with values: [-0.018909648157538816, 0.018827786853811354] and parameters: {'p_sma': 16, 'p_std': 38, 'p_atr': 8, 'p_adx': 14, 'rsi_period': 68, 'ema1': 25, 'ema2': 42, 'slip_atr_k': 0.24972007388927692, 'slip_spread_k': 0.17525779540816486, 'spread_hl_frac': 0.047670749293700354, 'bb_std_mult': 2.9338482649377076, 'rsi_os': 54, 'rsi_ob': 84, 'vol_spike': 0.1528818962488165, 'adx_thresh': 12.096334055716333, 'atr_min_pct': 0.0005234756618210604, 'atr_max_pct': 0.11475775915537245, 'tp_mult': 1.262272360438514, 'tsl_mult': 0.8625769776579313, 'strategy': 'breakout', 'time_stop': 168, 'use_sma': True, 'use_atr': True, 'use_adx': False, 'use_ema': True, 'use_spike': False, 'rsi_required': False, 'edge_k': 0.5776174860608234, 'edge_cap': 0.5631747566582807, 'bull_strategy': 'mean_reversion', 'bull_bb_std_mult': 0.5709313965677405, 'bull_rsi_os': 30, 'bull_rsi_ob': 70, 'bull_adx_thresh': 13.77882060539079, 'bull_atr_min_pct': 0.017679988366396972, 'bull_atr_max_pct': 0.08753037438387898, 'bull_tp_mult': 1.6095283271641954, 'bull_tsl_mult': 0.9040946178839864, 'bull_time_stop': 147, 'bull_use_sma': True, 'bull_use_ema': False, 'bull_use_atr': False, 'bull_use_adx': False, 'bull_use_spike': True, 'bull_rsi_required': False, 'bear_strategy': 'breakout', 'bear_bb_std_mult': 2.9031770463332984, 'bear_rsi_os': 53, 'bear_rsi_ob': 69, 'bear_adx_thresh': 20.588982644332685, 'bear_atr_min_pct': 0.0068609837763026925, 'bear_atr_max_pct': 0.04504783404777105, 'bear_tp_mult': 2.672075680970009, 'bear_tsl_mult': 0.9691571433740744, 'bear_time_stop': 70, 'bear_use_sma': False, 'bear_use_ema': True, 'bear_use_atr': False, 'bear_use_adx': True, 'bear_use_spike': True, 'bear_rsi_required': False, 'sideways_strategy': 'breakout', 'sideways_bb_std_mult': 2.429007922539626, 'sideways_rsi_os': 47, 'sideways_rsi_ob': 77, 'sideways_adx_thresh': 33.19098639073643, 'sideways_atr_min_pct': 0.004682389814971361, 'sideways_atr_max_pct': 0.01855141723793164, 'sideways_tp_mult': 1.0877410768350708, 'sideways_tsl_mult': 0.6797026332510238, 'sideways_time_stop': 274, 'sideways_use_sma': False, 'sideways_use_ema': False, 'sideways_use_atr': True, 'sideways_use_adx': False, 'sideways_use_spike': False, 'sideways_rsi_required': False}.
[I 2025-08-29 20:48:30,827] Trial 619 finished with values: [-1000000000.0, 1000000000.0] and parameters: {'p_sma': 17, 'p_std': 23, 'p_atr': 25, 'p_adx': 14, 'rsi_period': 36, 'ema1': 25, 'ema2': 47, 'slip_atr_k': 0.009321808103645968, 'slip_spread_k': 0.4889964425244801, 'spread_hl_frac': 0.047526009404492996, 'bb_std_mult': 1.7364486966856894, 'rsi_os': 13, 'rsi_ob': 55, 'vol_spike': 0.19208980016054233, 'adx_thresh': 14.312969714907203, 'atr_min_pct': 0.01983493738298533, 'atr_max_pct': 0.06601027442247255, 'tp_mult': 2.3173285038230005, 'tsl_mult': 0.9657387169360635, 'strategy': 'mean_reversion', 'time_stop': 168, 'use_sma': True, 'use_atr': False, 'use_adx': True, 'use_ema': True, 'use_spike': True, 'rsi_required': False, 'edge_k': 0.8789895215898043, 'edge_cap': 0.6058391209660615, 'bull_strategy': 'mean_reversion', 'bull_bb_std_mult': 3.1027755219604374, 'bull_rsi_os': 45, 'bull_rsi_ob': 76, 'bull_adx_thresh': 25.079713423039514, 'bull_atr_min_pct': 0.017764018637610228, 'bull_atr_max_pct': 0.13732708867414326, 'bull_tp_mult': 2.758419041700032, 'bull_tsl_mult': 0.8878697296234319, 'bull_time_stop': 29, 'bull_use_sma': True, 'bull_use_ema': True, 'bull_use_atr': True, 'bull_use_adx': False, 'bull_use_spike': False, 'bull_rsi_required': False, 'bear_strategy': 'mean_reversion', 'bear_bb_std_mult': 2.628414148039894, 'bear_rsi_os': 26, 'bear_rsi_ob': 58, 'bear_adx_thresh': 22.31166101641049, 'bear_atr_min_pct': 0.022930809000197408, 'bear_atr_max_pct': 0.049428568398899024, 'bear_tp_mult': 2.5992313045171533, 'bear_tsl_mult': 0.936813379319922, 'bear_time_stop': 40, 'bear_use_sma': False, 'bear_use_ema': True, 'bear_use_atr': False, 'bear_use_adx': True, 'bear_use_spike': True, 'bear_rsi_required': True, 'sideways_strategy': 'breakout', 'sideways_bb_std_mult': 2.2070602078029324, 'sideways_rsi_os': 27, 'sideways_rsi_ob': 77, 'sideways_adx_thresh': 34.267434837559634, 'sideways_atr_min_pct': 0.009831313920238234, 'sideways_atr_max_pct': 0.14030576623640492, 'sideways_tp_mult': 1.0672633708701371, 'sideways_tsl_mult': 0.5888257543442617, 'sideways_time_stop': 275, 'sideways_use_sma': False, 'sideways_use_ema': False, 'sideways_use_atr': False, 'sideways_use_adx': False, 'sideways_use_spike': False, 'sideways_rsi_required': False}.
