[I 2025-08-29 20:32:39,586] Trial 475 finished with values: [-1000000000.0, 1000000000.0] and parameters: {'p_sma': 22, 'p_std': 56, 'p_atr': 26, 'p_adx': 13, 'rsi_period': 35, 'ema1': 8, 'ema2': 58, 'slip_atr_k': 0.004759897752410341, 'slip_spread_k': 0.950083551016192, 'spread_hl_frac': 0.04718074765486614, 'bb_std_mult': 3.4566705615918556, 'rsi_os': 10, 'rsi_ob': 71, 'vol_spike': 0.19245549928369302, 'adx_thresh': 5.019006742208669, 'atr_min_pct': 0.01871174646649549, 'atr_max_pct': 0.03113362213644958, 'tp_mult': 1.5457645771111843, 'tsl_mult': 0.8660794919110324, 'strategy': 'mean_reversion', 'time_stop': 260, 'use_sma': True, 'use_atr': False, 'use_adx': False, 'use_ema': True, 'use_spike': False, 'rsi_required': False, 'edge_k': 1.6233950797024244, 'edge_cap': 0.3441780168924043, 'bull_strategy': 'mean_reversion', 'bull_bb_std_mult': 3.1241520823668334, 'bull_rsi_os': 29, 'bull_rsi_ob': 73, 'bull_adx_thresh': 21.693917463763114, 'bull_atr_min_pct': 0.01456084739424747, 'bull_atr_max_pct': 0.13279985290373353, 'bull_tp_mult': 1.2434276365564076, 'bull_tsl_mult': 0.322175194038689, 'bull_time_stop': 32, 'bull_use_sma': True, 'bull_use_ema': False, 'bull_use_atr': True, 'bull_use_adx': False, 'bull_use_spike': True, 'bull_rsi_required': False, 'bear_strategy': 'breakout', 'bear_bb_std_mult': 2.649905543139587, 'bear_rsi_os': 12, 'bear_rsi_ob': 76, 'bear_adx_thresh': 20.95216905940382, 'bear_atr_min_pct': 0.02343109932328341, 'bear_atr_max_pct': 0.04620412904921765, 'bear_tp_mult': 2.6312173253832385, 'bear_tsl_mult': 0.03575476366309649, 'bear_time_stop': 250, 'bear_use_sma': True, 'bear_use_ema': True, 'bear_use_atr': False, 'bear_use_adx': True, 'bear_use_spike': True, 'bear_rsi_required': True, 'sideways_strategy': 'breakout', 'sideways_bb_std_mult': 2.261077925042406, 'sideways_rsi_os': 24, 'sideways_rsi_ob': 45, 'sideways_adx_thresh': 5.602461268933624, 'sideways_atr_min_pct': 0.00900231929987951, 'sideways_atr_max_pct': 0.02311875228897599, 'sideways_tp_mult': 2.9965869341509075, 'sideways_tsl_mult': 0.7249262538845922, 'sideways_time_stop': 200, 'sideways_use_sma': True, 'sideways_use_ema': False, 'sideways_use_atr': False, 'sideways_use_adx': True, 'sideways_use_spike': False, 'sideways_rsi_required': False}.
[I 2025-08-29 20:32:40,216] Trial 478 finished with values: [-1000000000.0, 1000000000.0] and parameters: {'p_sma': 45, 'p_std': 58, 'p_atr': 25, 'p_adx': 12, 'rsi_period': 51, 'ema1': 8, 'ema2': 53, 'slip_atr_k': 0.18596266377278597, 'slip_spread_k': 0.15869352614849982, 'spread_hl_frac': 0.049038811106762295, 'bb_std_mult': 1.7282001839443804, 'rsi_os': 34, 'rsi_ob': 46, 'vol_spike': 0.20341547802064322, 'adx_thresh': 17.235668465373205, 'atr_min_pct': 0.02336357355302421, 'atr_max_pct': 0.012328224847789476, 'tp_mult': 2.672349389700841, 'tsl_mult': 0.8805919684851724, 'strategy': 'breakout', 'time_stop': 170, 'use_sma': False, 'use_atr': False, 'use_adx': True, 'use_ema': True, 'use_spike': False, 'rsi_required': False, 'edge_k': 0.5253936341948238, 'edge_cap': 0.6105513763803401, 'bull_strategy': 'mean_reversion', 'bull_bb_std_mult': 3.1237857353369156, 'bull_rsi_os': 29, 'bull_rsi_ob': 79, 'bull_adx_thresh': 15.54063991925713, 'bull_atr_min_pct': 0.01810425081501455, 'bull_atr_max_pct': 0.0927839924289727, 'bull_tp_mult': 2.736216349916252, 'bull_tsl_mult': 0.8872765794995515, 'bull_time_stop': 25, 'bull_use_sma': False, 'bull_use_ema': False, 'bull_use_atr': True, 'bull_use_adx': False, 'bull_use_spike': True, 'bull_rsi_required': False, 'bear_strategy': 'breakout', 'bear_bb_std_mult': 2.548014932015023, 'bear_rsi_os': 29, 'bear_rsi_ob': 74, 'bear_adx_thresh': 11.189924314830291, 'bear_atr_min_pct': 0.00858848910818071, 'bear_atr_max_pct': 0.04614737664211552, 'bear_tp_mult': 2.647317916376475, 'bear_tsl_mult': 0.9413263138640842, 'bear_time_stop': 102, 'bear_use_sma': True, 'bear_use_ema': False, 'bear_use_atr': False, 'bear_use_adx': True, 'bear_use_spike': False, 'bear_rsi_required': False, 'sideways_strategy': 'breakout', 'sideways_bb_std_mult': 2.114094713451127, 'sideways_rsi_os': 24, 'sideways_rsi_ob': 79, 'sideways_adx_thresh': 13.85544215664562, 'sideways_atr_min_pct': 0.02880600983254911, 'sideways_atr_max_pct': 0.017547965969626746, 'sideways_tp_mult': 1.0120014571460687, 'sideways_tsl_mult': 0.4278713085767053, 'sideways_time_stop': 202, 'sideways_use_sma': False, 'sideways_use_ema': False, 'sideways_use_atr': False, 'sideways_use_adx': True, 'sideways_use_spike': True, 'sideways_rsi_required': False}.
[I 2025-08-29 20:32:40,226] Trial 479 finished with values: [-1000000000.0, 1000000000.0] and parameters: {'p_sma': 21, 'p_std': 58, 'p_atr': 25, 'p_adx': 13, 'rsi_period': 36, 'ema1': 26, 'ema2': 46, 'slip_atr_k': 0.20065721830343541, 'slip_spread_k': 0.16377036503769396, 'spread_hl_frac': 0.04999367286680447, 'bb_std_mult': 1.7329191684997114, 'rsi_os': 9, 'rsi_ob': 46, 'vol_spike': 0.18283947269291162, 'adx_thresh': 13.907637639145221, 'atr_min_pct': 0.019022901270603926, 'atr_max_pct': 0.07599470521546571, 'tp_mult': 1.443184489031407, 'tsl_mult': 0.07390079292919216, 'strategy': 'mean_reversion', 'time_stop': 72, 'use_sma': False, 'use_atr': False, 'use_adx': True, 'use_ema': True, 'use_spike': False, 'rsi_required': False, 'edge_k': 0.9827794352722422, 'edge_cap': 0.6030307983837869, 'bull_strategy': 'mean_reversion', 'bull_bb_std_mult': 2.8402413495674717, 'bull_rsi_os': 16, 'bull_rsi_ob': 73, 'bull_adx_thresh': 29.635733577730313, 'bull_atr_min_pct': 0.017216670704609464, 'bull_atr_max_pct': 0.09344294123853551, 'bull_tp_mult': 2.7503736144557833, 'bull_tsl_mult': 0.8916817205017199, 'bull_time_stop': 26, 'bull_use_sma': False, 'bull_use_ema': False, 'bull_use_atr': True, 'bull_use_adx': False, 'bull_use_spike': True, 'bull_rsi_required': False, 'bear_strategy': 'breakout', 'bear_bb_std_mult': 3.5216570313865385, 'bear_rsi_os': 29, 'bear_rsi_ob': 75, 'bear_adx_thresh': 24.28182360364942, 'bear_atr_min_pct': 0.02454261875590398, 'bear_atr_max_pct': 0.04476086874288358, 'bear_tp_mult': 2.048962928469819, 'bear_tsl_mult': 0.9475079024408548, 'bear_time_stop': 250, 'bear_use_sma': False, 'bear_use_ema': False, 'bear_use_atr': False, 'bear_use_adx': True, 'bear_use_spike': False, 'bear_rsi_required': True, 'sideways_strategy': 'breakout', 'sideways_bb_std_mult': 2.432798447222426, 'sideways_rsi_os': 9, 'sideways_rsi_ob': 87, 'sideways_adx_thresh': 31.75804688156995, 'sideways_atr_min_pct': 0.00524213746349257, 'sideways_atr_max_pct': 0.14731298233439538, 'sideways_tp_mult': 2.349592154405876, 'sideways_tsl_mult': 0.7273154675775307, 'sideways_time_stop': 84, 'sideways_use_sma': True, 'sideways_use_ema': False, 'sideways_use_atr': False, 'sideways_use_adx': False, 'sideways_use_spike': False, 'sideways_rsi_required': True}.
[I 2025-08-29 20:33:06,390] Trial 481 finished with values: [-1000000000.0, 1000000000.0] and parameters: {'p_sma': 11, 'p_std': 58, 'p_atr': 17, 'p_adx': 28, 'rsi_period': 49, 'ema1': 26, 'ema2': 53, 'slip_atr_k': 0.14970388840875637, 'slip_spread_k': 0.1632183118569025, 'spread_hl_frac': 0.02946330419118376, 'bb_std_mult': 1.7391370036635694, 'rsi_os': 9, 'rsi_ob': 83, 'vol_spike': 0.17311036683959974, 'adx_thresh': 14.02412403523154, 'atr_min_pct': 0.007458141253362891, 'atr_max_pct': 0.05248192221015453, 'tp_mult': 1.3893669629741514, 'tsl_mult': 0.008787461834331267, 'strategy': 'breakout', 'time_stop': 170, 'use_sma': False, 'use_atr': False, 'use_adx': True, 'use_ema': True, 'use_spike': False, 'rsi_required': False, 'edge_k': 1.4881788462273047, 'edge_cap': 0.5927234931759717, 'bull_strategy': 'breakout', 'bull_bb_std_mult': 2.8126027910699434, 'bull_rsi_os': 14, 'bull_rsi_ob': 87, 'bull_adx_thresh': 25.580550265383103, 'bull_atr_min_pct': 0.01706720572949614, 'bull_atr_max_pct': 0.09275056078653045, 'bull_tp_mult': 2.737457843371762, 'bull_tsl_mult': 0.8217045279223147, 'bull_time_stop': 26, 'bull_use_sma': False, 'bull_use_ema': False, 'bull_use_atr': True, 'bull_use_adx': False, 'bull_use_spike': True, 'bull_rsi_required': False, 'bear_strategy': 'breakout', 'bear_bb_std_mult': 2.526278290525287, 'bear_rsi_os': 55, 'bear_rsi_ob': 68, 'bear_adx_thresh': 18.81905624166841, 'bear_atr_min_pct': 0.0083644082618978, 'bear_atr_max_pct': 0.04897075468746585, 'bear_tp_mult': 1.7027450836667515, 'bear_tsl_mult': 0.9516092645291115, 'bear_time_stop': 42, 'bear_use_sma': False, 'bear_use_ema': False, 'bear_use_atr': False, 'bear_use_adx': True, 'bear_use_spike': False, 'bear_rsi_required': False, 'sideways_strategy': 'breakout', 'sideways_bb_std_mult': 2.561174920117375, 'sideways_rsi_os': 47, 'sideways_rsi_ob': 90, 'sideways_adx_thresh': 31.8865392926237, 'sideways_atr_min_pct': 0.005376519099609581, 'sideways_atr_max_pct': 0.01770199473243462, 'sideways_tp_mult': 1.6465852480112766, 'sideways_tsl_mult': 0.7816536871831424, 'sideways_time_stop': 44, 'sideways_use_sma': False, 'sideways_use_ema': False, 'sideways_use_atr': False, 'sideways_use_adx': False, 'sideways_use_spike': True, 'sideways_rsi_required': True}.
[I 2025-08-29 20:33:06,718] Trial 480 finished with values: [-1000000000.0, 1000000000.0] and parameters: {'p_sma': 21, 'p_std': 58, 'p_atr': 7, 'p_adx': 13, 'rsi_period': 27, 'ema1': 26, 'ema2': 37, 'slip_atr_k': 0.0002645242056596084, 'slip_spread_k': 0.6490708764716844, 'spread_hl_frac': 0.029786592300174754, 'bb_std_mult': 1.7292548766138585, 'rsi_os': 9, 'rsi_ob': 83, 'vol_spike': 0.17342928949234132, 'adx_thresh': 13.778791731373214, 'atr_min_pct': 0.007504570689563299, 'atr_max_pct': 0.07697440052212122, 'tp_mult': 1.3616027180483763, 'tsl_mult': 0.8332383488915891, 'strategy': 'breakout', 'time_stop': 169, 'use_sma': False, 'use_atr': False, 'use_adx': True, 'use_ema': True, 'use_spike': False, 'rsi_required': False, 'edge_k': 0.6276085189038981, 'edge_cap': 0.5919985592545951, 'bull_strategy': 'breakout', 'bull_bb_std_mult': 2.841772177133278, 'bull_rsi_os': 24, 'bull_rsi_ob': 72, 'bull_adx_thresh': 15.48304520865888, 'bull_atr_min_pct': 0.018037211379889236, 'bull_atr_max_pct': 0.0931661572376493, 'bull_tp_mult': 2.733947219586019, 'bull_tsl_mult': 0.8117142172441644, 'bull_time_stop': 25, 'bull_use_sma': False, 'bull_use_ema': False, 'bull_use_atr': True, 'bull_use_adx': False, 'bull_use_spike': True, 'bull_rsi_required': False, 'bear_strategy': 'breakout', 'bear_bb_std_mult': 2.5106583909244273, 'bear_rsi_os': 29, 'bear_rsi_ob': 68, 'bear_adx_thresh': 18.565225594080932, 'bear_atr_min_pct': 0.008480601737242067, 'bear_atr_max_pct': 0.04919019526850408, 'bear_tp_mult': 2.8102578761551, 'bear_tsl_mult': 0.945309248499049, 'bear_time_stop': 42, 'bear_use_sma': False, 'bear_use_ema': False, 'bear_use_atr': False, 'bear_use_adx': True, 'bear_use_spike': False, 'bear_rsi_required': False, 'sideways_strategy': 'breakout', 'sideways_bb_std_mult': 2.0979595598905623, 'sideways_rsi_os': 47, 'sideways_rsi_ob': 78, 'sideways_adx_thresh': 7.658929446252005, 'sideways_atr_min_pct': 0.010715194664954537, 'sideways_atr_max_pct': 0.017850643305068345, 'sideways_tp_mult': 1.6470352950979263, 'sideways_tsl_mult': 0.782085686545723, 'sideways_time_stop': 192, 'sideways_use_sma': False, 'sideways_use_ema': False, 'sideways_use_atr': False, 'sideways_use_adx': False, 'sideways_use_spike': True, 'sideways_rsi_required': True}.
[I 2025-08-29 20:33:09,918] Trial 483 finished with values: [-1000000000.0, 1000000000.0] and parameters: {'p_sma': 12, 'p_std': 57, 'p_atr': 24, 'p_adx': 13, 'rsi_period': 33, 'ema1': 26, 'ema2': 30, 'slip_atr_k': 0.005631189340219298, 'slip_spread_k': 0.38051026332278026, 'spread_hl_frac': 0.029219162448934008, 'bb_std_mult': 2.1372734981908392, 'rsi_os': 9, 'rsi_ob': 83, 'vol_spike': 0.23131129349017504, 'adx_thresh': 11.985717308864627, 'atr_min_pct': 0.007171179973201339, 'atr_max_pct': 0.11608910687994456, 'tp_mult': 1.3744366402500316, 'tsl_mult': 0.9802063192017707, 'strategy': 'mean_reversion', 'time_stop': 161, 'use_sma': True, 'use_atr': False, 'use_adx': False, 'use_ema': True, 'use_spike': False, 'rsi_required': False, 'edge_k': 0.8173523645294065, 'edge_cap': 0.5852356778609884, 'bull_strategy': 'breakout', 'bull_bb_std_mult': 3.0684422243115907, 'bull_rsi_os': 26, 'bull_rsi_ob': 50, 'bull_adx_thresh': 25.83577211264322, 'bull_atr_min_pct': 0.016162625924924984, 'bull_atr_max_pct': 0.10376754584146239, 'bull_tp_mult': 1.9192066845483353, 'bull_tsl_mult': 0.7431851987617308, 'bull_time_stop': 48, 'bull_use_sma': True, 'bull_use_ema': False, 'bull_use_atr': True, 'bull_use_adx': False, 'bull_use_spike': True, 'bull_rsi_required': False, 'bear_strategy': 'breakout', 'bear_bb_std_mult': 0.7667251561611967, 'bear_rsi_os': 28, 'bear_rsi_ob': 55, 'bear_adx_thresh': 14.080503847892144, 'bear_atr_min_pct': 0.017595884332348214, 'bear_atr_max_pct': 0.04951948542314068, 'bear_tp_mult': 1.3297430766417238, 'bear_tsl_mult': 0.8905869360189016, 'bear_time_stop': 42, 'bear_use_sma': False, 'bear_use_ema': True, 'bear_use_atr': False, 'bear_use_adx': True, 'bear_use_spike': True, 'bear_rsi_required': False, 'sideways_strategy': 'breakout', 'sideways_bb_std_mult': 2.5297955876488096, 'sideways_rsi_os': 47, 'sideways_rsi_ob': 78, 'sideways_adx_thresh': 31.262366344352102, 'sideways_atr_min_pct': 0.010768725093854485, 'sideways_atr_max_pct': 0.08483146442251811, 'sideways_tp_mult': 1.3628860707907489, 'sideways_tsl_mult': 0.6792058645406571, 'sideways_time_stop': 155, 'sideways_use_sma': False, 'sideways_use_ema': False, 'sideways_use_atr': False, 'sideways_use_adx': False, 'sideways_use_spike': False, 'sideways_rsi_required': True}.
[I 2025-08-29 20:33:10,013] Trial 482 finished with values: [-3.7054407397429934e-05, 0.0009614778925291983] and parameters: {'p_sma': 54, 'p_std': 42, 'p_atr': 17, 'p_adx': 28, 'rsi_period': 63, 'ema1': 25, 'ema2': 45, 'slip_atr_k': 0.0002536535432448722, 'slip_spread_k': 0.7888409418432045, 'spread_hl_frac': 0.029154903164013042, 'bb_std_mult': 2.41360296110226, 'rsi_os': 9, 'rsi_ob': 73, 'vol_spike': 0.17308541238227781, 'adx_thresh': 13.911466042075979, 'atr_min_pct': 0.020421632507071737, 'atr_max_pct': 0.07590228536062921, 'tp_mult': 1.3846655579687441, 'tsl_mult': 0.28652622092661784, 'strategy': 'mean_reversion', 'time_stop': 69, 'use_sma': False, 'use_atr': False, 'use_adx': True, 'use_ema': True, 'use_spike': False, 'rsi_required': False, 'edge_k': 0.9929707166213276, 'edge_cap': 0.5876646069994509, 'bull_strategy': 'breakout', 'bull_bb_std_mult': 2.85247080315224, 'bull_rsi_os': 14, 'bull_rsi_ob': 72, 'bull_adx_thresh': 12.747255044726456, 'bull_atr_min_pct': 0.016925787498150376, 'bull_atr_max_pct': 0.09626499598610615, 'bull_tp_mult': 2.6848247632715005, 'bull_tsl_mult': 0.8235592001796045, 'bull_time_stop': 37, 'bull_use_sma': False, 'bull_use_ema': False, 'bull_use_atr': True, 'bull_use_adx': False, 'bull_use_spike': True, 'bull_rsi_required': False, 'bear_strategy': 'breakout', 'bear_bb_std_mult': 1.6468838728231914, 'bear_rsi_os': 29, 'bear_rsi_ob': 82, 'bear_adx_thresh': 18.610726878051402, 'bear_atr_min_pct': 0.0052545083137838615, 'bear_atr_max_pct': 0.09010747913857016, 'bear_tp_mult': 1.2807406810418465, 'bear_tsl_mult': 0.9553879298029013, 'bear_time_stop': 179, 'bear_use_sma': False, 'bear_use_ema': False, 'bear_use_atr': False, 'bear_use_adx': True, 'bear_use_spike': False, 'bear_rsi_required': False, 'sideways_strategy': 'breakout', 'sideways_bb_std_mult': 2.5346818893978167, 'sideways_rsi_os': 47, 'sideways_rsi_ob': 74, 'sideways_adx_thresh': 31.647488135373347, 'sideways_atr_min_pct': 0.005459399469579465, 'sideways_atr_max_pct': 0.10813101764210832, 'sideways_tp_mult': 1.595792933333287, 'sideways_tsl_mult': 0.549914741649655, 'sideways_time_stop': 156, 'sideways_use_sma': False, 'sideways_use_ema': False, 'sideways_use_atr': False, 'sideways_use_adx': False, 'sideways_use_spike': False, 'sideways_rsi_required': True}.
[I 2025-08-29 20:33:39,510] Trial 484 finished with values: [-0.0011293682778852343, 0.0016521743051784337] and parameters: {'p_sma': 22, 'p_std': 25, 'p_atr': 24, 'p_adx': 13, 'rsi_period': 63, 'ema1': 27, 'ema2': 30, 'slip_atr_k': 0.16686808057409613, 'slip_spread_k': 0.18635805650575346, 'spread_hl_frac': 0.014107660968513657, 'bb_std_mult': 1.6331784797121374, 'rsi_os': 10, 'rsi_ob': 82, 'vol_spike': 0.013166146915497001, 'adx_thresh': 12.8946642723667, 'atr_min_pct': 0.010485787354032102, 'atr_max_pct': 0.1156477826283199, 'tp_mult': 1.386926265630465, 'tsl_mult': 0.834590834211544, 'strategy': 'mean_reversion', 'time_stop': 65, 'use_sma': True, 'use_atr': False, 'use_adx': False, 'use_ema': True, 'use_spike': False, 'rsi_required': False, 'edge_k': 0.6281404715406926, 'edge_cap': 0.5736203985822035, 'bull_strategy': 'breakout', 'bull_bb_std_mult': 2.9807671581493045, 'bull_rsi_os': 25, 'bull_rsi_ob': 50, 'bull_adx_thresh': 12.766968632716084, 'bull_atr_min_pct': 0.016046548531874247, 'bull_atr_max_pct': 0.14656723057239135, 'bull_tp_mult': 2.6905313949613694, 'bull_tsl_mult': 0.4886396444151132, 'bull_time_stop': 47, 'bull_use_sma': True, 'bull_use_ema': False, 'bull_use_atr': True, 'bull_use_adx': False, 'bull_use_spike': True, 'bull_rsi_required': False, 'bear_strategy': 'breakout', 'bear_bb_std_mult': 2.81402051501419, 'bear_rsi_os': 28, 'bear_rsi_ob': 69, 'bear_adx_thresh': 10.559815554258003, 'bear_atr_min_pct': 0.005691926797133854, 'bear_atr_max_pct': 0.05425102424964947, 'bear_tp_mult': 2.3962319659455598, 'bear_tsl_mult': 0.8873546901870404, 'bear_time_stop': 61, 'bear_use_sma': False, 'bear_use_ema': True, 'bear_use_atr': False, 'bear_use_adx': True, 'bear_use_spike': True, 'bear_rsi_required': False, 'sideways_strategy': 'breakout', 'sideways_bb_std_mult': 2.373134769483353, 'sideways_rsi_os': 43, 'sideways_rsi_ob': 78, 'sideways_adx_thresh': 31.280440191912348, 'sideways_atr_min_pct': 0.00461353246359664, 'sideways_atr_max_pct': 0.029829924053636506, 'sideways_tp_mult': 1.0918432679125514, 'sideways_tsl_mult': 0.12405537793782517, 'sideways_time_stop': 157, 'sideways_use_sma': False, 'sideways_use_ema': False, 'sideways_use_atr': False, 'sideways_use_adx': False, 'sideways_use_spike': False, 'sideways_rsi_required': False}.
[I 2025-08-29 20:33:40,180] Trial 485 finished with values: [6.305586935217988e-05, 0.0008877738258062706] and parameters: {'p_sma': 34, 'p_std': 42, 'p_atr': 26, 'p_adx': 25, 'rsi_period': 34, 'ema1': 27, 'ema2': 19, 'slip_atr_k': 0.004319570282709604, 'slip_spread_k': 0.5987202118227067, 'spread_hl_frac': 0.049156910944636624, 'bb_std_mult': 2.212841943462403, 'rsi_os': 10, 'rsi_ob': 61, 'vol_spike': 0.185084704146448, 'adx_thresh': 12.090044860456322, 'atr_min_pct': 0.022145718223676895, 'atr_max_pct': 0.11859390454459251, 'tp_mult': 1.3884094178686877, 'tsl_mult': 0.9340302874308566, 'strategy': 'mean_reversion', 'time_stop': 160, 'use_sma': True, 'use_atr': False, 'use_adx': False, 'use_ema': True, 'use_spike': False, 'rsi_required': False, 'edge_k': 0.686132437603291, 'edge_cap': 0.5778649855305489, 'bull_strategy': 'mean_reversion', 'bull_bb_std_mult': 2.970002301038225, 'bull_rsi_os': 24, 'bull_rsi_ob': 70, 'bull_adx_thresh': 12.64238615118507, 'bull_atr_min_pct': 0.01603659009209347, 'bull_atr_max_pct': 0.09590085830426776, 'bull_tp_mult': 2.689067199616135, 'bull_tsl_mult': 0.5533653252438469, 'bull_time_stop': 47, 'bull_use_sma': True, 'bull_use_ema': False, 'bull_use_atr': True, 'bull_use_adx': False, 'bull_use_spike': True, 'bull_rsi_required': False, 'bear_strategy': 'breakout', 'bear_bb_std_mult': 2.8092901062066282, 'bear_rsi_os': 28, 'bear_rsi_ob': 60, 'bear_adx_thresh': 10.449104511180387, 'bear_atr_min_pct': 0.005245131555921479, 'bear_atr_max_pct': 0.09797291786671536, 'bear_tp_mult': 2.732527043976439, 'bear_tsl_mult': 0.8926872786136133, 'bear_time_stop': 60, 'bear_use_sma': False, 'bear_use_ema': True, 'bear_use_atr': False, 'bear_use_adx': True, 'bear_use_spike': True, 'bear_rsi_required': False, 'sideways_strategy': 'breakout', 'sideways_bb_std_mult': 2.3683441562796608, 'sideways_rsi_os': 50, 'sideways_rsi_ob': 69, 'sideways_adx_thresh': 32.91634835788153, 'sideways_atr_min_pct': 0.02104348299366935, 'sideways_atr_max_pct': 0.10179865366822792, 'sideways_tp_mult': 1.7492352266925735, 'sideways_tsl_mult': 0.7470276589176895, 'sideways_time_stop': 183, 'sideways_use_sma': False, 'sideways_use_ema': False, 'sideways_use_atr': False, 'sideways_use_adx': False, 'sideways_use_spike': False, 'sideways_rsi_required': False}.
