[I 2025-08-29 19:45:20,879] Trial 70 finished with values: [-1000000000.0, 1000000000.0] and parameters: {'p_sma': 39, 'p_std': 60, 'p_atr': 13, 'p_adx': 26, 'rsi_period': 19, 'ema1': 24, 'ema2': 42, 'slip_atr_k': 0.06719079947582401, 'slip_spread_k': 0.06437039798126987, 'spread_hl_frac': 0.03130370398758864, 'bb_std_mult': 0.723989633138341, 'rsi_os': 23, 'rsi_ob': 80, 'vol_spike': 0.18254752779117167, 'adx_thresh': 21.752283366595776, 'atr_min_pct': 0.00016738887303275273, 'atr_max_pct': 0.07848127391615795, 'tp_mult': 2.7561753146900863, 'tsl_mult': 0.18995778559128573, 'strategy': 'mean_reversion', 'time_stop': 183, 'use_sma': True, 'use_atr': True, 'use_adx': True, 'use_ema': False, 'use_spike': True, 'rsi_required': True, 'edge_k': 1.035264366310703, 'edge_cap': 0.7191285752948249, 'bull_strategy': 'mean_reversion', 'bull_bb_std_mult': 3.5934713487177934, 'bull_rsi_os': 29, 'bull_rsi_ob': 59, 'bull_adx_thresh': 18.628989189316037, 'bull_atr_min_pct': 0.024012126461571616, 'bull_atr_max_pct': 0.019303756415955907, 'bull_tp_mult': 2.813890032240289, 'bull_tsl_mult': 0.2488249358569824, 'bull_time_stop': 139, 'bull_use_sma': False, 'bull_use_ema': True, 'bull_use_atr': True, 'bull_use_adx': True, 'bull_use_spike': True, 'bull_rsi_required': False, 'bear_strategy': 'breakout', 'bear_bb_std_mult': 0.8475064504936166, 'bear_rsi_os': 50, 'bear_rsi_ob': 48, 'bear_adx_thresh': 6.4648319479529155, 'bear_atr_min_pct': 0.011035805051403846, 'bear_atr_max_pct': 0.07746782814991979, 'bear_tp_mult': 2.8604760792861006, 'bear_tsl_mult': 0.7256103590632005, 'bear_time_stop': 158, 'bear_use_sma': True, 'bear_use_ema': False, 'bear_use_atr': False, 'bear_use_adx': False, 'bear_use_spike': False, 'bear_rsi_required': False, 'sideways_strategy': 'breakout', 'sideways_bb_std_mult': 1.3509444046617747, 'sideways_rsi_os': 7, 'sideways_rsi_ob': 81, 'sideways_adx_thresh': 16.82430215613003, 'sideways_atr_min_pct': 0.010005536329497605, 'sideways_atr_max_pct': 0.12633890803566206, 'sideways_tp_mult': 2.9124150219855647, 'sideways_tsl_mult': 0.3357505863379728, 'sideways_time_stop': 168, 'sideways_use_sma': True, 'sideways_use_ema': True, 'sideways_use_atr': True, 'sideways_use_adx': False, 'sideways_use_spike': True, 'sideways_rsi_required': True}.
[I 2025-08-29 19:45:20,962] Trial 69 finished with values: [-0.034108872756082764, 0.03408977199756027] and parameters: {'p_sma': 15, 'p_std': 19, 'p_atr': 13, 'p_adx': 28, 'rsi_period': 12, 'ema1': 23, 'ema2': 45, 'slip_atr_k': 0.061799553054726133, 'slip_spread_k': 0.10335370529636367, 'spread_hl_frac': 0.03330292535751096, 'bb_std_mult': 2.9841282011157713, 'rsi_os': 18, 'rsi_ob': 80, 'vol_spike': 0.15829400125171186, 'adx_thresh': 10.496014426480137, 'atr_min_pct': 0.028026839281815187, 'atr_max_pct': 0.08603400303912416, 'tp_mult': 2.751184418322562, 'tsl_mult': 0.3617436487577126, 'strategy': 'mean_reversion', 'time_stop': 212, 'use_sma': True, 'use_atr': False, 'use_adx': False, 'use_ema': False, 'use_spike': True, 'rsi_required': True, 'edge_k': 1.8273279537710585, 'edge_cap': 0.5388819692182732, 'bull_strategy': 'mean_reversion', 'bull_bb_std_mult': 0.7060643310127357, 'bull_rsi_os': 6, 'bull_rsi_ob': 90, 'bull_adx_thresh': 18.84215174348895, 'bull_atr_min_pct': 0.024085572871202027, 'bull_atr_max_pct': 0.08165286882655474, 'bull_tp_mult': 1.4084214618056157, 'bull_tsl_mult': 0.2913790738708088, 'bull_time_stop': 264, 'bull_use_sma': False, 'bull_use_ema': True, 'bull_use_atr': False, 'bull_use_adx': True, 'bull_use_spike': True, 'bull_rsi_required': False, 'bear_strategy': 'breakout', 'bear_bb_std_mult': 1.0718269056629397, 'bear_rsi_os': 50, 'bear_rsi_ob': 67, 'bear_adx_thresh': 14.137577885820836, 'bear_atr_min_pct': 0.0032146906176933423, 'bear_atr_max_pct': 0.015544525195424638, 'bear_tp_mult': 2.8851814085187417, 'bear_tsl_mult': 0.04171600934967923, 'bear_time_stop': 159, 'bear_use_sma': True, 'bear_use_ema': False, 'bear_use_atr': False, 'bear_use_adx': False, 'bear_use_spike': False, 'bear_rsi_required': False, 'sideways_strategy': 'mean_reversion', 'sideways_bb_std_mult': 1.0219672351747462, 'sideways_rsi_os': 43, 'sideways_rsi_ob': 81, 'sideways_adx_thresh': 19.503589531628652, 'sideways_atr_min_pct': 0.02151077475365858, 'sideways_atr_max_pct': 0.09737149575694827, 'sideways_tp_mult': 2.2308026096075446, 'sideways_tsl_mult': 0.03437189809938751, 'sideways_time_stop': 221, 'sideways_use_sma': True, 'sideways_use_ema': True, 'sideways_use_atr': False, 'sideways_use_adx': False, 'sideways_use_spike': True, 'sideways_rsi_required': True}.
[I 2025-08-29 19:45:52,145] Trial 74 finished with values: [-1000000000.0, 1000000000.0] and parameters: {'p_sma': 38, 'p_std': 45, 'p_atr': 20, 'p_adx': 20, 'rsi_period': 7, 'ema1': 13, 'ema2': 44, 'slip_atr_k': 0.031245092831417784, 'slip_spread_k': 0.31222491120769, 'spread_hl_frac': 0.0445766700803259, 'bb_std_mult': 0.9475254551721678, 'rsi_os': 5, 'rsi_ob': 88, 'vol_spike': 0.18446282524498148, 'adx_thresh': 14.29693678134548, 'atr_min_pct': 0.004372340977521558, 'atr_max_pct': 0.0854602262194429, 'tp_mult': 1.9041721792529402, 'tsl_mult': 0.4055801914494456, 'strategy': 'breakout', 'time_stop': 268, 'use_sma': False, 'use_atr': True, 'use_adx': True, 'use_ema': False, 'use_spike': True, 'rsi_required': True, 'edge_k': 1.7940968526961307, 'edge_cap': 0.8078426720938187, 'bull_strategy': 'mean_reversion', 'bull_bb_std_mult': 3.140461890782427, 'bull_rsi_os': 38, 'bull_rsi_ob': 94, 'bull_adx_thresh': 11.037956882286467, 'bull_atr_min_pct': 0.02014093868584436, 'bull_atr_max_pct': 0.06495733655655346, 'bull_tp_mult': 2.9973211976313867, 'bull_tsl_mult': 0.2459932369134796, 'bull_time_stop': 257, 'bull_use_sma': True, 'bull_use_ema': True, 'bull_use_atr': False, 'bull_use_adx': True, 'bull_use_spike': True, 'bull_rsi_required': False, 'bear_strategy': 'breakout', 'bear_bb_std_mult': 0.8914012740156545, 'bear_rsi_os': 38, 'bear_rsi_ob': 72, 'bear_adx_thresh': 8.352169094008348, 'bear_atr_min_pct': 0.018898686803134918, 'bear_atr_max_pct': 0.10743876739466483, 'bear_tp_mult': 2.6718586506450794, 'bear_tsl_mult': 0.5983698422278737, 'bear_time_stop': 236, 'bear_use_sma': True, 'bear_use_ema': False, 'bear_use_atr': True, 'bear_use_adx': False, 'bear_use_spike': False, 'bear_rsi_required': False, 'sideways_strategy': 'mean_reversion', 'sideways_bb_std_mult': 1.3701077457537312, 'sideways_rsi_os': 29, 'sideways_rsi_ob': 81, 'sideways_adx_thresh': 7.2513601239745515, 'sideways_atr_min_pct': 0.010407901568552322, 'sideways_atr_max_pct': 0.12292489059535477, 'sideways_tp_mult': 1.643842881459371, 'sideways_tsl_mult': 0.3484638835488803, 'sideways_time_stop': 22, 'sideways_use_sma': True, 'sideways_use_ema': True, 'sideways_use_atr': True, 'sideways_use_adx': False, 'sideways_use_spike': False, 'sideways_rsi_required': False}.
[I 2025-08-29 19:45:52,436] Trial 76 finished with values: [-1000000000.0, 1000000000.0] and parameters: {'p_sma': 45, 'p_std': 25, 'p_atr': 20, 'p_adx': 20, 'rsi_period': 7, 'ema1': 14, 'ema2': 25, 'slip_atr_k': 0.04570696013822264, 'slip_spread_k': 0.6370349138934612, 'spread_hl_frac': 0.03545346356606884, 'bb_std_mult': 2.5956689455137214, 'rsi_os': 46, 'rsi_ob': 88, 'vol_spike': 0.15178469458252122, 'adx_thresh': 13.904461118405276, 'atr_min_pct': 0.004532029123830719, 'atr_max_pct': 0.0883537374265821, 'tp_mult': 1.8962315599940225, 'tsl_mult': 0.09504577077709753, 'strategy': 'breakout', 'time_stop': 210, 'use_sma': False, 'use_atr': True, 'use_adx': True, 'use_ema': False, 'use_spike': True, 'rsi_required': True, 'edge_k': 1.7358751284572047, 'edge_cap': 0.7944878603421431, 'bull_strategy': 'mean_reversion', 'bull_bb_std_mult': 0.7890175068364054, 'bull_rsi_os': 43, 'bull_rsi_ob': 94, 'bull_adx_thresh': 10.817614775156695, 'bull_atr_min_pct': 0.02255365036291874, 'bull_atr_max_pct': 0.12472029148995542, 'bull_tp_mult': 1.7151638834906284, 'bull_tsl_mult': 0.8951054706189501, 'bull_time_stop': 287, 'bull_use_sma': True, 'bull_use_ema': True, 'bull_use_atr': False, 'bull_use_adx': True, 'bull_use_spike': False, 'bull_rsi_required': False, 'bear_strategy': 'breakout', 'bear_bb_std_mult': 0.6582999380570078, 'bear_rsi_os': 11, 'bear_rsi_ob': 75, 'bear_adx_thresh': 5.757791598162385, 'bear_atr_min_pct': 0.019312781341106932, 'bear_atr_max_pct': 0.12218432394237111, 'bear_tp_mult': 2.280865223578114, 'bear_tsl_mult': 0.5914969879186598, 'bear_time_stop': 146, 'bear_use_sma': True, 'bear_use_ema': False, 'bear_use_atr': True, 'bear_use_adx': False, 'bear_use_spike': False, 'bear_rsi_required': False, 'sideways_strategy': 'mean_reversion', 'sideways_bb_std_mult': 1.129146141952933, 'sideways_rsi_os': 42, 'sideways_rsi_ob': 86, 'sideways_adx_thresh': 30.166787467657652, 'sideways_atr_min_pct': 0.015932825822479704, 'sideways_atr_max_pct': 0.0825870379374142, 'sideways_tp_mult': 1.0132712453187538, 'sideways_tsl_mult': 0.7127395235627667, 'sideways_time_stop': 80, 'sideways_use_sma': False, 'sideways_use_ema': True, 'sideways_use_atr': True, 'sideways_use_adx': False, 'sideways_use_spike': False, 'sideways_rsi_required': False}.
[I 2025-08-29 19:45:52,786] Trial 75 finished with values: [-1000000000.0, 1000000000.0] and parameters: {'p_sma': 46, 'p_std': 60, 'p_atr': 14, 'p_adx': 21, 'rsi_period': 8, 'ema1': 13, 'ema2': 41, 'slip_atr_k': 0.011353784985660038, 'slip_spread_k': 0.14984321498094572, 'spread_hl_frac': 0.01450849689062054, 'bb_std_mult': 1.9933159777218155, 'rsi_os': 25, 'rsi_ob': 88, 'vol_spike': 0.13391236680779706, 'adx_thresh': 14.397775948505796, 'atr_min_pct': 0.002957429038155058, 'atr_max_pct': 0.07910777551460843, 'tp_mult': 1.9184789359280752, 'tsl_mult': 0.09007206040197208, 'strategy': 'breakout', 'time_stop': 268, 'use_sma': False, 'use_atr': True, 'use_adx': True, 'use_ema': False, 'use_spike': True, 'rsi_required': True, 'edge_k': 0.6544081697459052, 'edge_cap': 0.21047262524762578, 'bull_strategy': 'mean_reversion', 'bull_bb_std_mult': 3.5992105623542696, 'bull_rsi_os': 43, 'bull_rsi_ob': 94, 'bull_adx_thresh': 10.807863771168966, 'bull_atr_min_pct': 0.020396732285192856, 'bull_atr_max_pct': 0.1252679086100199, 'bull_tp_mult': 2.613453104055857, 'bull_tsl_mult': 0.2439103608640571, 'bull_time_stop': 262, 'bull_use_sma': True, 'bull_use_ema': True, 'bull_use_atr': False, 'bull_use_adx': True, 'bull_use_spike': False, 'bull_rsi_required': False, 'bear_strategy': 'breakout', 'bear_bb_std_mult': 0.8526582454771712, 'bear_rsi_os': 49, 'bear_rsi_ob': 72, 'bear_adx_thresh': 6.531397508738121, 'bear_atr_min_pct': 0.011336955997720154, 'bear_atr_max_pct': 0.12350644773655128, 'bear_tp_mult': 1.6401850369500925, 'bear_tsl_mult': 0.377187339133941, 'bear_time_stop': 175, 'bear_use_sma': True, 'bear_use_ema': False, 'bear_use_atr': True, 'bear_use_adx': False, 'bear_use_spike': False, 'bear_rsi_required': False, 'sideways_strategy': 'mean_reversion', 'sideways_bb_std_mult': 1.1534448760168479, 'sideways_rsi_os': 15, 'sideways_rsi_ob': 81, 'sideways_adx_thresh': 6.940283473724779, 'sideways_atr_min_pct': 0.014043379174418688, 'sideways_atr_max_pct': 0.0652299559543446, 'sideways_tp_mult': 2.9280588574202615, 'sideways_tsl_mult': 0.19214716108296565, 'sideways_time_stop': 82, 'sideways_use_sma': True, 'sideways_use_ema': True, 'sideways_use_atr': True, 'sideways_use_adx': False, 'sideways_use_spike': False, 'sideways_rsi_required': False}.
[I 2025-08-29 19:45:52,856] Trial 77 finished with values: [-1000000000.0, 1000000000.0] and parameters: {'p_sma': 9, 'p_std': 5, 'p_atr': 20, 'p_adx': 20, 'rsi_period': 39, 'ema1': 9, 'ema2': 34, 'slip_atr_k': 0.04645811521565748, 'slip_spread_k': 0.3757889593406949, 'spread_hl_frac': 0.027093083064705176, 'bb_std_mult': 2.0093536011211373, 'rsi_os': 5, 'rsi_ob': 88, 'vol_spike': 0.10494556465542063, 'adx_thresh': 14.40841500793813, 'atr_min_pct': 0.004696832770272, 'atr_max_pct': 0.07079635742791981, 'tp_mult': 2.54011629914795, 'tsl_mult': 0.5294443810272913, 'strategy': 'breakout', 'time_stop': 277, 'use_sma': False, 'use_atr': True, 'use_adx': True, 'use_ema': False, 'use_spike': True, 'rsi_required': True, 'edge_k': 1.7344783268715955, 'edge_cap': 0.804531951304153, 'bull_strategy': 'mean_reversion', 'bull_bb_std_mult': 1.7859626482221587, 'bull_rsi_os': 43, 'bull_rsi_ob': 47, 'bull_adx_thresh': 28.903445139319338, 'bull_atr_min_pct': 0.022502277252744583, 'bull_atr_max_pct': 0.062368699099843765, 'bull_tp_mult': 1.0433282471761403, 'bull_tsl_mult': 0.3553065640018598, 'bull_time_stop': 161, 'bull_use_sma': True, 'bull_use_ema': True, 'bull_use_atr': False, 'bull_use_adx': True, 'bull_use_spike': False, 'bull_rsi_required': False, 'bear_strategy': 'breakout', 'bear_bb_std_mult': 2.1160592604975204, 'bear_rsi_os': 11, 'bear_rsi_ob': 75, 'bear_adx_thresh': 10.385646106922087, 'bear_atr_min_pct': 0.01844205800205449, 'bear_atr_max_pct': 0.1117548452988857, 'bear_tp_mult': 1.5707884481933427, 'bear_tsl_mult': 0.5969860886714481, 'bear_time_stop': 146, 'bear_use_sma': True, 'bear_use_ema': False, 'bear_use_atr': True, 'bear_use_adx': False, 'bear_use_spike': False, 'bear_rsi_required': False, 'sideways_strategy': 'mean_reversion', 'sideways_bb_std_mult': 1.1683329495702242, 'sideways_rsi_os': 29, 'sideways_rsi_ob': 88, 'sideways_adx_thresh': 30.294084574013752, 'sideways_atr_min_pct': 0.029974982120680647, 'sideways_atr_max_pct': 0.026625206973110577, 'sideways_tp_mult': 1.1269821868853005, 'sideways_tsl_mult': 0.684411559532949, 'sideways_time_stop': 273, 'sideways_use_sma': False, 'sideways_use_ema': True, 'sideways_use_atr': True, 'sideways_use_adx': False, 'sideways_use_spike': False, 'sideways_rsi_required': False}.
[I 2025-08-29 19:46:21,610] Trial 80 finished with values: [-0.020293447935431086, 0.020249864646277364] and parameters: {'p_sma': 8, 'p_std': 5, 'p_atr': 24, 'p_adx': 24, 'rsi_period': 15, 'ema1': 9, 'ema2': 38, 'slip_atr_k': 0.018164851873120964, 'slip_spread_k': 0.5369309733458976, 'spread_hl_frac': 0.04788629547246619, 'bb_std_mult': 3.3835685343198802, 'rsi_os': 55, 'rsi_ob': 83, 'vol_spike': 0.10670422628608173, 'adx_thresh': 16.401148359966466, 'atr_min_pct': 0.02237006492207832, 'atr_max_pct': 0.0710566927667136, 'tp_mult': 2.607676161065681, 'tsl_mult': 0.5267089967887124, 'strategy': 'breakout', 'time_stop': 299, 'use_sma': False, 'use_atr': False, 'use_adx': True, 'use_ema': True, 'use_spike': False, 'rsi_required': False, 'edge_k': 1.6937073252992867, 'edge_cap': 0.6390121379392638, 'bull_strategy': 'mean_reversion', 'bull_bb_std_mult': 1.0061815816286988, 'bull_rsi_os': 19, 'bull_rsi_ob': 48, 'bull_adx_thresh': 28.595613211850747, 'bull_atr_min_pct': 0.007264265103505827, 'bull_atr_max_pct': 0.10154006446744943, 'bull_tp_mult': 2.0271350086130537, 'bull_tsl_mult': 0.1940531618491786, 'bull_time_stop': 220, 'bull_use_sma': True, 'bull_use_ema': False, 'bull_use_atr': False, 'bull_use_adx': False, 'bull_use_spike': True, 'bull_rsi_required': False, 'bear_strategy': 'mean_reversion', 'bear_bb_std_mult': 1.2776079311582818, 'bear_rsi_os': 43, 'bear_rsi_ob': 64, 'bear_adx_thresh': 10.961695940176824, 'bear_atr_min_pct': 0.0024786655270729267, 'bear_atr_max_pct': 0.11168412482951698, 'bear_tp_mult': 2.417678190432712, 'bear_tsl_mult': 0.9549651957269438, 'bear_time_stop': 34, 'bear_use_sma': False, 'bear_use_ema': True, 'bear_use_atr': True, 'bear_use_adx': True, 'bear_use_spike': True, 'bear_rsi_required': True, 'sideways_strategy': 'mean_reversion', 'sideways_bb_std_mult': 3.1390255077357745, 'sideways_rsi_os': 49, 'sideways_rsi_ob': 75, 'sideways_adx_thresh': 28.440256295677415, 'sideways_atr_min_pct': 0.020402168338618208, 'sideways_atr_max_pct': 0.13501309284011137, 'sideways_tp_mult': 1.1689135501066787, 'sideways_tsl_mult': 0.26622486259639, 'sideways_time_stop': 299, 'sideways_use_sma': False, 'sideways_use_ema': False, 'sideways_use_atr': True, 'sideways_use_adx': True, 'sideways_use_spike': False, 'sideways_rsi_required': False}.
[I 2025-08-29 19:46:21,775] Trial 78 finished with values: [-1000000000.0, 1000000000.0] and parameters: {'p_sma': 45, 'p_std': 25, 'p_atr': 24, 'p_adx': 23, 'rsi_period': 43, 'ema1': 9, 'ema2': 33, 'slip_atr_k': 0.014395382793282212, 'slip_spread_k': 0.37444843932323363, 'spread_hl_frac': 0.01631712513338731, 'bb_std_mult': 3.364854544871849, 'rsi_os': 30, 'rsi_ob': 84, 'vol_spike': 0.10464390934284362, 'adx_thresh': 16.169059122982034, 'atr_min_pct': 0.0031702217628149726, 'atr_max_pct': 0.07051697486462657, 'tp_mult': 1.6344630772461533, 'tsl_mult': 0.46451631836080814, 'strategy': 'breakout', 'time_stop': 227, 'use_sma': False, 'use_atr': True, 'use_adx': True, 'use_ema': True, 'use_spike': True, 'rsi_required': True, 'edge_k': 1.7302336056672942, 'edge_cap': 0.6322451406851208, 'bull_strategy': 'mean_reversion', 'bull_bb_std_mult': 1.0450139869706805, 'bull_rsi_os': 44, 'bull_rsi_ob': 94, 'bull_adx_thresh': 29.11973607407873, 'bull_atr_min_pct': 0.02045091618119987, 'bull_atr_max_pct': 0.12190061699085303, 'bull_tp_mult': 1.737278159382085, 'bull_tsl_mult': 0.3585079816611786, 'bull_time_stop': 216, 'bull_use_sma': True, 'bull_use_ema': True, 'bull_use_atr': False, 'bull_use_adx': False, 'bull_use_spike': False, 'bull_rsi_required': False, 'bear_strategy': 'breakout', 'bear_bb_std_mult': 1.2579467247666152, 'bear_rsi_os': 44, 'bear_rsi_ob': 63, 'bear_adx_thresh': 6.923744472389225, 'bear_atr_min_pct': 0.022117715950134245, 'bear_atr_max_pct': 0.12312855742809295, 'bear_tp_mult': 1.7023984398436585, 'bear_tsl_mult': 0.38815249294033866, 'bear_time_stop': 145, 'bear_use_sma': False, 'bear_use_ema': False, 'bear_use_atr': True, 'bear_use_adx': True, 'bear_use_spike': True, 'bear_rsi_required': False, 'sideways_strategy': 'mean_reversion', 'sideways_bb_std_mult': 1.2057425015788292, 'sideways_rsi_os': 15, 'sideways_rsi_ob': 75, 'sideways_adx_thresh': 21.59549669723229, 'sideways_atr_min_pct': 0.006845577486609657, 'sideways_atr_max_pct': 0.029304903347015195, 'sideways_tp_mult': 1.9829088954203686, 'sideways_tsl_mult': 0.7007274809058736, 'sideways_time_stop': 83, 'sideways_use_sma': False, 'sideways_use_ema': False, 'sideways_use_atr': True, 'sideways_use_adx': False, 'sideways_use_spike': False, 'sideways_rsi_required': False}.
[I 2025-08-29 19:46:22,020] Trial 81 finished with values: [-1000000000.0, 1000000000.0] and parameters: {'p_sma': 41, 'p_std': 55, 'p_atr': 26, 'p_adx': 24, 'rsi_period': 11, 'ema1': 12, 'ema2': 50, 'slip_atr_k': 0.021492207749542643, 'slip_spread_k': 0.5282911084831738, 'spread_hl_frac': 0.008948543804582692, 'bb_std_mult': 2.268630805838804, 'rsi_os': 44, 'rsi_ob': 84, 'vol_spike': 0.14104281732339616, 'adx_thresh': 15.79689355723268, 'atr_min_pct': 0.001827845084352261, 'atr_max_pct': 0.10001499792683902, 'tp_mult': 1.6469349365734494, 'tsl_mult': 0.4628800340388851, 'strategy': 'breakout', 'time_stop': 229, 'use_sma': False, 'use_atr': False, 'use_adx': False, 'use_ema': True, 'use_spike': False, 'rsi_required': False, 'edge_k': 0.9076412262684745, 'edge_cap': 0.6595747438789029, 'bull_strategy': 'mean_reversion', 'bull_bb_std_mult': 1.8309593471777368, 'bull_rsi_os': 15, 'bull_rsi_ob': 86, 'bull_adx_thresh': 9.324833074418606, 'bull_atr_min_pct': 0.008119069092551565, 'bull_atr_max_pct': 0.06728591294534925, 'bull_tp_mult': 2.947036877368573, 'bull_tsl_mult': 0.43650614601790916, 'bull_time_stop': 243, 'bull_use_sma': True, 'bull_use_ema': False, 'bull_use_atr': True, 'bull_use_adx': False, 'bull_use_spike': True, 'bull_rsi_required': True, 'bear_strategy': 'mean_reversion', 'bear_bb_std_mult': 1.2641832129143464, 'bear_rsi_os': 14, 'bear_rsi_ob': 64, 'bear_adx_thresh': 7.142195140179829, 'bear_atr_min_pct': 0.02163883357814122, 'bear_atr_max_pct': 0.037397956896520874, 'bear_tp_mult': 1.376467403895809, 'bear_tsl_mult': 0.681861033033994, 'bear_time_stop': 35, 'bear_use_sma': False, 'bear_use_ema': True, 'bear_use_atr': True, 'bear_use_adx': True, 'bear_use_spike': True, 'bear_rsi_required': True, 'sideways_strategy': 'breakout', 'sideways_bb_std_mult': 1.4667231416797402, 'sideways_rsi_os': 46, 'sideways_rsi_ob': 70, 'sideways_adx_thresh': 28.513953135705712, 'sideways_atr_min_pct': 0.022909986450541556, 'sideways_atr_max_pct': 0.1323399250825574, 'sideways_tp_mult': 1.9968698656695787, 'sideways_tsl_mult': 0.2624290348473809, 'sideways_time_stop': 300, 'sideways_use_sma': True, 'sideways_use_ema': False, 'sideways_use_atr': False, 'sideways_use_adx': True, 'sideways_use_spike': False, 'sideways_rsi_required': False}.
