[I 2025-08-29 19:49:27,338] Trial 108 finished with values: [-1000000000.0, 1000000000.0] and parameters: {'p_sma': 40, 'p_std': 9, 'p_atr': 13, 'p_adx': 24, 'rsi_period': 18, 'ema1': 10, 'ema2': 41, 'slip_atr_k': 0.009548568944821575, 'slip_spread_k': 0.5023804898755253, 'spread_hl_frac': 0.0453635713494293, 'bb_std_mult': 2.966923835249467, 'rsi_os': 22, 'rsi_ob': 79, 'vol_spike': 0.16820934357422712, 'adx_thresh': 33.79474561247191, 'atr_min_pct': 0.011829714136173975, 'atr_max_pct': 0.11028352969877332, 'tp_mult': 2.822583668578909, 'tsl_mult': 0.47199576981530583, 'strategy': 'breakout', 'time_stop': 192, 'use_sma': False, 'use_atr': True, 'use_adx': True, 'use_ema': True, 'use_spike': True, 'rsi_required': True, 'edge_k': 1.6744893039595068, 'edge_cap': 0.9773135099558825, 'bull_strategy': 'mean_reversion', 'bull_bb_std_mult': 1.1660330465456, 'bull_rsi_os': 42, 'bull_rsi_ob': 91, 'bull_adx_thresh': 20.76062345239111, 'bull_atr_min_pct': 0.00893739436640736, 'bull_atr_max_pct': 0.10549010757983245, 'bull_tp_mult': 2.5734541126009867, 'bull_tsl_mult': 0.9035365245699765, 'bull_time_stop': 43, 'bull_use_sma': True, 'bull_use_ema': True, 'bull_use_atr': False, 'bull_use_adx': True, 'bull_use_spike': True, 'bull_rsi_required': False, 'bear_strategy': 'breakout', 'bear_bb_std_mult': 3.4621811360968957, 'bear_rsi_os': 9, 'bear_rsi_ob': 77, 'bear_adx_thresh': 5.793607114233909, 'bear_atr_min_pct': 0.006361962572294559, 'bear_atr_max_pct': 0.10459202598012565, 'bear_tp_mult': 2.743750280440273, 'bear_tsl_mult': 0.059765413679678026, 'bear_time_stop': 292, 'bear_use_sma': True, 'bear_use_ema': False, 'bear_use_atr': True, 'bear_use_adx': True, 'bear_use_spike': False, 'bear_rsi_required': False, 'sideways_strategy': 'mean_reversion', 'sideways_bb_std_mult': 2.979966645914601, 'sideways_rsi_os': 20, 'sideways_rsi_ob': 78, 'sideways_adx_thresh': 31.06653382584114, 'sideways_atr_min_pct': 0.0030029339784358507, 'sideways_atr_max_pct': 0.08100321542263575, 'sideways_tp_mult': 2.4297805564438315, 'sideways_tsl_mult': 0.9125042457403383, 'sideways_time_stop': 77, 'sideways_use_sma': True, 'sideways_use_ema': True, 'sideways_use_atr': True, 'sideways_use_adx': False, 'sideways_use_spike': False, 'sideways_rsi_required': False}.
[I 2025-08-29 19:49:57,703] Trial 111 finished with values: [-1000000000.0, 1000000000.0] and parameters: {'p_sma': 35, 'p_std': 58, 'p_atr': 23, 'p_adx': 16, 'rsi_period': 26, 'ema1': 13, 'ema2': 41, 'slip_atr_k': 0.07272014581639963, 'slip_spread_k': 0.27880164400818874, 'spread_hl_frac': 0.0028813655023906155, 'bb_std_mult': 1.4401874569298756, 'rsi_os': 19, 'rsi_ob': 62, 'vol_spike': 0.25605571868806976, 'adx_thresh': 29.18300472496042, 'atr_min_pct': 0.012314809145491969, 'atr_max_pct': 0.11177661729164562, 'tp_mult': 2.488443618597515, 'tsl_mult': 0.6597576209647388, 'strategy': 'mean_reversion', 'time_stop': 66, 'use_sma': True, 'use_atr': True, 'use_adx': False, 'use_ema': False, 'use_spike': False, 'rsi_required': True, 'edge_k': 1.3776723619465976, 'edge_cap': 0.46734383400526436, 'bull_strategy': 'breakout', 'bull_bb_std_mult': 0.77024065890711, 'bull_rsi_os': 42, 'bull_rsi_ob': 95, 'bull_adx_thresh': 19.605702625175596, 'bull_atr_min_pct': 0.02212641249918631, 'bull_atr_max_pct': 0.0610345693395595, 'bull_tp_mult': 1.1151226053045113, 'bull_tsl_mult': 0.010112149607906601, 'bull_time_stop': 284, 'bull_use_sma': False, 'bull_use_ema': True, 'bull_use_atr': False, 'bull_use_adx': True, 'bull_use_spike': False, 'bull_rsi_required': True, 'bear_strategy': 'breakout', 'bear_bb_std_mult': 1.3157940897990106, 'bear_rsi_os': 30, 'bear_rsi_ob': 77, 'bear_adx_thresh': 5.802627963843101, 'bear_atr_min_pct': 0.008966461536876063, 'bear_atr_max_pct': 0.10812539715564108, 'bear_tp_mult': 2.047605978101014, 'bear_tsl_mult': 0.7449342283140558, 'bear_time_stop': 6, 'bear_use_sma': False, 'bear_use_ema': False, 'bear_use_atr': True, 'bear_use_adx': False, 'bear_use_spike': False, 'bear_rsi_required': False, 'sideways_strategy': 'mean_reversion', 'sideways_bb_std_mult': 2.202058332557541, 'sideways_rsi_os': 31, 'sideways_rsi_ob': 86, 'sideways_adx_thresh': 31.34656304123423, 'sideways_atr_min_pct': 0.016979804784547844, 'sideways_atr_max_pct': 0.11307996481117233, 'sideways_tp_mult': 2.111328848727464, 'sideways_tsl_mult': 0.39439711959321605, 'sideways_time_stop': 259, 'sideways_use_sma': False, 'sideways_use_ema': True, 'sideways_use_atr': True, 'sideways_use_adx': False, 'sideways_use_spike': False, 'sideways_rsi_required': True}.
[I 2025-08-29 19:49:57,738] Trial 112 finished with values: [-1000000000.0, 1000000000.0] and parameters: {'p_sma': 34, 'p_std': 58, 'p_atr': 23, 'p_adx': 16, 'rsi_period': 25, 'ema1': 13, 'ema2': 40, 'slip_atr_k': 0.07629357046816118, 'slip_spread_k': 0.17820933611574663, 'spread_hl_frac': 0.004584472766288456, 'bb_std_mult': 1.459239536541045, 'rsi_os': 19, 'rsi_ob': 62, 'vol_spike': 0.09504796712460456, 'adx_thresh': 31.732364502743387, 'atr_min_pct': 0.014331070997161443, 'atr_max_pct': 0.13929611506332915, 'tp_mult': 2.4319500349650123, 'tsl_mult': 0.5977004670799004, 'strategy': 'mean_reversion', 'time_stop': 68, 'use_sma': True, 'use_atr': True, 'use_adx': False, 'use_ema': False, 'use_spike': False, 'rsi_required': True, 'edge_k': 1.300067108936044, 'edge_cap': 0.4507167489581884, 'bull_strategy': 'breakout', 'bull_bb_std_mult': 0.8212241403562381, 'bull_rsi_os': 49, 'bull_rsi_ob': 95, 'bull_adx_thresh': 19.57738440443004, 'bull_atr_min_pct': 0.022952776084414903, 'bull_atr_max_pct': 0.05589376235373181, 'bull_tp_mult': 1.6961048446596423, 'bull_tsl_mult': 0.09197850597315037, 'bull_time_stop': 284, 'bull_use_sma': False, 'bull_use_ema': True, 'bull_use_atr': True, 'bull_use_adx': True, 'bull_use_spike': False, 'bull_rsi_required': True, 'bear_strategy': 'breakout', 'bear_bb_std_mult': 1.4228973033352064, 'bear_rsi_os': 29, 'bear_rsi_ob': 71, 'bear_adx_thresh': 7.761678645878373, 'bear_atr_min_pct': 0.009312398165279094, 'bear_atr_max_pct': 0.10015180415057306, 'bear_tp_mult': 1.2941278536435816, 'bear_tsl_mult': 0.741766880819281, 'bear_time_stop': 6, 'bear_use_sma': False, 'bear_use_ema': False, 'bear_use_atr': True, 'bear_use_adx': False, 'bear_use_spike': False, 'bear_rsi_required': False, 'sideways_strategy': 'mean_reversion', 'sideways_bb_std_mult': 2.1345567375948318, 'sideways_rsi_os': 30, 'sideways_rsi_ob': 87, 'sideways_adx_thresh': 29.419740065681296, 'sideways_atr_min_pct': 0.015613495524977863, 'sideways_atr_max_pct': 0.10783500734569712, 'sideways_tp_mult': 2.1137627735736073, 'sideways_tsl_mult': 0.37721588081272106, 'sideways_time_stop': 260, 'sideways_use_sma': False, 'sideways_use_ema': True, 'sideways_use_atr': False, 'sideways_use_adx': False, 'sideways_use_spike': False, 'sideways_rsi_required': True}.
[I 2025-08-29 19:49:57,965] Trial 109 finished with values: [-1000000000.0, 1000000000.0] and parameters: {'p_sma': 34, 'p_std': 57, 'p_atr': 23, 'p_adx': 17, 'rsi_period': 27, 'ema1': 5, 'ema2': 24, 'slip_atr_k': 0.0969010750926366, 'slip_spread_k': 0.19808624626871874, 'spread_hl_frac': 0.0026878750502609206, 'bb_std_mult': 1.5869601145627072, 'rsi_os': 19, 'rsi_ob': 57, 'vol_spike': 0.09652947755380291, 'adx_thresh': 34.801234963632844, 'atr_min_pct': 0.012480905403396301, 'atr_max_pct': 0.10975720371646908, 'tp_mult': 2.4897554863448006, 'tsl_mult': 0.5905430220734527, 'strategy': 'mean_reversion', 'time_stop': 67, 'use_sma': False, 'use_atr': True, 'use_adx': False, 'use_ema': True, 'use_spike': False, 'rsi_required': True, 'edge_k': 1.3336907336770547, 'edge_cap': 0.46053229667910067, 'bull_strategy': 'breakout', 'bull_bb_std_mult': 0.840798508826507, 'bull_rsi_os': 42, 'bull_rsi_ob': 95, 'bull_adx_thresh': 23.343229539737344, 'bull_atr_min_pct': 0.00944026519932386, 'bull_atr_max_pct': 0.05583319307533332, 'bull_tp_mult': 1.6745615006661003, 'bull_tsl_mult': 0.012407141389801285, 'bull_time_stop': 279, 'bull_use_sma': False, 'bull_use_ema': True, 'bull_use_atr': False, 'bull_use_adx': True, 'bull_use_spike': False, 'bull_rsi_required': True, 'bear_strategy': 'breakout', 'bear_bb_std_mult': 1.454087260490975, 'bear_rsi_os': 29, 'bear_rsi_ob': 78, 'bear_adx_thresh': 5.82624351477387, 'bear_atr_min_pct': 0.007123647549772512, 'bear_atr_max_pct': 0.13455231996736655, 'bear_tp_mult': 1.300538009409845, 'bear_tsl_mult': 0.7475383263681821, 'bear_time_stop': 5, 'bear_use_sma': False, 'bear_use_ema': False, 'bear_use_atr': True, 'bear_use_adx': True, 'bear_use_spike': False, 'bear_rsi_required': False, 'sideways_strategy': 'mean_reversion', 'sideways_bb_std_mult': 2.192259608467312, 'sideways_rsi_os': 31, 'sideways_rsi_ob': 87, 'sideways_adx_thresh': 31.041844395008482, 'sideways_atr_min_pct': 0.0171555976226481, 'sideways_atr_max_pct': 0.11140767597667844, 'sideways_tp_mult': 2.125447153453544, 'sideways_tsl_mult': 0.36974669557675455, 'sideways_time_stop': 263, 'sideways_use_sma': False, 'sideways_use_ema': True, 'sideways_use_atr': True, 'sideways_use_adx': False, 'sideways_use_spike': False, 'sideways_rsi_required': True}.
[I 2025-08-29 19:49:58,162] Trial 110 finished with values: [-1000000000.0, 1000000000.0] and parameters: {'p_sma': 34, 'p_std': 57, 'p_atr': 23, 'p_adx': 16, 'rsi_period': 26, 'ema1': 13, 'ema2': 41, 'slip_atr_k': 0.09371394093656864, 'slip_spread_k': 0.19567333239959073, 'spread_hl_frac': 0.0027279667989911216, 'bb_std_mult': 1.452280390569125, 'rsi_os': 19, 'rsi_ob': 61, 'vol_spike': 0.2516954388061513, 'adx_thresh': 29.269994167793435, 'atr_min_pct': 0.011370197889162301, 'atr_max_pct': 0.14082474898476785, 'tp_mult': 2.486026049322909, 'tsl_mult': 0.6038876038012169, 'strategy': 'mean_reversion', 'time_stop': 123, 'use_sma': True, 'use_atr': True, 'use_adx': False, 'use_ema': False, 'use_spike': False, 'rsi_required': True, 'edge_k': 1.278018165236961, 'edge_cap': 0.45007821067134895, 'bull_strategy': 'breakout', 'bull_bb_std_mult': 0.9198908612320442, 'bull_rsi_os': 48, 'bull_rsi_ob': 95, 'bull_adx_thresh': 12.739214619159114, 'bull_atr_min_pct': 0.021700123271670306, 'bull_atr_max_pct': 0.05457625574016904, 'bull_tp_mult': 1.6149648249104875, 'bull_tsl_mult': 0.16281859962855966, 'bull_time_stop': 284, 'bull_use_sma': False, 'bull_use_ema': True, 'bull_use_atr': False, 'bull_use_adx': True, 'bull_use_spike': False, 'bull_rsi_required': True, 'bear_strategy': 'breakout', 'bear_bb_std_mult': 1.4089633669608612, 'bear_rsi_os': 29, 'bear_rsi_ob': 71, 'bear_adx_thresh': 5.80099725494392, 'bear_atr_min_pct': 0.006374649869593614, 'bear_atr_max_pct': 0.08008569303869188, 'bear_tp_mult': 1.278976129731375, 'bear_tsl_mult': 0.6377194084072393, 'bear_time_stop': 7, 'bear_use_sma': False, 'bear_use_ema': False, 'bear_use_atr': True, 'bear_use_adx': False, 'bear_use_spike': False, 'bear_rsi_required': False, 'sideways_strategy': 'mean_reversion', 'sideways_bb_std_mult': 2.3711416618992347, 'sideways_rsi_os': 31, 'sideways_rsi_ob': 87, 'sideways_adx_thresh': 31.25888132076509, 'sideways_atr_min_pct': 0.017230737799453576, 'sideways_atr_max_pct': 0.11112310546792016, 'sideways_tp_mult': 2.12817927325043, 'sideways_tsl_mult': 0.3820289916320311, 'sideways_time_stop': 259, 'sideways_use_sma': False, 'sideways_use_ema': True, 'sideways_use_atr': False, 'sideways_use_adx': False, 'sideways_use_spike': False, 'sideways_rsi_required': True}.
[I 2025-08-29 19:49:58,538] Trial 116 finished with values: [-1000000000.0, 1000000000.0] and parameters: {'p_sma': 29, 'p_std': 54, 'p_atr': 22, 'p_adx': 15, 'rsi_period': 30, 'ema1': 16, 'ema2': 43, 'slip_atr_k': 0.19066104328934771, 'slip_spread_k': 0.33332840061974317, 'spread_hl_frac': 0.006870386847436287, 'bb_std_mult': 1.3960848839077937, 'rsi_os': 16, 'rsi_ob': 45, 'vol_spike': 0.20952235468619282, 'adx_thresh': 23.89091269982371, 'atr_min_pct': 0.013315680872805229, 'atr_max_pct': 0.11608681224589734, 'tp_mult': 2.415052209337484, 'tsl_mult': 0.6919681999518431, 'strategy': 'mean_reversion', 'time_stop': 88, 'use_sma': False, 'use_atr': False, 'use_adx': False, 'use_ema': False, 'use_spike': False, 'rsi_required': True, 'edge_k': 1.1623711587054129, 'edge_cap': 0.41065144072449417, 'bull_strategy': 'breakout', 'bull_bb_std_mult': 0.643451912979846, 'bull_rsi_os': 44, 'bull_rsi_ob': 62, 'bull_adx_thresh': 26.37439292471298, 'bull_atr_min_pct': 0.023580980658854382, 'bull_atr_max_pct': 0.06654213790619913, 'bull_tp_mult': 1.937078015948465, 'bull_tsl_mult': 0.06107202160445639, 'bull_time_stop': 294, 'bull_use_sma': False, 'bull_use_ema': True, 'bull_use_atr': True, 'bull_use_adx': False, 'bull_use_spike': False, 'bull_rsi_required': True, 'bear_strategy': 'breakout', 'bear_bb_std_mult': 1.2307068324103532, 'bear_rsi_os': 25, 'bear_rsi_ob': 68, 'bear_adx_thresh': 15.45843298082275, 'bear_atr_min_pct': 0.014802206040783687, 'bear_atr_max_pct': 0.11499038341565994, 'bear_tp_mult': 1.1394966177983517, 'bear_tsl_mult': 0.6722109757949262, 'bear_time_stop': 14, 'bear_use_sma': False, 'bear_use_ema': False, 'bear_use_atr': False, 'bear_use_adx': False, 'bear_use_spike': True, 'bear_rsi_required': True, 'sideways_strategy': 'breakout', 'sideways_bb_std_mult': 1.9158681978222636, 'sideways_rsi_os': 28, 'sideways_rsi_ob': 84, 'sideways_adx_thresh': 10.413856340537523, 'sideways_atr_min_pct': 0.018088248906007715, 'sideways_atr_max_pct': 0.12486254413295482, 'sideways_tp_mult': 2.0836581384959985, 'sideways_tsl_mult': 0.4557319181642286, 'sideways_time_stop': 282, 'sideways_use_sma': False, 'sideways_use_ema': False, 'sideways_use_atr': True, 'sideways_use_adx': True, 'sideways_use_spike': True, 'sideways_rsi_required': True}.
[I 2025-08-29 19:50:29,667] Trial 113 finished with values: [-1000000000.0, 1000000000.0] and parameters: {'p_sma': 28, 'p_std': 55, 'p_atr': 22, 'p_adx': 17, 'rsi_period': 28, 'ema1': 11, 'ema2': 42, 'slip_atr_k': 0.0912120754595678, 'slip_spread_k': 0.20207861450348297, 'spread_hl_frac': 0.0076457572270239756, 'bb_std_mult': 1.305042990015801, 'rsi_os': 15, 'rsi_ob': 57, 'vol_spike': 0.03880170531775223, 'adx_thresh': 23.661228855702404, 'atr_min_pct': 0.012974628953991808, 'atr_max_pct': 0.048496161663565934, 'tp_mult': 2.420149374747966, 'tsl_mult': 0.6362960741744079, 'strategy': 'mean_reversion', 'time_stop': 80, 'use_sma': False, 'use_atr': False, 'use_adx': False, 'use_ema': False, 'use_spike': False, 'rsi_required': True, 'edge_k': 0.9544649767193945, 'edge_cap': 0.38018372371371956, 'bull_strategy': 'breakout', 'bull_bb_std_mult': 0.916627056786026, 'bull_rsi_os': 54, 'bull_rsi_ob': 94, 'bull_adx_thresh': 18.064010157455986, 'bull_atr_min_pct': 0.021919080597087148, 'bull_atr_max_pct': 0.05126639579440715, 'bull_tp_mult': 1.9730086056941347, 'bull_tsl_mult': 0.1714860984734627, 'bull_time_stop': 295, 'bull_use_sma': False, 'bull_use_ema': True, 'bull_use_atr': False, 'bull_use_adx': True, 'bull_use_spike': False, 'bull_rsi_required': True, 'bear_strategy': 'breakout', 'bear_bb_std_mult': 1.2229990153281367, 'bear_rsi_os': 27, 'bear_rsi_ob': 71, 'bear_adx_thresh': 6.804153572884383, 'bear_atr_min_pct': 0.007020613171296959, 'bear_atr_max_pct': 0.11250828754049699, 'bear_tp_mult': 1.9259909949298324, 'bear_tsl_mult': 0.7206961880004039, 'bear_time_stop': 16, 'bear_use_sma': False, 'bear_use_ema': False, 'bear_use_atr': True, 'bear_use_adx': False, 'bear_use_spike': False, 'bear_rsi_required': False, 'sideways_strategy': 'breakout', 'sideways_bb_std_mult': 2.475524715679746, 'sideways_rsi_os': 28, 'sideways_rsi_ob': 84, 'sideways_adx_thresh': 30.445562900523775, 'sideways_atr_min_pct': 0.013994382862199312, 'sideways_atr_max_pct': 0.11879186162912835, 'sideways_tp_mult': 2.0385122985550383, 'sideways_tsl_mult': 0.439123937921636, 'sideways_time_stop': 280, 'sideways_use_sma': False, 'sideways_use_ema': True, 'sideways_use_atr': True, 'sideways_use_adx': False, 'sideways_use_spike': True, 'sideways_rsi_required': True}.
[I 2025-08-29 19:50:29,987] Trial 115 finished with values: [-1000000000.0, 1000000000.0] and parameters: {'p_sma': 30, 'p_std': 55, 'p_atr': 22, 'p_adx': 15, 'rsi_period': 32, 'ema1': 16, 'ema2': 38, 'slip_atr_k': 0.23682786128197425, 'slip_spread_k': 0.28139244309129663, 'spread_hl_frac': 0.007035813830801214, 'bb_std_mult': 1.311400111581423, 'rsi_os': 21, 'rsi_ob': 65, 'vol_spike': 0.2108672689563108, 'adx_thresh': 24.237190044166326, 'atr_min_pct': 0.013272184378155099, 'atr_max_pct': 0.04828110810044786, 'tp_mult': 2.4024923885922447, 'tsl_mult': 0.6926840134996841, 'strategy': 'mean_reversion', 'time_stop': 82, 'use_sma': False, 'use_atr': False, 'use_adx': False, 'use_ema': False, 'use_spike': False, 'rsi_required': True, 'edge_k': 1.1756212221818552, 'edge_cap': 0.3993800457708036, 'bull_strategy': 'breakout', 'bull_bb_std_mult': 0.9199952862428875, 'bull_rsi_os': 8, 'bull_rsi_ob': 70, 'bull_adx_thresh': 26.160313197987527, 'bull_atr_min_pct': 0.021967371091879868, 'bull_atr_max_pct': 0.06535496631813191, 'bull_tp_mult': 1.9486466957815027, 'bull_tsl_mult': 0.1422195259612538, 'bull_time_stop': 294, 'bull_use_sma': False, 'bull_use_ema': True, 'bull_use_atr': False, 'bull_use_adx': True, 'bull_use_spike': False, 'bull_rsi_required': True, 'bear_strategy': 'breakout', 'bear_bb_std_mult': 1.2019942390271419, 'bear_rsi_os': 27, 'bear_rsi_ob': 68, 'bear_adx_thresh': 5.027547292359557, 'bear_atr_min_pct': 0.010095181127644143, 'bear_atr_max_pct': 0.11566149264139568, 'bear_tp_mult': 1.1312780904560211, 'bear_tsl_mult': 0.7061940984414111, 'bear_time_stop': 13, 'bear_use_sma': False, 'bear_use_ema': False, 'bear_use_atr': True, 'bear_use_adx': False, 'bear_use_spike': False, 'bear_rsi_required': False, 'sideways_strategy': 'breakout', 'sideways_bb_std_mult': 1.9464250938469823, 'sideways_rsi_os': 29, 'sideways_rsi_ob': 84, 'sideways_adx_thresh': 30.273338145708543, 'sideways_atr_min_pct': 0.017893249389874872, 'sideways_atr_max_pct': 0.12014307512421538, 'sideways_tp_mult': 2.1760470021976275, 'sideways_tsl_mult': 0.7373328058241511, 'sideways_time_stop': 279, 'sideways_use_sma': False, 'sideways_use_ema': True, 'sideways_use_atr': False, 'sideways_use_adx': False, 'sideways_use_spike': True, 'sideways_rsi_required': True}.
[I 2025-08-29 19:50:30,183] Trial 114 finished with values: [-1000000000.0, 1000000000.0] and parameters: {'p_sma': 29, 'p_std': 59, 'p_atr': 22, 'p_adx': 17, 'rsi_period': 30, 'ema1': 11, 'ema2': 42, 'slip_atr_k': 0.24171047763060907, 'slip_spread_k': 0.18472858915883592, 'spread_hl_frac': 0.002655052342006487, 'bb_std_mult': 1.3869077032932975, 'rsi_os': 21, 'rsi_ob': 57, 'vol_spike': 0.20927794526684707, 'adx_thresh': 24.338421162884092, 'atr_min_pct': 0.013158470607836086, 'atr_max_pct': 0.14424752293571919, 'tp_mult': 2.4972213857988437, 'tsl_mult': 0.6978471139687265, 'strategy': 'mean_reversion', 'time_stop': 107, 'use_sma': False, 'use_atr': False, 'use_adx': False, 'use_ema': False, 'use_spike': False, 'rsi_required': True, 'edge_k': 1.1785749542468265, 'edge_cap': 0.506899247176808, 'bull_strategy': 'breakout', 'bull_bb_std_mult': 0.9460397073630098, 'bull_rsi_os': 54, 'bull_rsi_ob': 94, 'bull_adx_thresh': 12.644498774898421, 'bull_atr_min_pct': 0.021935777738358447, 'bull_atr_max_pct': 0.06665188082606421, 'bull_tp_mult': 1.6726398594718408, 'bull_tsl_mult': 0.17274537744913207, 'bull_time_stop': 276, 'bull_use_sma': False, 'bull_use_ema': True, 'bull_use_atr': False, 'bull_use_adx': True, 'bull_use_spike': False, 'bull_rsi_required': True, 'bear_strategy': 'breakout', 'bear_bb_std_mult': 1.1982695109918926, 'bear_rsi_os': 27, 'bear_rsi_ob': 71, 'bear_adx_thresh': 15.543334460192321, 'bear_atr_min_pct': 0.00986463728897918, 'bear_atr_max_pct': 0.11279999470737795, 'bear_tp_mult': 1.1462987680397523, 'bear_tsl_mult': 0.7172817546121727, 'bear_time_stop': 13, 'bear_use_sma': False, 'bear_use_ema': False, 'bear_use_atr': True, 'bear_use_adx': False, 'bear_use_spike': False, 'bear_rsi_required': False, 'sideways_strategy': 'breakout', 'sideways_bb_std_mult': 2.4232826615693432, 'sideways_rsi_os': 28, 'sideways_rsi_ob': 83, 'sideways_adx_thresh': 30.271045316703535, 'sideways_atr_min_pct': 0.017999332206341763, 'sideways_atr_max_pct': 0.11700037989072049, 'sideways_tp_mult': 2.177002064341124, 'sideways_tsl_mult': 0.450851493764904, 'sideways_time_stop': 278, 'sideways_use_sma': False, 'sideways_use_ema': True, 'sideways_use_atr': True, 'sideways_use_adx': False, 'sideways_use_spike': True, 'sideways_rsi_required': True}.
