[I 2025-08-29 20:09:25,003] Trial 276 finished with values: [-1000000000.0, 1000000000.0] and parameters: {'p_sma': 11, 'p_std': 52, 'p_atr': 24, 'p_adx': 17, 'rsi_period': 37, 'ema1': 21, 'ema2': 55, 'slip_atr_k': 0.0453322833917013, 'slip_spread_k': 0.4053545580969261, 'spread_hl_frac': 0.020831320721247566, 'bb_std_mult': 1.1133719946036382, 'rsi_os': 10, 'rsi_ob': 67, 'vol_spike': 0.26314959404345284, 'adx_thresh': 14.200909001695937, 'atr_min_pct': 0.012430675236525862, 'atr_max_pct': 0.042657989658868425, 'tp_mult': 1.7851851997058277, 'tsl_mult': 0.759266863837714, 'strategy': 'mean_reversion', 'time_stop': 161, 'use_sma': True, 'use_atr': True, 'use_adx': False, 'use_ema': True, 'use_spike': False, 'rsi_required': True, 'edge_k': 0.035122552529827655, 'edge_cap': 0.5111383723744659, 'bull_strategy': 'mean_reversion', 'bull_bb_std_mult': 1.6800995622474064, 'bull_rsi_os': 39, 'bull_rsi_ob': 92, 'bull_adx_thresh': 18.131432399646418, 'bull_atr_min_pct': 0.010387700817596678, 'bull_atr_max_pct': 0.02144434947265765, 'bull_tp_mult': 2.147227952332098, 'bull_tsl_mult': 0.333644167552151, 'bull_time_stop': 169, 'bull_use_sma': True, 'bull_use_ema': False, 'bull_use_atr': True, 'bull_use_adx': False, 'bull_use_spike': False, 'bull_rsi_required': True, 'bear_strategy': 'breakout', 'bear_bb_std_mult': 2.83221161258493, 'bear_rsi_os': 14, 'bear_rsi_ob': 71, 'bear_adx_thresh': 6.4658406349979325, 'bear_atr_min_pct': 0.028380386874238085, 'bear_atr_max_pct': 0.046123305307528076, 'bear_tp_mult': 1.1054876487517695, 'bear_tsl_mult': 0.5686984665167242, 'bear_time_stop': 278, 'bear_use_sma': False, 'bear_use_ema': True, 'bear_use_atr': True, 'bear_use_adx': True, 'bear_use_spike': True, 'bear_rsi_required': False, 'sideways_strategy': 'breakout', 'sideways_bb_std_mult': 1.7297344772287948, 'sideways_rsi_os': 16, 'sideways_rsi_ob': 73, 'sideways_adx_thresh': 18.930854812594458, 'sideways_atr_min_pct': 0.004982499781119239, 'sideways_atr_max_pct': 0.058924097975378946, 'sideways_tp_mult': 2.73937770245755, 'sideways_tsl_mult': 0.8000510329504152, 'sideways_time_stop': 86, 'sideways_use_sma': False, 'sideways_use_ema': True, 'sideways_use_atr': True, 'sideways_use_adx': True, 'sideways_use_spike': False, 'sideways_rsi_required': False}.
[I 2025-08-29 20:09:25,969] Trial 280 finished with values: [-0.0028749859816605827, 0.002883853176605928] and parameters: {'p_sma': 22, 'p_std': 34, 'p_atr': 20, 'p_adx': 17, 'rsi_period': 62, 'ema1': 21, 'ema2': 45, 'slip_atr_k': 0.1897339190541855, 'slip_spread_k': 0.14054041403513473, 'spread_hl_frac': 0.0015655488304342953, 'bb_std_mult': 1.1484188490420175, 'rsi_os': 18, 'rsi_ob': 66, 'vol_spike': 0.08629402811517828, 'adx_thresh': 23.326177881892207, 'atr_min_pct': 0.017517249213292126, 'atr_max_pct': 0.042072529886884175, 'tp_mult': 1.6718281101701076, 'tsl_mult': 0.6226736935645993, 'strategy': 'mean_reversion', 'time_stop': 171, 'use_sma': True, 'use_atr': True, 'use_adx': False, 'use_ema': False, 'use_spike': False, 'rsi_required': False, 'edge_k': 0.7761190037261715, 'edge_cap': 0.08496620634713525, 'bull_strategy': 'mean_reversion', 'bull_bb_std_mult': 1.4769374889929705, 'bull_rsi_os': 40, 'bull_rsi_ob': 90, 'bull_adx_thresh': 27.42403004401069, 'bull_atr_min_pct': 0.0016912368014051068, 'bull_atr_max_pct': 0.0212890979013763, 'bull_tp_mult': 1.3774071140324782, 'bull_tsl_mult': 0.09837217536788972, 'bull_time_stop': 178, 'bull_use_sma': True, 'bull_use_ema': True, 'bull_use_atr': False, 'bull_use_adx': True, 'bull_use_spike': True, 'bull_rsi_required': True, 'bear_strategy': 'breakout', 'bear_bb_std_mult': 3.0671168468428123, 'bear_rsi_os': 29, 'bear_rsi_ob': 61, 'bear_adx_thresh': 15.34047247222879, 'bear_atr_min_pct': 0.0037379423125017187, 'bear_atr_max_pct': 0.11099824942206961, 'bear_tp_mult': 1.1300088166734663, 'bear_tsl_mult': 0.5266143279594473, 'bear_time_stop': 278, 'bear_use_sma': False, 'bear_use_ema': True, 'bear_use_atr': True, 'bear_use_adx': False, 'bear_use_spike': True, 'bear_rsi_required': False, 'sideways_strategy': 'breakout', 'sideways_bb_std_mult': 1.7320337105465273, 'sideways_rsi_os': 15, 'sideways_rsi_ob': 81, 'sideways_adx_thresh': 19.48945517262153, 'sideways_atr_min_pct': 0.0056227800911156966, 'sideways_atr_max_pct': 0.06346396375126072, 'sideways_tp_mult': 2.729763931870856, 'sideways_tsl_mult': 0.6372812334983603, 'sideways_time_stop': 132, 'sideways_use_sma': True, 'sideways_use_ema': True, 'sideways_use_atr': True, 'sideways_use_adx': False, 'sideways_use_spike': False, 'sideways_rsi_required': False}.
[I 2025-08-29 20:09:57,097] Trial 281 finished with values: [-1000000000.0, 1000000000.0] and parameters: {'p_sma': 53, 'p_std': 53, 'p_atr': 20, 'p_adx': 17, 'rsi_period': 9, 'ema1': 21, 'ema2': 45, 'slip_atr_k': 0.04397284469871251, 'slip_spread_k': 0.8453375036433324, 'spread_hl_frac': 0.0011112359261015003, 'bb_std_mult': 1.14145866896887, 'rsi_os': 37, 'rsi_ob': 75, 'vol_spike': 0.2911607960626954, 'adx_thresh': 30.9439176322614, 'atr_min_pct': 0.013726767664199576, 'atr_max_pct': 0.03635639138861508, 'tp_mult': 1.6818900113060407, 'tsl_mult': 0.13939496739587776, 'strategy': 'mean_reversion', 'time_stop': 157, 'use_sma': True, 'use_atr': True, 'use_adx': False, 'use_ema': False, 'use_spike': True, 'rsi_required': False, 'edge_k': 0.30824251220699683, 'edge_cap': 0.5187489528025258, 'bull_strategy': 'mean_reversion', 'bull_bb_std_mult': 2.519110972731352, 'bull_rsi_os': 40, 'bull_rsi_ob': 90, 'bull_adx_thresh': 17.12229084997133, 'bull_atr_min_pct': 0.013454951267449933, 'bull_atr_max_pct': 0.13301304887250104, 'bull_tp_mult': 1.3800152700462252, 'bull_tsl_mult': 0.11275880192737746, 'bull_time_stop': 179, 'bull_use_sma': True, 'bull_use_ema': True, 'bull_use_atr': False, 'bull_use_adx': True, 'bull_use_spike': False, 'bull_rsi_required': True, 'bear_strategy': 'breakout', 'bear_bb_std_mult': 2.3612520741719725, 'bear_rsi_os': 37, 'bear_rsi_ob': 61, 'bear_adx_thresh': 6.689250806711595, 'bear_atr_min_pct': 0.01874649265999817, 'bear_atr_max_pct': 0.07956835359048912, 'bear_tp_mult': 2.4556879563171172, 'bear_tsl_mult': 0.417287012795839, 'bear_time_stop': 280, 'bear_use_sma': False, 'bear_use_ema': True, 'bear_use_atr': True, 'bear_use_adx': False, 'bear_use_spike': True, 'bear_rsi_required': True, 'sideways_strategy': 'mean_reversion', 'sideways_bb_std_mult': 2.5763256628601443, 'sideways_rsi_os': 15, 'sideways_rsi_ob': 73, 'sideways_adx_thresh': 17.684973395799872, 'sideways_atr_min_pct': 0.0077710458621632625, 'sideways_atr_max_pct': 0.06224273155962164, 'sideways_tp_mult': 2.6536412803849205, 'sideways_tsl_mult': 0.5421333752777069, 'sideways_time_stop': 232, 'sideways_use_sma': False, 'sideways_use_ema': True, 'sideways_use_atr': True, 'sideways_use_adx': False, 'sideways_use_spike': False, 'sideways_rsi_required': False}.
[I 2025-08-29 20:09:58,081] Trial 283 finished with values: [-0.0005296484365872045, 0.0018342837435926507] and parameters: {'p_sma': 19, 'p_std': 16, 'p_atr': 20, 'p_adx': 26, 'rsi_period': 9, 'ema1': 19, 'ema2': 28, 'slip_atr_k': 0.01136856703766985, 'slip_spread_k': 0.9564061581781689, 'spread_hl_frac': 0.0032126951653135773, 'bb_std_mult': 1.26504157128322, 'rsi_os': 43, 'rsi_ob': 66, 'vol_spike': 0.1857956071752308, 'adx_thresh': 6.822953200800242, 'atr_min_pct': 0.013326923219166644, 'atr_max_pct': 0.04889341000120636, 'tp_mult': 1.710687759938722, 'tsl_mult': 0.8493252469676027, 'strategy': 'mean_reversion', 'time_stop': 172, 'use_sma': True, 'use_atr': False, 'use_adx': False, 'use_ema': False, 'use_spike': True, 'rsi_required': True, 'edge_k': 0.7814248869517062, 'edge_cap': 0.4731916006800226, 'bull_strategy': 'mean_reversion', 'bull_bb_std_mult': 1.495336094227862, 'bull_rsi_os': 11, 'bull_rsi_ob': 90, 'bull_adx_thresh': 19.08238207513545, 'bull_atr_min_pct': 0.0058457527808543006, 'bull_atr_max_pct': 0.13339523575751167, 'bull_tp_mult': 1.50978659737263, 'bull_tsl_mult': 0.1135178613131832, 'bull_time_stop': 180, 'bull_use_sma': True, 'bull_use_ema': True, 'bull_use_atr': False, 'bull_use_adx': True, 'bull_use_spike': True, 'bull_rsi_required': True, 'bear_strategy': 'breakout', 'bear_bb_std_mult': 1.184206279671229, 'bear_rsi_os': 12, 'bear_rsi_ob': 85, 'bear_adx_thresh': 33.306287452662986, 'bear_atr_min_pct': 0.0037827644598450345, 'bear_atr_max_pct': 0.11085945918529032, 'bear_tp_mult': 1.0455167433243955, 'bear_tsl_mult': 0.25954167952994467, 'bear_time_stop': 19, 'bear_use_sma': False, 'bear_use_ema': True, 'bear_use_atr': False, 'bear_use_adx': False, 'bear_use_spike': True, 'bear_rsi_required': True, 'sideways_strategy': 'mean_reversion', 'sideways_bb_std_mult': 0.8222868369186107, 'sideways_rsi_os': 38, 'sideways_rsi_ob': 94, 'sideways_adx_thresh': 17.870376389929174, 'sideways_atr_min_pct': 0.005854164171726682, 'sideways_atr_max_pct': 0.05545996032695105, 'sideways_tp_mult': 2.64622470547543, 'sideways_tsl_mult': 0.6411838323789932, 'sideways_time_stop': 254, 'sideways_use_sma': True, 'sideways_use_ema': True, 'sideways_use_atr': False, 'sideways_use_adx': False, 'sideways_use_spike': True, 'sideways_rsi_required': False}.
[I 2025-08-29 20:09:58,264] Trial 282 finished with values: [-0.022707951245904967, 0.022615673763977863] and parameters: {'p_sma': 40, 'p_std': 16, 'p_atr': 14, 'p_adx': 17, 'rsi_period': 38, 'ema1': 21, 'ema2': 44, 'slip_atr_k': 0.1935733728481409, 'slip_spread_k': 0.7352176504590278, 'spread_hl_frac': 0.010066931346340341, 'bb_std_mult': 1.2515099652345172, 'rsi_os': 37, 'rsi_ob': 66, 'vol_spike': 0.2632394613188448, 'adx_thresh': 32.51588813736599, 'atr_min_pct': 0.01386810456837334, 'atr_max_pct': 0.035707006998769004, 'tp_mult': 1.7275208457999012, 'tsl_mult': 0.7374255255413981, 'strategy': 'mean_reversion', 'time_stop': 169, 'use_sma': True, 'use_atr': False, 'use_adx': False, 'use_ema': False, 'use_spike': True, 'rsi_required': True, 'edge_k': 0.8139626049934761, 'edge_cap': 0.07604537953636042, 'bull_strategy': 'mean_reversion', 'bull_bb_std_mult': 1.5046359939438658, 'bull_rsi_os': 40, 'bull_rsi_ob': 93, 'bull_adx_thresh': 27.04702749178721, 'bull_atr_min_pct': 0.01208073798462323, 'bull_atr_max_pct': 0.02951095379829001, 'bull_tp_mult': 1.3864758720741344, 'bull_tsl_mult': 0.1193262468316055, 'bull_time_stop': 179, 'bull_use_sma': True, 'bull_use_ema': True, 'bull_use_atr': False, 'bull_use_adx': True, 'bull_use_spike': True, 'bull_rsi_required': True, 'bear_strategy': 'breakout', 'bear_bb_std_mult': 2.356584899519486, 'bear_rsi_os': 32, 'bear_rsi_ob': 71, 'bear_adx_thresh': 33.27855965522304, 'bear_atr_min_pct': 0.003714148689913658, 'bear_atr_max_pct': 0.025709437779338047, 'bear_tp_mult': 1.1148081230273728, 'bear_tsl_mult': 0.5355463029153864, 'bear_time_stop': 21, 'bear_use_sma': False, 'bear_use_ema': True, 'bear_use_atr': False, 'bear_use_adx': False, 'bear_use_spike': True, 'bear_rsi_required': True, 'sideways_strategy': 'mean_reversion', 'sideways_bb_std_mult': 0.7994165488778087, 'sideways_rsi_os': 38, 'sideways_rsi_ob': 80, 'sideways_adx_thresh': 18.571191391884657, 'sideways_atr_min_pct': 0.004877922163089845, 'sideways_atr_max_pct': 0.08717405512304692, 'sideways_tp_mult': 1.2723699959444978, 'sideways_tsl_mult': 0.7049176034290282, 'sideways_time_stop': 134, 'sideways_use_sma': False, 'sideways_use_ema': True, 'sideways_use_atr': True, 'sideways_use_adx': False, 'sideways_use_spike': False, 'sideways_rsi_required': False}.
[I 2025-08-29 20:09:58,333] Trial 284 finished with values: [-1000000000.0, 1000000000.0] and parameters: {'p_sma': 55, 'p_std': 17, 'p_atr': 11, 'p_adx': 26, 'rsi_period': 72, 'ema1': 21, 'ema2': 30, 'slip_atr_k': 0.033007101276686025, 'slip_spread_k': 0.18343012948658638, 'spread_hl_frac': 0.009972384890217845, 'bb_std_mult': 1.2547861878464506, 'rsi_os': 37, 'rsi_ob': 56, 'vol_spike': 0.18548251103137048, 'adx_thresh': 30.948308678939004, 'atr_min_pct': 0.013735225442302138, 'atr_max_pct': 0.035779037858184884, 'tp_mult': 2.076223124106135, 'tsl_mult': 0.6225501763080632, 'strategy': 'mean_reversion', 'time_stop': 143, 'use_sma': True, 'use_atr': False, 'use_adx': False, 'use_ema': False, 'use_spike': True, 'rsi_required': True, 'edge_k': 1.2756842435738298, 'edge_cap': 0.47686550043628634, 'bull_strategy': 'mean_reversion', 'bull_bb_std_mult': 1.4892091119380055, 'bull_rsi_os': 40, 'bull_rsi_ob': 95, 'bull_adx_thresh': 31.342320774361024, 'bull_atr_min_pct': 0.011951497081255308, 'bull_atr_max_pct': 0.030546222256533292, 'bull_tp_mult': 1.5101447831046293, 'bull_tsl_mult': 0.1118066503773356, 'bull_time_stop': 179, 'bull_use_sma': True, 'bull_use_ema': True, 'bull_use_atr': False, 'bull_use_adx': True, 'bull_use_spike': True, 'bull_rsi_required': True, 'bear_strategy': 'breakout', 'bear_bb_std_mult': 2.9866977639412955, 'bear_rsi_os': 32, 'bear_rsi_ob': 85, 'bear_adx_thresh': 33.261456048283776, 'bear_atr_min_pct': 0.018826198285155044, 'bear_atr_max_pct': 0.1112082371167801, 'bear_tp_mult': 2.3789766450719148, 'bear_tsl_mult': 0.5403751046238082, 'bear_time_stop': 10, 'bear_use_sma': False, 'bear_use_ema': True, 'bear_use_atr': False, 'bear_use_adx': False, 'bear_use_spike': True, 'bear_rsi_required': True, 'sideways_strategy': 'mean_reversion', 'sideways_bb_std_mult': 1.200511287087803, 'sideways_rsi_os': 38, 'sideways_rsi_ob': 80, 'sideways_adx_thresh': 20.352877595240017, 'sideways_atr_min_pct': 0.02993776084549977, 'sideways_atr_max_pct': 0.055953140023853404, 'sideways_tp_mult': 1.3896383426713312, 'sideways_tsl_mult': 0.6914189356688608, 'sideways_time_stop': 135, 'sideways_use_sma': True, 'sideways_use_ema': True, 'sideways_use_atr': False, 'sideways_use_adx': False, 'sideways_use_spike': True, 'sideways_rsi_required': False}.
[I 2025-08-29 20:10:28,972] Trial 285 finished with values: [-0.02868968930507676, 0.02874537503107699] and parameters: {'p_sma': 57, 'p_std': 16, 'p_atr': 14, 'p_adx': 16, 'rsi_period': 71, 'ema1': 19, 'ema2': 46, 'slip_atr_k': 0.20223439647811145, 'slip_spread_k': 0.13399167622610425, 'spread_hl_frac': 0.003159791826455049, 'bb_std_mult': 2.2978721063062877, 'rsi_os': 31, 'rsi_ob': 90, 'vol_spike': 0.1866454421657, 'adx_thresh': 6.4810397972182585, 'atr_min_pct': 0.013167362808315033, 'atr_max_pct': 0.04965191148072315, 'tp_mult': 1.1396489016953084, 'tsl_mult': 0.6210483275304913, 'strategy': 'breakout', 'time_stop': 245, 'use_sma': True, 'use_atr': False, 'use_adx': False, 'use_ema': False, 'use_spike': True, 'rsi_required': True, 'edge_k': 1.1018608483469607, 'edge_cap': 0.47643616213222006, 'bull_strategy': 'mean_reversion', 'bull_bb_std_mult': 1.5088646308652112, 'bull_rsi_os': 41, 'bull_rsi_ob': 62, 'bull_adx_thresh': 33.79461914915654, 'bull_atr_min_pct': 0.012041882283377305, 'bull_atr_max_pct': 0.029390625591334325, 'bull_tp_mult': 2.061749966801853, 'bull_tsl_mult': 0.12332094916906639, 'bull_time_stop': 177, 'bull_use_sma': True, 'bull_use_ema': True, 'bull_use_atr': False, 'bull_use_adx': True, 'bull_use_spike': True, 'bull_rsi_required': True, 'bear_strategy': 'breakout', 'bear_bb_std_mult': 2.966859920518968, 'bear_rsi_os': 41, 'bear_rsi_ob': 85, 'bear_adx_thresh': 27.603207739259265, 'bear_atr_min_pct': 0.004894374890348783, 'bear_atr_max_pct': 0.11261977580410462, 'bear_tp_mult': 1.0453297870435505, 'bear_tsl_mult': 0.8593155202930025, 'bear_time_stop': 102, 'bear_use_sma': False, 'bear_use_ema': True, 'bear_use_atr': False, 'bear_use_adx': False, 'bear_use_spike': True, 'bear_rsi_required': True, 'sideways_strategy': 'mean_reversion', 'sideways_bb_std_mult': 1.8819483214857091, 'sideways_rsi_os': 19, 'sideways_rsi_ob': 81, 'sideways_adx_thresh': 20.10975643130053, 'sideways_atr_min_pct': 0.005920744245295648, 'sideways_atr_max_pct': 0.05609554434944234, 'sideways_tp_mult': 2.8570273162947837, 'sideways_tsl_mult': 0.710792280353576, 'sideways_time_stop': 74, 'sideways_use_sma': True, 'sideways_use_ema': True, 'sideways_use_atr': False, 'sideways_use_adx': False, 'sideways_use_spike': True, 'sideways_rsi_required': False}.
[I 2025-08-29 20:10:29,165] Trial 286 finished with values: [-0.004103417989384961, 0.0040884941522278655] and parameters: {'p_sma': 27, 'p_std': 41, 'p_atr': 27, 'p_adx': 17, 'rsi_period': 39, 'ema1': 19, 'ema2': 46, 'slip_atr_k': 0.15491141800336272, 'slip_spread_k': 0.1822634960214307, 'spread_hl_frac': 0.010143155600533325, 'bb_std_mult': 1.8313026299613986, 'rsi_os': 44, 'rsi_ob': 66, 'vol_spike': 0.08626740550144849, 'adx_thresh': 17.649653755918635, 'atr_min_pct': 0.01172302095132515, 'atr_max_pct': 0.04947475586173469, 'tp_mult': 1.737506001789316, 'tsl_mult': 0.6234093968261127, 'strategy': 'breakout', 'time_stop': 146, 'use_sma': True, 'use_atr': False, 'use_adx': False, 'use_ema': False, 'use_spike': True, 'rsi_required': True, 'edge_k': 1.102233867637458, 'edge_cap': 0.4792902887120091, 'bull_strategy': 'mean_reversion', 'bull_bb_std_mult': 1.5111102891884909, 'bull_rsi_os': 14, 'bull_rsi_ob': 95, 'bull_adx_thresh': 16.14728204841545, 'bull_atr_min_pct': 0.00046959531031601416, 'bull_atr_max_pct': 0.029763643834471446, 'bull_tp_mult': 2.4796056311768853, 'bull_tsl_mult': 0.12675314912222146, 'bull_time_stop': 178, 'bull_use_sma': True, 'bull_use_ema': True, 'bull_use_atr': False, 'bull_use_adx': True, 'bull_use_spike': True, 'bull_rsi_required': True, 'bear_strategy': 'breakout', 'bear_bb_std_mult': 2.9454530184113845, 'bear_rsi_os': 32, 'bear_rsi_ob': 68, 'bear_adx_thresh': 33.22300733623602, 'bear_atr_min_pct': 0.004804381143533783, 'bear_atr_max_pct': 0.024151802769338176, 'bear_tp_mult': 1.128701235019439, 'bear_tsl_mult': 0.5347116023047602, 'bear_time_stop': 12, 'bear_use_sma': False, 'bear_use_ema': True, 'bear_use_atr': False, 'bear_use_adx': False, 'bear_use_spike': True, 'bear_rsi_required': False, 'sideways_strategy': 'mean_reversion', 'sideways_bb_std_mult': 1.8763665503160618, 'sideways_rsi_os': 19, 'sideways_rsi_ob': 80, 'sideways_adx_thresh': 20.07386966456501, 'sideways_atr_min_pct': 0.005796535949154374, 'sideways_atr_max_pct': 0.056055413464488016, 'sideways_tp_mult': 1.0919050648825763, 'sideways_tsl_mult': 0.6857949916813747, 'sideways_time_stop': 254, 'sideways_use_sma': True, 'sideways_use_ema': True, 'sideways_use_atr': False, 'sideways_use_adx': False, 'sideways_use_spike': True, 'sideways_rsi_required': False}.
[I 2025-08-29 20:10:29,334] Trial 288 finished with values: [-1000000000.0, 1000000000.0] and parameters: {'p_sma': 39, 'p_std': 49, 'p_atr': 26, 'p_adx': 18, 'rsi_period': 47, 'ema1': 20, 'ema2': 60, 'slip_atr_k': 0.012552024564704792, 'slip_spread_k': 0.13066848494914013, 'spread_hl_frac': 0.0035291135375278295, 'bb_std_mult': 2.261092846590137, 'rsi_os': 14, 'rsi_ob': 64, 'vol_spike': 0.052358510812032216, 'adx_thresh': 31.76925026362803, 'atr_min_pct': 0.01301818657670771, 'atr_max_pct': 0.048397683828148214, 'tp_mult': 1.8084931418667687, 'tsl_mult': 0.10088092851053027, 'strategy': 'breakout', 'time_stop': 272, 'use_sma': True, 'use_atr': True, 'use_adx': False, 'use_ema': False, 'use_spike': False, 'rsi_required': True, 'edge_k': 1.1108421251531124, 'edge_cap': 0.4812737546695599, 'bull_strategy': 'mean_reversion', 'bull_bb_std_mult': 3.24480982402082, 'bull_rsi_os': 14, 'bull_rsi_ob': 70, 'bull_adx_thresh': 33.89940594701652, 'bull_atr_min_pct': 0.0012258713445867128, 'bull_atr_max_pct': 0.013522236933201648, 'bull_tp_mult': 1.50929431205567, 'bull_tsl_mult': 0.9399600813133773, 'bull_time_stop': 189, 'bull_use_sma': True, 'bull_use_ema': True, 'bull_use_atr': False, 'bull_use_adx': True, 'bull_use_spike': False, 'bull_rsi_required': True, 'bear_strategy': 'mean_reversion', 'bear_bb_std_mult': 1.182535474155647, 'bear_rsi_os': 8, 'bear_rsi_ob': 79, 'bear_adx_thresh': 23.531584867460165, 'bear_atr_min_pct': 0.017297903067019074, 'bear_atr_max_pct': 0.11876868186332934, 'bear_tp_mult': 2.508641141120343, 'bear_tsl_mult': 0.45231955152531933, 'bear_time_stop': 195, 'bear_use_sma': False, 'bear_use_ema': True, 'bear_use_atr': True, 'bear_use_adx': False, 'bear_use_spike': True, 'bear_rsi_required': False, 'sideways_strategy': 'mean_reversion', 'sideways_bb_std_mult': 1.8601856257025033, 'sideways_rsi_os': 6, 'sideways_rsi_ob': 46, 'sideways_adx_thresh': 7.485900193141294, 'sideways_atr_min_pct': 0.008732261704773436, 'sideways_atr_max_pct': 0.1407347401352024, 'sideways_tp_mult': 2.878446612642413, 'sideways_tsl_mult': 0.7104590683854134, 'sideways_time_stop': 115, 'sideways_use_sma': True, 'sideways_use_ema': True, 'sideways_use_atr': True, 'sideways_use_adx': False, 'sideways_use_spike': True, 'sideways_rsi_required': False}.
