[I 2025-08-29 20:34:41,724] Trial 494 finished with values: [-1000000000.0, 1000000000.0] and parameters: {'p_sma': 52, 'p_std': 55, 'p_atr': 25, 'p_adx': 29, 'rsi_period': 32, 'ema1': 26, 'ema2': 18, 'slip_atr_k': 0.01365679814782196, 'slip_spread_k': 0.0017870474646247136, 'spread_hl_frac': 0.048067751751579485, 'bb_std_mult': 2.4830856126922387, 'rsi_os': 25, 'rsi_ob': 73, 'vol_spike': 0.1866728916021306, 'adx_thresh': 14.88138455800989, 'atr_min_pct': 0.0023374147060949545, 'atr_max_pct': 0.11877845043107685, 'tp_mult': 1.965619080807445, 'tsl_mult': 0.8612338008255558, 'strategy': 'breakout', 'time_stop': 188, 'use_sma': True, 'use_atr': False, 'use_adx': True, 'use_ema': True, 'use_spike': False, 'rsi_required': False, 'edge_k': 1.0932153431636586, 'edge_cap': 0.1913547019027877, 'bull_strategy': 'mean_reversion', 'bull_bb_std_mult': 0.6381005961083832, 'bull_rsi_os': 16, 'bull_rsi_ob': 75, 'bull_adx_thresh': 30.67477838397226, 'bull_atr_min_pct': 0.016522458383005593, 'bull_atr_max_pct': 0.0890393363521078, 'bull_tp_mult': 2.6195524343703798, 'bull_tsl_mult': 0.8515736777368178, 'bull_time_stop': 248, 'bull_use_sma': False, 'bull_use_ema': False, 'bull_use_atr': True, 'bull_use_adx': False, 'bull_use_spike': True, 'bull_rsi_required': False, 'bear_strategy': 'breakout', 'bear_bb_std_mult': 2.4265557703295997, 'bear_rsi_os': 25, 'bear_rsi_ob': 60, 'bear_adx_thresh': 20.003455375720275, 'bear_atr_min_pct': 0.006252294433144045, 'bear_atr_max_pct': 0.042251703722050615, 'bear_tp_mult': 2.26867595974376, 'bear_tsl_mult': 0.0650246730851593, 'bear_time_stop': 57, 'bear_use_sma': True, 'bear_use_ema': False, 'bear_use_atr': False, 'bear_use_adx': True, 'bear_use_spike': True, 'bear_rsi_required': False, 'sideways_strategy': 'breakout', 'sideways_bb_std_mult': 2.3081166287223307, 'sideways_rsi_os': 5, 'sideways_rsi_ob': 95, 'sideways_adx_thresh': 33.64051513293552, 'sideways_atr_min_pct': 0.011597293387591651, 'sideways_atr_max_pct': 0.107984846566931, 'sideways_tp_mult': 1.7631934019859303, 'sideways_tsl_mult': 0.48622824830059524, 'sideways_time_stop': 192, 'sideways_use_sma': False, 'sideways_use_ema': False, 'sideways_use_atr': False, 'sideways_use_adx': True, 'sideways_use_spike': True, 'sideways_rsi_required': True}.
[I 2025-08-29 20:35:10,705] Trial 498 finished with values: [-1000000000.0, 1000000000.0] and parameters: {'p_sma': 15, 'p_std': 56, 'p_atr': 25, 'p_adx': 30, 'rsi_period': 37, 'ema1': 25, 'ema2': 19, 'slip_atr_k': 0.08779146825996863, 'slip_spread_k': 0.1915976278400256, 'spread_hl_frac': 0.04715340125509628, 'bb_std_mult': 2.1999257596166477, 'rsi_os': 30, 'rsi_ob': 60, 'vol_spike': 0.18682519543966725, 'adx_thresh': 14.985108151035508, 'atr_min_pct': 0.01933075793034714, 'atr_max_pct': 0.03541050688253446, 'tp_mult': 2.232202027519145, 'tsl_mult': 0.4509827467691541, 'strategy': 'mean_reversion', 'time_stop': 202, 'use_sma': False, 'use_atr': False, 'use_adx': True, 'use_ema': True, 'use_spike': False, 'rsi_required': False, 'edge_k': 1.0954294321061238, 'edge_cap': 0.6549863816008784, 'bull_strategy': 'mean_reversion', 'bull_bb_std_mult': 3.2715226542909313, 'bull_rsi_os': 17, 'bull_rsi_ob': 72, 'bull_adx_thresh': 13.310428922829423, 'bull_atr_min_pct': 0.017019869046847106, 'bull_atr_max_pct': 0.10289631282913159, 'bull_tp_mult': 2.9503870677289137, 'bull_tsl_mult': 0.9320798243697439, 'bull_time_stop': 29, 'bull_use_sma': True, 'bull_use_ema': False, 'bull_use_atr': True, 'bull_use_adx': False, 'bull_use_spike': True, 'bull_rsi_required': False, 'bear_strategy': 'mean_reversion', 'bear_bb_std_mult': 3.0085985860372477, 'bear_rsi_os': 28, 'bear_rsi_ob': 86, 'bear_adx_thresh': 21.187214698515543, 'bear_atr_min_pct': 0.0290694044441564, 'bear_atr_max_pct': 0.14532411013623192, 'bear_tp_mult': 2.6665670111537083, 'bear_tsl_mult': 0.9159358766657444, 'bear_time_stop': 49, 'bear_use_sma': False, 'bear_use_ema': True, 'bear_use_atr': False, 'bear_use_adx': True, 'bear_use_spike': False, 'bear_rsi_required': False, 'sideways_strategy': 'breakout', 'sideways_bb_std_mult': 2.4794654045314237, 'sideways_rsi_os': 46, 'sideways_rsi_ob': 77, 'sideways_adx_thresh': 23.048171009510696, 'sideways_atr_min_pct': 0.019234538454376674, 'sideways_atr_max_pct': 0.10799895275285643, 'sideways_tp_mult': 1.0494757079703383, 'sideways_tsl_mult': 0.716094072867923, 'sideways_time_stop': 17, 'sideways_use_sma': False, 'sideways_use_ema': False, 'sideways_use_atr': False, 'sideways_use_adx': False, 'sideways_use_spike': False, 'sideways_rsi_required': True}.
[I 2025-08-29 20:35:11,606] Trial 496 finished with values: [-1000000000.0, 1000000000.0] and parameters: {'p_sma': 23, 'p_std': 56, 'p_atr': 25, 'p_adx': 29, 'rsi_period': 37, 'ema1': 25, 'ema2': 19, 'slip_atr_k': 0.013115703950010812, 'slip_spread_k': 0.14830358352221956, 'spread_hl_frac': 0.04802404225203523, 'bb_std_mult': 1.8020379214542124, 'rsi_os': 11, 'rsi_ob': 58, 'vol_spike': 0.18755078990314855, 'adx_thresh': 15.94579745724667, 'atr_min_pct': 0.008974958407064186, 'atr_max_pct': 0.12239440623976769, 'tp_mult': 1.4647178374563565, 'tsl_mult': 0.19898766439031673, 'strategy': 'breakout', 'time_stop': 190, 'use_sma': False, 'use_atr': False, 'use_adx': True, 'use_ema': True, 'use_spike': False, 'rsi_required': False, 'edge_k': 1.0874734966784159, 'edge_cap': 0.648719344088707, 'bull_strategy': 'mean_reversion', 'bull_bb_std_mult': 3.0039450710803806, 'bull_rsi_os': 15, 'bull_rsi_ob': 74, 'bull_adx_thresh': 23.02912520826084, 'bull_atr_min_pct': 0.0031798340974045283, 'bull_atr_max_pct': 0.1027111996519189, 'bull_tp_mult': 2.6416227324707795, 'bull_tsl_mult': 0.931098182505606, 'bull_time_stop': 29, 'bull_use_sma': False, 'bull_use_ema': False, 'bull_use_atr': True, 'bull_use_adx': False, 'bull_use_spike': True, 'bull_rsi_required': False, 'bear_strategy': 'breakout', 'bear_bb_std_mult': 3.1160541118333964, 'bear_rsi_os': 28, 'bear_rsi_ob': 67, 'bear_adx_thresh': 21.214935094583833, 'bear_atr_min_pct': 0.007775213661100187, 'bear_atr_max_pct': 0.0960223350012678, 'bear_tp_mult': 2.676916328128722, 'bear_tsl_mult': 0.9170376576246031, 'bear_time_stop': 48, 'bear_use_sma': False, 'bear_use_ema': False, 'bear_use_atr': False, 'bear_use_adx': True, 'bear_use_spike': False, 'bear_rsi_required': False, 'sideways_strategy': 'breakout', 'sideways_bb_std_mult': 2.4780512126265726, 'sideways_rsi_os': 40, 'sideways_rsi_ob': 79, 'sideways_adx_thresh': 32.24418666586531, 'sideways_atr_min_pct': 0.02391202320600902, 'sideways_atr_max_pct': 0.10149600467672897, 'sideways_tp_mult': 1.0121538566208679, 'sideways_tsl_mult': 0.5557751321335007, 'sideways_time_stop': 167, 'sideways_use_sma': False, 'sideways_use_ema': False, 'sideways_use_atr': False, 'sideways_use_adx': True, 'sideways_use_spike': False, 'sideways_rsi_required': True}.
[I 2025-08-29 20:35:11,697] Trial 499 finished with values: [-0.004164253547070618, 0.004135349303416487] and parameters: {'p_sma': 21, 'p_std': 22, 'p_atr': 25, 'p_adx': 11, 'rsi_period': 59, 'ema1': 25, 'ema2': 48, 'slip_atr_k': 0.004531393038239363, 'slip_spread_k': 0.19459532057978135, 'spread_hl_frac': 0.021277248617529384, 'bb_std_mult': 2.1903649759395747, 'rsi_os': 49, 'rsi_ob': 60, 'vol_spike': 0.29996510712125685, 'adx_thresh': 12.110286398061247, 'atr_min_pct': 0.008518325058209392, 'atr_max_pct': 0.03474689797898303, 'tp_mult': 2.5931693069334028, 'tsl_mult': 0.8920948527041558, 'strategy': 'mean_reversion', 'time_stop': 159, 'use_sma': False, 'use_atr': False, 'use_adx': False, 'use_ema': True, 'use_spike': False, 'rsi_required': False, 'edge_k': 1.15690724143668, 'edge_cap': 0.4327821949355989, 'bull_strategy': 'breakout', 'bull_bb_std_mult': 1.2141365902899115, 'bull_rsi_os': 22, 'bull_rsi_ob': 81, 'bull_adx_thresh': 13.331497191489468, 'bull_atr_min_pct': 0.0045266734271325, 'bull_atr_max_pct': 0.05170183151410271, 'bull_tp_mult': 2.712243154023406, 'bull_tsl_mult': 0.9325542692888379, 'bull_time_stop': 31, 'bull_use_sma': True, 'bull_use_ema': False, 'bull_use_atr': True, 'bull_use_adx': False, 'bull_use_spike': True, 'bull_rsi_required': False, 'bear_strategy': 'mean_reversion', 'bear_bb_std_mult': 2.783772563886121, 'bear_rsi_os': 28, 'bear_rsi_ob': 86, 'bear_adx_thresh': 21.18778393380606, 'bear_atr_min_pct': 0.007852336033599307, 'bear_atr_max_pct': 0.09774462274180735, 'bear_tp_mult': 2.669738870112851, 'bear_tsl_mult': 0.9174146679137736, 'bear_time_stop': 69, 'bear_use_sma': False, 'bear_use_ema': True, 'bear_use_atr': False, 'bear_use_adx': True, 'bear_use_spike': False, 'bear_rsi_required': False, 'sideways_strategy': 'breakout', 'sideways_bb_std_mult': 0.671301343070086, 'sideways_rsi_os': 46, 'sideways_rsi_ob': 77, 'sideways_adx_thresh': 15.287654438428529, 'sideways_atr_min_pct': 0.004284680713554737, 'sideways_atr_max_pct': 0.026189998495606433, 'sideways_tp_mult': 1.0782851097023727, 'sideways_tsl_mult': 0.7154212239216863, 'sideways_time_stop': 18, 'sideways_use_sma': False, 'sideways_use_ema': False, 'sideways_use_atr': False, 'sideways_use_adx': False, 'sideways_use_spike': False, 'sideways_rsi_required': False}.
[I 2025-08-29 20:35:11,959] Trial 497 finished with values: [-1000000000.0, 1000000000.0] and parameters: {'p_sma': 26, 'p_std': 33, 'p_atr': 25, 'p_adx': 11, 'rsi_period': 40, 'ema1': 25, 'ema2': 47, 'slip_atr_k': 0.22892390012093894, 'slip_spread_k': 0.1997542997292408, 'spread_hl_frac': 0.048064091307660484, 'bb_std_mult': 2.202072907786286, 'rsi_os': 25, 'rsi_ob': 83, 'vol_spike': 0.18795703687517915, 'adx_thresh': 11.853534026980848, 'atr_min_pct': 0.020046185348878077, 'atr_max_pct': 0.11195800097374153, 'tp_mult': 1.949791632396866, 'tsl_mult': 0.11385531442632285, 'strategy': 'breakout', 'time_stop': 166, 'use_sma': False, 'use_atr': False, 'use_adx': True, 'use_ema': True, 'use_spike': False, 'rsi_required': False, 'edge_k': 1.0830478415156732, 'edge_cap': 0.7277939037768818, 'bull_strategy': 'mean_reversion', 'bull_bb_std_mult': 3.42217772522252, 'bull_rsi_os': 15, 'bull_rsi_ob': 74, 'bull_adx_thresh': 14.7597904781279, 'bull_atr_min_pct': 0.0052768359005960185, 'bull_atr_max_pct': 0.12491769112495688, 'bull_tp_mult': 2.6426862875288304, 'bull_tsl_mult': 0.8521015150001513, 'bull_time_stop': 34, 'bull_use_sma': True, 'bull_use_ema': False, 'bull_use_atr': True, 'bull_use_adx': False, 'bull_use_spike': True, 'bull_rsi_required': False, 'bear_strategy': 'mean_reversion', 'bear_bb_std_mult': 3.0152905437109983, 'bear_rsi_os': 28, 'bear_rsi_ob': 86, 'bear_adx_thresh': 21.267479411402892, 'bear_atr_min_pct': 0.027476042686887966, 'bear_atr_max_pct': 0.043785593426252475, 'bear_tp_mult': 1.2109341443844581, 'bear_tsl_mult': 0.9272723055632937, 'bear_time_stop': 70, 'bear_use_sma': True, 'bear_use_ema': True, 'bear_use_atr': False, 'bear_use_adx': True, 'bear_use_spike': False, 'bear_rsi_required': False, 'sideways_strategy': 'breakout', 'sideways_bb_std_mult': 2.289516643281488, 'sideways_rsi_os': 26, 'sideways_rsi_ob': 48, 'sideways_adx_thresh': 34.594171205242574, 'sideways_atr_min_pct': 0.019075075218269986, 'sideways_atr_max_pct': 0.022639268016318062, 'sideways_tp_mult': 2.529199525872871, 'sideways_tsl_mult': 0.712388310594461, 'sideways_time_stop': 205, 'sideways_use_sma': False, 'sideways_use_ema': False, 'sideways_use_atr': False, 'sideways_use_adx': True, 'sideways_use_spike': True, 'sideways_rsi_required': True}.
[I 2025-08-29 20:35:41,487] Trial 501 finished with values: [-1000000000.0, 1000000000.0] and parameters: {'p_sma': 18, 'p_std': 45, 'p_atr': 24, 'p_adx': 10, 'rsi_period': 41, 'ema1': 27, 'ema2': 14, 'slip_atr_k': 0.21561351200109036, 'slip_spread_k': 0.24451041482195507, 'spread_hl_frac': 0.01647780404421234, 'bb_std_mult': 1.5972619466485574, 'rsi_os': 9, 'rsi_ob': 77, 'vol_spike': 0.16931414289073635, 'adx_thresh': 7.992457919863124, 'atr_min_pct': 0.006143931785987279, 'atr_max_pct': 0.01688391216418291, 'tp_mult': 1.4826710881337175, 'tsl_mult': 0.9978996113451166, 'strategy': 'mean_reversion', 'time_stop': 175, 'use_sma': True, 'use_atr': False, 'use_adx': False, 'use_ema': True, 'use_spike': False, 'rsi_required': False, 'edge_k': 1.006965376608111, 'edge_cap': 0.3297946984552967, 'bull_strategy': 'mean_reversion', 'bull_bb_std_mult': 3.1630195405727366, 'bull_rsi_os': 18, 'bull_rsi_ob': 72, 'bull_adx_thresh': 14.90790013448655, 'bull_atr_min_pct': 0.015790231255575528, 'bull_atr_max_pct': 0.07971672895621873, 'bull_tp_mult': 2.103566098274737, 'bull_tsl_mult': 0.34766445230528453, 'bull_time_stop': 43, 'bull_use_sma': True, 'bull_use_ema': False, 'bull_use_atr': True, 'bull_use_adx': False, 'bull_use_spike': True, 'bull_rsi_required': False, 'bear_strategy': 'breakout', 'bear_bb_std_mult': 3.415985106777816, 'bear_rsi_os': 27, 'bear_rsi_ob': 69, 'bear_adx_thresh': 19.479704773184398, 'bear_atr_min_pct': 0.013819858671799206, 'bear_atr_max_pct': 0.04442885592473367, 'bear_tp_mult': 2.595062739196657, 'bear_tsl_mult': 0.20502662209474393, 'bear_time_stop': 64, 'bear_use_sma': False, 'bear_use_ema': True, 'bear_use_atr': False, 'bear_use_adx': True, 'bear_use_spike': True, 'bear_rsi_required': False, 'sideways_strategy': 'breakout', 'sideways_bb_std_mult': 2.2195283811216058, 'sideways_rsi_os': 49, 'sideways_rsi_ob': 93, 'sideways_adx_thresh': 27.093232825470295, 'sideways_atr_min_pct': 0.018392175086542815, 'sideways_atr_max_pct': 0.033423951532996175, 'sideways_tp_mult': 1.2271867128474814, 'sideways_tsl_mult': 0.9477178960852307, 'sideways_time_stop': 206, 'sideways_use_sma': False, 'sideways_use_ema': False, 'sideways_use_atr': False, 'sideways_use_adx': False, 'sideways_use_spike': False, 'sideways_rsi_required': False}.
[I 2025-08-29 20:35:41,499] Trial 500 finished with values: [-0.00042297777309685536, 0.0013913085167821212] and parameters: {'p_sma': 19, 'p_std': 15, 'p_atr': 24, 'p_adx': 10, 'rsi_period': 60, 'ema1': 25, 'ema2': 47, 'slip_atr_k': 0.00030988577140424244, 'slip_spread_k': 0.4832605802869846, 'spread_hl_frac': 0.031711551627173554, 'bb_std_mult': 1.6082683943238767, 'rsi_os': 11, 'rsi_ob': 82, 'vol_spike': 0.17177624756817494, 'adx_thresh': 6.5640532337017365, 'atr_min_pct': 0.01816988196678947, 'atr_max_pct': 0.032290227603520176, 'tp_mult': 2.568836549859233, 'tsl_mult': 0.19949172997897324, 'strategy': 'mean_reversion', 'time_stop': 121, 'use_sma': False, 'use_atr': False, 'use_adx': False, 'use_ema': True, 'use_spike': False, 'rsi_required': False, 'edge_k': 1.157055911961095, 'edge_cap': 0.40643432950189345, 'bull_strategy': 'breakout', 'bull_bb_std_mult': 3.1675455527929586, 'bull_rsi_os': 14, 'bull_rsi_ob': 90, 'bull_adx_thresh': 6.9742460554735395, 'bull_atr_min_pct': 0.01585877497584346, 'bull_atr_max_pct': 0.12736201220906654, 'bull_tp_mult': 2.518326350513342, 'bull_tsl_mult': 0.3871789863576045, 'bull_time_stop': 132, 'bull_use_sma': True, 'bull_use_ema': False, 'bull_use_atr': True, 'bull_use_adx': False, 'bull_use_spike': True, 'bull_rsi_required': False, 'bear_strategy': 'breakout', 'bear_bb_std_mult': 2.0528931014662586, 'bear_rsi_os': 48, 'bear_rsi_ob': 67, 'bear_adx_thresh': 8.912945515593336, 'bear_atr_min_pct': 0.007229254097454846, 'bear_atr_max_pct': 0.0505538041916014, 'bear_tp_mult': 2.599792101557092, 'bear_tsl_mult': 0.9352000879111924, 'bear_time_stop': 74, 'bear_use_sma': False, 'bear_use_ema': True, 'bear_use_atr': False, 'bear_use_adx': True, 'bear_use_spike': False, 'bear_rsi_required': False, 'sideways_strategy': 'breakout', 'sideways_bb_std_mult': 2.8992094618487276, 'sideways_rsi_os': 48, 'sideways_rsi_ob': 81, 'sideways_adx_thresh': 31.491198855079855, 'sideways_atr_min_pct': 0.01834338252539952, 'sideways_atr_max_pct': 0.10106789329009014, 'sideways_tp_mult': 1.0825365564331868, 'sideways_tsl_mult': 0.6749140135277282, 'sideways_time_stop': 204, 'sideways_use_sma': False, 'sideways_use_ema': False, 'sideways_use_atr': False, 'sideways_use_adx': False, 'sideways_use_spike': False, 'sideways_rsi_required': False}.
[I 2025-08-29 20:35:41,750] Trial 503 finished with values: [-1000000000.0, 1000000000.0] and parameters: {'p_sma': 19, 'p_std': 57, 'p_atr': 24, 'p_adx': 12, 'rsi_period': 41, 'ema1': 27, 'ema2': 59, 'slip_atr_k': 0.00903332834583698, 'slip_spread_k': 0.21876762361272195, 'spread_hl_frac': 0.04502133724660454, 'bb_std_mult': 1.5940713861782914, 'rsi_os': 9, 'rsi_ob': 82, 'vol_spike': 0.28082255837788533, 'adx_thresh': 24.893370598869904, 'atr_min_pct': 0.024988553646540186, 'atr_max_pct': 0.031642667419203074, 'tp_mult': 2.963296536040197, 'tsl_mult': 0.3573645001473072, 'strategy': 'mean_reversion', 'time_stop': 215, 'use_sma': True, 'use_atr': False, 'use_adx': False, 'use_ema': True, 'use_spike': False, 'rsi_required': False, 'edge_k': 0.3261957191119682, 'edge_cap': 0.3899607934928304, 'bull_strategy': 'breakout', 'bull_bb_std_mult': 3.142177213931153, 'bull_rsi_os': 20, 'bull_rsi_ob': 72, 'bull_adx_thresh': 15.081909553085199, 'bull_atr_min_pct': 0.017586738005002524, 'bull_atr_max_pct': 0.1371219529906743, 'bull_tp_mult': 2.527869402264789, 'bull_tsl_mult': 0.88364894057474, 'bull_time_stop': 77, 'bull_use_sma': True, 'bull_use_ema': False, 'bull_use_atr': True, 'bull_use_adx': False, 'bull_use_spike': True, 'bull_rsi_required': False, 'bear_strategy': 'breakout', 'bear_bb_std_mult': 1.788779212275926, 'bear_rsi_os': 27, 'bear_rsi_ob': 49, 'bear_adx_thresh': 20.50930064575637, 'bear_atr_min_pct': 0.011220462440629655, 'bear_atr_max_pct': 0.05086899010923758, 'bear_tp_mult': 2.774824462565609, 'bear_tsl_mult': 0.9631520380576816, 'bear_time_stop': 62, 'bear_use_sma': False, 'bear_use_ema': True, 'bear_use_atr': False, 'bear_use_adx': True, 'bear_use_spike': True, 'bear_rsi_required': False, 'sideways_strategy': 'breakout', 'sideways_bb_std_mult': 3.5452106629332256, 'sideways_rsi_os': 48, 'sideways_rsi_ob': 65, 'sideways_adx_thresh': 31.443665519715132, 'sideways_atr_min_pct': 0.014037542988492796, 'sideways_atr_max_pct': 0.039973510215568234, 'sideways_tp_mult': 1.2195891710640037, 'sideways_tsl_mult': 0.6755973830726056, 'sideways_time_stop': 95, 'sideways_use_sma': False, 'sideways_use_ema': False, 'sideways_use_atr': False, 'sideways_use_adx': False, 'sideways_use_spike': False, 'sideways_rsi_required': False}.
[I 2025-08-29 20:35:41,864] Trial 502 finished with values: [-1000000000.0, 1000000000.0] and parameters: {'p_sma': 18, 'p_std': 40, 'p_atr': 24, 'p_adx': 12, 'rsi_period': 40, 'ema1': 27, 'ema2': 14, 'slip_atr_k': 0.22659571147024926, 'slip_spread_k': 0.2157859826320253, 'spread_hl_frac': 0.049386721988470626, 'bb_std_mult': 1.6071884886287808, 'rsi_os': 9, 'rsi_ob': 82, 'vol_spike': 0.1634872248997902, 'adx_thresh': 26.949041884152408, 'atr_min_pct': 0.018013888526331057, 'atr_max_pct': 0.0316932733021101, 'tp_mult': 1.489680351116305, 'tsl_mult': 0.4951269497548166, 'strategy': 'mean_reversion', 'time_stop': 166, 'use_sma': True, 'use_atr': False, 'use_adx': False, 'use_ema': True, 'use_spike': False, 'rsi_required': False, 'edge_k': 1.8325849513102206, 'edge_cap': 0.07400641622422166, 'bull_strategy': 'mean_reversion', 'bull_bb_std_mult': 3.1434565000894814, 'bull_rsi_os': 18, 'bull_rsi_ob': 76, 'bull_adx_thresh': 14.882576662438645, 'bull_atr_min_pct': 0.019366081198243096, 'bull_atr_max_pct': 0.12590531842441322, 'bull_tp_mult': 2.504618877531155, 'bull_tsl_mult': 0.8853930633071715, 'bull_time_stop': 44, 'bull_use_sma': True, 'bull_use_ema': False, 'bull_use_atr': True, 'bull_use_adx': False, 'bull_use_spike': True, 'bull_rsi_required': False, 'bear_strategy': 'breakout', 'bear_bb_std_mult': 2.0734308863686124, 'bear_rsi_os': 48, 'bear_rsi_ob': 82, 'bear_adx_thresh': 19.468618457778636, 'bear_atr_min_pct': 0.011297743285899237, 'bear_atr_max_pct': 0.05096599915809483, 'bear_tp_mult': 2.589342138593712, 'bear_tsl_mult': 0.9566494655108457, 'bear_time_stop': 75, 'bear_use_sma': False, 'bear_use_ema': True, 'bear_use_atr': False, 'bear_use_adx': True, 'bear_use_spike': True, 'bear_rsi_required': False, 'sideways_strategy': 'breakout', 'sideways_bb_std_mult': 2.165794895289247, 'sideways_rsi_os': 26, 'sideways_rsi_ob': 81, 'sideways_adx_thresh': 34.98701473937615, 'sideways_atr_min_pct': 0.004704074672526582, 'sideways_atr_max_pct': 0.032312611520317044, 'sideways_tp_mult': 1.2099526545323684, 'sideways_tsl_mult': 0.16296556709210414, 'sideways_time_stop': 148, 'sideways_use_sma': False, 'sideways_use_ema': False, 'sideways_use_atr': False, 'sideways_use_adx': False, 'sideways_use_spike': False, 'sideways_rsi_required': False}.
