[I 2025-08-29 21:09:43,943] Trial 800 finished with values: [-1000000000.0, 1000000000.0] and parameters: {'p_sma': 15, 'p_std': 39, 'p_atr': 14, 'p_adx': 9, 'rsi_period': 31, 'ema1': 24, 'ema2': 27, 'slip_atr_k': 0.01845170442459277, 'slip_spread_k': 0.07176526656581403, 'spread_hl_frac': 0.024189422659406462, 'bb_std_mult': 0.7943489750723756, 'rsi_os': 7, 'rsi_ob': 79, 'vol_spike': 0.27995825622174214, 'adx_thresh': 6.929638902927263, 'atr_min_pct': 0.012409764935050329, 'atr_max_pct': 0.041916985338719875, 'tp_mult': 2.4020643632682126, 'tsl_mult': 0.7715894773605858, 'strategy': 'breakout', 'time_stop': 225, 'use_sma': False, 'use_atr': True, 'use_adx': True, 'use_ema': False, 'use_spike': True, 'rsi_required': True, 'edge_k': 0.8136479958337832, 'edge_cap': 0.25170900711528715, 'bull_strategy': 'breakout', 'bull_bb_std_mult': 2.652456627301136, 'bull_rsi_os': 24, 'bull_rsi_ob': 67, 'bull_adx_thresh': 31.271249535762124, 'bull_atr_min_pct': 0.018340364270373336, 'bull_atr_max_pct': 0.10242569914333893, 'bull_tp_mult': 2.4265120599740317, 'bull_tsl_mult': 0.9881548499706524, 'bull_time_stop': 205, 'bull_use_sma': False, 'bull_use_ema': True, 'bull_use_atr': False, 'bull_use_adx': True, 'bull_use_spike': False, 'bull_rsi_required': True, 'bear_strategy': 'mean_reversion', 'bear_bb_std_mult': 2.4487646859561045, 'bear_rsi_os': 39, 'bear_rsi_ob': 85, 'bear_adx_thresh': 14.857708104810943, 'bear_atr_min_pct': 0.001681809391922565, 'bear_atr_max_pct': 0.0791405766814978, 'bear_tp_mult': 2.854989337991173, 'bear_tsl_mult': 0.02243394947322056, 'bear_time_stop': 251, 'bear_use_sma': True, 'bear_use_ema': False, 'bear_use_atr': True, 'bear_use_adx': False, 'bear_use_spike': False, 'bear_rsi_required': True, 'sideways_strategy': 'mean_reversion', 'sideways_bb_std_mult': 3.5439449656723605, 'sideways_rsi_os': 22, 'sideways_rsi_ob': 85, 'sideways_adx_thresh': 11.251028750276232, 'sideways_atr_min_pct': 0.015094909626348085, 'sideways_atr_max_pct': 0.04499374788211597, 'sideways_tp_mult': 2.2710928575023415, 'sideways_tsl_mult': 0.5681349650850019, 'sideways_time_stop': 152, 'sideways_use_sma': True, 'sideways_use_ema': True, 'sideways_use_atr': True, 'sideways_use_adx': True, 'sideways_use_spike': True, 'sideways_rsi_required': True}.
[I 2025-08-29 21:09:44,190] Trial 803 finished with values: [-1000000000.0, 1000000000.0] and parameters: {'p_sma': 15, 'p_std': 36, 'p_atr': 14, 'p_adx': 9, 'rsi_period': 33, 'ema1': 24, 'ema2': 28, 'slip_atr_k': 0.016822927759757137, 'slip_spread_k': 0.09732795066667747, 'spread_hl_frac': 0.023291015032201323, 'bb_std_mult': 0.8016110676749006, 'rsi_os': 7, 'rsi_ob': 79, 'vol_spike': 0.2798237403987506, 'adx_thresh': 8.138400239367545, 'atr_min_pct': 0.012344440120408298, 'atr_max_pct': 0.04160296088430145, 'tp_mult': 2.3877775158214543, 'tsl_mult': 0.7731648269753967, 'strategy': 'breakout', 'time_stop': 228, 'use_sma': False, 'use_atr': True, 'use_adx': True, 'use_ema': False, 'use_spike': True, 'rsi_required': True, 'edge_k': 0.845580122580151, 'edge_cap': 0.2783886760447829, 'bull_strategy': 'breakout', 'bull_bb_std_mult': 2.6985986292624147, 'bull_rsi_os': 24, 'bull_rsi_ob': 66, 'bull_adx_thresh': 26.29742633133732, 'bull_atr_min_pct': 0.01823989270120911, 'bull_atr_max_pct': 0.1026309978586198, 'bull_tp_mult': 2.3305602704184656, 'bull_tsl_mult': 0.9858210388573325, 'bull_time_stop': 200, 'bull_use_sma': False, 'bull_use_ema': True, 'bull_use_atr': False, 'bull_use_adx': True, 'bull_use_spike': False, 'bull_rsi_required': True, 'bear_strategy': 'mean_reversion', 'bear_bb_std_mult': 2.4490900723018116, 'bear_rsi_os': 39, 'bear_rsi_ob': 86, 'bear_adx_thresh': 12.436551191768004, 'bear_atr_min_pct': 0.024721283931763566, 'bear_atr_max_pct': 0.07488055527319608, 'bear_tp_mult': 2.8379274405276322, 'bear_tsl_mult': 0.026434413699740304, 'bear_time_stop': 253, 'bear_use_sma': True, 'bear_use_ema': False, 'bear_use_atr': True, 'bear_use_adx': False, 'bear_use_spike': False, 'bear_rsi_required': True, 'sideways_strategy': 'mean_reversion', 'sideways_bb_std_mult': 3.5959299150476065, 'sideways_rsi_os': 20, 'sideways_rsi_ob': 84, 'sideways_adx_thresh': 11.079397765449492, 'sideways_atr_min_pct': 0.014476376166026874, 'sideways_atr_max_pct': 0.04349478133941238, 'sideways_tp_mult': 2.279999389594503, 'sideways_tsl_mult': 0.5742945505051561, 'sideways_time_stop': 160, 'sideways_use_sma': True, 'sideways_use_ema': True, 'sideways_use_atr': True, 'sideways_use_adx': True, 'sideways_use_spike': True, 'sideways_rsi_required': True}.
[I 2025-08-29 21:09:44,282] Trial 802 finished with values: [-1000000000.0, 1000000000.0] and parameters: {'p_sma': 12, 'p_std': 38, 'p_atr': 14, 'p_adx': 9, 'rsi_period': 33, 'ema1': 24, 'ema2': 28, 'slip_atr_k': 0.016860786063802327, 'slip_spread_k': 0.09277111014086019, 'spread_hl_frac': 0.02396147734006471, 'bb_std_mult': 0.8007918781012958, 'rsi_os': 7, 'rsi_ob': 79, 'vol_spike': 0.27517586970889263, 'adx_thresh': 8.21253483982655, 'atr_min_pct': 0.012331630629585682, 'atr_max_pct': 0.04556228258370446, 'tp_mult': 2.380968623312674, 'tsl_mult': 0.7665805488565928, 'strategy': 'breakout', 'time_stop': 226, 'use_sma': False, 'use_atr': True, 'use_adx': True, 'use_ema': False, 'use_spike': True, 'rsi_required': True, 'edge_k': 0.8604003812999202, 'edge_cap': 0.2766057798152065, 'bull_strategy': 'breakout', 'bull_bb_std_mult': 2.6015157966601055, 'bull_rsi_os': 24, 'bull_rsi_ob': 66, 'bull_adx_thresh': 25.51112857868833, 'bull_atr_min_pct': 0.018656326830591447, 'bull_atr_max_pct': 0.10371451209213106, 'bull_tp_mult': 2.3436999989242344, 'bull_tsl_mult': 0.9815396458164217, 'bull_time_stop': 202, 'bull_use_sma': False, 'bull_use_ema': True, 'bull_use_atr': False, 'bull_use_adx': True, 'bull_use_spike': False, 'bull_rsi_required': True, 'bear_strategy': 'mean_reversion', 'bear_bb_std_mult': 2.4392104667570202, 'bear_rsi_os': 39, 'bear_rsi_ob': 85, 'bear_adx_thresh': 13.12370596094334, 'bear_atr_min_pct': 0.02487554875555254, 'bear_atr_max_pct': 0.07833499254314265, 'bear_tp_mult': 2.8315368724685612, 'bear_tsl_mult': 0.023489050670899903, 'bear_time_stop': 251, 'bear_use_sma': True, 'bear_use_ema': False, 'bear_use_atr': True, 'bear_use_adx': False, 'bear_use_spike': False, 'bear_rsi_required': True, 'sideways_strategy': 'mean_reversion', 'sideways_bb_std_mult': 3.5453506353021518, 'sideways_rsi_os': 20, 'sideways_rsi_ob': 84, 'sideways_adx_thresh': 11.00795192971287, 'sideways_atr_min_pct': 0.01437043381450031, 'sideways_atr_max_pct': 0.0435557055691099, 'sideways_tp_mult': 2.313184829737449, 'sideways_tsl_mult': 0.5589543025014542, 'sideways_time_stop': 155, 'sideways_use_sma': True, 'sideways_use_ema': True, 'sideways_use_atr': True, 'sideways_use_adx': True, 'sideways_use_spike': True, 'sideways_rsi_required': True}.
[I 2025-08-29 21:10:14,706] Trial 804 finished with values: [-1000000000.0, 1000000000.0] and parameters: {'p_sma': 16, 'p_std': 41, 'p_atr': 15, 'p_adx': 9, 'rsi_period': 33, 'ema1': 24, 'ema2': 26, 'slip_atr_k': 0.01924271836960008, 'slip_spread_k': 0.09795352126284144, 'spread_hl_frac': 0.023082893750763764, 'bb_std_mult': 0.8128657608419659, 'rsi_os': 7, 'rsi_ob': 79, 'vol_spike': 0.2795569195486747, 'adx_thresh': 8.029657173538673, 'atr_min_pct': 0.011883984043203481, 'atr_max_pct': 0.0410438973105733, 'tp_mult': 2.40051868958245, 'tsl_mult': 0.7766367731406558, 'strategy': 'breakout', 'time_stop': 227, 'use_sma': False, 'use_atr': True, 'use_adx': True, 'use_ema': False, 'use_spike': True, 'rsi_required': True, 'edge_k': 0.8729462880131037, 'edge_cap': 0.2857991008721439, 'bull_strategy': 'breakout', 'bull_bb_std_mult': 2.5845385084795662, 'bull_rsi_os': 24, 'bull_rsi_ob': 67, 'bull_adx_thresh': 24.15197418119353, 'bull_atr_min_pct': 0.01820325677576917, 'bull_atr_max_pct': 0.10334159884884565, 'bull_tp_mult': 2.4338036367843006, 'bull_tsl_mult': 0.9942818585096969, 'bull_time_stop': 202, 'bull_use_sma': False, 'bull_use_ema': True, 'bull_use_atr': False, 'bull_use_adx': True, 'bull_use_spike': False, 'bull_rsi_required': True, 'bear_strategy': 'mean_reversion', 'bear_bb_std_mult': 2.017221751695421, 'bear_rsi_os': 40, 'bear_rsi_ob': 86, 'bear_adx_thresh': 13.139744419160717, 'bear_atr_min_pct': 0.0017400245714339815, 'bear_atr_max_pct': 0.07377038115801339, 'bear_tp_mult': 2.835679619883258, 'bear_tsl_mult': 0.03126188234512436, 'bear_time_stop': 252, 'bear_use_sma': True, 'bear_use_ema': False, 'bear_use_atr': True, 'bear_use_adx': False, 'bear_use_spike': False, 'bear_rsi_required': True, 'sideways_strategy': 'mean_reversion', 'sideways_bb_std_mult': 3.5865088716920335, 'sideways_rsi_os': 20, 'sideways_rsi_ob': 84, 'sideways_adx_thresh': 10.638800644528095, 'sideways_atr_min_pct': 0.014202983496637848, 'sideways_atr_max_pct': 0.041236754122229546, 'sideways_tp_mult': 2.298449165342212, 'sideways_tsl_mult': 0.5799285389994009, 'sideways_time_stop': 153, 'sideways_use_sma': True, 'sideways_use_ema': True, 'sideways_use_atr': True, 'sideways_use_adx': True, 'sideways_use_spike': True, 'sideways_rsi_required': True}.
[I 2025-08-29 21:10:14,717] Trial 806 finished with values: [-1000000000.0, 1000000000.0] and parameters: {'p_sma': 12, 'p_std': 38, 'p_atr': 15, 'p_adx': 8, 'rsi_period': 30, 'ema1': 24, 'ema2': 26, 'slip_atr_k': 0.01823883423940669, 'slip_spread_k': 0.04986182241966276, 'spread_hl_frac': 0.023057583156960885, 'bb_std_mult': 0.8728701484911292, 'rsi_os': 7, 'rsi_ob': 79, 'vol_spike': 0.2747695223623254, 'adx_thresh': 8.188059606273352, 'atr_min_pct': 0.011855165819173057, 'atr_max_pct': 0.03948049818077582, 'tp_mult': 2.3566233734074746, 'tsl_mult': 0.7476879206506477, 'strategy': 'breakout', 'time_stop': 231, 'use_sma': False, 'use_atr': True, 'use_adx': True, 'use_ema': False, 'use_spike': True, 'rsi_required': True, 'edge_k': 0.8782412142638273, 'edge_cap': 0.2821867269330464, 'bull_strategy': 'breakout', 'bull_bb_std_mult': 2.5987218845470017, 'bull_rsi_os': 23, 'bull_rsi_ob': 67, 'bull_adx_thresh': 24.210011482408753, 'bull_atr_min_pct': 0.019222211326273317, 'bull_atr_max_pct': 0.10672866913867143, 'bull_tp_mult': 2.445763021491052, 'bull_tsl_mult': 0.9981756399168326, 'bull_time_stop': 198, 'bull_use_sma': False, 'bull_use_ema': True, 'bull_use_atr': False, 'bull_use_adx': True, 'bull_use_spike': False, 'bull_rsi_required': True, 'bear_strategy': 'mean_reversion', 'bear_bb_std_mult': 2.4749217810605835, 'bear_rsi_os': 40, 'bear_rsi_ob': 86, 'bear_adx_thresh': 13.474895394456428, 'bear_atr_min_pct': 0.0004228729231687857, 'bear_atr_max_pct': 0.0732835286815277, 'bear_tp_mult': 2.8911151005163696, 'bear_tsl_mult': 0.04078533433126969, 'bear_time_stop': 245, 'bear_use_sma': True, 'bear_use_ema': False, 'bear_use_atr': True, 'bear_use_adx': False, 'bear_use_spike': False, 'bear_rsi_required': True, 'sideways_strategy': 'mean_reversion', 'sideways_bb_std_mult': 3.5507044480478034, 'sideways_rsi_os': 21, 'sideways_rsi_ob': 83, 'sideways_adx_thresh': 10.777173614749675, 'sideways_atr_min_pct': 0.014214671496077656, 'sideways_atr_max_pct': 0.041057569119217575, 'sideways_tp_mult': 2.303750652933346, 'sideways_tsl_mult': 0.5909040065235373, 'sideways_time_stop': 152, 'sideways_use_sma': True, 'sideways_use_ema': True, 'sideways_use_atr': True, 'sideways_use_adx': True, 'sideways_use_spike': True, 'sideways_rsi_required': True}.
[I 2025-08-29 21:10:14,938] Trial 807 finished with values: [-1000000000.0, 1000000000.0] and parameters: {'p_sma': 17, 'p_std': 41, 'p_atr': 15, 'p_adx': 8, 'rsi_period': 30, 'ema1': 24, 'ema2': 26, 'slip_atr_k': 0.01762852241066819, 'slip_spread_k': 0.04875306390020406, 'spread_hl_frac': 0.025131951720467536, 'bb_std_mult': 0.8772214965672479, 'rsi_os': 7, 'rsi_ob': 78, 'vol_spike': 0.28450633781418666, 'adx_thresh': 8.612230449795913, 'atr_min_pct': 0.011546594312070883, 'atr_max_pct': 0.04061198799429973, 'tp_mult': 2.4478235695677033, 'tsl_mult': 0.7498321014508892, 'strategy': 'breakout', 'time_stop': 231, 'use_sma': False, 'use_atr': True, 'use_adx': True, 'use_ema': False, 'use_spike': True, 'rsi_required': True, 'edge_k': 0.869865419275124, 'edge_cap': 0.2796897606924785, 'bull_strategy': 'breakout', 'bull_bb_std_mult': 2.760352950278157, 'bull_rsi_os': 23, 'bull_rsi_ob': 67, 'bull_adx_thresh': 33.617037618824526, 'bull_atr_min_pct': 0.01916065101925628, 'bull_atr_max_pct': 0.10531879616994477, 'bull_tp_mult': 2.4516851399590847, 'bull_tsl_mult': 0.991023215040655, 'bull_time_stop': 209, 'bull_use_sma': False, 'bull_use_ema': True, 'bull_use_atr': False, 'bull_use_adx': True, 'bull_use_spike': False, 'bull_rsi_required': True, 'bear_strategy': 'mean_reversion', 'bear_bb_std_mult': 1.9880296058244722, 'bear_rsi_os': 40, 'bear_rsi_ob': 86, 'bear_adx_thresh': 11.174031935762855, 'bear_atr_min_pct': 0.028511118855430388, 'bear_atr_max_pct': 0.074310250906542, 'bear_tp_mult': 2.906103945889585, 'bear_tsl_mult': 0.04183320764282254, 'bear_time_stop': 233, 'bear_use_sma': True, 'bear_use_ema': False, 'bear_use_atr': True, 'bear_use_adx': False, 'bear_use_spike': False, 'bear_rsi_required': True, 'sideways_strategy': 'mean_reversion', 'sideways_bb_std_mult': 3.5945354476625715, 'sideways_rsi_os': 21, 'sideways_rsi_ob': 87, 'sideways_adx_thresh': 11.44786505913443, 'sideways_atr_min_pct': 0.013940671969701359, 'sideways_atr_max_pct': 0.040151006903702845, 'sideways_tp_mult': 2.2966130418906747, 'sideways_tsl_mult': 0.5839768071337212, 'sideways_time_stop': 162, 'sideways_use_sma': True, 'sideways_use_ema': True, 'sideways_use_atr': True, 'sideways_use_adx': True, 'sideways_use_spike': True, 'sideways_rsi_required': True}.
[I 2025-08-29 21:10:15,003] Trial 805 finished with values: [-1000000000.0, 1000000000.0] and parameters: {'p_sma': 13, 'p_std': 38, 'p_atr': 15, 'p_adx': 8, 'rsi_period': 33, 'ema1': 24, 'ema2': 28, 'slip_atr_k': 0.01990215136653982, 'slip_spread_k': 0.102062510287551, 'spread_hl_frac': 0.022953307689894932, 'bb_std_mult': 0.8195526621110569, 'rsi_os': 7, 'rsi_ob': 78, 'vol_spike': 0.28414653242242605, 'adx_thresh': 8.1075900229168, 'atr_min_pct': 0.011763720477210934, 'atr_max_pct': 0.04033580226628817, 'tp_mult': 2.3861052220398884, 'tsl_mult': 0.7492066946575743, 'strategy': 'breakout', 'time_stop': 232, 'use_sma': False, 'use_atr': True, 'use_adx': True, 'use_ema': False, 'use_spike': True, 'rsi_required': True, 'edge_k': 0.8901221220878254, 'edge_cap': 0.2763491851215591, 'bull_strategy': 'breakout', 'bull_bb_std_mult': 2.5812296769609007, 'bull_rsi_os': 24, 'bull_rsi_ob': 67, 'bull_adx_thresh': 26.27836950289198, 'bull_atr_min_pct': 0.018276614177146232, 'bull_atr_max_pct': 0.10585741961434948, 'bull_tp_mult': 2.3292258582984653, 'bull_tsl_mult': 0.9964594270571869, 'bull_time_stop': 200, 'bull_use_sma': False, 'bull_use_ema': True, 'bull_use_atr': False, 'bull_use_adx': True, 'bull_use_spike': False, 'bull_rsi_required': True, 'bear_strategy': 'mean_reversion', 'bear_bb_std_mult': 2.472113974852712, 'bear_rsi_os': 40, 'bear_rsi_ob': 86, 'bear_adx_thresh': 12.92258806868552, 'bear_atr_min_pct': 0.027633814250408992, 'bear_atr_max_pct': 0.07501503639125585, 'bear_tp_mult': 2.855757569886752, 'bear_tsl_mult': 0.03166785361684746, 'bear_time_stop': 249, 'bear_use_sma': True, 'bear_use_ema': False, 'bear_use_atr': True, 'bear_use_adx': False, 'bear_use_spike': False, 'bear_rsi_required': True, 'sideways_strategy': 'mean_reversion', 'sideways_bb_std_mult': 3.583721765694303, 'sideways_rsi_os': 20, 'sideways_rsi_ob': 84, 'sideways_adx_thresh': 10.835784376597275, 'sideways_atr_min_pct': 0.014447616518202313, 'sideways_atr_max_pct': 0.041244031491421154, 'sideways_tp_mult': 2.296106749235037, 'sideways_tsl_mult': 0.591988357385025, 'sideways_time_stop': 163, 'sideways_use_sma': True, 'sideways_use_ema': True, 'sideways_use_atr': True, 'sideways_use_adx': True, 'sideways_use_spike': True, 'sideways_rsi_required': True}.
[I 2025-08-29 21:10:44,216] Trial 809 finished with values: [-1000000000.0, 1000000000.0] and parameters: {'p_sma': 17, 'p_std': 40, 'p_atr': 15, 'p_adx': 8, 'rsi_period': 32, 'ema1': 24, 'ema2': 26, 'slip_atr_k': 0.021178913822357055, 'slip_spread_k': 0.056289664268470006, 'spread_hl_frac': 0.024924765167301677, 'bb_std_mult': 0.7038084514152806, 'rsi_os': 7, 'rsi_ob': 78, 'vol_spike': 0.2848766188772697, 'adx_thresh': 8.637410449423534, 'atr_min_pct': 0.01146553063394023, 'atr_max_pct': 0.03859346821628877, 'tp_mult': 2.4510142090105833, 'tsl_mult': 0.7885016193001015, 'strategy': 'breakout', 'time_stop': 220, 'use_sma': False, 'use_atr': True, 'use_adx': True, 'use_ema': False, 'use_spike': True, 'rsi_required': True, 'edge_k': 0.8794177767285425, 'edge_cap': 0.28222394923367133, 'bull_strategy': 'breakout', 'bull_bb_std_mult': 2.7491142293237023, 'bull_rsi_os': 23, 'bull_rsi_ob': 68, 'bull_adx_thresh': 24.848624511990053, 'bull_atr_min_pct': 0.01889504344315724, 'bull_atr_max_pct': 0.11137530266541215, 'bull_tp_mult': 2.3749258167539793, 'bull_tsl_mult': 0.9656739942397471, 'bull_time_stop': 210, 'bull_use_sma': False, 'bull_use_ema': True, 'bull_use_atr': False, 'bull_use_adx': True, 'bull_use_spike': False, 'bull_rsi_required': True, 'bear_strategy': 'mean_reversion', 'bear_bb_std_mult': 1.9516184871295739, 'bear_rsi_os': 37, 'bear_rsi_ob': 87, 'bear_adx_thresh': 10.420183340291489, 'bear_atr_min_pct': 0.022578495521187944, 'bear_atr_max_pct': 0.0814560488931175, 'bear_tp_mult': 2.9051022563888944, 'bear_tsl_mult': 0.05497149767137388, 'bear_time_stop': 230, 'bear_use_sma': True, 'bear_use_ema': False, 'bear_use_atr': True, 'bear_use_adx': False, 'bear_use_spike': False, 'bear_rsi_required': True, 'sideways_strategy': 'mean_reversion', 'sideways_bb_std_mult': 3.599929936134612, 'sideways_rsi_os': 23, 'sideways_rsi_ob': 83, 'sideways_adx_thresh': 11.460599090125113, 'sideways_atr_min_pct': 0.013779874844888592, 'sideways_atr_max_pct': 0.0391461432756257, 'sideways_tp_mult': 2.3330794660898735, 'sideways_tsl_mult': 0.5885908143131212, 'sideways_time_stop': 163, 'sideways_use_sma': True, 'sideways_use_ema': False, 'sideways_use_atr': True, 'sideways_use_adx': True, 'sideways_use_spike': True, 'sideways_rsi_required': True}.
[I 2025-08-29 21:10:44,493] Trial 808 finished with values: [-1000000000.0, 1000000000.0] and parameters: {'p_sma': 17, 'p_std': 40, 'p_atr': 15, 'p_adx': 8, 'rsi_period': 29, 'ema1': 24, 'ema2': 26, 'slip_atr_k': 0.0226354732738399, 'slip_spread_k': 0.10782424589128332, 'spread_hl_frac': 0.022756099661283762, 'bb_std_mult': 0.7372579105309227, 'rsi_os': 7, 'rsi_ob': 78, 'vol_spike': 0.2859574958902817, 'adx_thresh': 8.739271944548523, 'atr_min_pct': 0.012073952824181765, 'atr_max_pct': 0.04017536787715413, 'tp_mult': 2.4550793808862528, 'tsl_mult': 0.7871960299321954, 'strategy': 'breakout', 'time_stop': 237, 'use_sma': False, 'use_atr': True, 'use_adx': True, 'use_ema': False, 'use_spike': True, 'rsi_required': True, 'edge_k': 0.8319298240322257, 'edge_cap': 0.2825544373149235, 'bull_strategy': 'breakout', 'bull_bb_std_mult': 2.788137835895815, 'bull_rsi_os': 24, 'bull_rsi_ob': 68, 'bull_adx_thresh': 31.740090531708773, 'bull_atr_min_pct': 0.019053867947677848, 'bull_atr_max_pct': 0.11011600853454626, 'bull_tp_mult': 2.380916294375956, 'bull_tsl_mult': 0.967892144463412, 'bull_time_stop': 210, 'bull_use_sma': False, 'bull_use_ema': True, 'bull_use_atr': False, 'bull_use_adx': True, 'bull_use_spike': False, 'bull_rsi_required': True, 'bear_strategy': 'mean_reversion', 'bear_bb_std_mult': 2.051630008181462, 'bear_rsi_os': 41, 'bear_rsi_ob': 87, 'bear_adx_thresh': 11.3248910257681, 'bear_atr_min_pct': 0.02026054259763727, 'bear_atr_max_pct': 0.08286952963602039, 'bear_tp_mult': 2.9072934133543455, 'bear_tsl_mult': 0.04983983588524309, 'bear_time_stop': 228, 'bear_use_sma': True, 'bear_use_ema': False, 'bear_use_atr': True, 'bear_use_adx': False, 'bear_use_spike': False, 'bear_rsi_required': True, 'sideways_strategy': 'mean_reversion', 'sideways_bb_std_mult': 3.498274346740039, 'sideways_rsi_os': 19, 'sideways_rsi_ob': 83, 'sideways_adx_thresh': 11.880483333465975, 'sideways_atr_min_pct': 0.013465987791252175, 'sideways_atr_max_pct': 0.03987730003302961, 'sideways_tp_mult': 2.340390859657977, 'sideways_tsl_mult': 0.5825842978882182, 'sideways_time_stop': 163, 'sideways_use_sma': True, 'sideways_use_ema': False, 'sideways_use_atr': True, 'sideways_use_adx': True, 'sideways_use_spike': True, 'sideways_rsi_required': True}.
