[I 2025-08-29 20:38:47,848] Trial 532 finished with values: [-1000000000.0, 1000000000.0] and parameters: {'p_sma': 18, 'p_std': 59, 'p_atr': 26, 'p_adx': 13, 'rsi_period': 41, 'ema1': 16, 'ema2': 11, 'slip_atr_k': 4.176190172372907e-06, 'slip_spread_k': 0.5285919025861204, 'spread_hl_frac': 0.04997346346461751, 'bb_std_mult': 1.8232039069856238, 'rsi_os': 47, 'rsi_ob': 54, 'vol_spike': 0.03348102304993944, 'adx_thresh': 13.208937949712107, 'atr_min_pct': 0.019235894712495094, 'atr_max_pct': 0.03089379581789025, 'tp_mult': 1.2327644963533346, 'tsl_mult': 0.944413845873185, 'strategy': 'mean_reversion', 'time_stop': 171, 'use_sma': True, 'use_atr': True, 'use_adx': True, 'use_ema': True, 'use_spike': False, 'rsi_required': False, 'edge_k': 1.0776551658019067, 'edge_cap': 0.7080174744275688, 'bull_strategy': 'mean_reversion', 'bull_bb_std_mult': 3.2895273961917266, 'bull_rsi_os': 22, 'bull_rsi_ob': 52, 'bull_adx_thresh': 8.797945320985384, 'bull_atr_min_pct': 0.00667657152572952, 'bull_atr_max_pct': 0.05357678496117528, 'bull_tp_mult': 2.731030914973296, 'bull_tsl_mult': 0.7214751995196014, 'bull_time_stop': 26, 'bull_use_sma': True, 'bull_use_ema': False, 'bull_use_atr': True, 'bull_use_adx': False, 'bull_use_spike': False, 'bull_rsi_required': False, 'bear_strategy': 'breakout', 'bear_bb_std_mult': 2.6861833785632565, 'bear_rsi_os': 26, 'bear_rsi_ob': 68, 'bear_adx_thresh': 20.121867989901837, 'bear_atr_min_pct': 0.006041619291134605, 'bear_atr_max_pct': 0.04975750716351404, 'bear_tp_mult': 2.7350889037422745, 'bear_tsl_mult': 0.9160432528373736, 'bear_time_stop': 83, 'bear_use_sma': False, 'bear_use_ema': True, 'bear_use_atr': False, 'bear_use_adx': True, 'bear_use_spike': True, 'bear_rsi_required': True, 'sideways_strategy': 'breakout', 'sideways_bb_std_mult': 2.4541615757537563, 'sideways_rsi_os': 46, 'sideways_rsi_ob': 78, 'sideways_adx_thresh': 32.995724956995055, 'sideways_atr_min_pct': 0.005711005349002616, 'sideways_atr_max_pct': 0.022633505872219805, 'sideways_tp_mult': 1.0607929627863717, 'sideways_tsl_mult': 0.7318399031871563, 'sideways_time_stop': 60, 'sideways_use_sma': False, 'sideways_use_ema': False, 'sideways_use_atr': False, 'sideways_use_adx': False, 'sideways_use_spike': False, 'sideways_rsi_required': False}.
[I 2025-08-29 20:38:47,956] Trial 531 finished with values: [-1000000000.0, 1000000000.0] and parameters: {'p_sma': 19, 'p_std': 43, 'p_atr': 17, 'p_adx': 12, 'rsi_period': 52, 'ema1': 26, 'ema2': 45, 'slip_atr_k': 0.17820027121024917, 'slip_spread_k': 0.2044899791780914, 'spread_hl_frac': 0.04999767443479021, 'bb_std_mult': 1.8504046693359, 'rsi_os': 7, 'rsi_ob': 84, 'vol_spike': 0.0011949860095577247, 'adx_thresh': 10.550175366881378, 'atr_min_pct': 0.01826653058588178, 'atr_max_pct': 0.031887368187349996, 'tp_mult': 2.126786589389146, 'tsl_mult': 0.9437991838086899, 'strategy': 'breakout', 'time_stop': 162, 'use_sma': True, 'use_atr': False, 'use_adx': False, 'use_ema': True, 'use_spike': False, 'rsi_required': False, 'edge_k': 1.1749323571128831, 'edge_cap': 0.2941329556453185, 'bull_strategy': 'mean_reversion', 'bull_bb_std_mult': 3.286965985009287, 'bull_rsi_os': 21, 'bull_rsi_ob': 74, 'bull_adx_thresh': 13.444461190334989, 'bull_atr_min_pct': 0.01705076171439518, 'bull_atr_max_pct': 0.09174483961935978, 'bull_tp_mult': 2.72225392787938, 'bull_tsl_mult': 0.7244396523714844, 'bull_time_stop': 24, 'bull_use_sma': True, 'bull_use_ema': False, 'bull_use_atr': True, 'bull_use_adx': False, 'bull_use_spike': False, 'bull_rsi_required': False, 'bear_strategy': 'breakout', 'bear_bb_std_mult': 2.566507357120653, 'bear_rsi_os': 13, 'bear_rsi_ob': 77, 'bear_adx_thresh': 19.953463229095796, 'bear_atr_min_pct': 0.006228118856303563, 'bear_atr_max_pct': 0.04173600608540947, 'bear_tp_mult': 2.0250834678185687, 'bear_tsl_mult': 0.9189142179476608, 'bear_time_stop': 50, 'bear_use_sma': False, 'bear_use_ema': False, 'bear_use_atr': False, 'bear_use_adx': True, 'bear_use_spike': True, 'bear_rsi_required': True, 'sideways_strategy': 'breakout', 'sideways_bb_std_mult': 2.4153223535862045, 'sideways_rsi_os': 38, 'sideways_rsi_ob': 80, 'sideways_adx_thresh': 12.45320083596313, 'sideways_atr_min_pct': 0.0045846964580250685, 'sideways_atr_max_pct': 0.02250366554881012, 'sideways_tp_mult': 1.4278900808540484, 'sideways_tsl_mult': 0.9993374421276463, 'sideways_time_stop': 188, 'sideways_use_sma': False, 'sideways_use_ema': False, 'sideways_use_atr': False, 'sideways_use_adx': True, 'sideways_use_spike': False, 'sideways_rsi_required': False}.
[I 2025-08-29 20:39:16,819] Trial 533 finished with values: [-0.002643444111770421, 0.003221604046890355] and parameters: {'p_sma': 18, 'p_std': 59, 'p_atr': 25, 'p_adx': 13, 'rsi_period': 40, 'ema1': 26, 'ema2': 16, 'slip_atr_k': 0.009225109525218798, 'slip_spread_k': 0.15259315663843054, 'spread_hl_frac': 0.04914971609847207, 'bb_std_mult': 2.9403769528610053, 'rsi_os': 35, 'rsi_ob': 84, 'vol_spike': 0.0719079639634328, 'adx_thresh': 19.92873222595312, 'atr_min_pct': 0.02239697415326703, 'atr_max_pct': 0.14954482588657242, 'tp_mult': 2.1323937314289747, 'tsl_mult': 0.7532688015858029, 'strategy': 'mean_reversion', 'time_stop': 171, 'use_sma': True, 'use_atr': True, 'use_adx': True, 'use_ema': True, 'use_spike': False, 'rsi_required': False, 'edge_k': 0.9174411564798846, 'edge_cap': 0.2903797564948595, 'bull_strategy': 'mean_reversion', 'bull_bb_std_mult': 3.1481795953801273, 'bull_rsi_os': 27, 'bull_rsi_ob': 52, 'bull_adx_thresh': 25.0972306952669, 'bull_atr_min_pct': 0.026347105993109927, 'bull_atr_max_pct': 0.09153285717790194, 'bull_tp_mult': 2.7089769015967664, 'bull_tsl_mult': 0.7102745250583598, 'bull_time_stop': 27, 'bull_use_sma': True, 'bull_use_ema': False, 'bull_use_atr': True, 'bull_use_adx': False, 'bull_use_spike': False, 'bull_rsi_required': False, 'bear_strategy': 'breakout', 'bear_bb_std_mult': 2.709866586913127, 'bear_rsi_os': 28, 'bear_rsi_ob': 68, 'bear_adx_thresh': 12.734940151212614, 'bear_atr_min_pct': 0.0060644100860634195, 'bear_atr_max_pct': 0.09380757977414506, 'bear_tp_mult': 2.7169327860682966, 'bear_tsl_mult': 0.9185802427431142, 'bear_time_stop': 49, 'bear_use_sma': False, 'bear_use_ema': True, 'bear_use_atr': False, 'bear_use_adx': True, 'bear_use_spike': True, 'bear_rsi_required': True, 'sideways_strategy': 'breakout', 'sideways_bb_std_mult': 2.302175550056351, 'sideways_rsi_os': 38, 'sideways_rsi_ob': 56, 'sideways_adx_thresh': 31.889050738701858, 'sideways_atr_min_pct': 0.0029196623623775546, 'sideways_atr_max_pct': 0.026272721741352326, 'sideways_tp_mult': 1.0462410048249522, 'sideways_tsl_mult': 0.5253408521872553, 'sideways_time_stop': 49, 'sideways_use_sma': False, 'sideways_use_ema': False, 'sideways_use_atr': False, 'sideways_use_adx': False, 'sideways_use_spike': False, 'sideways_rsi_required': True}.
[I 2025-08-29 20:39:18,274] Trial 535 finished with values: [-0.0019200202733611338, 0.001989489077951755] and parameters: {'p_sma': 19, 'p_std': 35, 'p_atr': 25, 'p_adx': 13, 'rsi_period': 16, 'ema1': 26, 'ema2': 12, 'slip_atr_k': 0.009596852076480561, 'slip_spread_k': 0.20840799837948895, 'spread_hl_frac': 0.034713698860965723, 'bb_std_mult': 2.6610680989506745, 'rsi_os': 10, 'rsi_ob': 84, 'vol_spike': 0.1775709440702256, 'adx_thresh': 11.209622952304759, 'atr_min_pct': 0.02569272051594587, 'atr_max_pct': 0.05350973297803862, 'tp_mult': 2.8582424239659368, 'tsl_mult': 0.6719996149653141, 'strategy': 'mean_reversion', 'time_stop': 162, 'use_sma': True, 'use_atr': False, 'use_adx': False, 'use_ema': True, 'use_spike': False, 'rsi_required': False, 'edge_k': 1.99668794759291, 'edge_cap': 0.17262450980356553, 'bull_strategy': 'breakout', 'bull_bb_std_mult': 3.0210865921575203, 'bull_rsi_os': 26, 'bull_rsi_ob': 75, 'bull_adx_thresh': 14.609658617805572, 'bull_atr_min_pct': 0.029325050036055837, 'bull_atr_max_pct': 0.013663179790486507, 'bull_tp_mult': 2.70749619039404, 'bull_tsl_mult': 0.8817640391715844, 'bull_time_stop': 30, 'bull_use_sma': True, 'bull_use_ema': False, 'bull_use_atr': True, 'bull_use_adx': True, 'bull_use_spike': True, 'bull_rsi_required': False, 'bear_strategy': 'breakout', 'bear_bb_std_mult': 2.5756421527470574, 'bear_rsi_os': 28, 'bear_rsi_ob': 70, 'bear_adx_thresh': 21.98730553916335, 'bear_atr_min_pct': 0.024138493683424182, 'bear_atr_max_pct': 0.012625026422021693, 'bear_tp_mult': 2.6673314081300576, 'bear_tsl_mult': 0.9198700242640294, 'bear_time_stop': 257, 'bear_use_sma': False, 'bear_use_ema': True, 'bear_use_atr': True, 'bear_use_adx': True, 'bear_use_spike': True, 'bear_rsi_required': False, 'sideways_strategy': 'breakout', 'sideways_bb_std_mult': 0.9238279133573413, 'sideways_rsi_os': 38, 'sideways_rsi_ob': 80, 'sideways_adx_thresh': 31.755586162389605, 'sideways_atr_min_pct': 0.003989908943365086, 'sideways_atr_max_pct': 0.016963307496685433, 'sideways_tp_mult': 1.064117490279875, 'sideways_tsl_mult': 0.9986166128728362, 'sideways_time_stop': 214, 'sideways_use_sma': False, 'sideways_use_ema': False, 'sideways_use_atr': False, 'sideways_use_adx': False, 'sideways_use_spike': True, 'sideways_rsi_required': True}.
[I 2025-08-29 20:39:18,472] Trial 534 finished with values: [-1000000000.0, 1000000000.0] and parameters: {'p_sma': 18, 'p_std': 26, 'p_atr': 19, 'p_adx': 22, 'rsi_period': 40, 'ema1': 26, 'ema2': 16, 'slip_atr_k': 0.008027953123482623, 'slip_spread_k': 0.2135842749685546, 'spread_hl_frac': 0.008550866724883515, 'bb_std_mult': 1.845619307833858, 'rsi_os': 47, 'rsi_ob': 84, 'vol_spike': 0.18002293261078786, 'adx_thresh': 13.146268726950762, 'atr_min_pct': 0.021591167630929373, 'atr_max_pct': 0.053921847355775994, 'tp_mult': 2.102691269886003, 'tsl_mult': 0.9808595058452452, 'strategy': 'mean_reversion', 'time_stop': 79, 'use_sma': True, 'use_atr': True, 'use_adx': True, 'use_ema': True, 'use_spike': False, 'rsi_required': False, 'edge_k': 1.4207886469449686, 'edge_cap': 0.642945824564853, 'bull_strategy': 'breakout', 'bull_bb_std_mult': 3.2706806691650874, 'bull_rsi_os': 22, 'bull_rsi_ob': 75, 'bull_adx_thresh': 27.71030235256308, 'bull_atr_min_pct': 0.016998939983007708, 'bull_atr_max_pct': 0.09363558302487789, 'bull_tp_mult': 2.7211983862895033, 'bull_tsl_mult': 0.8906237989216816, 'bull_time_stop': 219, 'bull_use_sma': True, 'bull_use_ema': False, 'bull_use_atr': True, 'bull_use_adx': True, 'bull_use_spike': True, 'bull_rsi_required': False, 'bear_strategy': 'breakout', 'bear_bb_std_mult': 2.561490609694471, 'bear_rsi_os': 49, 'bear_rsi_ob': 68, 'bear_adx_thresh': 19.12027686550324, 'bear_atr_min_pct': 0.012214383577561837, 'bear_atr_max_pct': 0.048892994686110726, 'bear_tp_mult': 2.721377393882037, 'bear_tsl_mult': 0.9188789087836409, 'bear_time_stop': 50, 'bear_use_sma': False, 'bear_use_ema': True, 'bear_use_atr': False, 'bear_use_adx': True, 'bear_use_spike': True, 'bear_rsi_required': False, 'sideways_strategy': 'breakout', 'sideways_bb_std_mult': 2.7178471507293738, 'sideways_rsi_os': 46, 'sideways_rsi_ob': 80, 'sideways_adx_thresh': 32.9661877124757, 'sideways_atr_min_pct': 0.0056758870755723115, 'sideways_atr_max_pct': 0.016855951965297346, 'sideways_tp_mult': 2.37658899720097, 'sideways_tsl_mult': 0.7310079864949067, 'sideways_time_stop': 186, 'sideways_use_sma': False, 'sideways_use_ema': False, 'sideways_use_atr': False, 'sideways_use_adx': False, 'sideways_use_spike': True, 'sideways_rsi_required': True}.
[I 2025-08-29 20:39:18,546] Trial 536 finished with values: [-1000000000.0, 1000000000.0] and parameters: {'p_sma': 29, 'p_std': 57, 'p_atr': 27, 'p_adx': 13, 'rsi_period': 40, 'ema1': 26, 'ema2': 51, 'slip_atr_k': 0.009197458907484156, 'slip_spread_k': 0.2229996501349642, 'spread_hl_frac': 0.04897207729378417, 'bb_std_mult': 2.04627117790384, 'rsi_os': 10, 'rsi_ob': 55, 'vol_spike': 0.14302242830192607, 'adx_thresh': 23.71271933326593, 'atr_min_pct': 0.026681190793343537, 'atr_max_pct': 0.1274965240209333, 'tp_mult': 1.396754791651027, 'tsl_mult': 0.7446008014038334, 'strategy': 'mean_reversion', 'time_stop': 207, 'use_sma': True, 'use_atr': True, 'use_adx': True, 'use_ema': True, 'use_spike': False, 'rsi_required': False, 'edge_k': 1.4717080233433106, 'edge_cap': 0.05066932951867914, 'bull_strategy': 'breakout', 'bull_bb_std_mult': 3.015836020826476, 'bull_rsi_os': 49, 'bull_rsi_ob': 60, 'bull_adx_thresh': 33.77011048291241, 'bull_atr_min_pct': 0.016009161372526108, 'bull_atr_max_pct': 0.01358935679768701, 'bull_tp_mult': 2.336201605160376, 'bull_tsl_mult': 0.8916927907034357, 'bull_time_stop': 219, 'bull_use_sma': True, 'bull_use_ema': True, 'bull_use_atr': True, 'bull_use_adx': True, 'bull_use_spike': True, 'bull_rsi_required': False, 'bear_strategy': 'breakout', 'bear_bb_std_mult': 1.989785613804269, 'bear_rsi_os': 28, 'bear_rsi_ob': 69, 'bear_adx_thresh': 19.0866407771279, 'bear_atr_min_pct': 0.012199499367183623, 'bear_atr_max_pct': 0.05263171964321055, 'bear_tp_mult': 2.654960248514564, 'bear_tsl_mult': 0.899458171769053, 'bear_time_stop': 67, 'bear_use_sma': False, 'bear_use_ema': True, 'bear_use_atr': True, 'bear_use_adx': True, 'bear_use_spike': True, 'bear_rsi_required': False, 'sideways_strategy': 'mean_reversion', 'sideways_bb_std_mult': 2.7295379109736206, 'sideways_rsi_os': 48, 'sideways_rsi_ob': 80, 'sideways_adx_thresh': 31.685340057055587, 'sideways_atr_min_pct': 0.0035168042896420912, 'sideways_atr_max_pct': 0.01661049926676374, 'sideways_tp_mult': 2.3568321937764747, 'sideways_tsl_mult': 0.31362749566489306, 'sideways_time_stop': 48, 'sideways_use_sma': False, 'sideways_use_ema': False, 'sideways_use_atr': False, 'sideways_use_adx': False, 'sideways_use_spike': True, 'sideways_rsi_required': True}.
[I 2025-08-29 20:39:48,965] Trial 537 finished with values: [-1000000000.0, 1000000000.0] and parameters: {'p_sma': 29, 'p_std': 56, 'p_atr': 24, 'p_adx': 14, 'rsi_period': 14, 'ema1': 26, 'ema2': 12, 'slip_atr_k': 0.010297132280884736, 'slip_spread_k': 0.12568338851809524, 'spread_hl_frac': 0.02807622686676722, 'bb_std_mult': 1.5727073467840307, 'rsi_os': 27, 'rsi_ob': 82, 'vol_spike': 0.1341025099094745, 'adx_thresh': 21.42569077086263, 'atr_min_pct': 0.01080260051566953, 'atr_max_pct': 0.12774821223050528, 'tp_mult': 1.4063990801205613, 'tsl_mult': 0.8549675886895036, 'strategy': 'mean_reversion', 'time_stop': 152, 'use_sma': True, 'use_atr': False, 'use_adx': False, 'use_ema': True, 'use_spike': False, 'rsi_required': False, 'edge_k': 1.0339402273949618, 'edge_cap': 0.17756553792657986, 'bull_strategy': 'breakout', 'bull_bb_std_mult': 2.5172507186972597, 'bull_rsi_os': 14, 'bull_rsi_ob': 72, 'bull_adx_thresh': 33.779606891061576, 'bull_atr_min_pct': 0.015869535710975966, 'bull_atr_max_pct': 0.08753862792329664, 'bull_tp_mult': 2.658067921430257, 'bull_tsl_mult': 0.8902786059981848, 'bull_time_stop': 195, 'bull_use_sma': True, 'bull_use_ema': True, 'bull_use_atr': True, 'bull_use_adx': True, 'bull_use_spike': True, 'bull_rsi_required': False, 'bear_strategy': 'breakout', 'bear_bb_std_mult': 2.0193602618404274, 'bear_rsi_os': 24, 'bear_rsi_ob': 66, 'bear_adx_thresh': 21.675401532187625, 'bear_atr_min_pct': 0.01217142017355205, 'bear_atr_max_pct': 0.05212918341628308, 'bear_tp_mult': 1.594119766916737, 'bear_tsl_mult': 0.8786684824081844, 'bear_time_stop': 257, 'bear_use_sma': False, 'bear_use_ema': True, 'bear_use_atr': True, 'bear_use_adx': True, 'bear_use_spike': True, 'bear_rsi_required': False, 'sideways_strategy': 'mean_reversion', 'sideways_bb_std_mult': 2.7259142630672653, 'sideways_rsi_os': 44, 'sideways_rsi_ob': 80, 'sideways_adx_thresh': 33.48212384144706, 'sideways_atr_min_pct': 0.003961008192906918, 'sideways_atr_max_pct': 0.1028941783647728, 'sideways_tp_mult': 1.969364655117262, 'sideways_tsl_mult': 0.7213923780752975, 'sideways_time_stop': 161, 'sideways_use_sma': False, 'sideways_use_ema': False, 'sideways_use_atr': False, 'sideways_use_adx': False, 'sideways_use_spike': True, 'sideways_rsi_required': True}.
[I 2025-08-29 20:39:49,270] Trial 539 finished with values: [-1000000000.0, 1000000000.0] and parameters: {'p_sma': 23, 'p_std': 47, 'p_atr': 27, 'p_adx': 14, 'rsi_period': 74, 'ema1': 25, 'ema2': 48, 'slip_atr_k': 0.24650468579969287, 'slip_spread_k': 0.3932048982110742, 'spread_hl_frac': 0.03342955352369216, 'bb_std_mult': 1.5563467953119843, 'rsi_os': 8, 'rsi_ob': 62, 'vol_spike': 0.2475366491437524, 'adx_thresh': 21.33841602994998, 'atr_min_pct': 0.02662737649412384, 'atr_max_pct': 0.06265686057579581, 'tp_mult': 1.355128379482452, 'tsl_mult': 0.8552066452410282, 'strategy': 'mean_reversion', 'time_stop': 300, 'use_sma': True, 'use_atr': False, 'use_adx': False, 'use_ema': True, 'use_spike': False, 'rsi_required': False, 'edge_k': 1.0334156548014766, 'edge_cap': 0.3791568097720033, 'bull_strategy': 'mean_reversion', 'bull_bb_std_mult': 0.5468541427016922, 'bull_rsi_os': 15, 'bull_rsi_ob': 60, 'bull_adx_thresh': 12.850893718067237, 'bull_atr_min_pct': 0.015488967152090628, 'bull_atr_max_pct': 0.14365972578731478, 'bull_tp_mult': 2.7689844748471053, 'bull_tsl_mult': 0.91539094513473, 'bull_time_stop': 38, 'bull_use_sma': True, 'bull_use_ema': True, 'bull_use_atr': True, 'bull_use_adx': False, 'bull_use_spike': True, 'bull_rsi_required': False, 'bear_strategy': 'breakout', 'bear_bb_std_mult': 2.8457370306882503, 'bear_rsi_os': 28, 'bear_rsi_ob': 90, 'bear_adx_thresh': 21.412182249574865, 'bear_atr_min_pct': 0.007551297827271759, 'bear_atr_max_pct': 0.08807326056467013, 'bear_tp_mult': 1.5460658874773043, 'bear_tsl_mult': 0.8730855464779318, 'bear_time_stop': 64, 'bear_use_sma': False, 'bear_use_ema': True, 'bear_use_atr': True, 'bear_use_adx': True, 'bear_use_spike': True, 'bear_rsi_required': False, 'sideways_strategy': 'mean_reversion', 'sideways_bb_std_mult': 2.258699098025744, 'sideways_rsi_os': 48, 'sideways_rsi_ob': 91, 'sideways_adx_thresh': 14.495865287867419, 'sideways_atr_min_pct': 1.3918806739282932e-05, 'sideways_atr_max_pct': 0.10376909041696263, 'sideways_tp_mult': 1.150177752380079, 'sideways_tsl_mult': 0.7164419675763388, 'sideways_time_stop': 169, 'sideways_use_sma': False, 'sideways_use_ema': False, 'sideways_use_atr': False, 'sideways_use_adx': False, 'sideways_use_spike': False, 'sideways_rsi_required': False}.
[I 2025-08-29 20:39:49,478] Trial 540 finished with values: [-1000000000.0, 1000000000.0] and parameters: {'p_sma': 13, 'p_std': 56, 'p_atr': 24, 'p_adx': 14, 'rsi_period': 34, 'ema1': 7, 'ema2': 48, 'slip_atr_k': 0.2048485944225262, 'slip_spread_k': 0.3906526099708867, 'spread_hl_frac': 0.012649350671541125, 'bb_std_mult': 1.5676688999039734, 'rsi_os': 8, 'rsi_ob': 82, 'vol_spike': 0.24617239202729257, 'adx_thresh': 12.343845998655338, 'atr_min_pct': 0.019502221049115438, 'atr_max_pct': 0.06705200128164154, 'tp_mult': 1.342083353816633, 'tsl_mult': 0.41466356866650406, 'strategy': 'mean_reversion', 'time_stop': 156, 'use_sma': True, 'use_atr': False, 'use_adx': False, 'use_ema': False, 'use_spike': True, 'rsi_required': False, 'edge_k': 1.0409070924863464, 'edge_cap': 0.7498793883305993, 'bull_strategy': 'mean_reversion', 'bull_bb_std_mult': 0.5084499361050636, 'bull_rsi_os': 15, 'bull_rsi_ob': 72, 'bull_adx_thresh': 15.10623118345241, 'bull_atr_min_pct': 0.015835031854000124, 'bull_atr_max_pct': 0.08506486519742427, 'bull_tp_mult': 2.6579272449528726, 'bull_tsl_mult': 0.9187372045736389, 'bull_time_stop': 252, 'bull_use_sma': True, 'bull_use_ema': True, 'bull_use_atr': True, 'bull_use_adx': False, 'bull_use_spike': True, 'bull_rsi_required': True, 'bear_strategy': 'breakout', 'bear_bb_std_mult': 0.9174155125527799, 'bear_rsi_os': 24, 'bear_rsi_ob': 84, 'bear_adx_thresh': 21.39383818288441, 'bear_atr_min_pct': 0.022046910904468857, 'bear_atr_max_pct': 0.04875493074223457, 'bear_tp_mult': 2.5469985290955424, 'bear_tsl_mult': 0.8725891884466814, 'bear_time_stop': 118, 'bear_use_sma': False, 'bear_use_ema': True, 'bear_use_atr': False, 'bear_use_adx': False, 'bear_use_spike': True, 'bear_rsi_required': False, 'sideways_strategy': 'mean_reversion', 'sideways_bb_std_mult': 2.3499231167210346, 'sideways_rsi_os': 44, 'sideways_rsi_ob': 78, 'sideways_adx_thresh': 33.73303007756175, 'sideways_atr_min_pct': 0.004956157250247036, 'sideways_atr_max_pct': 0.10216423538734458, 'sideways_tp_mult': 1.9032028894698778, 'sideways_tsl_mult': 0.711199636266048, 'sideways_time_stop': 112, 'sideways_use_sma': False, 'sideways_use_ema': False, 'sideways_use_atr': False, 'sideways_use_adx': False, 'sideways_use_spike': False, 'sideways_rsi_required': False}.
