[I 2025-08-29 20:44:55,143] Trial 583 finished with values: [-1000000000.0, 1000000000.0] and parameters: {'p_sma': 11, 'p_std': 58, 'p_atr': 25, 'p_adx': 13, 'rsi_period': 79, 'ema1': 6, 'ema2': 45, 'slip_atr_k': 0.005068692697676517, 'slip_spread_k': 0.16292884797185275, 'spread_hl_frac': 0.03939139242275355, 'bb_std_mult': 1.8410726027833806, 'rsi_os': 8, 'rsi_ob': 82, 'vol_spike': 0.18343566342722054, 'adx_thresh': 22.88490420881943, 'atr_min_pct': 0.003822367214816949, 'atr_max_pct': 0.13721667832492074, 'tp_mult': 1.3919082808203693, 'tsl_mult': 0.9128227117426824, 'strategy': 'breakout', 'time_stop': 151, 'use_sma': False, 'use_atr': False, 'use_adx': True, 'use_ema': False, 'use_spike': True, 'rsi_required': True, 'edge_k': 1.1671432246825326, 'edge_cap': 0.6282816728080756, 'bull_strategy': 'breakout', 'bull_bb_std_mult': 3.203047442693148, 'bull_rsi_os': 50, 'bull_rsi_ob': 90, 'bull_adx_thresh': 13.804539234588372, 'bull_atr_min_pct': 0.01614243456312345, 'bull_atr_max_pct': 0.05701524300652731, 'bull_tp_mult': 2.910343282797186, 'bull_tsl_mult': 0.8309364781507289, 'bull_time_stop': 241, 'bull_use_sma': False, 'bull_use_ema': True, 'bull_use_atr': True, 'bull_use_adx': True, 'bull_use_spike': False, 'bull_rsi_required': False, 'bear_strategy': 'mean_reversion', 'bear_bb_std_mult': 3.219291580454507, 'bear_rsi_os': 6, 'bear_rsi_ob': 67, 'bear_adx_thresh': 22.920121079117003, 'bear_atr_min_pct': 0.005232402070986143, 'bear_atr_max_pct': 0.044421805838475326, 'bear_tp_mult': 2.7255218900522458, 'bear_tsl_mult': 0.9291234453538743, 'bear_time_stop': 52, 'bear_use_sma': False, 'bear_use_ema': False, 'bear_use_atr': False, 'bear_use_adx': False, 'bear_use_spike': False, 'bear_rsi_required': True, 'sideways_strategy': 'mean_reversion', 'sideways_bb_std_mult': 2.211678447549544, 'sideways_rsi_os': 47, 'sideways_rsi_ob': 78, 'sideways_adx_thresh': 32.23432419581085, 'sideways_atr_min_pct': 0.008028011750404511, 'sideways_atr_max_pct': 0.09855698751235217, 'sideways_tp_mult': 1.0772804663238356, 'sideways_tsl_mult': 0.6653732357521133, 'sideways_time_stop': 195, 'sideways_use_sma': False, 'sideways_use_ema': False, 'sideways_use_atr': False, 'sideways_use_adx': True, 'sideways_use_spike': True, 'sideways_rsi_required': True}.
[I 2025-08-29 20:44:55,235] Trial 584 finished with values: [-1000000000.0, 1000000000.0] and parameters: {'p_sma': 10, 'p_std': 58, 'p_atr': 21, 'p_adx': 13, 'rsi_period': 39, 'ema1': 25, 'ema2': 35, 'slip_atr_k': 0.11698691385311766, 'slip_spread_k': 0.9970863820076239, 'spread_hl_frac': 0.025839839695883996, 'bb_std_mult': 1.5832549410669043, 'rsi_os': 48, 'rsi_ob': 84, 'vol_spike': 0.16360927831817737, 'adx_thresh': 14.850327300868884, 'atr_min_pct': 0.0040570225537621876, 'atr_max_pct': 0.02450532497838631, 'tp_mult': 1.4023635404895252, 'tsl_mult': 0.9008576803397946, 'strategy': 'breakout', 'time_stop': 152, 'use_sma': False, 'use_atr': False, 'use_adx': False, 'use_ema': True, 'use_spike': False, 'rsi_required': True, 'edge_k': 1.0038752665444661, 'edge_cap': 0.5783212679563121, 'bull_strategy': 'breakout', 'bull_bb_std_mult': 2.320672577170944, 'bull_rsi_os': 46, 'bull_rsi_ob': 90, 'bull_adx_thresh': 13.790411099865048, 'bull_atr_min_pct': 0.008945201505609103, 'bull_atr_max_pct': 0.11457302647084547, 'bull_tp_mult': 2.361522193053755, 'bull_tsl_mult': 0.8228397577824276, 'bull_time_stop': 134, 'bull_use_sma': False, 'bull_use_ema': False, 'bull_use_atr': True, 'bull_use_adx': True, 'bull_use_spike': True, 'bull_rsi_required': False, 'bear_strategy': 'breakout', 'bear_bb_std_mult': 2.761706865629434, 'bear_rsi_os': 48, 'bear_rsi_ob': 66, 'bear_adx_thresh': 20.84407338992265, 'bear_atr_min_pct': 0.026302255814617932, 'bear_atr_max_pct': 0.05607036476710546, 'bear_tp_mult': 2.7096951801858586, 'bear_tsl_mult': 0.959837386569791, 'bear_time_stop': 52, 'bear_use_sma': True, 'bear_use_ema': False, 'bear_use_atr': True, 'bear_use_adx': True, 'bear_use_spike': False, 'bear_rsi_required': False, 'sideways_strategy': 'breakout', 'sideways_bb_std_mult': 1.6469169021064842, 'sideways_rsi_os': 49, 'sideways_rsi_ob': 78, 'sideways_adx_thresh': 8.830025944277118, 'sideways_atr_min_pct': 0.005813724897899313, 'sideways_atr_max_pct': 0.09853807254295813, 'sideways_tp_mult': 2.2573244332654947, 'sideways_tsl_mult': 0.7692013521546318, 'sideways_time_stop': 195, 'sideways_use_sma': True, 'sideways_use_ema': False, 'sideways_use_atr': False, 'sideways_use_adx': True, 'sideways_use_spike': True, 'sideways_rsi_required': True}.
[I 2025-08-29 20:44:56,393] Trial 587 finished with values: [-1000000000.0, 1000000000.0] and parameters: {'p_sma': 20, 'p_std': 56, 'p_atr': 25, 'p_adx': 11, 'rsi_period': 38, 'ema1': 6, 'ema2': 35, 'slip_atr_k': 0.004518500789758117, 'slip_spread_k': 0.1647684712951424, 'spread_hl_frac': 0.02524330335324687, 'bb_std_mult': 1.5980176299254487, 'rsi_os': 7, 'rsi_ob': 84, 'vol_spike': 0.007884214331350003, 'adx_thresh': 12.63342939171299, 'atr_min_pct': 0.021037719656219, 'atr_max_pct': 0.02413775557560178, 'tp_mult': 1.4031090552874108, 'tsl_mult': 0.9152362127468088, 'strategy': 'mean_reversion', 'time_stop': 148, 'use_sma': False, 'use_atr': False, 'use_adx': False, 'use_ema': True, 'use_spike': False, 'rsi_required': True, 'edge_k': 0.9611587643423003, 'edge_cap': 0.6010407998008735, 'bull_strategy': 'breakout', 'bull_bb_std_mult': 2.7776673340040112, 'bull_rsi_os': 52, 'bull_rsi_ob': 72, 'bull_adx_thresh': 30.612429807805402, 'bull_atr_min_pct': 0.007647115297176954, 'bull_atr_max_pct': 0.05635891107056628, 'bull_tp_mult': 2.6824719250734237, 'bull_tsl_mult': 0.41102659861406654, 'bull_time_stop': 131, 'bull_use_sma': False, 'bull_use_ema': False, 'bull_use_atr': True, 'bull_use_adx': True, 'bull_use_spike': True, 'bull_rsi_required': False, 'bear_strategy': 'breakout', 'bear_bb_std_mult': 3.404533681755832, 'bear_rsi_os': 45, 'bear_rsi_ob': 89, 'bear_adx_thresh': 20.935717489038815, 'bear_atr_min_pct': 0.00991291518159455, 'bear_atr_max_pct': 0.07909528612398332, 'bear_tp_mult': 2.7044763848600057, 'bear_tsl_mult': 0.9289406943318652, 'bear_time_stop': 52, 'bear_use_sma': False, 'bear_use_ema': False, 'bear_use_atr': True, 'bear_use_adx': True, 'bear_use_spike': False, 'bear_rsi_required': False, 'sideways_strategy': 'breakout', 'sideways_bb_std_mult': 2.8038786480898947, 'sideways_rsi_os': 45, 'sideways_rsi_ob': 78, 'sideways_adx_thresh': 31.73512486418748, 'sideways_atr_min_pct': 0.011922450467539135, 'sideways_atr_max_pct': 0.025328610188402847, 'sideways_tp_mult': 1.571217390532933, 'sideways_tsl_mult': 0.7573479751339744, 'sideways_time_stop': 300, 'sideways_use_sma': False, 'sideways_use_ema': False, 'sideways_use_atr': False, 'sideways_use_adx': False, 'sideways_use_spike': True, 'sideways_rsi_required': False}.
[I 2025-08-29 20:45:25,726] Trial 590 finished with values: [-1000000000.0, 1000000000.0] and parameters: {'p_sma': 5, 'p_std': 56, 'p_atr': 24, 'p_adx': 27, 'rsi_period': 38, 'ema1': 27, 'ema2': 47, 'slip_atr_k': 0.20081385033496413, 'slip_spread_k': 0.12481360764695851, 'spread_hl_frac': 0.04832576180789114, 'bb_std_mult': 3.160180412708502, 'rsi_os': 9, 'rsi_ob': 93, 'vol_spike': 0.07723466853993075, 'adx_thresh': 18.9278564062432, 'atr_min_pct': 0.021015911248785737, 'atr_max_pct': 0.02993258451921163, 'tp_mult': 1.5175553022169161, 'tsl_mult': 0.7317406022387177, 'strategy': 'mean_reversion', 'time_stop': 162, 'use_sma': True, 'use_atr': False, 'use_adx': False, 'use_ema': True, 'use_spike': False, 'rsi_required': False, 'edge_k': 1.0591743375921212, 'edge_cap': 0.601547808915319, 'bull_strategy': 'mean_reversion', 'bull_bb_std_mult': 1.869420893637351, 'bull_rsi_os': 48, 'bull_rsi_ob': 72, 'bull_adx_thresh': 12.138509008223801, 'bull_atr_min_pct': 0.01821690288938151, 'bull_atr_max_pct': 0.05063167501729043, 'bull_tp_mult': 2.678657449566424, 'bull_tsl_mult': 0.8950288867060654, 'bull_time_stop': 195, 'bull_use_sma': True, 'bull_use_ema': False, 'bull_use_atr': True, 'bull_use_adx': False, 'bull_use_spike': True, 'bull_rsi_required': False, 'bear_strategy': 'breakout', 'bear_bb_std_mult': 2.544948973164762, 'bear_rsi_os': 29, 'bear_rsi_ob': 70, 'bear_adx_thresh': 28.073629193574842, 'bear_atr_min_pct': 0.0063263738848823485, 'bear_atr_max_pct': 0.08964389950412427, 'bear_tp_mult': 2.570415509431441, 'bear_tsl_mult': 0.9158898822888166, 'bear_time_stop': 39, 'bear_use_sma': False, 'bear_use_ema': True, 'bear_use_atr': False, 'bear_use_adx': True, 'bear_use_spike': True, 'bear_rsi_required': False, 'sideways_strategy': 'breakout', 'sideways_bb_std_mult': 1.465793896053812, 'sideways_rsi_os': 45, 'sideways_rsi_ob': 89, 'sideways_adx_thresh': 13.166382479142692, 'sideways_atr_min_pct': 0.018542013702175363, 'sideways_atr_max_pct': 0.024781664685598608, 'sideways_tp_mult': 1.1784878314991754, 'sideways_tsl_mult': 0.2603408283436285, 'sideways_time_stop': 176, 'sideways_use_sma': False, 'sideways_use_ema': False, 'sideways_use_atr': False, 'sideways_use_adx': False, 'sideways_use_spike': False, 'sideways_rsi_required': False}.
[I 2025-08-29 20:45:25,916] Trial 589 finished with values: [-0.001562238950904793, 0.003266113901213586] and parameters: {'p_sma': 44, 'p_std': 27, 'p_atr': 24, 'p_adx': 14, 'rsi_period': 38, 'ema1': 27, 'ema2': 47, 'slip_atr_k': 0.0005071660577122624, 'slip_spread_k': 0.1259068646022008, 'spread_hl_frac': 0.030519454909766396, 'bb_std_mult': 3.13320740269326, 'rsi_os': 43, 'rsi_ob': 84, 'vol_spike': 0.014394911073116967, 'adx_thresh': 25.64099458698089, 'atr_min_pct': 0.006621126318727669, 'atr_max_pct': 0.03039372977690953, 'tp_mult': 1.5128757005462412, 'tsl_mult': 0.8209011209918092, 'strategy': 'mean_reversion', 'time_stop': 164, 'use_sma': True, 'use_atr': False, 'use_adx': False, 'use_ema': True, 'use_spike': False, 'rsi_required': False, 'edge_k': 0.4306898501681907, 'edge_cap': 0.5996600091613512, 'bull_strategy': 'mean_reversion', 'bull_bb_std_mult': 2.9753709525430017, 'bull_rsi_os': 14, 'bull_rsi_ob': 82, 'bull_adx_thresh': 6.240884233711839, 'bull_atr_min_pct': 0.00850104021566727, 'bull_atr_max_pct': 0.09570788420179749, 'bull_tp_mult': 2.695174155997961, 'bull_tsl_mult': 0.9601248411399084, 'bull_time_stop': 36, 'bull_use_sma': True, 'bull_use_ema': False, 'bull_use_atr': True, 'bull_use_adx': False, 'bull_use_spike': True, 'bull_rsi_required': False, 'bear_strategy': 'breakout', 'bear_bb_std_mult': 2.576777844176868, 'bear_rsi_os': 50, 'bear_rsi_ob': 71, 'bear_adx_thresh': 20.887469304860176, 'bear_atr_min_pct': 0.005991273070857424, 'bear_atr_max_pct': 0.05013895709337957, 'bear_tp_mult': 1.1781242783316843, 'bear_tsl_mult': 0.9096467346042919, 'bear_time_stop': 289, 'bear_use_sma': False, 'bear_use_ema': True, 'bear_use_atr': False, 'bear_use_adx': True, 'bear_use_spike': True, 'bear_rsi_required': False, 'sideways_strategy': 'breakout', 'sideways_bb_std_mult': 2.7977669864524093, 'sideways_rsi_os': 45, 'sideways_rsi_ob': 58, 'sideways_adx_thresh': 34.98227731084802, 'sideways_atr_min_pct': 0.005732061002213523, 'sideways_atr_max_pct': 0.08730396483808339, 'sideways_tp_mult': 2.265666270424659, 'sideways_tsl_mult': 0.2449312245807913, 'sideways_time_stop': 177, 'sideways_use_sma': False, 'sideways_use_ema': False, 'sideways_use_atr': False, 'sideways_use_adx': False, 'sideways_use_spike': False, 'sideways_rsi_required': False}.
[I 2025-08-29 20:45:26,110] Trial 588 finished with values: [-0.0036234326503894465, 0.003753570825537074] and parameters: {'p_sma': 44, 'p_std': 27, 'p_atr': 19, 'p_adx': 11, 'rsi_period': 38, 'ema1': 14, 'ema2': 28, 'slip_atr_k': 0.00011047412065868774, 'slip_spread_k': 0.22104039558791472, 'spread_hl_frac': 0.04998552362995999, 'bb_std_mult': 1.6942973743052527, 'rsi_os': 33, 'rsi_ob': 59, 'vol_spike': 0.1970989649607936, 'adx_thresh': 14.752109219255168, 'atr_min_pct': 0.020876109885677847, 'atr_max_pct': 0.024212564776584743, 'tp_mult': 1.0733052335732192, 'tsl_mult': 0.9965222389793644, 'strategy': 'mean_reversion', 'time_stop': 167, 'use_sma': True, 'use_atr': False, 'use_adx': False, 'use_ema': True, 'use_spike': False, 'rsi_required': False, 'edge_k': 0.9660621296563359, 'edge_cap': 0.5947385603064871, 'bull_strategy': 'mean_reversion', 'bull_bb_std_mult': 1.858851989737993, 'bull_rsi_os': 8, 'bull_rsi_ob': 71, 'bull_adx_thresh': 12.237492906055158, 'bull_atr_min_pct': 0.018204622498946957, 'bull_atr_max_pct': 0.05020937715356796, 'bull_tp_mult': 2.6973538616670716, 'bull_tsl_mult': 0.9239913370410557, 'bull_time_stop': 36, 'bull_use_sma': True, 'bull_use_ema': False, 'bull_use_atr': True, 'bull_use_adx': False, 'bull_use_spike': True, 'bull_rsi_required': False, 'bear_strategy': 'breakout', 'bear_bb_std_mult': 2.595265960229404, 'bear_rsi_os': 50, 'bear_rsi_ob': 57, 'bear_adx_thresh': 32.53504181300259, 'bear_atr_min_pct': 0.006353271602452402, 'bear_atr_max_pct': 0.02306760397069916, 'bear_tp_mult': 2.0122148554489647, 'bear_tsl_mult': 0.8299261637116722, 'bear_time_stop': 38, 'bear_use_sma': False, 'bear_use_ema': True, 'bear_use_atr': False, 'bear_use_adx': True, 'bear_use_spike': True, 'bear_rsi_required': False, 'sideways_strategy': 'breakout', 'sideways_bb_std_mult': 2.484326311250651, 'sideways_rsi_os': 10, 'sideways_rsi_ob': 80, 'sideways_adx_thresh': 30.739982849067204, 'sideways_atr_min_pct': 0.005839712102980435, 'sideways_atr_max_pct': 0.08656484874362058, 'sideways_tp_mult': 2.4041367108649663, 'sideways_tsl_mult': 0.2408540915176668, 'sideways_time_stop': 5, 'sideways_use_sma': False, 'sideways_use_ema': False, 'sideways_use_atr': False, 'sideways_use_adx': False, 'sideways_use_spike': False, 'sideways_rsi_required': False}.
[I 2025-08-29 20:45:26,308] Trial 591 finished with values: [-1000000000.0, 1000000000.0] and parameters: {'p_sma': 14, 'p_std': 55, 'p_atr': 27, 'p_adx': 14, 'rsi_period': 37, 'ema1': 27, 'ema2': 15, 'slip_atr_k': 0.009587525738495256, 'slip_spread_k': 0.6852566748852189, 'spread_hl_frac': 0.01641339981053199, 'bb_std_mult': 3.099810269102229, 'rsi_os': 35, 'rsi_ob': 71, 'vol_spike': 0.1964187344064187, 'adx_thresh': 13.431170674284942, 'atr_min_pct': 0.020241409057450515, 'atr_max_pct': 0.02951500636396127, 'tp_mult': 1.3463555361002413, 'tsl_mult': 0.4301770058629579, 'strategy': 'mean_reversion', 'time_stop': 190, 'use_sma': True, 'use_atr': False, 'use_adx': False, 'use_ema': True, 'use_spike': False, 'rsi_required': False, 'edge_k': 1.0681102773755389, 'edge_cap': 0.6007548771228578, 'bull_strategy': 'mean_reversion', 'bull_bb_std_mult': 2.98002551369657, 'bull_rsi_os': 22, 'bull_rsi_ob': 57, 'bull_adx_thresh': 12.220140393720405, 'bull_atr_min_pct': 0.018471083747406643, 'bull_atr_max_pct': 0.09511431006151454, 'bull_tp_mult': 1.8613005290396334, 'bull_tsl_mult': 0.9002337472323276, 'bull_time_stop': 198, 'bull_use_sma': True, 'bull_use_ema': False, 'bull_use_atr': True, 'bull_use_adx': False, 'bull_use_spike': True, 'bull_rsi_required': False, 'bear_strategy': 'breakout', 'bear_bb_std_mult': 2.5700472800882177, 'bear_rsi_os': 35, 'bear_rsi_ob': 61, 'bear_adx_thresh': 32.65502598252477, 'bear_atr_min_pct': 0.006487919351400133, 'bear_atr_max_pct': 0.08977601963526241, 'bear_tp_mult': 2.5873462486754297, 'bear_tsl_mult': 0.8446412274633093, 'bear_time_stop': 40, 'bear_use_sma': False, 'bear_use_ema': True, 'bear_use_atr': False, 'bear_use_adx': True, 'bear_use_spike': True, 'bear_rsi_required': False, 'sideways_strategy': 'breakout', 'sideways_bb_std_mult': 2.382911978255192, 'sideways_rsi_os': 44, 'sideways_rsi_ob': 64, 'sideways_adx_thresh': 30.703620550280803, 'sideways_atr_min_pct': 0.014338661848345792, 'sideways_atr_max_pct': 0.11140912037154813, 'sideways_tp_mult': 2.4172036298011212, 'sideways_tsl_mult': 0.7104071529574307, 'sideways_time_stop': 175, 'sideways_use_sma': False, 'sideways_use_ema': False, 'sideways_use_atr': False, 'sideways_use_adx': False, 'sideways_use_spike': False, 'sideways_rsi_required': False}.
[I 2025-08-29 20:45:26,986] Trial 593 finished with values: [-1000000000.0, 1000000000.0] and parameters: {'p_sma': 18, 'p_std': 55, 'p_atr': 19, 'p_adx': 14, 'rsi_period': 35, 'ema1': 14, 'ema2': 43, 'slip_atr_k': 0.011796729204657025, 'slip_spread_k': 0.6823893731284132, 'spread_hl_frac': 0.02169852926627513, 'bb_std_mult': 2.0860161406647872, 'rsi_os': 35, 'rsi_ob': 95, 'vol_spike': 0.12349212829438795, 'adx_thresh': 13.559801211326539, 'atr_min_pct': 0.021808236392667022, 'atr_max_pct': 0.01265739407919711, 'tp_mult': 1.592431312172869, 'tsl_mult': 0.46830967187424605, 'strategy': 'mean_reversion', 'time_stop': 167, 'use_sma': True, 'use_atr': True, 'use_adx': False, 'use_ema': True, 'use_spike': False, 'rsi_required': False, 'edge_k': 1.1457511651883698, 'edge_cap': 0.5544138153359178, 'bull_strategy': 'mean_reversion', 'bull_bb_std_mult': 3.0592528443932547, 'bull_rsi_os': 7, 'bull_rsi_ob': 74, 'bull_adx_thresh': 24.307722215582007, 'bull_atr_min_pct': 0.016879464415407115, 'bull_atr_max_pct': 0.09294946539322012, 'bull_tp_mult': 1.895226697954338, 'bull_tsl_mult': 0.9218642466797551, 'bull_time_stop': 15, 'bull_use_sma': True, 'bull_use_ema': False, 'bull_use_atr': False, 'bull_use_adx': False, 'bull_use_spike': True, 'bull_rsi_required': True, 'bear_strategy': 'breakout', 'bear_bb_std_mult': 2.87879910511271, 'bear_rsi_os': 31, 'bear_rsi_ob': 74, 'bear_adx_thresh': 22.1888317924142, 'bear_atr_min_pct': 0.006569564333568954, 'bear_atr_max_pct': 0.038208108049396276, 'bear_tp_mult': 2.1626241851695176, 'bear_tsl_mult': 0.9819251958738464, 'bear_time_stop': 127, 'bear_use_sma': False, 'bear_use_ema': True, 'bear_use_atr': False, 'bear_use_adx': True, 'bear_use_spike': True, 'bear_rsi_required': False, 'sideways_strategy': 'breakout', 'sideways_bb_std_mult': 2.4696848665259856, 'sideways_rsi_os': 39, 'sideways_rsi_ob': 64, 'sideways_adx_thresh': 7.366187322530653, 'sideways_atr_min_pct': 0.02175099833073271, 'sideways_atr_max_pct': 0.02691236893082717, 'sideways_tp_mult': 2.0002444824691006, 'sideways_tsl_mult': 0.710280831725881, 'sideways_time_stop': 188, 'sideways_use_sma': False, 'sideways_use_ema': False, 'sideways_use_atr': True, 'sideways_use_adx': False, 'sideways_use_spike': False, 'sideways_rsi_required': False}.
[I 2025-08-29 20:45:27,689] Trial 596 finished with values: [-1000000000.0, 1000000000.0] and parameters: {'p_sma': 21, 'p_std': 8, 'p_atr': 26, 'p_adx': 15, 'rsi_period': 50, 'ema1': 26, 'ema2': 21, 'slip_atr_k': 0.09783189334099464, 'slip_spread_k': 0.2089778389021142, 'spread_hl_frac': 0.04999868864006215, 'bb_std_mult': 1.762766369657678, 'rsi_os': 52, 'rsi_ob': 83, 'vol_spike': 0.18842771761486815, 'adx_thresh': 34.95107045506182, 'atr_min_pct': 0.01939204994212909, 'atr_max_pct': 0.033799614824284174, 'tp_mult': 2.523228184051536, 'tsl_mult': 0.8657067855378742, 'strategy': 'mean_reversion', 'time_stop': 118, 'use_sma': True, 'use_atr': True, 'use_adx': False, 'use_ema': False, 'use_spike': False, 'rsi_required': False, 'edge_k': 0.1983537953002027, 'edge_cap': 0.5788084340226234, 'bull_strategy': 'mean_reversion', 'bull_bb_std_mult': 3.145725015560764, 'bull_rsi_os': 10, 'bull_rsi_ob': 76, 'bull_adx_thresh': 13.433199528502259, 'bull_atr_min_pct': 0.02026626814622013, 'bull_atr_max_pct': 0.0983215981099919, 'bull_tp_mult': 2.6218289591643567, 'bull_tsl_mult': 0.6392241668124946, 'bull_time_stop': 27, 'bull_use_sma': True, 'bull_use_ema': False, 'bull_use_atr': True, 'bull_use_adx': False, 'bull_use_spike': True, 'bull_rsi_required': True, 'bear_strategy': 'breakout', 'bear_bb_std_mult': 0.5819096602273421, 'bear_rsi_os': 25, 'bear_rsi_ob': 59, 'bear_adx_thresh': 20.24610224264443, 'bear_atr_min_pct': 0.0156928180696341, 'bear_atr_max_pct': 0.051847430311120754, 'bear_tp_mult': 2.6524108790039462, 'bear_tsl_mult': 0.09128627250792581, 'bear_time_stop': 230, 'bear_use_sma': True, 'bear_use_ema': True, 'bear_use_atr': False, 'bear_use_adx': False, 'bear_use_spike': True, 'bear_rsi_required': True, 'sideways_strategy': 'mean_reversion', 'sideways_bb_std_mult': 2.363751217548904, 'sideways_rsi_os': 23, 'sideways_rsi_ob': 75, 'sideways_adx_thresh': 33.203333971665174, 'sideways_atr_min_pct': 0.004388461836061704, 'sideways_atr_max_pct': 0.03096236297359587, 'sideways_tp_mult': 1.0700014624720915, 'sideways_tsl_mult': 0.7377293190638538, 'sideways_time_stop': 205, 'sideways_use_sma': True, 'sideways_use_ema': False, 'sideways_use_atr': False, 'sideways_use_adx': False, 'sideways_use_spike': False, 'sideways_rsi_required': False}.
