[I 2025-08-29 21:00:51,696] Trial 728 finished with values: [-1000000000.0, 1000000000.0] and parameters: {'p_sma': 22, 'p_std': 57, 'p_atr': 25, 'p_adx': 15, 'rsi_period': 50, 'ema1': 29, 'ema2': 48, 'slip_atr_k': 0.008246215694508821, 'slip_spread_k': 0.19219628587005033, 'spread_hl_frac': 0.04930860754309397, 'bb_std_mult': 3.249006534804681, 'rsi_os': 7, 'rsi_ob': 85, 'vol_spike': 0.038062706085422726, 'adx_thresh': 13.83948218290672, 'atr_min_pct': 0.006040139065284056, 'atr_max_pct': 0.025760356268365238, 'tp_mult': 1.452796434072152, 'tsl_mult': 0.8820821150506606, 'strategy': 'breakout', 'time_stop': 185, 'use_sma': True, 'use_atr': True, 'use_adx': True, 'use_ema': True, 'use_spike': False, 'rsi_required': False, 'edge_k': 1.045176091415967, 'edge_cap': 0.84309351311002, 'bull_strategy': 'mean_reversion', 'bull_bb_std_mult': 2.964734244911072, 'bull_rsi_os': 23, 'bull_rsi_ob': 74, 'bull_adx_thresh': 13.958824506037297, 'bull_atr_min_pct': 0.00704067672036421, 'bull_atr_max_pct': 0.09435058704441486, 'bull_tp_mult': 2.8372775241510193, 'bull_tsl_mult': 0.6336501639731577, 'bull_time_stop': 47, 'bull_use_sma': True, 'bull_use_ema': True, 'bull_use_atr': True, 'bull_use_adx': False, 'bull_use_spike': False, 'bull_rsi_required': True, 'bear_strategy': 'mean_reversion', 'bear_bb_std_mult': 3.2578356239446276, 'bear_rsi_os': 28, 'bear_rsi_ob': 89, 'bear_adx_thresh': 18.367620358623096, 'bear_atr_min_pct': 0.007658997185435504, 'bear_atr_max_pct': 0.06604655131479459, 'bear_tp_mult': 2.780453945690297, 'bear_tsl_mult': 0.32182634579111247, 'bear_time_stop': 57, 'bear_use_sma': True, 'bear_use_ema': True, 'bear_use_atr': False, 'bear_use_adx': True, 'bear_use_spike': True, 'bear_rsi_required': True, 'sideways_strategy': 'mean_reversion', 'sideways_bb_std_mult': 2.289203142906649, 'sideways_rsi_os': 40, 'sideways_rsi_ob': 88, 'sideways_adx_thresh': 33.98088259950122, 'sideways_atr_min_pct': 0.004047574375331265, 'sideways_atr_max_pct': 0.021163509319922866, 'sideways_tp_mult': 1.0674968999022503, 'sideways_tsl_mult': 0.5029011674233365, 'sideways_time_stop': 200, 'sideways_use_sma': True, 'sideways_use_ema': False, 'sideways_use_atr': False, 'sideways_use_adx': False, 'sideways_use_spike': False, 'sideways_rsi_required': False}.
[I 2025-08-29 21:00:51,962] Trial 730 finished with values: [-1000000000.0, 1000000000.0] and parameters: {'p_sma': 22, 'p_std': 9, 'p_atr': 25, 'p_adx': 10, 'rsi_period': 37, 'ema1': 27, 'ema2': 59, 'slip_atr_k': 0.0877777151032169, 'slip_spread_k': 0.7880577181074158, 'spread_hl_frac': 0.04998803876770185, 'bb_std_mult': 1.7855640444963874, 'rsi_os': 7, 'rsi_ob': 84, 'vol_spike': 0.28392901244505725, 'adx_thresh': 12.489568567593919, 'atr_min_pct': 0.019634020173969292, 'atr_max_pct': 0.07869389567759748, 'tp_mult': 2.6336132912610823, 'tsl_mult': 0.7610338352190277, 'strategy': 'mean_reversion', 'time_stop': 183, 'use_sma': True, 'use_atr': False, 'use_adx': False, 'use_ema': True, 'use_spike': True, 'rsi_required': False, 'edge_k': 1.0475770724908113, 'edge_cap': 0.8562234312371662, 'bull_strategy': 'mean_reversion', 'bull_bb_std_mult': 2.0215533075242313, 'bull_rsi_os': 16, 'bull_rsi_ob': 79, 'bull_adx_thresh': 13.925638089656003, 'bull_atr_min_pct': 0.016468208109815672, 'bull_atr_max_pct': 0.11644091620900975, 'bull_tp_mult': 2.58724629899323, 'bull_tsl_mult': 0.892574622659474, 'bull_time_stop': 121, 'bull_use_sma': True, 'bull_use_ema': False, 'bull_use_atr': False, 'bull_use_adx': True, 'bull_use_spike': False, 'bull_rsi_required': False, 'bear_strategy': 'mean_reversion', 'bear_bb_std_mult': 2.716249916310073, 'bear_rsi_os': 40, 'bear_rsi_ob': 66, 'bear_adx_thresh': 19.910574909034914, 'bear_atr_min_pct': 0.007570636135739942, 'bear_atr_max_pct': 0.10097893714934857, 'bear_tp_mult': 1.9265854968762912, 'bear_tsl_mult': 0.9992860002188846, 'bear_time_stop': 184, 'bear_use_sma': False, 'bear_use_ema': False, 'bear_use_atr': False, 'bear_use_adx': True, 'bear_use_spike': True, 'bear_rsi_required': True, 'sideways_strategy': 'breakout', 'sideways_bb_std_mult': 2.290312300412907, 'sideways_rsi_os': 20, 'sideways_rsi_ob': 75, 'sideways_adx_thresh': 6.181387143258785, 'sideways_atr_min_pct': 0.0022275279886437363, 'sideways_atr_max_pct': 0.027676717789561642, 'sideways_tp_mult': 2.644962581822565, 'sideways_tsl_mult': 0.7509464028211769, 'sideways_time_stop': 187, 'sideways_use_sma': True, 'sideways_use_ema': False, 'sideways_use_atr': False, 'sideways_use_adx': False, 'sideways_use_spike': False, 'sideways_rsi_required': True}.
[I 2025-08-29 21:00:52,060] Trial 731 finished with values: [-0.004170199020320231, 0.004225775321092746] and parameters: {'p_sma': 22, 'p_std': 55, 'p_atr': 17, 'p_adx': 11, 'rsi_period': 7, 'ema1': 27, 'ema2': 60, 'slip_atr_k': 0.005090452782282906, 'slip_spread_k': 0.7800752047124411, 'spread_hl_frac': 0.04998937488852657, 'bb_std_mult': 2.3944970186193055, 'rsi_os': 15, 'rsi_ob': 74, 'vol_spike': 0.1721750877793695, 'adx_thresh': 12.631612070580939, 'atr_min_pct': 0.0007515601322921478, 'atr_max_pct': 0.09019137479315191, 'tp_mult': 1.5022714588370076, 'tsl_mult': 0.8793703774275954, 'strategy': 'mean_reversion', 'time_stop': 215, 'use_sma': True, 'use_atr': False, 'use_adx': False, 'use_ema': True, 'use_spike': True, 'rsi_required': False, 'edge_k': 1.6977116764754436, 'edge_cap': 0.28955960683149073, 'bull_strategy': 'mean_reversion', 'bull_bb_std_mult': 3.0341994041409626, 'bull_rsi_os': 23, 'bull_rsi_ob': 71, 'bull_adx_thresh': 33.386027884499036, 'bull_atr_min_pct': 0.016207328951833817, 'bull_atr_max_pct': 0.11548780541154126, 'bull_tp_mult': 2.670154112685365, 'bull_tsl_mult': 0.6385880931566418, 'bull_time_stop': 122, 'bull_use_sma': True, 'bull_use_ema': False, 'bull_use_atr': False, 'bull_use_adx': True, 'bull_use_spike': False, 'bull_rsi_required': False, 'bear_strategy': 'mean_reversion', 'bear_bb_std_mult': 2.8898022460561332, 'bear_rsi_os': 36, 'bear_rsi_ob': 87, 'bear_adx_thresh': 20.16162271720834, 'bear_atr_min_pct': 0.02998544264642607, 'bear_atr_max_pct': 0.07206580405344075, 'bear_tp_mult': 2.730659878326132, 'bear_tsl_mult': 0.9007391854712503, 'bear_time_stop': 186, 'bear_use_sma': False, 'bear_use_ema': False, 'bear_use_atr': False, 'bear_use_adx': True, 'bear_use_spike': True, 'bear_rsi_required': True, 'sideways_strategy': 'breakout', 'sideways_bb_std_mult': 2.2714062978845155, 'sideways_rsi_os': 51, 'sideways_rsi_ob': 81, 'sideways_adx_thresh': 6.111668386099332, 'sideways_atr_min_pct': 0.004102168745698021, 'sideways_atr_max_pct': 0.012309609938423328, 'sideways_tp_mult': 1.911299750650093, 'sideways_tsl_mult': 0.7479965981376745, 'sideways_time_stop': 186, 'sideways_use_sma': True, 'sideways_use_ema': False, 'sideways_use_atr': False, 'sideways_use_adx': False, 'sideways_use_spike': False, 'sideways_rsi_required': True}.
[I 2025-08-29 21:01:20,525] Trial 733 finished with values: [0.002357361143055181, 0.0008415687290381185] and parameters: {'p_sma': 19, 'p_std': 30, 'p_atr': 17, 'p_adx': 7, 'rsi_period': 37, 'ema1': 23, 'ema2': 23, 'slip_atr_k': 4.143785705867757e-05, 'slip_spread_k': 0.15624997562922505, 'spread_hl_frac': 0.019160237819908336, 'bb_std_mult': 1.0272527170903958, 'rsi_os': 6, 'rsi_ob': 82, 'vol_spike': 0.2860255384781314, 'adx_thresh': 11.325073356417693, 'atr_min_pct': 0.009681111940000257, 'atr_max_pct': 0.0302313456929841, 'tp_mult': 2.5755683005727876, 'tsl_mult': 0.8523180120789647, 'strategy': 'mean_reversion', 'time_stop': 214, 'use_sma': True, 'use_atr': False, 'use_adx': False, 'use_ema': False, 'use_spike': True, 'rsi_required': False, 'edge_k': 1.0400822674273005, 'edge_cap': 0.28909744994202147, 'bull_strategy': 'mean_reversion', 'bull_bb_std_mult': 2.552317868416731, 'bull_rsi_os': 20, 'bull_rsi_ob': 71, 'bull_adx_thresh': 29.584214863566686, 'bull_atr_min_pct': 0.016260103171356875, 'bull_atr_max_pct': 0.09452990671086264, 'bull_tp_mult': 2.6198819704529503, 'bull_tsl_mult': 0.8858272013259636, 'bull_time_stop': 199, 'bull_use_sma': True, 'bull_use_ema': False, 'bull_use_atr': False, 'bull_use_adx': True, 'bull_use_spike': True, 'bull_rsi_required': False, 'bear_strategy': 'breakout', 'bear_bb_std_mult': 2.167874291934753, 'bear_rsi_os': 39, 'bear_rsi_ob': 87, 'bear_adx_thresh': 21.144246012357428, 'bear_atr_min_pct': 0.0062376858437120705, 'bear_atr_max_pct': 0.06144722023043941, 'bear_tp_mult': 2.724850469671527, 'bear_tsl_mult': 0.08076508214744571, 'bear_time_stop': 277, 'bear_use_sma': False, 'bear_use_ema': False, 'bear_use_atr': False, 'bear_use_adx': False, 'bear_use_spike': True, 'bear_rsi_required': False, 'sideways_strategy': 'breakout', 'sideways_bb_std_mult': 3.590486014889319, 'sideways_rsi_os': 24, 'sideways_rsi_ob': 81, 'sideways_adx_thresh': 14.637217610914941, 'sideways_atr_min_pct': 0.014085731209190723, 'sideways_atr_max_pct': 0.026925833840822196, 'sideways_tp_mult': 2.4470410763996657, 'sideways_tsl_mult': 0.6643983905373321, 'sideways_time_stop': 133, 'sideways_use_sma': False, 'sideways_use_ema': False, 'sideways_use_atr': True, 'sideways_use_adx': False, 'sideways_use_spike': False, 'sideways_rsi_required': True}.
[I 2025-08-29 21:01:20,742] Trial 732 finished with values: [-1000000000.0, 1000000000.0] and parameters: {'p_sma': 19, 'p_std': 55, 'p_atr': 25, 'p_adx': 11, 'rsi_period': 34, 'ema1': 29, 'ema2': 42, 'slip_atr_k': 0.1206549119914771, 'slip_spread_k': 0.9067560616203914, 'spread_hl_frac': 0.04998192865320917, 'bb_std_mult': 3.2332807864401767, 'rsi_os': 7, 'rsi_ob': 84, 'vol_spike': 0.19538931060292145, 'adx_thresh': 11.271991159461738, 'atr_min_pct': 0.009543073443761813, 'atr_max_pct': 0.08257858869094563, 'tp_mult': 1.529682830091604, 'tsl_mult': 0.8792060432344495, 'strategy': 'mean_reversion', 'time_stop': 16, 'use_sma': True, 'use_atr': False, 'use_adx': False, 'use_ema': False, 'use_spike': True, 'rsi_required': False, 'edge_k': 1.0505884289467338, 'edge_cap': 0.6337415645986664, 'bull_strategy': 'mean_reversion', 'bull_bb_std_mult': 2.9688944510605237, 'bull_rsi_os': 23, 'bull_rsi_ob': 71, 'bull_adx_thresh': 28.37658811617458, 'bull_atr_min_pct': 0.016150198454716096, 'bull_atr_max_pct': 0.11589294974355405, 'bull_tp_mult': 2.8323311183592628, 'bull_tsl_mult': 0.8863039090577534, 'bull_time_stop': 266, 'bull_use_sma': True, 'bull_use_ema': False, 'bull_use_atr': True, 'bull_use_adx': True, 'bull_use_spike': False, 'bull_rsi_required': False, 'bear_strategy': 'mean_reversion', 'bear_bb_std_mult': 2.6425183403093273, 'bear_rsi_os': 5, 'bear_rsi_ob': 87, 'bear_adx_thresh': 20.061923440485792, 'bear_atr_min_pct': 0.005939135233332826, 'bear_atr_max_pct': 0.1009166404943713, 'bear_tp_mult': 2.7845347250890073, 'bear_tsl_mult': 0.3240484344764526, 'bear_time_stop': 290, 'bear_use_sma': False, 'bear_use_ema': False, 'bear_use_atr': False, 'bear_use_adx': False, 'bear_use_spike': True, 'bear_rsi_required': True, 'sideways_strategy': 'breakout', 'sideways_bb_std_mult': 2.5480703304867776, 'sideways_rsi_os': 11, 'sideways_rsi_ob': 81, 'sideways_adx_thresh': 32.14933239432334, 'sideways_atr_min_pct': 0.0038867916936958396, 'sideways_atr_max_pct': 0.028327236677261287, 'sideways_tp_mult': 1.180730018440923, 'sideways_tsl_mult': 0.5042766958664096, 'sideways_time_stop': 187, 'sideways_use_sma': True, 'sideways_use_ema': False, 'sideways_use_atr': False, 'sideways_use_adx': False, 'sideways_use_spike': False, 'sideways_rsi_required': False}.
[I 2025-08-29 21:01:21,213] Trial 735 finished with values: [-1000000000.0, 1000000000.0] and parameters: {'p_sma': 19, 'p_std': 56, 'p_atr': 15, 'p_adx': 19, 'rsi_period': 34, 'ema1': 25, 'ema2': 43, 'slip_atr_k': 0.00011456909988799319, 'slip_spread_k': 0.7303802492344782, 'spread_hl_frac': 0.04761498816325636, 'bb_std_mult': 1.6719410605533565, 'rsi_os': 38, 'rsi_ob': 82, 'vol_spike': 0.19492346545478448, 'adx_thresh': 21.36962187435503, 'atr_min_pct': 0.019331330386004795, 'atr_max_pct': 0.029954070417906434, 'tp_mult': 2.564847989607487, 'tsl_mult': 0.8494158017996141, 'strategy': 'mean_reversion', 'time_stop': 142, 'use_sma': False, 'use_atr': False, 'use_adx': False, 'use_ema': False, 'use_spike': False, 'rsi_required': True, 'edge_k': 1.1037122473664238, 'edge_cap': 0.25609758070881034, 'bull_strategy': 'breakout', 'bull_bb_std_mult': 2.0877243707657964, 'bull_rsi_os': 26, 'bull_rsi_ob': 71, 'bull_adx_thresh': 24.87853791983924, 'bull_atr_min_pct': 0.015497530379921624, 'bull_atr_max_pct': 0.1371369942501823, 'bull_tp_mult': 2.6953527357557743, 'bull_tsl_mult': 0.921695534794907, 'bull_time_stop': 268, 'bull_use_sma': False, 'bull_use_ema': False, 'bull_use_atr': True, 'bull_use_adx': False, 'bull_use_spike': True, 'bull_rsi_required': False, 'bear_strategy': 'breakout', 'bear_bb_std_mult': 2.63885573201374, 'bear_rsi_os': 31, 'bear_rsi_ob': 67, 'bear_adx_thresh': 20.967342992887627, 'bear_atr_min_pct': 0.022143214537088517, 'bear_atr_max_pct': 0.061353329006487614, 'bear_tp_mult': 2.717359211240188, 'bear_tsl_mult': 0.9054316577840795, 'bear_time_stop': 248, 'bear_use_sma': False, 'bear_use_ema': True, 'bear_use_atr': False, 'bear_use_adx': False, 'bear_use_spike': False, 'bear_rsi_required': False, 'sideways_strategy': 'breakout', 'sideways_bb_std_mult': 2.1807409787734042, 'sideways_rsi_os': 46, 'sideways_rsi_ob': 67, 'sideways_adx_thresh': 25.258137459769515, 'sideways_atr_min_pct': 0.005352874477007428, 'sideways_atr_max_pct': 0.016456193796631814, 'sideways_tp_mult': 2.2691364078222573, 'sideways_tsl_mult': 0.1562580246177569, 'sideways_time_stop': 221, 'sideways_use_sma': False, 'sideways_use_ema': False, 'sideways_use_atr': True, 'sideways_use_adx': False, 'sideways_use_spike': True, 'sideways_rsi_required': False}.
[I 2025-08-29 21:01:21,299] Trial 734 finished with values: [-0.004836548266381024, 0.004877977570401196] and parameters: {'p_sma': 20, 'p_std': 28, 'p_atr': 24, 'p_adx': 7, 'rsi_period': 38, 'ema1': 30, 'ema2': 53, 'slip_atr_k': 0.15256092909967103, 'slip_spread_k': 0.30226400304152423, 'spread_hl_frac': 0.047543327801798894, 'bb_std_mult': 1.6713507692094483, 'rsi_os': 9, 'rsi_ob': 74, 'vol_spike': 0.1933338473991162, 'adx_thresh': 11.421426632304593, 'atr_min_pct': 0.003687295183316848, 'atr_max_pct': 0.09049197680178912, 'tp_mult': 1.5513386818522208, 'tsl_mult': 0.8495424643237631, 'strategy': 'mean_reversion', 'time_stop': 164, 'use_sma': False, 'use_atr': False, 'use_adx': False, 'use_ema': False, 'use_spike': False, 'rsi_required': True, 'edge_k': 0.20159657494721894, 'edge_cap': 0.291268393004412, 'bull_strategy': 'breakout', 'bull_bb_std_mult': 3.219841995614451, 'bull_rsi_os': 14, 'bull_rsi_ob': 71, 'bull_adx_thresh': 22.677921445736825, 'bull_atr_min_pct': 0.004062852630447736, 'bull_atr_max_pct': 0.09316627711779502, 'bull_tp_mult': 2.6943541993993008, 'bull_tsl_mult': 0.8886114052752234, 'bull_time_stop': 30, 'bull_use_sma': False, 'bull_use_ema': False, 'bull_use_atr': True, 'bull_use_adx': True, 'bull_use_spike': True, 'bull_rsi_required': False, 'bear_strategy': 'breakout', 'bear_bb_std_mult': 2.628441600814359, 'bear_rsi_os': 5, 'bear_rsi_ob': 92, 'bear_adx_thresh': 20.885509438218243, 'bear_atr_min_pct': 0.0061943841569641975, 'bear_atr_max_pct': 0.041321334264469475, 'bear_tp_mult': 2.7255317003362785, 'bear_tsl_mult': 0.9016038730648025, 'bear_time_stop': 173, 'bear_use_sma': False, 'bear_use_ema': False, 'bear_use_atr': False, 'bear_use_adx': False, 'bear_use_spike': False, 'bear_rsi_required': False, 'sideways_strategy': 'breakout', 'sideways_bb_std_mult': 2.2011562746719, 'sideways_rsi_os': 46, 'sideways_rsi_ob': 78, 'sideways_adx_thresh': 31.275887995228718, 'sideways_atr_min_pct': 0.011029259712918599, 'sideways_atr_max_pct': 0.016079660382576754, 'sideways_tp_mult': 2.431117718528411, 'sideways_tsl_mult': 0.7009094341269546, 'sideways_time_stop': 191, 'sideways_use_sma': False, 'sideways_use_ema': False, 'sideways_use_atr': True, 'sideways_use_adx': False, 'sideways_use_spike': True, 'sideways_rsi_required': False}.
[I 2025-08-29 21:01:50,106] Trial 738 finished with values: [0.0004941278491934487, 0.002063656292553831] and parameters: {'p_sma': 16, 'p_std': 29, 'p_atr': 17, 'p_adx': 7, 'rsi_period': 31, 'ema1': 23, 'ema2': 24, 'slip_atr_k': 0.00013369657692538137, 'slip_spread_k': 0.10832064107568291, 'spread_hl_frac': 0.020800707142560427, 'bb_std_mult': 1.0325497249342737, 'rsi_os': 5, 'rsi_ob': 79, 'vol_spike': 0.26840389351922794, 'adx_thresh': 9.504115145465152, 'atr_min_pct': 0.00804707094518227, 'atr_max_pct': 0.030704220921243086, 'tp_mult': 2.6021667652727425, 'tsl_mult': 0.7940753305437829, 'strategy': 'mean_reversion', 'time_stop': 226, 'use_sma': True, 'use_atr': False, 'use_adx': False, 'use_ema': False, 'use_spike': True, 'rsi_required': False, 'edge_k': 0.909313335917056, 'edge_cap': 0.33339058221286433, 'bull_strategy': 'mean_reversion', 'bull_bb_std_mult': 2.3807816865645393, 'bull_rsi_os': 20, 'bull_rsi_ob': 68, 'bull_adx_thresh': 27.74206868183216, 'bull_atr_min_pct': 0.017603305002615983, 'bull_atr_max_pct': 0.1002424027563297, 'bull_tp_mult': 2.5501867390941606, 'bull_tsl_mult': 0.951885106803054, 'bull_time_stop': 197, 'bull_use_sma': True, 'bull_use_ema': False, 'bull_use_atr': False, 'bull_use_adx': True, 'bull_use_spike': True, 'bull_rsi_required': False, 'bear_strategy': 'breakout', 'bear_bb_std_mult': 2.1911420122007237, 'bear_rsi_os': 39, 'bear_rsi_ob': 88, 'bear_adx_thresh': 20.797637870665678, 'bear_atr_min_pct': 0.0047790196241959855, 'bear_atr_max_pct': 0.06706681634975167, 'bear_tp_mult': 2.8005824914692683, 'bear_tsl_mult': 0.09306224771667027, 'bear_time_stop': 277, 'bear_use_sma': False, 'bear_use_ema': False, 'bear_use_atr': False, 'bear_use_adx': False, 'bear_use_spike': True, 'bear_rsi_required': False, 'sideways_strategy': 'breakout', 'sideways_bb_std_mult': 3.4532875122230813, 'sideways_rsi_os': 24, 'sideways_rsi_ob': 84, 'sideways_adx_thresh': 14.762784238753959, 'sideways_atr_min_pct': 0.014282128953124067, 'sideways_atr_max_pct': 0.033914334625353836, 'sideways_tp_mult': 2.44776504968012, 'sideways_tsl_mult': 0.6374773495337509, 'sideways_time_stop': 143, 'sideways_use_sma': False, 'sideways_use_ema': False, 'sideways_use_atr': True, 'sideways_use_adx': False, 'sideways_use_spike': False, 'sideways_rsi_required': True}.
[I 2025-08-29 21:01:50,582] Trial 737 finished with values: [0.00120613032332062, 0.0015678303761260488] and parameters: {'p_sma': 15, 'p_std': 30, 'p_atr': 17, 'p_adx': 7, 'rsi_period': 31, 'ema1': 23, 'ema2': 24, 'slip_atr_k': 0.0004415024031345162, 'slip_spread_k': 0.11470799123401053, 'spread_hl_frac': 0.019097227251358498, 'bb_std_mult': 1.0269680366830591, 'rsi_os': 5, 'rsi_ob': 80, 'vol_spike': 0.2661871033835609, 'adx_thresh': 7.15100633414494, 'atr_min_pct': 0.008229778171400972, 'atr_max_pct': 0.03029085592586112, 'tp_mult': 2.5732552212124262, 'tsl_mult': 0.8054401081914853, 'strategy': 'mean_reversion', 'time_stop': 225, 'use_sma': True, 'use_atr': False, 'use_adx': False, 'use_ema': False, 'use_spike': True, 'rsi_required': False, 'edge_k': 0.9304972602586299, 'edge_cap': 0.251182508484169, 'bull_strategy': 'mean_reversion', 'bull_bb_std_mult': 2.5264870321310835, 'bull_rsi_os': 19, 'bull_rsi_ob': 69, 'bull_adx_thresh': 29.473562187228303, 'bull_atr_min_pct': 0.0177584877968616, 'bull_atr_max_pct': 0.10068103509760157, 'bull_tp_mult': 2.5308748718808234, 'bull_tsl_mult': 0.9198177025736229, 'bull_time_stop': 200, 'bull_use_sma': True, 'bull_use_ema': False, 'bull_use_atr': False, 'bull_use_adx': True, 'bull_use_spike': True, 'bull_rsi_required': False, 'bear_strategy': 'breakout', 'bear_bb_std_mult': 2.174923393572522, 'bear_rsi_os': 37, 'bear_rsi_ob': 86, 'bear_adx_thresh': 20.859480674672678, 'bear_atr_min_pct': 0.005014903172129553, 'bear_atr_max_pct': 0.06811559141271456, 'bear_tp_mult': 2.7875077101183114, 'bear_tsl_mult': 0.08137651382546233, 'bear_time_stop': 276, 'bear_use_sma': False, 'bear_use_ema': False, 'bear_use_atr': False, 'bear_use_adx': False, 'bear_use_spike': True, 'bear_rsi_required': False, 'sideways_strategy': 'breakout', 'sideways_bb_std_mult': 3.5707634930009577, 'sideways_rsi_os': 25, 'sideways_rsi_ob': 84, 'sideways_adx_thresh': 14.748152928338865, 'sideways_atr_min_pct': 0.014537539785627914, 'sideways_atr_max_pct': 0.03374114687560871, 'sideways_tp_mult': 2.3627482152816977, 'sideways_tsl_mult': 0.6393977020383801, 'sideways_time_stop': 150, 'sideways_use_sma': False, 'sideways_use_ema': False, 'sideways_use_atr': True, 'sideways_use_adx': False, 'sideways_use_spike': False, 'sideways_rsi_required': True}.
