[I 2025-08-29 19:48:55,735] Trial 99 finished with values: [-1000000000.0, 1000000000.0] and parameters: {'p_sma': 46, 'p_std': 38, 'p_atr': 11, 'p_adx': 8, 'rsi_period': 73, 'ema1': 8, 'ema2': 46, 'slip_atr_k': 0.21601073017272704, 'slip_spread_k': 0.5458681438593112, 'spread_hl_frac': 0.048413739044919975, 'bb_std_mult': 1.101778772169049, 'rsi_os': 49, 'rsi_ob': 53, 'vol_spike': 0.17783392415799168, 'adx_thresh': 13.550495123415274, 'atr_min_pct': 0.0013595521969619285, 'atr_max_pct': 0.03555992329802076, 'tp_mult': 2.269974891487761, 'tsl_mult': 0.3655680720977735, 'strategy': 'breakout', 'time_stop': 215, 'use_sma': False, 'use_atr': True, 'use_adx': True, 'use_ema': False, 'use_spike': False, 'rsi_required': False, 'edge_k': 1.1067038078238636, 'edge_cap': 0.5781313108937912, 'bull_strategy': 'mean_reversion', 'bull_bb_std_mult': 2.7853680241066643, 'bull_rsi_os': 11, 'bull_rsi_ob': 80, 'bull_adx_thresh': 15.349834973279822, 'bull_atr_min_pct': 0.004130075917931318, 'bull_atr_max_pct': 0.14988439771453022, 'bull_tp_mult': 2.6655017785721116, 'bull_tsl_mult': 0.7763808792585349, 'bull_time_stop': 291, 'bull_use_sma': True, 'bull_use_ema': True, 'bull_use_atr': False, 'bull_use_adx': False, 'bull_use_spike': True, 'bull_rsi_required': False, 'bear_strategy': 'mean_reversion', 'bear_bb_std_mult': 0.8127111421788652, 'bear_rsi_os': 7, 'bear_rsi_ob': 73, 'bear_adx_thresh': 22.15066433731766, 'bear_atr_min_pct': 0.012930799309999996, 'bear_atr_max_pct': 0.0749222897975185, 'bear_tp_mult': 2.769576918944912, 'bear_tsl_mult': 0.8245044701364146, 'bear_time_stop': 166, 'bear_use_sma': True, 'bear_use_ema': True, 'bear_use_atr': False, 'bear_use_adx': False, 'bear_use_spike': True, 'bear_rsi_required': False, 'sideways_strategy': 'breakout', 'sideways_bb_std_mult': 0.9716532742012576, 'sideways_rsi_os': 17, 'sideways_rsi_ob': 80, 'sideways_adx_thresh': 32.483059253249436, 'sideways_atr_min_pct': 0.01487523501308726, 'sideways_atr_max_pct': 0.017884643427813526, 'sideways_tp_mult': 2.6962625818415233, 'sideways_tsl_mult': 0.1719390343777788, 'sideways_time_stop': 197, 'sideways_use_sma': True, 'sideways_use_ema': True, 'sideways_use_atr': True, 'sideways_use_adx': True, 'sideways_use_spike': False, 'sideways_rsi_required': False}.
[I 2025-08-29 19:48:56,179] Trial 100 finished with values: [-1000000000.0, 1000000000.0] and parameters: {'p_sma': 46, 'p_std': 40, 'p_atr': 16, 'p_adx': 22, 'rsi_period': 74, 'ema1': 12, 'ema2': 17, 'slip_atr_k': 0.08570913226519292, 'slip_spread_k': 0.4464000566571204, 'spread_hl_frac': 0.036554017974109794, 'bb_std_mult': 1.1025443949945277, 'rsi_os': 7, 'rsi_ob': 53, 'vol_spike': 0.1768495862488177, 'adx_thresh': 13.280307175007062, 'atr_min_pct': 0.0005452633277946897, 'atr_max_pct': 0.08120496046988476, 'tp_mult': 2.246597012121433, 'tsl_mult': 0.8388269828345982, 'strategy': 'breakout', 'time_stop': 54, 'use_sma': False, 'use_atr': True, 'use_adx': True, 'use_ema': False, 'use_spike': False, 'rsi_required': False, 'edge_k': 1.1233692065498553, 'edge_cap': 0.9233448535128461, 'bull_strategy': 'mean_reversion', 'bull_bb_std_mult': 3.173218955813552, 'bull_rsi_os': 45, 'bull_rsi_ob': 93, 'bull_adx_thresh': 15.418473210953533, 'bull_atr_min_pct': 0.0023204449056762177, 'bull_atr_max_pct': 0.08411181367424861, 'bull_tp_mult': 2.665056920111609, 'bull_tsl_mult': 0.3466007761224873, 'bull_time_stop': 205, 'bull_use_sma': True, 'bull_use_ema': True, 'bull_use_atr': False, 'bull_use_adx': True, 'bull_use_spike': True, 'bull_rsi_required': True, 'bear_strategy': 'mean_reversion', 'bear_bb_std_mult': 2.8385728485985084, 'bear_rsi_os': 21, 'bear_rsi_ob': 90, 'bear_adx_thresh': 22.478223535094187, 'bear_atr_min_pct': 0.02760451896514953, 'bear_atr_max_pct': 0.09317552305697085, 'bear_tp_mult': 2.787770522311829, 'bear_tsl_mult': 0.6927373363852615, 'bear_time_stop': 166, 'bear_use_sma': True, 'bear_use_ema': False, 'bear_use_atr': False, 'bear_use_adx': False, 'bear_use_spike': False, 'bear_rsi_required': False, 'sideways_strategy': 'mean_reversion', 'sideways_bb_std_mult': 1.4138887203945847, 'sideways_rsi_os': 10, 'sideways_rsi_ob': 89, 'sideways_adx_thresh': 32.57594892856839, 'sideways_atr_min_pct': 0.014957645069708037, 'sideways_atr_max_pct': 0.14820875978228545, 'sideways_tp_mult': 2.2753486544201285, 'sideways_tsl_mult': 0.9985467809513222, 'sideways_time_stop': 89, 'sideways_use_sma': True, 'sideways_use_ema': True, 'sideways_use_atr': True, 'sideways_use_adx': False, 'sideways_use_spike': False, 'sideways_rsi_required': False}.
[I 2025-08-29 19:48:56,295] Trial 101 finished with values: [-0.004491873304261262, 0.004704133082930327] and parameters: {'p_sma': 52, 'p_std': 38, 'p_atr': 22, 'p_adx': 29, 'rsi_period': 27, 'ema1': 8, 'ema2': 41, 'slip_atr_k': 0.09029510624161641, 'slip_spread_k': 0.2516725846172494, 'spread_hl_frac': 0.004141529864258885, 'bb_std_mult': 1.0793368468856372, 'rsi_os': 49, 'rsi_ob': 79, 'vol_spike': 0.1669318079423602, 'adx_thresh': 13.408848067851212, 'atr_min_pct': 0.0036542256343891186, 'atr_max_pct': 0.1175913124953256, 'tp_mult': 2.5769666341531847, 'tsl_mult': 0.36571795358799625, 'strategy': 'breakout', 'time_stop': 51, 'use_sma': False, 'use_atr': True, 'use_adx': False, 'use_ema': False, 'use_spike': False, 'rsi_required': True, 'edge_k': 1.3074018588334393, 'edge_cap': 0.6758120080080229, 'bull_strategy': 'breakout', 'bull_bb_std_mult': 3.1842971748448754, 'bull_rsi_os': 45, 'bull_rsi_ob': 78, 'bull_adx_thresh': 25.949782872922626, 'bull_atr_min_pct': 0.004604279875847633, 'bull_atr_max_pct': 0.033382084828305326, 'bull_tp_mult': 2.720420873588649, 'bull_tsl_mult': 0.6488885493079553, 'bull_time_stop': 37, 'bull_use_sma': False, 'bull_use_ema': True, 'bull_use_atr': False, 'bull_use_adx': False, 'bull_use_spike': True, 'bull_rsi_required': True, 'bear_strategy': 'breakout', 'bear_bb_std_mult': 0.8074555143385524, 'bear_rsi_os': 53, 'bear_rsi_ob': 68, 'bear_adx_thresh': 5.79863976202617, 'bear_atr_min_pct': 0.007483537809050629, 'bear_atr_max_pct': 0.13161733441898726, 'bear_tp_mult': 1.1232061639881186, 'bear_tsl_mult': 0.6989300754091905, 'bear_time_stop': 21, 'bear_use_sma': False, 'bear_use_ema': True, 'bear_use_atr': False, 'bear_use_adx': False, 'bear_use_spike': False, 'bear_rsi_required': False, 'sideways_strategy': 'mean_reversion', 'sideways_bb_std_mult': 1.413004412380332, 'sideways_rsi_os': 10, 'sideways_rsi_ob': 61, 'sideways_adx_thresh': 33.8701480744586, 'sideways_atr_min_pct': 0.028773447035223804, 'sideways_atr_max_pct': 0.07055392217019502, 'sideways_tp_mult': 2.263665522662987, 'sideways_tsl_mult': 0.2307809398935508, 'sideways_time_stop': 199, 'sideways_use_sma': True, 'sideways_use_ema': True, 'sideways_use_atr': True, 'sideways_use_adx': True, 'sideways_use_spike': False, 'sideways_rsi_required': False}.
[I 2025-08-29 19:48:56,462] Trial 102 finished with values: [-1000000000.0, 1000000000.0] and parameters: {'p_sma': 38, 'p_std': 53, 'p_atr': 18, 'p_adx': 17, 'rsi_period': 21, 'ema1': 8, 'ema2': 36, 'slip_atr_k': 0.1600164396591759, 'slip_spread_k': 0.5590800885728764, 'spread_hl_frac': 0.03629425778532554, 'bb_std_mult': 0.7832291202398349, 'rsi_os': 49, 'rsi_ob': 54, 'vol_spike': 0.1602948740486356, 'adx_thresh': 13.328472704189316, 'atr_min_pct': 0.0034794799111663266, 'atr_max_pct': 0.11960522275927649, 'tp_mult': 2.5804375644488933, 'tsl_mult': 0.6520010805373322, 'strategy': 'breakout', 'time_stop': 240, 'use_sma': False, 'use_atr': True, 'use_adx': False, 'use_ema': False, 'use_spike': False, 'rsi_required': True, 'edge_k': 0.6062370432484199, 'edge_cap': 0.8945598518846472, 'bull_strategy': 'breakout', 'bull_bb_std_mult': 0.851511895819755, 'bull_rsi_os': 45, 'bull_rsi_ob': 50, 'bull_adx_thresh': 15.325510781959958, 'bull_atr_min_pct': 0.011471251892697789, 'bull_atr_max_pct': 0.010519780533277748, 'bull_tp_mult': 1.4863569799944427, 'bull_tsl_mult': 0.6442043754507119, 'bull_time_stop': 64, 'bull_use_sma': False, 'bull_use_ema': True, 'bull_use_atr': False, 'bull_use_adx': False, 'bull_use_spike': False, 'bull_rsi_required': True, 'bear_strategy': 'breakout', 'bear_bb_std_mult': 1.792608482011877, 'bear_rsi_os': 21, 'bear_rsi_ob': 55, 'bear_adx_thresh': 6.228697278250348, 'bear_atr_min_pct': 0.006304602231045198, 'bear_atr_max_pct': 0.09223370714562529, 'bear_tp_mult': 1.831583566833934, 'bear_tsl_mult': 0.844933367430118, 'bear_time_stop': 124, 'bear_use_sma': False, 'bear_use_ema': False, 'bear_use_atr': False, 'bear_use_adx': False, 'bear_use_spike': True, 'bear_rsi_required': False, 'sideways_strategy': 'breakout', 'sideways_bb_std_mult': 1.4153819147461548, 'sideways_rsi_os': 10, 'sideways_rsi_ob': 57, 'sideways_adx_thresh': 27.95020921328191, 'sideways_atr_min_pct': 0.028557657034892873, 'sideways_atr_max_pct': 0.0717034805337764, 'sideways_tp_mult': 2.274500871092589, 'sideways_tsl_mult': 0.23561551439327452, 'sideways_time_stop': 106, 'sideways_use_sma': False, 'sideways_use_ema': True, 'sideways_use_atr': True, 'sideways_use_adx': True, 'sideways_use_spike': False, 'sideways_rsi_required': True}.
[I 2025-08-29 19:48:56,777] Trial 103 finished with values: [-1000000000.0, 1000000000.0] and parameters: {'p_sma': 44, 'p_std': 53, 'p_atr': 18, 'p_adx': 29, 'rsi_period': 9, 'ema1': 14, 'ema2': 41, 'slip_atr_k': 0.04139280990833118, 'slip_spread_k': 0.2544333244622795, 'spread_hl_frac': 0.004357987621450222, 'bb_std_mult': 0.7834234016894892, 'rsi_os': 51, 'rsi_ob': 67, 'vol_spike': 0.16640974151477236, 'adx_thresh': 15.399498629994412, 'atr_min_pct': 0.003487478724767336, 'atr_max_pct': 0.08882526088976964, 'tp_mult': 1.3028380313253733, 'tsl_mult': 0.8285456633897703, 'strategy': 'mean_reversion', 'time_stop': 100, 'use_sma': False, 'use_atr': True, 'use_adx': False, 'use_ema': False, 'use_spike': False, 'rsi_required': True, 'edge_k': 0.6794940097173054, 'edge_cap': 0.6737017455412414, 'bull_strategy': 'breakout', 'bull_bb_std_mult': 2.0042044922841975, 'bull_rsi_os': 45, 'bull_rsi_ob': 95, 'bull_adx_thresh': 21.627190524808377, 'bull_atr_min_pct': 0.026722323956758765, 'bull_atr_max_pct': 0.10014578405324812, 'bull_tp_mult': 1.4780637807411114, 'bull_tsl_mult': 0.6401233057773781, 'bull_time_stop': 67, 'bull_use_sma': False, 'bull_use_ema': True, 'bull_use_atr': False, 'bull_use_adx': True, 'bull_use_spike': False, 'bull_rsi_required': True, 'bear_strategy': 'breakout', 'bear_bb_std_mult': 1.1047576112942084, 'bear_rsi_os': 28, 'bear_rsi_ob': 55, 'bear_adx_thresh': 31.7450131242244, 'bear_atr_min_pct': 0.0076210163110191935, 'bear_atr_max_pct': 0.09385023737237855, 'bear_tp_mult': 2.6370405754556057, 'bear_tsl_mult': 0.20152486072016879, 'bear_time_stop': 83, 'bear_use_sma': False, 'bear_use_ema': False, 'bear_use_atr': False, 'bear_use_adx': False, 'bear_use_spike': False, 'bear_rsi_required': False, 'sideways_strategy': 'mean_reversion', 'sideways_bb_std_mult': 2.5831013039856776, 'sideways_rsi_os': 10, 'sideways_rsi_ob': 61, 'sideways_adx_thresh': 29.302219902691856, 'sideways_atr_min_pct': 0.016569012710566454, 'sideways_atr_max_pct': 0.06201156145375877, 'sideways_tp_mult': 2.276210581744895, 'sideways_tsl_mult': 0.3073237389612292, 'sideways_time_stop': 107, 'sideways_use_sma': False, 'sideways_use_ema': True, 'sideways_use_atr': True, 'sideways_use_adx': False, 'sideways_use_spike': True, 'sideways_rsi_required': True}.
[I 2025-08-29 19:48:56,804] Trial 106 finished with values: [-1000000000.0, 1000000000.0] and parameters: {'p_sma': 43, 'p_std': 48, 'p_atr': 23, 'p_adx': 28, 'rsi_period': 79, 'ema1': 14, 'ema2': 43, 'slip_atr_k': 0.0425669030221958, 'slip_spread_k': 0.25332646259921726, 'spread_hl_frac': 0.01079578422593961, 'bb_std_mult': 1.2693289757813624, 'rsi_os': 52, 'rsi_ob': 67, 'vol_spike': 0.13711128439679143, 'adx_thresh': 15.657447000119802, 'atr_min_pct': 0.027796489347759953, 'atr_max_pct': 0.08961854224906791, 'tp_mult': 1.3030684476876755, 'tsl_mult': 0.4126769259146948, 'strategy': 'mean_reversion', 'time_stop': 259, 'use_sma': True, 'use_atr': True, 'use_adx': False, 'use_ema': False, 'use_spike': True, 'rsi_required': True, 'edge_k': 0.21223424718793937, 'edge_cap': 0.3040676918048985, 'bull_strategy': 'breakout', 'bull_bb_std_mult': 2.017646501939895, 'bull_rsi_os': 38, 'bull_rsi_ob': 78, 'bull_adx_thresh': 14.174871789900735, 'bull_atr_min_pct': 0.01710025895390995, 'bull_atr_max_pct': 0.06359313110728272, 'bull_tp_mult': 2.7288485558015125, 'bull_tsl_mult': 0.4052286688304395, 'bull_time_stop': 188, 'bull_use_sma': False, 'bull_use_ema': True, 'bull_use_atr': True, 'bull_use_adx': True, 'bull_use_spike': True, 'bull_rsi_required': False, 'bear_strategy': 'breakout', 'bear_bb_std_mult': 1.2154714503754647, 'bear_rsi_os': 53, 'bear_rsi_ob': 68, 'bear_adx_thresh': 31.865680006716218, 'bear_atr_min_pct': 0.007714537208575508, 'bear_atr_max_pct': 0.10998834900924619, 'bear_tp_mult': 2.9175819270076713, 'bear_tsl_mult': 0.6615595614925648, 'bear_time_stop': 21, 'bear_use_sma': False, 'bear_use_ema': False, 'bear_use_atr': True, 'bear_use_adx': False, 'bear_use_spike': False, 'bear_rsi_required': False, 'sideways_strategy': 'mean_reversion', 'sideways_bb_std_mult': 1.9676305557458649, 'sideways_rsi_os': 41, 'sideways_rsi_ob': 82, 'sideways_adx_thresh': 34.10848158449659, 'sideways_atr_min_pct': 0.016308963810285647, 'sideways_atr_max_pct': 0.12374915627217296, 'sideways_tp_mult': 1.7051448078891442, 'sideways_tsl_mult': 0.1996411102720725, 'sideways_time_stop': 229, 'sideways_use_sma': True, 'sideways_use_ema': False, 'sideways_use_atr': True, 'sideways_use_adx': False, 'sideways_use_spike': True, 'sideways_rsi_required': False}.
[I 2025-08-29 19:49:26,365] Trial 104 finished with values: [-0.0004548073543757525, 0.0011442828652896502] and parameters: {'p_sma': 38, 'p_std': 53, 'p_atr': 23, 'p_adx': 17, 'rsi_period': 21, 'ema1': 12, 'ema2': 41, 'slip_atr_k': 0.04267823666159351, 'slip_spread_k': 0.2628257975220254, 'spread_hl_frac': 0.0036002445314232585, 'bb_std_mult': 1.2690994588587352, 'rsi_os': 21, 'rsi_ob': 67, 'vol_spike': 0.16790277194252645, 'adx_thresh': 33.42576801208457, 'atr_min_pct': 0.013607610855272505, 'atr_max_pct': 0.08875154085916546, 'tp_mult': 2.420007527084511, 'tsl_mult': 0.6011726773588258, 'strategy': 'mean_reversion', 'time_stop': 105, 'use_sma': False, 'use_atr': True, 'use_adx': False, 'use_ema': False, 'use_spike': False, 'rsi_required': True, 'edge_k': 1.303701018591991, 'edge_cap': 0.45192587672119067, 'bull_strategy': 'breakout', 'bull_bb_std_mult': 0.8601359661014176, 'bull_rsi_os': 42, 'bull_rsi_ob': 95, 'bull_adx_thresh': 18.14087532067264, 'bull_atr_min_pct': 0.021923834927605357, 'bull_atr_max_pct': 0.0625826947349983, 'bull_tp_mult': 1.4679365908093145, 'bull_tsl_mult': 0.16898828498556084, 'bull_time_stop': 281, 'bull_use_sma': False, 'bull_use_ema': True, 'bull_use_atr': False, 'bull_use_adx': True, 'bull_use_spike': False, 'bull_rsi_required': True, 'bear_strategy': 'breakout', 'bear_bb_std_mult': 1.1847829120872035, 'bear_rsi_os': 29, 'bear_rsi_ob': 68, 'bear_adx_thresh': 5.959706180663372, 'bear_atr_min_pct': 0.006374115610411601, 'bear_atr_max_pct': 0.10989594181027257, 'bear_tp_mult': 1.8606977783853604, 'bear_tsl_mult': 0.659618680964868, 'bear_time_stop': 8, 'bear_use_sma': False, 'bear_use_ema': False, 'bear_use_atr': True, 'bear_use_adx': False, 'bear_use_spike': False, 'bear_rsi_required': False, 'sideways_strategy': 'mean_reversion', 'sideways_bb_std_mult': 1.9563233164935065, 'sideways_rsi_os': 30, 'sideways_rsi_ob': 82, 'sideways_adx_thresh': 29.44293792500748, 'sideways_atr_min_pct': 0.01660260347510923, 'sideways_atr_max_pct': 0.12445056329664089, 'sideways_tp_mult': 2.128953911193096, 'sideways_tsl_mult': 0.2353389755477412, 'sideways_time_stop': 262, 'sideways_use_sma': False, 'sideways_use_ema': True, 'sideways_use_atr': True, 'sideways_use_adx': False, 'sideways_use_spike': False, 'sideways_rsi_required': True}.
[I 2025-08-29 19:49:26,912] Trial 105 finished with values: [-0.0054807985417517635, 0.005453353459853093] and parameters: {'p_sma': 38, 'p_std': 31, 'p_atr': 23, 'p_adx': 29, 'rsi_period': 21, 'ema1': 13, 'ema2': 41, 'slip_atr_k': 0.04502815533282832, 'slip_spread_k': 0.2807467772246065, 'spread_hl_frac': 0.002776733602253032, 'bb_std_mult': 0.7876047008419365, 'rsi_os': 27, 'rsi_ob': 79, 'vol_spike': 0.16295301409273547, 'adx_thresh': 15.373000210876832, 'atr_min_pct': 0.027926113080729308, 'atr_max_pct': 0.13731653731965812, 'tp_mult': 2.576888023004708, 'tsl_mult': 0.41608156873479474, 'strategy': 'mean_reversion', 'time_stop': 259, 'use_sma': False, 'use_atr': True, 'use_adx': False, 'use_ema': False, 'use_spike': True, 'rsi_required': True, 'edge_k': 0.37743600960665324, 'edge_cap': 0.2963298014641892, 'bull_strategy': 'breakout', 'bull_bb_std_mult': 2.8695383828430128, 'bull_rsi_os': 38, 'bull_rsi_ob': 78, 'bull_adx_thresh': 21.705362927182104, 'bull_atr_min_pct': 0.008992778437203733, 'bull_atr_max_pct': 0.01091992031719416, 'bull_tp_mult': 2.791281580099855, 'bull_tsl_mult': 0.40914472819385805, 'bull_time_stop': 38, 'bull_use_sma': False, 'bull_use_ema': True, 'bull_use_atr': False, 'bull_use_adx': True, 'bull_use_spike': False, 'bull_rsi_required': True, 'bear_strategy': 'breakout', 'bear_bb_std_mult': 1.1087368623812095, 'bear_rsi_os': 40, 'bear_rsi_ob': 68, 'bear_adx_thresh': 5.907940441372245, 'bear_atr_min_pct': 0.006225350379846905, 'bear_atr_max_pct': 0.13226602819795405, 'bear_tp_mult': 2.0174111142623055, 'bear_tsl_mult': 0.659704012714016, 'bear_time_stop': 26, 'bear_use_sma': False, 'bear_use_ema': False, 'bear_use_atr': True, 'bear_use_adx': False, 'bear_use_spike': False, 'bear_rsi_required': False, 'sideways_strategy': 'mean_reversion', 'sideways_bb_std_mult': 1.403937917742994, 'sideways_rsi_os': 13, 'sideways_rsi_ob': 82, 'sideways_adx_thresh': 27.992011328517883, 'sideways_atr_min_pct': 0.016273829434146264, 'sideways_atr_max_pct': 0.1239753561350534, 'sideways_tp_mult': 1.699947591931375, 'sideways_tsl_mult': 0.2333425789390775, 'sideways_time_stop': 104, 'sideways_use_sma': False, 'sideways_use_ema': True, 'sideways_use_atr': True, 'sideways_use_adx': False, 'sideways_use_spike': True, 'sideways_rsi_required': True}.
[I 2025-08-29 19:49:27,068] Trial 107 finished with values: [-0.007214760368870365, 0.007207094549669213] and parameters: {'p_sma': 40, 'p_std': 8, 'p_atr': 13, 'p_adx': 24, 'rsi_period': 26, 'ema1': 10, 'ema2': 41, 'slip_atr_k': 0.04403486720836304, 'slip_spread_k': 0.49249193767924226, 'spread_hl_frac': 0.009441038223227833, 'bb_std_mult': 1.276372812019611, 'rsi_os': 21, 'rsi_ob': 79, 'vol_spike': 0.13784582822425734, 'adx_thresh': 16.9415240511709, 'atr_min_pct': 0.010831036457098889, 'atr_max_pct': 0.13966762771217395, 'tp_mult': 2.4959826071629703, 'tsl_mult': 0.9639231223445668, 'strategy': 'breakout', 'time_stop': 177, 'use_sma': True, 'use_atr': True, 'use_adx': True, 'use_ema': True, 'use_spike': True, 'rsi_required': True, 'edge_k': 1.9121682679218555, 'edge_cap': 0.5338320528237668, 'bull_strategy': 'mean_reversion', 'bull_bb_std_mult': 1.621246898504422, 'bull_rsi_os': 38, 'bull_rsi_ob': 77, 'bull_adx_thresh': 20.574316512457003, 'bull_atr_min_pct': 0.01752213241389135, 'bull_atr_max_pct': 0.10643600388097094, 'bull_tp_mult': 2.7807700001443236, 'bull_tsl_mult': 0.09287993072355977, 'bull_time_stop': 280, 'bull_use_sma': True, 'bull_use_ema': True, 'bull_use_atr': True, 'bull_use_adx': True, 'bull_use_spike': True, 'bull_rsi_required': False, 'bear_strategy': 'breakout', 'bear_bb_std_mult': 1.1778562894283635, 'bear_rsi_os': 45, 'bear_rsi_ob': 68, 'bear_adx_thresh': 5.876228553823044, 'bear_atr_min_pct': 0.0063308001083745465, 'bear_atr_max_pct': 0.10895767216828046, 'bear_tp_mult': 1.1323543035743762, 'bear_tsl_mult': 0.0758236816521356, 'bear_time_stop': 300, 'bear_use_sma': True, 'bear_use_ema': False, 'bear_use_atr': True, 'bear_use_adx': True, 'bear_use_spike': False, 'bear_rsi_required': False, 'sideways_strategy': 'mean_reversion', 'sideways_bb_std_mult': 1.9631031601053293, 'sideways_rsi_os': 24, 'sideways_rsi_ob': 82, 'sideways_adx_thresh': 31.044251864009574, 'sideways_atr_min_pct': 0.020376321360921962, 'sideways_atr_max_pct': 0.07936628195865181, 'sideways_tp_mult': 1.7092209229979656, 'sideways_tsl_mult': 0.20069774899083465, 'sideways_time_stop': 266, 'sideways_use_sma': True, 'sideways_use_ema': False, 'sideways_use_atr': True, 'sideways_use_adx': False, 'sideways_use_spike': False, 'sideways_rsi_required': False}.
