[I 2025-08-29 20:27:55,278] Trial 428 finished with values: [-1000000000.0, 1000000000.0] and parameters: {'p_sma': 8, 'p_std': 57, 'p_atr': 15, 'p_adx': 12, 'rsi_period': 36, 'ema1': 26, 'ema2': 46, 'slip_atr_k': 0.00875813253785428, 'slip_spread_k': 0.8408580037981409, 'spread_hl_frac': 0.049881207846205096, 'bb_std_mult': 1.662414927089081, 'rsi_os': 9, 'rsi_ob': 85, 'vol_spike': 0.025289235145042388, 'adx_thresh': 12.299012599635835, 'atr_min_pct': 0.019482230453347783, 'atr_max_pct': 0.023688618006294355, 'tp_mult': 1.4737886951829096, 'tsl_mult': 0.9017708374813154, 'strategy': 'mean_reversion', 'time_stop': 177, 'use_sma': True, 'use_atr': False, 'use_adx': False, 'use_ema': True, 'use_spike': False, 'rsi_required': False, 'edge_k': 1.0003380458817306, 'edge_cap': 0.6566285020732486, 'bull_strategy': 'mean_reversion', 'bull_bb_std_mult': 1.2361284591154449, 'bull_rsi_os': 7, 'bull_rsi_ob': 74, 'bull_adx_thresh': 28.317192792182688, 'bull_atr_min_pct': 0.01694879827929915, 'bull_atr_max_pct': 0.10198197709965168, 'bull_tp_mult': 2.76255787854313, 'bull_tsl_mult': 0.7119907072756885, 'bull_time_stop': 34, 'bull_use_sma': True, 'bull_use_ema': False, 'bull_use_atr': True, 'bull_use_adx': False, 'bull_use_spike': True, 'bull_rsi_required': False, 'bear_strategy': 'breakout', 'bear_bb_std_mult': 1.7045067518519723, 'bear_rsi_os': 27, 'bear_rsi_ob': 65, 'bear_adx_thresh': 20.99685767458867, 'bear_atr_min_pct': 0.0064243197215994394, 'bear_atr_max_pct': 0.13716061015819037, 'bear_tp_mult': 2.6945979626280336, 'bear_tsl_mult': 0.865911732990043, 'bear_time_stop': 46, 'bear_use_sma': False, 'bear_use_ema': False, 'bear_use_atr': False, 'bear_use_adx': True, 'bear_use_spike': True, 'bear_rsi_required': False, 'sideways_strategy': 'breakout', 'sideways_bb_std_mult': 1.235069115217913, 'sideways_rsi_os': 49, 'sideways_rsi_ob': 77, 'sideways_adx_thresh': 26.720836466965828, 'sideways_atr_min_pct': 0.004672171285281079, 'sideways_atr_max_pct': 0.04450705862711409, 'sideways_tp_mult': 1.0990967907132765, 'sideways_tsl_mult': 0.3966087440927941, 'sideways_time_stop': 141, 'sideways_use_sma': False, 'sideways_use_ema': False, 'sideways_use_atr': False, 'sideways_use_adx': False, 'sideways_use_spike': False, 'sideways_rsi_required': False}.
[I 2025-08-29 20:27:58,034] Trial 432 finished with values: [-1000000000.0, 1000000000.0] and parameters: {'p_sma': 46, 'p_std': 56, 'p_atr': 25, 'p_adx': 20, 'rsi_period': 37, 'ema1': 26, 'ema2': 47, 'slip_atr_k': 0.009096766075972772, 'slip_spread_k': 0.8377827363604915, 'spread_hl_frac': 0.03979058893125541, 'bb_std_mult': 2.7051132743508344, 'rsi_os': 6, 'rsi_ob': 95, 'vol_spike': 0.18966275845614658, 'adx_thresh': 18.37527918319074, 'atr_min_pct': 0.02072077338672073, 'atr_max_pct': 0.03415789438296919, 'tp_mult': 1.4457276530360936, 'tsl_mult': 0.17487294297596834, 'strategy': 'mean_reversion', 'time_stop': 175, 'use_sma': True, 'use_atr': False, 'use_adx': False, 'use_ema': True, 'use_spike': False, 'rsi_required': False, 'edge_k': 0.7338900233606647, 'edge_cap': 0.05149856357926924, 'bull_strategy': 'mean_reversion', 'bull_bb_std_mult': 3.202244211831687, 'bull_rsi_os': 33, 'bull_rsi_ob': 73, 'bull_adx_thresh': 30.444391343896726, 'bull_atr_min_pct': 0.027324604328616282, 'bull_atr_max_pct': 0.09684020851734915, 'bull_tp_mult': 2.7113626809822993, 'bull_tsl_mult': 0.8539967787591498, 'bull_time_stop': 36, 'bull_use_sma': True, 'bull_use_ema': False, 'bull_use_atr': True, 'bull_use_adx': False, 'bull_use_spike': True, 'bull_rsi_required': False, 'bear_strategy': 'breakout', 'bear_bb_std_mult': 2.8739940594507427, 'bear_rsi_os': 28, 'bear_rsi_ob': 65, 'bear_adx_thresh': 21.196143221400195, 'bear_atr_min_pct': 0.010042510361836232, 'bear_atr_max_pct': 0.026678932932977743, 'bear_tp_mult': 2.171122141922438, 'bear_tsl_mult': 0.1394981749062692, 'bear_time_stop': 61, 'bear_use_sma': False, 'bear_use_ema': True, 'bear_use_atr': False, 'bear_use_adx': True, 'bear_use_spike': True, 'bear_rsi_required': False, 'sideways_strategy': 'breakout', 'sideways_bb_std_mult': 3.581967650463327, 'sideways_rsi_os': 44, 'sideways_rsi_ob': 55, 'sideways_adx_thresh': 26.304707327735567, 'sideways_atr_min_pct': 0.00561746122834631, 'sideways_atr_max_pct': 0.03095763219374459, 'sideways_tp_mult': 1.2401729367604333, 'sideways_tsl_mult': 0.3835751930935996, 'sideways_time_stop': 205, 'sideways_use_sma': False, 'sideways_use_ema': False, 'sideways_use_atr': False, 'sideways_use_adx': False, 'sideways_use_spike': False, 'sideways_rsi_required': False}.
[I 2025-08-29 20:28:05,093] Trial 434 finished with values: [-1000000000.0, 1000000000.0] and parameters: {'p_sma': 23, 'p_std': 56, 'p_atr': 25, 'p_adx': 20, 'rsi_period': 36, 'ema1': 24, 'ema2': 47, 'slip_atr_k': 0.014837435351900434, 'slip_spread_k': 0.6192170864184232, 'spread_hl_frac': 0.046758950090537314, 'bb_std_mult': 2.691394689536007, 'rsi_os': 28, 'rsi_ob': 85, 'vol_spike': 0.19359527446068375, 'adx_thresh': 14.693974906439902, 'atr_min_pct': 0.02418200080363324, 'atr_max_pct': 0.033510760942420524, 'tp_mult': 1.4423528963439625, 'tsl_mult': 0.8817147528544275, 'strategy': 'mean_reversion', 'time_stop': 255, 'use_sma': True, 'use_atr': False, 'use_adx': False, 'use_ema': True, 'use_spike': False, 'rsi_required': False, 'edge_k': 0.9716464423669466, 'edge_cap': 0.8064038146952681, 'bull_strategy': 'breakout', 'bull_bb_std_mult': 3.2034807893547184, 'bull_rsi_os': 31, 'bull_rsi_ob': 74, 'bull_adx_thresh': 13.023077561101557, 'bull_atr_min_pct': 0.026672042357389306, 'bull_atr_max_pct': 0.07667647109486184, 'bull_tp_mult': 1.1838454543530414, 'bull_tsl_mult': 0.5741776494406206, 'bull_time_stop': 35, 'bull_use_sma': False, 'bull_use_ema': False, 'bull_use_atr': True, 'bull_use_adx': False, 'bull_use_spike': True, 'bull_rsi_required': False, 'bear_strategy': 'breakout', 'bear_bb_std_mult': 2.6907448035251194, 'bear_rsi_os': 17, 'bear_rsi_ob': 84, 'bear_adx_thresh': 16.666119856661496, 'bear_atr_min_pct': 0.006698836402037169, 'bear_atr_max_pct': 0.12808953628528166, 'bear_tp_mult': 2.8264500517886253, 'bear_tsl_mult': 1.0098340706476971e-05, 'bear_time_stop': 48, 'bear_use_sma': False, 'bear_use_ema': True, 'bear_use_atr': False, 'bear_use_adx': True, 'bear_use_spike': True, 'bear_rsi_required': False, 'sideways_strategy': 'breakout', 'sideways_bb_std_mult': 0.8075588099334772, 'sideways_rsi_os': 11, 'sideways_rsi_ob': 78, 'sideways_adx_thresh': 14.195699866304118, 'sideways_atr_min_pct': 0.012644572452991236, 'sideways_atr_max_pct': 0.1368907991329053, 'sideways_tp_mult': 1.0888694741285048, 'sideways_tsl_mult': 0.5156064878482816, 'sideways_time_stop': 199, 'sideways_use_sma': False, 'sideways_use_ema': False, 'sideways_use_atr': False, 'sideways_use_adx': False, 'sideways_use_spike': False, 'sideways_rsi_required': False}.
[I 2025-08-29 20:28:28,973] Trial 436 finished with values: [-0.006704101945790408, 0.006747731747472236] and parameters: {'p_sma': 22, 'p_std': 56, 'p_atr': 25, 'p_adx': 13, 'rsi_period': 34, 'ema1': 23, 'ema2': 47, 'slip_atr_k': 0.23031357754086823, 'slip_spread_k': 0.5564719444867513, 'spread_hl_frac': 0.03105305984164047, 'bb_std_mult': 1.7388284218924077, 'rsi_os': 6, 'rsi_ob': 83, 'vol_spike': 0.1951666979760168, 'adx_thresh': 25.551457058608957, 'atr_min_pct': 0.021551180853959198, 'atr_max_pct': 0.03399103441474918, 'tp_mult': 1.4052725097736483, 'tsl_mult': 0.9380081608826905, 'strategy': 'mean_reversion', 'time_stop': 171, 'use_sma': True, 'use_atr': False, 'use_adx': False, 'use_ema': True, 'use_spike': False, 'rsi_required': False, 'edge_k': 0.9847766838119324, 'edge_cap': 0.3071200904881052, 'bull_strategy': 'breakout', 'bull_bb_std_mult': 3.1910243006076917, 'bull_rsi_os': 33, 'bull_rsi_ob': 72, 'bull_adx_thresh': 13.16223525202352, 'bull_atr_min_pct': 0.026286926633082797, 'bull_atr_max_pct': 0.07661757149573183, 'bull_tp_mult': 2.6788024875144423, 'bull_tsl_mult': 0.5766479525720107, 'bull_time_stop': 24, 'bull_use_sma': False, 'bull_use_ema': False, 'bull_use_atr': True, 'bull_use_adx': False, 'bull_use_spike': True, 'bull_rsi_required': False, 'bear_strategy': 'mean_reversion', 'bear_bb_std_mult': 3.026734103612072, 'bear_rsi_os': 19, 'bear_rsi_ob': 90, 'bear_adx_thresh': 32.106192150234115, 'bear_atr_min_pct': 0.013645937322185227, 'bear_atr_max_pct': 0.04302030084801455, 'bear_tp_mult': 1.4865878475732963, 'bear_tsl_mult': 0.9080700613482328, 'bear_time_stop': 99, 'bear_use_sma': False, 'bear_use_ema': True, 'bear_use_atr': False, 'bear_use_adx': True, 'bear_use_spike': True, 'bear_rsi_required': False, 'sideways_strategy': 'breakout', 'sideways_bb_std_mult': 2.4173481439104085, 'sideways_rsi_os': 52, 'sideways_rsi_ob': 56, 'sideways_adx_thresh': 24.110576380518925, 'sideways_atr_min_pct': 0.0036237027496087296, 'sideways_atr_max_pct': 0.0313992684529196, 'sideways_tp_mult': 1.0813893350186132, 'sideways_tsl_mult': 0.7216919621219932, 'sideways_time_stop': 187, 'sideways_use_sma': False, 'sideways_use_ema': False, 'sideways_use_atr': False, 'sideways_use_adx': False, 'sideways_use_spike': False, 'sideways_rsi_required': False}.
[I 2025-08-29 20:28:29,426] Trial 435 finished with values: [0.0004539850687650393, 0.0016408287900932445] and parameters: {'p_sma': 16, 'p_std': 32, 'p_atr': 25, 'p_adx': 13, 'rsi_period': 61, 'ema1': 23, 'ema2': 47, 'slip_atr_k': 0.015424655045371358, 'slip_spread_k': 0.14513469102211707, 'spread_hl_frac': 0.031109240265828505, 'bb_std_mult': 1.6375902297340104, 'rsi_os': 6, 'rsi_ob': 83, 'vol_spike': 0.19300561087804408, 'adx_thresh': 18.522494630434714, 'atr_min_pct': 0.021452396815986544, 'atr_max_pct': 0.12344339299186899, 'tp_mult': 1.4003002653229006, 'tsl_mult': 0.9343186487851637, 'strategy': 'mean_reversion', 'time_stop': 255, 'use_sma': True, 'use_atr': False, 'use_adx': False, 'use_ema': True, 'use_spike': False, 'rsi_required': False, 'edge_k': 0.990154839041506, 'edge_cap': 0.06831028600758532, 'bull_strategy': 'breakout', 'bull_bb_std_mult': 3.191729208493165, 'bull_rsi_os': 16, 'bull_rsi_ob': 72, 'bull_adx_thresh': 13.130252091007435, 'bull_atr_min_pct': 0.01594216515801245, 'bull_atr_max_pct': 0.09620656814011291, 'bull_tp_mult': 2.6132261608149623, 'bull_tsl_mult': 0.8587422634297486, 'bull_time_stop': 34, 'bull_use_sma': False, 'bull_use_ema': False, 'bull_use_atr': True, 'bull_use_adx': False, 'bull_use_spike': True, 'bull_rsi_required': False, 'bear_strategy': 'breakout', 'bear_bb_std_mult': 3.5951520977478717, 'bear_rsi_os': 29, 'bear_rsi_ob': 45, 'bear_adx_thresh': 21.85590846980155, 'bear_atr_min_pct': 0.005359211621356694, 'bear_atr_max_pct': 0.04930270980870092, 'bear_tp_mult': 2.1175416994235263, 'bear_tsl_mult': 0.9225291095917603, 'bear_time_stop': 97, 'bear_use_sma': False, 'bear_use_ema': True, 'bear_use_atr': False, 'bear_use_adx': True, 'bear_use_spike': True, 'bear_rsi_required': False, 'sideways_strategy': 'breakout', 'sideways_bb_std_mult': 0.8070320099862922, 'sideways_rsi_os': 43, 'sideways_rsi_ob': 58, 'sideways_adx_thresh': 32.684612768520374, 'sideways_atr_min_pct': 0.0036711203250079164, 'sideways_atr_max_pct': 0.03105765992738824, 'sideways_tp_mult': 1.0867544104180786, 'sideways_tsl_mult': 0.5104741534077806, 'sideways_time_stop': 198, 'sideways_use_sma': False, 'sideways_use_ema': False, 'sideways_use_atr': False, 'sideways_use_adx': False, 'sideways_use_spike': False, 'sideways_rsi_required': False}.
[I 2025-08-29 20:28:31,313] Trial 437 finished with values: [-0.001690591555288612, 0.0017526432616807946] and parameters: {'p_sma': 22, 'p_std': 23, 'p_atr': 25, 'p_adx': 13, 'rsi_period': 33, 'ema1': 23, 'ema2': 47, 'slip_atr_k': 0.015027110873952889, 'slip_spread_k': 0.559805420842896, 'spread_hl_frac': 0.008120697759606128, 'bb_std_mult': 1.5503407897207189, 'rsi_os': 35, 'rsi_ob': 82, 'vol_spike': 0.18060578399348312, 'adx_thresh': 27.601097743108365, 'atr_min_pct': 0.028360948200614085, 'atr_max_pct': 0.03269123006927046, 'tp_mult': 1.3788812603156038, 'tsl_mult': 0.730925907534971, 'strategy': 'mean_reversion', 'time_stop': 255, 'use_sma': True, 'use_atr': False, 'use_adx': False, 'use_ema': True, 'use_spike': False, 'rsi_required': False, 'edge_k': 0.2590337121434402, 'edge_cap': 0.36043295831533395, 'bull_strategy': 'breakout', 'bull_bb_std_mult': 3.016667454754825, 'bull_rsi_os': 54, 'bull_rsi_ob': 72, 'bull_adx_thresh': 12.929068428616283, 'bull_atr_min_pct': 0.019403724280138947, 'bull_atr_max_pct': 0.1081281493946153, 'bull_tp_mult': 2.6086696878461257, 'bull_tsl_mult': 0.8880053464016899, 'bull_time_stop': 135, 'bull_use_sma': False, 'bull_use_ema': False, 'bull_use_atr': True, 'bull_use_adx': False, 'bull_use_spike': True, 'bull_rsi_required': False, 'bear_strategy': 'mean_reversion', 'bear_bb_std_mult': 2.3013849210842565, 'bear_rsi_os': 44, 'bear_rsi_ob': 78, 'bear_adx_thresh': 21.77778366218337, 'bear_atr_min_pct': 0.005410552879435329, 'bear_atr_max_pct': 0.055637860994709756, 'bear_tp_mult': 2.6343241394807704, 'bear_tsl_mult': 0.926129877678651, 'bear_time_stop': 72, 'bear_use_sma': False, 'bear_use_ema': True, 'bear_use_atr': False, 'bear_use_adx': True, 'bear_use_spike': True, 'bear_rsi_required': True, 'sideways_strategy': 'breakout', 'sideways_bb_std_mult': 1.3665328418577731, 'sideways_rsi_os': 39, 'sideways_rsi_ob': 58, 'sideways_adx_thresh': 32.9806143515851, 'sideways_atr_min_pct': 0.004028596662104138, 'sideways_atr_max_pct': 0.01646824128425048, 'sideways_tp_mult': 1.0699797145378347, 'sideways_tsl_mult': 0.5202762801374688, 'sideways_time_stop': 116, 'sideways_use_sma': True, 'sideways_use_ema': False, 'sideways_use_atr': False, 'sideways_use_adx': True, 'sideways_use_spike': False, 'sideways_rsi_required': False}.
[I 2025-08-29 20:28:35,350] Trial 438 finished with values: [-1000000000.0, 1000000000.0] and parameters: {'p_sma': 22, 'p_std': 32, 'p_atr': 16, 'p_adx': 13, 'rsi_period': 61, 'ema1': 23, 'ema2': 29, 'slip_atr_k': 0.09682152002892744, 'slip_spread_k': 0.875996773654129, 'spread_hl_frac': 0.04818403816006384, 'bb_std_mult': 2.1986872277007263, 'rsi_os': 7, 'rsi_ob': 82, 'vol_spike': 0.1799305977585948, 'adx_thresh': 25.17603439962571, 'atr_min_pct': 0.0097415432075228, 'atr_max_pct': 0.05647602012715765, 'tp_mult': 1.3810278856435254, 'tsl_mult': 0.8865804122266685, 'strategy': 'mean_reversion', 'time_stop': 237, 'use_sma': True, 'use_atr': False, 'use_adx': False, 'use_ema': True, 'use_spike': False, 'rsi_required': False, 'edge_k': 1.6658640332402141, 'edge_cap': 0.3054032851725944, 'bull_strategy': 'breakout', 'bull_bb_std_mult': 3.0352693638931063, 'bull_rsi_os': 30, 'bull_rsi_ob': 76, 'bull_adx_thresh': 13.866129049008352, 'bull_atr_min_pct': 0.005026449223162607, 'bull_atr_max_pct': 0.09450200999499343, 'bull_tp_mult': 2.62276176877028, 'bull_tsl_mult': 0.8813049798896481, 'bull_time_stop': 101, 'bull_use_sma': False, 'bull_use_ema': False, 'bull_use_atr': True, 'bull_use_adx': False, 'bull_use_spike': True, 'bull_rsi_required': False, 'bear_strategy': 'mean_reversion', 'bear_bb_std_mult': 2.4182524747422405, 'bear_rsi_os': 14, 'bear_rsi_ob': 68, 'bear_adx_thresh': 22.116542799406282, 'bear_atr_min_pct': 0.005389577421538454, 'bear_atr_max_pct': 0.04223400266831166, 'bear_tp_mult': 1.4525269492947372, 'bear_tsl_mult': 0.9325791984873973, 'bear_time_stop': 202, 'bear_use_sma': False, 'bear_use_ema': True, 'bear_use_atr': False, 'bear_use_adx': True, 'bear_use_spike': True, 'bear_rsi_required': True, 'sideways_strategy': 'breakout', 'sideways_bb_std_mult': 2.4289973382410577, 'sideways_rsi_os': 52, 'sideways_rsi_ob': 79, 'sideways_adx_thresh': 33.0170195289998, 'sideways_atr_min_pct': 0.029992072366487973, 'sideways_atr_max_pct': 0.11187283103621568, 'sideways_tp_mult': 1.0489239877063512, 'sideways_tsl_mult': 0.7174096646178274, 'sideways_time_stop': 184, 'sideways_use_sma': True, 'sideways_use_ema': False, 'sideways_use_atr': False, 'sideways_use_adx': True, 'sideways_use_spike': False, 'sideways_rsi_required': False}.
[I 2025-08-29 20:29:04,500] Trial 439 finished with values: [-0.011219946614987375, 0.011292703822598721] and parameters: {'p_sma': 20, 'p_std': 23, 'p_atr': 25, 'p_adx': 21, 'rsi_period': 74, 'ema1': 25, 'ema2': 45, 'slip_atr_k': 0.19838147516558202, 'slip_spread_k': 0.1415477450898655, 'spread_hl_frac': 0.020433408882211727, 'bb_std_mult': 1.5534269791822202, 'rsi_os': 7, 'rsi_ob': 82, 'vol_spike': 0.2483317548919795, 'adx_thresh': 13.748316732515645, 'atr_min_pct': 0.020232891986689316, 'atr_max_pct': 0.030068142663299175, 'tp_mult': 1.2867815740711397, 'tsl_mult': 0.43935093957558874, 'strategy': 'breakout', 'time_stop': 148, 'use_sma': True, 'use_atr': False, 'use_adx': True, 'use_ema': True, 'use_spike': False, 'rsi_required': False, 'edge_k': 1.10630042090567, 'edge_cap': 0.1772420793489336, 'bull_strategy': 'mean_reversion', 'bull_bb_std_mult': 2.0165539592472226, 'bull_rsi_os': 30, 'bull_rsi_ob': 76, 'bull_adx_thresh': 13.876202532782553, 'bull_atr_min_pct': 0.003995736890433574, 'bull_atr_max_pct': 0.09556871115099504, 'bull_tp_mult': 1.0563199726667332, 'bull_tsl_mult': 0.2795275999828357, 'bull_time_stop': 15, 'bull_use_sma': True, 'bull_use_ema': False, 'bull_use_atr': True, 'bull_use_adx': False, 'bull_use_spike': True, 'bull_rsi_required': False, 'bear_strategy': 'breakout', 'bear_bb_std_mult': 2.3237229597285824, 'bear_rsi_os': 43, 'bear_rsi_ob': 78, 'bear_adx_thresh': 27.866342624851868, 'bear_atr_min_pct': 0.005721315378570629, 'bear_atr_max_pct': 0.04895210557417634, 'bear_tp_mult': 2.613029705317195, 'bear_tsl_mult': 0.7613039404698532, 'bear_time_stop': 53, 'bear_use_sma': True, 'bear_use_ema': True, 'bear_use_atr': False, 'bear_use_adx': True, 'bear_use_spike': True, 'bear_rsi_required': True, 'sideways_strategy': 'breakout', 'sideways_bb_std_mult': 2.2803557871857456, 'sideways_rsi_os': 37, 'sideways_rsi_ob': 80, 'sideways_adx_thresh': 32.691110361357815, 'sideways_atr_min_pct': 0.003839696594918126, 'sideways_atr_max_pct': 0.016123973386861203, 'sideways_tp_mult': 1.0529750979468875, 'sideways_tsl_mult': 0.07597114583322162, 'sideways_time_stop': 196, 'sideways_use_sma': True, 'sideways_use_ema': False, 'sideways_use_atr': False, 'sideways_use_adx': True, 'sideways_use_spike': False, 'sideways_rsi_required': False}.
[I 2025-08-29 20:29:05,685] Trial 441 finished with values: [-1000000000.0, 1000000000.0] and parameters: {'p_sma': 20, 'p_std': 32, 'p_atr': 16, 'p_adx': 11, 'rsi_period': 7, 'ema1': 25, 'ema2': 60, 'slip_atr_k': 0.0045591916215235815, 'slip_spread_k': 0.14808451380946483, 'spread_hl_frac': 0.02660765438885198, 'bb_std_mult': 1.6324069968457073, 'rsi_os': 7, 'rsi_ob': 81, 'vol_spike': 0.17122526954280412, 'adx_thresh': 13.7972227236556, 'atr_min_pct': 0.018519844500486746, 'atr_max_pct': 0.1248442871631405, 'tp_mult': 1.3473153525611674, 'tsl_mult': 0.8865163889048941, 'strategy': 'breakout', 'time_stop': 168, 'use_sma': True, 'use_atr': False, 'use_adx': True, 'use_ema': True, 'use_spike': False, 'rsi_required': False, 'edge_k': 1.1004120687800851, 'edge_cap': 0.5991814197406136, 'bull_strategy': 'mean_reversion', 'bull_bb_std_mult': 1.9812115761620483, 'bull_rsi_os': 24, 'bull_rsi_ob': 70, 'bull_adx_thresh': 14.227032784531453, 'bull_atr_min_pct': 0.029296453280395575, 'bull_atr_max_pct': 0.0950457346462847, 'bull_tp_mult': 2.678790004766922, 'bull_tsl_mult': 0.29276524778458546, 'bull_time_stop': 215, 'bull_use_sma': True, 'bull_use_ema': False, 'bull_use_atr': True, 'bull_use_adx': False, 'bull_use_spike': True, 'bull_rsi_required': False, 'bear_strategy': 'breakout', 'bear_bb_std_mult': 2.750720797533676, 'bear_rsi_os': 25, 'bear_rsi_ob': 68, 'bear_adx_thresh': 22.35516899736045, 'bear_atr_min_pct': 0.012623873140114492, 'bear_atr_max_pct': 0.049710094780486346, 'bear_tp_mult': 2.5775609062304197, 'bear_tsl_mult': 0.9395064020658391, 'bear_time_stop': 290, 'bear_use_sma': True, 'bear_use_ema': True, 'bear_use_atr': False, 'bear_use_adx': True, 'bear_use_spike': True, 'bear_rsi_required': True, 'sideways_strategy': 'breakout', 'sideways_bb_std_mult': 0.6143171273239902, 'sideways_rsi_os': 48, 'sideways_rsi_ob': 70, 'sideways_adx_thresh': 15.816740265092577, 'sideways_atr_min_pct': 0.027063157027082813, 'sideways_atr_max_pct': 0.023768613931779946, 'sideways_tp_mult': 1.1361405419444595, 'sideways_tsl_mult': 0.4958252283041504, 'sideways_time_stop': 74, 'sideways_use_sma': True, 'sideways_use_ema': False, 'sideways_use_atr': False, 'sideways_use_adx': False, 'sideways_use_spike': True, 'sideways_rsi_required': True}.
