[I 2025-08-29 21:14:16,482] Trial 836 finished with values: [-1000000000.0, 1000000000.0] and parameters: {'p_sma': 17, 'p_std': 39, 'p_atr': 15, 'p_adx': 8, 'rsi_period': 27, 'ema1': 24, 'ema2': 25, 'slip_atr_k': 0.05595779314037669, 'slip_spread_k': 0.08677175080978711, 'spread_hl_frac': 0.023403664363301577, 'bb_std_mult': 0.8924119932018582, 'rsi_os': 47, 'rsi_ob': 75, 'vol_spike': 0.29225639489650496, 'adx_thresh': 9.729394536649732, 'atr_min_pct': 0.012905815880899759, 'atr_max_pct': 0.03956610423839818, 'tp_mult': 2.3789880985069742, 'tsl_mult': 0.7705387975885997, 'strategy': 'breakout', 'time_stop': 226, 'use_sma': False, 'use_atr': True, 'use_adx': True, 'use_ema': False, 'use_spike': True, 'rsi_required': False, 'edge_k': 0.8739565480052386, 'edge_cap': 0.2897445951847689, 'bull_strategy': 'breakout', 'bull_bb_std_mult': 2.7265223571800474, 'bull_rsi_os': 21, 'bull_rsi_ob': 66, 'bull_adx_thresh': 26.02314616773493, 'bull_atr_min_pct': 0.018464223028278364, 'bull_atr_max_pct': 0.11287868501582288, 'bull_tp_mult': 2.358909183990866, 'bull_tsl_mult': 0.9790511124539246, 'bull_time_stop': 200, 'bull_use_sma': False, 'bull_use_ema': True, 'bull_use_atr': False, 'bull_use_adx': True, 'bull_use_spike': False, 'bull_rsi_required': True, 'bear_strategy': 'mean_reversion', 'bear_bb_std_mult': 2.1407311729336156, 'bear_rsi_os': 42, 'bear_rsi_ob': 87, 'bear_adx_thresh': 12.56195625634368, 'bear_atr_min_pct': 0.007495212900949062, 'bear_atr_max_pct': 0.08007158005786244, 'bear_tp_mult': 2.8778956787500487, 'bear_tsl_mult': 0.08835128802298961, 'bear_time_stop': 239, 'bear_use_sma': True, 'bear_use_ema': False, 'bear_use_atr': True, 'bear_use_adx': False, 'bear_use_spike': False, 'bear_rsi_required': True, 'sideways_strategy': 'mean_reversion', 'sideways_bb_std_mult': 3.3923800568583866, 'sideways_rsi_os': 21, 'sideways_rsi_ob': 82, 'sideways_adx_thresh': 12.168171649719486, 'sideways_atr_min_pct': 0.01474286123244691, 'sideways_atr_max_pct': 0.03797482447868629, 'sideways_tp_mult': 2.3366567470623716, 'sideways_tsl_mult': 0.6154074395710603, 'sideways_time_stop': 163, 'sideways_use_sma': True, 'sideways_use_ema': False, 'sideways_use_atr': True, 'sideways_use_adx': True, 'sideways_use_spike': True, 'sideways_rsi_required': True}.
[I 2025-08-29 21:14:16,881] Trial 838 finished with values: [-1000000000.0, 1000000000.0] and parameters: {'p_sma': 13, 'p_std': 39, 'p_atr': 15, 'p_adx': 8, 'rsi_period': 32, 'ema1': 24, 'ema2': 26, 'slip_atr_k': 0.19107339670462142, 'slip_spread_k': 0.0852700131762838, 'spread_hl_frac': 0.02296838304310352, 'bb_std_mult': 0.8855792048953827, 'rsi_os': 6, 'rsi_ob': 78, 'vol_spike': 0.29205066184282436, 'adx_thresh': 8.87267087187689, 'atr_min_pct': 0.012012180346287815, 'atr_max_pct': 0.05890815097035633, 'tp_mult': 2.3811742861914316, 'tsl_mult': 0.7910225826434452, 'strategy': 'mean_reversion', 'time_stop': 229, 'use_sma': False, 'use_atr': True, 'use_adx': True, 'use_ema': False, 'use_spike': True, 'rsi_required': True, 'edge_k': 0.9372446585028478, 'edge_cap': 0.2860556608623476, 'bull_strategy': 'mean_reversion', 'bull_bb_std_mult': 2.703287458844981, 'bull_rsi_os': 21, 'bull_rsi_ob': 67, 'bull_adx_thresh': 26.969880570755308, 'bull_atr_min_pct': 0.019485511860501358, 'bull_atr_max_pct': 0.10098631424387353, 'bull_tp_mult': 2.386842096870725, 'bull_tsl_mult': 0.979637836716281, 'bull_time_stop': 194, 'bull_use_sma': False, 'bull_use_ema': True, 'bull_use_atr': False, 'bull_use_adx': True, 'bull_use_spike': False, 'bull_rsi_required': True, 'bear_strategy': 'breakout', 'bear_bb_std_mult': 1.8086731339467212, 'bear_rsi_os': 42, 'bear_rsi_ob': 86, 'bear_adx_thresh': 12.500566630014927, 'bear_atr_min_pct': 0.007629852203395638, 'bear_atr_max_pct': 0.07928313280606082, 'bear_tp_mult': 2.8689059183558183, 'bear_tsl_mult': 0.05301530392057583, 'bear_time_stop': 254, 'bear_use_sma': False, 'bear_use_ema': False, 'bear_use_atr': True, 'bear_use_adx': False, 'bear_use_spike': False, 'bear_rsi_required': True, 'sideways_strategy': 'mean_reversion', 'sideways_bb_std_mult': 3.5515122604525207, 'sideways_rsi_os': 21, 'sideways_rsi_ob': 82, 'sideways_adx_thresh': 11.984349145216736, 'sideways_atr_min_pct': 0.0132583766197125, 'sideways_atr_max_pct': 0.03752164571405935, 'sideways_tp_mult': 2.405334167594332, 'sideways_tsl_mult': 0.6080494699594913, 'sideways_time_stop': 160, 'sideways_use_sma': True, 'sideways_use_ema': False, 'sideways_use_atr': True, 'sideways_use_adx': True, 'sideways_use_spike': True, 'sideways_rsi_required': True}.
[I 2025-08-29 21:14:16,891] Trial 839 finished with values: [-1000000000.0, 1000000000.0] and parameters: {'p_sma': 28, 'p_std': 37, 'p_atr': 14, 'p_adx': 8, 'rsi_period': 34, 'ema1': 24, 'ema2': 27, 'slip_atr_k': 0.10938989405011519, 'slip_spread_k': 0.08471840100551994, 'spread_hl_frac': 0.021770082896927796, 'bb_std_mult': 0.8850239582605864, 'rsi_os': 48, 'rsi_ob': 78, 'vol_spike': 0.2900484903006309, 'adx_thresh': 8.991949246449721, 'atr_min_pct': 0.011681788853989333, 'atr_max_pct': 0.03560527172407187, 'tp_mult': 2.400831615717909, 'tsl_mult': 0.7973464293386504, 'strategy': 'mean_reversion', 'time_stop': 213, 'use_sma': False, 'use_atr': False, 'use_adx': True, 'use_ema': False, 'use_spike': True, 'rsi_required': True, 'edge_k': 0.943191597484209, 'edge_cap': 0.2869989011128939, 'bull_strategy': 'mean_reversion', 'bull_bb_std_mult': 2.5188137027060464, 'bull_rsi_os': 21, 'bull_rsi_ob': 70, 'bull_adx_thresh': 23.31512128952504, 'bull_atr_min_pct': 0.019665460295849417, 'bull_atr_max_pct': 0.11105041101754225, 'bull_tp_mult': 2.4063925641002313, 'bull_tsl_mult': 0.9752836090576603, 'bull_time_stop': 220, 'bull_use_sma': True, 'bull_use_ema': True, 'bull_use_atr': False, 'bull_use_adx': True, 'bull_use_spike': False, 'bull_rsi_required': True, 'bear_strategy': 'breakout', 'bear_bb_std_mult': 1.5437367700553324, 'bear_rsi_os': 39, 'bear_rsi_ob': 87, 'bear_adx_thresh': 27.968127188773487, 'bear_atr_min_pct': 0.013726949699489479, 'bear_atr_max_pct': 0.07883287066595236, 'bear_tp_mult': 2.8773807172480153, 'bear_tsl_mult': 0.05685609604862679, 'bear_time_stop': 259, 'bear_use_sma': False, 'bear_use_ema': False, 'bear_use_atr': False, 'bear_use_adx': False, 'bear_use_spike': False, 'bear_rsi_required': True, 'sideways_strategy': 'mean_reversion', 'sideways_bb_std_mult': 3.557074204720203, 'sideways_rsi_os': 20, 'sideways_rsi_ob': 82, 'sideways_adx_thresh': 12.000927269518526, 'sideways_atr_min_pct': 0.014172337193009862, 'sideways_atr_max_pct': 0.03696199217387636, 'sideways_tp_mult': 2.3798740482336878, 'sideways_tsl_mult': 0.59680893748603, 'sideways_time_stop': 138, 'sideways_use_sma': False, 'sideways_use_ema': False, 'sideways_use_atr': True, 'sideways_use_adx': True, 'sideways_use_spike': True, 'sideways_rsi_required': True}.
[I 2025-08-29 21:14:17,786] Trial 843 finished with values: [-1000000000.0, 1000000000.0] and parameters: {'p_sma': 16, 'p_std': 38, 'p_atr': 14, 'p_adx': 9, 'rsi_period': 34, 'ema1': 23, 'ema2': 26, 'slip_atr_k': 0.244368233445669, 'slip_spread_k': 0.1212020600521971, 'spread_hl_frac': 0.021773831196634053, 'bb_std_mult': 0.8218113941540153, 'rsi_os': 55, 'rsi_ob': 80, 'vol_spike': 0.2779586639430396, 'adx_thresh': 8.185447172917213, 'atr_min_pct': 0.010536216085924829, 'atr_max_pct': 0.1438343167767165, 'tp_mult': 2.433622757707209, 'tsl_mult': 0.7212109019122712, 'strategy': 'mean_reversion', 'time_stop': 220, 'use_sma': True, 'use_atr': False, 'use_adx': False, 'use_ema': False, 'use_spike': True, 'rsi_required': False, 'edge_k': 0.9469727382348564, 'edge_cap': 0.23585939619522647, 'bull_strategy': 'mean_reversion', 'bull_bb_std_mult': 2.6166393822438914, 'bull_rsi_os': 23, 'bull_rsi_ob': 67, 'bull_adx_thresh': 21.856131999749433, 'bull_atr_min_pct': 0.017904815163375196, 'bull_atr_max_pct': 0.10830978230052177, 'bull_tp_mult': 2.4990787049033543, 'bull_tsl_mult': 0.9990637319124487, 'bull_time_stop': 211, 'bull_use_sma': True, 'bull_use_ema': False, 'bull_use_atr': False, 'bull_use_adx': True, 'bull_use_spike': True, 'bull_rsi_required': False, 'bear_strategy': 'breakout', 'bear_bb_std_mult': 2.302269748109841, 'bear_rsi_os': 38, 'bear_rsi_ob': 89, 'bear_adx_thresh': 15.619342893803775, 'bear_atr_min_pct': 0.017094617942152196, 'bear_atr_max_pct': 0.08751521882061931, 'bear_tp_mult': 2.814067957013182, 'bear_tsl_mult': 0.03850095154926519, 'bear_time_stop': 263, 'bear_use_sma': False, 'bear_use_ema': False, 'bear_use_atr': False, 'bear_use_adx': False, 'bear_use_spike': True, 'bear_rsi_required': False, 'sideways_strategy': 'breakout', 'sideways_bb_std_mult': 3.5952345211107404, 'sideways_rsi_os': 19, 'sideways_rsi_ob': 86, 'sideways_adx_thresh': 10.132966289959372, 'sideways_atr_min_pct': 0.012379580086977498, 'sideways_atr_max_pct': 0.04212624478157406, 'sideways_tp_mult': 2.2737717767347436, 'sideways_tsl_mult': 0.5918107015531336, 'sideways_time_stop': 153, 'sideways_use_sma': False, 'sideways_use_ema': True, 'sideways_use_atr': True, 'sideways_use_adx': False, 'sideways_use_spike': False, 'sideways_rsi_required': True}.
[I 2025-08-29 21:14:44,430] Trial 840 finished with values: [-1000000000.0, 1000000000.0] and parameters: {'p_sma': 13, 'p_std': 38, 'p_atr': 14, 'p_adx': 8, 'rsi_period': 34, 'ema1': 24, 'ema2': 26, 'slip_atr_k': 0.11192794034182921, 'slip_spread_k': 0.09561760513415343, 'spread_hl_frac': 0.021653484051521347, 'bb_std_mult': 0.9066103348814231, 'rsi_os': 47, 'rsi_ob': 78, 'vol_spike': 0.29133394725179834, 'adx_thresh': 8.752288541286326, 'atr_min_pct': 0.011960849024481687, 'atr_max_pct': 0.0677132732316981, 'tp_mult': 2.392072096937141, 'tsl_mult': 0.7842283914963555, 'strategy': 'mean_reversion', 'time_stop': 213, 'use_sma': True, 'use_atr': False, 'use_adx': False, 'use_ema': False, 'use_spike': True, 'rsi_required': True, 'edge_k': 0.9496490165042502, 'edge_cap': 0.2214964997335533, 'bull_strategy': 'mean_reversion', 'bull_bb_std_mult': 2.725905535120713, 'bull_rsi_os': 55, 'bull_rsi_ob': 67, 'bull_adx_thresh': 34.39947177253204, 'bull_atr_min_pct': 0.017743571733539232, 'bull_atr_max_pct': 0.10068176910480255, 'bull_tp_mult': 2.447265058266195, 'bull_tsl_mult': 0.9771762707540659, 'bull_time_stop': 220, 'bull_use_sma': True, 'bull_use_ema': True, 'bull_use_atr': False, 'bull_use_adx': True, 'bull_use_spike': True, 'bull_rsi_required': False, 'bear_strategy': 'breakout', 'bear_bb_std_mult': 2.229685148048803, 'bear_rsi_os': 39, 'bear_rsi_ob': 83, 'bear_adx_thresh': 12.400829278413198, 'bear_atr_min_pct': 0.0184829356086032, 'bear_atr_max_pct': 0.07836363337683012, 'bear_tp_mult': 2.874900378832071, 'bear_tsl_mult': 0.0604551138136797, 'bear_time_stop': 262, 'bear_use_sma': False, 'bear_use_ema': False, 'bear_use_atr': False, 'bear_use_adx': False, 'bear_use_spike': True, 'bear_rsi_required': False, 'sideways_strategy': 'mean_reversion', 'sideways_bb_std_mult': 3.490496763971115, 'sideways_rsi_os': 18, 'sideways_rsi_ob': 82, 'sideways_adx_thresh': 11.730416001113554, 'sideways_atr_min_pct': 0.01318008912229511, 'sideways_atr_max_pct': 0.039376677665584, 'sideways_tp_mult': 2.3929984969754994, 'sideways_tsl_mult': 0.6176766405991954, 'sideways_time_stop': 139, 'sideways_use_sma': False, 'sideways_use_ema': True, 'sideways_use_atr': True, 'sideways_use_adx': True, 'sideways_use_spike': False, 'sideways_rsi_required': True}.
[I 2025-08-29 21:14:44,594] Trial 841 finished with values: [-0.03451335587121085, 0.034462395306519525] and parameters: {'p_sma': 13, 'p_std': 37, 'p_atr': 14, 'p_adx': 9, 'rsi_period': 34, 'ema1': 24, 'ema2': 26, 'slip_atr_k': 0.10932643814625542, 'slip_spread_k': 0.11153475258373602, 'spread_hl_frac': 0.021715990349109905, 'bb_std_mult': 0.8525118774925495, 'rsi_os': 16, 'rsi_ob': 77, 'vol_spike': 0.2924738587816673, 'adx_thresh': 8.86637600386787, 'atr_min_pct': 0.011849224132046707, 'atr_max_pct': 0.1439607954515998, 'tp_mult': 2.427871070117954, 'tsl_mult': 0.790818040473377, 'strategy': 'mean_reversion', 'time_stop': 215, 'use_sma': True, 'use_atr': False, 'use_adx': False, 'use_ema': False, 'use_spike': True, 'rsi_required': True, 'edge_k': 0.9397307993863612, 'edge_cap': 0.20964890733493335, 'bull_strategy': 'mean_reversion', 'bull_bb_std_mult': 2.629282445369118, 'bull_rsi_os': 24, 'bull_rsi_ob': 67, 'bull_adx_thresh': 23.194994504327894, 'bull_atr_min_pct': 0.017841700690010894, 'bull_atr_max_pct': 0.10061460216068127, 'bull_tp_mult': 2.500316937891226, 'bull_tsl_mult': 0.9768898294882831, 'bull_time_stop': 193, 'bull_use_sma': True, 'bull_use_ema': False, 'bull_use_atr': False, 'bull_use_adx': True, 'bull_use_spike': True, 'bull_rsi_required': False, 'bear_strategy': 'breakout', 'bear_bb_std_mult': 2.5067687330215036, 'bear_rsi_os': 38, 'bear_rsi_ob': 83, 'bear_adx_thresh': 14.364391695205267, 'bear_atr_min_pct': 3.850099785498995e-06, 'bear_atr_max_pct': 0.08609499239984468, 'bear_tp_mult': 2.813046373529073, 'bear_tsl_mult': 0.062046495817268475, 'bear_time_stop': 259, 'bear_use_sma': False, 'bear_use_ema': False, 'bear_use_atr': False, 'bear_use_adx': False, 'bear_use_spike': True, 'bear_rsi_required': False, 'sideways_strategy': 'breakout', 'sideways_bb_std_mult': 3.55566741774961, 'sideways_rsi_os': 18, 'sideways_rsi_ob': 87, 'sideways_adx_thresh': 11.402454420893918, 'sideways_atr_min_pct': 0.013272990719356875, 'sideways_atr_max_pct': 0.03962659337738138, 'sideways_tp_mult': 2.396064202075052, 'sideways_tsl_mult': 0.5929965211078472, 'sideways_time_stop': 138, 'sideways_use_sma': False, 'sideways_use_ema': True, 'sideways_use_atr': True, 'sideways_use_adx': False, 'sideways_use_spike': False, 'sideways_rsi_required': True}.
[I 2025-08-29 21:14:45,483] Trial 842 finished with values: [-1000000000.0, 1000000000.0] and parameters: {'p_sma': 16, 'p_std': 37, 'p_atr': 14, 'p_adx': 9, 'rsi_period': 34, 'ema1': 23, 'ema2': 26, 'slip_atr_k': 0.014420273824299105, 'slip_spread_k': 0.1123925056872549, 'spread_hl_frac': 0.02247261851487916, 'bb_std_mult': 0.8311751350494263, 'rsi_os': 7, 'rsi_ob': 77, 'vol_spike': 0.2797296657412732, 'adx_thresh': 8.0186853795299, 'atr_min_pct': 0.01049369707645646, 'atr_max_pct': 0.04498043823284914, 'tp_mult': 2.4326182039451765, 'tsl_mult': 0.7149639357392404, 'strategy': 'mean_reversion', 'time_stop': 220, 'use_sma': True, 'use_atr': False, 'use_adx': False, 'use_ema': False, 'use_spike': True, 'rsi_required': False, 'edge_k': 0.950500086572975, 'edge_cap': 0.24669029013675964, 'bull_strategy': 'mean_reversion', 'bull_bb_std_mult': 2.6203063493663152, 'bull_rsi_os': 24, 'bull_rsi_ob': 69, 'bull_adx_thresh': 22.202084920930407, 'bull_atr_min_pct': 0.01786704069527938, 'bull_atr_max_pct': 0.10128132479875884, 'bull_tp_mult': 2.50399719991512, 'bull_tsl_mult': 0.9391888771346003, 'bull_time_stop': 213, 'bull_use_sma': True, 'bull_use_ema': False, 'bull_use_atr': False, 'bull_use_adx': True, 'bull_use_spike': True, 'bull_rsi_required': False, 'bear_strategy': 'breakout', 'bear_bb_std_mult': 2.2266066795061428, 'bear_rsi_os': 38, 'bear_rsi_ob': 83, 'bear_adx_thresh': 14.415463291361334, 'bear_atr_min_pct': 0.018208387480143442, 'bear_atr_max_pct': 0.08525738929866619, 'bear_tp_mult': 2.9558119882058405, 'bear_tsl_mult': 0.06779081857371778, 'bear_time_stop': 265, 'bear_use_sma': False, 'bear_use_ema': False, 'bear_use_atr': False, 'bear_use_adx': False, 'bear_use_spike': True, 'bear_rsi_required': False, 'sideways_strategy': 'breakout', 'sideways_bb_std_mult': 3.495829229570812, 'sideways_rsi_os': 18, 'sideways_rsi_ob': 86, 'sideways_adx_thresh': 9.928215142136107, 'sideways_atr_min_pct': 0.012399634666234916, 'sideways_atr_max_pct': 0.043737128894646, 'sideways_tp_mult': 2.2705167830990085, 'sideways_tsl_mult': 0.6187290737842954, 'sideways_time_stop': 138, 'sideways_use_sma': False, 'sideways_use_ema': True, 'sideways_use_atr': True, 'sideways_use_adx': False, 'sideways_use_spike': False, 'sideways_rsi_required': True}.
[I 2025-08-29 21:14:46,896] Trial 844 finished with values: [-1000000000.0, 1000000000.0] and parameters: {'p_sma': 57, 'p_std': 28, 'p_atr': 15, 'p_adx': 10, 'rsi_period': 32, 'ema1': 24, 'ema2': 27, 'slip_atr_k': 0.18391320665949448, 'slip_spread_k': 0.06023327428596492, 'spread_hl_frac': 0.022510763517082692, 'bb_std_mult': 1.0279387830880107, 'rsi_os': 39, 'rsi_ob': 79, 'vol_spike': 0.29227228871978794, 'adx_thresh': 7.870681680253906, 'atr_min_pct': 0.011522237217626918, 'atr_max_pct': 0.04416831596766902, 'tp_mult': 2.4877874724780096, 'tsl_mult': 0.7810632054892519, 'strategy': 'mean_reversion', 'time_stop': 213, 'use_sma': True, 'use_atr': False, 'use_adx': False, 'use_ema': False, 'use_spike': True, 'rsi_required': False, 'edge_k': 0.9115208535068244, 'edge_cap': 0.21194231641296535, 'bull_strategy': 'mean_reversion', 'bull_bb_std_mult': 2.649307229411467, 'bull_rsi_os': 23, 'bull_rsi_ob': 69, 'bull_adx_thresh': 34.30920168894324, 'bull_atr_min_pct': 0.01911092155266455, 'bull_atr_max_pct': 0.1007387005452045, 'bull_tp_mult': 2.4312512911738877, 'bull_tsl_mult': 0.939801104205107, 'bull_time_stop': 191, 'bull_use_sma': True, 'bull_use_ema': False, 'bull_use_atr': False, 'bull_use_adx': True, 'bull_use_spike': True, 'bull_rsi_required': False, 'bear_strategy': 'breakout', 'bear_bb_std_mult': 2.226021967326843, 'bear_rsi_os': 40, 'bear_rsi_ob': 83, 'bear_adx_thresh': 14.411167234203624, 'bear_atr_min_pct': 0.02675278142194359, 'bear_atr_max_pct': 0.08348423034102485, 'bear_tp_mult': 2.811259338092024, 'bear_tsl_mult': 0.06670096391628717, 'bear_time_stop': 271, 'bear_use_sma': False, 'bear_use_ema': False, 'bear_use_atr': False, 'bear_use_adx': False, 'bear_use_spike': True, 'bear_rsi_required': False, 'sideways_strategy': 'breakout', 'sideways_bb_std_mult': 3.4760367670678427, 'sideways_rsi_os': 22, 'sideways_rsi_ob': 83, 'sideways_adx_thresh': 12.784104961925575, 'sideways_atr_min_pct': 0.013142918053933974, 'sideways_atr_max_pct': 0.039065571285064916, 'sideways_tp_mult': 2.390976401695678, 'sideways_tsl_mult': 0.6185534050981418, 'sideways_time_stop': 139, 'sideways_use_sma': False, 'sideways_use_ema': True, 'sideways_use_atr': True, 'sideways_use_adx': False, 'sideways_use_spike': False, 'sideways_rsi_required': True}.
[I 2025-08-29 21:15:15,384] Trial 845 finished with values: [-1000000000.0, 1000000000.0] and parameters: {'p_sma': 52, 'p_std': 28, 'p_atr': 15, 'p_adx': 9, 'rsi_period': 32, 'ema1': 23, 'ema2': 28, 'slip_atr_k': 0.1581458184084164, 'slip_spread_k': 0.05480827817801181, 'spread_hl_frac': 0.026850830265291253, 'bb_std_mult': 1.0159853203256621, 'rsi_os': 8, 'rsi_ob': 77, 'vol_spike': 0.2654605781674362, 'adx_thresh': 7.883403248951392, 'atr_min_pct': 0.011581217151336812, 'atr_max_pct': 0.04283504149713269, 'tp_mult': 2.460119891062609, 'tsl_mult': 0.8042671305713006, 'strategy': 'mean_reversion', 'time_stop': 221, 'use_sma': True, 'use_atr': False, 'use_adx': False, 'use_ema': False, 'use_spike': True, 'rsi_required': False, 'edge_k': 0.8416291046980557, 'edge_cap': 0.27237343243985757, 'bull_strategy': 'mean_reversion', 'bull_bb_std_mult': 2.61666918279695, 'bull_rsi_os': 24, 'bull_rsi_ob': 69, 'bull_adx_thresh': 31.73996473147111, 'bull_atr_min_pct': 0.02128286424862149, 'bull_atr_max_pct': 0.10350529245121112, 'bull_tp_mult': 2.5140256055142824, 'bull_tsl_mult': 0.958145235989825, 'bull_time_stop': 192, 'bull_use_sma': True, 'bull_use_ema': False, 'bull_use_atr': False, 'bull_use_adx': True, 'bull_use_spike': True, 'bull_rsi_required': False, 'bear_strategy': 'breakout', 'bear_bb_std_mult': 2.208144462825887, 'bear_rsi_os': 38, 'bear_rsi_ob': 88, 'bear_adx_thresh': 11.268216134736546, 'bear_atr_min_pct': 0.027019654967587556, 'bear_atr_max_pct': 0.08452146060988791, 'bear_tp_mult': 2.8193298066630934, 'bear_tsl_mult': 0.07572326553327413, 'bear_time_stop': 269, 'bear_use_sma': False, 'bear_use_ema': False, 'bear_use_atr': False, 'bear_use_adx': False, 'bear_use_spike': True, 'bear_rsi_required': False, 'sideways_strategy': 'breakout', 'sideways_bb_std_mult': 3.4563070451657465, 'sideways_rsi_os': 22, 'sideways_rsi_ob': 87, 'sideways_adx_thresh': 12.922993757718942, 'sideways_atr_min_pct': 0.013836537673877929, 'sideways_atr_max_pct': 0.045163355573879065, 'sideways_tp_mult': 2.259564272601176, 'sideways_tsl_mult': 0.5540021576156517, 'sideways_time_stop': 157, 'sideways_use_sma': False, 'sideways_use_ema': False, 'sideways_use_atr': True, 'sideways_use_adx': False, 'sideways_use_spike': False, 'sideways_rsi_required': True}.
