[I 2025-08-29 20:05:18,092] Trial 245 finished with values: [-1000000000.0, 1000000000.0] and parameters: {'p_sma': 40, 'p_std': 52, 'p_atr': 24, 'p_adx': 17, 'rsi_period': 35, 'ema1': 16, 'ema2': 45, 'slip_atr_k': 0.03695806781255612, 'slip_spread_k': 0.08143123475223807, 'spread_hl_frac': 0.00199604878319037, 'bb_std_mult': 1.1787639500973408, 'rsi_os': 19, 'rsi_ob': 91, 'vol_spike': 0.17893616695191866, 'adx_thresh': 31.8996255728856, 'atr_min_pct': 0.02298426050463536, 'atr_max_pct': 0.025986470807129833, 'tp_mult': 1.7535257102708293, 'tsl_mult': 0.6117858624324171, 'strategy': 'mean_reversion', 'time_stop': 146, 'use_sma': True, 'use_atr': True, 'use_adx': False, 'use_ema': False, 'use_spike': True, 'rsi_required': True, 'edge_k': 1.0796989011107958, 'edge_cap': 0.48423492274208857, 'bull_strategy': 'mean_reversion', 'bull_bb_std_mult': 1.6025245539870567, 'bull_rsi_os': 36, 'bull_rsi_ob': 46, 'bull_adx_thresh': 14.027118956941905, 'bull_atr_min_pct': 0.0020293699815889807, 'bull_atr_max_pct': 0.015433607658879666, 'bull_tp_mult': 1.429456630845348, 'bull_tsl_mult': 0.13045361315888698, 'bull_time_stop': 153, 'bull_use_sma': True, 'bull_use_ema': True, 'bull_use_atr': False, 'bull_use_adx': False, 'bull_use_spike': False, 'bull_rsi_required': True, 'bear_strategy': 'breakout', 'bear_bb_std_mult': 1.1513438625668386, 'bear_rsi_os': 22, 'bear_rsi_ob': 69, 'bear_adx_thresh': 9.29327730290533, 'bear_atr_min_pct': 0.005727642039583842, 'bear_atr_max_pct': 0.11496679163521105, 'bear_tp_mult': 1.118231451167013, 'bear_tsl_mult': 0.5006851355897577, 'bear_time_stop': 10, 'bear_use_sma': False, 'bear_use_ema': True, 'bear_use_atr': True, 'bear_use_adx': False, 'bear_use_spike': True, 'bear_rsi_required': False, 'sideways_strategy': 'mean_reversion', 'sideways_bb_std_mult': 1.860853228941711, 'sideways_rsi_os': 11, 'sideways_rsi_ob': 59, 'sideways_adx_thresh': 18.506439545943987, 'sideways_atr_min_pct': 0.00555614594463664, 'sideways_atr_max_pct': 0.066274194617989, 'sideways_tp_mult': 2.6956651456689893, 'sideways_tsl_mult': 0.8863021158821587, 'sideways_time_stop': 230, 'sideways_use_sma': False, 'sideways_use_ema': False, 'sideways_use_atr': True, 'sideways_use_adx': False, 'sideways_use_spike': True, 'sideways_rsi_required': False}.
[I 2025-08-29 20:05:18,451] Trial 243 finished with values: [-1000000000.0, 1000000000.0] and parameters: {'p_sma': 40, 'p_std': 10, 'p_atr': 24, 'p_adx': 17, 'rsi_period': 35, 'ema1': 18, 'ema2': 45, 'slip_atr_k': 0.015616016865700716, 'slip_spread_k': 0.37468193138057715, 'spread_hl_frac': 0.0020680018427014775, 'bb_std_mult': 1.1695328164416026, 'rsi_os': 19, 'rsi_ob': 66, 'vol_spike': 0.179516944368811, 'adx_thresh': 31.441711899133757, 'atr_min_pct': 0.012803062754650013, 'atr_max_pct': 0.06063139042969702, 'tp_mult': 1.7918409346951727, 'tsl_mult': 0.569944275969989, 'strategy': 'mean_reversion', 'time_stop': 144, 'use_sma': True, 'use_atr': True, 'use_adx': False, 'use_ema': False, 'use_spike': False, 'rsi_required': True, 'edge_k': 1.2069729498251138, 'edge_cap': 0.4876063757624186, 'bull_strategy': 'mean_reversion', 'bull_bb_std_mult': 1.3649141807776926, 'bull_rsi_os': 38, 'bull_rsi_ob': 46, 'bull_adx_thresh': 26.629881683448694, 'bull_atr_min_pct': 0.0017864725909008394, 'bull_atr_max_pct': 0.03687358739566207, 'bull_tp_mult': 1.4131409152809262, 'bull_tsl_mult': 0.11999185165537837, 'bull_time_stop': 152, 'bull_use_sma': True, 'bull_use_ema': True, 'bull_use_atr': False, 'bull_use_adx': True, 'bull_use_spike': False, 'bull_rsi_required': True, 'bear_strategy': 'breakout', 'bear_bb_std_mult': 1.0808353315319223, 'bear_rsi_os': 8, 'bear_rsi_ob': 72, 'bear_adx_thresh': 9.269324196118452, 'bear_atr_min_pct': 0.02961137004312463, 'bear_atr_max_pct': 0.05172551532985652, 'bear_tp_mult': 1.0124203281975448, 'bear_tsl_mult': 0.40254683673749436, 'bear_time_stop': 140, 'bear_use_sma': False, 'bear_use_ema': True, 'bear_use_atr': True, 'bear_use_adx': False, 'bear_use_spike': True, 'bear_rsi_required': False, 'sideways_strategy': 'mean_reversion', 'sideways_bb_std_mult': 3.412392307669821, 'sideways_rsi_os': 20, 'sideways_rsi_ob': 55, 'sideways_adx_thresh': 18.112283823906136, 'sideways_atr_min_pct': 0.005212691634820495, 'sideways_atr_max_pct': 0.051223963790069146, 'sideways_tp_mult': 2.8154434824102896, 'sideways_tsl_mult': 0.6894580501113046, 'sideways_time_stop': 228, 'sideways_use_sma': False, 'sideways_use_ema': True, 'sideways_use_atr': False, 'sideways_use_adx': True, 'sideways_use_spike': True, 'sideways_rsi_required': False}.
[I 2025-08-29 20:05:18,786] Trial 244 finished with values: [-0.0009080065016733307, 0.001600389034585198] and parameters: {'p_sma': 40, 'p_std': 10, 'p_atr': 24, 'p_adx': 17, 'rsi_period': 35, 'ema1': 18, 'ema2': 45, 'slip_atr_k': 0.03871499061736859, 'slip_spread_k': 0.6701736861036852, 'spread_hl_frac': 0.0020339732342968173, 'bb_std_mult': 1.1701236192196236, 'rsi_os': 19, 'rsi_ob': 94, 'vol_spike': 0.17650687446184565, 'adx_thresh': 31.925990639542455, 'atr_min_pct': 0.01298830816527675, 'atr_max_pct': 0.03385173970819961, 'tp_mult': 1.765919150074281, 'tsl_mult': 0.6148215992292604, 'strategy': 'mean_reversion', 'time_stop': 194, 'use_sma': True, 'use_atr': True, 'use_adx': False, 'use_ema': False, 'use_spike': False, 'rsi_required': True, 'edge_k': 1.212602196551713, 'edge_cap': 0.4789298308414516, 'bull_strategy': 'mean_reversion', 'bull_bb_std_mult': 1.379425116067647, 'bull_rsi_os': 40, 'bull_rsi_ob': 55, 'bull_adx_thresh': 34.34379128083568, 'bull_atr_min_pct': 0.0019410831886532748, 'bull_atr_max_pct': 0.030046895339389125, 'bull_tp_mult': 1.4283763040493642, 'bull_tsl_mult': 0.12752242446334616, 'bull_time_stop': 152, 'bull_use_sma': True, 'bull_use_ema': True, 'bull_use_atr': False, 'bull_use_adx': True, 'bull_use_spike': False, 'bull_rsi_required': True, 'bear_strategy': 'breakout', 'bear_bb_std_mult': 1.1397643885394344, 'bear_rsi_os': 31, 'bear_rsi_ob': 69, 'bear_adx_thresh': 21.704148242332728, 'bear_atr_min_pct': 0.005800019903964339, 'bear_atr_max_pct': 0.11431236686514246, 'bear_tp_mult': 1.0156561339050403, 'bear_tsl_mult': 0.5092673064831259, 'bear_time_stop': 12, 'bear_use_sma': False, 'bear_use_ema': True, 'bear_use_atr': True, 'bear_use_adx': False, 'bear_use_spike': True, 'bear_rsi_required': False, 'sideways_strategy': 'mean_reversion', 'sideways_bb_std_mult': 1.8738361462802604, 'sideways_rsi_os': 12, 'sideways_rsi_ob': 56, 'sideways_adx_thresh': 18.312516649623056, 'sideways_atr_min_pct': 0.005528894775631772, 'sideways_atr_max_pct': 0.04798384455993897, 'sideways_tp_mult': 2.808251242550659, 'sideways_tsl_mult': 0.739449366579977, 'sideways_time_stop': 234, 'sideways_use_sma': False, 'sideways_use_ema': True, 'sideways_use_atr': False, 'sideways_use_adx': False, 'sideways_use_spike': True, 'sideways_rsi_required': False}.
[I 2025-08-29 20:05:48,429] Trial 247 finished with values: [-1000000000.0, 1000000000.0] and parameters: {'p_sma': 42, 'p_std': 10, 'p_atr': 24, 'p_adx': 17, 'rsi_period': 35, 'ema1': 20, 'ema2': 49, 'slip_atr_k': 0.029850366178925183, 'slip_spread_k': 0.2535073638817887, 'spread_hl_frac': 0.034007370200222604, 'bb_std_mult': 3.5929622112612964, 'rsi_os': 19, 'rsi_ob': 66, 'vol_spike': 0.19018176483974286, 'adx_thresh': 28.913414159715895, 'atr_min_pct': 0.014081558815155342, 'atr_max_pct': 0.03402587724523208, 'tp_mult': 1.4281514339595103, 'tsl_mult': 0.022452815048687014, 'strategy': 'mean_reversion', 'time_stop': 189, 'use_sma': True, 'use_atr': True, 'use_adx': False, 'use_ema': True, 'use_spike': False, 'rsi_required': True, 'edge_k': 1.2126450716136683, 'edge_cap': 0.4769621030992183, 'bull_strategy': 'mean_reversion', 'bull_bb_std_mult': 1.6401502772531031, 'bull_rsi_os': 38, 'bull_rsi_ob': 56, 'bull_adx_thresh': 34.34045132045651, 'bull_atr_min_pct': 0.0008681983106457575, 'bull_atr_max_pct': 0.02922339148616789, 'bull_tp_mult': 1.3678704921345732, 'bull_tsl_mult': 0.055344869592742776, 'bull_time_stop': 207, 'bull_use_sma': True, 'bull_use_ema': True, 'bull_use_atr': False, 'bull_use_adx': True, 'bull_use_spike': False, 'bull_rsi_required': True, 'bear_strategy': 'breakout', 'bear_bb_std_mult': 1.1170196474515732, 'bear_rsi_os': 31, 'bear_rsi_ob': 48, 'bear_adx_thresh': 5.7236524114313845, 'bear_atr_min_pct': 0.017543879962374484, 'bear_atr_max_pct': 0.05167713728128018, 'bear_tp_mult': 1.0110906896374778, 'bear_tsl_mult': 0.5433931268904466, 'bear_time_stop': 14, 'bear_use_sma': True, 'bear_use_ema': True, 'bear_use_atr': False, 'bear_use_adx': True, 'bear_use_spike': True, 'bear_rsi_required': False, 'sideways_strategy': 'breakout', 'sideways_bb_std_mult': 1.8940377395989505, 'sideways_rsi_os': 20, 'sideways_rsi_ob': 91, 'sideways_adx_thresh': 19.140288139514396, 'sideways_atr_min_pct': 0.005120649795419821, 'sideways_atr_max_pct': 0.0474486719671075, 'sideways_tp_mult': 2.7898659333748284, 'sideways_tsl_mult': 0.6271714727711544, 'sideways_time_stop': 247, 'sideways_use_sma': False, 'sideways_use_ema': True, 'sideways_use_atr': True, 'sideways_use_adx': False, 'sideways_use_spike': False, 'sideways_rsi_required': False}.
[I 2025-08-29 20:05:48,637] Trial 249 finished with values: [-0.007367829127996273, 0.007351184799848145] and parameters: {'p_sma': 14, 'p_std': 15, 'p_atr': 24, 'p_adx': 30, 'rsi_period': 45, 'ema1': 20, 'ema2': 47, 'slip_atr_k': 0.13370295356368478, 'slip_spread_k': 0.07551904528651554, 'spread_hl_frac': 0.0013945763584284044, 'bb_std_mult': 3.5974220105655266, 'rsi_os': 18, 'rsi_ob': 66, 'vol_spike': 0.17479009863559927, 'adx_thresh': 30.198791798948154, 'atr_min_pct': 0.014002733204549795, 'atr_max_pct': 0.04737686325069657, 'tp_mult': 1.482273980427807, 'tsl_mult': 0.029762095460788562, 'strategy': 'mean_reversion', 'time_stop': 188, 'use_sma': True, 'use_atr': True, 'use_adx': False, 'use_ema': True, 'use_spike': True, 'rsi_required': True, 'edge_k': 1.2260280810854287, 'edge_cap': 0.46846699527879204, 'bull_strategy': 'mean_reversion', 'bull_bb_std_mult': 1.620080782347369, 'bull_rsi_os': 9, 'bull_rsi_ob': 49, 'bull_adx_thresh': 17.288752063298407, 'bull_atr_min_pct': 0.0009287811748549465, 'bull_atr_max_pct': 0.02524686786368957, 'bull_tp_mult': 1.48165244867312, 'bull_tsl_mult': 0.9619977389332823, 'bull_time_stop': 187, 'bull_use_sma': True, 'bull_use_ema': True, 'bull_use_atr': False, 'bull_use_adx': False, 'bull_use_spike': False, 'bull_rsi_required': True, 'bear_strategy': 'breakout', 'bear_bb_std_mult': 1.1339983623084993, 'bear_rsi_os': 31, 'bear_rsi_ob': 81, 'bear_adx_thresh': 10.795404342648384, 'bear_atr_min_pct': 0.005951445438597044, 'bear_atr_max_pct': 0.11262931784660347, 'bear_tp_mult': 1.1694096099811755, 'bear_tsl_mult': 0.5466117114585989, 'bear_time_stop': 198, 'bear_use_sma': True, 'bear_use_ema': True, 'bear_use_atr': False, 'bear_use_adx': True, 'bear_use_spike': True, 'bear_rsi_required': False, 'sideways_strategy': 'breakout', 'sideways_bb_std_mult': 1.9160710793774676, 'sideways_rsi_os': 17, 'sideways_rsi_ob': 75, 'sideways_adx_thresh': 19.161499957991403, 'sideways_atr_min_pct': 0.004797637626667746, 'sideways_atr_max_pct': 0.07137500366806247, 'sideways_tp_mult': 2.6997255430470366, 'sideways_tsl_mult': 0.6207366931876244, 'sideways_time_stop': 248, 'sideways_use_sma': False, 'sideways_use_ema': False, 'sideways_use_atr': True, 'sideways_use_adx': False, 'sideways_use_spike': False, 'sideways_rsi_required': False}.
[I 2025-08-29 20:05:48,891] Trial 246 finished with values: [-0.0032927753455808118, 0.0034493317936435505] and parameters: {'p_sma': 40, 'p_std': 52, 'p_atr': 24, 'p_adx': 17, 'rsi_period': 35, 'ema1': 16, 'ema2': 46, 'slip_atr_k': 0.1334308219885696, 'slip_spread_k': 0.6736142885877623, 'spread_hl_frac': 0.0017597125457291943, 'bb_std_mult': 1.1406157367571914, 'rsi_os': 19, 'rsi_ob': 66, 'vol_spike': 0.17537368687985297, 'adx_thresh': 29.860531963992383, 'atr_min_pct': 0.01408002148403702, 'atr_max_pct': 0.03490290239847805, 'tp_mult': 1.7723811644409255, 'tsl_mult': 0.023469688471195183, 'strategy': 'mean_reversion', 'time_stop': 192, 'use_sma': True, 'use_atr': True, 'use_adx': False, 'use_ema': True, 'use_spike': True, 'rsi_required': True, 'edge_k': 1.2164324424149635, 'edge_cap': 0.4822014992045896, 'bull_strategy': 'mean_reversion', 'bull_bb_std_mult': 1.6324200630484051, 'bull_rsi_os': 38, 'bull_rsi_ob': 45, 'bull_adx_thresh': 26.869483339389777, 'bull_atr_min_pct': 0.0009305912421896211, 'bull_atr_max_pct': 0.017152418288350416, 'bull_tp_mult': 1.4651114918936161, 'bull_tsl_mult': 0.13859818648714203, 'bull_time_stop': 201, 'bull_use_sma': True, 'bull_use_ema': True, 'bull_use_atr': False, 'bull_use_adx': False, 'bull_use_spike': False, 'bull_rsi_required': True, 'bear_strategy': 'breakout', 'bear_bb_std_mult': 1.140433241920318, 'bear_rsi_os': 31, 'bear_rsi_ob': 69, 'bear_adx_thresh': 5.817587002816155, 'bear_atr_min_pct': 0.005837998151995346, 'bear_atr_max_pct': 0.11254167840599588, 'bear_tp_mult': 1.1695884235472063, 'bear_tsl_mult': 0.5048916733114454, 'bear_time_stop': 12, 'bear_use_sma': False, 'bear_use_ema': True, 'bear_use_atr': False, 'bear_use_adx': True, 'bear_use_spike': True, 'bear_rsi_required': False, 'sideways_strategy': 'mean_reversion', 'sideways_bb_std_mult': 1.6131513509117956, 'sideways_rsi_os': 20, 'sideways_rsi_ob': 49, 'sideways_adx_thresh': 18.128441985035025, 'sideways_atr_min_pct': 0.005484062883794956, 'sideways_atr_max_pct': 0.07199046134241158, 'sideways_tp_mult': 2.698761556534619, 'sideways_tsl_mult': 0.8923439728543889, 'sideways_time_stop': 237, 'sideways_use_sma': False, 'sideways_use_ema': False, 'sideways_use_atr': True, 'sideways_use_adx': False, 'sideways_use_spike': True, 'sideways_rsi_required': False}.
[I 2025-08-29 20:05:49,139] Trial 248 finished with values: [-0.016093611037045985, 0.016047776305950882] and parameters: {'p_sma': 44, 'p_std': 29, 'p_atr': 24, 'p_adx': 17, 'rsi_period': 36, 'ema1': 22, 'ema2': 49, 'slip_atr_k': 0.10411356859138318, 'slip_spread_k': 0.252469581338786, 'spread_hl_frac': 0.0027144917324779818, 'bb_std_mult': 1.1160165871219876, 'rsi_os': 18, 'rsi_ob': 87, 'vol_spike': 0.18996705725020216, 'adx_thresh': 29.671105889831605, 'atr_min_pct': 0.02045525595794085, 'atr_max_pct': 0.03378566487728277, 'tp_mult': 1.5741663296589918, 'tsl_mult': 0.3917044268327418, 'strategy': 'mean_reversion', 'time_stop': 165, 'use_sma': True, 'use_atr': True, 'use_adx': False, 'use_ema': True, 'use_spike': False, 'rsi_required': True, 'edge_k': 1.2353258894330312, 'edge_cap': 0.4786751515974643, 'bull_strategy': 'mean_reversion', 'bull_bb_std_mult': 1.600004994741151, 'bull_rsi_os': 34, 'bull_rsi_ob': 49, 'bull_adx_thresh': 17.19193119059816, 'bull_atr_min_pct': 0.0008822283499280631, 'bull_atr_max_pct': 0.031179355173661133, 'bull_tp_mult': 1.4903646825272103, 'bull_tsl_mult': 0.07906336079353066, 'bull_time_stop': 184, 'bull_use_sma': True, 'bull_use_ema': True, 'bull_use_atr': False, 'bull_use_adx': True, 'bull_use_spike': False, 'bull_rsi_required': True, 'bear_strategy': 'breakout', 'bear_bb_std_mult': 0.8286823212543162, 'bear_rsi_os': 30, 'bear_rsi_ob': 76, 'bear_adx_thresh': 5.756701235973068, 'bear_atr_min_pct': 0.0030099534889418723, 'bear_atr_max_pct': 0.12466366440755298, 'bear_tp_mult': 1.0715195858835316, 'bear_tsl_mult': 0.5495474903505412, 'bear_time_stop': 78, 'bear_use_sma': True, 'bear_use_ema': True, 'bear_use_atr': False, 'bear_use_adx': True, 'bear_use_spike': True, 'bear_rsi_required': False, 'sideways_strategy': 'breakout', 'sideways_bb_std_mult': 1.925232162090244, 'sideways_rsi_os': 19, 'sideways_rsi_ob': 62, 'sideways_adx_thresh': 19.002662311165018, 'sideways_atr_min_pct': 0.0059663961971406386, 'sideways_atr_max_pct': 0.044409100502552125, 'sideways_tp_mult': 2.766720779743718, 'sideways_tsl_mult': 0.6105131193736708, 'sideways_time_stop': 247, 'sideways_use_sma': False, 'sideways_use_ema': True, 'sideways_use_atr': True, 'sideways_use_adx': False, 'sideways_use_spike': False, 'sideways_rsi_required': False}.
[I 2025-08-29 20:06:18,542] Trial 251 finished with values: [-1000000000.0, 1000000000.0] and parameters: {'p_sma': 6, 'p_std': 21, 'p_atr': 8, 'p_adx': 17, 'rsi_period': 42, 'ema1': 21, 'ema2': 46, 'slip_atr_k': 0.042117079823023366, 'slip_spread_k': 0.13641025900064618, 'spread_hl_frac': 0.002908654287641815, 'bb_std_mult': 1.121640000203012, 'rsi_os': 19, 'rsi_ob': 54, 'vol_spike': 0.04912105459187911, 'adx_thresh': 29.673515844191403, 'atr_min_pct': 0.006038106076645629, 'atr_max_pct': 0.05460078787719298, 'tp_mult': 1.8857295739580302, 'tsl_mult': 0.3952049402100222, 'strategy': 'breakout', 'time_stop': 159, 'use_sma': True, 'use_atr': False, 'use_adx': True, 'use_ema': False, 'use_spike': False, 'rsi_required': True, 'edge_k': 0.41938735267775884, 'edge_cap': 0.5262518477745293, 'bull_strategy': 'mean_reversion', 'bull_bb_std_mult': 1.5380804081410877, 'bull_rsi_os': 40, 'bull_rsi_ob': 63, 'bull_adx_thresh': 18.860178053708825, 'bull_atr_min_pct': 0.0012867356704110275, 'bull_atr_max_pct': 0.028190482048984694, 'bull_tp_mult': 1.4876621994444938, 'bull_tsl_mult': 0.13763308998185333, 'bull_time_stop': 183, 'bull_use_sma': True, 'bull_use_ema': True, 'bull_use_atr': False, 'bull_use_adx': True, 'bull_use_spike': True, 'bull_rsi_required': False, 'bear_strategy': 'mean_reversion', 'bear_bb_std_mult': 2.587616643882479, 'bear_rsi_os': 30, 'bear_rsi_ob': 69, 'bear_adx_thresh': 26.530185098813835, 'bear_atr_min_pct': 0.003017785012568096, 'bear_atr_max_pct': 0.03356202333334592, 'bear_tp_mult': 1.0668480074319695, 'bear_tsl_mult': 0.43213275196030104, 'bear_time_stop': 12, 'bear_use_sma': False, 'bear_use_ema': True, 'bear_use_atr': True, 'bear_use_adx': False, 'bear_use_spike': True, 'bear_rsi_required': True, 'sideways_strategy': 'mean_reversion', 'sideways_bb_std_mult': 2.393703060812126, 'sideways_rsi_os': 14, 'sideways_rsi_ob': 62, 'sideways_adx_thresh': 20.766325224958337, 'sideways_atr_min_pct': 0.005936332125965213, 'sideways_atr_max_pct': 0.06141383297615326, 'sideways_tp_mult': 2.9300242951107305, 'sideways_tsl_mult': 0.7168659112460297, 'sideways_time_stop': 241, 'sideways_use_sma': True, 'sideways_use_ema': True, 'sideways_use_atr': False, 'sideways_use_adx': False, 'sideways_use_spike': False, 'sideways_rsi_required': False}.
[I 2025-08-29 20:06:18,873] Trial 253 finished with values: [-1000000000.0, 1000000000.0] and parameters: {'p_sma': 5, 'p_std': 46, 'p_atr': 25, 'p_adx': 17, 'rsi_period': 47, 'ema1': 21, 'ema2': 46, 'slip_atr_k': 0.16176113702297673, 'slip_spread_k': 0.042464685674663466, 'spread_hl_frac': 0.001372569393054099, 'bb_std_mult': 3.068706025328972, 'rsi_os': 45, 'rsi_ob': 54, 'vol_spike': 0.17538492277552964, 'adx_thresh': 31.993303031002313, 'atr_min_pct': 0.013310424969919096, 'atr_max_pct': 0.029700571696572343, 'tp_mult': 1.7496050352203505, 'tsl_mult': 0.7970058534895174, 'strategy': 'breakout', 'time_stop': 220, 'use_sma': True, 'use_atr': False, 'use_adx': True, 'use_ema': False, 'use_spike': True, 'rsi_required': True, 'edge_k': 1.1351287529974958, 'edge_cap': 0.7937779032611113, 'bull_strategy': 'mean_reversion', 'bull_bb_std_mult': 1.5299899821324456, 'bull_rsi_os': 40, 'bull_rsi_ob': 93, 'bull_adx_thresh': 28.79621154622896, 'bull_atr_min_pct': 0.0028735994216311732, 'bull_atr_max_pct': 0.01987670492105395, 'bull_tp_mult': 1.5394711318600043, 'bull_tsl_mult': 0.1334677233822799, 'bull_time_stop': 138, 'bull_use_sma': True, 'bull_use_ema': True, 'bull_use_atr': False, 'bull_use_adx': False, 'bull_use_spike': True, 'bull_rsi_required': False, 'bear_strategy': 'mean_reversion', 'bear_bb_std_mult': 1.8509272194768789, 'bear_rsi_os': 42, 'bear_rsi_ob': 69, 'bear_adx_thresh': 7.168346213462391, 'bear_atr_min_pct': 0.022009192875208892, 'bear_atr_max_pct': 0.11311743648249897, 'bear_tp_mult': 1.056363525329115, 'bear_tsl_mult': 0.4327855862728896, 'bear_time_stop': 11, 'bear_use_sma': False, 'bear_use_ema': True, 'bear_use_atr': True, 'bear_use_adx': False, 'bear_use_spike': True, 'bear_rsi_required': True, 'sideways_strategy': 'mean_reversion', 'sideways_bb_std_mult': 2.3840887989867827, 'sideways_rsi_os': 18, 'sideways_rsi_ob': 49, 'sideways_adx_thresh': 20.73086657512333, 'sideways_atr_min_pct': 0.005960718944636113, 'sideways_atr_max_pct': 0.06351065310196809, 'sideways_tp_mult': 2.708891892354893, 'sideways_tsl_mult': 0.8286342211312572, 'sideways_time_stop': 238, 'sideways_use_sma': True, 'sideways_use_ema': False, 'sideways_use_atr': False, 'sideways_use_adx': False, 'sideways_use_spike': True, 'sideways_rsi_required': False}.
