[I 2025-08-29 20:54:42,724] Trial 675 finished with values: [-1000000000.0, 1000000000.0] and parameters: {'p_sma': 18, 'p_std': 33, 'p_atr': 25, 'p_adx': 15, 'rsi_period': 80, 'ema1': 27, 'ema2': 46, 'slip_atr_k': 0.008057512408244195, 'slip_spread_k': 0.43622797669777214, 'spread_hl_frac': 0.04999745126990589, 'bb_std_mult': 1.6503329889031433, 'rsi_os': 10, 'rsi_ob': 48, 'vol_spike': 0.0651674628418587, 'adx_thresh': 12.443428206501817, 'atr_min_pct': 0.019866125061660092, 'atr_max_pct': 0.1330388927840504, 'tp_mult': 2.340499721799008, 'tsl_mult': 0.8707332652533487, 'strategy': 'breakout', 'time_stop': 139, 'use_sma': True, 'use_atr': True, 'use_adx': False, 'use_ema': True, 'use_spike': True, 'rsi_required': False, 'edge_k': 0.6100209366823504, 'edge_cap': 0.5665798217927309, 'bull_strategy': 'mean_reversion', 'bull_bb_std_mult': 3.080564962526336, 'bull_rsi_os': 6, 'bull_rsi_ob': 61, 'bull_adx_thresh': 12.335526079695143, 'bull_atr_min_pct': 0.02320396447184635, 'bull_atr_max_pct': 0.12783001515738007, 'bull_tp_mult': 2.8008973020966565, 'bull_tsl_mult': 0.8893315334550754, 'bull_time_stop': 114, 'bull_use_sma': True, 'bull_use_ema': True, 'bull_use_atr': False, 'bull_use_adx': False, 'bull_use_spike': True, 'bull_rsi_required': False, 'bear_strategy': 'mean_reversion', 'bear_bb_std_mult': 1.644442730860269, 'bear_rsi_os': 28, 'bear_rsi_ob': 70, 'bear_adx_thresh': 34.920663095897915, 'bear_atr_min_pct': 0.006535603960391578, 'bear_atr_max_pct': 0.01249629710848213, 'bear_tp_mult': 2.7354009591181203, 'bear_tsl_mult': 0.601178001124252, 'bear_time_stop': 51, 'bear_use_sma': False, 'bear_use_ema': True, 'bear_use_atr': False, 'bear_use_adx': True, 'bear_use_spike': True, 'bear_rsi_required': True, 'sideways_strategy': 'breakout', 'sideways_bb_std_mult': 0.821967471470773, 'sideways_rsi_os': 50, 'sideways_rsi_ob': 63, 'sideways_adx_thresh': 32.375196180017156, 'sideways_atr_min_pct': 0.006690810282968996, 'sideways_atr_max_pct': 0.025629084149349193, 'sideways_tp_mult': 1.1854818113249292, 'sideways_tsl_mult': 0.7266860755054058, 'sideways_time_stop': 137, 'sideways_use_sma': True, 'sideways_use_ema': True, 'sideways_use_atr': True, 'sideways_use_adx': False, 'sideways_use_spike': False, 'sideways_rsi_required': True}.
[I 2025-08-29 20:55:11,743] Trial 677 finished with values: [-0.002411879869163025, 0.0024017774491807177] and parameters: {'p_sma': 58, 'p_std': 59, 'p_atr': 17, 'p_adx': 21, 'rsi_period': 42, 'ema1': 26, 'ema2': 46, 'slip_atr_k': 0.004729884671275263, 'slip_spread_k': 0.4279936394250822, 'spread_hl_frac': 0.03659591046841434, 'bb_std_mult': 3.0484798257321186, 'rsi_os': 6, 'rsi_ob': 48, 'vol_spike': 0.19270474152503456, 'adx_thresh': 12.249577438354484, 'atr_min_pct': 0.020941570658870288, 'atr_max_pct': 0.021156446798481887, 'tp_mult': 1.5106690169851003, 'tsl_mult': 0.8734399010152962, 'strategy': 'breakout', 'time_stop': 150, 'use_sma': False, 'use_atr': True, 'use_adx': False, 'use_ema': True, 'use_spike': False, 'rsi_required': True, 'edge_k': 1.1037860345162684, 'edge_cap': 0.0965829952272308, 'bull_strategy': 'breakout', 'bull_bb_std_mult': 2.9014841364295663, 'bull_rsi_os': 7, 'bull_rsi_ob': 78, 'bull_adx_thresh': 12.551029730851491, 'bull_atr_min_pct': 0.014204713373446608, 'bull_atr_max_pct': 0.05502457586234417, 'bull_tp_mult': 2.8954563479879214, 'bull_tsl_mult': 0.9125741519300973, 'bull_time_stop': 228, 'bull_use_sma': False, 'bull_use_ema': False, 'bull_use_atr': False, 'bull_use_adx': True, 'bull_use_spike': True, 'bull_rsi_required': False, 'bear_strategy': 'mean_reversion', 'bear_bb_std_mult': 2.675457640808173, 'bear_rsi_os': 28, 'bear_rsi_ob': 66, 'bear_adx_thresh': 19.841782867368845, 'bear_atr_min_pct': 0.007142882910587674, 'bear_atr_max_pct': 0.044984667450621324, 'bear_tp_mult': 2.5556019471081184, 'bear_tsl_mult': 0.7897037479755417, 'bear_time_stop': 166, 'bear_use_sma': True, 'bear_use_ema': False, 'bear_use_atr': True, 'bear_use_adx': True, 'bear_use_spike': False, 'bear_rsi_required': True, 'sideways_strategy': 'breakout', 'sideways_bb_std_mult': 0.8066372281952541, 'sideways_rsi_os': 49, 'sideways_rsi_ob': 71, 'sideways_adx_thresh': 13.958858282101687, 'sideways_atr_min_pct': 0.005028327211116199, 'sideways_atr_max_pct': 0.1378024061798565, 'sideways_tp_mult': 2.166744196042541, 'sideways_tsl_mult': 0.7830825550806989, 'sideways_time_stop': 98, 'sideways_use_sma': True, 'sideways_use_ema': False, 'sideways_use_atr': True, 'sideways_use_adx': True, 'sideways_use_spike': True, 'sideways_rsi_required': False}.
[I 2025-08-29 20:55:12,183] Trial 679 finished with values: [-1000000000.0, 1000000000.0] and parameters: {'p_sma': 20, 'p_std': 59, 'p_atr': 10, 'p_adx': 12, 'rsi_period': 30, 'ema1': 30, 'ema2': 45, 'slip_atr_k': 0.0035785090259743413, 'slip_spread_k': 0.18530744999731358, 'spread_hl_frac': 0.04832026242716056, 'bb_std_mult': 3.0566865257071183, 'rsi_os': 6, 'rsi_ob': 83, 'vol_spike': 0.19068011514718752, 'adx_thresh': 13.794350619359285, 'atr_min_pct': 0.02062263434868425, 'atr_max_pct': 0.035271296875808426, 'tp_mult': 1.5277129454000096, 'tsl_mult': 0.07885112848545789, 'strategy': 'mean_reversion', 'time_stop': 187, 'use_sma': False, 'use_atr': False, 'use_adx': True, 'use_ema': True, 'use_spike': False, 'rsi_required': True, 'edge_k': 1.038332880576232, 'edge_cap': 0.6517509910437895, 'bull_strategy': 'breakout', 'bull_bb_std_mult': 1.25773547187227, 'bull_rsi_os': 26, 'bull_rsi_ob': 73, 'bull_adx_thresh': 21.86696112046666, 'bull_atr_min_pct': 0.018707584102351533, 'bull_atr_max_pct': 0.05335013541066916, 'bull_tp_mult': 2.8831161291339256, 'bull_tsl_mult': 0.2723205395608761, 'bull_time_stop': 40, 'bull_use_sma': False, 'bull_use_ema': False, 'bull_use_atr': False, 'bull_use_adx': True, 'bull_use_spike': True, 'bull_rsi_required': True, 'bear_strategy': 'mean_reversion', 'bear_bb_std_mult': 2.6758480719928808, 'bear_rsi_os': 26, 'bear_rsi_ob': 65, 'bear_adx_thresh': 21.330270531388294, 'bear_atr_min_pct': 0.0071952470385797124, 'bear_atr_max_pct': 0.09157903620802149, 'bear_tp_mult': 1.3276423592209812, 'bear_tsl_mult': 0.8697430085942502, 'bear_time_stop': 44, 'bear_use_sma': False, 'bear_use_ema': False, 'bear_use_atr': True, 'bear_use_adx': True, 'bear_use_spike': False, 'bear_rsi_required': True, 'sideways_strategy': 'mean_reversion', 'sideways_bb_std_mult': 2.8713422484943467, 'sideways_rsi_os': 48, 'sideways_rsi_ob': 71, 'sideways_adx_thresh': 14.024077650432908, 'sideways_atr_min_pct': 0.017947083994481042, 'sideways_atr_max_pct': 0.020832167267971567, 'sideways_tp_mult': 2.998558535279547, 'sideways_tsl_mult': 0.6768071961289303, 'sideways_time_stop': 174, 'sideways_use_sma': False, 'sideways_use_ema': False, 'sideways_use_atr': True, 'sideways_use_adx': False, 'sideways_use_spike': True, 'sideways_rsi_required': False}.
[I 2025-08-29 20:55:12,401] Trial 678 finished with values: [-1000000000.0, 1000000000.0] and parameters: {'p_sma': 20, 'p_std': 59, 'p_atr': 19, 'p_adx': 21, 'rsi_period': 43, 'ema1': 26, 'ema2': 28, 'slip_atr_k': 0.004747910666382983, 'slip_spread_k': 0.42661290367448595, 'spread_hl_frac': 0.02418705909102571, 'bb_std_mult': 3.044834579641949, 'rsi_os': 8, 'rsi_ob': 83, 'vol_spike': 0.0658885218742512, 'adx_thresh': 8.403304131020718, 'atr_min_pct': 0.02079432088241466, 'atr_max_pct': 0.09262076937755392, 'tp_mult': 2.343361550874685, 'tsl_mult': 0.3128742830171547, 'strategy': 'breakout', 'time_stop': 151, 'use_sma': False, 'use_atr': True, 'use_adx': True, 'use_ema': True, 'use_spike': False, 'rsi_required': True, 'edge_k': 1.6004686032179523, 'edge_cap': 0.6370836516833818, 'bull_strategy': 'breakout', 'bull_bb_std_mult': 2.8538158731872194, 'bull_rsi_os': 26, 'bull_rsi_ob': 78, 'bull_adx_thresh': 12.33272871054557, 'bull_atr_min_pct': 0.02308580542072409, 'bull_atr_max_pct': 0.017144670748801716, 'bull_tp_mult': 2.8148576502699996, 'bull_tsl_mult': 0.9137000830124518, 'bull_time_stop': 28, 'bull_use_sma': False, 'bull_use_ema': False, 'bull_use_atr': False, 'bull_use_adx': True, 'bull_use_spike': True, 'bull_rsi_required': True, 'bear_strategy': 'mean_reversion', 'bear_bb_std_mult': 2.744602061176048, 'bear_rsi_os': 28, 'bear_rsi_ob': 73, 'bear_adx_thresh': 21.534316489215072, 'bear_atr_min_pct': 0.007235905149331011, 'bear_atr_max_pct': 0.12787413727250788, 'bear_tp_mult': 2.73878183553137, 'bear_tsl_mult': 0.9176721036938802, 'bear_time_stop': 45, 'bear_use_sma': False, 'bear_use_ema': False, 'bear_use_atr': True, 'bear_use_adx': True, 'bear_use_spike': False, 'bear_rsi_required': True, 'sideways_strategy': 'mean_reversion', 'sideways_bb_std_mult': 2.884239421507011, 'sideways_rsi_os': 48, 'sideways_rsi_ob': 80, 'sideways_adx_thresh': 32.67523494999582, 'sideways_atr_min_pct': 0.0067329685964027195, 'sideways_atr_max_pct': 0.13766918716562784, 'sideways_tp_mult': 2.1700156818434673, 'sideways_tsl_mult': 0.7200359327009663, 'sideways_time_stop': 142, 'sideways_use_sma': True, 'sideways_use_ema': False, 'sideways_use_atr': True, 'sideways_use_adx': False, 'sideways_use_spike': True, 'sideways_rsi_required': False}.
[I 2025-08-29 20:55:12,471] Trial 676 finished with values: [-1000000000.0, 1000000000.0] and parameters: {'p_sma': 18, 'p_std': 59, 'p_atr': 25, 'p_adx': 25, 'rsi_period': 39, 'ema1': 6, 'ema2': 36, 'slip_atr_k': 0.007669483693240156, 'slip_spread_k': 0.18805346130951778, 'spread_hl_frac': 0.036963990083526424, 'bb_std_mult': 1.6442485611348479, 'rsi_os': 16, 'rsi_ob': 48, 'vol_spike': 0.06476389836966359, 'adx_thresh': 12.346553335458037, 'atr_min_pct': 0.019691729987267644, 'atr_max_pct': 0.036437825903277744, 'tp_mult': 1.5158508881419992, 'tsl_mult': 0.8692424126579202, 'strategy': 'breakout', 'time_stop': 189, 'use_sma': False, 'use_atr': True, 'use_adx': False, 'use_ema': True, 'use_spike': False, 'rsi_required': True, 'edge_k': 0.5068853012685146, 'edge_cap': 0.6186645934595034, 'bull_strategy': 'breakout', 'bull_bb_std_mult': 2.6536552465498904, 'bull_rsi_os': 47, 'bull_rsi_ob': 73, 'bull_adx_thresh': 21.43769152900915, 'bull_atr_min_pct': 0.022939813733467828, 'bull_atr_max_pct': 0.1279472516693632, 'bull_tp_mult': 2.888710594682263, 'bull_tsl_mult': 0.896687086335791, 'bull_time_stop': 115, 'bull_use_sma': False, 'bull_use_ema': False, 'bull_use_atr': False, 'bull_use_adx': False, 'bull_use_spike': True, 'bull_rsi_required': False, 'bear_strategy': 'mean_reversion', 'bear_bb_std_mult': 2.6861225254714762, 'bear_rsi_os': 28, 'bear_rsi_ob': 58, 'bear_adx_thresh': 19.941645255110625, 'bear_atr_min_pct': 0.006482711655365913, 'bear_atr_max_pct': 0.05278948465581851, 'bear_tp_mult': 2.6800868906600597, 'bear_tsl_mult': 0.7826186740571556, 'bear_time_stop': 51, 'bear_use_sma': False, 'bear_use_ema': True, 'bear_use_atr': False, 'bear_use_adx': True, 'bear_use_spike': False, 'bear_rsi_required': True, 'sideways_strategy': 'breakout', 'sideways_bb_std_mult': 1.3923228439987168, 'sideways_rsi_os': 48, 'sideways_rsi_ob': 80, 'sideways_adx_thresh': 32.36392918601868, 'sideways_atr_min_pct': 0.017761634586378246, 'sideways_atr_max_pct': 0.012538499638155695, 'sideways_tp_mult': 2.5631659678003427, 'sideways_tsl_mult': 0.6265668316648729, 'sideways_time_stop': 212, 'sideways_use_sma': True, 'sideways_use_ema': True, 'sideways_use_atr': True, 'sideways_use_adx': False, 'sideways_use_spike': True, 'sideways_rsi_required': False}.
[I 2025-08-29 20:55:40,863] Trial 682 finished with values: [-0.0030954917650486413, 0.00423096658900579] and parameters: {'p_sma': 14, 'p_std': 53, 'p_atr': 26, 'p_adx': 7, 'rsi_period': 39, 'ema1': 11, 'ema2': 44, 'slip_atr_k': 0.00019184042949266418, 'slip_spread_k': 0.21188911926880472, 'spread_hl_frac': 0.047419653674954355, 'bb_std_mult': 1.765392827046557, 'rsi_os': 48, 'rsi_ob': 85, 'vol_spike': 0.21900438956505758, 'adx_thresh': 14.17848462078511, 'atr_min_pct': 0.02807818541347541, 'atr_max_pct': 0.040256523635392144, 'tp_mult': 1.407100566377973, 'tsl_mult': 0.9360655142944349, 'strategy': 'mean_reversion', 'time_stop': 111, 'use_sma': True, 'use_atr': False, 'use_adx': False, 'use_ema': True, 'use_spike': False, 'rsi_required': False, 'edge_k': 0.5107672021556018, 'edge_cap': 0.12438173924618812, 'bull_strategy': 'mean_reversion', 'bull_bb_std_mult': 3.026808100151195, 'bull_rsi_os': 49, 'bull_rsi_ob': 88, 'bull_adx_thresh': 14.80248586666443, 'bull_atr_min_pct': 0.017317093884995326, 'bull_atr_max_pct': 0.11894915206679063, 'bull_tp_mult': 2.1238826691280255, 'bull_tsl_mult': 0.766889420865046, 'bull_time_stop': 259, 'bull_use_sma': True, 'bull_use_ema': False, 'bull_use_atr': True, 'bull_use_adx': False, 'bull_use_spike': True, 'bull_rsi_required': False, 'bear_strategy': 'breakout', 'bear_bb_std_mult': 2.607001763525677, 'bear_rsi_os': 29, 'bear_rsi_ob': 49, 'bear_adx_thresh': 31.021734517257343, 'bear_atr_min_pct': 0.0061754743213981575, 'bear_atr_max_pct': 0.035832303867974126, 'bear_tp_mult': 2.232460399661161, 'bear_tsl_mult': 0.3316496126334999, 'bear_time_stop': 74, 'bear_use_sma': False, 'bear_use_ema': True, 'bear_use_atr': False, 'bear_use_adx': True, 'bear_use_spike': True, 'bear_rsi_required': False, 'sideways_strategy': 'breakout', 'sideways_bb_std_mult': 1.3679029411045929, 'sideways_rsi_os': 47, 'sideways_rsi_ob': 54, 'sideways_adx_thresh': 16.050925799501634, 'sideways_atr_min_pct': 0.0030227627164776966, 'sideways_atr_max_pct': 0.023893478056134645, 'sideways_tp_mult': 1.0853546793451818, 'sideways_tsl_mult': 0.6196191057889359, 'sideways_time_stop': 85, 'sideways_use_sma': False, 'sideways_use_ema': False, 'sideways_use_atr': False, 'sideways_use_adx': False, 'sideways_use_spike': False, 'sideways_rsi_required': False}.
[I 2025-08-29 20:55:41,033] Trial 680 finished with values: [-1000000000.0, 1000000000.0] and parameters: {'p_sma': 20, 'p_std': 5, 'p_atr': 26, 'p_adx': 12, 'rsi_period': 39, 'ema1': 24, 'ema2': 44, 'slip_atr_k': 0.005383788959016455, 'slip_spread_k': 0.17492216934723218, 'spread_hl_frac': 0.04754127514193581, 'bb_std_mult': 1.9004345992851168, 'rsi_os': 8, 'rsi_ob': 83, 'vol_spike': 0.22989681254101635, 'adx_thresh': 14.514818605475593, 'atr_min_pct': 0.00776610700321523, 'atr_max_pct': 0.03537719703699089, 'tp_mult': 1.5213401935086242, 'tsl_mult': 0.7308204613678536, 'strategy': 'mean_reversion', 'time_stop': 113, 'use_sma': False, 'use_atr': False, 'use_adx': True, 'use_ema': True, 'use_spike': False, 'rsi_required': True, 'edge_k': 0.7115619649242535, 'edge_cap': 0.6452002354931456, 'bull_strategy': 'breakout', 'bull_bb_std_mult': 2.6247267284480555, 'bull_rsi_os': 51, 'bull_rsi_ob': 74, 'bull_adx_thresh': 14.534262290619308, 'bull_atr_min_pct': 0.01870410610102001, 'bull_atr_max_pct': 0.09517388633187278, 'bull_tp_mult': 2.7531266069685785, 'bull_tsl_mult': 0.2815797520914418, 'bull_time_stop': 217, 'bull_use_sma': False, 'bull_use_ema': False, 'bull_use_atr': True, 'bull_use_adx': True, 'bull_use_spike': True, 'bull_rsi_required': True, 'bear_strategy': 'breakout', 'bear_bb_std_mult': 2.740581796501782, 'bear_rsi_os': 26, 'bear_rsi_ob': 58, 'bear_adx_thresh': 21.763111381840762, 'bear_atr_min_pct': 0.007520238312461135, 'bear_atr_max_pct': 0.054005851670279506, 'bear_tp_mult': 2.6695995868354934, 'bear_tsl_mult': 0.36605372903543, 'bear_time_stop': 44, 'bear_use_sma': False, 'bear_use_ema': False, 'bear_use_atr': False, 'bear_use_adx': True, 'bear_use_spike': False, 'bear_rsi_required': False, 'sideways_strategy': 'mean_reversion', 'sideways_bb_std_mult': 1.3742882638279572, 'sideways_rsi_os': 48, 'sideways_rsi_ob': 80, 'sideways_adx_thresh': 33.15760864163413, 'sideways_atr_min_pct': 0.0030549770120147225, 'sideways_atr_max_pct': 0.023169722430699972, 'sideways_tp_mult': 2.573357024314302, 'sideways_tsl_mult': 0.6244463558551481, 'sideways_time_stop': 84, 'sideways_use_sma': False, 'sideways_use_ema': False, 'sideways_use_atr': False, 'sideways_use_adx': False, 'sideways_use_spike': True, 'sideways_rsi_required': False}.
[I 2025-08-29 20:55:41,305] Trial 681 finished with values: [-0.0392818044504738, 0.03926561578768583] and parameters: {'p_sma': 22, 'p_std': 55, 'p_atr': 16, 'p_adx': 13, 'rsi_period': 39, 'ema1': 6, 'ema2': 43, 'slip_atr_k': 0.004495063593040026, 'slip_spread_k': 0.2136594409481697, 'spread_hl_frac': 0.047544086271206244, 'bb_std_mult': 2.6509893771422712, 'rsi_os': 16, 'rsi_ob': 85, 'vol_spike': 0.18122896344225023, 'adx_thresh': 22.005461666852348, 'atr_min_pct': 0.011712932902685113, 'atr_max_pct': 0.0267722819225867, 'tp_mult': 2.0341178001631444, 'tsl_mult': 0.7269223072885095, 'strategy': 'mean_reversion', 'time_stop': 162, 'use_sma': True, 'use_atr': False, 'use_adx': False, 'use_ema': True, 'use_spike': False, 'rsi_required': False, 'edge_k': 1.0359261603175347, 'edge_cap': 0.9309487958423011, 'bull_strategy': 'mean_reversion', 'bull_bb_std_mult': 3.0266828735983156, 'bull_rsi_os': 49, 'bull_rsi_ob': 74, 'bull_adx_thresh': 8.090229676458618, 'bull_atr_min_pct': 0.015429637238411504, 'bull_atr_max_pct': 0.14110229550714898, 'bull_tp_mult': 2.7632828830892087, 'bull_tsl_mult': 0.8659855684482878, 'bull_time_stop': 209, 'bull_use_sma': True, 'bull_use_ema': False, 'bull_use_atr': True, 'bull_use_adx': False, 'bull_use_spike': True, 'bull_rsi_required': True, 'bear_strategy': 'breakout', 'bear_bb_std_mult': 2.7571861174997485, 'bear_rsi_os': 55, 'bear_rsi_ob': 77, 'bear_adx_thresh': 21.98156470721636, 'bear_atr_min_pct': 0.0019305719387948568, 'bear_atr_max_pct': 0.035605281503985786, 'bear_tp_mult': 1.7027181428444491, 'bear_tsl_mult': 0.3715849732912856, 'bear_time_stop': 78, 'bear_use_sma': False, 'bear_use_ema': True, 'bear_use_atr': False, 'bear_use_adx': True, 'bear_use_spike': True, 'bear_rsi_required': False, 'sideways_strategy': 'breakout', 'sideways_bb_std_mult': 1.4370201767944737, 'sideways_rsi_os': 21, 'sideways_rsi_ob': 79, 'sideways_adx_thresh': 5.14754889978526, 'sideways_atr_min_pct': 0.015741804545776974, 'sideways_atr_max_pct': 0.02283006129069644, 'sideways_tp_mult': 2.302756997335908, 'sideways_tsl_mult': 0.6180506555986317, 'sideways_time_stop': 197, 'sideways_use_sma': False, 'sideways_use_ema': False, 'sideways_use_atr': False, 'sideways_use_adx': False, 'sideways_use_spike': False, 'sideways_rsi_required': False}.
[I 2025-08-29 20:55:41,306] Trial 683 finished with values: [-0.010099616268885447, 0.010134067560983822] and parameters: {'p_sma': 22, 'p_std': 55, 'p_atr': 16, 'p_adx': 13, 'rsi_period': 36, 'ema1': 14, 'ema2': 55, 'slip_atr_k': 0.06206272044625495, 'slip_spread_k': 0.520111597302054, 'spread_hl_frac': 0.04746422339270882, 'bb_std_mult': 1.7570273967490249, 'rsi_os': 11, 'rsi_ob': 85, 'vol_spike': 0.11214047966557028, 'adx_thresh': 25.815232320024627, 'atr_min_pct': 0.0047084603157471865, 'atr_max_pct': 0.026376975223939378, 'tp_mult': 1.597168756307544, 'tsl_mult': 0.2265996439997756, 'strategy': 'mean_reversion', 'time_stop': 162, 'use_sma': True, 'use_atr': False, 'use_adx': False, 'use_ema': True, 'use_spike': False, 'rsi_required': False, 'edge_k': 0.7263045465197935, 'edge_cap': 0.5781038703009973, 'bull_strategy': 'mean_reversion', 'bull_bb_std_mult': 0.9998771124173425, 'bull_rsi_os': 49, 'bull_rsi_ob': 71, 'bull_adx_thresh': 14.72134369362922, 'bull_atr_min_pct': 0.017092404732999052, 'bull_atr_max_pct': 0.05938633529030921, 'bull_tp_mult': 2.7695196313277313, 'bull_tsl_mult': 0.8675553929337207, 'bull_time_stop': 10, 'bull_use_sma': True, 'bull_use_ema': False, 'bull_use_atr': True, 'bull_use_adx': False, 'bull_use_spike': True, 'bull_rsi_required': False, 'bear_strategy': 'breakout', 'bear_bb_std_mult': 2.5881136417649357, 'bear_rsi_os': 29, 'bear_rsi_ob': 68, 'bear_adx_thresh': 15.220538291097366, 'bear_atr_min_pct': 0.006327344408705377, 'bear_atr_max_pct': 0.0868362298195461, 'bear_tp_mult': 1.7746477706202393, 'bear_tsl_mult': 0.1274729867740581, 'bear_time_stop': 130, 'bear_use_sma': False, 'bear_use_ema': True, 'bear_use_atr': False, 'bear_use_adx': True, 'bear_use_spike': True, 'bear_rsi_required': False, 'sideways_strategy': 'breakout', 'sideways_bb_std_mult': 2.3915152094861267, 'sideways_rsi_os': 46, 'sideways_rsi_ob': 79, 'sideways_adx_thresh': 33.10589241325364, 'sideways_atr_min_pct': 0.0032261029768123634, 'sideways_atr_max_pct': 0.02321229247487295, 'sideways_tp_mult': 1.7912222891670802, 'sideways_tsl_mult': 0.7000112525640304, 'sideways_time_stop': 124, 'sideways_use_sma': False, 'sideways_use_ema': False, 'sideways_use_atr': False, 'sideways_use_adx': False, 'sideways_use_spike': False, 'sideways_rsi_required': False}.
