[I 2025-08-29 19:44:18,777] Trial 64 finished with values: [-1000000000.0, 1000000000.0] and parameters: {'p_sma': 24, 'p_std': 13, 'p_atr': 8, 'p_adx': 17, 'rsi_period': 24, 'ema1': 15, 'ema2': 29, 'slip_atr_k': 0.03911115684265236, 'slip_spread_k': 0.894152332765682, 'spread_hl_frac': 0.049387575357057095, 'bb_std_mult': 1.5153608550152364, 'rsi_os': 25, 'rsi_ob': 86, 'vol_spike': 0.29139077042663464, 'adx_thresh': 17.67840341235106, 'atr_min_pct': 0.005092565305784778, 'atr_max_pct': 0.09190459267808028, 'tp_mult': 1.3732400463412509, 'tsl_mult': 0.6140673941712234, 'strategy': 'breakout', 'time_stop': 247, 'use_sma': False, 'use_atr': False, 'use_adx': False, 'use_ema': False, 'use_spike': False, 'rsi_required': True, 'edge_k': 0.4219865537849008, 'edge_cap': 0.14450118375694698, 'bull_strategy': 'breakout', 'bull_bb_std_mult': 1.1519939836576016, 'bull_rsi_os': 40, 'bull_rsi_ob': 92, 'bull_adx_thresh': 18.901151374010198, 'bull_atr_min_pct': 0.019837331215359688, 'bull_atr_max_pct': 0.14015861055887707, 'bull_tp_mult': 2.2307617303662193, 'bull_tsl_mult': 0.42670403406167134, 'bull_time_stop': 54, 'bull_use_sma': True, 'bull_use_ema': False, 'bull_use_atr': False, 'bull_use_adx': False, 'bull_use_spike': False, 'bull_rsi_required': True, 'bear_strategy': 'breakout', 'bear_bb_std_mult': 1.029290242360825, 'bear_rsi_os': 19, 'bear_rsi_ob': 62, 'bear_adx_thresh': 8.12368393842468, 'bear_atr_min_pct': 0.005694708857571842, 'bear_atr_max_pct': 0.06474900140554168, 'bear_tp_mult': 2.7430639128330268, 'bear_tsl_mult': 0.5564928520367849, 'bear_time_stop': 107, 'bear_use_sma': True, 'bear_use_ema': True, 'bear_use_atr': True, 'bear_use_adx': False, 'bear_use_spike': False, 'bear_rsi_required': True, 'sideways_strategy': 'mean_reversion', 'sideways_bb_std_mult': 2.310604239834482, 'sideways_rsi_os': 24, 'sideways_rsi_ob': 83, 'sideways_adx_thresh': 9.360169340490387, 'sideways_atr_min_pct': 0.025601865285907698, 'sideways_atr_max_pct': 0.1261945056904952, 'sideways_tp_mult': 2.5533542914087253, 'sideways_tsl_mult': 0.2973156259010156, 'sideways_time_stop': 115, 'sideways_use_sma': True, 'sideways_use_ema': True, 'sideways_use_atr': False, 'sideways_use_adx': True, 'sideways_use_spike': False, 'sideways_rsi_required': False}.
[I 2025-08-29 19:44:18,778] Trial 62 finished with values: [-1000000000.0, 1000000000.0] and parameters: {'p_sma': 26, 'p_std': 49, 'p_atr': 11, 'p_adx': 24, 'rsi_period': 24, 'ema1': 15, 'ema2': 30, 'slip_atr_k': 0.03774175020128277, 'slip_spread_k': 0.3067713167009669, 'spread_hl_frac': 0.04931432655355746, 'bb_std_mult': 1.661876086511797, 'rsi_os': 31, 'rsi_ob': 55, 'vol_spike': 0.29667626169422334, 'adx_thresh': 19.99221450606627, 'atr_min_pct': 0.0017093211327030991, 'atr_max_pct': 0.11593566085038023, 'tp_mult': 2.6104555748333595, 'tsl_mult': 0.7982386616747685, 'strategy': 'breakout', 'time_stop': 246, 'use_sma': False, 'use_atr': True, 'use_adx': True, 'use_ema': False, 'use_spike': False, 'rsi_required': True, 'edge_k': 1.9309579472014355, 'edge_cap': 0.3892416079382176, 'bull_strategy': 'breakout', 'bull_bb_std_mult': 1.3017308956962657, 'bull_rsi_os': 33, 'bull_rsi_ob': 92, 'bull_adx_thresh': 27.96897902445545, 'bull_atr_min_pct': 0.027413395614557943, 'bull_atr_max_pct': 0.13283225461424403, 'bull_tp_mult': 2.659688603734404, 'bull_tsl_mult': 0.5318816538095643, 'bull_time_stop': 152, 'bull_use_sma': True, 'bull_use_ema': False, 'bull_use_atr': False, 'bull_use_adx': False, 'bull_use_spike': True, 'bull_rsi_required': False, 'bear_strategy': 'breakout', 'bear_bb_std_mult': 3.2811472206279317, 'bear_rsi_os': 19, 'bear_rsi_ob': 61, 'bear_adx_thresh': 11.307456044272179, 'bear_atr_min_pct': 0.005371211894780363, 'bear_atr_max_pct': 0.026853091761974535, 'bear_tp_mult': 2.36162584500135, 'bear_tsl_mult': 0.5598549146886652, 'bear_time_stop': 64, 'bear_use_sma': True, 'bear_use_ema': True, 'bear_use_atr': True, 'bear_use_adx': False, 'bear_use_spike': False, 'bear_rsi_required': False, 'sideways_strategy': 'mean_reversion', 'sideways_bb_std_mult': 1.755087361138321, 'sideways_rsi_os': 23, 'sideways_rsi_ob': 45, 'sideways_adx_thresh': 29.566670948674822, 'sideways_atr_min_pct': 0.013464478973318345, 'sideways_atr_max_pct': 0.10444089428410572, 'sideways_tp_mult': 1.3088879536813904, 'sideways_tsl_mult': 0.2835136904637635, 'sideways_time_stop': 129, 'sideways_use_sma': True, 'sideways_use_ema': True, 'sideways_use_atr': True, 'sideways_use_adx': True, 'sideways_use_spike': False, 'sideways_rsi_required': False}.
[I 2025-08-29 19:44:49,147] Trial 65 finished with values: [-1000000000.0, 1000000000.0] and parameters: {'p_sma': 42, 'p_std': 9, 'p_atr': 8, 'p_adx': 24, 'rsi_period': 13, 'ema1': 12, 'ema2': 28, 'slip_atr_k': 0.05123168190693219, 'slip_spread_k': 0.5766802273083205, 'spread_hl_frac': 0.004323099925119613, 'bb_std_mult': 1.5322733942745408, 'rsi_os': 22, 'rsi_ob': 57, 'vol_spike': 0.2959104954948449, 'adx_thresh': 20.30055182971501, 'atr_min_pct': 0.015176007944400714, 'atr_max_pct': 0.017594238956850257, 'tp_mult': 2.386119572169158, 'tsl_mult': 0.6218364012524946, 'strategy': 'breakout', 'time_stop': 249, 'use_sma': False, 'use_atr': False, 'use_adx': False, 'use_ema': False, 'use_spike': False, 'rsi_required': True, 'edge_k': 0.5167116402504606, 'edge_cap': 0.4735565471997203, 'bull_strategy': 'breakout', 'bull_bb_std_mult': 1.2341339303577208, 'bull_rsi_os': 42, 'bull_rsi_ob': 92, 'bull_adx_thresh': 21.0119402741512, 'bull_atr_min_pct': 0.01856079049367438, 'bull_atr_max_pct': 0.0554625667400761, 'bull_tp_mult': 2.930230830422411, 'bull_tsl_mult': 0.43088722900191184, 'bull_time_stop': 53, 'bull_use_sma': True, 'bull_use_ema': False, 'bull_use_atr': False, 'bull_use_adx': True, 'bull_use_spike': True, 'bull_rsi_required': True, 'bear_strategy': 'breakout', 'bear_bb_std_mult': 3.3732053766888903, 'bear_rsi_os': 19, 'bear_rsi_ob': 66, 'bear_adx_thresh': 10.48374943601494, 'bear_atr_min_pct': 0.013700290830087562, 'bear_atr_max_pct': 0.11424851456469624, 'bear_tp_mult': 2.7736646812027557, 'bear_tsl_mult': 0.5586387879896265, 'bear_time_stop': 183, 'bear_use_sma': True, 'bear_use_ema': True, 'bear_use_atr': True, 'bear_use_adx': False, 'bear_use_spike': False, 'bear_rsi_required': True, 'sideways_strategy': 'mean_reversion', 'sideways_bb_std_mult': 2.286283219874143, 'sideways_rsi_os': 22, 'sideways_rsi_ob': 84, 'sideways_adx_thresh': 9.547356471407129, 'sideways_atr_min_pct': 0.01570427089315303, 'sideways_atr_max_pct': 0.10349765281067348, 'sideways_tp_mult': 1.3130852906760937, 'sideways_tsl_mult': 0.2869617311815256, 'sideways_time_stop': 111, 'sideways_use_sma': True, 'sideways_use_ema': True, 'sideways_use_atr': False, 'sideways_use_adx': True, 'sideways_use_spike': False, 'sideways_rsi_required': False}.
[I 2025-08-29 19:44:49,481] Trial 68 finished with values: [-0.026207524758903644, 0.026205676808696177] and parameters: {'p_sma': 43, 'p_std': 11, 'p_atr': 9, 'p_adx': 20, 'rsi_period': 14, 'ema1': 12, 'ema2': 17, 'slip_atr_k': 0.049561719459046236, 'slip_spread_k': 0.662930152937641, 'spread_hl_frac': 0.00904885248060295, 'bb_std_mult': 2.9469218176911256, 'rsi_os': 18, 'rsi_ob': 45, 'vol_spike': 0.1549782806989722, 'adx_thresh': 19.35409768558613, 'atr_min_pct': 0.01902298123586907, 'atr_max_pct': 0.08678245473412831, 'tp_mult': 2.3901262371050693, 'tsl_mult': 0.39100550548298346, 'strategy': 'breakout', 'time_stop': 38, 'use_sma': True, 'use_atr': False, 'use_adx': False, 'use_ema': False, 'use_spike': True, 'rsi_required': True, 'edge_k': 1.8448230863244446, 'edge_cap': 0.49448972849096345, 'bull_strategy': 'mean_reversion', 'bull_bb_std_mult': 0.6761317287710145, 'bull_rsi_os': 42, 'bull_rsi_ob': 85, 'bull_adx_thresh': 21.351492841535762, 'bull_atr_min_pct': 0.018440247081867648, 'bull_atr_max_pct': 0.05373104430949754, 'bull_tp_mult': 2.9312911292119184, 'bull_tsl_mult': 0.35652625060090987, 'bull_time_stop': 267, 'bull_use_sma': True, 'bull_use_ema': True, 'bull_use_atr': False, 'bull_use_adx': True, 'bull_use_spike': True, 'bull_rsi_required': False, 'bear_strategy': 'breakout', 'bear_bb_std_mult': 1.3895832417787801, 'bear_rsi_os': 27, 'bear_rsi_ob': 66, 'bear_adx_thresh': 17.321271005243702, 'bear_atr_min_pct': 0.0032208212659999534, 'bear_atr_max_pct': 0.011204942448502717, 'bear_tp_mult': 2.8878083886401784, 'bear_tsl_mult': 0.6157191356490199, 'bear_time_stop': 39, 'bear_use_sma': True, 'bear_use_ema': False, 'bear_use_atr': True, 'bear_use_adx': False, 'bear_use_spike': False, 'bear_rsi_required': True, 'sideways_strategy': 'mean_reversion', 'sideways_bb_std_mult': 1.0103758023684655, 'sideways_rsi_os': 39, 'sideways_rsi_ob': 84, 'sideways_adx_thresh': 24.318730317654648, 'sideways_atr_min_pct': 0.0056644677397103705, 'sideways_atr_max_pct': 0.1324603619664752, 'sideways_tp_mult': 1.783767643395506, 'sideways_tsl_mult': 0.7726713718994858, 'sideways_time_stop': 224, 'sideways_use_sma': True, 'sideways_use_ema': True, 'sideways_use_atr': False, 'sideways_use_adx': False, 'sideways_use_spike': False, 'sideways_rsi_required': True}.
[I 2025-08-29 19:44:49,710] Trial 66 finished with values: [-0.0036798093510961305, 0.003737033973480556] and parameters: {'p_sma': 25, 'p_std': 12, 'p_atr': 13, 'p_adx': 24, 'rsi_period': 14, 'ema1': 12, 'ema2': 28, 'slip_atr_k': 0.049214632084935414, 'slip_spread_k': 0.3109609782874492, 'spread_hl_frac': 0.007496402641761043, 'bb_std_mult': 1.559700680313857, 'rsi_os': 18, 'rsi_ob': 54, 'vol_spike': 0.28629648118444206, 'adx_thresh': 18.781312487587634, 'atr_min_pct': 1.2654544806854542e-05, 'atr_max_pct': 0.1153690517189711, 'tp_mult': 1.3356552840837188, 'tsl_mult': 0.6234225353610552, 'strategy': 'breakout', 'time_stop': 299, 'use_sma': False, 'use_atr': False, 'use_adx': False, 'use_ema': False, 'use_spike': False, 'rsi_required': True, 'edge_k': 1.5348882118596126, 'edge_cap': 0.5004324511480605, 'bull_strategy': 'mean_reversion', 'bull_bb_std_mult': 0.7428745508140153, 'bull_rsi_os': 40, 'bull_rsi_ob': 93, 'bull_adx_thresh': 21.986881080143185, 'bull_atr_min_pct': 0.018735807553400406, 'bull_atr_max_pct': 0.08064089909635204, 'bull_tp_mult': 2.948443070797886, 'bull_tsl_mult': 0.4177867862103394, 'bull_time_stop': 49, 'bull_use_sma': True, 'bull_use_ema': False, 'bull_use_atr': False, 'bull_use_adx': True, 'bull_use_spike': True, 'bull_rsi_required': False, 'bear_strategy': 'breakout', 'bear_bb_std_mult': 1.028690298481363, 'bear_rsi_os': 27, 'bear_rsi_ob': 66, 'bear_adx_thresh': 8.082396697296875, 'bear_atr_min_pct': 0.005726920382797216, 'bear_atr_max_pct': 0.02102974916342979, 'bear_tp_mult': 2.732082717348138, 'bear_tsl_mult': 0.5942022338553593, 'bear_time_stop': 161, 'bear_use_sma': True, 'bear_use_ema': True, 'bear_use_atr': True, 'bear_use_adx': False, 'bear_use_spike': False, 'bear_rsi_required': True, 'sideways_strategy': 'mean_reversion', 'sideways_bb_std_mult': 1.3345785163824722, 'sideways_rsi_os': 43, 'sideways_rsi_ob': 84, 'sideways_adx_thresh': 24.217306779546632, 'sideways_atr_min_pct': 0.025391938660309876, 'sideways_atr_max_pct': 0.12649236788658555, 'sideways_tp_mult': 1.8429532403095814, 'sideways_tsl_mult': 0.3328721839505874, 'sideways_time_stop': 108, 'sideways_use_sma': True, 'sideways_use_ema': True, 'sideways_use_atr': False, 'sideways_use_adx': False, 'sideways_use_spike': False, 'sideways_rsi_required': False}.
[I 2025-08-29 19:44:49,826] Trial 67 finished with values: [-0.003947002474279593, 0.00513165187496612] and parameters: {'p_sma': 43, 'p_std': 15, 'p_atr': 13, 'p_adx': 24, 'rsi_period': 13, 'ema1': 12, 'ema2': 42, 'slip_atr_k': 0.052354770823845195, 'slip_spread_k': 0.3248275079729892, 'spread_hl_frac': 0.004046984227522851, 'bb_std_mult': 1.5970753889158398, 'rsi_os': 18, 'rsi_ob': 45, 'vol_spike': 0.1571597041644316, 'adx_thresh': 19.8268465912919, 'atr_min_pct': 0.00021228031245481833, 'atr_max_pct': 0.11633913622515853, 'tp_mult': 2.421208627350709, 'tsl_mult': 0.19590838130174482, 'strategy': 'breakout', 'time_stop': 41, 'use_sma': False, 'use_atr': False, 'use_adx': False, 'use_ema': False, 'use_spike': False, 'rsi_required': True, 'edge_k': 1.5235714936885278, 'edge_cap': 0.3787727474171312, 'bull_strategy': 'mean_reversion', 'bull_bb_std_mult': 0.6841699475816085, 'bull_rsi_os': 42, 'bull_rsi_ob': 85, 'bull_adx_thresh': 21.426570638594946, 'bull_atr_min_pct': 0.005583824778816398, 'bull_atr_max_pct': 0.017618310514235805, 'bull_tp_mult': 2.643342311612529, 'bull_tsl_mult': 0.36713588376149564, 'bull_time_stop': 152, 'bull_use_sma': True, 'bull_use_ema': True, 'bull_use_atr': False, 'bull_use_adx': True, 'bull_use_spike': True, 'bull_rsi_required': False, 'bear_strategy': 'breakout', 'bear_bb_std_mult': 1.3636575236230972, 'bear_rsi_os': 13, 'bear_rsi_ob': 66, 'bear_adx_thresh': 10.64269034691652, 'bear_atr_min_pct': 0.0030207906503202913, 'bear_atr_max_pct': 0.0767501085907982, 'bear_tp_mult': 2.8841706172196853, 'bear_tsl_mult': 0.37684807031115375, 'bear_time_stop': 159, 'bear_use_sma': True, 'bear_use_ema': True, 'bear_use_atr': True, 'bear_use_adx': False, 'bear_use_spike': False, 'bear_rsi_required': True, 'sideways_strategy': 'mean_reversion', 'sideways_bb_std_mult': 1.3585412690446614, 'sideways_rsi_os': 42, 'sideways_rsi_ob': 50, 'sideways_adx_thresh': 29.82309669267392, 'sideways_atr_min_pct': 0.00702928799807356, 'sideways_atr_max_pct': 0.13118392384838298, 'sideways_tp_mult': 1.8215037356034853, 'sideways_tsl_mult': 0.03437552888107215, 'sideways_time_stop': 226, 'sideways_use_sma': True, 'sideways_use_ema': True, 'sideways_use_atr': False, 'sideways_use_adx': False, 'sideways_use_spike': False, 'sideways_rsi_required': True}.
[I 2025-08-29 19:44:50,128] Trial 71 finished with values: [-1000000000.0, 1000000000.0] and parameters: {'p_sma': 40, 'p_std': 41, 'p_atr': 13, 'p_adx': 29, 'rsi_period': 20, 'ema1': 11, 'ema2': 45, 'slip_atr_k': 0.02622269822695933, 'slip_spread_k': 0.08866956211219057, 'spread_hl_frac': 0.032026715260924626, 'bb_std_mult': 0.711368482422976, 'rsi_os': 52, 'rsi_ob': 80, 'vol_spike': 0.23705179744774274, 'adx_thresh': 6.835820416266699, 'atr_min_pct': 2.0407045010429475e-05, 'atr_max_pct': 0.04066616552990685, 'tp_mult': 2.067437554793588, 'tsl_mult': 0.19731404385002305, 'strategy': 'mean_reversion', 'time_stop': 102, 'use_sma': True, 'use_atr': True, 'use_adx': True, 'use_ema': True, 'use_spike': True, 'rsi_required': True, 'edge_k': 1.5302351609047262, 'edge_cap': 0.7348101484930769, 'bull_strategy': 'mean_reversion', 'bull_bb_std_mult': 2.7989183371416324, 'bull_rsi_os': 45, 'bull_rsi_ob': 90, 'bull_adx_thresh': 13.757013000379146, 'bull_atr_min_pct': 0.014467423854449702, 'bull_atr_max_pct': 0.01925467712731671, 'bull_tp_mult': 2.8252436284673124, 'bull_tsl_mult': 0.2898879393665109, 'bull_time_stop': 179, 'bull_use_sma': False, 'bull_use_ema': True, 'bull_use_atr': True, 'bull_use_adx': True, 'bull_use_spike': True, 'bull_rsi_required': False, 'bear_strategy': 'mean_reversion', 'bear_bb_std_mult': 1.0804015699863172, 'bear_rsi_os': 5, 'bear_rsi_ob': 47, 'bear_adx_thresh': 25.463266118950592, 'bear_atr_min_pct': 0.02908146023877057, 'bear_atr_max_pct': 0.09705895220316994, 'bear_tp_mult': 1.921870224825612, 'bear_tsl_mult': 0.009005871926430209, 'bear_time_stop': 192, 'bear_use_sma': False, 'bear_use_ema': False, 'bear_use_atr': False, 'bear_use_adx': True, 'bear_use_spike': True, 'bear_rsi_required': False, 'sideways_strategy': 'breakout', 'sideways_bb_std_mult': 0.6103796814677277, 'sideways_rsi_os': 7, 'sideways_rsi_ob': 48, 'sideways_adx_thresh': 26.549840264293852, 'sideways_atr_min_pct': 0.01762813459888227, 'sideways_atr_max_pct': 0.09734861287655361, 'sideways_tp_mult': 2.215313015100628, 'sideways_tsl_mult': 0.058542741080658045, 'sideways_time_stop': 104, 'sideways_use_sma': True, 'sideways_use_ema': False, 'sideways_use_atr': True, 'sideways_use_adx': False, 'sideways_use_spike': True, 'sideways_rsi_required': True}.
[I 2025-08-29 19:45:19,842] Trial 72 finished with values: [-1000000000.0, 1000000000.0] and parameters: {'p_sma': 15, 'p_std': 19, 'p_atr': 13, 'p_adx': 26, 'rsi_period': 62, 'ema1': 11, 'ema2': 42, 'slip_atr_k': 0.06965742403410616, 'slip_spread_k': 0.792045164244789, 'spread_hl_frac': 0.0007404015901602765, 'bb_std_mult': 1.4162595688710966, 'rsi_os': 17, 'rsi_ob': 81, 'vol_spike': 0.16632998963527895, 'adx_thresh': 10.570264125995443, 'atr_min_pct': 0.00012120835637709497, 'atr_max_pct': 0.04205664041712137, 'tp_mult': 2.226347908240949, 'tsl_mult': 0.3461396536199175, 'strategy': 'mean_reversion', 'time_stop': 62, 'use_sma': True, 'use_atr': True, 'use_adx': True, 'use_ema': True, 'use_spike': True, 'rsi_required': False, 'edge_k': 1.5429923058665518, 'edge_cap': 0.9404938540348431, 'bull_strategy': 'mean_reversion', 'bull_bb_std_mult': 2.112600732886769, 'bull_rsi_os': 39, 'bull_rsi_ob': 90, 'bull_adx_thresh': 6.964672763759278, 'bull_atr_min_pct': 0.02428531704434477, 'bull_atr_max_pct': 0.08100817667231211, 'bull_tp_mult': 2.825904295023614, 'bull_tsl_mult': 0.2795125970215783, 'bull_time_stop': 99, 'bull_use_sma': False, 'bull_use_ema': True, 'bull_use_atr': True, 'bull_use_adx': True, 'bull_use_spike': True, 'bull_rsi_required': False, 'bear_strategy': 'mean_reversion', 'bear_bb_std_mult': 0.9800317549342077, 'bear_rsi_os': 13, 'bear_rsi_ob': 69, 'bear_adx_thresh': 14.128487351171323, 'bear_atr_min_pct': 0.029971028833053134, 'bear_atr_max_pct': 0.09797328898900294, 'bear_tp_mult': 2.859864341051017, 'bear_tsl_mult': 0.7120100830934323, 'bear_time_stop': 160, 'bear_use_sma': False, 'bear_use_ema': False, 'bear_use_atr': False, 'bear_use_adx': True, 'bear_use_spike': True, 'bear_rsi_required': False, 'sideways_strategy': 'breakout', 'sideways_bb_std_mult': 1.3503808748108053, 'sideways_rsi_os': 8, 'sideways_rsi_ob': 50, 'sideways_adx_thresh': 16.558230189404064, 'sideways_atr_min_pct': 0.021658316366761077, 'sideways_atr_max_pct': 0.10956803385231106, 'sideways_tp_mult': 2.234498858795515, 'sideways_tsl_mult': 0.03752156191215944, 'sideways_time_stop': 164, 'sideways_use_sma': True, 'sideways_use_ema': False, 'sideways_use_atr': True, 'sideways_use_adx': False, 'sideways_use_spike': True, 'sideways_rsi_required': True}.
[I 2025-08-29 19:45:20,632] Trial 73 finished with values: [-1000000000.0, 1000000000.0] and parameters: {'p_sma': 38, 'p_std': 44, 'p_atr': 17, 'p_adx': 8, 'rsi_period': 55, 'ema1': 11, 'ema2': 43, 'slip_atr_k': 0.06804788628510759, 'slip_spread_k': 0.45941527672003063, 'spread_hl_frac': 0.04447226675230006, 'bb_std_mult': 0.9345478630874361, 'rsi_os': 18, 'rsi_ob': 76, 'vol_spike': 0.18461684973680398, 'adx_thresh': 10.55417086586071, 'atr_min_pct': 0.02110238022042769, 'atr_max_pct': 0.14239146121960577, 'tp_mult': 2.4863810107840267, 'tsl_mult': 0.410775740344622, 'strategy': 'mean_reversion', 'time_stop': 182, 'use_sma': False, 'use_atr': True, 'use_adx': True, 'use_ema': False, 'use_spike': True, 'rsi_required': False, 'edge_k': 1.0087493815265858, 'edge_cap': 0.5464907531815316, 'bull_strategy': 'mean_reversion', 'bull_bb_std_mult': 2.119500780301053, 'bull_rsi_os': 39, 'bull_rsi_ob': 60, 'bull_adx_thresh': 6.802662418832968, 'bull_atr_min_pct': 0.024061864040293698, 'bull_atr_max_pct': 0.0824978743225401, 'bull_tp_mult': 2.997374606151799, 'bull_tsl_mult': 0.07559007105536708, 'bull_time_stop': 98, 'bull_use_sma': True, 'bull_use_ema': True, 'bull_use_atr': False, 'bull_use_adx': True, 'bull_use_spike': True, 'bull_rsi_required': False, 'bear_strategy': 'breakout', 'bear_bb_std_mult': 2.5687749322931843, 'bear_rsi_os': 38, 'bear_rsi_ob': 68, 'bear_adx_thresh': 8.43785593259543, 'bear_atr_min_pct': 0.016672447406363824, 'bear_atr_max_pct': 0.10566939412556503, 'bear_tp_mult': 2.672894667893555, 'bear_tsl_mult': 0.7368942392077473, 'bear_time_stop': 158, 'bear_use_sma': True, 'bear_use_ema': False, 'bear_use_atr': False, 'bear_use_adx': False, 'bear_use_spike': False, 'bear_rsi_required': False, 'sideways_strategy': 'mean_reversion', 'sideways_bb_std_mult': 1.3500168195900393, 'sideways_rsi_os': 16, 'sideways_rsi_ob': 59, 'sideways_adx_thresh': 16.731857524288024, 'sideways_atr_min_pct': 0.010636101046163929, 'sideways_atr_max_pct': 0.11030134713934467, 'sideways_tp_mult': 2.7442315636477446, 'sideways_tsl_mult': 0.3541197496360918, 'sideways_time_stop': 19, 'sideways_use_sma': True, 'sideways_use_ema': True, 'sideways_use_atr': True, 'sideways_use_adx': False, 'sideways_use_spike': False, 'sideways_rsi_required': False}.
