[I 2025-08-29 21:10:44,780] Trial 811 finished with values: [-1000000000.0, 1000000000.0] and parameters: {'p_sma': 17, 'p_std': 40, 'p_atr': 14, 'p_adx': 7, 'rsi_period': 32, 'ema1': 24, 'ema2': 26, 'slip_atr_k': 0.21004245016315679, 'slip_spread_k': 0.10917168767924222, 'spread_hl_frac': 0.024436696195388057, 'bb_std_mult': 0.7216156169368577, 'rsi_os': 31, 'rsi_ob': 78, 'vol_spike': 0.2869354760928399, 'adx_thresh': 8.629023695518582, 'atr_min_pct': 0.011069395401536532, 'atr_max_pct': 0.03787916444190193, 'tp_mult': 2.4579378112023806, 'tsl_mult': 0.7838462210137969, 'strategy': 'breakout', 'time_stop': 218, 'use_sma': False, 'use_atr': True, 'use_adx': True, 'use_ema': False, 'use_spike': True, 'rsi_required': True, 'edge_k': 0.8087176036949679, 'edge_cap': 0.24096391432445402, 'bull_strategy': 'breakout', 'bull_bb_std_mult': 2.7188944624889833, 'bull_rsi_os': 23, 'bull_rsi_ob': 68, 'bull_adx_thresh': 32.1229096880902, 'bull_atr_min_pct': 0.019899789288126187, 'bull_atr_max_pct': 0.11009993844107396, 'bull_tp_mult': 2.379588905975061, 'bull_tsl_mult': 0.9685746084899737, 'bull_time_stop': 211, 'bull_use_sma': False, 'bull_use_ema': True, 'bull_use_atr': False, 'bull_use_adx': True, 'bull_use_spike': False, 'bull_rsi_required': True, 'bear_strategy': 'mean_reversion', 'bear_bb_std_mult': 2.3645381708792295, 'bear_rsi_os': 37, 'bear_rsi_ob': 87, 'bear_adx_thresh': 16.02742604716256, 'bear_atr_min_pct': 0.010247007188313006, 'bear_atr_max_pct': 0.0864892807659502, 'bear_tp_mult': 2.9005655068326455, 'bear_tsl_mult': 0.050130402315645174, 'bear_time_stop': 228, 'bear_use_sma': True, 'bear_use_ema': False, 'bear_use_atr': True, 'bear_use_adx': False, 'bear_use_spike': False, 'bear_rsi_required': True, 'sideways_strategy': 'mean_reversion', 'sideways_bb_std_mult': 3.4965383265495906, 'sideways_rsi_os': 23, 'sideways_rsi_ob': 83, 'sideways_adx_thresh': 11.747767073487811, 'sideways_atr_min_pct': 0.013673625313344167, 'sideways_atr_max_pct': 0.037916234641497196, 'sideways_tp_mult': 2.342789414157627, 'sideways_tsl_mult': 0.5967334891188365, 'sideways_time_stop': 148, 'sideways_use_sma': True, 'sideways_use_ema': False, 'sideways_use_atr': True, 'sideways_use_adx': True, 'sideways_use_spike': True, 'sideways_rsi_required': True}.
[I 2025-08-29 21:10:44,948] Trial 810 finished with values: [-1000000000.0, 1000000000.0] and parameters: {'p_sma': 16, 'p_std': 40, 'p_atr': 15, 'p_adx': 7, 'rsi_period': 32, 'ema1': 24, 'ema2': 28, 'slip_atr_k': 0.02124744279307388, 'slip_spread_k': 0.1083117479006934, 'spread_hl_frac': 0.022751441348667335, 'bb_std_mult': 0.8625936147874488, 'rsi_os': 7, 'rsi_ob': 78, 'vol_spike': 0.28603632939661666, 'adx_thresh': 8.800831097319245, 'atr_min_pct': 0.011196599470689532, 'atr_max_pct': 0.03742234629254097, 'tp_mult': 2.4507270268475287, 'tsl_mult': 0.7808978249069213, 'strategy': 'breakout', 'time_stop': 221, 'use_sma': False, 'use_atr': True, 'use_adx': True, 'use_ema': False, 'use_spike': True, 'rsi_required': True, 'edge_k': 0.8590243164766913, 'edge_cap': 0.2640392891662871, 'bull_strategy': 'breakout', 'bull_bb_std_mult': 2.705572534915303, 'bull_rsi_os': 23, 'bull_rsi_ob': 68, 'bull_adx_thresh': 24.73024932712789, 'bull_atr_min_pct': 0.018160435921512418, 'bull_atr_max_pct': 0.10827201728652856, 'bull_tp_mult': 2.4803389009202754, 'bull_tsl_mult': 0.9703500612945367, 'bull_time_stop': 209, 'bull_use_sma': False, 'bull_use_ema': True, 'bull_use_atr': False, 'bull_use_adx': True, 'bull_use_spike': False, 'bull_rsi_required': True, 'bear_strategy': 'mean_reversion', 'bear_bb_std_mult': 2.3968595693282513, 'bear_rsi_os': 37, 'bear_rsi_ob': 87, 'bear_adx_thresh': 9.874970349338657, 'bear_atr_min_pct': 0.02004321722741953, 'bear_atr_max_pct': 0.08219242207689678, 'bear_tp_mult': 2.8409166499744023, 'bear_tsl_mult': 0.052754673746160934, 'bear_time_stop': 246, 'bear_use_sma': True, 'bear_use_ema': False, 'bear_use_atr': True, 'bear_use_adx': False, 'bear_use_spike': False, 'bear_rsi_required': True, 'sideways_strategy': 'mean_reversion', 'sideways_bb_std_mult': 3.4933979018403996, 'sideways_rsi_os': 23, 'sideways_rsi_ob': 83, 'sideways_adx_thresh': 11.609154113473743, 'sideways_atr_min_pct': 0.013704402759299272, 'sideways_atr_max_pct': 0.038575201485153754, 'sideways_tp_mult': 2.3325566771549155, 'sideways_tsl_mult': 0.5911816785608662, 'sideways_time_stop': 147, 'sideways_use_sma': True, 'sideways_use_ema': False, 'sideways_use_atr': True, 'sideways_use_adx': True, 'sideways_use_spike': True, 'sideways_rsi_required': True}.
[I 2025-08-29 21:11:14,508] Trial 813 finished with values: [-1000000000.0, 1000000000.0] and parameters: {'p_sma': 15, 'p_std': 36, 'p_atr': 14, 'p_adx': 7, 'rsi_period': 32, 'ema1': 24, 'ema2': 27, 'slip_atr_k': 0.16146763905254644, 'slip_spread_k': 0.01880578930488086, 'spread_hl_frac': 0.02460650668344859, 'bb_std_mult': 0.8918981372852695, 'rsi_os': 42, 'rsi_ob': 79, 'vol_spike': 0.28646091935778, 'adx_thresh': 7.874456804613651, 'atr_min_pct': 0.011231365201956554, 'atr_max_pct': 0.037501086447212686, 'tp_mult': 2.4290624805966288, 'tsl_mult': 0.7788739060912881, 'strategy': 'breakout', 'time_stop': 220, 'use_sma': False, 'use_atr': True, 'use_adx': True, 'use_ema': False, 'use_spike': True, 'rsi_required': True, 'edge_k': 0.81029191199522, 'edge_cap': 0.2306998370119837, 'bull_strategy': 'breakout', 'bull_bb_std_mult': 2.7065326938103063, 'bull_rsi_os': 23, 'bull_rsi_ob': 68, 'bull_adx_thresh': 32.95318817450988, 'bull_atr_min_pct': 0.019740051280616223, 'bull_atr_max_pct': 0.10918655980515092, 'bull_tp_mult': 2.486406079039484, 'bull_tsl_mult': 0.972125779831539, 'bull_time_stop': 213, 'bull_use_sma': False, 'bull_use_ema': True, 'bull_use_atr': False, 'bull_use_adx': True, 'bull_use_spike': False, 'bull_rsi_required': True, 'bear_strategy': 'mean_reversion', 'bear_bb_std_mult': 2.3694755172051205, 'bear_rsi_os': 42, 'bear_rsi_ob': 88, 'bear_adx_thresh': 12.279273359189597, 'bear_atr_min_pct': 0.02594039303714738, 'bear_atr_max_pct': 0.08706490930734564, 'bear_tp_mult': 2.8345065134985044, 'bear_tsl_mult': 0.018472052384270014, 'bear_time_stop': 243, 'bear_use_sma': True, 'bear_use_ema': False, 'bear_use_atr': True, 'bear_use_adx': False, 'bear_use_spike': False, 'bear_rsi_required': True, 'sideways_strategy': 'mean_reversion', 'sideways_bb_std_mult': 3.494936873727071, 'sideways_rsi_os': 23, 'sideways_rsi_ob': 86, 'sideways_adx_thresh': 12.069447369991577, 'sideways_atr_min_pct': 0.015340674281865986, 'sideways_atr_max_pct': 0.03824618601418915, 'sideways_tp_mult': 2.3447468229661634, 'sideways_tsl_mult': 0.5882006650623459, 'sideways_time_stop': 146, 'sideways_use_sma': True, 'sideways_use_ema': False, 'sideways_use_atr': True, 'sideways_use_adx': True, 'sideways_use_spike': True, 'sideways_rsi_required': True}.
[I 2025-08-29 21:11:14,682] Trial 812 finished with values: [-1000000000.0, 1000000000.0] and parameters: {'p_sma': 16, 'p_std': 36, 'p_atr': 14, 'p_adx': 7, 'rsi_period': 32, 'ema1': 24, 'ema2': 26, 'slip_atr_k': 0.06965217093132897, 'slip_spread_k': 0.10962793709367805, 'spread_hl_frac': 0.024670959017299907, 'bb_std_mult': 0.7346860961839383, 'rsi_os': 7, 'rsi_ob': 79, 'vol_spike': 0.2873303548940997, 'adx_thresh': 7.561967284655863, 'atr_min_pct': 0.01106738257549437, 'atr_max_pct': 0.038399699078525064, 'tp_mult': 2.4646514017553436, 'tsl_mult': 0.784151937089035, 'strategy': 'breakout', 'time_stop': 219, 'use_sma': False, 'use_atr': True, 'use_adx': True, 'use_ema': False, 'use_spike': True, 'rsi_required': True, 'edge_k': 0.8184158621629747, 'edge_cap': 0.262117194813572, 'bull_strategy': 'breakout', 'bull_bb_std_mult': 2.802616471435241, 'bull_rsi_os': 23, 'bull_rsi_ob': 68, 'bull_adx_thresh': 31.01142203503247, 'bull_atr_min_pct': 0.018209674941889114, 'bull_atr_max_pct': 0.10809896551400709, 'bull_tp_mult': 2.4954530500002132, 'bull_tsl_mult': 0.9666860138112828, 'bull_time_stop': 209, 'bull_use_sma': False, 'bull_use_ema': True, 'bull_use_atr': False, 'bull_use_adx': True, 'bull_use_spike': False, 'bull_rsi_required': True, 'bear_strategy': 'mean_reversion', 'bear_bb_std_mult': 2.3915817825391956, 'bear_rsi_os': 38, 'bear_rsi_ob': 84, 'bear_adx_thresh': 15.93091742676511, 'bear_atr_min_pct': 0.02005409011463258, 'bear_atr_max_pct': 0.08590246538284832, 'bear_tp_mult': 2.835371155669613, 'bear_tsl_mult': 0.05063930281916231, 'bear_time_stop': 238, 'bear_use_sma': True, 'bear_use_ema': False, 'bear_use_atr': True, 'bear_use_adx': False, 'bear_use_spike': False, 'bear_rsi_required': True, 'sideways_strategy': 'mean_reversion', 'sideways_bb_std_mult': 3.4987383166469566, 'sideways_rsi_os': 19, 'sideways_rsi_ob': 83, 'sideways_adx_thresh': 11.862659416697685, 'sideways_atr_min_pct': 0.015725819040551224, 'sideways_atr_max_pct': 0.03980322882209727, 'sideways_tp_mult': 2.3361993384752355, 'sideways_tsl_mult': 0.5515998750659601, 'sideways_time_stop': 145, 'sideways_use_sma': True, 'sideways_use_ema': False, 'sideways_use_atr': True, 'sideways_use_adx': True, 'sideways_use_spike': True, 'sideways_rsi_required': True}.
[I 2025-08-29 21:11:14,972] Trial 815 finished with values: [-1000000000.0, 1000000000.0] and parameters: {'p_sma': 14, 'p_std': 36, 'p_atr': 14, 'p_adx': 8, 'rsi_period': 31, 'ema1': 24, 'ema2': 25, 'slip_atr_k': 0.014326869566267178, 'slip_spread_k': 0.025011701426815913, 'spread_hl_frac': 0.023649366464463275, 'bb_std_mult': 0.8918911892109551, 'rsi_os': 23, 'rsi_ob': 79, 'vol_spike': 0.27702996788082496, 'adx_thresh': 7.540109238315884, 'atr_min_pct': 0.011293830937173219, 'atr_max_pct': 0.04467880899014796, 'tp_mult': 2.3573549363874013, 'tsl_mult': 0.7565265215292036, 'strategy': 'breakout', 'time_stop': 223, 'use_sma': False, 'use_atr': True, 'use_adx': True, 'use_ema': False, 'use_spike': True, 'rsi_required': True, 'edge_k': 0.7848840598010192, 'edge_cap': 0.3033744732602078, 'bull_strategy': 'breakout', 'bull_bb_std_mult': 2.661511388346563, 'bull_rsi_os': 22, 'bull_rsi_ob': 67, 'bull_adx_thresh': 22.41730217191082, 'bull_atr_min_pct': 0.01821085948896388, 'bull_atr_max_pct': 0.10169848601094764, 'bull_tp_mult': 2.493363256924351, 'bull_tsl_mult': 0.9634961207055824, 'bull_time_stop': 197, 'bull_use_sma': False, 'bull_use_ema': True, 'bull_use_atr': False, 'bull_use_adx': True, 'bull_use_spike': False, 'bull_rsi_required': True, 'bear_strategy': 'mean_reversion', 'bear_bb_std_mult': 2.0122134288704734, 'bear_rsi_os': 42, 'bear_rsi_ob': 84, 'bear_adx_thresh': 14.167578642748563, 'bear_atr_min_pct': 0.017641602979476895, 'bear_atr_max_pct': 0.07726046600504752, 'bear_tp_mult': 2.844452309424276, 'bear_tsl_mult': 0.025723148859809523, 'bear_time_stop': 237, 'bear_use_sma': True, 'bear_use_ema': False, 'bear_use_atr': True, 'bear_use_adx': False, 'bear_use_spike': False, 'bear_rsi_required': True, 'sideways_strategy': 'mean_reversion', 'sideways_bb_std_mult': 3.5261248717138702, 'sideways_rsi_os': 21, 'sideways_rsi_ob': 86, 'sideways_adx_thresh': 12.269039859643343, 'sideways_atr_min_pct': 0.015318457953107973, 'sideways_atr_max_pct': 0.04460982247679127, 'sideways_tp_mult': 2.224021562872676, 'sideways_tsl_mult': 0.5433033637140338, 'sideways_time_stop': 148, 'sideways_use_sma': True, 'sideways_use_ema': False, 'sideways_use_atr': True, 'sideways_use_adx': True, 'sideways_use_spike': True, 'sideways_rsi_required': True}.
[I 2025-08-29 21:11:15,049] Trial 814 finished with values: [-1000000000.0, 1000000000.0] and parameters: {'p_sma': 16, 'p_std': 37, 'p_atr': 15, 'p_adx': 7, 'rsi_period': 31, 'ema1': 24, 'ema2': 27, 'slip_atr_k': 0.06831970468790151, 'slip_spread_k': 0.08084763009878969, 'spread_hl_frac': 0.022482688159102284, 'bb_std_mult': 0.9043236639930546, 'rsi_os': 34, 'rsi_ob': 79, 'vol_spike': 0.27858414126201514, 'adx_thresh': 9.002845799159383, 'atr_min_pct': 0.011671788383723429, 'atr_max_pct': 0.03733461532873372, 'tp_mult': 2.4206321824821595, 'tsl_mult': 0.7529769631591674, 'strategy': 'breakout', 'time_stop': 220, 'use_sma': False, 'use_atr': True, 'use_adx': True, 'use_ema': False, 'use_spike': True, 'rsi_required': True, 'edge_k': 0.8977031886418775, 'edge_cap': 0.25870371897955136, 'bull_strategy': 'breakout', 'bull_bb_std_mult': 2.7909145341294312, 'bull_rsi_os': 23, 'bull_rsi_ob': 67, 'bull_adx_thresh': 32.895650844912716, 'bull_atr_min_pct': 0.01800323135897663, 'bull_atr_max_pct': 0.10666672512433883, 'bull_tp_mult': 2.473673873001844, 'bull_tsl_mult': 0.9739625888777463, 'bull_time_stop': 195, 'bull_use_sma': False, 'bull_use_ema': True, 'bull_use_atr': False, 'bull_use_adx': True, 'bull_use_spike': False, 'bull_rsi_required': True, 'bear_strategy': 'mean_reversion', 'bear_bb_std_mult': 2.472890862949423, 'bear_rsi_os': 42, 'bear_rsi_ob': 88, 'bear_adx_thresh': 24.792756633457795, 'bear_atr_min_pct': 0.010925703706255346, 'bear_atr_max_pct': 0.07732957953252582, 'bear_tp_mult': 2.831213237876916, 'bear_tsl_mult': 0.025306035310442475, 'bear_time_stop': 242, 'bear_use_sma': True, 'bear_use_ema': False, 'bear_use_atr': True, 'bear_use_adx': False, 'bear_use_spike': False, 'bear_rsi_required': True, 'sideways_strategy': 'mean_reversion', 'sideways_bb_std_mult': 3.4400373400848445, 'sideways_rsi_os': 21, 'sideways_rsi_ob': 83, 'sideways_adx_thresh': 12.070230945159537, 'sideways_atr_min_pct': 0.01518988908477043, 'sideways_atr_max_pct': 0.04816805514531113, 'sideways_tp_mult': 2.2539078507691657, 'sideways_tsl_mult': 0.5415784490568369, 'sideways_time_stop': 147, 'sideways_use_sma': True, 'sideways_use_ema': False, 'sideways_use_atr': True, 'sideways_use_adx': True, 'sideways_use_spike': True, 'sideways_rsi_required': True}.
[I 2025-08-29 21:11:44,673] Trial 819 finished with values: [-1000000000.0, 1000000000.0] and parameters: {'p_sma': 17, 'p_std': 26, 'p_atr': 15, 'p_adx': 9, 'rsi_period': 33, 'ema1': 24, 'ema2': 28, 'slip_atr_k': 0.19768574818257828, 'slip_spread_k': 0.0652839659036967, 'spread_hl_frac': 0.023500490194895342, 'bb_std_mult': 0.9786594997971789, 'rsi_os': 27, 'rsi_ob': 77, 'vol_spike': 0.27337459360337457, 'adx_thresh': 8.335461746702363, 'atr_min_pct': 0.012678351407701856, 'atr_max_pct': 0.03668956039091182, 'tp_mult': 2.353821037865834, 'tsl_mult': 0.7391564182655045, 'strategy': 'breakout', 'time_stop': 216, 'use_sma': False, 'use_atr': True, 'use_adx': True, 'use_ema': False, 'use_spike': True, 'rsi_required': True, 'edge_k': 0.9218159387774302, 'edge_cap': 0.3009045388463442, 'bull_strategy': 'breakout', 'bull_bb_std_mult': 2.659821585528003, 'bull_rsi_os': 22, 'bull_rsi_ob': 69, 'bull_adx_thresh': 34.00220193660435, 'bull_atr_min_pct': 0.01865339932751049, 'bull_atr_max_pct': 0.10363003940993074, 'bull_tp_mult': 2.422032257832973, 'bull_tsl_mult': 0.9993361381226344, 'bull_time_stop': 204, 'bull_use_sma': False, 'bull_use_ema': True, 'bull_use_atr': False, 'bull_use_adx': True, 'bull_use_spike': False, 'bull_rsi_required': True, 'bear_strategy': 'mean_reversion', 'bear_bb_std_mult': 2.1510308326857066, 'bear_rsi_os': 38, 'bear_rsi_ob': 86, 'bear_adx_thresh': 8.549136089860928, 'bear_atr_min_pct': 0.013131206681365797, 'bear_atr_max_pct': 0.0808838947405205, 'bear_tp_mult': 2.8911886254508015, 'bear_tsl_mult': 0.07475232506566726, 'bear_time_stop': 256, 'bear_use_sma': True, 'bear_use_ema': False, 'bear_use_atr': True, 'bear_use_adx': False, 'bear_use_spike': False, 'bear_rsi_required': True, 'sideways_strategy': 'mean_reversion', 'sideways_bb_std_mult': 3.415581083662583, 'sideways_rsi_os': 22, 'sideways_rsi_ob': 84, 'sideways_adx_thresh': 10.113942365310223, 'sideways_atr_min_pct': 0.01342146273620395, 'sideways_atr_max_pct': 0.04681250997746126, 'sideways_tp_mult': 2.364753682068774, 'sideways_tsl_mult': 0.6008562696109024, 'sideways_time_stop': 156, 'sideways_use_sma': True, 'sideways_use_ema': False, 'sideways_use_atr': True, 'sideways_use_adx': True, 'sideways_use_spike': True, 'sideways_rsi_required': True}.
[I 2025-08-29 21:11:45,092] Trial 816 finished with values: [-1000000000.0, 1000000000.0] and parameters: {'p_sma': 16, 'p_std': 35, 'p_atr': 14, 'p_adx': 8, 'rsi_period': 30, 'ema1': 24, 'ema2': 25, 'slip_atr_k': 0.015176114208251459, 'slip_spread_k': 0.06840181374587312, 'spread_hl_frac': 0.023726509073116735, 'bb_std_mult': 0.909933481615123, 'rsi_os': 7, 'rsi_ob': 79, 'vol_spike': 0.2774688127406763, 'adx_thresh': 7.557163491016116, 'atr_min_pct': 0.011373786927820899, 'atr_max_pct': 0.0420765098343876, 'tp_mult': 2.3670235347323607, 'tsl_mult': 0.7663017510328691, 'strategy': 'breakout', 'time_stop': 222, 'use_sma': False, 'use_atr': True, 'use_adx': True, 'use_ema': False, 'use_spike': True, 'rsi_required': True, 'edge_k': 0.9025342882254916, 'edge_cap': 0.30034079779140327, 'bull_strategy': 'breakout', 'bull_bb_std_mult': 2.8054839337806063, 'bull_rsi_os': 22, 'bull_rsi_ob': 67, 'bull_adx_thresh': 23.80826300726742, 'bull_atr_min_pct': 0.018132266768150503, 'bull_atr_max_pct': 0.10367312561150518, 'bull_tp_mult': 2.4954833749740613, 'bull_tsl_mult': 0.9635185644626246, 'bull_time_stop': 199, 'bull_use_sma': False, 'bull_use_ema': True, 'bull_use_atr': False, 'bull_use_adx': True, 'bull_use_spike': False, 'bull_rsi_required': True, 'bear_strategy': 'mean_reversion', 'bear_bb_std_mult': 2.469326389177767, 'bear_rsi_os': 38, 'bear_rsi_ob': 84, 'bear_adx_thresh': 15.481760058843884, 'bear_atr_min_pct': 0.009866766359961494, 'bear_atr_max_pct': 0.07690297692459801, 'bear_tp_mult': 2.8600818017347724, 'bear_tsl_mult': 0.020861008666170446, 'bear_time_stop': 237, 'bear_use_sma': True, 'bear_use_ema': False, 'bear_use_atr': True, 'bear_use_adx': False, 'bear_use_spike': False, 'bear_rsi_required': True, 'sideways_strategy': 'mean_reversion', 'sideways_bb_std_mult': 3.432027038097052, 'sideways_rsi_os': 21, 'sideways_rsi_ob': 84, 'sideways_adx_thresh': 12.301173775012163, 'sideways_atr_min_pct': 0.015753541567305688, 'sideways_atr_max_pct': 0.04098949072139999, 'sideways_tp_mult': 2.253893825292761, 'sideways_tsl_mult': 0.5602951801831515, 'sideways_time_stop': 153, 'sideways_use_sma': True, 'sideways_use_ema': False, 'sideways_use_atr': True, 'sideways_use_adx': True, 'sideways_use_spike': True, 'sideways_rsi_required': True}.
[I 2025-08-29 21:11:45,242] Trial 818 finished with values: [-1000000000.0, 1000000000.0] and parameters: {'p_sma': 17, 'p_std': 26, 'p_atr': 15, 'p_adx': 8, 'rsi_period': 33, 'ema1': 24, 'ema2': 28, 'slip_atr_k': 0.0646514934647989, 'slip_spread_k': 0.07901869890170364, 'spread_hl_frac': 0.022234056958050336, 'bb_std_mult': 0.9488087107385846, 'rsi_os': 7, 'rsi_ob': 77, 'vol_spike': 0.2775432313257731, 'adx_thresh': 9.023404385502504, 'atr_min_pct': 0.012776926773023676, 'atr_max_pct': 0.042453676249790115, 'tp_mult': 2.3338546347866904, 'tsl_mult': 0.742701773587854, 'strategy': 'breakout', 'time_stop': 226, 'use_sma': False, 'use_atr': True, 'use_adx': True, 'use_ema': False, 'use_spike': True, 'rsi_required': True, 'edge_k': 0.9063429696866888, 'edge_cap': 0.30076426244315335, 'bull_strategy': 'breakout', 'bull_bb_std_mult': 2.6815321318537833, 'bull_rsi_os': 22, 'bull_rsi_ob': 67, 'bull_adx_thresh': 26.749473457084555, 'bull_atr_min_pct': 0.01894354340137639, 'bull_atr_max_pct': 0.1050664340672654, 'bull_tp_mult': 2.440201514760838, 'bull_tsl_mult': 0.9766828447748069, 'bull_time_stop': 204, 'bull_use_sma': False, 'bull_use_ema': True, 'bull_use_atr': False, 'bull_use_adx': True, 'bull_use_spike': False, 'bull_rsi_required': True, 'bear_strategy': 'mean_reversion', 'bear_bb_std_mult': 2.4860260325868926, 'bear_rsi_os': 41, 'bear_rsi_ob': 86, 'bear_adx_thresh': 9.675003518372838, 'bear_atr_min_pct': 0.01285600767983351, 'bear_atr_max_pct': 0.0786262733455324, 'bear_tp_mult': 2.8935483591424758, 'bear_tsl_mult': 0.00010598083784566642, 'bear_time_stop': 257, 'bear_use_sma': True, 'bear_use_ema': False, 'bear_use_atr': True, 'bear_use_adx': False, 'bear_use_spike': False, 'bear_rsi_required': True, 'sideways_strategy': 'mean_reversion', 'sideways_bb_std_mult': 3.426821538272092, 'sideways_rsi_os': 21, 'sideways_rsi_ob': 84, 'sideways_adx_thresh': 10.289530603919486, 'sideways_atr_min_pct': 0.013516327853602286, 'sideways_atr_max_pct': 0.04783592888721234, 'sideways_tp_mult': 2.2514610214738364, 'sideways_tsl_mult': 0.606156903338222, 'sideways_time_stop': 152, 'sideways_use_sma': True, 'sideways_use_ema': False, 'sideways_use_atr': True, 'sideways_use_adx': True, 'sideways_use_spike': True, 'sideways_rsi_required': True}.
