[I 2025-08-29 21:06:15,326] Trial 775 finished with values: [-1000000000.0, 1000000000.0] and parameters: {'p_sma': 16, 'p_std': 32, 'p_atr': 16, 'p_adx': 8, 'rsi_period': 32, 'ema1': 22, 'ema2': 24, 'slip_atr_k': 0.014871590162811093, 'slip_spread_k': 0.08201226411189838, 'spread_hl_frac': 0.022917870477302933, 'bb_std_mult': 0.9494210213743933, 'rsi_os': 6, 'rsi_ob': 78, 'vol_spike': 0.29901387968757537, 'adx_thresh': 9.015741953586708, 'atr_min_pct': 0.010039893508477064, 'atr_max_pct': 0.038533323096595615, 'tp_mult': 2.49430818671841, 'tsl_mult': 0.67089104913168, 'strategy': 'mean_reversion', 'time_stop': 210, 'use_sma': True, 'use_atr': False, 'use_adx': False, 'use_ema': False, 'use_spike': True, 'rsi_required': False, 'edge_k': 0.867616827212489, 'edge_cap': 0.3000085484855045, 'bull_strategy': 'mean_reversion', 'bull_bb_std_mult': 2.7754870498880573, 'bull_rsi_os': 21, 'bull_rsi_ob': 70, 'bull_adx_thresh': 28.736534361879574, 'bull_atr_min_pct': 0.018528592209191067, 'bull_atr_max_pct': 0.10581974200040638, 'bull_tp_mult': 2.451582689732451, 'bull_tsl_mult': 0.9386015302535843, 'bull_time_stop': 214, 'bull_use_sma': True, 'bull_use_ema': False, 'bull_use_atr': False, 'bull_use_adx': True, 'bull_use_spike': True, 'bull_rsi_required': False, 'bear_strategy': 'breakout', 'bear_bb_std_mult': 2.406224921099245, 'bear_rsi_os': 43, 'bear_rsi_ob': 87, 'bear_adx_thresh': 18.695912604621633, 'bear_atr_min_pct': 0.006808026793629154, 'bear_atr_max_pct': 0.07695104724172466, 'bear_tp_mult': 2.9703438460992317, 'bear_tsl_mult': 0.051438400609726806, 'bear_time_stop': 223, 'bear_use_sma': False, 'bear_use_ema': False, 'bear_use_atr': False, 'bear_use_adx': False, 'bear_use_spike': True, 'bear_rsi_required': False, 'sideways_strategy': 'breakout', 'sideways_bb_std_mult': 3.452961178612253, 'sideways_rsi_os': 22, 'sideways_rsi_ob': 84, 'sideways_adx_thresh': 13.704093234812584, 'sideways_atr_min_pct': 0.013172177321560627, 'sideways_atr_max_pct': 0.03584454742124704, 'sideways_tp_mult': 2.365026675227205, 'sideways_tsl_mult': 0.6084413916935091, 'sideways_time_stop': 144, 'sideways_use_sma': False, 'sideways_use_ema': False, 'sideways_use_atr': True, 'sideways_use_adx': False, 'sideways_use_spike': False, 'sideways_rsi_required': True}.
[I 2025-08-29 21:06:15,452] Trial 772 finished with values: [-1000000000.0, 1000000000.0] and parameters: {'p_sma': 15, 'p_std': 32, 'p_atr': 15, 'p_adx': 8, 'rsi_period': 31, 'ema1': 23, 'ema2': 24, 'slip_atr_k': 0.00046426555688421534, 'slip_spread_k': 0.0828460953208151, 'spread_hl_frac': 0.01979748233738692, 'bb_std_mult': 0.9327192284221061, 'rsi_os': 5, 'rsi_ob': 78, 'vol_spike': 0.29196139096717616, 'adx_thresh': 9.010906311859225, 'atr_min_pct': 0.01131657495124544, 'atr_max_pct': 0.04263215173573304, 'tp_mult': 2.514678765255169, 'tsl_mult': 0.6774110270987723, 'strategy': 'mean_reversion', 'time_stop': 207, 'use_sma': True, 'use_atr': False, 'use_adx': False, 'use_ema': False, 'use_spike': True, 'rsi_required': False, 'edge_k': 0.9488817002203751, 'edge_cap': 0.3150514516674434, 'bull_strategy': 'mean_reversion', 'bull_bb_std_mult': 2.6719353067359584, 'bull_rsi_os': 21, 'bull_rsi_ob': 69, 'bull_adx_thresh': 28.95148528410562, 'bull_atr_min_pct': 0.01870579586317942, 'bull_atr_max_pct': 0.10546260491338628, 'bull_tp_mult': 2.419239258381324, 'bull_tsl_mult': 0.951630239712166, 'bull_time_stop': 211, 'bull_use_sma': True, 'bull_use_ema': False, 'bull_use_atr': False, 'bull_use_adx': True, 'bull_use_spike': True, 'bull_rsi_required': False, 'bear_strategy': 'breakout', 'bear_bb_std_mult': 2.387811750424695, 'bear_rsi_os': 40, 'bear_rsi_ob': 88, 'bear_adx_thresh': 18.658122681882162, 'bear_atr_min_pct': 0.007196089716939314, 'bear_atr_max_pct': 0.08408118316777796, 'bear_tp_mult': 2.954846680391995, 'bear_tsl_mult': 0.039318808523251085, 'bear_time_stop': 249, 'bear_use_sma': False, 'bear_use_ema': False, 'bear_use_atr': False, 'bear_use_adx': False, 'bear_use_spike': True, 'bear_rsi_required': False, 'sideways_strategy': 'breakout', 'sideways_bb_std_mult': 3.3594846616508063, 'sideways_rsi_os': 21, 'sideways_rsi_ob': 86, 'sideways_adx_thresh': 13.425166107633276, 'sideways_atr_min_pct': 0.013177092438787173, 'sideways_atr_max_pct': 0.041477964191068396, 'sideways_tp_mult': 2.3015522101090022, 'sideways_tsl_mult': 0.6098575284984954, 'sideways_time_stop': 139, 'sideways_use_sma': False, 'sideways_use_ema': False, 'sideways_use_atr': True, 'sideways_use_adx': False, 'sideways_use_spike': False, 'sideways_rsi_required': True}.
[I 2025-08-29 21:06:44,801] Trial 778 finished with values: [-1000000000.0, 1000000000.0] and parameters: {'p_sma': 16, 'p_std': 33, 'p_atr': 15, 'p_adx': 9, 'rsi_period': 31, 'ema1': 23, 'ema2': 23, 'slip_atr_k': 0.00538914253421441, 'slip_spread_k': 0.08187508057868897, 'spread_hl_frac': 0.020353897808969804, 'bb_std_mult': 0.9498144129480859, 'rsi_os': 6, 'rsi_ob': 78, 'vol_spike': 0.28889989923781495, 'adx_thresh': 7.441374994243515, 'atr_min_pct': 0.01099786654989005, 'atr_max_pct': 0.045356732495044204, 'tp_mult': 2.2920040341992, 'tsl_mult': 0.6763454693697777, 'strategy': 'mean_reversion', 'time_stop': 199, 'use_sma': True, 'use_atr': False, 'use_adx': False, 'use_ema': False, 'use_spike': True, 'rsi_required': False, 'edge_k': 0.9645241775958503, 'edge_cap': 0.36263472474762803, 'bull_strategy': 'mean_reversion', 'bull_bb_std_mult': 2.6022684629591235, 'bull_rsi_os': 22, 'bull_rsi_ob': 70, 'bull_adx_thresh': 27.408038784293353, 'bull_atr_min_pct': 0.018416540697124527, 'bull_atr_max_pct': 0.11083010524361486, 'bull_tp_mult': 2.4849496655532897, 'bull_tsl_mult': 0.9488420676821331, 'bull_time_stop': 208, 'bull_use_sma': True, 'bull_use_ema': False, 'bull_use_atr': False, 'bull_use_adx': True, 'bull_use_spike': True, 'bull_rsi_required': False, 'bear_strategy': 'breakout', 'bear_bb_std_mult': 2.2546520879265355, 'bear_rsi_os': 43, 'bear_rsi_ob': 87, 'bear_adx_thresh': 18.648621321093728, 'bear_atr_min_pct': 0.0075516147927480425, 'bear_atr_max_pct': 0.084548356909669, 'bear_tp_mult': 2.87543616085008, 'bear_tsl_mult': 0.005747521119272382, 'bear_time_stop': 265, 'bear_use_sma': False, 'bear_use_ema': False, 'bear_use_atr': False, 'bear_use_adx': False, 'bear_use_spike': True, 'bear_rsi_required': False, 'sideways_strategy': 'breakout', 'sideways_bb_std_mult': 3.378842055839821, 'sideways_rsi_os': 20, 'sideways_rsi_ob': 83, 'sideways_adx_thresh': 12.78264321454322, 'sideways_atr_min_pct': 0.01246246798172061, 'sideways_atr_max_pct': 0.04155524897021931, 'sideways_tp_mult': 2.4043703162927215, 'sideways_tsl_mult': 0.6292188015585712, 'sideways_time_stop': 154, 'sideways_use_sma': False, 'sideways_use_ema': False, 'sideways_use_atr': True, 'sideways_use_adx': False, 'sideways_use_spike': False, 'sideways_rsi_required': True}.
[I 2025-08-29 21:06:44,954] Trial 776 finished with values: [-1000000000.0, 1000000000.0] and parameters: {'p_sma': 16, 'p_std': 32, 'p_atr': 16, 'p_adx': 8, 'rsi_period': 31, 'ema1': 22, 'ema2': 23, 'slip_atr_k': 0.01303436257109564, 'slip_spread_k': 0.08836256361291066, 'spread_hl_frac': 0.02035426212893654, 'bb_std_mult': 0.9506990456264588, 'rsi_os': 6, 'rsi_ob': 78, 'vol_spike': 0.28814844167651926, 'adx_thresh': 7.340605353602161, 'atr_min_pct': 0.01053997702602066, 'atr_max_pct': 0.03831957802074972, 'tp_mult': 2.761629614529081, 'tsl_mult': 0.7215852598831749, 'strategy': 'mean_reversion', 'time_stop': 198, 'use_sma': True, 'use_atr': False, 'use_adx': False, 'use_ema': False, 'use_spike': True, 'rsi_required': False, 'edge_k': 0.9896287045921016, 'edge_cap': 0.35882177830673073, 'bull_strategy': 'mean_reversion', 'bull_bb_std_mult': 2.587098683934533, 'bull_rsi_os': 21, 'bull_rsi_ob': 70, 'bull_adx_thresh': 27.30685328415434, 'bull_atr_min_pct': 0.018443653981859744, 'bull_atr_max_pct': 0.10464193738419716, 'bull_tp_mult': 2.473850771969368, 'bull_tsl_mult': 0.945516555136407, 'bull_time_stop': 214, 'bull_use_sma': True, 'bull_use_ema': False, 'bull_use_atr': False, 'bull_use_adx': True, 'bull_use_spike': True, 'bull_rsi_required': False, 'bear_strategy': 'breakout', 'bear_bb_std_mult': 2.3873456523954513, 'bear_rsi_os': 40, 'bear_rsi_ob': 88, 'bear_adx_thresh': 18.768143513964898, 'bear_atr_min_pct': 0.007641584862671811, 'bear_atr_max_pct': 0.08403794795674392, 'bear_tp_mult': 2.8734566167718145, 'bear_tsl_mult': 0.022316747633800534, 'bear_time_stop': 225, 'bear_use_sma': False, 'bear_use_ema': False, 'bear_use_atr': False, 'bear_use_adx': False, 'bear_use_spike': True, 'bear_rsi_required': False, 'sideways_strategy': 'breakout', 'sideways_bb_std_mult': 3.469580292139169, 'sideways_rsi_os': 21, 'sideways_rsi_ob': 83, 'sideways_adx_thresh': 12.403644444974475, 'sideways_atr_min_pct': 0.012636051692924175, 'sideways_atr_max_pct': 0.041404601885555004, 'sideways_tp_mult': 2.408701564996543, 'sideways_tsl_mult': 0.6209835213872529, 'sideways_time_stop': 145, 'sideways_use_sma': False, 'sideways_use_ema': False, 'sideways_use_atr': True, 'sideways_use_adx': False, 'sideways_use_spike': False, 'sideways_rsi_required': True}.
[I 2025-08-29 21:06:45,043] Trial 777 finished with values: [-1000000000.0, 1000000000.0] and parameters: {'p_sma': 16, 'p_std': 33, 'p_atr': 15, 'p_adx': 9, 'rsi_period': 32, 'ema1': 23, 'ema2': 23, 'slip_atr_k': 0.00696335866397605, 'slip_spread_k': 0.09141137587290223, 'spread_hl_frac': 0.02078247572287807, 'bb_std_mult': 0.9457328535641453, 'rsi_os': 6, 'rsi_ob': 78, 'vol_spike': 0.2997559262619283, 'adx_thresh': 9.2974142607467, 'atr_min_pct': 0.01076113870849951, 'atr_max_pct': 0.04424707249854468, 'tp_mult': 2.696468612868271, 'tsl_mult': 0.6822706395805443, 'strategy': 'mean_reversion', 'time_stop': 200, 'use_sma': True, 'use_atr': False, 'use_adx': False, 'use_ema': False, 'use_spike': True, 'rsi_required': False, 'edge_k': 0.965345541991981, 'edge_cap': 0.35869315894260734, 'bull_strategy': 'mean_reversion', 'bull_bb_std_mult': 2.667256199753431, 'bull_rsi_os': 22, 'bull_rsi_ob': 70, 'bull_adx_thresh': 27.54243200054014, 'bull_atr_min_pct': 0.0185577172320844, 'bull_atr_max_pct': 0.10425196813547527, 'bull_tp_mult': 2.485063173626, 'bull_tsl_mult': 0.9555120259614421, 'bull_time_stop': 216, 'bull_use_sma': True, 'bull_use_ema': False, 'bull_use_atr': False, 'bull_use_adx': True, 'bull_use_spike': True, 'bull_rsi_required': False, 'bear_strategy': 'breakout', 'bear_bb_std_mult': 2.2516547197640513, 'bear_rsi_os': 43, 'bear_rsi_ob': 87, 'bear_adx_thresh': 18.90301531784236, 'bear_atr_min_pct': 0.007713148784600416, 'bear_atr_max_pct': 0.0842702882391286, 'bear_tp_mult': 2.877452642440391, 'bear_tsl_mult': 0.005099227711654823, 'bear_time_stop': 291, 'bear_use_sma': False, 'bear_use_ema': False, 'bear_use_atr': False, 'bear_use_adx': False, 'bear_use_spike': True, 'bear_rsi_required': False, 'sideways_strategy': 'breakout', 'sideways_bb_std_mult': 3.3893299979190568, 'sideways_rsi_os': 21, 'sideways_rsi_ob': 83, 'sideways_adx_thresh': 13.001900308232955, 'sideways_atr_min_pct': 0.012598954311841859, 'sideways_atr_max_pct': 0.04267565409056981, 'sideways_tp_mult': 2.4068859325648897, 'sideways_tsl_mult': 0.621886217515144, 'sideways_time_stop': 157, 'sideways_use_sma': False, 'sideways_use_ema': False, 'sideways_use_atr': True, 'sideways_use_adx': False, 'sideways_use_spike': False, 'sideways_rsi_required': True}.
[I 2025-08-29 21:06:45,175] Trial 779 finished with values: [-1000000000.0, 1000000000.0] and parameters: {'p_sma': 17, 'p_std': 33, 'p_atr': 16, 'p_adx': 9, 'rsi_period': 31, 'ema1': 23, 'ema2': 22, 'slip_atr_k': 0.006241251593434319, 'slip_spread_k': 0.09735524321156284, 'spread_hl_frac': 0.020575012534516577, 'bb_std_mult': 0.7717486564939221, 'rsi_os': 6, 'rsi_ob': 78, 'vol_spike': 0.2880762893470739, 'adx_thresh': 7.666952235360769, 'atr_min_pct': 0.010572982957697846, 'atr_max_pct': 0.03898110989658428, 'tp_mult': 2.750440492019957, 'tsl_mult': 0.6352793947858488, 'strategy': 'mean_reversion', 'time_stop': 198, 'use_sma': True, 'use_atr': False, 'use_adx': False, 'use_ema': False, 'use_spike': True, 'rsi_required': False, 'edge_k': 0.9790461940372206, 'edge_cap': 0.28775989055980566, 'bull_strategy': 'mean_reversion', 'bull_bb_std_mult': 2.597173194386817, 'bull_rsi_os': 22, 'bull_rsi_ob': 70, 'bull_adx_thresh': 27.42360912188179, 'bull_atr_min_pct': 0.01850293145663817, 'bull_atr_max_pct': 0.10968928864896965, 'bull_tp_mult': 2.4683776473386416, 'bull_tsl_mult': 0.9407878606467373, 'bull_time_stop': 215, 'bull_use_sma': True, 'bull_use_ema': False, 'bull_use_atr': False, 'bull_use_adx': True, 'bull_use_spike': True, 'bull_rsi_required': False, 'bear_strategy': 'breakout', 'bear_bb_std_mult': 2.234335325519198, 'bear_rsi_os': 40, 'bear_rsi_ob': 87, 'bear_adx_thresh': 17.856198797835958, 'bear_atr_min_pct': 0.0076580381934439595, 'bear_atr_max_pct': 0.08427641315345799, 'bear_tp_mult': 2.8772504189614287, 'bear_tsl_mult': 0.00945736984862141, 'bear_time_stop': 254, 'bear_use_sma': False, 'bear_use_ema': False, 'bear_use_atr': False, 'bear_use_adx': False, 'bear_use_spike': True, 'bear_rsi_required': False, 'sideways_strategy': 'breakout', 'sideways_bb_std_mult': 3.4998756814131813, 'sideways_rsi_os': 20, 'sideways_rsi_ob': 83, 'sideways_adx_thresh': 12.403671931603853, 'sideways_atr_min_pct': 0.012211049945063468, 'sideways_atr_max_pct': 0.035352160673090535, 'sideways_tp_mult': 2.420572437575524, 'sideways_tsl_mult': 0.6275472726182779, 'sideways_time_stop': 156, 'sideways_use_sma': False, 'sideways_use_ema': False, 'sideways_use_atr': True, 'sideways_use_adx': False, 'sideways_use_spike': False, 'sideways_rsi_required': True}.
[I 2025-08-29 21:07:14,483] Trial 782 finished with values: [-1000000000.0, 1000000000.0] and parameters: {'p_sma': 17, 'p_std': 31, 'p_atr': 16, 'p_adx': 8, 'rsi_period': 28, 'ema1': 24, 'ema2': 21, 'slip_atr_k': 3.6261174439450566e-05, 'slip_spread_k': 0.05907344021259758, 'spread_hl_frac': 0.022548553856934748, 'bb_std_mult': 1.0272009377739213, 'rsi_os': 6, 'rsi_ob': 76, 'vol_spike': 0.29980884995382084, 'adx_thresh': 7.820572566996557, 'atr_min_pct': 0.009838743609684909, 'atr_max_pct': 0.036245771215821704, 'tp_mult': 2.9389648387224296, 'tsl_mult': 0.7346982141717572, 'strategy': 'mean_reversion', 'time_stop': 213, 'use_sma': True, 'use_atr': False, 'use_adx': False, 'use_ema': False, 'use_spike': True, 'rsi_required': False, 'edge_k': 0.8895903003215757, 'edge_cap': 0.2918090579108932, 'bull_strategy': 'mean_reversion', 'bull_bb_std_mult': 2.739481209239086, 'bull_rsi_os': 20, 'bull_rsi_ob': 68, 'bull_adx_thresh': 28.503186748488393, 'bull_atr_min_pct': 0.020029474001096788, 'bull_atr_max_pct': 0.10791845530732257, 'bull_tp_mult': 2.41382393727056, 'bull_tsl_mult': 0.9413375800008619, 'bull_time_stop': 226, 'bull_use_sma': True, 'bull_use_ema': False, 'bull_use_atr': False, 'bull_use_adx': True, 'bull_use_spike': True, 'bull_rsi_required': False, 'bear_strategy': 'breakout', 'bear_bb_std_mult': 2.3210981841588536, 'bear_rsi_os': 41, 'bear_rsi_ob': 85, 'bear_adx_thresh': 17.823998995868564, 'bear_atr_min_pct': 0.008670981028459243, 'bear_atr_max_pct': 0.07683442679458552, 'bear_tp_mult': 2.9159223772134157, 'bear_tsl_mult': 0.06352362782554352, 'bear_time_stop': 256, 'bear_use_sma': False, 'bear_use_ema': False, 'bear_use_atr': False, 'bear_use_adx': False, 'bear_use_spike': True, 'bear_rsi_required': False, 'sideways_strategy': 'breakout', 'sideways_bb_std_mult': 3.5006146438714434, 'sideways_rsi_os': 23, 'sideways_rsi_ob': 83, 'sideways_adx_thresh': 13.140286922433626, 'sideways_atr_min_pct': 0.011998323887661401, 'sideways_atr_max_pct': 0.035269389333379, 'sideways_tp_mult': 2.3525454805669352, 'sideways_tsl_mult': 0.629649986421696, 'sideways_time_stop': 153, 'sideways_use_sma': False, 'sideways_use_ema': False, 'sideways_use_atr': True, 'sideways_use_adx': False, 'sideways_use_spike': False, 'sideways_rsi_required': True}.
[I 2025-08-29 21:07:14,955] Trial 781 finished with values: [-1000000000.0, 1000000000.0] and parameters: {'p_sma': 13, 'p_std': 34, 'p_atr': 16, 'p_adx': 8, 'rsi_period': 28, 'ema1': 23, 'ema2': 22, 'slip_atr_k': 0.008981136852880447, 'slip_spread_k': 0.09921493470623013, 'spread_hl_frac': 0.021133727199713917, 'bb_std_mult': 0.7608559966299506, 'rsi_os': 6, 'rsi_ob': 78, 'vol_spike': 0.29574796926454633, 'adx_thresh': 9.432024021604276, 'atr_min_pct': 0.010625680397211776, 'atr_max_pct': 0.03717680296192041, 'tp_mult': 2.560043366640285, 'tsl_mult': 0.6406373872753558, 'strategy': 'mean_reversion', 'time_stop': 197, 'use_sma': True, 'use_atr': False, 'use_adx': False, 'use_ema': False, 'use_spike': True, 'rsi_required': False, 'edge_k': 0.9957934785050868, 'edge_cap': 0.2850035311728283, 'bull_strategy': 'mean_reversion', 'bull_bb_std_mult': 2.7513195227202187, 'bull_rsi_os': 20, 'bull_rsi_ob': 70, 'bull_adx_thresh': 28.217562134757692, 'bull_atr_min_pct': 0.01903044079289562, 'bull_atr_max_pct': 0.10400290477574531, 'bull_tp_mult': 2.460421631312907, 'bull_tsl_mult': 0.9434357298084302, 'bull_time_stop': 228, 'bull_use_sma': True, 'bull_use_ema': False, 'bull_use_atr': False, 'bull_use_adx': True, 'bull_use_spike': True, 'bull_rsi_required': False, 'bear_strategy': 'breakout', 'bear_bb_std_mult': 2.225922307347353, 'bear_rsi_os': 41, 'bear_rsi_ob': 88, 'bear_adx_thresh': 17.73177383069907, 'bear_atr_min_pct': 0.009079358464624107, 'bear_atr_max_pct': 0.07616875053015196, 'bear_tp_mult': 2.9179920086692874, 'bear_tsl_mult': 0.06379992073602232, 'bear_time_stop': 267, 'bear_use_sma': False, 'bear_use_ema': False, 'bear_use_atr': False, 'bear_use_adx': False, 'bear_use_spike': True, 'bear_rsi_required': False, 'sideways_strategy': 'breakout', 'sideways_bb_std_mult': 3.4877763581802363, 'sideways_rsi_os': 22, 'sideways_rsi_ob': 83, 'sideways_adx_thresh': 13.255751447678009, 'sideways_atr_min_pct': 0.0117528036002592, 'sideways_atr_max_pct': 0.0361276760760192, 'sideways_tp_mult': 2.4190768072069604, 'sideways_tsl_mult': 0.6363442458160665, 'sideways_time_stop': 157, 'sideways_use_sma': False, 'sideways_use_ema': False, 'sideways_use_atr': True, 'sideways_use_adx': False, 'sideways_use_spike': False, 'sideways_rsi_required': True}.
[I 2025-08-29 21:07:15,181] Trial 780 finished with values: [-1000000000.0, 1000000000.0] and parameters: {'p_sma': 17, 'p_std': 34, 'p_atr': 16, 'p_adx': 8, 'rsi_period': 32, 'ema1': 22, 'ema2': 21, 'slip_atr_k': 0.00821293784318368, 'slip_spread_k': 0.1023479238465572, 'spread_hl_frac': 0.02091213507651703, 'bb_std_mult': 0.7823253982083525, 'rsi_os': 6, 'rsi_ob': 78, 'vol_spike': 0.2984828858190408, 'adx_thresh': 8.078899321256166, 'atr_min_pct': 0.010603012905551759, 'atr_max_pct': 0.037977348955898105, 'tp_mult': 2.1723030404732384, 'tsl_mult': 0.7420252819401, 'strategy': 'mean_reversion', 'time_stop': 198, 'use_sma': True, 'use_atr': False, 'use_adx': False, 'use_ema': False, 'use_spike': True, 'rsi_required': False, 'edge_k': 0.9646506345021405, 'edge_cap': 0.3263185025641624, 'bull_strategy': 'mean_reversion', 'bull_bb_std_mult': 2.7248768010617592, 'bull_rsi_os': 22, 'bull_rsi_ob': 70, 'bull_adx_thresh': 28.39938295323105, 'bull_atr_min_pct': 0.019698805952744158, 'bull_atr_max_pct': 0.10462839184103953, 'bull_tp_mult': 2.477348733788403, 'bull_tsl_mult': 0.943566026949344, 'bull_time_stop': 216, 'bull_use_sma': True, 'bull_use_ema': False, 'bull_use_atr': False, 'bull_use_adx': True, 'bull_use_spike': True, 'bull_rsi_required': False, 'bear_strategy': 'breakout', 'bear_bb_std_mult': 2.2460111802062697, 'bear_rsi_os': 41, 'bear_rsi_ob': 85, 'bear_adx_thresh': 17.821114688622114, 'bear_atr_min_pct': 0.008514796465737162, 'bear_atr_max_pct': 0.08392043226208432, 'bear_tp_mult': 2.8836878988197516, 'bear_tsl_mult': 0.0298001641329352, 'bear_time_stop': 291, 'bear_use_sma': False, 'bear_use_ema': False, 'bear_use_atr': False, 'bear_use_adx': False, 'bear_use_spike': True, 'bear_rsi_required': False, 'sideways_strategy': 'breakout', 'sideways_bb_std_mult': 3.4763109103745324, 'sideways_rsi_os': 23, 'sideways_rsi_ob': 83, 'sideways_adx_thresh': 12.570185234766171, 'sideways_atr_min_pct': 0.012624853620049078, 'sideways_atr_max_pct': 0.03450892032578254, 'sideways_tp_mult': 2.416523730667527, 'sideways_tsl_mult': 0.6246243383407748, 'sideways_time_stop': 157, 'sideways_use_sma': False, 'sideways_use_ema': False, 'sideways_use_atr': True, 'sideways_use_adx': False, 'sideways_use_spike': False, 'sideways_rsi_required': True}.
