[I 2025-08-29 21:07:15,182] Trial 783 finished with values: [-1000000000.0, 1000000000.0] and parameters: {'p_sma': 17, 'p_std': 31, 'p_atr': 17, 'p_adx': 8, 'rsi_period': 28, 'ema1': 24, 'ema2': 21, 'slip_atr_k': 0.009347416490806983, 'slip_spread_k': 0.0438631317788727, 'spread_hl_frac': 0.021964087056765436, 'bb_std_mult': 0.8700313030870428, 'rsi_os': 5, 'rsi_ob': 77, 'vol_spike': 0.2991371744600214, 'adx_thresh': 9.455972232795084, 'atr_min_pct': 0.009856289133820483, 'atr_max_pct': 0.037258944023117226, 'tp_mult': 2.8244626075158856, 'tsl_mult': 0.7413018839048199, 'strategy': 'mean_reversion', 'time_stop': 213, 'use_sma': True, 'use_atr': False, 'use_adx': False, 'use_ema': False, 'use_spike': True, 'rsi_required': False, 'edge_k': 0.9783846630617321, 'edge_cap': 0.30335886723442707, 'bull_strategy': 'mean_reversion', 'bull_bb_std_mult': 2.7156247306129875, 'bull_rsi_os': 20, 'bull_rsi_ob': 68, 'bull_adx_thresh': 28.527945230505267, 'bull_atr_min_pct': 0.02013159064346922, 'bull_atr_max_pct': 0.10394134048849855, 'bull_tp_mult': 2.4110897811989904, 'bull_tsl_mult': 0.9426290587167128, 'bull_time_stop': 226, 'bull_use_sma': True, 'bull_use_ema': False, 'bull_use_atr': False, 'bull_use_adx': True, 'bull_use_spike': True, 'bull_rsi_required': False, 'bear_strategy': 'breakout', 'bear_bb_std_mult': 2.3452709688749867, 'bear_rsi_os': 41, 'bear_rsi_ob': 85, 'bear_adx_thresh': 18.047278055502836, 'bear_atr_min_pct': 0.008803257392888605, 'bear_atr_max_pct': 0.07534249155256982, 'bear_tp_mult': 2.9186074181656845, 'bear_tsl_mult': 0.06495174662582642, 'bear_time_stop': 269, 'bear_use_sma': False, 'bear_use_ema': False, 'bear_use_atr': False, 'bear_use_adx': False, 'bear_use_spike': True, 'bear_rsi_required': False, 'sideways_strategy': 'breakout', 'sideways_bb_std_mult': 3.4652294108776904, 'sideways_rsi_os': 22, 'sideways_rsi_ob': 84, 'sideways_adx_thresh': 13.999918664138734, 'sideways_atr_min_pct': 0.011684192397597914, 'sideways_atr_max_pct': 0.0384178560339573, 'sideways_tp_mult': 2.342368433867034, 'sideways_tsl_mult': 0.602636542652463, 'sideways_time_stop': 134, 'sideways_use_sma': False, 'sideways_use_ema': False, 'sideways_use_atr': True, 'sideways_use_adx': False, 'sideways_use_spike': False, 'sideways_rsi_required': True}.
[I 2025-08-29 21:07:44,867] Trial 787 finished with values: [0.0016175445201416228, 0.0010294272473322641] and parameters: {'p_sma': 17, 'p_std': 32, 'p_atr': 17, 'p_adx': 9, 'rsi_period': 32, 'ema1': 23, 'ema2': 25, 'slip_atr_k': 0.004010374448588574, 'slip_spread_k': 0.0686180566322545, 'spread_hl_frac': 0.023496184222868418, 'bb_std_mult': 1.0273930445863937, 'rsi_os': 5, 'rsi_ob': 76, 'vol_spike': 0.2915972763967102, 'adx_thresh': 8.752083873990562, 'atr_min_pct': 0.012227165991658578, 'atr_max_pct': 0.03538867567374765, 'tp_mult': 2.6448473614500356, 'tsl_mult': 0.7857453399559009, 'strategy': 'mean_reversion', 'time_stop': 204, 'use_sma': True, 'use_atr': False, 'use_adx': False, 'use_ema': False, 'use_spike': True, 'rsi_required': False, 'edge_k': 0.9246555733882547, 'edge_cap': 0.3293217040272048, 'bull_strategy': 'mean_reversion', 'bull_bb_std_mult': 2.819546209958359, 'bull_rsi_os': 23, 'bull_rsi_ob': 69, 'bull_adx_thresh': 29.380638180866313, 'bull_atr_min_pct': 0.0184142558189427, 'bull_atr_max_pct': 0.11104635340434774, 'bull_tp_mult': 2.4974356906692172, 'bull_tsl_mult': 0.9738132706041455, 'bull_time_stop': 206, 'bull_use_sma': True, 'bull_use_ema': False, 'bull_use_atr': False, 'bull_use_adx': True, 'bull_use_spike': True, 'bull_rsi_required': False, 'bear_strategy': 'breakout', 'bear_bb_std_mult': 2.293636548363555, 'bear_rsi_os': 43, 'bear_rsi_ob': 89, 'bear_adx_thresh': 19.060992958265054, 'bear_atr_min_pct': 0.0066670897680080506, 'bear_atr_max_pct': 0.08054456923794269, 'bear_tp_mult': 2.9962231594711755, 'bear_tsl_mult': 0.03125605585428065, 'bear_time_stop': 198, 'bear_use_sma': False, 'bear_use_ema': False, 'bear_use_atr': False, 'bear_use_adx': False, 'bear_use_spike': True, 'bear_rsi_required': False, 'sideways_strategy': 'breakout', 'sideways_bb_std_mult': 3.4027167694624616, 'sideways_rsi_os': 19, 'sideways_rsi_ob': 85, 'sideways_adx_thresh': 14.024000979347713, 'sideways_atr_min_pct': 0.01344193832629694, 'sideways_atr_max_pct': 0.033659582955065506, 'sideways_tp_mult': 2.278571819219445, 'sideways_tsl_mult': 0.5786425065015348, 'sideways_time_stop': 135, 'sideways_use_sma': False, 'sideways_use_ema': False, 'sideways_use_atr': True, 'sideways_use_adx': False, 'sideways_use_spike': False, 'sideways_rsi_required': True}.
[I 2025-08-29 21:07:45,105] Trial 784 finished with values: [-1000000000.0, 1000000000.0] and parameters: {'p_sma': 13, 'p_std': 34, 'p_atr': 17, 'p_adx': 8, 'rsi_period': 32, 'ema1': 22, 'ema2': 26, 'slip_atr_k': 0.009073401502776949, 'slip_spread_k': 0.04361287300784078, 'spread_hl_frac': 0.023716640121721016, 'bb_std_mult': 0.8752663714751319, 'rsi_os': 5, 'rsi_ob': 76, 'vol_spike': 0.2998608210327886, 'adx_thresh': 9.384568868310149, 'atr_min_pct': 0.01196475001948193, 'atr_max_pct': 0.03704398233437667, 'tp_mult': 2.661467906688477, 'tsl_mult': 0.5486211845323481, 'strategy': 'mean_reversion', 'time_stop': 195, 'use_sma': True, 'use_atr': False, 'use_adx': False, 'use_ema': False, 'use_spike': True, 'rsi_required': False, 'edge_k': 0.9484186216444251, 'edge_cap': 0.3270302354048687, 'bull_strategy': 'mean_reversion', 'bull_bb_std_mult': 2.7414285786034664, 'bull_rsi_os': 20, 'bull_rsi_ob': 68, 'bull_adx_thresh': 29.405569909613963, 'bull_atr_min_pct': 0.019590003739084896, 'bull_atr_max_pct': 0.10433804809696397, 'bull_tp_mult': 2.347735509502831, 'bull_tsl_mult': 0.9878567060742931, 'bull_time_stop': 207, 'bull_use_sma': True, 'bull_use_ema': False, 'bull_use_atr': False, 'bull_use_adx': True, 'bull_use_spike': True, 'bull_rsi_required': False, 'bear_strategy': 'breakout', 'bear_bb_std_mult': 2.287479136562095, 'bear_rsi_os': 41, 'bear_rsi_ob': 89, 'bear_adx_thresh': 18.238751215489447, 'bear_atr_min_pct': 0.006686734421700753, 'bear_atr_max_pct': 0.0753423327533353, 'bear_tp_mult': 2.9940728845565396, 'bear_tsl_mult': 0.0255260472415351, 'bear_time_stop': 266, 'bear_use_sma': False, 'bear_use_ema': False, 'bear_use_atr': False, 'bear_use_adx': False, 'bear_use_spike': True, 'bear_rsi_required': False, 'sideways_strategy': 'breakout', 'sideways_bb_std_mult': 3.45587163630307, 'sideways_rsi_os': 22, 'sideways_rsi_ob': 84, 'sideways_adx_thresh': 14.04757344732234, 'sideways_atr_min_pct': 0.011540815917677623, 'sideways_atr_max_pct': 0.03845508433603957, 'sideways_tp_mult': 2.279785335608122, 'sideways_tsl_mult': 0.6320357196248438, 'sideways_time_stop': 147, 'sideways_use_sma': False, 'sideways_use_ema': False, 'sideways_use_atr': True, 'sideways_use_adx': False, 'sideways_use_spike': False, 'sideways_rsi_required': True}.
[I 2025-08-29 21:07:45,205] Trial 786 finished with values: [-1000000000.0, 1000000000.0] and parameters: {'p_sma': 16, 'p_std': 32, 'p_atr': 17, 'p_adx': 9, 'rsi_period': 32, 'ema1': 23, 'ema2': 25, 'slip_atr_k': 0.00011598261923754849, 'slip_spread_k': 0.06134457683948075, 'spread_hl_frac': 0.019338403439629302, 'bb_std_mult': 0.8723554914812487, 'rsi_os': 5, 'rsi_ob': 77, 'vol_spike': 0.2922312301497685, 'adx_thresh': 8.776425065098149, 'atr_min_pct': 0.01196903544519478, 'atr_max_pct': 0.03516635691689751, 'tp_mult': 2.8881486092679673, 'tsl_mult': 0.7866756494668339, 'strategy': 'mean_reversion', 'time_stop': 207, 'use_sma': True, 'use_atr': False, 'use_adx': False, 'use_ema': False, 'use_spike': True, 'rsi_required': False, 'edge_k': 0.9145941259367378, 'edge_cap': 0.333811964042977, 'bull_strategy': 'mean_reversion', 'bull_bb_std_mult': 2.6399473589565186, 'bull_rsi_os': 23, 'bull_rsi_ob': 69, 'bull_adx_thresh': 29.30552668851941, 'bull_atr_min_pct': 0.019328929461968652, 'bull_atr_max_pct': 0.11171346191673713, 'bull_tp_mult': 2.3690139235933696, 'bull_tsl_mult': 0.9748978020855023, 'bull_time_stop': 207, 'bull_use_sma': True, 'bull_use_ema': False, 'bull_use_atr': False, 'bull_use_adx': True, 'bull_use_spike': True, 'bull_rsi_required': False, 'bear_strategy': 'breakout', 'bear_bb_std_mult': 2.3016067486643172, 'bear_rsi_os': 43, 'bear_rsi_ob': 89, 'bear_adx_thresh': 18.952980091525916, 'bear_atr_min_pct': 0.0070830708924545715, 'bear_atr_max_pct': 0.0799232346727186, 'bear_tp_mult': 2.994073023920662, 'bear_tsl_mult': 0.03112148193692021, 'bear_time_stop': 233, 'bear_use_sma': False, 'bear_use_ema': False, 'bear_use_atr': False, 'bear_use_adx': False, 'bear_use_spike': True, 'bear_rsi_required': False, 'sideways_strategy': 'breakout', 'sideways_bb_std_mult': 3.3953312653671373, 'sideways_rsi_os': 19, 'sideways_rsi_ob': 86, 'sideways_adx_thresh': 13.954562183799958, 'sideways_atr_min_pct': 0.013528668090561798, 'sideways_atr_max_pct': 0.03390738935859359, 'sideways_tp_mult': 2.298891471924941, 'sideways_tsl_mult': 0.5764326764042845, 'sideways_time_stop': 136, 'sideways_use_sma': False, 'sideways_use_ema': False, 'sideways_use_atr': True, 'sideways_use_adx': False, 'sideways_use_spike': False, 'sideways_rsi_required': True}.
[I 2025-08-29 21:07:45,316] Trial 785 finished with values: [0.0014339402374332622, 0.0008667125949856703] and parameters: {'p_sma': 17, 'p_std': 31, 'p_atr': 17, 'p_adx': 8, 'rsi_period': 32, 'ema1': 22, 'ema2': 26, 'slip_atr_k': 0.004561945113591612, 'slip_spread_k': 0.03923626264150547, 'spread_hl_frac': 0.023089528449077478, 'bb_std_mult': 0.8583801728449265, 'rsi_os': 6, 'rsi_ob': 76, 'vol_spike': 0.29404436297587005, 'adx_thresh': 8.514965159880298, 'atr_min_pct': 0.010068764021864265, 'atr_max_pct': 0.03614422853122578, 'tp_mult': 2.6467510441463955, 'tsl_mult': 0.7848261270051742, 'strategy': 'mean_reversion', 'time_stop': 211, 'use_sma': True, 'use_atr': False, 'use_adx': False, 'use_ema': False, 'use_spike': True, 'rsi_required': False, 'edge_k': 0.9394824951009593, 'edge_cap': 0.3292161835106436, 'bull_strategy': 'mean_reversion', 'bull_bb_std_mult': 2.6957874081121167, 'bull_rsi_os': 20, 'bull_rsi_ob': 68, 'bull_adx_thresh': 29.375437377165234, 'bull_atr_min_pct': 0.019475947031388285, 'bull_atr_max_pct': 0.111238042211041, 'bull_tp_mult': 2.348900613680853, 'bull_tsl_mult': 0.9840648762011099, 'bull_time_stop': 205, 'bull_use_sma': True, 'bull_use_ema': False, 'bull_use_atr': False, 'bull_use_adx': True, 'bull_use_spike': True, 'bull_rsi_required': False, 'bear_strategy': 'breakout', 'bear_bb_std_mult': 2.2886576970581087, 'bear_rsi_os': 42, 'bear_rsi_ob': 89, 'bear_adx_thresh': 18.250453044917183, 'bear_atr_min_pct': 0.006538660042457916, 'bear_atr_max_pct': 0.08028425530468385, 'bear_tp_mult': 2.9931744149629647, 'bear_tsl_mult': 0.03499095895917942, 'bear_time_stop': 231, 'bear_use_sma': False, 'bear_use_ema': False, 'bear_use_atr': False, 'bear_use_adx': False, 'bear_use_spike': True, 'bear_rsi_required': False, 'sideways_strategy': 'breakout', 'sideways_bb_std_mult': 3.398774096023338, 'sideways_rsi_os': 22, 'sideways_rsi_ob': 84, 'sideways_adx_thresh': 13.913525565143935, 'sideways_atr_min_pct': 0.013656090019409399, 'sideways_atr_max_pct': 0.03433358644486097, 'sideways_tp_mult': 2.282975308453235, 'sideways_tsl_mult': 0.5983457309916095, 'sideways_time_stop': 136, 'sideways_use_sma': False, 'sideways_use_ema': False, 'sideways_use_atr': True, 'sideways_use_adx': False, 'sideways_use_spike': False, 'sideways_rsi_required': True}.
[I 2025-08-29 21:08:14,237] Trial 791 finished with values: [-1000000000.0, 1000000000.0] and parameters: {'p_sma': 17, 'p_std': 31, 'p_atr': 17, 'p_adx': 9, 'rsi_period': 30, 'ema1': 24, 'ema2': 27, 'slip_atr_k': 0.014416461635618471, 'slip_spread_k': 0.0736083430506936, 'spread_hl_frac': 0.019725964466326573, 'bb_std_mult': 0.9926044696971268, 'rsi_os': 7, 'rsi_ob': 76, 'vol_spike': 0.2870972361312646, 'adx_thresh': 8.788315059273561, 'atr_min_pct': 0.01113842068069507, 'atr_max_pct': 0.03569887545189354, 'tp_mult': 2.1101578070999776, 'tsl_mult': 0.7951902985805255, 'strategy': 'mean_reversion', 'time_stop': 203, 'use_sma': True, 'use_atr': False, 'use_adx': False, 'use_ema': False, 'use_spike': True, 'rsi_required': False, 'edge_k': 0.998135756126185, 'edge_cap': 0.30246972621855134, 'bull_strategy': 'mean_reversion', 'bull_bb_std_mult': 2.7819570030083844, 'bull_rsi_os': 23, 'bull_rsi_ob': 70, 'bull_adx_thresh': 29.268504817343842, 'bull_atr_min_pct': 0.01846904271385571, 'bull_atr_max_pct': 0.10912986182309872, 'bull_tp_mult': 2.4917227462418645, 'bull_tsl_mult': 0.932928476709985, 'bull_time_stop': 220, 'bull_use_sma': True, 'bull_use_ema': False, 'bull_use_atr': False, 'bull_use_adx': True, 'bull_use_spike': True, 'bull_rsi_required': False, 'bear_strategy': 'breakout', 'bear_bb_std_mult': 2.3160255738214124, 'bear_rsi_os': 42, 'bear_rsi_ob': 90, 'bear_adx_thresh': 19.063883954893473, 'bear_atr_min_pct': 0.006846991826286175, 'bear_atr_max_pct': 0.08136733282651562, 'bear_tp_mult': 2.9346612433000714, 'bear_tsl_mult': 0.04830085808168813, 'bear_time_stop': 239, 'bear_use_sma': False, 'bear_use_ema': False, 'bear_use_atr': False, 'bear_use_adx': False, 'bear_use_spike': True, 'bear_rsi_required': False, 'sideways_strategy': 'breakout', 'sideways_bb_std_mult': 3.343752404372499, 'sideways_rsi_os': 21, 'sideways_rsi_ob': 85, 'sideways_adx_thresh': 12.002301815401035, 'sideways_atr_min_pct': 0.013596016514076515, 'sideways_atr_max_pct': 0.034092686825686246, 'sideways_tp_mult': 2.385805268282145, 'sideways_tsl_mult': 0.5977616646743387, 'sideways_time_stop': 135, 'sideways_use_sma': False, 'sideways_use_ema': False, 'sideways_use_atr': True, 'sideways_use_adx': False, 'sideways_use_spike': False, 'sideways_rsi_required': True}.
[I 2025-08-29 21:08:14,842] Trial 789 finished with values: [0.001811837713312503, 0.0010272079686299957] and parameters: {'p_sma': 17, 'p_std': 31, 'p_atr': 16, 'p_adx': 9, 'rsi_period': 32, 'ema1': 21, 'ema2': 25, 'slip_atr_k': 0.0040840055507131165, 'slip_spread_k': 0.07287473623709417, 'spread_hl_frac': 0.022756350978286093, 'bb_std_mult': 0.9849277087101502, 'rsi_os': 6, 'rsi_ob': 76, 'vol_spike': 0.29107421501859887, 'adx_thresh': 8.64159194550599, 'atr_min_pct': 0.011158827170833996, 'atr_max_pct': 0.03661271349386136, 'tp_mult': 2.88839472289238, 'tsl_mult': 0.7956532077495476, 'strategy': 'mean_reversion', 'time_stop': 203, 'use_sma': True, 'use_atr': False, 'use_adx': False, 'use_ema': False, 'use_spike': True, 'rsi_required': False, 'edge_k': 0.995536620699673, 'edge_cap': 0.30221165963040353, 'bull_strategy': 'mean_reversion', 'bull_bb_std_mult': 2.792857188435051, 'bull_rsi_os': 22, 'bull_rsi_ob': 69, 'bull_adx_thresh': 29.48870197263181, 'bull_atr_min_pct': 0.019261656062316213, 'bull_atr_max_pct': 0.1094396665678129, 'bull_tp_mult': 2.49846012998407, 'bull_tsl_mult': 0.9717884888229794, 'bull_time_stop': 205, 'bull_use_sma': True, 'bull_use_ema': False, 'bull_use_atr': False, 'bull_use_adx': True, 'bull_use_spike': True, 'bull_rsi_required': False, 'bear_strategy': 'breakout', 'bear_bb_std_mult': 2.3148273211788477, 'bear_rsi_os': 42, 'bear_rsi_ob': 89, 'bear_adx_thresh': 18.981861168626537, 'bear_atr_min_pct': 0.006596366395955139, 'bear_atr_max_pct': 0.0808668345166577, 'bear_tp_mult': 2.9361207863679235, 'bear_tsl_mult': 0.04575758229953383, 'bear_time_stop': 235, 'bear_use_sma': False, 'bear_use_ema': False, 'bear_use_atr': False, 'bear_use_adx': False, 'bear_use_spike': True, 'bear_rsi_required': False, 'sideways_strategy': 'breakout', 'sideways_bb_std_mult': 3.372853773407213, 'sideways_rsi_os': 23, 'sideways_rsi_ob': 83, 'sideways_adx_thresh': 13.576309421405572, 'sideways_atr_min_pct': 0.013486225696299642, 'sideways_atr_max_pct': 0.03370841698145286, 'sideways_tp_mult': 2.372371729885777, 'sideways_tsl_mult': 0.583238431372809, 'sideways_time_stop': 148, 'sideways_use_sma': False, 'sideways_use_ema': False, 'sideways_use_atr': True, 'sideways_use_adx': False, 'sideways_use_spike': False, 'sideways_rsi_required': True}.
[I 2025-08-29 21:08:15,140] Trial 790 finished with values: [0.001699765935164299, 0.0008187059907196894] and parameters: {'p_sma': 17, 'p_std': 31, 'p_atr': 16, 'p_adx': 9, 'rsi_period': 30, 'ema1': 21, 'ema2': 26, 'slip_atr_k': 0.014819606003639733, 'slip_spread_k': 0.07006056221432361, 'spread_hl_frac': 0.02283971322455219, 'bb_std_mult': 0.9856982199235181, 'rsi_os': 6, 'rsi_ob': 76, 'vol_spike': 0.2872985745541206, 'adx_thresh': 8.650423102673033, 'atr_min_pct': 0.0112846480513066, 'atr_max_pct': 0.036074564978593536, 'tp_mult': 2.3678247276727333, 'tsl_mult': 0.7778543104629725, 'strategy': 'mean_reversion', 'time_stop': 203, 'use_sma': True, 'use_atr': False, 'use_adx': False, 'use_ema': False, 'use_spike': True, 'rsi_required': False, 'edge_k': 0.991190776679629, 'edge_cap': 0.3111743153027245, 'bull_strategy': 'mean_reversion', 'bull_bb_std_mult': 2.6903571622537084, 'bull_rsi_os': 21, 'bull_rsi_ob': 70, 'bull_adx_thresh': 29.207041617969644, 'bull_atr_min_pct': 0.01849972353624602, 'bull_atr_max_pct': 0.10701231248756073, 'bull_tp_mult': 2.4956503540660875, 'bull_tsl_mult': 0.9343833991591167, 'bull_time_stop': 205, 'bull_use_sma': True, 'bull_use_ema': False, 'bull_use_atr': False, 'bull_use_adx': True, 'bull_use_spike': True, 'bull_rsi_required': False, 'bear_strategy': 'breakout', 'bear_bb_std_mult': 2.336804650589106, 'bear_rsi_os': 40, 'bear_rsi_ob': 87, 'bear_adx_thresh': 16.945086453175303, 'bear_atr_min_pct': 0.006469630640219794, 'bear_atr_max_pct': 0.08013219576270775, 'bear_tp_mult': 2.9342536291112653, 'bear_tsl_mult': 0.04582354976528486, 'bear_time_stop': 195, 'bear_use_sma': False, 'bear_use_ema': False, 'bear_use_atr': False, 'bear_use_adx': False, 'bear_use_spike': True, 'bear_rsi_required': False, 'sideways_strategy': 'breakout', 'sideways_bb_std_mult': 3.544029007505788, 'sideways_rsi_os': 23, 'sideways_rsi_ob': 83, 'sideways_adx_thresh': 11.99572933468431, 'sideways_atr_min_pct': 0.013509606209956778, 'sideways_atr_max_pct': 0.0341346493158241, 'sideways_tp_mult': 2.3781213831024335, 'sideways_tsl_mult': 0.5888134184393979, 'sideways_time_stop': 148, 'sideways_use_sma': False, 'sideways_use_ema': False, 'sideways_use_atr': True, 'sideways_use_adx': False, 'sideways_use_spike': False, 'sideways_rsi_required': True}.
[I 2025-08-29 21:08:15,150] Trial 788 finished with values: [0.0013707144670869198, 0.00089213910411127] and parameters: {'p_sma': 17, 'p_std': 31, 'p_atr': 17, 'p_adx': 9, 'rsi_period': 32, 'ema1': 24, 'ema2': 26, 'slip_atr_k': 0.004439661194150221, 'slip_spread_k': 0.06264976861616803, 'spread_hl_frac': 0.019580941332593867, 'bb_std_mult': 0.8610160882340161, 'rsi_os': 5, 'rsi_ob': 76, 'vol_spike': 0.2917847294766631, 'adx_thresh': 8.455172862249926, 'atr_min_pct': 0.011831389522146223, 'atr_max_pct': 0.03522144168279194, 'tp_mult': 2.881122134028592, 'tsl_mult': 0.530385974964115, 'strategy': 'mean_reversion', 'time_stop': 205, 'use_sma': True, 'use_atr': False, 'use_adx': False, 'use_ema': False, 'use_spike': True, 'rsi_required': False, 'edge_k': 0.9298887917918658, 'edge_cap': 0.31287795327838347, 'bull_strategy': 'mean_reversion', 'bull_bb_std_mult': 2.7712123716811528, 'bull_rsi_os': 23, 'bull_rsi_ob': 69, 'bull_adx_thresh': 29.303030464642003, 'bull_atr_min_pct': 0.019388783053502105, 'bull_atr_max_pct': 0.10811852330979307, 'bull_tp_mult': 2.33415694766359, 'bull_tsl_mult': 0.9802852115609736, 'bull_time_stop': 206, 'bull_use_sma': True, 'bull_use_ema': False, 'bull_use_atr': False, 'bull_use_adx': True, 'bull_use_spike': True, 'bull_rsi_required': False, 'bear_strategy': 'breakout', 'bear_bb_std_mult': 2.293156180525263, 'bear_rsi_os': 42, 'bear_rsi_ob': 89, 'bear_adx_thresh': 17.123640312401765, 'bear_atr_min_pct': 0.006551310097597133, 'bear_atr_max_pct': 0.08108270175130239, 'bear_tp_mult': 2.9677572088701387, 'bear_tsl_mult': 0.025672400318078267, 'bear_time_stop': 200, 'bear_use_sma': False, 'bear_use_ema': False, 'bear_use_atr': False, 'bear_use_adx': False, 'bear_use_spike': True, 'bear_rsi_required': False, 'sideways_strategy': 'breakout', 'sideways_bb_std_mult': 3.3845746612194985, 'sideways_rsi_os': 22, 'sideways_rsi_ob': 85, 'sideways_adx_thresh': 13.962032336550632, 'sideways_atr_min_pct': 0.013496927652095123, 'sideways_atr_max_pct': 0.03845049034419515, 'sideways_tp_mult': 2.2815673049188323, 'sideways_tsl_mult': 0.5982775603204417, 'sideways_time_stop': 136, 'sideways_use_sma': False, 'sideways_use_ema': False, 'sideways_use_atr': True, 'sideways_use_adx': False, 'sideways_use_spike': False, 'sideways_rsi_required': True}.
