[I 2025-08-29 20:29:05,780] Trial 440 finished with values: [-0.009395555004780953, 0.00934748535960592] and parameters: {'p_sma': 60, 'p_std': 39, 'p_atr': 25, 'p_adx': 21, 'rsi_period': 7, 'ema1': 7, 'ema2': 56, 'slip_atr_k': 0.0958145173697622, 'slip_spread_k': 0.139741111948076, 'spread_hl_frac': 0.04840167617309494, 'bb_std_mult': 1.8365848901112174, 'rsi_os': 7, 'rsi_ob': 82, 'vol_spike': 0.2972072930805249, 'adx_thresh': 21.380312751037593, 'atr_min_pct': 0.009899898351097542, 'atr_max_pct': 0.026563304825787653, 'tp_mult': 1.3796726690491647, 'tsl_mult': 0.9265475809959726, 'strategy': 'breakout', 'time_stop': 38, 'use_sma': True, 'use_atr': False, 'use_adx': True, 'use_ema': True, 'use_spike': False, 'rsi_required': False, 'edge_k': 0.6531282878580656, 'edge_cap': 0.3623615114886449, 'bull_strategy': 'mean_reversion', 'bull_bb_std_mult': 3.0167421999616484, 'bull_rsi_os': 15, 'bull_rsi_ob': 58, 'bull_adx_thresh': 13.898172151859239, 'bull_atr_min_pct': 0.016015259721929957, 'bull_atr_max_pct': 0.1077156071350908, 'bull_tp_mult': 2.611128712746805, 'bull_tsl_mult': 0.45720399627557784, 'bull_time_stop': 84, 'bull_use_sma': True, 'bull_use_ema': False, 'bull_use_atr': True, 'bull_use_adx': False, 'bull_use_spike': True, 'bull_rsi_required': False, 'bear_strategy': 'breakout', 'bear_bb_std_mult': 2.323093701594062, 'bear_rsi_os': 53, 'bear_rsi_ob': 68, 'bear_adx_thresh': 33.810760269303735, 'bear_atr_min_pct': 0.005353545115520823, 'bear_atr_max_pct': 0.04846004024569098, 'bear_tp_mult': 1.3644729731203524, 'bear_tsl_mult': 0.9315718278966282, 'bear_time_stop': 53, 'bear_use_sma': True, 'bear_use_ema': True, 'bear_use_atr': False, 'bear_use_adx': True, 'bear_use_spike': True, 'bear_rsi_required': True, 'sideways_strategy': 'breakout', 'sideways_bb_std_mult': 2.272898637845658, 'sideways_rsi_os': 48, 'sideways_rsi_ob': 79, 'sideways_adx_thresh': 30.945161597834474, 'sideways_atr_min_pct': 0.027307757863144697, 'sideways_atr_max_pct': 0.016167559885265647, 'sideways_tp_mult': 1.6867253438483822, 'sideways_tsl_mult': 0.7366332339190073, 'sideways_time_stop': 197, 'sideways_use_sma': True, 'sideways_use_ema': False, 'sideways_use_atr': False, 'sideways_use_adx': True, 'sideways_use_spike': True, 'sideways_rsi_required': True}.
[I 2025-08-29 20:29:06,518] Trial 442 finished with values: [-1000000000.0, 1000000000.0] and parameters: {'p_sma': 16, 'p_std': 20, 'p_atr': 20, 'p_adx': 11, 'rsi_period': 66, 'ema1': 27, 'ema2': 55, 'slip_atr_k': 0.004244961790133421, 'slip_spread_k': 0.6875290321924146, 'spread_hl_frac': 0.02048399030968828, 'bb_std_mult': 1.6292531639216035, 'rsi_os': 12, 'rsi_ob': 81, 'vol_spike': 0.28671913148039685, 'adx_thresh': 13.980168083601717, 'atr_min_pct': 0.018303309605326723, 'atr_max_pct': 0.02518813806908498, 'tp_mult': 2.0269513436729443, 'tsl_mult': 0.9283389731130524, 'strategy': 'breakout', 'time_stop': 151, 'use_sma': False, 'use_atr': False, 'use_adx': True, 'use_ema': True, 'use_spike': False, 'rsi_required': False, 'edge_k': 1.1070810223826768, 'edge_cap': 0.6186158561972508, 'bull_strategy': 'mean_reversion', 'bull_bb_std_mult': 3.106010572900792, 'bull_rsi_os': 17, 'bull_rsi_ob': 85, 'bull_adx_thresh': 14.327543854870848, 'bull_atr_min_pct': 0.015712232261697545, 'bull_atr_max_pct': 0.08775944970076952, 'bull_tp_mult': 2.9926888559782014, 'bull_tsl_mult': 0.9281724147318169, 'bull_time_stop': 213, 'bull_use_sma': True, 'bull_use_ema': False, 'bull_use_atr': True, 'bull_use_adx': False, 'bull_use_spike': True, 'bull_rsi_required': False, 'bear_strategy': 'breakout', 'bear_bb_std_mult': 2.789529761282385, 'bear_rsi_os': 29, 'bear_rsi_ob': 94, 'bear_adx_thresh': 20.160449865049067, 'bear_atr_min_pct': 0.007752417145955994, 'bear_atr_max_pct': 0.04927628950632519, 'bear_tp_mult': 2.466874589690241, 'bear_tsl_mult': 0.937804145235602, 'bear_time_stop': 131, 'bear_use_sma': True, 'bear_use_ema': True, 'bear_use_atr': False, 'bear_use_adx': True, 'bear_use_spike': False, 'bear_rsi_required': False, 'sideways_strategy': 'breakout', 'sideways_bb_std_mult': 2.283497703297279, 'sideways_rsi_os': 37, 'sideways_rsi_ob': 80, 'sideways_adx_thresh': 16.137252169673587, 'sideways_atr_min_pct': 0.00658718222801052, 'sideways_atr_max_pct': 0.02412688216052099, 'sideways_tp_mult': 1.7910964782469048, 'sideways_tsl_mult': 0.7819002617168803, 'sideways_time_stop': 195, 'sideways_use_sma': False, 'sideways_use_ema': False, 'sideways_use_atr': False, 'sideways_use_adx': False, 'sideways_use_spike': True, 'sideways_rsi_required': True}.
[I 2025-08-29 20:29:35,185] Trial 446 finished with values: [-1000000000.0, 1000000000.0] and parameters: {'p_sma': 31, 'p_std': 55, 'p_atr': 25, 'p_adx': 27, 'rsi_period': 40, 'ema1': 29, 'ema2': 33, 'slip_atr_k': 0.00011762359365300693, 'slip_spread_k': 0.21615869699513057, 'spread_hl_frac': 0.0490291014149904, 'bb_std_mult': 1.6922433147950984, 'rsi_os': 30, 'rsi_ob': 89, 'vol_spike': 0.1852510908026916, 'adx_thresh': 12.933726297901838, 'atr_min_pct': 0.0215732856395808, 'atr_max_pct': 0.028475740507292215, 'tp_mult': 1.506983481678451, 'tsl_mult': 0.8528366484477081, 'strategy': 'mean_reversion', 'time_stop': 161, 'use_sma': False, 'use_atr': False, 'use_adx': False, 'use_ema': True, 'use_spike': True, 'rsi_required': False, 'edge_k': 1.0490508059561192, 'edge_cap': 0.6226180645151704, 'bull_strategy': 'mean_reversion', 'bull_bb_std_mult': 2.232216247777715, 'bull_rsi_os': 18, 'bull_rsi_ob': 48, 'bull_adx_thresh': 10.799597566624644, 'bull_atr_min_pct': 0.014677561454617724, 'bull_atr_max_pct': 0.09962791925917566, 'bull_tp_mult': 2.3349692928399834, 'bull_tsl_mult': 0.8106501019037597, 'bull_time_stop': 46, 'bull_use_sma': True, 'bull_use_ema': False, 'bull_use_atr': True, 'bull_use_adx': False, 'bull_use_spike': True, 'bull_rsi_required': False, 'bear_strategy': 'breakout', 'bear_bb_std_mult': 2.6346990694975947, 'bear_rsi_os': 13, 'bear_rsi_ob': 66, 'bear_adx_thresh': 20.42299307807811, 'bear_atr_min_pct': 0.0032885498209056976, 'bear_atr_max_pct': 0.04628944523168537, 'bear_tp_mult': 2.1077997074972603, 'bear_tsl_mult': 0.9548763973999662, 'bear_time_stop': 171, 'bear_use_sma': False, 'bear_use_ema': False, 'bear_use_atr': False, 'bear_use_adx': True, 'bear_use_spike': False, 'bear_rsi_required': False, 'sideways_strategy': 'breakout', 'sideways_bb_std_mult': 1.5037392720193978, 'sideways_rsi_os': 44, 'sideways_rsi_ob': 78, 'sideways_adx_thresh': 34.208700560836405, 'sideways_atr_min_pct': 0.0052521887359643716, 'sideways_atr_max_pct': 0.02674492985661312, 'sideways_tp_mult': 1.1748240502985832, 'sideways_tsl_mult': 0.704104182490288, 'sideways_time_stop': 189, 'sideways_use_sma': False, 'sideways_use_ema': False, 'sideways_use_atr': False, 'sideways_use_adx': False, 'sideways_use_spike': False, 'sideways_rsi_required': False}.
[I 2025-08-29 20:29:35,989] Trial 445 finished with values: [-1000000000.0, 1000000000.0] and parameters: {'p_sma': 16, 'p_std': 16, 'p_atr': 20, 'p_adx': 28, 'rsi_period': 66, 'ema1': 27, 'ema2': 43, 'slip_atr_k': 0.14039925055725205, 'slip_spread_k': 0.2155700117110675, 'spread_hl_frac': 0.04921554070466131, 'bb_std_mult': 1.7003092362940702, 'rsi_os': 12, 'rsi_ob': 84, 'vol_spike': 0.16631996070899324, 'adx_thresh': 12.83015685725248, 'atr_min_pct': 0.021823897102504243, 'atr_max_pct': 0.026915715831814555, 'tp_mult': 1.2315017763901719, 'tsl_mult': 0.8673935506933627, 'strategy': 'mean_reversion', 'time_stop': 56, 'use_sma': False, 'use_atr': False, 'use_adx': False, 'use_ema': True, 'use_spike': True, 'rsi_required': False, 'edge_k': 0.8507645574920213, 'edge_cap': 0.08169110232538135, 'bull_strategy': 'mean_reversion', 'bull_bb_std_mult': 3.1005982179063944, 'bull_rsi_os': 20, 'bull_rsi_ob': 84, 'bull_adx_thresh': 15.025820917285602, 'bull_atr_min_pct': 0.014668119306896649, 'bull_atr_max_pct': 0.08802760859506119, 'bull_tp_mult': 2.746181764630424, 'bull_tsl_mult': 0.868086980216607, 'bull_time_stop': 47, 'bull_use_sma': True, 'bull_use_ema': False, 'bull_use_atr': True, 'bull_use_adx': False, 'bull_use_spike': True, 'bull_rsi_required': False, 'bear_strategy': 'breakout', 'bear_bb_std_mult': 2.800010038723368, 'bear_rsi_os': 27, 'bear_rsi_ob': 66, 'bear_adx_thresh': 23.072413279122312, 'bear_atr_min_pct': 0.007166226996759727, 'bear_atr_max_pct': 0.04931798214734772, 'bear_tp_mult': 2.476952303061805, 'bear_tsl_mult': 0.9464190870455635, 'bear_time_stop': 131, 'bear_use_sma': False, 'bear_use_ema': True, 'bear_use_atr': False, 'bear_use_adx': True, 'bear_use_spike': False, 'bear_rsi_required': False, 'sideways_strategy': 'breakout', 'sideways_bb_std_mult': 3.345439637462639, 'sideways_rsi_os': 55, 'sideways_rsi_ob': 80, 'sideways_adx_thresh': 34.25958749586077, 'sideways_atr_min_pct': 0.006625600257428428, 'sideways_atr_max_pct': 0.026968807943064565, 'sideways_tp_mult': 1.7933161814277188, 'sideways_tsl_mult': 0.7067186721468578, 'sideways_time_stop': 189, 'sideways_use_sma': False, 'sideways_use_ema': False, 'sideways_use_atr': False, 'sideways_use_adx': False, 'sideways_use_spike': False, 'sideways_rsi_required': False}.
[I 2025-08-29 20:29:36,132] Trial 443 finished with values: [-0.007830732408694585, 0.007831484628189929] and parameters: {'p_sma': 16, 'p_std': 36, 'p_atr': 25, 'p_adx': 11, 'rsi_period': 40, 'ema1': 7, 'ema2': 43, 'slip_atr_k': 0.006232370732215878, 'slip_spread_k': 0.16758340420371354, 'spread_hl_frac': 0.048917807708026353, 'bb_std_mult': 2.045485661673668, 'rsi_os': 12, 'rsi_ob': 81, 'vol_spike': 0.16735991102485193, 'adx_thresh': 12.82931531117423, 'atr_min_pct': 0.018337910427346952, 'atr_max_pct': 0.12468865890520103, 'tp_mult': 1.2302738067783254, 'tsl_mult': 0.6899324695834597, 'strategy': 'breakout', 'time_stop': 150, 'use_sma': False, 'use_atr': False, 'use_adx': True, 'use_ema': True, 'use_spike': False, 'rsi_required': False, 'edge_k': 1.016215626090146, 'edge_cap': 0.6214450943452483, 'bull_strategy': 'mean_reversion', 'bull_bb_std_mult': 3.101835576809663, 'bull_rsi_os': 15, 'bull_rsi_ob': 70, 'bull_adx_thresh': 15.086918890701856, 'bull_atr_min_pct': 0.015876744987626597, 'bull_atr_max_pct': 0.0991334887807514, 'bull_tp_mult': 2.676237996888712, 'bull_tsl_mult': 0.9281666601672527, 'bull_time_stop': 212, 'bull_use_sma': True, 'bull_use_ema': False, 'bull_use_atr': True, 'bull_use_adx': False, 'bull_use_spike': True, 'bull_rsi_required': False, 'bear_strategy': 'breakout', 'bear_bb_std_mult': 2.760004012532898, 'bear_rsi_os': 29, 'bear_rsi_ob': 66, 'bear_adx_thresh': 20.217409106053722, 'bear_atr_min_pct': 0.007079189158365689, 'bear_atr_max_pct': 0.049923403984639625, 'bear_tp_mult': 1.550853213272703, 'bear_tsl_mult': 0.9355212368520571, 'bear_time_stop': 272, 'bear_use_sma': False, 'bear_use_ema': True, 'bear_use_atr': False, 'bear_use_adx': True, 'bear_use_spike': False, 'bear_rsi_required': False, 'sideways_strategy': 'breakout', 'sideways_bb_std_mult': 0.5014679368279884, 'sideways_rsi_os': 55, 'sideways_rsi_ob': 70, 'sideways_adx_thresh': 15.945147666859857, 'sideways_atr_min_pct': 0.00291046466259515, 'sideways_atr_max_pct': 0.02415939696702264, 'sideways_tp_mult': 1.1355114051141946, 'sideways_tsl_mult': 0.7435162778523554, 'sideways_time_stop': 78, 'sideways_use_sma': False, 'sideways_use_ema': False, 'sideways_use_atr': False, 'sideways_use_adx': False, 'sideways_use_spike': True, 'sideways_rsi_required': True}.
[I 2025-08-29 20:29:36,223] Trial 444 finished with values: [-1000000000.0, 1000000000.0] and parameters: {'p_sma': 17, 'p_std': 55, 'p_atr': 20, 'p_adx': 11, 'rsi_period': 66, 'ema1': 29, 'ema2': 43, 'slip_atr_k': 0.004677799944784761, 'slip_spread_k': 0.6853131256676309, 'spread_hl_frac': 0.04889950198835022, 'bb_std_mult': 1.8314182643962316, 'rsi_os': 12, 'rsi_ob': 83, 'vol_spike': 0.291081169155304, 'adx_thresh': 12.882701821446242, 'atr_min_pct': 0.02252370508519637, 'atr_max_pct': 0.026153714823761977, 'tp_mult': 2.0225524470104137, 'tsl_mult': 0.5033885933277088, 'strategy': 'mean_reversion', 'time_stop': 155, 'use_sma': False, 'use_atr': False, 'use_adx': False, 'use_ema': True, 'use_spike': False, 'rsi_required': False, 'edge_k': 1.0154514004044468, 'edge_cap': 0.627814164701342, 'bull_strategy': 'mean_reversion', 'bull_bb_std_mult': 3.265342979644747, 'bull_rsi_os': 17, 'bull_rsi_ob': 71, 'bull_adx_thresh': 15.100263157356277, 'bull_atr_min_pct': 0.016076116181090387, 'bull_atr_max_pct': 0.14741613162593065, 'bull_tp_mult': 2.7558529360647115, 'bull_tsl_mult': 0.8701960311084405, 'bull_time_stop': 46, 'bull_use_sma': True, 'bull_use_ema': False, 'bull_use_atr': True, 'bull_use_adx': False, 'bull_use_spike': True, 'bull_rsi_required': False, 'bear_strategy': 'breakout', 'bear_bb_std_mult': 2.8127276908403367, 'bear_rsi_os': 21, 'bear_rsi_ob': 63, 'bear_adx_thresh': 22.902021027866667, 'bear_atr_min_pct': 0.0035103075396370944, 'bear_atr_max_pct': 0.04749320987424942, 'bear_tp_mult': 2.1130576366268845, 'bear_tsl_mult': 0.9492681449721025, 'bear_time_stop': 56, 'bear_use_sma': False, 'bear_use_ema': True, 'bear_use_atr': False, 'bear_use_adx': True, 'bear_use_spike': False, 'bear_rsi_required': False, 'sideways_strategy': 'breakout', 'sideways_bb_std_mult': 2.359398565220851, 'sideways_rsi_os': 48, 'sideways_rsi_ob': 79, 'sideways_adx_thresh': 12.873097236833265, 'sideways_atr_min_pct': 0.0052839696570784935, 'sideways_atr_max_pct': 0.027161860553902073, 'sideways_tp_mult': 1.1202033536362004, 'sideways_tsl_mult': 0.7402770462300494, 'sideways_time_stop': 189, 'sideways_use_sma': False, 'sideways_use_ema': False, 'sideways_use_atr': False, 'sideways_use_adx': False, 'sideways_use_spike': True, 'sideways_rsi_required': True}.
[I 2025-08-29 20:30:05,147] Trial 447 finished with values: [-0.010949650588650162, 0.01092262189909824] and parameters: {'p_sma': 33, 'p_std': 57, 'p_atr': 19, 'p_adx': 7, 'rsi_period': 72, 'ema1': 24, 'ema2': 44, 'slip_atr_k': 0.1043489933788281, 'slip_spread_k': 0.16980903335343958, 'spread_hl_frac': 0.04511832656784032, 'bb_std_mult': 1.7861595437583242, 'rsi_os': 8, 'rsi_ob': 83, 'vol_spike': 0.16715347086917617, 'adx_thresh': 10.658664177179546, 'atr_min_pct': 0.019725012696352243, 'atr_max_pct': 0.027929481602344992, 'tp_mult': 1.26201485741315, 'tsl_mult': 0.6930130300602592, 'strategy': 'mean_reversion', 'time_stop': 297, 'use_sma': True, 'use_atr': False, 'use_adx': False, 'use_ema': True, 'use_spike': False, 'rsi_required': False, 'edge_k': 0.4139943955010301, 'edge_cap': 0.5736163031455952, 'bull_strategy': 'mean_reversion', 'bull_bb_std_mult': 2.738526325912975, 'bull_rsi_os': 16, 'bull_rsi_ob': 81, 'bull_adx_thresh': 15.00112517522781, 'bull_atr_min_pct': 0.01809882666021062, 'bull_atr_max_pct': 0.12892653858802028, 'bull_tp_mult': 2.759122887041019, 'bull_tsl_mult': 0.8647892628042482, 'bull_time_stop': 26, 'bull_use_sma': True, 'bull_use_ema': False, 'bull_use_atr': True, 'bull_use_adx': False, 'bull_use_spike': True, 'bull_rsi_required': False, 'bear_strategy': 'breakout', 'bear_bb_std_mult': 3.5897841242956714, 'bear_rsi_os': 28, 'bear_rsi_ob': 73, 'bear_adx_thresh': 21.804043207971834, 'bear_atr_min_pct': 0.007140381238858015, 'bear_atr_max_pct': 0.05139266845880049, 'bear_tp_mult': 2.736953437891953, 'bear_tsl_mult': 0.17200559165774526, 'bear_time_stop': 58, 'bear_use_sma': False, 'bear_use_ema': True, 'bear_use_atr': False, 'bear_use_adx': True, 'bear_use_spike': True, 'bear_rsi_required': False, 'sideways_strategy': 'breakout', 'sideways_bb_std_mult': 3.331763753349911, 'sideways_rsi_os': 45, 'sideways_rsi_ob': 91, 'sideways_adx_thresh': 9.30849846350385, 'sideways_atr_min_pct': 0.003119875791954458, 'sideways_atr_max_pct': 0.018593224542421363, 'sideways_tp_mult': 1.1227563206478026, 'sideways_tsl_mult': 0.7578313240182081, 'sideways_time_stop': 178, 'sideways_use_sma': False, 'sideways_use_ema': False, 'sideways_use_atr': False, 'sideways_use_adx': False, 'sideways_use_spike': False, 'sideways_rsi_required': False}.
[I 2025-08-29 20:30:05,270] Trial 449 finished with values: [-1000000000.0, 1000000000.0] and parameters: {'p_sma': 21, 'p_std': 46, 'p_atr': 25, 'p_adx': 14, 'rsi_period': 78, 'ema1': 24, 'ema2': 36, 'slip_atr_k': 0.004888316645932582, 'slip_spread_k': 0.19161881893341076, 'spread_hl_frac': 0.04707086828478848, 'bb_std_mult': 1.7859551218411003, 'rsi_os': 15, 'rsi_ob': 83, 'vol_spike': 0.04656167360762754, 'adx_thresh': 11.924259892473513, 'atr_min_pct': 0.022628944685985142, 'atr_max_pct': 0.06497828352805904, 'tp_mult': 1.2709504963024272, 'tsl_mult': 0.9708886609857039, 'strategy': 'mean_reversion', 'time_stop': 137, 'use_sma': True, 'use_atr': False, 'use_adx': False, 'use_ema': True, 'use_spike': False, 'rsi_required': False, 'edge_k': 1.0801568482267856, 'edge_cap': 0.7444245692862635, 'bull_strategy': 'breakout', 'bull_bb_std_mult': 0.5946302577614959, 'bull_rsi_os': 47, 'bull_rsi_ob': 75, 'bull_adx_thresh': 27.632376197683328, 'bull_atr_min_pct': 0.01628725391427504, 'bull_atr_max_pct': 0.09250228807053339, 'bull_tp_mult': 1.1123684929792415, 'bull_tsl_mult': 0.8428664732903292, 'bull_time_stop': 26, 'bull_use_sma': True, 'bull_use_ema': False, 'bull_use_atr': True, 'bull_use_adx': False, 'bull_use_spike': True, 'bull_rsi_required': False, 'bear_strategy': 'mean_reversion', 'bear_bb_std_mult': 2.4813752363557757, 'bear_rsi_os': 21, 'bear_rsi_ob': 73, 'bear_adx_thresh': 21.381102553468356, 'bear_atr_min_pct': 0.02267812778875159, 'bear_atr_max_pct': 0.04529835434520073, 'bear_tp_mult': 2.645792690446038, 'bear_tsl_mult': 0.900949099662503, 'bear_time_stop': 57, 'bear_use_sma': False, 'bear_use_ema': True, 'bear_use_atr': False, 'bear_use_adx': True, 'bear_use_spike': True, 'bear_rsi_required': False, 'sideways_strategy': 'breakout', 'sideways_bb_std_mult': 2.395367072843156, 'sideways_rsi_os': 6, 'sideways_rsi_ob': 77, 'sideways_adx_thresh': 12.811643238726433, 'sideways_atr_min_pct': 0.004274241388282537, 'sideways_atr_max_pct': 0.10523374718837458, 'sideways_tp_mult': 2.9162527568084404, 'sideways_tsl_mult': 0.7665505341752643, 'sideways_time_stop': 180, 'sideways_use_sma': False, 'sideways_use_ema': False, 'sideways_use_atr': False, 'sideways_use_adx': False, 'sideways_use_spike': False, 'sideways_rsi_required': False}.
[I 2025-08-29 20:30:05,751] Trial 450 finished with values: [-1000000000.0, 1000000000.0] and parameters: {'p_sma': 21, 'p_std': 46, 'p_atr': 25, 'p_adx': 14, 'rsi_period': 78, 'ema1': 24, 'ema2': 23, 'slip_atr_k': 0.013811482062612287, 'slip_spread_k': 0.18810564270527722, 'spread_hl_frac': 0.04399629353109982, 'bb_std_mult': 2.3366645073584706, 'rsi_os': 8, 'rsi_ob': 51, 'vol_spike': 0.17949001565903416, 'adx_thresh': 11.523611053422675, 'atr_min_pct': 0.02652219891560649, 'atr_max_pct': 0.06463196378350333, 'tp_mult': 1.27401549814294, 'tsl_mult': 0.32834448579078396, 'strategy': 'mean_reversion', 'time_stop': 179, 'use_sma': True, 'use_atr': False, 'use_adx': False, 'use_ema': True, 'use_spike': False, 'rsi_required': False, 'edge_k': 1.0645329345314332, 'edge_cap': 0.6824180082386341, 'bull_strategy': 'breakout', 'bull_bb_std_mult': 2.7478640805777887, 'bull_rsi_os': 26, 'bull_rsi_ob': 73, 'bull_adx_thresh': 12.425498004229656, 'bull_atr_min_pct': 0.028489590059061327, 'bull_atr_max_pct': 0.09235318560340999, 'bull_tp_mult': 1.6907520117998107, 'bull_tsl_mult': 0.839221372061117, 'bull_time_stop': 24, 'bull_use_sma': False, 'bull_use_ema': False, 'bull_use_atr': True, 'bull_use_adx': False, 'bull_use_spike': True, 'bull_rsi_required': False, 'bear_strategy': 'mean_reversion', 'bear_bb_std_mult': 1.5958329150561787, 'bear_rsi_os': 26, 'bear_rsi_ob': 45, 'bear_adx_thresh': 18.764858912273933, 'bear_atr_min_pct': 0.026794409381220866, 'bear_atr_max_pct': 0.05101736191547191, 'bear_tp_mult': 2.645396428401828, 'bear_tsl_mult': 0.9119356504504262, 'bear_time_stop': 37, 'bear_use_sma': False, 'bear_use_ema': False, 'bear_use_atr': False, 'bear_use_adx': True, 'bear_use_spike': True, 'bear_rsi_required': False, 'sideways_strategy': 'breakout', 'sideways_bb_std_mult': 0.9812795023464853, 'sideways_rsi_os': 46, 'sideways_rsi_ob': 67, 'sideways_adx_thresh': 31.64171941219074, 'sideways_atr_min_pct': 0.0043111611788507346, 'sideways_atr_max_pct': 0.093182578556719, 'sideways_tp_mult': 2.5067712739629027, 'sideways_tsl_mult': 0.6882539068703821, 'sideways_time_stop': 180, 'sideways_use_sma': False, 'sideways_use_ema': False, 'sideways_use_atr': False, 'sideways_use_adx': False, 'sideways_use_spike': False, 'sideways_rsi_required': False}.
