[I 2025-08-29 20:15:09,762] Trial 323 finished with values: [-1000000000.0, 1000000000.0] and parameters: {'p_sma': 18, 'p_std': 54, 'p_atr': 25, 'p_adx': 14, 'rsi_period': 38, 'ema1': 19, 'ema2': 48, 'slip_atr_k': 0.028572187193357575, 'slip_spread_k': 0.18377310818502465, 'spread_hl_frac': 0.03768057873426185, 'bb_std_mult': 1.4927210591279845, 'rsi_os': 22, 'rsi_ob': 82, 'vol_spike': 0.19065976824927194, 'adx_thresh': 18.866053277343156, 'atr_min_pct': 0.018713982203903776, 'atr_max_pct': 0.13132624906844614, 'tp_mult': 1.6473793825284748, 'tsl_mult': 0.8314248052972381, 'strategy': 'breakout', 'time_stop': 173, 'use_sma': True, 'use_atr': False, 'use_adx': True, 'use_ema': True, 'use_spike': True, 'rsi_required': False, 'edge_k': 1.0588229607457196, 'edge_cap': 0.5187059360817893, 'bull_strategy': 'mean_reversion', 'bull_bb_std_mult': 3.0019199946236523, 'bull_rsi_os': 38, 'bull_rsi_ob': 74, 'bull_adx_thresh': 16.88465579774011, 'bull_atr_min_pct': 0.0164072428029638, 'bull_atr_max_pct': 0.1159400803731774, 'bull_tp_mult': 1.4998382730077102, 'bull_tsl_mult': 0.8524227872174333, 'bull_time_stop': 47, 'bull_use_sma': True, 'bull_use_ema': False, 'bull_use_atr': True, 'bull_use_adx': False, 'bull_use_spike': True, 'bull_rsi_required': False, 'bear_strategy': 'mean_reversion', 'bear_bb_std_mult': 2.6579542152190054, 'bear_rsi_os': 28, 'bear_rsi_ob': 67, 'bear_adx_thresh': 6.26257690547323, 'bear_atr_min_pct': 0.016429668213489755, 'bear_atr_max_pct': 0.030818426386883372, 'bear_tp_mult': 2.6203793564043583, 'bear_tsl_mult': 0.4068634915404778, 'bear_time_stop': 165, 'bear_use_sma': True, 'bear_use_ema': True, 'bear_use_atr': False, 'bear_use_adx': True, 'bear_use_spike': True, 'bear_rsi_required': False, 'sideways_strategy': 'breakout', 'sideways_bb_std_mult': 2.3091232227615133, 'sideways_rsi_os': 44, 'sideways_rsi_ob': 80, 'sideways_adx_thresh': 32.882331675930466, 'sideways_atr_min_pct': 0.004307476330599827, 'sideways_atr_max_pct': 0.02391290758582974, 'sideways_tp_mult': 1.0126115860709517, 'sideways_tsl_mult': 0.6741878860182025, 'sideways_time_stop': 198, 'sideways_use_sma': False, 'sideways_use_ema': True, 'sideways_use_atr': False, 'sideways_use_adx': False, 'sideways_use_spike': True, 'sideways_rsi_required': False}.
[I 2025-08-29 20:15:40,321] Trial 327 finished with values: [-0.0027462886310095636, 0.0030292168192197298] and parameters: {'p_sma': 17, 'p_std': 56, 'p_atr': 26, 'p_adx': 13, 'rsi_period': 40, 'ema1': 19, 'ema2': 48, 'slip_atr_k': 0.0059274985497444945, 'slip_spread_k': 0.16807541597624964, 'spread_hl_frac': 0.046766114392739186, 'bb_std_mult': 1.4398124198175668, 'rsi_os': 6, 'rsi_ob': 83, 'vol_spike': 0.2005051949820838, 'adx_thresh': 10.772707519186087, 'atr_min_pct': 0.018169468296322898, 'atr_max_pct': 0.038259212721931425, 'tp_mult': 1.6370889093532721, 'tsl_mult': 0.7861694287854886, 'strategy': 'mean_reversion', 'time_stop': 167, 'use_sma': True, 'use_atr': False, 'use_adx': False, 'use_ema': True, 'use_spike': False, 'rsi_required': False, 'edge_k': 1.138297916999628, 'edge_cap': 0.5752832758332865, 'bull_strategy': 'mean_reversion', 'bull_bb_std_mult': 2.947940205814378, 'bull_rsi_os': 37, 'bull_rsi_ob': 72, 'bull_adx_thresh': 14.656151317247849, 'bull_atr_min_pct': 0.016538813105228443, 'bull_atr_max_pct': 0.04534877896721591, 'bull_tp_mult': 2.551644564060245, 'bull_tsl_mult': 0.9265468226046698, 'bull_time_stop': 41, 'bull_use_sma': True, 'bull_use_ema': False, 'bull_use_atr': True, 'bull_use_adx': False, 'bull_use_spike': True, 'bull_rsi_required': False, 'bear_strategy': 'breakout', 'bear_bb_std_mult': 2.6176737012899425, 'bear_rsi_os': 28, 'bear_rsi_ob': 63, 'bear_adx_thresh': 21.225926409515466, 'bear_atr_min_pct': 0.008861171676001218, 'bear_atr_max_pct': 0.02974650473493404, 'bear_tp_mult': 2.598722783321649, 'bear_tsl_mult': 0.4044140144912888, 'bear_time_stop': 45, 'bear_use_sma': False, 'bear_use_ema': True, 'bear_use_atr': False, 'bear_use_adx': True, 'bear_use_spike': True, 'bear_rsi_required': False, 'sideways_strategy': 'breakout', 'sideways_bb_std_mult': 2.38688434433338, 'sideways_rsi_os': 43, 'sideways_rsi_ob': 78, 'sideways_adx_thresh': 32.077049191277645, 'sideways_atr_min_pct': 0.0032345538616520755, 'sideways_atr_max_pct': 0.029563209007379566, 'sideways_tp_mult': 1.0113314676356442, 'sideways_tsl_mult': 0.7162011757740032, 'sideways_time_stop': 197, 'sideways_use_sma': False, 'sideways_use_ema': True, 'sideways_use_atr': False, 'sideways_use_adx': False, 'sideways_use_spike': False, 'sideways_rsi_required': False}.
[I 2025-08-29 20:15:40,364] Trial 328 finished with values: [-0.0030732103548194445, 0.0032987601476091853] and parameters: {'p_sma': 21, 'p_std': 57, 'p_atr': 26, 'p_adx': 14, 'rsi_period': 40, 'ema1': 19, 'ema2': 50, 'slip_atr_k': 0.0062790284706172195, 'slip_spread_k': 0.17594601394461645, 'spread_hl_frac': 0.046745667764279214, 'bb_std_mult': 1.4355851071422863, 'rsi_os': 6, 'rsi_ob': 81, 'vol_spike': 0.20815163249627716, 'adx_thresh': 12.295014766747075, 'atr_min_pct': 0.017993918105676066, 'atr_max_pct': 0.038283353594798196, 'tp_mult': 1.6611539264952024, 'tsl_mult': 0.7838336534486778, 'strategy': 'mean_reversion', 'time_stop': 169, 'use_sma': True, 'use_atr': False, 'use_adx': False, 'use_ema': True, 'use_spike': False, 'rsi_required': False, 'edge_k': 1.1443632169821356, 'edge_cap': 0.5721435193208184, 'bull_strategy': 'mean_reversion', 'bull_bb_std_mult': 2.916080392573689, 'bull_rsi_os': 38, 'bull_rsi_ob': 72, 'bull_adx_thresh': 14.757447453536678, 'bull_atr_min_pct': 0.016556278268452105, 'bull_atr_max_pct': 0.04428388955266328, 'bull_tp_mult': 2.556392844420717, 'bull_tsl_mult': 0.9432211338089415, 'bull_time_stop': 32, 'bull_use_sma': True, 'bull_use_ema': False, 'bull_use_atr': True, 'bull_use_adx': False, 'bull_use_spike': True, 'bull_rsi_required': False, 'bear_strategy': 'breakout', 'bear_bb_std_mult': 2.6123963987991217, 'bear_rsi_os': 25, 'bear_rsi_ob': 63, 'bear_adx_thresh': 20.974359383803474, 'bear_atr_min_pct': 0.008765137823761473, 'bear_atr_max_pct': 0.02820741832405232, 'bear_tp_mult': 2.6712235844749297, 'bear_tsl_mult': 0.43401068856145164, 'bear_time_stop': 37, 'bear_use_sma': False, 'bear_use_ema': True, 'bear_use_atr': False, 'bear_use_adx': True, 'bear_use_spike': True, 'bear_rsi_required': False, 'sideways_strategy': 'breakout', 'sideways_bb_std_mult': 2.3854789365094984, 'sideways_rsi_os': 43, 'sideways_rsi_ob': 78, 'sideways_adx_thresh': 32.34793169893404, 'sideways_atr_min_pct': 0.0032273713609642855, 'sideways_atr_max_pct': 0.02850595857575835, 'sideways_tp_mult': 1.0604775879340413, 'sideways_tsl_mult': 0.7080585641343653, 'sideways_time_stop': 207, 'sideways_use_sma': False, 'sideways_use_ema': True, 'sideways_use_atr': False, 'sideways_use_adx': False, 'sideways_use_spike': False, 'sideways_rsi_required': False}.
[I 2025-08-29 20:15:40,553] Trial 325 finished with values: [-1000000000.0, 1000000000.0] and parameters: {'p_sma': 18, 'p_std': 57, 'p_atr': 26, 'p_adx': 14, 'rsi_period': 40, 'ema1': 19, 'ema2': 51, 'slip_atr_k': 0.0072926705983464455, 'slip_spread_k': 0.1744999869548563, 'spread_hl_frac': 0.046573980605283914, 'bb_std_mult': 1.478262395033167, 'rsi_os': 6, 'rsi_ob': 82, 'vol_spike': 0.20254942251858318, 'adx_thresh': 10.942381562378813, 'atr_min_pct': 0.018730464202247776, 'atr_max_pct': 0.03909529945378614, 'tp_mult': 1.6577709820133166, 'tsl_mult': 0.8292784342065891, 'strategy': 'mean_reversion', 'time_stop': 172, 'use_sma': True, 'use_atr': False, 'use_adx': False, 'use_ema': True, 'use_spike': False, 'rsi_required': False, 'edge_k': 1.1353588712149476, 'edge_cap': 0.5653868441741376, 'bull_strategy': 'mean_reversion', 'bull_bb_std_mult': 3.315651353449523, 'bull_rsi_os': 37, 'bull_rsi_ob': 72, 'bull_adx_thresh': 14.08230778366721, 'bull_atr_min_pct': 0.016496726115058136, 'bull_atr_max_pct': 0.04376555332188047, 'bull_tp_mult': 2.534438179320327, 'bull_tsl_mult': 0.9257921682402612, 'bull_time_stop': 49, 'bull_use_sma': True, 'bull_use_ema': False, 'bull_use_atr': True, 'bull_use_adx': False, 'bull_use_spike': True, 'bull_rsi_required': False, 'bear_strategy': 'breakout', 'bear_bb_std_mult': 2.614927081749424, 'bear_rsi_os': 28, 'bear_rsi_ob': 63, 'bear_adx_thresh': 21.3524734503945, 'bear_atr_min_pct': 0.008620636007338943, 'bear_atr_max_pct': 0.02821707834407346, 'bear_tp_mult': 2.632308662142093, 'bear_tsl_mult': 0.4072967151585679, 'bear_time_stop': 42, 'bear_use_sma': False, 'bear_use_ema': True, 'bear_use_atr': False, 'bear_use_adx': True, 'bear_use_spike': True, 'bear_rsi_required': False, 'sideways_strategy': 'breakout', 'sideways_bb_std_mult': 2.347906878917563, 'sideways_rsi_os': 44, 'sideways_rsi_ob': 78, 'sideways_adx_thresh': 32.227106780771216, 'sideways_atr_min_pct': 0.00457251172787578, 'sideways_atr_max_pct': 0.023733933064253917, 'sideways_tp_mult': 1.0108498851010455, 'sideways_tsl_mult': 0.7168696143065362, 'sideways_time_stop': 198, 'sideways_use_sma': False, 'sideways_use_ema': True, 'sideways_use_atr': False, 'sideways_use_adx': False, 'sideways_use_spike': False, 'sideways_rsi_required': False}.
[I 2025-08-29 20:15:40,755] Trial 326 finished with values: [-0.0025201927136692115, 0.0027751044044586823] and parameters: {'p_sma': 17, 'p_std': 56, 'p_atr': 26, 'p_adx': 13, 'rsi_period': 40, 'ema1': 19, 'ema2': 48, 'slip_atr_k': 0.007102167485976566, 'slip_spread_k': 0.1770269620090993, 'spread_hl_frac': 0.046347815576547526, 'bb_std_mult': 1.4500895980865667, 'rsi_os': 6, 'rsi_ob': 83, 'vol_spike': 0.20247085324184205, 'adx_thresh': 9.385034807197586, 'atr_min_pct': 0.018007152751232627, 'atr_max_pct': 0.03783893024702009, 'tp_mult': 1.631741330449563, 'tsl_mult': 0.832808960349005, 'strategy': 'mean_reversion', 'time_stop': 168, 'use_sma': True, 'use_atr': False, 'use_adx': False, 'use_ema': True, 'use_spike': False, 'rsi_required': False, 'edge_k': 1.1492699915887792, 'edge_cap': 0.5777074708428489, 'bull_strategy': 'mean_reversion', 'bull_bb_std_mult': 3.331305400370447, 'bull_rsi_os': 37, 'bull_rsi_ob': 71, 'bull_adx_thresh': 14.40863649205406, 'bull_atr_min_pct': 0.016481570923450865, 'bull_atr_max_pct': 0.036659113662174024, 'bull_tp_mult': 2.4594921088379795, 'bull_tsl_mult': 0.950949291834481, 'bull_time_stop': 42, 'bull_use_sma': True, 'bull_use_ema': False, 'bull_use_atr': True, 'bull_use_adx': False, 'bull_use_spike': True, 'bull_rsi_required': False, 'bear_strategy': 'breakout', 'bear_bb_std_mult': 2.6055658225941327, 'bear_rsi_os': 28, 'bear_rsi_ob': 63, 'bear_adx_thresh': 21.22927593534215, 'bear_atr_min_pct': 0.008520123689939495, 'bear_atr_max_pct': 0.028584090981496807, 'bear_tp_mult': 2.61594971871202, 'bear_tsl_mult': 0.39478521576801023, 'bear_time_stop': 40, 'bear_use_sma': False, 'bear_use_ema': True, 'bear_use_atr': False, 'bear_use_adx': True, 'bear_use_spike': True, 'bear_rsi_required': False, 'sideways_strategy': 'breakout', 'sideways_bb_std_mult': 2.369641676486183, 'sideways_rsi_os': 43, 'sideways_rsi_ob': 78, 'sideways_adx_thresh': 32.66535640350992, 'sideways_atr_min_pct': 0.0033488362613087646, 'sideways_atr_max_pct': 0.028695607227249717, 'sideways_tp_mult': 1.017827278315513, 'sideways_tsl_mult': 0.7164918141135413, 'sideways_time_stop': 195, 'sideways_use_sma': False, 'sideways_use_ema': True, 'sideways_use_atr': False, 'sideways_use_adx': False, 'sideways_use_spike': False, 'sideways_rsi_required': False}.
[I 2025-08-29 20:16:11,302] Trial 329 finished with values: [-1000000000.0, 1000000000.0] and parameters: {'p_sma': 20, 'p_std': 57, 'p_atr': 25, 'p_adx': 13, 'rsi_period': 40, 'ema1': 18, 'ema2': 47, 'slip_atr_k': 0.010869395108581315, 'slip_spread_k': 0.20950683805083087, 'spread_hl_frac': 0.04582004467898428, 'bb_std_mult': 1.400142138308939, 'rsi_os': 7, 'rsi_ob': 82, 'vol_spike': 0.19993903263941362, 'adx_thresh': 13.1407950128902, 'atr_min_pct': 0.02025712893173574, 'atr_max_pct': 0.039725873190355095, 'tp_mult': 1.6900675455055412, 'tsl_mult': 0.8277234892162487, 'strategy': 'mean_reversion', 'time_stop': 184, 'use_sma': True, 'use_atr': False, 'use_adx': False, 'use_ema': True, 'use_spike': False, 'rsi_required': False, 'edge_k': 1.1111161027107854, 'edge_cap': 0.5508440058821398, 'bull_strategy': 'mean_reversion', 'bull_bb_std_mult': 3.1753891960182115, 'bull_rsi_os': 36, 'bull_rsi_ob': 71, 'bull_adx_thresh': 14.29815840248126, 'bull_atr_min_pct': 0.01700269661092311, 'bull_atr_max_pct': 0.0400763632922445, 'bull_tp_mult': 2.753140004282962, 'bull_tsl_mult': 0.9182357775287074, 'bull_time_stop': 52, 'bull_use_sma': True, 'bull_use_ema': False, 'bull_use_atr': True, 'bull_use_adx': False, 'bull_use_spike': True, 'bull_rsi_required': False, 'bear_strategy': 'breakout', 'bear_bb_std_mult': 2.808541813712369, 'bear_rsi_os': 25, 'bear_rsi_ob': 64, 'bear_adx_thresh': 21.92596017371363, 'bear_atr_min_pct': 0.007540667120508716, 'bear_atr_max_pct': 0.02829234067747981, 'bear_tp_mult': 2.6993652155700394, 'bear_tsl_mult': 0.3991070762150266, 'bear_time_stop': 39, 'bear_use_sma': False, 'bear_use_ema': True, 'bear_use_atr': False, 'bear_use_adx': True, 'bear_use_spike': True, 'bear_rsi_required': False, 'sideways_strategy': 'breakout', 'sideways_bb_std_mult': 2.2261228039140373, 'sideways_rsi_os': 47, 'sideways_rsi_ob': 79, 'sideways_adx_thresh': 34.97884555958003, 'sideways_atr_min_pct': 0.004510891547384625, 'sideways_atr_max_pct': 0.023080153822480826, 'sideways_tp_mult': 1.0956365263044752, 'sideways_tsl_mult': 0.7321626253196598, 'sideways_time_stop': 204, 'sideways_use_sma': False, 'sideways_use_ema': True, 'sideways_use_atr': False, 'sideways_use_adx': False, 'sideways_use_spike': False, 'sideways_rsi_required': False}.
[I 2025-08-29 20:16:11,509] Trial 331 finished with values: [-0.0012993707575291724, 0.001875154506236858] and parameters: {'p_sma': 20, 'p_std': 57, 'p_atr': 25, 'p_adx': 13, 'rsi_period': 39, 'ema1': 18, 'ema2': 47, 'slip_atr_k': 0.011741465846323289, 'slip_spread_k': 0.20915326216426822, 'spread_hl_frac': 0.045842636662613415, 'bb_std_mult': 1.3853918063302952, 'rsi_os': 7, 'rsi_ob': 80, 'vol_spike': 0.19378845987047605, 'adx_thresh': 16.853565524798654, 'atr_min_pct': 0.02089836023143188, 'atr_max_pct': 0.032308957203327604, 'tp_mult': 1.5594013111677, 'tsl_mult': 0.8439720459599607, 'strategy': 'mean_reversion', 'time_stop': 183, 'use_sma': True, 'use_atr': False, 'use_adx': False, 'use_ema': True, 'use_spike': False, 'rsi_required': False, 'edge_k': 1.1016605075679184, 'edge_cap': 0.5525046122943311, 'bull_strategy': 'mean_reversion', 'bull_bb_std_mult': 3.2185811226371843, 'bull_rsi_os': 36, 'bull_rsi_ob': 71, 'bull_adx_thresh': 13.602994279783871, 'bull_atr_min_pct': 0.015713272238511815, 'bull_atr_max_pct': 0.04854233019864769, 'bull_tp_mult': 2.6506077197625375, 'bull_tsl_mult': 0.913604333968165, 'bull_time_stop': 53, 'bull_use_sma': True, 'bull_use_ema': False, 'bull_use_atr': True, 'bull_use_adx': False, 'bull_use_spike': True, 'bull_rsi_required': False, 'bear_strategy': 'breakout', 'bear_bb_std_mult': 2.8052099865201887, 'bear_rsi_os': 26, 'bear_rsi_ob': 64, 'bear_adx_thresh': 20.465121648512504, 'bear_atr_min_pct': 0.007810878079350747, 'bear_atr_max_pct': 0.030113953920998138, 'bear_tp_mult': 2.7071221539875476, 'bear_tsl_mult': 0.43804171163503886, 'bear_time_stop': 41, 'bear_use_sma': False, 'bear_use_ema': True, 'bear_use_atr': False, 'bear_use_adx': True, 'bear_use_spike': True, 'bear_rsi_required': False, 'sideways_strategy': 'breakout', 'sideways_bb_std_mult': 2.2384817584626875, 'sideways_rsi_os': 47, 'sideways_rsi_ob': 80, 'sideways_adx_thresh': 32.97044589693526, 'sideways_atr_min_pct': 0.003689141710554562, 'sideways_atr_max_pct': 0.026850250483563355, 'sideways_tp_mult': 1.098138976382642, 'sideways_tsl_mult': 0.7368840836247473, 'sideways_time_stop': 205, 'sideways_use_sma': False, 'sideways_use_ema': True, 'sideways_use_atr': False, 'sideways_use_adx': False, 'sideways_use_spike': False, 'sideways_rsi_required': False}.
[I 2025-08-29 20:16:11,644] Trial 330 finished with values: [-0.0006023459859012537, 0.0014054120053476039] and parameters: {'p_sma': 20, 'p_std': 57, 'p_atr': 25, 'p_adx': 13, 'rsi_period': 40, 'ema1': 18, 'ema2': 51, 'slip_atr_k': 0.009936284757701593, 'slip_spread_k': 0.20900086498877346, 'spread_hl_frac': 0.045600915340804224, 'bb_std_mult': 1.4018192488892707, 'rsi_os': 7, 'rsi_ob': 80, 'vol_spike': 0.2012876023109107, 'adx_thresh': 16.423564438384233, 'atr_min_pct': 0.02072892140126466, 'atr_max_pct': 0.040034153663412626, 'tp_mult': 1.6709623250319963, 'tsl_mult': 0.8301968913236223, 'strategy': 'mean_reversion', 'time_stop': 184, 'use_sma': True, 'use_atr': False, 'use_adx': False, 'use_ema': True, 'use_spike': False, 'rsi_required': False, 'edge_k': 1.1037621335391523, 'edge_cap': 0.5535285492990057, 'bull_strategy': 'mean_reversion', 'bull_bb_std_mult': 3.306089099366837, 'bull_rsi_os': 36, 'bull_rsi_ob': 71, 'bull_adx_thresh': 14.370359971013823, 'bull_atr_min_pct': 0.015809792209334223, 'bull_atr_max_pct': 0.048925455195307437, 'bull_tp_mult': 2.641109099281911, 'bull_tsl_mult': 0.9285688752408521, 'bull_time_stop': 49, 'bull_use_sma': True, 'bull_use_ema': False, 'bull_use_atr': True, 'bull_use_adx': False, 'bull_use_spike': True, 'bull_rsi_required': False, 'bear_strategy': 'breakout', 'bear_bb_std_mult': 2.759748338032262, 'bear_rsi_os': 26, 'bear_rsi_ob': 64, 'bear_adx_thresh': 21.688188127417877, 'bear_atr_min_pct': 0.007455199419057278, 'bear_atr_max_pct': 0.030188994815646956, 'bear_tp_mult': 2.7189339474312892, 'bear_tsl_mult': 0.43121708217870125, 'bear_time_stop': 39, 'bear_use_sma': False, 'bear_use_ema': True, 'bear_use_atr': False, 'bear_use_adx': True, 'bear_use_spike': True, 'bear_rsi_required': False, 'sideways_strategy': 'breakout', 'sideways_bb_std_mult': 2.3401674687247582, 'sideways_rsi_os': 47, 'sideways_rsi_ob': 80, 'sideways_adx_thresh': 34.9243847411924, 'sideways_atr_min_pct': 0.003815187636688794, 'sideways_atr_max_pct': 0.023006971415221587, 'sideways_tp_mult': 1.1029847975375584, 'sideways_tsl_mult': 0.7293406934409906, 'sideways_time_stop': 192, 'sideways_use_sma': False, 'sideways_use_ema': True, 'sideways_use_atr': False, 'sideways_use_adx': False, 'sideways_use_spike': False, 'sideways_rsi_required': False}.
[I 2025-08-29 20:16:11,747] Trial 332 finished with values: [0.00028487696102286186, 0.0005922902689833061] and parameters: {'p_sma': 20, 'p_std': 57, 'p_atr': 25, 'p_adx': 13, 'rsi_period': 37, 'ema1': 18, 'ema2': 47, 'slip_atr_k': 0.002368563713685678, 'slip_spread_k': 0.21022566299244355, 'spread_hl_frac': 0.048022701195429875, 'bb_std_mult': 1.57984228256588, 'rsi_os': 8, 'rsi_ob': 80, 'vol_spike': 0.19040482836490324, 'adx_thresh': 12.875845664534639, 'atr_min_pct': 0.02062655605610208, 'atr_max_pct': 0.034230796388012505, 'tp_mult': 1.554137525450086, 'tsl_mult': 0.8552112775950069, 'strategy': 'mean_reversion', 'time_stop': 184, 'use_sma': True, 'use_atr': False, 'use_adx': False, 'use_ema': True, 'use_spike': False, 'rsi_required': False, 'edge_k': 1.0998091917171835, 'edge_cap': 0.5308083456166973, 'bull_strategy': 'mean_reversion', 'bull_bb_std_mult': 3.1663987753012997, 'bull_rsi_os': 36, 'bull_rsi_ob': 73, 'bull_adx_thresh': 13.495199182809495, 'bull_atr_min_pct': 0.017262441961479427, 'bull_atr_max_pct': 0.049307749279017626, 'bull_tp_mult': 2.6585842911162714, 'bull_tsl_mult': 0.9246564440405983, 'bull_time_stop': 52, 'bull_use_sma': True, 'bull_use_ema': False, 'bull_use_atr': True, 'bull_use_adx': False, 'bull_use_spike': True, 'bull_rsi_required': False, 'bear_strategy': 'breakout', 'bear_bb_std_mult': 2.7448222421464576, 'bear_rsi_os': 26, 'bear_rsi_ob': 64, 'bear_adx_thresh': 21.84127356135146, 'bear_atr_min_pct': 0.00740929802478479, 'bear_atr_max_pct': 0.03128913244293715, 'bear_tp_mult': 2.7050996405928767, 'bear_tsl_mult': 0.4316881112380793, 'bear_time_stop': 33, 'bear_use_sma': False, 'bear_use_ema': True, 'bear_use_atr': False, 'bear_use_adx': True, 'bear_use_spike': True, 'bear_rsi_required': False, 'sideways_strategy': 'breakout', 'sideways_bb_std_mult': 2.2319687748426267, 'sideways_rsi_os': 47, 'sideways_rsi_ob': 80, 'sideways_adx_thresh': 33.23266543354361, 'sideways_atr_min_pct': 0.004312372271845397, 'sideways_atr_max_pct': 0.021810944566185347, 'sideways_tp_mult': 1.0956216226696802, 'sideways_tsl_mult': 0.6961513175906158, 'sideways_time_stop': 204, 'sideways_use_sma': False, 'sideways_use_ema': True, 'sideways_use_atr': False, 'sideways_use_adx': False, 'sideways_use_spike': False, 'sideways_rsi_required': False}.
