[I 2025-08-29 19:54:33,990] Trial 154 finished with values: [-1000000000.0, 1000000000.0] and parameters: {'p_sma': 42, 'p_std': 13, 'p_atr': 23, 'p_adx': 15, 'rsi_period': 21, 'ema1': 23, 'ema2': 56, 'slip_atr_k': 0.17183413852066406, 'slip_spread_k': 0.208275557207108, 'spread_hl_frac': 0.004193916139331398, 'bb_std_mult': 1.085400847684483, 'rsi_os': 34, 'rsi_ob': 59, 'vol_spike': 0.09206506849044743, 'adx_thresh': 33.55417195423395, 'atr_min_pct': 0.012853467512309098, 'atr_max_pct': 0.08351951801458676, 'tp_mult': 2.3842664545714665, 'tsl_mult': 0.6004792053818675, 'strategy': 'mean_reversion', 'time_stop': 99, 'use_sma': False, 'use_atr': True, 'use_adx': False, 'use_ema': False, 'use_spike': False, 'rsi_required': True, 'edge_k': 1.2000885737707936, 'edge_cap': 0.46272973992848565, 'bull_strategy': 'breakout', 'bull_bb_std_mult': 0.7834178835931227, 'bull_rsi_os': 42, 'bull_rsi_ob': 81, 'bull_adx_thresh': 18.688020409191527, 'bull_atr_min_pct': 0.021476951399949252, 'bull_atr_max_pct': 0.05670103014935078, 'bull_tp_mult': 1.3110922065737103, 'bull_tsl_mult': 0.2433389359236754, 'bull_time_stop': 272, 'bull_use_sma': False, 'bull_use_ema': True, 'bull_use_atr': False, 'bull_use_adx': True, 'bull_use_spike': False, 'bull_rsi_required': True, 'bear_strategy': 'mean_reversion', 'bear_bb_std_mult': 2.3243538549626512, 'bear_rsi_os': 26, 'bear_rsi_ob': 70, 'bear_adx_thresh': 6.9130532507103375, 'bear_atr_min_pct': 0.011817309998573385, 'bear_atr_max_pct': 0.01506195583165279, 'bear_tp_mult': 2.030486000726122, 'bear_tsl_mult': 0.022400667786194928, 'bear_time_stop': 5, 'bear_use_sma': False, 'bear_use_ema': False, 'bear_use_atr': False, 'bear_use_adx': False, 'bear_use_spike': False, 'bear_rsi_required': False, 'sideways_strategy': 'breakout', 'sideways_bb_std_mult': 2.0726007197793956, 'sideways_rsi_os': 50, 'sideways_rsi_ob': 83, 'sideways_adx_thresh': 29.086024364594277, 'sideways_atr_min_pct': 0.014269644002053924, 'sideways_atr_max_pct': 0.12491446971864152, 'sideways_tp_mult': 1.1195853679114434, 'sideways_tsl_mult': 0.28324912006580216, 'sideways_time_stop': 140, 'sideways_use_sma': False, 'sideways_use_ema': True, 'sideways_use_atr': True, 'sideways_use_adx': False, 'sideways_use_spike': True, 'sideways_rsi_required': True}.
[I 2025-08-29 19:54:34,293] Trial 153 finished with values: [-1000000000.0, 1000000000.0] and parameters: {'p_sma': 38, 'p_std': 56, 'p_atr': 22, 'p_adx': 17, 'rsi_period': 14, 'ema1': 6, 'ema2': 46, 'slip_atr_k': 0.22829085148576822, 'slip_spread_k': 0.2367655238210063, 'spread_hl_frac': 0.013441995839743292, 'bb_std_mult': 1.2360702840226743, 'rsi_os': 25, 'rsi_ob': 56, 'vol_spike': 0.09292341947432699, 'adx_thresh': 33.45118674481018, 'atr_min_pct': 0.02250017767172581, 'atr_max_pct': 0.09503867407473494, 'tp_mult': 1.3523449621358652, 'tsl_mult': 0.5705062405107646, 'strategy': 'mean_reversion', 'time_stop': 120, 'use_sma': False, 'use_atr': True, 'use_adx': False, 'use_ema': False, 'use_spike': False, 'rsi_required': True, 'edge_k': 1.1450141339355855, 'edge_cap': 0.39401318984037126, 'bull_strategy': 'breakout', 'bull_bb_std_mult': 3.0712071645731314, 'bull_rsi_os': 43, 'bull_rsi_ob': 92, 'bull_adx_thresh': 18.30793285831325, 'bull_atr_min_pct': 0.021315718416895023, 'bull_atr_max_pct': 0.03234049251329087, 'bull_tp_mult': 1.501234602198366, 'bull_tsl_mult': 0.8263163118607224, 'bull_time_stop': 210, 'bull_use_sma': False, 'bull_use_ema': True, 'bull_use_atr': False, 'bull_use_adx': True, 'bull_use_spike': False, 'bull_rsi_required': True, 'bear_strategy': 'mean_reversion', 'bear_bb_std_mult': 2.300173991878239, 'bear_rsi_os': 23, 'bear_rsi_ob': 72, 'bear_adx_thresh': 7.9562170135196695, 'bear_atr_min_pct': 0.02555868613466383, 'bear_atr_max_pct': 0.11120179870173467, 'bear_tp_mult': 1.7679714617191964, 'bear_tsl_mult': 0.7083777909520832, 'bear_time_stop': 6, 'bear_use_sma': False, 'bear_use_ema': False, 'bear_use_atr': False, 'bear_use_adx': False, 'bear_use_spike': False, 'bear_rsi_required': False, 'sideways_strategy': 'breakout', 'sideways_bb_std_mult': 0.5962985757700512, 'sideways_rsi_os': 44, 'sideways_rsi_ob': 83, 'sideways_adx_thresh': 28.823918521813702, 'sideways_atr_min_pct': 0.009351481685884799, 'sideways_atr_max_pct': 0.11342038959211743, 'sideways_tp_mult': 1.6489406690395587, 'sideways_tsl_mult': 0.14267784704993974, 'sideways_time_stop': 210, 'sideways_use_sma': False, 'sideways_use_ema': True, 'sideways_use_atr': True, 'sideways_use_adx': False, 'sideways_use_spike': True, 'sideways_rsi_required': True}.
[I 2025-08-29 19:54:34,479] Trial 155 finished with values: [-1000000000.0, 1000000000.0] and parameters: {'p_sma': 38, 'p_std': 53, 'p_atr': 22, 'p_adx': 28, 'rsi_period': 66, 'ema1': 11, 'ema2': 56, 'slip_atr_k': 0.1716271259990911, 'slip_spread_k': 0.268189366518671, 'spread_hl_frac': 0.004506634655856498, 'bb_std_mult': 1.069797436985659, 'rsi_os': 10, 'rsi_ob': 56, 'vol_spike': 0.11247119764145092, 'adx_thresh': 33.299877989853655, 'atr_min_pct': 0.009863362312087735, 'atr_max_pct': 0.08388069380397957, 'tp_mult': 2.382279763709428, 'tsl_mult': 0.5985289214333936, 'strategy': 'mean_reversion', 'time_stop': 130, 'use_sma': False, 'use_atr': True, 'use_adx': False, 'use_ema': False, 'use_spike': False, 'rsi_required': True, 'edge_k': 1.2090909362569917, 'edge_cap': 0.466311054448714, 'bull_strategy': 'breakout', 'bull_bb_std_mult': 0.9911494825458786, 'bull_rsi_os': 42, 'bull_rsi_ob': 72, 'bull_adx_thresh': 15.986459113054213, 'bull_atr_min_pct': 0.021474229777822807, 'bull_atr_max_pct': 0.12919191535904767, 'bull_tp_mult': 1.3060214420708702, 'bull_tsl_mult': 0.27648569772026665, 'bull_time_stop': 5, 'bull_use_sma': False, 'bull_use_ema': True, 'bull_use_atr': False, 'bull_use_adx': True, 'bull_use_spike': False, 'bull_rsi_required': True, 'bear_strategy': 'breakout', 'bear_bb_std_mult': 1.3158313495532623, 'bear_rsi_os': 26, 'bear_rsi_ob': 57, 'bear_adx_thresh': 26.04339578793486, 'bear_atr_min_pct': 0.006552785066469356, 'bear_atr_max_pct': 0.10634553606214307, 'bear_tp_mult': 1.9460882502380068, 'bear_tsl_mult': 0.01547773724309437, 'bear_time_stop': 6, 'bear_use_sma': False, 'bear_use_ema': False, 'bear_use_atr': False, 'bear_use_adx': False, 'bear_use_spike': False, 'bear_rsi_required': False, 'sideways_strategy': 'breakout', 'sideways_bb_std_mult': 2.064585254628008, 'sideways_rsi_os': 44, 'sideways_rsi_ob': 83, 'sideways_adx_thresh': 28.97615852802635, 'sideways_atr_min_pct': 0.029032237680465832, 'sideways_atr_max_pct': 0.1258701050259049, 'sideways_tp_mult': 1.4329418497220163, 'sideways_tsl_mult': 0.2899927307256721, 'sideways_time_stop': 13, 'sideways_use_sma': False, 'sideways_use_ema': True, 'sideways_use_atr': True, 'sideways_use_adx': False, 'sideways_use_spike': True, 'sideways_rsi_required': True}.
[I 2025-08-29 19:55:03,934] Trial 157 finished with values: [-1000000000.0, 1000000000.0] and parameters: {'p_sma': 11, 'p_std': 53, 'p_atr': 24, 'p_adx': 16, 'rsi_period': 21, 'ema1': 6, 'ema2': 40, 'slip_atr_k': 0.05114435962603324, 'slip_spread_k': 0.022361368942914184, 'spread_hl_frac': 0.020492230253824368, 'bb_std_mult': 1.03058501937104, 'rsi_os': 22, 'rsi_ob': 58, 'vol_spike': 0.11031957460000713, 'adx_thresh': 33.38666018538734, 'atr_min_pct': 0.015034725098393736, 'atr_max_pct': 0.08906713062598591, 'tp_mult': 2.251348582161542, 'tsl_mult': 0.646041460751161, 'strategy': 'mean_reversion', 'time_stop': 151, 'use_sma': False, 'use_atr': True, 'use_adx': False, 'use_ema': False, 'use_spike': False, 'rsi_required': True, 'edge_k': 1.1360934635091338, 'edge_cap': 0.14152020416221195, 'bull_strategy': 'breakout', 'bull_bb_std_mult': 3.090496267894726, 'bull_rsi_os': 30, 'bull_rsi_ob': 94, 'bull_adx_thresh': 15.814893499825063, 'bull_atr_min_pct': 0.02136636790183912, 'bull_atr_max_pct': 0.12813677465608367, 'bull_tp_mult': 1.448916701149798, 'bull_tsl_mult': 0.6741629888789613, 'bull_time_stop': 290, 'bull_use_sma': False, 'bull_use_ema': False, 'bull_use_atr': False, 'bull_use_adx': True, 'bull_use_spike': False, 'bull_rsi_required': True, 'bear_strategy': 'breakout', 'bear_bb_std_mult': 1.369698032507869, 'bear_rsi_os': 29, 'bear_rsi_ob': 93, 'bear_adx_thresh': 7.8144544896482495, 'bear_atr_min_pct': 0.006869546364857334, 'bear_atr_max_pct': 0.11075138542732205, 'bear_tp_mult': 1.9588945962740902, 'bear_tsl_mult': 0.9220497023283469, 'bear_time_stop': 258, 'bear_use_sma': False, 'bear_use_ema': True, 'bear_use_atr': True, 'bear_use_adx': False, 'bear_use_spike': False, 'bear_rsi_required': False, 'sideways_strategy': 'mean_reversion', 'sideways_bb_std_mult': 1.7815290909602242, 'sideways_rsi_os': 30, 'sideways_rsi_ob': 79, 'sideways_adx_thresh': 28.63168086677648, 'sideways_atr_min_pct': 0.003409272619012447, 'sideways_atr_max_pct': 0.036300277014179344, 'sideways_tp_mult': 2.0957798116355195, 'sideways_tsl_mult': 0.2090322241844933, 'sideways_time_stop': 211, 'sideways_use_sma': False, 'sideways_use_ema': True, 'sideways_use_atr': True, 'sideways_use_adx': False, 'sideways_use_spike': False, 'sideways_rsi_required': True}.
[I 2025-08-29 19:55:04,693] Trial 158 finished with values: [-1000000000.0, 1000000000.0] and parameters: {'p_sma': 38, 'p_std': 55, 'p_atr': 24, 'p_adx': 27, 'rsi_period': 21, 'ema1': 11, 'ema2': 40, 'slip_atr_k': 0.053027849203058516, 'slip_spread_k': 0.2651907788541007, 'spread_hl_frac': 0.0024239069104994536, 'bb_std_mult': 3.389187887756556, 'rsi_os': 18, 'rsi_ob': 70, 'vol_spike': 0.11169265851023247, 'adx_thresh': 33.161214665815685, 'atr_min_pct': 0.024331762330381437, 'atr_max_pct': 0.07845742073569058, 'tp_mult': 1.114571831496443, 'tsl_mult': 0.6378298335551567, 'strategy': 'mean_reversion', 'time_stop': 151, 'use_sma': True, 'use_atr': False, 'use_adx': False, 'use_ema': False, 'use_spike': False, 'rsi_required': True, 'edge_k': 1.2749397735249672, 'edge_cap': 0.426105278208067, 'bull_strategy': 'breakout', 'bull_bb_std_mult': 0.982849850282354, 'bull_rsi_os': 30, 'bull_rsi_ob': 94, 'bull_adx_thresh': 20.032005205001127, 'bull_atr_min_pct': 0.00503832814940818, 'bull_atr_max_pct': 0.023023419983812334, 'bull_tp_mult': 1.4391700301494388, 'bull_tsl_mult': 0.2836094875563952, 'bull_time_stop': 290, 'bull_use_sma': False, 'bull_use_ema': False, 'bull_use_atr': False, 'bull_use_adx': False, 'bull_use_spike': False, 'bull_rsi_required': True, 'bear_strategy': 'breakout', 'bear_bb_std_mult': 1.3180163303961605, 'bear_rsi_os': 29, 'bear_rsi_ob': 93, 'bear_adx_thresh': 27.1791736920682, 'bear_atr_min_pct': 0.006791927034623738, 'bear_atr_max_pct': 0.13791389959017664, 'bear_tp_mult': 1.6538051047985052, 'bear_tsl_mult': 0.6776042988768245, 'bear_time_stop': 15, 'bear_use_sma': False, 'bear_use_ema': True, 'bear_use_atr': True, 'bear_use_adx': False, 'bear_use_spike': False, 'bear_rsi_required': False, 'sideways_strategy': 'mean_reversion', 'sideways_bb_std_mult': 2.200566744918716, 'sideways_rsi_os': 28, 'sideways_rsi_ob': 81, 'sideways_adx_thresh': 10.126017729778704, 'sideways_atr_min_pct': 0.0035137803405784675, 'sideways_atr_max_pct': 0.03543323758334234, 'sideways_tp_mult': 2.104707300265876, 'sideways_tsl_mult': 0.25496958657846425, 'sideways_time_stop': 8, 'sideways_use_sma': False, 'sideways_use_ema': True, 'sideways_use_atr': True, 'sideways_use_adx': False, 'sideways_use_spike': False, 'sideways_rsi_required': True}.
[I 2025-08-29 19:55:04,836] Trial 159 finished with values: [-1000000000.0, 1000000000.0] and parameters: {'p_sma': 11, 'p_std': 16, 'p_atr': 25, 'p_adx': 9, 'rsi_period': 21, 'ema1': 25, 'ema2': 43, 'slip_atr_k': 0.19803107668586045, 'slip_spread_k': 0.29674701939623277, 'spread_hl_frac': 0.026753538586661248, 'bb_std_mult': 3.2747876948886194, 'rsi_os': 18, 'rsi_ob': 70, 'vol_spike': 0.21604765521303773, 'adx_thresh': 34.592535723163, 'atr_min_pct': 0.02548008893359864, 'atr_max_pct': 0.08809293348057655, 'tp_mult': 2.199153420861367, 'tsl_mult': 0.6478555041801798, 'strategy': 'mean_reversion', 'time_stop': 109, 'use_sma': True, 'use_atr': False, 'use_adx': False, 'use_ema': True, 'use_spike': False, 'rsi_required': True, 'edge_k': 0.2284895538433137, 'edge_cap': 0.42172542707901745, 'bull_strategy': 'breakout', 'bull_bb_std_mult': 0.807511324276268, 'bull_rsi_os': 46, 'bull_rsi_ob': 94, 'bull_adx_thresh': 17.19733819086839, 'bull_atr_min_pct': 0.004997521501626899, 'bull_atr_max_pct': 0.05798374150629328, 'bull_tp_mult': 1.767701426788518, 'bull_tsl_mult': 0.5666278147229367, 'bull_time_stop': 299, 'bull_use_sma': False, 'bull_use_ema': False, 'bull_use_atr': False, 'bull_use_adx': False, 'bull_use_spike': False, 'bull_rsi_required': True, 'bear_strategy': 'breakout', 'bear_bb_std_mult': 1.3725891264350425, 'bear_rsi_os': 41, 'bear_rsi_ob': 93, 'bear_adx_thresh': 5.002473854336413, 'bear_atr_min_pct': 0.026857876408373182, 'bear_atr_max_pct': 0.11775506518629905, 'bear_tp_mult': 1.6793281650476637, 'bear_tsl_mult': 0.5812830643561223, 'bear_time_stop': 14, 'bear_use_sma': False, 'bear_use_ema': True, 'bear_use_atr': True, 'bear_use_adx': True, 'bear_use_spike': False, 'bear_rsi_required': True, 'sideways_strategy': 'mean_reversion', 'sideways_bb_std_mult': 1.7820996220255436, 'sideways_rsi_os': 40, 'sideways_rsi_ob': 81, 'sideways_adx_thresh': 10.545276933360553, 'sideways_atr_min_pct': 0.006314193621583178, 'sideways_atr_max_pct': 0.05188875714305212, 'sideways_tp_mult': 2.0778933263820516, 'sideways_tsl_mult': 0.2517631078924272, 'sideways_time_stop': 222, 'sideways_use_sma': False, 'sideways_use_ema': True, 'sideways_use_atr': False, 'sideways_use_adx': False, 'sideways_use_spike': False, 'sideways_rsi_required': True}.
[I 2025-08-29 19:55:04,977] Trial 156 finished with values: [-1000000000.0, 1000000000.0] and parameters: {'p_sma': 38, 'p_std': 49, 'p_atr': 24, 'p_adx': 16, 'rsi_period': 19, 'ema1': 6, 'ema2': 15, 'slip_atr_k': 0.231542260634377, 'slip_spread_k': 0.030314946768239814, 'spread_hl_frac': 0.005007318788307698, 'bb_std_mult': 1.3719619743142764, 'rsi_os': 18, 'rsi_ob': 58, 'vol_spike': 0.11386358918532516, 'adx_thresh': 33.352238687279524, 'atr_min_pct': 0.009850621143674056, 'atr_max_pct': 0.08801136948976587, 'tp_mult': 2.269592338232191, 'tsl_mult': 0.6414183069075899, 'strategy': 'mean_reversion', 'time_stop': 129, 'use_sma': False, 'use_atr': True, 'use_adx': False, 'use_ema': False, 'use_spike': False, 'rsi_required': True, 'edge_k': 0.2621389536753548, 'edge_cap': 0.37161711974311856, 'bull_strategy': 'breakout', 'bull_bb_std_mult': 0.9649370210188393, 'bull_rsi_os': 30, 'bull_rsi_ob': 94, 'bull_adx_thresh': 15.750191105867712, 'bull_atr_min_pct': 0.021412812010682635, 'bull_atr_max_pct': 0.03442291591412899, 'bull_tp_mult': 1.6516313574281927, 'bull_tsl_mult': 0.052593535249086276, 'bull_time_stop': 211, 'bull_use_sma': False, 'bull_use_ema': False, 'bull_use_atr': False, 'bull_use_adx': True, 'bull_use_spike': False, 'bull_rsi_required': True, 'bear_strategy': 'breakout', 'bear_bb_std_mult': 1.3311793603617394, 'bear_rsi_os': 29, 'bear_rsi_ob': 67, 'bear_adx_thresh': 27.172157749249823, 'bear_atr_min_pct': 0.006849198712294741, 'bear_atr_max_pct': 0.14620811371045903, 'bear_tp_mult': 1.7699997864209407, 'bear_tsl_mult': 0.7080616675851735, 'bear_time_stop': 16, 'bear_use_sma': False, 'bear_use_ema': True, 'bear_use_atr': True, 'bear_use_adx': False, 'bear_use_spike': False, 'bear_rsi_required': False, 'sideways_strategy': 'mean_reversion', 'sideways_bb_std_mult': 3.329374134726178, 'sideways_rsi_os': 28, 'sideways_rsi_ob': 81, 'sideways_adx_thresh': 28.61258567981726, 'sideways_atr_min_pct': 0.02931983741102171, 'sideways_atr_max_pct': 0.12898889605658803, 'sideways_tp_mult': 2.0748784455459766, 'sideways_tsl_mult': 0.2481429188084213, 'sideways_time_stop': 5, 'sideways_use_sma': False, 'sideways_use_ema': True, 'sideways_use_atr': True, 'sideways_use_adx': False, 'sideways_use_spike': False, 'sideways_rsi_required': True}.
[I 2025-08-29 19:55:35,710] Trial 162 finished with values: [-1000000000.0, 1000000000.0] and parameters: {'p_sma': 56, 'p_std': 49, 'p_atr': 28, 'p_adx': 18, 'rsi_period': 79, 'ema1': 22, 'ema2': 16, 'slip_atr_k': 0.030226260026403523, 'slip_spread_k': 0.33058540042829543, 'spread_hl_frac': 0.007758052549457672, 'bb_std_mult': 1.4943760578670704, 'rsi_os': 20, 'rsi_ob': 66, 'vol_spike': 0.13050504947824318, 'adx_thresh': 34.16849270989066, 'atr_min_pct': 0.01229846455522383, 'atr_max_pct': 0.10064079137035238, 'tp_mult': 1.2612884347137756, 'tsl_mult': 0.6763056851251619, 'strategy': 'mean_reversion', 'time_stop': 76, 'use_sma': False, 'use_atr': True, 'use_adx': False, 'use_ema': True, 'use_spike': False, 'rsi_required': False, 'edge_k': 0.15121275609742757, 'edge_cap': 0.9650113218617642, 'bull_strategy': 'breakout', 'bull_bb_std_mult': 1.4675977273560465, 'bull_rsi_os': 21, 'bull_rsi_ob': 95, 'bull_adx_thresh': 14.725425357065378, 'bull_atr_min_pct': 0.020552218326325273, 'bull_atr_max_pct': 0.07317004614596703, 'bull_tp_mult': 1.1151822523754684, 'bull_tsl_mult': 0.0029033258148766783, 'bull_time_stop': 275, 'bull_use_sma': False, 'bull_use_ema': True, 'bull_use_atr': True, 'bull_use_adx': True, 'bull_use_spike': False, 'bull_rsi_required': True, 'bear_strategy': 'breakout', 'bear_bb_std_mult': 3.3550999862251922, 'bear_rsi_os': 31, 'bear_rsi_ob': 83, 'bear_adx_thresh': 6.259354571931691, 'bear_atr_min_pct': 0.005929894488567221, 'bear_atr_max_pct': 0.14507277013331935, 'bear_tp_mult': 1.6122628790916473, 'bear_tsl_mult': 0.6082482697594495, 'bear_time_stop': 28, 'bear_use_sma': False, 'bear_use_ema': False, 'bear_use_atr': True, 'bear_use_adx': True, 'bear_use_spike': True, 'bear_rsi_required': True, 'sideways_strategy': 'mean_reversion', 'sideways_bb_std_mult': 1.8876807293100977, 'sideways_rsi_os': 31, 'sideways_rsi_ob': 86, 'sideways_adx_thresh': 29.619437387247586, 'sideways_atr_min_pct': 0.021142186901014267, 'sideways_atr_max_pct': 0.12929049629159042, 'sideways_tp_mult': 2.165990383896672, 'sideways_tsl_mult': 0.17956791083479587, 'sideways_time_stop': 203, 'sideways_use_sma': False, 'sideways_use_ema': False, 'sideways_use_atr': True, 'sideways_use_adx': True, 'sideways_use_spike': False, 'sideways_rsi_required': True}.
[I 2025-08-29 19:55:35,830] Trial 163 finished with values: [-1000000000.0, 1000000000.0] and parameters: {'p_sma': 36, 'p_std': 24, 'p_atr': 28, 'p_adx': 18, 'rsi_period': 24, 'ema1': 12, 'ema2': 19, 'slip_atr_k': 0.1579796289617356, 'slip_spread_k': 0.21336311629363391, 'spread_hl_frac': 0.008122037036656947, 'bb_std_mult': 1.4750722510660488, 'rsi_os': 20, 'rsi_ob': 81, 'vol_spike': 0.01804777196656096, 'adx_thresh': 31.30347518895516, 'atr_min_pct': 0.01655137301987366, 'atr_max_pct': 0.10092086872360669, 'tp_mult': 1.6865686280816714, 'tsl_mult': 0.9981937095756348, 'strategy': 'mean_reversion', 'time_stop': 75, 'use_sma': False, 'use_atr': True, 'use_adx': False, 'use_ema': True, 'use_spike': False, 'rsi_required': False, 'edge_k': 1.307701509985895, 'edge_cap': 0.9749925839336395, 'bull_strategy': 'breakout', 'bull_bb_std_mult': 0.7315802697094494, 'bull_rsi_os': 32, 'bull_rsi_ob': 87, 'bull_adx_thresh': 16.586732661879513, 'bull_atr_min_pct': 0.022275497909433443, 'bull_atr_max_pct': 0.1452106587965063, 'bull_tp_mult': 1.019939371015624, 'bull_tsl_mult': 0.7571310196674492, 'bull_time_stop': 200, 'bull_use_sma': False, 'bull_use_ema': True, 'bull_use_atr': True, 'bull_use_adx': True, 'bull_use_spike': False, 'bull_rsi_required': True, 'bear_strategy': 'breakout', 'bear_bb_std_mult': 1.1762404258802333, 'bear_rsi_os': 31, 'bear_rsi_ob': 82, 'bear_adx_thresh': 13.901924145975908, 'bear_atr_min_pct': 0.024408969113516372, 'bear_atr_max_pct': 0.0998839844360189, 'bear_tp_mult': 1.901940814459166, 'bear_tsl_mult': 0.6082269645035177, 'bear_time_stop': 60, 'bear_use_sma': False, 'bear_use_ema': False, 'bear_use_atr': True, 'bear_use_adx': True, 'bear_use_spike': True, 'bear_rsi_required': True, 'sideways_strategy': 'mean_reversion', 'sideways_bb_std_mult': 1.9055945962618952, 'sideways_rsi_os': 31, 'sideways_rsi_ob': 76, 'sideways_adx_thresh': 29.81026455814368, 'sideways_atr_min_pct': 0.01791177733644283, 'sideways_atr_max_pct': 0.11786492396575698, 'sideways_tp_mult': 2.177517557833876, 'sideways_tsl_mult': 0.1792837329131604, 'sideways_time_stop': 40, 'sideways_use_sma': False, 'sideways_use_ema': False, 'sideways_use_atr': False, 'sideways_use_adx': True, 'sideways_use_spike': False, 'sideways_rsi_required': True}.
