[I 2025-08-29 20:12:01,539] Trial 299 finished with values: [-0.00298698253656271, 0.003034879464460198] and parameters: {'p_sma': 7, 'p_std': 53, 'p_atr': 18, 'p_adx': 16, 'rsi_period': 35, 'ema1': 21, 'ema2': 23, 'slip_atr_k': 0.1120241842136057, 'slip_spread_k': 0.26677636134855376, 'spread_hl_frac': 0.0444633776795616, 'bb_std_mult': 1.2130894522219842, 'rsi_os': 46, 'rsi_ob': 92, 'vol_spike': 0.19721694941108012, 'adx_thresh': 19.56539976127256, 'atr_min_pct': 0.016325500841349018, 'atr_max_pct': 0.041513028097442915, 'tp_mult': 1.6178648187987896, 'tsl_mult': 0.6728233590963081, 'strategy': 'mean_reversion', 'time_stop': 180, 'use_sma': True, 'use_atr': True, 'use_adx': False, 'use_ema': True, 'use_spike': False, 'rsi_required': True, 'edge_k': 1.1664544437997155, 'edge_cap': 0.44927540289322826, 'bull_strategy': 'mean_reversion', 'bull_bb_std_mult': 1.6388386871712255, 'bull_rsi_os': 23, 'bull_rsi_ob': 88, 'bull_adx_thresh': 17.635359789177937, 'bull_atr_min_pct': 0.0010076138673546942, 'bull_atr_max_pct': 0.02713792323086349, 'bull_tp_mult': 1.42895168680132, 'bull_tsl_mult': 0.9030175949040056, 'bull_time_stop': 59, 'bull_use_sma': True, 'bull_use_ema': False, 'bull_use_atr': True, 'bull_use_adx': False, 'bull_use_spike': False, 'bull_rsi_required': False, 'bear_strategy': 'breakout', 'bear_bb_std_mult': 1.177227727865251, 'bear_rsi_os': 48, 'bear_rsi_ob': 67, 'bear_adx_thresh': 18.734378912338308, 'bear_atr_min_pct': 0.0067188959003094025, 'bear_atr_max_pct': 0.08850059826301178, 'bear_tp_mult': 1.405009420934849, 'bear_tsl_mult': 0.39663093020488793, 'bear_time_stop': 5, 'bear_use_sma': False, 'bear_use_ema': True, 'bear_use_atr': True, 'bear_use_adx': True, 'bear_use_spike': True, 'bear_rsi_required': True, 'sideways_strategy': 'breakout', 'sideways_bb_std_mult': 2.3073530423428616, 'sideways_rsi_os': 17, 'sideways_rsi_ob': 82, 'sideways_adx_thresh': 5.886489487470325, 'sideways_atr_min_pct': 0.00451253831093842, 'sideways_atr_max_pct': 0.06085940371524166, 'sideways_tp_mult': 2.705384293094249, 'sideways_tsl_mult': 0.6589639136405439, 'sideways_time_stop': 235, 'sideways_use_sma': False, 'sideways_use_ema': True, 'sideways_use_atr': True, 'sideways_use_adx': False, 'sideways_use_spike': False, 'sideways_rsi_required': False}.
[I 2025-08-29 20:12:01,797] Trial 297 finished with values: [-1000000000.0, 1000000000.0] and parameters: {'p_sma': 21, 'p_std': 53, 'p_atr': 30, 'p_adx': 17, 'rsi_period': 39, 'ema1': 30, 'ema2': 46, 'slip_atr_k': 0.03413153999074986, 'slip_spread_k': 0.7151307529786266, 'spread_hl_frac': 0.0015282653254836535, 'bb_std_mult': 1.2049792233385044, 'rsi_os': 20, 'rsi_ob': 80, 'vol_spike': 0.2005374241015731, 'adx_thresh': 30.5442291782765, 'atr_min_pct': 0.014141468231985664, 'atr_max_pct': 0.03999101700101157, 'tp_mult': 1.625274949028105, 'tsl_mult': 0.9267166108945001, 'strategy': 'mean_reversion', 'time_stop': 147, 'use_sma': True, 'use_atr': False, 'use_adx': False, 'use_ema': True, 'use_spike': True, 'rsi_required': False, 'edge_k': 0.9422268530001134, 'edge_cap': 0.459184211373228, 'bull_strategy': 'mean_reversion', 'bull_bb_std_mult': 3.3709240210498206, 'bull_rsi_os': 41, 'bull_rsi_ob': 51, 'bull_adx_thresh': 17.658163145413553, 'bull_atr_min_pct': 0.027391603519286767, 'bull_atr_max_pct': 0.08898386391942967, 'bull_tp_mult': 1.425867620802417, 'bull_tsl_mult': 0.6691693895872417, 'bull_time_stop': 166, 'bull_use_sma': True, 'bull_use_ema': False, 'bull_use_atr': True, 'bull_use_adx': False, 'bull_use_spike': True, 'bull_rsi_required': False, 'bear_strategy': 'breakout', 'bear_bb_std_mult': 2.6770309942530925, 'bear_rsi_os': 31, 'bear_rsi_ob': 68, 'bear_adx_thresh': 6.00420030765132, 'bear_atr_min_pct': 0.006394813544894534, 'bear_atr_max_pct': 0.11535429574145246, 'bear_tp_mult': 2.2397045651968552, 'bear_tsl_mult': 0.38931629588766725, 'bear_time_stop': 10, 'bear_use_sma': False, 'bear_use_ema': True, 'bear_use_atr': False, 'bear_use_adx': True, 'bear_use_spike': True, 'bear_rsi_required': False, 'sideways_strategy': 'mean_reversion', 'sideways_bb_std_mult': 1.77487453749063, 'sideways_rsi_os': 15, 'sideways_rsi_ob': 91, 'sideways_adx_thresh': 18.39007719543154, 'sideways_atr_min_pct': 0.003741866597785151, 'sideways_atr_max_pct': 0.06471623574048649, 'sideways_tp_mult': 1.1442402992059932, 'sideways_tsl_mult': 0.6605416973719543, 'sideways_time_stop': 99, 'sideways_use_sma': False, 'sideways_use_ema': True, 'sideways_use_atr': False, 'sideways_use_adx': False, 'sideways_use_spike': False, 'sideways_rsi_required': False}.
[I 2025-08-29 20:12:01,819] Trial 300 finished with values: [-0.007875741916652967, 0.007843851374510328] and parameters: {'p_sma': 18, 'p_std': 56, 'p_atr': 23, 'p_adx': 15, 'rsi_period': 41, 'ema1': 18, 'ema2': 50, 'slip_atr_k': 0.021759362226872414, 'slip_spread_k': 0.16402487932522705, 'spread_hl_frac': 0.04222050132652791, 'bb_std_mult': 1.4591506014074285, 'rsi_os': 21, 'rsi_ob': 83, 'vol_spike': 0.2232694220251964, 'adx_thresh': 32.70274930452449, 'atr_min_pct': 0.019638492970406554, 'atr_max_pct': 0.03134980121097362, 'tp_mult': 1.5885513031671825, 'tsl_mult': 0.847558977077477, 'strategy': 'mean_reversion', 'time_stop': 180, 'use_sma': True, 'use_atr': False, 'use_adx': False, 'use_ema': True, 'use_spike': False, 'rsi_required': False, 'edge_k': 0.9555971055245334, 'edge_cap': 0.5639877301625699, 'bull_strategy': 'mean_reversion', 'bull_bb_std_mult': 3.0303962789700116, 'bull_rsi_os': 37, 'bull_rsi_ob': 73, 'bull_adx_thresh': 15.188692858945434, 'bull_atr_min_pct': 0.014759443457980073, 'bull_atr_max_pct': 0.03265660127238557, 'bull_tp_mult': 1.4367902270273403, 'bull_tsl_mult': 0.8979666975327495, 'bull_time_stop': 61, 'bull_use_sma': True, 'bull_use_ema': False, 'bull_use_atr': True, 'bull_use_adx': False, 'bull_use_spike': True, 'bull_rsi_required': False, 'bear_strategy': 'breakout', 'bear_bb_std_mult': 2.762609485214454, 'bear_rsi_os': 26, 'bear_rsi_ob': 67, 'bear_adx_thresh': 7.828420689100496, 'bear_atr_min_pct': 0.006756650771653188, 'bear_atr_max_pct': 0.03732508539119189, 'bear_tp_mult': 2.6541121591256447, 'bear_tsl_mult': 0.30718113129350744, 'bear_time_stop': 76, 'bear_use_sma': False, 'bear_use_ema': True, 'bear_use_atr': False, 'bear_use_adx': True, 'bear_use_spike': True, 'bear_rsi_required': True, 'sideways_strategy': 'breakout', 'sideways_bb_std_mult': 2.298768683043421, 'sideways_rsi_os': 46, 'sideways_rsi_ob': 79, 'sideways_adx_thresh': 33.603677469571316, 'sideways_atr_min_pct': 0.0025692052922914287, 'sideways_atr_max_pct': 0.018473256185610694, 'sideways_tp_mult': 1.1637078669573573, 'sideways_tsl_mult': 0.657239494334497, 'sideways_time_stop': 205, 'sideways_use_sma': False, 'sideways_use_ema': True, 'sideways_use_atr': False, 'sideways_use_adx': False, 'sideways_use_spike': False, 'sideways_rsi_required': False}.
[I 2025-08-29 20:12:02,017] Trial 298 finished with values: [-1000000000.0, 1000000000.0] and parameters: {'p_sma': 44, 'p_std': 28, 'p_atr': 23, 'p_adx': 16, 'rsi_period': 34, 'ema1': 21, 'ema2': 19, 'slip_atr_k': 0.034764746307764174, 'slip_spread_k': 0.20643542937808024, 'spread_hl_frac': 0.0015113988876903923, 'bb_std_mult': 3.1636851584071106, 'rsi_os': 18, 'rsi_ob': 62, 'vol_spike': 0.24600850871137572, 'adx_thresh': 30.339217267837128, 'atr_min_pct': 0.029276413534057327, 'atr_max_pct': 0.12520678947169767, 'tp_mult': 1.7663198102784234, 'tsl_mult': 0.5350107796703769, 'strategy': 'mean_reversion', 'time_stop': 232, 'use_sma': True, 'use_atr': True, 'use_adx': False, 'use_ema': True, 'use_spike': False, 'rsi_required': True, 'edge_k': 1.1606568192251951, 'edge_cap': 0.5231892839600017, 'bull_strategy': 'mean_reversion', 'bull_bb_std_mult': 2.461025689236367, 'bull_rsi_os': 39, 'bull_rsi_ob': 80, 'bull_adx_thresh': 17.60826364618163, 'bull_atr_min_pct': 0.014881629711738755, 'bull_atr_max_pct': 0.02699497750997073, 'bull_tp_mult': 1.4524604979736113, 'bull_tsl_mult': 0.6742995432895609, 'bull_time_stop': 104, 'bull_use_sma': True, 'bull_use_ema': False, 'bull_use_atr': True, 'bull_use_adx': False, 'bull_use_spike': False, 'bull_rsi_required': False, 'bear_strategy': 'breakout', 'bear_bb_std_mult': 1.338458582736378, 'bear_rsi_os': 48, 'bear_rsi_ob': 67, 'bear_adx_thresh': 13.504864158114433, 'bear_atr_min_pct': 0.010339299325392515, 'bear_atr_max_pct': 0.11352161033108749, 'bear_tp_mult': 1.4187355297670499, 'bear_tsl_mult': 0.3800650467949964, 'bear_time_stop': 55, 'bear_use_sma': False, 'bear_use_ema': True, 'bear_use_atr': True, 'bear_use_adx': True, 'bear_use_spike': True, 'bear_rsi_required': True, 'sideways_strategy': 'breakout', 'sideways_bb_std_mult': 1.755395295742339, 'sideways_rsi_os': 17, 'sideways_rsi_ob': 78, 'sideways_adx_thresh': 25.520771852818434, 'sideways_atr_min_pct': 0.004998033959810496, 'sideways_atr_max_pct': 0.07833780947909345, 'sideways_tp_mult': 1.533485824109035, 'sideways_tsl_mult': 0.6617323544362332, 'sideways_time_stop': 234, 'sideways_use_sma': False, 'sideways_use_ema': True, 'sideways_use_atr': True, 'sideways_use_adx': False, 'sideways_use_spike': False, 'sideways_rsi_required': False}.
[I 2025-08-29 20:12:32,441] Trial 301 finished with values: [-0.02719756069883328, 0.027170883794718628] and parameters: {'p_sma': 22, 'p_std': 56, 'p_atr': 7, 'p_adx': 15, 'rsi_period': 42, 'ema1': 18, 'ema2': 50, 'slip_atr_k': 0.021456516338670684, 'slip_spread_k': 0.16098184241332053, 'spread_hl_frac': 0.04047190942468349, 'bb_std_mult': 1.4167720670187223, 'rsi_os': 21, 'rsi_ob': 84, 'vol_spike': 0.2018666479003789, 'adx_thresh': 32.920555895038426, 'atr_min_pct': 0.01921424334113284, 'atr_max_pct': 0.032576347540455956, 'tp_mult': 1.6035717872457673, 'tsl_mult': 0.8525526684726097, 'strategy': 'mean_reversion', 'time_stop': 180, 'use_sma': True, 'use_atr': False, 'use_adx': False, 'use_ema': True, 'use_spike': False, 'rsi_required': False, 'edge_k': 1.0358336960509393, 'edge_cap': 0.564327649491438, 'bull_strategy': 'mean_reversion', 'bull_bb_std_mult': 3.075179318844034, 'bull_rsi_os': 37, 'bull_rsi_ob': 80, 'bull_adx_thresh': 15.51476629460353, 'bull_atr_min_pct': 0.014961976001043365, 'bull_atr_max_pct': 0.03192980422314408, 'bull_tp_mult': 1.4341746132568245, 'bull_tsl_mult': 0.9056575935093121, 'bull_time_stop': 62, 'bull_use_sma': True, 'bull_use_ema': False, 'bull_use_atr': True, 'bull_use_adx': False, 'bull_use_spike': True, 'bull_rsi_required': False, 'bear_strategy': 'breakout', 'bear_bb_std_mult': 2.761059444292594, 'bear_rsi_os': 26, 'bear_rsi_ob': 67, 'bear_adx_thresh': 8.495961260702567, 'bear_atr_min_pct': 0.006559564056556074, 'bear_atr_max_pct': 0.036839260001795264, 'bear_tp_mult': 2.64202375883353, 'bear_tsl_mult': 0.37460625193613595, 'bear_time_stop': 76, 'bear_use_sma': False, 'bear_use_ema': True, 'bear_use_atr': False, 'bear_use_adx': True, 'bear_use_spike': True, 'bear_rsi_required': True, 'sideways_strategy': 'breakout', 'sideways_bb_std_mult': 2.3446123217363297, 'sideways_rsi_os': 46, 'sideways_rsi_ob': 79, 'sideways_adx_thresh': 33.19978119616819, 'sideways_atr_min_pct': 0.0024397544826469933, 'sideways_atr_max_pct': 0.01789304928867269, 'sideways_tp_mult': 1.1595466802241905, 'sideways_tsl_mult': 0.6598144711674868, 'sideways_time_stop': 207, 'sideways_use_sma': False, 'sideways_use_ema': True, 'sideways_use_atr': False, 'sideways_use_adx': False, 'sideways_use_spike': False, 'sideways_rsi_required': False}.
[I 2025-08-29 20:12:32,779] Trial 302 finished with values: [-0.004086107722934718, 0.004506213620048338] and parameters: {'p_sma': 14, 'p_std': 56, 'p_atr': 23, 'p_adx': 15, 'rsi_period': 42, 'ema1': 18, 'ema2': 50, 'slip_atr_k': 0.024538021004134523, 'slip_spread_k': 0.14565625815796238, 'spread_hl_frac': 0.04227513432207425, 'bb_std_mult': 1.4273601174427246, 'rsi_os': 21, 'rsi_ob': 83, 'vol_spike': 0.19984686904005283, 'adx_thresh': 32.988194323523594, 'atr_min_pct': 0.01970209572373667, 'atr_max_pct': 0.03357404297749166, 'tp_mult': 1.5963561567674598, 'tsl_mult': 0.8400986331713945, 'strategy': 'mean_reversion', 'time_stop': 180, 'use_sma': True, 'use_atr': False, 'use_adx': False, 'use_ema': True, 'use_spike': False, 'rsi_required': False, 'edge_k': 0.9830982152963955, 'edge_cap': 0.5594680518112551, 'bull_strategy': 'mean_reversion', 'bull_bb_std_mult': 3.1188946771881394, 'bull_rsi_os': 37, 'bull_rsi_ob': 73, 'bull_adx_thresh': 15.222318092254813, 'bull_atr_min_pct': 0.014894489785311155, 'bull_atr_max_pct': 0.03225308088379536, 'bull_tp_mult': 1.4419066869339592, 'bull_tsl_mult': 0.9015376599816459, 'bull_time_stop': 60, 'bull_use_sma': True, 'bull_use_ema': False, 'bull_use_atr': True, 'bull_use_adx': False, 'bull_use_spike': True, 'bull_rsi_required': False, 'bear_strategy': 'breakout', 'bear_bb_std_mult': 2.752802317849024, 'bear_rsi_os': 26, 'bear_rsi_ob': 67, 'bear_adx_thresh': 8.416349208477884, 'bear_atr_min_pct': 0.0068005550540655635, 'bear_atr_max_pct': 0.03683511271889411, 'bear_tp_mult': 2.6605918845372885, 'bear_tsl_mult': 0.3123954900273121, 'bear_time_stop': 31, 'bear_use_sma': False, 'bear_use_ema': True, 'bear_use_atr': False, 'bear_use_adx': True, 'bear_use_spike': True, 'bear_rsi_required': True, 'sideways_strategy': 'breakout', 'sideways_bb_std_mult': 2.3256270150235028, 'sideways_rsi_os': 46, 'sideways_rsi_ob': 79, 'sideways_adx_thresh': 33.437218317679445, 'sideways_atr_min_pct': 0.002736032897587587, 'sideways_atr_max_pct': 0.018715973930558762, 'sideways_tp_mult': 1.1841603619021208, 'sideways_tsl_mult': 0.6777822891067312, 'sideways_time_stop': 205, 'sideways_use_sma': False, 'sideways_use_ema': True, 'sideways_use_atr': False, 'sideways_use_adx': False, 'sideways_use_spike': False, 'sideways_rsi_required': False}.
[I 2025-08-29 20:12:32,798] Trial 304 finished with values: [-0.0023145915039527454, 0.003096363467821154] and parameters: {'p_sma': 15, 'p_std': 54, 'p_atr': 13, 'p_adx': 15, 'rsi_period': 67, 'ema1': 18, 'ema2': 49, 'slip_atr_k': 0.016344871801392775, 'slip_spread_k': 0.16093976449260985, 'spread_hl_frac': 0.011360705625050975, 'bb_std_mult': 1.3663127705179963, 'rsi_os': 21, 'rsi_ob': 78, 'vol_spike': 0.19906584563855567, 'adx_thresh': 32.67063493466298, 'atr_min_pct': 0.019234849070343788, 'atr_max_pct': 0.03280650613685306, 'tp_mult': 1.6051057836358513, 'tsl_mult': 0.8057390208708185, 'strategy': 'mean_reversion', 'time_stop': 178, 'use_sma': True, 'use_atr': False, 'use_adx': False, 'use_ema': True, 'use_spike': False, 'rsi_required': False, 'edge_k': 1.0114491821431266, 'edge_cap': 0.5493045931518146, 'bull_strategy': 'mean_reversion', 'bull_bb_std_mult': 3.1080476813796927, 'bull_rsi_os': 36, 'bull_rsi_ob': 67, 'bull_adx_thresh': 16.163080479540316, 'bull_atr_min_pct': 0.014192811113296143, 'bull_atr_max_pct': 0.030443026114039727, 'bull_tp_mult': 1.3706721787683582, 'bull_tsl_mult': 0.8758951322494866, 'bull_time_stop': 57, 'bull_use_sma': True, 'bull_use_ema': False, 'bull_use_atr': True, 'bull_use_adx': False, 'bull_use_spike': True, 'bull_rsi_required': False, 'bear_strategy': 'breakout', 'bear_bb_std_mult': 2.535373257136812, 'bear_rsi_os': 26, 'bear_rsi_ob': 65, 'bear_adx_thresh': 8.123023542846473, 'bear_atr_min_pct': 0.007856041839503633, 'bear_atr_max_pct': 0.034942907395829025, 'bear_tp_mult': 2.550835529237892, 'bear_tsl_mult': 0.36914891024625307, 'bear_time_stop': 110, 'bear_use_sma': False, 'bear_use_ema': True, 'bear_use_atr': False, 'bear_use_adx': True, 'bear_use_spike': True, 'bear_rsi_required': False, 'sideways_strategy': 'breakout', 'sideways_bb_std_mult': 2.4303951256861147, 'sideways_rsi_os': 45, 'sideways_rsi_ob': 79, 'sideways_adx_thresh': 33.10943757861497, 'sideways_atr_min_pct': 0.0036927372223665433, 'sideways_atr_max_pct': 0.016001914589051865, 'sideways_tp_mult': 1.054358308095014, 'sideways_tsl_mult': 0.6788971721089013, 'sideways_time_stop': 183, 'sideways_use_sma': True, 'sideways_use_ema': True, 'sideways_use_atr': False, 'sideways_use_adx': False, 'sideways_use_spike': False, 'sideways_rsi_required': False}.
[I 2025-08-29 20:12:32,864] Trial 303 finished with values: [-0.004595811015217222, 0.004582893608437596] and parameters: {'p_sma': 14, 'p_std': 55, 'p_atr': 13, 'p_adx': 15, 'rsi_period': 62, 'ema1': 18, 'ema2': 49, 'slip_atr_k': 0.025778044220031514, 'slip_spread_k': 0.15109143176107664, 'spread_hl_frac': 0.004109471100405735, 'bb_std_mult': 1.3476691236141516, 'rsi_os': 21, 'rsi_ob': 77, 'vol_spike': 0.2062559203607138, 'adx_thresh': 32.887436214745705, 'atr_min_pct': 0.018524303771965248, 'atr_max_pct': 0.03463162366551804, 'tp_mult': 1.607749003817946, 'tsl_mult': 0.8086141299607984, 'strategy': 'mean_reversion', 'time_stop': 181, 'use_sma': True, 'use_atr': False, 'use_adx': False, 'use_ema': True, 'use_spike': False, 'rsi_required': False, 'edge_k': 1.012694950640002, 'edge_cap': 0.5316308856586148, 'bull_strategy': 'mean_reversion', 'bull_bb_std_mult': 3.124407050861042, 'bull_rsi_os': 36, 'bull_rsi_ob': 67, 'bull_adx_thresh': 15.959389198481409, 'bull_atr_min_pct': 0.015195878603409282, 'bull_atr_max_pct': 0.032130152097251875, 'bull_tp_mult': 1.3499084172724438, 'bull_tsl_mult': 0.8730687567773601, 'bull_time_stop': 56, 'bull_use_sma': True, 'bull_use_ema': False, 'bull_use_atr': True, 'bull_use_adx': False, 'bull_use_spike': True, 'bull_rsi_required': False, 'bear_strategy': 'breakout', 'bear_bb_std_mult': 2.705253400597722, 'bear_rsi_os': 26, 'bear_rsi_ob': 65, 'bear_adx_thresh': 7.157613978277972, 'bear_atr_min_pct': 0.025573461617827996, 'bear_atr_max_pct': 0.03301598689376452, 'bear_tp_mult': 2.689297427986555, 'bear_tsl_mult': 0.3852657100025607, 'bear_time_stop': 230, 'bear_use_sma': False, 'bear_use_ema': True, 'bear_use_atr': False, 'bear_use_adx': True, 'bear_use_spike': True, 'bear_rsi_required': True, 'sideways_strategy': 'breakout', 'sideways_bb_std_mult': 2.4417037189913384, 'sideways_rsi_os': 46, 'sideways_rsi_ob': 77, 'sideways_adx_thresh': 33.02695134843257, 'sideways_atr_min_pct': 0.003546302457759936, 'sideways_atr_max_pct': 0.015733090640772385, 'sideways_tp_mult': 1.063745561014559, 'sideways_tsl_mult': 0.675361123024312, 'sideways_time_stop': 196, 'sideways_use_sma': False, 'sideways_use_ema': True, 'sideways_use_atr': False, 'sideways_use_adx': False, 'sideways_use_spike': False, 'sideways_rsi_required': False}.
[I 2025-08-29 20:13:01,529] Trial 305 finished with values: [-0.002042434162431883, 0.0020393561718789754] and parameters: {'p_sma': 14, 'p_std': 58, 'p_atr': 24, 'p_adx': 15, 'rsi_period': 59, 'ema1': 18, 'ema2': 49, 'slip_atr_k': 0.026330399525858382, 'slip_spread_k': 0.7770086268379843, 'spread_hl_frac': 0.037352142809100985, 'bb_std_mult': 1.336665897588559, 'rsi_os': 21, 'rsi_ob': 77, 'vol_spike': 0.1989025576437217, 'adx_thresh': 32.86903298941973, 'atr_min_pct': 0.018451969006990036, 'atr_max_pct': 0.03718921834840877, 'tp_mult': 1.5760056956702708, 'tsl_mult': 0.8178658020468119, 'strategy': 'breakout', 'time_stop': 177, 'use_sma': True, 'use_atr': False, 'use_adx': True, 'use_ema': True, 'use_spike': False, 'rsi_required': False, 'edge_k': 0.8257005478350572, 'edge_cap': 0.5404587042712792, 'bull_strategy': 'mean_reversion', 'bull_bb_std_mult': 3.1616200465821365, 'bull_rsi_os': 35, 'bull_rsi_ob': 77, 'bull_adx_thresh': 16.028194351048782, 'bull_atr_min_pct': 0.01421324566037323, 'bull_atr_max_pct': 0.031810459968970445, 'bull_tp_mult': 1.3764489508477449, 'bull_tsl_mult': 0.8702450933098685, 'bull_time_stop': 55, 'bull_use_sma': True, 'bull_use_ema': False, 'bull_use_atr': True, 'bull_use_adx': False, 'bull_use_spike': True, 'bull_rsi_required': False, 'bear_strategy': 'mean_reversion', 'bear_bb_std_mult': 2.5198557680799785, 'bear_rsi_os': 26, 'bear_rsi_ob': 64, 'bear_adx_thresh': 25.605271852033745, 'bear_atr_min_pct': 0.023713017049306236, 'bear_atr_max_pct': 0.03395232246793734, 'bear_tp_mult': 2.3414952959048585, 'bear_tsl_mult': 0.3534955450929229, 'bear_time_stop': 110, 'bear_use_sma': False, 'bear_use_ema': True, 'bear_use_atr': False, 'bear_use_adx': True, 'bear_use_spike': True, 'bear_rsi_required': False, 'sideways_strategy': 'breakout', 'sideways_bb_std_mult': 2.259302137426112, 'sideways_rsi_os': 45, 'sideways_rsi_ob': 77, 'sideways_adx_thresh': 34.40413897214249, 'sideways_atr_min_pct': 0.0033731172553570763, 'sideways_atr_max_pct': 0.020412001512424716, 'sideways_tp_mult': 1.2325865308454964, 'sideways_tsl_mult': 0.6813863058434603, 'sideways_time_stop': 196, 'sideways_use_sma': True, 'sideways_use_ema': False, 'sideways_use_atr': False, 'sideways_use_adx': False, 'sideways_use_spike': False, 'sideways_rsi_required': False}.
