[I 2025-08-29 19:42:15,831] Trial 48 finished with values: [-0.005288179603518239, 0.0064635244366727535] and parameters: {'p_sma': 44, 'p_std': 37, 'p_atr': 7, 'p_adx': 19, 'rsi_period': 22, 'ema1': 10, 'ema2': 15, 'slip_atr_k': 0.026549012655173454, 'slip_spread_k': 0.7536079609215474, 'spread_hl_frac': 0.021325362647946502, 'bb_std_mult': 1.2607617253489571, 'rsi_os': 22, 'rsi_ob': 53, 'vol_spike': 0.08804924325261346, 'adx_thresh': 13.137700005348362, 'atr_min_pct': 0.026281823652878185, 'atr_max_pct': 0.055640812399390595, 'tp_mult': 2.9527923167202657, 'tsl_mult': 0.4181956793091088, 'strategy': 'breakout', 'time_stop': 170, 'use_sma': False, 'use_atr': False, 'use_adx': False, 'use_ema': False, 'use_spike': False, 'rsi_required': True, 'edge_k': 1.6584531440127497, 'edge_cap': 0.4603886046036495, 'bull_strategy': 'mean_reversion', 'bull_bb_std_mult': 1.4332522638997331, 'bull_rsi_os': 42, 'bull_rsi_ob': 93, 'bull_adx_thresh': 18.255902317774613, 'bull_atr_min_pct': 0.019289931656075496, 'bull_atr_max_pct': 0.04489526341448026, 'bull_tp_mult': 2.892636015732305, 'bull_tsl_mult': 0.3757713245766485, 'bull_time_stop': 79, 'bull_use_sma': False, 'bull_use_ema': False, 'bull_use_atr': False, 'bull_use_adx': True, 'bull_use_spike': True, 'bull_rsi_required': True, 'bear_strategy': 'breakout', 'bear_bb_std_mult': 3.014749610434771, 'bear_rsi_os': 25, 'bear_rsi_ob': 72, 'bear_adx_thresh': 34.030989848395315, 'bear_atr_min_pct': 0.004214313379940262, 'bear_atr_max_pct': 0.11446926861640186, 'bear_tp_mult': 2.903312325236138, 'bear_tsl_mult': 0.5685608983499995, 'bear_time_stop': 162, 'bear_use_sma': True, 'bear_use_ema': False, 'bear_use_atr': False, 'bear_use_adx': False, 'bear_use_spike': False, 'bear_rsi_required': False, 'sideways_strategy': 'mean_reversion', 'sideways_bb_std_mult': 0.8880589780080215, 'sideways_rsi_os': 26, 'sideways_rsi_ob': 82, 'sideways_adx_thresh': 23.268288069026433, 'sideways_atr_min_pct': 0.013933744699263638, 'sideways_atr_max_pct': 0.13390061078158244, 'sideways_tp_mult': 2.8239063414323002, 'sideways_tsl_mult': 0.12774229603719164, 'sideways_time_stop': 111, 'sideways_use_sma': True, 'sideways_use_ema': True, 'sideways_use_atr': False, 'sideways_use_adx': False, 'sideways_use_spike': False, 'sideways_rsi_required': True}.
[I 2025-08-29 19:42:16,366] Trial 46 finished with values: [-0.018651378460055823, 0.018792801836792283] and parameters: {'p_sma': 23, 'p_std': 14, 'p_atr': 8, 'p_adx': 18, 'rsi_period': 22, 'ema1': 26, 'ema2': 20, 'slip_atr_k': 0.06215713383137421, 'slip_spread_k': 0.673898262854666, 'spread_hl_frac': 0.024244732758223916, 'bb_std_mult': 1.5262083039880365, 'rsi_os': 23, 'rsi_ob': 54, 'vol_spike': 0.0876858669248963, 'adx_thresh': 18.998930864383706, 'atr_min_pct': 0.013820162646049938, 'atr_max_pct': 0.09619909592916089, 'tp_mult': 2.356145987627504, 'tsl_mult': 0.26005571679057005, 'strategy': 'breakout', 'time_stop': 33, 'use_sma': False, 'use_atr': False, 'use_adx': False, 'use_ema': False, 'use_spike': False, 'rsi_required': True, 'edge_k': 0.4662289953173935, 'edge_cap': 0.4551439040020874, 'bull_strategy': 'breakout', 'bull_bb_std_mult': 1.6875844327945335, 'bull_rsi_os': 41, 'bull_rsi_ob': 83, 'bull_adx_thresh': 17.61865493251185, 'bull_atr_min_pct': 0.00534359468509101, 'bull_atr_max_pct': 0.0963861055518701, 'bull_tp_mult': 2.9092043533123513, 'bull_tsl_mult': 0.3920865782388693, 'bull_time_stop': 147, 'bull_use_sma': True, 'bull_use_ema': False, 'bull_use_atr': False, 'bull_use_adx': True, 'bull_use_spike': True, 'bull_rsi_required': True, 'bear_strategy': 'breakout', 'bear_bb_std_mult': 1.3367063632356013, 'bear_rsi_os': 26, 'bear_rsi_ob': 66, 'bear_adx_thresh': 34.844009594743184, 'bear_atr_min_pct': 0.0032035166818301145, 'bear_atr_max_pct': 0.01124730207020988, 'bear_tp_mult': 2.7378541937245595, 'bear_tsl_mult': 0.6231376016197109, 'bear_time_stop': 113, 'bear_use_sma': True, 'bear_use_ema': True, 'bear_use_atr': True, 'bear_use_adx': False, 'bear_use_spike': False, 'bear_rsi_required': True, 'sideways_strategy': 'mean_reversion', 'sideways_bb_std_mult': 2.2952244980694987, 'sideways_rsi_os': 26, 'sideways_rsi_ob': 82, 'sideways_adx_thresh': 13.188658265990055, 'sideways_atr_min_pct': 0.008712710039597263, 'sideways_atr_max_pct': 0.12679953418049683, 'sideways_tp_mult': 1.8205916204551478, 'sideways_tsl_mult': 0.12156912835300973, 'sideways_time_stop': 113, 'sideways_use_sma': True, 'sideways_use_ema': True, 'sideways_use_atr': False, 'sideways_use_adx': False, 'sideways_use_spike': False, 'sideways_rsi_required': False}.
[I 2025-08-29 19:42:16,465] Trial 45 finished with values: [-1000000000.0, 0.1643165046088524] and parameters: {'p_sma': 44, 'p_std': 40, 'p_atr': 7, 'p_adx': 9, 'rsi_period': 28, 'ema1': 25, 'ema2': 21, 'slip_atr_k': 0.20465053836366956, 'slip_spread_k': 0.005903519501107568, 'spread_hl_frac': 0.024973437969585337, 'bb_std_mult': 1.2690628711892753, 'rsi_os': 24, 'rsi_ob': 59, 'vol_spike': 0.1425896527141025, 'adx_thresh': 12.82433927907152, 'atr_min_pct': 0.013926963374603665, 'atr_max_pct': 0.09787123024934104, 'tp_mult': 2.804894919203797, 'tsl_mult': 0.5424716665648042, 'strategy': 'breakout', 'time_stop': 165, 'use_sma': False, 'use_atr': False, 'use_adx': False, 'use_ema': False, 'use_spike': False, 'rsi_required': True, 'edge_k': 0.8955541484601692, 'edge_cap': 0.4572481285318403, 'bull_strategy': 'breakout', 'bull_bb_std_mult': 1.711198101431144, 'bull_rsi_os': 17, 'bull_rsi_ob': 81, 'bull_adx_thresh': 17.632202217236806, 'bull_atr_min_pct': 0.0034366791533314775, 'bull_atr_max_pct': 0.06463819603894536, 'bull_tp_mult': 1.5970006296399346, 'bull_tsl_mult': 0.388206364060021, 'bull_time_stop': 28, 'bull_use_sma': True, 'bull_use_ema': True, 'bull_use_atr': False, 'bull_use_adx': True, 'bull_use_spike': True, 'bull_rsi_required': True, 'bear_strategy': 'breakout', 'bear_bb_std_mult': 1.3111747713777495, 'bear_rsi_os': 55, 'bear_rsi_ob': 65, 'bear_adx_thresh': 34.814313665151204, 'bear_atr_min_pct': 0.0036793344312840734, 'bear_atr_max_pct': 0.13144693574781113, 'bear_tp_mult': 2.7292059342916724, 'bear_tsl_mult': 0.6622645632076869, 'bear_time_stop': 167, 'bear_use_sma': True, 'bear_use_ema': True, 'bear_use_atr': True, 'bear_use_adx': False, 'bear_use_spike': False, 'bear_rsi_required': True, 'sideways_strategy': 'breakout', 'sideways_bb_std_mult': 1.2632052880773097, 'sideways_rsi_os': 52, 'sideways_rsi_ob': 68, 'sideways_adx_thresh': 23.180920782719646, 'sideways_atr_min_pct': 0.0016818961357462844, 'sideways_atr_max_pct': 0.13169081045689252, 'sideways_tp_mult': 2.069369359353425, 'sideways_tsl_mult': 0.3125294916347714, 'sideways_time_stop': 146, 'sideways_use_sma': False, 'sideways_use_ema': True, 'sideways_use_atr': True, 'sideways_use_adx': True, 'sideways_use_spike': False, 'sideways_rsi_required': False}.
[I 2025-08-29 19:42:16,554] Trial 47 finished with values: [-1000000000.0, 1000000000.0] and parameters: {'p_sma': 44, 'p_std': 39, 'p_atr': 22, 'p_adx': 18, 'rsi_period': 22, 'ema1': 10, 'ema2': 15, 'slip_atr_k': 0.02766959114272952, 'slip_spread_k': 0.7614626586461406, 'spread_hl_frac': 0.04226442874137076, 'bb_std_mult': 1.2686701577876944, 'rsi_os': 23, 'rsi_ob': 60, 'vol_spike': 0.08406341730427722, 'adx_thresh': 12.762446287486501, 'atr_min_pct': 0.025912075360212356, 'atr_max_pct': 0.09858621148118371, 'tp_mult': 2.8421617667388293, 'tsl_mult': 0.2530944626376276, 'strategy': 'breakout', 'time_stop': 271, 'use_sma': False, 'use_atr': False, 'use_adx': False, 'use_ema': False, 'use_spike': False, 'rsi_required': True, 'edge_k': 1.6322939044851674, 'edge_cap': 0.43497300065771616, 'bull_strategy': 'mean_reversion', 'bull_bb_std_mult': 1.5202834223115378, 'bull_rsi_os': 41, 'bull_rsi_ob': 54, 'bull_adx_thresh': 25.1521923924998, 'bull_atr_min_pct': 0.01941978464348401, 'bull_atr_max_pct': 0.09784268053234148, 'bull_tp_mult': 1.6133697053688238, 'bull_tsl_mult': 0.38427562624089817, 'bull_time_stop': 74, 'bull_use_sma': True, 'bull_use_ema': False, 'bull_use_atr': False, 'bull_use_adx': True, 'bull_use_spike': True, 'bull_rsi_required': True, 'bear_strategy': 'breakout', 'bear_bb_std_mult': 2.7376785827056844, 'bear_rsi_os': 9, 'bear_rsi_ob': 71, 'bear_adx_thresh': 12.455016367819912, 'bear_atr_min_pct': 0.004491061225308839, 'bear_atr_max_pct': 0.10251248613548322, 'bear_tp_mult': 2.917457425300297, 'bear_tsl_mult': 0.5733710041187721, 'bear_time_stop': 170, 'bear_use_sma': True, 'bear_use_ema': True, 'bear_use_atr': False, 'bear_use_adx': False, 'bear_use_spike': False, 'bear_rsi_required': True, 'sideways_strategy': 'mean_reversion', 'sideways_bb_std_mult': 0.8986613265092127, 'sideways_rsi_os': 26, 'sideways_rsi_ob': 82, 'sideways_adx_thresh': 12.817356441763183, 'sideways_atr_min_pct': 0.007909908963086694, 'sideways_atr_max_pct': 0.13675605534035615, 'sideways_tp_mult': 2.8221923250997967, 'sideways_tsl_mult': 0.09767168196533282, 'sideways_time_stop': 114, 'sideways_use_sma': True, 'sideways_use_ema': True, 'sideways_use_atr': False, 'sideways_use_adx': False, 'sideways_use_spike': False, 'sideways_rsi_required': True}.
[I 2025-08-29 19:42:45,420] Trial 49 finished with values: [-0.022626485115407546, 0.022660767210181107] and parameters: {'p_sma': 34, 'p_std': 38, 'p_atr': 22, 'p_adx': 18, 'rsi_period': 22, 'ema1': 10, 'ema2': 49, 'slip_atr_k': 0.061316775992345994, 'slip_spread_k': 0.7573336564645055, 'spread_hl_frac': 0.04294088832974048, 'bb_std_mult': 1.237883379397295, 'rsi_os': 22, 'rsi_ob': 82, 'vol_spike': 0.009506686731695246, 'adx_thresh': 12.805564188288756, 'atr_min_pct': 0.026857864371173202, 'atr_max_pct': 0.05341179614639613, 'tp_mult': 2.7845933373927387, 'tsl_mult': 0.2566149905467784, 'strategy': 'breakout', 'time_stop': 165, 'use_sma': False, 'use_atr': False, 'use_adx': False, 'use_ema': False, 'use_spike': False, 'rsi_required': True, 'edge_k': 1.6080802970631434, 'edge_cap': 0.27324170231562417, 'bull_strategy': 'mean_reversion', 'bull_bb_std_mult': 1.541699302152694, 'bull_rsi_os': 27, 'bull_rsi_ob': 55, 'bull_adx_thresh': 17.282432103545453, 'bull_atr_min_pct': 0.010338430515856928, 'bull_atr_max_pct': 0.09542071310002323, 'bull_tp_mult': 1.5556684789819732, 'bull_tsl_mult': 0.40228795158026787, 'bull_time_stop': 73, 'bull_use_sma': True, 'bull_use_ema': False, 'bull_use_atr': False, 'bull_use_adx': True, 'bull_use_spike': True, 'bull_rsi_required': False, 'bear_strategy': 'breakout', 'bear_bb_std_mult': 2.96167853663934, 'bear_rsi_os': 55, 'bear_rsi_ob': 95, 'bear_adx_thresh': 12.896351285864363, 'bear_atr_min_pct': 0.004167508696044042, 'bear_atr_max_pct': 0.0269358569608981, 'bear_tp_mult': 2.927573202680938, 'bear_tsl_mult': 0.5016515743683565, 'bear_time_stop': 118, 'bear_use_sma': False, 'bear_use_ema': False, 'bear_use_atr': False, 'bear_use_adx': False, 'bear_use_spike': False, 'bear_rsi_required': False, 'sideways_strategy': 'mean_reversion', 'sideways_bb_std_mult': 1.7286363542918384, 'sideways_rsi_os': 26, 'sideways_rsi_ob': 82, 'sideways_adx_thresh': 22.953376654215713, 'sideways_atr_min_pct': 0.01642586360491543, 'sideways_atr_max_pct': 0.01126233374870568, 'sideways_tp_mult': 2.8234164283102836, 'sideways_tsl_mult': 0.08641986865259546, 'sideways_time_stop': 187, 'sideways_use_sma': True, 'sideways_use_ema': True, 'sideways_use_atr': False, 'sideways_use_adx': False, 'sideways_use_spike': False, 'sideways_rsi_required': True}.
[I 2025-08-29 19:42:46,294] Trial 50 finished with values: [-1000000000.0, 1000000000.0] and parameters: {'p_sma': 45, 'p_std': 36, 'p_atr': 17, 'p_adx': 19, 'rsi_period': 76, 'ema1': 10, 'ema2': 43, 'slip_atr_k': 0.021931326697251757, 'slip_spread_k': 0.7483444332809764, 'spread_hl_frac': 0.04280515851171239, 'bb_std_mult': 1.2116569171274514, 'rsi_os': 25, 'rsi_ob': 70, 'vol_spike': 0.05648781212754167, 'adx_thresh': 13.230105989793984, 'atr_min_pct': 0.026525421436662422, 'atr_max_pct': 0.028739919213881457, 'tp_mult': 2.995752075188377, 'tsl_mult': 0.33447607207641095, 'strategy': 'breakout', 'time_stop': 173, 'use_sma': True, 'use_atr': True, 'use_adx': False, 'use_ema': False, 'use_spike': False, 'rsi_required': True, 'edge_k': 1.654532779773582, 'edge_cap': 0.3197283401081481, 'bull_strategy': 'mean_reversion', 'bull_bb_std_mult': 2.5164473274256416, 'bull_rsi_os': 26, 'bull_rsi_ob': 93, 'bull_adx_thresh': 10.167182711531332, 'bull_atr_min_pct': 0.025036569944331864, 'bull_atr_max_pct': 0.03518789673703196, 'bull_tp_mult': 1.2704777327811927, 'bull_tsl_mult': 0.3965377682685453, 'bull_time_stop': 80, 'bull_use_sma': False, 'bull_use_ema': True, 'bull_use_atr': False, 'bull_use_adx': True, 'bull_use_spike': True, 'bull_rsi_required': False, 'bear_strategy': 'breakout', 'bear_bb_std_mult': 0.9178387104514372, 'bear_rsi_os': 8, 'bear_rsi_ob': 94, 'bear_adx_thresh': 6.584795507458808, 'bear_atr_min_pct': 7.105397783382494e-05, 'bear_atr_max_pct': 0.11544570531223507, 'bear_tp_mult': 2.891814915062034, 'bear_tsl_mult': 0.488894503264718, 'bear_time_stop': 163, 'bear_use_sma': False, 'bear_use_ema': False, 'bear_use_atr': False, 'bear_use_adx': False, 'bear_use_spike': False, 'bear_rsi_required': False, 'sideways_strategy': 'mean_reversion', 'sideways_bb_std_mult': 0.8948950280912884, 'sideways_rsi_os': 10, 'sideways_rsi_ob': 63, 'sideways_adx_thresh': 25.813363096690637, 'sideways_atr_min_pct': 0.02730677484537905, 'sideways_atr_max_pct': 0.13650474030465604, 'sideways_tp_mult': 2.8025468144733017, 'sideways_tsl_mult': 0.07629121087063112, 'sideways_time_stop': 187, 'sideways_use_sma': True, 'sideways_use_ema': True, 'sideways_use_atr': False, 'sideways_use_adx': False, 'sideways_use_spike': False, 'sideways_rsi_required': True}.
[I 2025-08-29 19:42:46,404] Trial 51 finished with values: [-1000000000.0, 1000000000.0] and parameters: {'p_sma': 7, 'p_std': 35, 'p_atr': 30, 'p_adx': 19, 'rsi_period': 78, 'ema1': 9, 'ema2': 14, 'slip_atr_k': 0.015011323444531353, 'slip_spread_k': 0.7677687436066901, 'spread_hl_frac': 0.042755236145229254, 'bb_std_mult': 1.0554197153082052, 'rsi_os': 33, 'rsi_ob': 82, 'vol_spike': 0.010012461820501833, 'adx_thresh': 27.969897653310902, 'atr_min_pct': 0.027005044479519937, 'atr_max_pct': 0.05309553243084911, 'tp_mult': 2.880503301656954, 'tsl_mult': 0.34706942638115246, 'strategy': 'mean_reversion', 'time_stop': 139, 'use_sma': True, 'use_atr': True, 'use_adx': True, 'use_ema': False, 'use_spike': True, 'rsi_required': True, 'edge_k': 1.6089095905155968, 'edge_cap': 0.257683725542884, 'bull_strategy': 'mean_reversion', 'bull_bb_std_mult': 1.5045329736839914, 'bull_rsi_os': 26, 'bull_rsi_ob': 54, 'bull_adx_thresh': 24.92219608083366, 'bull_atr_min_pct': 0.010920806129552377, 'bull_atr_max_pct': 0.04598104112452554, 'bull_tp_mult': 1.2923115904531044, 'bull_tsl_mult': 0.32830924613372886, 'bull_time_stop': 77, 'bull_use_sma': False, 'bull_use_ema': False, 'bull_use_atr': False, 'bull_use_adx': True, 'bull_use_spike': True, 'bull_rsi_required': False, 'bear_strategy': 'breakout', 'bear_bb_std_mult': 3.0586381506071474, 'bear_rsi_os': 9, 'bear_rsi_ob': 72, 'bear_adx_thresh': 13.093565603547475, 'bear_atr_min_pct': 4.443910461296441e-05, 'bear_atr_max_pct': 0.14034751160067654, 'bear_tp_mult': 1.3653073188740694, 'bear_tsl_mult': 0.4968074547049553, 'bear_time_stop': 214, 'bear_use_sma': False, 'bear_use_ema': False, 'bear_use_atr': False, 'bear_use_adx': False, 'bear_use_spike': False, 'bear_rsi_required': False, 'sideways_strategy': 'mean_reversion', 'sideways_bb_std_mult': 3.310720398805752, 'sideways_rsi_os': 11, 'sideways_rsi_ob': 64, 'sideways_adx_thresh': 26.218085999420076, 'sideways_atr_min_pct': 0.027756858783737962, 'sideways_atr_max_pct': 0.010026298803599953, 'sideways_tp_mult': 2.8245369865402554, 'sideways_tsl_mult': 0.9728460034054509, 'sideways_time_stop': 184, 'sideways_use_sma': True, 'sideways_use_ema': True, 'sideways_use_atr': False, 'sideways_use_adx': False, 'sideways_use_spike': False, 'sideways_rsi_required': True}.
[I 2025-08-29 19:42:46,625] Trial 52 finished with values: [-1000000000.0, 1000000000.0] and parameters: {'p_sma': 33, 'p_std': 35, 'p_atr': 30, 'p_adx': 11, 'rsi_period': 10, 'ema1': 19, 'ema2': 49, 'slip_atr_k': 0.007685807005948033, 'slip_spread_k': 0.5984337201395625, 'spread_hl_frac': 0.028203322851537257, 'bb_std_mult': 1.0983082811732838, 'rsi_os': 32, 'rsi_ob': 83, 'vol_spike': 0.05419716724977115, 'adx_thresh': 26.97566163747621, 'atr_min_pct': 0.009100383148015279, 'atr_max_pct': 0.05531494184662053, 'tp_mult': 2.9455082798883576, 'tsl_mult': 0.4196285774117222, 'strategy': 'mean_reversion', 'time_stop': 175, 'use_sma': True, 'use_atr': True, 'use_adx': True, 'use_ema': False, 'use_spike': True, 'rsi_required': True, 'edge_k': 1.2218860214925327, 'edge_cap': 0.2683946891952813, 'bull_strategy': 'mean_reversion', 'bull_bb_std_mult': 2.529565871832861, 'bull_rsi_os': 26, 'bull_rsi_ob': 93, 'bull_adx_thresh': 34.94235422361365, 'bull_atr_min_pct': 0.010292348296600338, 'bull_atr_max_pct': 0.11120014205036256, 'bull_tp_mult': 1.2864831381181838, 'bull_tsl_mult': 0.23394197979820158, 'bull_time_stop': 279, 'bull_use_sma': False, 'bull_use_ema': True, 'bull_use_atr': True, 'bull_use_adx': True, 'bull_use_spike': True, 'bull_rsi_required': False, 'bear_strategy': 'breakout', 'bear_bb_std_mult': 2.9549617622010955, 'bear_rsi_os': 25, 'bear_rsi_ob': 92, 'bear_adx_thresh': 6.313190044671376, 'bear_atr_min_pct': 0.017781293501710385, 'bear_atr_max_pct': 0.11611689708693795, 'bear_tp_mult': 1.1870380090871575, 'bear_tsl_mult': 0.49704970045755903, 'bear_time_stop': 215, 'bear_use_sma': False, 'bear_use_ema': False, 'bear_use_atr': False, 'bear_use_adx': False, 'bear_use_spike': False, 'bear_rsi_required': False, 'sideways_strategy': 'mean_reversion', 'sideways_bb_std_mult': 3.3274833810961324, 'sideways_rsi_os': 14, 'sideways_rsi_ob': 63, 'sideways_adx_thresh': 23.839908485278546, 'sideways_atr_min_pct': 0.013672395661292, 'sideways_atr_max_pct': 0.011248513800317356, 'sideways_tp_mult': 2.2163496145598227, 'sideways_tsl_mult': 0.42505214339196185, 'sideways_time_stop': 179, 'sideways_use_sma': True, 'sideways_use_ema': True, 'sideways_use_atr': True, 'sideways_use_adx': False, 'sideways_use_spike': False, 'sideways_rsi_required': True}.
[I 2025-08-29 19:43:16,510] Trial 53 finished with values: [-1000000000.0, 1000000000.0] and parameters: {'p_sma': 13, 'p_std': 36, 'p_atr': 30, 'p_adx': 11, 'rsi_period': 10, 'ema1': 9, 'ema2': 57, 'slip_atr_k': 0.0045239308264443945, 'slip_spread_k': 0.6173239829776473, 'spread_hl_frac': 0.03845391598527089, 'bb_std_mult': 1.0638655918138624, 'rsi_os': 33, 'rsi_ob': 71, 'vol_spike': 0.05094963452306969, 'adx_thresh': 27.20799867733146, 'atr_min_pct': 0.009841162831023147, 'atr_max_pct': 0.03135844749368141, 'tp_mult': 2.9817907439548836, 'tsl_mult': 0.6241885508285107, 'strategy': 'mean_reversion', 'time_stop': 139, 'use_sma': True, 'use_atr': True, 'use_adx': True, 'use_ema': False, 'use_spike': True, 'rsi_required': True, 'edge_k': 1.1902453015900196, 'edge_cap': 0.37851296530675893, 'bull_strategy': 'mean_reversion', 'bull_bb_std_mult': 2.5028991004350356, 'bull_rsi_os': 51, 'bull_rsi_ob': 88, 'bull_adx_thresh': 9.996940682903503, 'bull_atr_min_pct': 0.02493867224541859, 'bull_atr_max_pct': 0.11493551327407883, 'bull_tp_mult': 1.1414775222468816, 'bull_tsl_mult': 0.3301156458367296, 'bull_time_stop': 274, 'bull_use_sma': False, 'bull_use_ema': True, 'bull_use_atr': True, 'bull_use_adx': True, 'bull_use_spike': True, 'bull_rsi_required': False, 'bear_strategy': 'mean_reversion', 'bear_bb_std_mult': 0.6494272668157846, 'bear_rsi_os': 8, 'bear_rsi_ob': 91, 'bear_adx_thresh': 21.034714385439127, 'bear_atr_min_pct': 0.023499872460480308, 'bear_atr_max_pct': 0.1161207150586221, 'bear_tp_mult': 1.2599635802642826, 'bear_tsl_mult': 0.8023702476098389, 'bear_time_stop': 214, 'bear_use_sma': False, 'bear_use_ema': False, 'bear_use_atr': True, 'bear_use_adx': False, 'bear_use_spike': False, 'bear_rsi_required': False, 'sideways_strategy': 'mean_reversion', 'sideways_bb_std_mult': 2.01527496805117, 'sideways_rsi_os': 10, 'sideways_rsi_ob': 87, 'sideways_adx_thresh': 25.853427798879274, 'sideways_atr_min_pct': 0.028120964157398502, 'sideways_atr_max_pct': 0.04975004408148711, 'sideways_tp_mult': 1.5608779028325708, 'sideways_tsl_mult': 0.23800133985338048, 'sideways_time_stop': 49, 'sideways_use_sma': True, 'sideways_use_ema': True, 'sideways_use_atr': True, 'sideways_use_adx': False, 'sideways_use_spike': False, 'sideways_rsi_required': True}.
