[I 2025-08-29 21:05:16,884] Trial 764 finished with values: [-1000000000.0, 1000000000.0] and parameters: {'p_sma': 14, 'p_std': 33, 'p_atr': 16, 'p_adx': 8, 'rsi_period': 30, 'ema1': 22, 'ema2': 20, 'slip_atr_k': 0.009612654553099327, 'slip_spread_k': 0.07097229279280096, 'spread_hl_frac': 0.0217685105639409, 'bb_std_mult': 0.9195888881859435, 'rsi_os': 6, 'rsi_ob': 77, 'vol_spike': 0.297648343190103, 'adx_thresh': 8.508871195153057, 'atr_min_pct': 0.010596675952787763, 'atr_max_pct': 0.04137572241112725, 'tp_mult': 2.423582433755355, 'tsl_mult': 0.7530499713580061, 'strategy': 'mean_reversion', 'time_stop': 201, 'use_sma': True, 'use_atr': False, 'use_adx': False, 'use_ema': False, 'use_spike': True, 'rsi_required': False, 'edge_k': 0.9113828726396753, 'edge_cap': 0.3377005145379655, 'bull_strategy': 'mean_reversion', 'bull_bb_std_mult': 2.722126019835265, 'bull_rsi_os': 22, 'bull_rsi_ob': 67, 'bull_adx_thresh': 28.281667326387392, 'bull_atr_min_pct': 0.01910317726537832, 'bull_atr_max_pct': 0.10661922901916718, 'bull_tp_mult': 2.4366991565548117, 'bull_tsl_mult': 0.9684922770927279, 'bull_time_stop': 217, 'bull_use_sma': True, 'bull_use_ema': False, 'bull_use_atr': False, 'bull_use_adx': True, 'bull_use_spike': True, 'bull_rsi_required': False, 'bear_strategy': 'breakout', 'bear_bb_std_mult': 2.3097033159473837, 'bear_rsi_os': 41, 'bear_rsi_ob': 89, 'bear_adx_thresh': 18.07348878295882, 'bear_atr_min_pct': 0.008714263646021202, 'bear_atr_max_pct': 0.0819291222270049, 'bear_tp_mult': 2.9160094674693733, 'bear_tsl_mult': 0.029635489092528028, 'bear_time_stop': 262, 'bear_use_sma': False, 'bear_use_ema': False, 'bear_use_atr': False, 'bear_use_adx': False, 'bear_use_spike': True, 'bear_rsi_required': False, 'sideways_strategy': 'breakout', 'sideways_bb_std_mult': 3.4064898526205982, 'sideways_rsi_os': 22, 'sideways_rsi_ob': 84, 'sideways_adx_thresh': 13.07591116434169, 'sideways_atr_min_pct': 0.012318492545942314, 'sideways_atr_max_pct': 0.03893405673718859, 'sideways_tp_mult': 2.3589249372586085, 'sideways_tsl_mult': 0.595847802807781, 'sideways_time_stop': 149, 'sideways_use_sma': False, 'sideways_use_ema': False, 'sideways_use_atr': True, 'sideways_use_adx': False, 'sideways_use_spike': False, 'sideways_rsi_required': True}.
[I 2025-08-29 21:05:17,005] Trial 765 finished with values: [-1000000000.0, 1000000000.0] and parameters: {'p_sma': 14, 'p_std': 32, 'p_atr': 16, 'p_adx': 9, 'rsi_period': 30, 'ema1': 22, 'ema2': 25, 'slip_atr_k': 0.010592790669571743, 'slip_spread_k': 0.07554932596465465, 'spread_hl_frac': 0.021988783438600855, 'bb_std_mult': 0.8908679276535509, 'rsi_os': 6, 'rsi_ob': 77, 'vol_spike': 0.29903254504687954, 'adx_thresh': 8.393202588218328, 'atr_min_pct': 0.01043864427841742, 'atr_max_pct': 0.04058760961512581, 'tp_mult': 2.4703375485571923, 'tsl_mult': 0.7765926174387285, 'strategy': 'mean_reversion', 'time_stop': 202, 'use_sma': True, 'use_atr': False, 'use_adx': False, 'use_ema': False, 'use_spike': True, 'rsi_required': False, 'edge_k': 0.9167975427209298, 'edge_cap': 0.33495760042317335, 'bull_strategy': 'mean_reversion', 'bull_bb_std_mult': 2.7375203133280483, 'bull_rsi_os': 22, 'bull_rsi_ob': 67, 'bull_adx_thresh': 28.176774187902442, 'bull_atr_min_pct': 0.019274191205734616, 'bull_atr_max_pct': 0.10656789890813555, 'bull_tp_mult': 2.455040429293477, 'bull_tsl_mult': 0.9809974229341547, 'bull_time_stop': 219, 'bull_use_sma': True, 'bull_use_ema': False, 'bull_use_atr': False, 'bull_use_adx': True, 'bull_use_spike': True, 'bull_rsi_required': False, 'bear_strategy': 'breakout', 'bear_bb_std_mult': 2.317492033040192, 'bear_rsi_os': 41, 'bear_rsi_ob': 89, 'bear_adx_thresh': 17.89900531371857, 'bear_atr_min_pct': 0.008059140015621295, 'bear_atr_max_pct': 0.08063253893018013, 'bear_tp_mult': 2.9123047434072538, 'bear_tsl_mult': 0.013449149640170518, 'bear_time_stop': 260, 'bear_use_sma': False, 'bear_use_ema': False, 'bear_use_atr': False, 'bear_use_adx': False, 'bear_use_spike': True, 'bear_rsi_required': False, 'sideways_strategy': 'breakout', 'sideways_bb_std_mult': 3.4430024974123734, 'sideways_rsi_os': 22, 'sideways_rsi_ob': 85, 'sideways_adx_thresh': 13.461575794766757, 'sideways_atr_min_pct': 0.012439681036624978, 'sideways_atr_max_pct': 0.03918025794773844, 'sideways_tp_mult': 2.331851252539679, 'sideways_tsl_mult': 0.6008062331126213, 'sideways_time_stop': 149, 'sideways_use_sma': False, 'sideways_use_ema': False, 'sideways_use_atr': True, 'sideways_use_adx': False, 'sideways_use_spike': False, 'sideways_rsi_required': True}.
[I 2025-08-29 21:05:17,072] Trial 767 finished with values: [-1000000000.0, 1000000000.0] and parameters: {'p_sma': 14, 'p_std': 33, 'p_atr': 16, 'p_adx': 9, 'rsi_period': 30, 'ema1': 23, 'ema2': 20, 'slip_atr_k': 0.008680624356960038, 'slip_spread_k': 0.06969626838090714, 'spread_hl_frac': 0.021961990050862055, 'bb_std_mult': 0.8356883077223052, 'rsi_os': 6, 'rsi_ob': 77, 'vol_spike': 0.2948044293074932, 'adx_thresh': 8.408123046384931, 'atr_min_pct': 0.010012654770881568, 'atr_max_pct': 0.039893848448952406, 'tp_mult': 2.384957803736476, 'tsl_mult': 0.7548860439570187, 'strategy': 'mean_reversion', 'time_stop': 202, 'use_sma': True, 'use_atr': False, 'use_adx': False, 'use_ema': False, 'use_spike': True, 'rsi_required': False, 'edge_k': 0.9281329811585991, 'edge_cap': 0.3451807930490258, 'bull_strategy': 'mean_reversion', 'bull_bb_std_mult': 2.7185556079791287, 'bull_rsi_os': 22, 'bull_rsi_ob': 69, 'bull_adx_thresh': 27.839893081806125, 'bull_atr_min_pct': 0.01915401636678371, 'bull_atr_max_pct': 0.10907465852338519, 'bull_tp_mult': 2.390268013935868, 'bull_tsl_mult': 0.9715441124455316, 'bull_time_stop': 221, 'bull_use_sma': True, 'bull_use_ema': False, 'bull_use_atr': False, 'bull_use_adx': True, 'bull_use_spike': True, 'bull_rsi_required': False, 'bear_strategy': 'breakout', 'bear_bb_std_mult': 2.362564108588188, 'bear_rsi_os': 41, 'bear_rsi_ob': 89, 'bear_adx_thresh': 17.89561919726691, 'bear_atr_min_pct': 0.008008540389225657, 'bear_atr_max_pct': 0.0814381395780508, 'bear_tp_mult': 2.892269601448185, 'bear_tsl_mult': 0.010659694093785973, 'bear_time_stop': 257, 'bear_use_sma': False, 'bear_use_ema': False, 'bear_use_atr': False, 'bear_use_adx': False, 'bear_use_spike': True, 'bear_rsi_required': False, 'sideways_strategy': 'breakout', 'sideways_bb_std_mult': 3.3304486385145897, 'sideways_rsi_os': 21, 'sideways_rsi_ob': 85, 'sideways_adx_thresh': 12.71438734077325, 'sideways_atr_min_pct': 0.01237895112121525, 'sideways_atr_max_pct': 0.03727208745710582, 'sideways_tp_mult': 2.3199230670970765, 'sideways_tsl_mult': 0.5839252824629689, 'sideways_time_stop': 151, 'sideways_use_sma': False, 'sideways_use_ema': False, 'sideways_use_atr': True, 'sideways_use_adx': False, 'sideways_use_spike': False, 'sideways_rsi_required': True}.
[I 2025-08-29 21:05:45,473] Trial 770 finished with values: [-1000000000.0, 1000000000.0] and parameters: {'p_sma': 15, 'p_std': 34, 'p_atr': 15, 'p_adx': 8, 'rsi_period': 31, 'ema1': 23, 'ema2': 22, 'slip_atr_k': 0.00033125295746431257, 'slip_spread_k': 0.04843829911738247, 'spread_hl_frac': 0.020968709893432406, 'bb_std_mult': 0.8423627011306764, 'rsi_os': 5, 'rsi_ob': 78, 'vol_spike': 0.2931930681364458, 'adx_thresh': 8.180573754925938, 'atr_min_pct': 0.011612412956993475, 'atr_max_pct': 0.03695533577892318, 'tp_mult': 2.5230549817974186, 'tsl_mult': 0.7083443688047099, 'strategy': 'mean_reversion', 'time_stop': 205, 'use_sma': True, 'use_atr': False, 'use_adx': False, 'use_ema': False, 'use_spike': True, 'rsi_required': False, 'edge_k': 0.9488752332053486, 'edge_cap': 0.3185364773400006, 'bull_strategy': 'mean_reversion', 'bull_bb_std_mult': 2.667186256766889, 'bull_rsi_os': 21, 'bull_rsi_ob': 69, 'bull_adx_thresh': 27.89149398776843, 'bull_atr_min_pct': 0.018626171070149324, 'bull_atr_max_pct': 0.10968498935327305, 'bull_tp_mult': 2.382581786907586, 'bull_tsl_mult': 0.9594856810526649, 'bull_time_stop': 222, 'bull_use_sma': True, 'bull_use_ema': False, 'bull_use_atr': False, 'bull_use_adx': True, 'bull_use_spike': True, 'bull_rsi_required': False, 'bear_strategy': 'breakout', 'bear_bb_std_mult': 2.256031229055167, 'bear_rsi_os': 42, 'bear_rsi_ob': 88, 'bear_adx_thresh': 17.253287797261894, 'bear_atr_min_pct': 0.00725312412549361, 'bear_atr_max_pct': 0.07958409290628132, 'bear_tp_mult': 2.8801182117334236, 'bear_tsl_mult': 0.04267756147311764, 'bear_time_stop': 300, 'bear_use_sma': False, 'bear_use_ema': False, 'bear_use_atr': False, 'bear_use_adx': False, 'bear_use_spike': True, 'bear_rsi_required': False, 'sideways_strategy': 'breakout', 'sideways_bb_std_mult': 3.3112600628208306, 'sideways_rsi_os': 21, 'sideways_rsi_ob': 85, 'sideways_adx_thresh': 12.579236827943685, 'sideways_atr_min_pct': 0.013293762563950635, 'sideways_atr_max_pct': 0.03582500540776814, 'sideways_tp_mult': 2.387426780986784, 'sideways_tsl_mult': 0.5760918703109268, 'sideways_time_stop': 138, 'sideways_use_sma': False, 'sideways_use_ema': False, 'sideways_use_atr': True, 'sideways_use_adx': False, 'sideways_use_spike': False, 'sideways_rsi_required': True}.
[I 2025-08-29 21:05:45,671] Trial 771 finished with values: [-1000000000.0, 1000000000.0] and parameters: {'p_sma': 15, 'p_std': 34, 'p_atr': 15, 'p_adx': 8, 'rsi_period': 31, 'ema1': 23, 'ema2': 26, 'slip_atr_k': 0.0039288834170814226, 'slip_spread_k': 0.056374436214361424, 'spread_hl_frac': 0.020720171827893104, 'bb_std_mult': 0.942100936704039, 'rsi_os': 5, 'rsi_ob': 78, 'vol_spike': 0.29394310664617734, 'adx_thresh': 9.097129765678188, 'atr_min_pct': 0.011369749358427165, 'atr_max_pct': 0.03764045525726572, 'tp_mult': 2.6430030151309896, 'tsl_mult': 0.6539582791962724, 'strategy': 'mean_reversion', 'time_stop': 206, 'use_sma': True, 'use_atr': False, 'use_adx': False, 'use_ema': False, 'use_spike': True, 'rsi_required': False, 'edge_k': 0.9517198840886325, 'edge_cap': 0.3216772076240054, 'bull_strategy': 'mean_reversion', 'bull_bb_std_mult': 2.6498128207259835, 'bull_rsi_os': 21, 'bull_rsi_ob': 69, 'bull_adx_thresh': 28.99878332169995, 'bull_atr_min_pct': 0.01875278963510544, 'bull_atr_max_pct': 0.10516355681491923, 'bull_tp_mult': 2.3878209233751946, 'bull_tsl_mult': 0.9594627064060985, 'bull_time_stop': 210, 'bull_use_sma': True, 'bull_use_ema': False, 'bull_use_atr': False, 'bull_use_adx': True, 'bull_use_spike': True, 'bull_rsi_required': False, 'bear_strategy': 'breakout', 'bear_bb_std_mult': 2.2635022476262154, 'bear_rsi_os': 42, 'bear_rsi_ob': 88, 'bear_adx_thresh': 18.503332510863807, 'bear_atr_min_pct': 0.007265677499723039, 'bear_atr_max_pct': 0.07881168444930886, 'bear_tp_mult': 2.9474584466721327, 'bear_tsl_mult': 0.04273724074882495, 'bear_time_stop': 300, 'bear_use_sma': False, 'bear_use_ema': False, 'bear_use_atr': False, 'bear_use_adx': False, 'bear_use_spike': True, 'bear_rsi_required': False, 'sideways_strategy': 'breakout', 'sideways_bb_std_mult': 3.3562562885737623, 'sideways_rsi_os': 21, 'sideways_rsi_ob': 86, 'sideways_adx_thresh': 13.698785856799883, 'sideways_atr_min_pct': 0.01327302188497372, 'sideways_atr_max_pct': 0.035741880451109126, 'sideways_tp_mult': 2.393925031372443, 'sideways_tsl_mult': 0.6153288507313497, 'sideways_time_stop': 141, 'sideways_use_sma': False, 'sideways_use_ema': False, 'sideways_use_atr': True, 'sideways_use_adx': False, 'sideways_use_spike': False, 'sideways_rsi_required': True}.
[I 2025-08-29 21:05:45,944] Trial 768 finished with values: [-1000000000.0, 1000000000.0] and parameters: {'p_sma': 16, 'p_std': 33, 'p_atr': 16, 'p_adx': 9, 'rsi_period': 30, 'ema1': 23, 'ema2': 20, 'slip_atr_k': 0.00010862530191850419, 'slip_spread_k': 0.05377080203931005, 'spread_hl_frac': 0.021822806345497204, 'bb_std_mult': 0.9133974933397463, 'rsi_os': 5, 'rsi_ob': 77, 'vol_spike': 0.2939543176190969, 'adx_thresh': 8.23512471407025, 'atr_min_pct': 0.01160697044019822, 'atr_max_pct': 0.042188163256751364, 'tp_mult': 2.3875055732577044, 'tsl_mult': 0.7003773949134766, 'strategy': 'mean_reversion', 'time_stop': 205, 'use_sma': True, 'use_atr': False, 'use_adx': False, 'use_ema': False, 'use_spike': True, 'rsi_required': False, 'edge_k': 0.9306550352384131, 'edge_cap': 0.3185746349515658, 'bull_strategy': 'mean_reversion', 'bull_bb_std_mult': 2.680167440953669, 'bull_rsi_os': 22, 'bull_rsi_ob': 69, 'bull_adx_thresh': 27.686353413008977, 'bull_atr_min_pct': 0.019211710947553303, 'bull_atr_max_pct': 0.10690890475643842, 'bull_tp_mult': 2.4065515650650737, 'bull_tsl_mult': 0.9748450695641949, 'bull_time_stop': 221, 'bull_use_sma': True, 'bull_use_ema': False, 'bull_use_atr': False, 'bull_use_adx': True, 'bull_use_spike': True, 'bull_rsi_required': False, 'bear_strategy': 'breakout', 'bear_bb_std_mult': 2.277685691074996, 'bear_rsi_os': 41, 'bear_rsi_ob': 88, 'bear_adx_thresh': 17.59618821038624, 'bear_atr_min_pct': 0.008105690968236996, 'bear_atr_max_pct': 0.07904303412805941, 'bear_tp_mult': 2.9558801446744574, 'bear_tsl_mult': 0.03987246817715116, 'bear_time_stop': 269, 'bear_use_sma': False, 'bear_use_ema': False, 'bear_use_atr': False, 'bear_use_adx': False, 'bear_use_spike': True, 'bear_rsi_required': False, 'sideways_strategy': 'breakout', 'sideways_bb_std_mult': 3.420903690593374, 'sideways_rsi_os': 20, 'sideways_rsi_ob': 85, 'sideways_adx_thresh': 13.376273760342519, 'sideways_atr_min_pct': 0.012186650927502896, 'sideways_atr_max_pct': 0.040125423107791144, 'sideways_tp_mult': 2.303327415665654, 'sideways_tsl_mult': 0.5839514680145892, 'sideways_time_stop': 139, 'sideways_use_sma': False, 'sideways_use_ema': False, 'sideways_use_atr': True, 'sideways_use_adx': False, 'sideways_use_spike': False, 'sideways_rsi_required': True}.
[I 2025-08-29 21:05:46,096] Trial 769 finished with values: [-1000000000.0, 1000000000.0] and parameters: {'p_sma': 15, 'p_std': 34, 'p_atr': 15, 'p_adx': 9, 'rsi_period': 30, 'ema1': 23, 'ema2': 25, 'slip_atr_k': 0.008342966413383784, 'slip_spread_k': 0.08125722052363088, 'spread_hl_frac': 0.021381950549424534, 'bb_std_mult': 0.8212967066341107, 'rsi_os': 5, 'rsi_ob': 77, 'vol_spike': 0.29441059078562987, 'adx_thresh': 8.223323729013435, 'atr_min_pct': 0.011530085892947704, 'atr_max_pct': 0.03928854067395046, 'tp_mult': 2.4972025114780956, 'tsl_mult': 0.6954765967267234, 'strategy': 'mean_reversion', 'time_stop': 205, 'use_sma': True, 'use_atr': False, 'use_adx': False, 'use_ema': False, 'use_spike': True, 'rsi_required': False, 'edge_k': 0.9399758298758613, 'edge_cap': 0.3161663726836147, 'bull_strategy': 'mean_reversion', 'bull_bb_std_mult': 2.652184617317946, 'bull_rsi_os': 22, 'bull_rsi_ob': 69, 'bull_adx_thresh': 28.905254833756114, 'bull_atr_min_pct': 0.018799027783220217, 'bull_atr_max_pct': 0.10826011137839872, 'bull_tp_mult': 2.3762186064710633, 'bull_tsl_mult': 0.9750208589054585, 'bull_time_stop': 224, 'bull_use_sma': True, 'bull_use_ema': False, 'bull_use_atr': False, 'bull_use_adx': True, 'bull_use_spike': True, 'bull_rsi_required': False, 'bear_strategy': 'breakout', 'bear_bb_std_mult': 2.3686802217148757, 'bear_rsi_os': 42, 'bear_rsi_ob': 90, 'bear_adx_thresh': 17.411761130897684, 'bear_atr_min_pct': 0.007212070910053694, 'bear_atr_max_pct': 0.07921890045039405, 'bear_tp_mult': 2.9471119373901606, 'bear_tsl_mult': 0.04365600990156315, 'bear_time_stop': 246, 'bear_use_sma': False, 'bear_use_ema': False, 'bear_use_atr': False, 'bear_use_adx': False, 'bear_use_spike': True, 'bear_rsi_required': False, 'sideways_strategy': 'breakout', 'sideways_bb_std_mult': 3.3308284928423326, 'sideways_rsi_os': 21, 'sideways_rsi_ob': 85, 'sideways_adx_thresh': 13.676863637663539, 'sideways_atr_min_pct': 0.01330664426101214, 'sideways_atr_max_pct': 0.03609510903826903, 'sideways_tp_mult': 2.326728120861797, 'sideways_tsl_mult': 0.5876308700000367, 'sideways_time_stop': 140, 'sideways_use_sma': False, 'sideways_use_ema': False, 'sideways_use_atr': True, 'sideways_use_adx': False, 'sideways_use_spike': False, 'sideways_rsi_required': True}.
[I 2025-08-29 21:06:15,171] Trial 773 finished with values: [-1000000000.0, 1000000000.0] and parameters: {'p_sma': 15, 'p_std': 32, 'p_atr': 16, 'p_adx': 8, 'rsi_period': 29, 'ema1': 23, 'ema2': 19, 'slip_atr_k': 6.650172950296824e-05, 'slip_spread_k': 0.0858766010605429, 'spread_hl_frac': 0.0230820702767353, 'bb_std_mult': 0.903862385150676, 'rsi_os': 5, 'rsi_ob': 77, 'vol_spike': 0.29325469947291033, 'adx_thresh': 8.875351567035803, 'atr_min_pct': 0.012027143007150198, 'atr_max_pct': 0.04353889981758752, 'tp_mult': 2.5190026567911463, 'tsl_mult': 0.7255256907807398, 'strategy': 'mean_reversion', 'time_stop': 208, 'use_sma': True, 'use_atr': False, 'use_adx': False, 'use_ema': False, 'use_spike': True, 'rsi_required': False, 'edge_k': 1.001372297436998, 'edge_cap': 0.3008473380512927, 'bull_strategy': 'mean_reversion', 'bull_bb_std_mult': 2.7846170158199057, 'bull_rsi_os': 21, 'bull_rsi_ob': 68, 'bull_adx_thresh': 28.996487403260875, 'bull_atr_min_pct': 0.019473978536198776, 'bull_atr_max_pct': 0.10613852137144221, 'bull_tp_mult': 2.4198117458939272, 'bull_tsl_mult': 0.9516402717208289, 'bull_time_stop': 210, 'bull_use_sma': True, 'bull_use_ema': False, 'bull_use_atr': False, 'bull_use_adx': True, 'bull_use_spike': True, 'bull_rsi_required': False, 'bear_strategy': 'breakout', 'bear_bb_std_mult': 2.286223808590775, 'bear_rsi_os': 40, 'bear_rsi_ob': 90, 'bear_adx_thresh': 18.635743297355297, 'bear_atr_min_pct': 0.007067917927529834, 'bear_atr_max_pct': 0.0852322109243665, 'bear_tp_mult': 2.9568195567851974, 'bear_tsl_mult': 0.044434106339933395, 'bear_time_stop': 246, 'bear_use_sma': False, 'bear_use_ema': False, 'bear_use_atr': False, 'bear_use_adx': False, 'bear_use_spike': True, 'bear_rsi_required': False, 'sideways_strategy': 'breakout', 'sideways_bb_std_mult': 3.4264326518656465, 'sideways_rsi_os': 20, 'sideways_rsi_ob': 84, 'sideways_adx_thresh': 13.702248293931039, 'sideways_atr_min_pct': 0.013082153751864558, 'sideways_atr_max_pct': 0.04169332752886572, 'sideways_tp_mult': 2.3620444282313486, 'sideways_tsl_mult': 0.6078894131472053, 'sideways_time_stop': 143, 'sideways_use_sma': False, 'sideways_use_ema': False, 'sideways_use_atr': True, 'sideways_use_adx': False, 'sideways_use_spike': False, 'sideways_rsi_required': True}.
[I 2025-08-29 21:06:15,206] Trial 774 finished with values: [-1000000000.0, 1000000000.0] and parameters: {'p_sma': 15, 'p_std': 32, 'p_atr': 16, 'p_adx': 8, 'rsi_period': 29, 'ema1': 22, 'ema2': 24, 'slip_atr_k': 8.593079072675015e-05, 'slip_spread_k': 0.08797144185609643, 'spread_hl_frac': 0.0201745511013561, 'bb_std_mult': 0.8083808717918359, 'rsi_os': 6, 'rsi_ob': 77, 'vol_spike': 0.2931595858883907, 'adx_thresh': 9.034293581419707, 'atr_min_pct': 0.010020284310076243, 'atr_max_pct': 0.03923549068012405, 'tp_mult': 2.5178190867214068, 'tsl_mult': 0.7708218629616514, 'strategy': 'mean_reversion', 'time_stop': 209, 'use_sma': True, 'use_atr': False, 'use_adx': False, 'use_ema': False, 'use_spike': True, 'rsi_required': False, 'edge_k': 0.8738033849904782, 'edge_cap': 0.29819861607637066, 'bull_strategy': 'mean_reversion', 'bull_bb_std_mult': 2.768820576468453, 'bull_rsi_os': 21, 'bull_rsi_ob': 68, 'bull_adx_thresh': 28.745981032136108, 'bull_atr_min_pct': 0.019812936760946278, 'bull_atr_max_pct': 0.10428431856976098, 'bull_tp_mult': 2.4476519772036194, 'bull_tsl_mult': 0.968565625082143, 'bull_time_stop': 210, 'bull_use_sma': True, 'bull_use_ema': False, 'bull_use_atr': False, 'bull_use_adx': True, 'bull_use_spike': True, 'bull_rsi_required': False, 'bear_strategy': 'breakout', 'bear_bb_std_mult': 2.3618441925395235, 'bear_rsi_os': 40, 'bear_rsi_ob': 90, 'bear_adx_thresh': 18.433712450885537, 'bear_atr_min_pct': 0.007003988580845329, 'bear_atr_max_pct': 0.07756681603968624, 'bear_tp_mult': 2.8761493116065924, 'bear_tsl_mult': 0.05801533596490341, 'bear_time_stop': 249, 'bear_use_sma': False, 'bear_use_ema': False, 'bear_use_atr': False, 'bear_use_adx': False, 'bear_use_spike': True, 'bear_rsi_required': False, 'sideways_strategy': 'breakout', 'sideways_bb_std_mult': 3.4461879943399536, 'sideways_rsi_os': 22, 'sideways_rsi_ob': 84, 'sideways_adx_thresh': 13.942982987998295, 'sideways_atr_min_pct': 0.013157218944708598, 'sideways_atr_max_pct': 0.03747080976782567, 'sideways_tp_mult': 2.374702735402131, 'sideways_tsl_mult': 0.6077609808213278, 'sideways_time_stop': 141, 'sideways_use_sma': False, 'sideways_use_ema': False, 'sideways_use_atr': True, 'sideways_use_adx': False, 'sideways_use_spike': False, 'sideways_rsi_required': True}.
