[I 2025-08-29 19:46:22,307] Trial 79 finished with values: [-0.00915588429460279, 0.009108492420379134] and parameters: {'p_sma': 8, 'p_std': 5, 'p_atr': 14, 'p_adx': 23, 'rsi_period': 16, 'ema1': 9, 'ema2': 33, 'slip_atr_k': 0.014170383490829604, 'slip_spread_k': 0.22427468699470854, 'spread_hl_frac': 0.047344766398229376, 'bb_std_mult': 1.930305551939646, 'rsi_os': 30, 'rsi_ob': 84, 'vol_spike': 0.14038755351923615, 'adx_thresh': 16.181168889663883, 'atr_min_pct': 0.0030227267231452636, 'atr_max_pct': 0.07114502484482065, 'tp_mult': 2.5566171400967805, 'tsl_mult': 0.5364500555691357, 'strategy': 'breakout', 'time_stop': 293, 'use_sma': False, 'use_atr': True, 'use_adx': True, 'use_ema': True, 'use_spike': False, 'rsi_required': False, 'edge_k': 0.08982423265534034, 'edge_cap': 0.21457615787410061, 'bull_strategy': 'mean_reversion', 'bull_bb_std_mult': 1.0827948734261073, 'bull_rsi_os': 18, 'bull_rsi_ob': 47, 'bull_adx_thresh': 9.06605506188375, 'bull_atr_min_pct': 0.025909695565074005, 'bull_atr_max_pct': 0.10079093530099428, 'bull_tp_mult': 2.6331487038152654, 'bull_tsl_mult': 0.3607154147974254, 'bull_time_stop': 164, 'bull_use_sma': True, 'bull_use_ema': False, 'bull_use_atr': False, 'bull_use_adx': False, 'bull_use_spike': False, 'bull_rsi_required': False, 'bear_strategy': 'mean_reversion', 'bear_bb_std_mult': 2.1210911267628725, 'bear_rsi_os': 13, 'bear_rsi_ob': 64, 'bear_adx_thresh': 18.772545900284804, 'bear_atr_min_pct': 0.002386936569088044, 'bear_atr_max_pct': 0.03187281330995883, 'bear_tp_mult': 2.419095103662561, 'bear_tsl_mult': 0.6898646829456232, 'bear_time_stop': 172, 'bear_use_sma': False, 'bear_use_ema': True, 'bear_use_atr': True, 'bear_use_adx': True, 'bear_use_spike': True, 'bear_rsi_required': True, 'sideways_strategy': 'mean_reversion', 'sideways_bb_std_mult': 1.2073650140766041, 'sideways_rsi_os': 48, 'sideways_rsi_ob': 70, 'sideways_adx_thresh': 21.88984292961896, 'sideways_atr_min_pct': 0.01470890689727318, 'sideways_atr_max_pct': 0.02906917298079182, 'sideways_tp_mult': 1.9765982981807988, 'sideways_tsl_mult': 0.262837192661626, 'sideways_time_stop': 270, 'sideways_use_sma': False, 'sideways_use_ema': False, 'sideways_use_atr': True, 'sideways_use_adx': True, 'sideways_use_spike': False, 'sideways_rsi_required': False}.
[I 2025-08-29 19:46:52,417] Trial 82 finished with values: [-1000000000.0, 1000000000.0] and parameters: {'p_sma': 41, 'p_std': 56, 'p_atr': 27, 'p_adx': 22, 'rsi_period': 46, 'ema1': 12, 'ema2': 51, 'slip_atr_k': 0.054713541370013385, 'slip_spread_k': 0.23616251733374138, 'spread_hl_frac': 0.022150020867357154, 'bb_std_mult': 1.1603796998071465, 'rsi_os': 30, 'rsi_ob': 85, 'vol_spike': 0.14099747278807426, 'adx_thresh': 15.778434004160879, 'atr_min_pct': 0.006172777347861574, 'atr_max_pct': 0.0595172986594372, 'tp_mult': 1.6672923763036505, 'tsl_mult': 0.48352222985159576, 'strategy': 'breakout', 'time_stop': 228, 'use_sma': False, 'use_atr': True, 'use_adx': False, 'use_ema': True, 'use_spike': False, 'rsi_required': False, 'edge_k': 0.12734276407787204, 'edge_cap': 0.5162801107734106, 'bull_strategy': 'breakout', 'bull_bb_std_mult': 1.8411271659199966, 'bull_rsi_os': 37, 'bull_rsi_ob': 86, 'bull_adx_thresh': 27.33384431109151, 'bull_atr_min_pct': 0.026277665240950165, 'bull_atr_max_pct': 0.05005603479887101, 'bull_tp_mult': 1.3511120643885928, 'bull_tsl_mult': 0.41599227883642453, 'bull_time_stop': 241, 'bull_use_sma': True, 'bull_use_ema': True, 'bull_use_atr': True, 'bull_use_adx': False, 'bull_use_spike': True, 'bull_rsi_required': True, 'bear_strategy': 'mean_reversion', 'bear_bb_std_mult': 1.1623359453968725, 'bear_rsi_os': 13, 'bear_rsi_ob': 63, 'bear_adx_thresh': 7.150053131321131, 'bear_atr_min_pct': 0.006311957744086197, 'bear_atr_max_pct': 0.11874860566162576, 'bear_tp_mult': 1.7071877221297325, 'bear_tsl_mult': 0.6810620077550397, 'bear_time_stop': 139, 'bear_use_sma': False, 'bear_use_ema': True, 'bear_use_atr': True, 'bear_use_adx': True, 'bear_use_spike': True, 'bear_rsi_required': True, 'sideways_strategy': 'breakout', 'sideways_bb_std_mult': 1.463102934696026, 'sideways_rsi_os': 55, 'sideways_rsi_ob': 58, 'sideways_adx_thresh': 21.746326474167013, 'sideways_atr_min_pct': 0.007217394192610631, 'sideways_atr_max_pct': 0.14381227808459068, 'sideways_tp_mult': 2.010471262239768, 'sideways_tsl_mult': 0.25635680040067566, 'sideways_time_stop': 103, 'sideways_use_sma': True, 'sideways_use_ema': False, 'sideways_use_atr': False, 'sideways_use_adx': True, 'sideways_use_spike': False, 'sideways_rsi_required': False}.
[I 2025-08-29 19:46:52,896] Trial 84 finished with values: [-1000000000.0, 1000000000.0] and parameters: {'p_sma': 43, 'p_std': 33, 'p_atr': 12, 'p_adx': 22, 'rsi_period': 35, 'ema1': 27, 'ema2': 55, 'slip_atr_k': 0.055156804205983775, 'slip_spread_k': 0.8664080088071606, 'spread_hl_frac': 0.047272515454223944, 'bb_std_mult': 1.1942280229010007, 'rsi_os': 21, 'rsi_ob': 77, 'vol_spike': 0.08830185481305122, 'adx_thresh': 18.005339033928433, 'atr_min_pct': 0.006494222958543209, 'atr_max_pct': 0.0599747921264152, 'tp_mult': 2.355695838028119, 'tsl_mult': 0.2884926919956746, 'strategy': 'breakout', 'time_stop': 154, 'use_sma': False, 'use_atr': False, 'use_adx': False, 'use_ema': False, 'use_spike': False, 'rsi_required': True, 'edge_k': 1.9506778273848508, 'edge_cap': 0.40299357341436537, 'bull_strategy': 'breakout', 'bull_bb_std_mult': 1.3467474727843103, 'bull_rsi_os': 41, 'bull_rsi_ob': 91, 'bull_adx_thresh': 19.442149019417396, 'bull_atr_min_pct': 0.005395182579673412, 'bull_atr_max_pct': 0.04654838639438599, 'bull_tp_mult': 2.8712467779376496, 'bull_tsl_mult': 0.4761375418164397, 'bull_time_stop': 244, 'bull_use_sma': True, 'bull_use_ema': False, 'bull_use_atr': False, 'bull_use_adx': True, 'bull_use_spike': True, 'bull_rsi_required': True, 'bear_strategy': 'breakout', 'bear_bb_std_mult': 1.8755188637910052, 'bear_rsi_os': 7, 'bear_rsi_ob': 70, 'bear_adx_thresh': 5.409826229841032, 'bear_atr_min_pct': 0.0038990235468585174, 'bear_atr_max_pct': 0.11811207566278015, 'bear_tp_mult': 2.772883773049646, 'bear_tsl_mult': 0.5307957256201089, 'bear_time_stop': 126, 'bear_use_sma': True, 'bear_use_ema': True, 'bear_use_atr': True, 'bear_use_adx': False, 'bear_use_spike': False, 'bear_rsi_required': True, 'sideways_strategy': 'mean_reversion', 'sideways_bb_std_mult': 2.6615584960558447, 'sideways_rsi_os': 33, 'sideways_rsi_ob': 78, 'sideways_adx_thresh': 12.570610617366505, 'sideways_atr_min_pct': 0.018257928689480174, 'sideways_atr_max_pct': 0.125984226275747, 'sideways_tp_mult': 2.7223993982362904, 'sideways_tsl_mult': 0.7565389054893972, 'sideways_time_stop': 96, 'sideways_use_sma': True, 'sideways_use_ema': True, 'sideways_use_atr': False, 'sideways_use_adx': False, 'sideways_use_spike': False, 'sideways_rsi_required': False}.
[I 2025-08-29 19:46:53,258] Trial 83 finished with values: [-1000000000.0, 1000000000.0] and parameters: {'p_sma': 41, 'p_std': 56, 'p_atr': 12, 'p_adx': 12, 'rsi_period': 70, 'ema1': 8, 'ema2': 51, 'slip_atr_k': 0.05500650096465676, 'slip_spread_k': 0.8659492190601175, 'spread_hl_frac': 0.021863554570340112, 'bb_std_mult': 1.3448964777394394, 'rsi_os': 9, 'rsi_ob': 86, 'vol_spike': 0.06834041911679976, 'adx_thresh': 11.81854278989351, 'atr_min_pct': 0.0018269670578465128, 'atr_max_pct': 0.10145328607262341, 'tp_mult': 2.1989878384936627, 'tsl_mult': 0.7261239664294032, 'strategy': 'breakout', 'time_stop': 160, 'use_sma': False, 'use_atr': False, 'use_adx': False, 'use_ema': False, 'use_spike': False, 'rsi_required': False, 'edge_k': 1.982205591343468, 'edge_cap': 0.395982327389781, 'bull_strategy': 'breakout', 'bull_bb_std_mult': 1.4220238258789266, 'bull_rsi_os': 37, 'bull_rsi_ob': 85, 'bull_adx_thresh': 27.05673015525975, 'bull_atr_min_pct': 0.018834266944048255, 'bull_atr_max_pct': 0.04806332419795367, 'bull_tp_mult': 2.8717269866347377, 'bull_tsl_mult': 0.4227896962071297, 'bull_time_stop': 241, 'bull_use_sma': True, 'bull_use_ema': False, 'bull_use_atr': True, 'bull_use_adx': True, 'bull_use_spike': True, 'bull_rsi_required': True, 'bear_strategy': 'mean_reversion', 'bear_bb_std_mult': 3.185607071012692, 'bear_rsi_os': 13, 'bear_rsi_ob': 69, 'bear_adx_thresh': 17.961263351129432, 'bear_atr_min_pct': 0.004700781178750087, 'bear_atr_max_pct': 0.0347635135473758, 'bear_tp_mult': 2.9423968520850763, 'bear_tsl_mult': 0.5346970429077191, 'bear_time_stop': 137, 'bear_use_sma': True, 'bear_use_ema': True, 'bear_use_atr': True, 'bear_use_adx': False, 'bear_use_spike': False, 'bear_rsi_required': True, 'sideways_strategy': 'breakout', 'sideways_bb_std_mult': 1.4540840641539579, 'sideways_rsi_os': 33, 'sideways_rsi_ob': 70, 'sideways_adx_thresh': 25.07474089351701, 'sideways_atr_min_pct': 0.02264101071994028, 'sideways_atr_max_pct': 0.04094298069939449, 'sideways_tp_mult': 2.6080666856876453, 'sideways_tsl_mult': 0.25185308680894286, 'sideways_time_stop': 93, 'sideways_use_sma': True, 'sideways_use_ema': True, 'sideways_use_atr': False, 'sideways_use_adx': True, 'sideways_use_spike': True, 'sideways_rsi_required': False}.
[I 2025-08-29 19:46:53,515] Trial 85 finished with values: [-1000000000.0, 1000000000.0] and parameters: {'p_sma': 43, 'p_std': 29, 'p_atr': 12, 'p_adx': 22, 'rsi_period': 16, 'ema1': 30, 'ema2': 12, 'slip_atr_k': 0.05615756078159645, 'slip_spread_k': 0.7279931157653974, 'spread_hl_frac': 0.0475107698879678, 'bb_std_mult': 1.181934266957888, 'rsi_os': 9, 'rsi_ob': 86, 'vol_spike': 0.16538020203324197, 'adx_thresh': 11.997782356224826, 'atr_min_pct': 0.006107075630217786, 'atr_max_pct': 0.023671208200301164, 'tp_mult': 2.448923723364181, 'tsl_mult': 0.7440162445982461, 'strategy': 'breakout', 'time_stop': 203, 'use_sma': False, 'use_atr': True, 'use_adx': False, 'use_ema': False, 'use_spike': True, 'rsi_required': True, 'edge_k': 1.9576147519622786, 'edge_cap': 0.5251884661362344, 'bull_strategy': 'breakout', 'bull_bb_std_mult': 1.6233513480476547, 'bull_rsi_os': 46, 'bull_rsi_ob': 57, 'bull_adx_thresh': 27.228469369521, 'bull_atr_min_pct': 0.012946107980722939, 'bull_atr_max_pct': 0.037295097126134394, 'bull_tp_mult': 2.8677172743483217, 'bull_tsl_mult': 0.4839601512703616, 'bull_time_stop': 272, 'bull_use_sma': True, 'bull_use_ema': True, 'bull_use_atr': False, 'bull_use_adx': True, 'bull_use_spike': True, 'bull_rsi_required': True, 'bear_strategy': 'breakout', 'bear_bb_std_mult': 1.8700177912910028, 'bear_rsi_os': 13, 'bear_rsi_ob': 70, 'bear_adx_thresh': 5.245461997853859, 'bear_atr_min_pct': 0.00500936340017945, 'bear_atr_max_pct': 0.11748781590360906, 'bear_tp_mult': 2.9468553428087114, 'bear_tsl_mult': 0.5300172547560499, 'bear_time_stop': 190, 'bear_use_sma': True, 'bear_use_ema': False, 'bear_use_atr': True, 'bear_use_adx': False, 'bear_use_spike': False, 'bear_rsi_required': False, 'sideways_strategy': 'mean_reversion', 'sideways_bb_std_mult': 1.6612785342298118, 'sideways_rsi_os': 35, 'sideways_rsi_ob': 77, 'sideways_adx_thresh': 24.93448146216513, 'sideways_atr_min_pct': 0.012581705417072118, 'sideways_atr_max_pct': 0.14181566180865957, 'sideways_tp_mult': 2.4777504194754187, 'sideways_tsl_mult': 0.16402231315193988, 'sideways_time_stop': 95, 'sideways_use_sma': True, 'sideways_use_ema': True, 'sideways_use_atr': True, 'sideways_use_adx': False, 'sideways_use_spike': True, 'sideways_rsi_required': False}.
[I 2025-08-29 19:47:24,389] Trial 87 finished with values: [-1000000000.0, 1000000000.0] and parameters: {'p_sma': 32, 'p_std': 42, 'p_atr': 14, 'p_adx': 11, 'rsi_period': 16, 'ema1': 30, 'ema2': 37, 'slip_atr_k': 0.1770472070461884, 'slip_spread_k': 0.45537327267744954, 'spread_hl_frac': 0.04160473383714486, 'bb_std_mult': 1.3240914378569226, 'rsi_os': 26, 'rsi_ob': 94, 'vol_spike': 0.1509749815449133, 'adx_thresh': 12.354601607865288, 'atr_min_pct': 0.019866417839949965, 'atr_max_pct': 0.08297263077888793, 'tp_mult': 2.0529666713221904, 'tsl_mult': 0.7527197209775569, 'strategy': 'breakout', 'time_stop': 160, 'use_sma': True, 'use_atr': True, 'use_adx': True, 'use_ema': False, 'use_spike': True, 'rsi_required': True, 'edge_k': 1.9507383197592323, 'edge_cap': 0.32638252105956045, 'bull_strategy': 'mean_reversion', 'bull_bb_std_mult': 2.2156132783843656, 'bull_rsi_os': 47, 'bull_rsi_ob': 73, 'bull_adx_thresh': 30.041926542606358, 'bull_atr_min_pct': 0.012661659009180938, 'bull_atr_max_pct': 0.09194851895705727, 'bull_tp_mult': 2.171273853687186, 'bull_tsl_mult': 0.5822284646404206, 'bull_time_stop': 166, 'bull_use_sma': False, 'bull_use_ema': True, 'bull_use_atr': False, 'bull_use_adx': True, 'bull_use_spike': True, 'bull_rsi_required': False, 'bear_strategy': 'breakout', 'bear_bb_std_mult': 1.5025668946152557, 'bear_rsi_os': 15, 'bear_rsi_ob': 80, 'bear_adx_thresh': 16.772011042515302, 'bear_atr_min_pct': 0.004874262126202542, 'bear_atr_max_pct': 0.1060682471408533, 'bear_tp_mult': 2.18737082072825, 'bear_tsl_mult': 0.6421768974987697, 'bear_time_stop': 192, 'bear_use_sma': True, 'bear_use_ema': False, 'bear_use_atr': False, 'bear_use_adx': False, 'bear_use_spike': False, 'bear_rsi_required': False, 'sideways_strategy': 'mean_reversion', 'sideways_bb_std_mult': 1.6255186174373588, 'sideways_rsi_os': 13, 'sideways_rsi_ob': 73, 'sideways_adx_thresh': 24.798543511106498, 'sideways_atr_min_pct': 0.02523858005217928, 'sideways_atr_max_pct': 0.036782555711468996, 'sideways_tp_mult': 2.603251027297127, 'sideways_tsl_mult': 0.8670313188474379, 'sideways_time_stop': 60, 'sideways_use_sma': True, 'sideways_use_ema': True, 'sideways_use_atr': True, 'sideways_use_adx': False, 'sideways_use_spike': True, 'sideways_rsi_required': True}.
[I 2025-08-29 19:47:24,552] Trial 89 finished with values: [-1000000000.0, 1000000000.0] and parameters: {'p_sma': 28, 'p_std': 42, 'p_atr': 14, 'p_adx': 23, 'rsi_period': 54, 'ema1': 10, 'ema2': 37, 'slip_atr_k': 0.18121717891997013, 'slip_spread_k': 0.49924873595804564, 'spread_hl_frac': 0.04551969081585299, 'bb_std_mult': 0.9954890677205543, 'rsi_os': 26, 'rsi_ob': 93, 'vol_spike': 0.2608605002123972, 'adx_thresh': 17.314550699834868, 'atr_min_pct': 0.0024661154287802744, 'atr_max_pct': 0.09496075186955688, 'tp_mult': 2.0578938668078868, 'tsl_mult': 0.4385347346548089, 'strategy': 'mean_reversion', 'time_stop': 25, 'use_sma': True, 'use_atr': True, 'use_adx': True, 'use_ema': False, 'use_spike': True, 'rsi_required': True, 'edge_k': 1.826546321323014, 'edge_cap': 0.346036059233695, 'bull_strategy': 'mean_reversion', 'bull_bb_std_mult': 2.184999832445073, 'bull_rsi_os': 23, 'bull_rsi_ob': 75, 'bull_adx_thresh': 30.84424205694541, 'bull_atr_min_pct': 0.015956522946942678, 'bull_atr_max_pct': 0.057248916214060135, 'bull_tp_mult': 2.1784722044127633, 'bull_tsl_mult': 0.594348282219773, 'bull_time_stop': 196, 'bull_use_sma': False, 'bull_use_ema': True, 'bull_use_atr': False, 'bull_use_adx': True, 'bull_use_spike': True, 'bull_rsi_required': False, 'bear_strategy': 'breakout', 'bear_bb_std_mult': 2.5025298008529324, 'bear_rsi_os': 15, 'bear_rsi_ob': 67, 'bear_adx_thresh': 29.307979766835487, 'bear_atr_min_pct': 0.013964284149378822, 'bear_atr_max_pct': 0.1277152302849587, 'bear_tp_mult': 2.1487499730909807, 'bear_tsl_mult': 0.46027950279424623, 'bear_time_stop': 175, 'bear_use_sma': True, 'bear_use_ema': False, 'bear_use_atr': False, 'bear_use_adx': False, 'bear_use_spike': False, 'bear_rsi_required': False, 'sideways_strategy': 'mean_reversion', 'sideways_bb_std_mult': 3.476667891891409, 'sideways_rsi_os': 21, 'sideways_rsi_ob': 95, 'sideways_adx_thresh': 26.80098655481545, 'sideways_atr_min_pct': 0.026613060695162092, 'sideways_atr_max_pct': 0.11710820453804273, 'sideways_tp_mult': 1.4800310007717141, 'sideways_tsl_mult': 0.8610401606795521, 'sideways_time_stop': 56, 'sideways_use_sma': True, 'sideways_use_ema': True, 'sideways_use_atr': True, 'sideways_use_adx': False, 'sideways_use_spike': False, 'sideways_rsi_required': True}.
[I 2025-08-29 19:47:24,774] Trial 86 finished with values: [-1000000000.0, 1000000000.0] and parameters: {'p_sma': 48, 'p_std': 42, 'p_atr': 12, 'p_adx': 12, 'rsi_period': 81, 'ema1': 10, 'ema2': 54, 'slip_atr_k': 0.17615797524030807, 'slip_spread_k': 0.833717914933738, 'spread_hl_frac': 0.04709724938822967, 'bb_std_mult': 1.1570172446554503, 'rsi_os': 21, 'rsi_ob': 48, 'vol_spike': 0.14970687452211906, 'adx_thresh': 11.859683839090447, 'atr_min_pct': 0.0023267839766182765, 'atr_max_pct': 0.0958131400062997, 'tp_mult': 1.0150882644670605, 'tsl_mult': 0.043053297384697986, 'strategy': 'breakout', 'time_stop': 81, 'use_sma': True, 'use_atr': True, 'use_adx': True, 'use_ema': False, 'use_spike': True, 'rsi_required': True, 'edge_k': 1.9889612085268218, 'edge_cap': 0.35542040162778366, 'bull_strategy': 'breakout', 'bull_bb_std_mult': 1.382271145353616, 'bull_rsi_os': 47, 'bull_rsi_ob': 91, 'bull_adx_thresh': 13.429003206326055, 'bull_atr_min_pct': 0.013822272562677295, 'bull_atr_max_pct': 0.03848278841922628, 'bull_tp_mult': 2.852504570333935, 'bull_tsl_mult': 0.9972465427311048, 'bull_time_stop': 281, 'bull_use_sma': True, 'bull_use_ema': True, 'bull_use_atr': False, 'bull_use_adx': True, 'bull_use_spike': True, 'bull_rsi_required': False, 'bear_strategy': 'breakout', 'bear_bb_std_mult': 1.5334391485909251, 'bear_rsi_os': 15, 'bear_rsi_ob': 70, 'bear_adx_thresh': 19.094388662614353, 'bear_atr_min_pct': 0.004023229910265649, 'bear_atr_max_pct': 0.050334828705852805, 'bear_tp_mult': 2.9643468010313208, 'bear_tsl_mult': 0.6451512255514202, 'bear_time_stop': 174, 'bear_use_sma': True, 'bear_use_ema': False, 'bear_use_atr': True, 'bear_use_adx': False, 'bear_use_spike': False, 'bear_rsi_required': False, 'sideways_strategy': 'mean_reversion', 'sideways_bb_std_mult': 1.6533810801126017, 'sideways_rsi_os': 12, 'sideways_rsi_ob': 77, 'sideways_adx_thresh': 11.313886608230876, 'sideways_atr_min_pct': 0.02484448371070621, 'sideways_atr_max_pct': 0.040881392012132436, 'sideways_tp_mult': 2.467656467469993, 'sideways_tsl_mult': 0.19923820510086723, 'sideways_time_stop': 52, 'sideways_use_sma': True, 'sideways_use_ema': True, 'sideways_use_atr': True, 'sideways_use_adx': False, 'sideways_use_spike': True, 'sideways_rsi_required': False}.
[I 2025-08-29 19:47:24,948] Trial 88 finished with values: [-1000000000.0, 1000000000.0] and parameters: {'p_sma': 31, 'p_std': 52, 'p_atr': 14, 'p_adx': 19, 'rsi_period': 16, 'ema1': 30, 'ema2': 47, 'slip_atr_k': 0.03405128696388979, 'slip_spread_k': 0.7256297856538391, 'spread_hl_frac': 0.04548615707047136, 'bb_std_mult': 0.8666964436872822, 'rsi_os': 26, 'rsi_ob': 62, 'vol_spike': 0.0006975636216172698, 'adx_thresh': 8.212710386262925, 'atr_min_pct': 0.029869303025313133, 'atr_max_pct': 0.09395710419034606, 'tp_mult': 1.7609993220422098, 'tsl_mult': 0.04028242806669746, 'strategy': 'mean_reversion', 'time_stop': 203, 'use_sma': True, 'use_atr': True, 'use_adx': True, 'use_ema': False, 'use_spike': True, 'rsi_required': True, 'edge_k': 1.819284091776057, 'edge_cap': 0.3558120169271182, 'bull_strategy': 'mean_reversion', 'bull_bb_std_mult': 2.2306517035418403, 'bull_rsi_os': 22, 'bull_rsi_ob': 74, 'bull_adx_thresh': 29.833979010994014, 'bull_atr_min_pct': 0.012343951574108355, 'bull_atr_max_pct': 0.040330477707490965, 'bull_tp_mult': 1.1995638720287911, 'bull_tsl_mult': 0.6961448157583059, 'bull_time_stop': 271, 'bull_use_sma': False, 'bull_use_ema': True, 'bull_use_atr': False, 'bull_use_adx': True, 'bull_use_spike': True, 'bull_rsi_required': False, 'bear_strategy': 'breakout', 'bear_bb_std_mult': 2.5026365460773827, 'bear_rsi_os': 17, 'bear_rsi_ob': 84, 'bear_adx_thresh': 26.309581813701904, 'bear_atr_min_pct': 0.0252997760517486, 'bear_atr_max_pct': 0.105920861722157, 'bear_tp_mult': 2.0212778500194424, 'bear_tsl_mult': 0.4665735473472175, 'bear_time_stop': 174, 'bear_use_sma': True, 'bear_use_ema': False, 'bear_use_atr': False, 'bear_use_adx': False, 'bear_use_spike': False, 'bear_rsi_required': False, 'sideways_strategy': 'mean_reversion', 'sideways_bb_std_mult': 1.6669687567379683, 'sideways_rsi_os': 21, 'sideways_rsi_ob': 77, 'sideways_adx_thresh': 26.793756300288507, 'sideways_atr_min_pct': 0.02486051635210531, 'sideways_atr_max_pct': 0.1409126563663929, 'sideways_tp_mult': 2.4802191667566142, 'sideways_tsl_mult': 0.846344594523709, 'sideways_time_stop': 58, 'sideways_use_sma': True, 'sideways_use_ema': True, 'sideways_use_atr': True, 'sideways_use_adx': False, 'sideways_use_spike': True, 'sideways_rsi_required': True}.
