[I 2025-08-29 20:20:53,298] Trial 370 finished with values: [-1000000000.0, 1000000000.0] and parameters: {'p_sma': 20, 'p_std': 57, 'p_atr': 27, 'p_adx': 12, 'rsi_period': 39, 'ema1': 28, 'ema2': 45, 'slip_atr_k': 0.004752613743996846, 'slip_spread_k': 0.5908983802477031, 'spread_hl_frac': 0.049904612053499844, 'bb_std_mult': 1.8925292624405767, 'rsi_os': 9, 'rsi_ob': 86, 'vol_spike': 0.18000791887616344, 'adx_thresh': 13.940412786372722, 'atr_min_pct': 0.021532118616992908, 'atr_max_pct': 0.02073947891922469, 'tp_mult': 1.2998118579028664, 'tsl_mult': 0.9025699189170913, 'strategy': 'breakout', 'time_stop': 165, 'use_sma': True, 'use_atr': False, 'use_adx': False, 'use_ema': True, 'use_spike': False, 'rsi_required': False, 'edge_k': 0.9005285777572328, 'edge_cap': 0.7314252699004469, 'bull_strategy': 'mean_reversion', 'bull_bb_std_mult': 2.972738465146683, 'bull_rsi_os': 9, 'bull_rsi_ob': 71, 'bull_adx_thresh': 14.933361535138031, 'bull_atr_min_pct': 0.01706684137359298, 'bull_atr_max_pct': 0.09038859473028149, 'bull_tp_mult': 2.7781728740020046, 'bull_tsl_mult': 0.9061199483989633, 'bull_time_stop': 37, 'bull_use_sma': True, 'bull_use_ema': False, 'bull_use_atr': True, 'bull_use_adx': False, 'bull_use_spike': True, 'bull_rsi_required': False, 'bear_strategy': 'breakout', 'bear_bb_std_mult': 2.7722392058065104, 'bear_rsi_os': 39, 'bear_rsi_ob': 88, 'bear_adx_thresh': 20.68593185613085, 'bear_atr_min_pct': 0.0005014449163186219, 'bear_atr_max_pct': 0.06663235436836126, 'bear_tp_mult': 2.8565548572437436, 'bear_tsl_mult': 0.983473063776797, 'bear_time_stop': 64, 'bear_use_sma': False, 'bear_use_ema': True, 'bear_use_atr': False, 'bear_use_adx': True, 'bear_use_spike': True, 'bear_rsi_required': True, 'sideways_strategy': 'breakout', 'sideways_bb_std_mult': 2.431305245723512, 'sideways_rsi_os': 49, 'sideways_rsi_ob': 77, 'sideways_adx_thresh': 32.11669358796779, 'sideways_atr_min_pct': 0.005083048158729151, 'sideways_atr_max_pct': 0.026028480768600756, 'sideways_tp_mult': 1.0169581933134701, 'sideways_tsl_mult': 0.7303199629165379, 'sideways_time_stop': 193, 'sideways_use_sma': False, 'sideways_use_ema': False, 'sideways_use_atr': False, 'sideways_use_adx': False, 'sideways_use_spike': False, 'sideways_rsi_required': False}.
[I 2025-08-29 20:21:22,279] Trial 369 finished with values: [-1000000000.0, 1000000000.0] and parameters: {'p_sma': 20, 'p_std': 58, 'p_atr': 26, 'p_adx': 12, 'rsi_period': 40, 'ema1': 27, 'ema2': 57, 'slip_atr_k': 0.0005687580246158567, 'slip_spread_k': 0.12463177685552526, 'spread_hl_frac': 0.04988880992638784, 'bb_std_mult': 1.6729226471961394, 'rsi_os': 9, 'rsi_ob': 85, 'vol_spike': 0.02980716461599693, 'adx_thresh': 12.183229756352274, 'atr_min_pct': 0.020617792448793564, 'atr_max_pct': 0.0276413156664228, 'tp_mult': 1.3206508865928273, 'tsl_mult': 0.9004847945830681, 'strategy': 'breakout', 'time_stop': 165, 'use_sma': True, 'use_atr': False, 'use_adx': False, 'use_ema': True, 'use_spike': False, 'rsi_required': False, 'edge_k': 0.8814027129947414, 'edge_cap': 0.6166615217502583, 'bull_strategy': 'mean_reversion', 'bull_bb_std_mult': 2.967672050614555, 'bull_rsi_os': 9, 'bull_rsi_ob': 71, 'bull_adx_thresh': 14.938253322191647, 'bull_atr_min_pct': 0.017014560206214006, 'bull_atr_max_pct': 0.09012798510548158, 'bull_tp_mult': 2.785113334376687, 'bull_tsl_mult': 0.8472162517012334, 'bull_time_stop': 14, 'bull_use_sma': True, 'bull_use_ema': False, 'bull_use_atr': True, 'bull_use_adx': False, 'bull_use_spike': True, 'bull_rsi_required': False, 'bear_strategy': 'mean_reversion', 'bear_bb_std_mult': 2.7560485835930657, 'bear_rsi_os': 5, 'bear_rsi_ob': 65, 'bear_adx_thresh': 20.727713947205483, 'bear_atr_min_pct': 0.021689100435263352, 'bear_atr_max_pct': 0.06363054411961877, 'bear_tp_mult': 2.0709254991845745, 'bear_tsl_mult': 0.9499320215838041, 'bear_time_stop': 49, 'bear_use_sma': False, 'bear_use_ema': True, 'bear_use_atr': False, 'bear_use_adx': True, 'bear_use_spike': True, 'bear_rsi_required': True, 'sideways_strategy': 'breakout', 'sideways_bb_std_mult': 2.4111787215987763, 'sideways_rsi_os': 48, 'sideways_rsi_ob': 77, 'sideways_adx_thresh': 23.590443429114494, 'sideways_atr_min_pct': 0.0079969127883288, 'sideways_atr_max_pct': 0.027470482130946272, 'sideways_tp_mult': 2.4987664273195516, 'sideways_tsl_mult': 0.7312903208566653, 'sideways_time_stop': 193, 'sideways_use_sma': True, 'sideways_use_ema': False, 'sideways_use_atr': False, 'sideways_use_adx': False, 'sideways_use_spike': False, 'sideways_rsi_required': False}.
[I 2025-08-29 20:21:22,773] Trial 372 finished with values: [-0.02227579172953409, 0.02226052215040169] and parameters: {'p_sma': 19, 'p_std': 58, 'p_atr': 27, 'p_adx': 13, 'rsi_period': 11, 'ema1': 24, 'ema2': 59, 'slip_atr_k': 0.006033936357024905, 'slip_spread_k': 0.17041520323890053, 'spread_hl_frac': 0.048782665115292285, 'bb_std_mult': 1.6787788328361821, 'rsi_os': 11, 'rsi_ob': 83, 'vol_spike': 0.2518319139915869, 'adx_thresh': 13.501111323122052, 'atr_min_pct': 0.019488159972023474, 'atr_max_pct': 0.028564322502150193, 'tp_mult': 1.427898550149461, 'tsl_mult': 0.897792992803586, 'strategy': 'mean_reversion', 'time_stop': 215, 'use_sma': True, 'use_atr': False, 'use_adx': False, 'use_ema': True, 'use_spike': False, 'rsi_required': False, 'edge_k': 0.9118508503111673, 'edge_cap': 0.3613201932962332, 'bull_strategy': 'mean_reversion', 'bull_bb_std_mult': 3.042867592886101, 'bull_rsi_os': 26, 'bull_rsi_ob': 76, 'bull_adx_thresh': 13.754017813337445, 'bull_atr_min_pct': 0.01627747441906473, 'bull_atr_max_pct': 0.08926567050867136, 'bull_tp_mult': 2.789766236881538, 'bull_tsl_mult': 0.9046633306284629, 'bull_time_stop': 34, 'bull_use_sma': True, 'bull_use_ema': False, 'bull_use_atr': True, 'bull_use_adx': False, 'bull_use_spike': True, 'bull_rsi_required': False, 'bear_strategy': 'breakout', 'bear_bb_std_mult': 2.7432603273085086, 'bear_rsi_os': 28, 'bear_rsi_ob': 52, 'bear_adx_thresh': 20.600011982216323, 'bear_atr_min_pct': 0.002256168662380091, 'bear_atr_max_pct': 0.02227560040426986, 'bear_tp_mult': 2.6798110603701946, 'bear_tsl_mult': 0.9670290329740174, 'bear_time_stop': 49, 'bear_use_sma': False, 'bear_use_ema': True, 'bear_use_atr': False, 'bear_use_adx': True, 'bear_use_spike': True, 'bear_rsi_required': True, 'sideways_strategy': 'breakout', 'sideways_bb_std_mult': 2.6159373075097956, 'sideways_rsi_os': 48, 'sideways_rsi_ob': 78, 'sideways_adx_thresh': 23.610070367497322, 'sideways_atr_min_pct': 0.006982917442229005, 'sideways_atr_max_pct': 0.02326936189574315, 'sideways_tp_mult': 1.2704533480592468, 'sideways_tsl_mult': 0.7305023253440096, 'sideways_time_stop': 192, 'sideways_use_sma': False, 'sideways_use_ema': False, 'sideways_use_atr': False, 'sideways_use_adx': False, 'sideways_use_spike': False, 'sideways_rsi_required': False}.
[I 2025-08-29 20:21:22,930] Trial 371 finished with values: [-1000000000.0, 1000000000.0] and parameters: {'p_sma': 20, 'p_std': 57, 'p_atr': 27, 'p_adx': 12, 'rsi_period': 69, 'ema1': 29, 'ema2': 57, 'slip_atr_k': 0.005274672511799749, 'slip_spread_k': 0.890397907986589, 'spread_hl_frac': 0.04874470063946971, 'bb_std_mult': 1.660313369134969, 'rsi_os': 11, 'rsi_ob': 86, 'vol_spike': 0.18051704181314385, 'adx_thresh': 13.597670798649176, 'atr_min_pct': 0.021409716513288986, 'atr_max_pct': 0.029415722675334953, 'tp_mult': 1.4252216911752809, 'tsl_mult': 0.8920887939831247, 'strategy': 'breakout', 'time_stop': 57, 'use_sma': True, 'use_atr': False, 'use_adx': False, 'use_ema': True, 'use_spike': False, 'rsi_required': False, 'edge_k': 1.050238580193318, 'edge_cap': 0.7255970740734914, 'bull_strategy': 'mean_reversion', 'bull_bb_std_mult': 3.053330089881445, 'bull_rsi_os': 26, 'bull_rsi_ob': 71, 'bull_adx_thresh': 15.081323800800902, 'bull_atr_min_pct': 0.015766740126792, 'bull_atr_max_pct': 0.0891672753525545, 'bull_tp_mult': 2.7924149639097435, 'bull_tsl_mult': 0.9141951589205719, 'bull_time_stop': 36, 'bull_use_sma': True, 'bull_use_ema': False, 'bull_use_atr': True, 'bull_use_adx': False, 'bull_use_spike': True, 'bull_rsi_required': False, 'bear_strategy': 'breakout', 'bear_bb_std_mult': 2.7492822588063985, 'bear_rsi_os': 28, 'bear_rsi_ob': 65, 'bear_adx_thresh': 20.905011696962816, 'bear_atr_min_pct': 0.0019207972138794108, 'bear_atr_max_pct': 0.06348111749759416, 'bear_tp_mult': 2.5151468184020063, 'bear_tsl_mult': 0.9821376759504022, 'bear_time_stop': 48, 'bear_use_sma': False, 'bear_use_ema': True, 'bear_use_atr': False, 'bear_use_adx': True, 'bear_use_spike': True, 'bear_rsi_required': True, 'sideways_strategy': 'breakout', 'sideways_bb_std_mult': 2.41930859569369, 'sideways_rsi_os': 48, 'sideways_rsi_ob': 78, 'sideways_adx_thresh': 13.937303527877393, 'sideways_atr_min_pct': 0.009714547151891833, 'sideways_atr_max_pct': 0.026938192562126463, 'sideways_tp_mult': 1.0869834962026979, 'sideways_tsl_mult': 0.7401869373767568, 'sideways_time_stop': 194, 'sideways_use_sma': False, 'sideways_use_ema': False, 'sideways_use_atr': False, 'sideways_use_adx': False, 'sideways_use_spike': False, 'sideways_rsi_required': False}.
[I 2025-08-29 20:21:23,727] Trial 373 finished with values: [-0.0012230062324674051, 0.0014448515148804313] and parameters: {'p_sma': 20, 'p_std': 31, 'p_atr': 25, 'p_adx': 13, 'rsi_period': 40, 'ema1': 24, 'ema2': 18, 'slip_atr_k': 0.006321663544175269, 'slip_spread_k': 0.17058768313497208, 'spread_hl_frac': 0.048481695143939504, 'bb_std_mult': 1.6822781098206236, 'rsi_os': 11, 'rsi_ob': 83, 'vol_spike': 0.11586028899442592, 'adx_thresh': 13.524569130715719, 'atr_min_pct': 0.019741186264793625, 'atr_max_pct': 0.02991637710714648, 'tp_mult': 1.418098812881754, 'tsl_mult': 0.8887693970502913, 'strategy': 'mean_reversion', 'time_stop': 46, 'use_sma': True, 'use_atr': False, 'use_adx': False, 'use_ema': True, 'use_spike': False, 'rsi_required': False, 'edge_k': 0.9447443609476299, 'edge_cap': 0.7983858044206922, 'bull_strategy': 'mean_reversion', 'bull_bb_std_mult': 3.052789173561716, 'bull_rsi_os': 26, 'bull_rsi_ob': 75, 'bull_adx_thresh': 13.783134953364025, 'bull_atr_min_pct': 0.015692027496573932, 'bull_atr_max_pct': 0.09659694171218113, 'bull_tp_mult': 2.774381454247993, 'bull_tsl_mult': 0.9111999813788075, 'bull_time_stop': 34, 'bull_use_sma': True, 'bull_use_ema': False, 'bull_use_atr': True, 'bull_use_adx': False, 'bull_use_spike': True, 'bull_rsi_required': False, 'bear_strategy': 'breakout', 'bear_bb_std_mult': 2.594603884488181, 'bear_rsi_os': 28, 'bear_rsi_ob': 52, 'bear_adx_thresh': 19.112823421066523, 'bear_atr_min_pct': 0.025952295996384163, 'bear_atr_max_pct': 0.06421115807088633, 'bear_tp_mult': 2.5092578358548034, 'bear_tsl_mult': 0.8759774129849549, 'bear_time_stop': 49, 'bear_use_sma': False, 'bear_use_ema': True, 'bear_use_atr': False, 'bear_use_adx': True, 'bear_use_spike': True, 'bear_rsi_required': False, 'sideways_strategy': 'breakout', 'sideways_bb_std_mult': 1.0525992560564927, 'sideways_rsi_os': 48, 'sideways_rsi_ob': 78, 'sideways_adx_thresh': 13.155706488257284, 'sideways_atr_min_pct': 0.0045314679748407576, 'sideways_atr_max_pct': 0.022999529654455498, 'sideways_tp_mult': 2.3894932293156046, 'sideways_tsl_mult': 0.726016629065335, 'sideways_time_stop': 177, 'sideways_use_sma': False, 'sideways_use_ema': False, 'sideways_use_atr': False, 'sideways_use_adx': False, 'sideways_use_spike': False, 'sideways_rsi_required': False}.
[I 2025-08-29 20:21:53,956] Trial 377 finished with values: [-1000000000.0, 1000000000.0] and parameters: {'p_sma': 22, 'p_std': 31, 'p_atr': 25, 'p_adx': 13, 'rsi_period': 64, 'ema1': 25, 'ema2': 21, 'slip_atr_k': 0.00804642375685263, 'slip_spread_k': 0.17923147569720255, 'spread_hl_frac': 0.048488309231809336, 'bb_std_mult': 1.6939714052972494, 'rsi_os': 8, 'rsi_ob': 83, 'vol_spike': 0.2421550260568513, 'adx_thresh': 12.650716984728462, 'atr_min_pct': 0.019753265835227758, 'atr_max_pct': 0.030124612653162002, 'tp_mult': 1.4073821565675801, 'tsl_mult': 0.9158319167621168, 'strategy': 'mean_reversion', 'time_stop': 65, 'use_sma': True, 'use_atr': False, 'use_adx': False, 'use_ema': True, 'use_spike': False, 'rsi_required': False, 'edge_k': 1.048913423229687, 'edge_cap': 0.8023973297130651, 'bull_strategy': 'mean_reversion', 'bull_bb_std_mult': 2.7672363401629605, 'bull_rsi_os': 19, 'bull_rsi_ob': 72, 'bull_adx_thresh': 13.055643313516777, 'bull_atr_min_pct': 0.015546217293911884, 'bull_atr_max_pct': 0.0960462867971442, 'bull_tp_mult': 2.6870694594741975, 'bull_tsl_mult': 0.6285994568362828, 'bull_time_stop': 32, 'bull_use_sma': True, 'bull_use_ema': False, 'bull_use_atr': True, 'bull_use_adx': False, 'bull_use_spike': True, 'bull_rsi_required': False, 'bear_strategy': 'breakout', 'bear_bb_std_mult': 2.6937052939337303, 'bear_rsi_os': 42, 'bear_rsi_ob': 87, 'bear_adx_thresh': 19.572322462682877, 'bear_atr_min_pct': 0.02233851091600521, 'bear_atr_max_pct': 0.051039992462347, 'bear_tp_mult': 2.145318454386301, 'bear_tsl_mult': 0.8828792329840233, 'bear_time_stop': 54, 'bear_use_sma': False, 'bear_use_ema': True, 'bear_use_atr': False, 'bear_use_adx': True, 'bear_use_spike': True, 'bear_rsi_required': False, 'sideways_strategy': 'breakout', 'sideways_bb_std_mult': 2.355151974753957, 'sideways_rsi_os': 46, 'sideways_rsi_ob': 78, 'sideways_adx_thresh': 13.201834667436373, 'sideways_atr_min_pct': 0.005146379889155485, 'sideways_atr_max_pct': 0.02266300079064347, 'sideways_tp_mult': 2.3815640078755718, 'sideways_tsl_mult': 0.7228035398154109, 'sideways_time_stop': 178, 'sideways_use_sma': False, 'sideways_use_ema': False, 'sideways_use_atr': False, 'sideways_use_adx': False, 'sideways_use_spike': False, 'sideways_rsi_required': False}.
[I 2025-08-29 20:21:54,125] Trial 376 finished with values: [-0.002120166237089549, 0.0022515728933611926] and parameters: {'p_sma': 22, 'p_std': 19, 'p_atr': 25, 'p_adx': 13, 'rsi_period': 39, 'ema1': 25, 'ema2': 46, 'slip_atr_k': 0.00932426565413523, 'slip_spread_k': 0.1717379441641729, 'spread_hl_frac': 0.04863909024053856, 'bb_std_mult': 1.7526843149428306, 'rsi_os': 8, 'rsi_ob': 83, 'vol_spike': 0.16785778890190664, 'adx_thresh': 12.6016201398871, 'atr_min_pct': 0.020013973614420533, 'atr_max_pct': 0.021981394386413857, 'tp_mult': 1.2634792882221595, 'tsl_mult': 0.9604510350006994, 'strategy': 'mean_reversion', 'time_stop': 50, 'use_sma': True, 'use_atr': False, 'use_adx': False, 'use_ema': True, 'use_spike': False, 'rsi_required': False, 'edge_k': 0.9716068807075741, 'edge_cap': 0.31990011437444515, 'bull_strategy': 'mean_reversion', 'bull_bb_std_mult': 2.671929964854967, 'bull_rsi_os': 21, 'bull_rsi_ob': 74, 'bull_adx_thresh': 13.135717054528538, 'bull_atr_min_pct': 0.015212511575116192, 'bull_atr_max_pct': 0.10323121150801709, 'bull_tp_mult': 2.7574385819518663, 'bull_tsl_mult': 0.8321844722127163, 'bull_time_stop': 19, 'bull_use_sma': True, 'bull_use_ema': False, 'bull_use_atr': True, 'bull_use_adx': False, 'bull_use_spike': True, 'bull_rsi_required': False, 'bear_strategy': 'breakout', 'bear_bb_std_mult': 2.5828226110194143, 'bear_rsi_os': 42, 'bear_rsi_ob': 66, 'bear_adx_thresh': 19.088417166553125, 'bear_atr_min_pct': 0.012862125541980267, 'bear_atr_max_pct': 0.053258003969850205, 'bear_tp_mult': 2.726437871652678, 'bear_tsl_mult': 0.8630484964028509, 'bear_time_stop': 53, 'bear_use_sma': False, 'bear_use_ema': True, 'bear_use_atr': False, 'bear_use_adx': True, 'bear_use_spike': True, 'bear_rsi_required': False, 'sideways_strategy': 'breakout', 'sideways_bb_std_mult': 2.3374090864164496, 'sideways_rsi_os': 46, 'sideways_rsi_ob': 79, 'sideways_adx_thresh': 5.028847106469261, 'sideways_atr_min_pct': 0.004522272495645558, 'sideways_atr_max_pct': 0.022567355973983745, 'sideways_tp_mult': 1.131287280533332, 'sideways_tsl_mult': 0.7198961539646953, 'sideways_time_stop': 177, 'sideways_use_sma': False, 'sideways_use_ema': False, 'sideways_use_atr': False, 'sideways_use_adx': False, 'sideways_use_spike': False, 'sideways_rsi_required': False}.
[I 2025-08-29 20:21:54,397] Trial 374 finished with values: [-1000000000.0, 1000000000.0] and parameters: {'p_sma': 20, 'p_std': 8, 'p_atr': 25, 'p_adx': 13, 'rsi_period': 11, 'ema1': 29, 'ema2': 54, 'slip_atr_k': 0.007873256175998045, 'slip_spread_k': 0.1771448925715067, 'spread_hl_frac': 0.048581777234625416, 'bb_std_mult': 1.6697949506331753, 'rsi_os': 11, 'rsi_ob': 83, 'vol_spike': 0.059071498902377256, 'adx_thresh': 13.587963386794057, 'atr_min_pct': 0.019375974411805993, 'atr_max_pct': 0.029614920985521515, 'tp_mult': 1.4319695234244583, 'tsl_mult': 0.8845645035889869, 'strategy': 'mean_reversion', 'time_stop': 215, 'use_sma': True, 'use_atr': False, 'use_adx': False, 'use_ema': True, 'use_spike': False, 'rsi_required': False, 'edge_k': 0.9319618411846169, 'edge_cap': 0.3748835558450274, 'bull_strategy': 'mean_reversion', 'bull_bb_std_mult': 3.0524941046478875, 'bull_rsi_os': 21, 'bull_rsi_ob': 74, 'bull_adx_thresh': 13.63582317342547, 'bull_atr_min_pct': 0.01537764754641909, 'bull_atr_max_pct': 0.09591949558459081, 'bull_tp_mult': 2.8211791053304687, 'bull_tsl_mult': 0.9218009043039986, 'bull_time_stop': 33, 'bull_use_sma': True, 'bull_use_ema': False, 'bull_use_atr': True, 'bull_use_adx': False, 'bull_use_spike': True, 'bull_rsi_required': False, 'bear_strategy': 'breakout', 'bear_bb_std_mult': 2.721566296598194, 'bear_rsi_os': 17, 'bear_rsi_ob': 52, 'bear_adx_thresh': 21.420950341356075, 'bear_atr_min_pct': 0.01320543780136769, 'bear_atr_max_pct': 0.05368091260952276, 'bear_tp_mult': 2.4926227527949214, 'bear_tsl_mult': 0.8754859655140907, 'bear_time_stop': 50, 'bear_use_sma': False, 'bear_use_ema': True, 'bear_use_atr': False, 'bear_use_adx': True, 'bear_use_spike': True, 'bear_rsi_required': False, 'sideways_strategy': 'breakout', 'sideways_bb_std_mult': 1.0399626172400562, 'sideways_rsi_os': 23, 'sideways_rsi_ob': 78, 'sideways_adx_thresh': 32.656640463242844, 'sideways_atr_min_pct': 0.029324195030347652, 'sideways_atr_max_pct': 0.02269057205843525, 'sideways_tp_mult': 1.2721649805213406, 'sideways_tsl_mult': 0.721142008558194, 'sideways_time_stop': 195, 'sideways_use_sma': False, 'sideways_use_ema': False, 'sideways_use_atr': False, 'sideways_use_adx': False, 'sideways_use_spike': False, 'sideways_rsi_required': False}.
[I 2025-08-29 20:21:54,411] Trial 375 finished with values: [-1000000000.0, 1000000000.0] and parameters: {'p_sma': 20, 'p_std': 57, 'p_atr': 11, 'p_adx': 13, 'rsi_period': 39, 'ema1': 29, 'ema2': 46, 'slip_atr_k': 0.007447838911872666, 'slip_spread_k': 0.8876944231021946, 'spread_hl_frac': 0.04863057982750616, 'bb_std_mult': 1.6568769614846663, 'rsi_os': 11, 'rsi_ob': 83, 'vol_spike': 0.09891184224730887, 'adx_thresh': 13.505338085762672, 'atr_min_pct': 0.020057849605953987, 'atr_max_pct': 0.03013934309686636, 'tp_mult': 1.4153042420793294, 'tsl_mult': 0.8865536210151799, 'strategy': 'mean_reversion', 'time_stop': 47, 'use_sma': True, 'use_atr': False, 'use_adx': False, 'use_ema': True, 'use_spike': False, 'rsi_required': False, 'edge_k': 0.6373396830239124, 'edge_cap': 0.32805287868462596, 'bull_strategy': 'mean_reversion', 'bull_bb_std_mult': 3.049471291761966, 'bull_rsi_os': 24, 'bull_rsi_ob': 74, 'bull_adx_thresh': 13.118353165238943, 'bull_atr_min_pct': 0.015496556054171731, 'bull_atr_max_pct': 0.09504637105808342, 'bull_tp_mult': 2.8310677645305526, 'bull_tsl_mult': 0.9214407368423793, 'bull_time_stop': 33, 'bull_use_sma': True, 'bull_use_ema': False, 'bull_use_atr': True, 'bull_use_adx': False, 'bull_use_spike': True, 'bull_rsi_required': False, 'bear_strategy': 'breakout', 'bear_bb_std_mult': 2.688727620883017, 'bear_rsi_os': 7, 'bear_rsi_ob': 66, 'bear_adx_thresh': 21.399727715835883, 'bear_atr_min_pct': 0.006250272572186582, 'bear_atr_max_pct': 0.07440829716798622, 'bear_tp_mult': 2.5288161216262197, 'bear_tsl_mult': 0.8785607225944575, 'bear_time_stop': 52, 'bear_use_sma': False, 'bear_use_ema': True, 'bear_use_atr': False, 'bear_use_adx': True, 'bear_use_spike': True, 'bear_rsi_required': False, 'sideways_strategy': 'breakout', 'sideways_bb_std_mult': 2.3414220277676283, 'sideways_rsi_os': 23, 'sideways_rsi_ob': 78, 'sideways_adx_thresh': 32.658754925293344, 'sideways_atr_min_pct': 0.0062730913499736, 'sideways_atr_max_pct': 0.022542049814273702, 'sideways_tp_mult': 1.119081492707317, 'sideways_tsl_mult': 0.7162815157230347, 'sideways_time_stop': 58, 'sideways_use_sma': False, 'sideways_use_ema': False, 'sideways_use_atr': False, 'sideways_use_adx': False, 'sideways_use_spike': False, 'sideways_rsi_required': False}.
