[I 2025-08-29 20:31:06,988] Trial 459 finished with values: [-1000000000.0, 1000000000.0] and parameters: {'p_sma': 20, 'p_std': 55, 'p_atr': 30, 'p_adx': 26, 'rsi_period': 35, 'ema1': 29, 'ema2': 45, 'slip_atr_k': 0.24364017377029423, 'slip_spread_k': 0.2050535806830405, 'spread_hl_frac': 0.049988404933974, 'bb_std_mult': 1.6688000043448297, 'rsi_os': 6, 'rsi_ob': 86, 'vol_spike': 0.005353828782447306, 'adx_thresh': 13.519980584976615, 'atr_min_pct': 0.019025524412156908, 'atr_max_pct': 0.03527604891521892, 'tp_mult': 1.4977758996006456, 'tsl_mult': 0.3866781346093625, 'strategy': 'breakout', 'time_stop': 222, 'use_sma': True, 'use_atr': False, 'use_adx': True, 'use_ema': True, 'use_spike': False, 'rsi_required': False, 'edge_k': 0.8881798074542315, 'edge_cap': 0.2245876443353662, 'bull_strategy': 'mean_reversion', 'bull_bb_std_mult': 3.058267467431527, 'bull_rsi_os': 13, 'bull_rsi_ob': 74, 'bull_adx_thresh': 14.374600169471872, 'bull_atr_min_pct': 0.017180420859168113, 'bull_atr_max_pct': 0.0801161396002286, 'bull_tp_mult': 2.7051769496365727, 'bull_tsl_mult': 0.5275019756103959, 'bull_time_stop': 256, 'bull_use_sma': True, 'bull_use_ema': False, 'bull_use_atr': True, 'bull_use_adx': False, 'bull_use_spike': True, 'bull_rsi_required': False, 'bear_strategy': 'breakout', 'bear_bb_std_mult': 2.680001622455663, 'bear_rsi_os': 47, 'bear_rsi_ob': 85, 'bear_adx_thresh': 20.88821092146659, 'bear_atr_min_pct': 0.010919116704189893, 'bear_atr_max_pct': 0.05228679726544187, 'bear_tp_mult': 2.8972526216878722, 'bear_tsl_mult': 0.9230432098678603, 'bear_time_stop': 299, 'bear_use_sma': True, 'bear_use_ema': True, 'bear_use_atr': False, 'bear_use_adx': True, 'bear_use_spike': True, 'bear_rsi_required': True, 'sideways_strategy': 'breakout', 'sideways_bb_std_mult': 2.967671940927557, 'sideways_rsi_os': 48, 'sideways_rsi_ob': 54, 'sideways_adx_thresh': 32.57180815604103, 'sideways_atr_min_pct': 0.024921258053556432, 'sideways_atr_max_pct': 0.01983441264292115, 'sideways_tp_mult': 2.425131882074064, 'sideways_tsl_mult': 0.6862866908362883, 'sideways_time_stop': 193, 'sideways_use_sma': True, 'sideways_use_ema': False, 'sideways_use_atr': False, 'sideways_use_adx': True, 'sideways_use_spike': True, 'sideways_rsi_required': False}.
[I 2025-08-29 20:31:07,627] Trial 462 finished with values: [-1000000000.0, 1000000000.0] and parameters: {'p_sma': 24, 'p_std': 55, 'p_atr': 29, 'p_adx': 12, 'rsi_period': 36, 'ema1': 10, 'ema2': 13, 'slip_atr_k': 0.009821236298856104, 'slip_spread_k': 0.4145851168156918, 'spread_hl_frac': 0.048115277002930196, 'bb_std_mult': 1.5529148060485891, 'rsi_os': 41, 'rsi_ob': 75, 'vol_spike': 0.19144863866716946, 'adx_thresh': 13.27548962620906, 'atr_min_pct': 0.029669227424015267, 'atr_max_pct': 0.028854795559012353, 'tp_mult': 1.4257038243131785, 'tsl_mult': 0.8452486218108092, 'strategy': 'breakout', 'time_stop': 228, 'use_sma': False, 'use_atr': False, 'use_adx': True, 'use_ema': True, 'use_spike': False, 'rsi_required': False, 'edge_k': 1.0244320952246244, 'edge_cap': 0.39639767216895716, 'bull_strategy': 'breakout', 'bull_bb_std_mult': 3.065201483865633, 'bull_rsi_os': 32, 'bull_rsi_ob': 74, 'bull_adx_thresh': 6.636446521234966, 'bull_atr_min_pct': 0.029983989260368438, 'bull_atr_max_pct': 0.08591821018210512, 'bull_tp_mult': 2.9216404743150983, 'bull_tsl_mult': 0.4337514752461764, 'bull_time_stop': 32, 'bull_use_sma': True, 'bull_use_ema': False, 'bull_use_atr': True, 'bull_use_adx': False, 'bull_use_spike': True, 'bull_rsi_required': False, 'bear_strategy': 'breakout', 'bear_bb_std_mult': 2.6323598995491806, 'bear_rsi_os': 5, 'bear_rsi_ob': 69, 'bear_adx_thresh': 20.305199824823347, 'bear_atr_min_pct': 0.007676581188716785, 'bear_atr_max_pct': 0.04899989744047569, 'bear_tp_mult': 2.773204634066211, 'bear_tsl_mult': 0.9564369005590759, 'bear_time_stop': 300, 'bear_use_sma': False, 'bear_use_ema': True, 'bear_use_atr': False, 'bear_use_adx': True, 'bear_use_spike': False, 'bear_rsi_required': False, 'sideways_strategy': 'breakout', 'sideways_bb_std_mult': 2.9972518690031418, 'sideways_rsi_os': 51, 'sideways_rsi_ob': 73, 'sideways_adx_thresh': 33.32533045713236, 'sideways_atr_min_pct': 0.0014494379289679542, 'sideways_atr_max_pct': 0.0202841541740455, 'sideways_tp_mult': 1.0962661359653303, 'sideways_tsl_mult': 0.7176254939227432, 'sideways_time_stop': 37, 'sideways_use_sma': False, 'sideways_use_ema': False, 'sideways_use_atr': False, 'sideways_use_adx': False, 'sideways_use_spike': True, 'sideways_rsi_required': True}.
[I 2025-08-29 20:31:07,657] Trial 463 finished with values: [-1000000000.0, 1000000000.0] and parameters: {'p_sma': 25, 'p_std': 6, 'p_atr': 26, 'p_adx': 12, 'rsi_period': 39, 'ema1': 22, 'ema2': 48, 'slip_atr_k': 0.0001566546570379154, 'slip_spread_k': 0.5037915794053258, 'spread_hl_frac': 0.048189162901179625, 'bb_std_mult': 1.5350638361633615, 'rsi_os': 9, 'rsi_ob': 82, 'vol_spike': 0.17439044118536792, 'adx_thresh': 13.421546133489837, 'atr_min_pct': 0.029544188988634285, 'atr_max_pct': 0.021151125946606078, 'tp_mult': 1.4172640060481387, 'tsl_mult': 0.857210707402105, 'strategy': 'breakout', 'time_stop': 127, 'use_sma': False, 'use_atr': False, 'use_adx': True, 'use_ema': True, 'use_spike': False, 'rsi_required': False, 'edge_k': 1.0332406840452626, 'edge_cap': 0.5704124001169469, 'bull_strategy': 'breakout', 'bull_bb_std_mult': 2.8938395056309263, 'bull_rsi_os': 32, 'bull_rsi_ob': 73, 'bull_adx_thresh': 12.803647220289628, 'bull_atr_min_pct': 0.011696054873068166, 'bull_atr_max_pct': 0.08640399908331357, 'bull_tp_mult': 2.039248139941429, 'bull_tsl_mult': 0.4312013956745131, 'bull_time_stop': 128, 'bull_use_sma': True, 'bull_use_ema': False, 'bull_use_atr': True, 'bull_use_adx': False, 'bull_use_spike': True, 'bull_rsi_required': False, 'bear_strategy': 'breakout', 'bear_bb_std_mult': 2.8602401974655938, 'bear_rsi_os': 5, 'bear_rsi_ob': 53, 'bear_adx_thresh': 20.15192143101911, 'bear_atr_min_pct': 0.008040268658409051, 'bear_atr_max_pct': 0.04761663066685716, 'bear_tp_mult': 2.6132933765674666, 'bear_tsl_mult': 0.892880912910653, 'bear_time_stop': 210, 'bear_use_sma': False, 'bear_use_ema': True, 'bear_use_atr': False, 'bear_use_adx': True, 'bear_use_spike': False, 'bear_rsi_required': False, 'sideways_strategy': 'breakout', 'sideways_bb_std_mult': 2.4416695932741024, 'sideways_rsi_os': 34, 'sideways_rsi_ob': 80, 'sideways_adx_thresh': 33.404311522285745, 'sideways_atr_min_pct': 0.005562490650601867, 'sideways_atr_max_pct': 0.023230424157735442, 'sideways_tp_mult': 1.1071569518539135, 'sideways_tsl_mult': 0.7212093152291377, 'sideways_time_stop': 196, 'sideways_use_sma': False, 'sideways_use_ema': False, 'sideways_use_atr': False, 'sideways_use_adx': False, 'sideways_use_spike': True, 'sideways_rsi_required': True}.
[I 2025-08-29 20:31:08,327] Trial 464 finished with values: [-1000000000.0, 1000000000.0] and parameters: {'p_sma': 5, 'p_std': 56, 'p_atr': 11, 'p_adx': 24, 'rsi_period': 69, 'ema1': 25, 'ema2': 48, 'slip_atr_k': 0.1803137728515628, 'slip_spread_k': 0.022972562854719436, 'spread_hl_frac': 0.033534249714799506, 'bb_std_mult': 1.801023164741453, 'rsi_os': 54, 'rsi_ob': 53, 'vol_spike': 0.22473451359655644, 'adx_thresh': 22.179413510057316, 'atr_min_pct': 0.019918082055829706, 'atr_max_pct': 0.14044684214318529, 'tp_mult': 1.1342413513604694, 'tsl_mult': 0.9480498595191361, 'strategy': 'mean_reversion', 'time_stop': 181, 'use_sma': True, 'use_atr': False, 'use_adx': False, 'use_ema': True, 'use_spike': False, 'rsi_required': False, 'edge_k': 0.11166735310685982, 'edge_cap': 0.928611997550884, 'bull_strategy': 'mean_reversion', 'bull_bb_std_mult': 2.5392427904984594, 'bull_rsi_os': 9, 'bull_rsi_ob': 65, 'bull_adx_thresh': 9.536097824002733, 'bull_atr_min_pct': 0.018816229482201997, 'bull_atr_max_pct': 0.0951662016968934, 'bull_tp_mult': 2.401833779115134, 'bull_tsl_mult': 0.9161920310928419, 'bull_time_stop': 34, 'bull_use_sma': True, 'bull_use_ema': False, 'bull_use_atr': True, 'bull_use_adx': False, 'bull_use_spike': True, 'bull_rsi_required': False, 'bear_strategy': 'breakout', 'bear_bb_std_mult': 2.5631298920206933, 'bear_rsi_os': 24, 'bear_rsi_ob': 47, 'bear_adx_thresh': 21.190060016242473, 'bear_atr_min_pct': 0.00591043544529, 'bear_atr_max_pct': 0.04745686905822739, 'bear_tp_mult': 2.6017226427404947, 'bear_tsl_mult': 0.9713368967256384, 'bear_time_stop': 150, 'bear_use_sma': False, 'bear_use_ema': True, 'bear_use_atr': False, 'bear_use_adx': True, 'bear_use_spike': True, 'bear_rsi_required': False, 'sideways_strategy': 'breakout', 'sideways_bb_std_mult': 2.4375935728401283, 'sideways_rsi_os': 47, 'sideways_rsi_ob': 89, 'sideways_adx_thresh': 30.764653374405505, 'sideways_atr_min_pct': 0.006019589092264636, 'sideways_atr_max_pct': 0.02350369218784447, 'sideways_tp_mult': 1.0850686867050217, 'sideways_tsl_mult': 0.6041301133061379, 'sideways_time_stop': 196, 'sideways_use_sma': False, 'sideways_use_ema': False, 'sideways_use_atr': False, 'sideways_use_adx': False, 'sideways_use_spike': False, 'sideways_rsi_required': True}.
[I 2025-08-29 20:31:08,347] Trial 465 finished with values: [-1000000000.0, 1000000000.0] and parameters: {'p_sma': 13, 'p_std': 18, 'p_atr': 18, 'p_adx': 13, 'rsi_period': 69, 'ema1': 26, 'ema2': 47, 'slip_atr_k': 0.12680124110872915, 'slip_spread_k': 0.16151289806399674, 'spread_hl_frac': 0.03501999687300492, 'bb_std_mult': 1.7709716635886856, 'rsi_os': 52, 'rsi_ob': 53, 'vol_spike': 0.057581488132116596, 'adx_thresh': 12.36615488570683, 'atr_min_pct': 0.019926156502717864, 'atr_max_pct': 0.029326754757918284, 'tp_mult': 2.083160055147939, 'tsl_mult': 0.9434863177089294, 'strategy': 'mean_reversion', 'time_stop': 176, 'use_sma': True, 'use_atr': False, 'use_adx': False, 'use_ema': True, 'use_spike': False, 'rsi_required': False, 'edge_k': 1.1272609844769181, 'edge_cap': 0.6903927255987506, 'bull_strategy': 'mean_reversion', 'bull_bb_std_mult': 3.1786484205414154, 'bull_rsi_os': 9, 'bull_rsi_ob': 68, 'bull_adx_thresh': 9.544730070374479, 'bull_atr_min_pct': 0.006586088610843782, 'bull_atr_max_pct': 0.11780488396757915, 'bull_tp_mult': 2.7903582936631097, 'bull_tsl_mult': 0.3737550844047548, 'bull_time_stop': 117, 'bull_use_sma': False, 'bull_use_ema': False, 'bull_use_atr': True, 'bull_use_adx': False, 'bull_use_spike': True, 'bull_rsi_required': False, 'bear_strategy': 'breakout', 'bear_bb_std_mult': 1.8696769477615078, 'bear_rsi_os': 25, 'bear_rsi_ob': 68, 'bear_adx_thresh': 34.93469188152605, 'bear_atr_min_pct': 0.005873912626369539, 'bear_atr_max_pct': 0.048235264523200684, 'bear_tp_mult': 2.6838700869911793, 'bear_tsl_mult': 0.9678577997517619, 'bear_time_stop': 146, 'bear_use_sma': False, 'bear_use_ema': False, 'bear_use_atr': False, 'bear_use_adx': True, 'bear_use_spike': True, 'bear_rsi_required': False, 'sideways_strategy': 'breakout', 'sideways_bb_std_mult': 2.330834264742367, 'sideways_rsi_os': 47, 'sideways_rsi_ob': 78, 'sideways_adx_thresh': 30.80347718960981, 'sideways_atr_min_pct': 0.01331940589395491, 'sideways_atr_max_pct': 0.07633442715394947, 'sideways_tp_mult': 1.869361485098332, 'sideways_tsl_mult': 0.7364172966695999, 'sideways_time_stop': 63, 'sideways_use_sma': False, 'sideways_use_ema': False, 'sideways_use_atr': False, 'sideways_use_adx': False, 'sideways_use_spike': False, 'sideways_rsi_required': False}.
[I 2025-08-29 20:31:27,344] Trial 460 finished with values: [-1000000000.0, 1000000000.0] and parameters: {'p_sma': 24, 'p_std': 9, 'p_atr': 25, 'p_adx': 12, 'rsi_period': 38, 'ema1': 25, 'ema2': 45, 'slip_atr_k': 0.12751344534116513, 'slip_spread_k': 0.5075059954955363, 'spread_hl_frac': 0.049980821838350946, 'bb_std_mult': 1.5462235609645911, 'rsi_os': 41, 'rsi_ob': 86, 'vol_spike': 0.173923386399237, 'adx_thresh': 13.46313001871092, 'atr_min_pct': 0.019714053454785337, 'atr_max_pct': 0.019886093488257782, 'tp_mult': 1.1334521937529434, 'tsl_mult': 0.8468711795949814, 'strategy': 'breakout', 'time_stop': 176, 'use_sma': True, 'use_atr': False, 'use_adx': True, 'use_ema': True, 'use_spike': False, 'rsi_required': False, 'edge_k': 1.1141727886145347, 'edge_cap': 0.7853441573051806, 'bull_strategy': 'mean_reversion', 'bull_bb_std_mult': 3.1602522535059134, 'bull_rsi_os': 11, 'bull_rsi_ob': 66, 'bull_adx_thresh': 23.687240005282302, 'bull_atr_min_pct': 0.024978765586129, 'bull_atr_max_pct': 0.08570022839467874, 'bull_tp_mult': 2.0492694833323104, 'bull_tsl_mult': 0.9186840067647204, 'bull_time_stop': 31, 'bull_use_sma': True, 'bull_use_ema': False, 'bull_use_atr': True, 'bull_use_adx': False, 'bull_use_spike': True, 'bull_rsi_required': False, 'bear_strategy': 'breakout', 'bear_bb_std_mult': 1.4941635019371953, 'bear_rsi_os': 30, 'bear_rsi_ob': 88, 'bear_adx_thresh': 12.606133679355331, 'bear_atr_min_pct': 0.016804553172174986, 'bear_atr_max_pct': 0.05377655995425512, 'bear_tp_mult': 2.909331877260158, 'bear_tsl_mult': 0.8924011895966615, 'bear_time_stop': 211, 'bear_use_sma': False, 'bear_use_ema': True, 'bear_use_atr': False, 'bear_use_adx': True, 'bear_use_spike': True, 'bear_rsi_required': True, 'sideways_strategy': 'breakout', 'sideways_bb_std_mult': 2.313715780018391, 'sideways_rsi_os': 48, 'sideways_rsi_ob': 53, 'sideways_adx_thresh': 30.926542152204114, 'sideways_atr_min_pct': 0.005974311277080936, 'sideways_atr_max_pct': 0.019998019655149604, 'sideways_tp_mult': 1.076432474309141, 'sideways_tsl_mult': 0.9032275695887599, 'sideways_time_stop': 195, 'sideways_use_sma': True, 'sideways_use_ema': False, 'sideways_use_atr': False, 'sideways_use_adx': False, 'sideways_use_spike': True, 'sideways_rsi_required': True}.
[I 2025-08-29 20:31:28,067] Trial 461 finished with values: [-1000000000.0, 1000000000.0] and parameters: {'p_sma': 20, 'p_std': 55, 'p_atr': 11, 'p_adx': 26, 'rsi_period': 70, 'ema1': 25, 'ema2': 52, 'slip_atr_k': 0.009617483378298652, 'slip_spread_k': 0.20554453039650844, 'spread_hl_frac': 0.048015840765019656, 'bb_std_mult': 1.5513448613612015, 'rsi_os': 41, 'rsi_ob': 75, 'vol_spike': 0.18625540025381507, 'adx_thresh': 12.399477855577057, 'atr_min_pct': 0.019837800692368502, 'atr_max_pct': 0.029312419969147508, 'tp_mult': 1.4125465096501748, 'tsl_mult': 0.8921269075505032, 'strategy': 'breakout', 'time_stop': 181, 'use_sma': False, 'use_atr': False, 'use_adx': True, 'use_ema': True, 'use_spike': False, 'rsi_required': False, 'edge_k': 1.1200180836413498, 'edge_cap': 0.7067907293619446, 'bull_strategy': 'breakout', 'bull_bb_std_mult': 1.9048343695700602, 'bull_rsi_os': 13, 'bull_rsi_ob': 46, 'bull_adx_thresh': 14.362128226842561, 'bull_atr_min_pct': 0.0299831074112425, 'bull_atr_max_pct': 0.10172144994001461, 'bull_tp_mult': 2.39136938780242, 'bull_tsl_mult': 0.9191283520573232, 'bull_time_stop': 107, 'bull_use_sma': True, 'bull_use_ema': False, 'bull_use_atr': True, 'bull_use_adx': False, 'bull_use_spike': True, 'bull_rsi_required': False, 'bear_strategy': 'breakout', 'bear_bb_std_mult': 1.484392536624004, 'bear_rsi_os': 5, 'bear_rsi_ob': 69, 'bear_adx_thresh': 28.562111478366077, 'bear_atr_min_pct': 0.005815433130301101, 'bear_atr_max_pct': 0.048784120842742876, 'bear_tp_mult': 2.4291434437770043, 'bear_tsl_mult': 0.9584227641865982, 'bear_time_stop': 210, 'bear_use_sma': False, 'bear_use_ema': True, 'bear_use_atr': False, 'bear_use_adx': True, 'bear_use_spike': False, 'bear_rsi_required': True, 'sideways_strategy': 'breakout', 'sideways_bb_std_mult': 3.435901013282085, 'sideways_rsi_os': 48, 'sideways_rsi_ob': 50, 'sideways_adx_thresh': 33.32040500055795, 'sideways_atr_min_pct': 0.005913895950781038, 'sideways_atr_max_pct': 0.02004722381488165, 'sideways_tp_mult': 2.4238413382685424, 'sideways_tsl_mult': 0.6845219359732926, 'sideways_time_stop': 5, 'sideways_use_sma': False, 'sideways_use_ema': False, 'sideways_use_atr': False, 'sideways_use_adx': False, 'sideways_use_spike': True, 'sideways_rsi_required': True}.
[I 2025-08-29 20:31:37,687] Trial 466 finished with values: [-1000000000.0, 1000000000.0] and parameters: {'p_sma': 48, 'p_std': 60, 'p_atr': 18, 'p_adx': 13, 'rsi_period': 38, 'ema1': 27, 'ema2': 47, 'slip_atr_k': 0.1125070065245904, 'slip_spread_k': 0.23195621417966883, 'spread_hl_frac': 0.027749928455653165, 'bb_std_mult': 3.3034075662143048, 'rsi_os': 5, 'rsi_ob': 55, 'vol_spike': 0.1847351843350724, 'adx_thresh': 12.444026353817822, 'atr_min_pct': 0.019827181263006737, 'atr_max_pct': 0.10456699998628363, 'tp_mult': 1.2006736522776893, 'tsl_mult': 0.8937638996621271, 'strategy': 'mean_reversion', 'time_stop': 176, 'use_sma': True, 'use_atr': False, 'use_adx': False, 'use_ema': True, 'use_spike': False, 'rsi_required': False, 'edge_k': 1.1288115183910024, 'edge_cap': 0.12802445489036512, 'bull_strategy': 'mean_reversion', 'bull_bb_std_mult': 3.2473207979434235, 'bull_rsi_os': 23, 'bull_rsi_ob': 68, 'bull_adx_thresh': 14.706706104485589, 'bull_atr_min_pct': 0.016641873246710983, 'bull_atr_max_pct': 0.09835526799726199, 'bull_tp_mult': 2.7925349537735755, 'bull_tsl_mult': 0.8703242153611161, 'bull_time_stop': 40, 'bull_use_sma': False, 'bull_use_ema': False, 'bull_use_atr': True, 'bull_use_adx': False, 'bull_use_spike': True, 'bull_rsi_required': False, 'bear_strategy': 'breakout', 'bear_bb_std_mult': 1.526686175600664, 'bear_rsi_os': 28, 'bear_rsi_ob': 64, 'bear_adx_thresh': 32.62187931149869, 'bear_atr_min_pct': 0.006607922885973202, 'bear_atr_max_pct': 0.04874934287933222, 'bear_tp_mult': 2.6988164348029, 'bear_tsl_mult': 0.9291786338350108, 'bear_time_stop': 47, 'bear_use_sma': False, 'bear_use_ema': False, 'bear_use_atr': False, 'bear_use_adx': True, 'bear_use_spike': True, 'bear_rsi_required': False, 'sideways_strategy': 'breakout', 'sideways_bb_std_mult': 2.331210240275591, 'sideways_rsi_os': 8, 'sideways_rsi_ob': 78, 'sideways_adx_thresh': 32.976144407194745, 'sideways_atr_min_pct': 0.012053975171998693, 'sideways_atr_max_pct': 0.03008586155115072, 'sideways_tp_mult': 1.0138055989962131, 'sideways_tsl_mult': 0.7380912207278584, 'sideways_time_stop': 187, 'sideways_use_sma': False, 'sideways_use_ema': False, 'sideways_use_atr': False, 'sideways_use_adx': False, 'sideways_use_spike': False, 'sideways_rsi_required': False}.
[I 2025-08-29 20:31:38,276] Trial 467 finished with values: [-1000000000.0, 1000000000.0] and parameters: {'p_sma': 23, 'p_std': 59, 'p_atr': 25, 'p_adx': 10, 'rsi_period': 38, 'ema1': 22, 'ema2': 12, 'slip_atr_k': 0.009789363651017619, 'slip_spread_k': 0.228814545514533, 'spread_hl_frac': 0.041380092378348984, 'bb_std_mult': 1.602438877154714, 'rsi_os': 5, 'rsi_ob': 88, 'vol_spike': 0.11072548256251949, 'adx_thresh': 10.156445958934967, 'atr_min_pct': 0.0210760693950602, 'atr_max_pct': 0.10349767785305887, 'tp_mult': 1.3429456821403862, 'tsl_mult': 0.8778937205917938, 'strategy': 'mean_reversion', 'time_stop': 276, 'use_sma': True, 'use_atr': False, 'use_adx': False, 'use_ema': True, 'use_spike': False, 'rsi_required': False, 'edge_k': 1.0726915958479653, 'edge_cap': 0.5953075383679062, 'bull_strategy': 'mean_reversion', 'bull_bb_std_mult': 3.2324259941871105, 'bull_rsi_os': 23, 'bull_rsi_ob': 77, 'bull_adx_thresh': 14.58620580577805, 'bull_atr_min_pct': 0.010409661678934094, 'bull_atr_max_pct': 0.0995761345741292, 'bull_tp_mult': 2.730391082481049, 'bull_tsl_mult': 0.2518563096973707, 'bull_time_stop': 41, 'bull_use_sma': True, 'bull_use_ema': False, 'bull_use_atr': True, 'bull_use_adx': False, 'bull_use_spike': True, 'bull_rsi_required': False, 'bear_strategy': 'mean_reversion', 'bear_bb_std_mult': 2.7523757046981867, 'bear_rsi_os': 51, 'bear_rsi_ob': 88, 'bear_adx_thresh': 19.76425315973958, 'bear_atr_min_pct': 0.016900586797604616, 'bear_atr_max_pct': 0.041868894830626655, 'bear_tp_mult': 2.6636748691308063, 'bear_tsl_mult': 0.927043513300238, 'bear_time_stop': 46, 'bear_use_sma': False, 'bear_use_ema': True, 'bear_use_atr': False, 'bear_use_adx': True, 'bear_use_spike': True, 'bear_rsi_required': False, 'sideways_strategy': 'breakout', 'sideways_bb_std_mult': 3.090222338709225, 'sideways_rsi_os': 49, 'sideways_rsi_ob': 80, 'sideways_adx_thresh': 34.07664740533046, 'sideways_atr_min_pct': 0.004880167724780189, 'sideways_atr_max_pct': 0.028289348392328877, 'sideways_tp_mult': 1.1822651214659996, 'sideways_tsl_mult': 0.7024024659353796, 'sideways_time_stop': 187, 'sideways_use_sma': False, 'sideways_use_ema': False, 'sideways_use_atr': False, 'sideways_use_adx': False, 'sideways_use_spike': False, 'sideways_rsi_required': False}.
