[I 2025-08-29 20:33:40,626] Trial 487 finished with values: [-0.028548362396496718, 0.02851899661948285] and parameters: {'p_sma': 20, 'p_std': 30, 'p_atr': 15, 'p_adx': 13, 'rsi_period': 63, 'ema1': 26, 'ema2': 45, 'slip_atr_k': 0.14532423635070105, 'slip_spread_k': 0.6095961120835597, 'spread_hl_frac': 0.04994900862048891, 'bb_std_mult': 2.0074139475838866, 'rsi_os': 10, 'rsi_ob': 82, 'vol_spike': 0.2642490636607481, 'adx_thresh': 10.828144152881285, 'atr_min_pct': 0.020430331011326117, 'atr_max_pct': 0.13507456033704354, 'tp_mult': 1.411611702900931, 'tsl_mult': 0.9314923022801009, 'strategy': 'mean_reversion', 'time_stop': 66, 'use_sma': True, 'use_atr': False, 'use_adx': False, 'use_ema': True, 'use_spike': False, 'rsi_required': False, 'edge_k': 1.0564643733090933, 'edge_cap': 0.5866464943912774, 'bull_strategy': 'mean_reversion', 'bull_bb_std_mult': 2.117591947479446, 'bull_rsi_os': 6, 'bull_rsi_ob': 70, 'bull_adx_thresh': 12.714649055353604, 'bull_atr_min_pct': 0.023938980731180493, 'bull_atr_max_pct': 0.0966519764134059, 'bull_tp_mult': 2.5923221449616896, 'bull_tsl_mult': 0.5561519437054686, 'bull_time_stop': 207, 'bull_use_sma': True, 'bull_use_ema': False, 'bull_use_atr': True, 'bull_use_adx': False, 'bull_use_spike': True, 'bull_rsi_required': False, 'bear_strategy': 'breakout', 'bear_bb_std_mult': 2.819683691995184, 'bear_rsi_os': 15, 'bear_rsi_ob': 91, 'bear_adx_thresh': 31.612290222030147, 'bear_atr_min_pct': 0.02991998283896987, 'bear_atr_max_pct': 0.054643216830611865, 'bear_tp_mult': 2.7282619761003413, 'bear_tsl_mult': 0.23235001035114938, 'bear_time_stop': 186, 'bear_use_sma': False, 'bear_use_ema': True, 'bear_use_atr': False, 'bear_use_adx': True, 'bear_use_spike': True, 'bear_rsi_required': False, 'sideways_strategy': 'breakout', 'sideways_bb_std_mult': 2.3700198231529166, 'sideways_rsi_os': 48, 'sideways_rsi_ob': 58, 'sideways_adx_thresh': 32.8109047531637, 'sideways_atr_min_pct': 0.0023456822377974497, 'sideways_atr_max_pct': 0.028447858062073818, 'sideways_tp_mult': 1.5890053239439488, 'sideways_tsl_mult': 0.12706366899165122, 'sideways_time_stop': 29, 'sideways_use_sma': True, 'sideways_use_ema': False, 'sideways_use_atr': False, 'sideways_use_adx': False, 'sideways_use_spike': False, 'sideways_rsi_required': False}.
[I 2025-08-29 20:33:40,704] Trial 486 finished with values: [-0.003071183894734153, 0.004090017909767932] and parameters: {'p_sma': 34, 'p_std': 42, 'p_atr': 10, 'p_adx': 25, 'rsi_period': 15, 'ema1': 27, 'ema2': 45, 'slip_atr_k': 0.004432293991676608, 'slip_spread_k': 0.18136243019872236, 'spread_hl_frac': 0.009154693739010657, 'bb_std_mult': 1.6621751623115284, 'rsi_os': 10, 'rsi_ob': 85, 'vol_spike': 0.06546173825150858, 'adx_thresh': 12.807624852798304, 'atr_min_pct': 0.017001441821791686, 'atr_max_pct': 0.13395512233511198, 'tp_mult': 1.3932583685767759, 'tsl_mult': 0.9252879477096154, 'strategy': 'mean_reversion', 'time_stop': 160, 'use_sma': True, 'use_atr': False, 'use_adx': False, 'use_ema': True, 'use_spike': False, 'rsi_required': False, 'edge_k': 1.048193015761788, 'edge_cap': 0.5772678372294912, 'bull_strategy': 'mean_reversion', 'bull_bb_std_mult': 2.119161765340847, 'bull_rsi_os': 8, 'bull_rsi_ob': 70, 'bull_adx_thresh': 13.000045693410538, 'bull_atr_min_pct': 0.012572049234177119, 'bull_atr_max_pct': 0.09713940074807512, 'bull_tp_mult': 2.688654933923365, 'bull_tsl_mult': 0.9065770396965126, 'bull_time_stop': 36, 'bull_use_sma': True, 'bull_use_ema': False, 'bull_use_atr': True, 'bull_use_adx': False, 'bull_use_spike': True, 'bull_rsi_required': False, 'bear_strategy': 'breakout', 'bear_bb_std_mult': 1.9542088356157918, 'bear_rsi_os': 19, 'bear_rsi_ob': 66, 'bear_adx_thresh': 23.362884195908375, 'bear_atr_min_pct': 0.005081600575718237, 'bear_atr_max_pct': 0.05298462133531207, 'bear_tp_mult': 1.2831193800030498, 'bear_tsl_mult': 0.8980445855873744, 'bear_time_stop': 184, 'bear_use_sma': False, 'bear_use_ema': True, 'bear_use_atr': False, 'bear_use_adx': True, 'bear_use_spike': True, 'bear_rsi_required': False, 'sideways_strategy': 'breakout', 'sideways_bb_std_mult': 2.385573925121272, 'sideways_rsi_os': 51, 'sideways_rsi_ob': 71, 'sideways_adx_thresh': 32.953306370517694, 'sideways_atr_min_pct': 0.00450775705837862, 'sideways_atr_max_pct': 0.02521296418781487, 'sideways_tp_mult': 1.0902581078565499, 'sideways_tsl_mult': 0.28999178719596586, 'sideways_time_stop': 31, 'sideways_use_sma': False, 'sideways_use_ema': False, 'sideways_use_atr': False, 'sideways_use_adx': False, 'sideways_use_spike': False, 'sideways_rsi_required': False}.
[I 2025-08-29 20:34:10,449] Trial 491 finished with values: [-1000000000.0, 1000000000.0] and parameters: {'p_sma': 32, 'p_std': 47, 'p_atr': 26, 'p_adx': 12, 'rsi_period': 42, 'ema1': 26, 'ema2': 50, 'slip_atr_k': 0.006245589642528145, 'slip_spread_k': 0.21481121442652498, 'spread_hl_frac': 0.019168500971860514, 'bb_std_mult': 0.6729436000554876, 'rsi_os': 8, 'rsi_ob': 92, 'vol_spike': 0.13901959217269544, 'adx_thresh': 19.11266903514403, 'atr_min_pct': 0.020223852795731127, 'atr_max_pct': 0.02496231266726722, 'tp_mult': 1.4628868792852532, 'tsl_mult': 0.9029146633123932, 'strategy': 'mean_reversion', 'time_stop': 148, 'use_sma': True, 'use_atr': False, 'use_adx': False, 'use_ema': True, 'use_spike': True, 'rsi_required': False, 'edge_k': 0.07288280380110523, 'edge_cap': 0.37359483056930703, 'bull_strategy': 'mean_reversion', 'bull_bb_std_mult': 2.906906707514635, 'bull_rsi_os': 18, 'bull_rsi_ob': 61, 'bull_adx_thresh': 31.706011447294962, 'bull_atr_min_pct': 0.008931678564932934, 'bull_atr_max_pct': 0.11531086117403208, 'bull_tp_mult': 2.4682943487002156, 'bull_tsl_mult': 0.690269481321775, 'bull_time_stop': 36, 'bull_use_sma': True, 'bull_use_ema': False, 'bull_use_atr': True, 'bull_use_adx': False, 'bull_use_spike': True, 'bull_rsi_required': False, 'bear_strategy': 'mean_reversion', 'bear_bb_std_mult': 2.6798730711853227, 'bear_rsi_os': 11, 'bear_rsi_ob': 80, 'bear_adx_thresh': 30.81837904106391, 'bear_atr_min_pct': 0.006831895463554763, 'bear_atr_max_pct': 0.09035750913398707, 'bear_tp_mult': 2.6365606029862287, 'bear_tsl_mult': 0.9785446456692727, 'bear_time_stop': 236, 'bear_use_sma': False, 'bear_use_ema': True, 'bear_use_atr': False, 'bear_use_adx': True, 'bear_use_spike': True, 'bear_rsi_required': True, 'sideways_strategy': 'breakout', 'sideways_bb_std_mult': 0.8503583828771535, 'sideways_rsi_os': 50, 'sideways_rsi_ob': 74, 'sideways_adx_thresh': 11.577043372470888, 'sideways_atr_min_pct': 0.006388551585246607, 'sideways_atr_max_pct': 0.023381574409844584, 'sideways_tp_mult': 1.1284460859368484, 'sideways_tsl_mult': 0.746616807441512, 'sideways_time_stop': 182, 'sideways_use_sma': True, 'sideways_use_ema': False, 'sideways_use_atr': False, 'sideways_use_adx': False, 'sideways_use_spike': False, 'sideways_rsi_required': False}.
[I 2025-08-29 20:34:10,945] Trial 488 finished with values: [-0.0007931324209921042, 0.001991552329535348] and parameters: {'p_sma': 20, 'p_std': 30, 'p_atr': 26, 'p_adx': 25, 'rsi_period': 12, 'ema1': 26, 'ema2': 45, 'slip_atr_k': 0.004372033175380284, 'slip_spread_k': 0.17796752442717984, 'spread_hl_frac': 0.018797958461339553, 'bb_std_mult': 0.7699755158969239, 'rsi_os': 10, 'rsi_ob': 85, 'vol_spike': 0.18192684333440232, 'adx_thresh': 26.12241753826111, 'atr_min_pct': 0.021989859531555918, 'atr_max_pct': 0.1330553010953871, 'tp_mult': 1.3510212592545383, 'tsl_mult': 0.9233349725588399, 'strategy': 'mean_reversion', 'time_stop': 291, 'use_sma': True, 'use_atr': False, 'use_adx': False, 'use_ema': True, 'use_spike': True, 'rsi_required': False, 'edge_k': 1.0474616458514543, 'edge_cap': 0.5690089240907207, 'bull_strategy': 'mean_reversion', 'bull_bb_std_mult': 3.192392629687499, 'bull_rsi_os': 10, 'bull_rsi_ob': 58, 'bull_adx_thresh': 13.956008342557698, 'bull_atr_min_pct': 0.015101697545669196, 'bull_atr_max_pct': 0.0963478837077175, 'bull_tp_mult': 2.4763020455512628, 'bull_tsl_mult': 0.6947639075942961, 'bull_time_stop': 37, 'bull_use_sma': True, 'bull_use_ema': False, 'bull_use_atr': True, 'bull_use_adx': False, 'bull_use_spike': True, 'bull_rsi_required': False, 'bear_strategy': 'breakout', 'bear_bb_std_mult': 2.688356770822869, 'bear_rsi_os': 30, 'bear_rsi_ob': 80, 'bear_adx_thresh': 29.746350277783996, 'bear_atr_min_pct': 0.0051020541595573985, 'bear_atr_max_pct': 0.05263834103272569, 'bear_tp_mult': 1.6176389591817848, 'bear_tsl_mult': 0.9814030704476151, 'bear_time_stop': 263, 'bear_use_sma': False, 'bear_use_ema': True, 'bear_use_atr': False, 'bear_use_adx': True, 'bear_use_spike': True, 'bear_rsi_required': True, 'sideways_strategy': 'breakout', 'sideways_bb_std_mult': 2.3375895851726565, 'sideways_rsi_os': 45, 'sideways_rsi_ob': 79, 'sideways_adx_thresh': 32.72582906274162, 'sideways_atr_min_pct': 0.02141345649041163, 'sideways_atr_max_pct': 0.024825540713377142, 'sideways_tp_mult': 1.8386085962929857, 'sideways_tsl_mult': 0.28825944321563257, 'sideways_time_stop': 198, 'sideways_use_sma': True, 'sideways_use_ema': False, 'sideways_use_atr': False, 'sideways_use_adx': False, 'sideways_use_spike': False, 'sideways_rsi_required': False}.
[I 2025-08-29 20:34:11,115] Trial 490 finished with values: [-0.017028624007134563, 0.01703793747165357] and parameters: {'p_sma': 20, 'p_std': 20, 'p_atr': 27, 'p_adx': 12, 'rsi_period': 12, 'ema1': 26, 'ema2': 50, 'slip_atr_k': 0.2085039957337451, 'slip_spread_k': 0.8177547058080946, 'spread_hl_frac': 0.04907931846781395, 'bb_std_mult': 2.410928651524157, 'rsi_os': 8, 'rsi_ob': 92, 'vol_spike': 0.18367724447070896, 'adx_thresh': 18.581525450593166, 'atr_min_pct': 0.021907529466295567, 'atr_max_pct': 0.026562396785671395, 'tp_mult': 1.2000096226351749, 'tsl_mult': 0.40359507517336957, 'strategy': 'mean_reversion', 'time_stop': 30, 'use_sma': True, 'use_atr': False, 'use_adx': False, 'use_ema': True, 'use_spike': True, 'rsi_required': False, 'edge_k': 0.930993726164296, 'edge_cap': 0.9528078498281101, 'bull_strategy': 'mean_reversion', 'bull_bb_std_mult': 2.912434391200545, 'bull_rsi_os': 19, 'bull_rsi_ob': 61, 'bull_adx_thresh': 14.132827632002833, 'bull_atr_min_pct': 0.01537052554781446, 'bull_atr_max_pct': 0.08883934891338305, 'bull_tp_mult': 1.1932511564712778, 'bull_tsl_mult': 0.8779406629717609, 'bull_time_stop': 41, 'bull_use_sma': True, 'bull_use_ema': False, 'bull_use_atr': True, 'bull_use_adx': False, 'bull_use_spike': True, 'bull_rsi_required': False, 'bear_strategy': 'mean_reversion', 'bear_bb_std_mult': 0.5587233875047155, 'bear_rsi_os': 38, 'bear_rsi_ob': 48, 'bear_adx_thresh': 22.802747725126714, 'bear_atr_min_pct': 0.006881788010697464, 'bear_atr_max_pct': 0.046915334269624236, 'bear_tp_mult': 2.6076036992096614, 'bear_tsl_mult': 0.9105371564131504, 'bear_time_stop': 177, 'bear_use_sma': False, 'bear_use_ema': True, 'bear_use_atr': False, 'bear_use_adx': True, 'bear_use_spike': True, 'bear_rsi_required': True, 'sideways_strategy': 'breakout', 'sideways_bb_std_mult': 2.7570422092510354, 'sideways_rsi_os': 35, 'sideways_rsi_ob': 74, 'sideways_adx_thresh': 33.99165714910529, 'sideways_atr_min_pct': 0.003282972479464609, 'sideways_atr_max_pct': 0.07250847616122172, 'sideways_tp_mult': 1.1244089594141127, 'sideways_tsl_mult': 0.7478031296040439, 'sideways_time_stop': 183, 'sideways_use_sma': True, 'sideways_use_ema': False, 'sideways_use_atr': False, 'sideways_use_adx': False, 'sideways_use_spike': False, 'sideways_rsi_required': False}.
[I 2025-08-29 20:34:11,363] Trial 489 finished with values: [-1000000000.0, 1000000000.0] and parameters: {'p_sma': 30, 'p_std': 20, 'p_atr': 15, 'p_adx': 25, 'rsi_period': 75, 'ema1': 26, 'ema2': 45, 'slip_atr_k': 0.07894341451922787, 'slip_spread_k': 0.7063928284125324, 'spread_hl_frac': 0.007389123736522004, 'bb_std_mult': 1.6583422746389251, 'rsi_os': 10, 'rsi_ob': 85, 'vol_spike': 0.19902023543108888, 'adx_thresh': 26.016386795752414, 'atr_min_pct': 0.0022775252794913544, 'atr_max_pct': 0.025885106247235674, 'tp_mult': 1.2043405041155384, 'tsl_mult': 0.9321313400153579, 'strategy': 'mean_reversion', 'time_stop': 28, 'use_sma': True, 'use_atr': False, 'use_adx': False, 'use_ema': True, 'use_spike': True, 'rsi_required': False, 'edge_k': 1.0497896635213593, 'edge_cap': 0.672235230274952, 'bull_strategy': 'mean_reversion', 'bull_bb_std_mult': 2.902758483966466, 'bull_rsi_os': 19, 'bull_rsi_ob': 75, 'bull_adx_thresh': 13.972285171201147, 'bull_atr_min_pct': 0.012738543541031327, 'bull_atr_max_pct': 0.0898637060399854, 'bull_tp_mult': 2.682327260570759, 'bull_tsl_mult': 0.8984617900922988, 'bull_time_stop': 38, 'bull_use_sma': True, 'bull_use_ema': False, 'bull_use_atr': True, 'bull_use_adx': False, 'bull_use_spike': True, 'bull_rsi_required': False, 'bear_strategy': 'breakout', 'bear_bb_std_mult': 2.1950981997286663, 'bear_rsi_os': 30, 'bear_rsi_ob': 60, 'bear_adx_thresh': 30.889868679176985, 'bear_atr_min_pct': 0.029937610665323848, 'bear_atr_max_pct': 0.05394686497702611, 'bear_tp_mult': 2.7149944979249776, 'bear_tsl_mult': 0.23622175392057887, 'bear_time_stop': 285, 'bear_use_sma': False, 'bear_use_ema': True, 'bear_use_atr': False, 'bear_use_adx': True, 'bear_use_spike': True, 'bear_rsi_required': True, 'sideways_strategy': 'breakout', 'sideways_bb_std_mult': 3.2067694633709785, 'sideways_rsi_os': 5, 'sideways_rsi_ob': 72, 'sideways_adx_thresh': 11.45994600017796, 'sideways_atr_min_pct': 0.004652501915823719, 'sideways_atr_max_pct': 0.11042520842886092, 'sideways_tp_mult': 2.592960196239947, 'sideways_tsl_mult': 0.29052358432777536, 'sideways_time_stop': 184, 'sideways_use_sma': True, 'sideways_use_ema': False, 'sideways_use_atr': False, 'sideways_use_adx': False, 'sideways_use_spike': False, 'sideways_rsi_required': False}.
[I 2025-08-29 20:34:41,354] Trial 493 finished with values: [-1000000000.0, 1000000000.0] and parameters: {'p_sma': 18, 'p_std': 55, 'p_atr': 27, 'p_adx': 14, 'rsi_period': 34, 'ema1': 26, 'ema2': 46, 'slip_atr_k': 0.19413613618401235, 'slip_spread_k': 0.7884285189411762, 'spread_hl_frac': 0.04895854325240682, 'bb_std_mult': 2.4358594362384784, 'rsi_os': 8, 'rsi_ob': 50, 'vol_spike': 0.04208891801392252, 'adx_thresh': 13.416487841692536, 'atr_min_pct': 0.004981584473218087, 'atr_max_pct': 0.028669319829319414, 'tp_mult': 1.2195867750652116, 'tsl_mult': 0.861614797179005, 'strategy': 'breakout', 'time_stop': 40, 'use_sma': True, 'use_atr': False, 'use_adx': False, 'use_ema': True, 'use_spike': False, 'rsi_required': False, 'edge_k': 0.6800540852201999, 'edge_cap': 0.955356942524082, 'bull_strategy': 'mean_reversion', 'bull_bb_std_mult': 3.0900979295935675, 'bull_rsi_os': 20, 'bull_rsi_ob': 53, 'bull_adx_thresh': 26.734750770863588, 'bull_atr_min_pct': 0.016388429478593928, 'bull_atr_max_pct': 0.08896450909465949, 'bull_tp_mult': 2.7863916739936294, 'bull_tsl_mult': 0.6628049014542764, 'bull_time_stop': 16, 'bull_use_sma': False, 'bull_use_ema': False, 'bull_use_atr': True, 'bull_use_adx': False, 'bull_use_spike': True, 'bull_rsi_required': False, 'bear_strategy': 'breakout', 'bear_bb_std_mult': 1.6337729054799377, 'bear_rsi_os': 25, 'bear_rsi_ob': 68, 'bear_adx_thresh': 20.063531404812466, 'bear_atr_min_pct': 0.006200120917922732, 'bear_atr_max_pct': 0.04636494252717951, 'bear_tp_mult': 2.5050982624806166, 'bear_tsl_mult': 0.8094121279559205, 'bear_time_stop': 56, 'bear_use_sma': True, 'bear_use_ema': False, 'bear_use_atr': False, 'bear_use_adx': True, 'bear_use_spike': True, 'bear_rsi_required': False, 'sideways_strategy': 'breakout', 'sideways_bb_std_mult': 3.238374618114646, 'sideways_rsi_os': 7, 'sideways_rsi_ob': 95, 'sideways_adx_thresh': 33.744952277856974, 'sideways_atr_min_pct': 0.005503650159668875, 'sideways_atr_max_pct': 0.020675006124890545, 'sideways_tp_mult': 1.2990749973598605, 'sideways_tsl_mult': 0.34241843680597284, 'sideways_time_stop': 191, 'sideways_use_sma': False, 'sideways_use_ema': False, 'sideways_use_atr': False, 'sideways_use_adx': True, 'sideways_use_spike': True, 'sideways_rsi_required': False}.
[I 2025-08-29 20:34:41,535] Trial 492 finished with values: [-0.005173767744497293, 0.005174466129130101] and parameters: {'p_sma': 52, 'p_std': 55, 'p_atr': 8, 'p_adx': 14, 'rsi_period': 31, 'ema1': 26, 'ema2': 46, 'slip_atr_k': 0.07737966180798145, 'slip_spread_k': 0.804226934665762, 'spread_hl_frac': 0.04908561274186799, 'bb_std_mult': 1.8028080042771948, 'rsi_os': 8, 'rsi_ob': 84, 'vol_spike': 0.19832645238959543, 'adx_thresh': 13.274556898261947, 'atr_min_pct': 7.451283479778005e-05, 'atr_max_pct': 0.027786207675231628, 'tp_mult': 2.8395711470618203, 'tsl_mult': 0.2794413663110745, 'strategy': 'mean_reversion', 'time_stop': 153, 'use_sma': True, 'use_atr': False, 'use_adx': False, 'use_ema': True, 'use_spike': True, 'rsi_required': False, 'edge_k': 0.6978672951328562, 'edge_cap': 0.19966562095671087, 'bull_strategy': 'mean_reversion', 'bull_bb_std_mult': 3.0811938893237976, 'bull_rsi_os': 16, 'bull_rsi_ob': 58, 'bull_adx_thresh': 22.91474390211058, 'bull_atr_min_pct': 0.025550123986188007, 'bull_atr_max_pct': 0.08783699713603071, 'bull_tp_mult': 2.2408792060622886, 'bull_tsl_mult': 0.6526303718126572, 'bull_time_stop': 16, 'bull_use_sma': False, 'bull_use_ema': False, 'bull_use_atr': True, 'bull_use_adx': False, 'bull_use_spike': True, 'bull_rsi_required': False, 'bear_strategy': 'breakout', 'bear_bb_std_mult': 3.1248784078358245, 'bear_rsi_os': 38, 'bear_rsi_ob': 68, 'bear_adx_thresh': 22.707880845657293, 'bear_atr_min_pct': 0.016033520781924302, 'bear_atr_max_pct': 0.04659898472640113, 'bear_tp_mult': 1.379274063439321, 'bear_tsl_mult': 0.8135147286368067, 'bear_time_stop': 177, 'bear_use_sma': False, 'bear_use_ema': False, 'bear_use_atr': False, 'bear_use_adx': True, 'bear_use_spike': True, 'bear_rsi_required': True, 'sideways_strategy': 'breakout', 'sideways_bb_std_mult': 2.3239336647294344, 'sideways_rsi_os': 35, 'sideways_rsi_ob': 69, 'sideways_adx_thresh': 32.47184601199386, 'sideways_atr_min_pct': 0.005488695403995285, 'sideways_atr_max_pct': 0.13933647494352114, 'sideways_tp_mult': 1.2933846495731083, 'sideways_tsl_mult': 0.5485875865314503, 'sideways_time_stop': 191, 'sideways_use_sma': False, 'sideways_use_ema': False, 'sideways_use_atr': False, 'sideways_use_adx': False, 'sideways_use_spike': False, 'sideways_rsi_required': False}.
[I 2025-08-29 20:34:41,648] Trial 495 finished with values: [-0.00545096576857218, 0.005470192865395923] and parameters: {'p_sma': 46, 'p_std': 56, 'p_atr': 19, 'p_adx': 19, 'rsi_period': 54, 'ema1': 26, 'ema2': 25, 'slip_atr_k': 0.11635741813250834, 'slip_spread_k': 0.14342356881748108, 'spread_hl_frac': 0.04843378434181549, 'bb_std_mult': 1.7998599231921923, 'rsi_os': 8, 'rsi_ob': 84, 'vol_spike': 0.05154806363054208, 'adx_thresh': 13.310921501645936, 'atr_min_pct': 0.02013170725219083, 'atr_max_pct': 0.029368081624298967, 'tp_mult': 1.0489396530267439, 'tsl_mult': 0.11698791818735127, 'strategy': 'breakout', 'time_stop': 164, 'use_sma': True, 'use_atr': False, 'use_adx': True, 'use_ema': True, 'use_spike': False, 'rsi_required': False, 'edge_k': 1.0900434530554857, 'edge_cap': 0.902013226706611, 'bull_strategy': 'mean_reversion', 'bull_bb_std_mult': 2.586584665668865, 'bull_rsi_os': 15, 'bull_rsi_ob': 74, 'bull_adx_thresh': 22.61195765609644, 'bull_atr_min_pct': 0.0035438403277355153, 'bull_atr_max_pct': 0.12042534196154317, 'bull_tp_mult': 2.7864169170668727, 'bull_tsl_mult': 0.8466957326725489, 'bull_time_stop': 31, 'bull_use_sma': False, 'bull_use_ema': False, 'bull_use_atr': True, 'bull_use_adx': False, 'bull_use_spike': True, 'bull_rsi_required': False, 'bear_strategy': 'breakout', 'bear_bb_std_mult': 2.5979525575553124, 'bear_rsi_os': 25, 'bear_rsi_ob': 51, 'bear_adx_thresh': 25.0554651915553, 'bear_atr_min_pct': 0.0007170545370066995, 'bear_atr_max_pct': 0.04206509906872942, 'bear_tp_mult': 1.200206745898992, 'bear_tsl_mult': 0.0642506115211649, 'bear_time_stop': 55, 'bear_use_sma': True, 'bear_use_ema': False, 'bear_use_atr': False, 'bear_use_adx': True, 'bear_use_spike': True, 'bear_rsi_required': False, 'sideways_strategy': 'breakout', 'sideways_bb_std_mult': 2.3085064489154297, 'sideways_rsi_os': 40, 'sideways_rsi_ob': 62, 'sideways_adx_thresh': 33.90659308021884, 'sideways_atr_min_pct': 0.023955531444688788, 'sideways_atr_max_pct': 0.02198201014523684, 'sideways_tp_mult': 1.0112296124822433, 'sideways_tsl_mult': 0.7132517822023489, 'sideways_time_stop': 192, 'sideways_use_sma': False, 'sideways_use_ema': False, 'sideways_use_atr': False, 'sideways_use_adx': True, 'sideways_use_spike': True, 'sideways_rsi_required': True}.
