[I 2025-08-29 20:00:41,047] Trial 207 finished with values: [-1000000000.0, 1000000000.0] and parameters: {'p_sma': 20, 'p_std': 52, 'p_atr': 23, 'p_adx': 8, 'rsi_period': 68, 'ema1': 17, 'ema2': 51, 'slip_atr_k': 0.04511149945892107, 'slip_spread_k': 0.3383770764182466, 'spread_hl_frac': 0.004245225744135626, 'bb_std_mult': 2.6414278426578695, 'rsi_os': 27, 'rsi_ob': 67, 'vol_spike': 0.29986579323740215, 'adx_thresh': 29.97055676041584, 'atr_min_pct': 0.023929148842172357, 'atr_max_pct': 0.08807328111668367, 'tp_mult': 2.4212880019303746, 'tsl_mult': 0.7108961000864399, 'strategy': 'mean_reversion', 'time_stop': 93, 'use_sma': False, 'use_atr': True, 'use_adx': True, 'use_ema': False, 'use_spike': True, 'rsi_required': True, 'edge_k': 0.7574252355782354, 'edge_cap': 0.46485025119014106, 'bull_strategy': 'mean_reversion', 'bull_bb_std_mult': 0.7556370933802813, 'bull_rsi_os': 27, 'bull_rsi_ob': 95, 'bull_adx_thresh': 25.541489947704914, 'bull_atr_min_pct': 0.003028221742990167, 'bull_atr_max_pct': 0.06558447238393042, 'bull_tp_mult': 1.634331957246147, 'bull_tsl_mult': 0.14629967355423762, 'bull_time_stop': 285, 'bull_use_sma': True, 'bull_use_ema': True, 'bull_use_atr': False, 'bull_use_adx': True, 'bull_use_spike': True, 'bull_rsi_required': True, 'bear_strategy': 'mean_reversion', 'bear_bb_std_mult': 0.717877046809436, 'bear_rsi_os': 18, 'bear_rsi_ob': 68, 'bear_adx_thresh': 5.56847260248705, 'bear_atr_min_pct': 0.006287615357820764, 'bear_atr_max_pct': 0.13606857996881155, 'bear_tp_mult': 1.8513858543654391, 'bear_tsl_mult': 0.051446186049829534, 'bear_time_stop': 117, 'bear_use_sma': True, 'bear_use_ema': False, 'bear_use_atr': False, 'bear_use_adx': False, 'bear_use_spike': False, 'bear_rsi_required': False, 'sideways_strategy': 'breakout', 'sideways_bb_std_mult': 1.9955732756589812, 'sideways_rsi_os': 29, 'sideways_rsi_ob': 84, 'sideways_adx_thresh': 18.51109495365138, 'sideways_atr_min_pct': 0.01128221810432788, 'sideways_atr_max_pct': 0.02620763261570805, 'sideways_tp_mult': 2.1388402615169295, 'sideways_tsl_mult': 0.21236654456977425, 'sideways_time_stop': 261, 'sideways_use_sma': False, 'sideways_use_ema': True, 'sideways_use_atr': True, 'sideways_use_adx': False, 'sideways_use_spike': False, 'sideways_rsi_required': True}.
[I 2025-08-29 20:00:41,241] Trial 208 finished with values: [-1000000000.0, 1000000000.0] and parameters: {'p_sma': 20, 'p_std': 52, 'p_atr': 23, 'p_adx': 16, 'rsi_period': 18, 'ema1': 13, 'ema2': 43, 'slip_atr_k': 0.04354031661178867, 'slip_spread_k': 0.6443530691683351, 'spread_hl_frac': 0.0042747443977288425, 'bb_std_mult': 2.630627993808992, 'rsi_os': 22, 'rsi_ob': 67, 'vol_spike': 0.1458323465157844, 'adx_thresh': 33.482834076194806, 'atr_min_pct': 0.013457774896197035, 'atr_max_pct': 0.07277386598291671, 'tp_mult': 2.411925665844648, 'tsl_mult': 0.7103961234877845, 'strategy': 'mean_reversion', 'time_stop': 100, 'use_sma': False, 'use_atr': True, 'use_adx': True, 'use_ema': False, 'use_spike': True, 'rsi_required': True, 'edge_k': 1.321710834042046, 'edge_cap': 0.30706395875703063, 'bull_strategy': 'mean_reversion', 'bull_bb_std_mult': 0.7378927058930413, 'bull_rsi_os': 41, 'bull_rsi_ob': 95, 'bull_adx_thresh': 17.396460122340514, 'bull_atr_min_pct': 0.02339249612758366, 'bull_atr_max_pct': 0.06551031469268198, 'bull_tp_mult': 2.1462080896012456, 'bull_tsl_mult': 0.7959660551299464, 'bull_time_stop': 275, 'bull_use_sma': True, 'bull_use_ema': True, 'bull_use_atr': False, 'bull_use_adx': True, 'bull_use_spike': True, 'bull_rsi_required': False, 'bear_strategy': 'mean_reversion', 'bear_bb_std_mult': 1.576709630916398, 'bear_rsi_os': 18, 'bear_rsi_ob': 46, 'bear_adx_thresh': 6.692244481123973, 'bear_atr_min_pct': 0.006294373707404676, 'bear_atr_max_pct': 0.10098002404826077, 'bear_tp_mult': 1.9456058968150403, 'bear_tsl_mult': 0.6130403792940662, 'bear_time_stop': 128, 'bear_use_sma': True, 'bear_use_ema': False, 'bear_use_atr': False, 'bear_use_adx': False, 'bear_use_spike': False, 'bear_rsi_required': False, 'sideways_strategy': 'breakout', 'sideways_bb_std_mult': 1.5660040498104077, 'sideways_rsi_os': 22, 'sideways_rsi_ob': 83, 'sideways_adx_thresh': 8.824057154981183, 'sideways_atr_min_pct': 0.010813295751804928, 'sideways_atr_max_pct': 0.12002636911592035, 'sideways_tp_mult': 2.160795303718728, 'sideways_tsl_mult': 0.09709527522255057, 'sideways_time_stop': 262, 'sideways_use_sma': True, 'sideways_use_ema': True, 'sideways_use_atr': True, 'sideways_use_adx': False, 'sideways_use_spike': False, 'sideways_rsi_required': True}.
[I 2025-08-29 20:01:11,780] Trial 211 finished with values: [-0.0474049684350335, 0.04732342681652177] and parameters: {'p_sma': 39, 'p_std': 40, 'p_atr': 18, 'p_adx': 12, 'rsi_period': 18, 'ema1': 12, 'ema2': 43, 'slip_atr_k': 0.14000847724952223, 'slip_spread_k': 0.25676909484295324, 'spread_hl_frac': 0.013707790850029872, 'bb_std_mult': 0.5497821859263394, 'rsi_os': 22, 'rsi_ob': 64, 'vol_spike': 0.18263302058826192, 'adx_thresh': 27.133628242162317, 'atr_min_pct': 0.013128652801171422, 'atr_max_pct': 0.09236490326426577, 'tp_mult': 2.4112667281897364, 'tsl_mult': 0.1675470451660982, 'strategy': 'breakout', 'time_stop': 103, 'use_sma': False, 'use_atr': False, 'use_adx': False, 'use_ema': False, 'use_spike': False, 'rsi_required': True, 'edge_k': 1.0771519038255795, 'edge_cap': 0.49158103456723273, 'bull_strategy': 'breakout', 'bull_bb_std_mult': 1.0104981247083187, 'bull_rsi_os': 44, 'bull_rsi_ob': 64, 'bull_adx_thresh': 17.429867902422437, 'bull_atr_min_pct': 0.024397034567894965, 'bull_atr_max_pct': 0.06053185354056108, 'bull_tp_mult': 2.568258993214497, 'bull_tsl_mult': 0.2022283009090186, 'bull_time_stop': 275, 'bull_use_sma': False, 'bull_use_ema': True, 'bull_use_atr': False, 'bull_use_adx': True, 'bull_use_spike': False, 'bull_rsi_required': True, 'bear_strategy': 'mean_reversion', 'bear_bb_std_mult': 1.5929327679298686, 'bear_rsi_os': 29, 'bear_rsi_ob': 46, 'bear_adx_thresh': 8.142102214514846, 'bear_atr_min_pct': 0.0034714769578221456, 'bear_atr_max_pct': 0.1091777151796714, 'bear_tp_mult': 1.7950533371505057, 'bear_tsl_mult': 0.6039874871009755, 'bear_time_stop': 11, 'bear_use_sma': False, 'bear_use_ema': False, 'bear_use_atr': True, 'bear_use_adx': False, 'bear_use_spike': False, 'bear_rsi_required': False, 'sideways_strategy': 'breakout', 'sideways_bb_std_mult': 1.959747369920417, 'sideways_rsi_os': 28, 'sideways_rsi_ob': 81, 'sideways_adx_thresh': 32.44745282183418, 'sideways_atr_min_pct': 0.0024544260163532946, 'sideways_atr_max_pct': 0.13095394418943032, 'sideways_tp_mult': 1.481485689725782, 'sideways_tsl_mult': 0.08168456313097339, 'sideways_time_stop': 145, 'sideways_use_sma': True, 'sideways_use_ema': True, 'sideways_use_atr': True, 'sideways_use_adx': False, 'sideways_use_spike': True, 'sideways_rsi_required': False}.
[I 2025-08-29 20:01:11,781] Trial 209 finished with values: [-1000000000.0, 1000000000.0] and parameters: {'p_sma': 41, 'p_std': 40, 'p_atr': 23, 'p_adx': 8, 'rsi_period': 18, 'ema1': 12, 'ema2': 43, 'slip_atr_k': 0.046558029538762744, 'slip_spread_k': 0.3392121895113345, 'spread_hl_frac': 0.0415685132518987, 'bb_std_mult': 1.29690078052318, 'rsi_os': 22, 'rsi_ob': 67, 'vol_spike': 0.14558692883232366, 'adx_thresh': 19.101057638016844, 'atr_min_pct': 0.011185606229979312, 'atr_max_pct': 0.10322827622688137, 'tp_mult': 2.419396857009223, 'tsl_mult': 0.6587830511350274, 'strategy': 'breakout', 'time_stop': 103, 'use_sma': False, 'use_atr': False, 'use_adx': True, 'use_ema': False, 'use_spike': True, 'rsi_required': True, 'edge_k': 1.6418729714359572, 'edge_cap': 0.818752442015238, 'bull_strategy': 'mean_reversion', 'bull_bb_std_mult': 0.6962751538837586, 'bull_rsi_os': 44, 'bull_rsi_ob': 95, 'bull_adx_thresh': 27.786908963341197, 'bull_atr_min_pct': 0.024585988048280636, 'bull_atr_max_pct': 0.061351033740258104, 'bull_tp_mult': 2.507235656241876, 'bull_tsl_mult': 0.7983593090876941, 'bull_time_stop': 20, 'bull_use_sma': True, 'bull_use_ema': True, 'bull_use_atr': False, 'bull_use_adx': True, 'bull_use_spike': True, 'bull_rsi_required': True, 'bear_strategy': 'mean_reversion', 'bear_bb_std_mult': 2.073412301167948, 'bear_rsi_os': 28, 'bear_rsi_ob': 68, 'bear_adx_thresh': 17.181483783770513, 'bear_atr_min_pct': 0.012480758410099466, 'bear_atr_max_pct': 0.06074244348541533, 'bear_tp_mult': 1.2141499372547933, 'bear_tsl_mult': 0.32358804393043383, 'bear_time_stop': 115, 'bear_use_sma': True, 'bear_use_ema': False, 'bear_use_atr': True, 'bear_use_adx': False, 'bear_use_spike': False, 'bear_rsi_required': False, 'sideways_strategy': 'breakout', 'sideways_bb_std_mult': 2.5271831012787604, 'sideways_rsi_os': 29, 'sideways_rsi_ob': 85, 'sideways_adx_thresh': 26.418424831659866, 'sideways_atr_min_pct': 0.026774955496316026, 'sideways_atr_max_pct': 0.13058781930645247, 'sideways_tp_mult': 2.16294874162563, 'sideways_tsl_mult': 0.09618872489363836, 'sideways_time_stop': 261, 'sideways_use_sma': True, 'sideways_use_ema': True, 'sideways_use_atr': True, 'sideways_use_adx': False, 'sideways_use_spike': True, 'sideways_rsi_required': False}.
[I 2025-08-29 20:01:11,999] Trial 210 finished with values: [-1000000000.0, 1000000000.0] and parameters: {'p_sma': 39, 'p_std': 34, 'p_atr': 18, 'p_adx': 16, 'rsi_period': 25, 'ema1': 17, 'ema2': 43, 'slip_atr_k': 0.04900285586763517, 'slip_spread_k': 0.2691319076185494, 'spread_hl_frac': 0.00480299579016867, 'bb_std_mult': 1.2507369631370144, 'rsi_os': 22, 'rsi_ob': 67, 'vol_spike': 0.14643860374176781, 'adx_thresh': 33.52097960742322, 'atr_min_pct': 0.013392707877583235, 'atr_max_pct': 0.06803966524584525, 'tp_mult': 1.3409246556504244, 'tsl_mult': 0.8422198517246287, 'strategy': 'mean_reversion', 'time_stop': 103, 'use_sma': False, 'use_atr': False, 'use_adx': True, 'use_ema': False, 'use_spike': False, 'rsi_required': True, 'edge_k': 1.316588126327192, 'edge_cap': 0.3034385593418827, 'bull_strategy': 'mean_reversion', 'bull_bb_std_mult': 1.0143532728628528, 'bull_rsi_os': 27, 'bull_rsi_ob': 66, 'bull_adx_thresh': 17.541376090047233, 'bull_atr_min_pct': 0.023233822297240775, 'bull_atr_max_pct': 0.06565926178079547, 'bull_tp_mult': 2.516591101044498, 'bull_tsl_mult': 0.20612526846489898, 'bull_time_stop': 285, 'bull_use_sma': True, 'bull_use_ema': True, 'bull_use_atr': False, 'bull_use_adx': True, 'bull_use_spike': True, 'bull_rsi_required': True, 'bear_strategy': 'mean_reversion', 'bear_bb_std_mult': 2.092084944956932, 'bear_rsi_os': 29, 'bear_rsi_ob': 68, 'bear_adx_thresh': 34.986486064568126, 'bear_atr_min_pct': 0.006280232660424152, 'bear_atr_max_pct': 0.10849889223952304, 'bear_tp_mult': 1.6918364443111762, 'bear_tsl_mult': 0.6058884194439351, 'bear_time_stop': 12, 'bear_use_sma': True, 'bear_use_ema': False, 'bear_use_atr': True, 'bear_use_adx': False, 'bear_use_spike': False, 'bear_rsi_required': False, 'sideways_strategy': 'breakout', 'sideways_bb_std_mult': 0.6812713090065459, 'sideways_rsi_os': 22, 'sideways_rsi_ob': 84, 'sideways_adx_thresh': 17.481705419665115, 'sideways_atr_min_pct': 0.026952563099780818, 'sideways_atr_max_pct': 0.1310199215599737, 'sideways_tp_mult': 1.9943009307140789, 'sideways_tsl_mult': 0.40569872604307666, 'sideways_time_stop': 261, 'sideways_use_sma': True, 'sideways_use_ema': True, 'sideways_use_atr': True, 'sideways_use_adx': False, 'sideways_use_spike': True, 'sideways_rsi_required': True}.
[I 2025-08-29 20:01:12,308] Trial 212 finished with values: [-1000000000.0, 1000000000.0] and parameters: {'p_sma': 39, 'p_std': 54, 'p_atr': 22, 'p_adx': 17, 'rsi_period': 25, 'ema1': 12, 'ema2': 48, 'slip_atr_k': 0.05067460705834528, 'slip_spread_k': 0.9989687548703929, 'spread_hl_frac': 0.01363065597738096, 'bb_std_mult': 2.1591016800660903, 'rsi_os': 21, 'rsi_ob': 93, 'vol_spike': 0.18330961632257028, 'adx_thresh': 10.125567886585364, 'atr_min_pct': 0.010990231639091932, 'atr_max_pct': 0.09236010922305422, 'tp_mult': 2.436749795889792, 'tsl_mult': 0.20182642006054136, 'strategy': 'breakout', 'time_stop': 104, 'use_sma': False, 'use_atr': False, 'use_adx': False, 'use_ema': False, 'use_spike': False, 'rsi_required': True, 'edge_k': 1.3534697071793818, 'edge_cap': 0.33647815933589775, 'bull_strategy': 'breakout', 'bull_bb_std_mult': 1.6791626071786898, 'bull_rsi_os': 44, 'bull_rsi_ob': 66, 'bull_adx_thresh': 18.04571176555594, 'bull_atr_min_pct': 0.027855283941054756, 'bull_atr_max_pct': 0.06063695181075866, 'bull_tp_mult': 1.288538062710714, 'bull_tsl_mult': 0.20926477149771472, 'bull_time_stop': 18, 'bull_use_sma': False, 'bull_use_ema': True, 'bull_use_atr': False, 'bull_use_adx': True, 'bull_use_spike': False, 'bull_rsi_required': True, 'bear_strategy': 'breakout', 'bear_bb_std_mult': 2.093070801861269, 'bear_rsi_os': 29, 'bear_rsi_ob': 66, 'bear_adx_thresh': 6.194172882698973, 'bear_atr_min_pct': 0.01886749528219011, 'bear_atr_max_pct': 0.10897763006026819, 'bear_tp_mult': 1.2450777115591416, 'bear_tsl_mult': 0.6411058845365982, 'bear_time_stop': 14, 'bear_use_sma': False, 'bear_use_ema': False, 'bear_use_atr': True, 'bear_use_adx': False, 'bear_use_spike': False, 'bear_rsi_required': False, 'sideways_strategy': 'mean_reversion', 'sideways_bb_std_mult': 1.941166022477101, 'sideways_rsi_os': 9, 'sideways_rsi_ob': 81, 'sideways_adx_thresh': 32.39688178602926, 'sideways_atr_min_pct': 0.016626484115063265, 'sideways_atr_max_pct': 0.04228690663709624, 'sideways_tp_mult': 1.4829667896734278, 'sideways_tsl_mult': 0.39807290677989005, 'sideways_time_stop': 143, 'sideways_use_sma': False, 'sideways_use_ema': True, 'sideways_use_atr': True, 'sideways_use_adx': False, 'sideways_use_spike': True, 'sideways_rsi_required': False}.
[I 2025-08-29 20:01:41,235] Trial 215 finished with values: [-1000000000.0, 1000000000.0] and parameters: {'p_sma': 38, 'p_std': 54, 'p_atr': 22, 'p_adx': 17, 'rsi_period': 20, 'ema1': 11, 'ema2': 20, 'slip_atr_k': 0.03346738682173408, 'slip_spread_k': 0.006950276856754978, 'spread_hl_frac': 0.0015401083186236328, 'bb_std_mult': 0.8573686444023936, 'rsi_os': 20, 'rsi_ob': 69, 'vol_spike': 0.1626804557356578, 'adx_thresh': 34.181815231557174, 'atr_min_pct': 0.014896430422355396, 'atr_max_pct': 0.08789382335795105, 'tp_mult': 1.7952196840565513, 'tsl_mult': 0.562812847897426, 'strategy': 'mean_reversion', 'time_stop': 111, 'use_sma': False, 'use_atr': True, 'use_adx': False, 'use_ema': True, 'use_spike': False, 'rsi_required': True, 'edge_k': 0.9164694793042268, 'edge_cap': 0.10760904894374002, 'bull_strategy': 'breakout', 'bull_bb_std_mult': 1.6887861279394567, 'bull_rsi_os': 45, 'bull_rsi_ob': 93, 'bull_adx_thresh': 18.282895989186397, 'bull_atr_min_pct': 0.021826654242841376, 'bull_atr_max_pct': 0.1258791810909071, 'bull_tp_mult': 1.522028901953487, 'bull_tsl_mult': 0.16855723056230135, 'bull_time_stop': 284, 'bull_use_sma': False, 'bull_use_ema': True, 'bull_use_atr': True, 'bull_use_adx': False, 'bull_use_spike': False, 'bull_rsi_required': True, 'bear_strategy': 'breakout', 'bear_bb_std_mult': 2.7031250649387015, 'bear_rsi_os': 31, 'bear_rsi_ob': 66, 'bear_adx_thresh': 18.302543688993076, 'bear_atr_min_pct': 0.006851325895059935, 'bear_atr_max_pct': 0.11235739582098145, 'bear_tp_mult': 2.3072390711802013, 'bear_tsl_mult': 0.6466479871540443, 'bear_time_stop': 16, 'bear_use_sma': False, 'bear_use_ema': True, 'bear_use_atr': True, 'bear_use_adx': True, 'bear_use_spike': True, 'bear_rsi_required': True, 'sideways_strategy': 'mean_reversion', 'sideways_bb_std_mult': 1.9550494630912514, 'sideways_rsi_os': 33, 'sideways_rsi_ob': 79, 'sideways_adx_thresh': 30.449807066709536, 'sideways_atr_min_pct': 0.01889219879725068, 'sideways_atr_max_pct': 0.12708098427592643, 'sideways_tp_mult': 2.071742697634329, 'sideways_tsl_mult': 0.37908547548851845, 'sideways_time_stop': 268, 'sideways_use_sma': False, 'sideways_use_ema': False, 'sideways_use_atr': True, 'sideways_use_adx': True, 'sideways_use_spike': False, 'sideways_rsi_required': True}.
[I 2025-08-29 20:01:41,907] Trial 216 finished with values: [-1000000000.0, 1000000000.0] and parameters: {'p_sma': 27, 'p_std': 55, 'p_atr': 22, 'p_adx': 15, 'rsi_period': 74, 'ema1': 11, 'ema2': 18, 'slip_atr_k': 0.03536826272288083, 'slip_spread_k': 0.007524615860224959, 'spread_hl_frac': 0.0029676063682974514, 'bb_std_mult': 2.4786212711157836, 'rsi_os': 36, 'rsi_ob': 69, 'vol_spike': 0.16092321517094835, 'adx_thresh': 25.37580127906278, 'atr_min_pct': 0.0055084499125993645, 'atr_max_pct': 0.12260876842895385, 'tp_mult': 2.785951026755823, 'tsl_mult': 0.5699504333679529, 'strategy': 'mean_reversion', 'time_stop': 111, 'use_sma': True, 'use_atr': True, 'use_adx': False, 'use_ema': True, 'use_spike': False, 'rsi_required': False, 'edge_k': 1.281517860053334, 'edge_cap': 0.7395168615821214, 'bull_strategy': 'breakout', 'bull_bb_std_mult': 0.8488916433593862, 'bull_rsi_os': 37, 'bull_rsi_ob': 74, 'bull_adx_thresh': 19.396455001885784, 'bull_atr_min_pct': 0.021616324314767416, 'bull_atr_max_pct': 0.04078593538328625, 'bull_tp_mult': 1.431334846435251, 'bull_tsl_mult': 0.16975297635230185, 'bull_time_stop': 223, 'bull_use_sma': False, 'bull_use_ema': False, 'bull_use_atr': True, 'bull_use_adx': False, 'bull_use_spike': False, 'bull_rsi_required': True, 'bear_strategy': 'breakout', 'bear_bb_std_mult': 1.6534438894437042, 'bear_rsi_os': 30, 'bear_rsi_ob': 69, 'bear_adx_thresh': 14.732224505063513, 'bear_atr_min_pct': 0.007215351472596705, 'bear_atr_max_pct': 0.08536573895393752, 'bear_tp_mult': 1.519238233827429, 'bear_tsl_mult': 0.812844974229442, 'bear_time_stop': 271, 'bear_use_sma': False, 'bear_use_ema': True, 'bear_use_atr': True, 'bear_use_adx': True, 'bear_use_spike': True, 'bear_rsi_required': True, 'sideways_strategy': 'mean_reversion', 'sideways_bb_std_mult': 1.8790621413883417, 'sideways_rsi_os': 30, 'sideways_rsi_ob': 64, 'sideways_adx_thresh': 29.360434028759936, 'sideways_atr_min_pct': 0.018820992315110533, 'sideways_atr_max_pct': 0.12279812197749733, 'sideways_tp_mult': 2.077613575568106, 'sideways_tsl_mult': 0.4359042104571393, 'sideways_time_stop': 44, 'sideways_use_sma': False, 'sideways_use_ema': False, 'sideways_use_atr': True, 'sideways_use_adx': True, 'sideways_use_spike': False, 'sideways_rsi_required': True}.
[I 2025-08-29 20:01:41,934] Trial 214 finished with values: [-1000000000.0, 1000000000.0] and parameters: {'p_sma': 38, 'p_std': 54, 'p_atr': 25, 'p_adx': 17, 'rsi_period': 20, 'ema1': 11, 'ema2': 14, 'slip_atr_k': 0.03410330174679922, 'slip_spread_k': 0.5214995004711557, 'spread_hl_frac': 0.0031407838021738576, 'bb_std_mult': 0.8782766977848355, 'rsi_os': 35, 'rsi_ob': 69, 'vol_spike': 0.1625825202094701, 'adx_thresh': 34.00140106923531, 'atr_min_pct': 0.025287686155523886, 'atr_max_pct': 0.08805501779780588, 'tp_mult': 1.19022337082948, 'tsl_mult': 0.6336517212110417, 'strategy': 'mean_reversion', 'time_stop': 107, 'use_sma': False, 'use_atr': True, 'use_adx': False, 'use_ema': True, 'use_spike': False, 'rsi_required': True, 'edge_k': 0.3050053604172386, 'edge_cap': 0.2731482080823705, 'bull_strategy': 'breakout', 'bull_bb_std_mult': 1.7058201084946243, 'bull_rsi_os': 17, 'bull_rsi_ob': 53, 'bull_adx_thresh': 10.24587110901665, 'bull_atr_min_pct': 0.015670989508639804, 'bull_atr_max_pct': 0.06254505939300974, 'bull_tp_mult': 1.5072612941053527, 'bull_tsl_mult': 0.8847602978861104, 'bull_time_stop': 284, 'bull_use_sma': False, 'bull_use_ema': True, 'bull_use_atr': False, 'bull_use_adx': False, 'bull_use_spike': False, 'bull_rsi_required': True, 'bear_strategy': 'breakout', 'bear_bb_std_mult': 1.1409347708582018, 'bear_rsi_os': 31, 'bear_rsi_ob': 66, 'bear_adx_thresh': 14.696039814631675, 'bear_atr_min_pct': 0.007284622090450308, 'bear_atr_max_pct': 0.109490946341798, 'bear_tp_mult': 1.9272914283036546, 'bear_tsl_mult': 0.665834368510213, 'bear_time_stop': 270, 'bear_use_sma': False, 'bear_use_ema': False, 'bear_use_atr': True, 'bear_use_adx': True, 'bear_use_spike': False, 'bear_rsi_required': True, 'sideways_strategy': 'mean_reversion', 'sideways_bb_std_mult': 1.901617952727271, 'sideways_rsi_os': 49, 'sideways_rsi_ob': 80, 'sideways_adx_thresh': 30.236724777005655, 'sideways_atr_min_pct': 0.01664156012781417, 'sideways_atr_max_pct': 0.12286679519946327, 'sideways_tp_mult': 2.0644190749428475, 'sideways_tsl_mult': 0.40786735973388893, 'sideways_time_stop': 126, 'sideways_use_sma': False, 'sideways_use_ema': False, 'sideways_use_atr': True, 'sideways_use_adx': False, 'sideways_use_spike': False, 'sideways_rsi_required': True}.
