[I 2025-08-29 21:11:45,368] Trial 817 finished with values: [-1000000000.0, 1000000000.0] and parameters: {'p_sma': 14, 'p_std': 43, 'p_atr': 15, 'p_adx': 8, 'rsi_period': 29, 'ema1': 24, 'ema2': 25, 'slip_atr_k': 0.05107335453434479, 'slip_spread_k': 0.06643379662320655, 'spread_hl_frac': 0.02352383193462776, 'bb_std_mult': 0.9209941268473381, 'rsi_os': 7, 'rsi_ob': 77, 'vol_spike': 0.27783634640696003, 'adx_thresh': 7.7725533721393205, 'atr_min_pct': 0.011746638456784244, 'atr_max_pct': 0.04526620130960888, 'tp_mult': 2.3782844081844443, 'tsl_mult': 0.7609297862376319, 'strategy': 'breakout', 'time_stop': 217, 'use_sma': False, 'use_atr': True, 'use_adx': True, 'use_ema': False, 'use_spike': True, 'rsi_required': True, 'edge_k': 0.8788331165850314, 'edge_cap': 0.30250697198222803, 'bull_strategy': 'breakout', 'bull_bb_std_mult': 2.6694616617721327, 'bull_rsi_os': 23, 'bull_rsi_ob': 66, 'bull_adx_thresh': 22.253960152730908, 'bull_atr_min_pct': 0.01875084795280818, 'bull_atr_max_pct': 0.10258161219408969, 'bull_tp_mult': 2.4185237491454106, 'bull_tsl_mult': 0.9621392283886269, 'bull_time_stop': 196, 'bull_use_sma': False, 'bull_use_ema': True, 'bull_use_atr': False, 'bull_use_adx': True, 'bull_use_spike': False, 'bull_rsi_required': True, 'bear_strategy': 'mean_reversion', 'bear_bb_std_mult': 2.4874465138697524, 'bear_rsi_os': 41, 'bear_rsi_ob': 85, 'bear_adx_thresh': 9.53073276874309, 'bear_atr_min_pct': 0.0143369227629723, 'bear_atr_max_pct': 0.07886933336073412, 'bear_tp_mult': 2.845552265180716, 'bear_tsl_mult': 0.00011780199871532643, 'bear_time_stop': 257, 'bear_use_sma': True, 'bear_use_ema': False, 'bear_use_atr': True, 'bear_use_adx': False, 'bear_use_spike': False, 'bear_rsi_required': True, 'sideways_strategy': 'mean_reversion', 'sideways_bb_std_mult': 3.4372158727772217, 'sideways_rsi_os': 21, 'sideways_rsi_ob': 86, 'sideways_adx_thresh': 12.417527797159488, 'sideways_atr_min_pct': 0.013379045291390638, 'sideways_atr_max_pct': 0.04577612774572981, 'sideways_tp_mult': 2.2395723313822407, 'sideways_tsl_mult': 0.562812740785716, 'sideways_time_stop': 154, 'sideways_use_sma': True, 'sideways_use_ema': False, 'sideways_use_atr': True, 'sideways_use_adx': True, 'sideways_use_spike': True, 'sideways_rsi_required': True}.
[I 2025-08-29 21:12:16,444] Trial 820 finished with values: [-1000000000.0, 1000000000.0] and parameters: {'p_sma': 17, 'p_std': 35, 'p_atr': 15, 'p_adx': 8, 'rsi_period': 30, 'ema1': 24, 'ema2': 25, 'slip_atr_k': 0.0981323926129821, 'slip_spread_k': 0.08813604366332636, 'spread_hl_frac': 0.02585456998871464, 'bb_std_mult': 0.9486557171735942, 'rsi_os': 7, 'rsi_ob': 77, 'vol_spike': 0.28066320487868757, 'adx_thresh': 9.179807076786567, 'atr_min_pct': 0.011883475289076802, 'atr_max_pct': 0.04187594896674362, 'tp_mult': 2.395179229365987, 'tsl_mult': 0.7961676224040941, 'strategy': 'mean_reversion', 'time_stop': 237, 'use_sma': False, 'use_atr': True, 'use_adx': True, 'use_ema': False, 'use_spike': True, 'rsi_required': True, 'edge_k': 0.8880822719416073, 'edge_cap': 0.29868637173259943, 'bull_strategy': 'mean_reversion', 'bull_bb_std_mult': 2.6768366690223138, 'bull_rsi_os': 22, 'bull_rsi_ob': 69, 'bull_adx_thresh': 24.040010701303373, 'bull_atr_min_pct': 0.018786222996042698, 'bull_atr_max_pct': 0.10217863186456262, 'bull_tp_mult': 2.4281401941192065, 'bull_tsl_mult': 0.9600133653220626, 'bull_time_stop': 217, 'bull_use_sma': False, 'bull_use_ema': True, 'bull_use_atr': False, 'bull_use_adx': True, 'bull_use_spike': False, 'bull_rsi_required': True, 'bear_strategy': 'breakout', 'bear_bb_std_mult': 2.456566890031044, 'bear_rsi_os': 40, 'bear_rsi_ob': 86, 'bear_adx_thresh': 15.34971860555104, 'bear_atr_min_pct': 0.014814728109387412, 'bear_atr_max_pct': 0.07725836816704801, 'bear_tp_mult': 2.8766232348100997, 'bear_tsl_mult': 0.003956552450415866, 'bear_time_stop': 258, 'bear_use_sma': False, 'bear_use_ema': False, 'bear_use_atr': True, 'bear_use_adx': False, 'bear_use_spike': False, 'bear_rsi_required': True, 'sideways_strategy': 'mean_reversion', 'sideways_bb_std_mult': 3.540702115000036, 'sideways_rsi_os': 22, 'sideways_rsi_ob': 82, 'sideways_adx_thresh': 12.293430877341912, 'sideways_atr_min_pct': 0.014251132425467673, 'sideways_atr_max_pct': 0.0420745608708745, 'sideways_tp_mult': 2.286372007566031, 'sideways_tsl_mult': 0.6058485543353928, 'sideways_time_stop': 154, 'sideways_use_sma': False, 'sideways_use_ema': False, 'sideways_use_atr': True, 'sideways_use_adx': True, 'sideways_use_spike': True, 'sideways_rsi_required': True}.
[I 2025-08-29 21:12:16,778] Trial 823 finished with values: [-1000000000.0, 1000000000.0] and parameters: {'p_sma': 17, 'p_std': 38, 'p_atr': 15, 'p_adx': 9, 'rsi_period': 33, 'ema1': 24, 'ema2': 27, 'slip_atr_k': 0.1455017581022789, 'slip_spread_k': 0.09721034815307572, 'spread_hl_frac': 0.025656058886841065, 'bb_std_mult': 0.846975360450694, 'rsi_os': 8, 'rsi_ob': 78, 'vol_spike': 0.2887891090017115, 'adx_thresh': 9.14575693660283, 'atr_min_pct': 0.012044396974150365, 'atr_max_pct': 0.03614374123920604, 'tp_mult': 2.4785289753147115, 'tsl_mult': 0.7955246874931918, 'strategy': 'mean_reversion', 'time_stop': 237, 'use_sma': True, 'use_atr': False, 'use_adx': False, 'use_ema': False, 'use_spike': True, 'rsi_required': False, 'edge_k': 0.9286622734187086, 'edge_cap': 0.2325289978923702, 'bull_strategy': 'mean_reversion', 'bull_bb_std_mult': 2.570498357778648, 'bull_rsi_os': 25, 'bull_rsi_ob': 69, 'bull_adx_thresh': 20.862078180992093, 'bull_atr_min_pct': 0.02047449664603794, 'bull_atr_max_pct': 0.10123292615907507, 'bull_tp_mult': 2.377311480417636, 'bull_tsl_mult': 0.9588860815767628, 'bull_time_stop': 217, 'bull_use_sma': True, 'bull_use_ema': False, 'bull_use_atr': False, 'bull_use_adx': True, 'bull_use_spike': True, 'bull_rsi_required': False, 'bear_strategy': 'breakout', 'bear_bb_std_mult': 2.04880584313993, 'bear_rsi_os': 40, 'bear_rsi_ob': 88, 'bear_adx_thresh': 26.085628052272313, 'bear_atr_min_pct': 0.02081442984922404, 'bear_atr_max_pct': 0.08196756423990886, 'bear_tp_mult': 2.9310024072269463, 'bear_tsl_mult': 0.06635961685749955, 'bear_time_stop': 265, 'bear_use_sma': False, 'bear_use_ema': False, 'bear_use_atr': False, 'bear_use_adx': False, 'bear_use_spike': True, 'bear_rsi_required': False, 'sideways_strategy': 'breakout', 'sideways_bb_std_mult': 3.598823090212724, 'sideways_rsi_os': 24, 'sideways_rsi_ob': 82, 'sideways_adx_thresh': 10.733612856133039, 'sideways_atr_min_pct': 0.014257286233540679, 'sideways_atr_max_pct': 0.043100548575412616, 'sideways_tp_mult': 2.377661768879673, 'sideways_tsl_mult': 0.602819860258062, 'sideways_time_stop': 144, 'sideways_use_sma': False, 'sideways_use_ema': True, 'sideways_use_atr': True, 'sideways_use_adx': False, 'sideways_use_spike': False, 'sideways_rsi_required': True}.
[I 2025-08-29 21:12:16,992] Trial 821 finished with values: [-1000000000.0, 1000000000.0] and parameters: {'p_sma': 14, 'p_std': 44, 'p_atr': 15, 'p_adx': 9, 'rsi_period': 29, 'ema1': 24, 'ema2': 25, 'slip_atr_k': 0.1266028637470558, 'slip_spread_k': 0.08742200404532086, 'spread_hl_frac': 0.022368171846880412, 'bb_std_mult': 0.8492860876070872, 'rsi_os': 7, 'rsi_ob': 77, 'vol_spike': 0.28874082296114834, 'adx_thresh': 9.19207176660312, 'atr_min_pct': 0.012718104035517389, 'atr_max_pct': 0.04030884009703149, 'tp_mult': 2.476014699319574, 'tsl_mult': 0.7959242859871598, 'strategy': 'mean_reversion', 'time_stop': 227, 'use_sma': True, 'use_atr': False, 'use_adx': False, 'use_ema': False, 'use_spike': True, 'rsi_required': True, 'edge_k': 0.9109520618535698, 'edge_cap': 0.23396654655049673, 'bull_strategy': 'mean_reversion', 'bull_bb_std_mult': 2.5715662074307435, 'bull_rsi_os': 25, 'bull_rsi_ob': 66, 'bull_adx_thresh': 26.12438953463163, 'bull_atr_min_pct': 0.018958438527735478, 'bull_atr_max_pct': 0.1019212035402293, 'bull_tp_mult': 2.402633773144289, 'bull_tsl_mult': 0.9849225486011962, 'bull_time_stop': 215, 'bull_use_sma': True, 'bull_use_ema': True, 'bull_use_atr': False, 'bull_use_adx': True, 'bull_use_spike': True, 'bull_rsi_required': True, 'bear_strategy': 'breakout', 'bear_bb_std_mult': 1.917946841350437, 'bear_rsi_os': 40, 'bear_rsi_ob': 86, 'bear_adx_thresh': 14.558616523235449, 'bear_atr_min_pct': 0.01568109635206332, 'bear_atr_max_pct': 0.0803048872148049, 'bear_tp_mult': 2.880830924718461, 'bear_tsl_mult': 0.06461052550635249, 'bear_time_stop': 264, 'bear_use_sma': False, 'bear_use_ema': False, 'bear_use_atr': False, 'bear_use_adx': False, 'bear_use_spike': True, 'bear_rsi_required': False, 'sideways_strategy': 'mean_reversion', 'sideways_bb_std_mult': 3.5388423068434527, 'sideways_rsi_os': 22, 'sideways_rsi_ob': 82, 'sideways_adx_thresh': 11.369769012313153, 'sideways_atr_min_pct': 0.014187187644970331, 'sideways_atr_max_pct': 0.04514653829897834, 'sideways_tp_mult': 2.3584315340162103, 'sideways_tsl_mult': 0.6095014566958544, 'sideways_time_stop': 155, 'sideways_use_sma': False, 'sideways_use_ema': True, 'sideways_use_atr': True, 'sideways_use_adx': False, 'sideways_use_spike': False, 'sideways_rsi_required': True}.
[I 2025-08-29 21:12:17,214] Trial 822 finished with values: [-1000000000.0, 1000000000.0] and parameters: {'p_sma': 36, 'p_std': 42, 'p_atr': 15, 'p_adx': 9, 'rsi_period': 29, 'ema1': 24, 'ema2': 27, 'slip_atr_k': 0.14487677310123323, 'slip_spread_k': 0.09496553853174636, 'spread_hl_frac': 0.025986235134272888, 'bb_std_mult': 0.8420016540996226, 'rsi_os': 29, 'rsi_ob': 79, 'vol_spike': 0.28904750204796015, 'adx_thresh': 9.484353648768147, 'atr_min_pct': 0.011820598369583896, 'atr_max_pct': 0.0396875383240988, 'tp_mult': 2.420450742785286, 'tsl_mult': 0.7941053924337413, 'strategy': 'mean_reversion', 'time_stop': 235, 'use_sma': True, 'use_atr': False, 'use_adx': False, 'use_ema': False, 'use_spike': True, 'rsi_required': True, 'edge_k': 0.8896884014464549, 'edge_cap': 0.28508205391428404, 'bull_strategy': 'mean_reversion', 'bull_bb_std_mult': 2.6090683019543923, 'bull_rsi_os': 25, 'bull_rsi_ob': 69, 'bull_adx_thresh': 21.32606394770587, 'bull_atr_min_pct': 0.02054782887979897, 'bull_atr_max_pct': 0.10173984070183943, 'bull_tp_mult': 2.387237726372161, 'bull_tsl_mult': 0.982672163169424, 'bull_time_stop': 216, 'bull_use_sma': True, 'bull_use_ema': False, 'bull_use_atr': False, 'bull_use_adx': True, 'bull_use_spike': True, 'bull_rsi_required': False, 'bear_strategy': 'breakout', 'bear_bb_std_mult': 1.9285318361710755, 'bear_rsi_os': 40, 'bear_rsi_ob': 88, 'bear_adx_thresh': 26.40751162223755, 'bear_atr_min_pct': 0.02935845816838213, 'bear_atr_max_pct': 0.0822762144098586, 'bear_tp_mult': 2.877390893907804, 'bear_tsl_mult': 0.0403259778916315, 'bear_time_stop': 254, 'bear_use_sma': False, 'bear_use_ema': False, 'bear_use_atr': False, 'bear_use_adx': False, 'bear_use_spike': True, 'bear_rsi_required': False, 'sideways_strategy': 'breakout', 'sideways_bb_std_mult': 3.542964111484546, 'sideways_rsi_os': 24, 'sideways_rsi_ob': 82, 'sideways_adx_thresh': 11.72369667436421, 'sideways_atr_min_pct': 0.014402415996057646, 'sideways_atr_max_pct': 0.03773672749630903, 'sideways_tp_mult': 2.3768987584552907, 'sideways_tsl_mult': 0.6069491282350629, 'sideways_time_stop': 157, 'sideways_use_sma': False, 'sideways_use_ema': True, 'sideways_use_atr': True, 'sideways_use_adx': False, 'sideways_use_spike': False, 'sideways_rsi_required': True}.
[I 2025-08-29 21:12:46,362] Trial 827 finished with values: [-0.015296352475949293, 0.01525315769278672] and parameters: {'p_sma': 16, 'p_std': 37, 'p_atr': 14, 'p_adx': 8, 'rsi_period': 33, 'ema1': 24, 'ema2': 26, 'slip_atr_k': 0.015086241552462253, 'slip_spread_k': 0.03790547478232109, 'spread_hl_frac': 0.02217308334458739, 'bb_std_mult': 0.9695668047372376, 'rsi_os': 33, 'rsi_ob': 80, 'vol_spike': 0.27087910485651806, 'adx_thresh': 8.429504539952879, 'atr_min_pct': 0.011145821390809772, 'atr_max_pct': 0.03639301797348902, 'tp_mult': 2.4161714501902987, 'tsl_mult': 0.7680765950130822, 'strategy': 'mean_reversion', 'time_stop': 214, 'use_sma': True, 'use_atr': False, 'use_adx': False, 'use_ema': False, 'use_spike': True, 'rsi_required': False, 'edge_k': 0.9207944223115059, 'edge_cap': 0.2706359568535526, 'bull_strategy': 'mean_reversion', 'bull_bb_std_mult': 2.725904752331764, 'bull_rsi_os': 22, 'bull_rsi_ob': 69, 'bull_adx_thresh': 23.053029984605356, 'bull_atr_min_pct': 0.019800446137347133, 'bull_atr_max_pct': 0.10713569068156441, 'bull_tp_mult': 2.4661009523883473, 'bull_tsl_mult': 0.9992637617768549, 'bull_time_stop': 187, 'bull_use_sma': True, 'bull_use_ema': False, 'bull_use_atr': False, 'bull_use_adx': True, 'bull_use_spike': True, 'bull_rsi_required': False, 'bear_strategy': 'breakout', 'bear_bb_std_mult': 2.0917867645435493, 'bear_rsi_os': 39, 'bear_rsi_ob': 87, 'bear_adx_thresh': 11.937293259542894, 'bear_atr_min_pct': 0.002683264775835437, 'bear_atr_max_pct': 0.07441827677317424, 'bear_tp_mult': 2.9508504998804135, 'bear_tsl_mult': 0.03668861984768236, 'bear_time_stop': 247, 'bear_use_sma': False, 'bear_use_ema': False, 'bear_use_atr': False, 'bear_use_adx': False, 'bear_use_spike': True, 'bear_rsi_required': False, 'sideways_strategy': 'breakout', 'sideways_bb_std_mult': 3.50025787865503, 'sideways_rsi_os': 19, 'sideways_rsi_ob': 87, 'sideways_adx_thresh': 11.448147812430843, 'sideways_atr_min_pct': 0.012822031016293577, 'sideways_atr_max_pct': 0.03725089335398878, 'sideways_tp_mult': 2.310872877913396, 'sideways_tsl_mult': 0.5727618176971814, 'sideways_time_stop': 139, 'sideways_use_sma': False, 'sideways_use_ema': False, 'sideways_use_atr': True, 'sideways_use_adx': False, 'sideways_use_spike': False, 'sideways_rsi_required': True}.
[I 2025-08-29 21:12:46,820] Trial 826 finished with values: [-1000000000.0, 1000000000.0] and parameters: {'p_sma': 16, 'p_std': 27, 'p_atr': 14, 'p_adx': 9, 'rsi_period': 33, 'ema1': 24, 'ema2': 26, 'slip_atr_k': 0.012090894627926936, 'slip_spread_k': 0.03593391084954699, 'spread_hl_frac': 0.021974185869165143, 'bb_std_mult': 0.6545129216346843, 'rsi_os': 40, 'rsi_ob': 79, 'vol_spike': 0.29004661101215584, 'adx_thresh': 8.401621836390287, 'atr_min_pct': 0.0111248264356831, 'atr_max_pct': 0.03583658741837136, 'tp_mult': 2.4167007580357374, 'tsl_mult': 0.7721986469306347, 'strategy': 'mean_reversion', 'time_stop': 231, 'use_sma': True, 'use_atr': False, 'use_adx': False, 'use_ema': False, 'use_spike': True, 'rsi_required': False, 'edge_k': 0.9182827123643906, 'edge_cap': 0.2780973260422524, 'bull_strategy': 'mean_reversion', 'bull_bb_std_mult': 2.746239289576198, 'bull_rsi_os': 24, 'bull_rsi_ob': 68, 'bull_adx_thresh': 26.96062735766831, 'bull_atr_min_pct': 0.017867486974189443, 'bull_atr_max_pct': 0.10636148975430867, 'bull_tp_mult': 2.310896469243141, 'bull_tsl_mult': 0.9783701771193402, 'bull_time_stop': 207, 'bull_use_sma': True, 'bull_use_ema': False, 'bull_use_atr': False, 'bull_use_adx': True, 'bull_use_spike': True, 'bull_rsi_required': False, 'bear_strategy': 'breakout', 'bear_bb_std_mult': 2.328576352988343, 'bear_rsi_os': 39, 'bear_rsi_ob': 88, 'bear_adx_thresh': 13.686927186379208, 'bear_atr_min_pct': 0.0163288003828635, 'bear_atr_max_pct': 0.08426062171750053, 'bear_tp_mult': 2.8353990741779684, 'bear_tsl_mult': 0.04008383207842274, 'bear_time_stop': 254, 'bear_use_sma': False, 'bear_use_ema': False, 'bear_use_atr': False, 'bear_use_adx': False, 'bear_use_spike': True, 'bear_rsi_required': False, 'sideways_strategy': 'breakout', 'sideways_bb_std_mult': 3.5293958235533807, 'sideways_rsi_os': 24, 'sideways_rsi_ob': 85, 'sideways_adx_thresh': 11.455319410933479, 'sideways_atr_min_pct': 0.012927313667945122, 'sideways_atr_max_pct': 0.037423034499144664, 'sideways_tp_mult': 2.3119910696222945, 'sideways_tsl_mult': 0.5593731109408836, 'sideways_time_stop': 138, 'sideways_use_sma': False, 'sideways_use_ema': False, 'sideways_use_atr': True, 'sideways_use_adx': False, 'sideways_use_spike': False, 'sideways_rsi_required': True}.
[I 2025-08-29 21:12:47,386] Trial 825 finished with values: [-1000000000.0, 1000000000.0] and parameters: {'p_sma': 15, 'p_std': 41, 'p_atr': 14, 'p_adx': 9, 'rsi_period': 33, 'ema1': 24, 'ema2': 26, 'slip_atr_k': 0.014718451937848605, 'slip_spread_k': 0.11499575485682056, 'spread_hl_frac': 0.02246240798499687, 'bb_std_mult': 0.6449750560352754, 'rsi_os': 8, 'rsi_ob': 79, 'vol_spike': 0.29009077099061864, 'adx_thresh': 8.37329112583071, 'atr_min_pct': 0.011286695868348505, 'atr_max_pct': 0.04924363332541482, 'tp_mult': 2.4299055300787367, 'tsl_mult': 0.7902777040185351, 'strategy': 'mean_reversion', 'time_stop': 224, 'use_sma': True, 'use_atr': False, 'use_adx': False, 'use_ema': False, 'use_spike': True, 'rsi_required': False, 'edge_k': 0.9222991006392092, 'edge_cap': 0.27588769518141243, 'bull_strategy': 'mean_reversion', 'bull_bb_std_mult': 2.744041834967137, 'bull_rsi_os': 24, 'bull_rsi_ob': 69, 'bull_adx_thresh': 31.082536366668457, 'bull_atr_min_pct': 0.019421967838517937, 'bull_atr_max_pct': 0.10646028004358637, 'bull_tp_mult': 2.2848555435187596, 'bull_tsl_mult': 0.9825142735305844, 'bull_time_stop': 205, 'bull_use_sma': True, 'bull_use_ema': False, 'bull_use_atr': False, 'bull_use_adx': True, 'bull_use_spike': True, 'bull_rsi_required': False, 'bear_strategy': 'breakout', 'bear_bb_std_mult': 1.9313832179287629, 'bear_rsi_os': 39, 'bear_rsi_ob': 87, 'bear_adx_thresh': 26.442943283250646, 'bear_atr_min_pct': 0.015507500623325067, 'bear_atr_max_pct': 0.08119530068472602, 'bear_tp_mult': 2.821511315205022, 'bear_tsl_mult': 0.043368971290289084, 'bear_time_stop': 247, 'bear_use_sma': False, 'bear_use_ema': False, 'bear_use_atr': False, 'bear_use_adx': False, 'bear_use_spike': True, 'bear_rsi_required': False, 'sideways_strategy': 'breakout', 'sideways_bb_std_mult': 3.529198137266931, 'sideways_rsi_os': 23, 'sideways_rsi_ob': 82, 'sideways_adx_thresh': 11.598130844383064, 'sideways_atr_min_pct': 0.01278413599214878, 'sideways_atr_max_pct': 0.03862377159529142, 'sideways_tp_mult': 2.3701156989888195, 'sideways_tsl_mult': 0.5712912205213271, 'sideways_time_stop': 159, 'sideways_use_sma': False, 'sideways_use_ema': True, 'sideways_use_atr': True, 'sideways_use_adx': False, 'sideways_use_spike': False, 'sideways_rsi_required': True}.
[I 2025-08-29 21:12:47,474] Trial 824 finished with values: [-1000000000.0, 1000000000.0] and parameters: {'p_sma': 17, 'p_std': 27, 'p_atr': 13, 'p_adx': 9, 'rsi_period': 33, 'ema1': 24, 'ema2': 27, 'slip_atr_k': 0.14410661114827922, 'slip_spread_k': 0.10979434766014781, 'spread_hl_frac': 0.02213846422410149, 'bb_std_mult': 0.8384790617255551, 'rsi_os': 43, 'rsi_ob': 79, 'vol_spike': 0.28817630845931463, 'adx_thresh': 8.488751297441206, 'atr_min_pct': 0.011260545771910737, 'atr_max_pct': 0.036285117542649487, 'tp_mult': 2.473827851976245, 'tsl_mult': 0.7818371965314412, 'strategy': 'mean_reversion', 'time_stop': 233, 'use_sma': True, 'use_atr': False, 'use_adx': False, 'use_ema': False, 'use_spike': True, 'rsi_required': False, 'edge_k': 0.9364295275257574, 'edge_cap': 0.24525909033200233, 'bull_strategy': 'mean_reversion', 'bull_bb_std_mult': 2.5960063686262287, 'bull_rsi_os': 25, 'bull_rsi_ob': 69, 'bull_adx_thresh': 21.337827760930296, 'bull_atr_min_pct': 0.020569730955170378, 'bull_atr_max_pct': 0.10588779458820403, 'bull_tp_mult': 2.301954480468698, 'bull_tsl_mult': 0.9812143531579933, 'bull_time_stop': 188, 'bull_use_sma': True, 'bull_use_ema': False, 'bull_use_atr': False, 'bull_use_adx': True, 'bull_use_spike': True, 'bull_rsi_required': False, 'bear_strategy': 'breakout', 'bear_bb_std_mult': 2.0767803731167187, 'bear_rsi_os': 40, 'bear_rsi_ob': 88, 'bear_adx_thresh': 26.31177533107539, 'bear_atr_min_pct': 0.024127622335390758, 'bear_atr_max_pct': 0.08288781860101083, 'bear_tp_mult': 2.816178712849577, 'bear_tsl_mult': 0.07091506248560131, 'bear_time_stop': 249, 'bear_use_sma': False, 'bear_use_ema': False, 'bear_use_atr': False, 'bear_use_adx': False, 'bear_use_spike': True, 'bear_rsi_required': False, 'sideways_strategy': 'breakout', 'sideways_bb_std_mult': 3.5185544719420867, 'sideways_rsi_os': 24, 'sideways_rsi_ob': 83, 'sideways_adx_thresh': 11.603437429154653, 'sideways_atr_min_pct': 0.012867524404569002, 'sideways_atr_max_pct': 0.04374482273766546, 'sideways_tp_mult': 2.365479291463947, 'sideways_tsl_mult': 0.6086970415170917, 'sideways_time_stop': 143, 'sideways_use_sma': False, 'sideways_use_ema': True, 'sideways_use_atr': True, 'sideways_use_adx': False, 'sideways_use_spike': False, 'sideways_rsi_required': True}.
