[I 2025-08-30 04:12:40,268] Trial 217 finished with values: [-1000000000.0, 1000000000.0] and parameters: {'p_sma': 9, 'p_std': 52, 'p_atr': 9, 'p_adx': 24, 'rsi_period': 21, 'ema1': 13, 'ema2': 26, 'slip_atr_k': 0.0004993245477139512, 'slip_spread_k': 0.7929370355228906, 'spread_hl_frac': 0.008670860662226113, 'bb_std_mult': 3.518811946118442, 'rsi_os': 23, 'rsi_ob': 68, 'vol_spike': 0.18868450006892917, 'adx_thresh': 33.0089544248203, 'atr_min_pct': 0.022991499206280547, 'atr_max_pct': 0.14601075176336817, 'tp_mult': 1.75808847076995, 'tsl_mult': 0.2007759173629673, 'strategy': 'breakout', 'time_stop': 200, 'use_sma': False, 'use_atr': False, 'use_adx': False, 'use_ema': True, 'use_spike': True, 'rsi_required': False, 'edge_k': 1.5364637737751563, 'edge_cap': 0.5997900807031845}.
[I 2025-08-30 04:12:41,859] Trial 219 finished with values: [-0.014293285152251922, 0.014281149139267398] and parameters: {'p_sma': 11, 'p_std': 52, 'p_atr': 8, 'p_adx': 23, 'rsi_period': 21, 'ema1': 13, 'ema2': 25, 'slip_atr_k': 2.3056479770954333e-05, 'slip_spread_k': 0.786670804409362, 'spread_hl_frac': 0.008882925939238786, 'bb_std_mult': 3.405679070076079, 'rsi_os': 24, 'rsi_ob': 67, 'vol_spike': 0.09469428912007313, 'adx_thresh': 32.62872138739009, 'atr_min_pct': 0.0009322516500955966, 'atr_max_pct': 0.14220638905563593, 'tp_mult': 1.8351738715037844, 'tsl_mult': 0.1568620949706559, 'strategy': 'breakout', 'time_stop': 209, 'use_sma': False, 'use_atr': False, 'use_adx': False, 'use_ema': True, 'use_spike': True, 'rsi_required': False, 'edge_k': 1.5559660792670853, 'edge_cap': 0.5855608534874629}.
[I 2025-08-30 04:12:41,908] Trial 216 finished with values: [-1000000000.0, 1000000000.0] and parameters: {'p_sma': 9, 'p_std': 53, 'p_atr': 9, 'p_adx': 24, 'rsi_period': 20, 'ema1': 13, 'ema2': 28, 'slip_atr_k': 0.01089529522609263, 'slip_spread_k': 0.7736586385510453, 'spread_hl_frac': 0.008679363431764956, 'bb_std_mult': 3.494716438353076, 'rsi_os': 23, 'rsi_ob': 68, 'vol_spike': 0.18274128889733543, 'adx_thresh': 33.115796530424944, 'atr_min_pct': 4.434942159250271e-05, 'atr_max_pct': 0.14585342298243867, 'tp_mult': 1.7936062529384609, 'tsl_mult': 0.22020081324958174, 'strategy': 'breakout', 'time_stop': 198, 'use_sma': False, 'use_atr': False, 'use_adx': False, 'use_ema': True, 'use_spike': True, 'rsi_required': False, 'edge_k': 1.5509127318398213, 'edge_cap': 0.6026363137087983}.
[I 2025-08-30 04:12:42,298] Trial 218 finished with values: [-0.014896388021006013, 0.014938313380840064] and parameters: {'p_sma': 11, 'p_std': 53, 'p_atr': 10, 'p_adx': 23, 'rsi_period': 21, 'ema1': 13, 'ema2': 27, 'slip_atr_k': 0.0009531116199982545, 'slip_spread_k': 0.7813874205799807, 'spread_hl_frac': 0.008299176191245422, 'bb_std_mult': 3.3965386237217396, 'rsi_os': 25, 'rsi_ob': 67, 'vol_spike': 0.19225629455713808, 'adx_thresh': 32.629551049707274, 'atr_min_pct': 0.0008049978203955967, 'atr_max_pct': 0.14245574622197982, 'tp_mult': 1.8045987038868274, 'tsl_mult': 0.23554534119030884, 'strategy': 'breakout', 'time_stop': 198, 'use_sma': False, 'use_atr': False, 'use_adx': False, 'use_ema': True, 'use_spike': True, 'rsi_required': False, 'edge_k': 1.5508003771119188, 'edge_cap': 0.5928433370323476}.
[I 2025-08-30 04:13:30,432] Trial 223 finished with values: [-1000000000.0, 1000000000.0] and parameters: {'p_sma': 11, 'p_std': 52, 'p_atr': 9, 'p_adx': 26, 'rsi_period': 23, 'ema1': 16, 'ema2': 27, 'slip_atr_k': 0.010632026308321874, 'slip_spread_k': 0.7837214251575836, 'spread_hl_frac': 0.009816352524153185, 'bb_std_mult': 3.407750970540096, 'rsi_os': 24, 'rsi_ob': 67, 'vol_spike': 0.19046255564881803, 'adx_thresh': 31.8883980572034, 'atr_min_pct': 0.021797261617998852, 'atr_max_pct': 0.14285627213406543, 'tp_mult': 1.8178644052265165, 'tsl_mult': 0.1530644851334989, 'strategy': 'breakout', 'time_stop': 210, 'use_sma': False, 'use_atr': False, 'use_adx': False, 'use_ema': True, 'use_spike': True, 'rsi_required': False, 'edge_k': 1.3870334034240488, 'edge_cap': 0.5874207503305054}.
[I 2025-08-30 04:13:31,679] Trial 222 finished with values: [-1000000000.0, 1000000000.0] and parameters: {'p_sma': 11, 'p_std': 52, 'p_atr': 7, 'p_adx': 23, 'rsi_period': 22, 'ema1': 16, 'ema2': 27, 'slip_atr_k': 0.009303693276502309, 'slip_spread_k': 0.7805253526254512, 'spread_hl_frac': 0.009779994335157931, 'bb_std_mult': 3.3993873072833023, 'rsi_os': 21, 'rsi_ob': 67, 'vol_spike': 0.1945427473739532, 'adx_thresh': 32.22770725611091, 'atr_min_pct': 0.0009246553732926244, 'atr_max_pct': 0.14193178662914702, 'tp_mult': 1.8151658671488737, 'tsl_mult': 0.2714921603008515, 'strategy': 'breakout', 'time_stop': 211, 'use_sma': False, 'use_atr': False, 'use_adx': False, 'use_ema': True, 'use_spike': True, 'rsi_required': False, 'edge_k': 1.5498608156067477, 'edge_cap': 0.5899904735978039}.
[I 2025-08-30 04:13:31,927] Trial 221 finished with values: [-1000000000.0, 1000000000.0] and parameters: {'p_sma': 11, 'p_std': 52, 'p_atr': 7, 'p_adx': 23, 'rsi_period': 22, 'ema1': 16, 'ema2': 22, 'slip_atr_k': 0.011089861131015191, 'slip_spread_k': 0.7498094421665287, 'spread_hl_frac': 0.009622926964987323, 'bb_std_mult': 3.4163826381817852, 'rsi_os': 21, 'rsi_ob': 67, 'vol_spike': 0.1932209064660975, 'adx_thresh': 32.07774854691513, 'atr_min_pct': 0.02717860320594856, 'atr_max_pct': 0.14174059530457608, 'tp_mult': 1.841561729113997, 'tsl_mult': 0.13339141944249933, 'strategy': 'breakout', 'time_stop': 174, 'use_sma': False, 'use_atr': False, 'use_adx': False, 'use_ema': True, 'use_spike': True, 'rsi_required': False, 'edge_k': 1.4011328975800772, 'edge_cap': 0.6414738430983148}.
[I 2025-08-30 04:13:32,426] Trial 220 finished with values: [-1000000000.0, 1000000000.0] and parameters: {'p_sma': 11, 'p_std': 52, 'p_atr': 7, 'p_adx': 22, 'rsi_period': 22, 'ema1': 16, 'ema2': 22, 'slip_atr_k': 0.008291198504009903, 'slip_spread_k': 0.7849251386017846, 'spread_hl_frac': 0.009633784998656681, 'bb_std_mult': 3.438228678791653, 'rsi_os': 25, 'rsi_ob': 67, 'vol_spike': 0.19261933222242536, 'adx_thresh': 32.2437809043208, 'atr_min_pct': 0.02167430316889148, 'atr_max_pct': 0.14225200832277377, 'tp_mult': 1.8104019753109015, 'tsl_mult': 0.16067847002296287, 'strategy': 'breakout', 'time_stop': 208, 'use_sma': False, 'use_atr': False, 'use_adx': False, 'use_ema': True, 'use_spike': True, 'rsi_required': False, 'edge_k': 1.5529419275072078, 'edge_cap': 0.5965322407979032}.
[I 2025-08-30 04:14:23,472] Trial 224 finished with values: [-1000000000.0, 1000000000.0] and parameters: {'p_sma': 7, 'p_std': 50, 'p_atr': 10, 'p_adx': 26, 'rsi_period': 21, 'ema1': 16, 'ema2': 25, 'slip_atr_k': 0.007626887577230285, 'slip_spread_k': 0.8503952077295884, 'spread_hl_frac': 0.011340032493270145, 'bb_std_mult': 3.4330010330598637, 'rsi_os': 25, 'rsi_ob': 67, 'vol_spike': 0.09380562008917118, 'adx_thresh': 31.867261100523795, 'atr_min_pct': 0.0008122542765212385, 'atr_max_pct': 0.14746797495278555, 'tp_mult': 1.82955804797988, 'tsl_mult': 0.2824527876128638, 'strategy': 'breakout', 'time_stop': 206, 'use_sma': False, 'use_atr': False, 'use_adx': False, 'use_ema': True, 'use_spike': True, 'rsi_required': False, 'edge_k': 1.43615815844814, 'edge_cap': 0.6429866094102453}.
[I 2025-08-30 04:14:23,466] Trial 226 finished with values: [-1000000000.0, 1000000000.0] and parameters: {'p_sma': 7, 'p_std': 50, 'p_atr': 10, 'p_adx': 22, 'rsi_period': 16, 'ema1': 17, 'ema2': 25, 'slip_atr_k': 0.000674562664936461, 'slip_spread_k': 0.7420324089262245, 'spread_hl_frac': 0.011619747411663134, 'bb_std_mult': 3.473411332605005, 'rsi_os': 25, 'rsi_ob': 66, 'vol_spike': 0.18160705113809622, 'adx_thresh': 32.24387024764322, 'atr_min_pct': 0.014571599065732374, 'atr_max_pct': 0.1368441892631436, 'tp_mult': 1.0970357981163188, 'tsl_mult': 0.16571562595627146, 'strategy': 'breakout', 'time_stop': 207, 'use_sma': False, 'use_atr': False, 'use_adx': False, 'use_ema': True, 'use_spike': True, 'rsi_required': False, 'edge_k': 1.4464246686155844, 'edge_cap': 0.6367599913764538}.
[I 2025-08-30 04:14:25,086] Trial 225 finished with values: [-0.014551150948891478, 0.01453704124737545] and parameters: {'p_sma': 7, 'p_std': 50, 'p_atr': 10, 'p_adx': 22, 'rsi_period': 16, 'ema1': 17, 'ema2': 22, 'slip_atr_k': 0.013864798251046641, 'slip_spread_k': 0.8571916806142472, 'spread_hl_frac': 0.011696136523056535, 'bb_std_mult': 3.4299770179929387, 'rsi_os': 25, 'rsi_ob': 67, 'vol_spike': 0.17552324381468665, 'adx_thresh': 32.10150943448172, 'atr_min_pct': 0.0007572033725980602, 'atr_max_pct': 0.13674806973599024, 'tp_mult': 1.8452766073176856, 'tsl_mult': 0.16513834174620623, 'strategy': 'breakout', 'time_stop': 206, 'use_sma': False, 'use_atr': False, 'use_adx': False, 'use_ema': True, 'use_spike': True, 'rsi_required': False, 'edge_k': 1.442664565654202, 'edge_cap': 0.641815865589784}.
[I 2025-08-30 04:14:26,086] Trial 227 finished with values: [-1000000000.0, 1000000000.0] and parameters: {'p_sma': 7, 'p_std': 50, 'p_atr': 10, 'p_adx': 26, 'rsi_period': 17, 'ema1': 18, 'ema2': 33, 'slip_atr_k': 0.018247112399566008, 'slip_spread_k': 0.7417380334386257, 'spread_hl_frac': 0.011106244688522095, 'bb_std_mult': 3.366501542358277, 'rsi_os': 25, 'rsi_ob': 47, 'vol_spike': 0.17713901611376237, 'adx_thresh': 31.72146734076208, 'atr_min_pct': 0.0006576861750258583, 'atr_max_pct': 0.13632259274291825, 'tp_mult': 1.8659267785518476, 'tsl_mult': 0.11535454646593468, 'strategy': 'breakout', 'time_stop': 219, 'use_sma': False, 'use_atr': False, 'use_adx': False, 'use_ema': True, 'use_spike': True, 'rsi_required': False, 'edge_k': 1.4334636902249764, 'edge_cap': 0.6609597456155851}.
[I 2025-08-30 04:15:10,882] Trial 228 finished with values: [-1000000000.0, 1000000000.0] and parameters: {'p_sma': 8, 'p_std': 56, 'p_atr': 9, 'p_adx': 24, 'rsi_period': 18, 'ema1': 17, 'ema2': 29, 'slip_atr_k': 0.01726748641207672, 'slip_spread_k': 0.772100331995348, 'spread_hl_frac': 0.007588424651363591, 'bb_std_mult': 3.3451698527328046, 'rsi_os': 24, 'rsi_ob': 65, 'vol_spike': 0.175767137937578, 'adx_thresh': 24.126887366137442, 'atr_min_pct': 0.02058383051066806, 'atr_max_pct': 0.14620045060154074, 'tp_mult': 1.688894659162525, 'tsl_mult': 0.12071312827237722, 'strategy': 'breakout', 'time_stop': 218, 'use_sma': False, 'use_atr': False, 'use_adx': False, 'use_ema': True, 'use_spike': True, 'rsi_required': False, 'edge_k': 1.630250410014972, 'edge_cap': 0.524988394431396}.
[I 2025-08-30 04:15:11,728] Trial 231 finished with values: [-1000000000.0, 1000000000.0] and parameters: {'p_sma': 9, 'p_std': 55, 'p_atr': 8, 'p_adx': 24, 'rsi_period': 15, 'ema1': 15, 'ema2': 35, 'slip_atr_k': 0.00042208146123122545, 'slip_spread_k': 0.7744160386555686, 'spread_hl_frac': 0.007724235182351616, 'bb_std_mult': 3.5779211949758047, 'rsi_os': 22, 'rsi_ob': 55, 'vol_spike': 0.020707259225833136, 'adx_thresh': 24.17531865595264, 'atr_min_pct': 0.009472013247689507, 'atr_max_pct': 0.14751203537916954, 'tp_mult': 1.5481817050716211, 'tsl_mult': 0.2401512709391451, 'strategy': 'breakout', 'time_stop': 201, 'use_sma': False, 'use_atr': False, 'use_adx': False, 'use_ema': True, 'use_spike': True, 'rsi_required': False, 'edge_k': 1.6111357580267305, 'edge_cap': 0.6230241588161245}.
[I 2025-08-30 04:15:13,056] Trial 230 finished with values: [-0.01600940999892786, 0.016069496454970803] and parameters: {'p_sma': 8, 'p_std': 55, 'p_atr': 8, 'p_adx': 26, 'rsi_period': 18, 'ema1': 12, 'ema2': 35, 'slip_atr_k': 0.017117399330825504, 'slip_spread_k': 0.7681246000485145, 'spread_hl_frac': 0.007238642734978654, 'bb_std_mult': 3.5900221913967263, 'rsi_os': 22, 'rsi_ob': 55, 'vol_spike': 0.1755392457822908, 'adx_thresh': 24.085369362897676, 'atr_min_pct': 0.0005348764206683485, 'atr_max_pct': 0.14699154385009078, 'tp_mult': 1.858087461053314, 'tsl_mult': 0.2581850058691571, 'strategy': 'breakout', 'time_stop': 220, 'use_sma': False, 'use_atr': False, 'use_adx': False, 'use_ema': True, 'use_spike': True, 'rsi_required': False, 'edge_k': 1.566224678685122, 'edge_cap': 0.6626414567545815}.
[I 2025-08-30 04:15:13,691] Trial 229 finished with values: [-0.03337809210678255, 0.03335664786273117] and parameters: {'p_sma': 8, 'p_std': 55, 'p_atr': 8, 'p_adx': 24, 'rsi_period': 19, 'ema1': 13, 'ema2': 30, 'slip_atr_k': 0.0181048148980843, 'slip_spread_k': 0.7723123187997624, 'spread_hl_frac': 0.012326919287883344, 'bb_std_mult': 3.368979107219218, 'rsi_os': 24, 'rsi_ob': 65, 'vol_spike': 0.01745451084331176, 'adx_thresh': 10.54153175757811, 'atr_min_pct': 0.000732710131486047, 'atr_max_pct': 0.14719519172562673, 'tp_mult': 1.6832790379323666, 'tsl_mult': 0.1071880007287998, 'strategy': 'breakout', 'time_stop': 218, 'use_sma': False, 'use_atr': False, 'use_adx': False, 'use_ema': True, 'use_spike': True, 'rsi_required': False, 'edge_k': 1.5024214867122307, 'edge_cap': 0.660970820977681}.
[I 2025-08-30 04:15:58,235] Trial 235 finished with values: [-0.03297494977648041, 0.032954124732848686] and parameters: {'p_sma': 8, 'p_std': 53, 'p_atr': 8, 'p_adx': 25, 'rsi_period': 20, 'ema1': 12, 'ema2': 28, 'slip_atr_k': 0.003969591962463799, 'slip_spread_k': 0.5020687259042022, 'spread_hl_frac': 0.01210110178548864, 'bb_std_mult': 3.373050521115233, 'rsi_os': 24, 'rsi_ob': 66, 'vol_spike': 0.08249335897826425, 'adx_thresh': 13.82095102863593, 'atr_min_pct': 2.0979112496121644e-05, 'atr_max_pct': 0.14369411797827786, 'tp_mult': 2.450261988006239, 'tsl_mult': 0.21046676927750313, 'strategy': 'breakout', 'time_stop': 212, 'use_sma': False, 'use_atr': False, 'use_adx': False, 'use_ema': True, 'use_spike': True, 'rsi_required': False, 'edge_k': 1.4850697662356231, 'edge_cap': 0.4279602160983792}.
[I 2025-08-30 04:15:59,865] Trial 232 finished with values: [-1000000000.0, 1000000000.0] and parameters: {'p_sma': 9, 'p_std': 54, 'p_atr': 8, 'p_adx': 24, 'rsi_period': 25, 'ema1': 15, 'ema2': 30, 'slip_atr_k': 0.0008870141679010882, 'slip_spread_k': 0.7312250409725107, 'spread_hl_frac': 0.01198572542748358, 'bb_std_mult': 3.5805755393067398, 'rsi_os': 22, 'rsi_ob': 55, 'vol_spike': 0.018425577229891965, 'adx_thresh': 32.6356381037895, 'atr_min_pct': 0.000562391058476885, 'atr_max_pct': 0.14434466137309196, 'tp_mult': 1.5588615750186603, 'tsl_mult': 0.24990063579128619, 'strategy': 'breakout', 'time_stop': 198, 'use_sma': False, 'use_atr': False, 'use_adx': False, 'use_ema': True, 'use_spike': True, 'rsi_required': False, 'edge_k': 1.488340427232167, 'edge_cap': 0.6238714508675168}.
[I 2025-08-30 04:16:00,733] Trial 234 finished with values: [-0.02386394645357781, 0.02384261964214421] and parameters: {'p_sma': 9, 'p_std': 53, 'p_atr': 8, 'p_adx': 25, 'rsi_period': 20, 'ema1': 13, 'ema2': 31, 'slip_atr_k': 0.012839162083466405, 'slip_spread_k': 0.5115030653536173, 'spread_hl_frac': 0.012930179662426301, 'bb_std_mult': 3.44927839541728, 'rsi_os': 24, 'rsi_ob': 78, 'vol_spike': 0.13035197471683777, 'adx_thresh': 21.327405465248745, 'atr_min_pct': 0.0005841271195357581, 'atr_max_pct': 0.14401175736027697, 'tp_mult': 1.795589368817139, 'tsl_mult': 0.25542175341913004, 'strategy': 'breakout', 'time_stop': 213, 'use_sma': False, 'use_atr': False, 'use_adx': False, 'use_ema': True, 'use_spike': True, 'rsi_required': False, 'edge_k': 1.5048933595921656, 'edge_cap': 0.8634859512345956}.
[I 2025-08-30 04:16:01,242] Trial 233 finished with values: [-1000000000.0, 1000000000.0] and parameters: {'p_sma': 9, 'p_std': 51, 'p_atr': 8, 'p_adx': 25, 'rsi_period': 25, 'ema1': 12, 'ema2': 30, 'slip_atr_k': 0.013216389998168305, 'slip_spread_k': 0.49991692402114896, 'spread_hl_frac': 0.01298947399615438, 'bb_std_mult': 3.4607235885602505, 'rsi_os': 22, 'rsi_ob': 66, 'vol_spike': 0.12359303246935364, 'adx_thresh': 32.74765828232933, 'atr_min_pct': 3.5175730361360625e-05, 'atr_max_pct': 0.14356102789609454, 'tp_mult': 1.6306500150224306, 'tsl_mult': 0.2110234178833076, 'strategy': 'breakout', 'time_stop': 212, 'use_sma': False, 'use_atr': False, 'use_adx': False, 'use_ema': True, 'use_spike': True, 'rsi_required': False, 'edge_k': 1.4967824073538714, 'edge_cap': 0.10685698410245253}.
[I 2025-08-30 04:16:45,574] Trial 237 finished with values: [-1000000000.0, 1000000000.0] and parameters: {'p_sma': 8, 'p_std': 53, 'p_atr': 9, 'p_adx': 25, 'rsi_period': 20, 'ema1': 13, 'ema2': 28, 'slip_atr_k': 0.005002168017871955, 'slip_spread_k': 0.5051085608067584, 'spread_hl_frac': 0.01242190302556776, 'bb_std_mult': 3.44970678988759, 'rsi_os': 24, 'rsi_ob': 66, 'vol_spike': 0.08364079274812085, 'adx_thresh': 10.422318862358193, 'atr_min_pct': 0.013460731717872711, 'atr_max_pct': 0.14408663254292015, 'tp_mult': 1.6010512942668784, 'tsl_mult': 0.21460467830124624, 'strategy': 'breakout', 'time_stop': 213, 'use_sma': False, 'use_atr': False, 'use_adx': False, 'use_ema': True, 'use_spike': True, 'rsi_required': False, 'edge_k': 1.5070457176533032, 'edge_cap': 0.86486250093164}.
[I 2025-08-30 04:16:45,977] Trial 236 finished with values: [-0.026786431637840225, 0.02676503905387391] and parameters: {'p_sma': 8, 'p_std': 53, 'p_atr': 8, 'p_adx': 25, 'rsi_period': 20, 'ema1': 12, 'ema2': 28, 'slip_atr_k': 0.012711652673464446, 'slip_spread_k': 0.7295224692427992, 'spread_hl_frac': 0.01229134281495905, 'bb_std_mult': 3.460519938573417, 'rsi_os': 22, 'rsi_ob': 66, 'vol_spike': 0.1853992745545505, 'adx_thresh': 13.969344017378042, 'atr_min_pct': 3.8026860140790006e-07, 'atr_max_pct': 0.14327993618002546, 'tp_mult': 2.4570010033443275, 'tsl_mult': 0.21022146519955554, 'strategy': 'breakout', 'time_stop': 213, 'use_sma': False, 'use_atr': False, 'use_adx': False, 'use_ema': True, 'use_spike': True, 'rsi_required': False, 'edge_k': 1.4895052399332394, 'edge_cap': 0.6570197985020345}.
[I 2025-08-30 04:16:47,356] Trial 238 finished with values: [-1000000000.0, 1000000000.0] and parameters: {'p_sma': 12, 'p_std': 53, 'p_atr': 9, 'p_adx': 25, 'rsi_period': 20, 'ema1': 12, 'ema2': 28, 'slip_atr_k': 0.013596671873082779, 'slip_spread_k': 0.7616515342080827, 'spread_hl_frac': 0.012603953680854872, 'bb_std_mult': 3.458824559856847, 'rsi_os': 24, 'rsi_ob': 78, 'vol_spike': 0.18648122114116789, 'adx_thresh': 20.996884248636626, 'atr_min_pct': 0.01945619761217365, 'atr_max_pct': 0.1429054378799762, 'tp_mult': 1.6506051722750688, 'tsl_mult': 0.20213033346966205, 'strategy': 'breakout', 'time_stop': 212, 'use_sma': False, 'use_atr': False, 'use_adx': False, 'use_ema': True, 'use_spike': True, 'rsi_required': False, 'edge_k': 1.5119002723587147, 'edge_cap': 0.22091964888722815}.
[I 2025-08-30 04:16:47,803] Trial 239 finished with values: [-0.030696219230037736, 0.030676630447663163] and parameters: {'p_sma': 8, 'p_std': 53, 'p_atr': 9, 'p_adx': 25, 'rsi_period': 20, 'ema1': 13, 'ema2': 28, 'slip_atr_k': 0.00685617316338696, 'slip_spread_k': 0.4415571640914596, 'spread_hl_frac': 0.010902444757196308, 'bb_std_mult': 3.3730369380914955, 'rsi_os': 24, 'rsi_ob': 89, 'vol_spike': 0.18559624937540967, 'adx_thresh': 10.74524590397844, 'atr_min_pct': 0.0005516675370555122, 'atr_max_pct': 0.14927381228917977, 'tp_mult': 2.5110897444585913, 'tsl_mult': 0.21827822370276223, 'strategy': 'breakout', 'time_stop': 212, 'use_sma': False, 'use_atr': False, 'use_adx': False, 'use_ema': True, 'use_spike': True, 'rsi_required': False, 'edge_k': 1.570177062178229, 'edge_cap': 0.23511185828450326}.
[I 2025-08-30 04:17:31,159] Trial 240 finished with values: [-1000000000.0, 1000000000.0] and parameters: {'p_sma': 6, 'p_std': 53, 'p_atr': 9, 'p_adx': 25, 'rsi_period': 18, 'ema1': 14, 'ema2': 27, 'slip_atr_k': 0.00730775919173238, 'slip_spread_k': 0.7555813215292612, 'spread_hl_frac': 0.011085118697270132, 'bb_std_mult': 3.389246353975055, 'rsi_os': 24, 'rsi_ob': 87, 'vol_spike': 0.1854281246785884, 'adx_thresh': 31.10880579901033, 'atr_min_pct': 0.000709364367700446, 'atr_max_pct': 0.14833784062031197, 'tp_mult': 2.465339981170841, 'tsl_mult': 0.187571099649544, 'strategy': 'breakout', 'time_stop': 202, 'use_sma': False, 'use_atr': False, 'use_adx': False, 'use_ema': True, 'use_spike': True, 'rsi_required': False, 'edge_k': 1.5456729989676745, 'edge_cap': 0.432653963107765}.
[I 2025-08-30 04:17:31,771] Trial 242 finished with values: [-0.030907817492438316, 0.03088666659628381] and parameters: {'p_sma': 6, 'p_std': 51, 'p_atr': 8, 'p_adx': 25, 'rsi_period': 19, 'ema1': 14, 'ema2': 26, 'slip_atr_k': 0.007750429838900745, 'slip_spread_k': 0.8199105931816226, 'spread_hl_frac': 0.010969582063851244, 'bb_std_mult': 3.347136078339706, 'rsi_os': 27, 'rsi_ob': 87, 'vol_spike': 0.13237836423566396, 'adx_thresh': 13.828926044441324, 'atr_min_pct': 0.0006360528249810007, 'atr_max_pct': 0.14926452930006015, 'tp_mult': 2.718340154411347, 'tsl_mult': 0.253408446736555, 'strategy': 'breakout', 'time_stop': 220, 'use_sma': False, 'use_atr': False, 'use_adx': False, 'use_ema': True, 'use_spike': True, 'rsi_required': False, 'edge_k': 1.559533201443652, 'edge_cap': 0.39068046011144697}.
[I 2025-08-30 04:17:32,240] Trial 243 finished with values: [-1000000000.0, 1000000000.0] and parameters: {'p_sma': 10, 'p_std': 51, 'p_atr': 10, 'p_adx': 25, 'rsi_period': 18, 'ema1': 14, 'ema2': 27, 'slip_atr_k': 0.006643941601507532, 'slip_spread_k': 0.8172381248714846, 'spread_hl_frac': 0.014032511495794979, 'bb_std_mult': 3.386949674171355, 'rsi_os': 23, 'rsi_ob': 87, 'vol_spike': 0.18321502697577238, 'adx_thresh': 31.262682058128707, 'atr_min_pct': 0.005611477377502618, 'atr_max_pct': 0.13971195459586183, 'tp_mult': 1.7722862842740459, 'tsl_mult': 0.2554748134506657, 'strategy': 'breakout', 'time_stop': 204, 'use_sma': False, 'use_atr': False, 'use_adx': False, 'use_ema': True, 'use_spike': True, 'rsi_required': False, 'edge_k': 1.5539130977093543, 'edge_cap': 0.1414508414354969}.
