[I 2025-08-30 05:23:08,294] Trial 592 finished with values: [-1000000000.0, 1000000000.0] and parameters: {'p_sma': 9, 'p_std': 40, 'p_atr': 9, 'p_adx': 25, 'rsi_period': 16, 'ema1': 16, 'ema2': 21, 'slip_atr_k': 0.0165651667015599, 'slip_spread_k': 0.732089074063866, 'spread_hl_frac': 0.00479832006754843, 'bb_std_mult': 3.3375001935972364, 'rsi_os': 23, 'rsi_ob': 69, 'vol_spike': 0.03564686837872055, 'adx_thresh': 31.9575442685116, 'atr_min_pct': 0.0013174237521056077, 'atr_max_pct': 0.138881399124988, 'tp_mult': 2.4453203356390545, 'tsl_mult': 0.8961298327129414, 'strategy': 'breakout', 'time_stop': 154, 'use_sma': False, 'use_atr': False, 'use_adx': False, 'use_ema': True, 'use_spike': True, 'rsi_required': False, 'edge_k': 1.4481720616411937, 'edge_cap': 0.6419895350357991}.
[I 2025-08-30 05:23:37,324] Trial 598 finished with values: [-1000000000.0, 0.15062822244599175] and parameters: {'p_sma': 60, 'p_std': 57, 'p_atr': 19, 'p_adx': 9, 'rsi_period': 23, 'ema1': 15, 'ema2': 26, 'slip_atr_k': 0.15677109007471302, 'slip_spread_k': 0.6384871124558312, 'spread_hl_frac': 0.020459739278587692, 'bb_std_mult': 1.32350306558314, 'rsi_os': 21, 'rsi_ob': 66, 'vol_spike': 0.1776875196391272, 'adx_thresh': 31.309178141369443, 'atr_min_pct': 0.0005946076915164172, 'atr_max_pct': 0.14597971650761318, 'tp_mult': 1.7966988718659782, 'tsl_mult': 0.8741555979428128, 'strategy': 'mean_reversion', 'time_stop': 277, 'use_sma': True, 'use_atr': False, 'use_adx': True, 'use_ema': False, 'use_spike': True, 'rsi_required': True, 'edge_k': 1.5818467817048838, 'edge_cap': 0.7554716133848272}.
[I 2025-08-30 05:23:37,410] Trial 597 finished with values: [-1000000000.0, 1000000000.0] and parameters: {'p_sma': 38, 'p_std': 40, 'p_atr': 19, 'p_adx': 9, 'rsi_period': 46, 'ema1': 23, 'ema2': 49, 'slip_atr_k': 0.08248343000333586, 'slip_spread_k': 0.6337772921473466, 'spread_hl_frac': 0.01122975309591486, 'bb_std_mult': 1.2970680558354877, 'rsi_os': 21, 'rsi_ob': 59, 'vol_spike': 0.055469509208936466, 'adx_thresh': 33.64719699922353, 'atr_min_pct': 0.011550385229069406, 'atr_max_pct': 0.09498322481230662, 'tp_mult': 1.792860576262111, 'tsl_mult': 0.22903945879282472, 'strategy': 'mean_reversion', 'time_stop': 134, 'use_sma': True, 'use_atr': False, 'use_adx': True, 'use_ema': False, 'use_spike': True, 'rsi_required': True, 'edge_k': 1.317513635387416, 'edge_cap': 0.7560459179257413}.
[I 2025-08-30 05:23:37,658] Trial 595 finished with values: [-0.013248494985428128, 0.013424647413055962] and parameters: {'p_sma': 11, 'p_std': 43, 'p_atr': 18, 'p_adx': 30, 'rsi_period': 17, 'ema1': 27, 'ema2': 14, 'slip_atr_k': 6.499121621196622e-05, 'slip_spread_k': 0.5915247291435257, 'spread_hl_frac': 0.010369908142705256, 'bb_std_mult': 1.3275843029577725, 'rsi_os': 23, 'rsi_ob': 66, 'vol_spike': 0.18070568160410652, 'adx_thresh': 32.3431133391722, 'atr_min_pct': 1.267096372909663e-05, 'atr_max_pct': 0.07385940503693238, 'tp_mult': 1.9137308174569356, 'tsl_mult': 0.6025145498515563, 'strategy': 'breakout', 'time_stop': 133, 'use_sma': False, 'use_atr': True, 'use_adx': True, 'use_ema': True, 'use_spike': False, 'rsi_required': False, 'edge_k': 1.526558973214985, 'edge_cap': 0.5976724305126399}.
[I 2025-08-30 05:23:37,877] Trial 596 finished with values: [-1000000000.0, 1000000000.0] and parameters: {'p_sma': 60, 'p_std': 40, 'p_atr': 27, 'p_adx': 30, 'rsi_period': 57, 'ema1': 15, 'ema2': 30, 'slip_atr_k': 0.009468802818181353, 'slip_spread_k': 0.5980889710715337, 'spread_hl_frac': 0.02948779319446482, 'bb_std_mult': 1.325359072883641, 'rsi_os': 21, 'rsi_ob': 92, 'vol_spike': 0.2831140024907671, 'adx_thresh': 31.319596782771217, 'atr_min_pct': 0.0005263910439960544, 'atr_max_pct': 0.09532951321080015, 'tp_mult': 2.938104334937246, 'tsl_mult': 0.8958460524464286, 'strategy': 'breakout', 'time_stop': 43, 'use_sma': True, 'use_atr': True, 'use_adx': True, 'use_ema': True, 'use_spike': True, 'rsi_required': False, 'edge_k': 1.4392577999574816, 'edge_cap': 0.6010016644141534}.
[I 2025-08-30 05:23:45,252] Trial 599 finished with values: [-0.056576077233178146, 0.05655960591550065] and parameters: {'p_sma': 53, 'p_std': 51, 'p_atr': 27, 'p_adx': 20, 'rsi_period': 21, 'ema1': 14, 'ema2': 30, 'slip_atr_k': 0.009778181380358957, 'slip_spread_k': 0.30808369572470845, 'spread_hl_frac': 0.01004233982384844, 'bb_std_mult': 3.3532110754781885, 'rsi_os': 26, 'rsi_ob': 67, 'vol_spike': 0.18175006452351508, 'adx_thresh': 32.723361016649235, 'atr_min_pct': 1.7104271855007375e-05, 'atr_max_pct': 0.14513604913610842, 'tp_mult': 2.954859060516328, 'tsl_mult': 0.23286229365080297, 'strategy': 'breakout', 'time_stop': 201, 'use_sma': False, 'use_atr': True, 'use_adx': False, 'use_ema': True, 'use_spike': False, 'rsi_required': False, 'edge_k': 1.469386723341392, 'edge_cap': 0.49774345273171333}.
Starting optimization (600 trials, n_jobs=4) | multi-objective=True
Saved trials CSV -> runs/FUT_SHORT_calmar_aggr_r911/trials_metrics.csv
Saved Pareto plot -> runs/FUT_SHORT_calmar_aggr_r911/pareto_return_vs_drawdown.png
Top-K under DD cap: [413] (agg='median')
=== Selected trial(s) ===
top_k=1 selected_trial_numbers=[413] primary=413
ret%_train=0.16% dd%_train=-0.03% trades=15
ret%_test=0.29% dd%_test=-0.02% pnl_test=57.07 trades_test=9
Dumped TEST trades -> runs/FUT_SHORT_calmar_aggr_r911/test_trades.csv
WFO fold 1: OOS PnL=0.00 trades=0 win_rate=0.00% avg=0.000000 ret%=0.00% maxDD=0.000000 maxDD%=0.00%
WFO fold 2: OOS PnL=41.40 trades=5 win_rate=60.00% avg=8.280167 ret%=0.21% maxDD=-4.422095 maxDD%=-0.02%
WFO fold 3: OOS PnL=0.00 trades=0 win_rate=0.00% avg=0.000000 ret%=0.00% maxDD=0.000000 maxDD%=0.00%
WFO fold 4: OOS PnL=6.91 trades=2 win_rate=100.00% avg=3.453792 ret%=0.03% maxDD=0.000000 maxDD%=0.00%
WFO fold 5: OOS PnL=0.00 trades=0 win_rate=0.00% avg=0.000000 ret%=0.00% maxDD=0.000000 maxDD%=0.00%
WFO fold 6: OOS PnL=8.75 trades=2 win_rate=50.00% avg=4.372661 ret%=0.04% maxDD=-1.691284 maxDD%=-0.01%
WFO summary: meanPnL=9.51 stdPnL=14.70 meanWR=35.00% meanAvg=2.684437 meanRet%=0.05% worstDD=-4.422095 worstDD%=-0.02% folds=6 trades=9
Wrote runs/FUT_SHORT_calmar_aggr_r911/strategy_profile.json
Wrote runs/FUT_SHORT_calmar_aggr_r911/best_params.pkl
