[I 2025-08-30 04:17:32,250] Trial 241 finished with values: [-1000000000.0, 1000000000.0] and parameters: {'p_sma': 6, 'p_std': 53, 'p_atr': 9, 'p_adx': 25, 'rsi_period': 18, 'ema1': 14, 'ema2': 27, 'slip_atr_k': 0.012774890657906888, 'slip_spread_k': 0.09842289441548357, 'spread_hl_frac': 0.011151292209649652, 'bb_std_mult': 3.369918391983085, 'rsi_os': 24, 'rsi_ob': 65, 'vol_spike': 0.1863329522408137, 'adx_thresh': 31.31798494509272, 'atr_min_pct': 0.01816029887963539, 'atr_max_pct': 0.14738776446824664, 'tp_mult': 2.7291642522700745, 'tsl_mult': 0.18972374376831577, 'strategy': 'breakout', 'time_stop': 205, 'use_sma': False, 'use_atr': False, 'use_adx': False, 'use_ema': True, 'use_spike': True, 'rsi_required': False, 'edge_k': 1.567489420830619, 'edge_cap': 0.22465102759658218}.
[I 2025-08-30 04:18:17,963] Trial 245 finished with values: [-1000000000.0, 1000000000.0] and parameters: {'p_sma': 10, 'p_std': 51, 'p_atr': 10, 'p_adx': 25, 'rsi_period': 21, 'ema1': 14, 'ema2': 29, 'slip_atr_k': 0.004161776719730191, 'slip_spread_k': 0.7314703419433549, 'spread_hl_frac': 0.009928958423663854, 'bb_std_mult': 3.353422350954314, 'rsi_os': 23, 'rsi_ob': 89, 'vol_spike': 0.10913942633286919, 'adx_thresh': 31.438736769425102, 'atr_min_pct': 0.00531294613266883, 'atr_max_pct': 0.14009786796225004, 'tp_mult': 2.5248237190704126, 'tsl_mult': 0.23579897911934744, 'strategy': 'breakout', 'time_stop': 206, 'use_sma': False, 'use_atr': False, 'use_adx': False, 'use_ema': True, 'use_spike': True, 'rsi_required': False, 'edge_k': 1.4482581966100332, 'edge_cap': 0.6483956250540449}.
[I 2025-08-30 04:18:18,372] Trial 247 finished with values: [-1000000000.0, 1000000000.0] and parameters: {'p_sma': 10, 'p_std': 50, 'p_atr': 10, 'p_adx': 26, 'rsi_period': 20, 'ema1': 17, 'ema2': 29, 'slip_atr_k': 0.0047593134407856235, 'slip_spread_k': 0.9212871233629101, 'spread_hl_frac': 0.010267817282952528, 'bb_std_mult': 3.4466140013733226, 'rsi_os': 27, 'rsi_ob': 45, 'vol_spike': 0.23894012512469648, 'adx_thresh': 19.81015960359959, 'atr_min_pct': 0.00856340345081202, 'atr_max_pct': 0.1490828851736426, 'tp_mult': 1.8587655861789836, 'tsl_mult': 0.24753389344374616, 'strategy': 'breakout', 'time_stop': 196, 'use_sma': False, 'use_atr': False, 'use_adx': False, 'use_ema': True, 'use_spike': True, 'rsi_required': False, 'edge_k': 1.4533487643466425, 'edge_cap': 0.6458858187990137}.
[I 2025-08-30 04:18:18,895] Trial 246 finished with values: [-1000000000.0, 1000000000.0] and parameters: {'p_sma': 10, 'p_std': 51, 'p_atr': 9, 'p_adx': 26, 'rsi_period': 21, 'ema1': 17, 'ema2': 29, 'slip_atr_k': 0.005303693834582617, 'slip_spread_k': 0.7422493612072574, 'spread_hl_frac': 0.009786189923358491, 'bb_std_mult': 3.5112989456812858, 'rsi_os': 26, 'rsi_ob': 45, 'vol_spike': 0.043691873673098666, 'adx_thresh': 31.83559564531798, 'atr_min_pct': 0.017460237269125187, 'atr_max_pct': 0.14947306716902392, 'tp_mult': 1.8616920905409955, 'tsl_mult': 0.2421076982682273, 'strategy': 'breakout', 'time_stop': 208, 'use_sma': False, 'use_atr': False, 'use_adx': False, 'use_ema': True, 'use_spike': True, 'rsi_required': False, 'edge_k': 1.3505243524734274, 'edge_cap': 0.05062019841839932}.
[I 2025-08-30 04:18:19,114] Trial 244 finished with values: [-1000000000.0, 1000000000.0] and parameters: {'p_sma': 8, 'p_std': 51, 'p_atr': 8, 'p_adx': 26, 'rsi_period': 19, 'ema1': 18, 'ema2': 29, 'slip_atr_k': 0.0047146656984860995, 'slip_spread_k': 0.7434377482015186, 'spread_hl_frac': 0.010325890517945831, 'bb_std_mult': 3.3692166236313916, 'rsi_os': 27, 'rsi_ob': 89, 'vol_spike': 0.24122264465193505, 'adx_thresh': 31.63601572346883, 'atr_min_pct': 0.005308625996314268, 'atr_max_pct': 0.14973674496436368, 'tp_mult': 1.856002765768918, 'tsl_mult': 0.23701155821269532, 'strategy': 'breakout', 'time_stop': 205, 'use_sma': False, 'use_atr': False, 'use_adx': False, 'use_ema': True, 'use_spike': True, 'rsi_required': False, 'edge_k': 1.4599666221563845, 'edge_cap': 0.39141048615571616}.
[I 2025-08-30 04:19:03,101] Trial 248 finished with values: [-1000000000.0, 1000000000.0] and parameters: {'p_sma': 8, 'p_std': 52, 'p_atr': 8, 'p_adx': 26, 'rsi_period': 21, 'ema1': 11, 'ema2': 28, 'slip_atr_k': 0.001106164339685068, 'slip_spread_k': 0.13696660046550102, 'spread_hl_frac': 0.010607498869515026, 'bb_std_mult': 3.514666327050711, 'rsi_os': 25, 'rsi_ob': 66, 'vol_spike': 0.23566777935573713, 'adx_thresh': 31.775378448903258, 'atr_min_pct': 0.024375639164410157, 'atr_max_pct': 0.14938492459618735, 'tp_mult': 1.8590360021725396, 'tsl_mult': 0.22379398821025956, 'strategy': 'breakout', 'time_stop': 194, 'use_sma': False, 'use_atr': False, 'use_adx': False, 'use_ema': True, 'use_spike': True, 'rsi_required': False, 'edge_k': 1.4585096977255692, 'edge_cap': 0.39493375929620156}.
[I 2025-08-30 04:19:03,282] Trial 249 finished with values: [-1000000000.0, 1000000000.0] and parameters: {'p_sma': 37, 'p_std': 52, 'p_atr': 8, 'p_adx': 26, 'rsi_period': 23, 'ema1': 15, 'ema2': 28, 'slip_atr_k': 0.0006336936488560395, 'slip_spread_k': 0.15076507951331986, 'spread_hl_frac': 0.008954335462985649, 'bb_std_mult': 1.5164583973281909, 'rsi_os': 25, 'rsi_ob': 91, 'vol_spike': 0.13368448444291983, 'adx_thresh': 31.91433167763647, 'atr_min_pct': 0.02454612017886216, 'atr_max_pct': 0.1497157558364084, 'tp_mult': 1.8696044622393149, 'tsl_mult': 0.2219786576718457, 'strategy': 'breakout', 'time_stop': 221, 'use_sma': False, 'use_atr': False, 'use_adx': False, 'use_ema': True, 'use_spike': True, 'rsi_required': False, 'edge_k': 1.4706090991896277, 'edge_cap': 0.6327303646198045}.
[I 2025-08-30 04:19:04,864] Trial 250 finished with values: [-0.015254493609571873, 0.015205780684931898] and parameters: {'p_sma': 8, 'p_std': 48, 'p_atr': 8, 'p_adx': 25, 'rsi_period': 23, 'ema1': 15, 'ema2': 28, 'slip_atr_k': 0.0006357861220593368, 'slip_spread_k': 0.7961105912995601, 'spread_hl_frac': 0.03233788399944611, 'bb_std_mult': 3.549445472495262, 'rsi_os': 21, 'rsi_ob': 66, 'vol_spike': 0.18045665582906723, 'adx_thresh': 17.17295035930683, 'atr_min_pct': 5.9897588133277566e-05, 'atr_max_pct': 0.14542925139088256, 'tp_mult': 1.2188173923419499, 'tsl_mult': 0.22194966484213566, 'strategy': 'breakout', 'time_stop': 133, 'use_sma': False, 'use_atr': False, 'use_adx': False, 'use_ema': True, 'use_spike': True, 'rsi_required': False, 'edge_k': 1.459465306854758, 'edge_cap': 0.6338149867631361}.
[I 2025-08-30 04:19:04,867] Trial 251 finished with values: [-0.03467939438947565, 0.034631846718636485] and parameters: {'p_sma': 12, 'p_std': 52, 'p_atr': 9, 'p_adx': 25, 'rsi_period': 24, 'ema1': 16, 'ema2': 26, 'slip_atr_k': 0.0009259726011729458, 'slip_spread_k': 0.7985827671684651, 'spread_hl_frac': 0.011450693326878016, 'bb_std_mult': 0.671004226848279, 'rsi_os': 25, 'rsi_ob': 81, 'vol_spike': 0.17646660718823637, 'adx_thresh': 5.839441795658782, 'atr_min_pct': 0.0005239995283019166, 'atr_max_pct': 0.14362477263271856, 'tp_mult': 1.2216993272705645, 'tsl_mult': 0.22065119323876695, 'strategy': 'breakout', 'time_stop': 216, 'use_sma': False, 'use_atr': False, 'use_adx': False, 'use_ema': True, 'use_spike': True, 'rsi_required': False, 'edge_k': 1.3089154986251794, 'edge_cap': 0.2516035331265866}.
[I 2025-08-30 04:19:51,296] Trial 253 finished with values: [-1000000000.0, 1000000000.0] and parameters: {'p_sma': 12, 'p_std': 54, 'p_atr': 9, 'p_adx': 25, 'rsi_period': 24, 'ema1': 27, 'ema2': 26, 'slip_atr_k': 0.011429743247202645, 'slip_spread_k': 0.7237571655941538, 'spread_hl_frac': 0.03233738302113141, 'bb_std_mult': 3.2535621078183277, 'rsi_os': 7, 'rsi_ob': 67, 'vol_spike': 0.17504545508004704, 'adx_thresh': 6.865252330315689, 'atr_min_pct': 0.0004628985569806473, 'atr_max_pct': 0.1455241529730976, 'tp_mult': 1.806481291726797, 'tsl_mult': 0.03195493150292755, 'strategy': 'breakout', 'time_stop': 213, 'use_sma': False, 'use_atr': False, 'use_adx': False, 'use_ema': True, 'use_spike': True, 'rsi_required': False, 'edge_k': 1.3120488058795963, 'edge_cap': 0.6168226301794734}.
[I 2025-08-30 04:19:52,164] Trial 255 finished with values: [-1000000000.0, 1000000000.0] and parameters: {'p_sma': 7, 'p_std': 55, 'p_atr': 19, 'p_adx': 18, 'rsi_period': 15, 'ema1': 15, 'ema2': 26, 'slip_atr_k': 0.010771182580853703, 'slip_spread_k': 0.3596491216693268, 'spread_hl_frac': 0.013736502641300993, 'bb_std_mult': 3.2750918883211195, 'rsi_os': 21, 'rsi_ob': 85, 'vol_spike': 0.0024351358600420703, 'adx_thresh': 22.833285213420968, 'atr_min_pct': 0.010725671069991186, 'atr_max_pct': 0.1459007777293941, 'tp_mult': 1.2943413629256777, 'tsl_mult': 0.2618657354710652, 'strategy': 'breakout', 'time_stop': 133, 'use_sma': False, 'use_atr': False, 'use_adx': False, 'use_ema': True, 'use_spike': True, 'rsi_required': False, 'edge_k': 1.602183906320483, 'edge_cap': 0.6700648879111117}.
[I 2025-08-30 04:19:53,091] Trial 254 finished with values: [-0.01603146532759514, 0.015979637890927205] and parameters: {'p_sma': 13, 'p_std': 55, 'p_atr': 11, 'p_adx': 24, 'rsi_period': 16, 'ema1': 15, 'ema2': 26, 'slip_atr_k': 0.011461324508565296, 'slip_spread_k': 0.7218549790527319, 'spread_hl_frac': 0.013727263217955435, 'bb_std_mult': 3.281156252133615, 'rsi_os': 21, 'rsi_ob': 67, 'vol_spike': 0.2925845901715171, 'adx_thresh': 30.85425850543653, 'atr_min_pct': 0.0011893038583871691, 'atr_max_pct': 0.030733789300371822, 'tp_mult': 1.8106505459458502, 'tsl_mult': 0.2661963544386167, 'strategy': 'breakout', 'time_stop': 284, 'use_sma': False, 'use_atr': False, 'use_adx': False, 'use_ema': True, 'use_spike': True, 'rsi_required': False, 'edge_k': 0.30537174292638314, 'edge_cap': 0.6668251476757968}.
[I 2025-08-30 04:19:53,492] Trial 252 finished with values: [-0.047597285637233644, 0.04757755293699452] and parameters: {'p_sma': 12, 'p_std': 54, 'p_atr': 9, 'p_adx': 19, 'rsi_period': 16, 'ema1': 15, 'ema2': 26, 'slip_atr_k': 0.010636366265539921, 'slip_spread_k': 0.9967714283918934, 'spread_hl_frac': 0.011714665125407947, 'bb_std_mult': 3.3038151269215303, 'rsi_os': 21, 'rsi_ob': 67, 'vol_spike': 0.07501043765186374, 'adx_thresh': 17.122145171837552, 'atr_min_pct': 0.0005570045026810412, 'atr_max_pct': 0.14474419432781363, 'tp_mult': 1.791055700846939, 'tsl_mult': 0.2628085687494048, 'strategy': 'breakout', 'time_stop': 134, 'use_sma': False, 'use_atr': False, 'use_adx': False, 'use_ema': True, 'use_spike': True, 'rsi_required': False, 'edge_k': 1.5254622099506192, 'edge_cap': 0.49879981816646596}.
[I 2025-08-30 04:20:37,403] Trial 257 finished with values: [-0.042860141921193806, 0.04284147041964832] and parameters: {'p_sma': 9, 'p_std': 41, 'p_atr': 15, 'p_adx': 24, 'rsi_period': 16, 'ema1': 15, 'ema2': 27, 'slip_atr_k': 0.024565332850699437, 'slip_spread_k': 0.4501500034251051, 'spread_hl_frac': 0.008211011076949791, 'bb_std_mult': 3.5451992055842956, 'rsi_os': 22, 'rsi_ob': 51, 'vol_spike': 0.2730067606679221, 'adx_thresh': 17.07471704049127, 'atr_min_pct': 6.598379691734495e-07, 'atr_max_pct': 0.054771012578538614, 'tp_mult': 1.7869490948244393, 'tsl_mult': 0.17719146701245225, 'strategy': 'breakout', 'time_stop': 199, 'use_sma': False, 'use_atr': False, 'use_adx': False, 'use_ema': True, 'use_spike': True, 'rsi_required': False, 'edge_k': 0.2971713712260817, 'edge_cap': 0.49867149213743495}.
[I 2025-08-30 04:20:37,801] Trial 256 finished with values: [-1000000000.0, 1000000000.0] and parameters: {'p_sma': 9, 'p_std': 41, 'p_atr': 14, 'p_adx': 9, 'rsi_period': 15, 'ema1': 15, 'ema2': 31, 'slip_atr_k': 0.010225136053743589, 'slip_spread_k': 0.34046778213903905, 'spread_hl_frac': 0.030340455366056777, 'bb_std_mult': 3.5832719796529173, 'rsi_os': 21, 'rsi_ob': 68, 'vol_spike': 0.2935252632455815, 'adx_thresh': 33.74164200088071, 'atr_min_pct': 0.015488575970659741, 'atr_max_pct': 0.14057443914801313, 'tp_mult': 1.7947692783121079, 'tsl_mult': 0.18247192980134846, 'strategy': 'breakout', 'time_stop': 134, 'use_sma': False, 'use_atr': False, 'use_adx': False, 'use_ema': True, 'use_spike': True, 'rsi_required': False, 'edge_k': 1.4176174369497598, 'edge_cap': 0.6718689892372357}.
[I 2025-08-30 04:20:38,040] Trial 258 finished with values: [-0.013548707721621756, 0.013470524855815473] and parameters: {'p_sma': 9, 'p_std': 48, 'p_atr': 15, 'p_adx': 9, 'rsi_period': 22, 'ema1': 15, 'ema2': 27, 'slip_atr_k': 0.02492797195436135, 'slip_spread_k': 0.7648598471735297, 'spread_hl_frac': 0.008176201161078112, 'bb_std_mult': 3.5945477193422017, 'rsi_os': 22, 'rsi_ob': 69, 'vol_spike': 0.25927890085247485, 'adx_thresh': 32.565981604144085, 'atr_min_pct': 0.0012399896059518162, 'atr_max_pct': 0.05604052467336343, 'tp_mult': 1.015753655145858, 'tsl_mult': 0.18002460245505336, 'strategy': 'breakout', 'time_stop': 182, 'use_sma': False, 'use_atr': False, 'use_adx': False, 'use_ema': True, 'use_spike': True, 'rsi_required': False, 'edge_k': 0.23121742983546978, 'edge_cap': 0.6549161264848568}.
[I 2025-08-30 04:20:38,153] Trial 259 finished with values: [-1000000000.0, 1000000000.0] and parameters: {'p_sma': 9, 'p_std': 42, 'p_atr': 15, 'p_adx': 24, 'rsi_period': 22, 'ema1': 15, 'ema2': 31, 'slip_atr_k': 0.02102827559280697, 'slip_spread_k': 0.7596096416062635, 'spread_hl_frac': 0.029686840018237844, 'bb_std_mult': 3.543745952264006, 'rsi_os': 29, 'rsi_ob': 51, 'vol_spike': 0.2938255343295274, 'adx_thresh': 33.72738373647533, 'atr_min_pct': 0.015505210812564965, 'atr_max_pct': 0.05482982643882585, 'tp_mult': 1.0126509031191546, 'tsl_mult': 0.18003141393201222, 'strategy': 'breakout', 'time_stop': 201, 'use_sma': False, 'use_atr': False, 'use_adx': False, 'use_ema': True, 'use_spike': True, 'rsi_required': False, 'edge_k': 1.3871397396547531, 'edge_cap': 0.6503174833549558}.
[I 2025-08-30 04:21:23,018] Trial 260 finished with values: [-1000000000.0, 1000000000.0] and parameters: {'p_sma': 9, 'p_std': 48, 'p_atr': 11, 'p_adx': 25, 'rsi_period': 22, 'ema1': 15, 'ema2': 30, 'slip_atr_k': 0.016198942606776054, 'slip_spread_k': 0.2901208271947923, 'spread_hl_frac': 0.03028419035738368, 'bb_std_mult': 2.2115073040693174, 'rsi_os': 23, 'rsi_ob': 69, 'vol_spike': 0.11495377628795915, 'adx_thresh': 9.246781321093751, 'atr_min_pct': 0.02266043605387006, 'atr_max_pct': 0.14055614485985082, 'tp_mult': 1.8924375689484565, 'tsl_mult': 0.19691236407002025, 'strategy': 'breakout', 'time_stop': 227, 'use_sma': False, 'use_atr': False, 'use_adx': False, 'use_ema': True, 'use_spike': True, 'rsi_required': False, 'edge_k': 1.4141534773106088, 'edge_cap': 0.6565306355680819}.
[I 2025-08-30 04:21:24,319] Trial 262 finished with values: [-0.022960874104632767, 0.022921922620834072] and parameters: {'p_sma': 59, 'p_std': 49, 'p_atr': 22, 'p_adx': 25, 'rsi_period': 19, 'ema1': 15, 'ema2': 29, 'slip_atr_k': 0.01812883289195783, 'slip_spread_k': 0.7955874826356907, 'spread_hl_frac': 0.025101712439427482, 'bb_std_mult': 0.547835189480516, 'rsi_os': 23, 'rsi_ob': 65, 'vol_spike': 0.11654939157061203, 'adx_thresh': 32.47376112551018, 'atr_min_pct': 0.0012715867904277323, 'atr_max_pct': 0.044406252919802665, 'tp_mult': 2.907338411279611, 'tsl_mult': 0.20361827632289856, 'strategy': 'breakout', 'time_stop': 228, 'use_sma': False, 'use_atr': False, 'use_adx': False, 'use_ema': True, 'use_spike': True, 'rsi_required': False, 'edge_k': 0.20901979042079688, 'edge_cap': 0.9216296723762031}.
[I 2025-08-30 04:21:24,970] Trial 263 finished with values: [-0.02249206666402992, 0.02244685987725018] and parameters: {'p_sma': 55, 'p_std': 48, 'p_atr': 10, 'p_adx': 25, 'rsi_period': 40, 'ema1': 15, 'ema2': 28, 'slip_atr_k': 0.09642874858292093, 'slip_spread_k': 0.790261990526062, 'spread_hl_frac': 0.023031424164515157, 'bb_std_mult': 2.227829030283018, 'rsi_os': 19, 'rsi_ob': 65, 'vol_spike': 0.19070062398101778, 'adx_thresh': 9.13985177914451, 'atr_min_pct': 0.0011642840544737693, 'atr_max_pct': 0.13756711441361424, 'tp_mult': 1.4658908415839156, 'tsl_mult': 0.2831382655692781, 'strategy': 'breakout', 'time_stop': 285, 'use_sma': False, 'use_atr': False, 'use_adx': False, 'use_ema': True, 'use_spike': True, 'rsi_required': False, 'edge_k': 1.533025098996472, 'edge_cap': 0.6309154956574762}.
[I 2025-08-30 04:21:25,723] Trial 261 finished with values: [-1000000000.0, 1000000000.0] and parameters: {'p_sma': 11, 'p_std': 48, 'p_atr': 11, 'p_adx': 12, 'rsi_period': 38, 'ema1': 15, 'ema2': 31, 'slip_atr_k': 0.01672454196420685, 'slip_spread_k': 0.7651153144258148, 'spread_hl_frac': 0.008982976113936931, 'bb_std_mult': 0.9658582207092927, 'rsi_os': 26, 'rsi_ob': 65, 'vol_spike': 0.1898675445967163, 'adx_thresh': 32.48914141153041, 'atr_min_pct': 0.0011219003348430514, 'atr_max_pct': 0.02804410355180783, 'tp_mult': 1.1462031891624789, 'tsl_mult': 0.20083582452782403, 'strategy': 'breakout', 'time_stop': 227, 'use_sma': False, 'use_atr': False, 'use_adx': False, 'use_ema': True, 'use_spike': True, 'rsi_required': False, 'edge_k': 1.2190441943963146, 'edge_cap': 0.6541775271027566}.
[I 2025-08-30 04:21:26,018] Trial 265 finished with values: [-1000000000.0, 1000000000.0] and parameters: {'p_sma': 47, 'p_std': 56, 'p_atr': 10, 'p_adx': 25, 'rsi_period': 55, 'ema1': 16, 'ema2': 29, 'slip_atr_k': 0.09786498678569078, 'slip_spread_k': 0.761069953037242, 'spread_hl_frac': 0.025307170679064527, 'bb_std_mult': 0.5439399371902471, 'rsi_os': 31, 'rsi_ob': 76, 'vol_spike': 0.18922833317249702, 'adx_thresh': 32.42524498464268, 'atr_min_pct': 0.02800738078199285, 'atr_max_pct': 0.02595970943931429, 'tp_mult': 1.3617192617071086, 'tsl_mult': 0.28247008953154734, 'strategy': 'breakout', 'time_stop': 282, 'use_sma': False, 'use_atr': False, 'use_adx': False, 'use_ema': True, 'use_spike': True, 'rsi_required': False, 'edge_k': 1.5335151426644231, 'edge_cap': 0.823737023547909}.
[I 2025-08-30 04:22:09,936] Trial 264 finished with values: [-1000000000.0, 1000000000.0] and parameters: {'p_sma': 17, 'p_std': 50, 'p_atr': 10, 'p_adx': 25, 'rsi_period': 38, 'ema1': 16, 'ema2': 29, 'slip_atr_k': 0.09583836733994243, 'slip_spread_k': 0.06342645409074849, 'spread_hl_frac': 0.025161136095284118, 'bb_std_mult': 3.472402799116441, 'rsi_os': 26, 'rsi_ob': 65, 'vol_spike': 0.1905023518898851, 'adx_thresh': 30.61878852222269, 'atr_min_pct': 0.0011765223217858397, 'atr_max_pct': 0.08932604956021754, 'tp_mult': 2.91399897771878, 'tsl_mult': 0.22666091925656023, 'strategy': 'breakout', 'time_stop': 221, 'use_sma': False, 'use_atr': False, 'use_adx': False, 'use_ema': True, 'use_spike': True, 'rsi_required': False, 'edge_k': 0.23066371480279746, 'edge_cap': 0.9191758844733445}.
[I 2025-08-30 04:22:10,963] Trial 267 finished with values: [-1000000000.0, 1000000000.0] and parameters: {'p_sma': 17, 'p_std': 56, 'p_atr': 10, 'p_adx': 25, 'rsi_period': 18, 'ema1': 16, 'ema2': 29, 'slip_atr_k': 0.0969664412954253, 'slip_spread_k': 0.7884778314115928, 'spread_hl_frac': 0.01088383509377332, 'bb_std_mult': 1.2977422932114462, 'rsi_os': 17, 'rsi_ob': 66, 'vol_spike': 0.2531358667684695, 'adx_thresh': 8.406403223029699, 'atr_min_pct': 0.016326284297178875, 'atr_max_pct': 0.09055551959948561, 'tp_mult': 1.823745470403676, 'tsl_mult': 0.2828833469829788, 'strategy': 'breakout', 'time_stop': 219, 'use_sma': False, 'use_atr': False, 'use_adx': False, 'use_ema': True, 'use_spike': True, 'rsi_required': False, 'edge_k': 0.21896379357950801, 'edge_cap': 0.6281152555632832}.
[I 2025-08-30 04:22:11,532] Trial 268 finished with values: [-1000000000.0, 1000000000.0] and parameters: {'p_sma': 6, 'p_std': 50, 'p_atr': 10, 'p_adx': 8, 'rsi_period': 18, 'ema1': 30, 'ema2': 28, 'slip_atr_k': 0.007528504613529299, 'slip_spread_k': 0.7996221730327125, 'spread_hl_frac': 0.027505809672887536, 'bb_std_mult': 3.4719136302947673, 'rsi_os': 23, 'rsi_ob': 66, 'vol_spike': 0.2577181175813148, 'adx_thresh': 13.091554576580595, 'atr_min_pct': 0.026347619165300505, 'atr_max_pct': 0.06135712789730617, 'tp_mult': 2.9042485236664737, 'tsl_mult': 0.23073642165295669, 'strategy': 'breakout', 'time_stop': 218, 'use_sma': False, 'use_atr': False, 'use_adx': False, 'use_ema': True, 'use_spike': True, 'rsi_required': False, 'edge_k': 1.5207234381396908, 'edge_cap': 0.6310038758145601}.
[I 2025-08-30 04:22:12,014] Trial 266 finished with values: [-0.07774140888979564, 0.07769273773663579] and parameters: {'p_sma': 50, 'p_std': 48, 'p_atr': 10, 'p_adx': 12, 'rsi_period': 18, 'ema1': 16, 'ema2': 29, 'slip_atr_k': 0.08253211113461457, 'slip_spread_k': 0.5378309635339618, 'spread_hl_frac': 0.011077298783341231, 'bb_std_mult': 3.4523511409485246, 'rsi_os': 26, 'rsi_ob': 66, 'vol_spike': 0.25037223023782545, 'adx_thresh': 30.9558095456476, 'atr_min_pct': 0.0011483634751841307, 'atr_max_pct': 0.1381410140202819, 'tp_mult': 1.4937592689103385, 'tsl_mult': 0.824642062307986, 'strategy': 'breakout', 'time_stop': 221, 'use_sma': False, 'use_atr': False, 'use_adx': False, 'use_ema': True, 'use_spike': True, 'rsi_required': False, 'edge_k': 0.6964016745743236, 'edge_cap': 0.6313209354217145}.
[I 2025-08-30 04:22:54,137] Trial 271 finished with values: [-1000000000.0, 1000000000.0] and parameters: {'p_sma': 11, 'p_std': 53, 'p_atr': 9, 'p_adx': 24, 'rsi_period': 20, 'ema1': 14, 'ema2': 27, 'slip_atr_k': 0.16803391398471276, 'slip_spread_k': 0.1159110797591798, 'spread_hl_frac': 0.00021871693477196197, 'bb_std_mult': 1.819924372769228, 'rsi_os': 22, 'rsi_ob': 57, 'vol_spike': 0.18046458086345626, 'adx_thresh': 30.904377169977113, 'atr_min_pct': 0.010118589195412822, 'atr_max_pct': 0.03056975464811143, 'tp_mult': 1.4761206354557843, 'tsl_mult': 0.25400025273070265, 'strategy': 'breakout', 'time_stop': 82, 'use_sma': False, 'use_atr': False, 'use_adx': False, 'use_ema': True, 'use_spike': True, 'rsi_required': False, 'edge_k': 0.4537044694147625, 'edge_cap': 0.33443272340982744}.
