[I 2025-08-30 04:22:55,807] Trial 272 finished with values: [-1000000000.0, 1000000000.0] and parameters: {'p_sma': 55, 'p_std': 53, 'p_atr': 9, 'p_adx': 24, 'rsi_period': 19, 'ema1': 14, 'ema2': 27, 'slip_atr_k': 0.0069564043497409725, 'slip_spread_k': 0.8382540992896831, 'spread_hl_frac': 0.007103414738680425, 'bb_std_mult': 1.04196103162807, 'rsi_os': 13, 'rsi_ob': 67, 'vol_spike': 0.1829689259773364, 'adx_thresh': 30.943490895830024, 'atr_min_pct': 1.0840861823637043e-05, 'atr_max_pct': 0.03408093178945439, 'tp_mult': 1.9128311559491922, 'tsl_mult': 0.2116021241021226, 'strategy': 'breakout', 'time_stop': 79, 'use_sma': False, 'use_atr': False, 'use_adx': False, 'use_ema': True, 'use_spike': True, 'rsi_required': False, 'edge_k': 1.5767518539846361, 'edge_cap': 0.4549123412843482}.
[I 2025-08-30 04:22:56,746] Trial 270 finished with values: [-0.02335205568532983, 0.023289134437309907] and parameters: {'p_sma': 50, 'p_std': 44, 'p_atr': 22, 'p_adx': 8, 'rsi_period': 62, 'ema1': 14, 'ema2': 27, 'slip_atr_k': 0.15793792388039357, 'slip_spread_k': 0.39542584377529777, 'spread_hl_frac': 0.022858199333449805, 'bb_std_mult': 3.4278448558526984, 'rsi_os': 19, 'rsi_ob': 67, 'vol_spike': 0.09765936660981217, 'adx_thresh': 31.018754941015807, 'atr_min_pct': 0.0005514195711088444, 'atr_max_pct': 0.13765173153160143, 'tp_mult': 1.88797157766586, 'tsl_mult': 0.2513748057381694, 'strategy': 'breakout', 'time_stop': 208, 'use_sma': False, 'use_atr': False, 'use_adx': False, 'use_ema': True, 'use_spike': True, 'rsi_required': False, 'edge_k': 0.7087187351554254, 'edge_cap': 0.2820163990739174}.
[I 2025-08-30 04:22:57,461] Trial 269 finished with values: [-0.03405709573273674, 0.034039647236240485] and parameters: {'p_sma': 55, 'p_std': 57, 'p_atr': 22, 'p_adx': 8, 'rsi_period': 19, 'ema1': 14, 'ema2': 47, 'slip_atr_k': 0.007054113754366709, 'slip_spread_k': 0.5460883443705542, 'spread_hl_frac': 0.028246530950903855, 'bb_std_mult': 1.8225372724573656, 'rsi_os': 16, 'rsi_ob': 67, 'vol_spike': 0.18105266951015425, 'adx_thresh': 31.01395441457785, 'atr_min_pct': 4.472509339163434e-05, 'atr_max_pct': 0.13789917545470728, 'tp_mult': 1.5074463429163643, 'tsl_mult': 0.9148167296430231, 'strategy': 'breakout', 'time_stop': 240, 'use_sma': False, 'use_atr': False, 'use_adx': False, 'use_ema': True, 'use_spike': True, 'rsi_required': False, 'edge_k': 1.5648728155223575, 'edge_cap': 0.630319280430279}.
[I 2025-08-30 04:23:41,081] Trial 274 finished with values: [-0.0761396680812062, 0.07612826263077972] and parameters: {'p_sma': 8, 'p_std': 51, 'p_atr': 8, 'p_adx': 15, 'rsi_period': 59, 'ema1': 26, 'ema2': 28, 'slip_atr_k': 0.0001293686520104616, 'slip_spread_k': 0.8637432848731432, 'spread_hl_frac': 0.00939479791345529, 'bb_std_mult': 3.415474508058183, 'rsi_os': 51, 'rsi_ob': 78, 'vol_spike': 0.1979003771896308, 'adx_thresh': 32.471417273268436, 'atr_min_pct': 4.9899782581775795e-05, 'atr_max_pct': 0.14647054582765598, 'tp_mult': 1.833926148474266, 'tsl_mult': 0.9020294604734085, 'strategy': 'breakout', 'time_stop': 209, 'use_sma': False, 'use_atr': False, 'use_adx': False, 'use_ema': True, 'use_spike': True, 'rsi_required': False, 'edge_k': 0.5463942781800089, 'edge_cap': 0.6761517409819032}.
[I 2025-08-30 04:23:42,545] Trial 275 finished with values: [-0.05408877834093784, 0.05403921000995974] and parameters: {'p_sma': 13, 'p_std': 44, 'p_atr': 17, 'p_adx': 26, 'rsi_period': 23, 'ema1': 26, 'ema2': 47, 'slip_atr_k': 0.1545670973837979, 'slip_spread_k': 0.7500739866030698, 'spread_hl_frac': 0.00933328213759612, 'bb_std_mult': 3.317416280999879, 'rsi_os': 52, 'rsi_ob': 68, 'vol_spike': 0.19812328977301202, 'adx_thresh': 32.51358061116125, 'atr_min_pct': 0.0006173475721956183, 'atr_max_pct': 0.14654391678279946, 'tp_mult': 1.8370661918886833, 'tsl_mult': 0.9261213116080002, 'strategy': 'breakout', 'time_stop': 184, 'use_sma': False, 'use_atr': False, 'use_adx': False, 'use_ema': True, 'use_spike': True, 'rsi_required': False, 'edge_k': 1.638999852294696, 'edge_cap': 0.5761664155339989}.
[I 2025-08-30 04:23:44,128] Trial 273 finished with values: [-0.016447734140375703, 0.016464909482565484] and parameters: {'p_sma': 58, 'p_std': 60, 'p_atr': 9, 'p_adx': 15, 'rsi_period': 49, 'ema1': 15, 'ema2': 28, 'slip_atr_k': 0.007122348532205837, 'slip_spread_k': 0.7477198846818586, 'spread_hl_frac': 0.009296313150536428, 'bb_std_mult': 2.345640024146212, 'rsi_os': 25, 'rsi_ob': 47, 'vol_spike': 0.09950736060566417, 'adx_thresh': 32.49176907099043, 'atr_min_pct': 8.423736404243598e-06, 'atr_max_pct': 0.14689669475630962, 'tp_mult': 1.9063152664771505, 'tsl_mult': 0.8985970789169889, 'strategy': 'breakout', 'time_stop': 209, 'use_sma': False, 'use_atr': False, 'use_adx': False, 'use_ema': True, 'use_spike': True, 'rsi_required': False, 'edge_k': 1.5573931481610797, 'edge_cap': 0.6695655265208287}.
[I 2025-08-30 04:23:44,148] Trial 276 finished with values: [-0.02927875410541636, 0.029202444685694662] and parameters: {'p_sma': 38, 'p_std': 51, 'p_atr': 8, 'p_adx': 26, 'rsi_period': 49, 'ema1': 15, 'ema2': 28, 'slip_atr_k': 0.15856893703740182, 'slip_spread_k': 0.7361372377989642, 'spread_hl_frac': 0.009718381506577677, 'bb_std_mult': 2.1419339414098664, 'rsi_os': 25, 'rsi_ob': 47, 'vol_spike': 0.03220259178900586, 'adx_thresh': 11.15426022115998, 'atr_min_pct': 9.941469468269915e-06, 'atr_max_pct': 0.13359291355416514, 'tp_mult': 1.7407230588591673, 'tsl_mult': 0.24248948280574992, 'strategy': 'breakout', 'time_stop': 209, 'use_sma': False, 'use_atr': False, 'use_adx': False, 'use_ema': True, 'use_spike': True, 'rsi_required': False, 'edge_k': 1.4902238659039473, 'edge_cap': 0.26864057854888607}.
[I 2025-08-30 04:24:30,328] Trial 280 finished with values: [-1000000000.0, 1000000000.0] and parameters: {'p_sma': 60, 'p_std': 52, 'p_atr': 23, 'p_adx': 24, 'rsi_period': 62, 'ema1': 15, 'ema2': 24, 'slip_atr_k': 0.057466951558473936, 'slip_spread_k': 0.23008487957822277, 'spread_hl_frac': 0.012083330288763338, 'bb_std_mult': 1.3955108853085234, 'rsi_os': 19, 'rsi_ob': 64, 'vol_spike': 0.17237980342549497, 'adx_thresh': 31.535982990250705, 'atr_min_pct': 0.011884836741525693, 'atr_max_pct': 0.14324798469609845, 'tp_mult': 1.4170069367771378, 'tsl_mult': 0.2326240029060586, 'strategy': 'breakout', 'time_stop': 197, 'use_sma': False, 'use_atr': False, 'use_adx': False, 'use_ema': True, 'use_spike': True, 'rsi_required': False, 'edge_k': 1.4711624576729398, 'edge_cap': 0.614465488770696}.
[I 2025-08-30 04:24:31,061] Trial 279 finished with values: [-1000000000.0, 1000000000.0] and parameters: {'p_sma': 58, 'p_std': 52, 'p_atr': 23, 'p_adx': 17, 'rsi_period': 48, 'ema1': 15, 'ema2': 24, 'slip_atr_k': 0.15899479420950646, 'slip_spread_k': 0.7222339894397573, 'spread_hl_frac': 0.014962989498558819, 'bb_std_mult': 2.3748099541414422, 'rsi_os': 19, 'rsi_ob': 64, 'vol_spike': 0.09704424349688827, 'adx_thresh': 31.486256885835246, 'atr_min_pct': 0.011760254511218612, 'atr_max_pct': 0.14204659612435647, 'tp_mult': 1.7378884410623687, 'tsl_mult': 0.24004924803523672, 'strategy': 'breakout', 'time_stop': 196, 'use_sma': False, 'use_atr': False, 'use_adx': False, 'use_ema': True, 'use_spike': True, 'rsi_required': False, 'edge_k': 1.473963138646873, 'edge_cap': 0.6088556423409394}.
[I 2025-08-30 04:24:31,987] Trial 278 finished with values: [-1000000000.0, 1000000000.0] and parameters: {'p_sma': 59, 'p_std': 52, 'p_atr': 9, 'p_adx': 26, 'rsi_period': 61, 'ema1': 15, 'ema2': 44, 'slip_atr_k': 0.14288878346644732, 'slip_spread_k': 0.3909788520190058, 'spread_hl_frac': 0.014828567275341216, 'bb_std_mult': 2.0987070324999664, 'rsi_os': 25, 'rsi_ob': 47, 'vol_spike': 0.032863166154667126, 'adx_thresh': 34.52104408728816, 'atr_min_pct': 0.01944139771405866, 'atr_max_pct': 0.13392085059638834, 'tp_mult': 2.392959197814597, 'tsl_mult': 0.24074944161356207, 'strategy': 'breakout', 'time_stop': 201, 'use_sma': False, 'use_atr': False, 'use_adx': False, 'use_ema': True, 'use_spike': True, 'rsi_required': False, 'edge_k': 1.4947860158638788, 'edge_cap': 0.286535444859213}.
[I 2025-08-30 04:24:32,558] Trial 277 finished with values: [-0.034856522713067384, 0.034799472111215264] and parameters: {'p_sma': 38, 'p_std': 51, 'p_atr': 9, 'p_adx': 26, 'rsi_period': 23, 'ema1': 15, 'ema2': 59, 'slip_atr_k': 0.15997028019946374, 'slip_spread_k': 0.7476283663322338, 'spread_hl_frac': 0.015655087522984272, 'bb_std_mult': 1.4380127220102787, 'rsi_os': 25, 'rsi_ob': 68, 'vol_spike': 0.1731680781485288, 'adx_thresh': 34.46356620750838, 'atr_min_pct': 0.0006801171979433714, 'atr_max_pct': 0.022668439735309923, 'tp_mult': 1.7495343458523906, 'tsl_mult': 0.26080099763649045, 'strategy': 'breakout', 'time_stop': 201, 'use_sma': False, 'use_atr': False, 'use_adx': False, 'use_ema': True, 'use_spike': True, 'rsi_required': False, 'edge_k': 1.4863768142016116, 'edge_cap': 0.2777555771863617}.
[I 2025-08-30 04:25:16,923] Trial 284 finished with values: [-1000000000.0, 1000000000.0] and parameters: {'p_sma': 10, 'p_std': 54, 'p_atr': 18, 'p_adx': 20, 'rsi_period': 21, 'ema1': 21, 'ema2': 30, 'slip_atr_k': 0.012229304573415988, 'slip_spread_k': 0.7799716932586703, 'spread_hl_frac': 0.017693695143792793, 'bb_std_mult': 3.4274937316436116, 'rsi_os': 23, 'rsi_ob': 69, 'vol_spike': 0.10438050482781297, 'adx_thresh': 12.312717063367732, 'atr_min_pct': 0.007595255939810328, 'atr_max_pct': 0.07424899994288857, 'tp_mult': 1.8835260420655238, 'tsl_mult': 0.06731098859587942, 'strategy': 'breakout', 'time_stop': 205, 'use_sma': False, 'use_atr': False, 'use_adx': False, 'use_ema': True, 'use_spike': True, 'rsi_required': False, 'edge_k': 1.3698306919171137, 'edge_cap': 0.6535993765357002}.
[I 2025-08-30 04:25:17,720] Trial 282 finished with values: [-1000000000.0, 1000000000.0] and parameters: {'p_sma': 10, 'p_std': 54, 'p_atr': 18, 'p_adx': 26, 'rsi_period': 22, 'ema1': 15, 'ema2': 44, 'slip_atr_k': 0.012238006989886944, 'slip_spread_k': 0.971731364661059, 'spread_hl_frac': 0.023415630869816, 'bb_std_mult': 3.432515572856199, 'rsi_os': 25, 'rsi_ob': 83, 'vol_spike': 0.037567756088429605, 'adx_thresh': 34.6393423494114, 'atr_min_pct': 0.01935874345501933, 'atr_max_pct': 0.02224653211031792, 'tp_mult': 2.3948185604147474, 'tsl_mult': 0.01633880589124087, 'strategy': 'breakout', 'time_stop': 205, 'use_sma': False, 'use_atr': False, 'use_adx': False, 'use_ema': True, 'use_spike': True, 'rsi_required': False, 'edge_k': 1.0605362738229387, 'edge_cap': 0.11192651619309568}.
[I 2025-08-30 04:25:18,281] Trial 281 finished with values: [-1000000000.0, 1000000000.0] and parameters: {'p_sma': 36, 'p_std': 54, 'p_atr': 11, 'p_adx': 14, 'rsi_period': 21, 'ema1': 15, 'ema2': 59, 'slip_atr_k': 0.0001489540025178468, 'slip_spread_k': 0.7744085482222818, 'spread_hl_frac': 0.034500865032585336, 'bb_std_mult': 3.4265138200778114, 'rsi_os': 9, 'rsi_ob': 92, 'vol_spike': 0.17537076047449146, 'adx_thresh': 7.489607669152175, 'atr_min_pct': 0.006998514710725726, 'atr_max_pct': 0.13258855008294745, 'tp_mult': 1.891622430714851, 'tsl_mult': 0.21035637320187756, 'strategy': 'breakout', 'time_stop': 203, 'use_sma': False, 'use_atr': False, 'use_adx': False, 'use_ema': True, 'use_spike': True, 'rsi_required': False, 'edge_k': 0.8442362614263409, 'edge_cap': 0.27766646673946965}.
[I 2025-08-30 04:25:18,771] Trial 283 finished with values: [-1000000000.0, 1000000000.0] and parameters: {'p_sma': 38, 'p_std': 49, 'p_atr': 9, 'p_adx': 26, 'rsi_period': 51, 'ema1': 16, 'ema2': 30, 'slip_atr_k': 0.012789084332452644, 'slip_spread_k': 0.7702081922767118, 'spread_hl_frac': 0.017725846258354494, 'bb_std_mult': 3.425364703545567, 'rsi_os': 9, 'rsi_ob': 95, 'vol_spike': 0.06857544062377151, 'adx_thresh': 12.20653909670784, 'atr_min_pct': 0.0012459605015443926, 'atr_max_pct': 0.14583407699786713, 'tp_mult': 1.892991994061193, 'tsl_mult': 0.20269849930194728, 'strategy': 'breakout', 'time_stop': 109, 'use_sma': False, 'use_atr': False, 'use_adx': False, 'use_ema': True, 'use_spike': True, 'rsi_required': False, 'edge_k': 1.5209075541394304, 'edge_cap': 0.07433398402127339}.
[I 2025-08-30 04:26:01,348] Trial 287 finished with values: [-1000000000.0, 1000000000.0] and parameters: {'p_sma': 7, 'p_std': 60, 'p_atr': 8, 'p_adx': 25, 'rsi_period': 17, 'ema1': 25, 'ema2': 51, 'slip_atr_k': 0.015383772883890104, 'slip_spread_k': 0.7393749462266785, 'spread_hl_frac': 0.008190239470303687, 'bb_std_mult': 3.508468817791879, 'rsi_os': 23, 'rsi_ob': 65, 'vol_spike': 0.19295980457199946, 'adx_thresh': 20.24885683727908, 'atr_min_pct': 0.023541436484080934, 'atr_max_pct': 0.07010751832829344, 'tp_mult': 1.8221382527140937, 'tsl_mult': 0.20901175380434628, 'strategy': 'breakout', 'time_stop': 212, 'use_sma': False, 'use_atr': False, 'use_adx': False, 'use_ema': True, 'use_spike': True, 'rsi_required': False, 'edge_k': 1.2560348072171634, 'edge_cap': 0.9984208050073056}.
[I 2025-08-30 04:26:02,670] Trial 288 finished with values: [-1000000000.0, 1000000000.0] and parameters: {'p_sma': 14, 'p_std': 38, 'p_atr': 14, 'p_adx': 10, 'rsi_period': 40, 'ema1': 24, 'ema2': 38, 'slip_atr_k': 0.005158111958967507, 'slip_spread_k': 0.31727579238934156, 'spread_hl_frac': 0.010043141219675072, 'bb_std_mult': 2.269621495863186, 'rsi_os': 28, 'rsi_ob': 65, 'vol_spike': 0.18094668238872016, 'adx_thresh': 33.434923404049265, 'atr_min_pct': 0.02556796074423983, 'atr_max_pct': 0.046113314637825205, 'tp_mult': 2.3372754523644588, 'tsl_mult': 0.15345840790385412, 'strategy': 'breakout', 'time_stop': 99, 'use_sma': False, 'use_atr': False, 'use_adx': False, 'use_ema': True, 'use_spike': True, 'rsi_required': False, 'edge_k': 1.433061035834711, 'edge_cap': 0.538390719989239}.
[I 2025-08-30 04:26:03,259] Trial 286 finished with values: [-1000000000.0, 1000000000.0] and parameters: {'p_sma': 7, 'p_std': 60, 'p_atr': 19, 'p_adx': 9, 'rsi_period': 17, 'ema1': 16, 'ema2': 38, 'slip_atr_k': 0.07015715366821072, 'slip_spread_k': 0.7138664693296307, 'spread_hl_frac': 0.008197803030839043, 'bb_std_mult': 3.4869165717360717, 'rsi_os': 8, 'rsi_ob': 65, 'vol_spike': 0.06684471315928446, 'adx_thresh': 19.519201753983147, 'atr_min_pct': 0.025754223582425684, 'atr_max_pct': 0.14403304995504687, 'tp_mult': 1.8917740848007918, 'tsl_mult': 0.20779073507350504, 'strategy': 'breakout', 'time_stop': 110, 'use_sma': False, 'use_atr': False, 'use_adx': False, 'use_ema': True, 'use_spike': True, 'rsi_required': False, 'edge_k': 0.8601281903369656, 'edge_cap': 0.6711479217066032}.
[I 2025-08-30 04:26:03,781] Trial 285 finished with values: [-1000000000.0, 1000000000.0] and parameters: {'p_sma': 45, 'p_std': 60, 'p_atr': 20, 'p_adx': 9, 'rsi_period': 13, 'ema1': 16, 'ema2': 38, 'slip_atr_k': 1.9786563801521898e-06, 'slip_spread_k': 0.9631712966357491, 'spread_hl_frac': 0.023515612252070574, 'bb_std_mult': 3.490751549573807, 'rsi_os': 23, 'rsi_ob': 95, 'vol_spike': 0.17779000966454192, 'adx_thresh': 24.78457350086544, 'atr_min_pct': 0.0069175198428634375, 'atr_max_pct': 0.14581454485449402, 'tp_mult': 1.93021844632064, 'tsl_mult': 0.20569355495092675, 'strategy': 'breakout', 'time_stop': 109, 'use_sma': False, 'use_atr': False, 'use_adx': False, 'use_ema': True, 'use_spike': True, 'rsi_required': False, 'edge_k': 1.4287560975931017, 'edge_cap': 0.6816025409456429}.
[I 2025-08-30 04:26:46,919] Trial 292 finished with values: [-1000000000.0, 1000000000.0] and parameters: {'p_sma': 52, 'p_std': 35, 'p_atr': 10, 'p_adx': 24, 'rsi_period': 48, 'ema1': 14, 'ema2': 27, 'slip_atr_k': 0.1069259742412206, 'slip_spread_k': 0.7920589788488182, 'spread_hl_frac': 0.012094965767460804, 'bb_std_mult': 3.3117601205276093, 'rsi_os': 22, 'rsi_ob': 67, 'vol_spike': 0.20248550483888236, 'adx_thresh': 32.173160502645594, 'atr_min_pct': 0.014826653498125092, 'atr_max_pct': 0.14178590459660395, 'tp_mult': 1.0604078192098898, 'tsl_mult': 0.32116963709524926, 'strategy': 'breakout', 'time_stop': 213, 'use_sma': False, 'use_atr': False, 'use_adx': False, 'use_ema': True, 'use_spike': True, 'rsi_required': False, 'edge_k': 0.7535061705310573, 'edge_cap': 0.6465257594240337}.
[I 2025-08-30 04:26:47,767] Trial 289 finished with values: [-1000000000.0, 1000000000.0] and parameters: {'p_sma': 15, 'p_std': 37, 'p_atr': 19, 'p_adx': 10, 'rsi_period': 9, 'ema1': 22, 'ema2': 38, 'slip_atr_k': 0.005026513942169075, 'slip_spread_k': 0.7271909911567858, 'spread_hl_frac': 0.013057727324223709, 'bb_std_mult': 2.262364748411368, 'rsi_os': 30, 'rsi_ob': 80, 'vol_spike': 0.18101814001075253, 'adx_thresh': 21.464848515584684, 'atr_min_pct': 0.02551847565644879, 'atr_max_pct': 0.045702434981533584, 'tp_mult': 1.069169791833684, 'tsl_mult': 0.16132518544510893, 'strategy': 'breakout', 'time_stop': 93, 'use_sma': False, 'use_atr': False, 'use_adx': False, 'use_ema': True, 'use_spike': True, 'rsi_required': False, 'edge_k': 1.4109279088667814, 'edge_cap': 0.9354162362909748}.
[I 2025-08-30 04:26:48,303] Trial 290 finished with values: [-0.036626533966651054, 0.03657495591950721] and parameters: {'p_sma': 11, 'p_std': 50, 'p_atr': 22, 'p_adx': 24, 'rsi_period': 9, 'ema1': 22, 'ema2': 27, 'slip_atr_k': 0.04151160314110135, 'slip_spread_k': 0.9366972368235971, 'spread_hl_frac': 0.012728266880218369, 'bb_std_mult': 0.7270034441905835, 'rsi_os': 22, 'rsi_ob': 54, 'vol_spike': 0.052176020268384554, 'adx_thresh': 32.8384312987995, 'atr_min_pct': 4.2474668190460184e-05, 'atr_max_pct': 0.14205181722773835, 'tp_mult': 2.802799111844015, 'tsl_mult': 0.18763107082021002, 'strategy': 'breakout', 'time_stop': 214, 'use_sma': False, 'use_atr': False, 'use_adx': False, 'use_ema': True, 'use_spike': True, 'rsi_required': False, 'edge_k': 1.0190530175076018, 'edge_cap': 0.16535578064230355}.
[I 2025-08-30 04:26:48,886] Trial 291 finished with values: [-0.04328827305378147, 0.0432347752735229] and parameters: {'p_sma': 11, 'p_std': 50, 'p_atr': 10, 'p_adx': 24, 'rsi_period': 56, 'ema1': 23, 'ema2': 27, 'slip_atr_k': 0.13257561489388056, 'slip_spread_k': 0.7883493198171093, 'spread_hl_frac': 0.0035105556326249857, 'bb_std_mult': 1.6302754136801318, 'rsi_os': 54, 'rsi_ob': 67, 'vol_spike': 0.2040499611356455, 'adx_thresh': 31.980723430697388, 'atr_min_pct': 0.00120994395844618, 'atr_max_pct': 0.1413285883946949, 'tp_mult': 1.928078070409276, 'tsl_mult': 0.17437127771076022, 'strategy': 'breakout', 'time_stop': 73, 'use_sma': False, 'use_atr': False, 'use_adx': False, 'use_ema': True, 'use_spike': True, 'rsi_required': False, 'edge_k': 1.0011210934123171, 'edge_cap': 0.31360417826685544}.
[I 2025-08-30 04:26:49,450] Trial 295 finished with values: [-1000000000.0, 1000000000.0] and parameters: {'p_sma': 9, 'p_std': 46, 'p_atr': 9, 'p_adx': 18, 'rsi_period': 25, 'ema1': 14, 'ema2': 28, 'slip_atr_k': 0.021209988881688267, 'slip_spread_k': 0.7409668028683214, 'spread_hl_frac': 0.01899027856905898, 'bb_std_mult': 3.187128710082745, 'rsi_os': 24, 'rsi_ob': 66, 'vol_spike': 0.29929853783643245, 'adx_thresh': 31.659273103269864, 'atr_min_pct': 0.020295526656331126, 'atr_max_pct': 0.016313230488603836, 'tp_mult': 1.7980998871818263, 'tsl_mult': 0.27720497944644357, 'strategy': 'breakout', 'time_stop': 288, 'use_sma': False, 'use_atr': False, 'use_adx': False, 'use_ema': True, 'use_spike': True, 'rsi_required': False, 'edge_k': 1.5233354115553999, 'edge_cap': 0.5902872135088646}.
[I 2025-08-30 04:27:31,036] Trial 294 finished with values: [-1000000000.0, 1000000000.0] and parameters: {'p_sma': 11, 'p_std': 50, 'p_atr': 9, 'p_adx': 25, 'rsi_period': 36, 'ema1': 14, 'ema2': 32, 'slip_atr_k': 0.13353861786239674, 'slip_spread_k': 0.7508654557679583, 'spread_hl_frac': 0.020741131900048, 'bb_std_mult': 1.6782523516901322, 'rsi_os': 24, 'rsi_ob': 66, 'vol_spike': 0.26449002645116504, 'adx_thresh': 14.67375279371998, 'atr_min_pct': 0.0012408597496100498, 'atr_max_pct': 0.011595162498610923, 'tp_mult': 1.8062339530762586, 'tsl_mult': 0.2680575222038515, 'strategy': 'breakout', 'time_stop': 192, 'use_sma': False, 'use_atr': False, 'use_adx': False, 'use_ema': True, 'use_spike': True, 'rsi_required': False, 'edge_k': 1.5220665901300545, 'edge_cap': 0.5857295031972435}.
[I 2025-08-30 04:27:31,154] Trial 296 finished with values: [-0.024277353911077992, 0.02422075732236736] and parameters: {'p_sma': 9, 'p_std': 52, 'p_atr': 24, 'p_adx': 25, 'rsi_period': 24, 'ema1': 29, 'ema2': 32, 'slip_atr_k': 0.2373066100477726, 'slip_spread_k': 0.7075642146970735, 'spread_hl_frac': 0.009877131401044837, 'bb_std_mult': 1.7154298018647864, 'rsi_os': 24, 'rsi_ob': 66, 'vol_spike': 0.1874034623245125, 'adx_thresh': 15.407870099957119, 'atr_min_pct': 0.0006334345633439055, 'atr_max_pct': 0.14691049116474092, 'tp_mult': 1.8067326465263147, 'tsl_mult': 0.2748729504803395, 'strategy': 'breakout', 'time_stop': 193, 'use_sma': False, 'use_atr': False, 'use_adx': False, 'use_ema': True, 'use_spike': True, 'rsi_required': False, 'edge_k': 1.5055570971743926, 'edge_cap': 0.5866180290648857}.
[I 2025-08-30 04:27:31,909] Trial 293 finished with values: [-0.01630499946641828, 0.016255740203136568] and parameters: {'p_sma': 11, 'p_std': 50, 'p_atr': 9, 'p_adx': 21, 'rsi_period': 25, 'ema1': 14, 'ema2': 28, 'slip_atr_k': 0.023583713733666106, 'slip_spread_k': 0.7166094151277905, 'spread_hl_frac': 0.010129268218480831, 'bb_std_mult': 1.9579688200702883, 'rsi_os': 24, 'rsi_ob': 49, 'vol_spike': 0.1861378598893562, 'adx_thresh': 31.638160928251484, 'atr_min_pct': 1.1385969549984755e-05, 'atr_max_pct': 0.14708343493045514, 'tp_mult': 2.8106656503091747, 'tsl_mult': 0.1773661851873669, 'strategy': 'breakout', 'time_stop': 209, 'use_sma': False, 'use_atr': False, 'use_adx': False, 'use_ema': True, 'use_spike': True, 'rsi_required': False, 'edge_k': 1.52074628921664, 'edge_cap': 0.47677250509524544}.
