2025-08-30 03:32:19,900 WARNING: DATA SANITY: Extreme jumps >20*ATR200: 42
[I 2025-08-30 03:32:19,913] A new study created in memory with name: no-name-3544159c-3a5b-4d89-a8d6-a9c1faa36a6e
[I 2025-08-30 03:33:06,405] Trial 3 finished with values: [-1000000000.0, 1000000000.0] and parameters: {'p_sma': 16, 'p_std': 21, 'p_atr': 29, 'p_adx': 9, 'rsi_period': 48, 'ema1': 10, 'ema2': 59, 'slip_atr_k': 0.24819253013101766, 'slip_spread_k': 0.1637934486764402, 'spread_hl_frac': 0.021440250131245422, 'bb_std_mult': 3.0195815517052527, 'rsi_os': 43, 'rsi_ob': 89, 'vol_spike': 0.11311431863752802, 'adx_thresh': 17.855413767360304, 'atr_min_pct': 0.014799991932521989, 'atr_max_pct': 0.14338067218543307, 'tp_mult': 2.865253714413056, 'tsl_mult': 0.44054743296145615, 'strategy': 'mean_reversion', 'time_stop': 20, 'use_sma': True, 'use_atr': True, 'use_adx': False, 'use_ema': False, 'use_spike': True, 'rsi_required': False, 'edge_k': 1.3003837063126138, 'edge_cap': 0.9463943694875521}.
[I 2025-08-30 03:33:06,804] Trial 4 finished with values: [-1000000000.0, 1000000000.0] and parameters: {'p_sma': 53, 'p_std': 56, 'p_atr': 10, 'p_adx': 13, 'rsi_period': 34, 'ema1': 7, 'ema2': 10, 'slip_atr_k': 0.15136508885170827, 'slip_spread_k': 0.8767093953435631, 'spread_hl_frac': 0.042505673191406156, 'bb_std_mult': 3.400350297854609, 'rsi_os': 51, 'rsi_ob': 52, 'vol_spike': 0.05268613169804976, 'adx_thresh': 11.55404321006131, 'atr_min_pct': 0.019970810102991943, 'atr_max_pct': 0.07234631175963549, 'tp_mult': 2.7000106361848744, 'tsl_mult': 0.3078463162547356, 'strategy': 'mean_reversion', 'time_stop': 51, 'use_sma': False, 'use_atr': True, 'use_adx': False, 'use_ema': True, 'use_spike': True, 'rsi_required': True, 'edge_k': 0.3849942378336322, 'edge_cap': 0.10035797928941177}.
[I 2025-08-30 03:33:06,832] Trial 2 finished with values: [-1000000000.0, 1000000000.0] and parameters: {'p_sma': 59, 'p_std': 47, 'p_atr': 27, 'p_adx': 11, 'rsi_period': 29, 'ema1': 13, 'ema2': 19, 'slip_atr_k': 0.2338829736699124, 'slip_spread_k': 0.6963545773217852, 'spread_hl_frac': 0.015003428576050405, 'bb_std_mult': 0.615297287599638, 'rsi_os': 54, 'rsi_ob': 45, 'vol_spike': 0.14159379319170115, 'adx_thresh': 13.844286030108284, 'atr_min_pct': 0.010541349930334794, 'atr_max_pct': 0.1070961960713272, 'tp_mult': 2.321938129175056, 'tsl_mult': 0.8469285681130831, 'strategy': 'breakout', 'time_stop': 198, 'use_sma': False, 'use_atr': True, 'use_adx': True, 'use_ema': False, 'use_spike': False, 'rsi_required': False, 'edge_k': 0.9025757874970934, 'edge_cap': 0.9220928805101555}.
[I 2025-08-30 03:33:07,572] Trial 1 finished with values: [-1000000000.0, 1000000000.0] and parameters: {'p_sma': 34, 'p_std': 14, 'p_atr': 21, 'p_adx': 25, 'rsi_period': 20, 'ema1': 16, 'ema2': 11, 'slip_atr_k': 0.04173763619069762, 'slip_spread_k': 0.8999287751810419, 'spread_hl_frac': 0.04284870662500542, 'bb_std_mult': 1.4158287006011132, 'rsi_os': 45, 'rsi_ob': 82, 'vol_spike': 0.03565487787009205, 'adx_thresh': 34.10162473980322, 'atr_min_pct': 0.01277665250348231, 'atr_max_pct': 0.016111784947492686, 'tp_mult': 2.5532681746178407, 'tsl_mult': 0.27371445210634415, 'strategy': 'mean_reversion', 'time_stop': 258, 'use_sma': False, 'use_atr': True, 'use_adx': False, 'use_ema': False, 'use_spike': False, 'rsi_required': True, 'edge_k': 0.9268364404799387, 'edge_cap': 0.5116722378483524}.
[I 2025-08-30 03:33:08,448] Trial 0 finished with values: [-1000000000.0, 1000000000.0] and parameters: {'p_sma': 18, 'p_std': 51, 'p_atr': 29, 'p_adx': 9, 'rsi_period': 62, 'ema1': 15, 'ema2': 16, 'slip_atr_k': 0.0026302450279204748, 'slip_spread_k': 0.6960935714711102, 'spread_hl_frac': 0.030217169315981035, 'bb_std_mult': 2.7895689563488495, 'rsi_os': 49, 'rsi_ob': 76, 'vol_spike': 0.13277923655157362, 'adx_thresh': 5.852449713698436, 'atr_min_pct': 0.011649991675631905, 'atr_max_pct': 0.12741401208005232, 'tp_mult': 1.4849757836384412, 'tsl_mult': 0.7354597840386092, 'strategy': 'breakout', 'time_stop': 19, 'use_sma': False, 'use_atr': False, 'use_adx': True, 'use_ema': True, 'use_spike': True, 'rsi_required': False, 'edge_k': 0.26728806965141394, 'edge_cap': 0.4923262442547441}.
[I 2025-08-30 03:33:55,956] Trial 5 finished with values: [-1000000000.0, 1000000000.0] and parameters: {'p_sma': 40, 'p_std': 36, 'p_atr': 12, 'p_adx': 24, 'rsi_period': 30, 'ema1': 13, 'ema2': 44, 'slip_atr_k': 0.03334233395034522, 'slip_spread_k': 0.31634729663668737, 'spread_hl_frac': 0.025914121860909474, 'bb_std_mult': 0.7843795491274026, 'rsi_os': 36, 'rsi_ob': 81, 'vol_spike': 0.18302240680338677, 'adx_thresh': 11.53651338642348, 'atr_min_pct': 0.02122346479247471, 'atr_max_pct': 0.1201179547593177, 'tp_mult': 1.1974334430686757, 'tsl_mult': 0.9545244528350911, 'strategy': 'breakout', 'time_stop': 45, 'use_sma': False, 'use_atr': False, 'use_adx': True, 'use_ema': True, 'use_spike': True, 'rsi_required': False, 'edge_k': 1.0839792865450133, 'edge_cap': 0.77190916429262}.
[I 2025-08-30 03:33:57,758] Trial 6 finished with values: [-1000000000.0, 1000000000.0] and parameters: {'p_sma': 31, 'p_std': 12, 'p_atr': 7, 'p_adx': 14, 'rsi_period': 14, 'ema1': 17, 'ema2': 18, 'slip_atr_k': 0.12692669342080148, 'slip_spread_k': 0.4539243299532302, 'spread_hl_frac': 0.025816624160139565, 'bb_std_mult': 2.707325790704997, 'rsi_os': 7, 'rsi_ob': 60, 'vol_spike': 0.1700486200954722, 'adx_thresh': 6.313978076793588, 'atr_min_pct': 0.008073947868033286, 'atr_max_pct': 0.07071401195088822, 'tp_mult': 1.123957543920496, 'tsl_mult': 0.7201090322857375, 'strategy': 'breakout', 'time_stop': 172, 'use_sma': True, 'use_atr': False, 'use_adx': False, 'use_ema': True, 'use_spike': True, 'rsi_required': True, 'edge_k': 0.7026965918393757, 'edge_cap': 0.351579451467791}.
[I 2025-08-30 03:33:58,700] Trial 7 finished with values: [-1000000000.0, 1000000000.0] and parameters: {'p_sma': 19, 'p_std': 23, 'p_atr': 16, 'p_adx': 9, 'rsi_period': 32, 'ema1': 26, 'ema2': 17, 'slip_atr_k': 0.08720705591916536, 'slip_spread_k': 0.9863016434259729, 'spread_hl_frac': 0.04991840878494225, 'bb_std_mult': 3.343030720097175, 'rsi_os': 18, 'rsi_ob': 95, 'vol_spike': 0.23444910154576498, 'adx_thresh': 31.58126356243824, 'atr_min_pct': 0.022977828823470513, 'atr_max_pct': 0.10890049989135187, 'tp_mult': 2.007485082415032, 'tsl_mult': 0.730026546989097, 'strategy': 'mean_reversion', 'time_stop': 244, 'use_sma': False, 'use_atr': True, 'use_adx': True, 'use_ema': True, 'use_spike': False, 'rsi_required': True, 'edge_k': 1.7868045784761581, 'edge_cap': 0.4554217598006151}.
[I 2025-08-30 03:33:59,547] Trial 8 finished with values: [-1000000000.0, 1000000000.0] and parameters: {'p_sma': 42, 'p_std': 9, 'p_atr': 9, 'p_adx': 27, 'rsi_period': 16, 'ema1': 29, 'ema2': 24, 'slip_atr_k': 0.2062488198815281, 'slip_spread_k': 0.8306984243867065, 'spread_hl_frac': 0.019274526706624773, 'bb_std_mult': 1.5887192132265973, 'rsi_os': 46, 'rsi_ob': 64, 'vol_spike': 0.22191392817582606, 'adx_thresh': 31.229865645740066, 'atr_min_pct': 0.017360225786740898, 'atr_max_pct': 0.04114627336960326, 'tp_mult': 1.2367853949183405, 'tsl_mult': 0.30192097757836556, 'strategy': 'mean_reversion', 'time_stop': 42, 'use_sma': False, 'use_atr': False, 'use_adx': False, 'use_ema': False, 'use_spike': True, 'rsi_required': False, 'edge_k': 1.9597017412758835, 'edge_cap': 0.7990918132344208}.
[I 2025-08-30 03:34:52,059] Trial 9 finished with values: [-1000000000.0, 1000000000.0] and parameters: {'p_sma': 60, 'p_std': 35, 'p_atr': 28, 'p_adx': 16, 'rsi_period': 60, 'ema1': 18, 'ema2': 18, 'slip_atr_k': 0.17361659565385884, 'slip_spread_k': 0.9939312388576188, 'spread_hl_frac': 0.036256858733243184, 'bb_std_mult': 2.9300580436324895, 'rsi_os': 12, 'rsi_ob': 70, 'vol_spike': 0.2770190117100733, 'adx_thresh': 19.031423254152482, 'atr_min_pct': 0.02383302087301461, 'atr_max_pct': 0.06051955643135957, 'tp_mult': 1.1690428793518788, 'tsl_mult': 0.6235143403504149, 'strategy': 'mean_reversion', 'time_stop': 56, 'use_sma': True, 'use_atr': True, 'use_adx': True, 'use_ema': False, 'use_spike': False, 'rsi_required': True, 'edge_k': 1.8259138618510509, 'edge_cap': 0.37979014396339783}.
[I 2025-08-30 03:34:55,239] Trial 11 finished with values: [-1000000000.0, 1000000000.0] and parameters: {'p_sma': 28, 'p_std': 8, 'p_atr': 19, 'p_adx': 23, 'rsi_period': 62, 'ema1': 16, 'ema2': 49, 'slip_atr_k': 0.09288152356745946, 'slip_spread_k': 0.5601010835582271, 'spread_hl_frac': 0.03751832460305949, 'bb_std_mult': 3.581225673493095, 'rsi_os': 24, 'rsi_ob': 78, 'vol_spike': 0.021546741806870193, 'adx_thresh': 14.603665335951645, 'atr_min_pct': 0.022817663448906907, 'atr_max_pct': 0.13026005818955194, 'tp_mult': 1.4732972219176943, 'tsl_mult': 0.9997212157382446, 'strategy': 'breakout', 'time_stop': 198, 'use_sma': True, 'use_atr': False, 'use_adx': False, 'use_ema': False, 'use_spike': False, 'rsi_required': True, 'edge_k': 1.6446559736825708, 'edge_cap': 0.49528041037436665}.
[I 2025-08-30 03:34:56,336] Trial 10 finished with values: [-1000000000.0, 1000000000.0] and parameters: {'p_sma': 30, 'p_std': 36, 'p_atr': 20, 'p_adx': 9, 'rsi_period': 43, 'ema1': 20, 'ema2': 11, 'slip_atr_k': 0.17659269724961998, 'slip_spread_k': 0.4203900016424724, 'spread_hl_frac': 0.029641411560797543, 'bb_std_mult': 1.007236599635758, 'rsi_os': 29, 'rsi_ob': 73, 'vol_spike': 0.15989067425039813, 'adx_thresh': 27.773819963728357, 'atr_min_pct': 0.013288882118447878, 'atr_max_pct': 0.040595167973854804, 'tp_mult': 2.931981046663581, 'tsl_mult': 0.9668449314612774, 'strategy': 'breakout', 'time_stop': 50, 'use_sma': False, 'use_atr': False, 'use_adx': False, 'use_ema': False, 'use_spike': True, 'rsi_required': True, 'edge_k': 1.9851563953979843, 'edge_cap': 0.6111330126361043}.
[I 2025-08-30 03:34:57,441] Trial 12 finished with values: [-1000000000.0, 1000000000.0] and parameters: {'p_sma': 28, 'p_std': 27, 'p_atr': 21, 'p_adx': 22, 'rsi_period': 65, 'ema1': 13, 'ema2': 16, 'slip_atr_k': 0.13653396367787934, 'slip_spread_k': 0.999449104772856, 'spread_hl_frac': 0.0010637844396882091, 'bb_std_mult': 3.004328752574911, 'rsi_os': 29, 'rsi_ob': 64, 'vol_spike': 0.10556302325973918, 'adx_thresh': 13.058157553518466, 'atr_min_pct': 0.026829285072613382, 'atr_max_pct': 0.1480409176931091, 'tp_mult': 1.4195413417507967, 'tsl_mult': 0.8819699077470696, 'strategy': 'breakout', 'time_stop': 296, 'use_sma': True, 'use_atr': False, 'use_adx': False, 'use_ema': True, 'use_spike': False, 'rsi_required': True, 'edge_k': 1.6768820143516865, 'edge_cap': 0.9619458264092777}.
[I 2025-08-30 03:35:41,190] Trial 15 finished with values: [-1000000000.0, 1000000000.0] and parameters: {'p_sma': 5, 'p_std': 49, 'p_atr': 24, 'p_adx': 30, 'rsi_period': 84, 'ema1': 23, 'ema2': 34, 'slip_atr_k': 0.04050764055190262, 'slip_spread_k': 0.059820729133306105, 'spread_hl_frac': 0.0005323626629408704, 'bb_std_mult': 1.923877134517777, 'rsi_os': 40, 'rsi_ob': 56, 'vol_spike': 0.0823305400083919, 'adx_thresh': 23.773989025646838, 'atr_min_pct': 0.0005811157877277009, 'atr_max_pct': 0.01690915582170223, 'tp_mult': 1.7183049599653888, 'tsl_mult': 0.0013103243907032769, 'strategy': 'mean_reversion', 'time_stop': 294, 'use_sma': True, 'use_atr': False, 'use_adx': True, 'use_ema': True, 'use_spike': False, 'rsi_required': False, 'edge_k': 0.0526943999360181, 'edge_cap': 0.07412893216781774}.
[I 2025-08-30 03:35:42,153] Trial 17 finished with values: [-1000000000.0, 1000000000.0] and parameters: {'p_sma': 47, 'p_std': 45, 'p_atr': 16, 'p_adx': 19, 'rsi_period': 84, 'ema1': 5, 'ema2': 31, 'slip_atr_k': 0.0004427949010851473, 'slip_spread_k': 0.6331458731183377, 'spread_hl_frac': 0.010973095764214206, 'bb_std_mult': 2.1807377399768457, 'rsi_os': 19, 'rsi_ob': 45, 'vol_spike': 0.29593368873126435, 'adx_thresh': 34.84251123558662, 'atr_min_pct': 0.0002772118295519023, 'atr_max_pct': 0.09012813570789946, 'tp_mult': 2.4864953783141135, 'tsl_mult': 0.04029191578101243, 'strategy': 'mean_reversion', 'time_stop': 108, 'use_sma': False, 'use_atr': True, 'use_adx': True, 'use_ema': True, 'use_spike': True, 'rsi_required': False, 'edge_k': 0.01628155700703049, 'edge_cap': 0.21824588418769286}.
[I 2025-08-30 03:35:43,302] Trial 14 finished with values: [-1000000000.0, 1000000000.0] and parameters: {'p_sma': 9, 'p_std': 60, 'p_atr': 21, 'p_adx': 20, 'rsi_period': 82, 'ema1': 24, 'ema2': 36, 'slip_atr_k': 0.0031646480169785773, 'slip_spread_k': 0.07317986808521676, 'spread_hl_frac': 0.0008815657838743898, 'bb_std_mult': 2.0190208568612427, 'rsi_os': 31, 'rsi_ob': 79, 'vol_spike': 0.08450143062581979, 'adx_thresh': 24.724862131840794, 'atr_min_pct': 1.1542458279775042e-05, 'atr_max_pct': 0.010524596243818726, 'tp_mult': 1.6750041360323094, 'tsl_mult': 0.016813910808624488, 'strategy': 'breakout', 'time_stop': 295, 'use_sma': True, 'use_atr': False, 'use_adx': True, 'use_ema': True, 'use_spike': False, 'rsi_required': False, 'edge_k': 0.08300538487705089, 'edge_cap': 0.1356846413175551}.
[I 2025-08-30 03:35:44,652] Trial 13 finished with values: [-1000000000.0, 1000000000.0] and parameters: {'p_sma': 6, 'p_std': 58, 'p_atr': 23, 'p_adx': 19, 'rsi_period': 76, 'ema1': 24, 'ema2': 33, 'slip_atr_k': 0.0025094127754887036, 'slip_spread_k': 0.6307878132129157, 'spread_hl_frac': 0.01015360278261106, 'bb_std_mult': 2.28790664097622, 'rsi_os': 27, 'rsi_ob': 77, 'vol_spike': 0.09654668446481035, 'adx_thresh': 5.291775841942468, 'atr_min_pct': 0.0011781751635109323, 'atr_max_pct': 0.14767117331974072, 'tp_mult': 1.6525054893920852, 'tsl_mult': 0.019866102346476955, 'strategy': 'breakout', 'time_stop': 120, 'use_sma': True, 'use_atr': False, 'use_adx': True, 'use_ema': True, 'use_spike': True, 'rsi_required': False, 'edge_k': 0.027125080656596218, 'edge_cap': 0.10552752084927103}.
[I 2025-08-30 03:35:44,764] Trial 18 finished with values: [-1000000000.0, 1000000000.0] and parameters: {'p_sma': 6, 'p_std': 60, 'p_atr': 24, 'p_adx': 19, 'rsi_period': 71, 'ema1': 23, 'ema2': 43, 'slip_atr_k': 0.09972874404614265, 'slip_spread_k': 0.26170621077304457, 'spread_hl_frac': 0.009811668284121, 'bb_std_mult': 1.2249888869780365, 'rsi_os': 36, 'rsi_ob': 85, 'vol_spike': 0.0020007665287240795, 'adx_thresh': 5.036629211831578, 'atr_min_pct': 0.029876781408973395, 'atr_max_pct': 0.011451523446732642, 'tp_mult': 1.94899618194084, 'tsl_mult': 0.2410846514369261, 'strategy': 'breakout', 'time_stop': 116, 'use_sma': True, 'use_atr': True, 'use_adx': True, 'use_ema': False, 'use_spike': False, 'rsi_required': False, 'edge_k': 0.48920807448869286, 'edge_cap': 0.641788608450307}.
[I 2025-08-30 03:35:46,491] Trial 16 finished with values: [-1000000000.0, 1000000000.0] and parameters: {'p_sma': 5, 'p_std': 48, 'p_atr': 23, 'p_adx': 29, 'rsi_period': 81, 'ema1': 23, 'ema2': 32, 'slip_atr_k': 0.006849118585034633, 'slip_spread_k': 0.10506155147145024, 'spread_hl_frac': 0.0009064677553028595, 'bb_std_mult': 2.0991553046235296, 'rsi_os': 5, 'rsi_ob': 54, 'vol_spike': 0.28906016932025946, 'adx_thresh': 24.06176840063863, 'atr_min_pct': 0.00027181971624454064, 'atr_max_pct': 0.023085535984503212, 'tp_mult': 1.79993153879547, 'tsl_mult': 0.011371667016735532, 'strategy': 'mean_reversion', 'time_stop': 120, 'use_sma': True, 'use_atr': True, 'use_adx': True, 'use_ema': True, 'use_spike': False, 'rsi_required': False, 'edge_k': 0.18180416834468593, 'edge_cap': 0.06461670862136865}.
[I 2025-08-30 03:36:31,160] Trial 19 finished with values: [-1000000000.0, 1000000000.0] and parameters: {'p_sma': 20, 'p_std': 16, 'p_atr': 14, 'p_adx': 27, 'rsi_period': 53, 'ema1': 30, 'ema2': 55, 'slip_atr_k': 0.09039322845894046, 'slip_spread_k': 0.315404302900541, 'spread_hl_frac': 0.010327721949120017, 'bb_std_mult': 1.302269041793365, 'rsi_os': 5, 'rsi_ob': 87, 'vol_spike': 0.020683293875919218, 'adx_thresh': 5.401403353366883, 'atr_min_pct': 0.005864083315947073, 'atr_max_pct': 0.0950668082426459, 'tp_mult': 2.195734119361286, 'tsl_mult': 0.2308378097054533, 'strategy': 'mean_reversion', 'time_stop': 118, 'use_sma': False, 'use_atr': True, 'use_adx': False, 'use_ema': False, 'use_spike': False, 'rsi_required': True, 'edge_k': 1.4406687342824371, 'edge_cap': 0.6360938432121912}.
[I 2025-08-30 03:36:31,790] Trial 21 finished with values: [-1000000000.0, 1000000000.0] and parameters: {'p_sma': 20, 'p_std': 14, 'p_atr': 14, 'p_adx': 30, 'rsi_period': 52, 'ema1': 29, 'ema2': 57, 'slip_atr_k': 0.06400797982644005, 'slip_spread_k': 0.8043699821445982, 'spread_hl_frac': 0.04965653218246602, 'bb_std_mult': 2.5736304512798087, 'rsi_os': 5, 'rsi_ob': 91, 'vol_spike': 0.21523889767349724, 'adx_thresh': 23.165275394952893, 'atr_min_pct': 0.005716174419451502, 'atr_max_pct': 0.09235473523566332, 'tp_mult': 2.2294949350727804, 'tsl_mult': 0.5375483544609249, 'strategy': 'mean_reversion', 'time_stop': 242, 'use_sma': False, 'use_atr': True, 'use_adx': False, 'use_ema': False, 'use_spike': True, 'rsi_required': True, 'edge_k': 1.470390808348266, 'edge_cap': 0.3022057167848726}.
[I 2025-08-30 03:36:32,320] Trial 20 finished with values: [-1000000000.0, 1000000000.0] and parameters: {'p_sma': 21, 'p_std': 16, 'p_atr': 16, 'p_adx': 30, 'rsi_period': 50, 'ema1': 30, 'ema2': 59, 'slip_atr_k': 0.09089388456278659, 'slip_spread_k': 0.2690270479001758, 'spread_hl_frac': 0.047942113312315106, 'bb_std_mult': 1.1930080566212795, 'rsi_os': 6, 'rsi_ob': 90, 'vol_spike': 0.015058945830316028, 'adx_thresh': 22.239955675670465, 'atr_min_pct': 0.029420649022165152, 'atr_max_pct': 0.03610050659483846, 'tp_mult': 2.0288050186182276, 'tsl_mult': 0.20236598679464146, 'strategy': 'mean_reversion', 'time_stop': 112, 'use_sma': False, 'use_atr': True, 'use_adx': False, 'use_ema': False, 'use_spike': False, 'rsi_required': True, 'edge_k': 1.4135450811398473, 'edge_cap': 0.6637860217308749}.
[I 2025-08-30 03:36:33,318] Trial 22 finished with values: [-1000000000.0, 1000000000.0] and parameters: {'p_sma': 18, 'p_std': 17, 'p_atr': 14, 'p_adx': 7, 'rsi_period': 52, 'ema1': 30, 'ema2': 53, 'slip_atr_k': 0.05831657803212377, 'slip_spread_k': 0.34198446895357226, 'spread_hl_frac': 0.03132893887193122, 'bb_std_mult': 1.4467964885337168, 'rsi_os': 12, 'rsi_ob': 94, 'vol_spike': 0.2149974956921649, 'adx_thresh': 9.506516828881756, 'atr_min_pct': 0.005088343427111102, 'atr_max_pct': 0.09244813185411511, 'tp_mult': 2.210695304279139, 'tsl_mult': 0.5110641757032287, 'strategy': 'mean_reversion', 'time_stop': 250, 'use_sma': False, 'use_atr': True, 'use_adx': False, 'use_ema': False, 'use_spike': True, 'rsi_required': True, 'edge_k': 1.4558330898189218, 'edge_cap': 0.2375076481686395}.
[I 2025-08-30 03:37:19,322] Trial 24 finished with values: [-1000000000.0, 1000000000.0] and parameters: {'p_sma': 36, 'p_std': 41, 'p_atr': 26, 'p_adx': 13, 'rsi_period': 9, 'ema1': 9, 'ema2': 26, 'slip_atr_k': 0.2490397344306048, 'slip_spread_k': 0.6917178622506992, 'spread_hl_frac': 0.03190885783758839, 'bb_std_mult': 0.5054645522029377, 'rsi_os': 48, 'rsi_ob': 45, 'vol_spike': 0.13000458005276314, 'adx_thresh': 9.053642821984491, 'atr_min_pct': 0.011483790900678985, 'atr_max_pct': 0.04764658691535974, 'tp_mult': 2.4243277577446807, 'tsl_mult': 0.7956909647617539, 'strategy': 'breakout', 'time_stop': 214, 'use_sma': False, 'use_atr': True, 'use_adx': True, 'use_ema': False, 'use_spike': False, 'rsi_required': False, 'edge_k': 0.878079476275305, 'edge_cap': 0.8133881353797184}.
[I 2025-08-30 03:37:20,973] Trial 23 finished with values: [-1000000000.0, 1000000000.0] and parameters: {'p_sma': 38, 'p_std': 30, 'p_atr': 30, 'p_adx': 16, 'rsi_period': 21, 'ema1': 9, 'ema2': 26, 'slip_atr_k': 0.060714990551393344, 'slip_spread_k': 0.7694791446198065, 'spread_hl_frac': 0.04961611426551161, 'bb_std_mult': 2.618523522893351, 'rsi_os': 14, 'rsi_ob': 93, 'vol_spike': 0.21570866691669244, 'adx_thresh': 9.157777797483982, 'atr_min_pct': 0.004888102690188677, 'atr_max_pct': 0.050200487420346565, 'tp_mult': 2.595694156480335, 'tsl_mult': 0.48842146336979336, 'strategy': 'mean_reversion', 'time_stop': 245, 'use_sma': False, 'use_atr': True, 'use_adx': False, 'use_ema': False, 'use_spike': True, 'rsi_required': True, 'edge_k': 1.1703966845912985, 'edge_cap': 0.2875124239026494}.
[I 2025-08-30 03:37:20,992] Trial 26 finished with values: [-1000000000.0, 1000000000.0] and parameters: {'p_sma': 37, 'p_std': 42, 'p_atr': 26, 'p_adx': 16, 'rsi_period': 8, 'ema1': 9, 'ema2': 26, 'slip_atr_k': 0.23863552201536145, 'slip_spread_k': 0.7475401406280698, 'spread_hl_frac': 0.0175938227427283, 'bb_std_mult': 0.5637059631563051, 'rsi_os': 53, 'rsi_ob': 46, 'vol_spike': 0.13660724994253728, 'adx_thresh': 16.819584430493908, 'atr_min_pct': 0.011400984326223405, 'atr_max_pct': 0.053334994817911804, 'tp_mult': 2.53425223699334, 'tsl_mult': 0.8169867829691064, 'strategy': 'breakout', 'time_stop': 199, 'use_sma': False, 'use_atr': False, 'use_adx': True, 'use_ema': False, 'use_spike': False, 'rsi_required': False, 'edge_k': 0.8223040492168988, 'edge_cap': 0.8364575695357812}.
[I 2025-08-30 03:37:21,619] Trial 25 finished with values: [-1000000000.0, 1000000000.0] and parameters: {'p_sma': 37, 'p_std': 42, 'p_atr': 27, 'p_adx': 12, 'rsi_period': 22, 'ema1': 11, 'ema2': 26, 'slip_atr_k': 0.24652418052577674, 'slip_spread_k': 0.6243950739701563, 'spread_hl_frac': 0.016589281565196158, 'bb_std_mult': 0.5656593408794373, 'rsi_os': 55, 'rsi_ob': 46, 'vol_spike': 0.25274887239635224, 'adx_thresh': 8.638682701653856, 'atr_min_pct': 0.010983880894073062, 'atr_max_pct': 0.05898456322505709, 'tp_mult': 2.506463386694287, 'tsl_mult': 0.46549908580349375, 'strategy': 'breakout', 'time_stop': 205, 'use_sma': False, 'use_atr': False, 'use_adx': True, 'use_ema': False, 'use_spike': True, 'rsi_required': False, 'edge_k': 0.7627559072751011, 'edge_cap': 0.8538589721820066}.
