[I 2025-08-30 05:15:07,902] Trial 542 finished with values: [-1000000000.0, 1000000000.0] and parameters: {'p_sma': 11, 'p_std': 51, 'p_atr': 9, 'p_adx': 15, 'rsi_period': 22, 'ema1': 25, 'ema2': 20, 'slip_atr_k': 0.00029797752815033905, 'slip_spread_k': 0.8140314345597863, 'spread_hl_frac': 0.011972236191404164, 'bb_std_mult': 3.263039119247359, 'rsi_os': 30, 'rsi_ob': 90, 'vol_spike': 0.12894979996251074, 'adx_thresh': 31.93723627873186, 'atr_min_pct': 0.001363599948964707, 'atr_max_pct': 0.13695217593310857, 'tp_mult': 1.1396805842090454, 'tsl_mult': 0.23863632410154373, 'strategy': 'mean_reversion', 'time_stop': 151, 'use_sma': False, 'use_atr': True, 'use_adx': False, 'use_ema': False, 'use_spike': True, 'rsi_required': True, 'edge_k': 1.387036661519552, 'edge_cap': 0.6131089530643894}.
[I 2025-08-30 05:15:08,984] Trial 539 finished with values: [-1000000000.0, 1000000000.0] and parameters: {'p_sma': 11, 'p_std': 18, 'p_atr': 23, 'p_adx': 26, 'rsi_period': 39, 'ema1': 25, 'ema2': 26, 'slip_atr_k': 0.01475974016096328, 'slip_spread_k': 0.19413029298696122, 'spread_hl_frac': 0.005935034466811973, 'bb_std_mult': 3.316142404643455, 'rsi_os': 23, 'rsi_ob': 65, 'vol_spike': 0.004020251124393859, 'adx_thresh': 19.10281766225173, 'atr_min_pct': 0.009421848441875632, 'atr_max_pct': 0.13730576133001113, 'tp_mult': 1.7223536966775603, 'tsl_mult': 0.7483659813352953, 'strategy': 'breakout', 'time_stop': 285, 'use_sma': True, 'use_atr': False, 'use_adx': True, 'use_ema': True, 'use_spike': True, 'rsi_required': False, 'edge_k': 1.0613873113212453, 'edge_cap': 0.4318130321491988}.
[I 2025-08-30 05:15:09,498] Trial 541 finished with values: [-0.11477960065809545, 0.11473687974198118] and parameters: {'p_sma': 10, 'p_std': 5, 'p_atr': 9, 'p_adx': 23, 'rsi_period': 20, 'ema1': 16, 'ema2': 60, 'slip_atr_k': 0.0002866252042350642, 'slip_spread_k': 0.8270960638064637, 'spread_hl_frac': 0.03958511068280508, 'bb_std_mult': 3.249883411699878, 'rsi_os': 42, 'rsi_ob': 65, 'vol_spike': 0.12701478969187754, 'adx_thresh': 29.40225181776096, 'atr_min_pct': 0.0005300840488664563, 'atr_max_pct': 0.05672141893241894, 'tp_mult': 2.209062703565245, 'tsl_mult': 0.6876420792047024, 'strategy': 'mean_reversion', 'time_stop': 218, 'use_sma': False, 'use_atr': True, 'use_adx': False, 'use_ema': False, 'use_spike': True, 'rsi_required': True, 'edge_k': 1.391229903848861, 'edge_cap': 0.4305515283285489}.
[I 2025-08-30 05:15:10,025] Trial 543 finished with values: [-0.02242839593383905, 0.022384310258183483] and parameters: {'p_sma': 8, 'p_std': 50, 'p_atr': 9, 'p_adx': 15, 'rsi_period': 22, 'ema1': 15, 'ema2': 60, 'slip_atr_k': 0.0004523229928423238, 'slip_spread_k': 0.40367137245724416, 'spread_hl_frac': 0.01180807815048902, 'bb_std_mult': 2.1957380685926307, 'rsi_os': 32, 'rsi_ob': 65, 'vol_spike': 0.18043842181547276, 'adx_thresh': 34.72545769921932, 'atr_min_pct': 0.0014060812616153125, 'atr_max_pct': 0.0566926194908437, 'tp_mult': 2.672897705229787, 'tsl_mult': 0.6857524451977882, 'strategy': 'breakout', 'time_stop': 247, 'use_sma': False, 'use_atr': True, 'use_adx': False, 'use_ema': True, 'use_spike': True, 'rsi_required': True, 'edge_k': 0.9685256115480927, 'edge_cap': 0.17806650127238222}.
[I 2025-08-30 05:15:53,777] Trial 546 finished with values: [-1000000000.0, 1000000000.0] and parameters: {'p_sma': 8, 'p_std': 50, 'p_atr': 18, 'p_adx': 20, 'rsi_period': 33, 'ema1': 15, 'ema2': 40, 'slip_atr_k': 6.032810773588804e-05, 'slip_spread_k': 0.6634316606470835, 'spread_hl_frac': 0.01439283137490296, 'bb_std_mult': 2.709906968510091, 'rsi_os': 24, 'rsi_ob': 81, 'vol_spike': 0.276258429401534, 'adx_thresh': 34.94185508165245, 'atr_min_pct': 0.0005408569404752574, 'atr_max_pct': 0.14631701096463517, 'tp_mult': 2.389423496997907, 'tsl_mult': 0.18378749753404466, 'strategy': 'breakout', 'time_stop': 209, 'use_sma': False, 'use_atr': False, 'use_adx': False, 'use_ema': True, 'use_spike': True, 'rsi_required': False, 'edge_k': 0.9855145552332978, 'edge_cap': 0.5820776926641807}.
[I 2025-08-30 05:15:55,185] Trial 547 finished with values: [-1000000000.0, 1000000000.0] and parameters: {'p_sma': 18, 'p_std': 45, 'p_atr': 14, 'p_adx': 24, 'rsi_period': 33, 'ema1': 15, 'ema2': 40, 'slip_atr_k': 0.008977962934182421, 'slip_spread_k': 0.6492516357440183, 'spread_hl_frac': 0.01338591017760963, 'bb_std_mult': 2.536088889030366, 'rsi_os': 24, 'rsi_ob': 87, 'vol_spike': 0.22641330571234125, 'adx_thresh': 34.28227786454577, 'atr_min_pct': 0.01610732425281627, 'atr_max_pct': 0.14635202183257395, 'tp_mult': 1.2981512599768752, 'tsl_mult': 0.18035934580271018, 'strategy': 'breakout', 'time_stop': 247, 'use_sma': False, 'use_atr': False, 'use_adx': False, 'use_ema': True, 'use_spike': True, 'rsi_required': False, 'edge_k': 1.5312401784248884, 'edge_cap': 0.17773378664306388}.
[I 2025-08-30 05:15:56,289] Trial 545 finished with values: [-1000000000.0, 1000000000.0] and parameters: {'p_sma': 18, 'p_std': 11, 'p_atr': 9, 'p_adx': 24, 'rsi_period': 66, 'ema1': 15, 'ema2': 27, 'slip_atr_k': 0.13826262319346289, 'slip_spread_k': 0.4036413674269607, 'spread_hl_frac': 0.035229241434145867, 'bb_std_mult': 3.482238295541122, 'rsi_os': 16, 'rsi_ob': 87, 'vol_spike': 0.17902482048285173, 'adx_thresh': 28.982916062846975, 'atr_min_pct': 0.0007338658414126962, 'atr_max_pct': 0.04718604452298115, 'tp_mult': 2.378172234698923, 'tsl_mult': 0.17061378778118402, 'strategy': 'breakout', 'time_stop': 221, 'use_sma': False, 'use_atr': False, 'use_adx': False, 'use_ema': True, 'use_spike': True, 'rsi_required': True, 'edge_k': 1.5253070062328877, 'edge_cap': 0.6396414438021921}.
[I 2025-08-30 05:15:56,290] Trial 544 finished with values: [-0.054302309608592614, 0.054250534597676495] and parameters: {'p_sma': 8, 'p_std': 12, 'p_atr': 9, 'p_adx': 24, 'rsi_period': 66, 'ema1': 15, 'ema2': 27, 'slip_atr_k': 0.01575873803038711, 'slip_spread_k': 0.19049645065741755, 'spread_hl_frac': 0.03921548477702026, 'bb_std_mult': 2.2115608912963407, 'rsi_os': 42, 'rsi_ob': 75, 'vol_spike': 0.06519658028177187, 'adx_thresh': 31.127385062125573, 'atr_min_pct': 0.0005420853382120384, 'atr_max_pct': 0.05075849362802095, 'tp_mult': 2.2376356505266948, 'tsl_mult': 0.1795589384732743, 'strategy': 'breakout', 'time_stop': 220, 'use_sma': False, 'use_atr': False, 'use_adx': False, 'use_ema': True, 'use_spike': True, 'rsi_required': True, 'edge_k': 1.5266276078096808, 'edge_cap': 0.5808099435852141}.
[I 2025-08-30 05:16:39,073] Trial 550 finished with values: [-1000000000.0, 1000000000.0] and parameters: {'p_sma': 6, 'p_std': 33, 'p_atr': 8, 'p_adx': 14, 'rsi_period': 22, 'ema1': 16, 'ema2': 47, 'slip_atr_k': 0.006661630697705293, 'slip_spread_k': 0.6114966739319689, 'spread_hl_frac': 0.011585448567641677, 'bb_std_mult': 3.461233310721533, 'rsi_os': 26, 'rsi_ob': 67, 'vol_spike': 0.18847120526889366, 'adx_thresh': 15.29191378754999, 'atr_min_pct': 0.02328914093818023, 'atr_max_pct': 0.07797666913214427, 'tp_mult': 1.854331150680576, 'tsl_mult': 0.30614971951259107, 'strategy': 'breakout', 'time_stop': 125, 'use_sma': False, 'use_atr': True, 'use_adx': False, 'use_ema': True, 'use_spike': False, 'rsi_required': False, 'edge_k': 0.24597591240250616, 'edge_cap': 0.12885065574946675}.
[I 2025-08-30 05:16:39,647] Trial 549 finished with values: [-1000000000.0, 1000000000.0] and parameters: {'p_sma': 8, 'p_std': 51, 'p_atr': 27, 'p_adx': 27, 'rsi_period': 59, 'ema1': 13, 'ema2': 47, 'slip_atr_k': 0.04470775400647514, 'slip_spread_k': 0.7388551121487982, 'spread_hl_frac': 0.011226893337071001, 'bb_std_mult': 2.205479621094411, 'rsi_os': 26, 'rsi_ob': 67, 'vol_spike': 0.1789877711420487, 'adx_thresh': 31.308486394107582, 'atr_min_pct': 0.02118188074723542, 'atr_max_pct': 0.02783182372633928, 'tp_mult': 1.8562277340241022, 'tsl_mult': 0.30539067895683325, 'strategy': 'breakout', 'time_stop': 34, 'use_sma': False, 'use_atr': False, 'use_adx': False, 'use_ema': True, 'use_spike': True, 'rsi_required': True, 'edge_k': 1.4730744757809653, 'edge_cap': 0.643643715030302}.
[I 2025-08-30 05:16:40,662] Trial 551 finished with values: [-0.06600707459676325, 0.06598456880066972] and parameters: {'p_sma': 7, 'p_std': 9, 'p_atr': 15, 'p_adx': 25, 'rsi_period': 22, 'ema1': 13, 'ema2': 29, 'slip_atr_k': 0.07788804386314926, 'slip_spread_k': 0.998330679448842, 'spread_hl_frac': 0.011029551829195239, 'bb_std_mult': 3.4895625622910997, 'rsi_os': 46, 'rsi_ob': 45, 'vol_spike': 0.18669588507595428, 'adx_thresh': 27.04592558557556, 'atr_min_pct': 0.001560178850247745, 'atr_max_pct': 0.1426623700899935, 'tp_mult': 2.3246877822822096, 'tsl_mult': 0.8157136420106088, 'strategy': 'breakout', 'time_stop': 212, 'use_sma': False, 'use_atr': True, 'use_adx': False, 'use_ema': True, 'use_spike': False, 'rsi_required': False, 'edge_k': 1.4807683399976908, 'edge_cap': 0.6592446694920167}.
[I 2025-08-30 05:16:41,226] Trial 548 finished with values: [-1000000000.0, 1000000000.0] and parameters: {'p_sma': 8, 'p_std': 46, 'p_atr': 14, 'p_adx': 24, 'rsi_period': 59, 'ema1': 13, 'ema2': 47, 'slip_atr_k': 0.04626521123491635, 'slip_spread_k': 0.7450328890176776, 'spread_hl_frac': 0.016027587579567605, 'bb_std_mult': 2.336789552056353, 'rsi_os': 26, 'rsi_ob': 67, 'vol_spike': 0.1792666151091998, 'adx_thresh': 27.11255575679823, 'atr_min_pct': 0.0006125472137228513, 'atr_max_pct': 0.018008922547247938, 'tp_mult': 1.8485869465326745, 'tsl_mult': 0.8178617873767484, 'strategy': 'breakout', 'time_stop': 220, 'use_sma': False, 'use_atr': False, 'use_adx': False, 'use_ema': True, 'use_spike': True, 'rsi_required': True, 'edge_k': 1.5262007994304483, 'edge_cap': 0.6411638860813591}.
[I 2025-08-30 05:16:41,900] Trial 554 finished with values: [-1000000000.0, 1000000000.0] and parameters: {'p_sma': 45, 'p_std': 41, 'p_atr': 10, 'p_adx': 25, 'rsi_period': 84, 'ema1': 22, 'ema2': 28, 'slip_atr_k': 0.01278794804928339, 'slip_spread_k': 0.8446370675992474, 'spread_hl_frac': 0.009618700171692278, 'bb_std_mult': 1.6844931262312606, 'rsi_os': 51, 'rsi_ob': 66, 'vol_spike': 0.2473543461417554, 'adx_thresh': 17.834268723995955, 'atr_min_pct': 0.027050593263240448, 'atr_max_pct': 0.1002655556147781, 'tp_mult': 1.7803919975857303, 'tsl_mult': 0.7898559701349337, 'strategy': 'mean_reversion', 'time_stop': 98, 'use_sma': True, 'use_atr': False, 'use_adx': True, 'use_ema': False, 'use_spike': True, 'rsi_required': False, 'edge_k': 1.7351901850823666, 'edge_cap': 0.6741478002898724}.
[I 2025-08-30 05:17:21,808] Trial 552 finished with values: [-1000000000.0, 1000000000.0] and parameters: {'p_sma': 16, 'p_std': 56, 'p_atr': 19, 'p_adx': 28, 'rsi_period': 49, 'ema1': 13, 'ema2': 34, 'slip_atr_k': 0.09278895942394463, 'slip_spread_k': 0.7427591518136735, 'spread_hl_frac': 0.009854801639377775, 'bb_std_mult': 1.4039519154984152, 'rsi_os': 47, 'rsi_ob': 93, 'vol_spike': 0.014317598427363493, 'adx_thresh': 24.313792990367446, 'atr_min_pct': 0.021028006664811718, 'atr_max_pct': 0.09763848817139559, 'tp_mult': 2.318739138747247, 'tsl_mult': 0.21469159595662957, 'strategy': 'mean_reversion', 'time_stop': 213, 'use_sma': False, 'use_atr': False, 'use_adx': False, 'use_ema': False, 'use_spike': True, 'rsi_required': False, 'edge_k': 1.4824450239083475, 'edge_cap': 0.6599146039533121}.
[I 2025-08-30 05:17:23,506] Trial 555 finished with values: [-1000000000.0, 1000000000.0] and parameters: {'p_sma': 45, 'p_std': 56, 'p_atr': 10, 'p_adx': 25, 'rsi_period': 49, 'ema1': 18, 'ema2': 23, 'slip_atr_k': 0.057647572734717475, 'slip_spread_k': 0.7798313566097144, 'spread_hl_frac': 0.0009890721624267011, 'bb_std_mult': 3.3842209007313757, 'rsi_os': 5, 'rsi_ob': 59, 'vol_spike': 0.24880373481289553, 'adx_thresh': 32.00701806815658, 'atr_min_pct': 0.00297592188078432, 'atr_max_pct': 0.14450438639945756, 'tp_mult': 1.813753857129695, 'tsl_mult': 0.21464006590156143, 'strategy': 'mean_reversion', 'time_stop': 208, 'use_sma': True, 'use_atr': False, 'use_adx': True, 'use_ema': False, 'use_spike': True, 'rsi_required': False, 'edge_k': 0.6510678250129716, 'edge_cap': 0.9825949923839008}.
[I 2025-08-30 05:17:24,144] Trial 553 finished with values: [-0.10038658286625357, 0.10033766172819314] and parameters: {'p_sma': 45, 'p_std': 54, 'p_atr': 10, 'p_adx': 25, 'rsi_period': 18, 'ema1': 22, 'ema2': 29, 'slip_atr_k': 0.09234119069102512, 'slip_spread_k': 0.856211130576472, 'spread_hl_frac': 0.009845185129294186, 'bb_std_mult': 3.0447943033637133, 'rsi_os': 24, 'rsi_ob': 54, 'vol_spike': 0.24821953650192774, 'adx_thresh': 9.381983592914493, 'atr_min_pct': 0.0018997889086041992, 'atr_max_pct': 0.10304726094240929, 'tp_mult': 2.6562574922059783, 'tsl_mult': 0.5049746594851771, 'strategy': 'mean_reversion', 'time_stop': 212, 'use_sma': False, 'use_atr': False, 'use_adx': False, 'use_ema': False, 'use_spike': True, 'rsi_required': False, 'edge_k': 0.410079703245278, 'edge_cap': 0.40500295157278127}.
[I 2025-08-30 05:17:24,152] Trial 556 finished with values: [-1000000000.0, 1000000000.0] and parameters: {'p_sma': 48, 'p_std': 55, 'p_atr': 7, 'p_adx': 25, 'rsi_period': 63, 'ema1': 14, 'ema2': 27, 'slip_atr_k': 0.05901129192197467, 'slip_spread_k': 0.7741110197640134, 'spread_hl_frac': 0.0019318457741393374, 'bb_std_mult': 3.3665982462114195, 'rsi_os': 25, 'rsi_ob': 68, 'vol_spike': 0.11076622122994292, 'adx_thresh': 32.23541525806428, 'atr_min_pct': 0.002734394242017403, 'atr_max_pct': 0.1468944000603589, 'tp_mult': 1.9286670904195649, 'tsl_mult': 0.4138642827013667, 'strategy': 'mean_reversion', 'time_stop': 206, 'use_sma': False, 'use_atr': False, 'use_adx': False, 'use_ema': False, 'use_spike': True, 'rsi_required': False, 'edge_k': 1.5712642153631569, 'edge_cap': 0.3226220295758635}.
[I 2025-08-30 05:18:07,426] Trial 560 finished with values: [-1000000000.0, 0.16333889867736864] and parameters: {'p_sma': 13, 'p_std': 26, 'p_atr': 24, 'p_adx': 26, 'rsi_period': 27, 'ema1': 16, 'ema2': 42, 'slip_atr_k': 0.19301074880328484, 'slip_spread_k': 0.37865602779898894, 'spread_hl_frac': 0.043658995748585186, 'bb_std_mult': 3.316520608655185, 'rsi_os': 54, 'rsi_ob': 64, 'vol_spike': 0.1950552622164284, 'adx_thresh': 22.65883537453379, 'atr_min_pct': 2.723857912674527e-05, 'atr_max_pct': 0.1204579580958288, 'tp_mult': 1.8730475179216868, 'tsl_mult': 0.2401516177135878, 'strategy': 'breakout', 'time_stop': 198, 'use_sma': False, 'use_atr': True, 'use_adx': False, 'use_ema': True, 'use_spike': False, 'rsi_required': False, 'edge_k': 1.4194770951245732, 'edge_cap': 0.6028393149200086}.
[I 2025-08-30 05:18:08,595] Trial 558 finished with values: [-1000000000.0, 1000000000.0] and parameters: {'p_sma': 13, 'p_std': 54, 'p_atr': 7, 'p_adx': 25, 'rsi_period': 17, 'ema1': 11, 'ema2': 29, 'slip_atr_k': 0.021877695675862008, 'slip_spread_k': 0.7654241788384994, 'spread_hl_frac': 0.01264874672132351, 'bb_std_mult': 0.6258322713337525, 'rsi_os': 11, 'rsi_ob': 64, 'vol_spike': 0.19683887195526595, 'adx_thresh': 6.377778498840696, 'atr_min_pct': 0.0019665995709007623, 'atr_max_pct': 0.1499103285661441, 'tp_mult': 1.8750893025671709, 'tsl_mult': 0.24122785233920396, 'strategy': 'breakout', 'time_stop': 203, 'use_sma': False, 'use_atr': False, 'use_adx': False, 'use_ema': True, 'use_spike': True, 'rsi_required': False, 'edge_k': 0.41184479008427544, 'edge_cap': 0.6105395186046634}.
[I 2025-08-30 05:18:09,047] Trial 559 finished with values: [-1000000000.0, 1000000000.0] and parameters: {'p_sma': 10, 'p_std': 52, 'p_atr': 24, 'p_adx': 26, 'rsi_period': 17, 'ema1': 8, 'ema2': 26, 'slip_atr_k': 0.024771377865383654, 'slip_spread_k': 0.7092417456397372, 'spread_hl_frac': 0.040655747669565215, 'bb_std_mult': 3.3115396265043726, 'rsi_os': 8, 'rsi_ob': 70, 'vol_spike': 0.1930157473146696, 'adx_thresh': 33.381684556137955, 'atr_min_pct': 2.9408566339887388e-05, 'atr_max_pct': 0.08508877402513282, 'tp_mult': 1.8767825281460158, 'tsl_mult': 0.24051010061228115, 'strategy': 'breakout', 'time_stop': 200, 'use_sma': False, 'use_atr': True, 'use_adx': False, 'use_ema': True, 'use_spike': False, 'rsi_required': False, 'edge_k': 1.6149018530292916, 'edge_cap': 0.6139304287452372}.
[I 2025-08-30 05:18:09,564] Trial 557 finished with values: [-0.04658240468131336, 0.04653276053042112] and parameters: {'p_sma': 10, 'p_std': 52, 'p_atr': 24, 'p_adx': 25, 'rsi_period': 18, 'ema1': 14, 'ema2': 26, 'slip_atr_k': 0.024805185630601738, 'slip_spread_k': 0.7710314844053995, 'spread_hl_frac': 0.0019377929609369245, 'bb_std_mult': 0.8054190928918912, 'rsi_os': 53, 'rsi_ob': 71, 'vol_spike': 0.1937241308857419, 'adx_thresh': 31.92440118635742, 'atr_min_pct': 7.84607185620213e-05, 'atr_max_pct': 0.12089463259167668, 'tp_mult': 2.785869986568547, 'tsl_mult': 0.24274013774584383, 'strategy': 'breakout', 'time_stop': 58, 'use_sma': False, 'use_atr': False, 'use_adx': False, 'use_ema': True, 'use_spike': True, 'rsi_required': False, 'edge_k': 1.5839409403142537, 'edge_cap': 0.9461236456637474}.
[I 2025-08-30 05:18:09,912] Trial 563 finished with values: [-1000000000.0, 1000000000.0] and parameters: {'p_sma': 9, 'p_std': 19, 'p_atr': 8, 'p_adx': 10, 'rsi_period': 20, 'ema1': 15, 'ema2': 31, 'slip_atr_k': 0.005358978734165641, 'slip_spread_k': 0.7935709513783731, 'spread_hl_frac': 0.007492489258082081, 'bb_std_mult': 3.458754386601462, 'rsi_os': 23, 'rsi_ob': 66, 'vol_spike': 0.16736220267553853, 'adx_thresh': 6.8668162064397755, 'atr_min_pct': 0.029620418969506016, 'atr_max_pct': 0.01404466304893201, 'tp_mult': 1.8233999163285728, 'tsl_mult': 0.27211225812234513, 'strategy': 'breakout', 'time_stop': 206, 'use_sma': True, 'use_atr': False, 'use_adx': True, 'use_ema': True, 'use_spike': True, 'rsi_required': True, 'edge_k': 1.2877563423536231, 'edge_cap': 0.5136568746669832}.
[I 2025-08-30 05:18:55,219] Trial 561 finished with values: [-1000000000.0, 1000000000.0] and parameters: {'p_sma': 10, 'p_std': 19, 'p_atr': 21, 'p_adx': 10, 'rsi_period': 18, 'ema1': 15, 'ema2': 32, 'slip_atr_k': 0.23941272081113407, 'slip_spread_k': 0.7136256350009595, 'spread_hl_frac': 0.02180195029505155, 'bb_std_mult': 3.541838765676613, 'rsi_os': 22, 'rsi_ob': 66, 'vol_spike': 0.1370839571110035, 'adx_thresh': 7.194565161145981, 'atr_min_pct': 0.016944425153461347, 'atr_max_pct': 0.14066053236146014, 'tp_mult': 1.8967161100591927, 'tsl_mult': 0.2500935525120334, 'strategy': 'breakout', 'time_stop': 260, 'use_sma': False, 'use_atr': False, 'use_adx': True, 'use_ema': True, 'use_spike': True, 'rsi_required': False, 'edge_k': 1.798209116105959, 'edge_cap': 0.2762358079481029}.
[I 2025-08-30 05:18:55,876] Trial 565 finished with values: [-0.017398308269240492, 0.017346514822508333] and parameters: {'p_sma': 12, 'p_std': 50, 'p_atr': 8, 'p_adx': 27, 'rsi_period': 35, 'ema1': 24, 'ema2': 28, 'slip_atr_k': 0.007137849351471413, 'slip_spread_k': 0.14870987317942896, 'spread_hl_frac': 0.032513762187669056, 'bb_std_mult': 3.5380819891606325, 'rsi_os': 35, 'rsi_ob': 61, 'vol_spike': 0.18269491513453395, 'adx_thresh': 32.5601543950202, 'atr_min_pct': 0.0011104418452303833, 'atr_max_pct': 0.14277004796452875, 'tp_mult': 1.4798845316593114, 'tsl_mult': 0.03517671237985087, 'strategy': 'breakout', 'time_stop': 265, 'use_sma': True, 'use_atr': False, 'use_adx': True, 'use_ema': True, 'use_spike': True, 'rsi_required': False, 'edge_k': 1.4644580685103405, 'edge_cap': 0.2600711041550005}.
[I 2025-08-30 05:18:56,041] Trial 562 finished with values: [-0.052841860772826266, 0.052785703294684516] and parameters: {'p_sma': 10, 'p_std': 19, 'p_atr': 8, 'p_adx': 10, 'rsi_period': 11, 'ema1': 8, 'ema2': 32, 'slip_atr_k': 0.2396731811565787, 'slip_spread_k': 0.7138060682282988, 'spread_hl_frac': 0.007416017084386443, 'bb_std_mult': 0.8993217938715048, 'rsi_os': 8, 'rsi_ob': 70, 'vol_spike': 0.18542599430889323, 'adx_thresh': 32.93913634444098, 'atr_min_pct': 1.7664128257949074e-06, 'atr_max_pct': 0.1402078473314927, 'tp_mult': 2.815919716338253, 'tsl_mult': 0.25497629582586095, 'strategy': 'breakout', 'time_stop': 142, 'use_sma': True, 'use_atr': True, 'use_adx': True, 'use_ema': True, 'use_spike': True, 'rsi_required': False, 'edge_k': 0.6976226168629049, 'edge_cap': 0.6835936433141024}.
[I 2025-08-30 05:18:56,253] Trial 564 finished with values: [-1000000000.0, 1000000000.0] and parameters: {'p_sma': 9, 'p_std': 50, 'p_atr': 8, 'p_adx': 24, 'rsi_period': 20, 'ema1': 21, 'ema2': 15, 'slip_atr_k': 0.12099050428499862, 'slip_spread_k': 0.7215373688574439, 'spread_hl_frac': 0.02173972998080005, 'bb_std_mult': 3.4866239727087613, 'rsi_os': 23, 'rsi_ob': 66, 'vol_spike': 0.16973013221614813, 'adx_thresh': 32.59765416308194, 'atr_min_pct': 0.001060949875388534, 'atr_max_pct': 0.14042649756923511, 'tp_mult': 2.011095707992038, 'tsl_mult': 0.2039708774411045, 'strategy': 'breakout', 'time_stop': 271, 'use_sma': True, 'use_atr': False, 'use_adx': True, 'use_ema': True, 'use_spike': True, 'rsi_required': True, 'edge_k': 0.7281766711366735, 'edge_cap': 0.25525507298417965}.
[I 2025-08-30 05:19:36,508] Trial 569 finished with values: [-0.02568126170097562, 0.025633348567100363] and parameters: {'p_sma': 6, 'p_std': 51, 'p_atr': 9, 'p_adx': 15, 'rsi_period': 23, 'ema1': 27, 'ema2': 51, 'slip_atr_k': 0.007573876305213207, 'slip_spread_k': 0.13962838937536814, 'spread_hl_frac': 0.01209000621017234, 'bb_std_mult': 1.557340811874604, 'rsi_os': 35, 'rsi_ob': 68, 'vol_spike': 0.2672511688622659, 'adx_thresh': 30.843353153220754, 'atr_min_pct': 0.0009233483878421718, 'atr_max_pct': 0.14470353501073124, 'tp_mult': 1.9418438500091748, 'tsl_mult': 0.21193951860203614, 'strategy': 'breakout', 'time_stop': 216, 'use_sma': False, 'use_atr': False, 'use_adx': False, 'use_ema': True, 'use_spike': False, 'rsi_required': False, 'edge_k': 1.4397486485504052, 'edge_cap': 0.798100414629881}.
