[I 2025-08-30 04:58:50,410] Trial 458 finished with values: [-1000000000.0, 1000000000.0] and parameters: {'p_sma': 10, 'p_std': 34, 'p_atr': 9, 'p_adx': 27, 'rsi_period': 37, 'ema1': 8, 'ema2': 28, 'slip_atr_k': 0.0036485294246200815, 'slip_spread_k': 0.5769550501103804, 'spread_hl_frac': 0.025670701371848962, 'bb_std_mult': 3.377668614512607, 'rsi_os': 28, 'rsi_ob': 70, 'vol_spike': 0.18174952323082, 'adx_thresh': 31.58279486997528, 'atr_min_pct': 0.007390701335120813, 'atr_max_pct': 0.022986992410529775, 'tp_mult': 2.2080845831504394, 'tsl_mult': 0.20222952890356913, 'strategy': 'breakout', 'time_stop': 201, 'use_sma': False, 'use_atr': True, 'use_adx': True, 'use_ema': True, 'use_spike': True, 'rsi_required': True, 'edge_k': 1.73824756739814, 'edge_cap': 0.6519502883038981}.
[I 2025-08-30 04:59:30,941] Trial 463 finished with values: [-1000000000.0, 1000000000.0] and parameters: {'p_sma': 6, 'p_std': 10, 'p_atr': 9, 'p_adx': 11, 'rsi_period': 16, 'ema1': 15, 'ema2': 30, 'slip_atr_k': 0.18968859317626682, 'slip_spread_k': 0.7312922254466692, 'spread_hl_frac': 0.012382621027938174, 'bb_std_mult': 2.121305710507489, 'rsi_os': 23, 'rsi_ob': 65, 'vol_spike': 0.08799714208667006, 'adx_thresh': 33.985077715598656, 'atr_min_pct': 0.027013880384932604, 'atr_max_pct': 0.13893949586071053, 'tp_mult': 1.474829747477534, 'tsl_mult': 0.8699548745043773, 'strategy': 'breakout', 'time_stop': 216, 'use_sma': True, 'use_atr': False, 'use_adx': False, 'use_ema': False, 'use_spike': False, 'rsi_required': False, 'edge_k': 1.5654237671004834, 'edge_cap': 0.262504421184107}.
[I 2025-08-30 04:59:31,705] Trial 462 finished with values: [-1000000000.0, 1000000000.0] and parameters: {'p_sma': 6, 'p_std': 10, 'p_atr': 9, 'p_adx': 24, 'rsi_period': 16, 'ema1': 15, 'ema2': 30, 'slip_atr_k': 0.09096471581194202, 'slip_spread_k': 0.7322507357040371, 'spread_hl_frac': 0.010705832121517277, 'bb_std_mult': 1.4371273952774943, 'rsi_os': 37, 'rsi_ob': 88, 'vol_spike': 0.11559893977169727, 'adx_thresh': 33.92100336017178, 'atr_min_pct': 0.014967929762897392, 'atr_max_pct': 0.1497843487427235, 'tp_mult': 1.8165781354194799, 'tsl_mult': 0.6907978515322626, 'strategy': 'breakout', 'time_stop': 95, 'use_sma': False, 'use_atr': False, 'use_adx': False, 'use_ema': False, 'use_spike': True, 'rsi_required': False, 'edge_k': 1.5708703334921053, 'edge_cap': 0.6528542675802678}.
[I 2025-08-30 04:59:32,126] Trial 461 finished with values: [-1000000000.0, 1000000000.0] and parameters: {'p_sma': 13, 'p_std': 56, 'p_atr': 24, 'p_adx': 24, 'rsi_period': 31, 'ema1': 8, 'ema2': 55, 'slip_atr_k': 4.4700812784220084e-05, 'slip_spread_k': 0.7409344143127815, 'spread_hl_frac': 0.010270145809092981, 'bb_std_mult': 3.481748359474301, 'rsi_os': 31, 'rsi_ob': 47, 'vol_spike': 0.20697204666144411, 'adx_thresh': 30.130292847442607, 'atr_min_pct': 0.007450960692468535, 'atr_max_pct': 0.14972043314486555, 'tp_mult': 2.2772668454730267, 'tsl_mult': 0.3423550396017732, 'strategy': 'breakout', 'time_stop': 205, 'use_sma': False, 'use_atr': False, 'use_adx': False, 'use_ema': False, 'use_spike': True, 'rsi_required': False, 'edge_k': 0.22211081221548934, 'edge_cap': 0.6500342471659452}.
[I 2025-08-30 04:59:32,533] Trial 460 finished with values: [-1000000000.0, 1000000000.0] and parameters: {'p_sma': 13, 'p_std': 56, 'p_atr': 9, 'p_adx': 24, 'rsi_period': 49, 'ema1': 15, 'ema2': 55, 'slip_atr_k': 0.031011123620102762, 'slip_spread_k': 0.09942790649711736, 'spread_hl_frac': 0.026631980630918074, 'bb_std_mult': 2.4844917607711228, 'rsi_os': 24, 'rsi_ob': 88, 'vol_spike': 0.060114221091100706, 'adx_thresh': 30.615002223235244, 'atr_min_pct': 2.9112455515729142e-05, 'atr_max_pct': 0.1387662941688131, 'tp_mult': 2.271165543448512, 'tsl_mult': 0.19728453892232736, 'strategy': 'breakout', 'time_stop': 206, 'use_sma': False, 'use_atr': True, 'use_adx': True, 'use_ema': False, 'use_spike': True, 'rsi_required': False, 'edge_k': 0.808607472223455, 'edge_cap': 0.6514635091464462}.
[I 2025-08-30 05:00:16,436] Trial 464 finished with values: [-1000000000.0, 1000000000.0] and parameters: {'p_sma': 8, 'p_std': 57, 'p_atr': 24, 'p_adx': 24, 'rsi_period': 23, 'ema1': 14, 'ema2': 23, 'slip_atr_k': 2.5712467898758584e-05, 'slip_spread_k': 0.035085619274386026, 'spread_hl_frac': 0.001794555878763513, 'bb_std_mult': 1.6530381760975528, 'rsi_os': 8, 'rsi_ob': 89, 'vol_spike': 0.21454082428310856, 'adx_thresh': 30.365659511107857, 'atr_min_pct': 0.0013245895758466945, 'atr_max_pct': 0.014226326203448533, 'tp_mult': 2.3008132307518543, 'tsl_mult': 0.302163068930708, 'strategy': 'breakout', 'time_stop': 207, 'use_sma': False, 'use_atr': False, 'use_adx': False, 'use_ema': False, 'use_spike': True, 'rsi_required': False, 'edge_k': 1.417502210804605, 'edge_cap': 0.7039846542167656}.
[I 2025-08-30 05:00:17,257] Trial 467 finished with values: [-1000000000.0, 1000000000.0] and parameters: {'p_sma': 9, 'p_std': 52, 'p_atr': 10, 'p_adx': 26, 'rsi_period': 22, 'ema1': 14, 'ema2': 19, 'slip_atr_k': 0.017005794159602555, 'slip_spread_k': 0.20793230206801228, 'spread_hl_frac': 0.009029799195935974, 'bb_std_mult': 2.2029928737987223, 'rsi_os': 25, 'rsi_ob': 72, 'vol_spike': 0.07224344741357408, 'adx_thresh': 18.566661865731056, 'atr_min_pct': 1.0089423937966659e-05, 'atr_max_pct': 0.1448649534631337, 'tp_mult': 1.2714561205619481, 'tsl_mult': 0.26629200143235343, 'strategy': 'mean_reversion', 'time_stop': 189, 'use_sma': True, 'use_atr': False, 'use_adx': False, 'use_ema': True, 'use_spike': False, 'rsi_required': False, 'edge_k': 1.6658021522360176, 'edge_cap': 0.7060602272685911}.
[I 2025-08-30 05:00:18,488] Trial 466 finished with values: [-0.02359819228232518, 0.02358189678911115] and parameters: {'p_sma': 8, 'p_std': 41, 'p_atr': 10, 'p_adx': 21, 'rsi_period': 22, 'ema1': 14, 'ema2': 50, 'slip_atr_k': 0.11635284295238499, 'slip_spread_k': 0.2208865096609588, 'spread_hl_frac': 0.008664091349387153, 'bb_std_mult': 3.0847608265533015, 'rsi_os': 23, 'rsi_ob': 67, 'vol_spike': 0.28034266392156765, 'adx_thresh': 18.48260482958784, 'atr_min_pct': 0.00048381313755264634, 'atr_max_pct': 0.08829223341124795, 'tp_mult': 2.888850638499725, 'tsl_mult': 0.30819371179005633, 'strategy': 'breakout', 'time_stop': 188, 'use_sma': True, 'use_atr': False, 'use_adx': False, 'use_ema': True, 'use_spike': False, 'rsi_required': False, 'edge_k': 1.4089805555658514, 'edge_cap': 0.6963946711686765}.
[I 2025-08-30 05:00:18,499] Trial 465 finished with values: [-0.06594381102835667, 0.06590451501419922] and parameters: {'p_sma': 54, 'p_std': 17, 'p_atr': 10, 'p_adx': 26, 'rsi_period': 23, 'ema1': 14, 'ema2': 55, 'slip_atr_k': 0.0005500076450921897, 'slip_spread_k': 0.034989665012370386, 'spread_hl_frac': 0.02899192286071495, 'bb_std_mult': 2.4963700805387012, 'rsi_os': 31, 'rsi_ob': 49, 'vol_spike': 0.19974609566482374, 'adx_thresh': 18.1729086390087, 'atr_min_pct': 0.0014722877445033126, 'atr_max_pct': 0.14227815823921147, 'tp_mult': 2.759492181611198, 'tsl_mult': 0.2753071116233306, 'strategy': 'breakout', 'time_stop': 187, 'use_sma': False, 'use_atr': False, 'use_adx': False, 'use_ema': True, 'use_spike': True, 'rsi_required': False, 'edge_k': 0.8175607061434181, 'edge_cap': 0.21198324281673525}.
[I 2025-08-30 05:01:00,424] Trial 468 finished with values: [-1000000000.0, 1000000000.0] and parameters: {'p_sma': 9, 'p_std': 42, 'p_atr': 10, 'p_adx': 9, 'rsi_period': 84, 'ema1': 13, 'ema2': 50, 'slip_atr_k': 0.23680351078803935, 'slip_spread_k': 0.6996390852155303, 'spread_hl_frac': 0.009113662799404974, 'bb_std_mult': 0.7746284981112244, 'rsi_os': 23, 'rsi_ob': 72, 'vol_spike': 0.0719005321404038, 'adx_thresh': 10.044944015688701, 'atr_min_pct': 0.012110972819742976, 'atr_max_pct': 0.14514563617434756, 'tp_mult': 1.9512109084469929, 'tsl_mult': 0.2730940097432492, 'strategy': 'mean_reversion', 'time_stop': 213, 'use_sma': True, 'use_atr': False, 'use_adx': False, 'use_ema': True, 'use_spike': False, 'rsi_required': False, 'edge_k': 1.515955706237791, 'edge_cap': 0.5569390550171324}.
[I 2025-08-30 05:01:01,685] Trial 470 finished with values: [-1000000000.0, 1000000000.0] and parameters: {'p_sma': 10, 'p_std': 50, 'p_atr': 9, 'p_adx': 9, 'rsi_period': 18, 'ema1': 13, 'ema2': 26, 'slip_atr_k': 0.16154022212533917, 'slip_spread_k': 0.8993939094636318, 'spread_hl_frac': 0.02091667683825673, 'bb_std_mult': 2.3961985276939104, 'rsi_os': 27, 'rsi_ob': 83, 'vol_spike': 0.24374496013433838, 'adx_thresh': 32.274262414096, 'atr_min_pct': 0.009941837700344184, 'atr_max_pct': 0.14236173978369654, 'tp_mult': 1.958037277597511, 'tsl_mult': 0.7236709902241788, 'strategy': 'mean_reversion', 'time_stop': 214, 'use_sma': False, 'use_atr': False, 'use_adx': False, 'use_ema': True, 'use_spike': True, 'rsi_required': False, 'edge_k': 1.5127794769802108, 'edge_cap': 0.6247060291927509}.
[I 2025-08-30 05:01:02,283] Trial 471 finished with values: [-1000000000.0, 1000000000.0] and parameters: {'p_sma': 60, 'p_std': 50, 'p_atr': 9, 'p_adx': 20, 'rsi_period': 18, 'ema1': 13, 'ema2': 32, 'slip_atr_k': 0.00676837647861047, 'slip_spread_k': 0.6948119198694535, 'spread_hl_frac': 0.005593289015933485, 'bb_std_mult': 3.520612098241199, 'rsi_os': 27, 'rsi_ob': 65, 'vol_spike': 0.17672959360791216, 'adx_thresh': 9.987346559818626, 'atr_min_pct': 0.0005723168945294702, 'atr_max_pct': 0.14508278236984595, 'tp_mult': 1.9334427362731619, 'tsl_mult': 0.24684176219726237, 'strategy': 'mean_reversion', 'time_stop': 214, 'use_sma': False, 'use_atr': False, 'use_adx': False, 'use_ema': True, 'use_spike': True, 'rsi_required': False, 'edge_k': 1.1358123524148567, 'edge_cap': 0.5629722804428902}.
[I 2025-08-30 05:01:02,493] Trial 469 finished with values: [-1000000000.0, 1000000000.0] and parameters: {'p_sma': 59, 'p_std': 54, 'p_atr': 10, 'p_adx': 9, 'rsi_period': 58, 'ema1': 13, 'ema2': 50, 'slip_atr_k': 0.11853999085962136, 'slip_spread_k': 0.47455289853936194, 'spread_hl_frac': 0.008292810776044457, 'bb_std_mult': 2.402691148564881, 'rsi_os': 12, 'rsi_ob': 67, 'vol_spike': 0.22856924656481054, 'adx_thresh': 32.411129464601125, 'atr_min_pct': 0.0004078405135279583, 'atr_max_pct': 0.08870778629246692, 'tp_mult': 1.732895662217934, 'tsl_mult': 0.7237862648640143, 'strategy': 'breakout', 'time_stop': 214, 'use_sma': False, 'use_atr': False, 'use_adx': False, 'use_ema': True, 'use_spike': True, 'rsi_required': False, 'edge_k': 1.499830639096763, 'edge_cap': 0.5630646911767415}.
[I 2025-08-30 05:01:46,919] Trial 474 finished with values: [-1000000000.0, 1000000000.0] and parameters: {'p_sma': 28, 'p_std': 19, 'p_atr': 8, 'p_adx': 19, 'rsi_period': 47, 'ema1': 21, 'ema2': 29, 'slip_atr_k': 0.007138303071708559, 'slip_spread_k': 0.42266231567832174, 'spread_hl_frac': 0.030291768006842773, 'bb_std_mult': 3.3122221609879974, 'rsi_os': 17, 'rsi_ob': 52, 'vol_spike': 0.150982824055066, 'adx_thresh': 30.702797771623462, 'atr_min_pct': 0.0005800158855386739, 'atr_max_pct': 0.07984431929203285, 'tp_mult': 1.740386567795928, 'tsl_mult': 0.5137235442905794, 'strategy': 'breakout', 'time_stop': 222, 'use_sma': False, 'use_atr': True, 'use_adx': True, 'use_ema': True, 'use_spike': True, 'rsi_required': True, 'edge_k': 1.0036380926810333, 'edge_cap': 0.6754414673528322}.
[I 2025-08-30 05:01:47,545] Trial 473 finished with values: [-0.029802671753613508, 0.02975453872478281] and parameters: {'p_sma': 16, 'p_std': 54, 'p_atr': 8, 'p_adx': 25, 'rsi_period': 11, 'ema1': 20, 'ema2': 32, 'slip_atr_k': 0.009029238769263571, 'slip_spread_k': 0.7677100139916357, 'spread_hl_frac': 0.011841469795722202, 'bb_std_mult': 3.5311582718916954, 'rsi_os': 17, 'rsi_ob': 66, 'vol_spike': 0.17504516354233923, 'adx_thresh': 30.99802685993035, 'atr_min_pct': 0.0005203379355820815, 'atr_max_pct': 0.06981091015469564, 'tp_mult': 1.807823164401813, 'tsl_mult': 0.46323260445427394, 'strategy': 'breakout', 'time_stop': 224, 'use_sma': False, 'use_atr': False, 'use_adx': False, 'use_ema': True, 'use_spike': True, 'rsi_required': True, 'edge_k': 1.4414248087933996, 'edge_cap': 0.737378751700882}.
[I 2025-08-30 05:01:48,033] Trial 475 finished with values: [-1000000000.0, 1000000000.0] and parameters: {'p_sma': 10, 'p_std': 37, 'p_atr': 8, 'p_adx': 25, 'rsi_period': 47, 'ema1': 18, 'ema2': 26, 'slip_atr_k': 0.006926733203484987, 'slip_spread_k': 0.7637475208880736, 'spread_hl_frac': 0.012019091224465584, 'bb_std_mult': 1.016687777082416, 'rsi_os': 14, 'rsi_ob': 53, 'vol_spike': 0.18709213286938822, 'adx_thresh': 30.982920251921133, 'atr_min_pct': 0.0014033400201135188, 'atr_max_pct': 0.09872138939849051, 'tp_mult': 2.5375239724392156, 'tsl_mult': 0.22706553391704956, 'strategy': 'breakout', 'time_stop': 222, 'use_sma': False, 'use_atr': True, 'use_adx': True, 'use_ema': True, 'use_spike': True, 'rsi_required': True, 'edge_k': 0.5537737767869284, 'edge_cap': 0.7410994907788396}.
[I 2025-08-30 05:01:48,445] Trial 472 finished with values: [-1000000000.0, 1000000000.0] and parameters: {'p_sma': 10, 'p_std': 49, 'p_atr': 9, 'p_adx': 25, 'rsi_period': 18, 'ema1': 21, 'ema2': 26, 'slip_atr_k': 0.006656046168423577, 'slip_spread_k': 0.36880891770380453, 'spread_hl_frac': 0.021200585966118447, 'bb_std_mult': 3.569043044968535, 'rsi_os': 27, 'rsi_ob': 53, 'vol_spike': 0.12177846821556693, 'adx_thresh': 19.679345802218336, 'atr_min_pct': 0.023753633135498123, 'atr_max_pct': 0.14184969595226332, 'tp_mult': 1.7404100522289565, 'tsl_mult': 0.24135390528349943, 'strategy': 'breakout', 'time_stop': 122, 'use_sma': False, 'use_atr': False, 'use_adx': False, 'use_ema': True, 'use_spike': True, 'rsi_required': True, 'edge_k': 1.5008823238098854, 'edge_cap': 0.6740423702157853}.
[I 2025-08-30 05:02:28,918] Trial 479 finished with values: [-0.026054064809268307, 0.026050620549136507] and parameters: {'p_sma': 12, 'p_std': 52, 'p_atr': 15, 'p_adx': 26, 'rsi_period': 20, 'ema1': 15, 'ema2': 46, 'slip_atr_k': 0.016304746159838103, 'slip_spread_k': 0.7245677784941893, 'spread_hl_frac': 0.010567919214407605, 'bb_std_mult': 3.4340709165301857, 'rsi_os': 22, 'rsi_ob': 80, 'vol_spike': 0.19845841893796615, 'adx_thresh': 13.18397994426186, 'atr_min_pct': 0.000954300578650678, 'atr_max_pct': 0.14634995608909804, 'tp_mult': 1.8692498852669992, 'tsl_mult': 0.21081583706295748, 'strategy': 'breakout', 'time_stop': 38, 'use_sma': True, 'use_atr': False, 'use_adx': False, 'use_ema': False, 'use_spike': False, 'rsi_required': False, 'edge_k': 1.375954839831201, 'edge_cap': 0.5935162933377867}.
[I 2025-08-30 05:02:30,080] Trial 478 finished with values: [-1000000000.0, 1000000000.0] and parameters: {'p_sma': 5, 'p_std': 55, 'p_atr': 15, 'p_adx': 17, 'rsi_period': 61, 'ema1': 17, 'ema2': 46, 'slip_atr_k': 0.1317750113359338, 'slip_spread_k': 0.7204116516621274, 'spread_hl_frac': 0.010336356303994071, 'bb_std_mult': 3.5834140966753996, 'rsi_os': 22, 'rsi_ob': 63, 'vol_spike': 0.022460977551254424, 'adx_thresh': 5.001113991907825, 'atr_min_pct': 0.023910518737535608, 'atr_max_pct': 0.14179788718162326, 'tp_mult': 1.8788537779171304, 'tsl_mult': 0.16279322664396706, 'strategy': 'breakout', 'time_stop': 196, 'use_sma': True, 'use_atr': False, 'use_adx': False, 'use_ema': True, 'use_spike': False, 'rsi_required': False, 'edge_k': 1.5569952732832721, 'edge_cap': 0.38829549502891086}.
[I 2025-08-30 05:02:30,824] Trial 476 finished with values: [-0.022422195167840053, 0.022378156810086414] and parameters: {'p_sma': 45, 'p_std': 30, 'p_atr': 15, 'p_adx': 10, 'rsi_period': 68, 'ema1': 19, 'ema2': 25, 'slip_atr_k': 0.07841211232457052, 'slip_spread_k': 0.7655586152744323, 'spread_hl_frac': 0.03467401894219261, 'bb_std_mult': 3.207059105384901, 'rsi_os': 22, 'rsi_ob': 64, 'vol_spike': 0.18770726738348406, 'adx_thresh': 28.081493345312612, 'atr_min_pct': 0.0013600843677414236, 'atr_max_pct': 0.04913618170761194, 'tp_mult': 1.8189899785256851, 'tsl_mult': 0.9792720106682749, 'strategy': 'breakout', 'time_stop': 162, 'use_sma': False, 'use_atr': False, 'use_adx': False, 'use_ema': True, 'use_spike': True, 'rsi_required': True, 'edge_k': 1.2025677675579445, 'edge_cap': 0.6304619158495243}.
[I 2025-08-30 05:02:31,534] Trial 477 finished with values: [-1000000000.0, 1000000000.0] and parameters: {'p_sma': 7, 'p_std': 52, 'p_atr': 16, 'p_adx': 10, 'rsi_period': 68, 'ema1': 23, 'ema2': 25, 'slip_atr_k': 0.016074991068827454, 'slip_spread_k': 0.9254753711302213, 'spread_hl_frac': 0.032331927358990334, 'bb_std_mult': 3.441271109858273, 'rsi_os': 25, 'rsi_ob': 63, 'vol_spike': 0.18751736491975118, 'adx_thresh': 31.939393562969432, 'atr_min_pct': 0.0013019523273280714, 'atr_max_pct': 0.1406633680429838, 'tp_mult': 2.553253625394502, 'tsl_mult': 0.23369353197656192, 'strategy': 'breakout', 'time_stop': 197, 'use_sma': False, 'use_atr': False, 'use_adx': False, 'use_ema': True, 'use_spike': True, 'rsi_required': False, 'edge_k': 1.3747307240205804, 'edge_cap': 0.6313375239045605}.
[I 2025-08-30 05:03:11,971] Trial 481 finished with values: [-1000000000.0, 1000000000.0] and parameters: {'p_sma': 7, 'p_std': 53, 'p_atr': 9, 'p_adx': 10, 'rsi_period': 69, 'ema1': 16, 'ema2': 37, 'slip_atr_k': 0.17905701132037372, 'slip_spread_k': 0.9239138017820298, 'spread_hl_frac': 0.015301180809706385, 'bb_std_mult': 3.195584819917443, 'rsi_os': 25, 'rsi_ob': 65, 'vol_spike': 0.015646148668183785, 'adx_thresh': 28.785858742722283, 'atr_min_pct': 0.002038223242552601, 'atr_max_pct': 0.14978764807009545, 'tp_mult': 2.0680931947256744, 'tsl_mult': 0.5712934793132396, 'strategy': 'breakout', 'time_stop': 86, 'use_sma': False, 'use_atr': True, 'use_adx': True, 'use_ema': True, 'use_spike': True, 'rsi_required': False, 'edge_k': 1.784759740724731, 'edge_cap': 0.628173977183747}.
[I 2025-08-30 05:03:13,226] Trial 482 finished with values: [-0.05617737664301514, 0.056130554761402406] and parameters: {'p_sma': 45, 'p_std': 45, 'p_atr': 21, 'p_adx': 15, 'rsi_period': 29, 'ema1': 16, 'ema2': 37, 'slip_atr_k': 0.14985198170166972, 'slip_spread_k': 0.9251557153372227, 'spread_hl_frac': 0.040392311705362366, 'bb_std_mult': 3.1772936142717727, 'rsi_os': 25, 'rsi_ob': 65, 'vol_spike': 0.1871674306959028, 'adx_thresh': 16.02248046724233, 'atr_min_pct': 3.025338755545305e-05, 'atr_max_pct': 0.06072440171623848, 'tp_mult': 1.3324312101671425, 'tsl_mult': 0.22442254731970274, 'strategy': 'breakout', 'time_stop': 292, 'use_sma': False, 'use_atr': False, 'use_adx': False, 'use_ema': True, 'use_spike': True, 'rsi_required': False, 'edge_k': 1.4570282767547538, 'edge_cap': 0.6256215867906426}.
[I 2025-08-30 05:03:13,865] Trial 483 finished with values: [-0.08070736395498812, 0.08068849031873314] and parameters: {'p_sma': 40, 'p_std': 12, 'p_atr': 17, 'p_adx': 18, 'rsi_period': 21, 'ema1': 16, 'ema2': 27, 'slip_atr_k': 0.0613935768547587, 'slip_spread_k': 0.8317426783585536, 'spread_hl_frac': 0.015107559745845834, 'bb_std_mult': 3.3613145467686456, 'rsi_os': 24, 'rsi_ob': 69, 'vol_spike': 0.19427563887275223, 'adx_thresh': 27.602975083133824, 'atr_min_pct': 1.8997461882104437e-05, 'atr_max_pct': 0.04897968232672708, 'tp_mult': 1.8130393791451014, 'tsl_mult': 0.5753315990030459, 'strategy': 'breakout', 'time_stop': 166, 'use_sma': False, 'use_atr': True, 'use_adx': True, 'use_ema': True, 'use_spike': True, 'rsi_required': False, 'edge_k': 1.4497409227699531, 'edge_cap': 0.6353856750710749}.
[I 2025-08-30 05:03:14,261] Trial 480 finished with values: [-1000000000.0, 1000000000.0] and parameters: {'p_sma': 7, 'p_std': 30, 'p_atr': 9, 'p_adx': 17, 'rsi_period': 27, 'ema1': 17, 'ema2': 21, 'slip_atr_k': 0.1492886717960144, 'slip_spread_k': 0.7447759331878796, 'spread_hl_frac': 0.010159348987129892, 'bb_std_mult': 3.392277064332881, 'rsi_os': 25, 'rsi_ob': 64, 'vol_spike': 0.1852078160014112, 'adx_thresh': 16.181409208789013, 'atr_min_pct': 0.011193763832474134, 'atr_max_pct': 0.060032121508252004, 'tp_mult': 2.4164357297057224, 'tsl_mult': 0.21949219385608368, 'strategy': 'breakout', 'time_stop': 258, 'use_sma': False, 'use_atr': False, 'use_adx': False, 'use_ema': True, 'use_spike': True, 'rsi_required': False, 'edge_k': 1.4508222289330435, 'edge_cap': 0.3900913340719094}.
[I 2025-08-30 05:03:49,774] Trial 487 finished with values: [-0.025127062482196427, 0.02506268305976119] and parameters: {'p_sma': 9, 'p_std': 15, 'p_atr': 7, 'p_adx': 25, 'rsi_period': 24, 'ema1': 15, 'ema2': 29, 'slip_atr_k': 0.021984733768453, 'slip_spread_k': 0.7614099020651959, 'spread_hl_frac': 0.012504961322710381, 'bb_std_mult': 3.483833389751317, 'rsi_os': 41, 'rsi_ob': 86, 'vol_spike': 0.16118829265703155, 'adx_thresh': 17.120997442129692, 'atr_min_pct': 7.156202002485984e-06, 'atr_max_pct': 0.13049647368451728, 'tp_mult': 2.993428793979461, 'tsl_mult': 0.25803403086319887, 'strategy': 'mean_reversion', 'time_stop': 148, 'use_sma': True, 'use_atr': False, 'use_adx': False, 'use_ema': False, 'use_spike': False, 'rsi_required': False, 'edge_k': 1.2013742917260741, 'edge_cap': 0.8054363776087133}.
[I 2025-08-30 05:03:52,316] Trial 485 finished with values: [-1000000000.0, 1000000000.0] and parameters: {'p_sma': 8, 'p_std': 29, 'p_atr': 7, 'p_adx': 8, 'rsi_period': 43, 'ema1': 15, 'ema2': 17, 'slip_atr_k': 0.1407922775851861, 'slip_spread_k': 0.27843486115130994, 'spread_hl_frac': 0.010938119552992415, 'bb_std_mult': 1.3638951974470883, 'rsi_os': 29, 'rsi_ob': 69, 'vol_spike': 0.26060930074796207, 'adx_thresh': 17.275138405220922, 'atr_min_pct': 0.008873986851074942, 'atr_max_pct': 0.14537097490028966, 'tp_mult': 1.7880840211517175, 'tsl_mult': 0.8031742984819302, 'strategy': 'mean_reversion', 'time_stop': 209, 'use_sma': False, 'use_atr': False, 'use_adx': False, 'use_ema': False, 'use_spike': True, 'rsi_required': False, 'edge_k': 1.1917188729090475, 'edge_cap': 0.3464414294645727}.
