[I 2025-08-30 05:19:36,857] Trial 568 finished with values: [-1000000000.0, 1000000000.0] and parameters: {'p_sma': 15, 'p_std': 24, 'p_atr': 9, 'p_adx': 23, 'rsi_period': 21, 'ema1': 20, 'ema2': 28, 'slip_atr_k': 0.12270192339226473, 'slip_spread_k': 0.1548142706423249, 'spread_hl_frac': 0.008438029538971391, 'bb_std_mult': 3.4669905540441395, 'rsi_os': 35, 'rsi_ob': 73, 'vol_spike': 0.18103218832708196, 'adx_thresh': 31.463707630561327, 'atr_min_pct': 0.02829741972671375, 'atr_max_pct': 0.14346026943660775, 'tp_mult': 1.7746032903697855, 'tsl_mult': 0.20714069299877058, 'strategy': 'breakout', 'time_stop': 234, 'use_sma': False, 'use_atr': False, 'use_adx': False, 'use_ema': True, 'use_spike': False, 'rsi_required': True, 'edge_k': 1.4865171489196003, 'edge_cap': 0.225499668551583}.
[I 2025-08-30 05:19:37,359] Trial 567 finished with values: [-0.021484163138380086, 0.02143217801949996] and parameters: {'p_sma': 9, 'p_std': 50, 'p_atr': 9, 'p_adx': 27, 'rsi_period': 23, 'ema1': 21, 'ema2': 27, 'slip_atr_k': 0.005538624162654133, 'slip_spread_k': 0.9039151483095345, 'spread_hl_frac': 0.03772588366168445, 'bb_std_mult': 2.436929687878339, 'rsi_os': 40, 'rsi_ob': 69, 'vol_spike': 0.18369573081254684, 'adx_thresh': 32.68864877594701, 'atr_min_pct': 0.0010818731941236006, 'atr_max_pct': 0.14518643477891258, 'tp_mult': 2.005358158949429, 'tsl_mult': 0.04821665831259747, 'strategy': 'breakout', 'time_stop': 271, 'use_sma': True, 'use_atr': True, 'use_adx': False, 'use_ema': True, 'use_spike': False, 'rsi_required': True, 'edge_k': 1.4345975864490517, 'edge_cap': 0.6811464772189987}.
[I 2025-08-30 05:19:37,774] Trial 566 finished with values: [-0.11759088382653748, 0.11754104651937188] and parameters: {'p_sma': 35, 'p_std': 50, 'p_atr': 9, 'p_adx': 17, 'rsi_period': 21, 'ema1': 16, 'ema2': 28, 'slip_atr_k': 0.16817377694586289, 'slip_spread_k': 0.5298347267185608, 'spread_hl_frac': 0.03759808765483166, 'bb_std_mult': 1.850947298145614, 'rsi_os': 35, 'rsi_ob': 73, 'vol_spike': 0.15304555426564323, 'adx_thresh': 32.92893695228997, 'atr_min_pct': 0.0012312858482867377, 'atr_max_pct': 0.14367094909606626, 'tp_mult': 2.597911522912022, 'tsl_mult': 0.19851316564486535, 'strategy': 'breakout', 'time_stop': 143, 'use_sma': True, 'use_atr': True, 'use_adx': False, 'use_ema': True, 'use_spike': False, 'rsi_required': False, 'edge_k': 1.4409735944374276, 'edge_cap': 0.6844703778587222}.
[I 2025-08-30 05:19:38,128] Trial 573 finished with values: [-1000000000.0, 1000000000.0] and parameters: {'p_sma': 11, 'p_std': 8, 'p_atr': 9, 'p_adx': 16, 'rsi_period': 8, 'ema1': 24, 'ema2': 19, 'slip_atr_k': 0.16258237175497414, 'slip_spread_k': 0.32854304189853184, 'spread_hl_frac': 0.010807410784787364, 'bb_std_mult': 3.1993201647936518, 'rsi_os': 27, 'rsi_ob': 47, 'vol_spike': 0.21242218813274127, 'adx_thresh': 29.9343684542863, 'atr_min_pct': 0.01437969177010033, 'atr_max_pct': 0.1473901570891452, 'tp_mult': 1.802747559268637, 'tsl_mult': 0.2241623094211556, 'strategy': 'mean_reversion', 'time_stop': 197, 'use_sma': False, 'use_atr': False, 'use_adx': False, 'use_ema': False, 'use_spike': True, 'rsi_required': False, 'edge_k': 0.3476638950399822, 'edge_cap': 0.6315844001032289}.
[I 2025-08-30 05:20:18,294] Trial 572 finished with values: [-1000000000.0, 1000000000.0] and parameters: {'p_sma': 12, 'p_std': 21, 'p_atr': 9, 'p_adx': 11, 'rsi_period': 7, 'ema1': 10, 'ema2': 30, 'slip_atr_k': 0.0346385008688324, 'slip_spread_k': 0.9008431548156113, 'spread_hl_frac': 0.010749489211436066, 'bb_std_mult': 1.788964577461679, 'rsi_os': 27, 'rsi_ob': 61, 'vol_spike': 0.10007930738374882, 'adx_thresh': 29.981933000998275, 'atr_min_pct': 0.0039006096865303545, 'atr_max_pct': 0.14687735541924607, 'tp_mult': 2.6017472324367494, 'tsl_mult': 0.5581063727562523, 'strategy': 'mean_reversion', 'time_stop': 192, 'use_sma': False, 'use_atr': False, 'use_adx': False, 'use_ema': False, 'use_spike': True, 'rsi_required': False, 'edge_k': 1.5582065239291776, 'edge_cap': 0.6632007577106893}.
[I 2025-08-30 05:20:18,311] Trial 571 finished with values: [-1000000000.0, 1000000000.0] and parameters: {'p_sma': 57, 'p_std': 60, 'p_atr': 9, 'p_adx': 16, 'rsi_period': 25, 'ema1': 16, 'ema2': 27, 'slip_atr_k': 0.19913921146158836, 'slip_spread_k': 0.3333387435343417, 'spread_hl_frac': 0.010732714431858855, 'bb_std_mult': 1.824154376340156, 'rsi_os': 24, 'rsi_ob': 65, 'vol_spike': 0.10003124520310436, 'adx_thresh': 25.84772199764619, 'atr_min_pct': 0.025211317981194498, 'atr_max_pct': 0.14836556347911342, 'tp_mult': 1.821416880377444, 'tsl_mult': 0.22600310720474928, 'strategy': 'mean_reversion', 'time_stop': 194, 'use_sma': False, 'use_atr': True, 'use_adx': False, 'use_ema': False, 'use_spike': True, 'rsi_required': False, 'edge_k': 0.29718906798277533, 'edge_cap': 0.6310006454730989}.
[I 2025-08-30 05:20:18,802] Trial 570 finished with values: [-1000000000.0, 1000000000.0] and parameters: {'p_sma': 12, 'p_std': 53, 'p_atr': 9, 'p_adx': 16, 'rsi_period': 22, 'ema1': 24, 'ema2': 28, 'slip_atr_k': 0.01287376640032004, 'slip_spread_k': 0.5335383820411935, 'spread_hl_frac': 0.008452870065016542, 'bb_std_mult': 3.194654032842194, 'rsi_os': 27, 'rsi_ob': 77, 'vol_spike': 0.020502602698446615, 'adx_thresh': 31.493393094489655, 'atr_min_pct': 0.005470148394226722, 'atr_max_pct': 0.1478572898331047, 'tp_mult': 1.7700427070092692, 'tsl_mult': 0.22445149379043014, 'strategy': 'breakout', 'time_stop': 190, 'use_sma': False, 'use_atr': True, 'use_adx': False, 'use_ema': True, 'use_spike': False, 'rsi_required': False, 'edge_k': 0.9587007541478032, 'edge_cap': 0.22404155753727695}.
[I 2025-08-30 05:20:19,162] Trial 574 finished with values: [-1000000000.0, 1000000000.0] and parameters: {'p_sma': 12, 'p_std': 21, 'p_atr': 9, 'p_adx': 26, 'rsi_period': 25, 'ema1': 19, 'ema2': 30, 'slip_atr_k': 0.011516498782678745, 'slip_spread_k': 0.7474652669774566, 'spread_hl_frac': 0.023810347349578542, 'bb_std_mult': 3.421569330157366, 'rsi_os': 24, 'rsi_ob': 63, 'vol_spike': 0.022262251922597703, 'adx_thresh': 13.485148906475759, 'atr_min_pct': 0.013234330730786465, 'atr_max_pct': 0.13186378099956442, 'tp_mult': 1.8329766428583012, 'tsl_mult': 0.15875455444955722, 'strategy': 'mean_reversion', 'time_stop': 187, 'use_sma': False, 'use_atr': False, 'use_adx': False, 'use_ema': False, 'use_spike': True, 'rsi_required': False, 'edge_k': 1.561512363879142, 'edge_cap': 0.37573622217751945}.
[I 2025-08-30 05:20:54,358] Trial 577 finished with values: [-1000000000.0, 0.168020098297499] and parameters: {'p_sma': 41, 'p_std': 52, 'p_atr': 13, 'p_adx': 8, 'rsi_period': 19, 'ema1': 9, 'ema2': 29, 'slip_atr_k': 0.005428264655347361, 'slip_spread_k': 0.7523204576411905, 'spread_hl_frac': 0.013289829621188534, 'bb_std_mult': 3.402456089994184, 'rsi_os': 40, 'rsi_ob': 62, 'vol_spike': 0.047094858043224455, 'adx_thresh': 13.459426245399504, 'atr_min_pct': 0.0005883590564707973, 'atr_max_pct': 0.13413251836079715, 'tp_mult': 1.3312608132134987, 'tsl_mult': 0.10862893654771782, 'strategy': 'breakout', 'time_stop': 206, 'use_sma': True, 'use_atr': False, 'use_adx': True, 'use_ema': True, 'use_spike': True, 'rsi_required': False, 'edge_k': 0.16940299476919685, 'edge_cap': 0.7306534278159112}.
[I 2025-08-30 05:20:54,705] Trial 576 finished with values: [-1000000000.0, 1000000000.0] and parameters: {'p_sma': 41, 'p_std': 53, 'p_atr': 9, 'p_adx': 28, 'rsi_period': 36, 'ema1': 15, 'ema2': 29, 'slip_atr_k': 0.012409630459411767, 'slip_spread_k': 0.7539480509380891, 'spread_hl_frac': 0.046824096300458494, 'bb_std_mult': 2.437497699535194, 'rsi_os': 25, 'rsi_ob': 77, 'vol_spike': 0.186034144367682, 'adx_thresh': 21.27689841817576, 'atr_min_pct': 0.004949017941373831, 'atr_max_pct': 0.14560855170758208, 'tp_mult': 1.7664917804266396, 'tsl_mult': 0.664436191339189, 'strategy': 'breakout', 'time_stop': 207, 'use_sma': False, 'use_atr': False, 'use_adx': False, 'use_ema': True, 'use_spike': True, 'rsi_required': False, 'edge_k': 0.15413331177099576, 'edge_cap': 0.8343979570935751}.
[I 2025-08-30 05:20:55,198] Trial 575 finished with values: [-1000000000.0, 1000000000.0] and parameters: {'p_sma': 7, 'p_std': 53, 'p_atr': 9, 'p_adx': 26, 'rsi_period': 72, 'ema1': 15, 'ema2': 29, 'slip_atr_k': 0.13395639956837962, 'slip_spread_k': 0.7545581494533924, 'spread_hl_frac': 0.012903885304860611, 'bb_std_mult': 3.40903285429592, 'rsi_os': 40, 'rsi_ob': 49, 'vol_spike': 0.1869103261521503, 'adx_thresh': 31.652088330118406, 'atr_min_pct': 0.005604482121295405, 'atr_max_pct': 0.1475806314917747, 'tp_mult': 1.208833580225029, 'tsl_mult': 0.15472292037124613, 'strategy': 'breakout', 'time_stop': 206, 'use_sma': False, 'use_atr': False, 'use_adx': False, 'use_ema': True, 'use_spike': True, 'rsi_required': False, 'edge_k': 0.7756879687960909, 'edge_cap': 0.6530613049167651}.
[I 2025-08-30 05:20:55,532] Trial 578 finished with values: [-1000000000.0, 1000000000.0] and parameters: {'p_sma': 7, 'p_std': 52, 'p_atr': 10, 'p_adx': 27, 'rsi_period': 19, 'ema1': 15, 'ema2': 25, 'slip_atr_k': 0.14460552650066827, 'slip_spread_k': 0.23062664417616546, 'spread_hl_frac': 0.013087542901181371, 'bb_std_mult': 3.358863709214436, 'rsi_os': 18, 'rsi_ob': 52, 'vol_spike': 0.14311767589208127, 'adx_thresh': 14.813855807483247, 'atr_min_pct': 0.0005982934436516023, 'atr_max_pct': 0.1429052148556617, 'tp_mult': 2.1243045566631307, 'tsl_mult': 0.6703995036150675, 'strategy': 'breakout', 'time_stop': 207, 'use_sma': True, 'use_atr': False, 'use_adx': True, 'use_ema': True, 'use_spike': True, 'rsi_required': True, 'edge_k': 1.1257004879216095, 'edge_cap': 0.6519329883408612}.
[I 2025-08-30 05:21:29,744] Trial 582 finished with values: [-0.09335536894066832, 0.09333801332702091] and parameters: {'p_sma': 51, 'p_std': 51, 'p_atr': 15, 'p_adx': 14, 'rsi_period': 14, 'ema1': 14, 'ema2': 27, 'slip_atr_k': 0.00527394371881898, 'slip_spread_k': 0.6875148633022281, 'spread_hl_frac': 0.009394230327159536, 'bb_std_mult': 3.5990629641061376, 'rsi_os': 22, 'rsi_ob': 75, 'vol_spike': 0.1743039477185568, 'adx_thresh': 30.626447725244766, 'atr_min_pct': 3.105110017585469e-05, 'atr_max_pct': 0.12684754408472346, 'tp_mult': 1.8889470822937775, 'tsl_mult': 0.26685655033483563, 'strategy': 'breakout', 'time_stop': 217, 'use_sma': False, 'use_atr': False, 'use_adx': False, 'use_ema': True, 'use_spike': False, 'rsi_required': True, 'edge_k': 1.39505050971579, 'edge_cap': 0.3109542212011219}.
[I 2025-08-30 05:21:31,269] Trial 579 finished with values: [-0.0528212900706474, 0.05280231676123897] and parameters: {'p_sma': 7, 'p_std': 53, 'p_atr': 9, 'p_adx': 25, 'rsi_period': 14, 'ema1': 14, 'ema2': 24, 'slip_atr_k': 0.004969109859951737, 'slip_spread_k': 0.28159374284017824, 'spread_hl_frac': 0.00960271021978449, 'bb_std_mult': 2.119719074840434, 'rsi_os': 25, 'rsi_ob': 67, 'vol_spike': 0.18628668739304383, 'adx_thresh': 14.646446154389256, 'atr_min_pct': 2.7055570054784404e-05, 'atr_max_pct': 0.14224141135707186, 'tp_mult': 1.9311977515490022, 'tsl_mult': 0.012690980646631267, 'strategy': 'breakout', 'time_stop': 210, 'use_sma': False, 'use_atr': False, 'use_adx': False, 'use_ema': True, 'use_spike': True, 'rsi_required': True, 'edge_k': 1.3893514412582744, 'edge_cap': 0.6513542862643567}.
[I 2025-08-30 05:21:31,295] Trial 580 finished with values: [-1000000000.0, 1000000000.0] and parameters: {'p_sma': 27, 'p_std': 54, 'p_atr': 10, 'p_adx': 24, 'rsi_period': 52, 'ema1': 14, 'ema2': 24, 'slip_atr_k': 7.15804370972628e-05, 'slip_spread_k': 0.22371013072153562, 'spread_hl_frac': 0.01236983479804503, 'bb_std_mult': 3.550507199400698, 'rsi_os': 22, 'rsi_ob': 68, 'vol_spike': 0.1737770974304812, 'adx_thresh': 30.59232681292273, 'atr_min_pct': 0.006413741313266998, 'atr_max_pct': 0.12823838237482127, 'tp_mult': 2.1160467974828814, 'tsl_mult': 0.2635131844787001, 'strategy': 'breakout', 'time_stop': 294, 'use_sma': True, 'use_atr': False, 'use_adx': True, 'use_ema': True, 'use_spike': True, 'rsi_required': True, 'edge_k': 1.387032010033547, 'edge_cap': 0.6493922335162688}.
[I 2025-08-30 05:21:31,501] Trial 581 finished with values: [-1000000000.0, 1000000000.0] and parameters: {'p_sma': 51, 'p_std': 51, 'p_atr': 26, 'p_adx': 27, 'rsi_period': 14, 'ema1': 14, 'ema2': 56, 'slip_atr_k': 0.0047968157265804385, 'slip_spread_k': 0.024475037118288245, 'spread_hl_frac': 0.00950415301757071, 'bb_std_mult': 3.3488868509159433, 'rsi_os': 22, 'rsi_ob': 57, 'vol_spike': 0.17274182507119099, 'adx_thresh': 30.958689811547334, 'atr_min_pct': 0.01064316810379369, 'atr_max_pct': 0.14236957153936988, 'tp_mult': 2.1118912049273444, 'tsl_mult': 0.7048885905929289, 'strategy': 'breakout', 'time_stop': 214, 'use_sma': True, 'use_atr': False, 'use_adx': True, 'use_ema': True, 'use_spike': True, 'rsi_required': True, 'edge_k': 1.4045206341983965, 'edge_cap': 0.5392494821627125}.
[I 2025-08-30 05:22:02,410] Trial 586 finished with values: [-1000000000.0, 1000000000.0] and parameters: {'p_sma': 9, 'p_std': 36, 'p_atr': 8, 'p_adx': 25, 'rsi_period': 23, 'ema1': 17, 'ema2': 26, 'slip_atr_k': 0.11216018988524365, 'slip_spread_k': 0.8042650141539651, 'spread_hl_frac': 0.03228777170680264, 'bb_std_mult': 3.2712535273166097, 'rsi_os': 15, 'rsi_ob': 85, 'vol_spike': 0.20094513545411552, 'adx_thresh': 24.894558714255723, 'atr_min_pct': 0.0008135551870200131, 'atr_max_pct': 0.1499956993744579, 'tp_mult': 2.757565378514844, 'tsl_mult': 0.962336932281457, 'strategy': 'mean_reversion', 'time_stop': 199, 'use_sma': False, 'use_atr': True, 'use_adx': False, 'use_ema': False, 'use_spike': False, 'rsi_required': False, 'edge_k': 1.632836798969361, 'edge_cap': 0.6891343881709342}.
[I 2025-08-30 05:22:04,120] Trial 583 finished with values: [-1000000000.0, 1000000000.0] and parameters: {'p_sma': 27, 'p_std': 54, 'p_atr': 10, 'p_adx': 24, 'rsi_period': 78, 'ema1': 16, 'ema2': 27, 'slip_atr_k': 0.11473203627123472, 'slip_spread_k': 0.8120498196653491, 'spread_hl_frac': 0.01449989704310973, 'bb_std_mult': 3.527110655621505, 'rsi_os': 49, 'rsi_ob': 68, 'vol_spike': 0.20150291666090642, 'adx_thresh': 32.36344121161546, 'atr_min_pct': 0.01823571813181874, 'atr_max_pct': 0.07123284390631453, 'tp_mult': 1.9826927449692646, 'tsl_mult': 0.020994072048744095, 'strategy': 'breakout', 'time_stop': 211, 'use_sma': False, 'use_atr': False, 'use_adx': False, 'use_ema': True, 'use_spike': True, 'rsi_required': False, 'edge_k': 1.4950980771510929, 'edge_cap': 0.6681549846397669}.
[I 2025-08-30 05:22:04,527] Trial 585 finished with values: [-0.11049823788154611, 0.11045392573193122] and parameters: {'p_sma': 24, 'p_std': 49, 'p_atr': 8, 'p_adx': 25, 'rsi_period': 70, 'ema1': 16, 'ema2': 37, 'slip_atr_k': 0.018423858513326306, 'slip_spread_k': 0.4231528501853793, 'spread_hl_frac': 0.011536851965766391, 'bb_std_mult': 3.270247955349025, 'rsi_os': 49, 'rsi_ob': 57, 'vol_spike': 0.16244049934510504, 'adx_thresh': 23.638213097753994, 'atr_min_pct': 0.0008917711435753936, 'atr_max_pct': 0.03326651519573345, 'tp_mult': 1.407153336309206, 'tsl_mult': 0.45227060375465, 'strategy': 'breakout', 'time_stop': 51, 'use_sma': False, 'use_atr': True, 'use_adx': False, 'use_ema': True, 'use_spike': False, 'rsi_required': False, 'edge_k': 1.4921556099094548, 'edge_cap': 0.6754671664347254}.
[I 2025-08-30 05:22:04,782] Trial 584 finished with values: [-1000000000.0, 1000000000.0] and parameters: {'p_sma': 24, 'p_std': 49, 'p_atr': 8, 'p_adx': 24, 'rsi_period': 61, 'ema1': 17, 'ema2': 56, 'slip_atr_k': 0.10832110776941602, 'slip_spread_k': 0.8007545968671657, 'spread_hl_frac': 0.011256751660666427, 'bb_std_mult': 3.5459457648836756, 'rsi_os': 24, 'rsi_ob': 68, 'vol_spike': 0.12056592413356318, 'adx_thresh': 31.058907272380562, 'atr_min_pct': 0.018231296367262475, 'atr_max_pct': 0.022904654320985644, 'tp_mult': 1.4015142425001281, 'tsl_mult': 0.2873107636230734, 'strategy': 'breakout', 'time_stop': 174, 'use_sma': True, 'use_atr': False, 'use_adx': True, 'use_ema': True, 'use_spike': True, 'rsi_required': False, 'edge_k': 0.4651327649100485, 'edge_cap': 0.8158181511873799}.
[I 2025-08-30 05:22:36,094] Trial 590 finished with values: [-1000000000.0, 1000000000.0] and parameters: {'p_sma': 31, 'p_std': 32, 'p_atr': 16, 'p_adx': 11, 'rsi_period': 41, 'ema1': 15, 'ema2': 33, 'slip_atr_k': 0.06991253036860443, 'slip_spread_k': 0.7403314567970113, 'spread_hl_frac': 0.01042552821665032, 'bb_std_mult': 3.462804153353211, 'rsi_os': 37, 'rsi_ob': 66, 'vol_spike': 0.21780334142674845, 'adx_thresh': 12.378327475888554, 'atr_min_pct': 0.024236732408221003, 'atr_max_pct': 0.14455664790165695, 'tp_mult': 1.8370588125668623, 'tsl_mult': 0.19941631751647748, 'strategy': 'mean_reversion', 'time_stop': 223, 'use_sma': False, 'use_atr': False, 'use_adx': False, 'use_ema': False, 'use_spike': True, 'rsi_required': False, 'edge_k': 0.8512937533941649, 'edge_cap': 0.6206727888025823}.
[I 2025-08-30 05:22:36,462] Trial 589 finished with values: [-0.046105233310647975, 0.046041036224548894] and parameters: {'p_sma': 8, 'p_std': 6, 'p_atr': 9, 'p_adx': 26, 'rsi_period': 20, 'ema1': 30, 'ema2': 16, 'slip_atr_k': 0.009336774755525898, 'slip_spread_k': 0.767756328711951, 'spread_hl_frac': 0.02742653443945512, 'bb_std_mult': 3.449524607432728, 'rsi_os': 24, 'rsi_ob': 64, 'vol_spike': 0.23221894579563257, 'adx_thresh': 31.852340846921585, 'atr_min_pct': 0.0015808795594774488, 'atr_max_pct': 0.1457494126197107, 'tp_mult': 1.8433289320750013, 'tsl_mult': 0.04753353290485901, 'strategy': 'mean_reversion', 'time_stop': 5, 'use_sma': False, 'use_atr': False, 'use_adx': False, 'use_ema': False, 'use_spike': True, 'rsi_required': False, 'edge_k': 0.025402219137587223, 'edge_cap': 0.6202920858513937}.
[I 2025-08-30 05:22:37,336] Trial 587 finished with values: [-0.028606735077208345, 0.028633757578898935] and parameters: {'p_sma': 9, 'p_std': 55, 'p_atr': 8, 'p_adx': 24, 'rsi_period': 20, 'ema1': 16, 'ema2': 38, 'slip_atr_k': 0.017651582357123097, 'slip_spread_k': 0.49515352869734686, 'spread_hl_frac': 0.01497536534529041, 'bb_std_mult': 3.48921379171716, 'rsi_os': 25, 'rsi_ob': 69, 'vol_spike': 0.18263136846853878, 'adx_thresh': 8.125388170571574, 'atr_min_pct': 0.0015383546371285708, 'atr_max_pct': 0.03211916196662424, 'tp_mult': 1.982879541905743, 'tsl_mult': 0.4574068250645173, 'strategy': 'breakout', 'time_stop': 49, 'use_sma': False, 'use_atr': False, 'use_adx': False, 'use_ema': True, 'use_spike': True, 'rsi_required': False, 'edge_k': 1.4976274457667957, 'edge_cap': 0.6704593319949584}.
[I 2025-08-30 05:22:37,337] Trial 588 finished with values: [-1000000000.0, 1000000000.0] and parameters: {'p_sma': 31, 'p_std': 13, 'p_atr': 9, 'p_adx': 22, 'rsi_period': 20, 'ema1': 30, 'ema2': 21, 'slip_atr_k': 0.015926301523953686, 'slip_spread_k': 0.1007228003874826, 'spread_hl_frac': 0.004348664673186356, 'bb_std_mult': 3.4708715094604607, 'rsi_os': 24, 'rsi_ob': 90, 'vol_spike': 0.23058151502531038, 'adx_thresh': 8.156166279450812, 'atr_min_pct': 0.008544296923503697, 'atr_max_pct': 0.03457916009157216, 'tp_mult': 2.4246783149150004, 'tsl_mult': 0.761492236918077, 'strategy': 'breakout', 'time_stop': 169, 'use_sma': False, 'use_atr': False, 'use_adx': False, 'use_ema': True, 'use_spike': True, 'rsi_required': False, 'edge_k': 1.458217950118571, 'edge_cap': 0.6190928502748526}.
[I 2025-08-30 05:23:07,676] Trial 591 finished with values: [-0.024417802650330334, 0.024271993755791643] and parameters: {'p_sma': 8, 'p_std': 52, 'p_atr': 9, 'p_adx': 21, 'rsi_period': 16, 'ema1': 16, 'ema2': 38, 'slip_atr_k': 0.007849058144527563, 'slip_spread_k': 0.10127232781482637, 'spread_hl_frac': 0.02819705461061222, 'bb_std_mult': 1.9495109478117831, 'rsi_os': 25, 'rsi_ob': 64, 'vol_spike': 0.19145271115745707, 'adx_thresh': 5.610110404844537, 'atr_min_pct': 0.0019058141651331247, 'atr_max_pct': 0.13770400954095172, 'tp_mult': 1.491386264351637, 'tsl_mult': 0.04404037248091436, 'strategy': 'breakout', 'time_stop': 102, 'use_sma': False, 'use_atr': False, 'use_adx': False, 'use_ema': True, 'use_spike': True, 'rsi_required': False, 'edge_k': 0.5628844110586624, 'edge_cap': 0.4596039623350411}.
[I 2025-08-30 05:23:07,843] Trial 593 finished with values: [-1000000000.0, 1000000000.0] and parameters: {'p_sma': 11, 'p_std': 31, 'p_atr': 18, 'p_adx': 25, 'rsi_period': 17, 'ema1': 21, 'ema2': 28, 'slip_atr_k': 0.0001739956911508047, 'slip_spread_k': 0.7344018235613602, 'spread_hl_frac': 0.008345985003933163, 'bb_std_mult': 0.5092768264187009, 'rsi_os': 30, 'rsi_ob': 66, 'vol_spike': 0.19073475689972433, 'adx_thresh': 32.19440373521604, 'atr_min_pct': 0.02995681834786195, 'atr_max_pct': 0.1497112688406182, 'tp_mult': 2.050035568095747, 'tsl_mult': 0.18897523099431185, 'strategy': 'breakout', 'time_stop': 154, 'use_sma': False, 'use_atr': True, 'use_adx': False, 'use_ema': True, 'use_spike': False, 'rsi_required': False, 'edge_k': 1.52815599566056, 'edge_cap': 0.6336751929394719}.
[I 2025-08-30 05:23:08,136] Trial 594 finished with values: [-0.0823329131261833, 0.08231569150196479] and parameters: {'p_sma': 11, 'p_std': 52, 'p_atr': 18, 'p_adx': 25, 'rsi_period': 17, 'ema1': 15, 'ema2': 28, 'slip_atr_k': 3.2833670097465704e-05, 'slip_spread_k': 0.7291479415333668, 'spread_hl_frac': 0.017414431433706197, 'bb_std_mult': 2.575930111924553, 'rsi_os': 30, 'rsi_ob': 92, 'vol_spike': 0.2806948801258208, 'adx_thresh': 5.572255804887298, 'atr_min_pct': 0.0005774381354719423, 'atr_max_pct': 0.14000418374608783, 'tp_mult': 1.8931633554323184, 'tsl_mult': 0.606483639992601, 'strategy': 'breakout', 'time_stop': 216, 'use_sma': False, 'use_atr': True, 'use_adx': False, 'use_ema': True, 'use_spike': False, 'rsi_required': False, 'edge_k': 1.5348421695734853, 'edge_cap': 0.5997689112064785}.
