[I 2025-08-30 03:57:20,901] Trial 133 finished with values: [-1000000000.0, 1000000000.0] and parameters: {'p_sma': 23, 'p_std': 10, 'p_atr': 27, 'p_adx': 27, 'rsi_period': 81, 'ema1': 5, 'ema2': 20, 'slip_atr_k': 0.18385470984789287, 'slip_spread_k': 0.6341076259391119, 'spread_hl_frac': 0.04574532260429261, 'bb_std_mult': 2.4970887653612, 'rsi_os': 34, 'rsi_ob': 73, 'vol_spike': 0.20713280358879313, 'adx_thresh': 30.1906826413029, 'atr_min_pct': 0.013964854899112561, 'atr_max_pct': 0.12315771348687923, 'tp_mult': 2.0346988698887642, 'tsl_mult': 0.6790244213568716, 'strategy': 'mean_reversion', 'time_stop': 39, 'use_sma': True, 'use_atr': True, 'use_adx': True, 'use_ema': False, 'use_spike': False, 'rsi_required': True, 'edge_k': 1.815292109985282, 'edge_cap': 0.7487232844776758}.
[I 2025-08-30 03:57:21,114] Trial 134 finished with values: [-1000000000.0, 1000000000.0] and parameters: {'p_sma': 32, 'p_std': 7, 'p_atr': 30, 'p_adx': 27, 'rsi_period': 81, 'ema1': 7, 'ema2': 17, 'slip_atr_k': 0.19099493799782954, 'slip_spread_k': 0.6294460184980838, 'spread_hl_frac': 0.04892867975128487, 'bb_std_mult': 2.3435863526746767, 'rsi_os': 32, 'rsi_ob': 73, 'vol_spike': 0.2166020419751583, 'adx_thresh': 26.74820446211429, 'atr_min_pct': 0.011458855022872564, 'atr_max_pct': 0.12801582150935767, 'tp_mult': 2.2331720139755986, 'tsl_mult': 0.6749272334962915, 'strategy': 'mean_reversion', 'time_stop': 39, 'use_sma': True, 'use_atr': True, 'use_adx': True, 'use_ema': False, 'use_spike': False, 'rsi_required': True, 'edge_k': 1.74170199320351, 'edge_cap': 0.7379235349679277}.
[I 2025-08-30 03:58:01,994] Trial 139 finished with values: [-1000000000.0, 1000000000.0] and parameters: {'p_sma': 26, 'p_std': 8, 'p_atr': 29, 'p_adx': 29, 'rsi_period': 75, 'ema1': 6, 'ema2': 14, 'slip_atr_k': 0.21460351112802012, 'slip_spread_k': 0.6673215803889518, 'spread_hl_frac': 0.04763318187215651, 'bb_std_mult': 2.6920824995045294, 'rsi_os': 39, 'rsi_ob': 71, 'vol_spike': 0.19725774765498177, 'adx_thresh': 28.230980023913016, 'atr_min_pct': 0.019938449436661558, 'atr_max_pct': 0.11731084147865643, 'tp_mult': 2.1443681543925455, 'tsl_mult': 0.7198952184432302, 'strategy': 'mean_reversion', 'time_stop': 13, 'use_sma': True, 'use_atr': True, 'use_adx': True, 'use_ema': False, 'use_spike': False, 'rsi_required': True, 'edge_k': 1.96026314566432, 'edge_cap': 0.6639395452814859}.
[I 2025-08-30 03:58:02,437] Trial 138 finished with values: [-1000000000.0, 1000000000.0] and parameters: {'p_sma': 26, 'p_std': 10, 'p_atr': 28, 'p_adx': 29, 'rsi_period': 72, 'ema1': 6, 'ema2': 20, 'slip_atr_k': 0.20117767678500983, 'slip_spread_k': 0.6664086048662848, 'spread_hl_frac': 0.048731413787424335, 'bb_std_mult': 2.8801523729347545, 'rsi_os': 39, 'rsi_ob': 73, 'vol_spike': 0.2193184147062815, 'adx_thresh': 28.43351505309944, 'atr_min_pct': 0.011420980709446204, 'atr_max_pct': 0.12371781102833175, 'tp_mult': 2.0321172909277387, 'tsl_mult': 0.6710338412805525, 'strategy': 'mean_reversion', 'time_stop': 55, 'use_sma': True, 'use_atr': True, 'use_adx': True, 'use_ema': False, 'use_spike': False, 'rsi_required': True, 'edge_k': 1.960482071103194, 'edge_cap': 0.6491200131726749}.
[I 2025-08-30 03:58:03,357] Trial 140 finished with values: [-0.02846334383796023, 0.028404452200246785] and parameters: {'p_sma': 26, 'p_std': 13, 'p_atr': 29, 'p_adx': 29, 'rsi_period': 76, 'ema1': 6, 'ema2': 11, 'slip_atr_k': 0.21181891702937974, 'slip_spread_k': 0.6678347128407681, 'spread_hl_frac': 0.04744812093110306, 'bb_std_mult': 2.907752554917197, 'rsi_os': 39, 'rsi_ob': 68, 'vol_spike': 0.19947222443456855, 'adx_thresh': 28.35355923355441, 'atr_min_pct': 0.0017769279773486618, 'atr_max_pct': 0.11762687307207526, 'tp_mult': 2.1310734257481916, 'tsl_mult': 0.6164669329863278, 'strategy': 'mean_reversion', 'time_stop': 12, 'use_sma': True, 'use_atr': True, 'use_adx': True, 'use_ema': False, 'use_spike': False, 'rsi_required': True, 'edge_k': 1.9556332525118738, 'edge_cap': 0.6601333023212768}.
[I 2025-08-30 03:58:03,605] Trial 137 finished with values: [-1000000000.0, 1000000000.0] and parameters: {'p_sma': 26, 'p_std': 8, 'p_atr': 30, 'p_adx': 27, 'rsi_period': 76, 'ema1': 6, 'ema2': 19, 'slip_atr_k': 0.2115030363615207, 'slip_spread_k': 0.6262294537467425, 'spread_hl_frac': 0.04580565019692645, 'bb_std_mult': 2.711512128218482, 'rsi_os': 39, 'rsi_ob': 73, 'vol_spike': 0.21775363908298745, 'adx_thresh': 28.449678248236367, 'atr_min_pct': 0.024868574688790706, 'atr_max_pct': 0.11816941053451421, 'tp_mult': 2.004920848698258, 'tsl_mult': 0.6670882333629535, 'strategy': 'mean_reversion', 'time_stop': 13, 'use_sma': True, 'use_atr': True, 'use_adx': True, 'use_ema': False, 'use_spike': False, 'rsi_required': True, 'edge_k': 1.9624058942140234, 'edge_cap': 0.7373405291756681}.
[I 2025-08-30 03:58:45,150] Trial 142 finished with values: [-1000000000.0, 1000000000.0] and parameters: {'p_sma': 35, 'p_std': 13, 'p_atr': 29, 'p_adx': 29, 'rsi_period': 76, 'ema1': 9, 'ema2': 15, 'slip_atr_k': 0.2108265295594256, 'slip_spread_k': 0.5598391192164107, 'spread_hl_frac': 0.04730197078795317, 'bb_std_mult': 2.707012909683763, 'rsi_os': 36, 'rsi_ob': 67, 'vol_spike': 0.18678898830440144, 'adx_thresh': 28.94725224078994, 'atr_min_pct': 0.006315757990816795, 'atr_max_pct': 0.13394860440121795, 'tp_mult': 2.2915772190516144, 'tsl_mult': 0.652202423185725, 'strategy': 'mean_reversion', 'time_stop': 21, 'use_sma': True, 'use_atr': True, 'use_adx': True, 'use_ema': False, 'use_spike': False, 'rsi_required': True, 'edge_k': 1.8565869371976045, 'edge_cap': 0.630813282520279}.
[I 2025-08-30 03:58:47,106] Trial 143 finished with values: [-1000000000.0, 1000000000.0] and parameters: {'p_sma': 24, 'p_std': 30, 'p_atr': 30, 'p_adx': 30, 'rsi_period': 77, 'ema1': 9, 'ema2': 11, 'slip_atr_k': 0.2216391794201544, 'slip_spread_k': 0.7348362978320315, 'spread_hl_frac': 0.04673985430643262, 'bb_std_mult': 2.948976455816049, 'rsi_os': 40, 'rsi_ob': 67, 'vol_spike': 0.17949797689534855, 'adx_thresh': 26.126324053651913, 'atr_min_pct': 0.0018921865143556316, 'atr_max_pct': 0.11549504514686712, 'tp_mult': 1.9987142046314363, 'tsl_mult': 0.6007754321715483, 'strategy': 'mean_reversion', 'time_stop': 5, 'use_sma': True, 'use_atr': True, 'use_adx': True, 'use_ema': False, 'use_spike': False, 'rsi_required': True, 'edge_k': 1.9706896722977236, 'edge_cap': 0.6218755479616276}.
[I 2025-08-30 03:58:49,591] Trial 141 finished with values: [-1000000000.0, 1000000000.0] and parameters: {'p_sma': 34, 'p_std': 5, 'p_atr': 28, 'p_adx': 29, 'rsi_period': 72, 'ema1': 6, 'ema2': 18, 'slip_atr_k': 0.17990110513989044, 'slip_spread_k': 0.5603060889248931, 'spread_hl_frac': 0.04855888124018123, 'bb_std_mult': 2.919646639007266, 'rsi_os': 40, 'rsi_ob': 67, 'vol_spike': 0.18506063332788325, 'adx_thresh': 28.698597306145796, 'atr_min_pct': 0.025140970777030185, 'atr_max_pct': 0.11893344733834021, 'tp_mult': 2.288566708032313, 'tsl_mult': 0.6604541715955795, 'strategy': 'mean_reversion', 'time_stop': 20, 'use_sma': True, 'use_atr': True, 'use_adx': True, 'use_ema': False, 'use_spike': False, 'rsi_required': True, 'edge_k': 1.8603031257452673, 'edge_cap': 0.6519985706242066}.
[I 2025-08-30 03:58:51,203] Trial 144 finished with values: [-1000000000.0, 1000000000.0] and parameters: {'p_sma': 21, 'p_std': 30, 'p_atr': 29, 'p_adx': 30, 'rsi_period': 78, 'ema1': 9, 'ema2': 11, 'slip_atr_k': 0.22148481031381667, 'slip_spread_k': 0.7383379231652479, 'spread_hl_frac': 0.0421180218139221, 'bb_std_mult': 3.0190653225323008, 'rsi_os': 40, 'rsi_ob': 67, 'vol_spike': 0.18693568547218115, 'adx_thresh': 26.050180766907758, 'atr_min_pct': 0.0019459529803115435, 'atr_max_pct': 0.1189265330812271, 'tp_mult': 2.0779106264452625, 'tsl_mult': 0.5785018148938271, 'strategy': 'mean_reversion', 'time_stop': 6, 'use_sma': True, 'use_atr': True, 'use_adx': True, 'use_ema': False, 'use_spike': False, 'rsi_required': True, 'edge_k': 1.975874314440783, 'edge_cap': 0.6292239810222459}.
[I 2025-08-30 03:59:28,334] Trial 146 finished with values: [-1000000000.0, 1000000000.0] and parameters: {'p_sma': 21, 'p_std': 29, 'p_atr': 29, 'p_adx': 30, 'rsi_period': 78, 'ema1': 5, 'ema2': 11, 'slip_atr_k': 0.2199089295477336, 'slip_spread_k': 0.6743771983914855, 'spread_hl_frac': 0.04205585446708149, 'bb_std_mult': 3.0516186736643003, 'rsi_os': 41, 'rsi_ob': 65, 'vol_spike': 0.1984001598936798, 'adx_thresh': 26.31389595617303, 'atr_min_pct': 0.0016254785172947327, 'atr_max_pct': 0.119899562841805, 'tp_mult': 2.1010968344521697, 'tsl_mult': 0.5869596615446394, 'strategy': 'mean_reversion', 'time_stop': 10, 'use_sma': True, 'use_atr': True, 'use_adx': True, 'use_ema': False, 'use_spike': False, 'rsi_required': True, 'edge_k': 1.9345468348617005, 'edge_cap': 0.6823099152176062}.
[I 2025-08-30 03:59:29,411] Trial 145 finished with values: [-1000000000.0, 1000000000.0] and parameters: {'p_sma': 24, 'p_std': 29, 'p_atr': 29, 'p_adx': 30, 'rsi_period': 79, 'ema1': 5, 'ema2': 11, 'slip_atr_k': 0.22677029311161195, 'slip_spread_k': 0.7434976300876796, 'spread_hl_frac': 0.04370018898002474, 'bb_std_mult': 2.9982097604878795, 'rsi_os': 41, 'rsi_ob': 65, 'vol_spike': 0.18111392083276284, 'adx_thresh': 27.72491578975626, 'atr_min_pct': 0.0019153680207806912, 'atr_max_pct': 0.11525792261333634, 'tp_mult': 2.0829494019751635, 'tsl_mult': 0.5929956442392593, 'strategy': 'mean_reversion', 'time_stop': 5, 'use_sma': True, 'use_atr': True, 'use_adx': True, 'use_ema': False, 'use_spike': False, 'rsi_required': True, 'edge_k': 1.932753069269115, 'edge_cap': 0.689886262217123}.
[I 2025-08-30 03:59:29,907] Trial 147 finished with values: [-1000000000.0, 1000000000.0] and parameters: {'p_sma': 22, 'p_std': 39, 'p_atr': 29, 'p_adx': 30, 'rsi_period': 79, 'ema1': 7, 'ema2': 12, 'slip_atr_k': 0.22020552718621478, 'slip_spread_k': 0.6863895219453178, 'spread_hl_frac': 0.04335415884804188, 'bb_std_mult': 2.999651081373133, 'rsi_os': 41, 'rsi_ob': 65, 'vol_spike': 0.1982174339368602, 'adx_thresh': 27.586976687793683, 'atr_min_pct': 0.0015220240805208873, 'atr_max_pct': 0.11420818123882043, 'tp_mult': 2.13546720987046, 'tsl_mult': 0.5769660110220515, 'strategy': 'mean_reversion', 'time_stop': 10, 'use_sma': True, 'use_atr': True, 'use_adx': True, 'use_ema': False, 'use_spike': False, 'rsi_required': True, 'edge_k': 1.9838788876861517, 'edge_cap': 0.6869728158543095}.
[I 2025-08-30 03:59:31,572] Trial 148 finished with values: [-1000000000.0, 1000000000.0] and parameters: {'p_sma': 24, 'p_std': 39, 'p_atr': 29, 'p_adx': 30, 'rsi_period': 79, 'ema1': 5, 'ema2': 12, 'slip_atr_k': 0.22771553600732597, 'slip_spread_k': 0.6977380092523794, 'spread_hl_frac': 0.043293175819823435, 'bb_std_mult': 3.0190794044709595, 'rsi_os': 37, 'rsi_ob': 65, 'vol_spike': 0.19983515110931344, 'adx_thresh': 27.462151542048748, 'atr_min_pct': 0.0011169591689717151, 'atr_max_pct': 0.11395351175602801, 'tp_mult': 2.1310720059667747, 'tsl_mult': 0.5742653038013416, 'strategy': 'mean_reversion', 'time_stop': 11, 'use_sma': True, 'use_atr': True, 'use_adx': True, 'use_ema': False, 'use_spike': False, 'rsi_required': True, 'edge_k': 1.9402524711379467, 'edge_cap': 0.6829631907092626}.
[I 2025-08-30 04:00:20,607] Trial 151 finished with values: [-0.02343916292427728, 0.023367080456038945] and parameters: {'p_sma': 25, 'p_std': 25, 'p_atr': 30, 'p_adx': 29, 'rsi_period': 75, 'ema1': 6, 'ema2': 10, 'slip_atr_k': 0.20661583321076551, 'slip_spread_k': 0.6865491530125932, 'spread_hl_frac': 0.04465548061101141, 'bb_std_mult': 2.90298219971529, 'rsi_os': 44, 'rsi_ob': 63, 'vol_spike': 0.16654039444660082, 'adx_thresh': 29.76800138337328, 'atr_min_pct': 0.0008241403640693055, 'atr_max_pct': 0.10884671817352906, 'tp_mult': 1.9565716733821037, 'tsl_mult': 0.5260567530328651, 'strategy': 'mean_reversion', 'time_stop': 16, 'use_sma': True, 'use_atr': True, 'use_adx': True, 'use_ema': False, 'use_spike': False, 'rsi_required': True, 'edge_k': 1.9190400427552265, 'edge_cap': 0.709560363186409}.
[I 2025-08-30 04:00:21,232] Trial 149 finished with values: [-0.027904408071238174, 0.02783260339632078] and parameters: {'p_sma': 23, 'p_std': 19, 'p_atr': 30, 'p_adx': 30, 'rsi_period': 75, 'ema1': 7, 'ema2': 12, 'slip_atr_k': 0.20753004545036363, 'slip_spread_k': 0.6890577693345201, 'spread_hl_frac': 0.04479455267532161, 'bb_std_mult': 2.910846469735351, 'rsi_os': 44, 'rsi_ob': 65, 'vol_spike': 0.20748721558008648, 'adx_thresh': 27.40647491997237, 'atr_min_pct': 0.0008934958290705932, 'atr_max_pct': 0.11463380164240461, 'tp_mult': 2.1433769438796864, 'tsl_mult': 0.6184621452802681, 'strategy': 'mean_reversion', 'time_stop': 16, 'use_sma': True, 'use_atr': True, 'use_adx': True, 'use_ema': False, 'use_spike': False, 'rsi_required': True, 'edge_k': 1.9996748680772825, 'edge_cap': 0.6713594276849951}.
[I 2025-08-30 04:00:21,885] Trial 150 finished with values: [-0.03851051889625379, 0.03843953504882928] and parameters: {'p_sma': 23, 'p_std': 15, 'p_atr': 30, 'p_adx': 29, 'rsi_period': 75, 'ema1': 7, 'ema2': 12, 'slip_atr_k': 0.2065514560709541, 'slip_spread_k': 0.6924740520754111, 'spread_hl_frac': 0.04488350905162583, 'bb_std_mult': 3.001109504764893, 'rsi_os': 37, 'rsi_ob': 63, 'vol_spike': 0.20620206686192744, 'adx_thresh': 27.253507443351577, 'atr_min_pct': 0.0009965182913574118, 'atr_max_pct': 0.10933637348246507, 'tp_mult': 2.1420229911905913, 'tsl_mult': 0.6198142933558316, 'strategy': 'mean_reversion', 'time_stop': 15, 'use_sma': True, 'use_atr': True, 'use_adx': True, 'use_ema': False, 'use_spike': False, 'rsi_required': True, 'edge_k': 1.9138933822427984, 'edge_cap': 0.7163474329321537}.
[I 2025-08-30 04:00:22,875] Trial 152 finished with values: [-0.02461004196080685, 0.0245380906544906] and parameters: {'p_sma': 25, 'p_std': 19, 'p_atr': 30, 'p_adx': 29, 'rsi_period': 83, 'ema1': 6, 'ema2': 10, 'slip_atr_k': 0.20669958261716817, 'slip_spread_k': 0.654830203364524, 'spread_hl_frac': 0.044963930555884955, 'bb_std_mult': 2.889542669037113, 'rsi_os': 38, 'rsi_ob': 68, 'vol_spike': 0.12761130495811274, 'adx_thresh': 29.46585410647148, 'atr_min_pct': 0.0008755024181051033, 'atr_max_pct': 0.1249675190660873, 'tp_mult': 1.9175996264418311, 'tsl_mult': 0.47521735570431134, 'strategy': 'mean_reversion', 'time_stop': 22, 'use_sma': True, 'use_atr': True, 'use_adx': True, 'use_ema': False, 'use_spike': False, 'rsi_required': True, 'edge_k': 1.8628585136063558, 'edge_cap': 0.7098845160682634}.
[I 2025-08-30 04:01:10,992] Trial 154 finished with values: [-0.032281894099587594, 0.032210676250320855] and parameters: {'p_sma': 25, 'p_std': 20, 'p_atr': 30, 'p_adx': 29, 'rsi_period': 69, 'ema1': 7, 'ema2': 10, 'slip_atr_k': 0.20583496859522088, 'slip_spread_k': 0.7219213923665486, 'spread_hl_frac': 0.03635298104844099, 'bb_std_mult': 3.227331353566842, 'rsi_os': 44, 'rsi_ob': 63, 'vol_spike': 0.16625427627773476, 'adx_thresh': 31.941859555832124, 'atr_min_pct': 0.0008874550778116447, 'atr_max_pct': 0.10787331886748618, 'tp_mult': 1.9121980983498186, 'tsl_mult': 0.4794110986236649, 'strategy': 'mean_reversion', 'time_stop': 24, 'use_sma': True, 'use_atr': True, 'use_adx': True, 'use_ema': False, 'use_spike': False, 'rsi_required': True, 'edge_k': 0.13953626697261545, 'edge_cap': 0.7108693752911642}.
[I 2025-08-30 04:01:10,994] Trial 153 finished with values: [-1000000000.0, 1000000000.0] and parameters: {'p_sma': 25, 'p_std': 36, 'p_atr': 30, 'p_adx': 29, 'rsi_period': 69, 'ema1': 7, 'ema2': 10, 'slip_atr_k': 0.2071880155298803, 'slip_spread_k': 0.7165706124123442, 'spread_hl_frac': 0.02013939601940379, 'bb_std_mult': 3.0923024246717428, 'rsi_os': 44, 'rsi_ob': 63, 'vol_spike': 0.15782795468680128, 'adx_thresh': 31.235713759396248, 'atr_min_pct': 0.000924172141093358, 'atr_max_pct': 0.10165360642199135, 'tp_mult': 1.9173694795262732, 'tsl_mult': 0.5186865707254262, 'strategy': 'mean_reversion', 'time_stop': 24, 'use_sma': True, 'use_atr': True, 'use_adx': True, 'use_ema': False, 'use_spike': False, 'rsi_required': True, 'edge_k': 1.6557614803760572, 'edge_cap': 0.787442859619542}.
[I 2025-08-30 04:01:11,516] Trial 155 finished with values: [-1000000000.0, 1000000000.0] and parameters: {'p_sma': 25, 'p_std': 25, 'p_atr': 30, 'p_adx': 29, 'rsi_period': 69, 'ema1': 8, 'ema2': 10, 'slip_atr_k': 0.20607064309604398, 'slip_spread_k': 0.760088705371503, 'spread_hl_frac': 0.03706111292851205, 'bb_std_mult': 3.0974943854919443, 'rsi_os': 44, 'rsi_ob': 63, 'vol_spike': 0.154808091315942, 'adx_thresh': 31.597530345672958, 'atr_min_pct': 0.0010815779004438146, 'atr_max_pct': 0.10146843662607774, 'tp_mult': 1.919808934689523, 'tsl_mult': 0.5182749425679012, 'strategy': 'mean_reversion', 'time_stop': 25, 'use_sma': True, 'use_atr': True, 'use_adx': True, 'use_ema': False, 'use_spike': False, 'rsi_required': True, 'edge_k': 1.7880671340992287, 'edge_cap': 0.7776324384870711}.
[I 2025-08-30 04:01:11,746] Trial 156 finished with values: [-1000000000.0, 1000000000.0] and parameters: {'p_sma': 23, 'p_std': 26, 'p_atr': 30, 'p_adx': 29, 'rsi_period': 71, 'ema1': 7, 'ema2': 10, 'slip_atr_k': 0.206934963473335, 'slip_spread_k': 0.7583211804482082, 'spread_hl_frac': 0.03678161082530599, 'bb_std_mult': 3.0962145186226953, 'rsi_os': 44, 'rsi_ob': 63, 'vol_spike': 0.16555792913715475, 'adx_thresh': 31.988041713925806, 'atr_min_pct': 0.0009383163542292287, 'atr_max_pct': 0.10865236270568131, 'tp_mult': 1.9237330174229728, 'tsl_mult': 0.5197568685781377, 'strategy': 'mean_reversion', 'time_stop': 24, 'use_sma': True, 'use_atr': True, 'use_adx': True, 'use_ema': False, 'use_spike': False, 'rsi_required': True, 'edge_k': 1.7930657265142247, 'edge_cap': 0.7854856122126508}.
[I 2025-08-30 04:01:54,446] Trial 159 finished with values: [-1000000000.0, 1000000000.0] and parameters: {'p_sma': 27, 'p_std': 25, 'p_atr': 30, 'p_adx': 30, 'rsi_period': 72, 'ema1': 14, 'ema2': 10, 'slip_atr_k': 0.1975670542117091, 'slip_spread_k': 0.7893160047720695, 'spread_hl_frac': 0.0398002027140259, 'bb_std_mult': 2.883093859031395, 'rsi_os': 46, 'rsi_ob': 62, 'vol_spike': 0.16246830413191293, 'adx_thresh': 29.713208249221015, 'atr_min_pct': 0.0026742631824398337, 'atr_max_pct': 0.10945349602597884, 'tp_mult': 1.8271300957459162, 'tsl_mult': 0.4792808492286802, 'strategy': 'mean_reversion', 'time_stop': 31, 'use_sma': True, 'use_atr': True, 'use_adx': True, 'use_ema': False, 'use_spike': False, 'rsi_required': True, 'edge_k': 1.8528871119240737, 'edge_cap': 0.7169330882785276}.
[I 2025-08-30 04:01:55,238] Trial 157 finished with values: [-1000000000.0, 1000000000.0] and parameters: {'p_sma': 25, 'p_std': 26, 'p_atr': 30, 'p_adx': 29, 'rsi_period': 71, 'ema1': 8, 'ema2': 10, 'slip_atr_k': 0.19710086211966948, 'slip_spread_k': 0.7898132157964726, 'spread_hl_frac': 0.03661712404762217, 'bb_std_mult': 3.205669205551282, 'rsi_os': 48, 'rsi_ob': 62, 'vol_spike': 0.16427754196601116, 'adx_thresh': 31.9462520488792, 'atr_min_pct': 0.002582966844433616, 'atr_max_pct': 0.10769585642678726, 'tp_mult': 1.8212449626673366, 'tsl_mult': 0.43974151830808406, 'strategy': 'mean_reversion', 'time_stop': 32, 'use_sma': True, 'use_atr': True, 'use_adx': True, 'use_ema': False, 'use_spike': False, 'rsi_required': True, 'edge_k': 0.17032329681077174, 'edge_cap': 0.7253444024026129}.
[I 2025-08-30 04:01:55,769] Trial 158 finished with values: [-1000000000.0, 1000000000.0] and parameters: {'p_sma': 26, 'p_std': 25, 'p_atr': 30, 'p_adx': 29, 'rsi_period': 71, 'ema1': 8, 'ema2': 10, 'slip_atr_k': 0.19689291873626394, 'slip_spread_k': 0.7810035916763015, 'spread_hl_frac': 0.040118574050219145, 'bb_std_mult': 2.895051289696757, 'rsi_os': 48, 'rsi_ob': 60, 'vol_spike': 0.16617220189515639, 'adx_thresh': 31.865930162190974, 'atr_min_pct': 0.0026650389810143134, 'atr_max_pct': 0.10764848508395482, 'tp_mult': 1.8257349719122664, 'tsl_mult': 0.4741401230219343, 'strategy': 'mean_reversion', 'time_stop': 32, 'use_sma': True, 'use_atr': True, 'use_adx': True, 'use_ema': False, 'use_spike': False, 'rsi_required': True, 'edge_k': 1.8040688875140782, 'edge_cap': 0.7768497770287613}.
[I 2025-08-30 04:01:56,269] Trial 160 finished with values: [-0.062216019644845466, 0.06214742496538448] and parameters: {'p_sma': 25, 'p_std': 19, 'p_atr': 30, 'p_adx': 30, 'rsi_period': 65, 'ema1': 12, 'ema2': 11, 'slip_atr_k': 0.19674778709982726, 'slip_spread_k': 0.666122201968644, 'spread_hl_frac': 0.03918752977230648, 'bb_std_mult': 2.9170169742900898, 'rsi_os': 47, 'rsi_ob': 60, 'vol_spike': 0.14986468465729882, 'adx_thresh': 29.862388560645844, 'atr_min_pct': 3.993802092220353e-05, 'atr_max_pct': 0.10772743740992076, 'tp_mult': 1.950102678539963, 'tsl_mult': 0.5636336820873005, 'strategy': 'mean_reversion', 'time_stop': 17, 'use_sma': True, 'use_atr': True, 'use_adx': True, 'use_ema': False, 'use_spike': False, 'rsi_required': True, 'edge_k': 1.9994878245678565, 'edge_cap': 0.7202966857710383}.
[I 2025-08-30 04:02:40,564] Trial 163 finished with values: [-0.03279072045013787, 0.032716329989809] and parameters: {'p_sma': 21, 'p_std': 20, 'p_atr': 30, 'p_adx': 11, 'rsi_period': 76, 'ema1': 6, 'ema2': 11, 'slip_atr_k': 0.2147879128896748, 'slip_spread_k': 0.6664178883145776, 'spread_hl_frac': 0.041083908996065954, 'bb_std_mult': 2.9514974348242227, 'rsi_os': 45, 'rsi_ob': 61, 'vol_spike': 0.1444129681933766, 'adx_thresh': 30.868722216015826, 'atr_min_pct': 0.0016885572248288806, 'atr_max_pct': 0.09553855603551474, 'tp_mult': 1.763014891500456, 'tsl_mult': 0.3942262604862866, 'strategy': 'mean_reversion', 'time_stop': 16, 'use_sma': True, 'use_atr': True, 'use_adx': False, 'use_ema': False, 'use_spike': False, 'rsi_required': True, 'edge_k': 1.5914591724000657, 'edge_cap': 0.7545090273028994}.
