[I 2025-08-30 04:54:12,824] Trial 434 finished with values: [-1000000000.0, 1000000000.0] and parameters: {'p_sma': 17, 'p_std': 40, 'p_atr': 11, 'p_adx': 25, 'rsi_period': 17, 'ema1': 30, 'ema2': 28, 'slip_atr_k': 0.22476131449371367, 'slip_spread_k': 0.12212743430863937, 'spread_hl_frac': 0.012205482046204585, 'bb_std_mult': 2.6509373464680044, 'rsi_os': 25, 'rsi_ob': 80, 'vol_spike': 0.22235540845249033, 'adx_thresh': 33.51784730683898, 'atr_min_pct': 0.02914842099221509, 'atr_max_pct': 0.1444970656021283, 'tp_mult': 2.6680469066911066, 'tsl_mult': 0.17210435006844535, 'strategy': 'mean_reversion', 'time_stop': 193, 'use_sma': False, 'use_atr': False, 'use_adx': False, 'use_ema': False, 'use_spike': True, 'rsi_required': False, 'edge_k': 0.08390686509214185, 'edge_cap': 0.6676035014943151}.
[I 2025-08-30 04:54:14,205] Trial 435 finished with values: [-1000000000.0, 1000000000.0] and parameters: {'p_sma': 7, 'p_std': 54, 'p_atr': 10, 'p_adx': 12, 'rsi_period': 70, 'ema1': 22, 'ema2': 24, 'slip_atr_k': 0.0067731018117580056, 'slip_spread_k': 0.8891648468701767, 'spread_hl_frac': 0.011665357551593026, 'bb_std_mult': 2.6457786707252304, 'rsi_os': 25, 'rsi_ob': 67, 'vol_spike': 0.18622777297452145, 'adx_thresh': 24.001938428520926, 'atr_min_pct': 0.004791243458724526, 'atr_max_pct': 0.0721795158421338, 'tp_mult': 2.3727003921966334, 'tsl_mult': 0.2343366081640936, 'strategy': 'mean_reversion', 'time_stop': 187, 'use_sma': False, 'use_atr': False, 'use_adx': False, 'use_ema': False, 'use_spike': True, 'rsi_required': True, 'edge_k': 0.0003540576200551371, 'edge_cap': 0.679679840391221}.
[I 2025-08-30 04:54:15,196] Trial 433 finished with values: [-1000000000.0, 1000000000.0] and parameters: {'p_sma': 40, 'p_std': 39, 'p_atr': 10, 'p_adx': 14, 'rsi_period': 17, 'ema1': 30, 'ema2': 28, 'slip_atr_k': 0.008382073647757005, 'slip_spread_k': 0.6198106319064945, 'spread_hl_frac': 0.03609451176666515, 'bb_std_mult': 3.3288945623255883, 'rsi_os': 10, 'rsi_ob': 92, 'vol_spike': 0.18893032212774152, 'adx_thresh': 24.231512204685053, 'atr_min_pct': 0.013034390025786855, 'atr_max_pct': 0.08651906020388458, 'tp_mult': 1.8723390687988053, 'tsl_mult': 0.17497184993524903, 'strategy': 'mean_reversion', 'time_stop': 219, 'use_sma': False, 'use_atr': False, 'use_adx': False, 'use_ema': True, 'use_spike': True, 'rsi_required': False, 'edge_k': 1.4909737272954215, 'edge_cap': 0.5085696112032516}.
[I 2025-08-30 04:54:16,146] Trial 432 finished with values: [-1000000000.0, 1000000000.0] and parameters: {'p_sma': 7, 'p_std': 39, 'p_atr': 10, 'p_adx': 14, 'rsi_period': 17, 'ema1': 22, 'ema2': 28, 'slip_atr_k': 0.05776290614932031, 'slip_spread_k': 0.6229308415870712, 'spread_hl_frac': 0.03603724947386716, 'bb_std_mult': 3.3425999741597447, 'rsi_os': 10, 'rsi_ob': 67, 'vol_spike': 0.29997444040223015, 'adx_thresh': 32.088878916362916, 'atr_min_pct': 0.02535617141796715, 'atr_max_pct': 0.14462887708391808, 'tp_mult': 2.3475487765817067, 'tsl_mult': 0.9992769947759381, 'strategy': 'mean_reversion', 'time_stop': 220, 'use_sma': False, 'use_atr': False, 'use_adx': False, 'use_ema': True, 'use_spike': True, 'rsi_required': False, 'edge_k': 0.0887010311159474, 'edge_cap': 0.6715090517776215}.
[I 2025-08-30 04:55:00,367] Trial 437 finished with values: [-1000000000.0, 1000000000.0] and parameters: {'p_sma': 9, 'p_std': 59, 'p_atr': 9, 'p_adx': 26, 'rsi_period': 10, 'ema1': 14, 'ema2': 51, 'slip_atr_k': 0.10022968086163284, 'slip_spread_k': 0.7109240565123714, 'spread_hl_frac': 0.0067927531556566745, 'bb_std_mult': 3.3419830174056253, 'rsi_os': 28, 'rsi_ob': 65, 'vol_spike': 0.18894669373982878, 'adx_thresh': 32.34564062192611, 'atr_min_pct': 0.013744157659560054, 'atr_max_pct': 0.1323788506562027, 'tp_mult': 1.6931749978669444, 'tsl_mult': 0.9071698970618594, 'strategy': 'breakout', 'time_stop': 270, 'use_sma': False, 'use_atr': True, 'use_adx': True, 'use_ema': True, 'use_spike': True, 'rsi_required': False, 'edge_k': 1.5338633661143886, 'edge_cap': 0.6391648603504079}.
[I 2025-08-30 04:55:01,350] Trial 439 finished with values: [-1000000000.0, 1000000000.0] and parameters: {'p_sma': 9, 'p_std': 27, 'p_atr': 14, 'p_adx': 22, 'rsi_period': 41, 'ema1': 16, 'ema2': 46, 'slip_atr_k': 0.03732813967778437, 'slip_spread_k': 0.7064615343846977, 'spread_hl_frac': 0.007991313858493545, 'bb_std_mult': 2.316717093446764, 'rsi_os': 22, 'rsi_ob': 65, 'vol_spike': 0.17671874369434215, 'adx_thresh': 30.763134260047522, 'atr_min_pct': 0.014379531357372684, 'atr_max_pct': 0.14724883090580906, 'tp_mult': 1.7044223835223486, 'tsl_mult': 0.2671282200265929, 'strategy': 'breakout', 'time_stop': 197, 'use_sma': False, 'use_atr': True, 'use_adx': True, 'use_ema': True, 'use_spike': True, 'rsi_required': True, 'edge_k': 1.5450299664402096, 'edge_cap': 0.6420958888402679}.
[I 2025-08-30 04:55:02,369] Trial 438 finished with values: [-1000000000.0, 1000000000.0] and parameters: {'p_sma': 9, 'p_std': 32, 'p_atr': 9, 'p_adx': 26, 'rsi_period': 21, 'ema1': 16, 'ema2': 58, 'slip_atr_k': 0.01796346022283076, 'slip_spread_k': 0.7162425246255117, 'spread_hl_frac': 0.0068374330958675435, 'bb_std_mult': 3.1881007433669835, 'rsi_os': 24, 'rsi_ob': 65, 'vol_spike': 0.027468353704849374, 'adx_thresh': 26.116038456936643, 'atr_min_pct': 0.02626579822265268, 'atr_max_pct': 0.08381017715238369, 'tp_mult': 1.7048239592608245, 'tsl_mult': 0.26042112754998176, 'strategy': 'breakout', 'time_stop': 219, 'use_sma': False, 'use_atr': True, 'use_adx': True, 'use_ema': True, 'use_spike': True, 'rsi_required': True, 'edge_k': 1.6119673004783872, 'edge_cap': 0.6399695068736894}.
[I 2025-08-30 04:55:02,693] Trial 436 finished with values: [-1000000000.0, 1000000000.0] and parameters: {'p_sma': 7, 'p_std': 54, 'p_atr': 14, 'p_adx': 13, 'rsi_period': 56, 'ema1': 14, 'ema2': 30, 'slip_atr_k': 0.13694641265333113, 'slip_spread_k': 0.5421439758340515, 'spread_hl_frac': 0.007799751723365075, 'bb_std_mult': 3.4370552893183364, 'rsi_os': 22, 'rsi_ob': 45, 'vol_spike': 0.18441756994938405, 'adx_thresh': 7.583803331260855, 'atr_min_pct': 0.014087365608170933, 'atr_max_pct': 0.035232100950577536, 'tp_mult': 1.885584498944356, 'tsl_mult': 0.0012438158174382652, 'strategy': 'breakout', 'time_stop': 217, 'use_sma': False, 'use_atr': True, 'use_adx': True, 'use_ema': True, 'use_spike': True, 'rsi_required': True, 'edge_k': 1.6132339767691954, 'edge_cap': 0.5014750871445216}.
[I 2025-08-30 04:55:45,471] Trial 442 finished with values: [-1000000000.0, 1000000000.0] and parameters: {'p_sma': 12, 'p_std': 53, 'p_atr': 13, 'p_adx': 24, 'rsi_period': 45, 'ema1': 14, 'ema2': 30, 'slip_atr_k': 0.08521154190675387, 'slip_spread_k': 0.7495738589470622, 'spread_hl_frac': 0.009340323199398485, 'bb_std_mult': 3.4620582555663133, 'rsi_os': 7, 'rsi_ob': 70, 'vol_spike': 0.18123669193076614, 'adx_thresh': 16.666308631093646, 'atr_min_pct': 0.0018353626259872352, 'atr_max_pct': 0.1388748224132445, 'tp_mult': 1.906196487247972, 'tsl_mult': 0.20498574511360043, 'strategy': 'breakout', 'time_stop': 207, 'use_sma': True, 'use_atr': False, 'use_adx': False, 'use_ema': False, 'use_spike': False, 'rsi_required': False, 'edge_k': 1.5017932744569653, 'edge_cap': 0.9987123837728116}.
[I 2025-08-30 04:55:47,450] Trial 443 finished with values: [-0.02601259972308234, 0.02594193663969745] and parameters: {'p_sma': 58, 'p_std': 53, 'p_atr': 23, 'p_adx': 16, 'rsi_period': 24, 'ema1': 10, 'ema2': 20, 'slip_atr_k': 0.023779723727069647, 'slip_spread_k': 0.7582275982057428, 'spread_hl_frac': 0.03954217148099401, 'bb_std_mult': 3.4511717395934394, 'rsi_os': 24, 'rsi_ob': 74, 'vol_spike': 0.038797350720596854, 'adx_thresh': 31.647661637315494, 'atr_min_pct': 0.0017369560106499822, 'atr_max_pct': 0.1472823839398314, 'tp_mult': 1.9165365870111302, 'tsl_mult': 0.6586822447768625, 'strategy': 'breakout', 'time_stop': 63, 'use_sma': True, 'use_atr': False, 'use_adx': False, 'use_ema': False, 'use_spike': False, 'rsi_required': False, 'edge_k': 0.3402240963014511, 'edge_cap': 0.6135187419143294}.
[I 2025-08-30 04:55:47,971] Trial 440 finished with values: [-1000000000.0, 1000000000.0] and parameters: {'p_sma': 8, 'p_std': 27, 'p_atr': 8, 'p_adx': 24, 'rsi_period': 25, 'ema1': 26, 'ema2': 42, 'slip_atr_k': 0.016385739557642408, 'slip_spread_k': 0.758280085015108, 'spread_hl_frac': 0.009343293065563956, 'bb_std_mult': 3.424143008987503, 'rsi_os': 23, 'rsi_ob': 66, 'vol_spike': 0.17652254030568054, 'adx_thresh': 26.07853068395441, 'atr_min_pct': 0.0028677947872266605, 'atr_max_pct': 0.14705596365088014, 'tp_mult': 1.909019352995235, 'tsl_mult': 0.6445912581194603, 'strategy': 'breakout', 'time_stop': 230, 'use_sma': True, 'use_atr': True, 'use_adx': True, 'use_ema': True, 'use_spike': False, 'rsi_required': True, 'edge_k': 1.6102125888586731, 'edge_cap': 0.6112095310741914}.
[I 2025-08-30 04:55:48,644] Trial 441 finished with values: [-1000000000.0, 1000000000.0] and parameters: {'p_sma': 6, 'p_std': 54, 'p_atr': 13, 'p_adx': 16, 'rsi_period': 21, 'ema1': 15, 'ema2': 29, 'slip_atr_k': 0.02060429104949982, 'slip_spread_k': 0.7562495499834633, 'spread_hl_frac': 0.008837000720776906, 'bb_std_mult': 3.4229857299793847, 'rsi_os': 24, 'rsi_ob': 51, 'vol_spike': 0.18280131137379185, 'adx_thresh': 7.5372047360070376, 'atr_min_pct': 0.0022415435879139323, 'atr_max_pct': 0.05802273025500315, 'tp_mult': 1.8959602521647845, 'tsl_mult': 0.642905380298392, 'strategy': 'breakout', 'time_stop': 62, 'use_sma': True, 'use_atr': False, 'use_adx': False, 'use_ema': True, 'use_spike': False, 'rsi_required': False, 'edge_k': 1.5937468192133153, 'edge_cap': 0.15179827298087178}.
[I 2025-08-30 04:56:33,300] Trial 447 finished with values: [-1000000000.0, 1000000000.0] and parameters: {'p_sma': 11, 'p_std': 23, 'p_atr': 16, 'p_adx': 23, 'rsi_period': 82, 'ema1': 15, 'ema2': 27, 'slip_atr_k': 0.004529578930229231, 'slip_spread_k': 0.24888676993717113, 'spread_hl_frac': 0.013404155357615103, 'bb_std_mult': 1.1210245150672833, 'rsi_os': 26, 'rsi_ob': 91, 'vol_spike': 0.15887473586470383, 'adx_thresh': 30.912671233784124, 'atr_min_pct': 0.021016473554950482, 'atr_max_pct': 0.0298497542099999, 'tp_mult': 1.823967789087402, 'tsl_mult': 0.2172639828584435, 'strategy': 'breakout', 'time_stop': 203, 'use_sma': False, 'use_atr': False, 'use_adx': False, 'use_ema': True, 'use_spike': True, 'rsi_required': False, 'edge_k': 1.2683844138586986, 'edge_cap': 0.059278014832667425}.
[I 2025-08-30 04:56:35,282] Trial 444 finished with values: [-0.05002825464524807, 0.04998127749394193] and parameters: {'p_sma': 37, 'p_std': 51, 'p_atr': 8, 'p_adx': 23, 'rsi_period': 25, 'ema1': 15, 'ema2': 29, 'slip_atr_k': 0.0040408690010901565, 'slip_spread_k': 0.7695914252276713, 'spread_hl_frac': 0.013266920035229264, 'bb_std_mult': 1.11467332602165, 'rsi_os': 24, 'rsi_ob': 67, 'vol_spike': 0.17199597094919822, 'adx_thresh': 12.167568396173788, 'atr_min_pct': 8.935229177247284e-06, 'atr_max_pct': 0.05533455862270575, 'tp_mult': 1.9940137783797245, 'tsl_mult': 0.2376977642459619, 'strategy': 'breakout', 'time_stop': 175, 'use_sma': True, 'use_atr': False, 'use_adx': False, 'use_ema': True, 'use_spike': False, 'rsi_required': False, 'edge_k': 1.4034821195818303, 'edge_cap': 0.6074711674102962}.
[I 2025-08-30 04:56:35,839] Trial 445 finished with values: [-0.06305412926804033, 0.0629919346866194] and parameters: {'p_sma': 37, 'p_std': 51, 'p_atr': 8, 'p_adx': 23, 'rsi_period': 19, 'ema1': 15, 'ema2': 29, 'slip_atr_k': 0.11123503526297147, 'slip_spread_k': 0.7805406725363515, 'spread_hl_frac': 0.013443768231304883, 'bb_std_mult': 3.276382910605814, 'rsi_os': 38, 'rsi_ob': 62, 'vol_spike': 0.17132588448752287, 'adx_thresh': 25.323958078211525, 'atr_min_pct': 0.0026993405584101633, 'atr_max_pct': 0.14402236110808037, 'tp_mult': 1.828146156241594, 'tsl_mult': 0.23290618103541968, 'strategy': 'breakout', 'time_stop': 230, 'use_sma': False, 'use_atr': False, 'use_adx': False, 'use_ema': True, 'use_spike': True, 'rsi_required': False, 'edge_k': 1.2888520569419912, 'edge_cap': 0.4809165312463932}.
[I 2025-08-30 04:56:36,323] Trial 446 finished with values: [-0.04520022115094269, 0.045188325985957054] and parameters: {'p_sma': 35, 'p_std': 51, 'p_atr': 11, 'p_adx': 23, 'rsi_period': 19, 'ema1': 15, 'ema2': 44, 'slip_atr_k': 0.005453786511563098, 'slip_spread_k': 0.793041759473503, 'spread_hl_frac': 0.014528567779688327, 'bb_std_mult': 1.12293951922197, 'rsi_os': 26, 'rsi_ob': 58, 'vol_spike': 0.2646408543593126, 'adx_thresh': 31.034116911419975, 'atr_min_pct': 0.0008378349303163173, 'atr_max_pct': 0.12794255890685896, 'tp_mult': 2.0095109075986852, 'tsl_mult': 0.39604498151600603, 'strategy': 'breakout', 'time_stop': 211, 'use_sma': False, 'use_atr': False, 'use_adx': False, 'use_ema': True, 'use_spike': True, 'rsi_required': False, 'edge_k': 1.565174836395488, 'edge_cap': 0.050169409717292335}.
[I 2025-08-30 04:57:17,183] Trial 450 finished with values: [-0.07574560016454668, 0.0756861679384831] and parameters: {'p_sma': 47, 'p_std': 52, 'p_atr': 11, 'p_adx': 25, 'rsi_period': 19, 'ema1': 25, 'ema2': 24, 'slip_atr_k': 0.06848042567704632, 'slip_spread_k': 0.7906119968673192, 'spread_hl_frac': 0.011146988717869826, 'bb_std_mult': 1.8031176666305226, 'rsi_os': 26, 'rsi_ob': 60, 'vol_spike': 0.19982569302482128, 'adx_thresh': 33.01925022159696, 'atr_min_pct': 0.0009492830970414051, 'atr_max_pct': 0.14097920105119274, 'tp_mult': 1.7589193825371958, 'tsl_mult': 0.21323339673981584, 'strategy': 'mean_reversion', 'time_stop': 210, 'use_sma': False, 'use_atr': False, 'use_adx': False, 'use_ema': False, 'use_spike': True, 'rsi_required': False, 'edge_k': 1.465864788015451, 'edge_cap': 0.7139102076768864}.
[I 2025-08-30 04:57:18,451] Trial 449 finished with values: [-0.031684412489819236, 0.03162562069858331] and parameters: {'p_sma': 47, 'p_std': 51, 'p_atr': 18, 'p_adx': 25, 'rsi_period': 80, 'ema1': 17, 'ema2': 41, 'slip_atr_k': 0.010016233687558865, 'slip_spread_k': 0.7911444196769474, 'spread_hl_frac': 0.011350579912044278, 'bb_std_mult': 3.243303235730101, 'rsi_os': 21, 'rsi_ob': 58, 'vol_spike': 0.1908846074544545, 'adx_thresh': 32.89180469981803, 'atr_min_pct': 0.0009110375036966753, 'atr_max_pct': 0.06470816137701335, 'tp_mult': 1.777125015264131, 'tsl_mult': 0.1480909409444312, 'strategy': 'mean_reversion', 'time_stop': 208, 'use_sma': False, 'use_atr': False, 'use_adx': False, 'use_ema': False, 'use_spike': True, 'rsi_required': False, 'edge_k': 1.4755691286806285, 'edge_cap': 0.7730924544670807}.
[I 2025-08-30 04:57:19,028] Trial 448 finished with values: [-1000000000.0, 1000000000.0] and parameters: {'p_sma': 8, 'p_std': 51, 'p_atr': 8, 'p_adx': 25, 'rsi_period': 19, 'ema1': 25, 'ema2': 35, 'slip_atr_k': 0.11062658634959184, 'slip_spread_k': 0.7806861574499564, 'spread_hl_frac': 0.017608261098579887, 'bb_std_mult': 3.27532638529874, 'rsi_os': 39, 'rsi_ob': 63, 'vol_spike': 0.1726435716733073, 'adx_thresh': 33.04041468638242, 'atr_min_pct': 0.0009063633869054207, 'atr_max_pct': 0.1438121516251834, 'tp_mult': 2.000080838664633, 'tsl_mult': 0.2373113616684057, 'strategy': 'mean_reversion', 'time_stop': 137, 'use_sma': False, 'use_atr': False, 'use_adx': False, 'use_ema': True, 'use_spike': True, 'rsi_required': False, 'edge_k': 1.4632095205087536, 'edge_cap': 0.5297319747005159}.
[I 2025-08-30 04:57:19,787] Trial 451 finished with values: [-0.07490202935997581, 0.07487224044945597] and parameters: {'p_sma': 48, 'p_std': 13, 'p_atr': 9, 'p_adx': 25, 'rsi_period': 20, 'ema1': 16, 'ema2': 35, 'slip_atr_k': 0.010603692912003953, 'slip_spread_k': 0.5165327765862029, 'spread_hl_frac': 0.011467284651874372, 'bb_std_mult': 1.2700414597969663, 'rsi_os': 25, 'rsi_ob': 68, 'vol_spike': 0.19166610459619773, 'adx_thresh': 32.42729898286949, 'atr_min_pct': 0.0006205345566727893, 'atr_max_pct': 0.12001093313444362, 'tp_mult': 1.764913048303928, 'tsl_mult': 0.776840511511291, 'strategy': 'mean_reversion', 'time_stop': 138, 'use_sma': False, 'use_atr': False, 'use_adx': False, 'use_ema': False, 'use_spike': True, 'rsi_required': False, 'edge_k': 1.4639536510973101, 'edge_cap': 0.09509381969421643}.
[I 2025-08-30 04:58:04,716] Trial 455 finished with values: [-0.01599236198900922, 0.016173779935312042] and parameters: {'p_sma': 11, 'p_std': 49, 'p_atr': 10, 'p_adx': 26, 'rsi_period': 7, 'ema1': 14, 'ema2': 27, 'slip_atr_k': 0.0035932073201039158, 'slip_spread_k': 0.02918839020294134, 'spread_hl_frac': 0.026738069771187027, 'bb_std_mult': 3.3855942321858796, 'rsi_os': 22, 'rsi_ob': 66, 'vol_spike': 0.11389854341202738, 'adx_thresh': 31.80173131169876, 'atr_min_pct': 0.0014857644941161869, 'atr_max_pct': 0.02255293185995147, 'tp_mult': 2.5545010925425844, 'tsl_mult': 0.18241028051047217, 'strategy': 'breakout', 'time_stop': 195, 'use_sma': False, 'use_atr': True, 'use_adx': True, 'use_ema': True, 'use_spike': True, 'rsi_required': True, 'edge_k': 1.5129628525540233, 'edge_cap': 0.6558399071107708}.
[I 2025-08-30 04:58:04,709] Trial 453 finished with values: [-1000000000.0, 1000000000.0] and parameters: {'p_sma': 11, 'p_std': 49, 'p_atr': 27, 'p_adx': 26, 'rsi_period': 14, 'ema1': 16, 'ema2': 27, 'slip_atr_k': 0.012224344054391548, 'slip_spread_k': 0.729835437766376, 'spread_hl_frac': 0.009868037742903579, 'bb_std_mult': 0.6661935775660726, 'rsi_os': 50, 'rsi_ob': 68, 'vol_spike': 0.18890483306509734, 'adx_thresh': 32.18752704300636, 'atr_min_pct': 0.017830603378199607, 'atr_max_pct': 0.118360083394261, 'tp_mult': 1.8572413112225694, 'tsl_mult': 0.5299668208362244, 'strategy': 'breakout', 'time_stop': 197, 'use_sma': False, 'use_atr': False, 'use_adx': False, 'use_ema': True, 'use_spike': True, 'rsi_required': True, 'edge_k': 1.518827633007081, 'edge_cap': 0.6660543383297732}.
[I 2025-08-30 04:58:05,423] Trial 452 finished with values: [-1000000000.0, 1000000000.0] and parameters: {'p_sma': 11, 'p_std': 5, 'p_atr': 9, 'p_adx': 25, 'rsi_period': 21, 'ema1': 16, 'ema2': 27, 'slip_atr_k': 0.01078534441216148, 'slip_spread_k': 0.5127535689949415, 'spread_hl_frac': 0.01197412114830291, 'bb_std_mult': 1.972575977050039, 'rsi_os': 21, 'rsi_ob': 68, 'vol_spike': 0.19071104178089437, 'adx_thresh': 10.703287272853236, 'atr_min_pct': 0.017867740365096127, 'atr_max_pct': 0.0649861442885973, 'tp_mult': 1.8646448926432524, 'tsl_mult': 0.17904386629475932, 'strategy': 'mean_reversion', 'time_stop': 114, 'use_sma': False, 'use_atr': False, 'use_adx': False, 'use_ema': True, 'use_spike': True, 'rsi_required': False, 'edge_k': 0.918639259818163, 'edge_cap': 0.9035606577397284}.
[I 2025-08-30 04:58:06,045] Trial 454 finished with values: [-0.038986463855119835, 0.0389689634685765] and parameters: {'p_sma': 11, 'p_std': 48, 'p_atr': 20, 'p_adx': 8, 'rsi_period': 21, 'ema1': 16, 'ema2': 28, 'slip_atr_k': 0.009991219600423991, 'slip_spread_k': 0.8392516925303666, 'spread_hl_frac': 0.010019713128242146, 'bb_std_mult': 3.4009764711466586, 'rsi_os': 25, 'rsi_ob': 68, 'vol_spike': 0.24938698327197503, 'adx_thresh': 14.509485953886548, 'atr_min_pct': 0.0005850847758291229, 'atr_max_pct': 0.14701926077179045, 'tp_mult': 1.8539761324297992, 'tsl_mult': 0.769032919937283, 'strategy': 'breakout', 'time_stop': 195, 'use_sma': False, 'use_atr': False, 'use_adx': False, 'use_ema': True, 'use_spike': True, 'rsi_required': True, 'edge_k': 0.4089825172930285, 'edge_cap': 0.65085561467653}.
[I 2025-08-30 04:58:48,491] Trial 459 finished with values: [-1000000000.0, 1000000000.0] and parameters: {'p_sma': 20, 'p_std': 53, 'p_atr': 9, 'p_adx': 27, 'rsi_period': 64, 'ema1': 14, 'ema2': 28, 'slip_atr_k': 0.003482006433891599, 'slip_spread_k': 0.1799613919434912, 'spread_hl_frac': 0.03848185379479658, 'bb_std_mult': 3.495471963176697, 'rsi_os': 22, 'rsi_ob': 66, 'vol_spike': 0.18272718865497814, 'adx_thresh': 31.643880577163408, 'atr_min_pct': 0.0015418582286245842, 'atr_max_pct': 0.09540268834228034, 'tp_mult': 1.1163874264978095, 'tsl_mult': 0.10908207230325428, 'strategy': 'breakout', 'time_stop': 156, 'use_sma': True, 'use_atr': True, 'use_adx': True, 'use_ema': True, 'use_spike': False, 'rsi_required': False, 'edge_k': 1.531170726607819, 'edge_cap': 0.68581360979011}.
[I 2025-08-30 04:58:49,707] Trial 457 finished with values: [-1000000000.0, 1000000000.0] and parameters: {'p_sma': 20, 'p_std': 34, 'p_atr': 9, 'p_adx': 27, 'rsi_period': 64, 'ema1': 28, 'ema2': 28, 'slip_atr_k': 0.031117476240749065, 'slip_spread_k': 0.5846529540127033, 'spread_hl_frac': 0.026292898915074633, 'bb_std_mult': 3.373490890040106, 'rsi_os': 34, 'rsi_ob': 70, 'vol_spike': 0.18113415000369806, 'adx_thresh': 31.49346651226594, 'atr_min_pct': 1.3048129117920441e-05, 'atr_max_pct': 0.14775929355324502, 'tp_mult': 2.575395236867803, 'tsl_mult': 0.18465826958928533, 'strategy': 'breakout', 'time_stop': 203, 'use_sma': False, 'use_atr': True, 'use_adx': True, 'use_ema': True, 'use_spike': True, 'rsi_required': True, 'edge_k': 1.0373442716290844, 'edge_cap': 0.4496379832259032}.
[I 2025-08-30 04:58:49,973] Trial 456 finished with values: [-1000000000.0, 1000000000.0] and parameters: {'p_sma': 14, 'p_std': 34, 'p_atr': 9, 'p_adx': 27, 'rsi_period': 7, 'ema1': 28, 'ema2': 28, 'slip_atr_k': 0.0007819563057641409, 'slip_spread_k': 0.745502471610138, 'spread_hl_frac': 0.038017675346814245, 'bb_std_mult': 3.365480154026521, 'rsi_os': 34, 'rsi_ob': 66, 'vol_spike': 0.007636223905087447, 'adx_thresh': 31.581491492174536, 'atr_min_pct': 0.019806949923856863, 'atr_max_pct': 0.14782952854123468, 'tp_mult': 1.8413489475256055, 'tsl_mult': 0.2057252322826817, 'strategy': 'breakout', 'time_stop': 200, 'use_sma': False, 'use_atr': True, 'use_adx': True, 'use_ema': True, 'use_spike': True, 'rsi_required': True, 'edge_k': 0.14899367993747403, 'edge_cap': 0.448823188793829}.
