[I 2025-08-30 04:08:03,254] Trial 192 finished with values: [-1000000000.0, 1000000000.0] and parameters: {'p_sma': 21, 'p_std': 27, 'p_atr': 7, 'p_adx': 22, 'rsi_period': 53, 'ema1': 20, 'ema2': 30, 'slip_atr_k': 0.045427133538652714, 'slip_spread_k': 0.41989910355507143, 'spread_hl_frac': 0.04587424472205018, 'bb_std_mult': 3.0478097158343913, 'rsi_os': 43, 'rsi_ob': 61, 'vol_spike': 0.17817755553279432, 'adx_thresh': 16.995278955529518, 'atr_min_pct': 0.02858401821259486, 'atr_max_pct': 0.10667253780610382, 'tp_mult': 2.0527214651991605, 'tsl_mult': 0.4618700169083766, 'strategy': 'mean_reversion', 'time_stop': 186, 'use_sma': True, 'use_atr': True, 'use_adx': False, 'use_ema': False, 'use_spike': False, 'rsi_required': True, 'edge_k': 1.9189770522608116, 'edge_cap': 0.6608983782674074}.
[I 2025-08-30 04:08:05,504] Trial 191 finished with values: [-1000000000.0, 1000000000.0] and parameters: {'p_sma': 22, 'p_std': 28, 'p_atr': 18, 'p_adx': 28, 'rsi_period': 7, 'ema1': 20, 'ema2': 42, 'slip_atr_k': 0.07656633593230253, 'slip_spread_k': 0.4162958016808993, 'spread_hl_frac': 0.005703544954344584, 'bb_std_mult': 3.027953241251188, 'rsi_os': 11, 'rsi_ob': 62, 'vol_spike': 0.17016643491153957, 'adx_thresh': 34.78491638882908, 'atr_min_pct': 0.018822073695455483, 'atr_max_pct': 0.10611796791269754, 'tp_mult': 1.9724217116133522, 'tsl_mult': 0.9810581625227828, 'strategy': 'breakout', 'time_stop': 178, 'use_sma': True, 'use_atr': False, 'use_adx': False, 'use_ema': False, 'use_spike': True, 'rsi_required': True, 'edge_k': 1.685526980193889, 'edge_cap': 0.35066590686015886}.
[I 2025-08-30 04:08:06,301] Trial 190 finished with values: [-1000000000.0, 1000000000.0] and parameters: {'p_sma': 21, 'p_std': 28, 'p_atr': 29, 'p_adx': 28, 'rsi_period': 7, 'ema1': 5, 'ema2': 12, 'slip_atr_k': 0.031137071864761334, 'slip_spread_k': 0.4129603243980776, 'spread_hl_frac': 0.013990362428730769, 'bb_std_mult': 2.9302127684828596, 'rsi_os': 14, 'rsi_ob': 62, 'vol_spike': 0.17167604846137163, 'adx_thresh': 29.03628667449418, 'atr_min_pct': 0.028797817472838747, 'atr_max_pct': 0.11361358154747357, 'tp_mult': 1.9615494270919804, 'tsl_mult': 0.17917743070999104, 'strategy': 'breakout', 'time_stop': 142, 'use_sma': True, 'use_atr': False, 'use_adx': False, 'use_ema': False, 'use_spike': True, 'rsi_required': True, 'edge_k': 1.010108621210164, 'edge_cap': 0.3616959514452752}.
[I 2025-08-30 04:08:06,912] Trial 195 finished with values: [-1000000000.0, 1000000000.0] and parameters: {'p_sma': 45, 'p_std': 19, 'p_atr': 30, 'p_adx': 29, 'rsi_period': 74, 'ema1': 5, 'ema2': 50, 'slip_atr_k': 0.21822678357650596, 'slip_spread_k': 0.8846195711185503, 'spread_hl_frac': 0.02660283530609129, 'bb_std_mult': 2.980517341158744, 'rsi_os': 44, 'rsi_ob': 49, 'vol_spike': 0.1597375327146258, 'adx_thresh': 12.690050540468349, 'atr_min_pct': 0.0007496439381530669, 'atr_max_pct': 0.1113741900476191, 'tp_mult': 2.8199682277117675, 'tsl_mult': 0.07075176660243238, 'strategy': 'mean_reversion', 'time_stop': 29, 'use_sma': True, 'use_atr': True, 'use_adx': True, 'use_ema': False, 'use_spike': False, 'rsi_required': True, 'edge_k': 0.07171361645521035, 'edge_cap': 0.45570985104079476}.
[I 2025-08-30 04:08:07,373] Trial 189 finished with values: [-0.07270003991215435, 0.07268867621664664] and parameters: {'p_sma': 22, 'p_std': 29, 'p_atr': 29, 'p_adx': 23, 'rsi_period': 32, 'ema1': 5, 'ema2': 22, 'slip_atr_k': 0.04496323828094369, 'slip_spread_k': 0.28307555234918325, 'spread_hl_frac': 0.00581022684397247, 'bb_std_mult': 1.1510972376220814, 'rsi_os': 45, 'rsi_ob': 66, 'vol_spike': 0.15958407419443113, 'adx_thresh': 18.413698825760907, 'atr_min_pct': 0.001641158740508168, 'atr_max_pct': 0.11391913136786538, 'tp_mult': 1.9601363675190115, 'tsl_mult': 0.4829879196414338, 'strategy': 'breakout', 'time_stop': 158, 'use_sma': True, 'use_atr': False, 'use_adx': False, 'use_ema': True, 'use_spike': True, 'rsi_required': True, 'edge_k': 1.9253130141543988, 'edge_cap': 0.9649853300310889}.
[I 2025-08-30 04:08:47,775] Trial 194 finished with values: [-1000000000.0, 1000000000.0] and parameters: {'p_sma': 25, 'p_std': 21, 'p_atr': 30, 'p_adx': 29, 'rsi_period': 77, 'ema1': 5, 'ema2': 23, 'slip_atr_k': 0.031308518152935005, 'slip_spread_k': 0.25633694206510615, 'spread_hl_frac': 0.04659753472714415, 'bb_std_mult': 1.1493393031413865, 'rsi_os': 15, 'rsi_ob': 83, 'vol_spike': 0.25212889498372093, 'adx_thresh': 29.61114530014937, 'atr_min_pct': 0.0005690190227982202, 'atr_max_pct': 0.04849134010813731, 'tp_mult': 2.977468018227731, 'tsl_mult': 0.3476457232288564, 'strategy': 'mean_reversion', 'time_stop': 142, 'use_sma': True, 'use_atr': True, 'use_adx': True, 'use_ema': False, 'use_spike': False, 'rsi_required': True, 'edge_k': 1.8783446954414695, 'edge_cap': 0.7080468987771122}.
[I 2025-08-30 04:08:48,226] Trial 193 finished with values: [-1000000000.0, 1000000000.0] and parameters: {'p_sma': 22, 'p_std': 59, 'p_atr': 30, 'p_adx': 28, 'rsi_period': 10, 'ema1': 23, 'ema2': 36, 'slip_atr_k': 0.14702241283318163, 'slip_spread_k': 0.8864323395159579, 'spread_hl_frac': 0.04021835677396503, 'bb_std_mult': 2.9372735273497916, 'rsi_os': 11, 'rsi_ob': 84, 'vol_spike': 0.16049392073660582, 'adx_thresh': 14.54703218047782, 'atr_min_pct': 0.016055173181497892, 'atr_max_pct': 0.11254348392112325, 'tp_mult': 1.9729704883679386, 'tsl_mult': 0.3419526117149449, 'strategy': 'mean_reversion', 'time_stop': 125, 'use_sma': True, 'use_atr': True, 'use_adx': True, 'use_ema': False, 'use_spike': False, 'rsi_required': True, 'edge_k': 0.06082120934547741, 'edge_cap': 0.3690842656190978}.
[I 2025-08-30 04:08:50,901] Trial 196 finished with values: [-0.08234801233268241, 0.08228018956771048] and parameters: {'p_sma': 25, 'p_std': 51, 'p_atr': 30, 'p_adx': 29, 'rsi_period': 23, 'ema1': 10, 'ema2': 34, 'slip_atr_k': 0.20965402557634638, 'slip_spread_k': 0.7381337859384625, 'spread_hl_frac': 0.03983139929740501, 'bb_std_mult': 3.252277003199926, 'rsi_os': 44, 'rsi_ob': 60, 'vol_spike': 0.1689993359593395, 'adx_thresh': 29.683204346953392, 'atr_min_pct': 0.0006044166724303671, 'atr_max_pct': 0.08610437708561332, 'tp_mult': 2.6588117195173515, 'tsl_mult': 0.5545610272538284, 'strategy': 'mean_reversion', 'time_stop': 119, 'use_sma': True, 'use_atr': True, 'use_adx': True, 'use_ema': False, 'use_spike': False, 'rsi_required': True, 'edge_k': 1.864568941284057, 'edge_cap': 0.697475774667477}.
[I 2025-08-30 04:08:51,487] Trial 197 finished with values: [-1000000000.0, 1000000000.0] and parameters: {'p_sma': 24, 'p_std': 58, 'p_atr': 30, 'p_adx': 13, 'rsi_period': 76, 'ema1': 28, 'ema2': 37, 'slip_atr_k': 0.2123722903157064, 'slip_spread_k': 0.2448842200050413, 'spread_hl_frac': 0.01161320894053685, 'bb_std_mult': 2.922327901751205, 'rsi_os': 27, 'rsi_ob': 93, 'vol_spike': 0.27960736741705183, 'adx_thresh': 11.6477809154937, 'atr_min_pct': 0.0005257636045465588, 'atr_max_pct': 0.06764597588964866, 'tp_mult': 2.6420953749631275, 'tsl_mult': 0.5576222667674702, 'strategy': 'mean_reversion', 'time_stop': 21, 'use_sma': True, 'use_atr': True, 'use_adx': True, 'use_ema': False, 'use_spike': False, 'rsi_required': True, 'edge_k': 1.88299966393088, 'edge_cap': 0.695102386634685}.
[I 2025-08-30 04:08:51,710] Trial 201 finished with values: [-1000000000.0, 1000000000.0] and parameters: {'p_sma': 7, 'p_std': 22, 'p_atr': 8, 'p_adx': 15, 'rsi_period': 73, 'ema1': 6, 'ema2': 10, 'slip_atr_k': 0.02424609287211575, 'slip_spread_k': 0.7070179603396278, 'spread_hl_frac': 0.04287593553572296, 'bb_std_mult': 2.761781645322822, 'rsi_os': 51, 'rsi_ob': 59, 'vol_spike': 0.06077514020639911, 'adx_thresh': 28.32733961253676, 'atr_min_pct': 0.012868319859703301, 'atr_max_pct': 0.1450155913369252, 'tp_mult': 1.8946639876600324, 'tsl_mult': 0.3755629725886296, 'strategy': 'mean_reversion', 'time_stop': 271, 'use_sma': False, 'use_atr': True, 'use_adx': True, 'use_ema': False, 'use_spike': False, 'rsi_required': False, 'edge_k': 1.9526280316756972, 'edge_cap': 0.7306696546154197}.
[I 2025-08-30 04:09:30,192] Trial 198 finished with values: [-1000000000.0, 1000000000.0] and parameters: {'p_sma': 14, 'p_std': 26, 'p_atr': 8, 'p_adx': 13, 'rsi_period': 23, 'ema1': 6, 'ema2': 34, 'slip_atr_k': 0.21133736496003233, 'slip_spread_k': 0.7330821627649914, 'spread_hl_frac': 0.00724696595831905, 'bb_std_mult': 2.763569091975195, 'rsi_os': 46, 'rsi_ob': 94, 'vol_spike': 0.030855848726310586, 'adx_thresh': 16.035526706945568, 'atr_min_pct': 0.01247293522362386, 'atr_max_pct': 0.037958083856330996, 'tp_mult': 1.435165313858817, 'tsl_mult': 0.5571498490878153, 'strategy': 'mean_reversion', 'time_stop': 216, 'use_sma': True, 'use_atr': True, 'use_adx': True, 'use_ema': False, 'use_spike': False, 'rsi_required': True, 'edge_k': 1.109718425883797, 'edge_cap': 0.6869981951099566}.
[I 2025-08-30 04:09:31,184] Trial 199 finished with values: [-0.01849120065097265, 0.018428359597722772] and parameters: {'p_sma': 7, 'p_std': 51, 'p_atr': 8, 'p_adx': 25, 'rsi_period': 22, 'ema1': 14, 'ema2': 10, 'slip_atr_k': 0.02162612844641873, 'slip_spread_k': 0.7149543955531327, 'spread_hl_frac': 0.012548754732823707, 'bb_std_mult': 3.276936252284128, 'rsi_os': 26, 'rsi_ob': 64, 'vol_spike': 0.17488108668337615, 'adx_thresh': 30.339697579116113, 'atr_min_pct': 0.00039862669860556415, 'atr_max_pct': 0.14604469518312202, 'tp_mult': 1.9122942770685454, 'tsl_mult': 0.2302740400218199, 'strategy': 'mean_reversion', 'time_stop': 221, 'use_sma': True, 'use_atr': True, 'use_adx': True, 'use_ema': False, 'use_spike': False, 'rsi_required': True, 'edge_k': 1.5065607317491692, 'edge_cap': 0.6830227558557965}.
[I 2025-08-30 04:09:32,729] Trial 203 finished with values: [-1000000000.0, 1000000000.0] and parameters: {'p_sma': 27, 'p_std': 23, 'p_atr': 29, 'p_adx': 10, 'rsi_period': 75, 'ema1': 11, 'ema2': 11, 'slip_atr_k': 0.19562418631983552, 'slip_spread_k': 0.9594676195604656, 'spread_hl_frac': 0.020899164805068635, 'bb_std_mult': 1.6880734097030987, 'rsi_os': 54, 'rsi_ob': 64, 'vol_spike': 0.286905325076117, 'adx_thresh': 30.13340520393117, 'atr_min_pct': 0.007301356090636447, 'atr_max_pct': 0.08119270213695275, 'tp_mult': 1.853312186986701, 'tsl_mult': 0.8607266709602657, 'strategy': 'mean_reversion', 'time_stop': 300, 'use_sma': True, 'use_atr': True, 'use_adx': True, 'use_ema': False, 'use_spike': False, 'rsi_required': True, 'edge_k': 1.5263402759817724, 'edge_cap': 0.6712628413416881}.
[I 2025-08-30 04:09:33,291] Trial 200 finished with values: [-1000000000.0, 1000000000.0] and parameters: {'p_sma': 8, 'p_std': 26, 'p_atr': 8, 'p_adx': 13, 'rsi_period': 75, 'ema1': 6, 'ema2': 10, 'slip_atr_k': 0.020698377034267273, 'slip_spread_k': 0.6393023548955243, 'spread_hl_frac': 0.01184218466421466, 'bb_std_mult': 2.899626508271919, 'rsi_os': 46, 'rsi_ob': 94, 'vol_spike': 0.056269214010020455, 'adx_thresh': 15.806289953851833, 'atr_min_pct': 0.0027962316357490746, 'atr_max_pct': 0.08080711739419388, 'tp_mult': 2.5912942283632163, 'tsl_mult': 0.5275387419092162, 'strategy': 'mean_reversion', 'time_stop': 268, 'use_sma': False, 'use_atr': True, 'use_adx': True, 'use_ema': False, 'use_spike': False, 'rsi_required': False, 'edge_k': 1.9991475670967032, 'edge_cap': 0.6852812816598508}.
[I 2025-08-30 04:09:33,663] Trial 202 finished with values: [-1000000000.0, 1000000000.0] and parameters: {'p_sma': 13, 'p_std': 26, 'p_atr': 20, 'p_adx': 30, 'rsi_period': 75, 'ema1': 6, 'ema2': 32, 'slip_atr_k': 0.1907737493560833, 'slip_spread_k': 0.6521493432330435, 'spread_hl_frac': 0.042023728231571605, 'bb_std_mult': 1.9884063452210354, 'rsi_os': 42, 'rsi_ob': 64, 'vol_spike': 0.009513335224920427, 'adx_thresh': 30.55121991224903, 'atr_min_pct': 0.0011372585296169449, 'atr_max_pct': 0.13914109129298075, 'tp_mult': 1.836061173694374, 'tsl_mult': 0.870251321940381, 'strategy': 'mean_reversion', 'time_stop': 215, 'use_sma': True, 'use_atr': True, 'use_adx': True, 'use_ema': False, 'use_spike': False, 'rsi_required': True, 'edge_k': 0.9080305296080762, 'edge_cap': 0.31448777853093923}.
[I 2025-08-30 04:10:15,516] Trial 204 finished with values: [-0.03009384318706032, 0.030031401620505747] and parameters: {'p_sma': 11, 'p_std': 51, 'p_atr': 12, 'p_adx': 25, 'rsi_period': 21, 'ema1': 11, 'ema2': 11, 'slip_atr_k': 0.07180910246697392, 'slip_spread_k': 0.7528577793628147, 'spread_hl_frac': 0.012754988846202261, 'bb_std_mult': 3.293071939371825, 'rsi_os': 25, 'rsi_ob': 64, 'vol_spike': 0.18326910088923296, 'adx_thresh': 32.54110676977456, 'atr_min_pct': 0.0001968625864424692, 'atr_max_pct': 0.148707089077714, 'tp_mult': 1.8445665825000415, 'tsl_mult': 0.22550859143388582, 'strategy': 'mean_reversion', 'time_stop': 209, 'use_sma': True, 'use_atr': True, 'use_adx': True, 'use_ema': False, 'use_spike': False, 'rsi_required': True, 'edge_k': 1.4016477343340572, 'edge_cap': 0.6447451279819452}.
[I 2025-08-30 04:10:16,967] Trial 205 finished with values: [-0.022027235211664498, 0.02203583187323058] and parameters: {'p_sma': 11, 'p_std': 48, 'p_atr': 12, 'p_adx': 25, 'rsi_period': 28, 'ema1': 14, 'ema2': 10, 'slip_atr_k': 0.005831785969266184, 'slip_spread_k': 0.7432406947098336, 'spread_hl_frac': 0.012947741090931868, 'bb_std_mult': 3.2901431405735644, 'rsi_os': 26, 'rsi_ob': 66, 'vol_spike': 0.18037513684094048, 'adx_thresh': 30.899440552380312, 'atr_min_pct': 0.00010410012406798937, 'atr_max_pct': 0.13866183484988698, 'tp_mult': 1.8023764693193949, 'tsl_mult': 0.29173340342196435, 'strategy': 'mean_reversion', 'time_stop': 255, 'use_sma': True, 'use_atr': True, 'use_adx': True, 'use_ema': False, 'use_spike': False, 'rsi_required': False, 'edge_k': 1.489477617087976, 'edge_cap': 0.6612048083481947}.
[I 2025-08-30 04:10:17,407] Trial 206 finished with values: [-1000000000.0, 1000000000.0] and parameters: {'p_sma': 12, 'p_std': 49, 'p_atr': 10, 'p_adx': 25, 'rsi_period': 34, 'ema1': 19, 'ema2': 12, 'slip_atr_k': 0.062444681857559775, 'slip_spread_k': 0.761970609608501, 'spread_hl_frac': 0.015114723273094047, 'bb_std_mult': 3.29477674526149, 'rsi_os': 26, 'rsi_ob': 65, 'vol_spike': 0.180003990317911, 'adx_thresh': 32.533719268423575, 'atr_min_pct': 0.0005739587229704338, 'atr_max_pct': 0.1496804253018782, 'tp_mult': 1.7993593646237214, 'tsl_mult': 0.3029041362438285, 'strategy': 'mean_reversion', 'time_stop': 225, 'use_sma': True, 'use_atr': True, 'use_adx': True, 'use_ema': True, 'use_spike': False, 'rsi_required': True, 'edge_k': 1.3550453057859722, 'edge_cap': 0.6444100077091247}.
[I 2025-08-30 04:10:17,683] Trial 207 finished with values: [-1000000000.0, 1000000000.0] and parameters: {'p_sma': 10, 'p_std': 52, 'p_atr': 10, 'p_adx': 20, 'rsi_period': 29, 'ema1': 14, 'ema2': 12, 'slip_atr_k': 0.008015712297988161, 'slip_spread_k': 0.7545431973776839, 'spread_hl_frac': 0.012934462066808499, 'bb_std_mult': 3.303182605354131, 'rsi_os': 26, 'rsi_ob': 66, 'vol_spike': 0.1835206032662551, 'adx_thresh': 31.46553682073386, 'atr_min_pct': 0.0002365637348753909, 'atr_max_pct': 0.1485978058426808, 'tp_mult': 1.780870710606556, 'tsl_mult': 0.2953167211484486, 'strategy': 'mean_reversion', 'time_stop': 258, 'use_sma': True, 'use_atr': True, 'use_adx': True, 'use_ema': True, 'use_spike': False, 'rsi_required': True, 'edge_k': 1.419234970170948, 'edge_cap': 0.6521859030286263}.
[I 2025-08-30 04:11:00,874] Trial 211 finished with values: [-1000000000.0, 1000000000.0] and parameters: {'p_sma': 7, 'p_std': 51, 'p_atr': 7, 'p_adx': 25, 'rsi_period': 21, 'ema1': 14, 'ema2': 55, 'slip_atr_k': 0.07274334334715497, 'slip_spread_k': 0.8291950947882365, 'spread_hl_frac': 0.016462200438704947, 'bb_std_mult': 3.4289785101265164, 'rsi_os': 24, 'rsi_ob': 68, 'vol_spike': 0.17705630480457432, 'adx_thresh': 30.948859294497204, 'atr_min_pct': 3.0144668943259958e-05, 'atr_max_pct': 0.14479893627110044, 'tp_mult': 1.8536954315490728, 'tsl_mult': 0.22371432108765088, 'strategy': 'breakout', 'time_stop': 205, 'use_sma': False, 'use_atr': False, 'use_adx': False, 'use_ema': False, 'use_spike': True, 'rsi_required': False, 'edge_k': 1.5080489906683514, 'edge_cap': 0.6368627605278566}.
[I 2025-08-30 04:11:02,011] Trial 210 finished with values: [-0.012960209279669344, 0.012911491252825816] and parameters: {'p_sma': 9, 'p_std': 52, 'p_atr': 9, 'p_adx': 25, 'rsi_period': 20, 'ema1': 15, 'ema2': 28, 'slip_atr_k': 0.004668686981182932, 'slip_spread_k': 0.7530972160232378, 'spread_hl_frac': 0.010772641573241176, 'bb_std_mult': 3.42339757048663, 'rsi_os': 24, 'rsi_ob': 66, 'vol_spike': 0.18402172009194825, 'adx_thresh': 31.57746554173052, 'atr_min_pct': 4.1478807784871936e-05, 'atr_max_pct': 0.14635097695299976, 'tp_mult': 1.8480457978840226, 'tsl_mult': 0.22488218809463392, 'strategy': 'breakout', 'time_stop': 208, 'use_sma': False, 'use_atr': False, 'use_adx': False, 'use_ema': True, 'use_spike': True, 'rsi_required': False, 'edge_k': 1.49592660094047, 'edge_cap': 0.6476979894831889}.
[I 2025-08-30 04:11:02,728] Trial 209 finished with values: [-1000000000.0, 1000000000.0] and parameters: {'p_sma': 10, 'p_std': 49, 'p_atr': 9, 'p_adx': 25, 'rsi_period': 27, 'ema1': 14, 'ema2': 53, 'slip_atr_k': 0.014710354708925408, 'slip_spread_k': 0.7647637008437247, 'spread_hl_frac': 0.013059988382335689, 'bb_std_mult': 3.295847726763053, 'rsi_os': 26, 'rsi_ob': 66, 'vol_spike': 0.17965824922915652, 'adx_thresh': 32.412569698508534, 'atr_min_pct': 2.5425431271061108e-05, 'atr_max_pct': 0.14973411591901342, 'tp_mult': 1.8456959573940126, 'tsl_mult': 0.2244163711525584, 'strategy': 'breakout', 'time_stop': 257, 'use_sma': False, 'use_atr': False, 'use_adx': True, 'use_ema': True, 'use_spike': True, 'rsi_required': False, 'edge_k': 1.4146384079529415, 'edge_cap': 0.6474984346639151}.
[I 2025-08-30 04:11:03,051] Trial 208 finished with values: [-1000000000.0, 1000000000.0] and parameters: {'p_sma': 10, 'p_std': 49, 'p_atr': 9, 'p_adx': 25, 'rsi_period': 28, 'ema1': 14, 'ema2': 10, 'slip_atr_k': 0.004935728054960703, 'slip_spread_k': 0.760732950753151, 'spread_hl_frac': 0.012781839025477295, 'bb_std_mult': 3.3078824428821303, 'rsi_os': 26, 'rsi_ob': 66, 'vol_spike': 0.18368758804633367, 'adx_thresh': 31.608392277936687, 'atr_min_pct': 0.00023482094250220395, 'atr_max_pct': 0.14834505590805963, 'tp_mult': 1.9048872401014667, 'tsl_mult': 0.31035167376036943, 'strategy': 'breakout', 'time_stop': 223, 'use_sma': True, 'use_atr': False, 'use_adx': True, 'use_ema': True, 'use_spike': True, 'rsi_required': True, 'edge_k': 1.502550546855963, 'edge_cap': 0.6426326612990181}.
[I 2025-08-30 04:11:51,265] Trial 212 finished with values: [-1000000000.0, 1000000000.0] and parameters: {'p_sma': 5, 'p_std': 48, 'p_atr': 11, 'p_adx': 25, 'rsi_period': 27, 'ema1': 15, 'ema2': 10, 'slip_atr_k': 0.015123661305943234, 'slip_spread_k': 0.7524064143956775, 'spread_hl_frac': 0.010636704107861694, 'bb_std_mult': 3.2503766376928658, 'rsi_os': 28, 'rsi_ob': 80, 'vol_spike': 0.1842274182465069, 'adx_thresh': 30.530309170555803, 'atr_min_pct': 0.0001510980316369896, 'atr_max_pct': 0.13992749549411945, 'tp_mult': 1.8995631481338844, 'tsl_mult': 0.24435377225632932, 'strategy': 'breakout', 'time_stop': 232, 'use_sma': True, 'use_atr': False, 'use_adx': True, 'use_ema': False, 'use_spike': True, 'rsi_required': True, 'edge_k': 1.4615718791942405, 'edge_cap': 0.8945169229810345}.
[I 2025-08-30 04:11:51,289] Trial 215 finished with values: [-1000000000.0, 1000000000.0] and parameters: {'p_sma': 8, 'p_std': 54, 'p_atr': 12, 'p_adx': 24, 'rsi_period': 19, 'ema1': 15, 'ema2': 29, 'slip_atr_k': 0.0036584988870454927, 'slip_spread_k': 0.8056884713212645, 'spread_hl_frac': 0.010639566299360114, 'bb_std_mult': 3.4994536872678825, 'rsi_os': 23, 'rsi_ob': 68, 'vol_spike': 0.1880680523748683, 'adx_thresh': 33.153895013602984, 'atr_min_pct': 0.029963869345491376, 'atr_max_pct': 0.13988625162940033, 'tp_mult': 1.740163406894202, 'tsl_mult': 0.18803175749034806, 'strategy': 'breakout', 'time_stop': 190, 'use_sma': False, 'use_atr': False, 'use_adx': False, 'use_ema': True, 'use_spike': True, 'rsi_required': False, 'edge_k': 1.4634051185247152, 'edge_cap': 0.6223322415702066}.
[I 2025-08-30 04:11:52,669] Trial 214 finished with values: [-1000000000.0, 1000000000.0] and parameters: {'p_sma': 9, 'p_std': 54, 'p_atr': 12, 'p_adx': 25, 'rsi_period': 19, 'ema1': 15, 'ema2': 31, 'slip_atr_k': 0.003999228451204262, 'slip_spread_k': 0.805634420149433, 'spread_hl_frac': 0.010549135168063021, 'bb_std_mult': 3.520782123802933, 'rsi_os': 23, 'rsi_ob': 68, 'vol_spike': 0.18781267513811517, 'adx_thresh': 33.215601170164774, 'atr_min_pct': 7.82107608603963e-05, 'atr_max_pct': 0.14560121033266568, 'tp_mult': 1.7730378758664025, 'tsl_mult': 0.1977507388811332, 'strategy': 'breakout', 'time_stop': 189, 'use_sma': False, 'use_atr': False, 'use_adx': False, 'use_ema': True, 'use_spike': True, 'rsi_required': False, 'edge_k': 1.482307549969065, 'edge_cap': 0.621983562343802}.
[I 2025-08-30 04:11:53,561] Trial 213 finished with values: [-1000000000.0, 1000000000.0] and parameters: {'p_sma': 10, 'p_std': 54, 'p_atr': 9, 'p_adx': 25, 'rsi_period': 19, 'ema1': 15, 'ema2': 28, 'slip_atr_k': 0.004467314717332964, 'slip_spread_k': 0.8104019404033047, 'spread_hl_frac': 0.01066681795646855, 'bb_std_mult': 3.5457362071311014, 'rsi_os': 23, 'rsi_ob': 68, 'vol_spike': 0.18784840254645424, 'adx_thresh': 33.08894365015941, 'atr_min_pct': 7.10161990866659e-05, 'atr_max_pct': 0.1458610152537694, 'tp_mult': 1.7405295990457748, 'tsl_mult': 0.23537428666521518, 'strategy': 'breakout', 'time_stop': 192, 'use_sma': False, 'use_atr': False, 'use_adx': False, 'use_ema': True, 'use_spike': True, 'rsi_required': False, 'edge_k': 1.4957166253048098, 'edge_cap': 0.6223272141045227}.
