[I 2025-08-30 03:43:12,030] Trial 53 finished with values: [-1000000000.0, 1000000000.0] and parameters: {'p_sma': 9, 'p_std': 56, 'p_atr': 15, 'p_adx': 29, 'rsi_period': 18, 'ema1': 25, 'ema2': 30, 'slip_atr_k': 0.040798470563086886, 'slip_spread_k': 0.6705337049985036, 'spread_hl_frac': 0.008038715715997957, 'bb_std_mult': 1.0912244256500148, 'rsi_os': 38, 'rsi_ob': 53, 'vol_spike': 0.03813740864126951, 'adx_thresh': 7.329140184292573, 'atr_min_pct': 0.0023745386823960345, 'atr_max_pct': 0.03576934490008655, 'tp_mult': 2.63971697172303, 'tsl_mult': 0.2912287840007567, 'strategy': 'mean_reversion', 'time_stop': 100, 'use_sma': False, 'use_atr': True, 'use_adx': False, 'use_ema': True, 'use_spike': False, 'rsi_required': False, 'edge_k': 1.9911506994771828, 'edge_cap': 0.5866744385937509}.
[I 2025-08-30 03:43:12,382] Trial 57 finished with values: [-1000000000.0, 1000000000.0] and parameters: {'p_sma': 18, 'p_std': 28, 'p_atr': 29, 'p_adx': 24, 'rsi_period': 67, 'ema1': 15, 'ema2': 43, 'slip_atr_k': 0.19172239331440533, 'slip_spread_k': 0.1187685666913445, 'spread_hl_frac': 0.02912232333058548, 'bb_std_mult': 0.7048422010023481, 'rsi_os': 50, 'rsi_ob': 61, 'vol_spike': 0.03506725230165189, 'adx_thresh': 19.108691008843095, 'atr_min_pct': 0.022269937275505684, 'atr_max_pct': 0.14250831469743724, 'tp_mult': 2.3132157414594396, 'tsl_mult': 0.16373733413931396, 'strategy': 'mean_reversion', 'time_stop': 94, 'use_sma': False, 'use_atr': False, 'use_adx': False, 'use_ema': False, 'use_spike': True, 'rsi_required': False, 'edge_k': 1.5188409904736317, 'edge_cap': 0.2657788797424016}.
[I 2025-08-30 03:43:13,733] Trial 52 finished with values: [-1000000000.0, 1000000000.0] and parameters: {'p_sma': 9, 'p_std': 47, 'p_atr': 15, 'p_adx': 17, 'rsi_period': 65, 'ema1': 15, 'ema2': 54, 'slip_atr_k': 0.07768935067928237, 'slip_spread_k': 0.6944693588888596, 'spread_hl_frac': 0.005438813448318376, 'bb_std_mult': 1.9248700225997195, 'rsi_os': 39, 'rsi_ob': 52, 'vol_spike': 0.08687485545134196, 'adx_thresh': 14.329914274586944, 'atr_min_pct': 0.0035816311311046636, 'atr_max_pct': 0.1478285167587738, 'tp_mult': 1.572512787938775, 'tsl_mult': 0.3133066363454615, 'strategy': 'mean_reversion', 'time_stop': 136, 'use_sma': False, 'use_atr': True, 'use_adx': False, 'use_ema': True, 'use_spike': False, 'rsi_required': False, 'edge_k': 1.544237919108542, 'edge_cap': 0.3229105321886617}.
[I 2025-08-30 03:43:13,813] Trial 60 finished with values: [-1000000000.0, 1000000000.0] and parameters: {'p_sma': 40, 'p_std': 35, 'p_atr': 24, 'p_adx': 29, 'rsi_period': 11, 'ema1': 22, 'ema2': 51, 'slip_atr_k': 0.09851364939051159, 'slip_spread_k': 0.26480645964856503, 'spread_hl_frac': 0.046328975848353326, 'bb_std_mult': 2.523662768173015, 'rsi_os': 30, 'rsi_ob': 91, 'vol_spike': 0.07029693736703722, 'adx_thresh': 11.096518832755029, 'atr_min_pct': 0.019400720471071897, 'atr_max_pct': 0.0193175466136825, 'tp_mult': 1.7469557749425715, 'tsl_mult': 0.9505076285098675, 'strategy': 'breakout', 'time_stop': 224, 'use_sma': True, 'use_atr': False, 'use_adx': True, 'use_ema': False, 'use_spike': True, 'rsi_required': True, 'edge_k': 0.12011584936681685, 'edge_cap': 0.0905990443535668}.
[I 2025-08-30 03:43:55,761] Trial 56 finished with values: [-1000000000.0, 1000000000.0] and parameters: {'p_sma': 17, 'p_std': 35, 'p_atr': 29, 'p_adx': 29, 'rsi_period': 60, 'ema1': 24, 'ema2': 57, 'slip_atr_k': 0.2265016732175491, 'slip_spread_k': 0.12503231927574127, 'spread_hl_frac': 0.02910023438282363, 'bb_std_mult': 2.146406685220711, 'rsi_os': 19, 'rsi_ob': 77, 'vol_spike': 0.09732195340009761, 'adx_thresh': 10.674081201296062, 'atr_min_pct': 0.028043755717064484, 'atr_max_pct': 0.1418308165402673, 'tp_mult': 2.6204760322951968, 'tsl_mult': 0.9342269960765162, 'strategy': 'breakout', 'time_stop': 96, 'use_sma': False, 'use_atr': False, 'use_adx': True, 'use_ema': False, 'use_spike': False, 'rsi_required': False, 'edge_k': 1.5283290816417785, 'edge_cap': 0.26278802379692007}.
[I 2025-08-30 03:43:57,389] Trial 59 finished with values: [-1000000000.0, 1000000000.0] and parameters: {'p_sma': 40, 'p_std': 50, 'p_atr': 24, 'p_adx': 13, 'rsi_period': 28, 'ema1': 28, 'ema2': 34, 'slip_atr_k': 0.10065405421868939, 'slip_spread_k': 0.01582211865238714, 'spread_hl_frac': 0.02880785615235624, 'bb_std_mult': 2.6795228518179095, 'rsi_os': 30, 'rsi_ob': 92, 'vol_spike': 0.201788644698987, 'adx_thresh': 30.69957310482909, 'atr_min_pct': 0.003976843725208059, 'atr_max_pct': 0.01923842019452999, 'tp_mult': 2.6757860953736383, 'tsl_mult': 0.9409589435682362, 'strategy': 'breakout', 'time_stop': 227, 'use_sma': True, 'use_atr': False, 'use_adx': True, 'use_ema': False, 'use_spike': True, 'rsi_required': False, 'edge_k': 0.1062398788186063, 'edge_cap': 0.19888240265006452}.
[I 2025-08-30 03:43:58,080] Trial 58 finished with values: [-1000000000.0, 1000000000.0] and parameters: {'p_sma': 56, 'p_std': 27, 'p_atr': 28, 'p_adx': 24, 'rsi_period': 12, 'ema1': 22, 'ema2': 54, 'slip_atr_k': 0.10051038029862149, 'slip_spread_k': 0.11879699141651168, 'spread_hl_frac': 0.04637839021230114, 'bb_std_mult': 2.523269370765079, 'rsi_os': 32, 'rsi_ob': 92, 'vol_spike': 0.19960827345744242, 'adx_thresh': 11.000924117120402, 'atr_min_pct': 0.009574553204466848, 'atr_max_pct': 0.043378425065297765, 'tp_mult': 1.7225668990739513, 'tsl_mult': 0.8397968790094311, 'strategy': 'breakout', 'time_stop': 224, 'use_sma': True, 'use_atr': False, 'use_adx': True, 'use_ema': False, 'use_spike': True, 'rsi_required': False, 'edge_k': 0.10138661801629179, 'edge_cap': 0.23385409305982824}.
[I 2025-08-30 03:43:59,141] Trial 61 finished with values: [-1000000000.0, 1000000000.0] and parameters: {'p_sma': 49, 'p_std': 49, 'p_atr': 9, 'p_adx': 13, 'rsi_period': 27, 'ema1': 19, 'ema2': 33, 'slip_atr_k': 0.17916685987547026, 'slip_spread_k': 0.3155830902157046, 'spread_hl_frac': 0.02830685595260667, 'bb_std_mult': 2.705685883291388, 'rsi_os': 7, 'rsi_ob': 77, 'vol_spike': 0.29210281800582516, 'adx_thresh': 22.2745797047664, 'atr_min_pct': 0.009928927199219586, 'atr_max_pct': 0.041431603522105696, 'tp_mult': 1.653757999303078, 'tsl_mult': 0.1965052350290994, 'strategy': 'breakout', 'time_stop': 56, 'use_sma': True, 'use_atr': False, 'use_adx': True, 'use_ema': False, 'use_spike': True, 'rsi_required': False, 'edge_k': 1.3245013934016496, 'edge_cap': 0.21116326301701216}.
[I 2025-08-30 03:44:45,573] Trial 64 finished with values: [-1000000000.0, 1000000000.0] and parameters: {'p_sma': 49, 'p_std': 50, 'p_atr': 10, 'p_adx': 10, 'rsi_period': 22, 'ema1': 19, 'ema2': 42, 'slip_atr_k': 0.1778060218595419, 'slip_spread_k': 0.8205228896975483, 'spread_hl_frac': 0.02003030583189918, 'bb_std_mult': 1.3752030864951297, 'rsi_os': 36, 'rsi_ob': 87, 'vol_spike': 0.29974075428248464, 'adx_thresh': 22.870609895041085, 'atr_min_pct': 0.025664197718059466, 'atr_max_pct': 0.055597869481389874, 'tp_mult': 2.123679760060431, 'tsl_mult': 0.0586962475477647, 'strategy': 'mean_reversion', 'time_stop': 60, 'use_sma': True, 'use_atr': True, 'use_adx': False, 'use_ema': True, 'use_spike': False, 'rsi_required': True, 'edge_k': 1.3708056756839846, 'edge_cap': 0.12039258972486144}.
[I 2025-08-30 03:44:47,098] Trial 63 finished with values: [-1000000000.0, 1000000000.0] and parameters: {'p_sma': 57, 'p_std': 44, 'p_atr': 8, 'p_adx': 26, 'rsi_period': 44, 'ema1': 6, 'ema2': 38, 'slip_atr_k': 0.17624553275699814, 'slip_spread_k': 0.7997469278846827, 'spread_hl_frac': 0.002206019427954682, 'bb_std_mult': 1.3692754156662392, 'rsi_os': 8, 'rsi_ob': 95, 'vol_spike': 0.2942283334143481, 'adx_thresh': 18.01454897850219, 'atr_min_pct': 0.001384922595028329, 'atr_max_pct': 0.08499417375437085, 'tp_mult': 2.1343272795800656, 'tsl_mult': 0.8204495070529478, 'strategy': 'mean_reversion', 'time_stop': 254, 'use_sma': True, 'use_atr': True, 'use_adx': True, 'use_ema': True, 'use_spike': True, 'rsi_required': True, 'edge_k': 1.3667502557358076, 'edge_cap': 0.8753781178821722}.
[I 2025-08-30 03:44:47,925] Trial 65 finished with values: [-1000000000.0, 1000000000.0] and parameters: {'p_sma': 51, 'p_std': 44, 'p_atr': 7, 'p_adx': 26, 'rsi_period': 54, 'ema1': 6, 'ema2': 38, 'slip_atr_k': 0.048680470603914616, 'slip_spread_k': 0.8129494610452038, 'spread_hl_frac': 0.03201563200081185, 'bb_std_mult': 1.3744827367460974, 'rsi_os': 36, 'rsi_ob': 88, 'vol_spike': 0.018977825515256785, 'adx_thresh': 6.275824180046735, 'atr_min_pct': 0.0013575226151593262, 'atr_max_pct': 0.055150826765014316, 'tp_mult': 2.10597722225083, 'tsl_mult': 0.5239162066630584, 'strategy': 'mean_reversion', 'time_stop': 163, 'use_sma': False, 'use_atr': True, 'use_adx': False, 'use_ema': True, 'use_spike': False, 'rsi_required': True, 'edge_k': 1.7222665263916563, 'edge_cap': 0.05303764358973739}.
[I 2025-08-30 03:44:47,969] Trial 66 finished with values: [-1000000000.0, 1000000000.0] and parameters: {'p_sma': 22, 'p_std': 14, 'p_atr': 26, 'p_adx': 26, 'rsi_period': 7, 'ema1': 8, 'ema2': 39, 'slip_atr_k': 0.018697673655682354, 'slip_spread_k': 0.4450420777664361, 'spread_hl_frac': 0.002443959114093768, 'bb_std_mult': 1.576667672580417, 'rsi_os': 43, 'rsi_ob': 48, 'vol_spike': 0.26423098466568395, 'adx_thresh': 6.506470270308048, 'atr_min_pct': 0.0013589687961835153, 'atr_max_pct': 0.013952144828048393, 'tp_mult': 2.892661156939415, 'tsl_mult': 0.4838598152586792, 'strategy': 'mean_reversion', 'time_stop': 300, 'use_sma': False, 'use_atr': True, 'use_adx': False, 'use_ema': True, 'use_spike': False, 'rsi_required': True, 'edge_k': 1.145086027853894, 'edge_cap': 0.06055916197601119}.
[I 2025-08-30 03:44:48,323] Trial 62 finished with values: [-1000000000.0, 1000000000.0] and parameters: {'p_sma': 57, 'p_std': 51, 'p_atr': 7, 'p_adx': 13, 'rsi_period': 28, 'ema1': 29, 'ema2': 33, 'slip_atr_k': 0.12006787063250256, 'slip_spread_k': 0.025964787321079985, 'spread_hl_frac': 0.01948636354081043, 'bb_std_mult': 1.3680177564066205, 'rsi_os': 8, 'rsi_ob': 95, 'vol_spike': 0.2979713287339911, 'adx_thresh': 28.56747204456107, 'atr_min_pct': 0.025561072322040405, 'atr_max_pct': 0.0453227633672211, 'tp_mult': 1.6522040164647385, 'tsl_mult': 0.8441061730524382, 'strategy': 'breakout', 'time_stop': 59, 'use_sma': True, 'use_atr': False, 'use_adx': True, 'use_ema': True, 'use_spike': True, 'rsi_required': True, 'edge_k': 1.3479183696599608, 'edge_cap': 0.20432104653518468}.
[I 2025-08-30 03:44:48,411] Trial 67 finished with values: [-1000000000.0, 1000000000.0] and parameters: {'p_sma': 22, 'p_std': 12, 'p_atr': 19, 'p_adx': 15, 'rsi_period': 80, 'ema1': 8, 'ema2': 24, 'slip_atr_k': 0.05102318475178595, 'slip_spread_k': 0.4388212716860645, 'spread_hl_frac': 0.01866549180278112, 'bb_std_mult': 2.2744573068872804, 'rsi_os': 44, 'rsi_ob': 48, 'vol_spike': 0.11016658147403913, 'adx_thresh': 5.981201956156729, 'atr_min_pct': 0.02249715991290816, 'atr_max_pct': 0.11725246857197352, 'tp_mult': 1.1390863556819202, 'tsl_mult': 0.5424252636272738, 'strategy': 'mean_reversion', 'time_stop': 293, 'use_sma': False, 'use_atr': True, 'use_adx': False, 'use_ema': True, 'use_spike': False, 'rsi_required': True, 'edge_k': 1.1766964311625552, 'edge_cap': 0.6818349939662962}.
[I 2025-08-30 03:45:32,013] Trial 69 finished with values: [-1000000000.0, 1000000000.0] and parameters: {'p_sma': 31, 'p_std': 33, 'p_atr': 13, 'p_adx': 15, 'rsi_period': 73, 'ema1': 10, 'ema2': 58, 'slip_atr_k': 0.06856500064252626, 'slip_spread_k': 0.7495793803817457, 'spread_hl_frac': 4.938505834946316e-06, 'bb_std_mult': 2.0376424202473977, 'rsi_os': 25, 'rsi_ob': 55, 'vol_spike': 0.1106788937563001, 'adx_thresh': 24.417015947811592, 'atr_min_pct': 0.022005639816460608, 'atr_max_pct': 0.11664408047321034, 'tp_mult': 1.326404111890041, 'tsl_mult': 0.3923990400744851, 'strategy': 'breakout', 'time_stop': 210, 'use_sma': False, 'use_atr': True, 'use_adx': False, 'use_ema': False, 'use_spike': True, 'rsi_required': False, 'edge_k': 0.2064175623939668, 'edge_cap': 0.6900813548529319}.
[I 2025-08-30 03:45:33,278] Trial 71 finished with values: [-1000000000.0, 1000000000.0] and parameters: {'p_sma': 31, 'p_std': 7, 'p_atr': 25, 'p_adx': 22, 'rsi_period': 74, 'ema1': 10, 'ema2': 12, 'slip_atr_k': 0.14417040880433443, 'slip_spread_k': 0.9801206889408851, 'spread_hl_frac': 0.015107670676971833, 'bb_std_mult': 2.0521664751685456, 'rsi_os': 25, 'rsi_ob': 56, 'vol_spike': 0.12914410769003953, 'adx_thresh': 24.692336659021876, 'atr_min_pct': 0.014973287414419072, 'atr_max_pct': 0.07365732387079323, 'tp_mult': 2.293050155130016, 'tsl_mult': 0.6889788465857539, 'strategy': 'breakout', 'time_stop': 129, 'use_sma': False, 'use_atr': False, 'use_adx': True, 'use_ema': False, 'use_spike': True, 'rsi_required': False, 'edge_k': 0.2514882174113009, 'edge_cap': 0.8059393951778806}.
[I 2025-08-30 03:45:34,053] Trial 70 finished with values: [-1000000000.0, 1000000000.0] and parameters: {'p_sma': 44, 'p_std': 7, 'p_atr': 19, 'p_adx': 15, 'rsi_period': 81, 'ema1': 9, 'ema2': 23, 'slip_atr_k': 0.24070582136042018, 'slip_spread_k': 0.05865945710878956, 'spread_hl_frac': 0.01191208154398507, 'bb_std_mult': 2.294398286228346, 'rsi_os': 50, 'rsi_ob': 55, 'vol_spike': 0.11869275635374785, 'adx_thresh': 25.07355354038556, 'atr_min_pct': 0.006621516190499119, 'atr_max_pct': 0.11677474650386277, 'tp_mult': 2.3338161016563803, 'tsl_mult': 0.6999563834247631, 'strategy': 'breakout', 'time_stop': 210, 'use_sma': False, 'use_atr': True, 'use_adx': False, 'use_ema': False, 'use_spike': True, 'rsi_required': False, 'edge_k': 0.2659353059543863, 'edge_cap': 0.7941831296880294}.
[I 2025-08-30 03:45:35,070] Trial 68 finished with values: [-1000000000.0, 1000000000.0] and parameters: {'p_sma': 31, 'p_std': 60, 'p_atr': 19, 'p_adx': 16, 'rsi_period': 84, 'ema1': 10, 'ema2': 12, 'slip_atr_k': 0.1459768166319666, 'slip_spread_k': 0.7457822631435025, 'spread_hl_frac': 0.01772696237735972, 'bb_std_mult': 2.2884544725674028, 'rsi_os': 50, 'rsi_ob': 56, 'vol_spike': 0.11258007925739671, 'adx_thresh': 28.209062428540328, 'atr_min_pct': 0.022086720509895942, 'atr_max_pct': 0.11999580679954282, 'tp_mult': 2.32051699820416, 'tsl_mult': 0.5930708248204384, 'strategy': 'breakout', 'time_stop': 126, 'use_sma': False, 'use_atr': False, 'use_adx': True, 'use_ema': True, 'use_spike': True, 'rsi_required': False, 'edge_k': 0.21902069303778238, 'edge_cap': 0.705035230260386}.
[I 2025-08-30 03:45:35,176] Trial 75 finished with values: [-1000000000.0, 1000000000.0] and parameters: {'p_sma': 35, 'p_std': 58, 'p_atr': 16, 'p_adx': 28, 'rsi_period': 39, 'ema1': 13, 'ema2': 27, 'slip_atr_k': 0.19863624661814627, 'slip_spread_k': 0.22031384610965898, 'spread_hl_frac': 0.008422971658444297, 'bb_std_mult': 1.2282864877683952, 'rsi_os': 53, 'rsi_ob': 61, 'vol_spike': 0.13818839176671735, 'adx_thresh': 15.254405271673404, 'atr_min_pct': 0.018960150077871663, 'atr_max_pct': 0.06575414744442548, 'tp_mult': 1.4523734309562832, 'tsl_mult': 0.45228068843940195, 'strategy': 'mean_reversion', 'time_stop': 193, 'use_sma': True, 'use_atr': False, 'use_adx': True, 'use_ema': True, 'use_spike': False, 'rsi_required': True, 'edge_k': 0.6486539756972429, 'edge_cap': 0.6386140247563442}.
[I 2025-08-30 03:46:21,392] Trial 72 finished with values: [-1000000000.0, 1000000000.0] and parameters: {'p_sma': 16, 'p_std': 7, 'p_atr': 23, 'p_adx': 20, 'rsi_period': 84, 'ema1': 13, 'ema2': 44, 'slip_atr_k': 0.23956159654634795, 'slip_spread_k': 0.23381792987557704, 'spread_hl_frac': 0.012173634950297656, 'bb_std_mult': 0.8508446772265887, 'rsi_os': 49, 'rsi_ob': 57, 'vol_spike': 0.13403445784671758, 'adx_thresh': 15.295421004045835, 'atr_min_pct': 0.016467160377077936, 'atr_max_pct': 0.07169006130730717, 'tp_mult': 2.282471754438702, 'tsl_mult': 0.2772789132056981, 'strategy': 'breakout', 'time_stop': 127, 'use_sma': True, 'use_atr': False, 'use_adx': True, 'use_ema': False, 'use_spike': True, 'rsi_required': False, 'edge_k': 0.6353056228861378, 'edge_cap': 0.6237808136831859}.
[I 2025-08-30 03:46:23,193] Trial 76 finished with values: [-1000000000.0, 1000000000.0] and parameters: {'p_sma': 12, 'p_std': 18, 'p_atr': 17, 'p_adx': 20, 'rsi_period': 42, 'ema1': 30, 'ema2': 45, 'slip_atr_k': 0.15659774753236888, 'slip_spread_k': 0.3893381834543309, 'spread_hl_frac': 0.04479891280595827, 'bb_std_mult': 0.7271201119904782, 'rsi_os': 18, 'rsi_ob': 72, 'vol_spike': 0.049091247555712855, 'adx_thresh': 19.413350145522486, 'atr_min_pct': 0.015906116349209746, 'atr_max_pct': 0.10789114958328344, 'tp_mult': 2.420153798442999, 'tsl_mult': 0.003157440839770209, 'strategy': 'mean_reversion', 'time_stop': 162, 'use_sma': True, 'use_atr': True, 'use_adx': False, 'use_ema': False, 'use_spike': False, 'rsi_required': True, 'edge_k': 0.8096571227240378, 'edge_cap': 0.3651100635318181}.
[I 2025-08-30 03:46:23,194] Trial 74 finished with values: [-1000000000.0, 1000000000.0] and parameters: {'p_sma': 13, 'p_std': 18, 'p_atr': 16, 'p_adx': 20, 'rsi_period': 40, 'ema1': 13, 'ema2': 27, 'slip_atr_k': 0.0009043980685277675, 'slip_spread_k': 0.24278999015688968, 'spread_hl_frac': 0.04870424914981409, 'bb_std_mult': 1.2152906121614842, 'rsi_os': 28, 'rsi_ob': 61, 'vol_spike': 0.04839912363611944, 'adx_thresh': 15.310717863878693, 'atr_min_pct': 0.016768862722013028, 'atr_max_pct': 0.10659622086137845, 'tp_mult': 2.4434555403676788, 'tsl_mult': 0.6099738858245176, 'strategy': 'mean_reversion', 'time_stop': 195, 'use_sma': True, 'use_atr': False, 'use_adx': True, 'use_ema': True, 'use_spike': False, 'rsi_required': True, 'edge_k': 0.6660328205007113, 'edge_cap': 0.6451527230087896}.
[I 2025-08-30 03:46:23,545] Trial 73 finished with values: [-1000000000.0, 1000000000.0] and parameters: {'p_sma': 35, 'p_std': 18, 'p_atr': 17, 'p_adx': 28, 'rsi_period': 83, 'ema1': 16, 'ema2': 45, 'slip_atr_k': 0.19759683126764005, 'slip_spread_k': 0.0609267641552641, 'spread_hl_frac': 0.012113498747137297, 'bb_std_mult': 1.1837908268569546, 'rsi_os': 49, 'rsi_ob': 62, 'vol_spike': 0.07509160970932943, 'adx_thresh': 19.276684866027388, 'atr_min_pct': 0.018757637075261395, 'atr_max_pct': 0.108637816470751, 'tp_mult': 2.562654390412067, 'tsl_mult': 0.46277387384669516, 'strategy': 'mean_reversion', 'time_stop': 197, 'use_sma': True, 'use_atr': False, 'use_adx': True, 'use_ema': True, 'use_spike': False, 'rsi_required': False, 'edge_k': 0.6435705184135572, 'edge_cap': 0.644349698413641}.
[I 2025-08-30 03:47:09,871] Trial 79 finished with values: [-1000000000.0, 1000000000.0] and parameters: {'p_sma': 6, 'p_std': 24, 'p_atr': 11, 'p_adx': 10, 'rsi_period': 24, 'ema1': 28, 'ema2': 47, 'slip_atr_k': 0.08494720878785031, 'slip_spread_k': 0.31080033786400096, 'spread_hl_frac': 0.038057896604805484, 'bb_std_mult': 3.291472626248231, 'rsi_os': 13, 'rsi_ob': 66, 'vol_spike': 0.1717930908242021, 'adx_thresh': 34.162904793383156, 'atr_min_pct': 0.017721763581651357, 'atr_max_pct': 0.08204829887834869, 'tp_mult': 2.705045724230998, 'tsl_mult': 0.4154668747638853, 'strategy': 'mean_reversion', 'time_stop': 262, 'use_sma': False, 'use_atr': True, 'use_adx': False, 'use_ema': True, 'use_spike': False, 'rsi_required': False, 'edge_k': 0.35045557351397905, 'edge_cap': 0.5410896736008184}.
[I 2025-08-30 03:47:09,889] Trial 80 finished with values: [-1000000000.0, 1000000000.0] and parameters: {'p_sma': 5, 'p_std': 24, 'p_atr': 27, 'p_adx': 7, 'rsi_period': 24, 'ema1': 26, 'ema2': 48, 'slip_atr_k': 0.21447688691702557, 'slip_spread_k': 0.3376833962415656, 'spread_hl_frac': 0.036635990475219135, 'bb_std_mult': 2.7756707587068714, 'rsi_os': 12, 'rsi_ob': 66, 'vol_spike': 0.1711473681178675, 'adx_thresh': 34.06532861292646, 'atr_min_pct': 0.012132947605315513, 'atr_max_pct': 0.08385270637550031, 'tp_mult': 2.720876069370692, 'tsl_mult': 0.4084899510993394, 'strategy': 'breakout', 'time_stop': 25, 'use_sma': False, 'use_atr': True, 'use_adx': False, 'use_ema': False, 'use_spike': True, 'rsi_required': True, 'edge_k': 0.37898640666291505, 'edge_cap': 0.9553635164544647}.
[I 2025-08-30 03:47:10,305] Trial 78 finished with values: [-1000000000.0, 1000000000.0] and parameters: {'p_sma': 6, 'p_std': 23, 'p_atr': 27, 'p_adx': 10, 'rsi_period': 56, 'ema1': 28, 'ema2': 52, 'slip_atr_k': 0.2171609144565252, 'slip_spread_k': 0.34048864650597493, 'spread_hl_frac': 0.03898726570980853, 'bb_std_mult': 3.3017565866306615, 'rsi_os': 34, 'rsi_ob': 70, 'vol_spike': 0.17286966288297828, 'adx_thresh': 17.89525023075221, 'atr_min_pct': 0.012214984064158422, 'atr_max_pct': 0.13111687834127828, 'tp_mult': 1.9505904306232746, 'tsl_mult': 0.7743681214000374, 'strategy': 'mean_reversion', 'time_stop': 68, 'use_sma': False, 'use_atr': True, 'use_adx': False, 'use_ema': True, 'use_spike': False, 'rsi_required': False, 'edge_k': 0.37083782109189234, 'edge_cap': 0.5363006990724904}.
[I 2025-08-30 03:47:11,536] Trial 77 finished with values: [-1000000000.0, 1000000000.0] and parameters: {'p_sma': 5, 'p_std': 18, 'p_atr': 27, 'p_adx': 12, 'rsi_period': 55, 'ema1': 30, 'ema2': 51, 'slip_atr_k': 0.08567979660611381, 'slip_spread_k': 0.30748563164608367, 'spread_hl_frac': 0.030857009397287655, 'bb_std_mult': 3.3549216059116116, 'rsi_os': 13, 'rsi_ob': 72, 'vol_spike': 0.04951028015882049, 'adx_thresh': 9.701726283889611, 'atr_min_pct': 0.012180419288355062, 'atr_max_pct': 0.10668839424192453, 'tp_mult': 1.9810066581670327, 'tsl_mult': 0.9949936433721214, 'strategy': 'mean_reversion', 'time_stop': 167, 'use_sma': True, 'use_atr': True, 'use_adx': False, 'use_ema': True, 'use_spike': False, 'rsi_required': True, 'edge_k': 0.3651682807041162, 'edge_cap': 0.3657400850734138}.
