[I 2025-08-30 03:47:56,348] Trial 81 finished with values: [-1000000000.0, 1000000000.0] and parameters: {'p_sma': 45, 'p_std': 41, 'p_atr': 13, 'p_adx': 12, 'rsi_period': 68, 'ema1': 23, 'ema2': 18, 'slip_atr_k': 0.009424993838556314, 'slip_spread_k': 0.46549684076327874, 'spread_hl_frac': 0.02755963722772726, 'bb_std_mult': 1.785906436947581, 'rsi_os': 35, 'rsi_ob': 82, 'vol_spike': 0.029654310060979586, 'adx_thresh': 17.860100662158047, 'atr_min_pct': 0.013949403516674083, 'atr_max_pct': 0.0942365805842198, 'tp_mult': 1.9805903683391968, 'tsl_mult': 0.21161350324523492, 'strategy': 'breakout', 'time_stop': 242, 'use_sma': True, 'use_atr': False, 'use_adx': False, 'use_ema': False, 'use_spike': True, 'rsi_required': True, 'edge_k': 1.0990164305817425, 'edge_cap': 0.9088800995039314}.
[I 2025-08-30 03:47:56,334] Trial 83 finished with values: [-1000000000.0, 1000000000.0] and parameters: {'p_sma': 39, 'p_std': 14, 'p_atr': 9, 'p_adx': 23, 'rsi_period': 60, 'ema1': 23, 'ema2': 18, 'slip_atr_k': 0.08389988608675533, 'slip_spread_k': 0.6504189323518532, 'spread_hl_frac': 0.027395324271053633, 'bb_std_mult': 1.768157762741365, 'rsi_os': 22, 'rsi_ob': 63, 'vol_spike': 0.009121331136685479, 'adx_thresh': 9.796268878714324, 'atr_min_pct': 0.014194113922871999, 'atr_max_pct': 0.1313151749594953, 'tp_mult': 1.1085256502647058, 'tsl_mult': 0.362130933115025, 'strategy': 'breakout', 'time_stop': 45, 'use_sma': True, 'use_atr': False, 'use_adx': True, 'use_ema': False, 'use_spike': True, 'rsi_required': True, 'edge_k': 0.47559168597322277, 'edge_cap': 0.8764479029618706}.
[I 2025-08-30 03:47:56,863] Trial 84 finished with values: [-1000000000.0, 1000000000.0] and parameters: {'p_sma': 39, 'p_std': 41, 'p_atr': 9, 'p_adx': 9, 'rsi_period': 61, 'ema1': 22, 'ema2': 18, 'slip_atr_k': 0.014727772824862498, 'slip_spread_k': 0.5423997115561137, 'spread_hl_frac': 0.04250381089547209, 'bb_std_mult': 1.68399501911416, 'rsi_os': 22, 'rsi_ob': 82, 'vol_spike': 0.2822418321921072, 'adx_thresh': 31.29402636849231, 'atr_min_pct': 0.029258849331746377, 'atr_max_pct': 0.09127664492714523, 'tp_mult': 1.1362588085650662, 'tsl_mult': 0.35619366023568844, 'strategy': 'breakout', 'time_stop': 239, 'use_sma': True, 'use_atr': False, 'use_adx': True, 'use_ema': False, 'use_spike': True, 'rsi_required': True, 'edge_k': 0.015008680409859587, 'edge_cap': 0.880475665052725}.
[I 2025-08-30 03:47:57,517] Trial 82 finished with values: [-1000000000.0, 1000000000.0] and parameters: {'p_sma': 39, 'p_std': 14, 'p_atr': 9, 'p_adx': 12, 'rsi_period': 15, 'ema1': 24, 'ema2': 52, 'slip_atr_k': 0.010016880113416782, 'slip_spread_k': 0.984750007059733, 'spread_hl_frac': 0.031205386306730885, 'bb_std_mult': 1.7482381938247684, 'rsi_os': 22, 'rsi_ob': 82, 'vol_spike': 0.2849291984749326, 'adx_thresh': 26.92165613635077, 'atr_min_pct': 0.029636960663255052, 'atr_max_pct': 0.0930433202331033, 'tp_mult': 1.9510874307320072, 'tsl_mult': 0.2091543467382418, 'strategy': 'breakout', 'time_stop': 67, 'use_sma': True, 'use_atr': False, 'use_adx': False, 'use_ema': False, 'use_spike': True, 'rsi_required': True, 'edge_k': 0.47500880656215005, 'edge_cap': 0.9056727331596444}.
[I 2025-08-30 03:47:57,727] Trial 86 finished with values: [-1000000000.0, 1000000000.0] and parameters: {'p_sma': 59, 'p_std': 31, 'p_atr': 22, 'p_adx': 30, 'rsi_period': 36, 'ema1': 19, 'ema2': 21, 'slip_atr_k': 0.03536016249841564, 'slip_spread_k': 0.5305864393195008, 'spread_hl_frac': 0.04217385959913024, 'bb_std_mult': 1.6096409666733174, 'rsi_os': 46, 'rsi_ob': 86, 'vol_spike': 0.22139870101054004, 'adx_thresh': 13.518535694363923, 'atr_min_pct': 0.010809328990244381, 'atr_max_pct': 0.010101783405405088, 'tp_mult': 2.2109597945743094, 'tsl_mult': 0.03782790291315624, 'strategy': 'breakout', 'time_stop': 106, 'use_sma': False, 'use_atr': False, 'use_adx': True, 'use_ema': False, 'use_spike': True, 'rsi_required': False, 'edge_k': 0.005544379771599939, 'edge_cap': 0.15336846400800014}.
[I 2025-08-30 03:47:57,854] Trial 89 finished with values: [-1000000000.0, 1000000000.0] and parameters: {'p_sma': 42, 'p_std': 37, 'p_atr': 12, 'p_adx': 21, 'rsi_period': 30, 'ema1': 20, 'ema2': 36, 'slip_atr_k': 0.16228502786905263, 'slip_spread_k': 0.2874978300879414, 'spread_hl_frac': 0.010073460016596182, 'bb_std_mult': 0.9973202299934989, 'rsi_os': 53, 'rsi_ob': 59, 'vol_spike': 0.24779907272590257, 'adx_thresh': 21.167300354346263, 'atr_min_pct': 0.027968945148342923, 'atr_max_pct': 0.06022329693067737, 'tp_mult': 1.785812332302361, 'tsl_mult': 0.7231932159296247, 'strategy': 'mean_reversion', 'time_stop': 141, 'use_sma': False, 'use_atr': True, 'use_adx': False, 'use_ema': True, 'use_spike': False, 'rsi_required': False, 'edge_k': 0.7505859497415492, 'edge_cap': 0.838104665822708}.
[I 2025-08-30 03:48:41,774] Trial 85 finished with values: [-1000000000.0, 1000000000.0] and parameters: {'p_sma': 50, 'p_std': 32, 'p_atr': 23, 'p_adx': 30, 'rsi_period': 36, 'ema1': 19, 'ema2': 10, 'slip_atr_k': 0.03774157446206171, 'slip_spread_k': 0.5303624216741211, 'spread_hl_frac': 0.02506230511058295, 'bb_std_mult': 1.5593682824335884, 'rsi_os': 46, 'rsi_ob': 86, 'vol_spike': 0.14834285095625938, 'adx_thresh': 26.683329675976367, 'atr_min_pct': 0.029030322317054255, 'atr_max_pct': 0.05161915313107542, 'tp_mult': 1.340217696665531, 'tsl_mult': 0.17166256718469586, 'strategy': 'breakout', 'time_stop': 105, 'use_sma': False, 'use_atr': False, 'use_adx': True, 'use_ema': False, 'use_spike': True, 'rsi_required': False, 'edge_k': 0.04440757014061547, 'edge_cap': 0.15567916316232117}.
[I 2025-08-30 03:48:44,485] Trial 87 finished with values: [-1000000000.0, 1000000000.0] and parameters: {'p_sma': 51, 'p_std': 32, 'p_atr': 22, 'p_adx': 30, 'rsi_period': 50, 'ema1': 15, 'ema2': 10, 'slip_atr_k': 0.1603306261063638, 'slip_spread_k': 0.6121879350962427, 'spread_hl_frac': 0.02466734485868756, 'bb_std_mult': 0.9920786416769856, 'rsi_os': 45, 'rsi_ob': 59, 'vol_spike': 0.2268918059400483, 'adx_thresh': 13.482985448501058, 'atr_min_pct': 0.005055883623847136, 'atr_max_pct': 0.0517860440572418, 'tp_mult': 2.92325074302116, 'tsl_mult': 0.05225027096791485, 'strategy': 'mean_reversion', 'time_stop': 149, 'use_sma': False, 'use_atr': True, 'use_adx': False, 'use_ema': True, 'use_spike': False, 'rsi_required': False, 'edge_k': 1.7753268105231328, 'edge_cap': 0.16901002991257602}.
[I 2025-08-30 03:48:45,453] Trial 90 finished with values: [-1000000000.0, 1000000000.0] and parameters: {'p_sma': 19, 'p_std': 58, 'p_atr': 14, 'p_adx': 17, 'rsi_period': 50, 'ema1': 12, 'ema2': 35, 'slip_atr_k': 0.06443065988675847, 'slip_spread_k': 0.16725539471673317, 'spread_hl_frac': 0.015397695593894522, 'bb_std_mult': 2.965419337301603, 'rsi_os': 41, 'rsi_ob': 79, 'vol_spike': 0.26904658550106386, 'adx_thresh': 8.144406682812619, 'atr_min_pct': 0.005544612363906598, 'atr_max_pct': 0.030159708138398335, 'tp_mult': 1.5861991516678762, 'tsl_mult': 0.14630438883824964, 'strategy': 'mean_reversion', 'time_stop': 111, 'use_sma': False, 'use_atr': True, 'use_adx': True, 'use_ema': True, 'use_spike': False, 'rsi_required': False, 'edge_k': 0.5877237389970387, 'edge_cap': 0.4791735965123819}.
[I 2025-08-30 03:48:46,698] Trial 88 finished with values: [-1000000000.0, 1000000000.0] and parameters: {'p_sma': 51, 'p_std': 28, 'p_atr': 12, 'p_adx': 19, 'rsi_period': 52, 'ema1': 19, 'ema2': 10, 'slip_atr_k': 0.03757136620287803, 'slip_spread_k': 0.16574152458588243, 'spread_hl_frac': 0.024006571471631523, 'bb_std_mult': 3.591103876427864, 'rsi_os': 46, 'rsi_ob': 86, 'vol_spike': 0.2664772109228558, 'adx_thresh': 28.864617674237994, 'atr_min_pct': 0.010910895657821535, 'atr_max_pct': 0.05040512002384302, 'tp_mult': 2.0641291603924157, 'tsl_mult': 0.14066968109275163, 'strategy': 'mean_reversion', 'time_stop': 153, 'use_sma': False, 'use_atr': True, 'use_adx': True, 'use_ema': True, 'use_spike': False, 'rsi_required': False, 'edge_k': 1.7837106720915932, 'edge_cap': 0.42121362104819116}.
[I 2025-08-30 03:49:28,639] Trial 93 finished with values: [-1000000000.0, 1000000000.0] and parameters: {'p_sma': 26, 'p_std': 27, 'p_atr': 30, 'p_adx': 19, 'rsi_period': 15, 'ema1': 26, 'ema2': 31, 'slip_atr_k': 0.1694020852943131, 'slip_spread_k': 0.14036786873914187, 'spread_hl_frac': 0.007249596652442795, 'bb_std_mult': 2.4183320527349155, 'rsi_os': 17, 'rsi_ob': 90, 'vol_spike': 0.2120625192459317, 'adx_thresh': 23.53043949285524, 'atr_min_pct': 0.004001849851090495, 'atr_max_pct': 0.0766346822711113, 'tp_mult': 2.074597301916521, 'tsl_mult': 0.10433489825991082, 'strategy': 'mean_reversion', 'time_stop': 6, 'use_sma': True, 'use_atr': True, 'use_adx': True, 'use_ema': False, 'use_spike': False, 'rsi_required': True, 'edge_k': 1.2182558769101357, 'edge_cap': 0.40632504612149445}.
[I 2025-08-30 03:49:28,647] Trial 92 finished with values: [-1000000000.0, 1000000000.0] and parameters: {'p_sma': 20, 'p_std': 26, 'p_atr': 29, 'p_adx': 17, 'rsi_period': 63, 'ema1': 14, 'ema2': 41, 'slip_atr_k': 0.06750389518237238, 'slip_spread_k': 0.14117892734622717, 'spread_hl_frac': 0.03494757217636915, 'bb_std_mult': 0.501332482672942, 'rsi_os': 31, 'rsi_ob': 89, 'vol_spike': 0.20897714193661876, 'adx_thresh': 23.40839724533875, 'atr_min_pct': 0.006608204226906859, 'atr_max_pct': 0.03207367745600647, 'tp_mult': 2.057400304051393, 'tsl_mult': 0.9178338844779087, 'strategy': 'mean_reversion', 'time_stop': 235, 'use_sma': True, 'use_atr': True, 'use_adx': True, 'use_ema': True, 'use_spike': False, 'rsi_required': True, 'edge_k': 1.2284453168305443, 'edge_cap': 0.4082437669798974}.
[I 2025-08-30 03:49:29,255] Trial 94 finished with values: [-1000000000.0, 1000000000.0] and parameters: {'p_sma': 15, 'p_std': 53, 'p_atr': 29, 'p_adx': 9, 'rsi_period': 63, 'ema1': 21, 'ema2': 59, 'slip_atr_k': 0.13602458843147033, 'slip_spread_k': 0.9086418478505789, 'spread_hl_frac': 0.022113614964290637, 'bb_std_mult': 0.6131186816162986, 'rsi_os': 17, 'rsi_ob': 90, 'vol_spike': 0.2110366788521616, 'adx_thresh': 23.67101199018176, 'atr_min_pct': 0.009159961307281313, 'atr_max_pct': 0.0774021415594138, 'tp_mult': 1.5059255076471936, 'tsl_mult': 0.9073210210026741, 'strategy': 'breakout', 'time_stop': 291, 'use_sma': True, 'use_atr': False, 'use_adx': False, 'use_ema': False, 'use_spike': True, 'rsi_required': True, 'edge_k': 0.8636619287556637, 'edge_cap': 0.29252434000607835}.
[I 2025-08-30 03:49:29,617] Trial 91 finished with values: [-1000000000.0, 1000000000.0] and parameters: {'p_sma': 53, 'p_std': 53, 'p_atr': 14, 'p_adx': 17, 'rsi_period': 50, 'ema1': 15, 'ema2': 60, 'slip_atr_k': 0.10804408562568703, 'slip_spread_k': 0.8441317120311642, 'spread_hl_frac': 0.02363452842139927, 'bb_std_mult': 2.9406680270029706, 'rsi_os': 18, 'rsi_ob': 79, 'vol_spike': 0.271121422323142, 'adx_thresh': 5.186013390502756, 'atr_min_pct': 0.004835766970979425, 'atr_max_pct': 0.0775415868514826, 'tp_mult': 2.92721600484952, 'tsl_mult': 0.10468809083037711, 'strategy': 'mean_reversion', 'time_stop': 150, 'use_sma': False, 'use_atr': True, 'use_adx': False, 'use_ema': True, 'use_spike': False, 'rsi_required': False, 'edge_k': 1.7152370156199324, 'edge_cap': 0.4750879784172155}.
[I 2025-08-30 03:50:13,404] Trial 98 finished with values: [-1000000000.0, 1000000000.0] and parameters: {'p_sma': 47, 'p_std': 22, 'p_atr': 20, 'p_adx': 24, 'rsi_period': 44, 'ema1': 17, 'ema2': 16, 'slip_atr_k': 0.12107319416365858, 'slip_spread_k': 0.08218324535720267, 'spread_hl_frac': 0.004498091425603094, 'bb_std_mult': 1.4711258624431829, 'rsi_os': 38, 'rsi_ob': 50, 'vol_spike': 0.08932752051981084, 'adx_thresh': 16.87861801261817, 'atr_min_pct': 0.021383705058499427, 'atr_max_pct': 0.037856877700547985, 'tp_mult': 2.2521426935327415, 'tsl_mult': 0.5487998104308732, 'strategy': 'breakout', 'time_stop': 86, 'use_sma': True, 'use_atr': False, 'use_adx': False, 'use_ema': False, 'use_spike': True, 'rsi_required': True, 'edge_k': 1.4578483802935023, 'edge_cap': 0.9986500808114747}.
[I 2025-08-30 03:50:16,239] Trial 95 finished with values: [-1000000000.0, 1000000000.0] and parameters: {'p_sma': 53, 'p_std': 21, 'p_atr': 20, 'p_adx': 24, 'rsi_period': 9, 'ema1': 17, 'ema2': 60, 'slip_atr_k': 0.055784329718126344, 'slip_spread_k': 0.7244536909015727, 'spread_hl_frac': 0.022056247692227963, 'bb_std_mult': 0.6691829462454113, 'rsi_os': 28, 'rsi_ob': 45, 'vol_spike': 0.24439685901823077, 'adx_thresh': 16.075587960603972, 'atr_min_pct': 0.02120972172335208, 'atr_max_pct': 0.13884658975868408, 'tp_mult': 1.4927968666572218, 'tsl_mult': 0.24332751585666795, 'strategy': 'breakout', 'time_stop': 88, 'use_sma': True, 'use_atr': False, 'use_adx': False, 'use_ema': False, 'use_spike': True, 'rsi_required': True, 'edge_k': 1.481229332251509, 'edge_cap': 0.29192558644318634}.
[I 2025-08-30 03:50:18,048] Trial 96 finished with values: [-1000000000.0, 1000000000.0] and parameters: {'p_sma': 11, 'p_std': 21, 'p_atr': 25, 'p_adx': 24, 'rsi_period': 11, 'ema1': 17, 'ema2': 24, 'slip_atr_k': 0.10940910724573964, 'slip_spread_k': 0.847513264828851, 'spread_hl_frac': 0.004267459594803357, 'bb_std_mult': 1.4872622159744817, 'rsi_os': 6, 'rsi_ob': 75, 'vol_spike': 0.008792971357132279, 'adx_thresh': 5.214987718865313, 'atr_min_pct': 0.020845173239256214, 'atr_max_pct': 0.14370782547988206, 'tp_mult': 2.867869466287209, 'tsl_mult': 0.5493029751130016, 'strategy': 'breakout', 'time_stop': 91, 'use_sma': False, 'use_atr': False, 'use_adx': False, 'use_ema': True, 'use_spike': True, 'rsi_required': False, 'edge_k': 0.9550699257307675, 'edge_cap': 0.4711003277239802}.
[I 2025-08-30 03:50:19,004] Trial 97 finished with values: [-1000000000.0, 1000000000.0] and parameters: {'p_sma': 53, 'p_std': 16, 'p_atr': 25, 'p_adx': 24, 'rsi_period': 58, 'ema1': 17, 'ema2': 49, 'slip_atr_k': 0.12210116585745687, 'slip_spread_k': 0.08919856830740674, 'spread_hl_frac': 0.0038040402648352907, 'bb_std_mult': 3.1567054956745517, 'rsi_os': 29, 'rsi_ob': 74, 'vol_spike': 0.09147836150450256, 'adx_thresh': 5.088761584158945, 'atr_min_pct': 0.008053856382139563, 'atr_max_pct': 0.02379777310071402, 'tp_mult': 1.8729292739538441, 'tsl_mult': 0.659537444547242, 'strategy': 'breakout', 'time_stop': 29, 'use_sma': False, 'use_atr': False, 'use_adx': False, 'use_ema': True, 'use_spike': True, 'rsi_required': False, 'edge_k': 0.9526682265582603, 'edge_cap': 0.09719774262336217}.
[I 2025-08-30 03:50:19,173] Trial 101 finished with values: [-1000000000.0, 1000000000.0] and parameters: {'p_sma': 27, 'p_std': 34, 'p_atr': 10, 'p_adx': 14, 'rsi_period': 67, 'ema1': 29, 'ema2': 49, 'slip_atr_k': 0.022465661887181923, 'slip_spread_k': 0.37708047032381153, 'spread_hl_frac': 0.0329801091865999, 'bb_std_mult': 3.4982100301501933, 'rsi_os': 55, 'rsi_ob': 93, 'vol_spike': 0.02566781854311541, 'adx_thresh': 30.59857709574871, 'atr_min_pct': 0.023564044627621822, 'atr_max_pct': 0.023479687670325586, 'tp_mult': 1.1832482493540852, 'tsl_mult': 0.8496291090968496, 'strategy': 'mean_reversion', 'time_stop': 218, 'use_sma': False, 'use_atr': True, 'use_adx': True, 'use_ema': True, 'use_spike': False, 'rsi_required': False, 'edge_k': 1.0344378799971714, 'edge_cap': 0.7228783880029712}.
[I 2025-08-30 03:50:19,208] Trial 102 finished with values: [-1000000000.0, 1000000000.0] and parameters: {'p_sma': 10, 'p_std': 34, 'p_atr': 10, 'p_adx': 14, 'rsi_period': 68, 'ema1': 5, 'ema2': 28, 'slip_atr_k': 0.1519636864650135, 'slip_spread_k': 0.7730866101912686, 'spread_hl_frac': 0.03312383033637083, 'bb_std_mult': 3.4900882499701718, 'rsi_os': 5, 'rsi_ob': 48, 'vol_spike': 0.06676664143812969, 'adx_thresh': 32.10940236335005, 'atr_min_pct': 0.023933816333198916, 'atr_max_pct': 0.06694109325943359, 'tp_mult': 1.1825632726190085, 'tsl_mult': 0.496082100261055, 'strategy': 'mean_reversion', 'time_stop': 252, 'use_sma': True, 'use_atr': True, 'use_adx': True, 'use_ema': False, 'use_spike': False, 'rsi_required': True, 'edge_k': 1.070983358753671, 'edge_cap': 0.9336698007482298}.
[I 2025-08-30 03:50:59,788] Trial 104 finished with values: [-1000000000.0, 1000000000.0] and parameters: {'p_sma': 37, 'p_std': 43, 'p_atr': 26, 'p_adx': 28, 'rsi_period': 79, 'ema1': 8, 'ema2': 32, 'slip_atr_k': 0.23595798088064673, 'slip_spread_k': 0.9609118488194268, 'spread_hl_frac': 0.04516739720289636, 'bb_std_mult': 2.569382370558083, 'rsi_os': 52, 'rsi_ob': 69, 'vol_spike': 0.18873484955439945, 'adx_thresh': 12.210466329210398, 'atr_min_pct': 0.025900837699915677, 'atr_max_pct': 0.09853440070334066, 'tp_mult': 1.0121566250964737, 'tsl_mult': 0.7800006327538225, 'strategy': 'breakout', 'time_stop': 273, 'use_sma': True, 'use_atr': False, 'use_adx': True, 'use_ema': False, 'use_spike': True, 'rsi_required': True, 'edge_k': 1.9449760659511253, 'edge_cap': 0.12680305897961247}.
[I 2025-08-30 03:51:02,947] Trial 103 finished with values: [-0.050605241967919934, 0.0505596660480567] and parameters: {'p_sma': 29, 'p_std': 12, 'p_atr': 26, 'p_adx': 28, 'rsi_period': 79, 'ema1': 6, 'ema2': 16, 'slip_atr_k': 0.24969887091834708, 'slip_spread_k': 0.6002963319004737, 'spread_hl_frac': 0.04732283205187142, 'bb_std_mult': 2.604308782166178, 'rsi_os': 42, 'rsi_ob': 70, 'vol_spike': 0.19019835247984587, 'adx_thresh': 21.907905553728398, 'atr_min_pct': 0.0005098134375242109, 'atr_max_pct': 0.0980201660529331, 'tp_mult': 2.1685958263069995, 'tsl_mult': 0.7852149685753553, 'strategy': 'mean_reversion', 'time_stop': 46, 'use_sma': True, 'use_atr': True, 'use_adx': True, 'use_ema': False, 'use_spike': False, 'rsi_required': True, 'edge_k': 1.892229724206787, 'edge_cap': 0.565905721140702}.
[I 2025-08-30 03:51:04,436] Trial 100 finished with values: [-1000000000.0, 1000000000.0] and parameters: {'p_sma': 27, 'p_std': 43, 'p_atr': 25, 'p_adx': 14, 'rsi_period': 67, 'ema1': 29, 'ema2': 55, 'slip_atr_k': 0.20923293570515783, 'slip_spread_k': 0.384359305526169, 'spread_hl_frac': 0.03380535739249468, 'bb_std_mult': 3.121813491541185, 'rsi_os': 6, 'rsi_ob': 75, 'vol_spike': 0.0666879464653258, 'adx_thresh': 30.852136694926664, 'atr_min_pct': 0.023287477559631772, 'atr_max_pct': 0.09773383828805665, 'tp_mult': 2.862094415149561, 'tsl_mult': 0.6476755218892537, 'strategy': 'breakout', 'time_stop': 266, 'use_sma': False, 'use_atr': False, 'use_adx': True, 'use_ema': True, 'use_spike': True, 'rsi_required': False, 'edge_k': 1.9143996143917545, 'edge_cap': 0.935789607634993}.
[I 2025-08-30 03:51:05,484] Trial 99 finished with values: [-1000000000.0, 1000000000.0] and parameters: {'p_sma': 28, 'p_std': 16, 'p_atr': 25, 'p_adx': 23, 'rsi_period': 67, 'ema1': 6, 'ema2': 20, 'slip_atr_k': 0.2323593926528431, 'slip_spread_k': 0.7737423728553194, 'spread_hl_frac': 0.046806292288939455, 'bb_std_mult': 3.163835265173714, 'rsi_os': 5, 'rsi_ob': 46, 'vol_spike': 0.2430470210527516, 'adx_thresh': 31.39941348848736, 'atr_min_pct': 0.008215823953183852, 'atr_max_pct': 0.14279090572441677, 'tp_mult': 1.874500609923528, 'tsl_mult': 0.5011550818225093, 'strategy': 'breakout', 'time_stop': 187, 'use_sma': False, 'use_atr': False, 'use_adx': True, 'use_ema': True, 'use_spike': True, 'rsi_required': False, 'edge_k': 0.9668043266195967, 'edge_cap': 0.7291975965923495}.
[I 2025-08-30 03:51:47,785] Trial 106 finished with values: [-0.047682602346532654, 0.04761085708576612] and parameters: {'p_sma': 29, 'p_std': 9, 'p_atr': 28, 'p_adx': 28, 'rsi_period': 73, 'ema1': 6, 'ema2': 14, 'slip_atr_k': 0.24670873995449702, 'slip_spread_k': 0.6170106557705556, 'spread_hl_frac': 0.04749025807139924, 'bb_std_mult': 2.8717462832187404, 'rsi_os': 42, 'rsi_ob': 70, 'vol_spike': 0.19302704131208334, 'adx_thresh': 25.327002638837634, 'atr_min_pct': 0.0007687632409138878, 'atr_max_pct': 0.11175099464598959, 'tp_mult': 2.148289720609151, 'tsl_mult': 0.7567455942368339, 'strategy': 'mean_reversion', 'time_stop': 46, 'use_sma': True, 'use_atr': True, 'use_adx': True, 'use_ema': False, 'use_spike': False, 'rsi_required': True, 'edge_k': 1.9193116657769667, 'edge_cap': 0.5709236066977215}.
[I 2025-08-30 03:51:49,357] Trial 108 finished with values: [-0.049460928190644515, 0.04938917026586469] and parameters: {'p_sma': 22, 'p_std': 9, 'p_atr': 28, 'p_adx': 27, 'rsi_period': 73, 'ema1': 6, 'ema2': 14, 'slip_atr_k': 0.24907323613023447, 'slip_spread_k': 0.6074618277874245, 'spread_hl_frac': 0.04988319739265009, 'bb_std_mult': 2.8606894213466836, 'rsi_os': 41, 'rsi_ob': 70, 'vol_spike': 0.19333193401088444, 'adx_thresh': 22.093527781272222, 'atr_min_pct': 0.0006381282115201909, 'atr_max_pct': 0.08860986339962018, 'tp_mult': 2.153920560856988, 'tsl_mult': 0.7535124722184027, 'strategy': 'mean_reversion', 'time_stop': 47, 'use_sma': True, 'use_atr': True, 'use_adx': True, 'use_ema': False, 'use_spike': False, 'rsi_required': True, 'edge_k': 1.9036081861700094, 'edge_cap': 0.5150735942451655}.
[I 2025-08-30 03:51:50,011] Trial 107 finished with values: [-0.04866677556360266, 0.04862146273096117] and parameters: {'p_sma': 29, 'p_std': 12, 'p_atr': 28, 'p_adx': 29, 'rsi_period': 74, 'ema1': 6, 'ema2': 14, 'slip_atr_k': 0.2483372619403091, 'slip_spread_k': 0.5993091494897964, 'spread_hl_frac': 0.04791456407647144, 'bb_std_mult': 2.759469400691802, 'rsi_os': 42, 'rsi_ob': 70, 'vol_spike': 0.1990181207869036, 'adx_thresh': 22.330494981627066, 'atr_min_pct': 0.0004539056222957589, 'atr_max_pct': 0.1040238110434755, 'tp_mult': 2.158687897573043, 'tsl_mult': 0.7532271324623171, 'strategy': 'mean_reversion', 'time_stop': 50, 'use_sma': True, 'use_atr': True, 'use_adx': True, 'use_ema': False, 'use_spike': False, 'rsi_required': True, 'edge_k': 1.9021818788138778, 'edge_cap': 0.6069668298862114}.
