[I 2025-08-30 04:48:47,062] Trial 406 finished with values: [-1000000000.0, 1000000000.0] and parameters: {'p_sma': 12, 'p_std': 52, 'p_atr': 16, 'p_adx': 24, 'rsi_period': 49, 'ema1': 21, 'ema2': 48, 'slip_atr_k': 0.01209206032772914, 'slip_spread_k': 0.5577577652025223, 'spread_hl_frac': 0.010872910937015205, 'bb_std_mult': 2.2376174156890283, 'rsi_os': 26, 'rsi_ob': 67, 'vol_spike': 0.19316215312872673, 'adx_thresh': 23.35887944557031, 'atr_min_pct': 0.0011856178523279557, 'atr_max_pct': 0.07904117601885957, 'tp_mult': 1.220957042292376, 'tsl_mult': 0.25446956064023435, 'strategy': 'mean_reversion', 'time_stop': 189, 'use_sma': True, 'use_atr': True, 'use_adx': True, 'use_ema': False, 'use_spike': False, 'rsi_required': False, 'edge_k': 1.1463041348035496, 'edge_cap': 0.5497879770838724}.
[I 2025-08-30 04:48:47,536] Trial 403 finished with values: [-1000000000.0, 1000000000.0] and parameters: {'p_sma': 56, 'p_std': 53, 'p_atr': 9, 'p_adx': 15, 'rsi_period': 25, 'ema1': 16, 'ema2': 27, 'slip_atr_k': 0.1648470389203492, 'slip_spread_k': 0.055671584934009866, 'spread_hl_frac': 0.008696356591856896, 'bb_std_mult': 0.5905677084625733, 'rsi_os': 25, 'rsi_ob': 67, 'vol_spike': 0.007042867713906054, 'adx_thresh': 30.90295334040469, 'atr_min_pct': 0.024108247297051688, 'atr_max_pct': 0.03929315491533671, 'tp_mult': 2.22205254805175, 'tsl_mult': 0.8292376644086121, 'strategy': 'mean_reversion', 'time_stop': 211, 'use_sma': True, 'use_atr': True, 'use_adx': True, 'use_ema': True, 'use_spike': False, 'rsi_required': False, 'edge_k': 1.0478460507414369, 'edge_cap': 0.6017124860301527}.
[I 2025-08-30 04:49:33,120] Trial 407 finished with values: [-1000000000.0, 1000000000.0] and parameters: {'p_sma': 9, 'p_std': 52, 'p_atr': 9, 'p_adx': 27, 'rsi_period': 22, 'ema1': 23, 'ema2': 22, 'slip_atr_k': 0.02868512789241566, 'slip_spread_k': 0.6898698814279323, 'spread_hl_frac': 0.011873456346012001, 'bb_std_mult': 3.5267280951570137, 'rsi_os': 24, 'rsi_ob': 69, 'vol_spike': 0.08005650196790866, 'adx_thresh': 30.668649382563, 'atr_min_pct': 0.0011013397166316121, 'atr_max_pct': 0.09016586807213069, 'tp_mult': 1.8616746554789323, 'tsl_mult': 0.1940040826713597, 'strategy': 'mean_reversion', 'time_stop': 67, 'use_sma': True, 'use_atr': True, 'use_adx': True, 'use_ema': True, 'use_spike': False, 'rsi_required': False, 'edge_k': 0.43753251372633895, 'edge_cap': 0.6927362439400752}.
[I 2025-08-30 04:49:34,441] Trial 408 finished with values: [-1000000000.0, 1000000000.0] and parameters: {'p_sma': 33, 'p_std': 14, 'p_atr': 8, 'p_adx': 23, 'rsi_period': 22, 'ema1': 15, 'ema2': 26, 'slip_atr_k': 0.2421228541601999, 'slip_spread_k': 0.4871893746048485, 'spread_hl_frac': 0.01190278567378949, 'bb_std_mult': 0.5013186250622426, 'rsi_os': 33, 'rsi_ob': 81, 'vol_spike': 0.17426503064507892, 'adx_thresh': 30.50629663217843, 'atr_min_pct': 0.019163732608236752, 'atr_max_pct': 0.04033381330927774, 'tp_mult': 1.213997248336811, 'tsl_mult': 0.19211239187067167, 'strategy': 'breakout', 'time_stop': 210, 'use_sma': False, 'use_atr': False, 'use_adx': False, 'use_ema': True, 'use_spike': True, 'rsi_required': True, 'edge_k': 0.6154693597512468, 'edge_cap': 0.644241030363738}.
[I 2025-08-30 04:49:34,922] Trial 410 finished with values: [-1000000000.0, 1000000000.0] and parameters: {'p_sma': 9, 'p_std': 24, 'p_atr': 8, 'p_adx': 21, 'rsi_period': 35, 'ema1': 23, 'ema2': 37, 'slip_atr_k': 0.15531507346159346, 'slip_spread_k': 0.687936703603586, 'spread_hl_frac': 0.031048301655758184, 'bb_std_mult': 3.510880355121082, 'rsi_os': 24, 'rsi_ob': 46, 'vol_spike': 0.0840606032902509, 'adx_thresh': 19.025081244891453, 'atr_min_pct': 3.1945985148347495e-05, 'atr_max_pct': 0.1472212156150852, 'tp_mult': 1.869567392157774, 'tsl_mult': 0.19353457368562782, 'strategy': 'breakout', 'time_stop': 227, 'use_sma': False, 'use_atr': False, 'use_adx': False, 'use_ema': True, 'use_spike': True, 'rsi_required': True, 'edge_k': 1.4968975609655153, 'edge_cap': 0.6960727166489303}.
[I 2025-08-30 04:49:35,312] Trial 409 finished with values: [-1000000000.0, 1000000000.0] and parameters: {'p_sma': 10, 'p_std': 6, 'p_atr': 8, 'p_adx': 25, 'rsi_period': 60, 'ema1': 15, 'ema2': 23, 'slip_atr_k': 0.017805818153961123, 'slip_spread_k': 0.8122499478150967, 'spread_hl_frac': 0.011850407563123748, 'bb_std_mult': 0.7350459198631061, 'rsi_os': 24, 'rsi_ob': 69, 'vol_spike': 0.17320060080133928, 'adx_thresh': 30.483236626250466, 'atr_min_pct': 0.0004997895163486067, 'atr_max_pct': 0.13980875819556818, 'tp_mult': 1.0896958150817426, 'tsl_mult': 0.2871451921973196, 'strategy': 'breakout', 'time_stop': 208, 'use_sma': False, 'use_atr': False, 'use_adx': False, 'use_ema': True, 'use_spike': True, 'rsi_required': True, 'edge_k': 1.5040205893178558, 'edge_cap': 0.6871218117934697}.
[I 2025-08-30 04:50:20,221] Trial 413 finished with values: [-1000000000.0, 1000000000.0] and parameters: {'p_sma': 11, 'p_std': 21, 'p_atr': 23, 'p_adx': 25, 'rsi_period': 15, 'ema1': 13, 'ema2': 57, 'slip_atr_k': 0.02219535417602256, 'slip_spread_k': 0.8034937216781373, 'spread_hl_frac': 0.010247298792133984, 'bb_std_mult': 3.2896958708760735, 'rsi_os': 48, 'rsi_ob': 59, 'vol_spike': 0.2717732664480652, 'adx_thresh': 31.961177532297032, 'atr_min_pct': 0.007932524212631454, 'atr_max_pct': 0.13889328503168955, 'tp_mult': 1.0128336522819925, 'tsl_mult': 0.09140920985469081, 'strategy': 'breakout', 'time_stop': 202, 'use_sma': False, 'use_atr': False, 'use_adx': False, 'use_ema': True, 'use_spike': True, 'rsi_required': False, 'edge_k': 1.4615019592902074, 'edge_cap': 0.6758732189121095}.
[I 2025-08-30 04:50:20,800] Trial 414 finished with values: [-1000000000.0, 1000000000.0] and parameters: {'p_sma': 31, 'p_std': 51, 'p_atr': 10, 'p_adx': 26, 'rsi_period': 15, 'ema1': 13, 'ema2': 29, 'slip_atr_k': 0.009525872676187926, 'slip_spread_k': 0.8664057053895291, 'spread_hl_frac': 0.010037753096902434, 'bb_std_mult': 3.2959684361795336, 'rsi_os': 22, 'rsi_ob': 64, 'vol_spike': 0.20185808800029942, 'adx_thresh': 31.982841101991067, 'atr_min_pct': 0.008164761100725428, 'atr_max_pct': 0.09955928632941226, 'tp_mult': 1.9271313892131947, 'tsl_mult': 0.09168473899601526, 'strategy': 'breakout', 'time_stop': 201, 'use_sma': False, 'use_atr': False, 'use_adx': False, 'use_ema': True, 'use_spike': True, 'rsi_required': False, 'edge_k': 0.17722196545984925, 'edge_cap': 0.6341622017410765}.
[I 2025-08-30 04:50:21,389] Trial 412 finished with values: [-1000000000.0, 1000000000.0] and parameters: {'p_sma': 31, 'p_std': 21, 'p_atr': 7, 'p_adx': 25, 'rsi_period': 35, 'ema1': 15, 'ema2': 29, 'slip_atr_k': 0.15426854163128617, 'slip_spread_k': 0.8090532466556232, 'spread_hl_frac': 0.022877638603985524, 'bb_std_mult': 2.0508690310247344, 'rsi_os': 49, 'rsi_ob': 66, 'vol_spike': 0.2545038445714858, 'adx_thresh': 31.916554937445923, 'atr_min_pct': 0.008119954765751104, 'atr_max_pct': 0.07549245176790306, 'tp_mult': 1.0444711528286916, 'tsl_mult': 0.256387630142425, 'strategy': 'breakout', 'time_stop': 54, 'use_sma': False, 'use_atr': False, 'use_adx': False, 'use_ema': True, 'use_spike': True, 'rsi_required': True, 'edge_k': 0.574230315927802, 'edge_cap': 0.8743544334343674}.
[I 2025-08-30 04:50:21,694] Trial 411 finished with values: [-0.03929327615680955, 0.03926438595843371] and parameters: {'p_sma': 33, 'p_std': 16, 'p_atr': 8, 'p_adx': 25, 'rsi_period': 60, 'ema1': 15, 'ema2': 26, 'slip_atr_k': 0.04302426493852454, 'slip_spread_k': 0.821225684094116, 'spread_hl_frac': 0.02295793029430538, 'bb_std_mult': 1.4001798439371531, 'rsi_os': 32, 'rsi_ob': 63, 'vol_spike': 0.17402031118958225, 'adx_thresh': 22.368406644766473, 'atr_min_pct': 0.0005019576573354462, 'atr_max_pct': 0.04422527471728484, 'tp_mult': 1.0367647196175256, 'tsl_mult': 0.22121617519139805, 'strategy': 'breakout', 'time_stop': 223, 'use_sma': False, 'use_atr': False, 'use_adx': False, 'use_ema': True, 'use_spike': True, 'rsi_required': True, 'edge_k': 0.6322546513199656, 'edge_cap': 0.32273109970815833}.
[I 2025-08-30 04:51:04,406] Trial 418 finished with values: [-1000000000.0, 1000000000.0] and parameters: {'p_sma': 8, 'p_std': 11, 'p_atr': 9, 'p_adx': 20, 'rsi_period': 47, 'ema1': 27, 'ema2': 28, 'slip_atr_k': 0.0046775830803050585, 'slip_spread_k': 0.1559182764972163, 'spread_hl_frac': 0.019844133604570588, 'bb_std_mult': 3.3955428467527877, 'rsi_os': 23, 'rsi_ob': 66, 'vol_spike': 0.1871599746957157, 'adx_thresh': 32.9548806331735, 'atr_min_pct': 0.028275836756044392, 'atr_max_pct': 0.14392763996567856, 'tp_mult': 1.8168286634979252, 'tsl_mult': 0.2429561522061131, 'strategy': 'breakout', 'time_stop': 162, 'use_sma': False, 'use_atr': False, 'use_adx': False, 'use_ema': False, 'use_spike': True, 'rsi_required': False, 'edge_k': 1.5353523363448602, 'edge_cap': 0.9400081325805384}.
[I 2025-08-30 04:51:04,829] Trial 415 finished with values: [-1000000000.0, 1000000000.0] and parameters: {'p_sma': 31, 'p_std': 51, 'p_atr': 7, 'p_adx': 24, 'rsi_period': 43, 'ema1': 14, 'ema2': 29, 'slip_atr_k': 0.011806164511873073, 'slip_spread_k': 0.853080122871151, 'spread_hl_frac': 0.024167574206791984, 'bb_std_mult': 3.416493269777161, 'rsi_os': 22, 'rsi_ob': 66, 'vol_spike': 0.20391466443987338, 'adx_thresh': 32.614651250718715, 'atr_min_pct': 0.01655732900529556, 'atr_max_pct': 0.14471528222792188, 'tp_mult': 2.604878016576303, 'tsl_mult': 0.4524014571928374, 'strategy': 'breakout', 'time_stop': 257, 'use_sma': False, 'use_atr': False, 'use_adx': False, 'use_ema': False, 'use_spike': True, 'rsi_required': False, 'edge_k': 0.6715716697730012, 'edge_cap': 0.8802391721914312}.
[I 2025-08-30 04:51:05,137] Trial 416 finished with values: [-1000000000.0, 1000000000.0] and parameters: {'p_sma': 50, 'p_std': 30, 'p_atr': 21, 'p_adx': 24, 'rsi_period': 20, 'ema1': 14, 'ema2': 18, 'slip_atr_k': 0.003622138720350189, 'slip_spread_k': 0.4578052461594314, 'spread_hl_frac': 0.02263111344797542, 'bb_std_mult': 2.0442290655101867, 'rsi_os': 26, 'rsi_ob': 66, 'vol_spike': 0.16655578562841128, 'adx_thresh': 22.33960082420014, 'atr_min_pct': 0.028026442835220523, 'atr_max_pct': 0.14987514050603237, 'tp_mult': 1.7943375432890825, 'tsl_mult': 0.22426199710954006, 'strategy': 'breakout', 'time_stop': 223, 'use_sma': False, 'use_atr': False, 'use_adx': False, 'use_ema': False, 'use_spike': True, 'rsi_required': False, 'edge_k': 1.527444499632296, 'edge_cap': 0.8783673996851756}.
[I 2025-08-30 04:51:05,643] Trial 417 finished with values: [-0.049032762920649064, 0.04901252213004416] and parameters: {'p_sma': 50, 'p_std': 50, 'p_atr': 10, 'p_adx': 19, 'rsi_period': 20, 'ema1': 27, 'ema2': 28, 'slip_atr_k': 0.0422415160432464, 'slip_spread_k': 0.719070138044568, 'spread_hl_frac': 0.02428311011748762, 'bb_std_mult': 3.4161352548493427, 'rsi_os': 23, 'rsi_ob': 50, 'vol_spike': 0.1650643614088644, 'adx_thresh': 32.644165968048824, 'atr_min_pct': 0.0005348636443037334, 'atr_max_pct': 0.04389947790342878, 'tp_mult': 1.3097821052336358, 'tsl_mult': 0.22136514518998085, 'strategy': 'breakout', 'time_stop': 129, 'use_sma': False, 'use_atr': False, 'use_adx': False, 'use_ema': False, 'use_spike': True, 'rsi_required': False, 'edge_k': 1.557262295020895, 'edge_cap': 0.3217940102860656}.
[I 2025-08-30 04:51:06,031] Trial 422 finished with values: [-1000000000.0, 1000000000.0] and parameters: {'p_sma': 10, 'p_std': 49, 'p_atr': 19, 'p_adx': 26, 'rsi_period': 21, 'ema1': 16, 'ema2': 39, 'slip_atr_k': 0.04928041777159195, 'slip_spread_k': 0.740694837680524, 'spread_hl_frac': 0.01097259444907019, 'bb_std_mult': 3.487446856933419, 'rsi_os': 52, 'rsi_ob': 65, 'vol_spike': 0.23545212951559585, 'adx_thresh': 31.38229340663118, 'atr_min_pct': 0.0016870086519968862, 'atr_max_pct': 0.14660082859548146, 'tp_mult': 1.882017285407719, 'tsl_mult': 0.2855723465112854, 'strategy': 'mean_reversion', 'time_stop': 212, 'use_sma': True, 'use_atr': True, 'use_adx': True, 'use_ema': True, 'use_spike': False, 'rsi_required': False, 'edge_k': 1.4598900226978757, 'edge_cap': 0.6582106594961906}.
[I 2025-08-30 04:51:49,836] Trial 419 finished with values: [-1000000000.0, 1000000000.0] and parameters: {'p_sma': 15, 'p_std': 50, 'p_atr': 22, 'p_adx': 24, 'rsi_period': 19, 'ema1': 20, 'ema2': 39, 'slip_atr_k': 0.04968227841718445, 'slip_spread_k': 0.7392917811758527, 'spread_hl_frac': 0.010640579692333514, 'bb_std_mult': 3.464112777690088, 'rsi_os': 27, 'rsi_ob': 67, 'vol_spike': 0.23392970973946858, 'adx_thresh': 31.454488799438582, 'atr_min_pct': 0.009580763694091329, 'atr_max_pct': 0.14542597672510268, 'tp_mult': 1.78298162579221, 'tsl_mult': 0.2224220435686647, 'strategy': 'breakout', 'time_stop': 212, 'use_sma': False, 'use_atr': False, 'use_adx': False, 'use_ema': False, 'use_spike': True, 'rsi_required': False, 'edge_k': 1.496169986901736, 'edge_cap': 0.6586453286436165}.
[I 2025-08-30 04:51:50,926] Trial 421 finished with values: [-1000000000.0, 1000000000.0] and parameters: {'p_sma': 11, 'p_std': 45, 'p_atr': 19, 'p_adx': 27, 'rsi_period': 19, 'ema1': 8, 'ema2': 15, 'slip_atr_k': 0.013583097202039436, 'slip_spread_k': 0.7381302530203058, 'spread_hl_frac': 0.01074959909637063, 'bb_std_mult': 0.9361035980160961, 'rsi_os': 19, 'rsi_ob': 62, 'vol_spike': 0.13050413250524348, 'adx_thresh': 31.324122444080622, 'atr_min_pct': 0.006678005100869081, 'atr_max_pct': 0.14666878162345431, 'tp_mult': 2.0497070603600744, 'tsl_mult': 0.28075424683532835, 'strategy': 'breakout', 'time_stop': 213, 'use_sma': True, 'use_atr': False, 'use_adx': False, 'use_ema': True, 'use_spike': False, 'rsi_required': False, 'edge_k': 0.7674878494429213, 'edge_cap': 0.2404712825330902}.
[I 2025-08-30 04:51:51,507] Trial 420 finished with values: [-1000000000.0, 1000000000.0] and parameters: {'p_sma': 50, 'p_std': 50, 'p_atr': 20, 'p_adx': 11, 'rsi_period': 20, 'ema1': 14, 'ema2': 31, 'slip_atr_k': 0.00424531171153131, 'slip_spread_k': 0.7241714286222971, 'spread_hl_frac': 0.01063665200925423, 'bb_std_mult': 3.479939871801955, 'rsi_os': 26, 'rsi_ob': 84, 'vol_spike': 0.16517334928238397, 'adx_thresh': 31.304739391439156, 'atr_min_pct': 0.022343637627057145, 'atr_max_pct': 0.14756728417090925, 'tp_mult': 1.7907702560155447, 'tsl_mult': 0.0608740752961861, 'strategy': 'breakout', 'time_stop': 245, 'use_sma': False, 'use_atr': False, 'use_adx': False, 'use_ema': True, 'use_spike': True, 'rsi_required': False, 'edge_k': 1.5069961431679275, 'edge_cap': 0.6532638750407366}.
[I 2025-08-30 04:51:51,516] Trial 423 finished with values: [-1000000000.0, 1000000000.0] and parameters: {'p_sma': 9, 'p_std': 52, 'p_atr': 22, 'p_adx': 24, 'rsi_period': 19, 'ema1': 11, 'ema2': 30, 'slip_atr_k': 0.09480799969463426, 'slip_spread_k': 0.30068937791356093, 'spread_hl_frac': 0.02805166294067407, 'bb_std_mult': 3.5967242818654035, 'rsi_os': 24, 'rsi_ob': 48, 'vol_spike': 0.06507474569559911, 'adx_thresh': 20.063197833191488, 'atr_min_pct': 0.011912825281372524, 'atr_max_pct': 0.13519389246701427, 'tp_mult': 1.1579805148186457, 'tsl_mult': 0.059382170308095505, 'strategy': 'breakout', 'time_stop': 200, 'use_sma': False, 'use_atr': False, 'use_adx': False, 'use_ema': True, 'use_spike': True, 'rsi_required': False, 'edge_k': 1.418764079565475, 'edge_cap': 0.187631050985193}.
[I 2025-08-30 04:52:39,245] Trial 427 finished with values: [-1000000000.0, 1000000000.0] and parameters: {'p_sma': 8, 'p_std': 25, 'p_atr': 12, 'p_adx': 17, 'rsi_period': 17, 'ema1': 15, 'ema2': 56, 'slip_atr_k': 0.17552441906116695, 'slip_spread_k': 0.7809703335516034, 'spread_hl_frac': 0.003215699132556156, 'bb_std_mult': 3.279168081246675, 'rsi_os': 13, 'rsi_ob': 86, 'vol_spike': 0.17971528325982117, 'adx_thresh': 27.02861370569064, 'atr_min_pct': 0.001133118618633162, 'atr_max_pct': 0.14181885134742372, 'tp_mult': 1.9400514645372293, 'tsl_mult': 0.955134614971874, 'strategy': 'mean_reversion', 'time_stop': 103, 'use_sma': False, 'use_atr': True, 'use_adx': True, 'use_ema': True, 'use_spike': True, 'rsi_required': True, 'edge_k': 1.2215395335467023, 'edge_cap': 0.3683787710395433}.
[I 2025-08-30 04:52:40,183] Trial 426 finished with values: [-1000000000.0, 1000000000.0] and parameters: {'p_sma': 19, 'p_std': 56, 'p_atr': 12, 'p_adx': 25, 'rsi_period': 39, 'ema1': 17, 'ema2': 60, 'slip_atr_k': 0.00028031822848451245, 'slip_spread_k': 0.7852110994614624, 'spread_hl_frac': 0.009773636338276648, 'bb_std_mult': 1.5199565352476305, 'rsi_os': 16, 'rsi_ob': 64, 'vol_spike': 0.21118794199620058, 'adx_thresh': 15.819319941333061, 'atr_min_pct': 5.792942947291393e-05, 'atr_max_pct': 0.14203033220029893, 'tp_mult': 1.8369161425529688, 'tsl_mult': 0.2520956072270375, 'strategy': 'mean_reversion', 'time_stop': 205, 'use_sma': False, 'use_atr': True, 'use_adx': True, 'use_ema': True, 'use_spike': True, 'rsi_required': True, 'edge_k': 1.5801001929571161, 'edge_cap': 0.5823730772302554}.
[I 2025-08-30 04:52:41,192] Trial 425 finished with values: [-1000000000.0, 1000000000.0] and parameters: {'p_sma': 53, 'p_std': 52, 'p_atr': 17, 'p_adx': 25, 'rsi_period': 53, 'ema1': 11, 'ema2': 53, 'slip_atr_k': 0.00016838722667811452, 'slip_spread_k': 0.7698280298383812, 'spread_hl_frac': 0.002678529407184327, 'bb_std_mult': 3.5281612504475826, 'rsi_os': 13, 'rsi_ob': 68, 'vol_spike': 0.17993310362749576, 'adx_thresh': 8.826770945511111, 'atr_min_pct': 1.1888570401318313e-05, 'atr_max_pct': 0.13536249816327825, 'tp_mult': 1.6155365053905129, 'tsl_mult': 0.056024595159646196, 'strategy': 'breakout', 'time_stop': 75, 'use_sma': False, 'use_atr': True, 'use_adx': True, 'use_ema': True, 'use_spike': True, 'rsi_required': False, 'edge_k': 1.4252086673910962, 'edge_cap': 0.19598576506622517}.
[I 2025-08-30 04:52:41,946] Trial 424 finished with values: [-1000000000.0, 1000000000.0] and parameters: {'p_sma': 39, 'p_std': 52, 'p_atr': 9, 'p_adx': 7, 'rsi_period': 67, 'ema1': 11, 'ema2': 31, 'slip_atr_k': 0.014788926198510756, 'slip_spread_k': 0.9427444820329607, 'spread_hl_frac': 0.028487758758707935, 'bb_std_mult': 3.5473708430935478, 'rsi_os': 19, 'rsi_ob': 64, 'vol_spike': 0.29319747907892446, 'adx_thresh': 29.809989733231244, 'atr_min_pct': 0.0010596301001512187, 'atr_max_pct': 0.14200119572639147, 'tp_mult': 1.9654403749015934, 'tsl_mult': 0.7036670291274199, 'strategy': 'breakout', 'time_stop': 200, 'use_sma': False, 'use_atr': False, 'use_adx': False, 'use_ema': True, 'use_spike': True, 'rsi_required': False, 'edge_k': 1.4258119388622665, 'edge_cap': 0.5756393946567258}.
[I 2025-08-30 04:53:27,759] Trial 429 finished with values: [-0.032962896972772215, 0.032910670917778384] and parameters: {'p_sma': 10, 'p_std': 47, 'p_atr': 9, 'p_adx': 7, 'rsi_period': 23, 'ema1': 15, 'ema2': 26, 'slip_atr_k': 0.12532794619792914, 'slip_spread_k': 0.7642470835311094, 'spread_hl_frac': 0.005100902318920169, 'bb_std_mult': 3.5420242261798256, 'rsi_os': 23, 'rsi_ob': 76, 'vol_spike': 0.19601942538828301, 'adx_thresh': 20.988540885981358, 'atr_min_pct': 0.0005919913142345197, 'atr_max_pct': 0.13764161374302814, 'tp_mult': 1.3860537320897492, 'tsl_mult': 0.2015612902336546, 'strategy': 'breakout', 'time_stop': 238, 'use_sma': True, 'use_atr': False, 'use_adx': False, 'use_ema': True, 'use_spike': False, 'rsi_required': False, 'edge_k': 1.4565187469501248, 'edge_cap': 0.6267713293390295}.
[I 2025-08-30 04:53:27,732] Trial 430 finished with values: [-1000000000.0, 1000000000.0] and parameters: {'p_sma': 10, 'p_std': 47, 'p_atr': 9, 'p_adx': 26, 'rsi_period': 22, 'ema1': 29, 'ema2': 27, 'slip_atr_k': 0.011765622266021611, 'slip_spread_k': 0.9528718253841684, 'spread_hl_frac': 0.015479326777506349, 'bb_std_mult': 3.380697762753946, 'rsi_os': 54, 'rsi_ob': 55, 'vol_spike': 0.19546572959554312, 'adx_thresh': 29.52855729961628, 'atr_min_pct': 0.005671209115007165, 'atr_max_pct': 0.14994515871582592, 'tp_mult': 1.3691390646623807, 'tsl_mult': 0.19681209067122143, 'strategy': 'breakout', 'time_stop': 145, 'use_sma': True, 'use_atr': False, 'use_adx': False, 'use_ema': True, 'use_spike': False, 'rsi_required': False, 'edge_k': 1.703680060170551, 'edge_cap': 0.627747258147804}.
[I 2025-08-30 04:53:28,584] Trial 431 finished with values: [-1000000000.0, 1000000000.0] and parameters: {'p_sma': 42, 'p_std': 47, 'p_atr': 25, 'p_adx': 12, 'rsi_period': 22, 'ema1': 19, 'ema2': 26, 'slip_atr_k': 0.009352545305885428, 'slip_spread_k': 0.7539941789463259, 'spread_hl_frac': 0.03619653540657417, 'bb_std_mult': 3.346798806942425, 'rsi_os': 10, 'rsi_ob': 76, 'vol_spike': 0.19474303327439346, 'adx_thresh': 6.349613081332219, 'atr_min_pct': 0.024965229162873734, 'atr_max_pct': 0.14998535078265507, 'tp_mult': 1.380130077673288, 'tsl_mult': 0.9982592366044359, 'strategy': 'breakout', 'time_stop': 206, 'use_sma': True, 'use_atr': False, 'use_adx': False, 'use_ema': True, 'use_spike': False, 'rsi_required': False, 'edge_k': 1.468719750732054, 'edge_cap': 0.6233881364520328}.
[I 2025-08-30 04:53:29,773] Trial 428 finished with values: [-1000000000.0, 1000000000.0] and parameters: {'p_sma': 19, 'p_std': 18, 'p_atr': 10, 'p_adx': 25, 'rsi_period': 53, 'ema1': 30, 'ema2': 26, 'slip_atr_k': 0.12511935033430116, 'slip_spread_k': 0.9506690442688335, 'spread_hl_frac': 9.355961332064427e-05, 'bb_std_mult': 3.538171200172567, 'rsi_os': 23, 'rsi_ob': 64, 'vol_spike': 0.2926780347134638, 'adx_thresh': 30.059450614170814, 'atr_min_pct': 4.085083459267775e-05, 'atr_max_pct': 0.14228780386082285, 'tp_mult': 1.8402194858182088, 'tsl_mult': 0.24724501392784767, 'strategy': 'breakout', 'time_stop': 75, 'use_sma': False, 'use_atr': False, 'use_adx': False, 'use_ema': True, 'use_spike': True, 'rsi_required': False, 'edge_k': 0.9577128807313099, 'edge_cap': 0.5893635314455932}.
