[I 2025-08-30 04:43:32,754] Trial 378 finished with values: [-0.0963451117811599, 0.096328802665747] and parameters: {'p_sma': 44, 'p_std': 54, 'p_atr': 20, 'p_adx': 21, 'rsi_period': 28, 'ema1': 14, 'ema2': 30, 'slip_atr_k': 0.00744923764182211, 'slip_spread_k': 0.7541657116733804, 'spread_hl_frac': 0.008832279895341341, 'bb_std_mult': 2.5599775733441295, 'rsi_os': 35, 'rsi_ob': 65, 'vol_spike': 0.07290733797845907, 'adx_thresh': 31.134903893630845, 'atr_min_pct': 4.645610981788919e-06, 'atr_max_pct': 0.14470308101666934, 'tp_mult': 1.982994200177496, 'tsl_mult': 0.2025168279549296, 'strategy': 'breakout', 'time_stop': 186, 'use_sma': False, 'use_atr': False, 'use_adx': False, 'use_ema': True, 'use_spike': True, 'rsi_required': False, 'edge_k': 1.1862367671541458, 'edge_cap': 0.4804888766369076}.
[I 2025-08-30 04:44:13,319] Trial 382 finished with values: [-1000000000.0, 1000000000.0] and parameters: {'p_sma': 8, 'p_std': 54, 'p_atr': 8, 'p_adx': 25, 'rsi_period': 68, 'ema1': 14, 'ema2': 28, 'slip_atr_k': 0.012441611249754982, 'slip_spread_k': 0.7330611992665544, 'spread_hl_frac': 0.01018537914433086, 'bb_std_mult': 3.3966305452473553, 'rsi_os': 24, 'rsi_ob': 66, 'vol_spike': 0.16253018755975535, 'adx_thresh': 30.20244373434234, 'atr_min_pct': 0.006064413078714158, 'atr_max_pct': 0.05260784298229321, 'tp_mult': 1.7993054353374185, 'tsl_mult': 0.25503780084428895, 'strategy': 'mean_reversion', 'time_stop': 281, 'use_sma': False, 'use_atr': True, 'use_adx': False, 'use_ema': False, 'use_spike': False, 'rsi_required': False, 'edge_k': 1.549966657469277, 'edge_cap': 0.6151002295104067}.
[I 2025-08-30 04:44:15,693] Trial 379 finished with values: [-1000000000.0, 1000000000.0] and parameters: {'p_sma': 44, 'p_std': 54, 'p_atr': 7, 'p_adx': 25, 'rsi_period': 28, 'ema1': 14, 'ema2': 30, 'slip_atr_k': 0.17043349667906887, 'slip_spread_k': 0.9813078947697023, 'spread_hl_frac': 0.009971209486895503, 'bb_std_mult': 1.6224389115551845, 'rsi_os': 20, 'rsi_ob': 65, 'vol_spike': 0.05151104703314967, 'adx_thresh': 30.857916463206926, 'atr_min_pct': 0.018430357974989053, 'atr_max_pct': 0.09691611532622536, 'tp_mult': 2.301346286464642, 'tsl_mult': 0.8822780709533071, 'strategy': 'breakout', 'time_stop': 284, 'use_sma': False, 'use_atr': False, 'use_adx': False, 'use_ema': True, 'use_spike': True, 'rsi_required': False, 'edge_k': 1.539513970637527, 'edge_cap': 0.6273891151041453}.
[I 2025-08-30 04:44:16,155] Trial 381 finished with values: [-1000000000.0, 1000000000.0] and parameters: {'p_sma': 51, 'p_std': 33, 'p_atr': 8, 'p_adx': 25, 'rsi_period': 28, 'ema1': 14, 'ema2': 30, 'slip_atr_k': 0.015023637238862853, 'slip_spread_k': 0.7556330035145462, 'spread_hl_frac': 0.010052039556459887, 'bb_std_mult': 3.409466108126329, 'rsi_os': 36, 'rsi_ob': 65, 'vol_spike': 0.05285152893332948, 'adx_thresh': 32.552165663939824, 'atr_min_pct': 0.0006441709950631793, 'atr_max_pct': 0.05272511216709518, 'tp_mult': 1.790189372889026, 'tsl_mult': 0.8862622015938737, 'strategy': 'mean_reversion', 'time_stop': 288, 'use_sma': False, 'use_atr': True, 'use_adx': False, 'use_ema': True, 'use_spike': False, 'rsi_required': False, 'edge_k': 0.12143484719184627, 'edge_cap': 0.6206852612276648}.
[I 2025-08-30 04:44:16,429] Trial 380 finished with values: [-0.043768524071145065, 0.043712682838801434] and parameters: {'p_sma': 44, 'p_std': 18, 'p_atr': 7, 'p_adx': 25, 'rsi_period': 21, 'ema1': 14, 'ema2': 30, 'slip_atr_k': 0.17107108832038198, 'slip_spread_k': 0.7532368673267392, 'spread_hl_frac': 0.025869752148206703, 'bb_std_mult': 2.555548007493996, 'rsi_os': 20, 'rsi_ob': 65, 'vol_spike': 0.014598613937936461, 'adx_thresh': 30.999574437165304, 'atr_min_pct': 8.090886341355859e-07, 'atr_max_pct': 0.1449399227802561, 'tp_mult': 1.978772941094852, 'tsl_mult': 0.2929643371618782, 'strategy': 'breakout', 'time_stop': 218, 'use_sma': False, 'use_atr': False, 'use_adx': False, 'use_ema': True, 'use_spike': True, 'rsi_required': False, 'edge_k': 1.3286431664130174, 'edge_cap': 0.6224620153764056}.
[I 2025-08-30 04:44:58,429] Trial 386 finished with values: [-0.023167180516900365, 0.023095948131821628] and parameters: {'p_sma': 10, 'p_std': 51, 'p_atr': 11, 'p_adx': 12, 'rsi_period': 22, 'ema1': 16, 'ema2': 48, 'slip_atr_k': 0.0053515226025493716, 'slip_spread_k': 0.0018188291084414998, 'spread_hl_frac': 0.011782144392467888, 'bb_std_mult': 3.3395886871482126, 'rsi_os': 27, 'rsi_ob': 68, 'vol_spike': 0.0385719671313423, 'adx_thresh': 19.81027920517185, 'atr_min_pct': 0.0017461623606538149, 'atr_max_pct': 0.14969972334407744, 'tp_mult': 2.495974774575237, 'tsl_mult': 0.2253310361378596, 'strategy': 'breakout', 'time_stop': 227, 'use_sma': True, 'use_atr': False, 'use_adx': True, 'use_ema': False, 'use_spike': True, 'rsi_required': True, 'edge_k': 0.5050630753831458, 'edge_cap': 0.6577520654644149}.
[I 2025-08-30 04:45:00,153] Trial 385 finished with values: [-1000000000.0, 1000000000.0] and parameters: {'p_sma': 9, 'p_std': 49, 'p_atr': 8, 'p_adx': 24, 'rsi_period': 22, 'ema1': 16, 'ema2': 26, 'slip_atr_k': 3.032481770352119e-05, 'slip_spread_k': 0.8263353880285358, 'spread_hl_frac': 0.007624164604058036, 'bb_std_mult': 3.342013819442598, 'rsi_os': 28, 'rsi_ob': 67, 'vol_spike': 0.18876240027785912, 'adx_thresh': 31.57399979076812, 'atr_min_pct': 0.0174158732733525, 'atr_max_pct': 0.14978908868135063, 'tp_mult': 2.512207723035968, 'tsl_mult': 0.3739536826598052, 'strategy': 'breakout', 'time_stop': 211, 'use_sma': True, 'use_atr': False, 'use_adx': True, 'use_ema': True, 'use_spike': True, 'rsi_required': True, 'edge_k': 1.7588461377154547, 'edge_cap': 0.34890384039714284}.
[I 2025-08-30 04:45:00,530] Trial 383 finished with values: [-1000000000.0, 1000000000.0] and parameters: {'p_sma': 9, 'p_std': 51, 'p_atr': 27, 'p_adx': 25, 'rsi_period': 32, 'ema1': 16, 'ema2': 25, 'slip_atr_k': 0.00375869554523603, 'slip_spread_k': 0.7606429117380649, 'spread_hl_frac': 0.03874095424597797, 'bb_std_mult': 1.5877409307418, 'rsi_os': 20, 'rsi_ob': 68, 'vol_spike': 0.18930016839730546, 'adx_thresh': 19.46983162044041, 'atr_min_pct': 0.018614072171044913, 'atr_max_pct': 0.14764368057014296, 'tp_mult': 2.491277678746725, 'tsl_mult': 0.8868684232447567, 'strategy': 'breakout', 'time_stop': 139, 'use_sma': False, 'use_atr': False, 'use_adx': False, 'use_ema': True, 'use_spike': True, 'rsi_required': True, 'edge_k': 1.4136239880472186, 'edge_cap': 0.21954742540104039}.
[I 2025-08-30 04:45:01,071] Trial 384 finished with values: [-0.0811680218767431, 0.08112192009221139] and parameters: {'p_sma': 51, 'p_std': 49, 'p_atr': 8, 'p_adx': 24, 'rsi_period': 32, 'ema1': 22, 'ema2': 25, 'slip_atr_k': 0.0033146983458413612, 'slip_spread_k': 0.7033410700535278, 'spread_hl_frac': 0.03728851427353097, 'bb_std_mult': 1.3378815601505731, 'rsi_os': 36, 'rsi_ob': 92, 'vol_spike': 0.17004533356483917, 'adx_thresh': 31.71745000875678, 'atr_min_pct': 0.0005308499359601535, 'atr_max_pct': 0.08124669305908175, 'tp_mult': 1.7657864869156057, 'tsl_mult': 0.1333413194296506, 'strategy': 'breakout', 'time_stop': 292, 'use_sma': False, 'use_atr': False, 'use_adx': False, 'use_ema': True, 'use_spike': True, 'rsi_required': True, 'edge_k': 0.824137631134177, 'edge_cap': 0.6568868056043824}.
[I 2025-08-30 04:45:42,502] Trial 389 finished with values: [-1000000000.0, 1000000000.0] and parameters: {'p_sma': 7, 'p_std': 53, 'p_atr': 11, 'p_adx': 26, 'rsi_period': 21, 'ema1': 15, 'ema2': 28, 'slip_atr_k': 0.0090470379047378, 'slip_spread_k': 0.7263764428428778, 'spread_hl_frac': 0.011453802715697098, 'bb_std_mult': 0.8595099149192491, 'rsi_os': 27, 'rsi_ob': 88, 'vol_spike': 0.20447841106495493, 'adx_thresh': 10.115694216194033, 'atr_min_pct': 0.0036925330570877126, 'atr_max_pct': 0.13939292489001892, 'tp_mult': 1.8796486573700482, 'tsl_mult': 0.22476059682695954, 'strategy': 'mean_reversion', 'time_stop': 115, 'use_sma': True, 'use_atr': True, 'use_adx': True, 'use_ema': False, 'use_spike': False, 'rsi_required': False, 'edge_k': 0.25646399280134413, 'edge_cap': 0.6564438702330293}.
[I 2025-08-30 04:45:42,937] Trial 387 finished with values: [-1000000000.0, 1000000000.0] and parameters: {'p_sma': 7, 'p_std': 50, 'p_atr': 27, 'p_adx': 24, 'rsi_period': 21, 'ema1': 24, 'ema2': 25, 'slip_atr_k': 0.1453895110107594, 'slip_spread_k': 0.3472138703030669, 'spread_hl_frac': 0.01892446532482731, 'bb_std_mult': 0.8386162825748948, 'rsi_os': 12, 'rsi_ob': 52, 'vol_spike': 0.1699698659762263, 'adx_thresh': 31.80674822917275, 'atr_min_pct': 0.00434443409050638, 'atr_max_pct': 0.14973485649094134, 'tp_mult': 1.8679342048688925, 'tsl_mult': 0.13150062139334182, 'strategy': 'breakout', 'time_stop': 154, 'use_sma': True, 'use_atr': False, 'use_adx': True, 'use_ema': False, 'use_spike': True, 'rsi_required': True, 'edge_k': 1.4305567308525358, 'edge_cap': 0.7923681918323506}.
[I 2025-08-30 04:45:43,183] Trial 390 finished with values: [-1000000000.0, 1000000000.0] and parameters: {'p_sma': 7, 'p_std': 36, 'p_atr': 11, 'p_adx': 26, 'rsi_period': 20, 'ema1': 15, 'ema2': 28, 'slip_atr_k': 0.006777400208840958, 'slip_spread_k': 0.32491017418152324, 'spread_hl_frac': 0.011309660110087785, 'bb_std_mult': 0.846475208981385, 'rsi_os': 22, 'rsi_ob': 68, 'vol_spike': 0.24229558221577074, 'adx_thresh': 32.85311336907924, 'atr_min_pct': 0.0017386957517677012, 'atr_max_pct': 0.14062946192931036, 'tp_mult': 2.6351082191892052, 'tsl_mult': 0.22230410181636917, 'strategy': 'mean_reversion', 'time_stop': 82, 'use_sma': True, 'use_atr': True, 'use_adx': True, 'use_ema': False, 'use_spike': False, 'rsi_required': False, 'edge_k': 0.26447456867052366, 'edge_cap': 0.6699535564140622}.
[I 2025-08-30 04:45:43,356] Trial 388 finished with values: [-1000000000.0, 1000000000.0] and parameters: {'p_sma': 7, 'p_std': 36, 'p_atr': 10, 'p_adx': 26, 'rsi_period': 20, 'ema1': 26, 'ema2': 25, 'slip_atr_k': 0.14531621686711427, 'slip_spread_k': 0.34233835598584683, 'spread_hl_frac': 0.018490033362592834, 'bb_std_mult': 1.1760720559258129, 'rsi_os': 27, 'rsi_ob': 68, 'vol_spike': 0.1407584075144754, 'adx_thresh': 18.30587229571919, 'atr_min_pct': 0.003592004888013745, 'atr_max_pct': 0.14143852172913393, 'tp_mult': 1.9068965465645444, 'tsl_mult': 0.5915759661398864, 'strategy': 'mean_reversion', 'time_stop': 227, 'use_sma': True, 'use_atr': True, 'use_adx': True, 'use_ema': False, 'use_spike': False, 'rsi_required': True, 'edge_k': 1.4464629537358016, 'edge_cap': 0.6625348939954475}.
[I 2025-08-30 04:46:26,710] Trial 392 finished with values: [-1000000000.0, 1000000000.0] and parameters: {'p_sma': 10, 'p_std': 35, 'p_atr': 18, 'p_adx': 26, 'rsi_period': 15, 'ema1': 25, 'ema2': 28, 'slip_atr_k': 0.07392941653608415, 'slip_spread_k': 0.7264504596943009, 'spread_hl_frac': 0.01095294496703715, 'bb_std_mult': 3.465389037778352, 'rsi_os': 25, 'rsi_ob': 68, 'vol_spike': 0.27919209602531103, 'adx_thresh': 32.423686899373784, 'atr_min_pct': 0.002004944849831965, 'atr_max_pct': 0.06634274576756985, 'tp_mult': 1.9221141757560003, 'tsl_mult': 0.7211936247281246, 'strategy': 'mean_reversion', 'time_stop': 235, 'use_sma': False, 'use_atr': True, 'use_adx': False, 'use_ema': True, 'use_spike': False, 'rsi_required': False, 'edge_k': 0.48902582225583746, 'edge_cap': 0.6818118318143012}.
[I 2025-08-30 04:46:26,734] Trial 391 finished with values: [-1000000000.0, 1000000000.0] and parameters: {'p_sma': 11, 'p_std': 50, 'p_atr': 17, 'p_adx': 26, 'rsi_period': 20, 'ema1': 24, 'ema2': 27, 'slip_atr_k': 0.07527519719028546, 'slip_spread_k': 0.7358138382621179, 'spread_hl_frac': 0.011263763801295174, 'bb_std_mult': 3.4407782335666064, 'rsi_os': 22, 'rsi_ob': 48, 'vol_spike': 0.178378392159712, 'adx_thresh': 32.31336815482707, 'atr_min_pct': 0.0015145426332855818, 'atr_max_pct': 0.14203555341122567, 'tp_mult': 1.902990164936045, 'tsl_mult': 0.5941742355379537, 'strategy': 'breakout', 'time_stop': 84, 'use_sma': False, 'use_atr': False, 'use_adx': False, 'use_ema': False, 'use_spike': True, 'rsi_required': False, 'edge_k': 0.5055397743768741, 'edge_cap': 0.7911942609981011}.
[I 2025-08-30 04:46:27,092] Trial 393 finished with values: [-1000000000.0, 1000000000.0] and parameters: {'p_sma': 10, 'p_std': 55, 'p_atr': 25, 'p_adx': 19, 'rsi_period': 18, 'ema1': 16, 'ema2': 52, 'slip_atr_k': 0.07415305437077035, 'slip_spread_k': 0.3881329573962847, 'spread_hl_frac': 0.01263459112562638, 'bb_std_mult': 1.1878072168950546, 'rsi_os': 25, 'rsi_ob': 64, 'vol_spike': 0.13791624134901515, 'adx_thresh': 29.891622630227697, 'atr_min_pct': 0.008833756184187205, 'atr_max_pct': 0.06957656940145214, 'tp_mult': 2.855514335984834, 'tsl_mult': 0.591517140133148, 'strategy': 'breakout', 'time_stop': 202, 'use_sma': False, 'use_atr': False, 'use_adx': False, 'use_ema': True, 'use_spike': True, 'rsi_required': False, 'edge_k': 0.5006788513742944, 'edge_cap': 0.8575347915350635}.
[I 2025-08-30 04:46:27,594] Trial 394 finished with values: [-1000000000.0, 1000000000.0] and parameters: {'p_sma': 36, 'p_std': 46, 'p_atr': 15, 'p_adx': 9, 'rsi_period': 18, 'ema1': 9, 'ema2': 45, 'slip_atr_k': 0.0142816693342295, 'slip_spread_k': 0.38174178752436844, 'spread_hl_frac': 0.012661639320257842, 'bb_std_mult': 3.4634249040412035, 'rsi_os': 23, 'rsi_ob': 83, 'vol_spike': 0.17757140352451914, 'adx_thresh': 7.138160488467884, 'atr_min_pct': 0.021740846893425758, 'atr_max_pct': 0.14316000341964205, 'tp_mult': 1.8251909644280107, 'tsl_mult': 0.23801884013191618, 'strategy': 'breakout', 'time_stop': 299, 'use_sma': False, 'use_atr': False, 'use_adx': False, 'use_ema': True, 'use_spike': True, 'rsi_required': False, 'edge_k': 1.3895531780800636, 'edge_cap': 0.9847417691786634}.
[I 2025-08-30 04:47:14,804] Trial 395 finished with values: [-1000000000.0, 1000000000.0] and parameters: {'p_sma': 10, 'p_std': 55, 'p_atr': 15, 'p_adx': 22, 'rsi_period': 18, 'ema1': 15, 'ema2': 35, 'slip_atr_k': 0.10551127192762268, 'slip_spread_k': 0.0034400813339513503, 'spread_hl_frac': 0.01296358544291315, 'bb_std_mult': 2.4077845340681256, 'rsi_os': 23, 'rsi_ob': 54, 'vol_spike': 0.09808025145107666, 'adx_thresh': 30.31149819230105, 'atr_min_pct': 0.026602366541725708, 'atr_max_pct': 0.1472563696814582, 'tp_mult': 2.84983985373976, 'tsl_mult': 0.15554367028593832, 'strategy': 'breakout', 'time_stop': 203, 'use_sma': False, 'use_atr': False, 'use_adx': False, 'use_ema': True, 'use_spike': True, 'rsi_required': False, 'edge_k': 1.3771451425668795, 'edge_cap': 0.41025451073347013}.
[I 2025-08-30 04:47:15,393] Trial 398 finished with values: [-1000000000.0, 1000000000.0] and parameters: {'p_sma': 8, 'p_std': 51, 'p_atr': 10, 'p_adx': 12, 'rsi_period': 57, 'ema1': 15, 'ema2': 29, 'slip_atr_k': 0.009638987925129627, 'slip_spread_k': 0.9991500105530475, 'spread_hl_frac': 0.020970135787679336, 'bb_std_mult': 3.1524061241712222, 'rsi_os': 16, 'rsi_ob': 90, 'vol_spike': 0.1964859447846048, 'adx_thresh': 11.667146776349968, 'atr_min_pct': 0.01128807158503022, 'atr_max_pct': 0.028492188616989413, 'tp_mult': 2.7999295224311043, 'tsl_mult': 0.40715608899068473, 'strategy': 'breakout', 'time_stop': 207, 'use_sma': False, 'use_atr': False, 'use_adx': False, 'use_ema': True, 'use_spike': True, 'rsi_required': False, 'edge_k': 0.31755214957334854, 'edge_cap': 0.4190558190900708}.
[I 2025-08-30 04:47:15,407] Trial 397 finished with values: [-1000000000.0, 1000000000.0] and parameters: {'p_sma': 14, 'p_std': 53, 'p_atr': 9, 'p_adx': 14, 'rsi_period': 8, 'ema1': 9, 'ema2': 29, 'slip_atr_k': 0.10737177001034569, 'slip_spread_k': 0.2674776817316491, 'spread_hl_frac': 0.007914660965468733, 'bb_std_mult': 3.35200252570194, 'rsi_os': 23, 'rsi_ob': 71, 'vol_spike': 0.18175803880060815, 'adx_thresh': 14.140073565816621, 'atr_min_pct': 0.02994810772322667, 'atr_max_pct': 0.14554791820706198, 'tp_mult': 2.801139098867302, 'tsl_mult': 0.16481970490786427, 'strategy': 'breakout', 'time_stop': 206, 'use_sma': False, 'use_atr': False, 'use_adx': False, 'use_ema': True, 'use_spike': True, 'rsi_required': False, 'edge_k': 1.3698192363863873, 'edge_cap': 0.6452594221846792}.
[I 2025-08-30 04:47:15,635] Trial 396 finished with values: [-0.08698715712705907, 0.08696902942704438] and parameters: {'p_sma': 60, 'p_std': 55, 'p_atr': 13, 'p_adx': 9, 'rsi_period': 18, 'ema1': 9, 'ema2': 29, 'slip_atr_k': 0.017577147319031355, 'slip_spread_k': 0.4090948162193769, 'spread_hl_frac': 0.013031102978863101, 'bb_std_mult': 3.359780479072463, 'rsi_os': 26, 'rsi_ob': 94, 'vol_spike': 0.09799785261605076, 'adx_thresh': 13.50003737237353, 'atr_min_pct': 0.0005838348107486338, 'atr_max_pct': 0.09276120106608454, 'tp_mult': 2.846539465103471, 'tsl_mult': 0.2276284667357283, 'strategy': 'breakout', 'time_stop': 123, 'use_sma': False, 'use_atr': False, 'use_adx': False, 'use_ema': True, 'use_spike': True, 'rsi_required': False, 'edge_k': 1.3607112085759863, 'edge_cap': 0.42363803787925514}.
[I 2025-08-30 04:48:01,031] Trial 402 finished with values: [-1000000000.0, 1000000000.0] and parameters: {'p_sma': 5, 'p_std': 59, 'p_atr': 26, 'p_adx': 25, 'rsi_period': 23, 'ema1': 15, 'ema2': 27, 'slip_atr_k': 0.00044335323994395843, 'slip_spread_k': 0.43268542507576235, 'spread_hl_frac': 0.006130434139376313, 'bb_std_mult': 3.5811710303955673, 'rsi_os': 24, 'rsi_ob': 66, 'vol_spike': 0.1813276052960813, 'adx_thresh': 31.84506647714719, 'atr_min_pct': 0.0009766417312823497, 'atr_max_pct': 0.06040895159759881, 'tp_mult': 1.7469393193875657, 'tsl_mult': 0.3209846256289719, 'strategy': 'breakout', 'time_stop': 215, 'use_sma': False, 'use_atr': False, 'use_adx': False, 'use_ema': True, 'use_spike': True, 'rsi_required': True, 'edge_k': 1.6496746461078384, 'edge_cap': 0.1266971353110613}.
[I 2025-08-30 04:48:01,646] Trial 399 finished with values: [-1000000000.0, 1000000000.0] and parameters: {'p_sma': 8, 'p_std': 51, 'p_atr': 26, 'p_adx': 25, 'rsi_period': 23, 'ema1': 15, 'ema2': 27, 'slip_atr_k': 0.11912392014850352, 'slip_spread_k': 0.7610182599260722, 'spread_hl_frac': 0.009402829326246444, 'bb_std_mult': 1.785999795612127, 'rsi_os': 7, 'rsi_ob': 94, 'vol_spike': 0.18453836702454776, 'adx_thresh': 12.803400023196446, 'atr_min_pct': 0.0005496422572004418, 'atr_max_pct': 0.12559946756715462, 'tp_mult': 1.753809369840438, 'tsl_mult': 0.32022175141824916, 'strategy': 'breakout', 'time_stop': 216, 'use_sma': False, 'use_atr': False, 'use_adx': False, 'use_ema': True, 'use_spike': True, 'rsi_required': True, 'edge_k': 1.6293739052414193, 'edge_cap': 0.6026434271039984}.
[I 2025-08-30 04:48:02,139] Trial 400 finished with values: [-0.06052297501410253, 0.060477113294601426] and parameters: {'p_sma': 5, 'p_std': 53, 'p_atr': 9, 'p_adx': 8, 'rsi_period': 23, 'ema1': 16, 'ema2': 27, 'slip_atr_k': 2.4206938288745886e-05, 'slip_spread_k': 0.053605036004311823, 'spread_hl_frac': 0.008474998691627668, 'bb_std_mult': 3.3557990720666453, 'rsi_os': 55, 'rsi_ob': 66, 'vol_spike': 0.18299734047036273, 'adx_thresh': 33.140059704396485, 'atr_min_pct': 0.0005294443727398091, 'atr_max_pct': 0.01634989077641147, 'tp_mult': 1.572842354033204, 'tsl_mult': 0.9273907296496414, 'strategy': 'breakout', 'time_stop': 96, 'use_sma': False, 'use_atr': False, 'use_adx': False, 'use_ema': True, 'use_spike': True, 'rsi_required': False, 'edge_k': 1.5404669389619674, 'edge_cap': 0.11707560182867621}.
[I 2025-08-30 04:48:02,464] Trial 401 finished with values: [-0.01567215273965228, 0.015629597085560748] and parameters: {'p_sma': 60, 'p_std': 21, 'p_atr': 9, 'p_adx': 15, 'rsi_period': 66, 'ema1': 15, 'ema2': 27, 'slip_atr_k': 0.00027272751455781775, 'slip_spread_k': 0.8151699749435339, 'spread_hl_frac': 0.009143051428938117, 'bb_std_mult': 3.5933960574494854, 'rsi_os': 7, 'rsi_ob': 66, 'vol_spike': 0.18246899550697976, 'adx_thresh': 33.17171219408272, 'atr_min_pct': 0.0005725111664669024, 'atr_max_pct': 0.01546299096310004, 'tp_mult': 1.8368307494338754, 'tsl_mult': 0.8304689831867251, 'strategy': 'breakout', 'time_stop': 214, 'use_sma': False, 'use_atr': False, 'use_adx': False, 'use_ema': True, 'use_spike': True, 'rsi_required': True, 'edge_k': 1.5125318739006517, 'edge_cap': 0.11818631441331173}.
[I 2025-08-30 04:48:46,498] Trial 405 finished with values: [-1000000000.0, 1000000000.0] and parameters: {'p_sma': 12, 'p_std': 57, 'p_atr': 10, 'p_adx': 24, 'rsi_period': 65, 'ema1': 16, 'ema2': 48, 'slip_atr_k': 0.006549895731430726, 'slip_spread_k': 0.19789467256195975, 'spread_hl_frac': 0.03454861623600049, 'bb_std_mult': 0.5931666706071865, 'rsi_os': 25, 'rsi_ob': 64, 'vol_spike': 0.035646314912261626, 'adx_thresh': 5.636494844548302, 'atr_min_pct': 0.0026225371964630484, 'atr_max_pct': 0.1476081519576766, 'tp_mult': 1.830603713434893, 'tsl_mult': 0.8160517338311695, 'strategy': 'mean_reversion', 'time_stop': 196, 'use_sma': True, 'use_atr': True, 'use_adx': True, 'use_ema': False, 'use_spike': False, 'rsi_required': False, 'edge_k': 1.4595342170187282, 'edge_cap': 0.29740623004687256}.
[I 2025-08-30 04:48:46,846] Trial 404 finished with values: [-0.031919554596386845, 0.031911965730879184] and parameters: {'p_sma': 56, 'p_std': 53, 'p_atr': 9, 'p_adx': 15, 'rsi_period': 26, 'ema1': 16, 'ema2': 48, 'slip_atr_k': 0.005490030081158115, 'slip_spread_k': 0.768678331963933, 'spread_hl_frac': 0.03243810762181888, 'bb_std_mult': 3.4109838597382356, 'rsi_os': 25, 'rsi_ob': 79, 'vol_spike': 0.19163229763866532, 'adx_thresh': 23.440470007594996, 'atr_min_pct': 0.0011511484162356725, 'atr_max_pct': 0.016547540492450497, 'tp_mult': 1.8400116267756346, 'tsl_mult': 0.8345080070189008, 'strategy': 'mean_reversion', 'time_stop': 192, 'use_sma': True, 'use_atr': True, 'use_adx': True, 'use_ema': False, 'use_spike': False, 'rsi_required': False, 'edge_k': 1.5583777853615948, 'edge_cap': 0.6417160667566406}.
