[I 2025-08-30 04:02:42,289] Trial 164 finished with values: [-1000000000.0, 1000000000.0] and parameters: {'p_sma': 23, 'p_std': 23, 'p_atr': 30, 'p_adx': 22, 'rsi_period': 75, 'ema1': 6, 'ema2': 11, 'slip_atr_k': 0.21131400158646418, 'slip_spread_k': 0.6942421497223527, 'spread_hl_frac': 0.0413481774062219, 'bb_std_mult': 2.9659460429083637, 'rsi_os': 45, 'rsi_ob': 64, 'vol_spike': 0.14124860503456396, 'adx_thresh': 30.777622747798205, 'atr_min_pct': 0.0014492499614715203, 'atr_max_pct': 0.10394582449929932, 'tp_mult': 1.7636571947647888, 'tsl_mult': 0.45266095281345176, 'strategy': 'mean_reversion', 'time_stop': 16, 'use_sma': True, 'use_atr': True, 'use_adx': False, 'use_ema': False, 'use_spike': False, 'rsi_required': True, 'edge_k': 1.586489827613098, 'edge_cap': 0.8234473165348237}.
[I 2025-08-30 04:02:42,769] Trial 162 finished with values: [-0.04767034441803186, 0.0475997762353558] and parameters: {'p_sma': 19, 'p_std': 20, 'p_atr': 30, 'p_adx': 28, 'rsi_period': 65, 'ema1': 5, 'ema2': 11, 'slip_atr_k': 0.21405204062682714, 'slip_spread_k': 0.702311318709254, 'spread_hl_frac': 0.041089307837410396, 'bb_std_mult': 2.9282625653393515, 'rsi_os': 47, 'rsi_ob': 60, 'vol_spike': 0.14184550652919053, 'adx_thresh': 30.766149789760817, 'atr_min_pct': 0.00029254059787703747, 'atr_max_pct': 0.10601222975557577, 'tp_mult': 1.9762401347099405, 'tsl_mult': 0.4740012813050478, 'strategy': 'mean_reversion', 'time_stop': 18, 'use_sma': True, 'use_atr': True, 'use_adx': False, 'use_ema': False, 'use_spike': False, 'rsi_required': True, 'edge_k': 1.5965099817152102, 'edge_cap': 0.7617314860972049}.
[I 2025-08-30 04:02:43,156] Trial 161 finished with values: [-1000000000.0, 0.2587886330323999] and parameters: {'p_sma': 25, 'p_std': 20, 'p_atr': 30, 'p_adx': 11, 'rsi_period': 17, 'ema1': 27, 'ema2': 11, 'slip_atr_k': 0.21383233840899923, 'slip_spread_k': 0.7273785684080992, 'spread_hl_frac': 0.03830586150456833, 'bb_std_mult': 2.9186257106890903, 'rsi_os': 48, 'rsi_ob': 61, 'vol_spike': 0.14671962726525828, 'adx_thresh': 32.59887864136411, 'atr_min_pct': 2.083353212748904e-05, 'atr_max_pct': 0.10665325573358234, 'tp_mult': 1.7844989850487496, 'tsl_mult': 0.43987075514203705, 'strategy': 'mean_reversion', 'time_stop': 18, 'use_sma': True, 'use_atr': True, 'use_adx': False, 'use_ema': False, 'use_spike': False, 'rsi_required': True, 'edge_k': 1.2847310574448199, 'edge_cap': 0.7591229239083652}.
[I 2025-08-30 04:03:30,057] Trial 167 finished with values: [-1000000000.0, 0.22926083632043925] and parameters: {'p_sma': 27, 'p_std': 28, 'p_atr': 29, 'p_adx': 11, 'rsi_period': 25, 'ema1': 16, 'ema2': 12, 'slip_atr_k': 0.21665324224002647, 'slip_spread_k': 0.034390707923447394, 'spread_hl_frac': 0.042668800210919795, 'bb_std_mult': 2.812601342627615, 'rsi_os': 45, 'rsi_ob': 64, 'vol_spike': 0.17093730365512777, 'adx_thresh': 29.475434434812488, 'atr_min_pct': 5.429065547308946e-06, 'atr_max_pct': 0.01431580429158702, 'tp_mult': 1.876133539200255, 'tsl_mult': 0.4023148565089495, 'strategy': 'breakout', 'time_stop': 286, 'use_sma': True, 'use_atr': True, 'use_adx': True, 'use_ema': False, 'use_spike': False, 'rsi_required': True, 'edge_k': 0.8621192858063418, 'edge_cap': 0.7478310814203999}.
[I 2025-08-30 04:03:30,060] Trial 166 finished with values: [-1000000000.0, 0.16983312604533538] and parameters: {'p_sma': 20, 'p_std': 22, 'p_atr': 11, 'p_adx': 25, 'rsi_period': 17, 'ema1': 16, 'ema2': 12, 'slip_atr_k': 0.2151833937185333, 'slip_spread_k': 0.03688134788150749, 'spread_hl_frac': 0.04271383624884038, 'bb_std_mult': 1.0846960282614044, 'rsi_os': 43, 'rsi_ob': 61, 'vol_spike': 0.1737226021244205, 'adx_thresh': 30.412558524487284, 'atr_min_pct': 0.00010462782294646058, 'atr_max_pct': 0.09680789329073783, 'tp_mult': 1.872623060893326, 'tsl_mult': 0.39404306064011907, 'strategy': 'mean_reversion', 'time_stop': 17, 'use_sma': True, 'use_atr': True, 'use_adx': False, 'use_ema': False, 'use_spike': False, 'rsi_required': True, 'edge_k': 0.7337109593331743, 'edge_cap': 0.7565063050260524}.
[I 2025-08-30 04:03:30,060] Trial 165 finished with values: [-1000000000.0, 0.1331336066704281] and parameters: {'p_sma': 20, 'p_std': 23, 'p_atr': 30, 'p_adx': 11, 'rsi_period': 17, 'ema1': 6, 'ema2': 12, 'slip_atr_k': 0.2147458700867469, 'slip_spread_k': 0.042140758956676905, 'spread_hl_frac': 0.04104771151685922, 'bb_std_mult': 2.8161423128734207, 'rsi_os': 45, 'rsi_ob': 61, 'vol_spike': 0.17392046706881142, 'adx_thresh': 30.652853939378655, 'atr_min_pct': 0.0015423425394820848, 'atr_max_pct': 0.10483057700134854, 'tp_mult': 1.8730843074860921, 'tsl_mult': 0.44532090683086206, 'strategy': 'mean_reversion', 'time_stop': 21, 'use_sma': True, 'use_atr': True, 'use_adx': False, 'use_ema': False, 'use_spike': False, 'rsi_required': True, 'edge_k': 1.582129660212611, 'edge_cap': 0.7540391217899375}.
[I 2025-08-30 04:03:30,497] Trial 168 finished with values: [-0.10959194094403046, 0.1095159944458654] and parameters: {'p_sma': 27, 'p_std': 22, 'p_atr': 11, 'p_adx': 7, 'rsi_period': 75, 'ema1': 18, 'ema2': 12, 'slip_atr_k': 0.20108683500386074, 'slip_spread_k': 0.6635440985970644, 'spread_hl_frac': 0.04284803486003184, 'bb_std_mult': 1.9442682683469754, 'rsi_os': 45, 'rsi_ob': 64, 'vol_spike': 0.17364017659741127, 'adx_thresh': 33.750350935747974, 'atr_min_pct': 0.0019558714702022904, 'atr_max_pct': 0.01395503977124421, 'tp_mult': 1.8776165484804275, 'tsl_mult': 0.3788998944223572, 'strategy': 'breakout', 'time_stop': 23, 'use_sma': True, 'use_atr': False, 'use_adx': True, 'use_ema': False, 'use_spike': True, 'rsi_required': True, 'edge_k': 0.7882694376952879, 'edge_cap': 0.7010392423652394}.
[I 2025-08-30 04:04:20,891] Trial 172 finished with values: [-1000000000.0, 1000000000.0] and parameters: {'p_sma': 57, 'p_std': 31, 'p_atr': 15, 'p_adx': 28, 'rsi_period': 83, 'ema1': 6, 'ema2': 10, 'slip_atr_k': 0.20244001826407068, 'slip_spread_k': 0.7234365774616226, 'spread_hl_frac': 0.0442700387447475, 'bb_std_mult': 2.2129824501386928, 'rsi_os': 43, 'rsi_ob': 58, 'vol_spike': 0.12489039166023055, 'adx_thresh': 6.889477810754544, 'atr_min_pct': 0.002226930998586807, 'atr_max_pct': 0.10146987178342075, 'tp_mult': 1.9632616833408842, 'tsl_mult': 0.5381321591739201, 'strategy': 'mean_reversion', 'time_stop': 27, 'use_sma': False, 'use_atr': False, 'use_adx': True, 'use_ema': True, 'use_spike': True, 'rsi_required': False, 'edge_k': 1.8342556183615086, 'edge_cap': 0.24397436241174258}.
[I 2025-08-30 04:04:20,913] Trial 171 finished with values: [-0.052560328425591996, 0.052410525890232436] and parameters: {'p_sma': 55, 'p_std': 32, 'p_atr': 29, 'p_adx': 28, 'rsi_period': 20, 'ema1': 18, 'ema2': 10, 'slip_atr_k': 0.20203199305801114, 'slip_spread_k': 0.6635039365340204, 'spread_hl_frac': 0.044341981365492236, 'bb_std_mult': 2.0933524239894026, 'rsi_os': 43, 'rsi_ob': 58, 'vol_spike': 0.15600370796788024, 'adx_thresh': 33.868414471054415, 'atr_min_pct': 0.0022642561449031343, 'atr_max_pct': 0.05802782973924234, 'tp_mult': 1.9685430398240387, 'tsl_mult': 0.5301250498676465, 'strategy': 'breakout', 'time_stop': 26, 'use_sma': False, 'use_atr': False, 'use_adx': True, 'use_ema': True, 'use_spike': True, 'rsi_required': False, 'edge_k': 1.8555604228531262, 'edge_cap': 0.7061948782881718}.
[I 2025-08-30 04:04:21,836] Trial 170 finished with values: [-0.10705839557190944, 0.10698103027818084] and parameters: {'p_sma': 24, 'p_std': 32, 'p_atr': 17, 'p_adx': 7, 'rsi_period': 13, 'ema1': 5, 'ema2': 10, 'slip_atr_k': 0.20282511598054215, 'slip_spread_k': 0.6564587471563019, 'spread_hl_frac': 0.04388581238403087, 'bb_std_mult': 1.2768382213349487, 'rsi_os': 43, 'rsi_ob': 62, 'vol_spike': 0.15731547702459736, 'adx_thresh': 20.27236161268742, 'atr_min_pct': 0.0019359434230555054, 'atr_max_pct': 0.10011673256448604, 'tp_mult': 1.7126411461685283, 'tsl_mult': 0.501677907198863, 'strategy': 'breakout', 'time_stop': 24, 'use_sma': False, 'use_atr': False, 'use_adx': True, 'use_ema': True, 'use_spike': True, 'rsi_required': False, 'edge_k': 0.3259858929938282, 'edge_cap': 0.6999584106484193}.
[I 2025-08-30 04:04:22,592] Trial 169 finished with values: [-0.07272044957703871, 0.07270508096867677] and parameters: {'p_sma': 24, 'p_std': 31, 'p_atr': 29, 'p_adx': 7, 'rsi_period': 38, 'ema1': 5, 'ema2': 10, 'slip_atr_k': 0.20277589999887352, 'slip_spread_k': 0.4670641229167535, 'spread_hl_frac': 0.04444394833625992, 'bb_std_mult': 3.1952783776000415, 'rsi_os': 43, 'rsi_ob': 58, 'vol_spike': 0.15597854520727789, 'adx_thresh': 10.138394262700688, 'atr_min_pct': 0.002193442291624326, 'atr_max_pct': 0.018378328636305362, 'tp_mult': 1.6958950183013084, 'tsl_mult': 0.5424153924675379, 'strategy': 'breakout', 'time_stop': 10, 'use_sma': False, 'use_atr': False, 'use_adx': True, 'use_ema': True, 'use_spike': True, 'rsi_required': False, 'edge_k': 0.8036011728836947, 'edge_cap': 0.2680497181919752}.
[I 2025-08-30 04:05:05,971] Trial 173 finished with values: [-1000000000.0, 1000000000.0] and parameters: {'p_sma': 23, 'p_std': 17, 'p_atr': 30, 'p_adx': 8, 'rsi_period': 13, 'ema1': 7, 'ema2': 25, 'slip_atr_k': 0.20821697182445312, 'slip_spread_k': 0.47706356656031923, 'spread_hl_frac': 0.04479407597057724, 'bb_std_mult': 1.857308665244012, 'rsi_os': 44, 'rsi_ob': 62, 'vol_spike': 0.16628514799330593, 'adx_thresh': 29.443166585440007, 'atr_min_pct': 0.02742598017293972, 'atr_max_pct': 0.10962525466324531, 'tp_mult': 1.9054184122854523, 'tsl_mult': 0.6149691443750633, 'strategy': 'mean_reversion', 'time_stop': 12, 'use_sma': True, 'use_atr': True, 'use_adx': True, 'use_ema': False, 'use_spike': False, 'rsi_required': True, 'edge_k': 1.875002667594809, 'edge_cap': 0.7238899628656015}.
[I 2025-08-30 04:05:07,197] Trial 176 finished with values: [-0.06837229085422392, 0.06832461503564492] and parameters: {'p_sma': 59, 'p_std': 17, 'p_atr': 24, 'p_adx': 21, 'rsi_period': 58, 'ema1': 7, 'ema2': 25, 'slip_atr_k': 0.20857171258013468, 'slip_spread_k': 0.6954637178083416, 'spread_hl_frac': 0.045110593646337044, 'bb_std_mult': 2.9810645258172195, 'rsi_os': 44, 'rsi_ob': 63, 'vol_spike': 0.16740530995533315, 'adx_thresh': 29.289221704969588, 'atr_min_pct': 0.001000496699773399, 'atr_max_pct': 0.11015296904699708, 'tp_mult': 1.9179350101536228, 'tsl_mult': 0.6162834904911827, 'strategy': 'mean_reversion', 'time_stop': 203, 'use_sma': True, 'use_atr': True, 'use_adx': True, 'use_ema': False, 'use_spike': False, 'rsi_required': True, 'edge_k': 1.8912337528844074, 'edge_cap': 0.7318839086005626}.
[I 2025-08-30 04:05:08,105] Trial 175 finished with values: [-0.03866017824927204, 0.03859076501563481] and parameters: {'p_sma': 23, 'p_std': 16, 'p_atr': 24, 'p_adx': 21, 'rsi_period': 76, 'ema1': 7, 'ema2': 13, 'slip_atr_k': 0.20874548524942382, 'slip_spread_k': 0.6939828671940529, 'spread_hl_frac': 0.009107813935580748, 'bb_std_mult': 0.7888823006323928, 'rsi_os': 47, 'rsi_ob': 63, 'vol_spike': 0.16486234845575784, 'adx_thresh': 30.11401017483981, 'atr_min_pct': 0.0008425088622741694, 'atr_max_pct': 0.11006951664217475, 'tp_mult': 1.9151962291243223, 'tsl_mult': 0.6141502889569396, 'strategy': 'mean_reversion', 'time_stop': 12, 'use_sma': True, 'use_atr': True, 'use_adx': True, 'use_ema': False, 'use_spike': False, 'rsi_required': True, 'edge_k': 1.86324501579912, 'edge_cap': 0.7256782071519736}.
[I 2025-08-30 04:05:08,106] Trial 174 finished with values: [-0.036819698840225956, 0.03674963783538717] and parameters: {'p_sma': 23, 'p_std': 15, 'p_atr': 30, 'p_adx': 29, 'rsi_period': 76, 'ema1': 7, 'ema2': 12, 'slip_atr_k': 0.20537574653778248, 'slip_spread_k': 0.6871227913021973, 'spread_hl_frac': 0.008681528386499725, 'bb_std_mult': 0.8017547623052323, 'rsi_os': 44, 'rsi_ob': 62, 'vol_spike': 0.16724405439350096, 'adx_thresh': 29.20484768270238, 'atr_min_pct': 0.001034891433051815, 'atr_max_pct': 0.10980716641348785, 'tp_mult': 1.7145461830658661, 'tsl_mult': 0.4985105741221455, 'strategy': 'mean_reversion', 'time_stop': 11, 'use_sma': True, 'use_atr': True, 'use_adx': True, 'use_ema': False, 'use_spike': False, 'rsi_required': True, 'edge_k': 0.14309984235945483, 'edge_cap': 0.7206735645954016}.
[I 2025-08-30 04:05:48,964] Trial 179 finished with values: [-1000000000.0, 1000000000.0] and parameters: {'p_sma': 43, 'p_std': 27, 'p_atr': 13, 'p_adx': 29, 'rsi_period': 45, 'ema1': 22, 'ema2': 39, 'slip_atr_k': 0.1926746750978256, 'slip_spread_k': 0.6764682856171551, 'spread_hl_frac': 0.016519606663566493, 'bb_std_mult': 0.9042012917627016, 'rsi_os': 46, 'rsi_ob': 64, 'vol_spike': 0.10305289064787496, 'adx_thresh': 7.839035772013329, 'atr_min_pct': 0.004235545863396149, 'atr_max_pct': 0.06377144851536262, 'tp_mult': 2.481626139256388, 'tsl_mult': 0.4169663886068079, 'strategy': 'mean_reversion', 'time_stop': 169, 'use_sma': True, 'use_atr': True, 'use_adx': False, 'use_ema': False, 'use_spike': False, 'rsi_required': True, 'edge_k': 0.42484635133943205, 'edge_cap': 0.6605726287239011}.
[I 2025-08-30 04:05:51,452] Trial 180 finished with values: [-1000000000.0, 1000000000.0] and parameters: {'p_sma': 16, 'p_std': 46, 'p_atr': 13, 'p_adx': 18, 'rsi_period': 46, 'ema1': 6, 'ema2': 11, 'slip_atr_k': 0.05349285243726702, 'slip_spread_k': 0.6845702442522147, 'spread_hl_frac': 0.03515197649289761, 'bb_std_mult': 2.748474979279702, 'rsi_os': 9, 'rsi_ob': 66, 'vol_spike': 0.07748595009240779, 'adx_thresh': 28.97512181096977, 'atr_min_pct': 0.003771922543614642, 'atr_max_pct': 0.10497415085122214, 'tp_mult': 2.000556319007848, 'tsl_mult': 0.32805116874412055, 'strategy': 'mean_reversion', 'time_stop': 6, 'use_sma': True, 'use_atr': True, 'use_adx': False, 'use_ema': False, 'use_spike': False, 'rsi_required': True, 'edge_k': 0.5912364489833406, 'edge_cap': 0.08038735449468842}.
[I 2025-08-30 04:05:51,952] Trial 178 finished with values: [-1000000000.0, 1000000000.0] and parameters: {'p_sma': 43, 'p_std': 46, 'p_atr': 30, 'p_adx': 29, 'rsi_period': 76, 'ema1': 21, 'ema2': 40, 'slip_atr_k': 0.1159691060260821, 'slip_spread_k': 0.6875853533004397, 'spread_hl_frac': 0.01841105068123606, 'bb_std_mult': 3.3692193041028977, 'rsi_os': 47, 'rsi_ob': 63, 'vol_spike': 0.26031546319235604, 'adx_thresh': 30.070776421467823, 'atr_min_pct': 0.004130703240049018, 'atr_max_pct': 0.06437335490977099, 'tp_mult': 2.0080492661669713, 'tsl_mult': 0.4212691349272153, 'strategy': 'mean_reversion', 'time_stop': 5, 'use_sma': True, 'use_atr': True, 'use_adx': True, 'use_ema': False, 'use_spike': False, 'rsi_required': True, 'edge_k': 1.1517633468402046, 'edge_cap': 0.6760809127763614}.
[I 2025-08-30 04:05:52,319] Trial 177 finished with values: [-0.07376475032047403, 0.07370279296304949] and parameters: {'p_sma': 43, 'p_std': 15, 'p_atr': 21, 'p_adx': 29, 'rsi_period': 46, 'ema1': 7, 'ema2': 13, 'slip_atr_k': 0.10395161753054462, 'slip_spread_k': 0.6957729088270955, 'spread_hl_frac': 0.009395343863213244, 'bb_std_mult': 0.8927651218865476, 'rsi_os': 47, 'rsi_ob': 63, 'vol_spike': 0.1630095250777935, 'adx_thresh': 29.950557363806727, 'atr_min_pct': 0.0007756403562686235, 'atr_max_pct': 0.11113855359138555, 'tp_mult': 2.0150104251374468, 'tsl_mult': 0.55829154279523, 'strategy': 'mean_reversion', 'time_stop': 14, 'use_sma': True, 'use_atr': True, 'use_adx': True, 'use_ema': False, 'use_spike': False, 'rsi_required': True, 'edge_k': 0.5959542414462479, 'edge_cap': 0.7381880231626476}.
[I 2025-08-30 04:06:33,947] Trial 184 finished with values: [-0.03225986270052705, 0.032213330638331546] and parameters: {'p_sma': 41, 'p_std': 29, 'p_atr': 16, 'p_adx': 30, 'rsi_period': 77, 'ema1': 6, 'ema2': 12, 'slip_atr_k': 0.09150304431100746, 'slip_spread_k': 0.7327068637048332, 'spread_hl_frac': 0.013638621074349594, 'bb_std_mult': 3.017055969190261, 'rsi_os': 24, 'rsi_ob': 65, 'vol_spike': 0.14763556858681032, 'adx_thresh': 18.84354146004895, 'atr_min_pct': 0.0015228323366164123, 'atr_max_pct': 0.04150053528546797, 'tp_mult': 2.999280035309402, 'tsl_mult': 0.9683179624370145, 'strategy': 'mean_reversion', 'time_stop': 176, 'use_sma': True, 'use_atr': True, 'use_adx': True, 'use_ema': False, 'use_spike': False, 'rsi_required': False, 'edge_k': 1.9986158492690498, 'edge_cap': 0.7091390387188412}.
[I 2025-08-30 04:06:34,444] Trial 181 finished with values: [-1000000000.0, 1000000000.0] and parameters: {'p_sma': 26, 'p_std': 34, 'p_atr': 16, 'p_adx': 30, 'rsi_period': 73, 'ema1': 24, 'ema2': 11, 'slip_atr_k': 0.17286365317030392, 'slip_spread_k': 0.35762929461944787, 'spread_hl_frac': 0.041497160958725104, 'bb_std_mult': 3.357126216602069, 'rsi_os': 24, 'rsi_ob': 51, 'vol_spike': 0.14602871790070662, 'adx_thresh': 31.224015684741754, 'atr_min_pct': 0.01706982608890006, 'atr_max_pct': 0.10290444352768593, 'tp_mult': 2.0181727932006512, 'tsl_mult': 0.2682576718949364, 'strategy': 'mean_reversion', 'time_stop': 74, 'use_sma': True, 'use_atr': True, 'use_adx': True, 'use_ema': False, 'use_spike': False, 'rsi_required': True, 'edge_k': 0.508695976886919, 'edge_cap': 0.8037078626422647}.
[I 2025-08-30 04:06:34,994] Trial 183 finished with values: [-1000000000.0, 1000000000.0] and parameters: {'p_sma': 28, 'p_std': 37, 'p_atr': 16, 'p_adx': 30, 'rsi_period': 77, 'ema1': 6, 'ema2': 57, 'slip_atr_k': 0.1311729174437189, 'slip_spread_k': 0.0037569140360873, 'spread_hl_frac': 0.041409459249965, 'bb_std_mult': 2.8774123941500287, 'rsi_os': 20, 'rsi_ob': 53, 'vol_spike': 0.17816525837110928, 'adx_thresh': 31.083651409917106, 'atr_min_pct': 0.0032422940006343365, 'atr_max_pct': 0.04139800435734747, 'tp_mult': 1.9402499259189665, 'tsl_mult': 0.49844855221945406, 'strategy': 'mean_reversion', 'time_stop': 16, 'use_sma': False, 'use_atr': True, 'use_adx': True, 'use_ema': False, 'use_spike': False, 'rsi_required': False, 'edge_k': 1.9601156318156767, 'edge_cap': 0.17917903509710142}.
[I 2025-08-30 04:06:35,485] Trial 182 finished with values: [-0.03734136510746355, 0.037287930712113684] and parameters: {'p_sma': 28, 'p_std': 51, 'p_atr': 21, 'p_adx': 30, 'rsi_period': 42, 'ema1': 6, 'ema2': 42, 'slip_atr_k': 0.11591314037870212, 'slip_spread_k': 0.19108846149139663, 'spread_hl_frac': 0.002128527917054486, 'bb_std_mult': 2.8589752147628955, 'rsi_os': 25, 'rsi_ob': 53, 'vol_spike': 0.14545591280735565, 'adx_thresh': 31.234021300294717, 'atr_min_pct': 0.001249929100067708, 'atr_max_pct': 0.04172729931972018, 'tp_mult': 2.988289214846023, 'tsl_mult': 0.500911974129156, 'strategy': 'mean_reversion', 'time_stop': 122, 'use_sma': True, 'use_atr': True, 'use_adx': True, 'use_ema': False, 'use_spike': False, 'rsi_required': True, 'edge_k': 1.1744393608717212, 'edge_cap': 0.1844751434567677}.
[I 2025-08-30 04:07:18,206] Trial 185 finished with values: [-1000000000.0, 1000000000.0] and parameters: {'p_sma': 26, 'p_std': 24, 'p_atr': 16, 'p_adx': 30, 'rsi_period': 73, 'ema1': 6, 'ema2': 11, 'slip_atr_k': 0.09237783303146738, 'slip_spread_k': 0.19701663430109279, 'spread_hl_frac': 0.002071831009600962, 'bb_std_mult': 2.841026454197487, 'rsi_os': 20, 'rsi_ob': 65, 'vol_spike': 0.1520986429092951, 'adx_thresh': 31.347971497247897, 'atr_min_pct': 0.001392512697265145, 'atr_max_pct': 0.07375419014091193, 'tp_mult': 2.56190306573579, 'tsl_mult': 0.26261813460483296, 'strategy': 'mean_reversion', 'time_stop': 232, 'use_sma': False, 'use_atr': True, 'use_adx': True, 'use_ema': True, 'use_spike': False, 'rsi_required': False, 'edge_k': 0.5115973328390989, 'edge_cap': 0.19390751706500686}.
[I 2025-08-30 04:07:19,018] Trial 186 finished with values: [-1000000000.0, 1000000000.0] and parameters: {'p_sma': 48, 'p_std': 55, 'p_atr': 23, 'p_adx': 16, 'rsi_period': 32, 'ema1': 6, 'ema2': 57, 'slip_atr_k': 0.1265709576041244, 'slip_spread_k': 0.7201376344868664, 'spread_hl_frac': 0.03874638532007443, 'bb_std_mult': 2.8483751770784393, 'rsi_os': 45, 'rsi_ob': 64, 'vol_spike': 0.043401702226645814, 'adx_thresh': 18.47816012733853, 'atr_min_pct': 0.0015574651208127138, 'atr_max_pct': 0.09514609388733158, 'tp_mult': 1.2862679203261624, 'tsl_mult': 0.4959361855269312, 'strategy': 'mean_reversion', 'time_stop': 158, 'use_sma': False, 'use_atr': True, 'use_adx': True, 'use_ema': True, 'use_spike': False, 'rsi_required': False, 'edge_k': 1.9363566434714345, 'edge_cap': 0.977723673650196}.
[I 2025-08-30 04:07:19,954] Trial 187 finished with values: [-1000000000.0, 1000000000.0] and parameters: {'p_sma': 41, 'p_std': 24, 'p_atr': 29, 'p_adx': 16, 'rsi_period': 31, 'ema1': 25, 'ema2': 46, 'slip_atr_k': 0.1387161854455973, 'slip_spread_k': 0.21284356648211505, 'spread_hl_frac': 0.002454191661061752, 'bb_std_mult': 2.820494144482874, 'rsi_os': 45, 'rsi_ob': 65, 'vol_spike': 0.15238337740365712, 'adx_thresh': 8.688888406677622, 'atr_min_pct': 0.02628215094535869, 'atr_max_pct': 0.11415468084047557, 'tp_mult': 1.3710849782100702, 'tsl_mult': 0.489078422874414, 'strategy': 'breakout', 'time_stop': 247, 'use_sma': True, 'use_atr': False, 'use_adx': True, 'use_ema': True, 'use_spike': True, 'rsi_required': True, 'edge_k': 0.16111979819037048, 'edge_cap': 0.7006782541920247}.
[I 2025-08-30 04:07:20,936] Trial 188 finished with values: [-0.06674862477746868, 0.06670237162412039] and parameters: {'p_sma': 26, 'p_std': 29, 'p_atr': 29, 'p_adx': 23, 'rsi_period': 42, 'ema1': 12, 'ema2': 43, 'slip_atr_k': 0.09054774014066866, 'slip_spread_k': 0.20305441368061045, 'spread_hl_frac': 0.006219392790116098, 'bb_std_mult': 2.8194130850257215, 'rsi_os': 45, 'rsi_ob': 66, 'vol_spike': 0.15143376014862253, 'adx_thresh': 28.963713854776184, 'atr_min_pct': 0.00141204671348656, 'atr_max_pct': 0.11423774672169723, 'tp_mult': 2.762173215433799, 'tsl_mult': 0.964309934232904, 'strategy': 'breakout', 'time_stop': 101, 'use_sma': False, 'use_atr': False, 'use_adx': False, 'use_ema': True, 'use_spike': True, 'rsi_required': False, 'edge_k': 1.999950632187577, 'edge_cap': 0.8451886402366703}.
