[I 2025-08-30 04:38:56,635] Trial 350 finished with values: [-1000000000.0, 1000000000.0] and parameters: {'p_sma': 6, 'p_std': 17, 'p_atr': 17, 'p_adx': 23, 'rsi_period': 17, 'ema1': 16, 'ema2': 29, 'slip_atr_k': 0.13701023006925556, 'slip_spread_k': 0.8696635539167374, 'spread_hl_frac': 0.009622654024610136, 'bb_std_mult': 3.2516188663119148, 'rsi_os': 21, 'rsi_ob': 75, 'vol_spike': 0.18408943073108852, 'adx_thresh': 31.52139507496346, 'atr_min_pct': 0.029589731583890253, 'atr_max_pct': 0.13572666911362555, 'tp_mult': 1.660242376577402, 'tsl_mult': 0.23188047837990952, 'strategy': 'breakout', 'time_stop': 181, 'use_sma': False, 'use_atr': False, 'use_adx': False, 'use_ema': True, 'use_spike': True, 'rsi_required': False, 'edge_k': 0.3794525677250573, 'edge_cap': 0.6321035660319032}.
[I 2025-08-30 04:38:59,224] Trial 351 finished with values: [-1000000000.0, 1000000000.0] and parameters: {'p_sma': 6, 'p_std': 53, 'p_atr': 9, 'p_adx': 23, 'rsi_period': 51, 'ema1': 16, 'ema2': 29, 'slip_atr_k': 0.11202255185850266, 'slip_spread_k': 0.7972294742987474, 'spread_hl_frac': 0.009612552566844963, 'bb_std_mult': 3.2286827507394653, 'rsi_os': 21, 'rsi_ob': 66, 'vol_spike': 0.2604328083658004, 'adx_thresh': 31.384030836343825, 'atr_min_pct': 0.0031331475816834334, 'atr_max_pct': 0.13716794635040352, 'tp_mult': 1.859651659922101, 'tsl_mult': 0.35902151645011027, 'strategy': 'breakout', 'time_stop': 180, 'use_sma': False, 'use_atr': False, 'use_adx': False, 'use_ema': True, 'use_spike': True, 'rsi_required': False, 'edge_k': 1.712780593106315, 'edge_cap': 0.6810163295140473}.
[I 2025-08-30 04:39:01,031] Trial 353 finished with values: [-1000000000.0, 1000000000.0] and parameters: {'p_sma': 6, 'p_std': 53, 'p_atr': 24, 'p_adx': 18, 'rsi_period': 54, 'ema1': 14, 'ema2': 29, 'slip_atr_k': 0.004203657023461741, 'slip_spread_k': 0.7703682930728825, 'spread_hl_frac': 0.01672632482726967, 'bb_std_mult': 3.2114738291815357, 'rsi_os': 21, 'rsi_ob': 66, 'vol_spike': 0.19844462544545852, 'adx_thresh': 17.70192543616169, 'atr_min_pct': 0.0006311652930693099, 'atr_max_pct': 0.1360079555561362, 'tp_mult': 1.6741001488390812, 'tsl_mult': 0.22574618548632494, 'strategy': 'breakout', 'time_stop': 204, 'use_sma': False, 'use_atr': False, 'use_adx': False, 'use_ema': True, 'use_spike': True, 'rsi_required': False, 'edge_k': 1.5199922776058943, 'edge_cap': 0.6766313056096632}.
[I 2025-08-30 04:39:48,179] Trial 356 finished with values: [-1000000000.0, 1000000000.0] and parameters: {'p_sma': 12, 'p_std': 55, 'p_atr': 9, 'p_adx': 18, 'rsi_period': 22, 'ema1': 14, 'ema2': 27, 'slip_atr_k': 0.004551380594173842, 'slip_spread_k': 0.8320883862116324, 'spread_hl_frac': 0.01622539144228253, 'bb_std_mult': 0.778019760416323, 'rsi_os': 23, 'rsi_ob': 50, 'vol_spike': 0.09125726530657453, 'adx_thresh': 22.70300931463823, 'atr_min_pct': 0.02003042235305129, 'atr_max_pct': 0.1405301886823526, 'tp_mult': 2.340140386734783, 'tsl_mult': 0.22647548603000414, 'strategy': 'breakout', 'time_stop': 190, 'use_sma': False, 'use_atr': False, 'use_adx': False, 'use_ema': True, 'use_spike': True, 'rsi_required': False, 'edge_k': 1.528096465730518, 'edge_cap': 0.20120705013636947}.
[I 2025-08-30 04:39:49,112] Trial 354 finished with values: [-1000000000.0, 1000000000.0] and parameters: {'p_sma': 10, 'p_std': 53, 'p_atr': 9, 'p_adx': 25, 'rsi_period': 55, 'ema1': 14, 'ema2': 25, 'slip_atr_k': 0.0038901753754537736, 'slip_spread_k': 0.22034437332488238, 'spread_hl_frac': 0.016336022590463684, 'bb_std_mult': 3.3792762320002154, 'rsi_os': 25, 'rsi_ob': 75, 'vol_spike': 0.10693776581833228, 'adx_thresh': 32.371322049886516, 'atr_min_pct': 0.024881320915330712, 'atr_max_pct': 0.1427747851569967, 'tp_mult': 1.9462118898473888, 'tsl_mult': 0.3525825682532228, 'strategy': 'breakout', 'time_stop': 204, 'use_sma': False, 'use_atr': False, 'use_adx': False, 'use_ema': True, 'use_spike': True, 'rsi_required': False, 'edge_k': 0.3778318822654638, 'edge_cap': 0.6277332500692788}.
[I 2025-08-30 04:39:49,952] Trial 357 finished with values: [-1000000000.0, 1000000000.0] and parameters: {'p_sma': 12, 'p_std': 43, 'p_atr': 18, 'p_adx': 25, 'rsi_period': 22, 'ema1': 23, 'ema2': 24, 'slip_atr_k': 0.04670132823407282, 'slip_spread_k': 0.7439113622947343, 'spread_hl_frac': 0.010911819079158516, 'bb_std_mult': 3.407564255872143, 'rsi_os': 15, 'rsi_ob': 67, 'vol_spike': 0.10602532806288026, 'adx_thresh': 8.035445678705425, 'atr_min_pct': 0.020174033262890755, 'atr_max_pct': 0.14201799023492415, 'tp_mult': 1.7684438743940392, 'tsl_mult': 0.15300329973938062, 'strategy': 'breakout', 'time_stop': 231, 'use_sma': False, 'use_atr': False, 'use_adx': False, 'use_ema': True, 'use_spike': True, 'rsi_required': False, 'edge_k': 1.2948809076377352, 'edge_cap': 0.46029665904301204}.
[I 2025-08-30 04:39:49,988] Trial 355 finished with values: [-1000000000.0, 1000000000.0] and parameters: {'p_sma': 12, 'p_std': 54, 'p_atr': 9, 'p_adx': 18, 'rsi_period': 51, 'ema1': 24, 'ema2': 21, 'slip_atr_k': 0.00017682907255753104, 'slip_spread_k': 0.7739040495770392, 'spread_hl_frac': 0.011017948460948031, 'bb_std_mult': 3.3741059817804824, 'rsi_os': 23, 'rsi_ob': 66, 'vol_spike': 0.09437013228966518, 'adx_thresh': 17.680746730459628, 'atr_min_pct': 0.010438899198753456, 'atr_max_pct': 0.13851851714783878, 'tp_mult': 1.9522366072287585, 'tsl_mult': 0.22915182962029687, 'strategy': 'breakout', 'time_stop': 203, 'use_sma': False, 'use_atr': False, 'use_adx': False, 'use_ema': True, 'use_spike': True, 'rsi_required': False, 'edge_k': 1.5310781806331633, 'edge_cap': 0.6200938907635258}.
[I 2025-08-30 04:40:34,773] Trial 361 finished with values: [-0.02819868337243625, 0.02818165971856563] and parameters: {'p_sma': 9, 'p_std': 58, 'p_atr': 21, 'p_adx': 8, 'rsi_period': 20, 'ema1': 20, 'ema2': 27, 'slip_atr_k': 1.7604030254067538e-05, 'slip_spread_k': 0.9460660955063613, 'spread_hl_frac': 0.007899002137343195, 'bb_std_mult': 0.6580788407416458, 'rsi_os': 24, 'rsi_ob': 63, 'vol_spike': 0.058175596321581646, 'adx_thresh': 5.1159843890001255, 'atr_min_pct': 0.0006059888360229369, 'atr_max_pct': 0.04357260647185618, 'tp_mult': 1.8055094244333671, 'tsl_mult': 0.027981769801841916, 'strategy': 'breakout', 'time_stop': 61, 'use_sma': False, 'use_atr': False, 'use_adx': False, 'use_ema': True, 'use_spike': True, 'rsi_required': False, 'edge_k': 0.051767224667730205, 'edge_cap': 0.5445246482884148}.
[I 2025-08-30 04:40:35,685] Trial 359 finished with values: [-1000000000.0, 1000000000.0] and parameters: {'p_sma': 56, 'p_std': 42, 'p_atr': 10, 'p_adx': 24, 'rsi_period': 46, 'ema1': 9, 'ema2': 27, 'slip_atr_k': 0.06041318391307833, 'slip_spread_k': 0.7425712561485549, 'spread_hl_frac': 0.01087820152633279, 'bb_std_mult': 3.4578880596864496, 'rsi_os': 15, 'rsi_ob': 84, 'vol_spike': 0.023289598762582936, 'adx_thresh': 32.54730333522842, 'atr_min_pct': 0.010463577607040985, 'atr_max_pct': 0.025474213419952645, 'tp_mult': 1.7738167088040875, 'tsl_mult': 0.034326839296316136, 'strategy': 'breakout', 'time_stop': 210, 'use_sma': False, 'use_atr': False, 'use_adx': False, 'use_ema': True, 'use_spike': True, 'rsi_required': False, 'edge_k': 1.2577645019180546, 'edge_cap': 0.43962496500113724}.
[I 2025-08-30 04:40:36,364] Trial 360 finished with values: [-0.06631152701724263, 0.06629327595179012] and parameters: {'p_sma': 9, 'p_std': 38, 'p_atr': 10, 'p_adx': 11, 'rsi_period': 14, 'ema1': 15, 'ema2': 27, 'slip_atr_k': 0.014775350883832708, 'slip_spread_k': 0.7482616350803181, 'spread_hl_frac': 0.0010093050693611508, 'bb_std_mult': 3.4838920969027143, 'rsi_os': 24, 'rsi_ob': 63, 'vol_spike': 0.22426564613580613, 'adx_thresh': 26.43434948889442, 'atr_min_pct': 0.0005575636994985544, 'atr_max_pct': 0.03642443576853518, 'tp_mult': 1.8790505367107493, 'tsl_mult': 0.18472507069996025, 'strategy': 'breakout', 'time_stop': 211, 'use_sma': False, 'use_atr': False, 'use_adx': False, 'use_ema': True, 'use_spike': True, 'rsi_required': False, 'edge_k': 0.883879650073037, 'edge_cap': 0.828600993943525}.
[I 2025-08-30 04:40:36,826] Trial 358 finished with values: [-0.0727815234289324, 0.07276562659550875] and parameters: {'p_sma': 10, 'p_std': 43, 'p_atr': 21, 'p_adx': 25, 'rsi_period': 12, 'ema1': 28, 'ema2': 21, 'slip_atr_k': 0.0004828232398058187, 'slip_spread_k': 0.7429947701098912, 'spread_hl_frac': 0.0011957826872935305, 'bb_std_mult': 3.3765590859658605, 'rsi_os': 25, 'rsi_ob': 63, 'vol_spike': 0.10760270726671445, 'adx_thresh': 8.022413294165915, 'atr_min_pct': 0.0006867159750641521, 'atr_max_pct': 0.1427694274748505, 'tp_mult': 1.9406501178961195, 'tsl_mult': 0.188890216147577, 'strategy': 'breakout', 'time_stop': 102, 'use_sma': False, 'use_atr': False, 'use_adx': False, 'use_ema': True, 'use_spike': True, 'rsi_required': False, 'edge_k': 0.8834670220812372, 'edge_cap': 0.3787634897364047}.
[I 2025-08-30 04:41:21,635] Trial 363 finished with values: [-1000000000.0, 1000000000.0] and parameters: {'p_sma': 7, 'p_std': 51, 'p_atr': 16, 'p_adx': 11, 'rsi_period': 13, 'ema1': 28, 'ema2': 54, 'slip_atr_k': 0.03706428996658788, 'slip_spread_k': 0.8029378047372635, 'spread_hl_frac': 0.003171676941183813, 'bb_std_mult': 2.166631808155957, 'rsi_os': 25, 'rsi_ob': 64, 'vol_spike': 0.1900292526560859, 'adx_thresh': 30.45539153081264, 'atr_min_pct': 0.013895955222024433, 'atr_max_pct': 0.14723066714812907, 'tp_mult': 1.8581019082786674, 'tsl_mult': 0.17768873790686196, 'strategy': 'breakout', 'time_stop': 215, 'use_sma': False, 'use_atr': False, 'use_adx': False, 'use_ema': True, 'use_spike': True, 'rsi_required': False, 'edge_k': 1.593260401564225, 'edge_cap': 0.8208638245365035}.
[I 2025-08-30 04:41:22,318] Trial 365 finished with values: [-1000000000.0, 1000000000.0] and parameters: {'p_sma': 33, 'p_std': 48, 'p_atr': 9, 'p_adx': 24, 'rsi_period': 37, 'ema1': 15, 'ema2': 33, 'slip_atr_k': 0.010247415120636698, 'slip_spread_k': 0.46555450695428807, 'spread_hl_frac': 0.0317636850835426, 'bb_std_mult': 2.1420257536266147, 'rsi_os': 5, 'rsi_ob': 65, 'vol_spike': 0.17817541872770523, 'adx_thresh': 14.947559588114057, 'atr_min_pct': 0.001230244168938004, 'atr_max_pct': 0.14639495045113723, 'tp_mult': 1.457397666348291, 'tsl_mult': 0.23865348404934597, 'strategy': 'breakout', 'time_stop': 219, 'use_sma': False, 'use_atr': False, 'use_adx': False, 'use_ema': True, 'use_spike': True, 'rsi_required': False, 'edge_k': 1.5947812137385564, 'edge_cap': 0.9163277649054866}.
[I 2025-08-30 04:41:22,651] Trial 364 finished with values: [-1000000000.0, 1000000000.0] and parameters: {'p_sma': 7, 'p_std': 51, 'p_atr': 9, 'p_adx': 25, 'rsi_period': 19, 'ema1': 27, 'ema2': 54, 'slip_atr_k': 0.008470688373669993, 'slip_spread_k': 0.8099376198735644, 'spread_hl_frac': 0.011697601013080844, 'bb_std_mult': 1.7211047884026962, 'rsi_os': 26, 'rsi_ob': 68, 'vol_spike': 0.1779095510639895, 'adx_thresh': 30.502983958349922, 'atr_min_pct': 0.0013766067118631488, 'atr_max_pct': 0.07598802772587353, 'tp_mult': 1.431597673752485, 'tsl_mult': 0.3298325971780379, 'strategy': 'breakout', 'time_stop': 195, 'use_sma': False, 'use_atr': False, 'use_adx': False, 'use_ema': True, 'use_spike': True, 'rsi_required': False, 'edge_k': 1.5916063227210897, 'edge_cap': 0.6423076250652129}.
[I 2025-08-30 04:41:23,221] Trial 362 finished with values: [-1000000000.0, 1000000000.0] and parameters: {'p_sma': 10, 'p_std': 38, 'p_atr': 12, 'p_adx': 24, 'rsi_period': 12, 'ema1': 26, 'ema2': 33, 'slip_atr_k': 0.23154941390778883, 'slip_spread_k': 0.7405525877184872, 'spread_hl_frac': 0.012073508881758526, 'bb_std_mult': 0.5311820063873913, 'rsi_os': 10, 'rsi_ob': 64, 'vol_spike': 0.18999476105077712, 'adx_thresh': 15.035660001956527, 'atr_min_pct': 0.023011448609870082, 'atr_max_pct': 0.026161537974283264, 'tp_mult': 1.8855022892484175, 'tsl_mult': 0.18844998444360625, 'strategy': 'breakout', 'time_stop': 212, 'use_sma': False, 'use_atr': False, 'use_adx': False, 'use_ema': True, 'use_spike': True, 'rsi_required': False, 'edge_k': 1.5842717491580944, 'edge_cap': 0.8292493254048912}.
[I 2025-08-30 04:41:23,642] Trial 367 finished with values: [-1000000000.0, 1000000000.0] and parameters: {'p_sma': 58, 'p_std': 31, 'p_atr': 8, 'p_adx': 26, 'rsi_period': 24, 'ema1': 15, 'ema2': 28, 'slip_atr_k': 0.014573091510967062, 'slip_spread_k': 0.7726356052055252, 'spread_hl_frac': 0.027135923948592194, 'bb_std_mult': 3.2922652565826502, 'rsi_os': 8, 'rsi_ob': 67, 'vol_spike': 0.18385593137755038, 'adx_thresh': 32.226454007044126, 'atr_min_pct': 0.0275658118371395, 'atr_max_pct': 0.011488327550367133, 'tp_mult': 2.9520214712579227, 'tsl_mult': 0.42706935980909233, 'strategy': 'breakout', 'time_stop': 198, 'use_sma': False, 'use_atr': False, 'use_adx': False, 'use_ema': True, 'use_spike': True, 'rsi_required': False, 'edge_k': 1.4302162398245324, 'edge_cap': 0.6950081426221559}.
[I 2025-08-30 04:42:04,254] Trial 370 finished with values: [-1000000000.0, 1000000000.0] and parameters: {'p_sma': 11, 'p_std': 50, 'p_atr': 19, 'p_adx': 25, 'rsi_period': 21, 'ema1': 14, 'ema2': 43, 'slip_atr_k': 0.006414545482213528, 'slip_spread_k': 0.7106400977553334, 'spread_hl_frac': 0.029513864619022254, 'bb_std_mult': 2.3273671036675814, 'rsi_os': 51, 'rsi_ob': 59, 'vol_spike': 0.20055111374630363, 'adx_thresh': 24.65626964189893, 'atr_min_pct': 0.02083437228792063, 'atr_max_pct': 0.05728870532099642, 'tp_mult': 1.8171053747756754, 'tsl_mult': 0.24848612721873045, 'strategy': 'breakout', 'time_stop': 169, 'use_sma': False, 'use_atr': False, 'use_adx': False, 'use_ema': True, 'use_spike': True, 'rsi_required': False, 'edge_k': 0.979467910730669, 'edge_cap': 0.6658568160885354}.
[I 2025-08-30 04:42:04,765] Trial 368 finished with values: [-1000000000.0, 1000000000.0] and parameters: {'p_sma': 11, 'p_std': 31, 'p_atr': 12, 'p_adx': 27, 'rsi_period': 24, 'ema1': 15, 'ema2': 56, 'slip_atr_k': 0.22707927183917337, 'slip_spread_k': 0.7737748556732746, 'spread_hl_frac': 0.012054237086716081, 'bb_std_mult': 3.304580085451758, 'rsi_os': 51, 'rsi_ob': 71, 'vol_spike': 0.18541450156940775, 'adx_thresh': 24.750903964060715, 'atr_min_pct': 0.023126698692969454, 'atr_max_pct': 0.1474292151231828, 'tp_mult': 2.9465420748613647, 'tsl_mult': 0.24513853086650705, 'strategy': 'breakout', 'time_stop': 170, 'use_sma': False, 'use_atr': False, 'use_adx': False, 'use_ema': True, 'use_spike': True, 'rsi_required': False, 'edge_k': 1.0867151435175553, 'edge_cap': 0.6968139968341073}.
[I 2025-08-30 04:42:05,302] Trial 366 finished with values: [-1000000000.0, 1000000000.0] and parameters: {'p_sma': 16, 'p_std': 48, 'p_atr': 9, 'p_adx': 24, 'rsi_period': 62, 'ema1': 15, 'ema2': 32, 'slip_atr_k': 0.23069803498927832, 'slip_spread_k': 0.7728066703905887, 'spread_hl_frac': 0.014283717678858377, 'bb_std_mult': 1.258492801690224, 'rsi_os': 5, 'rsi_ob': 78, 'vol_spike': 0.17683427225327739, 'adx_thresh': 9.3376797662336, 'atr_min_pct': 0.0013591769007251665, 'atr_max_pct': 0.012172711887336346, 'tp_mult': 2.697731381702381, 'tsl_mult': 0.24739732466650824, 'strategy': 'breakout', 'time_stop': 197, 'use_sma': False, 'use_atr': False, 'use_adx': False, 'use_ema': True, 'use_spike': True, 'rsi_required': False, 'edge_k': 1.4368060473718243, 'edge_cap': 0.9186624678381358}.
[I 2025-08-30 04:42:05,581] Trial 369 finished with values: [-1000000000.0, 1000000000.0] and parameters: {'p_sma': 35, 'p_std': 50, 'p_atr': 7, 'p_adx': 26, 'rsi_period': 63, 'ema1': 15, 'ema2': 43, 'slip_atr_k': 0.019936479540283804, 'slip_spread_k': 0.13107863811813208, 'spread_hl_frac': 0.013511097980775042, 'bb_std_mult': 3.3133450804067848, 'rsi_os': 23, 'rsi_ob': 67, 'vol_spike': 0.18339769600348382, 'adx_thresh': 32.04586652610948, 'atr_min_pct': 0.0010147838362178365, 'atr_max_pct': 0.049115611742689004, 'tp_mult': 1.527807141158721, 'tsl_mult': 0.43183672008628676, 'strategy': 'breakout', 'time_stop': 201, 'use_sma': False, 'use_atr': False, 'use_adx': False, 'use_ema': True, 'use_spike': True, 'rsi_required': False, 'edge_k': 1.0996638393962146, 'edge_cap': 0.6650702010648306}.
[I 2025-08-30 04:42:47,211] Trial 374 finished with values: [-1000000000.0, 1000000000.0] and parameters: {'p_sma': 19, 'p_std': 52, 'p_atr': 23, 'p_adx': 10, 'rsi_period': 19, 'ema1': 16, 'ema2': 41, 'slip_atr_k': 0.054613683301487914, 'slip_spread_k': 0.7187602820826, 'spread_hl_frac': 0.010448953834202154, 'bb_std_mult': 3.5209353687627734, 'rsi_os': 49, 'rsi_ob': 54, 'vol_spike': 0.19150709666190585, 'adx_thresh': 33.993822491270585, 'atr_min_pct': 0.01575014250327874, 'atr_max_pct': 0.14971194050763523, 'tp_mult': 1.7270406837153995, 'tsl_mult': 0.7765015937983897, 'strategy': 'breakout', 'time_stop': 223, 'use_sma': False, 'use_atr': False, 'use_adx': False, 'use_ema': True, 'use_spike': True, 'rsi_required': False, 'edge_k': 1.6719061022502344, 'edge_cap': 0.25363664654773194}.
[I 2025-08-30 04:42:47,620] Trial 372 finished with values: [-1000000000.0, 1000000000.0] and parameters: {'p_sma': 47, 'p_std': 15, 'p_atr': 10, 'p_adx': 26, 'rsi_period': 82, 'ema1': 15, 'ema2': 31, 'slip_atr_k': 0.1839576472964914, 'slip_spread_k': 0.7869049678066705, 'spread_hl_frac': 0.014208410802530994, 'bb_std_mult': 3.526669935894503, 'rsi_os': 22, 'rsi_ob': 78, 'vol_spike': 0.17336578559720228, 'adx_thresh': 9.456345444961228, 'atr_min_pct': 0.002421575239073768, 'atr_max_pct': 0.047915829114139795, 'tp_mult': 1.5238231352711502, 'tsl_mult': 0.970294452060575, 'strategy': 'breakout', 'time_stop': 207, 'use_sma': False, 'use_atr': False, 'use_adx': False, 'use_ema': True, 'use_spike': True, 'rsi_required': False, 'edge_k': 1.4776705981264775, 'edge_cap': 0.6442296179608297}.
[I 2025-08-30 04:42:47,926] Trial 373 finished with values: [-1000000000.0, 1000000000.0] and parameters: {'p_sma': 9, 'p_std': 52, 'p_atr': 10, 'p_adx': 10, 'rsi_period': 19, 'ema1': 16, 'ema2': 31, 'slip_atr_k': 0.1282758169237735, 'slip_spread_k': 0.7912850126455514, 'spread_hl_frac': 0.004302023511480758, 'bb_std_mult': 1.4553289438042998, 'rsi_os': 32, 'rsi_ob': 66, 'vol_spike': 0.19577157348839347, 'adx_thresh': 34.14876632959265, 'atr_min_pct': 0.015218269084268586, 'atr_max_pct': 0.019647888743033685, 'tp_mult': 1.715612911310335, 'tsl_mult': 0.21508418215923505, 'strategy': 'breakout', 'time_stop': 265, 'use_sma': False, 'use_atr': False, 'use_adx': False, 'use_ema': True, 'use_spike': True, 'rsi_required': False, 'edge_k': 1.4822706926106595, 'edge_cap': 0.6389260303395106}.
[I 2025-08-30 04:42:48,206] Trial 371 finished with values: [-1000000000.0, 1000000000.0] and parameters: {'p_sma': 42, 'p_std': 52, 'p_atr': 22, 'p_adx': 27, 'rsi_period': 19, 'ema1': 15, 'ema2': 58, 'slip_atr_k': 0.021481969960551708, 'slip_spread_k': 0.7798508987937993, 'spread_hl_frac': 0.0139796062268274, 'bb_std_mult': 3.505281320784045, 'rsi_os': 29, 'rsi_ob': 67, 'vol_spike': 0.18293885771259571, 'adx_thresh': 34.994595985252076, 'atr_min_pct': 0.015943368825140088, 'atr_max_pct': 0.020237810877453306, 'tp_mult': 2.7388137262453935, 'tsl_mult': 0.20685017062880512, 'strategy': 'breakout', 'time_stop': 263, 'use_sma': False, 'use_atr': False, 'use_adx': False, 'use_ema': True, 'use_spike': True, 'rsi_required': False, 'edge_k': 1.0855721223564039, 'edge_cap': 0.06753086238340145}.
[I 2025-08-30 04:43:31,736] Trial 377 finished with values: [-0.02389349317381273, 0.023845542970744347] and parameters: {'p_sma': 8, 'p_std': 54, 'p_atr': 8, 'p_adx': 25, 'rsi_period': 17, 'ema1': 14, 'ema2': 28, 'slip_atr_k': 0.00748073258674189, 'slip_spread_k': 0.0008579835904465871, 'spread_hl_frac': 0.0090692319729904, 'bb_std_mult': 3.122583497493233, 'rsi_os': 30, 'rsi_ob': 94, 'vol_spike': 0.13946235080048544, 'adx_thresh': 31.221191713673683, 'atr_min_pct': 2.593254585027084e-05, 'atr_max_pct': 0.14412848873087095, 'tp_mult': 2.491662913982992, 'tsl_mult': 0.37389720423441397, 'strategy': 'breakout', 'time_stop': 217, 'use_sma': False, 'use_atr': False, 'use_adx': False, 'use_ema': True, 'use_spike': True, 'rsi_required': False, 'edge_k': 1.331380250253059, 'edge_cap': 0.6137425328376855}.
[I 2025-08-30 04:43:31,798] Trial 375 finished with values: [-1000000000.0, 1000000000.0] and parameters: {'p_sma': 46, 'p_std': 56, 'p_atr': 10, 'p_adx': 20, 'rsi_period': 17, 'ema1': 30, 'ema2': 50, 'slip_atr_k': 0.18396687863287567, 'slip_spread_k': 0.7926236017908586, 'spread_hl_frac': 0.009005890983281162, 'bb_std_mult': 3.4572685196261097, 'rsi_os': 18, 'rsi_ob': 86, 'vol_spike': 0.21509753487210792, 'adx_thresh': 31.44687300434481, 'atr_min_pct': 0.02856851035338294, 'atr_max_pct': 0.1444423664995436, 'tp_mult': 1.847192830774925, 'tsl_mult': 0.20677298910801167, 'strategy': 'breakout', 'time_stop': 208, 'use_sma': False, 'use_atr': False, 'use_adx': False, 'use_ema': True, 'use_spike': True, 'rsi_required': False, 'edge_k': 1.487804263945878, 'edge_cap': 0.1725395639650958}.
[I 2025-08-30 04:43:32,456] Trial 376 finished with values: [-0.07345137898348908, 0.07340586750634076] and parameters: {'p_sma': 39, 'p_std': 52, 'p_atr': 9, 'p_adx': 25, 'rsi_period': 17, 'ema1': 14, 'ema2': 19, 'slip_atr_k': 0.006907080341555238, 'slip_spread_k': 0.2378114561906804, 'spread_hl_frac': 0.004383875122977179, 'bb_std_mult': 3.4411715865157095, 'rsi_os': 30, 'rsi_ob': 65, 'vol_spike': 0.19646677694765358, 'adx_thresh': 30.999312452712243, 'atr_min_pct': 2.0709745182832684e-06, 'atr_max_pct': 0.14474998005179912, 'tp_mult': 1.8513179224903211, 'tsl_mult': 0.20690441425941103, 'strategy': 'breakout', 'time_stop': 218, 'use_sma': False, 'use_atr': False, 'use_adx': False, 'use_ema': True, 'use_spike': True, 'rsi_required': False, 'edge_k': 1.5109552360583962, 'edge_cap': 0.16687008307410978}.
