[I 2025-08-30 03:51:50,307] Trial 105 finished with values: [-1000000000.0, 1000000000.0] and parameters: {'p_sma': 29, 'p_std': 12, 'p_atr': 8, 'p_adx': 16, 'rsi_period': 34, 'ema1': 25, 'ema2': 54, 'slip_atr_k': 0.18330040704044792, 'slip_spread_k': 0.9102878064643323, 'spread_hl_frac': 0.03021019365824527, 'bb_std_mult': 2.845122403253331, 'rsi_os': 42, 'rsi_ob': 77, 'vol_spike': 0.1565711747164338, 'adx_thresh': 25.423860934759702, 'atr_min_pct': 0.00030507213710591514, 'atr_max_pct': 0.04646404805848938, 'tp_mult': 1.619574475159405, 'tsl_mult': 0.6316006142625294, 'strategy': 'mean_reversion', 'time_stop': 115, 'use_sma': False, 'use_atr': True, 'use_adx': True, 'use_ema': True, 'use_spike': False, 'rsi_required': False, 'edge_k': 1.4067325795506884, 'edge_cap': 0.5711870600912687}.
[I 2025-08-30 03:52:38,292] Trial 109 finished with values: [-0.033718087023507204, 0.0336384508279395] and parameters: {'p_sma': 30, 'p_std': 9, 'p_atr': 28, 'p_adx': 27, 'rsi_period': 74, 'ema1': 7, 'ema2': 14, 'slip_atr_k': 0.24659694730164172, 'slip_spread_k': 0.6086779455608571, 'spread_hl_frac': 0.04984687594945865, 'bb_std_mult': 2.8786705946271374, 'rsi_os': 42, 'rsi_ob': 70, 'vol_spike': 0.19474615284299593, 'adx_thresh': 25.40135971037494, 'atr_min_pct': 0.0020815044849978124, 'atr_max_pct': 0.11275636816792425, 'tp_mult': 2.1768328595488, 'tsl_mult': 0.7478455458145217, 'strategy': 'mean_reversion', 'time_stop': 48, 'use_sma': True, 'use_atr': True, 'use_adx': True, 'use_ema': False, 'use_spike': False, 'rsi_required': True, 'edge_k': 1.8972054690867397, 'edge_cap': 0.6663871126776418}.
[I 2025-08-30 03:52:39,288] Trial 112 finished with values: [-0.03226427030562751, 0.032184665157441165] and parameters: {'p_sma': 30, 'p_std': 9, 'p_atr': 28, 'p_adx': 29, 'rsi_period': 74, 'ema1': 7, 'ema2': 13, 'slip_atr_k': 0.245448288884156, 'slip_spread_k': 0.6081197964145982, 'spread_hl_frac': 0.047887569091906036, 'bb_std_mult': 2.7889857034155994, 'rsi_os': 41, 'rsi_ob': 70, 'vol_spike': 0.1922213694137025, 'adx_thresh': 27.865595279636693, 'atr_min_pct': 0.0020854409413574738, 'atr_max_pct': 0.11204368495806714, 'tp_mult': 2.1885055737532952, 'tsl_mult': 0.7406510506781505, 'strategy': 'mean_reversion', 'time_stop': 43, 'use_sma': True, 'use_atr': True, 'use_adx': True, 'use_ema': False, 'use_spike': False, 'rsi_required': True, 'edge_k': 1.906853434968583, 'edge_cap': 0.6151138016438136}.
[I 2025-08-30 03:52:39,601] Trial 110 finished with values: [-0.05114117685301789, 0.051069641154446316] and parameters: {'p_sma': 30, 'p_std': 9, 'p_atr': 28, 'p_adx': 28, 'rsi_period': 74, 'ema1': 6, 'ema2': 13, 'slip_atr_k': 0.24758884491366712, 'slip_spread_k': 0.5927739734930348, 'spread_hl_frac': 0.049911781377464326, 'bb_std_mult': 2.817652587692358, 'rsi_os': 42, 'rsi_ob': 71, 'vol_spike': 0.19175744480026438, 'adx_thresh': 22.441188433185562, 'atr_min_pct': 0.0007340706067615612, 'atr_max_pct': 0.11219582493417396, 'tp_mult': 2.180775365568634, 'tsl_mult': 0.7606868312662319, 'strategy': 'mean_reversion', 'time_stop': 49, 'use_sma': True, 'use_atr': True, 'use_adx': True, 'use_ema': False, 'use_spike': False, 'rsi_required': True, 'edge_k': 1.8924812411552656, 'edge_cap': 0.5569048077481525}.
[I 2025-08-30 03:52:40,241] Trial 111 finished with values: [-0.053579932787152895, 0.05350852029146811] and parameters: {'p_sma': 30, 'p_std': 9, 'p_atr': 28, 'p_adx': 28, 'rsi_period': 74, 'ema1': 6, 'ema2': 13, 'slip_atr_k': 0.2498490530420993, 'slip_spread_k': 0.5939619752151539, 'spread_hl_frac': 0.04799770502210375, 'bb_std_mult': 2.85181165965008, 'rsi_os': 42, 'rsi_ob': 69, 'vol_spike': 0.19582534993536263, 'adx_thresh': 22.095964118118758, 'atr_min_pct': 3.4169365546317734e-05, 'atr_max_pct': 0.1114269365690299, 'tp_mult': 2.1732203255582374, 'tsl_mult': 0.765189634428064, 'strategy': 'mean_reversion', 'time_stop': 49, 'use_sma': True, 'use_atr': True, 'use_adx': True, 'use_ema': False, 'use_spike': False, 'rsi_required': True, 'edge_k': 1.8948044152843724, 'edge_cap': 0.6016335833798435}.
[I 2025-08-30 03:53:30,614] Trial 114 finished with values: [-0.03403557125822665, 0.03395328963512447] and parameters: {'p_sma': 32, 'p_std': 8, 'p_atr': 28, 'p_adx': 29, 'rsi_period': 75, 'ema1': 7, 'ema2': 13, 'slip_atr_k': 0.24658497357570822, 'slip_spread_k': 0.6018341281959688, 'spread_hl_frac': 0.04788421690181605, 'bb_std_mult': 2.7904676635215786, 'rsi_os': 40, 'rsi_ob': 70, 'vol_spike': 0.2009238557803891, 'adx_thresh': 27.941767610288647, 'atr_min_pct': 0.0020577578949881777, 'atr_max_pct': 0.11150687206616443, 'tp_mult': 2.3678295375568172, 'tsl_mult': 0.7533155317143716, 'strategy': 'mean_reversion', 'time_stop': 48, 'use_sma': True, 'use_atr': True, 'use_adx': True, 'use_ema': False, 'use_spike': False, 'rsi_required': True, 'edge_k': 1.9063965453295615, 'edge_cap': 0.6075404868303858}.
[I 2025-08-30 03:53:31,496] Trial 115 finished with values: [-1000000000.0, 1000000000.0] and parameters: {'p_sma': 32, 'p_std': 9, 'p_atr': 28, 'p_adx': 29, 'rsi_period': 72, 'ema1': 7, 'ema2': 13, 'slip_atr_k': 0.24874428216770011, 'slip_spread_k': 0.5993485453614965, 'spread_hl_frac': 0.048116315467752746, 'bb_std_mult': 2.7473082959357864, 'rsi_os': 41, 'rsi_ob': 70, 'vol_spike': 0.19283601000260397, 'adx_thresh': 27.60928148395238, 'atr_min_pct': 0.0032526697011750656, 'atr_max_pct': 0.11213758192162168, 'tp_mult': 2.1770044249324405, 'tsl_mult': 0.7561564632476014, 'strategy': 'mean_reversion', 'time_stop': 48, 'use_sma': True, 'use_atr': True, 'use_adx': True, 'use_ema': False, 'use_spike': False, 'rsi_required': True, 'edge_k': 1.8279784018383602, 'edge_cap': 0.6127322939228788}.
[I 2025-08-30 03:53:31,815] Trial 113 finished with values: [-0.03813497702553703, 0.03805284358002929] and parameters: {'p_sma': 30, 'p_std': 8, 'p_atr': 28, 'p_adx': 26, 'rsi_period': 74, 'ema1': 7, 'ema2': 13, 'slip_atr_k': 0.2493573807945238, 'slip_spread_k': 0.5895222213900497, 'spread_hl_frac': 0.04980387390703905, 'bb_std_mult': 2.7702347141368606, 'rsi_os': 40, 'rsi_ob': 70, 'vol_spike': 0.19367907048481625, 'adx_thresh': 21.960004028674096, 'atr_min_pct': 0.0020036372931464966, 'atr_max_pct': 0.11374216406068606, 'tp_mult': 2.150578071307757, 'tsl_mult': 0.7452038839542121, 'strategy': 'mean_reversion', 'time_stop': 46, 'use_sma': True, 'use_atr': True, 'use_adx': True, 'use_ema': False, 'use_spike': False, 'rsi_required': True, 'edge_k': 1.8945103631834743, 'edge_cap': 0.6697447975092071}.
[I 2025-08-30 03:53:32,025] Trial 116 finished with values: [-1000000000.0, 1000000000.0] and parameters: {'p_sma': 32, 'p_std': 9, 'p_atr': 28, 'p_adx': 29, 'rsi_period': 74, 'ema1': 7, 'ema2': 13, 'slip_atr_k': 0.2498810907394739, 'slip_spread_k': 0.5983613340206665, 'spread_hl_frac': 0.0483661227621361, 'bb_std_mult': 2.785174582449437, 'rsi_os': 40, 'rsi_ob': 69, 'vol_spike': 0.1941291532565245, 'adx_thresh': 32.97032189482653, 'atr_min_pct': 0.0034561886280385272, 'atr_max_pct': 0.11190251080368199, 'tp_mult': 2.2009352594296985, 'tsl_mult': 0.7537898858982514, 'strategy': 'mean_reversion', 'time_stop': 48, 'use_sma': True, 'use_atr': True, 'use_adx': True, 'use_ema': False, 'use_spike': False, 'rsi_required': True, 'edge_k': 1.8861711777002337, 'edge_cap': 0.6044713193616695}.
[I 2025-08-30 03:54:22,701] Trial 118 finished with values: [-1000000000.0, 1000000000.0] and parameters: {'p_sma': 34, 'p_std': 8, 'p_atr': 28, 'p_adx': 28, 'rsi_period': 76, 'ema1': 6, 'ema2': 14, 'slip_atr_k': 0.24331175695918844, 'slip_spread_k': 0.5942643377065127, 'spread_hl_frac': 0.04995859113343871, 'bb_std_mult': 2.8031474791039472, 'rsi_os': 43, 'rsi_ob': 69, 'vol_spike': 0.179185004077039, 'adx_thresh': 28.065944167377793, 'atr_min_pct': 0.00737070407957678, 'atr_max_pct': 0.11123711536051503, 'tp_mult': 2.166014391385204, 'tsl_mult': 0.7140760940083548, 'strategy': 'mean_reversion', 'time_stop': 40, 'use_sma': True, 'use_atr': True, 'use_adx': True, 'use_ema': False, 'use_spike': False, 'rsi_required': True, 'edge_k': 1.893183339287735, 'edge_cap': 0.6677779824857704}.
[I 2025-08-30 03:54:23,373] Trial 117 finished with values: [-1000000000.0, 1000000000.0] and parameters: {'p_sma': 30, 'p_std': 8, 'p_atr': 28, 'p_adx': 29, 'rsi_period': 74, 'ema1': 7, 'ema2': 13, 'slip_atr_k': 0.24638607646777766, 'slip_spread_k': 0.6007395005192663, 'spread_hl_frac': 0.04843459735118315, 'bb_std_mult': 2.757168412875476, 'rsi_os': 40, 'rsi_ob': 70, 'vol_spike': 0.17755664528250925, 'adx_thresh': 27.87737587229877, 'atr_min_pct': 0.003172438972408904, 'atr_max_pct': 0.1144282976706254, 'tp_mult': 2.173261563147429, 'tsl_mult': 0.7025597826790794, 'strategy': 'mean_reversion', 'time_stop': 50, 'use_sma': True, 'use_atr': True, 'use_adx': True, 'use_ema': False, 'use_spike': False, 'rsi_required': True, 'edge_k': 1.8884899961285058, 'edge_cap': 0.6099373105991668}.
[I 2025-08-30 03:54:24,196] Trial 120 finished with values: [-0.033756143985950615, 0.03367509529546133] and parameters: {'p_sma': 34, 'p_std': 6, 'p_atr': 28, 'p_adx': 28, 'rsi_period': 75, 'ema1': 6, 'ema2': 16, 'slip_atr_k': 0.22150552793822403, 'slip_spread_k': 0.6480466132268469, 'spread_hl_frac': 0.049884261805146414, 'bb_std_mult': 2.878413968684806, 'rsi_os': 38, 'rsi_ob': 72, 'vol_spike': 0.18040661710786288, 'adx_thresh': 29.12000059137225, 'atr_min_pct': 0.002047754648955475, 'atr_max_pct': 0.10476034102354861, 'tp_mult': 2.1687351661002263, 'tsl_mult': 0.7000018763075841, 'strategy': 'mean_reversion', 'time_stop': 29, 'use_sma': True, 'use_atr': True, 'use_adx': True, 'use_ema': False, 'use_spike': False, 'rsi_required': True, 'edge_k': 1.9217426778188589, 'edge_cap': 0.6667058288946771}.
[I 2025-08-30 03:54:24,679] Trial 119 finished with values: [-0.029038149570335237, 0.0289611255736901] and parameters: {'p_sma': 30, 'p_std': 8, 'p_atr': 28, 'p_adx': 28, 'rsi_period': 75, 'ema1': 6, 'ema2': 16, 'slip_atr_k': 0.19645179284300857, 'slip_spread_k': 0.6433306394973699, 'spread_hl_frac': 0.04883142594870051, 'bb_std_mult': 2.6554159463995286, 'rsi_os': 38, 'rsi_ob': 72, 'vol_spike': 0.20270218423430564, 'adx_thresh': 29.254875259180704, 'atr_min_pct': 0.0021021565424833564, 'atr_max_pct': 0.12304809895452276, 'tp_mult': 2.1695868600209343, 'tsl_mult': 0.7116300383288775, 'strategy': 'mean_reversion', 'time_stop': 39, 'use_sma': True, 'use_atr': True, 'use_adx': True, 'use_ema': False, 'use_spike': False, 'rsi_required': True, 'edge_k': 1.8967324249019684, 'edge_cap': 0.6772726185076566}.
[I 2025-08-30 03:55:13,663] Trial 121 finished with values: [-1000000000.0, 1000000000.0] and parameters: {'p_sma': 30, 'p_std': 6, 'p_atr': 30, 'p_adx': 28, 'rsi_period': 72, 'ema1': 8, 'ema2': 16, 'slip_atr_k': 0.22188895206005047, 'slip_spread_k': 0.6456627513089188, 'spread_hl_frac': 0.04686094399290849, 'bb_std_mult': 2.641253448278503, 'rsi_os': 37, 'rsi_ob': 72, 'vol_spike': 0.20171995010753216, 'adx_thresh': 29.357318033849022, 'atr_min_pct': 0.004567356044461481, 'atr_max_pct': 0.10508491610710397, 'tp_mult': 2.3859837200307217, 'tsl_mult': 0.8088394131640785, 'strategy': 'mean_reversion', 'time_stop': 28, 'use_sma': True, 'use_atr': True, 'use_adx': True, 'use_ema': False, 'use_spike': False, 'rsi_required': True, 'edge_k': 1.9191084207460056, 'edge_cap': 0.554878056035969}.
[I 2025-08-30 03:55:13,663] Trial 123 finished with values: [-1000000000.0, 1000000000.0] and parameters: {'p_sma': 30, 'p_std': 12, 'p_atr': 29, 'p_adx': 28, 'rsi_period': 70, 'ema1': 8, 'ema2': 16, 'slip_atr_k': 0.23294064497013084, 'slip_spread_k': 0.6511392796143405, 'spread_hl_frac': 0.045395462777497536, 'bb_std_mult': 2.665674298711865, 'rsi_os': 37, 'rsi_ob': 72, 'vol_spike': 0.20404226458948097, 'adx_thresh': 29.148743939549675, 'atr_min_pct': 0.006029335303147454, 'atr_max_pct': 0.12282733075977229, 'tp_mult': 2.364426837752206, 'tsl_mult': 0.8051227656614426, 'strategy': 'mean_reversion', 'time_stop': 29, 'use_sma': True, 'use_atr': True, 'use_adx': True, 'use_ema': False, 'use_spike': False, 'rsi_required': True, 'edge_k': 1.934757879553676, 'edge_cap': 0.5663609128151932}.
[I 2025-08-30 03:55:14,288] Trial 124 finished with values: [-0.03610270718432507, 0.03602979667853721] and parameters: {'p_sma': 30, 'p_std': 5, 'p_atr': 29, 'p_adx': 27, 'rsi_period': 71, 'ema1': 5, 'ema2': 16, 'slip_atr_k': 0.17338385356289635, 'slip_spread_k': 0.6511929996273439, 'spread_hl_frac': 0.04726220291635618, 'bb_std_mult': 2.6470242447288017, 'rsi_os': 33, 'rsi_ob': 73, 'vol_spike': 0.2055148258019155, 'adx_thresh': 29.94372756844698, 'atr_min_pct': 0.0016648662230309688, 'atr_max_pct': 0.12303898395550963, 'tp_mult': 2.251774009931924, 'tsl_mult': 0.6845178366324617, 'strategy': 'mean_reversion', 'time_stop': 32, 'use_sma': True, 'use_atr': True, 'use_adx': True, 'use_ema': False, 'use_spike': False, 'rsi_required': True, 'edge_k': 1.9366385120451142, 'edge_cap': 0.6654133171192282}.
[I 2025-08-30 03:55:14,600] Trial 122 finished with values: [-1000000000.0, 1000000000.0] and parameters: {'p_sma': 30, 'p_std': 6, 'p_atr': 29, 'p_adx': 28, 'rsi_period': 70, 'ema1': 8, 'ema2': 16, 'slip_atr_k': 0.1990144576366134, 'slip_spread_k': 0.6509770848054725, 'spread_hl_frac': 0.047164647097699894, 'bb_std_mult': 2.6327736547863703, 'rsi_os': 38, 'rsi_ob': 72, 'vol_spike': 0.2016569894528099, 'adx_thresh': 29.522923806713443, 'atr_min_pct': 0.0024839779193998415, 'atr_max_pct': 0.10422388047001185, 'tp_mult': 2.2356009320279044, 'tsl_mult': 0.7952855553456939, 'strategy': 'mean_reversion', 'time_stop': 34, 'use_sma': True, 'use_atr': True, 'use_adx': True, 'use_ema': False, 'use_spike': False, 'rsi_required': True, 'edge_k': 1.9940961402005013, 'edge_cap': 0.557331496200251}.
[I 2025-08-30 03:55:55,157] Trial 127 finished with values: [-1000000000.0, 1000000000.0] and parameters: {'p_sma': 34, 'p_std': 5, 'p_atr': 27, 'p_adx': 27, 'rsi_period': 75, 'ema1': 5, 'ema2': 17, 'slip_atr_k': 0.1947673882189451, 'slip_spread_k': 0.6769454873911194, 'spread_hl_frac': 0.04913564700160649, 'bb_std_mult': 2.5351787850902343, 'rsi_os': 38, 'rsi_ob': 73, 'vol_spike': 0.22022822171261794, 'adx_thresh': 30.542368569307172, 'atr_min_pct': 0.015589488571203172, 'atr_max_pct': 0.13006773864160148, 'tp_mult': 2.269483923001091, 'tsl_mult': 0.6794223494003828, 'strategy': 'mean_reversion', 'time_stop': 19, 'use_sma': True, 'use_atr': True, 'use_adx': True, 'use_ema': False, 'use_spike': False, 'rsi_required': True, 'edge_k': 1.6819128244548913, 'edge_cap': 0.6659165217264608}.
[I 2025-08-30 03:55:55,786] Trial 128 finished with values: [-0.031940830719785485, 0.03188224055280667] and parameters: {'p_sma': 34, 'p_std': 10, 'p_atr': 26, 'p_adx': 27, 'rsi_period': 78, 'ema1': 5, 'ema2': 17, 'slip_atr_k': 0.19237025709392114, 'slip_spread_k': 0.6727190822917745, 'spread_hl_frac': 0.049030347517895215, 'bb_std_mult': 2.4742956237338896, 'rsi_os': 34, 'rsi_ob': 73, 'vol_spike': 0.22139865951494764, 'adx_thresh': 30.458980884125065, 'atr_min_pct': 0.0019953285538156784, 'atr_max_pct': 0.12170033514489122, 'tp_mult': 2.2589568595927996, 'tsl_mult': 0.6680498390435848, 'strategy': 'mean_reversion', 'time_stop': 18, 'use_sma': True, 'use_atr': True, 'use_adx': True, 'use_ema': False, 'use_spike': False, 'rsi_required': True, 'edge_k': 1.8176768337661957, 'edge_cap': 0.6724955106867938}.
[I 2025-08-30 03:55:56,402] Trial 125 finished with values: [-0.02994917733519964, 0.02987033117054206] and parameters: {'p_sma': 29, 'p_std': 5, 'p_atr': 27, 'p_adx': 27, 'rsi_period': 75, 'ema1': 5, 'ema2': 17, 'slip_atr_k': 0.17108783002604996, 'slip_spread_k': 0.6711026043608156, 'spread_hl_frac': 0.047637826163830894, 'bb_std_mult': 2.47908260290017, 'rsi_os': 33, 'rsi_ob': 73, 'vol_spike': 0.19773769695467658, 'adx_thresh': 29.994320951679548, 'atr_min_pct': 0.0020837447705024815, 'atr_max_pct': 0.1279140719792163, 'tp_mult': 2.2514544870993243, 'tsl_mult': 0.6714526699702456, 'strategy': 'mean_reversion', 'time_stop': 20, 'use_sma': True, 'use_atr': True, 'use_adx': True, 'use_ema': False, 'use_spike': False, 'rsi_required': True, 'edge_k': 1.9958608179106634, 'edge_cap': 0.6647927285202533}.
[I 2025-08-30 03:55:56,768] Trial 126 finished with values: [-0.030346167069365437, 0.030283149710763183] and parameters: {'p_sma': 29, 'p_std': 11, 'p_atr': 26, 'p_adx': 27, 'rsi_period': 79, 'ema1': 5, 'ema2': 17, 'slip_atr_k': 0.19566764940859946, 'slip_spread_k': 0.7155426263476858, 'spread_hl_frac': 0.04730506720772148, 'bb_std_mult': 2.590847502835716, 'rsi_os': 33, 'rsi_ob': 73, 'vol_spike': 0.20560545678946027, 'adx_thresh': 30.524438815903615, 'atr_min_pct': 0.001901845847720414, 'atr_max_pct': 0.12295516985889128, 'tp_mult': 2.0972283932480917, 'tsl_mult': 0.6746203243134745, 'strategy': 'mean_reversion', 'time_stop': 33, 'use_sma': True, 'use_atr': True, 'use_adx': True, 'use_ema': False, 'use_spike': False, 'rsi_required': True, 'edge_k': 1.7027018784645909, 'edge_cap': 0.7052131372262438}.
[I 2025-08-30 03:56:37,383] Trial 131 finished with values: [-1000000000.0, 1000000000.0] and parameters: {'p_sma': 27, 'p_std': 6, 'p_atr': 26, 'p_adx': 26, 'rsi_period': 78, 'ema1': 5, 'ema2': 15, 'slip_atr_k': 0.2046111933459479, 'slip_spread_k': 0.7078307614284327, 'spread_hl_frac': 0.0445385154803744, 'bb_std_mult': 2.4248755847411925, 'rsi_os': 35, 'rsi_ob': 74, 'vol_spike': 0.2269999267214343, 'adx_thresh': 28.728397139014618, 'atr_min_pct': 0.01803395154013694, 'atr_max_pct': 0.13373308080815471, 'tp_mult': 2.090161544739356, 'tsl_mult': 0.7391285369028071, 'strategy': 'mean_reversion', 'time_stop': 63, 'use_sma': True, 'use_atr': True, 'use_adx': True, 'use_ema': False, 'use_spike': False, 'rsi_required': True, 'edge_k': 1.8400053653803006, 'edge_cap': 0.7078420429257298}.
[I 2025-08-30 03:56:39,167] Trial 132 finished with values: [-1000000000.0, 1000000000.0] and parameters: {'p_sma': 28, 'p_std': 11, 'p_atr': 27, 'p_adx': 26, 'rsi_period': 77, 'ema1': 5, 'ema2': 20, 'slip_atr_k': 0.20448721012704144, 'slip_spread_k': 0.7136089808336296, 'spread_hl_frac': 0.04399825417733135, 'bb_std_mult': 2.4548883580421568, 'rsi_os': 34, 'rsi_ob': 74, 'vol_spike': 0.22656465865455916, 'adx_thresh': 29.894642571652117, 'atr_min_pct': 0.008957709516031951, 'atr_max_pct': 0.12180552572641883, 'tp_mult': 2.0992632823330006, 'tsl_mult': 0.7410311585995152, 'strategy': 'mean_reversion', 'time_stop': 68, 'use_sma': True, 'use_atr': True, 'use_adx': True, 'use_ema': False, 'use_spike': False, 'rsi_required': True, 'edge_k': 1.8132906979020256, 'edge_cap': 0.7019043135927343}.
[I 2025-08-30 03:56:39,168] Trial 129 finished with values: [-0.03820095568388826, 0.03815694480347824] and parameters: {'p_sma': 29, 'p_std': 11, 'p_atr': 28, 'p_adx': 26, 'rsi_period': 79, 'ema1': 6, 'ema2': 20, 'slip_atr_k': 0.2038850075132392, 'slip_spread_k': 0.7182701408659908, 'spread_hl_frac': 0.04758321536066963, 'bb_std_mult': 2.4501901400456063, 'rsi_os': 34, 'rsi_ob': 74, 'vol_spike': 0.22770183630369958, 'adx_thresh': 30.017424391231348, 'atr_min_pct': 0.0008214989354287459, 'atr_max_pct': 0.12190977652291463, 'tp_mult': 2.100260319829651, 'tsl_mult': 0.7394186725810354, 'strategy': 'mean_reversion', 'time_stop': 40, 'use_sma': True, 'use_atr': True, 'use_adx': True, 'use_ema': False, 'use_spike': False, 'rsi_required': True, 'edge_k': 1.8291471929915366, 'edge_cap': 0.7064358914952192}.
[I 2025-08-30 03:56:39,177] Trial 130 finished with values: [-1000000000.0, 1000000000.0] and parameters: {'p_sma': 23, 'p_std': 11, 'p_atr': 26, 'p_adx': 26, 'rsi_period': 78, 'ema1': 5, 'ema2': 19, 'slip_atr_k': 0.18609122132032282, 'slip_spread_k': 0.7141172713681019, 'spread_hl_frac': 0.04967568336213723, 'bb_std_mult': 2.6074821025463044, 'rsi_os': 34, 'rsi_ob': 74, 'vol_spike': 0.22988227811401035, 'adx_thresh': 30.15350473845086, 'atr_min_pct': 0.002083045095575244, 'atr_max_pct': 0.12114413072411083, 'tp_mult': 2.1250875843772037, 'tsl_mult': 0.7374393143553314, 'strategy': 'mean_reversion', 'time_stop': 64, 'use_sma': True, 'use_atr': True, 'use_adx': True, 'use_ema': False, 'use_spike': False, 'rsi_required': True, 'edge_k': 1.818371320403647, 'edge_cap': 0.6794435350282125}.
[I 2025-08-30 03:57:19,905] Trial 135 finished with values: [-1000000000.0, 1000000000.0] and parameters: {'p_sma': 32, 'p_std': 7, 'p_atr': 27, 'p_adx': 27, 'rsi_period': 81, 'ema1': 7, 'ema2': 15, 'slip_atr_k': 0.18924539410785704, 'slip_spread_k': 0.6371927919031242, 'spread_hl_frac': 0.04602058625445103, 'bb_std_mult': 2.4894451831056577, 'rsi_os': 37, 'rsi_ob': 76, 'vol_spike': 0.20976068116435656, 'adx_thresh': 26.875505032642145, 'atr_min_pct': 0.014123358513337748, 'atr_max_pct': 0.12736684080051114, 'tp_mult': 2.2340638170058367, 'tsl_mult': 0.6925322834129314, 'strategy': 'mean_reversion', 'time_stop': 42, 'use_sma': True, 'use_atr': True, 'use_adx': True, 'use_ema': False, 'use_spike': False, 'rsi_required': True, 'edge_k': 1.7365933171056667, 'edge_cap': 0.7572659637639524}.
[I 2025-08-30 03:57:20,862] Trial 136 finished with values: [-1000000000.0, 1000000000.0] and parameters: {'p_sma': 32, 'p_std': 7, 'p_atr': 30, 'p_adx': 27, 'rsi_period': 81, 'ema1': 7, 'ema2': 17, 'slip_atr_k': 0.19229731436938297, 'slip_spread_k': 0.6324070933482828, 'spread_hl_frac': 0.04580644864887711, 'bb_std_mult': 2.4706901625509996, 'rsi_os': 32, 'rsi_ob': 71, 'vol_spike': 0.21026946297233598, 'adx_thresh': 27.020804026366996, 'atr_min_pct': 0.010174796320609199, 'atr_max_pct': 0.12663114453981086, 'tp_mult': 2.0312035637403203, 'tsl_mult': 0.7032629091013228, 'strategy': 'mean_reversion', 'time_stop': 39, 'use_sma': True, 'use_atr': True, 'use_adx': True, 'use_ema': False, 'use_spike': False, 'rsi_required': True, 'edge_k': 1.765377731228334, 'edge_cap': 0.7748547876341998}.
