[I 2025-08-31 11:36:13,502] Trial 776 finished with values: [-0.021881663043221256, 0.022026077573443194] and parameters: {'p_sma': 29, 'p_std': 12, 'p_atr': 19, 'p_adx': 30, 'rsi_period': 51, 'ema1': 12, 'ema2': 44, 'slip_atr_k': 0.027919024292679187, 'slip_spread_k': 0.16904589519414062, 'spread_hl_frac': 0.023221516230916332, 'bb_std_mult': 2.755125211505351, 'rsi_os': 28, 'rsi_ob': 93, 'vol_spike': 0.27618057703869076, 'adx_thresh': 33.133083569093074, 'atr_min_pct': 0.010380280496245776, 'atr_max_pct': 0.14041950297916797, 'tp_mult': 1.7253916049139202, 'tsl_mult': 0.050372379589028925, 'strategy': 'breakout', 'time_stop': 208, 'use_sma': True, 'use_atr': True, 'use_adx': False, 'use_ema': True, 'use_spike': True, 'rsi_required': False, 'edge_k': 0.34165708580076537, 'edge_cap': 0.9340930981026835, 'bull_strategy': 'mean_reversion', 'bull_bb_std_mult': 1.6108562072381973, 'bull_rsi_os': 13, 'bull_rsi_ob': 83, 'bull_adx_thresh': 5.634873793424939, 'bull_atr_min_pct': 0.003077498428584769, 'bull_atr_max_pct': 0.0930864289006508, 'bull_tp_mult': 2.599801197770283, 'bull_tsl_mult': 0.48630102366864314, 'bull_time_stop': 288, 'bull_use_sma': False, 'bull_use_ema': True, 'bull_use_atr': True, 'bull_use_adx': True, 'bull_use_spike': False, 'bull_rsi_required': True, 'bear_strategy': 'breakout', 'bear_bb_std_mult': 3.1468369261608475, 'bear_rsi_os': 52, 'bear_rsi_ob': 76, 'bear_adx_thresh': 6.524485014557047, 'bear_atr_min_pct': 0.004447736173850012, 'bear_atr_max_pct': 0.14072969849416236, 'bear_tp_mult': 2.770198206065893, 'bear_tsl_mult': 0.7286598049125248, 'bear_time_stop': 33, 'bear_use_sma': True, 'bear_use_ema': False, 'bear_use_atr': False, 'bear_use_adx': False, 'bear_use_spike': False, 'bear_rsi_required': True, 'sideways_strategy': 'breakout', 'sideways_bb_std_mult': 2.7113795393876363, 'sideways_rsi_os': 23, 'sideways_rsi_ob': 93, 'sideways_adx_thresh': 15.2716289557495, 'sideways_atr_min_pct': 0.017433539731143474, 'sideways_atr_max_pct': 0.041410423964862074, 'sideways_tp_mult': 1.9973282081676356, 'sideways_tsl_mult': 0.43077295861750575, 'sideways_time_stop': 15, 'sideways_use_sma': False, 'sideways_use_ema': False, 'sideways_use_atr': True, 'sideways_use_adx': True, 'sideways_use_spike': True, 'sideways_rsi_required': False}.
[I 2025-08-31 11:36:13,735] Trial 774 finished with values: [-0.07584624485142044, 0.07539857553704982] and parameters: {'p_sma': 15, 'p_std': 51, 'p_atr': 28, 'p_adx': 13, 'rsi_period': 56, 'ema1': 12, 'ema2': 44, 'slip_atr_k': 0.08827428612139804, 'slip_spread_k': 0.1707665855697672, 'spread_hl_frac': 0.04136848066884205, 'bb_std_mult': 1.9688166926521118, 'rsi_os': 41, 'rsi_ob': 95, 'vol_spike': 0.2806170237811911, 'adx_thresh': 33.12583882817561, 'atr_min_pct': 0.010222484046431148, 'atr_max_pct': 0.1410751207389805, 'tp_mult': 1.8037820445711625, 'tsl_mult': 0.016900362822481897, 'strategy': 'breakout', 'time_stop': 182, 'use_sma': True, 'use_atr': False, 'use_adx': True, 'use_ema': True, 'use_spike': True, 'rsi_required': False, 'edge_k': 0.2940106404159937, 'edge_cap': 0.1280917198088573, 'bull_strategy': 'mean_reversion', 'bull_bb_std_mult': 1.496563138913548, 'bull_rsi_os': 47, 'bull_rsi_ob': 86, 'bull_adx_thresh': 20.90789929713687, 'bull_atr_min_pct': 0.019412754122074133, 'bull_atr_max_pct': 0.09292073923389563, 'bull_tp_mult': 1.8405470094242826, 'bull_tsl_mult': 0.41008661629117193, 'bull_time_stop': 285, 'bull_use_sma': False, 'bull_use_ema': True, 'bull_use_atr': False, 'bull_use_adx': True, 'bull_use_spike': False, 'bull_rsi_required': True, 'bear_strategy': 'breakout', 'bear_bb_std_mult': 3.1425499093289924, 'bear_rsi_os': 52, 'bear_rsi_ob': 74, 'bear_adx_thresh': 5.016117270822515, 'bear_atr_min_pct': 0.0004830473137164889, 'bear_atr_max_pct': 0.13985109619233044, 'bear_tp_mult': 2.1015586838856755, 'bear_tsl_mult': 0.6970912100708595, 'bear_time_stop': 28, 'bear_use_sma': True, 'bear_use_ema': True, 'bear_use_atr': False, 'bear_use_adx': False, 'bear_use_spike': False, 'bear_rsi_required': True, 'sideways_strategy': 'breakout', 'sideways_bb_std_mult': 3.001381196589948, 'sideways_rsi_os': 23, 'sideways_rsi_ob': 61, 'sideways_adx_thresh': 11.245286136452341, 'sideways_atr_min_pct': 0.016470888701234677, 'sideways_atr_max_pct': 0.04051476961984438, 'sideways_tp_mult': 1.9613654437234653, 'sideways_tsl_mult': 0.43430456739605483, 'sideways_time_stop': 15, 'sideways_use_sma': False, 'sideways_use_ema': False, 'sideways_use_atr': True, 'sideways_use_adx': True, 'sideways_use_spike': True, 'sideways_rsi_required': False}.
[I 2025-08-31 11:36:13,825] Trial 773 finished with values: [-0.03181627816679977, 0.031559624454916176] and parameters: {'p_sma': 15, 'p_std': 12, 'p_atr': 8, 'p_adx': 16, 'rsi_period': 56, 'ema1': 10, 'ema2': 44, 'slip_atr_k': 0.08882339379777662, 'slip_spread_k': 0.11437858511062451, 'spread_hl_frac': 0.024952719633095515, 'bb_std_mult': 1.7315610900376666, 'rsi_os': 41, 'rsi_ob': 95, 'vol_spike': 0.28026333498149303, 'adx_thresh': 32.82923151708842, 'atr_min_pct': 0.010418589468606106, 'atr_max_pct': 0.1498077075414999, 'tp_mult': 1.7054494798673219, 'tsl_mult': 0.012031360302467597, 'strategy': 'breakout', 'time_stop': 204, 'use_sma': False, 'use_atr': False, 'use_adx': True, 'use_ema': True, 'use_spike': True, 'rsi_required': False, 'edge_k': 0.2901208224321146, 'edge_cap': 0.5056046999837571, 'bull_strategy': 'mean_reversion', 'bull_bb_std_mult': 2.922780522540924, 'bull_rsi_os': 13, 'bull_rsi_ob': 85, 'bull_adx_thresh': 13.845139575871576, 'bull_atr_min_pct': 0.019341589746027992, 'bull_atr_max_pct': 0.09268624817681176, 'bull_tp_mult': 1.8354236041539205, 'bull_tsl_mult': 0.48523142607091324, 'bull_time_stop': 288, 'bull_use_sma': False, 'bull_use_ema': True, 'bull_use_atr': False, 'bull_use_adx': True, 'bull_use_spike': False, 'bull_rsi_required': True, 'bear_strategy': 'breakout', 'bear_bb_std_mult': 3.1505164136619936, 'bear_rsi_os': 48, 'bear_rsi_ob': 74, 'bear_adx_thresh': 6.306185270952667, 'bear_atr_min_pct': 0.0043565733225965145, 'bear_atr_max_pct': 0.03309943514768252, 'bear_tp_mult': 1.3786449194159878, 'bear_tsl_mult': 0.7948640649909186, 'bear_time_stop': 29, 'bear_use_sma': True, 'bear_use_ema': True, 'bear_use_atr': True, 'bear_use_adx': False, 'bear_use_spike': False, 'bear_rsi_required': True, 'sideways_strategy': 'breakout', 'sideways_bb_std_mult': 2.9794456019298776, 'sideways_rsi_os': 23, 'sideways_rsi_ob': 55, 'sideways_adx_thresh': 13.084425577400848, 'sideways_atr_min_pct': 0.012462902377330913, 'sideways_atr_max_pct': 0.039838147759590256, 'sideways_tp_mult': 1.9449886484713257, 'sideways_tsl_mult': 0.37382654205710414, 'sideways_time_stop': 183, 'sideways_use_sma': False, 'sideways_use_ema': False, 'sideways_use_atr': True, 'sideways_use_adx': False, 'sideways_use_spike': True, 'sideways_rsi_required': True}.
[I 2025-08-31 11:36:47,881] Trial 778 finished with values: [-1000000000.0, 1000000000.0] and parameters: {'p_sma': 12, 'p_std': 30, 'p_atr': 11, 'p_adx': 14, 'rsi_period': 52, 'ema1': 11, 'ema2': 41, 'slip_atr_k': 0.031180690746751134, 'slip_spread_k': 0.23193932075893794, 'spread_hl_frac': 0.006389937579832864, 'bb_std_mult': 0.9080201030592021, 'rsi_os': 48, 'rsi_ob': 92, 'vol_spike': 0.2218782524999972, 'adx_thresh': 31.301973768377835, 'atr_min_pct': 0.01002144616296689, 'atr_max_pct': 0.1421834779386079, 'tp_mult': 1.8149481824421023, 'tsl_mult': 0.07489339579273513, 'strategy': 'breakout', 'time_stop': 182, 'use_sma': True, 'use_atr': False, 'use_adx': True, 'use_ema': True, 'use_spike': False, 'rsi_required': False, 'edge_k': 0.5551416208091535, 'edge_cap': 0.2815489903686594, 'bull_strategy': 'breakout', 'bull_bb_std_mult': 2.2176583363381703, 'bull_rsi_os': 51, 'bull_rsi_ob': 81, 'bull_adx_thresh': 5.628716589089171, 'bull_atr_min_pct': 0.004622364289762359, 'bull_atr_max_pct': 0.12798901741213858, 'bull_tp_mult': 1.8314080612829373, 'bull_tsl_mult': 0.7037203740750155, 'bull_time_stop': 286, 'bull_use_sma': False, 'bull_use_ema': True, 'bull_use_atr': False, 'bull_use_adx': False, 'bull_use_spike': False, 'bull_rsi_required': True, 'bear_strategy': 'breakout', 'bear_bb_std_mult': 3.259606770098812, 'bear_rsi_os': 52, 'bear_rsi_ob': 73, 'bear_adx_thresh': 5.957942692797106, 'bear_atr_min_pct': 0.0050486997814140995, 'bear_atr_max_pct': 0.13244219133325275, 'bear_tp_mult': 1.6806948447021695, 'bear_tsl_mult': 0.6992039497955446, 'bear_time_stop': 26, 'bear_use_sma': False, 'bear_use_ema': True, 'bear_use_atr': False, 'bear_use_adx': False, 'bear_use_spike': False, 'bear_rsi_required': False, 'sideways_strategy': 'breakout', 'sideways_bb_std_mult': 2.8498646530304907, 'sideways_rsi_os': 24, 'sideways_rsi_ob': 58, 'sideways_adx_thresh': 10.165179816535526, 'sideways_atr_min_pct': 0.02924051699704435, 'sideways_atr_max_pct': 0.04512833872849257, 'sideways_tp_mult': 2.7953998797038047, 'sideways_tsl_mult': 0.3751534186863216, 'sideways_time_stop': 109, 'sideways_use_sma': False, 'sideways_use_ema': False, 'sideways_use_atr': True, 'sideways_use_adx': False, 'sideways_use_spike': True, 'sideways_rsi_required': True}.
[I 2025-08-31 11:36:47,882] Trial 780 finished with values: [-1000000000.0, 1000000000.0] and parameters: {'p_sma': 50, 'p_std': 30, 'p_atr': 20, 'p_adx': 14, 'rsi_period': 51, 'ema1': 11, 'ema2': 41, 'slip_atr_k': 0.23858486635766024, 'slip_spread_k': 0.22631332347433283, 'spread_hl_frac': 0.005663615693494883, 'bb_std_mult': 2.715928787803993, 'rsi_os': 46, 'rsi_ob': 93, 'vol_spike': 0.27125222034180124, 'adx_thresh': 30.563439174579237, 'atr_min_pct': 0.012392452329374295, 'atr_max_pct': 0.14520035689689442, 'tp_mult': 1.629262512295366, 'tsl_mult': 0.059005421765737254, 'strategy': 'breakout', 'time_stop': 195, 'use_sma': True, 'use_atr': True, 'use_adx': False, 'use_ema': True, 'use_spike': False, 'rsi_required': False, 'edge_k': 0.4286016809128183, 'edge_cap': 0.052553127253728016, 'bull_strategy': 'breakout', 'bull_bb_std_mult': 2.231737479875593, 'bull_rsi_os': 11, 'bull_rsi_ob': 81, 'bull_adx_thresh': 17.74651492477671, 'bull_atr_min_pct': 0.0044497605682665455, 'bull_atr_max_pct': 0.09932787727000747, 'bull_tp_mult': 1.7863205962477382, 'bull_tsl_mult': 0.37742843061176434, 'bull_time_stop': 294, 'bull_use_sma': False, 'bull_use_ema': True, 'bull_use_atr': True, 'bull_use_adx': False, 'bull_use_spike': True, 'bull_rsi_required': True, 'bear_strategy': 'breakout', 'bear_bb_std_mult': 3.27206960330501, 'bear_rsi_os': 53, 'bear_rsi_ob': 72, 'bear_adx_thresh': 34.12332778549764, 'bear_atr_min_pct': 0.02516755610919479, 'bear_atr_max_pct': 0.13185895205202192, 'bear_tp_mult': 1.5478886616795087, 'bear_tsl_mult': 0.7370742035290476, 'bear_time_stop': 52, 'bear_use_sma': False, 'bear_use_ema': True, 'bear_use_atr': False, 'bear_use_adx': False, 'bear_use_spike': False, 'bear_rsi_required': False, 'sideways_strategy': 'breakout', 'sideways_bb_std_mult': 3.29846428590052, 'sideways_rsi_os': 25, 'sideways_rsi_ob': 94, 'sideways_adx_thresh': 16.629172767264183, 'sideways_atr_min_pct': 0.02913666650210477, 'sideways_atr_max_pct': 0.13447746865829313, 'sideways_tp_mult': 2.118800257806749, 'sideways_tsl_mult': 0.3896568702999539, 'sideways_time_stop': 108, 'sideways_use_sma': False, 'sideways_use_ema': False, 'sideways_use_atr': True, 'sideways_use_adx': False, 'sideways_use_spike': True, 'sideways_rsi_required': True}.
[I 2025-08-31 11:36:48,137] Trial 777 finished with values: [-0.010960390870532133, 0.01102379700762694] and parameters: {'p_sma': 15, 'p_std': 41, 'p_atr': 28, 'p_adx': 23, 'rsi_period': 51, 'ema1': 11, 'ema2': 40, 'slip_atr_k': 0.029346216065903888, 'slip_spread_k': 0.1575854331458468, 'spread_hl_frac': 0.04007585710796338, 'bb_std_mult': 0.8949930593435769, 'rsi_os': 8, 'rsi_ob': 92, 'vol_spike': 0.27456203294378717, 'adx_thresh': 34.16735800117493, 'atr_min_pct': 0.010062322742650415, 'atr_max_pct': 0.141130975492337, 'tp_mult': 1.811382278975721, 'tsl_mult': 0.054621646415624434, 'strategy': 'breakout', 'time_stop': 184, 'use_sma': True, 'use_atr': True, 'use_adx': False, 'use_ema': True, 'use_spike': False, 'rsi_required': False, 'edge_k': 0.42557291025080396, 'edge_cap': 0.542454114597514, 'bull_strategy': 'breakout', 'bull_bb_std_mult': 3.530444197292532, 'bull_rsi_os': 10, 'bull_rsi_ob': 81, 'bull_adx_thresh': 13.656248534842387, 'bull_atr_min_pct': 0.0030771729663206003, 'bull_atr_max_pct': 0.12813360819269384, 'bull_tp_mult': 1.8343638327432041, 'bull_tsl_mult': 0.5998579489152426, 'bull_time_stop': 284, 'bull_use_sma': False, 'bull_use_ema': True, 'bull_use_atr': True, 'bull_use_adx': True, 'bull_use_spike': False, 'bull_rsi_required': True, 'bear_strategy': 'breakout', 'bear_bb_std_mult': 3.1695139574983227, 'bear_rsi_os': 52, 'bear_rsi_ob': 74, 'bear_adx_thresh': 10.750710719810328, 'bear_atr_min_pct': 0.004289473196900498, 'bear_atr_max_pct': 0.04267910208724243, 'bear_tp_mult': 2.7651778420132493, 'bear_tsl_mult': 0.7458769023991237, 'bear_time_stop': 27, 'bear_use_sma': False, 'bear_use_ema': True, 'bear_use_atr': False, 'bear_use_adx': False, 'bear_use_spike': False, 'bear_rsi_required': False, 'sideways_strategy': 'breakout', 'sideways_bb_std_mult': 2.7308373000980226, 'sideways_rsi_os': 22, 'sideways_rsi_ob': 93, 'sideways_adx_thresh': 15.35671887886366, 'sideways_atr_min_pct': 0.001670655073417994, 'sideways_atr_max_pct': 0.04193578004355447, 'sideways_tp_mult': 2.791841872793333, 'sideways_tsl_mult': 0.3827588913940927, 'sideways_time_stop': 172, 'sideways_use_sma': False, 'sideways_use_ema': False, 'sideways_use_atr': True, 'sideways_use_adx': True, 'sideways_use_spike': True, 'sideways_rsi_required': True}.
[I 2025-08-31 11:36:48,236] Trial 779 finished with values: [-1000000000.0, 1000000000.0] and parameters: {'p_sma': 12, 'p_std': 40, 'p_atr': 10, 'p_adx': 14, 'rsi_period': 51, 'ema1': 11, 'ema2': 41, 'slip_atr_k': 0.1428957959586857, 'slip_spread_k': 0.22404530312794996, 'spread_hl_frac': 0.04854208706042473, 'bb_std_mult': 2.856999678719257, 'rsi_os': 44, 'rsi_ob': 93, 'vol_spike': 0.2683630473463043, 'adx_thresh': 31.218944198084035, 'atr_min_pct': 0.012302186821823952, 'atr_max_pct': 0.14522478515894238, 'tp_mult': 1.6165974761684752, 'tsl_mult': 0.07739305056135895, 'strategy': 'breakout', 'time_stop': 211, 'use_sma': True, 'use_atr': True, 'use_adx': False, 'use_ema': True, 'use_spike': False, 'rsi_required': False, 'edge_k': 0.41711458245261035, 'edge_cap': 0.54494113081739, 'bull_strategy': 'breakout', 'bull_bb_std_mult': 2.2791351232745867, 'bull_rsi_os': 52, 'bull_rsi_ob': 84, 'bull_adx_thresh': 5.737144120633724, 'bull_atr_min_pct': 0.004548689517253717, 'bull_atr_max_pct': 0.0503839250911476, 'bull_tp_mult': 2.4508256682566163, 'bull_tsl_mult': 0.37434266434224595, 'bull_time_stop': 293, 'bull_use_sma': False, 'bull_use_ema': True, 'bull_use_atr': True, 'bull_use_adx': False, 'bull_use_spike': True, 'bull_rsi_required': True, 'bear_strategy': 'breakout', 'bear_bb_std_mult': 3.273257770008924, 'bear_rsi_os': 53, 'bear_rsi_ob': 72, 'bear_adx_thresh': 10.794952501637809, 'bear_atr_min_pct': 0.004937951393702344, 'bear_atr_max_pct': 0.13251033000849927, 'bear_tp_mult': 2.6702113856142637, 'bear_tsl_mult': 0.7422438906308377, 'bear_time_stop': 36, 'bear_use_sma': False, 'bear_use_ema': True, 'bear_use_atr': False, 'bear_use_adx': False, 'bear_use_spike': False, 'bear_rsi_required': False, 'sideways_strategy': 'breakout', 'sideways_bb_std_mult': 1.7231046515123052, 'sideways_rsi_os': 28, 'sideways_rsi_ob': 94, 'sideways_adx_thresh': 16.72511134769217, 'sideways_atr_min_pct': 0.016793901390457878, 'sideways_atr_max_pct': 0.13415307866936105, 'sideways_tp_mult': 1.318970933582471, 'sideways_tsl_mult': 0.40025725047378413, 'sideways_time_stop': 113, 'sideways_use_sma': False, 'sideways_use_ema': False, 'sideways_use_atr': True, 'sideways_use_adx': False, 'sideways_use_spike': True, 'sideways_rsi_required': True}.
[I 2025-08-31 11:36:49,168] Trial 782 finished with values: [-1000000000.0, 1000000000.0] and parameters: {'p_sma': 60, 'p_std': 40, 'p_atr': 10, 'p_adx': 23, 'rsi_period': 54, 'ema1': 12, 'ema2': 45, 'slip_atr_k': 0.02259856993191837, 'slip_spread_k': 0.18638045813683604, 'spread_hl_frac': 0.007059530851810069, 'bb_std_mult': 2.84878441063727, 'rsi_os': 52, 'rsi_ob': 94, 'vol_spike': 0.26859326247876936, 'adx_thresh': 32.170757835063775, 'atr_min_pct': 0.011844715707274396, 'atr_max_pct': 0.14755658463296972, 'tp_mult': 1.5435589845911148, 'tsl_mult': 0.12443460291728081, 'strategy': 'mean_reversion', 'time_stop': 213, 'use_sma': True, 'use_atr': False, 'use_adx': True, 'use_ema': False, 'use_spike': True, 'rsi_required': False, 'edge_k': 0.9032196110152393, 'edge_cap': 0.4792662132203244, 'bull_strategy': 'breakout', 'bull_bb_std_mult': 0.7473357700042278, 'bull_rsi_os': 26, 'bull_rsi_ob': 83, 'bull_adx_thresh': 10.854850289191393, 'bull_atr_min_pct': 0.0036494151468388827, 'bull_atr_max_pct': 0.11275225755339033, 'bull_tp_mult': 2.4206885682857573, 'bull_tsl_mult': 0.3252507207095843, 'bull_time_stop': 295, 'bull_use_sma': False, 'bull_use_ema': True, 'bull_use_atr': False, 'bull_use_adx': False, 'bull_use_spike': False, 'bull_rsi_required': False, 'bear_strategy': 'mean_reversion', 'bear_bb_std_mult': 3.3330427563460376, 'bear_rsi_os': 51, 'bear_rsi_ob': 75, 'bear_adx_thresh': 11.340849529588148, 'bear_atr_min_pct': 0.011307311005596428, 'bear_atr_max_pct': 0.05486666360486615, 'bear_tp_mult': 2.665647566461236, 'bear_tsl_mult': 0.7767476168510298, 'bear_time_stop': 241, 'bear_use_sma': False, 'bear_use_ema': False, 'bear_use_atr': False, 'bear_use_adx': True, 'bear_use_spike': False, 'bear_rsi_required': False, 'sideways_strategy': 'breakout', 'sideways_bb_std_mult': 1.7399143357882405, 'sideways_rsi_os': 28, 'sideways_rsi_ob': 94, 'sideways_adx_thresh': 10.48857129426626, 'sideways_atr_min_pct': 0.01527653753817711, 'sideways_atr_max_pct': 0.03582439865146872, 'sideways_tp_mult': 1.8800759969336174, 'sideways_tsl_mult': 0.40841922775144873, 'sideways_time_stop': 5, 'sideways_use_sma': True, 'sideways_use_ema': True, 'sideways_use_atr': True, 'sideways_use_adx': False, 'sideways_use_spike': True, 'sideways_rsi_required': True}.
[I 2025-08-31 11:37:21,788] Trial 783 finished with values: [-1000000000.0, 1000000000.0] and parameters: {'p_sma': 7, 'p_std': 28, 'p_atr': 11, 'p_adx': 14, 'rsi_period': 52, 'ema1': 12, 'ema2': 45, 'slip_atr_k': 0.144408670930898, 'slip_spread_k': 0.15273629128731975, 'spread_hl_frac': 0.04015733323714284, 'bb_std_mult': 2.7882429527041404, 'rsi_os': 30, 'rsi_ob': 90, 'vol_spike': 0.20265523877351452, 'adx_thresh': 31.980401810106066, 'atr_min_pct': 0.013013366600366017, 'atr_max_pct': 0.1474738200542624, 'tp_mult': 1.6160156326453452, 'tsl_mult': 0.07847107605611195, 'strategy': 'mean_reversion', 'time_stop': 195, 'use_sma': True, 'use_atr': False, 'use_adx': True, 'use_ema': False, 'use_spike': True, 'rsi_required': False, 'edge_k': 0.9073796044988901, 'edge_cap': 0.5027149711493591, 'bull_strategy': 'breakout', 'bull_bb_std_mult': 3.2745269001404864, 'bull_rsi_os': 10, 'bull_rsi_ob': 83, 'bull_adx_thresh': 6.441101525139992, 'bull_atr_min_pct': 0.021126762835434177, 'bull_atr_max_pct': 0.032626271567509975, 'bull_tp_mult': 2.4498247126326325, 'bull_tsl_mult': 0.32792543453256656, 'bull_time_stop': 295, 'bull_use_sma': False, 'bull_use_ema': True, 'bull_use_atr': False, 'bull_use_adx': False, 'bull_use_spike': False, 'bull_rsi_required': False, 'bear_strategy': 'mean_reversion', 'bear_bb_std_mult': 3.357028500540145, 'bear_rsi_os': 53, 'bear_rsi_ob': 76, 'bear_adx_thresh': 10.788871807077483, 'bear_atr_min_pct': 0.020296400954787703, 'bear_atr_max_pct': 0.13594104065212528, 'bear_tp_mult': 2.225903656364236, 'bear_tsl_mult': 0.865164908775267, 'bear_time_stop': 158, 'bear_use_sma': False, 'bear_use_ema': False, 'bear_use_atr': False, 'bear_use_adx': True, 'bear_use_spike': False, 'bear_rsi_required': False, 'sideways_strategy': 'breakout', 'sideways_bb_std_mult': 2.9033522661087807, 'sideways_rsi_os': 25, 'sideways_rsi_ob': 94, 'sideways_adx_thresh': 10.599588620297082, 'sideways_atr_min_pct': 0.017389296308162733, 'sideways_atr_max_pct': 0.03369418381398722, 'sideways_tp_mult': 1.9194398781543403, 'sideways_tsl_mult': 0.4031999518474438, 'sideways_time_stop': 5, 'sideways_use_sma': True, 'sideways_use_ema': True, 'sideways_use_atr': True, 'sideways_use_adx': False, 'sideways_use_spike': True, 'sideways_rsi_required': True}.
