[I 2025-08-31 10:12:56,561] Trial 145 finished with values: [-0.020969269293555803, 0.020786348907350198] and parameters: {'p_sma': 53, 'p_std': 52, 'p_atr': 26, 'p_adx': 12, 'rsi_period': 42, 'ema1': 15, 'ema2': 54, 'slip_atr_k': 0.04547208383286806, 'slip_spread_k': 0.6267879978998672, 'spread_hl_frac': 0.016085075698686786, 'bb_std_mult': 2.500553610744124, 'rsi_os': 45, 'rsi_ob': 73, 'vol_spike': 0.12540972430767786, 'adx_thresh': 30.14646432032106, 'atr_min_pct': 0.005189460335850515, 'atr_max_pct': 0.07860713572141168, 'tp_mult': 2.5541740033975953, 'tsl_mult': 0.7323940221504198, 'strategy': 'breakout', 'time_stop': 244, 'use_sma': False, 'use_atr': True, 'use_adx': False, 'use_ema': True, 'use_spike': True, 'rsi_required': False, 'edge_k': 0.26064424316358514, 'edge_cap': 0.7325567403055124, 'bull_strategy': 'breakout', 'bull_bb_std_mult': 1.1105995413683218, 'bull_rsi_os': 44, 'bull_rsi_ob': 78, 'bull_adx_thresh': 19.95418174945837, 'bull_atr_min_pct': 0.0005582992144945128, 'bull_atr_max_pct': 0.017779181546870686, 'bull_tp_mult': 2.869281817041069, 'bull_tsl_mult': 0.22129345880818885, 'bull_time_stop': 63, 'bull_use_sma': True, 'bull_use_ema': True, 'bull_use_atr': True, 'bull_use_adx': False, 'bull_use_spike': True, 'bull_rsi_required': True, 'bear_strategy': 'breakout', 'bear_bb_std_mult': 0.7964989733608849, 'bear_rsi_os': 49, 'bear_rsi_ob': 79, 'bear_adx_thresh': 11.118480494060897, 'bear_atr_min_pct': 0.012912645272858797, 'bear_atr_max_pct': 0.08900843944135671, 'bear_tp_mult': 2.8784795601946147, 'bear_tsl_mult': 0.0777237367176737, 'bear_time_stop': 48, 'bear_use_sma': False, 'bear_use_ema': False, 'bear_use_atr': False, 'bear_use_adx': False, 'bear_use_spike': True, 'bear_rsi_required': True, 'sideways_strategy': 'breakout', 'sideways_bb_std_mult': 2.307197415407275, 'sideways_rsi_os': 21, 'sideways_rsi_ob': 78, 'sideways_adx_thresh': 27.744967616256677, 'sideways_atr_min_pct': 0.019298050453838433, 'sideways_atr_max_pct': 0.14468162279055474, 'sideways_tp_mult': 2.9024156269459795, 'sideways_tsl_mult': 0.11591655903407846, 'sideways_time_stop': 259, 'sideways_use_sma': False, 'sideways_use_ema': True, 'sideways_use_atr': False, 'sideways_use_adx': True, 'sideways_use_spike': True, 'sideways_rsi_required': True}.
[I 2025-08-31 10:12:56,586] Trial 143 finished with values: [-1000000000.0, 1000000000.0] and parameters: {'p_sma': 51, 'p_std': 45, 'p_atr': 26, 'p_adx': 17, 'rsi_period': 43, 'ema1': 14, 'ema2': 54, 'slip_atr_k': 0.04326233405166157, 'slip_spread_k': 0.6834117919891203, 'spread_hl_frac': 0.014946727435386227, 'bb_std_mult': 2.582009444215575, 'rsi_os': 44, 'rsi_ob': 73, 'vol_spike': 0.12374267500632845, 'adx_thresh': 29.95564094858191, 'atr_min_pct': 0.0061058062628732025, 'atr_max_pct': 0.07806055527673575, 'tp_mult': 2.6911061570943637, 'tsl_mult': 0.7365729903346775, 'strategy': 'breakout', 'time_stop': 235, 'use_sma': False, 'use_atr': True, 'use_adx': False, 'use_ema': True, 'use_spike': True, 'rsi_required': False, 'edge_k': 0.2561828860557267, 'edge_cap': 0.9308395846130828, 'bull_strategy': 'breakout', 'bull_bb_std_mult': 1.0790160021019133, 'bull_rsi_os': 44, 'bull_rsi_ob': 79, 'bull_adx_thresh': 24.154972243329425, 'bull_atr_min_pct': 0.002528745514057089, 'bull_atr_max_pct': 0.07421177358836048, 'bull_tp_mult': 2.8401941731819984, 'bull_tsl_mult': 0.17468777592703938, 'bull_time_stop': 54, 'bull_use_sma': True, 'bull_use_ema': True, 'bull_use_atr': True, 'bull_use_adx': False, 'bull_use_spike': True, 'bull_rsi_required': True, 'bear_strategy': 'breakout', 'bear_bb_std_mult': 0.8695385521670969, 'bear_rsi_os': 49, 'bear_rsi_ob': 79, 'bear_adx_thresh': 11.132724060475827, 'bear_atr_min_pct': 0.012932325758869743, 'bear_atr_max_pct': 0.09245190805562967, 'bear_tp_mult': 2.6992767560247555, 'bear_tsl_mult': 0.07140932358697581, 'bear_time_stop': 63, 'bear_use_sma': False, 'bear_use_ema': False, 'bear_use_atr': False, 'bear_use_adx': False, 'bear_use_spike': True, 'bear_rsi_required': True, 'sideways_strategy': 'breakout', 'sideways_bb_std_mult': 2.499118339528439, 'sideways_rsi_os': 19, 'sideways_rsi_ob': 83, 'sideways_adx_thresh': 27.748018556549663, 'sideways_atr_min_pct': 0.02035910169000885, 'sideways_atr_max_pct': 0.11359287771027836, 'sideways_tp_mult': 2.797409019804792, 'sideways_tsl_mult': 0.058073742816628623, 'sideways_time_stop': 262, 'sideways_use_sma': False, 'sideways_use_ema': True, 'sideways_use_atr': False, 'sideways_use_adx': True, 'sideways_use_spike': True, 'sideways_rsi_required': True}.
[I 2025-08-31 10:12:56,674] Trial 144 finished with values: [-1000000000.0, 1000000000.0] and parameters: {'p_sma': 53, 'p_std': 51, 'p_atr': 26, 'p_adx': 12, 'rsi_period': 42, 'ema1': 14, 'ema2': 54, 'slip_atr_k': 0.04531563804268416, 'slip_spread_k': 0.6875124231090732, 'spread_hl_frac': 0.014999492042281251, 'bb_std_mult': 2.571078779302857, 'rsi_os': 45, 'rsi_ob': 73, 'vol_spike': 0.12378557596402262, 'adx_thresh': 29.264817823801472, 'atr_min_pct': 0.006126398701243919, 'atr_max_pct': 0.11048229066529237, 'tp_mult': 2.5455481937061726, 'tsl_mult': 0.8005352726416824, 'strategy': 'breakout', 'time_stop': 241, 'use_sma': False, 'use_atr': True, 'use_adx': False, 'use_ema': True, 'use_spike': True, 'rsi_required': False, 'edge_k': 0.3280504217821507, 'edge_cap': 0.8306269857159616, 'bull_strategy': 'breakout', 'bull_bb_std_mult': 1.0537867973415425, 'bull_rsi_os': 44, 'bull_rsi_ob': 79, 'bull_adx_thresh': 21.482917399573825, 'bull_atr_min_pct': 0.0024573130314540785, 'bull_atr_max_pct': 0.017295975882115774, 'bull_tp_mult': 2.856754318376186, 'bull_tsl_mult': 0.2435921807294162, 'bull_time_stop': 56, 'bull_use_sma': True, 'bull_use_ema': True, 'bull_use_atr': True, 'bull_use_adx': False, 'bull_use_spike': True, 'bull_rsi_required': True, 'bear_strategy': 'breakout', 'bear_bb_std_mult': 1.0678275055400615, 'bear_rsi_os': 49, 'bear_rsi_ob': 81, 'bear_adx_thresh': 11.23508174024025, 'bear_atr_min_pct': 0.012871540799766493, 'bear_atr_max_pct': 0.07081482252727282, 'bear_tp_mult': 2.8917453558075588, 'bear_tsl_mult': 0.07451590842984557, 'bear_time_stop': 65, 'bear_use_sma': False, 'bear_use_ema': False, 'bear_use_atr': False, 'bear_use_adx': False, 'bear_use_spike': True, 'bear_rsi_required': True, 'sideways_strategy': 'breakout', 'sideways_bb_std_mult': 2.3105134959867635, 'sideways_rsi_os': 18, 'sideways_rsi_ob': 83, 'sideways_adx_thresh': 27.679159603899198, 'sideways_atr_min_pct': 0.019367549995544773, 'sideways_atr_max_pct': 0.10271607766072299, 'sideways_tp_mult': 2.9175076585411945, 'sideways_tsl_mult': 0.8417160528025764, 'sideways_time_stop': 296, 'sideways_use_sma': False, 'sideways_use_ema': True, 'sideways_use_atr': False, 'sideways_use_adx': True, 'sideways_use_spike': True, 'sideways_rsi_required': True}.
[I 2025-08-31 10:13:28,227] Trial 147 finished with values: [-0.021565093291501802, 0.021381734877203764] and parameters: {'p_sma': 53, 'p_std': 44, 'p_atr': 27, 'p_adx': 12, 'rsi_period': 47, 'ema1': 15, 'ema2': 56, 'slip_atr_k': 0.039662811993088166, 'slip_spread_k': 0.6336788330114094, 'spread_hl_frac': 0.04614492725426095, 'bb_std_mult': 3.077476560947715, 'rsi_os': 44, 'rsi_ob': 74, 'vol_spike': 0.1284411336133557, 'adx_thresh': 34.84496195356923, 'atr_min_pct': 0.006120991256795812, 'atr_max_pct': 0.09727663009951147, 'tp_mult': 2.5893969398684127, 'tsl_mult': 0.7340983731382341, 'strategy': 'breakout', 'time_stop': 290, 'use_sma': False, 'use_atr': True, 'use_adx': False, 'use_ema': True, 'use_spike': True, 'rsi_required': False, 'edge_k': 0.642517026464336, 'edge_cap': 0.7624951070600406, 'bull_strategy': 'breakout', 'bull_bb_std_mult': 1.1323572402335451, 'bull_rsi_os': 36, 'bull_rsi_ob': 76, 'bull_adx_thresh': 20.181377572236954, 'bull_atr_min_pct': 0.0005705821628719276, 'bull_atr_max_pct': 0.06444266828184628, 'bull_tp_mult': 2.845094043530506, 'bull_tsl_mult': 0.5183782735874358, 'bull_time_stop': 103, 'bull_use_sma': True, 'bull_use_ema': True, 'bull_use_atr': True, 'bull_use_adx': False, 'bull_use_spike': True, 'bull_rsi_required': True, 'bear_strategy': 'breakout', 'bear_bb_std_mult': 1.2293685485849677, 'bear_rsi_os': 50, 'bear_rsi_ob': 75, 'bear_adx_thresh': 9.608165836717824, 'bear_atr_min_pct': 0.01581513917335883, 'bear_atr_max_pct': 0.07125511488964864, 'bear_tp_mult': 2.918281000598657, 'bear_tsl_mult': 0.06896677077365698, 'bear_time_stop': 65, 'bear_use_sma': False, 'bear_use_ema': False, 'bear_use_atr': False, 'bear_use_adx': False, 'bear_use_spike': True, 'bear_rsi_required': True, 'sideways_strategy': 'breakout', 'sideways_bb_std_mult': 2.682510098585079, 'sideways_rsi_os': 16, 'sideways_rsi_ob': 80, 'sideways_adx_thresh': 29.118925074718533, 'sideways_atr_min_pct': 0.01911551353490942, 'sideways_atr_max_pct': 0.11395938898926057, 'sideways_tp_mult': 2.8905700262568206, 'sideways_tsl_mult': 0.0546481809252095, 'sideways_time_stop': 270, 'sideways_use_sma': False, 'sideways_use_ema': False, 'sideways_use_atr': False, 'sideways_use_adx': True, 'sideways_use_spike': True, 'sideways_rsi_required': True}.
[I 2025-08-31 10:13:28,383] Trial 150 finished with values: [-1000000000.0, 1000000000.0] and parameters: {'p_sma': 56, 'p_std': 50, 'p_atr': 27, 'p_adx': 10, 'rsi_period': 46, 'ema1': 15, 'ema2': 59, 'slip_atr_k': 0.034988028938089825, 'slip_spread_k': 0.6569313811474936, 'spread_hl_frac': 0.013576181406266903, 'bb_std_mult': 3.0624791657882593, 'rsi_os': 55, 'rsi_ob': 77, 'vol_spike': 0.13876829807564423, 'adx_thresh': 28.228504576269717, 'atr_min_pct': 0.007603102749359455, 'atr_max_pct': 0.09740728409063867, 'tp_mult': 2.5951990963279328, 'tsl_mult': 0.35261870979583565, 'strategy': 'breakout', 'time_stop': 221, 'use_sma': True, 'use_atr': True, 'use_adx': False, 'use_ema': True, 'use_spike': True, 'rsi_required': False, 'edge_k': 1.8720465363389183, 'edge_cap': 0.7609859562744777, 'bull_strategy': 'breakout', 'bull_bb_std_mult': 0.9558991185439253, 'bull_rsi_os': 39, 'bull_rsi_ob': 76, 'bull_adx_thresh': 25.682737714702036, 'bull_atr_min_pct': 0.007941067778664778, 'bull_atr_max_pct': 0.05978499123347585, 'bull_tp_mult': 2.775218160335379, 'bull_tsl_mult': 0.46180264938845705, 'bull_time_stop': 103, 'bull_use_sma': True, 'bull_use_ema': True, 'bull_use_atr': True, 'bull_use_adx': False, 'bull_use_spike': False, 'bull_rsi_required': True, 'bear_strategy': 'breakout', 'bear_bb_std_mult': 1.2205642864082207, 'bear_rsi_os': 38, 'bear_rsi_ob': 75, 'bear_adx_thresh': 9.527277401733297, 'bear_atr_min_pct': 0.014960916543810663, 'bear_atr_max_pct': 0.07526242914113047, 'bear_tp_mult': 2.836083579049888, 'bear_tsl_mult': 0.10212425484739929, 'bear_time_stop': 69, 'bear_use_sma': False, 'bear_use_ema': True, 'bear_use_atr': False, 'bear_use_adx': False, 'bear_use_spike': True, 'bear_rsi_required': False, 'sideways_strategy': 'breakout', 'sideways_bb_std_mult': 2.4256652669889767, 'sideways_rsi_os': 50, 'sideways_rsi_ob': 80, 'sideways_adx_thresh': 25.675418464758586, 'sideways_atr_min_pct': 0.01655398021905313, 'sideways_atr_max_pct': 0.08112893766731366, 'sideways_tp_mult': 2.840582661095723, 'sideways_tsl_mult': 0.7124091383887964, 'sideways_time_stop': 253, 'sideways_use_sma': False, 'sideways_use_ema': False, 'sideways_use_atr': False, 'sideways_use_adx': False, 'sideways_use_spike': False, 'sideways_rsi_required': True}.
[I 2025-08-31 10:13:28,794] Trial 149 finished with values: [-1000000000.0, 1000000000.0] and parameters: {'p_sma': 56, 'p_std': 51, 'p_atr': 29, 'p_adx': 18, 'rsi_period': 40, 'ema1': 15, 'ema2': 59, 'slip_atr_k': 0.03637355672172619, 'slip_spread_k': 0.5532537184623516, 'spread_hl_frac': 0.013620913783045715, 'bb_std_mult': 3.073503780380853, 'rsi_os': 54, 'rsi_ob': 73, 'vol_spike': 0.13024176044502406, 'adx_thresh': 18.40619327116364, 'atr_min_pct': 0.007381201171051254, 'atr_max_pct': 0.09682667543907314, 'tp_mult': 2.607493215955126, 'tsl_mult': 0.8357947683549996, 'strategy': 'breakout', 'time_stop': 300, 'use_sma': True, 'use_atr': True, 'use_adx': False, 'use_ema': True, 'use_spike': True, 'rsi_required': False, 'edge_k': 0.6780226463872394, 'edge_cap': 0.7631747256098836, 'bull_strategy': 'breakout', 'bull_bb_std_mult': 0.8379546530780972, 'bull_rsi_os': 35, 'bull_rsi_ob': 76, 'bull_adx_thresh': 18.647514704174306, 'bull_atr_min_pct': 0.004313746955223491, 'bull_atr_max_pct': 0.0664885205792183, 'bull_tp_mult': 1.5332477864203902, 'bull_tsl_mult': 0.09637625853428142, 'bull_time_stop': 11, 'bull_use_sma': True, 'bull_use_ema': True, 'bull_use_atr': True, 'bull_use_adx': False, 'bull_use_spike': False, 'bull_rsi_required': True, 'bear_strategy': 'breakout', 'bear_bb_std_mult': 1.252820673961561, 'bear_rsi_os': 45, 'bear_rsi_ob': 75, 'bear_adx_thresh': 17.970756605676716, 'bear_atr_min_pct': 0.015309679825561785, 'bear_atr_max_pct': 0.07060372936308329, 'bear_tp_mult': 2.923603750465785, 'bear_tsl_mult': 0.10802751010761868, 'bear_time_stop': 67, 'bear_use_sma': False, 'bear_use_ema': True, 'bear_use_atr': False, 'bear_use_adx': False, 'bear_use_spike': True, 'bear_rsi_required': False, 'sideways_strategy': 'breakout', 'sideways_bb_std_mult': 2.726147478531203, 'sideways_rsi_os': 16, 'sideways_rsi_ob': 81, 'sideways_adx_thresh': 29.236871057596808, 'sideways_atr_min_pct': 0.017655235410385578, 'sideways_atr_max_pct': 0.08213263375508796, 'sideways_tp_mult': 2.8367773429254224, 'sideways_tsl_mult': 0.5889692344717248, 'sideways_time_stop': 271, 'sideways_use_sma': False, 'sideways_use_ema': False, 'sideways_use_atr': False, 'sideways_use_adx': False, 'sideways_use_spike': True, 'sideways_rsi_required': True}.
[I 2025-08-31 10:13:28,945] Trial 148 finished with values: [-1000000000.0, 1000000000.0] and parameters: {'p_sma': 51, 'p_std': 51, 'p_atr': 29, 'p_adx': 10, 'rsi_period': 46, 'ema1': 14, 'ema2': 56, 'slip_atr_k': 0.04062186691225453, 'slip_spread_k': 0.6635911430142861, 'spread_hl_frac': 0.01058507148799312, 'bb_std_mult': 3.0236112627814853, 'rsi_os': 44, 'rsi_ob': 46, 'vol_spike': 0.1319295062508507, 'adx_thresh': 28.16002399163608, 'atr_min_pct': 0.007473388890636952, 'atr_max_pct': 0.09582671783214775, 'tp_mult': 2.4750849703708053, 'tsl_mult': 0.3006698897493364, 'strategy': 'breakout', 'time_stop': 299, 'use_sma': False, 'use_atr': True, 'use_adx': False, 'use_ema': True, 'use_spike': True, 'rsi_required': False, 'edge_k': 0.045914389623973026, 'edge_cap': 0.7599288561639974, 'bull_strategy': 'breakout', 'bull_bb_std_mult': 0.8202569619007747, 'bull_rsi_os': 39, 'bull_rsi_ob': 91, 'bull_adx_thresh': 25.76932845252084, 'bull_atr_min_pct': 0.0269341498276708, 'bull_atr_max_pct': 0.06440070416532043, 'bull_tp_mult': 2.7847897358470237, 'bull_tsl_mult': 0.5221878119943599, 'bull_time_stop': 11, 'bull_use_sma': True, 'bull_use_ema': True, 'bull_use_atr': True, 'bull_use_adx': False, 'bull_use_spike': True, 'bull_rsi_required': True, 'bear_strategy': 'breakout', 'bear_bb_std_mult': 1.2439291036188955, 'bear_rsi_os': 45, 'bear_rsi_ob': 74, 'bear_adx_thresh': 9.516280030294105, 'bear_atr_min_pct': 0.014859653367269278, 'bear_atr_max_pct': 0.07053992097409766, 'bear_tp_mult': 2.714906969847317, 'bear_tsl_mult': 0.10632507699255953, 'bear_time_stop': 65, 'bear_use_sma': False, 'bear_use_ema': True, 'bear_use_atr': False, 'bear_use_adx': False, 'bear_use_spike': True, 'bear_rsi_required': False, 'sideways_strategy': 'breakout', 'sideways_bb_std_mult': 2.4290044611066093, 'sideways_rsi_os': 18, 'sideways_rsi_ob': 87, 'sideways_adx_thresh': 19.110076453286876, 'sideways_atr_min_pct': 0.01691792286755405, 'sideways_atr_max_pct': 0.10324832010582796, 'sideways_tp_mult': 2.844750427816713, 'sideways_tsl_mult': 0.5762042201109648, 'sideways_time_stop': 268, 'sideways_use_sma': False, 'sideways_use_ema': False, 'sideways_use_atr': False, 'sideways_use_adx': True, 'sideways_use_spike': True, 'sideways_rsi_required': True}.
[I 2025-08-31 10:14:00,405] Trial 151 finished with values: [-0.016660682055077092, 0.016478317749660878] and parameters: {'p_sma': 32, 'p_std': 50, 'p_atr': 29, 'p_adx': 10, 'rsi_period': 40, 'ema1': 12, 'ema2': 58, 'slip_atr_k': 0.033693415887358066, 'slip_spread_k': 0.5585551228144008, 'spread_hl_frac': 0.010224000162901273, 'bb_std_mult': 2.344303999573241, 'rsi_os': 54, 'rsi_ob': 77, 'vol_spike': 0.035243012953774355, 'adx_thresh': 28.09977768273287, 'atr_min_pct': 0.007427936202766281, 'atr_max_pct': 0.06426613250193075, 'tp_mult': 1.9507884927568, 'tsl_mult': 0.2941790822662137, 'strategy': 'breakout', 'time_stop': 226, 'use_sma': True, 'use_atr': True, 'use_adx': False, 'use_ema': True, 'use_spike': True, 'rsi_required': True, 'edge_k': 0.07288662509729715, 'edge_cap': 0.38770622669791227, 'bull_strategy': 'breakout', 'bull_bb_std_mult': 0.985621592503792, 'bull_rsi_os': 39, 'bull_rsi_ob': 91, 'bull_adx_thresh': 34.82973717826252, 'bull_atr_min_pct': 0.0013363194982406647, 'bull_atr_max_pct': 0.05974553996641807, 'bull_tp_mult': 2.79076189067298, 'bull_tsl_mult': 0.4683117210958905, 'bull_time_stop': 86, 'bull_use_sma': True, 'bull_use_ema': True, 'bull_use_atr': True, 'bull_use_adx': False, 'bull_use_spike': False, 'bull_rsi_required': True, 'bear_strategy': 'breakout', 'bear_bb_std_mult': 1.395410290857929, 'bear_rsi_os': 41, 'bear_rsi_ob': 74, 'bear_adx_thresh': 15.993099279121699, 'bear_atr_min_pct': 0.015072443978955397, 'bear_atr_max_pct': 0.07613461570444989, 'bear_tp_mult': 2.8434397005532928, 'bear_tsl_mult': 0.10476731792594332, 'bear_time_stop': 53, 'bear_use_sma': False, 'bear_use_ema': True, 'bear_use_atr': False, 'bear_use_adx': False, 'bear_use_spike': True, 'bear_rsi_required': False, 'sideways_strategy': 'breakout', 'sideways_bb_std_mult': 2.42129910886797, 'sideways_rsi_os': 16, 'sideways_rsi_ob': 81, 'sideways_adx_thresh': 25.60986463458246, 'sideways_atr_min_pct': 0.02318875297555319, 'sideways_atr_max_pct': 0.09198113666450648, 'sideways_tp_mult': 2.2796465938191854, 'sideways_tsl_mult': 0.1423253405527675, 'sideways_time_stop': 251, 'sideways_use_sma': False, 'sideways_use_ema': False, 'sideways_use_atr': False, 'sideways_use_adx': False, 'sideways_use_spike': False, 'sideways_rsi_required': True}.
[I 2025-08-31 10:14:01,920] Trial 152 finished with values: [-0.10299153928959237, 0.1024963154689854] and parameters: {'p_sma': 48, 'p_std': 49, 'p_atr': 28, 'p_adx': 18, 'rsi_period': 40, 'ema1': 16, 'ema2': 57, 'slip_atr_k': 0.19757996984594162, 'slip_spread_k': 0.7413298898514405, 'spread_hl_frac': 0.03433220470468924, 'bb_std_mult': 3.006318390734857, 'rsi_os': 47, 'rsi_ob': 47, 'vol_spike': 0.03645181572692166, 'adx_thresh': 33.53451968807436, 'atr_min_pct': 0.007036751496574903, 'atr_max_pct': 0.11701707384109901, 'tp_mult': 1.9556701506276981, 'tsl_mult': 0.20457030575372537, 'strategy': 'breakout', 'time_stop': 216, 'use_sma': True, 'use_atr': True, 'use_adx': False, 'use_ema': True, 'use_spike': True, 'rsi_required': True, 'edge_k': 0.04718629053692566, 'edge_cap': 0.7880200240207842, 'bull_strategy': 'mean_reversion', 'bull_bb_std_mult': 0.9916340383083003, 'bull_rsi_os': 40, 'bull_rsi_ob': 92, 'bull_adx_thresh': 31.274388226507327, 'bull_atr_min_pct': 0.0015591109964439766, 'bull_atr_max_pct': 0.05176835996192733, 'bull_tp_mult': 2.9154287621887307, 'bull_tsl_mult': 0.38110407980626615, 'bull_time_stop': 41, 'bull_use_sma': True, 'bull_use_ema': True, 'bull_use_atr': True, 'bull_use_adx': False, 'bull_use_spike': True, 'bull_rsi_required': True, 'bear_strategy': 'breakout', 'bear_bb_std_mult': 1.4684716607625679, 'bear_rsi_os': 41, 'bear_rsi_ob': 77, 'bear_adx_thresh': 21.312327180282878, 'bear_atr_min_pct': 0.0012698133803001593, 'bear_atr_max_pct': 0.07433966631395962, 'bear_tp_mult': 1.6172484474507238, 'bear_tsl_mult': 0.1263689094420003, 'bear_time_stop': 158, 'bear_use_sma': False, 'bear_use_ema': True, 'bear_use_atr': False, 'bear_use_adx': False, 'bear_use_spike': True, 'bear_rsi_required': False, 'sideways_strategy': 'breakout', 'sideways_bb_std_mult': 1.1802965004225003, 'sideways_rsi_os': 16, 'sideways_rsi_ob': 93, 'sideways_adx_thresh': 24.12692897235078, 'sideways_atr_min_pct': 0.01743770870644235, 'sideways_atr_max_pct': 0.09177191674626686, 'sideways_tp_mult': 2.2886033898063394, 'sideways_tsl_mult': 0.14402538245517985, 'sideways_time_stop': 279, 'sideways_use_sma': False, 'sideways_use_ema': True, 'sideways_use_atr': False, 'sideways_use_adx': True, 'sideways_use_spike': True, 'sideways_rsi_required': True}.
