[I 2025-08-31 09:58:13,244] Trial 28 finished with values: [-1000000000.0, 1000000000.0] and parameters: {'p_sma': 19, 'p_std': 17, 'p_atr': 13, 'p_adx': 23, 'rsi_period': 60, 'ema1': 12, 'ema2': 14, 'slip_atr_k': 0.11869177611119629, 'slip_spread_k': 0.3351136012058945, 'spread_hl_frac': 0.020296081446849936, 'bb_std_mult': 1.234029852037399, 'rsi_os': 34, 'rsi_ob': 91, 'vol_spike': 0.15803521422227373, 'adx_thresh': 8.05840811842516, 'atr_min_pct': 0.027283052215994693, 'atr_max_pct': 0.13523647558676247, 'tp_mult': 2.336974951267365, 'tsl_mult': 0.92002207630911, 'strategy': 'mean_reversion', 'time_stop': 198, 'use_sma': True, 'use_atr': False, 'use_adx': True, 'use_ema': False, 'use_spike': False, 'rsi_required': True, 'edge_k': 0.8465350557325354, 'edge_cap': 0.15649364702085466, 'bull_strategy': 'breakout', 'bull_bb_std_mult': 2.6482087871101703, 'bull_rsi_os': 29, 'bull_rsi_ob': 51, 'bull_adx_thresh': 19.531556739062996, 'bull_atr_min_pct': 0.029877411268362814, 'bull_atr_max_pct': 0.08912674832352888, 'bull_tp_mult': 2.6282930675132117, 'bull_tsl_mult': 0.8928345494799752, 'bull_time_stop': 195, 'bull_use_sma': False, 'bull_use_ema': False, 'bull_use_atr': True, 'bull_use_adx': True, 'bull_use_spike': False, 'bull_rsi_required': True, 'bear_strategy': 'mean_reversion', 'bear_bb_std_mult': 2.6650824186621196, 'bear_rsi_os': 32, 'bear_rsi_ob': 52, 'bear_adx_thresh': 24.907405186591934, 'bear_atr_min_pct': 0.025955954388182267, 'bear_atr_max_pct': 0.020970294370755087, 'bear_tp_mult': 2.9427925501055308, 'bear_tsl_mult': 0.47973271023497366, 'bear_time_stop': 79, 'bear_use_sma': True, 'bear_use_ema': True, 'bear_use_atr': True, 'bear_use_adx': True, 'bear_use_spike': True, 'bear_rsi_required': False, 'sideways_strategy': 'mean_reversion', 'sideways_bb_std_mult': 3.2280515049365937, 'sideways_rsi_os': 33, 'sideways_rsi_ob': 64, 'sideways_adx_thresh': 18.553924782655056, 'sideways_atr_min_pct': 0.011305988000959164, 'sideways_atr_max_pct': 0.08213960750295995, 'sideways_tp_mult': 1.657774270361809, 'sideways_tsl_mult': 0.23606545280271962, 'sideways_time_stop': 48, 'sideways_use_sma': True, 'sideways_use_ema': False, 'sideways_use_atr': False, 'sideways_use_adx': False, 'sideways_use_spike': False, 'sideways_rsi_required': False}.
[I 2025-08-31 09:58:13,246] Trial 25 finished with values: [-1000000000.0, 1000000000.0] and parameters: {'p_sma': 11, 'p_std': 13, 'p_atr': 12, 'p_adx': 28, 'rsi_period': 27, 'ema1': 8, 'ema2': 25, 'slip_atr_k': 0.12541295632911775, 'slip_spread_k': 0.47927192309545213, 'spread_hl_frac': 0.021973146361007237, 'bb_std_mult': 3.590508557856918, 'rsi_os': 9, 'rsi_ob': 87, 'vol_spike': 0.16116019480500515, 'adx_thresh': 9.622288606993344, 'atr_min_pct': 0.026360565717201995, 'atr_max_pct': 0.11644776065960573, 'tp_mult': 2.364748758603999, 'tsl_mult': 0.9213654205697558, 'strategy': 'mean_reversion', 'time_stop': 164, 'use_sma': True, 'use_atr': False, 'use_adx': True, 'use_ema': False, 'use_spike': False, 'rsi_required': True, 'edge_k': 1.217224231139415, 'edge_cap': 0.16678562135245073, 'bull_strategy': 'breakout', 'bull_bb_std_mult': 3.1563665400279333, 'bull_rsi_os': 34, 'bull_rsi_ob': 66, 'bull_adx_thresh': 20.130357397419843, 'bull_atr_min_pct': 0.029972887109247844, 'bull_atr_max_pct': 0.07314700916836207, 'bull_tp_mult': 2.9905014031390738, 'bull_tsl_mult': 0.6169500953249542, 'bull_time_stop': 197, 'bull_use_sma': False, 'bull_use_ema': False, 'bull_use_atr': True, 'bull_use_adx': True, 'bull_use_spike': False, 'bull_rsi_required': False, 'bear_strategy': 'mean_reversion', 'bear_bb_std_mult': 2.623010167913158, 'bear_rsi_os': 31, 'bear_rsi_ob': 52, 'bear_adx_thresh': 29.92402522022873, 'bear_atr_min_pct': 0.02526642821281423, 'bear_atr_max_pct': 0.02757577011938509, 'bear_tp_mult': 2.6857965427135224, 'bear_tsl_mult': 0.33164497505030166, 'bear_time_stop': 255, 'bear_use_sma': True, 'bear_use_ema': True, 'bear_use_atr': True, 'bear_use_adx': True, 'bear_use_spike': True, 'bear_rsi_required': False, 'sideways_strategy': 'mean_reversion', 'sideways_bb_std_mult': 3.1365634138809346, 'sideways_rsi_os': 44, 'sideways_rsi_ob': 51, 'sideways_adx_thresh': 24.660541761477806, 'sideways_atr_min_pct': 0.025574255064975678, 'sideways_atr_max_pct': 0.1033961701865285, 'sideways_tp_mult': 1.7190872553108463, 'sideways_tsl_mult': 0.2319492394439051, 'sideways_time_stop': 97, 'sideways_use_sma': True, 'sideways_use_ema': False, 'sideways_use_atr': False, 'sideways_use_adx': False, 'sideways_use_spike': False, 'sideways_rsi_required': False}.
[I 2025-08-31 09:58:44,354] Trial 29 finished with values: [-1000000000.0, 1000000000.0] and parameters: {'p_sma': 19, 'p_std': 20, 'p_atr': 7, 'p_adx': 21, 'rsi_period': 61, 'ema1': 22, 'ema2': 16, 'slip_atr_k': 0.1782163605416795, 'slip_spread_k': 0.32559359120966774, 'spread_hl_frac': 0.028853223224958036, 'bb_std_mult': 2.225481289127509, 'rsi_os': 34, 'rsi_ob': 95, 'vol_spike': 0.21695928389526076, 'adx_thresh': 7.722279334704049, 'atr_min_pct': 0.02088545064407371, 'atr_max_pct': 0.11860740024019259, 'tp_mult': 2.7595139001722093, 'tsl_mult': 0.6421121509231886, 'strategy': 'breakout', 'time_stop': 139, 'use_sma': True, 'use_atr': True, 'use_adx': True, 'use_ema': False, 'use_spike': False, 'rsi_required': True, 'edge_k': 1.8310141743733106, 'edge_cap': 0.5876831893821953, 'bull_strategy': 'breakout', 'bull_bb_std_mult': 1.415053184181592, 'bull_rsi_os': 40, 'bull_rsi_ob': 52, 'bull_adx_thresh': 19.08664210169055, 'bull_atr_min_pct': 0.010987525234018605, 'bull_atr_max_pct': 0.11844632820968146, 'bull_tp_mult': 2.619309243655264, 'bull_tsl_mult': 0.8829414900005702, 'bull_time_stop': 53, 'bull_use_sma': False, 'bull_use_ema': False, 'bull_use_atr': True, 'bull_use_adx': False, 'bull_use_spike': False, 'bull_rsi_required': False, 'bear_strategy': 'mean_reversion', 'bear_bb_std_mult': 1.9228637247043356, 'bear_rsi_os': 29, 'bear_rsi_ob': 53, 'bear_adx_thresh': 24.782156752767985, 'bear_atr_min_pct': 0.019962356280288293, 'bear_atr_max_pct': 0.06250446230740227, 'bear_tp_mult': 2.7668496006013505, 'bear_tsl_mult': 0.4015182926202405, 'bear_time_stop': 92, 'bear_use_sma': True, 'bear_use_ema': False, 'bear_use_atr': True, 'bear_use_adx': True, 'bear_use_spike': False, 'bear_rsi_required': False, 'sideways_strategy': 'mean_reversion', 'sideways_bb_std_mult': 2.470119608917667, 'sideways_rsi_os': 42, 'sideways_rsi_ob': 49, 'sideways_adx_thresh': 22.160399288534958, 'sideways_atr_min_pct': 0.010545824516097809, 'sideways_atr_max_pct': 0.08489866406944185, 'sideways_tp_mult': 1.579672661559209, 'sideways_tsl_mult': 0.45205710961626944, 'sideways_time_stop': 62, 'sideways_use_sma': False, 'sideways_use_ema': False, 'sideways_use_atr': False, 'sideways_use_adx': False, 'sideways_use_spike': False, 'sideways_rsi_required': False}.
[I 2025-08-31 09:58:44,773] Trial 30 finished with values: [-1000000000.0, 1000000000.0] and parameters: {'p_sma': 5, 'p_std': 25, 'p_atr': 7, 'p_adx': 10, 'rsi_period': 84, 'ema1': 22, 'ema2': 17, 'slip_atr_k': 0.17146434828067894, 'slip_spread_k': 0.13537553209606507, 'spread_hl_frac': 0.03030097702429502, 'bb_std_mult': 2.349651220665735, 'rsi_os': 22, 'rsi_ob': 79, 'vol_spike': 0.2113382994779532, 'adx_thresh': 12.058325114818157, 'atr_min_pct': 0.02116824031738042, 'atr_max_pct': 0.11878063718491545, 'tp_mult': 2.714784319586567, 'tsl_mult': 0.7321998780096062, 'strategy': 'breakout', 'time_stop': 134, 'use_sma': True, 'use_atr': True, 'use_adx': True, 'use_ema': False, 'use_spike': False, 'rsi_required': True, 'edge_k': 1.8419483831287669, 'edge_cap': 0.37725527310157686, 'bull_strategy': 'breakout', 'bull_bb_std_mult': 2.18880488992097, 'bull_rsi_os': 40, 'bull_rsi_ob': 71, 'bull_adx_thresh': 7.877725138305291, 'bull_atr_min_pct': 0.004338282934863706, 'bull_atr_max_pct': 0.11981095127329888, 'bull_tp_mult': 2.210909049796306, 'bull_tsl_mult': 0.35860725689956807, 'bull_time_stop': 79, 'bull_use_sma': False, 'bull_use_ema': False, 'bull_use_atr': True, 'bull_use_adx': False, 'bull_use_spike': False, 'bull_rsi_required': False, 'bear_strategy': 'mean_reversion', 'bear_bb_std_mult': 1.8379735841424873, 'bear_rsi_os': 38, 'bear_rsi_ob': 48, 'bear_adx_thresh': 31.436101029187647, 'bear_atr_min_pct': 0.019679544620199333, 'bear_atr_max_pct': 0.04072849785760422, 'bear_tp_mult': 2.6752806040750183, 'bear_tsl_mult': 0.3874697272731798, 'bear_time_stop': 132, 'bear_use_sma': True, 'bear_use_ema': False, 'bear_use_atr': True, 'bear_use_adx': True, 'bear_use_spike': False, 'bear_rsi_required': False, 'sideways_strategy': 'mean_reversion', 'sideways_bb_std_mult': 2.521473298931937, 'sideways_rsi_os': 42, 'sideways_rsi_ob': 50, 'sideways_adx_thresh': 22.85992602790332, 'sideways_atr_min_pct': 0.023221020702760515, 'sideways_atr_max_pct': 0.08788285289157313, 'sideways_tp_mult': 1.4985288872017493, 'sideways_tsl_mult': 0.45501108399084284, 'sideways_time_stop': 20, 'sideways_use_sma': False, 'sideways_use_ema': False, 'sideways_use_atr': False, 'sideways_use_adx': False, 'sideways_use_spike': False, 'sideways_rsi_required': False}.
[I 2025-08-31 09:58:45,036] Trial 31 finished with values: [-1000000000.0, 1000000000.0] and parameters: {'p_sma': 27, 'p_std': 25, 'p_atr': 9, 'p_adx': 21, 'rsi_period': 17, 'ema1': 23, 'ema2': 18, 'slip_atr_k': 0.05780028292495534, 'slip_spread_k': 0.5543853821948842, 'spread_hl_frac': 0.028382348495633532, 'bb_std_mult': 1.5550044505855127, 'rsi_os': 23, 'rsi_ob': 79, 'vol_spike': 0.21621024243591216, 'adx_thresh': 12.62412440962415, 'atr_min_pct': 0.02133594661391682, 'atr_max_pct': 0.14775932025837865, 'tp_mult': 2.7464584230923683, 'tsl_mult': 0.7443291822239406, 'strategy': 'breakout', 'time_stop': 121, 'use_sma': True, 'use_atr': True, 'use_adx': True, 'use_ema': False, 'use_spike': False, 'rsi_required': True, 'edge_k': 1.834402487533407, 'edge_cap': 0.5825811081686083, 'bull_strategy': 'breakout', 'bull_bb_std_mult': 2.2744643317900306, 'bull_rsi_os': 40, 'bull_rsi_ob': 73, 'bull_adx_thresh': 6.951166625544769, 'bull_atr_min_pct': 0.01182646082993072, 'bull_atr_max_pct': 0.05027310916834893, 'bull_tp_mult': 2.1977860136918315, 'bull_tsl_mult': 0.3792497372073479, 'bull_time_stop': 59, 'bull_use_sma': True, 'bull_use_ema': False, 'bull_use_atr': True, 'bull_use_adx': False, 'bull_use_spike': False, 'bull_rsi_required': False, 'bear_strategy': 'mean_reversion', 'bear_bb_std_mult': 1.933929367480768, 'bear_rsi_os': 5, 'bear_rsi_ob': 88, 'bear_adx_thresh': 15.312098888745103, 'bear_atr_min_pct': 0.020181198234642286, 'bear_atr_max_pct': 0.06530571761797753, 'bear_tp_mult': 2.800066421532292, 'bear_tsl_mult': 0.5453769763047764, 'bear_time_stop': 141, 'bear_use_sma': False, 'bear_use_ema': False, 'bear_use_atr': True, 'bear_use_adx': True, 'bear_use_spike': False, 'bear_rsi_required': False, 'sideways_strategy': 'breakout', 'sideways_bb_std_mult': 2.6154915257993343, 'sideways_rsi_os': 26, 'sideways_rsi_ob': 71, 'sideways_adx_thresh': 21.209396255955053, 'sideways_atr_min_pct': 0.022785471754522814, 'sideways_atr_max_pct': 0.13255228693562854, 'sideways_tp_mult': 2.2421746274681245, 'sideways_tsl_mult': 0.42927239537399364, 'sideways_time_stop': 68, 'sideways_use_sma': False, 'sideways_use_ema': False, 'sideways_use_atr': True, 'sideways_use_adx': False, 'sideways_use_spike': False, 'sideways_rsi_required': False}.
[I 2025-08-31 09:58:45,230] Trial 32 finished with values: [-1000000000.0, 1000000000.0] and parameters: {'p_sma': 28, 'p_std': 9, 'p_atr': 9, 'p_adx': 22, 'rsi_period': 42, 'ema1': 22, 'ema2': 31, 'slip_atr_k': 0.17637137257849975, 'slip_spread_k': 0.5522576836774928, 'spread_hl_frac': 0.02745435038943069, 'bb_std_mult': 1.7038839010773632, 'rsi_os': 24, 'rsi_ob': 95, 'vol_spike': 0.22304836316651772, 'adx_thresh': 7.2387600940462065, 'atr_min_pct': 0.022094894754848445, 'atr_max_pct': 0.14692366580589317, 'tp_mult': 2.7199583051067866, 'tsl_mult': 0.7196415108977429, 'strategy': 'breakout', 'time_stop': 72, 'use_sma': True, 'use_atr': True, 'use_adx': True, 'use_ema': False, 'use_spike': False, 'rsi_required': True, 'edge_k': 1.8174481307209818, 'edge_cap': 0.572022053736018, 'bull_strategy': 'breakout', 'bull_bb_std_mult': 2.2309823037329597, 'bull_rsi_os': 39, 'bull_rsi_ob': 71, 'bull_adx_thresh': 7.074977348835835, 'bull_atr_min_pct': 0.011268075465390028, 'bull_atr_max_pct': 0.049511519237752495, 'bull_tp_mult': 2.5161216745467225, 'bull_tsl_mult': 0.36418610338692237, 'bull_time_stop': 57, 'bull_use_sma': True, 'bull_use_ema': False, 'bull_use_atr': True, 'bull_use_adx': False, 'bull_use_spike': False, 'bull_rsi_required': False, 'bear_strategy': 'mean_reversion', 'bear_bb_std_mult': 1.7907853697512515, 'bear_rsi_os': 5, 'bear_rsi_ob': 87, 'bear_adx_thresh': 31.307254042619316, 'bear_atr_min_pct': 0.016452263023455236, 'bear_atr_max_pct': 0.05460103705980786, 'bear_tp_mult': 2.7594173741876262, 'bear_tsl_mult': 0.4112236173821081, 'bear_time_stop': 139, 'bear_use_sma': False, 'bear_use_ema': False, 'bear_use_atr': True, 'bear_use_adx': True, 'bear_use_spike': False, 'bear_rsi_required': False, 'sideways_strategy': 'breakout', 'sideways_bb_std_mult': 2.619355412470415, 'sideways_rsi_os': 41, 'sideways_rsi_ob': 72, 'sideways_adx_thresh': 28.92251441230646, 'sideways_atr_min_pct': 0.022866504203336413, 'sideways_atr_max_pct': 0.13252130514933366, 'sideways_tp_mult': 1.5198454206320708, 'sideways_tsl_mult': 0.4383251425830174, 'sideways_time_stop': 69, 'sideways_use_sma': False, 'sideways_use_ema': False, 'sideways_use_atr': True, 'sideways_use_adx': False, 'sideways_use_spike': False, 'sideways_rsi_required': False}.
[I 2025-08-31 09:59:15,300] Trial 34 finished with values: [-1000000000.0, 1000000000.0] and parameters: {'p_sma': 5, 'p_std': 8, 'p_atr': 10, 'p_adx': 29, 'rsi_period': 42, 'ema1': 6, 'ema2': 32, 'slip_atr_k': 0.22501161656689211, 'slip_spread_k': 0.5681511164767012, 'spread_hl_frac': 0.014124728936180383, 'bb_std_mult': 1.6967428922521453, 'rsi_os': 18, 'rsi_ob': 95, 'vol_spike': 0.17828573472448328, 'adx_thresh': 6.739602785429882, 'atr_min_pct': 0.029561540460249655, 'atr_max_pct': 0.14935628342439303, 'tp_mult': 2.192728991804294, 'tsl_mult': 0.9858566520358609, 'strategy': 'mean_reversion', 'time_stop': 20, 'use_sma': True, 'use_atr': False, 'use_adx': True, 'use_ema': False, 'use_spike': False, 'rsi_required': True, 'edge_k': 1.6895558782590923, 'edge_cap': 0.10331154765361994, 'bull_strategy': 'breakout', 'bull_bb_std_mult': 2.365416865430907, 'bull_rsi_os': 51, 'bull_rsi_ob': 76, 'bull_adx_thresh': 14.32362246102695, 'bull_atr_min_pct': 0.002621705567703617, 'bull_atr_max_pct': 0.05203581523573818, 'bull_tp_mult': 2.541637515359201, 'bull_tsl_mult': 0.700526236516754, 'bull_time_stop': 139, 'bull_use_sma': True, 'bull_use_ema': False, 'bull_use_atr': True, 'bull_use_adx': True, 'bull_use_spike': False, 'bull_rsi_required': False, 'bear_strategy': 'mean_reversion', 'bear_bb_std_mult': 2.3824682498002545, 'bear_rsi_os': 27, 'bear_rsi_ob': 85, 'bear_adx_thresh': 32.36330963748766, 'bear_atr_min_pct': 0.015528126797685603, 'bear_atr_max_pct': 0.016063890490880587, 'bear_tp_mult': 2.9929050405908995, 'bear_tsl_mult': 0.24248924936541255, 'bear_time_stop': 274, 'bear_use_sma': False, 'bear_use_ema': True, 'bear_use_atr': True, 'bear_use_adx': True, 'bear_use_spike': True, 'bear_rsi_required': False, 'sideways_strategy': 'breakout', 'sideways_bb_std_mult': 3.4471671115388665, 'sideways_rsi_os': 36, 'sideways_rsi_ob': 74, 'sideways_adx_thresh': 20.448229931297675, 'sideways_atr_min_pct': 0.02801646429663913, 'sideways_atr_max_pct': 0.13483031019328837, 'sideways_tp_mult': 1.2252115031839628, 'sideways_tsl_mult': 0.2921599457935047, 'sideways_time_stop': 107, 'sideways_use_sma': True, 'sideways_use_ema': False, 'sideways_use_atr': True, 'sideways_use_adx': False, 'sideways_use_spike': False, 'sideways_rsi_required': False}.
[I 2025-08-31 09:59:16,277] Trial 35 finished with values: [-0.026529203678724134, 0.026463179082394508] and parameters: {'p_sma': 48, 'p_std': 8, 'p_atr': 15, 'p_adx': 30, 'rsi_period': 43, 'ema1': 6, 'ema2': 32, 'slip_atr_k': 0.2327597592125435, 'slip_spread_k': 0.5700688536757739, 'spread_hl_frac': 0.014787370577041764, 'bb_std_mult': 1.821168281765504, 'rsi_os': 18, 'rsi_ob': 95, 'vol_spike': 0.182622682303961, 'adx_thresh': 6.674367445311793, 'atr_min_pct': 0.0294451357694203, 'atr_max_pct': 0.149492183154451, 'tp_mult': 2.168740462720088, 'tsl_mult': 0.9531362953394916, 'strategy': 'mean_reversion', 'time_stop': 27, 'use_sma': True, 'use_atr': False, 'use_adx': True, 'use_ema': True, 'use_spike': False, 'rsi_required': True, 'edge_k': 1.463360227262674, 'edge_cap': 0.30659742437062204, 'bull_strategy': 'breakout', 'bull_bb_std_mult': 2.8904905332420308, 'bull_rsi_os': 51, 'bull_rsi_ob': 78, 'bull_adx_thresh': 14.546019197673694, 'bull_atr_min_pct': 0.0026129573336939535, 'bull_atr_max_pct': 0.08199810054148372, 'bull_tp_mult': 2.8082041901271126, 'bull_tsl_mult': 0.6993601612990519, 'bull_time_stop': 139, 'bull_use_sma': False, 'bull_use_ema': False, 'bull_use_atr': True, 'bull_use_adx': True, 'bull_use_spike': False, 'bull_rsi_required': False, 'bear_strategy': 'mean_reversion', 'bear_bb_std_mult': 2.419856369483893, 'bear_rsi_os': 26, 'bear_rsi_ob': 64, 'bear_adx_thresh': 32.20440956098034, 'bear_atr_min_pct': 0.016531378091786973, 'bear_atr_max_pct': 0.015487544855980685, 'bear_tp_mult': 2.9978623752584825, 'bear_tsl_mult': 0.25658334466550703, 'bear_time_stop': 271, 'bear_use_sma': False, 'bear_use_ema': True, 'bear_use_atr': True, 'bear_use_adx': False, 'bear_use_spike': True, 'bear_rsi_required': False, 'sideways_strategy': 'mean_reversion', 'sideways_bb_std_mult': 3.4228701434617825, 'sideways_rsi_os': 36, 'sideways_rsi_ob': 60, 'sideways_adx_thresh': 27.127447421809926, 'sideways_atr_min_pct': 0.027996778014655655, 'sideways_atr_max_pct': 0.1353177136211175, 'sideways_tp_mult': 1.896749018759198, 'sideways_tsl_mult': 0.28984721023475635, 'sideways_time_stop': 116, 'sideways_use_sma': True, 'sideways_use_ema': False, 'sideways_use_atr': True, 'sideways_use_adx': False, 'sideways_use_spike': True, 'sideways_rsi_required': False}.
[I 2025-08-31 09:59:16,278] Trial 33 finished with values: [-0.016426639068727877, 0.01663254256777369] and parameters: {'p_sma': 28, 'p_std': 26, 'p_atr': 10, 'p_adx': 11, 'rsi_period': 45, 'ema1': 15, 'ema2': 18, 'slip_atr_k': 0.05805732933127501, 'slip_spread_k': 0.5856981265828324, 'spread_hl_frac': 0.018215727197623783, 'bb_std_mult': 1.6953303414752408, 'rsi_os': 22, 'rsi_ob': 79, 'vol_spike': 0.2581228811170604, 'adx_thresh': 12.784092368101598, 'atr_min_pct': 0.023990680496504907, 'atr_max_pct': 0.149562012003822, 'tp_mult': 2.6929311573506385, 'tsl_mult': 0.6995901852243354, 'strategy': 'breakout', 'time_stop': 65, 'use_sma': True, 'use_atr': True, 'use_adx': True, 'use_ema': True, 'use_spike': False, 'rsi_required': True, 'edge_k': 0.03398632152075165, 'edge_cap': 0.30965303220226664, 'bull_strategy': 'breakout', 'bull_bb_std_mult': 2.3907521022698184, 'bull_rsi_os': 26, 'bull_rsi_ob': 71, 'bull_adx_thresh': 8.250313661274802, 'bull_atr_min_pct': 0.0030052145512686665, 'bull_atr_max_pct': 0.05286132223512885, 'bull_tp_mult': 2.2512375002768295, 'bull_tsl_mult': 0.3617774238868225, 'bull_time_stop': 139, 'bull_use_sma': True, 'bull_use_ema': False, 'bull_use_atr': True, 'bull_use_adx': False, 'bull_use_spike': False, 'bull_rsi_required': False, 'bear_strategy': 'mean_reversion', 'bear_bb_std_mult': 3.3412658142810105, 'bear_rsi_os': 37, 'bear_rsi_ob': 86, 'bear_adx_thresh': 32.0875165085442, 'bear_atr_min_pct': 0.0163164791513643, 'bear_atr_max_pct': 0.03975093197108294, 'bear_tp_mult': 2.803334849335229, 'bear_tsl_mult': 0.5360346416986239, 'bear_time_stop': 141, 'bear_use_sma': False, 'bear_use_ema': False, 'bear_use_atr': True, 'bear_use_adx': False, 'bear_use_spike': False, 'bear_rsi_required': False, 'sideways_strategy': 'breakout', 'sideways_bb_std_mult': 2.717923687256413, 'sideways_rsi_os': 26, 'sideways_rsi_ob': 71, 'sideways_adx_thresh': 27.72350067029914, 'sideways_atr_min_pct': 0.02288196671867358, 'sideways_atr_max_pct': 0.011201453894595065, 'sideways_tp_mult': 2.1983739165878564, 'sideways_tsl_mult': 0.6014270972502597, 'sideways_time_stop': 24, 'sideways_use_sma': False, 'sideways_use_ema': False, 'sideways_use_atr': True, 'sideways_use_adx': False, 'sideways_use_spike': True, 'sideways_rsi_required': False}.
