[I 2025-08-31 11:12:26,668] Trial 605 finished with values: [-1000000000.0, 1000000000.0] and parameters: {'p_sma': 13, 'p_std': 30, 'p_atr': 15, 'p_adx': 13, 'rsi_period': 49, 'ema1': 15, 'ema2': 12, 'slip_atr_k': 0.013059664401646437, 'slip_spread_k': 0.6688336357389922, 'spread_hl_frac': 0.019414794806510996, 'bb_std_mult': 2.340733173960178, 'rsi_os': 27, 'rsi_ob': 84, 'vol_spike': 0.25089871416688375, 'adx_thresh': 15.438558527368993, 'atr_min_pct': 0.00392219134977384, 'atr_max_pct': 0.09856227473015414, 'tp_mult': 2.295158579209808, 'tsl_mult': 0.0754389308681711, 'strategy': 'breakout', 'time_stop': 86, 'use_sma': True, 'use_atr': False, 'use_adx': True, 'use_ema': True, 'use_spike': True, 'rsi_required': True, 'edge_k': 0.24685014110961767, 'edge_cap': 0.45622171306389564, 'bull_strategy': 'breakout', 'bull_bb_std_mult': 2.710363233140293, 'bull_rsi_os': 29, 'bull_rsi_ob': 71, 'bull_adx_thresh': 5.613832364913987, 'bull_atr_min_pct': 0.0047241330670895355, 'bull_atr_max_pct': 0.04449641177568267, 'bull_tp_mult': 1.5318114921721735, 'bull_tsl_mult': 0.7736689263556913, 'bull_time_stop': 294, 'bull_use_sma': True, 'bull_use_ema': False, 'bull_use_atr': False, 'bull_use_adx': False, 'bull_use_spike': False, 'bull_rsi_required': True, 'bear_strategy': 'breakout', 'bear_bb_std_mult': 1.634945533640929, 'bear_rsi_os': 37, 'bear_rsi_ob': 92, 'bear_adx_thresh': 5.879659848929194, 'bear_atr_min_pct': 0.019068450209141614, 'bear_atr_max_pct': 0.014807393321869214, 'bear_tp_mult': 1.541859027401236, 'bear_tsl_mult': 0.33196176397620947, 'bear_time_stop': 47, 'bear_use_sma': False, 'bear_use_ema': True, 'bear_use_atr': False, 'bear_use_adx': False, 'bear_use_spike': True, 'bear_rsi_required': False, 'sideways_strategy': 'mean_reversion', 'sideways_bb_std_mult': 2.657362088795068, 'sideways_rsi_os': 7, 'sideways_rsi_ob': 89, 'sideways_adx_thresh': 5.155645848515986, 'sideways_atr_min_pct': 0.015978317229785932, 'sideways_atr_max_pct': 0.03662660280005277, 'sideways_tp_mult': 2.8141147264828255, 'sideways_tsl_mult': 0.882069905840849, 'sideways_time_stop': 10, 'sideways_use_sma': False, 'sideways_use_ema': False, 'sideways_use_atr': False, 'sideways_use_adx': False, 'sideways_use_spike': False, 'sideways_rsi_required': True}.
[I 2025-08-31 11:12:26,710] Trial 604 finished with values: [-1000000000.0, 1000000000.0] and parameters: {'p_sma': 14, 'p_std': 30, 'p_atr': 17, 'p_adx': 15, 'rsi_period': 49, 'ema1': 9, 'ema2': 43, 'slip_atr_k': 0.011576207884722547, 'slip_spread_k': 0.643801619233632, 'spread_hl_frac': 0.00715588235419119, 'bb_std_mult': 2.7618606533779873, 'rsi_os': 48, 'rsi_ob': 89, 'vol_spike': 0.2596741828822087, 'adx_thresh': 23.349069602656467, 'atr_min_pct': 0.004191452149685049, 'atr_max_pct': 0.10262939015854432, 'tp_mult': 1.592935425560305, 'tsl_mult': 0.24986838989484766, 'strategy': 'breakout', 'time_stop': 268, 'use_sma': True, 'use_atr': False, 'use_adx': True, 'use_ema': True, 'use_spike': True, 'rsi_required': True, 'edge_k': 0.2224634924819421, 'edge_cap': 0.6322821657315152, 'bull_strategy': 'breakout', 'bull_bb_std_mult': 2.7267937997948652, 'bull_rsi_os': 32, 'bull_rsi_ob': 72, 'bull_adx_thresh': 5.831507511702593, 'bull_atr_min_pct': 0.004431437574638178, 'bull_atr_max_pct': 0.09831083771448158, 'bull_tp_mult': 1.9676329087971918, 'bull_tsl_mult': 0.5623248457120675, 'bull_time_stop': 86, 'bull_use_sma': True, 'bull_use_ema': False, 'bull_use_atr': False, 'bull_use_adx': False, 'bull_use_spike': False, 'bull_rsi_required': True, 'bear_strategy': 'breakout', 'bear_bb_std_mult': 2.119089660597749, 'bear_rsi_os': 34, 'bear_rsi_ob': 87, 'bear_adx_thresh': 5.561455916182157, 'bear_atr_min_pct': 0.006401173451670673, 'bear_atr_max_pct': 0.01613968519061018, 'bear_tp_mult': 2.698925957486179, 'bear_tsl_mult': 0.47395983392662816, 'bear_time_stop': 49, 'bear_use_sma': False, 'bear_use_ema': True, 'bear_use_atr': False, 'bear_use_adx': False, 'bear_use_spike': True, 'bear_rsi_required': False, 'sideways_strategy': 'mean_reversion', 'sideways_bb_std_mult': 2.270547263309026, 'sideways_rsi_os': 7, 'sideways_rsi_ob': 84, 'sideways_adx_thresh': 25.449619370667754, 'sideways_atr_min_pct': 0.02939750563457231, 'sideways_atr_max_pct': 0.03583969269909898, 'sideways_tp_mult': 1.9240625212276727, 'sideways_tsl_mult': 0.10467310601691798, 'sideways_time_stop': 282, 'sideways_use_sma': False, 'sideways_use_ema': False, 'sideways_use_atr': False, 'sideways_use_adx': False, 'sideways_use_spike': False, 'sideways_rsi_required': True}.
[I 2025-08-31 11:12:26,942] Trial 603 finished with values: [-1000000000.0, 1000000000.0] and parameters: {'p_sma': 58, 'p_std': 30, 'p_atr': 12, 'p_adx': 10, 'rsi_period': 26, 'ema1': 15, 'ema2': 59, 'slip_atr_k': 0.013671501896612677, 'slip_spread_k': 0.6376963742181111, 'spread_hl_frac': 0.012569749899921382, 'bb_std_mult': 2.1936081547187904, 'rsi_os': 29, 'rsi_ob': 80, 'vol_spike': 0.25165850816684043, 'adx_thresh': 15.496539636516491, 'atr_min_pct': 0.021995996184528053, 'atr_max_pct': 0.09794398595133913, 'tp_mult': 1.9941729824556322, 'tsl_mult': 0.26170462553871904, 'strategy': 'breakout', 'time_stop': 89, 'use_sma': True, 'use_atr': False, 'use_adx': True, 'use_ema': True, 'use_spike': False, 'rsi_required': True, 'edge_k': 0.2149723261250358, 'edge_cap': 0.5397883808159861, 'bull_strategy': 'breakout', 'bull_bb_std_mult': 0.7292524804024493, 'bull_rsi_os': 7, 'bull_rsi_ob': 78, 'bull_adx_thresh': 5.681052547894489, 'bull_atr_min_pct': 0.0045003056213887855, 'bull_atr_max_pct': 0.10718173830775204, 'bull_tp_mult': 1.6550934505480837, 'bull_tsl_mult': 0.7790014281520119, 'bull_time_stop': 84, 'bull_use_sma': True, 'bull_use_ema': True, 'bull_use_atr': False, 'bull_use_adx': False, 'bull_use_spike': False, 'bull_rsi_required': True, 'bear_strategy': 'breakout', 'bear_bb_std_mult': 2.15481421824627, 'bear_rsi_os': 38, 'bear_rsi_ob': 90, 'bear_adx_thresh': 5.434121367880726, 'bear_atr_min_pct': 0.019161247801130647, 'bear_atr_max_pct': 0.11963075423595912, 'bear_tp_mult': 2.8394705679691192, 'bear_tsl_mult': 0.47763925272505636, 'bear_time_stop': 25, 'bear_use_sma': False, 'bear_use_ema': True, 'bear_use_atr': False, 'bear_use_adx': False, 'bear_use_spike': True, 'bear_rsi_required': False, 'sideways_strategy': 'mean_reversion', 'sideways_bb_std_mult': 2.8811144752038524, 'sideways_rsi_os': 7, 'sideways_rsi_ob': 88, 'sideways_adx_thresh': 26.397543682807004, 'sideways_atr_min_pct': 0.0213434529483578, 'sideways_atr_max_pct': 0.041533866690618274, 'sideways_tp_mult': 2.001304051879462, 'sideways_tsl_mult': 0.08143531246226152, 'sideways_time_stop': 203, 'sideways_use_sma': False, 'sideways_use_ema': False, 'sideways_use_atr': True, 'sideways_use_adx': False, 'sideways_use_spike': False, 'sideways_rsi_required': True}.
[I 2025-08-31 11:12:27,101] Trial 606 finished with values: [-1000000000.0, 1000000000.0] and parameters: {'p_sma': 7, 'p_std': 30, 'p_atr': 11, 'p_adx': 26, 'rsi_period': 50, 'ema1': 18, 'ema2': 26, 'slip_atr_k': 0.013059332289973344, 'slip_spread_k': 0.6661908576196978, 'spread_hl_frac': 0.007824833032908528, 'bb_std_mult': 2.7773884156549062, 'rsi_os': 8, 'rsi_ob': 78, 'vol_spike': 0.22503502359308925, 'adx_thresh': 8.230805332273604, 'atr_min_pct': 0.018010438854941156, 'atr_max_pct': 0.09760199385020449, 'tp_mult': 2.631506034315192, 'tsl_mult': 0.24704034518990242, 'strategy': 'breakout', 'time_stop': 267, 'use_sma': False, 'use_atr': False, 'use_adx': True, 'use_ema': True, 'use_spike': True, 'rsi_required': True, 'edge_k': 0.6346471024680187, 'edge_cap': 0.46125619237014776, 'bull_strategy': 'breakout', 'bull_bb_std_mult': 0.9889884126265939, 'bull_rsi_os': 32, 'bull_rsi_ob': 88, 'bull_adx_thresh': 5.701260993629493, 'bull_atr_min_pct': 0.004665039381424055, 'bull_atr_max_pct': 0.0444457043755822, 'bull_tp_mult': 1.6622298051911972, 'bull_tsl_mult': 0.16405279048399368, 'bull_time_stop': 73, 'bull_use_sma': False, 'bull_use_ema': True, 'bull_use_atr': False, 'bull_use_adx': False, 'bull_use_spike': False, 'bull_rsi_required': True, 'bear_strategy': 'breakout', 'bear_bb_std_mult': 1.6363087167935495, 'bear_rsi_os': 16, 'bear_rsi_ob': 59, 'bear_adx_thresh': 5.904321947467351, 'bear_atr_min_pct': 0.00859360692946551, 'bear_atr_max_pct': 0.02590002981334754, 'bear_tp_mult': 2.693127718111441, 'bear_tsl_mult': 0.0684696931241639, 'bear_time_stop': 47, 'bear_use_sma': False, 'bear_use_ema': True, 'bear_use_atr': False, 'bear_use_adx': False, 'bear_use_spike': True, 'bear_rsi_required': False, 'sideways_strategy': 'mean_reversion', 'sideways_bb_std_mult': 2.657002189304599, 'sideways_rsi_os': 32, 'sideways_rsi_ob': 85, 'sideways_adx_thresh': 14.707467670343071, 'sideways_atr_min_pct': 0.015750343122198224, 'sideways_atr_max_pct': 0.047277099557561215, 'sideways_tp_mult': 1.8482447553007033, 'sideways_tsl_mult': 0.882478288987558, 'sideways_time_stop': 201, 'sideways_use_sma': False, 'sideways_use_ema': False, 'sideways_use_atr': True, 'sideways_use_adx': False, 'sideways_use_spike': False, 'sideways_rsi_required': True}.
[I 2025-08-31 11:12:58,486] Trial 608 finished with values: [-1000000000.0, 1000000000.0] and parameters: {'p_sma': 18, 'p_std': 27, 'p_atr': 20, 'p_adx': 12, 'rsi_period': 26, 'ema1': 18, 'ema2': 59, 'slip_atr_k': 0.13135543745942083, 'slip_spread_k': 0.062292550799930624, 'spread_hl_frac': 0.008237426927809247, 'bb_std_mult': 2.8012044566475507, 'rsi_os': 34, 'rsi_ob': 78, 'vol_spike': 0.11451525626563916, 'adx_thresh': 28.10266690585625, 'atr_min_pct': 0.015203970685041158, 'atr_max_pct': 0.10746302548210794, 'tp_mult': 2.3710738717348665, 'tsl_mult': 0.3660092135284255, 'strategy': 'breakout', 'time_stop': 78, 'use_sma': False, 'use_atr': False, 'use_adx': True, 'use_ema': True, 'use_spike': True, 'rsi_required': True, 'edge_k': 0.5432257666624387, 'edge_cap': 0.14853735767902282, 'bull_strategy': 'breakout', 'bull_bb_std_mult': 0.7591990698059683, 'bull_rsi_os': 14, 'bull_rsi_ob': 78, 'bull_adx_thresh': 15.172838717100312, 'bull_atr_min_pct': 0.0025049673554845327, 'bull_atr_max_pct': 0.021625459488820845, 'bull_tp_mult': 1.6564306845681496, 'bull_tsl_mult': 0.1565814215539511, 'bull_time_stop': 71, 'bull_use_sma': False, 'bull_use_ema': True, 'bull_use_atr': False, 'bull_use_adx': True, 'bull_use_spike': True, 'bull_rsi_required': True, 'bear_strategy': 'mean_reversion', 'bear_bb_std_mult': 1.7351214023896433, 'bear_rsi_os': 40, 'bear_rsi_ob': 81, 'bear_adx_thresh': 7.295338014013836, 'bear_atr_min_pct': 0.005278907245957262, 'bear_atr_max_pct': 0.14991028035470444, 'bear_tp_mult': 1.9287591113534108, 'bear_tsl_mult': 0.06142188120514003, 'bear_time_stop': 37, 'bear_use_sma': False, 'bear_use_ema': True, 'bear_use_atr': False, 'bear_use_adx': False, 'bear_use_spike': True, 'bear_rsi_required': False, 'sideways_strategy': 'breakout', 'sideways_bb_std_mult': 3.0046654398450134, 'sideways_rsi_os': 30, 'sideways_rsi_ob': 95, 'sideways_adx_thresh': 31.0363505103634, 'sideways_atr_min_pct': 0.0251947026018325, 'sideways_atr_max_pct': 0.03121078760612702, 'sideways_tp_mult': 1.8476278464799052, 'sideways_tsl_mult': 0.28487147108952093, 'sideways_time_stop': 19, 'sideways_use_sma': False, 'sideways_use_ema': False, 'sideways_use_atr': True, 'sideways_use_adx': False, 'sideways_use_spike': False, 'sideways_rsi_required': True}.
[I 2025-08-31 11:12:58,486] Trial 607 finished with values: [-0.018550490255230923, 0.01873585494140421] and parameters: {'p_sma': 18, 'p_std': 5, 'p_atr': 11, 'p_adx': 14, 'rsi_period': 45, 'ema1': 19, 'ema2': 59, 'slip_atr_k': 0.13370262432245636, 'slip_spread_k': 0.6650588607440302, 'spread_hl_frac': 0.008305465917190086, 'bb_std_mult': 1.7823287690581182, 'rsi_os': 41, 'rsi_ob': 86, 'vol_spike': 0.2754211015759237, 'adx_thresh': 28.505749126537694, 'atr_min_pct': 0.02270369561346295, 'atr_max_pct': 0.11663487588782126, 'tp_mult': 2.35424286906833, 'tsl_mult': 0.2891146123318481, 'strategy': 'breakout', 'time_stop': 79, 'use_sma': False, 'use_atr': False, 'use_adx': True, 'use_ema': True, 'use_spike': True, 'rsi_required': True, 'edge_k': 1.078930736029279, 'edge_cap': 0.499823249599644, 'bull_strategy': 'breakout', 'bull_bb_std_mult': 0.755214787988332, 'bull_rsi_os': 9, 'bull_rsi_ob': 74, 'bull_adx_thresh': 14.963364413483342, 'bull_atr_min_pct': 0.002504236353867724, 'bull_atr_max_pct': 0.057446350338780025, 'bull_tp_mult': 1.5937047828127537, 'bull_tsl_mult': 0.2981710088957793, 'bull_time_stop': 39, 'bull_use_sma': False, 'bull_use_ema': True, 'bull_use_atr': False, 'bull_use_adx': True, 'bull_use_spike': True, 'bull_rsi_required': True, 'bear_strategy': 'mean_reversion', 'bear_bb_std_mult': 1.7302838382021688, 'bear_rsi_os': 40, 'bear_rsi_ob': 95, 'bear_adx_thresh': 7.383977143464195, 'bear_atr_min_pct': 0.005494684368367742, 'bear_atr_max_pct': 0.0436307950140839, 'bear_tp_mult': 2.826630054402795, 'bear_tsl_mult': 0.5244170217063119, 'bear_time_stop': 38, 'bear_use_sma': False, 'bear_use_ema': True, 'bear_use_atr': False, 'bear_use_adx': False, 'bear_use_spike': True, 'bear_rsi_required': False, 'sideways_strategy': 'breakout', 'sideways_bb_std_mult': 2.9223666765274423, 'sideways_rsi_os': 5, 'sideways_rsi_ob': 49, 'sideways_adx_thresh': 25.808865946304028, 'sideways_atr_min_pct': 0.017126300638275395, 'sideways_atr_max_pct': 0.04607961241172088, 'sideways_tp_mult': 1.9618991377131292, 'sideways_tsl_mult': 0.08337902017029625, 'sideways_time_stop': 120, 'sideways_use_sma': False, 'sideways_use_ema': False, 'sideways_use_atr': True, 'sideways_use_adx': False, 'sideways_use_spike': False, 'sideways_rsi_required': True}.
[I 2025-08-31 11:12:58,858] Trial 610 finished with values: [-1000000000.0, 1000000000.0] and parameters: {'p_sma': 12, 'p_std': 46, 'p_atr': 11, 'p_adx': 14, 'rsi_period': 45, 'ema1': 27, 'ema2': 55, 'slip_atr_k': 0.029683147816722974, 'slip_spread_k': 0.274486198536849, 'spread_hl_frac': 0.008593233228752368, 'bb_std_mult': 2.557447441284813, 'rsi_os': 10, 'rsi_ob': 86, 'vol_spike': 0.17150743593431034, 'adx_thresh': 28.376674029266688, 'atr_min_pct': 0.027849035630882486, 'atr_max_pct': 0.11709184167436121, 'tp_mult': 2.3793375584785963, 'tsl_mult': 0.36532964732224055, 'strategy': 'breakout', 'time_stop': 119, 'use_sma': False, 'use_atr': False, 'use_adx': True, 'use_ema': True, 'use_spike': True, 'rsi_required': False, 'edge_k': 0.5308916019688978, 'edge_cap': 0.6697503760070445, 'bull_strategy': 'breakout', 'bull_bb_std_mult': 0.8391379328080912, 'bull_rsi_os': 9, 'bull_rsi_ob': 74, 'bull_adx_thresh': 14.851926227777394, 'bull_atr_min_pct': 0.002027895300760231, 'bull_atr_max_pct': 0.05759587927581529, 'bull_tp_mult': 1.1580406044117109, 'bull_tsl_mult': 0.9563314524275159, 'bull_time_stop': 12, 'bull_use_sma': False, 'bull_use_ema': False, 'bull_use_atr': True, 'bull_use_adx': True, 'bull_use_spike': True, 'bull_rsi_required': True, 'bear_strategy': 'mean_reversion', 'bear_bb_std_mult': 1.7566111883614384, 'bear_rsi_os': 40, 'bear_rsi_ob': 84, 'bear_adx_thresh': 6.8774320060987275, 'bear_atr_min_pct': 0.010492185789224685, 'bear_atr_max_pct': 0.10284285555604028, 'bear_tp_mult': 1.895134982466002, 'bear_tsl_mult': 0.5331840806052013, 'bear_time_stop': 36, 'bear_use_sma': False, 'bear_use_ema': True, 'bear_use_atr': False, 'bear_use_adx': False, 'bear_use_spike': True, 'bear_rsi_required': True, 'sideways_strategy': 'breakout', 'sideways_bb_std_mult': 2.752763619134873, 'sideways_rsi_os': 26, 'sideways_rsi_ob': 95, 'sideways_adx_thresh': 25.931034064980185, 'sideways_atr_min_pct': 0.016962869930643023, 'sideways_atr_max_pct': 0.031855356512156006, 'sideways_tp_mult': 1.9592430598455894, 'sideways_tsl_mult': 0.15277148117976894, 'sideways_time_stop': 40, 'sideways_use_sma': False, 'sideways_use_ema': False, 'sideways_use_atr': False, 'sideways_use_adx': True, 'sideways_use_spike': True, 'sideways_rsi_required': True}.
[I 2025-08-31 11:12:59,023] Trial 609 finished with values: [-0.02553964681285814, 0.02559958572101312] and parameters: {'p_sma': 34, 'p_std': 14, 'p_atr': 10, 'p_adx': 13, 'rsi_period': 46, 'ema1': 19, 'ema2': 55, 'slip_atr_k': 0.020551865874386288, 'slip_spread_k': 0.6691406398075449, 'spread_hl_frac': 0.008517800058094008, 'bb_std_mult': 1.7848976445302398, 'rsi_os': 23, 'rsi_ob': 82, 'vol_spike': 0.1212326013449185, 'adx_thresh': 8.145866352831849, 'atr_min_pct': 0.027624165591571978, 'atr_max_pct': 0.12167306349507338, 'tp_mult': 2.625333723928243, 'tsl_mult': 0.677796954779241, 'strategy': 'breakout', 'time_stop': 77, 'use_sma': False, 'use_atr': False, 'use_adx': True, 'use_ema': True, 'use_spike': True, 'rsi_required': False, 'edge_k': 0.6310913046950836, 'edge_cap': 0.500034573808987, 'bull_strategy': 'breakout', 'bull_bb_std_mult': 0.8375068922814746, 'bull_rsi_os': 34, 'bull_rsi_ob': 92, 'bull_adx_thresh': 7.681827390293684, 'bull_atr_min_pct': 0.0022910447535661096, 'bull_atr_max_pct': 0.09252689036337094, 'bull_tp_mult': 2.268236558976252, 'bull_tsl_mult': 0.29358834234587616, 'bull_time_stop': 71, 'bull_use_sma': False, 'bull_use_ema': False, 'bull_use_atr': True, 'bull_use_adx': True, 'bull_use_spike': True, 'bull_rsi_required': True, 'bear_strategy': 'mean_reversion', 'bear_bb_std_mult': 3.1632563613771234, 'bear_rsi_os': 40, 'bear_rsi_ob': 84, 'bear_adx_thresh': 31.53164286016384, 'bear_atr_min_pct': 0.014192165484572836, 'bear_atr_max_pct': 0.11282593007784561, 'bear_tp_mult': 2.739922252263528, 'bear_tsl_mult': 0.525384789561379, 'bear_time_stop': 212, 'bear_use_sma': False, 'bear_use_ema': True, 'bear_use_atr': False, 'bear_use_adx': False, 'bear_use_spike': True, 'bear_rsi_required': True, 'sideways_strategy': 'breakout', 'sideways_bb_std_mult': 2.739229725654558, 'sideways_rsi_os': 13, 'sideways_rsi_ob': 85, 'sideways_adx_thresh': 25.76002602531477, 'sideways_atr_min_pct': 0.017214909232591228, 'sideways_atr_max_pct': 0.031384846767104166, 'sideways_tp_mult': 1.8419635231100548, 'sideways_tsl_mult': 0.13596091625303694, 'sideways_time_stop': 37, 'sideways_use_sma': False, 'sideways_use_ema': False, 'sideways_use_atr': False, 'sideways_use_adx': True, 'sideways_use_spike': True, 'sideways_rsi_required': True}.
[I 2025-08-31 11:13:31,212] Trial 614 finished with values: [-1000000000.0, 1000000000.0] and parameters: {'p_sma': 16, 'p_std': 28, 'p_atr': 22, 'p_adx': 7, 'rsi_period': 52, 'ema1': 13, 'ema2': 56, 'slip_atr_k': 0.035410638786407114, 'slip_spread_k': 0.5498971173572648, 'spread_hl_frac': 0.010340252381867338, 'bb_std_mult': 2.695564045114917, 'rsi_os': 27, 'rsi_ob': 76, 'vol_spike': 0.26996332643454435, 'adx_thresh': 21.480096373224402, 'atr_min_pct': 0.007962659849142906, 'atr_max_pct': 0.08555047076136031, 'tp_mult': 2.439563430669542, 'tsl_mult': 0.2796921341607287, 'strategy': 'breakout', 'time_stop': 64, 'use_sma': True, 'use_atr': True, 'use_adx': False, 'use_ema': True, 'use_spike': False, 'rsi_required': True, 'edge_k': 1.1647946736798922, 'edge_cap': 0.42319919168450537, 'bull_strategy': 'mean_reversion', 'bull_bb_std_mult': 3.5185605130991426, 'bull_rsi_os': 27, 'bull_rsi_ob': 82, 'bull_adx_thresh': 34.977903988797586, 'bull_atr_min_pct': 0.005167878873222896, 'bull_atr_max_pct': 0.08461478088169486, 'bull_tp_mult': 1.0546399554113657, 'bull_tsl_mult': 0.40289703170585045, 'bull_time_stop': 65, 'bull_use_sma': True, 'bull_use_ema': False, 'bull_use_atr': False, 'bull_use_adx': False, 'bull_use_spike': False, 'bull_rsi_required': True, 'bear_strategy': 'breakout', 'bear_bb_std_mult': 1.8429256213654897, 'bear_rsi_os': 24, 'bear_rsi_ob': 86, 'bear_adx_thresh': 21.331560015805287, 'bear_atr_min_pct': 0.0037725986600750366, 'bear_atr_max_pct': 0.04945479913418996, 'bear_tp_mult': 1.0833215376667102, 'bear_tsl_mult': 0.19788843770616643, 'bear_time_stop': 30, 'bear_use_sma': True, 'bear_use_ema': False, 'bear_use_atr': True, 'bear_use_adx': False, 'bear_use_spike': True, 'bear_rsi_required': False, 'sideways_strategy': 'mean_reversion', 'sideways_bb_std_mult': 1.4931241652000693, 'sideways_rsi_os': 9, 'sideways_rsi_ob': 75, 'sideways_adx_thresh': 15.948005849461698, 'sideways_atr_min_pct': 0.026859203998561128, 'sideways_atr_max_pct': 0.09356409404911052, 'sideways_tp_mult': 1.9120193723028298, 'sideways_tsl_mult': 0.11063327167480509, 'sideways_time_stop': 24, 'sideways_use_sma': False, 'sideways_use_ema': True, 'sideways_use_atr': False, 'sideways_use_adx': False, 'sideways_use_spike': False, 'sideways_rsi_required': True}.
