[I 2025-08-31 11:37:21,961] Trial 781 finished with values: [-1000000000.0, 1000000000.0] and parameters: {'p_sma': 14, 'p_std': 53, 'p_atr': 10, 'p_adx': 23, 'rsi_period': 53, 'ema1': 12, 'ema2': 45, 'slip_atr_k': 0.14416433475291546, 'slip_spread_k': 0.19092220240318325, 'spread_hl_frac': 0.006978698168570535, 'bb_std_mult': 2.8597090007713692, 'rsi_os': 30, 'rsi_ob': 94, 'vol_spike': 0.26757952916343, 'adx_thresh': 32.01451305221344, 'atr_min_pct': 0.012187469125851301, 'atr_max_pct': 0.1498699385262856, 'tp_mult': 1.5515529572464875, 'tsl_mult': 0.08552023497677405, 'strategy': 'mean_reversion', 'time_stop': 212, 'use_sma': True, 'use_atr': False, 'use_adx': True, 'use_ema': False, 'use_spike': True, 'rsi_required': False, 'edge_k': 1.3348232688003294, 'edge_cap': 0.6839597533557187, 'bull_strategy': 'breakout', 'bull_bb_std_mult': 0.701346651890438, 'bull_rsi_os': 10, 'bull_rsi_ob': 83, 'bull_adx_thresh': 15.381921057430205, 'bull_atr_min_pct': 0.01797720115385303, 'bull_atr_max_pct': 0.045322786197582024, 'bull_tp_mult': 2.8976685759204557, 'bull_tsl_mult': 0.3254809092724624, 'bull_time_stop': 283, 'bull_use_sma': False, 'bull_use_ema': True, 'bull_use_atr': False, 'bull_use_adx': False, 'bull_use_spike': False, 'bull_rsi_required': False, 'bear_strategy': 'mean_reversion', 'bear_bb_std_mult': 3.3427615059637126, 'bear_rsi_os': 53, 'bear_rsi_ob': 76, 'bear_adx_thresh': 5.825855489437883, 'bear_atr_min_pct': 0.003844742415759863, 'bear_atr_max_pct': 0.05680568236129108, 'bear_tp_mult': 2.9265695800192417, 'bear_tsl_mult': 0.8683173900049137, 'bear_time_stop': 36, 'bear_use_sma': False, 'bear_use_ema': False, 'bear_use_atr': False, 'bear_use_adx': True, 'bear_use_spike': False, 'bear_rsi_required': False, 'sideways_strategy': 'breakout', 'sideways_bb_std_mult': 2.8992186351029496, 'sideways_rsi_os': 28, 'sideways_rsi_ob': 94, 'sideways_adx_thresh': 14.516056579642232, 'sideways_atr_min_pct': 0.009348779973728634, 'sideways_atr_max_pct': 0.08433317484657116, 'sideways_tp_mult': 2.8437229395959656, 'sideways_tsl_mult': 0.40245431526841957, 'sideways_time_stop': 5, 'sideways_use_sma': True, 'sideways_use_ema': True, 'sideways_use_atr': True, 'sideways_use_adx': False, 'sideways_use_spike': True, 'sideways_rsi_required': True}.
[I 2025-08-31 11:37:22,214] Trial 784 finished with values: [-1000000000.0, 1000000000.0] and parameters: {'p_sma': 51, 'p_std': 29, 'p_atr': 12, 'p_adx': 14, 'rsi_period': 54, 'ema1': 12, 'ema2': 45, 'slip_atr_k': 0.1862500734769308, 'slip_spread_k': 0.18854513718402746, 'spread_hl_frac': 0.0072368116695298475, 'bb_std_mult': 2.7739566563436666, 'rsi_os': 30, 'rsi_ob': 90, 'vol_spike': 0.09120831154347228, 'adx_thresh': 31.98290604604374, 'atr_min_pct': 0.011789143883232251, 'atr_max_pct': 0.14733660801369788, 'tp_mult': 1.7843541767572773, 'tsl_mult': 0.12472726542830406, 'strategy': 'mean_reversion', 'time_stop': 195, 'use_sma': True, 'use_atr': False, 'use_adx': True, 'use_ema': False, 'use_spike': True, 'rsi_required': False, 'edge_k': 1.5094311466959873, 'edge_cap': 0.6834725192573836, 'bull_strategy': 'breakout', 'bull_bb_std_mult': 2.0848192141092294, 'bull_rsi_os': 11, 'bull_rsi_ob': 83, 'bull_adx_thresh': 6.468386108659492, 'bull_atr_min_pct': 0.0037286677997926884, 'bull_atr_max_pct': 0.10021406472666015, 'bull_tp_mult': 1.8843053724256502, 'bull_tsl_mult': 0.32863967580410247, 'bull_time_stop': 300, 'bull_use_sma': False, 'bull_use_ema': True, 'bull_use_atr': False, 'bull_use_adx': False, 'bull_use_spike': False, 'bull_rsi_required': False, 'bear_strategy': 'mean_reversion', 'bear_bb_std_mult': 3.343726599402274, 'bear_rsi_os': 49, 'bear_rsi_ob': 76, 'bear_adx_thresh': 7.784869900329307, 'bear_atr_min_pct': 0.02203923214640416, 'bear_atr_max_pct': 0.14371956387345206, 'bear_tp_mult': 2.848358822741194, 'bear_tsl_mult': 0.8666717389470273, 'bear_time_stop': 42, 'bear_use_sma': False, 'bear_use_ema': False, 'bear_use_atr': False, 'bear_use_adx': True, 'bear_use_spike': False, 'bear_rsi_required': False, 'sideways_strategy': 'breakout', 'sideways_bb_std_mult': 2.8819127408763863, 'sideways_rsi_os': 24, 'sideways_rsi_ob': 94, 'sideways_adx_thresh': 14.681918755284673, 'sideways_atr_min_pct': 0.009025655084870018, 'sideways_atr_max_pct': 0.0842695260256272, 'sideways_tp_mult': 2.8562133088996555, 'sideways_tsl_mult': 0.3320701749116507, 'sideways_time_stop': 10, 'sideways_use_sma': True, 'sideways_use_ema': True, 'sideways_use_atr': True, 'sideways_use_adx': False, 'sideways_use_spike': True, 'sideways_rsi_required': True}.
[I 2025-08-31 11:37:23,677] Trial 785 finished with values: [-1000000000.0, 1000000000.0] and parameters: {'p_sma': 14, 'p_std': 28, 'p_atr': 12, 'p_adx': 14, 'rsi_period': 53, 'ema1': 12, 'ema2': 43, 'slip_atr_k': 0.1840673460076981, 'slip_spread_k': 0.19229478443009435, 'spread_hl_frac': 0.00735548781412176, 'bb_std_mult': 2.7478370207648566, 'rsi_os': 14, 'rsi_ob': 90, 'vol_spike': 0.06711482465237474, 'adx_thresh': 32.121385759137524, 'atr_min_pct': 0.013008093837709768, 'atr_max_pct': 0.14995312864048319, 'tp_mult': 1.7701855443204004, 'tsl_mult': 0.043469685569939076, 'strategy': 'mean_reversion', 'time_stop': 194, 'use_sma': True, 'use_atr': False, 'use_adx': True, 'use_ema': True, 'use_spike': True, 'rsi_required': False, 'edge_k': 0.4819122603387527, 'edge_cap': 0.537061383880648, 'bull_strategy': 'breakout', 'bull_bb_std_mult': 3.5250520304786876, 'bull_rsi_os': 11, 'bull_rsi_ob': 83, 'bull_adx_thresh': 6.3214315668529935, 'bull_atr_min_pct': 0.003947879393568801, 'bull_atr_max_pct': 0.030914401862727092, 'bull_tp_mult': 1.1251896725931996, 'bull_tsl_mult': 0.5976010952820338, 'bull_time_stop': 281, 'bull_use_sma': False, 'bull_use_ema': True, 'bull_use_atr': False, 'bull_use_adx': False, 'bull_use_spike': False, 'bull_rsi_required': True, 'bear_strategy': 'mean_reversion', 'bear_bb_std_mult': 3.165375064568082, 'bear_rsi_os': 52, 'bear_rsi_ob': 76, 'bear_adx_thresh': 7.577165334211646, 'bear_atr_min_pct': 5.6606673311948574e-05, 'bear_atr_max_pct': 0.14400173871775312, 'bear_tp_mult': 1.881978399978845, 'bear_tsl_mult': 0.8671720673547684, 'bear_time_stop': 40, 'bear_use_sma': False, 'bear_use_ema': True, 'bear_use_atr': False, 'bear_use_adx': False, 'bear_use_spike': False, 'bear_rsi_required': False, 'sideways_strategy': 'breakout', 'sideways_bb_std_mult': 2.9050198301033427, 'sideways_rsi_os': 24, 'sideways_rsi_ob': 94, 'sideways_adx_thresh': 14.807462409530219, 'sideways_atr_min_pct': 0.009180473589018981, 'sideways_atr_max_pct': 0.03342890155424814, 'sideways_tp_mult': 2.678867197584465, 'sideways_tsl_mult': 0.3278737752404429, 'sideways_time_stop': 277, 'sideways_use_sma': True, 'sideways_use_ema': False, 'sideways_use_atr': True, 'sideways_use_adx': False, 'sideways_use_spike': True, 'sideways_rsi_required': True}.
[I 2025-08-31 11:38:02,265] Trial 789 finished with values: [-1000000000.0, 1000000000.0] and parameters: {'p_sma': 9, 'p_std': 27, 'p_atr': 27, 'p_adx': 14, 'rsi_period': 32, 'ema1': 11, 'ema2': 47, 'slip_atr_k': 0.05666123764536092, 'slip_spread_k': 0.15032233877602902, 'spread_hl_frac': 0.029359091914073283, 'bb_std_mult': 2.9863729622590713, 'rsi_os': 9, 'rsi_ob': 91, 'vol_spike': 0.2858145374615402, 'adx_thresh': 30.58746387540324, 'atr_min_pct': 0.010629495078651992, 'atr_max_pct': 0.1447408052301535, 'tp_mult': 1.689669396479132, 'tsl_mult': 0.05445094144128258, 'strategy': 'breakout', 'time_stop': 188, 'use_sma': False, 'use_atr': True, 'use_adx': False, 'use_ema': True, 'use_spike': False, 'rsi_required': False, 'edge_k': 0.3340083185902081, 'edge_cap': 0.7481388603764798, 'bull_strategy': 'breakout', 'bull_bb_std_mult': 0.6252768456325583, 'bull_rsi_os': 27, 'bull_rsi_ob': 81, 'bull_adx_thresh': 22.966475962574663, 'bull_atr_min_pct': 0.0031434929705619927, 'bull_atr_max_pct': 0.12259040921688608, 'bull_tp_mult': 2.707318217169583, 'bull_tsl_mult': 0.7926127675583066, 'bull_time_stop': 291, 'bull_use_sma': False, 'bull_use_ema': True, 'bull_use_atr': True, 'bull_use_adx': True, 'bull_use_spike': True, 'bull_rsi_required': True, 'bear_strategy': 'breakout', 'bear_bb_std_mult': 3.0766641971592157, 'bear_rsi_os': 51, 'bear_rsi_ob': 73, 'bear_adx_thresh': 30.935120178528635, 'bear_atr_min_pct': 0.005283321924854902, 'bear_atr_max_pct': 0.13757594487486088, 'bear_tp_mult': 2.769744678268779, 'bear_tsl_mult': 0.8125342963541742, 'bear_time_stop': 8, 'bear_use_sma': False, 'bear_use_ema': True, 'bear_use_atr': True, 'bear_use_adx': False, 'bear_use_spike': False, 'bear_rsi_required': False, 'sideways_strategy': 'breakout', 'sideways_bb_std_mult': 2.727654098662284, 'sideways_rsi_os': 27, 'sideways_rsi_ob': 53, 'sideways_adx_thresh': 12.831298926006669, 'sideways_atr_min_pct': 0.0018060027908886542, 'sideways_atr_max_pct': 0.10902323286649536, 'sideways_tp_mult': 1.8623946877989639, 'sideways_tsl_mult': 0.3711365751874311, 'sideways_time_stop': 240, 'sideways_use_sma': False, 'sideways_use_ema': False, 'sideways_use_atr': True, 'sideways_use_adx': True, 'sideways_use_spike': True, 'sideways_rsi_required': False}.
[I 2025-08-31 11:38:02,882] Trial 787 finished with values: [-1000000000.0, 1000000000.0] and parameters: {'p_sma': 9, 'p_std': 28, 'p_atr': 11, 'p_adx': 14, 'rsi_period': 51, 'ema1': 11, 'ema2': 43, 'slip_atr_k': 0.028250719549852036, 'slip_spread_k': 0.1571787753772702, 'spread_hl_frac': 0.004650691337230553, 'bb_std_mult': 2.7256758939001986, 'rsi_os': 7, 'rsi_ob': 91, 'vol_spike': 0.01899954611159327, 'adx_thresh': 30.492587002590014, 'atr_min_pct': 0.010786863158546751, 'atr_max_pct': 0.1475274904450992, 'tp_mult': 1.7763424487414476, 'tsl_mult': 0.04621335809387773, 'strategy': 'breakout', 'time_stop': 190, 'use_sma': True, 'use_atr': False, 'use_adx': True, 'use_ema': True, 'use_spike': True, 'rsi_required': False, 'edge_k': 0.33828191229427906, 'edge_cap': 0.5312019672809578, 'bull_strategy': 'breakout', 'bull_bb_std_mult': 0.5997166515964268, 'bull_rsi_os': 12, 'bull_rsi_ob': 80, 'bull_adx_thresh': 6.388229215891394, 'bull_atr_min_pct': 0.005251505015333276, 'bull_atr_max_pct': 0.10010666498799377, 'bull_tp_mult': 1.911623894667391, 'bull_tsl_mult': 0.35664496168523974, 'bull_time_stop': 300, 'bull_use_sma': False, 'bull_use_ema': True, 'bull_use_atr': False, 'bull_use_adx': False, 'bull_use_spike': False, 'bull_rsi_required': True, 'bear_strategy': 'breakout', 'bear_bb_std_mult': 3.191310107575732, 'bear_rsi_os': 51, 'bear_rsi_ob': 73, 'bear_adx_thresh': 5.661280794419901, 'bear_atr_min_pct': 0.021711934832012628, 'bear_atr_max_pct': 0.04412828336644258, 'bear_tp_mult': 1.8707180007869373, 'bear_tsl_mult': 0.8102895178086793, 'bear_time_stop': 44, 'bear_use_sma': False, 'bear_use_ema': True, 'bear_use_atr': False, 'bear_use_adx': False, 'bear_use_spike': False, 'bear_rsi_required': False, 'sideways_strategy': 'breakout', 'sideways_bb_std_mult': 2.750165309989573, 'sideways_rsi_os': 24, 'sideways_rsi_ob': 93, 'sideways_adx_thresh': 11.642109701304145, 'sideways_atr_min_pct': 0.01360865310366397, 'sideways_atr_max_pct': 0.050555432686215644, 'sideways_tp_mult': 1.8548128280645475, 'sideways_tsl_mult': 0.324779713128153, 'sideways_time_stop': 217, 'sideways_use_sma': False, 'sideways_use_ema': False, 'sideways_use_atr': True, 'sideways_use_adx': True, 'sideways_use_spike': True, 'sideways_rsi_required': False}.
[I 2025-08-31 11:38:03,296] Trial 788 finished with values: [-1000000000.0, 1000000000.0] and parameters: {'p_sma': 13, 'p_std': 28, 'p_atr': 11, 'p_adx': 14, 'rsi_period': 51, 'ema1': 11, 'ema2': 43, 'slip_atr_k': 0.039373196249851056, 'slip_spread_k': 0.15932477326229783, 'spread_hl_frac': 0.043111371907607374, 'bb_std_mult': 1.9185855660611626, 'rsi_os': 35, 'rsi_ob': 91, 'vol_spike': 0.07568674253823737, 'adx_thresh': 30.43844446685231, 'atr_min_pct': 0.011092402051177118, 'atr_max_pct': 0.1422915380680496, 'tp_mult': 1.737237932101383, 'tsl_mult': 0.037495875730162345, 'strategy': 'breakout', 'time_stop': 222, 'use_sma': True, 'use_atr': False, 'use_adx': True, 'use_ema': True, 'use_spike': False, 'rsi_required': False, 'edge_k': 0.314484991706554, 'edge_cap': 0.7606366657899806, 'bull_strategy': 'breakout', 'bull_bb_std_mult': 2.457258679297793, 'bull_rsi_os': 14, 'bull_rsi_ob': 81, 'bull_adx_thresh': 22.852834382675045, 'bull_atr_min_pct': 0.002923186143692646, 'bull_atr_max_pct': 0.09957561090438757, 'bull_tp_mult': 1.2247770010008927, 'bull_tsl_mult': 0.9366439028605613, 'bull_time_stop': 286, 'bull_use_sma': False, 'bull_use_ema': True, 'bull_use_atr': False, 'bull_use_adx': True, 'bull_use_spike': False, 'bull_rsi_required': True, 'bear_strategy': 'breakout', 'bear_bb_std_mult': 3.1857227347095427, 'bear_rsi_os': 51, 'bear_rsi_ob': 73, 'bear_adx_thresh': 25.99673008433377, 'bear_atr_min_pct': 0.02864241742880911, 'bear_atr_max_pct': 0.04276100777712978, 'bear_tp_mult': 1.7220479045743124, 'bear_tsl_mult': 0.7571716872804894, 'bear_time_stop': 8, 'bear_use_sma': False, 'bear_use_ema': True, 'bear_use_atr': False, 'bear_use_adx': False, 'bear_use_spike': False, 'bear_rsi_required': False, 'sideways_strategy': 'breakout', 'sideways_bb_std_mult': 2.727007685796298, 'sideways_rsi_os': 25, 'sideways_rsi_ob': 93, 'sideways_adx_thresh': 12.928906208678484, 'sideways_atr_min_pct': 0.015721634694675534, 'sideways_atr_max_pct': 0.11354984287541958, 'sideways_tp_mult': 2.01778915162743, 'sideways_tsl_mult': 0.36458186478434074, 'sideways_time_stop': 276, 'sideways_use_sma': False, 'sideways_use_ema': False, 'sideways_use_atr': True, 'sideways_use_adx': True, 'sideways_use_spike': True, 'sideways_rsi_required': False}.
[I 2025-08-31 11:38:03,496] Trial 786 finished with values: [-1000000000.0, 1000000000.0] and parameters: {'p_sma': 13, 'p_std': 28, 'p_atr': 12, 'p_adx': 14, 'rsi_period': 54, 'ema1': 12, 'ema2': 43, 'slip_atr_k': 0.18684592778310508, 'slip_spread_k': 0.18998542554920367, 'spread_hl_frac': 0.004650140401195558, 'bb_std_mult': 2.08134885647823, 'rsi_os': 8, 'rsi_ob': 90, 'vol_spike': 0.27590524863996185, 'adx_thresh': 30.78603393091948, 'atr_min_pct': 0.010935340901075005, 'atr_max_pct': 0.14737998637507646, 'tp_mult': 1.786590988808857, 'tsl_mult': 0.04356456007465312, 'strategy': 'breakout', 'time_stop': 189, 'use_sma': True, 'use_atr': False, 'use_adx': True, 'use_ema': True, 'use_spike': True, 'rsi_required': False, 'edge_k': 0.33761284922897805, 'edge_cap': 0.5890989339123264, 'bull_strategy': 'breakout', 'bull_bb_std_mult': 2.488190006727721, 'bull_rsi_os': 12, 'bull_rsi_ob': 81, 'bull_adx_thresh': 18.62526964016494, 'bull_atr_min_pct': 0.0052634634868538605, 'bull_atr_max_pct': 0.015647155219691164, 'bull_tp_mult': 1.1163038329366881, 'bull_tsl_mult': 0.3588459521138171, 'bull_time_stop': 286, 'bull_use_sma': False, 'bull_use_ema': True, 'bull_use_atr': False, 'bull_use_adx': False, 'bull_use_spike': False, 'bull_rsi_required': True, 'bear_strategy': 'breakout', 'bear_bb_std_mult': 3.190217963814977, 'bear_rsi_os': 49, 'bear_rsi_ob': 74, 'bear_adx_thresh': 17.38344606098924, 'bear_atr_min_pct': 0.021782612131796247, 'bear_atr_max_pct': 0.13778549155299016, 'bear_tp_mult': 2.7701504178602674, 'bear_tsl_mult': 0.8137967499703149, 'bear_time_stop': 42, 'bear_use_sma': False, 'bear_use_ema': True, 'bear_use_atr': False, 'bear_use_adx': False, 'bear_use_spike': False, 'bear_rsi_required': False, 'sideways_strategy': 'breakout', 'sideways_bb_std_mult': 0.5903473461834055, 'sideways_rsi_os': 22, 'sideways_rsi_ob': 93, 'sideways_adx_thresh': 14.56364622057006, 'sideways_atr_min_pct': 0.015662257959218065, 'sideways_atr_max_pct': 0.04949481619342134, 'sideways_tp_mult': 1.8687091243842855, 'sideways_tsl_mult': 0.3248443357030642, 'sideways_time_stop': 216, 'sideways_use_sma': False, 'sideways_use_ema': False, 'sideways_use_atr': True, 'sideways_use_adx': True, 'sideways_use_spike': True, 'sideways_rsi_required': False}.
[I 2025-08-31 11:38:40,458] Trial 790 finished with values: [-0.043076439985495374, 0.04319717625212026] and parameters: {'p_sma': 13, 'p_std': 29, 'p_atr': 11, 'p_adx': 14, 'rsi_period': 51, 'ema1': 11, 'ema2': 42, 'slip_atr_k': 0.03190111115578356, 'slip_spread_k': 0.15161613231087032, 'spread_hl_frac': 0.044252417613657745, 'bb_std_mult': 1.4017756622703383, 'rsi_os': 29, 'rsi_ob': 91, 'vol_spike': 0.07815818209131195, 'adx_thresh': 30.593581974188588, 'atr_min_pct': 0.010934632946505323, 'atr_max_pct': 0.14651123793366183, 'tp_mult': 1.7274126251454829, 'tsl_mult': 0.0299413174854506, 'strategy': 'breakout', 'time_stop': 223, 'use_sma': True, 'use_atr': False, 'use_adx': True, 'use_ema': True, 'use_spike': True, 'rsi_required': False, 'edge_k': 0.34064737880767026, 'edge_cap': 0.5040561762381167, 'bull_strategy': 'breakout', 'bull_bb_std_mult': 0.7425558794212241, 'bull_rsi_os': 14, 'bull_rsi_ob': 80, 'bull_adx_thresh': 5.473491099405667, 'bull_atr_min_pct': 0.005037900687717227, 'bull_atr_max_pct': 0.026783416970662076, 'bull_tp_mult': 2.9536644485568724, 'bull_tsl_mult': 0.35960671523077575, 'bull_time_stop': 283, 'bull_use_sma': False, 'bull_use_ema': True, 'bull_use_atr': False, 'bull_use_adx': False, 'bull_use_spike': False, 'bull_rsi_required': True, 'bear_strategy': 'breakout', 'bear_bb_std_mult': 3.1854236244925915, 'bear_rsi_os': 54, 'bear_rsi_ob': 74, 'bear_adx_thresh': 17.245984633904907, 'bear_atr_min_pct': 0.0026544993120767545, 'bear_atr_max_pct': 0.13568756107016952, 'bear_tp_mult': 2.838169374866223, 'bear_tsl_mult': 0.7679703884902576, 'bear_time_stop': 140, 'bear_use_sma': False, 'bear_use_ema': True, 'bear_use_atr': False, 'bear_use_adx': False, 'bear_use_spike': False, 'bear_rsi_required': False, 'sideways_strategy': 'breakout', 'sideways_bb_std_mult': 2.8130014155695786, 'sideways_rsi_os': 22, 'sideways_rsi_ob': 93, 'sideways_adx_thresh': 11.73557978571612, 'sideways_atr_min_pct': 0.027041837372284584, 'sideways_atr_max_pct': 0.04367121075541542, 'sideways_tp_mult': 2.0147306442262476, 'sideways_tsl_mult': 0.357199184898236, 'sideways_time_stop': 15, 'sideways_use_sma': False, 'sideways_use_ema': False, 'sideways_use_atr': True, 'sideways_use_adx': True, 'sideways_use_spike': True, 'sideways_rsi_required': False}.
[I 2025-08-31 11:38:41,042] Trial 792 finished with values: [-0.034724908187884984, 0.034509933676422175] and parameters: {'p_sma': 15, 'p_std': 29, 'p_atr': 21, 'p_adx': 14, 'rsi_period': 55, 'ema1': 10, 'ema2': 40, 'slip_atr_k': 0.03161854474913525, 'slip_spread_k': 0.13551465381729877, 'spread_hl_frac': 0.0028420364831038304, 'bb_std_mult': 1.6806253209418125, 'rsi_os': 29, 'rsi_ob': 91, 'vol_spike': 0.0413568727074749, 'adx_thresh': 31.294628235241678, 'atr_min_pct': 0.011603937667610097, 'atr_max_pct': 0.14516364716980198, 'tp_mult': 1.6769539149185972, 'tsl_mult': 0.10488040266258461, 'strategy': 'breakout', 'time_stop': 207, 'use_sma': False, 'use_atr': False, 'use_adx': True, 'use_ema': True, 'use_spike': True, 'rsi_required': False, 'edge_k': 0.3849988495218069, 'edge_cap': 0.5059121308384057, 'bull_strategy': 'mean_reversion', 'bull_bb_std_mult': 0.7551099726089138, 'bull_rsi_os': 13, 'bull_rsi_ob': 86, 'bull_adx_thresh': 5.819839352161211, 'bull_atr_min_pct': 0.005439312932527482, 'bull_atr_max_pct': 0.10410278809697655, 'bull_tp_mult': 1.7883350669744, 'bull_tsl_mult': 0.13335089565889274, 'bull_time_stop': 267, 'bull_use_sma': False, 'bull_use_ema': True, 'bull_use_atr': False, 'bull_use_adx': False, 'bull_use_spike': True, 'bull_rsi_required': True, 'bear_strategy': 'breakout', 'bear_bb_std_mult': 3.083720134158625, 'bear_rsi_os': 54, 'bear_rsi_ob': 75, 'bear_adx_thresh': 27.778906989870706, 'bear_atr_min_pct': 0.0026117470502539236, 'bear_atr_max_pct': 0.13748271367839396, 'bear_tp_mult': 2.8461776365378024, 'bear_tsl_mult': 0.7799174733779148, 'bear_time_stop': 22, 'bear_use_sma': True, 'bear_use_ema': True, 'bear_use_atr': False, 'bear_use_adx': False, 'bear_use_spike': False, 'bear_rsi_required': True, 'sideways_strategy': 'breakout', 'sideways_bb_std_mult': 1.919918416062079, 'sideways_rsi_os': 21, 'sideways_rsi_ob': 95, 'sideways_adx_thresh': 9.92414403554884, 'sideways_atr_min_pct': 0.026961483344848373, 'sideways_atr_max_pct': 0.04497577721368925, 'sideways_tp_mult': 2.5881881043208095, 'sideways_tsl_mult': 0.35451172632850564, 'sideways_time_stop': 15, 'sideways_use_sma': False, 'sideways_use_ema': False, 'sideways_use_atr': True, 'sideways_use_adx': False, 'sideways_use_spike': True, 'sideways_rsi_required': True}.
