[I 2025-08-31 10:21:34,141] Trial 210 finished with values: [-0.09995616225378434, 0.09973343691750054] and parameters: {'p_sma': 17, 'p_std': 26, 'p_atr': 16, 'p_adx': 17, 'rsi_period': 71, 'ema1': 15, 'ema2': 35, 'slip_atr_k': 0.15462473679164387, 'slip_spread_k': 0.30384510305671253, 'spread_hl_frac': 0.008838491736156685, 'bb_std_mult': 0.8315087420338506, 'rsi_os': 5, 'rsi_ob': 86, 'vol_spike': 0.2603978360037123, 'adx_thresh': 18.689747388649764, 'atr_min_pct': 0.005762866670088758, 'atr_max_pct': 0.08535280195844573, 'tp_mult': 1.6073284640714056, 'tsl_mult': 0.2978528795783677, 'strategy': 'breakout', 'time_stop': 205, 'use_sma': True, 'use_atr': True, 'use_adx': False, 'use_ema': True, 'use_spike': True, 'rsi_required': True, 'edge_k': 0.10139969331118376, 'edge_cap': 0.7951967327386578, 'bull_strategy': 'mean_reversion', 'bull_bb_std_mult': 0.9100842644110838, 'bull_rsi_os': 39, 'bull_rsi_ob': 69, 'bull_adx_thresh': 15.982697001147539, 'bull_atr_min_pct': 0.0024815487303717584, 'bull_atr_max_pct': 0.13768998744282052, 'bull_tp_mult': 1.5836923094483635, 'bull_tsl_mult': 0.361552092617021, 'bull_time_stop': 200, 'bull_use_sma': True, 'bull_use_ema': False, 'bull_use_atr': False, 'bull_use_adx': True, 'bull_use_spike': True, 'bull_rsi_required': False, 'bear_strategy': 'breakout', 'bear_bb_std_mult': 1.1952828438390066, 'bear_rsi_os': 41, 'bear_rsi_ob': 67, 'bear_adx_thresh': 15.035739632678935, 'bear_atr_min_pct': 0.0006840165140793979, 'bear_atr_max_pct': 0.07619984625263783, 'bear_tp_mult': 2.737874246623434, 'bear_tsl_mult': 0.5151561580318642, 'bear_time_stop': 188, 'bear_use_sma': False, 'bear_use_ema': True, 'bear_use_atr': False, 'bear_use_adx': False, 'bear_use_spike': False, 'bear_rsi_required': False, 'sideways_strategy': 'mean_reversion', 'sideways_bb_std_mult': 2.8464735455483905, 'sideways_rsi_os': 18, 'sideways_rsi_ob': 58, 'sideways_adx_thresh': 25.283395568326746, 'sideways_atr_min_pct': 0.002697008124830997, 'sideways_atr_max_pct': 0.07360170596593474, 'sideways_tp_mult': 1.1346285914226337, 'sideways_tsl_mult': 0.8611116308224149, 'sideways_time_stop': 41, 'sideways_use_sma': False, 'sideways_use_ema': False, 'sideways_use_atr': True, 'sideways_use_adx': False, 'sideways_use_spike': False, 'sideways_rsi_required': False}.
[I 2025-08-31 10:21:34,475] Trial 207 finished with values: [-0.023695606753623588, 0.023610648281632337] and parameters: {'p_sma': 20, 'p_std': 26, 'p_atr': 29, 'p_adx': 18, 'rsi_period': 44, 'ema1': 18, 'ema2': 24, 'slip_atr_k': 0.10030094446364686, 'slip_spread_k': 0.5934861314990315, 'spread_hl_frac': 0.0404613477897804, 'bb_std_mult': 0.6019622942380647, 'rsi_os': 8, 'rsi_ob': 74, 'vol_spike': 0.2611010410092951, 'adx_thresh': 28.586903057015633, 'atr_min_pct': 0.004502390178515514, 'atr_max_pct': 0.09901893867254763, 'tp_mult': 1.6089304614261923, 'tsl_mult': 0.19726488823935884, 'strategy': 'breakout', 'time_stop': 217, 'use_sma': True, 'use_atr': True, 'use_adx': False, 'use_ema': True, 'use_spike': True, 'rsi_required': True, 'edge_k': 0.19671793363875126, 'edge_cap': 0.7988128838153377, 'bull_strategy': 'breakout', 'bull_bb_std_mult': 0.9237770649833196, 'bull_rsi_os': 42, 'bull_rsi_ob': 67, 'bull_adx_thresh': 25.870203831648077, 'bull_atr_min_pct': 0.020531149036669135, 'bull_atr_max_pct': 0.1258590892347537, 'bull_tp_mult': 1.5802836379237415, 'bull_tsl_mult': 0.35280799300898247, 'bull_time_stop': 98, 'bull_use_sma': True, 'bull_use_ema': False, 'bull_use_atr': False, 'bull_use_adx': True, 'bull_use_spike': True, 'bull_rsi_required': True, 'bear_strategy': 'breakout', 'bear_bb_std_mult': 1.226970591919259, 'bear_rsi_os': 42, 'bear_rsi_ob': 69, 'bear_adx_thresh': 22.071293041913997, 'bear_atr_min_pct': 0.003171959113023977, 'bear_atr_max_pct': 0.08239068934760035, 'bear_tp_mult': 2.2045143669127643, 'bear_tsl_mult': 0.4688086276692282, 'bear_time_stop': 42, 'bear_use_sma': False, 'bear_use_ema': True, 'bear_use_atr': False, 'bear_use_adx': False, 'bear_use_spike': False, 'bear_rsi_required': False, 'sideways_strategy': 'mean_reversion', 'sideways_bb_std_mult': 2.846634531526678, 'sideways_rsi_os': 20, 'sideways_rsi_ob': 80, 'sideways_adx_thresh': 25.257045144148957, 'sideways_atr_min_pct': 0.0027477150477632018, 'sideways_atr_max_pct': 0.05432165755400862, 'sideways_tp_mult': 1.9293125049788464, 'sideways_tsl_mult': 0.06719832330327857, 'sideways_time_stop': 41, 'sideways_use_sma': False, 'sideways_use_ema': False, 'sideways_use_atr': True, 'sideways_use_adx': True, 'sideways_use_spike': True, 'sideways_rsi_required': True}.
[I 2025-08-31 10:21:34,691] Trial 208 finished with values: [-1000000000.0, 1000000000.0] and parameters: {'p_sma': 10, 'p_std': 28, 'p_atr': 30, 'p_adx': 17, 'rsi_period': 44, 'ema1': 15, 'ema2': 23, 'slip_atr_k': 0.08999763492255763, 'slip_spread_k': 0.6562027102891899, 'spread_hl_frac': 0.04158101372207469, 'bb_std_mult': 0.6115638404281002, 'rsi_os': 37, 'rsi_ob': 74, 'vol_spike': 0.25582047072608244, 'adx_thresh': 18.46672166016169, 'atr_min_pct': 0.02586679030693688, 'atr_max_pct': 0.09534542257898834, 'tp_mult': 1.5798223025754912, 'tsl_mult': 0.026085095755270737, 'strategy': 'breakout', 'time_stop': 206, 'use_sma': True, 'use_atr': True, 'use_adx': False, 'use_ema': True, 'use_spike': True, 'rsi_required': True, 'edge_k': 0.09999623420642301, 'edge_cap': 0.8339947349870394, 'bull_strategy': 'breakout', 'bull_bb_std_mult': 0.6997619526760792, 'bull_rsi_os': 42, 'bull_rsi_ob': 70, 'bull_adx_thresh': 16.013930889769455, 'bull_atr_min_pct': 0.0036439632106134118, 'bull_atr_max_pct': 0.1262624114984424, 'bull_tp_mult': 1.5314694734030243, 'bull_tsl_mult': 0.6168048160113017, 'bull_time_stop': 148, 'bull_use_sma': True, 'bull_use_ema': False, 'bull_use_atr': False, 'bull_use_adx': True, 'bull_use_spike': True, 'bull_rsi_required': True, 'bear_strategy': 'breakout', 'bear_bb_std_mult': 1.230972274220749, 'bear_rsi_os': 38, 'bear_rsi_ob': 63, 'bear_adx_thresh': 14.62040725608061, 'bear_atr_min_pct': 0.02360667909961845, 'bear_atr_max_pct': 0.07694320228551801, 'bear_tp_mult': 2.71288992809626, 'bear_tsl_mult': 0.5140952644350253, 'bear_time_stop': 43, 'bear_use_sma': False, 'bear_use_ema': True, 'bear_use_atr': False, 'bear_use_adx': False, 'bear_use_spike': False, 'bear_rsi_required': False, 'sideways_strategy': 'mean_reversion', 'sideways_bb_std_mult': 0.8448520411151936, 'sideways_rsi_os': 18, 'sideways_rsi_ob': 89, 'sideways_adx_thresh': 6.1004855831131835, 'sideways_atr_min_pct': 0.005595993956622545, 'sideways_atr_max_pct': 0.0758125061610463, 'sideways_tp_mult': 1.9242475368549345, 'sideways_tsl_mult': 0.7598593779567944, 'sideways_time_stop': 42, 'sideways_use_sma': False, 'sideways_use_ema': False, 'sideways_use_atr': True, 'sideways_use_adx': True, 'sideways_use_spike': True, 'sideways_rsi_required': False}.
[I 2025-08-31 10:21:34,834] Trial 209 finished with values: [-1000000000.0, 1000000000.0] and parameters: {'p_sma': 7, 'p_std': 27, 'p_atr': 23, 'p_adx': 17, 'rsi_period': 44, 'ema1': 15, 'ema2': 56, 'slip_atr_k': 0.11185848186324751, 'slip_spread_k': 0.3127357348009564, 'spread_hl_frac': 0.031365251814833024, 'bb_std_mult': 0.8312489260366159, 'rsi_os': 37, 'rsi_ob': 74, 'vol_spike': 0.2627522645468464, 'adx_thresh': 28.78496925975692, 'atr_min_pct': 0.005665873615004004, 'atr_max_pct': 0.08774726477631369, 'tp_mult': 1.575483828446096, 'tsl_mult': 0.015444903722280356, 'strategy': 'breakout', 'time_stop': 214, 'use_sma': True, 'use_atr': True, 'use_adx': False, 'use_ema': True, 'use_spike': True, 'rsi_required': True, 'edge_k': 1.6953592664774182, 'edge_cap': 0.8374934767031991, 'bull_strategy': 'mean_reversion', 'bull_bb_std_mult': 0.9392332606302487, 'bull_rsi_os': 42, 'bull_rsi_ob': 80, 'bull_adx_thresh': 24.558684992902297, 'bull_atr_min_pct': 0.0017139642305871552, 'bull_atr_max_pct': 0.12727771618418532, 'bull_tp_mult': 1.587670527787435, 'bull_tsl_mult': 0.3681155068348638, 'bull_time_stop': 212, 'bull_use_sma': True, 'bull_use_ema': False, 'bull_use_atr': False, 'bull_use_adx': True, 'bull_use_spike': True, 'bull_rsi_required': True, 'bear_strategy': 'breakout', 'bear_bb_std_mult': 1.2277816620869866, 'bear_rsi_os': 38, 'bear_rsi_ob': 69, 'bear_adx_thresh': 23.44285031205486, 'bear_atr_min_pct': 0.002962516129364339, 'bear_atr_max_pct': 0.08361474978686645, 'bear_tp_mult': 1.4075747906157083, 'bear_tsl_mult': 0.5197859745879425, 'bear_time_stop': 41, 'bear_use_sma': False, 'bear_use_ema': True, 'bear_use_atr': False, 'bear_use_adx': False, 'bear_use_spike': False, 'bear_rsi_required': False, 'sideways_strategy': 'mean_reversion', 'sideways_bb_std_mult': 2.850195657644192, 'sideways_rsi_os': 16, 'sideways_rsi_ob': 88, 'sideways_adx_thresh': 30.141944494329245, 'sideways_atr_min_pct': 0.0024603755274400767, 'sideways_atr_max_pct': 0.07557478499408253, 'sideways_tp_mult': 1.2475103372648102, 'sideways_tsl_mult': 0.9453509426553142, 'sideways_time_stop': 18, 'sideways_use_sma': False, 'sideways_use_ema': False, 'sideways_use_atr': True, 'sideways_use_adx': True, 'sideways_use_spike': True, 'sideways_rsi_required': False}.
[I 2025-08-31 10:22:06,803] Trial 214 finished with values: [-1000000000.0, 1000000000.0] and parameters: {'p_sma': 15, 'p_std': 40, 'p_atr': 30, 'p_adx': 18, 'rsi_period': 46, 'ema1': 22, 'ema2': 17, 'slip_atr_k': 0.12996754942267882, 'slip_spread_k': 0.6315298399031115, 'spread_hl_frac': 0.014504767721783812, 'bb_std_mult': 0.6020127319240228, 'rsi_os': 32, 'rsi_ob': 73, 'vol_spike': 0.05468028182362074, 'adx_thresh': 16.234681221124706, 'atr_min_pct': 0.004824293482462289, 'atr_max_pct': 0.025400289449898326, 'tp_mult': 1.7890186289460568, 'tsl_mult': 0.48033398067436034, 'strategy': 'breakout', 'time_stop': 227, 'use_sma': True, 'use_atr': True, 'use_adx': False, 'use_ema': True, 'use_spike': True, 'rsi_required': False, 'edge_k': 1.340276272177432, 'edge_cap': 0.17681434910573096, 'bull_strategy': 'breakout', 'bull_bb_std_mult': 0.8134120785118589, 'bull_rsi_os': 12, 'bull_rsi_ob': 78, 'bull_adx_thresh': 19.742918709432985, 'bull_atr_min_pct': 0.002149206961985629, 'bull_atr_max_pct': 0.13966281306839246, 'bull_tp_mult': 1.9302199356334748, 'bull_tsl_mult': 0.4818633378945753, 'bull_time_stop': 66, 'bull_use_sma': True, 'bull_use_ema': True, 'bull_use_atr': True, 'bull_use_adx': False, 'bull_use_spike': False, 'bull_rsi_required': True, 'bear_strategy': 'breakout', 'bear_bb_std_mult': 1.310581931040121, 'bear_rsi_os': 40, 'bear_rsi_ob': 93, 'bear_adx_thresh': 15.478107961159077, 'bear_atr_min_pct': 0.004917457280249771, 'bear_atr_max_pct': 0.08891737956938525, 'bear_tp_mult': 1.0739155927319457, 'bear_tsl_mult': 0.5378722426254432, 'bear_time_stop': 53, 'bear_use_sma': False, 'bear_use_ema': True, 'bear_use_atr': False, 'bear_use_adx': False, 'bear_use_spike': True, 'bear_rsi_required': False, 'sideways_strategy': 'breakout', 'sideways_bb_std_mult': 2.7541611189135304, 'sideways_rsi_os': 21, 'sideways_rsi_ob': 82, 'sideways_adx_thresh': 11.336419981637334, 'sideways_atr_min_pct': 0.006545250965080757, 'sideways_atr_max_pct': 0.1381922586115014, 'sideways_tp_mult': 1.8580445354728616, 'sideways_tsl_mult': 0.11080035405690386, 'sideways_time_stop': 181, 'sideways_use_sma': False, 'sideways_use_ema': False, 'sideways_use_atr': False, 'sideways_use_adx': False, 'sideways_use_spike': True, 'sideways_rsi_required': True}.
[I 2025-08-31 10:22:07,051] Trial 212 finished with values: [-1000000000.0, 1000000000.0] and parameters: {'p_sma': 7, 'p_std': 29, 'p_atr': 14, 'p_adx': 18, 'rsi_period': 45, 'ema1': 9, 'ema2': 56, 'slip_atr_k': 0.12582509796115304, 'slip_spread_k': 0.6533981546215691, 'spread_hl_frac': 0.044821520441530836, 'bb_std_mult': 0.5942664148959045, 'rsi_os': 37, 'rsi_ob': 72, 'vol_spike': 0.25748876071791416, 'adx_thresh': 8.816510620565035, 'atr_min_pct': 0.02606631822277386, 'atr_max_pct': 0.08758004993053627, 'tp_mult': 2.4621114926070535, 'tsl_mult': 0.013893062393488531, 'strategy': 'breakout', 'time_stop': 210, 'use_sma': True, 'use_atr': True, 'use_adx': False, 'use_ema': True, 'use_spike': True, 'rsi_required': False, 'edge_k': 0.08347096407378173, 'edge_cap': 0.8349946212392227, 'bull_strategy': 'mean_reversion', 'bull_bb_std_mult': 0.6487749907389471, 'bull_rsi_os': 41, 'bull_rsi_ob': 65, 'bull_adx_thresh': 7.693620080842724, 'bull_atr_min_pct': 0.0036065313455178544, 'bull_atr_max_pct': 0.13956377532840067, 'bull_tp_mult': 1.8449766355330757, 'bull_tsl_mult': 0.4761827430285548, 'bull_time_stop': 82, 'bull_use_sma': True, 'bull_use_ema': True, 'bull_use_atr': True, 'bull_use_adx': False, 'bull_use_spike': False, 'bull_rsi_required': True, 'bear_strategy': 'breakout', 'bear_bb_std_mult': 1.3164032935673418, 'bear_rsi_os': 34, 'bear_rsi_ob': 60, 'bear_adx_thresh': 13.427561933701746, 'bear_atr_min_pct': 0.02366945888703309, 'bear_atr_max_pct': 0.077700725166558, 'bear_tp_mult': 1.3762493428587566, 'bear_tsl_mult': 0.5137132122733402, 'bear_time_stop': 282, 'bear_use_sma': False, 'bear_use_ema': True, 'bear_use_atr': False, 'bear_use_adx': False, 'bear_use_spike': True, 'bear_rsi_required': False, 'sideways_strategy': 'breakout', 'sideways_bb_std_mult': 2.887641089837468, 'sideways_rsi_os': 16, 'sideways_rsi_ob': 82, 'sideways_adx_thresh': 9.065650584757108, 'sideways_atr_min_pct': 0.005603035792256151, 'sideways_atr_max_pct': 0.040246135742547685, 'sideways_tp_mult': 1.2395072541802024, 'sideways_tsl_mult': 0.06274242904792926, 'sideways_time_stop': 17, 'sideways_use_sma': False, 'sideways_use_ema': False, 'sideways_use_atr': False, 'sideways_use_adx': True, 'sideways_use_spike': True, 'sideways_rsi_required': False}.
[I 2025-08-31 10:22:07,188] Trial 211 finished with values: [-1000000000.0, 1000000000.0] and parameters: {'p_sma': 10, 'p_std': 32, 'p_atr': 30, 'p_adx': 18, 'rsi_period': 44, 'ema1': 15, 'ema2': 56, 'slip_atr_k': 0.030427383325860403, 'slip_spread_k': 0.02035630910952929, 'spread_hl_frac': 0.014259915651976655, 'bb_std_mult': 0.6010202675160624, 'rsi_os': 8, 'rsi_ob': 73, 'vol_spike': 0.2554866093493049, 'adx_thresh': 30.687386978464446, 'atr_min_pct': 0.016923035673379407, 'atr_max_pct': 0.06949249746576847, 'tp_mult': 1.7916374709047886, 'tsl_mult': 0.023974770706156223, 'strategy': 'breakout', 'time_stop': 210, 'use_sma': True, 'use_atr': True, 'use_adx': False, 'use_ema': True, 'use_spike': True, 'rsi_required': True, 'edge_k': 1.3299894099114133, 'edge_cap': 0.831504259926893, 'bull_strategy': 'breakout', 'bull_bb_std_mult': 0.6935314432870506, 'bull_rsi_os': 12, 'bull_rsi_ob': 65, 'bull_adx_thresh': 7.613349456216717, 'bull_atr_min_pct': 0.0037156610251523475, 'bull_atr_max_pct': 0.14053679275192016, 'bull_tp_mult': 1.5465546892307904, 'bull_tsl_mult': 0.4791162598604505, 'bull_time_stop': 65, 'bull_use_sma': True, 'bull_use_ema': False, 'bull_use_atr': False, 'bull_use_adx': True, 'bull_use_spike': True, 'bull_rsi_required': True, 'bear_strategy': 'breakout', 'bear_bb_std_mult': 1.2137320895275703, 'bear_rsi_os': 35, 'bear_rsi_ob': 71, 'bear_adx_thresh': 5.639384331821329, 'bear_atr_min_pct': 0.0048424124667415785, 'bear_atr_max_pct': 0.08882071153324042, 'bear_tp_mult': 2.9124927951563264, 'bear_tsl_mult': 0.46803398789712625, 'bear_time_stop': 40, 'bear_use_sma': False, 'bear_use_ema': True, 'bear_use_atr': False, 'bear_use_adx': False, 'bear_use_spike': False, 'bear_rsi_required': False, 'sideways_strategy': 'mean_reversion', 'sideways_bb_std_mult': 2.8807839890947005, 'sideways_rsi_os': 16, 'sideways_rsi_ob': 89, 'sideways_adx_thresh': 25.19031197243954, 'sideways_atr_min_pct': 0.02540607318029673, 'sideways_atr_max_pct': 0.05346481944114348, 'sideways_tp_mult': 2.005732079520834, 'sideways_tsl_mult': 0.15863830611118585, 'sideways_time_stop': 42, 'sideways_use_sma': False, 'sideways_use_ema': False, 'sideways_use_atr': True, 'sideways_use_adx': True, 'sideways_use_spike': True, 'sideways_rsi_required': True}.
[I 2025-08-31 10:22:07,361] Trial 213 finished with values: [-1000000000.0, 1000000000.0] and parameters: {'p_sma': 8, 'p_std': 32, 'p_atr': 14, 'p_adx': 17, 'rsi_period': 9, 'ema1': 22, 'ema2': 56, 'slip_atr_k': 0.1312995612761365, 'slip_spread_k': 0.6203998402295773, 'spread_hl_frac': 0.014627570302985593, 'bb_std_mult': 0.8032386595813202, 'rsi_os': 26, 'rsi_ob': 88, 'vol_spike': 0.05688033820563447, 'adx_thresh': 24.693155050481014, 'atr_min_pct': 0.00578495545523749, 'atr_max_pct': 0.03242593502259371, 'tp_mult': 2.3354548728068307, 'tsl_mult': 0.47274860706264166, 'strategy': 'breakout', 'time_stop': 104, 'use_sma': True, 'use_atr': True, 'use_adx': False, 'use_ema': True, 'use_spike': True, 'rsi_required': False, 'edge_k': 1.9990931869992137, 'edge_cap': 0.8154503528178273, 'bull_strategy': 'mean_reversion', 'bull_bb_std_mult': 0.7941878885792232, 'bull_rsi_os': 41, 'bull_rsi_ob': 48, 'bull_adx_thresh': 5.056305670841045, 'bull_atr_min_pct': 0.005578764563355248, 'bull_atr_max_pct': 0.14075341492104768, 'bull_tp_mult': 1.8548221446273458, 'bull_tsl_mult': 0.38540198368053435, 'bull_time_stop': 66, 'bull_use_sma': True, 'bull_use_ema': True, 'bull_use_atr': True, 'bull_use_adx': False, 'bull_use_spike': False, 'bull_rsi_required': True, 'bear_strategy': 'breakout', 'bear_bb_std_mult': 1.2997437603672477, 'bear_rsi_os': 8, 'bear_rsi_ob': 71, 'bear_adx_thresh': 18.337315065279398, 'bear_atr_min_pct': 0.00519478677338427, 'bear_atr_max_pct': 0.0896985214789578, 'bear_tp_mult': 2.918266002298711, 'bear_tsl_mult': 0.5381408356162635, 'bear_time_stop': 282, 'bear_use_sma': False, 'bear_use_ema': True, 'bear_use_atr': False, 'bear_use_adx': False, 'bear_use_spike': True, 'bear_rsi_required': False, 'sideways_strategy': 'breakout', 'sideways_bb_std_mult': 2.8841313825809145, 'sideways_rsi_os': 16, 'sideways_rsi_ob': 82, 'sideways_adx_thresh': 23.851645037656397, 'sideways_atr_min_pct': 0.005595441252224698, 'sideways_atr_max_pct': 0.042396370373626695, 'sideways_tp_mult': 2.0080867884817346, 'sideways_tsl_mult': 0.9454150119700708, 'sideways_time_stop': 18, 'sideways_use_sma': False, 'sideways_use_ema': False, 'sideways_use_atr': False, 'sideways_use_adx': False, 'sideways_use_spike': True, 'sideways_rsi_required': True}.
[I 2025-08-31 10:22:39,224] Trial 218 finished with values: [-1000000000.0, 1000000000.0] and parameters: {'p_sma': 12, 'p_std': 60, 'p_atr': 20, 'p_adx': 16, 'rsi_period': 49, 'ema1': 16, 'ema2': 54, 'slip_atr_k': 0.020843368676854067, 'slip_spread_k': 0.6193463997507652, 'spread_hl_frac': 0.011185308819314605, 'bb_std_mult': 3.5823150244899464, 'rsi_os': 21, 'rsi_ob': 75, 'vol_spike': 0.27617460774557284, 'adx_thresh': 30.094865950991203, 'atr_min_pct': 0.005238239588484531, 'atr_max_pct': 0.07865943863375546, 'tp_mult': 1.4955092976381898, 'tsl_mult': 0.24276413576507838, 'strategy': 'breakout', 'time_stop': 234, 'use_sma': True, 'use_atr': True, 'use_adx': False, 'use_ema': False, 'use_spike': True, 'rsi_required': False, 'edge_k': 0.26683815694508983, 'edge_cap': 0.5324842869310729, 'bull_strategy': 'breakout', 'bull_bb_std_mult': 0.992429395047211, 'bull_rsi_os': 39, 'bull_rsi_ob': 74, 'bull_adx_thresh': 24.679146865639446, 'bull_atr_min_pct': 0.025247424878474915, 'bull_atr_max_pct': 0.14445946576813035, 'bull_tp_mult': 1.7904160685550825, 'bull_tsl_mult': 0.39947811102415137, 'bull_time_stop': 78, 'bull_use_sma': True, 'bull_use_ema': True, 'bull_use_atr': True, 'bull_use_adx': False, 'bull_use_spike': True, 'bull_rsi_required': False, 'bear_strategy': 'breakout', 'bear_bb_std_mult': 1.1006836218565643, 'bear_rsi_os': 40, 'bear_rsi_ob': 67, 'bear_adx_thresh': 7.9462316939366655, 'bear_atr_min_pct': 0.0170662210837897, 'bear_atr_max_pct': 0.09767087928086379, 'bear_tp_mult': 2.5560581113318688, 'bear_tsl_mult': 0.3300636982465175, 'bear_time_stop': 50, 'bear_use_sma': False, 'bear_use_ema': True, 'bear_use_atr': False, 'bear_use_adx': True, 'bear_use_spike': True, 'bear_rsi_required': False, 'sideways_strategy': 'breakout', 'sideways_bb_std_mult': 2.7593850259441255, 'sideways_rsi_os': 5, 'sideways_rsi_ob': 78, 'sideways_adx_thresh': 24.395806964900565, 'sideways_atr_min_pct': 0.004987815743916813, 'sideways_atr_max_pct': 0.028824152931627253, 'sideways_tp_mult': 1.407297752313511, 'sideways_tsl_mult': 0.09883726956343478, 'sideways_time_stop': 33, 'sideways_use_sma': False, 'sideways_use_ema': False, 'sideways_use_atr': False, 'sideways_use_adx': True, 'sideways_use_spike': False, 'sideways_rsi_required': True}.
