[I 2025-08-31 10:49:02,916] Trial 423 finished with values: [-1000000000.0, 1000000000.0] and parameters: {'p_sma': 46, 'p_std': 56, 'p_atr': 20, 'p_adx': 15, 'rsi_period': 47, 'ema1': 13, 'ema2': 39, 'slip_atr_k': 0.016189648532708947, 'slip_spread_k': 0.1565469105422791, 'spread_hl_frac': 0.009695735417984535, 'bb_std_mult': 2.8465792842486977, 'rsi_os': 10, 'rsi_ob': 57, 'vol_spike': 0.17075358192189605, 'adx_thresh': 6.7965871574664956, 'atr_min_pct': 0.006390126028297047, 'atr_max_pct': 0.07542869103829791, 'tp_mult': 2.6242779974102177, 'tsl_mult': 0.2609475104355702, 'strategy': 'breakout', 'time_stop': 79, 'use_sma': False, 'use_atr': False, 'use_adx': True, 'use_ema': True, 'use_spike': True, 'rsi_required': True, 'edge_k': 0.22831368463399335, 'edge_cap': 0.49057999455533097, 'bull_strategy': 'breakout', 'bull_bb_std_mult': 1.7495606335227438, 'bull_rsi_os': 7, 'bull_rsi_ob': 76, 'bull_adx_thresh': 8.950317380784247, 'bull_atr_min_pct': 0.029920664459588013, 'bull_atr_max_pct': 0.011339635542465185, 'bull_tp_mult': 1.7950549384277608, 'bull_tsl_mult': 0.3890235722141466, 'bull_time_stop': 232, 'bull_use_sma': True, 'bull_use_ema': False, 'bull_use_atr': False, 'bull_use_adx': True, 'bull_use_spike': False, 'bull_rsi_required': True, 'bear_strategy': 'breakout', 'bear_bb_std_mult': 0.7171791668123215, 'bear_rsi_os': 39, 'bear_rsi_ob': 50, 'bear_adx_thresh': 7.266011237181071, 'bear_atr_min_pct': 0.016176046315811144, 'bear_atr_max_pct': 0.13823758206118264, 'bear_tp_mult': 2.8482390890683584, 'bear_tsl_mult': 0.4670856127913658, 'bear_time_stop': 30, 'bear_use_sma': False, 'bear_use_ema': True, 'bear_use_atr': False, 'bear_use_adx': False, 'bear_use_spike': True, 'bear_rsi_required': False, 'sideways_strategy': 'mean_reversion', 'sideways_bb_std_mult': 2.1739589658256455, 'sideways_rsi_os': 7, 'sideways_rsi_ob': 57, 'sideways_adx_thresh': 27.238012765769046, 'sideways_atr_min_pct': 0.02576720582592838, 'sideways_atr_max_pct': 0.048691223416695226, 'sideways_tp_mult': 1.559913338998355, 'sideways_tsl_mult': 0.3426597261734132, 'sideways_time_stop': 13, 'sideways_use_sma': False, 'sideways_use_ema': False, 'sideways_use_atr': False, 'sideways_use_adx': False, 'sideways_use_spike': False, 'sideways_rsi_required': True}.
[I 2025-08-31 10:49:03,442] Trial 421 finished with values: [-1000000000.0, 1000000000.0] and parameters: {'p_sma': 30, 'p_std': 30, 'p_atr': 20, 'p_adx': 25, 'rsi_period': 52, 'ema1': 13, 'ema2': 39, 'slip_atr_k': 0.005649088432342644, 'slip_spread_k': 0.027115736807912794, 'spread_hl_frac': 0.009997812516043628, 'bb_std_mult': 3.5974848548130685, 'rsi_os': 53, 'rsi_ob': 57, 'vol_spike': 0.25245193975896896, 'adx_thresh': 20.9341695551755, 'atr_min_pct': 0.006467291758008067, 'atr_max_pct': 0.07177840818790027, 'tp_mult': 2.3775924718586596, 'tsl_mult': 0.3853802342101849, 'strategy': 'breakout', 'time_stop': 76, 'use_sma': False, 'use_atr': False, 'use_adx': True, 'use_ema': True, 'use_spike': True, 'rsi_required': True, 'edge_k': 0.2925822665215087, 'edge_cap': 0.4913108316062345, 'bull_strategy': 'mean_reversion', 'bull_bb_std_mult': 1.981803993881463, 'bull_rsi_os': 18, 'bull_rsi_ob': 50, 'bull_adx_thresh': 7.653686464958709, 'bull_atr_min_pct': 0.011079977003101548, 'bull_atr_max_pct': 0.10100946917934336, 'bull_tp_mult': 2.1831209365086117, 'bull_tsl_mult': 0.41681642684405523, 'bull_time_stop': 189, 'bull_use_sma': True, 'bull_use_ema': False, 'bull_use_atr': False, 'bull_use_adx': True, 'bull_use_spike': False, 'bull_rsi_required': False, 'bear_strategy': 'breakout', 'bear_bb_std_mult': 0.7408430638839558, 'bear_rsi_os': 38, 'bear_rsi_ob': 78, 'bear_adx_thresh': 7.91754490468264, 'bear_atr_min_pct': 0.005437435083970248, 'bear_atr_max_pct': 0.05216870976899417, 'bear_tp_mult': 2.906503660785036, 'bear_tsl_mult': 0.4377960988996453, 'bear_time_stop': 33, 'bear_use_sma': False, 'bear_use_ema': True, 'bear_use_atr': False, 'bear_use_adx': False, 'bear_use_spike': True, 'bear_rsi_required': False, 'sideways_strategy': 'mean_reversion', 'sideways_bb_std_mult': 2.754792535336186, 'sideways_rsi_os': 5, 'sideways_rsi_ob': 90, 'sideways_adx_thresh': 26.467036397986213, 'sideways_atr_min_pct': 0.015226881492647788, 'sideways_atr_max_pct': 0.08228372635296768, 'sideways_tp_mult': 1.948968005249054, 'sideways_tsl_mult': 0.8479170708437294, 'sideways_time_stop': 14, 'sideways_use_sma': False, 'sideways_use_ema': True, 'sideways_use_atr': False, 'sideways_use_adx': False, 'sideways_use_spike': False, 'sideways_rsi_required': True}.
[I 2025-08-31 10:49:03,784] Trial 425 finished with values: [-1000000000.0, 1000000000.0] and parameters: {'p_sma': 46, 'p_std': 30, 'p_atr': 10, 'p_adx': 15, 'rsi_period': 66, 'ema1': 12, 'ema2': 47, 'slip_atr_k': 0.018210674222506364, 'slip_spread_k': 0.029526033745988944, 'spread_hl_frac': 0.048275482335528815, 'bb_std_mult': 2.7534421780169684, 'rsi_os': 28, 'rsi_ob': 68, 'vol_spike': 0.15846520545494674, 'adx_thresh': 21.212682006606993, 'atr_min_pct': 0.006550506688661479, 'atr_max_pct': 0.05951828817070377, 'tp_mult': 2.24633801551369, 'tsl_mult': 0.9607414684930884, 'strategy': 'breakout', 'time_stop': 288, 'use_sma': False, 'use_atr': False, 'use_adx': True, 'use_ema': True, 'use_spike': True, 'rsi_required': True, 'edge_k': 0.24588652069484312, 'edge_cap': 0.20869502030710613, 'bull_strategy': 'breakout', 'bull_bb_std_mult': 0.7425728040851103, 'bull_rsi_os': 18, 'bull_rsi_ob': 78, 'bull_adx_thresh': 8.313442992535384, 'bull_atr_min_pct': 0.02534962151236404, 'bull_atr_max_pct': 0.056425519850053285, 'bull_tp_mult': 1.8445303533555342, 'bull_tsl_mult': 0.42698547182304836, 'bull_time_stop': 140, 'bull_use_sma': True, 'bull_use_ema': False, 'bull_use_atr': False, 'bull_use_adx': True, 'bull_use_spike': False, 'bull_rsi_required': True, 'bear_strategy': 'breakout', 'bear_bb_std_mult': 0.7593866568676695, 'bear_rsi_os': 17, 'bear_rsi_ob': 84, 'bear_adx_thresh': 8.027433617886405, 'bear_atr_min_pct': 0.005137245693956061, 'bear_atr_max_pct': 0.061365068510316534, 'bear_tp_mult': 1.7231738264600722, 'bear_tsl_mult': 0.7207167369876161, 'bear_time_stop': 5, 'bear_use_sma': False, 'bear_use_ema': True, 'bear_use_atr': False, 'bear_use_adx': False, 'bear_use_spike': True, 'bear_rsi_required': False, 'sideways_strategy': 'mean_reversion', 'sideways_bb_std_mult': 2.733737879558856, 'sideways_rsi_os': 7, 'sideways_rsi_ob': 94, 'sideways_adx_thresh': 27.000190131247688, 'sideways_atr_min_pct': 0.018184301266790458, 'sideways_atr_max_pct': 0.04260498660894649, 'sideways_tp_mult': 1.887164416380621, 'sideways_tsl_mult': 0.6057201113376763, 'sideways_time_stop': 165, 'sideways_use_sma': False, 'sideways_use_ema': False, 'sideways_use_atr': False, 'sideways_use_adx': False, 'sideways_use_spike': False, 'sideways_rsi_required': True}.
[I 2025-08-31 10:49:04,600] Trial 427 finished with values: [-1000000000.0, 1000000000.0] and parameters: {'p_sma': 14, 'p_std': 20, 'p_atr': 10, 'p_adx': 13, 'rsi_period': 48, 'ema1': 15, 'ema2': 56, 'slip_atr_k': 0.008911103065429854, 'slip_spread_k': 0.020664174016053027, 'spread_hl_frac': 0.03890587866151225, 'bb_std_mult': 2.7370318259606807, 'rsi_os': 37, 'rsi_ob': 51, 'vol_spike': 0.24554136183395653, 'adx_thresh': 24.77131729163621, 'atr_min_pct': 0.02611831134579177, 'atr_max_pct': 0.021622023534946327, 'tp_mult': 2.511509320474476, 'tsl_mult': 0.31451377896674715, 'strategy': 'mean_reversion', 'time_stop': 61, 'use_sma': True, 'use_atr': False, 'use_adx': True, 'use_ema': True, 'use_spike': True, 'rsi_required': True, 'edge_k': 0.18412615153759282, 'edge_cap': 0.4560970897012371, 'bull_strategy': 'breakout', 'bull_bb_std_mult': 2.3525693287922875, 'bull_rsi_os': 9, 'bull_rsi_ob': 78, 'bull_adx_thresh': 18.278076669410556, 'bull_atr_min_pct': 0.02585534068387914, 'bull_atr_max_pct': 0.09665786853132817, 'bull_tp_mult': 2.393576697526563, 'bull_tsl_mult': 0.37164564314434534, 'bull_time_stop': 81, 'bull_use_sma': False, 'bull_use_ema': False, 'bull_use_atr': False, 'bull_use_adx': False, 'bull_use_spike': False, 'bull_rsi_required': True, 'bear_strategy': 'breakout', 'bear_bb_std_mult': 3.346840082832925, 'bear_rsi_os': 17, 'bear_rsi_ob': 82, 'bear_adx_thresh': 7.99461492795305, 'bear_atr_min_pct': 0.004944657712807785, 'bear_atr_max_pct': 0.09988595370340585, 'bear_tp_mult': 2.8613884893807886, 'bear_tsl_mult': 0.9019741842015985, 'bear_time_stop': 34, 'bear_use_sma': False, 'bear_use_ema': True, 'bear_use_atr': False, 'bear_use_adx': False, 'bear_use_spike': False, 'bear_rsi_required': False, 'sideways_strategy': 'mean_reversion', 'sideways_bb_std_mult': 2.7367969037269733, 'sideways_rsi_os': 27, 'sideways_rsi_ob': 94, 'sideways_adx_thresh': 25.48209258475363, 'sideways_atr_min_pct': 0.017990204463053203, 'sideways_atr_max_pct': 0.07704786756184326, 'sideways_tp_mult': 1.891696459596427, 'sideways_tsl_mult': 0.11767738911928459, 'sideways_time_stop': 165, 'sideways_use_sma': True, 'sideways_use_ema': False, 'sideways_use_atr': True, 'sideways_use_adx': False, 'sideways_use_spike': False, 'sideways_rsi_required': True}.
[I 2025-08-31 10:49:34,865] Trial 428 finished with values: [-1000000000.0, 1000000000.0] and parameters: {'p_sma': 14, 'p_std': 19, 'p_atr': 12, 'p_adx': 13, 'rsi_period': 48, 'ema1': 24, 'ema2': 56, 'slip_atr_k': 0.14541817527564507, 'slip_spread_k': 0.6849918659822285, 'spread_hl_frac': 0.011091053325698748, 'bb_std_mult': 2.7472677885793138, 'rsi_os': 28, 'rsi_ob': 75, 'vol_spike': 0.11828697402813365, 'adx_thresh': 27.991698476815003, 'atr_min_pct': 0.01942540028397919, 'atr_max_pct': 0.019732854198005086, 'tp_mult': 1.4860869638674972, 'tsl_mult': 0.1974333023244268, 'strategy': 'mean_reversion', 'time_stop': 67, 'use_sma': True, 'use_atr': False, 'use_adx': True, 'use_ema': True, 'use_spike': True, 'rsi_required': True, 'edge_k': 0.13855269937725362, 'edge_cap': 0.45366576020771743, 'bull_strategy': 'breakout', 'bull_bb_std_mult': 0.736066905207854, 'bull_rsi_os': 9, 'bull_rsi_ob': 59, 'bull_adx_thresh': 6.288608693630752, 'bull_atr_min_pct': 0.007644052742142433, 'bull_atr_max_pct': 0.05616785406841613, 'bull_tp_mult': 2.0952218282518347, 'bull_tsl_mult': 0.742664290821171, 'bull_time_stop': 81, 'bull_use_sma': False, 'bull_use_ema': False, 'bull_use_atr': False, 'bull_use_adx': False, 'bull_use_spike': False, 'bull_rsi_required': True, 'bear_strategy': 'breakout', 'bear_bb_std_mult': 2.394501940206352, 'bear_rsi_os': 42, 'bear_rsi_ob': 84, 'bear_adx_thresh': 5.350453641237197, 'bear_atr_min_pct': 0.004784535310822973, 'bear_atr_max_pct': 0.14125634714704824, 'bear_tp_mult': 2.5327340836552406, 'bear_tsl_mult': 0.13924428294517338, 'bear_time_stop': 152, 'bear_use_sma': False, 'bear_use_ema': True, 'bear_use_atr': False, 'bear_use_adx': False, 'bear_use_spike': False, 'bear_rsi_required': False, 'sideways_strategy': 'mean_reversion', 'sideways_bb_std_mult': 2.7075147108850994, 'sideways_rsi_os': 6, 'sideways_rsi_ob': 93, 'sideways_adx_thresh': 25.135076396487534, 'sideways_atr_min_pct': 0.018131738464856943, 'sideways_atr_max_pct': 0.022052027393759117, 'sideways_tp_mult': 1.8922866808320482, 'sideways_tsl_mult': 0.24108676286734504, 'sideways_time_stop': 86, 'sideways_use_sma': True, 'sideways_use_ema': False, 'sideways_use_atr': True, 'sideways_use_adx': False, 'sideways_use_spike': False, 'sideways_rsi_required': True}.
[I 2025-08-31 10:49:34,865] Trial 426 finished with values: [-1000000000.0, 1000000000.0] and parameters: {'p_sma': 39, 'p_std': 19, 'p_atr': 12, 'p_adx': 13, 'rsi_period': 48, 'ema1': 12, 'ema2': 56, 'slip_atr_k': 0.015100832848899147, 'slip_spread_k': 0.02488722496058171, 'spread_hl_frac': 0.011523074837971162, 'bb_std_mult': 2.7546127536186265, 'rsi_os': 25, 'rsi_ob': 75, 'vol_spike': 0.11903086799313822, 'adx_thresh': 13.560057704033625, 'atr_min_pct': 0.019698837551963333, 'atr_max_pct': 0.10525367120258161, 'tp_mult': 2.5178240678241743, 'tsl_mult': 0.19720761385801958, 'strategy': 'breakout', 'time_stop': 81, 'use_sma': True, 'use_atr': False, 'use_adx': True, 'use_ema': True, 'use_spike': True, 'rsi_required': True, 'edge_k': 0.1365872733228321, 'edge_cap': 0.4947613806459935, 'bull_strategy': 'breakout', 'bull_bb_std_mult': 2.9566895478230535, 'bull_rsi_os': 7, 'bull_rsi_ob': 64, 'bull_adx_thresh': 8.869583921557329, 'bull_atr_min_pct': 0.007116118047756137, 'bull_atr_max_pct': 0.055735996040675584, 'bull_tp_mult': 2.178946384201363, 'bull_tsl_mult': 0.3816226549636261, 'bull_time_stop': 229, 'bull_use_sma': True, 'bull_use_ema': False, 'bull_use_atr': False, 'bull_use_adx': False, 'bull_use_spike': False, 'bull_rsi_required': True, 'bear_strategy': 'breakout', 'bear_bb_std_mult': 0.747238413320775, 'bear_rsi_os': 17, 'bear_rsi_ob': 82, 'bear_adx_thresh': 5.045217700886489, 'bear_atr_min_pct': 0.01867814879934823, 'bear_atr_max_pct': 0.09936501693946842, 'bear_tp_mult': 1.0519946797991988, 'bear_tsl_mult': 0.21565065347196577, 'bear_time_stop': 32, 'bear_use_sma': False, 'bear_use_ema': True, 'bear_use_atr': False, 'bear_use_adx': False, 'bear_use_spike': True, 'bear_rsi_required': False, 'sideways_strategy': 'mean_reversion', 'sideways_bb_std_mult': 2.7485209999693847, 'sideways_rsi_os': 6, 'sideways_rsi_ob': 93, 'sideways_adx_thresh': 27.09867290864372, 'sideways_atr_min_pct': 0.018240903611371123, 'sideways_atr_max_pct': 0.1379044747014907, 'sideways_tp_mult': 2.8649324793287407, 'sideways_tsl_mult': 0.9050172201344827, 'sideways_time_stop': 90, 'sideways_use_sma': False, 'sideways_use_ema': False, 'sideways_use_atr': False, 'sideways_use_adx': False, 'sideways_use_spike': False, 'sideways_rsi_required': True}.
[I 2025-08-31 10:49:35,709] Trial 429 finished with values: [-1000000000.0, 1000000000.0] and parameters: {'p_sma': 14, 'p_std': 58, 'p_atr': 12, 'p_adx': 22, 'rsi_period': 48, 'ema1': 14, 'ema2': 56, 'slip_atr_k': 0.10810370745277198, 'slip_spread_k': 0.6964730220600879, 'spread_hl_frac': 0.0107061879812619, 'bb_std_mult': 2.7107394807287233, 'rsi_os': 25, 'rsi_ob': 75, 'vol_spike': 0.2621610658438068, 'adx_thresh': 27.780380081251817, 'atr_min_pct': 0.004088873469730693, 'atr_max_pct': 0.020116196481331616, 'tp_mult': 2.4597784582100046, 'tsl_mult': 0.19480085181770487, 'strategy': 'mean_reversion', 'time_stop': 64, 'use_sma': True, 'use_atr': False, 'use_adx': True, 'use_ema': True, 'use_spike': True, 'rsi_required': True, 'edge_k': 0.18917117248172935, 'edge_cap': 0.4545981381875378, 'bull_strategy': 'breakout', 'bull_bb_std_mult': 0.7285261681418344, 'bull_rsi_os': 35, 'bull_rsi_ob': 72, 'bull_adx_thresh': 6.246472025562249, 'bull_atr_min_pct': 0.007679323445698471, 'bull_atr_max_pct': 0.09590805229694166, 'bull_tp_mult': 2.081464363435719, 'bull_tsl_mult': 0.8309201333430574, 'bull_time_stop': 80, 'bull_use_sma': False, 'bull_use_ema': False, 'bull_use_atr': False, 'bull_use_adx': False, 'bull_use_spike': False, 'bull_rsi_required': True, 'bear_strategy': 'mean_reversion', 'bear_bb_std_mult': 1.5155437348290122, 'bear_rsi_os': 42, 'bear_rsi_ob': 82, 'bear_adx_thresh': 33.1406806505621, 'bear_atr_min_pct': 0.0068409882178290145, 'bear_atr_max_pct': 0.1410343876490682, 'bear_tp_mult': 1.8126594464386638, 'bear_tsl_mult': 0.533806102115661, 'bear_time_stop': 123, 'bear_use_sma': False, 'bear_use_ema': True, 'bear_use_atr': False, 'bear_use_adx': False, 'bear_use_spike': False, 'bear_rsi_required': False, 'sideways_strategy': 'mean_reversion', 'sideways_bb_std_mult': 1.1361746712996943, 'sideways_rsi_os': 6, 'sideways_rsi_ob': 93, 'sideways_adx_thresh': 18.222270980798548, 'sideways_atr_min_pct': 0.02789535846011674, 'sideways_atr_max_pct': 0.03856843150978324, 'sideways_tp_mult': 2.8379561547439778, 'sideways_tsl_mult': 0.7493116123394146, 'sideways_time_stop': 98, 'sideways_use_sma': True, 'sideways_use_ema': False, 'sideways_use_atr': True, 'sideways_use_adx': False, 'sideways_use_spike': False, 'sideways_rsi_required': True}.
[I 2025-08-31 10:49:36,095] Trial 430 finished with values: [-1000000000.0, 1000000000.0] and parameters: {'p_sma': 40, 'p_std': 48, 'p_atr': 12, 'p_adx': 28, 'rsi_period': 46, 'ema1': 28, 'ema2': 19, 'slip_atr_k': 0.17597969452451667, 'slip_spread_k': 0.6935941411951856, 'spread_hl_frac': 0.011670018603449739, 'bb_std_mult': 2.583554881669147, 'rsi_os': 47, 'rsi_ob': 75, 'vol_spike': 0.26361987898443834, 'adx_thresh': 28.00674353366176, 'atr_min_pct': 5.010311316489685e-06, 'atr_max_pct': 0.0949553592397704, 'tp_mult': 2.452441962245318, 'tsl_mult': 0.1870209177819857, 'strategy': 'breakout', 'time_stop': 67, 'use_sma': True, 'use_atr': False, 'use_adx': True, 'use_ema': True, 'use_spike': True, 'rsi_required': True, 'edge_k': 0.15593616516670794, 'edge_cap': 0.4262571518444816, 'bull_strategy': 'breakout', 'bull_bb_std_mult': 2.6624153849774825, 'bull_rsi_os': 25, 'bull_rsi_ob': 72, 'bull_adx_thresh': 21.095743394339802, 'bull_atr_min_pct': 0.0076668137409188816, 'bull_atr_max_pct': 0.09520161765794136, 'bull_tp_mult': 1.098315167437617, 'bull_tsl_mult': 0.7319649273966051, 'bull_time_stop': 266, 'bull_use_sma': True, 'bull_use_ema': False, 'bull_use_atr': False, 'bull_use_adx': False, 'bull_use_spike': False, 'bull_rsi_required': True, 'bear_strategy': 'mean_reversion', 'bear_bb_std_mult': 1.9229465766043237, 'bear_rsi_os': 14, 'bear_rsi_ob': 90, 'bear_adx_thresh': 5.361678054356948, 'bear_atr_min_pct': 0.0067171973076099855, 'bear_atr_max_pct': 0.14264001531655188, 'bear_tp_mult': 2.686450640826554, 'bear_tsl_mult': 0.4876821123570514, 'bear_time_stop': 17, 'bear_use_sma': False, 'bear_use_ema': True, 'bear_use_atr': False, 'bear_use_adx': False, 'bear_use_spike': False, 'bear_rsi_required': False, 'sideways_strategy': 'mean_reversion', 'sideways_bb_std_mult': 2.6891458062840727, 'sideways_rsi_os': 6, 'sideways_rsi_ob': 45, 'sideways_adx_thresh': 25.07505950663165, 'sideways_atr_min_pct': 0.026892053299373032, 'sideways_atr_max_pct': 0.08700643825046095, 'sideways_tp_mult': 2.853337422174871, 'sideways_tsl_mult': 0.7450058727370769, 'sideways_time_stop': 145, 'sideways_use_sma': False, 'sideways_use_ema': False, 'sideways_use_atr': False, 'sideways_use_adx': False, 'sideways_use_spike': False, 'sideways_rsi_required': True}.
[I 2025-08-31 10:50:07,506] Trial 432 finished with values: [-1000000000.0, 1000000000.0] and parameters: {'p_sma': 51, 'p_std': 15, 'p_atr': 23, 'p_adx': 12, 'rsi_period': 68, 'ema1': 14, 'ema2': 41, 'slip_atr_k': 0.026750211522340972, 'slip_spread_k': 0.612485407725969, 'spread_hl_frac': 0.03703518092869696, 'bb_std_mult': 2.57334101220259, 'rsi_os': 26, 'rsi_ob': 81, 'vol_spike': 0.046366830432051934, 'adx_thresh': 28.146682854857062, 'atr_min_pct': 0.017477255553186206, 'atr_max_pct': 0.08951871942818164, 'tp_mult': 2.4442947333316485, 'tsl_mult': 0.23585982171100464, 'strategy': 'breakout', 'time_stop': 143, 'use_sma': True, 'use_atr': False, 'use_adx': True, 'use_ema': False, 'use_spike': False, 'rsi_required': True, 'edge_k': 0.7284524205790424, 'edge_cap': 0.4274170341280944, 'bull_strategy': 'breakout', 'bull_bb_std_mult': 2.6389080181282565, 'bull_rsi_os': 17, 'bull_rsi_ob': 75, 'bull_adx_thresh': 14.027527655805894, 'bull_atr_min_pct': 0.0060947708364518976, 'bull_atr_max_pct': 0.09529962501328124, 'bull_tp_mult': 2.5349901776594654, 'bull_tsl_mult': 0.39388469455520764, 'bull_time_stop': 74, 'bull_use_sma': True, 'bull_use_ema': False, 'bull_use_atr': False, 'bull_use_adx': False, 'bull_use_spike': False, 'bull_rsi_required': True, 'bear_strategy': 'mean_reversion', 'bear_bb_std_mult': 3.5459125169289862, 'bear_rsi_os': 12, 'bear_rsi_ob': 90, 'bear_adx_thresh': 6.20993592096035, 'bear_atr_min_pct': 0.006815887061590696, 'bear_atr_max_pct': 0.1465142275542255, 'bear_tp_mult': 2.8344872005614024, 'bear_tsl_mult': 0.30089937061147143, 'bear_time_stop': 245, 'bear_use_sma': True, 'bear_use_ema': False, 'bear_use_atr': True, 'bear_use_adx': True, 'bear_use_spike': True, 'bear_rsi_required': True, 'sideways_strategy': 'mean_reversion', 'sideways_bb_std_mult': 2.812233782811875, 'sideways_rsi_os': 8, 'sideways_rsi_ob': 62, 'sideways_adx_thresh': 14.655352901150271, 'sideways_atr_min_pct': 0.016504550088126502, 'sideways_atr_max_pct': 0.12489452220053235, 'sideways_tp_mult': 1.9858028210100624, 'sideways_tsl_mult': 0.7340667505960472, 'sideways_time_stop': 32, 'sideways_use_sma': False, 'sideways_use_ema': False, 'sideways_use_atr': False, 'sideways_use_adx': False, 'sideways_use_spike': False, 'sideways_rsi_required': False}.
