[I 2025-08-31 11:30:53,847] Trial 738 finished with values: [-1000000000.0, 1000000000.0] and parameters: {'p_sma': 55, 'p_std': 33, 'p_atr': 14, 'p_adx': 15, 'rsi_period': 52, 'ema1': 11, 'ema2': 45, 'slip_atr_k': 0.08363033905411428, 'slip_spread_k': 0.1863275048327526, 'spread_hl_frac': 0.007386789224073514, 'bb_std_mult': 1.8235719844495417, 'rsi_os': 32, 'rsi_ob': 92, 'vol_spike': 0.2726456344833424, 'adx_thresh': 33.2428425636015, 'atr_min_pct': 0.011529489280004149, 'atr_max_pct': 0.14471210202577184, 'tp_mult': 1.7136366387326631, 'tsl_mult': 0.09011007580203512, 'strategy': 'breakout', 'time_stop': 197, 'use_sma': False, 'use_atr': False, 'use_adx': True, 'use_ema': True, 'use_spike': True, 'rsi_required': False, 'edge_k': 0.4094983765648603, 'edge_cap': 0.4985755489635865, 'bull_strategy': 'mean_reversion', 'bull_bb_std_mult': 3.589528310401152, 'bull_rsi_os': 13, 'bull_rsi_ob': 85, 'bull_adx_thresh': 5.490857126599326, 'bull_atr_min_pct': 0.00407372400687476, 'bull_atr_max_pct': 0.10136619506950613, 'bull_tp_mult': 1.8431794868184623, 'bull_tsl_mult': 0.03038236393685073, 'bull_time_stop': 295, 'bull_use_sma': False, 'bull_use_ema': True, 'bull_use_atr': False, 'bull_use_adx': False, 'bull_use_spike': False, 'bull_rsi_required': True, 'bear_strategy': 'breakout', 'bear_bb_std_mult': 3.2870845286665538, 'bear_rsi_os': 52, 'bear_rsi_ob': 73, 'bear_adx_thresh': 31.934612292228465, 'bear_atr_min_pct': 0.004847794807035348, 'bear_atr_max_pct': 0.1400438142651377, 'bear_tp_mult': 1.7196002242975814, 'bear_tsl_mult': 0.8007891990156056, 'bear_time_stop': 27, 'bear_use_sma': True, 'bear_use_ema': False, 'bear_use_atr': False, 'bear_use_adx': False, 'bear_use_spike': False, 'bear_rsi_required': True, 'sideways_strategy': 'breakout', 'sideways_bb_std_mult': 1.3427080476103628, 'sideways_rsi_os': 24, 'sideways_rsi_ob': 93, 'sideways_adx_thresh': 10.65735984366925, 'sideways_atr_min_pct': 0.016300981077349376, 'sideways_atr_max_pct': 0.045705341084400435, 'sideways_tp_mult': 1.2100646589903055, 'sideways_tsl_mult': 0.36018733872050857, 'sideways_time_stop': 12, 'sideways_use_sma': False, 'sideways_use_ema': False, 'sideways_use_atr': True, 'sideways_use_adx': False, 'sideways_use_spike': True, 'sideways_rsi_required': True}.
[I 2025-08-31 11:30:53,847] Trial 737 finished with values: [-0.05980746025156769, 0.05947410937637189] and parameters: {'p_sma': 13, 'p_std': 42, 'p_atr': 14, 'p_adx': 15, 'rsi_period': 51, 'ema1': 11, 'ema2': 45, 'slip_atr_k': 0.17258303808316613, 'slip_spread_k': 0.18663627318367007, 'spread_hl_frac': 0.007663524943062331, 'bb_std_mult': 2.9457554525398435, 'rsi_os': 32, 'rsi_ob': 95, 'vol_spike': 0.2698430610508592, 'adx_thresh': 32.10820320565524, 'atr_min_pct': 0.011457714516664773, 'atr_max_pct': 0.140408647847303, 'tp_mult': 1.7214284645121931, 'tsl_mult': 0.08927427466103594, 'strategy': 'breakout', 'time_stop': 195, 'use_sma': False, 'use_atr': False, 'use_adx': True, 'use_ema': True, 'use_spike': True, 'rsi_required': False, 'edge_k': 0.41846325333512246, 'edge_cap': 0.49281159840127625, 'bull_strategy': 'mean_reversion', 'bull_bb_std_mult': 0.7275129333048097, 'bull_rsi_os': 13, 'bull_rsi_ob': 85, 'bull_adx_thresh': 5.6818912646840385, 'bull_atr_min_pct': 0.020325673185660333, 'bull_atr_max_pct': 0.10424053053880702, 'bull_tp_mult': 1.8447514039824269, 'bull_tsl_mult': 0.47196116842444125, 'bull_time_stop': 296, 'bull_use_sma': False, 'bull_use_ema': True, 'bull_use_atr': False, 'bull_use_adx': False, 'bull_use_spike': False, 'bull_rsi_required': True, 'bear_strategy': 'breakout', 'bear_bb_std_mult': 3.2592050292217833, 'bear_rsi_os': 49, 'bear_rsi_ob': 73, 'bear_adx_thresh': 10.121207513100133, 'bear_atr_min_pct': 0.002387702585463128, 'bear_atr_max_pct': 0.13659329136584794, 'bear_tp_mult': 1.4870378818699268, 'bear_tsl_mult': 0.8434225382376956, 'bear_time_stop': 27, 'bear_use_sma': True, 'bear_use_ema': False, 'bear_use_atr': False, 'bear_use_adx': False, 'bear_use_spike': False, 'bear_rsi_required': True, 'sideways_strategy': 'breakout', 'sideways_bb_std_mult': 2.770804370787246, 'sideways_rsi_os': 24, 'sideways_rsi_ob': 93, 'sideways_adx_thresh': 10.597793054109282, 'sideways_atr_min_pct': 0.016282450804665713, 'sideways_atr_max_pct': 0.0455041639656247, 'sideways_tp_mult': 2.414991853837163, 'sideways_tsl_mult': 0.35892815104864684, 'sideways_time_stop': 12, 'sideways_use_sma': False, 'sideways_use_ema': False, 'sideways_use_atr': True, 'sideways_use_adx': False, 'sideways_use_spike': True, 'sideways_rsi_required': True}.
[I 2025-08-31 11:31:29,610] Trial 741 finished with values: [-1000000000.0, 1000000000.0] and parameters: {'p_sma': 58, 'p_std': 25, 'p_atr': 7, 'p_adx': 28, 'rsi_period': 54, 'ema1': 11, 'ema2': 44, 'slip_atr_k': 0.1382230792500636, 'slip_spread_k': 0.17773477100007162, 'spread_hl_frac': 0.006427048853639957, 'bb_std_mult': 2.832454028993187, 'rsi_os': 32, 'rsi_ob': 93, 'vol_spike': 0.27123725525162146, 'adx_thresh': 32.28696608711351, 'atr_min_pct': 0.01130110884999266, 'atr_max_pct': 0.14688820402709968, 'tp_mult': 1.6414988766412708, 'tsl_mult': 0.08730200647939787, 'strategy': 'breakout', 'time_stop': 196, 'use_sma': True, 'use_atr': False, 'use_adx': True, 'use_ema': True, 'use_spike': True, 'rsi_required': False, 'edge_k': 0.36584193911206, 'edge_cap': 0.49054139008720427, 'bull_strategy': 'breakout', 'bull_bb_std_mult': 2.1367826627036886, 'bull_rsi_os': 54, 'bull_rsi_ob': 82, 'bull_adx_thresh': 6.225695727354539, 'bull_atr_min_pct': 0.02741478096234053, 'bull_atr_max_pct': 0.10152531890101732, 'bull_tp_mult': 1.850249930363013, 'bull_tsl_mult': 0.047139378973706514, 'bull_time_stop': 286, 'bull_use_sma': False, 'bull_use_ema': True, 'bull_use_atr': False, 'bull_use_adx': False, 'bull_use_spike': False, 'bull_rsi_required': True, 'bear_strategy': 'breakout', 'bear_bb_std_mult': 3.2272004154762755, 'bear_rsi_os': 49, 'bear_rsi_ob': 74, 'bear_adx_thresh': 6.474244530604996, 'bear_atr_min_pct': 0.024545869988637534, 'bear_atr_max_pct': 0.13658415331836213, 'bear_tp_mult': 2.748861639052266, 'bear_tsl_mult': 0.7609060652391753, 'bear_time_stop': 24, 'bear_use_sma': False, 'bear_use_ema': False, 'bear_use_atr': False, 'bear_use_adx': False, 'bear_use_spike': False, 'bear_rsi_required': False, 'sideways_strategy': 'breakout', 'sideways_bb_std_mult': 1.6414485689154292, 'sideways_rsi_os': 26, 'sideways_rsi_ob': 63, 'sideways_adx_thresh': 10.458148421507236, 'sideways_atr_min_pct': 0.015925983730586506, 'sideways_atr_max_pct': 0.12051189803733936, 'sideways_tp_mult': 1.859707899841615, 'sideways_tsl_mult': 0.34962658914648015, 'sideways_time_stop': 5, 'sideways_use_sma': False, 'sideways_use_ema': False, 'sideways_use_atr': True, 'sideways_use_adx': False, 'sideways_use_spike': True, 'sideways_rsi_required': False}.
[I 2025-08-31 11:31:29,881] Trial 740 finished with values: [-1000000000.0, 1000000000.0] and parameters: {'p_sma': 53, 'p_std': 9, 'p_atr': 11, 'p_adx': 16, 'rsi_period': 51, 'ema1': 11, 'ema2': 46, 'slip_atr_k': 0.03444341073857131, 'slip_spread_k': 0.18378110872678882, 'spread_hl_frac': 0.004020137662998723, 'bb_std_mult': 3.2464364528785694, 'rsi_os': 28, 'rsi_ob': 93, 'vol_spike': 0.18368944410030552, 'adx_thresh': 32.240997821032536, 'atr_min_pct': 0.011333630373318488, 'atr_max_pct': 0.14068087335756094, 'tp_mult': 1.7380781046165485, 'tsl_mult': 0.08480827282756974, 'strategy': 'breakout', 'time_stop': 214, 'use_sma': True, 'use_atr': False, 'use_adx': True, 'use_ema': True, 'use_spike': True, 'rsi_required': False, 'edge_k': 0.42530822421224923, 'edge_cap': 0.4933242978358709, 'bull_strategy': 'breakout', 'bull_bb_std_mult': 0.6432852947700096, 'bull_rsi_os': 11, 'bull_rsi_ob': 85, 'bull_adx_thresh': 6.184469456075919, 'bull_atr_min_pct': 0.004438844840603619, 'bull_atr_max_pct': 0.10346569961277043, 'bull_tp_mult': 1.7944383066869452, 'bull_tsl_mult': 0.028405607239135433, 'bull_time_stop': 285, 'bull_use_sma': False, 'bull_use_ema': True, 'bull_use_atr': False, 'bull_use_adx': False, 'bull_use_spike': False, 'bull_rsi_required': True, 'bear_strategy': 'breakout', 'bear_bb_std_mult': 3.041519725301029, 'bear_rsi_os': 49, 'bear_rsi_ob': 73, 'bear_adx_thresh': 6.244484507676196, 'bear_atr_min_pct': 0.02697440455133926, 'bear_atr_max_pct': 0.1367446803300576, 'bear_tp_mult': 2.1635047134375154, 'bear_tsl_mult': 0.8248799446370509, 'bear_time_stop': 12, 'bear_use_sma': False, 'bear_use_ema': False, 'bear_use_atr': False, 'bear_use_adx': False, 'bear_use_spike': False, 'bear_rsi_required': True, 'sideways_strategy': 'breakout', 'sideways_bb_std_mult': 2.002567025961741, 'sideways_rsi_os': 27, 'sideways_rsi_ob': 73, 'sideways_adx_thresh': 10.351298115905829, 'sideways_atr_min_pct': 0.01626579546663994, 'sideways_atr_max_pct': 0.1290623317792662, 'sideways_tp_mult': 1.0899603201774513, 'sideways_tsl_mult': 0.3834695182868629, 'sideways_time_stop': 5, 'sideways_use_sma': False, 'sideways_use_ema': False, 'sideways_use_atr': True, 'sideways_use_adx': False, 'sideways_use_spike': True, 'sideways_rsi_required': True}.
[I 2025-08-31 11:31:30,105] Trial 742 finished with values: [-1000000000.0, 1000000000.0] and parameters: {'p_sma': 8, 'p_std': 8, 'p_atr': 11, 'p_adx': 16, 'rsi_period': 58, 'ema1': 12, 'ema2': 42, 'slip_atr_k': 0.18064876899678511, 'slip_spread_k': 0.21435693069235118, 'spread_hl_frac': 0.006069864525567029, 'bb_std_mult': 1.6295858608575737, 'rsi_os': 29, 'rsi_ob': 93, 'vol_spike': 0.27947656460469206, 'adx_thresh': 30.67588454140431, 'atr_min_pct': 0.012435935114994509, 'atr_max_pct': 0.14728980145149706, 'tp_mult': 1.638748140399338, 'tsl_mult': 0.016253417110469244, 'strategy': 'breakout', 'time_stop': 220, 'use_sma': True, 'use_atr': False, 'use_adx': True, 'use_ema': True, 'use_spike': True, 'rsi_required': False, 'edge_k': 0.3103818661823996, 'edge_cap': 0.4935616487059132, 'bull_strategy': 'breakout', 'bull_bb_std_mult': 3.0023061717880246, 'bull_rsi_os': 11, 'bull_rsi_ob': 83, 'bull_adx_thresh': 6.268440983862599, 'bull_atr_min_pct': 0.0048481679081721, 'bull_atr_max_pct': 0.09374363854776159, 'bull_tp_mult': 1.803340995301688, 'bull_tsl_mult': 0.3698723971666884, 'bull_time_stop': 285, 'bull_use_sma': False, 'bull_use_ema': True, 'bull_use_atr': False, 'bull_use_adx': True, 'bull_use_spike': False, 'bull_rsi_required': True, 'bear_strategy': 'breakout', 'bear_bb_std_mult': 3.0725524863477145, 'bear_rsi_os': 52, 'bear_rsi_ob': 74, 'bear_adx_thresh': 23.951289381935783, 'bear_atr_min_pct': 0.004931891590110846, 'bear_atr_max_pct': 0.13717940484036514, 'bear_tp_mult': 2.7509899331796426, 'bear_tsl_mult': 0.7269903388096939, 'bear_time_stop': 148, 'bear_use_sma': False, 'bear_use_ema': True, 'bear_use_atr': True, 'bear_use_adx': False, 'bear_use_spike': False, 'bear_rsi_required': False, 'sideways_strategy': 'breakout', 'sideways_bb_std_mult': 2.996992565767345, 'sideways_rsi_os': 26, 'sideways_rsi_ob': 65, 'sideways_adx_thresh': 15.629651986802465, 'sideways_atr_min_pct': 0.013702445625443605, 'sideways_atr_max_pct': 0.14398359982317335, 'sideways_tp_mult': 1.8478355853132113, 'sideways_tsl_mult': 0.34197834024732954, 'sideways_time_stop': 5, 'sideways_use_sma': False, 'sideways_use_ema': False, 'sideways_use_atr': True, 'sideways_use_adx': False, 'sideways_use_spike': True, 'sideways_rsi_required': False}.
[I 2025-08-31 11:31:30,261] Trial 743 finished with values: [-1000000000.0, 1000000000.0] and parameters: {'p_sma': 52, 'p_std': 9, 'p_atr': 7, 'p_adx': 27, 'rsi_period': 58, 'ema1': 12, 'ema2': 42, 'slip_atr_k': 0.1082525301566182, 'slip_spread_k': 0.20930065423863295, 'spread_hl_frac': 0.006358109270737242, 'bb_std_mult': 3.2497754780697043, 'rsi_os': 29, 'rsi_ob': 93, 'vol_spike': 0.28014792953887585, 'adx_thresh': 30.67812491964544, 'atr_min_pct': 0.01104264657151174, 'atr_max_pct': 0.14724322882614027, 'tp_mult': 1.6455015917790605, 'tsl_mult': 0.022099950059864717, 'strategy': 'breakout', 'time_stop': 218, 'use_sma': True, 'use_atr': False, 'use_adx': True, 'use_ema': True, 'use_spike': True, 'rsi_required': False, 'edge_k': 0.35912734112487, 'edge_cap': 0.5307379641335495, 'bull_strategy': 'breakout', 'bull_bb_std_mult': 2.14358595028983, 'bull_rsi_os': 11, 'bull_rsi_ob': 83, 'bull_adx_thresh': 17.2010116396427, 'bull_atr_min_pct': 0.027423509236889937, 'bull_atr_max_pct': 0.09378144803056114, 'bull_tp_mult': 1.8042237158377277, 'bull_tsl_mult': 0.3653456167323369, 'bull_time_stop': 286, 'bull_use_sma': False, 'bull_use_ema': True, 'bull_use_atr': False, 'bull_use_adx': True, 'bull_use_spike': False, 'bull_rsi_required': True, 'bear_strategy': 'breakout', 'bear_bb_std_mult': 3.0614108436119807, 'bear_rsi_os': 52, 'bear_rsi_ob': 74, 'bear_adx_thresh': 6.484436918995467, 'bear_atr_min_pct': 0.024048911256500036, 'bear_atr_max_pct': 0.13689457455068152, 'bear_tp_mult': 2.1840454031791188, 'bear_tsl_mult': 0.6898564923342306, 'bear_time_stop': 111, 'bear_use_sma': False, 'bear_use_ema': True, 'bear_use_atr': True, 'bear_use_adx': False, 'bear_use_spike': False, 'bear_rsi_required': False, 'sideways_strategy': 'breakout', 'sideways_bb_std_mult': 1.1576168785058853, 'sideways_rsi_os': 26, 'sideways_rsi_ob': 95, 'sideways_adx_thresh': 9.6655528988175, 'sideways_atr_min_pct': 7.366390775462826e-05, 'sideways_atr_max_pct': 0.03721586293941649, 'sideways_tp_mult': 1.0742967334052547, 'sideways_tsl_mult': 0.3071474130401947, 'sideways_time_stop': 5, 'sideways_use_sma': False, 'sideways_use_ema': False, 'sideways_use_atr': True, 'sideways_use_adx': False, 'sideways_use_spike': True, 'sideways_rsi_required': False}.
[I 2025-08-31 11:32:05,382] Trial 744 finished with values: [-0.023533203721118334, 0.023729504219802182] and parameters: {'p_sma': 53, 'p_std': 8, 'p_atr': 10, 'p_adx': 27, 'rsi_period': 54, 'ema1': 12, 'ema2': 42, 'slip_atr_k': 0.10907752119344333, 'slip_spread_k': 0.21343404632959656, 'spread_hl_frac': 0.004507756372920463, 'bb_std_mult': 3.2364027795595725, 'rsi_os': 28, 'rsi_ob': 94, 'vol_spike': 0.11732083887622395, 'adx_thresh': 30.97961977621897, 'atr_min_pct': 0.013109888409785398, 'atr_max_pct': 0.14709918635291164, 'tp_mult': 1.6407838977944162, 'tsl_mult': 0.02243179285822787, 'strategy': 'breakout', 'time_stop': 220, 'use_sma': True, 'use_atr': False, 'use_adx': True, 'use_ema': False, 'use_spike': True, 'rsi_required': False, 'edge_k': 0.2919809698354599, 'edge_cap': 0.5647428915716334, 'bull_strategy': 'breakout', 'bull_bb_std_mult': 2.4369689000994312, 'bull_rsi_os': 11, 'bull_rsi_ob': 83, 'bull_adx_thresh': 6.319552102659914, 'bull_atr_min_pct': 0.0025167706405389264, 'bull_atr_max_pct': 0.09727226214627906, 'bull_tp_mult': 1.8064286081434113, 'bull_tsl_mult': 0.3648126036537678, 'bull_time_stop': 285, 'bull_use_sma': False, 'bull_use_ema': True, 'bull_use_atr': False, 'bull_use_adx': True, 'bull_use_spike': False, 'bull_rsi_required': False, 'bear_strategy': 'mean_reversion', 'bear_bb_std_mult': 3.0866805140172917, 'bear_rsi_os': 52, 'bear_rsi_ob': 76, 'bear_adx_thresh': 23.8185007319113, 'bear_atr_min_pct': 0.02672886051544849, 'bear_atr_max_pct': 0.04528672803350642, 'bear_tp_mult': 2.81820808554266, 'bear_tsl_mult': 0.6816947869251098, 'bear_time_stop': 146, 'bear_use_sma': False, 'bear_use_ema': True, 'bear_use_atr': True, 'bear_use_adx': True, 'bear_use_spike': False, 'bear_rsi_required': False, 'sideways_strategy': 'breakout', 'sideways_bb_std_mult': 2.847684242731097, 'sideways_rsi_os': 25, 'sideways_rsi_ob': 46, 'sideways_adx_thresh': 9.695088450793795, 'sideways_atr_min_pct': 0.016999215570915337, 'sideways_atr_max_pct': 0.03782862776855023, 'sideways_tp_mult': 1.9119736985862057, 'sideways_tsl_mult': 0.42492544642226215, 'sideways_time_stop': 5, 'sideways_use_sma': False, 'sideways_use_ema': True, 'sideways_use_atr': True, 'sideways_use_adx': False, 'sideways_use_spike': True, 'sideways_rsi_required': False}.
[I 2025-08-31 11:32:05,872] Trial 745 finished with values: [-1000000000.0, 1000000000.0] and parameters: {'p_sma': 14, 'p_std': 15, 'p_atr': 10, 'p_adx': 11, 'rsi_period': 58, 'ema1': 12, 'ema2': 42, 'slip_atr_k': 0.11025231021820552, 'slip_spread_k': 0.22249663222428845, 'spread_hl_frac': 0.005648554148025532, 'bb_std_mult': 1.5406604604560608, 'rsi_os': 29, 'rsi_ob': 94, 'vol_spike': 0.2797742126866778, 'adx_thresh': 30.718100435262144, 'atr_min_pct': 0.012377934965991511, 'atr_max_pct': 0.1469495841865468, 'tp_mult': 1.6339421428637362, 'tsl_mult': 0.061585525790605895, 'strategy': 'breakout', 'time_stop': 206, 'use_sma': True, 'use_atr': False, 'use_adx': True, 'use_ema': False, 'use_spike': True, 'rsi_required': False, 'edge_k': 0.31205609548880797, 'edge_cap': 0.530139989418985, 'bull_strategy': 'breakout', 'bull_bb_std_mult': 1.8961581720426346, 'bull_rsi_os': 14, 'bull_rsi_ob': 81, 'bull_adx_thresh': 6.268474429639131, 'bull_atr_min_pct': 0.002782824499226703, 'bull_atr_max_pct': 0.09348612937872851, 'bull_tp_mult': 1.7972304460693471, 'bull_tsl_mult': 0.2540005960677777, 'bull_time_stop': 300, 'bull_use_sma': False, 'bull_use_ema': True, 'bull_use_atr': False, 'bull_use_adx': True, 'bull_use_spike': False, 'bull_rsi_required': False, 'bear_strategy': 'mean_reversion', 'bear_bb_std_mult': 2.963254763681211, 'bear_rsi_os': 52, 'bear_rsi_ob': 76, 'bear_adx_thresh': 34.913911763238104, 'bear_atr_min_pct': 0.004928811743712736, 'bear_atr_max_pct': 0.13970616412660752, 'bear_tp_mult': 2.8426285841743653, 'bear_tsl_mult': 0.6876728250266091, 'bear_time_stop': 58, 'bear_use_sma': False, 'bear_use_ema': True, 'bear_use_atr': True, 'bear_use_adx': True, 'bear_use_spike': False, 'bear_rsi_required': False, 'sideways_strategy': 'breakout', 'sideways_bb_std_mult': 1.1499798063299496, 'sideways_rsi_os': 26, 'sideways_rsi_ob': 71, 'sideways_adx_thresh': 8.22966989247589, 'sideways_atr_min_pct': 0.017435983392973118, 'sideways_atr_max_pct': 0.037479631231915306, 'sideways_tp_mult': 1.3900368428330032, 'sideways_tsl_mult': 0.3088277578802165, 'sideways_time_stop': 5, 'sideways_use_sma': False, 'sideways_use_ema': True, 'sideways_use_atr': True, 'sideways_use_adx': False, 'sideways_use_spike': True, 'sideways_rsi_required': False}.
[I 2025-08-31 11:32:06,288] Trial 747 finished with values: [-1000000000.0, 1000000000.0] and parameters: {'p_sma': 14, 'p_std': 21, 'p_atr': 10, 'p_adx': 11, 'rsi_period': 53, 'ema1': 12, 'ema2': 41, 'slip_atr_k': 0.025234576065696932, 'slip_spread_k': 0.12010397534190922, 'spread_hl_frac': 0.005246603784531571, 'bb_std_mult': 3.398021689168889, 'rsi_os': 28, 'rsi_ob': 94, 'vol_spike': 0.05695345262609236, 'adx_thresh': 31.35431811347382, 'atr_min_pct': 0.013221439942215935, 'atr_max_pct': 0.14506414712028928, 'tp_mult': 1.696312547270281, 'tsl_mult': 0.06330270011448126, 'strategy': 'breakout', 'time_stop': 206, 'use_sma': True, 'use_atr': True, 'use_adx': False, 'use_ema': False, 'use_spike': False, 'rsi_required': False, 'edge_k': 0.34358546935899953, 'edge_cap': 0.58499219493846, 'bull_strategy': 'breakout', 'bull_bb_std_mult': 1.6906357577986548, 'bull_rsi_os': 14, 'bull_rsi_ob': 81, 'bull_adx_thresh': 5.00582378092742, 'bull_atr_min_pct': 0.022522741586305937, 'bull_atr_max_pct': 0.09814545034589313, 'bull_tp_mult': 1.8922039014873335, 'bull_tsl_mult': 0.2825414425591459, 'bull_time_stop': 293, 'bull_use_sma': False, 'bull_use_ema': True, 'bull_use_atr': True, 'bull_use_adx': False, 'bull_use_spike': True, 'bull_rsi_required': False, 'bear_strategy': 'mean_reversion', 'bear_bb_std_mult': 3.1723862362143684, 'bear_rsi_os': 53, 'bear_rsi_ob': 76, 'bear_adx_thresh': 18.197708140017756, 'bear_atr_min_pct': 0.00429910628381866, 'bear_atr_max_pct': 0.06072007125318124, 'bear_tp_mult': 2.0517669699813017, 'bear_tsl_mult': 0.7398619689487417, 'bear_time_stop': 217, 'bear_use_sma': False, 'bear_use_ema': True, 'bear_use_atr': False, 'bear_use_adx': True, 'bear_use_spike': False, 'bear_rsi_required': False, 'sideways_strategy': 'breakout', 'sideways_bb_std_mult': 0.676892074718807, 'sideways_rsi_os': 25, 'sideways_rsi_ob': 71, 'sideways_adx_thresh': 8.201150318785345, 'sideways_atr_min_pct': 0.01720965537625332, 'sideways_atr_max_pct': 0.12427864851026932, 'sideways_tp_mult': 2.937717827854547, 'sideways_tsl_mult': 0.41274228576637845, 'sideways_time_stop': 12, 'sideways_use_sma': False, 'sideways_use_ema': True, 'sideways_use_atr': True, 'sideways_use_adx': False, 'sideways_use_spike': True, 'sideways_rsi_required': True}.
