[I 2025-08-31 10:06:52,318] Trial 101 finished with values: [-0.01246887930481333, 0.012729714645548507] and parameters: {'p_sma': 55, 'p_std': 53, 'p_atr': 9, 'p_adx': 27, 'rsi_period': 45, 'ema1': 28, 'ema2': 57, 'slip_atr_k': 0.02442482418493795, 'slip_spread_k': 0.6198783851672696, 'spread_hl_frac': 0.015075701171175564, 'bb_std_mult': 3.0371468928946723, 'rsi_os': 29, 'rsi_ob': 69, 'vol_spike': 0.14430412181705096, 'adx_thresh': 28.480192253754403, 'atr_min_pct': 0.009696744772991005, 'atr_max_pct': 0.13989551614495813, 'tp_mult': 2.439951785634942, 'tsl_mult': 0.8530319809279585, 'strategy': 'mean_reversion', 'time_stop': 187, 'use_sma': False, 'use_atr': True, 'use_adx': False, 'use_ema': True, 'use_spike': False, 'rsi_required': False, 'edge_k': 0.1439384753925721, 'edge_cap': 0.7918860430555137, 'bull_strategy': 'breakout', 'bull_bb_std_mult': 2.720319936147405, 'bull_rsi_os': 22, 'bull_rsi_ob': 70, 'bull_adx_thresh': 12.32200819785387, 'bull_atr_min_pct': 0.0013247848033838185, 'bull_atr_max_pct': 0.09905571278676281, 'bull_tp_mult': 2.7127095229283618, 'bull_tsl_mult': 0.8244886012556123, 'bull_time_stop': 90, 'bull_use_sma': False, 'bull_use_ema': True, 'bull_use_atr': True, 'bull_use_adx': False, 'bull_use_spike': True, 'bull_rsi_required': True, 'bear_strategy': 'mean_reversion', 'bear_bb_std_mult': 2.87789147096376, 'bear_rsi_os': 45, 'bear_rsi_ob': 72, 'bear_adx_thresh': 28.65175119136712, 'bear_atr_min_pct': 0.010917703470675602, 'bear_atr_max_pct': 0.05816806621382651, 'bear_tp_mult': 2.7997292690247857, 'bear_tsl_mult': 0.10900676646406698, 'bear_time_stop': 89, 'bear_use_sma': True, 'bear_use_ema': False, 'bear_use_atr': True, 'bear_use_adx': False, 'bear_use_spike': True, 'bear_rsi_required': True, 'sideways_strategy': 'breakout', 'sideways_bb_std_mult': 2.556748500008334, 'sideways_rsi_os': 22, 'sideways_rsi_ob': 78, 'sideways_adx_thresh': 24.783637501555734, 'sideways_atr_min_pct': 0.012531844481874336, 'sideways_atr_max_pct': 0.11156076409876096, 'sideways_tp_mult': 1.6839913283263257, 'sideways_tsl_mult': 0.00018038348931981307, 'sideways_time_stop': 240, 'sideways_use_sma': True, 'sideways_use_ema': True, 'sideways_use_atr': False, 'sideways_use_adx': True, 'sideways_use_spike': True, 'sideways_rsi_required': True}.
[I 2025-08-31 10:06:52,411] Trial 99 finished with values: [-0.019825589709186353, 0.019658824969991242] and parameters: {'p_sma': 56, 'p_std': 58, 'p_atr': 27, 'p_adx': 18, 'rsi_period': 45, 'ema1': 7, 'ema2': 51, 'slip_atr_k': 0.06540746266748121, 'slip_spread_k': 0.16037081830746627, 'spread_hl_frac': 0.026858394525182357, 'bb_std_mult': 2.397643337894007, 'rsi_os': 18, 'rsi_ob': 54, 'vol_spike': 0.030830124623737812, 'adx_thresh': 10.84335430710528, 'atr_min_pct': 0.00958084074809877, 'atr_max_pct': 0.027316519405609488, 'tp_mult': 2.4473944298050276, 'tsl_mult': 0.5100361568728682, 'strategy': 'mean_reversion', 'time_stop': 110, 'use_sma': False, 'use_atr': True, 'use_adx': False, 'use_ema': True, 'use_spike': True, 'rsi_required': False, 'edge_k': 0.5688756038000518, 'edge_cap': 0.8396912895283708, 'bull_strategy': 'breakout', 'bull_bb_std_mult': 0.9404923206278213, 'bull_rsi_os': 23, 'bull_rsi_ob': 70, 'bull_adx_thresh': 16.10532632533108, 'bull_atr_min_pct': 0.0013862943169671996, 'bull_atr_max_pct': 0.08494243835520515, 'bull_tp_mult': 2.903626278525001, 'bull_tsl_mult': 0.4003483580555367, 'bull_time_stop': 135, 'bull_use_sma': False, 'bull_use_ema': False, 'bull_use_atr': True, 'bull_use_adx': False, 'bull_use_spike': True, 'bull_rsi_required': True, 'bear_strategy': 'mean_reversion', 'bear_bb_std_mult': 2.8950579442494466, 'bear_rsi_os': 44, 'bear_rsi_ob': 72, 'bear_adx_thresh': 28.90617026246764, 'bear_atr_min_pct': 0.01567400702015998, 'bear_atr_max_pct': 0.12501537898680587, 'bear_tp_mult': 1.6945248734610487, 'bear_tsl_mult': 0.6926343263148299, 'bear_time_stop': 89, 'bear_use_sma': True, 'bear_use_ema': False, 'bear_use_atr': False, 'bear_use_adx': False, 'bear_use_spike': True, 'bear_rsi_required': True, 'sideways_strategy': 'mean_reversion', 'sideways_bb_std_mult': 3.0379065815487483, 'sideways_rsi_os': 31, 'sideways_rsi_ob': 74, 'sideways_adx_thresh': 33.87654682147733, 'sideways_atr_min_pct': 0.012548966280986467, 'sideways_atr_max_pct': 0.11232086061897259, 'sideways_tp_mult': 1.7132985870720003, 'sideways_tsl_mult': 0.8498857322129496, 'sideways_time_stop': 17, 'sideways_use_sma': True, 'sideways_use_ema': True, 'sideways_use_atr': False, 'sideways_use_adx': True, 'sideways_use_spike': True, 'sideways_rsi_required': True}.
[I 2025-08-31 10:06:52,539] Trial 100 finished with values: [-1000000000.0, 1000000000.0] and parameters: {'p_sma': 56, 'p_std': 52, 'p_atr': 27, 'p_adx': 27, 'rsi_period': 46, 'ema1': 7, 'ema2': 52, 'slip_atr_k': 0.063765622721877, 'slip_spread_k': 0.15046216764754805, 'spread_hl_frac': 0.006250500068083236, 'bb_std_mult': 2.4420086932557523, 'rsi_os': 18, 'rsi_ob': 68, 'vol_spike': 0.1418910587619883, 'adx_thresh': 27.936450096160915, 'atr_min_pct': 0.010097382836330932, 'atr_max_pct': 0.028520471729601447, 'tp_mult': 2.055699261317378, 'tsl_mult': 0.9264527246506271, 'strategy': 'mean_reversion', 'time_stop': 108, 'use_sma': False, 'use_atr': True, 'use_adx': False, 'use_ema': True, 'use_spike': False, 'rsi_required': False, 'edge_k': 1.0930330803163104, 'edge_cap': 0.7611006392663128, 'bull_strategy': 'breakout', 'bull_bb_std_mult': 2.7294170795937234, 'bull_rsi_os': 23, 'bull_rsi_ob': 70, 'bull_adx_thresh': 29.593253417164803, 'bull_atr_min_pct': 0.0012788978764881824, 'bull_atr_max_pct': 0.03215144578573099, 'bull_tp_mult': 1.9558390217009802, 'bull_tsl_mult': 0.22969600103879012, 'bull_time_stop': 210, 'bull_use_sma': False, 'bull_use_ema': True, 'bull_use_atr': True, 'bull_use_adx': False, 'bull_use_spike': True, 'bull_rsi_required': True, 'bear_strategy': 'mean_reversion', 'bear_bb_std_mult': 2.861050361795532, 'bear_rsi_os': 45, 'bear_rsi_ob': 86, 'bear_adx_thresh': 13.722469491751694, 'bear_atr_min_pct': 0.015680017995613714, 'bear_atr_max_pct': 0.11644085814093219, 'bear_tp_mult': 2.7718514079260155, 'bear_tsl_mult': 0.27685361996489904, 'bear_time_stop': 66, 'bear_use_sma': True, 'bear_use_ema': False, 'bear_use_atr': True, 'bear_use_adx': False, 'bear_use_spike': True, 'bear_rsi_required': True, 'sideways_strategy': 'breakout', 'sideways_bb_std_mult': 1.7916892480157205, 'sideways_rsi_os': 31, 'sideways_rsi_ob': 78, 'sideways_adx_thresh': 30.649188528214438, 'sideways_atr_min_pct': 0.01026422101885163, 'sideways_atr_max_pct': 0.11336354811551905, 'sideways_tp_mult': 1.9414482623106002, 'sideways_tsl_mult': 0.6552854796492878, 'sideways_time_stop': 275, 'sideways_use_sma': True, 'sideways_use_ema': True, 'sideways_use_atr': False, 'sideways_use_adx': True, 'sideways_use_spike': True, 'sideways_rsi_required': True}.
[I 2025-08-31 10:07:24,821] Trial 103 finished with values: [-0.02122685875461483, 0.021306482653513335] and parameters: {'p_sma': 55, 'p_std': 28, 'p_atr': 11, 'p_adx': 25, 'rsi_period': 46, 'ema1': 28, 'ema2': 57, 'slip_atr_k': 0.02560739173814032, 'slip_spread_k': 0.7612489872032498, 'spread_hl_frac': 0.01981653914810192, 'bb_std_mult': 3.0271049280926277, 'rsi_os': 35, 'rsi_ob': 69, 'vol_spike': 0.11930486939275989, 'adx_thresh': 28.671490251471912, 'atr_min_pct': 0.013548426983295538, 'atr_max_pct': 0.12848887981326418, 'tp_mult': 2.2775497652519086, 'tsl_mult': 0.8032842683212793, 'strategy': 'mean_reversion', 'time_stop': 187, 'use_sma': False, 'use_atr': True, 'use_adx': False, 'use_ema': True, 'use_spike': False, 'rsi_required': False, 'edge_k': 0.19158915784864206, 'edge_cap': 0.7928858534395763, 'bull_strategy': 'breakout', 'bull_bb_std_mult': 2.312058955589034, 'bull_rsi_os': 14, 'bull_rsi_ob': 71, 'bull_adx_thresh': 9.64624350412226, 'bull_atr_min_pct': 0.0010005843937738318, 'bull_atr_max_pct': 0.030852512647756104, 'bull_tp_mult': 2.7079633954103737, 'bull_tsl_mult': 0.880812460631562, 'bull_time_stop': 49, 'bull_use_sma': True, 'bull_use_ema': True, 'bull_use_atr': True, 'bull_use_adx': False, 'bull_use_spike': True, 'bull_rsi_required': True, 'bear_strategy': 'mean_reversion', 'bear_bb_std_mult': 2.5588706470541744, 'bear_rsi_os': 44, 'bear_rsi_ob': 72, 'bear_adx_thresh': 29.102660332944264, 'bear_atr_min_pct': 0.010699849974880674, 'bear_atr_max_pct': 0.05492092260420943, 'bear_tp_mult': 2.352827912751661, 'bear_tsl_mult': 0.05122998459769169, 'bear_time_stop': 88, 'bear_use_sma': True, 'bear_use_ema': False, 'bear_use_atr': True, 'bear_use_adx': False, 'bear_use_spike': True, 'bear_rsi_required': True, 'sideways_strategy': 'breakout', 'sideways_bb_std_mult': 2.372348302325302, 'sideways_rsi_os': 14, 'sideways_rsi_ob': 79, 'sideways_adx_thresh': 24.794929717963537, 'sideways_atr_min_pct': 0.012209084858205873, 'sideways_atr_max_pct': 0.12068718740267687, 'sideways_tp_mult': 1.7117122693594526, 'sideways_tsl_mult': 0.022912524136548467, 'sideways_time_stop': 268, 'sideways_use_sma': True, 'sideways_use_ema': True, 'sideways_use_atr': False, 'sideways_use_adx': True, 'sideways_use_spike': True, 'sideways_rsi_required': True}.
[I 2025-08-31 10:07:25,122] Trial 102 finished with values: [-1000000000.0, 1000000000.0] and parameters: {'p_sma': 56, 'p_std': 53, 'p_atr': 26, 'p_adx': 27, 'rsi_period': 48, 'ema1': 5, 'ema2': 51, 'slip_atr_k': 0.02369829846163976, 'slip_spread_k': 0.15323973484759462, 'spread_hl_frac': 0.042569005159613094, 'bb_std_mult': 1.4704830021223645, 'rsi_os': 18, 'rsi_ob': 69, 'vol_spike': 0.14354992302693187, 'adx_thresh': 28.449436622154487, 'atr_min_pct': 0.00952259252887937, 'atr_max_pct': 0.13957543083233573, 'tp_mult': 1.3653783290061265, 'tsl_mult': 0.8742547301364935, 'strategy': 'mean_reversion', 'time_stop': 185, 'use_sma': False, 'use_atr': True, 'use_adx': False, 'use_ema': True, 'use_spike': False, 'rsi_required': False, 'edge_k': 1.0851165463580619, 'edge_cap': 0.15677195686294784, 'bull_strategy': 'breakout', 'bull_bb_std_mult': 2.69533569087288, 'bull_rsi_os': 23, 'bull_rsi_ob': 50, 'bull_adx_thresh': 30.182294745957563, 'bull_atr_min_pct': 0.001281224206498046, 'bull_atr_max_pct': 0.03108415298043314, 'bull_tp_mult': 2.9162871195969644, 'bull_tsl_mult': 0.8191307278112574, 'bull_time_stop': 91, 'bull_use_sma': False, 'bull_use_ema': True, 'bull_use_atr': True, 'bull_use_adx': False, 'bull_use_spike': True, 'bull_rsi_required': True, 'bear_strategy': 'mean_reversion', 'bear_bb_std_mult': 2.801600436100683, 'bear_rsi_os': 24, 'bear_rsi_ob': 85, 'bear_adx_thresh': 13.863243028893498, 'bear_atr_min_pct': 0.010623907755238794, 'bear_atr_max_pct': 0.11685326897178425, 'bear_tp_mult': 2.3665529007472523, 'bear_tsl_mult': 0.761838515736306, 'bear_time_stop': 93, 'bear_use_sma': True, 'bear_use_ema': False, 'bear_use_atr': True, 'bear_use_adx': False, 'bear_use_spike': True, 'bear_rsi_required': True, 'sideways_strategy': 'breakout', 'sideways_bb_std_mult': 3.046656566691647, 'sideways_rsi_os': 21, 'sideways_rsi_ob': 64, 'sideways_adx_thresh': 30.717831137590764, 'sideways_atr_min_pct': 0.0035603857825950037, 'sideways_atr_max_pct': 0.05902049570116685, 'sideways_tp_mult': 2.790908784985427, 'sideways_tsl_mult': 0.9703640643420646, 'sideways_time_stop': 283, 'sideways_use_sma': True, 'sideways_use_ema': True, 'sideways_use_atr': False, 'sideways_use_adx': True, 'sideways_use_spike': True, 'sideways_rsi_required': True}.
[I 2025-08-31 10:07:25,148] Trial 104 finished with values: [-0.014984853882971438, 0.015011617434932433] and parameters: {'p_sma': 56, 'p_std': 53, 'p_atr': 11, 'p_adx': 25, 'rsi_period': 47, 'ema1': 28, 'ema2': 60, 'slip_atr_k': 0.022945538953638406, 'slip_spread_k': 0.75991152553889, 'spread_hl_frac': 0.017469775408616713, 'bb_std_mult': 3.057962284165847, 'rsi_os': 30, 'rsi_ob': 69, 'vol_spike': 0.11422534075049155, 'adx_thresh': 28.393791176101665, 'atr_min_pct': 0.015505376603690096, 'atr_max_pct': 0.12561445211173225, 'tp_mult': 2.049882635490953, 'tsl_mult': 0.8066739513220688, 'strategy': 'mean_reversion', 'time_stop': 193, 'use_sma': False, 'use_atr': True, 'use_adx': False, 'use_ema': True, 'use_spike': False, 'rsi_required': False, 'edge_k': 0.1746485178105704, 'edge_cap': 0.7989635383720508, 'bull_strategy': 'breakout', 'bull_bb_std_mult': 2.366436829178605, 'bull_rsi_os': 15, 'bull_rsi_ob': 71, 'bull_adx_thresh': 10.528091950206317, 'bull_atr_min_pct': 0.001073769776923805, 'bull_atr_max_pct': 0.10185113601397362, 'bull_tp_mult': 2.922104148289139, 'bull_tsl_mult': 0.9025770027030081, 'bull_time_stop': 47, 'bull_use_sma': False, 'bull_use_ema': True, 'bull_use_atr': True, 'bull_use_adx': False, 'bull_use_spike': True, 'bull_rsi_required': True, 'bear_strategy': 'mean_reversion', 'bear_bb_std_mult': 2.802391710785565, 'bear_rsi_os': 44, 'bear_rsi_ob': 71, 'bear_adx_thresh': 28.489171621264372, 'bear_atr_min_pct': 0.011870182042705377, 'bear_atr_max_pct': 0.0583242734287808, 'bear_tp_mult': 2.3638827782220484, 'bear_tsl_mult': 0.044392026090706374, 'bear_time_stop': 87, 'bear_use_sma': True, 'bear_use_ema': False, 'bear_use_atr': True, 'bear_use_adx': False, 'bear_use_spike': True, 'bear_rsi_required': True, 'sideways_strategy': 'breakout', 'sideways_bb_std_mult': 2.310385592235977, 'sideways_rsi_os': 21, 'sideways_rsi_ob': 78, 'sideways_adx_thresh': 25.036809478310843, 'sideways_atr_min_pct': 0.01183976771255428, 'sideways_atr_max_pct': 0.12207233987029426, 'sideways_tp_mult': 1.7035819439917186, 'sideways_tsl_mult': 0.008188472997939905, 'sideways_time_stop': 273, 'sideways_use_sma': True, 'sideways_use_ema': True, 'sideways_use_atr': False, 'sideways_use_adx': True, 'sideways_use_spike': True, 'sideways_rsi_required': True}.
[I 2025-08-31 10:07:25,373] Trial 105 finished with values: [-1000000000.0, 1000000000.0] and parameters: {'p_sma': 54, 'p_std': 55, 'p_atr': 11, 'p_adx': 25, 'rsi_period': 48, 'ema1': 28, 'ema2': 57, 'slip_atr_k': 0.024469535277255202, 'slip_spread_k': 0.7394047672931191, 'spread_hl_frac': 0.01951550125332316, 'bb_std_mult': 3.048925569267176, 'rsi_os': 30, 'rsi_ob': 69, 'vol_spike': 0.0953072642758955, 'adx_thresh': 23.916267105559925, 'atr_min_pct': 0.018366446184802036, 'atr_max_pct': 0.12187509597281752, 'tp_mult': 2.2835746449541334, 'tsl_mult': 0.8216924490185811, 'strategy': 'mean_reversion', 'time_stop': 188, 'use_sma': False, 'use_atr': True, 'use_adx': False, 'use_ema': True, 'use_spike': False, 'rsi_required': False, 'edge_k': 0.13554915430714318, 'edge_cap': 0.7983604657047919, 'bull_strategy': 'mean_reversion', 'bull_bb_std_mult': 2.346073330802439, 'bull_rsi_os': 14, 'bull_rsi_ob': 71, 'bull_adx_thresh': 9.713523917792381, 'bull_atr_min_pct': 0.0008145684561933586, 'bull_atr_max_pct': 0.09891323910385522, 'bull_tp_mult': 2.9125680570654544, 'bull_tsl_mult': 0.9157468437579289, 'bull_time_stop': 50, 'bull_use_sma': True, 'bull_use_ema': True, 'bull_use_atr': True, 'bull_use_adx': False, 'bull_use_spike': True, 'bull_rsi_required': True, 'bear_strategy': 'mean_reversion', 'bear_bb_std_mult': 2.7872509264701257, 'bear_rsi_os': 40, 'bear_rsi_ob': 72, 'bear_adx_thresh': 28.665955919354378, 'bear_atr_min_pct': 0.010771037754686104, 'bear_atr_max_pct': 0.05684036899133351, 'bear_tp_mult': 2.3864787060523485, 'bear_tsl_mult': 0.04494619947541208, 'bear_time_stop': 85, 'bear_use_sma': True, 'bear_use_ema': False, 'bear_use_atr': True, 'bear_use_adx': False, 'bear_use_spike': True, 'bear_rsi_required': True, 'sideways_strategy': 'breakout', 'sideways_bb_std_mult': 2.393576097984514, 'sideways_rsi_os': 22, 'sideways_rsi_ob': 74, 'sideways_adx_thresh': 25.018607746866458, 'sideways_atr_min_pct': 0.0121323312751525, 'sideways_atr_max_pct': 0.1231218061404653, 'sideways_tp_mult': 1.706134346387836, 'sideways_tsl_mult': 0.02008171386760507, 'sideways_time_stop': 236, 'sideways_use_sma': True, 'sideways_use_ema': True, 'sideways_use_atr': False, 'sideways_use_adx': True, 'sideways_use_spike': True, 'sideways_rsi_required': True}.
[I 2025-08-31 10:07:57,778] Trial 106 finished with values: [-1000000000.0, 1000000000.0] and parameters: {'p_sma': 54, 'p_std': 50, 'p_atr': 11, 'p_adx': 26, 'rsi_period': 48, 'ema1': 28, 'ema2': 57, 'slip_atr_k': 0.026051956421497047, 'slip_spread_k': 0.6735947693327863, 'spread_hl_frac': 0.019740712177738665, 'bb_std_mult': 3.0204176024640725, 'rsi_os': 30, 'rsi_ob': 69, 'vol_spike': 0.13370190956716702, 'adx_thresh': 27.020008573134465, 'atr_min_pct': 0.015632481769048717, 'atr_max_pct': 0.12217983124577328, 'tp_mult': 2.305579912056548, 'tsl_mult': 0.800606699016744, 'strategy': 'mean_reversion', 'time_stop': 187, 'use_sma': False, 'use_atr': True, 'use_adx': False, 'use_ema': True, 'use_spike': False, 'rsi_required': False, 'edge_k': 0.16371337890525148, 'edge_cap': 0.8026415131674106, 'bull_strategy': 'mean_reversion', 'bull_bb_std_mult': 2.6242857339316, 'bull_rsi_os': 14, 'bull_rsi_ob': 71, 'bull_adx_thresh': 12.29481215614251, 'bull_atr_min_pct': 0.0009746861236280094, 'bull_atr_max_pct': 0.09934447045214849, 'bull_tp_mult': 2.7200424426840075, 'bull_tsl_mult': 0.8833459800866947, 'bull_time_stop': 47, 'bull_use_sma': True, 'bull_use_ema': True, 'bull_use_atr': True, 'bull_use_adx': False, 'bull_use_spike': True, 'bull_rsi_required': True, 'bear_strategy': 'mean_reversion', 'bear_bb_std_mult': 2.7600040320475583, 'bear_rsi_os': 40, 'bear_rsi_ob': 72, 'bear_adx_thresh': 28.92175942160673, 'bear_atr_min_pct': 0.011121055991548485, 'bear_atr_max_pct': 0.05676927073315277, 'bear_tp_mult': 2.2251234440163064, 'bear_tsl_mult': 0.1145635250929617, 'bear_time_stop': 99, 'bear_use_sma': True, 'bear_use_ema': False, 'bear_use_atr': True, 'bear_use_adx': False, 'bear_use_spike': True, 'bear_rsi_required': True, 'sideways_strategy': 'breakout', 'sideways_bb_std_mult': 2.378190331927379, 'sideways_rsi_os': 21, 'sideways_rsi_ob': 74, 'sideways_adx_thresh': 24.908889565449353, 'sideways_atr_min_pct': 0.01178550844305669, 'sideways_atr_max_pct': 0.12182715779531539, 'sideways_tp_mult': 1.703469290118262, 'sideways_tsl_mult': 0.009268883620524249, 'sideways_time_stop': 233, 'sideways_use_sma': True, 'sideways_use_ema': True, 'sideways_use_atr': False, 'sideways_use_adx': True, 'sideways_use_spike': True, 'sideways_rsi_required': True}.
[I 2025-08-31 10:07:57,947] Trial 109 finished with values: [-1000000000.0, 1000000000.0] and parameters: {'p_sma': 27, 'p_std': 29, 'p_atr': 9, 'p_adx': 26, 'rsi_period': 45, 'ema1': 21, 'ema2': 60, 'slip_atr_k': 0.01031673179208322, 'slip_spread_k': 0.6004736722214757, 'spread_hl_frac': 0.017178992129029517, 'bb_std_mult': 3.2426857596667307, 'rsi_os': 34, 'rsi_ob': 70, 'vol_spike': 0.11137365423086136, 'adx_thresh': 29.745733364798355, 'atr_min_pct': 0.013341183868910571, 'atr_max_pct': 0.12899245909028373, 'tp_mult': 2.469398454296314, 'tsl_mult': 0.7981457910833338, 'strategy': 'mean_reversion', 'time_stop': 233, 'use_sma': False, 'use_atr': True, 'use_adx': False, 'use_ema': True, 'use_spike': True, 'rsi_required': False, 'edge_k': 0.17937013116799894, 'edge_cap': 0.8801532327150083, 'bull_strategy': 'breakout', 'bull_bb_std_mult': 2.4670633632254684, 'bull_rsi_os': 19, 'bull_rsi_ob': 74, 'bull_adx_thresh': 12.316641104305113, 'bull_atr_min_pct': 0.013976132215777282, 'bull_atr_max_pct': 0.1028950623795978, 'bull_tp_mult': 2.709535920278195, 'bull_tsl_mult': 0.8813275830236655, 'bull_time_stop': 77, 'bull_use_sma': True, 'bull_use_ema': True, 'bull_use_atr': True, 'bull_use_adx': False, 'bull_use_spike': True, 'bull_rsi_required': True, 'bear_strategy': 'breakout', 'bear_bb_std_mult': 2.7093017371764367, 'bear_rsi_os': 44, 'bear_rsi_ob': 73, 'bear_adx_thresh': 29.198844609662103, 'bear_atr_min_pct': 0.009279129584818455, 'bear_atr_max_pct': 0.051240034383359716, 'bear_tp_mult': 1.9437265448803402, 'bear_tsl_mult': 0.11386357793575234, 'bear_time_stop': 100, 'bear_use_sma': True, 'bear_use_ema': False, 'bear_use_atr': True, 'bear_use_adx': False, 'bear_use_spike': False, 'bear_rsi_required': True, 'sideways_strategy': 'breakout', 'sideways_bb_std_mult': 2.581012974038946, 'sideways_rsi_os': 20, 'sideways_rsi_ob': 79, 'sideways_adx_thresh': 23.025191288577634, 'sideways_atr_min_pct': 0.01488145121383585, 'sideways_atr_max_pct': 0.12056885788681164, 'sideways_tp_mult': 1.8464427122585638, 'sideways_tsl_mult': 0.0005771306642828754, 'sideways_time_stop': 264, 'sideways_use_sma': True, 'sideways_use_ema': True, 'sideways_use_atr': True, 'sideways_use_adx': True, 'sideways_use_spike': True, 'sideways_rsi_required': True}.
