[I 2025-08-31 09:59:16,387] Trial 36 finished with values: [-0.03737145135955866, 0.03726015204487443] and parameters: {'p_sma': 43, 'p_std': 8, 'p_atr': 25, 'p_adx': 30, 'rsi_period': 78, 'ema1': 5, 'ema2': 60, 'slip_atr_k': 0.2193867467294887, 'slip_spread_k': 0.012351039379463857, 'spread_hl_frac': 0.017555628722872585, 'bb_std_mult': 1.2474439111536915, 'rsi_os': 17, 'rsi_ob': 55, 'vol_spike': 0.25277950340916333, 'adx_thresh': 34.67426452625053, 'atr_min_pct': 0.029137029709844463, 'atr_max_pct': 0.1371083696861877, 'tp_mult': 2.102204434592398, 'tsl_mult': 0.9816100030474793, 'strategy': 'mean_reversion', 'time_stop': 28, 'use_sma': True, 'use_atr': False, 'use_adx': True, 'use_ema': True, 'use_spike': False, 'rsi_required': False, 'edge_k': 1.4292254870791257, 'edge_cap': 0.11394375698774167, 'bull_strategy': 'mean_reversion', 'bull_bb_std_mult': 2.848586839848518, 'bull_rsi_os': 50, 'bull_rsi_ob': 77, 'bull_adx_thresh': 14.38659540563609, 'bull_atr_min_pct': 0.0026283631375024047, 'bull_atr_max_pct': 0.08146568156338208, 'bull_tp_mult': 2.809888696397758, 'bull_tsl_mult': 0.5440123808811843, 'bull_time_stop': 140, 'bull_use_sma': False, 'bull_use_ema': False, 'bull_use_atr': True, 'bull_use_adx': True, 'bull_use_spike': False, 'bull_rsi_required': False, 'bear_strategy': 'mean_reversion', 'bear_bb_std_mult': 2.297805992347893, 'bear_rsi_os': 27, 'bear_rsi_ob': 56, 'bear_adx_thresh': 32.79313563165516, 'bear_atr_min_pct': 0.011329517341140698, 'bear_atr_max_pct': 0.01570520821201604, 'bear_tp_mult': 2.8883832229225113, 'bear_tsl_mult': 0.716373398695514, 'bear_time_stop': 213, 'bear_use_sma': True, 'bear_use_ema': True, 'bear_use_atr': True, 'bear_use_adx': False, 'bear_use_spike': True, 'bear_rsi_required': False, 'sideways_strategy': 'mean_reversion', 'sideways_bb_std_mult': 2.2729454723455875, 'sideways_rsi_os': 35, 'sideways_rsi_ob': 48, 'sideways_adx_thresh': 15.441172395035277, 'sideways_atr_min_pct': 0.027961722275303736, 'sideways_atr_max_pct': 0.11374438684888687, 'sideways_tp_mult': 1.270262075148943, 'sideways_tsl_mult': 0.2884764663568187, 'sideways_time_stop': 188, 'sideways_use_sma': True, 'sideways_use_ema': False, 'sideways_use_atr': True, 'sideways_use_adx': False, 'sideways_use_spike': True, 'sideways_rsi_required': False}.
[I 2025-08-31 09:59:48,123] Trial 37 finished with values: [-1000000000.0, 1000000000.0] and parameters: {'p_sma': 45, 'p_std': 9, 'p_atr': 26, 'p_adx': 30, 'rsi_period': 35, 'ema1': 5, 'ema2': 59, 'slip_atr_k': 0.2488792703619267, 'slip_spread_k': 0.10749844162806432, 'spread_hl_frac': 0.0179445888044637, 'bb_std_mult': 2.6386780842540443, 'rsi_os': 16, 'rsi_ob': 53, 'vol_spike': 0.2612268068368405, 'adx_thresh': 17.691492652631812, 'atr_min_pct': 0.02438428146707967, 'atr_max_pct': 0.13863201056048544, 'tp_mult': 2.120414770659871, 'tsl_mult': 0.00840570790628914, 'strategy': 'mean_reversion', 'time_stop': 33, 'use_sma': True, 'use_atr': False, 'use_adx': True, 'use_ema': True, 'use_spike': False, 'rsi_required': False, 'edge_k': 1.4545057886530008, 'edge_cap': 0.2883848774307445, 'bull_strategy': 'mean_reversion', 'bull_bb_std_mult': 2.874409933669753, 'bull_rsi_os': 26, 'bull_rsi_ob': 81, 'bull_adx_thresh': 17.12624632343263, 'bull_atr_min_pct': 0.017388104167361886, 'bull_atr_max_pct': 0.08313292775013162, 'bull_tp_mult': 2.7992186886064605, 'bull_tsl_mult': 0.5421960197975221, 'bull_time_stop': 85, 'bull_use_sma': False, 'bull_use_ema': False, 'bull_use_atr': True, 'bull_use_adx': True, 'bull_use_spike': False, 'bull_rsi_required': True, 'bear_strategy': 'mean_reversion', 'bear_bb_std_mult': 2.428827057047754, 'bear_rsi_os': 14, 'bear_rsi_ob': 64, 'bear_adx_thresh': 27.118565914132923, 'bear_atr_min_pct': 0.02832946465760522, 'bear_atr_max_pct': 0.03593310383122484, 'bear_tp_mult': 2.8528458539315062, 'bear_tsl_mult': 0.7218447820672615, 'bear_time_stop': 115, 'bear_use_sma': True, 'bear_use_ema': True, 'bear_use_atr': True, 'bear_use_adx': False, 'bear_use_spike': True, 'bear_rsi_required': True, 'sideways_strategy': 'mean_reversion', 'sideways_bb_std_mult': 2.32086095129115, 'sideways_rsi_os': 48, 'sideways_rsi_ob': 60, 'sideways_adx_thresh': 15.855928825703769, 'sideways_atr_min_pct': 0.027545841798067655, 'sideways_atr_max_pct': 0.11730002752320859, 'sideways_tp_mult': 1.8671192935936232, 'sideways_tsl_mult': 0.6134899411123065, 'sideways_time_stop': 181, 'sideways_use_sma': True, 'sideways_use_ema': True, 'sideways_use_atr': False, 'sideways_use_adx': False, 'sideways_use_spike': True, 'sideways_rsi_required': False}.
[I 2025-08-31 09:59:48,358] Trial 40 finished with values: [-1000000000.0, 1000000000.0] and parameters: {'p_sma': 53, 'p_std': 16, 'p_atr': 15, 'p_adx': 26, 'rsi_period': 47, 'ema1': 7, 'ema2': 12, 'slip_atr_k': 0.07877756720772339, 'slip_spread_k': 0.820729096681412, 'spread_hl_frac': 0.0046872741977114244, 'bb_std_mult': 2.622892412896678, 'rsi_os': 20, 'rsi_ob': 63, 'vol_spike': 0.12897943141941426, 'adx_thresh': 15.686575975265471, 'atr_min_pct': 0.0006236512572982168, 'atr_max_pct': 0.12777235621483723, 'tp_mult': 1.9257111657503339, 'tsl_mult': 0.8648253901024823, 'strategy': 'breakout', 'time_stop': 56, 'use_sma': False, 'use_atr': False, 'use_adx': False, 'use_ema': True, 'use_spike': True, 'rsi_required': False, 'edge_k': 0.6082433313418405, 'edge_cap': 0.30478735262318263, 'bull_strategy': 'mean_reversion', 'bull_bb_std_mult': 2.6432397533268968, 'bull_rsi_os': 26, 'bull_rsi_ob': 48, 'bull_adx_thresh': 25.2640646001375, 'bull_atr_min_pct': 0.006381685113193029, 'bull_atr_max_pct': 0.09715072162612273, 'bull_tp_mult': 2.7110903016224652, 'bull_tsl_mult': 0.7990560359732157, 'bull_time_stop': 36, 'bull_use_sma': True, 'bull_use_ema': False, 'bull_use_atr': False, 'bull_use_adx': True, 'bull_use_spike': False, 'bull_rsi_required': True, 'bear_strategy': 'breakout', 'bear_bb_std_mult': 3.3360547992533647, 'bear_rsi_os': 14, 'bear_rsi_ob': 64, 'bear_adx_thresh': 26.807419268909154, 'bear_atr_min_pct': 0.02886403506222894, 'bear_atr_max_pct': 0.03545730423208229, 'bear_tp_mult': 2.8368672448183148, 'bear_tsl_mult': 0.5588151849537818, 'bear_time_stop': 154, 'bear_use_sma': False, 'bear_use_ema': False, 'bear_use_atr': True, 'bear_use_adx': False, 'bear_use_spike': True, 'bear_rsi_required': True, 'sideways_strategy': 'breakout', 'sideways_bb_std_mult': 2.8008881316508973, 'sideways_rsi_os': 48, 'sideways_rsi_ob': 59, 'sideways_adx_thresh': 27.40684462347361, 'sideways_atr_min_pct': 0.02732154174443802, 'sideways_atr_max_pct': 0.03933053440071258, 'sideways_tp_mult': 1.8570291692507792, 'sideways_tsl_mult': 0.622733745724109, 'sideways_time_stop': 28, 'sideways_use_sma': False, 'sideways_use_ema': True, 'sideways_use_atr': True, 'sideways_use_adx': False, 'sideways_use_spike': True, 'sideways_rsi_required': True}.
[I 2025-08-31 09:59:48,651] Trial 39 finished with values: [-1000000000.0, 1000000000.0] and parameters: {'p_sma': 44, 'p_std': 16, 'p_atr': 25, 'p_adx': 26, 'rsi_period': 35, 'ema1': 7, 'ema2': 60, 'slip_atr_k': 0.08022122921031441, 'slip_spread_k': 0.24768240761614482, 'spread_hl_frac': 0.018559514204016372, 'bb_std_mult': 2.593525006093508, 'rsi_os': 20, 'rsi_ob': 52, 'vol_spike': 0.1375327843417857, 'adx_thresh': 17.475389006481816, 'atr_min_pct': 0.005735644692178533, 'atr_max_pct': 0.08167550531960223, 'tp_mult': 2.0689874738865175, 'tsl_mult': 0.8701450251629617, 'strategy': 'mean_reversion', 'time_stop': 37, 'use_sma': False, 'use_atr': False, 'use_adx': True, 'use_ema': True, 'use_spike': False, 'rsi_required': False, 'edge_k': 0.010713959575153975, 'edge_cap': 0.28680084818710333, 'bull_strategy': 'mean_reversion', 'bull_bb_std_mult': 2.6611832096965005, 'bull_rsi_os': 25, 'bull_rsi_ob': 49, 'bull_adx_thresh': 32.22501236756237, 'bull_atr_min_pct': 0.0030591256307273295, 'bull_atr_max_pct': 0.10087943454588558, 'bull_tp_mult': 2.6870186315569597, 'bull_tsl_mult': 0.5465142200436769, 'bull_time_stop': 83, 'bull_use_sma': False, 'bull_use_ema': False, 'bull_use_atr': False, 'bull_use_adx': True, 'bull_use_spike': False, 'bull_rsi_required': True, 'bear_strategy': 'mean_reversion', 'bear_bb_std_mult': 2.9975633222808833, 'bear_rsi_os': 48, 'bear_rsi_ob': 65, 'bear_adx_thresh': 5.0650659082827545, 'bear_atr_min_pct': 0.028433486521718777, 'bear_atr_max_pct': 0.034846055566811265, 'bear_tp_mult': 2.49259174539723, 'bear_tsl_mult': 0.7175921158866446, 'bear_time_stop': 163, 'bear_use_sma': True, 'bear_use_ema': True, 'bear_use_atr': True, 'bear_use_adx': False, 'bear_use_spike': True, 'bear_rsi_required': True, 'sideways_strategy': 'mean_reversion', 'sideways_bb_std_mult': 2.2052470904426427, 'sideways_rsi_os': 30, 'sideways_rsi_ob': 59, 'sideways_adx_thresh': 15.652415912230076, 'sideways_atr_min_pct': 0.0278522454738344, 'sideways_atr_max_pct': 0.010478353002572424, 'sideways_tp_mult': 1.8861598845789653, 'sideways_tsl_mult': 0.6182233803246914, 'sideways_time_stop': 189, 'sideways_use_sma': True, 'sideways_use_ema': True, 'sideways_use_atr': True, 'sideways_use_adx': False, 'sideways_use_spike': True, 'sideways_rsi_required': False}.
[I 2025-08-31 09:59:48,785] Trial 38 finished with values: [-0.03367809832651836, 0.03350660784764265] and parameters: {'p_sma': 42, 'p_std': 8, 'p_atr': 15, 'p_adx': 26, 'rsi_period': 46, 'ema1': 7, 'ema2': 59, 'slip_atr_k': 0.08692648303519226, 'slip_spread_k': 0.12939482866629132, 'spread_hl_frac': 0.018043519008337335, 'bb_std_mult': 1.8424081655913445, 'rsi_os': 19, 'rsi_ob': 64, 'vol_spike': 0.13828450102711745, 'adx_thresh': 16.587046548315744, 'atr_min_pct': 0.007132859905550107, 'atr_max_pct': 0.053613123509911535, 'tp_mult': 1.9059830702059823, 'tsl_mult': 0.8662823529784602, 'strategy': 'mean_reversion', 'time_stop': 34, 'use_sma': False, 'use_atr': False, 'use_adx': True, 'use_ema': True, 'use_spike': False, 'rsi_required': False, 'edge_k': 0.05510885778122132, 'edge_cap': 0.3075540881486979, 'bull_strategy': 'mean_reversion', 'bull_bb_std_mult': 2.679895090912222, 'bull_rsi_os': 26, 'bull_rsi_ob': 83, 'bull_adx_thresh': 14.199431699091576, 'bull_atr_min_pct': 0.0025592760278016578, 'bull_atr_max_pct': 0.09526929531317035, 'bull_tp_mult': 2.707307876091992, 'bull_tsl_mult': 0.5376049432237745, 'bull_time_stop': 91, 'bull_use_sma': False, 'bull_use_ema': False, 'bull_use_atr': False, 'bull_use_adx': True, 'bull_use_spike': False, 'bull_rsi_required': True, 'bear_strategy': 'mean_reversion', 'bear_bb_std_mult': 3.14463725319963, 'bear_rsi_os': 13, 'bear_rsi_ob': 66, 'bear_adx_thresh': 5.2655344016569785, 'bear_atr_min_pct': 0.006607900072538224, 'bear_atr_max_pct': 0.038640105578594236, 'bear_tp_mult': 2.4513058605160842, 'bear_tsl_mult': 0.7013605835346673, 'bear_time_stop': 110, 'bear_use_sma': True, 'bear_use_ema': True, 'bear_use_atr': True, 'bear_use_adx': False, 'bear_use_spike': True, 'bear_rsi_required': True, 'sideways_strategy': 'mean_reversion', 'sideways_bb_std_mult': 2.783687619165654, 'sideways_rsi_os': 49, 'sideways_rsi_ob': 58, 'sideways_adx_thresh': 28.041619352651765, 'sideways_atr_min_pct': 0.02727082931677729, 'sideways_atr_max_pct': 0.010858023386921933, 'sideways_tp_mult': 1.9015153613823514, 'sideways_tsl_mult': 0.5975532043638861, 'sideways_time_stop': 202, 'sideways_use_sma': True, 'sideways_use_ema': True, 'sideways_use_atr': True, 'sideways_use_adx': False, 'sideways_use_spike': True, 'sideways_rsi_required': False}.
[I 2025-08-31 10:00:20,934] Trial 44 finished with values: [-1000000000.0, 1000000000.0] and parameters: {'p_sma': 17, 'p_std': 55, 'p_atr': 12, 'p_adx': 9, 'rsi_period': 14, 'ema1': 28, 'ema2': 10, 'slip_atr_k': 0.0559454488755672, 'slip_spread_k': 0.9206780666728491, 'spread_hl_frac': 0.012317518290525268, 'bb_std_mult': 1.4251873280005631, 'rsi_os': 13, 'rsi_ob': 91, 'vol_spike': 0.09563894513964408, 'adx_thresh': 6.3503690461482725, 'atr_min_pct': 0.027631397410932658, 'atr_max_pct': 0.12795378440986238, 'tp_mult': 2.4435263060049563, 'tsl_mult': 0.18010488013213072, 'strategy': 'breakout', 'time_stop': 5, 'use_sma': True, 'use_atr': True, 'use_adx': False, 'use_ema': False, 'use_spike': True, 'rsi_required': True, 'edge_k': 0.9877752933263241, 'edge_cap': 0.6811783970665153, 'bull_strategy': 'breakout', 'bull_bb_std_mult': 1.6019561292324638, 'bull_rsi_os': 17, 'bull_rsi_ob': 61, 'bull_adx_thresh': 18.076949615659537, 'bull_atr_min_pct': 0.00497623600303459, 'bull_atr_max_pct': 0.11091693671680392, 'bull_tp_mult': 2.501763391775385, 'bull_tsl_mult': 0.9989663554984538, 'bull_time_stop': 173, 'bull_use_sma': False, 'bull_use_ema': True, 'bull_use_atr': True, 'bull_use_adx': False, 'bull_use_spike': True, 'bull_rsi_required': False, 'bear_strategy': 'breakout', 'bear_bb_std_mult': 2.8222619783196476, 'bear_rsi_os': 23, 'bear_rsi_ob': 79, 'bear_adx_thresh': 14.088866912646125, 'bear_atr_min_pct': 0.008405385708017334, 'bear_atr_max_pct': 0.04759951204144747, 'bear_tp_mult': 2.724436808066, 'bear_tsl_mult': 0.21719206018193074, 'bear_time_stop': 175, 'bear_use_sma': False, 'bear_use_ema': False, 'bear_use_atr': False, 'bear_use_adx': True, 'bear_use_spike': False, 'bear_rsi_required': False, 'sideways_strategy': 'breakout', 'sideways_bb_std_mult': 3.331979676953277, 'sideways_rsi_os': 18, 'sideways_rsi_ob': 90, 'sideways_adx_thresh': 23.407853151371345, 'sideways_atr_min_pct': 0.019142843712645498, 'sideways_atr_max_pct': 0.05827536782958822, 'sideways_tp_mult': 1.1231670250509525, 'sideways_tsl_mult': 0.8750772611740798, 'sideways_time_stop': 258, 'sideways_use_sma': False, 'sideways_use_ema': False, 'sideways_use_atr': False, 'sideways_use_adx': True, 'sideways_use_spike': False, 'sideways_rsi_required': True}.
[I 2025-08-31 10:00:21,841] Trial 43 finished with values: [-1000000000.0, 1000000000.0] and parameters: {'p_sma': 23, 'p_std': 31, 'p_atr': 15, 'p_adx': 8, 'rsi_period': 62, 'ema1': 30, 'ema2': 30, 'slip_atr_k': 0.13594497892235077, 'slip_spread_k': 0.9897444383396032, 'spread_hl_frac': 0.049529925174281106, 'bb_std_mult': 1.0730925361987542, 'rsi_os': 13, 'rsi_ob': 82, 'vol_spike': 0.10119876181746149, 'adx_thresh': 22.39922797989091, 'atr_min_pct': 0.01600982949420239, 'atr_max_pct': 0.05149495744107506, 'tp_mult': 1.2553876886032254, 'tsl_mult': 0.7821213455057324, 'strategy': 'breakout', 'time_stop': 73, 'use_sma': False, 'use_atr': True, 'use_adx': False, 'use_ema': True, 'use_spike': True, 'rsi_required': False, 'edge_k': 0.9916514430445281, 'edge_cap': 0.6824415176904128, 'bull_strategy': 'breakout', 'bull_bb_std_mult': 3.332586069446791, 'bull_rsi_os': 17, 'bull_rsi_ob': 83, 'bull_adx_thresh': 22.356361683625195, 'bull_atr_min_pct': 0.007372356558671332, 'bull_atr_max_pct': 0.1103118913090975, 'bull_tp_mult': 2.0498331261827643, 'bull_tsl_mult': 0.8337604741544875, 'bull_time_stop': 299, 'bull_use_sma': True, 'bull_use_ema': True, 'bull_use_atr': True, 'bull_use_adx': False, 'bull_use_spike': True, 'bull_rsi_required': False, 'bear_strategy': 'breakout', 'bear_bb_std_mult': 2.857944477515637, 'bear_rsi_os': 35, 'bear_rsi_ob': 72, 'bear_adx_thresh': 22.758948860659462, 'bear_atr_min_pct': 0.004798533703599294, 'bear_atr_max_pct': 0.044568802486990376, 'bear_tp_mult': 2.37901352913339, 'bear_tsl_mult': 0.2925756364597618, 'bear_time_stop': 57, 'bear_use_sma': False, 'bear_use_ema': False, 'bear_use_atr': False, 'bear_use_adx': False, 'bear_use_spike': False, 'bear_rsi_required': True, 'sideways_strategy': 'breakout', 'sideways_bb_std_mult': 2.831489913275393, 'sideways_rsi_os': 55, 'sideways_rsi_ob': 52, 'sideways_adx_thresh': 34.49831668690304, 'sideways_atr_min_pct': 0.01927570331829197, 'sideways_atr_max_pct': 0.07193333408237956, 'sideways_tp_mult': 2.2160860897437797, 'sideways_tsl_mult': 0.9920828249926701, 'sideways_time_stop': 210, 'sideways_use_sma': False, 'sideways_use_ema': False, 'sideways_use_atr': False, 'sideways_use_adx': True, 'sideways_use_spike': True, 'sideways_rsi_required': True}.
[I 2025-08-31 10:00:22,203] Trial 42 finished with values: [-1000000000.0, 1000000000.0] and parameters: {'p_sma': 39, 'p_std': 31, 'p_atr': 16, 'p_adx': 10, 'rsi_period': 59, 'ema1': 29, 'ema2': 29, 'slip_atr_k': 0.09262062654855302, 'slip_spread_k': 0.9886398404358012, 'spread_hl_frac': 0.012608312330305174, 'bb_std_mult': 1.8667631457725924, 'rsi_os': 48, 'rsi_ob': 80, 'vol_spike': 0.10403749066349058, 'adx_thresh': 10.756249388119034, 'atr_min_pct': 0.006723831433669624, 'atr_max_pct': 0.05137241187058689, 'tp_mult': 2.6277333837935384, 'tsl_mult': 0.17088212663975522, 'strategy': 'breakout', 'time_stop': 70, 'use_sma': False, 'use_atr': True, 'use_adx': False, 'use_ema': True, 'use_spike': True, 'rsi_required': False, 'edge_k': 0.07619103223811019, 'edge_cap': 0.6656023002569578, 'bull_strategy': 'mean_reversion', 'bull_bb_std_mult': 3.3234176135430213, 'bull_rsi_os': 18, 'bull_rsi_ob': 84, 'bull_adx_thresh': 31.378932917008317, 'bull_atr_min_pct': 0.002045312297660017, 'bull_atr_max_pct': 0.13804965886583812, 'bull_tp_mult': 2.0070353987384713, 'bull_tsl_mult': 0.8308608755213825, 'bull_time_stop': 178, 'bull_use_sma': False, 'bull_use_ema': True, 'bull_use_atr': False, 'bull_use_adx': False, 'bull_use_spike': True, 'bull_rsi_required': True, 'bear_strategy': 'mean_reversion', 'bear_bb_std_mult': 2.909854242942, 'bear_rsi_os': 35, 'bear_rsi_ob': 80, 'bear_adx_thresh': 14.977375565269037, 'bear_atr_min_pct': 0.006578612085702202, 'bear_atr_max_pct': 0.048800231774758826, 'bear_tp_mult': 2.444695629302248, 'bear_tsl_mult': 0.20364861468387985, 'bear_time_stop': 176, 'bear_use_sma': False, 'bear_use_ema': False, 'bear_use_atr': False, 'bear_use_adx': False, 'bear_use_spike': False, 'bear_rsi_required': True, 'sideways_strategy': 'breakout', 'sideways_bb_std_mult': 2.762542694026248, 'sideways_rsi_os': 31, 'sideways_rsi_ob': 68, 'sideways_adx_thresh': 34.78616064034923, 'sideways_atr_min_pct': 0.004036573909698138, 'sideways_atr_max_pct': 0.07165146467000044, 'sideways_tp_mult': 1.9576476811152552, 'sideways_tsl_mult': 0.8138323087453758, 'sideways_time_stop': 267, 'sideways_use_sma': False, 'sideways_use_ema': True, 'sideways_use_atr': False, 'sideways_use_adx': True, 'sideways_use_spike': True, 'sideways_rsi_required': True}.
[I 2025-08-31 10:00:22,218] Trial 41 finished with values: [-1000000000.0, 1000000000.0] and parameters: {'p_sma': 51, 'p_std': 15, 'p_atr': 15, 'p_adx': 26, 'rsi_period': 48, 'ema1': 30, 'ema2': 10, 'slip_atr_k': 0.07215265432702618, 'slip_spread_k': 0.253340300714056, 'spread_hl_frac': 0.04990029286459469, 'bb_std_mult': 1.8660519010229915, 'rsi_os': 12, 'rsi_ob': 69, 'vol_spike': 0.1378923030960122, 'adx_thresh': 30.990309347382432, 'atr_min_pct': 0.00395476890880129, 'atr_max_pct': 0.04930287940664205, 'tp_mult': 2.609149546432758, 'tsl_mult': 0.8647325536510898, 'strategy': 'breakout', 'time_stop': 65, 'use_sma': False, 'use_atr': True, 'use_adx': False, 'use_ema': True, 'use_spike': True, 'rsi_required': False, 'edge_k': 0.527136279750479, 'edge_cap': 0.30234572875203725, 'bull_strategy': 'mean_reversion', 'bull_bb_std_mult': 2.6576047853041254, 'bull_rsi_os': 18, 'bull_rsi_ob': 84, 'bull_adx_thresh': 23.784089930426937, 'bull_atr_min_pct': 0.007411829756400819, 'bull_atr_max_pct': 0.09730055471237278, 'bull_tp_mult': 2.0357414643805893, 'bull_tsl_mult': 0.8087853376722992, 'bull_time_stop': 35, 'bull_use_sma': True, 'bull_use_ema': True, 'bull_use_atr': False, 'bull_use_adx': True, 'bull_use_spike': True, 'bull_rsi_required': True, 'bear_strategy': 'breakout', 'bear_bb_std_mult': 3.284614333560471, 'bear_rsi_os': 35, 'bear_rsi_ob': 66, 'bear_adx_thresh': 22.438159584353123, 'bear_atr_min_pct': 0.029723081037750124, 'bear_atr_max_pct': 0.04710262263411012, 'bear_tp_mult': 2.438726723193851, 'bear_tsl_mult': 0.5253342613228603, 'bear_time_stop': 153, 'bear_use_sma': False, 'bear_use_ema': False, 'bear_use_atr': True, 'bear_use_adx': False, 'bear_use_spike': True, 'bear_rsi_required': True, 'sideways_strategy': 'breakout', 'sideways_bb_std_mult': 2.8972538419581166, 'sideways_rsi_os': 30, 'sideways_rsi_ob': 91, 'sideways_adx_thresh': 28.16368430721737, 'sideways_atr_min_pct': 0.01862109614871489, 'sideways_atr_max_pct': 0.014737236633121154, 'sideways_tp_mult': 1.9395743326586965, 'sideways_tsl_mult': 0.8192094325156608, 'sideways_time_stop': 214, 'sideways_use_sma': False, 'sideways_use_ema': True, 'sideways_use_atr': True, 'sideways_use_adx': True, 'sideways_use_spike': True, 'sideways_rsi_required': True}.
