[I 2025-08-31 11:01:30,134] Trial 522 finished with values: [-1000000000.0, 1000000000.0] and parameters: {'p_sma': 10, 'p_std': 30, 'p_atr': 11, 'p_adx': 15, 'rsi_period': 65, 'ema1': 13, 'ema2': 27, 'slip_atr_k': 0.02377486987579648, 'slip_spread_k': 0.5701586149167744, 'spread_hl_frac': 0.008669269675800294, 'bb_std_mult': 2.8923438111105217, 'rsi_os': 37, 'rsi_ob': 78, 'vol_spike': 0.2667525580460232, 'adx_thresh': 17.172892811656748, 'atr_min_pct': 0.011109527249414377, 'atr_max_pct': 0.09117401958769956, 'tp_mult': 2.5166433097552012, 'tsl_mult': 0.2011861289584768, 'strategy': 'breakout', 'time_stop': 62, 'use_sma': True, 'use_atr': True, 'use_adx': False, 'use_ema': True, 'use_spike': False, 'rsi_required': False, 'edge_k': 0.19762481417945035, 'edge_cap': 0.5115361959250381, 'bull_strategy': 'mean_reversion', 'bull_bb_std_mult': 0.7508560817977887, 'bull_rsi_os': 5, 'bull_rsi_ob': 47, 'bull_adx_thresh': 15.685003232278, 'bull_atr_min_pct': 0.022923679369774796, 'bull_atr_max_pct': 0.1253377489132086, 'bull_tp_mult': 1.6307324828515823, 'bull_tsl_mult': 0.3327788405972046, 'bull_time_stop': 74, 'bull_use_sma': True, 'bull_use_ema': True, 'bull_use_atr': True, 'bull_use_adx': False, 'bull_use_spike': True, 'bull_rsi_required': True, 'bear_strategy': 'breakout', 'bear_bb_std_mult': 2.129579048187715, 'bear_rsi_os': 20, 'bear_rsi_ob': 84, 'bear_adx_thresh': 7.267130193435531, 'bear_atr_min_pct': 0.014568203159542539, 'bear_atr_max_pct': 0.048447780440787014, 'bear_tp_mult': 2.712791698494879, 'bear_tsl_mult': 0.22785018254570844, 'bear_time_stop': 270, 'bear_use_sma': False, 'bear_use_ema': False, 'bear_use_atr': True, 'bear_use_adx': False, 'bear_use_spike': True, 'bear_rsi_required': True, 'sideways_strategy': 'breakout', 'sideways_bb_std_mult': 3.2943093711210985, 'sideways_rsi_os': 8, 'sideways_rsi_ob': 92, 'sideways_adx_thresh': 33.6256570513085, 'sideways_atr_min_pct': 0.018696753558617298, 'sideways_atr_max_pct': 0.14598013612744756, 'sideways_tp_mult': 2.1294094721935943, 'sideways_tsl_mult': 0.07351447491595053, 'sideways_time_stop': 25, 'sideways_use_sma': False, 'sideways_use_ema': False, 'sideways_use_atr': True, 'sideways_use_adx': True, 'sideways_use_spike': True, 'sideways_rsi_required': False}.
[I 2025-08-31 11:02:03,279] Trial 524 finished with values: [-1000000000.0, 1000000000.0] and parameters: {'p_sma': 13, 'p_std': 38, 'p_atr': 11, 'p_adx': 15, 'rsi_period': 73, 'ema1': 14, 'ema2': 29, 'slip_atr_k': 0.02627051225930069, 'slip_spread_k': 0.7049948561878978, 'spread_hl_frac': 0.010152790396895648, 'bb_std_mult': 2.712246789354207, 'rsi_os': 54, 'rsi_ob': 58, 'vol_spike': 0.23357140720504288, 'adx_thresh': 17.24339387207779, 'atr_min_pct': 0.014609147164617265, 'atr_max_pct': 0.09841308065127882, 'tp_mult': 2.411825495384643, 'tsl_mult': 0.8127632586711857, 'strategy': 'breakout', 'time_stop': 68, 'use_sma': True, 'use_atr': False, 'use_adx': True, 'use_ema': False, 'use_spike': False, 'rsi_required': True, 'edge_k': 0.20536360495414963, 'edge_cap': 0.4562444387738367, 'bull_strategy': 'breakout', 'bull_bb_std_mult': 1.9722457965752316, 'bull_rsi_os': 5, 'bull_rsi_ob': 47, 'bull_adx_thresh': 6.948360290589162, 'bull_atr_min_pct': 0.022559585057693746, 'bull_atr_max_pct': 0.09773509310221382, 'bull_tp_mult': 1.6769236786724762, 'bull_tsl_mult': 0.34104712902194856, 'bull_time_stop': 73, 'bull_use_sma': True, 'bull_use_ema': True, 'bull_use_atr': False, 'bull_use_adx': False, 'bull_use_spike': True, 'bull_rsi_required': True, 'bear_strategy': 'breakout', 'bear_bb_std_mult': 3.0066551161650525, 'bear_rsi_os': 53, 'bear_rsi_ob': 84, 'bear_adx_thresh': 12.76501205247573, 'bear_atr_min_pct': 0.007764810093792765, 'bear_atr_max_pct': 0.14997571581854466, 'bear_tp_mult': 2.817914744807974, 'bear_tsl_mult': 0.5117097745145037, 'bear_time_stop': 71, 'bear_use_sma': True, 'bear_use_ema': True, 'bear_use_atr': False, 'bear_use_adx': True, 'bear_use_spike': True, 'bear_rsi_required': True, 'sideways_strategy': 'breakout', 'sideways_bb_std_mult': 1.2427433581902414, 'sideways_rsi_os': 6, 'sideways_rsi_ob': 90, 'sideways_adx_thresh': 24.549048614899057, 'sideways_atr_min_pct': 0.01895430553959666, 'sideways_atr_max_pct': 0.1453709701097514, 'sideways_tp_mult': 1.5838585071263758, 'sideways_tsl_mult': 0.09835274812535874, 'sideways_time_stop': 22, 'sideways_use_sma': False, 'sideways_use_ema': False, 'sideways_use_atr': True, 'sideways_use_adx': False, 'sideways_use_spike': False, 'sideways_rsi_required': False}.
[I 2025-08-31 11:02:03,297] Trial 525 finished with values: [-1000000000.0, 1000000000.0] and parameters: {'p_sma': 14, 'p_std': 12, 'p_atr': 25, 'p_adx': 15, 'rsi_period': 66, 'ema1': 14, 'ema2': 57, 'slip_atr_k': 0.12371920395811052, 'slip_spread_k': 0.5634539368053156, 'spread_hl_frac': 0.004284233717475647, 'bb_std_mult': 1.872037613671247, 'rsi_os': 30, 'rsi_ob': 58, 'vol_spike': 0.2648511628070692, 'adx_thresh': 11.215706156001183, 'atr_min_pct': 0.006680131997290905, 'atr_max_pct': 0.11597290758880735, 'tp_mult': 2.181048173722805, 'tsl_mult': 0.2519718526850992, 'strategy': 'breakout', 'time_stop': 67, 'use_sma': True, 'use_atr': False, 'use_adx': True, 'use_ema': False, 'use_spike': False, 'rsi_required': True, 'edge_k': 0.7461825853208706, 'edge_cap': 0.4795220479464622, 'bull_strategy': 'breakout', 'bull_bb_std_mult': 1.9538798484863078, 'bull_rsi_os': 5, 'bull_rsi_ob': 65, 'bull_adx_thresh': 6.866747165063791, 'bull_atr_min_pct': 0.012827564794604437, 'bull_atr_max_pct': 0.050559977936369085, 'bull_tp_mult': 1.8280720601609552, 'bull_tsl_mult': 0.33788843609626473, 'bull_time_stop': 74, 'bull_use_sma': True, 'bull_use_ema': True, 'bull_use_atr': False, 'bull_use_adx': False, 'bull_use_spike': True, 'bull_rsi_required': True, 'bear_strategy': 'breakout', 'bear_bb_std_mult': 2.123146686744932, 'bear_rsi_os': 47, 'bear_rsi_ob': 84, 'bear_adx_thresh': 6.923998922169523, 'bear_atr_min_pct': 0.0271963123392494, 'bear_atr_max_pct': 0.12042969384813484, 'bear_tp_mult': 2.821773826916499, 'bear_tsl_mult': 0.5136040699519473, 'bear_time_stop': 33, 'bear_use_sma': True, 'bear_use_ema': True, 'bear_use_atr': False, 'bear_use_adx': True, 'bear_use_spike': True, 'bear_rsi_required': True, 'sideways_strategy': 'breakout', 'sideways_bb_std_mult': 2.724430359907881, 'sideways_rsi_os': 6, 'sideways_rsi_ob': 90, 'sideways_adx_thresh': 26.243006850789506, 'sideways_atr_min_pct': 0.018771512376557102, 'sideways_atr_max_pct': 0.14563983025698513, 'sideways_tp_mult': 2.1391269031190894, 'sideways_tsl_mult': 0.08837967333805201, 'sideways_time_stop': 20, 'sideways_use_sma': False, 'sideways_use_ema': False, 'sideways_use_atr': True, 'sideways_use_adx': False, 'sideways_use_spike': False, 'sideways_rsi_required': False}.
[I 2025-08-31 11:02:03,681] Trial 523 finished with values: [-1000000000.0, 1000000000.0] and parameters: {'p_sma': 26, 'p_std': 38, 'p_atr': 11, 'p_adx': 7, 'rsi_period': 44, 'ema1': 13, 'ema2': 57, 'slip_atr_k': 0.025926425866249384, 'slip_spread_k': 0.0503383917138468, 'spread_hl_frac': 0.008657936308176102, 'bb_std_mult': 2.8572471871325393, 'rsi_os': 37, 'rsi_ob': 78, 'vol_spike': 0.27321527514665384, 'adx_thresh': 17.240088815065096, 'atr_min_pct': 0.01425154105442823, 'atr_max_pct': 0.09087426208426731, 'tp_mult': 2.4816676742678636, 'tsl_mult': 0.27813904309900517, 'strategy': 'breakout', 'time_stop': 68, 'use_sma': True, 'use_atr': True, 'use_adx': False, 'use_ema': True, 'use_spike': False, 'rsi_required': False, 'edge_k': 0.7935128804120118, 'edge_cap': 0.13806459702734808, 'bull_strategy': 'mean_reversion', 'bull_bb_std_mult': 2.051660248766754, 'bull_rsi_os': 5, 'bull_rsi_ob': 93, 'bull_adx_thresh': 28.311736115839068, 'bull_atr_min_pct': 0.02309691981317661, 'bull_atr_max_pct': 0.08906873348093439, 'bull_tp_mult': 1.6330024630619107, 'bull_tsl_mult': 0.3381805637296707, 'bull_time_stop': 60, 'bull_use_sma': True, 'bull_use_ema': True, 'bull_use_atr': True, 'bull_use_adx': False, 'bull_use_spike': True, 'bull_rsi_required': True, 'bear_strategy': 'breakout', 'bear_bb_std_mult': 1.7962180556613514, 'bear_rsi_os': 40, 'bear_rsi_ob': 86, 'bear_adx_thresh': 7.098495188113745, 'bear_atr_min_pct': 0.018010942987076933, 'bear_atr_max_pct': 0.1305230092947421, 'bear_tp_mult': 2.3712970802198114, 'bear_tsl_mult': 0.08007221594791547, 'bear_time_stop': 270, 'bear_use_sma': False, 'bear_use_ema': False, 'bear_use_atr': True, 'bear_use_adx': False, 'bear_use_spike': True, 'bear_rsi_required': True, 'sideways_strategy': 'breakout', 'sideways_bb_std_mult': 3.154625681298082, 'sideways_rsi_os': 6, 'sideways_rsi_ob': 90, 'sideways_adx_thresh': 19.6563172860447, 'sideways_atr_min_pct': 0.024388874989496295, 'sideways_atr_max_pct': 0.04240608998178794, 'sideways_tp_mult': 1.3199774140003715, 'sideways_tsl_mult': 0.07656930849226443, 'sideways_time_stop': 28, 'sideways_use_sma': False, 'sideways_use_ema': False, 'sideways_use_atr': True, 'sideways_use_adx': True, 'sideways_use_spike': True, 'sideways_rsi_required': False}.
[I 2025-08-31 11:02:03,812] Trial 526 finished with values: [-1000000000.0, 1000000000.0] and parameters: {'p_sma': 29, 'p_std': 38, 'p_atr': 19, 'p_adx': 14, 'rsi_period': 53, 'ema1': 14, 'ema2': 57, 'slip_atr_k': 0.1691961011100695, 'slip_spread_k': 0.4396192752550382, 'spread_hl_frac': 0.04986751954108856, 'bb_std_mult': 2.718895898556508, 'rsi_os': 25, 'rsi_ob': 77, 'vol_spike': 0.2741076076219089, 'adx_thresh': 27.903457389789597, 'atr_min_pct': 0.01457000288474456, 'atr_max_pct': 0.07667722975173513, 'tp_mult': 2.4142868172454706, 'tsl_mult': 0.25344722383569684, 'strategy': 'breakout', 'time_stop': 69, 'use_sma': True, 'use_atr': False, 'use_adx': True, 'use_ema': False, 'use_spike': True, 'rsi_required': True, 'edge_k': 0.752336681748319, 'edge_cap': 0.47317293900943, 'bull_strategy': 'breakout', 'bull_bb_std_mult': 1.5470641707044588, 'bull_rsi_os': 16, 'bull_rsi_ob': 73, 'bull_adx_thresh': 20.5281621885872, 'bull_atr_min_pct': 0.00780585893787397, 'bull_atr_max_pct': 0.09366249967830392, 'bull_tp_mult': 1.7094457197152484, 'bull_tsl_mult': 0.3543408602798249, 'bull_time_stop': 86, 'bull_use_sma': True, 'bull_use_ema': False, 'bull_use_atr': False, 'bull_use_adx': False, 'bull_use_spike': False, 'bull_rsi_required': True, 'bear_strategy': 'breakout', 'bear_bb_std_mult': 1.7767903484717364, 'bear_rsi_os': 11, 'bear_rsi_ob': 89, 'bear_adx_thresh': 6.777184714785223, 'bear_atr_min_pct': 0.027001503159988127, 'bear_atr_max_pct': 0.12074905446884185, 'bear_tp_mult': 2.8111172474046477, 'bear_tsl_mult': 0.5117522674964904, 'bear_time_stop': 227, 'bear_use_sma': True, 'bear_use_ema': True, 'bear_use_atr': False, 'bear_use_adx': True, 'bear_use_spike': True, 'bear_rsi_required': False, 'sideways_strategy': 'mean_reversion', 'sideways_bb_std_mult': 2.263020074171118, 'sideways_rsi_os': 6, 'sideways_rsi_ob': 90, 'sideways_adx_thresh': 26.278499956889462, 'sideways_atr_min_pct': 0.01888533333747445, 'sideways_atr_max_pct': 0.12393864758148779, 'sideways_tp_mult': 2.173017698979424, 'sideways_tsl_mult': 0.09718626891237303, 'sideways_time_stop': 18, 'sideways_use_sma': False, 'sideways_use_ema': False, 'sideways_use_atr': False, 'sideways_use_adx': False, 'sideways_use_spike': False, 'sideways_rsi_required': True}.
[I 2025-08-31 11:02:36,804] Trial 529 finished with values: [-1000000000.0, 1000000000.0] and parameters: {'p_sma': 57, 'p_std': 27, 'p_atr': 10, 'p_adx': 14, 'rsi_period': 52, 'ema1': 11, 'ema2': 53, 'slip_atr_k': 0.0426482640854942, 'slip_spread_k': 0.4455436111029567, 'spread_hl_frac': 0.017575298951350564, 'bb_std_mult': 1.79815290402065, 'rsi_os': 39, 'rsi_ob': 77, 'vol_spike': 0.09325702287222724, 'adx_thresh': 6.347063695812507, 'atr_min_pct': 0.016882533890645174, 'atr_max_pct': 0.1038912875775847, 'tp_mult': 2.283322446452682, 'tsl_mult': 0.2304465111689829, 'strategy': 'breakout', 'time_stop': 113, 'use_sma': False, 'use_atr': False, 'use_adx': True, 'use_ema': True, 'use_spike': True, 'rsi_required': True, 'edge_k': 1.0632533130851662, 'edge_cap': 0.5365303195773621, 'bull_strategy': 'breakout', 'bull_bb_std_mult': 1.5807365111395928, 'bull_rsi_os': 29, 'bull_rsi_ob': 91, 'bull_adx_thresh': 7.75171891392151, 'bull_atr_min_pct': 0.007988540777332883, 'bull_atr_max_pct': 0.0395019634350827, 'bull_tp_mult': 1.704391297680783, 'bull_tsl_mult': 0.38914850470849127, 'bull_time_stop': 85, 'bull_use_sma': False, 'bull_use_ema': False, 'bull_use_atr': False, 'bull_use_adx': True, 'bull_use_spike': False, 'bull_rsi_required': True, 'bear_strategy': 'breakout', 'bear_bb_std_mult': 2.3971538402096138, 'bear_rsi_os': 22, 'bear_rsi_ob': 89, 'bear_adx_thresh': 5.049921830722875, 'bear_atr_min_pct': 0.006864496071970963, 'bear_atr_max_pct': 0.13834269117630024, 'bear_tp_mult': 2.7894501653348254, 'bear_tsl_mult': 0.473981840864171, 'bear_time_stop': 232, 'bear_use_sma': False, 'bear_use_ema': True, 'bear_use_atr': False, 'bear_use_adx': False, 'bear_use_spike': False, 'bear_rsi_required': False, 'sideways_strategy': 'mean_reversion', 'sideways_bb_std_mult': 1.7819657813732996, 'sideways_rsi_os': 7, 'sideways_rsi_ob': 94, 'sideways_adx_thresh': 10.15224621233003, 'sideways_atr_min_pct': 0.01630371371794793, 'sideways_atr_max_pct': 0.04608096573053763, 'sideways_tp_mult': 2.0663345312614276, 'sideways_tsl_mult': 0.14604614929422008, 'sideways_time_stop': 177, 'sideways_use_sma': False, 'sideways_use_ema': True, 'sideways_use_atr': False, 'sideways_use_adx': False, 'sideways_use_spike': False, 'sideways_rsi_required': True}.
[I 2025-08-31 11:02:37,123] Trial 528 finished with values: [-1000000000.0, 1000000000.0] and parameters: {'p_sma': 16, 'p_std': 27, 'p_atr': 9, 'p_adx': 14, 'rsi_period': 54, 'ema1': 15, 'ema2': 53, 'slip_atr_k': 0.031217919321985234, 'slip_spread_k': 0.6539816689375533, 'spread_hl_frac': 0.017539751141193785, 'bb_std_mult': 2.630520676025767, 'rsi_os': 25, 'rsi_ob': 77, 'vol_spike': 0.06118016923959112, 'adx_thresh': 27.88659653093436, 'atr_min_pct': 0.0029677525497760916, 'atr_max_pct': 0.08456402068888037, 'tp_mult': 1.7033125124171553, 'tsl_mult': 0.23099161419003925, 'strategy': 'breakout', 'time_stop': 112, 'use_sma': True, 'use_atr': False, 'use_adx': True, 'use_ema': True, 'use_spike': True, 'rsi_required': True, 'edge_k': 0.391123648164447, 'edge_cap': 0.134564039978802, 'bull_strategy': 'breakout', 'bull_bb_std_mult': 1.5129298634255428, 'bull_rsi_os': 16, 'bull_rsi_ob': 73, 'bull_adx_thresh': 20.512994593321856, 'bull_atr_min_pct': 0.006334871138486253, 'bull_atr_max_pct': 0.09455706298348997, 'bull_tp_mult': 1.820349034620784, 'bull_tsl_mult': 0.38754967603499846, 'bull_time_stop': 86, 'bull_use_sma': False, 'bull_use_ema': False, 'bull_use_atr': False, 'bull_use_adx': False, 'bull_use_spike': False, 'bull_rsi_required': True, 'bear_strategy': 'breakout', 'bear_bb_std_mult': 1.7583965224213243, 'bear_rsi_os': 43, 'bear_rsi_ob': 89, 'bear_adx_thresh': 5.014771178426807, 'bear_atr_min_pct': 0.0070898115826409265, 'bear_atr_max_pct': 0.13821454871817673, 'bear_tp_mult': 2.9222199046918953, 'bear_tsl_mult': 0.6909464052069408, 'bear_time_stop': 19, 'bear_use_sma': False, 'bear_use_ema': True, 'bear_use_atr': False, 'bear_use_adx': False, 'bear_use_spike': False, 'bear_rsi_required': False, 'sideways_strategy': 'mean_reversion', 'sideways_bb_std_mult': 3.1729875619607846, 'sideways_rsi_os': 10, 'sideways_rsi_ob': 59, 'sideways_adx_thresh': 26.21685920538445, 'sideways_atr_min_pct': 0.007141870846349369, 'sideways_atr_max_pct': 0.12408021599517668, 'sideways_tp_mult': 2.251595836077793, 'sideways_tsl_mult': 0.1442566504982516, 'sideways_time_stop': 16, 'sideways_use_sma': False, 'sideways_use_ema': True, 'sideways_use_atr': False, 'sideways_use_adx': False, 'sideways_use_spike': False, 'sideways_rsi_required': True}.
[I 2025-08-31 11:02:37,505] Trial 527 finished with values: [-1000000000.0, 1000000000.0] and parameters: {'p_sma': 27, 'p_std': 27, 'p_atr': 9, 'p_adx': 14, 'rsi_period': 21, 'ema1': 11, 'ema2': 55, 'slip_atr_k': 0.09065970753512753, 'slip_spread_k': 0.42636128076036317, 'spread_hl_frac': 0.017707312031009836, 'bb_std_mult': 2.6257002138835315, 'rsi_os': 25, 'rsi_ob': 77, 'vol_spike': 0.06149242805189019, 'adx_thresh': 27.934250431377613, 'atr_min_pct': 0.004932113202937164, 'atr_max_pct': 0.07724882592075447, 'tp_mult': 1.7281041710416172, 'tsl_mult': 0.27374027479695934, 'strategy': 'breakout', 'time_stop': 110, 'use_sma': True, 'use_atr': False, 'use_adx': True, 'use_ema': True, 'use_spike': True, 'rsi_required': True, 'edge_k': 1.8081346919152788, 'edge_cap': 0.4384948143633103, 'bull_strategy': 'breakout', 'bull_bb_std_mult': 1.5153455352541112, 'bull_rsi_os': 53, 'bull_rsi_ob': 73, 'bull_adx_thresh': 28.340487889312993, 'bull_atr_min_pct': 0.008899852084318816, 'bull_atr_max_pct': 0.09503681137449561, 'bull_tp_mult': 1.7095589655553929, 'bull_tsl_mult': 0.3829024647957184, 'bull_time_stop': 261, 'bull_use_sma': False, 'bull_use_ema': False, 'bull_use_atr': False, 'bull_use_adx': False, 'bull_use_spike': False, 'bull_rsi_required': True, 'bear_strategy': 'breakout', 'bear_bb_std_mult': 1.786627451604521, 'bear_rsi_os': 43, 'bear_rsi_ob': 89, 'bear_adx_thresh': 30.863661041297565, 'bear_atr_min_pct': 0.006657614590226525, 'bear_atr_max_pct': 0.13046489764404648, 'bear_tp_mult': 2.013856732370191, 'bear_tsl_mult': 0.6896260762021803, 'bear_time_stop': 231, 'bear_use_sma': False, 'bear_use_ema': True, 'bear_use_atr': False, 'bear_use_adx': False, 'bear_use_spike': False, 'bear_rsi_required': False, 'sideways_strategy': 'mean_reversion', 'sideways_bb_std_mult': 2.642094643071238, 'sideways_rsi_os': 7, 'sideways_rsi_ob': 58, 'sideways_adx_thresh': 26.295985600397017, 'sideways_atr_min_pct': 0.016217662952360577, 'sideways_atr_max_pct': 0.04346341872287331, 'sideways_tp_mult': 1.311438339703038, 'sideways_tsl_mult': 0.986927584937809, 'sideways_time_stop': 176, 'sideways_use_sma': False, 'sideways_use_ema': True, 'sideways_use_atr': False, 'sideways_use_adx': False, 'sideways_use_spike': False, 'sideways_rsi_required': True}.
[I 2025-08-31 11:02:37,622] Trial 530 finished with values: [-1000000000.0, 1000000000.0] and parameters: {'p_sma': 16, 'p_std': 27, 'p_atr': 9, 'p_adx': 14, 'rsi_period': 48, 'ema1': 15, 'ema2': 55, 'slip_atr_k': 0.04404237954871332, 'slip_spread_k': 0.6568188836709008, 'spread_hl_frac': 0.010081551885855312, 'bb_std_mult': 2.6263367797656696, 'rsi_os': 33, 'rsi_ob': 68, 'vol_spike': 0.0596330595857201, 'adx_thresh': 6.278658787537518, 'atr_min_pct': 0.019964582499155375, 'atr_max_pct': 0.0957850784509811, 'tp_mult': 2.292499047160748, 'tsl_mult': 0.9424683205761888, 'strategy': 'breakout', 'time_stop': 259, 'use_sma': False, 'use_atr': False, 'use_adx': True, 'use_ema': True, 'use_spike': True, 'rsi_required': True, 'edge_k': 0.2562592742711333, 'edge_cap': 0.4423866559818895, 'bull_strategy': 'breakout', 'bull_bb_std_mult': 1.4530051620809075, 'bull_rsi_os': 9, 'bull_rsi_ob': 76, 'bull_adx_thresh': 8.576027466347485, 'bull_atr_min_pct': 0.02444197344698032, 'bull_atr_max_pct': 0.0952207131033628, 'bull_tp_mult': 1.809724453602346, 'bull_tsl_mult': 0.3843451843248011, 'bull_time_stop': 265, 'bull_use_sma': False, 'bull_use_ema': False, 'bull_use_atr': False, 'bull_use_adx': True, 'bull_use_spike': False, 'bull_rsi_required': True, 'bear_strategy': 'breakout', 'bear_bb_std_mult': 2.3543112474688135, 'bear_rsi_os': 41, 'bear_rsi_ob': 74, 'bear_adx_thresh': 5.096377781137095, 'bear_atr_min_pct': 0.00684231097460619, 'bear_atr_max_pct': 0.1031895589544574, 'bear_tp_mult': 2.0116139078303643, 'bear_tsl_mult': 0.6784103149679493, 'bear_time_stop': 30, 'bear_use_sma': False, 'bear_use_ema': True, 'bear_use_atr': False, 'bear_use_adx': False, 'bear_use_spike': False, 'bear_rsi_required': False, 'sideways_strategy': 'mean_reversion', 'sideways_bb_std_mult': 1.7803651552700401, 'sideways_rsi_os': 23, 'sideways_rsi_ob': 94, 'sideways_adx_thresh': 25.50872437007248, 'sideways_atr_min_pct': 0.023098815970441895, 'sideways_atr_max_pct': 0.04641945167552438, 'sideways_tp_mult': 2.0483161686907287, 'sideways_tsl_mult': 0.13941613762327662, 'sideways_time_stop': 123, 'sideways_use_sma': False, 'sideways_use_ema': True, 'sideways_use_atr': False, 'sideways_use_adx': False, 'sideways_use_spike': False, 'sideways_rsi_required': True}.
