[I 2025-08-31 11:26:50,989] Trial 709 finished with values: [-1000000000.0, 1000000000.0] and parameters: {'p_sma': 13, 'p_std': 27, 'p_atr': 12, 'p_adx': 14, 'rsi_period': 52, 'ema1': 12, 'ema2': 43, 'slip_atr_k': 0.03209139673292354, 'slip_spread_k': 0.1308005784664203, 'spread_hl_frac': 0.007037363889177944, 'bb_std_mult': 2.8243962172675743, 'rsi_os': 29, 'rsi_ob': 94, 'vol_spike': 0.27827416486645545, 'adx_thresh': 32.781899717605235, 'atr_min_pct': 0.012095084850005471, 'atr_max_pct': 0.14969415454939272, 'tp_mult': 1.7476678547082982, 'tsl_mult': 0.060348338907876595, 'strategy': 'breakout', 'time_stop': 204, 'use_sma': True, 'use_atr': True, 'use_adx': False, 'use_ema': False, 'use_spike': False, 'rsi_required': False, 'edge_k': 0.34278948518849345, 'edge_cap': 0.5085872896972172, 'bull_strategy': 'breakout', 'bull_bb_std_mult': 0.6548240316531604, 'bull_rsi_os': 12, 'bull_rsi_ob': 86, 'bull_adx_thresh': 5.036154550123304, 'bull_atr_min_pct': 0.004953410311722861, 'bull_atr_max_pct': 0.0964335198016989, 'bull_tp_mult': 1.8238244841360287, 'bull_tsl_mult': 0.5534299935015935, 'bull_time_stop': 296, 'bull_use_sma': False, 'bull_use_ema': True, 'bull_use_atr': True, 'bull_use_adx': True, 'bull_use_spike': False, 'bull_rsi_required': False, 'bear_strategy': 'mean_reversion', 'bear_bb_std_mult': 3.164648273631148, 'bear_rsi_os': 53, 'bear_rsi_ob': 74, 'bear_adx_thresh': 26.417968785870258, 'bear_atr_min_pct': 0.0041060432769330505, 'bear_atr_max_pct': 0.13875135897035745, 'bear_tp_mult': 2.777885809657621, 'bear_tsl_mult': 0.719490076111066, 'bear_time_stop': 63, 'bear_use_sma': False, 'bear_use_ema': True, 'bear_use_atr': True, 'bear_use_adx': True, 'bear_use_spike': False, 'bear_rsi_required': False, 'sideways_strategy': 'breakout', 'sideways_bb_std_mult': 2.9102884857755775, 'sideways_rsi_os': 27, 'sideways_rsi_ob': 94, 'sideways_adx_thresh': 10.055281285943405, 'sideways_atr_min_pct': 0.016879938944773923, 'sideways_atr_max_pct': 0.04666580091002692, 'sideways_tp_mult': 1.9268714040059132, 'sideways_tsl_mult': 0.34567567351724465, 'sideways_time_stop': 5, 'sideways_use_sma': False, 'sideways_use_ema': True, 'sideways_use_atr': True, 'sideways_use_adx': False, 'sideways_use_spike': True, 'sideways_rsi_required': True}.
[I 2025-08-31 11:27:23,478] Trial 713 finished with values: [-0.037356161397612775, 0.03715867585266884] and parameters: {'p_sma': 12, 'p_std': 13, 'p_atr': 21, 'p_adx': 24, 'rsi_period': 53, 'ema1': 12, 'ema2': 44, 'slip_atr_k': 0.029365175885338105, 'slip_spread_k': 0.22492065862363025, 'spread_hl_frac': 0.005098581625507217, 'bb_std_mult': 2.8887604192257785, 'rsi_os': 29, 'rsi_ob': 94, 'vol_spike': 0.2837691990326165, 'adx_thresh': 31.934175110913635, 'atr_min_pct': 0.011417781686616429, 'atr_max_pct': 0.14724441703405475, 'tp_mult': 1.7228074721511237, 'tsl_mult': 0.045211045873962116, 'strategy': 'mean_reversion', 'time_stop': 210, 'use_sma': True, 'use_atr': False, 'use_adx': True, 'use_ema': True, 'use_spike': True, 'rsi_required': False, 'edge_k': 0.3339184382700601, 'edge_cap': 0.5388071690044183, 'bull_strategy': 'breakout', 'bull_bb_std_mult': 0.6382654428303942, 'bull_rsi_os': 14, 'bull_rsi_ob': 84, 'bull_adx_thresh': 5.956605281954832, 'bull_atr_min_pct': 0.02510514520604055, 'bull_atr_max_pct': 0.09635299811015409, 'bull_tp_mult': 1.8547318077073887, 'bull_tsl_mult': 0.5087580468090287, 'bull_time_stop': 299, 'bull_use_sma': False, 'bull_use_ema': True, 'bull_use_atr': False, 'bull_use_adx': False, 'bull_use_spike': False, 'bull_rsi_required': True, 'bear_strategy': 'breakout', 'bear_bb_std_mult': 3.2727125865384656, 'bear_rsi_os': 52, 'bear_rsi_ob': 73, 'bear_adx_thresh': 5.0074436539840175, 'bear_atr_min_pct': 0.003100125306301195, 'bear_atr_max_pct': 0.13502687649767794, 'bear_tp_mult': 2.7833909851012324, 'bear_tsl_mult': 0.77467100912175, 'bear_time_stop': 52, 'bear_use_sma': False, 'bear_use_ema': False, 'bear_use_atr': False, 'bear_use_adx': False, 'bear_use_spike': False, 'bear_rsi_required': True, 'sideways_strategy': 'breakout', 'sideways_bb_std_mult': 2.921535919055633, 'sideways_rsi_os': 22, 'sideways_rsi_ob': 95, 'sideways_adx_thresh': 11.746829122568602, 'sideways_atr_min_pct': 0.014494891381893246, 'sideways_atr_max_pct': 0.10552710600857648, 'sideways_tp_mult': 1.9265570165223307, 'sideways_tsl_mult': 0.3371551956891132, 'sideways_time_stop': 10, 'sideways_use_sma': True, 'sideways_use_ema': False, 'sideways_use_atr': True, 'sideways_use_adx': False, 'sideways_use_spike': True, 'sideways_rsi_required': False}.
[I 2025-08-31 11:27:23,779] Trial 712 finished with values: [-0.017320363457372534, 0.01962153648314035] and parameters: {'p_sma': 12, 'p_std': 54, 'p_atr': 11, 'p_adx': 24, 'rsi_period': 53, 'ema1': 12, 'ema2': 44, 'slip_atr_k': 0.038224651573019464, 'slip_spread_k': 0.16024624468339277, 'spread_hl_frac': 0.005873843388779435, 'bb_std_mult': 2.7992500467930883, 'rsi_os': 30, 'rsi_ob': 93, 'vol_spike': 0.28310934216197525, 'adx_thresh': 31.843083222567877, 'atr_min_pct': 0.010983617494623897, 'atr_max_pct': 0.14490835940222552, 'tp_mult': 1.7163495021521284, 'tsl_mult': 0.04689726657816651, 'strategy': 'mean_reversion', 'time_stop': 208, 'use_sma': True, 'use_atr': False, 'use_adx': True, 'use_ema': True, 'use_spike': True, 'rsi_required': False, 'edge_k': 0.3351362073774965, 'edge_cap': 0.528251485004017, 'bull_strategy': 'breakout', 'bull_bb_std_mult': 0.6334230848903265, 'bull_rsi_os': 14, 'bull_rsi_ob': 83, 'bull_adx_thresh': 5.722630416590692, 'bull_atr_min_pct': 0.00446390783558331, 'bull_atr_max_pct': 0.09576616503454692, 'bull_tp_mult': 1.8613786005756698, 'bull_tsl_mult': 0.3933541553886529, 'bull_time_stop': 299, 'bull_use_sma': False, 'bull_use_ema': True, 'bull_use_atr': False, 'bull_use_adx': False, 'bull_use_spike': False, 'bull_rsi_required': True, 'bear_strategy': 'breakout', 'bear_bb_std_mult': 3.2564299483423063, 'bear_rsi_os': 50, 'bear_rsi_ob': 73, 'bear_adx_thresh': 6.193118481513617, 'bear_atr_min_pct': 0.00305180313010067, 'bear_atr_max_pct': 0.1361193654698971, 'bear_tp_mult': 2.7757033211171462, 'bear_tsl_mult': 0.8302472185892417, 'bear_time_stop': 266, 'bear_use_sma': False, 'bear_use_ema': False, 'bear_use_atr': False, 'bear_use_adx': False, 'bear_use_spike': False, 'bear_rsi_required': True, 'sideways_strategy': 'breakout', 'sideways_bb_std_mult': 2.9031074290349346, 'sideways_rsi_os': 26, 'sideways_rsi_ob': 95, 'sideways_adx_thresh': 13.920246893449931, 'sideways_atr_min_pct': 0.016723903626831117, 'sideways_atr_max_pct': 0.043768198217259156, 'sideways_tp_mult': 2.8766554523155246, 'sideways_tsl_mult': 0.36873074422562846, 'sideways_time_stop': 11, 'sideways_use_sma': True, 'sideways_use_ema': False, 'sideways_use_atr': True, 'sideways_use_adx': False, 'sideways_use_spike': True, 'sideways_rsi_required': False}.
[I 2025-08-31 11:27:23,927] Trial 715 finished with values: [-0.014206087481692165, 0.016291732570957698] and parameters: {'p_sma': 13, 'p_std': 58, 'p_atr': 11, 'p_adx': 15, 'rsi_period': 55, 'ema1': 12, 'ema2': 44, 'slip_atr_k': 0.029171008166393973, 'slip_spread_k': 0.16657103412956437, 'spread_hl_frac': 0.006793033206656002, 'bb_std_mult': 2.7895037834463245, 'rsi_os': 29, 'rsi_ob': 93, 'vol_spike': 0.27583965035768937, 'adx_thresh': 31.830101665878985, 'atr_min_pct': 0.01037173986900983, 'atr_max_pct': 0.14449172907067123, 'tp_mult': 1.7153340430931834, 'tsl_mult': 0.03714914268732768, 'strategy': 'mean_reversion', 'time_stop': 209, 'use_sma': False, 'use_atr': False, 'use_adx': True, 'use_ema': True, 'use_spike': True, 'rsi_required': False, 'edge_k': 0.4679968379487994, 'edge_cap': 0.5276909995981185, 'bull_strategy': 'mean_reversion', 'bull_bb_std_mult': 0.6164963396245039, 'bull_rsi_os': 14, 'bull_rsi_ob': 84, 'bull_adx_thresh': 5.5654450920627, 'bull_atr_min_pct': 0.025070522603147995, 'bull_atr_max_pct': 0.09973751940876602, 'bull_tp_mult': 1.8641966921295983, 'bull_tsl_mult': 0.8096576270348547, 'bull_time_stop': 284, 'bull_use_sma': False, 'bull_use_ema': True, 'bull_use_atr': False, 'bull_use_adx': False, 'bull_use_spike': False, 'bull_rsi_required': True, 'bear_strategy': 'breakout', 'bear_bb_std_mult': 3.2450204007889756, 'bear_rsi_os': 50, 'bear_rsi_ob': 73, 'bear_adx_thresh': 6.001681950412566, 'bear_atr_min_pct': 0.002991139218257787, 'bear_atr_max_pct': 0.13522039712967657, 'bear_tp_mult': 2.8541700615204633, 'bear_tsl_mult': 0.7729375089078383, 'bear_time_stop': 266, 'bear_use_sma': True, 'bear_use_ema': False, 'bear_use_atr': False, 'bear_use_adx': False, 'bear_use_spike': False, 'bear_rsi_required': True, 'sideways_strategy': 'breakout', 'sideways_bb_std_mult': 2.928217616765222, 'sideways_rsi_os': 22, 'sideways_rsi_ob': 94, 'sideways_adx_thresh': 12.90188072419129, 'sideways_atr_min_pct': 0.016214019203968418, 'sideways_atr_max_pct': 0.10388271119531231, 'sideways_tp_mult': 1.8802827128658133, 'sideways_tsl_mult': 0.3756417381583994, 'sideways_time_stop': 5, 'sideways_use_sma': True, 'sideways_use_ema': False, 'sideways_use_atr': True, 'sideways_use_adx': True, 'sideways_use_spike': True, 'sideways_rsi_required': False}.
[I 2025-08-31 11:27:24,094] Trial 714 finished with values: [-1000000000.0, 1000000000.0] and parameters: {'p_sma': 13, 'p_std': 26, 'p_atr': 21, 'p_adx': 24, 'rsi_period': 54, 'ema1': 12, 'ema2': 44, 'slip_atr_k': 0.037501029786426, 'slip_spread_k': 0.16814407572802909, 'spread_hl_frac': 0.004085801581335462, 'bb_std_mult': 2.7982347590159358, 'rsi_os': 29, 'rsi_ob': 93, 'vol_spike': 0.2732076037842582, 'adx_thresh': 31.5223865998727, 'atr_min_pct': 0.010350196037878326, 'atr_max_pct': 0.14713232175344196, 'tp_mult': 1.7185199762138583, 'tsl_mult': 0.04142335886337126, 'strategy': 'mean_reversion', 'time_stop': 210, 'use_sma': False, 'use_atr': False, 'use_adx': True, 'use_ema': True, 'use_spike': True, 'rsi_required': False, 'edge_k': 0.46263682386592775, 'edge_cap': 0.5062876114161802, 'bull_strategy': 'mean_reversion', 'bull_bb_std_mult': 0.6443173894941706, 'bull_rsi_os': 14, 'bull_rsi_ob': 81, 'bull_adx_thresh': 5.716437293035587, 'bull_atr_min_pct': 0.004528994098016075, 'bull_atr_max_pct': 0.09642024340452165, 'bull_tp_mult': 1.8593287373563534, 'bull_tsl_mult': 0.4987997444348613, 'bull_time_stop': 285, 'bull_use_sma': False, 'bull_use_ema': True, 'bull_use_atr': False, 'bull_use_adx': False, 'bull_use_spike': False, 'bull_rsi_required': True, 'bear_strategy': 'breakout', 'bear_bb_std_mult': 3.263891148179599, 'bear_rsi_os': 51, 'bear_rsi_ob': 73, 'bear_adx_thresh': 27.793389133503748, 'bear_atr_min_pct': 0.0042900297417467394, 'bear_atr_max_pct': 0.13507338228686114, 'bear_tp_mult': 2.7745745446834422, 'bear_tsl_mult': 0.7770299677460084, 'bear_time_stop': 49, 'bear_use_sma': True, 'bear_use_ema': False, 'bear_use_atr': False, 'bear_use_adx': False, 'bear_use_spike': False, 'bear_rsi_required': True, 'sideways_strategy': 'breakout', 'sideways_bb_std_mult': 2.9447650114240185, 'sideways_rsi_os': 27, 'sideways_rsi_ob': 94, 'sideways_adx_thresh': 12.691007435898133, 'sideways_atr_min_pct': 0.01603485151587075, 'sideways_atr_max_pct': 0.04649694235812963, 'sideways_tp_mult': 1.8984985074571354, 'sideways_tsl_mult': 0.3765069600875763, 'sideways_time_stop': 5, 'sideways_use_sma': True, 'sideways_use_ema': False, 'sideways_use_atr': True, 'sideways_use_adx': False, 'sideways_use_spike': True, 'sideways_rsi_required': False}.
[I 2025-08-31 11:27:56,301] Trial 716 finished with values: [-1000000000.0, 1000000000.0] and parameters: {'p_sma': 13, 'p_std': 58, 'p_atr': 11, 'p_adx': 15, 'rsi_period': 54, 'ema1': 12, 'ema2': 44, 'slip_atr_k': 0.037762440591604614, 'slip_spread_k': 0.1590370531770998, 'spread_hl_frac': 0.005996734239041132, 'bb_std_mult': 3.0229553041896526, 'rsi_os': 29, 'rsi_ob': 93, 'vol_spike': 0.27467067348392615, 'adx_thresh': 31.284638616369158, 'atr_min_pct': 0.010476454550909953, 'atr_max_pct': 0.1426765686514683, 'tp_mult': 1.6697034287465298, 'tsl_mult': 0.027335765106828502, 'strategy': 'mean_reversion', 'time_stop': 212, 'use_sma': False, 'use_atr': False, 'use_adx': True, 'use_ema': True, 'use_spike': True, 'rsi_required': False, 'edge_k': 0.4855504451332926, 'edge_cap': 0.5289400717237185, 'bull_strategy': 'mean_reversion', 'bull_bb_std_mult': 0.6776950849039629, 'bull_rsi_os': 13, 'bull_rsi_ob': 81, 'bull_adx_thresh': 5.6976686657013085, 'bull_atr_min_pct': 0.02405636626791121, 'bull_atr_max_pct': 0.10311021373090655, 'bull_tp_mult': 1.877598864844298, 'bull_tsl_mult': 0.3886928415904694, 'bull_time_stop': 286, 'bull_use_sma': False, 'bull_use_ema': True, 'bull_use_atr': False, 'bull_use_adx': False, 'bull_use_spike': False, 'bull_rsi_required': True, 'bear_strategy': 'breakout', 'bear_bb_std_mult': 3.2170054736532716, 'bear_rsi_os': 50, 'bear_rsi_ob': 73, 'bear_adx_thresh': 6.074891529461173, 'bear_atr_min_pct': 0.0046137363012956146, 'bear_atr_max_pct': 0.1358179496411331, 'bear_tp_mult': 1.0840359888762539, 'bear_tsl_mult': 0.8208401606730612, 'bear_time_stop': 30, 'bear_use_sma': True, 'bear_use_ema': True, 'bear_use_atr': False, 'bear_use_adx': False, 'bear_use_spike': False, 'bear_rsi_required': False, 'sideways_strategy': 'breakout', 'sideways_bb_std_mult': 2.8043509381784375, 'sideways_rsi_os': 26, 'sideways_rsi_ob': 94, 'sideways_adx_thresh': 12.633220376185747, 'sideways_atr_min_pct': 0.01594701432019585, 'sideways_atr_max_pct': 0.1406018336533328, 'sideways_tp_mult': 1.8859617498784398, 'sideways_tsl_mult': 0.3796800105698949, 'sideways_time_stop': 5, 'sideways_use_sma': True, 'sideways_use_ema': False, 'sideways_use_atr': True, 'sideways_use_adx': True, 'sideways_use_spike': True, 'sideways_rsi_required': True}.
[I 2025-08-31 11:27:56,343] Trial 718 finished with values: [-1000000000.0, 1000000000.0] and parameters: {'p_sma': 13, 'p_std': 24, 'p_atr': 26, 'p_adx': 15, 'rsi_period': 55, 'ema1': 12, 'ema2': 42, 'slip_atr_k': 0.03877909817394351, 'slip_spread_k': 0.17143259913639847, 'spread_hl_frac': 0.003823861629616137, 'bb_std_mult': 2.9796831675331092, 'rsi_os': 29, 'rsi_ob': 93, 'vol_spike': 0.2722948114207438, 'adx_thresh': 31.174783606969786, 'atr_min_pct': 0.01026383414125963, 'atr_max_pct': 0.14288636661961981, 'tp_mult': 1.6753264355374275, 'tsl_mult': 0.03139624303257939, 'strategy': 'breakout', 'time_stop': 212, 'use_sma': False, 'use_atr': False, 'use_adx': True, 'use_ema': True, 'use_spike': True, 'rsi_required': False, 'edge_k': 0.45308776493941805, 'edge_cap': 0.5100797020577104, 'bull_strategy': 'mean_reversion', 'bull_bb_std_mult': 0.6112580669939209, 'bull_rsi_os': 13, 'bull_rsi_ob': 83, 'bull_adx_thresh': 5.008934984473779, 'bull_atr_min_pct': 0.0031140637057947684, 'bull_atr_max_pct': 0.10483375077352092, 'bull_tp_mult': 1.8672025940552788, 'bull_tsl_mult': 0.3952242002225316, 'bull_time_stop': 286, 'bull_use_sma': False, 'bull_use_ema': True, 'bull_use_atr': False, 'bull_use_adx': False, 'bull_use_spike': True, 'bull_rsi_required': True, 'bear_strategy': 'breakout', 'bear_bb_std_mult': 3.0654364786582207, 'bear_rsi_os': 50, 'bear_rsi_ob': 75, 'bear_adx_thresh': 31.290293284675094, 'bear_atr_min_pct': 0.004612344809768569, 'bear_atr_max_pct': 0.1419102911235865, 'bear_tp_mult': 2.846749176162719, 'bear_tsl_mult': 0.7741747517494857, 'bear_time_stop': 28, 'bear_use_sma': True, 'bear_use_ema': True, 'bear_use_atr': False, 'bear_use_adx': False, 'bear_use_spike': False, 'bear_rsi_required': False, 'sideways_strategy': 'breakout', 'sideways_bb_std_mult': 2.78041412287949, 'sideways_rsi_os': 22, 'sideways_rsi_ob': 94, 'sideways_adx_thresh': 12.363169065754407, 'sideways_atr_min_pct': 0.01593225799156906, 'sideways_atr_max_pct': 0.13878972321096697, 'sideways_tp_mult': 1.254559788602947, 'sideways_tsl_mult': 0.3936117964600051, 'sideways_time_stop': 10, 'sideways_use_sma': False, 'sideways_use_ema': False, 'sideways_use_atr': True, 'sideways_use_adx': True, 'sideways_use_spike': True, 'sideways_rsi_required': True}.
[I 2025-08-31 11:27:56,705] Trial 719 finished with values: [-0.006786278579344995, 0.008692376059479154] and parameters: {'p_sma': 14, 'p_std': 24, 'p_atr': 11, 'p_adx': 15, 'rsi_period': 52, 'ema1': 11, 'ema2': 41, 'slip_atr_k': 0.028320302012088832, 'slip_spread_k': 0.19430847176506674, 'spread_hl_frac': 0.0071292782765054906, 'bb_std_mult': 2.975697489330091, 'rsi_os': 29, 'rsi_ob': 95, 'vol_spike': 0.2746544494266302, 'adx_thresh': 30.97355875241246, 'atr_min_pct': 0.011502474688036165, 'atr_max_pct': 0.14211260276040136, 'tp_mult': 1.6697198320511872, 'tsl_mult': 0.08833489882121104, 'strategy': 'breakout', 'time_stop': 201, 'use_sma': False, 'use_atr': False, 'use_adx': True, 'use_ema': True, 'use_spike': True, 'rsi_required': False, 'edge_k': 0.3896687339378216, 'edge_cap': 0.5058864586806002, 'bull_strategy': 'mean_reversion', 'bull_bb_std_mult': 0.6852752283682286, 'bull_rsi_os': 12, 'bull_rsi_ob': 84, 'bull_adx_thresh': 5.506341813380186, 'bull_atr_min_pct': 0.003893081210024296, 'bull_atr_max_pct': 0.10360721776519131, 'bull_tp_mult': 1.812614641114827, 'bull_tsl_mult': 0.4694066804613409, 'bull_time_stop': 283, 'bull_use_sma': False, 'bull_use_ema': True, 'bull_use_atr': False, 'bull_use_adx': False, 'bull_use_spike': True, 'bull_rsi_required': True, 'bear_strategy': 'breakout', 'bear_bb_std_mult': 3.12186673960961, 'bear_rsi_os': 50, 'bear_rsi_ob': 75, 'bear_adx_thresh': 5.965933380997533, 'bear_atr_min_pct': 0.004482375450862898, 'bear_atr_max_pct': 0.14220264738606117, 'bear_tp_mult': 2.9986692827823265, 'bear_tsl_mult': 0.751867662486992, 'bear_time_stop': 185, 'bear_use_sma': True, 'bear_use_ema': True, 'bear_use_atr': False, 'bear_use_adx': False, 'bear_use_spike': False, 'bear_rsi_required': False, 'sideways_strategy': 'breakout', 'sideways_bb_std_mult': 3.0086887924997723, 'sideways_rsi_os': 25, 'sideways_rsi_ob': 94, 'sideways_adx_thresh': 14.65362771967612, 'sideways_atr_min_pct': 0.015948098947636716, 'sideways_atr_max_pct': 0.0986209577787838, 'sideways_tp_mult': 1.3182781044745888, 'sideways_tsl_mult': 0.3975352190086174, 'sideways_time_stop': 5, 'sideways_use_sma': False, 'sideways_use_ema': False, 'sideways_use_atr': True, 'sideways_use_adx': True, 'sideways_use_spike': True, 'sideways_rsi_required': True}.
[I 2025-08-31 11:27:56,716] Trial 717 finished with values: [-1000000000.0, 1000000000.0] and parameters: {'p_sma': 13, 'p_std': 47, 'p_atr': 26, 'p_adx': 15, 'rsi_period': 54, 'ema1': 11, 'ema2': 44, 'slip_atr_k': 0.09501930593622339, 'slip_spread_k': 0.19007483320580099, 'spread_hl_frac': 0.006978205913754265, 'bb_std_mult': 3.0230260500549084, 'rsi_os': 29, 'rsi_ob': 95, 'vol_spike': 0.2747512982823054, 'adx_thresh': 31.238501477003314, 'atr_min_pct': 0.010453285024375782, 'atr_max_pct': 0.14266249969973274, 'tp_mult': 1.6189416328676158, 'tsl_mult': 0.09636371218207143, 'strategy': 'breakout', 'time_stop': 216, 'use_sma': False, 'use_atr': False, 'use_adx': True, 'use_ema': True, 'use_spike': True, 'rsi_required': False, 'edge_k': 0.4607833099305555, 'edge_cap': 0.5099799595405111, 'bull_strategy': 'mean_reversion', 'bull_bb_std_mult': 0.6806196883138703, 'bull_rsi_os': 13, 'bull_rsi_ob': 81, 'bull_adx_thresh': 5.771952641412939, 'bull_atr_min_pct': 0.004359557582226539, 'bull_atr_max_pct': 0.10295163869601166, 'bull_tp_mult': 1.924196601363649, 'bull_tsl_mult': 0.3859764702660746, 'bull_time_stop': 284, 'bull_use_sma': False, 'bull_use_ema': True, 'bull_use_atr': False, 'bull_use_adx': False, 'bull_use_spike': True, 'bull_rsi_required': True, 'bear_strategy': 'breakout', 'bear_bb_std_mult': 3.0971584421834497, 'bear_rsi_os': 51, 'bear_rsi_ob': 75, 'bear_adx_thresh': 5.884612809272644, 'bear_atr_min_pct': 0.004558570427497345, 'bear_atr_max_pct': 0.14161564253146566, 'bear_tp_mult': 1.0589564894541303, 'bear_tsl_mult': 0.8207933339982991, 'bear_time_stop': 97, 'bear_use_sma': True, 'bear_use_ema': True, 'bear_use_atr': False, 'bear_use_adx': False, 'bear_use_spike': False, 'bear_rsi_required': False, 'sideways_strategy': 'breakout', 'sideways_bb_std_mult': 3.0677853204533063, 'sideways_rsi_os': 25, 'sideways_rsi_ob': 94, 'sideways_adx_thresh': 14.438583141064171, 'sideways_atr_min_pct': 0.015723608161866263, 'sideways_atr_max_pct': 0.07245500551574083, 'sideways_tp_mult': 1.888331771789389, 'sideways_tsl_mult': 0.3883528105132087, 'sideways_time_stop': 5, 'sideways_use_sma': False, 'sideways_use_ema': False, 'sideways_use_atr': True, 'sideways_use_adx': True, 'sideways_use_spike': True, 'sideways_rsi_required': True}.
