[I 2025-08-31 10:23:45,683] Trial 224 finished with values: [-0.011582132152558211, 0.012501686470019155] and parameters: {'p_sma': 14, 'p_std': 24, 'p_atr': 30, 'p_adx': 24, 'rsi_period': 12, 'ema1': 16, 'ema2': 46, 'slip_atr_k': 0.037659077413510336, 'slip_spread_k': 0.6603089265947665, 'spread_hl_frac': 0.011433205805083658, 'bb_std_mult': 0.7209200010933827, 'rsi_os': 28, 'rsi_ob': 58, 'vol_spike': 0.2632687177364042, 'adx_thresh': 29.552142694917293, 'atr_min_pct': 0.0006687962485661808, 'atr_max_pct': 0.10913233598972408, 'tp_mult': 1.3407362125016895, 'tsl_mult': 0.5995495541408062, 'strategy': 'breakout', 'time_stop': 226, 'use_sma': True, 'use_atr': False, 'use_adx': True, 'use_ema': True, 'use_spike': True, 'rsi_required': False, 'edge_k': 0.20451462485720162, 'edge_cap': 0.2199635757448698, 'bull_strategy': 'breakout', 'bull_bb_std_mult': 1.7187833897793603, 'bull_rsi_os': 40, 'bull_rsi_ob': 71, 'bull_adx_thresh': 23.92996247976333, 'bull_atr_min_pct': 0.023421502905984295, 'bull_atr_max_pct': 0.1480858128489718, 'bull_tp_mult': 1.6196618667825773, 'bull_tsl_mult': 0.4306225030122903, 'bull_time_stop': 47, 'bull_use_sma': False, 'bull_use_ema': True, 'bull_use_atr': True, 'bull_use_adx': False, 'bull_use_spike': True, 'bull_rsi_required': True, 'bear_strategy': 'breakout', 'bear_bb_std_mult': 1.1694043932697544, 'bear_rsi_os': 38, 'bear_rsi_ob': 68, 'bear_adx_thresh': 14.794068640710154, 'bear_atr_min_pct': 0.004071628401356935, 'bear_atr_max_pct': 0.07373428791206364, 'bear_tp_mult': 2.103225442091082, 'bear_tsl_mult': 0.7001959451138399, 'bear_time_stop': 149, 'bear_use_sma': False, 'bear_use_ema': True, 'bear_use_atr': False, 'bear_use_adx': False, 'bear_use_spike': True, 'bear_rsi_required': False, 'sideways_strategy': 'breakout', 'sideways_bb_std_mult': 1.5714893499058866, 'sideways_rsi_os': 39, 'sideways_rsi_ob': 81, 'sideways_adx_thresh': 23.431607200079952, 'sideways_atr_min_pct': 0.003425918065911542, 'sideways_atr_max_pct': 0.01946711224868741, 'sideways_tp_mult': 1.9059863068330298, 'sideways_tsl_mult': 0.5957250255801089, 'sideways_time_stop': 39, 'sideways_use_sma': False, 'sideways_use_ema': False, 'sideways_use_atr': False, 'sideways_use_adx': False, 'sideways_use_spike': True, 'sideways_rsi_required': True}.
[I 2025-08-31 10:23:45,858] Trial 223 finished with values: [-1000000000.0, 1000000000.0] and parameters: {'p_sma': 14, 'p_std': 23, 'p_atr': 30, 'p_adx': 24, 'rsi_period': 46, 'ema1': 16, 'ema2': 37, 'slip_atr_k': 0.03976900457627208, 'slip_spread_k': 0.6433029920304288, 'spread_hl_frac': 0.0018572591196359192, 'bb_std_mult': 1.9161140046190175, 'rsi_os': 18, 'rsi_ob': 57, 'vol_spike': 0.26587593361570183, 'adx_thresh': 14.30710319496961, 'atr_min_pct': 0.02731470678101031, 'atr_max_pct': 0.08145463490421943, 'tp_mult': 2.5047964869292176, 'tsl_mult': 0.5988876871147901, 'strategy': 'breakout', 'time_stop': 198, 'use_sma': True, 'use_atr': False, 'use_adx': True, 'use_ema': True, 'use_spike': True, 'rsi_required': False, 'edge_k': 0.21656788865737012, 'edge_cap': 0.8533471626237665, 'bull_strategy': 'breakout', 'bull_bb_std_mult': 0.8843293407616705, 'bull_rsi_os': 30, 'bull_rsi_ob': 70, 'bull_adx_thresh': 32.22969495995195, 'bull_atr_min_pct': 0.0016582808863876222, 'bull_atr_max_pct': 0.13735275531889007, 'bull_tp_mult': 1.4928130225389418, 'bull_tsl_mult': 0.4416189022502449, 'bull_time_stop': 227, 'bull_use_sma': False, 'bull_use_ema': True, 'bull_use_atr': True, 'bull_use_adx': False, 'bull_use_spike': True, 'bull_rsi_required': True, 'bear_strategy': 'breakout', 'bear_bb_std_mult': 2.250475705374023, 'bear_rsi_os': 20, 'bear_rsi_ob': 65, 'bear_adx_thresh': 14.643767627026886, 'bear_atr_min_pct': 0.004138160708102404, 'bear_atr_max_pct': 0.07491066915674906, 'bear_tp_mult': 2.5051869568934055, 'bear_tsl_mult': 0.5719709800684001, 'bear_time_stop': 13, 'bear_use_sma': False, 'bear_use_ema': True, 'bear_use_atr': False, 'bear_use_adx': False, 'bear_use_spike': True, 'bear_rsi_required': False, 'sideways_strategy': 'breakout', 'sideways_bb_std_mult': 1.5739941655659064, 'sideways_rsi_os': 17, 'sideways_rsi_ob': 94, 'sideways_adx_thresh': 31.42965440275942, 'sideways_atr_min_pct': 0.003356167279436411, 'sideways_atr_max_pct': 0.01575151329333281, 'sideways_tp_mult': 2.1029688975899417, 'sideways_tsl_mult': 0.055826466548253795, 'sideways_time_stop': 196, 'sideways_use_sma': False, 'sideways_use_ema': False, 'sideways_use_atr': False, 'sideways_use_adx': False, 'sideways_use_spike': True, 'sideways_rsi_required': True}.
[I 2025-08-31 10:24:17,890] Trial 228 finished with values: [-1000000000.0, 1000000000.0] and parameters: {'p_sma': 13, 'p_std': 30, 'p_atr': 30, 'p_adx': 24, 'rsi_period': 26, 'ema1': 16, 'ema2': 55, 'slip_atr_k': 0.024209006162300706, 'slip_spread_k': 0.47403238572876255, 'spread_hl_frac': 0.011579433115007412, 'bb_std_mult': 0.6704545375481707, 'rsi_os': 35, 'rsi_ob': 75, 'vol_spike': 0.2852395599740865, 'adx_thresh': 29.629853730097444, 'atr_min_pct': 0.023438725351613274, 'atr_max_pct': 0.05021478127929148, 'tp_mult': 2.4669495097807284, 'tsl_mult': 0.617782033641685, 'strategy': 'mean_reversion', 'time_stop': 148, 'use_sma': True, 'use_atr': True, 'use_adx': False, 'use_ema': True, 'use_spike': True, 'rsi_required': True, 'edge_k': 0.1343351063272754, 'edge_cap': 0.12999828194310764, 'bull_strategy': 'breakout', 'bull_bb_std_mult': 3.389465352690734, 'bull_rsi_os': 30, 'bull_rsi_ob': 68, 'bull_adx_thresh': 32.4181366354707, 'bull_atr_min_pct': 0.02904996965832049, 'bull_atr_max_pct': 0.0803773522170981, 'bull_tp_mult': 1.8035668334790855, 'bull_tsl_mult': 0.38154627798303264, 'bull_time_stop': 231, 'bull_use_sma': True, 'bull_use_ema': False, 'bull_use_atr': False, 'bull_use_adx': True, 'bull_use_spike': True, 'bull_rsi_required': True, 'bear_strategy': 'breakout', 'bear_bb_std_mult': 1.0751830408495384, 'bear_rsi_os': 42, 'bear_rsi_ob': 68, 'bear_adx_thresh': 15.553231792788033, 'bear_atr_min_pct': 0.028966610285869974, 'bear_atr_max_pct': 0.08653890876981767, 'bear_tp_mult': 2.5889740885527845, 'bear_tsl_mult': 0.5045690695802411, 'bear_time_stop': 58, 'bear_use_sma': False, 'bear_use_ema': True, 'bear_use_atr': False, 'bear_use_adx': False, 'bear_use_spike': False, 'bear_rsi_required': False, 'sideways_strategy': 'mean_reversion', 'sideways_bb_std_mult': 2.7737610022488197, 'sideways_rsi_os': 19, 'sideways_rsi_ob': 81, 'sideways_adx_thresh': 23.636771972536902, 'sideways_atr_min_pct': 0.006466970392623201, 'sideways_atr_max_pct': 0.015378535608866255, 'sideways_tp_mult': 1.0730157316646793, 'sideways_tsl_mult': 0.3344526784288826, 'sideways_time_stop': 49, 'sideways_use_sma': True, 'sideways_use_ema': False, 'sideways_use_atr': True, 'sideways_use_adx': True, 'sideways_use_spike': True, 'sideways_rsi_required': True}.
[I 2025-08-31 10:24:18,495] Trial 227 finished with values: [-1000000000.0, 1000000000.0] and parameters: {'p_sma': 15, 'p_std': 25, 'p_atr': 19, 'p_adx': 24, 'rsi_period': 26, 'ema1': 16, 'ema2': 11, 'slip_atr_k': 0.02682024260651232, 'slip_spread_k': 0.21058510797411162, 'spread_hl_frac': 0.012759023634386354, 'bb_std_mult': 0.6682044462855165, 'rsi_os': 19, 'rsi_ob': 77, 'vol_spike': 0.28445363624724984, 'adx_thresh': 29.622052152840453, 'atr_min_pct': 0.023378217929179504, 'atr_max_pct': 0.051850396013823796, 'tp_mult': 2.4801792777641296, 'tsl_mult': 0.5961995634886434, 'strategy': 'mean_reversion', 'time_stop': 223, 'use_sma': True, 'use_atr': True, 'use_adx': False, 'use_ema': True, 'use_spike': True, 'rsi_required': False, 'edge_k': 0.05031422649155223, 'edge_cap': 0.6162392102761312, 'bull_strategy': 'breakout', 'bull_bb_std_mult': 3.211843242601354, 'bull_rsi_os': 40, 'bull_rsi_ob': 72, 'bull_adx_thresh': 32.13696658778606, 'bull_atr_min_pct': 0.02430666832046712, 'bull_atr_max_pct': 0.1477190569133499, 'bull_tp_mult': 1.6129320957222066, 'bull_tsl_mult': 0.3832499192794253, 'bull_time_stop': 136, 'bull_use_sma': False, 'bull_use_ema': True, 'bull_use_atr': True, 'bull_use_adx': False, 'bull_use_spike': True, 'bull_rsi_required': True, 'bear_strategy': 'breakout', 'bear_bb_std_mult': 1.0891481150452162, 'bear_rsi_os': 42, 'bear_rsi_ob': 70, 'bear_adx_thresh': 15.812006880667631, 'bear_atr_min_pct': 0.003982645401141813, 'bear_atr_max_pct': 0.07334206762749614, 'bear_tp_mult': 2.6538446928854897, 'bear_tsl_mult': 0.44266682497697957, 'bear_time_stop': 58, 'bear_use_sma': False, 'bear_use_ema': True, 'bear_use_atr': False, 'bear_use_adx': False, 'bear_use_spike': True, 'bear_rsi_required': False, 'sideways_strategy': 'breakout', 'sideways_bb_std_mult': 2.777276237140515, 'sideways_rsi_os': 18, 'sideways_rsi_ob': 83, 'sideways_adx_thresh': 18.06478407593922, 'sideways_atr_min_pct': 0.004166602267841372, 'sideways_atr_max_pct': 0.014852139706320683, 'sideways_tp_mult': 2.0616852847784743, 'sideways_tsl_mult': 0.322695757993426, 'sideways_time_stop': 49, 'sideways_use_sma': True, 'sideways_use_ema': False, 'sideways_use_atr': True, 'sideways_use_adx': False, 'sideways_use_spike': True, 'sideways_rsi_required': True}.
[I 2025-08-31 10:24:18,657] Trial 230 finished with values: [-0.03537250758918764, 0.03500716043151343] and parameters: {'p_sma': 13, 'p_std': 25, 'p_atr': 15, 'p_adx': 15, 'rsi_period': 15, 'ema1': 16, 'ema2': 55, 'slip_atr_k': 0.03390201430953165, 'slip_spread_k': 0.38555586161791533, 'spread_hl_frac': 0.012738126258793248, 'bb_std_mult': 0.7158737446016775, 'rsi_os': 19, 'rsi_ob': 51, 'vol_spike': 0.023448681158746376, 'adx_thresh': 29.50689704839466, 'atr_min_pct': 0.0009350443158936909, 'atr_max_pct': 0.11435265462798608, 'tp_mult': 1.8519039441650194, 'tsl_mult': 0.6178220514630437, 'strategy': 'mean_reversion', 'time_stop': 119, 'use_sma': True, 'use_atr': True, 'use_adx': False, 'use_ema': True, 'use_spike': False, 'rsi_required': True, 'edge_k': 0.11843598170045677, 'edge_cap': 0.12353730824081072, 'bull_strategy': 'mean_reversion', 'bull_bb_std_mult': 2.401503963819252, 'bull_rsi_os': 40, 'bull_rsi_ob': 72, 'bull_adx_thresh': 24.340384893355644, 'bull_atr_min_pct': 0.002548910504714616, 'bull_atr_max_pct': 0.14552714729215468, 'bull_tp_mult': 1.7962002805962731, 'bull_tsl_mult': 0.3827904914942234, 'bull_time_stop': 133, 'bull_use_sma': True, 'bull_use_ema': False, 'bull_use_atr': False, 'bull_use_adx': True, 'bull_use_spike': False, 'bull_rsi_required': True, 'bear_strategy': 'mean_reversion', 'bear_bb_std_mult': 3.4849009070337953, 'bear_rsi_os': 42, 'bear_rsi_ob': 49, 'bear_adx_thresh': 15.551955884417115, 'bear_atr_min_pct': 0.003402059068045105, 'bear_atr_max_pct': 0.08611161709575897, 'bear_tp_mult': 1.7402070019326927, 'bear_tsl_mult': 0.5007930878169468, 'bear_time_stop': 149, 'bear_use_sma': False, 'bear_use_ema': True, 'bear_use_atr': True, 'bear_use_adx': False, 'bear_use_spike': False, 'bear_rsi_required': False, 'sideways_strategy': 'mean_reversion', 'sideways_bb_std_mult': 2.7929303832487378, 'sideways_rsi_os': 19, 'sideways_rsi_ob': 81, 'sideways_adx_thresh': 25.004355996880232, 'sideways_atr_min_pct': 0.006347569918848999, 'sideways_atr_max_pct': 0.04760422550400514, 'sideways_tp_mult': 2.247342741574139, 'sideways_tsl_mult': 0.3344491456376268, 'sideways_time_stop': 140, 'sideways_use_sma': True, 'sideways_use_ema': False, 'sideways_use_atr': True, 'sideways_use_adx': True, 'sideways_use_spike': True, 'sideways_rsi_required': True}.
[I 2025-08-31 10:24:18,785] Trial 229 finished with values: [-1000000000.0, 1000000000.0] and parameters: {'p_sma': 15, 'p_std': 24, 'p_atr': 19, 'p_adx': 24, 'rsi_period': 13, 'ema1': 16, 'ema2': 11, 'slip_atr_k': 0.026904795975480275, 'slip_spread_k': 0.860820258184549, 'spread_hl_frac': 0.012505387757012841, 'bb_std_mult': 0.6570093939021588, 'rsi_os': 28, 'rsi_ob': 76, 'vol_spike': 0.28497917998200495, 'adx_thresh': 29.45566382041203, 'atr_min_pct': 0.006135682847436149, 'atr_max_pct': 0.11058318749570557, 'tp_mult': 1.8521924936596563, 'tsl_mult': 0.6264266583428559, 'strategy': 'mean_reversion', 'time_stop': 118, 'use_sma': True, 'use_atr': True, 'use_adx': False, 'use_ema': True, 'use_spike': True, 'rsi_required': True, 'edge_k': 0.11475342434683733, 'edge_cap': 0.6115949618291339, 'bull_strategy': 'breakout', 'bull_bb_std_mult': 3.2917295049646365, 'bull_rsi_os': 40, 'bull_rsi_ob': 69, 'bull_adx_thresh': 23.103423347887837, 'bull_atr_min_pct': 0.023328692899760726, 'bull_atr_max_pct': 0.08049319273113521, 'bull_tp_mult': 1.8184125725828426, 'bull_tsl_mult': 0.3820684170440012, 'bull_time_stop': 50, 'bull_use_sma': True, 'bull_use_ema': False, 'bull_use_atr': False, 'bull_use_adx': True, 'bull_use_spike': True, 'bull_rsi_required': True, 'bear_strategy': 'mean_reversion', 'bear_bb_std_mult': 1.4680905216925138, 'bear_rsi_os': 42, 'bear_rsi_ob': 68, 'bear_adx_thresh': 20.49659740658512, 'bear_atr_min_pct': 0.02288170522780484, 'bear_atr_max_pct': 0.07285616460326118, 'bear_tp_mult': 2.514021621369272, 'bear_tsl_mult': 0.49795275792851307, 'bear_time_stop': 199, 'bear_use_sma': False, 'bear_use_ema': True, 'bear_use_atr': False, 'bear_use_adx': False, 'bear_use_spike': False, 'bear_rsi_required': False, 'sideways_strategy': 'mean_reversion', 'sideways_bb_std_mult': 2.7546945042621913, 'sideways_rsi_os': 47, 'sideways_rsi_ob': 81, 'sideways_adx_thresh': 24.993531886186354, 'sideways_atr_min_pct': 0.006423102801026993, 'sideways_atr_max_pct': 0.015382876851131596, 'sideways_tp_mult': 2.2476207797374914, 'sideways_tsl_mult': 0.342835717248336, 'sideways_time_stop': 141, 'sideways_use_sma': True, 'sideways_use_ema': False, 'sideways_use_atr': True, 'sideways_use_adx': True, 'sideways_use_spike': True, 'sideways_rsi_required': True}.
[I 2025-08-31 10:24:19,345] Trial 233 finished with values: [-1000000000.0, 1000000000.0] and parameters: {'p_sma': 15, 'p_std': 26, 'p_atr': 18, 'p_adx': 18, 'rsi_period': 53, 'ema1': 17, 'ema2': 48, 'slip_atr_k': 0.027008161066886673, 'slip_spread_k': 0.7736033251983352, 'spread_hl_frac': 0.046835081482295086, 'bb_std_mult': 0.9584595880546829, 'rsi_os': 28, 'rsi_ob': 76, 'vol_spike': 0.2542250675771347, 'adx_thresh': 28.18958275373488, 'atr_min_pct': 0.01936679944746665, 'atr_max_pct': 0.013712315852262444, 'tp_mult': 2.4151939221597667, 'tsl_mult': 0.5736637510957295, 'strategy': 'breakout', 'time_stop': 226, 'use_sma': True, 'use_atr': True, 'use_adx': False, 'use_ema': False, 'use_spike': False, 'rsi_required': False, 'edge_k': 1.9216129539119466, 'edge_cap': 0.8103968536575951, 'bull_strategy': 'mean_reversion', 'bull_bb_std_mult': 1.8920271837654523, 'bull_rsi_os': 17, 'bull_rsi_ob': 71, 'bull_adx_thresh': 18.850103423455128, 'bull_atr_min_pct': 0.0022021070341201065, 'bull_atr_max_pct': 0.14248966287881001, 'bull_tp_mult': 1.7667109614269183, 'bull_tsl_mult': 0.676202046532292, 'bull_time_stop': 31, 'bull_use_sma': True, 'bull_use_ema': True, 'bull_use_atr': True, 'bull_use_adx': False, 'bull_use_spike': True, 'bull_rsi_required': False, 'bear_strategy': 'mean_reversion', 'bear_bb_std_mult': 0.7196394534448185, 'bear_rsi_os': 39, 'bear_rsi_ob': 68, 'bear_adx_thresh': 20.57166997724217, 'bear_atr_min_pct': 0.022697717469844798, 'bear_atr_max_pct': 0.07935073873221081, 'bear_tp_mult': 2.779118846613481, 'bear_tsl_mult': 0.7601177162838105, 'bear_time_stop': 36, 'bear_use_sma': True, 'bear_use_ema': True, 'bear_use_atr': True, 'bear_use_adx': True, 'bear_use_spike': True, 'bear_rsi_required': False, 'sideways_strategy': 'breakout', 'sideways_bb_std_mult': 2.725536794096554, 'sideways_rsi_os': 20, 'sideways_rsi_ob': 79, 'sideways_adx_thresh': 25.615467742032013, 'sideways_atr_min_pct': 0.0050052168237396544, 'sideways_atr_max_pct': 0.04369360670429705, 'sideways_tp_mult': 1.1894685464326797, 'sideways_tsl_mult': 0.43974569373023803, 'sideways_time_stop': 99, 'sideways_use_sma': False, 'sideways_use_ema': False, 'sideways_use_atr': False, 'sideways_use_adx': True, 'sideways_use_spike': False, 'sideways_rsi_required': False}.
[I 2025-08-31 10:24:49,903] Trial 231 finished with values: [-1000000000.0, 1000000000.0] and parameters: {'p_sma': 15, 'p_std': 26, 'p_atr': 24, 'p_adx': 15, 'rsi_period': 47, 'ema1': 17, 'ema2': 16, 'slip_atr_k': 0.14651682329234664, 'slip_spread_k': 0.37723921876368594, 'spread_hl_frac': 0.0235063132378071, 'bb_std_mult': 0.6535863607542831, 'rsi_os': 28, 'rsi_ob': 77, 'vol_spike': 0.20640345605426888, 'adx_thresh': 29.144527871757784, 'atr_min_pct': 0.0010494977794295417, 'atr_max_pct': 0.11333121894022796, 'tp_mult': 1.0588127122037234, 'tsl_mult': 0.5983729707708999, 'strategy': 'mean_reversion', 'time_stop': 227, 'use_sma': True, 'use_atr': True, 'use_adx': False, 'use_ema': True, 'use_spike': False, 'rsi_required': False, 'edge_k': 1.9252531534040975, 'edge_cap': 0.8082685285388941, 'bull_strategy': 'mean_reversion', 'bull_bb_std_mult': 1.9042318846439572, 'bull_rsi_os': 40, 'bull_rsi_ob': 72, 'bull_adx_thresh': 24.381505752054686, 'bull_atr_min_pct': 0.002604462680371915, 'bull_atr_max_pct': 0.13256440999774116, 'bull_tp_mult': 1.7645622620122703, 'bull_tsl_mult': 0.6737248898770708, 'bull_time_stop': 28, 'bull_use_sma': True, 'bull_use_ema': True, 'bull_use_atr': True, 'bull_use_adx': True, 'bull_use_spike': False, 'bull_rsi_required': False, 'bear_strategy': 'mean_reversion', 'bear_bb_std_mult': 0.9548388752396411, 'bear_rsi_os': 29, 'bear_rsi_ob': 54, 'bear_adx_thresh': 15.271301480837748, 'bear_atr_min_pct': 0.022811166509198594, 'bear_atr_max_pct': 0.13363753666588754, 'bear_tp_mult': 2.6645309834910846, 'bear_tsl_mult': 0.7662350402771307, 'bear_time_stop': 36, 'bear_use_sma': False, 'bear_use_ema': True, 'bear_use_atr': True, 'bear_use_adx': False, 'bear_use_spike': False, 'bear_rsi_required': False, 'sideways_strategy': 'breakout', 'sideways_bb_std_mult': 2.1284880324345354, 'sideways_rsi_os': 18, 'sideways_rsi_ob': 83, 'sideways_adx_thresh': 24.993001044550144, 'sideways_atr_min_pct': 0.005047750071405909, 'sideways_atr_max_pct': 0.04722933460304962, 'sideways_tp_mult': 1.9366045480071383, 'sideways_tsl_mult': 0.977766559019043, 'sideways_time_stop': 36, 'sideways_use_sma': True, 'sideways_use_ema': False, 'sideways_use_atr': True, 'sideways_use_adx': True, 'sideways_use_spike': False, 'sideways_rsi_required': True}.
[I 2025-08-31 10:24:50,187] Trial 232 finished with values: [-1000000000.0, 1000000000.0] and parameters: {'p_sma': 13, 'p_std': 26, 'p_atr': 30, 'p_adx': 17, 'rsi_period': 15, 'ema1': 17, 'ema2': 48, 'slip_atr_k': 0.033692694471864265, 'slip_spread_k': 0.8564685354851429, 'spread_hl_frac': 0.01021043118086772, 'bb_std_mult': 2.1445487073608707, 'rsi_os': 28, 'rsi_ob': 75, 'vol_spike': 0.022746468160870115, 'adx_thresh': 5.841681935420404, 'atr_min_pct': 0.01900321151985726, 'atr_max_pct': 0.11908599882135931, 'tp_mult': 2.418648198966047, 'tsl_mult': 0.6186683258248715, 'strategy': 'breakout', 'time_stop': 61, 'use_sma': True, 'use_atr': True, 'use_adx': False, 'use_ema': True, 'use_spike': False, 'rsi_required': True, 'edge_k': 1.9226925046536254, 'edge_cap': 0.8106157701409835, 'bull_strategy': 'mean_reversion', 'bull_bb_std_mult': 1.8838352953980988, 'bull_rsi_os': 40, 'bull_rsi_ob': 45, 'bull_adx_thresh': 18.964706548234044, 'bull_atr_min_pct': 0.023353861363694328, 'bull_atr_max_pct': 0.07577316433511573, 'bull_tp_mult': 1.3893715715965098, 'bull_tsl_mult': 0.423088266565155, 'bull_time_stop': 53, 'bull_use_sma': True, 'bull_use_ema': False, 'bull_use_atr': False, 'bull_use_adx': True, 'bull_use_spike': False, 'bull_rsi_required': False, 'bear_strategy': 'mean_reversion', 'bear_bb_std_mult': 0.9723890826390863, 'bear_rsi_os': 5, 'bear_rsi_ob': 49, 'bear_adx_thresh': 34.47349717245877, 'bear_atr_min_pct': 0.0034384547083300392, 'bear_atr_max_pct': 0.1337578584221849, 'bear_tp_mult': 1.7384237310283905, 'bear_tsl_mult': 0.7577966273654175, 'bear_time_stop': 299, 'bear_use_sma': True, 'bear_use_ema': True, 'bear_use_atr': True, 'bear_use_adx': False, 'bear_use_spike': False, 'bear_rsi_required': False, 'sideways_strategy': 'mean_reversion', 'sideways_bb_std_mult': 2.721762373964872, 'sideways_rsi_os': 53, 'sideways_rsi_ob': 81, 'sideways_adx_thresh': 25.134820266142153, 'sideways_atr_min_pct': 0.004960936687546526, 'sideways_atr_max_pct': 0.022750297865360918, 'sideways_tp_mult': 1.9397394811385167, 'sideways_tsl_mult': 0.18237302474079953, 'sideways_time_stop': 38, 'sideways_use_sma': False, 'sideways_use_ema': False, 'sideways_use_atr': False, 'sideways_use_adx': True, 'sideways_use_spike': False, 'sideways_rsi_required': True}.
