[I 2025-08-31 11:06:24,575] Trial 560 finished with values: [-0.07156954937664928, 0.07129358678803062] and parameters: {'p_sma': 55, 'p_std': 49, 'p_atr': 11, 'p_adx': 15, 'rsi_period': 79, 'ema1': 13, 'ema2': 54, 'slip_atr_k': 0.008388598039955647, 'slip_spread_k': 0.21745160594739504, 'spread_hl_frac': 0.012189915469476894, 'bb_std_mult': 2.7842147973664253, 'rsi_os': 17, 'rsi_ob': 65, 'vol_spike': 0.07418962678715406, 'adx_thresh': 16.331765201337298, 'atr_min_pct': 0.006142084983160697, 'atr_max_pct': 0.01025963981256868, 'tp_mult': 2.3982795079922177, 'tsl_mult': 0.29260470214373935, 'strategy': 'mean_reversion', 'time_stop': 71, 'use_sma': True, 'use_atr': False, 'use_adx': True, 'use_ema': True, 'use_spike': True, 'rsi_required': True, 'edge_k': 0.31197070367617796, 'edge_cap': 0.3693516039535045, 'bull_strategy': 'mean_reversion', 'bull_bb_std_mult': 2.5127666153025427, 'bull_rsi_os': 12, 'bull_rsi_ob': 75, 'bull_adx_thresh': 6.704730504797302, 'bull_atr_min_pct': 0.006754954132131632, 'bull_atr_max_pct': 0.11143358903133777, 'bull_tp_mult': 1.586411958296023, 'bull_tsl_mult': 0.40837907043682375, 'bull_time_stop': 191, 'bull_use_sma': True, 'bull_use_ema': False, 'bull_use_atr': False, 'bull_use_adx': False, 'bull_use_spike': True, 'bull_rsi_required': True, 'bear_strategy': 'breakout', 'bear_bb_std_mult': 2.5480720487286517, 'bear_rsi_os': 42, 'bear_rsi_ob': 92, 'bear_adx_thresh': 6.5318200047213635, 'bear_atr_min_pct': 0.0015476288501260343, 'bear_atr_max_pct': 0.1400596119510868, 'bear_tp_mult': 2.8307241170052646, 'bear_tsl_mult': 0.1300082904774783, 'bear_time_stop': 37, 'bear_use_sma': True, 'bear_use_ema': True, 'bear_use_atr': False, 'bear_use_adx': False, 'bear_use_spike': True, 'bear_rsi_required': False, 'sideways_strategy': 'mean_reversion', 'sideways_bb_std_mult': 2.9446894228910083, 'sideways_rsi_os': 10, 'sideways_rsi_ob': 86, 'sideways_adx_thresh': 24.01740846200396, 'sideways_atr_min_pct': 0.015509179776090048, 'sideways_atr_max_pct': 0.03560239793944736, 'sideways_tp_mult': 1.9821428021958645, 'sideways_tsl_mult': 0.06237900223151553, 'sideways_time_stop': 104, 'sideways_use_sma': True, 'sideways_use_ema': False, 'sideways_use_atr': True, 'sideways_use_adx': False, 'sideways_use_spike': False, 'sideways_rsi_required': True}.
[I 2025-08-31 11:06:24,576] Trial 559 finished with values: [-0.039800360073072305, 0.039334910440252294] and parameters: {'p_sma': 13, 'p_std': 23, 'p_atr': 11, 'p_adx': 23, 'rsi_period': 52, 'ema1': 13, 'ema2': 19, 'slip_atr_k': 0.008851666527899706, 'slip_spread_k': 0.646869823462006, 'spread_hl_frac': 0.012089999709786439, 'bb_std_mult': 2.785650384803634, 'rsi_os': 28, 'rsi_ob': 85, 'vol_spike': 0.036318829751225856, 'adx_thresh': 28.06911313862743, 'atr_min_pct': 0.005899177652289734, 'atr_max_pct': 0.10770204813606842, 'tp_mult': 2.3815041261856034, 'tsl_mult': 0.36679301149456656, 'strategy': 'mean_reversion', 'time_stop': 71, 'use_sma': True, 'use_atr': False, 'use_adx': True, 'use_ema': False, 'use_spike': False, 'rsi_required': True, 'edge_k': 0.3231088418788407, 'edge_cap': 0.4762364446321871, 'bull_strategy': 'mean_reversion', 'bull_bb_std_mult': 0.9227574393403366, 'bull_rsi_os': 12, 'bull_rsi_ob': 79, 'bull_adx_thresh': 6.695493504654285, 'bull_atr_min_pct': 0.011922170096157649, 'bull_atr_max_pct': 0.11182044532456145, 'bull_tp_mult': 1.523067972114207, 'bull_tsl_mult': 0.3555788094140766, 'bull_time_stop': 70, 'bull_use_sma': True, 'bull_use_ema': False, 'bull_use_atr': False, 'bull_use_adx': False, 'bull_use_spike': True, 'bull_rsi_required': True, 'bear_strategy': 'breakout', 'bear_bb_std_mult': 1.3510945696138705, 'bear_rsi_os': 39, 'bear_rsi_ob': 93, 'bear_adx_thresh': 6.227019595787195, 'bear_atr_min_pct': 0.0007737324711100738, 'bear_atr_max_pct': 0.14005751693188395, 'bear_tp_mult': 2.630657650461332, 'bear_tsl_mult': 0.8369652672503266, 'bear_time_stop': 34, 'bear_use_sma': True, 'bear_use_ema': True, 'bear_use_atr': False, 'bear_use_adx': True, 'bear_use_spike': True, 'bear_rsi_required': True, 'sideways_strategy': 'breakout', 'sideways_bb_std_mult': 2.836581694151197, 'sideways_rsi_os': 7, 'sideways_rsi_ob': 87, 'sideways_adx_thresh': 26.830621813430785, 'sideways_atr_min_pct': 0.0171920387540973, 'sideways_atr_max_pct': 0.043207487234576715, 'sideways_tp_mult': 1.973700808820811, 'sideways_tsl_mult': 0.0569248940716689, 'sideways_time_stop': 254, 'sideways_use_sma': True, 'sideways_use_ema': False, 'sideways_use_atr': True, 'sideways_use_adx': False, 'sideways_use_spike': False, 'sideways_rsi_required': False}.
[I 2025-08-31 11:06:24,855] Trial 557 finished with values: [-0.025837393680344767, 0.025430905710953793] and parameters: {'p_sma': 13, 'p_std': 51, 'p_atr': 11, 'p_adx': 15, 'rsi_period': 50, 'ema1': 14, 'ema2': 55, 'slip_atr_k': 0.00888616042701107, 'slip_spread_k': 0.3826237185859076, 'spread_hl_frac': 0.011514315590124833, 'bb_std_mult': 2.141918223071938, 'rsi_os': 23, 'rsi_ob': 78, 'vol_spike': 0.2717101576372976, 'adx_thresh': 28.430366479750194, 'atr_min_pct': 0.005951447899867646, 'atr_max_pct': 0.08796267224734028, 'tp_mult': 1.923733421998549, 'tsl_mult': 0.2154317907805761, 'strategy': 'mean_reversion', 'time_stop': 74, 'use_sma': True, 'use_atr': True, 'use_adx': False, 'use_ema': False, 'use_spike': False, 'rsi_required': False, 'edge_k': 0.27579455426042565, 'edge_cap': 0.3630810484383739, 'bull_strategy': 'mean_reversion', 'bull_bb_std_mult': 0.9125919759932748, 'bull_rsi_os': 11, 'bull_rsi_ob': 75, 'bull_adx_thresh': 6.704472627568363, 'bull_atr_min_pct': 0.0067941282928928, 'bull_atr_max_pct': 0.017424411979578558, 'bull_tp_mult': 1.5706810537781937, 'bull_tsl_mult': 0.4576628869707113, 'bull_time_stop': 112, 'bull_use_sma': True, 'bull_use_ema': True, 'bull_use_atr': True, 'bull_use_adx': False, 'bull_use_spike': True, 'bull_rsi_required': True, 'bear_strategy': 'breakout', 'bear_bb_std_mult': 0.8581874108331622, 'bear_rsi_os': 42, 'bear_rsi_ob': 82, 'bear_adx_thresh': 6.418952924152064, 'bear_atr_min_pct': 1.596903725181384e-05, 'bear_atr_max_pct': 0.13955132758555822, 'bear_tp_mult': 2.4954056206696187, 'bear_tsl_mult': 0.4980472505079646, 'bear_time_stop': 77, 'bear_use_sma': True, 'bear_use_ema': False, 'bear_use_atr': True, 'bear_use_adx': True, 'bear_use_spike': True, 'bear_rsi_required': True, 'sideways_strategy': 'breakout', 'sideways_bb_std_mult': 2.6961341263953513, 'sideways_rsi_os': 9, 'sideways_rsi_ob': 87, 'sideways_adx_thresh': 28.146806476853893, 'sideways_atr_min_pct': 0.016846733401347836, 'sideways_atr_max_pct': 0.11975906123023683, 'sideways_tp_mult': 1.6691954967986673, 'sideways_tsl_mult': 0.05952359757854232, 'sideways_time_stop': 220, 'sideways_use_sma': True, 'sideways_use_ema': False, 'sideways_use_atr': True, 'sideways_use_adx': True, 'sideways_use_spike': True, 'sideways_rsi_required': False}.
[I 2025-08-31 11:06:58,070] Trial 563 finished with values: [-1000000000.0, 1000000000.0] and parameters: {'p_sma': 15, 'p_std': 53, 'p_atr': 19, 'p_adx': 13, 'rsi_period': 42, 'ema1': 30, 'ema2': 55, 'slip_atr_k': 0.015892756736630095, 'slip_spread_k': 0.998524890482428, 'spread_hl_frac': 0.024184829462469096, 'bb_std_mult': 2.666570912574959, 'rsi_os': 24, 'rsi_ob': 67, 'vol_spike': 0.25465009211127193, 'adx_thresh': 12.810216501898902, 'atr_min_pct': 0.01841616978199216, 'atr_max_pct': 0.13600198177483663, 'tp_mult': 2.072241256280422, 'tsl_mult': 0.23691112924663196, 'strategy': 'breakout', 'time_stop': 78, 'use_sma': True, 'use_atr': False, 'use_adx': True, 'use_ema': True, 'use_spike': True, 'rsi_required': True, 'edge_k': 0.4841885698668248, 'edge_cap': 0.9375717660280876, 'bull_strategy': 'breakout', 'bull_bb_std_mult': 2.9590313052053485, 'bull_rsi_os': 10, 'bull_rsi_ob': 73, 'bull_adx_thresh': 7.416979878514476, 'bull_atr_min_pct': 0.010382269268776969, 'bull_atr_max_pct': 0.010289581134932613, 'bull_tp_mult': 1.9826552745165313, 'bull_tsl_mult': 0.3849281433231063, 'bull_time_stop': 77, 'bull_use_sma': False, 'bull_use_ema': False, 'bull_use_atr': False, 'bull_use_adx': False, 'bull_use_spike': False, 'bull_rsi_required': True, 'bear_strategy': 'breakout', 'bear_bb_std_mult': 2.369658041432139, 'bear_rsi_os': 6, 'bear_rsi_ob': 60, 'bear_adx_thresh': 5.960161627580544, 'bear_atr_min_pct': 0.005387301532846096, 'bear_atr_max_pct': 0.14731442245033508, 'bear_tp_mult': 1.7445889166621105, 'bear_tsl_mult': 0.02219336120479215, 'bear_time_stop': 27, 'bear_use_sma': False, 'bear_use_ema': True, 'bear_use_atr': False, 'bear_use_adx': False, 'bear_use_spike': False, 'bear_rsi_required': False, 'sideways_strategy': 'mean_reversion', 'sideways_bb_std_mult': 2.711820335928124, 'sideways_rsi_os': 29, 'sideways_rsi_ob': 85, 'sideways_adx_thresh': 26.22511890691165, 'sideways_atr_min_pct': 0.01786322045383949, 'sideways_atr_max_pct': 0.02635151413409529, 'sideways_tp_mult': 2.096124364370929, 'sideways_tsl_mult': 0.13058982795351443, 'sideways_time_stop': 32, 'sideways_use_sma': False, 'sideways_use_ema': True, 'sideways_use_atr': False, 'sideways_use_adx': False, 'sideways_use_spike': False, 'sideways_rsi_required': True}.
[I 2025-08-31 11:06:58,475] Trial 562 finished with values: [-1000000000.0, 1000000000.0] and parameters: {'p_sma': 16, 'p_std': 25, 'p_atr': 25, 'p_adx': 13, 'rsi_period': 43, 'ema1': 28, 'ema2': 56, 'slip_atr_k': 0.01550760384427323, 'slip_spread_k': 0.680426509089546, 'spread_hl_frac': 0.010965092513286092, 'bb_std_mult': 1.730882907202278, 'rsi_os': 30, 'rsi_ob': 74, 'vol_spike': 0.2546210884614213, 'adx_thresh': 29.241087542269863, 'atr_min_pct': 0.0066317250621276795, 'atr_max_pct': 0.09486748807082979, 'tp_mult': 2.4241512344216973, 'tsl_mult': 0.2350423688918644, 'strategy': 'breakout', 'time_stop': 82, 'use_sma': True, 'use_atr': False, 'use_adx': True, 'use_ema': True, 'use_spike': True, 'rsi_required': True, 'edge_k': 0.14932301015536623, 'edge_cap': 0.4516887925976447, 'bull_strategy': 'breakout', 'bull_bb_std_mult': 2.343450506655414, 'bull_rsi_os': 10, 'bull_rsi_ob': 73, 'bull_adx_thresh': 33.375673442528864, 'bull_atr_min_pct': 0.0054433085772950165, 'bull_atr_max_pct': 0.08222671247763036, 'bull_tp_mult': 1.9863164778657416, 'bull_tsl_mult': 0.37935632951032444, 'bull_time_stop': 75, 'bull_use_sma': False, 'bull_use_ema': False, 'bull_use_atr': False, 'bull_use_adx': False, 'bull_use_spike': False, 'bull_rsi_required': True, 'bear_strategy': 'breakout', 'bear_bb_std_mult': 2.3761589191648627, 'bear_rsi_os': 18, 'bear_rsi_ob': 87, 'bear_adx_thresh': 5.923250581841746, 'bear_atr_min_pct': 0.005423605324005835, 'bear_atr_max_pct': 0.06563900254138846, 'bear_tp_mult': 1.2644451749185797, 'bear_tsl_mult': 0.5122756361830104, 'bear_time_stop': 25, 'bear_use_sma': False, 'bear_use_ema': True, 'bear_use_atr': False, 'bear_use_adx': False, 'bear_use_spike': False, 'bear_rsi_required': False, 'sideways_strategy': 'mean_reversion', 'sideways_bb_std_mult': 0.6708830290013712, 'sideways_rsi_os': 35, 'sideways_rsi_ob': 85, 'sideways_adx_thresh': 25.960774698904235, 'sideways_atr_min_pct': 0.01735975577944324, 'sideways_atr_max_pct': 0.034787697867829405, 'sideways_tp_mult': 1.674415673374339, 'sideways_tsl_mult': 0.16193996174038883, 'sideways_time_stop': 95, 'sideways_use_sma': False, 'sideways_use_ema': True, 'sideways_use_atr': False, 'sideways_use_adx': False, 'sideways_use_spike': False, 'sideways_rsi_required': True}.
[I 2025-08-31 11:06:58,776] Trial 564 finished with values: [-1000000000.0, 1000000000.0] and parameters: {'p_sma': 20, 'p_std': 53, 'p_atr': 12, 'p_adx': 21, 'rsi_period': 41, 'ema1': 15, 'ema2': 35, 'slip_atr_k': 0.015546482579604948, 'slip_spread_k': 0.6833849897818032, 'spread_hl_frac': 0.010390022079496445, 'bb_std_mult': 2.6795019345680933, 'rsi_os': 30, 'rsi_ob': 76, 'vol_spike': 0.25469837238523496, 'adx_thresh': 29.31363730356148, 'atr_min_pct': 0.006762849123675165, 'atr_max_pct': 0.09309290568990411, 'tp_mult': 2.421037289780335, 'tsl_mult': 0.66415169005948, 'strategy': 'breakout', 'time_stop': 82, 'use_sma': True, 'use_atr': False, 'use_adx': True, 'use_ema': True, 'use_spike': True, 'rsi_required': True, 'edge_k': 0.16599708251100947, 'edge_cap': 0.44834327835937665, 'bull_strategy': 'breakout', 'bull_bb_std_mult': 0.6338482014231874, 'bull_rsi_os': 10, 'bull_rsi_ob': 81, 'bull_adx_thresh': 7.686297741494753, 'bull_atr_min_pct': 0.013093585470971466, 'bull_atr_max_pct': 0.04233760200151218, 'bull_tp_mult': 1.9562653414580309, 'bull_tsl_mult': 0.428959365832096, 'bull_time_stop': 276, 'bull_use_sma': False, 'bull_use_ema': False, 'bull_use_atr': False, 'bull_use_adx': False, 'bull_use_spike': False, 'bull_rsi_required': True, 'bear_strategy': 'breakout', 'bear_bb_std_mult': 2.36070893432362, 'bear_rsi_os': 38, 'bear_rsi_ob': 77, 'bear_adx_thresh': 6.781772092121233, 'bear_atr_min_pct': 0.004170726888366337, 'bear_atr_max_pct': 0.14747897046266525, 'bear_tp_mult': 2.2527262387069094, 'bear_tsl_mult': 0.5203902381659591, 'bear_time_stop': 115, 'bear_use_sma': False, 'bear_use_ema': True, 'bear_use_atr': False, 'bear_use_adx': False, 'bear_use_spike': False, 'bear_rsi_required': False, 'sideways_strategy': 'mean_reversion', 'sideways_bb_std_mult': 2.712936015217194, 'sideways_rsi_os': 46, 'sideways_rsi_ob': 88, 'sideways_adx_thresh': 17.742125378951723, 'sideways_atr_min_pct': 0.027482187330083698, 'sideways_atr_max_pct': 0.026527050605766066, 'sideways_tp_mult': 2.088686275854021, 'sideways_tsl_mult': 0.16355091940006694, 'sideways_time_stop': 169, 'sideways_use_sma': False, 'sideways_use_ema': True, 'sideways_use_atr': False, 'sideways_use_adx': False, 'sideways_use_spike': False, 'sideways_rsi_required': True}.
[I 2025-08-31 11:06:58,903] Trial 561 finished with values: [-1000000000.0, 1000000000.0] and parameters: {'p_sma': 55, 'p_std': 23, 'p_atr': 17, 'p_adx': 13, 'rsi_period': 44, 'ema1': 27, 'ema2': 54, 'slip_atr_k': 0.015534392949558017, 'slip_spread_k': 0.9967032580436875, 'spread_hl_frac': 0.010845965501530754, 'bb_std_mult': 2.6740981445944394, 'rsi_os': 23, 'rsi_ob': 67, 'vol_spike': 0.1605459576898838, 'adx_thresh': 29.138077467561633, 'atr_min_pct': 0.00598790202387884, 'atr_max_pct': 0.09375076184542766, 'tp_mult': 2.3941143028257725, 'tsl_mult': 0.22791642770751055, 'strategy': 'breakout', 'time_stop': 73, 'use_sma': True, 'use_atr': False, 'use_adx': True, 'use_ema': True, 'use_spike': True, 'rsi_required': True, 'edge_k': 0.47792476133932504, 'edge_cap': 0.37216068863712726, 'bull_strategy': 'mean_reversion', 'bull_bb_std_mult': 0.9352667872462186, 'bull_rsi_os': 12, 'bull_rsi_ob': 51, 'bull_adx_thresh': 14.634176863667934, 'bull_atr_min_pct': 0.013109666835915397, 'bull_atr_max_pct': 0.0823778267602722, 'bull_tp_mult': 1.6027583093382614, 'bull_tsl_mult': 0.8676951075350583, 'bull_time_stop': 174, 'bull_use_sma': True, 'bull_use_ema': False, 'bull_use_atr': False, 'bull_use_adx': False, 'bull_use_spike': True, 'bull_rsi_required': True, 'bear_strategy': 'breakout', 'bear_bb_std_mult': 0.810883496310991, 'bear_rsi_os': 42, 'bear_rsi_ob': 93, 'bear_adx_thresh': 5.729181252477101, 'bear_atr_min_pct': 0.010944194290112636, 'bear_atr_max_pct': 0.13880580133727197, 'bear_tp_mult': 2.8291843909276233, 'bear_tsl_mult': 0.955057385527303, 'bear_time_stop': 25, 'bear_use_sma': True, 'bear_use_ema': True, 'bear_use_atr': False, 'bear_use_adx': False, 'bear_use_spike': False, 'bear_rsi_required': False, 'sideways_strategy': 'mean_reversion', 'sideways_bb_std_mult': 2.8248096153736793, 'sideways_rsi_os': 11, 'sideways_rsi_ob': 85, 'sideways_adx_thresh': 32.82193993632488, 'sideways_atr_min_pct': 0.017506407850837357, 'sideways_atr_max_pct': 0.035720253324886646, 'sideways_tp_mult': 1.4456087131262643, 'sideways_tsl_mult': 0.12622161355276718, 'sideways_time_stop': 103, 'sideways_use_sma': False, 'sideways_use_ema': True, 'sideways_use_atr': True, 'sideways_use_adx': False, 'sideways_use_spike': False, 'sideways_rsi_required': True}.
[I 2025-08-31 11:07:30,922] Trial 566 finished with values: [-1000000000.0, 1000000000.0] and parameters: {'p_sma': 20, 'p_std': 58, 'p_atr': 10, 'p_adx': 14, 'rsi_period': 45, 'ema1': 7, 'ema2': 11, 'slip_atr_k': 0.02252721103577815, 'slip_spread_k': 0.3586248532251453, 'spread_hl_frac': 0.009077279223992247, 'bb_std_mult': 2.579887339213015, 'rsi_os': 52, 'rsi_ob': 63, 'vol_spike': 0.2804209943630328, 'adx_thresh': 26.306902057773552, 'atr_min_pct': 0.004478912822382296, 'atr_max_pct': 0.08313650896880861, 'tp_mult': 2.2136695646834927, 'tsl_mult': 0.31826624934499265, 'strategy': 'breakout', 'time_stop': 68, 'use_sma': True, 'use_atr': False, 'use_adx': True, 'use_ema': True, 'use_spike': True, 'rsi_required': True, 'edge_k': 0.18090389675107496, 'edge_cap': 0.6147392089415559, 'bull_strategy': 'breakout', 'bull_bb_std_mult': 0.6245140440598893, 'bull_rsi_os': 12, 'bull_rsi_ob': 87, 'bull_adx_thresh': 8.310096544951538, 'bull_atr_min_pct': 0.00570776262562585, 'bull_atr_max_pct': 0.13038757516653895, 'bull_tp_mult': 2.034078147870904, 'bull_tsl_mult': 0.9753596041829238, 'bull_time_stop': 68, 'bull_use_sma': True, 'bull_use_ema': False, 'bull_use_atr': False, 'bull_use_adx': False, 'bull_use_spike': False, 'bull_rsi_required': False, 'bear_strategy': 'breakout', 'bear_bb_std_mult': 2.0811045395769483, 'bear_rsi_os': 38, 'bear_rsi_ob': 94, 'bear_adx_thresh': 6.833142906869155, 'bear_atr_min_pct': 0.004471638163880766, 'bear_atr_max_pct': 0.11782105876876284, 'bear_tp_mult': 2.410429508768669, 'bear_tsl_mult': 0.44231925318466886, 'bear_time_stop': 45, 'bear_use_sma': False, 'bear_use_ema': True, 'bear_use_atr': False, 'bear_use_adx': False, 'bear_use_spike': True, 'bear_rsi_required': False, 'sideways_strategy': 'mean_reversion', 'sideways_bb_std_mult': 0.9653342097239059, 'sideways_rsi_os': 6, 'sideways_rsi_ob': 88, 'sideways_adx_thresh': 25.385113610394544, 'sideways_atr_min_pct': 0.009698798280815556, 'sideways_atr_max_pct': 0.04659235020616162, 'sideways_tp_mult': 1.1640521087601539, 'sideways_tsl_mult': 0.9515603277642659, 'sideways_time_stop': 19, 'sideways_use_sma': False, 'sideways_use_ema': False, 'sideways_use_atr': False, 'sideways_use_adx': False, 'sideways_use_spike': False, 'sideways_rsi_required': True}.
[I 2025-08-31 11:07:31,082] Trial 567 finished with values: [-1000000000.0, 1000000000.0] and parameters: {'p_sma': 54, 'p_std': 47, 'p_atr': 28, 'p_adx': 12, 'rsi_period': 46, 'ema1': 7, 'ema2': 57, 'slip_atr_k': 0.021899783024253463, 'slip_spread_k': 0.8668541825760918, 'spread_hl_frac': 0.015989455664688873, 'bb_std_mult': 2.59941426255141, 'rsi_os': 50, 'rsi_ob': 94, 'vol_spike': 0.15896217513036398, 'adx_thresh': 18.859275697535836, 'atr_min_pct': 0.026528763095943278, 'atr_max_pct': 0.09656744221171941, 'tp_mult': 1.6669118001423975, 'tsl_mult': 0.9124698988515175, 'strategy': 'breakout', 'time_stop': 68, 'use_sma': True, 'use_atr': False, 'use_adx': True, 'use_ema': True, 'use_spike': True, 'rsi_required': True, 'edge_k': 0.8510810062137706, 'edge_cap': 0.5307350680742398, 'bull_strategy': 'breakout', 'bull_bb_std_mult': 0.7500263308597538, 'bull_rsi_os': 12, 'bull_rsi_ob': 49, 'bull_adx_thresh': 8.19980858466967, 'bull_atr_min_pct': 0.0076396432833418446, 'bull_atr_max_pct': 0.09656426753202911, 'bull_tp_mult': 2.0006511381663326, 'bull_tsl_mult': 0.4025733066896272, 'bull_time_stop': 174, 'bull_use_sma': True, 'bull_use_ema': False, 'bull_use_atr': False, 'bull_use_adx': False, 'bull_use_spike': False, 'bull_rsi_required': False, 'bear_strategy': 'breakout', 'bear_bb_std_mult': 2.012781577717583, 'bear_rsi_os': 29, 'bear_rsi_ob': 94, 'bear_adx_thresh': 5.564369916326214, 'bear_atr_min_pct': 0.013872825255413253, 'bear_atr_max_pct': 0.11719371860745117, 'bear_tp_mult': 2.798902748389156, 'bear_tsl_mult': 0.452343305147665, 'bear_time_stop': 42, 'bear_use_sma': False, 'bear_use_ema': True, 'bear_use_atr': False, 'bear_use_adx': False, 'bear_use_spike': True, 'bear_rsi_required': False, 'sideways_strategy': 'mean_reversion', 'sideways_bb_std_mult': 2.1894304987735818, 'sideways_rsi_os': 6, 'sideways_rsi_ob': 88, 'sideways_adx_thresh': 20.730312213147936, 'sideways_atr_min_pct': 0.010043562647264777, 'sideways_atr_max_pct': 0.06743313761545525, 'sideways_tp_mult': 1.557788421315168, 'sideways_tsl_mult': 0.46032813818263396, 'sideways_time_stop': 74, 'sideways_use_sma': False, 'sideways_use_ema': False, 'sideways_use_atr': False, 'sideways_use_adx': False, 'sideways_use_spike': False, 'sideways_rsi_required': True}.
