[I 2025-08-31 10:00:52,250] Trial 45 finished with values: [-1000000000.0, 1000000000.0] and parameters: {'p_sma': 8, 'p_std': 37, 'p_atr': 14, 'p_adx': 13, 'rsi_period': 75, 'ema1': 26, 'ema2': 24, 'slip_atr_k': 0.13329609436463905, 'slip_spread_k': 0.6131163414567906, 'spread_hl_frac': 0.043482163892111375, 'bb_std_mult': 1.8792275661646702, 'rsi_os': 46, 'rsi_ob': 89, 'vol_spike': 0.29314147081835895, 'adx_thresh': 29.213916509115194, 'atr_min_pct': 0.011068499127607902, 'atr_max_pct': 0.04028660872121852, 'tp_mult': 1.3199514847449136, 'tsl_mult': 0.9478419269576699, 'strategy': 'mean_reversion', 'time_stop': 270, 'use_sma': True, 'use_atr': True, 'use_adx': True, 'use_ema': False, 'use_spike': False, 'rsi_required': True, 'edge_k': 0.49903361416020264, 'edge_cap': 0.8400776446051901, 'bull_strategy': 'breakout', 'bull_bb_std_mult': 0.8932874874893209, 'bull_rsi_os': 19, 'bull_rsi_ob': 69, 'bull_adx_thresh': 22.260854110508408, 'bull_atr_min_pct': 0.0077135088219901695, 'bull_atr_max_pct': 0.06564181082451903, 'bull_tp_mult': 2.0188462247064907, 'bull_tsl_mult': 0.01562850820424444, 'bull_time_stop': 233, 'bull_use_sma': True, 'bull_use_ema': True, 'bull_use_atr': True, 'bull_use_adx': True, 'bull_use_spike': False, 'bull_rsi_required': False, 'bear_strategy': 'mean_reversion', 'bear_bb_std_mult': 2.0891852739715007, 'bear_rsi_os': 36, 'bear_rsi_ob': 55, 'bear_adx_thresh': 34.985355594731665, 'bear_atr_min_pct': 0.01787300462930127, 'bear_atr_max_pct': 0.018970922417870545, 'bear_tp_mult': 1.9070436984053902, 'bear_tsl_mult': 0.28589818617744445, 'bear_time_stop': 235, 'bear_use_sma': True, 'bear_use_ema': False, 'bear_use_atr': True, 'bear_use_adx': True, 'bear_use_spike': True, 'bear_rsi_required': True, 'sideways_strategy': 'breakout', 'sideways_bb_std_mult': 0.5644540415288584, 'sideways_rsi_os': 55, 'sideways_rsi_ob': 68, 'sideways_adx_thresh': 19.728587452428762, 'sideways_atr_min_pct': 0.005550461242750725, 'sideways_atr_max_pct': 0.0717670287680116, 'sideways_tp_mult': 2.7404875833236155, 'sideways_tsl_mult': 0.1344552997866674, 'sideways_time_stop': 209, 'sideways_use_sma': True, 'sideways_use_ema': False, 'sideways_use_atr': False, 'sideways_use_adx': True, 'sideways_use_spike': False, 'sideways_rsi_required': False}.
[I 2025-08-31 10:00:52,829] Trial 47 finished with values: [-1000000000.0, 1000000000.0] and parameters: {'p_sma': 60, 'p_std': 38, 'p_atr': 30, 'p_adx': 17, 'rsi_period': 79, 'ema1': 26, 'ema2': 23, 'slip_atr_k': 0.03322882548104679, 'slip_spread_k': 0.6414640713087425, 'spread_hl_frac': 0.044320638276463306, 'bb_std_mult': 2.1356826761990977, 'rsi_os': 42, 'rsi_ob': 89, 'vol_spike': 0.002695205342263002, 'adx_thresh': 30.55081809221049, 'atr_min_pct': 0.009801228902573391, 'atr_max_pct': 0.06943323643125363, 'tp_mult': 2.868719181528985, 'tsl_mult': 0.46937472712467027, 'strategy': 'mean_reversion', 'time_stop': 271, 'use_sma': True, 'use_atr': False, 'use_adx': True, 'use_ema': False, 'use_spike': False, 'rsi_required': True, 'edge_k': 0.2737660700873037, 'edge_cap': 0.8513055777421734, 'bull_strategy': 'breakout', 'bull_bb_std_mult': 3.035346267570972, 'bull_rsi_os': 43, 'bull_rsi_ob': 69, 'bull_adx_thresh': 28.697303169585002, 'bull_atr_min_pct': 0.00559031060837557, 'bull_atr_max_pct': 0.06783313707210493, 'bull_tp_mult': 2.8888372278294927, 'bull_tsl_mult': 0.2976829009441486, 'bull_time_stop': 235, 'bull_use_sma': False, 'bull_use_ema': False, 'bull_use_atr': True, 'bull_use_adx': True, 'bull_use_spike': False, 'bull_rsi_required': False, 'bear_strategy': 'mean_reversion', 'bear_bb_std_mult': 2.503146865086472, 'bear_rsi_os': 39, 'bear_rsi_ob': 55, 'bear_adx_thresh': 34.08762700283602, 'bear_atr_min_pct': 0.021315971816760794, 'bear_atr_max_pct': 0.018532910480920445, 'bear_tp_mult': 2.0088781003233502, 'bear_tsl_mult': 0.32294382608642336, 'bear_time_stop': 275, 'bear_use_sma': True, 'bear_use_ema': True, 'bear_use_atr': True, 'bear_use_adx': True, 'bear_use_spike': True, 'bear_rsi_required': False, 'sideways_strategy': 'mean_reversion', 'sideways_bb_std_mult': 3.599105993457347, 'sideways_rsi_os': 40, 'sideways_rsi_ob': 80, 'sideways_adx_thresh': 19.2665105700016, 'sideways_atr_min_pct': 0.009333416068409126, 'sideways_atr_max_pct': 0.04322965182470187, 'sideways_tp_mult': 1.4637889182640826, 'sideways_tsl_mult': 0.14822295066828323, 'sideways_time_stop': 140, 'sideways_use_sma': True, 'sideways_use_ema': False, 'sideways_use_atr': False, 'sideways_use_adx': False, 'sideways_use_spike': False, 'sideways_rsi_required': False}.
[I 2025-08-31 10:00:53,081] Trial 46 finished with values: [-1000000000.0, 1000000000.0] and parameters: {'p_sma': 8, 'p_std': 37, 'p_atr': 30, 'p_adx': 29, 'rsi_period': 75, 'ema1': 10, 'ema2': 24, 'slip_atr_k': 0.18930370167723393, 'slip_spread_k': 0.3678514332933642, 'spread_hl_frac': 0.04569879711035522, 'bb_std_mult': 1.884845149983424, 'rsi_os': 46, 'rsi_ob': 91, 'vol_spike': 0.2991459715896214, 'adx_thresh': 32.67153147439215, 'atr_min_pct': 0.012090673483272668, 'atr_max_pct': 0.03382239182499871, 'tp_mult': 2.6482358893954956, 'tsl_mult': 0.9484270868055587, 'strategy': 'mean_reversion', 'time_stop': 266, 'use_sma': True, 'use_atr': False, 'use_adx': True, 'use_ema': False, 'use_spike': False, 'rsi_required': True, 'edge_k': 1.312267307430709, 'edge_cap': 0.11034469641710762, 'bull_strategy': 'breakout', 'bull_bb_std_mult': 0.768865643357461, 'bull_rsi_os': 43, 'bull_rsi_ob': 55, 'bull_adx_thresh': 13.320687414563432, 'bull_atr_min_pct': 0.002015711151232752, 'bull_atr_max_pct': 0.14110581114251347, 'bull_tp_mult': 2.882118758585457, 'bull_tsl_mult': 0.6672811566386736, 'bull_time_stop': 251, 'bull_use_sma': False, 'bull_use_ema': False, 'bull_use_atr': True, 'bull_use_adx': True, 'bull_use_spike': False, 'bull_rsi_required': False, 'bear_strategy': 'mean_reversion', 'bear_bb_std_mult': 2.0670350494070857, 'bear_rsi_os': 9, 'bear_rsi_ob': 55, 'bear_adx_thresh': 34.237222651272106, 'bear_atr_min_pct': 0.021396343165272873, 'bear_atr_max_pct': 0.08633970211454044, 'bear_tp_mult': 2.006444015015229, 'bear_tsl_mult': 0.4368149776000789, 'bear_time_stop': 239, 'bear_use_sma': True, 'bear_use_ema': True, 'bear_use_atr': True, 'bear_use_adx': True, 'bear_use_spike': True, 'bear_rsi_required': False, 'sideways_strategy': 'mean_reversion', 'sideways_bb_std_mult': 0.5734202263515753, 'sideways_rsi_os': 28, 'sideways_rsi_ob': 47, 'sideways_adx_thresh': 11.327200507971817, 'sideways_atr_min_pct': 0.0061476757040253936, 'sideways_atr_max_pct': 0.02333607573387949, 'sideways_tp_mult': 2.6979814146493393, 'sideways_tsl_mult': 0.153089166771659, 'sideways_time_stop': 5, 'sideways_use_sma': True, 'sideways_use_ema': False, 'sideways_use_atr': False, 'sideways_use_adx': False, 'sideways_use_spike': False, 'sideways_rsi_required': False}.
[I 2025-08-31 10:00:53,211] Trial 48 finished with values: [-0.026856386635621843, 0.026742246516007404] and parameters: {'p_sma': 60, 'p_std': 38, 'p_atr': 28, 'p_adx': 12, 'rsi_period': 76, 'ema1': 10, 'ema2': 23, 'slip_atr_k': 0.1892249299963106, 'slip_spread_k': 0.6442711698702456, 'spread_hl_frac': 0.03587957722025931, 'bb_std_mult': 2.900453773719148, 'rsi_os': 9, 'rsi_ob': 89, 'vol_spike': 0.2989318901704643, 'adx_thresh': 31.296699164197175, 'atr_min_pct': 0.01194312586949544, 'atr_max_pct': 0.039947749497479076, 'tp_mult': 2.4243767842654496, 'tsl_mult': 0.41622203247983947, 'strategy': 'mean_reversion', 'time_stop': 276, 'use_sma': True, 'use_atr': False, 'use_adx': True, 'use_ema': False, 'use_spike': False, 'rsi_required': True, 'edge_k': 0.3250499038378104, 'edge_cap': 0.8394109845200328, 'bull_strategy': 'breakout', 'bull_bb_std_mult': 0.8153757012362812, 'bull_rsi_os': 32, 'bull_rsi_ob': 68, 'bull_adx_thresh': 12.973333369397665, 'bull_atr_min_pct': 0.0013896288592742632, 'bull_atr_max_pct': 0.06882969626061591, 'bull_tp_mult': 1.388399373623832, 'bull_tsl_mult': 0.9349066825352748, 'bull_time_stop': 241, 'bull_use_sma': False, 'bull_use_ema': False, 'bull_use_atr': True, 'bull_use_adx': True, 'bull_use_spike': False, 'bull_rsi_required': False, 'bear_strategy': 'mean_reversion', 'bear_bb_std_mult': 2.1084801249278815, 'bear_rsi_os': 8, 'bear_rsi_ob': 55, 'bear_adx_thresh': 34.17503017218938, 'bear_atr_min_pct': 0.02163273676984342, 'bear_atr_max_pct': 0.018861450075911394, 'bear_tp_mult': 2.0752672216102823, 'bear_tsl_mult': 0.08656547282666377, 'bear_time_stop': 238, 'bear_use_sma': True, 'bear_use_ema': True, 'bear_use_atr': True, 'bear_use_adx': True, 'bear_use_spike': True, 'bear_rsi_required': False, 'sideways_strategy': 'mean_reversion', 'sideways_bb_std_mult': 0.5570759063442028, 'sideways_rsi_os': 26, 'sideways_rsi_ob': 47, 'sideways_adx_thresh': 9.896489551355133, 'sideways_atr_min_pct': 0.013296260277996064, 'sideways_atr_max_pct': 0.09249830162662548, 'sideways_tp_mult': 2.6444785870579515, 'sideways_tsl_mult': 0.14705373735094296, 'sideways_time_stop': 142, 'sideways_use_sma': True, 'sideways_use_ema': False, 'sideways_use_atr': False, 'sideways_use_adx': False, 'sideways_use_spike': False, 'sideways_rsi_required': False}.
[I 2025-08-31 10:00:53,453] Trial 49 finished with values: [-1000000000.0, 1000000000.0] and parameters: {'p_sma': 17, 'p_std': 45, 'p_atr': 29, 'p_adx': 29, 'rsi_period': 81, 'ema1': 9, 'ema2': 19, 'slip_atr_k': 0.19082601488834544, 'slip_spread_k': 0.37057119852301756, 'spread_hl_frac': 0.004984866969290202, 'bb_std_mult': 2.8900205200786147, 'rsi_os': 25, 'rsi_ob': 93, 'vol_spike': 0.013261623246576454, 'adx_thresh': 6.824738916677722, 'atr_min_pct': 0.02417926599102356, 'atr_max_pct': 0.021968672957195845, 'tp_mult': 2.4155761743391038, 'tsl_mult': 0.48305794554770354, 'strategy': 'mean_reversion', 'time_stop': 48, 'use_sma': True, 'use_atr': False, 'use_adx': True, 'use_ema': False, 'use_spike': False, 'rsi_required': True, 'edge_k': 1.327644130842049, 'edge_cap': 0.12229216551273303, 'bull_strategy': 'breakout', 'bull_bb_std_mult': 3.5976103449675287, 'bull_rsi_os': 55, 'bull_rsi_ob': 90, 'bull_adx_thresh': 27.462633242429874, 'bull_atr_min_pct': 0.0015044630185335403, 'bull_atr_max_pct': 0.12500336138719526, 'bull_tp_mult': 2.883198530296049, 'bull_tsl_mult': 0.6814387786439804, 'bull_time_stop': 282, 'bull_use_sma': False, 'bull_use_ema': False, 'bull_use_atr': True, 'bull_use_adx': True, 'bull_use_spike': False, 'bull_rsi_required': False, 'bear_strategy': 'mean_reversion', 'bear_bb_std_mult': 2.5220428940537074, 'bear_rsi_os': 23, 'bear_rsi_ob': 69, 'bear_adx_thresh': 30.559003181415846, 'bear_atr_min_pct': 0.02085220971211963, 'bear_atr_max_pct': 0.0969247033418417, 'bear_tp_mult': 1.5717819854889452, 'bear_tsl_mult': 0.44257001110512023, 'bear_time_stop': 279, 'bear_use_sma': True, 'bear_use_ema': True, 'bear_use_atr': True, 'bear_use_adx': True, 'bear_use_spike': True, 'bear_rsi_required': False, 'sideways_strategy': 'mean_reversion', 'sideways_bb_std_mult': 1.6812488428287735, 'sideways_rsi_os': 40, 'sideways_rsi_ob': 47, 'sideways_adx_thresh': 10.581747358336802, 'sideways_atr_min_pct': 0.013074045760921308, 'sideways_atr_max_pct': 0.02187651827635187, 'sideways_tp_mult': 1.435976135215153, 'sideways_tsl_mult': 0.3862021003669764, 'sideways_time_stop': 6, 'sideways_use_sma': True, 'sideways_use_ema': False, 'sideways_use_atr': False, 'sideways_use_adx': False, 'sideways_use_spike': False, 'sideways_rsi_required': False}.
[I 2025-08-31 10:00:53,502] Trial 51 finished with values: [-1000000000.0, 1000000000.0] and parameters: {'p_sma': 17, 'p_std': 44, 'p_atr': 28, 'p_adx': 24, 'rsi_period': 68, 'ema1': 19, 'ema2': 18, 'slip_atr_k': 0.1072742410237598, 'slip_spread_k': 0.7882714022717158, 'spread_hl_frac': 0.03713525354630581, 'bb_std_mult': 0.9419303986770236, 'rsi_os': 26, 'rsi_ob': 93, 'vol_spike': 0.031122084884852408, 'adx_thresh': 25.54606065209481, 'atr_min_pct': 0.024027131157614887, 'atr_max_pct': 0.017182941403265276, 'tp_mult': 2.993283340319611, 'tsl_mult': 0.44350061271649094, 'strategy': 'mean_reversion', 'time_stop': 18, 'use_sma': False, 'use_atr': False, 'use_adx': True, 'use_ema': False, 'use_spike': False, 'rsi_required': True, 'edge_k': 1.4934475475268942, 'edge_cap': 0.5173104492134374, 'bull_strategy': 'breakout', 'bull_bb_std_mult': 2.4283125384876385, 'bull_rsi_os': 55, 'bull_rsi_ob': 89, 'bull_adx_thresh': 15.693331937911092, 'bull_atr_min_pct': 0.0013695925356315326, 'bull_atr_max_pct': 0.12832912200928562, 'bull_tp_mult': 1.2817916014574333, 'bull_tsl_mult': 0.19877576963485594, 'bull_time_stop': 276, 'bull_use_sma': False, 'bull_use_ema': False, 'bull_use_atr': True, 'bull_use_adx': False, 'bull_use_spike': False, 'bull_rsi_required': False, 'bear_strategy': 'mean_reversion', 'bear_bb_std_mult': 0.7775068211035852, 'bear_rsi_os': 42, 'bear_rsi_ob': 48, 'bear_adx_thresh': 18.046917897288495, 'bear_atr_min_pct': 0.024070275724157483, 'bear_atr_max_pct': 0.11489010661888105, 'bear_tp_mult': 2.147330771284335, 'bear_tsl_mult': 0.5756853824822408, 'bear_time_stop': 196, 'bear_use_sma': True, 'bear_use_ema': True, 'bear_use_atr': False, 'bear_use_adx': True, 'bear_use_spike': False, 'bear_rsi_required': False, 'sideways_strategy': 'mean_reversion', 'sideways_bb_std_mult': 1.7946960959678866, 'sideways_rsi_os': 11, 'sideways_rsi_ob': 47, 'sideways_adx_thresh': 26.26454577488493, 'sideways_atr_min_pct': 0.012984882581113983, 'sideways_atr_max_pct': 0.13838729295675328, 'sideways_tp_mult': 1.6692507420231681, 'sideways_tsl_mult': 0.37316763077189313, 'sideways_time_stop': 230, 'sideways_use_sma': True, 'sideways_use_ema': False, 'sideways_use_atr': False, 'sideways_use_adx': False, 'sideways_use_spike': False, 'sideways_rsi_required': False}.
[I 2025-08-31 10:01:22,270] Trial 50 finished with values: [-1000000000.0, 1000000000.0] and parameters: {'p_sma': 8, 'p_std': 47, 'p_atr': 11, 'p_adx': 29, 'rsi_period': 70, 'ema1': 10, 'ema2': 43, 'slip_atr_k': 0.10338416938498717, 'slip_spread_k': 0.38618551556984115, 'spread_hl_frac': 0.0366811245130669, 'bb_std_mult': 2.8790072744882416, 'rsi_os': 9, 'rsi_ob': 93, 'vol_spike': 0.28674459879775277, 'adx_thresh': 7.021784761710421, 'atr_min_pct': 0.013016953676445777, 'atr_max_pct': 0.09270601838102521, 'tp_mult': 1.5731929391440846, 'tsl_mult': 0.4591054525491631, 'strategy': 'mean_reversion', 'time_stop': 45, 'use_sma': True, 'use_atr': False, 'use_adx': True, 'use_ema': False, 'use_spike': False, 'rsi_required': True, 'edge_k': 1.3436886453917993, 'edge_cap': 0.11664332609225789, 'bull_strategy': 'breakout', 'bull_bb_std_mult': 0.6264280222606833, 'bull_rsi_os': 31, 'bull_rsi_ob': 90, 'bull_adx_thresh': 15.76104256099377, 'bull_atr_min_pct': 0.0012900315955771103, 'bull_atr_max_pct': 0.056334280602272246, 'bull_tp_mult': 1.2738685369530982, 'bull_tsl_mult': 0.6926607883133513, 'bull_time_stop': 284, 'bull_use_sma': False, 'bull_use_ema': False, 'bull_use_atr': True, 'bull_use_adx': True, 'bull_use_spike': False, 'bull_rsi_required': False, 'bear_strategy': 'mean_reversion', 'bear_bb_std_mult': 1.0914109234486338, 'bear_rsi_os': 23, 'bear_rsi_ob': 69, 'bear_adx_thresh': 30.67209124674541, 'bear_atr_min_pct': 0.024310018007948655, 'bear_atr_max_pct': 0.1313480218177117, 'bear_tp_mult': 2.8498714674254852, 'bear_tsl_mult': 0.09768511548704895, 'bear_time_stop': 203, 'bear_use_sma': True, 'bear_use_ema': True, 'bear_use_atr': True, 'bear_use_adx': True, 'bear_use_spike': True, 'bear_rsi_required': False, 'sideways_strategy': 'mean_reversion', 'sideways_bb_std_mult': 3.3775956985384874, 'sideways_rsi_os': 27, 'sideways_rsi_ob': 49, 'sideways_adx_thresh': 9.408528811619046, 'sideways_atr_min_pct': 0.013422298280599255, 'sideways_atr_max_pct': 0.14098329411462565, 'sideways_tp_mult': 1.672008660788397, 'sideways_tsl_mult': 0.38192918214909644, 'sideways_time_stop': 227, 'sideways_use_sma': True, 'sideways_use_ema': False, 'sideways_use_atr': False, 'sideways_use_adx': False, 'sideways_use_spike': False, 'sideways_rsi_required': False}.
[I 2025-08-31 10:01:23,631] Trial 52 finished with values: [-1000000000.0, 1000000000.0] and parameters: {'p_sma': 15, 'p_std': 44, 'p_atr': 28, 'p_adx': 24, 'rsi_period': 67, 'ema1': 19, 'ema2': 19, 'slip_atr_k': 0.10574767806487766, 'slip_spread_k': 0.8265202870774075, 'spread_hl_frac': 0.03540236735649194, 'bb_std_mult': 0.7798426841095147, 'rsi_os': 26, 'rsi_ob': 85, 'vol_spike': 0.17826577146876296, 'adx_thresh': 24.141621821324645, 'atr_min_pct': 0.019799252159695968, 'atr_max_pct': 0.02466403710125694, 'tp_mult': 2.2443070426630713, 'tsl_mult': 0.4356530160828667, 'strategy': 'mean_reversion', 'time_stop': 21, 'use_sma': False, 'use_atr': False, 'use_adx': True, 'use_ema': False, 'use_spike': False, 'rsi_required': True, 'edge_k': 1.0701849111599393, 'edge_cap': 0.474323151363683, 'bull_strategy': 'mean_reversion', 'bull_bb_std_mult': 2.4624009085056593, 'bull_rsi_os': 32, 'bull_rsi_ob': 92, 'bull_adx_thresh': 15.648561596618702, 'bull_atr_min_pct': 0.024823538646477218, 'bull_atr_max_pct': 0.057856310888874316, 'bull_tp_mult': 1.360848453459727, 'bull_tsl_mult': 0.19602646040208077, 'bull_time_stop': 275, 'bull_use_sma': True, 'bull_use_ema': False, 'bull_use_atr': True, 'bull_use_adx': False, 'bull_use_spike': False, 'bull_rsi_required': False, 'bear_strategy': 'breakout', 'bear_bb_std_mult': 0.5792106803656949, 'bear_rsi_os': 41, 'bear_rsi_ob': 61, 'bear_adx_thresh': 7.489519329727797, 'bear_atr_min_pct': 0.02445810042097805, 'bear_atr_max_pct': 0.1327222958895563, 'bear_tp_mult': 2.1749581377503326, 'bear_tsl_mult': 0.4655337998257348, 'bear_time_stop': 201, 'bear_use_sma': True, 'bear_use_ema': True, 'bear_use_atr': False, 'bear_use_adx': True, 'bear_use_spike': False, 'bear_rsi_required': False, 'sideways_strategy': 'mean_reversion', 'sideways_bb_std_mult': 1.67966825756909, 'sideways_rsi_os': 11, 'sideways_rsi_ob': 49, 'sideways_adx_thresh': 16.973197709970016, 'sideways_atr_min_pct': 0.024167210706830054, 'sideways_atr_max_pct': 0.1404783536312875, 'sideways_tp_mult': 1.0720406717581659, 'sideways_tsl_mult': 0.38616095415269036, 'sideways_time_stop': 249, 'sideways_use_sma': True, 'sideways_use_ema': True, 'sideways_use_atr': True, 'sideways_use_adx': False, 'sideways_use_spike': False, 'sideways_rsi_required': False}.
[I 2025-08-31 10:01:25,061] Trial 54 finished with values: [-1000000000.0, 1000000000.0] and parameters: {'p_sma': 32, 'p_std': 7, 'p_atr': 11, 'p_adx': 12, 'rsi_period': 64, 'ema1': 6, 'ema2': 55, 'slip_atr_k': 0.13740259536604654, 'slip_spread_k': 0.05384662735098919, 'spread_hl_frac': 0.036870119649639134, 'bb_std_mult': 0.6806616920276727, 'rsi_os': 8, 'rsi_ob': 86, 'vol_spike': 0.24616977929828143, 'adx_thresh': 8.517878069226509, 'atr_min_pct': 0.02860607862162008, 'atr_max_pct': 0.14219450706600478, 'tp_mult': 2.2834813846508943, 'tsl_mult': 0.8136933499869803, 'strategy': 'mean_reversion', 'time_stop': 22, 'use_sma': True, 'use_atr': False, 'use_adx': True, 'use_ema': False, 'use_spike': False, 'rsi_required': True, 'edge_k': 1.0569711314009875, 'edge_cap': 0.08677334759536885, 'bull_strategy': 'mean_reversion', 'bull_bb_std_mult': 3.06104121160984, 'bull_rsi_os': 31, 'bull_rsi_ob': 67, 'bull_adx_thresh': 18.137837147838056, 'bull_atr_min_pct': 0.0137135047843399, 'bull_atr_max_pct': 0.0782671061599225, 'bull_tp_mult': 2.451867308773827, 'bull_tsl_mult': 0.9362310177010783, 'bull_time_stop': 151, 'bull_use_sma': True, 'bull_use_ema': False, 'bull_use_atr': True, 'bull_use_adx': True, 'bull_use_spike': True, 'bull_rsi_required': False, 'bear_strategy': 'breakout', 'bear_bb_std_mult': 1.1500619439536282, 'bear_rsi_os': 29, 'bear_rsi_ob': 61, 'bear_adx_thresh': 33.3307496686092, 'bear_atr_min_pct': 0.023913495215346636, 'bear_atr_max_pct': 0.13405250289593723, 'bear_tp_mult': 2.889574517777536, 'bear_tsl_mult': 0.08007753113336841, 'bear_time_stop': 11, 'bear_use_sma': True, 'bear_use_ema': True, 'bear_use_atr': True, 'bear_use_adx': True, 'bear_use_spike': True, 'bear_rsi_required': False, 'sideways_strategy': 'mean_reversion', 'sideways_bb_std_mult': 3.354902720732066, 'sideways_rsi_os': 35, 'sideways_rsi_ob': 45, 'sideways_adx_thresh': 13.639713245097173, 'sideways_atr_min_pct': 0.0287379623889217, 'sideways_atr_max_pct': 0.09486830328790925, 'sideways_tp_mult': 1.3301103056804424, 'sideways_tsl_mult': 0.26985476861100205, 'sideways_time_stop': 257, 'sideways_use_sma': True, 'sideways_use_ema': True, 'sideways_use_atr': True, 'sideways_use_adx': False, 'sideways_use_spike': False, 'sideways_rsi_required': False}.
