[I 2025-08-31 10:31:54,674] Trial 285 finished with values: [-1000000000.0, 1000000000.0] and parameters: {'p_sma': 28, 'p_std': 39, 'p_atr': 14, 'p_adx': 18, 'rsi_period': 46, 'ema1': 16, 'ema2': 56, 'slip_atr_k': 0.14193390564479053, 'slip_spread_k': 0.6855948864978096, 'spread_hl_frac': 0.014148078601061188, 'bb_std_mult': 0.7277539000836155, 'rsi_os': 27, 'rsi_ob': 63, 'vol_spike': 0.26551220759526223, 'adx_thresh': 13.164693107025176, 'atr_min_pct': 0.005552836823932218, 'atr_max_pct': 0.08952446516272336, 'tp_mult': 1.3496472710396865, 'tsl_mult': 0.5730892024126726, 'strategy': 'breakout', 'time_stop': 223, 'use_sma': True, 'use_atr': True, 'use_adx': False, 'use_ema': True, 'use_spike': False, 'rsi_required': True, 'edge_k': 0.22358215178624818, 'edge_cap': 0.9470341660372477, 'bull_strategy': 'breakout', 'bull_bb_std_mult': 0.8687112215671875, 'bull_rsi_os': 39, 'bull_rsi_ob': 47, 'bull_adx_thresh': 34.023200596606195, 'bull_atr_min_pct': 0.028387240876175987, 'bull_atr_max_pct': 0.13882171015119768, 'bull_tp_mult': 1.6534647056531218, 'bull_tsl_mult': 0.42120922897267726, 'bull_time_stop': 82, 'bull_use_sma': False, 'bull_use_ema': False, 'bull_use_atr': False, 'bull_use_adx': False, 'bull_use_spike': True, 'bull_rsi_required': False, 'bear_strategy': 'mean_reversion', 'bear_bb_std_mult': 1.0444174884012127, 'bear_rsi_os': 38, 'bear_rsi_ob': 68, 'bear_adx_thresh': 14.86377470586925, 'bear_atr_min_pct': 0.001801535279139144, 'bear_atr_max_pct': 0.13041913770316213, 'bear_tp_mult': 2.753004977719363, 'bear_tsl_mult': 0.940407071237207, 'bear_time_stop': 25, 'bear_use_sma': True, 'bear_use_ema': True, 'bear_use_atr': True, 'bear_use_adx': False, 'bear_use_spike': True, 'bear_rsi_required': False, 'sideways_strategy': 'mean_reversion', 'sideways_bb_std_mult': 0.6867452405848773, 'sideways_rsi_os': 36, 'sideways_rsi_ob': 80, 'sideways_adx_thresh': 23.277343979472022, 'sideways_atr_min_pct': 0.026348630853583906, 'sideways_atr_max_pct': 0.14781658111708562, 'sideways_tp_mult': 1.526945726472623, 'sideways_tsl_mult': 0.16295928193566506, 'sideways_time_stop': 11, 'sideways_use_sma': False, 'sideways_use_ema': False, 'sideways_use_atr': False, 'sideways_use_adx': True, 'sideways_use_spike': True, 'sideways_rsi_required': True}.
[I 2025-08-31 10:32:27,064] Trial 291 finished with values: [-1000000000.0, 1000000000.0] and parameters: {'p_sma': 31, 'p_std': 24, 'p_atr': 30, 'p_adx': 17, 'rsi_period': 43, 'ema1': 17, 'ema2': 54, 'slip_atr_k': 0.03349262818655453, 'slip_spread_k': 0.4263489045290685, 'spread_hl_frac': 0.038459034165034656, 'bb_std_mult': 0.5006391649652036, 'rsi_os': 25, 'rsi_ob': 94, 'vol_spike': 0.10078389862091079, 'adx_thresh': 19.976971558546836, 'atr_min_pct': 0.006595882379712566, 'atr_max_pct': 0.03690729541329877, 'tp_mult': 2.0297913194655433, 'tsl_mult': 0.5401211766148961, 'strategy': 'breakout', 'time_stop': 232, 'use_sma': True, 'use_atr': True, 'use_adx': False, 'use_ema': False, 'use_spike': True, 'rsi_required': False, 'edge_k': 1.0069050447330734, 'edge_cap': 0.831521073959039, 'bull_strategy': 'breakout', 'bull_bb_std_mult': 1.4834087305614188, 'bull_rsi_os': 43, 'bull_rsi_ob': 94, 'bull_adx_thresh': 27.871957002627795, 'bull_atr_min_pct': 0.00305385067609679, 'bull_atr_max_pct': 0.1499284909529507, 'bull_tp_mult': 1.744480478425254, 'bull_tsl_mult': 0.9653763978334768, 'bull_time_stop': 90, 'bull_use_sma': True, 'bull_use_ema': True, 'bull_use_atr': True, 'bull_use_adx': True, 'bull_use_spike': True, 'bull_rsi_required': True, 'bear_strategy': 'breakout', 'bear_bb_std_mult': 3.0088170720631027, 'bear_rsi_os': 9, 'bear_rsi_ob': 64, 'bear_adx_thresh': 16.692015380119617, 'bear_atr_min_pct': 0.004491275682179892, 'bear_atr_max_pct': 0.09683795651817043, 'bear_tp_mult': 1.7953342805045487, 'bear_tsl_mult': 0.5863071734546005, 'bear_time_stop': 118, 'bear_use_sma': False, 'bear_use_ema': False, 'bear_use_atr': False, 'bear_use_adx': True, 'bear_use_spike': True, 'bear_rsi_required': True, 'sideways_strategy': 'breakout', 'sideways_bb_std_mult': 2.9250905837607277, 'sideways_rsi_os': 18, 'sideways_rsi_ob': 88, 'sideways_adx_thresh': 24.53929883954629, 'sideways_atr_min_pct': 0.010947159010946218, 'sideways_atr_max_pct': 0.02864200282327231, 'sideways_tp_mult': 2.1292488212196234, 'sideways_tsl_mult': 0.03254963464777281, 'sideways_time_stop': 26, 'sideways_use_sma': False, 'sideways_use_ema': True, 'sideways_use_atr': True, 'sideways_use_adx': False, 'sideways_use_spike': False, 'sideways_rsi_required': False}.
[I 2025-08-31 10:32:27,500] Trial 292 finished with values: [-1000000000.0, 1000000000.0] and parameters: {'p_sma': 46, 'p_std': 26, 'p_atr': 30, 'p_adx': 17, 'rsi_period': 43, 'ema1': 17, 'ema2': 40, 'slip_atr_k': 0.03501717487577119, 'slip_spread_k': 0.41520827368090035, 'spread_hl_frac': 0.03816229817679333, 'bb_std_mult': 2.612884286380999, 'rsi_os': 25, 'rsi_ob': 72, 'vol_spike': 0.26068410075993426, 'adx_thresh': 24.33321030878328, 'atr_min_pct': 0.00646827497820592, 'atr_max_pct': 0.09899661424406013, 'tp_mult': 2.822606641097464, 'tsl_mult': 0.5434194296852144, 'strategy': 'breakout', 'time_stop': 234, 'use_sma': True, 'use_atr': True, 'use_adx': False, 'use_ema': False, 'use_spike': True, 'rsi_required': False, 'edge_k': 0.10564635490647667, 'edge_cap': 0.8226182178781024, 'bull_strategy': 'breakout', 'bull_bb_std_mult': 1.3510538831403769, 'bull_rsi_os': 47, 'bull_rsi_ob': 71, 'bull_adx_thresh': 24.28060317523724, 'bull_atr_min_pct': 0.003131946728320551, 'bull_atr_max_pct': 0.0618327586260802, 'bull_tp_mult': 1.758882806073326, 'bull_tsl_mult': 0.9598672836981146, 'bull_time_stop': 92, 'bull_use_sma': True, 'bull_use_ema': True, 'bull_use_atr': True, 'bull_use_adx': True, 'bull_use_spike': True, 'bull_rsi_required': True, 'bear_strategy': 'breakout', 'bear_bb_std_mult': 0.8236814111639297, 'bear_rsi_os': 10, 'bear_rsi_ob': 84, 'bear_adx_thresh': 16.749378922498508, 'bear_atr_min_pct': 0.004767562943102279, 'bear_atr_max_pct': 0.0854869045696114, 'bear_tp_mult': 2.839104114999294, 'bear_tsl_mult': 0.6347077441548435, 'bear_time_stop': 42, 'bear_use_sma': False, 'bear_use_ema': False, 'bear_use_atr': False, 'bear_use_adx': True, 'bear_use_spike': True, 'bear_rsi_required': True, 'sideways_strategy': 'breakout', 'sideways_bb_std_mult': 3.045723863958942, 'sideways_rsi_os': 18, 'sideways_rsi_ob': 88, 'sideways_adx_thresh': 22.16497365696852, 'sideways_atr_min_pct': 0.005627008549466711, 'sideways_atr_max_pct': 0.028458093420380685, 'sideways_tp_mult': 2.95464728799171, 'sideways_tsl_mult': 0.2456934824757479, 'sideways_time_stop': 85, 'sideways_use_sma': False, 'sideways_use_ema': True, 'sideways_use_atr': True, 'sideways_use_adx': False, 'sideways_use_spike': False, 'sideways_rsi_required': False}.
[I 2025-08-31 10:32:27,651] Trial 290 finished with values: [-0.035240545340458396, 0.035088213714804146] and parameters: {'p_sma': 29, 'p_std': 26, 'p_atr': 25, 'p_adx': 17, 'rsi_period': 43, 'ema1': 7, 'ema2': 41, 'slip_atr_k': 0.03479002373183519, 'slip_spread_k': 0.2900425440106246, 'spread_hl_frac': 0.010893943575467253, 'bb_std_mult': 0.7203558389964533, 'rsi_os': 25, 'rsi_ob': 72, 'vol_spike': 0.26478839536150345, 'adx_thresh': 27.607428347047275, 'atr_min_pct': 0.008033476676411213, 'atr_max_pct': 0.03226485488913211, 'tp_mult': 2.004357871513075, 'tsl_mult': 0.6282986025743097, 'strategy': 'breakout', 'time_stop': 234, 'use_sma': True, 'use_atr': True, 'use_adx': False, 'use_ema': False, 'use_spike': True, 'rsi_required': False, 'edge_k': 0.11839347394805345, 'edge_cap': 0.2364312038260739, 'bull_strategy': 'breakout', 'bull_bb_std_mult': 1.022986560310388, 'bull_rsi_os': 44, 'bull_rsi_ob': 74, 'bull_adx_thresh': 11.229286320637026, 'bull_atr_min_pct': 0.001253555532385861, 'bull_atr_max_pct': 0.14415784297397075, 'bull_tp_mult': 1.7471645448515696, 'bull_tsl_mult': 0.963633489435609, 'bull_time_stop': 235, 'bull_use_sma': True, 'bull_use_ema': True, 'bull_use_atr': True, 'bull_use_adx': False, 'bull_use_spike': True, 'bull_rsi_required': True, 'bear_strategy': 'breakout', 'bear_bb_std_mult': 0.9246890300390622, 'bear_rsi_os': 36, 'bear_rsi_ob': 69, 'bear_adx_thresh': 27.22638084160472, 'bear_atr_min_pct': 0.004659197344920194, 'bear_atr_max_pct': 0.01838726642059771, 'bear_tp_mult': 2.7471049798781433, 'bear_tsl_mult': 0.5579756143545612, 'bear_time_stop': 54, 'bear_use_sma': False, 'bear_use_ema': False, 'bear_use_atr': False, 'bear_use_adx': True, 'bear_use_spike': False, 'bear_rsi_required': True, 'sideways_strategy': 'breakout', 'sideways_bb_std_mult': 3.053022834841966, 'sideways_rsi_os': 15, 'sideways_rsi_ob': 80, 'sideways_adx_thresh': 30.874998971696044, 'sideways_atr_min_pct': 0.005615758526741775, 'sideways_atr_max_pct': 0.04044877541554302, 'sideways_tp_mult': 1.9093975079747465, 'sideways_tsl_mult': 0.2599108082234903, 'sideways_time_stop': 27, 'sideways_use_sma': False, 'sideways_use_ema': True, 'sideways_use_atr': False, 'sideways_use_adx': True, 'sideways_use_spike': True, 'sideways_rsi_required': False}.
[I 2025-08-31 10:32:27,831] Trial 289 finished with values: [-0.027473134195331705, 0.027275639880399594] and parameters: {'p_sma': 23, 'p_std': 24, 'p_atr': 14, 'p_adx': 17, 'rsi_period': 46, 'ema1': 7, 'ema2': 52, 'slip_atr_k': 0.19417939548892277, 'slip_spread_k': 0.6202172990420292, 'spread_hl_frac': 0.038118282233907876, 'bb_std_mult': 0.500583346049797, 'rsi_os': 25, 'rsi_ob': 61, 'vol_spike': 0.1004322930115859, 'adx_thresh': 27.544689532226037, 'atr_min_pct': 0.0065115105145878635, 'atr_max_pct': 0.03573694044496098, 'tp_mult': 2.0170112697219342, 'tsl_mult': 0.6256338977433391, 'strategy': 'breakout', 'time_stop': 235, 'use_sma': True, 'use_atr': True, 'use_adx': False, 'use_ema': False, 'use_spike': True, 'rsi_required': False, 'edge_k': 0.08966934954560335, 'edge_cap': 0.8249820143060386, 'bull_strategy': 'breakout', 'bull_bb_std_mult': 0.9975387394356351, 'bull_rsi_os': 43, 'bull_rsi_ob': 47, 'bull_adx_thresh': 24.411159239199684, 'bull_atr_min_pct': 0.001208788798845394, 'bull_atr_max_pct': 0.0889536421145702, 'bull_tp_mult': 1.7286756134497774, 'bull_tsl_mult': 0.9612056686156947, 'bull_time_stop': 140, 'bull_use_sma': True, 'bull_use_ema': True, 'bull_use_atr': True, 'bull_use_adx': False, 'bull_use_spike': True, 'bull_rsi_required': True, 'bear_strategy': 'breakout', 'bear_bb_std_mult': 0.9089025022047835, 'bear_rsi_os': 10, 'bear_rsi_ob': 64, 'bear_adx_thresh': 24.03115190724593, 'bear_atr_min_pct': 0.004429799863763487, 'bear_atr_max_pct': 0.08534235097135107, 'bear_tp_mult': 2.8399768673918895, 'bear_tsl_mult': 0.8822760311954505, 'bear_time_stop': 52, 'bear_use_sma': False, 'bear_use_ema': False, 'bear_use_atr': False, 'bear_use_adx': True, 'bear_use_spike': False, 'bear_rsi_required': True, 'sideways_strategy': 'breakout', 'sideways_bb_std_mult': 2.9217372433016715, 'sideways_rsi_os': 18, 'sideways_rsi_ob': 80, 'sideways_adx_thresh': 23.430090278653044, 'sideways_atr_min_pct': 0.005701419283996963, 'sideways_atr_max_pct': 0.0830835171523547, 'sideways_tp_mult': 2.7417139254217346, 'sideways_tsl_mult': 0.03282882047163453, 'sideways_time_stop': 73, 'sideways_use_sma': False, 'sideways_use_ema': True, 'sideways_use_atr': False, 'sideways_use_adx': True, 'sideways_use_spike': True, 'sideways_rsi_required': False}.
[I 2025-08-31 10:32:59,592] Trial 295 finished with values: [-1000000000.0, 1000000000.0] and parameters: {'p_sma': 9, 'p_std': 25, 'p_atr': 29, 'p_adx': 18, 'rsi_period': 65, 'ema1': 20, 'ema2': 29, 'slip_atr_k': 0.02616413419850724, 'slip_spread_k': 0.6213776062562316, 'spread_hl_frac': 0.047569203767075914, 'bb_std_mult': 1.4008830189483066, 'rsi_os': 28, 'rsi_ob': 73, 'vol_spike': 0.2719659157751481, 'adx_thresh': 29.728844903943227, 'atr_min_pct': 0.004772114216866345, 'atr_max_pct': 0.09338601748242756, 'tp_mult': 2.506798311392564, 'tsl_mult': 0.605063878071582, 'strategy': 'breakout', 'time_stop': 291, 'use_sma': False, 'use_atr': True, 'use_adx': False, 'use_ema': True, 'use_spike': True, 'rsi_required': False, 'edge_k': 0.1714691182615724, 'edge_cap': 0.867677199455034, 'bull_strategy': 'mean_reversion', 'bull_bb_std_mult': 0.8187453115452632, 'bull_rsi_os': 37, 'bull_rsi_ob': 59, 'bull_adx_thresh': 25.098525632959984, 'bull_atr_min_pct': 0.013904271538546845, 'bull_atr_max_pct': 0.1431455635750363, 'bull_tp_mult': 1.7041047657108337, 'bull_tsl_mult': 0.4563484491652303, 'bull_time_stop': 143, 'bull_use_sma': True, 'bull_use_ema': True, 'bull_use_atr': True, 'bull_use_adx': False, 'bull_use_spike': False, 'bull_rsi_required': True, 'bear_strategy': 'mean_reversion', 'bear_bb_std_mult': 1.3207504004942279, 'bear_rsi_os': 39, 'bear_rsi_ob': 48, 'bear_adx_thresh': 15.938433140835741, 'bear_atr_min_pct': 0.02901469162625353, 'bear_atr_max_pct': 0.08312121004658901, 'bear_tp_mult': 2.7956521653660946, 'bear_tsl_mult': 0.5278793953567098, 'bear_time_stop': 258, 'bear_use_sma': False, 'bear_use_ema': True, 'bear_use_atr': True, 'bear_use_adx': False, 'bear_use_spike': True, 'bear_rsi_required': False, 'sideways_strategy': 'breakout', 'sideways_bb_std_mult': 1.0678549884723472, 'sideways_rsi_os': 13, 'sideways_rsi_ob': 77, 'sideways_adx_thresh': 6.4285632996481965, 'sideways_atr_min_pct': 0.0021634396678342238, 'sideways_atr_max_pct': 0.031397126821226, 'sideways_tp_mult': 2.027703618245913, 'sideways_tsl_mult': 0.43266622105844393, 'sideways_time_stop': 57, 'sideways_use_sma': False, 'sideways_use_ema': False, 'sideways_use_atr': False, 'sideways_use_adx': True, 'sideways_use_spike': True, 'sideways_rsi_required': True}.
[I 2025-08-31 10:33:00,073] Trial 296 finished with values: [-1000000000.0, 1000000000.0] and parameters: {'p_sma': 17, 'p_std': 6, 'p_atr': 22, 'p_adx': 18, 'rsi_period': 39, 'ema1': 28, 'ema2': 55, 'slip_atr_k': 0.12251564031035642, 'slip_spread_k': 0.6602084701004407, 'spread_hl_frac': 0.041765726926073485, 'bb_std_mult': 0.7962300696707415, 'rsi_os': 28, 'rsi_ob': 52, 'vol_spike': 0.29659306493568105, 'adx_thresh': 8.222426250387013, 'atr_min_pct': 0.004282957850356168, 'atr_max_pct': 0.09398224468948227, 'tp_mult': 2.403867591167247, 'tsl_mult': 0.5945777173819657, 'strategy': 'breakout', 'time_stop': 242, 'use_sma': False, 'use_atr': True, 'use_adx': False, 'use_ema': True, 'use_spike': True, 'rsi_required': False, 'edge_k': 0.532357792172132, 'edge_cap': 0.6557350802745808, 'bull_strategy': 'mean_reversion', 'bull_bb_std_mult': 2.995084673295139, 'bull_rsi_os': 42, 'bull_rsi_ob': 73, 'bull_adx_thresh': 14.48679550689895, 'bull_atr_min_pct': 0.01411567892907702, 'bull_atr_max_pct': 0.040026878120656265, 'bull_tp_mult': 1.5993051221712877, 'bull_tsl_mult': 0.9994790132033399, 'bull_time_stop': 73, 'bull_use_sma': True, 'bull_use_ema': True, 'bull_use_atr': False, 'bull_use_adx': False, 'bull_use_spike': False, 'bull_rsi_required': False, 'bear_strategy': 'mean_reversion', 'bear_bb_std_mult': 1.314071935804649, 'bear_rsi_os': 30, 'bear_rsi_ob': 71, 'bear_adx_thresh': 15.90454468398567, 'bear_atr_min_pct': 0.003921960670264965, 'bear_atr_max_pct': 0.08122884108645503, 'bear_tp_mult': 2.8130495808269163, 'bear_tsl_mult': 0.47127332669518074, 'bear_time_stop': 156, 'bear_use_sma': False, 'bear_use_ema': True, 'bear_use_atr': True, 'bear_use_adx': False, 'bear_use_spike': True, 'bear_rsi_required': False, 'sideways_strategy': 'breakout', 'sideways_bb_std_mult': 3.5054410886130647, 'sideways_rsi_os': 19, 'sideways_rsi_ob': 59, 'sideways_adx_thresh': 24.078856991283928, 'sideways_atr_min_pct': 0.006878863642241304, 'sideways_atr_max_pct': 0.06734686397733348, 'sideways_tp_mult': 2.038092577372403, 'sideways_tsl_mult': 0.05470886506912209, 'sideways_time_stop': 103, 'sideways_use_sma': False, 'sideways_use_ema': False, 'sideways_use_atr': False, 'sideways_use_adx': True, 'sideways_use_spike': True, 'sideways_rsi_required': True}.
[I 2025-08-31 10:33:00,122] Trial 294 finished with values: [-1000000000.0, 1000000000.0] and parameters: {'p_sma': 23, 'p_std': 24, 'p_atr': 29, 'p_adx': 18, 'rsi_period': 41, 'ema1': 27, 'ema2': 55, 'slip_atr_k': 0.19498953888613113, 'slip_spread_k': 0.5355092327717963, 'spread_hl_frac': 0.04218527582778692, 'bb_std_mult': 0.8052851912634231, 'rsi_os': 25, 'rsi_ob': 73, 'vol_spike': 0.271342124956553, 'adx_thresh': 22.159143291571667, 'atr_min_pct': 0.013538459767036505, 'atr_max_pct': 0.06181846020763619, 'tp_mult': 1.895913570028287, 'tsl_mult': 0.6259946074613993, 'strategy': 'breakout', 'time_stop': 238, 'use_sma': False, 'use_atr': True, 'use_adx': False, 'use_ema': True, 'use_spike': True, 'rsi_required': False, 'edge_k': 1.6831331302668868, 'edge_cap': 0.8721647328562788, 'bull_strategy': 'mean_reversion', 'bull_bb_std_mult': 0.8117705515927996, 'bull_rsi_os': 42, 'bull_rsi_ob': 52, 'bull_adx_thresh': 16.51032983153694, 'bull_atr_min_pct': 0.02234593637159569, 'bull_atr_max_pct': 0.14434799640201287, 'bull_tp_mult': 1.592520279994975, 'bull_tsl_mult': 0.3687455101738937, 'bull_time_stop': 74, 'bull_use_sma': True, 'bull_use_ema': True, 'bull_use_atr': True, 'bull_use_adx': False, 'bull_use_spike': False, 'bull_rsi_required': True, 'bear_strategy': 'breakout', 'bear_bb_std_mult': 0.8910244479307635, 'bear_rsi_os': 52, 'bear_rsi_ob': 71, 'bear_adx_thresh': 15.971515954703142, 'bear_atr_min_pct': 0.0041709372225664535, 'bear_atr_max_pct': 0.08192801369788891, 'bear_tp_mult': 2.795923804470923, 'bear_tsl_mult': 0.5642832925276154, 'bear_time_stop': 256, 'bear_use_sma': False, 'bear_use_ema': True, 'bear_use_atr': False, 'bear_use_adx': False, 'bear_use_spike': False, 'bear_rsi_required': False, 'sideways_strategy': 'breakout', 'sideways_bb_std_mult': 2.8628856533163267, 'sideways_rsi_os': 19, 'sideways_rsi_ob': 77, 'sideways_adx_thresh': 8.873535140838484, 'sideways_atr_min_pct': 0.0029632516787803116, 'sideways_atr_max_pct': 0.04008334221696955, 'sideways_tp_mult': 1.9179540797030352, 'sideways_tsl_mult': 0.05468008049926705, 'sideways_time_stop': 204, 'sideways_use_sma': False, 'sideways_use_ema': False, 'sideways_use_atr': False, 'sideways_use_adx': True, 'sideways_use_spike': True, 'sideways_rsi_required': True}.
[I 2025-08-31 10:33:00,367] Trial 293 finished with values: [-1000000000.0, 1000000000.0] and parameters: {'p_sma': 9, 'p_std': 59, 'p_atr': 30, 'p_adx': 18, 'rsi_period': 42, 'ema1': 15, 'ema2': 43, 'slip_atr_k': 0.004545766141435079, 'slip_spread_k': 0.6240735655374248, 'spread_hl_frac': 0.030939091317718482, 'bb_std_mult': 2.2778379006959675, 'rsi_os': 25, 'rsi_ob': 73, 'vol_spike': 0.26069481162959357, 'adx_thresh': 9.272975187801574, 'atr_min_pct': 0.004771958474116651, 'atr_max_pct': 0.0987341889901236, 'tp_mult': 2.8044232382625705, 'tsl_mult': 0.7181369288272201, 'strategy': 'breakout', 'time_stop': 236, 'use_sma': True, 'use_atr': True, 'use_adx': False, 'use_ema': False, 'use_spike': True, 'rsi_required': False, 'edge_k': 0.10827107855575742, 'edge_cap': 0.8619581541420552, 'bull_strategy': 'breakout', 'bull_bb_std_mult': 1.3351685838857827, 'bull_rsi_os': 42, 'bull_rsi_ob': 71, 'bull_adx_thresh': 14.466696090807513, 'bull_atr_min_pct': 0.014123560041511694, 'bull_atr_max_pct': 0.04025932976966008, 'bull_tp_mult': 1.7772618711343473, 'bull_tsl_mult': 0.3280691803615175, 'bull_time_stop': 75, 'bull_use_sma': True, 'bull_use_ema': True, 'bull_use_atr': True, 'bull_use_adx': False, 'bull_use_spike': False, 'bull_rsi_required': True, 'bear_strategy': 'breakout', 'bear_bb_std_mult': 0.9227758621625104, 'bear_rsi_os': 52, 'bear_rsi_ob': 71, 'bear_adx_thresh': 24.17460652568128, 'bear_atr_min_pct': 0.00478570450665802, 'bear_atr_max_pct': 0.08147274262129076, 'bear_tp_mult': 2.839855688784679, 'bear_tsl_mult': 0.5623439411160223, 'bear_time_stop': 258, 'bear_use_sma': False, 'bear_use_ema': False, 'bear_use_atr': False, 'bear_use_adx': True, 'bear_use_spike': True, 'bear_rsi_required': False, 'sideways_strategy': 'breakout', 'sideways_bb_std_mult': 2.7745767255421296, 'sideways_rsi_os': 19, 'sideways_rsi_ob': 77, 'sideways_adx_thresh': 22.090653331165814, 'sideways_atr_min_pct': 0.00561082057433991, 'sideways_atr_max_pct': 0.04118124631187281, 'sideways_tp_mult': 1.9168771415912491, 'sideways_tsl_mult': 0.25644064226721275, 'sideways_time_stop': 5, 'sideways_use_sma': False, 'sideways_use_ema': True, 'sideways_use_atr': False, 'sideways_use_adx': True, 'sideways_use_spike': True, 'sideways_rsi_required': False}.
