[I 2025-08-31 10:37:51,918] Trial 332 finished with values: [-1000000000.0, 1000000000.0] and parameters: {'p_sma': 15, 'p_std': 34, 'p_atr': 12, 'p_adx': 13, 'rsi_period': 50, 'ema1': 13, 'ema2': 57, 'slip_atr_k': 0.021435027281345904, 'slip_spread_k': 0.6787420253681092, 'spread_hl_frac': 0.009771347738180449, 'bb_std_mult': 2.424323731030817, 'rsi_os': 26, 'rsi_ob': 79, 'vol_spike': 0.2617998143892921, 'adx_thresh': 26.236016529003326, 'atr_min_pct': 0.006155231479668463, 'atr_max_pct': 0.1039458183822998, 'tp_mult': 2.4049896201054315, 'tsl_mult': 0.2735361762312402, 'strategy': 'breakout', 'time_stop': 86, 'use_sma': True, 'use_atr': False, 'use_adx': True, 'use_ema': False, 'use_spike': True, 'rsi_required': True, 'edge_k': 0.2369067549118718, 'edge_cap': 0.44106990990581413, 'bull_strategy': 'breakout', 'bull_bb_std_mult': 0.7362724643311691, 'bull_rsi_os': 9, 'bull_rsi_ob': 74, 'bull_adx_thresh': 7.485359168420341, 'bull_atr_min_pct': 0.00545729389745243, 'bull_atr_max_pct': 0.09940598448781375, 'bull_tp_mult': 1.7733888910618294, 'bull_tsl_mult': 0.35975692775476653, 'bull_time_stop': 239, 'bull_use_sma': True, 'bull_use_ema': False, 'bull_use_atr': False, 'bull_use_adx': False, 'bull_use_spike': False, 'bull_rsi_required': True, 'bear_strategy': 'breakout', 'bear_bb_std_mult': 1.861341186265494, 'bear_rsi_os': 41, 'bear_rsi_ob': 92, 'bear_adx_thresh': 5.088650672846699, 'bear_atr_min_pct': 0.008585388459057559, 'bear_atr_max_pct': 0.14632325763689094, 'bear_tp_mult': 1.9641711610549852, 'bear_tsl_mult': 0.5053250258432563, 'bear_time_stop': 15, 'bear_use_sma': False, 'bear_use_ema': False, 'bear_use_atr': False, 'bear_use_adx': True, 'bear_use_spike': True, 'bear_rsi_required': False, 'sideways_strategy': 'mean_reversion', 'sideways_bb_std_mult': 2.6197597779229516, 'sideways_rsi_os': 7, 'sideways_rsi_ob': 94, 'sideways_adx_thresh': 25.942163777271738, 'sideways_atr_min_pct': 0.01942557548456647, 'sideways_atr_max_pct': 0.05896590196044763, 'sideways_tp_mult': 2.78768272333457, 'sideways_tsl_mult': 0.10824470050255501, 'sideways_time_stop': 24, 'sideways_use_sma': False, 'sideways_use_ema': True, 'sideways_use_atr': False, 'sideways_use_adx': False, 'sideways_use_spike': False, 'sideways_rsi_required': True}.
[I 2025-08-31 10:38:23,227] Trial 335 finished with values: [-1000000000.0, 1000000000.0] and parameters: {'p_sma': 14, 'p_std': 33, 'p_atr': 11, 'p_adx': 14, 'rsi_period': 48, 'ema1': 13, 'ema2': 15, 'slip_atr_k': 0.18827043086076573, 'slip_spread_k': 0.7788498801369663, 'spread_hl_frac': 0.010011781600547392, 'bb_std_mult': 2.8888721202024845, 'rsi_os': 24, 'rsi_ob': 77, 'vol_spike': 0.26014947062934773, 'adx_thresh': 27.262590216222087, 'atr_min_pct': 0.007583805016821743, 'atr_max_pct': 0.10248181257510364, 'tp_mult': 1.9331014051349804, 'tsl_mult': 0.255941934653769, 'strategy': 'breakout', 'time_stop': 49, 'use_sma': True, 'use_atr': False, 'use_adx': True, 'use_ema': False, 'use_spike': True, 'rsi_required': True, 'edge_k': 0.20266487819786053, 'edge_cap': 0.4532288279694026, 'bull_strategy': 'breakout', 'bull_bb_std_mult': 0.6358045669659388, 'bull_rsi_os': 10, 'bull_rsi_ob': 74, 'bull_adx_thresh': 7.322868485700889, 'bull_atr_min_pct': 0.004917553151207669, 'bull_atr_max_pct': 0.08299817388559956, 'bull_tp_mult': 1.8506560584540832, 'bull_tsl_mult': 0.369993307732184, 'bull_time_stop': 206, 'bull_use_sma': True, 'bull_use_ema': False, 'bull_use_atr': False, 'bull_use_adx': True, 'bull_use_spike': False, 'bull_rsi_required': True, 'bear_strategy': 'breakout', 'bear_bb_std_mult': 1.6436631541092102, 'bear_rsi_os': 41, 'bear_rsi_ob': 90, 'bear_adx_thresh': 6.280692567652572, 'bear_atr_min_pct': 0.009844167882247757, 'bear_atr_max_pct': 0.14997084291937102, 'bear_tp_mult': 2.8169878421623595, 'bear_tsl_mult': 0.5259649205369668, 'bear_time_stop': 21, 'bear_use_sma': False, 'bear_use_ema': True, 'bear_use_atr': False, 'bear_use_adx': True, 'bear_use_spike': True, 'bear_rsi_required': False, 'sideways_strategy': 'mean_reversion', 'sideways_bb_std_mult': 2.5444774791990215, 'sideways_rsi_os': 8, 'sideways_rsi_ob': 95, 'sideways_adx_thresh': 25.71423197718614, 'sideways_atr_min_pct': 0.01936870753400353, 'sideways_atr_max_pct': 0.05901096949795056, 'sideways_tp_mult': 2.2849228390794867, 'sideways_tsl_mult': 0.10195136077096861, 'sideways_time_stop': 13, 'sideways_use_sma': False, 'sideways_use_ema': False, 'sideways_use_atr': False, 'sideways_use_adx': False, 'sideways_use_spike': False, 'sideways_rsi_required': True}.
[I 2025-08-31 10:38:23,722] Trial 334 finished with values: [-0.09567006473108719, 0.09552010908780537] and parameters: {'p_sma': 60, 'p_std': 34, 'p_atr': 11, 'p_adx': 13, 'rsi_period': 51, 'ema1': 13, 'ema2': 57, 'slip_atr_k': 0.021852937569176355, 'slip_spread_k': 0.6665964494957297, 'spread_hl_frac': 0.0096947804854223, 'bb_std_mult': 2.8717941779202336, 'rsi_os': 48, 'rsi_ob': 79, 'vol_spike': 0.2491553177822925, 'adx_thresh': 28.31092135496843, 'atr_min_pct': 0.00643320862268665, 'atr_max_pct': 0.09583285916141981, 'tp_mult': 2.3717628458940156, 'tsl_mult': 0.20263564244125112, 'strategy': 'breakout', 'time_stop': 49, 'use_sma': True, 'use_atr': False, 'use_adx': True, 'use_ema': False, 'use_spike': True, 'rsi_required': True, 'edge_k': 0.2060423277721216, 'edge_cap': 0.4385078582720131, 'bull_strategy': 'breakout', 'bull_bb_std_mult': 2.0280326097335766, 'bull_rsi_os': 10, 'bull_rsi_ob': 75, 'bull_adx_thresh': 8.246944296843418, 'bull_atr_min_pct': 0.0049925850025035, 'bull_atr_max_pct': 0.08327691800402506, 'bull_tp_mult': 1.737132978650869, 'bull_tsl_mult': 0.28729448133209323, 'bull_time_stop': 204, 'bull_use_sma': True, 'bull_use_ema': False, 'bull_use_atr': False, 'bull_use_adx': True, 'bull_use_spike': False, 'bull_rsi_required': True, 'bear_strategy': 'breakout', 'bear_bb_std_mult': 2.427438293677539, 'bear_rsi_os': 41, 'bear_rsi_ob': 90, 'bear_adx_thresh': 8.024741434204167, 'bear_atr_min_pct': 0.00044729700654570596, 'bear_atr_max_pct': 0.14529716057539324, 'bear_tp_mult': 1.5103811883707885, 'bear_tsl_mult': 0.41202674767704683, 'bear_time_stop': 10, 'bear_use_sma': False, 'bear_use_ema': True, 'bear_use_atr': False, 'bear_use_adx': True, 'bear_use_spike': True, 'bear_rsi_required': False, 'sideways_strategy': 'mean_reversion', 'sideways_bb_std_mult': 2.5591492763301984, 'sideways_rsi_os': 8, 'sideways_rsi_ob': 89, 'sideways_adx_thresh': 25.85100068371196, 'sideways_atr_min_pct': 0.019632471722662824, 'sideways_atr_max_pct': 0.08685312755561259, 'sideways_tp_mult': 1.9459667995188812, 'sideways_tsl_mult': 0.8374149054467075, 'sideways_time_stop': 24, 'sideways_use_sma': False, 'sideways_use_ema': False, 'sideways_use_atr': False, 'sideways_use_adx': False, 'sideways_use_spike': False, 'sideways_rsi_required': True}.
[I 2025-08-31 10:38:23,958] Trial 337 finished with values: [-0.07966193137212652, 0.07906799271767782] and parameters: {'p_sma': 14, 'p_std': 30, 'p_atr': 10, 'p_adx': 14, 'rsi_period': 47, 'ema1': 14, 'ema2': 58, 'slip_atr_k': 0.24197612684639713, 'slip_spread_k': 0.7552796700050612, 'spread_hl_frac': 0.008380714916340305, 'bb_std_mult': 2.6610088060582355, 'rsi_os': 28, 'rsi_ob': 77, 'vol_spike': 0.25156336397986506, 'adx_thresh': 28.44625318127096, 'atr_min_pct': 0.007545173255784682, 'atr_max_pct': 0.10223715740920578, 'tp_mult': 2.372292149456891, 'tsl_mult': 0.20689699084126362, 'strategy': 'breakout', 'time_stop': 91, 'use_sma': True, 'use_atr': False, 'use_adx': True, 'use_ema': True, 'use_spike': True, 'rsi_required': True, 'edge_k': 0.20292589554321638, 'edge_cap': 0.40219209546722356, 'bull_strategy': 'breakout', 'bull_bb_std_mult': 0.6334692646275866, 'bull_rsi_os': 9, 'bull_rsi_ob': 74, 'bull_adx_thresh': 5.278312789944904, 'bull_atr_min_pct': 0.005015624932480354, 'bull_atr_max_pct': 0.09492546104143379, 'bull_tp_mult': 1.8361683316405384, 'bull_tsl_mult': 0.3775746193481098, 'bull_time_stop': 200, 'bull_use_sma': False, 'bull_use_ema': False, 'bull_use_atr': False, 'bull_use_adx': True, 'bull_use_spike': False, 'bull_rsi_required': True, 'bear_strategy': 'breakout', 'bear_bb_std_mult': 2.1177287963699025, 'bear_rsi_os': 41, 'bear_rsi_ob': 85, 'bear_adx_thresh': 6.104137053470696, 'bear_atr_min_pct': 0.0009827215567958236, 'bear_atr_max_pct': 0.1436685946189705, 'bear_tp_mult': 2.814245261991891, 'bear_tsl_mult': 0.16197346051055295, 'bear_time_stop': 23, 'bear_use_sma': False, 'bear_use_ema': True, 'bear_use_atr': False, 'bear_use_adx': False, 'bear_use_spike': False, 'bear_rsi_required': False, 'sideways_strategy': 'mean_reversion', 'sideways_bb_std_mult': 1.1319284838795842, 'sideways_rsi_os': 8, 'sideways_rsi_ob': 95, 'sideways_adx_thresh': 25.611311649511315, 'sideways_atr_min_pct': 0.018699907071238905, 'sideways_atr_max_pct': 0.05211328406286815, 'sideways_tp_mult': 2.7144573300092474, 'sideways_tsl_mult': 0.8905648870024219, 'sideways_time_stop': 10, 'sideways_use_sma': False, 'sideways_use_ema': False, 'sideways_use_atr': True, 'sideways_use_adx': False, 'sideways_use_spike': False, 'sideways_rsi_required': True}.
[I 2025-08-31 10:38:24,054] Trial 336 finished with values: [-1000000000.0, 1000000000.0] and parameters: {'p_sma': 14, 'p_std': 31, 'p_atr': 11, 'p_adx': 14, 'rsi_period': 47, 'ema1': 14, 'ema2': 56, 'slip_atr_k': 0.024264695016246066, 'slip_spread_k': 0.11758777899905865, 'spread_hl_frac': 0.010145051470628986, 'bb_std_mult': 2.872726210494089, 'rsi_os': 15, 'rsi_ob': 77, 'vol_spike': 0.2626213689350289, 'adx_thresh': 27.514330304507485, 'atr_min_pct': 0.007656279045197304, 'atr_max_pct': 0.10246434916526632, 'tp_mult': 1.0979149329199083, 'tsl_mult': 0.21277169499208157, 'strategy': 'breakout', 'time_stop': 90, 'use_sma': True, 'use_atr': False, 'use_adx': True, 'use_ema': True, 'use_spike': True, 'rsi_required': True, 'edge_k': 0.20634490451133547, 'edge_cap': 0.40404981164803244, 'bull_strategy': 'breakout', 'bull_bb_std_mult': 2.0120116086793036, 'bull_rsi_os': 10, 'bull_rsi_ob': 74, 'bull_adx_thresh': 5.094232926432916, 'bull_atr_min_pct': 0.005450386373697727, 'bull_atr_max_pct': 0.09456651089321784, 'bull_tp_mult': 1.8333202726325195, 'bull_tsl_mult': 0.8108686338227342, 'bull_time_stop': 74, 'bull_use_sma': False, 'bull_use_ema': False, 'bull_use_atr': False, 'bull_use_adx': True, 'bull_use_spike': False, 'bull_rsi_required': True, 'bear_strategy': 'breakout', 'bear_bb_std_mult': 2.3948948380203814, 'bear_rsi_os': 7, 'bear_rsi_ob': 85, 'bear_adx_thresh': 5.856443015579842, 'bear_atr_min_pct': 0.0009272489365939468, 'bear_atr_max_pct': 0.14647397326988937, 'bear_tp_mult': 1.9090747742051588, 'bear_tsl_mult': 0.8960984834631938, 'bear_time_stop': 8, 'bear_use_sma': False, 'bear_use_ema': True, 'bear_use_atr': False, 'bear_use_adx': False, 'bear_use_spike': True, 'bear_rsi_required': False, 'sideways_strategy': 'mean_reversion', 'sideways_bb_std_mult': 1.7866992577617777, 'sideways_rsi_os': 8, 'sideways_rsi_ob': 95, 'sideways_adx_thresh': 25.92862689112876, 'sideways_atr_min_pct': 0.01942795024851659, 'sideways_atr_max_pct': 0.05820646360623634, 'sideways_tp_mult': 1.6045088901256175, 'sideways_tsl_mult': 0.09925842196301847, 'sideways_time_stop': 12, 'sideways_use_sma': False, 'sideways_use_ema': False, 'sideways_use_atr': False, 'sideways_use_adx': False, 'sideways_use_spike': False, 'sideways_rsi_required': True}.
[I 2025-08-31 10:38:56,483] Trial 340 finished with values: [-1000000000.0, 1000000000.0] and parameters: {'p_sma': 32, 'p_std': 31, 'p_atr': 10, 'p_adx': 14, 'rsi_period': 31, 'ema1': 14, 'ema2': 23, 'slip_atr_k': 0.00771234088912022, 'slip_spread_k': 0.6549770554931366, 'spread_hl_frac': 0.007586592900726136, 'bb_std_mult': 2.3487334539230753, 'rsi_os': 15, 'rsi_ob': 77, 'vol_spike': 0.00673991101223384, 'adx_thresh': 27.948616496178357, 'atr_min_pct': 0.014696194143532706, 'atr_max_pct': 0.1009626480930124, 'tp_mult': 1.0989394996180124, 'tsl_mult': 0.2694104877489104, 'strategy': 'breakout', 'time_stop': 39, 'use_sma': True, 'use_atr': False, 'use_adx': True, 'use_ema': True, 'use_spike': True, 'rsi_required': True, 'edge_k': 0.29618394981888685, 'edge_cap': 0.4744064012664834, 'bull_strategy': 'breakout', 'bull_bb_std_mult': 2.297232965437618, 'bull_rsi_os': 15, 'bull_rsi_ob': 54, 'bull_adx_thresh': 6.946433499439879, 'bull_atr_min_pct': 0.003359904882889159, 'bull_atr_max_pct': 0.09189636339474391, 'bull_tp_mult': 2.5995611201113635, 'bull_tsl_mult': 0.15164453363806657, 'bull_time_stop': 170, 'bull_use_sma': False, 'bull_use_ema': False, 'bull_use_atr': False, 'bull_use_adx': False, 'bull_use_spike': False, 'bull_rsi_required': True, 'bear_strategy': 'mean_reversion', 'bear_bb_std_mult': 2.360053355267541, 'bear_rsi_os': 7, 'bear_rsi_ob': 94, 'bear_adx_thresh': 7.020836647683064, 'bear_atr_min_pct': 0.0066224292452804236, 'bear_atr_max_pct': 0.13705592389732493, 'bear_tp_mult': 1.0382205248193954, 'bear_tsl_mult': 0.7740711718470903, 'bear_time_stop': 32, 'bear_use_sma': True, 'bear_use_ema': True, 'bear_use_atr': False, 'bear_use_adx': False, 'bear_use_spike': False, 'bear_rsi_required': False, 'sideways_strategy': 'mean_reversion', 'sideways_bb_std_mult': 2.737160068845962, 'sideways_rsi_os': 6, 'sideways_rsi_ob': 92, 'sideways_adx_thresh': 26.57019079739943, 'sideways_atr_min_pct': 0.017994707348636424, 'sideways_atr_max_pct': 0.0741257698541012, 'sideways_tp_mult': 1.9599671232935376, 'sideways_tsl_mult': 0.48409839537753807, 'sideways_time_stop': 16, 'sideways_use_sma': False, 'sideways_use_ema': False, 'sideways_use_atr': False, 'sideways_use_adx': False, 'sideways_use_spike': False, 'sideways_rsi_required': True}.
[I 2025-08-31 10:38:56,898] Trial 338 finished with values: [-0.014198471391694278, 0.014412929853621642] and parameters: {'p_sma': 44, 'p_std': 31, 'p_atr': 10, 'p_adx': 14, 'rsi_period': 9, 'ema1': 14, 'ema2': 58, 'slip_atr_k': 0.0150487897784175, 'slip_spread_k': 0.7068161347505576, 'spread_hl_frac': 0.00786740606696756, 'bb_std_mult': 2.6218238102377476, 'rsi_os': 28, 'rsi_ob': 77, 'vol_spike': 0.26532399903672993, 'adx_thresh': 10.362565535754781, 'atr_min_pct': 0.014867507854518772, 'atr_max_pct': 0.10083584974866423, 'tp_mult': 2.369259688366345, 'tsl_mult': 0.3202137470613703, 'strategy': 'breakout', 'time_stop': 91, 'use_sma': True, 'use_atr': False, 'use_adx': True, 'use_ema': True, 'use_spike': True, 'rsi_required': True, 'edge_k': 0.19836209276115216, 'edge_cap': 0.396085221752947, 'bull_strategy': 'breakout', 'bull_bb_std_mult': 2.024559702683222, 'bull_rsi_os': 15, 'bull_rsi_ob': 75, 'bull_adx_thresh': 5.5069108107041185, 'bull_atr_min_pct': 0.003584379839228274, 'bull_atr_max_pct': 0.09348072266196754, 'bull_tp_mult': 1.7168382445145154, 'bull_tsl_mult': 0.14836427489285636, 'bull_time_stop': 72, 'bull_use_sma': False, 'bull_use_ema': False, 'bull_use_atr': False, 'bull_use_adx': True, 'bull_use_spike': False, 'bull_rsi_required': True, 'bear_strategy': 'breakout', 'bear_bb_std_mult': 2.349336620274404, 'bear_rsi_os': 40, 'bear_rsi_ob': 87, 'bear_adx_thresh': 8.296578793971586, 'bear_atr_min_pct': 0.006614039787762234, 'bear_atr_max_pct': 0.14442461484881633, 'bear_tp_mult': 1.5280472057621062, 'bear_tsl_mult': 0.9006525079952328, 'bear_time_stop': 32, 'bear_use_sma': True, 'bear_use_ema': True, 'bear_use_atr': False, 'bear_use_adx': False, 'bear_use_spike': False, 'bear_rsi_required': False, 'sideways_strategy': 'mean_reversion', 'sideways_bb_std_mult': 2.7354962789471418, 'sideways_rsi_os': 8, 'sideways_rsi_ob': 92, 'sideways_adx_thresh': 25.81345906884319, 'sideways_atr_min_pct': 0.018541164067719725, 'sideways_atr_max_pct': 0.051767496694956554, 'sideways_tp_mult': 1.9393048547836456, 'sideways_tsl_mult': 0.8176856030143147, 'sideways_time_stop': 25, 'sideways_use_sma': False, 'sideways_use_ema': False, 'sideways_use_atr': True, 'sideways_use_adx': False, 'sideways_use_spike': False, 'sideways_rsi_required': True}.
[I 2025-08-31 10:38:56,898] Trial 339 finished with values: [-1000000000.0, 1000000000.0] and parameters: {'p_sma': 31, 'p_std': 31, 'p_atr': 10, 'p_adx': 14, 'rsi_period': 47, 'ema1': 14, 'ema2': 58, 'slip_atr_k': 0.015867098107263312, 'slip_spread_k': 0.13852275479974746, 'spread_hl_frac': 0.007866447647439182, 'bb_std_mult': 3.103446098440162, 'rsi_os': 43, 'rsi_ob': 77, 'vol_spike': 0.005913994231646985, 'adx_thresh': 27.50104709535036, 'atr_min_pct': 0.024684931565848875, 'atr_max_pct': 0.12199741321149483, 'tp_mult': 1.7698860612728953, 'tsl_mult': 0.21518654233854936, 'strategy': 'breakout', 'time_stop': 58, 'use_sma': True, 'use_atr': False, 'use_adx': True, 'use_ema': True, 'use_spike': True, 'rsi_required': True, 'edge_k': 0.22442025795121823, 'edge_cap': 0.394711605682809, 'bull_strategy': 'breakout', 'bull_bb_std_mult': 0.7854051110503882, 'bull_rsi_os': 8, 'bull_rsi_ob': 75, 'bull_adx_thresh': 5.031010287485582, 'bull_atr_min_pct': 0.0034407401979701926, 'bull_atr_max_pct': 0.09339987054211582, 'bull_tp_mult': 1.835764768154018, 'bull_tsl_mult': 0.8166303017034581, 'bull_time_stop': 171, 'bull_use_sma': False, 'bull_use_ema': False, 'bull_use_atr': False, 'bull_use_adx': False, 'bull_use_spike': False, 'bull_rsi_required': True, 'bear_strategy': 'mean_reversion', 'bear_bb_std_mult': 2.3201980697300617, 'bear_rsi_os': 40, 'bear_rsi_ob': 86, 'bear_adx_thresh': 8.494724810722593, 'bear_atr_min_pct': 0.010882158977897967, 'bear_atr_max_pct': 0.13430853527644715, 'bear_tp_mult': 2.811208285009964, 'bear_tsl_mult': 0.15906100777252918, 'bear_time_stop': 31, 'bear_use_sma': True, 'bear_use_ema': True, 'bear_use_atr': False, 'bear_use_adx': False, 'bear_use_spike': False, 'bear_rsi_required': False, 'sideways_strategy': 'mean_reversion', 'sideways_bb_std_mult': 2.751146624329964, 'sideways_rsi_os': 6, 'sideways_rsi_ob': 92, 'sideways_adx_thresh': 26.700775616060426, 'sideways_atr_min_pct': 0.018620598149844195, 'sideways_atr_max_pct': 0.08054392250257318, 'sideways_tp_mult': 1.7542430468365862, 'sideways_tsl_mult': 0.5005486481259882, 'sideways_time_stop': 17, 'sideways_use_sma': False, 'sideways_use_ema': False, 'sideways_use_atr': True, 'sideways_use_adx': False, 'sideways_use_spike': False, 'sideways_rsi_required': True}.
[I 2025-08-31 10:38:57,126] Trial 341 finished with values: [-1000000000.0, 1000000000.0] and parameters: {'p_sma': 32, 'p_std': 29, 'p_atr': 10, 'p_adx': 14, 'rsi_period': 16, 'ema1': 14, 'ema2': 23, 'slip_atr_k': 0.01613545161453978, 'slip_spread_k': 0.6584249498960189, 'spread_hl_frac': 0.00611445437382443, 'bb_std_mult': 2.622823261142285, 'rsi_os': 9, 'rsi_ob': 78, 'vol_spike': 0.17103269998869525, 'adx_thresh': 20.688677785186847, 'atr_min_pct': 0.005651280335660599, 'atr_max_pct': 0.09670677211880065, 'tp_mult': 2.4595566818702155, 'tsl_mult': 0.2568500077741232, 'strategy': 'breakout', 'time_stop': 69, 'use_sma': False, 'use_atr': False, 'use_adx': True, 'use_ema': True, 'use_spike': True, 'rsi_required': True, 'edge_k': 0.28585973603704257, 'edge_cap': 0.4738208250038861, 'bull_strategy': 'breakout', 'bull_bb_std_mult': 0.8007305637963464, 'bull_rsi_os': 15, 'bull_rsi_ob': 54, 'bull_adx_thresh': 6.640358231781821, 'bull_atr_min_pct': 0.0033764448773012904, 'bull_atr_max_pct': 0.10447915294727711, 'bull_tp_mult': 1.8035576454706506, 'bull_tsl_mult': 0.020472776865312237, 'bull_time_stop': 171, 'bull_use_sma': True, 'bull_use_ema': False, 'bull_use_atr': False, 'bull_use_adx': False, 'bull_use_spike': False, 'bull_rsi_required': True, 'bear_strategy': 'mean_reversion', 'bear_bb_std_mult': 2.3211679143898003, 'bear_rsi_os': 40, 'bear_rsi_ob': 94, 'bear_adx_thresh': 8.298851803046196, 'bear_atr_min_pct': 0.006767902163580182, 'bear_atr_max_pct': 0.13440492153598232, 'bear_tp_mult': 2.9193110215143405, 'bear_tsl_mult': 0.972640338856644, 'bear_time_stop': 32, 'bear_use_sma': True, 'bear_use_ema': True, 'bear_use_atr': True, 'bear_use_adx': False, 'bear_use_spike': False, 'bear_rsi_required': False, 'sideways_strategy': 'mean_reversion', 'sideways_bb_std_mult': 2.7425496655171533, 'sideways_rsi_os': 6, 'sideways_rsi_ob': 92, 'sideways_adx_thresh': 26.7990789918967, 'sideways_atr_min_pct': 0.017744688974541827, 'sideways_atr_max_pct': 0.04814769811164885, 'sideways_tp_mult': 2.658614128013064, 'sideways_tsl_mult': 0.3675407991875965, 'sideways_time_stop': 16, 'sideways_use_sma': False, 'sideways_use_ema': False, 'sideways_use_atr': True, 'sideways_use_adx': False, 'sideways_use_spike': False, 'sideways_rsi_required': True}.
