[I 2025-08-31 11:48:49,897] Trial 854 finished with values: [-1000000000.0, 1000000000.0] and parameters: {'p_sma': 16, 'p_std': 45, 'p_atr': 14, 'p_adx': 14, 'rsi_period': 52, 'ema1': 11, 'ema2': 42, 'slip_atr_k': 0.02075110465389485, 'slip_spread_k': 0.05539612729197191, 'spread_hl_frac': 0.0011083081358517037, 'bb_std_mult': 2.4864263640617374, 'rsi_os': 32, 'rsi_ob': 69, 'vol_spike': 0.11163021327153733, 'adx_thresh': 30.730239348731466, 'atr_min_pct': 0.013776974192889015, 'atr_max_pct': 0.13589273768761898, 'tp_mult': 1.451392908163321, 'tsl_mult': 0.13797396070685905, 'strategy': 'breakout', 'time_stop': 197, 'use_sma': True, 'use_atr': True, 'use_adx': False, 'use_ema': False, 'use_spike': True, 'rsi_required': False, 'edge_k': 0.45521404651399194, 'edge_cap': 0.7982852592733063, 'bull_strategy': 'breakout', 'bull_bb_std_mult': 0.5004799299111707, 'bull_rsi_os': 23, 'bull_rsi_ob': 49, 'bull_adx_thresh': 18.963683442665918, 'bull_atr_min_pct': 0.01586264978994911, 'bull_atr_max_pct': 0.13853709249690643, 'bull_tp_mult': 2.692655244321417, 'bull_tsl_mult': 0.763631935350921, 'bull_time_stop': 275, 'bull_use_sma': False, 'bull_use_ema': True, 'bull_use_atr': False, 'bull_use_adx': False, 'bull_use_spike': False, 'bull_rsi_required': False, 'bear_strategy': 'breakout', 'bear_bb_std_mult': 3.237507265767965, 'bear_rsi_os': 44, 'bear_rsi_ob': 71, 'bear_adx_thresh': 5.665697479817814, 'bear_atr_min_pct': 0.003830374745614125, 'bear_atr_max_pct': 0.14683205619764045, 'bear_tp_mult': 2.9923307346098507, 'bear_tsl_mult': 0.7490240023539696, 'bear_time_stop': 12, 'bear_use_sma': False, 'bear_use_ema': False, 'bear_use_atr': False, 'bear_use_adx': True, 'bear_use_spike': False, 'bear_rsi_required': True, 'sideways_strategy': 'breakout', 'sideways_bb_std_mult': 2.6365048135749376, 'sideways_rsi_os': 36, 'sideways_rsi_ob': 78, 'sideways_adx_thresh': 11.36562815096745, 'sideways_atr_min_pct': 0.007425261523498204, 'sideways_atr_max_pct': 0.04558473990320646, 'sideways_tp_mult': 2.915590485142118, 'sideways_tsl_mult': 0.4525189355987245, 'sideways_time_stop': 291, 'sideways_use_sma': False, 'sideways_use_ema': True, 'sideways_use_atr': True, 'sideways_use_adx': False, 'sideways_use_spike': True, 'sideways_rsi_required': True}.
[I 2025-08-31 11:48:50,068] Trial 855 finished with values: [-1000000000.0, 1000000000.0] and parameters: {'p_sma': 20, 'p_std': 39, 'p_atr': 12, 'p_adx': 18, 'rsi_period': 51, 'ema1': 11, 'ema2': 42, 'slip_atr_k': 0.24343512313450333, 'slip_spread_k': 0.189745623645232, 'spread_hl_frac': 0.006439614535650885, 'bb_std_mult': 2.350773654805925, 'rsi_os': 32, 'rsi_ob': 59, 'vol_spike': 0.11090719328167661, 'adx_thresh': 30.6147658398677, 'atr_min_pct': 0.01370734336812329, 'atr_max_pct': 0.13544855485071086, 'tp_mult': 1.4598941119616724, 'tsl_mult': 0.9177566156919574, 'strategy': 'breakout', 'time_stop': 197, 'use_sma': True, 'use_atr': True, 'use_adx': False, 'use_ema': True, 'use_spike': True, 'rsi_required': False, 'edge_k': 0.46507584921994116, 'edge_cap': 0.7123641179797682, 'bull_strategy': 'breakout', 'bull_bb_std_mult': 0.5554260146087417, 'bull_rsi_os': 23, 'bull_rsi_ob': 83, 'bull_adx_thresh': 5.022356053194049, 'bull_atr_min_pct': 0.002618882126942619, 'bull_atr_max_pct': 0.0656513444745274, 'bull_tp_mult': 2.6467719745152434, 'bull_tsl_mult': 0.7608586013037285, 'bull_time_stop': 279, 'bull_use_sma': False, 'bull_use_ema': True, 'bull_use_atr': False, 'bull_use_adx': False, 'bull_use_spike': False, 'bull_rsi_required': False, 'bear_strategy': 'breakout', 'bear_bb_std_mult': 3.239964834621078, 'bear_rsi_os': 45, 'bear_rsi_ob': 69, 'bear_adx_thresh': 5.003176097727886, 'bear_atr_min_pct': 0.011210066197440083, 'bear_atr_max_pct': 0.13662250626474962, 'bear_tp_mult': 2.924180598149568, 'bear_tsl_mult': 0.7496291960535428, 'bear_time_stop': 21, 'bear_use_sma': False, 'bear_use_ema': True, 'bear_use_atr': False, 'bear_use_adx': False, 'bear_use_spike': False, 'bear_rsi_required': True, 'sideways_strategy': 'breakout', 'sideways_bb_std_mult': 2.721388424706185, 'sideways_rsi_os': 37, 'sideways_rsi_ob': 78, 'sideways_adx_thresh': 11.533028669951545, 'sideways_atr_min_pct': 0.016197307512710604, 'sideways_atr_max_pct': 0.04474314121124745, 'sideways_tp_mult': 2.798381895078897, 'sideways_tsl_mult': 0.4614367342810177, 'sideways_time_stop': 232, 'sideways_use_sma': False, 'sideways_use_ema': True, 'sideways_use_atr': True, 'sideways_use_adx': False, 'sideways_use_spike': True, 'sideways_rsi_required': True}.
[I 2025-08-31 11:48:50,341] Trial 857 finished with values: [-1000000000.0, 1000000000.0] and parameters: {'p_sma': 16, 'p_std': 29, 'p_atr': 12, 'p_adx': 18, 'rsi_period': 74, 'ema1': 11, 'ema2': 41, 'slip_atr_k': 0.01826542170763755, 'slip_spread_k': 0.48909415972272924, 'spread_hl_frac': 0.006627060307494645, 'bb_std_mult': 2.3670073040104356, 'rsi_os': 31, 'rsi_ob': 94, 'vol_spike': 0.1146334902260259, 'adx_thresh': 11.734246880782933, 'atr_min_pct': 0.01279572360980574, 'atr_max_pct': 0.13250650600539465, 'tp_mult': 1.4599386613188472, 'tsl_mult': 0.9194118525021306, 'strategy': 'breakout', 'time_stop': 199, 'use_sma': True, 'use_atr': True, 'use_adx': False, 'use_ema': True, 'use_spike': True, 'rsi_required': False, 'edge_k': 0.45833518345952345, 'edge_cap': 0.739634819165974, 'bull_strategy': 'mean_reversion', 'bull_bb_std_mult': 0.6154887476093134, 'bull_rsi_os': 24, 'bull_rsi_ob': 49, 'bull_adx_thresh': 5.549056599710097, 'bull_atr_min_pct': 0.025245352579266862, 'bull_atr_max_pct': 0.054456714978687, 'bull_tp_mult': 2.766113141083793, 'bull_tsl_mult': 0.8443918213664678, 'bull_time_stop': 280, 'bull_use_sma': False, 'bull_use_ema': True, 'bull_use_atr': False, 'bull_use_adx': True, 'bull_use_spike': False, 'bull_rsi_required': False, 'bear_strategy': 'breakout', 'bear_bb_std_mult': 3.2885280934773484, 'bear_rsi_os': 49, 'bear_rsi_ob': 69, 'bear_adx_thresh': 5.023477201855481, 'bear_atr_min_pct': 0.00491049624324064, 'bear_atr_max_pct': 0.14643736019280038, 'bear_tp_mult': 2.995678921597575, 'bear_tsl_mult': 0.7510811163626451, 'bear_time_stop': 12, 'bear_use_sma': False, 'bear_use_ema': True, 'bear_use_atr': False, 'bear_use_adx': False, 'bear_use_spike': False, 'bear_rsi_required': True, 'sideways_strategy': 'breakout', 'sideways_bb_std_mult': 2.619737054256882, 'sideways_rsi_os': 50, 'sideways_rsi_ob': 55, 'sideways_adx_thresh': 11.580885174566326, 'sideways_atr_min_pct': 0.015492970548198235, 'sideways_atr_max_pct': 0.09407794470159786, 'sideways_tp_mult': 2.788308483332854, 'sideways_tsl_mult': 0.4167743898867274, 'sideways_time_stop': 224, 'sideways_use_sma': False, 'sideways_use_ema': False, 'sideways_use_atr': True, 'sideways_use_adx': False, 'sideways_use_spike': True, 'sideways_rsi_required': True}.
[I 2025-08-31 11:49:26,727] Trial 861 finished with values: [-0.014528792473955776, 0.014555570400970934] and parameters: {'p_sma': 50, 'p_std': 41, 'p_atr': 14, 'p_adx': 9, 'rsi_period': 68, 'ema1': 12, 'ema2': 41, 'slip_atr_k': 0.04534681951406176, 'slip_spread_k': 0.22029742482059467, 'spread_hl_frac': 0.004625383716670938, 'bb_std_mult': 2.43937345119719, 'rsi_os': 33, 'rsi_ob': 66, 'vol_spike': 0.1246900519412207, 'adx_thresh': 13.25198354739354, 'atr_min_pct': 0.012615875863522289, 'atr_max_pct': 0.1393383235861911, 'tp_mult': 1.3159773451686734, 'tsl_mult': 0.07022549535489118, 'strategy': 'breakout', 'time_stop': 182, 'use_sma': True, 'use_atr': True, 'use_adx': False, 'use_ema': True, 'use_spike': False, 'rsi_required': False, 'edge_k': 0.4999982367828506, 'edge_cap': 0.7873590948198101, 'bull_strategy': 'mean_reversion', 'bull_bb_std_mult': 0.6219946474714596, 'bull_rsi_os': 28, 'bull_rsi_ob': 85, 'bull_adx_thresh': 6.53712461550453, 'bull_atr_min_pct': 0.012281556896068215, 'bull_atr_max_pct': 0.09485359214097161, 'bull_tp_mult': 2.59736226081199, 'bull_tsl_mult': 0.870382723894104, 'bull_time_stop': 281, 'bull_use_sma': False, 'bull_use_ema': True, 'bull_use_atr': True, 'bull_use_adx': True, 'bull_use_spike': True, 'bull_rsi_required': True, 'bear_strategy': 'breakout', 'bear_bb_std_mult': 3.3301546745409767, 'bear_rsi_os': 48, 'bear_rsi_ob': 72, 'bear_adx_thresh': 5.815652515312056, 'bear_atr_min_pct': 0.004698407717924256, 'bear_atr_max_pct': 0.014047716545904324, 'bear_tp_mult': 2.935912472659327, 'bear_tsl_mult': 0.7678751044640937, 'bear_time_stop': 23, 'bear_use_sma': False, 'bear_use_ema': True, 'bear_use_atr': True, 'bear_use_adx': False, 'bear_use_spike': False, 'bear_rsi_required': True, 'sideways_strategy': 'breakout', 'sideways_bb_std_mult': 1.3525208362318364, 'sideways_rsi_os': 15, 'sideways_rsi_ob': 94, 'sideways_adx_thresh': 10.390959383688338, 'sideways_atr_min_pct': 0.017453903601623327, 'sideways_atr_max_pct': 0.12647740495827792, 'sideways_tp_mult': 2.9492889989948647, 'sideways_tsl_mult': 0.4032709382584059, 'sideways_time_stop': 255, 'sideways_use_sma': False, 'sideways_use_ema': False, 'sideways_use_atr': True, 'sideways_use_adx': True, 'sideways_use_spike': True, 'sideways_rsi_required': False}.
[I 2025-08-31 11:49:26,750] Trial 858 finished with values: [-1000000000.0, 1000000000.0] and parameters: {'p_sma': 50, 'p_std': 18, 'p_atr': 14, 'p_adx': 15, 'rsi_period': 51, 'ema1': 12, 'ema2': 41, 'slip_atr_k': 0.048254997151770784, 'slip_spread_k': 0.1855887879833102, 'spread_hl_frac': 0.006800436226538033, 'bb_std_mult': 2.4135663362130177, 'rsi_os': 33, 'rsi_ob': 94, 'vol_spike': 0.11277013307547731, 'adx_thresh': 6.4954218744110825, 'atr_min_pct': 0.012721539225390223, 'atr_max_pct': 0.13422899391122695, 'tp_mult': 1.4490405978238672, 'tsl_mult': 0.4783448523397999, 'strategy': 'breakout', 'time_stop': 197, 'use_sma': True, 'use_atr': True, 'use_adx': False, 'use_ema': True, 'use_spike': True, 'rsi_required': False, 'edge_k': 0.45694839271303095, 'edge_cap': 0.7807361728863752, 'bull_strategy': 'mean_reversion', 'bull_bb_std_mult': 0.6383422406878484, 'bull_rsi_os': 29, 'bull_rsi_ob': 83, 'bull_adx_thresh': 5.578811729092206, 'bull_atr_min_pct': 0.00458862651121186, 'bull_atr_max_pct': 0.09437463595485665, 'bull_tp_mult': 2.5960911824674637, 'bull_tsl_mult': 0.8779109197291559, 'bull_time_stop': 280, 'bull_use_sma': False, 'bull_use_ema': True, 'bull_use_atr': False, 'bull_use_adx': True, 'bull_use_spike': False, 'bull_rsi_required': False, 'bear_strategy': 'breakout', 'bear_bb_std_mult': 3.3350639829372515, 'bear_rsi_os': 48, 'bear_rsi_ob': 72, 'bear_adx_thresh': 29.153773064384854, 'bear_atr_min_pct': 0.011252458205589354, 'bear_atr_max_pct': 0.013394284136088647, 'bear_tp_mult': 2.9804329976607518, 'bear_tsl_mult': 0.7579078852400848, 'bear_time_stop': 12, 'bear_use_sma': False, 'bear_use_ema': True, 'bear_use_atr': False, 'bear_use_adx': False, 'bear_use_spike': False, 'bear_rsi_required': True, 'sideways_strategy': 'breakout', 'sideways_bb_std_mult': 2.628777507304297, 'sideways_rsi_os': 20, 'sideways_rsi_ob': 64, 'sideways_adx_thresh': 11.60440870041905, 'sideways_atr_min_pct': 0.01566548354803775, 'sideways_atr_max_pct': 0.04217160678769263, 'sideways_tp_mult': 2.788965929531405, 'sideways_tsl_mult': 0.4107086843834128, 'sideways_time_stop': 64, 'sideways_use_sma': False, 'sideways_use_ema': False, 'sideways_use_atr': True, 'sideways_use_adx': False, 'sideways_use_spike': True, 'sideways_rsi_required': True}.
[I 2025-08-31 11:49:27,062] Trial 860 finished with values: [-0.016599517647169937, 0.016884048878072086] and parameters: {'p_sma': 49, 'p_std': 42, 'p_atr': 15, 'p_adx': 10, 'rsi_period': 24, 'ema1': 12, 'ema2': 41, 'slip_atr_k': 0.04700983344387392, 'slip_spread_k': 0.19184197365298927, 'spread_hl_frac': 0.006758132479259553, 'bb_std_mult': 2.4206366804700163, 'rsi_os': 31, 'rsi_ob': 94, 'vol_spike': 0.1261389820984823, 'adx_thresh': 11.718980070807902, 'atr_min_pct': 0.012693691379286672, 'atr_max_pct': 0.13310007275101488, 'tp_mult': 1.3461205742988285, 'tsl_mult': 0.076689304253999, 'strategy': 'breakout', 'time_stop': 183, 'use_sma': True, 'use_atr': True, 'use_adx': False, 'use_ema': True, 'use_spike': False, 'rsi_required': False, 'edge_k': 0.5041717844876012, 'edge_cap': 0.7855706883246338, 'bull_strategy': 'mean_reversion', 'bull_bb_std_mult': 0.626860027412626, 'bull_rsi_os': 28, 'bull_rsi_ob': 55, 'bull_adx_thresh': 5.5723407397125575, 'bull_atr_min_pct': 0.004457906268977299, 'bull_atr_max_pct': 0.09481407107628839, 'bull_tp_mult': 2.7538040583264984, 'bull_tsl_mult': 0.8789196345526045, 'bull_time_stop': 280, 'bull_use_sma': False, 'bull_use_ema': True, 'bull_use_atr': True, 'bull_use_adx': True, 'bull_use_spike': True, 'bull_rsi_required': True, 'bear_strategy': 'breakout', 'bear_bb_std_mult': 3.3152709708865236, 'bear_rsi_os': 48, 'bear_rsi_ob': 72, 'bear_adx_thresh': 5.6974496034522595, 'bear_atr_min_pct': 0.004974985061603993, 'bear_atr_max_pct': 0.1439690073747601, 'bear_tp_mult': 2.9398761304633636, 'bear_tsl_mult': 0.16307894639183218, 'bear_time_stop': 11, 'bear_use_sma': False, 'bear_use_ema': True, 'bear_use_atr': True, 'bear_use_adx': False, 'bear_use_spike': False, 'bear_rsi_required': True, 'sideways_strategy': 'breakout', 'sideways_bb_std_mult': 2.6160644424883683, 'sideways_rsi_os': 23, 'sideways_rsi_ob': 56, 'sideways_adx_thresh': 12.007428626744215, 'sideways_atr_min_pct': 0.0031513817216141868, 'sideways_atr_max_pct': 0.0611340806709601, 'sideways_tp_mult': 2.8143136133198494, 'sideways_tsl_mult': 0.4133554914735645, 'sideways_time_stop': 85, 'sideways_use_sma': False, 'sideways_use_ema': False, 'sideways_use_atr': True, 'sideways_use_adx': True, 'sideways_use_spike': True, 'sideways_rsi_required': False}.
[I 2025-08-31 11:49:27,177] Trial 859 finished with values: [-1000000000.0, 1000000000.0] and parameters: {'p_sma': 25, 'p_std': 16, 'p_atr': 14, 'p_adx': 15, 'rsi_period': 50, 'ema1': 11, 'ema2': 41, 'slip_atr_k': 0.034297005981864366, 'slip_spread_k': 0.19544266202069732, 'spread_hl_frac': 0.0066853167059227085, 'bb_std_mult': 2.359323694476293, 'rsi_os': 31, 'rsi_ob': 94, 'vol_spike': 0.12546709815942336, 'adx_thresh': 14.233024289726533, 'atr_min_pct': 0.013167062433304469, 'atr_max_pct': 0.13306995164518248, 'tp_mult': 1.338020331601217, 'tsl_mult': 0.9123673691845489, 'strategy': 'breakout', 'time_stop': 184, 'use_sma': True, 'use_atr': True, 'use_adx': False, 'use_ema': True, 'use_spike': False, 'rsi_required': False, 'edge_k': 0.5026721903436036, 'edge_cap': 0.7811430680960348, 'bull_strategy': 'mean_reversion', 'bull_bb_std_mult': 0.5018248269244572, 'bull_rsi_os': 28, 'bull_rsi_ob': 83, 'bull_adx_thresh': 12.033501137344057, 'bull_atr_min_pct': 0.004638851114777689, 'bull_atr_max_pct': 0.09543265710445385, 'bull_tp_mult': 2.6016617068017496, 'bull_tsl_mult': 0.8460464853140662, 'bull_time_stop': 282, 'bull_use_sma': False, 'bull_use_ema': True, 'bull_use_atr': True, 'bull_use_adx': True, 'bull_use_spike': False, 'bull_rsi_required': False, 'bear_strategy': 'breakout', 'bear_bb_std_mult': 3.297743892938236, 'bear_rsi_os': 44, 'bear_rsi_ob': 69, 'bear_adx_thresh': 31.568180340517806, 'bear_atr_min_pct': 0.004703356649440328, 'bear_atr_max_pct': 0.13688363907789047, 'bear_tp_mult': 2.9281435488718053, 'bear_tsl_mult': 0.7732591167924897, 'bear_time_stop': 11, 'bear_use_sma': False, 'bear_use_ema': True, 'bear_use_atr': False, 'bear_use_adx': False, 'bear_use_spike': False, 'bear_rsi_required': True, 'sideways_strategy': 'breakout', 'sideways_bb_std_mult': 2.6112065814933403, 'sideways_rsi_os': 38, 'sideways_rsi_ob': 56, 'sideways_adx_thresh': 11.935442376739122, 'sideways_atr_min_pct': 0.015409276518427323, 'sideways_atr_max_pct': 0.1258247707371821, 'sideways_tp_mult': 2.7972116043014976, 'sideways_tsl_mult': 0.4128085694080023, 'sideways_time_stop': 170, 'sideways_use_sma': False, 'sideways_use_ema': False, 'sideways_use_atr': True, 'sideways_use_adx': False, 'sideways_use_spike': True, 'sideways_rsi_required': False}.
[I 2025-08-31 11:50:02,165] Trial 865 finished with values: [-1000000000.0, 1000000000.0] and parameters: {'p_sma': 14, 'p_std': 56, 'p_atr': 14, 'p_adx': 22, 'rsi_period': 56, 'ema1': 13, 'ema2': 40, 'slip_atr_k': 0.09363259986885217, 'slip_spread_k': 0.45073849757618256, 'spread_hl_frac': 0.04778057172978714, 'bb_std_mult': 2.295196513788056, 'rsi_os': 35, 'rsi_ob': 91, 'vol_spike': 0.1037167857870939, 'adx_thresh': 30.12377119942433, 'atr_min_pct': 0.012613545896782038, 'atr_max_pct': 0.1385599011566124, 'tp_mult': 1.4029309230490257, 'tsl_mult': 0.44133879983760205, 'strategy': 'mean_reversion', 'time_stop': 281, 'use_sma': False, 'use_atr': True, 'use_adx': False, 'use_ema': True, 'use_spike': True, 'rsi_required': False, 'edge_k': 0.41576108270461615, 'edge_cap': 0.8184855243257492, 'bull_strategy': 'breakout', 'bull_bb_std_mult': 0.6284875582540875, 'bull_rsi_os': 24, 'bull_rsi_ob': 84, 'bull_adx_thresh': 6.149962165698745, 'bull_atr_min_pct': 0.003524958314403178, 'bull_atr_max_pct': 0.09801425923271975, 'bull_tp_mult': 2.8175962041331926, 'bull_tsl_mult': 0.8144241967831712, 'bull_time_stop': 283, 'bull_use_sma': False, 'bull_use_ema': True, 'bull_use_atr': False, 'bull_use_adx': False, 'bull_use_spike': False, 'bull_rsi_required': True, 'bear_strategy': 'mean_reversion', 'bear_bb_std_mult': 3.222488820852773, 'bear_rsi_os': 49, 'bear_rsi_ob': 70, 'bear_adx_thresh': 5.0110305260938475, 'bear_atr_min_pct': 0.028968173549290162, 'bear_atr_max_pct': 0.0361555916855084, 'bear_tp_mult': 2.8698452710666884, 'bear_tsl_mult': 0.8342953185146358, 'bear_time_stop': 22, 'bear_use_sma': True, 'bear_use_ema': True, 'bear_use_atr': False, 'bear_use_adx': False, 'bear_use_spike': False, 'bear_rsi_required': True, 'sideways_strategy': 'breakout', 'sideways_bb_std_mult': 2.7174967464317894, 'sideways_rsi_os': 22, 'sideways_rsi_ob': 95, 'sideways_adx_thresh': 10.698108073984546, 'sideways_atr_min_pct': 0.028033093912777685, 'sideways_atr_max_pct': 0.01714218328674398, 'sideways_tp_mult': 2.97630365405951, 'sideways_tsl_mult': 0.38434160132321904, 'sideways_time_stop': 18, 'sideways_use_sma': True, 'sideways_use_ema': False, 'sideways_use_atr': True, 'sideways_use_adx': False, 'sideways_use_spike': True, 'sideways_rsi_required': True}.
[I 2025-08-31 11:50:02,687] Trial 862 finished with values: [-1000000000.0, 1000000000.0] and parameters: {'p_sma': 14, 'p_std': 56, 'p_atr': 14, 'p_adx': 23, 'rsi_period': 31, 'ema1': 13, 'ema2': 43, 'slip_atr_k': 0.09547116530760263, 'slip_spread_k': 0.45193298331294995, 'spread_hl_frac': 0.0424676652772544, 'bb_std_mult': 2.299111632269441, 'rsi_os': 35, 'rsi_ob': 93, 'vol_spike': 0.10468673813905556, 'adx_thresh': 14.266176220008347, 'atr_min_pct': 0.013084278136520371, 'atr_max_pct': 0.139136272261766, 'tp_mult': 1.5667973922214318, 'tsl_mult': 0.0728147640107774, 'strategy': 'mean_reversion', 'time_stop': 287, 'use_sma': False, 'use_atr': True, 'use_adx': False, 'use_ema': True, 'use_spike': False, 'rsi_required': False, 'edge_k': 0.39410051466998275, 'edge_cap': 0.7496167015804193, 'bull_strategy': 'breakout', 'bull_bb_std_mult': 0.5054329653557126, 'bull_rsi_os': 27, 'bull_rsi_ob': 90, 'bull_adx_thresh': 32.911276531458654, 'bull_atr_min_pct': 0.006326548852078548, 'bull_atr_max_pct': 0.09786341186611434, 'bull_tp_mult': 2.809910907588933, 'bull_tsl_mult': 0.7875953980128338, 'bull_time_stop': 278, 'bull_use_sma': False, 'bull_use_ema': True, 'bull_use_atr': True, 'bull_use_adx': False, 'bull_use_spike': False, 'bull_rsi_required': True, 'bear_strategy': 'mean_reversion', 'bear_bb_std_mult': 3.1991596083031393, 'bear_rsi_os': 44, 'bear_rsi_ob': 70, 'bear_adx_thresh': 5.6806113750230764, 'bear_atr_min_pct': 0.0053002837398041696, 'bear_atr_max_pct': 0.1382736899537672, 'bear_tp_mult': 2.870945818608812, 'bear_tsl_mult': 0.779752458880015, 'bear_time_stop': 18, 'bear_use_sma': True, 'bear_use_ema': True, 'bear_use_atr': True, 'bear_use_adx': False, 'bear_use_spike': False, 'bear_rsi_required': True, 'sideways_strategy': 'breakout', 'sideways_bb_std_mult': 2.4147925441318865, 'sideways_rsi_os': 22, 'sideways_rsi_ob': 95, 'sideways_adx_thresh': 10.792321414763487, 'sideways_atr_min_pct': 0.00290078879759088, 'sideways_atr_max_pct': 0.11655986894982578, 'sideways_tp_mult': 2.819848680694139, 'sideways_tsl_mult': 0.37922224741591715, 'sideways_time_stop': 165, 'sideways_use_sma': True, 'sideways_use_ema': False, 'sideways_use_atr': True, 'sideways_use_adx': False, 'sideways_use_spike': True, 'sideways_rsi_required': False}.
