[I 2025-08-31 10:29:43,737] Trial 272 finished with values: [-1000000000.0, 1000000000.0] and parameters: {'p_sma': 8, 'p_std': 24, 'p_atr': 12, 'p_adx': 16, 'rsi_period': 45, 'ema1': 9, 'ema2': 55, 'slip_atr_k': 0.1695296754607683, 'slip_spread_k': 0.6731640601064841, 'spread_hl_frac': 0.014199409685623072, 'bb_std_mult': 0.6878239765241384, 'rsi_os': 32, 'rsi_ob': 51, 'vol_spike': 0.27872339096089327, 'adx_thresh': 16.945269191345236, 'atr_min_pct': 0.02648502263750272, 'atr_max_pct': 0.08871345044488514, 'tp_mult': 1.9703601382064917, 'tsl_mult': 0.6082479507465886, 'strategy': 'breakout', 'time_stop': 229, 'use_sma': True, 'use_atr': True, 'use_adx': False, 'use_ema': False, 'use_spike': True, 'rsi_required': False, 'edge_k': 0.08477040746909914, 'edge_cap': 0.8440864761634281, 'bull_strategy': 'breakout', 'bull_bb_std_mult': 1.2251375816840542, 'bull_rsi_os': 41, 'bull_rsi_ob': 71, 'bull_adx_thresh': 10.024754108885478, 'bull_atr_min_pct': 0.0009160334839129248, 'bull_atr_max_pct': 0.14186089370414195, 'bull_tp_mult': 1.5084463771042769, 'bull_tsl_mult': 0.3204802777381097, 'bull_time_stop': 87, 'bull_use_sma': True, 'bull_use_ema': True, 'bull_use_atr': True, 'bull_use_adx': False, 'bull_use_spike': True, 'bull_rsi_required': False, 'bear_strategy': 'mean_reversion', 'bear_bb_std_mult': 0.9838585134409814, 'bear_rsi_os': 12, 'bear_rsi_ob': 91, 'bear_adx_thresh': 14.216644344262454, 'bear_atr_min_pct': 0.005932931273480236, 'bear_atr_max_pct': 0.08257038549604982, 'bear_tp_mult': 2.2847423619925302, 'bear_tsl_mult': 0.3503864547110266, 'bear_time_stop': 292, 'bear_use_sma': False, 'bear_use_ema': True, 'bear_use_atr': True, 'bear_use_adx': True, 'bear_use_spike': True, 'bear_rsi_required': False, 'sideways_strategy': 'breakout', 'sideways_bb_std_mult': 2.8286666505204474, 'sideways_rsi_os': 19, 'sideways_rsi_ob': 81, 'sideways_adx_thresh': 7.610667252860781, 'sideways_atr_min_pct': 0.02229510337596497, 'sideways_atr_max_pct': 0.03315216408271069, 'sideways_tp_mult': 2.327001397282988, 'sideways_tsl_mult': 0.281945050416054, 'sideways_time_stop': 37, 'sideways_use_sma': False, 'sideways_use_ema': False, 'sideways_use_atr': False, 'sideways_use_adx': True, 'sideways_use_spike': False, 'sideways_rsi_required': False}.
[I 2025-08-31 10:29:44,087] Trial 270 finished with values: [-1000000000.0, 1000000000.0] and parameters: {'p_sma': 19, 'p_std': 24, 'p_atr': 12, 'p_adx': 17, 'rsi_period': 45, 'ema1': 21, 'ema2': 53, 'slip_atr_k': 0.2491061148750091, 'slip_spread_k': 0.8000868874658643, 'spread_hl_frac': 0.009068936932089513, 'bb_std_mult': 1.8372699255537774, 'rsi_os': 24, 'rsi_ob': 83, 'vol_spike': 0.015195247962169312, 'adx_thresh': 30.04666406209737, 'atr_min_pct': 0.02663659825688603, 'atr_max_pct': 0.08964173652602787, 'tp_mult': 2.4095818341687827, 'tsl_mult': 0.6096825015428705, 'strategy': 'breakout', 'time_stop': 67, 'use_sma': True, 'use_atr': False, 'use_adx': True, 'use_ema': False, 'use_spike': True, 'rsi_required': False, 'edge_k': 0.1325025475354099, 'edge_cap': 0.8490657149626272, 'bull_strategy': 'breakout', 'bull_bb_std_mult': 3.1751485666007024, 'bull_rsi_os': 41, 'bull_rsi_ob': 72, 'bull_adx_thresh': 22.622240586839027, 'bull_atr_min_pct': 0.0044364762387910164, 'bull_atr_max_pct': 0.1435821427292947, 'bull_tp_mult': 1.3919622878035, 'bull_tsl_mult': 0.2040739517794557, 'bull_time_stop': 78, 'bull_use_sma': True, 'bull_use_ema': True, 'bull_use_atr': True, 'bull_use_adx': False, 'bull_use_spike': True, 'bull_rsi_required': True, 'bear_strategy': 'breakout', 'bear_bb_std_mult': 2.481878159051781, 'bear_rsi_os': 41, 'bear_rsi_ob': 91, 'bear_adx_thresh': 13.906943749696804, 'bear_atr_min_pct': 0.004545244553314064, 'bear_atr_max_pct': 0.10948375081591974, 'bear_tp_mult': 2.2455602363737874, 'bear_tsl_mult': 0.792185673901744, 'bear_time_stop': 130, 'bear_use_sma': False, 'bear_use_ema': True, 'bear_use_atr': False, 'bear_use_adx': True, 'bear_use_spike': True, 'bear_rsi_required': False, 'sideways_strategy': 'breakout', 'sideways_bb_std_mult': 2.86415136367023, 'sideways_rsi_os': 32, 'sideways_rsi_ob': 91, 'sideways_adx_thresh': 24.541210832015533, 'sideways_atr_min_pct': 0.006124152613125468, 'sideways_atr_max_pct': 0.03332657352839341, 'sideways_tp_mult': 2.431626782851423, 'sideways_tsl_mult': 0.7559129174274977, 'sideways_time_stop': 131, 'sideways_use_sma': False, 'sideways_use_ema': False, 'sideways_use_atr': False, 'sideways_use_adx': True, 'sideways_use_spike': True, 'sideways_rsi_required': False}.
[I 2025-08-31 10:29:44,212] Trial 269 finished with values: [-1000000000.0, 1000000000.0] and parameters: {'p_sma': 17, 'p_std': 26, 'p_atr': 23, 'p_adx': 17, 'rsi_period': 44, 'ema1': 9, 'ema2': 57, 'slip_atr_k': 0.22204429195088732, 'slip_spread_k': 0.6417373094794744, 'spread_hl_frac': 0.012919387144149178, 'bb_std_mult': 0.6844532780030265, 'rsi_os': 24, 'rsi_ob': 76, 'vol_spike': 0.2504615269525705, 'adx_thresh': 18.089175977371895, 'atr_min_pct': 0.021373499301071942, 'atr_max_pct': 0.09104575476819012, 'tp_mult': 2.499209116462807, 'tsl_mult': 0.4987670174511726, 'strategy': 'mean_reversion', 'time_stop': 178, 'use_sma': True, 'use_atr': False, 'use_adx': True, 'use_ema': False, 'use_spike': False, 'rsi_required': False, 'edge_k': 1.2812953702202667, 'edge_cap': 0.8493294178757939, 'bull_strategy': 'breakout', 'bull_bb_std_mult': 0.9657956644304919, 'bull_rsi_os': 41, 'bull_rsi_ob': 72, 'bull_adx_thresh': 29.058146709510112, 'bull_atr_min_pct': 0.008459996101613052, 'bull_atr_max_pct': 0.14517924150838657, 'bull_tp_mult': 1.516049239403427, 'bull_tsl_mult': 0.3773349555836547, 'bull_time_stop': 77, 'bull_use_sma': False, 'bull_use_ema': True, 'bull_use_atr': True, 'bull_use_adx': False, 'bull_use_spike': True, 'bull_rsi_required': True, 'bear_strategy': 'breakout', 'bear_bb_std_mult': 1.0046183516469651, 'bear_rsi_os': 12, 'bear_rsi_ob': 82, 'bear_adx_thresh': 19.226091247434702, 'bear_atr_min_pct': 0.02768620951781994, 'bear_atr_max_pct': 0.08294945680336925, 'bear_tp_mult': 2.2675384532450877, 'bear_tsl_mult': 0.4853347379479453, 'bear_time_stop': 62, 'bear_use_sma': False, 'bear_use_ema': True, 'bear_use_atr': False, 'bear_use_adx': True, 'bear_use_spike': True, 'bear_rsi_required': False, 'sideways_strategy': 'breakout', 'sideways_bb_std_mult': 2.847969044823017, 'sideways_rsi_os': 48, 'sideways_rsi_ob': 81, 'sideways_adx_thresh': 9.656571746924351, 'sideways_atr_min_pct': 0.006256928946749431, 'sideways_atr_max_pct': 0.033010886428479984, 'sideways_tp_mult': 2.1793906924688313, 'sideways_tsl_mult': 0.17045453309891154, 'sideways_time_stop': 300, 'sideways_use_sma': True, 'sideways_use_ema': False, 'sideways_use_atr': False, 'sideways_use_adx': True, 'sideways_use_spike': True, 'sideways_rsi_required': False}.
[I 2025-08-31 10:30:17,248] Trial 276 finished with values: [-1000000000.0, 1000000000.0] and parameters: {'p_sma': 10, 'p_std': 25, 'p_atr': 30, 'p_adx': 18, 'rsi_period': 43, 'ema1': 15, 'ema2': 18, 'slip_atr_k': 0.03278598247853578, 'slip_spread_k': 0.006101841833348887, 'spread_hl_frac': 0.01045779084747355, 'bb_std_mult': 3.3431198034075407, 'rsi_os': 55, 'rsi_ob': 47, 'vol_spike': 0.2584022653316721, 'adx_thresh': 6.721163148152865, 'atr_min_pct': 0.006044617755838196, 'atr_max_pct': 0.09731564794604775, 'tp_mult': 2.3107966617029105, 'tsl_mult': 0.5270407112874014, 'strategy': 'breakout', 'time_stop': 203, 'use_sma': True, 'use_atr': True, 'use_adx': False, 'use_ema': True, 'use_spike': True, 'rsi_required': True, 'edge_k': 1.8125076047839066, 'edge_cap': 0.8790779038092771, 'bull_strategy': 'breakout', 'bull_bb_std_mult': 2.729649290131084, 'bull_rsi_os': 43, 'bull_rsi_ob': 74, 'bull_adx_thresh': 25.394388928707144, 'bull_atr_min_pct': 0.019431132360635144, 'bull_atr_max_pct': 0.14098931724481487, 'bull_tp_mult': 1.7838678543411142, 'bull_tsl_mult': 0.44718147938031955, 'bull_time_stop': 246, 'bull_use_sma': True, 'bull_use_ema': False, 'bull_use_atr': False, 'bull_use_adx': True, 'bull_use_spike': True, 'bull_rsi_required': True, 'bear_strategy': 'mean_reversion', 'bear_bb_std_mult': 1.6216625214407772, 'bear_rsi_os': 39, 'bear_rsi_ob': 66, 'bear_adx_thresh': 16.102670842769808, 'bear_atr_min_pct': 0.003398101447438675, 'bear_atr_max_pct': 0.114482831770282, 'bear_tp_mult': 2.9245446072244525, 'bear_tsl_mult': 0.6533218114115192, 'bear_time_stop': 34, 'bear_use_sma': True, 'bear_use_ema': True, 'bear_use_atr': True, 'bear_use_adx': False, 'bear_use_spike': False, 'bear_rsi_required': False, 'sideways_strategy': 'mean_reversion', 'sideways_bb_std_mult': 2.9131077670445564, 'sideways_rsi_os': 28, 'sideways_rsi_ob': 82, 'sideways_adx_thresh': 21.549445722452088, 'sideways_atr_min_pct': 0.004276525979220125, 'sideways_atr_max_pct': 0.030305993424861195, 'sideways_tp_mult': 1.8719056973330603, 'sideways_tsl_mult': 0.043170568832937226, 'sideways_time_stop': 27, 'sideways_use_sma': False, 'sideways_use_ema': False, 'sideways_use_atr': True, 'sideways_use_adx': True, 'sideways_use_spike': True, 'sideways_rsi_required': True}.
[I 2025-08-31 10:30:17,528] Trial 274 finished with values: [-0.07585416202165651, 0.07562988404439118] and parameters: {'p_sma': 45, 'p_std': 25, 'p_atr': 23, 'p_adx': 17, 'rsi_period': 55, 'ema1': 15, 'ema2': 53, 'slip_atr_k': 0.031857764508987654, 'slip_spread_k': 0.6179266402745166, 'spread_hl_frac': 0.022023600565243717, 'bb_std_mult': 0.5664220366837661, 'rsi_os': 55, 'rsi_ob': 92, 'vol_spike': 0.21256834731814636, 'adx_thresh': 30.07684598309221, 'atr_min_pct': 0.01675871442585742, 'atr_max_pct': 0.09765385245945567, 'tp_mult': 2.295377192327657, 'tsl_mult': 0.14095235683244622, 'strategy': 'breakout', 'time_stop': 67, 'use_sma': True, 'use_atr': True, 'use_adx': False, 'use_ema': True, 'use_spike': True, 'rsi_required': False, 'edge_k': 0.0454876558376756, 'edge_cap': 0.3754126429832878, 'bull_strategy': 'breakout', 'bull_bb_std_mult': 0.9459288762005779, 'bull_rsi_os': 35, 'bull_rsi_ob': 74, 'bull_adx_thresh': 25.392749043261798, 'bull_atr_min_pct': 0.004853953332089713, 'bull_atr_max_pct': 0.14255246724333598, 'bull_tp_mult': 1.8122298618987558, 'bull_tsl_mult': 0.3791827486765923, 'bull_time_stop': 69, 'bull_use_sma': True, 'bull_use_ema': True, 'bull_use_atr': True, 'bull_use_adx': False, 'bull_use_spike': True, 'bull_rsi_required': True, 'bear_strategy': 'breakout', 'bear_bb_std_mult': 2.3609436820961474, 'bear_rsi_os': 39, 'bear_rsi_ob': 66, 'bear_adx_thresh': 16.166717651272815, 'bear_atr_min_pct': 0.0007784094683813934, 'bear_atr_max_pct': 0.14960072927991958, 'bear_tp_mult': 2.9320429159024357, 'bear_tsl_mult': 0.52062897303247, 'bear_time_stop': 106, 'bear_use_sma': True, 'bear_use_ema': True, 'bear_use_atr': False, 'bear_use_adx': False, 'bear_use_spike': True, 'bear_rsi_required': False, 'sideways_strategy': 'breakout', 'sideways_bb_std_mult': 1.5164359049407534, 'sideways_rsi_os': 32, 'sideways_rsi_ob': 82, 'sideways_adx_thresh': 15.824762251791144, 'sideways_atr_min_pct': 0.004672993832122498, 'sideways_atr_max_pct': 0.03549366557755477, 'sideways_tp_mult': 1.86395238551833, 'sideways_tsl_mult': 0.7450419208224781, 'sideways_time_stop': 62, 'sideways_use_sma': False, 'sideways_use_ema': False, 'sideways_use_atr': False, 'sideways_use_adx': True, 'sideways_use_spike': True, 'sideways_rsi_required': True}.
[I 2025-08-31 10:30:17,668] Trial 273 finished with values: [-1000000000.0, 1000000000.0] and parameters: {'p_sma': 10, 'p_std': 25, 'p_atr': 12, 'p_adx': 17, 'rsi_period': 12, 'ema1': 15, 'ema2': 53, 'slip_atr_k': 0.1695029836310043, 'slip_spread_k': 0.8074037059825533, 'spread_hl_frac': 0.02485281397442765, 'bb_std_mult': 0.6214167749721176, 'rsi_os': 22, 'rsi_ob': 86, 'vol_spike': 0.26077286766025154, 'adx_thresh': 29.962960110476562, 'atr_min_pct': 0.005119204545990933, 'atr_max_pct': 0.09611144480792068, 'tp_mult': 1.745379920248075, 'tsl_mult': 0.37837064682146065, 'strategy': 'breakout', 'time_stop': 283, 'use_sma': True, 'use_atr': True, 'use_adx': False, 'use_ema': False, 'use_spike': True, 'rsi_required': False, 'edge_k': 1.8242279543359752, 'edge_cap': 0.8534143310820436, 'bull_strategy': 'breakout', 'bull_bb_std_mult': 0.9433212722081313, 'bull_rsi_os': 41, 'bull_rsi_ob': 73, 'bull_adx_thresh': 25.59499468583296, 'bull_atr_min_pct': 0.007755784609915558, 'bull_atr_max_pct': 0.1419287288923274, 'bull_tp_mult': 1.7836295528840045, 'bull_tsl_mult': 0.37242801767431666, 'bull_time_stop': 89, 'bull_use_sma': True, 'bull_use_ema': True, 'bull_use_atr': True, 'bull_use_adx': False, 'bull_use_spike': True, 'bull_rsi_required': True, 'bear_strategy': 'mean_reversion', 'bear_bb_std_mult': 3.5985953159629878, 'bear_rsi_os': 39, 'bear_rsi_ob': 66, 'bear_adx_thresh': 16.415554316058227, 'bear_atr_min_pct': 0.005878676286078539, 'bear_atr_max_pct': 0.10907186200850064, 'bear_tp_mult': 2.287250927118795, 'bear_tsl_mult': 0.352922980652573, 'bear_time_stop': 103, 'bear_use_sma': False, 'bear_use_ema': True, 'bear_use_atr': True, 'bear_use_adx': True, 'bear_use_spike': True, 'bear_rsi_required': False, 'sideways_strategy': 'breakout', 'sideways_bb_std_mult': 2.2267460786257733, 'sideways_rsi_os': 48, 'sideways_rsi_ob': 82, 'sideways_adx_thresh': 34.999224694285864, 'sideways_atr_min_pct': 0.008051242053764281, 'sideways_atr_max_pct': 0.03475778279808509, 'sideways_tp_mult': 2.0576700339337624, 'sideways_tsl_mult': 0.04330452206518351, 'sideways_time_stop': 134, 'sideways_use_sma': False, 'sideways_use_ema': False, 'sideways_use_atr': False, 'sideways_use_adx': True, 'sideways_use_spike': True, 'sideways_rsi_required': False}.
[I 2025-08-31 10:30:17,748] Trial 275 finished with values: [-0.01883707374576349, 0.018629186912782918] and parameters: {'p_sma': 11, 'p_std': 25, 'p_atr': 23, 'p_adx': 17, 'rsi_period': 50, 'ema1': 16, 'ema2': 36, 'slip_atr_k': 0.034599575379213855, 'slip_spread_k': 0.6135221566258223, 'spread_hl_frac': 0.01046203697559393, 'bb_std_mult': 0.557908864265758, 'rsi_os': 36, 'rsi_ob': 47, 'vol_spike': 0.2138382059481246, 'adx_thresh': 18.20810636916205, 'atr_min_pct': 0.01692145208412239, 'atr_max_pct': 0.09478284307441275, 'tp_mult': 2.30866830237296, 'tsl_mult': 0.5812124588104246, 'strategy': 'breakout', 'time_stop': 203, 'use_sma': True, 'use_atr': True, 'use_adx': False, 'use_ema': True, 'use_spike': True, 'rsi_required': True, 'edge_k': 0.22530478108811383, 'edge_cap': 0.8831396333989475, 'bull_strategy': 'breakout', 'bull_bb_std_mult': 1.7846607485264405, 'bull_rsi_os': 28, 'bull_rsi_ob': 73, 'bull_adx_thresh': 25.381308708550833, 'bull_atr_min_pct': 9.929817627888889e-06, 'bull_atr_max_pct': 0.14707339427498098, 'bull_tp_mult': 1.8056231641181133, 'bull_tsl_mult': 0.37737600829797985, 'bull_time_stop': 69, 'bull_use_sma': True, 'bull_use_ema': False, 'bull_use_atr': False, 'bull_use_adx': True, 'bull_use_spike': True, 'bull_rsi_required': True, 'bear_strategy': 'mean_reversion', 'bear_bb_std_mult': 1.3729166609650567, 'bear_rsi_os': 38, 'bear_rsi_ob': 66, 'bear_adx_thresh': 21.064502697025596, 'bear_atr_min_pct': 0.003793137714628408, 'bear_atr_max_pct': 0.08513396627842347, 'bear_tp_mult': 2.7841170639495787, 'bear_tsl_mult': 0.7022276513477584, 'bear_time_stop': 104, 'bear_use_sma': True, 'bear_use_ema': True, 'bear_use_atr': True, 'bear_use_adx': False, 'bear_use_spike': False, 'bear_rsi_required': False, 'sideways_strategy': 'mean_reversion', 'sideways_bb_std_mult': 2.641735832604907, 'sideways_rsi_os': 55, 'sideways_rsi_ob': 61, 'sideways_adx_thresh': 21.585686747024177, 'sideways_atr_min_pct': 0.0043180342040290715, 'sideways_atr_max_pct': 0.03576690467611337, 'sideways_tp_mult': 1.9989230210402562, 'sideways_tsl_mult': 0.5317317307244827, 'sideways_time_stop': 50, 'sideways_use_sma': False, 'sideways_use_ema': False, 'sideways_use_atr': True, 'sideways_use_adx': True, 'sideways_use_spike': True, 'sideways_rsi_required': True}.
[I 2025-08-31 10:30:48,883] Trial 279 finished with values: [-1000000000.0, 1000000000.0] and parameters: {'p_sma': 38, 'p_std': 44, 'p_atr': 29, 'p_adx': 16, 'rsi_period': 76, 'ema1': 11, 'ema2': 38, 'slip_atr_k': 0.023925285530963524, 'slip_spread_k': 0.5948864649227803, 'spread_hl_frac': 0.0455895471307813, 'bb_std_mult': 0.5492476959841845, 'rsi_os': 36, 'rsi_ob': 74, 'vol_spike': 0.24236381462736817, 'adx_thresh': 28.93777830458177, 'atr_min_pct': 0.015526597495936281, 'atr_max_pct': 0.09424913101086425, 'tp_mult': 2.446738972614294, 'tsl_mult': 0.5806038103834991, 'strategy': 'breakout', 'time_stop': 255, 'use_sma': True, 'use_atr': True, 'use_adx': False, 'use_ema': True, 'use_spike': True, 'rsi_required': True, 'edge_k': 1.067041233288537, 'edge_cap': 0.8130358725954498, 'bull_strategy': 'mean_reversion', 'bull_bb_std_mult': 0.7641183518951898, 'bull_rsi_os': 40, 'bull_rsi_ob': 70, 'bull_adx_thresh': 30.764429268216098, 'bull_atr_min_pct': 0.016909432112138845, 'bull_atr_max_pct': 0.14790798036849323, 'bull_tp_mult': 1.7233214261569416, 'bull_tsl_mult': 0.6221670601978536, 'bull_time_stop': 216, 'bull_use_sma': True, 'bull_use_ema': False, 'bull_use_atr': False, 'bull_use_adx': True, 'bull_use_spike': False, 'bull_rsi_required': False, 'bear_strategy': 'breakout', 'bear_bb_std_mult': 0.5081951145112753, 'bear_rsi_os': 16, 'bear_rsi_ob': 70, 'bear_adx_thresh': 17.62818467353982, 'bear_atr_min_pct': 0.003863309737047933, 'bear_atr_max_pct': 0.026084591033558382, 'bear_tp_mult': 2.76715502661157, 'bear_tsl_mult': 0.7091120488927488, 'bear_time_stop': 18, 'bear_use_sma': False, 'bear_use_ema': True, 'bear_use_atr': False, 'bear_use_adx': False, 'bear_use_spike': False, 'bear_rsi_required': False, 'sideways_strategy': 'mean_reversion', 'sideways_bb_std_mult': 3.3126381078640366, 'sideways_rsi_os': 55, 'sideways_rsi_ob': 52, 'sideways_adx_thresh': 33.80525757529034, 'sideways_atr_min_pct': 0.009282133804809441, 'sideways_atr_max_pct': 0.0399145803262811, 'sideways_tp_mult': 2.00551084274873, 'sideways_tsl_mult': 0.5249535937538535, 'sideways_time_stop': 152, 'sideways_use_sma': False, 'sideways_use_ema': False, 'sideways_use_atr': True, 'sideways_use_adx': False, 'sideways_use_spike': False, 'sideways_rsi_required': True}.
[I 2025-08-31 10:30:49,048] Trial 280 finished with values: [-0.02906992469676628, 0.029379044647761823] and parameters: {'p_sma': 38, 'p_std': 29, 'p_atr': 28, 'p_adx': 16, 'rsi_period': 7, 'ema1': 16, 'ema2': 36, 'slip_atr_k': 0.09378411268334372, 'slip_spread_k': 0.5987156125383929, 'spread_hl_frac': 0.03369329374465313, 'bb_std_mult': 0.5387374723049108, 'rsi_os': 26, 'rsi_ob': 74, 'vol_spike': 0.24348052457654093, 'adx_thresh': 21.38145334065335, 'atr_min_pct': 0.00454444428433738, 'atr_max_pct': 0.09456656902329735, 'tp_mult': 2.440259418713591, 'tsl_mult': 0.45043853604710227, 'strategy': 'breakout', 'time_stop': 245, 'use_sma': True, 'use_atr': True, 'use_adx': False, 'use_ema': True, 'use_spike': True, 'rsi_required': False, 'edge_k': 0.6897701115985666, 'edge_cap': 0.8222219144368335, 'bull_strategy': 'mean_reversion', 'bull_bb_std_mult': 2.856552421587414, 'bull_rsi_os': 32, 'bull_rsi_ob': 70, 'bull_adx_thresh': 33.07435132189812, 'bull_atr_min_pct': 0.0024571929842192013, 'bull_atr_max_pct': 0.057022804939586225, 'bull_tp_mult': 1.7170123352646256, 'bull_tsl_mult': 0.6368218687127769, 'bull_time_stop': 217, 'bull_use_sma': True, 'bull_use_ema': True, 'bull_use_atr': True, 'bull_use_adx': True, 'bull_use_spike': False, 'bull_rsi_required': True, 'bear_strategy': 'breakout', 'bear_bb_std_mult': 1.390649919429832, 'bear_rsi_os': 54, 'bear_rsi_ob': 70, 'bear_adx_thresh': 25.34257933419537, 'bear_atr_min_pct': 0.003873438551908022, 'bear_atr_max_pct': 0.02579856599108675, 'bear_tp_mult': 2.809401031619307, 'bear_tsl_mult': 0.544633312977719, 'bear_time_stop': 203, 'bear_use_sma': False, 'bear_use_ema': True, 'bear_use_atr': False, 'bear_use_adx': False, 'bear_use_spike': False, 'bear_rsi_required': False, 'sideways_strategy': 'breakout', 'sideways_bb_std_mult': 0.5987890214501304, 'sideways_rsi_os': 17, 'sideways_rsi_ob': 61, 'sideways_adx_thresh': 26.190315272492377, 'sideways_atr_min_pct': 0.005145452686384027, 'sideways_atr_max_pct': 0.04091602253045504, 'sideways_tp_mult': 2.000119145072949, 'sideways_tsl_mult': 0.1294320667907499, 'sideways_time_stop': 292, 'sideways_use_sma': False, 'sideways_use_ema': False, 'sideways_use_atr': True, 'sideways_use_adx': False, 'sideways_use_spike': False, 'sideways_rsi_required': True}.
