[I 2025-08-31 10:16:44,071] Trial 174 finished with values: [-1000000000.0, 1000000000.0] and parameters: {'p_sma': 25, 'p_std': 25, 'p_atr': 30, 'p_adx': 17, 'rsi_period': 27, 'ema1': 17, 'ema2': 37, 'slip_atr_k': 0.09209981342765206, 'slip_spread_k': 0.908342666752231, 'spread_hl_frac': 0.00971236190008757, 'bb_std_mult': 0.6877955233434946, 'rsi_os': 26, 'rsi_ob': 76, 'vol_spike': 0.26153653602694626, 'adx_thresh': 29.332592933027097, 'atr_min_pct': 0.0016151047389975273, 'atr_max_pct': 0.09222350656705705, 'tp_mult': 2.038166162276013, 'tsl_mult': 0.6399053526451224, 'strategy': 'breakout', 'time_stop': 227, 'use_sma': True, 'use_atr': True, 'use_adx': False, 'use_ema': False, 'use_spike': True, 'rsi_required': True, 'edge_k': 0.13569303757052242, 'edge_cap': 0.8846928187255899, 'bull_strategy': 'mean_reversion', 'bull_bb_std_mult': 0.7144559739867852, 'bull_rsi_os': 40, 'bull_rsi_ob': 86, 'bull_adx_thresh': 34.75964512799568, 'bull_atr_min_pct': 0.01457754268919707, 'bull_atr_max_pct': 0.1471063483694777, 'bull_tp_mult': 1.7043182714600846, 'bull_tsl_mult': 0.4363498713832184, 'bull_time_stop': 175, 'bull_use_sma': True, 'bull_use_ema': True, 'bull_use_atr': False, 'bull_use_adx': False, 'bull_use_spike': False, 'bull_rsi_required': True, 'bear_strategy': 'breakout', 'bear_bb_std_mult': 1.5408248055224232, 'bear_rsi_os': 36, 'bear_rsi_ob': 68, 'bear_adx_thresh': 14.705447287039092, 'bear_atr_min_pct': 0.0038633026944524464, 'bear_atr_max_pct': 0.08505204193535812, 'bear_tp_mult': 1.4903152192805005, 'bear_tsl_mult': 0.520199014010424, 'bear_time_stop': 38, 'bear_use_sma': False, 'bear_use_ema': True, 'bear_use_atr': False, 'bear_use_adx': True, 'bear_use_spike': False, 'bear_rsi_required': False, 'sideways_strategy': 'breakout', 'sideways_bb_std_mult': 2.9432129071977693, 'sideways_rsi_os': 16, 'sideways_rsi_ob': 65, 'sideways_adx_thresh': 22.080028970157827, 'sideways_atr_min_pct': 0.003055332997636896, 'sideways_atr_max_pct': 0.04102655178215774, 'sideways_tp_mult': 2.114701332035489, 'sideways_tsl_mult': 0.16480055877760902, 'sideways_time_stop': 78, 'sideways_use_sma': False, 'sideways_use_ema': False, 'sideways_use_atr': True, 'sideways_use_adx': False, 'sideways_use_spike': False, 'sideways_rsi_required': True}.
[I 2025-08-31 10:16:44,222] Trial 171 finished with values: [-1000000000.0, 1000000000.0] and parameters: {'p_sma': 14, 'p_std': 25, 'p_atr': 30, 'p_adx': 15, 'rsi_period': 34, 'ema1': 17, 'ema2': 52, 'slip_atr_k': 0.17383120235158311, 'slip_spread_k': 0.8924909691488098, 'spread_hl_frac': 0.009521045311964987, 'bb_std_mult': 0.509687313080184, 'rsi_os': 25, 'rsi_ob': 50, 'vol_spike': 0.2540359732136708, 'adx_thresh': 32.25019282889462, 'atr_min_pct': 0.0018280245407174375, 'atr_max_pct': 0.02022120165221255, 'tp_mult': 1.9182286220462128, 'tsl_mult': 0.640040610459467, 'strategy': 'breakout', 'time_stop': 229, 'use_sma': True, 'use_atr': True, 'use_adx': False, 'use_ema': False, 'use_spike': True, 'rsi_required': True, 'edge_k': 0.158378258245778, 'edge_cap': 0.8722136351147037, 'bull_strategy': 'mean_reversion', 'bull_bb_std_mult': 0.722364291250853, 'bull_rsi_os': 40, 'bull_rsi_ob': 72, 'bull_adx_thresh': 24.602231826550998, 'bull_atr_min_pct': 0.01661504312915354, 'bull_atr_max_pct': 0.13291325319242334, 'bull_tp_mult': 1.2420225336027766, 'bull_tsl_mult': 0.4309915811013658, 'bull_time_stop': 78, 'bull_use_sma': True, 'bull_use_ema': True, 'bull_use_atr': False, 'bull_use_adx': False, 'bull_use_spike': False, 'bull_rsi_required': True, 'bear_strategy': 'breakout', 'bear_bb_std_mult': 0.676105134723888, 'bear_rsi_os': 39, 'bear_rsi_ob': 68, 'bear_adx_thresh': 14.879242292427072, 'bear_atr_min_pct': 0.003960805553408598, 'bear_atr_max_pct': 0.08462207646407863, 'bear_tp_mult': 1.5090897650217652, 'bear_tsl_mult': 0.5293873657094217, 'bear_time_stop': 35, 'bear_use_sma': False, 'bear_use_ema': True, 'bear_use_atr': False, 'bear_use_adx': True, 'bear_use_spike': False, 'bear_rsi_required': False, 'sideways_strategy': 'breakout', 'sideways_bb_std_mult': 2.933912524751618, 'sideways_rsi_os': 12, 'sideways_rsi_ob': 91, 'sideways_adx_thresh': 22.879914220901362, 'sideways_atr_min_pct': 0.006072157352452124, 'sideways_atr_max_pct': 0.040528908023571925, 'sideways_tp_mult': 1.9116305398467057, 'sideways_tsl_mult': 0.10614622296842821, 'sideways_time_stop': 77, 'sideways_use_sma': False, 'sideways_use_ema': False, 'sideways_use_atr': True, 'sideways_use_adx': False, 'sideways_use_spike': False, 'sideways_rsi_required': True}.
[I 2025-08-31 10:16:44,227] Trial 172 finished with values: [-0.045356067195320815, 0.0454206466487533] and parameters: {'p_sma': 9, 'p_std': 16, 'p_atr': 30, 'p_adx': 17, 'rsi_period': 33, 'ema1': 17, 'ema2': 53, 'slip_atr_k': 0.14817117885176695, 'slip_spread_k': 0.8795039622169109, 'spread_hl_frac': 0.009871560015658557, 'bb_std_mult': 0.6866281392062652, 'rsi_os': 25, 'rsi_ob': 76, 'vol_spike': 0.2575182342174238, 'adx_thresh': 31.222448768939405, 'atr_min_pct': 0.0019587855777399676, 'atr_max_pct': 0.09291662666980553, 'tp_mult': 1.747823023627094, 'tsl_mult': 0.6438851920682304, 'strategy': 'breakout', 'time_stop': 230, 'use_sma': True, 'use_atr': True, 'use_adx': False, 'use_ema': False, 'use_spike': True, 'rsi_required': True, 'edge_k': 0.06635314770064973, 'edge_cap': 0.884295944506546, 'bull_strategy': 'mean_reversion', 'bull_bb_std_mult': 0.7210602218176538, 'bull_rsi_os': 40, 'bull_rsi_ob': 73, 'bull_adx_thresh': 24.726913265146496, 'bull_atr_min_pct': 0.012842539009853408, 'bull_atr_max_pct': 0.1498605957305149, 'bull_tp_mult': 1.6810150633310417, 'bull_tsl_mult': 0.46939255952726916, 'bull_time_stop': 277, 'bull_use_sma': True, 'bull_use_ema': True, 'bull_use_atr': False, 'bull_use_adx': False, 'bull_use_spike': False, 'bull_rsi_required': True, 'bear_strategy': 'breakout', 'bear_bb_std_mult': 1.569784720432669, 'bear_rsi_os': 36, 'bear_rsi_ob': 65, 'bear_adx_thresh': 14.836326741621166, 'bear_atr_min_pct': 0.0012147985911320396, 'bear_atr_max_pct': 0.09197221980438143, 'bear_tp_mult': 1.4792552504684418, 'bear_tsl_mult': 0.5275277105002345, 'bear_time_stop': 39, 'bear_use_sma': False, 'bear_use_ema': True, 'bear_use_atr': False, 'bear_use_adx': True, 'bear_use_spike': False, 'bear_rsi_required': False, 'sideways_strategy': 'breakout', 'sideways_bb_std_mult': 2.9669771202253608, 'sideways_rsi_os': 12, 'sideways_rsi_ob': 87, 'sideways_adx_thresh': 22.964321984689498, 'sideways_atr_min_pct': 0.005998001702780392, 'sideways_atr_max_pct': 0.042312920309500804, 'sideways_tp_mult': 1.8969040413645921, 'sideways_tsl_mult': 0.9533569814226317, 'sideways_time_stop': 79, 'sideways_use_sma': False, 'sideways_use_ema': False, 'sideways_use_atr': True, 'sideways_use_adx': False, 'sideways_use_spike': False, 'sideways_rsi_required': True}.
[I 2025-08-31 10:16:44,408] Trial 173 finished with values: [-1000000000.0, 1000000000.0] and parameters: {'p_sma': 9, 'p_std': 16, 'p_atr': 30, 'p_adx': 17, 'rsi_period': 32, 'ema1': 17, 'ema2': 42, 'slip_atr_k': 0.172044910465734, 'slip_spread_k': 0.3977278173440383, 'spread_hl_frac': 0.00966807630492562, 'bb_std_mult': 0.713660701491561, 'rsi_os': 25, 'rsi_ob': 76, 'vol_spike': 0.2548575129069839, 'adx_thresh': 29.225918209020268, 'atr_min_pct': 0.0015653480150414015, 'atr_max_pct': 0.08515758430952995, 'tp_mult': 2.320758254243284, 'tsl_mult': 0.641199769608794, 'strategy': 'breakout', 'time_stop': 226, 'use_sma': True, 'use_atr': True, 'use_adx': False, 'use_ema': False, 'use_spike': True, 'rsi_required': True, 'edge_k': 0.15007703404722791, 'edge_cap': 0.8794638752378077, 'bull_strategy': 'mean_reversion', 'bull_bb_std_mult': 0.7220130729462054, 'bull_rsi_os': 39, 'bull_rsi_ob': 54, 'bull_adx_thresh': 34.87570373281997, 'bull_atr_min_pct': 0.029575862001173098, 'bull_atr_max_pct': 0.149401489874023, 'bull_tp_mult': 2.1574577714717726, 'bull_tsl_mult': 0.436788371367609, 'bull_time_stop': 169, 'bull_use_sma': True, 'bull_use_ema': True, 'bull_use_atr': False, 'bull_use_adx': False, 'bull_use_spike': False, 'bull_rsi_required': True, 'bear_strategy': 'breakout', 'bear_bb_std_mult': 1.4102281432491879, 'bear_rsi_os': 37, 'bear_rsi_ob': 66, 'bear_adx_thresh': 14.812726596619033, 'bear_atr_min_pct': 0.003639870435979851, 'bear_atr_max_pct': 0.09269191236707386, 'bear_tp_mult': 2.561709778777785, 'bear_tsl_mult': 0.5175550818727448, 'bear_time_stop': 38, 'bear_use_sma': False, 'bear_use_ema': True, 'bear_use_atr': False, 'bear_use_adx': True, 'bear_use_spike': False, 'bear_rsi_required': False, 'sideways_strategy': 'breakout', 'sideways_bb_std_mult': 2.9346365600135607, 'sideways_rsi_os': 17, 'sideways_rsi_ob': 65, 'sideways_adx_thresh': 21.996397979834754, 'sideways_atr_min_pct': 0.00316101527349922, 'sideways_atr_max_pct': 0.056206634454708596, 'sideways_tp_mult': 2.1065351991345875, 'sideways_tsl_mult': 0.5199212390079321, 'sideways_time_stop': 85, 'sideways_use_sma': False, 'sideways_use_ema': False, 'sideways_use_atr': True, 'sideways_use_adx': False, 'sideways_use_spike': False, 'sideways_rsi_required': True}.
[I 2025-08-31 10:17:15,588] Trial 177 finished with values: [-1000000000.0, 1000000000.0] and parameters: {'p_sma': 18, 'p_std': 33, 'p_atr': 29, 'p_adx': 19, 'rsi_period': 65, 'ema1': 18, 'ema2': 43, 'slip_atr_k': 0.021858515319076607, 'slip_spread_k': 0.4018014744598508, 'spread_hl_frac': 0.011256787477671277, 'bb_std_mult': 0.8792171959974762, 'rsi_os': 23, 'rsi_ob': 87, 'vol_spike': 0.2713194165511255, 'adx_thresh': 29.344251507176885, 'atr_min_pct': 0.004467989338820498, 'atr_max_pct': 0.08930656731956173, 'tp_mult': 2.155041654262074, 'tsl_mult': 0.675201582484369, 'strategy': 'breakout', 'time_stop': 209, 'use_sma': True, 'use_atr': True, 'use_adx': False, 'use_ema': False, 'use_spike': True, 'rsi_required': False, 'edge_k': 0.2057992283958585, 'edge_cap': 0.9657912184482845, 'bull_strategy': 'mean_reversion', 'bull_bb_std_mult': 0.7885230733679565, 'bull_rsi_os': 42, 'bull_rsi_ob': 62, 'bull_adx_thresh': 25.84328450064261, 'bull_atr_min_pct': 0.024830929251968475, 'bull_atr_max_pct': 0.12200108586497142, 'bull_tp_mult': 1.5751125007758475, 'bull_tsl_mult': 0.3958148754317488, 'bull_time_stop': 287, 'bull_use_sma': True, 'bull_use_ema': True, 'bull_use_atr': True, 'bull_use_adx': False, 'bull_use_spike': True, 'bull_rsi_required': True, 'bear_strategy': 'breakout', 'bear_bb_std_mult': 1.3208629796937619, 'bear_rsi_os': 38, 'bear_rsi_ob': 66, 'bear_adx_thresh': 16.38462210308636, 'bear_atr_min_pct': 0.0032981354183035, 'bear_atr_max_pct': 0.08285623229426285, 'bear_tp_mult': 2.4920943301377143, 'bear_tsl_mult': 0.4542184479485273, 'bear_time_stop': 45, 'bear_use_sma': False, 'bear_use_ema': True, 'bear_use_atr': False, 'bear_use_adx': True, 'bear_use_spike': True, 'bear_rsi_required': False, 'sideways_strategy': 'breakout', 'sideways_bb_std_mult': 2.8570671747352607, 'sideways_rsi_os': 6, 'sideways_rsi_ob': 80, 'sideways_adx_thresh': 5.068351532985281, 'sideways_atr_min_pct': 0.0013966785589996523, 'sideways_atr_max_pct': 0.03294549464823327, 'sideways_tp_mult': 2.043536098368798, 'sideways_tsl_mult': 0.13586068054147457, 'sideways_time_stop': 67, 'sideways_use_sma': False, 'sideways_use_ema': False, 'sideways_use_atr': True, 'sideways_use_adx': False, 'sideways_use_spike': False, 'sideways_rsi_required': True}.
[I 2025-08-31 10:17:16,502] Trial 175 finished with values: [-0.03262003757732368, 0.03212142512459918] and parameters: {'p_sma': 9, 'p_std': 14, 'p_atr': 30, 'p_adx': 19, 'rsi_period': 7, 'ema1': 17, 'ema2': 42, 'slip_atr_k': 0.07762806789456397, 'slip_spread_k': 0.5684763516313115, 'spread_hl_frac': 0.010585232945750506, 'bb_std_mult': 0.8853121951524614, 'rsi_os': 23, 'rsi_ob': 75, 'vol_spike': 0.276806634931516, 'adx_thresh': 31.01999703888268, 'atr_min_pct': 0.003960878718540766, 'atr_max_pct': 0.10078403854380782, 'tp_mult': 1.8962003315601677, 'tsl_mult': 0.5404781387271429, 'strategy': 'breakout', 'time_stop': 232, 'use_sma': True, 'use_atr': True, 'use_adx': False, 'use_ema': False, 'use_spike': True, 'rsi_required': True, 'edge_k': 0.21770748837560994, 'edge_cap': 0.8607262176020838, 'bull_strategy': 'mean_reversion', 'bull_bb_std_mult': 0.6084350506961792, 'bull_rsi_os': 38, 'bull_rsi_ob': 64, 'bull_adx_thresh': 24.67564325007424, 'bull_atr_min_pct': 0.025833783494689476, 'bull_atr_max_pct': 0.13279574973093095, 'bull_tp_mult': 1.2100977245123072, 'bull_tsl_mult': 0.3991967965627051, 'bull_time_stop': 290, 'bull_use_sma': True, 'bull_use_ema': True, 'bull_use_atr': False, 'bull_use_adx': False, 'bull_use_spike': False, 'bull_rsi_required': True, 'bear_strategy': 'breakout', 'bear_bb_std_mult': 1.417734123614745, 'bear_rsi_os': 39, 'bear_rsi_ob': 66, 'bear_adx_thresh': 16.470326799517878, 'bear_atr_min_pct': 0.002908595025741202, 'bear_atr_max_pct': 0.08252972304398379, 'bear_tp_mult': 1.345228433161785, 'bear_tsl_mult': 0.541704572225427, 'bear_time_stop': 36, 'bear_use_sma': False, 'bear_use_ema': True, 'bear_use_atr': False, 'bear_use_adx': True, 'bear_use_spike': False, 'bear_rsi_required': False, 'sideways_strategy': 'breakout', 'sideways_bb_std_mult': 2.9148221636808227, 'sideways_rsi_os': 17, 'sideways_rsi_ob': 80, 'sideways_adx_thresh': 23.119603258386118, 'sideways_atr_min_pct': 0.005416538353934247, 'sideways_atr_max_pct': 0.056996187063486733, 'sideways_tp_mult': 1.9244281760869972, 'sideways_tsl_mult': 0.9182232752399856, 'sideways_time_stop': 66, 'sideways_use_sma': False, 'sideways_use_ema': False, 'sideways_use_atr': True, 'sideways_use_adx': False, 'sideways_use_spike': False, 'sideways_rsi_required': True}.
[I 2025-08-31 10:17:16,548] Trial 176 finished with values: [-0.0437162322485285, 0.043674748234825866] and parameters: {'p_sma': 18, 'p_std': 14, 'p_atr': 29, 'p_adx': 16, 'rsi_period': 11, 'ema1': 18, 'ema2': 10, 'slip_atr_k': 0.020735840014822034, 'slip_spread_k': 0.415012881027102, 'spread_hl_frac': 0.011098720309126207, 'bb_std_mult': 0.9247550956989401, 'rsi_os': 23, 'rsi_ob': 62, 'vol_spike': 0.27567969129796005, 'adx_thresh': 29.348069519627806, 'atr_min_pct': 0.0046086438208259055, 'atr_max_pct': 0.08599874119113422, 'tp_mult': 2.1042216229405946, 'tsl_mult': 0.5413057597884774, 'strategy': 'breakout', 'time_stop': 219, 'use_sma': True, 'use_atr': True, 'use_adx': False, 'use_ema': False, 'use_spike': True, 'rsi_required': False, 'edge_k': 1.4154774032982629, 'edge_cap': 0.9987036427263452, 'bull_strategy': 'mean_reversion', 'bull_bb_std_mult': 0.793014585980583, 'bull_rsi_os': 42, 'bull_rsi_ob': 58, 'bull_adx_thresh': 26.45617049647525, 'bull_atr_min_pct': 0.013537483352818937, 'bull_atr_max_pct': 0.12144225881099778, 'bull_tp_mult': 2.1784964076098148, 'bull_tsl_mult': 0.39411304929743374, 'bull_time_stop': 242, 'bull_use_sma': True, 'bull_use_ema': True, 'bull_use_atr': True, 'bull_use_adx': False, 'bull_use_spike': True, 'bull_rsi_required': True, 'bear_strategy': 'breakout', 'bear_bb_std_mult': 1.314344376235858, 'bear_rsi_os': 38, 'bear_rsi_ob': 66, 'bear_adx_thresh': 16.823883604903934, 'bear_atr_min_pct': 0.003197698929285617, 'bear_atr_max_pct': 0.08200377538635001, 'bear_tp_mult': 2.5802494136229357, 'bear_tsl_mult': 0.4633378796661157, 'bear_time_stop': 43, 'bear_use_sma': False, 'bear_use_ema': True, 'bear_use_atr': False, 'bear_use_adx': True, 'bear_use_spike': True, 'bear_rsi_required': False, 'sideways_strategy': 'breakout', 'sideways_bb_std_mult': 2.883194244877801, 'sideways_rsi_os': 14, 'sideways_rsi_ob': 81, 'sideways_adx_thresh': 23.61986575156745, 'sideways_atr_min_pct': 0.0014489742618454256, 'sideways_atr_max_pct': 0.05769003897747689, 'sideways_tp_mult': 2.0184182858036843, 'sideways_tsl_mult': 0.5110726657762589, 'sideways_time_stop': 66, 'sideways_use_sma': False, 'sideways_use_ema': False, 'sideways_use_atr': True, 'sideways_use_adx': False, 'sideways_use_spike': False, 'sideways_rsi_required': True}.
[I 2025-08-31 10:17:17,085] Trial 178 finished with values: [-0.02055474636704735, 0.02228933888629327] and parameters: {'p_sma': 21, 'p_std': 30, 'p_atr': 29, 'p_adx': 19, 'rsi_period': 19, 'ema1': 18, 'ema2': 45, 'slip_atr_k': 0.020938576779737216, 'slip_spread_k': 0.5942193779743927, 'spread_hl_frac': 0.011547514886798355, 'bb_std_mult': 0.6133882116594671, 'rsi_os': 27, 'rsi_ob': 74, 'vol_spike': 0.27475840322897416, 'adx_thresh': 28.662695761565388, 'atr_min_pct': 0.017620194897335437, 'atr_max_pct': 0.09978914778847854, 'tp_mult': 2.163466188622115, 'tsl_mult': 0.56325319767295, 'strategy': 'breakout', 'time_stop': 148, 'use_sma': True, 'use_atr': True, 'use_adx': False, 'use_ema': True, 'use_spike': True, 'rsi_required': False, 'edge_k': 1.624828323057514, 'edge_cap': 0.8658542794496437, 'bull_strategy': 'breakout', 'bull_bb_std_mult': 0.5947914088886999, 'bull_rsi_os': 42, 'bull_rsi_ob': 80, 'bull_adx_thresh': 26.14221303050157, 'bull_atr_min_pct': 0.020255804578904867, 'bull_atr_max_pct': 0.12788742063372927, 'bull_tp_mult': 1.5741628391390947, 'bull_tsl_mult': 0.4053540891849714, 'bull_time_stop': 254, 'bull_use_sma': True, 'bull_use_ema': True, 'bull_use_atr': True, 'bull_use_adx': False, 'bull_use_spike': True, 'bull_rsi_required': True, 'bear_strategy': 'breakout', 'bear_bb_std_mult': 1.282543912132105, 'bear_rsi_os': 38, 'bear_rsi_ob': 69, 'bear_adx_thresh': 16.627343601660602, 'bear_atr_min_pct': 0.002778121283389697, 'bear_atr_max_pct': 0.08180386388144564, 'bear_tp_mult': 2.0320436515245333, 'bear_tsl_mult': 0.46634215921549405, 'bear_time_stop': 44, 'bear_use_sma': False, 'bear_use_ema': True, 'bear_use_atr': False, 'bear_use_adx': False, 'bear_use_spike': True, 'bear_rsi_required': False, 'sideways_strategy': 'breakout', 'sideways_bb_std_mult': 2.8819266665142056, 'sideways_rsi_os': 14, 'sideways_rsi_ob': 80, 'sideways_adx_thresh': 15.10869099914801, 'sideways_atr_min_pct': 0.00139229050857426, 'sideways_atr_max_pct': 0.01330869163708169, 'sideways_tp_mult': 2.035152516470179, 'sideways_tsl_mult': 0.1452396955112807, 'sideways_time_stop': 66, 'sideways_use_sma': False, 'sideways_use_ema': False, 'sideways_use_atr': False, 'sideways_use_adx': True, 'sideways_use_spike': True, 'sideways_rsi_required': True}.
[I 2025-08-31 10:17:48,385] Trial 182 finished with values: [-1000000000.0, 1000000000.0] and parameters: {'p_sma': 31, 'p_std': 40, 'p_atr': 30, 'p_adx': 20, 'rsi_period': 39, 'ema1': 16, 'ema2': 28, 'slip_atr_k': 0.02883620889554788, 'slip_spread_k': 0.9482310312770735, 'spread_hl_frac': 0.03210837188879597, 'bb_std_mult': 1.040751707586722, 'rsi_os': 26, 'rsi_ob': 80, 'vol_spike': 0.24710287933300237, 'adx_thresh': 30.39865842831138, 'atr_min_pct': 0.020934405270050943, 'atr_max_pct': 0.06850436500739167, 'tp_mult': 2.3505617120302023, 'tsl_mult': 0.6987024610884595, 'strategy': 'breakout', 'time_stop': 239, 'use_sma': True, 'use_atr': False, 'use_adx': True, 'use_ema': True, 'use_spike': True, 'rsi_required': False, 'edge_k': 0.9652149696689465, 'edge_cap': 0.8402247171451883, 'bull_strategy': 'breakout', 'bull_bb_std_mult': 0.8223476836433427, 'bull_rsi_os': 38, 'bull_rsi_ob': 82, 'bull_adx_thresh': 25.113341623626397, 'bull_atr_min_pct': 0.02763228070571732, 'bull_atr_max_pct': 0.14467438561644802, 'bull_tp_mult': 2.2746742824981023, 'bull_tsl_mult': 0.368582332374404, 'bull_time_stop': 88, 'bull_use_sma': True, 'bull_use_ema': False, 'bull_use_atr': True, 'bull_use_adx': True, 'bull_use_spike': True, 'bull_rsi_required': False, 'bear_strategy': 'breakout', 'bear_bb_std_mult': 1.8554453570022476, 'bear_rsi_os': 40, 'bear_rsi_ob': 69, 'bear_adx_thresh': 15.970857000567612, 'bear_atr_min_pct': 0.005571438792726555, 'bear_atr_max_pct': 0.0867360749519125, 'bear_tp_mult': 1.2919106284012263, 'bear_tsl_mult': 0.49796348335401525, 'bear_time_stop': 23, 'bear_use_sma': False, 'bear_use_ema': True, 'bear_use_atr': False, 'bear_use_adx': False, 'bear_use_spike': True, 'bear_rsi_required': False, 'sideways_strategy': 'mean_reversion', 'sideways_bb_std_mult': 3.033491001506074, 'sideways_rsi_os': 54, 'sideways_rsi_ob': 82, 'sideways_adx_thresh': 24.70701623471604, 'sideways_atr_min_pct': 0.0040036485689180735, 'sideways_atr_max_pct': 0.061378697424131434, 'sideways_tp_mult': 1.982090902260352, 'sideways_tsl_mult': 0.6963403944316373, 'sideways_time_stop': 32, 'sideways_use_sma': False, 'sideways_use_ema': False, 'sideways_use_atr': False, 'sideways_use_adx': True, 'sideways_use_spike': True, 'sideways_rsi_required': False}.
