[I 2025-08-31 10:03:01,776] Trial 72 finished with values: [-1000000000.0, 1000000000.0] and parameters: {'p_sma': 12, 'p_std': 12, 'p_atr': 16, 'p_adx': 28, 'rsi_period': 72, 'ema1': 9, 'ema2': 15, 'slip_atr_k': 0.21165732359393935, 'slip_spread_k': 0.033425771824790756, 'spread_hl_frac': 0.0003635059682432079, 'bb_std_mult': 0.9955088740651774, 'rsi_os': 17, 'rsi_ob': 48, 'vol_spike': 0.14733488234358033, 'adx_thresh': 7.440551774404497, 'atr_min_pct': 0.026387347710721234, 'atr_max_pct': 0.1487182981623503, 'tp_mult': 2.324141319118938, 'tsl_mult': 0.04295265746557153, 'strategy': 'mean_reversion', 'time_stop': 38, 'use_sma': True, 'use_atr': False, 'use_adx': True, 'use_ema': True, 'use_spike': False, 'rsi_required': True, 'edge_k': 1.1607635794830677, 'edge_cap': 0.137555164123425, 'bull_strategy': 'mean_reversion', 'bull_bb_std_mult': 2.924082844785886, 'bull_rsi_os': 37, 'bull_rsi_ob': 94, 'bull_adx_thresh': 16.528569284857713, 'bull_atr_min_pct': 0.02218179690264239, 'bull_atr_max_pct': 0.04241971104754304, 'bull_tp_mult': 2.2193027633610574, 'bull_tsl_mult': 0.4953224232835695, 'bull_time_stop': 67, 'bull_use_sma': False, 'bull_use_ema': True, 'bull_use_atr': True, 'bull_use_adx': True, 'bull_use_spike': True, 'bull_rsi_required': False, 'bear_strategy': 'mean_reversion', 'bear_bb_std_mult': 1.4540244361100347, 'bear_rsi_os': 28, 'bear_rsi_ob': 57, 'bear_adx_thresh': 20.620741772428925, 'bear_atr_min_pct': 0.01927471707506779, 'bear_atr_max_pct': 0.015880417817454587, 'bear_tp_mult': 2.613695534227686, 'bear_tsl_mult': 0.31197394832814584, 'bear_time_stop': 97, 'bear_use_sma': True, 'bear_use_ema': False, 'bear_use_atr': True, 'bear_use_adx': False, 'bear_use_spike': True, 'bear_rsi_required': True, 'sideways_strategy': 'mean_reversion', 'sideways_bb_std_mult': 3.102689765284371, 'sideways_rsi_os': 32, 'sideways_rsi_ob': 89, 'sideways_adx_thresh': 24.052940508387735, 'sideways_atr_min_pct': 0.00833342200883045, 'sideways_atr_max_pct': 0.09990907198434705, 'sideways_tp_mult': 2.61526472559904, 'sideways_tsl_mult': 0.9067766703695224, 'sideways_time_stop': 74, 'sideways_use_sma': True, 'sideways_use_ema': True, 'sideways_use_atr': True, 'sideways_use_adx': True, 'sideways_use_spike': False, 'sideways_rsi_required': False}.
[I 2025-08-31 10:03:31,275] Trial 71 finished with values: [-1000000000.0, 1000000000.0] and parameters: {'p_sma': 34, 'p_std': 12, 'p_atr': 17, 'p_adx': 28, 'rsi_period': 64, 'ema1': 8, 'ema2': 15, 'slip_atr_k': 0.11591579593992518, 'slip_spread_k': 0.03694576928890933, 'spread_hl_frac': 0.008984285713733671, 'bb_std_mult': 1.1676801462383106, 'rsi_os': 37, 'rsi_ob': 90, 'vol_spike': 0.1685554301272316, 'adx_thresh': 14.062845131879904, 'atr_min_pct': 0.026890014104790895, 'atr_max_pct': 0.14986736870766404, 'tp_mult': 2.583499886521451, 'tsl_mult': 0.16314082392956658, 'strategy': 'mean_reversion', 'time_stop': 213, 'use_sma': True, 'use_atr': False, 'use_adx': True, 'use_ema': True, 'use_spike': False, 'rsi_required': True, 'edge_k': 0.7410959701478834, 'edge_cap': 0.14322348238356497, 'bull_strategy': 'mean_reversion', 'bull_bb_std_mult': 3.242960772384192, 'bull_rsi_os': 38, 'bull_rsi_ob': 73, 'bull_adx_thresh': 16.623947999146257, 'bull_atr_min_pct': 0.01789904587762127, 'bull_atr_max_pct': 0.08597699941265742, 'bull_tp_mult': 1.4604174289569662, 'bull_tsl_mult': 0.48896210114011385, 'bull_time_stop': 68, 'bull_use_sma': True, 'bull_use_ema': True, 'bull_use_atr': True, 'bull_use_adx': True, 'bull_use_spike': True, 'bull_rsi_required': False, 'bear_strategy': 'breakout', 'bear_bb_std_mult': 2.291716080604003, 'bear_rsi_os': 28, 'bear_rsi_ob': 63, 'bear_adx_thresh': 31.305849894987368, 'bear_atr_min_pct': 0.011893754952095773, 'bear_atr_max_pct': 0.015465529818745164, 'bear_tp_mult': 2.7803717259939393, 'bear_tsl_mult': 0.6531477968237741, 'bear_time_stop': 165, 'bear_use_sma': True, 'bear_use_ema': False, 'bear_use_atr': True, 'bear_use_adx': False, 'bear_use_spike': True, 'bear_rsi_required': False, 'sideways_strategy': 'mean_reversion', 'sideways_bb_std_mult': 3.463019863452374, 'sideways_rsi_os': 43, 'sideways_rsi_ob': 51, 'sideways_adx_thresh': 23.68262345821243, 'sideways_atr_min_pct': 0.00813179177630207, 'sideways_atr_max_pct': 0.14920967739430774, 'sideways_tp_mult': 2.5909360872213765, 'sideways_tsl_mult': 0.927790700630936, 'sideways_time_stop': 105, 'sideways_use_sma': True, 'sideways_use_ema': True, 'sideways_use_atr': True, 'sideways_use_adx': True, 'sideways_use_spike': False, 'sideways_rsi_required': False}.
[I 2025-08-31 10:03:33,322] Trial 74 finished with values: [-0.013139091778744283, 0.013508166567633156] and parameters: {'p_sma': 54, 'p_std': 54, 'p_atr': 8, 'p_adx': 29, 'rsi_period': 46, 'ema1': 6, 'ema2': 55, 'slip_atr_k': 0.021470244282925308, 'slip_spread_k': 0.1324533063999892, 'spread_hl_frac': 0.008550899433042474, 'bb_std_mult': 1.3296219480015161, 'rsi_os': 21, 'rsi_ob': 63, 'vol_spike': 0.16837472404584253, 'adx_thresh': 11.75892984252418, 'atr_min_pct': 0.008456159911027555, 'atr_max_pct': 0.145019907397688, 'tp_mult': 2.5480197559491335, 'tsl_mult': 0.9123584419006747, 'strategy': 'mean_reversion', 'time_stop': 27, 'use_sma': False, 'use_atr': False, 'use_adx': True, 'use_ema': True, 'use_spike': False, 'rsi_required': False, 'edge_k': 1.1541348277341175, 'edge_cap': 0.14206141910579123, 'bull_strategy': 'breakout', 'bull_bb_std_mult': 2.951517322799571, 'bull_rsi_os': 27, 'bull_rsi_ob': 63, 'bull_adx_thresh': 14.690640256357472, 'bull_atr_min_pct': 0.002260335823403731, 'bull_atr_max_pct': 0.09476052818882125, 'bull_tp_mult': 2.7231631625899593, 'bull_tsl_mult': 0.74502579448798, 'bull_time_stop': 127, 'bull_use_sma': False, 'bull_use_ema': False, 'bull_use_atr': True, 'bull_use_adx': True, 'bull_use_spike': True, 'bull_rsi_required': False, 'bear_strategy': 'mean_reversion', 'bear_bb_std_mult': 3.1616722675638966, 'bear_rsi_os': 26, 'bear_rsi_ob': 57, 'bear_adx_thresh': 31.462293370673176, 'bear_atr_min_pct': 0.009003021429299412, 'bear_atr_max_pct': 0.11359070576278196, 'bear_tp_mult': 2.8409699696600814, 'bear_tsl_mult': 0.25271890344354164, 'bear_time_stop': 104, 'bear_use_sma': True, 'bear_use_ema': False, 'bear_use_atr': True, 'bear_use_adx': False, 'bear_use_spike': True, 'bear_rsi_required': True, 'sideways_strategy': 'mean_reversion', 'sideways_bb_std_mult': 3.09588688636009, 'sideways_rsi_os': 35, 'sideways_rsi_ob': 50, 'sideways_adx_thresh': 27.573811130453105, 'sideways_atr_min_pct': 0.008066036596800332, 'sideways_atr_max_pct': 0.1005628085382708, 'sideways_tp_mult': 1.642498477663951, 'sideways_tsl_mult': 0.2544816689026722, 'sideways_time_stop': 112, 'sideways_use_sma': True, 'sideways_use_ema': True, 'sideways_use_atr': False, 'sideways_use_adx': True, 'sideways_use_spike': True, 'sideways_rsi_required': False}.
[I 2025-08-31 10:03:34,341] Trial 76 finished with values: [-0.027281474531200223, 0.027107681849637962] and parameters: {'p_sma': 24, 'p_std': 9, 'p_atr': 19, 'p_adx': 29, 'rsi_period': 11, 'ema1': 6, 'ema2': 56, 'slip_atr_k': 0.12955529257758605, 'slip_spread_k': 0.1280347497228968, 'spread_hl_frac': 0.009817145297942462, 'bb_std_mult': 1.2199386202622287, 'rsi_os': 20, 'rsi_ob': 56, 'vol_spike': 0.16751077559924135, 'adx_thresh': 11.568541839957408, 'atr_min_pct': 0.00836573957259953, 'atr_max_pct': 0.14400986009025712, 'tp_mult': 1.9662190907141694, 'tsl_mult': 0.9146882383629629, 'strategy': 'breakout', 'time_stop': 212, 'use_sma': False, 'use_atr': False, 'use_adx': True, 'use_ema': True, 'use_spike': False, 'rsi_required': False, 'edge_k': 1.2622779435872682, 'edge_cap': 0.08350637753875556, 'bull_strategy': 'breakout', 'bull_bb_std_mult': 2.5677358479619925, 'bull_rsi_os': 14, 'bull_rsi_ob': 63, 'bull_adx_thresh': 14.782947791699106, 'bull_atr_min_pct': 0.002596776608530741, 'bull_atr_max_pct': 0.0935920424280356, 'bull_tp_mult': 2.4982647780070386, 'bull_tsl_mult': 0.31435493257397124, 'bull_time_stop': 128, 'bull_use_sma': False, 'bull_use_ema': False, 'bull_use_atr': False, 'bull_use_adx': True, 'bull_use_spike': False, 'bull_rsi_required': False, 'bear_strategy': 'mean_reversion', 'bear_bb_std_mult': 3.05110199075741, 'bear_rsi_os': 12, 'bear_rsi_ob': 67, 'bear_adx_thresh': 25.583685107260045, 'bear_atr_min_pct': 0.020664380894686585, 'bear_atr_max_pct': 0.010223040154886627, 'bear_tp_mult': 1.256912921838451, 'bear_tsl_mult': 0.2540606229665089, 'bear_time_stop': 182, 'bear_use_sma': True, 'bear_use_ema': True, 'bear_use_atr': True, 'bear_use_adx': False, 'bear_use_spike': True, 'bear_rsi_required': True, 'sideways_strategy': 'mean_reversion', 'sideways_bb_std_mult': 3.4426428618320726, 'sideways_rsi_os': 35, 'sideways_rsi_ob': 49, 'sideways_adx_thresh': 27.212635424001945, 'sideways_atr_min_pct': 0.02848262134484095, 'sideways_atr_max_pct': 0.05176418772615268, 'sideways_tp_mult': 1.625175987449773, 'sideways_tsl_mult': 0.3571423950145659, 'sideways_time_stop': 111, 'sideways_use_sma': False, 'sideways_use_ema': False, 'sideways_use_atr': False, 'sideways_use_adx': False, 'sideways_use_spike': True, 'sideways_rsi_required': False}.
[I 2025-08-31 10:03:34,637] Trial 75 finished with values: [-1000000000.0, 1000000000.0] and parameters: {'p_sma': 22, 'p_std': 57, 'p_atr': 8, 'p_adx': 29, 'rsi_period': 46, 'ema1': 6, 'ema2': 56, 'slip_atr_k': 0.12847095625840674, 'slip_spread_k': 0.12854665330433357, 'spread_hl_frac': 0.009475045196359295, 'bb_std_mult': 1.1926732800834394, 'rsi_os': 19, 'rsi_ob': 64, 'vol_spike': 0.14243241730036754, 'adx_thresh': 33.74726753607645, 'atr_min_pct': 0.0005259172982452348, 'atr_max_pct': 0.14324055219025006, 'tp_mult': 2.395263485813322, 'tsl_mult': 0.00022065246624031198, 'strategy': 'breakout', 'time_stop': 32, 'use_sma': False, 'use_atr': False, 'use_adx': True, 'use_ema': True, 'use_spike': False, 'rsi_required': False, 'edge_k': 0.7852083426101346, 'edge_cap': 0.08426237497657638, 'bull_strategy': 'breakout', 'bull_bb_std_mult': 2.5660533724003924, 'bull_rsi_os': 45, 'bull_rsi_ob': 63, 'bull_adx_thresh': 14.315053760781257, 'bull_atr_min_pct': 0.02131780191134335, 'bull_atr_max_pct': 0.09334450008793993, 'bull_tp_mult': 2.40259009166166, 'bull_tsl_mult': 0.7272185290052847, 'bull_time_stop': 130, 'bull_use_sma': False, 'bull_use_ema': False, 'bull_use_atr': False, 'bull_use_adx': True, 'bull_use_spike': False, 'bull_rsi_required': False, 'bear_strategy': 'mean_reversion', 'bear_bb_std_mult': 3.1355348390834052, 'bear_rsi_os': 24, 'bear_rsi_ob': 57, 'bear_adx_thresh': 20.732410948615414, 'bear_atr_min_pct': 0.02057637415437414, 'bear_atr_max_pct': 0.010488400831202074, 'bear_tp_mult': 2.9379636695972007, 'bear_tsl_mult': 0.25566424654524567, 'bear_time_stop': 145, 'bear_use_sma': True, 'bear_use_ema': False, 'bear_use_atr': True, 'bear_use_adx': False, 'bear_use_spike': True, 'bear_rsi_required': True, 'sideways_strategy': 'mean_reversion', 'sideways_bb_std_mult': 1.5212635348845742, 'sideways_rsi_os': 35, 'sideways_rsi_ob': 49, 'sideways_adx_thresh': 27.30196260997055, 'sideways_atr_min_pct': 0.028299920694925734, 'sideways_atr_max_pct': 0.1186815238534079, 'sideways_tp_mult': 1.6583716337236547, 'sideways_tsl_mult': 0.5412616082588316, 'sideways_time_stop': 62, 'sideways_use_sma': False, 'sideways_use_ema': True, 'sideways_use_atr': False, 'sideways_use_adx': False, 'sideways_use_spike': True, 'sideways_rsi_required': False}.
[I 2025-08-31 10:04:07,120] Trial 77 finished with values: [-0.016871705919130897, 0.017094687113670598] and parameters: {'p_sma': 41, 'p_std': 53, 'p_atr': 8, 'p_adx': 29, 'rsi_period': 47, 'ema1': 6, 'ema2': 23, 'slip_atr_k': 0.12818910607705586, 'slip_spread_k': 0.9396933587447451, 'spread_hl_frac': 0.033585185523600375, 'bb_std_mult': 2.3025537866567047, 'rsi_os': 21, 'rsi_ob': 57, 'vol_spike': 0.08155061489473257, 'adx_thresh': 33.76974811604279, 'atr_min_pct': 0.001955634836759248, 'atr_max_pct': 0.1445109908569737, 'tp_mult': 2.1638324331005885, 'tsl_mult': 0.9153633105552385, 'strategy': 'breakout', 'time_stop': 28, 'use_sma': False, 'use_atr': False, 'use_adx': True, 'use_ema': False, 'use_spike': False, 'rsi_required': False, 'edge_k': 1.2837873752678637, 'edge_cap': 0.0915829211026751, 'bull_strategy': 'breakout', 'bull_bb_std_mult': 1.4634485476190702, 'bull_rsi_os': 49, 'bull_rsi_ob': 62, 'bull_adx_thresh': 14.946314990645641, 'bull_atr_min_pct': 0.002422469774443863, 'bull_atr_max_pct': 0.09356916810009974, 'bull_tp_mult': 1.1843037060655175, 'bull_tsl_mult': 0.314147858692188, 'bull_time_stop': 126, 'bull_use_sma': False, 'bull_use_ema': False, 'bull_use_atr': False, 'bull_use_adx': True, 'bull_use_spike': False, 'bull_rsi_required': False, 'bear_strategy': 'mean_reversion', 'bear_bb_std_mult': 2.5726625267553693, 'bear_rsi_os': 55, 'bear_rsi_ob': 67, 'bear_adx_thresh': 12.81400663874971, 'bear_atr_min_pct': 0.025388340676212068, 'bear_atr_max_pct': 0.11058494226614793, 'bear_tp_mult': 1.219763908748523, 'bear_tsl_mult': 0.2566259094269982, 'bear_time_stop': 144, 'bear_use_sma': False, 'bear_use_ema': True, 'bear_use_atr': False, 'bear_use_adx': True, 'bear_use_spike': True, 'bear_rsi_required': True, 'sideways_strategy': 'breakout', 'sideways_bb_std_mult': 0.8624514795529594, 'sideways_rsi_os': 35, 'sideways_rsi_ob': 48, 'sideways_adx_thresh': 26.906292963671888, 'sideways_atr_min_pct': 0.028651882104547752, 'sideways_atr_max_pct': 0.11997457375569556, 'sideways_tp_mult': 1.5205293891219194, 'sideways_tsl_mult': 0.3566217769847227, 'sideways_time_stop': 198, 'sideways_use_sma': False, 'sideways_use_ema': False, 'sideways_use_atr': False, 'sideways_use_adx': False, 'sideways_use_spike': True, 'sideways_rsi_required': False}.
[I 2025-08-31 10:04:07,550] Trial 78 finished with values: [-1000000000.0, 1000000000.0] and parameters: {'p_sma': 55, 'p_std': 53, 'p_atr': 8, 'p_adx': 20, 'rsi_period': 31, 'ema1': 11, 'ema2': 56, 'slip_atr_k': 0.017187358871398592, 'slip_spread_k': 0.9343680275710078, 'spread_hl_frac': 0.0328400077539997, 'bb_std_mult': 1.2816764925585453, 'rsi_os': 21, 'rsi_ob': 60, 'vol_spike': 0.1688817206310503, 'adx_thresh': 11.420077145253856, 'atr_min_pct': 0.00831253098730232, 'atr_max_pct': 0.14367102706202745, 'tp_mult': 2.4026097112947298, 'tsl_mult': 0.7793026098720142, 'strategy': 'breakout', 'time_stop': 57, 'use_sma': False, 'use_atr': False, 'use_adx': True, 'use_ema': True, 'use_spike': True, 'rsi_required': False, 'edge_k': 1.2649890854130041, 'edge_cap': 0.26611930808228107, 'bull_strategy': 'breakout', 'bull_bb_std_mult': 2.5414239095308675, 'bull_rsi_os': 28, 'bull_rsi_ob': 63, 'bull_adx_thresh': 11.346242438500934, 'bull_atr_min_pct': 0.005893816519679612, 'bull_atr_max_pct': 0.09345290735514551, 'bull_tp_mult': 2.955372102374125, 'bull_tsl_mult': 0.7449689312751953, 'bull_time_stop': 127, 'bull_use_sma': False, 'bull_use_ema': False, 'bull_use_atr': False, 'bull_use_adx': True, 'bull_use_spike': True, 'bull_rsi_required': False, 'bear_strategy': 'mean_reversion', 'bear_bb_std_mult': 3.1323672622560976, 'bear_rsi_os': 26, 'bear_rsi_ob': 83, 'bear_adx_thresh': 22.783545465071292, 'bear_atr_min_pct': 0.003766932351616477, 'bear_atr_max_pct': 0.10899837102652037, 'bear_tp_mult': 1.2577855890475882, 'bear_tsl_mult': 0.2525646486649708, 'bear_time_stop': 76, 'bear_use_sma': False, 'bear_use_ema': False, 'bear_use_atr': False, 'bear_use_adx': False, 'bear_use_spike': True, 'bear_rsi_required': True, 'sideways_strategy': 'breakout', 'sideways_bb_std_mult': 2.692083735442405, 'sideways_rsi_os': 34, 'sideways_rsi_ob': 63, 'sideways_adx_thresh': 26.811697186922554, 'sideways_atr_min_pct': 0.01131317718987343, 'sideways_atr_max_pct': 0.08470738787100102, 'sideways_tp_mult': 1.64659684377473, 'sideways_tsl_mult': 0.20542300278373324, 'sideways_time_stop': 15, 'sideways_use_sma': False, 'sideways_use_ema': True, 'sideways_use_atr': False, 'sideways_use_adx': True, 'sideways_use_spike': True, 'sideways_rsi_required': False}.
[I 2025-08-31 10:04:08,182] Trial 79 finished with values: [-0.028845517508418905, 0.028687176105236398] and parameters: {'p_sma': 54, 'p_std': 54, 'p_atr': 8, 'p_adx': 19, 'rsi_period': 39, 'ema1': 11, 'ema2': 55, 'slip_atr_k': 0.018029375324790778, 'slip_spread_k': 0.24502438756324732, 'spread_hl_frac': 0.03255736752405519, 'bb_std_mult': 1.2819561219447757, 'rsi_os': 22, 'rsi_ob': 61, 'vol_spike': 0.17094098310299027, 'adx_thresh': 11.625083571286105, 'atr_min_pct': 0.009349666317868117, 'atr_max_pct': 0.11349843345218816, 'tp_mult': 1.6605128460839804, 'tsl_mult': 0.6160045520554147, 'strategy': 'breakout', 'time_stop': 57, 'use_sma': False, 'use_atr': False, 'use_adx': False, 'use_ema': True, 'use_spike': True, 'rsi_required': False, 'edge_k': 1.2782768921388457, 'edge_cap': 0.25978823070473644, 'bull_strategy': 'breakout', 'bull_bb_std_mult': 3.4412776581584303, 'bull_rsi_os': 27, 'bull_rsi_ob': 57, 'bull_adx_thresh': 8.537634757776626, 'bull_atr_min_pct': 0.0020701873591214923, 'bull_atr_max_pct': 0.11240362286728532, 'bull_tp_mult': 2.938328394435467, 'bull_tsl_mult': 0.7568421019512385, 'bull_time_stop': 128, 'bull_use_sma': False, 'bull_use_ema': False, 'bull_use_atr': False, 'bull_use_adx': True, 'bull_use_spike': True, 'bull_rsi_required': False, 'bear_strategy': 'mean_reversion', 'bear_bb_std_mult': 3.106739846193383, 'bear_rsi_os': 26, 'bear_rsi_ob': 57, 'bear_adx_thresh': 25.702027825421695, 'bear_atr_min_pct': 0.010531081914613574, 'bear_atr_max_pct': 0.11323322655405046, 'bear_tp_mult': 1.1153976596385813, 'bear_tsl_mult': 0.24830957427636835, 'bear_time_stop': 77, 'bear_use_sma': False, 'bear_use_ema': False, 'bear_use_atr': False, 'bear_use_adx': False, 'bear_use_spike': True, 'bear_rsi_required': True, 'sideways_strategy': 'breakout', 'sideways_bb_std_mult': 2.7026931509230874, 'sideways_rsi_os': 35, 'sideways_rsi_ob': 56, 'sideways_adx_thresh': 26.78894235171796, 'sideways_atr_min_pct': 0.003552025933407244, 'sideways_atr_max_pct': 0.08523093850820802, 'sideways_tp_mult': 2.315429309442431, 'sideways_tsl_mult': 0.09992935963101646, 'sideways_time_stop': 115, 'sideways_use_sma': False, 'sideways_use_ema': True, 'sideways_use_atr': False, 'sideways_use_adx': True, 'sideways_use_spike': True, 'sideways_rsi_required': True}.
[I 2025-08-31 10:04:08,183] Trial 80 finished with values: [-0.01820700292253008, 0.018508091028098913] and parameters: {'p_sma': 55, 'p_std': 50, 'p_atr': 7, 'p_adx': 20, 'rsi_period': 22, 'ema1': 6, 'ema2': 54, 'slip_atr_k': 0.02046718623930836, 'slip_spread_k': 0.24332939812302828, 'spread_hl_frac': 0.005413817700104378, 'bb_std_mult': 1.6421716355884381, 'rsi_os': 21, 'rsi_ob': 57, 'vol_spike': 0.16361313218796664, 'adx_thresh': 11.131285752208905, 'atr_min_pct': 0.00869603585734462, 'atr_max_pct': 0.04185362178023149, 'tp_mult': 1.6492552239376626, 'tsl_mult': 0.7777746184176484, 'strategy': 'breakout', 'time_stop': 59, 'use_sma': False, 'use_atr': True, 'use_adx': False, 'use_ema': True, 'use_spike': True, 'rsi_required': False, 'edge_k': 1.2181121984405954, 'edge_cap': 0.26341060942410505, 'bull_strategy': 'breakout', 'bull_bb_std_mult': 3.5079961902558647, 'bull_rsi_os': 27, 'bull_rsi_ob': 68, 'bull_adx_thresh': 11.498219444848715, 'bull_atr_min_pct': 0.004806118116230364, 'bull_atr_max_pct': 0.11341151863982497, 'bull_tp_mult': 2.941806431467752, 'bull_tsl_mult': 0.7697340501932479, 'bull_time_stop': 123, 'bull_use_sma': False, 'bull_use_ema': False, 'bull_use_atr': True, 'bull_use_adx': True, 'bull_use_spike': True, 'bull_rsi_required': False, 'bear_strategy': 'mean_reversion', 'bear_bb_std_mult': 3.0503757971188845, 'bear_rsi_os': 26, 'bear_rsi_ob': 83, 'bear_adx_thresh': 25.503041084464037, 'bear_atr_min_pct': 0.0032387464495649398, 'bear_atr_max_pct': 0.11534189506813147, 'bear_tp_mult': 1.1282654392913822, 'bear_tsl_mult': 0.05691946715891899, 'bear_time_stop': 77, 'bear_use_sma': False, 'bear_use_ema': False, 'bear_use_atr': False, 'bear_use_adx': False, 'bear_use_spike': True, 'bear_rsi_required': True, 'sideways_strategy': 'breakout', 'sideways_bb_std_mult': 2.40916117002926, 'sideways_rsi_os': 34, 'sideways_rsi_ob': 63, 'sideways_adx_thresh': 25.86707953160517, 'sideways_atr_min_pct': 0.004055906068623847, 'sideways_atr_max_pct': 0.08472639465798122, 'sideways_tp_mult': 1.7339945887242425, 'sideways_tsl_mult': 0.20241043813094645, 'sideways_time_stop': 118, 'sideways_use_sma': False, 'sideways_use_ema': True, 'sideways_use_atr': False, 'sideways_use_adx': True, 'sideways_use_spike': True, 'sideways_rsi_required': True}.
