[I 2025-08-31 10:22:39,236] Trial 216 finished with values: [-1000000000.0, 1000000000.0] and parameters: {'p_sma': 21, 'p_std': 13, 'p_atr': 30, 'p_adx': 16, 'rsi_period': 84, 'ema1': 24, 'ema2': 54, 'slip_atr_k': 0.030408178639148183, 'slip_spread_k': 0.6191440861851649, 'spread_hl_frac': 0.012842702038070147, 'bb_std_mult': 0.7406557058804213, 'rsi_os': 26, 'rsi_ob': 73, 'vol_spike': 0.26813793779033696, 'adx_thresh': 29.543450047031186, 'atr_min_pct': 0.0051761223655371, 'atr_max_pct': 0.07881800489293364, 'tp_mult': 2.3393679145573723, 'tsl_mult': 0.37325884405656345, 'strategy': 'breakout', 'time_stop': 233, 'use_sma': True, 'use_atr': True, 'use_adx': False, 'use_ema': True, 'use_spike': True, 'rsi_required': False, 'edge_k': 0.7489440160462748, 'edge_cap': 0.871779392781258, 'bull_strategy': 'breakout', 'bull_bb_std_mult': 0.794466089764556, 'bull_rsi_os': 45, 'bull_rsi_ob': 74, 'bull_adx_thresh': 30.763806760470302, 'bull_atr_min_pct': 0.022003000864377772, 'bull_atr_max_pct': 0.14340424314236713, 'bull_tp_mult': 1.7047082582353617, 'bull_tsl_mult': 0.5075848809056765, 'bull_time_stop': 81, 'bull_use_sma': True, 'bull_use_ema': True, 'bull_use_atr': True, 'bull_use_adx': False, 'bull_use_spike': True, 'bull_rsi_required': False, 'bear_strategy': 'breakout', 'bear_bb_std_mult': 2.0301988851752792, 'bear_rsi_os': 40, 'bear_rsi_ob': 71, 'bear_adx_thresh': 15.50713862874876, 'bear_atr_min_pct': 0.02601937189130725, 'bear_atr_max_pct': 0.08039895464779873, 'bear_tp_mult': 2.9076226825177187, 'bear_tsl_mult': 0.5427491018905997, 'bear_time_stop': 227, 'bear_use_sma': False, 'bear_use_ema': True, 'bear_use_atr': False, 'bear_use_adx': False, 'bear_use_spike': True, 'bear_rsi_required': False, 'sideways_strategy': 'breakout', 'sideways_bb_std_mult': 1.0968741993791435, 'sideways_rsi_os': 19, 'sideways_rsi_ob': 78, 'sideways_adx_thresh': 24.255332908738282, 'sideways_atr_min_pct': 0.025963320412151877, 'sideways_atr_max_pct': 0.029050658489511084, 'sideways_tp_mult': 2.00490415221693, 'sideways_tsl_mult': 0.10585360004272906, 'sideways_time_stop': 29, 'sideways_use_sma': False, 'sideways_use_ema': False, 'sideways_use_atr': False, 'sideways_use_adx': True, 'sideways_use_spike': False, 'sideways_rsi_required': True}.
[I 2025-08-31 10:22:39,270] Trial 215 finished with values: [-1000000000.0, 1000000000.0] and parameters: {'p_sma': 6, 'p_std': 32, 'p_atr': 20, 'p_adx': 9, 'rsi_period': 49, 'ema1': 11, 'ema2': 54, 'slip_atr_k': 0.030805562880997298, 'slip_spread_k': 0.620328264654271, 'spread_hl_frac': 6.475994815964212e-05, 'bb_std_mult': 3.5168983808151673, 'rsi_os': 26, 'rsi_ob': 63, 'vol_spike': 0.25247708661538915, 'adx_thresh': 8.736912593247423, 'atr_min_pct': 0.005269631665805577, 'atr_max_pct': 0.07854141152636437, 'tp_mult': 2.333663417403183, 'tsl_mult': 0.6936926884204023, 'strategy': 'breakout', 'time_stop': 234, 'use_sma': True, 'use_atr': True, 'use_adx': False, 'use_ema': True, 'use_spike': True, 'rsi_required': False, 'edge_k': 0.25622498684321554, 'edge_cap': 0.32038947232572534, 'bull_strategy': 'breakout', 'bull_bb_std_mult': 0.7975936677859948, 'bull_rsi_os': 41, 'bull_rsi_ob': 73, 'bull_adx_thresh': 24.949604222157156, 'bull_atr_min_pct': 0.025230103427791917, 'bull_atr_max_pct': 0.1433812764928274, 'bull_tp_mult': 1.8513262250263143, 'bull_tsl_mult': 0.5121083704186274, 'bull_time_stop': 80, 'bull_use_sma': True, 'bull_use_ema': True, 'bull_use_atr': True, 'bull_use_adx': False, 'bull_use_spike': True, 'bull_rsi_required': False, 'bear_strategy': 'breakout', 'bear_bb_std_mult': 2.049427183539661, 'bear_rsi_os': 40, 'bear_rsi_ob': 71, 'bear_adx_thresh': 13.76539632888275, 'bear_atr_min_pct': 0.006786234309325114, 'bear_atr_max_pct': 0.07973872323730882, 'bear_tp_mult': 2.8797911054743692, 'bear_tsl_mult': 0.5433708336073103, 'bear_time_stop': 52, 'bear_use_sma': False, 'bear_use_ema': True, 'bear_use_atr': False, 'bear_use_adx': False, 'bear_use_spike': True, 'bear_rsi_required': False, 'sideways_strategy': 'breakout', 'sideways_bb_std_mult': 2.901251402122432, 'sideways_rsi_os': 5, 'sideways_rsi_ob': 78, 'sideways_adx_thresh': 24.344266931438852, 'sideways_atr_min_pct': 0.005742340264085926, 'sideways_atr_max_pct': 0.039670428121593965, 'sideways_tp_mult': 2.0065913342501642, 'sideways_tsl_mult': 0.09425442890198847, 'sideways_time_stop': 31, 'sideways_use_sma': False, 'sideways_use_ema': False, 'sideways_use_atr': False, 'sideways_use_adx': True, 'sideways_use_spike': False, 'sideways_rsi_required': True}.
[I 2025-08-31 10:22:39,356] Trial 217 finished with values: [-0.027978551678546126, 0.02789243003193515] and parameters: {'p_sma': 21, 'p_std': 20, 'p_atr': 29, 'p_adx': 8, 'rsi_period': 49, 'ema1': 11, 'ema2': 30, 'slip_atr_k': 0.022211177608866477, 'slip_spread_k': 0.6765737110466274, 'spread_hl_frac': 0.013128791266644452, 'bb_std_mult': 3.560913801317783, 'rsi_os': 16, 'rsi_ob': 64, 'vol_spike': 0.27644168440252354, 'adx_thresh': 24.790547564053156, 'atr_min_pct': 0.005237387909668578, 'atr_max_pct': 0.07841744308175504, 'tp_mult': 2.33112020580282, 'tsl_mult': 0.6958981703904843, 'strategy': 'breakout', 'time_stop': 244, 'use_sma': True, 'use_atr': True, 'use_adx': False, 'use_ema': False, 'use_spike': True, 'rsi_required': False, 'edge_k': 1.0305216305594973, 'edge_cap': 0.31959318492072625, 'bull_strategy': 'breakout', 'bull_bb_std_mult': 0.7771038793931635, 'bull_rsi_os': 45, 'bull_rsi_ob': 74, 'bull_adx_thresh': 20.465262018570428, 'bull_atr_min_pct': 0.0015257841855596563, 'bull_atr_max_pct': 0.13488399211294724, 'bull_tp_mult': 1.710553148085904, 'bull_tsl_mult': 0.9907491410305997, 'bull_time_stop': 80, 'bull_use_sma': True, 'bull_use_ema': True, 'bull_use_atr': True, 'bull_use_adx': False, 'bull_use_spike': True, 'bull_rsi_required': False, 'bear_strategy': 'breakout', 'bear_bb_std_mult': 1.1072046831771856, 'bear_rsi_os': 40, 'bear_rsi_ob': 67, 'bear_adx_thresh': 7.867284273143161, 'bear_atr_min_pct': 0.0264582520074893, 'bear_atr_max_pct': 0.12870392848525225, 'bear_tp_mult': 2.876111667191446, 'bear_tsl_mult': 0.734948566248311, 'bear_time_stop': 133, 'bear_use_sma': False, 'bear_use_ema': True, 'bear_use_atr': False, 'bear_use_adx': True, 'bear_use_spike': True, 'bear_rsi_required': False, 'sideways_strategy': 'breakout', 'sideways_bb_std_mult': 1.4583892581377882, 'sideways_rsi_os': 19, 'sideways_rsi_ob': 63, 'sideways_adx_thresh': 24.29350823745226, 'sideways_atr_min_pct': 0.004915462933686119, 'sideways_atr_max_pct': 0.027668710188831762, 'sideways_tp_mult': 2.0051533683459466, 'sideways_tsl_mult': 0.08957231432722706, 'sideways_time_stop': 33, 'sideways_use_sma': False, 'sideways_use_ema': False, 'sideways_use_atr': False, 'sideways_use_adx': True, 'sideways_use_spike': False, 'sideways_rsi_required': True}.
[I 2025-08-31 10:23:11,910] Trial 220 finished with values: [-0.018647166290725936, 0.018532200448675137] and parameters: {'p_sma': 18, 'p_std': 20, 'p_atr': 29, 'p_adx': 24, 'rsi_period': 12, 'ema1': 20, 'ema2': 30, 'slip_atr_k': 0.036900660418835385, 'slip_spread_k': 0.34712918039798313, 'spread_hl_frac': 0.007600788440185271, 'bb_std_mult': 0.5285950473495993, 'rsi_os': 30, 'rsi_ob': 77, 'vol_spike': 0.26636895292970403, 'adx_thresh': 7.8561893052854685, 'atr_min_pct': 0.018917273933451252, 'atr_max_pct': 0.11453685008789019, 'tp_mult': 1.0520816739062475, 'tsl_mult': 0.628907942654431, 'strategy': 'breakout', 'time_stop': 197, 'use_sma': True, 'use_atr': False, 'use_adx': True, 'use_ema': False, 'use_spike': True, 'rsi_required': False, 'edge_k': 1.032827168846108, 'edge_cap': 0.8564430502108678, 'bull_strategy': 'breakout', 'bull_bb_std_mult': 1.7264033988507266, 'bull_rsi_os': 30, 'bull_rsi_ob': 77, 'bull_adx_thresh': 23.81921619083257, 'bull_atr_min_pct': 0.0014374951236530789, 'bull_atr_max_pct': 0.13552821346667882, 'bull_tp_mult': 1.477006173169505, 'bull_tsl_mult': 0.43265327865326697, 'bull_time_stop': 91, 'bull_use_sma': True, 'bull_use_ema': True, 'bull_use_atr': True, 'bull_use_adx': False, 'bull_use_spike': True, 'bull_rsi_required': True, 'bear_strategy': 'breakout', 'bear_bb_std_mult': 2.247575326239389, 'bear_rsi_os': 42, 'bear_rsi_ob': 89, 'bear_adx_thresh': 16.789381159756505, 'bear_atr_min_pct': 0.0043947605155548065, 'bear_atr_max_pct': 0.07388702727141651, 'bear_tp_mult': 2.811150752061244, 'bear_tsl_mult': 0.720223127340898, 'bear_time_stop': 197, 'bear_use_sma': False, 'bear_use_ema': True, 'bear_use_atr': False, 'bear_use_adx': True, 'bear_use_spike': True, 'bear_rsi_required': False, 'sideways_strategy': 'breakout', 'sideways_bb_std_mult': 2.804096421209671, 'sideways_rsi_os': 18, 'sideways_rsi_ob': 63, 'sideways_adx_thresh': 23.023743162872183, 'sideways_atr_min_pct': 0.0032884170082299507, 'sideways_atr_max_pct': 0.13465130114367158, 'sideways_tp_mult': 2.0580168069348126, 'sideways_tsl_mult': 0.6115014917640649, 'sideways_time_stop': 50, 'sideways_use_sma': False, 'sideways_use_ema': False, 'sideways_use_atr': False, 'sideways_use_adx': True, 'sideways_use_spike': True, 'sideways_rsi_required': True}.
[I 2025-08-31 10:23:12,161] Trial 222 finished with values: [-0.014811410788190038, 0.014742998267157241] and parameters: {'p_sma': 13, 'p_std': 17, 'p_atr': 30, 'p_adx': 24, 'rsi_period': 12, 'ema1': 16, 'ema2': 46, 'slip_atr_k': 0.07515183041053425, 'slip_spread_k': 0.21468282713086984, 'spread_hl_frac': 0.011784492969156407, 'bb_std_mult': 1.9379006173160447, 'rsi_os': 28, 'rsi_ob': 57, 'vol_spike': 0.26590646343807633, 'adx_thresh': 9.716301296840953, 'atr_min_pct': 0.01904331661744069, 'atr_max_pct': 0.10952745729227638, 'tp_mult': 1.3257139434742844, 'tsl_mult': 0.6050042031178539, 'strategy': 'breakout', 'time_stop': 199, 'use_sma': True, 'use_atr': False, 'use_adx': True, 'use_ema': True, 'use_spike': True, 'rsi_required': False, 'edge_k': 0.16519286610178854, 'edge_cap': 0.8483564802425885, 'bull_strategy': 'breakout', 'bull_bb_std_mult': 0.8770188566908459, 'bull_rsi_os': 30, 'bull_rsi_ob': 71, 'bull_adx_thresh': 32.458151299871176, 'bull_atr_min_pct': 0.002508662333029447, 'bull_atr_max_pct': 0.0798396187878059, 'bull_tp_mult': 1.6352440591519621, 'bull_tsl_mult': 0.44474693895271267, 'bull_time_stop': 93, 'bull_use_sma': False, 'bull_use_ema': True, 'bull_use_atr': True, 'bull_use_adx': False, 'bull_use_spike': True, 'bull_rsi_required': True, 'bear_strategy': 'breakout', 'bear_bb_std_mult': 3.46830296106567, 'bear_rsi_os': 42, 'bear_rsi_ob': 69, 'bear_adx_thresh': 16.687661646033398, 'bear_atr_min_pct': 0.004184775771694017, 'bear_atr_max_pct': 0.07358604109110906, 'bear_tp_mult': 2.8184443430446424, 'bear_tsl_mult': 0.9729493287091673, 'bear_time_stop': 159, 'bear_use_sma': False, 'bear_use_ema': True, 'bear_use_atr': False, 'bear_use_adx': False, 'bear_use_spike': True, 'bear_rsi_required': False, 'sideways_strategy': 'breakout', 'sideways_bb_std_mult': 2.8140982344022434, 'sideways_rsi_os': 17, 'sideways_rsi_ob': 81, 'sideways_adx_thresh': 14.987533014166685, 'sideways_atr_min_pct': 0.003403419510721067, 'sideways_atr_max_pct': 0.133781122241732, 'sideways_tp_mult': 2.109117317970409, 'sideways_tsl_mult': 0.06838148443000838, 'sideways_time_stop': 52, 'sideways_use_sma': False, 'sideways_use_ema': False, 'sideways_use_atr': False, 'sideways_use_adx': False, 'sideways_use_spike': True, 'sideways_rsi_required': True}.
[I 2025-08-31 10:23:12,349] Trial 219 finished with values: [-1000000000.0, 1000000000.0] and parameters: {'p_sma': 18, 'p_std': 17, 'p_atr': 22, 'p_adx': 17, 'rsi_period': 57, 'ema1': 26, 'ema2': 52, 'slip_atr_k': 0.120932565074698, 'slip_spread_k': 0.8215820996956295, 'spread_hl_frac': 0.01176176636454731, 'bb_std_mult': 1.9587305670280735, 'rsi_os': 17, 'rsi_ob': 58, 'vol_spike': 0.26779309536629614, 'adx_thresh': 7.6871069136589725, 'atr_min_pct': 0.004634105127888807, 'atr_max_pct': 0.08182511565878471, 'tp_mult': 1.4226107758780557, 'tsl_mult': 0.6070407117445139, 'strategy': 'breakout', 'time_stop': 245, 'use_sma': True, 'use_atr': False, 'use_adx': True, 'use_ema': False, 'use_spike': True, 'rsi_required': False, 'edge_k': 0.20473431231183026, 'edge_cap': 0.21465784195848714, 'bull_strategy': 'breakout', 'bull_bb_std_mult': 0.8885298327370248, 'bull_rsi_os': 43, 'bull_rsi_ob': 71, 'bull_adx_thresh': 20.628066640601624, 'bull_atr_min_pct': 0.012226196272017167, 'bull_atr_max_pct': 0.13679686711855887, 'bull_tp_mult': 1.7195850988043666, 'bull_tsl_mult': 0.448568458167911, 'bull_time_stop': 90, 'bull_use_sma': True, 'bull_use_ema': True, 'bull_use_atr': True, 'bull_use_adx': False, 'bull_use_spike': True, 'bull_rsi_required': True, 'bear_strategy': 'breakout', 'bear_bb_std_mult': 1.1670461732666702, 'bear_rsi_os': 19, 'bear_rsi_ob': 65, 'bear_adx_thresh': 16.77508379261809, 'bear_atr_min_pct': 0.018837634623727416, 'bear_atr_max_pct': 0.08502370137445185, 'bear_tp_mult': 2.8041003118324763, 'bear_tsl_mult': 0.8599266076876952, 'bear_time_stop': 260, 'bear_use_sma': False, 'bear_use_ema': True, 'bear_use_atr': False, 'bear_use_adx': True, 'bear_use_spike': True, 'bear_rsi_required': False, 'sideways_strategy': 'breakout', 'sideways_bb_std_mult': 2.681435214865648, 'sideways_rsi_os': 39, 'sideways_rsi_ob': 81, 'sideways_adx_thresh': 20.382569497756737, 'sideways_atr_min_pct': 0.0032551602227969987, 'sideways_atr_max_pct': 0.019900228650581834, 'sideways_tp_mult': 2.1312036681370055, 'sideways_tsl_mult': 0.07246351323432267, 'sideways_time_stop': 50, 'sideways_use_sma': False, 'sideways_use_ema': False, 'sideways_use_atr': False, 'sideways_use_adx': True, 'sideways_use_spike': True, 'sideways_rsi_required': True}.
[I 2025-08-31 10:23:12,422] Trial 221 finished with values: [-1000000000.0, 1000000000.0] and parameters: {'p_sma': 17, 'p_std': 20, 'p_atr': 29, 'p_adx': 17, 'rsi_period': 42, 'ema1': 26, 'ema2': 52, 'slip_atr_k': 0.07559353501432685, 'slip_spread_k': 0.6423094897773254, 'spread_hl_frac': 0.0018927275739805856, 'bb_std_mult': 0.5235203955078255, 'rsi_os': 16, 'rsi_ob': 58, 'vol_spike': 0.26778826830169067, 'adx_thresh': 7.604392826235221, 'atr_min_pct': 0.0062467432260003486, 'atr_max_pct': 0.043158681745020654, 'tp_mult': 2.4966400331828202, 'tsl_mult': 0.6531193279548544, 'strategy': 'breakout', 'time_stop': 161, 'use_sma': True, 'use_atr': False, 'use_adx': True, 'use_ema': False, 'use_spike': True, 'rsi_required': False, 'edge_k': 0.6603970206299958, 'edge_cap': 0.21583239455904418, 'bull_strategy': 'breakout', 'bull_bb_std_mult': 1.5254690225766772, 'bull_rsi_os': 43, 'bull_rsi_ob': 77, 'bull_adx_thresh': 23.807390097594066, 'bull_atr_min_pct': 0.026391769702868155, 'bull_atr_max_pct': 0.1361733650123878, 'bull_tp_mult': 1.626388175798852, 'bull_tsl_mult': 0.6445292889531217, 'bull_time_stop': 90, 'bull_use_sma': True, 'bull_use_ema': True, 'bull_use_atr': True, 'bull_use_adx': False, 'bull_use_spike': True, 'bull_rsi_required': True, 'bear_strategy': 'breakout', 'bear_bb_std_mult': 2.2330798854304623, 'bear_rsi_os': 19, 'bear_rsi_ob': 89, 'bear_adx_thresh': 16.852800259864424, 'bear_atr_min_pct': 0.004203829246813135, 'bear_atr_max_pct': 0.0830256834460706, 'bear_tp_mult': 1.985362436404846, 'bear_tsl_mult': 0.5711839704756139, 'bear_time_stop': 194, 'bear_use_sma': False, 'bear_use_ema': True, 'bear_use_atr': False, 'bear_use_adx': True, 'bear_use_spike': True, 'bear_rsi_required': False, 'sideways_strategy': 'breakout', 'sideways_bb_std_mult': 2.6736615148777045, 'sideways_rsi_os': 45, 'sideways_rsi_ob': 94, 'sideways_adx_thresh': 31.45143503604845, 'sideways_atr_min_pct': 0.0031429368609390065, 'sideways_atr_max_pct': 0.14253768292281027, 'sideways_tp_mult': 2.061480174474513, 'sideways_tsl_mult': 0.06481368571440907, 'sideways_time_stop': 193, 'sideways_use_sma': False, 'sideways_use_ema': False, 'sideways_use_atr': False, 'sideways_use_adx': True, 'sideways_use_spike': True, 'sideways_rsi_required': True}.
[I 2025-08-31 10:23:45,122] Trial 226 finished with values: [-1000000000.0, 1000000000.0] and parameters: {'p_sma': 14, 'p_std': 24, 'p_atr': 30, 'p_adx': 16, 'rsi_period': 46, 'ema1': 16, 'ema2': 57, 'slip_atr_k': 0.03709990301062517, 'slip_spread_k': 0.6517662217615522, 'spread_hl_frac': 0.03667639581929672, 'bb_std_mult': 0.7079283482193812, 'rsi_os': 29, 'rsi_ob': 94, 'vol_spike': 0.26034157935237784, 'adx_thresh': 9.65876332510041, 'atr_min_pct': 0.004273594788014355, 'atr_max_pct': 0.062155797834028845, 'tp_mult': 2.417308496853248, 'tsl_mult': 0.5795460295574916, 'strategy': 'breakout', 'time_stop': 197, 'use_sma': True, 'use_atr': True, 'use_adx': False, 'use_ema': True, 'use_spike': False, 'rsi_required': False, 'edge_k': 0.17248452087441046, 'edge_cap': 0.8479990580473444, 'bull_strategy': 'mean_reversion', 'bull_bb_std_mult': 1.7063402433852062, 'bull_rsi_os': 33, 'bull_rsi_ob': 70, 'bull_adx_thresh': 28.239534834424756, 'bull_atr_min_pct': 0.00149289109529257, 'bull_atr_max_pct': 0.14995735359803777, 'bull_tp_mult': 1.482727080210862, 'bull_tsl_mult': 0.4397100807253584, 'bull_time_stop': 46, 'bull_use_sma': False, 'bull_use_ema': True, 'bull_use_atr': True, 'bull_use_adx': False, 'bull_use_spike': False, 'bull_rsi_required': True, 'bear_strategy': 'mean_reversion', 'bear_bb_std_mult': 2.3964844994659216, 'bear_rsi_os': 38, 'bear_rsi_ob': 69, 'bear_adx_thresh': 14.75151348698431, 'bear_atr_min_pct': 0.029895847936362602, 'bear_atr_max_pct': 0.07617460493001953, 'bear_tp_mult': 1.018526484756637, 'bear_tsl_mult': 0.48450240143613243, 'bear_time_stop': 12, 'bear_use_sma': False, 'bear_use_ema': True, 'bear_use_atr': False, 'bear_use_adx': False, 'bear_use_spike': True, 'bear_rsi_required': False, 'sideways_strategy': 'breakout', 'sideways_bb_std_mult': 2.8240503888361825, 'sideways_rsi_os': 17, 'sideways_rsi_ob': 50, 'sideways_adx_thresh': 23.27020268335269, 'sideways_atr_min_pct': 0.026821371768667078, 'sideways_atr_max_pct': 0.1339577539040371, 'sideways_tp_mult': 1.8859523726114529, 'sideways_tsl_mult': 0.47861805052923734, 'sideways_time_stop': 40, 'sideways_use_sma': False, 'sideways_use_ema': False, 'sideways_use_atr': False, 'sideways_use_adx': False, 'sideways_use_spike': True, 'sideways_rsi_required': False}.
[I 2025-08-31 10:23:45,304] Trial 225 finished with values: [-1000000000.0, 1000000000.0] and parameters: {'p_sma': 17, 'p_std': 23, 'p_atr': 30, 'p_adx': 17, 'rsi_period': 77, 'ema1': 16, 'ema2': 37, 'slip_atr_k': 0.07722524750096885, 'slip_spread_k': 0.34923424263135827, 'spread_hl_frac': 0.01334393903386164, 'bb_std_mult': 0.5120899863998887, 'rsi_os': 30, 'rsi_ob': 93, 'vol_spike': 0.263971661587283, 'adx_thresh': 13.931235021334633, 'atr_min_pct': 0.004181748956272461, 'atr_max_pct': 0.043924685055091305, 'tp_mult': 2.5018140270713625, 'tsl_mult': 0.5814701811123346, 'strategy': 'breakout', 'time_stop': 197, 'use_sma': True, 'use_atr': False, 'use_adx': True, 'use_ema': True, 'use_spike': True, 'rsi_required': False, 'edge_k': 0.17309181936268964, 'edge_cap': 0.849676402384443, 'bull_strategy': 'breakout', 'bull_bb_std_mult': 2.1751790051884856, 'bull_rsi_os': 33, 'bull_rsi_ob': 76, 'bull_adx_thresh': 23.892665126564424, 'bull_atr_min_pct': 0.026445190509653667, 'bull_atr_max_pct': 0.14786360524017342, 'bull_tp_mult': 1.4848574825762615, 'bull_tsl_mult': 0.4292855533223858, 'bull_time_stop': 180, 'bull_use_sma': False, 'bull_use_ema': True, 'bull_use_atr': True, 'bull_use_adx': False, 'bull_use_spike': True, 'bull_rsi_required': True, 'bear_strategy': 'breakout', 'bear_bb_std_mult': 1.1546185990191442, 'bear_rsi_os': 38, 'bear_rsi_ob': 70, 'bear_adx_thresh': 16.09988295855188, 'bear_atr_min_pct': 0.029953290217647664, 'bear_atr_max_pct': 0.07514763672035657, 'bear_tp_mult': 2.09441934043627, 'bear_tsl_mult': 0.9727116095915889, 'bear_time_stop': 158, 'bear_use_sma': False, 'bear_use_ema': True, 'bear_use_atr': False, 'bear_use_adx': False, 'bear_use_spike': True, 'bear_rsi_required': False, 'sideways_strategy': 'breakout', 'sideways_bb_std_mult': 1.5852376655452511, 'sideways_rsi_os': 18, 'sideways_rsi_ob': 83, 'sideways_adx_thresh': 23.1832901677852, 'sideways_atr_min_pct': 0.004064159920475001, 'sideways_atr_max_pct': 0.13096238299534232, 'sideways_tp_mult': 1.899629877056269, 'sideways_tsl_mult': 0.6245433791882635, 'sideways_time_stop': 194, 'sideways_use_sma': False, 'sideways_use_ema': False, 'sideways_use_atr': False, 'sideways_use_adx': False, 'sideways_use_spike': True, 'sideways_rsi_required': False}.
