[I 2025-08-31 10:02:29,218] Trial 59 finished with values: [-1000000000.0, 1000000000.0] and parameters: {'p_sma': 11, 'p_std': 21, 'p_atr': 9, 'p_adx': 27, 'rsi_period': 57, 'ema1': 6, 'ema2': 50, 'slip_atr_k': 0.16682872839475638, 'slip_spread_k': 0.2782437434789733, 'spread_hl_frac': 0.010219621826355108, 'bb_std_mult': 3.377901219082953, 'rsi_os': 32, 'rsi_ob': 72, 'vol_spike': 0.20077279487548375, 'adx_thresh': 5.3218463327248235, 'atr_min_pct': 0.02835359929121056, 'atr_max_pct': 0.14106993312883243, 'tp_mult': 2.8357010638067806, 'tsl_mult': 0.555725451309674, 'strategy': 'breakout', 'time_stop': 11, 'use_sma': True, 'use_atr': True, 'use_adx': False, 'use_ema': True, 'use_spike': True, 'rsi_required': False, 'edge_k': 1.736030943278461, 'edge_cap': 0.4144421259906249, 'bull_strategy': 'breakout', 'bull_bb_std_mult': 1.2612731184649055, 'bull_rsi_os': 9, 'bull_rsi_ob': 55, 'bull_adx_thresh': 10.211958104411112, 'bull_atr_min_pct': 0.003417825210609118, 'bull_atr_max_pct': 0.07676552515793443, 'bull_tp_mult': 1.88633846818634, 'bull_tsl_mult': 0.7735365498311453, 'bull_time_stop': 218, 'bull_use_sma': False, 'bull_use_ema': True, 'bull_use_atr': False, 'bull_use_adx': True, 'bull_use_spike': True, 'bull_rsi_required': True, 'bear_strategy': 'mean_reversion', 'bear_bb_std_mult': 3.4619732135122274, 'bear_rsi_os': 20, 'bear_rsi_ob': 45, 'bear_adx_thresh': 11.955841190868652, 'bear_atr_min_pct': 0.026579853898848597, 'bear_atr_max_pct': 0.0695085331686087, 'bear_tp_mult': 1.8025860740708333, 'bear_tsl_mult': 0.35352120260244635, 'bear_time_stop': 249, 'bear_use_sma': False, 'bear_use_ema': True, 'bear_use_atr': True, 'bear_use_adx': False, 'bear_use_spike': True, 'bear_rsi_required': True, 'sideways_strategy': 'breakout', 'sideways_bb_std_mult': 1.2440609853486713, 'sideways_rsi_os': 52, 'sideways_rsi_ob': 95, 'sideways_adx_thresh': 32.989698833551245, 'sideways_atr_min_pct': 0.029966106651934103, 'sideways_atr_max_pct': 0.11168418255660534, 'sideways_tp_mult': 1.185916432721371, 'sideways_tsl_mult': 0.3384488999089827, 'sideways_time_stop': 298, 'sideways_use_sma': False, 'sideways_use_ema': False, 'sideways_use_atr': False, 'sideways_use_adx': True, 'sideways_use_spike': True, 'sideways_rsi_required': True}.
[I 2025-08-31 10:02:29,475] Trial 65 finished with values: [-1000000000.0, 1000000000.0] and parameters: {'p_sma': 5, 'p_std': 5, 'p_atr': 14, 'p_adx': 30, 'rsi_period': 53, 'ema1': 5, 'ema2': 27, 'slip_atr_k': 0.15767806315898258, 'slip_spread_k': 0.13886505350729805, 'spread_hl_frac': 0.016009303797178808, 'bb_std_mult': 0.9221099878112937, 'rsi_os': 51, 'rsi_ob': 92, 'vol_spike': 0.17962046036040888, 'adx_thresh': 8.516778872854875, 'atr_min_pct': 0.028945942840975084, 'atr_max_pct': 0.05916261828024899, 'tp_mult': 2.676086444906898, 'tsl_mult': 0.9974136316417999, 'strategy': 'mean_reversion', 'time_stop': 5, 'use_sma': False, 'use_atr': False, 'use_adx': True, 'use_ema': False, 'use_spike': False, 'rsi_required': True, 'edge_k': 0.9295011076700244, 'edge_cap': 0.9329577568336302, 'bull_strategy': 'breakout', 'bull_bb_std_mult': 3.035435313146534, 'bull_rsi_os': 10, 'bull_rsi_ob': 59, 'bull_adx_thresh': 20.907641901523178, 'bull_atr_min_pct': 0.0008674051925146547, 'bull_atr_max_pct': 0.06923211874311457, 'bull_tp_mult': 1.7205251098663714, 'bull_tsl_mult': 0.577816378884106, 'bull_time_stop': 29, 'bull_use_sma': False, 'bull_use_ema': False, 'bull_use_atr': True, 'bull_use_adx': False, 'bull_use_spike': False, 'bull_rsi_required': False, 'bear_strategy': 'mean_reversion', 'bear_bb_std_mult': 2.4828425336986784, 'bear_rsi_os': 47, 'bear_rsi_ob': 60, 'bear_adx_thresh': 33.81677766369661, 'bear_atr_min_pct': 0.02317724648822727, 'bear_atr_max_pct': 0.022440367720671553, 'bear_tp_mult': 2.9047757520154334, 'bear_tsl_mult': 0.41783373228262677, 'bear_time_stop': 260, 'bear_use_sma': True, 'bear_use_ema': True, 'bear_use_atr': False, 'bear_use_adx': True, 'bear_use_spike': True, 'bear_rsi_required': False, 'sideways_strategy': 'mean_reversion', 'sideways_bb_std_mult': 1.9758915943135233, 'sideways_rsi_os': 37, 'sideways_rsi_ob': 47, 'sideways_adx_thresh': 20.712883579164384, 'sideways_atr_min_pct': 0.002512431053210678, 'sideways_atr_max_pct': 0.12754681515688593, 'sideways_tp_mult': 2.152526330628157, 'sideways_tsl_mult': 0.4146788039907687, 'sideways_time_stop': 175, 'sideways_use_sma': True, 'sideways_use_ema': False, 'sideways_use_atr': False, 'sideways_use_adx': False, 'sideways_use_spike': False, 'sideways_rsi_required': False}.
[I 2025-08-31 10:02:29,482] Trial 64 finished with values: [-1000000000.0, 1000000000.0] and parameters: {'p_sma': 5, 'p_std': 5, 'p_atr': 13, 'p_adx': 30, 'rsi_period': 51, 'ema1': 13, 'ema2': 20, 'slip_atr_k': 0.16002122916854594, 'slip_spread_k': 0.16241904476855545, 'spread_hl_frac': 0.0066376074564607375, 'bb_std_mult': 1.4146019631844666, 'rsi_os': 52, 'rsi_ob': 92, 'vol_spike': 0.1854902737080921, 'adx_thresh': 6.409180221072365, 'atr_min_pct': 0.01688342651734669, 'atr_max_pct': 0.05939958140399405, 'tp_mult': 1.5565224373259503, 'tsl_mult': 0.8368206617022892, 'strategy': 'mean_reversion', 'time_stop': 6, 'use_sma': True, 'use_atr': False, 'use_adx': True, 'use_ema': False, 'use_spike': False, 'rsi_required': True, 'edge_k': 1.7164740910211136, 'edge_cap': 0.9226951548805035, 'bull_strategy': 'breakout', 'bull_bb_std_mult': 3.0101162683773532, 'bull_rsi_os': 7, 'bull_rsi_ob': 65, 'bull_adx_thresh': 13.101397092063396, 'bull_atr_min_pct': 0.00044682957497232175, 'bull_atr_max_pct': 0.018986600237969956, 'bull_tp_mult': 2.356521116031723, 'bull_tsl_mult': 0.8548507976474229, 'bull_time_stop': 26, 'bull_use_sma': False, 'bull_use_ema': False, 'bull_use_atr': True, 'bull_use_adx': True, 'bull_use_spike': False, 'bull_rsi_required': False, 'bear_strategy': 'mean_reversion', 'bear_bb_std_mult': 3.4678949012536506, 'bear_rsi_os': 48, 'bear_rsi_ob': 59, 'bear_adx_thresh': 33.73475915036077, 'bear_atr_min_pct': 0.022206125018745408, 'bear_atr_max_pct': 0.03160827973245805, 'bear_tp_mult': 1.8404996683958543, 'bear_tsl_mult': 0.5153386368717989, 'bear_time_stop': 286, 'bear_use_sma': True, 'bear_use_ema': True, 'bear_use_atr': False, 'bear_use_adx': True, 'bear_use_spike': True, 'bear_rsi_required': False, 'sideways_strategy': 'mean_reversion', 'sideways_bb_std_mult': 3.5780863429429037, 'sideways_rsi_os': 38, 'sideways_rsi_ob': 53, 'sideways_adx_thresh': 29.986910242944493, 'sideways_atr_min_pct': 0.026247052947528306, 'sideways_atr_max_pct': 0.10850544309690376, 'sideways_tp_mult': 2.143138544565571, 'sideways_tsl_mult': 0.416629268475357, 'sideways_time_stop': 170, 'sideways_use_sma': True, 'sideways_use_ema': False, 'sideways_use_atr': False, 'sideways_use_adx': False, 'sideways_use_spike': False, 'sideways_rsi_required': False}.
[I 2025-08-31 10:02:29,510] Trial 67 finished with values: [-1000000000.0, 1000000000.0] and parameters: {'p_sma': 5, 'p_std': 5, 'p_atr': 22, 'p_adx': 7, 'rsi_period': 54, 'ema1': 13, 'ema2': 21, 'slip_atr_k': 0.18300990073220194, 'slip_spread_k': 0.09810600022273151, 'spread_hl_frac': 0.016390422396021505, 'bb_std_mult': 1.5199100584866394, 'rsi_os': 51, 'rsi_ob': 95, 'vol_spike': 0.23281002437819268, 'adx_thresh': 8.076239426027856, 'atr_min_pct': 0.029945741621412163, 'atr_max_pct': 0.14798839048166398, 'tp_mult': 1.1575990206676021, 'tsl_mult': 0.9562322142925391, 'strategy': 'mean_reversion', 'time_stop': 7, 'use_sma': True, 'use_atr': False, 'use_adx': True, 'use_ema': False, 'use_spike': False, 'rsi_required': True, 'edge_k': 0.34032823811527035, 'edge_cap': 0.7535442054153692, 'bull_strategy': 'breakout', 'bull_bb_std_mult': 2.8038292219712924, 'bull_rsi_os': 53, 'bull_rsi_ob': 59, 'bull_adx_thresh': 20.786111922356525, 'bull_atr_min_pct': 0.0002487812859969862, 'bull_atr_max_pct': 0.07097008629567716, 'bull_tp_mult': 2.570311035245566, 'bull_tsl_mult': 0.44727030631044473, 'bull_time_stop': 27, 'bull_use_sma': True, 'bull_use_ema': False, 'bull_use_atr': True, 'bull_use_adx': False, 'bull_use_spike': False, 'bull_rsi_required': False, 'bear_strategy': 'breakout', 'bear_bb_std_mult': 2.4846704182129336, 'bear_rsi_os': 33, 'bear_rsi_ob': 60, 'bear_adx_thresh': 33.667772407839806, 'bear_atr_min_pct': 0.021990955753424257, 'bear_atr_max_pct': 0.021817326814776133, 'bear_tp_mult': 1.0217039856243846, 'bear_tsl_mult': 0.41555594544586705, 'bear_time_stop': 289, 'bear_use_sma': True, 'bear_use_ema': True, 'bear_use_atr': True, 'bear_use_adx': True, 'bear_use_spike': False, 'bear_rsi_required': False, 'sideways_strategy': 'mean_reversion', 'sideways_bb_std_mult': 3.3092203974122567, 'sideways_rsi_os': 37, 'sideways_rsi_ob': 46, 'sideways_adx_thresh': 20.699652101030047, 'sideways_atr_min_pct': 0.0020999338562028343, 'sideways_atr_max_pct': 0.07863526237214355, 'sideways_tp_mult': 1.7692048359128862, 'sideways_tsl_mult': 0.6829403723995751, 'sideways_time_stop': 124, 'sideways_use_sma': True, 'sideways_use_ema': False, 'sideways_use_atr': False, 'sideways_use_adx': False, 'sideways_use_spike': False, 'sideways_rsi_required': False}.
[I 2025-08-31 10:02:58,563] Trial 66 finished with values: [-0.10959312744985417, 0.10939630693666107] and parameters: {'p_sma': 7, 'p_std': 5, 'p_atr': 14, 'p_adx': 7, 'rsi_period': 52, 'ema1': 5, 'ema2': 22, 'slip_atr_k': 0.156914845880375, 'slip_spread_k': 0.0981056078449664, 'spread_hl_frac': 0.013405720421501158, 'bb_std_mult': 1.5673811324480043, 'rsi_os': 32, 'rsi_ob': 95, 'vol_spike': 0.18421177553885115, 'adx_thresh': 19.038182749733245, 'atr_min_pct': 0.028816230570363296, 'atr_max_pct': 0.13967091018284805, 'tp_mult': 2.6622416785317853, 'tsl_mult': 0.9545877334001722, 'strategy': 'mean_reversion', 'time_stop': 10, 'use_sma': True, 'use_atr': False, 'use_adx': True, 'use_ema': False, 'use_spike': False, 'rsi_required': True, 'edge_k': 0.915533584539963, 'edge_cap': 0.1861855475992219, 'bull_strategy': 'breakout', 'bull_bb_std_mult': 2.7841485675527506, 'bull_rsi_os': 7, 'bull_rsi_ob': 59, 'bull_adx_thresh': 21.49677554837553, 'bull_atr_min_pct': 0.0002878194503833512, 'bull_atr_max_pct': 0.070969516570438, 'bull_tp_mult': 2.372343696460833, 'bull_tsl_mult': 0.7178040469584823, 'bull_time_stop': 35, 'bull_use_sma': False, 'bull_use_ema': False, 'bull_use_atr': True, 'bull_use_adx': False, 'bull_use_spike': False, 'bull_rsi_required': True, 'bear_strategy': 'mean_reversion', 'bear_bb_std_mult': 2.447533999013802, 'bear_rsi_os': 30, 'bear_rsi_ob': 59, 'bear_adx_thresh': 16.890793601893154, 'bear_atr_min_pct': 0.02182715012149627, 'bear_atr_max_pct': 0.022244290018594758, 'bear_tp_mult': 2.91613510305032, 'bear_tsl_mult': 0.4057327019090727, 'bear_time_stop': 264, 'bear_use_sma': True, 'bear_use_ema': True, 'bear_use_atr': True, 'bear_use_adx': True, 'bear_use_spike': False, 'bear_rsi_required': False, 'sideways_strategy': 'mean_reversion', 'sideways_bb_std_mult': 3.3165614998640107, 'sideways_rsi_os': 38, 'sideways_rsi_ob': 46, 'sideways_adx_thresh': 20.71413483927387, 'sideways_atr_min_pct': 0.0023592930773021926, 'sideways_atr_max_pct': 0.1279529211094788, 'sideways_tp_mult': 1.3597778913453218, 'sideways_tsl_mult': 0.48005590927882463, 'sideways_time_stop': 132, 'sideways_use_sma': True, 'sideways_use_ema': False, 'sideways_use_atr': False, 'sideways_use_adx': False, 'sideways_use_spike': False, 'sideways_rsi_required': False}.
[I 2025-08-31 10:03:01,051] Trial 68 finished with values: [-0.06681589123311282, 0.0666986698301228] and parameters: {'p_sma': 7, 'p_std': 5, 'p_atr': 21, 'p_adx': 7, 'rsi_period': 44, 'ema1': 8, 'ema2': 21, 'slip_atr_k': 0.18561689512267682, 'slip_spread_k': 0.09110998645170221, 'spread_hl_frac': 0.013379808940558555, 'bb_std_mult': 1.4782705000760954, 'rsi_os': 38, 'rsi_ob': 95, 'vol_spike': 0.23173184364050592, 'adx_thresh': 21.68675228036321, 'atr_min_pct': 0.029684121140757993, 'atr_max_pct': 0.1092220823627585, 'tp_mult': 1.079889809165823, 'tsl_mult': 0.8330527217482789, 'strategy': 'mean_reversion', 'time_stop': 151, 'use_sma': True, 'use_atr': False, 'use_adx': True, 'use_ema': False, 'use_spike': False, 'rsi_required': True, 'edge_k': 0.2150136493817596, 'edge_cap': 0.18546176546039186, 'bull_strategy': 'mean_reversion', 'bull_bb_std_mult': 2.7849852090039766, 'bull_rsi_os': 50, 'bull_rsi_ob': 69, 'bull_adx_thresh': 28.751074580921426, 'bull_atr_min_pct': 5.139276358498445e-05, 'bull_atr_max_pct': 0.01007599028246732, 'bull_tp_mult': 1.3769374422326361, 'bull_tsl_mult': 0.44839367645956835, 'bull_time_stop': 244, 'bull_use_sma': True, 'bull_use_ema': False, 'bull_use_atr': True, 'bull_use_adx': True, 'bull_use_spike': False, 'bull_rsi_required': False, 'bear_strategy': 'breakout', 'bear_bb_std_mult': 2.342333382779896, 'bear_rsi_os': 33, 'bear_rsi_ob': 62, 'bear_adx_thresh': 30.284093361030738, 'bear_atr_min_pct': 0.022213377917741813, 'bear_atr_max_pct': 0.031093183543961497, 'bear_tp_mult': 2.7808646647746404, 'bear_tsl_mult': 0.6354856773019091, 'bear_time_stop': 283, 'bear_use_sma': True, 'bear_use_ema': True, 'bear_use_atr': True, 'bear_use_adx': True, 'bear_use_spike': False, 'bear_rsi_required': False, 'sideways_strategy': 'mean_reversion', 'sideways_bb_std_mult': 3.4756083065190158, 'sideways_rsi_os': 39, 'sideways_rsi_ob': 50, 'sideways_adx_thresh': 29.69480858725688, 'sideways_atr_min_pct': 0.02400262259349563, 'sideways_atr_max_pct': 0.07626930033508092, 'sideways_tp_mult': 1.3791431625148494, 'sideways_tsl_mult': 0.3221661065702021, 'sideways_time_stop': 103, 'sideways_use_sma': True, 'sideways_use_ema': False, 'sideways_use_atr': True, 'sideways_use_adx': False, 'sideways_use_spike': False, 'sideways_rsi_required': False}.
[I 2025-08-31 10:03:01,245] Trial 69 finished with values: [-1000000000.0, 1000000000.0] and parameters: {'p_sma': 8, 'p_std': 11, 'p_atr': 21, 'p_adx': 7, 'rsi_period': 43, 'ema1': 8, 'ema2': 21, 'slip_atr_k': 0.18216732731010024, 'slip_spread_k': 0.04346531368047979, 'spread_hl_frac': 0.01409399195973779, 'bb_std_mult': 1.5551068173367433, 'rsi_os': 38, 'rsi_ob': 95, 'vol_spike': 0.23455382073842052, 'adx_thresh': 14.769774965964064, 'atr_min_pct': 0.026801191488332814, 'atr_max_pct': 0.13836904889237633, 'tp_mult': 1.014058660430146, 'tsl_mult': 0.9550475447907272, 'strategy': 'mean_reversion', 'time_stop': 43, 'use_sma': True, 'use_atr': False, 'use_adx': True, 'use_ema': False, 'use_spike': False, 'rsi_required': True, 'edge_k': 0.7110860586232319, 'edge_cap': 0.19540697003172008, 'bull_strategy': 'mean_reversion', 'bull_bb_std_mult': 2.7968744740905334, 'bull_rsi_os': 51, 'bull_rsi_ob': 95, 'bull_adx_thresh': 16.80116550164215, 'bull_atr_min_pct': 0.017843831248066655, 'bull_atr_max_pct': 0.08852209812540356, 'bull_tp_mult': 2.5637195202334007, 'bull_tsl_mult': 0.48718307758371393, 'bull_time_stop': 253, 'bull_use_sma': True, 'bull_use_ema': False, 'bull_use_atr': True, 'bull_use_adx': False, 'bull_use_spike': False, 'bull_rsi_required': False, 'bear_strategy': 'breakout', 'bear_bb_std_mult': 2.336541134317447, 'bear_rsi_os': 28, 'bear_rsi_ob': 62, 'bear_adx_thresh': 30.42525439820832, 'bear_atr_min_pct': 0.012457221812418371, 'bear_atr_max_pct': 0.01516616214059869, 'bear_tp_mult': 2.590470117193761, 'bear_tsl_mult': 0.30383717830041573, 'bear_time_stop': 168, 'bear_use_sma': True, 'bear_use_ema': True, 'bear_use_atr': True, 'bear_use_adx': True, 'bear_use_spike': False, 'bear_rsi_required': False, 'sideways_strategy': 'mean_reversion', 'sideways_bb_std_mult': 3.302672195419864, 'sideways_rsi_os': 42, 'sideways_rsi_ob': 86, 'sideways_adx_thresh': 24.123286014925146, 'sideways_atr_min_pct': 0.02439992765444769, 'sideways_atr_max_pct': 0.07619592065770689, 'sideways_tp_mult': 2.5382242823231094, 'sideways_tsl_mult': 0.49167519667431153, 'sideways_time_stop': 134, 'sideways_use_sma': True, 'sideways_use_ema': False, 'sideways_use_atr': True, 'sideways_use_adx': False, 'sideways_use_spike': False, 'sideways_rsi_required': False}.
[I 2025-08-31 10:03:01,453] Trial 70 finished with values: [-1000000000.0, 1000000000.0] and parameters: {'p_sma': 12, 'p_std': 12, 'p_atr': 17, 'p_adx': 28, 'rsi_period': 63, 'ema1': 8, 'ema2': 15, 'slip_atr_k': 0.23868121043783946, 'slip_spread_k': 0.037350812444674975, 'spread_hl_frac': 0.013689728549163937, 'bb_std_mult': 0.6827321369675101, 'rsi_os': 39, 'rsi_ob': 66, 'vol_spike': 0.22489883500614843, 'adx_thresh': 19.50357977915415, 'atr_min_pct': 0.014387244336919328, 'atr_max_pct': 0.14999829219360727, 'tp_mult': 2.3331478050286836, 'tsl_mult': 0.23437726909669665, 'strategy': 'mean_reversion', 'time_stop': 39, 'use_sma': True, 'use_atr': False, 'use_adx': True, 'use_ema': False, 'use_spike': False, 'rsi_required': True, 'edge_k': 0.7035749938391573, 'edge_cap': 0.1973116661341334, 'bull_strategy': 'mean_reversion', 'bull_bb_std_mult': 3.2191352284745625, 'bull_rsi_os': 38, 'bull_rsi_ob': 87, 'bull_adx_thresh': 29.054059042884084, 'bull_atr_min_pct': 0.005220535458418033, 'bull_atr_max_pct': 0.08773398889281468, 'bull_tp_mult': 1.4853200572568803, 'bull_tsl_mult': 0.11577435610306497, 'bull_time_stop': 187, 'bull_use_sma': True, 'bull_use_ema': True, 'bull_use_atr': True, 'bull_use_adx': True, 'bull_use_spike': False, 'bull_rsi_required': True, 'bear_strategy': 'breakout', 'bear_bb_std_mult': 2.296949508583796, 'bear_rsi_os': 28, 'bear_rsi_ob': 63, 'bear_adx_thresh': 34.99789636782036, 'bear_atr_min_pct': 0.012637478316026709, 'bear_atr_max_pct': 0.0153535164043683, 'bear_tp_mult': 2.598273952351064, 'bear_tsl_mult': 0.6413203903813195, 'bear_time_stop': 266, 'bear_use_sma': True, 'bear_use_ema': True, 'bear_use_atr': True, 'bear_use_adx': True, 'bear_use_spike': False, 'bear_rsi_required': False, 'sideways_strategy': 'mean_reversion', 'sideways_bb_std_mult': 3.4926826942007043, 'sideways_rsi_os': 32, 'sideways_rsi_ob': 86, 'sideways_adx_thresh': 23.689537001485995, 'sideways_atr_min_pct': 0.024120049391134497, 'sideways_atr_max_pct': 0.1499872598528051, 'sideways_tp_mult': 2.5701063138088136, 'sideways_tsl_mult': 0.30952900553958906, 'sideways_time_stop': 73, 'sideways_use_sma': True, 'sideways_use_ema': True, 'sideways_use_atr': True, 'sideways_use_adx': False, 'sideways_use_spike': False, 'sideways_rsi_required': False}.
[I 2025-08-31 10:03:01,704] Trial 73 finished with values: [-1000000000.0, 1000000000.0] and parameters: {'p_sma': 12, 'p_std': 14, 'p_atr': 16, 'p_adx': 28, 'rsi_period': 62, 'ema1': 9, 'ema2': 40, 'slip_atr_k': 0.2089728246306533, 'slip_spread_k': 0.20119012289139457, 'spread_hl_frac': 0.019711611259951054, 'bb_std_mult': 1.3410231938475803, 'rsi_os': 17, 'rsi_ob': 48, 'vol_spike': 0.04563597336609196, 'adx_thresh': 7.073688832205725, 'atr_min_pct': 0.013885151280964255, 'atr_max_pct': 0.08979580344319152, 'tp_mult': 2.570887254552542, 'tsl_mult': 0.21673599982632719, 'strategy': 'mean_reversion', 'time_stop': 27, 'use_sma': False, 'use_atr': False, 'use_adx': True, 'use_ema': True, 'use_spike': False, 'rsi_required': True, 'edge_k': 1.1571307215574378, 'edge_cap': 0.14097561601398267, 'bull_strategy': 'breakout', 'bull_bb_std_mult': 3.2440895989563616, 'bull_rsi_os': 38, 'bull_rsi_ob': 73, 'bull_adx_thresh': 18.694475902818553, 'bull_atr_min_pct': 0.010104148563549967, 'bull_atr_max_pct': 0.08079419663827916, 'bull_tp_mult': 2.737738413558617, 'bull_tsl_mult': 0.6572989365670745, 'bull_time_stop': 181, 'bull_use_sma': False, 'bull_use_ema': True, 'bull_use_atr': True, 'bull_use_adx': True, 'bull_use_spike': True, 'bull_rsi_required': True, 'bear_strategy': 'mean_reversion', 'bear_bb_std_mult': 1.2810664650492156, 'bear_rsi_os': 18, 'bear_rsi_ob': 54, 'bear_adx_thresh': 31.673842600138176, 'bear_atr_min_pct': 0.009649863733660044, 'bear_atr_max_pct': 0.01650475204558295, 'bear_tp_mult': 2.6885540540382133, 'bear_tsl_mult': 0.7859605818656641, 'bear_time_stop': 214, 'bear_use_sma': False, 'bear_use_ema': False, 'bear_use_atr': True, 'bear_use_adx': False, 'bear_use_spike': True, 'bear_rsi_required': True, 'sideways_strategy': 'mean_reversion', 'sideways_bb_std_mult': 3.0785368342613673, 'sideways_rsi_os': 32, 'sideways_rsi_ob': 51, 'sideways_adx_thresh': 22.42309131427208, 'sideways_atr_min_pct': 0.015947820073527966, 'sideways_atr_max_pct': 0.10015775182318296, 'sideways_tp_mult': 1.2693979269746865, 'sideways_tsl_mult': 0.892260027745, 'sideways_time_stop': 82, 'sideways_use_sma': True, 'sideways_use_ema': True, 'sideways_use_atr': False, 'sideways_use_adx': True, 'sideways_use_spike': False, 'sideways_rsi_required': False}.
