[I 2025-08-31 10:05:45,797] Trial 90 finished with values: [-1000000000.0, 1000000000.0] and parameters: {'p_sma': 60, 'p_std': 55, 'p_atr': 10, 'p_adx': 30, 'rsi_period': 41, 'ema1': 20, 'ema2': 47, 'slip_atr_k': 0.04580488542267676, 'slip_spread_k': 0.18360754782791555, 'spread_hl_frac': 0.0114163726343069, 'bb_std_mult': 2.7393814315455494, 'rsi_os': 21, 'rsi_ob': 65, 'vol_spike': 0.07404716501258696, 'adx_thresh': 13.584770930579571, 'atr_min_pct': 0.011113499283966159, 'atr_max_pct': 0.07782752452428936, 'tp_mult': 2.5288304697141144, 'tsl_mult': 0.702657440312433, 'strategy': 'mean_reversion', 'time_stop': 249, 'use_sma': False, 'use_atr': False, 'use_adx': True, 'use_ema': True, 'use_spike': False, 'rsi_required': False, 'edge_k': 1.1254734906261465, 'edge_cap': 0.2208823565502503, 'bull_strategy': 'breakout', 'bull_bb_std_mult': 2.1308880178571328, 'bull_rsi_os': 25, 'bull_rsi_ob': 53, 'bull_adx_thresh': 17.464333623212532, 'bull_atr_min_pct': 0.008971514452150418, 'bull_atr_max_pct': 0.12292244529976876, 'bull_tp_mult': 2.8409128581325516, 'bull_tsl_mult': 0.8452670486590275, 'bull_time_stop': 117, 'bull_use_sma': True, 'bull_use_ema': False, 'bull_use_atr': True, 'bull_use_adx': True, 'bull_use_spike': True, 'bull_rsi_required': False, 'bear_strategy': 'mean_reversion', 'bear_bb_std_mult': 3.5431036301728516, 'bear_rsi_os': 31, 'bear_rsi_ob': 90, 'bear_adx_thresh': 23.71526995763545, 'bear_atr_min_pct': 0.0058039528368387504, 'bear_atr_max_pct': 0.1071167200043708, 'bear_tp_mult': 1.93823777845922, 'bear_tsl_mult': 0.222761521698277, 'bear_time_stop': 46, 'bear_use_sma': True, 'bear_use_ema': False, 'bear_use_atr': True, 'bear_use_adx': False, 'bear_use_spike': False, 'bear_rsi_required': True, 'sideways_strategy': 'mean_reversion', 'sideways_bb_std_mult': 3.1872244912626777, 'sideways_rsi_os': 40, 'sideways_rsi_ob': 55, 'sideways_adx_thresh': 25.95808518822615, 'sideways_atr_min_pct': 0.009673468856070011, 'sideways_atr_max_pct': 0.08893910818799347, 'sideways_tp_mult': 1.4346803101599397, 'sideways_tsl_mult': 0.23970977695879758, 'sideways_time_stop': 33, 'sideways_use_sma': True, 'sideways_use_ema': True, 'sideways_use_atr': False, 'sideways_use_adx': True, 'sideways_use_spike': True, 'sideways_rsi_required': False}.
[I 2025-08-31 10:05:46,712] Trial 91 finished with values: [-1000000000.0, 1000000000.0] and parameters: {'p_sma': 60, 'p_std': 49, 'p_atr': 24, 'p_adx': 11, 'rsi_period': 48, 'ema1': 20, 'ema2': 46, 'slip_atr_k': 0.044184338200314095, 'slip_spread_k': 0.5272964111643627, 'spread_hl_frac': 0.011443703132974731, 'bb_std_mult': 2.7060555129859125, 'rsi_os': 27, 'rsi_ob': 65, 'vol_spike': 0.19291092901721685, 'adx_thresh': 15.458700031269341, 'atr_min_pct': 0.01078014933047653, 'atr_max_pct': 0.010923789420486052, 'tp_mult': 2.5044188894903683, 'tsl_mult': 0.10731423047977151, 'strategy': 'breakout', 'time_stop': 251, 'use_sma': False, 'use_atr': False, 'use_adx': True, 'use_ema': True, 'use_spike': False, 'rsi_required': False, 'edge_k': 1.3751806062769198, 'edge_cap': 0.5119566855397306, 'bull_strategy': 'mean_reversion', 'bull_bb_std_mult': 1.8425672865497493, 'bull_rsi_os': 21, 'bull_rsi_ob': 53, 'bull_adx_thresh': 17.407573576118065, 'bull_atr_min_pct': 0.009313140830889376, 'bull_atr_max_pct': 0.09835132249506251, 'bull_tp_mult': 2.639844372553056, 'bull_tsl_mult': 0.8618101942794714, 'bull_time_stop': 118, 'bull_use_sma': False, 'bull_use_ema': False, 'bull_use_atr': True, 'bull_use_adx': True, 'bull_use_spike': True, 'bull_rsi_required': False, 'bear_strategy': 'breakout', 'bear_bb_std_mult': 0.885175445522626, 'bear_rsi_os': 31, 'bear_rsi_ob': 55, 'bear_adx_thresh': 17.2578483689554, 'bear_atr_min_pct': 0.002140745750196015, 'bear_atr_max_pct': 0.10231727773946454, 'bear_tp_mult': 2.6436870460884085, 'bear_tsl_mult': 0.8314301424702085, 'bear_time_stop': 51, 'bear_use_sma': True, 'bear_use_ema': False, 'bear_use_atr': True, 'bear_use_adx': False, 'bear_use_spike': True, 'bear_rsi_required': True, 'sideways_strategy': 'mean_reversion', 'sideways_bb_std_mult': 2.103787756693444, 'sideways_rsi_os': 7, 'sideways_rsi_ob': 55, 'sideways_adx_thresh': 26.235571872340962, 'sideways_atr_min_pct': 0.01066753816479737, 'sideways_atr_max_pct': 0.09396967728228896, 'sideways_tp_mult': 1.4538521462751794, 'sideways_tsl_mult': 0.23201201555740897, 'sideways_time_stop': 93, 'sideways_use_sma': False, 'sideways_use_ema': True, 'sideways_use_atr': True, 'sideways_use_adx': True, 'sideways_use_spike': True, 'sideways_rsi_required': False}.
[I 2025-08-31 10:05:46,719] Trial 89 finished with values: [-1000000000.0, 1000000000.0] and parameters: {'p_sma': 58, 'p_std': 48, 'p_atr': 10, 'p_adx': 29, 'rsi_period': 18, 'ema1': 26, 'ema2': 58, 'slip_atr_k': 0.04132757095219437, 'slip_spread_k': 0.5183515384871307, 'spread_hl_frac': 0.008083008478881135, 'bb_std_mult': 1.7817093506391115, 'rsi_os': 27, 'rsi_ob': 65, 'vol_spike': 0.08156272218171165, 'adx_thresh': 16.658432531222907, 'atr_min_pct': 0.004972638344446726, 'atr_max_pct': 0.010382745546216529, 'tp_mult': 2.5104440130245, 'tsl_mult': 0.7163681862813174, 'strategy': 'mean_reversion', 'time_stop': 50, 'use_sma': False, 'use_atr': False, 'use_adx': True, 'use_ema': True, 'use_spike': False, 'rsi_required': False, 'edge_k': 0.3953536542024718, 'edge_cap': 0.3373860635782358, 'bull_strategy': 'mean_reversion', 'bull_bb_std_mult': 2.102164642950507, 'bull_rsi_os': 31, 'bull_rsi_ob': 46, 'bull_adx_thresh': 5.579990468683874, 'bull_atr_min_pct': 0.004881320024427023, 'bull_atr_max_pct': 0.1433581477231784, 'bull_tp_mult': 2.635373406683713, 'bull_tsl_mult': 0.8480141153130499, 'bull_time_stop': 163, 'bull_use_sma': True, 'bull_use_ema': True, 'bull_use_atr': True, 'bull_use_adx': True, 'bull_use_spike': True, 'bull_rsi_required': False, 'bear_strategy': 'breakout', 'bear_bb_std_mult': 2.9706004805380135, 'bear_rsi_os': 31, 'bear_rsi_ob': 56, 'bear_adx_thresh': 23.688063819227114, 'bear_atr_min_pct': 0.005343584176381517, 'bear_atr_max_pct': 0.09900125349811295, 'bear_tp_mult': 2.654944861767275, 'bear_tsl_mult': 0.1879163935874048, 'bear_time_stop': 65, 'bear_use_sma': True, 'bear_use_ema': False, 'bear_use_atr': True, 'bear_use_adx': False, 'bear_use_spike': False, 'bear_rsi_required': True, 'sideways_strategy': 'mean_reversion', 'sideways_bb_std_mult': 3.1930990999055067, 'sideways_rsi_os': 33, 'sideways_rsi_ob': 57, 'sideways_adx_thresh': 25.887584822769377, 'sideways_atr_min_pct': 0.016838665141259916, 'sideways_atr_max_pct': 0.037407030950384154, 'sideways_tp_mult': 2.8646178502283197, 'sideways_tsl_mult': 0.25761676784552434, 'sideways_time_stop': 195, 'sideways_use_sma': True, 'sideways_use_ema': True, 'sideways_use_atr': True, 'sideways_use_adx': True, 'sideways_use_spike': True, 'sideways_rsi_required': False}.
[I 2025-08-31 10:05:46,881] Trial 93 finished with values: [-0.024749840359808872, 0.024578201751572746] and parameters: {'p_sma': 52, 'p_std': 42, 'p_atr': 8, 'p_adx': 11, 'rsi_period': 48, 'ema1': 26, 'ema2': 55, 'slip_atr_k': 0.06516128724839808, 'slip_spread_k': 0.19102159388994505, 'spread_hl_frac': 0.0417737056179172, 'bb_std_mult': 2.245734728650218, 'rsi_os': 21, 'rsi_ob': 74, 'vol_spike': 0.08863026117426248, 'adx_thresh': 16.54248683272466, 'atr_min_pct': 0.007316471498132141, 'atr_max_pct': 0.028832766147543647, 'tp_mult': 2.9250865456295303, 'tsl_mult': 0.8872637471579091, 'strategy': 'mean_reversion', 'time_stop': 157, 'use_sma': False, 'use_atr': False, 'use_adx': True, 'use_ema': True, 'use_spike': False, 'rsi_required': False, 'edge_k': 0.6136497682016501, 'edge_cap': 0.7406033624886086, 'bull_strategy': 'breakout', 'bull_bb_std_mult': 2.9156030632827608, 'bull_rsi_os': 27, 'bull_rsi_ob': 71, 'bull_adx_thresh': 17.60565707285256, 'bull_atr_min_pct': 0.0014633255704077015, 'bull_atr_max_pct': 0.10801220775424938, 'bull_tp_mult': 2.83715631856825, 'bull_tsl_mult': 0.8383742634427909, 'bull_time_stop': 93, 'bull_use_sma': False, 'bull_use_ema': False, 'bull_use_atr': True, 'bull_use_adx': True, 'bull_use_spike': True, 'bull_rsi_required': False, 'bear_strategy': 'mean_reversion', 'bear_bb_std_mult': 3.5211940748190287, 'bear_rsi_os': 16, 'bear_rsi_ob': 71, 'bear_adx_thresh': 13.465260631060417, 'bear_atr_min_pct': 0.005106107444713064, 'bear_atr_max_pct': 0.09978944594977618, 'bear_tp_mult': 2.8609245737233207, 'bear_tsl_mult': 0.5884264543840945, 'bear_time_stop': 138, 'bear_use_sma': False, 'bear_use_ema': False, 'bear_use_atr': False, 'bear_use_adx': False, 'bear_use_spike': True, 'bear_rsi_required': True, 'sideways_strategy': 'mean_reversion', 'sideways_bb_std_mult': 2.367514333687652, 'sideways_rsi_os': 7, 'sideways_rsi_ob': 68, 'sideways_adx_thresh': 33.50701195786705, 'sideways_atr_min_pct': 0.01730802066045939, 'sideways_atr_max_pct': 0.09333204374209735, 'sideways_tp_mult': 2.814186136011899, 'sideways_tsl_mult': 0.30073186089211085, 'sideways_time_stop': 235, 'sideways_use_sma': True, 'sideways_use_ema': True, 'sideways_use_atr': False, 'sideways_use_adx': True, 'sideways_use_spike': True, 'sideways_rsi_required': False}.
[I 2025-08-31 10:06:19,175] Trial 97 finished with values: [-1000000000.0, 1000000000.0] and parameters: {'p_sma': 52, 'p_std': 42, 'p_atr': 8, 'p_adx': 28, 'rsi_period': 37, 'ema1': 6, 'ema2': 55, 'slip_atr_k': 0.02604791329655086, 'slip_spread_k': 0.8629006749251784, 'spread_hl_frac': 0.024041844098395607, 'bb_std_mult': 2.198505944862168, 'rsi_os': 42, 'rsi_ob': 74, 'vol_spike': 0.21103846516551042, 'adx_thresh': 9.055065086451515, 'atr_min_pct': 0.007340343595942968, 'atr_max_pct': 0.1015322743807831, 'tp_mult': 2.7855773738359746, 'tsl_mult': 0.8880264343270937, 'strategy': 'mean_reversion', 'time_stop': 158, 'use_sma': False, 'use_atr': False, 'use_adx': True, 'use_ema': True, 'use_spike': True, 'rsi_required': False, 'edge_k': 1.2318270717136044, 'edge_cap': 0.9766874546052338, 'bull_strategy': 'breakout', 'bull_bb_std_mult': 2.8967167510534555, 'bull_rsi_os': 27, 'bull_rsi_ob': 75, 'bull_adx_thresh': 23.488771446581456, 'bull_atr_min_pct': 0.0020887388012625963, 'bull_atr_max_pct': 0.10766461777371655, 'bull_tp_mult': 1.7205117484165835, 'bull_tsl_mult': 0.6691626565954174, 'bull_time_stop': 146, 'bull_use_sma': False, 'bull_use_ema': False, 'bull_use_atr': False, 'bull_use_adx': True, 'bull_use_spike': True, 'bull_rsi_required': False, 'bear_strategy': 'mean_reversion', 'bear_bb_std_mult': 3.391463390205106, 'bear_rsi_os': 18, 'bear_rsi_ob': 78, 'bear_adx_thresh': 10.381060738437771, 'bear_atr_min_pct': 0.00288931940037776, 'bear_atr_max_pct': 0.11076181133223682, 'bear_tp_mult': 2.862040621891385, 'bear_tsl_mult': 0.010627462068307447, 'bear_time_stop': 26, 'bear_use_sma': False, 'bear_use_ema': False, 'bear_use_atr': False, 'bear_use_adx': False, 'bear_use_spike': True, 'bear_rsi_required': True, 'sideways_strategy': 'breakout', 'sideways_bb_std_mult': 2.8454931762963045, 'sideways_rsi_os': 36, 'sideways_rsi_ob': 92, 'sideways_adx_thresh': 32.89585067104097, 'sideways_atr_min_pct': 0.008489070590510935, 'sideways_atr_max_pct': 0.03244987894477855, 'sideways_tp_mult': 1.6224410733159382, 'sideways_tsl_mult': 0.3068470566518612, 'sideways_time_stop': 219, 'sideways_use_sma': True, 'sideways_use_ema': True, 'sideways_use_atr': False, 'sideways_use_adx': True, 'sideways_use_spike': True, 'sideways_rsi_required': False}.
[I 2025-08-31 10:06:19,602] Trial 94 finished with values: [-0.031155017747895863, 0.0314357128806944] and parameters: {'p_sma': 52, 'p_std': 34, 'p_atr': 8, 'p_adx': 29, 'rsi_period': 37, 'ema1': 6, 'ema2': 55, 'slip_atr_k': 0.011338268606665826, 'slip_spread_k': 0.12228772148484926, 'spread_hl_frac': 0.0032527379901570314, 'bb_std_mult': 1.9713355306768237, 'rsi_os': 20, 'rsi_ob': 74, 'vol_spike': 0.17232452251288558, 'adx_thresh': 11.703770674149538, 'atr_min_pct': 0.008203319281926807, 'atr_max_pct': 0.14549115342831515, 'tp_mult': 2.609222899580163, 'tsl_mult': 0.903767770364457, 'strategy': 'breakout', 'time_stop': 209, 'use_sma': False, 'use_atr': False, 'use_adx': True, 'use_ema': True, 'use_spike': False, 'rsi_required': False, 'edge_k': 1.2359017861024626, 'edge_cap': 0.4687820667578583, 'bull_strategy': 'breakout', 'bull_bb_std_mult': 2.952616026098914, 'bull_rsi_os': 27, 'bull_rsi_ob': 81, 'bull_adx_thresh': 13.737308569443355, 'bull_atr_min_pct': 0.002604231678728893, 'bull_atr_max_pct': 0.10819435049377128, 'bull_tp_mult': 1.6017971061188585, 'bull_tsl_mult': 0.30810306318573544, 'bull_time_stop': 124, 'bull_use_sma': False, 'bull_use_ema': False, 'bull_use_atr': False, 'bull_use_adx': True, 'bull_use_spike': True, 'bull_rsi_required': False, 'bear_strategy': 'mean_reversion', 'bear_bb_std_mult': 3.0415460189912595, 'bear_rsi_os': 12, 'bear_rsi_ob': 56, 'bear_adx_thresh': 26.001668884643664, 'bear_atr_min_pct': 0.0018907281325128084, 'bear_atr_max_pct': 0.10060384976977896, 'bear_tp_mult': 2.8568362097571645, 'bear_tsl_mult': 0.36387475892643234, 'bear_time_stop': 22, 'bear_use_sma': False, 'bear_use_ema': False, 'bear_use_atr': True, 'bear_use_adx': False, 'bear_use_spike': True, 'bear_rsi_required': True, 'sideways_strategy': 'mean_reversion', 'sideways_bb_std_mult': 2.0465895112621952, 'sideways_rsi_os': 34, 'sideways_rsi_ob': 59, 'sideways_adx_thresh': 27.457217361861918, 'sideways_atr_min_pct': 0.017273668082776264, 'sideways_atr_max_pct': 0.04675106823000824, 'sideways_tp_mult': 1.6265701531455212, 'sideways_tsl_mult': 0.28458734864443525, 'sideways_time_stop': 113, 'sideways_use_sma': False, 'sideways_use_ema': True, 'sideways_use_atr': False, 'sideways_use_adx': True, 'sideways_use_spike': True, 'sideways_rsi_required': False}.
[I 2025-08-31 10:06:19,755] Trial 96 finished with values: [-0.04385636028862061, 0.04385933279530331] and parameters: {'p_sma': 52, 'p_std': 58, 'p_atr': 8, 'p_adx': 18, 'rsi_period': 36, 'ema1': 6, 'ema2': 55, 'slip_atr_k': 0.0696464466777332, 'slip_spread_k': 0.11470289481057008, 'spread_hl_frac': 0.025294037226182113, 'bb_std_mult': 2.225970270666302, 'rsi_os': 20, 'rsi_ob': 74, 'vol_spike': 0.20944435269655132, 'adx_thresh': 11.907635246474142, 'atr_min_pct': 0.00793489852221402, 'atr_max_pct': 0.099887236708718, 'tp_mult': 2.7808896517438093, 'tsl_mult': 0.9048532787334644, 'strategy': 'breakout', 'time_stop': 154, 'use_sma': False, 'use_atr': False, 'use_adx': True, 'use_ema': True, 'use_spike': True, 'rsi_required': False, 'edge_k': 1.2176040109828281, 'edge_cap': 0.8332558927264646, 'bull_strategy': 'breakout', 'bull_bb_std_mult': 2.958965472235604, 'bull_rsi_os': 27, 'bull_rsi_ob': 64, 'bull_adx_thresh': 14.867755391316775, 'bull_atr_min_pct': 0.002325479610511924, 'bull_atr_max_pct': 0.10784380825256268, 'bull_tp_mult': 1.6250381831804224, 'bull_tsl_mult': 0.28922097384058904, 'bull_time_stop': 123, 'bull_use_sma': False, 'bull_use_ema': False, 'bull_use_atr': False, 'bull_use_adx': True, 'bull_use_spike': True, 'bull_rsi_required': False, 'bear_strategy': 'mean_reversion', 'bear_bb_std_mult': 3.373960764305221, 'bear_rsi_os': 11, 'bear_rsi_ob': 58, 'bear_adx_thresh': 6.154364110265007, 'bear_atr_min_pct': 0.0030725505628634315, 'bear_atr_max_pct': 0.12482949461650848, 'bear_tp_mult': 2.854842371720855, 'bear_tsl_mult': 0.3714004411357914, 'bear_time_stop': 28, 'bear_use_sma': False, 'bear_use_ema': False, 'bear_use_atr': False, 'bear_use_adx': False, 'bear_use_spike': True, 'bear_rsi_required': True, 'sideways_strategy': 'mean_reversion', 'sideways_bb_std_mult': 2.8493655783125087, 'sideways_rsi_os': 34, 'sideways_rsi_ob': 68, 'sideways_adx_thresh': 33.51406983620215, 'sideways_atr_min_pct': 0.020279607732998434, 'sideways_atr_max_pct': 0.05324951341861707, 'sideways_tp_mult': 1.6179877901749828, 'sideways_tsl_mult': 0.7870677701511167, 'sideways_time_stop': 120, 'sideways_use_sma': False, 'sideways_use_ema': True, 'sideways_use_atr': False, 'sideways_use_adx': True, 'sideways_use_spike': True, 'sideways_rsi_required': False}.
[I 2025-08-31 10:06:19,917] Trial 95 finished with values: [-1000000000.0, 1000000000.0] and parameters: {'p_sma': 52, 'p_std': 41, 'p_atr': 8, 'p_adx': 29, 'rsi_period': 37, 'ema1': 6, 'ema2': 55, 'slip_atr_k': 0.06386968595946013, 'slip_spread_k': 0.12562588314654652, 'spread_hl_frac': 0.02436516657038277, 'bb_std_mult': 1.9765740480543361, 'rsi_os': 20, 'rsi_ob': 55, 'vol_spike': 0.16358360523273022, 'adx_thresh': 11.04617662897167, 'atr_min_pct': 0.008165923523631905, 'atr_max_pct': 0.1463087433210204, 'tp_mult': 2.610824771437468, 'tsl_mult': 0.9200893085244621, 'strategy': 'breakout', 'time_stop': 213, 'use_sma': False, 'use_atr': False, 'use_adx': True, 'use_ema': True, 'use_spike': True, 'rsi_required': False, 'edge_k': 0.5903399443812773, 'edge_cap': 0.7103968894535767, 'bull_strategy': 'breakout', 'bull_bb_std_mult': 0.9619848537776714, 'bull_rsi_os': 27, 'bull_rsi_ob': 77, 'bull_adx_thresh': 13.918887484446213, 'bull_atr_min_pct': 0.002849469977990065, 'bull_atr_max_pct': 0.10741078617301877, 'bull_tp_mult': 1.6306054080022547, 'bull_tsl_mult': 0.32160102048321637, 'bull_time_stop': 134, 'bull_use_sma': False, 'bull_use_ema': False, 'bull_use_atr': False, 'bull_use_adx': True, 'bull_use_spike': True, 'bull_rsi_required': False, 'bear_strategy': 'mean_reversion', 'bear_bb_std_mult': 3.0618218962721, 'bear_rsi_os': 19, 'bear_rsi_ob': 58, 'bear_adx_thresh': 26.168541126214368, 'bear_atr_min_pct': 0.014940890292723564, 'bear_atr_max_pct': 0.11160613260653178, 'bear_tp_mult': 1.6671638878019845, 'bear_tsl_mult': 0.6834400721912101, 'bear_time_stop': 20, 'bear_use_sma': False, 'bear_use_ema': False, 'bear_use_atr': False, 'bear_use_adx': False, 'bear_use_spike': True, 'bear_rsi_required': True, 'sideways_strategy': 'mean_reversion', 'sideways_bb_std_mult': 2.8425677879063587, 'sideways_rsi_os': 31, 'sideways_rsi_ob': 69, 'sideways_adx_thresh': 33.12564101736932, 'sideways_atr_min_pct': 0.02013925814572514, 'sideways_atr_max_pct': 0.029073005889346686, 'sideways_tp_mult': 1.6227552699532497, 'sideways_tsl_mult': 0.2988824816560793, 'sideways_time_stop': 122, 'sideways_use_sma': False, 'sideways_use_ema': True, 'sideways_use_atr': False, 'sideways_use_adx': True, 'sideways_use_spike': True, 'sideways_rsi_required': False}.
[I 2025-08-31 10:06:52,208] Trial 98 finished with values: [-0.02152978130679639, 0.021542486525761326] and parameters: {'p_sma': 56, 'p_std': 58, 'p_atr': 8, 'p_adx': 26, 'rsi_period': 46, 'ema1': 7, 'ema2': 51, 'slip_atr_k': 0.06938745521499073, 'slip_spread_k': 0.1475507892993726, 'spread_hl_frac': 0.006548594078838541, 'bb_std_mult': 3.25782082922878, 'rsi_os': 21, 'rsi_ob': 68, 'vol_spike': 0.14577821464857554, 'adx_thresh': 10.224520442926334, 'atr_min_pct': 0.0092107176238047, 'atr_max_pct': 0.14586781150142109, 'tp_mult': 2.612048635070685, 'tsl_mult': 0.9068430616876821, 'strategy': 'mean_reversion', 'time_stop': 111, 'use_sma': False, 'use_atr': False, 'use_adx': True, 'use_ema': True, 'use_spike': False, 'rsi_required': False, 'edge_k': 0.8944540034419258, 'edge_cap': 0.8019921749268366, 'bull_strategy': 'breakout', 'bull_bb_std_mult': 2.9918064294420823, 'bull_rsi_os': 27, 'bull_rsi_ob': 70, 'bull_adx_thresh': 13.84552374511418, 'bull_atr_min_pct': 0.0010060580104796727, 'bull_atr_max_pct': 0.026075946569837576, 'bull_tp_mult': 2.9079207164278262, 'bull_tsl_mult': 0.11513604635658975, 'bull_time_stop': 122, 'bull_use_sma': False, 'bull_use_ema': False, 'bull_use_atr': False, 'bull_use_adx': False, 'bull_use_spike': True, 'bull_rsi_required': True, 'bear_strategy': 'mean_reversion', 'bear_bb_std_mult': 3.5981693483841903, 'bear_rsi_os': 7, 'bear_rsi_ob': 72, 'bear_adx_thresh': 12.361800226866583, 'bear_atr_min_pct': 0.01540405303394558, 'bear_atr_max_pct': 0.12347235883547192, 'bear_tp_mult': 1.7056920344417472, 'bear_tsl_mult': 0.38149587354371395, 'bear_time_stop': 137, 'bear_use_sma': False, 'bear_use_ema': False, 'bear_use_atr': False, 'bear_use_adx': False, 'bear_use_spike': True, 'bear_rsi_required': True, 'sideways_strategy': 'mean_reversion', 'sideways_bb_std_mult': 3.0570481778186283, 'sideways_rsi_os': 31, 'sideways_rsi_ob': 69, 'sideways_adx_thresh': 33.739160470200744, 'sideways_atr_min_pct': 0.0120440361414604, 'sideways_atr_max_pct': 0.062161107527022856, 'sideways_tp_mult': 1.7078287077005796, 'sideways_tsl_mult': 0.7376374874746149, 'sideways_time_stop': 282, 'sideways_use_sma': True, 'sideways_use_ema': True, 'sideways_use_atr': False, 'sideways_use_adx': True, 'sideways_use_spike': True, 'sideways_rsi_required': False}.
