[I 2025-08-31 11:23:24,306] Trial 684 finished with values: [-0.015220206703499772, 0.01621711530290043] and parameters: {'p_sma': 27, 'p_std': 43, 'p_atr': 11, 'p_adx': 14, 'rsi_period': 45, 'ema1': 14, 'ema2': 57, 'slip_atr_k': 0.02554622473690718, 'slip_spread_k': 0.5094874232134371, 'spread_hl_frac': 0.03750274666917554, 'bb_std_mult': 2.623268338606521, 'rsi_os': 24, 'rsi_ob': 83, 'vol_spike': 0.27216657230444097, 'adx_thresh': 20.823906558181218, 'atr_min_pct': 0.004951558601778322, 'atr_max_pct': 0.08309242163223254, 'tp_mult': 1.607940325659078, 'tsl_mult': 0.9555487898954546, 'strategy': 'breakout', 'time_stop': 17, 'use_sma': True, 'use_atr': False, 'use_adx': True, 'use_ema': True, 'use_spike': True, 'rsi_required': True, 'edge_k': 1.1812049096006416, 'edge_cap': 0.5263137524055446, 'bull_strategy': 'breakout', 'bull_bb_std_mult': 0.7446128122887105, 'bull_rsi_os': 9, 'bull_rsi_ob': 75, 'bull_adx_thresh': 7.997714046555837, 'bull_atr_min_pct': 0.0036219054190392854, 'bull_atr_max_pct': 0.04127199412293874, 'bull_tp_mult': 2.194424459905188, 'bull_tsl_mult': 0.3906545363095969, 'bull_time_stop': 75, 'bull_use_sma': False, 'bull_use_ema': False, 'bull_use_atr': False, 'bull_use_adx': False, 'bull_use_spike': True, 'bull_rsi_required': True, 'bear_strategy': 'breakout', 'bear_bb_std_mult': 0.5005847641195511, 'bear_rsi_os': 43, 'bear_rsi_ob': 89, 'bear_adx_thresh': 17.61438852307537, 'bear_atr_min_pct': 0.005617508439843135, 'bear_atr_max_pct': 0.1378757110413845, 'bear_tp_mult': 2.8136649440929107, 'bear_tsl_mult': 0.666484872454014, 'bear_time_stop': 282, 'bear_use_sma': True, 'bear_use_ema': True, 'bear_use_atr': False, 'bear_use_adx': False, 'bear_use_spike': False, 'bear_rsi_required': False, 'sideways_strategy': 'breakout', 'sideways_bb_std_mult': 3.4331307536603206, 'sideways_rsi_os': 5, 'sideways_rsi_ob': 55, 'sideways_adx_thresh': 6.826785434098394, 'sideways_atr_min_pct': 0.017441778086412996, 'sideways_atr_max_pct': 0.04052046184164579, 'sideways_tp_mult': 2.3784898711769644, 'sideways_tsl_mult': 0.19136361510944894, 'sideways_time_stop': 8, 'sideways_use_sma': False, 'sideways_use_ema': False, 'sideways_use_atr': True, 'sideways_use_adx': True, 'sideways_use_spike': False, 'sideways_rsi_required': True}.
[I 2025-08-31 11:23:25,191] Trial 685 finished with values: [-0.027750965902583413, 0.02729653052167687] and parameters: {'p_sma': 49, 'p_std': 60, 'p_atr': 16, 'p_adx': 13, 'rsi_period': 15, 'ema1': 14, 'ema2': 57, 'slip_atr_k': 0.18968099751669057, 'slip_spread_k': 0.27995655265227015, 'spread_hl_frac': 0.0010859453103398385, 'bb_std_mult': 2.6454683622877706, 'rsi_os': 28, 'rsi_ob': 79, 'vol_spike': 0.28194710472043094, 'adx_thresh': 16.1205607957424, 'atr_min_pct': 0.006734127782167113, 'atr_max_pct': 0.09507113364839272, 'tp_mult': 2.96250341345061, 'tsl_mult': 0.26095090424137946, 'strategy': 'mean_reversion', 'time_stop': 203, 'use_sma': True, 'use_atr': False, 'use_adx': True, 'use_ema': True, 'use_spike': True, 'rsi_required': False, 'edge_k': 0.6585165276140119, 'edge_cap': 0.19660453320324683, 'bull_strategy': 'breakout', 'bull_bb_std_mult': 2.309126100291541, 'bull_rsi_os': 12, 'bull_rsi_ob': 75, 'bull_adx_thresh': 6.793751930971391, 'bull_atr_min_pct': 0.003327361227493967, 'bull_atr_max_pct': 0.1085926317367789, 'bull_tp_mult': 1.8960487922881437, 'bull_tsl_mult': 0.6444035928828573, 'bull_time_stop': 28, 'bull_use_sma': True, 'bull_use_ema': True, 'bull_use_atr': False, 'bull_use_adx': False, 'bull_use_spike': False, 'bull_rsi_required': True, 'bear_strategy': 'breakout', 'bear_bb_std_mult': 0.5015130465327231, 'bear_rsi_os': 35, 'bear_rsi_ob': 86, 'bear_adx_thresh': 6.958182578306461, 'bear_atr_min_pct': 0.004895269433114436, 'bear_atr_max_pct': 0.13711645015498658, 'bear_tp_mult': 2.8665929519266595, 'bear_tsl_mult': 0.6592199185192047, 'bear_time_stop': 156, 'bear_use_sma': True, 'bear_use_ema': True, 'bear_use_atr': False, 'bear_use_adx': False, 'bear_use_spike': True, 'bear_rsi_required': False, 'sideways_strategy': 'mean_reversion', 'sideways_bb_std_mult': 1.493977032328142, 'sideways_rsi_os': 46, 'sideways_rsi_ob': 52, 'sideways_adx_thresh': 16.13344642184378, 'sideways_atr_min_pct': 0.025464985400933504, 'sideways_atr_max_pct': 0.03790426285155977, 'sideways_tp_mult': 2.606667266590488, 'sideways_tsl_mult': 0.10975832024181745, 'sideways_time_stop': 209, 'sideways_use_sma': True, 'sideways_use_ema': False, 'sideways_use_atr': False, 'sideways_use_adx': True, 'sideways_use_spike': True, 'sideways_rsi_required': True}.
[I 2025-08-31 11:23:25,191] Trial 686 finished with values: [-1000000000.0, 1000000000.0] and parameters: {'p_sma': 11, 'p_std': 39, 'p_atr': 7, 'p_adx': 13, 'rsi_period': 62, 'ema1': 12, 'ema2': 57, 'slip_atr_k': 0.017852407714686304, 'slip_spread_k': 0.7575334341839619, 'spread_hl_frac': 0.021302620502577117, 'bb_std_mult': 2.615907230997136, 'rsi_os': 27, 'rsi_ob': 80, 'vol_spike': 0.2720146742252174, 'adx_thresh': 27.7839575531977, 'atr_min_pct': 0.020117876818258818, 'atr_max_pct': 0.03267378930942655, 'tp_mult': 2.435389209470922, 'tsl_mult': 0.7064002011234176, 'strategy': 'mean_reversion', 'time_stop': 203, 'use_sma': True, 'use_atr': False, 'use_adx': True, 'use_ema': True, 'use_spike': True, 'rsi_required': False, 'edge_k': 0.9755712533445123, 'edge_cap': 0.5145156074282652, 'bull_strategy': 'breakout', 'bull_bb_std_mult': 0.7605840418363363, 'bull_rsi_os': 12, 'bull_rsi_ob': 75, 'bull_adx_thresh': 27.623537504102554, 'bull_atr_min_pct': 0.004436652701526533, 'bull_atr_max_pct': 0.01974717672769321, 'bull_tp_mult': 2.2074274167628536, 'bull_tsl_mult': 0.6449698005299631, 'bull_time_stop': 30, 'bull_use_sma': True, 'bull_use_ema': True, 'bull_use_atr': False, 'bull_use_adx': False, 'bull_use_spike': False, 'bull_rsi_required': True, 'bear_strategy': 'breakout', 'bear_bb_std_mult': 2.1371735868668944, 'bear_rsi_os': 30, 'bear_rsi_ob': 83, 'bear_adx_thresh': 28.35157265284543, 'bear_atr_min_pct': 0.004566795087950383, 'bear_atr_max_pct': 0.14293545297887478, 'bear_tp_mult': 2.8579020836967817, 'bear_tsl_mult': 0.5223503590084796, 'bear_time_stop': 56, 'bear_use_sma': True, 'bear_use_ema': True, 'bear_use_atr': False, 'bear_use_adx': False, 'bear_use_spike': True, 'bear_rsi_required': False, 'sideways_strategy': 'mean_reversion', 'sideways_bb_std_mult': 2.7032530574168194, 'sideways_rsi_os': 41, 'sideways_rsi_ob': 94, 'sideways_adx_thresh': 25.36058667962754, 'sideways_atr_min_pct': 0.008387799924818657, 'sideways_atr_max_pct': 0.034034433822830196, 'sideways_tp_mult': 1.958909357666583, 'sideways_tsl_mult': 0.9012265510065436, 'sideways_time_stop': 7, 'sideways_use_sma': True, 'sideways_use_ema': False, 'sideways_use_atr': False, 'sideways_use_adx': True, 'sideways_use_spike': True, 'sideways_rsi_required': True}.
[I 2025-08-31 11:23:25,348] Trial 687 finished with values: [-0.018327455648135538, 0.019018694616726697] and parameters: {'p_sma': 10, 'p_std': 29, 'p_atr': 19, 'p_adx': 14, 'rsi_period': 54, 'ema1': 10, 'ema2': 43, 'slip_atr_k': 0.03952564451758897, 'slip_spread_k': 0.18184638092537914, 'spread_hl_frac': 0.004716822936937373, 'bb_std_mult': 2.9151945651389335, 'rsi_os': 30, 'rsi_ob': 92, 'vol_spike': 0.2890045948569377, 'adx_thresh': 31.66108850735964, 'atr_min_pct': 0.01144218190454783, 'atr_max_pct': 0.1497399699046721, 'tp_mult': 1.6814159228025403, 'tsl_mult': 0.09278036239399878, 'strategy': 'mean_reversion', 'time_stop': 204, 'use_sma': True, 'use_atr': False, 'use_adx': True, 'use_ema': True, 'use_spike': True, 'rsi_required': False, 'edge_k': 0.40017706286390264, 'edge_cap': 0.5292097688705304, 'bull_strategy': 'breakout', 'bull_bb_std_mult': 0.5600899316883167, 'bull_rsi_os': 14, 'bull_rsi_ob': 83, 'bull_adx_thresh': 5.7435554945421545, 'bull_atr_min_pct': 0.00539461828017551, 'bull_atr_max_pct': 0.09913188457841222, 'bull_tp_mult': 1.853989537069795, 'bull_tsl_mult': 0.4577950376538862, 'bull_time_stop': 285, 'bull_use_sma': False, 'bull_use_ema': True, 'bull_use_atr': False, 'bull_use_adx': False, 'bull_use_spike': False, 'bull_rsi_required': True, 'bear_strategy': 'breakout', 'bear_bb_std_mult': 3.2224246666101948, 'bear_rsi_os': 50, 'bear_rsi_ob': 74, 'bear_adx_thresh': 5.118285927835785, 'bear_atr_min_pct': 0.00294347681981453, 'bear_atr_max_pct': 0.13809004504234515, 'bear_tp_mult': 2.8808271591014134, 'bear_tsl_mult': 0.7493110058675229, 'bear_time_stop': 45, 'bear_use_sma': True, 'bear_use_ema': True, 'bear_use_atr': False, 'bear_use_adx': False, 'bear_use_spike': False, 'bear_rsi_required': False, 'sideways_strategy': 'breakout', 'sideways_bb_std_mult': 3.012448208474791, 'sideways_rsi_os': 26, 'sideways_rsi_ob': 95, 'sideways_adx_thresh': 12.10915262322066, 'sideways_atr_min_pct': 0.016136660364099952, 'sideways_atr_max_pct': 0.04578538604436856, 'sideways_tp_mult': 1.8609650053039273, 'sideways_tsl_mult': 0.3573522390152094, 'sideways_time_stop': 7, 'sideways_use_sma': True, 'sideways_use_ema': False, 'sideways_use_atr': True, 'sideways_use_adx': True, 'sideways_use_spike': True, 'sideways_rsi_required': True}.
[I 2025-08-31 11:23:58,657] Trial 688 finished with values: [-0.027558930352985178, 0.027798908913248738] and parameters: {'p_sma': 12, 'p_std': 22, 'p_atr': 11, 'p_adx': 14, 'rsi_period': 56, 'ema1': 9, 'ema2': 43, 'slip_atr_k': 0.041129454651977655, 'slip_spread_k': 0.16786140735390692, 'spread_hl_frac': 0.005237692381098239, 'bb_std_mult': 2.900684644836394, 'rsi_os': 30, 'rsi_ob': 92, 'vol_spike': 0.2846631343120369, 'adx_thresh': 31.742139231531265, 'atr_min_pct': 0.01172789611054295, 'atr_max_pct': 0.1498950484108773, 'tp_mult': 1.6902883393525003, 'tsl_mult': 0.03385318456792698, 'strategy': 'mean_reversion', 'time_stop': 204, 'use_sma': True, 'use_atr': False, 'use_adx': True, 'use_ema': True, 'use_spike': True, 'rsi_required': False, 'edge_k': 0.4244024807517867, 'edge_cap': 0.5290958280006651, 'bull_strategy': 'breakout', 'bull_bb_std_mult': 0.5512965169160343, 'bull_rsi_os': 13, 'bull_rsi_ob': 83, 'bull_adx_thresh': 5.086946384068193, 'bull_atr_min_pct': 0.005510532903499222, 'bull_atr_max_pct': 0.09975818402916524, 'bull_tp_mult': 1.8600303638103326, 'bull_tsl_mult': 0.430843712296109, 'bull_time_stop': 282, 'bull_use_sma': False, 'bull_use_ema': True, 'bull_use_atr': False, 'bull_use_adx': False, 'bull_use_spike': False, 'bull_rsi_required': True, 'bear_strategy': 'breakout', 'bear_bb_std_mult': 3.231839855084213, 'bear_rsi_os': 52, 'bear_rsi_ob': 74, 'bear_adx_thresh': 5.227777009192964, 'bear_atr_min_pct': 0.003158125411663536, 'bear_atr_max_pct': 0.13683944490465957, 'bear_tp_mult': 2.868914169951281, 'bear_tsl_mult': 0.7584134182633796, 'bear_time_stop': 44, 'bear_use_sma': True, 'bear_use_ema': True, 'bear_use_atr': False, 'bear_use_adx': False, 'bear_use_spike': False, 'bear_rsi_required': False, 'sideways_strategy': 'breakout', 'sideways_bb_std_mult': 2.9135341776921218, 'sideways_rsi_os': 24, 'sideways_rsi_ob': 95, 'sideways_adx_thresh': 12.240994322746264, 'sideways_atr_min_pct': 0.015676910053010265, 'sideways_atr_max_pct': 0.046488228946825375, 'sideways_tp_mult': 1.8359125112124726, 'sideways_tsl_mult': 0.36100532179962486, 'sideways_time_stop': 5, 'sideways_use_sma': True, 'sideways_use_ema': False, 'sideways_use_atr': True, 'sideways_use_adx': True, 'sideways_use_spike': True, 'sideways_rsi_required': True}.
[I 2025-08-31 11:23:59,132] Trial 691 finished with values: [-1000000000.0, 1000000000.0] and parameters: {'p_sma': 12, 'p_std': 34, 'p_atr': 11, 'p_adx': 26, 'rsi_period': 56, 'ema1': 9, 'ema2': 42, 'slip_atr_k': 0.04421422534372936, 'slip_spread_k': 0.1681303818653882, 'spread_hl_frac': 0.005055738278575332, 'bb_std_mult': 2.9610473272763134, 'rsi_os': 30, 'rsi_ob': 93, 'vol_spike': 0.27968209712066766, 'adx_thresh': 31.92332015706948, 'atr_min_pct': 0.01081203061454366, 'atr_max_pct': 0.14997986256985732, 'tp_mult': 1.6931701630155138, 'tsl_mult': 0.04038752884353397, 'strategy': 'breakout', 'time_stop': 208, 'use_sma': True, 'use_atr': False, 'use_adx': True, 'use_ema': False, 'use_spike': True, 'rsi_required': False, 'edge_k': 0.38723439215460015, 'edge_cap': 0.5310664418605516, 'bull_strategy': 'breakout', 'bull_bb_std_mult': 0.5580610261511699, 'bull_rsi_os': 14, 'bull_rsi_ob': 83, 'bull_adx_thresh': 5.234425036443746, 'bull_atr_min_pct': 0.004678116713150108, 'bull_atr_max_pct': 0.09893009202785355, 'bull_tp_mult': 1.8518360144188137, 'bull_tsl_mult': 0.41879756016950825, 'bull_time_stop': 279, 'bull_use_sma': False, 'bull_use_ema': True, 'bull_use_atr': False, 'bull_use_adx': False, 'bull_use_spike': True, 'bull_rsi_required': True, 'bear_strategy': 'mean_reversion', 'bear_bb_std_mult': 3.1468424032259157, 'bear_rsi_os': 52, 'bear_rsi_ob': 72, 'bear_adx_thresh': 5.085440141174988, 'bear_atr_min_pct': 0.0034145810810837255, 'bear_atr_max_pct': 0.13771590586125548, 'bear_tp_mult': 2.915825189782461, 'bear_tsl_mult': 0.7805646634978012, 'bear_time_stop': 45, 'bear_use_sma': False, 'bear_use_ema': True, 'bear_use_atr': False, 'bear_use_adx': True, 'bear_use_spike': False, 'bear_rsi_required': False, 'sideways_strategy': 'breakout', 'sideways_bb_std_mult': 2.962169637907137, 'sideways_rsi_os': 24, 'sideways_rsi_ob': 95, 'sideways_adx_thresh': 10.874903998579368, 'sideways_atr_min_pct': 0.01619525238822932, 'sideways_atr_max_pct': 0.04427388718018899, 'sideways_tp_mult': 1.85049212383303, 'sideways_tsl_mult': 0.3932917575884447, 'sideways_time_stop': 5, 'sideways_use_sma': False, 'sideways_use_ema': False, 'sideways_use_atr': True, 'sideways_use_adx': False, 'sideways_use_spike': True, 'sideways_rsi_required': True}.
[I 2025-08-31 11:23:59,134] Trial 690 finished with values: [-0.019616567479840863, 0.020288889896810124] and parameters: {'p_sma': 10, 'p_std': 24, 'p_atr': 11, 'p_adx': 14, 'rsi_period': 54, 'ema1': 9, 'ema2': 42, 'slip_atr_k': 0.03560809983331555, 'slip_spread_k': 0.17766611873921745, 'spread_hl_frac': 0.0047905016131431465, 'bb_std_mult': 2.9154950659991132, 'rsi_os': 30, 'rsi_ob': 94, 'vol_spike': 0.28370273697387166, 'adx_thresh': 31.740679295707338, 'atr_min_pct': 0.011581319620040715, 'atr_max_pct': 0.14869786527555545, 'tp_mult': 1.6802129399596837, 'tsl_mult': 0.08923002912423939, 'strategy': 'breakout', 'time_stop': 207, 'use_sma': True, 'use_atr': False, 'use_adx': True, 'use_ema': True, 'use_spike': True, 'rsi_required': False, 'edge_k': 0.3897096547588711, 'edge_cap': 0.5369609806912473, 'bull_strategy': 'breakout', 'bull_bb_std_mult': 0.5634739078607769, 'bull_rsi_os': 13, 'bull_rsi_ob': 83, 'bull_adx_thresh': 5.073823531598968, 'bull_atr_min_pct': 0.005561681966062184, 'bull_atr_max_pct': 0.09996880945214827, 'bull_tp_mult': 1.8745271364865548, 'bull_tsl_mult': 0.4409892479714511, 'bull_time_stop': 280, 'bull_use_sma': False, 'bull_use_ema': True, 'bull_use_atr': False, 'bull_use_adx': False, 'bull_use_spike': True, 'bull_rsi_required': True, 'bear_strategy': 'breakout', 'bear_bb_std_mult': 3.1962677376712447, 'bear_rsi_os': 52, 'bear_rsi_ob': 73, 'bear_adx_thresh': 5.132577252148246, 'bear_atr_min_pct': 0.003187489707528999, 'bear_atr_max_pct': 0.1386203173201043, 'bear_tp_mult': 2.8977268049350213, 'bear_tsl_mult': 0.7547811062824414, 'bear_time_stop': 45, 'bear_use_sma': False, 'bear_use_ema': True, 'bear_use_atr': False, 'bear_use_adx': False, 'bear_use_spike': False, 'bear_rsi_required': False, 'sideways_strategy': 'breakout', 'sideways_bb_std_mult': 2.9643938378934855, 'sideways_rsi_os': 24, 'sideways_rsi_ob': 95, 'sideways_adx_thresh': 10.584106844553524, 'sideways_atr_min_pct': 0.01590627315030442, 'sideways_atr_max_pct': 0.044866874938689884, 'sideways_tp_mult': 1.8679435287805022, 'sideways_tsl_mult': 0.3453542484866011, 'sideways_time_stop': 9, 'sideways_use_sma': False, 'sideways_use_ema': False, 'sideways_use_atr': True, 'sideways_use_adx': False, 'sideways_use_spike': True, 'sideways_rsi_required': True}.
[I 2025-08-31 11:23:59,288] Trial 689 finished with values: [-0.02192458751815518, 0.02145401939275006] and parameters: {'p_sma': 13, 'p_std': 24, 'p_atr': 11, 'p_adx': 14, 'rsi_period': 54, 'ema1': 10, 'ema2': 42, 'slip_atr_k': 0.04110119404381195, 'slip_spread_k': 0.17301094740167258, 'spread_hl_frac': 0.004935454477453787, 'bb_std_mult': 2.9765006412261052, 'rsi_os': 30, 'rsi_ob': 94, 'vol_spike': 0.2888282839869441, 'adx_thresh': 31.8179720414285, 'atr_min_pct': 0.011775996192702042, 'atr_max_pct': 0.14987693490221632, 'tp_mult': 1.6875251792073702, 'tsl_mult': 0.029070988709255723, 'strategy': 'breakout', 'time_stop': 207, 'use_sma': True, 'use_atr': False, 'use_adx': True, 'use_ema': True, 'use_spike': True, 'rsi_required': False, 'edge_k': 0.3856477158002868, 'edge_cap': 0.5435120149915377, 'bull_strategy': 'breakout', 'bull_bb_std_mult': 0.605777791721973, 'bull_rsi_os': 13, 'bull_rsi_ob': 83, 'bull_adx_thresh': 5.246568222112865, 'bull_atr_min_pct': 0.005563762261148223, 'bull_atr_max_pct': 0.09876884936580908, 'bull_tp_mult': 1.8922748566441265, 'bull_tsl_mult': 0.44471630324434985, 'bull_time_stop': 286, 'bull_use_sma': False, 'bull_use_ema': True, 'bull_use_atr': False, 'bull_use_adx': False, 'bull_use_spike': True, 'bull_rsi_required': True, 'bear_strategy': 'breakout', 'bear_bb_std_mult': 3.2166775890547723, 'bear_rsi_os': 52, 'bear_rsi_ob': 73, 'bear_adx_thresh': 5.276158526085, 'bear_atr_min_pct': 0.0034668502656718825, 'bear_atr_max_pct': 0.13688281141794867, 'bear_tp_mult': 2.897453986618013, 'bear_tsl_mult': 0.7489745752884133, 'bear_time_stop': 44, 'bear_use_sma': False, 'bear_use_ema': True, 'bear_use_atr': False, 'bear_use_adx': False, 'bear_use_spike': False, 'bear_rsi_required': False, 'sideways_strategy': 'breakout', 'sideways_bb_std_mult': 2.973268891842596, 'sideways_rsi_os': 24, 'sideways_rsi_ob': 95, 'sideways_adx_thresh': 12.232715882805385, 'sideways_atr_min_pct': 0.01542293116820809, 'sideways_atr_max_pct': 0.04325769984091638, 'sideways_tp_mult': 1.9024505901132267, 'sideways_tsl_mult': 0.36643594011358743, 'sideways_time_stop': 5, 'sideways_use_sma': False, 'sideways_use_ema': False, 'sideways_use_atr': True, 'sideways_use_adx': False, 'sideways_use_spike': True, 'sideways_rsi_required': True}.
[I 2025-08-31 11:24:32,324] Trial 694 finished with values: [-1000000000.0, 1000000000.0] and parameters: {'p_sma': 11, 'p_std': 32, 'p_atr': 11, 'p_adx': 23, 'rsi_period': 54, 'ema1': 6, 'ema2': 45, 'slip_atr_k': 0.03713050234088097, 'slip_spread_k': 0.15611308554152944, 'spread_hl_frac': 0.00625987069056308, 'bb_std_mult': 2.9548979273324503, 'rsi_os': 30, 'rsi_ob': 90, 'vol_spike': 0.28809845353998925, 'adx_thresh': 31.29466311047436, 'atr_min_pct': 0.012822334730647143, 'atr_max_pct': 0.14678702656200476, 'tp_mult': 1.7508299422299138, 'tsl_mult': 0.11353954401294503, 'strategy': 'breakout', 'time_stop': 197, 'use_sma': False, 'use_atr': False, 'use_adx': True, 'use_ema': True, 'use_spike': False, 'rsi_required': False, 'edge_k': 0.4531324134146101, 'edge_cap': 0.5192088817254562, 'bull_strategy': 'mean_reversion', 'bull_bb_std_mult': 0.5936045456610587, 'bull_rsi_os': 13, 'bull_rsi_ob': 84, 'bull_adx_thresh': 5.318100865826581, 'bull_atr_min_pct': 0.004811354953901433, 'bull_atr_max_pct': 0.09832915019668108, 'bull_tp_mult': 1.844603477978539, 'bull_tsl_mult': 0.4490046085884329, 'bull_time_stop': 295, 'bull_use_sma': False, 'bull_use_ema': True, 'bull_use_atr': False, 'bull_use_adx': True, 'bull_use_spike': False, 'bull_rsi_required': False, 'bear_strategy': 'mean_reversion', 'bear_bb_std_mult': 3.0211603755556418, 'bear_rsi_os': 51, 'bear_rsi_ob': 72, 'bear_adx_thresh': 5.661287868853088, 'bear_atr_min_pct': 0.0035904202560480608, 'bear_atr_max_pct': 0.13636184643820543, 'bear_tp_mult': 2.8306042856922997, 'bear_tsl_mult': 0.7123240645940215, 'bear_time_stop': 38, 'bear_use_sma': False, 'bear_use_ema': False, 'bear_use_atr': True, 'bear_use_adx': False, 'bear_use_spike': False, 'bear_rsi_required': True, 'sideways_strategy': 'breakout', 'sideways_bb_std_mult': 2.8899926138337575, 'sideways_rsi_os': 22, 'sideways_rsi_ob': 95, 'sideways_adx_thresh': 11.529935800892572, 'sideways_atr_min_pct': 0.01561770360019013, 'sideways_atr_max_pct': 0.11773343088480923, 'sideways_tp_mult': 1.8923310486179876, 'sideways_tsl_mult': 0.32021394329556463, 'sideways_time_stop': 6, 'sideways_use_sma': False, 'sideways_use_ema': False, 'sideways_use_atr': True, 'sideways_use_adx': False, 'sideways_use_spike': True, 'sideways_rsi_required': False}.
