[I 2025-08-31 10:58:13,292] Trial 496 finished with values: [-0.02638290694503287, 0.02618315898175893] and parameters: {'p_sma': 54, 'p_std': 28, 'p_atr': 11, 'p_adx': 21, 'rsi_period': 44, 'ema1': 13, 'ema2': 49, 'slip_atr_k': 0.24992312412919188, 'slip_spread_k': 0.6882427745578001, 'spread_hl_frac': 0.016708928162539483, 'bb_std_mult': 3.1426939530936764, 'rsi_os': 14, 'rsi_ob': 51, 'vol_spike': 0.2680839528846458, 'adx_thresh': 20.344694084830405, 'atr_min_pct': 0.006091589994511903, 'atr_max_pct': 0.10172330356643118, 'tp_mult': 1.4938304323863487, 'tsl_mult': 0.24238360233005588, 'strategy': 'breakout', 'time_stop': 82, 'use_sma': False, 'use_atr': False, 'use_adx': True, 'use_ema': True, 'use_spike': False, 'rsi_required': True, 'edge_k': 0.21696484954768502, 'edge_cap': 0.29573045257400116, 'bull_strategy': 'breakout', 'bull_bb_std_mult': 0.8460057254205091, 'bull_rsi_os': 12, 'bull_rsi_ob': 60, 'bull_adx_thresh': 20.997830564157624, 'bull_atr_min_pct': 0.018778684055735934, 'bull_atr_max_pct': 0.08828507676939437, 'bull_tp_mult': 2.370477116561091, 'bull_tsl_mult': 0.7519097867656706, 'bull_time_stop': 133, 'bull_use_sma': True, 'bull_use_ema': False, 'bull_use_atr': False, 'bull_use_adx': True, 'bull_use_spike': False, 'bull_rsi_required': True, 'bear_strategy': 'breakout', 'bear_bb_std_mult': 1.6733444343247754, 'bear_rsi_os': 40, 'bear_rsi_ob': 59, 'bear_adx_thresh': 7.140900144821893, 'bear_atr_min_pct': 0.018900801742183792, 'bear_atr_max_pct': 0.1319022850258763, 'bear_tp_mult': 2.3018571149529157, 'bear_tsl_mult': 0.430343282844612, 'bear_time_stop': 24, 'bear_use_sma': False, 'bear_use_ema': True, 'bear_use_atr': False, 'bear_use_adx': False, 'bear_use_spike': False, 'bear_rsi_required': False, 'sideways_strategy': 'mean_reversion', 'sideways_bb_std_mult': 2.7066077569363776, 'sideways_rsi_os': 6, 'sideways_rsi_ob': 66, 'sideways_adx_thresh': 15.866634189237631, 'sideways_atr_min_pct': 0.0021989593241552863, 'sideways_atr_max_pct': 0.0677743207851963, 'sideways_tp_mult': 1.9354170514965008, 'sideways_tsl_mult': 0.08455700558884052, 'sideways_time_stop': 12, 'sideways_use_sma': False, 'sideways_use_ema': False, 'sideways_use_atr': False, 'sideways_use_adx': False, 'sideways_use_spike': False, 'sideways_rsi_required': True}.
[I 2025-08-31 10:58:13,310] Trial 494 finished with values: [-0.04281331788138654, 0.04265320173795625] and parameters: {'p_sma': 38, 'p_std': 28, 'p_atr': 17, 'p_adx': 23, 'rsi_period': 42, 'ema1': 14, 'ema2': 57, 'slip_atr_k': 0.026841133227476107, 'slip_spread_k': 0.5907860770995219, 'spread_hl_frac': 0.03670129446454706, 'bb_std_mult': 2.6462376733653645, 'rsi_os': 46, 'rsi_ob': 95, 'vol_spike': 0.2563869036655233, 'adx_thresh': 29.049925192029665, 'atr_min_pct': 0.006232576015519709, 'atr_max_pct': 0.1354001275146811, 'tp_mult': 2.2217231506257975, 'tsl_mult': 0.23949538223466155, 'strategy': 'breakout', 'time_stop': 85, 'use_sma': False, 'use_atr': False, 'use_adx': True, 'use_ema': True, 'use_spike': False, 'rsi_required': True, 'edge_k': 0.21366402400212664, 'edge_cap': 0.7560182561125832, 'bull_strategy': 'breakout', 'bull_bb_std_mult': 3.0221278621393926, 'bull_rsi_os': 12, 'bull_rsi_ob': 90, 'bull_adx_thresh': 9.23057067806853, 'bull_atr_min_pct': 7.9659053571976e-05, 'bull_atr_max_pct': 0.07885495829392351, 'bull_tp_mult': 2.376184415998204, 'bull_tsl_mult': 0.809806712116072, 'bull_time_stop': 239, 'bull_use_sma': True, 'bull_use_ema': False, 'bull_use_atr': False, 'bull_use_adx': True, 'bull_use_spike': False, 'bull_rsi_required': True, 'bear_strategy': 'breakout', 'bear_bb_std_mult': 1.7195953501640389, 'bear_rsi_os': 41, 'bear_rsi_ob': 85, 'bear_adx_thresh': 27.68343487928307, 'bear_atr_min_pct': 0.022025502534800963, 'bear_atr_max_pct': 0.13694857769651492, 'bear_tp_mult': 2.797423995573259, 'bear_tsl_mult': 0.046648231953036134, 'bear_time_stop': 85, 'bear_use_sma': False, 'bear_use_ema': False, 'bear_use_atr': True, 'bear_use_adx': False, 'bear_use_spike': False, 'bear_rsi_required': True, 'sideways_strategy': 'mean_reversion', 'sideways_bb_std_mult': 2.6907581928615607, 'sideways_rsi_os': 5, 'sideways_rsi_ob': 71, 'sideways_adx_thresh': 26.594855420352634, 'sideways_atr_min_pct': 0.01794179835193828, 'sideways_atr_max_pct': 0.04050898310750785, 'sideways_tp_mult': 1.940944798403196, 'sideways_tsl_mult': 0.08236270218141327, 'sideways_time_stop': 214, 'sideways_use_sma': False, 'sideways_use_ema': False, 'sideways_use_atr': True, 'sideways_use_adx': False, 'sideways_use_spike': False, 'sideways_rsi_required': False}.
[I 2025-08-31 10:58:13,489] Trial 497 finished with values: [-1000000000.0, 1000000000.0] and parameters: {'p_sma': 20, 'p_std': 52, 'p_atr': 16, 'p_adx': 28, 'rsi_period': 51, 'ema1': 22, 'ema2': 56, 'slip_atr_k': 0.023452829225615764, 'slip_spread_k': 0.6850005852339118, 'spread_hl_frac': 0.027797551385813853, 'bb_std_mult': 2.739943433079862, 'rsi_os': 14, 'rsi_ob': 76, 'vol_spike': 0.054709277200586715, 'adx_thresh': 26.550397635916834, 'atr_min_pct': 0.026357611550633413, 'atr_max_pct': 0.07467023670995546, 'tp_mult': 2.273460901767967, 'tsl_mult': 0.10657132989652757, 'strategy': 'breakout', 'time_stop': 88, 'use_sma': True, 'use_atr': False, 'use_adx': True, 'use_ema': True, 'use_spike': True, 'rsi_required': True, 'edge_k': 0.5015335207576574, 'edge_cap': 0.48926628105112785, 'bull_strategy': 'breakout', 'bull_bb_std_mult': 0.8792406342888693, 'bull_rsi_os': 6, 'bull_rsi_ob': 75, 'bull_adx_thresh': 18.726425025007202, 'bull_atr_min_pct': 0.0049996131007268635, 'bull_atr_max_pct': 0.03664697413323073, 'bull_tp_mult': 2.8463687102291337, 'bull_tsl_mult': 0.07379268669743128, 'bull_time_stop': 72, 'bull_use_sma': True, 'bull_use_ema': False, 'bull_use_atr': False, 'bull_use_adx': False, 'bull_use_spike': False, 'bull_rsi_required': True, 'bear_strategy': 'breakout', 'bear_bb_std_mult': 1.871667220428868, 'bear_rsi_os': 40, 'bear_rsi_ob': 56, 'bear_adx_thresh': 7.056729511255918, 'bear_atr_min_pct': 0.006093834792026014, 'bear_atr_max_pct': 0.13211310081039548, 'bear_tp_mult': 2.890405462533593, 'bear_tsl_mult': 0.047419394651140145, 'bear_time_stop': 15, 'bear_use_sma': False, 'bear_use_ema': True, 'bear_use_atr': False, 'bear_use_adx': False, 'bear_use_spike': False, 'bear_rsi_required': False, 'sideways_strategy': 'mean_reversion', 'sideways_bb_std_mult': 1.490062309080841, 'sideways_rsi_os': 6, 'sideways_rsi_ob': 71, 'sideways_adx_thresh': 25.930271359578175, 'sideways_atr_min_pct': 0.018523471961276065, 'sideways_atr_max_pct': 0.04053018476016715, 'sideways_tp_mult': 2.335333270638964, 'sideways_tsl_mult': 0.09722697207461882, 'sideways_time_stop': 224, 'sideways_use_sma': False, 'sideways_use_ema': False, 'sideways_use_atr': False, 'sideways_use_adx': False, 'sideways_use_spike': False, 'sideways_rsi_required': True}.
[I 2025-08-31 10:58:46,507] Trial 498 finished with values: [-1000000000.0, 1000000000.0] and parameters: {'p_sma': 14, 'p_std': 26, 'p_atr': 11, 'p_adx': 20, 'rsi_period': 46, 'ema1': 23, 'ema2': 17, 'slip_atr_k': 0.02236370363203714, 'slip_spread_k': 0.6465382572729488, 'spread_hl_frac': 0.00914245326747587, 'bb_std_mult': 3.3211758626554495, 'rsi_os': 26, 'rsi_ob': 62, 'vol_spike': 0.1345916176302312, 'adx_thresh': 26.89616551327514, 'atr_min_pct': 0.004526916447933203, 'atr_max_pct': 0.06622270124009179, 'tp_mult': 2.3771036528628278, 'tsl_mult': 0.27254598700520044, 'strategy': 'breakout', 'time_stop': 135, 'use_sma': True, 'use_atr': False, 'use_adx': True, 'use_ema': False, 'use_spike': True, 'rsi_required': True, 'edge_k': 0.6812322767229291, 'edge_cap': 0.32763535050999176, 'bull_strategy': 'breakout', 'bull_bb_std_mult': 0.9145586652007768, 'bull_rsi_os': 35, 'bull_rsi_ob': 62, 'bull_adx_thresh': 18.452321257959802, 'bull_atr_min_pct': 0.017406104883188365, 'bull_atr_max_pct': 0.1018680890862266, 'bull_tp_mult': 2.9375685081555787, 'bull_tsl_mult': 0.9128873760974728, 'bull_time_stop': 62, 'bull_use_sma': True, 'bull_use_ema': False, 'bull_use_atr': False, 'bull_use_adx': False, 'bull_use_spike': False, 'bull_rsi_required': False, 'bear_strategy': 'mean_reversion', 'bear_bb_std_mult': 3.595766988900399, 'bear_rsi_os': 39, 'bear_rsi_ob': 77, 'bear_adx_thresh': 6.607289029773003, 'bear_atr_min_pct': 0.004308467341149536, 'bear_atr_max_pct': 0.09329074662580361, 'bear_tp_mult': 1.6434626919729305, 'bear_tsl_mult': 0.20951764942155016, 'bear_time_stop': 11, 'bear_use_sma': False, 'bear_use_ema': True, 'bear_use_atr': False, 'bear_use_adx': True, 'bear_use_spike': True, 'bear_rsi_required': False, 'sideways_strategy': 'mean_reversion', 'sideways_bb_std_mult': 3.371221330099825, 'sideways_rsi_os': 9, 'sideways_rsi_ob': 91, 'sideways_adx_thresh': 25.706669142633054, 'sideways_atr_min_pct': 0.027722148053833835, 'sideways_atr_max_pct': 0.01603205175122832, 'sideways_tp_mult': 2.460559468744477, 'sideways_tsl_mult': 0.042253398137418935, 'sideways_time_stop': 37, 'sideways_use_sma': False, 'sideways_use_ema': False, 'sideways_use_atr': False, 'sideways_use_adx': False, 'sideways_use_spike': False, 'sideways_rsi_required': True}.
[I 2025-08-31 10:58:46,654] Trial 500 finished with values: [-1000000000.0, 1000000000.0] and parameters: {'p_sma': 14, 'p_std': 26, 'p_atr': 11, 'p_adx': 20, 'rsi_period': 10, 'ema1': 23, 'ema2': 45, 'slip_atr_k': 0.01363544589034403, 'slip_spread_k': 0.6343526483997018, 'spread_hl_frac': 0.02760598937699369, 'bb_std_mult': 1.6000765747714067, 'rsi_os': 26, 'rsi_ob': 62, 'vol_spike': 0.13408459784857102, 'adx_thresh': 28.636658508654804, 'atr_min_pct': 0.004541127773273281, 'atr_max_pct': 0.09434746665894164, 'tp_mult': 2.3950299100571804, 'tsl_mult': 0.33691809942795525, 'strategy': 'breakout', 'time_stop': 21, 'use_sma': True, 'use_atr': False, 'use_adx': True, 'use_ema': False, 'use_spike': True, 'rsi_required': True, 'edge_k': 0.6728323225906379, 'edge_cap': 0.5172908380192314, 'bull_strategy': 'breakout', 'bull_bb_std_mult': 2.8289603762657873, 'bull_rsi_os': 15, 'bull_rsi_ob': 72, 'bull_adx_thresh': 7.150593419790139, 'bull_atr_min_pct': 0.009982164993583705, 'bull_atr_max_pct': 0.09323892821913295, 'bull_tp_mult': 2.9384139682286152, 'bull_tsl_mult': 0.36954813311476936, 'bull_time_stop': 72, 'bull_use_sma': True, 'bull_use_ema': False, 'bull_use_atr': False, 'bull_use_adx': False, 'bull_use_spike': False, 'bull_rsi_required': False, 'bear_strategy': 'mean_reversion', 'bear_bb_std_mult': 1.8454569535008245, 'bear_rsi_os': 39, 'bear_rsi_ob': 45, 'bear_adx_thresh': 20.712677571583654, 'bear_atr_min_pct': 0.0062550614073784904, 'bear_atr_max_pct': 0.013203429705204661, 'bear_tp_mult': 2.892958733897689, 'bear_tsl_mult': 0.49997392329409246, 'bear_time_stop': 199, 'bear_use_sma': False, 'bear_use_ema': True, 'bear_use_atr': False, 'bear_use_adx': True, 'bear_use_spike': True, 'bear_rsi_required': False, 'sideways_strategy': 'mean_reversion', 'sideways_bb_std_mult': 2.881738119116646, 'sideways_rsi_os': 9, 'sideways_rsi_ob': 92, 'sideways_adx_thresh': 25.793560268852755, 'sideways_atr_min_pct': 0.02847129172978307, 'sideways_atr_max_pct': 0.05100045553929941, 'sideways_tp_mult': 2.895841388602947, 'sideways_tsl_mult': 0.10322689182178936, 'sideways_time_stop': 22, 'sideways_use_sma': False, 'sideways_use_ema': False, 'sideways_use_atr': False, 'sideways_use_adx': False, 'sideways_use_spike': False, 'sideways_rsi_required': True}.
[I 2025-08-31 10:58:46,929] Trial 499 finished with values: [-1000000000.0, 1000000000.0] and parameters: {'p_sma': 14, 'p_std': 26, 'p_atr': 11, 'p_adx': 13, 'rsi_period': 46, 'ema1': 15, 'ema2': 56, 'slip_atr_k': 0.022901448202972713, 'slip_spread_k': 0.6378963836454472, 'spread_hl_frac': 0.01228788890184098, 'bb_std_mult': 1.3154622100530142, 'rsi_os': 16, 'rsi_ob': 81, 'vol_spike': 0.23057296820093381, 'adx_thresh': 26.744849292562513, 'atr_min_pct': 0.0045551398521347635, 'atr_max_pct': 0.09301700596778364, 'tp_mult': 2.3835591962547755, 'tsl_mult': 0.2633739490159748, 'strategy': 'breakout', 'time_stop': 75, 'use_sma': True, 'use_atr': False, 'use_adx': True, 'use_ema': False, 'use_spike': True, 'rsi_required': True, 'edge_k': 0.6093540289259887, 'edge_cap': 0.42926085652947704, 'bull_strategy': 'breakout', 'bull_bb_std_mult': 0.9259392610027328, 'bull_rsi_os': 15, 'bull_rsi_ob': 55, 'bull_adx_thresh': 7.27872483419287, 'bull_atr_min_pct': 0.01449300519221293, 'bull_atr_max_pct': 0.08259293825147057, 'bull_tp_mult': 1.7970057019840386, 'bull_tsl_mult': 0.3660961237698351, 'bull_time_stop': 209, 'bull_use_sma': True, 'bull_use_ema': False, 'bull_use_atr': False, 'bull_use_adx': False, 'bull_use_spike': False, 'bull_rsi_required': False, 'bear_strategy': 'mean_reversion', 'bear_bb_std_mult': 3.19782902684246, 'bear_rsi_os': 32, 'bear_rsi_ob': 77, 'bear_adx_thresh': 9.033071024776453, 'bear_atr_min_pct': 0.005992357908996154, 'bear_atr_max_pct': 0.14122568033482275, 'bear_tp_mult': 1.3144876676112036, 'bear_tsl_mult': 0.49551460945595954, 'bear_time_stop': 196, 'bear_use_sma': False, 'bear_use_ema': True, 'bear_use_atr': False, 'bear_use_adx': True, 'bear_use_spike': True, 'bear_rsi_required': False, 'sideways_strategy': 'mean_reversion', 'sideways_bb_std_mult': 3.388235676505269, 'sideways_rsi_os': 9, 'sideways_rsi_ob': 46, 'sideways_adx_thresh': 25.819657546653296, 'sideways_atr_min_pct': 0.026095124786610732, 'sideways_atr_max_pct': 0.04065511272466697, 'sideways_tp_mult': 1.8320667882714667, 'sideways_tsl_mult': 0.04026497086868974, 'sideways_time_stop': 22, 'sideways_use_sma': False, 'sideways_use_ema': False, 'sideways_use_atr': False, 'sideways_use_adx': False, 'sideways_use_spike': False, 'sideways_rsi_required': True}.
[I 2025-08-31 10:58:46,929] Trial 501 finished with values: [-1000000000.0, 1000000000.0] and parameters: {'p_sma': 14, 'p_std': 26, 'p_atr': 11, 'p_adx': 13, 'rsi_period': 39, 'ema1': 13, 'ema2': 54, 'slip_atr_k': 0.01447511276566221, 'slip_spread_k': 0.6398321935462626, 'spread_hl_frac': 0.00875771664712109, 'bb_std_mult': 3.312537081106498, 'rsi_os': 6, 'rsi_ob': 81, 'vol_spike': 0.11312727672181143, 'adx_thresh': 28.719142257165068, 'atr_min_pct': 0.004504891352168996, 'atr_max_pct': 0.09351281000310185, 'tp_mult': 2.405794676756706, 'tsl_mult': 0.2651521362272408, 'strategy': 'breakout', 'time_stop': 109, 'use_sma': True, 'use_atr': False, 'use_adx': True, 'use_ema': False, 'use_spike': True, 'rsi_required': True, 'edge_k': 1.585754118303584, 'edge_cap': 0.4322752289167008, 'bull_strategy': 'breakout', 'bull_bb_std_mult': 1.2928817506020276, 'bull_rsi_os': 19, 'bull_rsi_ob': 51, 'bull_adx_thresh': 34.92591567787831, 'bull_atr_min_pct': 0.017289557774414103, 'bull_atr_max_pct': 0.10141457477161563, 'bull_tp_mult': 1.7933487019627952, 'bull_tsl_mult': 0.3676078280734707, 'bull_time_stop': 204, 'bull_use_sma': True, 'bull_use_ema': False, 'bull_use_atr': False, 'bull_use_adx': False, 'bull_use_spike': False, 'bull_rsi_required': False, 'bear_strategy': 'mean_reversion', 'bear_bb_std_mult': 2.3488736701971713, 'bear_rsi_os': 38, 'bear_rsi_ob': 45, 'bear_adx_thresh': 20.598359974670892, 'bear_atr_min_pct': 0.004307738763813631, 'bear_atr_max_pct': 0.12386502828913139, 'bear_tp_mult': 2.616143317289532, 'bear_tsl_mult': 0.49315507015589444, 'bear_time_stop': 32, 'bear_use_sma': False, 'bear_use_ema': True, 'bear_use_atr': False, 'bear_use_adx': True, 'bear_use_spike': True, 'bear_rsi_required': False, 'sideways_strategy': 'mean_reversion', 'sideways_bb_std_mult': 2.63502700298911, 'sideways_rsi_os': 7, 'sideways_rsi_ob': 55, 'sideways_adx_thresh': 20.520675221639113, 'sideways_atr_min_pct': 0.026232309844532294, 'sideways_atr_max_pct': 0.050755527738024095, 'sideways_tp_mult': 1.835817822001406, 'sideways_tsl_mult': 0.049797653097348855, 'sideways_time_stop': 22, 'sideways_use_sma': False, 'sideways_use_ema': False, 'sideways_use_atr': False, 'sideways_use_adx': False, 'sideways_use_spike': False, 'sideways_rsi_required': True}.
[I 2025-08-31 10:58:47,643] Trial 505 finished with values: [-1000000000.0, 1000000000.0] and parameters: {'p_sma': 16, 'p_std': 34, 'p_atr': 12, 'p_adx': 11, 'rsi_period': 59, 'ema1': 25, 'ema2': 55, 'slip_atr_k': 0.15462462760963977, 'slip_spread_k': 0.6614751825843136, 'spread_hl_frac': 0.010595506381748405, 'bb_std_mult': 2.5758910264285966, 'rsi_os': 41, 'rsi_ob': 46, 'vol_spike': 0.1992819047217317, 'adx_thresh': 5.0752984761987125, 'atr_min_pct': 0.005426126054821035, 'atr_max_pct': 0.09989036161589188, 'tp_mult': 2.462995803468051, 'tsl_mult': 0.9790645148539192, 'strategy': 'mean_reversion', 'time_stop': 63, 'use_sma': True, 'use_atr': False, 'use_adx': True, 'use_ema': True, 'use_spike': True, 'rsi_required': True, 'edge_k': 0.15213642184236542, 'edge_cap': 0.46711032901727206, 'bull_strategy': 'breakout', 'bull_bb_std_mult': 0.6503924409507917, 'bull_rsi_os': 26, 'bull_rsi_ob': 74, 'bull_adx_thresh': 21.80243202641759, 'bull_atr_min_pct': 0.006025803817595616, 'bull_atr_max_pct': 0.09982096508682914, 'bull_tp_mult': 1.9059779440485487, 'bull_tsl_mult': 0.4748669092144735, 'bull_time_stop': 282, 'bull_use_sma': False, 'bull_use_ema': False, 'bull_use_atr': False, 'bull_use_adx': False, 'bull_use_spike': False, 'bull_rsi_required': True, 'bear_strategy': 'breakout', 'bear_bb_std_mult': 2.2111015702095216, 'bear_rsi_os': 30, 'bear_rsi_ob': 48, 'bear_adx_thresh': 7.788772260506545, 'bear_atr_min_pct': 0.0200718272102363, 'bear_atr_max_pct': 0.09597670620542999, 'bear_tp_mult': 2.811057978323954, 'bear_tsl_mult': 0.8100946320190964, 'bear_time_stop': 260, 'bear_use_sma': False, 'bear_use_ema': False, 'bear_use_atr': True, 'bear_use_adx': False, 'bear_use_spike': True, 'bear_rsi_required': True, 'sideways_strategy': 'mean_reversion', 'sideways_bb_std_mult': 2.7653719230831886, 'sideways_rsi_os': 48, 'sideways_rsi_ob': 94, 'sideways_adx_thresh': 24.89738777251317, 'sideways_atr_min_pct': 0.016777937109524108, 'sideways_atr_max_pct': 0.08439403197447037, 'sideways_tp_mult': 1.9948752047557683, 'sideways_tsl_mult': 0.6665304098254231, 'sideways_time_stop': 29, 'sideways_use_sma': True, 'sideways_use_ema': True, 'sideways_use_atr': True, 'sideways_use_adx': False, 'sideways_use_spike': False, 'sideways_rsi_required': True}.
[I 2025-08-31 10:59:17,101] Trial 502 finished with values: [-1000000000.0, 1000000000.0] and parameters: {'p_sma': 16, 'p_std': 29, 'p_atr': 12, 'p_adx': 22, 'rsi_period': 10, 'ema1': 25, 'ema2': 45, 'slip_atr_k': 0.015778894654473907, 'slip_spread_k': 0.6312127316504913, 'spread_hl_frac': 0.010523494535319342, 'bb_std_mult': 2.5901878584852103, 'rsi_os': 26, 'rsi_ob': 80, 'vol_spike': 0.20053001673096144, 'adx_thresh': 28.739654769570937, 'atr_min_pct': 0.00526608441457992, 'atr_max_pct': 0.09498792454717762, 'tp_mult': 2.3988768025268374, 'tsl_mult': 0.25162830657487195, 'strategy': 'breakout', 'time_stop': 71, 'use_sma': True, 'use_atr': False, 'use_adx': True, 'use_ema': False, 'use_spike': True, 'rsi_required': True, 'edge_k': 0.15058031261669375, 'edge_cap': 0.4307706463131436, 'bull_strategy': 'breakout', 'bull_bb_std_mult': 3.17347978040302, 'bull_rsi_os': 18, 'bull_rsi_ob': 71, 'bull_adx_thresh': 7.228543282809683, 'bull_atr_min_pct': 0.029591926532603195, 'bull_atr_max_pct': 0.10874552924986661, 'bull_tp_mult': 1.7998630961398365, 'bull_tsl_mult': 0.3644499079231067, 'bull_time_stop': 53, 'bull_use_sma': True, 'bull_use_ema': False, 'bull_use_atr': False, 'bull_use_adx': False, 'bull_use_spike': False, 'bull_rsi_required': True, 'bear_strategy': 'breakout', 'bear_bb_std_mult': 2.6920956625689954, 'bear_rsi_os': 30, 'bear_rsi_ob': 94, 'bear_adx_thresh': 8.923072169274791, 'bear_atr_min_pct': 0.006230993613028181, 'bear_atr_max_pct': 0.12333441854032068, 'bear_tp_mult': 1.7041223599578226, 'bear_tsl_mult': 0.49460879856479173, 'bear_time_stop': 132, 'bear_use_sma': False, 'bear_use_ema': False, 'bear_use_atr': True, 'bear_use_adx': True, 'bear_use_spike': True, 'bear_rsi_required': True, 'sideways_strategy': 'mean_reversion', 'sideways_bb_std_mult': 2.0232925654894744, 'sideways_rsi_os': 7, 'sideways_rsi_ob': 92, 'sideways_adx_thresh': 28.17359721567311, 'sideways_atr_min_pct': 0.026121646063300773, 'sideways_atr_max_pct': 0.037062262659043894, 'sideways_tp_mult': 1.8431170170961972, 'sideways_tsl_mult': 0.270457211670325, 'sideways_time_stop': 262, 'sideways_use_sma': False, 'sideways_use_ema': False, 'sideways_use_atr': True, 'sideways_use_adx': False, 'sideways_use_spike': False, 'sideways_rsi_required': True}.
