[I 2025-08-31 10:28:37,399] Trial 261 finished with values: [-0.017757657728233456, 0.01753963651924991] and parameters: {'p_sma': 41, 'p_std': 26, 'p_atr': 30, 'p_adx': 17, 'rsi_period': 10, 'ema1': 14, 'ema2': 57, 'slip_atr_k': 0.00872219395637161, 'slip_spread_k': 0.644564895941419, 'spread_hl_frac': 0.012775558702392702, 'bb_std_mult': 0.6312936433269576, 'rsi_os': 29, 'rsi_ob': 87, 'vol_spike': 0.06337668748895235, 'adx_thresh': 32.99715754351992, 'atr_min_pct': 0.00995626810017625, 'atr_max_pct': 0.09705910944761982, 'tp_mult': 2.3825830069823746, 'tsl_mult': 0.57946150459103, 'strategy': 'breakout', 'time_stop': 207, 'use_sma': True, 'use_atr': False, 'use_adx': True, 'use_ema': True, 'use_spike': True, 'rsi_required': False, 'edge_k': 0.5979383362674218, 'edge_cap': 0.8866371266713718, 'bull_strategy': 'breakout', 'bull_bb_std_mult': 0.8282776402075906, 'bull_rsi_os': 39, 'bull_rsi_ob': 73, 'bull_adx_thresh': 16.995688931468344, 'bull_atr_min_pct': 0.002474452207988526, 'bull_atr_max_pct': 0.1438100703003944, 'bull_tp_mult': 2.470543237830582, 'bull_tsl_mult': 0.6063019499354312, 'bull_time_stop': 78, 'bull_use_sma': True, 'bull_use_ema': True, 'bull_use_atr': True, 'bull_use_adx': False, 'bull_use_spike': True, 'bull_rsi_required': True, 'bear_strategy': 'breakout', 'bear_bb_std_mult': 3.4030936181771887, 'bear_rsi_os': 27, 'bear_rsi_ob': 71, 'bear_adx_thresh': 15.27870704909887, 'bear_atr_min_pct': 0.005543674601110493, 'bear_atr_max_pct': 0.07899266296747916, 'bear_tp_mult': 2.262447040262739, 'bear_tsl_mult': 0.42858343896784235, 'bear_time_stop': 40, 'bear_use_sma': False, 'bear_use_ema': True, 'bear_use_atr': False, 'bear_use_adx': False, 'bear_use_spike': True, 'bear_rsi_required': False, 'sideways_strategy': 'breakout', 'sideways_bb_std_mult': 2.8173287051453126, 'sideways_rsi_os': 43, 'sideways_rsi_ob': 81, 'sideways_adx_thresh': 24.630826095534445, 'sideways_atr_min_pct': 0.02901447774872133, 'sideways_atr_max_pct': 0.035777282882219145, 'sideways_tp_mult': 2.3930148474929975, 'sideways_tsl_mult': 0.3794184691599008, 'sideways_time_stop': 129, 'sideways_use_sma': False, 'sideways_use_ema': False, 'sideways_use_atr': False, 'sideways_use_adx': False, 'sideways_use_spike': True, 'sideways_rsi_required': True}.
[I 2025-08-31 10:28:37,887] Trial 264 finished with values: [-1000000000.0, 1000000000.0] and parameters: {'p_sma': 10, 'p_std': 27, 'p_atr': 28, 'p_adx': 18, 'rsi_period': 31, 'ema1': 29, 'ema2': 30, 'slip_atr_k': 0.03075099366840364, 'slip_spread_k': 0.32755121230429746, 'spread_hl_frac': 0.010828791790459268, 'bb_std_mult': 0.7914163122699008, 'rsi_os': 39, 'rsi_ob': 88, 'vol_spike': 0.26986247919698797, 'adx_thresh': 29.559240317488698, 'atr_min_pct': 0.00460802897383847, 'atr_max_pct': 0.09190245990540519, 'tp_mult': 1.5360956461051285, 'tsl_mult': 0.21592937597506956, 'strategy': 'breakout', 'time_stop': 108, 'use_sma': True, 'use_atr': True, 'use_adx': False, 'use_ema': True, 'use_spike': True, 'rsi_required': False, 'edge_k': 0.1912505511760188, 'edge_cap': 0.8909772767661558, 'bull_strategy': 'breakout', 'bull_bb_std_mult': 3.5399831848103114, 'bull_rsi_os': 55, 'bull_rsi_ob': 73, 'bull_adx_thresh': 24.16381367461823, 'bull_atr_min_pct': 0.0018992683092363249, 'bull_atr_max_pct': 0.029723364184455453, 'bull_tp_mult': 1.7407727293812982, 'bull_tsl_mult': 0.42374487960851664, 'bull_time_stop': 78, 'bull_use_sma': True, 'bull_use_ema': True, 'bull_use_atr': True, 'bull_use_adx': False, 'bull_use_spike': True, 'bull_rsi_required': True, 'bear_strategy': 'breakout', 'bear_bb_std_mult': 1.1478519393681876, 'bear_rsi_os': 25, 'bear_rsi_ob': 70, 'bear_adx_thresh': 16.077285310399876, 'bear_atr_min_pct': 0.0034476546629021417, 'bear_atr_max_pct': 0.07678340265078719, 'bear_tp_mult': 2.6871665231485893, 'bear_tsl_mult': 0.606853865668663, 'bear_time_stop': 40, 'bear_use_sma': False, 'bear_use_ema': True, 'bear_use_atr': False, 'bear_use_adx': False, 'bear_use_spike': True, 'bear_rsi_required': False, 'sideways_strategy': 'breakout', 'sideways_bb_std_mult': 2.734424464985619, 'sideways_rsi_os': 26, 'sideways_rsi_ob': 81, 'sideways_adx_thresh': 23.879112687401, 'sideways_atr_min_pct': 0.029014551562267888, 'sideways_atr_max_pct': 0.03721146160112176, 'sideways_tp_mult': 1.0494680713895996, 'sideways_tsl_mult': 0.41107963466162334, 'sideways_time_stop': 43, 'sideways_use_sma': False, 'sideways_use_ema': False, 'sideways_use_atr': False, 'sideways_use_adx': False, 'sideways_use_spike': True, 'sideways_rsi_required': True}.
[I 2025-08-31 10:28:38,085] Trial 262 finished with values: [-1000000000.0, 1000000000.0] and parameters: {'p_sma': 19, 'p_std': 27, 'p_atr': 29, 'p_adx': 17, 'rsi_period': 48, 'ema1': 19, 'ema2': 56, 'slip_atr_k': 0.1610941063940613, 'slip_spread_k': 0.18266204121119778, 'spread_hl_frac': 0.03611754499534428, 'bb_std_mult': 0.7830843006491748, 'rsi_os': 25, 'rsi_ob': 88, 'vol_spike': 0.27090866273003944, 'adx_thresh': 29.012650011855605, 'atr_min_pct': 0.025117407783479748, 'atr_max_pct': 0.09224560593555256, 'tp_mult': 2.3748035151266844, 'tsl_mult': 0.17631257862914407, 'strategy': 'breakout', 'time_stop': 32, 'use_sma': True, 'use_atr': False, 'use_adx': True, 'use_ema': True, 'use_spike': True, 'rsi_required': False, 'edge_k': 0.19022767348082592, 'edge_cap': 0.7822572762053512, 'bull_strategy': 'breakout', 'bull_bb_std_mult': 0.7068316439072113, 'bull_rsi_os': 42, 'bull_rsi_ob': 73, 'bull_adx_thresh': 24.832365495117177, 'bull_atr_min_pct': 0.0022147229214618987, 'bull_atr_max_pct': 0.14319008047429355, 'bull_tp_mult': 2.4782412486588106, 'bull_tsl_mult': 0.599046558134411, 'bull_time_stop': 93, 'bull_use_sma': True, 'bull_use_ema': True, 'bull_use_atr': True, 'bull_use_adx': False, 'bull_use_spike': True, 'bull_rsi_required': True, 'bear_strategy': 'breakout', 'bear_bb_std_mult': 1.1604213944054955, 'bear_rsi_os': 35, 'bear_rsi_ob': 60, 'bear_adx_thresh': 22.051685951020442, 'bear_atr_min_pct': 0.0048331828161137244, 'bear_atr_max_pct': 0.07974301003977546, 'bear_tp_mult': 2.4717892567455766, 'bear_tsl_mult': 0.5098161608968408, 'bear_time_stop': 40, 'bear_use_sma': False, 'bear_use_ema': True, 'bear_use_atr': False, 'bear_use_adx': False, 'bear_use_spike': True, 'bear_rsi_required': False, 'sideways_strategy': 'breakout', 'sideways_bb_std_mult': 3.5501134343102754, 'sideways_rsi_os': 43, 'sideways_rsi_ob': 76, 'sideways_adx_thresh': 24.660654953875166, 'sideways_atr_min_pct': 0.024421524089392507, 'sideways_atr_max_pct': 0.03530753984967828, 'sideways_tp_mult': 1.9428549302399887, 'sideways_tsl_mult': 0.015448751716030482, 'sideways_time_stop': 43, 'sideways_use_sma': False, 'sideways_use_ema': False, 'sideways_use_atr': False, 'sideways_use_adx': False, 'sideways_use_spike': True, 'sideways_rsi_required': True}.
[I 2025-08-31 10:28:38,217] Trial 263 finished with values: [-1000000000.0, 1000000000.0] and parameters: {'p_sma': 18, 'p_std': 27, 'p_atr': 16, 'p_adx': 18, 'rsi_period': 48, 'ema1': 14, 'ema2': 57, 'slip_atr_k': 0.026304278284401333, 'slip_spread_k': 0.06194448999760638, 'spread_hl_frac': 0.012213195796549496, 'bb_std_mult': 0.782350297858758, 'rsi_os': 25, 'rsi_ob': 74, 'vol_spike': 0.19651385969304697, 'adx_thresh': 29.56226653158486, 'atr_min_pct': 0.011238404986429217, 'atr_max_pct': 0.09225090017434232, 'tp_mult': 2.3684992031268717, 'tsl_mult': 0.5739030076026974, 'strategy': 'breakout', 'time_stop': 208, 'use_sma': True, 'use_atr': True, 'use_adx': False, 'use_ema': True, 'use_spike': True, 'rsi_required': False, 'edge_k': 0.18452613529432976, 'edge_cap': 0.7839403120273514, 'bull_strategy': 'breakout', 'bull_bb_std_mult': 0.8290584253344473, 'bull_rsi_os': 37, 'bull_rsi_ob': 71, 'bull_adx_thresh': 17.067714287461552, 'bull_atr_min_pct': 0.002065586080069827, 'bull_atr_max_pct': 0.1499587178122145, 'bull_tp_mult': 2.053799820550755, 'bull_tsl_mult': 0.06658247733962269, 'bull_time_stop': 78, 'bull_use_sma': True, 'bull_use_ema': True, 'bull_use_atr': True, 'bull_use_adx': False, 'bull_use_spike': True, 'bull_rsi_required': True, 'bear_strategy': 'breakout', 'bear_bb_std_mult': 2.6647598541264257, 'bear_rsi_os': 25, 'bear_rsi_ob': 88, 'bear_adx_thresh': 15.182457349713422, 'bear_atr_min_pct': 0.007516010209119548, 'bear_atr_max_pct': 0.07670290555902723, 'bear_tp_mult': 1.8668095180732809, 'bear_tsl_mult': 0.5781727538977974, 'bear_time_stop': 41, 'bear_use_sma': False, 'bear_use_ema': True, 'bear_use_atr': False, 'bear_use_adx': False, 'bear_use_spike': True, 'bear_rsi_required': False, 'sideways_strategy': 'breakout', 'sideways_bb_std_mult': 2.744785451086129, 'sideways_rsi_os': 42, 'sideways_rsi_ob': 63, 'sideways_adx_thresh': 24.011265822848824, 'sideways_atr_min_pct': 0.005446294441851806, 'sideways_atr_max_pct': 0.03843028126031091, 'sideways_tp_mult': 1.1149582993892668, 'sideways_tsl_mult': 0.0216650762930109, 'sideways_time_stop': 46, 'sideways_use_sma': False, 'sideways_use_ema': False, 'sideways_use_atr': False, 'sideways_use_adx': False, 'sideways_use_spike': True, 'sideways_rsi_required': True}.
[I 2025-08-31 10:29:10,290] Trial 268 finished with values: [-1000000000.0, 1000000000.0] and parameters: {'p_sma': 40, 'p_std': 26, 'p_atr': 30, 'p_adx': 7, 'rsi_period': 40, 'ema1': 17, 'ema2': 35, 'slip_atr_k': 0.19970252305158415, 'slip_spread_k': 0.647620915670415, 'spread_hl_frac': 0.014167667219421181, 'bb_std_mult': 0.8574592907901968, 'rsi_os': 30, 'rsi_ob': 75, 'vol_spike': 0.2685767511410569, 'adx_thresh': 16.094757903005267, 'atr_min_pct': 0.007513100615347296, 'atr_max_pct': 0.09373025310158525, 'tp_mult': 2.490353216873326, 'tsl_mult': 0.6356125847707474, 'strategy': 'mean_reversion', 'time_stop': 231, 'use_sma': True, 'use_atr': True, 'use_adx': False, 'use_ema': True, 'use_spike': False, 'rsi_required': False, 'edge_k': 1.3991011248633094, 'edge_cap': 0.0637376349161693, 'bull_strategy': 'mean_reversion', 'bull_bb_std_mult': 1.620980420407612, 'bull_rsi_os': 40, 'bull_rsi_ob': 72, 'bull_adx_thresh': 26.787099519617485, 'bull_atr_min_pct': 0.0015162380734703995, 'bull_atr_max_pct': 0.14529418082761186, 'bull_tp_mult': 2.3951459071524366, 'bull_tsl_mult': 0.4575640971494048, 'bull_time_stop': 82, 'bull_use_sma': False, 'bull_use_ema': True, 'bull_use_atr': True, 'bull_use_adx': True, 'bull_use_spike': False, 'bull_rsi_required': False, 'bear_strategy': 'mean_reversion', 'bear_bb_std_mult': 1.4224943803085892, 'bear_rsi_os': 22, 'bear_rsi_ob': 61, 'bear_adx_thresh': 30.266597578713387, 'bear_atr_min_pct': 0.004038032309171934, 'bear_atr_max_pct': 0.12354437436445503, 'bear_tp_mult': 1.1398731714604395, 'bear_tsl_mult': 0.5550612262037342, 'bear_time_stop': 273, 'bear_use_sma': True, 'bear_use_ema': True, 'bear_use_atr': True, 'bear_use_adx': False, 'bear_use_spike': False, 'bear_rsi_required': False, 'sideways_strategy': 'breakout', 'sideways_bb_std_mult': 2.695098530626591, 'sideways_rsi_os': 16, 'sideways_rsi_ob': 82, 'sideways_adx_thresh': 25.14719772130747, 'sideways_atr_min_pct': 0.004585188180010953, 'sideways_atr_max_pct': 0.03874476881698299, 'sideways_tp_mult': 1.9653472094944775, 'sideways_tsl_mult': 0.22514851463559465, 'sideways_time_stop': 119, 'sideways_use_sma': True, 'sideways_use_ema': False, 'sideways_use_atr': True, 'sideways_use_adx': True, 'sideways_use_spike': False, 'sideways_rsi_required': True}.
[I 2025-08-31 10:29:10,721] Trial 267 finished with values: [-1000000000.0, 1000000000.0] and parameters: {'p_sma': 18, 'p_std': 26, 'p_atr': 30, 'p_adx': 7, 'rsi_period': 40, 'ema1': 17, 'ema2': 57, 'slip_atr_k': 0.02482929173021207, 'slip_spread_k': 0.6383758837872406, 'spread_hl_frac': 0.012687294517708291, 'bb_std_mult': 1.5790873261365133, 'rsi_os': 30, 'rsi_ob': 76, 'vol_spike': 0.19664959460604953, 'adx_thresh': 11.234185900184368, 'atr_min_pct': 0.018329329915711172, 'atr_max_pct': 0.09267133055383074, 'tp_mult': 2.497168721658436, 'tsl_mult': 0.6456546874597957, 'strategy': 'mean_reversion', 'time_stop': 221, 'use_sma': True, 'use_atr': True, 'use_adx': False, 'use_ema': True, 'use_spike': False, 'rsi_required': False, 'edge_k': 0.10859705000228834, 'edge_cap': 0.06544272091712544, 'bull_strategy': 'mean_reversion', 'bull_bb_std_mult': 0.8382019899307384, 'bull_rsi_os': 44, 'bull_rsi_ob': 72, 'bull_adx_thresh': 24.12237111217577, 'bull_atr_min_pct': 0.0014488749280702168, 'bull_atr_max_pct': 0.1458881394495387, 'bull_tp_mult': 1.9732102561296858, 'bull_tsl_mult': 0.10788063721022068, 'bull_time_stop': 78, 'bull_use_sma': False, 'bull_use_ema': True, 'bull_use_atr': True, 'bull_use_adx': True, 'bull_use_spike': False, 'bull_rsi_required': True, 'bear_strategy': 'breakout', 'bear_bb_std_mult': 0.8656319228509599, 'bear_rsi_os': 27, 'bear_rsi_ob': 62, 'bear_adx_thresh': 15.436944867037013, 'bear_atr_min_pct': 0.007361837342103047, 'bear_atr_max_pct': 0.12290689570913697, 'bear_tp_mult': 2.573726951754609, 'bear_tsl_mult': 0.4218870156701007, 'bear_time_stop': 271, 'bear_use_sma': True, 'bear_use_ema': True, 'bear_use_atr': False, 'bear_use_adx': False, 'bear_use_spike': False, 'bear_rsi_required': False, 'sideways_strategy': 'breakout', 'sideways_bb_std_mult': 2.7289514022773926, 'sideways_rsi_os': 16, 'sideways_rsi_ob': 63, 'sideways_adx_thresh': 29.69503701167431, 'sideways_atr_min_pct': 0.0007513327041522994, 'sideways_atr_max_pct': 0.038625133462269735, 'sideways_tp_mult': 1.9574873413877514, 'sideways_tsl_mult': 0.17597968367390518, 'sideways_time_stop': 29, 'sideways_use_sma': True, 'sideways_use_ema': False, 'sideways_use_atr': True, 'sideways_use_adx': True, 'sideways_use_spike': True, 'sideways_rsi_required': True}.
[I 2025-08-31 10:29:10,830] Trial 266 finished with values: [-1000000000.0, 1000000000.0] and parameters: {'p_sma': 18, 'p_std': 26, 'p_atr': 30, 'p_adx': 17, 'rsi_period': 44, 'ema1': 17, 'ema2': 57, 'slip_atr_k': 0.08297685852429126, 'slip_spread_k': 0.6415068773894467, 'spread_hl_frac': 0.010114506666193563, 'bb_std_mult': 0.8532719957050261, 'rsi_os': 30, 'rsi_ob': 76, 'vol_spike': 0.24955383535981124, 'adx_thresh': 22.641403950481557, 'atr_min_pct': 0.011337424375325554, 'atr_max_pct': 0.09268679141443702, 'tp_mult': 2.3681254109404124, 'tsl_mult': 0.6462000154931923, 'strategy': 'mean_reversion', 'time_stop': 222, 'use_sma': True, 'use_atr': False, 'use_adx': True, 'use_ema': True, 'use_spike': False, 'rsi_required': False, 'edge_k': 0.13901291422405557, 'edge_cap': 0.7901247582999884, 'bull_strategy': 'mean_reversion', 'bull_bb_std_mult': 0.830106670877437, 'bull_rsi_os': 52, 'bull_rsi_ob': 72, 'bull_adx_thresh': 24.83297977193738, 'bull_atr_min_pct': 0.0016345273706307958, 'bull_atr_max_pct': 0.1457235868354729, 'bull_tp_mult': 1.120301338774221, 'bull_tsl_mult': 0.20946791558628752, 'bull_time_stop': 78, 'bull_use_sma': False, 'bull_use_ema': True, 'bull_use_atr': True, 'bull_use_adx': False, 'bull_use_spike': False, 'bull_rsi_required': True, 'bear_strategy': 'breakout', 'bear_bb_std_mult': 2.4570554153015074, 'bear_rsi_os': 37, 'bear_rsi_ob': 59, 'bear_adx_thresh': 31.101477220779195, 'bear_atr_min_pct': 0.0048592851603954336, 'bear_atr_max_pct': 0.012998390220401557, 'bear_tp_mult': 2.5809410059255393, 'bear_tsl_mult': 0.5691525823682697, 'bear_time_stop': 64, 'bear_use_sma': False, 'bear_use_ema': True, 'bear_use_atr': False, 'bear_use_adx': False, 'bear_use_spike': True, 'bear_rsi_required': False, 'sideways_strategy': 'breakout', 'sideways_bb_std_mult': 2.7422030735386844, 'sideways_rsi_os': 39, 'sideways_rsi_ob': 83, 'sideways_adx_thresh': 5.593093606859483, 'sideways_atr_min_pct': 0.005464211903907023, 'sideways_atr_max_pct': 0.038532345089771505, 'sideways_tp_mult': 1.9496158401601384, 'sideways_tsl_mult': 0.8691107014140989, 'sideways_time_stop': 128, 'sideways_use_sma': True, 'sideways_use_ema': False, 'sideways_use_atr': False, 'sideways_use_adx': True, 'sideways_use_spike': True, 'sideways_rsi_required': True}.
[I 2025-08-31 10:29:11,051] Trial 265 finished with values: [-1000000000.0, 1000000000.0] and parameters: {'p_sma': 18, 'p_std': 27, 'p_atr': 22, 'p_adx': 17, 'rsi_period': 48, 'ema1': 17, 'ema2': 57, 'slip_atr_k': 0.08274128744786369, 'slip_spread_k': 0.06755435396304688, 'spread_hl_frac': 0.012470057094057197, 'bb_std_mult': 1.8305242244504871, 'rsi_os': 26, 'rsi_ob': 88, 'vol_spike': 0.26879165778867986, 'adx_thresh': 29.378038176897114, 'atr_min_pct': 0.029184099803197004, 'atr_max_pct': 0.09230380072491998, 'tp_mult': 2.393224489425373, 'tsl_mult': 0.6491440923416862, 'strategy': 'mean_reversion', 'time_stop': 248, 'use_sma': True, 'use_atr': False, 'use_adx': True, 'use_ema': True, 'use_spike': False, 'rsi_required': False, 'edge_k': 0.13637876730230925, 'edge_cap': 0.7848216894108464, 'bull_strategy': 'breakout', 'bull_bb_std_mult': 0.8173443174357038, 'bull_rsi_os': 6, 'bull_rsi_ob': 73, 'bull_adx_thresh': 24.28338328863479, 'bull_atr_min_pct': 0.0017648588375441519, 'bull_atr_max_pct': 0.14515761180497344, 'bull_tp_mult': 1.9837531510279267, 'bull_tsl_mult': 0.4205998390279703, 'bull_time_stop': 78, 'bull_use_sma': False, 'bull_use_ema': True, 'bull_use_atr': True, 'bull_use_adx': False, 'bull_use_spike': True, 'bull_rsi_required': True, 'bear_strategy': 'breakout', 'bear_bb_std_mult': 2.5105061089267577, 'bear_rsi_os': 22, 'bear_rsi_ob': 82, 'bear_adx_thresh': 15.647678537814764, 'bear_atr_min_pct': 0.027199338991942983, 'bear_atr_max_pct': 0.07709077776235151, 'bear_tp_mult': 2.4698937004855597, 'bear_tsl_mult': 0.6053519855961549, 'bear_time_stop': 134, 'bear_use_sma': False, 'bear_use_ema': True, 'bear_use_atr': False, 'bear_use_adx': False, 'bear_use_spike': True, 'bear_rsi_required': False, 'sideways_strategy': 'breakout', 'sideways_bb_std_mult': 2.7312754039891605, 'sideways_rsi_os': 26, 'sideways_rsi_ob': 76, 'sideways_adx_thresh': 23.780159892049486, 'sideways_atr_min_pct': 0.02964876554057059, 'sideways_atr_max_pct': 0.03668741761055217, 'sideways_tp_mult': 1.1074948440425938, 'sideways_tsl_mult': 0.22245731711419703, 'sideways_time_stop': 43, 'sideways_use_sma': True, 'sideways_use_ema': False, 'sideways_use_atr': False, 'sideways_use_adx': False, 'sideways_use_spike': True, 'sideways_rsi_required': True}.
[I 2025-08-31 10:29:43,387] Trial 271 finished with values: [-1000000000.0, 1000000000.0] and parameters: {'p_sma': 8, 'p_std': 24, 'p_atr': 29, 'p_adx': 16, 'rsi_period': 45, 'ema1': 9, 'ema2': 55, 'slip_atr_k': 0.013255930776178246, 'slip_spread_k': 0.09793073696208066, 'spread_hl_frac': 0.013088526672109572, 'bb_std_mult': 0.6827420216301425, 'rsi_os': 14, 'rsi_ob': 77, 'vol_spike': 0.2772060372911741, 'adx_thresh': 31.53184806008078, 'atr_min_pct': 0.0065331911899933984, 'atr_max_pct': 0.08994262357013329, 'tp_mult': 1.4614013533145718, 'tsl_mult': 0.6113544964563684, 'strategy': 'breakout', 'time_stop': 233, 'use_sma': True, 'use_atr': True, 'use_adx': False, 'use_ema': False, 'use_spike': True, 'rsi_required': False, 'edge_k': 0.7263825877293015, 'edge_cap': 0.8424092899628506, 'bull_strategy': 'breakout', 'bull_bb_std_mult': 3.4678744037830542, 'bull_rsi_os': 41, 'bull_rsi_ob': 71, 'bull_adx_thresh': 29.02364367696979, 'bull_atr_min_pct': 0.027332232500056036, 'bull_atr_max_pct': 0.14425808929901088, 'bull_tp_mult': 1.418736390165885, 'bull_tsl_mult': 0.2983744956004635, 'bull_time_stop': 86, 'bull_use_sma': True, 'bull_use_ema': True, 'bull_use_atr': True, 'bull_use_adx': False, 'bull_use_spike': True, 'bull_rsi_required': False, 'bear_strategy': 'breakout', 'bear_bb_std_mult': 1.0070322295318719, 'bear_rsi_os': 41, 'bear_rsi_ob': 91, 'bear_adx_thresh': 13.940597387359622, 'bear_atr_min_pct': 0.016932237076116914, 'bear_atr_max_pct': 0.0831268857492313, 'bear_tp_mult': 2.642014288430743, 'bear_tsl_mult': 0.49277478941791847, 'bear_time_stop': 177, 'bear_use_sma': False, 'bear_use_ema': True, 'bear_use_atr': False, 'bear_use_adx': True, 'bear_use_spike': True, 'bear_rsi_required': False, 'sideways_strategy': 'breakout', 'sideways_bb_std_mult': 2.812682465549119, 'sideways_rsi_os': 19, 'sideways_rsi_ob': 81, 'sideways_adx_thresh': 16.567404691449084, 'sideways_atr_min_pct': 0.0061963004067234545, 'sideways_atr_max_pct': 0.032664414023232724, 'sideways_tp_mult': 2.200879706088648, 'sideways_tsl_mult': 0.49523518164799374, 'sideways_time_stop': 37, 'sideways_use_sma': False, 'sideways_use_ema': False, 'sideways_use_atr': False, 'sideways_use_adx': True, 'sideways_use_spike': False, 'sideways_rsi_required': False}.
