[I 2025-08-31 11:03:11,196] Trial 533 finished with values: [-1000000000.0, 1000000000.0] and parameters: {'p_sma': 14, 'p_std': 20, 'p_atr': 15, 'p_adx': 30, 'rsi_period': 47, 'ema1': 20, 'ema2': 25, 'slip_atr_k': 0.012133246939726, 'slip_spread_k': 0.6201823590685951, 'spread_hl_frac': 0.04003680434153008, 'bb_std_mult': 2.735777727137533, 'rsi_os': 26, 'rsi_ob': 88, 'vol_spike': 0.2240430872271883, 'adx_thresh': 28.837923475488495, 'atr_min_pct': 0.0211548566078523, 'atr_max_pct': 0.09616079087805877, 'tp_mult': 2.3664457179663, 'tsl_mult': 0.32192302681324925, 'strategy': 'mean_reversion', 'time_stop': 6, 'use_sma': False, 'use_atr': False, 'use_adx': True, 'use_ema': True, 'use_spike': True, 'rsi_required': True, 'edge_k': 0.2534184452558331, 'edge_cap': 0.4538466890971894, 'bull_strategy': 'breakout', 'bull_bb_std_mult': 0.9733024637831774, 'bull_rsi_os': 9, 'bull_rsi_ob': 53, 'bull_adx_thresh': 8.725736854115313, 'bull_atr_min_pct': 0.009848783477861786, 'bull_atr_max_pct': 0.10910960311697791, 'bull_tp_mult': 1.2942226357516227, 'bull_tsl_mult': 0.4134690884388555, 'bull_time_stop': 269, 'bull_use_sma': True, 'bull_use_ema': False, 'bull_use_atr': False, 'bull_use_adx': True, 'bull_use_spike': False, 'bull_rsi_required': False, 'bear_strategy': 'breakout', 'bear_bb_std_mult': 2.011085750431806, 'bear_rsi_os': 37, 'bear_rsi_ob': 62, 'bear_adx_thresh': 27.18041391926611, 'bear_atr_min_pct': 0.013127910397268605, 'bear_atr_max_pct': 0.11611170912069066, 'bear_tp_mult': 2.8610421951305227, 'bear_tsl_mult': 0.5993224220154935, 'bear_time_stop': 30, 'bear_use_sma': False, 'bear_use_ema': True, 'bear_use_atr': False, 'bear_use_adx': False, 'bear_use_spike': True, 'bear_rsi_required': False, 'sideways_strategy': 'mean_reversion', 'sideways_bb_std_mult': 2.710129004661021, 'sideways_rsi_os': 5, 'sideways_rsi_ob': 91, 'sideways_adx_thresh': 16.485020322555375, 'sideways_atr_min_pct': 0.023092318067498285, 'sideways_atr_max_pct': 0.05302172340075508, 'sideways_tp_mult': 1.9614538547304319, 'sideways_tsl_mult': 0.8595956719522329, 'sideways_time_stop': 128, 'sideways_use_sma': True, 'sideways_use_ema': False, 'sideways_use_atr': False, 'sideways_use_adx': False, 'sideways_use_spike': False, 'sideways_rsi_required': True}.
[I 2025-08-31 11:03:11,527] Trial 532 finished with values: [-1000000000.0, 1000000000.0] and parameters: {'p_sma': 22, 'p_std': 20, 'p_atr': 15, 'p_adx': 26, 'rsi_period': 48, 'ema1': 20, 'ema2': 55, 'slip_atr_k': 0.19148423515577606, 'slip_spread_k': 0.6177480742761698, 'spread_hl_frac': 0.01112180451960814, 'bb_std_mult': 2.6512424908882397, 'rsi_os': 26, 'rsi_ob': 80, 'vol_spike': 0.25546436766438646, 'adx_thresh': 8.429499049496677, 'atr_min_pct': 0.019185186700503586, 'atr_max_pct': 0.09392842831873019, 'tp_mult': 2.3605710344775033, 'tsl_mult': 0.268859222484349, 'strategy': 'mean_reversion', 'time_stop': 48, 'use_sma': True, 'use_atr': False, 'use_adx': True, 'use_ema': True, 'use_spike': True, 'rsi_required': True, 'edge_k': 0.2761794874224295, 'edge_cap': 0.9976435735798121, 'bull_strategy': 'breakout', 'bull_bb_std_mult': 2.7711390888526695, 'bull_rsi_os': 14, 'bull_rsi_ob': 75, 'bull_adx_thresh': 19.342473774434193, 'bull_atr_min_pct': 0.008734083688876309, 'bull_atr_max_pct': 0.09174016531128336, 'bull_tp_mult': 1.7672610905565094, 'bull_tsl_mult': 0.4109403689274242, 'bull_time_stop': 263, 'bull_use_sma': True, 'bull_use_ema': False, 'bull_use_atr': False, 'bull_use_adx': False, 'bull_use_spike': False, 'bull_rsi_required': True, 'bear_strategy': 'breakout', 'bear_bb_std_mult': 2.040680242261665, 'bear_rsi_os': 37, 'bear_rsi_ob': 55, 'bear_adx_thresh': 8.279816287023555, 'bear_atr_min_pct': 0.004749365332615135, 'bear_atr_max_pct': 0.10269854424855801, 'bear_tp_mult': 2.854483326539639, 'bear_tsl_mult': 0.6043465625045874, 'bear_time_stop': 36, 'bear_use_sma': False, 'bear_use_ema': True, 'bear_use_atr': False, 'bear_use_adx': False, 'bear_use_spike': True, 'bear_rsi_required': False, 'sideways_strategy': 'mean_reversion', 'sideways_bb_std_mult': 2.494963370760716, 'sideways_rsi_os': 7, 'sideways_rsi_ob': 63, 'sideways_adx_thresh': 22.119199373855484, 'sideways_atr_min_pct': 0.018040468214831632, 'sideways_atr_max_pct': 0.05284183912254116, 'sideways_tp_mult': 2.592988070218257, 'sideways_tsl_mult': 0.02150150580044803, 'sideways_time_stop': 187, 'sideways_use_sma': True, 'sideways_use_ema': False, 'sideways_use_atr': False, 'sideways_use_adx': False, 'sideways_use_spike': False, 'sideways_rsi_required': True}.
[I 2025-08-31 11:03:11,674] Trial 534 finished with values: [-1000000000.0, 1000000000.0] and parameters: {'p_sma': 13, 'p_std': 55, 'p_atr': 7, 'p_adx': 26, 'rsi_period': 45, 'ema1': 14, 'ema2': 25, 'slip_atr_k': 0.19301075666293355, 'slip_spread_k': 0.6237825531840714, 'spread_hl_frac': 0.011396433297946922, 'bb_std_mult': 2.7519223244204354, 'rsi_os': 35, 'rsi_ob': 86, 'vol_spike': 0.2506856557047256, 'adx_thresh': 28.657410884841685, 'atr_min_pct': 0.019018308587881193, 'atr_max_pct': 0.09880795521991097, 'tp_mult': 2.371297602435474, 'tsl_mult': 0.3321619313893154, 'strategy': 'mean_reversion', 'time_stop': 188, 'use_sma': True, 'use_atr': True, 'use_adx': False, 'use_ema': True, 'use_spike': True, 'rsi_required': False, 'edge_k': 0.16886645697079125, 'edge_cap': 0.4600927185086828, 'bull_strategy': 'breakout', 'bull_bb_std_mult': 0.9789642476263578, 'bull_rsi_os': 14, 'bull_rsi_ob': 70, 'bull_adx_thresh': 5.042826179610227, 'bull_atr_min_pct': 0.015486782833533963, 'bull_atr_max_pct': 0.03336475889510543, 'bull_tp_mult': 2.729516777220917, 'bull_tsl_mult': 0.41292145455820944, 'bull_time_stop': 215, 'bull_use_sma': True, 'bull_use_ema': False, 'bull_use_atr': True, 'bull_use_adx': False, 'bull_use_spike': False, 'bull_rsi_required': False, 'bear_strategy': 'mean_reversion', 'bear_bb_std_mult': 2.93164976385769, 'bear_rsi_os': 37, 'bear_rsi_ob': 55, 'bear_adx_thresh': 8.52362437299917, 'bear_atr_min_pct': 0.013077401892963214, 'bear_atr_max_pct': 0.06868824791745931, 'bear_tp_mult': 2.8516398997326124, 'bear_tsl_mult': 0.0025291548058785085, 'bear_time_stop': 253, 'bear_use_sma': False, 'bear_use_ema': True, 'bear_use_atr': False, 'bear_use_adx': False, 'bear_use_spike': True, 'bear_rsi_required': False, 'sideways_strategy': 'mean_reversion', 'sideways_bb_std_mult': 2.7166383933536347, 'sideways_rsi_os': 5, 'sideways_rsi_ob': 91, 'sideways_adx_thresh': 16.642741262725316, 'sideways_atr_min_pct': 0.01811521855915748, 'sideways_atr_max_pct': 0.11008907492674283, 'sideways_tp_mult': 1.9563735121966508, 'sideways_tsl_mult': 0.4421043909719954, 'sideways_time_stop': 206, 'sideways_use_sma': True, 'sideways_use_ema': False, 'sideways_use_atr': False, 'sideways_use_adx': False, 'sideways_use_spike': True, 'sideways_rsi_required': True}.
[I 2025-08-31 11:03:11,809] Trial 531 finished with values: [-1000000000.0, 1000000000.0] and parameters: {'p_sma': 16, 'p_std': 21, 'p_atr': 10, 'p_adx': 24, 'rsi_period': 48, 'ema1': 15, 'ema2': 13, 'slip_atr_k': 0.011778989581139312, 'slip_spread_k': 0.6552959689358934, 'spread_hl_frac': 0.010777178832815674, 'bb_std_mult': 2.635941283737337, 'rsi_os': 33, 'rsi_ob': 88, 'vol_spike': 0.0010936554918299923, 'adx_thresh': 28.667411390180916, 'atr_min_pct': 0.021319905873989235, 'atr_max_pct': 0.09440655009020134, 'tp_mult': 1.7292808722518704, 'tsl_mult': 0.9413581736171525, 'strategy': 'mean_reversion', 'time_stop': 187, 'use_sma': True, 'use_atr': False, 'use_adx': True, 'use_ema': True, 'use_spike': True, 'rsi_required': True, 'edge_k': 0.4002250681154177, 'edge_cap': 0.09250585700112562, 'bull_strategy': 'breakout', 'bull_bb_std_mult': 1.4519766448836422, 'bull_rsi_os': 14, 'bull_rsi_ob': 74, 'bull_adx_thresh': 8.997317971425783, 'bull_atr_min_pct': 0.008647118314868153, 'bull_atr_max_pct': 0.013597963662600868, 'bull_tp_mult': 1.8177167567877972, 'bull_tsl_mult': 0.6431614296387401, 'bull_time_stop': 262, 'bull_use_sma': False, 'bull_use_ema': False, 'bull_use_atr': False, 'bull_use_adx': False, 'bull_use_spike': False, 'bull_rsi_required': True, 'bear_strategy': 'breakout', 'bear_bb_std_mult': 2.4805449412378584, 'bear_rsi_os': 42, 'bear_rsi_ob': 80, 'bear_adx_thresh': 8.4125016134937, 'bear_atr_min_pct': 0.016511133328359812, 'bear_atr_max_pct': 0.018178932966414228, 'bear_tp_mult': 2.0174776416581723, 'bear_tsl_mult': 0.6771520353581203, 'bear_time_stop': 21, 'bear_use_sma': False, 'bear_use_ema': True, 'bear_use_atr': False, 'bear_use_adx': False, 'bear_use_spike': False, 'bear_rsi_required': False, 'sideways_strategy': 'mean_reversion', 'sideways_bb_std_mult': 2.6415642826700756, 'sideways_rsi_os': 7, 'sideways_rsi_ob': 91, 'sideways_adx_thresh': 25.410089237221808, 'sideways_atr_min_pct': 0.007462549360058731, 'sideways_atr_max_pct': 0.11113236669050244, 'sideways_tp_mult': 1.9632080185026826, 'sideways_tsl_mult': 0.12765096813438245, 'sideways_time_stop': 136, 'sideways_use_sma': True, 'sideways_use_ema': True, 'sideways_use_atr': False, 'sideways_use_adx': False, 'sideways_use_spike': False, 'sideways_rsi_required': True}.
[I 2025-08-31 11:03:42,600] Trial 537 finished with values: [-1000000000.0, 1000000000.0] and parameters: {'p_sma': 15, 'p_std': 30, 'p_atr': 11, 'p_adx': 22, 'rsi_period': 50, 'ema1': 29, 'ema2': 58, 'slip_atr_k': 0.019624824451963424, 'slip_spread_k': 0.6893654304441709, 'spread_hl_frac': 0.009799522123523028, 'bb_std_mult': 2.5341110923273478, 'rsi_os': 24, 'rsi_ob': 55, 'vol_spike': 0.2893535067009905, 'adx_thresh': 29.908240700574755, 'atr_min_pct': 0.005933416563626439, 'atr_max_pct': 0.09265977951294752, 'tp_mult': 2.48489614104394, 'tsl_mult': 0.47632943297034025, 'strategy': 'breakout', 'time_stop': 76, 'use_sma': True, 'use_atr': False, 'use_adx': True, 'use_ema': False, 'use_spike': True, 'rsi_required': True, 'edge_k': 0.898414283964619, 'edge_cap': 0.24319787610355637, 'bull_strategy': 'breakout', 'bull_bb_std_mult': 0.6793280580644455, 'bull_rsi_os': 12, 'bull_rsi_ob': 71, 'bull_adx_thresh': 29.692986043886023, 'bull_atr_min_pct': 0.02003634506741757, 'bull_atr_max_pct': 0.08363004160744134, 'bull_tp_mult': 1.8579501344869873, 'bull_tsl_mult': 0.3088881719896841, 'bull_time_stop': 46, 'bull_use_sma': True, 'bull_use_ema': False, 'bull_use_atr': False, 'bull_use_adx': False, 'bull_use_spike': False, 'bull_rsi_required': True, 'bear_strategy': 'mean_reversion', 'bear_bb_std_mult': 2.530867087071532, 'bear_rsi_os': 8, 'bear_rsi_ob': 80, 'bear_adx_thresh': 28.39526393832874, 'bear_atr_min_pct': 0.01650728128716633, 'bear_atr_max_pct': 0.011452964174870517, 'bear_tp_mult': 1.4870455180039226, 'bear_tsl_mult': 0.554663531087439, 'bear_time_stop': 25, 'bear_use_sma': True, 'bear_use_ema': False, 'bear_use_atr': True, 'bear_use_adx': True, 'bear_use_spike': True, 'bear_rsi_required': False, 'sideways_strategy': 'mean_reversion', 'sideways_bb_std_mult': 2.6372369705182304, 'sideways_rsi_os': 6, 'sideways_rsi_ob': 92, 'sideways_adx_thresh': 24.2322976515417, 'sideways_atr_min_pct': 0.0175094259538144, 'sideways_atr_max_pct': 0.037958717179848625, 'sideways_tp_mult': 1.8625073552859213, 'sideways_tsl_mult': 0.11865211201576213, 'sideways_time_stop': 31, 'sideways_use_sma': False, 'sideways_use_ema': False, 'sideways_use_atr': False, 'sideways_use_adx': True, 'sideways_use_spike': False, 'sideways_rsi_required': True}.
[I 2025-08-31 11:03:43,006] Trial 535 finished with values: [-1000000000.0, 1000000000.0] and parameters: {'p_sma': 13, 'p_std': 31, 'p_atr': 10, 'p_adx': 24, 'rsi_period': 50, 'ema1': 14, 'ema2': 13, 'slip_atr_k': 0.016493403193128166, 'slip_spread_k': 0.7034510424449133, 'spread_hl_frac': 0.011036324448066227, 'bb_std_mult': 2.8180539896208185, 'rsi_os': 27, 'rsi_ob': 55, 'vol_spike': 0.16825633396794676, 'adx_thresh': 25.017142420819997, 'atr_min_pct': 0.006523933753076414, 'atr_max_pct': 0.09333631468437333, 'tp_mult': 2.458310416431325, 'tsl_mult': 0.09679334114220373, 'strategy': 'mean_reversion', 'time_stop': 275, 'use_sma': True, 'use_atr': True, 'use_adx': False, 'use_ema': True, 'use_spike': True, 'rsi_required': False, 'edge_k': 0.17403878550717056, 'edge_cap': 0.5784139599345237, 'bull_strategy': 'breakout', 'bull_bb_std_mult': 0.6854999477290044, 'bull_rsi_os': 14, 'bull_rsi_ob': 75, 'bull_adx_thresh': 8.10864415397181, 'bull_atr_min_pct': 0.015471017194162238, 'bull_atr_max_pct': 0.08347849935862815, 'bull_tp_mult': 1.9211753862579237, 'bull_tsl_mult': 0.1757407278003646, 'bull_time_stop': 71, 'bull_use_sma': True, 'bull_use_ema': False, 'bull_use_atr': True, 'bull_use_adx': False, 'bull_use_spike': False, 'bull_rsi_required': True, 'bear_strategy': 'mean_reversion', 'bear_bb_std_mult': 2.7534507558415116, 'bear_rsi_os': 8, 'bear_rsi_ob': 80, 'bear_adx_thresh': 8.605088567121431, 'bear_atr_min_pct': 0.004890049684155821, 'bear_atr_max_pct': 0.03246637227828338, 'bear_tp_mult': 2.758134443572749, 'bear_tsl_mult': 0.5598929459542303, 'bear_time_stop': 126, 'bear_use_sma': False, 'bear_use_ema': False, 'bear_use_atr': True, 'bear_use_adx': False, 'bear_use_spike': True, 'bear_rsi_required': False, 'sideways_strategy': 'mean_reversion', 'sideways_bb_std_mult': 1.555586746155895, 'sideways_rsi_os': 14, 'sideways_rsi_ob': 92, 'sideways_adx_thresh': 26.925620297667667, 'sideways_atr_min_pct': 0.018051402860581767, 'sideways_atr_max_pct': 0.03911087253634852, 'sideways_tp_mult': 1.207190564292279, 'sideways_tsl_mult': 0.5543764284085125, 'sideways_time_stop': 185, 'sideways_use_sma': True, 'sideways_use_ema': False, 'sideways_use_atr': False, 'sideways_use_adx': True, 'sideways_use_spike': True, 'sideways_rsi_required': True}.
[I 2025-08-31 11:03:43,249] Trial 536 finished with values: [-1000000000.0, 1000000000.0] and parameters: {'p_sma': 37, 'p_std': 31, 'p_atr': 10, 'p_adx': 28, 'rsi_period': 42, 'ema1': 14, 'ema2': 58, 'slip_atr_k': 0.020031469762344146, 'slip_spread_k': 0.7022488739732925, 'spread_hl_frac': 0.012091517772792593, 'bb_std_mult': 2.5421858969606803, 'rsi_os': 43, 'rsi_ob': 47, 'vol_spike': 0.28086508983268293, 'adx_thresh': 28.510997218685517, 'atr_min_pct': 0.028298186640042383, 'atr_max_pct': 0.0985847075434134, 'tp_mult': 2.602488493914013, 'tsl_mult': 0.21421584927864362, 'strategy': 'breakout', 'time_stop': 274, 'use_sma': True, 'use_atr': True, 'use_adx': False, 'use_ema': False, 'use_spike': True, 'rsi_required': False, 'edge_k': 0.17093602804696273, 'edge_cap': 0.6539448842809193, 'bull_strategy': 'breakout', 'bull_bb_std_mult': 0.8587048105940992, 'bull_rsi_os': 34, 'bull_rsi_ob': 71, 'bull_adx_thresh': 5.113860399114375, 'bull_atr_min_pct': 0.011067779120811876, 'bull_atr_max_pct': 0.020295106732544227, 'bull_tp_mult': 2.2088481393817716, 'bull_tsl_mult': 0.832658224325642, 'bull_time_stop': 214, 'bull_use_sma': True, 'bull_use_ema': False, 'bull_use_atr': True, 'bull_use_adx': False, 'bull_use_spike': False, 'bull_rsi_required': True, 'bear_strategy': 'mean_reversion', 'bear_bb_std_mult': 2.4679623540030997, 'bear_rsi_os': 39, 'bear_rsi_ob': 57, 'bear_adx_thresh': 24.834184501743575, 'bear_atr_min_pct': 0.02807789148072716, 'bear_atr_max_pct': 0.0524084116114978, 'bear_tp_mult': 1.4977339680808734, 'bear_tsl_mult': 0.5529024340515045, 'bear_time_stop': 161, 'bear_use_sma': True, 'bear_use_ema': False, 'bear_use_atr': True, 'bear_use_adx': True, 'bear_use_spike': True, 'bear_rsi_required': False, 'sideways_strategy': 'mean_reversion', 'sideways_bb_std_mult': 2.6286666521235835, 'sideways_rsi_os': 14, 'sideways_rsi_ob': 54, 'sideways_adx_thresh': 24.605396365730886, 'sideways_atr_min_pct': 0.01803043944601305, 'sideways_atr_max_pct': 0.06258448759422115, 'sideways_tp_mult': 1.9397777336978768, 'sideways_tsl_mult': 0.4858626630878947, 'sideways_time_stop': 29, 'sideways_use_sma': False, 'sideways_use_ema': False, 'sideways_use_atr': False, 'sideways_use_adx': True, 'sideways_use_spike': True, 'sideways_rsi_required': True}.
[I 2025-08-31 11:03:43,374] Trial 538 finished with values: [-1000000000.0, 1000000000.0] and parameters: {'p_sma': 6, 'p_std': 7, 'p_atr': 12, 'p_adx': 22, 'rsi_period': 27, 'ema1': 14, 'ema2': 58, 'slip_atr_k': 0.02128250065511847, 'slip_spread_k': 0.6883034664572611, 'spread_hl_frac': 0.00950565499392729, 'bb_std_mult': 2.522405140859859, 'rsi_os': 29, 'rsi_ob': 60, 'vol_spike': 0.24174517934565642, 'adx_thresh': 27.513174886112385, 'atr_min_pct': 0.0068446800122163014, 'atr_max_pct': 0.14201900017002464, 'tp_mult': 2.4642288250850295, 'tsl_mult': 0.10654194667161687, 'strategy': 'breakout', 'time_stop': 276, 'use_sma': True, 'use_atr': True, 'use_adx': False, 'use_ema': False, 'use_spike': True, 'rsi_required': False, 'edge_k': 0.21052681301550993, 'edge_cap': 0.6493109229267632, 'bull_strategy': 'mean_reversion', 'bull_bb_std_mult': 1.756095697130927, 'bull_rsi_os': 12, 'bull_rsi_ob': 77, 'bull_adx_thresh': 7.8859662410082105, 'bull_atr_min_pct': 0.01116510726692696, 'bull_atr_max_pct': 0.04704719185132872, 'bull_tp_mult': 1.893842203429804, 'bull_tsl_mult': 0.44215760992622855, 'bull_time_stop': 97, 'bull_use_sma': True, 'bull_use_ema': False, 'bull_use_atr': True, 'bull_use_adx': False, 'bull_use_spike': False, 'bull_rsi_required': True, 'bear_strategy': 'mean_reversion', 'bear_bb_std_mult': 2.2298823843113813, 'bear_rsi_os': 16, 'bear_rsi_ob': 79, 'bear_adx_thresh': 28.754107210168574, 'bear_atr_min_pct': 0.005110572556621789, 'bear_atr_max_pct': 0.13383774857911207, 'bear_tp_mult': 2.752637197492966, 'bear_tsl_mult': 0.5332607778633869, 'bear_time_stop': 44, 'bear_use_sma': True, 'bear_use_ema': False, 'bear_use_atr': True, 'bear_use_adx': True, 'bear_use_spike': True, 'bear_rsi_required': False, 'sideways_strategy': 'mean_reversion', 'sideways_bb_std_mult': 1.5639027521979463, 'sideways_rsi_os': 6, 'sideways_rsi_ob': 54, 'sideways_adx_thresh': 8.335934114075053, 'sideways_atr_min_pct': 0.01750639457323446, 'sideways_atr_max_pct': 0.03898822316611384, 'sideways_tp_mult': 1.8740830987886936, 'sideways_tsl_mult': 0.50985654080909, 'sideways_time_stop': 29, 'sideways_use_sma': False, 'sideways_use_ema': False, 'sideways_use_atr': False, 'sideways_use_adx': True, 'sideways_use_spike': True, 'sideways_rsi_required': True}.
[I 2025-08-31 11:04:15,312] Trial 541 finished with values: [-1000000000.0, 1000000000.0] and parameters: {'p_sma': 6, 'p_std': 13, 'p_atr': 12, 'p_adx': 13, 'rsi_period': 45, 'ema1': 13, 'ema2': 54, 'slip_atr_k': 0.11395570070868927, 'slip_spread_k': 0.7975937936645473, 'spread_hl_frac': 0.03794809425927072, 'bb_std_mult': 2.698973101888469, 'rsi_os': 29, 'rsi_ob': 70, 'vol_spike': 0.24067463596961358, 'adx_thresh': 27.20218032862254, 'atr_min_pct': 0.002321296830466264, 'atr_max_pct': 0.10595823935735402, 'tp_mult': 2.8814882676157714, 'tsl_mult': 0.8374691881488725, 'strategy': 'breakout', 'time_stop': 152, 'use_sma': False, 'use_atr': False, 'use_adx': True, 'use_ema': True, 'use_spike': False, 'rsi_required': True, 'edge_k': 1.103946178056419, 'edge_cap': 0.48422873623369417, 'bull_strategy': 'mean_reversion', 'bull_bb_std_mult': 1.068896308038557, 'bull_rsi_os': 21, 'bull_rsi_ob': 66, 'bull_adx_thresh': 7.159772696819251, 'bull_atr_min_pct': 0.02159245674202708, 'bull_atr_max_pct': 0.04690431455563528, 'bull_tp_mult': 2.5138716128948926, 'bull_tsl_mult': 0.1073102378554377, 'bull_time_stop': 99, 'bull_use_sma': True, 'bull_use_ema': True, 'bull_use_atr': False, 'bull_use_adx': True, 'bull_use_spike': True, 'bull_rsi_required': False, 'bear_strategy': 'breakout', 'bear_bb_std_mult': 2.2600725804092323, 'bear_rsi_os': 33, 'bear_rsi_ob': 91, 'bear_adx_thresh': 7.811284545556843, 'bear_atr_min_pct': 0.005423910323881469, 'bear_atr_max_pct': 0.13352975976227308, 'bear_tp_mult': 1.1577015521942138, 'bear_tsl_mult': 0.5284001797916474, 'bear_time_stop': 44, 'bear_use_sma': False, 'bear_use_ema': True, 'bear_use_atr': False, 'bear_use_adx': False, 'bear_use_spike': True, 'bear_rsi_required': True, 'sideways_strategy': 'breakout', 'sideways_bb_std_mult': 2.846935451869629, 'sideways_rsi_os': 26, 'sideways_rsi_ob': 67, 'sideways_adx_thresh': 24.9556309502323, 'sideways_atr_min_pct': 0.014719840348047238, 'sideways_atr_max_pct': 0.0490088903368493, 'sideways_tp_mult': 1.796237005861494, 'sideways_tsl_mult': 0.31747006106245457, 'sideways_time_stop': 24, 'sideways_use_sma': False, 'sideways_use_ema': False, 'sideways_use_atr': True, 'sideways_use_adx': False, 'sideways_use_spike': False, 'sideways_rsi_required': False}.
