[I 2025-08-31 10:30:49,695] Trial 277 finished with values: [-1000000000.0, 1000000000.0] and parameters: {'p_sma': 37, 'p_std': 29, 'p_atr': 7, 'p_adx': 16, 'rsi_period': 55, 'ema1': 11, 'ema2': 34, 'slip_atr_k': 0.11612969384964095, 'slip_spread_k': 0.2585070643636277, 'spread_hl_frac': 0.03369328450772546, 'bb_std_mult': 0.5579069298657335, 'rsi_os': 22, 'rsi_ob': 74, 'vol_spike': 0.09277612349765055, 'adx_thresh': 21.317966234955218, 'atr_min_pct': 0.016873821030286458, 'atr_max_pct': 0.09524905825019732, 'tp_mult': 2.4407664051189073, 'tsl_mult': 0.30769467697792074, 'strategy': 'breakout', 'time_stop': 256, 'use_sma': True, 'use_atr': True, 'use_adx': False, 'use_ema': True, 'use_spike': True, 'rsi_required': False, 'edge_k': 0.2572711144117581, 'edge_cap': 0.16579864369448444, 'bull_strategy': 'mean_reversion', 'bull_bb_std_mult': 0.7429708649622779, 'bull_rsi_os': 29, 'bull_rsi_ob': 70, 'bull_adx_thresh': 23.685775603506286, 'bull_atr_min_pct': 0.005995457106520764, 'bull_atr_max_pct': 0.1102464367826953, 'bull_tp_mult': 1.7214640582532834, 'bull_tsl_mult': 0.398078245146474, 'bull_time_stop': 69, 'bull_use_sma': True, 'bull_use_ema': True, 'bull_use_atr': True, 'bull_use_adx': False, 'bull_use_spike': False, 'bull_rsi_required': True, 'bear_strategy': 'breakout', 'bear_bb_std_mult': 1.37318628120722, 'bear_rsi_os': 38, 'bear_rsi_ob': 70, 'bear_adx_thresh': 21.136934359325483, 'bear_atr_min_pct': 0.018585675065569483, 'bear_atr_max_pct': 0.07290758562963787, 'bear_tp_mult': 2.821970448341312, 'bear_tsl_mult': 0.5222495565393053, 'bear_time_stop': 48, 'bear_use_sma': False, 'bear_use_ema': True, 'bear_use_atr': False, 'bear_use_adx': False, 'bear_use_spike': True, 'bear_rsi_required': False, 'sideways_strategy': 'breakout', 'sideways_bb_std_mult': 1.5233105071172086, 'sideways_rsi_os': 34, 'sideways_rsi_ob': 73, 'sideways_adx_thresh': 32.240116973057766, 'sideways_atr_min_pct': 0.004975284557773184, 'sideways_atr_max_pct': 0.036033329831222156, 'sideways_tp_mult': 2.004542948807231, 'sideways_tsl_mult': 0.714802536975098, 'sideways_time_stop': 152, 'sideways_use_sma': False, 'sideways_use_ema': False, 'sideways_use_atr': False, 'sideways_use_adx': True, 'sideways_use_spike': True, 'sideways_rsi_required': True}.
[I 2025-08-31 10:30:49,706] Trial 278 finished with values: [-1000000000.0, 1000000000.0] and parameters: {'p_sma': 11, 'p_std': 29, 'p_atr': 20, 'p_adx': 16, 'rsi_period': 22, 'ema1': 5, 'ema2': 34, 'slip_atr_k': 0.02369130264907375, 'slip_spread_k': 0.5944210628329322, 'spread_hl_frac': 0.02452735307019531, 'bb_std_mult': 0.6152180361049129, 'rsi_os': 22, 'rsi_ob': 74, 'vol_spike': 0.24482367199596056, 'adx_thresh': 29.10527671650953, 'atr_min_pct': 0.015583158446747488, 'atr_max_pct': 0.09538101024387777, 'tp_mult': 2.4366787234644107, 'tsl_mult': 0.5741586218698397, 'strategy': 'breakout', 'time_stop': 172, 'use_sma': True, 'use_atr': True, 'use_adx': False, 'use_ema': True, 'use_spike': True, 'rsi_required': False, 'edge_k': 1.0570209636027201, 'edge_cap': 0.15107054612091747, 'bull_strategy': 'mean_reversion', 'bull_bb_std_mult': 0.764908241108224, 'bull_rsi_os': 13, 'bull_rsi_ob': 70, 'bull_adx_thresh': 23.703982770317218, 'bull_atr_min_pct': 0.00774187281524189, 'bull_atr_max_pct': 0.14825314985471233, 'bull_tp_mult': 1.473445813874616, 'bull_tsl_mult': 0.3978808243716069, 'bull_time_stop': 70, 'bull_use_sma': True, 'bull_use_ema': True, 'bull_use_atr': True, 'bull_use_adx': False, 'bull_use_spike': False, 'bull_rsi_required': True, 'bear_strategy': 'breakout', 'bear_bb_std_mult': 1.390750461603661, 'bear_rsi_os': 54, 'bear_rsi_ob': 70, 'bear_adx_thresh': 17.400188372322237, 'bear_atr_min_pct': 0.00647246203183857, 'bear_atr_max_pct': 0.07363508286703634, 'bear_tp_mult': 2.3348104942468355, 'bear_tsl_mult': 0.54608462340134, 'bear_time_stop': 47, 'bear_use_sma': False, 'bear_use_ema': True, 'bear_use_atr': False, 'bear_use_adx': False, 'bear_use_spike': True, 'bear_rsi_required': False, 'sideways_strategy': 'breakout', 'sideways_bb_std_mult': 2.6561735042093844, 'sideways_rsi_os': 17, 'sideways_rsi_ob': 53, 'sideways_adx_thresh': 25.598306154169627, 'sideways_atr_min_pct': 0.028069990147154278, 'sideways_atr_max_pct': 0.03638867893189614, 'sideways_tp_mult': 2.0533154543308014, 'sideways_tsl_mult': 0.12348273622264387, 'sideways_time_stop': 32, 'sideways_use_sma': False, 'sideways_use_ema': False, 'sideways_use_atr': True, 'sideways_use_adx': False, 'sideways_use_spike': True, 'sideways_rsi_required': True}.
[I 2025-08-31 10:31:21,648] Trial 281 finished with values: [-1000000000.0, 1000000000.0] and parameters: {'p_sma': 33, 'p_std': 29, 'p_atr': 28, 'p_adx': 8, 'rsi_period': 58, 'ema1': 16, 'ema2': 55, 'slip_atr_k': 0.15455733966912977, 'slip_spread_k': 0.8372995182630556, 'spread_hl_frac': 0.011847441508983588, 'bb_std_mult': 0.6316713020174466, 'rsi_os': 26, 'rsi_ob': 80, 'vol_spike': 0.08782615419154433, 'adx_thresh': 26.611615507010438, 'atr_min_pct': 0.002589942824960423, 'atr_max_pct': 0.08673126668405783, 'tp_mult': 2.448568581469127, 'tsl_mult': 0.4475975164001973, 'strategy': 'breakout', 'time_stop': 53, 'use_sma': True, 'use_atr': True, 'use_adx': False, 'use_ema': True, 'use_spike': True, 'rsi_required': False, 'edge_k': 0.3117390936926342, 'edge_cap': 0.15996771104907032, 'bull_strategy': 'breakout', 'bull_bb_std_mult': 1.7961911010649099, 'bull_rsi_os': 31, 'bull_rsi_ob': 71, 'bull_adx_thresh': 23.642591340586954, 'bull_atr_min_pct': 0.002620018482878629, 'bull_atr_max_pct': 0.14759911082512422, 'bull_tp_mult': 1.6916649777414927, 'bull_tsl_mult': 0.5336013783294314, 'bull_time_stop': 69, 'bull_use_sma': True, 'bull_use_ema': True, 'bull_use_atr': True, 'bull_use_adx': False, 'bull_use_spike': True, 'bull_rsi_required': True, 'bear_strategy': 'breakout', 'bear_bb_std_mult': 1.9288242455775566, 'bear_rsi_os': 40, 'bear_rsi_ob': 72, 'bear_adx_thresh': 33.346448244247966, 'bear_atr_min_pct': 0.00821145583416193, 'bear_atr_max_pct': 0.08530658102911683, 'bear_tp_mult': 2.824403336073938, 'bear_tsl_mult': 0.9113696424601014, 'bear_time_stop': 47, 'bear_use_sma': False, 'bear_use_ema': True, 'bear_use_atr': False, 'bear_use_adx': False, 'bear_use_spike': True, 'bear_rsi_required': False, 'sideways_strategy': 'breakout', 'sideways_bb_std_mult': 2.643477463632064, 'sideways_rsi_os': 34, 'sideways_rsi_ob': 61, 'sideways_adx_thresh': 25.347970544028456, 'sideways_atr_min_pct': 0.025298667753169725, 'sideways_atr_max_pct': 0.13582730921647274, 'sideways_tp_mult': 2.0033032942299807, 'sideways_tsl_mult': 0.7165537648404735, 'sideways_time_stop': 32, 'sideways_use_sma': False, 'sideways_use_ema': False, 'sideways_use_atr': False, 'sideways_use_adx': True, 'sideways_use_spike': True, 'sideways_rsi_required': True}.
[I 2025-08-31 10:31:22,056] Trial 283 finished with values: [-1000000000.0, 1000000000.0] and parameters: {'p_sma': 20, 'p_std': 21, 'p_atr': 29, 'p_adx': 9, 'rsi_period': 51, 'ema1': 16, 'ema2': 50, 'slip_atr_k': 0.015355257297577859, 'slip_spread_k': 0.6907434155740322, 'spread_hl_frac': 0.0048565834861039395, 'bb_std_mult': 0.7329343401694334, 'rsi_os': 26, 'rsi_ob': 75, 'vol_spike': 0.04881573071682077, 'adx_thresh': 19.187462504984644, 'atr_min_pct': 0.022266870153192776, 'atr_max_pct': 0.08716523234871211, 'tp_mult': 1.6694877229777505, 'tsl_mult': 0.23186341924629789, 'strategy': 'breakout', 'time_stop': 56, 'use_sma': True, 'use_atr': True, 'use_adx': False, 'use_ema': True, 'use_spike': True, 'rsi_required': False, 'edge_k': 0.22369926971891774, 'edge_cap': 0.5928515053777341, 'bull_strategy': 'breakout', 'bull_bb_std_mult': 0.8826554980420689, 'bull_rsi_os': 39, 'bull_rsi_ob': 73, 'bull_adx_thresh': 15.269333718714929, 'bull_atr_min_pct': 0.015485876332432605, 'bull_atr_max_pct': 0.14672073429617266, 'bull_tp_mult': 1.667796767713363, 'bull_tsl_mult': 0.5347038737266528, 'bull_time_stop': 21, 'bull_use_sma': True, 'bull_use_ema': True, 'bull_use_atr': False, 'bull_use_adx': False, 'bull_use_spike': True, 'bull_rsi_required': False, 'bear_strategy': 'mean_reversion', 'bear_bb_std_mult': 1.5489003464938371, 'bear_rsi_os': 40, 'bear_rsi_ob': 72, 'bear_adx_thresh': 14.787626750339228, 'bear_atr_min_pct': 0.008252354380057716, 'bear_atr_max_pct': 0.13926613347467603, 'bear_tp_mult': 2.787133581299406, 'bear_tsl_mult': 0.94105045169502, 'bear_time_stop': 26, 'bear_use_sma': True, 'bear_use_ema': True, 'bear_use_atr': True, 'bear_use_adx': False, 'bear_use_spike': True, 'bear_rsi_required': False, 'sideways_strategy': 'breakout', 'sideways_bb_std_mult': 0.5020439251557138, 'sideways_rsi_os': 8, 'sideways_rsi_ob': 85, 'sideways_adx_thresh': 20.498432721325614, 'sideways_atr_min_pct': 0.020781655240503807, 'sideways_atr_max_pct': 0.030728678390287194, 'sideways_tp_mult': 1.9382876033182408, 'sideways_tsl_mult': 0.19607146037379575, 'sideways_time_stop': 50, 'sideways_use_sma': False, 'sideways_use_ema': False, 'sideways_use_atr': False, 'sideways_use_adx': True, 'sideways_use_spike': True, 'sideways_rsi_required': True}.
[I 2025-08-31 10:31:22,346] Trial 282 finished with values: [-0.031255670650832124, 0.03092175917068858] and parameters: {'p_sma': 12, 'p_std': 23, 'p_atr': 28, 'p_adx': 9, 'rsi_period': 72, 'ema1': 16, 'ema2': 16, 'slip_atr_k': 0.14218412422785803, 'slip_spread_k': 0.8971125394314731, 'spread_hl_frac': 0.005173407881500801, 'bb_std_mult': 0.639531251874264, 'rsi_os': 26, 'rsi_ob': 72, 'vol_spike': 0.09073503432848269, 'adx_thresh': 29.069620832264214, 'atr_min_pct': 0.005750425990225439, 'atr_max_pct': 0.08854485139056634, 'tp_mult': 1.2226982165642828, 'tsl_mult': 0.30623182785020653, 'strategy': 'breakout', 'time_stop': 155, 'use_sma': True, 'use_atr': True, 'use_adx': False, 'use_ema': True, 'use_spike': True, 'rsi_required': False, 'edge_k': 0.23460413750245462, 'edge_cap': 0.5277105247289576, 'bull_strategy': 'breakout', 'bull_bb_std_mult': 2.630925479297729, 'bull_rsi_os': 39, 'bull_rsi_ob': 71, 'bull_adx_thresh': 21.203418489355542, 'bull_atr_min_pct': 0.006208910651005359, 'bull_atr_max_pct': 0.14759087075356986, 'bull_tp_mult': 1.6740525731664069, 'bull_tsl_mult': 0.39687171218286055, 'bull_time_stop': 188, 'bull_use_sma': True, 'bull_use_ema': True, 'bull_use_atr': True, 'bull_use_adx': False, 'bull_use_spike': True, 'bull_rsi_required': True, 'bear_strategy': 'breakout', 'bear_bb_std_mult': 0.7484583840577634, 'bear_rsi_os': 38, 'bear_rsi_ob': 68, 'bear_adx_thresh': 21.137755024962374, 'bear_atr_min_pct': 0.0021334064760650173, 'bear_atr_max_pct': 0.11737186651988099, 'bear_tp_mult': 2.7921067826931707, 'bear_tsl_mult': 0.456362958064499, 'bear_time_stop': 217, 'bear_use_sma': False, 'bear_use_ema': True, 'bear_use_atr': False, 'bear_use_adx': False, 'bear_use_spike': True, 'bear_rsi_required': False, 'sideways_strategy': 'breakout', 'sideways_bb_std_mult': 1.2909468970244742, 'sideways_rsi_os': 34, 'sideways_rsi_ob': 79, 'sideways_adx_thresh': 25.330698151040316, 'sideways_atr_min_pct': 0.026352365747625138, 'sideways_atr_max_pct': 0.03668457538742165, 'sideways_tp_mult': 1.5304649632773748, 'sideways_tsl_mult': 0.12760216211909284, 'sideways_time_stop': 32, 'sideways_use_sma': False, 'sideways_use_ema': False, 'sideways_use_atr': False, 'sideways_use_adx': True, 'sideways_use_spike': True, 'sideways_rsi_required': True}.
[I 2025-08-31 10:31:22,615] Trial 284 finished with values: [-0.026555013167804287, 0.02646752836171355] and parameters: {'p_sma': 12, 'p_std': 21, 'p_atr': 29, 'p_adx': 9, 'rsi_period': 50, 'ema1': 16, 'ema2': 22, 'slip_atr_k': 0.029111859953017245, 'slip_spread_k': 0.9013288995886402, 'spread_hl_frac': 0.011805321119082425, 'bb_std_mult': 0.6420614015144079, 'rsi_os': 26, 'rsi_ob': 78, 'vol_spike': 0.050883042441282444, 'adx_thresh': 32.97254990226213, 'atr_min_pct': 0.0055494779323289585, 'atr_max_pct': 0.09001669587399312, 'tp_mult': 1.169120503501864, 'tsl_mult': 0.40152899369183515, 'strategy': 'breakout', 'time_stop': 223, 'use_sma': True, 'use_atr': True, 'use_adx': False, 'use_ema': True, 'use_spike': True, 'rsi_required': False, 'edge_k': 0.3010913793149146, 'edge_cap': 0.5234935543087955, 'bull_strategy': 'breakout', 'bull_bb_std_mult': 3.307060999272681, 'bull_rsi_os': 26, 'bull_rsi_ob': 72, 'bull_adx_thresh': 15.207778116834692, 'bull_atr_min_pct': 0.001028307256601623, 'bull_atr_max_pct': 0.012321670879620689, 'bull_tp_mult': 1.6671434226767756, 'bull_tsl_mult': 0.7605557407513793, 'bull_time_stop': 85, 'bull_use_sma': True, 'bull_use_ema': True, 'bull_use_atr': False, 'bull_use_adx': False, 'bull_use_spike': True, 'bull_rsi_required': False, 'bear_strategy': 'mean_reversion', 'bear_bb_std_mult': 1.9053468687586341, 'bear_rsi_os': 40, 'bear_rsi_ob': 68, 'bear_adx_thresh': 15.11586483518897, 'bear_atr_min_pct': 0.008443777933048825, 'bear_atr_max_pct': 0.04346812304294486, 'bear_tp_mult': 2.7873998542386693, 'bear_tsl_mult': 0.5124510258144394, 'bear_time_stop': 57, 'bear_use_sma': True, 'bear_use_ema': True, 'bear_use_atr': True, 'bear_use_adx': False, 'bear_use_spike': True, 'bear_rsi_required': False, 'sideways_strategy': 'breakout', 'sideways_bb_std_mult': 1.6879852745980184, 'sideways_rsi_os': 20, 'sideways_rsi_ob': 79, 'sideways_adx_thresh': 20.046324429365335, 'sideways_atr_min_pct': 0.014575417394514444, 'sideways_atr_max_pct': 0.136847622336968, 'sideways_tp_mult': 1.9816640547747326, 'sideways_tsl_mult': 0.16021912584816117, 'sideways_time_stop': 49, 'sideways_use_sma': False, 'sideways_use_ema': False, 'sideways_use_atr': False, 'sideways_use_adx': True, 'sideways_use_spike': True, 'sideways_rsi_required': True}.
[I 2025-08-31 10:31:54,009] Trial 286 finished with values: [-1000000000.0, 1000000000.0] and parameters: {'p_sma': 5, 'p_std': 39, 'p_atr': 29, 'p_adx': 17, 'rsi_period': 50, 'ema1': 30, 'ema2': 56, 'slip_atr_k': 0.17727109967262422, 'slip_spread_k': 0.6695890330755074, 'spread_hl_frac': 0.014448070163303371, 'bb_std_mult': 0.6519147122250133, 'rsi_os': 27, 'rsi_ob': 63, 'vol_spike': 0.18146456865186852, 'adx_thresh': 25.39378170913042, 'atr_min_pct': 0.005668501434646547, 'atr_max_pct': 0.0893403989327862, 'tp_mult': 1.204205538429449, 'tsl_mult': 0.9356526113755279, 'strategy': 'mean_reversion', 'time_stop': 223, 'use_sma': True, 'use_atr': False, 'use_adx': True, 'use_ema': True, 'use_spike': False, 'rsi_required': True, 'edge_k': 0.16822357115000236, 'edge_cap': 0.5191533916374897, 'bull_strategy': 'breakout', 'bull_bb_std_mult': 2.5462540786885466, 'bull_rsi_os': 18, 'bull_rsi_ob': 72, 'bull_adx_thresh': 31.596161507098905, 'bull_atr_min_pct': 0.028170253450406864, 'bull_atr_max_pct': 0.14012220058119967, 'bull_tp_mult': 1.6279864339868324, 'bull_tsl_mult': 0.43064134190483605, 'bull_time_stop': 83, 'bull_use_sma': False, 'bull_use_ema': False, 'bull_use_atr': True, 'bull_use_adx': False, 'bull_use_spike': True, 'bull_rsi_required': True, 'bear_strategy': 'breakout', 'bear_bb_std_mult': 1.055862471903621, 'bear_rsi_os': 38, 'bear_rsi_ob': 68, 'bear_adx_thresh': 15.432403492714633, 'bear_atr_min_pct': 0.001874729956699709, 'bear_atr_max_pct': 0.07941021331675172, 'bear_tp_mult': 2.7635352729869753, 'bear_tsl_mult': 0.3200763318671827, 'bear_time_stop': 217, 'bear_use_sma': False, 'bear_use_ema': True, 'bear_use_atr': False, 'bear_use_adx': False, 'bear_use_spike': True, 'bear_rsi_required': False, 'sideways_strategy': 'mean_reversion', 'sideways_bb_std_mult': 2.7950339221048646, 'sideways_rsi_os': 20, 'sideways_rsi_ob': 69, 'sideways_adx_thresh': 18.59946863929106, 'sideways_atr_min_pct': 0.0042665211479099695, 'sideways_atr_max_pct': 0.12953283612601338, 'sideways_tp_mult': 1.4252367428854116, 'sideways_tsl_mult': 0.00018404319567422167, 'sideways_time_stop': 40, 'sideways_use_sma': True, 'sideways_use_ema': False, 'sideways_use_atr': False, 'sideways_use_adx': True, 'sideways_use_spike': True, 'sideways_rsi_required': True}.
[I 2025-08-31 10:31:54,010] Trial 288 finished with values: [-0.046735072096353525, 0.04661538996595687] and parameters: {'p_sma': 42, 'p_std': 41, 'p_atr': 30, 'p_adx': 18, 'rsi_period': 46, 'ema1': 22, 'ema2': 56, 'slip_atr_k': 0.044787764856096826, 'slip_spread_k': 0.4875417114443687, 'spread_hl_frac': 0.014198916989046744, 'bb_std_mult': 0.7043172504965292, 'rsi_os': 27, 'rsi_ob': 90, 'vol_spike': 0.16356988996908425, 'adx_thresh': 28.580195351591914, 'atr_min_pct': 0.004205534857807903, 'atr_max_pct': 0.012989605427723303, 'tp_mult': 2.9101634622474317, 'tsl_mult': 0.5920194143355082, 'strategy': 'mean_reversion', 'time_stop': 208, 'use_sma': False, 'use_atr': False, 'use_adx': True, 'use_ema': True, 'use_spike': False, 'rsi_required': True, 'edge_k': 0.1681006979283966, 'edge_cap': 0.2966885793321863, 'bull_strategy': 'breakout', 'bull_bb_std_mult': 2.125296605467898, 'bull_rsi_os': 18, 'bull_rsi_ob': 73, 'bull_adx_thresh': 24.852792633240263, 'bull_atr_min_pct': 1.2462048641443497e-05, 'bull_atr_max_pct': 0.13927869222279712, 'bull_tp_mult': 1.6259334322649264, 'bull_tsl_mult': 0.42145385310857636, 'bull_time_stop': 74, 'bull_use_sma': False, 'bull_use_ema': False, 'bull_use_atr': True, 'bull_use_adx': True, 'bull_use_spike': True, 'bull_rsi_required': True, 'bear_strategy': 'breakout', 'bear_bb_std_mult': 1.047269696303785, 'bear_rsi_os': 38, 'bear_rsi_ob': 57, 'bear_adx_thresh': 15.728063177598047, 'bear_atr_min_pct': 0.0030987972269350484, 'bear_atr_max_pct': 0.09095218295700143, 'bear_tp_mult': 2.7508078282045716, 'bear_tsl_mult': 0.5325207959924566, 'bear_time_stop': 35, 'bear_use_sma': False, 'bear_use_ema': True, 'bear_use_atr': False, 'bear_use_adx': False, 'bear_use_spike': False, 'bear_rsi_required': False, 'sideways_strategy': 'mean_reversion', 'sideways_bb_std_mult': 2.7720616384568504, 'sideways_rsi_os': 37, 'sideways_rsi_ob': 66, 'sideways_adx_thresh': 11.143367899090798, 'sideways_atr_min_pct': 0.004006637618735496, 'sideways_atr_max_pct': 0.14968171507107325, 'sideways_tp_mult': 2.0678254131735407, 'sideways_tsl_mult': 0.9260888739714996, 'sideways_time_stop': 14, 'sideways_use_sma': True, 'sideways_use_ema': False, 'sideways_use_atr': False, 'sideways_use_adx': True, 'sideways_use_spike': False, 'sideways_rsi_required': True}.
[I 2025-08-31 10:31:54,674] Trial 287 finished with values: [-1000000000.0, 1000000000.0] and parameters: {'p_sma': 5, 'p_std': 40, 'p_atr': 14, 'p_adx': 17, 'rsi_period': 46, 'ema1': 30, 'ema2': 52, 'slip_atr_k': 0.04381733164675174, 'slip_spread_k': 0.48663290069288284, 'spread_hl_frac': 0.01427084475542579, 'bb_std_mult': 2.0672492016918205, 'rsi_os': 27, 'rsi_ob': 78, 'vol_spike': 0.1649472459852713, 'adx_thresh': 27.682526819294882, 'atr_min_pct': 0.0051353912007774385, 'atr_max_pct': 0.09156958208481009, 'tp_mult': 1.350956849249849, 'tsl_mult': 0.617115344958697, 'strategy': 'mean_reversion', 'time_stop': 224, 'use_sma': False, 'use_atr': False, 'use_adx': True, 'use_ema': True, 'use_spike': False, 'rsi_required': True, 'edge_k': 0.08561238747013786, 'edge_cap': 0.8810937948014333, 'bull_strategy': 'breakout', 'bull_bb_std_mult': 1.0404108290173273, 'bull_rsi_os': 18, 'bull_rsi_ob': 74, 'bull_adx_thresh': 24.66491801284396, 'bull_atr_min_pct': 0.0010783014960677275, 'bull_atr_max_pct': 0.13956711737492672, 'bull_tp_mult': 1.7504988621985869, 'bull_tsl_mult': 0.42764579795116175, 'bull_time_stop': 83, 'bull_use_sma': False, 'bull_use_ema': False, 'bull_use_atr': True, 'bull_use_adx': False, 'bull_use_spike': True, 'bull_rsi_required': True, 'bear_strategy': 'breakout', 'bear_bb_std_mult': 3.0796762557735615, 'bear_rsi_os': 36, 'bear_rsi_ob': 57, 'bear_adx_thresh': 22.87171886163907, 'bear_atr_min_pct': 0.003224566885587541, 'bear_atr_max_pct': 0.0791218678375008, 'bear_tp_mult': 2.747186611445787, 'bear_tsl_mult': 0.5031294709803575, 'bear_time_stop': 55, 'bear_use_sma': True, 'bear_use_ema': True, 'bear_use_atr': False, 'bear_use_adx': False, 'bear_use_spike': False, 'bear_rsi_required': False, 'sideways_strategy': 'mean_reversion', 'sideways_bb_std_mult': 1.7114558484197917, 'sideways_rsi_os': 15, 'sideways_rsi_ob': 83, 'sideways_adx_thresh': 18.56983324756932, 'sideways_atr_min_pct': 0.004076377901066623, 'sideways_atr_max_pct': 0.12955189468929834, 'sideways_tp_mult': 1.3875190993845217, 'sideways_tsl_mult': 0.1600793549945021, 'sideways_time_stop': 40, 'sideways_use_sma': True, 'sideways_use_ema': False, 'sideways_use_atr': False, 'sideways_use_adx': True, 'sideways_use_spike': True, 'sideways_rsi_required': True}.
