[I 2025-08-31 10:24:50,524] Trial 234 finished with values: [-1000000000.0, 1000000000.0] and parameters: {'p_sma': 12, 'p_std': 26, 'p_atr': 30, 'p_adx': 19, 'rsi_period': 28, 'ema1': 17, 'ema2': 47, 'slip_atr_k': 0.017782668264095507, 'slip_spread_k': 0.6633563031543132, 'spread_hl_frac': 0.013846342695454567, 'bb_std_mult': 2.027902845418351, 'rsi_os': 23, 'rsi_ob': 72, 'vol_spike': 0.2740075414114357, 'adx_thresh': 28.101661269507254, 'atr_min_pct': 0.0056195548170039225, 'atr_max_pct': 0.11879726597589052, 'tp_mult': 1.0567646970824358, 'tsl_mult': 0.568518905984285, 'strategy': 'breakout', 'time_stop': 253, 'use_sma': True, 'use_atr': True, 'use_adx': False, 'use_ema': False, 'use_spike': False, 'rsi_required': False, 'edge_k': 0.07200022750838816, 'edge_cap': 0.809757063947853, 'bull_strategy': 'breakout', 'bull_bb_std_mult': 0.7238232127018486, 'bull_rsi_os': 17, 'bull_rsi_ob': 71, 'bull_adx_thresh': 18.89731689938309, 'bull_atr_min_pct': 0.015950063801447385, 'bull_atr_max_pct': 0.07248785245819395, 'bull_tp_mult': 2.4174200196140245, 'bull_tsl_mult': 0.6840708301290588, 'bull_time_stop': 29, 'bull_use_sma': True, 'bull_use_ema': True, 'bull_use_atr': True, 'bull_use_adx': False, 'bull_use_spike': True, 'bull_rsi_required': False, 'bear_strategy': 'breakout', 'bear_bb_std_mult': 1.1853353093431074, 'bear_rsi_os': 32, 'bear_rsi_ob': 86, 'bear_adx_thresh': 32.882298872483595, 'bear_atr_min_pct': 0.0035299041786813626, 'bear_atr_max_pct': 0.041168528843003496, 'bear_tp_mult': 2.7713493293597207, 'bear_tsl_mult': 0.7024971034704655, 'bear_time_stop': 48, 'bear_use_sma': True, 'bear_use_ema': True, 'bear_use_atr': True, 'bear_use_adx': True, 'bear_use_spike': True, 'bear_rsi_required': False, 'sideways_strategy': 'breakout', 'sideways_bb_std_mult': 1.2121792018504955, 'sideways_rsi_os': 17, 'sideways_rsi_ob': 48, 'sideways_adx_thresh': 10.341774371454319, 'sideways_atr_min_pct': 0.004944832553587465, 'sideways_atr_max_pct': 0.04488709079598796, 'sideways_tp_mult': 1.1720909429651554, 'sideways_tsl_mult': 0.9775602167818753, 'sideways_time_stop': 37, 'sideways_use_sma': False, 'sideways_use_ema': False, 'sideways_use_atr': False, 'sideways_use_adx': True, 'sideways_use_spike': False, 'sideways_rsi_required': False}.
[I 2025-08-31 10:24:50,916] Trial 235 finished with values: [-1000000000.0, 1000000000.0] and parameters: {'p_sma': 13, 'p_std': 26, 'p_atr': 24, 'p_adx': 22, 'rsi_period': 43, 'ema1': 17, 'ema2': 46, 'slip_atr_k': 0.1472151650901449, 'slip_spread_k': 0.6748850201279527, 'spread_hl_frac': 0.027627710756284212, 'bb_std_mult': 2.1880784954987518, 'rsi_os': 21, 'rsi_ob': 47, 'vol_spike': 0.2047016778509053, 'adx_thresh': 30.331700794633665, 'atr_min_pct': 0.005699859922892044, 'atr_max_pct': 0.10053353600641418, 'tp_mult': 2.437881572826517, 'tsl_mult': 0.5974468647867616, 'strategy': 'breakout', 'time_stop': 61, 'use_sma': True, 'use_atr': True, 'use_adx': False, 'use_ema': True, 'use_spike': True, 'rsi_required': False, 'edge_k': 1.6462629064824728, 'edge_cap': 0.824386513547362, 'bull_strategy': 'breakout', 'bull_bb_std_mult': 0.8540666379623738, 'bull_rsi_os': 41, 'bull_rsi_ob': 76, 'bull_adx_thresh': 25.273273692997677, 'bull_atr_min_pct': 0.001126856881504188, 'bull_atr_max_pct': 0.13149170983685246, 'bull_tp_mult': 1.9297271391889332, 'bull_tsl_mult': 0.03659184904552942, 'bull_time_stop': 195, 'bull_use_sma': True, 'bull_use_ema': True, 'bull_use_atr': True, 'bull_use_adx': False, 'bull_use_spike': False, 'bull_rsi_required': True, 'bear_strategy': 'breakout', 'bear_bb_std_mult': 1.1743037349766254, 'bear_rsi_os': 30, 'bear_rsi_ob': 85, 'bear_adx_thresh': 34.383495817918906, 'bear_atr_min_pct': 0.0029883309281041786, 'bear_atr_max_pct': 0.12088378552001428, 'bear_tp_mult': 2.701375862680001, 'bear_tsl_mult': 0.5262973893730193, 'bear_time_stop': 48, 'bear_use_sma': False, 'bear_use_ema': True, 'bear_use_atr': False, 'bear_use_adx': False, 'bear_use_spike': True, 'bear_rsi_required': False, 'sideways_strategy': 'breakout', 'sideways_bb_std_mult': 2.1208946922519383, 'sideways_rsi_os': 37, 'sideways_rsi_ob': 80, 'sideways_adx_thresh': 10.405027179102238, 'sideways_atr_min_pct': 0.004980600631659121, 'sideways_atr_max_pct': 0.03813348667038214, 'sideways_tp_mult': 1.9625723760888012, 'sideways_tsl_mult': 0.5712664584577529, 'sideways_time_stop': 37, 'sideways_use_sma': False, 'sideways_use_ema': False, 'sideways_use_atr': False, 'sideways_use_adx': True, 'sideways_use_spike': True, 'sideways_rsi_required': True}.
[I 2025-08-31 10:25:22,636] Trial 239 finished with values: [-1000000000.0, 1000000000.0] and parameters: {'p_sma': 14, 'p_std': 24, 'p_atr': 29, 'p_adx': 13, 'rsi_period': 45, 'ema1': 15, 'ema2': 53, 'slip_atr_k': 0.03267084162111649, 'slip_spread_k': 0.6387334508090591, 'spread_hl_frac': 0.0039466515939069816, 'bb_std_mult': 0.5742030095260757, 'rsi_os': 25, 'rsi_ob': 74, 'vol_spike': 0.27072451597913655, 'adx_thresh': 10.285874640394228, 'atr_min_pct': 0.014011647331065571, 'atr_max_pct': 0.05742495632536625, 'tp_mult': 1.1277712912022497, 'tsl_mult': 0.6360495324859077, 'strategy': 'breakout', 'time_stop': 43, 'use_sma': True, 'use_atr': False, 'use_adx': True, 'use_ema': True, 'use_spike': True, 'rsi_required': False, 'edge_k': 1.74291715561254, 'edge_cap': 0.5065711233794301, 'bull_strategy': 'breakout', 'bull_bb_std_mult': 0.9791645647376922, 'bull_rsi_os': 41, 'bull_rsi_ob': 68, 'bull_adx_thresh': 25.14365047736339, 'bull_atr_min_pct': 0.018211513325863966, 'bull_atr_max_pct': 0.14747275838874438, 'bull_tp_mult': 1.9946543253828009, 'bull_tsl_mult': 0.9485711056287054, 'bull_time_stop': 93, 'bull_use_sma': False, 'bull_use_ema': True, 'bull_use_atr': True, 'bull_use_adx': False, 'bull_use_spike': True, 'bull_rsi_required': True, 'bear_strategy': 'breakout', 'bear_bb_std_mult': 1.2613920038435043, 'bear_rsi_os': 17, 'bear_rsi_ob': 69, 'bear_adx_thresh': 16.365489125954394, 'bear_atr_min_pct': 0.021315255714472216, 'bear_atr_max_pct': 0.08128509879984794, 'bear_tp_mult': 1.5462064704950413, 'bear_tsl_mult': 0.30101771155874235, 'bear_time_stop': 210, 'bear_use_sma': False, 'bear_use_ema': True, 'bear_use_atr': False, 'bear_use_adx': False, 'bear_use_spike': True, 'bear_rsi_required': False, 'sideways_strategy': 'breakout', 'sideways_bb_std_mult': 2.853427245120214, 'sideways_rsi_os': 17, 'sideways_rsi_ob': 45, 'sideways_adx_thresh': 15.272967797304034, 'sideways_atr_min_pct': 0.004125329391456885, 'sideways_atr_max_pct': 0.03265091088988224, 'sideways_tp_mult': 2.0326609302720478, 'sideways_tsl_mult': 0.13718586371377775, 'sideways_time_stop': 23, 'sideways_use_sma': False, 'sideways_use_ema': False, 'sideways_use_atr': False, 'sideways_use_adx': True, 'sideways_use_spike': True, 'sideways_rsi_required': True}.
[I 2025-08-31 10:25:22,807] Trial 238 finished with values: [-1000000000.0, 1000000000.0] and parameters: {'p_sma': 13, 'p_std': 24, 'p_atr': 29, 'p_adx': 13, 'rsi_period': 43, 'ema1': 15, 'ema2': 54, 'slip_atr_k': 0.019714871592009388, 'slip_spread_k': 0.6819839769496923, 'spread_hl_frac': 0.0033064032029686413, 'bb_std_mult': 0.5623389253603279, 'rsi_os': 34, 'rsi_ob': 74, 'vol_spike': 0.2736310098946336, 'adx_thresh': 30.28982259890954, 'atr_min_pct': 0.021840088532027877, 'atr_max_pct': 0.09312769441265199, 'tp_mult': 1.125790292227037, 'tsl_mult': 0.5530353491764224, 'strategy': 'breakout', 'time_stop': 140, 'use_sma': True, 'use_atr': False, 'use_adx': True, 'use_ema': True, 'use_spike': True, 'rsi_required': False, 'edge_k': 1.7464476588435447, 'edge_cap': 0.4415359239015335, 'bull_strategy': 'breakout', 'bull_bb_std_mult': 0.8435543326864234, 'bull_rsi_os': 41, 'bull_rsi_ob': 67, 'bull_adx_thresh': 25.28070100138498, 'bull_atr_min_pct': 0.01806250773638073, 'bull_atr_max_pct': 0.14445099746027648, 'bull_tp_mult': 1.5414888860962557, 'bull_tsl_mult': 0.037143587124535915, 'bull_time_stop': 95, 'bull_use_sma': False, 'bull_use_ema': True, 'bull_use_atr': True, 'bull_use_adx': False, 'bull_use_spike': True, 'bull_rsi_required': True, 'bear_strategy': 'breakout', 'bear_bb_std_mult': 1.268629955558066, 'bear_rsi_os': 38, 'bear_rsi_ob': 69, 'bear_adx_thresh': 11.80806812160262, 'bear_atr_min_pct': 0.020977644776088065, 'bear_atr_max_pct': 0.08156574041854464, 'bear_tp_mult': 1.9263763666355287, 'bear_tsl_mult': 0.933403546205321, 'bear_time_stop': 53, 'bear_use_sma': False, 'bear_use_ema': True, 'bear_use_atr': False, 'bear_use_adx': False, 'bear_use_spike': True, 'bear_rsi_required': False, 'sideways_strategy': 'breakout', 'sideways_bb_std_mult': 2.8197233453853405, 'sideways_rsi_os': 7, 'sideways_rsi_ob': 92, 'sideways_adx_thresh': 19.35515710889601, 'sideways_atr_min_pct': 0.0041191658506148175, 'sideways_atr_max_pct': 0.061802619378346996, 'sideways_tp_mult': 1.3487380009265495, 'sideways_tsl_mult': 0.14851981928369024, 'sideways_time_stop': 23, 'sideways_use_sma': False, 'sideways_use_ema': False, 'sideways_use_atr': False, 'sideways_use_adx': True, 'sideways_use_spike': True, 'sideways_rsi_required': True}.
[I 2025-08-31 10:25:22,839] Trial 237 finished with values: [-1000000000.0, 1000000000.0] and parameters: {'p_sma': 14, 'p_std': 25, 'p_atr': 13, 'p_adx': 19, 'rsi_period': 44, 'ema1': 16, 'ema2': 53, 'slip_atr_k': 0.018679793104974224, 'slip_spread_k': 0.6528224516787264, 'spread_hl_frac': 0.0032148483652748756, 'bb_std_mult': 0.586993332157167, 'rsi_os': 25, 'rsi_ob': 72, 'vol_spike': 0.274082068181221, 'adx_thresh': 20.080625015730554, 'atr_min_pct': 0.0242835216931194, 'atr_max_pct': 0.057738771177941794, 'tp_mult': 2.4355780272472467, 'tsl_mult': 0.5522501311851908, 'strategy': 'breakout', 'time_stop': 218, 'use_sma': True, 'use_atr': True, 'use_adx': False, 'use_ema': True, 'use_spike': True, 'rsi_required': False, 'edge_k': 0.5494670250529943, 'edge_cap': 0.6971718682654502, 'bull_strategy': 'breakout', 'bull_bb_std_mult': 0.968809218625158, 'bull_rsi_os': 41, 'bull_rsi_ob': 67, 'bull_adx_thresh': 25.348322910505985, 'bull_atr_min_pct': 0.014823534760094995, 'bull_atr_max_pct': 0.14584537150677673, 'bull_tp_mult': 1.923627712786136, 'bull_tsl_mult': 0.4029457214218478, 'bull_time_stop': 97, 'bull_use_sma': True, 'bull_use_ema': True, 'bull_use_atr': True, 'bull_use_adx': False, 'bull_use_spike': True, 'bull_rsi_required': True, 'bear_strategy': 'breakout', 'bear_bb_std_mult': 1.1866009872229337, 'bear_rsi_os': 32, 'bear_rsi_ob': 86, 'bear_adx_thresh': 16.171541111659828, 'bear_atr_min_pct': 0.005719362086977002, 'bear_atr_max_pct': 0.08137270434676644, 'bear_tp_mult': 2.8211105108210353, 'bear_tsl_mult': 0.5250118702436366, 'bear_time_stop': 47, 'bear_use_sma': False, 'bear_use_ema': True, 'bear_use_atr': False, 'bear_use_adx': False, 'bear_use_spike': True, 'bear_rsi_required': False, 'sideways_strategy': 'breakout', 'sideways_bb_std_mult': 2.822519788221185, 'sideways_rsi_os': 17, 'sideways_rsi_ob': 46, 'sideways_adx_thresh': 19.3592895336292, 'sideways_atr_min_pct': 0.004168911169288307, 'sideways_atr_max_pct': 0.03784344924464383, 'sideways_tp_mult': 1.8210605966083917, 'sideways_tsl_mult': 0.5917966708061215, 'sideways_time_stop': 22, 'sideways_use_sma': False, 'sideways_use_ema': False, 'sideways_use_atr': False, 'sideways_use_adx': True, 'sideways_use_spike': True, 'sideways_rsi_required': True}.
[I 2025-08-31 10:25:22,985] Trial 236 finished with values: [-1000000000.0, 1000000000.0] and parameters: {'p_sma': 13, 'p_std': 24, 'p_atr': 13, 'p_adx': 19, 'rsi_period': 45, 'ema1': 15, 'ema2': 46, 'slip_atr_k': 0.01984500341724344, 'slip_spread_k': 0.6867643061812839, 'spread_hl_frac': 0.027611951712174072, 'bb_std_mult': 0.5660995786470162, 'rsi_os': 34, 'rsi_ob': 72, 'vol_spike': 0.2748747900634971, 'adx_thresh': 5.770216072626335, 'atr_min_pct': 0.00566772047789733, 'atr_max_pct': 0.03680201102043573, 'tp_mult': 1.3173119598748733, 'tsl_mult': 0.5555559455666288, 'strategy': 'breakout', 'time_stop': 253, 'use_sma': True, 'use_atr': True, 'use_adx': False, 'use_ema': True, 'use_spike': True, 'rsi_required': False, 'edge_k': 0.4865023389624552, 'edge_cap': 0.09162005087117425, 'bull_strategy': 'breakout', 'bull_bb_std_mult': 0.8673565525142946, 'bull_rsi_os': 41, 'bull_rsi_ob': 76, 'bull_adx_thresh': 25.36017586971352, 'bull_atr_min_pct': 0.018205010380259862, 'bull_atr_max_pct': 0.07231703446276594, 'bull_tp_mult': 1.934196180284913, 'bull_tsl_mult': 0.041545201325447645, 'bull_time_stop': 52, 'bull_use_sma': True, 'bull_use_ema': True, 'bull_use_atr': True, 'bull_use_adx': False, 'bull_use_spike': True, 'bull_rsi_required': True, 'bear_strategy': 'breakout', 'bear_bb_std_mult': 1.2110986945247622, 'bear_rsi_os': 5, 'bear_rsi_ob': 86, 'bear_adx_thresh': 16.164517291948655, 'bear_atr_min_pct': 0.019924812454806044, 'bear_atr_max_pct': 0.08186028286292074, 'bear_tp_mult': 2.701222733957401, 'bear_tsl_mult': 0.5282367007066282, 'bear_time_stop': 46, 'bear_use_sma': True, 'bear_use_ema': True, 'bear_use_atr': False, 'bear_use_adx': False, 'bear_use_spike': True, 'bear_rsi_required': False, 'sideways_strategy': 'breakout', 'sideways_bb_std_mult': 2.9914372995661678, 'sideways_rsi_os': 53, 'sideways_rsi_ob': 56, 'sideways_adx_thresh': 12.144958296510872, 'sideways_atr_min_pct': 0.004353605268172324, 'sideways_atr_max_pct': 0.022696075179167323, 'sideways_tp_mult': 1.350262359706619, 'sideways_tsl_mult': 0.1467687619744369, 'sideways_time_stop': 23, 'sideways_use_sma': False, 'sideways_use_ema': False, 'sideways_use_atr': False, 'sideways_use_adx': True, 'sideways_use_spike': True, 'sideways_rsi_required': True}.
[I 2025-08-31 10:25:55,145] Trial 240 finished with values: [-1000000000.0, 1000000000.0] and parameters: {'p_sma': 12, 'p_std': 24, 'p_atr': 29, 'p_adx': 23, 'rsi_period': 45, 'ema1': 25, 'ema2': 56, 'slip_atr_k': 0.01930731414983318, 'slip_spread_k': 0.567921758598493, 'spread_hl_frac': 0.011413777563535843, 'bb_std_mult': 0.7475755578823022, 'rsi_os': 33, 'rsi_ob': 61, 'vol_spike': 0.08133220464517403, 'adx_thresh': 29.015780771510116, 'atr_min_pct': 0.004869715671864269, 'atr_max_pct': 0.09247157371746934, 'tp_mult': 2.456956271528012, 'tsl_mult': 0.5551767358492148, 'strategy': 'breakout', 'time_stop': 221, 'use_sma': True, 'use_atr': True, 'use_adx': False, 'use_ema': True, 'use_spike': True, 'rsi_required': False, 'edge_k': 0.17319547354263365, 'edge_cap': 0.8766382049253159, 'bull_strategy': 'breakout', 'bull_bb_std_mult': 0.9029952549950987, 'bull_rsi_os': 38, 'bull_rsi_ob': 67, 'bull_adx_thresh': 24.75132544984185, 'bull_atr_min_pct': 0.0017862080108462762, 'bull_atr_max_pct': 0.14440195010576665, 'bull_tp_mult': 1.545547423716628, 'bull_tsl_mult': 0.4117838967759392, 'bull_time_stop': 102, 'bull_use_sma': True, 'bull_use_ema': True, 'bull_use_atr': True, 'bull_use_adx': False, 'bull_use_spike': True, 'bull_rsi_required': True, 'bear_strategy': 'breakout', 'bear_bb_std_mult': 1.1283955523277278, 'bear_rsi_os': 38, 'bear_rsi_ob': 70, 'bear_adx_thresh': 15.000212599371775, 'bear_atr_min_pct': 0.004598933946220175, 'bear_atr_max_pct': 0.050324507297798415, 'bear_tp_mult': 2.843944408277942, 'bear_tsl_mult': 0.23268139279354388, 'bear_time_stop': 45, 'bear_use_sma': False, 'bear_use_ema': True, 'bear_use_atr': False, 'bear_use_adx': False, 'bear_use_spike': True, 'bear_rsi_required': False, 'sideways_strategy': 'breakout', 'sideways_bb_std_mult': 2.9704452082036816, 'sideways_rsi_os': 18, 'sideways_rsi_ob': 71, 'sideways_adx_thresh': 23.618050017203107, 'sideways_atr_min_pct': 0.005704399582880388, 'sideways_atr_max_pct': 0.036953760458971294, 'sideways_tp_mult': 1.828057328642423, 'sideways_tsl_mult': 0.6068458794405328, 'sideways_time_stop': 148, 'sideways_use_sma': False, 'sideways_use_ema': False, 'sideways_use_atr': False, 'sideways_use_adx': False, 'sideways_use_spike': True, 'sideways_rsi_required': True}.
[I 2025-08-31 10:25:55,556] Trial 242 finished with values: [-1000000000.0, 1000000000.0] and parameters: {'p_sma': 16, 'p_std': 28, 'p_atr': 30, 'p_adx': 23, 'rsi_period': 64, 'ema1': 16, 'ema2': 57, 'slip_atr_k': 0.1846185768956837, 'slip_spread_k': 0.5605129194736761, 'spread_hl_frac': 0.011691639533574683, 'bb_std_mult': 0.7483315994780134, 'rsi_os': 31, 'rsi_ob': 75, 'vol_spike': 0.08247899851100333, 'adx_thresh': 28.974256758313338, 'atr_min_pct': 0.006871357148832922, 'atr_max_pct': 0.10816318666002667, 'tp_mult': 2.4681276824421636, 'tsl_mult': 0.06021892130522599, 'strategy': 'breakout', 'time_stop': 94, 'use_sma': True, 'use_atr': True, 'use_adx': False, 'use_ema': False, 'use_spike': True, 'rsi_required': False, 'edge_k': 0.15694926654554558, 'edge_cap': 0.09859574729924969, 'bull_strategy': 'breakout', 'bull_bb_std_mult': 0.8816626653324743, 'bull_rsi_os': 38, 'bull_rsi_ob': 77, 'bull_adx_thresh': 24.558234724600695, 'bull_atr_min_pct': 0.013194099907123946, 'bull_atr_max_pct': 0.06909195988289851, 'bull_tp_mult': 1.6880232726378586, 'bull_tsl_mult': 0.4055402415522928, 'bull_time_stop': 86, 'bull_use_sma': True, 'bull_use_ema': True, 'bull_use_atr': True, 'bull_use_adx': False, 'bull_use_spike': True, 'bull_rsi_required': True, 'bear_strategy': 'breakout', 'bear_bb_std_mult': 2.1343067982398645, 'bear_rsi_os': 14, 'bear_rsi_ob': 72, 'bear_adx_thresh': 14.652516913125208, 'bear_atr_min_pct': 0.004416425002765443, 'bear_atr_max_pct': 0.07867973794852594, 'bear_tp_mult': 2.616067214992626, 'bear_tsl_mult': 0.5531206872303522, 'bear_time_stop': 123, 'bear_use_sma': False, 'bear_use_ema': True, 'bear_use_atr': False, 'bear_use_adx': True, 'bear_use_spike': True, 'bear_rsi_required': False, 'sideways_strategy': 'breakout', 'sideways_bb_std_mult': 2.970365840815444, 'sideways_rsi_os': 19, 'sideways_rsi_ob': 73, 'sideways_adx_thresh': 23.50650855389231, 'sideways_atr_min_pct': 0.0058890758346728375, 'sideways_atr_max_pct': 0.04055059299600691, 'sideways_tp_mult': 1.9866264351712066, 'sideways_tsl_mult': 0.11540577928291029, 'sideways_time_stop': 45, 'sideways_use_sma': False, 'sideways_use_ema': False, 'sideways_use_atr': False, 'sideways_use_adx': False, 'sideways_use_spike': True, 'sideways_rsi_required': False}.
[I 2025-08-31 10:25:55,698] Trial 241 finished with values: [-1000000000.0, 1000000000.0] and parameters: {'p_sma': 16, 'p_std': 28, 'p_atr': 30, 'p_adx': 20, 'rsi_period': 45, 'ema1': 16, 'ema2': 56, 'slip_atr_k': 0.23531709616272692, 'slip_spread_k': 0.6147778176069967, 'spread_hl_frac': 0.007574149272230945, 'bb_std_mult': 2.2831818421244225, 'rsi_os': 23, 'rsi_ob': 60, 'vol_spike': 0.2598732159586075, 'adx_thresh': 28.72737461190155, 'atr_min_pct': 5.5120082886368424e-05, 'atr_max_pct': 0.08439128285991321, 'tp_mult': 1.3122718208469837, 'tsl_mult': 0.07422169933739153, 'strategy': 'breakout', 'time_stop': 75, 'use_sma': True, 'use_atr': True, 'use_adx': False, 'use_ema': False, 'use_spike': True, 'rsi_required': False, 'edge_k': 0.1661327563028733, 'edge_cap': 0.9614192701258774, 'bull_strategy': 'breakout', 'bull_bb_std_mult': 0.9023192271068934, 'bull_rsi_os': 50, 'bull_rsi_ob': 91, 'bull_adx_thresh': 8.635331077610328, 'bull_atr_min_pct': 0.007157061063089958, 'bull_atr_max_pct': 0.13817853300095545, 'bull_tp_mult': 1.688451064915962, 'bull_tsl_mult': 0.401822701934747, 'bull_time_stop': 169, 'bull_use_sma': True, 'bull_use_ema': True, 'bull_use_atr': True, 'bull_use_adx': False, 'bull_use_spike': True, 'bull_rsi_required': True, 'bear_strategy': 'breakout', 'bear_bb_std_mult': 1.096317728367381, 'bear_rsi_os': 41, 'bear_rsi_ob': 45, 'bear_adx_thresh': 14.392288036646388, 'bear_atr_min_pct': 0.0200290967819095, 'bear_atr_max_pct': 0.04704790542999068, 'bear_tp_mult': 2.6099398435775445, 'bear_tsl_mult': 0.9937968067292846, 'bear_time_stop': 164, 'bear_use_sma': False, 'bear_use_ema': True, 'bear_use_atr': False, 'bear_use_adx': True, 'bear_use_spike': True, 'bear_rsi_required': False, 'sideways_strategy': 'breakout', 'sideways_bb_std_mult': 2.9667214246064653, 'sideways_rsi_os': 19, 'sideways_rsi_ob': 70, 'sideways_adx_thresh': 13.366072840384449, 'sideways_atr_min_pct': 0.0057781258388953215, 'sideways_atr_max_pct': 0.02487008615101676, 'sideways_tp_mult': 2.0478881549267207, 'sideways_tsl_mult': 0.05035167561197554, 'sideways_time_stop': 205, 'sideways_use_sma': False, 'sideways_use_ema': False, 'sideways_use_atr': False, 'sideways_use_adx': False, 'sideways_use_spike': True, 'sideways_rsi_required': False}.
