[I 2025-08-31 10:45:47,841] Trial 395 finished with values: [-1000000000.0, 1000000000.0] and parameters: {'p_sma': 17, 'p_std': 27, 'p_atr': 25, 'p_adx': 29, 'rsi_period': 8, 'ema1': 14, 'ema2': 24, 'slip_atr_k': 0.07204916281736376, 'slip_spread_k': 0.7865228035522518, 'spread_hl_frac': 0.010114016259450014, 'bb_std_mult': 2.6421050842516505, 'rsi_os': 24, 'rsi_ob': 87, 'vol_spike': 0.020435522463871675, 'adx_thresh': 30.037383889052663, 'atr_min_pct': 0.005074811510124811, 'atr_max_pct': 0.11117518615740538, 'tp_mult': 1.6428016549215418, 'tsl_mult': 0.7544016381672816, 'strategy': 'breakout', 'time_stop': 73, 'use_sma': True, 'use_atr': False, 'use_adx': True, 'use_ema': False, 'use_spike': True, 'rsi_required': True, 'edge_k': 0.2109087550974067, 'edge_cap': 0.4646250802195321, 'bull_strategy': 'breakout', 'bull_bb_std_mult': 1.576144234142342, 'bull_rsi_os': 13, 'bull_rsi_ob': 73, 'bull_adx_thresh': 31.693749355101566, 'bull_atr_min_pct': 0.011928684457026875, 'bull_atr_max_pct': 0.08921805630244112, 'bull_tp_mult': 2.117305021101265, 'bull_tsl_mult': 0.9860783308758446, 'bull_time_stop': 81, 'bull_use_sma': True, 'bull_use_ema': False, 'bull_use_atr': False, 'bull_use_adx': False, 'bull_use_spike': False, 'bull_rsi_required': True, 'bear_strategy': 'breakout', 'bear_bb_std_mult': 3.4281394547616353, 'bear_rsi_os': 41, 'bear_rsi_ob': 92, 'bear_adx_thresh': 7.585640741886153, 'bear_atr_min_pct': 0.02052350476399835, 'bear_atr_max_pct': 0.13650878924393992, 'bear_tp_mult': 2.7859414741319855, 'bear_tsl_mult': 0.5239211675764023, 'bear_time_stop': 38, 'bear_use_sma': False, 'bear_use_ema': True, 'bear_use_atr': False, 'bear_use_adx': True, 'bear_use_spike': True, 'bear_rsi_required': False, 'sideways_strategy': 'mean_reversion', 'sideways_bb_std_mult': 1.7478674466866215, 'sideways_rsi_os': 42, 'sideways_rsi_ob': 69, 'sideways_adx_thresh': 26.312531335096033, 'sideways_atr_min_pct': 0.017716820855514556, 'sideways_atr_max_pct': 0.015454797804425699, 'sideways_tp_mult': 1.854151923839412, 'sideways_tsl_mult': 0.9361022005520165, 'sideways_time_stop': 24, 'sideways_use_sma': False, 'sideways_use_ema': False, 'sideways_use_atr': False, 'sideways_use_adx': False, 'sideways_use_spike': False, 'sideways_rsi_required': False}.
[I 2025-08-31 10:45:48,332] Trial 397 finished with values: [-1000000000.0, 1000000000.0] and parameters: {'p_sma': 17, 'p_std': 27, 'p_atr': 11, 'p_adx': 30, 'rsi_period': 48, 'ema1': 6, 'ema2': 58, 'slip_atr_k': 0.07246395424729582, 'slip_spread_k': 0.2508419684674945, 'spread_hl_frac': 0.030256155342189332, 'bb_std_mult': 2.6254658600967664, 'rsi_os': 24, 'rsi_ob': 77, 'vol_spike': 0.09669218201496858, 'adx_thresh': 29.706545216482148, 'atr_min_pct': 0.01869201156671405, 'atr_max_pct': 0.09507587028799898, 'tp_mult': 1.9691195407506055, 'tsl_mult': 0.3714176186134619, 'strategy': 'breakout', 'time_stop': 72, 'use_sma': True, 'use_atr': False, 'use_adx': True, 'use_ema': False, 'use_spike': True, 'rsi_required': True, 'edge_k': 0.22762254618727246, 'edge_cap': 0.46658546804788015, 'bull_strategy': 'breakout', 'bull_bb_std_mult': 0.7971351926417284, 'bull_rsi_os': 13, 'bull_rsi_ob': 73, 'bull_adx_thresh': 9.560243930784592, 'bull_atr_min_pct': 0.012161272780624986, 'bull_atr_max_pct': 0.08957200306195423, 'bull_tp_mult': 1.7753724775790531, 'bull_tsl_mult': 0.49192791255048257, 'bull_time_stop': 70, 'bull_use_sma': True, 'bull_use_ema': False, 'bull_use_atr': False, 'bull_use_adx': False, 'bull_use_spike': False, 'bull_rsi_required': True, 'bear_strategy': 'breakout', 'bear_bb_std_mult': 3.464919507467169, 'bear_rsi_os': 24, 'bear_rsi_ob': 91, 'bear_adx_thresh': 7.614304861573823, 'bear_atr_min_pct': 0.020318941406555907, 'bear_atr_max_pct': 0.11802199159660329, 'bear_tp_mult': 2.4143154288470847, 'bear_tsl_mult': 0.9658385951348674, 'bear_time_stop': 37, 'bear_use_sma': False, 'bear_use_ema': True, 'bear_use_atr': False, 'bear_use_adx': True, 'bear_use_spike': True, 'bear_rsi_required': False, 'sideways_strategy': 'mean_reversion', 'sideways_bb_std_mult': 2.580066209763477, 'sideways_rsi_os': 8, 'sideways_rsi_ob': 72, 'sideways_adx_thresh': 33.2095426911506, 'sideways_atr_min_pct': 0.016148598014380577, 'sideways_atr_max_pct': 0.12283309684747429, 'sideways_tp_mult': 2.039135908673403, 'sideways_tsl_mult': 0.16881243269729318, 'sideways_time_stop': 11, 'sideways_use_sma': False, 'sideways_use_ema': False, 'sideways_use_atr': False, 'sideways_use_adx': False, 'sideways_use_spike': False, 'sideways_rsi_required': False}.
[I 2025-08-31 10:45:49,180] Trial 398 finished with values: [-1000000000.0, 1000000000.0] and parameters: {'p_sma': 43, 'p_std': 41, 'p_atr': 11, 'p_adx': 10, 'rsi_period': 17, 'ema1': 21, 'ema2': 22, 'slip_atr_k': 0.0008927708510945431, 'slip_spread_k': 0.7007625627703384, 'spread_hl_frac': 0.009991774832225306, 'bb_std_mult': 2.6264488993944908, 'rsi_os': 24, 'rsi_ob': 77, 'vol_spike': 0.09740844374778382, 'adx_thresh': 29.641357615063498, 'atr_min_pct': 0.005112517603853301, 'atr_max_pct': 0.09218552339282325, 'tp_mult': 1.7460379815398288, 'tsl_mult': 0.9377270298202871, 'strategy': 'breakout', 'time_stop': 86, 'use_sma': True, 'use_atr': False, 'use_adx': True, 'use_ema': False, 'use_spike': False, 'rsi_required': True, 'edge_k': 1.410624239802109, 'edge_cap': 0.46648771648541976, 'bull_strategy': 'breakout', 'bull_bb_std_mult': 2.269428248755801, 'bull_rsi_os': 26, 'bull_rsi_ob': 73, 'bull_adx_thresh': 6.409528757597247, 'bull_atr_min_pct': 0.02708363069519199, 'bull_atr_max_pct': 0.015071176446484702, 'bull_tp_mult': 2.7008974321053247, 'bull_tsl_mult': 0.34263859329599794, 'bull_time_stop': 64, 'bull_use_sma': True, 'bull_use_ema': False, 'bull_use_atr': False, 'bull_use_adx': False, 'bull_use_spike': False, 'bull_rsi_required': True, 'bear_strategy': 'breakout', 'bear_bb_std_mult': 2.2070834170236013, 'bear_rsi_os': 41, 'bear_rsi_ob': 56, 'bear_adx_thresh': 26.838299474957676, 'bear_atr_min_pct': 0.00591299576144871, 'bear_atr_max_pct': 0.03163474638968762, 'bear_tp_mult': 2.410783272852302, 'bear_tsl_mult': 0.5412537980452624, 'bear_time_stop': 211, 'bear_use_sma': True, 'bear_use_ema': True, 'bear_use_atr': False, 'bear_use_adx': True, 'bear_use_spike': True, 'bear_rsi_required': False, 'sideways_strategy': 'mean_reversion', 'sideways_bb_std_mult': 0.8692858043838845, 'sideways_rsi_os': 6, 'sideways_rsi_ob': 90, 'sideways_adx_thresh': 27.114251057140567, 'sideways_atr_min_pct': 0.018546109379127138, 'sideways_atr_max_pct': 0.05126425197384371, 'sideways_tp_mult': 1.9859990399950207, 'sideways_tsl_mult': 0.09374927833167652, 'sideways_time_stop': 72, 'sideways_use_sma': False, 'sideways_use_ema': False, 'sideways_use_atr': False, 'sideways_use_adx': False, 'sideways_use_spike': False, 'sideways_rsi_required': False}.
[I 2025-08-31 10:45:50,266] Trial 399 finished with values: [-1000000000.0, 1000000000.0] and parameters: {'p_sma': 17, 'p_std': 28, 'p_atr': 11, 'p_adx': 14, 'rsi_period': 17, 'ema1': 14, 'ema2': 31, 'slip_atr_k': 0.13933833065758694, 'slip_spread_k': 0.5359377438167928, 'spread_hl_frac': 0.03309695408434865, 'bb_std_mult': 2.782678919069513, 'rsi_os': 19, 'rsi_ob': 77, 'vol_spike': 0.019338805210017074, 'adx_thresh': 8.637354457694295, 'atr_min_pct': 0.005839266797321071, 'atr_max_pct': 0.0543489639475027, 'tp_mult': 1.7313998896178109, 'tsl_mult': 0.16332128996867407, 'strategy': 'breakout', 'time_stop': 86, 'use_sma': True, 'use_atr': False, 'use_adx': True, 'use_ema': True, 'use_spike': False, 'rsi_required': True, 'edge_k': 0.17038940912160316, 'edge_cap': 0.47205491417650774, 'bull_strategy': 'breakout', 'bull_bb_std_mult': 0.8754126681238628, 'bull_rsi_os': 5, 'bull_rsi_ob': 73, 'bull_adx_thresh': 31.48460538779764, 'bull_atr_min_pct': 0.02680638260250633, 'bull_atr_max_pct': 0.06524767433373466, 'bull_tp_mult': 1.1938465635349438, 'bull_tsl_mult': 0.40185078766712173, 'bull_time_stop': 15, 'bull_use_sma': True, 'bull_use_ema': False, 'bull_use_atr': False, 'bull_use_adx': False, 'bull_use_spike': False, 'bull_rsi_required': True, 'bear_strategy': 'breakout', 'bear_bb_std_mult': 3.450649365233156, 'bear_rsi_os': 51, 'bear_rsi_ob': 48, 'bear_adx_thresh': 5.47964100062393, 'bear_atr_min_pct': 0.029126379334477627, 'bear_atr_max_pct': 0.11549124133590083, 'bear_tp_mult': 1.8908895728916648, 'bear_tsl_mult': 0.9658986494854075, 'bear_time_stop': 15, 'bear_use_sma': True, 'bear_use_ema': True, 'bear_use_atr': False, 'bear_use_adx': False, 'bear_use_spike': True, 'bear_rsi_required': False, 'sideways_strategy': 'mean_reversion', 'sideways_bb_std_mult': 3.423034915924858, 'sideways_rsi_os': 6, 'sideways_rsi_ob': 90, 'sideways_adx_thresh': 26.73743959115064, 'sideways_atr_min_pct': 0.01864268422263141, 'sideways_atr_max_pct': 0.05020635895898532, 'sideways_tp_mult': 1.986680419821022, 'sideways_tsl_mult': 0.5117369815209568, 'sideways_time_stop': 10, 'sideways_use_sma': False, 'sideways_use_ema': False, 'sideways_use_atr': False, 'sideways_use_adx': False, 'sideways_use_spike': False, 'sideways_rsi_required': False}.
[I 2025-08-31 10:46:20,852] Trial 401 finished with values: [-1000000000.0, 1000000000.0] and parameters: {'p_sma': 15, 'p_std': 30, 'p_atr': 11, 'p_adx': 10, 'rsi_period': 45, 'ema1': 15, 'ema2': 31, 'slip_atr_k': 0.0553936356968458, 'slip_spread_k': 0.6639727558392068, 'spread_hl_frac': 0.03303279798965165, 'bb_std_mult': 2.0187564317152145, 'rsi_os': 26, 'rsi_ob': 78, 'vol_spike': 0.2840044580870683, 'adx_thresh': 28.368756528295823, 'atr_min_pct': 0.011845031613324659, 'atr_max_pct': 0.10223972307648273, 'tp_mult': 2.4238869851745943, 'tsl_mult': 0.9234980480487136, 'strategy': 'breakout', 'time_stop': 86, 'use_sma': True, 'use_atr': False, 'use_adx': True, 'use_ema': True, 'use_spike': False, 'rsi_required': True, 'edge_k': 0.16087678329566196, 'edge_cap': 0.3657724805722816, 'bull_strategy': 'breakout', 'bull_bb_std_mult': 0.878984081949595, 'bull_rsi_os': 49, 'bull_rsi_ob': 48, 'bull_adx_thresh': 6.177722930394771, 'bull_atr_min_pct': 0.02677503198186846, 'bull_atr_max_pct': 0.09860796588878543, 'bull_tp_mult': 1.2030707949002628, 'bull_tsl_mult': 0.6310524016921519, 'bull_time_stop': 245, 'bull_use_sma': True, 'bull_use_ema': False, 'bull_use_atr': False, 'bull_use_adx': False, 'bull_use_spike': False, 'bull_rsi_required': True, 'bear_strategy': 'breakout', 'bear_bb_std_mult': 2.2287952862135976, 'bear_rsi_os': 21, 'bear_rsi_ob': 93, 'bear_adx_thresh': 26.83674783750012, 'bear_atr_min_pct': 0.006373217750838054, 'bear_atr_max_pct': 0.02880356948342523, 'bear_tp_mult': 2.7267463493846034, 'bear_tsl_mult': 0.46889534418580064, 'bear_time_stop': 212, 'bear_use_sma': True, 'bear_use_ema': False, 'bear_use_atr': True, 'bear_use_adx': False, 'bear_use_spike': True, 'bear_rsi_required': True, 'sideways_strategy': 'mean_reversion', 'sideways_bb_std_mult': 0.8603208089136021, 'sideways_rsi_os': 6, 'sideways_rsi_ob': 91, 'sideways_adx_thresh': 13.307225944473913, 'sideways_atr_min_pct': 0.018529593030713262, 'sideways_atr_max_pct': 0.09032315749666771, 'sideways_tp_mult': 1.9911679633747956, 'sideways_tsl_mult': 0.21201627096039438, 'sideways_time_stop': 32, 'sideways_use_sma': False, 'sideways_use_ema': False, 'sideways_use_atr': False, 'sideways_use_adx': False, 'sideways_use_spike': False, 'sideways_rsi_required': True}.
[I 2025-08-31 10:46:21,121] Trial 402 finished with values: [-1000000000.0, 1000000000.0] and parameters: {'p_sma': 15, 'p_std': 8, 'p_atr': 15, 'p_adx': 14, 'rsi_period': 74, 'ema1': 13, 'ema2': 60, 'slip_atr_k': 0.04991249972877518, 'slip_spread_k': 0.6598534900704458, 'spread_hl_frac': 0.033357019309160796, 'bb_std_mult': 2.788455678205423, 'rsi_os': 19, 'rsi_ob': 78, 'vol_spike': 0.2596984881215733, 'adx_thresh': 28.43120504739221, 'atr_min_pct': 0.005801196056942945, 'atr_max_pct': 0.04473308841967594, 'tp_mult': 2.409427369210032, 'tsl_mult': 0.0005021411880613558, 'strategy': 'breakout', 'time_stop': 64, 'use_sma': True, 'use_atr': False, 'use_adx': True, 'use_ema': True, 'use_spike': False, 'rsi_required': True, 'edge_k': 0.15265006638750442, 'edge_cap': 0.4157922500836998, 'bull_strategy': 'breakout', 'bull_bb_std_mult': 0.8882008887981301, 'bull_rsi_os': 24, 'bull_rsi_ob': 58, 'bull_adx_thresh': 17.10335217843884, 'bull_atr_min_pct': 0.021149637930775143, 'bull_atr_max_pct': 0.07914566885457724, 'bull_tp_mult': 1.2235340329607487, 'bull_tsl_mult': 0.3905776392825961, 'bull_time_stop': 71, 'bull_use_sma': True, 'bull_use_ema': False, 'bull_use_atr': False, 'bull_use_adx': False, 'bull_use_spike': False, 'bull_rsi_required': True, 'bear_strategy': 'breakout', 'bear_bb_std_mult': 2.117648864046347, 'bear_rsi_os': 20, 'bear_rsi_ob': 59, 'bear_adx_thresh': 24.701469709647302, 'bear_atr_min_pct': 0.006525515415551167, 'bear_atr_max_pct': 0.10303238233658743, 'bear_tp_mult': 1.2786369292123512, 'bear_tsl_mult': 0.3960636795359479, 'bear_time_stop': 82, 'bear_use_sma': True, 'bear_use_ema': False, 'bear_use_atr': True, 'bear_use_adx': False, 'bear_use_spike': True, 'bear_rsi_required': True, 'sideways_strategy': 'mean_reversion', 'sideways_bb_std_mult': 2.8806862830920648, 'sideways_rsi_os': 7, 'sideways_rsi_ob': 92, 'sideways_adx_thresh': 18.955943445510897, 'sideways_atr_min_pct': 0.0196123038234255, 'sideways_atr_max_pct': 0.07010702778109514, 'sideways_tp_mult': 1.2101376649714237, 'sideways_tsl_mult': 0.8206054997565095, 'sideways_time_stop': 29, 'sideways_use_sma': False, 'sideways_use_ema': False, 'sideways_use_atr': False, 'sideways_use_adx': False, 'sideways_use_spike': False, 'sideways_rsi_required': True}.
[I 2025-08-31 10:46:21,263] Trial 403 finished with values: [-1000000000.0, 1000000000.0] and parameters: {'p_sma': 15, 'p_std': 33, 'p_atr': 15, 'p_adx': 14, 'rsi_period': 63, 'ema1': 15, 'ema2': 60, 'slip_atr_k': 0.10167382944376056, 'slip_spread_k': 0.650481937998648, 'spread_hl_frac': 0.008694986024954714, 'bb_std_mult': 1.5635713440714736, 'rsi_os': 26, 'rsi_ob': 83, 'vol_spike': 0.053307762153320684, 'adx_thresh': 28.577034628899895, 'atr_min_pct': 0.00597105398221567, 'atr_max_pct': 0.10041554475455308, 'tp_mult': 2.397355307631525, 'tsl_mult': 0.2725009472735307, 'strategy': 'breakout', 'time_stop': 170, 'use_sma': False, 'use_atr': False, 'use_adx': True, 'use_ema': True, 'use_spike': True, 'rsi_required': True, 'edge_k': 0.16123920717857512, 'edge_cap': 0.4203983471253925, 'bull_strategy': 'breakout', 'bull_bb_std_mult': 2.149874991258812, 'bull_rsi_os': 8, 'bull_rsi_ob': 48, 'bull_adx_thresh': 17.33145341311861, 'bull_atr_min_pct': 0.010469747391927124, 'bull_atr_max_pct': 0.07801719460533027, 'bull_tp_mult': 1.6930220089956132, 'bull_tsl_mult': 0.3781436623482914, 'bull_time_stop': 24, 'bull_use_sma': True, 'bull_use_ema': False, 'bull_use_atr': False, 'bull_use_adx': True, 'bull_use_spike': False, 'bull_rsi_required': False, 'bear_strategy': 'breakout', 'bear_bb_std_mult': 2.1220073134824045, 'bear_rsi_os': 39, 'bear_rsi_ob': 61, 'bear_adx_thresh': 6.827618640208066, 'bear_atr_min_pct': 0.0054753409994146695, 'bear_atr_max_pct': 0.013884565987904121, 'bear_tp_mult': 1.3146153241774448, 'bear_tsl_mult': 0.45022039039416134, 'bear_time_stop': 24, 'bear_use_sma': False, 'bear_use_ema': False, 'bear_use_atr': True, 'bear_use_adx': False, 'bear_use_spike': True, 'bear_rsi_required': True, 'sideways_strategy': 'mean_reversion', 'sideways_bb_std_mult': 2.8752343298638796, 'sideways_rsi_os': 41, 'sideways_rsi_ob': 59, 'sideways_adx_thresh': 24.831193700393975, 'sideways_atr_min_pct': 0.019725922934011805, 'sideways_atr_max_pct': 0.06422863222954127, 'sideways_tp_mult': 1.074933908320138, 'sideways_tsl_mult': 0.11357055699850335, 'sideways_time_stop': 31, 'sideways_use_sma': False, 'sideways_use_ema': False, 'sideways_use_atr': False, 'sideways_use_adx': False, 'sideways_use_spike': False, 'sideways_rsi_required': True}.
[I 2025-08-31 10:46:21,337] Trial 400 finished with values: [-1000000000.0, 1000000000.0] and parameters: {'p_sma': 15, 'p_std': 41, 'p_atr': 15, 'p_adx': 15, 'rsi_period': 63, 'ema1': 13, 'ema2': 60, 'slip_atr_k': 0.10184990949814678, 'slip_spread_k': 0.7057461036041505, 'spread_hl_frac': 0.030740598794208953, 'bb_std_mult': 2.793766304519194, 'rsi_os': 29, 'rsi_ob': 66, 'vol_spike': 0.26004591844819114, 'adx_thresh': 28.48416473842138, 'atr_min_pct': 0.005824430162152908, 'atr_max_pct': 0.04508595023142372, 'tp_mult': 1.9873283107311763, 'tsl_mult': 0.1641958702291501, 'strategy': 'breakout', 'time_stop': 87, 'use_sma': True, 'use_atr': False, 'use_adx': True, 'use_ema': True, 'use_spike': False, 'rsi_required': True, 'edge_k': 1.9969328243180589, 'edge_cap': 0.4233621872333268, 'bull_strategy': 'breakout', 'bull_bb_std_mult': 0.8663816537134871, 'bull_rsi_os': 8, 'bull_rsi_ob': 94, 'bull_adx_thresh': 8.864091646990378, 'bull_atr_min_pct': 0.010429262950657315, 'bull_atr_max_pct': 0.015348853605490986, 'bull_tp_mult': 2.6959040153999925, 'bull_tsl_mult': 0.489738481970676, 'bull_time_stop': 252, 'bull_use_sma': True, 'bull_use_ema': False, 'bull_use_atr': False, 'bull_use_adx': False, 'bull_use_spike': False, 'bull_rsi_required': True, 'bear_strategy': 'breakout', 'bear_bb_std_mult': 2.6175025334332513, 'bear_rsi_os': 21, 'bear_rsi_ob': 55, 'bear_adx_thresh': 30.778086879821778, 'bear_atr_min_pct': 0.025859071786930584, 'bear_atr_max_pct': 0.030249832305821275, 'bear_tp_mult': 2.1376996149091085, 'bear_tsl_mult': 0.6857952972938517, 'bear_time_stop': 92, 'bear_use_sma': True, 'bear_use_ema': True, 'bear_use_atr': False, 'bear_use_adx': False, 'bear_use_spike': True, 'bear_rsi_required': False, 'sideways_strategy': 'mean_reversion', 'sideways_bb_std_mult': 2.7854395198660655, 'sideways_rsi_os': 44, 'sideways_rsi_ob': 72, 'sideways_adx_thresh': 8.590299200108191, 'sideways_atr_min_pct': 0.018689820623393607, 'sideways_atr_max_pct': 0.05245316647324254, 'sideways_tp_mult': 1.987819522835934, 'sideways_tsl_mult': 0.30231795109194515, 'sideways_time_stop': 31, 'sideways_use_sma': False, 'sideways_use_ema': False, 'sideways_use_atr': False, 'sideways_use_adx': False, 'sideways_use_spike': False, 'sideways_rsi_required': True}.
[I 2025-08-31 10:46:53,310] Trial 407 finished with values: [-1000000000.0, 1000000000.0] and parameters: {'p_sma': 24, 'p_std': 36, 'p_atr': 24, 'p_adx': 11, 'rsi_period': 47, 'ema1': 14, 'ema2': 55, 'slip_atr_k': 0.18863904528385433, 'slip_spread_k': 0.6264487518132089, 'spread_hl_frac': 0.007975025102778524, 'bb_std_mult': 1.031467850688851, 'rsi_os': 45, 'rsi_ob': 80, 'vol_spike': 0.2433524216037101, 'adx_thresh': 15.817911228048235, 'atr_min_pct': 0.00895564579788743, 'atr_max_pct': 0.09581995063517162, 'tp_mult': 2.5042201102598667, 'tsl_mult': 0.24697579137562806, 'strategy': 'breakout', 'time_stop': 300, 'use_sma': False, 'use_atr': False, 'use_adx': True, 'use_ema': True, 'use_spike': True, 'rsi_required': True, 'edge_k': 0.2663312822279288, 'edge_cap': 0.3087143401756463, 'bull_strategy': 'mean_reversion', 'bull_bb_std_mult': 1.8097833407662227, 'bull_rsi_os': 17, 'bull_rsi_ob': 75, 'bull_adx_thresh': 20.395156359978497, 'bull_atr_min_pct': 0.014829307862713728, 'bull_atr_max_pct': 0.12177308500955314, 'bull_tp_mult': 1.2900568514875048, 'bull_tsl_mult': 0.7732522391381533, 'bull_time_stop': 64, 'bull_use_sma': True, 'bull_use_ema': False, 'bull_use_atr': False, 'bull_use_adx': True, 'bull_use_spike': False, 'bull_rsi_required': False, 'bear_strategy': 'mean_reversion', 'bear_bb_std_mult': 2.5107581979360556, 'bear_rsi_os': 55, 'bear_rsi_ob': 81, 'bear_adx_thresh': 34.69287839482501, 'bear_atr_min_pct': 0.005527848319414311, 'bear_atr_max_pct': 0.03583956890888191, 'bear_tp_mult': 1.4691132489310537, 'bear_tsl_mult': 0.4956285381562481, 'bear_time_stop': 130, 'bear_use_sma': False, 'bear_use_ema': True, 'bear_use_atr': False, 'bear_use_adx': False, 'bear_use_spike': True, 'bear_rsi_required': False, 'sideways_strategy': 'mean_reversion', 'sideways_bb_std_mult': 2.290171555254026, 'sideways_rsi_os': 49, 'sideways_rsi_ob': 92, 'sideways_adx_thresh': 25.560643878255686, 'sideways_atr_min_pct': 0.012707710982996072, 'sideways_atr_max_pct': 0.030881952485876656, 'sideways_tp_mult': 1.9023190818113644, 'sideways_tsl_mult': 0.5610053709479399, 'sideways_time_stop': 108, 'sideways_use_sma': False, 'sideways_use_ema': True, 'sideways_use_atr': False, 'sideways_use_adx': False, 'sideways_use_spike': False, 'sideways_rsi_required': True}.
