[I 2025-08-31 10:41:34,781] Trial 359 finished with values: [-1000000000.0, 1000000000.0] and parameters: {'p_sma': 25, 'p_std': 17, 'p_atr': 10, 'p_adx': 15, 'rsi_period': 46, 'ema1': 14, 'ema2': 59, 'slip_atr_k': 0.018456202970097244, 'slip_spread_k': 0.7392880234213615, 'spread_hl_frac': 0.009132565471040265, 'bb_std_mult': 2.678714520936944, 'rsi_os': 25, 'rsi_ob': 79, 'vol_spike': 0.25557880482072926, 'adx_thresh': 28.87581958895808, 'atr_min_pct': 0.021306691375282457, 'atr_max_pct': 0.1487986069299839, 'tp_mult': 2.414857083068503, 'tsl_mult': 0.18807990633329696, 'strategy': 'breakout', 'time_stop': 75, 'use_sma': False, 'use_atr': False, 'use_adx': True, 'use_ema': True, 'use_spike': True, 'rsi_required': True, 'edge_k': 0.24003671542657812, 'edge_cap': 0.38084604760678314, 'bull_strategy': 'breakout', 'bull_bb_std_mult': 2.7526114425046155, 'bull_rsi_os': 8, 'bull_rsi_ob': 73, 'bull_adx_thresh': 6.558741178400824, 'bull_atr_min_pct': 0.012410044318670954, 'bull_atr_max_pct': 0.10632030555749383, 'bull_tp_mult': 1.8671471508367963, 'bull_tsl_mult': 0.6034699527557075, 'bull_time_stop': 80, 'bull_use_sma': True, 'bull_use_ema': False, 'bull_use_atr': False, 'bull_use_adx': False, 'bull_use_spike': False, 'bull_rsi_required': False, 'bear_strategy': 'mean_reversion', 'bear_bb_std_mult': 2.03238719010962, 'bear_rsi_os': 29, 'bear_rsi_ob': 86, 'bear_adx_thresh': 7.087611614707245, 'bear_atr_min_pct': 0.006743572172393389, 'bear_atr_max_pct': 0.14803496578135159, 'bear_tp_mult': 2.802407661307437, 'bear_tsl_mult': 0.5293935855075931, 'bear_time_stop': 265, 'bear_use_sma': False, 'bear_use_ema': True, 'bear_use_atr': False, 'bear_use_adx': False, 'bear_use_spike': True, 'bear_rsi_required': False, 'sideways_strategy': 'mean_reversion', 'sideways_bb_std_mult': 1.3554256482024005, 'sideways_rsi_os': 6, 'sideways_rsi_ob': 92, 'sideways_adx_thresh': 27.293878311240825, 'sideways_atr_min_pct': 0.017808418407205102, 'sideways_atr_max_pct': 0.05330468845466037, 'sideways_tp_mult': 1.9643471792431328, 'sideways_tsl_mult': 0.7342020250930055, 'sideways_time_stop': 26, 'sideways_use_sma': False, 'sideways_use_ema': False, 'sideways_use_atr': False, 'sideways_use_adx': False, 'sideways_use_spike': False, 'sideways_rsi_required': True}.
[I 2025-08-31 10:41:34,858] Trial 362 finished with values: [-1000000000.0, 1000000000.0] and parameters: {'p_sma': 15, 'p_std': 59, 'p_atr': 10, 'p_adx': 14, 'rsi_period': 46, 'ema1': 26, 'ema2': 59, 'slip_atr_k': 0.16495200188276418, 'slip_spread_k': 0.6486671416725469, 'spread_hl_frac': 0.009401492279898397, 'bb_std_mult': 2.7055200234316645, 'rsi_os': 11, 'rsi_ob': 79, 'vol_spike': 0.25727956872671315, 'adx_thresh': 32.73557357057313, 'atr_min_pct': 0.0070651311920396885, 'atr_max_pct': 0.06020307790094972, 'tp_mult': 1.2606065082306255, 'tsl_mult': 0.21998790142926605, 'strategy': 'breakout', 'time_stop': 55, 'use_sma': False, 'use_atr': False, 'use_adx': True, 'use_ema': True, 'use_spike': False, 'rsi_required': True, 'edge_k': 0.20168270823511808, 'edge_cap': 0.4552016472402425, 'bull_strategy': 'breakout', 'bull_bb_std_mult': 0.6607694737460268, 'bull_rsi_os': 11, 'bull_rsi_ob': 85, 'bull_adx_thresh': 6.548771510009203, 'bull_atr_min_pct': 0.014949951125689184, 'bull_atr_max_pct': 0.08637054412681026, 'bull_tp_mult': 2.4868151613179745, 'bull_tsl_mult': 0.41323358259602705, 'bull_time_stop': 83, 'bull_use_sma': True, 'bull_use_ema': False, 'bull_use_atr': False, 'bull_use_adx': True, 'bull_use_spike': False, 'bull_rsi_required': False, 'bear_strategy': 'breakout', 'bear_bb_std_mult': 1.9437795956814963, 'bear_rsi_os': 40, 'bear_rsi_ob': 91, 'bear_adx_thresh': 7.136483400592456, 'bear_atr_min_pct': 0.006921790669755854, 'bear_atr_max_pct': 0.14968239441140344, 'bear_tp_mult': 1.5370428146212198, 'bear_tsl_mult': 0.5667001165209956, 'bear_time_stop': 265, 'bear_use_sma': False, 'bear_use_ema': False, 'bear_use_atr': True, 'bear_use_adx': False, 'bear_use_spike': True, 'bear_rsi_required': False, 'sideways_strategy': 'mean_reversion', 'sideways_bb_std_mult': 2.5796228991074646, 'sideways_rsi_os': 8, 'sideways_rsi_ob': 89, 'sideways_adx_thresh': 25.757497560423428, 'sideways_atr_min_pct': 0.018945668336397985, 'sideways_atr_max_pct': 0.01757926336825847, 'sideways_tp_mult': 1.7838855856788054, 'sideways_tsl_mult': 0.18625726382050167, 'sideways_time_stop': 25, 'sideways_use_sma': False, 'sideways_use_ema': False, 'sideways_use_atr': False, 'sideways_use_adx': False, 'sideways_use_spike': False, 'sideways_rsi_required': True}.
[I 2025-08-31 10:41:34,928] Trial 360 finished with values: [-1000000000.0, 1000000000.0] and parameters: {'p_sma': 15, 'p_std': 30, 'p_atr': 10, 'p_adx': 15, 'rsi_period': 46, 'ema1': 15, 'ema2': 42, 'slip_atr_k': 0.01853932499688788, 'slip_spread_k': 0.5069350787501944, 'spread_hl_frac': 0.010639852639659098, 'bb_std_mult': 2.7074988972744647, 'rsi_os': 27, 'rsi_ob': 79, 'vol_spike': 0.25634652473790753, 'adx_thresh': 7.130706444552633, 'atr_min_pct': 0.02790053829688434, 'atr_max_pct': 0.056085136967811276, 'tp_mult': 2.4254577912635296, 'tsl_mult': 0.1919943262153514, 'strategy': 'breakout', 'time_stop': 53, 'use_sma': True, 'use_atr': False, 'use_adx': True, 'use_ema': True, 'use_spike': True, 'rsi_required': True, 'edge_k': 0.23786028448220908, 'edge_cap': 0.4501044549537882, 'bull_strategy': 'breakout', 'bull_bb_std_mult': 2.2292701826147843, 'bull_rsi_os': 11, 'bull_rsi_ob': 73, 'bull_adx_thresh': 7.727399562917666, 'bull_atr_min_pct': 0.016098372326672737, 'bull_atr_max_pct': 0.08746297647634822, 'bull_tp_mult': 2.477022076665399, 'bull_tsl_mult': 0.37552986087686924, 'bull_time_stop': 84, 'bull_use_sma': False, 'bull_use_ema': False, 'bull_use_atr': False, 'bull_use_adx': False, 'bull_use_spike': False, 'bull_rsi_required': True, 'bear_strategy': 'breakout', 'bear_bb_std_mult': 1.9486631125174394, 'bear_rsi_os': 40, 'bear_rsi_ob': 79, 'bear_adx_thresh': 7.281659663659254, 'bear_atr_min_pct': 0.005332506562679929, 'bear_atr_max_pct': 0.13014395970012055, 'bear_tp_mult': 1.546975493751916, 'bear_tsl_mult': 0.5312700448060633, 'bear_time_stop': 19, 'bear_use_sma': False, 'bear_use_ema': False, 'bear_use_atr': True, 'bear_use_adx': False, 'bear_use_spike': True, 'bear_rsi_required': False, 'sideways_strategy': 'mean_reversion', 'sideways_bb_std_mult': 2.639257682546154, 'sideways_rsi_os': 8, 'sideways_rsi_ob': 92, 'sideways_adx_thresh': 26.99641505368265, 'sideways_atr_min_pct': 0.017944225361831916, 'sideways_atr_max_pct': 0.04336840298978834, 'sideways_tp_mult': 1.140422428061263, 'sideways_tsl_mult': 0.09406837006125764, 'sideways_time_stop': 22, 'sideways_use_sma': False, 'sideways_use_ema': False, 'sideways_use_atr': True, 'sideways_use_adx': False, 'sideways_use_spike': False, 'sideways_rsi_required': True}.
[I 2025-08-31 10:41:35,505] Trial 366 finished with values: [-1000000000.0, 1000000000.0] and parameters: {'p_sma': 36, 'p_std': 32, 'p_atr': 11, 'p_adx': 14, 'rsi_period': 56, 'ema1': 15, 'ema2': 55, 'slip_atr_k': 0.011710015597954648, 'slip_spread_k': 0.39198558049703164, 'spread_hl_frac': 0.04406781362209182, 'bb_std_mult': 2.813773429753645, 'rsi_os': 52, 'rsi_ob': 65, 'vol_spike': 0.21638026452262105, 'adx_thresh': 29.06221501849589, 'atr_min_pct': 0.006433841078622508, 'atr_max_pct': 0.021619635904707196, 'tp_mult': 2.247258281104255, 'tsl_mult': 0.2421540117712764, 'strategy': 'mean_reversion', 'time_stop': 95, 'use_sma': True, 'use_atr': False, 'use_adx': True, 'use_ema': False, 'use_spike': True, 'rsi_required': True, 'edge_k': 0.520000386679546, 'edge_cap': 0.45517482862523523, 'bull_strategy': 'breakout', 'bull_bb_std_mult': 0.5016951043841626, 'bull_rsi_os': 12, 'bull_rsi_ob': 74, 'bull_adx_thresh': 7.404847101125827, 'bull_atr_min_pct': 0.020806515780563525, 'bull_atr_max_pct': 0.07806478276178336, 'bull_tp_mult': 1.262945001324049, 'bull_tsl_mult': 0.4105304220462833, 'bull_time_stop': 72, 'bull_use_sma': True, 'bull_use_ema': False, 'bull_use_atr': False, 'bull_use_adx': False, 'bull_use_spike': False, 'bull_rsi_required': True, 'bear_strategy': 'breakout', 'bear_bb_std_mult': 2.1755860828764337, 'bear_rsi_os': 39, 'bear_rsi_ob': 77, 'bear_adx_thresh': 6.09361668772151, 'bear_atr_min_pct': 0.00597909866178, 'bear_atr_max_pct': 0.13904361235723575, 'bear_tp_mult': 1.1826009765026604, 'bear_tsl_mult': 0.8758996260421463, 'bear_time_stop': 26, 'bear_use_sma': False, 'bear_use_ema': True, 'bear_use_atr': False, 'bear_use_adx': True, 'bear_use_spike': True, 'bear_rsi_required': True, 'sideways_strategy': 'mean_reversion', 'sideways_bb_std_mult': 2.7001201399266295, 'sideways_rsi_os': 7, 'sideways_rsi_ob': 90, 'sideways_adx_thresh': 20.92456611009444, 'sideways_atr_min_pct': 0.019096591197939466, 'sideways_atr_max_pct': 0.043304745828781355, 'sideways_tp_mult': 2.8161520736192607, 'sideways_tsl_mult': 0.659614424539891, 'sideways_time_stop': 17, 'sideways_use_sma': True, 'sideways_use_ema': False, 'sideways_use_atr': False, 'sideways_use_adx': False, 'sideways_use_spike': False, 'sideways_rsi_required': False}.
[I 2025-08-31 10:42:04,423] Trial 364 finished with values: [-1000000000.0, 1000000000.0] and parameters: {'p_sma': 14, 'p_std': 8, 'p_atr': 11, 'p_adx': 14, 'rsi_period': 76, 'ema1': 15, 'ema2': 55, 'slip_atr_k': 0.025542354858724706, 'slip_spread_k': 0.6834076958962276, 'spread_hl_frac': 0.010617900025100456, 'bb_std_mult': 2.8336227199696324, 'rsi_os': 17, 'rsi_ob': 64, 'vol_spike': 0.040121805864959406, 'adx_thresh': 29.164364549473465, 'atr_min_pct': 0.02809822124669172, 'atr_max_pct': 0.0935184396151336, 'tp_mult': 1.8643961658243249, 'tsl_mult': 0.24396954727364215, 'strategy': 'mean_reversion', 'time_stop': 88, 'use_sma': True, 'use_atr': False, 'use_adx': True, 'use_ema': False, 'use_spike': True, 'rsi_required': True, 'edge_k': 0.8911404230471496, 'edge_cap': 0.4491115021741649, 'bull_strategy': 'breakout', 'bull_bb_std_mult': 0.8205914058937587, 'bull_rsi_os': 10, 'bull_rsi_ob': 74, 'bull_adx_thresh': 7.717091690946414, 'bull_atr_min_pct': 0.019542636052328536, 'bull_atr_max_pct': 0.10214293460555265, 'bull_tp_mult': 2.301563684453801, 'bull_tsl_mult': 0.0928672772832595, 'bull_time_stop': 129, 'bull_use_sma': True, 'bull_use_ema': False, 'bull_use_atr': False, 'bull_use_adx': False, 'bull_use_spike': False, 'bull_rsi_required': True, 'bear_strategy': 'breakout', 'bear_bb_std_mult': 1.5105463678927478, 'bear_rsi_os': 39, 'bear_rsi_ob': 78, 'bear_adx_thresh': 6.120023424725023, 'bear_atr_min_pct': 0.005813480856224676, 'bear_atr_max_pct': 0.13834575135018698, 'bear_tp_mult': 1.184036168934282, 'bear_tsl_mult': 0.49183008460275635, 'bear_time_stop': 16, 'bear_use_sma': False, 'bear_use_ema': True, 'bear_use_atr': False, 'bear_use_adx': True, 'bear_use_spike': True, 'bear_rsi_required': True, 'sideways_strategy': 'mean_reversion', 'sideways_bb_std_mult': 2.701402347867235, 'sideways_rsi_os': 7, 'sideways_rsi_ob': 90, 'sideways_adx_thresh': 31.036457907329343, 'sideways_atr_min_pct': 0.01930868696794418, 'sideways_atr_max_pct': 0.020154929250441135, 'sideways_tp_mult': 2.98800337630167, 'sideways_tsl_mult': 0.6978889289827468, 'sideways_time_stop': 180, 'sideways_use_sma': True, 'sideways_use_ema': False, 'sideways_use_atr': False, 'sideways_use_adx': False, 'sideways_use_spike': False, 'sideways_rsi_required': False}.
[I 2025-08-31 10:42:04,864] Trial 365 finished with values: [-1000000000.0, 1000000000.0] and parameters: {'p_sma': 37, 'p_std': 45, 'p_atr': 11, 'p_adx': 25, 'rsi_period': 50, 'ema1': 15, 'ema2': 55, 'slip_atr_k': 0.02443124730206346, 'slip_spread_k': 0.6822140183004024, 'spread_hl_frac': 0.04378779968175563, 'bb_std_mult': 2.785780210123579, 'rsi_os': 23, 'rsi_ob': 76, 'vol_spike': 0.10521204014021379, 'adx_thresh': 33.87132450391913, 'atr_min_pct': 0.0063800962625799275, 'atr_max_pct': 0.010216513566883051, 'tp_mult': 1.595906651316001, 'tsl_mult': 0.24443246617746053, 'strategy': 'mean_reversion', 'time_stop': 90, 'use_sma': True, 'use_atr': False, 'use_adx': True, 'use_ema': False, 'use_spike': True, 'rsi_required': True, 'edge_k': 0.18254862619146459, 'edge_cap': 0.45294946947947723, 'bull_strategy': 'breakout', 'bull_bb_std_mult': 0.8344488092344655, 'bull_rsi_os': 19, 'bull_rsi_ob': 74, 'bull_adx_thresh': 7.51144467819395, 'bull_atr_min_pct': 0.018978986241950543, 'bull_atr_max_pct': 0.1021441823191801, 'bull_tp_mult': 2.1510297372702643, 'bull_tsl_mult': 0.4059880420753712, 'bull_time_stop': 127, 'bull_use_sma': True, 'bull_use_ema': False, 'bull_use_atr': False, 'bull_use_adx': False, 'bull_use_spike': False, 'bull_rsi_required': True, 'bear_strategy': 'breakout', 'bear_bb_std_mult': 1.815310110029442, 'bear_rsi_os': 39, 'bear_rsi_ob': 81, 'bear_adx_thresh': 6.211724870388209, 'bear_atr_min_pct': 0.00605906867005961, 'bear_atr_max_pct': 0.13903323345682134, 'bear_tp_mult': 1.1663913858712904, 'bear_tsl_mult': 0.7425090926388618, 'bear_time_stop': 13, 'bear_use_sma': False, 'bear_use_ema': True, 'bear_use_atr': False, 'bear_use_adx': True, 'bear_use_spike': True, 'bear_rsi_required': True, 'sideways_strategy': 'mean_reversion', 'sideways_bb_std_mult': 1.4392300959777944, 'sideways_rsi_os': 7, 'sideways_rsi_ob': 90, 'sideways_adx_thresh': 26.196972569843616, 'sideways_atr_min_pct': 0.019298347870839037, 'sideways_atr_max_pct': 0.05021804652296939, 'sideways_tp_mult': 2.999184350550926, 'sideways_tsl_mult': 0.41366833980012263, 'sideways_time_stop': 180, 'sideways_use_sma': True, 'sideways_use_ema': False, 'sideways_use_atr': False, 'sideways_use_adx': False, 'sideways_use_spike': False, 'sideways_rsi_required': False}.
[I 2025-08-31 10:42:04,887] Trial 363 finished with values: [-1000000000.0, 1000000000.0] and parameters: {'p_sma': 14, 'p_std': 60, 'p_atr': 11, 'p_adx': 14, 'rsi_period': 50, 'ema1': 15, 'ema2': 27, 'slip_atr_k': 0.16504120342704137, 'slip_spread_k': 0.8182038442960827, 'spread_hl_frac': 0.026237598045132458, 'bb_std_mult': 2.8168796037610213, 'rsi_os': 11, 'rsi_ob': 76, 'vol_spike': 0.037661626567446135, 'adx_thresh': 33.66347309484861, 'atr_min_pct': 0.00841596008585178, 'atr_max_pct': 0.06374730263089876, 'tp_mult': 1.2601933280223911, 'tsl_mult': 0.2187879305991558, 'strategy': 'mean_reversion', 'time_stop': 91, 'use_sma': True, 'use_atr': False, 'use_adx': True, 'use_ema': True, 'use_spike': True, 'rsi_required': True, 'edge_k': 0.1928532013512562, 'edge_cap': 0.4539044128687968, 'bull_strategy': 'breakout', 'bull_bb_std_mult': 3.332034370820958, 'bull_rsi_os': 12, 'bull_rsi_ob': 84, 'bull_adx_thresh': 7.349937880358253, 'bull_atr_min_pct': 0.014635090559980109, 'bull_atr_max_pct': 0.10203430640737778, 'bull_tp_mult': 2.452305002025385, 'bull_tsl_mult': 0.4081372308014837, 'bull_time_stop': 86, 'bull_use_sma': True, 'bull_use_ema': False, 'bull_use_atr': False, 'bull_use_adx': False, 'bull_use_spike': False, 'bull_rsi_required': True, 'bear_strategy': 'breakout', 'bear_bb_std_mult': 1.8160046015017275, 'bear_rsi_os': 40, 'bear_rsi_ob': 90, 'bear_adx_thresh': 6.05579082331568, 'bear_atr_min_pct': 0.006014784405021266, 'bear_atr_max_pct': 0.13744375867515207, 'bear_tp_mult': 1.0117834411542868, 'bear_tsl_mult': 0.572004476142013, 'bear_time_stop': 138, 'bear_use_sma': False, 'bear_use_ema': False, 'bear_use_atr': True, 'bear_use_adx': False, 'bear_use_spike': True, 'bear_rsi_required': True, 'sideways_strategy': 'mean_reversion', 'sideways_bb_std_mult': 0.5826541859705838, 'sideways_rsi_os': 8, 'sideways_rsi_ob': 89, 'sideways_adx_thresh': 11.552955484845803, 'sideways_atr_min_pct': 0.018724315384904367, 'sideways_atr_max_pct': 0.019879084135178707, 'sideways_tp_mult': 2.9876478105883773, 'sideways_tsl_mult': 0.1863936850586178, 'sideways_time_stop': 19, 'sideways_use_sma': True, 'sideways_use_ema': False, 'sideways_use_atr': False, 'sideways_use_adx': False, 'sideways_use_spike': False, 'sideways_rsi_required': True}.
[I 2025-08-31 10:42:06,754] Trial 367 finished with values: [-1000000000.0, 1000000000.0] and parameters: {'p_sma': 14, 'p_std': 28, 'p_atr': 12, 'p_adx': 25, 'rsi_period': 76, 'ema1': 14, 'ema2': 57, 'slip_atr_k': 0.12715284515356193, 'slip_spread_k': 0.682721564855429, 'spread_hl_frac': 0.02687654303491199, 'bb_std_mult': 2.764630308158881, 'rsi_os': 17, 'rsi_ob': 76, 'vol_spike': 0.03977164913699345, 'adx_thresh': 28.412865797526763, 'atr_min_pct': 0.005313119798716275, 'atr_max_pct': 0.10689277697748278, 'tp_mult': 2.144604143392021, 'tsl_mult': 0.2544675740060574, 'strategy': 'mean_reversion', 'time_stop': 91, 'use_sma': True, 'use_atr': False, 'use_adx': True, 'use_ema': True, 'use_spike': True, 'rsi_required': True, 'edge_k': 0.9052189559050958, 'edge_cap': 0.4096934951127843, 'bull_strategy': 'mean_reversion', 'bull_bb_std_mult': 0.8337150658984942, 'bull_rsi_os': 10, 'bull_rsi_ob': 58, 'bull_adx_thresh': 7.140619610836206, 'bull_atr_min_pct': 0.01277974040870815, 'bull_atr_max_pct': 0.10107187101307803, 'bull_tp_mult': 1.806414553233273, 'bull_tsl_mult': 0.35875898467879885, 'bull_time_stop': 132, 'bull_use_sma': True, 'bull_use_ema': False, 'bull_use_atr': False, 'bull_use_adx': False, 'bull_use_spike': False, 'bull_rsi_required': True, 'bear_strategy': 'breakout', 'bear_bb_std_mult': 1.7256100955685225, 'bear_rsi_os': 16, 'bear_rsi_ob': 83, 'bear_adx_thresh': 6.2607166327194355, 'bear_atr_min_pct': 0.006277133901602361, 'bear_atr_max_pct': 0.11234630627773387, 'bear_tp_mult': 2.7471881972426395, 'bear_tsl_mult': 0.4997099522605788, 'bear_time_stop': 125, 'bear_use_sma': False, 'bear_use_ema': True, 'bear_use_atr': False, 'bear_use_adx': False, 'bear_use_spike': True, 'bear_rsi_required': False, 'sideways_strategy': 'mean_reversion', 'sideways_bb_std_mult': 1.8342680549151664, 'sideways_rsi_os': 7, 'sideways_rsi_ob': 93, 'sideways_adx_thresh': 26.085240712535708, 'sideways_atr_min_pct': 0.019806162467186396, 'sideways_atr_max_pct': 0.14101415685539048, 'sideways_tp_mult': 1.2663570798946475, 'sideways_tsl_mult': 0.1232305453674861, 'sideways_time_stop': 183, 'sideways_use_sma': True, 'sideways_use_ema': True, 'sideways_use_atr': False, 'sideways_use_adx': False, 'sideways_use_spike': False, 'sideways_rsi_required': True}.
[I 2025-08-31 10:42:37,880] Trial 369 finished with values: [-1000000000.0, 1000000000.0] and parameters: {'p_sma': 27, 'p_std': 27, 'p_atr': 12, 'p_adx': 8, 'rsi_period': 27, 'ema1': 5, 'ema2': 57, 'slip_atr_k': 0.08967651238757404, 'slip_spread_k': 0.640256458388242, 'spread_hl_frac': 0.009760263215404392, 'bb_std_mult': 2.759326083354975, 'rsi_os': 27, 'rsi_ob': 89, 'vol_spike': 0.2651534645291065, 'adx_thresh': 27.041568749500495, 'atr_min_pct': 0.005298060661046773, 'atr_max_pct': 0.10460454843641981, 'tp_mult': 2.3466104713854627, 'tsl_mult': 0.26428255195358374, 'strategy': 'breakout', 'time_stop': 65, 'use_sma': False, 'use_atr': False, 'use_adx': True, 'use_ema': True, 'use_spike': False, 'rsi_required': True, 'edge_k': 0.26985181252453694, 'edge_cap': 0.49233299427943816, 'bull_strategy': 'mean_reversion', 'bull_bb_std_mult': 1.9372380896787127, 'bull_rsi_os': 7, 'bull_rsi_ob': 56, 'bull_adx_thresh': 6.821427904843016, 'bull_atr_min_pct': 0.006359529488657629, 'bull_atr_max_pct': 0.08379447687108586, 'bull_tp_mult': 1.8093857730032032, 'bull_tsl_mult': 0.3522892706562213, 'bull_time_stop': 193, 'bull_use_sma': True, 'bull_use_ema': False, 'bull_use_atr': False, 'bull_use_adx': True, 'bull_use_spike': False, 'bull_rsi_required': False, 'bear_strategy': 'breakout', 'bear_bb_std_mult': 1.7042328251222127, 'bear_rsi_os': 32, 'bear_rsi_ob': 88, 'bear_adx_thresh': 7.672081996370462, 'bear_atr_min_pct': 0.005179419871693942, 'bear_atr_max_pct': 0.14373679353962202, 'bear_tp_mult': 2.0512735489095624, 'bear_tsl_mult': 0.625728103885042, 'bear_time_stop': 231, 'bear_use_sma': True, 'bear_use_ema': True, 'bear_use_atr': False, 'bear_use_adx': False, 'bear_use_spike': True, 'bear_rsi_required': False, 'sideways_strategy': 'mean_reversion', 'sideways_bb_std_mult': 1.8380246178830209, 'sideways_rsi_os': 5, 'sideways_rsi_ob': 93, 'sideways_adx_thresh': 25.44209114915927, 'sideways_atr_min_pct': 0.017395252090972993, 'sideways_atr_max_pct': 0.12715241907941305, 'sideways_tp_mult': 1.8833209698999045, 'sideways_tsl_mult': 0.12766231410549078, 'sideways_time_stop': 29, 'sideways_use_sma': False, 'sideways_use_ema': True, 'sideways_use_atr': False, 'sideways_use_adx': False, 'sideways_use_spike': False, 'sideways_rsi_required': True}.
