[I 2025-08-31 11:28:31,050] Trial 720 finished with values: [-1000000000.0, 1000000000.0] and parameters: {'p_sma': 9, 'p_std': 20, 'p_atr': 28, 'p_adx': 14, 'rsi_period': 52, 'ema1': 11, 'ema2': 41, 'slip_atr_k': 0.027719346500648036, 'slip_spread_k': 0.19711676304547449, 'spread_hl_frac': 0.007043835611086737, 'bb_std_mult': 2.7793805925593347, 'rsi_os': 31, 'rsi_ob': 95, 'vol_spike': 0.2755364400078378, 'adx_thresh': 32.0465051535557, 'atr_min_pct': 0.01169178036142558, 'atr_max_pct': 0.1472900906183842, 'tp_mult': 1.621588974207194, 'tsl_mult': 0.0829865800749986, 'strategy': 'breakout', 'time_stop': 199, 'use_sma': True, 'use_atr': False, 'use_adx': True, 'use_ema': True, 'use_spike': True, 'rsi_required': False, 'edge_k': 0.38856743099917035, 'edge_cap': 0.5050817170080185, 'bull_strategy': 'breakout', 'bull_bb_std_mult': 0.500830386280814, 'bull_rsi_os': 12, 'bull_rsi_ob': 84, 'bull_adx_thresh': 5.022884485674578, 'bull_atr_min_pct': 0.005978617128641436, 'bull_atr_max_pct': 0.10008534718670718, 'bull_tp_mult': 1.9268380390817625, 'bull_tsl_mult': 0.465706672127232, 'bull_time_stop': 281, 'bull_use_sma': False, 'bull_use_ema': True, 'bull_use_atr': False, 'bull_use_adx': False, 'bull_use_spike': False, 'bull_rsi_required': True, 'bear_strategy': 'breakout', 'bear_bb_std_mult': 3.0976849845180325, 'bear_rsi_os': 52, 'bear_rsi_ob': 75, 'bear_adx_thresh': 5.852708489193791, 'bear_atr_min_pct': 0.0046324287256904765, 'bear_atr_max_pct': 0.1417579201562347, 'bear_tp_mult': 2.4877116429448405, 'bear_tsl_mult': 0.747790654986039, 'bear_time_stop': 96, 'bear_use_sma': False, 'bear_use_ema': True, 'bear_use_atr': False, 'bear_use_adx': False, 'bear_use_spike': False, 'bear_rsi_required': False, 'sideways_strategy': 'breakout', 'sideways_bb_std_mult': 3.2586915392245235, 'sideways_rsi_os': 23, 'sideways_rsi_ob': 94, 'sideways_adx_thresh': 11.058308579232378, 'sideways_atr_min_pct': 0.016688899361295532, 'sideways_atr_max_pct': 0.09964681521138215, 'sideways_tp_mult': 1.646490404344335, 'sideways_tsl_mult': 0.36741652175311595, 'sideways_time_stop': 5, 'sideways_use_sma': False, 'sideways_use_ema': False, 'sideways_use_atr': True, 'sideways_use_adx': False, 'sideways_use_spike': True, 'sideways_rsi_required': True}.
[I 2025-08-31 11:28:31,459] Trial 722 finished with values: [-0.021975757760643533, 0.023247998443123523] and parameters: {'p_sma': 14, 'p_std': 32, 'p_atr': 10, 'p_adx': 11, 'rsi_period': 52, 'ema1': 12, 'ema2': 43, 'slip_atr_k': 0.09380635416346245, 'slip_spread_k': 0.19705610909348348, 'spread_hl_frac': 0.007121660710709684, 'bb_std_mult': 2.7869138036476575, 'rsi_os': 31, 'rsi_ob': 95, 'vol_spike': 0.27634614157762866, 'adx_thresh': 32.282601820106144, 'atr_min_pct': 0.011606272139690125, 'atr_max_pct': 0.14711139943678186, 'tp_mult': 1.6224015721108305, 'tsl_mult': 0.08703682011786838, 'strategy': 'breakout', 'time_stop': 217, 'use_sma': True, 'use_atr': False, 'use_adx': True, 'use_ema': True, 'use_spike': True, 'rsi_required': False, 'edge_k': 0.3877383912912365, 'edge_cap': 0.4978201208643738, 'bull_strategy': 'breakout', 'bull_bb_std_mult': 0.7024926859746654, 'bull_rsi_os': 12, 'bull_rsi_ob': 82, 'bull_adx_thresh': 5.769933880348593, 'bull_atr_min_pct': 0.003944352053770315, 'bull_atr_max_pct': 0.09995664144920226, 'bull_tp_mult': 1.8132330610774754, 'bull_tsl_mult': 0.8062645489919775, 'bull_time_stop': 294, 'bull_use_sma': False, 'bull_use_ema': True, 'bull_use_atr': False, 'bull_use_adx': False, 'bull_use_spike': False, 'bull_rsi_required': True, 'bear_strategy': 'breakout', 'bear_bb_std_mult': 3.0960829286649583, 'bear_rsi_os': 52, 'bear_rsi_ob': 74, 'bear_adx_thresh': 12.196140174357136, 'bear_atr_min_pct': 0.004591316028577699, 'bear_atr_max_pct': 0.14244493291943522, 'bear_tp_mult': 2.8765247521753072, 'bear_tsl_mult': 0.745537782182028, 'bear_time_stop': 177, 'bear_use_sma': False, 'bear_use_ema': True, 'bear_use_atr': False, 'bear_use_adx': False, 'bear_use_spike': False, 'bear_rsi_required': False, 'sideways_strategy': 'breakout', 'sideways_bb_std_mult': 3.034423156898924, 'sideways_rsi_os': 24, 'sideways_rsi_ob': 95, 'sideways_adx_thresh': 14.230549464711594, 'sideways_atr_min_pct': 0.01683345630928639, 'sideways_atr_max_pct': 0.04092570696799649, 'sideways_tp_mult': 1.962536095455287, 'sideways_tsl_mult': 0.3591412461989256, 'sideways_time_stop': 11, 'sideways_use_sma': False, 'sideways_use_ema': False, 'sideways_use_atr': True, 'sideways_use_adx': False, 'sideways_use_spike': True, 'sideways_rsi_required': True}.
[I 2025-08-31 11:28:31,797] Trial 721 finished with values: [-0.02978094338196302, 0.032356494701157416] and parameters: {'p_sma': 25, 'p_std': 21, 'p_atr': 10, 'p_adx': 14, 'rsi_period': 52, 'ema1': 11, 'ema2': 45, 'slip_atr_k': 0.04501051115154729, 'slip_spread_k': 0.20451253495014127, 'spread_hl_frac': 0.007301610861745221, 'bb_std_mult': 2.779141257756524, 'rsi_os': 28, 'rsi_ob': 95, 'vol_spike': 0.27637308213135214, 'adx_thresh': 32.04296673879839, 'atr_min_pct': 0.011503917171373675, 'atr_max_pct': 0.14717854075199338, 'tp_mult': 1.6314881086962618, 'tsl_mult': 0.09802305710666517, 'strategy': 'breakout', 'time_stop': 199, 'use_sma': True, 'use_atr': False, 'use_adx': True, 'use_ema': True, 'use_spike': True, 'rsi_required': False, 'edge_k': 0.3930857952343536, 'edge_cap': 0.5054060337746403, 'bull_strategy': 'breakout', 'bull_bb_std_mult': 0.6996532831653585, 'bull_rsi_os': 12, 'bull_rsi_ob': 84, 'bull_adx_thresh': 5.611771691083944, 'bull_atr_min_pct': 0.003921865885747259, 'bull_atr_max_pct': 0.10125476714328077, 'bull_tp_mult': 1.8135547757931114, 'bull_tsl_mult': 0.42350237943116, 'bull_time_stop': 281, 'bull_use_sma': False, 'bull_use_ema': True, 'bull_use_atr': False, 'bull_use_adx': False, 'bull_use_spike': False, 'bull_rsi_required': True, 'bear_strategy': 'breakout', 'bear_bb_std_mult': 3.090696930144755, 'bear_rsi_os': 52, 'bear_rsi_ob': 76, 'bear_adx_thresh': 5.96894934030699, 'bear_atr_min_pct': 0.004578494881971111, 'bear_atr_max_pct': 0.14049074716020415, 'bear_tp_mult': 2.865189240509963, 'bear_tsl_mult': 0.7446373330734517, 'bear_time_stop': 275, 'bear_use_sma': False, 'bear_use_ema': True, 'bear_use_atr': False, 'bear_use_adx': False, 'bear_use_spike': False, 'bear_rsi_required': False, 'sideways_strategy': 'breakout', 'sideways_bb_std_mult': 2.813951429349927, 'sideways_rsi_os': 23, 'sideways_rsi_ob': 94, 'sideways_adx_thresh': 14.382416493558933, 'sideways_atr_min_pct': 0.016864380961691783, 'sideways_atr_max_pct': 0.11193663181355425, 'sideways_tp_mult': 1.3084901173360293, 'sideways_tsl_mult': 0.36443762739100377, 'sideways_time_stop': 11, 'sideways_use_sma': False, 'sideways_use_ema': False, 'sideways_use_atr': True, 'sideways_use_adx': False, 'sideways_use_spike': True, 'sideways_rsi_required': True}.
[I 2025-08-31 11:28:32,264] Trial 723 finished with values: [-0.013132253969234786, 0.013119012667272972] and parameters: {'p_sma': 14, 'p_std': 21, 'p_atr': 10, 'p_adx': 11, 'rsi_period': 52, 'ema1': 11, 'ema2': 41, 'slip_atr_k': 0.02942337357774127, 'slip_spread_k': 0.20510818220734317, 'spread_hl_frac': 0.007031689040702544, 'bb_std_mult': 2.837298048582497, 'rsi_os': 32, 'rsi_ob': 95, 'vol_spike': 0.29136082108198336, 'adx_thresh': 32.39788747698266, 'atr_min_pct': 0.011773815080499857, 'atr_max_pct': 0.14754706437456486, 'tp_mult': 1.58926097398837, 'tsl_mult': 0.09520034576053715, 'strategy': 'breakout', 'time_stop': 199, 'use_sma': True, 'use_atr': False, 'use_adx': True, 'use_ema': True, 'use_spike': True, 'rsi_required': False, 'edge_k': 0.3922607102449167, 'edge_cap': 0.5011488130700843, 'bull_strategy': 'breakout', 'bull_bb_std_mult': 0.6997660688446025, 'bull_rsi_os': 12, 'bull_rsi_ob': 84, 'bull_adx_thresh': 5.051881749462698, 'bull_atr_min_pct': 0.003944449501411407, 'bull_atr_max_pct': 0.09895584585992233, 'bull_tp_mult': 1.8079286281989195, 'bull_tsl_mult': 0.4704215427796182, 'bull_time_stop': 293, 'bull_use_sma': False, 'bull_use_ema': True, 'bull_use_atr': False, 'bull_use_adx': False, 'bull_use_spike': False, 'bull_rsi_required': True, 'bear_strategy': 'breakout', 'bear_bb_std_mult': 3.091871298732336, 'bear_rsi_os': 52, 'bear_rsi_ob': 74, 'bear_adx_thresh': 30.037071544635317, 'bear_atr_min_pct': 0.004568607195065508, 'bear_atr_max_pct': 0.13814297996690467, 'bear_tp_mult': 1.7243584606328746, 'bear_tsl_mult': 0.7468889395353925, 'bear_time_stop': 40, 'bear_use_sma': False, 'bear_use_ema': True, 'bear_use_atr': False, 'bear_use_adx': False, 'bear_use_spike': False, 'bear_rsi_required': False, 'sideways_strategy': 'breakout', 'sideways_bb_std_mult': 2.852163403854377, 'sideways_rsi_os': 25, 'sideways_rsi_ob': 95, 'sideways_adx_thresh': 8.958297626637645, 'sideways_atr_min_pct': 0.01684729024627546, 'sideways_atr_max_pct': 0.041067214721093856, 'sideways_tp_mult': 1.3208675488889758, 'sideways_tsl_mult': 0.36105667651131157, 'sideways_time_stop': 5, 'sideways_use_sma': False, 'sideways_use_ema': False, 'sideways_use_atr': True, 'sideways_use_adx': False, 'sideways_use_spike': True, 'sideways_rsi_required': True}.
[I 2025-08-31 11:29:07,655] Trial 724 finished with values: [-1000000000.0, 1000000000.0] and parameters: {'p_sma': 14, 'p_std': 32, 'p_atr': 25, 'p_adx': 16, 'rsi_period': 57, 'ema1': 12, 'ema2': 43, 'slip_atr_k': 0.046336450733736836, 'slip_spread_k': 0.20560297880617104, 'spread_hl_frac': 0.007309160847724226, 'bb_std_mult': 2.8678969845108515, 'rsi_os': 28, 'rsi_ob': 95, 'vol_spike': 0.2961834361324289, 'adx_thresh': 30.961509264645414, 'atr_min_pct': 0.01260593408862254, 'atr_max_pct': 0.1449884908370389, 'tp_mult': 1.770884710533207, 'tsl_mult': 0.07076469183776744, 'strategy': 'breakout', 'time_stop': 191, 'use_sma': True, 'use_atr': False, 'use_adx': True, 'use_ema': True, 'use_spike': True, 'rsi_required': False, 'edge_k': 0.3412265333227258, 'edge_cap': 0.5397025479008257, 'bull_strategy': 'breakout', 'bull_bb_std_mult': 0.619000501276472, 'bull_rsi_os': 33, 'bull_rsi_ob': 84, 'bull_adx_thresh': 5.000818848019048, 'bull_atr_min_pct': 0.00336331519364384, 'bull_atr_max_pct': 0.09877910387280338, 'bull_tp_mult': 1.8217216154781006, 'bull_tsl_mult': 0.42549455075941467, 'bull_time_stop': 293, 'bull_use_sma': False, 'bull_use_ema': True, 'bull_use_atr': False, 'bull_use_adx': True, 'bull_use_spike': False, 'bull_rsi_required': True, 'bear_strategy': 'breakout', 'bear_bb_std_mult': 3.1930696487684176, 'bear_rsi_os': 52, 'bear_rsi_ob': 74, 'bear_adx_thresh': 29.98057494581713, 'bear_atr_min_pct': 0.00377706556849808, 'bear_atr_max_pct': 0.1384875473539182, 'bear_tp_mult': 2.9960844821231176, 'bear_tsl_mult': 0.7432222241380685, 'bear_time_stop': 243, 'bear_use_sma': False, 'bear_use_ema': True, 'bear_use_atr': False, 'bear_use_adx': False, 'bear_use_spike': False, 'bear_rsi_required': False, 'sideways_strategy': 'breakout', 'sideways_bb_std_mult': 1.0651331648496494, 'sideways_rsi_os': 25, 'sideways_rsi_ob': 95, 'sideways_adx_thresh': 8.930410633503644, 'sideways_atr_min_pct': 0.016826110335067163, 'sideways_atr_max_pct': 0.04116874725032378, 'sideways_tp_mult': 1.7770683930410003, 'sideways_tsl_mult': 0.3224118426255275, 'sideways_time_stop': 12, 'sideways_use_sma': False, 'sideways_use_ema': False, 'sideways_use_atr': True, 'sideways_use_adx': False, 'sideways_use_spike': True, 'sideways_rsi_required': True}.
[I 2025-08-31 11:29:08,214] Trial 727 finished with values: [-1000000000.0, 1000000000.0] and parameters: {'p_sma': 14, 'p_std': 31, 'p_atr': 27, 'p_adx': 12, 'rsi_period': 52, 'ema1': 11, 'ema2': 41, 'slip_atr_k': 0.02818199955949273, 'slip_spread_k': 0.2262608212107956, 'spread_hl_frac': 0.005185452444996074, 'bb_std_mult': 2.856160813931397, 'rsi_os': 28, 'rsi_ob': 95, 'vol_spike': 0.28876617499745816, 'adx_thresh': 30.90876819847868, 'atr_min_pct': 0.012769599320324213, 'atr_max_pct': 0.14093335786882727, 'tp_mult': 1.7831756368936411, 'tsl_mult': 0.07561763845544886, 'strategy': 'breakout', 'time_stop': 188, 'use_sma': True, 'use_atr': False, 'use_adx': True, 'use_ema': False, 'use_spike': True, 'rsi_required': False, 'edge_k': 0.31953368160405643, 'edge_cap': 0.5477017134617518, 'bull_strategy': 'breakout', 'bull_bb_std_mult': 0.5790137585636101, 'bull_rsi_os': 33, 'bull_rsi_ob': 83, 'bull_adx_thresh': 6.02977037371023, 'bull_atr_min_pct': 0.0034962345831718346, 'bull_atr_max_pct': 0.09395335420884446, 'bull_tp_mult': 1.8179444347104863, 'bull_tsl_mult': 0.430262507422284, 'bull_time_stop': 292, 'bull_use_sma': False, 'bull_use_ema': True, 'bull_use_atr': False, 'bull_use_adx': True, 'bull_use_spike': False, 'bull_rsi_required': False, 'bear_strategy': 'mean_reversion', 'bear_bb_std_mult': 3.1894716512446064, 'bear_rsi_os': 54, 'bear_rsi_ob': 72, 'bear_adx_thresh': 13.684487109605257, 'bear_atr_min_pct': 0.003675933060711998, 'bear_atr_max_pct': 0.13774197156517273, 'bear_tp_mult': 1.157238718540246, 'bear_tsl_mult': 0.8010717746966902, 'bear_time_stop': 209, 'bear_use_sma': False, 'bear_use_ema': True, 'bear_use_atr': True, 'bear_use_adx': True, 'bear_use_spike': False, 'bear_rsi_required': False, 'sideways_strategy': 'breakout', 'sideways_bb_std_mult': 2.215084841081326, 'sideways_rsi_os': 25, 'sideways_rsi_ob': 95, 'sideways_adx_thresh': 10.723398511912652, 'sideways_atr_min_pct': 0.01689192437205856, 'sideways_atr_max_pct': 0.08229471603702823, 'sideways_tp_mult': 1.768040140354161, 'sideways_tsl_mult': 0.33678245516012845, 'sideways_time_stop': 11, 'sideways_use_sma': False, 'sideways_use_ema': True, 'sideways_use_atr': True, 'sideways_use_adx': False, 'sideways_use_spike': True, 'sideways_rsi_required': True}.
[I 2025-08-31 11:29:08,359] Trial 726 finished with values: [-1000000000.0, 1000000000.0] and parameters: {'p_sma': 14, 'p_std': 31, 'p_atr': 25, 'p_adx': 21, 'rsi_period': 52, 'ema1': 11, 'ema2': 42, 'slip_atr_k': 0.02947464152317951, 'slip_spread_k': 0.1722631865383131, 'spread_hl_frac': 0.005719213345039052, 'bb_std_mult': 2.9230619590611036, 'rsi_os': 29, 'rsi_ob': 94, 'vol_spike': 0.293295213815364, 'adx_thresh': 31.03588365900888, 'atr_min_pct': 0.012812138105759987, 'atr_max_pct': 0.14984495416174196, 'tp_mult': 1.7729110031449644, 'tsl_mult': 0.06731882854943819, 'strategy': 'breakout', 'time_stop': 190, 'use_sma': True, 'use_atr': False, 'use_adx': True, 'use_ema': False, 'use_spike': True, 'rsi_required': False, 'edge_k': 0.33824874276322675, 'edge_cap': 0.5351568028191487, 'bull_strategy': 'breakout', 'bull_bb_std_mult': 0.58166742006607, 'bull_rsi_os': 12, 'bull_rsi_ob': 83, 'bull_adx_thresh': 6.148687366448367, 'bull_atr_min_pct': 0.0034600314451200217, 'bull_atr_max_pct': 0.09432911378544041, 'bull_tp_mult': 1.807169918416128, 'bull_tsl_mult': 0.22400644581629497, 'bull_time_stop': 293, 'bull_use_sma': False, 'bull_use_ema': True, 'bull_use_atr': False, 'bull_use_adx': True, 'bull_use_spike': False, 'bull_rsi_required': False, 'bear_strategy': 'mean_reversion', 'bear_bb_std_mult': 3.208957048811024, 'bear_rsi_os': 54, 'bear_rsi_ob': 72, 'bear_adx_thresh': 29.755472241566657, 'bear_atr_min_pct': 0.0035364300672736416, 'bear_atr_max_pct': 0.1378159573779955, 'bear_tp_mult': 2.7372064940270313, 'bear_tsl_mult': 0.7785772380261395, 'bear_time_stop': 36, 'bear_use_sma': False, 'bear_use_ema': False, 'bear_use_atr': True, 'bear_use_adx': True, 'bear_use_spike': False, 'bear_rsi_required': False, 'sideways_strategy': 'breakout', 'sideways_bb_std_mult': 2.867268778663149, 'sideways_rsi_os': 25, 'sideways_rsi_ob': 95, 'sideways_adx_thresh': 13.657941115276309, 'sideways_atr_min_pct': 0.016748575254210855, 'sideways_atr_max_pct': 0.0817772883799028, 'sideways_tp_mult': 1.582224347512257, 'sideways_tsl_mult': 0.32480623972108197, 'sideways_time_stop': 11, 'sideways_use_sma': False, 'sideways_use_ema': True, 'sideways_use_atr': True, 'sideways_use_adx': False, 'sideways_use_spike': True, 'sideways_rsi_required': False}.
[I 2025-08-31 11:29:08,505] Trial 725 finished with values: [-1000000000.0, 1000000000.0] and parameters: {'p_sma': 14, 'p_std': 23, 'p_atr': 11, 'p_adx': 16, 'rsi_period': 57, 'ema1': 11, 'ema2': 42, 'slip_atr_k': 0.029714547218511522, 'slip_spread_k': 0.17319476346120904, 'spread_hl_frac': 0.004858112090551384, 'bb_std_mult': 2.861299933834535, 'rsi_os': 29, 'rsi_ob': 94, 'vol_spike': 0.28755703995403364, 'adx_thresh': 30.94288529907052, 'atr_min_pct': 0.012464340113904505, 'atr_max_pct': 0.14995418188714385, 'tp_mult': 1.785762062646198, 'tsl_mult': 0.06919302928936125, 'strategy': 'breakout', 'time_stop': 187, 'use_sma': True, 'use_atr': False, 'use_adx': True, 'use_ema': False, 'use_spike': True, 'rsi_required': False, 'edge_k': 0.3429860322445152, 'edge_cap': 0.5439699925708386, 'bull_strategy': 'breakout', 'bull_bb_std_mult': 0.5910634707855431, 'bull_rsi_os': 12, 'bull_rsi_ob': 83, 'bull_adx_thresh': 6.083931135406605, 'bull_atr_min_pct': 0.003335527221237802, 'bull_atr_max_pct': 0.09508821021465193, 'bull_tp_mult': 1.8127707599165046, 'bull_tsl_mult': 0.4088127228055463, 'bull_time_stop': 292, 'bull_use_sma': False, 'bull_use_ema': True, 'bull_use_atr': False, 'bull_use_adx': True, 'bull_use_spike': False, 'bull_rsi_required': False, 'bear_strategy': 'mean_reversion', 'bear_bb_std_mult': 3.2084289361635436, 'bear_rsi_os': 50, 'bear_rsi_ob': 72, 'bear_adx_thresh': 29.683739144517393, 'bear_atr_min_pct': 0.003851016656340836, 'bear_atr_max_pct': 0.1381101730777442, 'bear_tp_mult': 1.949691091253095, 'bear_tsl_mult': 0.770012251760357, 'bear_time_stop': 186, 'bear_use_sma': False, 'bear_use_ema': False, 'bear_use_atr': True, 'bear_use_adx': True, 'bear_use_spike': False, 'bear_rsi_required': False, 'sideways_strategy': 'breakout', 'sideways_bb_std_mult': 2.2294145252124706, 'sideways_rsi_os': 25, 'sideways_rsi_ob': 95, 'sideways_adx_thresh': 13.151882888090842, 'sideways_atr_min_pct': 0.016435208040635137, 'sideways_atr_max_pct': 0.10841562340384503, 'sideways_tp_mult': 1.591952281861313, 'sideways_tsl_mult': 0.33212685716305324, 'sideways_time_stop': 11, 'sideways_use_sma': False, 'sideways_use_ema': True, 'sideways_use_atr': True, 'sideways_use_adx': False, 'sideways_use_spike': True, 'sideways_rsi_required': False}.
[I 2025-08-31 11:29:42,799] Trial 731 finished with values: [-1000000000.0, 1000000000.0] and parameters: {'p_sma': 11, 'p_std': 25, 'p_atr': 16, 'p_adx': 8, 'rsi_period': 55, 'ema1': 12, 'ema2': 45, 'slip_atr_k': 0.03588458646771063, 'slip_spread_k': 0.12227366978710531, 'spread_hl_frac': 0.0060604095053400624, 'bb_std_mult': 3.553742505711213, 'rsi_os': 30, 'rsi_ob': 93, 'vol_spike': 0.00012652999096385287, 'adx_thresh': 32.58877508720816, 'atr_min_pct': 0.01098439411451263, 'atr_max_pct': 0.14713356912254968, 'tp_mult': 1.5776499112494786, 'tsl_mult': 0.0226622735721142, 'strategy': 'breakout', 'time_stop': 202, 'use_sma': True, 'use_atr': True, 'use_adx': False, 'use_ema': True, 'use_spike': False, 'rsi_required': False, 'edge_k': 0.31050291657644846, 'edge_cap': 0.49609047646224635, 'bull_strategy': 'breakout', 'bull_bb_std_mult': 1.3302785236464358, 'bull_rsi_os': 11, 'bull_rsi_ob': 82, 'bull_adx_thresh': 5.037561818637149, 'bull_atr_min_pct': 0.00454012905288571, 'bull_atr_max_pct': 0.09678384743475281, 'bull_tp_mult': 1.9212495029095777, 'bull_tsl_mult': 0.376505917946739, 'bull_time_stop': 300, 'bull_use_sma': False, 'bull_use_ema': True, 'bull_use_atr': True, 'bull_use_adx': False, 'bull_use_spike': True, 'bull_rsi_required': True, 'bear_strategy': 'breakout', 'bear_bb_std_mult': 3.0291801572787285, 'bear_rsi_os': 53, 'bear_rsi_ob': 76, 'bear_adx_thresh': 25.248687086230355, 'bear_atr_min_pct': 0.004714150831712336, 'bear_atr_max_pct': 0.1337249349267659, 'bear_tp_mult': 2.254974301198863, 'bear_tsl_mult': 0.7007465415774876, 'bear_time_stop': 40, 'bear_use_sma': False, 'bear_use_ema': True, 'bear_use_atr': False, 'bear_use_adx': False, 'bear_use_spike': False, 'bear_rsi_required': True, 'sideways_strategy': 'breakout', 'sideways_bb_std_mult': 1.4307612550814646, 'sideways_rsi_os': 26, 'sideways_rsi_ob': 94, 'sideways_adx_thresh': 11.449761901124743, 'sideways_atr_min_pct': 0.015727673201770077, 'sideways_atr_max_pct': 0.03925726791605797, 'sideways_tp_mult': 1.1449211747113046, 'sideways_tsl_mult': 0.3064918506675243, 'sideways_time_stop': 11, 'sideways_use_sma': False, 'sideways_use_ema': False, 'sideways_use_atr': True, 'sideways_use_adx': False, 'sideways_use_spike': True, 'sideways_rsi_required': True}.
