[I 2025-08-31 10:51:12,077] Trial 441 finished with values: [-1000000000.0, 1000000000.0] and parameters: {'p_sma': 13, 'p_std': 29, 'p_atr': 10, 'p_adx': 15, 'rsi_period': 50, 'ema1': 13, 'ema2': 52, 'slip_atr_k': 0.06291419581836749, 'slip_spread_k': 0.49367384684095894, 'spread_hl_frac': 0.02904317297448965, 'bb_std_mult': 2.9463293443608336, 'rsi_os': 25, 'rsi_ob': 77, 'vol_spike': 0.2769194442441319, 'adx_thresh': 28.83642715377015, 'atr_min_pct': 0.005689434612209731, 'atr_max_pct': 0.10837607357930909, 'tp_mult': 2.3170991570775517, 'tsl_mult': 0.7061282583737848, 'strategy': 'mean_reversion', 'time_stop': 176, 'use_sma': False, 'use_atr': False, 'use_adx': True, 'use_ema': True, 'use_spike': True, 'rsi_required': True, 'edge_k': 0.22693544270779997, 'edge_cap': 0.40805563481759455, 'bull_strategy': 'breakout', 'bull_bb_std_mult': 1.372540259158841, 'bull_rsi_os': 13, 'bull_rsi_ob': 85, 'bull_adx_thresh': 6.996836524605911, 'bull_atr_min_pct': 0.005585484062343238, 'bull_atr_max_pct': 0.10342730575118197, 'bull_tp_mult': 1.6700270050189787, 'bull_tsl_mult': 0.14377861468396147, 'bull_time_stop': 94, 'bull_use_sma': False, 'bull_use_ema': False, 'bull_use_atr': False, 'bull_use_adx': True, 'bull_use_spike': False, 'bull_rsi_required': True, 'bear_strategy': 'breakout', 'bear_bb_std_mult': 1.7629342462332969, 'bear_rsi_os': 40, 'bear_rsi_ob': 89, 'bear_adx_thresh': 20.233186985894022, 'bear_atr_min_pct': 0.0044683752156615495, 'bear_atr_max_pct': 0.13522946314303114, 'bear_tp_mult': 2.7813671209721833, 'bear_tsl_mult': 0.5563920274647931, 'bear_time_stop': 144, 'bear_use_sma': False, 'bear_use_ema': True, 'bear_use_atr': False, 'bear_use_adx': False, 'bear_use_spike': True, 'bear_rsi_required': False, 'sideways_strategy': 'mean_reversion', 'sideways_bb_std_mult': 2.922022601449835, 'sideways_rsi_os': 9, 'sideways_rsi_ob': 90, 'sideways_adx_thresh': 20.994597750335988, 'sideways_atr_min_pct': 0.019373958971079894, 'sideways_atr_max_pct': 0.04776341629557229, 'sideways_tp_mult': 1.1695787378188465, 'sideways_tsl_mult': 0.09263892352754668, 'sideways_time_stop': 26, 'sideways_use_sma': True, 'sideways_use_ema': False, 'sideways_use_atr': True, 'sideways_use_adx': False, 'sideways_use_spike': False, 'sideways_rsi_required': True}.
[I 2025-08-31 10:51:12,229] Trial 440 finished with values: [-1000000000.0, 1000000000.0] and parameters: {'p_sma': 17, 'p_std': 17, 'p_atr': 10, 'p_adx': 14, 'rsi_period': 50, 'ema1': 13, 'ema2': 48, 'slip_atr_k': 0.18180982066558787, 'slip_spread_k': 0.6695730021294877, 'spread_hl_frac': 0.029372714440255986, 'bb_std_mult': 1.1885822576583445, 'rsi_os': 25, 'rsi_ob': 55, 'vol_spike': 0.14128423519905647, 'adx_thresh': 34.99093553633476, 'atr_min_pct': 0.007981895909320191, 'atr_max_pct': 0.10990660637744751, 'tp_mult': 1.0110301577201461, 'tsl_mult': 0.30112422720324405, 'strategy': 'mean_reversion', 'time_stop': 82, 'use_sma': False, 'use_atr': False, 'use_adx': True, 'use_ema': True, 'use_spike': True, 'rsi_required': True, 'edge_k': 0.22394226320410812, 'edge_cap': 0.979465231778561, 'bull_strategy': 'breakout', 'bull_bb_std_mult': 0.5453115979129093, 'bull_rsi_os': 10, 'bull_rsi_ob': 93, 'bull_adx_thresh': 33.47436321731994, 'bull_atr_min_pct': 0.014073305566543879, 'bull_atr_max_pct': 0.08359740849607054, 'bull_tp_mult': 1.6655995552138145, 'bull_tsl_mult': 0.5730943480064393, 'bull_time_stop': 42, 'bull_use_sma': False, 'bull_use_ema': False, 'bull_use_atr': False, 'bull_use_adx': True, 'bull_use_spike': False, 'bull_rsi_required': False, 'bear_strategy': 'breakout', 'bear_bb_std_mult': 2.6718109276300326, 'bear_rsi_os': 34, 'bear_rsi_ob': 80, 'bear_adx_thresh': 31.319857501149162, 'bear_atr_min_pct': 0.013633826605447059, 'bear_atr_max_pct': 0.1143229515643994, 'bear_tp_mult': 1.9860527648919832, 'bear_tsl_mult': 0.5611830718887015, 'bear_time_stop': 230, 'bear_use_sma': False, 'bear_use_ema': True, 'bear_use_atr': False, 'bear_use_adx': False, 'bear_use_spike': True, 'bear_rsi_required': False, 'sideways_strategy': 'mean_reversion', 'sideways_bb_std_mult': 2.9389258794139197, 'sideways_rsi_os': 44, 'sideways_rsi_ob': 73, 'sideways_adx_thresh': 25.92736514582152, 'sideways_atr_min_pct': 0.01956253317146735, 'sideways_atr_max_pct': 0.14944332458774973, 'sideways_tp_mult': 1.8432271588025988, 'sideways_tsl_mult': 0.05356362360820516, 'sideways_time_stop': 63, 'sideways_use_sma': True, 'sideways_use_ema': False, 'sideways_use_atr': True, 'sideways_use_adx': False, 'sideways_use_spike': False, 'sideways_rsi_required': True}.
[I 2025-08-31 10:51:13,034] Trial 443 finished with values: [-1000000000.0, 1000000000.0] and parameters: {'p_sma': 13, 'p_std': 12, 'p_atr': 16, 'p_adx': 13, 'rsi_period': 12, 'ema1': 29, 'ema2': 54, 'slip_atr_k': 0.035781023433673925, 'slip_spread_k': 0.6617978428249739, 'spread_hl_frac': 0.029203394018617036, 'bb_std_mult': 2.6835658797328854, 'rsi_os': 25, 'rsi_ob': 82, 'vol_spike': 0.27473922842489423, 'adx_thresh': 28.76192112288112, 'atr_min_pct': 0.005623650284575008, 'atr_max_pct': 0.11523497973147268, 'tp_mult': 2.8477838159489735, 'tsl_mult': 0.2264349009890454, 'strategy': 'breakout', 'time_stop': 81, 'use_sma': False, 'use_atr': False, 'use_adx': True, 'use_ema': True, 'use_spike': True, 'rsi_required': True, 'edge_k': 0.22956513215806093, 'edge_cap': 0.5977905750540613, 'bull_strategy': 'breakout', 'bull_bb_std_mult': 1.5080280864618851, 'bull_rsi_os': 12, 'bull_rsi_ob': 76, 'bull_adx_thresh': 8.196544149841582, 'bull_atr_min_pct': 0.011489555211982395, 'bull_atr_max_pct': 0.11892986614767592, 'bull_tp_mult': 1.8344440678695022, 'bull_tsl_mult': 0.1368044481978059, 'bull_time_stop': 86, 'bull_use_sma': True, 'bull_use_ema': False, 'bull_use_atr': False, 'bull_use_adx': True, 'bull_use_spike': False, 'bull_rsi_required': True, 'bear_strategy': 'breakout', 'bear_bb_std_mult': 2.604559008158433, 'bear_rsi_os': 33, 'bear_rsi_ob': 63, 'bear_adx_thresh': 32.43315710609984, 'bear_atr_min_pct': 0.014287389609190673, 'bear_atr_max_pct': 0.02317470643322664, 'bear_tp_mult': 1.5997257164388325, 'bear_tsl_mult': 0.555431523669245, 'bear_time_stop': 109, 'bear_use_sma': False, 'bear_use_ema': True, 'bear_use_atr': False, 'bear_use_adx': False, 'bear_use_spike': False, 'bear_rsi_required': False, 'sideways_strategy': 'mean_reversion', 'sideways_bb_std_mult': 2.947656270292029, 'sideways_rsi_os': 9, 'sideways_rsi_ob': 88, 'sideways_adx_thresh': 27.860399914506885, 'sideways_atr_min_pct': 0.018697279185682168, 'sideways_atr_max_pct': 0.14984642949578952, 'sideways_tp_mult': 1.9217315878848715, 'sideways_tsl_mult': 0.5308064768008066, 'sideways_time_stop': 152, 'sideways_use_sma': False, 'sideways_use_ema': False, 'sideways_use_atr': True, 'sideways_use_adx': False, 'sideways_use_spike': False, 'sideways_rsi_required': True}.
[I 2025-08-31 10:51:44,152] Trial 446 finished with values: [-1000000000.0, 1000000000.0] and parameters: {'p_sma': 36, 'p_std': 32, 'p_atr': 16, 'p_adx': 11, 'rsi_period': 71, 'ema1': 14, 'ema2': 55, 'slip_atr_k': 0.17016967999550736, 'slip_spread_k': 0.6590842730012301, 'spread_hl_frac': 0.031805612813823464, 'bb_std_mult': 2.6923068463074995, 'rsi_os': 28, 'rsi_ob': 76, 'vol_spike': 0.26930306711693575, 'adx_thresh': 27.26021076661462, 'atr_min_pct': 0.0053930247978541315, 'atr_max_pct': 0.0959120728724666, 'tp_mult': 2.855135245950512, 'tsl_mult': 0.24886468609782408, 'strategy': 'breakout', 'time_stop': 72, 'use_sma': True, 'use_atr': False, 'use_adx': True, 'use_ema': True, 'use_spike': True, 'rsi_required': True, 'edge_k': 0.35725873493787275, 'edge_cap': 0.4440273197251786, 'bull_strategy': 'breakout', 'bull_bb_std_mult': 2.061049416799189, 'bull_rsi_os': 53, 'bull_rsi_ob': 83, 'bull_adx_thresh': 5.612307537047534, 'bull_atr_min_pct': 0.01138518667523946, 'bull_atr_max_pct': 0.07729658548346471, 'bull_tp_mult': 1.771769230004908, 'bull_tsl_mult': 0.08653985906735473, 'bull_time_stop': 86, 'bull_use_sma': True, 'bull_use_ema': False, 'bull_use_atr': False, 'bull_use_adx': False, 'bull_use_spike': False, 'bull_rsi_required': True, 'bear_strategy': 'breakout', 'bear_bb_std_mult': 2.0494479916049686, 'bear_rsi_os': 36, 'bear_rsi_ob': 85, 'bear_adx_thresh': 25.07366413902127, 'bear_atr_min_pct': 0.006316457705771671, 'bear_atr_max_pct': 0.0659978346334546, 'bear_tp_mult': 2.3442102617343776, 'bear_tsl_mult': 0.4115471722436295, 'bear_time_stop': 108, 'bear_use_sma': False, 'bear_use_ema': True, 'bear_use_atr': False, 'bear_use_adx': False, 'bear_use_spike': False, 'bear_rsi_required': False, 'sideways_strategy': 'mean_reversion', 'sideways_bb_std_mult': 3.5630760819090845, 'sideways_rsi_os': 5, 'sideways_rsi_ob': 91, 'sideways_adx_thresh': 17.636551203780108, 'sideways_atr_min_pct': 0.01871871126748118, 'sideways_atr_max_pct': 0.03236492731102736, 'sideways_tp_mult': 2.925209586934937, 'sideways_tsl_mult': 0.39334747960494654, 'sideways_time_stop': 27, 'sideways_use_sma': False, 'sideways_use_ema': False, 'sideways_use_atr': False, 'sideways_use_adx': False, 'sideways_use_spike': False, 'sideways_rsi_required': True}.
[I 2025-08-31 10:51:44,336] Trial 447 finished with values: [-1000000000.0, 1000000000.0] and parameters: {'p_sma': 15, 'p_std': 32, 'p_atr': 9, 'p_adx': 14, 'rsi_period': 71, 'ema1': 26, 'ema2': 55, 'slip_atr_k': 0.1259454902246115, 'slip_spread_k': 0.6457459567376284, 'spread_hl_frac': 0.01022996649506519, 'bb_std_mult': 2.807200997209817, 'rsi_os': 34, 'rsi_ob': 76, 'vol_spike': 0.26804268307327006, 'adx_thresh': 30.31772367019243, 'atr_min_pct': 0.011276806551298913, 'atr_max_pct': 0.04790801380191945, 'tp_mult': 2.3949469670396155, 'tsl_mult': 0.26271245939914417, 'strategy': 'breakout', 'time_stop': 72, 'use_sma': True, 'use_atr': False, 'use_adx': True, 'use_ema': True, 'use_spike': False, 'rsi_required': True, 'edge_k': 0.3570077353881861, 'edge_cap': 0.10056007228337982, 'bull_strategy': 'breakout', 'bull_bb_std_mult': 2.463418060017923, 'bull_rsi_os': 14, 'bull_rsi_ob': 76, 'bull_adx_thresh': 15.557683885948915, 'bull_atr_min_pct': 0.015124073879649463, 'bull_atr_max_pct': 0.0909934929418975, 'bull_tp_mult': 1.7632061829928083, 'bull_tsl_mult': 0.3665121079394596, 'bull_time_stop': 274, 'bull_use_sma': True, 'bull_use_ema': False, 'bull_use_atr': False, 'bull_use_adx': False, 'bull_use_spike': False, 'bull_rsi_required': True, 'bear_strategy': 'breakout', 'bear_bb_std_mult': 1.4890392101532877, 'bear_rsi_os': 29, 'bear_rsi_ob': 85, 'bear_adx_thresh': 12.15746438586293, 'bear_atr_min_pct': 0.0062921432529340765, 'bear_atr_max_pct': 0.11766428874882749, 'bear_tp_mult': 2.0513414347090184, 'bear_tsl_mult': 0.4954568775929703, 'bear_time_stop': 39, 'bear_use_sma': False, 'bear_use_ema': True, 'bear_use_atr': False, 'bear_use_adx': False, 'bear_use_spike': True, 'bear_rsi_required': False, 'sideways_strategy': 'mean_reversion', 'sideways_bb_std_mult': 2.689157410513772, 'sideways_rsi_os': 5, 'sideways_rsi_ob': 91, 'sideways_adx_thresh': 7.646627436176635, 'sideways_atr_min_pct': 0.028995572402325753, 'sideways_atr_max_pct': 0.025934852434940814, 'sideways_tp_mult': 2.0979644809287685, 'sideways_tsl_mult': 0.09633751541454956, 'sideways_time_stop': 218, 'sideways_use_sma': False, 'sideways_use_ema': False, 'sideways_use_atr': False, 'sideways_use_adx': False, 'sideways_use_spike': False, 'sideways_rsi_required': False}.
[I 2025-08-31 10:51:44,567] Trial 444 finished with values: [-1000000000.0, 1000000000.0] and parameters: {'p_sma': 37, 'p_std': 11, 'p_atr': 8, 'p_adx': 15, 'rsi_period': 46, 'ema1': 29, 'ema2': 54, 'slip_atr_k': 0.03252716499408341, 'slip_spread_k': 0.9811558849473985, 'spread_hl_frac': 0.010051031851045965, 'bb_std_mult': 1.5057411554174276, 'rsi_os': 51, 'rsi_ob': 77, 'vol_spike': 0.27531977492030757, 'adx_thresh': 29.4918950043331, 'atr_min_pct': 0.005609094416271743, 'atr_max_pct': 0.108818221314833, 'tp_mult': 2.3943969492499355, 'tsl_mult': 0.2502614561812262, 'strategy': 'breakout', 'time_stop': 176, 'use_sma': False, 'use_atr': False, 'use_adx': True, 'use_ema': True, 'use_spike': True, 'rsi_required': True, 'edge_k': 0.3477737509383586, 'edge_cap': 0.22777229959853101, 'bull_strategy': 'breakout', 'bull_bb_std_mult': 2.5268447423673157, 'bull_rsi_os': 14, 'bull_rsi_ob': 76, 'bull_adx_thresh': 7.484653981608793, 'bull_atr_min_pct': 0.011461620515011706, 'bull_atr_max_pct': 0.02344506031276484, 'bull_tp_mult': 2.7336280981096266, 'bull_tsl_mult': 0.5752308074701433, 'bull_time_stop': 89, 'bull_use_sma': True, 'bull_use_ema': False, 'bull_use_atr': False, 'bull_use_adx': True, 'bull_use_spike': False, 'bull_rsi_required': True, 'bear_strategy': 'breakout', 'bear_bb_std_mult': 2.0613849503960466, 'bear_rsi_os': 25, 'bear_rsi_ob': 63, 'bear_adx_thresh': 29.418736879665996, 'bear_atr_min_pct': 0.029942057999148702, 'bear_atr_max_pct': 0.11014266223735783, 'bear_tp_mult': 2.0531452974704627, 'bear_tsl_mult': 0.5679809088169159, 'bear_time_stop': 37, 'bear_use_sma': False, 'bear_use_ema': True, 'bear_use_atr': False, 'bear_use_adx': False, 'bear_use_spike': True, 'bear_rsi_required': False, 'sideways_strategy': 'mean_reversion', 'sideways_bb_std_mult': 2.6897879178363455, 'sideways_rsi_os': 7, 'sideways_rsi_ob': 90, 'sideways_adx_thresh': 25.102284632624972, 'sideways_atr_min_pct': 0.02001909626302179, 'sideways_atr_max_pct': 0.026110527547246604, 'sideways_tp_mult': 2.1027566900268266, 'sideways_tsl_mult': 0.5317789463896604, 'sideways_time_stop': 27, 'sideways_use_sma': False, 'sideways_use_ema': False, 'sideways_use_atr': False, 'sideways_use_adx': False, 'sideways_use_spike': False, 'sideways_rsi_required': True}.
[I 2025-08-31 10:51:44,640] Trial 445 finished with values: [-1000000000.0, 1000000000.0] and parameters: {'p_sma': 18, 'p_std': 31, 'p_atr': 10, 'p_adx': 27, 'rsi_period': 12, 'ema1': 8, 'ema2': 55, 'slip_atr_k': 0.13619236989105082, 'slip_spread_k': 0.43486559530585867, 'spread_hl_frac': 0.03186221788478501, 'bb_std_mult': 1.515056582873863, 'rsi_os': 34, 'rsi_ob': 76, 'vol_spike': 0.26787301881018233, 'adx_thresh': 19.232321315282775, 'atr_min_pct': 0.005299333526733538, 'atr_max_pct': 0.09638168899176938, 'tp_mult': 2.3925128047280437, 'tsl_mult': 0.24330802599082285, 'strategy': 'breakout', 'time_stop': 72, 'use_sma': True, 'use_atr': False, 'use_adx': True, 'use_ema': True, 'use_spike': True, 'rsi_required': True, 'edge_k': 0.43930552775332254, 'edge_cap': 0.6011177400535433, 'bull_strategy': 'breakout', 'bull_bb_std_mult': 0.7661506580031331, 'bull_rsi_os': 9, 'bull_rsi_ob': 76, 'bull_adx_thresh': 33.79898228975007, 'bull_atr_min_pct': 0.018575571455468922, 'bull_atr_max_pct': 0.022370070047744633, 'bull_tp_mult': 1.7852949233682, 'bull_tsl_mult': 0.36242719092301345, 'bull_time_stop': 70, 'bull_use_sma': True, 'bull_use_ema': False, 'bull_use_atr': False, 'bull_use_adx': False, 'bull_use_spike': False, 'bull_rsi_required': True, 'bear_strategy': 'breakout', 'bear_bb_std_mult': 2.511657224049828, 'bear_rsi_os': 37, 'bear_rsi_ob': 63, 'bear_adx_thresh': 21.55569054097798, 'bear_atr_min_pct': 0.025405534553118676, 'bear_atr_max_pct': 0.1253498783638566, 'bear_tp_mult': 1.5767526702449393, 'bear_tsl_mult': 0.4901657676802028, 'bear_time_stop': 39, 'bear_use_sma': False, 'bear_use_ema': True, 'bear_use_atr': False, 'bear_use_adx': False, 'bear_use_spike': False, 'bear_rsi_required': False, 'sideways_strategy': 'mean_reversion', 'sideways_bb_std_mult': 3.336593404256738, 'sideways_rsi_os': 5, 'sideways_rsi_ob': 91, 'sideways_adx_thresh': 25.341194944579414, 'sideways_atr_min_pct': 0.02920955770602162, 'sideways_atr_max_pct': 0.025295983517144766, 'sideways_tp_mult': 1.9209870595513323, 'sideways_tsl_mult': 0.532869182203387, 'sideways_time_stop': 269, 'sideways_use_sma': False, 'sideways_use_ema': False, 'sideways_use_atr': False, 'sideways_use_adx': False, 'sideways_use_spike': False, 'sideways_rsi_required': True}.
[I 2025-08-31 10:52:16,100] Trial 449 finished with values: [-1000000000.0, 1000000000.0] and parameters: {'p_sma': 24, 'p_std': 54, 'p_atr': 11, 'p_adx': 15, 'rsi_period': 21, 'ema1': 14, 'ema2': 21, 'slip_atr_k': 0.009832086604138856, 'slip_spread_k': 0.46698008280967496, 'spread_hl_frac': 0.018434377555143138, 'bb_std_mult': 1.5229282261396666, 'rsi_os': 23, 'rsi_ob': 77, 'vol_spike': 0.2465575615353962, 'adx_thresh': 29.68102275333156, 'atr_min_pct': 0.014196154416007795, 'atr_max_pct': 0.09610539397994995, 'tp_mult': 2.4790584879369124, 'tsl_mult': 0.27988816931774757, 'strategy': 'breakout', 'time_stop': 60, 'use_sma': True, 'use_atr': False, 'use_adx': True, 'use_ema': True, 'use_spike': True, 'rsi_required': True, 'edge_k': 0.4253397815515859, 'edge_cap': 0.22626999911083795, 'bull_strategy': 'breakout', 'bull_bb_std_mult': 0.7678527256565147, 'bull_rsi_os': 12, 'bull_rsi_ob': 57, 'bull_adx_thresh': 6.406265854375037, 'bull_atr_min_pct': 0.006673313900383766, 'bull_atr_max_pct': 0.11256224277063594, 'bull_tp_mult': 1.7325587918588992, 'bull_tsl_mult': 0.3006535391290903, 'bull_time_stop': 198, 'bull_use_sma': True, 'bull_use_ema': False, 'bull_use_atr': False, 'bull_use_adx': False, 'bull_use_spike': False, 'bull_rsi_required': True, 'bear_strategy': 'mean_reversion', 'bear_bb_std_mult': 2.5060957751299497, 'bear_rsi_os': 39, 'bear_rsi_ob': 91, 'bear_adx_thresh': 21.62639579707551, 'bear_atr_min_pct': 0.004764669382326107, 'bear_atr_max_pct': 0.11159614121078167, 'bear_tp_mult': 2.857026580343637, 'bear_tsl_mult': 0.48195392992879205, 'bear_time_stop': 27, 'bear_use_sma': False, 'bear_use_ema': True, 'bear_use_atr': False, 'bear_use_adx': False, 'bear_use_spike': True, 'bear_rsi_required': False, 'sideways_strategy': 'mean_reversion', 'sideways_bb_std_mult': 2.410293283421618, 'sideways_rsi_os': 40, 'sideways_rsi_ob': 94, 'sideways_adx_thresh': 31.160390032584765, 'sideways_atr_min_pct': 0.017212076041571166, 'sideways_atr_max_pct': 0.07406195671571772, 'sideways_tp_mult': 1.972698855912857, 'sideways_tsl_mult': 0.08616114723850496, 'sideways_time_stop': 200, 'sideways_use_sma': False, 'sideways_use_ema': False, 'sideways_use_atr': False, 'sideways_use_adx': False, 'sideways_use_spike': False, 'sideways_rsi_required': True}.
[I 2025-08-31 10:52:16,425] Trial 448 finished with values: [-1000000000.0, 1000000000.0] and parameters: {'p_sma': 15, 'p_std': 54, 'p_atr': 11, 'p_adx': 13, 'rsi_period': 79, 'ema1': 22, 'ema2': 57, 'slip_atr_k': 0.13619649950348786, 'slip_spread_k': 0.9850194139647537, 'spread_hl_frac': 0.018338215231438675, 'bb_std_mult': 2.7801921775414313, 'rsi_os': 51, 'rsi_ob': 77, 'vol_spike': 0.2457055623341542, 'adx_thresh': 30.24408501551845, 'atr_min_pct': 0.006129546337269455, 'atr_max_pct': 0.09312624082849971, 'tp_mult': 2.398869259977348, 'tsl_mult': 0.5144641909929916, 'strategy': 'breakout', 'time_stop': 57, 'use_sma': True, 'use_atr': False, 'use_adx': True, 'use_ema': True, 'use_spike': False, 'rsi_required': True, 'edge_k': 0.13446319413689262, 'edge_cap': 0.5293897489639943, 'bull_strategy': 'breakout', 'bull_bb_std_mult': 2.444606324915716, 'bull_rsi_os': 49, 'bull_rsi_ob': 73, 'bull_adx_thresh': 7.433431932331748, 'bull_atr_min_pct': 0.01471675896420205, 'bull_atr_max_pct': 0.09198519464095502, 'bull_tp_mult': 1.0139988341137487, 'bull_tsl_mult': 0.4173863475739078, 'bull_time_stop': 71, 'bull_use_sma': True, 'bull_use_ema': False, 'bull_use_atr': False, 'bull_use_adx': False, 'bull_use_spike': False, 'bull_rsi_required': True, 'bear_strategy': 'mean_reversion', 'bear_bb_std_mult': 2.5027530634464448, 'bear_rsi_os': 37, 'bear_rsi_ob': 51, 'bear_adx_thresh': 5.516843127007427, 'bear_atr_min_pct': 0.02293093667321105, 'bear_atr_max_pct': 0.11036467997501305, 'bear_tp_mult': 2.863554553983942, 'bear_tsl_mult': 0.4877782448362071, 'bear_time_stop': 38, 'bear_use_sma': False, 'bear_use_ema': True, 'bear_use_atr': False, 'bear_use_adx': False, 'bear_use_spike': True, 'bear_rsi_required': False, 'sideways_strategy': 'mean_reversion', 'sideways_bb_std_mult': 2.6701520792876514, 'sideways_rsi_os': 7, 'sideways_rsi_ob': 50, 'sideways_adx_thresh': 7.000896711211171, 'sideways_atr_min_pct': 0.024769392059074864, 'sideways_atr_max_pct': 0.02420383048515475, 'sideways_tp_mult': 1.4178210440858938, 'sideways_tsl_mult': 0.08903289995768586, 'sideways_time_stop': 198, 'sideways_use_sma': False, 'sideways_use_ema': False, 'sideways_use_atr': False, 'sideways_use_adx': False, 'sideways_use_spike': False, 'sideways_rsi_required': False}.
