[I 2025-08-31 11:11:20,029] Trial 593 finished with values: [-1000000000.0, 1000000000.0] and parameters: {'p_sma': 12, 'p_std': 28, 'p_atr': 7, 'p_adx': 14, 'rsi_period': 72, 'ema1': 13, 'ema2': 55, 'slip_atr_k': 0.20459044646309357, 'slip_spread_k': 0.9076913370220113, 'spread_hl_frac': 0.011100388738259364, 'bb_std_mult': 2.0373301185286623, 'rsi_os': 26, 'rsi_ob': 48, 'vol_spike': 0.045407002690096746, 'adx_thresh': 26.785449685252416, 'atr_min_pct': 0.006940077416536197, 'atr_max_pct': 0.07292647620523814, 'tp_mult': 2.42261482621148, 'tsl_mult': 0.1279610674207154, 'strategy': 'breakout', 'time_stop': 174, 'use_sma': True, 'use_atr': True, 'use_adx': False, 'use_ema': True, 'use_spike': True, 'rsi_required': True, 'edge_k': 0.29085137018762663, 'edge_cap': 0.11233125996519, 'bull_strategy': 'mean_reversion', 'bull_bb_std_mult': 1.2763814545243144, 'bull_rsi_os': 13, 'bull_rsi_ob': 60, 'bull_adx_thresh': 7.851140765539059, 'bull_atr_min_pct': 0.002778182883083462, 'bull_atr_max_pct': 0.10312381118086736, 'bull_tp_mult': 1.2060359213036307, 'bull_tsl_mult': 0.38791198302050117, 'bull_time_stop': 201, 'bull_use_sma': False, 'bull_use_ema': False, 'bull_use_atr': False, 'bull_use_adx': True, 'bull_use_spike': True, 'bull_rsi_required': True, 'bear_strategy': 'mean_reversion', 'bear_bb_std_mult': 3.2600800943385444, 'bear_rsi_os': 36, 'bear_rsi_ob': 62, 'bear_adx_thresh': 5.548007494730316, 'bear_atr_min_pct': 0.02001475726383465, 'bear_atr_max_pct': 0.09808435082642797, 'bear_tp_mult': 2.886355922680795, 'bear_tsl_mult': 0.5912694286394515, 'bear_time_stop': 32, 'bear_use_sma': True, 'bear_use_ema': True, 'bear_use_atr': True, 'bear_use_adx': False, 'bear_use_spike': True, 'bear_rsi_required': False, 'sideways_strategy': 'breakout', 'sideways_bb_std_mult': 1.6219465338184913, 'sideways_rsi_os': 28, 'sideways_rsi_ob': 64, 'sideways_adx_thresh': 24.914806339916176, 'sideways_atr_min_pct': 0.019480356206292477, 'sideways_atr_max_pct': 0.03927697109480027, 'sideways_tp_mult': 1.6196575954513481, 'sideways_tsl_mult': 0.17798813494495883, 'sideways_time_stop': 15, 'sideways_use_sma': False, 'sideways_use_ema': True, 'sideways_use_atr': False, 'sideways_use_adx': False, 'sideways_use_spike': False, 'sideways_rsi_required': True}.
[I 2025-08-31 11:11:20,229] Trial 594 finished with values: [-1000000000.0, 1000000000.0] and parameters: {'p_sma': 17, 'p_std': 28, 'p_atr': 12, 'p_adx': 14, 'rsi_period': 44, 'ema1': 10, 'ema2': 57, 'slip_atr_k': 0.01881033941316854, 'slip_spread_k': 0.1486819014075667, 'spread_hl_frac': 4.928614669110279e-05, 'bb_std_mult': 1.5632600599839266, 'rsi_os': 26, 'rsi_ob': 78, 'vol_spike': 0.04626599672285078, 'adx_thresh': 28.932653272281737, 'atr_min_pct': 0.008955614399416778, 'atr_max_pct': 0.09575712218194522, 'tp_mult': 2.4071867686407353, 'tsl_mult': 0.8184838189586889, 'strategy': 'breakout', 'time_stop': 72, 'use_sma': True, 'use_atr': True, 'use_adx': False, 'use_ema': True, 'use_spike': True, 'rsi_required': False, 'edge_k': 0.13643234724203004, 'edge_cap': 0.07850075079077123, 'bull_strategy': 'breakout', 'bull_bb_std_mult': 0.8961605806852977, 'bull_rsi_os': 15, 'bull_rsi_ob': 76, 'bull_adx_thresh': 27.05449452321217, 'bull_atr_min_pct': 0.0040628444637254325, 'bull_atr_max_pct': 0.036193747307192034, 'bull_tp_mult': 2.6682720974480736, 'bull_tsl_mult': 0.3712726522991096, 'bull_time_stop': 201, 'bull_use_sma': True, 'bull_use_ema': False, 'bull_use_atr': True, 'bull_use_adx': False, 'bull_use_spike': False, 'bull_rsi_required': True, 'bear_strategy': 'breakout', 'bear_bb_std_mult': 3.086719323028518, 'bear_rsi_os': 19, 'bear_rsi_ob': 78, 'bear_adx_thresh': 22.174154563217414, 'bear_atr_min_pct': 0.004674875423041812, 'bear_atr_max_pct': 0.12182196132013683, 'bear_tp_mult': 2.7691624021484236, 'bear_tsl_mult': 0.5099382807725004, 'bear_time_stop': 263, 'bear_use_sma': False, 'bear_use_ema': False, 'bear_use_atr': True, 'bear_use_adx': False, 'bear_use_spike': True, 'bear_rsi_required': True, 'sideways_strategy': 'mean_reversion', 'sideways_bb_std_mult': 2.71825178534634, 'sideways_rsi_os': 39, 'sideways_rsi_ob': 84, 'sideways_adx_thresh': 28.72330523206684, 'sideways_atr_min_pct': 0.01993558696628056, 'sideways_atr_max_pct': 0.038747941840321404, 'sideways_tp_mult': 1.9535415778554592, 'sideways_tsl_mult': 0.4304592344294642, 'sideways_time_stop': 33, 'sideways_use_sma': False, 'sideways_use_ema': True, 'sideways_use_atr': False, 'sideways_use_adx': True, 'sideways_use_spike': True, 'sideways_rsi_required': True}.
[I 2025-08-31 11:11:20,373] Trial 596 finished with values: [-1000000000.0, 1000000000.0] and parameters: {'p_sma': 28, 'p_std': 26, 'p_atr': 10, 'p_adx': 14, 'rsi_period': 9, 'ema1': 14, 'ema2': 50, 'slip_atr_k': 0.05078914740609357, 'slip_spread_k': 0.2396529308853071, 'spread_hl_frac': 0.009611386649707676, 'bb_std_mult': 1.1721222298020126, 'rsi_os': 27, 'rsi_ob': 64, 'vol_spike': 0.09886158850684262, 'adx_thresh': 30.322440500401612, 'atr_min_pct': 0.006949421665651276, 'atr_max_pct': 0.06565711756574195, 'tp_mult': 2.982730108947416, 'tsl_mult': 0.22350128215226117, 'strategy': 'breakout', 'time_stop': 73, 'use_sma': True, 'use_atr': True, 'use_adx': False, 'use_ema': True, 'use_spike': True, 'rsi_required': False, 'edge_k': 1.7122341484028265, 'edge_cap': 0.2873871787224245, 'bull_strategy': 'mean_reversion', 'bull_bb_std_mult': 2.8790647787296173, 'bull_rsi_os': 18, 'bull_rsi_ob': 86, 'bull_adx_thresh': 26.865816280817715, 'bull_atr_min_pct': 0.0027674456882024966, 'bull_atr_max_pct': 0.08408620250705805, 'bull_tp_mult': 1.21507931666876, 'bull_tsl_mult': 0.7421156656844066, 'bull_time_stop': 183, 'bull_use_sma': False, 'bull_use_ema': False, 'bull_use_atr': True, 'bull_use_adx': False, 'bull_use_spike': True, 'bull_rsi_required': True, 'bear_strategy': 'breakout', 'bear_bb_std_mult': 2.4390277445735715, 'bear_rsi_os': 36, 'bear_rsi_ob': 78, 'bear_adx_thresh': 12.490191683634611, 'bear_atr_min_pct': 0.024165493594892708, 'bear_atr_max_pct': 0.12131117201703179, 'bear_tp_mult': 2.3311276726851813, 'bear_tsl_mult': 0.5180476702353644, 'bear_time_stop': 193, 'bear_use_sma': True, 'bear_use_ema': False, 'bear_use_atr': True, 'bear_use_adx': False, 'bear_use_spike': False, 'bear_rsi_required': True, 'sideways_strategy': 'breakout', 'sideways_bb_std_mult': 2.636316103301942, 'sideways_rsi_os': 34, 'sideways_rsi_ob': 64, 'sideways_adx_thresh': 17.30553304488374, 'sideways_atr_min_pct': 0.01809105280299345, 'sideways_atr_max_pct': 0.032695538009580236, 'sideways_tp_mult': 1.0453231319511516, 'sideways_tsl_mult': 0.4235202229461492, 'sideways_time_stop': 33, 'sideways_use_sma': False, 'sideways_use_ema': True, 'sideways_use_atr': False, 'sideways_use_adx': True, 'sideways_use_spike': True, 'sideways_rsi_required': True}.
[I 2025-08-31 11:11:21,125] Trial 599 finished with values: [-1000000000.0, 1000000000.0] and parameters: {'p_sma': 15, 'p_std': 26, 'p_atr': 23, 'p_adx': 16, 'rsi_period': 32, 'ema1': 14, 'ema2': 33, 'slip_atr_k': 0.024791650258325647, 'slip_spread_k': 0.6905560767941867, 'spread_hl_frac': 0.00967866815015916, 'bb_std_mult': 2.5489215671006766, 'rsi_os': 51, 'rsi_ob': 79, 'vol_spike': 0.23415193800555423, 'adx_thresh': 31.04675847643151, 'atr_min_pct': 0.005466622189306492, 'atr_max_pct': 0.09221683259733131, 'tp_mult': 2.47782996910996, 'tsl_mult': 0.19578081499735334, 'strategy': 'mean_reversion', 'time_stop': 73, 'use_sma': True, 'use_atr': False, 'use_adx': True, 'use_ema': False, 'use_spike': False, 'rsi_required': True, 'edge_k': 1.6512149738060464, 'edge_cap': 0.9111770466675143, 'bull_strategy': 'mean_reversion', 'bull_bb_std_mult': 1.0943784510649954, 'bull_rsi_os': 17, 'bull_rsi_ob': 75, 'bull_adx_thresh': 6.983248568246055, 'bull_atr_min_pct': 0.003451438341191466, 'bull_atr_max_pct': 0.08131749505780902, 'bull_tp_mult': 2.3044043015791686, 'bull_tsl_mult': 0.90567633283162, 'bull_time_stop': 65, 'bull_use_sma': True, 'bull_use_ema': True, 'bull_use_atr': False, 'bull_use_adx': False, 'bull_use_spike': False, 'bull_rsi_required': False, 'bear_strategy': 'breakout', 'bear_bb_std_mult': 1.9614862083339786, 'bear_rsi_os': 12, 'bear_rsi_ob': 88, 'bear_adx_thresh': 6.686287783668482, 'bear_atr_min_pct': 0.0061628706297764905, 'bear_atr_max_pct': 0.09253414674529993, 'bear_tp_mult': 2.8214977558218926, 'bear_tsl_mult': 0.5552703214622459, 'bear_time_stop': 17, 'bear_use_sma': True, 'bear_use_ema': True, 'bear_use_atr': False, 'bear_use_adx': True, 'bear_use_spike': False, 'bear_rsi_required': False, 'sideways_strategy': 'mean_reversion', 'sideways_bb_std_mult': 0.5717785588218214, 'sideways_rsi_os': 6, 'sideways_rsi_ob': 89, 'sideways_adx_thresh': 27.643018254999184, 'sideways_atr_min_pct': 0.02256683611399131, 'sideways_atr_max_pct': 0.13379217332098156, 'sideways_tp_mult': 1.0464141584568676, 'sideways_tsl_mult': 0.0745448232332328, 'sideways_time_stop': 29, 'sideways_use_sma': True, 'sideways_use_ema': False, 'sideways_use_atr': True, 'sideways_use_adx': False, 'sideways_use_spike': False, 'sideways_rsi_required': False}.
[I 2025-08-31 11:11:21,135] Trial 597 finished with values: [-1000000000.0, 1000000000.0] and parameters: {'p_sma': 15, 'p_std': 26, 'p_atr': 10, 'p_adx': 13, 'rsi_period': 59, 'ema1': 14, 'ema2': 57, 'slip_atr_k': 0.024472741777441985, 'slip_spread_k': 0.6955069224163256, 'spread_hl_frac': 0.03523909482504249, 'bb_std_mult': 1.1670685845294164, 'rsi_os': 24, 'rsi_ob': 47, 'vol_spike': 0.09769969108736959, 'adx_thresh': 30.3659772186028, 'atr_min_pct': 0.008563993657405443, 'atr_max_pct': 0.0928400727538144, 'tp_mult': 1.5341255157751394, 'tsl_mult': 0.22481125304887034, 'strategy': 'mean_reversion', 'time_stop': 194, 'use_sma': True, 'use_atr': True, 'use_adx': False, 'use_ema': False, 'use_spike': True, 'rsi_required': True, 'edge_k': 0.8027628491644541, 'edge_cap': 0.4887413316084942, 'bull_strategy': 'mean_reversion', 'bull_bb_std_mult': 0.6682914185015838, 'bull_rsi_os': 16, 'bull_rsi_ob': 76, 'bull_adx_thresh': 29.174038989534704, 'bull_atr_min_pct': 0.0029019820978782905, 'bull_atr_max_pct': 0.1267335455245424, 'bull_tp_mult': 2.5528940747025817, 'bull_tsl_mult': 0.9119167542799826, 'bull_time_stop': 243, 'bull_use_sma': True, 'bull_use_ema': False, 'bull_use_atr': False, 'bull_use_adx': False, 'bull_use_spike': True, 'bull_rsi_required': False, 'bear_strategy': 'breakout', 'bear_bb_std_mult': 2.424892314812669, 'bear_rsi_os': 13, 'bear_rsi_ob': 88, 'bear_adx_thresh': 6.472122046556737, 'bear_atr_min_pct': 0.02996206338516693, 'bear_atr_max_pct': 0.11548430598154279, 'bear_tp_mult': 2.7765874732611335, 'bear_tsl_mult': 0.5549865047408357, 'bear_time_stop': 18, 'bear_use_sma': True, 'bear_use_ema': False, 'bear_use_atr': True, 'bear_use_adx': True, 'bear_use_spike': False, 'bear_rsi_required': False, 'sideways_strategy': 'breakout', 'sideways_bb_std_mult': 2.843543734741912, 'sideways_rsi_os': 34, 'sideways_rsi_ob': 65, 'sideways_adx_thresh': 17.09487540842065, 'sideways_atr_min_pct': 0.01807959853452619, 'sideways_atr_max_pct': 0.04381441195076878, 'sideways_tp_mult': 2.058884246755147, 'sideways_tsl_mult': 0.1895757411453939, 'sideways_time_stop': 16, 'sideways_use_sma': True, 'sideways_use_ema': True, 'sideways_use_atr': False, 'sideways_use_adx': False, 'sideways_use_spike': False, 'sideways_rsi_required': True}.
[I 2025-08-31 11:11:46,690] Trial 598 finished with values: [-1000000000.0, 1000000000.0] and parameters: {'p_sma': 32, 'p_std': 41, 'p_atr': 10, 'p_adx': 16, 'rsi_period': 47, 'ema1': 14, 'ema2': 16, 'slip_atr_k': 0.19735197671709107, 'slip_spread_k': 0.4083155048953134, 'spread_hl_frac': 0.009773444030367374, 'bb_std_mult': 1.1304333189675213, 'rsi_os': 24, 'rsi_ob': 61, 'vol_spike': 0.2677285667830383, 'adx_thresh': 25.62950865876891, 'atr_min_pct': 0.009072102035514545, 'atr_max_pct': 0.09227419651227915, 'tp_mult': 2.4792069397722916, 'tsl_mult': 0.22378895882779892, 'strategy': 'mean_reversion', 'time_stop': 137, 'use_sma': True, 'use_atr': False, 'use_adx': True, 'use_ema': False, 'use_spike': True, 'rsi_required': False, 'edge_k': 1.7988435881416298, 'edge_cap': 0.07546038740363004, 'bull_strategy': 'breakout', 'bull_bb_std_mult': 2.8446059271856408, 'bull_rsi_os': 16, 'bull_rsi_ob': 76, 'bull_adx_thresh': 6.996779471101348, 'bull_atr_min_pct': 0.0036071246280471644, 'bull_atr_max_pct': 0.08108056431311948, 'bull_tp_mult': 2.6700999305081026, 'bull_tsl_mult': 0.3488985718707294, 'bull_time_stop': 62, 'bull_use_sma': True, 'bull_use_ema': False, 'bull_use_atr': True, 'bull_use_adx': False, 'bull_use_spike': False, 'bull_rsi_required': False, 'bear_strategy': 'breakout', 'bear_bb_std_mult': 3.0424220855691955, 'bear_rsi_os': 39, 'bear_rsi_ob': 74, 'bear_adx_thresh': 6.514684057815356, 'bear_atr_min_pct': 0.02342756454503751, 'bear_atr_max_pct': 0.11569821071071279, 'bear_tp_mult': 2.7736785630455905, 'bear_tsl_mult': 0.4972777728524589, 'bear_time_stop': 17, 'bear_use_sma': False, 'bear_use_ema': False, 'bear_use_atr': False, 'bear_use_adx': True, 'bear_use_spike': False, 'bear_rsi_required': True, 'sideways_strategy': 'mean_reversion', 'sideways_bb_std_mult': 1.7186567575348661, 'sideways_rsi_os': 42, 'sideways_rsi_ob': 76, 'sideways_adx_thresh': 28.818017192913018, 'sideways_atr_min_pct': 0.0026913520423841007, 'sideways_atr_max_pct': 0.04310236685635048, 'sideways_tp_mult': 2.191275791073526, 'sideways_tsl_mult': 0.1083783355416729, 'sideways_time_stop': 28, 'sideways_use_sma': True, 'sideways_use_ema': False, 'sideways_use_atr': False, 'sideways_use_adx': True, 'sideways_use_spike': True, 'sideways_rsi_required': False}.
[I 2025-08-31 11:11:47,196] Trial 600 finished with values: [-1000000000.0, 1000000000.0] and parameters: {'p_sma': 16, 'p_std': 42, 'p_atr': 23, 'p_adx': 10, 'rsi_period': 28, 'ema1': 30, 'ema2': 16, 'slip_atr_k': 0.02530995912416888, 'slip_spread_k': 0.6930163338922124, 'spread_hl_frac': 0.025690398247869634, 'bb_std_mult': 2.632664724049544, 'rsi_os': 29, 'rsi_ob': 80, 'vol_spike': 0.21361905082559282, 'adx_thresh': 31.15380004917596, 'atr_min_pct': 0.00561816057955542, 'atr_max_pct': 0.09345613192262728, 'tp_mult': 2.0207061198983416, 'tsl_mult': 0.26455120594660403, 'strategy': 'mean_reversion', 'time_stop': 136, 'use_sma': True, 'use_atr': False, 'use_adx': True, 'use_ema': False, 'use_spike': False, 'rsi_required': True, 'edge_k': 1.7858135593094722, 'edge_cap': 0.5486891303987917, 'bull_strategy': 'breakout', 'bull_bb_std_mult': 0.656808754320253, 'bull_rsi_os': 16, 'bull_rsi_ob': 75, 'bull_adx_thresh': 19.128432853343142, 'bull_atr_min_pct': 0.003511814759954057, 'bull_atr_max_pct': 0.11777948176163075, 'bull_tp_mult': 2.55062168362712, 'bull_tsl_mult': 0.24430524115475571, 'bull_time_stop': 256, 'bull_use_sma': True, 'bull_use_ema': True, 'bull_use_atr': False, 'bull_use_adx': False, 'bull_use_spike': False, 'bull_rsi_required': False, 'bear_strategy': 'breakout', 'bear_bb_std_mult': 2.5981215631115724, 'bear_rsi_os': 39, 'bear_rsi_ob': 90, 'bear_adx_thresh': 6.631120838272509, 'bear_atr_min_pct': 0.025150755007177013, 'bear_atr_max_pct': 0.11484974382556544, 'bear_tp_mult': 2.8354145113001663, 'bear_tsl_mult': 0.5537984292876554, 'bear_time_stop': 17, 'bear_use_sma': False, 'bear_use_ema': True, 'bear_use_atr': False, 'bear_use_adx': True, 'bear_use_spike': False, 'bear_rsi_required': False, 'sideways_strategy': 'mean_reversion', 'sideways_bb_std_mult': 2.8418828724580054, 'sideways_rsi_os': 6, 'sideways_rsi_ob': 88, 'sideways_adx_thresh': 26.53528598244694, 'sideways_atr_min_pct': 0.011771019235700881, 'sideways_atr_max_pct': 0.043346428317900317, 'sideways_tp_mult': 2.0010392803547328, 'sideways_tsl_mult': 0.9990805663484404, 'sideways_time_stop': 26, 'sideways_use_sma': True, 'sideways_use_ema': False, 'sideways_use_atr': True, 'sideways_use_adx': False, 'sideways_use_spike': False, 'sideways_rsi_required': False}.
[I 2025-08-31 11:11:53,160] Trial 602 finished with values: [-1000000000.0, 1000000000.0] and parameters: {'p_sma': 24, 'p_std': 41, 'p_atr': 12, 'p_adx': 15, 'rsi_period': 47, 'ema1': 9, 'ema2': 56, 'slip_atr_k': 0.028257590180985375, 'slip_spread_k': 0.6362341875849734, 'spread_hl_frac': 0.012493047900583237, 'bb_std_mult': 2.655419143347984, 'rsi_os': 29, 'rsi_ob': 61, 'vol_spike': 0.2594022128000508, 'adx_thresh': 29.27434014529677, 'atr_min_pct': 0.005860060761831842, 'atr_max_pct': 0.10290365934786289, 'tp_mult': 2.5286029785532365, 'tsl_mult': 0.26611896591532597, 'strategy': 'breakout', 'time_stop': 87, 'use_sma': True, 'use_atr': False, 'use_adx': True, 'use_ema': True, 'use_spike': False, 'rsi_required': True, 'edge_k': 0.20239728538313992, 'edge_cap': 0.41561271493458724, 'bull_strategy': 'breakout', 'bull_bb_std_mult': 0.7011720152778875, 'bull_rsi_os': 7, 'bull_rsi_ob': 72, 'bull_adx_thresh': 6.0896236231338365, 'bull_atr_min_pct': 0.0037272423512543645, 'bull_atr_max_pct': 0.09721917323529321, 'bull_tp_mult': 1.97263784449521, 'bull_tsl_mult': 0.358214918476706, 'bull_time_stop': 84, 'bull_use_sma': True, 'bull_use_ema': False, 'bull_use_atr': False, 'bull_use_adx': False, 'bull_use_spike': False, 'bull_rsi_required': True, 'bear_strategy': 'breakout', 'bear_bb_std_mult': 2.6303436618860516, 'bear_rsi_os': 39, 'bear_rsi_ob': 90, 'bear_adx_thresh': 5.437644807787236, 'bear_atr_min_pct': 0.006526331608682122, 'bear_atr_max_pct': 0.11756610114637224, 'bear_tp_mult': 2.436484786486296, 'bear_tsl_mult': 0.48710168108901536, 'bear_time_stop': 25, 'bear_use_sma': False, 'bear_use_ema': True, 'bear_use_atr': False, 'bear_use_adx': False, 'bear_use_spike': True, 'bear_rsi_required': False, 'sideways_strategy': 'mean_reversion', 'sideways_bb_std_mult': 2.298738360338103, 'sideways_rsi_os': 7, 'sideways_rsi_ob': 88, 'sideways_adx_thresh': 26.47362573869321, 'sideways_atr_min_pct': 0.029932144069087015, 'sideways_atr_max_pct': 0.04196453381840751, 'sideways_tp_mult': 2.008139232682012, 'sideways_tsl_mult': 0.5466826686747306, 'sideways_time_stop': 67, 'sideways_use_sma': False, 'sideways_use_ema': False, 'sideways_use_atr': False, 'sideways_use_adx': False, 'sideways_use_spike': False, 'sideways_rsi_required': False}.
[I 2025-08-31 11:11:53,379] Trial 601 finished with values: [-1000000000.0, 1000000000.0] and parameters: {'p_sma': 15, 'p_std': 30, 'p_atr': 18, 'p_adx': 10, 'rsi_period': 28, 'ema1': 14, 'ema2': 57, 'slip_atr_k': 0.1979440723733967, 'slip_spread_k': 0.6323310655161212, 'spread_hl_frac': 0.02578184524971831, 'bb_std_mult': 2.6199987238259466, 'rsi_os': 32, 'rsi_ob': 80, 'vol_spike': 0.25917934060267567, 'adx_thresh': 15.439215841360571, 'atr_min_pct': 0.0011186939419406856, 'atr_max_pct': 0.10294119604210247, 'tp_mult': 1.5672774261558784, 'tsl_mult': 0.5294038584217019, 'strategy': 'mean_reversion', 'time_stop': 88, 'use_sma': True, 'use_atr': False, 'use_adx': True, 'use_ema': False, 'use_spike': True, 'rsi_required': True, 'edge_k': 0.2038843422733987, 'edge_cap': 0.5417420831927485, 'bull_strategy': 'breakout', 'bull_bb_std_mult': 0.6948809130254321, 'bull_rsi_os': 16, 'bull_rsi_ob': 72, 'bull_adx_thresh': 13.470281034559196, 'bull_atr_min_pct': 0.003421250196461076, 'bull_atr_max_pct': 0.09736357823513282, 'bull_tp_mult': 2.558641005835703, 'bull_tsl_mult': 0.7949539079907988, 'bull_time_stop': 73, 'bull_use_sma': True, 'bull_use_ema': False, 'bull_use_atr': False, 'bull_use_adx': False, 'bull_use_spike': False, 'bull_rsi_required': False, 'bear_strategy': 'breakout', 'bear_bb_std_mult': 2.138779230218315, 'bear_rsi_os': 39, 'bear_rsi_ob': 90, 'bear_adx_thresh': 6.472935533657063, 'bear_atr_min_pct': 0.006415778615687095, 'bear_atr_max_pct': 0.014073387635033047, 'bear_tp_mult': 1.5222719435309349, 'bear_tsl_mult': 0.4821457420819677, 'bear_time_stop': 25, 'bear_use_sma': False, 'bear_use_ema': True, 'bear_use_atr': False, 'bear_use_adx': True, 'bear_use_spike': True, 'bear_rsi_required': False, 'sideways_strategy': 'mean_reversion', 'sideways_bb_std_mult': 2.3133231276699195, 'sideways_rsi_os': 7, 'sideways_rsi_ob': 62, 'sideways_adx_thresh': 12.387748361768395, 'sideways_atr_min_pct': 0.011992232478366617, 'sideways_atr_max_pct': 0.042504113799160165, 'sideways_tp_mult': 1.9929716690879413, 'sideways_tsl_mult': 0.9996346180116152, 'sideways_time_stop': 11, 'sideways_use_sma': True, 'sideways_use_ema': False, 'sideways_use_atr': False, 'sideways_use_adx': False, 'sideways_use_spike': False, 'sideways_rsi_required': False}.
