[I 2025-08-31 11:21:44,099] Trial 674 finished with values: [-1000000000.0, 1000000000.0] and parameters: {'p_sma': 40, 'p_std': 45, 'p_atr': 10, 'p_adx': 15, 'rsi_period': 49, 'ema1': 27, 'ema2': 53, 'slip_atr_k': 0.24080080449297725, 'slip_spread_k': 0.11014005756599676, 'spread_hl_frac': 0.009137250796683016, 'bb_std_mult': 3.046472779652156, 'rsi_os': 28, 'rsi_ob': 76, 'vol_spike': 0.25591802606536407, 'adx_thresh': 23.54001395663816, 'atr_min_pct': 0.015997569681929415, 'atr_max_pct': 0.09240947872581626, 'tp_mult': 2.3681493987964473, 'tsl_mult': 0.20308244427693423, 'strategy': 'breakout', 'time_stop': 69, 'use_sma': False, 'use_atr': True, 'use_adx': False, 'use_ema': False, 'use_spike': False, 'rsi_required': True, 'edge_k': 1.7327072693902683, 'edge_cap': 0.40773893131478656, 'bull_strategy': 'breakout', 'bull_bb_std_mult': 3.2407781593931744, 'bull_rsi_os': 11, 'bull_rsi_ob': 58, 'bull_adx_thresh': 7.224669304001642, 'bull_atr_min_pct': 0.005044479220915422, 'bull_atr_max_pct': 0.08670851405282652, 'bull_tp_mult': 1.5615967619419437, 'bull_tsl_mult': 0.30920925949451794, 'bull_time_stop': 97, 'bull_use_sma': True, 'bull_use_ema': False, 'bull_use_atr': True, 'bull_use_adx': True, 'bull_use_spike': False, 'bull_rsi_required': False, 'bear_strategy': 'breakout', 'bear_bb_std_mult': 1.8342820650873788, 'bear_rsi_os': 11, 'bear_rsi_ob': 93, 'bear_adx_thresh': 24.80208208211926, 'bear_atr_min_pct': 0.00356763286854587, 'bear_atr_max_pct': 0.14695131311038273, 'bear_tp_mult': 2.7833274047176193, 'bear_tsl_mult': 0.544365805177182, 'bear_time_stop': 25, 'bear_use_sma': False, 'bear_use_ema': False, 'bear_use_atr': True, 'bear_use_adx': True, 'bear_use_spike': True, 'bear_rsi_required': True, 'sideways_strategy': 'mean_reversion', 'sideways_bb_std_mult': 2.9036420809174355, 'sideways_rsi_os': 6, 'sideways_rsi_ob': 91, 'sideways_adx_thresh': 24.936081075140486, 'sideways_atr_min_pct': 0.01905777020874184, 'sideways_atr_max_pct': 0.03703898692328118, 'sideways_tp_mult': 1.815934293585661, 'sideways_tsl_mult': 0.05357295307641097, 'sideways_time_stop': 18, 'sideways_use_sma': False, 'sideways_use_ema': True, 'sideways_use_atr': False, 'sideways_use_adx': False, 'sideways_use_spike': False, 'sideways_rsi_required': False}.
[I 2025-08-31 11:22:18,127] Trial 679 finished with values: [-1000000000.0, 1000000000.0] and parameters: {'p_sma': 31, 'p_std': 27, 'p_atr': 12, 'p_adx': 7, 'rsi_period': 47, 'ema1': 15, 'ema2': 21, 'slip_atr_k': 0.008787441225789835, 'slip_spread_k': 0.6799020636891558, 'spread_hl_frac': 0.010060486184186415, 'bb_std_mult': 2.0700442039491116, 'rsi_os': 26, 'rsi_ob': 74, 'vol_spike': 0.2954772788480001, 'adx_thresh': 17.84720061848146, 'atr_min_pct': 0.0073476667830082495, 'atr_max_pct': 0.0975083332116667, 'tp_mult': 2.420214378512672, 'tsl_mult': 0.2839892566219415, 'strategy': 'breakout', 'time_stop': 147, 'use_sma': True, 'use_atr': False, 'use_adx': True, 'use_ema': True, 'use_spike': True, 'rsi_required': False, 'edge_k': 0.20742853996969676, 'edge_cap': 0.9217734145432546, 'bull_strategy': 'breakout', 'bull_bb_std_mult': 3.142412233768156, 'bull_rsi_os': 12, 'bull_rsi_ob': 73, 'bull_adx_thresh': 13.114075081222667, 'bull_atr_min_pct': 0.004148905216621088, 'bull_atr_max_pct': 0.09988957980010728, 'bull_tp_mult': 1.8394678639512416, 'bull_tsl_mult': 0.3687222281323093, 'bull_time_stop': 255, 'bull_use_sma': True, 'bull_use_ema': True, 'bull_use_atr': False, 'bull_use_adx': False, 'bull_use_spike': True, 'bull_rsi_required': True, 'bear_strategy': 'mean_reversion', 'bear_bb_std_mult': 0.6198461813907492, 'bear_rsi_os': 15, 'bear_rsi_ob': 82, 'bear_adx_thresh': 23.033560473095672, 'bear_atr_min_pct': 0.010853969766368834, 'bear_atr_max_pct': 0.13371790230829658, 'bear_tp_mult': 1.8314877008351702, 'bear_tsl_mult': 0.3350219330503892, 'bear_time_stop': 18, 'bear_use_sma': False, 'bear_use_ema': True, 'bear_use_atr': False, 'bear_use_adx': False, 'bear_use_spike': True, 'bear_rsi_required': False, 'sideways_strategy': 'mean_reversion', 'sideways_bb_std_mult': 1.832847198818857, 'sideways_rsi_os': 21, 'sideways_rsi_ob': 58, 'sideways_adx_thresh': 17.975133271447294, 'sideways_atr_min_pct': 0.01617460400582339, 'sideways_atr_max_pct': 0.03370019963023616, 'sideways_tp_mult': 2.736999476068196, 'sideways_tsl_mult': 0.8554206572435231, 'sideways_time_stop': 227, 'sideways_use_sma': False, 'sideways_use_ema': False, 'sideways_use_atr': False, 'sideways_use_adx': False, 'sideways_use_spike': True, 'sideways_rsi_required': True}.
[I 2025-08-31 11:22:18,303] Trial 677 finished with values: [-1000000000.0, 1000000000.0] and parameters: {'p_sma': 43, 'p_std': 28, 'p_atr': 12, 'p_adx': 25, 'rsi_period': 50, 'ema1': 11, 'ema2': 10, 'slip_atr_k': 0.008695140089023364, 'slip_spread_k': 0.12000706267996286, 'spread_hl_frac': 0.016909665587596757, 'bb_std_mult': 2.872855770463095, 'rsi_os': 40, 'rsi_ob': 75, 'vol_spike': 0.24371616623028303, 'adx_thresh': 29.611714892748015, 'atr_min_pct': 0.009479116482996729, 'atr_max_pct': 0.10029615351496896, 'tp_mult': 2.5939838496642764, 'tsl_mult': 0.2456454249005274, 'strategy': 'breakout', 'time_stop': 147, 'use_sma': False, 'use_atr': True, 'use_adx': False, 'use_ema': True, 'use_spike': False, 'rsi_required': True, 'edge_k': 0.8507677636150915, 'edge_cap': 0.6352987531577016, 'bull_strategy': 'breakout', 'bull_bb_std_mult': 0.5114890235605202, 'bull_rsi_os': 11, 'bull_rsi_ob': 74, 'bull_adx_thresh': 5.017517857765476, 'bull_atr_min_pct': 0.005053429374257798, 'bull_atr_max_pct': 0.06113697218747739, 'bull_tp_mult': 2.699125064636412, 'bull_tsl_mult': 0.37064341731804357, 'bull_time_stop': 59, 'bull_use_sma': True, 'bull_use_ema': False, 'bull_use_atr': True, 'bull_use_adx': True, 'bull_use_spike': False, 'bull_rsi_required': False, 'bear_strategy': 'mean_reversion', 'bear_bb_std_mult': 1.839677007825707, 'bear_rsi_os': 37, 'bear_rsi_ob': 88, 'bear_adx_thresh': 24.387770371575485, 'bear_atr_min_pct': 0.012062279004288547, 'bear_atr_max_pct': 0.13320961291665043, 'bear_tp_mult': 2.7165944213138715, 'bear_tsl_mult': 0.5500293859258683, 'bear_time_stop': 227, 'bear_use_sma': False, 'bear_use_ema': True, 'bear_use_atr': True, 'bear_use_adx': False, 'bear_use_spike': True, 'bear_rsi_required': False, 'sideways_strategy': 'mean_reversion', 'sideways_bb_std_mult': 1.8016971963435724, 'sideways_rsi_os': 7, 'sideways_rsi_ob': 91, 'sideways_adx_thresh': 24.362198008594895, 'sideways_atr_min_pct': 0.019147658104562537, 'sideways_atr_max_pct': 0.08609533232502913, 'sideways_tp_mult': 2.051613406839311, 'sideways_tsl_mult': 0.8578410814519419, 'sideways_time_stop': 227, 'sideways_use_sma': False, 'sideways_use_ema': True, 'sideways_use_atr': False, 'sideways_use_adx': False, 'sideways_use_spike': False, 'sideways_rsi_required': True}.
[I 2025-08-31 11:22:19,047] Trial 676 finished with values: [-1000000000.0, 1000000000.0] and parameters: {'p_sma': 15, 'p_std': 26, 'p_atr': 12, 'p_adx': 15, 'rsi_period': 60, 'ema1': 15, 'ema2': 53, 'slip_atr_k': 0.011912254265442596, 'slip_spread_k': 0.6817668128773595, 'spread_hl_frac': 0.012941961878813406, 'bb_std_mult': 2.3524160897440805, 'rsi_os': 26, 'rsi_ob': 75, 'vol_spike': 0.2919944150335534, 'adx_thresh': 29.59620655676764, 'atr_min_pct': 0.002665285066549696, 'atr_max_pct': 0.10032398942459153, 'tp_mult': 1.0169250862817423, 'tsl_mult': 0.28346129769303335, 'strategy': 'breakout', 'time_stop': 92, 'use_sma': False, 'use_atr': True, 'use_adx': False, 'use_ema': True, 'use_spike': False, 'rsi_required': True, 'edge_k': 1.7324567989252748, 'edge_cap': 0.4298246836841638, 'bull_strategy': 'mean_reversion', 'bull_bb_std_mult': 1.1278856695435662, 'bull_rsi_os': 11, 'bull_rsi_ob': 71, 'bull_adx_thresh': 19.473266654095006, 'bull_atr_min_pct': 0.0026260915098552415, 'bull_atr_max_pct': 0.08824021075691578, 'bull_tp_mult': 1.634178898812824, 'bull_tsl_mult': 0.0032490772365863507, 'bull_time_stop': 129, 'bull_use_sma': True, 'bull_use_ema': False, 'bull_use_atr': True, 'bull_use_adx': True, 'bull_use_spike': False, 'bull_rsi_required': False, 'bear_strategy': 'breakout', 'bear_bb_std_mult': 1.8037918079201245, 'bear_rsi_os': 23, 'bear_rsi_ob': 80, 'bear_adx_thresh': 23.28712791069478, 'bear_atr_min_pct': 0.006449229325786941, 'bear_atr_max_pct': 0.1451562241683439, 'bear_tp_mult': 2.70228411597646, 'bear_tsl_mult': 0.0012924236819606971, 'bear_time_stop': 118, 'bear_use_sma': False, 'bear_use_ema': True, 'bear_use_atr': True, 'bear_use_adx': False, 'bear_use_spike': True, 'bear_rsi_required': True, 'sideways_strategy': 'mean_reversion', 'sideways_bb_std_mult': 0.9989666435049906, 'sideways_rsi_os': 6, 'sideways_rsi_ob': 91, 'sideways_adx_thresh': 33.341267710469026, 'sideways_atr_min_pct': 0.01898725693303211, 'sideways_atr_max_pct': 0.036468441842122945, 'sideways_tp_mult': 2.044700961070674, 'sideways_tsl_mult': 0.8594631373186308, 'sideways_time_stop': 18, 'sideways_use_sma': False, 'sideways_use_ema': True, 'sideways_use_atr': False, 'sideways_use_adx': False, 'sideways_use_spike': False, 'sideways_rsi_required': True}.
[I 2025-08-31 11:22:19,426] Trial 678 finished with values: [-1000000000.0, 1000000000.0] and parameters: {'p_sma': 59, 'p_std': 50, 'p_atr': 12, 'p_adx': 30, 'rsi_period': 48, 'ema1': 16, 'ema2': 52, 'slip_atr_k': 0.21640455785006474, 'slip_spread_k': 0.710256422795659, 'spread_hl_frac': 0.009988404316242705, 'bb_std_mult': 2.7791267343521, 'rsi_os': 26, 'rsi_ob': 74, 'vol_spike': 0.22907998034321653, 'adx_thresh': 17.788648877484242, 'atr_min_pct': 0.007292352549624813, 'atr_max_pct': 0.1002340915190521, 'tp_mult': 1.3027018407386448, 'tsl_mult': 0.5352172000529346, 'strategy': 'breakout', 'time_stop': 70, 'use_sma': True, 'use_atr': True, 'use_adx': False, 'use_ema': True, 'use_spike': True, 'rsi_required': False, 'edge_k': 0.2064157980397212, 'edge_cap': 0.9970546187635098, 'bull_strategy': 'breakout', 'bull_bb_std_mult': 1.0828660025534318, 'bull_rsi_os': 11, 'bull_rsi_ob': 75, 'bull_adx_thresh': 5.471598694214425, 'bull_atr_min_pct': 0.004116013939023499, 'bull_atr_max_pct': 0.11820531129710449, 'bull_tp_mult': 1.8851581126451926, 'bull_tsl_mult': 0.5895876114878209, 'bull_time_stop': 62, 'bull_use_sma': True, 'bull_use_ema': True, 'bull_use_atr': False, 'bull_use_adx': False, 'bull_use_spike': False, 'bull_rsi_required': False, 'bear_strategy': 'mean_reversion', 'bear_bb_std_mult': 1.7747270208902268, 'bear_rsi_os': 40, 'bear_rsi_ob': 88, 'bear_adx_thresh': 23.016284799564858, 'bear_atr_min_pct': 0.006484299305993705, 'bear_atr_max_pct': 0.13392084031633478, 'bear_tp_mult': 1.8412507800694273, 'bear_tsl_mult': 0.5439471668839576, 'bear_time_stop': 30, 'bear_use_sma': False, 'bear_use_ema': True, 'bear_use_atr': False, 'bear_use_adx': False, 'bear_use_spike': True, 'bear_rsi_required': False, 'sideways_strategy': 'mean_reversion', 'sideways_bb_std_mult': 2.7885200357821227, 'sideways_rsi_os': 27, 'sideways_rsi_ob': 91, 'sideways_adx_thresh': 14.142361461689568, 'sideways_atr_min_pct': 0.017175271635303923, 'sideways_atr_max_pct': 0.040619189642064006, 'sideways_tp_mult': 2.0789213373108857, 'sideways_tsl_mult': 0.05897146817675679, 'sideways_time_stop': 258, 'sideways_use_sma': False, 'sideways_use_ema': True, 'sideways_use_atr': False, 'sideways_use_adx': False, 'sideways_use_spike': True, 'sideways_rsi_required': True}.
[I 2025-08-31 11:22:51,361] Trial 681 finished with values: [-1000000000.0, 1000000000.0] and parameters: {'p_sma': 14, 'p_std': 27, 'p_atr': 14, 'p_adx': 30, 'rsi_period': 48, 'ema1': 21, 'ema2': 56, 'slip_atr_k': 0.21680839290664167, 'slip_spread_k': 0.7025839551307442, 'spread_hl_frac': 0.007536544910256958, 'bb_std_mult': 2.301271972594262, 'rsi_os': 15, 'rsi_ob': 95, 'vol_spike': 0.09315307948121183, 'adx_thresh': 29.057836336946067, 'atr_min_pct': 0.002493729458406072, 'atr_max_pct': 0.09559114249332393, 'tp_mult': 1.3078440549241743, 'tsl_mult': 0.5275360227321861, 'strategy': 'breakout', 'time_stop': 91, 'use_sma': True, 'use_atr': False, 'use_adx': True, 'use_ema': True, 'use_spike': True, 'rsi_required': True, 'edge_k': 0.5907576684170196, 'edge_cap': 0.4256458167954153, 'bull_strategy': 'mean_reversion', 'bull_bb_std_mult': 0.6780426006648858, 'bull_rsi_os': 12, 'bull_rsi_ob': 60, 'bull_adx_thresh': 5.644257099374068, 'bull_atr_min_pct': 0.00258558573499878, 'bull_atr_max_pct': 0.1194338242846044, 'bull_tp_mult': 2.063013864596064, 'bull_tsl_mult': 0.7602708905239043, 'bull_time_stop': 245, 'bull_use_sma': False, 'bull_use_ema': False, 'bull_use_atr': False, 'bull_use_adx': False, 'bull_use_spike': False, 'bull_rsi_required': True, 'bear_strategy': 'breakout', 'bear_bb_std_mult': 3.141985240618369, 'bear_rsi_os': 16, 'bear_rsi_ob': 80, 'bear_adx_thresh': 5.7675042964162175, 'bear_atr_min_pct': 0.015935338014031096, 'bear_atr_max_pct': 0.12540002609323858, 'bear_tp_mult': 2.358065191657032, 'bear_tsl_mult': 0.5001676738666885, 'bear_time_stop': 118, 'bear_use_sma': False, 'bear_use_ema': True, 'bear_use_atr': False, 'bear_use_adx': False, 'bear_use_spike': False, 'bear_rsi_required': False, 'sideways_strategy': 'breakout', 'sideways_bb_std_mult': 2.775852569311464, 'sideways_rsi_os': 5, 'sideways_rsi_ob': 91, 'sideways_adx_thresh': 19.757203913679675, 'sideways_atr_min_pct': 0.018651489824500662, 'sideways_atr_max_pct': 0.04017331591757734, 'sideways_tp_mult': 1.9405696325829926, 'sideways_tsl_mult': 0.1467935162832054, 'sideways_time_stop': 31, 'sideways_use_sma': False, 'sideways_use_ema': False, 'sideways_use_atr': True, 'sideways_use_adx': False, 'sideways_use_spike': False, 'sideways_rsi_required': True}.
[I 2025-08-31 11:22:51,785] Trial 680 finished with values: [-1000000000.0, 1000000000.0] and parameters: {'p_sma': 16, 'p_std': 50, 'p_atr': 11, 'p_adx': 14, 'rsi_period': 48, 'ema1': 16, 'ema2': 51, 'slip_atr_k': 0.042778235249408644, 'slip_spread_k': 0.7137441718943359, 'spread_hl_frac': 0.03758979330316768, 'bb_std_mult': 1.4028401402628463, 'rsi_os': 26, 'rsi_ob': 77, 'vol_spike': 0.24438181711455742, 'adx_thresh': 29.899362962332912, 'atr_min_pct': 0.0035141192406882107, 'atr_max_pct': 0.08241062342267955, 'tp_mult': 1.6166150298651587, 'tsl_mult': 0.06633372260728154, 'strategy': 'breakout', 'time_stop': 75, 'use_sma': True, 'use_atr': False, 'use_adx': True, 'use_ema': True, 'use_spike': True, 'rsi_required': True, 'edge_k': 0.5887820530619315, 'edge_cap': 0.43240055585602527, 'bull_strategy': 'mean_reversion', 'bull_bb_std_mult': 3.342388439570198, 'bull_rsi_os': 11, 'bull_rsi_ob': 71, 'bull_adx_thresh': 5.537249386273799, 'bull_atr_min_pct': 0.002529505932028344, 'bull_atr_max_pct': 0.11558790928167781, 'bull_tp_mult': 1.0131370732042133, 'bull_tsl_mult': 0.5819471499831919, 'bull_time_stop': 291, 'bull_use_sma': True, 'bull_use_ema': False, 'bull_use_atr': False, 'bull_use_adx': False, 'bull_use_spike': False, 'bull_rsi_required': True, 'bear_strategy': 'breakout', 'bear_bb_std_mult': 1.772035216900486, 'bear_rsi_os': 16, 'bear_rsi_ob': 88, 'bear_adx_thresh': 18.44797229699863, 'bear_atr_min_pct': 0.006519877263857995, 'bear_atr_max_pct': 0.1278061994761755, 'bear_tp_mult': 2.597534404323699, 'bear_tsl_mult': 0.49612105546278307, 'bear_time_stop': 32, 'bear_use_sma': False, 'bear_use_ema': True, 'bear_use_atr': False, 'bear_use_adx': False, 'bear_use_spike': False, 'bear_rsi_required': False, 'sideways_strategy': 'breakout', 'sideways_bb_std_mult': 2.78861378699714, 'sideways_rsi_os': 25, 'sideways_rsi_ob': 53, 'sideways_adx_thresh': 26.557923157478882, 'sideways_atr_min_pct': 0.017224480680238446, 'sideways_atr_max_pct': 0.08619856769598129, 'sideways_tp_mult': 2.0329328728814744, 'sideways_tsl_mult': 0.6006002722241015, 'sideways_time_stop': 31, 'sideways_use_sma': False, 'sideways_use_ema': False, 'sideways_use_atr': True, 'sideways_use_adx': False, 'sideways_use_spike': False, 'sideways_rsi_required': True}.
[I 2025-08-31 11:22:51,811] Trial 683 finished with values: [-1000000000.0, 1000000000.0] and parameters: {'p_sma': 14, 'p_std': 28, 'p_atr': 11, 'p_adx': 14, 'rsi_period': 34, 'ema1': 14, 'ema2': 56, 'slip_atr_k': 0.026776317681633036, 'slip_spread_k': 0.6567353691889221, 'spread_hl_frac': 0.007796040790833561, 'bb_std_mult': 1.2593543817938218, 'rsi_os': 24, 'rsi_ob': 95, 'vol_spike': 0.2700443331919139, 'adx_thresh': 28.97006911011524, 'atr_min_pct': 0.003369298768702171, 'atr_max_pct': 0.08862630966997312, 'tp_mult': 2.36435161800671, 'tsl_mult': 0.9531076729226908, 'strategy': 'breakout', 'time_stop': 253, 'use_sma': True, 'use_atr': False, 'use_adx': True, 'use_ema': True, 'use_spike': True, 'rsi_required': True, 'edge_k': 0.29545588219418517, 'edge_cap': 0.4892462860506124, 'bull_strategy': 'breakout', 'bull_bb_std_mult': 3.486869302012921, 'bull_rsi_os': 9, 'bull_rsi_ob': 52, 'bull_adx_thresh': 7.887443948745467, 'bull_atr_min_pct': 0.0034452787416924266, 'bull_atr_max_pct': 0.09570513740552077, 'bull_tp_mult': 2.2792183473802963, 'bull_tsl_mult': 0.7555923856160787, 'bull_time_stop': 142, 'bull_use_sma': False, 'bull_use_ema': False, 'bull_use_atr': False, 'bull_use_adx': False, 'bull_use_spike': True, 'bull_rsi_required': True, 'bear_strategy': 'breakout', 'bear_bb_std_mult': 1.2882782697827868, 'bear_rsi_os': 17, 'bear_rsi_ob': 73, 'bear_adx_thresh': 5.592356585874663, 'bear_atr_min_pct': 0.005773864360794182, 'bear_atr_max_pct': 0.12776688740902598, 'bear_tp_mult': 2.815564275616528, 'bear_tsl_mult': 0.49439415456708286, 'bear_time_stop': 283, 'bear_use_sma': False, 'bear_use_ema': True, 'bear_use_atr': False, 'bear_use_adx': False, 'bear_use_spike': False, 'bear_rsi_required': False, 'sideways_strategy': 'breakout', 'sideways_bb_std_mult': 1.715549144422956, 'sideways_rsi_os': 5, 'sideways_rsi_ob': 68, 'sideways_adx_thresh': 26.540095414489194, 'sideways_atr_min_pct': 0.017335334261661534, 'sideways_atr_max_pct': 0.040549326199776636, 'sideways_tp_mult': 1.9416753731146814, 'sideways_tsl_mult': 0.13944047316932248, 'sideways_time_stop': 30, 'sideways_use_sma': False, 'sideways_use_ema': False, 'sideways_use_atr': True, 'sideways_use_adx': False, 'sideways_use_spike': False, 'sideways_rsi_required': True}.
[I 2025-08-31 11:22:52,112] Trial 682 finished with values: [-0.004727536856590109, 0.005940432498842406] and parameters: {'p_sma': 14, 'p_std': 28, 'p_atr': 11, 'p_adx': 14, 'rsi_period': 52, 'ema1': 12, 'ema2': 43, 'slip_atr_k': 0.026771481243836628, 'slip_spread_k': 0.17236207920855118, 'spread_hl_frac': 0.007456747575082025, 'bb_std_mult': 2.772008000493597, 'rsi_os': 28, 'rsi_ob': 95, 'vol_spike': 0.271109991568894, 'adx_thresh': 31.43670464091992, 'atr_min_pct': 0.011633025470895043, 'atr_max_pct': 0.14989058389037643, 'tp_mult': 1.688171197848152, 'tsl_mult': 0.06171744062545881, 'strategy': 'breakout', 'time_stop': 204, 'use_sma': True, 'use_atr': False, 'use_adx': True, 'use_ema': True, 'use_spike': True, 'rsi_required': False, 'edge_k': 0.3109849791810718, 'edge_cap': 0.498252443560644, 'bull_strategy': 'breakout', 'bull_bb_std_mult': 0.7044349833264767, 'bull_rsi_os': 12, 'bull_rsi_ob': 83, 'bull_adx_thresh': 5.710335829254088, 'bull_atr_min_pct': 0.003931264827215906, 'bull_atr_max_pct': 0.09680554678193246, 'bull_tp_mult': 1.8390925129421156, 'bull_tsl_mult': 0.3936362023788537, 'bull_time_stop': 291, 'bull_use_sma': False, 'bull_use_ema': True, 'bull_use_atr': False, 'bull_use_adx': False, 'bull_use_spike': False, 'bull_rsi_required': True, 'bear_strategy': 'breakout', 'bear_bb_std_mult': 3.1585817376346887, 'bear_rsi_os': 52, 'bear_rsi_ob': 74, 'bear_adx_thresh': 5.909030261495075, 'bear_atr_min_pct': 0.00484189294888958, 'bear_atr_max_pct': 0.13795449851440128, 'bear_tp_mult': 2.818404850109194, 'bear_tsl_mult': 0.7594739947994634, 'bear_time_stop': 32, 'bear_use_sma': False, 'bear_use_ema': True, 'bear_use_atr': False, 'bear_use_adx': False, 'bear_use_spike': False, 'bear_rsi_required': False, 'sideways_strategy': 'breakout', 'sideways_bb_std_mult': 2.7815317915262954, 'sideways_rsi_os': 25, 'sideways_rsi_ob': 94, 'sideways_adx_thresh': 11.974476361630998, 'sideways_atr_min_pct': 0.017117208906171293, 'sideways_atr_max_pct': 0.04038431303417254, 'sideways_tp_mult': 1.9498223987032302, 'sideways_tsl_mult': 0.3622425580003079, 'sideways_time_stop': 5, 'sideways_use_sma': False, 'sideways_use_ema': False, 'sideways_use_atr': True, 'sideways_use_adx': False, 'sideways_use_spike': True, 'sideways_rsi_required': True}.
