[I 2025-08-31 11:40:02,210] Trial 800 finished with values: [-1000000000.0, 1000000000.0] and parameters: {'p_sma': 45, 'p_std': 26, 'p_atr': 11, 'p_adx': 15, 'rsi_period': 60, 'ema1': 25, 'ema2': 44, 'slip_atr_k': 0.00017343489117407906, 'slip_spread_k': 0.12724740119857708, 'spread_hl_frac': 0.03120499175317166, 'bb_std_mult': 1.570050152323885, 'rsi_os': 27, 'rsi_ob': 89, 'vol_spike': 0.2734875556717258, 'adx_thresh': 33.967858359251125, 'atr_min_pct': 0.009660837718870944, 'atr_max_pct': 0.1409693461598627, 'tp_mult': 1.737312229501538, 'tsl_mult': 0.06180073600322537, 'strategy': 'mean_reversion', 'time_stop': 217, 'use_sma': True, 'use_atr': False, 'use_adx': True, 'use_ema': False, 'use_spike': False, 'rsi_required': False, 'edge_k': 1.053082530458937, 'edge_cap': 0.4825827651031877, 'bull_strategy': 'breakout', 'bull_bb_std_mult': 0.6432295076588505, 'bull_rsi_os': 36, 'bull_rsi_ob': 82, 'bull_adx_thresh': 13.39163083686159, 'bull_atr_min_pct': 0.0030329404878783996, 'bull_atr_max_pct': 0.052095169989656395, 'bull_tp_mult': 1.8136198651924165, 'bull_tsl_mult': 0.3774571561361737, 'bull_time_stop': 276, 'bull_use_sma': False, 'bull_use_ema': True, 'bull_use_atr': False, 'bull_use_adx': True, 'bull_use_spike': False, 'bull_rsi_required': False, 'bear_strategy': 'mean_reversion', 'bear_bb_std_mult': 3.006245664621191, 'bear_rsi_os': 50, 'bear_rsi_ob': 75, 'bear_adx_thresh': 5.868835837732618, 'bear_atr_min_pct': 0.004276171007755097, 'bear_atr_max_pct': 0.047534008246639156, 'bear_tp_mult': 2.79564479263229, 'bear_tsl_mult': 0.8357828789380819, 'bear_time_stop': 112, 'bear_use_sma': False, 'bear_use_ema': False, 'bear_use_atr': False, 'bear_use_adx': True, 'bear_use_spike': False, 'bear_rsi_required': False, 'sideways_strategy': 'breakout', 'sideways_bb_std_mult': 2.0368331705193703, 'sideways_rsi_os': 25, 'sideways_rsi_ob': 93, 'sideways_adx_thresh': 12.46479644297035, 'sideways_atr_min_pct': 0.017324166262288266, 'sideways_atr_max_pct': 0.03816744292884042, 'sideways_tp_mult': 1.9822445946884586, 'sideways_tsl_mult': 0.2977661775758854, 'sideways_time_stop': 5, 'sideways_use_sma': True, 'sideways_use_ema': True, 'sideways_use_atr': True, 'sideways_use_adx': False, 'sideways_use_spike': True, 'sideways_rsi_required': True}.
[I 2025-08-31 11:40:39,009] Trial 804 finished with values: [-1000000000.0, 1000000000.0] and parameters: {'p_sma': 58, 'p_std': 29, 'p_atr': 25, 'p_adx': 14, 'rsi_period': 73, 'ema1': 11, 'ema2': 47, 'slip_atr_k': 0.03813576655594289, 'slip_spread_k': 0.20013310857634595, 'spread_hl_frac': 0.005705479149948523, 'bb_std_mult': 2.7219193600408604, 'rsi_os': 55, 'rsi_ob': 95, 'vol_spike': 0.28679504600885525, 'adx_thresh': 32.735774626507194, 'atr_min_pct': 0.01166481289713297, 'atr_max_pct': 0.1424011805870302, 'tp_mult': 1.7012088996016115, 'tsl_mult': 0.025761525545622284, 'strategy': 'breakout', 'time_stop': 210, 'use_sma': False, 'use_atr': False, 'use_adx': True, 'use_ema': True, 'use_spike': True, 'rsi_required': False, 'edge_k': 1.3686966703645418, 'edge_cap': 0.9686638820272511, 'bull_strategy': 'breakout', 'bull_bb_std_mult': 0.5509015617450773, 'bull_rsi_os': 12, 'bull_rsi_ob': 85, 'bull_adx_thresh': 6.60040999737471, 'bull_atr_min_pct': 0.017160623367114495, 'bull_atr_max_pct': 0.0956739738233687, 'bull_tp_mult': 2.1383433924413517, 'bull_tsl_mult': 0.4162879336795847, 'bull_time_stop': 300, 'bull_use_sma': False, 'bull_use_ema': True, 'bull_use_atr': False, 'bull_use_adx': False, 'bull_use_spike': True, 'bull_rsi_required': True, 'bear_strategy': 'breakout', 'bear_bb_std_mult': 3.1183421107639964, 'bear_rsi_os': 49, 'bear_rsi_ob': 73, 'bear_adx_thresh': 32.81998967180898, 'bear_atr_min_pct': 0.0053756852014319335, 'bear_atr_max_pct': 0.06638385541181814, 'bear_tp_mult': 2.729789974557708, 'bear_tsl_mult': 0.7779973962063963, 'bear_time_stop': 234, 'bear_use_sma': False, 'bear_use_ema': True, 'bear_use_atr': False, 'bear_use_adx': False, 'bear_use_spike': False, 'bear_rsi_required': False, 'sideways_strategy': 'breakout', 'sideways_bb_std_mult': 2.370431656469997, 'sideways_rsi_os': 27, 'sideways_rsi_ob': 67, 'sideways_adx_thresh': 12.105585149995568, 'sideways_atr_min_pct': 0.0026185124801937527, 'sideways_atr_max_pct': 0.013274557359021055, 'sideways_tp_mult': 2.0409068802428907, 'sideways_tsl_mult': 0.34661729405405206, 'sideways_time_stop': 10, 'sideways_use_sma': False, 'sideways_use_ema': False, 'sideways_use_atr': True, 'sideways_use_adx': True, 'sideways_use_spike': True, 'sideways_rsi_required': False}.
[I 2025-08-31 11:40:39,707] Trial 802 finished with values: [-0.03810761054378908, 0.039726414280277345] and parameters: {'p_sma': 58, 'p_std': 29, 'p_atr': 11, 'p_adx': 29, 'rsi_period': 53, 'ema1': 11, 'ema2': 43, 'slip_atr_k': 0.02099143624112236, 'slip_spread_k': 0.21032410358862424, 'spread_hl_frac': 0.018384059860188696, 'bb_std_mult': 1.5797995431389162, 'rsi_os': 28, 'rsi_ob': 88, 'vol_spike': 0.28854912087838236, 'adx_thresh': 32.8691355251398, 'atr_min_pct': 0.011811268704545894, 'atr_max_pct': 0.14232167947705093, 'tp_mult': 1.8458881275525656, 'tsl_mult': 0.025490899037838834, 'strategy': 'breakout', 'time_stop': 208, 'use_sma': True, 'use_atr': False, 'use_adx': True, 'use_ema': True, 'use_spike': True, 'rsi_required': False, 'edge_k': 1.4603787582459902, 'edge_cap': 0.15434125579828334, 'bull_strategy': 'breakout', 'bull_bb_std_mult': 3.455881710063964, 'bull_rsi_os': 12, 'bull_rsi_ob': 84, 'bull_adx_thresh': 19.612363493960633, 'bull_atr_min_pct': 0.0032636604650137504, 'bull_atr_max_pct': 0.04151931849928416, 'bull_tp_mult': 1.935293880140178, 'bull_tsl_mult': 0.3779025908423643, 'bull_time_stop': 277, 'bull_use_sma': False, 'bull_use_ema': True, 'bull_use_atr': False, 'bull_use_adx': False, 'bull_use_spike': False, 'bull_rsi_required': True, 'bear_strategy': 'breakout', 'bear_bb_std_mult': 3.289884402868318, 'bear_rsi_os': 50, 'bear_rsi_ob': 75, 'bear_adx_thresh': 5.4441405676101216, 'bear_atr_min_pct': 0.004204911974842402, 'bear_atr_max_pct': 0.04851446674480514, 'bear_tp_mult': 1.4450511005540625, 'bear_tsl_mult': 0.8347394849355996, 'bear_time_stop': 277, 'bear_use_sma': False, 'bear_use_ema': False, 'bear_use_atr': False, 'bear_use_adx': False, 'bear_use_spike': False, 'bear_rsi_required': False, 'sideways_strategy': 'breakout', 'sideways_bb_std_mult': 2.3625235422164663, 'sideways_rsi_os': 25, 'sideways_rsi_ob': 78, 'sideways_adx_thresh': 10.666652877078288, 'sideways_atr_min_pct': 0.017055171845139338, 'sideways_atr_max_pct': 0.01323676504165519, 'sideways_tp_mult': 2.058432435852091, 'sideways_tsl_mult': 0.3575276300859991, 'sideways_time_stop': 101, 'sideways_use_sma': False, 'sideways_use_ema': False, 'sideways_use_atr': True, 'sideways_use_adx': False, 'sideways_use_spike': True, 'sideways_rsi_required': True}.
[I 2025-08-31 11:40:39,856] Trial 803 finished with values: [-1000000000.0, 1000000000.0] and parameters: {'p_sma': 11, 'p_std': 30, 'p_atr': 22, 'p_adx': 19, 'rsi_period': 72, 'ema1': 11, 'ema2': 47, 'slip_atr_k': 0.04487333178753847, 'slip_spread_k': 0.2069857475459482, 'spread_hl_frac': 0.005499805320448218, 'bb_std_mult': 2.2852130214060997, 'rsi_os': 28, 'rsi_ob': 95, 'vol_spike': 0.08529115120487958, 'adx_thresh': 32.55254769797064, 'atr_min_pct': 0.011565987919827252, 'atr_max_pct': 0.1407893203251481, 'tp_mult': 1.8598242687505437, 'tsl_mult': 0.025027886043378113, 'strategy': 'breakout', 'time_stop': 209, 'use_sma': False, 'use_atr': False, 'use_adx': True, 'use_ema': True, 'use_spike': True, 'rsi_required': False, 'edge_k': 1.3617504753070735, 'edge_cap': 0.5378739525462862, 'bull_strategy': 'breakout', 'bull_bb_std_mult': 0.6588252949406906, 'bull_rsi_os': 12, 'bull_rsi_ob': 84, 'bull_adx_thresh': 6.433470763560048, 'bull_atr_min_pct': 0.002584682110112587, 'bull_atr_max_pct': 0.09634390846662493, 'bull_tp_mult': 1.8050118177582077, 'bull_tsl_mult': 0.23893811560328154, 'bull_time_stop': 296, 'bull_use_sma': False, 'bull_use_ema': True, 'bull_use_atr': False, 'bull_use_adx': False, 'bull_use_spike': True, 'bull_rsi_required': True, 'bear_strategy': 'breakout', 'bear_bb_std_mult': 3.1142014675535568, 'bear_rsi_os': 51, 'bear_rsi_ob': 75, 'bear_adx_thresh': 19.52592916302131, 'bear_atr_min_pct': 0.005193916551260494, 'bear_atr_max_pct': 0.13135068556625132, 'bear_tp_mult': 2.750468334769773, 'bear_tsl_mult': 0.8333699296529496, 'bear_time_stop': 276, 'bear_use_sma': False, 'bear_use_ema': True, 'bear_use_atr': False, 'bear_use_adx': False, 'bear_use_spike': False, 'bear_rsi_required': False, 'sideways_strategy': 'breakout', 'sideways_bb_std_mult': 2.8262724377678343, 'sideways_rsi_os': 25, 'sideways_rsi_ob': 67, 'sideways_adx_thresh': 12.055032565233358, 'sideways_atr_min_pct': 0.023456716347459154, 'sideways_atr_max_pct': 0.09746273615639882, 'sideways_tp_mult': 1.2656944091630546, 'sideways_tsl_mult': 0.34665980694071136, 'sideways_time_stop': 101, 'sideways_use_sma': False, 'sideways_use_ema': False, 'sideways_use_atr': True, 'sideways_use_adx': False, 'sideways_use_spike': True, 'sideways_rsi_required': True}.
[I 2025-08-31 11:40:40,034] Trial 805 finished with values: [-1000000000.0, 1000000000.0] and parameters: {'p_sma': 11, 'p_std': 29, 'p_atr': 25, 'p_adx': 14, 'rsi_period': 53, 'ema1': 19, 'ema2': 47, 'slip_atr_k': 0.044837882114886166, 'slip_spread_k': 0.2126481387866587, 'spread_hl_frac': 0.005452196642902647, 'bb_std_mult': 2.408490415185331, 'rsi_os': 36, 'rsi_ob': 95, 'vol_spike': 0.28368757743438827, 'adx_thresh': 32.715475656065706, 'atr_min_pct': 0.011681159058470008, 'atr_max_pct': 0.14723172108878402, 'tp_mult': 1.718600152752335, 'tsl_mult': 0.025981086413247832, 'strategy': 'breakout', 'time_stop': 210, 'use_sma': False, 'use_atr': False, 'use_adx': True, 'use_ema': True, 'use_spike': True, 'rsi_required': False, 'edge_k': 1.2089426148310125, 'edge_cap': 0.22395864019635692, 'bull_strategy': 'breakout', 'bull_bb_std_mult': 3.4288526927750937, 'bull_rsi_os': 12, 'bull_rsi_ob': 85, 'bull_adx_thresh': 6.486873030748403, 'bull_atr_min_pct': 0.004570887133606408, 'bull_atr_max_pct': 0.0954099006490185, 'bull_tp_mult': 2.639138683759078, 'bull_tsl_mult': 0.41196721004784376, 'bull_time_stop': 293, 'bull_use_sma': False, 'bull_use_ema': True, 'bull_use_atr': False, 'bull_use_adx': False, 'bull_use_spike': True, 'bull_rsi_required': True, 'bear_strategy': 'breakout', 'bear_bb_std_mult': 3.2661619900040475, 'bear_rsi_os': 47, 'bear_rsi_ob': 73, 'bear_adx_thresh': 5.5445347402371965, 'bear_atr_min_pct': 0.004988145121253628, 'bear_atr_max_pct': 0.07190752384515663, 'bear_tp_mult': 2.728551444947185, 'bear_tsl_mult': 0.7905007290484247, 'bear_time_stop': 23, 'bear_use_sma': False, 'bear_use_ema': True, 'bear_use_atr': False, 'bear_use_adx': False, 'bear_use_spike': False, 'bear_rsi_required': False, 'sideways_strategy': 'breakout', 'sideways_bb_std_mult': 2.697243359111294, 'sideways_rsi_os': 27, 'sideways_rsi_ob': 68, 'sideways_adx_thresh': 11.771520579014656, 'sideways_atr_min_pct': 0.016787239502751763, 'sideways_atr_max_pct': 0.047020795880628664, 'sideways_tp_mult': 1.7886389945310317, 'sideways_tsl_mult': 0.33660395573547164, 'sideways_time_stop': 10, 'sideways_use_sma': False, 'sideways_use_ema': False, 'sideways_use_atr': True, 'sideways_use_adx': True, 'sideways_use_spike': True, 'sideways_rsi_required': False}.
[I 2025-08-31 11:41:19,114] Trial 808 finished with values: [-0.002511838801842581, 0.00472421714831319] and parameters: {'p_sma': 14, 'p_std': 28, 'p_atr': 12, 'p_adx': 14, 'rsi_period': 52, 'ema1': 12, 'ema2': 42, 'slip_atr_k': 0.027422255045939658, 'slip_spread_k': 0.1670269057738321, 'spread_hl_frac': 0.006586526357252987, 'bb_std_mult': 2.413475647140868, 'rsi_os': 31, 'rsi_ob': 94, 'vol_spike': 0.11933369179170406, 'adx_thresh': 30.96818856513048, 'atr_min_pct': 0.012801015452625296, 'atr_max_pct': 0.13782610003425586, 'tp_mult': 1.4978400235154639, 'tsl_mult': 0.08347058731327502, 'strategy': 'breakout', 'time_stop': 196, 'use_sma': True, 'use_atr': True, 'use_adx': False, 'use_ema': True, 'use_spike': True, 'rsi_required': False, 'edge_k': 0.4100856766889643, 'edge_cap': 0.7831957394040807, 'bull_strategy': 'breakout', 'bull_bb_std_mult': 0.5986206044178606, 'bull_rsi_os': 24, 'bull_rsi_ob': 83, 'bull_adx_thresh': 5.58018906852385, 'bull_atr_min_pct': 0.003789387279411858, 'bull_atr_max_pct': 0.09745714762015442, 'bull_tp_mult': 2.6537856074350983, 'bull_tsl_mult': 0.8213381426288264, 'bull_time_stop': 281, 'bull_use_sma': False, 'bull_use_ema': True, 'bull_use_atr': False, 'bull_use_adx': False, 'bull_use_spike': False, 'bull_rsi_required': True, 'bear_strategy': 'breakout', 'bear_bb_std_mult': 3.252803804022859, 'bear_rsi_os': 47, 'bear_rsi_ob': 71, 'bear_adx_thresh': 5.00579820551946, 'bear_atr_min_pct': 0.00464363459656082, 'bear_atr_max_pct': 0.13911603098630002, 'bear_tp_mult': 2.8760349582338267, 'bear_tsl_mult': 0.7780267789533363, 'bear_time_stop': 21, 'bear_use_sma': False, 'bear_use_ema': True, 'bear_use_atr': False, 'bear_use_adx': False, 'bear_use_spike': False, 'bear_rsi_required': True, 'sideways_strategy': 'breakout', 'sideways_bb_std_mult': 2.7056042483714142, 'sideways_rsi_os': 24, 'sideways_rsi_ob': 95, 'sideways_adx_thresh': 11.554023191066165, 'sideways_atr_min_pct': 0.016862052693738135, 'sideways_atr_max_pct': 0.042103534645092824, 'sideways_tp_mult': 2.9151780450010083, 'sideways_tsl_mult': 0.39199288270400817, 'sideways_time_stop': 11, 'sideways_use_sma': False, 'sideways_use_ema': False, 'sideways_use_atr': True, 'sideways_use_adx': False, 'sideways_use_spike': True, 'sideways_rsi_required': True}.
[I 2025-08-31 11:41:19,127] Trial 806 finished with values: [-1000000000.0, 1000000000.0] and parameters: {'p_sma': 14, 'p_std': 29, 'p_atr': 12, 'p_adx': 29, 'rsi_period': 53, 'ema1': 11, 'ema2': 43, 'slip_atr_k': 0.01989909982330144, 'slip_spread_k': 0.20529030000000525, 'spread_hl_frac': 0.006978009915418517, 'bb_std_mult': 2.265094490361142, 'rsi_os': 31, 'rsi_ob': 94, 'vol_spike': 0.28330759998859817, 'adx_thresh': 31.284087871638224, 'atr_min_pct': 0.010114437578295415, 'atr_max_pct': 0.14738421112496172, 'tp_mult': 1.840117108726853, 'tsl_mult': 0.08902365058538925, 'strategy': 'breakout', 'time_stop': 199, 'use_sma': True, 'use_atr': False, 'use_adx': True, 'use_ema': True, 'use_spike': True, 'rsi_required': False, 'edge_k': 1.211724978645741, 'edge_cap': 0.4831616978877203, 'bull_strategy': 'breakout', 'bull_bb_std_mult': 3.3459441436927606, 'bull_rsi_os': 13, 'bull_rsi_ob': 84, 'bull_adx_thresh': 19.70096706934636, 'bull_atr_min_pct': 0.004555748014493579, 'bull_atr_max_pct': 0.09772656488163925, 'bull_tp_mult': 1.4149422029362049, 'bull_tsl_mult': 0.39839938709571004, 'bull_time_stop': 283, 'bull_use_sma': False, 'bull_use_ema': True, 'bull_use_atr': False, 'bull_use_adx': False, 'bull_use_spike': False, 'bull_rsi_required': True, 'bear_strategy': 'breakout', 'bear_bb_std_mult': 3.229238103336202, 'bear_rsi_os': 51, 'bear_rsi_ob': 75, 'bear_adx_thresh': 7.2867081701868095, 'bear_atr_min_pct': 0.004813218987685736, 'bear_atr_max_pct': 0.13895758375372805, 'bear_tp_mult': 2.6050274464977505, 'bear_tsl_mult': 0.7965140687957682, 'bear_time_stop': 22, 'bear_use_sma': False, 'bear_use_ema': True, 'bear_use_atr': False, 'bear_use_adx': False, 'bear_use_spike': False, 'bear_rsi_required': False, 'sideways_strategy': 'breakout', 'sideways_bb_std_mult': 2.6922334398349235, 'sideways_rsi_os': 23, 'sideways_rsi_ob': 94, 'sideways_adx_thresh': 11.595670378498458, 'sideways_atr_min_pct': 0.01432642614328996, 'sideways_atr_max_pct': 0.09797107623099302, 'sideways_tp_mult': 1.8097251211375727, 'sideways_tsl_mult': 0.3773539985549418, 'sideways_time_stop': 9, 'sideways_use_sma': False, 'sideways_use_ema': False, 'sideways_use_atr': True, 'sideways_use_adx': False, 'sideways_use_spike': True, 'sideways_rsi_required': True}.
[I 2025-08-31 11:41:19,323] Trial 809 finished with values: [-0.08797904228681341, 0.08738179916017336] and parameters: {'p_sma': 41, 'p_std': 28, 'p_atr': 13, 'p_adx': 29, 'rsi_period': 52, 'ema1': 13, 'ema2': 41, 'slip_atr_k': 0.24784499939333926, 'slip_spread_k': 0.15549784208903722, 'spread_hl_frac': 0.026335966168097812, 'bb_std_mult': 2.768986965418542, 'rsi_os': 31, 'rsi_ob': 94, 'vol_spike': 0.11807583062321425, 'adx_thresh': 31.07070353603893, 'atr_min_pct': 0.010353269013979517, 'atr_max_pct': 0.14747055998844066, 'tp_mult': 1.6482143692164264, 'tsl_mult': 0.07911900682712067, 'strategy': 'breakout', 'time_stop': 197, 'use_sma': True, 'use_atr': True, 'use_adx': False, 'use_ema': True, 'use_spike': True, 'rsi_required': False, 'edge_k': 0.39894520588175275, 'edge_cap': 0.517335801416206, 'bull_strategy': 'breakout', 'bull_bb_std_mult': 0.6932929003297461, 'bull_rsi_os': 20, 'bull_rsi_ob': 83, 'bull_adx_thresh': 32.46707056665891, 'bull_atr_min_pct': 0.001858561194424145, 'bull_atr_max_pct': 0.09245929453687647, 'bull_tp_mult': 1.9052156794277888, 'bull_tsl_mult': 0.43589632701440256, 'bull_time_stop': 282, 'bull_use_sma': False, 'bull_use_ema': True, 'bull_use_atr': False, 'bull_use_adx': False, 'bull_use_spike': False, 'bull_rsi_required': True, 'bear_strategy': 'breakout', 'bear_bb_std_mult': 3.207473955632678, 'bear_rsi_os': 53, 'bear_rsi_ob': 77, 'bear_adx_thresh': 7.172456300267635, 'bear_atr_min_pct': 0.0034997200538811257, 'bear_atr_max_pct': 0.13929161313419552, 'bear_tp_mult': 2.878477829508083, 'bear_tsl_mult': 0.762924487042575, 'bear_time_stop': 58, 'bear_use_sma': False, 'bear_use_ema': True, 'bear_use_atr': False, 'bear_use_adx': False, 'bear_use_spike': False, 'bear_rsi_required': True, 'sideways_strategy': 'breakout', 'sideways_bb_std_mult': 3.10691503461217, 'sideways_rsi_os': 24, 'sideways_rsi_ob': 57, 'sideways_adx_thresh': 11.499167157854599, 'sideways_atr_min_pct': 0.014611081681298793, 'sideways_atr_max_pct': 0.13867201211892827, 'sideways_tp_mult': 1.9006946433903078, 'sideways_tsl_mult': 0.415754068759834, 'sideways_time_stop': 169, 'sideways_use_sma': False, 'sideways_use_ema': False, 'sideways_use_atr': True, 'sideways_use_adx': False, 'sideways_use_spike': True, 'sideways_rsi_required': True}.
[I 2025-08-31 11:41:19,518] Trial 807 finished with values: [-1000000000.0, 1000000000.0] and parameters: {'p_sma': 11, 'p_std': 60, 'p_atr': 22, 'p_adx': 14, 'rsi_period': 64, 'ema1': 12, 'ema2': 41, 'slip_atr_k': 0.026636467145906187, 'slip_spread_k': 0.15330389018258367, 'spread_hl_frac': 0.04679808058466044, 'bb_std_mult': 3.1332808649448993, 'rsi_os': 49, 'rsi_ob': 94, 'vol_spike': 0.008249060051485263, 'adx_thresh': 31.019872116783024, 'atr_min_pct': 0.012820410810356904, 'atr_max_pct': 0.1472369451399216, 'tp_mult': 1.727409470749967, 'tsl_mult': 0.08112026240809095, 'strategy': 'breakout', 'time_stop': 197, 'use_sma': True, 'use_atr': False, 'use_adx': True, 'use_ema': True, 'use_spike': True, 'rsi_required': False, 'edge_k': 0.38326303002617834, 'edge_cap': 0.22539956671151473, 'bull_strategy': 'breakout', 'bull_bb_std_mult': 0.6770652219000517, 'bull_rsi_os': 13, 'bull_rsi_ob': 83, 'bull_adx_thresh': 5.011801706161847, 'bull_atr_min_pct': 0.0046336108919606475, 'bull_atr_max_pct': 0.09688695126852716, 'bull_tp_mult': 1.7724794521953018, 'bull_tsl_mult': 0.24550212571609337, 'bull_time_stop': 283, 'bull_use_sma': False, 'bull_use_ema': True, 'bull_use_atr': False, 'bull_use_adx': False, 'bull_use_spike': False, 'bull_rsi_required': True, 'bear_strategy': 'breakout', 'bear_bb_std_mult': 3.244529957985853, 'bear_rsi_os': 47, 'bear_rsi_ob': 77, 'bear_adx_thresh': 5.007018239896988, 'bear_atr_min_pct': 0.005141921568764622, 'bear_atr_max_pct': 0.060065561183611345, 'bear_tp_mult': 1.0423395322008013, 'bear_tsl_mult': 0.7907929295697238, 'bear_time_stop': 21, 'bear_use_sma': False, 'bear_use_ema': True, 'bear_use_atr': False, 'bear_use_adx': False, 'bear_use_spike': False, 'bear_rsi_required': True, 'sideways_strategy': 'breakout', 'sideways_bb_std_mult': 2.824706254899459, 'sideways_rsi_os': 23, 'sideways_rsi_ob': 72, 'sideways_adx_thresh': 11.857033853868458, 'sideways_atr_min_pct': 0.014435133923341262, 'sideways_atr_max_pct': 0.04753421977056051, 'sideways_tp_mult': 1.1576854217337758, 'sideways_tsl_mult': 0.3852473380507738, 'sideways_time_stop': 161, 'sideways_use_sma': False, 'sideways_use_ema': False, 'sideways_use_atr': True, 'sideways_use_adx': False, 'sideways_use_spike': True, 'sideways_rsi_required': True}.
