[I 2025-08-31 11:34:59,974] Trial 767 finished with values: [-0.07500620117311296, 0.07444330865933915] and parameters: {'p_sma': 42, 'p_std': 44, 'p_atr': 9, 'p_adx': 22, 'rsi_period': 53, 'ema1': 12, 'ema2': 42, 'slip_atr_k': 0.16222928471489903, 'slip_spread_k': 0.1427998081559841, 'spread_hl_frac': 0.008205068222711467, 'bb_std_mult': 1.4808699042420819, 'rsi_os': 37, 'rsi_ob': 94, 'vol_spike': 0.2682728306407264, 'adx_thresh': 31.91382808477394, 'atr_min_pct': 0.011854728694136406, 'atr_max_pct': 0.14770709863263232, 'tp_mult': 1.6599954898847298, 'tsl_mult': 0.05216613543351238, 'strategy': 'breakout', 'time_stop': 198, 'use_sma': True, 'use_atr': True, 'use_adx': False, 'use_ema': False, 'use_spike': False, 'rsi_required': False, 'edge_k': 0.35432765365715446, 'edge_cap': 0.9054988623439426, 'bull_strategy': 'breakout', 'bull_bb_std_mult': 0.5555880370223645, 'bull_rsi_os': 37, 'bull_rsi_ob': 82, 'bull_adx_thresh': 5.590155474624101, 'bull_atr_min_pct': 0.0036557160278835265, 'bull_atr_max_pct': 0.01235324640462332, 'bull_tp_mult': 1.857918087973668, 'bull_tsl_mult': 0.41824234399039273, 'bull_time_stop': 300, 'bull_use_sma': False, 'bull_use_ema': True, 'bull_use_atr': True, 'bull_use_adx': False, 'bull_use_spike': True, 'bull_rsi_required': False, 'bear_strategy': 'breakout', 'bear_bb_std_mult': 3.205162338434232, 'bear_rsi_os': 50, 'bear_rsi_ob': 73, 'bear_adx_thresh': 13.196099337488354, 'bear_atr_min_pct': 0.003427717781938013, 'bear_atr_max_pct': 0.13406830154598587, 'bear_tp_mult': 2.8820862234306786, 'bear_tsl_mult': 0.7237092825742055, 'bear_time_stop': 35, 'bear_use_sma': False, 'bear_use_ema': True, 'bear_use_atr': False, 'bear_use_adx': True, 'bear_use_spike': False, 'bear_rsi_required': False, 'sideways_strategy': 'breakout', 'sideways_bb_std_mult': 2.799201914537184, 'sideways_rsi_os': 26, 'sideways_rsi_ob': 74, 'sideways_adx_thresh': 12.454249471986635, 'sideways_atr_min_pct': 0.021827805367369484, 'sideways_atr_max_pct': 0.0364865607486602, 'sideways_tp_mult': 1.8964237640338986, 'sideways_tsl_mult': 0.30374973944700845, 'sideways_time_stop': 5, 'sideways_use_sma': False, 'sideways_use_ema': False, 'sideways_use_atr': True, 'sideways_use_adx': True, 'sideways_use_spike': True, 'sideways_rsi_required': True}.
[I 2025-08-31 11:35:00,297] Trial 765 finished with values: [-1000000000.0, 1000000000.0] and parameters: {'p_sma': 46, 'p_std': 48, 'p_atr': 9, 'p_adx': 22, 'rsi_period': 54, 'ema1': 11, 'ema2': 46, 'slip_atr_k': 0.1593590386309433, 'slip_spread_k': 0.13708576106572173, 'spread_hl_frac': 0.008086575426499024, 'bb_std_mult': 1.4706576226842243, 'rsi_os': 34, 'rsi_ob': 95, 'vol_spike': 0.2701633171605198, 'adx_thresh': 30.64968094662369, 'atr_min_pct': 0.011974550698107253, 'atr_max_pct': 0.1447935159718756, 'tp_mult': 1.6682666881234243, 'tsl_mult': 0.07937702529189182, 'strategy': 'mean_reversion', 'time_stop': 214, 'use_sma': True, 'use_atr': True, 'use_adx': False, 'use_ema': False, 'use_spike': False, 'rsi_required': False, 'edge_k': 0.3869305516404444, 'edge_cap': 0.5259490057098182, 'bull_strategy': 'breakout', 'bull_bb_std_mult': 3.2098131448085536, 'bull_rsi_os': 11, 'bull_rsi_ob': 82, 'bull_adx_thresh': 34.13841768976381, 'bull_atr_min_pct': 0.02319566243269276, 'bull_atr_max_pct': 0.10698059641688633, 'bull_tp_mult': 1.3476328283691656, 'bull_tsl_mult': 0.5305601046364005, 'bull_time_stop': 295, 'bull_use_sma': False, 'bull_use_ema': True, 'bull_use_atr': True, 'bull_use_adx': False, 'bull_use_spike': True, 'bull_rsi_required': False, 'bear_strategy': 'mean_reversion', 'bear_bb_std_mult': 3.215100471022803, 'bear_rsi_os': 50, 'bear_rsi_ob': 77, 'bear_adx_thresh': 5.006584386052753, 'bear_atr_min_pct': 0.01830847494315064, 'bear_atr_max_pct': 0.1360617524793593, 'bear_tp_mult': 1.6189691005512143, 'bear_tsl_mult': 0.7584549530426233, 'bear_time_stop': 182, 'bear_use_sma': False, 'bear_use_ema': True, 'bear_use_atr': False, 'bear_use_adx': True, 'bear_use_spike': False, 'bear_rsi_required': False, 'sideways_strategy': 'breakout', 'sideways_bb_std_mult': 2.7644011954462577, 'sideways_rsi_os': 24, 'sideways_rsi_ob': 66, 'sideways_adx_thresh': 12.026188453172272, 'sideways_atr_min_pct': 0.010143281383183706, 'sideways_atr_max_pct': 0.036036467424858366, 'sideways_tp_mult': 1.9040053867919073, 'sideways_tsl_mult': 0.31322387240832494, 'sideways_time_stop': 10, 'sideways_use_sma': True, 'sideways_use_ema': True, 'sideways_use_atr': True, 'sideways_use_adx': False, 'sideways_use_spike': True, 'sideways_rsi_required': True}.
[I 2025-08-31 11:35:00,704] Trial 764 finished with values: [-1000000000.0, 1000000000.0] and parameters: {'p_sma': 14, 'p_std': 5, 'p_atr': 10, 'p_adx': 15, 'rsi_period': 53, 'ema1': 11, 'ema2': 45, 'slip_atr_k': 0.04853743582018903, 'slip_spread_k': 0.20496936537486576, 'spread_hl_frac': 0.0053343657154517644, 'bb_std_mult': 1.230850813485087, 'rsi_os': 47, 'rsi_ob': 95, 'vol_spike': 0.16234093008402523, 'adx_thresh': 30.909759733160033, 'atr_min_pct': 0.012171728181454912, 'atr_max_pct': 0.14666371455279498, 'tp_mult': 1.6566767060074001, 'tsl_mult': 0.10529179190392175, 'strategy': 'mean_reversion', 'time_stop': 217, 'use_sma': True, 'use_atr': False, 'use_adx': True, 'use_ema': False, 'use_spike': True, 'rsi_required': False, 'edge_k': 0.3685149438350497, 'edge_cap': 0.5257064385625202, 'bull_strategy': 'breakout', 'bull_bb_std_mult': 0.549956084365618, 'bull_rsi_os': 11, 'bull_rsi_ob': 82, 'bull_adx_thresh': 34.13441739571621, 'bull_atr_min_pct': 0.006115269911695679, 'bull_atr_max_pct': 0.09629061045717918, 'bull_tp_mult': 1.7945607438431002, 'bull_tsl_mult': 0.3453476980654928, 'bull_time_stop': 294, 'bull_use_sma': False, 'bull_use_ema': True, 'bull_use_atr': False, 'bull_use_adx': False, 'bull_use_spike': False, 'bull_rsi_required': False, 'bear_strategy': 'mean_reversion', 'bear_bb_std_mult': 3.0176691380444267, 'bear_rsi_os': 50, 'bear_rsi_ob': 75, 'bear_adx_thresh': 5.5234068112324115, 'bear_atr_min_pct': 0.008918982888444628, 'bear_atr_max_pct': 0.024671663965313145, 'bear_tp_mult': 2.8752823088279564, 'bear_tsl_mult': 0.8493464217556945, 'bear_time_stop': 258, 'bear_use_sma': False, 'bear_use_ema': True, 'bear_use_atr': False, 'bear_use_adx': True, 'bear_use_spike': False, 'bear_rsi_required': False, 'sideways_strategy': 'breakout', 'sideways_bb_std_mult': 2.7546613240903137, 'sideways_rsi_os': 26, 'sideways_rsi_ob': 93, 'sideways_adx_thresh': 15.814764822425955, 'sideways_atr_min_pct': 0.01736400968411174, 'sideways_atr_max_pct': 0.06831161450098122, 'sideways_tp_mult': 1.4806196351666976, 'sideways_tsl_mult': 0.31830062229448036, 'sideways_time_stop': 5, 'sideways_use_sma': True, 'sideways_use_ema': True, 'sideways_use_atr': True, 'sideways_use_adx': False, 'sideways_use_spike': True, 'sideways_rsi_required': True}.
[I 2025-08-31 11:35:01,883] Trial 768 finished with values: [-1000000000.0, 1000000000.0] and parameters: {'p_sma': 42, 'p_std': 5, 'p_atr': 24, 'p_adx': 9, 'rsi_period': 52, 'ema1': 12, 'ema2': 42, 'slip_atr_k': 0.040795662674676485, 'slip_spread_k': 0.14575227686507664, 'spread_hl_frac': 0.008302417754403513, 'bb_std_mult': 2.8890136572605, 'rsi_os': 5, 'rsi_ob': 94, 'vol_spike': 0.1760411730221058, 'adx_thresh': 31.96122971523394, 'atr_min_pct': 0.011483969554625242, 'atr_max_pct': 0.14731620648387944, 'tp_mult': 1.6624561727164588, 'tsl_mult': 0.07057717640982636, 'strategy': 'breakout', 'time_stop': 199, 'use_sma': True, 'use_atr': False, 'use_adx': True, 'use_ema': True, 'use_spike': True, 'rsi_required': False, 'edge_k': 1.8712713571398791, 'edge_cap': 0.48389758622299767, 'bull_strategy': 'breakout', 'bull_bb_std_mult': 0.5711394672975096, 'bull_rsi_os': 34, 'bull_rsi_ob': 82, 'bull_adx_thresh': 6.194790747100797, 'bull_atr_min_pct': 0.0034649233323465535, 'bull_atr_max_pct': 0.09692108782152134, 'bull_tp_mult': 1.8630280945551745, 'bull_tsl_mult': 0.7375597056079267, 'bull_time_stop': 279, 'bull_use_sma': False, 'bull_use_ema': True, 'bull_use_atr': False, 'bull_use_adx': False, 'bull_use_spike': True, 'bull_rsi_required': True, 'bear_strategy': 'breakout', 'bear_bb_std_mult': 3.047690053454192, 'bear_rsi_os': 55, 'bear_rsi_ob': 73, 'bear_adx_thresh': 5.60875924567181, 'bear_atr_min_pct': 0.01866849202754401, 'bear_atr_max_pct': 0.03783469828730009, 'bear_tp_mult': 2.3317527658773693, 'bear_tsl_mult': 0.6660635119799174, 'bear_time_stop': 184, 'bear_use_sma': False, 'bear_use_ema': True, 'bear_use_atr': False, 'bear_use_adx': False, 'bear_use_spike': False, 'bear_rsi_required': False, 'sideways_strategy': 'breakout', 'sideways_bb_std_mult': 2.8080321361816094, 'sideways_rsi_os': 28, 'sideways_rsi_ob': 66, 'sideways_adx_thresh': 12.270569298270551, 'sideways_atr_min_pct': 0.02226236209061224, 'sideways_atr_max_pct': 0.10136992481708866, 'sideways_tp_mult': 1.818237653214167, 'sideways_tsl_mult': 0.3471593569387992, 'sideways_time_stop': 10, 'sideways_use_sma': False, 'sideways_use_ema': False, 'sideways_use_atr': True, 'sideways_use_adx': False, 'sideways_use_spike': True, 'sideways_rsi_required': True}.
[I 2025-08-31 11:35:37,080] Trial 771 finished with values: [-0.017532991202460102, 0.01869778676495808] and parameters: {'p_sma': 10, 'p_std': 31, 'p_atr': 16, 'p_adx': 14, 'rsi_period': 51, 'ema1': 12, 'ema2': 42, 'slip_atr_k': 0.07347524596947444, 'slip_spread_k': 0.17523803275723543, 'spread_hl_frac': 0.006932014953973112, 'bb_std_mult': 1.0700639559978942, 'rsi_os': 5, 'rsi_ob': 94, 'vol_spike': 0.17769572270206407, 'adx_thresh': 31.95317074132709, 'atr_min_pct': 0.011255962412478091, 'atr_max_pct': 0.1499505336934019, 'tp_mult': 1.5613212252488688, 'tsl_mult': 0.07412976716779617, 'strategy': 'breakout', 'time_stop': 202, 'use_sma': False, 'use_atr': False, 'use_adx': True, 'use_ema': True, 'use_spike': True, 'rsi_required': False, 'edge_k': 0.273186784120148, 'edge_cap': 0.4870658862136995, 'bull_strategy': 'breakout', 'bull_bb_std_mult': 0.6386043186604353, 'bull_rsi_os': 22, 'bull_rsi_ob': 85, 'bull_adx_thresh': 5.0223522951138015, 'bull_atr_min_pct': 0.0022859111792655016, 'bull_atr_max_pct': 0.13666145301245208, 'bull_tp_mult': 1.9191709478862493, 'bull_tsl_mult': 0.4603870886797605, 'bull_time_stop': 279, 'bull_use_sma': False, 'bull_use_ema': True, 'bull_use_atr': False, 'bull_use_adx': False, 'bull_use_spike': False, 'bull_rsi_required': True, 'bear_strategy': 'breakout', 'bear_bb_std_mult': 3.062155399456565, 'bear_rsi_os': 54, 'bear_rsi_ob': 71, 'bear_adx_thresh': 6.233575092516549, 'bear_atr_min_pct': 0.003514576106673141, 'bear_atr_max_pct': 0.14079659837212444, 'bear_tp_mult': 2.8028631313683077, 'bear_tsl_mult': 0.6665407756826075, 'bear_time_stop': 42, 'bear_use_sma': False, 'bear_use_ema': True, 'bear_use_atr': True, 'bear_use_adx': False, 'bear_use_spike': False, 'bear_rsi_required': False, 'sideways_strategy': 'breakout', 'sideways_bb_std_mult': 2.854224056686351, 'sideways_rsi_os': 26, 'sideways_rsi_ob': 94, 'sideways_adx_thresh': 14.36525257811671, 'sideways_atr_min_pct': 0.022728776167150445, 'sideways_atr_max_pct': 0.04879867956438015, 'sideways_tp_mult': 2.4666686144650236, 'sideways_tsl_mult': 0.34795029043295017, 'sideways_time_stop': 15, 'sideways_use_sma': False, 'sideways_use_ema': False, 'sideways_use_atr': True, 'sideways_use_adx': False, 'sideways_use_spike': True, 'sideways_rsi_required': True}.
[I 2025-08-31 11:35:37,397] Trial 769 finished with values: [-1000000000.0, 1000000000.0] and parameters: {'p_sma': 14, 'p_std': 37, 'p_atr': 8, 'p_adx': 9, 'rsi_period': 57, 'ema1': 10, 'ema2': 42, 'slip_atr_k': 0.1261206086109791, 'slip_spread_k': 0.0942411785848978, 'spread_hl_frac': 0.008141269608839654, 'bb_std_mult': 2.8983420406530325, 'rsi_os': 47, 'rsi_ob': 95, 'vol_spike': 0.17806562122714253, 'adx_thresh': 31.46113165298032, 'atr_min_pct': 0.01126534438471925, 'atr_max_pct': 0.14749089025224998, 'tp_mult': 1.6655178646194564, 'tsl_mult': 0.0018618857906650271, 'strategy': 'breakout', 'time_stop': 202, 'use_sma': False, 'use_atr': False, 'use_adx': True, 'use_ema': True, 'use_spike': True, 'rsi_required': False, 'edge_k': 0.7739014218021069, 'edge_cap': 0.4870938935240132, 'bull_strategy': 'breakout', 'bull_bb_std_mult': 0.6534401145301479, 'bull_rsi_os': 53, 'bull_rsi_ob': 85, 'bull_adx_thresh': 6.119620598550854, 'bull_atr_min_pct': 0.02188695459191666, 'bull_atr_max_pct': 0.09618395649819934, 'bull_tp_mult': 1.9073520087671971, 'bull_tsl_mult': 0.45800150377704213, 'bull_time_stop': 278, 'bull_use_sma': False, 'bull_use_ema': True, 'bull_use_atr': False, 'bull_use_adx': False, 'bull_use_spike': False, 'bull_rsi_required': True, 'bear_strategy': 'breakout', 'bear_bb_std_mult': 3.066679106026278, 'bear_rsi_os': 55, 'bear_rsi_ob': 74, 'bear_adx_thresh': 5.337604737123108, 'bear_atr_min_pct': 0.022829865699005775, 'bear_atr_max_pct': 0.03340689069798364, 'bear_tp_mult': 2.3491759229516607, 'bear_tsl_mult': 0.6657695659041977, 'bear_time_stop': 104, 'bear_use_sma': False, 'bear_use_ema': True, 'bear_use_atr': True, 'bear_use_adx': False, 'bear_use_spike': False, 'bear_rsi_required': False, 'sideways_strategy': 'breakout', 'sideways_bb_std_mult': 3.595820915363053, 'sideways_rsi_os': 26, 'sideways_rsi_ob': 93, 'sideways_adx_thresh': 7.752936044642587, 'sideways_atr_min_pct': 0.015036541825124823, 'sideways_atr_max_pct': 0.06884271405549172, 'sideways_tp_mult': 1.8376610724405107, 'sideways_tsl_mult': 0.3515268170983059, 'sideways_time_stop': 92, 'sideways_use_sma': False, 'sideways_use_ema': False, 'sideways_use_atr': True, 'sideways_use_adx': False, 'sideways_use_spike': True, 'sideways_rsi_required': True}.
[I 2025-08-31 11:35:37,737] Trial 770 finished with values: [-0.036607475983226556, 0.03648928121988809] and parameters: {'p_sma': 15, 'p_std': 23, 'p_atr': 24, 'p_adx': 15, 'rsi_period': 56, 'ema1': 12, 'ema2': 43, 'slip_atr_k': 0.12857075617683425, 'slip_spread_k': 0.10516463779831017, 'spread_hl_frac': 0.035391272790733924, 'bb_std_mult': 1.0959050026642294, 'rsi_os': 42, 'rsi_ob': 94, 'vol_spike': 0.17401376911840197, 'adx_thresh': 31.37865966326234, 'atr_min_pct': 0.011275430705220926, 'atr_max_pct': 0.14989960888447978, 'tp_mult': 1.6179284141660357, 'tsl_mult': 0.11551343062238709, 'strategy': 'breakout', 'time_stop': 200, 'use_sma': False, 'use_atr': False, 'use_adx': True, 'use_ema': True, 'use_spike': True, 'rsi_required': False, 'edge_k': 0.772738617697005, 'edge_cap': 0.4933719979970951, 'bull_strategy': 'breakout', 'bull_bb_std_mult': 2.926281527357567, 'bull_rsi_os': 29, 'bull_rsi_ob': 85, 'bull_adx_thresh': 6.241296035535614, 'bull_atr_min_pct': 0.002370162171417746, 'bull_atr_max_pct': 0.09652234585818034, 'bull_tp_mult': 2.251231985520157, 'bull_tsl_mult': 0.4581627016262773, 'bull_time_stop': 274, 'bull_use_sma': False, 'bull_use_ema': True, 'bull_use_atr': False, 'bull_use_adx': False, 'bull_use_spike': False, 'bull_rsi_required': True, 'bear_strategy': 'breakout', 'bear_bb_std_mult': 3.0333943444090177, 'bear_rsi_os': 55, 'bear_rsi_ob': 71, 'bear_adx_thresh': 5.009958837424858, 'bear_atr_min_pct': 0.0036887517724809677, 'bear_atr_max_pct': 0.0323443531105078, 'bear_tp_mult': 2.8273942095128635, 'bear_tsl_mult': 0.6698350304751559, 'bear_time_stop': 258, 'bear_use_sma': False, 'bear_use_ema': True, 'bear_use_atr': True, 'bear_use_adx': False, 'bear_use_spike': False, 'bear_rsi_required': False, 'sideways_strategy': 'breakout', 'sideways_bb_std_mult': 3.024299798064644, 'sideways_rsi_os': 26, 'sideways_rsi_ob': 47, 'sideways_adx_thresh': 13.26111356292391, 'sideways_atr_min_pct': 0.01233661719813863, 'sideways_atr_max_pct': 0.07891627916310728, 'sideways_tp_mult': 1.485842671031854, 'sideways_tsl_mult': 0.34005375172618485, 'sideways_time_stop': 92, 'sideways_use_sma': False, 'sideways_use_ema': False, 'sideways_use_atr': True, 'sideways_use_adx': False, 'sideways_use_spike': True, 'sideways_rsi_required': True}.
[I 2025-08-31 11:35:37,881] Trial 772 finished with values: [-1000000000.0, 1000000000.0] and parameters: {'p_sma': 27, 'p_std': 25, 'p_atr': 11, 'p_adx': 7, 'rsi_period': 57, 'ema1': 10, 'ema2': 43, 'slip_atr_k': 0.15011290796615462, 'slip_spread_k': 0.08995089288872726, 'spread_hl_frac': 0.024789242218455597, 'bb_std_mult': 2.8379564679972518, 'rsi_os': 31, 'rsi_ob': 95, 'vol_spike': 0.2799950795427747, 'adx_thresh': 32.936780087598294, 'atr_min_pct': 0.011357731969379175, 'atr_max_pct': 0.1499679020394833, 'tp_mult': 1.717323248250219, 'tsl_mult': 0.01829750222310554, 'strategy': 'breakout', 'time_stop': 205, 'use_sma': False, 'use_atr': False, 'use_adx': True, 'use_ema': True, 'use_spike': True, 'rsi_required': False, 'edge_k': 0.2920834628800044, 'edge_cap': 0.13486615463784274, 'bull_strategy': 'mean_reversion', 'bull_bb_std_mult': 0.6746104913572782, 'bull_rsi_os': 47, 'bull_rsi_ob': 85, 'bull_adx_thresh': 5.007415038517185, 'bull_atr_min_pct': 0.004218011198698964, 'bull_atr_max_pct': 0.10368293983721971, 'bull_tp_mult': 1.8469724789734168, 'bull_tsl_mult': 0.4132392396433021, 'bull_time_stop': 273, 'bull_use_sma': False, 'bull_use_ema': True, 'bull_use_atr': False, 'bull_use_adx': False, 'bull_use_spike': False, 'bull_rsi_required': True, 'bear_strategy': 'breakout', 'bear_bb_std_mult': 3.144850280697429, 'bear_rsi_os': 54, 'bear_rsi_ob': 71, 'bear_adx_thresh': 6.292420282015816, 'bear_atr_min_pct': 0.013097100383659835, 'bear_atr_max_pct': 0.06419534511245287, 'bear_tp_mult': 2.8070728863474526, 'bear_tsl_mult': 0.7976216421819842, 'bear_time_stop': 43, 'bear_use_sma': True, 'bear_use_ema': True, 'bear_use_atr': True, 'bear_use_adx': False, 'bear_use_spike': False, 'bear_rsi_required': True, 'sideways_strategy': 'breakout', 'sideways_bb_std_mult': 2.945754353174012, 'sideways_rsi_os': 26, 'sideways_rsi_ob': 63, 'sideways_adx_thresh': 7.740634031516022, 'sideways_atr_min_pct': 0.02573906071830867, 'sideways_atr_max_pct': 0.03909650423065402, 'sideways_tp_mult': 1.947330547679644, 'sideways_tsl_mult': 0.3486406403970172, 'sideways_time_stop': 295, 'sideways_use_sma': False, 'sideways_use_ema': False, 'sideways_use_atr': True, 'sideways_use_adx': False, 'sideways_use_spike': True, 'sideways_rsi_required': True}.
[I 2025-08-31 11:36:13,308] Trial 775 finished with values: [-1000000000.0, 1000000000.0] and parameters: {'p_sma': 25, 'p_std': 25, 'p_atr': 13, 'p_adx': 18, 'rsi_period': 55, 'ema1': 12, 'ema2': 44, 'slip_atr_k': 0.0650642908516663, 'slip_spread_k': 0.16988746505684116, 'spread_hl_frac': 0.023553442196174015, 'bb_std_mult': 2.793852907713458, 'rsi_os': 11, 'rsi_ob': 95, 'vol_spike': 0.2807429407066525, 'adx_thresh': 33.415568677484174, 'atr_min_pct': 0.01320477230505807, 'atr_max_pct': 0.14307079558155064, 'tp_mult': 1.7145862474542912, 'tsl_mult': 0.04791119977018375, 'strategy': 'breakout', 'time_stop': 205, 'use_sma': True, 'use_atr': False, 'use_adx': True, 'use_ema': True, 'use_spike': True, 'rsi_required': False, 'edge_k': 0.28623217249142996, 'edge_cap': 0.5126570400838284, 'bull_strategy': 'mean_reversion', 'bull_bb_std_mult': 1.8086491225627341, 'bull_rsi_os': 13, 'bull_rsi_ob': 83, 'bull_adx_thresh': 20.92656153363429, 'bull_atr_min_pct': 0.028389206256100606, 'bull_atr_max_pct': 0.09278034512431702, 'bull_tp_mult': 2.518469809243069, 'bull_tsl_mult': 0.4097636549432856, 'bull_time_stop': 289, 'bull_use_sma': False, 'bull_use_ema': True, 'bull_use_atr': False, 'bull_use_adx': True, 'bull_use_spike': False, 'bull_rsi_required': True, 'bear_strategy': 'breakout', 'bear_bb_std_mult': 3.124726284957247, 'bear_rsi_os': 48, 'bear_rsi_ob': 74, 'bear_adx_thresh': 6.535632117639375, 'bear_atr_min_pct': 0.016541925437906033, 'bear_atr_max_pct': 0.13937359689631978, 'bear_tp_mult': 1.3050979729181256, 'bear_tsl_mult': 0.7080463683743399, 'bear_time_stop': 295, 'bear_use_sma': True, 'bear_use_ema': False, 'bear_use_atr': False, 'bear_use_adx': False, 'bear_use_spike': False, 'bear_rsi_required': True, 'sideways_strategy': 'breakout', 'sideways_bb_std_mult': 1.8602324860107637, 'sideways_rsi_os': 23, 'sideways_rsi_ob': 63, 'sideways_adx_thresh': 11.121368043379258, 'sideways_atr_min_pct': 0.00762730409263664, 'sideways_atr_max_pct': 0.038868241524404754, 'sideways_tp_mult': 2.017116959747263, 'sideways_tsl_mult': 0.42900285554081397, 'sideways_time_stop': 10, 'sideways_use_sma': False, 'sideways_use_ema': False, 'sideways_use_atr': True, 'sideways_use_adx': True, 'sideways_use_spike': True, 'sideways_rsi_required': False}.
