[I 2025-08-31 10:44:45,352] Trial 388 finished with values: [-1000000000.0, 1000000000.0] and parameters: {'p_sma': 59, 'p_std': 57, 'p_atr': 9, 'p_adx': 15, 'rsi_period': 50, 'ema1': 13, 'ema2': 55, 'slip_atr_k': 0.24820647978375887, 'slip_spread_k': 0.674676337898185, 'spread_hl_frac': 0.0469225170135024, 'bb_std_mult': 2.734589773109526, 'rsi_os': 6, 'rsi_ob': 76, 'vol_spike': 0.25222828984716317, 'adx_thresh': 29.17016723282127, 'atr_min_pct': 0.027102977739787756, 'atr_max_pct': 0.09831578339637187, 'tp_mult': 2.3138606416315035, 'tsl_mult': 0.2337576125440924, 'strategy': 'breakout', 'time_stop': 99, 'use_sma': False, 'use_atr': False, 'use_adx': True, 'use_ema': True, 'use_spike': False, 'rsi_required': True, 'edge_k': 1.0932239623137072, 'edge_cap': 0.5559851779185446, 'bull_strategy': 'mean_reversion', 'bull_bb_std_mult': 0.8695500409875725, 'bull_rsi_os': 10, 'bull_rsi_ob': 87, 'bull_adx_thresh': 8.017362826140262, 'bull_atr_min_pct': 0.01319524443780707, 'bull_atr_max_pct': 0.0944896844100025, 'bull_tp_mult': 1.8652925604666732, 'bull_tsl_mult': 0.39158095452883207, 'bull_time_stop': 71, 'bull_use_sma': True, 'bull_use_ema': False, 'bull_use_atr': False, 'bull_use_adx': True, 'bull_use_spike': False, 'bull_rsi_required': False, 'bear_strategy': 'breakout', 'bear_bb_std_mult': 2.971819141632802, 'bear_rsi_os': 40, 'bear_rsi_ob': 74, 'bear_adx_thresh': 5.732009303114241, 'bear_atr_min_pct': 0.004906425204407845, 'bear_atr_max_pct': 0.010047913517553186, 'bear_tp_mult': 2.937084075759802, 'bear_tsl_mult': 0.7904467126915269, 'bear_time_stop': 224, 'bear_use_sma': True, 'bear_use_ema': False, 'bear_use_atr': True, 'bear_use_adx': False, 'bear_use_spike': True, 'bear_rsi_required': False, 'sideways_strategy': 'mean_reversion', 'sideways_bb_std_mult': 2.06506544422117, 'sideways_rsi_os': 10, 'sideways_rsi_ob': 87, 'sideways_adx_thresh': 31.85838585569769, 'sideways_atr_min_pct': 0.02029589085034124, 'sideways_atr_max_pct': 0.028287620241211765, 'sideways_tp_mult': 1.0177249565112882, 'sideways_tsl_mult': 0.08137651605257878, 'sideways_time_stop': 238, 'sideways_use_sma': False, 'sideways_use_ema': True, 'sideways_use_atr': False, 'sideways_use_adx': False, 'sideways_use_spike': False, 'sideways_rsi_required': True}.
[I 2025-08-31 10:44:45,363] Trial 386 finished with values: [-1000000000.0, 1000000000.0] and parameters: {'p_sma': 30, 'p_std': 16, 'p_atr': 10, 'p_adx': 23, 'rsi_period': 23, 'ema1': 23, 'ema2': 45, 'slip_atr_k': 0.013083834159430008, 'slip_spread_k': 0.00020680824630542327, 'spread_hl_frac': 0.005817536159711881, 'bb_std_mult': 2.74016413626574, 'rsi_os': 5, 'rsi_ob': 86, 'vol_spike': 0.058766599715518425, 'adx_thresh': 28.948686323277144, 'atr_min_pct': 0.02304517630618802, 'atr_max_pct': 0.10243493422349681, 'tp_mult': 2.7793482956502795, 'tsl_mult': 0.2686348457957687, 'strategy': 'breakout', 'time_stop': 99, 'use_sma': False, 'use_atr': False, 'use_adx': True, 'use_ema': True, 'use_spike': False, 'rsi_required': True, 'edge_k': 1.2675881963404323, 'edge_cap': 0.5012236575707725, 'bull_strategy': 'mean_reversion', 'bull_bb_std_mult': 0.6899563923570036, 'bull_rsi_os': 14, 'bull_rsi_ob': 74, 'bull_adx_thresh': 7.83515505316468, 'bull_atr_min_pct': 0.00597566154526372, 'bull_atr_max_pct': 0.09381884767642017, 'bull_tp_mult': 1.8507662804610787, 'bull_tsl_mult': 0.16504728488138748, 'bull_time_stop': 72, 'bull_use_sma': True, 'bull_use_ema': False, 'bull_use_atr': False, 'bull_use_adx': True, 'bull_use_spike': False, 'bull_rsi_required': False, 'bear_strategy': 'breakout', 'bear_bb_std_mult': 2.3450301540908525, 'bear_rsi_os': 28, 'bear_rsi_ob': 79, 'bear_adx_thresh': 10.65051465276367, 'bear_atr_min_pct': 0.028079776261676372, 'bear_atr_max_pct': 0.14091612368576684, 'bear_tp_mult': 2.8760673074975283, 'bear_tsl_mult': 0.0038242707526249253, 'bear_time_stop': 241, 'bear_use_sma': True, 'bear_use_ema': False, 'bear_use_atr': True, 'bear_use_adx': False, 'bear_use_spike': True, 'bear_rsi_required': True, 'sideways_strategy': 'mean_reversion', 'sideways_bb_std_mult': 2.6074032366531554, 'sideways_rsi_os': 5, 'sideways_rsi_ob': 87, 'sideways_adx_thresh': 6.176973357474001, 'sideways_atr_min_pct': 0.020008635366496035, 'sideways_atr_max_pct': 0.02304801572520019, 'sideways_tp_mult': 1.3270817828806818, 'sideways_tsl_mult': 0.07768397987968045, 'sideways_time_stop': 16, 'sideways_use_sma': False, 'sideways_use_ema': True, 'sideways_use_atr': False, 'sideways_use_adx': False, 'sideways_use_spike': False, 'sideways_rsi_required': True}.
[I 2025-08-31 10:44:46,840] Trial 389 finished with values: [-0.02238975906127616, 0.02303103370132386] and parameters: {'p_sma': 59, 'p_std': 18, 'p_atr': 7, 'p_adx': 7, 'rsi_period': 49, 'ema1': 11, 'ema2': 54, 'slip_atr_k': 0.012158453478966179, 'slip_spread_k': 0.6757017910951607, 'spread_hl_frac': 0.0026231065275105145, 'bb_std_mult': 2.729328834045831, 'rsi_os': 27, 'rsi_ob': 79, 'vol_spike': 0.2517275204386348, 'adx_thresh': 23.79449633591544, 'atr_min_pct': 0.014863879644575391, 'atr_max_pct': 0.06889962193384376, 'tp_mult': 2.3083264827175203, 'tsl_mult': 0.2327123366690178, 'strategy': 'breakout', 'time_stop': 106, 'use_sma': True, 'use_atr': False, 'use_adx': True, 'use_ema': True, 'use_spike': True, 'rsi_required': True, 'edge_k': 1.1002159822184054, 'edge_cap': 0.5372554412061379, 'bull_strategy': 'mean_reversion', 'bull_bb_std_mult': 3.019871455964696, 'bull_rsi_os': 11, 'bull_rsi_ob': 62, 'bull_adx_thresh': 7.013816075000943, 'bull_atr_min_pct': 0.015247682212442788, 'bull_atr_max_pct': 0.08525694785415358, 'bull_tp_mult': 1.947779538290279, 'bull_tsl_mult': 0.2579317416441175, 'bull_time_stop': 222, 'bull_use_sma': True, 'bull_use_ema': False, 'bull_use_atr': False, 'bull_use_adx': False, 'bull_use_spike': False, 'bull_rsi_required': True, 'bear_strategy': 'breakout', 'bear_bb_std_mult': 1.8879151998268082, 'bear_rsi_os': 40, 'bear_rsi_ob': 83, 'bear_adx_thresh': 5.68875141502267, 'bear_atr_min_pct': 0.004819588263479947, 'bear_atr_max_pct': 0.10871875350229665, 'bear_tp_mult': 2.865641211750397, 'bear_tsl_mult': 0.7927274487886985, 'bear_time_stop': 27, 'bear_use_sma': False, 'bear_use_ema': True, 'bear_use_atr': False, 'bear_use_adx': False, 'bear_use_spike': False, 'bear_rsi_required': False, 'sideways_strategy': 'mean_reversion', 'sideways_bb_std_mult': 2.091653894036032, 'sideways_rsi_os': 5, 'sideways_rsi_ob': 87, 'sideways_adx_thresh': 9.668762603482143, 'sideways_atr_min_pct': 0.018873741989941826, 'sideways_atr_max_pct': 0.041826419649416545, 'sideways_tp_mult': 1.3835672054658765, 'sideways_tsl_mult': 0.10357662109961362, 'sideways_time_stop': 15, 'sideways_use_sma': False, 'sideways_use_ema': True, 'sideways_use_atr': False, 'sideways_use_adx': False, 'sideways_use_spike': False, 'sideways_rsi_required': True}.
[I 2025-08-31 10:44:47,282] Trial 390 finished with values: [-1000000000.0, 1000000000.0] and parameters: {'p_sma': 12, 'p_std': 29, 'p_atr': 8, 'p_adx': 15, 'rsi_period': 50, 'ema1': 15, 'ema2': 55, 'slip_atr_k': 0.016616734719834436, 'slip_spread_k': 0.22715905541709458, 'spread_hl_frac': 0.004283408650034737, 'bb_std_mult': 2.7394188830647845, 'rsi_os': 27, 'rsi_ob': 46, 'vol_spike': 0.2521744280792788, 'adx_thresh': 17.900246146753283, 'atr_min_pct': 0.010626143603730747, 'atr_max_pct': 0.11699318353501947, 'tp_mult': 2.2865174086631694, 'tsl_mult': 0.24427825020827887, 'strategy': 'mean_reversion', 'time_stop': 143, 'use_sma': True, 'use_atr': False, 'use_adx': True, 'use_ema': True, 'use_spike': True, 'rsi_required': True, 'edge_k': 0.6377093322913963, 'edge_cap': 0.33694001305290433, 'bull_strategy': 'breakout', 'bull_bb_std_mult': 0.6960825193648367, 'bull_rsi_os': 10, 'bull_rsi_ob': 83, 'bull_adx_thresh': 7.077170280934256, 'bull_atr_min_pct': 0.008769068364997152, 'bull_atr_max_pct': 0.0864391836833679, 'bull_tp_mult': 1.855248476745334, 'bull_tsl_mult': 0.2521659750923774, 'bull_time_stop': 236, 'bull_use_sma': False, 'bull_use_ema': False, 'bull_use_atr': False, 'bull_use_adx': False, 'bull_use_spike': False, 'bull_rsi_required': True, 'bear_strategy': 'breakout', 'bear_bb_std_mult': 1.758529811757565, 'bear_rsi_os': 40, 'bear_rsi_ob': 77, 'bear_adx_thresh': 9.563372713318989, 'bear_atr_min_pct': 0.005036061530351233, 'bear_atr_max_pct': 0.14091002325583066, 'bear_tp_mult': 2.8758966331744746, 'bear_tsl_mult': 0.49155293721952165, 'bear_time_stop': 30, 'bear_use_sma': False, 'bear_use_ema': False, 'bear_use_atr': True, 'bear_use_adx': False, 'bear_use_spike': False, 'bear_rsi_required': False, 'sideways_strategy': 'mean_reversion', 'sideways_bb_std_mult': 0.6408348811129492, 'sideways_rsi_os': 5, 'sideways_rsi_ob': 93, 'sideways_adx_thresh': 28.410100488184796, 'sideways_atr_min_pct': 0.02845385979700398, 'sideways_atr_max_pct': 0.0604515045650033, 'sideways_tp_mult': 2.035724951275198, 'sideways_tsl_mult': 0.9696049074651027, 'sideways_time_stop': 21, 'sideways_use_sma': True, 'sideways_use_ema': True, 'sideways_use_atr': True, 'sideways_use_adx': False, 'sideways_use_spike': False, 'sideways_rsi_required': True}.
[I 2025-08-31 10:45:16,930] Trial 391 finished with values: [-1000000000.0, 1000000000.0] and parameters: {'p_sma': 14, 'p_std': 29, 'p_atr': 12, 'p_adx': 13, 'rsi_period': 46, 'ema1': 14, 'ema2': 57, 'slip_atr_k': 0.01789449246277657, 'slip_spread_k': 0.6353371193033508, 'spread_hl_frac': 0.021607824515904164, 'bb_std_mult': 2.6925950683295503, 'rsi_os': 42, 'rsi_ob': 54, 'vol_spike': 0.14877748431584195, 'adx_thresh': 27.897127401892746, 'atr_min_pct': 0.01782307619863302, 'atr_max_pct': 0.09791075700100525, 'tp_mult': 2.4700219223364095, 'tsl_mult': 0.30105755575711146, 'strategy': 'mean_reversion', 'time_stop': 277, 'use_sma': True, 'use_atr': False, 'use_adx': True, 'use_ema': True, 'use_spike': True, 'rsi_required': True, 'edge_k': 1.1459467852124903, 'edge_cap': 0.4635262717866849, 'bull_strategy': 'breakout', 'bull_bb_std_mult': 0.7318839095165606, 'bull_rsi_os': 11, 'bull_rsi_ob': 61, 'bull_adx_thresh': 6.9908482550419455, 'bull_atr_min_pct': 0.015515972582144792, 'bull_atr_max_pct': 0.08633054597414196, 'bull_tp_mult': 1.7437219039734417, 'bull_tsl_mult': 0.019480700227506587, 'bull_time_stop': 153, 'bull_use_sma': False, 'bull_use_ema': False, 'bull_use_atr': False, 'bull_use_adx': False, 'bull_use_spike': False, 'bull_rsi_required': True, 'bear_strategy': 'mean_reversion', 'bear_bb_std_mult': 2.5719409363024677, 'bear_rsi_os': 43, 'bear_rsi_ob': 83, 'bear_adx_thresh': 9.405375809915123, 'bear_atr_min_pct': 0.007097083066642865, 'bear_atr_max_pct': 0.046343444991902, 'bear_tp_mult': 1.3627423106894998, 'bear_tsl_mult': 0.4919687584165134, 'bear_time_stop': 31, 'bear_use_sma': False, 'bear_use_ema': True, 'bear_use_atr': False, 'bear_use_adx': False, 'bear_use_spike': False, 'bear_rsi_required': False, 'sideways_strategy': 'mean_reversion', 'sideways_bb_std_mult': 1.074792781781047, 'sideways_rsi_os': 38, 'sideways_rsi_ob': 51, 'sideways_adx_thresh': 12.47427620974799, 'sideways_atr_min_pct': 0.009819496403885837, 'sideways_atr_max_pct': 0.059900697129882705, 'sideways_tp_mult': 1.9366730868445472, 'sideways_tsl_mult': 0.1356725281738249, 'sideways_time_stop': 22, 'sideways_use_sma': True, 'sideways_use_ema': False, 'sideways_use_atr': True, 'sideways_use_adx': False, 'sideways_use_spike': False, 'sideways_rsi_required': True}.
[I 2025-08-31 10:45:17,336] Trial 392 finished with values: [-1000000000.0, 1000000000.0] and parameters: {'p_sma': 14, 'p_std': 29, 'p_atr': 12, 'p_adx': 13, 'rsi_period': 46, 'ema1': 11, 'ema2': 54, 'slip_atr_k': 0.1991084217982741, 'slip_spread_k': 0.7872211795051871, 'spread_hl_frac': 0.022215782780409216, 'bb_std_mult': 2.4780345939723385, 'rsi_os': 27, 'rsi_ob': 79, 'vol_spike': 0.25892313692513674, 'adx_thresh': 27.729570525558, 'atr_min_pct': 0.010675588332856, 'atr_max_pct': 0.11893172576560196, 'tp_mult': 1.5641866999135914, 'tsl_mult': 0.3011207760673922, 'strategy': 'mean_reversion', 'time_stop': 107, 'use_sma': True, 'use_atr': False, 'use_adx': True, 'use_ema': True, 'use_spike': True, 'rsi_required': True, 'edge_k': 0.2734586184466954, 'edge_cap': 0.6827153866827299, 'bull_strategy': 'breakout', 'bull_bb_std_mult': 2.484286643956977, 'bull_rsi_os': 55, 'bull_rsi_ob': 61, 'bull_adx_thresh': 7.0936798284486855, 'bull_atr_min_pct': 0.024755057718309652, 'bull_atr_max_pct': 0.08775689968465442, 'bull_tp_mult': 1.9499149097279393, 'bull_tsl_mult': 0.45970897094617696, 'bull_time_stop': 85, 'bull_use_sma': False, 'bull_use_ema': False, 'bull_use_atr': False, 'bull_use_adx': False, 'bull_use_spike': False, 'bull_rsi_required': True, 'bear_strategy': 'mean_reversion', 'bear_bb_std_mult': 1.8782597375073113, 'bear_rsi_os': 43, 'bear_rsi_ob': 92, 'bear_adx_thresh': 9.442885497854007, 'bear_atr_min_pct': 0.01954843677542398, 'bear_atr_max_pct': 0.04606514004322898, 'bear_tp_mult': 1.3658609631487646, 'bear_tsl_mult': 0.3684429575476451, 'bear_time_stop': 28, 'bear_use_sma': False, 'bear_use_ema': True, 'bear_use_atr': False, 'bear_use_adx': False, 'bear_use_spike': False, 'bear_rsi_required': False, 'sideways_strategy': 'mean_reversion', 'sideways_bb_std_mult': 2.663506208092747, 'sideways_rsi_os': 38, 'sideways_rsi_ob': 93, 'sideways_adx_thresh': 9.635824598282733, 'sideways_atr_min_pct': 0.009669671655194806, 'sideways_atr_max_pct': 0.05992236673877561, 'sideways_tp_mult': 2.7534806658755824, 'sideways_tsl_mult': 0.14226754247140466, 'sideways_time_stop': 22, 'sideways_use_sma': True, 'sideways_use_ema': False, 'sideways_use_atr': True, 'sideways_use_adx': False, 'sideways_use_spike': False, 'sideways_rsi_required': True}.
[I 2025-08-31 10:45:17,622] Trial 393 finished with values: [-1000000000.0, 1000000000.0] and parameters: {'p_sma': 14, 'p_std': 11, 'p_atr': 12, 'p_adx': 13, 'rsi_period': 11, 'ema1': 15, 'ema2': 57, 'slip_atr_k': 0.017977102261049357, 'slip_spread_k': 0.8701545442494113, 'spread_hl_frac': 0.010968505654814147, 'bb_std_mult': 2.4830462337704495, 'rsi_os': 48, 'rsi_ob': 61, 'vol_spike': 0.14829367774226115, 'adx_thresh': 27.625644424791382, 'atr_min_pct': 0.007998558895623615, 'atr_max_pct': 0.09829431399466745, 'tp_mult': 1.8184283857813857, 'tsl_mult': 0.2998641885057351, 'strategy': 'mean_reversion', 'time_stop': 279, 'use_sma': True, 'use_atr': False, 'use_adx': True, 'use_ema': True, 'use_spike': True, 'rsi_required': True, 'edge_k': 0.27900918923223966, 'edge_cap': 0.3393777969131484, 'bull_strategy': 'breakout', 'bull_bb_std_mult': 0.7561300404661107, 'bull_rsi_os': 22, 'bull_rsi_ob': 79, 'bull_adx_thresh': 34.32194867890249, 'bull_atr_min_pct': 0.007481407941528198, 'bull_atr_max_pct': 0.05867109905327032, 'bull_tp_mult': 1.7475006150392325, 'bull_tsl_mult': 0.9812220586781728, 'bull_time_stop': 81, 'bull_use_sma': False, 'bull_use_ema': False, 'bull_use_atr': False, 'bull_use_adx': False, 'bull_use_spike': False, 'bull_rsi_required': True, 'bear_strategy': 'mean_reversion', 'bear_bb_std_mult': 1.9840993909936557, 'bear_rsi_os': 43, 'bear_rsi_ob': 89, 'bear_adx_thresh': 33.874767497992394, 'bear_atr_min_pct': 0.015300880198204263, 'bear_atr_max_pct': 0.04691226018680647, 'bear_tp_mult': 2.7719700825081, 'bear_tsl_mult': 0.523457586316793, 'bear_time_stop': 277, 'bear_use_sma': False, 'bear_use_ema': True, 'bear_use_atr': False, 'bear_use_adx': False, 'bear_use_spike': False, 'bear_rsi_required': False, 'sideways_strategy': 'mean_reversion', 'sideways_bb_std_mult': 1.7562825553700523, 'sideways_rsi_os': 38, 'sideways_rsi_ob': 51, 'sideways_adx_thresh': 28.444525542657725, 'sideways_atr_min_pct': 0.01764943606142175, 'sideways_atr_max_pct': 0.11402971361005179, 'sideways_tp_mult': 1.860490986692001, 'sideways_tsl_mult': 0.13907223162996862, 'sideways_time_stop': 23, 'sideways_use_sma': True, 'sideways_use_ema': False, 'sideways_use_atr': True, 'sideways_use_adx': False, 'sideways_use_spike': False, 'sideways_rsi_required': True}.
[I 2025-08-31 10:45:18,761] Trial 394 finished with values: [-1000000000.0, 1000000000.0] and parameters: {'p_sma': 14, 'p_std': 27, 'p_atr': 12, 'p_adx': 14, 'rsi_period': 9, 'ema1': 14, 'ema2': 34, 'slip_atr_k': 0.073143230622211, 'slip_spread_k': 0.8799057453576971, 'spread_hl_frac': 0.01038076428290854, 'bb_std_mult': 2.630855591517283, 'rsi_os': 8, 'rsi_ob': 87, 'vol_spike': 0.21007304111409253, 'adx_thresh': 27.78530481480746, 'atr_min_pct': 0.012868631968805992, 'atr_max_pct': 0.0976222492447684, 'tp_mult': 1.5568696175812071, 'tsl_mult': 0.2501983625137073, 'strategy': 'mean_reversion', 'time_stop': 72, 'use_sma': True, 'use_atr': False, 'use_adx': True, 'use_ema': False, 'use_spike': True, 'rsi_required': True, 'edge_k': 0.22564031076669094, 'edge_cap': 0.6910265523413209, 'bull_strategy': 'breakout', 'bull_bb_std_mult': 0.7535132614958759, 'bull_rsi_os': 21, 'bull_rsi_ob': 73, 'bull_adx_thresh': 9.712269940396133, 'bull_atr_min_pct': 0.02463778661385984, 'bull_atr_max_pct': 0.08935909496820169, 'bull_tp_mult': 1.7649015072524254, 'bull_tsl_mult': 0.9456616798144641, 'bull_time_stop': 85, 'bull_use_sma': False, 'bull_use_ema': False, 'bull_use_atr': False, 'bull_use_adx': False, 'bull_use_spike': False, 'bull_rsi_required': True, 'bear_strategy': 'mean_reversion', 'bear_bb_std_mult': 2.0177328544099944, 'bear_rsi_os': 5, 'bear_rsi_ob': 91, 'bear_adx_thresh': 7.320601330196109, 'bear_atr_min_pct': 0.02139964043598137, 'bear_atr_max_pct': 0.12859405500991009, 'bear_tp_mult': 2.785572830289419, 'bear_tsl_mult': 0.5246268190498135, 'bear_time_stop': 33, 'bear_use_sma': False, 'bear_use_ema': True, 'bear_use_atr': False, 'bear_use_adx': True, 'bear_use_spike': True, 'bear_rsi_required': False, 'sideways_strategy': 'mean_reversion', 'sideways_bb_std_mult': 2.6623676352971697, 'sideways_rsi_os': 8, 'sideways_rsi_ob': 54, 'sideways_adx_thresh': 26.230459783372925, 'sideways_atr_min_pct': 0.023982532016386504, 'sideways_atr_max_pct': 0.012999303787657762, 'sideways_tp_mult': 2.4957166475776473, 'sideways_tsl_mult': 0.10937797563917998, 'sideways_time_stop': 23, 'sideways_use_sma': True, 'sideways_use_ema': False, 'sideways_use_atr': True, 'sideways_use_adx': False, 'sideways_use_spike': False, 'sideways_rsi_required': True}.
[I 2025-08-31 10:45:19,312] Trial 396 finished with values: [-1000000000.0, 1000000000.0] and parameters: {'p_sma': 16, 'p_std': 27, 'p_atr': 11, 'p_adx': 12, 'rsi_period': 52, 'ema1': 24, 'ema2': 22, 'slip_atr_k': 0.0009701060385664401, 'slip_spread_k': 0.3669913553396874, 'spread_hl_frac': 0.010182346025054993, 'bb_std_mult': 2.624249827116616, 'rsi_os': 24, 'rsi_ob': 61, 'vol_spike': 0.2693377463979306, 'adx_thresh': 29.681639817721265, 'atr_min_pct': 0.018807900766439806, 'atr_max_pct': 0.013524030699922612, 'tp_mult': 1.9466160867367035, 'tsl_mult': 0.2544410725221982, 'strategy': 'breakout', 'time_stop': 67, 'use_sma': True, 'use_atr': False, 'use_adx': True, 'use_ema': False, 'use_spike': True, 'rsi_required': True, 'edge_k': 0.2174434226586961, 'edge_cap': 0.1137079817083127, 'bull_strategy': 'breakout', 'bull_bb_std_mult': 0.7788461099990609, 'bull_rsi_os': 13, 'bull_rsi_ob': 79, 'bull_adx_thresh': 6.275596729221669, 'bull_atr_min_pct': 0.028896053023617325, 'bull_atr_max_pct': 0.08949922337513666, 'bull_tp_mult': 1.7673004400694319, 'bull_tsl_mult': 0.36083502234699416, 'bull_time_stop': 78, 'bull_use_sma': True, 'bull_use_ema': False, 'bull_use_atr': False, 'bull_use_adx': False, 'bull_use_spike': False, 'bull_rsi_required': True, 'bear_strategy': 'breakout', 'bear_bb_std_mult': 1.6507335397913523, 'bear_rsi_os': 38, 'bear_rsi_ob': 89, 'bear_adx_thresh': 7.8091374369828745, 'bear_atr_min_pct': 0.005820906247337087, 'bear_atr_max_pct': 0.1462465348015527, 'bear_tp_mult': 2.0150257819181685, 'bear_tsl_mult': 0.5232602573453894, 'bear_time_stop': 280, 'bear_use_sma': False, 'bear_use_ema': True, 'bear_use_atr': False, 'bear_use_adx': True, 'bear_use_spike': True, 'bear_rsi_required': False, 'sideways_strategy': 'mean_reversion', 'sideways_bb_std_mult': 2.594852804726016, 'sideways_rsi_os': 8, 'sideways_rsi_ob': 54, 'sideways_adx_thresh': 33.04941360190458, 'sideways_atr_min_pct': 0.01767900645463586, 'sideways_atr_max_pct': 0.1216339903154699, 'sideways_tp_mult': 2.6895582022881324, 'sideways_tsl_mult': 0.9332065396056837, 'sideways_time_stop': 70, 'sideways_use_sma': False, 'sideways_use_ema': False, 'sideways_use_atr': False, 'sideways_use_adx': False, 'sideways_use_spike': False, 'sideways_rsi_required': False}.
