[I 2025-08-31 10:17:49,014] Trial 180 finished with values: [-0.043194385714063865, 0.0427299173330289] and parameters: {'p_sma': 21, 'p_std': 29, 'p_atr': 29, 'p_adx': 16, 'rsi_period': 19, 'ema1': 16, 'ema2': 28, 'slip_atr_k': 0.02885443065544836, 'slip_spread_k': 0.9597871489949716, 'spread_hl_frac': 0.032610734546579895, 'bb_std_mult': 0.6052673635156172, 'rsi_os': 24, 'rsi_ob': 62, 'vol_spike': 0.2466679559109286, 'adx_thresh': 28.628738619707597, 'atr_min_pct': 0.004904953124468969, 'atr_max_pct': 0.07652699850740208, 'tp_mult': 1.9728558263188458, 'tsl_mult': 0.5599005840781179, 'strategy': 'breakout', 'time_stop': 149, 'use_sma': True, 'use_atr': True, 'use_adx': False, 'use_ema': True, 'use_spike': True, 'rsi_required': False, 'edge_k': 1.616571196676167, 'edge_cap': 0.5460519588481887, 'bull_strategy': 'breakout', 'bull_bb_std_mult': 0.8033967781187656, 'bull_rsi_os': 42, 'bull_rsi_ob': 84, 'bull_adx_thresh': 26.57178131563414, 'bull_atr_min_pct': 0.011724629681933886, 'bull_atr_max_pct': 0.12881086434390918, 'bull_tp_mult': 2.2777602697484167, 'bull_tsl_mult': 0.47111600546150784, 'bull_time_stop': 240, 'bull_use_sma': True, 'bull_use_ema': True, 'bull_use_atr': True, 'bull_use_adx': False, 'bull_use_spike': True, 'bull_rsi_required': False, 'bear_strategy': 'breakout', 'bear_bb_std_mult': 1.1966470337333712, 'bear_rsi_os': 40, 'bear_rsi_ob': 69, 'bear_adx_thresh': 15.37979565149948, 'bear_atr_min_pct': 0.0025393177003922626, 'bear_atr_max_pct': 0.08652065950924298, 'bear_tp_mult': 1.8885790295440477, 'bear_tsl_mult': 0.5673895594623515, 'bear_time_stop': 54, 'bear_use_sma': False, 'bear_use_ema': True, 'bear_use_atr': False, 'bear_use_adx': False, 'bear_use_spike': True, 'bear_rsi_required': False, 'sideways_strategy': 'breakout', 'sideways_bb_std_mult': 3.1135793503229214, 'sideways_rsi_os': 14, 'sideways_rsi_ob': 81, 'sideways_adx_thresh': 34.82462592071908, 'sideways_atr_min_pct': 0.004336831385844931, 'sideways_atr_max_pct': 0.06914267605953192, 'sideways_tp_mult': 1.9761989475475246, 'sideways_tsl_mult': 0.6915993671421766, 'sideways_time_stop': 41, 'sideways_use_sma': False, 'sideways_use_ema': False, 'sideways_use_atr': False, 'sideways_use_adx': True, 'sideways_use_spike': True, 'sideways_rsi_required': True}.
[I 2025-08-31 10:17:49,325] Trial 179 finished with values: [-1000000000.0, 1000000000.0] and parameters: {'p_sma': 29, 'p_std': 14, 'p_atr': 30, 'p_adx': 20, 'rsi_period': 38, 'ema1': 16, 'ema2': 14, 'slip_atr_k': 0.028929272688337167, 'slip_spread_k': 0.9502970883340018, 'spread_hl_frac': 0.03839884198263937, 'bb_std_mult': 1.063836658624423, 'rsi_os': 27, 'rsi_ob': 75, 'vol_spike': 0.283084058082111, 'adx_thresh': 30.850519336637646, 'atr_min_pct': 0.004136774396400268, 'atr_max_pct': 0.100534246850134, 'tp_mult': 2.2681934582690886, 'tsl_mult': 0.5407713952754074, 'strategy': 'breakout', 'time_stop': 128, 'use_sma': True, 'use_atr': True, 'use_adx': False, 'use_ema': True, 'use_spike': True, 'rsi_required': False, 'edge_k': 0.10509973541434114, 'edge_cap': 0.2764846048453611, 'bull_strategy': 'breakout', 'bull_bb_std_mult': 0.6044102719764676, 'bull_rsi_os': 38, 'bull_rsi_ob': 84, 'bull_adx_thresh': 26.320830308326556, 'bull_atr_min_pct': 0.01981480165483816, 'bull_atr_max_pct': 0.14512985315986907, 'bull_tp_mult': 2.0810934994295, 'bull_tsl_mult': 0.39772245236204384, 'bull_time_stop': 87, 'bull_use_sma': True, 'bull_use_ema': True, 'bull_use_atr': True, 'bull_use_adx': False, 'bull_use_spike': True, 'bull_rsi_required': True, 'bear_strategy': 'breakout', 'bear_bb_std_mult': 1.8361279935581134, 'bear_rsi_os': 39, 'bear_rsi_ob': 67, 'bear_adx_thresh': 16.62377268802291, 'bear_atr_min_pct': 0.005994282803813058, 'bear_atr_max_pct': 0.08782841967849482, 'bear_tp_mult': 1.2757052094508148, 'bear_tsl_mult': 0.5653082617099513, 'bear_time_stop': 26, 'bear_use_sma': False, 'bear_use_ema': True, 'bear_use_atr': False, 'bear_use_adx': False, 'bear_use_spike': True, 'bear_rsi_required': False, 'sideways_strategy': 'breakout', 'sideways_bb_std_mult': 3.1359845287947463, 'sideways_rsi_os': 16, 'sideways_rsi_ob': 81, 'sideways_adx_thresh': 15.199653589812632, 'sideways_atr_min_pct': 0.007630333343225291, 'sideways_atr_max_pct': 0.0126869303750817, 'sideways_tp_mult': 2.000904876349264, 'sideways_tsl_mult': 0.16318855159122797, 'sideways_time_stop': 36, 'sideways_use_sma': False, 'sideways_use_ema': False, 'sideways_use_atr': False, 'sideways_use_adx': True, 'sideways_use_spike': True, 'sideways_rsi_required': True}.
[I 2025-08-31 10:17:49,392] Trial 181 finished with values: [-1000000000.0, 1000000000.0] and parameters: {'p_sma': 29, 'p_std': 30, 'p_atr': 29, 'p_adx': 18, 'rsi_period': 20, 'ema1': 16, 'ema2': 28, 'slip_atr_k': 0.028377699333329356, 'slip_spread_k': 0.339788227115834, 'spread_hl_frac': 0.03261927513465788, 'bb_std_mult': 0.6101500704819807, 'rsi_os': 27, 'rsi_ob': 74, 'vol_spike': 0.24635052857688772, 'adx_thresh': 30.159242873148177, 'atr_min_pct': 0.023592180328884604, 'atr_max_pct': 0.08054404571164495, 'tp_mult': 1.2720684708873962, 'tsl_mult': 0.5642070674101264, 'strategy': 'breakout', 'time_stop': 125, 'use_sma': True, 'use_atr': True, 'use_adx': False, 'use_ema': True, 'use_spike': True, 'rsi_required': False, 'edge_k': 0.10569349795214958, 'edge_cap': 0.44576714875935874, 'bull_strategy': 'breakout', 'bull_bb_std_mult': 0.8605003243323797, 'bull_rsi_os': 41, 'bull_rsi_ob': 81, 'bull_adx_thresh': 33.53127378843948, 'bull_atr_min_pct': 0.028100629510382585, 'bull_atr_max_pct': 0.12822063068708178, 'bull_tp_mult': 2.2802142788206154, 'bull_tsl_mult': 0.36559288842387627, 'bull_time_stop': 87, 'bull_use_sma': True, 'bull_use_ema': False, 'bull_use_atr': True, 'bull_use_adx': True, 'bull_use_spike': True, 'bull_rsi_required': False, 'bear_strategy': 'breakout', 'bear_bb_std_mult': 0.814530668274142, 'bear_rsi_os': 40, 'bear_rsi_ob': 69, 'bear_adx_thresh': 15.651676888506412, 'bear_atr_min_pct': 0.005470378801606543, 'bear_atr_max_pct': 0.0858843436362156, 'bear_tp_mult': 1.2852441732049802, 'bear_tsl_mult': 0.5002616207069849, 'bear_time_stop': 21, 'bear_use_sma': False, 'bear_use_ema': True, 'bear_use_atr': False, 'bear_use_adx': False, 'bear_use_spike': True, 'bear_rsi_required': False, 'sideways_strategy': 'mean_reversion', 'sideways_bb_std_mult': 3.017253210193551, 'sideways_rsi_os': 54, 'sideways_rsi_ob': 84, 'sideways_adx_thresh': 10.667465171931607, 'sideways_atr_min_pct': 0.007594222240661789, 'sideways_atr_max_pct': 0.011414795642024283, 'sideways_tp_mult': 1.9858893707381615, 'sideways_tsl_mult': 0.8825646096675894, 'sideways_time_stop': 23, 'sideways_use_sma': False, 'sideways_use_ema': False, 'sideways_use_atr': False, 'sideways_use_adx': True, 'sideways_use_spike': True, 'sideways_rsi_required': False}.
[I 2025-08-31 10:18:21,790] Trial 183 finished with values: [-1000000000.0, 1000000000.0] and parameters: {'p_sma': 16, 'p_std': 27, 'p_atr': 30, 'p_adx': 14, 'rsi_period': 45, 'ema1': 16, 'ema2': 53, 'slip_atr_k': 0.014181182839309615, 'slip_spread_k': 0.6289601084473417, 'spread_hl_frac': 0.03426834354796226, 'bb_std_mult': 1.117261465865154, 'rsi_os': 7, 'rsi_ob': 74, 'vol_spike': 0.2651862391986348, 'adx_thresh': 17.076089585986832, 'atr_min_pct': 0.004757640798550634, 'atr_max_pct': 0.08051179835515955, 'tp_mult': 2.269256589129701, 'tsl_mult': 0.6127593690799895, 'strategy': 'breakout', 'time_stop': 132, 'use_sma': True, 'use_atr': True, 'use_adx': False, 'use_ema': True, 'use_spike': True, 'rsi_required': False, 'edge_k': 0.8712082716653222, 'edge_cap': 0.28734436662526397, 'bull_strategy': 'breakout', 'bull_bb_std_mult': 3.52372557752412, 'bull_rsi_os': 7, 'bull_rsi_ob': 94, 'bull_adx_thresh': 25.39647416146522, 'bull_atr_min_pct': 0.0018840445619219058, 'bull_atr_max_pct': 0.1176409591048304, 'bull_tp_mult': 2.0875846652668764, 'bull_tsl_mult': 0.36082358778970736, 'bull_time_stop': 158, 'bull_use_sma': True, 'bull_use_ema': True, 'bull_use_atr': True, 'bull_use_adx': False, 'bull_use_spike': True, 'bull_rsi_required': True, 'bear_strategy': 'breakout', 'bear_bb_std_mult': 1.2083045793574732, 'bear_rsi_os': 41, 'bear_rsi_ob': 68, 'bear_adx_thresh': 15.438855794590305, 'bear_atr_min_pct': 0.006260410976927714, 'bear_atr_max_pct': 0.13893702979723646, 'bear_tp_mult': 1.9710464066648399, 'bear_tsl_mult': 0.5817556274928817, 'bear_time_stop': 171, 'bear_use_sma': False, 'bear_use_ema': True, 'bear_use_atr': False, 'bear_use_adx': False, 'bear_use_spike': True, 'bear_rsi_required': False, 'sideways_strategy': 'breakout', 'sideways_bb_std_mult': 3.1130476767220863, 'sideways_rsi_os': 9, 'sideways_rsi_ob': 84, 'sideways_adx_thresh': 16.055427173764826, 'sideways_atr_min_pct': 0.007694383216252781, 'sideways_atr_max_pct': 0.06905310118748323, 'sideways_tp_mult': 1.9473782112923748, 'sideways_tsl_mult': 0.12280974569546348, 'sideways_time_stop': 10, 'sideways_use_sma': False, 'sideways_use_ema': False, 'sideways_use_atr': False, 'sideways_use_adx': True, 'sideways_use_spike': True, 'sideways_rsi_required': True}.
[I 2025-08-31 10:18:21,923] Trial 186 finished with values: [-1000000000.0, 1000000000.0] and parameters: {'p_sma': 16, 'p_std': 21, 'p_atr': 30, 'p_adx': 14, 'rsi_period': 45, 'ema1': 19, 'ema2': 53, 'slip_atr_k': 0.014168999188063225, 'slip_spread_k': 0.642516265104966, 'spread_hl_frac': 0.03474264782949621, 'bb_std_mult': 0.7780474035739988, 'rsi_os': 14, 'rsi_ob': 73, 'vol_spike': 0.26853600083337853, 'adx_thresh': 17.572862786466057, 'atr_min_pct': 0.02475530369984072, 'atr_max_pct': 0.08938191360063576, 'tp_mult': 1.6991343577507065, 'tsl_mult': 0.6557562094690629, 'strategy': 'breakout', 'time_stop': 69, 'use_sma': True, 'use_atr': False, 'use_adx': True, 'use_ema': True, 'use_spike': True, 'rsi_required': False, 'edge_k': 1.9771326438156605, 'edge_cap': 0.9109958105476101, 'bull_strategy': 'breakout', 'bull_bb_std_mult': 1.6782648450016278, 'bull_rsi_os': 7, 'bull_rsi_ob': 50, 'bull_adx_thresh': 25.45401038499606, 'bull_atr_min_pct': 0.002099003997906189, 'bull_atr_max_pct': 0.13912120628987165, 'bull_tp_mult': 1.5073843225491308, 'bull_tsl_mult': 0.42165619460795406, 'bull_time_stop': 157, 'bull_use_sma': True, 'bull_use_ema': True, 'bull_use_atr': True, 'bull_use_adx': True, 'bull_use_spike': True, 'bull_rsi_required': True, 'bear_strategy': 'breakout', 'bear_bb_std_mult': 0.5958703920826707, 'bear_rsi_os': 6, 'bear_rsi_ob': 70, 'bear_adx_thresh': 14.208589911975752, 'bear_atr_min_pct': 0.00460393298097224, 'bear_atr_max_pct': 0.09478503326298379, 'bear_tp_mult': 2.9609772019265996, 'bear_tsl_mult': 0.5929070442234736, 'bear_time_stop': 172, 'bear_use_sma': False, 'bear_use_ema': True, 'bear_use_atr': False, 'bear_use_adx': False, 'bear_use_spike': True, 'bear_rsi_required': False, 'sideways_strategy': 'breakout', 'sideways_bb_std_mult': 2.7994946695485545, 'sideways_rsi_os': 19, 'sideways_rsi_ob': 83, 'sideways_adx_thresh': 9.257644490087968, 'sideways_atr_min_pct': 0.0067282306734164615, 'sideways_atr_max_pct': 0.0357950895468381, 'sideways_tp_mult': 2.0813408241725977, 'sideways_tsl_mult': 0.11992789347452593, 'sideways_time_stop': 10, 'sideways_use_sma': False, 'sideways_use_ema': False, 'sideways_use_atr': False, 'sideways_use_adx': True, 'sideways_use_spike': True, 'sideways_rsi_required': True}.
[I 2025-08-31 10:18:22,018] Trial 184 finished with values: [-1000000000.0, 1000000000.0] and parameters: {'p_sma': 16, 'p_std': 24, 'p_atr': 30, 'p_adx': 21, 'rsi_period': 24, 'ema1': 19, 'ema2': 14, 'slip_atr_k': 0.21475268459471308, 'slip_spread_k': 0.6453607740294092, 'spread_hl_frac': 0.037826809260445064, 'bb_std_mult': 0.7697451463986211, 'rsi_os': 14, 'rsi_ob': 74, 'vol_spike': 0.2665407567401061, 'adx_thresh': 17.63973948703809, 'atr_min_pct': 0.005469167557398875, 'atr_max_pct': 0.03694970434656992, 'tp_mult': 1.2623149844587003, 'tsl_mult': 0.6057530054154399, 'strategy': 'breakout', 'time_stop': 99, 'use_sma': True, 'use_atr': False, 'use_adx': True, 'use_ema': True, 'use_spike': True, 'rsi_required': False, 'edge_k': 0.11365229047848291, 'edge_cap': 0.3962654085645673, 'bull_strategy': 'breakout', 'bull_bb_std_mult': 3.5844135593492625, 'bull_rsi_os': 41, 'bull_rsi_ob': 93, 'bull_adx_thresh': 33.154078876478465, 'bull_atr_min_pct': 0.002135791448559352, 'bull_atr_max_pct': 0.1394911558981165, 'bull_tp_mult': 1.4389053495154833, 'bull_tsl_mult': 0.3653822515112387, 'bull_time_stop': 65, 'bull_use_sma': True, 'bull_use_ema': False, 'bull_use_atr': True, 'bull_use_adx': True, 'bull_use_spike': True, 'bull_rsi_required': True, 'bear_strategy': 'breakout', 'bear_bb_std_mult': 0.7894270000846171, 'bear_rsi_os': 41, 'bear_rsi_ob': 68, 'bear_adx_thresh': 14.079947152485044, 'bear_atr_min_pct': 0.006136157707905812, 'bear_atr_max_pct': 0.13707112174193017, 'bear_tp_mult': 1.1577512072177734, 'bear_tsl_mult': 0.5941619748270455, 'bear_time_stop': 255, 'bear_use_sma': False, 'bear_use_ema': True, 'bear_use_atr': False, 'bear_use_adx': False, 'bear_use_spike': True, 'bear_rsi_required': False, 'sideways_strategy': 'mean_reversion', 'sideways_bb_std_mult': 2.7918873860840963, 'sideways_rsi_os': 9, 'sideways_rsi_ob': 60, 'sideways_adx_thresh': 18.645567489873663, 'sideways_atr_min_pct': 0.008947549401148815, 'sideways_atr_max_pct': 0.04518176094463364, 'sideways_tp_mult': 2.086783868526131, 'sideways_tsl_mult': 0.4026029710415987, 'sideways_time_stop': 128, 'sideways_use_sma': False, 'sideways_use_ema': False, 'sideways_use_atr': False, 'sideways_use_adx': True, 'sideways_use_spike': True, 'sideways_rsi_required': False}.
[I 2025-08-31 10:18:22,162] Trial 185 finished with values: [-0.02852822914309805, 0.02838501564251997] and parameters: {'p_sma': 36, 'p_std': 22, 'p_atr': 30, 'p_adx': 14, 'rsi_period': 46, 'ema1': 19, 'ema2': 53, 'slip_atr_k': 0.01518375393922115, 'slip_spread_k': 0.6313668241566633, 'spread_hl_frac': 0.0342263976283206, 'bb_std_mult': 0.7857037658259474, 'rsi_os': 28, 'rsi_ob': 73, 'vol_spike': 0.26430836901758226, 'adx_thresh': 19.753770549454465, 'atr_min_pct': 0.005763781113681507, 'atr_max_pct': 0.09481614065640867, 'tp_mult': 2.883078406546726, 'tsl_mult': 0.6103143745075189, 'strategy': 'breakout', 'time_stop': 78, 'use_sma': True, 'use_atr': False, 'use_adx': True, 'use_ema': True, 'use_spike': True, 'rsi_required': False, 'edge_k': 0.1836862079487937, 'edge_cap': 0.39654903949069586, 'bull_strategy': 'breakout', 'bull_bb_std_mult': 0.8422889144147707, 'bull_rsi_os': 39, 'bull_rsi_ob': 87, 'bull_adx_thresh': 25.362125103311406, 'bull_atr_min_pct': 0.0017636648007890888, 'bull_atr_max_pct': 0.1394171919601867, 'bull_tp_mult': 1.3284988504057558, 'bull_tsl_mult': 0.4297253558605665, 'bull_time_stop': 156, 'bull_use_sma': True, 'bull_use_ema': True, 'bull_use_atr': True, 'bull_use_adx': True, 'bull_use_spike': True, 'bull_rsi_required': True, 'bear_strategy': 'breakout', 'bear_bb_std_mult': 2.1192731552043296, 'bear_rsi_os': 41, 'bear_rsi_ob': 92, 'bear_adx_thresh': 14.098245078222515, 'bear_atr_min_pct': 0.004467187011109731, 'bear_atr_max_pct': 0.09092798083319216, 'bear_tp_mult': 1.1751104398473187, 'bear_tsl_mult': 0.5937033138592268, 'bear_time_stop': 291, 'bear_use_sma': False, 'bear_use_ema': True, 'bear_use_atr': False, 'bear_use_adx': False, 'bear_use_spike': True, 'bear_rsi_required': False, 'sideways_strategy': 'breakout', 'sideways_bb_std_mult': 2.7887807005386613, 'sideways_rsi_os': 19, 'sideways_rsi_ob': 61, 'sideways_adx_thresh': 16.930201476483347, 'sideways_atr_min_pct': 0.004947133709903743, 'sideways_atr_max_pct': 0.045380177982774175, 'sideways_tp_mult': 2.077124589962307, 'sideways_tsl_mult': 0.1257313658467386, 'sideways_time_stop': 48, 'sideways_use_sma': False, 'sideways_use_ema': False, 'sideways_use_atr': False, 'sideways_use_adx': True, 'sideways_use_spike': True, 'sideways_rsi_required': True}.
[I 2025-08-31 10:18:53,641] Trial 189 finished with values: [-0.016206958895426005, 0.016065864060132985] and parameters: {'p_sma': 38, 'p_std': 37, 'p_atr': 29, 'p_adx': 22, 'rsi_period': 41, 'ema1': 15, 'ema2': 39, 'slip_atr_k': 0.0336057709059127, 'slip_spread_k': 0.2738419467690279, 'spread_hl_frac': 0.013162051068052759, 'bb_std_mult': 0.5665709890786651, 'rsi_os': 28, 'rsi_ob': 58, 'vol_spike': 0.289088648414792, 'adx_thresh': 19.244673620514142, 'atr_min_pct': 0.0030802675913736946, 'atr_max_pct': 0.029888083744491596, 'tp_mult': 2.3832067056148882, 'tsl_mult': 0.5855197606442402, 'strategy': 'breakout', 'time_stop': 243, 'use_sma': True, 'use_atr': True, 'use_adx': False, 'use_ema': True, 'use_spike': True, 'rsi_required': True, 'edge_k': 1.5501263858714704, 'edge_cap': 0.6535197633368074, 'bull_strategy': 'breakout', 'bull_bb_std_mult': 0.6643397208132282, 'bull_rsi_os': 45, 'bull_rsi_ob': 89, 'bull_adx_thresh': 23.829993389657027, 'bull_atr_min_pct': 0.0007100518346614009, 'bull_atr_max_pct': 0.13490329523877306, 'bull_tp_mult': 1.902713218333159, 'bull_tsl_mult': 0.4492972253793444, 'bull_time_stop': 116, 'bull_use_sma': True, 'bull_use_ema': True, 'bull_use_atr': False, 'bull_use_adx': False, 'bull_use_spike': True, 'bull_rsi_required': False, 'bear_strategy': 'breakout', 'bear_bb_std_mult': 1.489822664006079, 'bear_rsi_os': 15, 'bear_rsi_ob': 70, 'bear_adx_thresh': 17.450184961996793, 'bear_atr_min_pct': 0.005015203630589308, 'bear_atr_max_pct': 0.08005742922186267, 'bear_tp_mult': 1.2224202866940463, 'bear_tsl_mult': 0.6270924997792102, 'bear_time_stop': 57, 'bear_use_sma': False, 'bear_use_ema': True, 'bear_use_atr': False, 'bear_use_adx': False, 'bear_use_spike': False, 'bear_rsi_required': False, 'sideways_strategy': 'breakout', 'sideways_bb_std_mult': 1.9887740930746842, 'sideways_rsi_os': 49, 'sideways_rsi_ob': 53, 'sideways_adx_thresh': 24.558023979662668, 'sideways_atr_min_pct': 0.005062211410088762, 'sideways_atr_max_pct': 0.024665430251215495, 'sideways_tp_mult': 1.8700443446070432, 'sideways_tsl_mult': 0.0828795955598387, 'sideways_time_stop': 48, 'sideways_use_sma': False, 'sideways_use_ema': False, 'sideways_use_atr': False, 'sideways_use_adx': True, 'sideways_use_spike': True, 'sideways_rsi_required': True}.
[I 2025-08-31 10:18:54,102] Trial 190 finished with values: [-1000000000.0, 1000000000.0] and parameters: {'p_sma': 24, 'p_std': 18, 'p_atr': 29, 'p_adx': 22, 'rsi_period': 43, 'ema1': 21, 'ema2': 19, 'slip_atr_k': 0.033386258440149516, 'slip_spread_k': 0.23677314928044313, 'spread_hl_frac': 0.013352164386873215, 'bb_std_mult': 0.5675073082876988, 'rsi_os': 31, 'rsi_ob': 78, 'vol_spike': 0.29185950929884186, 'adx_thresh': 19.003075742830475, 'atr_min_pct': 0.0029217920207921366, 'atr_max_pct': 0.08379133410684657, 'tp_mult': 2.3799296871666598, 'tsl_mult': 0.5844286385003485, 'strategy': 'breakout', 'time_stop': 212, 'use_sma': True, 'use_atr': True, 'use_adx': False, 'use_ema': False, 'use_spike': True, 'rsi_required': True, 'edge_k': 0.03650018196421172, 'edge_cap': 0.8472639787591151, 'bull_strategy': 'breakout', 'bull_bb_std_mult': 3.3648477925773377, 'bull_rsi_os': 36, 'bull_rsi_ob': 61, 'bull_adx_thresh': 24.114635333388826, 'bull_atr_min_pct': 0.015445351879615718, 'bull_atr_max_pct': 0.13360134180473554, 'bull_tp_mult': 1.9060625678556102, 'bull_tsl_mult': 0.3769943220632932, 'bull_time_stop': 107, 'bull_use_sma': True, 'bull_use_ema': False, 'bull_use_atr': False, 'bull_use_adx': False, 'bull_use_spike': True, 'bull_rsi_required': False, 'bear_strategy': 'breakout', 'bear_bb_std_mult': 1.968247471450432, 'bear_rsi_os': 36, 'bear_rsi_ob': 65, 'bear_adx_thresh': 18.881160282562647, 'bear_atr_min_pct': 0.005077785697895686, 'bear_atr_max_pct': 0.14647501732881596, 'bear_tp_mult': 2.644646973039423, 'bear_tsl_mult': 0.5504858930981563, 'bear_time_stop': 57, 'bear_use_sma': False, 'bear_use_ema': True, 'bear_use_atr': False, 'bear_use_adx': True, 'bear_use_spike': False, 'bear_rsi_required': False, 'sideways_strategy': 'mean_reversion', 'sideways_bb_std_mult': 1.7334676008943255, 'sideways_rsi_os': 43, 'sideways_rsi_ob': 79, 'sideways_adx_thresh': 23.912695941445552, 'sideways_atr_min_pct': 0.00038406489367828756, 'sideways_atr_max_pct': 0.0236829034505806, 'sideways_tp_mult': 1.890526166201635, 'sideways_tsl_mult': 0.6677063654472337, 'sideways_time_stop': 157, 'sideways_use_sma': False, 'sideways_use_ema': False, 'sideways_use_atr': False, 'sideways_use_adx': True, 'sideways_use_spike': True, 'sideways_rsi_required': True}.
