[I 2025-08-31 10:25:55,830] Trial 243 finished with values: [-1000000000.0, 1000000000.0] and parameters: {'p_sma': 16, 'p_std': 28, 'p_atr': 30, 'p_adx': 23, 'rsi_period': 47, 'ema1': 25, 'ema2': 56, 'slip_atr_k': 0.18389433747386333, 'slip_spread_k': 0.5581510272699142, 'spread_hl_frac': 0.011476226199387651, 'bb_std_mult': 1.7088656239330837, 'rsi_os': 23, 'rsi_ob': 79, 'vol_spike': 0.26282983404696614, 'adx_thresh': 29.053495530387764, 'atr_min_pct': 0.020231132831273188, 'atr_max_pct': 0.10180994490760928, 'tp_mult': 2.4714092500714515, 'tsl_mult': 0.5876106005654128, 'strategy': 'breakout', 'time_stop': 262, 'use_sma': True, 'use_atr': True, 'use_adx': False, 'use_ema': False, 'use_spike': True, 'rsi_required': False, 'edge_k': 1.4423577228527937, 'edge_cap': 0.8689465048570044, 'bull_strategy': 'breakout', 'bull_bb_std_mult': 0.9142171518697857, 'bull_rsi_os': 48, 'bull_rsi_ob': 91, 'bull_adx_thresh': 33.97879058437105, 'bull_atr_min_pct': 0.006718200117884559, 'bull_atr_max_pct': 0.11855546119821772, 'bull_tp_mult': 1.693231682134645, 'bull_tsl_mult': 0.4060146601499113, 'bull_time_stop': 283, 'bull_use_sma': True, 'bull_use_ema': True, 'bull_use_atr': True, 'bull_use_adx': False, 'bull_use_spike': True, 'bull_rsi_required': True, 'bear_strategy': 'breakout', 'bear_bb_std_mult': 3.2168088448567698, 'bear_rsi_os': 39, 'bear_rsi_ob': 94, 'bear_adx_thresh': 14.82105308773172, 'bear_atr_min_pct': 0.004444724848432852, 'bear_atr_max_pct': 0.049351662601095, 'bear_tp_mult': 2.8432600809981823, 'bear_tsl_mult': 0.9885852267687387, 'bear_time_stop': 234, 'bear_use_sma': False, 'bear_use_ema': True, 'bear_use_atr': False, 'bear_use_adx': True, 'bear_use_spike': True, 'bear_rsi_required': False, 'sideways_strategy': 'breakout', 'sideways_bb_std_mult': 1.1559348653131383, 'sideways_rsi_os': 30, 'sideways_rsi_ob': 67, 'sideways_adx_thresh': 23.75313600082592, 'sideways_atr_min_pct': 0.006038126348223668, 'sideways_atr_max_pct': 0.06501669368889773, 'sideways_tp_mult': 1.9800409129098193, 'sideways_tsl_mult': 0.11745827551362345, 'sideways_time_stop': 46, 'sideways_use_sma': False, 'sideways_use_ema': False, 'sideways_use_atr': False, 'sideways_use_adx': False, 'sideways_use_spike': True, 'sideways_rsi_required': False}.
[I 2025-08-31 10:26:27,380] Trial 247 finished with values: [-0.028146504768191694, 0.028004497953017456] and parameters: {'p_sma': 15, 'p_std': 22, 'p_atr': 30, 'p_adx': 14, 'rsi_period': 42, 'ema1': 8, 'ema2': 54, 'slip_atr_k': 0.10787860977776104, 'slip_spread_k': 0.6060685643070027, 'spread_hl_frac': 0.013643146068459285, 'bb_std_mult': 2.5083609824499296, 'rsi_os': 30, 'rsi_ob': 91, 'vol_spike': 0.2504688256159383, 'adx_thresh': 30.016686785316182, 'atr_min_pct': 0.004706813533248046, 'atr_max_pct': 0.06722202215241703, 'tp_mult': 2.400171777377714, 'tsl_mult': 0.3468073663076471, 'strategy': 'mean_reversion', 'time_stop': 238, 'use_sma': True, 'use_atr': False, 'use_adx': True, 'use_ema': True, 'use_spike': True, 'rsi_required': True, 'edge_k': 0.21971111988933542, 'edge_cap': 0.4613761557575764, 'bull_strategy': 'mean_reversion', 'bull_bb_std_mult': 1.4149376625210341, 'bull_rsi_os': 5, 'bull_rsi_ob': 73, 'bull_adx_thresh': 23.934850944517756, 'bull_atr_min_pct': 0.001241600074521758, 'bull_atr_max_pct': 0.14101331302343012, 'bull_tp_mult': 1.6279520222796122, 'bull_tsl_mult': 0.5504510107724246, 'bull_time_stop': 72, 'bull_use_sma': False, 'bull_use_ema': False, 'bull_use_atr': False, 'bull_use_adx': False, 'bull_use_spike': False, 'bull_rsi_required': True, 'bear_strategy': 'breakout', 'bear_bb_std_mult': 0.6067045050429254, 'bear_rsi_os': 40, 'bear_rsi_ob': 70, 'bear_adx_thresh': 5.127070662864197, 'bear_atr_min_pct': 0.017766307905042758, 'bear_atr_max_pct': 0.08432499581945657, 'bear_tp_mult': 2.9582424924921735, 'bear_tsl_mult': 0.5509922443654165, 'bear_time_stop': 39, 'bear_use_sma': False, 'bear_use_ema': True, 'bear_use_atr': False, 'bear_use_adx': False, 'bear_use_spike': True, 'bear_rsi_required': False, 'sideways_strategy': 'mean_reversion', 'sideways_bb_std_mult': 0.8188967032170926, 'sideways_rsi_os': 21, 'sideways_rsi_ob': 82, 'sideways_adx_thresh': 8.365486020628156, 'sideways_atr_min_pct': 0.007229120387641873, 'sideways_atr_max_pct': 0.03040636076741688, 'sideways_tp_mult': 2.002971431494369, 'sideways_tsl_mult': 0.07726461518603454, 'sideways_time_stop': 30, 'sideways_use_sma': True, 'sideways_use_ema': False, 'sideways_use_atr': False, 'sideways_use_adx': True, 'sideways_use_spike': True, 'sideways_rsi_required': True}.
[I 2025-08-31 10:26:27,591] Trial 246 finished with values: [-0.029866078183516942, 0.029732694627589398] and parameters: {'p_sma': 42, 'p_std': 22, 'p_atr': 30, 'p_adx': 20, 'rsi_period': 42, 'ema1': 20, 'ema2': 54, 'slip_atr_k': 0.10820244303527068, 'slip_spread_k': 0.6285748386187323, 'spread_hl_frac': 0.0299743780832075, 'bb_std_mult': 0.6369796838127132, 'rsi_os': 32, 'rsi_ob': 73, 'vol_spike': 0.2636083750127057, 'adx_thresh': 21.674921127280015, 'atr_min_pct': 0.01220500020015441, 'atr_max_pct': 0.07583364970929239, 'tp_mult': 2.4024988886426026, 'tsl_mult': 0.586715832697789, 'strategy': 'mean_reversion', 'time_stop': 239, 'use_sma': True, 'use_atr': False, 'use_adx': True, 'use_ema': True, 'use_spike': True, 'rsi_required': True, 'edge_k': 0.21337168300962894, 'edge_cap': 0.8608217058798666, 'bull_strategy': 'breakout', 'bull_bb_std_mult': 0.7321539537228361, 'bull_rsi_os': 43, 'bull_rsi_ob': 78, 'bull_adx_thresh': 23.862546796462507, 'bull_atr_min_pct': 0.0011510809901223262, 'bull_atr_max_pct': 0.14120173386101234, 'bull_tp_mult': 1.283784350261735, 'bull_tsl_mult': 0.3613540004578816, 'bull_time_stop': 74, 'bull_use_sma': False, 'bull_use_ema': False, 'bull_use_atr': False, 'bull_use_adx': False, 'bull_use_spike': True, 'bull_rsi_required': True, 'bear_strategy': 'breakout', 'bear_bb_std_mult': 0.5559219962027349, 'bear_rsi_os': 11, 'bear_rsi_ob': 70, 'bear_adx_thresh': 24.65563975251731, 'bear_atr_min_pct': 0.004005356955988807, 'bear_atr_max_pct': 0.08507855911417495, 'bear_tp_mult': 2.9629388824174296, 'bear_tsl_mult': 0.8670278104184049, 'bear_time_stop': 143, 'bear_use_sma': False, 'bear_use_ema': True, 'bear_use_atr': False, 'bear_use_adx': False, 'bear_use_spike': True, 'bear_rsi_required': False, 'sideways_strategy': 'mean_reversion', 'sideways_bb_std_mult': 3.3878115107229876, 'sideways_rsi_os': 30, 'sideways_rsi_ob': 82, 'sideways_adx_thresh': 24.510674980787805, 'sideways_atr_min_pct': 0.00703204927313531, 'sideways_atr_max_pct': 0.01850991419316899, 'sideways_tp_mult': 1.97985239387662, 'sideways_tsl_mult': 0.0807897111203535, 'sideways_time_stop': 31, 'sideways_use_sma': True, 'sideways_use_ema': False, 'sideways_use_atr': False, 'sideways_use_adx': True, 'sideways_use_spike': True, 'sideways_rsi_required': True}.
[I 2025-08-31 10:26:27,730] Trial 244 finished with values: [-1000000000.0, 1000000000.0] and parameters: {'p_sma': 16, 'p_std': 22, 'p_atr': 30, 'p_adx': 20, 'rsi_period': 47, 'ema1': 16, 'ema2': 54, 'slip_atr_k': 0.23595190380168846, 'slip_spread_k': 0.6071836202892351, 'spread_hl_frac': 0.03971184606745415, 'bb_std_mult': 2.507060804608034, 'rsi_os': 23, 'rsi_ob': 73, 'vol_spike': 0.2634205563211261, 'adx_thresh': 29.97770509507954, 'atr_min_pct': 0.006920263232621873, 'atr_max_pct': 0.06623857778981951, 'tp_mult': 2.400539736854698, 'tsl_mult': 0.586372929288256, 'strategy': 'breakout', 'time_stop': 241, 'use_sma': True, 'use_atr': True, 'use_adx': False, 'use_ema': False, 'use_spike': True, 'rsi_required': False, 'edge_k': 0.9669117683294, 'edge_cap': 0.5689158379511796, 'bull_strategy': 'breakout', 'bull_bb_std_mult': 1.3953861132919272, 'bull_rsi_os': 42, 'bull_rsi_ob': 77, 'bull_adx_thresh': 8.455261741357006, 'bull_atr_min_pct': 0.013400497355427617, 'bull_atr_max_pct': 0.11913353728677593, 'bull_tp_mult': 1.734192641831421, 'bull_tsl_mult': 0.35381860427739087, 'bull_time_stop': 75, 'bull_use_sma': True, 'bull_use_ema': True, 'bull_use_atr': True, 'bull_use_adx': False, 'bull_use_spike': True, 'bull_rsi_required': True, 'bear_strategy': 'breakout', 'bear_bb_std_mult': 3.1612646499098256, 'bear_rsi_os': 14, 'bear_rsi_ob': 67, 'bear_adx_thresh': 5.118740387907835, 'bear_atr_min_pct': 0.004366582320055674, 'bear_atr_max_pct': 0.07788505246854169, 'bear_tp_mult': 2.9555274645753107, 'bear_tsl_mult': 0.5634839042184048, 'bear_time_stop': 143, 'bear_use_sma': False, 'bear_use_ema': True, 'bear_use_atr': False, 'bear_use_adx': True, 'bear_use_spike': True, 'bear_rsi_required': False, 'sideways_strategy': 'breakout', 'sideways_bb_std_mult': 1.8275656084733325, 'sideways_rsi_os': 21, 'sideways_rsi_ob': 82, 'sideways_adx_thresh': 23.93138977693086, 'sideways_atr_min_pct': 0.02284864361473809, 'sideways_atr_max_pct': 0.026067799644703148, 'sideways_tp_mult': 1.982268677539792, 'sideways_tsl_mult': 0.11054029871556632, 'sideways_time_stop': 43, 'sideways_use_sma': False, 'sideways_use_ema': False, 'sideways_use_atr': False, 'sideways_use_adx': False, 'sideways_use_spike': True, 'sideways_rsi_required': False}.
[I 2025-08-31 10:26:27,834] Trial 245 finished with values: [-1000000000.0, 1000000000.0] and parameters: {'p_sma': 16, 'p_std': 22, 'p_atr': 30, 'p_adx': 12, 'rsi_period': 47, 'ema1': 16, 'ema2': 54, 'slip_atr_k': 0.026393337621349624, 'slip_spread_k': 0.6310210369817181, 'spread_hl_frac': 0.007479591942853293, 'bb_std_mult': 3.4585932788779363, 'rsi_os': 22, 'rsi_ob': 73, 'vol_spike': 0.26247574721932543, 'adx_thresh': 23.493551656956242, 'atr_min_pct': 0.004702735849197346, 'atr_max_pct': 0.08542891185373915, 'tp_mult': 1.7099497101039494, 'tsl_mult': 0.344608035924338, 'strategy': 'breakout', 'time_stop': 238, 'use_sma': True, 'use_atr': True, 'use_adx': False, 'use_ema': True, 'use_spike': True, 'rsi_required': True, 'edge_k': 0.9516901364638898, 'edge_cap': 0.8601052155514765, 'bull_strategy': 'breakout', 'bull_bb_std_mult': 0.7437793308041699, 'bull_rsi_os': 50, 'bull_rsi_ob': 73, 'bull_adx_thresh': 23.732813444997394, 'bull_atr_min_pct': 0.011420348102723143, 'bull_atr_max_pct': 0.14065938179616008, 'bull_tp_mult': 2.1201198165450683, 'bull_tsl_mult': 0.3527642709079698, 'bull_time_stop': 72, 'bull_use_sma': True, 'bull_use_ema': False, 'bull_use_atr': False, 'bull_use_adx': False, 'bull_use_spike': True, 'bull_rsi_required': True, 'bear_strategy': 'breakout', 'bear_bb_std_mult': 1.1422457627852252, 'bear_rsi_os': 41, 'bear_rsi_ob': 69, 'bear_adx_thresh': 31.890166641694762, 'bear_atr_min_pct': 0.0040231712727278055, 'bear_atr_max_pct': 0.08390852959175718, 'bear_tp_mult': 2.735451931909143, 'bear_tsl_mult': 0.277792701619311, 'bear_time_stop': 38, 'bear_use_sma': False, 'bear_use_ema': True, 'bear_use_atr': False, 'bear_use_adx': False, 'bear_use_spike': True, 'bear_rsi_required': False, 'sideways_strategy': 'mean_reversion', 'sideways_bb_std_mult': 1.8283379516530622, 'sideways_rsi_os': 18, 'sideways_rsi_ob': 67, 'sideways_adx_thresh': 24.238459557918894, 'sideways_atr_min_pct': 0.00544490743189748, 'sideways_atr_max_pct': 0.019167575414639006, 'sideways_tp_mult': 2.0481606209535403, 'sideways_tsl_mult': 0.08223335778931558, 'sideways_time_stop': 31, 'sideways_use_sma': False, 'sideways_use_ema': False, 'sideways_use_atr': False, 'sideways_use_adx': True, 'sideways_use_spike': True, 'sideways_rsi_required': True}.
[I 2025-08-31 10:26:59,500] Trial 248 finished with values: [-1000000000.0, 1000000000.0] and parameters: {'p_sma': 14, 'p_std': 25, 'p_atr': 15, 'p_adx': 10, 'rsi_period': 41, 'ema1': 16, 'ema2': 54, 'slip_atr_k': 0.029210934325740602, 'slip_spread_k': 0.6330211225830373, 'spread_hl_frac': 0.03949455542699948, 'bb_std_mult': 3.3983031926426825, 'rsi_os': 10, 'rsi_ob': 73, 'vol_spike': 0.26580144647356835, 'adx_thresh': 31.121780117177472, 'atr_min_pct': 0.006205256780452446, 'atr_max_pct': 0.08857834941929393, 'tp_mult': 1.2385849625864993, 'tsl_mult': 0.9721287938645127, 'strategy': 'breakout', 'time_stop': 84, 'use_sma': True, 'use_atr': True, 'use_adx': False, 'use_ema': True, 'use_spike': True, 'rsi_required': False, 'edge_k': 1.5851581049117636, 'edge_cap': 0.8444919054849571, 'bull_strategy': 'breakout', 'bull_bb_std_mult': 0.7797101629600016, 'bull_rsi_os': 43, 'bull_rsi_ob': 78, 'bull_adx_thresh': 29.65577164413778, 'bull_atr_min_pct': 0.00204293646796901, 'bull_atr_max_pct': 0.13479806700439576, 'bull_tp_mult': 1.3139105944243659, 'bull_tsl_mult': 0.34782481804344184, 'bull_time_stop': 84, 'bull_use_sma': True, 'bull_use_ema': True, 'bull_use_atr': True, 'bull_use_adx': False, 'bull_use_spike': True, 'bull_rsi_required': True, 'bear_strategy': 'breakout', 'bear_bb_std_mult': 1.253799949469575, 'bear_rsi_os': 24, 'bear_rsi_ob': 68, 'bear_adx_thresh': 31.94237912549638, 'bear_atr_min_pct': 0.0014521576441385402, 'bear_atr_max_pct': 0.10447395747506469, 'bear_tp_mult': 2.7280001389062343, 'bear_tsl_mult': 0.39078196781484115, 'bear_time_stop': 56, 'bear_use_sma': True, 'bear_use_ema': True, 'bear_use_atr': False, 'bear_use_adx': False, 'bear_use_spike': False, 'bear_rsi_required': False, 'sideways_strategy': 'breakout', 'sideways_bb_std_mult': 0.9167376964234397, 'sideways_rsi_os': 51, 'sideways_rsi_ob': 79, 'sideways_adx_thresh': 14.700503380419102, 'sideways_atr_min_pct': 0.009952191738501197, 'sideways_atr_max_pct': 0.14321746136778768, 'sideways_tp_mult': 2.0412426227964895, 'sideways_tsl_mult': 0.09149811964423173, 'sideways_time_stop': 108, 'sideways_use_sma': False, 'sideways_use_ema': False, 'sideways_use_atr': True, 'sideways_use_adx': True, 'sideways_use_spike': False, 'sideways_rsi_required': True}.
[I 2025-08-31 10:26:59,714] Trial 250 finished with values: [-1000000000.0, 1000000000.0] and parameters: {'p_sma': 11, 'p_std': 27, 'p_atr': 29, 'p_adx': 12, 'rsi_period': 24, 'ema1': 15, 'ema2': 26, 'slip_atr_k': 0.029577959890237808, 'slip_spread_k': 0.6617177314898897, 'spread_hl_frac': 0.020420801405409902, 'bb_std_mult': 0.7111895458269815, 'rsi_os': 6, 'rsi_ob': 75, 'vol_spike': 0.17535812589085586, 'adx_thresh': 27.143395844732282, 'atr_min_pct': 0.004981539718390843, 'atr_max_pct': 0.08725662197877662, 'tp_mult': 2.951935547550001, 'tsl_mult': 0.4139196056647556, 'strategy': 'breakout', 'time_stop': 228, 'use_sma': True, 'use_atr': True, 'use_adx': False, 'use_ema': True, 'use_spike': False, 'rsi_required': False, 'edge_k': 1.1828749397355445, 'edge_cap': 0.6658073570525606, 'bull_strategy': 'mean_reversion', 'bull_bb_std_mult': 2.245941166108837, 'bull_rsi_os': 8, 'bull_rsi_ob': 82, 'bull_adx_thresh': 23.307040036077726, 'bull_atr_min_pct': 0.029883694604595203, 'bull_atr_max_pct': 0.13543786934769075, 'bull_tp_mult': 1.0452134989319417, 'bull_tsl_mult': 0.4316632881421868, 'bull_time_stop': 86, 'bull_use_sma': True, 'bull_use_ema': True, 'bull_use_atr': True, 'bull_use_adx': True, 'bull_use_spike': True, 'bull_rsi_required': False, 'bear_strategy': 'mean_reversion', 'bear_bb_std_mult': 1.2465543242540782, 'bear_rsi_os': 37, 'bear_rsi_ob': 69, 'bear_adx_thresh': 31.795372407216973, 'bear_atr_min_pct': 0.002849974376497127, 'bear_atr_max_pct': 0.07885961067763905, 'bear_tp_mult': 1.236171814812184, 'bear_tsl_mult': 0.8116072516196451, 'bear_time_stop': 223, 'bear_use_sma': True, 'bear_use_ema': True, 'bear_use_atr': True, 'bear_use_adx': False, 'bear_use_spike': False, 'bear_rsi_required': False, 'sideways_strategy': 'breakout', 'sideways_bb_std_mult': 0.9322118346485286, 'sideways_rsi_os': 50, 'sideways_rsi_ob': 79, 'sideways_adx_thresh': 14.726932760760814, 'sideways_atr_min_pct': 0.005338286491201304, 'sideways_atr_max_pct': 0.05112219503268434, 'sideways_tp_mult': 1.9149201503941657, 'sideways_tsl_mult': 0.08975492466151132, 'sideways_time_stop': 40, 'sideways_use_sma': False, 'sideways_use_ema': False, 'sideways_use_atr': True, 'sideways_use_adx': True, 'sideways_use_spike': False, 'sideways_rsi_required': True}.
[I 2025-08-31 10:26:59,811] Trial 249 finished with values: [-1000000000.0, 1000000000.0] and parameters: {'p_sma': 14, 'p_std': 25, 'p_atr': 29, 'p_adx': 15, 'rsi_period': 24, 'ema1': 16, 'ema2': 20, 'slip_atr_k': 0.036926187614470043, 'slip_spread_k': 0.9736316259586517, 'spread_hl_frac': 0.020744381698082993, 'bb_std_mult': 3.45382504700639, 'rsi_os': 27, 'rsi_ob': 73, 'vol_spike': 0.18757412656524963, 'adx_thresh': 12.40315963526221, 'atr_min_pct': 0.028002925640360464, 'atr_max_pct': 0.08738862242418598, 'tp_mult': 2.9601993413395973, 'tsl_mult': 0.6022294430372063, 'strategy': 'breakout', 'time_stop': 15, 'use_sma': True, 'use_atr': True, 'use_adx': False, 'use_ema': True, 'use_spike': True, 'rsi_required': False, 'edge_k': 0.9112259328323865, 'edge_cap': 0.5682569606579809, 'bull_strategy': 'breakout', 'bull_bb_std_mult': 0.7999044671373896, 'bull_rsi_os': 42, 'bull_rsi_ob': 82, 'bull_adx_thresh': 23.13219270819044, 'bull_atr_min_pct': 0.009306556740058418, 'bull_atr_max_pct': 0.015363801427828103, 'bull_tp_mult': 2.1188907452367385, 'bull_tsl_mult': 0.3522342321025186, 'bull_time_stop': 83, 'bull_use_sma': True, 'bull_use_ema': True, 'bull_use_atr': True, 'bull_use_adx': True, 'bull_use_spike': True, 'bull_rsi_required': False, 'bear_strategy': 'mean_reversion', 'bear_bb_std_mult': 1.2475749029844572, 'bear_rsi_os': 37, 'bear_rsi_ob': 67, 'bear_adx_thresh': 10.54537419285487, 'bear_atr_min_pct': 6.372082275848782e-05, 'bear_atr_max_pct': 0.10474846077177499, 'bear_tp_mult': 2.7385403412438363, 'bear_tsl_mult': 0.48528614815836457, 'bear_time_stop': 52, 'bear_use_sma': True, 'bear_use_ema': True, 'bear_use_atr': True, 'bear_use_adx': False, 'bear_use_spike': False, 'bear_rsi_required': False, 'sideways_strategy': 'breakout', 'sideways_bb_std_mult': 0.9206008471713034, 'sideways_rsi_os': 21, 'sideways_rsi_ob': 79, 'sideways_adx_thresh': 22.89727350564431, 'sideways_atr_min_pct': 0.0052907555477578055, 'sideways_atr_max_pct': 0.14307967025335352, 'sideways_tp_mult': 1.9251451949550382, 'sideways_tsl_mult': 0.8295463714239765, 'sideways_time_stop': 42, 'sideways_use_sma': False, 'sideways_use_ema': False, 'sideways_use_atr': True, 'sideways_use_adx': True, 'sideways_use_spike': False, 'sideways_rsi_required': True}.
[I 2025-08-31 10:27:00,043] Trial 251 finished with values: [-1000000000.0, 1000000000.0] and parameters: {'p_sma': 14, 'p_std': 25, 'p_atr': 29, 'p_adx': 10, 'rsi_period': 43, 'ema1': 17, 'ema2': 20, 'slip_atr_k': 0.036800489889626635, 'slip_spread_k': 0.9249797438590968, 'spread_hl_frac': 0.04280603395506, 'bb_std_mult': 0.7116130081282296, 'rsi_os': 25, 'rsi_ob': 75, 'vol_spike': 0.2673104278357026, 'adx_thresh': 27.52195405523567, 'atr_min_pct': 0.006136992454281643, 'atr_max_pct': 0.018222896904106563, 'tp_mult': 1.3811118179927613, 'tsl_mult': 0.10882738314261164, 'strategy': 'breakout', 'time_stop': 85, 'use_sma': True, 'use_atr': True, 'use_adx': False, 'use_ema': True, 'use_spike': False, 'rsi_required': False, 'edge_k': 1.5799698929178307, 'edge_cap': 0.8327883481289576, 'bull_strategy': 'mean_reversion', 'bull_bb_std_mult': 0.7996695340523053, 'bull_rsi_os': 11, 'bull_rsi_ob': 50, 'bull_adx_thresh': 24.51294985637342, 'bull_atr_min_pct': 0.009404845335264107, 'bull_atr_max_pct': 0.1341798133936306, 'bull_tp_mult': 1.8765850836858369, 'bull_tsl_mult': 0.0003125451554090719, 'bull_time_stop': 85, 'bull_use_sma': True, 'bull_use_ema': True, 'bull_use_atr': True, 'bull_use_adx': True, 'bull_use_spike': False, 'bull_rsi_required': False, 'bear_strategy': 'mean_reversion', 'bear_bb_std_mult': 1.243503969531464, 'bear_rsi_os': 38, 'bear_rsi_ob': 68, 'bear_adx_thresh': 6.757769611999327, 'bear_atr_min_pct': 0.0027237439114007247, 'bear_atr_max_pct': 0.10536994111930824, 'bear_tp_mult': 2.159907657615017, 'bear_tsl_mult': 0.8195500128064295, 'bear_time_stop': 55, 'bear_use_sma': True, 'bear_use_ema': True, 'bear_use_atr': True, 'bear_use_adx': False, 'bear_use_spike': False, 'bear_rsi_required': False, 'sideways_strategy': 'breakout', 'sideways_bb_std_mult': 1.3164239284458834, 'sideways_rsi_os': 11, 'sideways_rsi_ob': 80, 'sideways_adx_thresh': 22.93584148313145, 'sideways_atr_min_pct': 0.004568366684281202, 'sideways_atr_max_pct': 0.0872561239454592, 'sideways_tp_mult': 1.8991848255397072, 'sideways_tsl_mult': 0.06334707043281908, 'sideways_time_stop': 166, 'sideways_use_sma': False, 'sideways_use_ema': False, 'sideways_use_atr': True, 'sideways_use_adx': True, 'sideways_use_spike': False, 'sideways_rsi_required': True}.
