[I 2025-08-31 10:53:23,061] Trial 457 finished with values: [-1000000000.0, 1000000000.0] and parameters: {'p_sma': 14, 'p_std': 27, 'p_atr': 12, 'p_adx': 14, 'rsi_period': 25, 'ema1': 14, 'ema2': 14, 'slip_atr_k': 0.04774201267003446, 'slip_spread_k': 0.6508324864433229, 'spread_hl_frac': 0.04619113298181879, 'bb_std_mult': 2.6316265318551904, 'rsi_os': 21, 'rsi_ob': 91, 'vol_spike': 0.26455900238723007, 'adx_thresh': 5.5608774241113625, 'atr_min_pct': 0.006416897808744937, 'atr_max_pct': 0.1040871186588295, 'tp_mult': 1.6327846511266584, 'tsl_mult': 0.27509841532225043, 'strategy': 'mean_reversion', 'time_stop': 51, 'use_sma': True, 'use_atr': False, 'use_adx': True, 'use_ema': True, 'use_spike': True, 'rsi_required': True, 'edge_k': 0.29909754347740913, 'edge_cap': 0.38003955667545963, 'bull_strategy': 'breakout', 'bull_bb_std_mult': 3.498980342567828, 'bull_rsi_os': 20, 'bull_rsi_ob': 74, 'bull_adx_thresh': 6.693273766675356, 'bull_atr_min_pct': 0.022142918630067485, 'bull_atr_max_pct': 0.09828224418493274, 'bull_tp_mult': 1.8124248353997092, 'bull_tsl_mult': 0.36166346118611864, 'bull_time_stop': 61, 'bull_use_sma': False, 'bull_use_ema': False, 'bull_use_atr': False, 'bull_use_adx': False, 'bull_use_spike': False, 'bull_rsi_required': True, 'bear_strategy': 'breakout', 'bear_bb_std_mult': 0.5098826384215802, 'bear_rsi_os': 41, 'bear_rsi_ob': 78, 'bear_adx_thresh': 11.072580634228979, 'bear_atr_min_pct': 0.019577151900922976, 'bear_atr_max_pct': 0.13977242941527707, 'bear_tp_mult': 2.751124642760396, 'bear_tsl_mult': 0.9461800334315985, 'bear_time_stop': 177, 'bear_use_sma': False, 'bear_use_ema': True, 'bear_use_atr': False, 'bear_use_adx': False, 'bear_use_spike': False, 'bear_rsi_required': False, 'sideways_strategy': 'mean_reversion', 'sideways_bb_std_mult': 2.7736697096404055, 'sideways_rsi_os': 50, 'sideways_rsi_ob': 74, 'sideways_adx_thresh': 32.4878595303492, 'sideways_atr_min_pct': 0.01832345545914935, 'sideways_atr_max_pct': 0.05275901939991158, 'sideways_tp_mult': 1.7854073700394086, 'sideways_tsl_mult': 0.8880202472410865, 'sideways_time_stop': 228, 'sideways_use_sma': True, 'sideways_use_ema': True, 'sideways_use_atr': True, 'sideways_use_adx': False, 'sideways_use_spike': False, 'sideways_rsi_required': True}.
[I 2025-08-31 10:53:54,917] Trial 461 finished with values: [-1000000000.0, 1000000000.0] and parameters: {'p_sma': 32, 'p_std': 60, 'p_atr': 10, 'p_adx': 26, 'rsi_period': 49, 'ema1': 13, 'ema2': 53, 'slip_atr_k': 0.03129968001333813, 'slip_spread_k': 0.676777955738286, 'spread_hl_frac': 0.011375094894244693, 'bb_std_mult': 2.7223362398431723, 'rsi_os': 26, 'rsi_ob': 53, 'vol_spike': 0.25316822746443096, 'adx_thresh': 13.148647105170951, 'atr_min_pct': 0.007325870198955469, 'atr_max_pct': 0.06861882638943864, 'tp_mult': 2.3596042976329494, 'tsl_mult': 0.28952561161401025, 'strategy': 'breakout', 'time_stop': 79, 'use_sma': True, 'use_atr': False, 'use_adx': True, 'use_ema': True, 'use_spike': True, 'rsi_required': True, 'edge_k': 0.18261445543362104, 'edge_cap': 0.48533754648598576, 'bull_strategy': 'breakout', 'bull_bb_std_mult': 2.218169083898989, 'bull_rsi_os': 33, 'bull_rsi_ob': 73, 'bull_adx_thresh': 6.640765301677796, 'bull_atr_min_pct': 0.008111461369109339, 'bull_atr_max_pct': 0.0946057654229852, 'bull_tp_mult': 1.4426115306928002, 'bull_tsl_mult': 0.5161625429936159, 'bull_time_stop': 82, 'bull_use_sma': True, 'bull_use_ema': False, 'bull_use_atr': False, 'bull_use_adx': False, 'bull_use_spike': False, 'bull_rsi_required': True, 'bear_strategy': 'breakout', 'bear_bb_std_mult': 2.734681164460299, 'bear_rsi_os': 43, 'bear_rsi_ob': 88, 'bear_adx_thresh': 34.99102884100029, 'bear_atr_min_pct': 0.007849539654389049, 'bear_atr_max_pct': 0.13954294933756725, 'bear_tp_mult': 2.73639476119234, 'bear_tsl_mult': 0.5361640130493028, 'bear_time_stop': 35, 'bear_use_sma': False, 'bear_use_ema': True, 'bear_use_atr': False, 'bear_use_adx': False, 'bear_use_spike': True, 'bear_rsi_required': False, 'sideways_strategy': 'mean_reversion', 'sideways_bb_std_mult': 2.350364605838154, 'sideways_rsi_os': 51, 'sideways_rsi_ob': 94, 'sideways_adx_thresh': 24.513925281388257, 'sideways_atr_min_pct': 0.01853108904316176, 'sideways_atr_max_pct': 0.11940155094903493, 'sideways_tp_mult': 1.2840350008835237, 'sideways_tsl_mult': 0.8834720229166766, 'sideways_time_stop': 77, 'sideways_use_sma': False, 'sideways_use_ema': False, 'sideways_use_atr': False, 'sideways_use_adx': False, 'sideways_use_spike': False, 'sideways_rsi_required': True}.
[I 2025-08-31 10:53:55,282] Trial 462 finished with values: [-1000000000.0, 1000000000.0] and parameters: {'p_sma': 41, 'p_std': 30, 'p_atr': 23, 'p_adx': 7, 'rsi_period': 65, 'ema1': 13, 'ema2': 53, 'slip_atr_k': 0.030191757554672446, 'slip_spread_k': 0.7518905197236616, 'spread_hl_frac': 0.03568431519477914, 'bb_std_mult': 2.781013167362447, 'rsi_os': 7, 'rsi_ob': 75, 'vol_spike': 0.25274862559152605, 'adx_thresh': 28.761655387983943, 'atr_min_pct': 0.01224817021612715, 'atr_max_pct': 0.098182133715899, 'tp_mult': 1.6313331195054723, 'tsl_mult': 0.6859122867660965, 'strategy': 'breakout', 'time_stop': 81, 'use_sma': True, 'use_atr': False, 'use_adx': True, 'use_ema': True, 'use_spike': True, 'rsi_required': True, 'edge_k': 0.13276791147663128, 'edge_cap': 0.40197634189536313, 'bull_strategy': 'breakout', 'bull_bb_std_mult': 1.0338197694884468, 'bull_rsi_os': 11, 'bull_rsi_ob': 72, 'bull_adx_thresh': 9.181060339930891, 'bull_atr_min_pct': 0.013254879165473854, 'bull_atr_max_pct': 0.1074854165392773, 'bull_tp_mult': 1.7166500108227851, 'bull_tsl_mult': 0.5277943403262852, 'bull_time_stop': 158, 'bull_use_sma': True, 'bull_use_ema': False, 'bull_use_atr': False, 'bull_use_adx': False, 'bull_use_spike': False, 'bull_rsi_required': True, 'bear_strategy': 'breakout', 'bear_bb_std_mult': 2.96445578867883, 'bear_rsi_os': 7, 'bear_rsi_ob': 88, 'bear_adx_thresh': 23.15478147057426, 'bear_atr_min_pct': 0.02938845496001033, 'bear_atr_max_pct': 0.13954142194725128, 'bear_tp_mult': 1.0810717720873306, 'bear_tsl_mult': 0.7001499143875588, 'bear_time_stop': 43, 'bear_use_sma': False, 'bear_use_ema': True, 'bear_use_atr': False, 'bear_use_adx': False, 'bear_use_spike': True, 'bear_rsi_required': False, 'sideways_strategy': 'mean_reversion', 'sideways_bb_std_mult': 2.541655361258544, 'sideways_rsi_os': 25, 'sideways_rsi_ob': 58, 'sideways_adx_thresh': 25.34878051565365, 'sideways_atr_min_pct': 0.018403517616267018, 'sideways_atr_max_pct': 0.0632225215855808, 'sideways_tp_mult': 1.3556803461177407, 'sideways_tsl_mult': 0.11201746493035031, 'sideways_time_stop': 25, 'sideways_use_sma': False, 'sideways_use_ema': False, 'sideways_use_atr': False, 'sideways_use_adx': False, 'sideways_use_spike': False, 'sideways_rsi_required': True}.
[I 2025-08-31 10:53:55,288] Trial 463 finished with values: [-1000000000.0, 1000000000.0] and parameters: {'p_sma': 33, 'p_std': 30, 'p_atr': 23, 'p_adx': 22, 'rsi_period': 36, 'ema1': 13, 'ema2': 53, 'slip_atr_k': 0.08088215214285711, 'slip_spread_k': 0.06691578849338486, 'spread_hl_frac': 0.011197630308391491, 'bb_std_mult': 2.7259575099930493, 'rsi_os': 26, 'rsi_ob': 84, 'vol_spike': 0.25365979975487457, 'adx_thresh': 15.215199803098802, 'atr_min_pct': 0.022004654003605538, 'atr_max_pct': 0.09624591016499619, 'tp_mult': 2.1159675110596723, 'tsl_mult': 0.2325981378145826, 'strategy': 'breakout', 'time_stop': 78, 'use_sma': True, 'use_atr': False, 'use_adx': True, 'use_ema': True, 'use_spike': True, 'rsi_required': True, 'edge_k': 0.11205116659675061, 'edge_cap': 0.5062080715428212, 'bull_strategy': 'breakout', 'bull_bb_std_mult': 2.2313121652665875, 'bull_rsi_os': 11, 'bull_rsi_ob': 72, 'bull_adx_thresh': 10.294398488172018, 'bull_atr_min_pct': 0.020744591460196412, 'bull_atr_max_pct': 0.04690940881414135, 'bull_tp_mult': 1.4534252971245338, 'bull_tsl_mult': 0.5092967098286365, 'bull_time_stop': 157, 'bull_use_sma': True, 'bull_use_ema': False, 'bull_use_atr': False, 'bull_use_adx': False, 'bull_use_spike': False, 'bull_rsi_required': True, 'bear_strategy': 'breakout', 'bear_bb_std_mult': 2.242180319442498, 'bear_rsi_os': 39, 'bear_rsi_ob': 88, 'bear_adx_thresh': 34.95188793652318, 'bear_atr_min_pct': 0.00738319814508152, 'bear_atr_max_pct': 0.1414991701931454, 'bear_tp_mult': 2.8184801546773195, 'bear_tsl_mult': 0.5365691463430332, 'bear_time_stop': 43, 'bear_use_sma': False, 'bear_use_ema': True, 'bear_use_atr': False, 'bear_use_adx': False, 'bear_use_spike': True, 'bear_rsi_required': False, 'sideways_strategy': 'mean_reversion', 'sideways_bb_std_mult': 1.5848203629043416, 'sideways_rsi_os': 25, 'sideways_rsi_ob': 89, 'sideways_adx_thresh': 25.476524947200467, 'sideways_atr_min_pct': 0.0017716637633410533, 'sideways_atr_max_pct': 0.10964848516835335, 'sideways_tp_mult': 1.3631917707607495, 'sideways_tsl_mult': 0.9639787630720802, 'sideways_time_stop': 78, 'sideways_use_sma': False, 'sideways_use_ema': False, 'sideways_use_atr': False, 'sideways_use_adx': False, 'sideways_use_spike': False, 'sideways_rsi_required': True}.
[I 2025-08-31 10:53:55,396] Trial 460 finished with values: [-1000000000.0, 1000000000.0] and parameters: {'p_sma': 33, 'p_std': 28, 'p_atr': 10, 'p_adx': 14, 'rsi_period': 36, 'ema1': 30, 'ema2': 44, 'slip_atr_k': 0.21415367796760915, 'slip_spread_k': 0.7534895451473149, 'spread_hl_frac': 0.006474215954772115, 'bb_std_mult': 2.6289827464182434, 'rsi_os': 7, 'rsi_ob': 75, 'vol_spike': 0.011248834999680768, 'adx_thresh': 13.207313436811454, 'atr_min_pct': 0.006834990354382967, 'atr_max_pct': 0.024232409115708883, 'tp_mult': 2.350005444256684, 'tsl_mult': 0.27599836464978506, 'strategy': 'mean_reversion', 'time_stop': 79, 'use_sma': True, 'use_atr': False, 'use_adx': True, 'use_ema': True, 'use_spike': True, 'rsi_required': True, 'edge_k': 0.5522841770264197, 'edge_cap': 0.5018946431206743, 'bull_strategy': 'breakout', 'bull_bb_std_mult': 0.884607307944071, 'bull_rsi_os': 11, 'bull_rsi_ob': 89, 'bull_adx_thresh': 5.016637259230608, 'bull_atr_min_pct': 0.01319580449429282, 'bull_atr_max_pct': 0.12350599951789973, 'bull_tp_mult': 1.8104868058050638, 'bull_tsl_mult': 0.36629382062756394, 'bull_time_stop': 83, 'bull_use_sma': True, 'bull_use_ema': False, 'bull_use_atr': False, 'bull_use_adx': False, 'bull_use_spike': False, 'bull_rsi_required': True, 'bear_strategy': 'breakout', 'bear_bb_std_mult': 2.23416804276464, 'bear_rsi_os': 39, 'bear_rsi_ob': 47, 'bear_adx_thresh': 5.921586228464893, 'bear_atr_min_pct': 0.008042247208531115, 'bear_atr_max_pct': 0.04991232359807932, 'bear_tp_mult': 2.9964716326714274, 'bear_tsl_mult': 0.8767303803608084, 'bear_time_stop': 272, 'bear_use_sma': False, 'bear_use_ema': True, 'bear_use_atr': False, 'bear_use_adx': False, 'bear_use_spike': False, 'bear_rsi_required': False, 'sideways_strategy': 'mean_reversion', 'sideways_bb_std_mult': 2.327403556190403, 'sideways_rsi_os': 30, 'sideways_rsi_ob': 94, 'sideways_adx_thresh': 19.127620471738528, 'sideways_atr_min_pct': 0.01843693025820631, 'sideways_atr_max_pct': 0.038000555314473126, 'sideways_tp_mult': 1.946048715209527, 'sideways_tsl_mult': 0.9666711612488266, 'sideways_time_stop': 19, 'sideways_use_sma': True, 'sideways_use_ema': False, 'sideways_use_atr': False, 'sideways_use_adx': False, 'sideways_use_spike': False, 'sideways_rsi_required': True}.
[I 2025-08-31 10:54:25,709] Trial 465 finished with values: [-1000000000.0, 1000000000.0] and parameters: {'p_sma': 16, 'p_std': 29, 'p_atr': 11, 'p_adx': 14, 'rsi_period': 29, 'ema1': 12, 'ema2': 56, 'slip_atr_k': 0.11903550376764455, 'slip_spread_k': 0.8916963700238886, 'spread_hl_frac': 8.440607702912134e-05, 'bb_std_mult': 2.890580647387479, 'rsi_os': 49, 'rsi_ob': 76, 'vol_spike': 0.03330855250415016, 'adx_thresh': 22.855657683592227, 'atr_min_pct': 0.023757795743856776, 'atr_max_pct': 0.023967477530148024, 'tp_mult': 2.291734325205235, 'tsl_mult': 0.9992988498639537, 'strategy': 'breakout', 'time_stop': 184, 'use_sma': False, 'use_atr': False, 'use_adx': True, 'use_ema': True, 'use_spike': False, 'rsi_required': True, 'edge_k': 1.9390105234342832, 'edge_cap': 0.44129170946858953, 'bull_strategy': 'breakout', 'bull_bb_std_mult': 0.922026846002541, 'bull_rsi_os': 51, 'bull_rsi_ob': 66, 'bull_adx_thresh': 8.188404414857235, 'bull_atr_min_pct': 0.02131298616852729, 'bull_atr_max_pct': 0.06703595123487201, 'bull_tp_mult': 1.7775838350470077, 'bull_tsl_mult': 0.787031491689621, 'bull_time_stop': 75, 'bull_use_sma': True, 'bull_use_ema': False, 'bull_use_atr': False, 'bull_use_adx': True, 'bull_use_spike': False, 'bull_rsi_required': True, 'bear_strategy': 'breakout', 'bear_bb_std_mult': 1.5613605609827448, 'bear_rsi_os': 38, 'bear_rsi_ob': 60, 'bear_adx_thresh': 5.999428937397848, 'bear_atr_min_pct': 0.005966200494512066, 'bear_atr_max_pct': 0.12603380151822452, 'bear_tp_mult': 2.874690434824362, 'bear_tsl_mult': 0.29052471558365683, 'bear_time_stop': 79, 'bear_use_sma': False, 'bear_use_ema': True, 'bear_use_atr': False, 'bear_use_adx': False, 'bear_use_spike': True, 'bear_rsi_required': False, 'sideways_strategy': 'mean_reversion', 'sideways_bb_std_mult': 3.454425762382284, 'sideways_rsi_os': 42, 'sideways_rsi_ob': 94, 'sideways_adx_thresh': 27.471146991170034, 'sideways_atr_min_pct': 0.016608665206655698, 'sideways_atr_max_pct': 0.03854971171446217, 'sideways_tp_mult': 1.6040744985947808, 'sideways_tsl_mult': 0.42540184696822403, 'sideways_time_stop': 15, 'sideways_use_sma': False, 'sideways_use_ema': False, 'sideways_use_atr': False, 'sideways_use_adx': False, 'sideways_use_spike': False, 'sideways_rsi_required': False}.
[I 2025-08-31 10:54:26,043] Trial 467 finished with values: [-1000000000.0, 1000000000.0] and parameters: {'p_sma': 7, 'p_std': 14, 'p_atr': 11, 'p_adx': 20, 'rsi_period': 43, 'ema1': 12, 'ema2': 16, 'slip_atr_k': 0.023876347099229762, 'slip_spread_k': 0.8935001735250582, 'spread_hl_frac': 0.039533007311302236, 'bb_std_mult': 1.0928163016169976, 'rsi_os': 49, 'rsi_ob': 76, 'vol_spike': 0.10613398723079642, 'adx_thresh': 24.171877781880887, 'atr_min_pct': 0.004853884123442165, 'atr_max_pct': 0.09942689201664545, 'tp_mult': 2.4165519826227464, 'tsl_mult': 0.7877847560943688, 'strategy': 'breakout', 'time_stop': 29, 'use_sma': False, 'use_atr': False, 'use_adx': True, 'use_ema': True, 'use_spike': False, 'rsi_required': True, 'edge_k': 1.7147776181047445, 'edge_cap': 0.4389164478743034, 'bull_strategy': 'breakout', 'bull_bb_std_mult': 0.7799880609135732, 'bull_rsi_os': 51, 'bull_rsi_ob': 77, 'bull_adx_thresh': 29.12299353171654, 'bull_atr_min_pct': 0.005593467650183763, 'bull_atr_max_pct': 0.08837992455074806, 'bull_tp_mult': 1.7584956480701581, 'bull_tsl_mult': 0.3387580546472269, 'bull_time_stop': 106, 'bull_use_sma': True, 'bull_use_ema': False, 'bull_use_atr': False, 'bull_use_adx': True, 'bull_use_spike': False, 'bull_rsi_required': True, 'bear_strategy': 'mean_reversion', 'bear_bb_std_mult': 1.560016667135086, 'bear_rsi_os': 15, 'bear_rsi_ob': 94, 'bear_adx_thresh': 6.530289057330157, 'bear_atr_min_pct': 0.01264469489896547, 'bear_atr_max_pct': 0.12601761994717056, 'bear_tp_mult': 2.2605630944728468, 'bear_tsl_mult': 0.32097470966448705, 'bear_time_stop': 219, 'bear_use_sma': False, 'bear_use_ema': True, 'bear_use_atr': False, 'bear_use_adx': False, 'bear_use_spike': True, 'bear_rsi_required': False, 'sideways_strategy': 'mean_reversion', 'sideways_bb_std_mult': 1.1807952476962993, 'sideways_rsi_os': 7, 'sideways_rsi_ob': 70, 'sideways_adx_thresh': 9.980378755812437, 'sideways_atr_min_pct': 0.016482171956603706, 'sideways_atr_max_pct': 0.03458676462095585, 'sideways_tp_mult': 2.7238380654957157, 'sideways_tsl_mult': 0.3231868781180266, 'sideways_time_stop': 112, 'sideways_use_sma': False, 'sideways_use_ema': False, 'sideways_use_atr': False, 'sideways_use_adx': False, 'sideways_use_spike': False, 'sideways_rsi_required': False}.
[I 2025-08-31 10:54:26,201] Trial 464 finished with values: [-1000000000.0, 1000000000.0] and parameters: {'p_sma': 43, 'p_std': 30, 'p_atr': 11, 'p_adx': 14, 'rsi_period': 38, 'ema1': 23, 'ema2': 30, 'slip_atr_k': 0.08761075992294534, 'slip_spread_k': 0.7581775739304636, 'spread_hl_frac': 0.004873517905806819, 'bb_std_mult': 2.8189102198413494, 'rsi_os': 49, 'rsi_ob': 60, 'vol_spike': 0.28647076064056354, 'adx_thresh': 23.967748453000052, 'atr_min_pct': 0.022147550487449343, 'atr_max_pct': 0.09716845654647537, 'tp_mult': 2.4930096600845792, 'tsl_mult': 0.23182643635602895, 'strategy': 'breakout', 'time_stop': 78, 'use_sma': True, 'use_atr': False, 'use_adx': True, 'use_ema': True, 'use_spike': True, 'rsi_required': True, 'edge_k': 0.8568893611023273, 'edge_cap': 0.5044907087795806, 'bull_strategy': 'breakout', 'bull_bb_std_mult': 1.0300227960206745, 'bull_rsi_os': 12, 'bull_rsi_ob': 72, 'bull_adx_thresh': 9.671921135432328, 'bull_atr_min_pct': 0.006249862433292596, 'bull_atr_max_pct': 0.0611433603738579, 'bull_tp_mult': 1.7428275000292284, 'bull_tsl_mult': 0.4022548949195134, 'bull_time_stop': 105, 'bull_use_sma': True, 'bull_use_ema': False, 'bull_use_atr': False, 'bull_use_adx': False, 'bull_use_spike': False, 'bull_rsi_required': True, 'bear_strategy': 'breakout', 'bear_bb_std_mult': 2.262333079996717, 'bear_rsi_os': 38, 'bear_rsi_ob': 47, 'bear_adx_thresh': 6.20419983578887, 'bear_atr_min_pct': 0.00725134907842398, 'bear_atr_max_pct': 0.10559092933602152, 'bear_tp_mult': 2.1309889651498755, 'bear_tsl_mult': 0.2870822238806176, 'bear_time_stop': 20, 'bear_use_sma': False, 'bear_use_ema': True, 'bear_use_atr': False, 'bear_use_adx': False, 'bear_use_spike': True, 'bear_rsi_required': False, 'sideways_strategy': 'mean_reversion', 'sideways_bb_std_mult': 2.510222655212731, 'sideways_rsi_os': 7, 'sideways_rsi_ob': 89, 'sideways_adx_thresh': 10.807078487921661, 'sideways_atr_min_pct': 0.013933345296751274, 'sideways_atr_max_pct': 0.11452320724093645, 'sideways_tp_mult': 2.5326547830457358, 'sideways_tsl_mult': 0.3712938555092661, 'sideways_time_stop': 25, 'sideways_use_sma': False, 'sideways_use_ema': False, 'sideways_use_atr': False, 'sideways_use_adx': False, 'sideways_use_spike': False, 'sideways_rsi_required': True}.
[I 2025-08-31 10:54:26,286] Trial 466 finished with values: [-1000000000.0, 1000000000.0] and parameters: {'p_sma': 16, 'p_std': 45, 'p_atr': 9, 'p_adx': 14, 'rsi_period': 29, 'ema1': 30, 'ema2': 20, 'slip_atr_k': 0.005600590824473395, 'slip_spread_k': 0.3552273214870919, 'spread_hl_frac': 0.006803564595064163, 'bb_std_mult': 2.921192008476454, 'rsi_os': 27, 'rsi_ob': 76, 'vol_spike': 0.2828729115368965, 'adx_thresh': 23.94811897729158, 'atr_min_pct': 0.023271228531053404, 'atr_max_pct': 0.023991166449455502, 'tp_mult': 2.420435955127908, 'tsl_mult': 0.7871991154645643, 'strategy': 'breakout', 'time_stop': 30, 'use_sma': False, 'use_atr': False, 'use_adx': True, 'use_ema': True, 'use_spike': False, 'rsi_required': True, 'edge_k': 1.9593769120623938, 'edge_cap': 0.43966334238858057, 'bull_strategy': 'breakout', 'bull_bb_std_mult': 0.9264767280519635, 'bull_rsi_os': 51, 'bull_rsi_ob': 89, 'bull_adx_thresh': 28.982777970543996, 'bull_atr_min_pct': 0.005619077194073814, 'bull_atr_max_pct': 0.060022163583620405, 'bull_tp_mult': 1.7696135473853813, 'bull_tsl_mult': 0.7852701784398288, 'bull_time_stop': 77, 'bull_use_sma': True, 'bull_use_ema': False, 'bull_use_atr': False, 'bull_use_adx': True, 'bull_use_spike': False, 'bull_rsi_required': True, 'bear_strategy': 'breakout', 'bear_bb_std_mult': 1.984087573680316, 'bear_rsi_os': 38, 'bear_rsi_ob': 83, 'bear_adx_thresh': 5.987467258746427, 'bear_atr_min_pct': 0.004571773734484871, 'bear_atr_max_pct': 0.12714813296792854, 'bear_tp_mult': 2.11636810780633, 'bear_tsl_mult': 0.45761862232790357, 'bear_time_stop': 20, 'bear_use_sma': False, 'bear_use_ema': True, 'bear_use_atr': False, 'bear_use_adx': False, 'bear_use_spike': True, 'bear_rsi_required': False, 'sideways_strategy': 'mean_reversion', 'sideways_bb_std_mult': 1.1831441791548485, 'sideways_rsi_os': 7, 'sideways_rsi_ob': 48, 'sideways_adx_thresh': 27.486776590931623, 'sideways_atr_min_pct': 0.014310063799788846, 'sideways_atr_max_pct': 0.1397989511900888, 'sideways_tp_mult': 1.9566205283878437, 'sideways_tsl_mult': 0.17876827239254417, 'sideways_time_stop': 16, 'sideways_use_sma': False, 'sideways_use_ema': False, 'sideways_use_atr': False, 'sideways_use_adx': False, 'sideways_use_spike': False, 'sideways_rsi_required': False}.
