[I 2025-08-31 11:44:35,226] Trial 829 finished with values: [-1000000000.0, 1000000000.0] and parameters: {'p_sma': 15, 'p_std': 13, 'p_atr': 13, 'p_adx': 14, 'rsi_period': 52, 'ema1': 12, 'ema2': 41, 'slip_atr_k': 0.04004821907058555, 'slip_spread_k': 0.13968212037163188, 'spread_hl_frac': 0.005809503619994265, 'bb_std_mult': 2.3654696717343864, 'rsi_os': 34, 'rsi_ob': 92, 'vol_spike': 0.10941519141405255, 'adx_thresh': 30.9130279325427, 'atr_min_pct': 0.014176084824784363, 'atr_max_pct': 0.13102980446425735, 'tp_mult': 1.3924112341518595, 'tsl_mult': 0.09924335763462842, 'strategy': 'breakout', 'time_stop': 193, 'use_sma': False, 'use_atr': True, 'use_adx': False, 'use_ema': True, 'use_spike': False, 'rsi_required': False, 'edge_k': 0.4206629096071532, 'edge_cap': 0.798332035813655, 'bull_strategy': 'mean_reversion', 'bull_bb_std_mult': 0.5755370929803532, 'bull_rsi_os': 25, 'bull_rsi_ob': 84, 'bull_adx_thresh': 5.748148596116561, 'bull_atr_min_pct': 0.014496695564315267, 'bull_atr_max_pct': 0.13433962156363138, 'bull_tp_mult': 2.225166719686648, 'bull_tsl_mult': 0.8356492921569468, 'bull_time_stop': 269, 'bull_use_sma': False, 'bull_use_ema': True, 'bull_use_atr': True, 'bull_use_adx': False, 'bull_use_spike': True, 'bull_rsi_required': True, 'bear_strategy': 'breakout', 'bear_bb_std_mult': 3.363330702547595, 'bear_rsi_os': 46, 'bear_rsi_ob': 69, 'bear_adx_thresh': 5.1067248195890595, 'bear_atr_min_pct': 0.012700865570884519, 'bear_atr_max_pct': 0.021250697732661153, 'bear_tp_mult': 2.9764524037733793, 'bear_tsl_mult': 0.7669010531720796, 'bear_time_stop': 8, 'bear_use_sma': True, 'bear_use_ema': True, 'bear_use_atr': True, 'bear_use_adx': False, 'bear_use_spike': False, 'bear_rsi_required': True, 'sideways_strategy': 'breakout', 'sideways_bb_std_mult': 2.4454565457781507, 'sideways_rsi_os': 21, 'sideways_rsi_ob': 95, 'sideways_adx_thresh': 10.728250889675895, 'sideways_atr_min_pct': 0.016763976726352475, 'sideways_atr_max_pct': 0.04366422951818925, 'sideways_tp_mult': 2.835264375502638, 'sideways_tsl_mult': 0.3998212957049933, 'sideways_time_stop': 57, 'sideways_use_sma': False, 'sideways_use_ema': False, 'sideways_use_atr': True, 'sideways_use_adx': True, 'sideways_use_spike': True, 'sideways_rsi_required': False}.
[I 2025-08-31 11:44:35,408] Trial 828 finished with values: [-1000000000.0, 1000000000.0] and parameters: {'p_sma': 15, 'p_std': 17, 'p_atr': 13, 'p_adx': 8, 'rsi_period': 52, 'ema1': 12, 'ema2': 41, 'slip_atr_k': 0.03028633965780356, 'slip_spread_k': 0.14337447416745605, 'spread_hl_frac': 0.005523871837878617, 'bb_std_mult': 2.380949324157329, 'rsi_os': 34, 'rsi_ob': 92, 'vol_spike': 0.10881154795383116, 'adx_thresh': 7.695982097910127, 'atr_min_pct': 0.013639105260417166, 'atr_max_pct': 0.13017125176263925, 'tp_mult': 1.521839360744017, 'tsl_mult': 0.09767077661044123, 'strategy': 'breakout', 'time_stop': 194, 'use_sma': False, 'use_atr': True, 'use_adx': False, 'use_ema': True, 'use_spike': False, 'rsi_required': False, 'edge_k': 0.4289735942651841, 'edge_cap': 0.953364173074897, 'bull_strategy': 'mean_reversion', 'bull_bb_std_mult': 0.577046955086325, 'bull_rsi_os': 21, 'bull_rsi_ob': 84, 'bull_adx_thresh': 16.468540785541833, 'bull_atr_min_pct': 0.01859906814124126, 'bull_atr_max_pct': 0.10605201676818704, 'bull_tp_mult': 2.254392814589875, 'bull_tsl_mult': 0.8392877488923507, 'bull_time_stop': 261, 'bull_use_sma': False, 'bull_use_ema': True, 'bull_use_atr': True, 'bull_use_adx': False, 'bull_use_spike': True, 'bull_rsi_required': True, 'bear_strategy': 'breakout', 'bear_bb_std_mult': 3.3056740703905003, 'bear_rsi_os': 46, 'bear_rsi_ob': 70, 'bear_adx_thresh': 5.087562071039285, 'bear_atr_min_pct': 0.02058360895324368, 'bear_atr_max_pct': 0.14380024910611358, 'bear_tp_mult': 2.9201563027530226, 'bear_tsl_mult': 0.763089669738795, 'bear_time_stop': 5, 'bear_use_sma': True, 'bear_use_ema': True, 'bear_use_atr': True, 'bear_use_adx': False, 'bear_use_spike': False, 'bear_rsi_required': True, 'sideways_strategy': 'breakout', 'sideways_bb_std_mult': 2.6557788383361656, 'sideways_rsi_os': 20, 'sideways_rsi_ob': 95, 'sideways_adx_thresh': 10.57133883768709, 'sideways_atr_min_pct': 0.0166461134632875, 'sideways_atr_max_pct': 0.044270452258821626, 'sideways_tp_mult': 2.8326841058032026, 'sideways_tsl_mult': 0.40600030773223394, 'sideways_time_stop': 205, 'sideways_use_sma': False, 'sideways_use_ema': False, 'sideways_use_atr': True, 'sideways_use_adx': True, 'sideways_use_spike': True, 'sideways_rsi_required': False}.
[I 2025-08-31 11:45:13,707] Trial 830 finished with values: [-0.029990281759376236, 0.02983847204500018] and parameters: {'p_sma': 16, 'p_std': 14, 'p_atr': 13, 'p_adx': 14, 'rsi_period': 54, 'ema1': 11, 'ema2': 39, 'slip_atr_k': 0.03972080875022889, 'slip_spread_k': 0.13146510732534483, 'spread_hl_frac': 0.0026354832181241725, 'bb_std_mult': 2.457469528319479, 'rsi_os': 34, 'rsi_ob': 92, 'vol_spike': 0.12277184203006368, 'adx_thresh': 16.81278965926873, 'atr_min_pct': 0.014059433232322428, 'atr_max_pct': 0.13736036963328233, 'tp_mult': 1.3873322285614031, 'tsl_mult': 0.09985761503141974, 'strategy': 'breakout', 'time_stop': 192, 'use_sma': True, 'use_atr': True, 'use_adx': False, 'use_ema': True, 'use_spike': True, 'rsi_required': False, 'edge_k': 0.43250321905528, 'edge_cap': 0.9899988247450043, 'bull_strategy': 'mean_reversion', 'bull_bb_std_mult': 0.5765470905754028, 'bull_rsi_os': 25, 'bull_rsi_ob': 84, 'bull_adx_thresh': 27.535987793958277, 'bull_atr_min_pct': 0.0036866824239890727, 'bull_atr_max_pct': 0.05721559943389441, 'bull_tp_mult': 2.570800329060603, 'bull_tsl_mult': 0.836998638042428, 'bull_time_stop': 273, 'bull_use_sma': False, 'bull_use_ema': True, 'bull_use_atr': False, 'bull_use_adx': False, 'bull_use_spike': False, 'bull_rsi_required': True, 'bear_strategy': 'breakout', 'bear_bb_std_mult': 3.2906010619437365, 'bear_rsi_os': 45, 'bear_rsi_ob': 70, 'bear_adx_thresh': 5.49872860359166, 'bear_atr_min_pct': 0.0036617445542634474, 'bear_atr_max_pct': 0.1456700333139861, 'bear_tp_mult': 2.9928582318646453, 'bear_tsl_mult': 0.787814091225501, 'bear_time_stop': 16, 'bear_use_sma': False, 'bear_use_ema': True, 'bear_use_atr': True, 'bear_use_adx': False, 'bear_use_spike': False, 'bear_rsi_required': True, 'sideways_strategy': 'breakout', 'sideways_bb_std_mult': 2.474829893782058, 'sideways_rsi_os': 23, 'sideways_rsi_ob': 95, 'sideways_adx_thresh': 10.84116104302547, 'sideways_atr_min_pct': 0.02420078809188482, 'sideways_atr_max_pct': 0.0438809237518861, 'sideways_tp_mult': 2.838350878548187, 'sideways_tsl_mult': 0.42579742071611926, 'sideways_time_stop': 283, 'sideways_use_sma': False, 'sideways_use_ema': False, 'sideways_use_atr': True, 'sideways_use_adx': False, 'sideways_use_spike': True, 'sideways_rsi_required': True}.
[I 2025-08-31 11:45:14,045] Trial 831 finished with values: [-1000000000.0, 1000000000.0] and parameters: {'p_sma': 31, 'p_std': 28, 'p_atr': 13, 'p_adx': 8, 'rsi_period': 16, 'ema1': 13, 'ema2': 39, 'slip_atr_k': 0.02867494440749716, 'slip_spread_k': 0.15813830441219867, 'spread_hl_frac': 0.004157281241741962, 'bb_std_mult': 2.478752465774604, 'rsi_os': 34, 'rsi_ob': 94, 'vol_spike': 0.11640503306792624, 'adx_thresh': 31.029550967721153, 'atr_min_pct': 0.014094803199984626, 'atr_max_pct': 0.13881888946447868, 'tp_mult': 1.525377094777267, 'tsl_mult': 0.09907691537986202, 'strategy': 'mean_reversion', 'time_stop': 183, 'use_sma': True, 'use_atr': True, 'use_adx': False, 'use_ema': True, 'use_spike': True, 'rsi_required': False, 'edge_k': 0.4421092779000725, 'edge_cap': 0.6915663462089061, 'bull_strategy': 'breakout', 'bull_bb_std_mult': 0.588587883886384, 'bull_rsi_os': 27, 'bull_rsi_ob': 85, 'bull_adx_thresh': 10.345834359949237, 'bull_atr_min_pct': 0.003591309285165357, 'bull_atr_max_pct': 0.0976666063404438, 'bull_tp_mult': 2.7288305202481333, 'bull_tsl_mult': 0.7797345466469858, 'bull_time_stop': 270, 'bull_use_sma': False, 'bull_use_ema': True, 'bull_use_atr': False, 'bull_use_adx': False, 'bull_use_spike': False, 'bull_rsi_required': True, 'bear_strategy': 'mean_reversion', 'bear_bb_std_mult': 3.270755023279244, 'bear_rsi_os': 45, 'bear_rsi_ob': 70, 'bear_adx_thresh': 5.038052500500127, 'bear_atr_min_pct': 0.012479695796852217, 'bear_atr_max_pct': 0.0392542173370001, 'bear_tp_mult': 2.9121855749339898, 'bear_tsl_mult': 0.7901939463097266, 'bear_time_stop': 17, 'bear_use_sma': False, 'bear_use_ema': True, 'bear_use_atr': False, 'bear_use_adx': False, 'bear_use_spike': False, 'bear_rsi_required': True, 'sideways_strategy': 'breakout', 'sideways_bb_std_mult': 2.606353070329902, 'sideways_rsi_os': 23, 'sideways_rsi_ob': 95, 'sideways_adx_thresh': 11.273230123343453, 'sideways_atr_min_pct': 0.016478359574828617, 'sideways_atr_max_pct': 0.04352965486751045, 'sideways_tp_mult': 2.864153728497525, 'sideways_tsl_mult': 0.43188805186541596, 'sideways_time_stop': 19, 'sideways_use_sma': True, 'sideways_use_ema': False, 'sideways_use_atr': True, 'sideways_use_adx': False, 'sideways_use_spike': True, 'sideways_rsi_required': True}.
[I 2025-08-31 11:45:14,073] Trial 832 finished with values: [-1000000000.0, 1000000000.0] and parameters: {'p_sma': 13, 'p_std': 27, 'p_atr': 13, 'p_adx': 14, 'rsi_period': 33, 'ema1': 10, 'ema2': 42, 'slip_atr_k': 0.02923193878841823, 'slip_spread_k': 0.15808855470257166, 'spread_hl_frac': 0.003856464393997884, 'bb_std_mult': 2.4713496657790297, 'rsi_os': 31, 'rsi_ob': 94, 'vol_spike': 0.12319535415747666, 'adx_thresh': 34.9845552139372, 'atr_min_pct': 0.01338165790869366, 'atr_max_pct': 0.13867392125275682, 'tp_mult': 1.531195308345143, 'tsl_mult': 0.1378249683192862, 'strategy': 'mean_reversion', 'time_stop': 183, 'use_sma': True, 'use_atr': True, 'use_adx': False, 'use_ema': False, 'use_spike': True, 'rsi_required': False, 'edge_k': 0.4568939165878399, 'edge_cap': 0.8968898722313104, 'bull_strategy': 'breakout', 'bull_bb_std_mult': 0.5846973780570768, 'bull_rsi_os': 27, 'bull_rsi_ob': 82, 'bull_adx_thresh': 21.443892337155535, 'bull_atr_min_pct': 0.029968864171554022, 'bull_atr_max_pct': 0.09811454034266742, 'bull_tp_mult': 2.573669391872347, 'bull_tsl_mult': 0.7957404507871094, 'bull_time_stop': 272, 'bull_use_sma': False, 'bull_use_ema': True, 'bull_use_atr': False, 'bull_use_adx': False, 'bull_use_spike': False, 'bull_rsi_required': False, 'bear_strategy': 'mean_reversion', 'bear_bb_std_mult': 3.2849583166956626, 'bear_rsi_os': 45, 'bear_rsi_ob': 70, 'bear_adx_thresh': 5.062576401076124, 'bear_atr_min_pct': 0.004465742848817185, 'bear_atr_max_pct': 0.1469075307908825, 'bear_tp_mult': 2.9385964560872186, 'bear_tsl_mult': 0.7895744047768439, 'bear_time_stop': 17, 'bear_use_sma': False, 'bear_use_ema': True, 'bear_use_atr': False, 'bear_use_adx': True, 'bear_use_spike': False, 'bear_rsi_required': True, 'sideways_strategy': 'breakout', 'sideways_bb_std_mult': 2.565967662965468, 'sideways_rsi_os': 23, 'sideways_rsi_ob': 95, 'sideways_adx_thresh': 11.384469326172935, 'sideways_atr_min_pct': 0.010736352747728379, 'sideways_atr_max_pct': 0.043521615326280405, 'sideways_tp_mult': 2.9490606039118723, 'sideways_tsl_mult': 0.446199835017088, 'sideways_time_stop': 149, 'sideways_use_sma': True, 'sideways_use_ema': True, 'sideways_use_atr': True, 'sideways_use_adx': False, 'sideways_use_spike': True, 'sideways_rsi_required': True}.
[I 2025-08-31 11:45:14,266] Trial 833 finished with values: [-1000000000.0, 1000000000.0] and parameters: {'p_sma': 13, 'p_std': 27, 'p_atr': 13, 'p_adx': 14, 'rsi_period': 33, 'ema1': 13, 'ema2': 42, 'slip_atr_k': 0.19473297019143876, 'slip_spread_k': 0.1653846637831739, 'spread_hl_frac': 0.0028853388809020153, 'bb_std_mult': 2.4432115797651823, 'rsi_os': 32, 'rsi_ob': 94, 'vol_spike': 0.12163996447969179, 'adx_thresh': 30.153926943279636, 'atr_min_pct': 0.013325700510595753, 'atr_max_pct': 0.1376875537106567, 'tp_mult': 1.4899931077938378, 'tsl_mult': 0.09570491758788963, 'strategy': 'mean_reversion', 'time_stop': 183, 'use_sma': True, 'use_atr': True, 'use_adx': False, 'use_ema': False, 'use_spike': True, 'rsi_required': False, 'edge_k': 0.46599106980496696, 'edge_cap': 0.6908553785213283, 'bull_strategy': 'breakout', 'bull_bb_std_mult': 0.582720244278182, 'bull_rsi_os': 24, 'bull_rsi_ob': 46, 'bull_adx_thresh': 27.5837416538001, 'bull_atr_min_pct': 0.003588256447584203, 'bull_atr_max_pct': 0.09772239990129414, 'bull_tp_mult': 2.9985199008870596, 'bull_tsl_mult': 0.7969973985616252, 'bull_time_stop': 270, 'bull_use_sma': False, 'bull_use_ema': True, 'bull_use_atr': False, 'bull_use_adx': False, 'bull_use_spike': False, 'bull_rsi_required': False, 'bear_strategy': 'mean_reversion', 'bear_bb_std_mult': 3.438385726322796, 'bear_rsi_os': 48, 'bear_rsi_ob': 71, 'bear_adx_thresh': 5.498068483790238, 'bear_atr_min_pct': 0.016200328924874538, 'bear_atr_max_pct': 0.13780353643215287, 'bear_tp_mult': 2.9134240535002247, 'bear_tsl_mult': 0.7971996784175102, 'bear_time_stop': 15, 'bear_use_sma': False, 'bear_use_ema': False, 'bear_use_atr': False, 'bear_use_adx': True, 'bear_use_spike': False, 'bear_rsi_required': True, 'sideways_strategy': 'breakout', 'sideways_bb_std_mult': 2.5847197798479478, 'sideways_rsi_os': 23, 'sideways_rsi_ob': 95, 'sideways_adx_thresh': 11.494109727368905, 'sideways_atr_min_pct': 0.008218073451367068, 'sideways_atr_max_pct': 0.04462763347673093, 'sideways_tp_mult': 2.9456922086317503, 'sideways_tsl_mult': 0.43393878312958345, 'sideways_time_stop': 300, 'sideways_use_sma': True, 'sideways_use_ema': True, 'sideways_use_atr': True, 'sideways_use_adx': False, 'sideways_use_spike': True, 'sideways_rsi_required': True}.
[I 2025-08-31 11:45:51,939] Trial 837 finished with values: [-0.058595289091256886, 0.058820704058709795] and parameters: {'p_sma': 36, 'p_std': 30, 'p_atr': 13, 'p_adx': 13, 'rsi_period': 22, 'ema1': 11, 'ema2': 40, 'slip_atr_k': 0.025420343775046414, 'slip_spread_k': 0.1815244882134681, 'spread_hl_frac': 0.006546924764382717, 'bb_std_mult': 2.223758314491233, 'rsi_os': 31, 'rsi_ob': 93, 'vol_spike': 0.11614562258075346, 'adx_thresh': 14.880478452961032, 'atr_min_pct': 0.012976419346490155, 'atr_max_pct': 0.13559199948639586, 'tp_mult': 1.469882556886192, 'tsl_mult': 0.13609922855376583, 'strategy': 'breakout', 'time_stop': 192, 'use_sma': True, 'use_atr': True, 'use_adx': False, 'use_ema': True, 'use_spike': True, 'rsi_required': False, 'edge_k': 0.48628327475824656, 'edge_cap': 0.9151742553425419, 'bull_strategy': 'breakout', 'bull_bb_std_mult': 0.5140728202694769, 'bull_rsi_os': 23, 'bull_rsi_ob': 82, 'bull_adx_thresh': 29.92232156446243, 'bull_atr_min_pct': 0.002990585632036834, 'bull_atr_max_pct': 0.028688947663929328, 'bull_tp_mult': 2.6354761495539836, 'bull_tsl_mult': 0.819304785156688, 'bull_time_stop': 252, 'bull_use_sma': False, 'bull_use_ema': True, 'bull_use_atr': False, 'bull_use_adx': True, 'bull_use_spike': False, 'bull_rsi_required': True, 'bear_strategy': 'breakout', 'bear_bb_std_mult': 3.5117547769466877, 'bear_rsi_os': 47, 'bear_rsi_ob': 71, 'bear_adx_thresh': 5.014859993868649, 'bear_atr_min_pct': 0.0030765985434580557, 'bear_atr_max_pct': 0.13874620356882553, 'bear_tp_mult': 2.8863044910151303, 'bear_tsl_mult': 0.8189888320016598, 'bear_time_stop': 14, 'bear_use_sma': False, 'bear_use_ema': False, 'bear_use_atr': False, 'bear_use_adx': False, 'bear_use_spike': False, 'bear_rsi_required': True, 'sideways_strategy': 'breakout', 'sideways_bb_std_mult': 2.644536862631, 'sideways_rsi_os': 24, 'sideways_rsi_ob': 94, 'sideways_adx_thresh': 12.276869376799969, 'sideways_atr_min_pct': 0.015987578645645702, 'sideways_atr_max_pct': 0.0757001482759877, 'sideways_tp_mult': 2.997002705793783, 'sideways_tsl_mult': 0.39731026315388085, 'sideways_time_stop': 132, 'sideways_use_sma': False, 'sideways_use_ema': False, 'sideways_use_atr': True, 'sideways_use_adx': False, 'sideways_use_spike': True, 'sideways_rsi_required': True}.
[I 2025-08-31 11:45:52,471] Trial 834 finished with values: [-1000000000.0, 1000000000.0] and parameters: {'p_sma': 13, 'p_std': 10, 'p_atr': 13, 'p_adx': 14, 'rsi_period': 20, 'ema1': 10, 'ema2': 42, 'slip_atr_k': 0.027714282656575794, 'slip_spread_k': 0.17148635998926706, 'spread_hl_frac': 0.003747293094459561, 'bb_std_mult': 2.225257181517224, 'rsi_os': 31, 'rsi_ob': 94, 'vol_spike': 0.11544571139505602, 'adx_thresh': 30.9592147123298, 'atr_min_pct': 0.013231079757975977, 'atr_max_pct': 0.13832141687834595, 'tp_mult': 1.4884662716149573, 'tsl_mult': 0.1555890687783062, 'strategy': 'mean_reversion', 'time_stop': 179, 'use_sma': True, 'use_atr': True, 'use_adx': False, 'use_ema': False, 'use_spike': True, 'rsi_required': False, 'edge_k': 0.4800756909808569, 'edge_cap': 0.6750360808374204, 'bull_strategy': 'breakout', 'bull_bb_std_mult': 0.5965834607140541, 'bull_rsi_os': 27, 'bull_rsi_ob': 82, 'bull_adx_thresh': 29.99665775388128, 'bull_atr_min_pct': 0.003017393993630513, 'bull_atr_max_pct': 0.03755264948833163, 'bull_tp_mult': 2.7172379774822106, 'bull_tsl_mult': 0.7796102839121488, 'bull_time_stop': 277, 'bull_use_sma': False, 'bull_use_ema': True, 'bull_use_atr': False, 'bull_use_adx': False, 'bull_use_spike': False, 'bull_rsi_required': False, 'bear_strategy': 'mean_reversion', 'bear_bb_std_mult': 3.426307543012747, 'bear_rsi_os': 48, 'bear_rsi_ob': 71, 'bear_adx_thresh': 5.111568022360238, 'bear_atr_min_pct': 0.00430529933705559, 'bear_atr_max_pct': 0.13776944869411345, 'bear_tp_mult': 2.909517336356668, 'bear_tsl_mult': 0.7909805063130787, 'bear_time_stop': 16, 'bear_use_sma': False, 'bear_use_ema': False, 'bear_use_atr': False, 'bear_use_adx': True, 'bear_use_spike': False, 'bear_rsi_required': True, 'sideways_strategy': 'breakout', 'sideways_bb_std_mult': 2.5735853573365706, 'sideways_rsi_os': 24, 'sideways_rsi_ob': 95, 'sideways_adx_thresh': 11.454767777383484, 'sideways_atr_min_pct': 0.015930589123137863, 'sideways_atr_max_pct': 0.052070575320155174, 'sideways_tp_mult': 2.9981049919915335, 'sideways_tsl_mult': 0.439158172829367, 'sideways_time_stop': 18, 'sideways_use_sma': True, 'sideways_use_ema': True, 'sideways_use_atr': True, 'sideways_use_adx': False, 'sideways_use_spike': True, 'sideways_rsi_required': True}.
[I 2025-08-31 11:45:52,784] Trial 836 finished with values: [-0.04410929009755504, 0.04389428872489773] and parameters: {'p_sma': 37, 'p_std': 42, 'p_atr': 13, 'p_adx': 13, 'rsi_period': 29, 'ema1': 11, 'ema2': 42, 'slip_atr_k': 0.20191925502034802, 'slip_spread_k': 0.184340296554994, 'spread_hl_frac': 0.006107263573215553, 'bb_std_mult': 2.2301776909863076, 'rsi_os': 31, 'rsi_ob': 93, 'vol_spike': 0.11725967891389191, 'adx_thresh': 30.05144491071488, 'atr_min_pct': 0.013334500402723493, 'atr_max_pct': 0.13555747863238995, 'tp_mult': 1.476975441312532, 'tsl_mult': 0.1325832649184851, 'strategy': 'breakout', 'time_stop': 177, 'use_sma': True, 'use_atr': True, 'use_adx': False, 'use_ema': False, 'use_spike': True, 'rsi_required': False, 'edge_k': 0.4846566395297252, 'edge_cap': 0.9179863958880599, 'bull_strategy': 'breakout', 'bull_bb_std_mult': 0.5658509250091655, 'bull_rsi_os': 24, 'bull_rsi_ob': 81, 'bull_adx_thresh': 6.288170478887352, 'bull_atr_min_pct': 0.004043740370140835, 'bull_atr_max_pct': 0.10024887752595249, 'bull_tp_mult': 2.287493997848793, 'bull_tsl_mult': 0.816371212903451, 'bull_time_stop': 278, 'bull_use_sma': False, 'bull_use_ema': True, 'bull_use_atr': False, 'bull_use_adx': False, 'bull_use_spike': False, 'bull_rsi_required': False, 'bear_strategy': 'breakout', 'bear_bb_std_mult': 3.4745043864731664, 'bear_rsi_os': 48, 'bear_rsi_ob': 71, 'bear_adx_thresh': 5.562777917827271, 'bear_atr_min_pct': 0.004423004374545692, 'bear_atr_max_pct': 0.13958299622309253, 'bear_tp_mult': 2.9114252558348364, 'bear_tsl_mult': 0.8072796423014209, 'bear_time_stop': 12, 'bear_use_sma': False, 'bear_use_ema': False, 'bear_use_atr': False, 'bear_use_adx': True, 'bear_use_spike': False, 'bear_rsi_required': True, 'sideways_strategy': 'breakout', 'sideways_bb_std_mult': 2.6657672851780823, 'sideways_rsi_os': 24, 'sideways_rsi_ob': 95, 'sideways_adx_thresh': 12.301148296381458, 'sideways_atr_min_pct': 0.02983155445014622, 'sideways_atr_max_pct': 0.046091947213193374, 'sideways_tp_mult': 2.8921261712831665, 'sideways_tsl_mult': 0.39783082396992964, 'sideways_time_stop': 250, 'sideways_use_sma': False, 'sideways_use_ema': True, 'sideways_use_atr': True, 'sideways_use_adx': False, 'sideways_use_spike': True, 'sideways_rsi_required': True}.
