[I 2025-08-31 10:10:12,997] Trial 125 finished with values: [-1000000000.0, 1000000000.0] and parameters: {'p_sma': 59, 'p_std': 53, 'p_atr': 10, 'p_adx': 15, 'rsi_period': 52, 'ema1': 16, 'ema2': 54, 'slip_atr_k': 0.005558946560545272, 'slip_spread_k': 0.7013219562318356, 'spread_hl_frac': 0.012859287357694031, 'bb_std_mult': 3.1252176258396425, 'rsi_os': 31, 'rsi_ob': 71, 'vol_spike': 0.13138999966488052, 'adx_thresh': 30.63604539757021, 'atr_min_pct': 0.02306480606149408, 'atr_max_pct': 0.13326170458014325, 'tp_mult': 1.187594385052943, 'tsl_mult': 0.7482813827634202, 'strategy': 'mean_reversion', 'time_stop': 192, 'use_sma': False, 'use_atr': True, 'use_adx': False, 'use_ema': True, 'use_spike': False, 'rsi_required': False, 'edge_k': 0.1155827082418498, 'edge_cap': 0.8273181196277577, 'bull_strategy': 'mean_reversion', 'bull_bb_std_mult': 0.7553429561564253, 'bull_rsi_os': 20, 'bull_rsi_ob': 81, 'bull_adx_thresh': 12.809630532922995, 'bull_atr_min_pct': 0.022804260299898415, 'bull_atr_max_pct': 0.09735223849437441, 'bull_tp_mult': 2.6500042202152816, 'bull_tsl_mult': 0.15746388902607367, 'bull_time_stop': 225, 'bull_use_sma': False, 'bull_use_ema': True, 'bull_use_atr': False, 'bull_use_adx': False, 'bull_use_spike': True, 'bull_rsi_required': True, 'bear_strategy': 'mean_reversion', 'bear_bb_std_mult': 1.280962760422689, 'bear_rsi_os': 49, 'bear_rsi_ob': 67, 'bear_adx_thresh': 8.470736481833804, 'bear_atr_min_pct': 0.01026638898413948, 'bear_atr_max_pct': 0.07706030888370625, 'bear_tp_mult': 2.7433765736413505, 'bear_tsl_mult': 0.14631637332471392, 'bear_time_stop': 72, 'bear_use_sma': True, 'bear_use_ema': False, 'bear_use_atr': True, 'bear_use_adx': False, 'bear_use_spike': False, 'bear_rsi_required': True, 'sideways_strategy': 'breakout', 'sideways_bb_std_mult': 2.752707315530032, 'sideways_rsi_os': 24, 'sideways_rsi_ob': 75, 'sideways_adx_thresh': 11.67595250856695, 'sideways_atr_min_pct': 0.013222299613245099, 'sideways_atr_max_pct': 0.1262790883966461, 'sideways_tp_mult': 2.9863342039942395, 'sideways_tsl_mult': 0.02240705928694181, 'sideways_time_stop': 255, 'sideways_use_sma': True, 'sideways_use_ema': True, 'sideways_use_atr': True, 'sideways_use_adx': True, 'sideways_use_spike': True, 'sideways_rsi_required': True}.
[I 2025-08-31 10:10:45,349] Trial 128 finished with values: [-0.023546635413787986, 0.023372441573535768] and parameters: {'p_sma': 34, 'p_std': 33, 'p_atr': 22, 'p_adx': 28, 'rsi_period': 26, 'ema1': 23, 'ema2': 54, 'slip_atr_k': 0.24068242740297296, 'slip_spread_k': 0.9685555367366299, 'spread_hl_frac': 0.012862530479968387, 'bb_std_mult': 3.0858576194102243, 'rsi_os': 44, 'rsi_ob': 71, 'vol_spike': 0.13269177078943356, 'adx_thresh': 33.43814228365347, 'atr_min_pct': 0.01241664745495474, 'atr_max_pct': 0.13713493924314457, 'tp_mult': 2.2523159245927196, 'tsl_mult': 0.2636397056309862, 'strategy': 'mean_reversion', 'time_stop': 204, 'use_sma': False, 'use_atr': True, 'use_adx': False, 'use_ema': True, 'use_spike': False, 'rsi_required': False, 'edge_k': 0.11180951877405772, 'edge_cap': 0.792981518861821, 'bull_strategy': 'breakout', 'bull_bb_std_mult': 2.704252962512668, 'bull_rsi_os': 22, 'bull_rsi_ob': 80, 'bull_adx_thresh': 13.125046214894933, 'bull_atr_min_pct': 1.3902719691551895e-05, 'bull_atr_max_pct': 0.05424437514020076, 'bull_tp_mult': 2.6734745132084337, 'bull_tsl_mult': 0.779079381935362, 'bull_time_stop': 207, 'bull_use_sma': False, 'bull_use_ema': True, 'bull_use_atr': True, 'bull_use_adx': False, 'bull_use_spike': True, 'bull_rsi_required': True, 'bear_strategy': 'breakout', 'bear_bb_std_mult': 1.5686998659295401, 'bear_rsi_os': 44, 'bear_rsi_ob': 66, 'bear_adx_thresh': 9.955707933204744, 'bear_atr_min_pct': 0.010958019533644234, 'bear_atr_max_pct': 0.0540224472586946, 'bear_tp_mult': 2.9480963292685685, 'bear_tsl_mult': 0.12166917352873632, 'bear_time_stop': 119, 'bear_use_sma': True, 'bear_use_ema': False, 'bear_use_atr': True, 'bear_use_adx': False, 'bear_use_spike': False, 'bear_rsi_required': True, 'sideways_strategy': 'breakout', 'sideways_bb_std_mult': 2.453282040339578, 'sideways_rsi_os': 20, 'sideways_rsi_ob': 88, 'sideways_adx_thresh': 24.346199019872433, 'sideways_atr_min_pct': 0.01436063590127742, 'sideways_atr_max_pct': 0.12555453159258126, 'sideways_tp_mult': 2.426262974283986, 'sideways_tsl_mult': 0.0036962724680853357, 'sideways_time_stop': 228, 'sideways_use_sma': True, 'sideways_use_ema': True, 'sideways_use_atr': True, 'sideways_use_adx': True, 'sideways_use_spike': True, 'sideways_rsi_required': True}.
[I 2025-08-31 10:10:45,446] Trial 129 finished with values: [-0.013096907998875196, 0.012963073076128906] and parameters: {'p_sma': 59, 'p_std': 50, 'p_atr': 20, 'p_adx': 28, 'rsi_period': 46, 'ema1': 23, 'ema2': 56, 'slip_atr_k': 0.03839388292159687, 'slip_spread_k': 0.3489464598683549, 'spread_hl_frac': 0.014559970424862316, 'bb_std_mult': 2.9836788083796226, 'rsi_os': 26, 'rsi_ob': 71, 'vol_spike': 0.2555528223014275, 'adx_thresh': 31.61017996490659, 'atr_min_pct': 0.01225151197947296, 'atr_max_pct': 0.13245189164757187, 'tp_mult': 1.9854246475562851, 'tsl_mult': 0.6505417600865786, 'strategy': 'mean_reversion', 'time_stop': 209, 'use_sma': False, 'use_atr': True, 'use_adx': False, 'use_ema': True, 'use_spike': False, 'rsi_required': False, 'edge_k': 0.21078519856557648, 'edge_cap': 0.833511362846651, 'bull_strategy': 'breakout', 'bull_bb_std_mult': 3.543548559366728, 'bull_rsi_os': 23, 'bull_rsi_ob': 91, 'bull_adx_thresh': 10.206230825891057, 'bull_atr_min_pct': 0.0019530039890521822, 'bull_atr_max_pct': 0.045978956842511506, 'bull_tp_mult': 2.6810820137299234, 'bull_tsl_mult': 0.7638407824650245, 'bull_time_stop': 8, 'bull_use_sma': True, 'bull_use_ema': True, 'bull_use_atr': False, 'bull_use_adx': False, 'bull_use_spike': True, 'bull_rsi_required': True, 'bear_strategy': 'breakout', 'bear_bb_std_mult': 1.5835036948864207, 'bear_rsi_os': 43, 'bear_rsi_ob': 77, 'bear_adx_thresh': 21.629986422448283, 'bear_atr_min_pct': 0.012181577372144523, 'bear_atr_max_pct': 0.07431245574928347, 'bear_tp_mult': 2.961088628337565, 'bear_tsl_mult': 0.03848340330617239, 'bear_time_stop': 60, 'bear_use_sma': True, 'bear_use_ema': False, 'bear_use_atr': False, 'bear_use_adx': False, 'bear_use_spike': False, 'bear_rsi_required': True, 'sideways_strategy': 'breakout', 'sideways_bb_std_mult': 2.51257301254214, 'sideways_rsi_os': 20, 'sideways_rsi_ob': 81, 'sideways_adx_thresh': 8.125584356133679, 'sideways_atr_min_pct': 0.010007582260565369, 'sideways_atr_max_pct': 0.12553061711413985, 'sideways_tp_mult': 1.9867200922169566, 'sideways_tsl_mult': 0.7546800282569741, 'sideways_time_stop': 228, 'sideways_use_sma': True, 'sideways_use_ema': True, 'sideways_use_atr': True, 'sideways_use_adx': True, 'sideways_use_spike': True, 'sideways_rsi_required': True}.
[I 2025-08-31 10:10:45,730] Trial 130 finished with values: [-0.014561697395837125, 0.014418934589143824] and parameters: {'p_sma': 59, 'p_std': 50, 'p_atr': 20, 'p_adx': 28, 'rsi_period': 19, 'ema1': 27, 'ema2': 56, 'slip_atr_k': 0.03767007624852357, 'slip_spread_k': 0.6535964561684187, 'spread_hl_frac': 0.014304037338997272, 'bb_std_mult': 2.9531063339321033, 'rsi_os': 26, 'rsi_ob': 66, 'vol_spike': 0.1571044369961472, 'adx_thresh': 24.82497515514816, 'atr_min_pct': 0.01224748779032766, 'atr_max_pct': 0.13712947073499157, 'tp_mult': 1.7026007993550671, 'tsl_mult': 0.6483336937160274, 'strategy': 'breakout', 'time_stop': 204, 'use_sma': False, 'use_atr': True, 'use_adx': False, 'use_ema': True, 'use_spike': True, 'rsi_required': False, 'edge_k': 0.21349661844985818, 'edge_cap': 0.8133245738163203, 'bull_strategy': 'breakout', 'bull_bb_std_mult': 2.8548051392103813, 'bull_rsi_os': 23, 'bull_rsi_ob': 91, 'bull_adx_thresh': 10.216502362827777, 'bull_atr_min_pct': 7.497571362142033e-06, 'bull_atr_max_pct': 0.04754165509144131, 'bull_tp_mult': 2.871797250288822, 'bull_tsl_mult': 0.7655318041434086, 'bull_time_stop': 55, 'bull_use_sma': True, 'bull_use_ema': True, 'bull_use_atr': True, 'bull_use_adx': False, 'bull_use_spike': True, 'bull_rsi_required': True, 'bear_strategy': 'breakout', 'bear_bb_std_mult': 1.1709511711898675, 'bear_rsi_os': 42, 'bear_rsi_ob': 95, 'bear_adx_thresh': 19.761507842795304, 'bear_atr_min_pct': 0.012219016773435717, 'bear_atr_max_pct': 0.05305423503509861, 'bear_tp_mult': 2.9556295107757937, 'bear_tsl_mult': 0.11734405598374857, 'bear_time_stop': 62, 'bear_use_sma': False, 'bear_use_ema': False, 'bear_use_atr': False, 'bear_use_adx': False, 'bear_use_spike': True, 'bear_rsi_required': True, 'sideways_strategy': 'breakout', 'sideways_bb_std_mult': 2.4550147403598626, 'sideways_rsi_os': 20, 'sideways_rsi_ob': 88, 'sideways_adx_thresh': 24.151374158429128, 'sideways_atr_min_pct': 0.00992308036202492, 'sideways_atr_max_pct': 0.10148343606705917, 'sideways_tp_mult': 1.9828048514045986, 'sideways_tsl_mult': 0.05988094847699158, 'sideways_time_stop': 226, 'sideways_use_sma': False, 'sideways_use_ema': True, 'sideways_use_atr': False, 'sideways_use_adx': True, 'sideways_use_spike': True, 'sideways_rsi_required': True}.
[I 2025-08-31 10:10:45,731] Trial 127 finished with values: [-1000000000.0, 1000000000.0] and parameters: {'p_sma': 59, 'p_std': 50, 'p_atr': 12, 'p_adx': 28, 'rsi_period': 13, 'ema1': 23, 'ema2': 29, 'slip_atr_k': 0.21711327709128828, 'slip_spread_k': 0.8464485658234534, 'spread_hl_frac': 0.02672837842959666, 'bb_std_mult': 3.3031770194282997, 'rsi_os': 49, 'rsi_ob': 71, 'vol_spike': 0.25975403916607004, 'adx_thresh': 31.671278720472234, 'atr_min_pct': 0.018597478615359746, 'atr_max_pct': 0.13795616720117668, 'tp_mult': 2.397399165017481, 'tsl_mult': 0.2544308986667969, 'strategy': 'mean_reversion', 'time_stop': 285, 'use_sma': False, 'use_atr': True, 'use_adx': False, 'use_ema': True, 'use_spike': False, 'rsi_required': False, 'edge_k': 0.12054625352139725, 'edge_cap': 0.8207588836685464, 'bull_strategy': 'breakout', 'bull_bb_std_mult': 2.841470285663978, 'bull_rsi_os': 23, 'bull_rsi_ob': 92, 'bull_adx_thresh': 12.729401141113579, 'bull_atr_min_pct': 0.016524708215519192, 'bull_atr_max_pct': 0.05491820790833085, 'bull_tp_mult': 2.6594778203908094, 'bull_tsl_mult': 0.7741375873516652, 'bull_time_stop': 202, 'bull_use_sma': True, 'bull_use_ema': True, 'bull_use_atr': False, 'bull_use_adx': False, 'bull_use_spike': True, 'bull_rsi_required': True, 'bear_strategy': 'mean_reversion', 'bear_bb_std_mult': 0.9651880704653706, 'bear_rsi_os': 42, 'bear_rsi_ob': 67, 'bear_adx_thresh': 25.148605036288863, 'bear_atr_min_pct': 0.010209041641595588, 'bear_atr_max_pct': 0.07710236390836145, 'bear_tp_mult': 2.9611631773836686, 'bear_tsl_mult': 0.06412534439648387, 'bear_time_stop': 61, 'bear_use_sma': True, 'bear_use_ema': False, 'bear_use_atr': False, 'bear_use_adx': False, 'bear_use_spike': False, 'bear_rsi_required': True, 'sideways_strategy': 'breakout', 'sideways_bb_std_mult': 2.5209946773144707, 'sideways_rsi_os': 24, 'sideways_rsi_ob': 75, 'sideways_adx_thresh': 12.489072544879232, 'sideways_atr_min_pct': 0.014857560976946897, 'sideways_atr_max_pct': 0.1084972917176763, 'sideways_tp_mult': 2.964624999469022, 'sideways_tsl_mult': 0.05885841709634804, 'sideways_time_stop': 240, 'sideways_use_sma': True, 'sideways_use_ema': True, 'sideways_use_atr': True, 'sideways_use_adx': True, 'sideways_use_spike': True, 'sideways_rsi_required': True}.
[I 2025-08-31 10:11:18,148] Trial 131 finished with values: [-0.01258558985124969, 0.0124662385093326] and parameters: {'p_sma': 53, 'p_std': 50, 'p_atr': 27, 'p_adx': 14, 'rsi_period': 46, 'ema1': 14, 'ema2': 56, 'slip_atr_k': 0.03826050987296911, 'slip_spread_k': 0.652960025599192, 'spread_hl_frac': 0.014018972703998493, 'bb_std_mult': 2.9932539926094446, 'rsi_os': 48, 'rsi_ob': 73, 'vol_spike': 0.12442737849862621, 'adx_thresh': 29.161096493432336, 'atr_min_pct': 0.005814064481022658, 'atr_max_pct': 0.10580323602132644, 'tp_mult': 2.5730416812625654, 'tsl_mult': 0.8286116438249833, 'strategy': 'breakout', 'time_stop': 259, 'use_sma': False, 'use_atr': True, 'use_adx': False, 'use_ema': True, 'use_spike': True, 'rsi_required': False, 'edge_k': 0.21633433052041057, 'edge_cap': 0.8144123756782196, 'bull_strategy': 'breakout', 'bull_bb_std_mult': 1.0105250305036628, 'bull_rsi_os': 42, 'bull_rsi_ob': 72, 'bull_adx_thresh': 23.799613172161244, 'bull_atr_min_pct': 0.0019810283660803936, 'bull_atr_max_pct': 0.043951597105973524, 'bull_tp_mult': 2.8684912477140068, 'bull_tsl_mult': 0.25255684667905587, 'bull_time_stop': 57, 'bull_use_sma': True, 'bull_use_ema': True, 'bull_use_atr': True, 'bull_use_adx': False, 'bull_use_spike': True, 'bull_rsi_required': True, 'bear_strategy': 'breakout', 'bear_bb_std_mult': 1.0987238036487175, 'bear_rsi_os': 47, 'bear_rsi_ob': 77, 'bear_adx_thresh': 12.308281744068712, 'bear_atr_min_pct': 0.012936920847762807, 'bear_atr_max_pct': 0.07376357381954014, 'bear_tp_mult': 2.80970317524642, 'bear_tsl_mult': 0.06696931097237241, 'bear_time_stop': 62, 'bear_use_sma': False, 'bear_use_ema': False, 'bear_use_atr': False, 'bear_use_adx': False, 'bear_use_spike': True, 'bear_rsi_required': True, 'sideways_strategy': 'breakout', 'sideways_bb_std_mult': 2.5257909841294954, 'sideways_rsi_os': 19, 'sideways_rsi_ob': 81, 'sideways_adx_thresh': 26.37620036920807, 'sideways_atr_min_pct': 0.018194152457272742, 'sideways_atr_max_pct': 0.1015146129890414, 'sideways_tp_mult': 2.693482348641835, 'sideways_tsl_mult': 0.05854780524567897, 'sideways_time_stop': 263, 'sideways_use_sma': False, 'sideways_use_ema': True, 'sideways_use_atr': False, 'sideways_use_adx': True, 'sideways_use_spike': True, 'sideways_rsi_required': True}.
[I 2025-08-31 10:11:18,282] Trial 134 finished with values: [-1000000000.0, 1000000000.0] and parameters: {'p_sma': 54, 'p_std': 56, 'p_atr': 27, 'p_adx': 27, 'rsi_period': 20, 'ema1': 27, 'ema2': 56, 'slip_atr_k': 0.0368973643324734, 'slip_spread_k': 0.6313576806331019, 'spread_hl_frac': 0.014260707846191992, 'bb_std_mult': 2.974803318599619, 'rsi_os': 29, 'rsi_ob': 73, 'vol_spike': 0.1568249726436716, 'adx_thresh': 29.175786134315057, 'atr_min_pct': 0.010627254712483752, 'atr_max_pct': 0.07121276932447795, 'tp_mult': 2.5573576465191725, 'tsl_mult': 0.6572978378129799, 'strategy': 'breakout', 'time_stop': 203, 'use_sma': False, 'use_atr': True, 'use_adx': False, 'use_ema': False, 'use_spike': True, 'rsi_required': False, 'edge_k': 0.19683688165489477, 'edge_cap': 0.7472947034864642, 'bull_strategy': 'breakout', 'bull_bb_std_mult': 1.3450884350841354, 'bull_rsi_os': 24, 'bull_rsi_ob': 66, 'bull_adx_thresh': 25.23243628741739, 'bull_atr_min_pct': 0.010804237213669608, 'bull_atr_max_pct': 0.10377584588263424, 'bull_tp_mult': 2.7848131564052294, 'bull_tsl_mult': 0.26695990020320276, 'bull_time_stop': 260, 'bull_use_sma': True, 'bull_use_ema': True, 'bull_use_atr': True, 'bull_use_adx': False, 'bull_use_spike': True, 'bull_rsi_required': True, 'bear_strategy': 'breakout', 'bear_bb_std_mult': 2.819882697047041, 'bear_rsi_os': 47, 'bear_rsi_ob': 47, 'bear_adx_thresh': 19.41377882482486, 'bear_atr_min_pct': 0.017050011548492294, 'bear_atr_max_pct': 0.13708681719764526, 'bear_tp_mult': 2.8051634210040675, 'bear_tsl_mult': 0.03334762712313463, 'bear_time_stop': 297, 'bear_use_sma': True, 'bear_use_ema': False, 'bear_use_atr': True, 'bear_use_adx': True, 'bear_use_spike': True, 'bear_rsi_required': True, 'sideways_strategy': 'breakout', 'sideways_bb_std_mult': 1.900291221135668, 'sideways_rsi_os': 18, 'sideways_rsi_ob': 81, 'sideways_adx_thresh': 25.326812512638394, 'sideways_atr_min_pct': 0.011657201482846116, 'sideways_atr_max_pct': 0.10121748666171523, 'sideways_tp_mult': 1.6660776568931028, 'sideways_tsl_mult': 0.7858545267622659, 'sideways_time_stop': 211, 'sideways_use_sma': False, 'sideways_use_ema': True, 'sideways_use_atr': False, 'sideways_use_adx': True, 'sideways_use_spike': True, 'sideways_rsi_required': True}.
[I 2025-08-31 10:11:18,383] Trial 133 finished with values: [-1000000000.0, 1000000000.0] and parameters: {'p_sma': 54, 'p_std': 23, 'p_atr': 27, 'p_adx': 27, 'rsi_period': 43, 'ema1': 27, 'ema2': 56, 'slip_atr_k': 0.03701890422617217, 'slip_spread_k': 0.632656588764899, 'spread_hl_frac': 0.030676112651118498, 'bb_std_mult': 2.9729207925759145, 'rsi_os': 27, 'rsi_ob': 66, 'vol_spike': 0.15598349876507253, 'adx_thresh': 24.958306315275912, 'atr_min_pct': 0.010637851520258415, 'atr_max_pct': 0.07301552922872948, 'tp_mult': 1.6518761334470344, 'tsl_mult': 0.8351924129697594, 'strategy': 'breakout', 'time_stop': 203, 'use_sma': False, 'use_atr': True, 'use_adx': False, 'use_ema': False, 'use_spike': True, 'rsi_required': False, 'edge_k': 0.2272416102638038, 'edge_cap': 0.7850805512989903, 'bull_strategy': 'breakout', 'bull_bb_std_mult': 2.1905462489314087, 'bull_rsi_os': 24, 'bull_rsi_ob': 72, 'bull_adx_thresh': 24.981914967161856, 'bull_atr_min_pct': 0.001852467617308164, 'bull_atr_max_pct': 0.137212132996127, 'bull_tp_mult': 1.4324491212012749, 'bull_tsl_mult': 0.2680629042794589, 'bull_time_stop': 56, 'bull_use_sma': True, 'bull_use_ema': True, 'bull_use_atr': True, 'bull_use_adx': False, 'bull_use_spike': True, 'bull_rsi_required': True, 'bear_strategy': 'breakout', 'bear_bb_std_mult': 2.821390699825279, 'bear_rsi_os': 47, 'bear_rsi_ob': 77, 'bear_adx_thresh': 19.848177693710536, 'bear_atr_min_pct': 0.012357415114246938, 'bear_atr_max_pct': 0.14938451319842788, 'bear_tp_mult': 2.342160697573588, 'bear_tsl_mult': 0.1780006392605153, 'bear_time_stop': 192, 'bear_use_sma': True, 'bear_use_ema': False, 'bear_use_atr': True, 'bear_use_adx': True, 'bear_use_spike': True, 'bear_rsi_required': True, 'sideways_strategy': 'breakout', 'sideways_bb_std_mult': 2.6413712742070885, 'sideways_rsi_os': 22, 'sideways_rsi_ob': 81, 'sideways_adx_thresh': 7.708499405240172, 'sideways_atr_min_pct': 0.011526438869585853, 'sideways_atr_max_pct': 0.10959706334305214, 'sideways_tp_mult': 1.6688931124714954, 'sideways_tsl_mult': 0.7636784156478252, 'sideways_time_stop': 264, 'sideways_use_sma': False, 'sideways_use_ema': True, 'sideways_use_atr': False, 'sideways_use_adx': True, 'sideways_use_spike': True, 'sideways_rsi_required': True}.
[I 2025-08-31 10:11:18,484] Trial 132 finished with values: [-1000000000.0, 1000000000.0] and parameters: {'p_sma': 53, 'p_std': 50, 'p_atr': 27, 'p_adx': 27, 'rsi_period': 29, 'ema1': 25, 'ema2': 57, 'slip_atr_k': 0.22637618353263095, 'slip_spread_k': 0.8436856836585735, 'spread_hl_frac': 0.014073610034265459, 'bb_std_mult': 2.968430020889282, 'rsi_os': 29, 'rsi_ob': 66, 'vol_spike': 0.15523442172466712, 'adx_thresh': 31.762023239007217, 'atr_min_pct': 0.005547276370773454, 'atr_max_pct': 0.06430892164986113, 'tp_mult': 2.006702850909382, 'tsl_mult': 0.5381433624726062, 'strategy': 'breakout', 'time_stop': 202, 'use_sma': False, 'use_atr': True, 'use_adx': False, 'use_ema': False, 'use_spike': True, 'rsi_required': False, 'edge_k': 0.1859832782194073, 'edge_cap': 0.819340541111554, 'bull_strategy': 'breakout', 'bull_bb_std_mult': 1.3657406249869024, 'bull_rsi_os': 42, 'bull_rsi_ob': 66, 'bull_adx_thresh': 24.891435610264352, 'bull_atr_min_pct': 0.0018094979788136518, 'bull_atr_max_pct': 0.1370633877996228, 'bull_tp_mult': 2.864790850198512, 'bull_tsl_mult': 0.24934777807126413, 'bull_time_stop': 265, 'bull_use_sma': True, 'bull_use_ema': True, 'bull_use_atr': True, 'bull_use_adx': False, 'bull_use_spike': True, 'bull_rsi_required': True, 'bear_strategy': 'breakout', 'bear_bb_std_mult': 1.1539289406582594, 'bear_rsi_os': 42, 'bear_rsi_ob': 77, 'bear_adx_thresh': 19.630384311691866, 'bear_atr_min_pct': 0.012398175224202843, 'bear_atr_max_pct': 0.05944559376219231, 'bear_tp_mult': 2.8112238196956927, 'bear_tsl_mult': 0.7415201952111767, 'bear_time_stop': 60, 'bear_use_sma': True, 'bear_use_ema': False, 'bear_use_atr': True, 'bear_use_adx': True, 'bear_use_spike': True, 'bear_rsi_required': True, 'sideways_strategy': 'breakout', 'sideways_bb_std_mult': 2.618170281874276, 'sideways_rsi_os': 22, 'sideways_rsi_ob': 81, 'sideways_adx_thresh': 7.859367325787916, 'sideways_atr_min_pct': 0.010246564327421898, 'sideways_atr_max_pct': 0.10177504297392634, 'sideways_tp_mult': 1.0891804861437644, 'sideways_tsl_mult': 0.7808761217093371, 'sideways_time_stop': 213, 'sideways_use_sma': False, 'sideways_use_ema': True, 'sideways_use_atr': False, 'sideways_use_adx': True, 'sideways_use_spike': True, 'sideways_rsi_required': True}.
