[I 2025-08-31 10:35:43,368] Trial 315 finished with values: [-1000000000.0, 1000000000.0] and parameters: {'p_sma': 15, 'p_std': 56, 'p_atr': 11, 'p_adx': 11, 'rsi_period': 29, 'ema1': 12, 'ema2': 56, 'slip_atr_k': 0.05528953609309922, 'slip_spread_k': 0.667879381390867, 'spread_hl_frac': 0.009687903111099138, 'bb_std_mult': 0.740164830086091, 'rsi_os': 26, 'rsi_ob': 77, 'vol_spike': 0.2605420690153776, 'adx_thresh': 29.634055931327186, 'atr_min_pct': 0.00608557185701457, 'atr_max_pct': 0.09649578859027795, 'tp_mult': 1.5125128256949887, 'tsl_mult': 0.5801014610422683, 'strategy': 'breakout', 'time_stop': 187, 'use_sma': True, 'use_atr': False, 'use_adx': True, 'use_ema': True, 'use_spike': True, 'rsi_required': True, 'edge_k': 0.8319527538482027, 'edge_cap': 0.857376860110289, 'bull_strategy': 'breakout', 'bull_bb_std_mult': 0.7555706264904293, 'bull_rsi_os': 45, 'bull_rsi_ob': 74, 'bull_adx_thresh': 24.92116081625192, 'bull_atr_min_pct': 0.003933303433609762, 'bull_atr_max_pct': 0.14970203971198529, 'bull_tp_mult': 1.8073482956949678, 'bull_tsl_mult': 0.18675316153978883, 'bull_time_stop': 75, 'bull_use_sma': True, 'bull_use_ema': False, 'bull_use_atr': False, 'bull_use_adx': False, 'bull_use_spike': False, 'bull_rsi_required': True, 'bear_strategy': 'breakout', 'bear_bb_std_mult': 0.9854448230410633, 'bear_rsi_os': 40, 'bear_rsi_ob': 51, 'bear_adx_thresh': 15.315591329012914, 'bear_atr_min_pct': 0.005338083393092382, 'bear_atr_max_pct': 0.09347537356073865, 'bear_tp_mult': 2.828857519901575, 'bear_tsl_mult': 0.4325704226666427, 'bear_time_stop': 208, 'bear_use_sma': False, 'bear_use_ema': True, 'bear_use_atr': False, 'bear_use_adx': False, 'bear_use_spike': True, 'bear_rsi_required': False, 'sideways_strategy': 'mean_reversion', 'sideways_bb_std_mult': 2.2391573514233043, 'sideways_rsi_os': 9, 'sideways_rsi_ob': 46, 'sideways_adx_thresh': 25.884203843216604, 'sideways_atr_min_pct': 0.02312742119235213, 'sideways_atr_max_pct': 0.08963152161361305, 'sideways_tp_mult': 2.5191188861368428, 'sideways_tsl_mult': 0.10670987954335548, 'sideways_time_stop': 161, 'sideways_use_sma': False, 'sideways_use_ema': False, 'sideways_use_atr': False, 'sideways_use_adx': False, 'sideways_use_spike': False, 'sideways_rsi_required': True}.
[I 2025-08-31 10:35:43,389] Trial 316 finished with values: [-0.007589143537469867, 0.007872152230658713] and parameters: {'p_sma': 15, 'p_std': 28, 'p_atr': 11, 'p_adx': 14, 'rsi_period': 47, 'ema1': 14, 'ema2': 56, 'slip_atr_k': 0.022944654103988472, 'slip_spread_k': 0.66321897696104, 'spread_hl_frac': 0.009856888851567911, 'bb_std_mult': 2.711508641184838, 'rsi_os': 26, 'rsi_ob': 77, 'vol_spike': 0.2624596045947773, 'adx_thresh': 28.725756859631645, 'atr_min_pct': 0.005926310314032526, 'atr_max_pct': 0.09634215341978589, 'tp_mult': 2.416593977408855, 'tsl_mult': 0.2563102848285794, 'strategy': 'breakout', 'time_stop': 75, 'use_sma': True, 'use_atr': False, 'use_adx': True, 'use_ema': True, 'use_spike': True, 'rsi_required': True, 'edge_k': 0.2035735795540471, 'edge_cap': 0.45864813879773947, 'bull_strategy': 'breakout', 'bull_bb_std_mult': 0.7708552592429765, 'bull_rsi_os': 11, 'bull_rsi_ob': 74, 'bull_adx_thresh': 6.912396505849417, 'bull_atr_min_pct': 0.0037588007992129355, 'bull_atr_max_pct': 0.0920136774210472, 'bull_tp_mult': 1.770109479325355, 'bull_tsl_mult': 0.3875760928847847, 'bull_time_stop': 75, 'bull_use_sma': True, 'bull_use_ema': False, 'bull_use_atr': False, 'bull_use_adx': False, 'bull_use_spike': False, 'bull_rsi_required': True, 'bear_strategy': 'breakout', 'bear_bb_std_mult': 1.9708614774107285, 'bear_rsi_os': 40, 'bear_rsi_ob': 88, 'bear_adx_thresh': 6.190511790924086, 'bear_atr_min_pct': 0.005602795064874003, 'bear_atr_max_pct': 0.13710568580809682, 'bear_tp_mult': 2.8117523696662623, 'bear_tsl_mult': 0.5190353139774587, 'bear_time_stop': 31, 'bear_use_sma': False, 'bear_use_ema': True, 'bear_use_atr': False, 'bear_use_adx': False, 'bear_use_spike': True, 'bear_rsi_required': False, 'sideways_strategy': 'mean_reversion', 'sideways_bb_std_mult': 2.737443294114196, 'sideways_rsi_os': 6, 'sideways_rsi_ob': 92, 'sideways_adx_thresh': 25.60669295160514, 'sideways_atr_min_pct': 0.01817997868368923, 'sideways_atr_max_pct': 0.03915323706245954, 'sideways_tp_mult': 1.9647194670541877, 'sideways_tsl_mult': 0.10822521231788948, 'sideways_time_stop': 23, 'sideways_use_sma': False, 'sideways_use_ema': False, 'sideways_use_atr': False, 'sideways_use_adx': False, 'sideways_use_spike': False, 'sideways_rsi_required': True}.
[I 2025-08-31 10:35:43,517] Trial 317 finished with values: [-0.015789254466349822, 0.01747372970644216] and parameters: {'p_sma': 15, 'p_std': 23, 'p_atr': 11, 'p_adx': 14, 'rsi_period': 9, 'ema1': 14, 'ema2': 56, 'slip_atr_k': 0.023185483625280997, 'slip_spread_k': 0.6686985317681888, 'spread_hl_frac': 0.03182547998994149, 'bb_std_mult': 0.75878316032325, 'rsi_os': 12, 'rsi_ob': 76, 'vol_spike': 0.2617935336512375, 'adx_thresh': 10.46396212450105, 'atr_min_pct': 0.006086013531884046, 'atr_max_pct': 0.0879226323763925, 'tp_mult': 2.4773341786552203, 'tsl_mult': 0.25255870290961246, 'strategy': 'breakout', 'time_stop': 102, 'use_sma': True, 'use_atr': False, 'use_adx': True, 'use_ema': True, 'use_spike': True, 'rsi_required': True, 'edge_k': 0.18934294707647956, 'edge_cap': 0.6300892676532048, 'bull_strategy': 'breakout', 'bull_bb_std_mult': 2.4060870589318535, 'bull_rsi_os': 45, 'bull_rsi_ob': 74, 'bull_adx_thresh': 9.014106072026937, 'bull_atr_min_pct': 0.02625018068909321, 'bull_atr_max_pct': 0.07750812456494784, 'bull_tp_mult': 1.0564393026657832, 'bull_tsl_mult': 0.3871609407557211, 'bull_time_stop': 203, 'bull_use_sma': False, 'bull_use_ema': False, 'bull_use_atr': False, 'bull_use_adx': False, 'bull_use_spike': True, 'bull_rsi_required': True, 'bear_strategy': 'breakout', 'bear_bb_std_mult': 3.252698948441978, 'bear_rsi_os': 41, 'bear_rsi_ob': 95, 'bear_adx_thresh': 15.357756507226917, 'bear_atr_min_pct': 0.004192662358540319, 'bear_atr_max_pct': 0.08361519350252972, 'bear_tp_mult': 2.816444937695001, 'bear_tsl_mult': 0.521148086461134, 'bear_time_stop': 233, 'bear_use_sma': False, 'bear_use_ema': True, 'bear_use_atr': False, 'bear_use_adx': False, 'bear_use_spike': False, 'bear_rsi_required': False, 'sideways_strategy': 'mean_reversion', 'sideways_bb_std_mult': 2.767947590490011, 'sideways_rsi_os': 18, 'sideways_rsi_ob': 92, 'sideways_adx_thresh': 25.91046690666482, 'sideways_atr_min_pct': 0.024792770463786626, 'sideways_atr_max_pct': 0.010415281566847331, 'sideways_tp_mult': 2.5185819433856746, 'sideways_tsl_mult': 0.06147090024155988, 'sideways_time_stop': 22, 'sideways_use_sma': False, 'sideways_use_ema': False, 'sideways_use_atr': False, 'sideways_use_adx': False, 'sideways_use_spike': False, 'sideways_rsi_required': True}.
[I 2025-08-31 10:36:14,260] Trial 318 finished with values: [-1000000000.0, 1000000000.0] and parameters: {'p_sma': 15, 'p_std': 19, 'p_atr': 30, 'p_adx': 11, 'rsi_period': 47, 'ema1': 12, 'ema2': 56, 'slip_atr_k': 0.0218101603819446, 'slip_spread_k': 0.9406931177815517, 'spread_hl_frac': 0.009543430446038496, 'bb_std_mult': 0.7360236898229487, 'rsi_os': 51, 'rsi_ob': 71, 'vol_spike': 0.2630108308353873, 'adx_thresh': 34.95410799776528, 'atr_min_pct': 0.005897567644017729, 'atr_max_pct': 0.10084379765031111, 'tp_mult': 1.5266366736579124, 'tsl_mult': 0.42642134817389843, 'strategy': 'breakout', 'time_stop': 182, 'use_sma': True, 'use_atr': False, 'use_adx': True, 'use_ema': True, 'use_spike': True, 'rsi_required': True, 'edge_k': 0.1187870517609847, 'edge_cap': 0.9998118401683231, 'bull_strategy': 'breakout', 'bull_bb_std_mult': 3.41021971118238, 'bull_rsi_os': 45, 'bull_rsi_ob': 93, 'bull_adx_thresh': 24.632445903116963, 'bull_atr_min_pct': 0.0038547541329380882, 'bull_atr_max_pct': 0.11574885538541323, 'bull_tp_mult': 1.8569231074350037, 'bull_tsl_mult': 0.39668261154602524, 'bull_time_stop': 258, 'bull_use_sma': False, 'bull_use_ema': False, 'bull_use_atr': False, 'bull_use_adx': True, 'bull_use_spike': True, 'bull_rsi_required': True, 'bear_strategy': 'breakout', 'bear_bb_std_mult': 1.2186429800790912, 'bear_rsi_os': 20, 'bear_rsi_ob': 70, 'bear_adx_thresh': 8.949801968644588, 'bear_atr_min_pct': 0.0040589157282535406, 'bear_atr_max_pct': 0.058574189460754336, 'bear_tp_mult': 1.4626165554451154, 'bear_tsl_mult': 0.5179435392695027, 'bear_time_stop': 40, 'bear_use_sma': False, 'bear_use_ema': True, 'bear_use_atr': False, 'bear_use_adx': False, 'bear_use_spike': False, 'bear_rsi_required': False, 'sideways_strategy': 'mean_reversion', 'sideways_bb_std_mult': 2.2365211656402555, 'sideways_rsi_os': 9, 'sideways_rsi_ob': 79, 'sideways_adx_thresh': 25.5578996533887, 'sideways_atr_min_pct': 0.018287727091686017, 'sideways_atr_max_pct': 0.038596347683769724, 'sideways_tp_mult': 2.4703833323613984, 'sideways_tsl_mult': 0.0689505909117208, 'sideways_time_stop': 190, 'sideways_use_sma': False, 'sideways_use_ema': False, 'sideways_use_atr': True, 'sideways_use_adx': False, 'sideways_use_spike': False, 'sideways_rsi_required': True}.
[I 2025-08-31 10:36:14,583] Trial 321 finished with values: [-1000000000.0, 1000000000.0] and parameters: {'p_sma': 16, 'p_std': 31, 'p_atr': 11, 'p_adx': 13, 'rsi_period': 51, 'ema1': 13, 'ema2': 59, 'slip_atr_k': 0.012562828302340557, 'slip_spread_k': 0.7266866151418461, 'spread_hl_frac': 0.008745226954599486, 'bb_std_mult': 2.704875195305375, 'rsi_os': 24, 'rsi_ob': 79, 'vol_spike': 0.24922651336667787, 'adx_thresh': 26.914518454345775, 'atr_min_pct': 0.007163880448750532, 'atr_max_pct': 0.10263912381962521, 'tp_mult': 2.25113763709638, 'tsl_mult': 0.2567120573645348, 'strategy': 'breakout', 'time_stop': 89, 'use_sma': True, 'use_atr': False, 'use_adx': True, 'use_ema': True, 'use_spike': True, 'rsi_required': True, 'edge_k': 0.27863121610729247, 'edge_cap': 0.4645530106319034, 'bull_strategy': 'breakout', 'bull_bb_std_mult': 0.6501354487653616, 'bull_rsi_os': 11, 'bull_rsi_ob': 75, 'bull_adx_thresh': 6.9725058789144185, 'bull_atr_min_pct': 0.004639432222557131, 'bull_atr_max_pct': 0.09257499093889966, 'bull_tp_mult': 1.7815929971940958, 'bull_tsl_mult': 0.37418983543759815, 'bull_time_stop': 63, 'bull_use_sma': False, 'bull_use_ema': False, 'bull_use_atr': False, 'bull_use_adx': True, 'bull_use_spike': False, 'bull_rsi_required': True, 'bear_strategy': 'breakout', 'bear_bb_std_mult': 2.160596962893026, 'bear_rsi_os': 42, 'bear_rsi_ob': 88, 'bear_adx_thresh': 5.950749281178369, 'bear_atr_min_pct': 0.006769502673181486, 'bear_atr_max_pct': 0.1360872011491703, 'bear_tp_mult': 2.8732404912211815, 'bear_tsl_mult': 0.48091550198626914, 'bear_time_stop': 24, 'bear_use_sma': True, 'bear_use_ema': True, 'bear_use_atr': False, 'bear_use_adx': False, 'bear_use_spike': False, 'bear_rsi_required': False, 'sideways_strategy': 'mean_reversion', 'sideways_bb_std_mult': 2.6093177564774237, 'sideways_rsi_os': 6, 'sideways_rsi_ob': 92, 'sideways_adx_thresh': 26.84666698575216, 'sideways_atr_min_pct': 0.018052956767323346, 'sideways_atr_max_pct': 0.05985772460045784, 'sideways_tp_mult': 1.8803773211953358, 'sideways_tsl_mult': 0.13499997443991033, 'sideways_time_stop': 14, 'sideways_use_sma': False, 'sideways_use_ema': False, 'sideways_use_atr': True, 'sideways_use_adx': False, 'sideways_use_spike': False, 'sideways_rsi_required': True}.
[I 2025-08-31 10:36:14,851] Trial 320 finished with values: [-1000000000.0, 1000000000.0] and parameters: {'p_sma': 26, 'p_std': 30, 'p_atr': 11, 'p_adx': 14, 'rsi_period': 49, 'ema1': 13, 'ema2': 58, 'slip_atr_k': 0.01664558247039222, 'slip_spread_k': 0.723356023825205, 'spread_hl_frac': 0.008785476699443358, 'bb_std_mult': 2.7251958127494817, 'rsi_os': 5, 'rsi_ob': 79, 'vol_spike': 0.247637092832098, 'adx_thresh': 26.87577486119457, 'atr_min_pct': 0.007338964656349466, 'atr_max_pct': 0.10124313721480101, 'tp_mult': 2.365962957745155, 'tsl_mult': 0.2646259074679582, 'strategy': 'breakout', 'time_stop': 136, 'use_sma': True, 'use_atr': False, 'use_adx': True, 'use_ema': True, 'use_spike': True, 'rsi_required': True, 'edge_k': 0.2670729036525562, 'edge_cap': 0.46247924547102265, 'bull_strategy': 'breakout', 'bull_bb_std_mult': 0.6103620670278584, 'bull_rsi_os': 11, 'bull_rsi_ob': 86, 'bull_adx_thresh': 7.049277672033282, 'bull_atr_min_pct': 0.004926277363700521, 'bull_atr_max_pct': 0.09278079416962211, 'bull_tp_mult': 1.7867546786170276, 'bull_tsl_mult': 0.33480314458186505, 'bull_time_stop': 63, 'bull_use_sma': False, 'bull_use_ema': False, 'bull_use_atr': False, 'bull_use_adx': True, 'bull_use_spike': False, 'bull_rsi_required': True, 'bear_strategy': 'breakout', 'bear_bb_std_mult': 2.055801346580451, 'bear_rsi_os': 42, 'bear_rsi_ob': 87, 'bear_adx_thresh': 6.521712302685963, 'bear_atr_min_pct': 0.009532761976048085, 'bear_atr_max_pct': 0.13715169702574062, 'bear_tp_mult': 2.8651168670816913, 'bear_tsl_mult': 0.4491759335525713, 'bear_time_stop': 18, 'bear_use_sma': True, 'bear_use_ema': True, 'bear_use_atr': False, 'bear_use_adx': False, 'bear_use_spike': False, 'bear_rsi_required': False, 'sideways_strategy': 'mean_reversion', 'sideways_bb_std_mult': 2.6278821486854054, 'sideways_rsi_os': 7, 'sideways_rsi_ob': 93, 'sideways_adx_thresh': 26.555176269610815, 'sideways_atr_min_pct': 0.01813236244107876, 'sideways_atr_max_pct': 0.04528992239747267, 'sideways_tp_mult': 1.8146989527414217, 'sideways_tsl_mult': 0.14160015609779064, 'sideways_time_stop': 15, 'sideways_use_sma': False, 'sideways_use_ema': False, 'sideways_use_atr': True, 'sideways_use_adx': False, 'sideways_use_spike': False, 'sideways_rsi_required': True}.
[I 2025-08-31 10:36:14,964] Trial 319 finished with values: [-1000000000.0, 1000000000.0] and parameters: {'p_sma': 15, 'p_std': 23, 'p_atr': 16, 'p_adx': 15, 'rsi_period': 78, 'ema1': 22, 'ema2': 56, 'slip_atr_k': 0.07331581814349007, 'slip_spread_k': 0.6064566643908657, 'spread_hl_frac': 0.03176502407622128, 'bb_std_mult': 2.7286392850937213, 'rsi_os': 12, 'rsi_ob': 71, 'vol_spike': 0.1910658208126046, 'adx_thresh': 28.380765943562345, 'atr_min_pct': 0.004491581591217571, 'atr_max_pct': 0.04366707373071424, 'tp_mult': 1.819617947161383, 'tsl_mult': 0.04435766704787203, 'strategy': 'breakout', 'time_stop': 219, 'use_sma': True, 'use_atr': True, 'use_adx': False, 'use_ema': True, 'use_spike': True, 'rsi_required': True, 'edge_k': 0.1302339278504781, 'edge_cap': 0.459692281502713, 'bull_strategy': 'breakout', 'bull_bb_std_mult': 2.416705684892684, 'bull_rsi_os': 42, 'bull_rsi_ob': 69, 'bull_adx_thresh': 23.458028736784563, 'bull_atr_min_pct': 0.003427032398189531, 'bull_atr_max_pct': 0.11457631922012378, 'bull_tp_mult': 1.015169279374301, 'bull_tsl_mult': 0.3927659005513582, 'bull_time_stop': 12, 'bull_use_sma': False, 'bull_use_ema': True, 'bull_use_atr': False, 'bull_use_adx': True, 'bull_use_spike': True, 'bull_rsi_required': True, 'bear_strategy': 'breakout', 'bear_bb_std_mult': 2.0804599552051237, 'bear_rsi_os': 27, 'bear_rsi_ob': 70, 'bear_adx_thresh': 16.565718392245135, 'bear_atr_min_pct': 0.003840365078441579, 'bear_atr_max_pct': 0.058471597148692184, 'bear_tp_mult': 1.5878727115676174, 'bear_tsl_mult': 0.5166338721676874, 'bear_time_stop': 34, 'bear_use_sma': True, 'bear_use_ema': True, 'bear_use_atr': False, 'bear_use_adx': False, 'bear_use_spike': False, 'bear_rsi_required': False, 'sideways_strategy': 'breakout', 'sideways_bb_std_mult': 2.7686450302386647, 'sideways_rsi_os': 18, 'sideways_rsi_ob': 78, 'sideways_adx_thresh': 26.27548302321072, 'sideways_atr_min_pct': 0.018218581996938626, 'sideways_atr_max_pct': 0.03977730018620722, 'sideways_tp_mult': 1.9686273287062597, 'sideways_tsl_mult': 0.06456864646532162, 'sideways_time_stop': 30, 'sideways_use_sma': False, 'sideways_use_ema': False, 'sideways_use_atr': True, 'sideways_use_adx': True, 'sideways_use_spike': False, 'sideways_rsi_required': True}.
[I 2025-08-31 10:36:45,569] Trial 322 finished with values: [-1000000000.0, 1000000000.0] and parameters: {'p_sma': 16, 'p_std': 30, 'p_atr': 11, 'p_adx': 14, 'rsi_period': 49, 'ema1': 13, 'ema2': 59, 'slip_atr_k': 0.00945955254056769, 'slip_spread_k': 0.7234235957496086, 'spread_hl_frac': 0.007775533500716475, 'bb_std_mult': 2.71400270478459, 'rsi_os': 25, 'rsi_ob': 78, 'vol_spike': 0.2323149401922925, 'adx_thresh': 26.99330098661406, 'atr_min_pct': 0.007969974855271051, 'atr_max_pct': 0.10390718317954167, 'tp_mult': 2.3443343750805483, 'tsl_mult': 0.24785244983110902, 'strategy': 'breakout', 'time_stop': 96, 'use_sma': False, 'use_atr': False, 'use_adx': True, 'use_ema': True, 'use_spike': True, 'rsi_required': True, 'edge_k': 0.2962485008309858, 'edge_cap': 0.46747216292167826, 'bull_strategy': 'breakout', 'bull_bb_std_mult': 0.5818173460653446, 'bull_rsi_os': 10, 'bull_rsi_ob': 75, 'bull_adx_thresh': 6.957251647250045, 'bull_atr_min_pct': 0.004680137411373582, 'bull_atr_max_pct': 0.09074708121458902, 'bull_tp_mult': 1.8002784915644465, 'bull_tsl_mult': 0.3410421283229481, 'bull_time_stop': 60, 'bull_use_sma': False, 'bull_use_ema': False, 'bull_use_atr': False, 'bull_use_adx': False, 'bull_use_spike': False, 'bull_rsi_required': True, 'bear_strategy': 'breakout', 'bear_bb_std_mult': 2.173638843274834, 'bear_rsi_os': 42, 'bear_rsi_ob': 88, 'bear_adx_thresh': 6.074913402922526, 'bear_atr_min_pct': 0.006939481472084261, 'bear_atr_max_pct': 0.13680086842329361, 'bear_tp_mult': 2.8778796139695197, 'bear_tsl_mult': 0.4842930636459712, 'bear_time_stop': 21, 'bear_use_sma': True, 'bear_use_ema': True, 'bear_use_atr': True, 'bear_use_adx': False, 'bear_use_spike': False, 'bear_rsi_required': False, 'sideways_strategy': 'mean_reversion', 'sideways_bb_std_mult': 2.635967343449201, 'sideways_rsi_os': 6, 'sideways_rsi_ob': 93, 'sideways_adx_thresh': 26.630166803163227, 'sideways_atr_min_pct': 0.018266772436358804, 'sideways_atr_max_pct': 0.06214196338611268, 'sideways_tp_mult': 1.8554086984491185, 'sideways_tsl_mult': 0.1421626849067655, 'sideways_time_stop': 14, 'sideways_use_sma': False, 'sideways_use_ema': False, 'sideways_use_atr': True, 'sideways_use_adx': False, 'sideways_use_spike': False, 'sideways_rsi_required': True}.
[I 2025-08-31 10:36:46,325] Trial 324 finished with values: [-1000000000.0, 1000000000.0] and parameters: {'p_sma': 16, 'p_std': 33, 'p_atr': 10, 'p_adx': 14, 'rsi_period': 52, 'ema1': 14, 'ema2': 59, 'slip_atr_k': 0.014377984320964307, 'slip_spread_k': 0.6904826701135751, 'spread_hl_frac': 0.008108647593614036, 'bb_std_mult': 2.6375527365647127, 'rsi_os': 25, 'rsi_ob': 78, 'vol_spike': 0.25406392266830585, 'adx_thresh': 27.881347664876095, 'atr_min_pct': 0.00795133473979594, 'atr_max_pct': 0.09977445571281354, 'tp_mult': 2.286279802773754, 'tsl_mult': 0.2380796157172071, 'strategy': 'breakout', 'time_stop': 72, 'use_sma': False, 'use_atr': False, 'use_adx': True, 'use_ema': True, 'use_spike': False, 'rsi_required': True, 'edge_k': 0.32915318579385755, 'edge_cap': 0.42098554916018366, 'bull_strategy': 'breakout', 'bull_bb_std_mult': 0.5531249032414379, 'bull_rsi_os': 13, 'bull_rsi_ob': 75, 'bull_adx_thresh': 6.301760537877355, 'bull_atr_min_pct': 0.00408540240557592, 'bull_atr_max_pct': 0.08727274155020212, 'bull_tp_mult': 1.822611900579565, 'bull_tsl_mult': 0.32917028477788457, 'bull_time_stop': 60, 'bull_use_sma': True, 'bull_use_ema': False, 'bull_use_atr': False, 'bull_use_adx': False, 'bull_use_spike': False, 'bull_rsi_required': False, 'bear_strategy': 'mean_reversion', 'bear_bb_std_mult': 1.9911695501818778, 'bear_rsi_os': 43, 'bear_rsi_ob': 95, 'bear_adx_thresh': 7.377445718557659, 'bear_atr_min_pct': 0.00790800379495922, 'bear_atr_max_pct': 0.1414237196135765, 'bear_tp_mult': 2.8863623559976563, 'bear_tsl_mult': 0.4842456896811338, 'bear_time_stop': 28, 'bear_use_sma': False, 'bear_use_ema': True, 'bear_use_atr': True, 'bear_use_adx': False, 'bear_use_spike': True, 'bear_rsi_required': False, 'sideways_strategy': 'mean_reversion', 'sideways_bb_std_mult': 2.703140452044164, 'sideways_rsi_os': 6, 'sideways_rsi_ob': 92, 'sideways_adx_thresh': 26.52865223201265, 'sideways_atr_min_pct': 0.019048160743617443, 'sideways_atr_max_pct': 0.07324745675973383, 'sideways_tp_mult': 1.8534338218492825, 'sideways_tsl_mult': 0.12351877724695522, 'sideways_time_stop': 21, 'sideways_use_sma': False, 'sideways_use_ema': False, 'sideways_use_atr': False, 'sideways_use_adx': False, 'sideways_use_spike': False, 'sideways_rsi_required': True}.
