[I 2025-08-31 11:29:43,328] Trial 730 finished with values: [-1000000000.0, 1000000000.0] and parameters: {'p_sma': 11, 'p_std': 24, 'p_atr': 11, 'p_adx': 9, 'rsi_period': 56, 'ema1': 12, 'ema2': 41, 'slip_atr_k': 0.13371928245770953, 'slip_spread_k': 0.1227785393082308, 'spread_hl_frac': 0.005933338817249409, 'bb_std_mult': 2.1627357653803285, 'rsi_os': 30, 'rsi_ob': 93, 'vol_spike': 0.28530534494415966, 'adx_thresh': 32.553968374263725, 'atr_min_pct': 0.010907876638264173, 'atr_max_pct': 0.14810181078904636, 'tp_mult': 1.5803711572655756, 'tsl_mult': 0.022136230950388525, 'strategy': 'breakout', 'time_stop': 201, 'use_sma': True, 'use_atr': True, 'use_adx': False, 'use_ema': True, 'use_spike': False, 'rsi_required': False, 'edge_k': 0.31296821341879166, 'edge_cap': 0.49667915006299834, 'bull_strategy': 'breakout', 'bull_bb_std_mult': 0.6764893164435517, 'bull_rsi_os': 27, 'bull_rsi_ob': 82, 'bull_adx_thresh': 5.03460048422931, 'bull_atr_min_pct': 0.005146204854254444, 'bull_atr_max_pct': 0.09702723637670772, 'bull_tp_mult': 1.946782676556194, 'bull_tsl_mult': 0.9997170427578939, 'bull_time_stop': 289, 'bull_use_sma': False, 'bull_use_ema': True, 'bull_use_atr': True, 'bull_use_adx': False, 'bull_use_spike': True, 'bull_rsi_required': True, 'bear_strategy': 'breakout', 'bear_bb_std_mult': 3.0217032995302215, 'bear_rsi_os': 51, 'bear_rsi_ob': 74, 'bear_adx_thresh': 33.82841934910054, 'bear_atr_min_pct': 0.004494688919614129, 'bear_atr_max_pct': 0.13374930151278727, 'bear_tp_mult': 2.2670914597796177, 'bear_tsl_mult': 0.6996096360998287, 'bear_time_stop': 20, 'bear_use_sma': False, 'bear_use_ema': True, 'bear_use_atr': False, 'bear_use_adx': False, 'bear_use_spike': False, 'bear_rsi_required': True, 'sideways_strategy': 'breakout', 'sideways_bb_std_mult': 2.776106869965765, 'sideways_rsi_os': 26, 'sideways_rsi_ob': 94, 'sideways_adx_thresh': 11.34778126148781, 'sideways_atr_min_pct': 0.015291954917505795, 'sideways_atr_max_pct': 0.03939160695778459, 'sideways_tp_mult': 1.8314357549762, 'sideways_tsl_mult': 0.40481973208779665, 'sideways_time_stop': 5, 'sideways_use_sma': False, 'sideways_use_ema': False, 'sideways_use_atr': True, 'sideways_use_adx': False, 'sideways_use_spike': True, 'sideways_rsi_required': True}.
[I 2025-08-31 11:29:43,601] Trial 729 finished with values: [-1000000000.0, 1000000000.0] and parameters: {'p_sma': 11, 'p_std': 24, 'p_atr': 24, 'p_adx': 12, 'rsi_period': 55, 'ema1': 12, 'ema2': 42, 'slip_atr_k': 0.07792982504543022, 'slip_spread_k': 0.1496327698273235, 'spread_hl_frac': 0.005894670503832262, 'bb_std_mult': 3.545454951583864, 'rsi_os': 30, 'rsi_ob': 94, 'vol_spike': 0.28165558760372345, 'adx_thresh': 30.947532027683025, 'atr_min_pct': 0.011029389809059698, 'atr_max_pct': 0.14988306934046525, 'tp_mult': 1.668923272044196, 'tsl_mult': 0.054066534424145794, 'strategy': 'breakout', 'time_stop': 202, 'use_sma': True, 'use_atr': True, 'use_adx': False, 'use_ema': False, 'use_spike': False, 'rsi_required': False, 'edge_k': 0.3301237240525303, 'edge_cap': 0.5006251739602668, 'bull_strategy': 'breakout', 'bull_bb_std_mult': 0.6873741423120167, 'bull_rsi_os': 50, 'bull_rsi_ob': 82, 'bull_adx_thresh': 6.137056102264655, 'bull_atr_min_pct': 0.02988988759053958, 'bull_atr_max_pct': 0.09428509836510708, 'bull_tp_mult': 1.9327951566182955, 'bull_tsl_mult': 0.9988648745740482, 'bull_time_stop': 289, 'bull_use_sma': False, 'bull_use_ema': True, 'bull_use_atr': True, 'bull_use_adx': False, 'bull_use_spike': True, 'bull_rsi_required': False, 'bear_strategy': 'mean_reversion', 'bear_bb_std_mult': 3.145147167117058, 'bear_rsi_os': 51, 'bear_rsi_ob': 76, 'bear_adx_thresh': 32.8988561664447, 'bear_atr_min_pct': 0.0034150744910402212, 'bear_atr_max_pct': 0.13487107371514542, 'bear_tp_mult': 1.9294542353970472, 'bear_tsl_mult': 0.7871167978787591, 'bear_time_stop': 41, 'bear_use_sma': False, 'bear_use_ema': True, 'bear_use_atr': True, 'bear_use_adx': True, 'bear_use_spike': False, 'bear_rsi_required': False, 'sideways_strategy': 'breakout', 'sideways_bb_std_mult': 2.866681029008888, 'sideways_rsi_os': 26, 'sideways_rsi_ob': 95, 'sideways_adx_thresh': 13.546844631233908, 'sideways_atr_min_pct': 0.015371559087606452, 'sideways_atr_max_pct': 0.03915179872610348, 'sideways_tp_mult': 2.993542285574266, 'sideways_tsl_mult': 0.4021897132020149, 'sideways_time_stop': 5, 'sideways_use_sma': False, 'sideways_use_ema': True, 'sideways_use_atr': True, 'sideways_use_adx': False, 'sideways_use_spike': True, 'sideways_rsi_required': False}.
[I 2025-08-31 11:29:44,148] Trial 728 finished with values: [-1000000000.0, 1000000000.0] and parameters: {'p_sma': 10, 'p_std': 23, 'p_atr': 20, 'p_adx': 12, 'rsi_period': 55, 'ema1': 11, 'ema2': 41, 'slip_atr_k': 0.029632733657891173, 'slip_spread_k': 0.14460454963728417, 'spread_hl_frac': 0.005018258478564519, 'bb_std_mult': 2.8735804511527223, 'rsi_os': 30, 'rsi_ob': 94, 'vol_spike': 0.2856917139873006, 'adx_thresh': 31.05895304692946, 'atr_min_pct': 0.010935277850121324, 'atr_max_pct': 0.14978918260276242, 'tp_mult': 1.5798321143858303, 'tsl_mult': 0.06014859238934342, 'strategy': 'breakout', 'time_stop': 204, 'use_sma': True, 'use_atr': True, 'use_adx': False, 'use_ema': False, 'use_spike': False, 'rsi_required': False, 'edge_k': 0.3226618982578111, 'edge_cap': 0.5577272125559386, 'bull_strategy': 'breakout', 'bull_bb_std_mult': 1.352895080789204, 'bull_rsi_os': 12, 'bull_rsi_ob': 83, 'bull_adx_thresh': 5.964362566789167, 'bull_atr_min_pct': 0.0032210058122072263, 'bull_atr_max_pct': 0.09471101008586624, 'bull_tp_mult': 1.9353840638856492, 'bull_tsl_mult': 0.3744615325932385, 'bull_time_stop': 291, 'bull_use_sma': False, 'bull_use_ema': True, 'bull_use_atr': True, 'bull_use_adx': True, 'bull_use_spike': True, 'bull_rsi_required': False, 'bear_strategy': 'mean_reversion', 'bear_bb_std_mult': 3.1520893437769666, 'bear_rsi_os': 54, 'bear_rsi_ob': 72, 'bear_adx_thresh': 25.13022539643306, 'bear_atr_min_pct': 0.003837557025502935, 'bear_atr_max_pct': 0.133359987624236, 'bear_tp_mult': 2.898437971001671, 'bear_tsl_mult': 0.7095983775562177, 'bear_time_stop': 38, 'bear_use_sma': False, 'bear_use_ema': True, 'bear_use_atr': True, 'bear_use_adx': True, 'bear_use_spike': False, 'bear_rsi_required': False, 'sideways_strategy': 'breakout', 'sideways_bb_std_mult': 2.8825922818936816, 'sideways_rsi_os': 25, 'sideways_rsi_ob': 95, 'sideways_adx_thresh': 13.494949440342925, 'sideways_atr_min_pct': 0.015030941845066776, 'sideways_atr_max_pct': 0.04203452554684408, 'sideways_tp_mult': 1.5761474107364055, 'sideways_tsl_mult': 0.3360442006045293, 'sideways_time_stop': 11, 'sideways_use_sma': False, 'sideways_use_ema': True, 'sideways_use_atr': True, 'sideways_use_adx': False, 'sideways_use_spike': True, 'sideways_rsi_required': True}.
[I 2025-08-31 11:30:19,286] Trial 732 finished with values: [-1000000000.0, 1000000000.0] and parameters: {'p_sma': 12, 'p_std': 24, 'p_atr': 11, 'p_adx': 13, 'rsi_period': 53, 'ema1': 12, 'ema2': 43, 'slip_atr_k': 0.24462709610389555, 'slip_spread_k': 0.1466502488849595, 'spread_hl_frac': 0.007487960863957666, 'bb_std_mult': 2.157519979747632, 'rsi_os': 28, 'rsi_ob': 95, 'vol_spike': 0.28318857997159486, 'adx_thresh': 31.5431025512934, 'atr_min_pct': 0.011930584685653856, 'atr_max_pct': 0.14981758179799143, 'tp_mult': 1.6738406997619024, 'tsl_mult': 0.10598900263660127, 'strategy': 'mean_reversion', 'time_stop': 205, 'use_sma': True, 'use_atr': True, 'use_adx': False, 'use_ema': True, 'use_spike': False, 'rsi_required': False, 'edge_k': 0.31018832583653394, 'edge_cap': 0.4941187039888139, 'bull_strategy': 'breakout', 'bull_bb_std_mult': 0.698183487227829, 'bull_rsi_os': 44, 'bull_rsi_ob': 82, 'bull_adx_thresh': 6.003460770846236, 'bull_atr_min_pct': 0.005314195083797518, 'bull_atr_max_pct': 0.09733241632279829, 'bull_tp_mult': 1.899189496860002, 'bull_tsl_mult': 0.07653280344616958, 'bull_time_stop': 289, 'bull_use_sma': False, 'bull_use_ema': True, 'bull_use_atr': True, 'bull_use_adx': False, 'bull_use_spike': True, 'bull_rsi_required': True, 'bear_strategy': 'breakout', 'bear_bb_std_mult': 3.1358040374234974, 'bear_rsi_os': 51, 'bear_rsi_ob': 75, 'bear_adx_thresh': 5.005448172065666, 'bear_atr_min_pct': 0.0042758838530521535, 'bear_atr_max_pct': 0.13356747687425122, 'bear_tp_mult': 2.9105031223350952, 'bear_tsl_mult': 0.7113295912522918, 'bear_time_stop': 20, 'bear_use_sma': False, 'bear_use_ema': True, 'bear_use_atr': False, 'bear_use_adx': False, 'bear_use_spike': False, 'bear_rsi_required': False, 'sideways_strategy': 'breakout', 'sideways_bb_std_mult': 0.8297684729995636, 'sideways_rsi_os': 24, 'sideways_rsi_ob': 94, 'sideways_adx_thresh': 12.32079102526, 'sideways_atr_min_pct': 0.0149536448479442, 'sideways_atr_max_pct': 0.09261209717809266, 'sideways_tp_mult': 1.9602216711406892, 'sideways_tsl_mult': 0.4014946709756487, 'sideways_time_stop': 5, 'sideways_use_sma': True, 'sideways_use_ema': False, 'sideways_use_atr': True, 'sideways_use_adx': False, 'sideways_use_spike': True, 'sideways_rsi_required': True}.
[I 2025-08-31 11:30:19,479] Trial 733 finished with values: [-0.10291324078111885, 0.10241117376689848] and parameters: {'p_sma': 12, 'p_std': 25, 'p_atr': 19, 'p_adx': 13, 'rsi_period': 53, 'ema1': 12, 'ema2': 43, 'slip_atr_k': 0.22308746607807717, 'slip_spread_k': 0.14973019788287256, 'spread_hl_frac': 0.006959729235325024, 'bb_std_mult': 2.017248101479343, 'rsi_os': 28, 'rsi_ob': 95, 'vol_spike': 0.27181621374228954, 'adx_thresh': 31.57954192683666, 'atr_min_pct': 0.011989633171971253, 'atr_max_pct': 0.14991185712082444, 'tp_mult': 1.6756742008307497, 'tsl_mult': 0.10366587539329443, 'strategy': 'mean_reversion', 'time_stop': 207, 'use_sma': True, 'use_atr': False, 'use_adx': True, 'use_ema': True, 'use_spike': True, 'rsi_required': False, 'edge_k': 0.5145291476029084, 'edge_cap': 0.5200689021804318, 'bull_strategy': 'breakout', 'bull_bb_std_mult': 0.7040106762430023, 'bull_rsi_os': 49, 'bull_rsi_ob': 85, 'bull_adx_thresh': 6.060785953049059, 'bull_atr_min_pct': 0.005575100091516001, 'bull_atr_max_pct': 0.0993403294361277, 'bull_tp_mult': 1.897067124373088, 'bull_tsl_mult': 0.40055967310554585, 'bull_time_stop': 280, 'bull_use_sma': False, 'bull_use_ema': True, 'bull_use_atr': False, 'bull_use_adx': False, 'bull_use_spike': False, 'bull_rsi_required': True, 'bear_strategy': 'breakout', 'bear_bb_std_mult': 3.136292699679544, 'bear_rsi_os': 51, 'bear_rsi_ob': 75, 'bear_adx_thresh': 5.4986187314264265, 'bear_atr_min_pct': 0.0017355282138994, 'bear_atr_max_pct': 0.14325702451726988, 'bear_tp_mult': 2.913041881231561, 'bear_tsl_mult': 0.7149594426774781, 'bear_time_stop': 31, 'bear_use_sma': False, 'bear_use_ema': True, 'bear_use_atr': False, 'bear_use_adx': False, 'bear_use_spike': False, 'bear_rsi_required': False, 'sideways_strategy': 'breakout', 'sideways_bb_std_mult': 3.181647952817135, 'sideways_rsi_os': 25, 'sideways_rsi_ob': 94, 'sideways_adx_thresh': 15.03208309421343, 'sideways_atr_min_pct': 0.016894137568322046, 'sideways_atr_max_pct': 0.041707695385888664, 'sideways_tp_mult': 1.9507795517697517, 'sideways_tsl_mult': 0.3973772018458189, 'sideways_time_stop': 5, 'sideways_use_sma': True, 'sideways_use_ema': False, 'sideways_use_atr': True, 'sideways_use_adx': True, 'sideways_use_spike': True, 'sideways_rsi_required': True}.
[I 2025-08-31 11:30:19,569] Trial 734 finished with values: [-1000000000.0, 1000000000.0] and parameters: {'p_sma': 7, 'p_std': 36, 'p_atr': 12, 'p_adx': 13, 'rsi_period': 53, 'ema1': 12, 'ema2': 43, 'slip_atr_k': 0.031203277547591925, 'slip_spread_k': 0.14871672457950624, 'spread_hl_frac': 0.007784462150308142, 'bb_std_mult': 2.762062625528085, 'rsi_os': 28, 'rsi_ob': 95, 'vol_spike': 0.2742907932838957, 'adx_thresh': 31.568497427364683, 'atr_min_pct': 0.011935481080780746, 'atr_max_pct': 0.14576095482575618, 'tp_mult': 1.6779182570088582, 'tsl_mult': 0.045440665306559366, 'strategy': 'mean_reversion', 'time_stop': 208, 'use_sma': True, 'use_atr': False, 'use_adx': True, 'use_ema': True, 'use_spike': True, 'rsi_required': False, 'edge_k': 0.36701714933707574, 'edge_cap': 0.5209776324068315, 'bull_strategy': 'mean_reversion', 'bull_bb_std_mult': 1.4027960236705375, 'bull_rsi_os': 37, 'bull_rsi_ob': 84, 'bull_adx_thresh': 5.6387107288513105, 'bull_atr_min_pct': 0.005892150274554232, 'bull_atr_max_pct': 0.09904021298003968, 'bull_tp_mult': 1.8738104453959419, 'bull_tsl_mult': 0.4060365952015015, 'bull_time_stop': 277, 'bull_use_sma': False, 'bull_use_ema': True, 'bull_use_atr': False, 'bull_use_adx': False, 'bull_use_spike': False, 'bull_rsi_required': True, 'bear_strategy': 'breakout', 'bear_bb_std_mult': 3.293532203128474, 'bear_rsi_os': 53, 'bear_rsi_ob': 75, 'bear_adx_thresh': 6.454910830699621, 'bear_atr_min_pct': 0.004555324879160817, 'bear_atr_max_pct': 0.14293542804357884, 'bear_tp_mult': 2.617470850337562, 'bear_tsl_mult': 0.712811785622907, 'bear_time_stop': 31, 'bear_use_sma': False, 'bear_use_ema': True, 'bear_use_atr': False, 'bear_use_adx': False, 'bear_use_spike': False, 'bear_rsi_required': False, 'sideways_strategy': 'breakout', 'sideways_bb_std_mult': 2.8041984040294143, 'sideways_rsi_os': 24, 'sideways_rsi_ob': 93, 'sideways_adx_thresh': 12.239929764153656, 'sideways_atr_min_pct': 0.01709711009052057, 'sideways_atr_max_pct': 0.04211501201628197, 'sideways_tp_mult': 1.9570687335434733, 'sideways_tsl_mult': 0.351150983028136, 'sideways_time_stop': 9, 'sideways_use_sma': True, 'sideways_use_ema': False, 'sideways_use_atr': True, 'sideways_use_adx': True, 'sideways_use_spike': True, 'sideways_rsi_required': True}.
[I 2025-08-31 11:30:19,685] Trial 735 finished with values: [-0.08001915908971191, 0.0796772646783653] and parameters: {'p_sma': 12, 'p_std': 34, 'p_atr': 12, 'p_adx': 13, 'rsi_period': 52, 'ema1': 12, 'ema2': 43, 'slip_atr_k': 0.2116003369075371, 'slip_spread_k': 0.21953911767960974, 'spread_hl_frac': 0.007291394950100974, 'bb_std_mult': 2.7574185729426723, 'rsi_os': 32, 'rsi_ob': 95, 'vol_spike': 0.27158315403683403, 'adx_thresh': 31.658535989918903, 'atr_min_pct': 0.011773383155777315, 'atr_max_pct': 0.1445718446380669, 'tp_mult': 1.680470344378652, 'tsl_mult': 0.10314249893453323, 'strategy': 'mean_reversion', 'time_stop': 194, 'use_sma': False, 'use_atr': False, 'use_adx': True, 'use_ema': True, 'use_spike': True, 'rsi_required': False, 'edge_k': 0.4068700761415632, 'edge_cap': 0.5175014655753359, 'bull_strategy': 'mean_reversion', 'bull_bb_std_mult': 0.7193769190663863, 'bull_rsi_os': 44, 'bull_rsi_ob': 85, 'bull_adx_thresh': 5.58420873706477, 'bull_atr_min_pct': 0.004069316119820225, 'bull_atr_max_pct': 0.04871399296737981, 'bull_tp_mult': 1.8723271268113137, 'bull_tsl_mult': 0.6892460105499185, 'bull_time_stop': 278, 'bull_use_sma': False, 'bull_use_ema': True, 'bull_use_atr': False, 'bull_use_adx': False, 'bull_use_spike': False, 'bull_rsi_required': True, 'bear_strategy': 'breakout', 'bear_bb_std_mult': 3.2781687149269634, 'bear_rsi_os': 53, 'bear_rsi_ob': 75, 'bear_adx_thresh': 5.350662526601914, 'bear_atr_min_pct': 0.0020297463593308292, 'bear_atr_max_pct': 0.14293672912446806, 'bear_tp_mult': 1.5156542240134536, 'bear_tsl_mult': 0.8079556629917626, 'bear_time_stop': 31, 'bear_use_sma': True, 'bear_use_ema': True, 'bear_use_atr': False, 'bear_use_adx': False, 'bear_use_spike': False, 'bear_rsi_required': False, 'sideways_strategy': 'breakout', 'sideways_bb_std_mult': 2.8232993895216065, 'sideways_rsi_os': 24, 'sideways_rsi_ob': 93, 'sideways_adx_thresh': 9.209306047797083, 'sideways_atr_min_pct': 0.01704924654133065, 'sideways_atr_max_pct': 0.04384818440686866, 'sideways_tp_mult': 1.9553867061131673, 'sideways_tsl_mult': 0.36379509499908863, 'sideways_time_stop': 12, 'sideways_use_sma': True, 'sideways_use_ema': False, 'sideways_use_atr': True, 'sideways_use_adx': True, 'sideways_use_spike': True, 'sideways_rsi_required': True}.
[I 2025-08-31 11:30:53,312] Trial 736 finished with values: [-0.03020081711324185, 0.03065358719815207] and parameters: {'p_sma': 12, 'p_std': 36, 'p_atr': 10, 'p_adx': 13, 'rsi_period': 51, 'ema1': 12, 'ema2': 45, 'slip_atr_k': 0.02598690356507765, 'slip_spread_k': 0.1887860032251195, 'spread_hl_frac': 0.0075538556839169395, 'bb_std_mult': 2.7536202670489893, 'rsi_os': 28, 'rsi_ob': 95, 'vol_spike': 0.2733361894494155, 'adx_thresh': 33.30307891921319, 'atr_min_pct': 0.011829463633136306, 'atr_max_pct': 0.14489589199375877, 'tp_mult': 1.7028741795527669, 'tsl_mult': 0.04521058395215383, 'strategy': 'mean_reversion', 'time_stop': 196, 'use_sma': False, 'use_atr': False, 'use_adx': True, 'use_ema': True, 'use_spike': True, 'rsi_required': False, 'edge_k': 0.38061045591435944, 'edge_cap': 0.524475485614144, 'bull_strategy': 'mean_reversion', 'bull_bb_std_mult': 1.4393208505119617, 'bull_rsi_os': 13, 'bull_rsi_ob': 84, 'bull_adx_thresh': 5.526042674245692, 'bull_atr_min_pct': 0.020349004806506442, 'bull_atr_max_pct': 0.10580568957784987, 'bull_tp_mult': 1.8649381019173203, 'bull_tsl_mult': 0.4028920835498255, 'bull_time_stop': 279, 'bull_use_sma': False, 'bull_use_ema': True, 'bull_use_atr': False, 'bull_use_adx': False, 'bull_use_spike': False, 'bull_rsi_required': True, 'bear_strategy': 'breakout', 'bear_bb_std_mult': 3.3041896365186756, 'bear_rsi_os': 53, 'bear_rsi_ob': 74, 'bear_adx_thresh': 5.459342684307344, 'bear_atr_min_pct': 0.002708128704500193, 'bear_atr_max_pct': 0.13983125173305064, 'bear_tp_mult': 1.5048748195418367, 'bear_tsl_mult': 0.8039525388422623, 'bear_time_stop': 31, 'bear_use_sma': True, 'bear_use_ema': True, 'bear_use_atr': False, 'bear_use_adx': False, 'bear_use_spike': False, 'bear_rsi_required': False, 'sideways_strategy': 'breakout', 'sideways_bb_std_mult': 3.1858271450653746, 'sideways_rsi_os': 24, 'sideways_rsi_ob': 93, 'sideways_adx_thresh': 12.013427404636985, 'sideways_atr_min_pct': 0.016902806998764328, 'sideways_atr_max_pct': 0.04881391291349851, 'sideways_tp_mult': 1.9437223257031648, 'sideways_tsl_mult': 0.36229464831377556, 'sideways_time_stop': 11, 'sideways_use_sma': True, 'sideways_use_ema': False, 'sideways_use_atr': True, 'sideways_use_adx': True, 'sideways_use_spike': True, 'sideways_rsi_required': True}.
[I 2025-08-31 11:30:53,663] Trial 739 finished with values: [-0.025613352929691247, 0.027668593375931676] and parameters: {'p_sma': 14, 'p_std': 31, 'p_atr': 8, 'p_adx': 7, 'rsi_period': 51, 'ema1': 11, 'ema2': 46, 'slip_atr_k': 0.15467434579121286, 'slip_spread_k': 0.18508022354605785, 'spread_hl_frac': 0.006476165307458272, 'bb_std_mult': 3.186738642458998, 'rsi_os': 28, 'rsi_ob': 92, 'vol_spike': 0.27714287696400813, 'adx_thresh': 32.3518618503472, 'atr_min_pct': 0.012353567535555708, 'atr_max_pct': 0.141116073814923, 'tp_mult': 1.7382086016715952, 'tsl_mult': 0.04877019294551252, 'strategy': 'breakout', 'time_stop': 214, 'use_sma': False, 'use_atr': False, 'use_adx': True, 'use_ema': True, 'use_spike': True, 'rsi_required': False, 'edge_k': 0.40984043279783466, 'edge_cap': 0.4951109260509054, 'bull_strategy': 'breakout', 'bull_bb_std_mult': 1.5632664170944695, 'bull_rsi_os': 25, 'bull_rsi_ob': 83, 'bull_adx_thresh': 5.505977991990756, 'bull_atr_min_pct': 0.00442757723135892, 'bull_atr_max_pct': 0.10542005337429358, 'bull_tp_mult': 1.8021442857791867, 'bull_tsl_mult': 0.8972399122100125, 'bull_time_stop': 296, 'bull_use_sma': False, 'bull_use_ema': True, 'bull_use_atr': False, 'bull_use_adx': False, 'bull_use_spike': False, 'bull_rsi_required': True, 'bear_strategy': 'breakout', 'bear_bb_std_mult': 3.038079863777513, 'bear_rsi_os': 52, 'bear_rsi_ob': 73, 'bear_adx_thresh': 6.446187562368776, 'bear_atr_min_pct': 0.0049320025061991134, 'bear_atr_max_pct': 0.1397610765755079, 'bear_tp_mult': 2.817508017196, 'bear_tsl_mult': 0.797885365936663, 'bear_time_stop': 46, 'bear_use_sma': True, 'bear_use_ema': False, 'bear_use_atr': False, 'bear_use_adx': False, 'bear_use_spike': False, 'bear_rsi_required': True, 'sideways_strategy': 'breakout', 'sideways_bb_std_mult': 2.76962274490222, 'sideways_rsi_os': 27, 'sideways_rsi_ob': 73, 'sideways_adx_thresh': 11.856167511264406, 'sideways_atr_min_pct': 0.01628503733137257, 'sideways_atr_max_pct': 0.04760521307752568, 'sideways_tp_mult': 1.2011569427516848, 'sideways_tsl_mult': 0.38251833916814904, 'sideways_time_stop': 12, 'sideways_use_sma': False, 'sideways_use_ema': False, 'sideways_use_atr': True, 'sideways_use_adx': False, 'sideways_use_spike': True, 'sideways_rsi_required': True}.
