[I 2025-08-31 09:55:54,680] Trial 6 finished with values: [-1000000000.0, 1000000000.0] and parameters: {'p_sma': 9, 'p_std': 19, 'p_atr': 30, 'p_adx': 19, 'rsi_period': 66, 'ema1': 9, 'ema2': 28, 'slip_atr_k': 0.22716989302439308, 'slip_spread_k': 0.9850461846539017, 'spread_hl_frac': 0.03268033919367585, 'bb_std_mult': 1.7187882324624477, 'rsi_os': 13, 'rsi_ob': 85, 'vol_spike': 0.07676466741870663, 'adx_thresh': 27.624547004507384, 'atr_min_pct': 0.010412867303424667, 'atr_max_pct': 0.03430860223176508, 'tp_mult': 1.062564467290724, 'tsl_mult': 0.8034255429675431, 'strategy': 'breakout', 'time_stop': 116, 'use_sma': True, 'use_atr': False, 'use_adx': True, 'use_ema': True, 'use_spike': False, 'rsi_required': False, 'edge_k': 0.3314746415776517, 'edge_cap': 0.36490584970378365, 'bull_strategy': 'breakout', 'bull_bb_std_mult': 2.515294341830331, 'bull_rsi_os': 28, 'bull_rsi_ob': 86, 'bull_adx_thresh': 34.8577910743769, 'bull_atr_min_pct': 0.025887119148641412, 'bull_atr_max_pct': 0.14980207170749393, 'bull_tp_mult': 2.4349451154160544, 'bull_tsl_mult': 0.11940961050021714, 'bull_time_stop': 160, 'bull_use_sma': False, 'bull_use_ema': False, 'bull_use_atr': True, 'bull_use_adx': True, 'bull_use_spike': True, 'bull_rsi_required': False, 'bear_strategy': 'mean_reversion', 'bear_bb_std_mult': 0.755397592933755, 'bear_rsi_os': 32, 'bear_rsi_ob': 73, 'bear_adx_thresh': 11.178435666871252, 'bear_atr_min_pct': 0.027485363873479978, 'bear_atr_max_pct': 0.037876056850751676, 'bear_tp_mult': 2.327775533641755, 'bear_tsl_mult': 0.12656134351918547, 'bear_time_stop': 298, 'bear_use_sma': True, 'bear_use_ema': False, 'bear_use_atr': False, 'bear_use_adx': False, 'bear_use_spike': True, 'bear_rsi_required': True, 'sideways_strategy': 'breakout', 'sideways_bb_std_mult': 1.4281925635858295, 'sideways_rsi_os': 21, 'sideways_rsi_ob': 84, 'sideways_adx_thresh': 14.765100829341703, 'sideways_atr_min_pct': 0.007614494779399855, 'sideways_atr_max_pct': 0.08023702670549603, 'sideways_tp_mult': 2.9363355536237257, 'sideways_tsl_mult': 0.1455863807359895, 'sideways_time_stop': 289, 'sideways_use_sma': False, 'sideways_use_ema': False, 'sideways_use_atr': True, 'sideways_use_adx': True, 'sideways_use_spike': True, 'sideways_rsi_required': True}.
[I 2025-08-31 09:55:55,055] Trial 7 finished with values: [-1000000000.0, 1000000000.0] and parameters: {'p_sma': 36, 'p_std': 40, 'p_atr': 13, 'p_adx': 11, 'rsi_period': 72, 'ema1': 29, 'ema2': 44, 'slip_atr_k': 0.09600883200858637, 'slip_spread_k': 0.3158819746969296, 'spread_hl_frac': 0.03964465507616758, 'bb_std_mult': 1.9942476579598103, 'rsi_os': 54, 'rsi_ob': 68, 'vol_spike': 0.24116304252488996, 'adx_thresh': 15.845908327396073, 'atr_min_pct': 0.019538950517002295, 'atr_max_pct': 0.04593360769427466, 'tp_mult': 1.3501048537352873, 'tsl_mult': 0.535207839475748, 'strategy': 'breakout', 'time_stop': 97, 'use_sma': False, 'use_atr': False, 'use_adx': False, 'use_ema': False, 'use_spike': True, 'rsi_required': False, 'edge_k': 1.0772608481883221, 'edge_cap': 0.7402848301120927, 'bull_strategy': 'mean_reversion', 'bull_bb_std_mult': 3.4832056151471757, 'bull_rsi_os': 16, 'bull_rsi_ob': 79, 'bull_adx_thresh': 16.555984387674442, 'bull_atr_min_pct': 0.015969418285656675, 'bull_atr_max_pct': 0.0633640904170734, 'bull_tp_mult': 1.9513945256426866, 'bull_tsl_mult': 0.1469914806773993, 'bull_time_stop': 106, 'bull_use_sma': False, 'bull_use_ema': True, 'bull_use_atr': False, 'bull_use_adx': False, 'bull_use_spike': False, 'bull_rsi_required': True, 'bear_strategy': 'breakout', 'bear_bb_std_mult': 0.9675318153145093, 'bear_rsi_os': 45, 'bear_rsi_ob': 92, 'bear_adx_thresh': 24.58208054906087, 'bear_atr_min_pct': 0.005114572132326168, 'bear_atr_max_pct': 0.1221226547634242, 'bear_tp_mult': 2.118359891948921, 'bear_tsl_mult': 0.14943212934125982, 'bear_time_stop': 35, 'bear_use_sma': True, 'bear_use_ema': False, 'bear_use_atr': True, 'bear_use_adx': False, 'bear_use_spike': False, 'bear_rsi_required': True, 'sideways_strategy': 'mean_reversion', 'sideways_bb_std_mult': 0.9953515440791736, 'sideways_rsi_os': 13, 'sideways_rsi_ob': 65, 'sideways_adx_thresh': 12.019554826125596, 'sideways_atr_min_pct': 0.0016316068555619222, 'sideways_atr_max_pct': 0.14582412504698689, 'sideways_tp_mult': 1.5680184968003705, 'sideways_tsl_mult': 0.9523166180171238, 'sideways_time_stop': 54, 'sideways_use_sma': False, 'sideways_use_ema': True, 'sideways_use_atr': False, 'sideways_use_adx': True, 'sideways_use_spike': False, 'sideways_rsi_required': False}.
[I 2025-08-31 09:55:55,349] Trial 11 finished with values: [-1000000000.0, 1000000000.0] and parameters: {'p_sma': 30, 'p_std': 49, 'p_atr': 17, 'p_adx': 26, 'rsi_period': 23, 'ema1': 15, 'ema2': 51, 'slip_atr_k': 0.20763757704915914, 'slip_spread_k': 0.7366542728969584, 'spread_hl_frac': 0.0018201477928689758, 'bb_std_mult': 0.76103081520785, 'rsi_os': 29, 'rsi_ob': 77, 'vol_spike': 0.11676454010442604, 'adx_thresh': 28.239342283904772, 'atr_min_pct': 0.002351648795129758, 'atr_max_pct': 0.024332332104551116, 'tp_mult': 2.940999803731795, 'tsl_mult': 0.8136869881766785, 'strategy': 'mean_reversion', 'time_stop': 86, 'use_sma': False, 'use_atr': False, 'use_adx': False, 'use_ema': True, 'use_spike': True, 'rsi_required': False, 'edge_k': 1.1373951119556127, 'edge_cap': 0.42919895952022474, 'bull_strategy': 'mean_reversion', 'bull_bb_std_mult': 2.457110370583433, 'bull_rsi_os': 10, 'bull_rsi_ob': 52, 'bull_adx_thresh': 9.71951846871592, 'bull_atr_min_pct': 0.008612424101295849, 'bull_atr_max_pct': 0.024267877837842306, 'bull_tp_mult': 1.6482824653449217, 'bull_tsl_mult': 0.1494136485408849, 'bull_time_stop': 266, 'bull_use_sma': True, 'bull_use_ema': True, 'bull_use_atr': False, 'bull_use_adx': False, 'bull_use_spike': True, 'bull_rsi_required': True, 'bear_strategy': 'breakout', 'bear_bb_std_mult': 1.5124048635298395, 'bear_rsi_os': 54, 'bear_rsi_ob': 70, 'bear_adx_thresh': 20.074017832315164, 'bear_atr_min_pct': 0.012771414510751452, 'bear_atr_max_pct': 0.10701887634478192, 'bear_tp_mult': 1.8841749444553564, 'bear_tsl_mult': 0.15071532064078075, 'bear_time_stop': 294, 'bear_use_sma': False, 'bear_use_ema': True, 'bear_use_atr': False, 'bear_use_adx': False, 'bear_use_spike': True, 'bear_rsi_required': True, 'sideways_strategy': 'breakout', 'sideways_bb_std_mult': 1.1929041601254942, 'sideways_rsi_os': 8, 'sideways_rsi_ob': 84, 'sideways_adx_thresh': 30.826254805394413, 'sideways_atr_min_pct': 0.021096539598893037, 'sideways_atr_max_pct': 0.05265506036475313, 'sideways_tp_mult': 2.8855093956696387, 'sideways_tsl_mult': 0.06821138066712396, 'sideways_time_stop': 40, 'sideways_use_sma': True, 'sideways_use_ema': True, 'sideways_use_atr': False, 'sideways_use_adx': True, 'sideways_use_spike': False, 'sideways_rsi_required': True}.
[I 2025-08-31 09:55:55,354] Trial 13 finished with values: [-1000000000.0, 1000000000.0] and parameters: {'p_sma': 47, 'p_std': 30, 'p_atr': 23, 'p_adx': 19, 'rsi_period': 8, 'ema1': 14, 'ema2': 21, 'slip_atr_k': 0.11437429811675984, 'slip_spread_k': 0.0148072954954169, 'spread_hl_frac': 0.0003047102777885592, 'bb_std_mult': 0.8760033937154929, 'rsi_os': 54, 'rsi_ob': 74, 'vol_spike': 0.011752304604076088, 'adx_thresh': 10.85431522578748, 'atr_min_pct': 0.022775614483158457, 'atr_max_pct': 0.06685588638603206, 'tp_mult': 2.765564497243874, 'tsl_mult': 0.3295470610544885, 'strategy': 'mean_reversion', 'time_stop': 293, 'use_sma': True, 'use_atr': False, 'use_adx': False, 'use_ema': False, 'use_spike': True, 'rsi_required': True, 'edge_k': 1.9882347926830057, 'edge_cap': 0.42431328664753476, 'bull_strategy': 'breakout', 'bull_bb_std_mult': 3.47178971715096, 'bull_rsi_os': 55, 'bull_rsi_ob': 75, 'bull_adx_thresh': 5.236162817186344, 'bull_atr_min_pct': 0.0002746467331923054, 'bull_atr_max_pct': 0.014731167130631537, 'bull_tp_mult': 1.6022611271269915, 'bull_tsl_mult': 0.9362902944736408, 'bull_time_stop': 53, 'bull_use_sma': True, 'bull_use_ema': True, 'bull_use_atr': False, 'bull_use_adx': True, 'bull_use_spike': True, 'bull_rsi_required': False, 'bear_strategy': 'breakout', 'bear_bb_std_mult': 3.566100322501314, 'bear_rsi_os': 21, 'bear_rsi_ob': 95, 'bear_adx_thresh': 5.411798403390687, 'bear_atr_min_pct': 0.017565383890477973, 'bear_atr_max_pct': 0.14049878229422796, 'bear_tp_mult': 1.1873216731787215, 'bear_tsl_mult': 0.9199287314583657, 'bear_time_stop': 8, 'bear_use_sma': True, 'bear_use_ema': False, 'bear_use_atr': False, 'bear_use_adx': False, 'bear_use_spike': True, 'bear_rsi_required': False, 'sideways_strategy': 'mean_reversion', 'sideways_bb_std_mult': 3.417664291590281, 'sideways_rsi_os': 5, 'sideways_rsi_ob': 57, 'sideways_adx_thresh': 5.371628857227314, 'sideways_atr_min_pct': 0.0007207212381149788, 'sideways_atr_max_pct': 0.14551238044790113, 'sideways_tp_mult': 2.048711194561142, 'sideways_tsl_mult': 0.3973377254414191, 'sideways_time_stop': 231, 'sideways_use_sma': True, 'sideways_use_ema': True, 'sideways_use_atr': False, 'sideways_use_adx': True, 'sideways_use_spike': False, 'sideways_rsi_required': True}.
[I 2025-08-31 09:56:27,930] Trial 16 finished with values: [-0.027516880638945973, 0.027388084060076014] and parameters: {'p_sma': 6, 'p_std': 11, 'p_atr': 12, 'p_adx': 30, 'rsi_period': 84, 'ema1': 5, 'ema2': 24, 'slip_atr_k': 0.24985852737452413, 'slip_spread_k': 0.06684976027513129, 'spread_hl_frac': 0.016151533803841864, 'bb_std_mult': 1.4026755038097594, 'rsi_os': 17, 'rsi_ob': 95, 'vol_spike': 0.18743327465351944, 'adx_thresh': 8.213322774495463, 'atr_min_pct': 0.028954357674200258, 'atr_max_pct': 0.14515552416142602, 'tp_mult': 2.437891799903637, 'tsl_mult': 0.995690656368508, 'strategy': 'mean_reversion', 'time_stop': 6, 'use_sma': True, 'use_atr': False, 'use_adx': True, 'use_ema': False, 'use_spike': False, 'rsi_required': True, 'edge_k': 1.444552088821256, 'edge_cap': 0.06066846603248682, 'bull_strategy': 'breakout', 'bull_bb_std_mult': 2.8597636119951755, 'bull_rsi_os': 6, 'bull_rsi_ob': 62, 'bull_adx_thresh': 16.297162355143552, 'bull_atr_min_pct': 0.00028153670292118023, 'bull_atr_max_pct': 0.08220569863721536, 'bull_tp_mult': 2.82957676028687, 'bull_tsl_mult': 0.6428348054654082, 'bull_time_stop': 15, 'bull_use_sma': False, 'bull_use_ema': False, 'bull_use_atr': True, 'bull_use_adx': True, 'bull_use_spike': False, 'bull_rsi_required': False, 'bear_strategy': 'mean_reversion', 'bear_bb_std_mult': 2.398693893548384, 'bear_rsi_os': 23, 'bear_rsi_ob': 58, 'bear_adx_thresh': 33.48152441669316, 'bear_atr_min_pct': 0.022512593428255182, 'bear_atr_max_pct': 0.01580590506807515, 'bear_tp_mult': 2.9875910706847617, 'bear_tsl_mult': 0.383123663859305, 'bear_time_stop': 219, 'bear_use_sma': True, 'bear_use_ema': True, 'bear_use_atr': True, 'bear_use_adx': True, 'bear_use_spike': True, 'bear_rsi_required': False, 'sideways_strategy': 'mean_reversion', 'sideways_bb_std_mult': 3.395656551384703, 'sideways_rsi_os': 39, 'sideways_rsi_ob': 47, 'sideways_adx_thresh': 21.898713970638084, 'sideways_atr_min_pct': 0.02721650121840421, 'sideways_atr_max_pct': 0.11562639998408432, 'sideways_tp_mult': 1.681303366332, 'sideways_tsl_mult': 0.29290756551632224, 'sideways_time_stop': 127, 'sideways_use_sma': True, 'sideways_use_ema': False, 'sideways_use_atr': False, 'sideways_use_adx': False, 'sideways_use_spike': False, 'sideways_rsi_required': False}.
[I 2025-08-31 09:56:28,289] Trial 12 finished with values: [-0.058041034074466924, 0.05773142303864843] and parameters: {'p_sma': 34, 'p_std': 24, 'p_atr': 28, 'p_adx': 23, 'rsi_period': 7, 'ema1': 11, 'ema2': 45, 'slip_atr_k': 0.0950198379260831, 'slip_spread_k': 0.7272558005942512, 'spread_hl_frac': 0.04065013739803481, 'bb_std_mult': 1.0559437668058593, 'rsi_os': 27, 'rsi_ob': 67, 'vol_spike': 0.2694859774096337, 'adx_thresh': 20.44311859748651, 'atr_min_pct': 0.023430494453929175, 'atr_max_pct': 0.12723570943526075, 'tp_mult': 2.227698569934942, 'tsl_mult': 0.518583321922702, 'strategy': 'mean_reversion', 'time_stop': 34, 'use_sma': False, 'use_atr': True, 'use_adx': True, 'use_ema': True, 'use_spike': True, 'rsi_required': True, 'edge_k': 1.9978192205926228, 'edge_cap': 0.2020323281754035, 'bull_strategy': 'breakout', 'bull_bb_std_mult': 3.4190252600231514, 'bull_rsi_os': 22, 'bull_rsi_ob': 67, 'bull_adx_thresh': 20.989510409692134, 'bull_atr_min_pct': 0.005550242370321021, 'bull_atr_max_pct': 0.09595415803101717, 'bull_tp_mult': 1.2943657681563567, 'bull_tsl_mult': 0.8647364605693079, 'bull_time_stop': 12, 'bull_use_sma': False, 'bull_use_ema': True, 'bull_use_atr': True, 'bull_use_adx': False, 'bull_use_spike': False, 'bull_rsi_required': False, 'bear_strategy': 'mean_reversion', 'bear_bb_std_mult': 1.6290455371119823, 'bear_rsi_os': 54, 'bear_rsi_ob': 75, 'bear_adx_thresh': 11.654581339076174, 'bear_atr_min_pct': 0.0016589623661208807, 'bear_atr_max_pct': 0.1203372837739789, 'bear_tp_mult': 1.699588770508779, 'bear_tsl_mult': 0.4496000842122021, 'bear_time_stop': 300, 'bear_use_sma': True, 'bear_use_ema': True, 'bear_use_atr': True, 'bear_use_adx': True, 'bear_use_spike': False, 'bear_rsi_required': False, 'sideways_strategy': 'mean_reversion', 'sideways_bb_std_mult': 3.490640493880691, 'sideways_rsi_os': 17, 'sideways_rsi_ob': 45, 'sideways_adx_thresh': 29.624497373967642, 'sideways_atr_min_pct': 0.021383539778777185, 'sideways_atr_max_pct': 0.09368457208473313, 'sideways_tp_mult': 1.427362185038648, 'sideways_tsl_mult': 0.017653578874848308, 'sideways_time_stop': 104, 'sideways_use_sma': True, 'sideways_use_ema': True, 'sideways_use_atr': False, 'sideways_use_adx': False, 'sideways_use_spike': True, 'sideways_rsi_required': False}.
[I 2025-08-31 09:56:28,592] Trial 14 finished with values: [-0.025534697136542328, 0.025360862839410032] and parameters: {'p_sma': 7, 'p_std': 5, 'p_atr': 23, 'p_adx': 30, 'rsi_period': 10, 'ema1': 14, 'ema2': 23, 'slip_atr_k': 0.13710500246381271, 'slip_spread_k': 0.04687963808477813, 'spread_hl_frac': 0.005756683706626582, 'bb_std_mult': 0.6073480193114367, 'rsi_os': 20, 'rsi_ob': 75, 'vol_spike': 0.0025514852481293704, 'adx_thresh': 5.126608075498552, 'atr_min_pct': 0.021981163668299223, 'atr_max_pct': 0.13846474870852682, 'tp_mult': 2.9805677733947284, 'tsl_mult': 0.3144458855620579, 'strategy': 'mean_reversion', 'time_stop': 6, 'use_sma': True, 'use_atr': False, 'use_adx': False, 'use_ema': False, 'use_spike': True, 'rsi_required': True, 'edge_k': 1.9636505958890949, 'edge_cap': 0.05155367901840707, 'bull_strategy': 'breakout', 'bull_bb_std_mult': 2.806719097123374, 'bull_rsi_os': 5, 'bull_rsi_ob': 49, 'bull_adx_thresh': 14.177375070127233, 'bull_atr_min_pct': 0.0004980748158756199, 'bull_atr_max_pct': 0.013262535055156996, 'bull_tp_mult': 1.6564094924133135, 'bull_tsl_mult': 0.9651439813731739, 'bull_time_stop': 16, 'bull_use_sma': False, 'bull_use_ema': True, 'bull_use_atr': False, 'bull_use_adx': True, 'bull_use_spike': True, 'bull_rsi_required': False, 'bear_strategy': 'breakout', 'bear_bb_std_mult': 1.823003986818417, 'bear_rsi_os': 21, 'bear_rsi_ob': 58, 'bear_adx_thresh': 34.16771051578452, 'bear_atr_min_pct': 0.017632382135529614, 'bear_atr_max_pct': 0.14550035552761403, 'bear_tp_mult': 1.0610842747760518, 'bear_tsl_mult': 0.9860617343218829, 'bear_time_stop': 223, 'bear_use_sma': True, 'bear_use_ema': True, 'bear_use_atr': False, 'bear_use_adx': True, 'bear_use_spike': True, 'bear_rsi_required': False, 'sideways_strategy': 'mean_reversion', 'sideways_bb_std_mult': 3.544144329699913, 'sideways_rsi_os': 5, 'sideways_rsi_ob': 48, 'sideways_adx_thresh': 5.48482518944965, 'sideways_atr_min_pct': 0.029518812833618555, 'sideways_atr_max_pct': 0.14654809960540788, 'sideways_tp_mult': 2.1548981112280416, 'sideways_tsl_mult': 0.35627765694292235, 'sideways_time_stop': 177, 'sideways_use_sma': True, 'sideways_use_ema': False, 'sideways_use_atr': False, 'sideways_use_adx': True, 'sideways_use_spike': False, 'sideways_rsi_required': True}.
[I 2025-08-31 09:56:28,708] Trial 15 finished with values: [-1000000000.0, 1000000000.0] and parameters: {'p_sma': 6, 'p_std': 6, 'p_atr': 23, 'p_adx': 30, 'rsi_period': 10, 'ema1': 24, 'ema2': 22, 'slip_atr_k': 0.2470827778695686, 'slip_spread_k': 0.06905833272832962, 'spread_hl_frac': 0.01490053488862703, 'bb_std_mult': 1.4363044881060727, 'rsi_os': 19, 'rsi_ob': 72, 'vol_spike': 0.20151844051105966, 'adx_thresh': 5.333560052798719, 'atr_min_pct': 0.02140978839800655, 'atr_max_pct': 0.14635775724532124, 'tp_mult': 2.8842931367631706, 'tsl_mult': 0.9984815324433356, 'strategy': 'mean_reversion', 'time_stop': 15, 'use_sma': True, 'use_atr': False, 'use_adx': False, 'use_ema': False, 'use_spike': False, 'rsi_required': True, 'edge_k': 1.5801391125883635, 'edge_cap': 0.06791963754156777, 'bull_strategy': 'breakout', 'bull_bb_std_mult': 2.9515335546112604, 'bull_rsi_os': 5, 'bull_rsi_ob': 45, 'bull_adx_thresh': 15.044175598007525, 'bull_atr_min_pct': 2.938838572625474e-05, 'bull_atr_max_pct': 0.014312522230231384, 'bull_tp_mult': 1.5086658030019677, 'bull_tsl_mult': 0.9791124235289463, 'bull_time_stop': 14, 'bull_use_sma': False, 'bull_use_ema': False, 'bull_use_atr': False, 'bull_use_adx': True, 'bull_use_spike': True, 'bull_rsi_required': False, 'bear_strategy': 'breakout', 'bear_bb_std_mult': 2.3174854098075075, 'bear_rsi_os': 23, 'bear_rsi_ob': 59, 'bear_adx_thresh': 32.88759941570742, 'bear_atr_min_pct': 0.018752939072615812, 'bear_atr_max_pct': 0.14837701170282186, 'bear_tp_mult': 1.0513312262208205, 'bear_tsl_mult': 0.9537966372917934, 'bear_time_stop': 209, 'bear_use_sma': True, 'bear_use_ema': True, 'bear_use_atr': False, 'bear_use_adx': True, 'bear_use_spike': True, 'bear_rsi_required': False, 'sideways_strategy': 'mean_reversion', 'sideways_bb_std_mult': 3.587459330954241, 'sideways_rsi_os': 38, 'sideways_rsi_ob': 45, 'sideways_adx_thresh': 5.693432032572213, 'sideways_atr_min_pct': 0.029930891216465045, 'sideways_atr_max_pct': 0.14867011695197124, 'sideways_tp_mult': 2.090483263414979, 'sideways_tsl_mult': 0.3380986586417675, 'sideways_time_stop': 199, 'sideways_use_sma': True, 'sideways_use_ema': False, 'sideways_use_atr': False, 'sideways_use_adx': True, 'sideways_use_spike': False, 'sideways_rsi_required': True}.
[I 2025-08-31 09:57:01,577] Trial 17 finished with values: [-0.04813702307518253, 0.04798274529970045] and parameters: {'p_sma': 7, 'p_std': 5, 'p_atr': 11, 'p_adx': 30, 'rsi_period': 55, 'ema1': 6, 'ema2': 21, 'slip_atr_k': 0.24631152738401207, 'slip_spread_k': 0.05918621102949118, 'spread_hl_frac': 0.01492000608741808, 'bb_std_mult': 1.29956062338585, 'rsi_os': 16, 'rsi_ob': 93, 'vol_spike': 0.18972233490517262, 'adx_thresh': 5.533264994182508, 'atr_min_pct': 0.02953981953225303, 'atr_max_pct': 0.14615566663335558, 'tp_mult': 2.4924509921372744, 'tsl_mult': 0.6206642747616441, 'strategy': 'mean_reversion', 'time_stop': 13, 'use_sma': True, 'use_atr': False, 'use_adx': True, 'use_ema': False, 'use_spike': False, 'rsi_required': True, 'edge_k': 1.6581080614844386, 'edge_cap': 0.06468607382917142, 'bull_strategy': 'breakout', 'bull_bb_std_mult': 2.9585303856858856, 'bull_rsi_os': 34, 'bull_rsi_ob': 63, 'bull_adx_thresh': 16.70819943221901, 'bull_atr_min_pct': 0.000762835599911271, 'bull_atr_max_pct': 0.08443371003678561, 'bull_tp_mult': 2.5978134296861866, 'bull_tsl_mult': 0.7383892633376092, 'bull_time_stop': 6, 'bull_use_sma': False, 'bull_use_ema': False, 'bull_use_atr': True, 'bull_use_adx': True, 'bull_use_spike': False, 'bull_rsi_required': False, 'bear_strategy': 'mean_reversion', 'bear_bb_std_mult': 2.3050290653238017, 'bear_rsi_os': 27, 'bear_rsi_ob': 58, 'bear_adx_thresh': 32.79112464079043, 'bear_atr_min_pct': 0.022419834038145677, 'bear_atr_max_pct': 0.012465420497577857, 'bear_tp_mult': 2.972993320687055, 'bear_tsl_mult': 0.37935945925759473, 'bear_time_stop': 218, 'bear_use_sma': True, 'bear_use_ema': True, 'bear_use_atr': True, 'bear_use_adx': True, 'bear_use_spike': True, 'bear_rsi_required': False, 'sideways_strategy': 'mean_reversion', 'sideways_bb_std_mult': 3.5294389551496796, 'sideways_rsi_os': 38, 'sideways_rsi_ob': 47, 'sideways_adx_thresh': 22.187509734839274, 'sideways_atr_min_pct': 0.029179251185145746, 'sideways_atr_max_pct': 0.1144552177035277, 'sideways_tp_mult': 1.602637777745616, 'sideways_tsl_mult': 0.3472031748135319, 'sideways_time_stop': 114, 'sideways_use_sma': True, 'sideways_use_ema': False, 'sideways_use_atr': False, 'sideways_use_adx': False, 'sideways_use_spike': False, 'sideways_rsi_required': False}.
