[I 2025-08-31 11:50:02,687] Trial 863 finished with values: [-1000000000.0, 1000000000.0] and parameters: {'p_sma': 14, 'p_std': 26, 'p_atr': 14, 'p_adx': 10, 'rsi_period': 56, 'ema1': 17, 'ema2': 40, 'slip_atr_k': 0.036314502118656805, 'slip_spread_k': 0.1655014527055145, 'spread_hl_frac': 0.005420654812053708, 'bb_std_mult': 2.2613756107419727, 'rsi_os': 35, 'rsi_ob': 93, 'vol_spike': 0.10513984126583334, 'adx_thresh': 30.056047931839576, 'atr_min_pct': 0.0130416424200439, 'atr_max_pct': 0.1397416858037536, 'tp_mult': 1.3920179429612471, 'tsl_mult': 0.40475082269715246, 'strategy': 'mean_reversion', 'time_stop': 283, 'use_sma': False, 'use_atr': True, 'use_adx': False, 'use_ema': True, 'use_spike': False, 'rsi_required': False, 'edge_k': 0.42870812049856943, 'edge_cap': 0.81737727804419, 'bull_strategy': 'breakout', 'bull_bb_std_mult': 0.6253217007179552, 'bull_rsi_os': 23, 'bull_rsi_ob': 84, 'bull_adx_thresh': 12.016405789684104, 'bull_atr_min_pct': 0.02123915059370239, 'bull_atr_max_pct': 0.0974576181567791, 'bull_tp_mult': 2.816361007889638, 'bull_tsl_mult': 0.8087690385534919, 'bull_time_stop': 284, 'bull_use_sma': False, 'bull_use_ema': True, 'bull_use_atr': True, 'bull_use_adx': False, 'bull_use_spike': False, 'bull_rsi_required': True, 'bear_strategy': 'mean_reversion', 'bear_bb_std_mult': 3.432778341522993, 'bear_rsi_os': 48, 'bear_rsi_ob': 70, 'bear_adx_thresh': 5.693027126328421, 'bear_atr_min_pct': 0.005202097693822849, 'bear_atr_max_pct': 0.14325141815529752, 'bear_tp_mult': 2.8832623226160203, 'bear_tsl_mult': 0.08590781844069534, 'bear_time_stop': 17, 'bear_use_sma': True, 'bear_use_ema': True, 'bear_use_atr': True, 'bear_use_adx': False, 'bear_use_spike': False, 'bear_rsi_required': True, 'sideways_strategy': 'breakout', 'sideways_bb_std_mult': 1.256210014607463, 'sideways_rsi_os': 22, 'sideways_rsi_ob': 95, 'sideways_adx_thresh': 12.080723233910094, 'sideways_atr_min_pct': 0.01692341055019468, 'sideways_atr_max_pct': 0.1475764897471442, 'sideways_tp_mult': 2.968597851957891, 'sideways_tsl_mult': 0.3822433013796264, 'sideways_time_stop': 19, 'sideways_use_sma': True, 'sideways_use_ema': False, 'sideways_use_atr': True, 'sideways_use_adx': False, 'sideways_use_spike': True, 'sideways_rsi_required': False}.
[I 2025-08-31 11:50:02,821] Trial 864 finished with values: [-1000000000.0, 1000000000.0] and parameters: {'p_sma': 43, 'p_std': 26, 'p_atr': 14, 'p_adx': 13, 'rsi_period': 55, 'ema1': 8, 'ema2': 43, 'slip_atr_k': 0.09362223598997156, 'slip_spread_k': 0.16442481641200163, 'spread_hl_frac': 0.005578484309035218, 'bb_std_mult': 2.2586624083878175, 'rsi_os': 31, 'rsi_ob': 91, 'vol_spike': 0.13237437850246092, 'adx_thresh': 23.978305260507163, 'atr_min_pct': 0.013407024740502736, 'atr_max_pct': 0.14033182258184235, 'tp_mult': 1.39213452474977, 'tsl_mult': 0.41171741047011556, 'strategy': 'mean_reversion', 'time_stop': 286, 'use_sma': False, 'use_atr': True, 'use_adx': False, 'use_ema': True, 'use_spike': True, 'rsi_required': False, 'edge_k': 0.4126151205903349, 'edge_cap': 0.8160812704176955, 'bull_strategy': 'breakout', 'bull_bb_std_mult': 0.6183108540301112, 'bull_rsi_os': 22, 'bull_rsi_ob': 90, 'bull_adx_thresh': 12.99253775598979, 'bull_atr_min_pct': 0.006432920036405972, 'bull_atr_max_pct': 0.09834023940973582, 'bull_tp_mult': 2.803137127124273, 'bull_tsl_mult': 0.787407815871334, 'bull_time_stop': 283, 'bull_use_sma': False, 'bull_use_ema': True, 'bull_use_atr': False, 'bull_use_adx': False, 'bull_use_spike': False, 'bull_rsi_required': True, 'bear_strategy': 'mean_reversion', 'bear_bb_std_mult': 3.212059613420546, 'bear_rsi_os': 49, 'bear_rsi_ob': 70, 'bear_adx_thresh': 28.344951451047038, 'bear_atr_min_pct': 0.028736631982043112, 'bear_atr_max_pct': 0.13878163273930166, 'bear_tp_mult': 2.866380031476078, 'bear_tsl_mult': 0.8347658007868797, 'bear_time_stop': 21, 'bear_use_sma': True, 'bear_use_ema': True, 'bear_use_atr': False, 'bear_use_adx': False, 'bear_use_spike': False, 'bear_rsi_required': True, 'sideways_strategy': 'breakout', 'sideways_bb_std_mult': 1.260863256694087, 'sideways_rsi_os': 44, 'sideways_rsi_ob': 95, 'sideways_adx_thresh': 10.749878924017253, 'sideways_atr_min_pct': 0.017090608050035788, 'sideways_atr_max_pct': 0.14959298596267656, 'sideways_tp_mult': 2.970912132200327, 'sideways_tsl_mult': 0.3817337931522107, 'sideways_time_stop': 20, 'sideways_use_sma': True, 'sideways_use_ema': False, 'sideways_use_atr': True, 'sideways_use_adx': False, 'sideways_use_spike': True, 'sideways_rsi_required': True}.
[I 2025-08-31 11:50:41,957] Trial 867 finished with values: [-1000000000.0, 1000000000.0] and parameters: {'p_sma': 57, 'p_std': 28, 'p_atr': 15, 'p_adx': 13, 'rsi_period': 38, 'ema1': 23, 'ema2': 17, 'slip_atr_k': 0.02843966735645939, 'slip_spread_k': 0.13396974378035564, 'spread_hl_frac': 0.049287773123638065, 'bb_std_mult': 2.1175047414514245, 'rsi_os': 31, 'rsi_ob': 71, 'vol_spike': 0.13239737585328004, 'adx_thresh': 15.905393069018299, 'atr_min_pct': 0.013561244526926591, 'atr_max_pct': 0.13675240589511506, 'tp_mult': 1.5619885960026554, 'tsl_mult': 0.7723309987946481, 'strategy': 'breakout', 'time_stop': 161, 'use_sma': True, 'use_atr': True, 'use_adx': False, 'use_ema': True, 'use_spike': True, 'rsi_required': False, 'edge_k': 0.40682126033276106, 'edge_cap': 0.7693718344130027, 'bull_strategy': 'breakout', 'bull_bb_std_mult': 1.2370803040898457, 'bull_rsi_os': 21, 'bull_rsi_ob': 80, 'bull_adx_thresh': 15.391392184839283, 'bull_atr_min_pct': 0.003234414681607643, 'bull_atr_max_pct': 0.12099701258105758, 'bull_tp_mult': 2.8671220961362387, 'bull_tsl_mult': 0.8386716286280053, 'bull_time_stop': 273, 'bull_use_sma': False, 'bull_use_ema': True, 'bull_use_atr': False, 'bull_use_adx': False, 'bull_use_spike': True, 'bull_rsi_required': True, 'bear_strategy': 'breakout', 'bear_bb_std_mult': 3.2730189549771995, 'bear_rsi_os': 46, 'bear_rsi_ob': 71, 'bear_adx_thresh': 5.003059877090086, 'bear_atr_min_pct': 0.024254195069655305, 'bear_atr_max_pct': 0.050287817260442916, 'bear_tp_mult': 2.5035565325928544, 'bear_tsl_mult': 0.8036856165324067, 'bear_time_stop': 22, 'bear_use_sma': False, 'bear_use_ema': False, 'bear_use_atr': False, 'bear_use_adx': False, 'bear_use_spike': False, 'bear_rsi_required': True, 'sideways_strategy': 'breakout', 'sideways_bb_std_mult': 2.266290803755171, 'sideways_rsi_os': 21, 'sideways_rsi_ob': 94, 'sideways_adx_thresh': 12.406058034798775, 'sideways_atr_min_pct': 0.017022277710988524, 'sideways_atr_max_pct': 0.07078636872074705, 'sideways_tp_mult': 2.919392431567765, 'sideways_tsl_mult': 0.44091398498133755, 'sideways_time_stop': 14, 'sideways_use_sma': False, 'sideways_use_ema': False, 'sideways_use_atr': True, 'sideways_use_adx': True, 'sideways_use_spike': True, 'sideways_rsi_required': True}.
[I 2025-08-31 11:50:42,478] Trial 868 finished with values: [-1000000000.0, 1000000000.0] and parameters: {'p_sma': 8, 'p_std': 30, 'p_atr': 14, 'p_adx': 13, 'rsi_period': 53, 'ema1': 23, 'ema2': 17, 'slip_atr_k': 0.02749649005022579, 'slip_spread_k': 0.1245085243093963, 'spread_hl_frac': 0.03885690481932072, 'bb_std_mult': 2.3392112822393476, 'rsi_os': 31, 'rsi_ob': 52, 'vol_spike': 0.11918979438549356, 'adx_thresh': 15.98842174024061, 'atr_min_pct': 0.013607279993819462, 'atr_max_pct': 0.1283528432494563, 'tp_mult': 1.5684631058010088, 'tsl_mult': 0.735320172764707, 'strategy': 'breakout', 'time_stop': 191, 'use_sma': True, 'use_atr': True, 'use_adx': False, 'use_ema': True, 'use_spike': True, 'rsi_required': False, 'edge_k': 0.41094991756755656, 'edge_cap': 0.7718349045098598, 'bull_strategy': 'breakout', 'bull_bb_std_mult': 0.5707002475013663, 'bull_rsi_os': 22, 'bull_rsi_ob': 80, 'bull_adx_thresh': 6.513797729187374, 'bull_atr_min_pct': 0.01687052412746661, 'bull_atr_max_pct': 0.10145335101275167, 'bull_tp_mult': 2.4561666209379935, 'bull_tsl_mult': 0.8315851202718989, 'bull_time_stop': 277, 'bull_use_sma': False, 'bull_use_ema': True, 'bull_use_atr': False, 'bull_use_adx': False, 'bull_use_spike': True, 'bull_rsi_required': True, 'bear_strategy': 'breakout', 'bear_bb_std_mult': 3.4984592658355225, 'bear_rsi_os': 46, 'bear_rsi_ob': 67, 'bear_adx_thresh': 11.909429893192435, 'bear_atr_min_pct': 0.018157311994561363, 'bear_atr_max_pct': 0.13509885023323667, 'bear_tp_mult': 2.8744296018708724, 'bear_tsl_mult': 0.8202365471620061, 'bear_time_stop': 22, 'bear_use_sma': False, 'bear_use_ema': False, 'bear_use_atr': False, 'bear_use_adx': False, 'bear_use_spike': False, 'bear_rsi_required': True, 'sideways_strategy': 'breakout', 'sideways_bb_std_mult': 2.536093823754812, 'sideways_rsi_os': 21, 'sideways_rsi_ob': 94, 'sideways_adx_thresh': 12.456041360044182, 'sideways_atr_min_pct': 0.017367328833890153, 'sideways_atr_max_pct': 0.06555419057702494, 'sideways_tp_mult': 2.923425008163427, 'sideways_tsl_mult': 0.643432212085749, 'sideways_time_stop': 14, 'sideways_use_sma': False, 'sideways_use_ema': False, 'sideways_use_atr': True, 'sideways_use_adx': True, 'sideways_use_spike': True, 'sideways_rsi_required': True}.
[I 2025-08-31 11:50:42,818] Trial 869 finished with values: [-1000000000.0, 1000000000.0] and parameters: {'p_sma': 57, 'p_std': 30, 'p_atr': 14, 'p_adx': 11, 'rsi_period': 53, 'ema1': 28, 'ema2': 42, 'slip_atr_k': 0.027924531928141382, 'slip_spread_k': 0.2336570737426164, 'spread_hl_frac': 0.04520056443308329, 'bb_std_mult': 2.1562978635923926, 'rsi_os': 34, 'rsi_ob': 95, 'vol_spike': 0.11929249815665358, 'adx_thresh': 9.222425919525406, 'atr_min_pct': 0.013686752137245786, 'atr_max_pct': 0.13786856586929036, 'tp_mult': 1.5687443063157214, 'tsl_mult': 0.06470656753436921, 'strategy': 'breakout', 'time_stop': 165, 'use_sma': True, 'use_atr': True, 'use_adx': False, 'use_ema': True, 'use_spike': True, 'rsi_required': False, 'edge_k': 0.3870277577240656, 'edge_cap': 0.7547561741533054, 'bull_strategy': 'breakout', 'bull_bb_std_mult': 0.6273506056718464, 'bull_rsi_os': 20, 'bull_rsi_ob': 82, 'bull_adx_thresh': 6.077881866075338, 'bull_atr_min_pct': 0.014982687390992002, 'bull_atr_max_pct': 0.09218685434126941, 'bull_tp_mult': 2.5462171741814954, 'bull_tsl_mult': 0.8424691715961737, 'bull_time_stop': 275, 'bull_use_sma': False, 'bull_use_ema': True, 'bull_use_atr': False, 'bull_use_adx': False, 'bull_use_spike': True, 'bull_rsi_required': True, 'bear_strategy': 'breakout', 'bear_bb_std_mult': 3.2899903667168084, 'bear_rsi_os': 46, 'bear_rsi_ob': 72, 'bear_adx_thresh': 11.909927550408154, 'bear_atr_min_pct': 0.017736287689537635, 'bear_atr_max_pct': 0.05789449494627713, 'bear_tp_mult': 2.501221431260665, 'bear_tsl_mult': 0.8013355349605227, 'bear_time_stop': 23, 'bear_use_sma': False, 'bear_use_ema': False, 'bear_use_atr': False, 'bear_use_adx': False, 'bear_use_spike': False, 'bear_rsi_required': True, 'sideways_strategy': 'breakout', 'sideways_bb_std_mult': 2.712903491231547, 'sideways_rsi_os': 21, 'sideways_rsi_ob': 94, 'sideways_adx_thresh': 12.317185203706826, 'sideways_atr_min_pct': 0.016337567730248945, 'sideways_atr_max_pct': 0.05418240433446253, 'sideways_tp_mult': 2.91148262830143, 'sideways_tsl_mult': 0.6362892792425026, 'sideways_time_stop': 11, 'sideways_use_sma': False, 'sideways_use_ema': False, 'sideways_use_atr': True, 'sideways_use_adx': True, 'sideways_use_spike': True, 'sideways_rsi_required': True}.
[I 2025-08-31 11:50:43,040] Trial 866 finished with values: [-0.012249191506004342, 0.012420819515866901] and parameters: {'p_sma': 8, 'p_std': 55, 'p_atr': 14, 'p_adx': 26, 'rsi_period': 38, 'ema1': 10, 'ema2': 43, 'slip_atr_k': 0.027085604130854063, 'slip_spread_k': 0.12792095010913018, 'spread_hl_frac': 0.00534103399112518, 'bb_std_mult': 2.2616379149340466, 'rsi_os': 31, 'rsi_ob': 51, 'vol_spike': 0.135641193107831, 'adx_thresh': 9.745916502999759, 'atr_min_pct': 0.0133987552643908, 'atr_max_pct': 0.12913517477784148, 'tp_mult': 1.5623479063230155, 'tsl_mult': 0.11550860485799447, 'strategy': 'mean_reversion', 'time_stop': 192, 'use_sma': False, 'use_atr': True, 'use_adx': False, 'use_ema': True, 'use_spike': True, 'rsi_required': False, 'edge_k': 0.4237582162677389, 'edge_cap': 0.7556044846664974, 'bull_strategy': 'breakout', 'bull_bb_std_mult': 1.2378718064679806, 'bull_rsi_os': 22, 'bull_rsi_ob': 89, 'bull_adx_thresh': 13.755559155596998, 'bull_atr_min_pct': 0.0061173172329598725, 'bull_atr_max_pct': 0.11798306470111523, 'bull_tp_mult': 2.5455909171226025, 'bull_tsl_mult': 0.7980489526017633, 'bull_time_stop': 275, 'bull_use_sma': False, 'bull_use_ema': True, 'bull_use_atr': False, 'bull_use_adx': False, 'bull_use_spike': False, 'bull_rsi_required': True, 'bear_strategy': 'mean_reversion', 'bear_bb_std_mult': 3.4742699094787772, 'bear_rsi_os': 44, 'bear_rsi_ob': 70, 'bear_adx_thresh': 20.359543635668242, 'bear_atr_min_pct': 0.009432943711267707, 'bear_atr_max_pct': 0.04102742308344615, 'bear_tp_mult': 2.87094658309127, 'bear_tsl_mult': 0.7799222214015863, 'bear_time_stop': 21, 'bear_use_sma': True, 'bear_use_ema': True, 'bear_use_atr': False, 'bear_use_adx': False, 'bear_use_spike': False, 'bear_rsi_required': True, 'sideways_strategy': 'breakout', 'sideways_bb_std_mult': 2.5498983491005647, 'sideways_rsi_os': 31, 'sideways_rsi_ob': 94, 'sideways_adx_thresh': 10.795496778112941, 'sideways_atr_min_pct': 6.333188736372744e-05, 'sideways_atr_max_pct': 0.06535296802203173, 'sideways_tp_mult': 2.9246695067235704, 'sideways_tsl_mult': 0.5192042577887778, 'sideways_time_stop': 20, 'sideways_use_sma': True, 'sideways_use_ema': False, 'sideways_use_atr': True, 'sideways_use_adx': False, 'sideways_use_spike': True, 'sideways_rsi_required': True}.
[I 2025-08-31 11:51:23,118] Trial 870 finished with values: [-1000000000.0, 1000000000.0] and parameters: {'p_sma': 11, 'p_std': 29, 'p_atr': 16, 'p_adx': 16, 'rsi_period': 52, 'ema1': 10, 'ema2': 11, 'slip_atr_k': 0.03145952231370722, 'slip_spread_k': 0.12794365054464277, 'spread_hl_frac': 0.03905810103016498, 'bb_std_mult': 2.3403616187300824, 'rsi_os': 34, 'rsi_ob': 95, 'vol_spike': 0.11969447757258667, 'adx_thresh': 19.528772691202374, 'atr_min_pct': 0.012414224081535374, 'atr_max_pct': 0.1283237487051687, 'tp_mult': 1.485497697519743, 'tsl_mult': 0.09993130515192328, 'strategy': 'breakout', 'time_stop': 192, 'use_sma': True, 'use_atr': True, 'use_adx': False, 'use_ema': True, 'use_spike': True, 'rsi_required': False, 'edge_k': 0.37979645697004183, 'edge_cap': 0.7358157608952698, 'bull_strategy': 'breakout', 'bull_bb_std_mult': 0.5585784152269693, 'bull_rsi_os': 25, 'bull_rsi_ob': 88, 'bull_adx_thresh': 6.556317294161139, 'bull_atr_min_pct': 0.01662454852504951, 'bull_atr_max_pct': 0.023230968012156857, 'bull_tp_mult': 2.4475668994263753, 'bull_tsl_mult': 0.8262974596806195, 'bull_time_stop': 211, 'bull_use_sma': False, 'bull_use_ema': True, 'bull_use_atr': False, 'bull_use_adx': False, 'bull_use_spike': False, 'bull_rsi_required': True, 'bear_strategy': 'breakout', 'bear_bb_std_mult': 3.485880497163485, 'bear_rsi_os': 44, 'bear_rsi_ob': 72, 'bear_adx_thresh': 5.741734188567181, 'bear_atr_min_pct': 0.003960199274256374, 'bear_atr_max_pct': 0.13513235984826966, 'bear_tp_mult': 2.386416688434324, 'bear_tsl_mult': 0.7823702215607098, 'bear_time_stop': 16, 'bear_use_sma': False, 'bear_use_ema': True, 'bear_use_atr': False, 'bear_use_adx': False, 'bear_use_spike': False, 'bear_rsi_required': True, 'sideways_strategy': 'breakout', 'sideways_bb_std_mult': 2.5711704721587956, 'sideways_rsi_os': 13, 'sideways_rsi_ob': 94, 'sideways_adx_thresh': 10.154923746298195, 'sideways_atr_min_pct': 0.016258233242687343, 'sideways_atr_max_pct': 0.07862256786434141, 'sideways_tp_mult': 2.882104441293328, 'sideways_tsl_mult': 0.6374362391968285, 'sideways_time_stop': 13, 'sideways_use_sma': False, 'sideways_use_ema': False, 'sideways_use_atr': True, 'sideways_use_adx': False, 'sideways_use_spike': True, 'sideways_rsi_required': True}.
[I 2025-08-31 11:51:23,244] Trial 873 finished with values: [-0.10334448883611036, 0.10337018089494157] and parameters: {'p_sma': 52, 'p_std': 28, 'p_atr': 15, 'p_adx': 15, 'rsi_period': 71, 'ema1': 30, 'ema2': 28, 'slip_atr_k': 0.03145789207645817, 'slip_spread_k': 0.8593487080426989, 'spread_hl_frac': 0.035485467185902814, 'bb_std_mult': 2.487643296575972, 'rsi_os': 33, 'rsi_ob': 92, 'vol_spike': 0.11932928837963278, 'adx_thresh': 30.990112826285138, 'atr_min_pct': 0.012495005370197508, 'atr_max_pct': 0.1407188973422561, 'tp_mult': 1.2183440533389742, 'tsl_mult': 0.11925307541912394, 'strategy': 'breakout', 'time_stop': 193, 'use_sma': True, 'use_atr': True, 'use_adx': False, 'use_ema': True, 'use_spike': True, 'rsi_required': False, 'edge_k': 0.5775720626244235, 'edge_cap': 0.7745640868160374, 'bull_strategy': 'breakout', 'bull_bb_std_mult': 0.502185003811898, 'bull_rsi_os': 25, 'bull_rsi_ob': 85, 'bull_adx_thresh': 6.495862105564966, 'bull_atr_min_pct': 0.003167947677029722, 'bull_atr_max_pct': 0.10129636622772498, 'bull_tp_mult': 2.666734301170475, 'bull_tsl_mult': 0.8179808000405264, 'bull_time_stop': 225, 'bull_use_sma': False, 'bull_use_ema': True, 'bull_use_atr': False, 'bull_use_adx': False, 'bull_use_spike': False, 'bull_rsi_required': True, 'bear_strategy': 'breakout', 'bear_bb_std_mult': 3.1987950813440693, 'bear_rsi_os': 44, 'bear_rsi_ob': 66, 'bear_adx_thresh': 18.182392204156578, 'bear_atr_min_pct': 0.0017796172195279434, 'bear_atr_max_pct': 0.13377116002014128, 'bear_tp_mult': 2.3894688700225566, 'bear_tsl_mult': 0.7422152462035149, 'bear_time_stop': 14, 'bear_use_sma': False, 'bear_use_ema': True, 'bear_use_atr': False, 'bear_use_adx': False, 'bear_use_spike': False, 'bear_rsi_required': True, 'sideways_strategy': 'breakout', 'sideways_bb_std_mult': 1.784741785521573, 'sideways_rsi_os': 25, 'sideways_rsi_ob': 74, 'sideways_adx_thresh': 10.044331313272425, 'sideways_atr_min_pct': 0.01766795813159036, 'sideways_atr_max_pct': 0.0796674060175616, 'sideways_tp_mult': 2.870100516532699, 'sideways_tsl_mult': 0.39552743291319853, 'sideways_time_stop': 269, 'sideways_use_sma': False, 'sideways_use_ema': False, 'sideways_use_atr': True, 'sideways_use_adx': False, 'sideways_use_spike': True, 'sideways_rsi_required': True}.
[I 2025-08-31 11:51:23,427] Trial 871 finished with values: [-1000000000.0, 1000000000.0] and parameters: {'p_sma': 52, 'p_std': 29, 'p_atr': 14, 'p_adx': 16, 'rsi_period': 53, 'ema1': 6, 'ema2': 24, 'slip_atr_k': 0.1907362948890009, 'slip_spread_k': 0.08371237596918885, 'spread_hl_frac': 0.004467442937520059, 'bb_std_mult': 2.472561810027875, 'rsi_os': 33, 'rsi_ob': 95, 'vol_spike': 0.12034448468628196, 'adx_thresh': 30.957730473325842, 'atr_min_pct': 0.012410208154492636, 'atr_max_pct': 0.12869575983103232, 'tp_mult': 1.4973247982878004, 'tsl_mult': 0.11322107796467949, 'strategy': 'breakout', 'time_stop': 188, 'use_sma': True, 'use_atr': True, 'use_adx': False, 'use_ema': False, 'use_spike': True, 'rsi_required': False, 'edge_k': 0.3730745097248963, 'edge_cap': 0.7316566499874472, 'bull_strategy': 'breakout', 'bull_bb_std_mult': 0.5606606591925457, 'bull_rsi_os': 25, 'bull_rsi_ob': 85, 'bull_adx_thresh': 34.998766324144015, 'bull_atr_min_pct': 0.014945661793532026, 'bull_atr_max_pct': 0.09226557561717298, 'bull_tp_mult': 2.728978755134917, 'bull_tsl_mult': 0.8091248283935714, 'bull_time_stop': 276, 'bull_use_sma': False, 'bull_use_ema': True, 'bull_use_atr': False, 'bull_use_adx': False, 'bull_use_spike': False, 'bull_rsi_required': True, 'bear_strategy': 'breakout', 'bear_bb_std_mult': 3.283832540465646, 'bear_rsi_os': 45, 'bear_rsi_ob': 72, 'bear_adx_thresh': 18.778902564379667, 'bear_atr_min_pct': 0.015078812531289438, 'bear_atr_max_pct': 0.04176159225815226, 'bear_tp_mult': 2.918166193249657, 'bear_tsl_mult': 0.9676856738083585, 'bear_time_stop': 15, 'bear_use_sma': False, 'bear_use_ema': True, 'bear_use_atr': False, 'bear_use_adx': True, 'bear_use_spike': False, 'bear_rsi_required': True, 'sideways_strategy': 'breakout', 'sideways_bb_std_mult': 2.739193588840264, 'sideways_rsi_os': 31, 'sideways_rsi_ob': 74, 'sideways_adx_thresh': 9.70940410927365, 'sideways_atr_min_pct': 0.016326454836788365, 'sideways_atr_max_pct': 0.04142840386720567, 'sideways_tp_mult': 2.8789235080440383, 'sideways_tsl_mult': 0.434867302853485, 'sideways_time_stop': 153, 'sideways_use_sma': False, 'sideways_use_ema': True, 'sideways_use_atr': True, 'sideways_use_adx': False, 'sideways_use_spike': True, 'sideways_rsi_required': True}.
