[I 2025-08-31 10:56:01,066] Trial 479 finished with values: [-1000000000.0, 1000000000.0] and parameters: {'p_sma': 13, 'p_std': 56, 'p_atr': 12, 'p_adx': 14, 'rsi_period': 16, 'ema1': 13, 'ema2': 55, 'slip_atr_k': 0.028177600156697787, 'slip_spread_k': 0.6515099230348915, 'spread_hl_frac': 0.01194896107090283, 'bb_std_mult': 2.691033483562263, 'rsi_os': 38, 'rsi_ob': 58, 'vol_spike': 0.25988282165609783, 'adx_thresh': 28.39495864310523, 'atr_min_pct': 0.015417890564981687, 'atr_max_pct': 0.09455742936937966, 'tp_mult': 2.5887843884819954, 'tsl_mult': 0.9565425630151678, 'strategy': 'breakout', 'time_stop': 104, 'use_sma': False, 'use_atr': False, 'use_adx': True, 'use_ema': True, 'use_spike': False, 'rsi_required': True, 'edge_k': 1.1411332912066547, 'edge_cap': 0.482256598850428, 'bull_strategy': 'breakout', 'bull_bb_std_mult': 0.8007032296300771, 'bull_rsi_os': 46, 'bull_rsi_ob': 95, 'bull_adx_thresh': 8.62604365452512, 'bull_atr_min_pct': 0.016412428753647446, 'bull_atr_max_pct': 0.08088984048159031, 'bull_tp_mult': 1.9369748135233953, 'bull_tsl_mult': 0.38262401123376877, 'bull_time_stop': 221, 'bull_use_sma': True, 'bull_use_ema': False, 'bull_use_atr': False, 'bull_use_adx': True, 'bull_use_spike': False, 'bull_rsi_required': True, 'bear_strategy': 'breakout', 'bear_bb_std_mult': 2.3038271936266668, 'bear_rsi_os': 28, 'bear_rsi_ob': 87, 'bear_adx_thresh': 25.642692653310977, 'bear_atr_min_pct': 0.024778967268342514, 'bear_atr_max_pct': 0.019978779260885197, 'bear_tp_mult': 1.2285402472363924, 'bear_tsl_mult': 0.4926352751998232, 'bear_time_stop': 28, 'bear_use_sma': False, 'bear_use_ema': True, 'bear_use_atr': False, 'bear_use_adx': False, 'bear_use_spike': False, 'bear_rsi_required': False, 'sideways_strategy': 'mean_reversion', 'sideways_bb_std_mult': 3.0073948322472543, 'sideways_rsi_os': 6, 'sideways_rsi_ob': 93, 'sideways_adx_thresh': 17.185056513937617, 'sideways_atr_min_pct': 0.01793106912139263, 'sideways_atr_max_pct': 0.04456796617403563, 'sideways_tp_mult': 1.8711039211042193, 'sideways_tsl_mult': 0.7189411082805361, 'sideways_time_stop': 132, 'sideways_use_sma': False, 'sideways_use_ema': False, 'sideways_use_atr': False, 'sideways_use_adx': False, 'sideways_use_spike': False, 'sideways_rsi_required': False}.
[I 2025-08-31 10:56:01,141] Trial 477 finished with values: [-1000000000.0, 1000000000.0] and parameters: {'p_sma': 22, 'p_std': 27, 'p_atr': 11, 'p_adx': 12, 'rsi_period': 58, 'ema1': 15, 'ema2': 46, 'slip_atr_k': 0.010808843737140139, 'slip_spread_k': 0.6988466447422381, 'spread_hl_frac': 0.008385449770702987, 'bb_std_mult': 2.0719240339467917, 'rsi_os': 12, 'rsi_ob': 93, 'vol_spike': 0.2607473518142968, 'adx_thresh': 29.338251131843297, 'atr_min_pct': 0.00626165101734134, 'atr_max_pct': 0.029159099112790292, 'tp_mult': 1.3638425692990521, 'tsl_mult': 0.2107675621147039, 'strategy': 'breakout', 'time_stop': 192, 'use_sma': False, 'use_atr': False, 'use_adx': True, 'use_ema': True, 'use_spike': False, 'rsi_required': True, 'edge_k': 0.20111247129941776, 'edge_cap': 0.5503738465637895, 'bull_strategy': 'breakout', 'bull_bb_std_mult': 0.8082927850899239, 'bull_rsi_os': 10, 'bull_rsi_ob': 59, 'bull_adx_thresh': 17.707370231296835, 'bull_atr_min_pct': 0.015543677966635184, 'bull_atr_max_pct': 0.09172298386823599, 'bull_tp_mult': 2.780241132197927, 'bull_tsl_mult': 0.3785514964443622, 'bull_time_stop': 166, 'bull_use_sma': True, 'bull_use_ema': False, 'bull_use_atr': False, 'bull_use_adx': True, 'bull_use_spike': False, 'bull_rsi_required': False, 'bear_strategy': 'breakout', 'bear_bb_std_mult': 2.157760920282731, 'bear_rsi_os': 51, 'bear_rsi_ob': 73, 'bear_adx_thresh': 19.885605302345922, 'bear_atr_min_pct': 0.024603143549302615, 'bear_atr_max_pct': 0.02755265968779822, 'bear_tp_mult': 1.8484115234805392, 'bear_tsl_mult': 0.36414469490674894, 'bear_time_stop': 29, 'bear_use_sma': False, 'bear_use_ema': True, 'bear_use_atr': False, 'bear_use_adx': False, 'bear_use_spike': False, 'bear_rsi_required': False, 'sideways_strategy': 'mean_reversion', 'sideways_bb_std_mult': 2.7308602116219354, 'sideways_rsi_os': 54, 'sideways_rsi_ob': 93, 'sideways_adx_thresh': 24.379399396145363, 'sideways_atr_min_pct': 0.019045915475335278, 'sideways_atr_max_pct': 0.04506041609273039, 'sideways_tp_mult': 1.986226340549537, 'sideways_tsl_mult': 0.06450559881876389, 'sideways_time_stop': 24, 'sideways_use_sma': False, 'sideways_use_ema': False, 'sideways_use_atr': False, 'sideways_use_adx': False, 'sideways_use_spike': False, 'sideways_rsi_required': False}.
[I 2025-08-31 10:56:01,375] Trial 478 finished with values: [-1000000000.0, 1000000000.0] and parameters: {'p_sma': 13, 'p_std': 33, 'p_atr': 11, 'p_adx': 13, 'rsi_period': 32, 'ema1': 15, 'ema2': 51, 'slip_atr_k': 0.025681604623728715, 'slip_spread_k': 0.6940741470785807, 'spread_hl_frac': 0.010670604314203087, 'bb_std_mult': 2.307398087096912, 'rsi_os': 25, 'rsi_ob': 69, 'vol_spike': 0.2611336155874694, 'adx_thresh': 30.11695699495873, 'atr_min_pct': 0.0026948646056234454, 'atr_max_pct': 0.030919177168163163, 'tp_mult': 1.8410668677122808, 'tsl_mult': 0.2194540296493191, 'strategy': 'breakout', 'time_stop': 116, 'use_sma': False, 'use_atr': False, 'use_adx': True, 'use_ema': True, 'use_spike': False, 'rsi_required': True, 'edge_k': 0.20334783756971825, 'edge_cap': 0.5683063793397365, 'bull_strategy': 'breakout', 'bull_bb_std_mult': 0.8088334654407402, 'bull_rsi_os': 54, 'bull_rsi_ob': 73, 'bull_adx_thresh': 8.523904796690603, 'bull_atr_min_pct': 0.025179056241506702, 'bull_atr_max_pct': 0.09093056009811834, 'bull_tp_mult': 2.2418857041437956, 'bull_tsl_mult': 0.38040205183199816, 'bull_time_stop': 88, 'bull_use_sma': True, 'bull_use_ema': False, 'bull_use_atr': False, 'bull_use_adx': True, 'bull_use_spike': False, 'bull_rsi_required': True, 'bear_strategy': 'breakout', 'bear_bb_std_mult': 1.7998144940048468, 'bear_rsi_os': 39, 'bear_rsi_ob': 73, 'bear_adx_thresh': 5.005068036460175, 'bear_atr_min_pct': 0.02456795589366167, 'bear_atr_max_pct': 0.13719277764489538, 'bear_tp_mult': 1.8682658879515315, 'bear_tsl_mult': 0.6590306730962072, 'bear_time_stop': 28, 'bear_use_sma': False, 'bear_use_ema': True, 'bear_use_atr': False, 'bear_use_adx': False, 'bear_use_spike': False, 'bear_rsi_required': False, 'sideways_strategy': 'mean_reversion', 'sideways_bb_std_mult': 0.9362849453276199, 'sideways_rsi_os': 6, 'sideways_rsi_ob': 93, 'sideways_adx_thresh': 24.424832703868976, 'sideways_atr_min_pct': 0.01579281603539066, 'sideways_atr_max_pct': 0.13444070054858723, 'sideways_tp_mult': 1.9790073853669365, 'sideways_tsl_mult': 0.7056491556671991, 'sideways_time_stop': 101, 'sideways_use_sma': False, 'sideways_use_ema': False, 'sideways_use_atr': False, 'sideways_use_adx': False, 'sideways_use_spike': False, 'sideways_rsi_required': False}.
[I 2025-08-31 10:56:01,501] Trial 480 finished with values: [-0.07311579131585877, 0.0726763889945621] and parameters: {'p_sma': 50, 'p_std': 29, 'p_atr': 14, 'p_adx': 27, 'rsi_period': 19, 'ema1': 15, 'ema2': 55, 'slip_atr_k': 0.009461185970544468, 'slip_spread_k': 0.6556828288560286, 'spread_hl_frac': 0.01055420153995172, 'bb_std_mult': 2.6964273112528687, 'rsi_os': 25, 'rsi_ob': 78, 'vol_spike': 0.266207979407322, 'adx_thresh': 21.801299031579678, 'atr_min_pct': 0.027680478300284514, 'atr_max_pct': 0.03065936011416976, 'tp_mult': 2.430923075694216, 'tsl_mult': 0.2172934178298561, 'strategy': 'breakout', 'time_stop': 104, 'use_sma': False, 'use_atr': False, 'use_adx': True, 'use_ema': True, 'use_spike': False, 'rsi_required': True, 'edge_k': 1.1569018221112244, 'edge_cap': 0.16804813741230118, 'bull_strategy': 'breakout', 'bull_bb_std_mult': 0.7236192401924658, 'bull_rsi_os': 8, 'bull_rsi_ob': 59, 'bull_adx_thresh': 5.907075004055953, 'bull_atr_min_pct': 0.016190944154697292, 'bull_atr_max_pct': 0.09021281556426375, 'bull_tp_mult': 2.7763793736177536, 'bull_tsl_mult': 0.3892278300589249, 'bull_time_stop': 221, 'bull_use_sma': True, 'bull_use_ema': False, 'bull_use_atr': False, 'bull_use_adx': True, 'bull_use_spike': False, 'bull_rsi_required': True, 'bear_strategy': 'breakout', 'bear_bb_std_mult': 0.6149760610780552, 'bear_rsi_os': 39, 'bear_rsi_ob': 61, 'bear_adx_thresh': 19.622348721851193, 'bear_atr_min_pct': 0.0014397973287014181, 'bear_atr_max_pct': 0.12093444129548094, 'bear_tp_mult': 2.8265930082420585, 'bear_tsl_mult': 0.4988310246195823, 'bear_time_stop': 11, 'bear_use_sma': False, 'bear_use_ema': True, 'bear_use_atr': False, 'bear_use_adx': False, 'bear_use_spike': True, 'bear_rsi_required': False, 'sideways_strategy': 'mean_reversion', 'sideways_bb_std_mult': 1.3073253232700421, 'sideways_rsi_os': 6, 'sideways_rsi_ob': 90, 'sideways_adx_thresh': 24.50868895295327, 'sideways_atr_min_pct': 0.012137721452404162, 'sideways_atr_max_pct': 0.04522497717803245, 'sideways_tp_mult': 2.0243306327837867, 'sideways_tsl_mult': 0.499311868508745, 'sideways_time_stop': 249, 'sideways_use_sma': False, 'sideways_use_ema': False, 'sideways_use_atr': False, 'sideways_use_adx': False, 'sideways_use_spike': False, 'sideways_rsi_required': False}.
[I 2025-08-31 10:56:34,004] Trial 484 finished with values: [-1000000000.0, 1000000000.0] and parameters: {'p_sma': 15, 'p_std': 47, 'p_atr': 25, 'p_adx': 24, 'rsi_period': 50, 'ema1': 14, 'ema2': 56, 'slip_atr_k': 0.18762275183709826, 'slip_spread_k': 0.6721748958320568, 'spread_hl_frac': 0.011870377047856593, 'bb_std_mult': 2.7708714062510684, 'rsi_os': 10, 'rsi_ob': 78, 'vol_spike': 0.21955743669264885, 'adx_thresh': 28.66943802621599, 'atr_min_pct': 0.0038254391422877405, 'atr_max_pct': 0.10455244695574283, 'tp_mult': 2.4723362836533376, 'tsl_mult': 0.3866094236155634, 'strategy': 'breakout', 'time_stop': 95, 'use_sma': True, 'use_atr': False, 'use_adx': True, 'use_ema': True, 'use_spike': True, 'rsi_required': True, 'edge_k': 0.09037396622389672, 'edge_cap': 0.4460223699794893, 'bull_strategy': 'breakout', 'bull_bb_std_mult': 0.8817107931359445, 'bull_rsi_os': 36, 'bull_rsi_ob': 75, 'bull_adx_thresh': 16.675376577981947, 'bull_atr_min_pct': 0.011897963362021246, 'bull_atr_max_pct': 0.028365856559687146, 'bull_tp_mult': 1.8434592763753728, 'bull_tsl_mult': 0.3479959325390542, 'bull_time_stop': 80, 'bull_use_sma': True, 'bull_use_ema': False, 'bull_use_atr': False, 'bull_use_adx': False, 'bull_use_spike': False, 'bull_rsi_required': True, 'bear_strategy': 'mean_reversion', 'bear_bb_std_mult': 3.303319142785285, 'bear_rsi_os': 35, 'bear_rsi_ob': 81, 'bear_adx_thresh': 18.242469103284268, 'bear_atr_min_pct': 0.015596472580001186, 'bear_atr_max_pct': 0.11810779520525844, 'bear_tp_mult': 2.8532304699140507, 'bear_tsl_mult': 0.5225991768415011, 'bear_time_stop': 188, 'bear_use_sma': True, 'bear_use_ema': True, 'bear_use_atr': False, 'bear_use_adx': False, 'bear_use_spike': True, 'bear_rsi_required': False, 'sideways_strategy': 'mean_reversion', 'sideways_bb_std_mult': 2.221266534574134, 'sideways_rsi_os': 23, 'sideways_rsi_ob': 92, 'sideways_adx_thresh': 21.42682983127937, 'sideways_atr_min_pct': 0.022148312150085912, 'sideways_atr_max_pct': 0.09728617733243193, 'sideways_tp_mult': 2.948437365987367, 'sideways_tsl_mult': 0.6357505866446573, 'sideways_time_stop': 17, 'sideways_use_sma': False, 'sideways_use_ema': False, 'sideways_use_atr': False, 'sideways_use_adx': False, 'sideways_use_spike': False, 'sideways_rsi_required': True}.
[I 2025-08-31 10:56:34,175] Trial 482 finished with values: [-1000000000.0, 1000000000.0] and parameters: {'p_sma': 15, 'p_std': 29, 'p_atr': 11, 'p_adx': 15, 'rsi_period': 77, 'ema1': 6, 'ema2': 55, 'slip_atr_k': 0.02204780800747198, 'slip_spread_k': 0.669601067519899, 'spread_hl_frac': 0.010902190185969541, 'bb_std_mult': 2.684364633148738, 'rsi_os': 26, 'rsi_ob': 65, 'vol_spike': 0.17481931007047988, 'adx_thresh': 21.751236814648813, 'atr_min_pct': 0.020452159486073502, 'atr_max_pct': 0.08090819026257264, 'tp_mult': 2.43772786464903, 'tsl_mult': 0.38654355620757863, 'strategy': 'breakout', 'time_stop': 60, 'use_sma': True, 'use_atr': False, 'use_adx': True, 'use_ema': True, 'use_spike': True, 'rsi_required': True, 'edge_k': 0.11576679173759419, 'edge_cap': 0.44886722154443237, 'bull_strategy': 'breakout', 'bull_bb_std_mult': 0.7442064516509561, 'bull_rsi_os': 17, 'bull_rsi_ob': 50, 'bull_adx_thresh': 5.895491982240987, 'bull_atr_min_pct': 0.024933827051696403, 'bull_atr_max_pct': 0.04208932659289138, 'bull_tp_mult': 1.8464476389125661, 'bull_tsl_mult': 0.7209302814833465, 'bull_time_stop': 187, 'bull_use_sma': True, 'bull_use_ema': False, 'bull_use_atr': False, 'bull_use_adx': False, 'bull_use_spike': False, 'bull_rsi_required': True, 'bear_strategy': 'mean_reversion', 'bear_bb_std_mult': 1.8834495529249304, 'bear_rsi_os': 47, 'bear_rsi_ob': 81, 'bear_adx_thresh': 18.66071386885011, 'bear_atr_min_pct': 0.005120309196221251, 'bear_atr_max_pct': 0.14862869754431282, 'bear_tp_mult': 2.843783081792785, 'bear_tsl_mult': 0.5166088760890324, 'bear_time_stop': 36, 'bear_use_sma': False, 'bear_use_ema': True, 'bear_use_atr': False, 'bear_use_adx': False, 'bear_use_spike': True, 'bear_rsi_required': False, 'sideways_strategy': 'mean_reversion', 'sideways_bb_std_mult': 2.5871781283047732, 'sideways_rsi_os': 12, 'sideways_rsi_ob': 90, 'sideways_adx_thresh': 30.670163980168773, 'sideways_atr_min_pct': 0.021975354367150524, 'sideways_atr_max_pct': 0.04776993780509459, 'sideways_tp_mult': 2.0268095006206064, 'sideways_tsl_mult': 0.155907543475786, 'sideways_time_stop': 246, 'sideways_use_sma': False, 'sideways_use_ema': False, 'sideways_use_atr': False, 'sideways_use_adx': False, 'sideways_use_spike': False, 'sideways_rsi_required': True}.
[I 2025-08-31 10:56:34,371] Trial 483 finished with values: [-1000000000.0, 1000000000.0] and parameters: {'p_sma': 15, 'p_std': 31, 'p_atr': 11, 'p_adx': 15, 'rsi_period': 19, 'ema1': 20, 'ema2': 56, 'slip_atr_k': 0.04015034245322667, 'slip_spread_k': 0.6727040056088129, 'spread_hl_frac': 0.01129083725905613, 'bb_std_mult': 2.683284145918541, 'rsi_os': 32, 'rsi_ob': 89, 'vol_spike': 0.1748791024204138, 'adx_thresh': 25.553976690900345, 'atr_min_pct': 0.017301660277177423, 'atr_max_pct': 0.08056121017221125, 'tp_mult': 2.4393792984752354, 'tsl_mult': 0.39478311003108235, 'strategy': 'breakout', 'time_stop': 93, 'use_sma': True, 'use_atr': False, 'use_adx': True, 'use_ema': True, 'use_spike': True, 'rsi_required': True, 'edge_k': 0.30872804552748967, 'edge_cap': 0.16101059406186596, 'bull_strategy': 'breakout', 'bull_bb_std_mult': 0.7285411035513962, 'bull_rsi_os': 17, 'bull_rsi_ob': 75, 'bull_adx_thresh': 5.56691089425529, 'bull_atr_min_pct': 0.02382965961024465, 'bull_atr_max_pct': 0.11666315632579088, 'bull_tp_mult': 1.2494933900895606, 'bull_tsl_mult': 0.4073645710502409, 'bull_time_stop': 78, 'bull_use_sma': True, 'bull_use_ema': False, 'bull_use_atr': False, 'bull_use_adx': False, 'bull_use_spike': False, 'bull_rsi_required': True, 'bear_strategy': 'mean_reversion', 'bear_bb_std_mult': 3.3155749255736255, 'bear_rsi_os': 36, 'bear_rsi_ob': 95, 'bear_adx_thresh': 18.619691927585933, 'bear_atr_min_pct': 0.00552903187155531, 'bear_atr_max_pct': 0.11896527017226079, 'bear_tp_mult': 2.844920870394267, 'bear_tsl_mult': 0.5199113046968308, 'bear_time_stop': 35, 'bear_use_sma': False, 'bear_use_ema': True, 'bear_use_atr': False, 'bear_use_adx': False, 'bear_use_spike': True, 'bear_rsi_required': False, 'sideways_strategy': 'mean_reversion', 'sideways_bb_std_mult': 2.59353395006777, 'sideways_rsi_os': 7, 'sideways_rsi_ob': 90, 'sideways_adx_thresh': 21.494147707735735, 'sideways_atr_min_pct': 0.017903335550865075, 'sideways_atr_max_pct': 0.047844281462657956, 'sideways_tp_mult': 1.1454931248284708, 'sideways_tsl_mult': 0.835013735705002, 'sideways_time_stop': 287, 'sideways_use_sma': False, 'sideways_use_ema': False, 'sideways_use_atr': False, 'sideways_use_adx': False, 'sideways_use_spike': False, 'sideways_rsi_required': True}.
[I 2025-08-31 10:56:34,573] Trial 481 finished with values: [-1000000000.0, 1000000000.0] and parameters: {'p_sma': 15, 'p_std': 31, 'p_atr': 11, 'p_adx': 15, 'rsi_period': 50, 'ema1': 6, 'ema2': 55, 'slip_atr_k': 0.20001957211012963, 'slip_spread_k': 0.8085608916376984, 'spread_hl_frac': 0.010447301615699001, 'bb_std_mult': 2.75004077370571, 'rsi_os': 26, 'rsi_ob': 69, 'vol_spike': 0.2672873927475544, 'adx_thresh': 11.985994718692195, 'atr_min_pct': 0.003646488440071153, 'atr_max_pct': 0.1493974980604706, 'tp_mult': 2.4377575379795076, 'tsl_mult': 0.39219265702492234, 'strategy': 'breakout', 'time_stop': 91, 'use_sma': True, 'use_atr': False, 'use_adx': True, 'use_ema': True, 'use_spike': True, 'rsi_required': True, 'edge_k': 0.8212404851081296, 'edge_cap': 0.4488562693453795, 'bull_strategy': 'breakout', 'bull_bb_std_mult': 2.3055095203987, 'bull_rsi_os': 15, 'bull_rsi_ob': 75, 'bull_adx_thresh': 5.8244400197659, 'bull_atr_min_pct': 0.007117440944070189, 'bull_atr_max_pct': 0.05311476752114734, 'bull_tp_mult': 1.7806215437383286, 'bull_tsl_mult': 0.34973681493670405, 'bull_time_stop': 80, 'bull_use_sma': True, 'bull_use_ema': False, 'bull_use_atr': False, 'bull_use_adx': False, 'bull_use_spike': False, 'bull_rsi_required': True, 'bear_strategy': 'mean_reversion', 'bear_bb_std_mult': 2.43549272694983, 'bear_rsi_os': 35, 'bear_rsi_ob': 81, 'bear_adx_thresh': 8.091844188588798, 'bear_atr_min_pct': 0.0056032181620876064, 'bear_atr_max_pct': 0.1493250643605682, 'bear_tp_mult': 2.831902709479088, 'bear_tsl_mult': 0.5177128169834424, 'bear_time_stop': 187, 'bear_use_sma': False, 'bear_use_ema': True, 'bear_use_atr': False, 'bear_use_adx': False, 'bear_use_spike': True, 'bear_rsi_required': False, 'sideways_strategy': 'mean_reversion', 'sideways_bb_std_mult': 2.5880802460030767, 'sideways_rsi_os': 12, 'sideways_rsi_ob': 90, 'sideways_adx_thresh': 25.955760179404116, 'sideways_atr_min_pct': 0.01565616018282477, 'sideways_atr_max_pct': 0.09704863107072162, 'sideways_tp_mult': 1.5351436425129155, 'sideways_tsl_mult': 0.6334626737380299, 'sideways_time_stop': 18, 'sideways_use_sma': False, 'sideways_use_ema': False, 'sideways_use_atr': False, 'sideways_use_adx': False, 'sideways_use_spike': False, 'sideways_rsi_required': True}.
[I 2025-08-31 10:57:05,624] Trial 487 finished with values: [-1000000000.0, 1000000000.0] and parameters: {'p_sma': 16, 'p_std': 17, 'p_atr': 10, 'p_adx': 8, 'rsi_period': 49, 'ema1': 19, 'ema2': 28, 'slip_atr_k': 0.015787933570598517, 'slip_spread_k': 0.09681780665631318, 'spread_hl_frac': 0.009384036569963311, 'bb_std_mult': 3.2608376606652905, 'rsi_os': 28, 'rsi_ob': 77, 'vol_spike': 0.2766512013278728, 'adx_thresh': 11.941809915413723, 'atr_min_pct': 0.005670027069624912, 'atr_max_pct': 0.09843385458444366, 'tp_mult': 2.311776204009511, 'tsl_mult': 0.497453855417158, 'strategy': 'breakout', 'time_stop': 44, 'use_sma': True, 'use_atr': False, 'use_adx': True, 'use_ema': False, 'use_spike': True, 'rsi_required': True, 'edge_k': 1.3301146414091232, 'edge_cap': 0.4884052938168037, 'bull_strategy': 'breakout', 'bull_bb_std_mult': 1.7120920911470547, 'bull_rsi_os': 9, 'bull_rsi_ob': 77, 'bull_adx_thresh': 6.524732961527367, 'bull_atr_min_pct': 0.010823840228085583, 'bull_atr_max_pct': 0.10492895780116572, 'bull_tp_mult': 1.6340488909688042, 'bull_tsl_mult': 0.4355011166692305, 'bull_time_stop': 26, 'bull_use_sma': False, 'bull_use_ema': False, 'bull_use_atr': False, 'bull_use_adx': False, 'bull_use_spike': False, 'bull_rsi_required': False, 'bear_strategy': 'breakout', 'bear_bb_std_mult': 0.8210630045478775, 'bear_rsi_os': 45, 'bear_rsi_ob': 79, 'bear_adx_thresh': 7.992287526637725, 'bear_atr_min_pct': 0.00573449095037143, 'bear_atr_max_pct': 0.0621060393857763, 'bear_tp_mult': 1.7786378332878885, 'bear_tsl_mult': 0.3441411525653363, 'bear_time_stop': 265, 'bear_use_sma': False, 'bear_use_ema': False, 'bear_use_atr': True, 'bear_use_adx': True, 'bear_use_spike': True, 'bear_rsi_required': True, 'sideways_strategy': 'mean_reversion', 'sideways_bb_std_mult': 2.816540330563202, 'sideways_rsi_os': 8, 'sideways_rsi_ob': 86, 'sideways_adx_thresh': 25.85100796311007, 'sideways_atr_min_pct': 0.0011778350504993915, 'sideways_atr_max_pct': 0.09138691533795502, 'sideways_tp_mult': 1.9192697142218205, 'sideways_tsl_mult': 0.22033757096629442, 'sideways_time_stop': 20, 'sideways_use_sma': False, 'sideways_use_ema': False, 'sideways_use_atr': True, 'sideways_use_adx': False, 'sideways_use_spike': False, 'sideways_rsi_required': True}.
