[I 2025-08-31 11:41:59,811] Trial 811 finished with values: [-0.015699992197726664, 0.017969513492712044] and parameters: {'p_sma': 14, 'p_std': 28, 'p_atr': 14, 'p_adx': 13, 'rsi_period': 66, 'ema1': 12, 'ema2': 40, 'slip_atr_k': 0.03562466910283944, 'slip_spread_k': 0.16194011434886235, 'spread_hl_frac': 0.003435482253380554, 'bb_std_mult': 2.3444829187512437, 'rsi_os': 33, 'rsi_ob': 92, 'vol_spike': 0.11975569414997281, 'adx_thresh': 30.28980883344887, 'atr_min_pct': 0.015174286837519504, 'atr_max_pct': 0.13516169453288737, 'tp_mult': 1.4934762376664446, 'tsl_mult': 0.1281626347032533, 'strategy': 'breakout', 'time_stop': 179, 'use_sma': True, 'use_atr': True, 'use_adx': False, 'use_ema': True, 'use_spike': True, 'rsi_required': False, 'edge_k': 0.48239538264003234, 'edge_cap': 0.7813058880354682, 'bull_strategy': 'mean_reversion', 'bull_bb_std_mult': 0.5508454996483025, 'bull_rsi_os': 24, 'bull_rsi_ob': 86, 'bull_adx_thresh': 5.078271100166646, 'bull_atr_min_pct': 0.0015459698995312927, 'bull_atr_max_pct': 0.1095300899908297, 'bull_tp_mult': 2.7830995912085887, 'bull_tsl_mult': 0.8251992036904883, 'bull_time_stop': 271, 'bull_use_sma': False, 'bull_use_ema': True, 'bull_use_atr': False, 'bull_use_adx': False, 'bull_use_spike': False, 'bull_rsi_required': True, 'bear_strategy': 'breakout', 'bear_bb_std_mult': 3.3729649806715662, 'bear_rsi_os': 46, 'bear_rsi_ob': 70, 'bear_adx_thresh': 5.017455198442123, 'bear_atr_min_pct': 0.0033218164929789944, 'bear_atr_max_pct': 0.14516800125754564, 'bear_tp_mult': 2.9600090078905232, 'bear_tsl_mult': 0.7882265526870447, 'bear_time_stop': 5, 'bear_use_sma': False, 'bear_use_ema': True, 'bear_use_atr': False, 'bear_use_adx': False, 'bear_use_spike': False, 'bear_rsi_required': True, 'sideways_strategy': 'breakout', 'sideways_bb_std_mult': 2.5812889950545577, 'sideways_rsi_os': 22, 'sideways_rsi_ob': 95, 'sideways_adx_thresh': 11.17241049250249, 'sideways_atr_min_pct': 0.015391938201046309, 'sideways_atr_max_pct': 0.049804311658657424, 'sideways_tp_mult': 2.9225143585079456, 'sideways_tsl_mult': 0.4333582360280918, 'sideways_time_stop': 17, 'sideways_use_sma': False, 'sideways_use_ema': False, 'sideways_use_atr': True, 'sideways_use_adx': False, 'sideways_use_spike': True, 'sideways_rsi_required': True}.
[I 2025-08-31 11:41:59,954] Trial 812 finished with values: [-0.025445342028699303, 0.02499351349764045] and parameters: {'p_sma': 21, 'p_std': 55, 'p_atr': 16, 'p_adx': 13, 'rsi_period': 25, 'ema1': 12, 'ema2': 39, 'slip_atr_k': 0.036218557259336044, 'slip_spread_k': 0.14555745804452852, 'spread_hl_frac': 0.004623278516564495, 'bb_std_mult': 2.214632762064005, 'rsi_os': 33, 'rsi_ob': 92, 'vol_spike': 0.12126170084992866, 'adx_thresh': 30.29104621479333, 'atr_min_pct': 0.014519674273685085, 'atr_max_pct': 0.1352308868661186, 'tp_mult': 1.4859204948321478, 'tsl_mult': 0.14029035952817506, 'strategy': 'breakout', 'time_stop': 180, 'use_sma': True, 'use_atr': True, 'use_adx': False, 'use_ema': True, 'use_spike': True, 'rsi_required': False, 'edge_k': 0.48434475229998114, 'edge_cap': 0.7252425344680251, 'bull_strategy': 'mean_reversion', 'bull_bb_std_mult': 0.5124751856023897, 'bull_rsi_os': 24, 'bull_rsi_ob': 83, 'bull_adx_thresh': 5.032863656865302, 'bull_atr_min_pct': 0.002917763112232389, 'bull_atr_max_pct': 0.10802264897318595, 'bull_tp_mult': 2.5813138590005003, 'bull_tsl_mult': 0.828763207741845, 'bull_time_stop': 269, 'bull_use_sma': False, 'bull_use_ema': True, 'bull_use_atr': False, 'bull_use_adx': False, 'bull_use_spike': False, 'bull_rsi_required': True, 'bear_strategy': 'breakout', 'bear_bb_std_mult': 3.387929470832106, 'bear_rsi_os': 47, 'bear_rsi_ob': 71, 'bear_adx_thresh': 5.079740219072349, 'bear_atr_min_pct': 0.0028586707181690084, 'bear_atr_max_pct': 0.1441499114188122, 'bear_tp_mult': 2.969547425451367, 'bear_tsl_mult': 0.7887893703558218, 'bear_time_stop': 11, 'bear_use_sma': False, 'bear_use_ema': True, 'bear_use_atr': False, 'bear_use_adx': False, 'bear_use_spike': False, 'bear_rsi_required': True, 'sideways_strategy': 'breakout', 'sideways_bb_std_mult': 2.6101887529085803, 'sideways_rsi_os': 21, 'sideways_rsi_ob': 95, 'sideways_adx_thresh': 11.061153466679833, 'sideways_atr_min_pct': 0.015328904635987583, 'sideways_atr_max_pct': 0.05090193550159018, 'sideways_tp_mult': 2.908824092053065, 'sideways_tsl_mult': 0.44150665328211014, 'sideways_time_stop': 19, 'sideways_use_sma': False, 'sideways_use_ema': False, 'sideways_use_atr': True, 'sideways_use_adx': False, 'sideways_use_spike': True, 'sideways_rsi_required': True}.
[I 2025-08-31 11:42:00,663] Trial 810 finished with values: [-0.025434309078366413, 0.02586584232343243] and parameters: {'p_sma': 22, 'p_std': 28, 'p_atr': 14, 'p_adx': 13, 'rsi_period': 52, 'ema1': 12, 'ema2': 39, 'slip_atr_k': 0.036517691057832535, 'slip_spread_k': 0.15256952420976844, 'spread_hl_frac': 0.003978536040633139, 'bb_std_mult': 2.202047343203541, 'rsi_os': 33, 'rsi_ob': 92, 'vol_spike': 0.11959466482073286, 'adx_thresh': 30.402493759520066, 'atr_min_pct': 0.014566169911132715, 'atr_max_pct': 0.1357623354906767, 'tp_mult': 1.5019565339827365, 'tsl_mult': 0.12418037290518773, 'strategy': 'breakout', 'time_stop': 179, 'use_sma': True, 'use_atr': True, 'use_adx': False, 'use_ema': True, 'use_spike': True, 'rsi_required': False, 'edge_k': 0.4813168399320399, 'edge_cap': 0.7743333769279838, 'bull_strategy': 'mean_reversion', 'bull_bb_std_mult': 0.5157947095240016, 'bull_rsi_os': 24, 'bull_rsi_ob': 86, 'bull_adx_thresh': 5.083140559776374, 'bull_atr_min_pct': 0.001638529448145376, 'bull_atr_max_pct': 0.10692502305690849, 'bull_tp_mult': 2.795548064784054, 'bull_tsl_mult': 0.8263908346927323, 'bull_time_stop': 266, 'bull_use_sma': False, 'bull_use_ema': True, 'bull_use_atr': False, 'bull_use_adx': False, 'bull_use_spike': False, 'bull_rsi_required': True, 'bear_strategy': 'breakout', 'bear_bb_std_mult': 3.4409199420532754, 'bear_rsi_os': 46, 'bear_rsi_ob': 70, 'bear_adx_thresh': 5.01886471830281, 'bear_atr_min_pct': 0.0033032492724551425, 'bear_atr_max_pct': 0.14158734174204662, 'bear_tp_mult': 2.9524988625549016, 'bear_tsl_mult': 0.795352618727075, 'bear_time_stop': 13, 'bear_use_sma': False, 'bear_use_ema': True, 'bear_use_atr': False, 'bear_use_adx': False, 'bear_use_spike': False, 'bear_rsi_required': True, 'sideways_strategy': 'breakout', 'sideways_bb_std_mult': 2.5962141035220765, 'sideways_rsi_os': 21, 'sideways_rsi_ob': 95, 'sideways_adx_thresh': 11.170587830496562, 'sideways_atr_min_pct': 0.014921274645672361, 'sideways_atr_max_pct': 0.04573918324737504, 'sideways_tp_mult': 2.9101610082883953, 'sideways_tsl_mult': 0.43003702694570667, 'sideways_time_stop': 18, 'sideways_use_sma': False, 'sideways_use_ema': False, 'sideways_use_atr': True, 'sideways_use_adx': False, 'sideways_use_spike': True, 'sideways_rsi_required': True}.
[I 2025-08-31 11:42:01,033] Trial 813 finished with values: [-1000000000.0, 1000000000.0] and parameters: {'p_sma': 14, 'p_std': 52, 'p_atr': 14, 'p_adx': 13, 'rsi_period': 55, 'ema1': 30, 'ema2': 39, 'slip_atr_k': 0.03505440847829885, 'slip_spread_k': 0.13952637930213135, 'spread_hl_frac': 0.004995039949776686, 'bb_std_mult': 2.3344028276542828, 'rsi_os': 33, 'rsi_ob': 92, 'vol_spike': 0.12237579481509935, 'adx_thresh': 30.34589992784255, 'atr_min_pct': 0.014259472159723683, 'atr_max_pct': 0.13311550055301213, 'tp_mult': 1.4927030766817542, 'tsl_mult': 0.12644997910300707, 'strategy': 'mean_reversion', 'time_stop': 177, 'use_sma': True, 'use_atr': True, 'use_adx': False, 'use_ema': False, 'use_spike': True, 'rsi_required': False, 'edge_k': 0.4870183105853254, 'edge_cap': 0.7783317723353661, 'bull_strategy': 'mean_reversion', 'bull_bb_std_mult': 0.5532796727150793, 'bull_rsi_os': 24, 'bull_rsi_ob': 86, 'bull_adx_thresh': 5.031409213862447, 'bull_atr_min_pct': 0.0024572060165639602, 'bull_atr_max_pct': 0.11016703953310508, 'bull_tp_mult': 2.7843450994019876, 'bull_tsl_mult': 0.8245931966474576, 'bull_time_stop': 268, 'bull_use_sma': False, 'bull_use_ema': True, 'bull_use_atr': True, 'bull_use_adx': False, 'bull_use_spike': False, 'bull_rsi_required': False, 'bear_strategy': 'mean_reversion', 'bear_bb_std_mult': 3.4743532853525347, 'bear_rsi_os': 46, 'bear_rsi_ob': 70, 'bear_adx_thresh': 5.132158473014113, 'bear_atr_min_pct': 0.003431740372176649, 'bear_atr_max_pct': 0.14613670422055106, 'bear_tp_mult': 2.9508364743045017, 'bear_tsl_mult': 0.7891353978577217, 'bear_time_stop': 11, 'bear_use_sma': True, 'bear_use_ema': True, 'bear_use_atr': False, 'bear_use_adx': True, 'bear_use_spike': False, 'bear_rsi_required': True, 'sideways_strategy': 'breakout', 'sideways_bb_std_mult': 2.5886038151432182, 'sideways_rsi_os': 22, 'sideways_rsi_ob': 95, 'sideways_adx_thresh': 11.336588035178263, 'sideways_atr_min_pct': 0.01558760157180752, 'sideways_atr_max_pct': 0.05081547715630355, 'sideways_tp_mult': 2.915763244485444, 'sideways_tsl_mult': 0.44003237024157194, 'sideways_time_stop': 19, 'sideways_use_sma': True, 'sideways_use_ema': True, 'sideways_use_atr': True, 'sideways_use_adx': True, 'sideways_use_spike': True, 'sideways_rsi_required': False}.
[I 2025-08-31 11:42:40,019] Trial 815 finished with values: [-1000000000.0, 1000000000.0] and parameters: {'p_sma': 12, 'p_std': 27, 'p_atr': 14, 'p_adx': 21, 'rsi_period': 55, 'ema1': 13, 'ema2': 41, 'slip_atr_k': 0.041356728041835975, 'slip_spread_k': 0.1348243046989369, 'spread_hl_frac': 0.0037077076799943744, 'bb_std_mult': 2.388383873005288, 'rsi_os': 32, 'rsi_ob': 93, 'vol_spike': 0.11381991297211416, 'adx_thresh': 30.469687065099397, 'atr_min_pct': 0.014329100787449733, 'atr_max_pct': 0.13306730684312357, 'tp_mult': 1.373702780293177, 'tsl_mult': 0.13068467272812034, 'strategy': 'mean_reversion', 'time_stop': 186, 'use_sma': True, 'use_atr': True, 'use_adx': False, 'use_ema': False, 'use_spike': True, 'rsi_required': False, 'edge_k': 0.4837609997294364, 'edge_cap': 0.8953776245736511, 'bull_strategy': 'breakout', 'bull_bb_std_mult': 0.5049635749887694, 'bull_rsi_os': 25, 'bull_rsi_ob': 87, 'bull_adx_thresh': 5.479413009470793, 'bull_atr_min_pct': 0.0019446396806382473, 'bull_atr_max_pct': 0.1027452191512375, 'bull_tp_mult': 2.836367234479421, 'bull_tsl_mult': 0.81521273845952, 'bull_time_stop': 266, 'bull_use_sma': False, 'bull_use_ema': True, 'bull_use_atr': True, 'bull_use_adx': False, 'bull_use_spike': False, 'bull_rsi_required': False, 'bear_strategy': 'mean_reversion', 'bear_bb_std_mult': 3.45905425575952, 'bear_rsi_os': 46, 'bear_rsi_ob': 70, 'bear_adx_thresh': 5.0406781731501935, 'bear_atr_min_pct': 0.0032315422850548257, 'bear_atr_max_pct': 0.1449581309727925, 'bear_tp_mult': 2.9513513236856337, 'bear_tsl_mult': 0.7749460513270622, 'bear_time_stop': 9, 'bear_use_sma': True, 'bear_use_ema': False, 'bear_use_atr': True, 'bear_use_adx': True, 'bear_use_spike': False, 'bear_rsi_required': True, 'sideways_strategy': 'breakout', 'sideways_bb_std_mult': 2.537594392417035, 'sideways_rsi_os': 21, 'sideways_rsi_ob': 95, 'sideways_adx_thresh': 11.286340711957209, 'sideways_atr_min_pct': 0.015923541426430935, 'sideways_atr_max_pct': 0.047403099300005434, 'sideways_tp_mult': 2.9594783694007676, 'sideways_tsl_mult': 0.4156841891117424, 'sideways_time_stop': 18, 'sideways_use_sma': True, 'sideways_use_ema': True, 'sideways_use_atr': True, 'sideways_use_adx': True, 'sideways_use_spike': True, 'sideways_rsi_required': False}.
[I 2025-08-31 11:42:40,626] Trial 816 finished with values: [-1000000000.0, 1000000000.0] and parameters: {'p_sma': 24, 'p_std': 57, 'p_atr': 14, 'p_adx': 21, 'rsi_period': 76, 'ema1': 13, 'ema2': 40, 'slip_atr_k': 0.08279661061157509, 'slip_spread_k': 0.11543003778639484, 'spread_hl_frac': 0.004322079256250288, 'bb_std_mult': 2.3810141998568723, 'rsi_os': 32, 'rsi_ob': 93, 'vol_spike': 0.1116524359507328, 'adx_thresh': 30.48183323446803, 'atr_min_pct': 0.014168478943823021, 'atr_max_pct': 0.13693986380348616, 'tp_mult': 1.3600823142000635, 'tsl_mult': 0.147236034593697, 'strategy': 'mean_reversion', 'time_stop': 182, 'use_sma': False, 'use_atr': True, 'use_adx': False, 'use_ema': False, 'use_spike': True, 'rsi_required': False, 'edge_k': 0.44814191767280764, 'edge_cap': 0.6397796512678707, 'bull_strategy': 'breakout', 'bull_bb_std_mult': 0.5405114042038525, 'bull_rsi_os': 25, 'bull_rsi_ob': 88, 'bull_adx_thresh': 5.5839662635101, 'bull_atr_min_pct': 0.0023560596116204494, 'bull_atr_max_pct': 0.10330752938408647, 'bull_tp_mult': 2.7425059732972117, 'bull_tsl_mult': 0.7873794183685362, 'bull_time_stop': 264, 'bull_use_sma': False, 'bull_use_ema': True, 'bull_use_atr': True, 'bull_use_adx': False, 'bull_use_spike': False, 'bull_rsi_required': False, 'bear_strategy': 'mean_reversion', 'bear_bb_std_mult': 3.3556989087750306, 'bear_rsi_os': 46, 'bear_rsi_ob': 70, 'bear_adx_thresh': 5.035053277635951, 'bear_atr_min_pct': 0.003963066155148622, 'bear_atr_max_pct': 0.1453566119743525, 'bear_tp_mult': 2.9703312483414477, 'bear_tsl_mult': 0.7679960375809674, 'bear_time_stop': 12, 'bear_use_sma': True, 'bear_use_ema': False, 'bear_use_atr': True, 'bear_use_adx': True, 'bear_use_spike': False, 'bear_rsi_required': True, 'sideways_strategy': 'breakout', 'sideways_bb_std_mult': 2.5804918537189914, 'sideways_rsi_os': 21, 'sideways_rsi_ob': 95, 'sideways_adx_thresh': 11.082427508849607, 'sideways_atr_min_pct': 0.015915617093367886, 'sideways_atr_max_pct': 0.044767936719806896, 'sideways_tp_mult': 2.9603554867948234, 'sideways_tsl_mult': 0.4193164543106275, 'sideways_time_stop': 69, 'sideways_use_sma': True, 'sideways_use_ema': True, 'sideways_use_atr': True, 'sideways_use_adx': True, 'sideways_use_spike': True, 'sideways_rsi_required': False}.
[I 2025-08-31 11:42:40,791] Trial 817 finished with values: [-1000000000.0, 1000000000.0] and parameters: {'p_sma': 13, 'p_std': 27, 'p_atr': 16, 'p_adx': 21, 'rsi_period': 50, 'ema1': 5, 'ema2': 40, 'slip_atr_k': 0.08037572051058277, 'slip_spread_k': 0.1095425145828069, 'spread_hl_frac': 0.004264222723910407, 'bb_std_mult': 2.385450127566458, 'rsi_os': 32, 'rsi_ob': 93, 'vol_spike': 0.1137048126440651, 'adx_thresh': 30.339830178722785, 'atr_min_pct': 0.015111771296721024, 'atr_max_pct': 0.13701731863684158, 'tp_mult': 1.374296472364991, 'tsl_mult': 0.11385947218815934, 'strategy': 'mean_reversion', 'time_stop': 185, 'use_sma': False, 'use_atr': True, 'use_adx': False, 'use_ema': False, 'use_spike': False, 'rsi_required': False, 'edge_k': 0.4373033119942148, 'edge_cap': 0.6512553355218801, 'bull_strategy': 'breakout', 'bull_bb_std_mult': 0.505462730549463, 'bull_rsi_os': 25, 'bull_rsi_ob': 81, 'bull_adx_thresh': 5.614508460085099, 'bull_atr_min_pct': 0.0023914373354181812, 'bull_atr_max_pct': 0.09991362998562446, 'bull_tp_mult': 2.846060544043479, 'bull_tsl_mult': 0.7975748303181335, 'bull_time_stop': 274, 'bull_use_sma': False, 'bull_use_ema': True, 'bull_use_atr': True, 'bull_use_adx': False, 'bull_use_spike': True, 'bull_rsi_required': False, 'bear_strategy': 'mean_reversion', 'bear_bb_std_mult': 3.3426963894877435, 'bear_rsi_os': 47, 'bear_rsi_ob': 70, 'bear_adx_thresh': 5.2943388731313314, 'bear_atr_min_pct': 0.004037863467616733, 'bear_atr_max_pct': 0.14405292010229975, 'bear_tp_mult': 2.9999065604774473, 'bear_tsl_mult': 0.7707546707071911, 'bear_time_stop': 12, 'bear_use_sma': True, 'bear_use_ema': False, 'bear_use_atr': True, 'bear_use_adx': True, 'bear_use_spike': False, 'bear_rsi_required': True, 'sideways_strategy': 'breakout', 'sideways_bb_std_mult': 2.5420881656119185, 'sideways_rsi_os': 22, 'sideways_rsi_ob': 95, 'sideways_adx_thresh': 10.837196474638793, 'sideways_atr_min_pct': 0.015890669804781855, 'sideways_atr_max_pct': 0.04969866263526414, 'sideways_tp_mult': 2.9726153391510612, 'sideways_tsl_mult': 0.41568413861915476, 'sideways_time_stop': 18, 'sideways_use_sma': True, 'sideways_use_ema': True, 'sideways_use_atr': True, 'sideways_use_adx': True, 'sideways_use_spike': True, 'sideways_rsi_required': False}.
[I 2025-08-31 11:42:41,010] Trial 814 finished with values: [-0.013458803406905417, 0.013301850521179744] and parameters: {'p_sma': 26, 'p_std': 26, 'p_atr': 14, 'p_adx': 21, 'rsi_period': 55, 'ema1': 20, 'ema2': 40, 'slip_atr_k': 0.040497717362007135, 'slip_spread_k': 0.132974011556813, 'spread_hl_frac': 0.004563915916083343, 'bb_std_mult': 2.394768976497908, 'rsi_os': 32, 'rsi_ob': 93, 'vol_spike': 0.11323267250762062, 'adx_thresh': 30.351054374135146, 'atr_min_pct': 0.014088194536147779, 'atr_max_pct': 0.13258298099663746, 'tp_mult': 1.3764438317501408, 'tsl_mult': 0.13260668063788866, 'strategy': 'mean_reversion', 'time_stop': 184, 'use_sma': True, 'use_atr': True, 'use_adx': False, 'use_ema': False, 'use_spike': True, 'rsi_required': False, 'edge_k': 0.45453562044318463, 'edge_cap': 0.9026857423343746, 'bull_strategy': 'breakout', 'bull_bb_std_mult': 0.5553167158169927, 'bull_rsi_os': 23, 'bull_rsi_ob': 87, 'bull_adx_thresh': 5.609363134405576, 'bull_atr_min_pct': 0.002244001287623724, 'bull_atr_max_pct': 0.1047580542098837, 'bull_tp_mult': 2.7316450072141576, 'bull_tsl_mult': 0.8028647629631742, 'bull_time_stop': 263, 'bull_use_sma': False, 'bull_use_ema': True, 'bull_use_atr': True, 'bull_use_adx': False, 'bull_use_spike': False, 'bull_rsi_required': False, 'bear_strategy': 'mean_reversion', 'bear_bb_std_mult': 3.325164709502851, 'bear_rsi_os': 45, 'bear_rsi_ob': 70, 'bear_adx_thresh': 5.0201381701565735, 'bear_atr_min_pct': 0.0038551956831616345, 'bear_atr_max_pct': 0.14758181768226883, 'bear_tp_mult': 2.9474260711096836, 'bear_tsl_mult': 0.7712730713746434, 'bear_time_stop': 13, 'bear_use_sma': True, 'bear_use_ema': False, 'bear_use_atr': True, 'bear_use_adx': True, 'bear_use_spike': False, 'bear_rsi_required': True, 'sideways_strategy': 'breakout', 'sideways_bb_std_mult': 2.539493278594196, 'sideways_rsi_os': 22, 'sideways_rsi_ob': 95, 'sideways_adx_thresh': 11.092649056964923, 'sideways_atr_min_pct': 0.016056093928471918, 'sideways_atr_max_pct': 0.04633184360047957, 'sideways_tp_mult': 2.9527359028136617, 'sideways_tsl_mult': 0.4194336148288724, 'sideways_time_stop': 18, 'sideways_use_sma': True, 'sideways_use_ema': True, 'sideways_use_atr': True, 'sideways_use_adx': True, 'sideways_use_spike': True, 'sideways_rsi_required': False}.
[I 2025-08-31 11:43:17,433] Trial 821 finished with values: [-0.05815753339632079, 0.05792235085809178] and parameters: {'p_sma': 47, 'p_std': 47, 'p_atr': 13, 'p_adx': 14, 'rsi_period': 50, 'ema1': 12, 'ema2': 41, 'slip_atr_k': 0.10399666831606022, 'slip_spread_k': 0.0766285055473363, 'spread_hl_frac': 0.005272674173159486, 'bb_std_mult': 2.4566111945377873, 'rsi_os': 32, 'rsi_ob': 93, 'vol_spike': 0.13116716688516777, 'adx_thresh': 30.267891070482825, 'atr_min_pct': 0.013112443876167784, 'atr_max_pct': 0.13423312698364281, 'tp_mult': 1.4318974739812584, 'tsl_mult': 0.08953635582575474, 'strategy': 'breakout', 'time_stop': 188, 'use_sma': True, 'use_atr': True, 'use_adx': False, 'use_ema': True, 'use_spike': False, 'rsi_required': False, 'edge_k': 0.4513090676070194, 'edge_cap': 0.9426006534042387, 'bull_strategy': 'breakout', 'bull_bb_std_mult': 0.5504834793317398, 'bull_rsi_os': 22, 'bull_rsi_ob': 82, 'bull_adx_thresh': 5.925835740537856, 'bull_atr_min_pct': 0.0029824556357100863, 'bull_atr_max_pct': 0.10157304096709023, 'bull_tp_mult': 2.520351798277052, 'bull_tsl_mult': 0.8475657694302267, 'bull_time_stop': 257, 'bull_use_sma': False, 'bull_use_ema': True, 'bull_use_atr': False, 'bull_use_adx': True, 'bull_use_spike': True, 'bull_rsi_required': True, 'bear_strategy': 'breakout', 'bear_bb_std_mult': 3.301965177905799, 'bear_rsi_os': 47, 'bear_rsi_ob': 71, 'bear_adx_thresh': 5.3106306888565555, 'bear_atr_min_pct': 0.003622925125767252, 'bear_atr_max_pct': 0.14195548913732728, 'bear_tp_mult': 2.923840787082708, 'bear_tsl_mult': 0.7750965223868497, 'bear_time_stop': 15, 'bear_use_sma': False, 'bear_use_ema': True, 'bear_use_atr': False, 'bear_use_adx': False, 'bear_use_spike': False, 'bear_rsi_required': True, 'sideways_strategy': 'breakout', 'sideways_bb_std_mult': 2.520088122340179, 'sideways_rsi_os': 23, 'sideways_rsi_ob': 95, 'sideways_adx_thresh': 12.159957802602797, 'sideways_atr_min_pct': 0.016279973451033086, 'sideways_atr_max_pct': 0.045091238275579766, 'sideways_tp_mult': 2.8720562849107405, 'sideways_tsl_mult': 0.42345255137774396, 'sideways_time_stop': 156, 'sideways_use_sma': False, 'sideways_use_ema': False, 'sideways_use_atr': True, 'sideways_use_adx': False, 'sideways_use_spike': True, 'sideways_rsi_required': True}.
