[I 2025-08-31 10:36:46,702] Trial 323 finished with values: [-1000000000.0, 1000000000.0] and parameters: {'p_sma': 16, 'p_std': 31, 'p_atr': 11, 'p_adx': 14, 'rsi_period': 49, 'ema1': 14, 'ema2': 58, 'slip_atr_k': 0.012768474615579091, 'slip_spread_k': 0.7160642853686444, 'spread_hl_frac': 0.008470970726104319, 'bb_std_mult': 2.772405456242463, 'rsi_os': 25, 'rsi_ob': 78, 'vol_spike': 0.2583805645227625, 'adx_thresh': 27.100266755869182, 'atr_min_pct': 0.0070277934956186035, 'atr_max_pct': 0.09946086959260843, 'tp_mult': 2.357323487819774, 'tsl_mult': 0.2370180034123714, 'strategy': 'breakout', 'time_stop': 97, 'use_sma': False, 'use_atr': False, 'use_adx': True, 'use_ema': True, 'use_spike': False, 'rsi_required': True, 'edge_k': 0.28133879240039206, 'edge_cap': 0.4767835627894359, 'bull_strategy': 'breakout', 'bull_bb_std_mult': 0.6076173397394061, 'bull_rsi_os': 13, 'bull_rsi_ob': 75, 'bull_adx_thresh': 6.372659129514945, 'bull_atr_min_pct': 0.0052189295253274315, 'bull_atr_max_pct': 0.08719431889250139, 'bull_tp_mult': 1.7860461861938581, 'bull_tsl_mult': 0.33952558916496106, 'bull_time_stop': 55, 'bull_use_sma': True, 'bull_use_ema': False, 'bull_use_atr': False, 'bull_use_adx': False, 'bull_use_spike': False, 'bull_rsi_required': False, 'bear_strategy': 'breakout', 'bear_bb_std_mult': 2.04039357607139, 'bear_rsi_os': 43, 'bear_rsi_ob': 87, 'bear_adx_thresh': 6.328562449165255, 'bear_atr_min_pct': 0.009314446145045124, 'bear_atr_max_pct': 0.13972164884150817, 'bear_tp_mult': 2.862554610530265, 'bear_tsl_mult': 0.45743132639423817, 'bear_time_stop': 20, 'bear_use_sma': True, 'bear_use_ema': True, 'bear_use_atr': True, 'bear_use_adx': False, 'bear_use_spike': True, 'bear_rsi_required': False, 'sideways_strategy': 'mean_reversion', 'sideways_bb_std_mult': 2.5851415278269894, 'sideways_rsi_os': 7, 'sideways_rsi_ob': 93, 'sideways_adx_thresh': 26.336791424998186, 'sideways_atr_min_pct': 0.018833588305053193, 'sideways_atr_max_pct': 0.05511106136328346, 'sideways_tp_mult': 1.8376874741615494, 'sideways_tsl_mult': 0.12972259285731547, 'sideways_time_stop': 18, 'sideways_use_sma': False, 'sideways_use_ema': False, 'sideways_use_atr': False, 'sideways_use_adx': False, 'sideways_use_spike': False, 'sideways_rsi_required': True}.
[I 2025-08-31 10:36:46,703] Trial 325 finished with values: [-1000000000.0, 1000000000.0] and parameters: {'p_sma': 16, 'p_std': 32, 'p_atr': 11, 'p_adx': 14, 'rsi_period': 49, 'ema1': 14, 'ema2': 57, 'slip_atr_k': 0.010947906488139205, 'slip_spread_k': 0.6954885007488183, 'spread_hl_frac': 0.006761057189265222, 'bb_std_mult': 2.788573902809104, 'rsi_os': 25, 'rsi_ob': 78, 'vol_spike': 0.2566265404999112, 'adx_thresh': 27.879726871706403, 'atr_min_pct': 0.00697222358469983, 'atr_max_pct': 0.09978995792502598, 'tp_mult': 2.294645995429641, 'tsl_mult': 0.24202363475227706, 'strategy': 'breakout', 'time_stop': 75, 'use_sma': False, 'use_atr': False, 'use_adx': True, 'use_ema': True, 'use_spike': False, 'rsi_required': True, 'edge_k': 0.35878391084505157, 'edge_cap': 0.42163701717460583, 'bull_strategy': 'mean_reversion', 'bull_bb_std_mult': 0.5572029543093195, 'bull_rsi_os': 13, 'bull_rsi_ob': 75, 'bull_adx_thresh': 5.993280649499586, 'bull_atr_min_pct': 0.004264310238823312, 'bull_atr_max_pct': 0.08725076747839185, 'bull_tp_mult': 1.8202158206392134, 'bull_tsl_mult': 0.3120074934216011, 'bull_time_stop': 70, 'bull_use_sma': True, 'bull_use_ema': False, 'bull_use_atr': False, 'bull_use_adx': False, 'bull_use_spike': False, 'bull_rsi_required': False, 'bear_strategy': 'mean_reversion', 'bear_bb_std_mult': 1.991619232443345, 'bear_rsi_os': 43, 'bear_rsi_ob': 85, 'bear_adx_thresh': 5.711429549487177, 'bear_atr_min_pct': 0.007176734642299117, 'bear_atr_max_pct': 0.13103816116536526, 'bear_tp_mult': 2.8927240523082496, 'bear_tsl_mult': 0.48454714938854526, 'bear_time_stop': 28, 'bear_use_sma': False, 'bear_use_ema': True, 'bear_use_atr': True, 'bear_use_adx': False, 'bear_use_spike': True, 'bear_rsi_required': True, 'sideways_strategy': 'mean_reversion', 'sideways_bb_std_mult': 2.6815154205535428, 'sideways_rsi_os': 6, 'sideways_rsi_ob': 91, 'sideways_adx_thresh': 26.988125761816637, 'sideways_atr_min_pct': 0.018918599992713895, 'sideways_atr_max_pct': 0.06272590333334153, 'sideways_tp_mult': 1.9048482522873553, 'sideways_tsl_mult': 0.12461365166974739, 'sideways_time_stop': 20, 'sideways_use_sma': False, 'sideways_use_ema': False, 'sideways_use_atr': False, 'sideways_use_adx': False, 'sideways_use_spike': False, 'sideways_rsi_required': True}.
[I 2025-08-31 10:37:17,622] Trial 326 finished with values: [-1000000000.0, 1000000000.0] and parameters: {'p_sma': 17, 'p_std': 32, 'p_atr': 10, 'p_adx': 14, 'rsi_period': 48, 'ema1': 14, 'ema2': 58, 'slip_atr_k': 0.016528833908786837, 'slip_spread_k': 0.6920710643610364, 'spread_hl_frac': 0.008387662695877972, 'bb_std_mult': 2.797314365860917, 'rsi_os': 28, 'rsi_ob': 78, 'vol_spike': 0.25696385273532885, 'adx_thresh': 27.88026024521503, 'atr_min_pct': 0.006925711133228688, 'atr_max_pct': 0.09960498065195152, 'tp_mult': 2.291711046143147, 'tsl_mult': 0.22947339927927793, 'strategy': 'breakout', 'time_stop': 76, 'use_sma': False, 'use_atr': False, 'use_adx': True, 'use_ema': True, 'use_spike': False, 'rsi_required': True, 'edge_k': 0.33423676229331145, 'edge_cap': 0.4234342093444893, 'bull_strategy': 'mean_reversion', 'bull_bb_std_mult': 0.7096849373227768, 'bull_rsi_os': 13, 'bull_rsi_ob': 75, 'bull_adx_thresh': 6.159409566571704, 'bull_atr_min_pct': 0.004223300661145259, 'bull_atr_max_pct': 0.08823471663732013, 'bull_tp_mult': 1.8282457366023064, 'bull_tsl_mult': 0.32964037233799204, 'bull_time_stop': 57, 'bull_use_sma': True, 'bull_use_ema': False, 'bull_use_atr': False, 'bull_use_adx': False, 'bull_use_spike': False, 'bull_rsi_required': False, 'bear_strategy': 'mean_reversion', 'bear_bb_std_mult': 1.9892360007045262, 'bear_rsi_os': 43, 'bear_rsi_ob': 94, 'bear_adx_thresh': 7.416875624589795, 'bear_atr_min_pct': 0.0076882824557012765, 'bear_atr_max_pct': 0.1410984713664996, 'bear_tp_mult': 2.8488451649462716, 'bear_tsl_mult': 0.4653603986505252, 'bear_time_stop': 27, 'bear_use_sma': False, 'bear_use_ema': True, 'bear_use_atr': True, 'bear_use_adx': False, 'bear_use_spike': True, 'bear_rsi_required': True, 'sideways_strategy': 'mean_reversion', 'sideways_bb_std_mult': 2.6804082120522748, 'sideways_rsi_os': 5, 'sideways_rsi_ob': 92, 'sideways_adx_thresh': 27.045576107016743, 'sideways_atr_min_pct': 0.018893620845398248, 'sideways_atr_max_pct': 0.06317614052993603, 'sideways_tp_mult': 1.8972065580753537, 'sideways_tsl_mult': 0.12982204373296258, 'sideways_time_stop': 19, 'sideways_use_sma': False, 'sideways_use_ema': False, 'sideways_use_atr': False, 'sideways_use_adx': False, 'sideways_use_spike': False, 'sideways_rsi_required': True}.
[I 2025-08-31 10:37:17,995] Trial 327 finished with values: [-1000000000.0, 1000000000.0] and parameters: {'p_sma': 17, 'p_std': 31, 'p_atr': 11, 'p_adx': 13, 'rsi_period': 49, 'ema1': 14, 'ema2': 57, 'slip_atr_k': 0.013704170741517707, 'slip_spread_k': 0.6916004834798963, 'spread_hl_frac': 0.006841633062226182, 'bb_std_mult': 2.829828315150437, 'rsi_os': 53, 'rsi_ob': 80, 'vol_spike': 0.04322794743645671, 'adx_thresh': 27.831738876294988, 'atr_min_pct': 0.006841449726611683, 'atr_max_pct': 0.09927297245771464, 'tp_mult': 2.201373921438721, 'tsl_mult': 0.2250745782416633, 'strategy': 'breakout', 'time_stop': 101, 'use_sma': True, 'use_atr': False, 'use_adx': True, 'use_ema': True, 'use_spike': False, 'rsi_required': True, 'edge_k': 0.2715729378976321, 'edge_cap': 0.4861016431621875, 'bull_strategy': 'mean_reversion', 'bull_bb_std_mult': 0.6925656456206455, 'bull_rsi_os': 13, 'bull_rsi_ob': 76, 'bull_adx_thresh': 5.695742555254041, 'bull_atr_min_pct': 0.004328775997100332, 'bull_atr_max_pct': 0.09701563923665377, 'bull_tp_mult': 1.7516338865325485, 'bull_tsl_mult': 0.35449073181635676, 'bull_time_stop': 68, 'bull_use_sma': True, 'bull_use_ema': False, 'bull_use_atr': False, 'bull_use_adx': False, 'bull_use_spike': False, 'bull_rsi_required': False, 'bear_strategy': 'mean_reversion', 'bear_bb_std_mult': 1.9384024394904942, 'bear_rsi_os': 41, 'bear_rsi_ob': 84, 'bear_adx_thresh': 5.617722731869259, 'bear_atr_min_pct': 0.007428266306416929, 'bear_atr_max_pct': 0.13225413314078144, 'bear_tp_mult': 2.859783457449063, 'bear_tsl_mult': 0.4520897799499141, 'bear_time_stop': 28, 'bear_use_sma': False, 'bear_use_ema': True, 'bear_use_atr': False, 'bear_use_adx': False, 'bear_use_spike': True, 'bear_rsi_required': True, 'sideways_strategy': 'mean_reversion', 'sideways_bb_std_mult': 2.6834427006603763, 'sideways_rsi_os': 5, 'sideways_rsi_ob': 91, 'sideways_adx_thresh': 27.446765304059355, 'sideways_atr_min_pct': 0.01748712811739675, 'sideways_atr_max_pct': 0.055732422425789394, 'sideways_tp_mult': 1.887903411963804, 'sideways_tsl_mult': 0.11958413806812762, 'sideways_time_stop': 19, 'sideways_use_sma': False, 'sideways_use_ema': False, 'sideways_use_atr': False, 'sideways_use_adx': False, 'sideways_use_spike': False, 'sideways_rsi_required': False}.
[I 2025-08-31 10:37:18,186] Trial 328 finished with values: [-1000000000.0, 1000000000.0] and parameters: {'p_sma': 17, 'p_std': 36, 'p_atr': 12, 'p_adx': 13, 'rsi_period': 50, 'ema1': 14, 'ema2': 57, 'slip_atr_k': 0.021080403506487946, 'slip_spread_k': 0.6827648647909234, 'spread_hl_frac': 0.009127347207681154, 'bb_std_mult': 2.3437708303762377, 'rsi_os': 38, 'rsi_ob': 80, 'vol_spike': 0.2436222077478903, 'adx_thresh': 28.361939248348506, 'atr_min_pct': 0.006399037165685949, 'atr_max_pct': 0.09812113111798149, 'tp_mult': 2.200984496710371, 'tsl_mult': 0.29199737973256057, 'strategy': 'mean_reversion', 'time_stop': 103, 'use_sma': True, 'use_atr': False, 'use_adx': True, 'use_ema': True, 'use_spike': True, 'rsi_required': True, 'edge_k': 0.2454084455461015, 'edge_cap': 0.4920450702407784, 'bull_strategy': 'mean_reversion', 'bull_bb_std_mult': 0.6784281740753078, 'bull_rsi_os': 16, 'bull_rsi_ob': 76, 'bull_adx_thresh': 7.877004006835435, 'bull_atr_min_pct': 0.004310527842824888, 'bull_atr_max_pct': 0.09521735283627315, 'bull_tp_mult': 1.754534180155142, 'bull_tsl_mult': 0.36010946144862155, 'bull_time_stop': 66, 'bull_use_sma': True, 'bull_use_ema': False, 'bull_use_atr': False, 'bull_use_adx': False, 'bull_use_spike': False, 'bull_rsi_required': True, 'bear_strategy': 'breakout', 'bear_bb_std_mult': 1.7732393351868188, 'bear_rsi_os': 42, 'bear_rsi_ob': 83, 'bear_adx_thresh': 7.40743399755535, 'bear_atr_min_pct': 0.006365947551652014, 'bear_atr_max_pct': 0.12764027487493446, 'bear_tp_mult': 2.828952520880686, 'bear_tsl_mult': 0.28744414214322694, 'bear_time_stop': 27, 'bear_use_sma': False, 'bear_use_ema': False, 'bear_use_atr': False, 'bear_use_adx': False, 'bear_use_spike': True, 'bear_rsi_required': True, 'sideways_strategy': 'mean_reversion', 'sideways_bb_std_mult': 2.706819663206136, 'sideways_rsi_os': 5, 'sideways_rsi_ob': 90, 'sideways_adx_thresh': 25.95130821612729, 'sideways_atr_min_pct': 0.017536865296505215, 'sideways_atr_max_pct': 0.011087174357414742, 'sideways_tp_mult': 1.9190286209802274, 'sideways_tsl_mult': 0.11265296158698557, 'sideways_time_stop': 5, 'sideways_use_sma': True, 'sideways_use_ema': True, 'sideways_use_atr': False, 'sideways_use_adx': False, 'sideways_use_spike': False, 'sideways_rsi_required': False}.
[I 2025-08-31 10:37:18,555] Trial 329 finished with values: [-1000000000.0, 1000000000.0] and parameters: {'p_sma': 17, 'p_std': 30, 'p_atr': 12, 'p_adx': 13, 'rsi_period': 51, 'ema1': 14, 'ema2': 57, 'slip_atr_k': 0.01990972267261233, 'slip_spread_k': 0.6894887261000118, 'spread_hl_frac': 0.009321230244203007, 'bb_std_mult': 2.5726527344144436, 'rsi_os': 38, 'rsi_ob': 80, 'vol_spike': 0.24217334518898115, 'adx_thresh': 25.80609378148467, 'atr_min_pct': 0.006526804740732223, 'atr_max_pct': 0.09771981067262608, 'tp_mult': 2.4169492615296053, 'tsl_mult': 0.28324904895140146, 'strategy': 'mean_reversion', 'time_stop': 82, 'use_sma': True, 'use_atr': False, 'use_adx': True, 'use_ema': True, 'use_spike': True, 'rsi_required': True, 'edge_k': 0.265420502211191, 'edge_cap': 0.491978637465409, 'bull_strategy': 'mean_reversion', 'bull_bb_std_mult': 0.702621305120138, 'bull_rsi_os': 9, 'bull_rsi_ob': 76, 'bull_adx_thresh': 7.978603940643792, 'bull_atr_min_pct': 0.004199582256862822, 'bull_atr_max_pct': 0.09961363326276, 'bull_tp_mult': 1.7647294874291326, 'bull_tsl_mult': 0.35488964560498193, 'bull_time_stop': 294, 'bull_use_sma': True, 'bull_use_ema': False, 'bull_use_atr': False, 'bull_use_adx': False, 'bull_use_spike': False, 'bull_rsi_required': True, 'bear_strategy': 'breakout', 'bear_bb_std_mult': 1.8850006563198674, 'bear_rsi_os': 40, 'bear_rsi_ob': 90, 'bear_adx_thresh': 7.388332852736514, 'bear_atr_min_pct': 0.006287218444367058, 'bear_atr_max_pct': 0.12822691594517427, 'bear_tp_mult': 2.853325945498026, 'bear_tsl_mult': 0.5003219576903992, 'bear_time_stop': 29, 'bear_use_sma': False, 'bear_use_ema': False, 'bear_use_atr': False, 'bear_use_adx': False, 'bear_use_spike': True, 'bear_rsi_required': True, 'sideways_strategy': 'mean_reversion', 'sideways_bb_std_mult': 2.702996784657139, 'sideways_rsi_os': 5, 'sideways_rsi_ob': 90, 'sideways_adx_thresh': 27.280657395719984, 'sideways_atr_min_pct': 0.017518795143763366, 'sideways_atr_max_pct': 0.06516306843576136, 'sideways_tp_mult': 1.886055780036178, 'sideways_tsl_mult': 0.11217827727948139, 'sideways_time_stop': 11, 'sideways_use_sma': True, 'sideways_use_ema': True, 'sideways_use_atr': False, 'sideways_use_adx': False, 'sideways_use_spike': False, 'sideways_rsi_required': False}.
[I 2025-08-31 10:37:50,996] Trial 333 finished with values: [-1000000000.0, 1000000000.0] and parameters: {'p_sma': 15, 'p_std': 36, 'p_atr': 10, 'p_adx': 14, 'rsi_period': 48, 'ema1': 13, 'ema2': 60, 'slip_atr_k': 0.0024067394992147266, 'slip_spread_k': 0.6654459133636912, 'spread_hl_frac': 0.009885520485425334, 'bb_std_mult': 2.446103616309422, 'rsi_os': 45, 'rsi_ob': 77, 'vol_spike': 0.2611597443094894, 'adx_thresh': 26.218823026592993, 'atr_min_pct': 0.006035695809544098, 'atr_max_pct': 0.10461090557774419, 'tp_mult': 1.4612051304362836, 'tsl_mult': 0.26741799201557076, 'strategy': 'breakout', 'time_stop': 62, 'use_sma': True, 'use_atr': False, 'use_adx': True, 'use_ema': False, 'use_spike': True, 'rsi_required': True, 'edge_k': 0.23678066632705125, 'edge_cap': 0.44256157553149644, 'bull_strategy': 'breakout', 'bull_bb_std_mult': 0.7304639067928878, 'bull_rsi_os': 7, 'bull_rsi_ob': 74, 'bull_adx_thresh': 7.568499353587377, 'bull_atr_min_pct': 0.003630627217726635, 'bull_atr_max_pct': 0.09081248885173963, 'bull_tp_mult': 1.7761735362259994, 'bull_tsl_mult': 0.3643517991923215, 'bull_time_stop': 68, 'bull_use_sma': True, 'bull_use_ema': False, 'bull_use_atr': False, 'bull_use_adx': False, 'bull_use_spike': False, 'bull_rsi_required': True, 'bear_strategy': 'breakout', 'bear_bb_std_mult': 1.679436818630471, 'bear_rsi_os': 41, 'bear_rsi_ob': 92, 'bear_adx_thresh': 6.701717776603175, 'bear_atr_min_pct': 0.008576267856043707, 'bear_atr_max_pct': 0.1197926076092021, 'bear_tp_mult': 1.9561500483533416, 'bear_tsl_mult': 0.5090795148002955, 'bear_time_stop': 17, 'bear_use_sma': False, 'bear_use_ema': True, 'bear_use_atr': False, 'bear_use_adx': True, 'bear_use_spike': True, 'bear_rsi_required': False, 'sideways_strategy': 'mean_reversion', 'sideways_bb_std_mult': 2.5929545277811297, 'sideways_rsi_os': 7, 'sideways_rsi_ob': 94, 'sideways_adx_thresh': 26.042532516575438, 'sideways_atr_min_pct': 0.016820828834777136, 'sideways_atr_max_pct': 0.06929184214624942, 'sideways_tp_mult': 1.934797936210147, 'sideways_tsl_mult': 0.15055420029855787, 'sideways_time_stop': 21, 'sideways_use_sma': False, 'sideways_use_ema': False, 'sideways_use_atr': False, 'sideways_use_adx': False, 'sideways_use_spike': False, 'sideways_rsi_required': True}.
[I 2025-08-31 10:37:51,590] Trial 330 finished with values: [-1000000000.0, 1000000000.0] and parameters: {'p_sma': 15, 'p_std': 34, 'p_atr': 12, 'p_adx': 13, 'rsi_period': 51, 'ema1': 14, 'ema2': 57, 'slip_atr_k': 0.022484261168961413, 'slip_spread_k': 0.6740739607474011, 'spread_hl_frac': 0.009225264167744506, 'bb_std_mult': 2.5401653819772867, 'rsi_os': 26, 'rsi_ob': 79, 'vol_spike': 0.24989542599953724, 'adx_thresh': 28.447182538101124, 'atr_min_pct': 0.006285884431216595, 'atr_max_pct': 0.0977417737496476, 'tp_mult': 1.4380555807476008, 'tsl_mult': 0.2890935860098165, 'strategy': 'mean_reversion', 'time_stop': 104, 'use_sma': True, 'use_atr': False, 'use_adx': True, 'use_ema': True, 'use_spike': True, 'rsi_required': True, 'edge_k': 0.2566199418665964, 'edge_cap': 0.4888664216304922, 'bull_strategy': 'breakout', 'bull_bb_std_mult': 0.7225670879522057, 'bull_rsi_os': 11, 'bull_rsi_ob': 76, 'bull_adx_thresh': 8.229003902522606, 'bull_atr_min_pct': 0.0038053820972792874, 'bull_atr_max_pct': 0.09976790773063118, 'bull_tp_mult': 1.770978492067018, 'bull_tsl_mult': 0.28841410469738643, 'bull_time_stop': 63, 'bull_use_sma': True, 'bull_use_ema': False, 'bull_use_atr': False, 'bull_use_adx': False, 'bull_use_spike': False, 'bull_rsi_required': True, 'bear_strategy': 'breakout', 'bear_bb_std_mult': 1.765001724983526, 'bear_rsi_os': 41, 'bear_rsi_ob': 83, 'bear_adx_thresh': 5.00377147258941, 'bear_atr_min_pct': 0.009011187129829264, 'bear_atr_max_pct': 0.1283856481618672, 'bear_tp_mult': 1.3838318157026634, 'bear_tsl_mult': 0.5032289751663565, 'bear_time_stop': 14, 'bear_use_sma': False, 'bear_use_ema': False, 'bear_use_atr': False, 'bear_use_adx': False, 'bear_use_spike': True, 'bear_rsi_required': False, 'sideways_strategy': 'mean_reversion', 'sideways_bb_std_mult': 2.073751480914287, 'sideways_rsi_os': 5, 'sideways_rsi_ob': 90, 'sideways_adx_thresh': 26.14333467133961, 'sideways_atr_min_pct': 0.017537287045767114, 'sideways_atr_max_pct': 0.05494267496107917, 'sideways_tp_mult': 1.9301606893637187, 'sideways_tsl_mult': 0.14751312139555112, 'sideways_time_stop': 24, 'sideways_use_sma': True, 'sideways_use_ema': True, 'sideways_use_atr': False, 'sideways_use_adx': False, 'sideways_use_spike': False, 'sideways_rsi_required': False}.
[I 2025-08-31 10:37:51,779] Trial 331 finished with values: [-1000000000.0, 1000000000.0] and parameters: {'p_sma': 15, 'p_std': 34, 'p_atr': 12, 'p_adx': 13, 'rsi_period': 52, 'ema1': 13, 'ema2': 60, 'slip_atr_k': 0.020791734681166015, 'slip_spread_k': 0.6721091909464675, 'spread_hl_frac': 0.009352093200485656, 'bb_std_mult': 2.558421737564913, 'rsi_os': 26, 'rsi_ob': 79, 'vol_spike': 0.24153189253638438, 'adx_thresh': 26.382756984784837, 'atr_min_pct': 0.005977916368257385, 'atr_max_pct': 0.09705084029062214, 'tp_mult': 2.4142183616109247, 'tsl_mult': 0.28277579868416114, 'strategy': 'mean_reversion', 'time_stop': 62, 'use_sma': True, 'use_atr': False, 'use_adx': True, 'use_ema': False, 'use_spike': True, 'rsi_required': True, 'edge_k': 0.24443837061129947, 'edge_cap': 0.443652755602078, 'bull_strategy': 'breakout', 'bull_bb_std_mult': 0.71211973713932, 'bull_rsi_os': 6, 'bull_rsi_ob': 76, 'bull_adx_thresh': 7.954872889274787, 'bull_atr_min_pct': 0.005584915525150185, 'bull_atr_max_pct': 0.10052549072733741, 'bull_tp_mult': 1.7567551262906251, 'bull_tsl_mult': 0.3588442375216334, 'bull_time_stop': 67, 'bull_use_sma': True, 'bull_use_ema': False, 'bull_use_atr': False, 'bull_use_adx': False, 'bull_use_spike': False, 'bull_rsi_required': True, 'bear_strategy': 'breakout', 'bear_bb_std_mult': 1.7631551289723915, 'bear_rsi_os': 41, 'bear_rsi_ob': 81, 'bear_adx_thresh': 5.009975497246478, 'bear_atr_min_pct': 0.0087431079288798, 'bear_atr_max_pct': 0.12768256999918173, 'bear_tp_mult': 1.6551291287971208, 'bear_tsl_mult': 0.5076721083357433, 'bear_time_stop': 17, 'bear_use_sma': False, 'bear_use_ema': False, 'bear_use_atr': False, 'bear_use_adx': True, 'bear_use_spike': True, 'bear_rsi_required': False, 'sideways_strategy': 'mean_reversion', 'sideways_bb_std_mult': 2.5385453518211194, 'sideways_rsi_os': 8, 'sideways_rsi_ob': 90, 'sideways_adx_thresh': 26.12708571531404, 'sideways_atr_min_pct': 0.01975646689759965, 'sideways_atr_max_pct': 0.08447341472532, 'sideways_tp_mult': 1.9603976469979785, 'sideways_tsl_mult': 0.11227779924051934, 'sideways_time_stop': 7, 'sideways_use_sma': True, 'sideways_use_ema': True, 'sideways_use_atr': False, 'sideways_use_adx': False, 'sideways_use_spike': False, 'sideways_rsi_required': False}.
