[I 2025-08-31 10:34:36,915] Trial 307 finished with values: [-1000000000.0, 1000000000.0] and parameters: {'p_sma': 19, 'p_std': 26, 'p_atr': 21, 'p_adx': 19, 'rsi_period': 44, 'ema1': 13, 'ema2': 27, 'slip_atr_k': 0.028093249495129126, 'slip_spread_k': 0.6831346659958678, 'spread_hl_frac': 0.02338520471188427, 'bb_std_mult': 0.6816889808568133, 'rsi_os': 7, 'rsi_ob': 84, 'vol_spike': 0.28944423295023664, 'adx_thresh': 31.990272507522526, 'atr_min_pct': 0.02861653417338371, 'atr_max_pct': 0.09161814900140924, 'tp_mult': 2.4738850137874735, 'tsl_mult': 0.5951690613649612, 'strategy': 'breakout', 'time_stop': 163, 'use_sma': False, 'use_atr': True, 'use_adx': False, 'use_ema': True, 'use_spike': True, 'rsi_required': False, 'edge_k': 1.1219046007658222, 'edge_cap': 0.8455744584343644, 'bull_strategy': 'mean_reversion', 'bull_bb_std_mult': 1.6459543205443055, 'bull_rsi_os': 8, 'bull_rsi_ob': 71, 'bull_adx_thresh': 25.757058313311486, 'bull_atr_min_pct': 0.0025764003630096306, 'bull_atr_max_pct': 0.14213737693898246, 'bull_tp_mult': 1.242424013037178, 'bull_tsl_mult': 0.40795919338072034, 'bull_time_stop': 278, 'bull_use_sma': True, 'bull_use_ema': True, 'bull_use_atr': False, 'bull_use_adx': False, 'bull_use_spike': True, 'bull_rsi_required': False, 'bear_strategy': 'mean_reversion', 'bear_bb_std_mult': 1.1972186891030339, 'bear_rsi_os': 18, 'bear_rsi_ob': 80, 'bear_adx_thresh': 32.62924738424251, 'bear_atr_min_pct': 0.020554453380732488, 'bear_atr_max_pct': 0.07624491118752459, 'bear_tp_mult': 1.3460864719820171, 'bear_tsl_mult': 0.8365280418163367, 'bear_time_stop': 59, 'bear_use_sma': False, 'bear_use_ema': True, 'bear_use_atr': True, 'bear_use_adx': False, 'bear_use_spike': False, 'bear_rsi_required': True, 'sideways_strategy': 'breakout', 'sideways_bb_std_mult': 3.4209706997302094, 'sideways_rsi_os': 22, 'sideways_rsi_ob': 56, 'sideways_adx_thresh': 23.42440101878864, 'sideways_atr_min_pct': 0.0037056341904888853, 'sideways_atr_max_pct': 0.13942631214001946, 'sideways_tp_mult': 2.595637764217438, 'sideways_tsl_mult': 0.4568121421634725, 'sideways_time_stop': 215, 'sideways_use_sma': False, 'sideways_use_ema': False, 'sideways_use_atr': False, 'sideways_use_adx': True, 'sideways_use_spike': True, 'sideways_rsi_required': True}.
[I 2025-08-31 10:34:37,279] Trial 306 finished with values: [-1000000000.0, 1000000000.0] and parameters: {'p_sma': 16, 'p_std': 25, 'p_atr': 30, 'p_adx': 19, 'rsi_period': 44, 'ema1': 19, 'ema2': 10, 'slip_atr_k': 0.029653047844502012, 'slip_spread_k': 0.5805661676807783, 'spread_hl_frac': 0.016032787066141075, 'bb_std_mult': 0.8888259177401931, 'rsi_os': 24, 'rsi_ob': 75, 'vol_spike': 0.25384229895554294, 'adx_thresh': 23.078709019363803, 'atr_min_pct': 0.019686969713154204, 'atr_max_pct': 0.09178099855542764, 'tp_mult': 2.527964327323864, 'tsl_mult': 0.09131026707902296, 'strategy': 'breakout', 'time_stop': 262, 'use_sma': True, 'use_atr': True, 'use_adx': False, 'use_ema': True, 'use_spike': True, 'rsi_required': False, 'edge_k': 0.15746233456674427, 'edge_cap': 0.8432123842036886, 'bull_strategy': 'mean_reversion', 'bull_bb_std_mult': 1.6495494711837633, 'bull_rsi_os': 28, 'bull_rsi_ob': 72, 'bull_adx_thresh': 13.541799552535572, 'bull_atr_min_pct': 0.0016631047676663238, 'bull_atr_max_pct': 0.025180834435534122, 'bull_tp_mult': 1.6994833763585262, 'bull_tsl_mult': 0.4118259836820807, 'bull_time_stop': 81, 'bull_use_sma': True, 'bull_use_ema': True, 'bull_use_atr': True, 'bull_use_adx': False, 'bull_use_spike': True, 'bull_rsi_required': True, 'bear_strategy': 'mean_reversion', 'bear_bb_std_mult': 1.1118249725796443, 'bear_rsi_os': 39, 'bear_rsi_ob': 67, 'bear_adx_thresh': 17.09902547555534, 'bear_atr_min_pct': 0.025153845183705413, 'bear_atr_max_pct': 0.08807926268756666, 'bear_tp_mult': 1.2374811090966382, 'bear_tsl_mult': 0.5400662059669613, 'bear_time_stop': 188, 'bear_use_sma': False, 'bear_use_ema': True, 'bear_use_atr': True, 'bear_use_adx': False, 'bear_use_spike': False, 'bear_rsi_required': True, 'sideways_strategy': 'breakout', 'sideways_bb_std_mult': 0.9962641696076011, 'sideways_rsi_os': 12, 'sideways_rsi_ob': 81, 'sideways_adx_thresh': 33.16966399309955, 'sideways_atr_min_pct': 0.003659278496097604, 'sideways_atr_max_pct': 0.07122083952947647, 'sideways_tp_mult': 2.6024341739933785, 'sideways_tsl_mult': 0.0773613570341, 'sideways_time_stop': 38, 'sideways_use_sma': False, 'sideways_use_ema': False, 'sideways_use_atr': False, 'sideways_use_adx': True, 'sideways_use_spike': True, 'sideways_rsi_required': True}.
[I 2025-08-31 10:34:37,385] Trial 308 finished with values: [-1000000000.0, 1000000000.0] and parameters: {'p_sma': 13, 'p_std': 25, 'p_atr': 24, 'p_adx': 19, 'rsi_period': 81, 'ema1': 14, 'ema2': 53, 'slip_atr_k': 0.10328648220664463, 'slip_spread_k': 0.5808167376551037, 'spread_hl_frac': 0.0007090415035885325, 'bb_std_mult': 0.8969333584147423, 'rsi_os': 10, 'rsi_ob': 59, 'vol_spike': 0.2550175820818951, 'adx_thresh': 23.368955031144726, 'atr_min_pct': 0.020633732565564458, 'atr_max_pct': 0.023354525527222766, 'tp_mult': 2.5454239609332143, 'tsl_mult': 0.08322062659892399, 'strategy': 'breakout', 'time_stop': 228, 'use_sma': False, 'use_atr': True, 'use_adx': False, 'use_ema': False, 'use_spike': True, 'rsi_required': False, 'edge_k': 0.16375597737215736, 'edge_cap': 0.8396439166230054, 'bull_strategy': 'mean_reversion', 'bull_bb_std_mult': 0.8597849065146919, 'bull_rsi_os': 21, 'bull_rsi_ob': 71, 'bull_adx_thresh': 24.08129167004376, 'bull_atr_min_pct': 0.011878274465958063, 'bull_atr_max_pct': 0.025907480184400776, 'bull_tp_mult': 2.186812059861131, 'bull_tsl_mult': 0.8597473715262969, 'bull_time_stop': 80, 'bull_use_sma': True, 'bull_use_ema': True, 'bull_use_atr': True, 'bull_use_adx': False, 'bull_use_spike': True, 'bull_rsi_required': False, 'bear_strategy': 'mean_reversion', 'bear_bb_std_mult': 1.16964472577376, 'bear_rsi_os': 39, 'bear_rsi_ob': 46, 'bear_adx_thresh': 25.992749709732333, 'bear_atr_min_pct': 0.017567034669850958, 'bear_atr_max_pct': 0.07815593373938409, 'bear_tp_mult': 2.096439522169485, 'bear_tsl_mult': 0.5803810721413325, 'bear_time_stop': 287, 'bear_use_sma': False, 'bear_use_ema': True, 'bear_use_atr': False, 'bear_use_adx': True, 'bear_use_spike': True, 'bear_rsi_required': True, 'sideways_strategy': 'breakout', 'sideways_bb_std_mult': 0.9794334138907439, 'sideways_rsi_os': 40, 'sideways_rsi_ob': 56, 'sideways_adx_thresh': 23.313617578338278, 'sideways_atr_min_pct': 0.017013420939414246, 'sideways_atr_max_pct': 0.03282052439520373, 'sideways_tp_mult': 2.091048093163281, 'sideways_tsl_mult': 0.08036565168142995, 'sideways_time_stop': 40, 'sideways_use_sma': False, 'sideways_use_ema': False, 'sideways_use_atr': False, 'sideways_use_adx': True, 'sideways_use_spike': True, 'sideways_rsi_required': False}.
[I 2025-08-31 10:34:38,465] Trial 309 finished with values: [-1000000000.0, 1000000000.0] and parameters: {'p_sma': 13, 'p_std': 35, 'p_atr': 29, 'p_adx': 19, 'rsi_period': 44, 'ema1': 13, 'ema2': 10, 'slip_atr_k': 0.20295067688433766, 'slip_spread_k': 0.2377793577792507, 'spread_hl_frac': 0.0008486033397982692, 'bb_std_mult': 0.97016140513312, 'rsi_os': 46, 'rsi_ob': 82, 'vol_spike': 0.05976163969776509, 'adx_thresh': 31.89433674064763, 'atr_min_pct': 0.023973099000510464, 'atr_max_pct': 0.09101933684243635, 'tp_mult': 2.475555753173677, 'tsl_mult': 0.6001474940528834, 'strategy': 'breakout', 'time_stop': 125, 'use_sma': False, 'use_atr': True, 'use_adx': False, 'use_ema': False, 'use_spike': True, 'rsi_required': False, 'edge_k': 0.1520705976774661, 'edge_cap': 0.43543173475597463, 'bull_strategy': 'mean_reversion', 'bull_bb_std_mult': 2.1803639680594515, 'bull_rsi_os': 8, 'bull_rsi_ob': 72, 'bull_adx_thresh': 23.950759588792124, 'bull_atr_min_pct': 0.0026115230194112896, 'bull_atr_max_pct': 0.05349012519256327, 'bull_tp_mult': 1.8832734514814735, 'bull_tsl_mult': 0.8601810555490425, 'bull_time_stop': 248, 'bull_use_sma': True, 'bull_use_ema': True, 'bull_use_atr': True, 'bull_use_adx': False, 'bull_use_spike': True, 'bull_rsi_required': False, 'bear_strategy': 'breakout', 'bear_bb_std_mult': 2.7394672255735357, 'bear_rsi_os': 39, 'bear_rsi_ob': 69, 'bear_adx_thresh': 19.77360454834691, 'bear_atr_min_pct': 0.021794960995008918, 'bear_atr_max_pct': 0.07774253067165124, 'bear_tp_mult': 2.103181812726971, 'bear_tsl_mult': 0.376908777350162, 'bear_time_stop': 192, 'bear_use_sma': False, 'bear_use_ema': True, 'bear_use_atr': False, 'bear_use_adx': True, 'bear_use_spike': True, 'bear_rsi_required': True, 'sideways_strategy': 'breakout', 'sideways_bb_std_mult': 2.834874181641875, 'sideways_rsi_os': 22, 'sideways_rsi_ob': 81, 'sideways_adx_thresh': 28.468035480822014, 'sideways_atr_min_pct': 0.003621019900527663, 'sideways_atr_max_pct': 0.04373679626475438, 'sideways_tp_mult': 2.616538142808331, 'sideways_tsl_mult': 0.0797180311278483, 'sideways_time_stop': 44, 'sideways_use_sma': False, 'sideways_use_ema': True, 'sideways_use_atr': False, 'sideways_use_adx': True, 'sideways_use_spike': True, 'sideways_rsi_required': False}.
[I 2025-08-31 10:35:11,526] Trial 313 finished with values: [-1000000000.0, 1000000000.0] and parameters: {'p_sma': 15, 'p_std': 43, 'p_atr': 20, 'p_adx': 15, 'rsi_period': 62, 'ema1': 18, 'ema2': 32, 'slip_atr_k': 0.03968012466461449, 'slip_spread_k': 0.3628745208138115, 'spread_hl_frac': 0.011317237177543646, 'bb_std_mult': 2.1514235397883352, 'rsi_os': 27, 'rsi_ob': 70, 'vol_spike': 0.0766968200480517, 'adx_thresh': 29.244454837566874, 'atr_min_pct': 0.012642040902110319, 'atr_max_pct': 0.030158042308014783, 'tp_mult': 2.410151378708921, 'tsl_mult': 0.6150682843172626, 'strategy': 'mean_reversion', 'time_stop': 251, 'use_sma': True, 'use_atr': True, 'use_adx': False, 'use_ema': True, 'use_spike': False, 'rsi_required': False, 'edge_k': 0.45970491459120366, 'edge_cap': 0.2766124205592351, 'bull_strategy': 'breakout', 'bull_bb_std_mult': 0.9162670462689161, 'bull_rsi_os': 38, 'bull_rsi_ob': 95, 'bull_adx_thresh': 19.38479212817047, 'bull_atr_min_pct': 0.02552740603324353, 'bull_atr_max_pct': 0.14407423306272313, 'bull_tp_mult': 1.6331991494292357, 'bull_tsl_mult': 0.7126598186306233, 'bull_time_stop': 122, 'bull_use_sma': False, 'bull_use_ema': True, 'bull_use_atr': True, 'bull_use_adx': False, 'bull_use_spike': False, 'bull_rsi_required': True, 'bear_strategy': 'breakout', 'bear_bb_std_mult': 1.3098637097862436, 'bear_rsi_os': 37, 'bear_rsi_ob': 69, 'bear_adx_thresh': 9.987557939281624, 'bear_atr_min_pct': 0.0032199706800268794, 'bear_atr_max_pct': 0.07223829629178155, 'bear_tp_mult': 2.7783356218716735, 'bear_tsl_mult': 0.5246214244974075, 'bear_time_stop': 66, 'bear_use_sma': False, 'bear_use_ema': False, 'bear_use_atr': False, 'bear_use_adx': False, 'bear_use_spike': True, 'bear_rsi_required': False, 'sideways_strategy': 'breakout', 'sideways_bb_std_mult': 1.237453486474966, 'sideways_rsi_os': 20, 'sideways_rsi_ob': 71, 'sideways_adx_thresh': 23.98919405626224, 'sideways_atr_min_pct': 0.0065530075676857175, 'sideways_atr_max_pct': 0.07816639172535216, 'sideways_tp_mult': 2.8772757489143457, 'sideways_tsl_mult': 0.0951118607877375, 'sideways_time_stop': 89, 'sideways_use_sma': True, 'sideways_use_ema': True, 'sideways_use_atr': False, 'sideways_use_adx': True, 'sideways_use_spike': True, 'sideways_rsi_required': True}.
[I 2025-08-31 10:35:11,674] Trial 311 finished with values: [-1000000000.0, 1000000000.0] and parameters: {'p_sma': 13, 'p_std': 46, 'p_atr': 29, 'p_adx': 30, 'rsi_period': 45, 'ema1': 13, 'ema2': 32, 'slip_atr_k': 0.21158105336399402, 'slip_spread_k': 0.6367249335418612, 'spread_hl_frac': 0.0007031672060200042, 'bb_std_mult': 1.1406832086268786, 'rsi_os': 27, 'rsi_ob': 59, 'vol_spike': 0.2683677828772454, 'adx_thresh': 29.157480433986333, 'atr_min_pct': 0.022818490684610768, 'atr_max_pct': 0.048989808547208816, 'tp_mult': 2.392058450702997, 'tsl_mult': 0.598450868080262, 'strategy': 'mean_reversion', 'time_stop': 45, 'use_sma': False, 'use_atr': True, 'use_adx': False, 'use_ema': False, 'use_spike': False, 'rsi_required': False, 'edge_k': 0.4597384778540008, 'edge_cap': 0.712774909179866, 'bull_strategy': 'breakout', 'bull_bb_std_mult': 0.8391481619548815, 'bull_rsi_os': 48, 'bull_rsi_ob': 95, 'bull_adx_thresh': 24.37336669288601, 'bull_atr_min_pct': 0.011945405274088203, 'bull_atr_max_pct': 0.02040387075527695, 'bull_tp_mult': 1.5623703064771406, 'bull_tsl_mult': 0.8932059534037917, 'bull_time_stop': 89, 'bull_use_sma': True, 'bull_use_ema': True, 'bull_use_atr': True, 'bull_use_adx': False, 'bull_use_spike': True, 'bull_rsi_required': False, 'bear_strategy': 'breakout', 'bear_bb_std_mult': 1.4405088993568267, 'bear_rsi_os': 23, 'bear_rsi_ob': 69, 'bear_adx_thresh': 20.188208810172014, 'bear_atr_min_pct': 0.0032337125544586766, 'bear_atr_max_pct': 0.07902203350116986, 'bear_tp_mult': 2.0798914009684406, 'bear_tsl_mult': 0.25719462347743294, 'bear_time_stop': 50, 'bear_use_sma': False, 'bear_use_ema': False, 'bear_use_atr': False, 'bear_use_adx': True, 'bear_use_spike': True, 'bear_rsi_required': False, 'sideways_strategy': 'breakout', 'sideways_bb_std_mult': 0.7729556520570855, 'sideways_rsi_os': 25, 'sideways_rsi_ob': 86, 'sideways_adx_thresh': 23.842108322572663, 'sideways_atr_min_pct': 0.005252109623022612, 'sideways_atr_max_pct': 0.043324894232680135, 'sideways_tp_mult': 2.0760671122593193, 'sideways_tsl_mult': 0.09589196903239945, 'sideways_time_stop': 46, 'sideways_use_sma': True, 'sideways_use_ema': True, 'sideways_use_atr': False, 'sideways_use_adx': True, 'sideways_use_spike': True, 'sideways_rsi_required': False}.
[I 2025-08-31 10:35:11,759] Trial 310 finished with values: [-1000000000.0, 1000000000.0] and parameters: {'p_sma': 14, 'p_std': 34, 'p_atr': 29, 'p_adx': 15, 'rsi_period': 63, 'ema1': 18, 'ema2': 53, 'slip_atr_k': 0.03957642640785851, 'slip_spread_k': 0.7007075006118378, 'spread_hl_frac': 0.011359552021992202, 'bb_std_mult': 0.9558346078564662, 'rsi_os': 28, 'rsi_ob': 59, 'vol_spike': 0.269266246669007, 'adx_thresh': 23.358790064731323, 'atr_min_pct': 0.003277513695704857, 'atr_max_pct': 0.03080414018804637, 'tp_mult': 2.5446757722456455, 'tsl_mult': 0.5566164781317179, 'strategy': 'mean_reversion', 'time_stop': 249, 'use_sma': True, 'use_atr': True, 'use_adx': False, 'use_ema': False, 'use_spike': True, 'rsi_required': False, 'edge_k': 1.4633111458460104, 'edge_cap': 0.820396903333137, 'bull_strategy': 'mean_reversion', 'bull_bb_std_mult': 0.8879014165034739, 'bull_rsi_os': 38, 'bull_rsi_ob': 72, 'bull_adx_thresh': 24.151716682155634, 'bull_atr_min_pct': 0.010071120361508933, 'bull_atr_max_pct': 0.02028094543182697, 'bull_tp_mult': 1.554134925626358, 'bull_tsl_mult': 0.44257829539701204, 'bull_time_stop': 271, 'bull_use_sma': True, 'bull_use_ema': True, 'bull_use_atr': True, 'bull_use_adx': False, 'bull_use_spike': True, 'bull_rsi_required': True, 'bear_strategy': 'breakout', 'bear_bb_std_mult': 2.7112859841474473, 'bear_rsi_os': 39, 'bear_rsi_ob': 46, 'bear_adx_thresh': 18.53319083213674, 'bear_atr_min_pct': 0.019176004907249203, 'bear_atr_max_pct': 0.05322294136703816, 'bear_tp_mult': 2.0090205084641513, 'bear_tsl_mult': 0.3967355193417205, 'bear_time_stop': 288, 'bear_use_sma': False, 'bear_use_ema': False, 'bear_use_atr': False, 'bear_use_adx': True, 'bear_use_spike': True, 'bear_rsi_required': True, 'sideways_strategy': 'breakout', 'sideways_bb_std_mult': 3.223747083099086, 'sideways_rsi_os': 39, 'sideways_rsi_ob': 81, 'sideways_adx_thresh': 23.874235220127066, 'sideways_atr_min_pct': 0.008531350052194766, 'sideways_atr_max_pct': 0.11877859849176957, 'sideways_tp_mult': 2.107666605887901, 'sideways_tsl_mult': 0.08249169394811817, 'sideways_time_stop': 45, 'sideways_use_sma': True, 'sideways_use_ema': True, 'sideways_use_atr': False, 'sideways_use_adx': True, 'sideways_use_spike': True, 'sideways_rsi_required': False}.
[I 2025-08-31 10:35:11,861] Trial 312 finished with values: [-0.039576003424196315, 0.03932693294478898] and parameters: {'p_sma': 14, 'p_std': 7, 'p_atr': 15, 'p_adx': 15, 'rsi_period': 38, 'ema1': 8, 'ema2': 32, 'slip_atr_k': 0.21305019396491734, 'slip_spread_k': 0.8744295294079686, 'spread_hl_frac': 0.01155765149724104, 'bb_std_mult': 2.144850302986011, 'rsi_os': 27, 'rsi_ob': 82, 'vol_spike': 0.016434105984526243, 'adx_thresh': 29.058640580453503, 'atr_min_pct': 0.003301719165672009, 'atr_max_pct': 0.09677547711566009, 'tp_mult': 2.4074608397388975, 'tsl_mult': 0.5573435378295479, 'strategy': 'mean_reversion', 'time_stop': 248, 'use_sma': True, 'use_atr': True, 'use_adx': False, 'use_ema': False, 'use_spike': False, 'rsi_required': False, 'edge_k': 1.4480922165943675, 'edge_cap': 0.821315982492993, 'bull_strategy': 'breakout', 'bull_bb_std_mult': 0.7779332287291436, 'bull_rsi_os': 52, 'bull_rsi_ob': 60, 'bull_adx_thresh': 18.049816326836545, 'bull_atr_min_pct': 0.029313713825636502, 'bull_atr_max_pct': 0.14277434063982883, 'bull_tp_mult': 1.8971630129690669, 'bull_tsl_mult': 0.7123782112046091, 'bull_time_stop': 270, 'bull_use_sma': True, 'bull_use_ema': True, 'bull_use_atr': True, 'bull_use_adx': False, 'bull_use_spike': False, 'bull_rsi_required': True, 'bear_strategy': 'breakout', 'bear_bb_std_mult': 1.2942812300814803, 'bear_rsi_os': 37, 'bear_rsi_ob': 69, 'bear_adx_thresh': 10.060595176995166, 'bear_atr_min_pct': 0.0034429604569981725, 'bear_atr_max_pct': 0.0711397949312268, 'bear_tp_mult': 2.770303659081223, 'bear_tsl_mult': 0.18634997496926142, 'bear_time_stop': 51, 'bear_use_sma': False, 'bear_use_ema': False, 'bear_use_atr': False, 'bear_use_adx': True, 'bear_use_spike': True, 'bear_rsi_required': False, 'sideways_strategy': 'breakout', 'sideways_bb_std_mult': 3.2104310666869784, 'sideways_rsi_os': 6, 'sideways_rsi_ob': 90, 'sideways_adx_thresh': 17.478025098615536, 'sideways_atr_min_pct': 0.02729977930418428, 'sideways_atr_max_pct': 0.033542378497931256, 'sideways_tp_mult': 1.2982921091924267, 'sideways_tsl_mult': 0.10212749263458709, 'sideways_time_stop': 159, 'sideways_use_sma': True, 'sideways_use_ema': True, 'sideways_use_atr': False, 'sideways_use_adx': True, 'sideways_use_spike': True, 'sideways_rsi_required': False}.
[I 2025-08-31 10:35:42,910] Trial 314 finished with values: [-1000000000.0, 1000000000.0] and parameters: {'p_sma': 14, 'p_std': 28, 'p_atr': 11, 'p_adx': 14, 'rsi_period': 53, 'ema1': 14, 'ema2': 49, 'slip_atr_k': 0.010489486170564354, 'slip_spread_k': 0.7048395494768126, 'spread_hl_frac': 0.03527804465681934, 'bb_std_mult': 1.1112515010009294, 'rsi_os': 26, 'rsi_ob': 76, 'vol_spike': 0.26783189093988624, 'adx_thresh': 12.111619556904262, 'atr_min_pct': 0.008676974101023298, 'atr_max_pct': 0.04865716105117948, 'tp_mult': 2.372442168012709, 'tsl_mult': 0.559851447828508, 'strategy': 'mean_reversion', 'time_stop': 78, 'use_sma': True, 'use_atr': True, 'use_adx': False, 'use_ema': True, 'use_spike': True, 'rsi_required': False, 'edge_k': 0.2078915197469793, 'edge_cap': 0.8221289861617167, 'bull_strategy': 'breakout', 'bull_bb_std_mult': 0.7497314707298783, 'bull_rsi_os': 52, 'bull_rsi_ob': 74, 'bull_adx_thresh': 9.229023251162399, 'bull_atr_min_pct': 0.0101200563406721, 'bull_atr_max_pct': 0.07764375575212165, 'bull_tp_mult': 2.3527504162663595, 'bull_tsl_mult': 0.43795386469242636, 'bull_time_stop': 92, 'bull_use_sma': True, 'bull_use_ema': True, 'bull_use_atr': True, 'bull_use_adx': False, 'bull_use_spike': True, 'bull_rsi_required': True, 'bear_strategy': 'breakout', 'bear_bb_std_mult': 1.4314377104705838, 'bear_rsi_os': 15, 'bear_rsi_ob': 68, 'bear_adx_thresh': 15.210232740052179, 'bear_atr_min_pct': 0.005444793956697036, 'bear_atr_max_pct': 0.02274938166830954, 'bear_tp_mult': 2.7954641204726673, 'bear_tsl_mult': 0.18868825846835846, 'bear_time_stop': 50, 'bear_use_sma': False, 'bear_use_ema': False, 'bear_use_atr': False, 'bear_use_adx': False, 'bear_use_spike': True, 'bear_rsi_required': False, 'sideways_strategy': 'breakout', 'sideways_bb_std_mult': 3.5983352190827427, 'sideways_rsi_os': 47, 'sideways_rsi_ob': 95, 'sideways_adx_thresh': 23.774295269098587, 'sideways_atr_min_pct': 0.024929442564545483, 'sideways_atr_max_pct': 0.03330193115998031, 'sideways_tp_mult': 1.2245916780686108, 'sideways_tsl_mult': 0.10104580640606299, 'sideways_time_stop': 20, 'sideways_use_sma': True, 'sideways_use_ema': False, 'sideways_use_atr': False, 'sideways_use_adx': False, 'sideways_use_spike': True, 'sideways_rsi_required': True}.
