[I 2025-08-31 11:18:26,011] Trial 650 finished with values: [-0.13814751523470092, 0.13789031464997267] and parameters: {'p_sma': 42, 'p_std': 27, 'p_atr': 18, 'p_adx': 14, 'rsi_period': 11, 'ema1': 15, 'ema2': 55, 'slip_atr_k': 0.054020642075952405, 'slip_spread_k': 0.6661278567702805, 'spread_hl_frac': 0.0059225179916089915, 'bb_std_mult': 2.6264369034441555, 'rsi_os': 23, 'rsi_ob': 75, 'vol_spike': 0.2638539652279007, 'adx_thresh': 18.270728345453122, 'atr_min_pct': 0.0043370386887995275, 'atr_max_pct': 0.09798395976290573, 'tp_mult': 2.4727280688706057, 'tsl_mult': 0.12261477831664125, 'strategy': 'breakout', 'time_stop': 71, 'use_sma': True, 'use_atr': True, 'use_adx': False, 'use_ema': True, 'use_spike': True, 'rsi_required': True, 'edge_k': 0.18675008719126948, 'edge_cap': 0.7636432606392002, 'bull_strategy': 'mean_reversion', 'bull_bb_std_mult': 1.0268985944639455, 'bull_rsi_os': 15, 'bull_rsi_ob': 61, 'bull_adx_thresh': 6.83206427358353, 'bull_atr_min_pct': 0.004340475513129107, 'bull_atr_max_pct': 0.09573420727148274, 'bull_tp_mult': 1.596422279306727, 'bull_tsl_mult': 0.7250240344243271, 'bull_time_stop': 102, 'bull_use_sma': True, 'bull_use_ema': False, 'bull_use_atr': False, 'bull_use_adx': False, 'bull_use_spike': False, 'bull_rsi_required': True, 'bear_strategy': 'breakout', 'bear_bb_std_mult': 1.3459836409834733, 'bear_rsi_os': 53, 'bear_rsi_ob': 52, 'bear_adx_thresh': 5.571445275233902, 'bear_atr_min_pct': 0.0006550901379287731, 'bear_atr_max_pct': 0.14970901066510692, 'bear_tp_mult': 2.718959098694489, 'bear_tsl_mult': 0.5411760199442901, 'bear_time_stop': 44, 'bear_use_sma': True, 'bear_use_ema': True, 'bear_use_atr': True, 'bear_use_adx': False, 'bear_use_spike': True, 'bear_rsi_required': False, 'sideways_strategy': 'mean_reversion', 'sideways_bb_std_mult': 2.7796650023963294, 'sideways_rsi_os': 48, 'sideways_rsi_ob': 93, 'sideways_adx_thresh': 26.8928294858164, 'sideways_atr_min_pct': 0.017680881071272313, 'sideways_atr_max_pct': 0.03509597807667096, 'sideways_tp_mult': 1.9802639763227936, 'sideways_tsl_mult': 0.7745023679807228, 'sideways_time_stop': 64, 'sideways_use_sma': False, 'sideways_use_ema': True, 'sideways_use_atr': True, 'sideways_use_adx': False, 'sideways_use_spike': False, 'sideways_rsi_required': True}.
[I 2025-08-31 11:18:26,148] Trial 648 finished with values: [-0.012347462691130073, 0.012357578232964553] and parameters: {'p_sma': 23, 'p_std': 11, 'p_atr': 19, 'p_adx': 14, 'rsi_period': 64, 'ema1': 15, 'ema2': 55, 'slip_atr_k': 0.019862731520003618, 'slip_spread_k': 0.6439233173355566, 'spread_hl_frac': 0.010258961977586146, 'bb_std_mult': 2.8081886230628292, 'rsi_os': 32, 'rsi_ob': 75, 'vol_spike': 0.26457142446626, 'adx_thresh': 29.39585843007478, 'atr_min_pct': 0.026191062466130607, 'atr_max_pct': 0.09562430172076734, 'tp_mult': 1.8217917493552984, 'tsl_mult': 0.47834456680917353, 'strategy': 'breakout', 'time_stop': 89, 'use_sma': True, 'use_atr': False, 'use_adx': True, 'use_ema': True, 'use_spike': False, 'rsi_required': False, 'edge_k': 0.176655945264565, 'edge_cap': 0.3874819036948963, 'bull_strategy': 'breakout', 'bull_bb_std_mult': 0.8257716664781152, 'bull_rsi_os': 12, 'bull_rsi_ob': 91, 'bull_adx_thresh': 5.58101560814243, 'bull_atr_min_pct': 0.00420842553766555, 'bull_atr_max_pct': 0.08292170047428696, 'bull_tp_mult': 2.895340974357277, 'bull_tsl_mult': 0.7228059629554187, 'bull_time_stop': 61, 'bull_use_sma': True, 'bull_use_ema': False, 'bull_use_atr': True, 'bull_use_adx': False, 'bull_use_spike': True, 'bull_rsi_required': True, 'bear_strategy': 'breakout', 'bear_bb_std_mult': 2.076527571693033, 'bear_rsi_os': 42, 'bear_rsi_ob': 95, 'bear_adx_thresh': 5.424959273528904, 'bear_atr_min_pct': 0.006020671595317525, 'bear_atr_max_pct': 0.12463383760702545, 'bear_tp_mult': 2.788476538647843, 'bear_tsl_mult': 0.5381657924879404, 'bear_time_stop': 160, 'bear_use_sma': False, 'bear_use_ema': True, 'bear_use_atr': False, 'bear_use_adx': False, 'bear_use_spike': True, 'bear_rsi_required': False, 'sideways_strategy': 'breakout', 'sideways_bb_std_mult': 2.795105438526882, 'sideways_rsi_os': 22, 'sideways_rsi_ob': 91, 'sideways_adx_thresh': 26.74173106810038, 'sideways_atr_min_pct': 0.019875089268810823, 'sideways_atr_max_pct': 0.03612349112123525, 'sideways_tp_mult': 1.103761393314031, 'sideways_tsl_mult': 0.16350874745907742, 'sideways_time_stop': 35, 'sideways_use_sma': False, 'sideways_use_ema': False, 'sideways_use_atr': False, 'sideways_use_adx': True, 'sideways_use_spike': True, 'sideways_rsi_required': False}.
[I 2025-08-31 11:18:26,246] Trial 647 finished with values: [-1000000000.0, 1000000000.0] and parameters: {'p_sma': 17, 'p_std': 30, 'p_atr': 24, 'p_adx': 29, 'rsi_period': 49, 'ema1': 14, 'ema2': 14, 'slip_atr_k': 0.018684751826090196, 'slip_spread_k': 0.036603949814155656, 'spread_hl_frac': 0.010425247442225574, 'bb_std_mult': 2.578342066915003, 'rsi_os': 31, 'rsi_ob': 59, 'vol_spike': 0.19519026218018393, 'adx_thresh': 32.21015096667764, 'atr_min_pct': 0.004515138854804878, 'atr_max_pct': 0.09587985414291553, 'tp_mult': 2.4647418410080433, 'tsl_mult': 0.8087752695033759, 'strategy': 'breakout', 'time_stop': 87, 'use_sma': True, 'use_atr': False, 'use_adx': True, 'use_ema': True, 'use_spike': False, 'rsi_required': False, 'edge_k': 0.17553685081397885, 'edge_cap': 0.42772758264968236, 'bull_strategy': 'breakout', 'bull_bb_std_mult': 1.9254234462030428, 'bull_rsi_os': 14, 'bull_rsi_ob': 72, 'bull_adx_thresh': 6.895627627139646, 'bull_atr_min_pct': 0.003219007013713279, 'bull_atr_max_pct': 0.05434528954575808, 'bull_tp_mult': 1.5966673586850348, 'bull_tsl_mult': 0.4158431162973311, 'bull_time_stop': 61, 'bull_use_sma': True, 'bull_use_ema': True, 'bull_use_atr': True, 'bull_use_adx': True, 'bull_use_spike': True, 'bull_rsi_required': True, 'bear_strategy': 'breakout', 'bear_bb_std_mult': 1.3465662702489682, 'bear_rsi_os': 42, 'bear_rsi_ob': 56, 'bear_adx_thresh': 20.954768699203658, 'bear_atr_min_pct': 0.006158224719395044, 'bear_atr_max_pct': 0.1494496271621038, 'bear_tp_mult': 1.012377074644589, 'bear_tsl_mult': 0.5423370249568591, 'bear_time_stop': 27, 'bear_use_sma': False, 'bear_use_ema': True, 'bear_use_atr': False, 'bear_use_adx': False, 'bear_use_spike': True, 'bear_rsi_required': False, 'sideways_strategy': 'breakout', 'sideways_bb_std_mult': 2.0761750892496904, 'sideways_rsi_os': 6, 'sideways_rsi_ob': 91, 'sideways_adx_thresh': 12.949154689728548, 'sideways_atr_min_pct': 0.017658928590177588, 'sideways_atr_max_pct': 0.035786323578888835, 'sideways_tp_mult': 1.9677697538167873, 'sideways_tsl_mult': 0.168176973390127, 'sideways_time_stop': 286, 'sideways_use_sma': False, 'sideways_use_ema': False, 'sideways_use_atr': False, 'sideways_use_adx': True, 'sideways_use_spike': True, 'sideways_rsi_required': False}.
[I 2025-08-31 11:18:57,742] Trial 653 finished with values: [-1000000000.0, 1000000000.0] and parameters: {'p_sma': 11, 'p_std': 19, 'p_atr': 10, 'p_adx': 12, 'rsi_period': 64, 'ema1': 14, 'ema2': 57, 'slip_atr_k': 0.034873135848090354, 'slip_spread_k': 0.3027555915889266, 'spread_hl_frac': 0.038690493010865155, 'bb_std_mult': 2.230214491638744, 'rsi_os': 25, 'rsi_ob': 65, 'vol_spike': 0.051503092284016255, 'adx_thresh': 30.45206114309188, 'atr_min_pct': 0.025875465945114175, 'atr_max_pct': 0.09476690986102698, 'tp_mult': 2.930555584367681, 'tsl_mult': 0.2960655559941485, 'strategy': 'mean_reversion', 'time_stop': 59, 'use_sma': True, 'use_atr': False, 'use_adx': True, 'use_ema': True, 'use_spike': True, 'rsi_required': True, 'edge_k': 1.0219987337460523, 'edge_cap': 0.4918367773400971, 'bull_strategy': 'breakout', 'bull_bb_std_mult': 0.8174460659803581, 'bull_rsi_os': 11, 'bull_rsi_ob': 91, 'bull_adx_thresh': 5.8433253200344755, 'bull_atr_min_pct': 0.004423232111182113, 'bull_atr_max_pct': 0.05457142196314356, 'bull_tp_mult': 2.9690557671772204, 'bull_tsl_mult': 0.4153546169737262, 'bull_time_stop': 72, 'bull_use_sma': True, 'bull_use_ema': False, 'bull_use_atr': False, 'bull_use_adx': False, 'bull_use_spike': False, 'bull_rsi_required': True, 'bear_strategy': 'breakout', 'bear_bb_std_mult': 2.0865057536570912, 'bear_rsi_os': 6, 'bear_rsi_ob': 87, 'bear_adx_thresh': 6.425489570070374, 'bear_atr_min_pct': 0.029137607459792762, 'bear_atr_max_pct': 0.1341540921655443, 'bear_tp_mult': 1.6795134921829904, 'bear_tsl_mult': 0.7323194644674216, 'bear_time_stop': 35, 'bear_use_sma': False, 'bear_use_ema': True, 'bear_use_atr': False, 'bear_use_adx': False, 'bear_use_spike': True, 'bear_rsi_required': True, 'sideways_strategy': 'mean_reversion', 'sideways_bb_std_mult': 2.1429897356372103, 'sideways_rsi_os': 5, 'sideways_rsi_ob': 93, 'sideways_adx_thresh': 25.189577421578036, 'sideways_atr_min_pct': 0.01909708727569066, 'sideways_atr_max_pct': 0.04249780381765608, 'sideways_tp_mult': 2.1050083886431734, 'sideways_tsl_mult': 0.17090108234132995, 'sideways_time_stop': 15, 'sideways_use_sma': True, 'sideways_use_ema': False, 'sideways_use_atr': False, 'sideways_use_adx': False, 'sideways_use_spike': False, 'sideways_rsi_required': True}.
[I 2025-08-31 11:18:58,250] Trial 652 finished with values: [-1000000000.0, 1000000000.0] and parameters: {'p_sma': 23, 'p_std': 28, 'p_atr': 24, 'p_adx': 24, 'rsi_period': 75, 'ema1': 14, 'ema2': 57, 'slip_atr_k': 0.03572192066015553, 'slip_spread_k': 0.3052150874383192, 'spread_hl_frac': 0.039132654307410725, 'bb_std_mult': 2.808413866291184, 'rsi_os': 28, 'rsi_ob': 79, 'vol_spike': 0.23828390274838043, 'adx_thresh': 30.503397974604532, 'atr_min_pct': 0.004817659087349268, 'atr_max_pct': 0.09497343927089752, 'tp_mult': 2.3345888567417235, 'tsl_mult': 0.2585409811136606, 'strategy': 'mean_reversion', 'time_stop': 79, 'use_sma': True, 'use_atr': False, 'use_adx': True, 'use_ema': True, 'use_spike': True, 'rsi_required': True, 'edge_k': 1.0368370316757065, 'edge_cap': 0.43927987953691994, 'bull_strategy': 'breakout', 'bull_bb_std_mult': 0.8156642951177635, 'bull_rsi_os': 7, 'bull_rsi_ob': 48, 'bull_adx_thresh': 6.015632122571322, 'bull_atr_min_pct': 0.0042385145691770714, 'bull_atr_max_pct': 0.10981836430874087, 'bull_tp_mult': 1.8693989742398411, 'bull_tsl_mult': 0.4213660063494357, 'bull_time_stop': 71, 'bull_use_sma': True, 'bull_use_ema': False, 'bull_use_atr': False, 'bull_use_adx': False, 'bull_use_spike': False, 'bull_rsi_required': True, 'bear_strategy': 'breakout', 'bear_bb_std_mult': 1.6560105955616466, 'bear_rsi_os': 37, 'bear_rsi_ob': 88, 'bear_adx_thresh': 20.622342433107658, 'bear_atr_min_pct': 0.006853895317718973, 'bear_atr_max_pct': 0.06709402196527019, 'bear_tp_mult': 2.4620449806977827, 'bear_tsl_mult': 0.5122813859036383, 'bear_time_stop': 160, 'bear_use_sma': False, 'bear_use_ema': True, 'bear_use_atr': False, 'bear_use_adx': False, 'bear_use_spike': True, 'bear_rsi_required': True, 'sideways_strategy': 'mean_reversion', 'sideways_bb_std_mult': 2.0741428519156333, 'sideways_rsi_os': 5, 'sideways_rsi_ob': 91, 'sideways_adx_thresh': 25.29818364039345, 'sideways_atr_min_pct': 0.009200459914026658, 'sideways_atr_max_pct': 0.04104170741742569, 'sideways_tp_mult': 1.9364695848909368, 'sideways_tsl_mult': 0.12808787318068926, 'sideways_time_stop': 265, 'sideways_use_sma': True, 'sideways_use_ema': False, 'sideways_use_atr': False, 'sideways_use_adx': False, 'sideways_use_spike': False, 'sideways_rsi_required': True}.
[I 2025-08-31 11:18:58,561] Trial 654 finished with values: [-1000000000.0, 1000000000.0] and parameters: {'p_sma': 46, 'p_std': 28, 'p_atr': 10, 'p_adx': 12, 'rsi_period': 58, 'ema1': 15, 'ema2': 57, 'slip_atr_k': 0.03575179303207102, 'slip_spread_k': 0.22494368641339124, 'spread_hl_frac': 0.0126787050660114, 'bb_std_mult': 2.80831489982062, 'rsi_os': 13, 'rsi_ob': 81, 'vol_spike': 0.25702841147317074, 'adx_thresh': 14.015278620108106, 'atr_min_pct': 0.02606300767991359, 'atr_max_pct': 0.06106871122975403, 'tp_mult': 2.325422745539838, 'tsl_mult': 0.2939148954252713, 'strategy': 'mean_reversion', 'time_stop': 77, 'use_sma': True, 'use_atr': False, 'use_adx': True, 'use_ema': True, 'use_spike': True, 'rsi_required': True, 'edge_k': 0.24880300134655864, 'edge_cap': 0.5056252740477171, 'bull_strategy': 'breakout', 'bull_bb_std_mult': 0.8184430774197593, 'bull_rsi_os': 11, 'bull_rsi_ob': 91, 'bull_adx_thresh': 6.124833827384443, 'bull_atr_min_pct': 0.004322696799873276, 'bull_atr_max_pct': 0.06673785946646192, 'bull_tp_mult': 2.4273906529727545, 'bull_tsl_mult': 0.326794574734943, 'bull_time_stop': 72, 'bull_use_sma': True, 'bull_use_ema': False, 'bull_use_atr': False, 'bull_use_adx': False, 'bull_use_spike': False, 'bull_rsi_required': True, 'bear_strategy': 'breakout', 'bear_bb_std_mult': 2.093573872579026, 'bear_rsi_os': 9, 'bear_rsi_ob': 87, 'bear_adx_thresh': 6.33666923458722, 'bear_atr_min_pct': 0.029331880738734786, 'bear_atr_max_pct': 0.13658679532953172, 'bear_tp_mult': 2.869148198963061, 'bear_tsl_mult': 0.5027007310828315, 'bear_time_stop': 12, 'bear_use_sma': False, 'bear_use_ema': True, 'bear_use_atr': False, 'bear_use_adx': False, 'bear_use_spike': True, 'bear_rsi_required': True, 'sideways_strategy': 'mean_reversion', 'sideways_bb_std_mult': 2.1662046051433084, 'sideways_rsi_os': 5, 'sideways_rsi_ob': 93, 'sideways_adx_thresh': 5.6221817526591416, 'sideways_atr_min_pct': 0.02015292804140598, 'sideways_atr_max_pct': 0.04217218202207045, 'sideways_tp_mult': 1.5417360262514461, 'sideways_tsl_mult': 0.12582111974044047, 'sideways_time_stop': 13, 'sideways_use_sma': True, 'sideways_use_ema': False, 'sideways_use_atr': False, 'sideways_use_adx': False, 'sideways_use_spike': False, 'sideways_rsi_required': True}.
[I 2025-08-31 11:18:58,697] Trial 651 finished with values: [-1000000000.0, 1000000000.0] and parameters: {'p_sma': 23, 'p_std': 11, 'p_atr': 12, 'p_adx': 14, 'rsi_period': 46, 'ema1': 14, 'ema2': 56, 'slip_atr_k': 0.03484341207927212, 'slip_spread_k': 0.6708133191466495, 'spread_hl_frac': 0.005761903010560223, 'bb_std_mult': 1.6473157100167162, 'rsi_os': 43, 'rsi_ob': 90, 'vol_spike': 0.2625289161360851, 'adx_thresh': 30.507797412048802, 'atr_min_pct': 0.004858725569979865, 'atr_max_pct': 0.06817040552233361, 'tp_mult': 1.7674593798577107, 'tsl_mult': 0.25677990484890484, 'strategy': 'mean_reversion', 'time_stop': 71, 'use_sma': True, 'use_atr': True, 'use_adx': False, 'use_ema': True, 'use_spike': True, 'rsi_required': True, 'edge_k': 0.6971468592773735, 'edge_cap': 0.5017421522870857, 'bull_strategy': 'breakout', 'bull_bb_std_mult': 0.8373054953280289, 'bull_rsi_os': 14, 'bull_rsi_ob': 65, 'bull_adx_thresh': 6.837659266717701, 'bull_atr_min_pct': 0.004153921967470193, 'bull_atr_max_pct': 0.091125096773651, 'bull_tp_mult': 1.6176514123270078, 'bull_tsl_mult': 0.057593120344816395, 'bull_time_stop': 105, 'bull_use_sma': True, 'bull_use_ema': False, 'bull_use_atr': False, 'bull_use_adx': False, 'bull_use_spike': False, 'bull_rsi_required': True, 'bear_strategy': 'breakout', 'bear_bb_std_mult': 2.119906361540006, 'bear_rsi_os': 9, 'bear_rsi_ob': 86, 'bear_adx_thresh': 5.633107806713948, 'bear_atr_min_pct': 0.006860491680055282, 'bear_atr_max_pct': 0.020484532313301197, 'bear_tp_mult': 1.6534178077823427, 'bear_tsl_mult': 0.8881711020050838, 'bear_time_stop': 34, 'bear_use_sma': False, 'bear_use_ema': True, 'bear_use_atr': True, 'bear_use_adx': False, 'bear_use_spike': True, 'bear_rsi_required': False, 'sideways_strategy': 'mean_reversion', 'sideways_bb_std_mult': 2.7790816467813126, 'sideways_rsi_os': 48, 'sideways_rsi_ob': 91, 'sideways_adx_thresh': 26.955522089014774, 'sideways_atr_min_pct': 0.017882108617309253, 'sideways_atr_max_pct': 0.042199884552384125, 'sideways_tp_mult': 1.5504903687178435, 'sideways_tsl_mult': 0.16860165653623704, 'sideways_time_stop': 60, 'sideways_use_sma': True, 'sideways_use_ema': True, 'sideways_use_atr': False, 'sideways_use_adx': False, 'sideways_use_spike': False, 'sideways_rsi_required': True}.
[I 2025-08-31 11:19:30,210] Trial 658 finished with values: [-1000000000.0, 1000000000.0] and parameters: {'p_sma': 26, 'p_std': 27, 'p_atr': 9, 'p_adx': 22, 'rsi_period': 37, 'ema1': 16, 'ema2': 54, 'slip_atr_k': 0.1597983774461643, 'slip_spread_k': 0.7928005027606397, 'spread_hl_frac': 0.00784105734252714, 'bb_std_mult': 1.8613960391121238, 'rsi_os': 27, 'rsi_ob': 77, 'vol_spike': 0.24849384110311346, 'adx_thresh': 29.533564968669523, 'atr_min_pct': 0.008202320613054814, 'atr_max_pct': 0.09156182769562343, 'tp_mult': 2.3748873262157044, 'tsl_mult': 0.2102293341911576, 'strategy': 'breakout', 'time_stop': 131, 'use_sma': False, 'use_atr': False, 'use_adx': True, 'use_ema': False, 'use_spike': True, 'rsi_required': True, 'edge_k': 1.5922883676582824, 'edge_cap': 0.24825141584746413, 'bull_strategy': 'mean_reversion', 'bull_bb_std_mult': 2.9563513706843225, 'bull_rsi_os': 11, 'bull_rsi_ob': 74, 'bull_adx_thresh': 7.597020237479187, 'bull_atr_min_pct': 0.003621652199475066, 'bull_atr_max_pct': 0.09042562186838897, 'bull_tp_mult': 1.8568624489510024, 'bull_tsl_mult': 0.38126273571019664, 'bull_time_stop': 81, 'bull_use_sma': False, 'bull_use_ema': False, 'bull_use_atr': False, 'bull_use_adx': False, 'bull_use_spike': False, 'bull_rsi_required': False, 'bear_strategy': 'breakout', 'bear_bb_std_mult': 2.3763939667541836, 'bear_rsi_os': 39, 'bear_rsi_ob': 85, 'bear_adx_thresh': 6.737900511859881, 'bear_atr_min_pct': 0.02098286017186563, 'bear_atr_max_pct': 0.13637969925666846, 'bear_tp_mult': 2.805178971931784, 'bear_tsl_mult': 0.5942036014389833, 'bear_time_stop': 189, 'bear_use_sma': True, 'bear_use_ema': False, 'bear_use_atr': True, 'bear_use_adx': True, 'bear_use_spike': False, 'bear_rsi_required': False, 'sideways_strategy': 'mean_reversion', 'sideways_bb_std_mult': 1.3075956234552897, 'sideways_rsi_os': 8, 'sideways_rsi_ob': 92, 'sideways_adx_thresh': 22.70011294149205, 'sideways_atr_min_pct': 0.018681046863773768, 'sideways_atr_max_pct': 0.037304755298364495, 'sideways_tp_mult': 1.1779014580372464, 'sideways_tsl_mult': 0.11135124015085411, 'sideways_time_stop': 27, 'sideways_use_sma': False, 'sideways_use_ema': False, 'sideways_use_atr': True, 'sideways_use_adx': False, 'sideways_use_spike': False, 'sideways_rsi_required': True}.
[I 2025-08-31 11:19:30,939] Trial 655 finished with values: [-1000000000.0, 1000000000.0] and parameters: {'p_sma': 23, 'p_std': 12, 'p_atr': 9, 'p_adx': 16, 'rsi_period': 36, 'ema1': 15, 'ema2': 54, 'slip_atr_k': 0.17687792133398816, 'slip_spread_k': 0.4574768699070826, 'spread_hl_frac': 0.007943220963272641, 'bb_std_mult': 2.8012906997247775, 'rsi_os': 27, 'rsi_ob': 81, 'vol_spike': 0.23734552442083667, 'adx_thresh': 22.441919493591023, 'atr_min_pct': 0.005780570513282976, 'atr_max_pct': 0.036108130798472055, 'tp_mult': 2.3236831000620404, 'tsl_mult': 0.250022040551351, 'strategy': 'breakout', 'time_stop': 78, 'use_sma': True, 'use_atr': False, 'use_adx': True, 'use_ema': True, 'use_spike': True, 'rsi_required': True, 'edge_k': 0.24219518762056186, 'edge_cap': 0.5218207704960597, 'bull_strategy': 'breakout', 'bull_bb_std_mult': 0.7392212772869298, 'bull_rsi_os': 11, 'bull_rsi_ob': 74, 'bull_adx_thresh': 11.577805763485497, 'bull_atr_min_pct': 0.004187875882943403, 'bull_atr_max_pct': 0.08989912708184748, 'bull_tp_mult': 1.9101059781057825, 'bull_tsl_mult': 0.3368765379200642, 'bull_time_stop': 79, 'bull_use_sma': True, 'bull_use_ema': False, 'bull_use_atr': False, 'bull_use_adx': False, 'bull_use_spike': False, 'bull_rsi_required': False, 'bear_strategy': 'breakout', 'bear_bb_std_mult': 1.6568393299807784, 'bear_rsi_os': 9, 'bear_rsi_ob': 85, 'bear_adx_thresh': 5.503817242220554, 'bear_atr_min_pct': 0.016999703533324043, 'bear_atr_max_pct': 0.13536335332284866, 'bear_tp_mult': 2.1533260894025053, 'bear_tsl_mult': 0.5876333660056422, 'bear_time_stop': 37, 'bear_use_sma': False, 'bear_use_ema': True, 'bear_use_atr': True, 'bear_use_adx': False, 'bear_use_spike': True, 'bear_rsi_required': False, 'sideways_strategy': 'mean_reversion', 'sideways_bb_std_mult': 0.7158099187034563, 'sideways_rsi_os': 28, 'sideways_rsi_ob': 91, 'sideways_adx_thresh': 22.84894162142603, 'sideways_atr_min_pct': 0.02005924381124386, 'sideways_atr_max_pct': 0.04104638672747464, 'sideways_tp_mult': 1.0100363792459413, 'sideways_tsl_mult': 0.12242565823658315, 'sideways_time_stop': 28, 'sideways_use_sma': False, 'sideways_use_ema': False, 'sideways_use_atr': False, 'sideways_use_adx': False, 'sideways_use_spike': False, 'sideways_rsi_required': True}.
