[I 2025-08-31 11:24:33,291] Trial 693 finished with values: [-1000000000.0, 1000000000.0] and parameters: {'p_sma': 10, 'p_std': 35, 'p_atr': 11, 'p_adx': 14, 'rsi_period': 53, 'ema1': 11, 'ema2': 44, 'slip_atr_k': 0.03902027857289583, 'slip_spread_k': 0.15312767693131263, 'spread_hl_frac': 0.0060002892092600475, 'bb_std_mult': 2.882200551556494, 'rsi_os': 30, 'rsi_ob': 94, 'vol_spike': 0.2854673651243281, 'adx_thresh': 31.52761043162943, 'atr_min_pct': 0.011921325348458627, 'atr_max_pct': 0.147361537056217, 'tp_mult': 1.6505034534639145, 'tsl_mult': 0.1225938526463457, 'strategy': 'breakout', 'time_stop': 197, 'use_sma': True, 'use_atr': False, 'use_adx': True, 'use_ema': True, 'use_spike': False, 'rsi_required': False, 'edge_k': 0.370914748924184, 'edge_cap': 0.5472830255456046, 'bull_strategy': 'mean_reversion', 'bull_bb_std_mult': 0.5990643840305083, 'bull_rsi_os': 13, 'bull_rsi_ob': 85, 'bull_adx_thresh': 5.213208093060629, 'bull_atr_min_pct': 0.004659019976009901, 'bull_atr_max_pct': 0.09820826483977192, 'bull_tp_mult': 1.9057801770966756, 'bull_tsl_mult': 0.4449463827316407, 'bull_time_stop': 275, 'bull_use_sma': False, 'bull_use_ema': True, 'bull_use_atr': False, 'bull_use_adx': False, 'bull_use_spike': True, 'bull_rsi_required': True, 'bear_strategy': 'breakout', 'bear_bb_std_mult': 3.0217333649057045, 'bear_rsi_os': 51, 'bear_rsi_ob': 73, 'bear_adx_thresh': 5.594538430276012, 'bear_atr_min_pct': 0.004277758471953841, 'bear_atr_max_pct': 0.1395805550157215, 'bear_tp_mult': 2.9202529798085326, 'bear_tsl_mult': 0.7918050670796036, 'bear_time_stop': 292, 'bear_use_sma': False, 'bear_use_ema': False, 'bear_use_atr': False, 'bear_use_adx': False, 'bear_use_spike': False, 'bear_rsi_required': True, 'sideways_strategy': 'breakout', 'sideways_bb_std_mult': 2.944207461594204, 'sideways_rsi_os': 29, 'sideways_rsi_ob': 95, 'sideways_adx_thresh': 10.320963919713828, 'sideways_atr_min_pct': 0.015459677851406225, 'sideways_atr_max_pct': 0.04515910165092355, 'sideways_tp_mult': 1.913304046547448, 'sideways_tsl_mult': 0.32485534409027317, 'sideways_time_stop': 5, 'sideways_use_sma': False, 'sideways_use_ema': False, 'sideways_use_atr': True, 'sideways_use_adx': False, 'sideways_use_spike': True, 'sideways_rsi_required': False}.
[I 2025-08-31 11:24:33,637] Trial 692 finished with values: [-1000000000.0, 1000000000.0] and parameters: {'p_sma': 11, 'p_std': 32, 'p_atr': 11, 'p_adx': 26, 'rsi_period': 54, 'ema1': 6, 'ema2': 42, 'slip_atr_k': 0.03771536979114348, 'slip_spread_k': 0.16334046422370382, 'spread_hl_frac': 0.006369013874738138, 'bb_std_mult': 2.970199410633963, 'rsi_os': 30, 'rsi_ob': 94, 'vol_spike': 0.28196543460481427, 'adx_thresh': 32.196895562977886, 'atr_min_pct': 0.010597031827835477, 'atr_max_pct': 0.14699667899767818, 'tp_mult': 1.7192927445217951, 'tsl_mult': 0.051109678151131106, 'strategy': 'breakout', 'time_stop': 198, 'use_sma': True, 'use_atr': False, 'use_adx': True, 'use_ema': False, 'use_spike': True, 'rsi_required': False, 'edge_k': 0.3669579756689918, 'edge_cap': 0.5408612129434144, 'bull_strategy': 'breakout', 'bull_bb_std_mult': 0.6052313063798387, 'bull_rsi_os': 13, 'bull_rsi_ob': 85, 'bull_adx_thresh': 5.057030629016953, 'bull_atr_min_pct': 0.004710358568295877, 'bull_atr_max_pct': 0.09821595970924175, 'bull_tp_mult': 1.8354417939198213, 'bull_tsl_mult': 0.4459061270355319, 'bull_time_stop': 296, 'bull_use_sma': False, 'bull_use_ema': True, 'bull_use_atr': False, 'bull_use_adx': False, 'bull_use_spike': True, 'bull_rsi_required': True, 'bear_strategy': 'mean_reversion', 'bear_bb_std_mult': 3.1374587361577033, 'bear_rsi_os': 51, 'bear_rsi_ob': 72, 'bear_adx_thresh': 5.504062532300281, 'bear_atr_min_pct': 0.003494590871169293, 'bear_atr_max_pct': 0.14000292752872706, 'bear_tp_mult': 2.937837773767808, 'bear_tsl_mult': 0.7858451587255205, 'bear_time_stop': 40, 'bear_use_sma': False, 'bear_use_ema': False, 'bear_use_atr': False, 'bear_use_adx': True, 'bear_use_spike': False, 'bear_rsi_required': True, 'sideways_strategy': 'breakout', 'sideways_bb_std_mult': 2.967913083076381, 'sideways_rsi_os': 25, 'sideways_rsi_ob': 95, 'sideways_adx_thresh': 11.60351944777949, 'sideways_atr_min_pct': 0.01585185593635625, 'sideways_atr_max_pct': 0.04478718315966372, 'sideways_tp_mult': 1.9001796710642165, 'sideways_tsl_mult': 0.41356976407046314, 'sideways_time_stop': 7, 'sideways_use_sma': False, 'sideways_use_ema': False, 'sideways_use_atr': True, 'sideways_use_adx': False, 'sideways_use_spike': True, 'sideways_rsi_required': False}.
[I 2025-08-31 11:24:33,988] Trial 695 finished with values: [-1000000000.0, 1000000000.0] and parameters: {'p_sma': 11, 'p_std': 32, 'p_atr': 11, 'p_adx': 23, 'rsi_period': 53, 'ema1': 7, 'ema2': 45, 'slip_atr_k': 0.03357794127996587, 'slip_spread_k': 0.14925822989732945, 'spread_hl_frac': 0.006126153647609717, 'bb_std_mult': 2.856789280555365, 'rsi_os': 29, 'rsi_ob': 95, 'vol_spike': 0.27977307457340217, 'adx_thresh': 31.285845999524934, 'atr_min_pct': 0.012803496998109088, 'atr_max_pct': 0.14649027006277568, 'tp_mult': 1.7383632806112048, 'tsl_mult': 0.06123550675481868, 'strategy': 'breakout', 'time_stop': 198, 'use_sma': False, 'use_atr': False, 'use_adx': True, 'use_ema': False, 'use_spike': False, 'rsi_required': False, 'edge_k': 0.4459157863742391, 'edge_cap': 0.5563206866019049, 'bull_strategy': 'mean_reversion', 'bull_bb_std_mult': 0.5983652693715937, 'bull_rsi_os': 12, 'bull_rsi_ob': 81, 'bull_adx_thresh': 5.183747840555397, 'bull_atr_min_pct': 0.00473110124061186, 'bull_atr_max_pct': 0.09731192350924414, 'bull_tp_mult': 1.8265588160510915, 'bull_tsl_mult': 0.47919903991922536, 'bull_time_stop': 299, 'bull_use_sma': False, 'bull_use_ema': True, 'bull_use_atr': True, 'bull_use_adx': True, 'bull_use_spike': False, 'bull_rsi_required': False, 'bear_strategy': 'mean_reversion', 'bear_bb_std_mult': 3.0195755370396506, 'bear_rsi_os': 51, 'bear_rsi_ob': 72, 'bear_adx_thresh': 5.505966357836276, 'bear_atr_min_pct': 0.0038760580406742764, 'bear_atr_max_pct': 0.14017514402346556, 'bear_tp_mult': 2.825463215525338, 'bear_tsl_mult': 0.7977848068917563, 'bear_time_stop': 34, 'bear_use_sma': False, 'bear_use_ema': False, 'bear_use_atr': True, 'bear_use_adx': True, 'bear_use_spike': False, 'bear_rsi_required': True, 'sideways_strategy': 'breakout', 'sideways_bb_std_mult': 2.874468242177001, 'sideways_rsi_os': 27, 'sideways_rsi_ob': 95, 'sideways_adx_thresh': 11.391048054851069, 'sideways_atr_min_pct': 0.016183830214982438, 'sideways_atr_max_pct': 0.04191017013354439, 'sideways_tp_mult': 1.883021947556491, 'sideways_tsl_mult': 0.27645940861754703, 'sideways_time_stop': 6, 'sideways_use_sma': False, 'sideways_use_ema': True, 'sideways_use_atr': True, 'sideways_use_adx': False, 'sideways_use_spike': True, 'sideways_rsi_required': False}.
[I 2025-08-31 11:25:07,657] Trial 699 finished with values: [-0.008107111100306819, 0.007570330171620677] and parameters: {'p_sma': 12, 'p_std': 22, 'p_atr': 21, 'p_adx': 14, 'rsi_period': 55, 'ema1': 10, 'ema2': 40, 'slip_atr_k': 0.0321615145093242, 'slip_spread_k': 0.1947121811466842, 'spread_hl_frac': 0.006705481687361126, 'bb_std_mult': 2.8538872372249036, 'rsi_os': 30, 'rsi_ob': 91, 'vol_spike': 0.2768378126132965, 'adx_thresh': 32.65075044335068, 'atr_min_pct': 0.0111011259205907, 'atr_max_pct': 0.14411557073312442, 'tp_mult': 1.6334672824896335, 'tsl_mult': 0.0010458358042104363, 'strategy': 'breakout', 'time_stop': 212, 'use_sma': True, 'use_atr': True, 'use_adx': False, 'use_ema': True, 'use_spike': True, 'rsi_required': False, 'edge_k': 0.35572985840348414, 'edge_cap': 0.5130870122799687, 'bull_strategy': 'breakout', 'bull_bb_std_mult': 0.5089074119095989, 'bull_rsi_os': 13, 'bull_rsi_ob': 81, 'bull_adx_thresh': 5.527272349314437, 'bull_atr_min_pct': 0.026346173466255764, 'bull_atr_max_pct': 0.10148778611121118, 'bull_tp_mult': 1.841181705374704, 'bull_tsl_mult': 0.4260179915825425, 'bull_time_stop': 268, 'bull_use_sma': False, 'bull_use_ema': True, 'bull_use_atr': True, 'bull_use_adx': False, 'bull_use_spike': False, 'bull_rsi_required': True, 'bear_strategy': 'breakout', 'bear_bb_std_mult': 3.2736003701043215, 'bear_rsi_os': 53, 'bear_rsi_ob': 75, 'bear_adx_thresh': 5.652320084747926, 'bear_atr_min_pct': 0.003819108931988306, 'bear_atr_max_pct': 0.13492288518543574, 'bear_tp_mult': 2.790293044131149, 'bear_tsl_mult': 0.7272953221236258, 'bear_time_stop': 93, 'bear_use_sma': False, 'bear_use_ema': True, 'bear_use_atr': False, 'bear_use_adx': False, 'bear_use_spike': False, 'bear_rsi_required': False, 'sideways_strategy': 'breakout', 'sideways_bb_std_mult': 2.859297128756386, 'sideways_rsi_os': 27, 'sideways_rsi_ob': 94, 'sideways_adx_thresh': 13.881354538526155, 'sideways_atr_min_pct': 0.016460963006799063, 'sideways_atr_max_pct': 0.06977969635141036, 'sideways_tp_mult': 1.763406754812755, 'sideways_tsl_mult': 0.43028451241196053, 'sideways_time_stop': 6, 'sideways_use_sma': False, 'sideways_use_ema': True, 'sideways_use_atr': True, 'sideways_use_adx': False, 'sideways_use_spike': True, 'sideways_rsi_required': True}.
[I 2025-08-31 11:25:08,487] Trial 698 finished with values: [-0.017422652817422057, 0.017509613139682308] and parameters: {'p_sma': 13, 'p_std': 22, 'p_atr': 11, 'p_adx': 14, 'rsi_period': 53, 'ema1': 7, 'ema2': 44, 'slip_atr_k': 0.03476543496451193, 'slip_spread_k': 0.194191237462762, 'spread_hl_frac': 0.0060529249282372695, 'bb_std_mult': 2.8358432050107396, 'rsi_os': 29, 'rsi_ob': 91, 'vol_spike': 0.28028360698429156, 'adx_thresh': 32.70999174873647, 'atr_min_pct': 0.013272975743347855, 'atr_max_pct': 0.14432079077978313, 'tp_mult': 1.6473015731845428, 'tsl_mult': 0.006385164764587635, 'strategy': 'breakout', 'time_stop': 212, 'use_sma': False, 'use_atr': True, 'use_adx': False, 'use_ema': True, 'use_spike': True, 'rsi_required': False, 'edge_k': 0.4283804879074864, 'edge_cap': 0.5167057050149815, 'bull_strategy': 'breakout', 'bull_bb_std_mult': 0.519384712535279, 'bull_rsi_os': 13, 'bull_rsi_ob': 81, 'bull_adx_thresh': 5.5346962437299485, 'bull_atr_min_pct': 0.02640114083373149, 'bull_atr_max_pct': 0.1017699664630212, 'bull_tp_mult': 1.8378494728660493, 'bull_tsl_mult': 0.4110313551517016, 'bull_time_stop': 270, 'bull_use_sma': False, 'bull_use_ema': True, 'bull_use_atr': True, 'bull_use_adx': True, 'bull_use_spike': False, 'bull_rsi_required': False, 'bear_strategy': 'breakout', 'bear_bb_std_mult': 3.0907390244338466, 'bear_rsi_os': 53, 'bear_rsi_ob': 74, 'bear_adx_thresh': 5.808577457215251, 'bear_atr_min_pct': 0.003887454518311314, 'bear_atr_max_pct': 0.14170783350427976, 'bear_tp_mult': 2.8147065974711643, 'bear_tsl_mult': 0.8128705115046091, 'bear_time_stop': 34, 'bear_use_sma': False, 'bear_use_ema': True, 'bear_use_atr': True, 'bear_use_adx': False, 'bear_use_spike': False, 'bear_rsi_required': False, 'sideways_strategy': 'breakout', 'sideways_bb_std_mult': 2.8815999494447824, 'sideways_rsi_os': 30, 'sideways_rsi_ob': 94, 'sideways_adx_thresh': 13.439284472355984, 'sideways_atr_min_pct': 0.016483143563820826, 'sideways_atr_max_pct': 0.042375088612944006, 'sideways_tp_mult': 1.795997435312151, 'sideways_tsl_mult': 0.2868691054682387, 'sideways_time_stop': 8, 'sideways_use_sma': False, 'sideways_use_ema': True, 'sideways_use_atr': True, 'sideways_use_adx': False, 'sideways_use_spike': True, 'sideways_rsi_required': True}.
[I 2025-08-31 11:25:08,487] Trial 696 finished with values: [-0.043799326483428325, 0.04332914236729779] and parameters: {'p_sma': 13, 'p_std': 35, 'p_atr': 11, 'p_adx': 14, 'rsi_period': 53, 'ema1': 11, 'ema2': 44, 'slip_atr_k': 0.032507972601841344, 'slip_spread_k': 0.14114755202254767, 'spread_hl_frac': 0.006456681142217055, 'bb_std_mult': 2.8538116246543392, 'rsi_os': 29, 'rsi_ob': 91, 'vol_spike': 0.2807779594799692, 'adx_thresh': 32.347199189835045, 'atr_min_pct': 0.013294245665016444, 'atr_max_pct': 0.146318588147231, 'tp_mult': 1.6457426283722942, 'tsl_mult': 0.003178438174528918, 'strategy': 'breakout', 'time_stop': 198, 'use_sma': True, 'use_atr': True, 'use_adx': False, 'use_ema': False, 'use_spike': True, 'rsi_required': False, 'edge_k': 0.37190372192330584, 'edge_cap': 0.5214238794100654, 'bull_strategy': 'breakout', 'bull_bb_std_mult': 0.6457209477717404, 'bull_rsi_os': 13, 'bull_rsi_ob': 85, 'bull_adx_thresh': 5.295506760528825, 'bull_atr_min_pct': 0.004362793803518673, 'bull_atr_max_pct': 0.09654278680314347, 'bull_tp_mult': 1.8307918849166724, 'bull_tsl_mult': 0.41888566532282, 'bull_time_stop': 270, 'bull_use_sma': False, 'bull_use_ema': True, 'bull_use_atr': True, 'bull_use_adx': False, 'bull_use_spike': False, 'bull_rsi_required': True, 'bear_strategy': 'breakout', 'bear_bb_std_mult': 3.121058773366061, 'bear_rsi_os': 53, 'bear_rsi_ob': 74, 'bear_adx_thresh': 5.767780570890272, 'bear_atr_min_pct': 0.0024602226037474324, 'bear_atr_max_pct': 0.14079788900469228, 'bear_tp_mult': 2.9705004704064972, 'bear_tsl_mult': 0.7984863000693679, 'bear_time_stop': 35, 'bear_use_sma': False, 'bear_use_ema': False, 'bear_use_atr': False, 'bear_use_adx': True, 'bear_use_spike': False, 'bear_rsi_required': True, 'sideways_strategy': 'breakout', 'sideways_bb_std_mult': 2.872136576158976, 'sideways_rsi_os': 29, 'sideways_rsi_ob': 94, 'sideways_adx_thresh': 13.648644483518503, 'sideways_atr_min_pct': 0.01628282170690705, 'sideways_atr_max_pct': 0.06982624834618985, 'sideways_tp_mult': 1.8850299512911906, 'sideways_tsl_mult': 0.402679962376507, 'sideways_time_stop': 6, 'sideways_use_sma': False, 'sideways_use_ema': True, 'sideways_use_atr': True, 'sideways_use_adx': False, 'sideways_use_spike': True, 'sideways_rsi_required': False}.
[I 2025-08-31 11:25:08,657] Trial 697 finished with values: [-0.011941366251880803, 0.012669168425497007] and parameters: {'p_sma': 12, 'p_std': 32, 'p_atr': 11, 'p_adx': 14, 'rsi_period': 53, 'ema1': 18, 'ema2': 44, 'slip_atr_k': 0.03167294330656492, 'slip_spread_k': 0.1985630957542083, 'spread_hl_frac': 0.006023905277488486, 'bb_std_mult': 2.8457246969968946, 'rsi_os': 29, 'rsi_ob': 95, 'vol_spike': 0.2795723649285163, 'adx_thresh': 32.6746532213807, 'atr_min_pct': 0.010343773911012273, 'atr_max_pct': 0.14495248773450045, 'tp_mult': 1.7301877781468251, 'tsl_mult': 0.0008676475285463794, 'strategy': 'breakout', 'time_stop': 213, 'use_sma': True, 'use_atr': True, 'use_adx': False, 'use_ema': False, 'use_spike': True, 'rsi_required': False, 'edge_k': 0.3558118582959361, 'edge_cap': 0.5166233164257127, 'bull_strategy': 'breakout', 'bull_bb_std_mult': 0.5233230652285146, 'bull_rsi_os': 13, 'bull_rsi_ob': 81, 'bull_adx_thresh': 5.339520996143407, 'bull_atr_min_pct': 0.004464525241294203, 'bull_atr_max_pct': 0.10194210581916471, 'bull_tp_mult': 1.8470159465572247, 'bull_tsl_mult': 0.4188630479146425, 'bull_time_stop': 300, 'bull_use_sma': False, 'bull_use_ema': True, 'bull_use_atr': True, 'bull_use_adx': False, 'bull_use_spike': False, 'bull_rsi_required': True, 'bear_strategy': 'breakout', 'bear_bb_std_mult': 3.1106013428277572, 'bear_rsi_os': 53, 'bear_rsi_ob': 75, 'bear_adx_thresh': 5.933293253525378, 'bear_atr_min_pct': 0.0039337882951343255, 'bear_atr_max_pct': 0.1414307622207691, 'bear_tp_mult': 2.8032885850926825, 'bear_tsl_mult': 0.8150458713264336, 'bear_time_stop': 196, 'bear_use_sma': False, 'bear_use_ema': True, 'bear_use_atr': False, 'bear_use_adx': True, 'bear_use_spike': False, 'bear_rsi_required': False, 'sideways_strategy': 'breakout', 'sideways_bb_std_mult': 2.884622761979017, 'sideways_rsi_os': 27, 'sideways_rsi_ob': 94, 'sideways_adx_thresh': 13.709335398045521, 'sideways_atr_min_pct': 0.01636363553286047, 'sideways_atr_max_pct': 0.0420660436634758, 'sideways_tp_mult': 1.8838377705523541, 'sideways_tsl_mult': 0.2698398541996066, 'sideways_time_stop': 5, 'sideways_use_sma': False, 'sideways_use_ema': True, 'sideways_use_atr': True, 'sideways_use_adx': False, 'sideways_use_spike': True, 'sideways_rsi_required': True}.
[I 2025-08-31 11:25:40,465] Trial 703 finished with values: [-0.019897466582225576, 0.020032306636215236] and parameters: {'p_sma': 12, 'p_std': 24, 'p_atr': 10, 'p_adx': 14, 'rsi_period': 56, 'ema1': 11, 'ema2': 40, 'slip_atr_k': 0.04314300307211775, 'slip_spread_k': 0.20731812107312853, 'spread_hl_frac': 0.005974127241696494, 'bb_std_mult': 2.9165180680537586, 'rsi_os': 29, 'rsi_ob': 95, 'vol_spike': 0.27529006172944426, 'adx_thresh': 31.21798097923609, 'atr_min_pct': 0.01129527498598027, 'atr_max_pct': 0.1438148503947772, 'tp_mult': 1.6923615406513486, 'tsl_mult': 0.14000309929617566, 'strategy': 'mean_reversion', 'time_stop': 213, 'use_sma': True, 'use_atr': False, 'use_adx': True, 'use_ema': True, 'use_spike': True, 'rsi_required': False, 'edge_k': 0.3641161188330345, 'edge_cap': 0.5162609199573127, 'bull_strategy': 'breakout', 'bull_bb_std_mult': 0.5616814890694103, 'bull_rsi_os': 13, 'bull_rsi_ob': 82, 'bull_adx_thresh': 5.061129905166597, 'bull_atr_min_pct': 0.004030297969725698, 'bull_atr_max_pct': 0.10155819842055834, 'bull_tp_mult': 1.875853598017782, 'bull_tsl_mult': 0.42846972800172994, 'bull_time_stop': 291, 'bull_use_sma': False, 'bull_use_ema': True, 'bull_use_atr': False, 'bull_use_adx': False, 'bull_use_spike': False, 'bull_rsi_required': True, 'bear_strategy': 'breakout', 'bear_bb_std_mult': 3.177970193991225, 'bear_rsi_os': 54, 'bear_rsi_ob': 74, 'bear_adx_thresh': 5.02809200834735, 'bear_atr_min_pct': 0.004068447410720882, 'bear_atr_max_pct': 0.13689564614939675, 'bear_tp_mult': 2.404845233643479, 'bear_tsl_mult': 0.7349578471116234, 'bear_time_stop': 72, 'bear_use_sma': True, 'bear_use_ema': True, 'bear_use_atr': False, 'bear_use_adx': False, 'bear_use_spike': False, 'bear_rsi_required': False, 'sideways_strategy': 'breakout', 'sideways_bb_std_mult': 2.838588982827345, 'sideways_rsi_os': 26, 'sideways_rsi_ob': 94, 'sideways_adx_thresh': 9.451979599534008, 'sideways_atr_min_pct': 0.016411401068952967, 'sideways_atr_max_pct': 0.041185187509319064, 'sideways_tp_mult': 1.7509671344246325, 'sideways_tsl_mult': 0.36585025734796633, 'sideways_time_stop': 5, 'sideways_use_sma': True, 'sideways_use_ema': False, 'sideways_use_atr': True, 'sideways_use_adx': True, 'sideways_use_spike': True, 'sideways_rsi_required': True}.
[I 2025-08-31 11:25:41,222] Trial 702 finished with values: [-0.015369823834352037, 0.015453066678435146] and parameters: {'p_sma': 11, 'p_std': 34, 'p_atr': 10, 'p_adx': 22, 'rsi_period': 56, 'ema1': 11, 'ema2': 40, 'slip_atr_k': 0.03150469310833141, 'slip_spread_k': 0.21083384461196858, 'spread_hl_frac': 0.005595064413092549, 'bb_std_mult': 2.899467512124229, 'rsi_os': 31, 'rsi_ob': 95, 'vol_spike': 0.2770736125025847, 'adx_thresh': 31.310925082272544, 'atr_min_pct': 0.01106448339778379, 'atr_max_pct': 0.14380657756818307, 'tp_mult': 1.7160846982272469, 'tsl_mult': 0.08057467895649684, 'strategy': 'breakout', 'time_stop': 213, 'use_sma': True, 'use_atr': False, 'use_adx': True, 'use_ema': True, 'use_spike': True, 'rsi_required': False, 'edge_k': 0.3301886267857368, 'edge_cap': 0.5114411358519622, 'bull_strategy': 'breakout', 'bull_bb_std_mult': 0.5019327521987338, 'bull_rsi_os': 13, 'bull_rsi_ob': 82, 'bull_adx_thresh': 5.162786322047104, 'bull_atr_min_pct': 0.003786566217165033, 'bull_atr_max_pct': 0.10171550661143824, 'bull_tp_mult': 1.896242648353949, 'bull_tsl_mult': 0.4230911798117234, 'bull_time_stop': 289, 'bull_use_sma': False, 'bull_use_ema': True, 'bull_use_atr': False, 'bull_use_adx': False, 'bull_use_spike': False, 'bull_rsi_required': True, 'bear_strategy': 'breakout', 'bear_bb_std_mult': 3.3150698851764275, 'bear_rsi_os': 54, 'bear_rsi_ob': 75, 'bear_adx_thresh': 6.178818453315579, 'bear_atr_min_pct': 0.003916954528231331, 'bear_atr_max_pct': 0.13460292482808126, 'bear_tp_mult': 1.7841883048959073, 'bear_tsl_mult': 0.7641738145492594, 'bear_time_stop': 134, 'bear_use_sma': True, 'bear_use_ema': True, 'bear_use_atr': False, 'bear_use_adx': False, 'bear_use_spike': False, 'bear_rsi_required': False, 'sideways_strategy': 'breakout', 'sideways_bb_std_mult': 2.8725803843147015, 'sideways_rsi_os': 25, 'sideways_rsi_ob': 94, 'sideways_adx_thresh': 12.72069094318514, 'sideways_atr_min_pct': 0.016500639363003177, 'sideways_atr_max_pct': 0.04135164828947534, 'sideways_tp_mult': 1.830821224735852, 'sideways_tsl_mult': 0.37667578655253314, 'sideways_time_stop': 7, 'sideways_use_sma': False, 'sideways_use_ema': False, 'sideways_use_atr': True, 'sideways_use_adx': True, 'sideways_use_spike': True, 'sideways_rsi_required': True}.
