[I 2025-08-31 11:07:31,360] Trial 568 finished with values: [-1000000000.0, 1000000000.0] and parameters: {'p_sma': 53, 'p_std': 28, 'p_atr': 10, 'p_adx': 14, 'rsi_period': 46, 'ema1': 7, 'ema2': 44, 'slip_atr_k': 0.02135112525271076, 'slip_spread_k': 0.862213788089468, 'spread_hl_frac': 0.009023813710242636, 'bb_std_mult': 2.6076100324367646, 'rsi_os': 54, 'rsi_ob': 76, 'vol_spike': 0.08688654365893213, 'adx_thresh': 30.141410809818005, 'atr_min_pct': 0.004433584262211375, 'atr_max_pct': 0.0969786884586287, 'tp_mult': 2.2338811816739397, 'tsl_mult': 0.27901299228481213, 'strategy': 'breakout', 'time_stop': 68, 'use_sma': True, 'use_atr': False, 'use_adx': True, 'use_ema': True, 'use_spike': True, 'rsi_required': True, 'edge_k': 1.3629917532716074, 'edge_cap': 0.4748899385767057, 'bull_strategy': 'breakout', 'bull_bb_std_mult': 1.338717764734009, 'bull_rsi_os': 10, 'bull_rsi_ob': 69, 'bull_adx_thresh': 8.382714171629509, 'bull_atr_min_pct': 0.017652539684941293, 'bull_atr_max_pct': 0.0638514809938969, 'bull_tp_mult': 2.020553596827529, 'bull_tsl_mult': 0.32452801020527666, 'bull_time_stop': 58, 'bull_use_sma': True, 'bull_use_ema': False, 'bull_use_atr': False, 'bull_use_adx': False, 'bull_use_spike': False, 'bull_rsi_required': False, 'bear_strategy': 'mean_reversion', 'bear_bb_std_mult': 2.0932747400525304, 'bear_rsi_os': 29, 'bear_rsi_ob': 90, 'bear_adx_thresh': 5.616649952096238, 'bear_atr_min_pct': 0.007308605422053, 'bear_atr_max_pct': 0.021313668806693498, 'bear_tp_mult': 1.062628349618159, 'bear_tsl_mult': 0.4447003556417584, 'bear_time_stop': 41, 'bear_use_sma': False, 'bear_use_ema': True, 'bear_use_atr': False, 'bear_use_adx': False, 'bear_use_spike': True, 'bear_rsi_required': False, 'sideways_strategy': 'mean_reversion', 'sideways_bb_std_mult': 0.5056220701382961, 'sideways_rsi_os': 6, 'sideways_rsi_ob': 86, 'sideways_adx_thresh': 25.41326679188946, 'sideways_atr_min_pct': 0.00986757146443365, 'sideways_atr_max_pct': 0.04593737527823353, 'sideways_tp_mult': 1.8728808966585397, 'sideways_tsl_mult': 0.20447166119173193, 'sideways_time_stop': 19, 'sideways_use_sma': False, 'sideways_use_ema': False, 'sideways_use_atr': False, 'sideways_use_adx': False, 'sideways_use_spike': False, 'sideways_rsi_required': True}.
[I 2025-08-31 11:07:31,867] Trial 565 finished with values: [-0.010679436730231306, 0.012658675213374845] and parameters: {'p_sma': 16, 'p_std': 28, 'p_atr': 12, 'p_adx': 13, 'rsi_period': 44, 'ema1': 15, 'ema2': 49, 'slip_atr_k': 0.021660495368785018, 'slip_spread_k': 0.7127024558980288, 'spread_hl_frac': 0.010756270862212772, 'bb_std_mult': 2.5904542735297693, 'rsi_os': 30, 'rsi_ob': 76, 'vol_spike': 0.10973734228013526, 'adx_thresh': 29.444841886175922, 'atr_min_pct': 0.006769380290530374, 'atr_max_pct': 0.09524505098897235, 'tp_mult': 2.432166722648833, 'tsl_mult': 0.050925553196600304, 'strategy': 'breakout', 'time_stop': 84, 'use_sma': True, 'use_atr': False, 'use_adx': True, 'use_ema': True, 'use_spike': True, 'rsi_required': True, 'edge_k': 0.1470944788914036, 'edge_cap': 0.2974444848776131, 'bull_strategy': 'breakout', 'bull_bb_std_mult': 1.8788490281473127, 'bull_rsi_os': 10, 'bull_rsi_ob': 67, 'bull_adx_thresh': 15.00782003051098, 'bull_atr_min_pct': 0.005263322078789838, 'bull_atr_max_pct': 0.063664896725471, 'bull_tp_mult': 1.9997024739338198, 'bull_tsl_mult': 0.4199610784625195, 'bull_time_stop': 70, 'bull_use_sma': False, 'bull_use_ema': False, 'bull_use_atr': False, 'bull_use_adx': False, 'bull_use_spike': False, 'bull_rsi_required': True, 'bear_strategy': 'breakout', 'bear_bb_std_mult': 2.101950538491208, 'bear_rsi_os': 40, 'bear_rsi_ob': 65, 'bear_adx_thresh': 5.7930173304441475, 'bear_atr_min_pct': 0.00408171215947055, 'bear_atr_max_pct': 0.02205462640615613, 'bear_tp_mult': 1.6784953016733213, 'bear_tsl_mult': 0.5210157335907399, 'bear_time_stop': 135, 'bear_use_sma': False, 'bear_use_ema': True, 'bear_use_atr': False, 'bear_use_adx': False, 'bear_use_spike': False, 'bear_rsi_required': False, 'sideways_strategy': 'mean_reversion', 'sideways_bb_std_mult': 2.808086203958223, 'sideways_rsi_os': 53, 'sideways_rsi_ob': 88, 'sideways_adx_thresh': 25.310640537674832, 'sideways_atr_min_pct': 0.02095518827312591, 'sideways_atr_max_pct': 0.046796283156871274, 'sideways_tp_mult': 2.8919038276588425, 'sideways_tsl_mult': 0.9488435701887699, 'sideways_time_stop': 19, 'sideways_use_sma': False, 'sideways_use_ema': True, 'sideways_use_atr': False, 'sideways_use_adx': False, 'sideways_use_spike': False, 'sideways_rsi_required': True}.
[I 2025-08-31 11:08:04,717] Trial 571 finished with values: [-1000000000.0, 1000000000.0] and parameters: {'p_sma': 17, 'p_std': 30, 'p_atr': 13, 'p_adx': 8, 'rsi_period': 38, 'ema1': 15, 'ema2': 17, 'slip_atr_k': 0.033914555710539765, 'slip_spread_k': 0.7159203632612584, 'spread_hl_frac': 0.003842979349111361, 'bb_std_mult': 2.8642436187626226, 'rsi_os': 25, 'rsi_ob': 77, 'vol_spike': 0.26621633347310797, 'adx_thresh': 27.386706752427994, 'atr_min_pct': 0.005480307975856569, 'atr_max_pct': 0.05455285237530344, 'tp_mult': 2.4958107843009927, 'tsl_mult': 0.752826131986949, 'strategy': 'breakout', 'time_stop': 84, 'use_sma': False, 'use_atr': False, 'use_adx': True, 'use_ema': False, 'use_spike': False, 'rsi_required': True, 'edge_k': 0.22406154382147336, 'edge_cap': 0.4316849259653105, 'bull_strategy': 'breakout', 'bull_bb_std_mult': 2.0944208065560193, 'bull_rsi_os': 11, 'bull_rsi_ob': 72, 'bull_adx_thresh': 5.589938578639723, 'bull_atr_min_pct': 0.015030783642361361, 'bull_atr_max_pct': 0.05321419216200868, 'bull_tp_mult': 1.5606556845834323, 'bull_tsl_mult': 0.42759462050596825, 'bull_time_stop': 84, 'bull_use_sma': True, 'bull_use_ema': False, 'bull_use_atr': False, 'bull_use_adx': True, 'bull_use_spike': False, 'bull_rsi_required': True, 'bear_strategy': 'mean_reversion', 'bear_bb_std_mult': 1.7030527999859775, 'bear_rsi_os': 40, 'bear_rsi_ob': 73, 'bear_adx_thresh': 6.908448003878126, 'bear_atr_min_pct': 0.005828555482158003, 'bear_atr_max_pct': 0.12636449461477917, 'bear_tp_mult': 2.8694717262960685, 'bear_tsl_mult': 0.4798369452533581, 'bear_time_stop': 17, 'bear_use_sma': False, 'bear_use_ema': True, 'bear_use_atr': False, 'bear_use_adx': True, 'bear_use_spike': True, 'bear_rsi_required': False, 'sideways_strategy': 'mean_reversion', 'sideways_bb_std_mult': 1.1252135877434983, 'sideways_rsi_os': 7, 'sideways_rsi_ob': 95, 'sideways_adx_thresh': 26.352206993618683, 'sideways_atr_min_pct': 0.020941601557563548, 'sideways_atr_max_pct': 0.014386581215712985, 'sideways_tp_mult': 1.7552751906360984, 'sideways_tsl_mult': 0.8457405857830682, 'sideways_time_stop': 27, 'sideways_use_sma': False, 'sideways_use_ema': False, 'sideways_use_atr': False, 'sideways_use_adx': False, 'sideways_use_spike': False, 'sideways_rsi_required': False}.
[I 2025-08-31 11:08:04,949] Trial 570 finished with values: [-0.04147038634884992, 0.041314579418147035] and parameters: {'p_sma': 30, 'p_std': 28, 'p_atr': 12, 'p_adx': 7, 'rsi_period': 38, 'ema1': 15, 'ema2': 44, 'slip_atr_k': 0.030651125143307582, 'slip_spread_k': 0.7108460571051297, 'spread_hl_frac': 0.008573914120271768, 'bb_std_mult': 0.9195016934006723, 'rsi_os': 54, 'rsi_ob': 92, 'vol_spike': 0.15119214143678003, 'adx_thresh': 27.402902771482864, 'atr_min_pct': 0.015796648009307277, 'atr_max_pct': 0.038788269025281645, 'tp_mult': 2.260889614682756, 'tsl_mult': 0.055698658929265676, 'strategy': 'breakout', 'time_stop': 84, 'use_sma': True, 'use_atr': False, 'use_adx': True, 'use_ema': False, 'use_spike': False, 'rsi_required': True, 'edge_k': 1.5645641983761618, 'edge_cap': 0.3062842978126784, 'bull_strategy': 'breakout', 'bull_bb_std_mult': 2.101172477084816, 'bull_rsi_os': 10, 'bull_rsi_ob': 69, 'bull_adx_thresh': 31.66816732061382, 'bull_atr_min_pct': 0.0006303624074716339, 'bull_atr_max_pct': 0.06274838640746665, 'bull_tp_mult': 1.4739289811131508, 'bull_tsl_mult': 0.31829383291525315, 'bull_time_stop': 59, 'bull_use_sma': True, 'bull_use_ema': False, 'bull_use_atr': False, 'bull_use_adx': True, 'bull_use_spike': False, 'bull_rsi_required': True, 'bear_strategy': 'mean_reversion', 'bear_bb_std_mult': 1.702229631831727, 'bear_rsi_os': 40, 'bear_rsi_ob': 90, 'bear_adx_thresh': 5.5508211267643714, 'bear_atr_min_pct': 0.007206682967384191, 'bear_atr_max_pct': 0.13543838080444695, 'bear_tp_mult': 2.076755501102575, 'bear_tsl_mult': 0.569067401788117, 'bear_time_stop': 38, 'bear_use_sma': False, 'bear_use_ema': True, 'bear_use_atr': False, 'bear_use_adx': True, 'bear_use_spike': True, 'bear_rsi_required': False, 'sideways_strategy': 'mean_reversion', 'sideways_bb_std_mult': 0.8763744791861259, 'sideways_rsi_os': 7, 'sideways_rsi_ob': 95, 'sideways_adx_thresh': 25.428902863176038, 'sideways_atr_min_pct': 0.019061362277582705, 'sideways_atr_max_pct': 0.05105415220116756, 'sideways_tp_mult': 2.714495789005009, 'sideways_tsl_mult': 0.08823084888222604, 'sideways_time_stop': 27, 'sideways_use_sma': False, 'sideways_use_ema': False, 'sideways_use_atr': False, 'sideways_use_adx': False, 'sideways_use_spike': False, 'sideways_rsi_required': False}.
[I 2025-08-31 11:08:04,956] Trial 569 finished with values: [-1000000000.0, 1000000000.0] and parameters: {'p_sma': 16, 'p_std': 28, 'p_atr': 24, 'p_adx': 9, 'rsi_period': 18, 'ema1': 13, 'ema2': 58, 'slip_atr_k': 0.22505146364757667, 'slip_spread_k': 0.709289974804003, 'spread_hl_frac': 0.008002313723357168, 'bb_std_mult': 3.387699966748904, 'rsi_os': 25, 'rsi_ob': 94, 'vol_spike': 0.08925099947750735, 'adx_thresh': 27.436040364933653, 'atr_min_pct': 0.005356525328268636, 'atr_max_pct': 0.12402122545007901, 'tp_mult': 2.2476447462280267, 'tsl_mult': 0.4559018538030112, 'strategy': 'breakout', 'time_stop': 68, 'use_sma': True, 'use_atr': False, 'use_adx': True, 'use_ema': True, 'use_spike': True, 'rsi_required': True, 'edge_k': 1.9964022565634023, 'edge_cap': 0.32474385949471285, 'bull_strategy': 'breakout', 'bull_bb_std_mult': 0.7157968026181335, 'bull_rsi_os': 10, 'bull_rsi_ob': 74, 'bull_adx_thresh': 6.0956926888366585, 'bull_atr_min_pct': 0.0028706393107324306, 'bull_atr_max_pct': 0.09374131131151191, 'bull_tp_mult': 1.5542415713028332, 'bull_tsl_mult': 0.3199399285014701, 'bull_time_stop': 84, 'bull_use_sma': True, 'bull_use_ema': False, 'bull_use_atr': False, 'bull_use_adx': True, 'bull_use_spike': False, 'bull_rsi_required': False, 'bear_strategy': 'mean_reversion', 'bear_bb_std_mult': 0.6734016582096596, 'bear_rsi_os': 40, 'bear_rsi_ob': 51, 'bear_adx_thresh': 5.637716742276277, 'bear_atr_min_pct': 0.007328407106535909, 'bear_atr_max_pct': 0.12574936568700296, 'bear_tp_mult': 2.868206517280526, 'bear_tsl_mult': 0.5662965415319698, 'bear_time_stop': 40, 'bear_use_sma': False, 'bear_use_ema': True, 'bear_use_atr': False, 'bear_use_adx': False, 'bear_use_spike': True, 'bear_rsi_required': False, 'sideways_strategy': 'mean_reversion', 'sideways_bb_std_mult': 2.0592743758042507, 'sideways_rsi_os': 7, 'sideways_rsi_ob': 95, 'sideways_adx_thresh': 25.23341917949088, 'sideways_atr_min_pct': 0.0012190637105790724, 'sideways_atr_max_pct': 0.04479938077254319, 'sideways_tp_mult': 2.4513864368981273, 'sideways_tsl_mult': 0.09898275805955085, 'sideways_time_stop': 28, 'sideways_use_sma': False, 'sideways_use_ema': False, 'sideways_use_atr': False, 'sideways_use_adx': False, 'sideways_use_spike': False, 'sideways_rsi_required': True}.
[I 2025-08-31 11:08:05,024] Trial 572 finished with values: [-1000000000.0, 1000000000.0] and parameters: {'p_sma': 16, 'p_std': 29, 'p_atr': 8, 'p_adx': 15, 'rsi_period': 49, 'ema1': 21, 'ema2': 46, 'slip_atr_k': 0.03358433675048621, 'slip_spread_k': 0.32927368327494244, 'spread_hl_frac': 0.003548496582635563, 'bb_std_mult': 1.8941686637378408, 'rsi_os': 26, 'rsi_ob': 53, 'vol_spike': 0.15318176823424423, 'adx_thresh': 27.34993441456511, 'atr_min_pct': 0.023289970426566636, 'atr_max_pct': 0.10479849972309312, 'tp_mult': 2.4757750353866395, 'tsl_mult': 0.2669975510527433, 'strategy': 'breakout', 'time_stop': 83, 'use_sma': False, 'use_atr': True, 'use_adx': False, 'use_ema': False, 'use_spike': False, 'rsi_required': True, 'edge_k': 0.22859342124902246, 'edge_cap': 0.48787901645642223, 'bull_strategy': 'breakout', 'bull_bb_std_mult': 0.7147869158915808, 'bull_rsi_os': 50, 'bull_rsi_ob': 72, 'bull_adx_thresh': 7.417825074555364, 'bull_atr_min_pct': 0.0037614579506447822, 'bull_atr_max_pct': 0.09383931296273001, 'bull_tp_mult': 1.4930744088236203, 'bull_tsl_mult': 0.04461901060405116, 'bull_time_stop': 227, 'bull_use_sma': True, 'bull_use_ema': False, 'bull_use_atr': False, 'bull_use_adx': True, 'bull_use_spike': False, 'bull_rsi_required': True, 'bear_strategy': 'mean_reversion', 'bear_bb_std_mult': 0.6831981973596724, 'bear_rsi_os': 48, 'bear_rsi_ob': 58, 'bear_adx_thresh': 6.87147761860626, 'bear_atr_min_pct': 0.012456506232684137, 'bear_atr_max_pct': 0.09610359802317747, 'bear_tp_mult': 2.081197263244733, 'bear_tsl_mult': 0.3662272566937078, 'bear_time_stop': 145, 'bear_use_sma': False, 'bear_use_ema': True, 'bear_use_atr': False, 'bear_use_adx': True, 'bear_use_spike': True, 'bear_rsi_required': False, 'sideways_strategy': 'mean_reversion', 'sideways_bb_std_mult': 1.120585332584779, 'sideways_rsi_os': 7, 'sideways_rsi_ob': 88, 'sideways_adx_thresh': 10.770316531070277, 'sideways_atr_min_pct': 0.01891076769168983, 'sideways_atr_max_pct': 0.037540426335046874, 'sideways_tp_mult': 1.9396745035588792, 'sideways_tsl_mult': 0.09034966332903845, 'sideways_time_stop': 267, 'sideways_use_sma': False, 'sideways_use_ema': False, 'sideways_use_atr': False, 'sideways_use_adx': False, 'sideways_use_spike': False, 'sideways_rsi_required': False}.
[I 2025-08-31 11:08:36,529] Trial 573 finished with values: [-1000000000.0, 1000000000.0] and parameters: {'p_sma': 60, 'p_std': 28, 'p_atr': 21, 'p_adx': 20, 'rsi_period': 48, 'ema1': 13, 'ema2': 59, 'slip_atr_k': 0.10324048701980398, 'slip_spread_k': 0.3221818517182298, 'spread_hl_frac': 0.0409914721410755, 'bb_std_mult': 2.7190417105238525, 'rsi_os': 26, 'rsi_ob': 53, 'vol_spike': 0.11041391168961802, 'adx_thresh': 13.76240281722123, 'atr_min_pct': 0.029117201783622003, 'atr_max_pct': 0.03950409647498291, 'tp_mult': 1.1050882360611065, 'tsl_mult': 0.4584212041904016, 'strategy': 'breakout', 'time_stop': 199, 'use_sma': True, 'use_atr': True, 'use_adx': False, 'use_ema': True, 'use_spike': True, 'rsi_required': True, 'edge_k': 1.9654352225685767, 'edge_cap': 0.41637989341603776, 'bull_strategy': 'breakout', 'bull_bb_std_mult': 0.7156962211146717, 'bull_rsi_os': 50, 'bull_rsi_ob': 58, 'bull_adx_thresh': 6.425864192445741, 'bull_atr_min_pct': 0.0037674377302291014, 'bull_atr_max_pct': 0.0934177770162557, 'bull_tp_mult': 1.9336208441203673, 'bull_tsl_mult': 0.3960443251707464, 'bull_time_stop': 71, 'bull_use_sma': True, 'bull_use_ema': False, 'bull_use_atr': False, 'bull_use_adx': True, 'bull_use_spike': False, 'bull_rsi_required': True, 'bear_strategy': 'breakout', 'bear_bb_std_mult': 2.3069276791850504, 'bear_rsi_os': 40, 'bear_rsi_ob': 86, 'bear_adx_thresh': 6.306494879971894, 'bear_atr_min_pct': 0.008321996621890444, 'bear_atr_max_pct': 0.10884293212988115, 'bear_tp_mult': 2.072683804764973, 'bear_tsl_mult': 0.35913149085470886, 'bear_time_stop': 144, 'bear_use_sma': False, 'bear_use_ema': True, 'bear_use_atr': False, 'bear_use_adx': False, 'bear_use_spike': True, 'bear_rsi_required': False, 'sideways_strategy': 'mean_reversion', 'sideways_bb_std_mult': 1.2877205525413826, 'sideways_rsi_os': 22, 'sideways_rsi_ob': 95, 'sideways_adx_thresh': 24.079512968502193, 'sideways_atr_min_pct': 0.0005030977898139583, 'sideways_atr_max_pct': 0.039958520850940496, 'sideways_tp_mult': 1.9332955054025924, 'sideways_tsl_mult': 0.09080202328204955, 'sideways_time_stop': 5, 'sideways_use_sma': False, 'sideways_use_ema': False, 'sideways_use_atr': False, 'sideways_use_adx': False, 'sideways_use_spike': False, 'sideways_rsi_required': True}.
[I 2025-08-31 11:08:37,142] Trial 574 finished with values: [-1000000000.0, 1000000000.0] and parameters: {'p_sma': 50, 'p_std': 28, 'p_atr': 8, 'p_adx': 15, 'rsi_period': 48, 'ema1': 8, 'ema2': 56, 'slip_atr_k': 0.0002808724285665726, 'slip_spread_k': 0.32517255852641025, 'spread_hl_frac': 0.010138993090054798, 'bb_std_mult': 1.9085018364140927, 'rsi_os': 26, 'rsi_ob': 83, 'vol_spike': 0.26504692801241814, 'adx_thresh': 6.955336767607882, 'atr_min_pct': 0.023346720111163344, 'atr_max_pct': 0.13185975549524978, 'tp_mult': 2.355709318250553, 'tsl_mult': 0.26905136191309076, 'strategy': 'breakout', 'time_stop': 78, 'use_sma': True, 'use_atr': True, 'use_adx': False, 'use_ema': True, 'use_spike': True, 'rsi_required': False, 'edge_k': 0.07964347288202064, 'edge_cap': 0.5896025447472437, 'bull_strategy': 'breakout', 'bull_bb_std_mult': 0.8251769021932207, 'bull_rsi_os': 15, 'bull_rsi_ob': 84, 'bull_adx_thresh': 21.511834946717862, 'bull_atr_min_pct': 0.003936109101127673, 'bull_atr_max_pct': 0.09297493675047169, 'bull_tp_mult': 1.9235292542203686, 'bull_tsl_mult': 0.3761140341662188, 'bull_time_stop': 228, 'bull_use_sma': True, 'bull_use_ema': False, 'bull_use_atr': True, 'bull_use_adx': False, 'bull_use_spike': False, 'bull_rsi_required': True, 'bear_strategy': 'breakout', 'bear_bb_std_mult': 2.2900696325170165, 'bear_rsi_os': 48, 'bear_rsi_ob': 75, 'bear_adx_thresh': 6.440861157951501, 'bear_atr_min_pct': 0.02586834024694424, 'bear_atr_max_pct': 0.10764156263955475, 'bear_tp_mult': 2.7298239228444907, 'bear_tsl_mult': 0.358582952220413, 'bear_time_stop': 136, 'bear_use_sma': False, 'bear_use_ema': False, 'bear_use_atr': True, 'bear_use_adx': False, 'bear_use_spike': True, 'bear_rsi_required': True, 'sideways_strategy': 'mean_reversion', 'sideways_bb_std_mult': 2.609117666562818, 'sideways_rsi_os': 54, 'sideways_rsi_ob': 89, 'sideways_adx_thresh': 22.482128675243022, 'sideways_atr_min_pct': 0.0015709863307892188, 'sideways_atr_max_pct': 0.04046948465401437, 'sideways_tp_mult': 1.9405381274649034, 'sideways_tsl_mult': 0.10412255591267418, 'sideways_time_stop': 145, 'sideways_use_sma': False, 'sideways_use_ema': False, 'sideways_use_atr': False, 'sideways_use_adx': True, 'sideways_use_spike': True, 'sideways_rsi_required': True}.
[I 2025-08-31 11:08:37,810] Trial 575 finished with values: [-1000000000.0, 1000000000.0] and parameters: {'p_sma': 14, 'p_std': 27, 'p_atr': 20, 'p_adx': 14, 'rsi_period': 24, 'ema1': 14, 'ema2': 56, 'slip_atr_k': 0.027873535389233168, 'slip_spread_k': 0.6310219343531009, 'spread_hl_frac': 0.010347255243660546, 'bb_std_mult': 2.4356384095069585, 'rsi_os': 27, 'rsi_ob': 77, 'vol_spike': 0.1287639347600868, 'adx_thresh': 28.84088792297965, 'atr_min_pct': 0.006949413968074029, 'atr_max_pct': 0.0910419071857998, 'tp_mult': 2.3500928530930003, 'tsl_mult': 0.8750154134839054, 'strategy': 'breakout', 'time_stop': 76, 'use_sma': True, 'use_atr': True, 'use_adx': False, 'use_ema': True, 'use_spike': True, 'rsi_required': False, 'edge_k': 0.07504136373038045, 'edge_cap': 0.1798823710442613, 'bull_strategy': 'mean_reversion', 'bull_bb_std_mult': 0.8558085792843518, 'bull_rsi_os': 15, 'bull_rsi_ob': 85, 'bull_adx_thresh': 6.61442244191304, 'bull_atr_min_pct': 0.003955349118115282, 'bull_atr_max_pct': 0.10734014319533157, 'bull_tp_mult': 1.9178180336324941, 'bull_tsl_mult': 0.07437840982632177, 'bull_time_stop': 70, 'bull_use_sma': False, 'bull_use_ema': True, 'bull_use_atr': True, 'bull_use_adx': False, 'bull_use_spike': True, 'bull_rsi_required': True, 'bear_strategy': 'breakout', 'bear_bb_std_mult': 1.4050774747089425, 'bear_rsi_os': 38, 'bear_rsi_ob': 85, 'bear_adx_thresh': 6.246793122285189, 'bear_atr_min_pct': 0.005112536210632075, 'bear_atr_max_pct': 0.10782916575265712, 'bear_tp_mult': 2.699601042718124, 'bear_tsl_mult': 0.5318483337097387, 'bear_time_stop': 131, 'bear_use_sma': True, 'bear_use_ema': False, 'bear_use_atr': True, 'bear_use_adx': False, 'bear_use_spike': True, 'bear_rsi_required': True, 'sideways_strategy': 'breakout', 'sideways_bb_std_mult': 3.2339154537338217, 'sideways_rsi_os': 38, 'sideways_rsi_ob': 89, 'sideways_adx_thresh': 24.003082678399974, 'sideways_atr_min_pct': 0.019799950840519605, 'sideways_atr_max_pct': 0.041107362755665636, 'sideways_tp_mult': 1.2654678312958887, 'sideways_tsl_mult': 0.12203183847015295, 'sideways_time_stop': 143, 'sideways_use_sma': False, 'sideways_use_ema': True, 'sideways_use_atr': True, 'sideways_use_adx': True, 'sideways_use_spike': True, 'sideways_rsi_required': True}.
