[I 2025-08-31 11:10:14,792] Trial 587 finished with values: [-1000000000.0, 1000000000.0] and parameters: {'p_sma': 16, 'p_std': 29, 'p_atr': 11, 'p_adx': 15, 'rsi_period': 57, 'ema1': 25, 'ema2': 58, 'slip_atr_k': 0.06822726875220261, 'slip_spread_k': 0.11283050328314792, 'spread_hl_frac': 0.03722264092320559, 'bb_std_mult': 3.168614589066965, 'rsi_os': 25, 'rsi_ob': 76, 'vol_spike': 0.006587421286876199, 'adx_thresh': 27.926744230249085, 'atr_min_pct': 0.005746893243948484, 'atr_max_pct': 0.027593214048907203, 'tp_mult': 2.383318161352784, 'tsl_mult': 0.000814091830279251, 'strategy': 'breakout', 'time_stop': 87, 'use_sma': True, 'use_atr': False, 'use_adx': True, 'use_ema': True, 'use_spike': False, 'rsi_required': True, 'edge_k': 0.3492878086487434, 'edge_cap': 0.4797606897692508, 'bull_strategy': 'breakout', 'bull_bb_std_mult': 0.683036617084128, 'bull_rsi_os': 24, 'bull_rsi_ob': 76, 'bull_adx_thresh': 6.705451982395026, 'bull_atr_min_pct': 0.004295369952521734, 'bull_atr_max_pct': 0.09988511345078756, 'bull_tp_mult': 1.6004714193011136, 'bull_tsl_mult': 0.26720192978948454, 'bull_time_stop': 66, 'bull_use_sma': True, 'bull_use_ema': False, 'bull_use_atr': False, 'bull_use_adx': False, 'bull_use_spike': False, 'bull_rsi_required': True, 'bear_strategy': 'breakout', 'bear_bb_std_mult': 3.4085948616634867, 'bear_rsi_os': 39, 'bear_rsi_ob': 83, 'bear_adx_thresh': 6.959013547738788, 'bear_atr_min_pct': 0.005826658488671893, 'bear_atr_max_pct': 0.11426913781010486, 'bear_tp_mult': 2.852187289114993, 'bear_tsl_mult': 0.7400306150646572, 'bear_time_stop': 281, 'bear_use_sma': False, 'bear_use_ema': True, 'bear_use_atr': False, 'bear_use_adx': False, 'bear_use_spike': True, 'bear_rsi_required': False, 'sideways_strategy': 'mean_reversion', 'sideways_bb_std_mult': 1.8904365687513862, 'sideways_rsi_os': 43, 'sideways_rsi_ob': 95, 'sideways_adx_thresh': 34.27116772883498, 'sideways_atr_min_pct': 0.016530085841149296, 'sideways_atr_max_pct': 0.037909387720360774, 'sideways_tp_mult': 1.8081572247321342, 'sideways_tsl_mult': 0.724683203433618, 'sideways_time_stop': 215, 'sideways_use_sma': False, 'sideways_use_ema': False, 'sideways_use_atr': False, 'sideways_use_adx': False, 'sideways_use_spike': False, 'sideways_rsi_required': True}.
[I 2025-08-31 11:10:14,975] Trial 586 finished with values: [-1000000000.0, 1000000000.0] and parameters: {'p_sma': 38, 'p_std': 29, 'p_atr': 11, 'p_adx': 24, 'rsi_period': 75, 'ema1': 15, 'ema2': 22, 'slip_atr_k': 0.019929802883172573, 'slip_spread_k': 0.6031248982136398, 'spread_hl_frac': 0.03137719489420324, 'bb_std_mult': 2.8158175746121694, 'rsi_os': 46, 'rsi_ob': 76, 'vol_spike': 0.006940629817787425, 'adx_thresh': 10.921134509494328, 'atr_min_pct': 0.013274969236794389, 'atr_max_pct': 0.09523832231472386, 'tp_mult': 2.3762943220324138, 'tsl_mult': 0.20136166095160665, 'strategy': 'breakout', 'time_stop': 66, 'use_sma': True, 'use_atr': False, 'use_adx': True, 'use_ema': True, 'use_spike': True, 'rsi_required': True, 'edge_k': 1.4852908065759325, 'edge_cap': 0.47901054236528373, 'bull_strategy': 'breakout', 'bull_bb_std_mult': 2.2603599576524296, 'bull_rsi_os': 6, 'bull_rsi_ob': 80, 'bull_adx_thresh': 6.546062137357423, 'bull_atr_min_pct': 0.004879110562806101, 'bull_atr_max_pct': 0.08984758862371817, 'bull_tp_mult': 1.536963195281357, 'bull_tsl_mult': 0.8429232355594197, 'bull_time_stop': 284, 'bull_use_sma': True, 'bull_use_ema': False, 'bull_use_atr': False, 'bull_use_adx': False, 'bull_use_spike': False, 'bull_rsi_required': True, 'bear_strategy': 'breakout', 'bear_bb_std_mult': 3.406590752862173, 'bear_rsi_os': 55, 'bear_rsi_ob': 83, 'bear_adx_thresh': 30.346269208801427, 'bear_atr_min_pct': 0.00585549897065212, 'bear_atr_max_pct': 0.1065320180900037, 'bear_tp_mult': 2.571791548416896, 'bear_tsl_mult': 0.4903592694711535, 'bear_time_stop': 31, 'bear_use_sma': False, 'bear_use_ema': True, 'bear_use_atr': False, 'bear_use_adx': False, 'bear_use_spike': True, 'bear_rsi_required': False, 'sideways_strategy': 'mean_reversion', 'sideways_bb_std_mult': 0.7420774220350368, 'sideways_rsi_os': 8, 'sideways_rsi_ob': 95, 'sideways_adx_thresh': 25.950124717059015, 'sideways_atr_min_pct': 0.01868941601441488, 'sideways_atr_max_pct': 0.03658556082935752, 'sideways_tp_mult': 2.963271709644734, 'sideways_tsl_mult': 0.7301034498642219, 'sideways_time_stop': 162, 'sideways_use_sma': False, 'sideways_use_ema': False, 'sideways_use_atr': False, 'sideways_use_adx': False, 'sideways_use_spike': False, 'sideways_rsi_required': False}.
[I 2025-08-31 11:10:15,144] Trial 588 finished with values: [-1000000000.0, 1000000000.0] and parameters: {'p_sma': 48, 'p_std': 29, 'p_atr': 11, 'p_adx': 15, 'rsi_period': 70, 'ema1': 25, 'ema2': 36, 'slip_atr_k': 0.038938369099849476, 'slip_spread_k': 0.6780863026297802, 'spread_hl_frac': 0.02857964484291963, 'bb_std_mult': 2.6694110702794616, 'rsi_os': 13, 'rsi_ob': 76, 'vol_spike': 0.2779137676572123, 'adx_thresh': 27.89913394435449, 'atr_min_pct': 0.011991687009668793, 'atr_max_pct': 0.026866230666836063, 'tp_mult': 2.8241656318196218, 'tsl_mult': 0.2784584898705352, 'strategy': 'breakout', 'time_stop': 65, 'use_sma': False, 'use_atr': False, 'use_adx': True, 'use_ema': True, 'use_spike': False, 'rsi_required': True, 'edge_k': 1.4808418787884994, 'edge_cap': 0.5192080077253995, 'bull_strategy': 'breakout', 'bull_bb_std_mult': 2.2691364210567526, 'bull_rsi_os': 48, 'bull_rsi_ob': 55, 'bull_adx_thresh': 6.38540708843484, 'bull_atr_min_pct': 0.0036637847915606814, 'bull_atr_max_pct': 0.09710861012769341, 'bull_tp_mult': 1.8937500444541255, 'bull_tsl_mult': 0.37555576584661454, 'bull_time_stop': 5, 'bull_use_sma': True, 'bull_use_ema': False, 'bull_use_atr': False, 'bull_use_adx': False, 'bull_use_spike': False, 'bull_rsi_required': True, 'bear_strategy': 'mean_reversion', 'bear_bb_std_mult': 3.412978322914737, 'bear_rsi_os': 5, 'bear_rsi_ob': 85, 'bear_adx_thresh': 5.871496060749253, 'bear_atr_min_pct': 0.01578607568644332, 'bear_atr_max_pct': 0.11082242298472884, 'bear_tp_mult': 1.69471391136489, 'bear_tsl_mult': 0.8643526516425062, 'bear_time_stop': 245, 'bear_use_sma': False, 'bear_use_ema': True, 'bear_use_atr': False, 'bear_use_adx': False, 'bear_use_spike': True, 'bear_rsi_required': False, 'sideways_strategy': 'mean_reversion', 'sideways_bb_std_mult': 1.8989449406003387, 'sideways_rsi_os': 8, 'sideways_rsi_ob': 57, 'sideways_adx_thresh': 26.001576202210508, 'sideways_atr_min_pct': 0.01628620470688589, 'sideways_atr_max_pct': 0.038338425391275834, 'sideways_tp_mult': 1.9746970390056164, 'sideways_tsl_mult': 0.03385888242782814, 'sideways_time_stop': 163, 'sideways_use_sma': False, 'sideways_use_ema': False, 'sideways_use_atr': False, 'sideways_use_adx': False, 'sideways_use_spike': False, 'sideways_rsi_required': True}.
[I 2025-08-31 11:10:15,158] Trial 585 finished with values: [-0.05240174424242505, 0.05200714393375732] and parameters: {'p_sma': 25, 'p_std': 29, 'p_atr': 11, 'p_adx': 13, 'rsi_period': 70, 'ema1': 12, 'ema2': 58, 'slip_atr_k': 0.2357951978400748, 'slip_spread_k': 0.6074279993301787, 'spread_hl_frac': 0.028488627549314763, 'bb_std_mult': 3.158956954051942, 'rsi_os': 25, 'rsi_ob': 59, 'vol_spike': 0.2623178201251704, 'adx_thresh': 28.848303219481014, 'atr_min_pct': 0.006327924840645501, 'atr_max_pct': 0.05723524182452029, 'tp_mult': 1.3525746310327125, 'tsl_mult': 0.9681467577323957, 'strategy': 'breakout', 'time_stop': 66, 'use_sma': False, 'use_atr': False, 'use_adx': True, 'use_ema': True, 'use_spike': False, 'rsi_required': True, 'edge_k': 0.9926874637007812, 'edge_cap': 0.4452478217149203, 'bull_strategy': 'breakout', 'bull_bb_std_mult': 0.7632044591642928, 'bull_rsi_os': 30, 'bull_rsi_ob': 62, 'bull_adx_thresh': 6.402145445042443, 'bull_atr_min_pct': 0.00435242422368986, 'bull_atr_max_pct': 0.08986957551014135, 'bull_tp_mult': 1.8929813086390057, 'bull_tsl_mult': 0.40957709885766075, 'bull_time_stop': 94, 'bull_use_sma': True, 'bull_use_ema': False, 'bull_use_atr': False, 'bull_use_adx': False, 'bull_use_spike': False, 'bull_rsi_required': True, 'bear_strategy': 'breakout', 'bear_bb_std_mult': 3.4015766564286203, 'bear_rsi_os': 42, 'bear_rsi_ob': 83, 'bear_adx_thresh': 7.178270487262645, 'bear_atr_min_pct': 0.004040581454737303, 'bear_atr_max_pct': 0.10444464819282889, 'bear_tp_mult': 2.8506874783880463, 'bear_tsl_mult': 0.9139184237103225, 'bear_time_stop': 120, 'bear_use_sma': False, 'bear_use_ema': True, 'bear_use_atr': False, 'bear_use_adx': False, 'bear_use_spike': True, 'bear_rsi_required': False, 'sideways_strategy': 'mean_reversion', 'sideways_bb_std_mult': 2.7819962895227093, 'sideways_rsi_os': 6, 'sideways_rsi_ob': 95, 'sideways_adx_thresh': 34.438428495569994, 'sideways_atr_min_pct': 0.01838941969941418, 'sideways_atr_max_pct': 0.035273383406988434, 'sideways_tp_mult': 2.5746458344482366, 'sideways_tsl_mult': 0.7347256324798654, 'sideways_time_stop': 41, 'sideways_use_sma': False, 'sideways_use_ema': False, 'sideways_use_atr': False, 'sideways_use_adx': False, 'sideways_use_spike': False, 'sideways_rsi_required': False}.
[I 2025-08-31 11:10:46,463] Trial 591 finished with values: [-1000000000.0, 1000000000.0] and parameters: {'p_sma': 9, 'p_std': 27, 'p_atr': 11, 'p_adx': 12, 'rsi_period': 21, 'ema1': 11, 'ema2': 54, 'slip_atr_k': 0.02647820134772097, 'slip_spread_k': 0.64416431338071, 'spread_hl_frac': 0.0018761240025641675, 'bb_std_mult': 1.4546627570324593, 'rsi_os': 25, 'rsi_ob': 70, 'vol_spike': 0.2928396035873349, 'adx_thresh': 32.76917946297385, 'atr_min_pct': 0.020390401383711804, 'atr_max_pct': 0.10369294924222214, 'tp_mult': 1.3273967836199394, 'tsl_mult': 0.33734726039392726, 'strategy': 'breakout', 'time_stop': 80, 'use_sma': False, 'use_atr': False, 'use_adx': True, 'use_ema': True, 'use_spike': True, 'rsi_required': True, 'edge_k': 0.721081438473256, 'edge_cap': 0.429536599140997, 'bull_strategy': 'breakout', 'bull_bb_std_mult': 1.6886841857832346, 'bull_rsi_os': 13, 'bull_rsi_ob': 73, 'bull_adx_thresh': 7.421324698177099, 'bull_atr_min_pct': 0.005332555674199732, 'bull_atr_max_pct': 0.09015282987231783, 'bull_tp_mult': 2.408770215657539, 'bull_tsl_mult': 0.12259698362522392, 'bull_time_stop': 94, 'bull_use_sma': True, 'bull_use_ema': True, 'bull_use_atr': False, 'bull_use_adx': True, 'bull_use_spike': False, 'bull_rsi_required': True, 'bear_strategy': 'breakout', 'bear_bb_std_mult': 2.027583849943249, 'bear_rsi_os': 41, 'bear_rsi_ob': 87, 'bear_adx_thresh': 27.98771080139252, 'bear_atr_min_pct': 0.01810558093533976, 'bear_atr_max_pct': 0.095308843499902, 'bear_tp_mult': 2.950980224853669, 'bear_tsl_mult': 0.8097326623897917, 'bear_time_stop': 68, 'bear_use_sma': False, 'bear_use_ema': True, 'bear_use_atr': False, 'bear_use_adx': False, 'bear_use_spike': True, 'bear_rsi_required': False, 'sideways_strategy': 'mean_reversion', 'sideways_bb_std_mult': 2.510091860989224, 'sideways_rsi_os': 33, 'sideways_rsi_ob': 46, 'sideways_adx_thresh': 24.795602068573043, 'sideways_atr_min_pct': 0.017452828682008485, 'sideways_atr_max_pct': 0.03338195847540571, 'sideways_tp_mult': 2.2591426747671117, 'sideways_tsl_mult': 0.13778237943362653, 'sideways_time_stop': 9, 'sideways_use_sma': False, 'sideways_use_ema': False, 'sideways_use_atr': True, 'sideways_use_adx': False, 'sideways_use_spike': False, 'sideways_rsi_required': True}.
[I 2025-08-31 11:10:46,990] Trial 592 finished with values: [-1000000000.0, 1000000000.0] and parameters: {'p_sma': 36, 'p_std': 27, 'p_atr': 10, 'p_adx': 14, 'rsi_period': 21, 'ema1': 13, 'ema2': 54, 'slip_atr_k': 0.2154775299819298, 'slip_spread_k': 0.7408201683168942, 'spread_hl_frac': 0.008212855739142658, 'bb_std_mult': 2.7418799715611173, 'rsi_os': 25, 'rsi_ob': 70, 'vol_spike': 0.2571841636548903, 'adx_thresh': 26.764423261119962, 'atr_min_pct': 0.004851080929710755, 'atr_max_pct': 0.033815225365156625, 'tp_mult': 1.4609668512421095, 'tsl_mult': 0.23398073427607008, 'strategy': 'breakout', 'time_stop': 81, 'use_sma': True, 'use_atr': False, 'use_adx': True, 'use_ema': True, 'use_spike': True, 'rsi_required': True, 'edge_k': 0.28649625682581903, 'edge_cap': 0.1125627646832491, 'bull_strategy': 'mean_reversion', 'bull_bb_std_mult': 1.248706853588284, 'bull_rsi_os': 13, 'bull_rsi_ob': 48, 'bull_adx_thresh': 7.40992503671611, 'bull_atr_min_pct': 0.002477117457955786, 'bull_atr_max_pct': 0.10212409953244611, 'bull_tp_mult': 2.8708763937543655, 'bull_tsl_mult': 0.39084491296264323, 'bull_time_stop': 47, 'bull_use_sma': False, 'bull_use_ema': True, 'bull_use_atr': False, 'bull_use_adx': True, 'bull_use_spike': True, 'bull_rsi_required': True, 'bear_strategy': 'mean_reversion', 'bear_bb_std_mult': 3.260627931025085, 'bear_rsi_os': 41, 'bear_rsi_ob': 79, 'bear_adx_thresh': 5.687689872928517, 'bear_atr_min_pct': 0.028702025006957975, 'bear_atr_max_pct': 0.09893067023764551, 'bear_tp_mult': 2.8891592569459816, 'bear_tsl_mult': 0.585696539419027, 'bear_time_stop': 68, 'bear_use_sma': True, 'bear_use_ema': True, 'bear_use_atr': False, 'bear_use_adx': False, 'bear_use_spike': True, 'bear_rsi_required': False, 'sideways_strategy': 'breakout', 'sideways_bb_std_mult': 2.696985714761843, 'sideways_rsi_os': 7, 'sideways_rsi_ob': 73, 'sideways_adx_thresh': 24.828321453003277, 'sideways_atr_min_pct': 0.008324967648973555, 'sideways_atr_max_pct': 0.0442953863250163, 'sideways_tp_mult': 1.3968020875544236, 'sideways_tsl_mult': 0.605866689298527, 'sideways_time_stop': 15, 'sideways_use_sma': False, 'sideways_use_ema': False, 'sideways_use_atr': True, 'sideways_use_adx': False, 'sideways_use_spike': False, 'sideways_rsi_required': True}.
[I 2025-08-31 11:10:47,152] Trial 590 finished with values: [-1000000000.0, 1000000000.0] and parameters: {'p_sma': 17, 'p_std': 28, 'p_atr': 11, 'p_adx': 15, 'rsi_period': 73, 'ema1': 26, 'ema2': 55, 'slip_atr_k': 0.03864160343029338, 'slip_spread_k': 0.7375636003999387, 'spread_hl_frac': 0.001854759438430352, 'bb_std_mult': 2.718747579137561, 'rsi_os': 25, 'rsi_ob': 79, 'vol_spike': 0.25562199684107917, 'adx_thresh': 28.887621852823084, 'atr_min_pct': 0.004789308859273456, 'atr_max_pct': 0.07279335415834494, 'tp_mult': 2.8166701649669257, 'tsl_mult': 0.2825867022487628, 'strategy': 'breakout', 'time_stop': 81, 'use_sma': False, 'use_atr': False, 'use_adx': True, 'use_ema': True, 'use_spike': True, 'rsi_required': True, 'edge_k': 0.14474133542111445, 'edge_cap': 0.5102612338809833, 'bull_strategy': 'breakout', 'bull_bb_std_mult': 0.8752679907493858, 'bull_rsi_os': 48, 'bull_rsi_ob': 73, 'bull_adx_thresh': 7.570512836716233, 'bull_atr_min_pct': 0.004124316415163741, 'bull_atr_max_pct': 0.10281912815679986, 'bull_tp_mult': 1.8888871978566306, 'bull_tsl_mult': 0.3907215512529013, 'bull_time_stop': 94, 'bull_use_sma': True, 'bull_use_ema': False, 'bull_use_atr': False, 'bull_use_adx': True, 'bull_use_spike': False, 'bull_rsi_required': True, 'bear_strategy': 'mean_reversion', 'bear_bb_std_mult': 2.962388541115375, 'bear_rsi_os': 52, 'bear_rsi_ob': 47, 'bear_adx_thresh': 6.1405145800145124, 'bear_atr_min_pct': 0.005429986412582839, 'bear_atr_max_pct': 0.11042647460554858, 'bear_tp_mult': 2.938789751189646, 'bear_tsl_mult': 0.7974690559225925, 'bear_time_stop': 110, 'bear_use_sma': False, 'bear_use_ema': True, 'bear_use_atr': False, 'bear_use_adx': False, 'bear_use_spike': True, 'bear_rsi_required': False, 'sideways_strategy': 'mean_reversion', 'sideways_bb_std_mult': 2.7157289572559753, 'sideways_rsi_os': 6, 'sideways_rsi_ob': 60, 'sideways_adx_thresh': 25.00360032306026, 'sideways_atr_min_pct': 0.019656240107893092, 'sideways_atr_max_pct': 0.04397437630929521, 'sideways_tp_mult': 2.571212536083947, 'sideways_tsl_mult': 0.13735163384156604, 'sideways_time_stop': 87, 'sideways_use_sma': False, 'sideways_use_ema': False, 'sideways_use_atr': False, 'sideways_use_adx': False, 'sideways_use_spike': False, 'sideways_rsi_required': True}.
[I 2025-08-31 11:10:47,165] Trial 589 finished with values: [-1000000000.0, 1000000000.0] and parameters: {'p_sma': 9, 'p_std': 29, 'p_atr': 11, 'p_adx': 11, 'rsi_period': 44, 'ema1': 26, 'ema2': 53, 'slip_atr_k': 0.019067467996749427, 'slip_spread_k': 0.5960367929778212, 'spread_hl_frac': 0.028374469827697216, 'bb_std_mult': 2.724591541719496, 'rsi_os': 26, 'rsi_ob': 56, 'vol_spike': 0.2790328943554688, 'adx_thresh': 10.88960109350479, 'atr_min_pct': 0.016449415182514974, 'atr_max_pct': 0.09502143252727804, 'tp_mult': 1.4602927679980175, 'tsl_mult': 0.9752732805712028, 'strategy': 'breakout', 'time_stop': 64, 'use_sma': False, 'use_atr': False, 'use_adx': True, 'use_ema': True, 'use_spike': True, 'rsi_required': True, 'edge_k': 0.14570940466219057, 'edge_cap': 0.10522700792142364, 'bull_strategy': 'breakout', 'bull_bb_std_mult': 1.270494508090784, 'bull_rsi_os': 6, 'bull_rsi_ob': 73, 'bull_adx_thresh': 6.150765338930382, 'bull_atr_min_pct': 0.005149279418875136, 'bull_atr_max_pct': 0.08999865592201788, 'bull_tp_mult': 1.8974336590022811, 'bull_tsl_mult': 0.3835190367800669, 'bull_time_stop': 102, 'bull_use_sma': True, 'bull_use_ema': False, 'bull_use_atr': False, 'bull_use_adx': True, 'bull_use_spike': False, 'bull_rsi_required': True, 'bear_strategy': 'mean_reversion', 'bear_bb_std_mult': 2.953275118753878, 'bear_rsi_os': 41, 'bear_rsi_ob': 85, 'bear_adx_thresh': 22.48402951461062, 'bear_atr_min_pct': 0.005599437349277703, 'bear_atr_max_pct': 0.11081601261213651, 'bear_tp_mult': 2.5829449129945914, 'bear_tsl_mult': 0.8666117434364367, 'bear_time_stop': 33, 'bear_use_sma': False, 'bear_use_ema': True, 'bear_use_atr': False, 'bear_use_adx': False, 'bear_use_spike': True, 'bear_rsi_required': False, 'sideways_strategy': 'mean_reversion', 'sideways_bb_std_mult': 2.504241024906309, 'sideways_rsi_os': 8, 'sideways_rsi_ob': 57, 'sideways_adx_thresh': 34.98400667361899, 'sideways_atr_min_pct': 0.01751188539481278, 'sideways_atr_max_pct': 0.03889555835621928, 'sideways_tp_mult': 2.2604596472925786, 'sideways_tsl_mult': 0.03304471134907494, 'sideways_time_stop': 87, 'sideways_use_sma': False, 'sideways_use_ema': False, 'sideways_use_atr': False, 'sideways_use_adx': False, 'sideways_use_spike': False, 'sideways_rsi_required': True}.
[I 2025-08-31 11:11:19,690] Trial 595 finished with values: [-1000000000.0, 1000000000.0] and parameters: {'p_sma': 28, 'p_std': 28, 'p_atr': 12, 'p_adx': 14, 'rsi_period': 51, 'ema1': 29, 'ema2': 60, 'slip_atr_k': 0.24494189669232674, 'slip_spread_k': 0.14585096715767953, 'spread_hl_frac': 0.011001837083890856, 'bb_std_mult': 1.5862871781760766, 'rsi_os': 26, 'rsi_ob': 78, 'vol_spike': 0.2844503892226405, 'adx_thresh': 28.279678207360455, 'atr_min_pct': 0.007103438669412442, 'atr_max_pct': 0.09629768310035366, 'tp_mult': 2.4052236207199464, 'tsl_mult': 0.26242262621014145, 'strategy': 'breakout', 'time_stop': 73, 'use_sma': True, 'use_atr': True, 'use_adx': False, 'use_ema': True, 'use_spike': True, 'rsi_required': False, 'edge_k': 0.2357354279789674, 'edge_cap': 0.46485485379216673, 'bull_strategy': 'breakout', 'bull_bb_std_mult': 0.5675044426240774, 'bull_rsi_os': 54, 'bull_rsi_ob': 75, 'bull_adx_thresh': 11.931706560560466, 'bull_atr_min_pct': 0.004959202878383083, 'bull_atr_max_pct': 0.09589790922259345, 'bull_tp_mult': 1.4312040824353278, 'bull_tsl_mult': 0.6481938209496398, 'bull_time_stop': 126, 'bull_use_sma': False, 'bull_use_ema': False, 'bull_use_atr': True, 'bull_use_adx': False, 'bull_use_spike': False, 'bull_rsi_required': True, 'bear_strategy': 'breakout', 'bear_bb_std_mult': 1.8299325513053537, 'bear_rsi_os': 19, 'bear_rsi_ob': 78, 'bear_adx_thresh': 22.558225574689004, 'bear_atr_min_pct': 0.004902889532301763, 'bear_atr_max_pct': 0.1197968444890951, 'bear_tp_mult': 2.6495723355524357, 'bear_tsl_mult': 0.5172454895220336, 'bear_time_stop': 261, 'bear_use_sma': False, 'bear_use_ema': False, 'bear_use_atr': True, 'bear_use_adx': False, 'bear_use_spike': True, 'bear_rsi_required': True, 'sideways_strategy': 'mean_reversion', 'sideways_bb_std_mult': 1.6138557246808711, 'sideways_rsi_os': 39, 'sideways_rsi_ob': 51, 'sideways_adx_thresh': 7.201791762543554, 'sideways_atr_min_pct': 0.02818971380337707, 'sideways_atr_max_pct': 0.0320817171821375, 'sideways_tp_mult': 1.6189609327842036, 'sideways_tsl_mult': 0.7952161997006439, 'sideways_time_stop': 32, 'sideways_use_sma': False, 'sideways_use_ema': True, 'sideways_use_atr': False, 'sideways_use_adx': True, 'sideways_use_spike': True, 'sideways_rsi_required': True}.
