[I 2025-08-31 11:38:41,599] Trial 793 finished with values: [-1000000000.0, 1000000000.0] and parameters: {'p_sma': 39, 'p_std': 29, 'p_atr': 21, 'p_adx': 13, 'rsi_period': 55, 'ema1': 12, 'ema2': 40, 'slip_atr_k': 0.03159972932275945, 'slip_spread_k': 0.17427009474820104, 'spread_hl_frac': 0.0032637754776209983, 'bb_std_mult': 2.9335151952833134, 'rsi_os': 29, 'rsi_ob': 91, 'vol_spike': 0.048003262252070925, 'adx_thresh': 31.53983479243813, 'atr_min_pct': 0.013759783627881848, 'atr_max_pct': 0.1445174447436532, 'tp_mult': 1.6787372784851162, 'tsl_mult': 0.10402632052467531, 'strategy': 'breakout', 'time_stop': 204, 'use_sma': False, 'use_atr': True, 'use_adx': False, 'use_ema': True, 'use_spike': True, 'rsi_required': False, 'edge_k': 1.9608895993550588, 'edge_cap': 0.5046775869680841, 'bull_strategy': 'mean_reversion', 'bull_bb_std_mult': 0.7482663210125216, 'bull_rsi_os': 14, 'bull_rsi_ob': 84, 'bull_adx_thresh': 5.434572526347871, 'bull_atr_min_pct': 0.02643512066630338, 'bull_atr_max_pct': 0.10354583218925031, 'bull_tp_mult': 2.9483597796760663, 'bull_tsl_mult': 0.9566112875055885, 'bull_time_stop': 290, 'bull_use_sma': False, 'bull_use_ema': True, 'bull_use_atr': True, 'bull_use_adx': False, 'bull_use_spike': True, 'bull_rsi_required': True, 'bear_strategy': 'breakout', 'bear_bb_std_mult': 3.0779880921242433, 'bear_rsi_os': 54, 'bear_rsi_ob': 75, 'bear_adx_thresh': 22.280121838897166, 'bear_atr_min_pct': 0.009421089961447332, 'bear_atr_max_pct': 0.1410425957534672, 'bear_tp_mult': 2.8367147377667736, 'bear_tsl_mult': 0.6453989193222754, 'bear_time_stop': 288, 'bear_use_sma': True, 'bear_use_ema': True, 'bear_use_atr': True, 'bear_use_adx': False, 'bear_use_spike': False, 'bear_rsi_required': True, 'sideways_strategy': 'breakout', 'sideways_bb_std_mult': 1.4565918646347438, 'sideways_rsi_os': 27, 'sideways_rsi_ob': 95, 'sideways_adx_thresh': 15.64731892639104, 'sideways_atr_min_pct': 0.011573588808154251, 'sideways_atr_max_pct': 0.042691657603260005, 'sideways_tp_mult': 1.9226032778233382, 'sideways_tsl_mult': 0.36591856532473505, 'sideways_time_stop': 16, 'sideways_use_sma': False, 'sideways_use_ema': False, 'sideways_use_atr': True, 'sideways_use_adx': False, 'sideways_use_spike': True, 'sideways_rsi_required': True}.
[I 2025-08-31 11:38:41,984] Trial 791 finished with values: [-1000000000.0, 1000000000.0] and parameters: {'p_sma': 13, 'p_std': 28, 'p_atr': 15, 'p_adx': 14, 'rsi_period': 51, 'ema1': 12, 'ema2': 42, 'slip_atr_k': 0.031898375797076495, 'slip_spread_k': 0.16586247397772805, 'spread_hl_frac': 0.0028263587532047843, 'bb_std_mult': 1.8994467983134526, 'rsi_os': 34, 'rsi_ob': 91, 'vol_spike': 0.2747295309892638, 'adx_thresh': 31.446472386090953, 'atr_min_pct': 0.011108772368781017, 'atr_max_pct': 0.14475268702272454, 'tp_mult': 1.6799785792835555, 'tsl_mult': 0.10155604540450108, 'strategy': 'breakout', 'time_stop': 200, 'use_sma': True, 'use_atr': False, 'use_adx': True, 'use_ema': True, 'use_spike': True, 'rsi_required': False, 'edge_k': 1.924803801975431, 'edge_cap': 0.5046532612758147, 'bull_strategy': 'mean_reversion', 'bull_bb_std_mult': 0.7660232642056798, 'bull_rsi_os': 55, 'bull_rsi_ob': 81, 'bull_adx_thresh': 28.096977368601856, 'bull_atr_min_pct': 0.005385198384927531, 'bull_atr_max_pct': 0.021681885922842932, 'bull_tp_mult': 1.7734677094344267, 'bull_tsl_mult': 0.8920935440856003, 'bull_time_stop': 284, 'bull_use_sma': False, 'bull_use_ema': True, 'bull_use_atr': False, 'bull_use_adx': False, 'bull_use_spike': False, 'bull_rsi_required': True, 'bear_strategy': 'breakout', 'bear_bb_std_mult': 3.215163298480196, 'bear_rsi_os': 54, 'bear_rsi_ob': 74, 'bear_adx_thresh': 17.174128388701163, 'bear_atr_min_pct': 0.017346003025797484, 'bear_atr_max_pct': 0.13485628244442996, 'bear_tp_mult': 1.1919956133441327, 'bear_tsl_mult': 0.7544816872905232, 'bear_time_stop': 206, 'bear_use_sma': True, 'bear_use_ema': True, 'bear_use_atr': False, 'bear_use_adx': False, 'bear_use_spike': False, 'bear_rsi_required': False, 'sideways_strategy': 'breakout', 'sideways_bb_std_mult': 0.6317881444155902, 'sideways_rsi_os': 22, 'sideways_rsi_ob': 95, 'sideways_adx_thresh': 13.94842918174901, 'sideways_atr_min_pct': 0.016075242368660068, 'sideways_atr_max_pct': 0.1426059161550341, 'sideways_tp_mult': 2.019766593334283, 'sideways_tsl_mult': 0.361218093178208, 'sideways_time_stop': 11, 'sideways_use_sma': False, 'sideways_use_ema': False, 'sideways_use_atr': True, 'sideways_use_adx': False, 'sideways_use_spike': True, 'sideways_rsi_required': True}.
[I 2025-08-31 11:39:24,319] Trial 794 finished with values: [-1000000000.0, 1000000000.0] and parameters: {'p_sma': 15, 'p_std': 27, 'p_atr': 15, 'p_adx': 13, 'rsi_period': 68, 'ema1': 10, 'ema2': 40, 'slip_atr_k': 0.2096893338797629, 'slip_spread_k': 0.1732588039072281, 'spread_hl_frac': 0.008414161234452254, 'bb_std_mult': 2.9171649787045397, 'rsi_os': 28, 'rsi_ob': 91, 'vol_spike': 0.04783877619098169, 'adx_thresh': 31.327817118028886, 'atr_min_pct': 0.011614090184316419, 'atr_max_pct': 0.14385351817506653, 'tp_mult': 1.6804185094189004, 'tsl_mult': 0.09220657858845938, 'strategy': 'breakout', 'time_stop': 207, 'use_sma': False, 'use_atr': True, 'use_adx': False, 'use_ema': True, 'use_spike': True, 'rsi_required': False, 'edge_k': 0.44244274286731927, 'edge_cap': 0.3316906478059801, 'bull_strategy': 'mean_reversion', 'bull_bb_std_mult': 3.1456020314642794, 'bull_rsi_os': 49, 'bull_rsi_ob': 84, 'bull_adx_thresh': 27.067931485044653, 'bull_atr_min_pct': 0.004137071658725765, 'bull_atr_max_pct': 0.05997600562572748, 'bull_tp_mult': 1.87848993316845, 'bull_tsl_mult': 0.20845413474702584, 'bull_time_stop': 270, 'bull_use_sma': False, 'bull_use_ema': True, 'bull_use_atr': True, 'bull_use_adx': False, 'bull_use_spike': True, 'bull_rsi_required': True, 'bear_strategy': 'breakout', 'bear_bb_std_mult': 2.9239242642120558, 'bear_rsi_os': 52, 'bear_rsi_ob': 72, 'bear_adx_thresh': 6.5088734388311105, 'bear_atr_min_pct': 0.015644779602668274, 'bear_atr_max_pct': 0.14231542834984848, 'bear_tp_mult': 2.708510225371887, 'bear_tsl_mult': 0.7286483978013757, 'bear_time_stop': 72, 'bear_use_sma': True, 'bear_use_ema': True, 'bear_use_atr': True, 'bear_use_adx': False, 'bear_use_spike': False, 'bear_rsi_required': True, 'sideways_strategy': 'breakout', 'sideways_bb_std_mult': 1.452183791184185, 'sideways_rsi_os': 26, 'sideways_rsi_ob': 95, 'sideways_adx_thresh': 13.839358986314009, 'sideways_atr_min_pct': 0.01169770944375952, 'sideways_atr_max_pct': 0.06282431283868273, 'sideways_tp_mult': 1.9254965915204494, 'sideways_tsl_mult': 0.3836709876263395, 'sideways_time_stop': 11, 'sideways_use_sma': False, 'sideways_use_ema': False, 'sideways_use_atr': True, 'sideways_use_adx': False, 'sideways_use_spike': True, 'sideways_rsi_required': True}.
[I 2025-08-31 11:39:24,752] Trial 796 finished with values: [-1000000000.0, 1000000000.0] and parameters: {'p_sma': 12, 'p_std': 27, 'p_atr': 13, 'p_adx': 15, 'rsi_period': 81, 'ema1': 12, 'ema2': 42, 'slip_atr_k': 0.021645116497770883, 'slip_spread_k': 0.20248357532054612, 'spread_hl_frac': 0.006196966524219168, 'bb_std_mult': 2.7083686350037093, 'rsi_os': 27, 'rsi_ob': 92, 'vol_spike': 0.10215568815303386, 'adx_thresh': 34.55263062243539, 'atr_min_pct': 0.012742340854510195, 'atr_max_pct': 0.14976312813081846, 'tp_mult': 1.6014058741428296, 'tsl_mult': 0.05993567508566503, 'strategy': 'breakout', 'time_stop': 200, 'use_sma': True, 'use_atr': False, 'use_adx': True, 'use_ema': True, 'use_spike': False, 'rsi_required': False, 'edge_k': 0.7131534665461853, 'edge_cap': 0.08889305487442029, 'bull_strategy': 'breakout', 'bull_bb_std_mult': 2.826388062252428, 'bull_rsi_os': 55, 'bull_rsi_ob': 82, 'bull_adx_thresh': 31.858252850559477, 'bull_atr_min_pct': 0.016168026120338023, 'bull_atr_max_pct': 0.02129970549255452, 'bull_tp_mult': 1.8682646367631786, 'bull_tsl_mult': 0.4021923815352535, 'bull_time_stop': 292, 'bull_use_sma': False, 'bull_use_ema': True, 'bull_use_atr': True, 'bull_use_adx': True, 'bull_use_spike': False, 'bull_rsi_required': True, 'bear_strategy': 'breakout', 'bear_bb_std_mult': 2.919592928244047, 'bear_rsi_os': 52, 'bear_rsi_ob': 77, 'bear_adx_thresh': 12.481412108071925, 'bear_atr_min_pct': 0.019469410077181445, 'bear_atr_max_pct': 0.01185044022743667, 'bear_tp_mult': 2.8933986255241813, 'bear_tsl_mult': 0.7444841156507507, 'bear_time_stop': 31, 'bear_use_sma': False, 'bear_use_ema': True, 'bear_use_atr': True, 'bear_use_adx': False, 'bear_use_spike': False, 'bear_rsi_required': False, 'sideways_strategy': 'breakout', 'sideways_bb_std_mult': 3.373928715414531, 'sideways_rsi_os': 26, 'sideways_rsi_ob': 45, 'sideways_adx_thresh': 13.454149197591095, 'sideways_atr_min_pct': 0.016480624690796652, 'sideways_atr_max_pct': 0.09256519789880577, 'sideways_tp_mult': 1.9542020680175665, 'sideways_tsl_mult': 0.38387847589511864, 'sideways_time_stop': 270, 'sideways_use_sma': False, 'sideways_use_ema': False, 'sideways_use_atr': True, 'sideways_use_adx': False, 'sideways_use_spike': True, 'sideways_rsi_required': True}.
[I 2025-08-31 11:39:24,764] Trial 795 finished with values: [-1000000000.0, 1000000000.0] and parameters: {'p_sma': 15, 'p_std': 27, 'p_atr': 10, 'p_adx': 13, 'rsi_period': 50, 'ema1': 18, 'ema2': 42, 'slip_atr_k': 0.22555106676512238, 'slip_spread_k': 0.1729275900092374, 'spread_hl_frac': 0.034209260559206145, 'bb_std_mult': 2.9186501807731937, 'rsi_os': 28, 'rsi_ob': 92, 'vol_spike': 0.10960427214597546, 'adx_thresh': 31.598852041339168, 'atr_min_pct': 0.01345807703419298, 'atr_max_pct': 0.14770940256094928, 'tp_mult': 1.6588893531236313, 'tsl_mult': 0.07430945636574214, 'strategy': 'breakout', 'time_stop': 200, 'use_sma': True, 'use_atr': True, 'use_adx': False, 'use_ema': True, 'use_spike': True, 'rsi_required': False, 'edge_k': 1.625139849084641, 'edge_cap': 0.08808272311828186, 'bull_strategy': 'mean_reversion', 'bull_bb_std_mult': 0.6942533152605778, 'bull_rsi_os': 11, 'bull_rsi_ob': 84, 'bull_adx_thresh': 5.474445667092748, 'bull_atr_min_pct': 0.004120329965666482, 'bull_atr_max_pct': 0.10283240132219601, 'bull_tp_mult': 1.872790317170774, 'bull_tsl_mult': 0.43757143505092194, 'bull_time_stop': 290, 'bull_use_sma': False, 'bull_use_ema': True, 'bull_use_atr': True, 'bull_use_adx': False, 'bull_use_spike': False, 'bull_rsi_required': True, 'bear_strategy': 'breakout', 'bear_bb_std_mult': 2.9399086140023405, 'bear_rsi_os': 53, 'bear_rsi_ob': 72, 'bear_adx_thresh': 6.701778665025145, 'bear_atr_min_pct': 0.01042977416887593, 'bear_atr_max_pct': 0.1416908168963685, 'bear_tp_mult': 2.891972620072413, 'bear_tsl_mult': 0.7422005689821758, 'bear_time_stop': 88, 'bear_use_sma': True, 'bear_use_ema': True, 'bear_use_atr': True, 'bear_use_adx': False, 'bear_use_spike': False, 'bear_rsi_required': True, 'sideways_strategy': 'breakout', 'sideways_bb_std_mult': 1.0858062733737674, 'sideways_rsi_os': 26, 'sideways_rsi_ob': 45, 'sideways_adx_thresh': 15.440950549858709, 'sideways_atr_min_pct': 0.01644849447215884, 'sideways_atr_max_pct': 0.14234438568097418, 'sideways_tp_mult': 1.9266494578756723, 'sideways_tsl_mult': 0.382133024389302, 'sideways_time_stop': 12, 'sideways_use_sma': False, 'sideways_use_ema': False, 'sideways_use_atr': True, 'sideways_use_adx': False, 'sideways_use_spike': True, 'sideways_rsi_required': True}.
[I 2025-08-31 11:39:25,184] Trial 797 finished with values: [-1000000000.0, 1000000000.0] and parameters: {'p_sma': 54, 'p_std': 27, 'p_atr': 12, 'p_adx': 25, 'rsi_period': 50, 'ema1': 26, 'ema2': 44, 'slip_atr_k': 0.21026426550008134, 'slip_spread_k': 0.1280817570053177, 'spread_hl_frac': 0.008191937466960229, 'bb_std_mult': 2.811055552569514, 'rsi_os': 27, 'rsi_ob': 92, 'vol_spike': 0.27313065810823683, 'adx_thresh': 34.440825303434764, 'atr_min_pct': 0.0094400722478745, 'atr_max_pct': 0.14983453347864062, 'tp_mult': 1.6102044804190847, 'tsl_mult': 0.06451401447194328, 'strategy': 'breakout', 'time_stop': 217, 'use_sma': True, 'use_atr': True, 'use_adx': False, 'use_ema': False, 'use_spike': False, 'rsi_required': False, 'edge_k': 0.5107332130866916, 'edge_cap': 0.09348598867522667, 'bull_strategy': 'breakout', 'bull_bb_std_mult': 2.678681731033998, 'bull_rsi_os': 10, 'bull_rsi_ob': 82, 'bull_adx_thresh': 5.98812408865931, 'bull_atr_min_pct': 0.004134720783742283, 'bull_atr_max_pct': 0.06071824250733715, 'bull_tp_mult': 1.8272053988441526, 'bull_tsl_mult': 0.43529509852682735, 'bull_time_stop': 292, 'bull_use_sma': False, 'bull_use_ema': True, 'bull_use_atr': True, 'bull_use_adx': True, 'bull_use_spike': False, 'bull_rsi_required': False, 'bear_strategy': 'breakout', 'bear_bb_std_mult': 2.924519566491825, 'bear_rsi_os': 52, 'bear_rsi_ob': 72, 'bear_adx_thresh': 6.629667092607298, 'bear_atr_min_pct': 0.010496588628222432, 'bear_atr_max_pct': 0.14252652586321737, 'bear_tp_mult': 1.2537995099722452, 'bear_tsl_mult': 0.7216884168537564, 'bear_time_stop': 30, 'bear_use_sma': False, 'bear_use_ema': True, 'bear_use_atr': True, 'bear_use_adx': True, 'bear_use_spike': False, 'bear_rsi_required': False, 'sideways_strategy': 'breakout', 'sideways_bb_std_mult': 2.1158932080690365, 'sideways_rsi_os': 25, 'sideways_rsi_ob': 93, 'sideways_adx_thresh': 7.245684622849023, 'sideways_atr_min_pct': 0.017543194145511552, 'sideways_atr_max_pct': 0.03946699688977261, 'sideways_tp_mult': 1.9650708196537179, 'sideways_tsl_mult': 0.2998724676199781, 'sideways_time_stop': 197, 'sideways_use_sma': False, 'sideways_use_ema': True, 'sideways_use_atr': True, 'sideways_use_adx': False, 'sideways_use_spike': True, 'sideways_rsi_required': True}.
[I 2025-08-31 11:40:01,462] Trial 798 finished with values: [-0.014940293351849876, 0.015145668723500998] and parameters: {'p_sma': 33, 'p_std': 26, 'p_atr': 11, 'p_adx': 28, 'rsi_period': 59, 'ema1': 25, 'ema2': 44, 'slip_atr_k': 0.024516061068255345, 'slip_spread_k': 0.1278407563634475, 'spread_hl_frac': 0.032933681619818675, 'bb_std_mult': 2.829069308617823, 'rsi_os': 27, 'rsi_ob': 89, 'vol_spike': 0.2681008159692117, 'adx_thresh': 32.35760647089456, 'atr_min_pct': 0.012232511260565807, 'atr_max_pct': 0.14991135021077884, 'tp_mult': 1.6183213316989224, 'tsl_mult': 0.00042942450066894844, 'strategy': 'mean_reversion', 'time_stop': 214, 'use_sma': True, 'use_atr': False, 'use_adx': True, 'use_ema': False, 'use_spike': False, 'rsi_required': False, 'edge_k': 0.27729458826681813, 'edge_cap': 0.48361569421249734, 'bull_strategy': 'breakout', 'bull_bb_std_mult': 0.6586376027029373, 'bull_rsi_os': 45, 'bull_rsi_ob': 82, 'bull_adx_thresh': 5.020766237400718, 'bull_atr_min_pct': 0.0021561515992708537, 'bull_atr_max_pct': 0.09920084967866055, 'bull_tp_mult': 1.835676373905284, 'bull_tsl_mult': 0.3887332698055038, 'bull_time_stop': 274, 'bull_use_sma': False, 'bull_use_ema': True, 'bull_use_atr': False, 'bull_use_adx': True, 'bull_use_spike': False, 'bull_rsi_required': False, 'bear_strategy': 'mean_reversion', 'bear_bb_std_mult': 3.015525911359111, 'bear_rsi_os': 49, 'bear_rsi_ob': 74, 'bear_adx_thresh': 5.959659503026387, 'bear_atr_min_pct': 0.029967062615482126, 'bear_atr_max_pct': 0.13442099359371207, 'bear_tp_mult': 2.794149428839377, 'bear_tsl_mult': 0.7102442510315468, 'bear_time_stop': 33, 'bear_use_sma': False, 'bear_use_ema': False, 'bear_use_atr': False, 'bear_use_adx': True, 'bear_use_spike': False, 'bear_rsi_required': False, 'sideways_strategy': 'breakout', 'sideways_bb_std_mult': 2.7867375793376277, 'sideways_rsi_os': 24, 'sideways_rsi_ob': 50, 'sideways_adx_thresh': 12.624527096685245, 'sideways_atr_min_pct': 0.01747511719358181, 'sideways_atr_max_pct': 0.03755068362938378, 'sideways_tp_mult': 1.968690192967788, 'sideways_tsl_mult': 0.33924580157281314, 'sideways_time_stop': 5, 'sideways_use_sma': True, 'sideways_use_ema': True, 'sideways_use_atr': True, 'sideways_use_adx': False, 'sideways_use_spike': True, 'sideways_rsi_required': True}.
[I 2025-08-31 11:40:01,939] Trial 799 finished with values: [-1000000000.0, 1000000000.0] and parameters: {'p_sma': 45, 'p_std': 26, 'p_atr': 11, 'p_adx': 15, 'rsi_period': 60, 'ema1': 12, 'ema2': 44, 'slip_atr_k': 0.023035044634426544, 'slip_spread_k': 0.127946710103464, 'spread_hl_frac': 0.008308931705174306, 'bb_std_mult': 2.8248209052168063, 'rsi_os': 43, 'rsi_ob': 89, 'vol_spike': 0.2738806348516505, 'adx_thresh': 32.49466744033672, 'atr_min_pct': 0.012304090252653365, 'atr_max_pct': 0.14737141175543234, 'tp_mult': 1.6248607939829933, 'tsl_mult': 0.06563081820008332, 'strategy': 'mean_reversion', 'time_stop': 217, 'use_sma': True, 'use_atr': False, 'use_adx': True, 'use_ema': False, 'use_spike': False, 'rsi_required': False, 'edge_k': 1.0697223989668874, 'edge_cap': 0.48481395308091113, 'bull_strategy': 'breakout', 'bull_bb_std_mult': 2.7010296785648267, 'bull_rsi_os': 45, 'bull_rsi_ob': 82, 'bull_adx_thresh': 6.054235740951715, 'bull_atr_min_pct': 0.0033490393556533764, 'bull_atr_max_pct': 0.04223526547008749, 'bull_tp_mult': 1.8266453726564558, 'bull_tsl_mult': 0.38927620860301276, 'bull_time_stop': 275, 'bull_use_sma': False, 'bull_use_ema': True, 'bull_use_atr': False, 'bull_use_adx': True, 'bull_use_spike': False, 'bull_rsi_required': False, 'bear_strategy': 'mean_reversion', 'bear_bb_std_mult': 3.0010850884604325, 'bear_rsi_os': 50, 'bear_rsi_ob': 74, 'bear_adx_thresh': 9.60125328013786, 'bear_atr_min_pct': 0.004148478052472367, 'bear_atr_max_pct': 0.1381759590528317, 'bear_tp_mult': 2.795392607739763, 'bear_tsl_mult': 0.7120810689938152, 'bear_time_stop': 49, 'bear_use_sma': False, 'bear_use_ema': False, 'bear_use_atr': False, 'bear_use_adx': True, 'bear_use_spike': False, 'bear_rsi_required': False, 'sideways_strategy': 'breakout', 'sideways_bb_std_mult': 0.8416678093353107, 'sideways_rsi_os': 25, 'sideways_rsi_ob': 93, 'sideways_adx_thresh': 7.254629210588774, 'sideways_atr_min_pct': 0.028603890548457574, 'sideways_atr_max_pct': 0.03651264654552307, 'sideways_tp_mult': 1.974191885510125, 'sideways_tsl_mult': 0.3009512767512915, 'sideways_time_stop': 176, 'sideways_use_sma': True, 'sideways_use_ema': True, 'sideways_use_atr': True, 'sideways_use_adx': False, 'sideways_use_spike': True, 'sideways_rsi_required': True}.
[I 2025-08-31 11:40:02,083] Trial 801 finished with values: [-0.013602134478198913, 0.013432814948359212] and parameters: {'p_sma': 14, 'p_std': 26, 'p_atr': 11, 'p_adx': 15, 'rsi_period': 59, 'ema1': 11, 'ema2': 43, 'slip_atr_k': 0.022673833947710997, 'slip_spread_k': 0.20092010608780725, 'spread_hl_frac': 0.0061749814020087895, 'bb_std_mult': 2.8082612958111812, 'rsi_os': 49, 'rsi_ob': 92, 'vol_spike': 0.2874885315031408, 'adx_thresh': 32.23841165568561, 'atr_min_pct': 0.012106958829618172, 'atr_max_pct': 0.13823749453492898, 'tp_mult': 1.7337546848479672, 'tsl_mult': 0.02326294690544689, 'strategy': 'mean_reversion', 'time_stop': 211, 'use_sma': True, 'use_atr': False, 'use_adx': True, 'use_ema': False, 'use_spike': True, 'rsi_required': False, 'edge_k': 1.0017598829734542, 'edge_cap': 0.4869052383944993, 'bull_strategy': 'breakout', 'bull_bb_std_mult': 0.6413682720631418, 'bull_rsi_os': 12, 'bull_rsi_ob': 86, 'bull_adx_thresh': 5.041395745978955, 'bull_atr_min_pct': 0.0021026952135024795, 'bull_atr_max_pct': 0.09574204016799233, 'bull_tp_mult': 2.656064984031905, 'bull_tsl_mult': 0.4063486546115502, 'bull_time_stop': 274, 'bull_use_sma': False, 'bull_use_ema': True, 'bull_use_atr': False, 'bull_use_adx': False, 'bull_use_spike': False, 'bull_rsi_required': False, 'bear_strategy': 'mean_reversion', 'bear_bb_std_mult': 2.991795189768649, 'bear_rsi_os': 50, 'bear_rsi_ob': 75, 'bear_adx_thresh': 19.48658750541732, 'bear_atr_min_pct': 0.004225454160605718, 'bear_atr_max_pct': 0.06598568469893244, 'bear_tp_mult': 2.8025221303634615, 'bear_tsl_mult': 0.7133981939076703, 'bear_time_stop': 270, 'bear_use_sma': False, 'bear_use_ema': False, 'bear_use_atr': False, 'bear_use_adx': True, 'bear_use_spike': False, 'bear_rsi_required': False, 'sideways_strategy': 'breakout', 'sideways_bb_std_mult': 2.823342645553399, 'sideways_rsi_os': 25, 'sideways_rsi_ob': 60, 'sideways_adx_thresh': 11.159120642849427, 'sideways_atr_min_pct': 0.017156339618605417, 'sideways_atr_max_pct': 0.03573480707287883, 'sideways_tp_mult': 2.160624822176744, 'sideways_tsl_mult': 0.3407380978456619, 'sideways_time_stop': 176, 'sideways_use_sma': True, 'sideways_use_ema': True, 'sideways_use_atr': True, 'sideways_use_adx': False, 'sideways_use_spike': True, 'sideways_rsi_required': True}.
