[I 2025-08-31 10:46:53,328] Trial 406 finished with values: [-1000000000.0, 1000000000.0] and parameters: {'p_sma': 48, 'p_std': 46, 'p_atr': 12, 'p_adx': 26, 'rsi_period': 30, 'ema1': 12, 'ema2': 55, 'slip_atr_k': 0.08545028516874237, 'slip_spread_k': 0.10843459584620785, 'spread_hl_frac': 0.03500383505121311, 'bb_std_mult': 2.7127747689710464, 'rsi_os': 29, 'rsi_ob': 67, 'vol_spike': 0.2676376306267992, 'adx_thresh': 15.639655296817418, 'atr_min_pct': 0.0087789650063186, 'atr_max_pct': 0.09492124817671983, 'tp_mult': 1.4069834552321105, 'tsl_mult': 0.4602469835562055, 'strategy': 'breakout', 'time_stop': 52, 'use_sma': False, 'use_atr': False, 'use_adx': True, 'use_ema': True, 'use_spike': True, 'rsi_required': True, 'edge_k': 0.503764248116803, 'edge_cap': 0.18236172877895152, 'bull_strategy': 'mean_reversion', 'bull_bb_std_mult': 2.786666167658156, 'bull_rsi_os': 54, 'bull_rsi_ob': 55, 'bull_adx_thresh': 7.853054327681983, 'bull_atr_min_pct': 0.022239468150473656, 'bull_atr_max_pct': 0.08214879803674748, 'bull_tp_mult': 1.8233682025672622, 'bull_tsl_mult': 0.36538608709536624, 'bull_time_stop': 121, 'bull_use_sma': True, 'bull_use_ema': False, 'bull_use_atr': False, 'bull_use_adx': True, 'bull_use_spike': False, 'bull_rsi_required': True, 'bear_strategy': 'breakout', 'bear_bb_std_mult': 1.7712941613476496, 'bear_rsi_os': 39, 'bear_rsi_ob': 75, 'bear_adx_thresh': 11.828894031192922, 'bear_atr_min_pct': 0.005474155184964797, 'bear_atr_max_pct': 0.01838941545269822, 'bear_tp_mult': 2.8239989182394187, 'bear_tsl_mult': 0.671185086560913, 'bear_time_stop': 94, 'bear_use_sma': False, 'bear_use_ema': True, 'bear_use_atr': False, 'bear_use_adx': False, 'bear_use_spike': True, 'bear_rsi_required': False, 'sideways_strategy': 'mean_reversion', 'sideways_bb_std_mult': 2.777375923319306, 'sideways_rsi_os': 49, 'sideways_rsi_ob': 93, 'sideways_adx_thresh': 25.390349267577797, 'sideways_atr_min_pct': 0.016642262110073195, 'sideways_atr_max_pct': 0.029563307858779704, 'sideways_tp_mult': 1.912135015588538, 'sideways_tsl_mult': 0.3068173368715311, 'sideways_time_stop': 174, 'sideways_use_sma': False, 'sideways_use_ema': True, 'sideways_use_atr': False, 'sideways_use_adx': False, 'sideways_use_spike': False, 'sideways_rsi_required': True}.
[I 2025-08-31 10:46:53,671] Trial 404 finished with values: [-1000000000.0, 1000000000.0] and parameters: {'p_sma': 13, 'p_std': 33, 'p_atr': 9, 'p_adx': 26, 'rsi_period': 25, 'ema1': 10, 'ema2': 60, 'slip_atr_k': 0.024916391853204378, 'slip_spread_k': 0.630843414582337, 'spread_hl_frac': 0.00880167879230846, 'bb_std_mult': 2.785680910425941, 'rsi_os': 29, 'rsi_ob': 80, 'vol_spike': 0.2994881884393644, 'adx_thresh': 28.378770923652528, 'atr_min_pct': 0.005957374880932515, 'atr_max_pct': 0.10095213123223212, 'tp_mult': 2.4036950603781815, 'tsl_mult': 0.4891022640546315, 'strategy': 'breakout', 'time_stop': 52, 'use_sma': False, 'use_atr': False, 'use_adx': True, 'use_ema': True, 'use_spike': True, 'rsi_required': True, 'edge_k': 0.8303092839991855, 'edge_cap': 0.08111657591218824, 'bull_strategy': 'mean_reversion', 'bull_bb_std_mult': 3.3858553953539268, 'bull_rsi_os': 8, 'bull_rsi_ob': 75, 'bull_adx_thresh': 28.52022975567641, 'bull_atr_min_pct': 0.027761504572378127, 'bull_atr_max_pct': 0.0802130970419821, 'bull_tp_mult': 1.6841586135489468, 'bull_tsl_mult': 0.3759339040771359, 'bull_time_stop': 251, 'bull_use_sma': True, 'bull_use_ema': False, 'bull_use_atr': False, 'bull_use_adx': True, 'bull_use_spike': False, 'bull_rsi_required': False, 'bear_strategy': 'breakout', 'bear_bb_std_mult': 2.1048180717993827, 'bear_rsi_os': 53, 'bear_rsi_ob': 75, 'bear_adx_thresh': 6.681031506328233, 'bear_atr_min_pct': 0.007299768554617332, 'bear_atr_max_pct': 0.1318838506550108, 'bear_tp_mult': 2.829101627987342, 'bear_tsl_mult': 0.23833554190408385, 'bear_time_stop': 200, 'bear_use_sma': False, 'bear_use_ema': True, 'bear_use_atr': False, 'bear_use_adx': False, 'bear_use_spike': True, 'bear_rsi_required': False, 'sideways_strategy': 'mean_reversion', 'sideways_bb_std_mult': 2.8676460169990543, 'sideways_rsi_os': 7, 'sideways_rsi_ob': 59, 'sideways_adx_thresh': 8.796186658145722, 'sideways_atr_min_pct': 0.01134145187018895, 'sideways_atr_max_pct': 0.04698180060888791, 'sideways_tp_mult': 1.911358126645655, 'sideways_tsl_mult': 0.5620872848931141, 'sideways_time_stop': 173, 'sideways_use_sma': False, 'sideways_use_ema': True, 'sideways_use_atr': False, 'sideways_use_adx': False, 'sideways_use_spike': False, 'sideways_rsi_required': True}.
[I 2025-08-31 10:46:53,982] Trial 405 finished with values: [-1000000000.0, 1000000000.0] and parameters: {'p_sma': 13, 'p_std': 33, 'p_atr': 24, 'p_adx': 15, 'rsi_period': 31, 'ema1': 13, 'ema2': 50, 'slip_atr_k': 0.02488042096845398, 'slip_spread_k': 0.6313254909928849, 'spread_hl_frac': 0.00791795116290533, 'bb_std_mult': 1.034042238663704, 'rsi_os': 45, 'rsi_ob': 84, 'vol_spike': 0.0759022614748806, 'adx_thresh': 16.02081279527523, 'atr_min_pct': 0.009017375988275036, 'atr_max_pct': 0.1012679290898627, 'tp_mult': 2.5301692659434334, 'tsl_mult': 0.27813935498632264, 'strategy': 'breakout', 'time_stop': 168, 'use_sma': False, 'use_atr': False, 'use_adx': True, 'use_ema': True, 'use_spike': True, 'rsi_required': True, 'edge_k': 0.2640803108716093, 'edge_cap': 0.3115752678231178, 'bull_strategy': 'mean_reversion', 'bull_bb_std_mult': 1.3063508109178543, 'bull_rsi_os': 8, 'bull_rsi_ob': 75, 'bull_adx_thresh': 12.117073255535454, 'bull_atr_min_pct': 0.022668922593400136, 'bull_atr_max_pct': 0.07003397664114108, 'bull_tp_mult': 1.6913063327782305, 'bull_tsl_mult': 0.18674188003269437, 'bull_time_stop': 61, 'bull_use_sma': True, 'bull_use_ema': False, 'bull_use_atr': False, 'bull_use_adx': True, 'bull_use_spike': False, 'bull_rsi_required': False, 'bear_strategy': 'breakout', 'bear_bb_std_mult': 2.311115958286731, 'bear_rsi_os': 39, 'bear_rsi_ob': 53, 'bear_adx_thresh': 6.868357915561713, 'bear_atr_min_pct': 0.007281676165921639, 'bear_atr_max_pct': 0.13199044175046737, 'bear_tp_mult': 1.4567813938077276, 'bear_tsl_mult': 0.9993865014894132, 'bear_time_stop': 91, 'bear_use_sma': False, 'bear_use_ema': True, 'bear_use_atr': False, 'bear_use_adx': False, 'bear_use_spike': True, 'bear_rsi_required': False, 'sideways_strategy': 'mean_reversion', 'sideways_bb_std_mult': 2.8529371558276155, 'sideways_rsi_os': 9, 'sideways_rsi_ob': 93, 'sideways_adx_thresh': 25.46238121864112, 'sideways_atr_min_pct': 0.013123536189581276, 'sideways_atr_max_pct': 0.03034139911152931, 'sideways_tp_mult': 2.2962599219983497, 'sideways_tsl_mult': 0.10659740555084474, 'sideways_time_stop': 171, 'sideways_use_sma': False, 'sideways_use_ema': True, 'sideways_use_atr': False, 'sideways_use_adx': False, 'sideways_use_spike': False, 'sideways_rsi_required': True}.
[I 2025-08-31 10:46:54,781] Trial 408 finished with values: [-1000000000.0, 1000000000.0] and parameters: {'p_sma': 12, 'p_std': 31, 'p_atr': 22, 'p_adx': 15, 'rsi_period': 47, 'ema1': 14, 'ema2': 15, 'slip_atr_k': 0.12180946896042427, 'slip_spread_k': 0.417914950715217, 'spread_hl_frac': 0.011377527721519586, 'bb_std_mult': 1.4334821064048924, 'rsi_os': 50, 'rsi_ob': 76, 'vol_spike': 0.19566295624132876, 'adx_thresh': 26.674815068534507, 'atr_min_pct': 0.0025298621474840258, 'atr_max_pct': 0.10273548607806988, 'tp_mult': 2.7049041126297, 'tsl_mult': 0.28087279632778783, 'strategy': 'mean_reversion', 'time_stop': 120, 'use_sma': True, 'use_atr': False, 'use_adx': True, 'use_ema': True, 'use_spike': True, 'rsi_required': True, 'edge_k': 0.1998428872022968, 'edge_cap': 0.24759157817969468, 'bull_strategy': 'breakout', 'bull_bb_std_mult': 3.4115948666031493, 'bull_rsi_os': 12, 'bull_rsi_ob': 77, 'bull_adx_thresh': 32.91405150476279, 'bull_atr_min_pct': 0.016237311964770153, 'bull_atr_max_pct': 0.09210875121891404, 'bull_tp_mult': 1.712059389791599, 'bull_tsl_mult': 0.18835954451753212, 'bull_time_stop': 77, 'bull_use_sma': False, 'bull_use_ema': False, 'bull_use_atr': False, 'bull_use_adx': False, 'bull_use_spike': False, 'bull_rsi_required': True, 'bear_strategy': 'breakout', 'bear_bb_std_mult': 2.339194827321913, 'bear_rsi_os': 23, 'bear_rsi_ob': 62, 'bear_adx_thresh': 30.02428325640505, 'bear_atr_min_pct': 0.00763254814092533, 'bear_atr_max_pct': 0.14995954500287315, 'bear_tp_mult': 2.840012445323046, 'bear_tsl_mult': 0.24259151262496126, 'bear_time_stop': 251, 'bear_use_sma': False, 'bear_use_ema': True, 'bear_use_atr': False, 'bear_use_adx': False, 'bear_use_spike': False, 'bear_rsi_required': False, 'sideways_strategy': 'mean_reversion', 'sideways_bb_std_mult': 2.823213139627471, 'sideways_rsi_os': 9, 'sideways_rsi_ob': 68, 'sideways_adx_thresh': 15.518082524593911, 'sideways_atr_min_pct': 0.017929977592106544, 'sideways_atr_max_pct': 0.04131312667900569, 'sideways_tp_mult': 2.305012733345612, 'sideways_tsl_mult': 0.09874774369211528, 'sideways_time_stop': 188, 'sideways_use_sma': True, 'sideways_use_ema': False, 'sideways_use_atr': True, 'sideways_use_adx': False, 'sideways_use_spike': False, 'sideways_rsi_required': True}.
[I 2025-08-31 10:47:23,387] Trial 411 finished with values: [-1000000000.0, 1000000000.0] and parameters: {'p_sma': 12, 'p_std': 10, 'p_atr': 18, 'p_adx': 14, 'rsi_period': 78, 'ema1': 20, 'ema2': 57, 'slip_atr_k': 0.032430044340331435, 'slip_spread_k': 0.14097716638962082, 'spread_hl_frac': 0.01864571854260884, 'bb_std_mult': 2.68635884010508, 'rsi_os': 25, 'rsi_ob': 76, 'vol_spike': 0.27193205323324476, 'adx_thresh': 29.101609446650144, 'atr_min_pct': 0.013906807232493313, 'atr_max_pct': 0.09167026184162867, 'tp_mult': 1.8859321872490156, 'tsl_mult': 0.2229986501110041, 'strategy': 'mean_reversion', 'time_stop': 26, 'use_sma': True, 'use_atr': False, 'use_adx': True, 'use_ema': True, 'use_spike': True, 'rsi_required': True, 'edge_k': 1.483944197320979, 'edge_cap': 0.49112743080497767, 'bull_strategy': 'breakout', 'bull_bb_std_mult': 1.8664790575531716, 'bull_rsi_os': 15, 'bull_rsi_ob': 52, 'bull_adx_thresh': 7.571341256105763, 'bull_atr_min_pct': 0.019299335230928277, 'bull_atr_max_pct': 0.09653609611170666, 'bull_tp_mult': 1.8011148284030047, 'bull_tsl_mult': 0.3037658257837096, 'bull_time_stop': 98, 'bull_use_sma': False, 'bull_use_ema': False, 'bull_use_atr': False, 'bull_use_adx': False, 'bull_use_spike': False, 'bull_rsi_required': True, 'bear_strategy': 'mean_reversion', 'bear_bb_std_mult': 2.743839228429935, 'bear_rsi_os': 46, 'bear_rsi_ob': 85, 'bear_adx_thresh': 5.808025741786397, 'bear_atr_min_pct': 0.0050637625029334304, 'bear_atr_max_pct': 0.1354394092731384, 'bear_tp_mult': 1.6726732924111276, 'bear_tsl_mult': 0.5473179557845536, 'bear_time_stop': 30, 'bear_use_sma': False, 'bear_use_ema': True, 'bear_use_atr': False, 'bear_use_adx': False, 'bear_use_spike': False, 'bear_rsi_required': False, 'sideways_strategy': 'mean_reversion', 'sideways_bb_std_mult': 2.6519935808421016, 'sideways_rsi_os': 31, 'sideways_rsi_ob': 68, 'sideways_adx_thresh': 15.286931245650356, 'sideways_atr_min_pct': 0.017416651655627908, 'sideways_atr_max_pct': 0.04586466601305307, 'sideways_tp_mult': 1.9513572005878077, 'sideways_tsl_mult': 0.07058088108493005, 'sideways_time_stop': 188, 'sideways_use_sma': True, 'sideways_use_ema': False, 'sideways_use_atr': True, 'sideways_use_adx': False, 'sideways_use_spike': False, 'sideways_rsi_required': True}.
[I 2025-08-31 10:47:24,305] Trial 410 finished with values: [-1000000000.0, 1000000000.0] and parameters: {'p_sma': 12, 'p_std': 31, 'p_atr': 21, 'p_adx': 12, 'rsi_period': 45, 'ema1': 14, 'ema2': 50, 'slip_atr_k': 0.023731902186755784, 'slip_spread_k': 0.6752656768441155, 'spread_hl_frac': 0.023661369207992392, 'bb_std_mult': 2.6833789874364413, 'rsi_os': 39, 'rsi_ob': 76, 'vol_spike': 0.21999857019249605, 'adx_thresh': 10.739883232250582, 'atr_min_pct': 0.006936514239999099, 'atr_max_pct': 0.09200964801987178, 'tp_mult': 1.890915632257245, 'tsl_mult': 0.2873677475879892, 'strategy': 'mean_reversion', 'time_stop': 19, 'use_sma': True, 'use_atr': False, 'use_adx': True, 'use_ema': True, 'use_spike': True, 'rsi_required': True, 'edge_k': 0.1942553707831427, 'edge_cap': 0.44202488387703254, 'bull_strategy': 'breakout', 'bull_bb_std_mult': 3.1997270020381112, 'bull_rsi_os': 51, 'bull_rsi_ob': 52, 'bull_adx_thresh': 11.933077216994468, 'bull_atr_min_pct': 0.013497095626691847, 'bull_atr_max_pct': 0.09321469283815646, 'bull_tp_mult': 2.3352503871953303, 'bull_tsl_mult': 0.4398607447070875, 'bull_time_stop': 101, 'bull_use_sma': False, 'bull_use_ema': False, 'bull_use_atr': False, 'bull_use_adx': False, 'bull_use_spike': False, 'bull_rsi_required': True, 'bear_strategy': 'breakout', 'bear_bb_std_mult': 2.3053021054556937, 'bear_rsi_os': 40, 'bear_rsi_ob': 53, 'bear_adx_thresh': 5.920740175119619, 'bear_atr_min_pct': 0.028607975378638975, 'bear_atr_max_pct': 0.14989772899766082, 'bear_tp_mult': 1.6625514227970253, 'bear_tsl_mult': 0.3415600852188438, 'bear_time_stop': 19, 'bear_use_sma': False, 'bear_use_ema': True, 'bear_use_atr': False, 'bear_use_adx': False, 'bear_use_spike': False, 'bear_rsi_required': False, 'sideways_strategy': 'mean_reversion', 'sideways_bb_std_mult': 2.48140526280978, 'sideways_rsi_os': 6, 'sideways_rsi_ob': 75, 'sideways_adx_thresh': 5.737418750649944, 'sideways_atr_min_pct': 0.01806450828440636, 'sideways_atr_max_pct': 0.04085184523784543, 'sideways_tp_mult': 2.2866541997375687, 'sideways_tsl_mult': 0.06768196870875129, 'sideways_time_stop': 221, 'sideways_use_sma': True, 'sideways_use_ema': False, 'sideways_use_atr': True, 'sideways_use_adx': False, 'sideways_use_spike': False, 'sideways_rsi_required': True}.
[I 2025-08-31 10:47:24,644] Trial 409 finished with values: [-1000000000.0, 1000000000.0] and parameters: {'p_sma': 13, 'p_std': 31, 'p_atr': 21, 'p_adx': 15, 'rsi_period': 49, 'ema1': 30, 'ema2': 58, 'slip_atr_k': 0.024893365029769545, 'slip_spread_k': 0.3380281931883155, 'spread_hl_frac': 0.0076774498611945465, 'bb_std_mult': 2.6800461279635024, 'rsi_os': 12, 'rsi_ob': 90, 'vol_spike': 0.27034991150701077, 'adx_thresh': 26.520095876403353, 'atr_min_pct': 0.007082431167504859, 'atr_max_pct': 0.09178994748814662, 'tp_mult': 1.3350282705532197, 'tsl_mult': 0.2845616536548487, 'strategy': 'mean_reversion', 'time_stop': 6, 'use_sma': True, 'use_atr': False, 'use_adx': True, 'use_ema': True, 'use_spike': True, 'rsi_required': True, 'edge_k': 1.4871722141167376, 'edge_cap': 0.5785469074752128, 'bull_strategy': 'breakout', 'bull_bb_std_mult': 3.2834733448178905, 'bull_rsi_os': 12, 'bull_rsi_ob': 77, 'bull_adx_thresh': 10.735012084064874, 'bull_atr_min_pct': 0.01954601243445832, 'bull_atr_max_pct': 0.09249290345195395, 'bull_tp_mult': 2.425868732696054, 'bull_tsl_mult': 0.6961783773966246, 'bull_time_stop': 77, 'bull_use_sma': False, 'bull_use_ema': False, 'bull_use_atr': False, 'bull_use_adx': False, 'bull_use_spike': False, 'bull_rsi_required': True, 'bear_strategy': 'breakout', 'bear_bb_std_mult': 2.8525016757999113, 'bear_rsi_os': 23, 'bear_rsi_ob': 87, 'bear_adx_thresh': 6.1384384033544475, 'bear_atr_min_pct': 0.007094562148808956, 'bear_atr_max_pct': 0.1324935443052007, 'bear_tp_mult': 2.6981366777642584, 'bear_tsl_mult': 0.548528417287702, 'bear_time_stop': 251, 'bear_use_sma': False, 'bear_use_ema': True, 'bear_use_atr': False, 'bear_use_adx': False, 'bear_use_spike': False, 'bear_rsi_required': False, 'sideways_strategy': 'mean_reversion', 'sideways_bb_std_mult': 2.6498702027607512, 'sideways_rsi_os': 53, 'sideways_rsi_ob': 95, 'sideways_adx_thresh': 24.743394643794833, 'sideways_atr_min_pct': 0.011360134002422495, 'sideways_atr_max_pct': 0.045828675838376395, 'sideways_tp_mult': 2.297960459102217, 'sideways_tsl_mult': 0.07096129485572426, 'sideways_time_stop': 16, 'sideways_use_sma': True, 'sideways_use_ema': False, 'sideways_use_atr': True, 'sideways_use_adx': False, 'sideways_use_spike': False, 'sideways_rsi_required': True}.
[I 2025-08-31 10:47:25,237] Trial 412 finished with values: [-1000000000.0, 1000000000.0] and parameters: {'p_sma': 16, 'p_std': 30, 'p_atr': 21, 'p_adx': 14, 'rsi_period': 49, 'ema1': 20, 'ema2': 12, 'slip_atr_k': 0.0317269846007951, 'slip_spread_k': 0.6858680860378539, 'spread_hl_frac': 0.011282614521051733, 'bb_std_mult': 1.7539602593136832, 'rsi_os': 25, 'rsi_ob': 90, 'vol_spike': 0.2723705136606195, 'adx_thresh': 27.278650067658834, 'atr_min_pct': 0.007264782862809686, 'atr_max_pct': 0.09195019938467608, 'tp_mult': 1.2918351334559486, 'tsl_mult': 0.06332576776656285, 'strategy': 'mean_reversion', 'time_stop': 33, 'use_sma': True, 'use_atr': False, 'use_adx': True, 'use_ema': True, 'use_spike': True, 'rsi_required': True, 'edge_k': 1.1899907287065141, 'edge_cap': 0.4488841474313199, 'bull_strategy': 'breakout', 'bull_bb_std_mult': 0.6762138761188239, 'bull_rsi_os': 15, 'bull_rsi_ob': 52, 'bull_adx_thresh': 5.630588443452987, 'bull_atr_min_pct': 0.006633089294132241, 'bull_atr_max_pct': 0.03649992188505068, 'bull_tp_mult': 1.906068336607786, 'bull_tsl_mult': 0.4437625424111235, 'bull_time_stop': 34, 'bull_use_sma': False, 'bull_use_ema': False, 'bull_use_atr': False, 'bull_use_adx': False, 'bull_use_spike': False, 'bull_rsi_required': True, 'bear_strategy': 'mean_reversion', 'bear_bb_std_mult': 1.5884953931499821, 'bear_rsi_os': 46, 'bear_rsi_ob': 85, 'bear_adx_thresh': 6.058060505495594, 'bear_atr_min_pct': 0.006214038147323584, 'bear_atr_max_pct': 0.041894239333670306, 'bear_tp_mult': 2.766256539472776, 'bear_tsl_mult': 0.546069078092231, 'bear_time_stop': 24, 'bear_use_sma': False, 'bear_use_ema': False, 'bear_use_atr': True, 'bear_use_adx': False, 'bear_use_spike': False, 'bear_rsi_required': False, 'sideways_strategy': 'mean_reversion', 'sideways_bb_std_mult': 0.77201376309104, 'sideways_rsi_os': 29, 'sideways_rsi_ob': 95, 'sideways_adx_thresh': 10.581703043246169, 'sideways_atr_min_pct': 0.01742567701937929, 'sideways_atr_max_pct': 0.1111995650769602, 'sideways_tp_mult': 1.9487615897063462, 'sideways_tsl_mult': 0.06998310976252792, 'sideways_time_stop': 20, 'sideways_use_sma': True, 'sideways_use_ema': False, 'sideways_use_atr': True, 'sideways_use_adx': False, 'sideways_use_spike': False, 'sideways_rsi_required': True}.
[I 2025-08-31 10:47:56,615] Trial 416 finished with values: [-1000000000.0, 1000000000.0] and parameters: {'p_sma': 16, 'p_std': 26, 'p_atr': 10, 'p_adx': 13, 'rsi_period': 45, 'ema1': 22, 'ema2': 56, 'slip_atr_k': 0.019840608084179846, 'slip_spread_k': 0.7180533180458055, 'spread_hl_frac': 0.02785357039350455, 'bb_std_mult': 2.576290968606755, 'rsi_os': 27, 'rsi_ob': 46, 'vol_spike': 0.2577478220775802, 'adx_thresh': 18.578200103993847, 'atr_min_pct': 0.020769154362858276, 'atr_max_pct': 0.09624923574366682, 'tp_mult': 2.4442813946981423, 'tsl_mult': 0.25253038116194626, 'strategy': 'breakout', 'time_stop': 153, 'use_sma': True, 'use_atr': False, 'use_adx': True, 'use_ema': False, 'use_spike': True, 'rsi_required': True, 'edge_k': 0.32730468333998797, 'edge_cap': 0.48187742637166975, 'bull_strategy': 'breakout', 'bull_bb_std_mult': 0.7025738086533206, 'bull_rsi_os': 19, 'bull_rsi_ob': 74, 'bull_adx_thresh': 19.492579903716514, 'bull_atr_min_pct': 0.014430429638203858, 'bull_atr_max_pct': 0.10424322772408301, 'bull_tp_mult': 2.0121738462748384, 'bull_tsl_mult': 0.06165168554867684, 'bull_time_stop': 89, 'bull_use_sma': True, 'bull_use_ema': False, 'bull_use_atr': False, 'bull_use_adx': False, 'bull_use_spike': False, 'bull_rsi_required': True, 'bear_strategy': 'breakout', 'bear_bb_std_mult': 1.9524645309203643, 'bear_rsi_os': 38, 'bear_rsi_ob': 88, 'bear_adx_thresh': 23.54794260813275, 'bear_atr_min_pct': 0.004798694530622642, 'bear_atr_max_pct': 0.14381031807877295, 'bear_tp_mult': 2.7311335894942856, 'bear_tsl_mult': 0.5073053165428361, 'bear_time_stop': 295, 'bear_use_sma': False, 'bear_use_ema': False, 'bear_use_atr': True, 'bear_use_adx': True, 'bear_use_spike': True, 'bear_rsi_required': True, 'sideways_strategy': 'mean_reversion', 'sideways_bb_std_mult': 1.2629693858003308, 'sideways_rsi_os': 5, 'sideways_rsi_ob': 91, 'sideways_adx_thresh': 29.881624402301824, 'sideways_atr_min_pct': 0.00024418936500863846, 'sideways_atr_max_pct': 0.056760411265833935, 'sideways_tp_mult': 2.063347253739079, 'sideways_tsl_mult': 0.17225414708684572, 'sideways_time_stop': 15, 'sideways_use_sma': False, 'sideways_use_ema': False, 'sideways_use_atr': False, 'sideways_use_adx': False, 'sideways_use_spike': False, 'sideways_rsi_required': False}.
