[I 2025-08-31 11:33:52,147] Trial 757 finished with values: [-1000000000.0, 1000000000.0] and parameters: {'p_sma': 48, 'p_std': 25, 'p_atr': 22, 'p_adx': 12, 'rsi_period': 52, 'ema1': 12, 'ema2': 43, 'slip_atr_k': 0.0343016192395283, 'slip_spread_k': 0.1632558166784219, 'spread_hl_frac': 0.007998892102319273, 'bb_std_mult': 2.739707113122811, 'rsi_os': 28, 'rsi_ob': 94, 'vol_spike': 0.13645686873123672, 'adx_thresh': 32.11588293753865, 'atr_min_pct': 0.011674460723800288, 'atr_max_pct': 0.14998850456330803, 'tp_mult': 1.7000610115671877, 'tsl_mult': 0.03133158785824719, 'strategy': 'breakout', 'time_stop': 195, 'use_sma': False, 'use_atr': False, 'use_adx': True, 'use_ema': True, 'use_spike': True, 'rsi_required': False, 'edge_k': 0.30585835189240723, 'edge_cap': 0.4863022726428404, 'bull_strategy': 'mean_reversion', 'bull_bb_std_mult': 0.6001473159517016, 'bull_rsi_os': 12, 'bull_rsi_ob': 80, 'bull_adx_thresh': 30.385189883702136, 'bull_atr_min_pct': 0.004828380371535698, 'bull_atr_max_pct': 0.1325065796220598, 'bull_tp_mult': 1.9535336868893032, 'bull_tsl_mult': 0.3904154656229227, 'bull_time_stop': 281, 'bull_use_sma': False, 'bull_use_ema': True, 'bull_use_atr': False, 'bull_use_adx': False, 'bull_use_spike': False, 'bull_rsi_required': True, 'bear_strategy': 'breakout', 'bear_bb_std_mult': 3.3173959701482407, 'bear_rsi_os': 51, 'bear_rsi_ob': 73, 'bear_adx_thresh': 18.865680847337316, 'bear_atr_min_pct': 0.028268085409924627, 'bear_atr_max_pct': 0.1436702552248548, 'bear_tp_mult': 2.8657075107674674, 'bear_tsl_mult': 0.8173848265867528, 'bear_time_stop': 49, 'bear_use_sma': True, 'bear_use_ema': False, 'bear_use_atr': False, 'bear_use_adx': False, 'bear_use_spike': False, 'bear_rsi_required': True, 'sideways_strategy': 'breakout', 'sideways_bb_std_mult': 1.5323576062372832, 'sideways_rsi_os': 28, 'sideways_rsi_ob': 95, 'sideways_adx_thresh': 13.69328871937071, 'sideways_atr_min_pct': 0.016094903804145286, 'sideways_atr_max_pct': 0.039280721464130135, 'sideways_tp_mult': 2.5275146280691376, 'sideways_tsl_mult': 0.36865538363435957, 'sideways_time_stop': 14, 'sideways_use_sma': False, 'sideways_use_ema': False, 'sideways_use_atr': True, 'sideways_use_adx': False, 'sideways_use_spike': True, 'sideways_rsi_required': True}.
[I 2025-08-31 11:33:52,527] Trial 758 finished with values: [-1000000000.0, 1000000000.0] and parameters: {'p_sma': 30, 'p_std': 7, 'p_atr': 11, 'p_adx': 14, 'rsi_period': 52, 'ema1': 12, 'ema2': 43, 'slip_atr_k': 0.035552417209696235, 'slip_spread_k': 0.17259366569622545, 'spread_hl_frac': 0.0064315424414709875, 'bb_std_mult': 3.0919311114579067, 'rsi_os': 28, 'rsi_ob': 95, 'vol_spike': 0.14863606274617244, 'adx_thresh': 32.354538827759434, 'atr_min_pct': 0.013726431504646697, 'atr_max_pct': 0.14765368409205312, 'tp_mult': 1.7054193294402056, 'tsl_mult': 0.04062904653141756, 'strategy': 'breakout', 'time_stop': 191, 'use_sma': True, 'use_atr': False, 'use_adx': True, 'use_ema': True, 'use_spike': True, 'rsi_required': False, 'edge_k': 0.31636297973086125, 'edge_cap': 0.7136990743766981, 'bull_strategy': 'breakout', 'bull_bb_std_mult': 0.7077231338391906, 'bull_rsi_os': 12, 'bull_rsi_ob': 80, 'bull_adx_thresh': 30.479733584745993, 'bull_atr_min_pct': 0.02585397129637472, 'bull_atr_max_pct': 0.09543088990979717, 'bull_tp_mult': 1.9095795103883617, 'bull_tsl_mult': 0.3916274516897318, 'bull_time_stop': 287, 'bull_use_sma': False, 'bull_use_ema': True, 'bull_use_atr': False, 'bull_use_adx': True, 'bull_use_spike': False, 'bull_rsi_required': True, 'bear_strategy': 'breakout', 'bear_bb_std_mult': 3.3388526002919727, 'bear_rsi_os': 53, 'bear_rsi_ob': 73, 'bear_adx_thresh': 28.87455740684679, 'bear_atr_min_pct': 0.005042210651798237, 'bear_atr_max_pct': 0.13913519402664729, 'bear_tp_mult': 2.4342121538487245, 'bear_tsl_mult': 0.8328421007077487, 'bear_time_stop': 166, 'bear_use_sma': False, 'bear_use_ema': False, 'bear_use_atr': True, 'bear_use_adx': False, 'bear_use_spike': False, 'bear_rsi_required': False, 'sideways_strategy': 'breakout', 'sideways_bb_std_mult': 1.5597334978891817, 'sideways_rsi_os': 25, 'sideways_rsi_ob': 95, 'sideways_adx_thresh': 11.595366287838253, 'sideways_atr_min_pct': 0.014408685794152673, 'sideways_atr_max_pct': 0.040375101438816556, 'sideways_tp_mult': 2.2284221395824755, 'sideways_tsl_mult': 0.36425746024396155, 'sideways_time_stop': 15, 'sideways_use_sma': False, 'sideways_use_ema': False, 'sideways_use_atr': True, 'sideways_use_adx': False, 'sideways_use_spike': True, 'sideways_rsi_required': True}.
[I 2025-08-31 11:33:52,658] Trial 759 finished with values: [-0.017879968436526394, 0.018578138858863873] and parameters: {'p_sma': 56, 'p_std': 56, 'p_atr': 11, 'p_adx': 14, 'rsi_period': 54, 'ema1': 11, 'ema2': 43, 'slip_atr_k': 0.033922403678350505, 'slip_spread_k': 0.10561140431804225, 'spread_hl_frac': 0.006349009239152086, 'bb_std_mult': 1.3131148668630144, 'rsi_os': 28, 'rsi_ob': 94, 'vol_spike': 0.2695073958200461, 'adx_thresh': 32.42392344344706, 'atr_min_pct': 0.011482855947105469, 'atr_max_pct': 0.13853042510836666, 'tp_mult': 1.708063627006482, 'tsl_mult': 0.03986524454240632, 'strategy': 'breakout', 'time_stop': 192, 'use_sma': True, 'use_atr': False, 'use_adx': True, 'use_ema': True, 'use_spike': True, 'rsi_required': False, 'edge_k': 0.3030895814292859, 'edge_cap': 0.48724219397183677, 'bull_strategy': 'breakout', 'bull_bb_std_mult': 0.7420967921708563, 'bull_rsi_os': 15, 'bull_rsi_ob': 80, 'bull_adx_thresh': 5.035641404185519, 'bull_atr_min_pct': 0.004920021512922166, 'bull_atr_max_pct': 0.13189873738544475, 'bull_tp_mult': 1.9558345070716319, 'bull_tsl_mult': 0.38716507152117147, 'bull_time_stop': 289, 'bull_use_sma': False, 'bull_use_ema': True, 'bull_use_atr': False, 'bull_use_adx': True, 'bull_use_spike': False, 'bull_rsi_required': True, 'bear_strategy': 'breakout', 'bear_bb_std_mult': 2.9761426811480702, 'bear_rsi_os': 53, 'bear_rsi_ob': 75, 'bear_adx_thresh': 7.126158391928708, 'bear_atr_min_pct': 0.004856612791013612, 'bear_atr_max_pct': 0.051518358018250936, 'bear_tp_mult': 2.68881322560149, 'bear_tsl_mult': 0.8254844928190437, 'bear_time_stop': 81, 'bear_use_sma': False, 'bear_use_ema': False, 'bear_use_atr': True, 'bear_use_adx': False, 'bear_use_spike': False, 'bear_rsi_required': False, 'sideways_strategy': 'breakout', 'sideways_bb_std_mult': 2.8847968158956507, 'sideways_rsi_os': 25, 'sideways_rsi_ob': 56, 'sideways_adx_thresh': 11.828540893855145, 'sideways_atr_min_pct': 0.01625372767804992, 'sideways_atr_max_pct': 0.01016117466311399, 'sideways_tp_mult': 2.539999333105504, 'sideways_tsl_mult': 0.3738958826011829, 'sideways_time_stop': 14, 'sideways_use_sma': False, 'sideways_use_ema': False, 'sideways_use_atr': True, 'sideways_use_adx': False, 'sideways_use_spike': True, 'sideways_rsi_required': False}.
[I 2025-08-31 11:33:52,841] Trial 756 finished with values: [-1000000000.0, 1000000000.0] and parameters: {'p_sma': 13, 'p_std': 25, 'p_atr': 11, 'p_adx': 13, 'rsi_period': 51, 'ema1': 12, 'ema2': 40, 'slip_atr_k': 0.03312352623599148, 'slip_spread_k': 0.16176800911619404, 'spread_hl_frac': 0.006719362294436483, 'bb_std_mult': 2.9619092861664664, 'rsi_os': 28, 'rsi_ob': 92, 'vol_spike': 0.13711900601710217, 'adx_thresh': 32.44988208116731, 'atr_min_pct': 0.01046354857364627, 'atr_max_pct': 0.14979857625752477, 'tp_mult': 1.5897152900682912, 'tsl_mult': 0.031176908943321046, 'strategy': 'breakout', 'time_stop': 209, 'use_sma': False, 'use_atr': False, 'use_adx': True, 'use_ema': True, 'use_spike': True, 'rsi_required': False, 'edge_k': 0.3082695056669016, 'edge_cap': 0.5585772258789958, 'bull_strategy': 'mean_reversion', 'bull_bb_std_mult': 0.7202492776141737, 'bull_rsi_os': 12, 'bull_rsi_ob': 83, 'bull_adx_thresh': 12.35401380945748, 'bull_atr_min_pct': 0.00499476401502486, 'bull_atr_max_pct': 0.09338036453838715, 'bull_tp_mult': 1.9607934468675774, 'bull_tsl_mult': 0.39013961005279274, 'bull_time_stop': 285, 'bull_use_sma': False, 'bull_use_ema': True, 'bull_use_atr': False, 'bull_use_adx': False, 'bull_use_spike': False, 'bull_rsi_required': True, 'bear_strategy': 'breakout', 'bear_bb_std_mult': 3.1161709025624327, 'bear_rsi_os': 51, 'bear_rsi_ob': 74, 'bear_adx_thresh': 6.98630835678188, 'bear_atr_min_pct': 0.005080333242534589, 'bear_atr_max_pct': 0.01736539685033482, 'bear_tp_mult': 2.4422470673849244, 'bear_tsl_mult': 0.8146344508335726, 'bear_time_stop': 16, 'bear_use_sma': True, 'bear_use_ema': False, 'bear_use_atr': False, 'bear_use_adx': False, 'bear_use_spike': False, 'bear_rsi_required': True, 'sideways_strategy': 'breakout', 'sideways_bb_std_mult': 1.5566748015008054, 'sideways_rsi_os': 27, 'sideways_rsi_ob': 95, 'sideways_adx_thresh': 13.848849218323181, 'sideways_atr_min_pct': 0.015824736440529976, 'sideways_atr_max_pct': 0.04321261531792658, 'sideways_tp_mult': 2.2716034396093026, 'sideways_tsl_mult': 0.36601260657961754, 'sideways_time_stop': 14, 'sideways_use_sma': False, 'sideways_use_ema': False, 'sideways_use_atr': True, 'sideways_use_adx': False, 'sideways_use_spike': True, 'sideways_rsi_required': True}.
[I 2025-08-31 11:34:25,883] Trial 761 finished with values: [-0.01781482925294986, 0.01976473299212653] and parameters: {'p_sma': 56, 'p_std': 19, 'p_atr': 18, 'p_adx': 28, 'rsi_period': 55, 'ema1': 11, 'ema2': 41, 'slip_atr_k': 0.027016113506491427, 'slip_spread_k': 0.19911673815498454, 'spread_hl_frac': 0.0038078728360283406, 'bb_std_mult': 3.3381221832196664, 'rsi_os': 29, 'rsi_ob': 93, 'vol_spike': 0.27215535982007144, 'adx_thresh': 30.954580675313423, 'atr_min_pct': 0.012978612873398701, 'atr_max_pct': 0.13847226735372134, 'tp_mult': 1.7564759053580656, 'tsl_mult': 0.0816570125548079, 'strategy': 'breakout', 'time_stop': 208, 'use_sma': True, 'use_atr': False, 'use_adx': True, 'use_ema': True, 'use_spike': True, 'rsi_required': False, 'edge_k': 0.4999733250975615, 'edge_cap': 0.18205025856150392, 'bull_strategy': 'breakout', 'bull_bb_std_mult': 0.7339870825039418, 'bull_rsi_os': 15, 'bull_rsi_ob': 84, 'bull_adx_thresh': 12.426434011587093, 'bull_atr_min_pct': 0.024350903166580937, 'bull_atr_max_pct': 0.10093748836768056, 'bull_tp_mult': 1.1787400220179274, 'bull_tsl_mult': 0.8515173769280284, 'bull_time_stop': 289, 'bull_use_sma': False, 'bull_use_ema': True, 'bull_use_atr': False, 'bull_use_adx': True, 'bull_use_spike': False, 'bull_rsi_required': True, 'bear_strategy': 'breakout', 'bear_bb_std_mult': 2.961117921743355, 'bear_rsi_os': 53, 'bear_rsi_ob': 75, 'bear_adx_thresh': 6.963717792657185, 'bear_atr_min_pct': 0.004771547424861543, 'bear_atr_max_pct': 0.01757649791214254, 'bear_tp_mult': 1.9818728582112106, 'bear_tsl_mult': 0.7622727227584227, 'bear_time_stop': 81, 'bear_use_sma': False, 'bear_use_ema': True, 'bear_use_atr': False, 'bear_use_adx': False, 'bear_use_spike': False, 'bear_rsi_required': False, 'sideways_strategy': 'breakout', 'sideways_bb_std_mult': 2.9173456908222977, 'sideways_rsi_os': 25, 'sideways_rsi_ob': 76, 'sideways_adx_thresh': 8.733920759631497, 'sideways_atr_min_pct': 0.01663999953519635, 'sideways_atr_max_pct': 0.14768205574165938, 'sideways_tp_mult': 1.698095775023012, 'sideways_tsl_mult': 0.3944292135337323, 'sideways_time_stop': 5, 'sideways_use_sma': False, 'sideways_use_ema': False, 'sideways_use_atr': True, 'sideways_use_adx': False, 'sideways_use_spike': True, 'sideways_rsi_required': False}.
[I 2025-08-31 11:34:26,820] Trial 760 finished with values: [-0.017619197772321016, 0.01885917979720566] and parameters: {'p_sma': 56, 'p_std': 33, 'p_atr': 11, 'p_adx': 14, 'rsi_period': 52, 'ema1': 12, 'ema2': 41, 'slip_atr_k': 0.05106780322827037, 'slip_spread_k': 0.1961471917657624, 'spread_hl_frac': 0.006954251812658969, 'bb_std_mult': 1.2316525099370144, 'rsi_os': 29, 'rsi_ob': 92, 'vol_spike': 0.14792481634111398, 'adx_thresh': 32.755963637065754, 'atr_min_pct': 0.013993836654805539, 'atr_max_pct': 0.14514695722657056, 'tp_mult': 1.7506903763821269, 'tsl_mult': 0.0996762312677793, 'strategy': 'breakout', 'time_stop': 191, 'use_sma': True, 'use_atr': False, 'use_adx': True, 'use_ema': True, 'use_spike': True, 'rsi_required': False, 'edge_k': 0.28353509585449815, 'edge_cap': 0.6109049711873583, 'bull_strategy': 'breakout', 'bull_bb_std_mult': 0.7269271346219701, 'bull_rsi_os': 15, 'bull_rsi_ob': 84, 'bull_adx_thresh': 33.11489641844065, 'bull_atr_min_pct': 0.02572378536515761, 'bull_atr_max_pct': 0.09526391241255942, 'bull_tp_mult': 1.785815500931839, 'bull_tsl_mult': 0.34675949118878163, 'bull_time_stop': 288, 'bull_use_sma': False, 'bull_use_ema': True, 'bull_use_atr': False, 'bull_use_adx': True, 'bull_use_spike': False, 'bull_rsi_required': True, 'bear_strategy': 'breakout', 'bear_bb_std_mult': 2.9891362134872095, 'bear_rsi_os': 53, 'bear_rsi_ob': 75, 'bear_adx_thresh': 7.185055865071992, 'bear_atr_min_pct': 0.005038723185108091, 'bear_atr_max_pct': 0.13866979844236577, 'bear_tp_mult': 2.7415179215211816, 'bear_tsl_mult': 0.8454440506875255, 'bear_time_stop': 16, 'bear_use_sma': False, 'bear_use_ema': False, 'bear_use_atr': True, 'bear_use_adx': False, 'bear_use_spike': False, 'bear_rsi_required': False, 'sideways_strategy': 'breakout', 'sideways_bb_std_mult': 0.9567857320454367, 'sideways_rsi_os': 25, 'sideways_rsi_ob': 76, 'sideways_adx_thresh': 9.135608880451981, 'sideways_atr_min_pct': 0.016704086765058655, 'sideways_atr_max_pct': 0.039802359427020845, 'sideways_tp_mult': 1.6940715426559136, 'sideways_tsl_mult': 0.3656741325876077, 'sideways_time_stop': 12, 'sideways_use_sma': False, 'sideways_use_ema': False, 'sideways_use_atr': True, 'sideways_use_adx': False, 'sideways_use_spike': True, 'sideways_rsi_required': False}.
[I 2025-08-31 11:34:27,099] Trial 762 finished with values: [-1000000000.0, 1000000000.0] and parameters: {'p_sma': 13, 'p_std': 34, 'p_atr': 10, 'p_adx': 15, 'rsi_period': 55, 'ema1': 11, 'ema2': 46, 'slip_atr_k': 0.2000092300116764, 'slip_spread_k': 0.2029990749746579, 'spread_hl_frac': 0.004248266641041111, 'bb_std_mult': 2.242318879125275, 'rsi_os': 29, 'rsi_ob': 93, 'vol_spike': 0.2995965954956448, 'adx_thresh': 30.731143399274895, 'atr_min_pct': 0.012648753198939468, 'atr_max_pct': 0.14511928437263183, 'tp_mult': 1.7657513755738774, 'tsl_mult': 0.09019115865797447, 'strategy': 'mean_reversion', 'time_stop': 209, 'use_sma': True, 'use_atr': False, 'use_adx': True, 'use_ema': True, 'use_spike': True, 'rsi_required': False, 'edge_k': 0.3800719907573016, 'edge_cap': 0.17733353550487957, 'bull_strategy': 'breakout', 'bull_bb_std_mult': 1.1753658830690772, 'bull_rsi_os': 48, 'bull_rsi_ob': 84, 'bull_adx_thresh': 6.1791217777972705, 'bull_atr_min_pct': 0.023818484747660323, 'bull_atr_max_pct': 0.035671808379182914, 'bull_tp_mult': 1.7843092138083767, 'bull_tsl_mult': 0.5328381809163786, 'bull_time_stop': 294, 'bull_use_sma': False, 'bull_use_ema': True, 'bull_use_atr': False, 'bull_use_adx': False, 'bull_use_spike': False, 'bull_rsi_required': True, 'bear_strategy': 'mean_reversion', 'bear_bb_std_mult': 3.2486489365443556, 'bear_rsi_os': 52, 'bear_rsi_ob': 75, 'bear_adx_thresh': 26.96417912868749, 'bear_atr_min_pct': 0.0011872162769429213, 'bear_atr_max_pct': 0.018353274156520848, 'bear_tp_mult': 2.8549375816296103, 'bear_tsl_mult': 0.7252294832891563, 'bear_time_stop': 16, 'bear_use_sma': False, 'bear_use_ema': True, 'bear_use_atr': False, 'bear_use_adx': False, 'bear_use_spike': False, 'bear_rsi_required': False, 'sideways_strategy': 'breakout', 'sideways_bb_std_mult': 2.7525439569431827, 'sideways_rsi_os': 25, 'sideways_rsi_ob': 93, 'sideways_adx_thresh': 9.001837300111642, 'sideways_atr_min_pct': 0.010302878320023065, 'sideways_atr_max_pct': 0.035248910061206715, 'sideways_tp_mult': 1.7147259965003938, 'sideways_tsl_mult': 0.3893775690037836, 'sideways_time_stop': 10, 'sideways_use_sma': True, 'sideways_use_ema': True, 'sideways_use_atr': True, 'sideways_use_adx': False, 'sideways_use_spike': True, 'sideways_rsi_required': True}.
[I 2025-08-31 11:34:27,230] Trial 763 finished with values: [-1000000000.0, 1000000000.0] and parameters: {'p_sma': 13, 'p_std': 19, 'p_atr': 18, 'p_adx': 26, 'rsi_period': 54, 'ema1': 11, 'ema2': 46, 'slip_atr_k': 0.025187979427830895, 'slip_spread_k': 0.18782561312710447, 'spread_hl_frac': 0.00559256931024274, 'bb_std_mult': 2.7503336375658884, 'rsi_os': 39, 'rsi_ob': 93, 'vol_spike': 0.1647014479134048, 'adx_thresh': 30.94291344334175, 'atr_min_pct': 0.012663103087108073, 'atr_max_pct': 0.14456744270161304, 'tp_mult': 1.75802880820689, 'tsl_mult': 0.09535811667903349, 'strategy': 'mean_reversion', 'time_stop': 216, 'use_sma': True, 'use_atr': False, 'use_adx': True, 'use_ema': False, 'use_spike': True, 'rsi_required': False, 'edge_k': 0.3973091240760174, 'edge_cap': 0.5216019931106763, 'bull_strategy': 'breakout', 'bull_bb_std_mult': 3.0648735145268757, 'bull_rsi_os': 14, 'bull_rsi_ob': 84, 'bull_adx_thresh': 31.189975500122316, 'bull_atr_min_pct': 0.02368724513300108, 'bull_atr_max_pct': 0.10139734600026767, 'bull_tp_mult': 2.825532861997437, 'bull_tsl_mult': 0.8501235166168859, 'bull_time_stop': 295, 'bull_use_sma': False, 'bull_use_ema': True, 'bull_use_atr': False, 'bull_use_adx': False, 'bull_use_spike': False, 'bull_rsi_required': False, 'bear_strategy': 'mean_reversion', 'bear_bb_std_mult': 3.21930282800541, 'bear_rsi_os': 52, 'bear_rsi_ob': 77, 'bear_adx_thresh': 26.972038311644873, 'bear_atr_min_pct': 0.001220156609267815, 'bear_atr_max_pct': 0.1381307528252236, 'bear_tp_mult': 2.7332803538633543, 'bear_tsl_mult': 0.7633659457454384, 'bear_time_stop': 22, 'bear_use_sma': False, 'bear_use_ema': True, 'bear_use_atr': False, 'bear_use_adx': True, 'bear_use_spike': False, 'bear_rsi_required': False, 'sideways_strategy': 'breakout', 'sideways_bb_std_mult': 0.9780678985116138, 'sideways_rsi_os': 24, 'sideways_rsi_ob': 69, 'sideways_adx_thresh': 9.154487721903264, 'sideways_atr_min_pct': 0.01669996900840743, 'sideways_atr_max_pct': 0.06605289492452887, 'sideways_tp_mult': 1.709776251131577, 'sideways_tsl_mult': 0.3909882929460718, 'sideways_time_stop': 5, 'sideways_use_sma': True, 'sideways_use_ema': True, 'sideways_use_atr': True, 'sideways_use_adx': False, 'sideways_use_spike': True, 'sideways_rsi_required': False}.
[I 2025-08-31 11:34:28,282] Trial 766 finished with values: [-1000000000.0, 1000000000.0] and parameters: {'p_sma': 44, 'p_std': 44, 'p_atr': 9, 'p_adx': 20, 'rsi_period': 53, 'ema1': 12, 'ema2': 45, 'slip_atr_k': 0.024056204440908703, 'slip_spread_k': 0.23312717640684155, 'spread_hl_frac': 0.01914301858668397, 'bb_std_mult': 2.7439483350284575, 'rsi_os': 50, 'rsi_ob': 95, 'vol_spike': 0.03211665079926494, 'adx_thresh': 31.42860292498803, 'atr_min_pct': 0.01193392025088312, 'atr_max_pct': 0.1460854511727097, 'tp_mult': 1.66562160588798, 'tsl_mult': 0.05186598286501065, 'strategy': 'mean_reversion', 'time_stop': 217, 'use_sma': True, 'use_atr': True, 'use_adx': False, 'use_ema': False, 'use_spike': False, 'rsi_required': False, 'edge_k': 0.34670147791379174, 'edge_cap': 0.5196891364615777, 'bull_strategy': 'breakout', 'bull_bb_std_mult': 3.3920041724813244, 'bull_rsi_os': 38, 'bull_rsi_ob': 82, 'bull_adx_thresh': 34.264380085442085, 'bull_atr_min_pct': 0.0059415060128450384, 'bull_atr_max_pct': 0.10699144999126224, 'bull_tp_mult': 1.3456442325482572, 'bull_tsl_mult': 0.6238078134939185, 'bull_time_stop': 300, 'bull_use_sma': False, 'bull_use_ema': True, 'bull_use_atr': True, 'bull_use_adx': False, 'bull_use_spike': True, 'bull_rsi_required': False, 'bear_strategy': 'mean_reversion', 'bear_bb_std_mult': 3.2349566367170213, 'bear_rsi_os': 50, 'bear_rsi_ob': 76, 'bear_adx_thresh': 14.23627301271486, 'bear_atr_min_pct': 0.014642850499085713, 'bear_atr_max_pct': 0.13560967509705135, 'bear_tp_mult': 1.1218210443953756, 'bear_tsl_mult': 0.7624182050204713, 'bear_time_stop': 23, 'bear_use_sma': False, 'bear_use_ema': True, 'bear_use_atr': False, 'bear_use_adx': True, 'bear_use_spike': False, 'bear_rsi_required': False, 'sideways_strategy': 'breakout', 'sideways_bb_std_mult': 2.7783026160366022, 'sideways_rsi_os': 24, 'sideways_rsi_ob': 69, 'sideways_adx_thresh': 12.52716398822383, 'sideways_atr_min_pct': 0.017403079156682426, 'sideways_atr_max_pct': 0.04572395407679339, 'sideways_tp_mult': 1.9107443219502613, 'sideways_tsl_mult': 0.31477163030772265, 'sideways_time_stop': 5, 'sideways_use_sma': True, 'sideways_use_ema': True, 'sideways_use_atr': True, 'sideways_use_adx': True, 'sideways_use_spike': True, 'sideways_rsi_required': True}.
