[I 2025-08-31 10:09:05,386] Trial 115 finished with values: [-0.016958382753054724, 0.0167785509791567] and parameters: {'p_sma': 50, 'p_std': 46, 'p_atr': 19, 'p_adx': 24, 'rsi_period': 50, 'ema1': 29, 'ema2': 40, 'slip_atr_k': 0.019010834862878336, 'slip_spread_k': 0.7675978662148517, 'spread_hl_frac': 0.015430622807870258, 'bb_std_mult': 2.943414114845965, 'rsi_os': 40, 'rsi_ob': 68, 'vol_spike': 0.13379450013492525, 'adx_thresh': 26.836698905138924, 'atr_min_pct': 0.006612954506753853, 'atr_max_pct': 0.13059627009348024, 'tp_mult': 2.2071387090173995, 'tsl_mult': 0.7489758545578531, 'strategy': 'mean_reversion', 'time_stop': 168, 'use_sma': False, 'use_atr': True, 'use_adx': False, 'use_ema': True, 'use_spike': False, 'rsi_required': False, 'edge_k': 0.017468167698247328, 'edge_cap': 0.736010111595908, 'bull_strategy': 'breakout', 'bull_bb_std_mult': 2.23279685979663, 'bull_rsi_os': 19, 'bull_rsi_ob': 70, 'bull_adx_thresh': 10.588934836551191, 'bull_atr_min_pct': 0.0017217166825182135, 'bull_atr_max_pct': 0.01699952900790863, 'bull_tp_mult': 1.1913607819656327, 'bull_tsl_mult': 0.8330836074119267, 'bull_time_stop': 93, 'bull_use_sma': False, 'bull_use_ema': True, 'bull_use_atr': True, 'bull_use_adx': False, 'bull_use_spike': True, 'bull_rsi_required': True, 'bear_strategy': 'mean_reversion', 'bear_bb_std_mult': 2.881953280146139, 'bear_rsi_os': 53, 'bear_rsi_ob': 75, 'bear_adx_thresh': 29.65792728804647, 'bear_atr_min_pct': 0.008765742728689742, 'bear_atr_max_pct': 0.06875594355669802, 'bear_tp_mult': 2.477180293789627, 'bear_tsl_mult': 0.1469973956341154, 'bear_time_stop': 93, 'bear_use_sma': False, 'bear_use_ema': False, 'bear_use_atr': False, 'bear_use_adx': False, 'bear_use_spike': True, 'bear_rsi_required': True, 'sideways_strategy': 'breakout', 'sideways_bb_std_mult': 2.6839238982874107, 'sideways_rsi_os': 19, 'sideways_rsi_ob': 84, 'sideways_adx_thresh': 8.606196073222165, 'sideways_atr_min_pct': 0.013735172964473368, 'sideways_atr_max_pct': 0.11504960192460284, 'sideways_tp_mult': 1.9702114796849526, 'sideways_tsl_mult': 0.07958334365828888, 'sideways_time_stop': 255, 'sideways_use_sma': True, 'sideways_use_ema': True, 'sideways_use_atr': False, 'sideways_use_adx': True, 'sideways_use_spike': True, 'sideways_rsi_required': True}.
[I 2025-08-31 10:09:05,759] Trial 118 finished with values: [-1000000000.0, 1000000000.0] and parameters: {'p_sma': 20, 'p_std': 57, 'p_atr': 19, 'p_adx': 9, 'rsi_period': 8, 'ema1': 29, 'ema2': 12, 'slip_atr_k': 0.029995072439020356, 'slip_spread_k': 0.48858980492735665, 'spread_hl_frac': 0.048494065284058786, 'bb_std_mult': 2.812156613617293, 'rsi_os': 41, 'rsi_ob': 50, 'vol_spike': 0.13742689599270694, 'adx_thresh': 27.419759757736436, 'atr_min_pct': 0.00666808353007298, 'atr_max_pct': 0.015740888890090288, 'tp_mult': 2.2195700257971978, 'tsl_mult': 0.05661262649341914, 'strategy': 'mean_reversion', 'time_stop': 223, 'use_sma': False, 'use_atr': True, 'use_adx': False, 'use_ema': True, 'use_spike': False, 'rsi_required': False, 'edge_k': 0.018483525016050967, 'edge_cap': 0.7360896407947319, 'bull_strategy': 'breakout', 'bull_bb_std_mult': 1.9462484809999243, 'bull_rsi_os': 12, 'bull_rsi_ob': 70, 'bull_adx_thresh': 6.800070644563155, 'bull_atr_min_pct': 0.004114278270524748, 'bull_atr_max_pct': 0.10458545747850163, 'bull_tp_mult': 2.810931983544205, 'bull_tsl_mult': 0.09296099335712932, 'bull_time_stop': 75, 'bull_use_sma': False, 'bull_use_ema': True, 'bull_use_atr': True, 'bull_use_adx': False, 'bull_use_spike': True, 'bull_rsi_required': True, 'bear_strategy': 'mean_reversion', 'bear_bb_std_mult': 1.9936445272418302, 'bear_rsi_os': 46, 'bear_rsi_ob': 75, 'bear_adx_thresh': 26.54884009576839, 'bear_atr_min_pct': 0.013205280378737414, 'bear_atr_max_pct': 0.06805319910826965, 'bear_tp_mult': 1.7496570752957776, 'bear_tsl_mult': 0.09636241664800682, 'bear_time_stop': 82, 'bear_use_sma': False, 'bear_use_ema': False, 'bear_use_atr': True, 'bear_use_adx': False, 'bear_use_spike': True, 'bear_rsi_required': True, 'sideways_strategy': 'breakout', 'sideways_bb_std_mult': 2.152683542256608, 'sideways_rsi_os': 17, 'sideways_rsi_ob': 80, 'sideways_adx_thresh': 22.536360414683376, 'sideways_atr_min_pct': 0.015858930636275907, 'sideways_atr_max_pct': 0.10609492971833043, 'sideways_tp_mult': 2.4802588135261185, 'sideways_tsl_mult': 0.07798732843001169, 'sideways_time_stop': 222, 'sideways_use_sma': True, 'sideways_use_ema': True, 'sideways_use_atr': False, 'sideways_use_adx': True, 'sideways_use_spike': True, 'sideways_rsi_required': True}.
[I 2025-08-31 10:09:38,714] Trial 121 finished with values: [-1000000000.0, 1000000000.0] and parameters: {'p_sma': 40, 'p_std': 18, 'p_atr': 22, 'p_adx': 25, 'rsi_period': 72, 'ema1': 30, 'ema2': 41, 'slip_atr_k': 0.03882885369001904, 'slip_spread_k': 0.5455202238004031, 'spread_hl_frac': 0.02100138042898561, 'bb_std_mult': 2.843979909085488, 'rsi_os': 40, 'rsi_ob': 81, 'vol_spike': 0.13546744431004004, 'adx_thresh': 26.59115003079946, 'atr_min_pct': 0.015122991471916113, 'atr_max_pct': 0.059277481703487, 'tp_mult': 2.2019331476825745, 'tsl_mult': 0.04308114694519766, 'strategy': 'breakout', 'time_stop': 169, 'use_sma': False, 'use_atr': True, 'use_adx': False, 'use_ema': True, 'use_spike': True, 'rsi_required': False, 'edge_k': 0.29550358482718797, 'edge_cap': 0.7155139345018924, 'bull_strategy': 'breakout', 'bull_bb_std_mult': 2.606451566595766, 'bull_rsi_os': 22, 'bull_rsi_ob': 68, 'bull_adx_thresh': 26.473338096977404, 'bull_atr_min_pct': 0.02054078911610706, 'bull_atr_max_pct': 0.06223603677178476, 'bull_tp_mult': 2.5199885969658893, 'bull_tsl_mult': 0.8682526086874098, 'bull_time_stop': 100, 'bull_use_sma': False, 'bull_use_ema': True, 'bull_use_atr': True, 'bull_use_adx': False, 'bull_use_spike': True, 'bull_rsi_required': True, 'bear_strategy': 'mean_reversion', 'bear_bb_std_mult': 0.6718327211259714, 'bear_rsi_os': 46, 'bear_rsi_ob': 68, 'bear_adx_thresh': 30.910716312192893, 'bear_atr_min_pct': 0.009107338009736251, 'bear_atr_max_pct': 0.044675847094962105, 'bear_tp_mult': 1.3225729628966976, 'bear_tsl_mult': 0.08776736472189516, 'bear_time_stop': 83, 'bear_use_sma': True, 'bear_use_ema': False, 'bear_use_atr': True, 'bear_use_adx': False, 'bear_use_spike': True, 'bear_rsi_required': True, 'sideways_strategy': 'breakout', 'sideways_bb_std_mult': 2.1998834961828586, 'sideways_rsi_os': 27, 'sideways_rsi_ob': 77, 'sideways_adx_thresh': 14.462264364832858, 'sideways_atr_min_pct': 0.016149865450525304, 'sideways_atr_max_pct': 0.10620316727937021, 'sideways_tp_mult': 2.5254331965622923, 'sideways_tsl_mult': 0.12456138217881692, 'sideways_time_stop': 220, 'sideways_use_sma': False, 'sideways_use_ema': True, 'sideways_use_atr': False, 'sideways_use_adx': True, 'sideways_use_spike': True, 'sideways_rsi_required': True}.
[I 2025-08-31 10:09:38,772] Trial 120 finished with values: [-1000000000.0, 1000000000.0] and parameters: {'p_sma': 30, 'p_std': 59, 'p_atr': 10, 'p_adx': 27, 'rsi_period': 40, 'ema1': 30, 'ema2': 39, 'slip_atr_k': 0.020705082886234766, 'slip_spread_k': 0.8038238753889253, 'spread_hl_frac': 0.04778286775774941, 'bb_std_mult': 2.7876716689786623, 'rsi_os': 43, 'rsi_ob': 81, 'vol_spike': 0.04726420069031015, 'adx_thresh': 25.623435908786306, 'atr_min_pct': 0.010301308818113815, 'atr_max_pct': 0.015099091024237968, 'tp_mult': 2.2251219392929324, 'tsl_mult': 0.5855310461901543, 'strategy': 'mean_reversion', 'time_stop': 182, 'use_sma': False, 'use_atr': True, 'use_adx': False, 'use_ema': True, 'use_spike': False, 'rsi_required': False, 'edge_k': 0.29635475436929404, 'edge_cap': 0.7128623409082873, 'bull_strategy': 'breakout', 'bull_bb_std_mult': 2.436254703780035, 'bull_rsi_os': 19, 'bull_rsi_ob': 74, 'bull_adx_thresh': 7.216072480163422, 'bull_atr_min_pct': 0.021143831767346726, 'bull_atr_max_pct': 0.08551526662151787, 'bull_tp_mult': 1.0114400490467899, 'bull_tsl_mult': 0.010350180119600483, 'bull_time_stop': 16, 'bull_use_sma': False, 'bull_use_ema': True, 'bull_use_atr': True, 'bull_use_adx': False, 'bull_use_spike': True, 'bull_rsi_required': True, 'bear_strategy': 'mean_reversion', 'bear_bb_std_mult': 2.9139574317080092, 'bear_rsi_os': 46, 'bear_rsi_ob': 74, 'bear_adx_thresh': 26.578455524692153, 'bear_atr_min_pct': 0.009065854654434862, 'bear_atr_max_pct': 0.06789454438209204, 'bear_tp_mult': 1.4478580970608987, 'bear_tsl_mult': 0.08730013987173646, 'bear_time_stop': 83, 'bear_use_sma': True, 'bear_use_ema': False, 'bear_use_atr': True, 'bear_use_adx': False, 'bear_use_spike': True, 'bear_rsi_required': True, 'sideways_strategy': 'breakout', 'sideways_bb_std_mult': 2.1892357034171583, 'sideways_rsi_os': 13, 'sideways_rsi_ob': 77, 'sideways_adx_thresh': 13.988460725809748, 'sideways_atr_min_pct': 0.010750711360934528, 'sideways_atr_max_pct': 0.1059560886614646, 'sideways_tp_mult': 2.5065212051471786, 'sideways_tsl_mult': 0.06695659623050387, 'sideways_time_stop': 222, 'sideways_use_sma': True, 'sideways_use_ema': True, 'sideways_use_atr': False, 'sideways_use_adx': True, 'sideways_use_spike': True, 'sideways_rsi_required': True}.
[I 2025-08-31 10:09:38,799] Trial 119 finished with values: [-1000000000.0, 1000000000.0] and parameters: {'p_sma': 55, 'p_std': 57, 'p_atr': 29, 'p_adx': 8, 'rsi_period': 42, 'ema1': 29, 'ema2': 12, 'slip_atr_k': 0.02848121849161114, 'slip_spread_k': 0.7992307349029082, 'spread_hl_frac': 0.047981956452899724, 'bb_std_mult': 3.1422251101706884, 'rsi_os': 40, 'rsi_ob': 78, 'vol_spike': 0.14751066520014672, 'adx_thresh': 27.517551491820054, 'atr_min_pct': 0.006511524322850499, 'atr_max_pct': 0.01620940675694471, 'tp_mult': 2.2143258954355587, 'tsl_mult': 0.3891347716259843, 'strategy': 'mean_reversion', 'time_stop': 179, 'use_sma': False, 'use_atr': True, 'use_adx': False, 'use_ema': True, 'use_spike': False, 'rsi_required': False, 'edge_k': 0.03275210107099788, 'edge_cap': 0.873566249263186, 'bull_strategy': 'breakout', 'bull_bb_std_mult': 1.9640504291205716, 'bull_rsi_os': 49, 'bull_rsi_ob': 87, 'bull_adx_thresh': 26.327058769681365, 'bull_atr_min_pct': 0.004097790953014397, 'bull_atr_max_pct': 0.08439657276189941, 'bull_tp_mult': 2.0917685681768337, 'bull_tsl_mult': 0.8757686499675921, 'bull_time_stop': 74, 'bull_use_sma': False, 'bull_use_ema': True, 'bull_use_atr': True, 'bull_use_adx': False, 'bull_use_spike': True, 'bull_rsi_required': True, 'bear_strategy': 'mean_reversion', 'bear_bb_std_mult': 2.9025954625523473, 'bear_rsi_os': 46, 'bear_rsi_ob': 76, 'bear_adx_thresh': 26.63833827651192, 'bear_atr_min_pct': 0.008974284267069164, 'bear_atr_max_pct': 0.04262155186396771, 'bear_tp_mult': 1.4420466947197659, 'bear_tsl_mult': 0.09323336404084703, 'bear_time_stop': 94, 'bear_use_sma': False, 'bear_use_ema': False, 'bear_use_atr': True, 'bear_use_adx': False, 'bear_use_spike': True, 'bear_rsi_required': True, 'sideways_strategy': 'breakout', 'sideways_bb_std_mult': 0.9196435973606196, 'sideways_rsi_os': 27, 'sideways_rsi_ob': 80, 'sideways_adx_thresh': 14.01188515023904, 'sideways_atr_min_pct': 0.022042872706650812, 'sideways_atr_max_pct': 0.018483351011409035, 'sideways_tp_mult': 1.0103320881581772, 'sideways_tsl_mult': 0.10419506653051792, 'sideways_time_stop': 204, 'sideways_use_sma': True, 'sideways_use_ema': True, 'sideways_use_atr': False, 'sideways_use_adx': True, 'sideways_use_spike': True, 'sideways_rsi_required': True}.
[I 2025-08-31 10:09:39,044] Trial 122 finished with values: [-1000000000.0, 1000000000.0] and parameters: {'p_sma': 55, 'p_std': 27, 'p_atr': 10, 'p_adx': 15, 'rsi_period': 55, 'ema1': 30, 'ema2': 54, 'slip_atr_k': 0.021964249800133034, 'slip_spread_k': 0.7851078675290633, 'spread_hl_frac': 0.021623209820915718, 'bb_std_mult': 3.145532472101136, 'rsi_os': 28, 'rsi_ob': 78, 'vol_spike': 0.051201047266508384, 'adx_thresh': 25.79853013922632, 'atr_min_pct': 0.02264435675083517, 'atr_max_pct': 0.134445678618903, 'tp_mult': 1.1889558454577993, 'tsl_mult': 0.5122462623300625, 'strategy': 'breakout', 'time_stop': 167, 'use_sma': False, 'use_atr': True, 'use_adx': False, 'use_ema': True, 'use_spike': True, 'rsi_required': False, 'edge_k': 0.2884095147188893, 'edge_cap': 0.8644290011732121, 'bull_strategy': 'mean_reversion', 'bull_bb_std_mult': 0.68960532794568, 'bull_rsi_os': 22, 'bull_rsi_ob': 73, 'bull_adx_thresh': 7.923546954589611, 'bull_atr_min_pct': 0.02149413073135744, 'bull_atr_max_pct': 0.08518389907688469, 'bull_tp_mult': 2.5159208622408036, 'bull_tsl_mult': 0.16538070019823153, 'bull_time_stop': 225, 'bull_use_sma': False, 'bull_use_ema': True, 'bull_use_atr': True, 'bull_use_adx': False, 'bull_use_spike': True, 'bull_rsi_required': True, 'bear_strategy': 'mean_reversion', 'bear_bb_std_mult': 2.8852245104254437, 'bear_rsi_os': 46, 'bear_rsi_ob': 74, 'bear_adx_thresh': 8.275107285937178, 'bear_atr_min_pct': 0.008719137369043319, 'bear_atr_max_pct': 0.04462611827470094, 'bear_tp_mult': 1.4284239450295662, 'bear_tsl_mult': 0.14683596539339921, 'bear_time_stop': 73, 'bear_use_sma': True, 'bear_use_ema': False, 'bear_use_atr': True, 'bear_use_adx': False, 'bear_use_spike': True, 'bear_rsi_required': True, 'sideways_strategy': 'breakout', 'sideways_bb_std_mult': 2.7494372044764126, 'sideways_rsi_os': 13, 'sideways_rsi_ob': 77, 'sideways_adx_thresh': 14.023044418638637, 'sideways_atr_min_pct': 0.010859387885894035, 'sideways_atr_max_pct': 0.01790830734435453, 'sideways_tp_mult': 1.5793200961637859, 'sideways_tsl_mult': 0.12769704172172808, 'sideways_time_stop': 258, 'sideways_use_sma': False, 'sideways_use_ema': True, 'sideways_use_atr': False, 'sideways_use_adx': True, 'sideways_use_spike': True, 'sideways_rsi_required': True}.
[I 2025-08-31 10:10:12,255] Trial 124 finished with values: [-1000000000.0, 1000000000.0] and parameters: {'p_sma': 55, 'p_std': 54, 'p_atr': 10, 'p_adx': 26, 'rsi_period': 55, 'ema1': 16, 'ema2': 35, 'slip_atr_k': 0.09912289911906236, 'slip_spread_k': 0.7155202776563566, 'spread_hl_frac': 0.03922172000191406, 'bb_std_mult': 3.1354084827552615, 'rsi_os': 29, 'rsi_ob': 78, 'vol_spike': 0.1452618988467001, 'adx_thresh': 30.73877875670923, 'atr_min_pct': 0.016450991614858194, 'atr_max_pct': 0.14056973542381984, 'tp_mult': 1.2966508209510919, 'tsl_mult': 0.5088870234812362, 'strategy': 'mean_reversion', 'time_stop': 192, 'use_sma': False, 'use_atr': True, 'use_adx': False, 'use_ema': True, 'use_spike': False, 'rsi_required': False, 'edge_k': 0.3812238102730402, 'edge_cap': 0.8489536577756037, 'bull_strategy': 'mean_reversion', 'bull_bb_std_mult': 2.5028771894160102, 'bull_rsi_os': 20, 'bull_rsi_ob': 88, 'bull_adx_thresh': 11.96603655766234, 'bull_atr_min_pct': 0.012353887026704908, 'bull_atr_max_pct': 0.09672557777240631, 'bull_tp_mult': 1.8124480411868154, 'bull_tsl_mult': 0.15452219178779808, 'bull_time_stop': 90, 'bull_use_sma': False, 'bull_use_ema': True, 'bull_use_atr': True, 'bull_use_adx': False, 'bull_use_spike': True, 'bull_rsi_required': True, 'bear_strategy': 'mean_reversion', 'bear_bb_std_mult': 1.753063205464931, 'bear_rsi_os': 44, 'bear_rsi_ob': 80, 'bear_adx_thresh': 16.29160098798236, 'bear_atr_min_pct': 0.014228527138884148, 'bear_atr_max_pct': 0.05323011714777929, 'bear_tp_mult': 2.7514435720939825, 'bear_tsl_mult': 0.13991792798858796, 'bear_time_stop': 70, 'bear_use_sma': True, 'bear_use_ema': False, 'bear_use_atr': True, 'bear_use_adx': False, 'bear_use_spike': True, 'bear_rsi_required': True, 'sideways_strategy': 'breakout', 'sideways_bb_std_mult': 0.8872105182782979, 'sideways_rsi_os': 26, 'sideways_rsi_ob': 72, 'sideways_adx_thresh': 23.54193113704502, 'sideways_atr_min_pct': 0.013588219526727173, 'sideways_atr_max_pct': 0.02101497208992882, 'sideways_tp_mult': 1.5594718327359538, 'sideways_tsl_mult': 0.024965377670517788, 'sideways_time_stop': 241, 'sideways_use_sma': True, 'sideways_use_ema': True, 'sideways_use_atr': False, 'sideways_use_adx': True, 'sideways_use_spike': True, 'sideways_rsi_required': True}.
[I 2025-08-31 10:10:12,731] Trial 126 finished with values: [-1000000000.0, 1000000000.0] and parameters: {'p_sma': 45, 'p_std': 54, 'p_atr': 12, 'p_adx': 26, 'rsi_period': 14, 'ema1': 18, 'ema2': 34, 'slip_atr_k': 0.08422638634732221, 'slip_spread_k': 0.7154228724784447, 'spread_hl_frac': 0.027088347725885663, 'bb_std_mult': 3.330604725285071, 'rsi_os': 5, 'rsi_ob': 70, 'vol_spike': 0.28157596796453055, 'adx_thresh': 30.57001158258111, 'atr_min_pct': 0.011464798866712308, 'atr_max_pct': 0.14045863510554266, 'tp_mult': 2.4027333591300395, 'tsl_mult': 0.7671829767974108, 'strategy': 'mean_reversion', 'time_stop': 191, 'use_sma': False, 'use_atr': True, 'use_adx': False, 'use_ema': True, 'use_spike': False, 'rsi_required': False, 'edge_k': 0.35818824112828473, 'edge_cap': 0.7757393697425935, 'bull_strategy': 'breakout', 'bull_bb_std_mult': 1.441529235920346, 'bull_rsi_os': 20, 'bull_rsi_ob': 68, 'bull_adx_thresh': 11.932865724978695, 'bull_atr_min_pct': 0.02265008646001259, 'bull_atr_max_pct': 0.025471143977958216, 'bull_tp_mult': 1.82834329744611, 'bull_tsl_mult': 0.8169476528115563, 'bull_time_stop': 297, 'bull_use_sma': True, 'bull_use_ema': True, 'bull_use_atr': False, 'bull_use_adx': False, 'bull_use_spike': True, 'bull_rsi_required': True, 'bear_strategy': 'mean_reversion', 'bear_bb_std_mult': 0.5166938998796413, 'bear_rsi_os': 49, 'bear_rsi_ob': 68, 'bear_adx_thresh': 25.15516236524779, 'bear_atr_min_pct': 0.010278393196965737, 'bear_atr_max_pct': 0.07717505844529152, 'bear_tp_mult': 2.7364983997562287, 'bear_tsl_mult': 0.05989527740209821, 'bear_time_stop': 36, 'bear_use_sma': True, 'bear_use_ema': False, 'bear_use_atr': False, 'bear_use_adx': False, 'bear_use_spike': False, 'bear_rsi_required': True, 'sideways_strategy': 'breakout', 'sideways_bb_std_mult': 0.695579882690434, 'sideways_rsi_os': 24, 'sideways_rsi_ob': 75, 'sideways_adx_thresh': 12.622626992635796, 'sideways_atr_min_pct': 0.01355202151637355, 'sideways_atr_max_pct': 0.130937640130937, 'sideways_tp_mult': 2.9938254517364777, 'sideways_tsl_mult': 0.025509274089604645, 'sideways_time_stop': 241, 'sideways_use_sma': True, 'sideways_use_ema': True, 'sideways_use_atr': True, 'sideways_use_adx': True, 'sideways_use_spike': True, 'sideways_rsi_required': True}.
[I 2025-08-31 10:10:12,845] Trial 123 finished with values: [-1000000000.0, 1000000000.0] and parameters: {'p_sma': 34, 'p_std': 54, 'p_atr': 29, 'p_adx': 26, 'rsi_period': 52, 'ema1': 18, 'ema2': 54, 'slip_atr_k': 0.006003810630441496, 'slip_spread_k': 0.6976505224943231, 'spread_hl_frac': 0.01266647166572344, 'bb_std_mult': 3.147852474886292, 'rsi_os': 46, 'rsi_ob': 70, 'vol_spike': 0.14454287946787034, 'adx_thresh': 27.90576063870048, 'atr_min_pct': 0.022452310363552965, 'atr_max_pct': 0.14059962163479256, 'tp_mult': 1.1984757124057077, 'tsl_mult': 0.5086480070486293, 'strategy': 'mean_reversion', 'time_stop': 192, 'use_sma': False, 'use_atr': True, 'use_adx': False, 'use_ema': True, 'use_spike': False, 'rsi_required': False, 'edge_k': 0.11177706588946676, 'edge_cap': 0.876082122056596, 'bull_strategy': 'mean_reversion', 'bull_bb_std_mult': 1.4617822268660334, 'bull_rsi_os': 20, 'bull_rsi_ob': 68, 'bull_adx_thresh': 12.936974698573422, 'bull_atr_min_pct': 0.02283143032496955, 'bull_atr_max_pct': 0.0971912150175491, 'bull_tp_mult': 1.803898230205082, 'bull_tsl_mult': 0.779909674912875, 'bull_time_stop': 91, 'bull_use_sma': False, 'bull_use_ema': True, 'bull_use_atr': True, 'bull_use_adx': False, 'bull_use_spike': True, 'bull_rsi_required': True, 'bear_strategy': 'mean_reversion', 'bear_bb_std_mult': 1.767747061917711, 'bear_rsi_os': 44, 'bear_rsi_ob': 81, 'bear_adx_thresh': 27.380384957744226, 'bear_atr_min_pct': 0.010377133357956458, 'bear_atr_max_pct': 0.07840550945592911, 'bear_tp_mult': 2.731775587433655, 'bear_tsl_mult': 0.14658928484947525, 'bear_time_stop': 92, 'bear_use_sma': True, 'bear_use_ema': False, 'bear_use_atr': True, 'bear_use_adx': False, 'bear_use_spike': True, 'bear_rsi_required': True, 'sideways_strategy': 'breakout', 'sideways_bb_std_mult': 1.4848396198770244, 'sideways_rsi_os': 24, 'sideways_rsi_ob': 73, 'sideways_adx_thresh': 23.36663783939187, 'sideways_atr_min_pct': 0.013428632486052354, 'sideways_atr_max_pct': 0.016432157948002735, 'sideways_tp_mult': 2.4127765654184916, 'sideways_tsl_mult': 0.02514235133159816, 'sideways_time_stop': 241, 'sideways_use_sma': True, 'sideways_use_ema': True, 'sideways_use_atr': False, 'sideways_use_adx': True, 'sideways_use_spike': True, 'sideways_rsi_required': True}.
