[I 2025-08-31 11:20:37,423] Trial 663 finished with values: [-1000000000.0, 1000000000.0] and parameters: {'p_sma': 14, 'p_std': 48, 'p_atr': 15, 'p_adx': 13, 'rsi_period': 45, 'ema1': 14, 'ema2': 26, 'slip_atr_k': 0.023177212601902863, 'slip_spread_k': 0.631193739860786, 'spread_hl_frac': 0.0029673828743357854, 'bb_std_mult': 3.4615380328669776, 'rsi_os': 25, 'rsi_ob': 79, 'vol_spike': 0.2666348694035345, 'adx_thresh': 28.49259626344869, 'atr_min_pct': 0.005614907615958444, 'atr_max_pct': 0.10379327525047044, 'tp_mult': 2.5221008194160857, 'tsl_mult': 0.26197191036992135, 'strategy': 'breakout', 'time_stop': 174, 'use_sma': True, 'use_atr': False, 'use_adx': True, 'use_ema': True, 'use_spike': True, 'rsi_required': False, 'edge_k': 0.1926023206219699, 'edge_cap': 0.3220640929815669, 'bull_strategy': 'breakout', 'bull_bb_std_mult': 0.6529686905139138, 'bull_rsi_os': 12, 'bull_rsi_ob': 76, 'bull_adx_thresh': 8.615157525374263, 'bull_atr_min_pct': 0.004543904386996247, 'bull_atr_max_pct': 0.09805091018359767, 'bull_tp_mult': 1.9816110189478495, 'bull_tsl_mult': 0.9778801915523319, 'bull_time_stop': 46, 'bull_use_sma': True, 'bull_use_ema': False, 'bull_use_atr': False, 'bull_use_adx': False, 'bull_use_spike': False, 'bull_rsi_required': True, 'bear_strategy': 'mean_reversion', 'bear_bb_std_mult': 2.205267625680548, 'bear_rsi_os': 28, 'bear_rsi_ob': 95, 'bear_adx_thresh': 21.766923213310008, 'bear_atr_min_pct': 0.00992037684929457, 'bear_atr_max_pct': 0.13198332189264292, 'bear_tp_mult': 2.294171407941472, 'bear_tsl_mult': 0.46787297203769357, 'bear_time_stop': 39, 'bear_use_sma': False, 'bear_use_ema': True, 'bear_use_atr': False, 'bear_use_adx': False, 'bear_use_spike': True, 'bear_rsi_required': False, 'sideways_strategy': 'mean_reversion', 'sideways_bb_std_mult': 2.6356440860676145, 'sideways_rsi_os': 9, 'sideways_rsi_ob': 92, 'sideways_adx_thresh': 27.856049279981814, 'sideways_atr_min_pct': 0.027742839222571827, 'sideways_atr_max_pct': 0.0390444985088055, 'sideways_tp_mult': 1.9099462120320208, 'sideways_tsl_mult': 0.08619546681464321, 'sideways_time_stop': 43, 'sideways_use_sma': False, 'sideways_use_ema': False, 'sideways_use_atr': False, 'sideways_use_adx': False, 'sideways_use_spike': True, 'sideways_rsi_required': True}.
[I 2025-08-31 11:20:38,425] Trial 670 finished with values: [-1000000000.0, 1000000000.0] and parameters: {'p_sma': 18, 'p_std': 27, 'p_atr': 11, 'p_adx': 8, 'rsi_period': 48, 'ema1': 15, 'ema2': 30, 'slip_atr_k': 0.015254402429708228, 'slip_spread_k': 0.7245597286759591, 'spread_hl_frac': 0.009861524722150744, 'bb_std_mult': 1.7258834481700382, 'rsi_os': 26, 'rsi_ob': 77, 'vol_spike': 0.25940562661707195, 'adx_thresh': 27.315595619224947, 'atr_min_pct': 0.024601934918170264, 'atr_max_pct': 0.012738502130186985, 'tp_mult': 1.1300548045771843, 'tsl_mult': 0.15274133719161248, 'strategy': 'mean_reversion', 'time_stop': 83, 'use_sma': False, 'use_atr': False, 'use_adx': True, 'use_ema': True, 'use_spike': True, 'rsi_required': True, 'edge_k': 1.2566514259020876, 'edge_cap': 0.4503715086685862, 'bull_strategy': 'mean_reversion', 'bull_bb_std_mult': 0.8803104927494457, 'bull_rsi_os': 10, 'bull_rsi_ob': 74, 'bull_adx_thresh': 7.791837525172795, 'bull_atr_min_pct': 0.003560732721068409, 'bull_atr_max_pct': 0.0944984555128994, 'bull_tp_mult': 2.470356415394725, 'bull_tsl_mult': 0.44507502329451565, 'bull_time_stop': 66, 'bull_use_sma': False, 'bull_use_ema': False, 'bull_use_atr': True, 'bull_use_adx': True, 'bull_use_spike': True, 'bull_rsi_required': True, 'bear_strategy': 'breakout', 'bear_bb_std_mult': 1.5460717197114628, 'bear_rsi_os': 41, 'bear_rsi_ob': 76, 'bear_adx_thresh': 5.227211325007135, 'bear_atr_min_pct': 0.005980737634265148, 'bear_atr_max_pct': 0.12600828311011955, 'bear_tp_mult': 2.9007444444492574, 'bear_tsl_mult': 0.6985467700742776, 'bear_time_stop': 12, 'bear_use_sma': True, 'bear_use_ema': True, 'bear_use_atr': False, 'bear_use_adx': False, 'bear_use_spike': False, 'bear_rsi_required': False, 'sideways_strategy': 'breakout', 'sideways_bb_std_mult': 2.7287080714944927, 'sideways_rsi_os': 8, 'sideways_rsi_ob': 90, 'sideways_adx_thresh': 25.968089512016252, 'sideways_atr_min_pct': 0.018047020682264152, 'sideways_atr_max_pct': 0.08942227605226653, 'sideways_tp_mult': 1.7009310495756043, 'sideways_tsl_mult': 0.1428490594784058, 'sideways_time_stop': 73, 'sideways_use_sma': True, 'sideways_use_ema': False, 'sideways_use_atr': True, 'sideways_use_adx': True, 'sideways_use_spike': False, 'sideways_rsi_required': True}.
[I 2025-08-31 11:21:08,897] Trial 668 finished with values: [-1000000000.0, 1000000000.0] and parameters: {'p_sma': 18, 'p_std': 28, 'p_atr': 11, 'p_adx': 13, 'rsi_period': 48, 'ema1': 14, 'ema2': 60, 'slip_atr_k': 0.02171628222299345, 'slip_spread_k': 0.6143330510050803, 'spread_hl_frac': 0.02694118005616424, 'bb_std_mult': 2.7090403791838193, 'rsi_os': 25, 'rsi_ob': 78, 'vol_spike': 0.2640213121071121, 'adx_thresh': 27.52348495146084, 'atr_min_pct': 0.0013144057436591649, 'atr_max_pct': 0.1085871603293166, 'tp_mult': 2.168245606193249, 'tsl_mult': 0.26437605428070143, 'strategy': 'mean_reversion', 'time_stop': 71, 'use_sma': True, 'use_atr': False, 'use_adx': True, 'use_ema': True, 'use_spike': True, 'rsi_required': True, 'edge_k': 1.2541639151778916, 'edge_cap': 0.3089951969892669, 'bull_strategy': 'breakout', 'bull_bb_std_mult': 0.8901221769119325, 'bull_rsi_os': 10, 'bull_rsi_ob': 73, 'bull_adx_thresh': 32.00770477077283, 'bull_atr_min_pct': 0.003552503498608802, 'bull_atr_max_pct': 0.10317014654382453, 'bull_tp_mult': 1.4937151125954982, 'bull_tsl_mult': 0.9284177497823698, 'bull_time_stop': 68, 'bull_use_sma': True, 'bull_use_ema': False, 'bull_use_atr': False, 'bull_use_adx': False, 'bull_use_spike': True, 'bull_rsi_required': True, 'bear_strategy': 'breakout', 'bear_bb_std_mult': 2.4699705093330873, 'bear_rsi_os': 41, 'bear_rsi_ob': 54, 'bear_adx_thresh': 5.065722719378304, 'bear_atr_min_pct': 0.02323942331757689, 'bear_atr_max_pct': 0.13930530989752024, 'bear_tp_mult': 2.900204800722893, 'bear_tsl_mult': 0.9265180097534458, 'bear_time_stop': 40, 'bear_use_sma': False, 'bear_use_ema': True, 'bear_use_atr': False, 'bear_use_adx': False, 'bear_use_spike': True, 'bear_rsi_required': False, 'sideways_strategy': 'breakout', 'sideways_bb_std_mult': 2.706962564557051, 'sideways_rsi_os': 8, 'sideways_rsi_ob': 93, 'sideways_adx_thresh': 25.71106622010077, 'sideways_atr_min_pct': 0.018234486228767496, 'sideways_atr_max_pct': 0.04362690090719445, 'sideways_tp_mult': 1.1077402988982339, 'sideways_tsl_mult': 0.09835585656572729, 'sideways_time_stop': 24, 'sideways_use_sma': True, 'sideways_use_ema': False, 'sideways_use_atr': True, 'sideways_use_adx': False, 'sideways_use_spike': False, 'sideways_rsi_required': True}.
[I 2025-08-31 11:21:09,386] Trial 667 finished with values: [-1000000000.0, 1000000000.0] and parameters: {'p_sma': 16, 'p_std': 31, 'p_atr': 17, 'p_adx': 19, 'rsi_period': 46, 'ema1': 14, 'ema2': 25, 'slip_atr_k': 0.021487649227437816, 'slip_spread_k': 0.6017054913363894, 'spread_hl_frac': 0.011122711805040122, 'bb_std_mult': 2.6952942463979936, 'rsi_os': 33, 'rsi_ob': 78, 'vol_spike': 0.2660883324131351, 'adx_thresh': 28.249263597135375, 'atr_min_pct': 0.024297836187504827, 'atr_max_pct': 0.14535586257093291, 'tp_mult': 2.045023395429962, 'tsl_mult': 0.6591409389148837, 'strategy': 'mean_reversion', 'time_stop': 140, 'use_sma': True, 'use_atr': False, 'use_adx': True, 'use_ema': True, 'use_spike': True, 'rsi_required': True, 'edge_k': 0.27780749897852525, 'edge_cap': 0.44833834657210037, 'bull_strategy': 'breakout', 'bull_bb_std_mult': 2.770475488282894, 'bull_rsi_os': 12, 'bull_rsi_ob': 76, 'bull_adx_thresh': 6.468766042919018, 'bull_atr_min_pct': 0.02807422013333073, 'bull_atr_max_pct': 0.10366885848462376, 'bull_tp_mult': 2.141739171541564, 'bull_tsl_mult': 0.9865813491218313, 'bull_time_stop': 68, 'bull_use_sma': True, 'bull_use_ema': True, 'bull_use_atr': False, 'bull_use_adx': False, 'bull_use_spike': False, 'bull_rsi_required': True, 'bear_strategy': 'breakout', 'bear_bb_std_mult': 1.9741831768958984, 'bear_rsi_os': 33, 'bear_rsi_ob': 76, 'bear_adx_thresh': 10.516577736047234, 'bear_atr_min_pct': 0.007328005140769891, 'bear_atr_max_pct': 0.13874631022969017, 'bear_tp_mult': 1.282220923693937, 'bear_tsl_mult': 0.4585299175751929, 'bear_time_stop': 300, 'bear_use_sma': False, 'bear_use_ema': True, 'bear_use_atr': False, 'bear_use_adx': False, 'bear_use_spike': True, 'bear_rsi_required': False, 'sideways_strategy': 'mean_reversion', 'sideways_bb_std_mult': 2.4613699947550445, 'sideways_rsi_os': 11, 'sideways_rsi_ob': 93, 'sideways_adx_thresh': 25.883911407890263, 'sideways_atr_min_pct': 0.011154407803200305, 'sideways_atr_max_pct': 0.04381656411808933, 'sideways_tp_mult': 1.4421805801400311, 'sideways_tsl_mult': 0.08670951097014128, 'sideways_time_stop': 126, 'sideways_use_sma': True, 'sideways_use_ema': False, 'sideways_use_atr': False, 'sideways_use_adx': False, 'sideways_use_spike': False, 'sideways_rsi_required': True}.
[I 2025-08-31 11:21:09,604] Trial 669 finished with values: [-1000000000.0, 1000000000.0] and parameters: {'p_sma': 18, 'p_std': 52, 'p_atr': 17, 'p_adx': 13, 'rsi_period': 42, 'ema1': 23, 'ema2': 58, 'slip_atr_k': 0.016506398512727477, 'slip_spread_k': 0.6110037641993168, 'spread_hl_frac': 0.01135343410005351, 'bb_std_mult': 2.6640411494529657, 'rsi_os': 25, 'rsi_ob': 63, 'vol_spike': 0.26023553526922244, 'adx_thresh': 13.389602539376565, 'atr_min_pct': 0.0060598377469982785, 'atr_max_pct': 0.1459544301926773, 'tp_mult': 2.467275628701891, 'tsl_mult': 0.2681537635290889, 'strategy': 'mean_reversion', 'time_stop': 83, 'use_sma': True, 'use_atr': False, 'use_adx': True, 'use_ema': True, 'use_spike': True, 'rsi_required': True, 'edge_k': 0.13942526147905349, 'edge_cap': 0.44810087679081206, 'bull_strategy': 'mean_reversion', 'bull_bb_std_mult': 0.8642592038596804, 'bull_rsi_os': 10, 'bull_rsi_ob': 87, 'bull_adx_thresh': 28.880259080685256, 'bull_atr_min_pct': 0.0036919078448706152, 'bull_atr_max_pct': 0.09437052274872881, 'bull_tp_mult': 1.1027482997317262, 'bull_tsl_mult': 0.4048530327637116, 'bull_time_stop': 235, 'bull_use_sma': False, 'bull_use_ema': False, 'bull_use_atr': False, 'bull_use_adx': False, 'bull_use_spike': True, 'bull_rsi_required': True, 'bear_strategy': 'breakout', 'bear_bb_std_mult': 2.0537574801823197, 'bear_rsi_os': 41, 'bear_rsi_ob': 76, 'bear_adx_thresh': 21.634933799932924, 'bear_atr_min_pct': 0.013558098247151719, 'bear_atr_max_pct': 0.13929995744384335, 'bear_tp_mult': 2.2992674284163614, 'bear_tsl_mult': 0.5211541145324284, 'bear_time_stop': 38, 'bear_use_sma': True, 'bear_use_ema': True, 'bear_use_atr': False, 'bear_use_adx': False, 'bear_use_spike': False, 'bear_rsi_required': False, 'sideways_strategy': 'breakout', 'sideways_bb_std_mult': 2.700483024810843, 'sideways_rsi_os': 32, 'sideways_rsi_ob': 93, 'sideways_adx_thresh': 25.786274055959527, 'sideways_atr_min_pct': 0.01804977282359944, 'sideways_atr_max_pct': 0.043998861233578504, 'sideways_tp_mult': 1.9904734572497167, 'sideways_tsl_mult': 0.7074479830112392, 'sideways_time_stop': 130, 'sideways_use_sma': True, 'sideways_use_ema': False, 'sideways_use_atr': True, 'sideways_use_adx': True, 'sideways_use_spike': False, 'sideways_rsi_required': True}.
[I 2025-08-31 11:21:10,976] Trial 671 finished with values: [-0.02859198647344874, 0.02915554066415776] and parameters: {'p_sma': 29, 'p_std': 31, 'p_atr': 17, 'p_adx': 27, 'rsi_period': 19, 'ema1': 23, 'ema2': 60, 'slip_atr_k': 0.027641798796264494, 'slip_spread_k': 0.36950309692663563, 'spread_hl_frac': 0.011464815449092666, 'bb_std_mult': 2.6792632565714687, 'rsi_os': 7, 'rsi_ob': 78, 'vol_spike': 0.25610190432643953, 'adx_thresh': 27.67069362971924, 'atr_min_pct': 0.01636073362388047, 'atr_max_pct': 0.11999658476567623, 'tp_mult': 2.4780693467504604, 'tsl_mult': 0.2042274554443807, 'strategy': 'mean_reversion', 'time_stop': 70, 'use_sma': True, 'use_atr': False, 'use_adx': True, 'use_ema': False, 'use_spike': True, 'rsi_required': True, 'edge_k': 0.13546672452017822, 'edge_cap': 0.29352353385457625, 'bull_strategy': 'breakout', 'bull_bb_std_mult': 0.775951422409694, 'bull_rsi_os': 10, 'bull_rsi_ob': 72, 'bull_adx_thresh': 7.154926124256868, 'bull_atr_min_pct': 0.002863332214067057, 'bull_atr_max_pct': 0.12947053562613542, 'bull_tp_mult': 1.5210670093956866, 'bull_tsl_mult': 0.40553196394592017, 'bull_time_stop': 89, 'bull_use_sma': True, 'bull_use_ema': False, 'bull_use_atr': False, 'bull_use_adx': False, 'bull_use_spike': False, 'bull_rsi_required': True, 'bear_strategy': 'breakout', 'bear_bb_std_mult': 1.9418956209625189, 'bear_rsi_os': 39, 'bear_rsi_ob': 63, 'bear_adx_thresh': 6.420876598502926, 'bear_atr_min_pct': 0.00434349246019579, 'bear_atr_max_pct': 0.14562900888050032, 'bear_tp_mult': 1.973071158161747, 'bear_tsl_mult': 0.13351384613288453, 'bear_time_stop': 24, 'bear_use_sma': False, 'bear_use_ema': False, 'bear_use_atr': False, 'bear_use_adx': True, 'bear_use_spike': True, 'bear_rsi_required': False, 'sideways_strategy': 'mean_reversion', 'sideways_bb_std_mult': 2.8343348504614605, 'sideways_rsi_os': 32, 'sideways_rsi_ob': 93, 'sideways_adx_thresh': 25.057745478843632, 'sideways_atr_min_pct': 0.023403092220773115, 'sideways_atr_max_pct': 0.04318592136648573, 'sideways_tp_mult': 1.997069260991055, 'sideways_tsl_mult': 0.011983430979425502, 'sideways_time_stop': 26, 'sideways_use_sma': True, 'sideways_use_ema': False, 'sideways_use_atr': False, 'sideways_use_adx': False, 'sideways_use_spike': False, 'sideways_rsi_required': False}.
[I 2025-08-31 11:21:43,170] Trial 672 finished with values: [-1000000000.0, 1000000000.0] and parameters: {'p_sma': 36, 'p_std': 40, 'p_atr': 17, 'p_adx': 15, 'rsi_period': 46, 'ema1': 24, 'ema2': 36, 'slip_atr_k': 0.20495840234915497, 'slip_spread_k': 0.09846357911671222, 'spread_hl_frac': 0.009050883780332718, 'bb_std_mult': 3.039469230430155, 'rsi_os': 24, 'rsi_ob': 76, 'vol_spike': 0.25751271501743334, 'adx_thresh': 19.942992910552068, 'atr_min_pct': 0.00640459870944329, 'atr_max_pct': 0.09222641339614795, 'tp_mult': 1.4320429192033826, 'tsl_mult': 0.2025779428678109, 'strategy': 'breakout', 'time_stop': 80, 'use_sma': True, 'use_atr': False, 'use_adx': True, 'use_ema': False, 'use_spike': True, 'rsi_required': True, 'edge_k': 0.14962615870490337, 'edge_cap': 0.40476918965187836, 'bull_strategy': 'breakout', 'bull_bb_std_mult': 1.8112201521205762, 'bull_rsi_os': 10, 'bull_rsi_ob': 95, 'bull_adx_thresh': 28.71319203900767, 'bull_atr_min_pct': 0.028027329894374647, 'bull_atr_max_pct': 0.08775595081136182, 'bull_tp_mult': 1.2575614365102883, 'bull_tsl_mult': 0.10175471632296385, 'bull_time_stop': 92, 'bull_use_sma': True, 'bull_use_ema': False, 'bull_use_atr': False, 'bull_use_adx': False, 'bull_use_spike': False, 'bull_rsi_required': True, 'bear_strategy': 'breakout', 'bear_bb_std_mult': 1.9326434372579373, 'bear_rsi_os': 39, 'bear_rsi_ob': 93, 'bear_adx_thresh': 6.595020497456406, 'bear_atr_min_pct': 0.02551195564147085, 'bear_atr_max_pct': 0.13185567533952613, 'bear_tp_mult': 2.832202391072787, 'bear_tsl_mult': 0.13086182882736092, 'bear_time_stop': 25, 'bear_use_sma': True, 'bear_use_ema': False, 'bear_use_atr': False, 'bear_use_adx': True, 'bear_use_spike': True, 'bear_rsi_required': True, 'sideways_strategy': 'mean_reversion', 'sideways_bb_std_mult': 2.461650340183475, 'sideways_rsi_os': 52, 'sideways_rsi_ob': 93, 'sideways_adx_thresh': 24.933067167030476, 'sideways_atr_min_pct': 0.0028349783459408126, 'sideways_atr_max_pct': 0.04468192144143912, 'sideways_tp_mult': 2.9480095391903975, 'sideways_tsl_mult': 0.017085442453986632, 'sideways_time_stop': 82, 'sideways_use_sma': False, 'sideways_use_ema': False, 'sideways_use_atr': False, 'sideways_use_adx': True, 'sideways_use_spike': False, 'sideways_rsi_required': False}.
[I 2025-08-31 11:21:43,575] Trial 673 finished with values: [-0.02654230859508988, 0.026802863132260303] and parameters: {'p_sma': 40, 'p_std': 26, 'p_atr': 10, 'p_adx': 15, 'rsi_period': 43, 'ema1': 24, 'ema2': 58, 'slip_atr_k': 0.20500543018045295, 'slip_spread_k': 0.6730535974639554, 'spread_hl_frac': 0.013266770866747345, 'bb_std_mult': 0.921404235716329, 'rsi_os': 38, 'rsi_ob': 62, 'vol_spike': 0.2545743502547865, 'adx_thresh': 26.12926165388516, 'atr_min_pct': 0.006128646607957003, 'atr_max_pct': 0.09184952616999922, 'tp_mult': 2.4662259068935124, 'tsl_mult': 0.19982064624550575, 'strategy': 'breakout', 'time_stop': 119, 'use_sma': False, 'use_atr': False, 'use_adx': True, 'use_ema': False, 'use_spike': False, 'rsi_required': True, 'edge_k': 0.1411340062033516, 'edge_cap': 0.7781924293623175, 'bull_strategy': 'mean_reversion', 'bull_bb_std_mult': 0.7861974357620308, 'bull_rsi_os': 10, 'bull_rsi_ob': 87, 'bull_adx_thresh': 19.013877256827058, 'bull_atr_min_pct': 0.0028173207756609048, 'bull_atr_max_pct': 0.09443782330494901, 'bull_tp_mult': 1.5345061449546895, 'bull_tsl_mult': 0.12337788559925084, 'bull_time_stop': 92, 'bull_use_sma': False, 'bull_use_ema': False, 'bull_use_atr': True, 'bull_use_adx': True, 'bull_use_spike': False, 'bull_rsi_required': True, 'bear_strategy': 'breakout', 'bear_bb_std_mult': 2.0558327487409134, 'bear_rsi_os': 39, 'bear_rsi_ob': 62, 'bear_adx_thresh': 6.546933334769382, 'bear_atr_min_pct': 0.013602760561065083, 'bear_atr_max_pct': 0.1461996039782022, 'bear_tp_mult': 2.8244138986124274, 'bear_tsl_mult': 0.5177004344948167, 'bear_time_stop': 26, 'bear_use_sma': True, 'bear_use_ema': False, 'bear_use_atr': True, 'bear_use_adx': True, 'bear_use_spike': False, 'bear_rsi_required': True, 'sideways_strategy': 'mean_reversion', 'sideways_bb_std_mult': 2.840237454027079, 'sideways_rsi_os': 6, 'sideways_rsi_ob': 94, 'sideways_adx_thresh': 24.803279203347913, 'sideways_atr_min_pct': 0.024853703853660078, 'sideways_atr_max_pct': 0.036325952067613715, 'sideways_tp_mult': 1.9886811697725617, 'sideways_tsl_mult': 0.11333403572003206, 'sideways_time_stop': 20, 'sideways_use_sma': False, 'sideways_use_ema': False, 'sideways_use_atr': False, 'sideways_use_adx': True, 'sideways_use_spike': False, 'sideways_rsi_required': False}.
[I 2025-08-31 11:21:43,954] Trial 675 finished with values: [-1000000000.0, 1000000000.0] and parameters: {'p_sma': 15, 'p_std': 56, 'p_atr': 10, 'p_adx': 15, 'rsi_period': 50, 'ema1': 13, 'ema2': 36, 'slip_atr_k': 0.030598299027241774, 'slip_spread_k': 0.5377739012844898, 'spread_hl_frac': 0.013598332353578288, 'bb_std_mult': 2.8647497910217354, 'rsi_os': 52, 'rsi_ob': 76, 'vol_spike': 0.2770249026119471, 'adx_thresh': 29.541288188080152, 'atr_min_pct': 0.009662023517499209, 'atr_max_pct': 0.09250984939902462, 'tp_mult': 1.4271707052066496, 'tsl_mult': 0.24568623156051875, 'strategy': 'breakout', 'time_stop': 80, 'use_sma': False, 'use_atr': True, 'use_adx': False, 'use_ema': False, 'use_spike': False, 'rsi_required': True, 'edge_k': 0.8472888644194609, 'edge_cap': 0.9653267428213705, 'bull_strategy': 'breakout', 'bull_bb_std_mult': 0.8030328031076323, 'bull_rsi_os': 11, 'bull_rsi_ob': 74, 'bull_adx_thresh': 6.398692431631343, 'bull_atr_min_pct': 0.0050667311823005545, 'bull_atr_max_pct': 0.06977515907754528, 'bull_tp_mult': 1.6351750187776766, 'bull_tsl_mult': 0.09874142941222758, 'bull_time_stop': 95, 'bull_use_sma': True, 'bull_use_ema': False, 'bull_use_atr': True, 'bull_use_adx': True, 'bull_use_spike': False, 'bull_rsi_required': False, 'bear_strategy': 'breakout', 'bear_bb_std_mult': 1.8477936192445772, 'bear_rsi_os': 37, 'bear_rsi_ob': 55, 'bear_adx_thresh': 7.663948096181203, 'bear_atr_min_pct': 0.012014139119124601, 'bear_atr_max_pct': 0.14589308056169467, 'bear_tp_mult': 2.692597354383515, 'bear_tsl_mult': 0.8498096579591523, 'bear_time_stop': 32, 'bear_use_sma': False, 'bear_use_ema': False, 'bear_use_atr': True, 'bear_use_adx': True, 'bear_use_spike': True, 'bear_rsi_required': True, 'sideways_strategy': 'mean_reversion', 'sideways_bb_std_mult': 2.91780238285143, 'sideways_rsi_os': 6, 'sideways_rsi_ob': 91, 'sideways_adx_thresh': 24.822051569230375, 'sideways_atr_min_pct': 0.019085939360047974, 'sideways_atr_max_pct': 0.0808061496153011, 'sideways_tp_mult': 1.8100995568990612, 'sideways_tsl_mult': 0.2953594243747753, 'sideways_time_stop': 150, 'sideways_use_sma': False, 'sideways_use_ema': True, 'sideways_use_atr': False, 'sideways_use_adx': False, 'sideways_use_spike': False, 'sideways_rsi_required': False}.
