[I 2025-08-31 10:07:58,098] Trial 108 finished with values: [-1000000000.0, 1000000000.0] and parameters: {'p_sma': 54, 'p_std': 50, 'p_atr': 11, 'p_adx': 25, 'rsi_period': 45, 'ema1': 28, 'ema2': 57, 'slip_atr_k': 0.011417236739190841, 'slip_spread_k': 0.6774801192648677, 'spread_hl_frac': 0.017015336134329498, 'bb_std_mult': 3.065679141083098, 'rsi_os': 30, 'rsi_ob': 70, 'vol_spike': 0.11790425124711482, 'adx_thresh': 29.703202128497576, 'atr_min_pct': 0.013196948348204078, 'atr_max_pct': 0.12338103462393925, 'tp_mult': 2.3005722544054708, 'tsl_mult': 0.8186030769384693, 'strategy': 'mean_reversion', 'time_stop': 195, 'use_sma': False, 'use_atr': True, 'use_adx': False, 'use_ema': True, 'use_spike': False, 'rsi_required': False, 'edge_k': 0.1524492994046677, 'edge_cap': 0.811264412568279, 'bull_strategy': 'mean_reversion', 'bull_bb_std_mult': 2.342217147181079, 'bull_rsi_os': 14, 'bull_rsi_ob': 72, 'bull_adx_thresh': 9.4864803434619, 'bull_atr_min_pct': 0.01428372413500728, 'bull_atr_max_pct': 0.10216857396125789, 'bull_tp_mult': 2.714262895115278, 'bull_tsl_mult': 0.9082588061369381, 'bull_time_stop': 43, 'bull_use_sma': True, 'bull_use_ema': True, 'bull_use_atr': True, 'bull_use_adx': False, 'bull_use_spike': True, 'bull_rsi_required': True, 'bear_strategy': 'breakout', 'bear_bb_std_mult': 2.7557250619186755, 'bear_rsi_os': 40, 'bear_rsi_ob': 73, 'bear_adx_thresh': 28.737735366297656, 'bear_atr_min_pct': 0.011416178951017507, 'bear_atr_max_pct': 0.058027630123637416, 'bear_tp_mult': 2.3910736293984787, 'bear_tsl_mult': 0.05459738950701073, 'bear_time_stop': 87, 'bear_use_sma': True, 'bear_use_ema': False, 'bear_use_atr': True, 'bear_use_adx': False, 'bear_use_spike': False, 'bear_rsi_required': True, 'sideways_strategy': 'breakout', 'sideways_bb_std_mult': 2.5351729981325573, 'sideways_rsi_os': 22, 'sideways_rsi_ob': 74, 'sideways_adx_thresh': 24.837368104885407, 'sideways_atr_min_pct': 0.012157728535314122, 'sideways_atr_max_pct': 0.1221540800895783, 'sideways_tp_mult': 1.712959037307884, 'sideways_tsl_mult': 0.0006345434239712899, 'sideways_time_stop': 236, 'sideways_use_sma': True, 'sideways_use_ema': True, 'sideways_use_atr': True, 'sideways_use_adx': True, 'sideways_use_spike': True, 'sideways_rsi_required': True}.
[I 2025-08-31 10:07:58,279] Trial 107 finished with values: [-1000000000.0, 1000000000.0] and parameters: {'p_sma': 26, 'p_std': 55, 'p_atr': 11, 'p_adx': 26, 'rsi_period': 33, 'ema1': 28, 'ema2': 57, 'slip_atr_k': 0.012588784632531045, 'slip_spread_k': 0.6093752068272973, 'spread_hl_frac': 0.01723863278596581, 'bb_std_mult': 3.020301485812168, 'rsi_os': 30, 'rsi_ob': 72, 'vol_spike': 0.11583774768597926, 'adx_thresh': 24.083668946942932, 'atr_min_pct': 0.013020074974633901, 'atr_max_pct': 0.12545707472385767, 'tp_mult': 2.4536664137754944, 'tsl_mult': 0.8192473971506719, 'strategy': 'mean_reversion', 'time_stop': 197, 'use_sma': False, 'use_atr': True, 'use_adx': False, 'use_ema': True, 'use_spike': False, 'rsi_required': False, 'edge_k': 0.1622129497701963, 'edge_cap': 0.8041951737415468, 'bull_strategy': 'mean_reversion', 'bull_bb_std_mult': 2.323566013659049, 'bull_rsi_os': 15, 'bull_rsi_ob': 71, 'bull_adx_thresh': 9.382030642328383, 'bull_atr_min_pct': 0.000884515477921316, 'bull_atr_max_pct': 0.10191662021949119, 'bull_tp_mult': 2.709295683010356, 'bull_tsl_mult': 0.908375384693106, 'bull_time_stop': 50, 'bull_use_sma': True, 'bull_use_ema': True, 'bull_use_atr': True, 'bull_use_adx': False, 'bull_use_spike': True, 'bull_rsi_required': True, 'bear_strategy': 'breakout', 'bear_bb_std_mult': 2.61800226616322, 'bear_rsi_os': 40, 'bear_rsi_ob': 72, 'bear_adx_thresh': 29.21979200090881, 'bear_atr_min_pct': 0.01137372877115567, 'bear_atr_max_pct': 0.055893973500059646, 'bear_tp_mult': 2.405566083995368, 'bear_tsl_mult': 0.12320884869720256, 'bear_time_stop': 86, 'bear_use_sma': True, 'bear_use_ema': False, 'bear_use_atr': True, 'bear_use_adx': False, 'bear_use_spike': True, 'bear_rsi_required': True, 'sideways_strategy': 'breakout', 'sideways_bb_std_mult': 2.376471289787729, 'sideways_rsi_os': 15, 'sideways_rsi_ob': 78, 'sideways_adx_thresh': 24.917621250225434, 'sideways_atr_min_pct': 0.012254005479945183, 'sideways_atr_max_pct': 0.12107074035952971, 'sideways_tp_mult': 1.6810509069577733, 'sideways_tsl_mult': 0.01904752682043883, 'sideways_time_stop': 233, 'sideways_use_sma': True, 'sideways_use_ema': True, 'sideways_use_atr': False, 'sideways_use_adx': True, 'sideways_use_spike': True, 'sideways_rsi_required': True}.
[I 2025-08-31 10:08:31,278] Trial 110 finished with values: [-1000000000.0, 1000000000.0] and parameters: {'p_sma': 28, 'p_std': 52, 'p_atr': 9, 'p_adx': 22, 'rsi_period': 45, 'ema1': 21, 'ema2': 60, 'slip_atr_k': 0.008238234492670218, 'slip_spread_k': 0.5987581179913646, 'spread_hl_frac': 0.017111713673894715, 'bb_std_mult': 3.2456409570789404, 'rsi_os': 35, 'rsi_ob': 72, 'vol_spike': 0.11197303917363302, 'adx_thresh': 29.79835891304969, 'atr_min_pct': 0.012757418596193698, 'atr_max_pct': 0.12681371816056208, 'tp_mult': 2.4396705223375346, 'tsl_mult': 0.8521834720580143, 'strategy': 'mean_reversion', 'time_stop': 143, 'use_sma': False, 'use_atr': True, 'use_adx': False, 'use_ema': True, 'use_spike': True, 'rsi_required': False, 'edge_k': 0.23263822190657907, 'edge_cap': 0.9044929887762154, 'bull_strategy': 'breakout', 'bull_bb_std_mult': 2.3511201176091387, 'bull_rsi_os': 20, 'bull_rsi_ob': 75, 'bull_adx_thresh': 8.805078889618935, 'bull_atr_min_pct': 0.028715586353684437, 'bull_atr_max_pct': 0.0903602441209491, 'bull_tp_mult': 2.599360329436292, 'bull_tsl_mult': 0.9652020645297978, 'bull_time_stop': 82, 'bull_use_sma': False, 'bull_use_ema': True, 'bull_use_atr': True, 'bull_use_adx': False, 'bull_use_spike': True, 'bull_rsi_required': True, 'bear_strategy': 'breakout', 'bear_bb_std_mult': 2.694535508028603, 'bear_rsi_os': 43, 'bear_rsi_ob': 70, 'bear_adx_thresh': 27.754409622812805, 'bear_atr_min_pct': 0.011713222153883217, 'bear_atr_max_pct': 0.050762300147966975, 'bear_tp_mult': 2.2939012414432964, 'bear_tsl_mult': 0.007944266145959833, 'bear_time_stop': 69, 'bear_use_sma': True, 'bear_use_ema': False, 'bear_use_atr': True, 'bear_use_adx': False, 'bear_use_spike': False, 'bear_rsi_required': True, 'sideways_strategy': 'breakout', 'sideways_bb_std_mult': 2.567402123098069, 'sideways_rsi_os': 23, 'sideways_rsi_ob': 79, 'sideways_adx_thresh': 24.424272380217655, 'sideways_atr_min_pct': 0.01435511170320056, 'sideways_atr_max_pct': 0.11674030493669092, 'sideways_tp_mult': 1.847475952315829, 'sideways_tsl_mult': 0.0437890338572841, 'sideways_time_stop': 268, 'sideways_use_sma': True, 'sideways_use_ema': True, 'sideways_use_atr': True, 'sideways_use_adx': True, 'sideways_use_spike': True, 'sideways_rsi_required': True}.
[I 2025-08-31 10:08:31,513] Trial 113 finished with values: [-1000000000.0, 1000000000.0] and parameters: {'p_sma': 57, 'p_std': 52, 'p_atr': 9, 'p_adx': 23, 'rsi_period': 41, 'ema1': 25, 'ema2': 59, 'slip_atr_k': 0.05264921345947765, 'slip_spread_k': 0.4336758216518381, 'spread_hl_frac': 0.014865256372405416, 'bb_std_mult': 3.210614453340784, 'rsi_os': 36, 'rsi_ob': 67, 'vol_spike': 0.0630182071945819, 'adx_thresh': 32.04244112965803, 'atr_min_pct': 0.008930284457958394, 'atr_max_pct': 0.0832621856198279, 'tp_mult': 2.3672640134682514, 'tsl_mult': 0.8519344722653873, 'strategy': 'breakout', 'time_stop': 142, 'use_sma': False, 'use_atr': True, 'use_adx': False, 'use_ema': True, 'use_spike': True, 'rsi_required': False, 'edge_k': 0.0909575107293023, 'edge_cap': 0.44948849097251387, 'bull_strategy': 'breakout', 'bull_bb_std_mult': 1.2618137019264597, 'bull_rsi_os': 21, 'bull_rsi_ob': 69, 'bull_adx_thresh': 10.746126638018923, 'bull_atr_min_pct': 0.0034773745906443855, 'bull_atr_max_pct': 0.09096239722272077, 'bull_tp_mult': 2.5676632974321376, 'bull_tsl_mult': 0.4115108288932521, 'bull_time_stop': 63, 'bull_use_sma': False, 'bull_use_ema': True, 'bull_use_atr': False, 'bull_use_adx': False, 'bull_use_spike': True, 'bull_rsi_required': True, 'bear_strategy': 'mean_reversion', 'bear_bb_std_mult': 2.930683031202546, 'bear_rsi_os': 50, 'bear_rsi_ob': 70, 'bear_adx_thresh': 27.941518535396213, 'bear_atr_min_pct': 0.009904369868518849, 'bear_atr_max_pct': 0.0642714286344819, 'bear_tp_mult': 2.323155543108812, 'bear_tsl_mult': 0.9544327762909351, 'bear_time_stop': 109, 'bear_use_sma': True, 'bear_use_ema': False, 'bear_use_atr': False, 'bear_use_adx': False, 'bear_use_spike': True, 'bear_rsi_required': True, 'sideways_strategy': 'breakout', 'sideways_bb_std_mult': 2.284931100891117, 'sideways_rsi_os': 24, 'sideways_rsi_ob': 76, 'sideways_adx_thresh': 21.34547094140094, 'sideways_atr_min_pct': 0.015000252607776024, 'sideways_atr_max_pct': 0.11200292110342662, 'sideways_tp_mult': 2.064377296600525, 'sideways_tsl_mult': 0.04704435734387254, 'sideways_time_stop': 247, 'sideways_use_sma': False, 'sideways_use_ema': True, 'sideways_use_atr': False, 'sideways_use_adx': True, 'sideways_use_spike': True, 'sideways_rsi_required': True}.
[I 2025-08-31 10:08:31,697] Trial 112 finished with values: [-1000000000.0, 1000000000.0] and parameters: {'p_sma': 57, 'p_std': 46, 'p_atr': 9, 'p_adx': 22, 'rsi_period': 50, 'ema1': 25, 'ema2': 59, 'slip_atr_k': 0.01994524357331011, 'slip_spread_k': 0.6209480325738985, 'spread_hl_frac': 0.015205125457931597, 'bb_std_mult': 3.2218890025826763, 'rsi_os': 36, 'rsi_ob': 72, 'vol_spike': 0.11966159635404873, 'adx_thresh': 28.755507257575967, 'atr_min_pct': 0.00899437784879288, 'atr_max_pct': 0.13025065767859295, 'tp_mult': 2.3634692741300145, 'tsl_mult': 0.7654070323407001, 'strategy': 'mean_reversion', 'time_stop': 164, 'use_sma': False, 'use_atr': True, 'use_adx': False, 'use_ema': True, 'use_spike': False, 'rsi_required': False, 'edge_k': 0.06513497858040496, 'edge_cap': 0.6040964785956746, 'bull_strategy': 'breakout', 'bull_bb_std_mult': 2.240806304207702, 'bull_rsi_os': 16, 'bull_rsi_ob': 69, 'bull_adx_thresh': 10.595007882400969, 'bull_atr_min_pct': 0.01881210007173789, 'bull_atr_max_pct': 0.09450221411514663, 'bull_tp_mult': 1.1533094388812275, 'bull_tsl_mult': 0.9785756829435337, 'bull_time_stop': 84, 'bull_use_sma': False, 'bull_use_ema': True, 'bull_use_atr': False, 'bull_use_adx': False, 'bull_use_spike': True, 'bull_rsi_required': True, 'bear_strategy': 'mean_reversion', 'bear_bb_std_mult': 2.587608249061049, 'bear_rsi_os': 43, 'bear_rsi_ob': 70, 'bear_adx_thresh': 28.022794536209222, 'bear_atr_min_pct': 0.012069346309917831, 'bear_atr_max_pct': 0.0641271623121671, 'bear_tp_mult': 2.5648664106425003, 'bear_tsl_mult': 0.9536541300602628, 'bear_time_stop': 112, 'bear_use_sma': True, 'bear_use_ema': False, 'bear_use_atr': False, 'bear_use_adx': False, 'bear_use_spike': True, 'bear_rsi_required': True, 'sideways_strategy': 'breakout', 'sideways_bb_std_mult': 2.2790691028447116, 'sideways_rsi_os': 19, 'sideways_rsi_ob': 83, 'sideways_adx_thresh': 8.35011503488312, 'sideways_atr_min_pct': 0.013850054247621016, 'sideways_atr_max_pct': 0.11088710944076156, 'sideways_tp_mult': 1.7703273229208956, 'sideways_tsl_mult': 0.03498269278959785, 'sideways_time_stop': 244, 'sideways_use_sma': True, 'sideways_use_ema': True, 'sideways_use_atr': False, 'sideways_use_adx': True, 'sideways_use_spike': True, 'sideways_rsi_required': True}.
[I 2025-08-31 10:08:32,200] Trial 111 finished with values: [-1000000000.0, 1000000000.0] and parameters: {'p_sma': 57, 'p_std': 46, 'p_atr': 9, 'p_adx': 23, 'rsi_period': 50, 'ema1': 23, 'ema2': 37, 'slip_atr_k': 0.015423721739597716, 'slip_spread_k': 0.6052887586557028, 'spread_hl_frac': 0.015631437781294708, 'bb_std_mult': 3.251205251088188, 'rsi_os': 32, 'rsi_ob': 67, 'vol_spike': 0.10967802696393755, 'adx_thresh': 29.651082709773043, 'atr_min_pct': 0.012945173478522755, 'atr_max_pct': 0.09511254291157625, 'tp_mult': 2.3500254493345833, 'tsl_mult': 0.8487219554984036, 'strategy': 'mean_reversion', 'time_stop': 203, 'use_sma': False, 'use_atr': True, 'use_adx': False, 'use_ema': True, 'use_spike': False, 'rsi_required': False, 'edge_k': 0.24787349069586592, 'edge_cap': 0.603877205630613, 'bull_strategy': 'breakout', 'bull_bb_std_mult': 2.3197001862667426, 'bull_rsi_os': 12, 'bull_rsi_ob': 72, 'bull_adx_thresh': 10.971469446188458, 'bull_atr_min_pct': 0.028490039727623716, 'bull_atr_max_pct': 0.0949877519041408, 'bull_tp_mult': 2.581984156005992, 'bull_tsl_mult': 0.9621020947696759, 'bull_time_stop': 44, 'bull_use_sma': False, 'bull_use_ema': True, 'bull_use_atr': True, 'bull_use_adx': False, 'bull_use_spike': True, 'bull_rsi_required': True, 'bear_strategy': 'breakout', 'bear_bb_std_mult': 2.586697349828836, 'bear_rsi_os': 37, 'bear_rsi_ob': 70, 'bear_adx_thresh': 29.683250272566642, 'bear_atr_min_pct': 0.011658266663654446, 'bear_atr_max_pct': 0.06114083165969968, 'bear_tp_mult': 1.668080909227771, 'bear_tsl_mult': 0.16289738155496214, 'bear_time_stop': 111, 'bear_use_sma': True, 'bear_use_ema': False, 'bear_use_atr': True, 'bear_use_adx': False, 'bear_use_spike': False, 'bear_rsi_required': True, 'sideways_strategy': 'breakout', 'sideways_bb_std_mult': 2.569665299445321, 'sideways_rsi_os': 23, 'sideways_rsi_ob': 83, 'sideways_adx_thresh': 21.81232661608025, 'sideways_atr_min_pct': 0.01241397465384766, 'sideways_atr_max_pct': 0.11616892207094917, 'sideways_tp_mult': 2.07316606614314, 'sideways_tsl_mult': 0.038856606002340845, 'sideways_time_stop': 250, 'sideways_use_sma': True, 'sideways_use_ema': True, 'sideways_use_atr': True, 'sideways_use_adx': True, 'sideways_use_spike': True, 'sideways_rsi_required': True}.
[I 2025-08-31 10:09:04,786] Trial 114 finished with values: [-1000000000.0, 1000000000.0] and parameters: {'p_sma': 50, 'p_std': 54, 'p_atr': 9, 'p_adx': 24, 'rsi_period': 82, 'ema1': 27, 'ema2': 59, 'slip_atr_k': 0.03971801238119705, 'slip_spread_k': 0.7586146401284672, 'spread_hl_frac': 0.015776669155372576, 'bb_std_mult': 2.9499034064307637, 'rsi_os': 33, 'rsi_ob': 67, 'vol_spike': 0.025890281007145244, 'adx_thresh': 28.69859099593505, 'atr_min_pct': 0.009125695097139222, 'atr_max_pct': 0.1302672295695869, 'tp_mult': 2.9208417515052423, 'tsl_mult': 0.8506208765810317, 'strategy': 'breakout', 'time_stop': 175, 'use_sma': False, 'use_atr': True, 'use_adx': False, 'use_ema': True, 'use_spike': False, 'rsi_required': False, 'edge_k': 0.0865600604113923, 'edge_cap': 0.7695800888644614, 'bull_strategy': 'breakout', 'bull_bb_std_mult': 1.2776702658356929, 'bull_rsi_os': 16, 'bull_rsi_ob': 69, 'bull_adx_thresh': 10.454687784081568, 'bull_atr_min_pct': 0.0017117419871616718, 'bull_atr_max_pct': 0.02015478606149123, 'bull_tp_mult': 1.2310175897297218, 'bull_tsl_mult': 0.8300481950497499, 'bull_time_stop': 61, 'bull_use_sma': False, 'bull_use_ema': True, 'bull_use_atr': False, 'bull_use_adx': False, 'bull_use_spike': True, 'bull_rsi_required': True, 'bear_strategy': 'mean_reversion', 'bear_bb_std_mult': 2.568139976273484, 'bear_rsi_os': 51, 'bear_rsi_ob': 71, 'bear_adx_thresh': 29.75992272988452, 'bear_atr_min_pct': 0.010119123766549942, 'bear_atr_max_pct': 0.06239675259486618, 'bear_tp_mult': 2.4795544929994766, 'bear_tsl_mult': 0.9608565665603379, 'bear_time_stop': 109, 'bear_use_sma': True, 'bear_use_ema': False, 'bear_use_atr': False, 'bear_use_adx': False, 'bear_use_spike': True, 'bear_rsi_required': True, 'sideways_strategy': 'breakout', 'sideways_bb_std_mult': 2.658923805953876, 'sideways_rsi_os': 19, 'sideways_rsi_ob': 84, 'sideways_adx_thresh': 16.273193005416505, 'sideways_atr_min_pct': 0.012681203735648572, 'sideways_atr_max_pct': 0.110452554263874, 'sideways_tp_mult': 1.7608276198809392, 'sideways_tsl_mult': 0.0426437229985423, 'sideways_time_stop': 250, 'sideways_use_sma': False, 'sideways_use_ema': True, 'sideways_use_atr': False, 'sideways_use_adx': True, 'sideways_use_spike': True, 'sideways_rsi_required': True}.
[I 2025-08-31 10:09:05,005] Trial 117 finished with values: [-0.017763812211819996, 0.01755935113925295] and parameters: {'p_sma': 50, 'p_std': 57, 'p_atr': 10, 'p_adx': 26, 'rsi_period': 42, 'ema1': 29, 'ema2': 12, 'slip_atr_k': 0.03925274048629138, 'slip_spread_k': 0.7624980883564372, 'spread_hl_frac': 0.02114843577992443, 'bb_std_mult': 2.9415758519923956, 'rsi_os': 40, 'rsi_ob': 78, 'vol_spike': 0.02293510590820974, 'adx_thresh': 27.128168603120265, 'atr_min_pct': 0.006449104502568966, 'atr_max_pct': 0.13281050185516322, 'tp_mult': 2.213396345394093, 'tsl_mult': 0.5109870189189386, 'strategy': 'mean_reversion', 'time_stop': 168, 'use_sma': False, 'use_atr': True, 'use_adx': False, 'use_ema': True, 'use_spike': False, 'rsi_required': False, 'edge_k': 0.013625148771553519, 'edge_cap': 0.7184971147721326, 'bull_strategy': 'breakout', 'bull_bb_std_mult': 0.7425154003062933, 'bull_rsi_os': 53, 'bull_rsi_ob': 70, 'bull_adx_thresh': 12.744730404535051, 'bull_atr_min_pct': 0.0016495989465362974, 'bull_atr_max_pct': 0.08387107433994995, 'bull_tp_mult': 2.789888111380407, 'bull_tsl_mult': 0.10229569938106986, 'bull_time_stop': 90, 'bull_use_sma': False, 'bull_use_ema': True, 'bull_use_atr': True, 'bull_use_adx': False, 'bull_use_spike': True, 'bull_rsi_required': True, 'bear_strategy': 'mean_reversion', 'bear_bb_std_mult': 2.855210460510026, 'bear_rsi_os': 46, 'bear_rsi_ob': 74, 'bear_adx_thresh': 26.928772389450224, 'bear_atr_min_pct': 0.013048239804089333, 'bear_atr_max_pct': 0.06747574704081635, 'bear_tp_mult': 2.483874114540419, 'bear_tsl_mult': 0.024724834080443903, 'bear_time_stop': 94, 'bear_use_sma': False, 'bear_use_ema': False, 'bear_use_atr': False, 'bear_use_adx': False, 'bear_use_spike': True, 'bear_rsi_required': True, 'sideways_strategy': 'breakout', 'sideways_bb_std_mult': 2.1765278762319062, 'sideways_rsi_os': 16, 'sideways_rsi_ob': 80, 'sideways_adx_thresh': 12.951363942295945, 'sideways_atr_min_pct': 0.012789210587180721, 'sideways_atr_max_pct': 0.1099243298695442, 'sideways_tp_mult': 2.469891107149987, 'sideways_tsl_mult': 0.0760886557096202, 'sideways_time_stop': 223, 'sideways_use_sma': True, 'sideways_use_ema': True, 'sideways_use_atr': False, 'sideways_use_adx': True, 'sideways_use_spike': True, 'sideways_rsi_required': True}.
[I 2025-08-31 10:09:05,146] Trial 116 finished with values: [-1000000000.0, 1000000000.0] and parameters: {'p_sma': 50, 'p_std': 57, 'p_atr': 19, 'p_adx': 8, 'rsi_period': 43, 'ema1': 29, 'ema2': 12, 'slip_atr_k': 0.02856415569272578, 'slip_spread_k': 0.5755678190468176, 'spread_hl_frac': 0.01862051984753741, 'bb_std_mult': 2.937433144716165, 'rsi_os': 33, 'rsi_ob': 68, 'vol_spike': 0.022797683472764785, 'adx_thresh': 27.23343831688565, 'atr_min_pct': 0.006456872908551486, 'atr_max_pct': 0.11902750114976207, 'tp_mult': 2.9460935334573475, 'tsl_mult': 0.8855778856987445, 'strategy': 'mean_reversion', 'time_stop': 174, 'use_sma': False, 'use_atr': True, 'use_adx': False, 'use_ema': True, 'use_spike': False, 'rsi_required': False, 'edge_k': 0.0025979964452716997, 'edge_cap': 0.773220476660778, 'bull_strategy': 'breakout', 'bull_bb_std_mult': 1.9620232326323812, 'bull_rsi_os': 18, 'bull_rsi_ob': 70, 'bull_adx_thresh': 12.5837552451875, 'bull_atr_min_pct': 0.023884351386888318, 'bull_atr_max_pct': 0.09638148871142768, 'bull_tp_mult': 2.8019323258872197, 'bull_tsl_mult': 0.831483110698087, 'bull_time_stop': 74, 'bull_use_sma': False, 'bull_use_ema': True, 'bull_use_atr': True, 'bull_use_adx': False, 'bull_use_spike': True, 'bull_rsi_required': True, 'bear_strategy': 'mean_reversion', 'bear_bb_std_mult': 2.852748490735574, 'bear_rsi_os': 37, 'bear_rsi_ob': 76, 'bear_adx_thresh': 29.76676943328521, 'bear_atr_min_pct': 0.012727529027467478, 'bear_atr_max_pct': 0.059994251365499136, 'bear_tp_mult': 1.1234037611743104, 'bear_tsl_mult': 0.6075720708786468, 'bear_time_stop': 94, 'bear_use_sma': False, 'bear_use_ema': False, 'bear_use_atr': True, 'bear_use_adx': False, 'bear_use_spike': True, 'bear_rsi_required': True, 'sideways_strategy': 'breakout', 'sideways_bb_std_mult': 2.6512791284745565, 'sideways_rsi_os': 16, 'sideways_rsi_ob': 80, 'sideways_adx_thresh': 22.855224368553287, 'sideways_atr_min_pct': 0.012844135238500169, 'sideways_atr_max_pct': 0.11551929864072755, 'sideways_tp_mult': 1.7616111146047546, 'sideways_tsl_mult': 0.0839218137606379, 'sideways_time_stop': 253, 'sideways_use_sma': True, 'sideways_use_ema': True, 'sideways_use_atr': False, 'sideways_use_adx': True, 'sideways_use_spike': True, 'sideways_rsi_required': True}.
