[I 2025-08-31 10:15:09,066] Trial 159 finished with values: [-1000000000.0, 1000000000.0] and parameters: {'p_sma': 18, 'p_std': 19, 'p_atr': 27, 'p_adx': 11, 'rsi_period': 79, 'ema1': 13, 'ema2': 31, 'slip_atr_k': 0.050675170312957166, 'slip_spread_k': 0.6210654089868007, 'spread_hl_frac': 0.010731588479501907, 'bb_std_mult': 3.189091145468847, 'rsi_os': 50, 'rsi_ob': 72, 'vol_spike': 0.010164698562387109, 'adx_thresh': 22.959755997724383, 'atr_min_pct': 0.003019818665444581, 'atr_max_pct': 0.04770693596622987, 'tp_mult': 1.6293537046610496, 'tsl_mult': 0.8486698168617552, 'strategy': 'breakout', 'time_stop': 249, 'use_sma': False, 'use_atr': True, 'use_adx': False, 'use_ema': False, 'use_spike': True, 'rsi_required': False, 'edge_k': 0.37688611810433115, 'edge_cap': 0.6893248300530918, 'bull_strategy': 'breakout', 'bull_bb_std_mult': 0.9104543648875636, 'bull_rsi_os': 46, 'bull_rsi_ob': 56, 'bull_adx_thresh': 22.620369068076375, 'bull_atr_min_pct': 0.002843831399648768, 'bull_atr_max_pct': 0.023162330120445333, 'bull_tp_mult': 1.9724444038832651, 'bull_tsl_mult': 0.13806937429108962, 'bull_time_stop': 97, 'bull_use_sma': True, 'bull_use_ema': True, 'bull_use_atr': False, 'bull_use_adx': False, 'bull_use_spike': False, 'bull_rsi_required': True, 'bear_strategy': 'breakout', 'bear_bb_std_mult': 0.9487351694415025, 'bear_rsi_os': 34, 'bear_rsi_ob': 71, 'bear_adx_thresh': 6.97757776580146, 'bear_atr_min_pct': 0.0118408830460108, 'bear_atr_max_pct': 0.06322069061196336, 'bear_tp_mult': 2.8449600470795056, 'bear_tsl_mult': 0.04696706242937642, 'bear_time_stop': 75, 'bear_use_sma': False, 'bear_use_ema': False, 'bear_use_atr': False, 'bear_use_adx': True, 'bear_use_spike': True, 'bear_rsi_required': True, 'sideways_strategy': 'breakout', 'sideways_bb_std_mult': 2.5639718074419187, 'sideways_rsi_os': 47, 'sideways_rsi_ob': 79, 'sideways_adx_thresh': 25.43649917221745, 'sideways_atr_min_pct': 0.015518691450132077, 'sideways_atr_max_pct': 0.026686834995897746, 'sideways_tp_mult': 2.550672229899835, 'sideways_tsl_mult': 0.039099558833709955, 'sideways_time_stop': 248, 'sideways_use_sma': False, 'sideways_use_ema': True, 'sideways_use_atr': True, 'sideways_use_adx': False, 'sideways_use_spike': False, 'sideways_rsi_required': True}.
[I 2025-08-31 10:15:40,251] Trial 164 finished with values: [-1000000000.0, 1000000000.0] and parameters: {'p_sma': 20, 'p_std': 49, 'p_atr': 27, 'p_adx': 21, 'rsi_period': 80, 'ema1': 27, 'ema2': 17, 'slip_atr_k': 0.026147765980502138, 'slip_spread_k': 0.3591408215228549, 'spread_hl_frac': 0.0011321931723685362, 'bb_std_mult': 3.1788929029420023, 'rsi_os': 31, 'rsi_ob': 73, 'vol_spike': 0.004340719708756102, 'adx_thresh': 28.29418508892401, 'atr_min_pct': 0.005279917237374336, 'atr_max_pct': 0.08357539244628989, 'tp_mult': 2.527992110921335, 'tsl_mult': 0.8916104694214737, 'strategy': 'breakout', 'time_stop': 280, 'use_sma': True, 'use_atr': True, 'use_adx': False, 'use_ema': True, 'use_spike': True, 'rsi_required': False, 'edge_k': 1.4902288686342406, 'edge_cap': 0.8427104835372765, 'bull_strategy': 'breakout', 'bull_bb_std_mult': 1.5622468404839722, 'bull_rsi_os': 43, 'bull_rsi_ob': 95, 'bull_adx_thresh': 23.537717001567227, 'bull_atr_min_pct': 0.00183148917181828, 'bull_atr_max_pct': 0.044367071893180926, 'bull_tp_mult': 1.7454744194073204, 'bull_tsl_mult': 0.33776012882997236, 'bull_time_stop': 186, 'bull_use_sma': True, 'bull_use_ema': True, 'bull_use_atr': True, 'bull_use_adx': False, 'bull_use_spike': True, 'bull_rsi_required': True, 'bear_strategy': 'breakout', 'bear_bb_std_mult': 1.3497651947728824, 'bear_rsi_os': 39, 'bear_rsi_ob': 73, 'bear_adx_thresh': 15.69806383849711, 'bear_atr_min_pct': 0.013779131987590273, 'bear_atr_max_pct': 0.07961830944667515, 'bear_tp_mult': 2.8333296751913526, 'bear_tsl_mult': 0.09420536763276299, 'bear_time_stop': 206, 'bear_use_sma': False, 'bear_use_ema': False, 'bear_use_atr': False, 'bear_use_adx': False, 'bear_use_spike': True, 'bear_rsi_required': True, 'sideways_strategy': 'breakout', 'sideways_bb_std_mult': 2.5790953126293585, 'sideways_rsi_os': 18, 'sideways_rsi_ob': 81, 'sideways_adx_thresh': 24.168294619920456, 'sideways_atr_min_pct': 0.016308412269881892, 'sideways_atr_max_pct': 0.049428934428892686, 'sideways_tp_mult': 2.013808611277365, 'sideways_tsl_mult': 0.03943273157623678, 'sideways_time_stop': 265, 'sideways_use_sma': False, 'sideways_use_ema': True, 'sideways_use_atr': False, 'sideways_use_adx': False, 'sideways_use_spike': True, 'sideways_rsi_required': True}.
[I 2025-08-31 10:15:40,432] Trial 165 finished with values: [-1000000000.0, 1000000000.0] and parameters: {'p_sma': 15, 'p_std': 49, 'p_atr': 30, 'p_adx': 21, 'rsi_period': 45, 'ema1': 16, 'ema2': 26, 'slip_atr_k': 0.025627830865666362, 'slip_spread_k': 0.651575851641076, 'spread_hl_frac': 0.01239244683488447, 'bb_std_mult': 0.620827107121769, 'rsi_os': 26, 'rsi_ob': 74, 'vol_spike': 0.08825504521191607, 'adx_thresh': 27.122122906540188, 'atr_min_pct': 0.005317865668947219, 'atr_max_pct': 0.07519727792811357, 'tp_mult': 2.4289169060661955, 'tsl_mult': 0.8869139778971041, 'strategy': 'breakout', 'time_stop': 227, 'use_sma': True, 'use_atr': True, 'use_adx': False, 'use_ema': True, 'use_spike': True, 'rsi_required': False, 'edge_k': 0.28718356622395114, 'edge_cap': 0.8427050044275894, 'bull_strategy': 'breakout', 'bull_bb_std_mult': 1.5696093148380452, 'bull_rsi_os': 41, 'bull_rsi_ob': 72, 'bull_adx_thresh': 23.66585450294556, 'bull_atr_min_pct': 0.0006782818419381839, 'bull_atr_max_pct': 0.05995581203322645, 'bull_tp_mult': 1.899201546635532, 'bull_tsl_mult': 0.08881096335737404, 'bull_time_stop': 190, 'bull_use_sma': True, 'bull_use_ema': True, 'bull_use_atr': True, 'bull_use_adx': False, 'bull_use_spike': True, 'bull_rsi_required': True, 'bear_strategy': 'breakout', 'bear_bb_std_mult': 1.3678549464283964, 'bear_rsi_os': 51, 'bear_rsi_ob': 73, 'bear_adx_thresh': 14.471913186086415, 'bear_atr_min_pct': 0.013788512307334506, 'bear_atr_max_pct': 0.07878751406338844, 'bear_tp_mult': 2.791337732482261, 'bear_tsl_mult': 0.5271640972271285, 'bear_time_stop': 51, 'bear_use_sma': False, 'bear_use_ema': True, 'bear_use_atr': False, 'bear_use_adx': False, 'bear_use_spike': True, 'bear_rsi_required': False, 'sideways_strategy': 'breakout', 'sideways_bb_std_mult': 2.4646165306032426, 'sideways_rsi_os': 18, 'sideways_rsi_ob': 71, 'sideways_adx_thresh': 24.1997039691723, 'sideways_atr_min_pct': 0.018747866241969037, 'sideways_atr_max_pct': 0.048726722227235716, 'sideways_tp_mult': 1.974455151024768, 'sideways_tsl_mult': 0.0812309101629515, 'sideways_time_stop': 263, 'sideways_use_sma': False, 'sideways_use_ema': False, 'sideways_use_atr': False, 'sideways_use_adx': True, 'sideways_use_spike': True, 'sideways_rsi_required': True}.
[I 2025-08-31 10:15:40,525] Trial 163 finished with values: [-1000000000.0, 1000000000.0] and parameters: {'p_sma': 15, 'p_std': 49, 'p_atr': 27, 'p_adx': 11, 'rsi_period': 80, 'ema1': 16, 'ema2': 53, 'slip_atr_k': 0.12026890870948705, 'slip_spread_k': 0.6433219043128086, 'spread_hl_frac': 0.01222064650831024, 'bb_std_mult': 2.382619609321443, 'rsi_os': 51, 'rsi_ob': 54, 'vol_spike': 0.00024459607033341935, 'adx_thresh': 23.385391589989357, 'atr_min_pct': 0.008580291349369816, 'atr_max_pct': 0.06252695427895603, 'tp_mult': 2.6359659557606596, 'tsl_mult': 0.7630958929711062, 'strategy': 'breakout', 'time_stop': 249, 'use_sma': True, 'use_atr': True, 'use_adx': False, 'use_ema': True, 'use_spike': True, 'rsi_required': False, 'edge_k': 0.3784721186434774, 'edge_cap': 0.7281924157587654, 'bull_strategy': 'breakout', 'bull_bb_std_mult': 0.9120873191414014, 'bull_rsi_os': 43, 'bull_rsi_ob': 51, 'bull_adx_thresh': 23.606596483473275, 'bull_atr_min_pct': 0.0028614198574015053, 'bull_atr_max_pct': 0.02230875930389706, 'bull_tp_mult': 2.8061475298024776, 'bull_tsl_mult': 0.5984626499591432, 'bull_time_stop': 94, 'bull_use_sma': True, 'bull_use_ema': True, 'bull_use_atr': True, 'bull_use_adx': False, 'bull_use_spike': True, 'bull_rsi_required': True, 'bear_strategy': 'breakout', 'bear_bb_std_mult': 1.1080862648968817, 'bear_rsi_os': 45, 'bear_rsi_ob': 73, 'bear_adx_thresh': 15.971984452322005, 'bear_atr_min_pct': 0.011423547536492818, 'bear_atr_max_pct': 0.07923518127289991, 'bear_tp_mult': 1.064149571976377, 'bear_tsl_mult': 0.08758757608341085, 'bear_time_stop': 31, 'bear_use_sma': False, 'bear_use_ema': False, 'bear_use_atr': False, 'bear_use_adx': False, 'bear_use_spike': True, 'bear_rsi_required': True, 'sideways_strategy': 'breakout', 'sideways_bb_std_mult': 0.9987437203621874, 'sideways_rsi_os': 18, 'sideways_rsi_ob': 78, 'sideways_adx_thresh': 24.242925348586198, 'sideways_atr_min_pct': 0.015737830825616708, 'sideways_atr_max_pct': 0.09764430496730613, 'sideways_tp_mult': 2.488987340883657, 'sideways_tsl_mult': 0.039915639754216165, 'sideways_time_stop': 254, 'sideways_use_sma': False, 'sideways_use_ema': False, 'sideways_use_atr': False, 'sideways_use_adx': True, 'sideways_use_spike': True, 'sideways_rsi_required': True}.
[I 2025-08-31 10:15:40,659] Trial 166 finished with values: [-0.00860087143178867, 0.008968433874970374] and parameters: {'p_sma': 14, 'p_std': 25, 'p_atr': 30, 'p_adx': 17, 'rsi_period': 45, 'ema1': 16, 'ema2': 55, 'slip_atr_k': 0.02819673659784072, 'slip_spread_k': 0.6417812341621012, 'spread_hl_frac': 0.012709783774357174, 'bb_std_mult': 0.6438260685039885, 'rsi_os': 26, 'rsi_ob': 74, 'vol_spike': 0.26589854713695055, 'adx_thresh': 29.28664793333661, 'atr_min_pct': 0.00527031084615836, 'atr_max_pct': 0.09231408701161059, 'tp_mult': 2.436070917703451, 'tsl_mult': 0.5955254753026885, 'strategy': 'breakout', 'time_stop': 227, 'use_sma': True, 'use_atr': True, 'use_adx': False, 'use_ema': True, 'use_spike': True, 'rsi_required': False, 'edge_k': 0.14712580744187448, 'edge_cap': 0.8411014538102805, 'bull_strategy': 'breakout', 'bull_bb_std_mult': 0.8286180370797906, 'bull_rsi_os': 41, 'bull_rsi_ob': 72, 'bull_adx_thresh': 24.64644732368317, 'bull_atr_min_pct': 0.00177212309510355, 'bull_atr_max_pct': 0.14531708209060418, 'bull_tp_mult': 1.7081196296977619, 'bull_tsl_mult': 0.4010367193163209, 'bull_time_stop': 79, 'bull_use_sma': True, 'bull_use_ema': True, 'bull_use_atr': True, 'bull_use_adx': False, 'bull_use_spike': True, 'bull_rsi_required': True, 'bear_strategy': 'breakout', 'bear_bb_std_mult': 1.1832200617375452, 'bear_rsi_os': 39, 'bear_rsi_ob': 69, 'bear_adx_thresh': 15.648084438201353, 'bear_atr_min_pct': 0.0039802150072725095, 'bear_atr_max_pct': 0.08103370452051178, 'bear_tp_mult': 2.7871770547519135, 'bear_tsl_mult': 0.5270494933413583, 'bear_time_stop': 47, 'bear_use_sma': False, 'bear_use_ema': True, 'bear_use_atr': False, 'bear_use_adx': False, 'bear_use_spike': True, 'bear_rsi_required': False, 'sideways_strategy': 'breakout', 'sideways_bb_std_mult': 2.796490211315709, 'sideways_rsi_os': 18, 'sideways_rsi_ob': 81, 'sideways_adx_thresh': 24.321965856033334, 'sideways_atr_min_pct': 0.00491574656008459, 'sideways_atr_max_pct': 0.03608153759722494, 'sideways_tp_mult': 1.9924968056121717, 'sideways_tsl_mult': 0.08465615681505342, 'sideways_time_stop': 38, 'sideways_use_sma': False, 'sideways_use_ema': False, 'sideways_use_atr': False, 'sideways_use_adx': True, 'sideways_use_spike': True, 'sideways_rsi_required': True}.
[I 2025-08-31 10:16:11,813] Trial 170 finished with values: [-1000000000.0, 1000000000.0] and parameters: {'p_sma': 22, 'p_std': 31, 'p_atr': 30, 'p_adx': 18, 'rsi_period': 83, 'ema1': 17, 'ema2': 51, 'slip_atr_k': 0.2313534307543489, 'slip_spread_k': 0.6712993103054887, 'spread_hl_frac': 0.022605153112279827, 'bb_std_mult': 0.8375736755990293, 'rsi_os': 25, 'rsi_ob': 75, 'vol_spike': 0.2675519131228326, 'adx_thresh': 20.5183528860555, 'atr_min_pct': 0.0038862617575512546, 'atr_max_pct': 0.09287553546315305, 'tp_mult': 2.058956472874966, 'tsl_mult': 0.5933469495795846, 'strategy': 'breakout', 'time_stop': 225, 'use_sma': True, 'use_atr': True, 'use_adx': False, 'use_ema': False, 'use_spike': True, 'rsi_required': True, 'edge_k': 0.08986515662752524, 'edge_cap': 0.5633927680886495, 'bull_strategy': 'mean_reversion', 'bull_bb_std_mult': 0.6550902605040684, 'bull_rsi_os': 37, 'bull_rsi_ob': 73, 'bull_adx_thresh': 25.497256591075857, 'bull_atr_min_pct': 0.009770744928993467, 'bull_atr_max_pct': 0.1431053050743539, 'bull_tp_mult': 1.330870186797153, 'bull_tsl_mult': 0.4077018303447384, 'bull_time_stop': 69, 'bull_use_sma': True, 'bull_use_ema': True, 'bull_use_atr': False, 'bull_use_adx': False, 'bull_use_spike': False, 'bull_rsi_required': True, 'bear_strategy': 'breakout', 'bear_bb_std_mult': 1.4545622606715791, 'bear_rsi_os': 38, 'bear_rsi_ob': 69, 'bear_adx_thresh': 16.96450348974365, 'bear_atr_min_pct': 0.004448420697691483, 'bear_atr_max_pct': 0.0872376647990026, 'bear_tp_mult': 2.533365461816985, 'bear_tsl_mult': 0.5750289163850872, 'bear_time_stop': 44, 'bear_use_sma': False, 'bear_use_ema': True, 'bear_use_atr': False, 'bear_use_adx': True, 'bear_use_spike': False, 'bear_rsi_required': False, 'sideways_strategy': 'breakout', 'sideways_bb_std_mult': 2.799479392904555, 'sideways_rsi_os': 15, 'sideways_rsi_ob': 81, 'sideways_adx_thresh': 23.49768295098072, 'sideways_atr_min_pct': 0.004779591967853653, 'sideways_atr_max_pct': 0.034672322143619885, 'sideways_tp_mult': 1.97985634078576, 'sideways_tsl_mult': 0.1247175716301081, 'sideways_time_stop': 40, 'sideways_use_sma': False, 'sideways_use_ema': False, 'sideways_use_atr': True, 'sideways_use_adx': False, 'sideways_use_spike': False, 'sideways_rsi_required': True}.
[I 2025-08-31 10:16:12,771] Trial 168 finished with values: [-1000000000.0, 1000000000.0] and parameters: {'p_sma': 55, 'p_std': 50, 'p_atr': 25, 'p_adx': 15, 'rsi_period': 48, 'ema1': 15, 'ema2': 55, 'slip_atr_k': 0.040414474168086016, 'slip_spread_k': 0.6673899472667353, 'spread_hl_frac': 0.014384859486713713, 'bb_std_mult': 0.5127890243711362, 'rsi_os': 39, 'rsi_ob': 49, 'vol_spike': 0.1354694505003148, 'adx_thresh': 32.230342475663925, 'atr_min_pct': 0.0068750883463977955, 'atr_max_pct': 0.11195224963911982, 'tp_mult': 2.675496624962841, 'tsl_mult': 0.5897053874018283, 'strategy': 'breakout', 'time_stop': 290, 'use_sma': False, 'use_atr': True, 'use_adx': False, 'use_ema': True, 'use_spike': True, 'rsi_required': True, 'edge_k': 0.15716104802042732, 'edge_cap': 0.8153868168301202, 'bull_strategy': 'breakout', 'bull_bb_std_mult': 1.0553303317292835, 'bull_rsi_os': 5, 'bull_rsi_ob': 68, 'bull_adx_thresh': 24.517608637547607, 'bull_atr_min_pct': 0.007096260717143296, 'bull_atr_max_pct': 0.03352453226754306, 'bull_tp_mult': 2.9399244465657746, 'bull_tsl_mult': 0.4150143295531127, 'bull_time_stop': 78, 'bull_use_sma': True, 'bull_use_ema': True, 'bull_use_atr': False, 'bull_use_adx': False, 'bull_use_spike': True, 'bull_rsi_required': True, 'bear_strategy': 'breakout', 'bear_bb_std_mult': 0.6984900512327912, 'bear_rsi_os': 10, 'bear_rsi_ob': 69, 'bear_adx_thresh': 17.54240406813368, 'bear_atr_min_pct': 0.004288797711995059, 'bear_atr_max_pct': 0.06924290818961375, 'bear_tp_mult': 1.7813526266507091, 'bear_tsl_mult': 0.02944043768310292, 'bear_time_stop': 179, 'bear_use_sma': False, 'bear_use_ema': False, 'bear_use_atr': False, 'bear_use_adx': False, 'bear_use_spike': False, 'bear_rsi_required': True, 'sideways_strategy': 'breakout', 'sideways_bb_std_mult': 2.3905031148811813, 'sideways_rsi_os': 23, 'sideways_rsi_ob': 90, 'sideways_adx_thresh': 26.401295761896808, 'sideways_atr_min_pct': 0.02475551229063957, 'sideways_atr_max_pct': 0.10878537700793474, 'sideways_tp_mult': 2.936306653736621, 'sideways_tsl_mult': 0.10789612643296156, 'sideways_time_stop': 169, 'sideways_use_sma': False, 'sideways_use_ema': True, 'sideways_use_atr': False, 'sideways_use_adx': True, 'sideways_use_spike': True, 'sideways_rsi_required': True}.
[I 2025-08-31 10:16:12,860] Trial 169 finished with values: [-1000000000.0, 1000000000.0] and parameters: {'p_sma': 54, 'p_std': 50, 'p_atr': 20, 'p_adx': 15, 'rsi_period': 48, 'ema1': 15, 'ema2': 55, 'slip_atr_k': 0.2332267084364144, 'slip_spread_k': 0.6959131484230592, 'spread_hl_frac': 0.02277460923104277, 'bb_std_mult': 2.971254384930585, 'rsi_os': 28, 'rsi_ob': 72, 'vol_spike': 0.13547328097105008, 'adx_thresh': 30.357471571479262, 'atr_min_pct': 0.019129089299762602, 'atr_max_pct': 0.021250767487360003, 'tp_mult': 1.4902319943319475, 'tsl_mult': 0.4860972159414039, 'strategy': 'breakout', 'time_stop': 218, 'use_sma': False, 'use_atr': True, 'use_adx': False, 'use_ema': True, 'use_spike': True, 'rsi_required': True, 'edge_k': 0.06990953800310007, 'edge_cap': 0.8124203218045187, 'bull_strategy': 'breakout', 'bull_bb_std_mult': 1.0810466585768101, 'bull_rsi_os': 41, 'bull_rsi_ob': 82, 'bull_adx_thresh': 24.818093696678854, 'bull_atr_min_pct': 0.01652760357100517, 'bull_atr_max_pct': 0.03946931985325065, 'bull_tp_mult': 1.0762167374457339, 'bull_tsl_mult': 0.3752474482828462, 'bull_time_stop': 80, 'bull_use_sma': True, 'bull_use_ema': True, 'bull_use_atr': False, 'bull_use_adx': False, 'bull_use_spike': True, 'bull_rsi_required': True, 'bear_strategy': 'breakout', 'bear_bb_std_mult': 1.1857623605836987, 'bear_rsi_os': 10, 'bear_rsi_ob': 76, 'bear_adx_thresh': 17.852653884655936, 'bear_atr_min_pct': 0.007975082799536085, 'bear_atr_max_pct': 0.1295440437503755, 'bear_tp_mult': 2.7054843648962112, 'bear_tsl_mult': 0.12391956684081247, 'bear_time_stop': 48, 'bear_use_sma': False, 'bear_use_ema': False, 'bear_use_atr': False, 'bear_use_adx': False, 'bear_use_spike': False, 'bear_rsi_required': True, 'sideways_strategy': 'breakout', 'sideways_bb_std_mult': 2.3495708220588107, 'sideways_rsi_os': 23, 'sideways_rsi_ob': 77, 'sideways_adx_thresh': 31.837125786937715, 'sideways_atr_min_pct': 0.02178681006437549, 'sideways_atr_max_pct': 0.04331437127984638, 'sideways_tp_mult': 1.1869177247398481, 'sideways_tsl_mult': 0.09107790132458533, 'sideways_time_stop': 228, 'sideways_use_sma': False, 'sideways_use_ema': True, 'sideways_use_atr': False, 'sideways_use_adx': True, 'sideways_use_spike': True, 'sideways_rsi_required': True}.
[I 2025-08-31 10:16:12,937] Trial 167 finished with values: [-0.018287976485352186, 0.018095952152150947] and parameters: {'p_sma': 58, 'p_std': 51, 'p_atr': 30, 'p_adx': 17, 'rsi_period': 47, 'ema1': 15, 'ema2': 55, 'slip_atr_k': 0.0916693876030887, 'slip_spread_k': 0.704379336398903, 'spread_hl_frac': 0.01256644763092044, 'bb_std_mult': 0.6415622313412173, 'rsi_os': 39, 'rsi_ob': 74, 'vol_spike': 0.13723810972093198, 'adx_thresh': 29.336691189378303, 'atr_min_pct': 0.0067610656931188385, 'atr_max_pct': 0.03631257530085444, 'tp_mult': 2.6281023184603667, 'tsl_mult': 0.802816485055283, 'strategy': 'breakout', 'time_stop': 226, 'use_sma': True, 'use_atr': True, 'use_adx': False, 'use_ema': True, 'use_spike': True, 'rsi_required': False, 'edge_k': 0.07440041255684261, 'edge_cap': 0.8186433479647702, 'bull_strategy': 'breakout', 'bull_bb_std_mult': 1.6914077285479237, 'bull_rsi_os': 41, 'bull_rsi_ob': 86, 'bull_adx_thresh': 24.61161111678709, 'bull_atr_min_pct': 0.0007648615298924894, 'bull_atr_max_pct': 0.03949500211523038, 'bull_tp_mult': 1.8829106180008668, 'bull_tsl_mult': 0.40478415271644214, 'bull_time_stop': 29, 'bull_use_sma': True, 'bull_use_ema': True, 'bull_use_atr': True, 'bull_use_adx': False, 'bull_use_spike': True, 'bull_rsi_required': True, 'bear_strategy': 'breakout', 'bear_bb_std_mult': 1.0633860051198918, 'bear_rsi_os': 6, 'bear_rsi_ob': 76, 'bear_adx_thresh': 11.959733756992012, 'bear_atr_min_pct': 0.004413733316867537, 'bear_atr_max_pct': 0.08471137566746186, 'bear_tp_mult': 1.1058148091405726, 'bear_tsl_mult': 0.6804426860155702, 'bear_time_stop': 48, 'bear_use_sma': False, 'bear_use_ema': True, 'bear_use_atr': False, 'bear_use_adx': False, 'bear_use_spike': True, 'bear_rsi_required': False, 'sideways_strategy': 'breakout', 'sideways_bb_std_mult': 2.3644465870047457, 'sideways_rsi_os': 23, 'sideways_rsi_ob': 70, 'sideways_adx_thresh': 26.421696752348975, 'sideways_atr_min_pct': 0.025489214719228593, 'sideways_atr_max_pct': 0.039821784943896314, 'sideways_tp_mult': 1.190544307080124, 'sideways_tsl_mult': 0.07840299971472237, 'sideways_time_stop': 37, 'sideways_use_sma': False, 'sideways_use_ema': False, 'sideways_use_atr': False, 'sideways_use_adx': True, 'sideways_use_spike': True, 'sideways_rsi_required': True}.
