[I 2025-08-31 09:57:02,009] Trial 18 finished with values: [-0.015565871349404348, 0.015383924713052869] and parameters: {'p_sma': 6, 'p_std': 5, 'p_atr': 12, 'p_adx': 30, 'rsi_period': 55, 'ema1': 5, 'ema2': 23, 'slip_atr_k': 0.15388937596465307, 'slip_spread_k': 0.17405412790666158, 'spread_hl_frac': 0.011978611935618697, 'bb_std_mult': 1.2515422408820231, 'rsi_os': 14, 'rsi_ob': 95, 'vol_spike': 0.1958762701941055, 'adx_thresh': 5.13325093040025, 'atr_min_pct': 0.02940484528120112, 'atr_max_pct': 0.1479466624315627, 'tp_mult': 2.5250712000895796, 'tsl_mult': 0.9986210100506258, 'strategy': 'mean_reversion', 'time_stop': 11, 'use_sma': True, 'use_atr': False, 'use_adx': True, 'use_ema': False, 'use_spike': False, 'rsi_required': True, 'edge_k': 1.4969344021976447, 'edge_cap': 0.058994970141385106, 'bull_strategy': 'breakout', 'bull_bb_std_mult': 2.9236326063357607, 'bull_rsi_os': 35, 'bull_rsi_ob': 63, 'bull_adx_thresh': 16.40563214019766, 'bull_atr_min_pct': 0.0012197201209684235, 'bull_atr_max_pct': 0.08413751948680866, 'bull_tp_mult': 2.519746565622072, 'bull_tsl_mult': 0.7558192838897594, 'bull_time_stop': 108, 'bull_use_sma': False, 'bull_use_ema': False, 'bull_use_atr': True, 'bull_use_adx': True, 'bull_use_spike': False, 'bull_rsi_required': False, 'bear_strategy': 'mean_reversion', 'bear_bb_std_mult': 2.3352516614815304, 'bear_rsi_os': 26, 'bear_rsi_ob': 60, 'bear_adx_thresh': 34.16957081347219, 'bear_atr_min_pct': 0.02251196878224634, 'bear_atr_max_pct': 0.012963448694787813, 'bear_tp_mult': 2.999639546055954, 'bear_tsl_mult': 0.38581994627732646, 'bear_time_stop': 210, 'bear_use_sma': True, 'bear_use_ema': True, 'bear_use_atr': True, 'bear_use_adx': True, 'bear_use_spike': True, 'bear_rsi_required': False, 'sideways_strategy': 'mean_reversion', 'sideways_bb_std_mult': 3.558612139740726, 'sideways_rsi_os': 38, 'sideways_rsi_ob': 45, 'sideways_adx_thresh': 22.7296662278354, 'sideways_atr_min_pct': 0.029806382102886542, 'sideways_atr_max_pct': 0.11401302408641376, 'sideways_tp_mult': 1.5910920219158802, 'sideways_tsl_mult': 0.350566772657275, 'sideways_time_stop': 115, 'sideways_use_sma': True, 'sideways_use_ema': False, 'sideways_use_atr': False, 'sideways_use_adx': False, 'sideways_use_spike': False, 'sideways_rsi_required': False}.
[I 2025-08-31 09:57:02,217] Trial 19 finished with values: [-1000000000.0, 1000000000.0] and parameters: {'p_sma': 6, 'p_std': 5, 'p_atr': 21, 'p_adx': 30, 'rsi_period': 50, 'ema1': 5, 'ema2': 21, 'slip_atr_k': 0.1496415580979841, 'slip_spread_k': 0.17016196576769393, 'spread_hl_frac': 0.011177055582379922, 'bb_std_mult': 0.5780308531321194, 'rsi_os': 15, 'rsi_ob': 94, 'vol_spike': 0.19386339763392532, 'adx_thresh': 5.071349764125161, 'atr_min_pct': 0.029494559212094047, 'atr_max_pct': 0.1422241375483528, 'tp_mult': 2.532329587062363, 'tsl_mult': 0.9998873794535963, 'strategy': 'mean_reversion', 'time_stop': 8, 'use_sma': True, 'use_atr': False, 'use_adx': False, 'use_ema': False, 'use_spike': True, 'rsi_required': True, 'edge_k': 1.5379057443194823, 'edge_cap': 0.05655069807453707, 'bull_strategy': 'breakout', 'bull_bb_std_mult': 2.9165124392967057, 'bull_rsi_os': 6, 'bull_rsi_ob': 60, 'bull_adx_thresh': 16.89838342544218, 'bull_atr_min_pct': 4.034717954110506e-05, 'bull_atr_max_pct': 0.03613872376376622, 'bull_tp_mult': 1.5611902337919212, 'bull_tsl_mult': 0.7250589839797612, 'bull_time_stop': 6, 'bull_use_sma': False, 'bull_use_ema': True, 'bull_use_atr': False, 'bull_use_adx': True, 'bull_use_spike': True, 'bull_rsi_required': False, 'bear_strategy': 'breakout', 'bear_bb_std_mult': 2.1629309827601704, 'bear_rsi_os': 26, 'bear_rsi_ob': 58, 'bear_adx_thresh': 33.7087481716451, 'bear_atr_min_pct': 0.021914691449694018, 'bear_atr_max_pct': 0.14658087240197215, 'bear_tp_mult': 1.4367736378864455, 'bear_tsl_mult': 0.8464116612269451, 'bear_time_stop': 227, 'bear_use_sma': True, 'bear_use_ema': True, 'bear_use_atr': False, 'bear_use_adx': True, 'bear_use_spike': True, 'bear_rsi_required': False, 'sideways_strategy': 'mean_reversion', 'sideways_bb_std_mult': 3.0490906862382174, 'sideways_rsi_os': 37, 'sideways_rsi_ob': 45, 'sideways_adx_thresh': 5.391659475647701, 'sideways_atr_min_pct': 0.028966440664561773, 'sideways_atr_max_pct': 0.12342838904095486, 'sideways_tp_mult': 2.463482706003445, 'sideways_tsl_mult': 0.36844139830420775, 'sideways_time_stop': 158, 'sideways_use_sma': True, 'sideways_use_ema': False, 'sideways_use_atr': False, 'sideways_use_adx': True, 'sideways_use_spike': False, 'sideways_rsi_required': True}.
[I 2025-08-31 09:57:02,323] Trial 20 finished with values: [-1000000000.0, 1000000000.0] and parameters: {'p_sma': 13, 'p_std': 5, 'p_atr': 20, 'p_adx': 15, 'rsi_period': 54, 'ema1': 5, 'ema2': 38, 'slip_atr_k': 0.1521918127417144, 'slip_spread_k': 0.18787024706147487, 'spread_hl_frac': 0.009730208796798628, 'bb_std_mult': 0.548480714322082, 'rsi_os': 13, 'rsi_ob': 59, 'vol_spike': 0.06537229647414601, 'adx_thresh': 5.640864506301245, 'atr_min_pct': 0.02999565205289526, 'atr_max_pct': 0.09965077073595333, 'tp_mult': 2.55745193514626, 'tsl_mult': 0.2698312661444465, 'strategy': 'mean_reversion', 'time_stop': 43, 'use_sma': True, 'use_atr': False, 'use_adx': False, 'use_ema': False, 'use_spike': True, 'rsi_required': True, 'edge_k': 1.6292913389313846, 'edge_cap': 0.22545010473434351, 'bull_strategy': 'breakout', 'bull_bb_std_mult': 2.033304333062787, 'bull_rsi_os': 12, 'bull_rsi_ob': 58, 'bull_adx_thresh': 11.877207855139366, 'bull_atr_min_pct': 0.02176641220314489, 'bull_atr_max_pct': 0.03668021259948247, 'bull_tp_mult': 1.7777611105000992, 'bull_tsl_mult': 0.790392246244551, 'bull_time_stop': 106, 'bull_use_sma': False, 'bull_use_ema': True, 'bull_use_atr': False, 'bull_use_adx': True, 'bull_use_spike': True, 'bull_rsi_required': False, 'bear_strategy': 'breakout', 'bear_bb_std_mult': 2.230744941240497, 'bear_rsi_os': 25, 'bear_rsi_ob': 57, 'bear_adx_thresh': 34.91568464563872, 'bear_atr_min_pct': 0.023126925222708664, 'bear_atr_max_pct': 0.010207954443103559, 'bear_tp_mult': 1.3915232730218183, 'bear_tsl_mult': 0.8026375234178267, 'bear_time_stop': 239, 'bear_use_sma': True, 'bear_use_ema': True, 'bear_use_atr': False, 'bear_use_adx': True, 'bear_use_spike': True, 'bear_rsi_required': False, 'sideways_strategy': 'mean_reversion', 'sideways_bb_std_mult': 0.5061557934247336, 'sideways_rsi_os': 22, 'sideways_rsi_ob': 54, 'sideways_adx_thresh': 21.64327282541169, 'sideways_atr_min_pct': 0.029883162791387467, 'sideways_atr_max_pct': 0.12254248705375684, 'sideways_tp_mult': 2.452225902852524, 'sideways_tsl_mult': 0.31570419452000476, 'sideways_time_stop': 141, 'sideways_use_sma': True, 'sideways_use_ema': False, 'sideways_use_atr': False, 'sideways_use_adx': True, 'sideways_use_spike': False, 'sideways_rsi_required': True}.
[I 2025-08-31 09:57:36,479] Trial 21 finished with values: [-1000000000.0, 1000000000.0] and parameters: {'p_sma': 14, 'p_std': 12, 'p_atr': 20, 'p_adx': 15, 'rsi_period': 51, 'ema1': 17, 'ema2': 35, 'slip_atr_k': 0.1600792654621229, 'slip_spread_k': 0.19566056631880757, 'spread_hl_frac': 0.008545487326020555, 'bb_std_mult': 0.5603628401816702, 'rsi_os': 6, 'rsi_ob': 60, 'vol_spike': 0.0589073463804505, 'adx_thresh': 9.374595314473689, 'atr_min_pct': 0.014714064002316556, 'atr_max_pct': 0.09695917497011963, 'tp_mult': 2.570190680940784, 'tsl_mult': 0.28119557686362473, 'strategy': 'mean_reversion', 'time_stop': 52, 'use_sma': True, 'use_atr': False, 'use_adx': False, 'use_ema': False, 'use_spike': True, 'rsi_required': True, 'edge_k': 1.372100119884882, 'edge_cap': 0.22551961600831905, 'bull_strategy': 'breakout', 'bull_bb_std_mult': 1.8452096823025959, 'bull_rsi_os': 12, 'bull_rsi_ob': 58, 'bull_adx_thresh': 12.05380221254903, 'bull_atr_min_pct': 0.003829019111080516, 'bull_atr_max_pct': 0.03682139909525125, 'bull_tp_mult': 1.842352561322336, 'bull_tsl_mult': 0.7410871287819449, 'bull_time_stop': 113, 'bull_use_sma': False, 'bull_use_ema': True, 'bull_use_atr': False, 'bull_use_adx': True, 'bull_use_spike': True, 'bull_rsi_required': False, 'bear_strategy': 'breakout', 'bear_bb_std_mult': 1.3794362660544, 'bear_rsi_os': 20, 'bear_rsi_ob': 59, 'bear_adx_thresh': 34.837637392838694, 'bear_atr_min_pct': 0.02289820808233055, 'bear_atr_max_pct': 0.09535367222759941, 'bear_tp_mult': 1.3471979342719687, 'bear_tsl_mult': 0.776650803856727, 'bear_time_stop': 200, 'bear_use_sma': True, 'bear_use_ema': True, 'bear_use_atr': False, 'bear_use_adx': True, 'bear_use_spike': True, 'bear_rsi_required': False, 'sideways_strategy': 'mean_reversion', 'sideways_bb_std_mult': 2.9955681676337136, 'sideways_rsi_os': 23, 'sideways_rsi_ob': 55, 'sideways_adx_thresh': 8.623146290066074, 'sideways_atr_min_pct': 0.02505108514173686, 'sideways_atr_max_pct': 0.12532483232932828, 'sideways_tp_mult': 2.4242993513482993, 'sideways_tsl_mult': 0.5067138488851523, 'sideways_time_stop': 174, 'sideways_use_sma': True, 'sideways_use_ema': False, 'sideways_use_atr': False, 'sideways_use_adx': True, 'sideways_use_spike': False, 'sideways_rsi_required': True}.
[I 2025-08-31 09:57:36,924] Trial 23 finished with values: [-1000000000.0, 1000000000.0] and parameters: {'p_sma': 13, 'p_std': 35, 'p_atr': 10, 'p_adx': 27, 'rsi_period': 56, 'ema1': 17, 'ema2': 38, 'slip_atr_k': 0.1510116113755195, 'slip_spread_k': 0.49811653721214194, 'spread_hl_frac': 0.007894006393961523, 'bb_std_mult': 2.438595719178649, 'rsi_os': 6, 'rsi_ob': 83, 'vol_spike': 0.2342806309229452, 'adx_thresh': 13.24241568728724, 'atr_min_pct': 0.02581260554734415, 'atr_max_pct': 0.10820371567299272, 'tp_mult': 1.8728181139373157, 'tsl_mult': 0.28317415582879757, 'strategy': 'mean_reversion', 'time_stop': 175, 'use_sma': True, 'use_atr': False, 'use_adx': True, 'use_ema': False, 'use_spike': False, 'rsi_required': True, 'edge_k': 1.2149242785090921, 'edge_cap': 0.2528604431100831, 'bull_strategy': 'breakout', 'bull_bb_std_mult': 2.009299677425693, 'bull_rsi_os': 35, 'bull_rsi_ob': 57, 'bull_adx_thresh': 12.375658789946595, 'bull_atr_min_pct': 0.019424680210334826, 'bull_atr_max_pct': 0.07539070178737761, 'bull_tp_mult': 2.3259780346382883, 'bull_tsl_mult': 0.45359473342385115, 'bull_time_stop': 118, 'bull_use_sma': False, 'bull_use_ema': False, 'bull_use_atr': True, 'bull_use_adx': True, 'bull_use_spike': False, 'bull_rsi_required': False, 'bear_strategy': 'mean_reversion', 'bear_bb_std_mult': 1.3294196784878778, 'bear_rsi_os': 17, 'bear_rsi_ob': 83, 'bear_adx_thresh': 29.22111382034504, 'bear_atr_min_pct': 0.013781475822776834, 'bear_atr_max_pct': 0.027673826883728166, 'bear_tp_mult': 2.5885850727405275, 'bear_tsl_mult': 0.2758265610908115, 'bear_time_stop': 263, 'bear_use_sma': True, 'bear_use_ema': True, 'bear_use_atr': True, 'bear_use_adx': True, 'bear_use_spike': True, 'bear_rsi_required': False, 'sideways_strategy': 'mean_reversion', 'sideways_bb_std_mult': 2.9453147772711032, 'sideways_rsi_os': 55, 'sideways_rsi_ob': 56, 'sideways_adx_thresh': 24.83892395868084, 'sideways_atr_min_pct': 0.015892819876569278, 'sideways_atr_max_pct': 0.09939874031899451, 'sideways_tp_mult': 1.8334329685977773, 'sideways_tsl_mult': 0.5492907939752545, 'sideways_time_stop': 88, 'sideways_use_sma': True, 'sideways_use_ema': False, 'sideways_use_atr': False, 'sideways_use_adx': False, 'sideways_use_spike': False, 'sideways_rsi_required': False}.
[I 2025-08-31 09:57:37,401] Trial 22 finished with values: [-1000000000.0, 1000000000.0] and parameters: {'p_sma': 13, 'p_std': 60, 'p_atr': 20, 'p_adx': 28, 'rsi_period': 53, 'ema1': 8, 'ema2': 36, 'slip_atr_k': 0.15395446752525957, 'slip_spread_k': 0.22948011712667032, 'spread_hl_frac': 0.007227826457748199, 'bb_std_mult': 0.5262500682531336, 'rsi_os': 6, 'rsi_ob': 83, 'vol_spike': 0.23117671242010615, 'adx_thresh': 13.999228143791253, 'atr_min_pct': 0.02573176246953119, 'atr_max_pct': 0.10577074476997368, 'tp_mult': 1.7113425129346271, 'tsl_mult': 0.3655739579662597, 'strategy': 'mean_reversion', 'time_stop': 173, 'use_sma': True, 'use_atr': False, 'use_adx': True, 'use_ema': False, 'use_spike': False, 'rsi_required': True, 'edge_k': 1.220141402828698, 'edge_cap': 0.24701588348926315, 'bull_strategy': 'breakout', 'bull_bb_std_mult': 1.9333047670473802, 'bull_rsi_os': 36, 'bull_rsi_ob': 58, 'bull_adx_thresh': 10.754204419967648, 'bull_atr_min_pct': 0.020124867124619864, 'bull_atr_max_pct': 0.0615911845578241, 'bull_tp_mult': 2.3784939363695576, 'bull_tsl_mult': 0.49673625345050315, 'bull_time_stop': 124, 'bull_use_sma': False, 'bull_use_ema': False, 'bull_use_atr': True, 'bull_use_adx': True, 'bull_use_spike': False, 'bull_rsi_required': False, 'bear_strategy': 'mean_reversion', 'bear_bb_std_mult': 2.0131666388729337, 'bear_rsi_os': 17, 'bear_rsi_ob': 61, 'bear_adx_thresh': 29.044134810444334, 'bear_atr_min_pct': 0.023230004616021333, 'bear_atr_max_pct': 0.027114992096111304, 'bear_tp_mult': 2.540556984791891, 'bear_tsl_mult': 0.008363779286726047, 'bear_time_stop': 252, 'bear_use_sma': True, 'bear_use_ema': True, 'bear_use_atr': True, 'bear_use_adx': True, 'bear_use_spike': True, 'bear_rsi_required': False, 'sideways_strategy': 'mean_reversion', 'sideways_bb_std_mult': 2.968810944677058, 'sideways_rsi_os': 33, 'sideways_rsi_ob': 55, 'sideways_adx_thresh': 25.49438230592346, 'sideways_atr_min_pct': 0.017581463520327384, 'sideways_atr_max_pct': 0.12208301456660448, 'sideways_tp_mult': 1.3325674660451547, 'sideways_tsl_mult': 0.4953006549680297, 'sideways_time_stop': 164, 'sideways_use_sma': True, 'sideways_use_ema': False, 'sideways_use_atr': False, 'sideways_use_adx': False, 'sideways_use_spike': False, 'sideways_rsi_required': False}.
[I 2025-08-31 09:57:38,142] Trial 24 finished with values: [-1000000000.0, 1000000000.0] and parameters: {'p_sma': 13, 'p_std': 13, 'p_atr': 11, 'p_adx': 28, 'rsi_period': 26, 'ema1': 8, 'ema2': 26, 'slip_atr_k': 0.01142835638714862, 'slip_spread_k': 0.42705654598855347, 'spread_hl_frac': 0.022609364756501642, 'bb_std_mult': 3.5286728655373185, 'rsi_os': 6, 'rsi_ob': 87, 'vol_spike': 0.1681268092083062, 'adx_thresh': 10.722044798437004, 'atr_min_pct': 0.026367391000049478, 'atr_max_pct': 0.11430101574792201, 'tp_mult': 1.7430875413520617, 'tsl_mult': 0.8845580409748159, 'strategy': 'mean_reversion', 'time_stop': 172, 'use_sma': True, 'use_atr': False, 'use_adx': True, 'use_ema': False, 'use_spike': False, 'rsi_required': True, 'edge_k': 1.2196133084348115, 'edge_cap': 0.17189897245782548, 'bull_strategy': 'breakout', 'bull_bb_std_mult': 3.1405548395939946, 'bull_rsi_os': 35, 'bull_rsi_ob': 64, 'bull_adx_thresh': 19.20581663810059, 'bull_atr_min_pct': 0.019646165881687647, 'bull_atr_max_pct': 0.07162227110486431, 'bull_tp_mult': 2.284886088429663, 'bull_tsl_mult': 0.6282923553416541, 'bull_time_stop': 117, 'bull_use_sma': False, 'bull_use_ema': False, 'bull_use_atr': True, 'bull_use_adx': True, 'bull_use_spike': False, 'bull_rsi_required': False, 'bear_strategy': 'mean_reversion', 'bear_bb_std_mult': 2.6104781229447105, 'bear_rsi_os': 18, 'bear_rsi_ob': 62, 'bear_adx_thresh': 29.644388651710553, 'bear_atr_min_pct': 0.014377907760186034, 'bear_atr_max_pct': 0.02706126749961984, 'bear_tp_mult': 2.6312061729850384, 'bear_tsl_mult': 0.34445306381233176, 'bear_time_stop': 188, 'bear_use_sma': True, 'bear_use_ema': True, 'bear_use_atr': True, 'bear_use_adx': True, 'bear_use_spike': True, 'bear_rsi_required': False, 'sideways_strategy': 'mean_reversion', 'sideways_bb_std_mult': 3.0715728710094377, 'sideways_rsi_os': 44, 'sideways_rsi_ob': 53, 'sideways_adx_thresh': 24.72796484531079, 'sideways_atr_min_pct': 0.02516734878135231, 'sideways_atr_max_pct': 0.10308452722538629, 'sideways_tp_mult': 1.762735809315015, 'sideways_tsl_mult': 0.5127050929082495, 'sideways_time_stop': 84, 'sideways_use_sma': True, 'sideways_use_ema': False, 'sideways_use_atr': False, 'sideways_use_adx': False, 'sideways_use_spike': False, 'sideways_rsi_required': False}.
[I 2025-08-31 09:58:13,043] Trial 27 finished with values: [-1000000000.0, 1000000000.0] and parameters: {'p_sma': 10, 'p_std': 11, 'p_atr': 14, 'p_adx': 22, 'rsi_period': 29, 'ema1': 12, 'ema2': 27, 'slip_atr_k': 0.1250653734800679, 'slip_spread_k': 0.416898200454919, 'spread_hl_frac': 0.0214048242889939, 'bb_std_mult': 1.239150489045462, 'rsi_os': 11, 'rsi_ob': 90, 'vol_spike': 0.15384989891914364, 'adx_thresh': 9.196807336793007, 'atr_min_pct': 0.02742823098810453, 'atr_max_pct': 0.1341668482330828, 'tp_mult': 2.3694141095876984, 'tsl_mult': 0.926086281835, 'strategy': 'mean_reversion', 'time_stop': 203, 'use_sma': True, 'use_atr': False, 'use_adx': True, 'use_ema': False, 'use_spike': False, 'rsi_required': True, 'edge_k': 0.7506033396073897, 'edge_cap': 0.14534324394286074, 'bull_strategy': 'breakout', 'bull_bb_std_mult': 3.149112348854678, 'bull_rsi_os': 29, 'bull_rsi_ob': 64, 'bull_adx_thresh': 19.995867297700517, 'bull_atr_min_pct': 0.029183817472217887, 'bull_atr_max_pct': 0.0861777218042875, 'bull_tp_mult': 2.6516025488923445, 'bull_tsl_mult': 0.646640861248789, 'bull_time_stop': 202, 'bull_use_sma': False, 'bull_use_ema': False, 'bull_use_atr': True, 'bull_use_adx': True, 'bull_use_spike': False, 'bull_rsi_required': True, 'bear_strategy': 'mean_reversion', 'bear_bb_std_mult': 2.682360639312251, 'bear_rsi_os': 31, 'bear_rsi_ob': 52, 'bear_adx_thresh': 26.698007300631865, 'bear_atr_min_pct': 0.025835819635252676, 'bear_atr_max_pct': 0.023646035451297193, 'bear_tp_mult': 2.9240999637868796, 'bear_tsl_mult': 0.49099059549079616, 'bear_time_stop': 188, 'bear_use_sma': True, 'bear_use_ema': True, 'bear_use_atr': True, 'bear_use_adx': True, 'bear_use_spike': True, 'bear_rsi_required': False, 'sideways_strategy': 'mean_reversion', 'sideways_bb_std_mult': 3.2416316185917333, 'sideways_rsi_os': 46, 'sideways_rsi_ob': 51, 'sideways_adx_thresh': 18.151138577812297, 'sideways_atr_min_pct': 0.02587088054874123, 'sideways_atr_max_pct': 0.1031197262048843, 'sideways_tp_mult': 1.7565837635347004, 'sideways_tsl_mult': 0.2300345561732754, 'sideways_time_stop': 120, 'sideways_use_sma': True, 'sideways_use_ema': False, 'sideways_use_atr': False, 'sideways_use_adx': False, 'sideways_use_spike': False, 'sideways_rsi_required': False}.
[I 2025-08-31 09:58:13,044] Trial 26 finished with values: [-1000000000.0, 1000000000.0] and parameters: {'p_sma': 10, 'p_std': 13, 'p_atr': 13, 'p_adx': 28, 'rsi_period': 29, 'ema1': 9, 'ema2': 25, 'slip_atr_k': 0.0058482050208116115, 'slip_spread_k': 0.40582175693627925, 'spread_hl_frac': 0.02274284419713905, 'bb_std_mult': 3.53229735831444, 'rsi_os': 10, 'rsi_ob': 89, 'vol_spike': 0.16209108834868685, 'adx_thresh': 8.151473528966518, 'atr_min_pct': 0.026873394993296315, 'atr_max_pct': 0.1347702926672964, 'tp_mult': 1.7369340326946154, 'tsl_mult': 0.9249438807577071, 'strategy': 'mean_reversion', 'time_stop': 192, 'use_sma': True, 'use_atr': False, 'use_adx': True, 'use_ema': False, 'use_spike': False, 'rsi_required': True, 'edge_k': 0.8429854527458566, 'edge_cap': 0.160320185648215, 'bull_strategy': 'breakout', 'bull_bb_std_mult': 2.7723717409392714, 'bull_rsi_os': 34, 'bull_rsi_ob': 64, 'bull_adx_thresh': 30.54150866903479, 'bull_atr_min_pct': 0.011607164322384428, 'bull_atr_max_pct': 0.08964133260803633, 'bull_tp_mult': 2.9870548134648836, 'bull_tsl_mult': 0.6130007881020915, 'bull_time_stop': 195, 'bull_use_sma': False, 'bull_use_ema': False, 'bull_use_atr': True, 'bull_use_adx': True, 'bull_use_spike': False, 'bull_rsi_required': True, 'bear_strategy': 'mean_reversion', 'bear_bb_std_mult': 2.6791752591217888, 'bear_rsi_os': 33, 'bear_rsi_ob': 64, 'bear_adx_thresh': 31.42804431845242, 'bear_atr_min_pct': 0.024857053000763955, 'bear_atr_max_pct': 0.02558786256124492, 'bear_tp_mult': 2.949868995718549, 'bear_tsl_mult': 0.02902345072588014, 'bear_time_stop': 185, 'bear_use_sma': True, 'bear_use_ema': True, 'bear_use_atr': True, 'bear_use_adx': True, 'bear_use_spike': True, 'bear_rsi_required': False, 'sideways_strategy': 'mean_reversion', 'sideways_bb_std_mult': 3.2490338635416824, 'sideways_rsi_os': 33, 'sideways_rsi_ob': 62, 'sideways_adx_thresh': 17.59751905022076, 'sideways_atr_min_pct': 0.025824545062418464, 'sideways_atr_max_pct': 0.1076092733683601, 'sideways_tp_mult': 1.388390745455481, 'sideways_tsl_mult': 0.22063984862397082, 'sideways_time_stop': 125, 'sideways_use_sma': True, 'sideways_use_ema': False, 'sideways_use_atr': False, 'sideways_use_adx': False, 'sideways_use_spike': False, 'sideways_rsi_required': False}.
