[I 2025-08-31 10:01:25,133] Trial 53 finished with values: [-1000000000.0, 1000000000.0] and parameters: {'p_sma': 10, 'p_std': 7, 'p_atr': 18, 'p_adx': 27, 'rsi_period': 67, 'ema1': 15, 'ema2': 44, 'slip_atr_k': 0.10614115789507216, 'slip_spread_k': 0.7146290530575836, 'spread_hl_frac': 0.038150701812389595, 'bb_std_mult': 0.8286715326673113, 'rsi_os': 9, 'rsi_ob': 85, 'vol_spike': 0.24668884077965889, 'adx_thresh': 26.369939807991898, 'atr_min_pct': 0.01948039741131828, 'atr_max_pct': 0.12397130804138495, 'tp_mult': 2.2463035699237857, 'tsl_mult': 0.6836504293635451, 'strategy': 'mean_reversion', 'time_stop': 101, 'use_sma': False, 'use_atr': False, 'use_adx': True, 'use_ema': False, 'use_spike': False, 'rsi_required': True, 'edge_k': 1.103270899212177, 'edge_cap': 0.3612724628273851, 'bull_strategy': 'mean_reversion', 'bull_bb_std_mult': 2.5186330766511977, 'bull_rsi_os': 22, 'bull_rsi_ob': 79, 'bull_adx_thresh': 15.581199980255013, 'bull_atr_min_pct': 0.023686909031333178, 'bull_atr_max_pct': 0.05819384668749952, 'bull_tp_mult': 2.463590601805573, 'bull_tsl_mult': 0.21003018056305822, 'bull_time_stop': 153, 'bull_use_sma': True, 'bull_use_ema': False, 'bull_use_atr': True, 'bull_use_adx': False, 'bull_use_spike': True, 'bull_rsi_required': False, 'bear_strategy': 'breakout', 'bear_bb_std_mult': 0.6397958451482444, 'bear_rsi_os': 29, 'bear_rsi_ob': 49, 'bear_adx_thresh': 7.477662855597778, 'bear_atr_min_pct': 0.024148933467048894, 'bear_atr_max_pct': 0.1029415762560005, 'bear_tp_mult': 2.182258825996914, 'bear_tsl_mult': 0.10723801077644657, 'bear_time_stop': 56, 'bear_use_sma': True, 'bear_use_ema': True, 'bear_use_atr': False, 'bear_use_adx': True, 'bear_use_spike': False, 'bear_rsi_required': False, 'sideways_strategy': 'mean_reversion', 'sideways_bb_std_mult': 0.7798688353792713, 'sideways_rsi_os': 10, 'sideways_rsi_ob': 45, 'sideways_adx_thresh': 17.161391119804033, 'sideways_atr_min_pct': 0.028958365657909758, 'sideways_atr_max_pct': 0.09621847764130985, 'sideways_tp_mult': 1.0496724393522059, 'sideways_tsl_mult': 0.7424229510279986, 'sideways_time_stop': 245, 'sideways_use_sma': True, 'sideways_use_ema': True, 'sideways_use_atr': True, 'sideways_use_adx': False, 'sideways_use_spike': False, 'sideways_rsi_required': False}.
[I 2025-08-31 10:01:57,390] Trial 55 finished with values: [-0.020637536485654695, 0.02077948199218593] and parameters: {'p_sma': 11, 'p_std': 6, 'p_atr': 9, 'p_adx': 27, 'rsi_period': 66, 'ema1': 6, 'ema2': 55, 'slip_atr_k': 0.16371758102426082, 'slip_spread_k': 0.28226774595201826, 'spread_hl_frac': 0.011045532496849307, 'bb_std_mult': 0.7549244241745674, 'rsi_os': 15, 'rsi_ob': 86, 'vol_spike': 0.17735511612987517, 'adx_thresh': 5.167097878902131, 'atr_min_pct': 0.02848364994773922, 'atr_max_pct': 0.1421586084575987, 'tp_mult': 2.2303612506745214, 'tsl_mult': 0.5937458823937012, 'strategy': 'mean_reversion', 'time_stop': 23, 'use_sma': True, 'use_atr': False, 'use_adx': True, 'use_ema': False, 'use_spike': True, 'rsi_required': True, 'edge_k': 1.0944795776042193, 'edge_cap': 0.050746248739233335, 'bull_strategy': 'mean_reversion', 'bull_bb_std_mult': 3.0231948684967174, 'bull_rsi_os': 23, 'bull_rsi_ob': 61, 'bull_adx_thresh': 17.668731272389298, 'bull_atr_min_pct': 0.003596079772220437, 'bull_atr_max_pct': 0.07754017433730939, 'bull_tp_mult': 2.426820968332292, 'bull_tsl_mult': 0.07946693786506759, 'bull_time_stop': 148, 'bull_use_sma': True, 'bull_use_ema': False, 'bull_use_atr': False, 'bull_use_adx': True, 'bull_use_spike': True, 'bull_rsi_required': False, 'bear_strategy': 'breakout', 'bear_bb_std_mult': 1.677612827658841, 'bear_rsi_os': 21, 'bear_rsi_ob': 60, 'bear_adx_thresh': 7.745835990767366, 'bear_atr_min_pct': 0.018688386068864485, 'bear_atr_max_pct': 0.06910094384824712, 'bear_tp_mult': 2.9869800703125056, 'bear_tsl_mult': 0.3552275708352585, 'bear_time_stop': 223, 'bear_use_sma': True, 'bear_use_ema': True, 'bear_use_atr': False, 'bear_use_adx': True, 'bear_use_spike': True, 'bear_rsi_required': False, 'sideways_strategy': 'mean_reversion', 'sideways_bb_std_mult': 0.8347738651462253, 'sideways_rsi_os': 52, 'sideways_rsi_ob': 45, 'sideways_adx_thresh': 13.304193019578141, 'sideways_atr_min_pct': 0.02886525625015113, 'sideways_atr_max_pct': 0.09320523098019291, 'sideways_tp_mult': 1.33691982672426, 'sideways_tsl_mult': 0.7690384671768045, 'sideways_time_stop': 128, 'sideways_use_sma': True, 'sideways_use_ema': True, 'sideways_use_atr': True, 'sideways_use_adx': False, 'sideways_use_spike': False, 'sideways_rsi_required': True}.
[I 2025-08-31 10:01:57,649] Trial 58 finished with values: [-1000000000.0, 1000000000.0] and parameters: {'p_sma': 57, 'p_std': 10, 'p_atr': 12, 'p_adx': 27, 'rsi_period': 39, 'ema1': 6, 'ema2': 33, 'slip_atr_k': 0.17012740478902974, 'slip_spread_k': 0.28382469844759073, 'spread_hl_frac': 0.02541625808134469, 'bb_std_mult': 1.0964446972961008, 'rsi_os': 15, 'rsi_ob': 76, 'vol_spike': 0.07870869270868003, 'adx_thresh': 5.006897146196845, 'atr_min_pct': 0.02794525245508213, 'atr_max_pct': 0.14342694115870364, 'tp_mult': 2.52184591109295, 'tsl_mult': 0.57036159686705, 'strategy': 'breakout', 'time_stop': 227, 'use_sma': True, 'use_atr': False, 'use_adx': False, 'use_ema': True, 'use_spike': True, 'rsi_required': False, 'edge_k': 1.9138215283665838, 'edge_cap': 0.05034013619977893, 'bull_strategy': 'breakout', 'bull_bb_std_mult': 1.0634020220984284, 'bull_rsi_os': 14, 'bull_rsi_ob': 62, 'bull_adx_thresh': 9.251975866020956, 'bull_atr_min_pct': 0.0037621500569114405, 'bull_atr_max_pct': 0.02919841784207025, 'bull_tp_mult': 1.031915950014393, 'bull_tsl_mult': 0.7703640115623924, 'bull_time_stop': 98, 'bull_use_sma': False, 'bull_use_ema': True, 'bull_use_atr': False, 'bull_use_adx': True, 'bull_use_spike': False, 'bull_rsi_required': True, 'bear_strategy': 'mean_reversion', 'bear_bb_std_mult': 1.645904166654974, 'bear_rsi_os': 20, 'bear_rsi_ob': 92, 'bear_adx_thresh': 28.116792943635343, 'bear_atr_min_pct': 0.0019822920781409435, 'bear_atr_max_pct': 0.07322549836379555, 'bear_tp_mult': 2.999969590450765, 'bear_tsl_mult': 0.3606452932127898, 'bear_time_stop': 224, 'bear_use_sma': False, 'bear_use_ema': True, 'bear_use_atr': True, 'bear_use_adx': False, 'bear_use_spike': True, 'bear_rsi_required': True, 'sideways_strategy': 'mean_reversion', 'sideways_bb_std_mult': 3.485886743928487, 'sideways_rsi_os': 24, 'sideways_rsi_ob': 82, 'sideways_adx_thresh': 31.9545012192509, 'sideways_atr_min_pct': 0.029454576696136613, 'sideways_atr_max_pct': 0.12824482529931688, 'sideways_tp_mult': 2.998010279964785, 'sideways_tsl_mult': 0.187680915538531, 'sideways_time_stop': 281, 'sideways_use_sma': False, 'sideways_use_ema': False, 'sideways_use_atr': False, 'sideways_use_adx': True, 'sideways_use_spike': True, 'sideways_rsi_required': True}.
[I 2025-08-31 10:01:57,649] Trial 57 finished with values: [-1000000000.0, 1000000000.0] and parameters: {'p_sma': 10, 'p_std': 10, 'p_atr': 18, 'p_adx': 27, 'rsi_period': 38, 'ema1': 15, 'ema2': 42, 'slip_atr_k': 0.16665184774340447, 'slip_spread_k': 0.6977693567905712, 'spread_hl_frac': 0.010620807961689765, 'bb_std_mult': 1.5395048523540549, 'rsi_os': 15, 'rsi_ob': 76, 'vol_spike': 0.2745140328076291, 'adx_thresh': 5.561590472435122, 'atr_min_pct': 0.02829185382753877, 'atr_max_pct': 0.14257989385179057, 'tp_mult': 2.4831653656925865, 'tsl_mult': 0.9763901595171788, 'strategy': 'mean_reversion', 'time_stop': 103, 'use_sma': True, 'use_atr': False, 'use_adx': False, 'use_ema': True, 'use_spike': True, 'rsi_required': False, 'edge_k': 1.9391643739742142, 'edge_cap': 0.0700015536995334, 'bull_strategy': 'breakout', 'bull_bb_std_mult': 3.3013155628361703, 'bull_rsi_os': 21, 'bull_rsi_ob': 60, 'bull_adx_thresh': 10.663137705768234, 'bull_atr_min_pct': 0.027911616837505687, 'bull_atr_max_pct': 0.09151480416360185, 'bull_tp_mult': 1.8839818339806529, 'bull_tsl_mult': 0.7638430391247054, 'bull_time_stop': 98, 'bull_use_sma': False, 'bull_use_ema': True, 'bull_use_atr': False, 'bull_use_adx': True, 'bull_use_spike': True, 'bull_rsi_required': True, 'bear_strategy': 'mean_reversion', 'bear_bb_std_mult': 1.6697079108751598, 'bear_rsi_os': 21, 'bear_rsi_ob': 94, 'bear_adx_thresh': 11.08344504568977, 'bear_atr_min_pct': 0.026707923307671987, 'bear_atr_max_pct': 0.07130977979004693, 'bear_tp_mult': 1.2050533671052144, 'bear_tsl_mult': 0.344506976683446, 'bear_time_stop': 57, 'bear_use_sma': False, 'bear_use_ema': True, 'bear_use_atr': False, 'bear_use_adx': False, 'bear_use_spike': True, 'bear_rsi_required': True, 'sideways_strategy': 'mean_reversion', 'sideways_bb_std_mult': 1.3671281532639177, 'sideways_rsi_os': 15, 'sideways_rsi_ob': 82, 'sideways_adx_thresh': 23.664742846370782, 'sideways_atr_min_pct': 0.029741317639457303, 'sideways_atr_max_pct': 0.1118035676786688, 'sideways_tp_mult': 1.5601692037309414, 'sideways_tsl_mult': 0.33299195958179684, 'sideways_time_stop': 299, 'sideways_use_sma': True, 'sideways_use_ema': False, 'sideways_use_atr': False, 'sideways_use_adx': True, 'sideways_use_spike': True, 'sideways_rsi_required': True}.
[I 2025-08-31 10:01:57,903] Trial 56 finished with values: [-1000000000.0, 1000000000.0] and parameters: {'p_sma': 11, 'p_std': 7, 'p_atr': 12, 'p_adx': 27, 'rsi_period': 33, 'ema1': 5, 'ema2': 33, 'slip_atr_k': 0.16613272924947434, 'slip_spread_k': 0.2858083072254356, 'spread_hl_frac': 0.01106505885645304, 'bb_std_mult': 1.1349878045624189, 'rsi_os': 15, 'rsi_ob': 88, 'vol_spike': 0.20242286718947466, 'adx_thresh': 5.047454880763843, 'atr_min_pct': 0.02779845652920479, 'atr_max_pct': 0.12419166022430064, 'tp_mult': 2.4781651011346835, 'tsl_mult': 0.6779255856974642, 'strategy': 'mean_reversion', 'time_stop': 295, 'use_sma': True, 'use_atr': False, 'use_adx': False, 'use_ema': False, 'use_spike': True, 'rsi_required': False, 'edge_k': 1.9519614213906378, 'edge_cap': 0.05894320915017937, 'bull_strategy': 'breakout', 'bull_bb_std_mult': 1.1066923699872535, 'bull_rsi_os': 23, 'bull_rsi_ob': 62, 'bull_adx_thresh': 17.78008249757655, 'bull_atr_min_pct': 0.004231525458596244, 'bull_atr_max_pct': 0.07760063238858667, 'bull_tp_mult': 2.4322196026866263, 'bull_tsl_mult': 0.9026560449823733, 'bull_time_stop': 154, 'bull_use_sma': False, 'bull_use_ema': True, 'bull_use_atr': False, 'bull_use_adx': True, 'bull_use_spike': True, 'bull_rsi_required': False, 'bear_strategy': 'breakout', 'bear_bb_std_mult': 1.6623162727126308, 'bear_rsi_os': 8, 'bear_rsi_ob': 93, 'bear_adx_thresh': 33.050552915489355, 'bear_atr_min_pct': 0.02701027208050151, 'bear_atr_max_pct': 0.01239864370125611, 'bear_tp_mult': 2.997529601391254, 'bear_tsl_mult': 0.9924272490712762, 'bear_time_stop': 222, 'bear_use_sma': False, 'bear_use_ema': True, 'bear_use_atr': True, 'bear_use_adx': True, 'bear_use_spike': True, 'bear_rsi_required': False, 'sideways_strategy': 'mean_reversion', 'sideways_bb_std_mult': 1.3218279062928922, 'sideways_rsi_os': 5, 'sideways_rsi_ob': 81, 'sideways_adx_thresh': 31.355835758714584, 'sideways_atr_min_pct': 0.028829001381516162, 'sideways_atr_max_pct': 0.09215678347580473, 'sideways_tp_mult': 1.5847381397887945, 'sideways_tsl_mult': 0.27030894525046, 'sideways_time_stop': 149, 'sideways_use_sma': True, 'sideways_use_ema': True, 'sideways_use_atr': False, 'sideways_use_adx': True, 'sideways_use_spike': True, 'sideways_rsi_required': True}.
[I 2025-08-31 10:01:58,168] Trial 61 finished with values: [-1000000000.0, 1000000000.0] and parameters: {'p_sma': 50, 'p_std': 22, 'p_atr': 9, 'p_adx': 16, 'rsi_period': 57, 'ema1': 7, 'ema2': 48, 'slip_atr_k': 0.14463704531781685, 'slip_spread_k': 0.21113244306845644, 'spread_hl_frac': 0.002847499650795119, 'bb_std_mult': 3.3856385083135665, 'rsi_os': 30, 'rsi_ob': 45, 'vol_spike': 0.19892830558695973, 'adx_thresh': 9.949347018417114, 'atr_min_pct': 0.024988208863598062, 'atr_max_pct': 0.07301036962198301, 'tp_mult': 2.854752223578742, 'tsl_mult': 0.8961488736582074, 'strategy': 'mean_reversion', 'time_stop': 286, 'use_sma': True, 'use_atr': True, 'use_adx': False, 'use_ema': False, 'use_spike': True, 'rsi_required': True, 'edge_k': 1.551177617353645, 'edge_cap': 0.4182162069715578, 'bull_strategy': 'breakout', 'bull_bb_std_mult': 1.6815696426368079, 'bull_rsi_os': 47, 'bull_rsi_ob': 55, 'bull_adx_thresh': 34.391113539807655, 'bull_atr_min_pct': 0.003780648117572771, 'bull_atr_max_pct': 0.10556217967010774, 'bull_tp_mult': 2.2548843621994803, 'bull_tsl_mult': 0.9349536048841918, 'bull_time_stop': 134, 'bull_use_sma': False, 'bull_use_ema': False, 'bull_use_atr': False, 'bull_use_adx': True, 'bull_use_spike': False, 'bull_rsi_required': False, 'bear_strategy': 'mean_reversion', 'bear_bb_std_mult': 2.1941457387727175, 'bear_rsi_os': 25, 'bear_rsi_ob': 75, 'bear_adx_thresh': 32.04017563588357, 'bear_atr_min_pct': 0.018179531376722437, 'bear_atr_max_pct': 0.011576631732967874, 'bear_tp_mult': 2.2995356940076084, 'bear_tsl_mult': 0.899957396762073, 'bear_time_stop': 246, 'bear_use_sma': True, 'bear_use_ema': True, 'bear_use_atr': True, 'bear_use_adx': True, 'bear_use_spike': True, 'bear_rsi_required': False, 'sideways_strategy': 'breakout', 'sideways_bb_std_mult': 3.1719414640571686, 'sideways_rsi_os': 52, 'sideways_rsi_ob': 76, 'sideways_adx_thresh': 6.704605240747886, 'sideways_atr_min_pct': 9.950249079108443e-05, 'sideways_atr_max_pct': 0.11866194054977397, 'sideways_tp_mult': 2.3681440310520854, 'sideways_tsl_mult': 0.557242517718717, 'sideways_time_stop': 153, 'sideways_use_sma': True, 'sideways_use_ema': False, 'sideways_use_atr': False, 'sideways_use_adx': False, 'sideways_use_spike': False, 'sideways_rsi_required': True}.
[I 2025-08-31 10:02:28,516] Trial 62 finished with values: [-1000000000.0, 1000000000.0] and parameters: {'p_sma': 37, 'p_std': 60, 'p_atr': 9, 'p_adx': 17, 'rsi_period': 58, 'ema1': 7, 'ema2': 48, 'slip_atr_k': 0.14281507816066324, 'slip_spread_k': 0.21422567168908574, 'spread_hl_frac': 0.002245197590857449, 'bb_std_mult': 3.1514379715323426, 'rsi_os': 55, 'rsi_ob': 71, 'vol_spike': 0.11420038734394816, 'adx_thresh': 9.896006185127334, 'atr_min_pct': 0.025573466345129994, 'atr_max_pct': 0.13106039254783688, 'tp_mult': 2.822965470098289, 'tsl_mult': 0.9567947387867138, 'strategy': 'breakout', 'time_stop': 244, 'use_sma': True, 'use_atr': True, 'use_adx': True, 'use_ema': False, 'use_spike': False, 'rsi_required': True, 'edge_k': 1.5924743408133666, 'edge_cap': 0.2066944374885392, 'bull_strategy': 'breakout', 'bull_bb_std_mult': 1.6281360637798041, 'bull_rsi_os': 47, 'bull_rsi_ob': 55, 'bull_adx_thresh': 13.624857859867372, 'bull_atr_min_pct': 0.01594676534693654, 'bull_atr_max_pct': 0.10204046344119161, 'bull_tp_mult': 2.14124864926841, 'bull_tsl_mult': 0.06660494437256431, 'bull_time_stop': 69, 'bull_use_sma': False, 'bull_use_ema': False, 'bull_use_atr': True, 'bull_use_adx': True, 'bull_use_spike': False, 'bull_rsi_required': False, 'bear_strategy': 'mean_reversion', 'bear_bb_std_mult': 2.1934563129681957, 'bear_rsi_os': 25, 'bear_rsi_ob': 74, 'bear_adx_thresh': 28.27754439190536, 'bear_atr_min_pct': 0.018278654506685386, 'bear_atr_max_pct': 0.0837948758681951, 'bear_tp_mult': 1.5251112538326272, 'bear_tsl_mult': 0.19806383577478667, 'bear_time_stop': 117, 'bear_use_sma': True, 'bear_use_ema': False, 'bear_use_atr': True, 'bear_use_adx': True, 'bear_use_spike': True, 'bear_rsi_required': False, 'sideways_strategy': 'breakout', 'sideways_bb_std_mult': 1.1249655573890471, 'sideways_rsi_os': 18, 'sideways_rsi_ob': 76, 'sideways_adx_thresh': 13.345038273342492, 'sideways_atr_min_pct': 3.6788408681404094e-05, 'sideways_atr_max_pct': 0.10791310746375625, 'sideways_tp_mult': 1.8130104233312647, 'sideways_tsl_mult': 0.045085152859509314, 'sideways_time_stop': 42, 'sideways_use_sma': False, 'sideways_use_ema': False, 'sideways_use_atr': False, 'sideways_use_adx': False, 'sideways_use_spike': False, 'sideways_rsi_required': False}.
[I 2025-08-31 10:02:28,645] Trial 60 finished with values: [-1000000000.0, 1000000000.0] and parameters: {'p_sma': 7, 'p_std': 22, 'p_atr': 9, 'p_adx': 16, 'rsi_period': 50, 'ema1': 7, 'ema2': 50, 'slip_atr_k': 0.14216806606179155, 'slip_spread_k': 0.1692297845339748, 'spread_hl_frac': 0.006925841507769398, 'bb_std_mult': 3.4089937025020545, 'rsi_os': 11, 'rsi_ob': 71, 'vol_spike': 0.2012444670786064, 'adx_thresh': 6.2571398401418605, 'atr_min_pct': 0.02538212955231852, 'atr_max_pct': 0.13250821185314113, 'tp_mult': 2.8373087724990764, 'tsl_mult': 0.899111772452212, 'strategy': 'mean_reversion', 'time_stop': 297, 'use_sma': True, 'use_atr': True, 'use_adx': False, 'use_ema': False, 'use_spike': True, 'rsi_required': True, 'edge_k': 1.581609424176942, 'edge_cap': 0.4181640116226299, 'bull_strategy': 'breakout', 'bull_bb_std_mult': 2.76650994807666, 'bull_rsi_os': 37, 'bull_rsi_ob': 65, 'bull_adx_thresh': 13.153003991413655, 'bull_atr_min_pct': 0.015224982640003508, 'bull_atr_max_pct': 0.10439560940950231, 'bull_tp_mult': 2.3156812329696006, 'bull_tsl_mult': 0.060552139066129274, 'bull_time_stop': 218, 'bull_use_sma': False, 'bull_use_ema': False, 'bull_use_atr': False, 'bull_use_adx': True, 'bull_use_spike': False, 'bull_rsi_required': False, 'bear_strategy': 'mean_reversion', 'bear_bb_std_mult': 2.1825251243625874, 'bear_rsi_os': 51, 'bear_rsi_ob': 76, 'bear_adx_thresh': 32.2244024385363, 'bear_atr_min_pct': 0.01863412506433395, 'bear_atr_max_pct': 0.03115865697816676, 'bear_tp_mult': 1.8439383250163996, 'bear_tsl_mult': 0.8922216754227423, 'bear_time_stop': 246, 'bear_use_sma': True, 'bear_use_ema': True, 'bear_use_atr': True, 'bear_use_adx': True, 'bear_use_spike': True, 'bear_rsi_required': False, 'sideways_strategy': 'breakout', 'sideways_bb_std_mult': 3.5666022869449607, 'sideways_rsi_os': 52, 'sideways_rsi_ob': 53, 'sideways_adx_thresh': 6.628915938691355, 'sideways_atr_min_pct': 0.026463035673221707, 'sideways_atr_max_pct': 0.08999715182901488, 'sideways_tp_mult': 2.02045229342475, 'sideways_tsl_mult': 0.07307091363499735, 'sideways_time_stop': 30, 'sideways_use_sma': True, 'sideways_use_ema': False, 'sideways_use_atr': False, 'sideways_use_adx': False, 'sideways_use_spike': False, 'sideways_rsi_required': True}.
[I 2025-08-31 10:02:28,912] Trial 63 finished with values: [-1000000000.0, 1000000000.0] and parameters: {'p_sma': 38, 'p_std': 27, 'p_atr': 10, 'p_adx': 30, 'rsi_period': 49, 'ema1': 20, 'ema2': 27, 'slip_atr_k': 0.20150965844230467, 'slip_spread_k': 0.16638979112297123, 'spread_hl_frac': 0.00668149272733386, 'bb_std_mult': 1.3723770622473526, 'rsi_os': 55, 'rsi_ob': 92, 'vol_spike': 0.17774965629338346, 'adx_thresh': 6.07061315757895, 'atr_min_pct': 0.017368592191352363, 'atr_max_pct': 0.13153086638597902, 'tp_mult': 1.5295426418175, 'tsl_mult': 0.3960776234575015, 'strategy': 'breakout', 'time_stop': 83, 'use_sma': False, 'use_atr': True, 'use_adx': True, 'use_ema': False, 'use_spike': False, 'rsi_required': True, 'edge_k': 1.7467035948283678, 'edge_cap': 0.36559506402516073, 'bull_strategy': 'breakout', 'bull_bb_std_mult': 3.056994941567425, 'bull_rsi_os': 10, 'bull_rsi_ob': 66, 'bull_adx_thresh': 26.14615859884938, 'bull_atr_min_pct': 0.015279947119205613, 'bull_atr_max_pct': 0.14944412448846414, 'bull_tp_mult': 2.1288603571021065, 'bull_tsl_mult': 0.5820329140164484, 'bull_time_stop': 221, 'bull_use_sma': False, 'bull_use_ema': False, 'bull_use_atr': True, 'bull_use_adx': True, 'bull_use_spike': False, 'bull_rsi_required': False, 'bear_strategy': 'mean_reversion', 'bear_bb_std_mult': 2.756442445072783, 'bear_rsi_os': 48, 'bear_rsi_ob': 45, 'bear_adx_thresh': 28.526470747533327, 'bear_atr_min_pct': 0.016420097611589968, 'bear_atr_max_pct': 0.08934307555946046, 'bear_tp_mult': 1.5675352687391593, 'bear_tsl_mult': 0.17337470293866888, 'bear_time_stop': 120, 'bear_use_sma': True, 'bear_use_ema': False, 'bear_use_atr': False, 'bear_use_adx': True, 'bear_use_spike': True, 'bear_rsi_required': False, 'sideways_strategy': 'mean_reversion', 'sideways_bb_std_mult': 1.0676667957042305, 'sideways_rsi_os': 20, 'sideways_rsi_ob': 95, 'sideways_adx_thresh': 25.53846226152252, 'sideways_atr_min_pct': 0.02664672804752931, 'sideways_atr_max_pct': 0.10802953174119977, 'sideways_tp_mult': 2.165645542539848, 'sideways_tsl_mult': 0.42287011393457596, 'sideways_time_stop': 92, 'sideways_use_sma': False, 'sideways_use_ema': False, 'sideways_use_atr': False, 'sideways_use_adx': False, 'sideways_use_spike': False, 'sideways_rsi_required': False}.
