[I 2025-08-31 11:45:53,155] Trial 835 finished with values: [-0.08127514454999696, 0.08087806902451755] and parameters: {'p_sma': 36, 'p_std': 30, 'p_atr': 13, 'p_adx': 13, 'rsi_period': 50, 'ema1': 27, 'ema2': 42, 'slip_atr_k': 0.15258880020801685, 'slip_spread_k': 0.17255068395545706, 'spread_hl_frac': 0.0063185440079136295, 'bb_std_mult': 2.254396606488996, 'rsi_os': 31, 'rsi_ob': 93, 'vol_spike': 0.11622544981226772, 'adx_thresh': 30.179737765684475, 'atr_min_pct': 0.013150480252323795, 'atr_max_pct': 0.13511395331522486, 'tp_mult': 1.472422761553147, 'tsl_mult': 0.08923824905261209, 'strategy': 'breakout', 'time_stop': 178, 'use_sma': True, 'use_atr': True, 'use_adx': False, 'use_ema': False, 'use_spike': True, 'rsi_required': False, 'edge_k': 0.4836220677256121, 'edge_cap': 0.9714882146480286, 'bull_strategy': 'breakout', 'bull_bb_std_mult': 0.5413757506471657, 'bull_rsi_os': 24, 'bull_rsi_ob': 81, 'bull_adx_thresh': 33.63721078643351, 'bull_atr_min_pct': 0.002844297909152499, 'bull_atr_max_pct': 0.0997130022423055, 'bull_tp_mult': 2.174692448715988, 'bull_tsl_mult': 0.8201202898976578, 'bull_time_stop': 280, 'bull_use_sma': False, 'bull_use_ema': True, 'bull_use_atr': False, 'bull_use_adx': False, 'bull_use_spike': False, 'bull_rsi_required': False, 'bear_strategy': 'breakout', 'bear_bb_std_mult': 3.394949713230085, 'bear_rsi_os': 48, 'bear_rsi_ob': 71, 'bear_adx_thresh': 5.006667035695142, 'bear_atr_min_pct': 0.0029915017737131046, 'bear_atr_max_pct': 0.13914729189552968, 'bear_tp_mult': 2.899783647288919, 'bear_tsl_mult': 0.8116668426646707, 'bear_time_stop': 19, 'bear_use_sma': False, 'bear_use_ema': False, 'bear_use_atr': False, 'bear_use_adx': True, 'bear_use_spike': False, 'bear_rsi_required': True, 'sideways_strategy': 'breakout', 'sideways_bb_std_mult': 2.674973770059904, 'sideways_rsi_os': 24, 'sideways_rsi_ob': 94, 'sideways_adx_thresh': 12.481061534416215, 'sideways_atr_min_pct': 0.015728018102434783, 'sideways_atr_max_pct': 0.05305596021708957, 'sideways_tp_mult': 2.9998691877564556, 'sideways_tsl_mult': 0.39673702202496325, 'sideways_time_stop': 17, 'sideways_use_sma': False, 'sideways_use_ema': True, 'sideways_use_atr': True, 'sideways_use_adx': False, 'sideways_use_spike': True, 'sideways_rsi_required': True}.
[I 2025-08-31 11:46:27,849] Trial 838 finished with values: [-1000000000.0, 1000000000.0] and parameters: {'p_sma': 14, 'p_std': 49, 'p_atr': 13, 'p_adx': 30, 'rsi_period': 28, 'ema1': 27, 'ema2': 42, 'slip_atr_k': 0.0613162080312698, 'slip_spread_k': 0.1116063615209068, 'spread_hl_frac': 0.00637504380149351, 'bb_std_mult': 2.306029956896711, 'rsi_os': 32, 'rsi_ob': 93, 'vol_spike': 0.12782472494792643, 'adx_thresh': 30.96753906454292, 'atr_min_pct': 0.013641522755989356, 'atr_max_pct': 0.13447255143075096, 'tp_mult': 1.3304196056170254, 'tsl_mult': 0.1163938116494083, 'strategy': 'breakout', 'time_stop': 174, 'use_sma': True, 'use_atr': True, 'use_adx': False, 'use_ema': True, 'use_spike': True, 'rsi_required': False, 'edge_k': 0.4020645206289801, 'edge_cap': 0.7347975470389796, 'bull_strategy': 'breakout', 'bull_bb_std_mult': 0.6021585580811388, 'bull_rsi_os': 22, 'bull_rsi_ob': 81, 'bull_adx_thresh': 33.58614659123264, 'bull_atr_min_pct': 0.0028077292347372966, 'bull_atr_max_pct': 0.10016721535824251, 'bull_tp_mult': 2.3875294316755014, 'bull_tsl_mult': 0.7751810721475695, 'bull_time_stop': 277, 'bull_use_sma': False, 'bull_use_ema': True, 'bull_use_atr': False, 'bull_use_adx': False, 'bull_use_spike': False, 'bull_rsi_required': True, 'bear_strategy': 'breakout', 'bear_bb_std_mult': 3.3752367779145476, 'bear_rsi_os': 47, 'bear_rsi_ob': 68, 'bear_adx_thresh': 5.542172656027832, 'bear_atr_min_pct': 0.004510228083805368, 'bear_atr_max_pct': 0.06962501202642724, 'bear_tp_mult': 2.9541016723051428, 'bear_tsl_mult': 0.7724674384411577, 'bear_time_stop': 16, 'bear_use_sma': False, 'bear_use_ema': True, 'bear_use_atr': False, 'bear_use_adx': False, 'bear_use_spike': False, 'bear_rsi_required': True, 'sideways_strategy': 'breakout', 'sideways_bb_std_mult': 2.6689168140225705, 'sideways_rsi_os': 22, 'sideways_rsi_ob': 94, 'sideways_adx_thresh': 11.976038532232778, 'sideways_atr_min_pct': 0.013841127757266215, 'sideways_atr_max_pct': 0.04682425151802908, 'sideways_tp_mult': 2.904901253234808, 'sideways_tsl_mult': 0.3958923444280843, 'sideways_time_stop': 244, 'sideways_use_sma': False, 'sideways_use_ema': False, 'sideways_use_atr': True, 'sideways_use_adx': False, 'sideways_use_spike': True, 'sideways_rsi_required': True}.
[I 2025-08-31 11:46:27,859] Trial 839 finished with values: [-1000000000.0, 1000000000.0] and parameters: {'p_sma': 38, 'p_std': 38, 'p_atr': 13, 'p_adx': 7, 'rsi_period': 50, 'ema1': 13, 'ema2': 41, 'slip_atr_k': 0.1519016005465896, 'slip_spread_k': 0.10360734271457225, 'spread_hl_frac': 0.005734389314266537, 'bb_std_mult': 2.2887332933882862, 'rsi_os': 32, 'rsi_ob': 93, 'vol_spike': 0.1337828289032008, 'adx_thresh': 21.877879173145676, 'atr_min_pct': 0.014541527451625753, 'atr_max_pct': 0.13558702481655946, 'tp_mult': 1.4165789423352046, 'tsl_mult': 0.11882671399288128, 'strategy': 'breakout', 'time_stop': 171, 'use_sma': True, 'use_atr': True, 'use_adx': False, 'use_ema': True, 'use_spike': True, 'rsi_required': False, 'edge_k': 0.41507663288546787, 'edge_cap': 0.8824338224823292, 'bull_strategy': 'breakout', 'bull_bb_std_mult': 0.5111058469099552, 'bull_rsi_os': 22, 'bull_rsi_ob': 83, 'bull_adx_thresh': 28.702661692597353, 'bull_atr_min_pct': 0.02854476664323815, 'bull_atr_max_pct': 0.047624017877820835, 'bull_tp_mult': 2.858573672467987, 'bull_tsl_mult': 0.8267156360619666, 'bull_time_stop': 278, 'bull_use_sma': False, 'bull_use_ema': True, 'bull_use_atr': False, 'bull_use_adx': False, 'bull_use_spike': False, 'bull_rsi_required': True, 'bear_strategy': 'breakout', 'bear_bb_std_mult': 3.2428193864320307, 'bear_rsi_os': 48, 'bear_rsi_ob': 69, 'bear_adx_thresh': 5.017064248608401, 'bear_atr_min_pct': 0.014642961617837085, 'bear_atr_max_pct': 0.14415711160705988, 'bear_tp_mult': 2.896578089103756, 'bear_tsl_mult': 0.7706000812584677, 'bear_time_stop': 20, 'bear_use_sma': False, 'bear_use_ema': True, 'bear_use_atr': False, 'bear_use_adx': False, 'bear_use_spike': False, 'bear_rsi_required': True, 'sideways_strategy': 'breakout', 'sideways_bb_std_mult': 2.671418890485858, 'sideways_rsi_os': 22, 'sideways_rsi_ob': 75, 'sideways_adx_thresh': 12.539834402038391, 'sideways_atr_min_pct': 0.013963638045246264, 'sideways_atr_max_pct': 0.04180999146736173, 'sideways_tp_mult': 2.9003722485846404, 'sideways_tsl_mult': 0.39720286347073974, 'sideways_time_stop': 75, 'sideways_use_sma': False, 'sideways_use_ema': False, 'sideways_use_atr': True, 'sideways_use_adx': False, 'sideways_use_spike': True, 'sideways_rsi_required': True}.
[I 2025-08-31 11:46:28,303] Trial 841 finished with values: [-1000000000.0, 1000000000.0] and parameters: {'p_sma': 14, 'p_std': 7, 'p_atr': 13, 'p_adx': 7, 'rsi_period': 63, 'ema1': 26, 'ema2': 40, 'slip_atr_k': 0.03290232914900041, 'slip_spread_k': 0.10101876234441343, 'spread_hl_frac': 0.0045741067714714055, 'bb_std_mult': 2.3177046222868154, 'rsi_os': 33, 'rsi_ob': 94, 'vol_spike': 0.13065521872053082, 'adx_thresh': 8.777251723984278, 'atr_min_pct': 0.014180083979961018, 'atr_max_pct': 0.13076061280676565, 'tp_mult': 1.3530272349314671, 'tsl_mult': 0.08128929644113386, 'strategy': 'breakout', 'time_stop': 171, 'use_sma': True, 'use_atr': True, 'use_adx': False, 'use_ema': True, 'use_spike': True, 'rsi_required': False, 'edge_k': 0.42073130071538994, 'edge_cap': 0.8775959824418719, 'bull_strategy': 'breakout', 'bull_bb_std_mult': 0.5086516947273861, 'bull_rsi_os': 26, 'bull_rsi_ob': 83, 'bull_adx_thresh': 5.014726898194791, 'bull_atr_min_pct': 0.026716477912246076, 'bull_atr_max_pct': 0.09858441286700402, 'bull_tp_mult': 2.385686437224438, 'bull_tsl_mult': 0.8556775856556793, 'bull_time_stop': 277, 'bull_use_sma': False, 'bull_use_ema': True, 'bull_use_atr': False, 'bull_use_adx': True, 'bull_use_spike': False, 'bull_rsi_required': True, 'bear_strategy': 'breakout', 'bear_bb_std_mult': 3.2609413914254484, 'bear_rsi_os': 47, 'bear_rsi_ob': 69, 'bear_adx_thresh': 5.6300145129464045, 'bear_atr_min_pct': 0.013781533029709456, 'bear_atr_max_pct': 0.02686120786478964, 'bear_tp_mult': 2.94121250920208, 'bear_tsl_mult': 0.7662772690837072, 'bear_time_stop': 20, 'bear_use_sma': False, 'bear_use_ema': True, 'bear_use_atr': False, 'bear_use_adx': False, 'bear_use_spike': False, 'bear_rsi_required': True, 'sideways_strategy': 'breakout', 'sideways_bb_std_mult': 2.672193736500689, 'sideways_rsi_os': 22, 'sideways_rsi_ob': 52, 'sideways_adx_thresh': 10.096299317775603, 'sideways_atr_min_pct': 0.01687854023837657, 'sideways_atr_max_pct': 0.08966244753522273, 'sideways_tp_mult': 2.90718845483577, 'sideways_tsl_mult': 0.42109554310261943, 'sideways_time_stop': 16, 'sideways_use_sma': False, 'sideways_use_ema': False, 'sideways_use_atr': True, 'sideways_use_adx': False, 'sideways_use_spike': True, 'sideways_rsi_required': True}.
[I 2025-08-31 11:46:28,454] Trial 840 finished with values: [-1000000000.0, 1000000000.0] and parameters: {'p_sma': 14, 'p_std': 49, 'p_atr': 13, 'p_adx': 19, 'rsi_period': 50, 'ema1': 24, 'ema2': 41, 'slip_atr_k': 0.2199564528444177, 'slip_spread_k': 0.11762004700321149, 'spread_hl_frac': 0.004902736372826725, 'bb_std_mult': 2.3187661803998125, 'rsi_os': 33, 'rsi_ob': 93, 'vol_spike': 0.12584690624106298, 'adx_thresh': 21.837454413951242, 'atr_min_pct': 0.014123531333923354, 'atr_max_pct': 0.1319704990411055, 'tp_mult': 1.4224356433319856, 'tsl_mult': 0.08167037212081579, 'strategy': 'breakout', 'time_stop': 194, 'use_sma': True, 'use_atr': True, 'use_adx': False, 'use_ema': True, 'use_spike': True, 'rsi_required': False, 'edge_k': 0.41370983017283064, 'edge_cap': 0.8730538803258426, 'bull_strategy': 'breakout', 'bull_bb_std_mult': 0.511363377297144, 'bull_rsi_os': 26, 'bull_rsi_ob': 54, 'bull_adx_thresh': 5.480620191942076, 'bull_atr_min_pct': 0.019804019125717366, 'bull_atr_max_pct': 0.09921838743781358, 'bull_tp_mult': 2.1892596895782037, 'bull_tsl_mult': 0.8559130354050294, 'bull_time_stop': 278, 'bull_use_sma': False, 'bull_use_ema': True, 'bull_use_atr': False, 'bull_use_adx': False, 'bull_use_spike': False, 'bull_rsi_required': True, 'bear_strategy': 'breakout', 'bear_bb_std_mult': 3.2485032195357784, 'bear_rsi_os': 47, 'bear_rsi_ob': 68, 'bear_adx_thresh': 5.687749721315548, 'bear_atr_min_pct': 0.026238885850160244, 'bear_atr_max_pct': 0.1449211356466356, 'bear_tp_mult': 2.9448592931656825, 'bear_tsl_mult': 0.7722821798421867, 'bear_time_stop': 19, 'bear_use_sma': False, 'bear_use_ema': True, 'bear_use_atr': False, 'bear_use_adx': False, 'bear_use_spike': False, 'bear_rsi_required': True, 'sideways_strategy': 'breakout', 'sideways_bb_std_mult': 2.673919843342822, 'sideways_rsi_os': 22, 'sideways_rsi_ob': 94, 'sideways_adx_thresh': 10.139200113387908, 'sideways_atr_min_pct': 0.013829475026016315, 'sideways_atr_max_pct': 0.12898877889798255, 'sideways_tp_mult': 2.895834151301838, 'sideways_tsl_mult': 0.46285643308462265, 'sideways_time_stop': 17, 'sideways_use_sma': False, 'sideways_use_ema': False, 'sideways_use_atr': True, 'sideways_use_adx': False, 'sideways_use_spike': True, 'sideways_rsi_required': True}.
[I 2025-08-31 11:47:01,930] Trial 842 finished with values: [-1000000000.0, 1000000000.0] and parameters: {'p_sma': 16, 'p_std': 29, 'p_atr': 12, 'p_adx': 15, 'rsi_period': 78, 'ema1': 26, 'ema2': 41, 'slip_atr_k': 0.17449256596822132, 'slip_spread_k': 0.9793694603402927, 'spread_hl_frac': 0.005189274974095794, 'bb_std_mult': 2.405454496078419, 'rsi_os': 33, 'rsi_ob': 94, 'vol_spike': 0.13140925841996437, 'adx_thresh': 31.191235538599344, 'atr_min_pct': 0.014658023239397655, 'atr_max_pct': 0.1315636373179301, 'tp_mult': 1.4253109150127259, 'tsl_mult': 0.0812697919402816, 'strategy': 'breakout', 'time_stop': 194, 'use_sma': False, 'use_atr': True, 'use_adx': False, 'use_ema': True, 'use_spike': False, 'rsi_required': False, 'edge_k': 0.4169074689067717, 'edge_cap': 0.6039591128248769, 'bull_strategy': 'breakout', 'bull_bb_std_mult': 0.5925736466019611, 'bull_rsi_os': 25, 'bull_rsi_ob': 85, 'bull_adx_thresh': 26.25467221721334, 'bull_atr_min_pct': 0.004022043751384763, 'bull_atr_max_pct': 0.09412413491820927, 'bull_tp_mult': 2.5210655661468047, 'bull_tsl_mult': 0.867090774373489, 'bull_time_stop': 257, 'bull_use_sma': False, 'bull_use_ema': True, 'bull_use_atr': True, 'bull_use_adx': True, 'bull_use_spike': True, 'bull_rsi_required': True, 'bear_strategy': 'breakout', 'bear_bb_std_mult': 3.3282015987475315, 'bear_rsi_os': 47, 'bear_rsi_ob': 68, 'bear_adx_thresh': 5.64317472387485, 'bear_atr_min_pct': 0.02628643589970136, 'bear_atr_max_pct': 0.062378658879479874, 'bear_tp_mult': 2.9438177356797994, 'bear_tsl_mult': 0.7540594156476034, 'bear_time_stop': 18, 'bear_use_sma': True, 'bear_use_ema': True, 'bear_use_atr': False, 'bear_use_adx': False, 'bear_use_spike': False, 'bear_rsi_required': True, 'sideways_strategy': 'breakout', 'sideways_bb_std_mult': 2.536734127695637, 'sideways_rsi_os': 23, 'sideways_rsi_ob': 94, 'sideways_adx_thresh': 11.095248328169639, 'sideways_atr_min_pct': 0.01676902607011527, 'sideways_atr_max_pct': 0.11874935608219533, 'sideways_tp_mult': 2.942798913898293, 'sideways_tsl_mult': 0.4188434685407061, 'sideways_time_stop': 17, 'sideways_use_sma': False, 'sideways_use_ema': False, 'sideways_use_atr': True, 'sideways_use_adx': True, 'sideways_use_spike': True, 'sideways_rsi_required': False}.
[I 2025-08-31 11:47:02,541] Trial 844 finished with values: [-1000000000.0, 1000000000.0] and parameters: {'p_sma': 10, 'p_std': 28, 'p_atr': 12, 'p_adx': 15, 'rsi_period': 14, 'ema1': 22, 'ema2': 39, 'slip_atr_k': 0.17511917246755657, 'slip_spread_k': 0.13047460046234866, 'spread_hl_frac': 0.022169654266885382, 'bb_std_mult': 2.38783166487449, 'rsi_os': 31, 'rsi_ob': 94, 'vol_spike': 0.10241288276748872, 'adx_thresh': 25.317272532283525, 'atr_min_pct': 0.014949765948473968, 'atr_max_pct': 0.13946518096864718, 'tp_mult': 1.561527632704456, 'tsl_mult': 0.08268729518049785, 'strategy': 'breakout', 'time_stop': 195, 'use_sma': False, 'use_atr': True, 'use_adx': False, 'use_ema': True, 'use_spike': False, 'rsi_required': False, 'edge_k': 0.5242474028494513, 'edge_cap': 0.606774099412842, 'bull_strategy': 'mean_reversion', 'bull_bb_std_mult': 0.5929853093980373, 'bull_rsi_os': 28, 'bull_rsi_ob': 85, 'bull_adx_thresh': 11.135531041676469, 'bull_atr_min_pct': 0.02185678764087315, 'bull_atr_max_pct': 0.1126344825660312, 'bull_tp_mult': 2.5093239242191583, 'bull_tsl_mult': 0.7911702990074821, 'bull_time_stop': 256, 'bull_use_sma': False, 'bull_use_ema': True, 'bull_use_atr': True, 'bull_use_adx': False, 'bull_use_spike': True, 'bull_rsi_required': True, 'bear_strategy': 'breakout', 'bear_bb_std_mult': 3.3174031636558015, 'bear_rsi_os': 47, 'bear_rsi_ob': 70, 'bear_adx_thresh': 5.696541632256617, 'bear_atr_min_pct': 0.02640070517931418, 'bear_atr_max_pct': 0.14301535265392984, 'bear_tp_mult': 2.8962275838897362, 'bear_tsl_mult': 0.8256583948882499, 'bear_time_stop': 10, 'bear_use_sma': True, 'bear_use_ema': True, 'bear_use_atr': True, 'bear_use_adx': False, 'bear_use_spike': False, 'bear_rsi_required': True, 'sideways_strategy': 'breakout', 'sideways_bb_std_mult': 2.5801249858465884, 'sideways_rsi_os': 24, 'sideways_rsi_ob': 59, 'sideways_adx_thresh': 11.665492077976433, 'sideways_atr_min_pct': 0.024672749757111256, 'sideways_atr_max_pct': 0.1309324724340354, 'sideways_tp_mult': 2.9490432069260883, 'sideways_tsl_mult': 0.4176045432867082, 'sideways_time_stop': 141, 'sideways_use_sma': False, 'sideways_use_ema': False, 'sideways_use_atr': True, 'sideways_use_adx': True, 'sideways_use_spike': True, 'sideways_rsi_required': False}.
[I 2025-08-31 11:47:02,732] Trial 843 finished with values: [-1000000000.0, 1000000000.0] and parameters: {'p_sma': 15, 'p_std': 29, 'p_atr': 12, 'p_adx': 15, 'rsi_period': 55, 'ema1': 26, 'ema2': 40, 'slip_atr_k': 0.03423607594275441, 'slip_spread_k': 0.9762705643675933, 'spread_hl_frac': 0.020427007357895807, 'bb_std_mult': 2.439392093436042, 'rsi_os': 32, 'rsi_ob': 94, 'vol_spike': 0.12988051014241123, 'adx_thresh': 31.442066072294846, 'atr_min_pct': 0.013789309459952406, 'atr_max_pct': 0.1315297641749476, 'tp_mult': 1.4168259893840711, 'tsl_mult': 0.08565235072738024, 'strategy': 'breakout', 'time_stop': 193, 'use_sma': False, 'use_atr': True, 'use_adx': False, 'use_ema': True, 'use_spike': False, 'rsi_required': False, 'edge_k': 0.5603451788324166, 'edge_cap': 0.7574631529496751, 'bull_strategy': 'breakout', 'bull_bb_std_mult': 0.502011343973112, 'bull_rsi_os': 25, 'bull_rsi_ob': 79, 'bull_adx_thresh': 5.471963351517699, 'bull_atr_min_pct': 0.003949678592278983, 'bull_atr_max_pct': 0.12983071507713775, 'bull_tp_mult': 2.540923211882282, 'bull_tsl_mult': 0.8472484596731411, 'bull_time_stop': 257, 'bull_use_sma': False, 'bull_use_ema': True, 'bull_use_atr': True, 'bull_use_adx': True, 'bull_use_spike': True, 'bull_rsi_required': True, 'bear_strategy': 'breakout', 'bear_bb_std_mult': 3.262517421238099, 'bear_rsi_os': 47, 'bear_rsi_ob': 68, 'bear_adx_thresh': 5.58737052362855, 'bear_atr_min_pct': 0.023461926818024347, 'bear_atr_max_pct': 0.062429695940217036, 'bear_tp_mult': 2.959229642189209, 'bear_tsl_mult': 0.7599978506916204, 'bear_time_stop': 19, 'bear_use_sma': True, 'bear_use_ema': True, 'bear_use_atr': False, 'bear_use_adx': False, 'bear_use_spike': False, 'bear_rsi_required': True, 'sideways_strategy': 'breakout', 'sideways_bb_std_mult': 2.4837744969499225, 'sideways_rsi_os': 23, 'sideways_rsi_ob': 51, 'sideways_adx_thresh': 10.221545758777186, 'sideways_atr_min_pct': 0.021584120395629597, 'sideways_atr_max_pct': 0.10421321048907961, 'sideways_tp_mult': 2.943171004736102, 'sideways_tsl_mult': 0.4168262928734627, 'sideways_time_stop': 187, 'sideways_use_sma': False, 'sideways_use_ema': False, 'sideways_use_atr': True, 'sideways_use_adx': True, 'sideways_use_spike': True, 'sideways_rsi_required': False}.
[I 2025-08-31 11:47:02,876] Trial 845 finished with values: [-1000000000.0, 1000000000.0] and parameters: {'p_sma': 30, 'p_std': 28, 'p_atr': 12, 'p_adx': 20, 'rsi_period': 54, 'ema1': 12, 'ema2': 39, 'slip_atr_k': 0.05252919709113124, 'slip_spread_k': 0.006590912297462448, 'spread_hl_frac': 0.022413525707477573, 'bb_std_mult': 2.4242938595434684, 'rsi_os': 33, 'rsi_ob': 94, 'vol_spike': 0.10366119026133458, 'adx_thresh': 31.421752232933297, 'atr_min_pct': 0.012721814133268231, 'atr_max_pct': 0.13939710997702404, 'tp_mult': 1.5545744904639223, 'tsl_mult': 0.0845600656257877, 'strategy': 'breakout', 'time_stop': 194, 'use_sma': False, 'use_atr': True, 'use_adx': False, 'use_ema': True, 'use_spike': False, 'rsi_required': False, 'edge_k': 0.5422033006467175, 'edge_cap': 0.7586697290300386, 'bull_strategy': 'mean_reversion', 'bull_bb_std_mult': 0.6023575847473306, 'bull_rsi_os': 25, 'bull_rsi_ob': 87, 'bull_adx_thresh': 6.168571593032628, 'bull_atr_min_pct': 0.00391794986612047, 'bull_atr_max_pct': 0.01873591892482361, 'bull_tp_mult': 2.619275126932008, 'bull_tsl_mult': 0.7988316335149901, 'bull_time_stop': 268, 'bull_use_sma': False, 'bull_use_ema': True, 'bull_use_atr': True, 'bull_use_adx': True, 'bull_use_spike': True, 'bull_rsi_required': True, 'bear_strategy': 'breakout', 'bear_bb_std_mult': 3.329841787779819, 'bear_rsi_os': 46, 'bear_rsi_ob': 70, 'bear_adx_thresh': 5.605304461815381, 'bear_atr_min_pct': 0.019107679035952962, 'bear_atr_max_pct': 0.08856191724732691, 'bear_tp_mult': 2.88522431854898, 'bear_tsl_mult': 0.7500027282100579, 'bear_time_stop': 11, 'bear_use_sma': True, 'bear_use_ema': True, 'bear_use_atr': True, 'bear_use_adx': False, 'bear_use_spike': False, 'bear_rsi_required': True, 'sideways_strategy': 'breakout', 'sideways_bb_std_mult': 2.583265323651193, 'sideways_rsi_os': 24, 'sideways_rsi_ob': 94, 'sideways_adx_thresh': 11.016196377127546, 'sideways_atr_min_pct': 0.01484789799066898, 'sideways_atr_max_pct': 0.10435269480834106, 'sideways_tp_mult': 2.9479490019411476, 'sideways_tsl_mult': 0.4204416893373177, 'sideways_time_stop': 140, 'sideways_use_sma': False, 'sideways_use_ema': False, 'sideways_use_atr': True, 'sideways_use_adx': True, 'sideways_use_spike': True, 'sideways_rsi_required': False}.
