[I 2025-08-31 10:57:05,654] Trial 486 finished with values: [-1000000000.0, 1000000000.0] and parameters: {'p_sma': 17, 'p_std': 31, 'p_atr': 12, 'p_adx': 8, 'rsi_period': 49, 'ema1': 13, 'ema2': 54, 'slip_atr_k': 0.038511120046045635, 'slip_spread_k': 0.614390335402153, 'spread_hl_frac': 0.00959388550218583, 'bb_std_mult': 3.4297711227213306, 'rsi_os': 31, 'rsi_ob': 77, 'vol_spike': 0.2775443682711922, 'adx_thresh': 12.06472239001298, 'atr_min_pct': 0.018052220494360453, 'atr_max_pct': 0.09793042997237474, 'tp_mult': 1.4438070986458031, 'tsl_mult': 0.2665819920535846, 'strategy': 'breakout', 'time_stop': 74, 'use_sma': True, 'use_atr': False, 'use_adx': True, 'use_ema': True, 'use_spike': True, 'rsi_required': True, 'edge_k': 0.956933205078833, 'edge_cap': 0.19112314532446306, 'bull_strategy': 'breakout', 'bull_bb_std_mult': 2.7240976201472273, 'bull_rsi_os': 16, 'bull_rsi_ob': 77, 'bull_adx_thresh': 6.870933028862665, 'bull_atr_min_pct': 0.007229180360926903, 'bull_atr_max_pct': 0.10485992978063333, 'bull_tp_mult': 1.263213569167457, 'bull_tsl_mult': 0.05135759906832227, 'bull_time_stop': 74, 'bull_use_sma': True, 'bull_use_ema': False, 'bull_use_atr': False, 'bull_use_adx': False, 'bull_use_spike': False, 'bull_rsi_required': False, 'bear_strategy': 'breakout', 'bear_bb_std_mult': 3.065434806731204, 'bear_rsi_os': 45, 'bear_rsi_ob': 95, 'bear_adx_thresh': 30.35469654047153, 'bear_atr_min_pct': 0.005670398711334901, 'bear_atr_max_pct': 0.06064387768493422, 'bear_tp_mult': 2.512684153022324, 'bear_tsl_mult': 0.47164101038695927, 'bear_time_stop': 35, 'bear_use_sma': False, 'bear_use_ema': True, 'bear_use_atr': False, 'bear_use_adx': False, 'bear_use_spike': True, 'bear_rsi_required': False, 'sideways_strategy': 'mean_reversion', 'sideways_bb_std_mult': 2.8111957644781915, 'sideways_rsi_os': 8, 'sideways_rsi_ob': 92, 'sideways_adx_thresh': 25.215424049661987, 'sideways_atr_min_pct': 0.007772957040717376, 'sideways_atr_max_pct': 0.057082665971076404, 'sideways_tp_mult': 2.3799893595867645, 'sideways_tsl_mult': 0.07948906078896496, 'sideways_time_stop': 20, 'sideways_use_sma': False, 'sideways_use_ema': False, 'sideways_use_atr': False, 'sideways_use_adx': False, 'sideways_use_spike': False, 'sideways_rsi_required': True}.
[I 2025-08-31 10:57:05,876] Trial 485 finished with values: [-1000000000.0, 1000000000.0] and parameters: {'p_sma': 15, 'p_std': 27, 'p_atr': 12, 'p_adx': 14, 'rsi_period': 49, 'ema1': 24, 'ema2': 54, 'slip_atr_k': 0.20342623468942223, 'slip_spread_k': 0.6245565700086693, 'spread_hl_frac': 0.04745646879819866, 'bb_std_mult': 3.445308558390132, 'rsi_os': 31, 'rsi_ob': 77, 'vol_spike': 0.2772259649474068, 'adx_thresh': 30.950480906337905, 'atr_min_pct': 0.009712961453188906, 'atr_max_pct': 0.012102830458372973, 'tp_mult': 1.9262475088672875, 'tsl_mult': 0.49160084141666366, 'strategy': 'breakout', 'time_stop': 55, 'use_sma': True, 'use_atr': False, 'use_adx': True, 'use_ema': True, 'use_spike': True, 'rsi_required': True, 'edge_k': 0.9375968990244129, 'edge_cap': 0.0749183704546238, 'bull_strategy': 'breakout', 'bull_bb_std_mult': 0.7301920590407576, 'bull_rsi_os': 30, 'bull_rsi_ob': 79, 'bull_adx_thresh': 6.847528713679746, 'bull_atr_min_pct': 0.0070993851991779326, 'bull_atr_max_pct': 0.10438161158463452, 'bull_tp_mult': 1.7952961327859176, 'bull_tsl_mult': 0.43540623440579773, 'bull_time_stop': 183, 'bull_use_sma': True, 'bull_use_ema': False, 'bull_use_atr': False, 'bull_use_adx': False, 'bull_use_spike': False, 'bull_rsi_required': False, 'bear_strategy': 'mean_reversion', 'bear_bb_std_mult': 2.4379179807643796, 'bear_rsi_os': 5, 'bear_rsi_ob': 52, 'bear_adx_thresh': 8.239344104232936, 'bear_atr_min_pct': 0.005268896945561225, 'bear_atr_max_pct': 0.06376283931883818, 'bear_tp_mult': 2.7195260467483418, 'bear_tsl_mult': 0.5183975628730148, 'bear_time_stop': 33, 'bear_use_sma': False, 'bear_use_ema': True, 'bear_use_atr': False, 'bear_use_adx': False, 'bear_use_spike': True, 'bear_rsi_required': False, 'sideways_strategy': 'mean_reversion', 'sideways_bb_std_mult': 2.5698628448364507, 'sideways_rsi_os': 10, 'sideways_rsi_ob': 52, 'sideways_adx_thresh': 25.90443292020952, 'sideways_atr_min_pct': 0.01975634578038494, 'sideways_atr_max_pct': 0.05750965984278644, 'sideways_tp_mult': 2.3962395957718705, 'sideways_tsl_mult': 0.16019062808107742, 'sideways_time_stop': 289, 'sideways_use_sma': False, 'sideways_use_ema': False, 'sideways_use_atr': False, 'sideways_use_adx': False, 'sideways_use_spike': False, 'sideways_rsi_required': True}.
[I 2025-08-31 10:57:06,004] Trial 488 finished with values: [-1000000000.0, 1000000000.0] and parameters: {'p_sma': 17, 'p_std': 24, 'p_atr': 12, 'p_adx': 14, 'rsi_period': 49, 'ema1': 19, 'ema2': 43, 'slip_atr_k': 0.03457229548283865, 'slip_spread_k': 0.09479598349070156, 'spread_hl_frac': 0.009597851926164806, 'bb_std_mult': 2.804146785848557, 'rsi_os': 28, 'rsi_ob': 77, 'vol_spike': 0.18409407879642123, 'adx_thresh': 28.203346970782825, 'atr_min_pct': 0.029092722213152636, 'atr_max_pct': 0.09677953105007682, 'tp_mult': 2.34108941110192, 'tsl_mult': 0.27007428990047677, 'strategy': 'breakout', 'time_stop': 53, 'use_sma': True, 'use_atr': False, 'use_adx': True, 'use_ema': False, 'use_spike': True, 'rsi_required': True, 'edge_k': 0.9572134866393492, 'edge_cap': 0.6730582860768093, 'bull_strategy': 'breakout', 'bull_bb_std_mult': 0.6619353331573986, 'bull_rsi_os': 8, 'bull_rsi_ob': 80, 'bull_adx_thresh': 27.551392497076794, 'bull_atr_min_pct': 0.010314619109101539, 'bull_atr_max_pct': 0.10459248569431114, 'bull_tp_mult': 1.7298382637560665, 'bull_tsl_mult': 0.8560341934873703, 'bull_time_stop': 73, 'bull_use_sma': False, 'bull_use_ema': False, 'bull_use_atr': False, 'bull_use_adx': False, 'bull_use_spike': False, 'bull_rsi_required': False, 'bear_strategy': 'breakout', 'bear_bb_std_mult': 2.8899800954814765, 'bear_rsi_os': 42, 'bear_rsi_ob': 79, 'bear_adx_thresh': 10.1070457572627, 'bear_atr_min_pct': 0.004780018288799239, 'bear_atr_max_pct': 0.05633929693727901, 'bear_tp_mult': 1.7719908926453558, 'bear_tsl_mult': 0.4664239577163486, 'bear_time_stop': 44, 'bear_use_sma': True, 'bear_use_ema': False, 'bear_use_atr': True, 'bear_use_adx': True, 'bear_use_spike': True, 'bear_rsi_required': True, 'sideways_strategy': 'mean_reversion', 'sideways_bb_std_mult': 2.806997270094905, 'sideways_rsi_os': 33, 'sideways_rsi_ob': 65, 'sideways_adx_thresh': 25.050851780081516, 'sideways_atr_min_pct': 0.01040626100933302, 'sideways_atr_max_pct': 0.09130428146257533, 'sideways_tp_mult': 1.730791581954787, 'sideways_tsl_mult': 0.35048587487454785, 'sideways_time_stop': 141, 'sideways_use_sma': False, 'sideways_use_ema': False, 'sideways_use_atr': True, 'sideways_use_adx': False, 'sideways_use_spike': False, 'sideways_rsi_required': True}.
[I 2025-08-31 10:57:06,817] Trial 489 finished with values: [-1000000000.0, 1000000000.0] and parameters: {'p_sma': 31, 'p_std': 24, 'p_atr': 13, 'p_adx': 14, 'rsi_period': 47, 'ema1': 24, 'ema2': 24, 'slip_atr_k': 0.03404941089256232, 'slip_spread_k': 0.6439706730998023, 'spread_hl_frac': 0.044364709332514934, 'bb_std_mult': 2.8276333667671745, 'rsi_os': 24, 'rsi_ob': 49, 'vol_spike': 0.29368475142880507, 'adx_thresh': 30.689632346480842, 'atr_min_pct': 0.009468170185965978, 'atr_max_pct': 0.12360539468981716, 'tp_mult': 2.3419064205950417, 'tsl_mult': 0.35840694400765943, 'strategy': 'mean_reversion', 'time_stop': 56, 'use_sma': True, 'use_atr': False, 'use_adx': True, 'use_ema': True, 'use_spike': True, 'rsi_required': True, 'edge_k': 1.5269805314422553, 'edge_cap': 0.6785658808078654, 'bull_strategy': 'mean_reversion', 'bull_bb_std_mult': 3.3388378201746365, 'bull_rsi_os': 27, 'bull_rsi_ob': 73, 'bull_adx_thresh': 27.359344162339617, 'bull_atr_min_pct': 0.00831571284386304, 'bull_atr_max_pct': 0.09484374577130698, 'bull_tp_mult': 1.7320983380204962, 'bull_tsl_mult': 0.6954497657360217, 'bull_time_stop': 96, 'bull_use_sma': False, 'bull_use_ema': False, 'bull_use_atr': False, 'bull_use_adx': False, 'bull_use_spike': False, 'bull_rsi_required': True, 'bear_strategy': 'breakout', 'bear_bb_std_mult': 2.037562357867395, 'bear_rsi_os': 43, 'bear_rsi_ob': 52, 'bear_adx_thresh': 23.995864497880934, 'bear_atr_min_pct': 0.004788587649236144, 'bear_atr_max_pct': 0.055505969067853794, 'bear_tp_mult': 2.7127876388515078, 'bear_tsl_mult': 0.5492441803575152, 'bear_time_stop': 41, 'bear_use_sma': True, 'bear_use_ema': True, 'bear_use_atr': False, 'bear_use_adx': False, 'bear_use_spike': True, 'bear_rsi_required': False, 'sideways_strategy': 'mean_reversion', 'sideways_bb_std_mult': 2.696788824588007, 'sideways_rsi_os': 41, 'sideways_rsi_ob': 76, 'sideways_adx_thresh': 25.065372274365483, 'sideways_atr_min_pct': 0.010567887048547515, 'sideways_atr_max_pct': 0.03306019697147419, 'sideways_tp_mult': 1.2331818294094736, 'sideways_tsl_mult': 0.13950869637767338, 'sideways_time_stop': 27, 'sideways_use_sma': True, 'sideways_use_ema': True, 'sideways_use_atr': False, 'sideways_use_adx': False, 'sideways_use_spike': False, 'sideways_rsi_required': True}.
[I 2025-08-31 10:57:37,749] Trial 490 finished with values: [-1000000000.0, 1000000000.0] and parameters: {'p_sma': 47, 'p_std': 24, 'p_atr': 26, 'p_adx': 14, 'rsi_period': 62, 'ema1': 24, 'ema2': 23, 'slip_atr_k': 0.03412876290271245, 'slip_spread_k': 0.5207373313410527, 'spread_hl_frac': 0.007580662678308151, 'bb_std_mult': 1.4061459718289164, 'rsi_os': 27, 'rsi_ob': 79, 'vol_spike': 0.25381231057286613, 'adx_thresh': 28.1372335513285, 'atr_min_pct': 0.006941240413635984, 'atr_max_pct': 0.09094718622447714, 'tp_mult': 2.483250803981726, 'tsl_mult': 0.30675343729188803, 'strategy': 'mean_reversion', 'time_stop': 54, 'use_sma': True, 'use_atr': False, 'use_adx': True, 'use_ema': True, 'use_spike': True, 'rsi_required': True, 'edge_k': 0.2588449095236099, 'edge_cap': 0.722082971127144, 'bull_strategy': 'mean_reversion', 'bull_bb_std_mult': 1.1880143030893007, 'bull_rsi_os': 14, 'bull_rsi_ob': 73, 'bull_adx_thresh': 7.99774319383282, 'bull_atr_min_pct': 0.008275054130412862, 'bull_atr_max_pct': 0.09574813381230331, 'bull_tp_mult': 2.663026507417261, 'bull_tsl_mult': 0.40731034142292133, 'bull_time_stop': 87, 'bull_use_sma': False, 'bull_use_ema': False, 'bull_use_atr': False, 'bull_use_adx': False, 'bull_use_spike': False, 'bull_rsi_required': True, 'bear_strategy': 'breakout', 'bear_bb_std_mult': 2.0714805338814988, 'bear_rsi_os': 43, 'bear_rsi_ob': 91, 'bear_adx_thresh': 6.7519628420353905, 'bear_atr_min_pct': 0.0051129988526496155, 'bear_atr_max_pct': 0.10182172274794186, 'bear_tp_mult': 2.7648278573298883, 'bear_tsl_mult': 0.5364430323009294, 'bear_time_stop': 40, 'bear_use_sma': True, 'bear_use_ema': True, 'bear_use_atr': False, 'bear_use_adx': False, 'bear_use_spike': True, 'bear_rsi_required': False, 'sideways_strategy': 'mean_reversion', 'sideways_bb_std_mult': 2.13058592827471, 'sideways_rsi_os': 45, 'sideways_rsi_ob': 52, 'sideways_adx_thresh': 25.28898789863097, 'sideways_atr_min_pct': 0.017289024893988036, 'sideways_atr_max_pct': 0.03329860492156548, 'sideways_tp_mult': 1.7124792500410382, 'sideways_tsl_mult': 0.1298683377612791, 'sideways_time_stop': 9, 'sideways_use_sma': True, 'sideways_use_ema': True, 'sideways_use_atr': False, 'sideways_use_adx': False, 'sideways_use_spike': False, 'sideways_rsi_required': True}.
[I 2025-08-31 10:57:38,151] Trial 491 finished with values: [-1000000000.0, 1000000000.0] and parameters: {'p_sma': 5, 'p_std': 25, 'p_atr': 17, 'p_adx': 14, 'rsi_period': 53, 'ema1': 14, 'ema2': 24, 'slip_atr_k': 0.10601970388966855, 'slip_spread_k': 0.4090140302577032, 'spread_hl_frac': 0.03465764192346387, 'bb_std_mult': 2.6400403016216005, 'rsi_os': 24, 'rsi_ob': 75, 'vol_spike': 0.2531589575025941, 'adx_thresh': 14.072478330030261, 'atr_min_pct': 0.0072749488058013005, 'atr_max_pct': 0.09103944816503914, 'tp_mult': 2.4906424890767935, 'tsl_mult': 0.30926709452443596, 'strategy': 'mean_reversion', 'time_stop': 63, 'use_sma': True, 'use_atr': False, 'use_adx': True, 'use_ema': False, 'use_spike': True, 'rsi_required': True, 'edge_k': 1.51544220331841, 'edge_cap': 0.38632244262934573, 'bull_strategy': 'mean_reversion', 'bull_bb_std_mult': 2.1349368690426265, 'bull_rsi_os': 8, 'bull_rsi_ob': 73, 'bull_adx_thresh': 7.881941467902506, 'bull_atr_min_pct': 6.100101751142263e-05, 'bull_atr_max_pct': 0.09577838833148351, 'bull_tp_mult': 2.144808651694501, 'bull_tsl_mult': 0.6777400109217387, 'bull_time_stop': 84, 'bull_use_sma': False, 'bull_use_ema': False, 'bull_use_atr': False, 'bull_use_adx': False, 'bull_use_spike': False, 'bull_rsi_required': True, 'bear_strategy': 'breakout', 'bear_bb_std_mult': 2.0756534658204986, 'bear_rsi_os': 42, 'bear_rsi_ob': 86, 'bear_adx_thresh': 24.314097231713646, 'bear_atr_min_pct': 0.007048955474279642, 'bear_atr_max_pct': 0.13789701175594818, 'bear_tp_mult': 2.7570732754322576, 'bear_tsl_mult': 0.5584331657940533, 'bear_time_stop': 85, 'bear_use_sma': True, 'bear_use_ema': False, 'bear_use_atr': True, 'bear_use_adx': True, 'bear_use_spike': True, 'bear_rsi_required': True, 'sideways_strategy': 'mean_reversion', 'sideways_bb_std_mult': 2.4576629033592754, 'sideways_rsi_os': 5, 'sideways_rsi_ob': 95, 'sideways_adx_thresh': 9.288908047636282, 'sideways_atr_min_pct': 0.01766878947190335, 'sideways_atr_max_pct': 0.03283553642075764, 'sideways_tp_mult': 1.063404255946402, 'sideways_tsl_mult': 0.3574017934526602, 'sideways_time_stop': 28, 'sideways_use_sma': True, 'sideways_use_ema': True, 'sideways_use_atr': True, 'sideways_use_adx': False, 'sideways_use_spike': False, 'sideways_rsi_required': False}.
[I 2025-08-31 10:57:38,300] Trial 492 finished with values: [-0.06409216764629144, 0.06402312058243438] and parameters: {'p_sma': 31, 'p_std': 25, 'p_atr': 10, 'p_adx': 14, 'rsi_period': 47, 'ema1': 14, 'ema2': 57, 'slip_atr_k': 0.13079997117726738, 'slip_spread_k': 0.33376032503707986, 'spread_hl_frac': 0.0074425342674797074, 'bb_std_mult': 2.872227547289138, 'rsi_os': 24, 'rsi_ob': 95, 'vol_spike': 0.1530832961997848, 'adx_thresh': 17.819388204061674, 'atr_min_pct': 0.007088438360756224, 'atr_max_pct': 0.13195699000531305, 'tp_mult': 2.4984174155795604, 'tsl_mult': 0.3012151186483124, 'strategy': 'mean_reversion', 'time_stop': 284, 'use_sma': False, 'use_atr': False, 'use_adx': True, 'use_ema': True, 'use_spike': False, 'rsi_required': True, 'edge_k': 0.250839698861209, 'edge_cap': 0.38130875528691177, 'bull_strategy': 'mean_reversion', 'bull_bb_std_mult': 3.3521306807195836, 'bull_rsi_os': 14, 'bull_rsi_ob': 73, 'bull_adx_thresh': 8.059237636157706, 'bull_atr_min_pct': 5.786018478074525e-05, 'bull_atr_max_pct': 0.09604626102712135, 'bull_tp_mult': 2.1548119898945988, 'bull_tsl_mult': 0.6708027996987675, 'bull_time_stop': 18, 'bull_use_sma': True, 'bull_use_ema': False, 'bull_use_atr': False, 'bull_use_adx': True, 'bull_use_spike': False, 'bull_rsi_required': True, 'bear_strategy': 'breakout', 'bear_bb_std_mult': 2.0715992643421846, 'bear_rsi_os': 41, 'bear_rsi_ob': 91, 'bear_adx_thresh': 5.737646609688495, 'bear_atr_min_pct': 0.021737382166553677, 'bear_atr_max_pct': 0.13613177455320763, 'bear_tp_mult': 2.7606628242212734, 'bear_tsl_mult': 0.5535658962361595, 'bear_time_stop': 116, 'bear_use_sma': True, 'bear_use_ema': True, 'bear_use_atr': False, 'bear_use_adx': False, 'bear_use_spike': True, 'bear_rsi_required': False, 'sideways_strategy': 'mean_reversion', 'sideways_bb_std_mult': 3.5199103645137453, 'sideways_rsi_os': 37, 'sideways_rsi_ob': 95, 'sideways_adx_thresh': 7.912292059802677, 'sideways_atr_min_pct': 0.017928444027195452, 'sideways_atr_max_pct': 0.03348498164587147, 'sideways_tp_mult': 1.9452599044311978, 'sideways_tsl_mult': 0.13753811946857528, 'sideways_time_stop': 28, 'sideways_use_sma': True, 'sideways_use_ema': True, 'sideways_use_atr': False, 'sideways_use_adx': False, 'sideways_use_spike': False, 'sideways_rsi_required': False}.
[I 2025-08-31 10:57:39,201] Trial 493 finished with values: [-1000000000.0, 1000000000.0] and parameters: {'p_sma': 35, 'p_std': 28, 'p_atr': 10, 'p_adx': 13, 'rsi_period': 43, 'ema1': 14, 'ema2': 57, 'slip_atr_k': 0.2499113864784499, 'slip_spread_k': 0.7120593459160074, 'spread_hl_frac': 0.007613852672056578, 'bb_std_mult': 1.4409322674018967, 'rsi_os': 47, 'rsi_ob': 52, 'vol_spike': 0.25500014879347815, 'adx_thresh': 20.312353003157916, 'atr_min_pct': 0.007086793770008105, 'atr_max_pct': 0.1434352308298673, 'tp_mult': 1.494408946714131, 'tsl_mult': 0.3036500380008877, 'strategy': 'breakout', 'time_stop': 83, 'use_sma': False, 'use_atr': False, 'use_adx': True, 'use_ema': True, 'use_spike': False, 'rsi_required': True, 'edge_k': 0.24834794869268834, 'edge_cap': 0.7226473264908295, 'bull_strategy': 'mean_reversion', 'bull_bb_std_mult': 3.00201310524375, 'bull_rsi_os': 12, 'bull_rsi_ob': 84, 'bull_adx_thresh': 8.043727516750979, 'bull_atr_min_pct': 0.018759663849274532, 'bull_atr_max_pct': 0.08724648875583636, 'bull_tp_mult': 1.692393776721499, 'bull_tsl_mult': 0.8113968036462846, 'bull_time_stop': 134, 'bull_use_sma': True, 'bull_use_ema': False, 'bull_use_atr': False, 'bull_use_adx': True, 'bull_use_spike': False, 'bull_rsi_required': True, 'bear_strategy': 'breakout', 'bear_bb_std_mult': 1.7410784202000227, 'bear_rsi_os': 41, 'bear_rsi_ob': 54, 'bear_adx_thresh': 5.698154948555091, 'bear_atr_min_pct': 0.018584181437085966, 'bear_atr_max_pct': 0.11616228188297423, 'bear_tp_mult': 2.3130897520622735, 'bear_tsl_mult': 0.4243586080236088, 'bear_time_stop': 23, 'bear_use_sma': False, 'bear_use_ema': True, 'bear_use_atr': False, 'bear_use_adx': False, 'bear_use_spike': True, 'bear_rsi_required': False, 'sideways_strategy': 'mean_reversion', 'sideways_bb_std_mult': 2.1213798574580873, 'sideways_rsi_os': 29, 'sideways_rsi_ob': 95, 'sideways_adx_thresh': 26.65552087509595, 'sideways_atr_min_pct': 0.017779384197372034, 'sideways_atr_max_pct': 0.027808107113171325, 'sideways_tp_mult': 1.9330501169466456, 'sideways_tsl_mult': 0.12239312735134363, 'sideways_time_stop': 13, 'sideways_use_sma': False, 'sideways_use_ema': False, 'sideways_use_atr': False, 'sideways_use_adx': False, 'sideways_use_spike': False, 'sideways_rsi_required': False}.
[I 2025-08-31 10:58:13,204] Trial 495 finished with values: [-1000000000.0, 1000000000.0] and parameters: {'p_sma': 35, 'p_std': 5, 'p_atr': 7, 'p_adx': 21, 'rsi_period': 47, 'ema1': 14, 'ema2': 57, 'slip_atr_k': 0.229003205293066, 'slip_spread_k': 0.7111251409364647, 'spread_hl_frac': 0.0361091864531713, 'bb_std_mult': 2.7335878159593165, 'rsi_os': 22, 'rsi_ob': 54, 'vol_spike': 0.05242070652495942, 'adx_thresh': 20.31255430367679, 'atr_min_pct': 0.005205869262928293, 'atr_max_pct': 0.09504955508192543, 'tp_mult': 2.808504471128995, 'tsl_mult': 0.24053270802223747, 'strategy': 'breakout', 'time_stop': 285, 'use_sma': False, 'use_atr': False, 'use_adx': True, 'use_ema': True, 'use_spike': False, 'rsi_required': True, 'edge_k': 0.23745292710479526, 'edge_cap': 0.11821744927963179, 'bull_strategy': 'breakout', 'bull_bb_std_mult': 0.8539468539050414, 'bull_rsi_os': 6, 'bull_rsi_ob': 76, 'bull_adx_thresh': 9.232059051570186, 'bull_atr_min_pct': 0.004555340074343219, 'bull_atr_max_pct': 0.08719062854937148, 'bull_tp_mult': 2.038250600839809, 'bull_tsl_mult': 0.7627776798332497, 'bull_time_stop': 133, 'bull_use_sma': True, 'bull_use_ema': False, 'bull_use_atr': False, 'bull_use_adx': True, 'bull_use_spike': False, 'bull_rsi_required': True, 'bear_strategy': 'breakout', 'bear_bb_std_mult': 1.6280733947871757, 'bear_rsi_os': 41, 'bear_rsi_ob': 85, 'bear_adx_thresh': 5.903866896194409, 'bear_atr_min_pct': 0.010587182347291113, 'bear_atr_max_pct': 0.13154214712314435, 'bear_tp_mult': 2.8963725673772855, 'bear_tsl_mult': 0.41860023423330583, 'bear_time_stop': 25, 'bear_use_sma': False, 'bear_use_ema': True, 'bear_use_atr': False, 'bear_use_adx': False, 'bear_use_spike': False, 'bear_rsi_required': False, 'sideways_strategy': 'mean_reversion', 'sideways_bb_std_mult': 0.6208997551970763, 'sideways_rsi_os': 6, 'sideways_rsi_ob': 93, 'sideways_adx_thresh': 26.57437978073062, 'sideways_atr_min_pct': 0.002370212338503817, 'sideways_atr_max_pct': 0.028287102501861096, 'sideways_tp_mult': 1.4702955524300625, 'sideways_tsl_mult': 0.09181686382314025, 'sideways_time_stop': 93, 'sideways_use_sma': False, 'sideways_use_ema': False, 'sideways_use_atr': False, 'sideways_use_adx': False, 'sideways_use_spike': False, 'sideways_rsi_required': False}.
