[I 2025-08-31 11:47:36,423] Trial 849 finished with values: [-1000000000.0, 1000000000.0] and parameters: {'p_sma': 12, 'p_std': 27, 'p_atr': 12, 'p_adx': 14, 'rsi_period': 53, 'ema1': 19, 'ema2': 32, 'slip_atr_k': 0.22995474089872225, 'slip_spread_k': 0.15091736073174136, 'spread_hl_frac': 0.03650794017023088, 'bb_std_mult': 2.1763013285705903, 'rsi_os': 31, 'rsi_ob': 92, 'vol_spike': 0.11296293613820653, 'adx_thresh': 23.066037616750936, 'atr_min_pct': 0.013112945201929592, 'atr_max_pct': 0.13904843341671239, 'tp_mult': 1.365168209189142, 'tsl_mult': 0.9863631715391667, 'strategy': 'mean_reversion', 'time_stop': 184, 'use_sma': True, 'use_atr': True, 'use_adx': False, 'use_ema': True, 'use_spike': True, 'rsi_required': False, 'edge_k': 0.44471130600979586, 'edge_cap': 0.656183751782515, 'bull_strategy': 'breakout', 'bull_bb_std_mult': 0.6110662418629623, 'bull_rsi_os': 23, 'bull_rsi_ob': 93, 'bull_adx_thresh': 6.563379155270439, 'bull_atr_min_pct': 0.0033045388437900215, 'bull_atr_max_pct': 0.11545966321398055, 'bull_tp_mult': 2.406116103159449, 'bull_tsl_mult': 0.8092190439234064, 'bull_time_stop': 271, 'bull_use_sma': False, 'bull_use_ema': True, 'bull_use_atr': False, 'bull_use_adx': False, 'bull_use_spike': False, 'bull_rsi_required': True, 'bear_strategy': 'mean_reversion', 'bear_bb_std_mult': 3.240484137573001, 'bear_rsi_os': 46, 'bear_rsi_ob': 71, 'bear_adx_thresh': 5.1076939616421315, 'bear_atr_min_pct': 0.024875307391221936, 'bear_atr_max_pct': 0.1365326639227453, 'bear_tp_mult': 2.8814197600347473, 'bear_tsl_mult': 0.7865417185453454, 'bear_time_stop': 5, 'bear_use_sma': False, 'bear_use_ema': True, 'bear_use_atr': False, 'bear_use_adx': False, 'bear_use_spike': False, 'bear_rsi_required': True, 'sideways_strategy': 'breakout', 'sideways_bb_std_mult': 2.703653692603598, 'sideways_rsi_os': 20, 'sideways_rsi_ob': 48, 'sideways_adx_thresh': 11.855452583273296, 'sideways_atr_min_pct': 0.026422463470289943, 'sideways_atr_max_pct': 0.041616363784637324, 'sideways_tp_mult': 2.842975872184618, 'sideways_tsl_mult': 0.38540911019166557, 'sideways_time_stop': 16, 'sideways_use_sma': True, 'sideways_use_ema': False, 'sideways_use_atr': True, 'sideways_use_adx': False, 'sideways_use_spike': True, 'sideways_rsi_required': True}.
[I 2025-08-31 11:47:36,781] Trial 846 finished with values: [-1000000000.0, 1000000000.0] and parameters: {'p_sma': 29, 'p_std': 28, 'p_atr': 12, 'p_adx': 20, 'rsi_period': 54, 'ema1': 12, 'ema2': 39, 'slip_atr_k': 0.2324898492629053, 'slip_spread_k': 0.14986112838339616, 'spread_hl_frac': 0.016858865884383577, 'bb_std_mult': 2.1445331316647946, 'rsi_os': 31, 'rsi_ob': 94, 'vol_spike': 0.12127022312765237, 'adx_thresh': 25.22372275769578, 'atr_min_pct': 0.012858241617172288, 'atr_max_pct': 0.13933215973183338, 'tp_mult': 1.541078270622331, 'tsl_mult': 0.10417823271541293, 'strategy': 'mean_reversion', 'time_stop': 187, 'use_sma': False, 'use_atr': True, 'use_adx': False, 'use_ema': True, 'use_spike': True, 'rsi_required': False, 'edge_k': 0.5509002653025927, 'edge_cap': 0.9476882102098797, 'bull_strategy': 'mean_reversion', 'bull_bb_std_mult': 0.5853788534695058, 'bull_rsi_os': 21, 'bull_rsi_ob': 79, 'bull_adx_thresh': 6.1363058942054245, 'bull_atr_min_pct': 0.0038546476683414903, 'bull_atr_max_pct': 0.018628232585572967, 'bull_tp_mult': 2.616496117752196, 'bull_tsl_mult': 0.7946804062178785, 'bull_time_stop': 266, 'bull_use_sma': False, 'bull_use_ema': True, 'bull_use_atr': False, 'bull_use_adx': False, 'bull_use_spike': False, 'bull_rsi_required': True, 'bear_strategy': 'mean_reversion', 'bear_bb_std_mult': 3.34149840871599, 'bear_rsi_os': 45, 'bear_rsi_ob': 70, 'bear_adx_thresh': 5.0061743572252855, 'bear_atr_min_pct': 0.023011870371051943, 'bear_atr_max_pct': 0.07422114943386085, 'bear_tp_mult': 2.873235060550315, 'bear_tsl_mult': 0.8174165966034231, 'bear_time_stop': 6, 'bear_use_sma': True, 'bear_use_ema': True, 'bear_use_atr': True, 'bear_use_adx': False, 'bear_use_spike': False, 'bear_rsi_required': True, 'sideways_strategy': 'breakout', 'sideways_bb_std_mult': 2.495706105782309, 'sideways_rsi_os': 24, 'sideways_rsi_ob': 95, 'sideways_adx_thresh': 11.870162025587321, 'sideways_atr_min_pct': 0.0248479563703239, 'sideways_atr_max_pct': 0.041820834625556455, 'sideways_tp_mult': 2.8512022575960145, 'sideways_tsl_mult': 0.3924916576615612, 'sideways_time_stop': 16, 'sideways_use_sma': True, 'sideways_use_ema': False, 'sideways_use_atr': True, 'sideways_use_adx': False, 'sideways_use_spike': True, 'sideways_rsi_required': True}.
[I 2025-08-31 11:47:36,787] Trial 848 finished with values: [-0.007709579887865248, 0.00844966944248232] and parameters: {'p_sma': 20, 'p_std': 27, 'p_atr': 12, 'p_adx': 10, 'rsi_period': 54, 'ema1': 13, 'ema2': 32, 'slip_atr_k': 0.047553435414755554, 'slip_spread_k': 0.15523293058722243, 'spread_hl_frac': 0.016813931173306297, 'bb_std_mult': 2.1376540705648623, 'rsi_os': 31, 'rsi_ob': 69, 'vol_spike': 0.12186985104952636, 'adx_thresh': 11.564589773720684, 'atr_min_pct': 0.012742996798794648, 'atr_max_pct': 0.1390250539490108, 'tp_mult': 1.5392297681328513, 'tsl_mult': 0.11231373201441965, 'strategy': 'mean_reversion', 'time_stop': 188, 'use_sma': True, 'use_atr': True, 'use_adx': False, 'use_ema': True, 'use_spike': True, 'rsi_required': False, 'edge_k': 0.4479983795402486, 'edge_cap': 0.6685134037511382, 'bull_strategy': 'mean_reversion', 'bull_bb_std_mult': 0.6061075541145476, 'bull_rsi_os': 23, 'bull_rsi_ob': 62, 'bull_adx_thresh': 6.3968737401686715, 'bull_atr_min_pct': 0.002454603075186369, 'bull_atr_max_pct': 0.12574551337745823, 'bull_tp_mult': 2.4326823240708517, 'bull_tsl_mult': 0.8026406535933917, 'bull_time_stop': 267, 'bull_use_sma': False, 'bull_use_ema': True, 'bull_use_atr': False, 'bull_use_adx': False, 'bull_use_spike': False, 'bull_rsi_required': True, 'bear_strategy': 'mean_reversion', 'bear_bb_std_mult': 3.3451129479680706, 'bear_rsi_os': 45, 'bear_rsi_ob': 71, 'bear_adx_thresh': 5.089764359665301, 'bear_atr_min_pct': 0.0036495878921503425, 'bear_atr_max_pct': 0.13675424534295172, 'bear_tp_mult': 2.8892826769111766, 'bear_tsl_mult': 0.7864464256987324, 'bear_time_stop': 12, 'bear_use_sma': False, 'bear_use_ema': True, 'bear_use_atr': True, 'bear_use_adx': False, 'bear_use_spike': False, 'bear_rsi_required': True, 'sideways_strategy': 'breakout', 'sideways_bb_std_mult': 2.5977257204486652, 'sideways_rsi_os': 36, 'sideways_rsi_ob': 78, 'sideways_adx_thresh': 11.811324756871693, 'sideways_atr_min_pct': 0.002947785834822636, 'sideways_atr_max_pct': 0.0494106322319374, 'sideways_tp_mult': 2.85275576826654, 'sideways_tsl_mult': 0.38722451931455043, 'sideways_time_stop': 16, 'sideways_use_sma': True, 'sideways_use_ema': False, 'sideways_use_atr': True, 'sideways_use_adx': False, 'sideways_use_spike': True, 'sideways_rsi_required': True}.
[I 2025-08-31 11:47:37,177] Trial 847 finished with values: [-1000000000.0, 1000000000.0] and parameters: {'p_sma': 12, 'p_std': 27, 'p_atr': 12, 'p_adx': 14, 'rsi_period': 54, 'ema1': 12, 'ema2': 38, 'slip_atr_k': 0.03460299633995976, 'slip_spread_k': 0.1564289078536742, 'spread_hl_frac': 0.02053663295276579, 'bb_std_mult': 2.189256139158609, 'rsi_os': 31, 'rsi_ob': 92, 'vol_spike': 0.12242191708867753, 'adx_thresh': 31.519417723689134, 'atr_min_pct': 0.012729480859283491, 'atr_max_pct': 0.13876257736900127, 'tp_mult': 1.528825914709507, 'tsl_mult': 0.1063315595708394, 'strategy': 'mean_reversion', 'time_stop': 187, 'use_sma': True, 'use_atr': True, 'use_adx': False, 'use_ema': True, 'use_spike': True, 'rsi_required': False, 'edge_k': 0.3896103812862351, 'edge_cap': 0.7695125358994079, 'bull_strategy': 'breakout', 'bull_bb_std_mult': 0.6028496771606493, 'bull_rsi_os': 20, 'bull_rsi_ob': 82, 'bull_adx_thresh': 17.81999811116859, 'bull_atr_min_pct': 0.02778912430326023, 'bull_atr_max_pct': 0.014854029807960703, 'bull_tp_mult': 2.1339329618460017, 'bull_tsl_mult': 0.8088614969538661, 'bull_time_stop': 269, 'bull_use_sma': False, 'bull_use_ema': True, 'bull_use_atr': False, 'bull_use_adx': False, 'bull_use_spike': False, 'bull_rsi_required': True, 'bear_strategy': 'mean_reversion', 'bear_bb_std_mult': 3.256905502887621, 'bear_rsi_os': 45, 'bear_rsi_ob': 71, 'bear_adx_thresh': 5.59236155589103, 'bear_atr_min_pct': 0.016857666140970975, 'bear_atr_max_pct': 0.13597932178024605, 'bear_tp_mult': 2.8844633081014086, 'bear_tsl_mult': 0.7898167645696984, 'bear_time_stop': 19, 'bear_use_sma': False, 'bear_use_ema': True, 'bear_use_atr': True, 'bear_use_adx': False, 'bear_use_spike': False, 'bear_rsi_required': True, 'sideways_strategy': 'breakout', 'sideways_bb_std_mult': 2.4884439924464226, 'sideways_rsi_os': 24, 'sideways_rsi_ob': 95, 'sideways_adx_thresh': 10.992535487769304, 'sideways_atr_min_pct': 0.012868502978060026, 'sideways_atr_max_pct': 0.049283843162110055, 'sideways_tp_mult': 2.8614328317906503, 'sideways_tsl_mult': 0.4796527496319857, 'sideways_time_stop': 183, 'sideways_use_sma': True, 'sideways_use_ema': False, 'sideways_use_atr': True, 'sideways_use_adx': False, 'sideways_use_spike': True, 'sideways_rsi_required': True}.
[I 2025-08-31 11:48:13,818] Trial 850 finished with values: [-1000000000.0, 1000000000.0] and parameters: {'p_sma': 12, 'p_std': 26, 'p_atr': 13, 'p_adx': 24, 'rsi_period': 80, 'ema1': 13, 'ema2': 37, 'slip_atr_k': 0.02443693831734612, 'slip_spread_k': 0.907273694373006, 'spread_hl_frac': 0.02753637528360084, 'bb_std_mult': 2.504925750903655, 'rsi_os': 31, 'rsi_ob': 85, 'vol_spike': 0.12186481253831918, 'adx_thresh': 30.157588813471442, 'atr_min_pct': 0.013081671460182614, 'atr_max_pct': 0.12799394805486558, 'tp_mult': 1.5306514419220831, 'tsl_mult': 0.1060299485438191, 'strategy': 'mean_reversion', 'time_stop': 190, 'use_sma': True, 'use_atr': True, 'use_adx': False, 'use_ema': False, 'use_spike': True, 'rsi_required': False, 'edge_k': 0.38799996537791104, 'edge_cap': 0.9565925011983887, 'bull_strategy': 'breakout', 'bull_bb_std_mult': 0.5696319386326512, 'bull_rsi_os': 21, 'bull_rsi_ob': 68, 'bull_adx_thresh': 20.419613853739424, 'bull_atr_min_pct': 0.01788502319454196, 'bull_atr_max_pct': 0.10351853454447814, 'bull_tp_mult': 2.9532615638769664, 'bull_tsl_mult': 0.8269033859109469, 'bull_time_stop': 263, 'bull_use_sma': False, 'bull_use_ema': True, 'bull_use_atr': False, 'bull_use_adx': False, 'bull_use_spike': False, 'bull_rsi_required': True, 'bear_strategy': 'mean_reversion', 'bear_bb_std_mult': 3.373648030380254, 'bear_rsi_os': 45, 'bear_rsi_ob': 71, 'bear_adx_thresh': 5.047227084245991, 'bear_atr_min_pct': 0.027299912980550303, 'bear_atr_max_pct': 0.14157557931315384, 'bear_tp_mult': 2.881337459035851, 'bear_tsl_mult': 0.8205057559286727, 'bear_time_stop': 20, 'bear_use_sma': False, 'bear_use_ema': True, 'bear_use_atr': False, 'bear_use_adx': True, 'bear_use_spike': False, 'bear_rsi_required': True, 'sideways_strategy': 'breakout', 'sideways_bb_std_mult': 2.695871251000015, 'sideways_rsi_os': 24, 'sideways_rsi_ob': 62, 'sideways_adx_thresh': 12.673896844605702, 'sideways_atr_min_pct': 0.00156503676450836, 'sideways_atr_max_pct': 0.11154556707363422, 'sideways_tp_mult': 2.8670773683169837, 'sideways_tsl_mult': 0.3882369460769007, 'sideways_time_stop': 15, 'sideways_use_sma': True, 'sideways_use_ema': False, 'sideways_use_atr': True, 'sideways_use_adx': False, 'sideways_use_spike': True, 'sideways_rsi_required': True}.
[I 2025-08-31 11:48:14,259] Trial 852 finished with values: [-1000000000.0, 1000000000.0] and parameters: {'p_sma': 12, 'p_std': 46, 'p_atr': 13, 'p_adx': 14, 'rsi_period': 52, 'ema1': 18, 'ema2': 37, 'slip_atr_k': 0.02211259921735939, 'slip_spread_k': 0.25838899109094915, 'spread_hl_frac': 0.00010976750797775728, 'bb_std_mult': 2.506702880739981, 'rsi_os': 32, 'rsi_ob': 92, 'vol_spike': 0.1147545297118756, 'adx_thresh': 5.5568360708072575, 'atr_min_pct': 0.013558498784881017, 'atr_max_pct': 0.13659467610073062, 'tp_mult': 1.5073978270133674, 'tsl_mult': 0.14558710945755599, 'strategy': 'breakout', 'time_stop': 198, 'use_sma': True, 'use_atr': True, 'use_adx': False, 'use_ema': False, 'use_spike': True, 'rsi_required': False, 'edge_k': 0.3898911460081009, 'edge_cap': 0.7991969859936875, 'bull_strategy': 'breakout', 'bull_bb_std_mult': 0.5829669886596552, 'bull_rsi_os': 26, 'bull_rsi_ob': 51, 'bull_adx_thresh': 31.302086333102388, 'bull_atr_min_pct': 0.013913378040814748, 'bull_atr_max_pct': 0.12499231182388003, 'bull_tp_mult': 2.6943083212380623, 'bull_tsl_mult': 0.8269769172157092, 'bull_time_stop': 271, 'bull_use_sma': False, 'bull_use_ema': True, 'bull_use_atr': False, 'bull_use_adx': False, 'bull_use_spike': False, 'bull_rsi_required': True, 'bear_strategy': 'breakout', 'bear_bb_std_mult': 3.3940578670899906, 'bear_rsi_os': 45, 'bear_rsi_ob': 71, 'bear_adx_thresh': 5.00608278298561, 'bear_atr_min_pct': 0.0039378270241830415, 'bear_atr_max_pct': 0.14114340508149126, 'bear_tp_mult': 2.8916248761667083, 'bear_tsl_mult': 0.7992097580746603, 'bear_time_stop': 12, 'bear_use_sma': False, 'bear_use_ema': False, 'bear_use_atr': False, 'bear_use_adx': True, 'bear_use_spike': False, 'bear_rsi_required': True, 'sideways_strategy': 'breakout', 'sideways_bb_std_mult': 2.6198497634390288, 'sideways_rsi_os': 35, 'sideways_rsi_ob': 95, 'sideways_adx_thresh': 11.124060687751774, 'sideways_atr_min_pct': 0.0062405846202365275, 'sideways_atr_max_pct': 0.048738244591579855, 'sideways_tp_mult': 2.8823877030079643, 'sideways_tsl_mult': 0.38626279679262, 'sideways_time_stop': 197, 'sideways_use_sma': False, 'sideways_use_ema': True, 'sideways_use_atr': True, 'sideways_use_adx': False, 'sideways_use_spike': True, 'sideways_rsi_required': True}.
[I 2025-08-31 11:48:14,697] Trial 851 finished with values: [-0.02864271915279437, 0.02847086211156908] and parameters: {'p_sma': 20, 'p_std': 27, 'p_atr': 13, 'p_adx': 14, 'rsi_period': 35, 'ema1': 18, 'ema2': 42, 'slip_atr_k': 0.02411340331452544, 'slip_spread_k': 0.3950141100481908, 'spread_hl_frac': 0.0066735376899388285, 'bb_std_mult': 2.50288596446835, 'rsi_os': 32, 'rsi_ob': 48, 'vol_spike': 0.12202690844905201, 'adx_thresh': 5.552934575961267, 'atr_min_pct': 0.012759040300187496, 'atr_max_pct': 0.13635535168715068, 'tp_mult': 1.5241663895344713, 'tsl_mult': 0.14416684664939555, 'strategy': 'breakout', 'time_stop': 188, 'use_sma': True, 'use_atr': True, 'use_adx': False, 'use_ema': False, 'use_spike': True, 'rsi_required': False, 'edge_k': 0.3875457375226008, 'edge_cap': 0.8087826062457607, 'bull_strategy': 'breakout', 'bull_bb_std_mult': 0.5622776347514732, 'bull_rsi_os': 26, 'bull_rsi_ob': 62, 'bull_adx_thresh': 18.4396039159791, 'bull_atr_min_pct': 0.0021820306845103266, 'bull_atr_max_pct': 0.10393566153994681, 'bull_tp_mult': 2.6691388641442764, 'bull_tsl_mult': 0.7684007666214944, 'bull_time_stop': 271, 'bull_use_sma': False, 'bull_use_ema': True, 'bull_use_atr': False, 'bull_use_adx': False, 'bull_use_spike': False, 'bull_rsi_required': True, 'bear_strategy': 'breakout', 'bear_bb_std_mult': 3.247407330186559, 'bear_rsi_os': 45, 'bear_rsi_ob': 71, 'bear_adx_thresh': 5.030161024149594, 'bear_atr_min_pct': 0.0037575308600964396, 'bear_atr_max_pct': 0.14120748201551037, 'bear_tp_mult': 2.912826038171523, 'bear_tsl_mult': 0.791820257870511, 'bear_time_stop': 19, 'bear_use_sma': False, 'bear_use_ema': False, 'bear_use_atr': False, 'bear_use_adx': True, 'bear_use_spike': False, 'bear_rsi_required': True, 'sideways_strategy': 'breakout', 'sideways_bb_std_mult': 2.6924072027257524, 'sideways_rsi_os': 24, 'sideways_rsi_ob': 70, 'sideways_adx_thresh': 12.583119059090002, 'sideways_atr_min_pct': 0.016198019595782338, 'sideways_atr_max_pct': 0.04963030684454734, 'sideways_tp_mult': 2.8735006312441347, 'sideways_tsl_mult': 0.44323864540045066, 'sideways_time_stop': 292, 'sideways_use_sma': False, 'sideways_use_ema': True, 'sideways_use_atr': True, 'sideways_use_adx': False, 'sideways_use_spike': True, 'sideways_rsi_required': True}.
[I 2025-08-31 11:48:14,797] Trial 853 finished with values: [-0.04271186860350351, 0.04340712764751924] and parameters: {'p_sma': 55, 'p_std': 30, 'p_atr': 13, 'p_adx': 14, 'rsi_period': 80, 'ema1': 29, 'ema2': 42, 'slip_atr_k': 0.07618703026982923, 'slip_spread_k': 0.3430478292085517, 'spread_hl_frac': 0.0015373380498648892, 'bb_std_mult': 2.5031041378604515, 'rsi_os': 32, 'rsi_ob': 48, 'vol_spike': 0.11040794285457851, 'adx_thresh': 21.135443913029405, 'atr_min_pct': 0.01337922491083945, 'atr_max_pct': 0.1356184133607874, 'tp_mult': 1.2746935094767504, 'tsl_mult': 0.11427375988445962, 'strategy': 'breakout', 'time_stop': 198, 'use_sma': True, 'use_atr': True, 'use_adx': False, 'use_ema': False, 'use_spike': True, 'rsi_required': False, 'edge_k': 0.4506535033542284, 'edge_cap': 0.7943699667696948, 'bull_strategy': 'breakout', 'bull_bb_std_mult': 0.5713189402154413, 'bull_rsi_os': 22, 'bull_rsi_ob': 64, 'bull_adx_thresh': 5.003275067842787, 'bull_atr_min_pct': 0.020547357100993882, 'bull_atr_max_pct': 0.1036575074504417, 'bull_tp_mult': 2.6787514114434456, 'bull_tsl_mult': 0.8251322989117472, 'bull_time_stop': 274, 'bull_use_sma': False, 'bull_use_ema': True, 'bull_use_atr': False, 'bull_use_adx': False, 'bull_use_spike': False, 'bull_rsi_required': True, 'bear_strategy': 'breakout', 'bear_bb_std_mult': 3.368534767230248, 'bear_rsi_os': 44, 'bear_rsi_ob': 69, 'bear_adx_thresh': 5.71154879472978, 'bear_atr_min_pct': 0.0036842438682885286, 'bear_atr_max_pct': 0.1403910770724513, 'bear_tp_mult': 2.890849025073213, 'bear_tsl_mult': 0.795572699336967, 'bear_time_stop': 21, 'bear_use_sma': False, 'bear_use_ema': False, 'bear_use_atr': False, 'bear_use_adx': True, 'bear_use_spike': False, 'bear_rsi_required': True, 'sideways_strategy': 'breakout', 'sideways_bb_std_mult': 2.6965957077468077, 'sideways_rsi_os': 35, 'sideways_rsi_ob': 94, 'sideways_adx_thresh': 12.706609993608241, 'sideways_atr_min_pct': 0.01715927478861295, 'sideways_atr_max_pct': 0.04606598063660791, 'sideways_tp_mult': 2.9080541096364185, 'sideways_tsl_mult': 0.3843026557524869, 'sideways_time_stop': 15, 'sideways_use_sma': False, 'sideways_use_ema': True, 'sideways_use_atr': True, 'sideways_use_adx': False, 'sideways_use_spike': True, 'sideways_rsi_required': True}.
[I 2025-08-31 11:48:49,482] Trial 856 finished with values: [-0.012927352624786392, 0.01572558292169623] and parameters: {'p_sma': 49, 'p_std': 29, 'p_atr': 12, 'p_adx': 15, 'rsi_period': 50, 'ema1': 11, 'ema2': 41, 'slip_atr_k': 0.019209761273089973, 'slip_spread_k': 0.4878422208368013, 'spread_hl_frac': 0.0066947435542874965, 'bb_std_mult': 2.35524553308203, 'rsi_os': 31, 'rsi_ob': 66, 'vol_spike': 0.10601545381394131, 'adx_thresh': 6.540509398916546, 'atr_min_pct': 0.013886543432418776, 'atr_max_pct': 0.13321682261532053, 'tp_mult': 1.3351142664434557, 'tsl_mult': 0.9145580071955399, 'strategy': 'breakout', 'time_stop': 197, 'use_sma': True, 'use_atr': True, 'use_adx': False, 'use_ema': True, 'use_spike': True, 'rsi_required': False, 'edge_k': 0.4550742553118672, 'edge_cap': 0.724805969243131, 'bull_strategy': 'mean_reversion', 'bull_bb_std_mult': 0.6193944471739832, 'bull_rsi_os': 24, 'bull_rsi_ob': 49, 'bull_adx_thresh': 13.054679847507884, 'bull_atr_min_pct': 0.004351287932729906, 'bull_atr_max_pct': 0.09535408694123096, 'bull_tp_mult': 2.771176891362619, 'bull_tsl_mult': 0.8760797140573965, 'bull_time_stop': 280, 'bull_use_sma': False, 'bull_use_ema': True, 'bull_use_atr': False, 'bull_use_adx': True, 'bull_use_spike': False, 'bull_rsi_required': False, 'bear_strategy': 'breakout', 'bear_bb_std_mult': 3.2793139378028644, 'bear_rsi_os': 44, 'bear_rsi_ob': 69, 'bear_adx_thresh': 5.6597609217678615, 'bear_atr_min_pct': 0.004660181509953419, 'bear_atr_max_pct': 0.1366097418327323, 'bear_tp_mult': 2.9943127480049103, 'bear_tsl_mult': 0.7547127727007416, 'bear_time_stop': 11, 'bear_use_sma': False, 'bear_use_ema': True, 'bear_use_atr': False, 'bear_use_adx': False, 'bear_use_spike': False, 'bear_rsi_required': True, 'sideways_strategy': 'breakout', 'sideways_bb_std_mult': 2.608728091183386, 'sideways_rsi_os': 21, 'sideways_rsi_ob': 94, 'sideways_adx_thresh': 11.635841367051668, 'sideways_atr_min_pct': 0.02812683405838413, 'sideways_atr_max_pct': 0.04222881083745974, 'sideways_tp_mult': 2.808989202249716, 'sideways_tsl_mult': 0.45959117907281, 'sideways_time_stop': 18, 'sideways_use_sma': False, 'sideways_use_ema': False, 'sideways_use_atr': True, 'sideways_use_adx': False, 'sideways_use_spike': True, 'sideways_rsi_required': True}.
