[I 2025-08-31 11:15:41,552] Trial 630 finished with values: [-0.01124016359704838, 0.012442654890600643] and parameters: {'p_sma': 49, 'p_std': 29, 'p_atr': 24, 'p_adx': 20, 'rsi_period': 51, 'ema1': 14, 'ema2': 31, 'slip_atr_k': 0.006161113313847468, 'slip_spread_k': 0.516639895763695, 'spread_hl_frac': 0.0047702208676366105, 'bb_std_mult': 1.2681239500452888, 'rsi_os': 27, 'rsi_ob': 76, 'vol_spike': 0.015154098405965682, 'adx_thresh': 30.354926029223243, 'atr_min_pct': 0.007170310176124324, 'atr_max_pct': 0.0948035574055567, 'tp_mult': 2.424244401416635, 'tsl_mult': 0.20894743359535034, 'strategy': 'breakout', 'time_stop': 81, 'use_sma': True, 'use_atr': True, 'use_adx': False, 'use_ema': False, 'use_spike': False, 'rsi_required': False, 'edge_k': 0.033942230495707215, 'edge_cap': 0.4129403142960325, 'bull_strategy': 'mean_reversion', 'bull_bb_std_mult': 1.1916313596638273, 'bull_rsi_os': 15, 'bull_rsi_ob': 77, 'bull_adx_thresh': 7.215707523643996, 'bull_atr_min_pct': 0.003669511094878982, 'bull_atr_max_pct': 0.033239484491361805, 'bull_tp_mult': 1.9414005857963657, 'bull_tsl_mult': 0.3919541798276654, 'bull_time_stop': 145, 'bull_use_sma': True, 'bull_use_ema': False, 'bull_use_atr': True, 'bull_use_adx': False, 'bull_use_spike': False, 'bull_rsi_required': True, 'bear_strategy': 'breakout', 'bear_bb_std_mult': 2.2673609711911427, 'bear_rsi_os': 40, 'bear_rsi_ob': 72, 'bear_adx_thresh': 23.87293978258333, 'bear_atr_min_pct': 0.00712394509336404, 'bear_atr_max_pct': 0.11346087757371895, 'bear_tp_mult': 2.2815654560098055, 'bear_tsl_mult': 0.5422762079665203, 'bear_time_stop': 42, 'bear_use_sma': True, 'bear_use_ema': False, 'bear_use_atr': True, 'bear_use_adx': True, 'bear_use_spike': True, 'bear_rsi_required': True, 'sideways_strategy': 'mean_reversion', 'sideways_bb_std_mult': 2.674480792222394, 'sideways_rsi_os': 6, 'sideways_rsi_ob': 45, 'sideways_adx_thresh': 26.210842835007984, 'sideways_atr_min_pct': 0.01856343224283516, 'sideways_atr_max_pct': 0.045439006383949654, 'sideways_tp_mult': 2.4295994164901553, 'sideways_tsl_mult': 0.5672049276883919, 'sideways_time_stop': 208, 'sideways_use_sma': False, 'sideways_use_ema': True, 'sideways_use_atr': False, 'sideways_use_adx': True, 'sideways_use_spike': True, 'sideways_rsi_required': False}.
[I 2025-08-31 11:16:15,030] Trial 634 finished with values: [-1000000000.0, 1000000000.0] and parameters: {'p_sma': 13, 'p_std': 44, 'p_atr': 13, 'p_adx': 28, 'rsi_period': 51, 'ema1': 22, 'ema2': 38, 'slip_atr_k': 0.11787257382671912, 'slip_spread_k': 0.3507853763525612, 'spread_hl_frac': 0.01025367508530502, 'bb_std_mult': 2.502320370345947, 'rsi_os': 35, 'rsi_ob': 51, 'vol_spike': 0.10570513009818325, 'adx_thresh': 28.16912829461686, 'atr_min_pct': 0.01964996404670246, 'atr_max_pct': 0.04261258703416346, 'tp_mult': 1.8899601435094266, 'tsl_mult': 0.21511237925890514, 'strategy': 'mean_reversion', 'time_stop': 83, 'use_sma': True, 'use_atr': True, 'use_adx': False, 'use_ema': True, 'use_spike': True, 'rsi_required': True, 'edge_k': 1.4172956694608516, 'edge_cap': 0.5671280764574872, 'bull_strategy': 'mean_reversion', 'bull_bb_std_mult': 0.7038862755996683, 'bull_rsi_os': 6, 'bull_rsi_ob': 45, 'bull_adx_thresh': 7.297088581504478, 'bull_atr_min_pct': 0.0019777969029249123, 'bull_atr_max_pct': 0.1001670025324058, 'bull_tp_mult': 2.6065244658290836, 'bull_tsl_mult': 0.230113722623299, 'bull_time_stop': 84, 'bull_use_sma': True, 'bull_use_ema': False, 'bull_use_atr': False, 'bull_use_adx': False, 'bull_use_spike': False, 'bull_rsi_required': True, 'bear_strategy': 'breakout', 'bear_bb_std_mult': 1.4564127855043, 'bear_rsi_os': 39, 'bear_rsi_ob': 92, 'bear_adx_thresh': 5.008248544751793, 'bear_atr_min_pct': 0.007028040169173973, 'bear_atr_max_pct': 0.11899372005789466, 'bear_tp_mult': 2.8408175673622993, 'bear_tsl_mult': 0.5231065078683186, 'bear_time_stop': 21, 'bear_use_sma': True, 'bear_use_ema': True, 'bear_use_atr': True, 'bear_use_adx': False, 'bear_use_spike': False, 'bear_rsi_required': False, 'sideways_strategy': 'mean_reversion', 'sideways_bb_std_mult': 3.3270196031882815, 'sideways_rsi_os': 8, 'sideways_rsi_ob': 70, 'sideways_adx_thresh': 7.6835015425791635, 'sideways_atr_min_pct': 0.007914711637687876, 'sideways_atr_max_pct': 0.040311861246587984, 'sideways_tp_mult': 1.221643854717021, 'sideways_tsl_mult': 0.12765615572872524, 'sideways_time_stop': 10, 'sideways_use_sma': True, 'sideways_use_ema': True, 'sideways_use_atr': False, 'sideways_use_adx': False, 'sideways_use_spike': False, 'sideways_rsi_required': True}.
[I 2025-08-31 11:16:15,151] Trial 632 finished with values: [-0.04331448908747404, 0.04307507915495339] and parameters: {'p_sma': 19, 'p_std': 29, 'p_atr': 11, 'p_adx': 14, 'rsi_period': 51, 'ema1': 22, 'ema2': 56, 'slip_atr_k': 0.12092262588493494, 'slip_spread_k': 0.6954034197802108, 'spread_hl_frac': 0.004515537625680223, 'bb_std_mult': 1.9715898430971859, 'rsi_os': 26, 'rsi_ob': 76, 'vol_spike': 0.24417050855253794, 'adx_thresh': 27.8881983857096, 'atr_min_pct': 0.007174984229135796, 'atr_max_pct': 0.12632216793767853, 'tp_mult': 2.091612186784262, 'tsl_mult': 0.2696882569035339, 'strategy': 'mean_reversion', 'time_stop': 257, 'use_sma': True, 'use_atr': True, 'use_adx': False, 'use_ema': True, 'use_spike': False, 'rsi_required': False, 'edge_k': 1.4274910675968313, 'edge_cap': 0.5721853476203221, 'bull_strategy': 'mean_reversion', 'bull_bb_std_mult': 3.409343436386216, 'bull_rsi_os': 6, 'bull_rsi_ob': 59, 'bull_adx_thresh': 7.03990939778588, 'bull_atr_min_pct': 0.002025662155275526, 'bull_atr_max_pct': 0.10576356251146841, 'bull_tp_mult': 1.877203598380261, 'bull_tsl_mult': 0.4012525132550262, 'bull_time_stop': 83, 'bull_use_sma': True, 'bull_use_ema': False, 'bull_use_atr': True, 'bull_use_adx': False, 'bull_use_spike': False, 'bull_rsi_required': True, 'bear_strategy': 'breakout', 'bear_bb_std_mult': 1.4897565878625276, 'bear_rsi_os': 38, 'bear_rsi_ob': 91, 'bear_adx_thresh': 5.013401867416076, 'bear_atr_min_pct': 0.004042850225001137, 'bear_atr_max_pct': 0.12888326617746734, 'bear_tp_mult': 2.195942240711, 'bear_tsl_mult': 0.9473458084879961, 'bear_time_stop': 40, 'bear_use_sma': True, 'bear_use_ema': True, 'bear_use_atr': True, 'bear_use_adx': False, 'bear_use_spike': True, 'bear_rsi_required': False, 'sideways_strategy': 'mean_reversion', 'sideways_bb_std_mult': 2.9024050515124142, 'sideways_rsi_os': 6, 'sideways_rsi_ob': 47, 'sideways_adx_thresh': 26.207801371045544, 'sideways_atr_min_pct': 0.017702823994200898, 'sideways_atr_max_pct': 0.045651960790076856, 'sideways_tp_mult': 1.9169878106318927, 'sideways_tsl_mult': 0.5685034864252582, 'sideways_time_stop': 12, 'sideways_use_sma': True, 'sideways_use_ema': True, 'sideways_use_atr': False, 'sideways_use_adx': True, 'sideways_use_spike': True, 'sideways_rsi_required': False}.
[I 2025-08-31 11:16:15,386] Trial 633 finished with values: [-1000000000.0, 1000000000.0] and parameters: {'p_sma': 39, 'p_std': 28, 'p_atr': 11, 'p_adx': 28, 'rsi_period': 51, 'ema1': 21, 'ema2': 56, 'slip_atr_k': 0.034631772527609836, 'slip_spread_k': 0.6952155669233557, 'spread_hl_frac': 0.015340486250816717, 'bb_std_mult': 2.478319621019114, 'rsi_os': 26, 'rsi_ob': 89, 'vol_spike': 0.07151758999763702, 'adx_thresh': 8.898210714071887, 'atr_min_pct': 0.019496956794713652, 'atr_max_pct': 0.04262018595832427, 'tp_mult': 2.4017042017496797, 'tsl_mult': 0.9303001206352937, 'strategy': 'mean_reversion', 'time_stop': 150, 'use_sma': True, 'use_atr': True, 'use_adx': False, 'use_ema': True, 'use_spike': True, 'rsi_required': True, 'edge_k': 1.125561039125718, 'edge_cap': 0.5719023745113213, 'bull_strategy': 'mean_reversion', 'bull_bb_std_mult': 0.72534462722092, 'bull_rsi_os': 26, 'bull_rsi_ob': 73, 'bull_adx_thresh': 6.178215472625097, 'bull_atr_min_pct': 0.0046988958091777775, 'bull_atr_max_pct': 0.1000167892327402, 'bull_tp_mult': 2.6303017219037526, 'bull_tsl_mult': 0.6860575776192647, 'bull_time_stop': 194, 'bull_use_sma': True, 'bull_use_ema': False, 'bull_use_atr': False, 'bull_use_adx': False, 'bull_use_spike': False, 'bull_rsi_required': True, 'bear_strategy': 'breakout', 'bear_bb_std_mult': 2.3192027226639915, 'bear_rsi_os': 39, 'bear_rsi_ob': 92, 'bear_adx_thresh': 32.24186656209968, 'bear_atr_min_pct': 0.009302278232798587, 'bear_atr_max_pct': 0.11836508176704037, 'bear_tp_mult': 2.8411391006295896, 'bear_tsl_mult': 0.9469190199078981, 'bear_time_stop': 23, 'bear_use_sma': True, 'bear_use_ema': True, 'bear_use_atr': True, 'bear_use_adx': False, 'bear_use_spike': False, 'bear_rsi_required': False, 'sideways_strategy': 'mean_reversion', 'sideways_bb_std_mult': 3.3317928523557736, 'sideways_rsi_os': 8, 'sideways_rsi_ob': 62, 'sideways_adx_thresh': 32.80153249032775, 'sideways_atr_min_pct': 0.015150477754634925, 'sideways_atr_max_pct': 0.02878800032125982, 'sideways_tp_mult': 1.7423485252551196, 'sideways_tsl_mult': 0.12929476742852453, 'sideways_time_stop': 30, 'sideways_use_sma': True, 'sideways_use_ema': True, 'sideways_use_atr': False, 'sideways_use_adx': False, 'sideways_use_spike': False, 'sideways_rsi_required': True}.
[I 2025-08-31 11:16:15,568] Trial 631 finished with values: [-0.03241734604373092, 0.032158445539811224] and parameters: {'p_sma': 13, 'p_std': 16, 'p_atr': 11, 'p_adx': 14, 'rsi_period': 17, 'ema1': 28, 'ema2': 39, 'slip_atr_k': 0.12000064293728155, 'slip_spread_k': 0.6947690455939666, 'spread_hl_frac': 0.04335273900262174, 'bb_std_mult': 2.647532424683979, 'rsi_os': 26, 'rsi_ob': 76, 'vol_spike': 0.20569684815904044, 'adx_thresh': 27.801192837125754, 'atr_min_pct': 0.0032076078069295036, 'atr_max_pct': 0.12657602665105377, 'tp_mult': 1.8790713567952984, 'tsl_mult': 0.2134818846085004, 'strategy': 'mean_reversion', 'time_stop': 83, 'use_sma': True, 'use_atr': True, 'use_adx': False, 'use_ema': True, 'use_spike': False, 'rsi_required': False, 'edge_k': 1.4055885345333266, 'edge_cap': 0.4443641886662015, 'bull_strategy': 'mean_reversion', 'bull_bb_std_mult': 2.0302518971483194, 'bull_rsi_os': 6, 'bull_rsi_ob': 77, 'bull_adx_thresh': 10.88078959619853, 'bull_atr_min_pct': 0.0021468259035028704, 'bull_atr_max_pct': 0.07884133425747869, 'bull_tp_mult': 1.4498415924087116, 'bull_tsl_mult': 0.39923887973173916, 'bull_time_stop': 83, 'bull_use_sma': True, 'bull_use_ema': False, 'bull_use_atr': True, 'bull_use_adx': False, 'bull_use_spike': False, 'bull_rsi_required': True, 'bear_strategy': 'breakout', 'bear_bb_std_mult': 1.4719894377953844, 'bear_rsi_os': 39, 'bear_rsi_ob': 48, 'bear_adx_thresh': 25.49417380480484, 'bear_atr_min_pct': 0.006778176457456594, 'bear_atr_max_pct': 0.12782917565513002, 'bear_tp_mult': 2.5281751238240298, 'bear_tsl_mult': 0.2323890660548535, 'bear_time_stop': 201, 'bear_use_sma': True, 'bear_use_ema': True, 'bear_use_atr': True, 'bear_use_adx': False, 'bear_use_spike': True, 'bear_rsi_required': False, 'sideways_strategy': 'mean_reversion', 'sideways_bb_std_mult': 3.393273197716484, 'sideways_rsi_os': 12, 'sideways_rsi_ob': 51, 'sideways_adx_thresh': 26.165465645729505, 'sideways_atr_min_pct': 0.01761388816279115, 'sideways_atr_max_pct': 0.13025760404947315, 'sideways_tp_mult': 1.3596763985496783, 'sideways_tsl_mult': 0.5726198747844241, 'sideways_time_stop': 274, 'sideways_use_sma': True, 'sideways_use_ema': True, 'sideways_use_atr': False, 'sideways_use_adx': True, 'sideways_use_spike': True, 'sideways_rsi_required': False}.
[I 2025-08-31 11:16:46,958] Trial 636 finished with values: [-1000000000.0, 1000000000.0] and parameters: {'p_sma': 14, 'p_std': 49, 'p_atr': 9, 'p_adx': 11, 'rsi_period': 54, 'ema1': 28, 'ema2': 56, 'slip_atr_k': 0.02862489608860372, 'slip_spread_k': 0.8352112246220202, 'spread_hl_frac': 0.015937353430417592, 'bb_std_mult': 3.274540797792613, 'rsi_os': 22, 'rsi_ob': 78, 'vol_spike': 0.25807309347584273, 'adx_thresh': 28.513097357221273, 'atr_min_pct': 0.013756195293984927, 'atr_max_pct': 0.09779759078320421, 'tp_mult': 2.691158468302346, 'tsl_mult': 0.2564232505629404, 'strategy': 'breakout', 'time_stop': 289, 'use_sma': True, 'use_atr': False, 'use_adx': True, 'use_ema': True, 'use_spike': True, 'rsi_required': True, 'edge_k': 1.1122112278225427, 'edge_cap': 0.4429557978131458, 'bull_strategy': 'breakout', 'bull_bb_std_mult': 2.6437299378163264, 'bull_rsi_os': 8, 'bull_rsi_ob': 94, 'bull_adx_thresh': 6.342890816922618, 'bull_atr_min_pct': 0.004860075114316875, 'bull_atr_max_pct': 0.07862406108844226, 'bull_tp_mult': 2.743368299152939, 'bull_tsl_mult': 0.3672778324760324, 'bull_time_stop': 89, 'bull_use_sma': True, 'bull_use_ema': False, 'bull_use_atr': False, 'bull_use_adx': False, 'bull_use_spike': False, 'bull_rsi_required': False, 'bear_strategy': 'breakout', 'bear_bb_std_mult': 2.2894597710547715, 'bear_rsi_os': 54, 'bear_rsi_ob': 46, 'bear_adx_thresh': 32.50322408302533, 'bear_atr_min_pct': 0.026476149575764787, 'bear_atr_max_pct': 0.09754761928087664, 'bear_tp_mult': 2.982358826318689, 'bear_tsl_mult': 0.5744925838551215, 'bear_time_stop': 202, 'bear_use_sma': False, 'bear_use_ema': True, 'bear_use_atr': False, 'bear_use_adx': False, 'bear_use_spike': True, 'bear_rsi_required': False, 'sideways_strategy': 'mean_reversion', 'sideways_bb_std_mult': 0.8068815190007812, 'sideways_rsi_os': 47, 'sideways_rsi_ob': 94, 'sideways_adx_thresh': 9.99920528094347, 'sideways_atr_min_pct': 0.016270888774695375, 'sideways_atr_max_pct': 0.03889305130182543, 'sideways_tp_mult': 1.3555868060039709, 'sideways_tsl_mult': 0.6229911287183852, 'sideways_time_stop': 212, 'sideways_use_sma': False, 'sideways_use_ema': False, 'sideways_use_atr': False, 'sideways_use_adx': False, 'sideways_use_spike': False, 'sideways_rsi_required': True}.
[I 2025-08-31 11:16:47,413] Trial 637 finished with values: [-0.013390565903112606, 0.013663078096706305] and parameters: {'p_sma': 14, 'p_std': 11, 'p_atr': 9, 'p_adx': 13, 'rsi_period': 44, 'ema1': 13, 'ema2': 56, 'slip_atr_k': 0.028358778872352386, 'slip_spread_k': 0.8363023632509125, 'spread_hl_frac': 0.009286669763133285, 'bb_std_mult': 2.1017744905318807, 'rsi_os': 50, 'rsi_ob': 78, 'vol_spike': 0.14751189024684788, 'adx_thresh': 18.282940469184563, 'atr_min_pct': 0.0055681118725575095, 'atr_max_pct': 0.012524698588023825, 'tp_mult': 2.7043221951541416, 'tsl_mult': 0.2603768081547786, 'strategy': 'breakout', 'time_stop': 64, 'use_sma': True, 'use_atr': False, 'use_adx': True, 'use_ema': True, 'use_spike': True, 'rsi_required': True, 'edge_k': 0.04231040871652847, 'edge_cap': 0.44964249274165796, 'bull_strategy': 'breakout', 'bull_bb_std_mult': 0.9296397413991052, 'bull_rsi_os': 18, 'bull_rsi_ob': 75, 'bull_adx_thresh': 16.081535256974785, 'bull_atr_min_pct': 0.003908909168234183, 'bull_atr_max_pct': 0.07969608455677639, 'bull_tp_mult': 2.7467504768193085, 'bull_tsl_mult': 0.3582076324176636, 'bull_time_stop': 74, 'bull_use_sma': True, 'bull_use_ema': False, 'bull_use_atr': False, 'bull_use_adx': False, 'bull_use_spike': False, 'bull_rsi_required': False, 'bear_strategy': 'breakout', 'bear_bb_std_mult': 2.6842475669308135, 'bear_rsi_os': 46, 'bear_rsi_ob': 55, 'bear_adx_thresh': 6.055564928111418, 'bear_atr_min_pct': 0.006574598154173288, 'bear_atr_max_pct': 0.10949785313737297, 'bear_tp_mult': 2.949890996935247, 'bear_tsl_mult': 0.03279970482461675, 'bear_time_stop': 157, 'bear_use_sma': False, 'bear_use_ema': True, 'bear_use_atr': False, 'bear_use_adx': False, 'bear_use_spike': True, 'bear_rsi_required': False, 'sideways_strategy': 'mean_reversion', 'sideways_bb_std_mult': 0.8183259955665831, 'sideways_rsi_os': 7, 'sideways_rsi_ob': 53, 'sideways_adx_thresh': 25.52649565976376, 'sideways_atr_min_pct': 0.016612157575595116, 'sideways_atr_max_pct': 0.03960001775528467, 'sideways_tp_mult': 1.3377485465583963, 'sideways_tsl_mult': 0.9452147604812983, 'sideways_time_stop': 181, 'sideways_use_sma': False, 'sideways_use_ema': False, 'sideways_use_atr': False, 'sideways_use_adx': False, 'sideways_use_spike': False, 'sideways_rsi_required': True}.
[I 2025-08-31 11:16:47,779] Trial 638 finished with values: [-1000000000.0, 1000000000.0] and parameters: {'p_sma': 37, 'p_std': 27, 'p_atr': 9, 'p_adx': 13, 'rsi_period': 55, 'ema1': 13, 'ema2': 19, 'slip_atr_k': 0.1864274123412143, 'slip_spread_k': 0.8829416748181746, 'spread_hl_frac': 0.009345064543515467, 'bb_std_mult': 2.7297161859037518, 'rsi_os': 28, 'rsi_ob': 78, 'vol_spike': 0.25756537928975964, 'adx_thresh': 28.490475257341497, 'atr_min_pct': 0.005964289416353661, 'atr_max_pct': 0.09702222936859002, 'tp_mult': 2.2838152193264705, 'tsl_mult': 0.2637542036879902, 'strategy': 'breakout', 'time_stop': 66, 'use_sma': True, 'use_atr': False, 'use_adx': True, 'use_ema': True, 'use_spike': True, 'rsi_required': True, 'edge_k': 0.42398655836334365, 'edge_cap': 0.6038564589133102, 'bull_strategy': 'breakout', 'bull_bb_std_mult': 3.0639265089525267, 'bull_rsi_os': 31, 'bull_rsi_ob': 53, 'bull_adx_thresh': 8.26619788305437, 'bull_atr_min_pct': 0.0038762136487870895, 'bull_atr_max_pct': 0.0958449671969458, 'bull_tp_mult': 2.755870767727127, 'bull_tsl_mult': 0.3574757359194765, 'bull_time_stop': 146, 'bull_use_sma': True, 'bull_use_ema': False, 'bull_use_atr': False, 'bull_use_adx': False, 'bull_use_spike': False, 'bull_rsi_required': False, 'bear_strategy': 'breakout', 'bear_bb_std_mult': 2.6648570183244438, 'bear_rsi_os': 46, 'bear_rsi_ob': 60, 'bear_adx_thresh': 6.041600714176073, 'bear_atr_min_pct': 0.012529670744042964, 'bear_atr_max_pct': 0.1069552276742308, 'bear_tp_mult': 1.3457555043002314, 'bear_tsl_mult': 0.031517642257417045, 'bear_time_stop': 128, 'bear_use_sma': False, 'bear_use_ema': True, 'bear_use_atr': False, 'bear_use_adx': False, 'bear_use_spike': True, 'bear_rsi_required': False, 'sideways_strategy': 'mean_reversion', 'sideways_bb_std_mult': 2.7364726593731556, 'sideways_rsi_os': 36, 'sideways_rsi_ob': 66, 'sideways_adx_thresh': 25.50907306916553, 'sideways_atr_min_pct': 0.014114590812927291, 'sideways_atr_max_pct': 0.03950882656400747, 'sideways_tp_mult': 2.685787608394835, 'sideways_tsl_mult': 0.21063883157329683, 'sideways_time_stop': 22, 'sideways_use_sma': False, 'sideways_use_ema': False, 'sideways_use_atr': False, 'sideways_use_adx': False, 'sideways_use_spike': False, 'sideways_rsi_required': True}.
[I 2025-08-31 11:16:48,048] Trial 635 finished with values: [-0.05074577935004987, 0.050638769329818034] and parameters: {'p_sma': 14, 'p_std': 16, 'p_atr': 13, 'p_adx': 11, 'rsi_period': 17, 'ema1': 28, 'ema2': 28, 'slip_atr_k': 0.229806293317552, 'slip_spread_k': 0.6998279005056576, 'spread_hl_frac': 0.009255087219850083, 'bb_std_mult': 2.6573026200720635, 'rsi_os': 26, 'rsi_ob': 57, 'vol_spike': 0.14447483587898632, 'adx_thresh': 26.006795284558198, 'atr_min_pct': 0.007290374863783613, 'atr_max_pct': 0.02232118650027698, 'tp_mult': 2.085266683402338, 'tsl_mult': 0.27400322635286906, 'strategy': 'mean_reversion', 'time_stop': 258, 'use_sma': True, 'use_atr': True, 'use_adx': False, 'use_ema': True, 'use_spike': True, 'rsi_required': True, 'edge_k': 1.1146370144939854, 'edge_cap': 0.51753650897987, 'bull_strategy': 'breakout', 'bull_bb_std_mult': 2.6482222934696864, 'bull_rsi_os': 8, 'bull_rsi_ob': 75, 'bull_adx_thresh': 6.307528058743448, 'bull_atr_min_pct': 0.004839637942877117, 'bull_atr_max_pct': 0.10573218393684526, 'bull_tp_mult': 1.9364859988245866, 'bull_tsl_mult': 0.8733262142280613, 'bull_time_stop': 188, 'bull_use_sma': True, 'bull_use_ema': False, 'bull_use_atr': False, 'bull_use_adx': False, 'bull_use_spike': False, 'bull_rsi_required': False, 'bear_strategy': 'breakout', 'bear_bb_std_mult': 2.3099993482390504, 'bear_rsi_os': 41, 'bear_rsi_ob': 91, 'bear_adx_thresh': 5.82638923897156, 'bear_atr_min_pct': 0.0037710951639936836, 'bear_atr_max_pct': 0.12930584850094623, 'bear_tp_mult': 2.22742018854783, 'bear_tsl_mult': 0.5577898683094671, 'bear_time_stop': 127, 'bear_use_sma': False, 'bear_use_ema': True, 'bear_use_atr': True, 'bear_use_adx': False, 'bear_use_spike': True, 'bear_rsi_required': False, 'sideways_strategy': 'mean_reversion', 'sideways_bb_std_mult': 2.7260260642077903, 'sideways_rsi_os': 6, 'sideways_rsi_ob': 94, 'sideways_adx_thresh': 25.758447831580053, 'sideways_atr_min_pct': 0.015085146533774102, 'sideways_atr_max_pct': 0.03992296577558171, 'sideways_tp_mult': 1.7972228081565862, 'sideways_tsl_mult': 0.5736875878744017, 'sideways_time_stop': 32, 'sideways_use_sma': True, 'sideways_use_ema': True, 'sideways_use_atr': False, 'sideways_use_adx': False, 'sideways_use_spike': False, 'sideways_rsi_required': True}.
