[I 2025-08-31 10:52:16,566] Trial 450 finished with values: [-1000000000.0, 1000000000.0] and parameters: {'p_sma': 48, 'p_std': 38, 'p_atr': 11, 'p_adx': 13, 'rsi_period': 47, 'ema1': 21, 'ema2': 28, 'slip_atr_k': 0.012853362294480114, 'slip_spread_k': 0.6291994940251477, 'spread_hl_frac': 0.023153318039392308, 'bb_std_mult': 3.2122173829497345, 'rsi_os': 18, 'rsi_ob': 81, 'vol_spike': 0.24659674792794736, 'adx_thresh': 19.41080103298179, 'atr_min_pct': 0.00452775228258245, 'atr_max_pct': 0.09311765515539262, 'tp_mult': 2.483551774017789, 'tsl_mult': 0.9106781555164032, 'strategy': 'breakout', 'time_stop': 88, 'use_sma': True, 'use_atr': False, 'use_adx': True, 'use_ema': False, 'use_spike': True, 'rsi_required': True, 'edge_k': 0.46212423563315297, 'edge_cap': 0.7072994971557132, 'bull_strategy': 'breakout', 'bull_bb_std_mult': 3.0628799878101125, 'bull_rsi_os': 49, 'bull_rsi_ob': 57, 'bull_adx_thresh': 11.16849333355054, 'bull_atr_min_pct': 0.006729789342675744, 'bull_atr_max_pct': 0.0925126968066196, 'bull_tp_mult': 1.7242865117975286, 'bull_tsl_mult': 0.418894735052388, 'bull_time_stop': 71, 'bull_use_sma': True, 'bull_use_ema': False, 'bull_use_atr': False, 'bull_use_adx': False, 'bull_use_spike': False, 'bull_rsi_required': True, 'bear_strategy': 'mean_reversion', 'bear_bb_std_mult': 1.666893593453424, 'bear_rsi_os': 37, 'bear_rsi_ob': 58, 'bear_adx_thresh': 9.887278048968541, 'bear_atr_min_pct': 0.025579121486904083, 'bear_atr_max_pct': 0.12978309660876045, 'bear_tp_mult': 1.500960058234873, 'bear_tsl_mult': 0.47501441019651225, 'bear_time_stop': 27, 'bear_use_sma': True, 'bear_use_ema': False, 'bear_use_atr': True, 'bear_use_adx': True, 'bear_use_spike': True, 'bear_rsi_required': True, 'sideways_strategy': 'mean_reversion', 'sideways_bb_std_mult': 2.8095998747764925, 'sideways_rsi_os': 6, 'sideways_rsi_ob': 55, 'sideways_adx_thresh': 33.88607171997898, 'sideways_atr_min_pct': 0.023619721383183422, 'sideways_atr_max_pct': 0.013989951942190774, 'sideways_tp_mult': 1.971153055878964, 'sideways_tsl_mult': 0.0823064687794753, 'sideways_time_stop': 272, 'sideways_use_sma': False, 'sideways_use_ema': False, 'sideways_use_atr': False, 'sideways_use_adx': False, 'sideways_use_spike': False, 'sideways_rsi_required': False}.
[I 2025-08-31 10:52:16,640] Trial 451 finished with values: [-1000000000.0, 1000000000.0] and parameters: {'p_sma': 16, 'p_std': 37, 'p_atr': 11, 'p_adx': 13, 'rsi_period': 47, 'ema1': 21, 'ema2': 56, 'slip_atr_k': 0.014306010436192262, 'slip_spread_k': 0.21760813647817262, 'spread_hl_frac': 0.041082355074025, 'bb_std_mult': 2.2007846033571, 'rsi_os': 24, 'rsi_ob': 78, 'vol_spike': 0.24501529867203176, 'adx_thresh': 10.256698291228394, 'atr_min_pct': 0.006236390513760755, 'atr_max_pct': 0.09330907345632874, 'tp_mult': 2.463346030262346, 'tsl_mult': 0.4399347725009117, 'strategy': 'breakout', 'time_stop': 12, 'use_sma': True, 'use_atr': False, 'use_adx': True, 'use_ema': False, 'use_spike': False, 'rsi_required': True, 'edge_k': 1.8756256320060256, 'edge_cap': 0.9336221912036088, 'bull_strategy': 'breakout', 'bull_bb_std_mult': 0.6786832530729485, 'bull_rsi_os': 21, 'bull_rsi_ob': 57, 'bull_adx_thresh': 11.221686992410106, 'bull_atr_min_pct': 0.02311185052690026, 'bull_atr_max_pct': 0.11348619150418837, 'bull_tp_mult': 2.9740573841911617, 'bull_tsl_mult': 0.419978116208809, 'bull_time_stop': 76, 'bull_use_sma': True, 'bull_use_ema': False, 'bull_use_atr': False, 'bull_use_adx': False, 'bull_use_spike': False, 'bull_rsi_required': False, 'bear_strategy': 'mean_reversion', 'bear_bb_std_mult': 1.6609326152473056, 'bear_rsi_os': 40, 'bear_rsi_ob': 76, 'bear_adx_thresh': 5.043334742079096, 'bear_atr_min_pct': 0.0047163142011338, 'bear_atr_max_pct': 0.13089038942606598, 'bear_tp_mult': 2.836548694594424, 'bear_tsl_mult': 0.5135452799903455, 'bear_time_stop': 25, 'bear_use_sma': True, 'bear_use_ema': False, 'bear_use_atr': True, 'bear_use_adx': True, 'bear_use_spike': True, 'bear_rsi_required': True, 'sideways_strategy': 'mean_reversion', 'sideways_bb_std_mult': 2.821259436295177, 'sideways_rsi_os': 6, 'sideways_rsi_ob': 50, 'sideways_adx_thresh': 26.45488458813582, 'sideways_atr_min_pct': 0.024894224438599878, 'sideways_atr_max_pct': 0.12806412234385617, 'sideways_tp_mult': 1.665244238457356, 'sideways_tsl_mult': 0.08200397634198468, 'sideways_time_stop': 195, 'sideways_use_sma': False, 'sideways_use_ema': False, 'sideways_use_atr': False, 'sideways_use_adx': False, 'sideways_use_spike': False, 'sideways_rsi_required': False}.
[I 2025-08-31 10:52:48,543] Trial 452 finished with values: [-1000000000.0, 1000000000.0] and parameters: {'p_sma': 29, 'p_std': 9, 'p_atr': 19, 'p_adx': 9, 'rsi_period': 56, 'ema1': 25, 'ema2': 42, 'slip_atr_k': 0.19500897518529284, 'slip_spread_k': 0.6318192603297113, 'spread_hl_frac': 0.0034140544748336235, 'bb_std_mult': 1.6296580557103961, 'rsi_os': 42, 'rsi_ob': 80, 'vol_spike': 0.2544979119262388, 'adx_thresh': 27.165384051767305, 'atr_min_pct': 0.02506226851660164, 'atr_max_pct': 0.092337074926979, 'tp_mult': 2.1876626110634416, 'tsl_mult': 0.3227356335654201, 'strategy': 'breakout', 'time_stop': 87, 'use_sma': True, 'use_atr': False, 'use_adx': True, 'use_ema': False, 'use_spike': False, 'rsi_required': True, 'edge_k': 0.2699076106910572, 'edge_cap': 0.52449297622068, 'bull_strategy': 'mean_reversion', 'bull_bb_std_mult': 0.6598345255528615, 'bull_rsi_os': 22, 'bull_rsi_ob': 73, 'bull_adx_thresh': 11.46879222329409, 'bull_atr_min_pct': 0.028945340847646668, 'bull_atr_max_pct': 0.09908964349827948, 'bull_tp_mult': 1.0474909027465464, 'bull_tsl_mult': 0.4226882639045343, 'bull_time_stop': 75, 'bull_use_sma': True, 'bull_use_ema': False, 'bull_use_atr': False, 'bull_use_adx': False, 'bull_use_spike': False, 'bull_rsi_required': False, 'bear_strategy': 'mean_reversion', 'bear_bb_std_mult': 1.858593165257725, 'bear_rsi_os': 9, 'bear_rsi_ob': 56, 'bear_adx_thresh': 5.558039499447622, 'bear_atr_min_pct': 0.0053498753705931565, 'bear_atr_max_pct': 0.12993587156218367, 'bear_tp_mult': 2.467691109054564, 'bear_tsl_mult': 0.5071817930748873, 'bear_time_stop': 72, 'bear_use_sma': True, 'bear_use_ema': False, 'bear_use_atr': True, 'bear_use_adx': True, 'bear_use_spike': True, 'bear_rsi_required': True, 'sideways_strategy': 'mean_reversion', 'sideways_bb_std_mult': 3.0912632195418634, 'sideways_rsi_os': 6, 'sideways_rsi_ob': 92, 'sideways_adx_thresh': 6.905793967155599, 'sideways_atr_min_pct': 0.023720063389607405, 'sideways_atr_max_pct': 0.12809994096306884, 'sideways_tp_mult': 1.1062252365869498, 'sideways_tsl_mult': 0.28470653648450506, 'sideways_time_stop': 8, 'sideways_use_sma': False, 'sideways_use_ema': False, 'sideways_use_atr': False, 'sideways_use_adx': False, 'sideways_use_spike': False, 'sideways_rsi_required': False}.
[I 2025-08-31 10:52:48,892] Trial 454 finished with values: [-1000000000.0, 1000000000.0] and parameters: {'p_sma': 28, 'p_std': 21, 'p_atr': 13, 'p_adx': 21, 'rsi_period': 49, 'ema1': 15, 'ema2': 37, 'slip_atr_k': 0.11267284490325576, 'slip_spread_k': 0.6722743580051596, 'spread_hl_frac': 0.041609125611829785, 'bb_std_mult': 2.2163849887932523, 'rsi_os': 55, 'rsi_ob': 48, 'vol_spike': 0.12951931779933307, 'adx_thresh': 29.2937965204152, 'atr_min_pct': 0.024978069894212626, 'atr_max_pct': 0.10008566698208034, 'tp_mult': 2.4273862644394972, 'tsl_mult': 0.3167805811375147, 'strategy': 'breakout', 'time_stop': 13, 'use_sma': True, 'use_atr': False, 'use_adx': True, 'use_ema': False, 'use_spike': False, 'rsi_required': True, 'edge_k': 0.1870632996653972, 'edge_cap': 0.9259630178859096, 'bull_strategy': 'mean_reversion', 'bull_bb_std_mult': 0.7062849704773455, 'bull_rsi_os': 6, 'bull_rsi_ob': 63, 'bull_adx_thresh': 19.816277568360345, 'bull_atr_min_pct': 0.012353946179502794, 'bull_atr_max_pct': 0.08924996963599163, 'bull_tp_mult': 1.8676212426699803, 'bull_tsl_mult': 0.4477393972749715, 'bull_time_stop': 148, 'bull_use_sma': True, 'bull_use_ema': False, 'bull_use_atr': False, 'bull_use_adx': False, 'bull_use_spike': False, 'bull_rsi_required': False, 'bear_strategy': 'breakout', 'bear_bb_std_mult': 1.8791728312574403, 'bear_rsi_os': 9, 'bear_rsi_ob': 86, 'bear_adx_thresh': 5.117266479307368, 'bear_atr_min_pct': 0.021306848291275618, 'bear_atr_max_pct': 0.12287430351328389, 'bear_tp_mult': 2.4469196029531837, 'bear_tsl_mult': 0.5111469565338145, 'bear_time_stop': 237, 'bear_use_sma': True, 'bear_use_ema': False, 'bear_use_atr': True, 'bear_use_adx': True, 'bear_use_spike': True, 'bear_rsi_required': True, 'sideways_strategy': 'mean_reversion', 'sideways_bb_std_mult': 1.9314683226597256, 'sideways_rsi_os': 36, 'sideways_rsi_ob': 93, 'sideways_adx_thresh': 26.322445046635604, 'sideways_atr_min_pct': 0.017426787262703056, 'sideways_atr_max_pct': 0.0711734837551151, 'sideways_tp_mult': 2.011887037971451, 'sideways_tsl_mult': 0.13253635325369673, 'sideways_time_stop': 234, 'sideways_use_sma': False, 'sideways_use_ema': True, 'sideways_use_atr': False, 'sideways_use_adx': False, 'sideways_use_spike': False, 'sideways_rsi_required': True}.
[I 2025-08-31 10:52:49,088] Trial 455 finished with values: [-1000000000.0, 1000000000.0] and parameters: {'p_sma': 21, 'p_std': 28, 'p_atr': 19, 'p_adx': 9, 'rsi_period': 44, 'ema1': 15, 'ema2': 35, 'slip_atr_k': 0.04580452507522631, 'slip_spread_k': 0.18250118989195885, 'spread_hl_frac': 0.02079664444852698, 'bb_std_mult': 2.116801349725222, 'rsi_os': 55, 'rsi_ob': 48, 'vol_spike': 0.16453519149141013, 'adx_thresh': 5.505997263486, 'atr_min_pct': 0.026933308110670833, 'atr_max_pct': 0.041890962049328205, 'tp_mult': 2.545588882283543, 'tsl_mult': 0.2128031390261582, 'strategy': 'breakout', 'time_stop': 98, 'use_sma': True, 'use_atr': False, 'use_adx': True, 'use_ema': True, 'use_spike': True, 'rsi_required': True, 'edge_k': 0.2791099992795194, 'edge_cap': 0.3586570337999668, 'bull_strategy': 'mean_reversion', 'bull_bb_std_mult': 0.6990004176215959, 'bull_rsi_os': 20, 'bull_rsi_ob': 47, 'bull_adx_thresh': 6.208315703906238, 'bull_atr_min_pct': 0.027670772927701537, 'bull_atr_max_pct': 0.09824990782642387, 'bull_tp_mult': 1.8911887797268452, 'bull_tsl_mult': 0.3938071721056576, 'bull_time_stop': 58, 'bull_use_sma': True, 'bull_use_ema': False, 'bull_use_atr': False, 'bull_use_adx': False, 'bull_use_spike': False, 'bull_rsi_required': False, 'bear_strategy': 'breakout', 'bear_bb_std_mult': 2.3635199091609698, 'bear_rsi_os': 42, 'bear_rsi_ob': 83, 'bear_adx_thresh': 8.35899525850814, 'bear_atr_min_pct': 0.0053322393099956705, 'bear_atr_max_pct': 0.12265207816651932, 'bear_tp_mult': 2.740257999118138, 'bear_tsl_mult': 0.5380049994588181, 'bear_time_stop': 238, 'bear_use_sma': False, 'bear_use_ema': True, 'bear_use_atr': False, 'bear_use_adx': False, 'bear_use_spike': True, 'bear_rsi_required': False, 'sideways_strategy': 'mean_reversion', 'sideways_bb_std_mult': 2.7738225866956796, 'sideways_rsi_os': 7, 'sideways_rsi_ob': 74, 'sideways_adx_thresh': 5.08643391590674, 'sideways_atr_min_pct': 0.01781161782431545, 'sideways_atr_max_pct': 0.03475610014665482, 'sideways_tp_mult': 1.7738842157247388, 'sideways_tsl_mult': 0.13250248895675482, 'sideways_time_stop': 11, 'sideways_use_sma': False, 'sideways_use_ema': True, 'sideways_use_atr': False, 'sideways_use_adx': False, 'sideways_use_spike': False, 'sideways_rsi_required': True}.
[I 2025-08-31 10:52:49,101] Trial 453 finished with values: [-1000000000.0, 1000000000.0] and parameters: {'p_sma': 14, 'p_std': 9, 'p_atr': 12, 'p_adx': 14, 'rsi_period': 56, 'ema1': 15, 'ema2': 14, 'slip_atr_k': 0.01873893138962333, 'slip_spread_k': 0.6395647206229427, 'spread_hl_frac': 0.022841980027223156, 'bb_std_mult': 1.8458702676118255, 'rsi_os': 28, 'rsi_ob': 80, 'vol_spike': 0.1619667535184552, 'adx_thresh': 27.067636812899885, 'atr_min_pct': 0.004354353125608873, 'atr_max_pct': 0.03364722119209023, 'tp_mult': 1.0784478150029098, 'tsl_mult': 0.4663554377051699, 'strategy': 'breakout', 'time_stop': 88, 'use_sma': True, 'use_atr': False, 'use_adx': True, 'use_ema': False, 'use_spike': True, 'rsi_required': True, 'edge_k': 0.27923716006457594, 'edge_cap': 0.45855781859630507, 'bull_strategy': 'mean_reversion', 'bull_bb_std_mult': 0.6912187082232596, 'bull_rsi_os': 7, 'bull_rsi_ob': 45, 'bull_adx_thresh': 19.853006597345637, 'bull_atr_min_pct': 0.010407384119305387, 'bull_atr_max_pct': 0.09735053157172091, 'bull_tp_mult': 2.998157315921929, 'bull_tsl_mult': 0.0067333913923533495, 'bull_time_stop': 79, 'bull_use_sma': True, 'bull_use_ema': False, 'bull_use_atr': False, 'bull_use_adx': False, 'bull_use_spike': False, 'bull_rsi_required': False, 'bear_strategy': 'breakout', 'bear_bb_std_mult': 1.7183838381805694, 'bear_rsi_os': 40, 'bear_rsi_ob': 78, 'bear_adx_thresh': 8.343602851148017, 'bear_atr_min_pct': 0.005256639456001764, 'bear_atr_max_pct': 0.12901078877758035, 'bear_tp_mult': 1.4129711961165445, 'bear_tsl_mult': 0.5081905034903591, 'bear_time_stop': 13, 'bear_use_sma': True, 'bear_use_ema': False, 'bear_use_atr': True, 'bear_use_adx': True, 'bear_use_spike': True, 'bear_rsi_required': True, 'sideways_strategy': 'mean_reversion', 'sideways_bb_std_mult': 2.812203782989868, 'sideways_rsi_os': 6, 'sideways_rsi_ob': 74, 'sideways_adx_thresh': 26.25473772710703, 'sideways_atr_min_pct': 0.01767564072782917, 'sideways_atr_max_pct': 0.05419180780240905, 'sideways_tp_mult': 2.0148974363068053, 'sideways_tsl_mult': 0.13078540546498577, 'sideways_time_stop': 275, 'sideways_use_sma': False, 'sideways_use_ema': True, 'sideways_use_atr': False, 'sideways_use_adx': False, 'sideways_use_spike': False, 'sideways_rsi_required': True}.
[I 2025-08-31 10:53:22,309] Trial 459 finished with values: [-1000000000.0, 1000000000.0] and parameters: {'p_sma': 12, 'p_std': 27, 'p_atr': 12, 'p_adx': 29, 'rsi_period': 45, 'ema1': 14, 'ema2': 57, 'slip_atr_k': 0.24333915467491318, 'slip_spread_k': 0.2582921790349423, 'spread_hl_frac': 0.04656889378005703, 'bb_std_mult': 2.605964763000418, 'rsi_os': 15, 'rsi_ob': 78, 'vol_spike': 0.2623789920784852, 'adx_thresh': 28.417461508919295, 'atr_min_pct': 0.013160580673779182, 'atr_max_pct': 0.10239801025961379, 'tp_mult': 1.7956446934084112, 'tsl_mult': 0.738576603457111, 'strategy': 'mean_reversion', 'time_stop': 48, 'use_sma': False, 'use_atr': False, 'use_adx': True, 'use_ema': True, 'use_spike': True, 'rsi_required': True, 'edge_k': 0.7671500691432512, 'edge_cap': 0.25826998829920705, 'bull_strategy': 'breakout', 'bull_bb_std_mult': 0.8529791774926253, 'bull_rsi_os': 16, 'bull_rsi_ob': 75, 'bull_adx_thresh': 30.887881686726544, 'bull_atr_min_pct': 0.02217060141630981, 'bull_atr_max_pct': 0.1017668206936485, 'bull_tp_mult': 1.319056528217847, 'bull_tsl_mult': 0.38751959480700504, 'bull_time_stop': 65, 'bull_use_sma': False, 'bull_use_ema': False, 'bull_use_atr': False, 'bull_use_adx': True, 'bull_use_spike': False, 'bull_rsi_required': True, 'bear_strategy': 'breakout', 'bear_bb_std_mult': 0.513074585626877, 'bear_rsi_os': 41, 'bear_rsi_ob': 92, 'bear_adx_thresh': 7.615387872474912, 'bear_atr_min_pct': 0.006396214657438012, 'bear_atr_max_pct': 0.037813587186982384, 'bear_tp_mult': 1.2623643557005537, 'bear_tsl_mult': 0.382940737188813, 'bear_time_stop': 31, 'bear_use_sma': False, 'bear_use_ema': True, 'bear_use_atr': False, 'bear_use_adx': False, 'bear_use_spike': False, 'bear_rsi_required': False, 'sideways_strategy': 'mean_reversion', 'sideways_bb_std_mult': 2.6287012892347867, 'sideways_rsi_os': 8, 'sideways_rsi_ob': 92, 'sideways_adx_thresh': 24.846452380240542, 'sideways_atr_min_pct': 0.01842647767651406, 'sideways_atr_max_pct': 0.04446249418322774, 'sideways_tp_mult': 1.8714550354686423, 'sideways_tsl_mult': 0.8010417405766284, 'sideways_time_stop': 35, 'sideways_use_sma': True, 'sideways_use_ema': False, 'sideways_use_atr': True, 'sideways_use_adx': False, 'sideways_use_spike': False, 'sideways_rsi_required': True}.
[I 2025-08-31 10:53:22,450] Trial 458 finished with values: [-1000000000.0, 1000000000.0] and parameters: {'p_sma': 12, 'p_std': 52, 'p_atr': 12, 'p_adx': 29, 'rsi_period': 46, 'ema1': 14, 'ema2': 57, 'slip_atr_k': 0.017772682376056885, 'slip_spread_k': 0.7044827165919714, 'spread_hl_frac': 0.0018808009263756517, 'bb_std_mult': 2.6133093086208685, 'rsi_os': 21, 'rsi_ob': 79, 'vol_spike': 0.26297518983274665, 'adx_thresh': 32.3860517825425, 'atr_min_pct': 0.006701869029080563, 'atr_max_pct': 0.14550210228982957, 'tp_mult': 1.068740969874265, 'tsl_mult': 0.740894248028665, 'strategy': 'mean_reversion', 'time_stop': 65, 'use_sma': False, 'use_atr': False, 'use_adx': True, 'use_ema': True, 'use_spike': True, 'rsi_required': True, 'edge_k': 0.6371021343254817, 'edge_cap': 0.05318019468831947, 'bull_strategy': 'breakout', 'bull_bb_std_mult': 0.847939791945644, 'bull_rsi_os': 15, 'bull_rsi_ob': 75, 'bull_adx_thresh': 5.347207661561783, 'bull_atr_min_pct': 0.024195760716393747, 'bull_atr_max_pct': 0.05045321752385591, 'bull_tp_mult': 1.8213213487633801, 'bull_tsl_mult': 0.3630024834157784, 'bull_time_stop': 258, 'bull_use_sma': False, 'bull_use_ema': False, 'bull_use_atr': False, 'bull_use_adx': True, 'bull_use_spike': False, 'bull_rsi_required': True, 'bear_strategy': 'breakout', 'bear_bb_std_mult': 1.7458427560620466, 'bear_rsi_os': 40, 'bear_rsi_ob': 92, 'bear_adx_thresh': 12.758264524908409, 'bear_atr_min_pct': 0.010217541330615608, 'bear_atr_max_pct': 0.033509755134485786, 'bear_tp_mult': 2.7946761214893487, 'bear_tsl_mult': 0.017763572238470582, 'bear_time_stop': 16, 'bear_use_sma': False, 'bear_use_ema': True, 'bear_use_atr': False, 'bear_use_adx': False, 'bear_use_spike': False, 'bear_rsi_required': False, 'sideways_strategy': 'mean_reversion', 'sideways_bb_std_mult': 1.387115384959025, 'sideways_rsi_os': 55, 'sideways_rsi_ob': 92, 'sideways_adx_thresh': 32.210517444142724, 'sideways_atr_min_pct': 3.987771742687551e-06, 'sideways_atr_max_pct': 0.030409214497989664, 'sideways_tp_mult': 1.9390290194121311, 'sideways_tsl_mult': 0.052002794782364685, 'sideways_time_stop': 300, 'sideways_use_sma': True, 'sideways_use_ema': False, 'sideways_use_atr': True, 'sideways_use_adx': False, 'sideways_use_spike': False, 'sideways_rsi_required': True}.
[I 2025-08-31 10:53:22,827] Trial 456 finished with values: [-1000000000.0, 1000000000.0] and parameters: {'p_sma': 14, 'p_std': 28, 'p_atr': 13, 'p_adx': 29, 'rsi_period': 25, 'ema1': 28, 'ema2': 57, 'slip_atr_k': 0.029004661273984853, 'slip_spread_k': 0.6698190848501003, 'spread_hl_frac': 0.020785931539838848, 'bb_std_mult': 2.593735387675827, 'rsi_os': 44, 'rsi_ob': 78, 'vol_spike': 0.010591524300611999, 'adx_thresh': 32.397087745610044, 'atr_min_pct': 0.006807007574580847, 'atr_max_pct': 0.04184963462141733, 'tp_mult': 1.7761144471511012, 'tsl_mult': 0.2806982747060877, 'strategy': 'breakout', 'time_stop': 99, 'use_sma': True, 'use_atr': False, 'use_adx': True, 'use_ema': True, 'use_spike': True, 'rsi_required': True, 'edge_k': 0.19272161461651402, 'edge_cap': 0.4567488549584193, 'bull_strategy': 'mean_reversion', 'bull_bb_std_mult': 0.8176239098788551, 'bull_rsi_os': 7, 'bull_rsi_ob': 91, 'bull_adx_thresh': 6.2184610035842836, 'bull_atr_min_pct': 0.012676127355364164, 'bull_atr_max_pct': 0.03394049867693012, 'bull_tp_mult': 1.8859637519905563, 'bull_tsl_mult': 0.10846479892973826, 'bull_time_stop': 58, 'bull_use_sma': True, 'bull_use_ema': False, 'bull_use_atr': False, 'bull_use_adx': False, 'bull_use_spike': False, 'bull_rsi_required': True, 'bear_strategy': 'breakout', 'bear_bb_std_mult': 2.3876643512557845, 'bear_rsi_os': 42, 'bear_rsi_ob': 86, 'bear_adx_thresh': 11.419112923114032, 'bear_atr_min_pct': 0.014953598455073526, 'bear_atr_max_pct': 0.037720725525149226, 'bear_tp_mult': 2.994248739128585, 'bear_tsl_mult': 0.19259134994283755, 'bear_time_stop': 158, 'bear_use_sma': False, 'bear_use_ema': True, 'bear_use_atr': False, 'bear_use_adx': False, 'bear_use_spike': False, 'bear_rsi_required': False, 'sideways_strategy': 'mean_reversion', 'sideways_bb_std_mult': 2.752117466516422, 'sideways_rsi_os': 36, 'sideways_rsi_ob': 93, 'sideways_adx_thresh': 19.34164017094011, 'sideways_atr_min_pct': 0.017640116693778723, 'sideways_atr_max_pct': 0.05445093975016858, 'sideways_tp_mult': 2.010859232939004, 'sideways_tsl_mult': 0.1336217241539595, 'sideways_time_stop': 300, 'sideways_use_sma': False, 'sideways_use_ema': True, 'sideways_use_atr': False, 'sideways_use_adx': False, 'sideways_use_spike': False, 'sideways_rsi_required': True}.
