[I 2025-08-31 10:50:07,860] Trial 433 finished with values: [-1000000000.0, 1000000000.0] and parameters: {'p_sma': 15, 'p_std': 43, 'p_atr': 9, 'p_adx': 14, 'rsi_period': 44, 'ema1': 14, 'ema2': 58, 'slip_atr_k': 0.025650619509744635, 'slip_spread_k': 0.8242826128306938, 'spread_hl_frac': 0.00885196966119965, 'bb_std_mult': 3.4113071393433154, 'rsi_os': 26, 'rsi_ob': 50, 'vol_spike': 0.2785463316812051, 'adx_thresh': 25.83363576924708, 'atr_min_pct': 0.005389136030716762, 'atr_max_pct': 0.08937353356951629, 'tp_mult': 2.419470925198518, 'tsl_mult': 0.26587772754394046, 'strategy': 'breakout', 'time_stop': 37, 'use_sma': True, 'use_atr': False, 'use_adx': True, 'use_ema': False, 'use_spike': False, 'rsi_required': True, 'edge_k': 1.8236710028824636, 'edge_cap': 0.4302715293263819, 'bull_strategy': 'breakout', 'bull_bb_std_mult': 2.6857602678201795, 'bull_rsi_os': 25, 'bull_rsi_ob': 75, 'bull_adx_thresh': 34.72923345262133, 'bull_atr_min_pct': 0.02159068649908124, 'bull_atr_max_pct': 0.0868395991655142, 'bull_tp_mult': 1.8980715583624947, 'bull_tsl_mult': 0.39850798811093574, 'bull_time_stop': 66, 'bull_use_sma': True, 'bull_use_ema': False, 'bull_use_atr': False, 'bull_use_adx': False, 'bull_use_spike': False, 'bull_rsi_required': True, 'bear_strategy': 'mean_reversion', 'bear_bb_std_mult': 3.2485165510388, 'bear_rsi_os': 12, 'bear_rsi_ob': 74, 'bear_adx_thresh': 6.50891740124824, 'bear_atr_min_pct': 0.01130767896508698, 'bear_atr_max_pct': 0.1457051210324008, 'bear_tp_mult': 2.8225122576493376, 'bear_tsl_mult': 0.6454606578932898, 'bear_time_stop': 193, 'bear_use_sma': True, 'bear_use_ema': False, 'bear_use_atr': True, 'bear_use_adx': True, 'bear_use_spike': True, 'bear_rsi_required': True, 'sideways_strategy': 'mean_reversion', 'sideways_bb_std_mult': 3.1688903097226833, 'sideways_rsi_os': 8, 'sideways_rsi_ob': 62, 'sideways_adx_thresh': 24.74854655370124, 'sideways_atr_min_pct': 0.027058105355359074, 'sideways_atr_max_pct': 0.0870732705376009, 'sideways_tp_mult': 2.6520503166816436, 'sideways_tsl_mult': 0.11790223822767538, 'sideways_time_stop': 243, 'sideways_use_sma': False, 'sideways_use_ema': False, 'sideways_use_atr': False, 'sideways_use_adx': False, 'sideways_use_spike': False, 'sideways_rsi_required': False}.
[I 2025-08-31 10:50:07,990] Trial 431 finished with values: [-1000000000.0, 1000000000.0] and parameters: {'p_sma': 15, 'p_std': 26, 'p_atr': 26, 'p_adx': 12, 'rsi_period': 68, 'ema1': 14, 'ema2': 57, 'slip_atr_k': 0.026582897940585853, 'slip_spread_k': 0.6964206006880701, 'spread_hl_frac': 0.0088243371741992, 'bb_std_mult': 2.5628972056809234, 'rsi_os': 26, 'rsi_ob': 77, 'vol_spike': 0.2630636086407137, 'adx_thresh': 28.102979800576467, 'atr_min_pct': 0.004044225341815075, 'atr_max_pct': 0.08915508513535975, 'tp_mult': 2.444664934501826, 'tsl_mult': 0.265441625833826, 'strategy': 'breakout', 'time_stop': 113, 'use_sma': True, 'use_atr': False, 'use_adx': True, 'use_ema': False, 'use_spike': False, 'rsi_required': True, 'edge_k': 0.19081133364773023, 'edge_cap': 0.43394587111526484, 'bull_strategy': 'breakout', 'bull_bb_std_mult': 2.8587228243596456, 'bull_rsi_os': 47, 'bull_rsi_ob': 72, 'bull_adx_thresh': 27.942207294970824, 'bull_atr_min_pct': 0.012852809594292141, 'bull_atr_max_pct': 0.06279970994777026, 'bull_tp_mult': 1.7280720904999551, 'bull_tsl_mult': 0.39661889133574346, 'bull_time_stop': 74, 'bull_use_sma': True, 'bull_use_ema': False, 'bull_use_atr': False, 'bull_use_adx': False, 'bull_use_spike': False, 'bull_rsi_required': True, 'bear_strategy': 'mean_reversion', 'bear_bb_std_mult': 1.925316183732524, 'bear_rsi_os': 19, 'bear_rsi_ob': 90, 'bear_adx_thresh': 6.43795653034146, 'bear_atr_min_pct': 0.023821629937906617, 'bear_atr_max_pct': 0.14623030955689958, 'bear_tp_mult': 2.6970611717753, 'bear_tsl_mult': 0.4881818259978315, 'bear_time_stop': 121, 'bear_use_sma': True, 'bear_use_ema': False, 'bear_use_atr': True, 'bear_use_adx': True, 'bear_use_spike': True, 'bear_rsi_required': True, 'sideways_strategy': 'mean_reversion', 'sideways_bb_std_mult': 2.0109416334486525, 'sideways_rsi_os': 13, 'sideways_rsi_ob': 45, 'sideways_adx_thresh': 24.482083217701184, 'sideways_atr_min_pct': 0.008127043902668097, 'sideways_atr_max_pct': 0.039395954433083226, 'sideways_tp_mult': 1.505092120076133, 'sideways_tsl_mult': 0.11582648706628364, 'sideways_time_stop': 32, 'sideways_use_sma': False, 'sideways_use_ema': False, 'sideways_use_atr': False, 'sideways_use_adx': False, 'sideways_use_spike': False, 'sideways_rsi_required': False}.
[I 2025-08-31 10:50:08,437] Trial 434 finished with values: [-1000000000.0, 1000000000.0] and parameters: {'p_sma': 52, 'p_std': 35, 'p_atr': 13, 'p_adx': 14, 'rsi_period': 45, 'ema1': 14, 'ema2': 59, 'slip_atr_k': 0.021697762931853826, 'slip_spread_k': 0.61089423995282, 'spread_hl_frac': 0.008708938242513942, 'bb_std_mult': 1.353556221741072, 'rsi_os': 27, 'rsi_ob': 62, 'vol_spike': 0.2586445208991588, 'adx_thresh': 29.639694887239457, 'atr_min_pct': 0.016338379881768058, 'atr_max_pct': 0.09937542383356873, 'tp_mult': 2.9437795008576524, 'tsl_mult': 0.23708582451634036, 'strategy': 'breakout', 'time_stop': 39, 'use_sma': True, 'use_atr': False, 'use_adx': True, 'use_ema': False, 'use_spike': False, 'rsi_required': True, 'edge_k': 0.2921378988988307, 'edge_cap': 0.47057698161547185, 'bull_strategy': 'mean_reversion', 'bull_bb_std_mult': 0.9530287701755386, 'bull_rsi_os': 16, 'bull_rsi_ob': 75, 'bull_adx_thresh': 13.223359770755707, 'bull_atr_min_pct': 0.01675793618268106, 'bull_atr_max_pct': 0.0868494446040265, 'bull_tp_mult': 2.5102443523551234, 'bull_tsl_mult': 0.8741496833943785, 'bull_time_stop': 10, 'bull_use_sma': True, 'bull_use_ema': False, 'bull_use_atr': False, 'bull_use_adx': False, 'bull_use_spike': False, 'bull_rsi_required': True, 'bear_strategy': 'breakout', 'bear_bb_std_mult': 3.531080819670914, 'bear_rsi_os': 19, 'bear_rsi_ob': 93, 'bear_adx_thresh': 6.204497992281986, 'bear_atr_min_pct': 0.023941897738381367, 'bear_atr_max_pct': 0.14621372025637272, 'bear_tp_mult': 2.824755717487652, 'bear_tsl_mult': 0.6034463040866159, 'bear_time_stop': 24, 'bear_use_sma': True, 'bear_use_ema': False, 'bear_use_atr': True, 'bear_use_adx': True, 'bear_use_spike': True, 'bear_rsi_required': True, 'sideways_strategy': 'mean_reversion', 'sideways_bb_std_mult': 3.253181436983559, 'sideways_rsi_os': 13, 'sideways_rsi_ob': 92, 'sideways_adx_thresh': 20.16525831242531, 'sideways_atr_min_pct': 0.016699281261078027, 'sideways_atr_max_pct': 0.04167597908264182, 'sideways_tp_mult': 2.2025992728618387, 'sideways_tsl_mult': 0.11540337031161386, 'sideways_time_stop': 34, 'sideways_use_sma': False, 'sideways_use_ema': True, 'sideways_use_atr': False, 'sideways_use_adx': False, 'sideways_use_spike': False, 'sideways_rsi_required': False}.
[I 2025-08-31 10:50:40,857] Trial 436 finished with values: [-1000000000.0, 1000000000.0] and parameters: {'p_sma': 17, 'p_std': 26, 'p_atr': 11, 'p_adx': 7, 'rsi_period': 34, 'ema1': 15, 'ema2': 59, 'slip_atr_k': 0.021750934382417708, 'slip_spread_k': 0.6333905568037235, 'spread_hl_frac': 0.008897355641747887, 'bb_std_mult': 2.6614983756506985, 'rsi_os': 27, 'rsi_ob': 63, 'vol_spike': 0.258552168921532, 'adx_thresh': 31.491696685143154, 'atr_min_pct': 0.0054661858563258385, 'atr_max_pct': 0.13926236398229166, 'tp_mult': 1.2105769041806602, 'tsl_mult': 0.2440686205807837, 'strategy': 'breakout', 'time_stop': 48, 'use_sma': True, 'use_atr': False, 'use_adx': True, 'use_ema': True, 'use_spike': True, 'rsi_required': True, 'edge_k': 1.0291123757240201, 'edge_cap': 0.1378636096213554, 'bull_strategy': 'mean_reversion', 'bull_bb_std_mult': 3.127538930609458, 'bull_rsi_os': 34, 'bull_rsi_ob': 73, 'bull_adx_thresh': 13.242967276608653, 'bull_atr_min_pct': 0.01683429355562219, 'bull_atr_max_pct': 0.0897442264726396, 'bull_tp_mult': 1.7241530890295476, 'bull_tsl_mult': 0.37765308997553954, 'bull_time_stop': 178, 'bull_use_sma': True, 'bull_use_ema': False, 'bull_use_atr': False, 'bull_use_adx': False, 'bull_use_spike': False, 'bull_rsi_required': False, 'bear_strategy': 'breakout', 'bear_bb_std_mult': 2.0025740761752897, 'bear_rsi_os': 52, 'bear_rsi_ob': 93, 'bear_adx_thresh': 7.16787808866323, 'bear_atr_min_pct': 0.023736419284459978, 'bear_atr_max_pct': 0.09617002626645044, 'bear_tp_mult': 1.12590492363692, 'bear_tsl_mult': 0.5310127913942605, 'bear_time_stop': 168, 'bear_use_sma': False, 'bear_use_ema': True, 'bear_use_atr': False, 'bear_use_adx': False, 'bear_use_spike': True, 'bear_rsi_required': False, 'sideways_strategy': 'mean_reversion', 'sideways_bb_std_mult': 2.604546906493113, 'sideways_rsi_os': 33, 'sideways_rsi_ob': 66, 'sideways_adx_thresh': 25.667050765887698, 'sideways_atr_min_pct': 0.00898086023379963, 'sideways_atr_max_pct': 0.1044051406430768, 'sideways_tp_mult': 2.2404055833905705, 'sideways_tsl_mult': 0.150187863648582, 'sideways_time_stop': 20, 'sideways_use_sma': False, 'sideways_use_ema': True, 'sideways_use_atr': False, 'sideways_use_adx': False, 'sideways_use_spike': False, 'sideways_rsi_required': True}.
[I 2025-08-31 10:50:41,549] Trial 435 finished with values: [-1000000000.0, 1000000000.0] and parameters: {'p_sma': 15, 'p_std': 26, 'p_atr': 11, 'p_adx': 14, 'rsi_period': 44, 'ema1': 9, 'ema2': 33, 'slip_atr_k': 0.02141385029081533, 'slip_spread_k': 0.9451875733227555, 'spread_hl_frac': 0.008367942366335143, 'bb_std_mult': 2.663281818370051, 'rsi_os': 27, 'rsi_ob': 64, 'vol_spike': 0.2582175840513256, 'adx_thresh': 31.32040931062367, 'atr_min_pct': 0.016194586007857364, 'atr_max_pct': 0.0998923123532446, 'tp_mult': 1.185515565044485, 'tsl_mult': 0.26522823499437237, 'strategy': 'breakout', 'time_stop': 57, 'use_sma': True, 'use_atr': False, 'use_adx': True, 'use_ema': False, 'use_spike': True, 'rsi_required': True, 'edge_k': 1.04338309667471, 'edge_cap': 0.4756200656360302, 'bull_strategy': 'mean_reversion', 'bull_bb_std_mult': 0.9607492491543683, 'bull_rsi_os': 47, 'bull_rsi_ob': 74, 'bull_adx_thresh': 16.141257053964956, 'bull_atr_min_pct': 0.015797586206663286, 'bull_atr_max_pct': 0.08666417889420303, 'bull_tp_mult': 1.7634239073795537, 'bull_tsl_mult': 0.46973720613412484, 'bull_time_stop': 65, 'bull_use_sma': True, 'bull_use_ema': False, 'bull_use_atr': False, 'bull_use_adx': False, 'bull_use_spike': False, 'bull_rsi_required': True, 'bear_strategy': 'breakout', 'bear_bb_std_mult': 3.0325508890929904, 'bear_rsi_os': 44, 'bear_rsi_ob': 93, 'bear_adx_thresh': 6.7444273532574845, 'bear_atr_min_pct': 0.011377559436642044, 'bear_atr_max_pct': 0.13435658568499592, 'bear_tp_mult': 1.9125421832781728, 'bear_tsl_mult': 0.5198124290831175, 'bear_time_stop': 24, 'bear_use_sma': True, 'bear_use_ema': False, 'bear_use_atr': True, 'bear_use_adx': True, 'bear_use_spike': True, 'bear_rsi_required': True, 'sideways_strategy': 'mean_reversion', 'sideways_bb_std_mult': 2.6211135794259968, 'sideways_rsi_os': 11, 'sideways_rsi_ob': 64, 'sideways_adx_thresh': 24.559105132535294, 'sideways_atr_min_pct': 0.017269012940293406, 'sideways_atr_max_pct': 0.042209453195193126, 'sideways_tp_mult': 2.218724729465183, 'sideways_tsl_mult': 0.15188057427387164, 'sideways_time_stop': 20, 'sideways_use_sma': False, 'sideways_use_ema': True, 'sideways_use_atr': False, 'sideways_use_adx': False, 'sideways_use_spike': False, 'sideways_rsi_required': True}.
[I 2025-08-31 10:50:41,773] Trial 437 finished with values: [-1000000000.0, 1000000000.0] and parameters: {'p_sma': 17, 'p_std': 35, 'p_atr': 11, 'p_adx': 14, 'rsi_period': 73, 'ema1': 15, 'ema2': 59, 'slip_atr_k': 0.23722249270402762, 'slip_spread_k': 0.5510649890250263, 'spread_hl_frac': 0.007364779525452265, 'bb_std_mult': 1.236664007747363, 'rsi_os': 31, 'rsi_ob': 79, 'vol_spike': 0.2015651995418053, 'adx_thresh': 34.22312921529957, 'atr_min_pct': 0.028557693726594273, 'atr_max_pct': 0.13931941460000283, 'tp_mult': 1.170028903151123, 'tsl_mult': 0.30229931234062574, 'strategy': 'breakout', 'time_stop': 161, 'use_sma': True, 'use_atr': False, 'use_adx': True, 'use_ema': True, 'use_spike': True, 'rsi_required': True, 'edge_k': 1.6348755931143413, 'edge_cap': 0.47109235674022437, 'bull_strategy': 'mean_reversion', 'bull_bb_std_mult': 0.6400180146909971, 'bull_rsi_os': 10, 'bull_rsi_ob': 74, 'bull_adx_thresh': 5.7269050111469895, 'bull_atr_min_pct': 0.009984682886025872, 'bull_atr_max_pct': 0.08219741131123315, 'bull_tp_mult': 1.4084931839496968, 'bull_tsl_mult': 0.23216560182701856, 'bull_time_stop': 63, 'bull_use_sma': True, 'bull_use_ema': False, 'bull_use_atr': False, 'bull_use_adx': False, 'bull_use_spike': False, 'bull_rsi_required': False, 'bear_strategy': 'breakout', 'bear_bb_std_mult': 2.1704031467176383, 'bear_rsi_os': 40, 'bear_rsi_ob': 80, 'bear_adx_thresh': 7.172663717708577, 'bear_atr_min_pct': 0.005725355502397926, 'bear_atr_max_pct': 0.11422548731967253, 'bear_tp_mult': 1.9161576090155983, 'bear_tsl_mult': 0.6010375161084457, 'bear_time_stop': 170, 'bear_use_sma': False, 'bear_use_ema': True, 'bear_use_atr': False, 'bear_use_adx': False, 'bear_use_spike': True, 'bear_rsi_required': False, 'sideways_strategy': 'mean_reversion', 'sideways_bb_std_mult': 1.503854794777326, 'sideways_rsi_os': 32, 'sideways_rsi_ob': 92, 'sideways_adx_thresh': 11.79231223023409, 'sideways_atr_min_pct': 0.020983007261297072, 'sideways_atr_max_pct': 0.04282516157681667, 'sideways_tp_mult': 2.0053976189093357, 'sideways_tsl_mult': 0.1497246305765085, 'sideways_time_stop': 21, 'sideways_use_sma': False, 'sideways_use_ema': True, 'sideways_use_atr': False, 'sideways_use_adx': False, 'sideways_use_spike': False, 'sideways_rsi_required': True}.
[I 2025-08-31 10:50:41,863] Trial 438 finished with values: [-1000000000.0, 1000000000.0] and parameters: {'p_sma': 17, 'p_std': 46, 'p_atr': 14, 'p_adx': 8, 'rsi_period': 50, 'ema1': 9, 'ema2': 52, 'slip_atr_k': 0.06593271246021998, 'slip_spread_k': 0.39425307105731056, 'spread_hl_frac': 0.010243300678264957, 'bb_std_mult': 1.2523707081667814, 'rsi_os': 13, 'rsi_ob': 55, 'vol_spike': 0.06904601919699903, 'adx_thresh': 8.141452560871205, 'atr_min_pct': 0.009876187098375672, 'atr_max_pct': 0.1393945762141406, 'tp_mult': 1.1765442765606218, 'tsl_mult': 0.286236124718708, 'strategy': 'mean_reversion', 'time_stop': 271, 'use_sma': True, 'use_atr': False, 'use_adx': True, 'use_ema': True, 'use_spike': True, 'rsi_required': True, 'edge_k': 1.0138561642407238, 'edge_cap': 0.5104870236913444, 'bull_strategy': 'mean_reversion', 'bull_bb_std_mult': 1.3957608325634476, 'bull_rsi_os': 5, 'bull_rsi_ob': 74, 'bull_adx_thresh': 7.039241404035257, 'bull_atr_min_pct': 0.009458801218258173, 'bull_atr_max_pct': 0.08214189892898856, 'bull_tp_mult': 1.6527220807762284, 'bull_tsl_mult': 0.4639665895880869, 'bull_time_stop': 176, 'bull_use_sma': False, 'bull_use_ema': False, 'bull_use_atr': False, 'bull_use_adx': False, 'bull_use_spike': False, 'bull_rsi_required': False, 'bear_strategy': 'breakout', 'bear_bb_std_mult': 2.277825042805326, 'bear_rsi_os': 44, 'bear_rsi_ob': 81, 'bear_adx_thresh': 7.138831329622251, 'bear_atr_min_pct': 0.0057141259733650895, 'bear_atr_max_pct': 0.1362917151670138, 'bear_tp_mult': 1.1249146843367095, 'bear_tsl_mult': 0.5257387050843372, 'bear_time_stop': 139, 'bear_use_sma': False, 'bear_use_ema': True, 'bear_use_atr': False, 'bear_use_adx': False, 'bear_use_spike': True, 'bear_rsi_required': False, 'sideways_strategy': 'mean_reversion', 'sideways_bb_std_mult': 2.554476393198228, 'sideways_rsi_os': 47, 'sideways_rsi_ob': 64, 'sideways_adx_thresh': 25.820422671206032, 'sideways_atr_min_pct': 0.019495911782539996, 'sideways_atr_max_pct': 0.10468990297092542, 'sideways_tp_mult': 1.977374669258493, 'sideways_tsl_mult': 0.7816930809672467, 'sideways_time_stop': 21, 'sideways_use_sma': True, 'sideways_use_ema': True, 'sideways_use_atr': False, 'sideways_use_adx': False, 'sideways_use_spike': False, 'sideways_rsi_required': True}.
[I 2025-08-31 10:50:42,575] Trial 439 finished with values: [-1000000000.0, 1000000000.0] and parameters: {'p_sma': 42, 'p_std': 27, 'p_atr': 7, 'p_adx': 24, 'rsi_period': 7, 'ema1': 15, 'ema2': 33, 'slip_atr_k': 0.06578068859317639, 'slip_spread_k': 0.5486908030372348, 'spread_hl_frac': 0.007745194616333988, 'bb_std_mult': 2.5079748154756687, 'rsi_os': 52, 'rsi_ob': 79, 'vol_spike': 0.027181880408782694, 'adx_thresh': 34.596855138120404, 'atr_min_pct': 0.00814576404719895, 'atr_max_pct': 0.09415284152759895, 'tp_mult': 2.322563816406179, 'tsl_mult': 0.03323489915058947, 'strategy': 'mean_reversion', 'time_stop': 270, 'use_sma': True, 'use_atr': False, 'use_adx': True, 'use_ema': True, 'use_spike': True, 'rsi_required': True, 'edge_k': 1.6297634368754954, 'edge_cap': 0.2822176406585801, 'bull_strategy': 'breakout', 'bull_bb_std_mult': 0.574977987580333, 'bull_rsi_os': 5, 'bull_rsi_ob': 85, 'bull_adx_thresh': 6.938169026004206, 'bull_atr_min_pct': 0.014100891314591558, 'bull_atr_max_pct': 0.04400116311926993, 'bull_tp_mult': 1.6675879946074277, 'bull_tsl_mult': 0.930979264186262, 'bull_time_stop': 211, 'bull_use_sma': False, 'bull_use_ema': False, 'bull_use_atr': False, 'bull_use_adx': False, 'bull_use_spike': False, 'bull_rsi_required': True, 'bear_strategy': 'breakout', 'bear_bb_std_mult': 2.1807756997892658, 'bear_rsi_os': 48, 'bear_rsi_ob': 80, 'bear_adx_thresh': 31.4202482388062, 'bear_atr_min_pct': 0.005848879574813481, 'bear_atr_max_pct': 0.13447409089545873, 'bear_tp_mult': 2.7759697321751524, 'bear_tsl_mult': 0.5293196123574477, 'bear_time_stop': 138, 'bear_use_sma': False, 'bear_use_ema': True, 'bear_use_atr': False, 'bear_use_adx': False, 'bear_use_spike': True, 'bear_rsi_required': False, 'sideways_strategy': 'mean_reversion', 'sideways_bb_std_mult': 2.791399927482707, 'sideways_rsi_os': 11, 'sideways_rsi_ob': 53, 'sideways_adx_thresh': 16.362450093621366, 'sideways_atr_min_pct': 0.01915291135377623, 'sideways_atr_max_pct': 0.049019024645910625, 'sideways_tp_mult': 1.8361043436816447, 'sideways_tsl_mult': 0.7777003326010201, 'sideways_time_stop': 19, 'sideways_use_sma': True, 'sideways_use_ema': False, 'sideways_use_atr': True, 'sideways_use_adx': False, 'sideways_use_spike': False, 'sideways_rsi_required': True}.
[I 2025-08-31 10:51:11,900] Trial 442 finished with values: [-1000000000.0, 1000000000.0] and parameters: {'p_sma': 26, 'p_std': 29, 'p_atr': 25, 'p_adx': 30, 'rsi_period': 46, 'ema1': 13, 'ema2': 26, 'slip_atr_k': 0.036658808366376416, 'slip_spread_k': 0.31261809537983254, 'spread_hl_frac': 0.011000071311383319, 'bb_std_mult': 1.9848014058139294, 'rsi_os': 40, 'rsi_ob': 79, 'vol_spike': 0.08827545665843343, 'adx_thresh': 28.821507201546712, 'atr_min_pct': 0.007928006922027591, 'atr_max_pct': 0.10296463617530878, 'tp_mult': 2.3418608401896996, 'tsl_mult': 0.22174856396525366, 'strategy': 'mean_reversion', 'time_stop': 295, 'use_sma': False, 'use_atr': False, 'use_adx': True, 'use_ema': True, 'use_spike': True, 'rsi_required': True, 'edge_k': 1.2988780734921306, 'edge_cap': 0.4122081982477468, 'bull_strategy': 'breakout', 'bull_bb_std_mult': 0.8276277026692779, 'bull_rsi_os': 29, 'bull_rsi_ob': 65, 'bull_adx_thresh': 8.168004900473736, 'bull_atr_min_pct': 0.013719176152128122, 'bull_atr_max_pct': 0.10570700764024549, 'bull_tp_mult': 1.831421700129755, 'bull_tsl_mult': 0.13563442231610673, 'bull_time_stop': 41, 'bull_use_sma': False, 'bull_use_ema': False, 'bull_use_atr': False, 'bull_use_adx': True, 'bull_use_spike': False, 'bull_rsi_required': True, 'bear_strategy': 'breakout', 'bear_bb_std_mult': 2.580112267487846, 'bear_rsi_os': 6, 'bear_rsi_ob': 88, 'bear_adx_thresh': 32.425778784656295, 'bear_atr_min_pct': 0.0135199395631825, 'bear_atr_max_pct': 0.05484867359267648, 'bear_tp_mult': 2.779844004174034, 'bear_tsl_mult': 0.1708389592536439, 'bear_time_stop': 204, 'bear_use_sma': False, 'bear_use_ema': True, 'bear_use_atr': False, 'bear_use_adx': False, 'bear_use_spike': False, 'bear_rsi_required': False, 'sideways_strategy': 'mean_reversion', 'sideways_bb_std_mult': 2.906952234166993, 'sideways_rsi_os': 9, 'sideways_rsi_ob': 88, 'sideways_adx_thresh': 25.977960369450393, 'sideways_atr_min_pct': 0.01592374645921646, 'sideways_atr_max_pct': 0.057350746381016865, 'sideways_tp_mult': 2.7774519942095277, 'sideways_tsl_mult': 0.6518884478907445, 'sideways_time_stop': 157, 'sideways_use_sma': True, 'sideways_use_ema': False, 'sideways_use_atr': True, 'sideways_use_adx': False, 'sideways_use_spike': False, 'sideways_rsi_required': True}.
