[I 2025-08-31 10:14:01,941] Trial 153 finished with values: [-1000000000.0, 1000000000.0] and parameters: {'p_sma': 49, 'p_std': 39, 'p_atr': 28, 'p_adx': 13, 'rsi_period': 51, 'ema1': 12, 'ema2': 57, 'slip_atr_k': 0.20203131700152957, 'slip_spread_k': 0.7433207355648288, 'spread_hl_frac': 0.016546549329600726, 'bb_std_mult': 2.668138424013622, 'rsi_os': 47, 'rsi_ob': 84, 'vol_spike': 0.03677409477217486, 'adx_thresh': 33.2627416304863, 'atr_min_pct': 0.006867429180281853, 'atr_max_pct': 0.10385092211560416, 'tp_mult': 2.4756191503568594, 'tsl_mult': 0.8679516737785996, 'strategy': 'breakout', 'time_stop': 275, 'use_sma': False, 'use_atr': True, 'use_adx': False, 'use_ema': True, 'use_spike': True, 'rsi_required': True, 'edge_k': 0.7986592694059258, 'edge_cap': 0.7821625005020705, 'bull_strategy': 'mean_reversion', 'bull_bb_std_mult': 1.005475143783627, 'bull_rsi_os': 39, 'bull_rsi_ob': 74, 'bull_adx_thresh': 26.851465379416922, 'bull_atr_min_pct': 0.027104225675009835, 'bull_atr_max_pct': 0.05209314557015246, 'bull_tp_mult': 2.9311915946395746, 'bull_tsl_mult': 0.42067783940011494, 'bull_time_stop': 42, 'bull_use_sma': True, 'bull_use_ema': True, 'bull_use_atr': True, 'bull_use_adx': False, 'bull_use_spike': True, 'bull_rsi_required': True, 'bear_strategy': 'breakout', 'bear_bb_std_mult': 1.0667670205026516, 'bear_rsi_os': 41, 'bear_rsi_ob': 74, 'bear_adx_thresh': 16.30707091020369, 'bear_atr_min_pct': 0.02941099797799667, 'bear_atr_max_pct': 0.07515752555288024, 'bear_tp_mult': 2.763404583262581, 'bear_tsl_mult': 0.5519117991782814, 'bear_time_stop': 54, 'bear_use_sma': False, 'bear_use_ema': False, 'bear_use_atr': False, 'bear_use_adx': False, 'bear_use_spike': True, 'bear_rsi_required': True, 'sideways_strategy': 'breakout', 'sideways_bb_std_mult': 2.435641142118024, 'sideways_rsi_os': 10, 'sideways_rsi_ob': 79, 'sideways_adx_thresh': 17.924121119542612, 'sideways_atr_min_pct': 0.021554191123241168, 'sideways_atr_max_pct': 0.09223001616939351, 'sideways_tp_mult': 2.632357761074528, 'sideways_tsl_mult': 0.14569137241856348, 'sideways_time_stop': 281, 'sideways_use_sma': False, 'sideways_use_ema': True, 'sideways_use_atr': False, 'sideways_use_adx': True, 'sideways_use_spike': True, 'sideways_rsi_required': True}.
[I 2025-08-31 10:14:02,179] Trial 154 finished with values: [-1000000000.0, 1000000000.0] and parameters: {'p_sma': 36, 'p_std': 52, 'p_atr': 28, 'p_adx': 20, 'rsi_period': 51, 'ema1': 12, 'ema2': 44, 'slip_atr_k': 0.03229225672350888, 'slip_spread_k': 0.7353714980278405, 'spread_hl_frac': 0.01628766208731736, 'bb_std_mult': 2.0883170319336557, 'rsi_os': 47, 'rsi_ob': 84, 'vol_spike': 0.11373989319705846, 'adx_thresh': 28.938209042672984, 'atr_min_pct': 0.005276423723913919, 'atr_max_pct': 0.1025800673393656, 'tp_mult': 2.7599799986218283, 'tsl_mult': 0.867100213318116, 'strategy': 'breakout', 'time_stop': 273, 'use_sma': False, 'use_atr': True, 'use_adx': False, 'use_ema': True, 'use_spike': True, 'rsi_required': True, 'edge_k': 0.19104016158983358, 'edge_cap': 0.4974919972450836, 'bull_strategy': 'mean_reversion', 'bull_bb_std_mult': 1.1547620379229588, 'bull_rsi_os': 41, 'bull_rsi_ob': 74, 'bull_adx_thresh': 31.38197446466157, 'bull_atr_min_pct': 0.0014117131336229354, 'bull_atr_max_pct': 0.051291599746686824, 'bull_tp_mult': 2.8848523118921134, 'bull_tsl_mult': 0.2750960795648019, 'bull_time_stop': 63, 'bull_use_sma': True, 'bull_use_ema': True, 'bull_use_atr': True, 'bull_use_adx': False, 'bull_use_spike': True, 'bull_rsi_required': True, 'bear_strategy': 'breakout', 'bear_bb_std_mult': 1.3931676637651107, 'bear_rsi_os': 47, 'bear_rsi_ob': 78, 'bear_adx_thresh': 10.57475883411117, 'bear_atr_min_pct': 0.025572785414199703, 'bear_atr_max_pct': 0.0749232895809657, 'bear_tp_mult': 2.7635962317839766, 'bear_tsl_mult': 0.495961710358186, 'bear_time_stop': 5, 'bear_use_sma': False, 'bear_use_ema': False, 'bear_use_atr': False, 'bear_use_adx': False, 'bear_use_spike': True, 'bear_rsi_required': True, 'sideways_strategy': 'breakout', 'sideways_bb_std_mult': 1.606264914601231, 'sideways_rsi_os': 21, 'sideways_rsi_ob': 93, 'sideways_adx_thresh': 10.061976654794279, 'sideways_atr_min_pct': 0.023441999490401745, 'sideways_atr_max_pct': 0.14574612536219622, 'sideways_tp_mult': 2.3161695037121826, 'sideways_tsl_mult': 0.4662854196641227, 'sideways_time_stop': 257, 'sideways_use_sma': False, 'sideways_use_ema': True, 'sideways_use_atr': False, 'sideways_use_adx': True, 'sideways_use_spike': True, 'sideways_rsi_required': True}.
[I 2025-08-31 10:14:34,952] Trial 155 finished with values: [-1000000000.0, 1000000000.0] and parameters: {'p_sma': 47, 'p_std': 36, 'p_atr': 28, 'p_adx': 13, 'rsi_period': 44, 'ema1': 12, 'ema2': 57, 'slip_atr_k': 0.031405789539964465, 'slip_spread_k': 0.7422287988795351, 'spread_hl_frac': 0.015483814334785963, 'bb_std_mult': 2.6632453925214774, 'rsi_os': 48, 'rsi_ob': 70, 'vol_spike': 0.11637017014145852, 'adx_thresh': 34.03547356626085, 'atr_min_pct': 0.02032651642037441, 'atr_max_pct': 0.11623159882181709, 'tp_mult': 2.7547077609455024, 'tsl_mult': 0.8261825643457776, 'strategy': 'breakout', 'time_stop': 270, 'use_sma': False, 'use_atr': True, 'use_adx': False, 'use_ema': True, 'use_spike': True, 'rsi_required': True, 'edge_k': 1.7779567105666123, 'edge_cap': 0.8123290801307612, 'bull_strategy': 'mean_reversion', 'bull_bb_std_mult': 1.0136778201055079, 'bull_rsi_os': 40, 'bull_rsi_ob': 85, 'bull_adx_thresh': 27.151600194223853, 'bull_atr_min_pct': 0.0013569413735491896, 'bull_atr_max_pct': 0.04849594196192957, 'bull_tp_mult': 2.9105005126832615, 'bull_tsl_mult': 0.19657007153131761, 'bull_time_stop': 85, 'bull_use_sma': True, 'bull_use_ema': True, 'bull_use_atr': True, 'bull_use_adx': False, 'bull_use_spike': True, 'bull_rsi_required': True, 'bear_strategy': 'breakout', 'bear_bb_std_mult': 1.3278683588523765, 'bear_rsi_os': 43, 'bear_rsi_ob': 95, 'bear_adx_thresh': 21.564135596063156, 'bear_atr_min_pct': 0.027928824483621315, 'bear_atr_max_pct': 0.07490092043510847, 'bear_tp_mult': 2.1315338795804455, 'bear_tsl_mult': 0.4783896207629942, 'bear_time_stop': 231, 'bear_use_sma': False, 'bear_use_ema': False, 'bear_use_atr': False, 'bear_use_adx': False, 'bear_use_spike': False, 'bear_rsi_required': True, 'sideways_strategy': 'breakout', 'sideways_bb_std_mult': 1.2721332612464866, 'sideways_rsi_os': 20, 'sideways_rsi_ob': 82, 'sideways_adx_thresh': 26.00386725776897, 'sideways_atr_min_pct': 0.023471356860485702, 'sideways_atr_max_pct': 0.10744626367198203, 'sideways_tp_mult': 2.2827631675056206, 'sideways_tsl_mult': 0.00030052642397982614, 'sideways_time_stop': 278, 'sideways_use_sma': False, 'sideways_use_ema': True, 'sideways_use_atr': True, 'sideways_use_adx': True, 'sideways_use_spike': False, 'sideways_rsi_required': True}.
[I 2025-08-31 10:14:35,400] Trial 156 finished with values: [-0.013461678513559838, 0.013399005871850599] and parameters: {'p_sma': 43, 'p_std': 53, 'p_atr': 24, 'p_adx': 20, 'rsi_period': 60, 'ema1': 13, 'ema2': 60, 'slip_atr_k': 0.031712880878344056, 'slip_spread_k': 0.6201401658203762, 'spread_hl_frac': 0.015819880697686146, 'bb_std_mult': 2.8157593735795796, 'rsi_os': 50, 'rsi_ob': 73, 'vol_spike': 0.11617661440930634, 'adx_thresh': 22.78251211580204, 'atr_min_pct': 0.005414766991211531, 'atr_max_pct': 0.04758836218725037, 'tp_mult': 2.805862470860391, 'tsl_mult': 0.8235363828342912, 'strategy': 'breakout', 'time_stop': 266, 'use_sma': False, 'use_atr': True, 'use_adx': False, 'use_ema': False, 'use_spike': True, 'rsi_required': False, 'edge_k': 0.39273934991521375, 'edge_cap': 0.4961323671271892, 'bull_strategy': 'breakout', 'bull_bb_std_mult': 0.8940191461695333, 'bull_rsi_os': 46, 'bull_rsi_ob': 86, 'bull_adx_thresh': 22.57036966114555, 'bull_atr_min_pct': 0.0017160640614811535, 'bull_atr_max_pct': 0.012057440331577879, 'bull_tp_mult': 2.7474209930740883, 'bull_tsl_mult': 0.3299352583187237, 'bull_time_stop': 80, 'bull_use_sma': True, 'bull_use_ema': True, 'bull_use_atr': False, 'bull_use_adx': False, 'bull_use_spike': True, 'bull_rsi_required': True, 'bear_strategy': 'breakout', 'bear_bb_std_mult': 1.064194825009023, 'bear_rsi_os': 43, 'bear_rsi_ob': 71, 'bear_adx_thresh': 7.905881604226467, 'bear_atr_min_pct': 0.027574425154314155, 'bear_atr_max_pct': 0.06610826014422759, 'bear_tp_mult': 2.6264629428942454, 'bear_tsl_mult': 0.4745649226337554, 'bear_time_stop': 230, 'bear_use_sma': False, 'bear_use_ema': False, 'bear_use_atr': False, 'bear_use_adx': True, 'bear_use_spike': False, 'bear_rsi_required': True, 'sideways_strategy': 'breakout', 'sideways_bb_std_mult': 1.6357800108641836, 'sideways_rsi_os': 54, 'sideways_rsi_ob': 82, 'sideways_adx_thresh': 32.18557829198243, 'sideways_atr_min_pct': 0.020972045799294663, 'sideways_atr_max_pct': 0.10628929973439707, 'sideways_tp_mult': 2.2463703245149396, 'sideways_tsl_mult': 0.041392353079844485, 'sideways_time_stop': 249, 'sideways_use_sma': False, 'sideways_use_ema': True, 'sideways_use_atr': True, 'sideways_use_adx': True, 'sideways_use_spike': False, 'sideways_rsi_required': True}.
[I 2025-08-31 10:14:35,412] Trial 158 finished with values: [-1000000000.0, 1000000000.0] and parameters: {'p_sma': 30, 'p_std': 35, 'p_atr': 25, 'p_adx': 9, 'rsi_period': 44, 'ema1': 13, 'ema2': 60, 'slip_atr_k': 0.051276717934304925, 'slip_spread_k': 0.31034278753883265, 'spread_hl_frac': 0.013268281679451762, 'bb_std_mult': 2.8297061093818314, 'rsi_os': 42, 'rsi_ob': 71, 'vol_spike': 0.1395250714044784, 'adx_thresh': 25.0639660609956, 'atr_min_pct': 0.002985271782537228, 'atr_max_pct': 0.06543941594622275, 'tp_mult': 2.107644119973617, 'tsl_mult': 0.8202017887072779, 'strategy': 'breakout', 'time_stop': 90, 'use_sma': False, 'use_atr': True, 'use_adx': False, 'use_ema': False, 'use_spike': True, 'rsi_required': False, 'edge_k': 1.6630803085946688, 'edge_cap': 0.807973812139385, 'bull_strategy': 'breakout', 'bull_bb_std_mult': 0.8975245418888183, 'bull_rsi_os': 46, 'bull_rsi_ob': 56, 'bull_adx_thresh': 21.995627517121314, 'bull_atr_min_pct': 0.018909297984585977, 'bull_atr_max_pct': 0.010018360770778445, 'bull_tp_mult': 2.7544703067085115, 'bull_tsl_mult': 0.13276714879674556, 'bull_time_stop': 85, 'bull_use_sma': True, 'bull_use_ema': True, 'bull_use_atr': False, 'bull_use_adx': False, 'bull_use_spike': False, 'bull_rsi_required': True, 'bear_strategy': 'breakout', 'bear_bb_std_mult': 0.9340864007698431, 'bear_rsi_os': 34, 'bear_rsi_ob': 95, 'bear_adx_thresh': 6.814713488177132, 'bear_atr_min_pct': 0.02755625374675287, 'bear_atr_max_pct': 0.06589890027941717, 'bear_tp_mult': 2.136516361344777, 'bear_tsl_mult': 0.05480461682516768, 'bear_time_stop': 15, 'bear_use_sma': False, 'bear_use_ema': False, 'bear_use_atr': False, 'bear_use_adx': True, 'bear_use_spike': False, 'bear_rsi_required': True, 'sideways_strategy': 'breakout', 'sideways_bb_std_mult': 2.5763017195735496, 'sideways_rsi_os': 20, 'sideways_rsi_ob': 82, 'sideways_adx_thresh': 25.962225152265194, 'sideways_atr_min_pct': 0.017790512756074257, 'sideways_atr_max_pct': 0.1073243065394626, 'sideways_tp_mult': 2.5645889838603324, 'sideways_tsl_mult': 0.6434013293246315, 'sideways_time_stop': 250, 'sideways_use_sma': False, 'sideways_use_ema': True, 'sideways_use_atr': True, 'sideways_use_adx': False, 'sideways_use_spike': False, 'sideways_rsi_required': True}.
[I 2025-08-31 10:14:35,531] Trial 157 finished with values: [-0.0238925119638721, 0.023762582897825544] and parameters: {'p_sma': 32, 'p_std': 20, 'p_atr': 24, 'p_adx': 20, 'rsi_period': 74, 'ema1': 13, 'ema2': 31, 'slip_atr_k': 0.11203937030992764, 'slip_spread_k': 0.6252350565068397, 'spread_hl_frac': 0.015815599597507373, 'bb_std_mult': 2.0897421939013956, 'rsi_os': 50, 'rsi_ob': 71, 'vol_spike': 0.11585378956405544, 'adx_thresh': 27.54349153444086, 'atr_min_pct': 0.0037957580038789993, 'atr_max_pct': 0.05428369425513405, 'tp_mult': 2.8077556667828714, 'tsl_mult': 0.8258775416031423, 'strategy': 'breakout', 'time_stop': 91, 'use_sma': False, 'use_atr': True, 'use_adx': False, 'use_ema': False, 'use_spike': True, 'rsi_required': False, 'edge_k': 0.4113395012538804, 'edge_cap': 0.3892689362605579, 'bull_strategy': 'breakout', 'bull_bb_std_mult': 1.1640295698880796, 'bull_rsi_os': 41, 'bull_rsi_ob': 56, 'bull_adx_thresh': 28.39779998834942, 'bull_atr_min_pct': 0.0012727785280413264, 'bull_atr_max_pct': 0.03394984452013983, 'bull_tp_mult': 2.751041871262042, 'bull_tsl_mult': 0.13479294773801392, 'bull_time_stop': 82, 'bull_use_sma': True, 'bull_use_ema': True, 'bull_use_atr': False, 'bull_use_adx': False, 'bull_use_spike': True, 'bull_rsi_required': True, 'bear_strategy': 'breakout', 'bear_bb_std_mult': 0.9211092126491309, 'bear_rsi_os': 43, 'bear_rsi_ob': 88, 'bear_adx_thresh': 14.36281757355528, 'bear_atr_min_pct': 0.011913494418912964, 'bear_atr_max_pct': 0.06720273776105247, 'bear_tp_mult': 2.853366297549785, 'bear_tsl_mult': 0.052001056871716377, 'bear_time_stop': 6, 'bear_use_sma': False, 'bear_use_ema': False, 'bear_use_atr': False, 'bear_use_adx': True, 'bear_use_spike': False, 'bear_rsi_required': True, 'sideways_strategy': 'breakout', 'sideways_bb_std_mult': 1.6384236225140345, 'sideways_rsi_os': 54, 'sideways_rsi_ob': 82, 'sideways_adx_thresh': 25.385995186175354, 'sideways_atr_min_pct': 0.023726518781023283, 'sideways_atr_max_pct': 0.1066095305690382, 'sideways_tp_mult': 2.576296832843322, 'sideways_tsl_mult': 0.6408823627801095, 'sideways_time_stop': 247, 'sideways_use_sma': False, 'sideways_use_ema': True, 'sideways_use_atr': True, 'sideways_use_adx': True, 'sideways_use_spike': False, 'sideways_rsi_required': True}.
[I 2025-08-31 10:15:08,723] Trial 161 finished with values: [-1000000000.0, 1000000000.0] and parameters: {'p_sma': 23, 'p_std': 53, 'p_atr': 27, 'p_adx': 19, 'rsi_period': 69, 'ema1': 14, 'ema2': 58, 'slip_atr_k': 0.016302411691098286, 'slip_spread_k': 0.6043080079807188, 'spread_hl_frac': 0.040524391430529466, 'bb_std_mult': 2.950059792987828, 'rsi_os': 53, 'rsi_ob': 77, 'vol_spike': 0.07253775483938829, 'adx_thresh': 26.094017529334383, 'atr_min_pct': 0.006091026377770744, 'atr_max_pct': 0.045977248880165245, 'tp_mult': 1.1130319928357175, 'tsl_mult': 0.846514531832575, 'strategy': 'breakout', 'time_stop': 268, 'use_sma': False, 'use_atr': True, 'use_adx': False, 'use_ema': True, 'use_spike': True, 'rsi_required': False, 'edge_k': 0.13810211660627564, 'edge_cap': 0.8560293858797642, 'bull_strategy': 'breakout', 'bull_bb_std_mult': 0.7525937140635648, 'bull_rsi_os': 46, 'bull_rsi_ob': 65, 'bull_adx_thresh': 22.762484332564128, 'bull_atr_min_pct': 0.00372928781125504, 'bull_atr_max_pct': 0.013619394319197772, 'bull_tp_mult': 1.9719562490014886, 'bull_tsl_mult': 0.3210100786371233, 'bull_time_stop': 70, 'bull_use_sma': True, 'bull_use_ema': True, 'bull_use_atr': True, 'bull_use_adx': False, 'bull_use_spike': False, 'bull_rsi_required': True, 'bear_strategy': 'breakout', 'bear_bb_std_mult': 1.062425649680487, 'bear_rsi_os': 48, 'bear_rsi_ob': 71, 'bear_adx_thresh': 13.150640170976422, 'bear_atr_min_pct': 0.01219613099347323, 'bear_atr_max_pct': 0.06496174867602701, 'bear_tp_mult': 2.6207482264340407, 'bear_tsl_mult': 0.8841544491260944, 'bear_time_stop': 75, 'bear_use_sma': False, 'bear_use_ema': False, 'bear_use_atr': False, 'bear_use_adx': False, 'bear_use_spike': True, 'bear_rsi_required': True, 'sideways_strategy': 'breakout', 'sideways_bb_std_mult': 2.6700368300811768, 'sideways_rsi_os': 46, 'sideways_rsi_ob': 84, 'sideways_adx_thresh': 19.804277501886855, 'sideways_atr_min_pct': 0.02101460401840334, 'sideways_atr_max_pct': 0.028015308908370243, 'sideways_tp_mult': 2.378058242657406, 'sideways_tsl_mult': 0.05126255882701131, 'sideways_time_stop': 15, 'sideways_use_sma': False, 'sideways_use_ema': True, 'sideways_use_atr': False, 'sideways_use_adx': True, 'sideways_use_spike': True, 'sideways_rsi_required': True}.
[I 2025-08-31 10:15:08,927] Trial 162 finished with values: [-1000000000.0, 1000000000.0] and parameters: {'p_sma': 43, 'p_std': 53, 'p_atr': 27, 'p_adx': 19, 'rsi_period': 59, 'ema1': 14, 'ema2': 58, 'slip_atr_k': 0.01925829044242452, 'slip_spread_k': 0.6077700986922268, 'spread_hl_frac': 0.014201465875513885, 'bb_std_mult': 2.3218071508823246, 'rsi_os': 40, 'rsi_ob': 77, 'vol_spike': 0.06969396005704281, 'adx_thresh': 21.779942159536457, 'atr_min_pct': 0.006065409869584473, 'atr_max_pct': 0.04635027097596351, 'tp_mult': 1.387015410504658, 'tsl_mult': 0.150562525002583, 'strategy': 'breakout', 'time_stop': 250, 'use_sma': False, 'use_atr': True, 'use_adx': False, 'use_ema': True, 'use_spike': True, 'rsi_required': False, 'edge_k': 0.21495934595198962, 'edge_cap': 0.8697263402529005, 'bull_strategy': 'breakout', 'bull_bb_std_mult': 0.951562728246705, 'bull_rsi_os': 43, 'bull_rsi_ob': 60, 'bull_adx_thresh': 22.850595072069677, 'bull_atr_min_pct': 0.0030484630031228843, 'bull_atr_max_pct': 0.02763210393374291, 'bull_tp_mult': 2.7988719615997275, 'bull_tsl_mult': 0.2979011989313535, 'bull_time_stop': 96, 'bull_use_sma': True, 'bull_use_ema': True, 'bull_use_atr': True, 'bull_use_adx': False, 'bull_use_spike': False, 'bull_rsi_required': True, 'bear_strategy': 'breakout', 'bear_bb_std_mult': 1.092153632577269, 'bear_rsi_os': 48, 'bear_rsi_ob': 71, 'bear_adx_thresh': 8.883482470129671, 'bear_atr_min_pct': 0.012183056611697277, 'bear_atr_max_pct': 0.06314620731533555, 'bear_tp_mult': 2.617362919493253, 'bear_tsl_mult': 0.8321170378188556, 'bear_time_stop': 32, 'bear_use_sma': False, 'bear_use_ema': False, 'bear_use_atr': False, 'bear_use_adx': False, 'bear_use_spike': True, 'bear_rsi_required': True, 'sideways_strategy': 'breakout', 'sideways_bb_std_mult': 1.034340632738227, 'sideways_rsi_os': 44, 'sideways_rsi_ob': 79, 'sideways_adx_thresh': 27.184361667927483, 'sideways_atr_min_pct': 0.015538603237087603, 'sideways_atr_max_pct': 0.09728256387530493, 'sideways_tp_mult': 2.4596654191761576, 'sideways_tsl_mult': 0.9992991826302156, 'sideways_time_stop': 254, 'sideways_use_sma': False, 'sideways_use_ema': True, 'sideways_use_atr': False, 'sideways_use_adx': True, 'sideways_use_spike': True, 'sideways_rsi_required': True}.
[I 2025-08-31 10:15:09,066] Trial 160 finished with values: [-1000000000.0, 1000000000.0] and parameters: {'p_sma': 43, 'p_std': 53, 'p_atr': 27, 'p_adx': 11, 'rsi_period': 78, 'ema1': 14, 'ema2': 58, 'slip_atr_k': 0.01741297325305189, 'slip_spread_k': 0.5375644712031133, 'spread_hl_frac': 0.011894621761438386, 'bb_std_mult': 2.362840163589293, 'rsi_os': 53, 'rsi_ob': 77, 'vol_spike': 0.1493917181129616, 'adx_thresh': 28.206436952427097, 'atr_min_pct': 0.006038433559160764, 'atr_max_pct': 0.08180517661444121, 'tp_mult': 1.0110078428613694, 'tsl_mult': 0.1359689747392614, 'strategy': 'breakout', 'time_stop': 248, 'use_sma': False, 'use_atr': True, 'use_adx': False, 'use_ema': True, 'use_spike': True, 'rsi_required': False, 'edge_k': 1.4920764236748687, 'edge_cap': 0.6768823680817022, 'bull_strategy': 'breakout', 'bull_bb_std_mult': 0.9328802641496894, 'bull_rsi_os': 43, 'bull_rsi_ob': 89, 'bull_adx_thresh': 23.206850153477347, 'bull_atr_min_pct': 0.002999804436747807, 'bull_atr_max_pct': 0.02224952539410998, 'bull_tp_mult': 2.817814799683009, 'bull_tsl_mult': 0.3392154752494466, 'bull_time_stop': 93, 'bull_use_sma': True, 'bull_use_ema': True, 'bull_use_atr': True, 'bull_use_adx': False, 'bull_use_spike': False, 'bull_rsi_required': True, 'bear_strategy': 'breakout', 'bear_bb_std_mult': 1.0868021153687495, 'bear_rsi_os': 48, 'bear_rsi_ob': 71, 'bear_adx_thresh': 13.216472592739313, 'bear_atr_min_pct': 0.012148336624137526, 'bear_atr_max_pct': 0.07864644513849721, 'bear_tp_mult': 2.614408047237387, 'bear_tsl_mult': 0.08536032348250189, 'bear_time_stop': 149, 'bear_use_sma': False, 'bear_use_ema': False, 'bear_use_atr': False, 'bear_use_adx': False, 'bear_use_spike': True, 'bear_rsi_required': True, 'sideways_strategy': 'breakout', 'sideways_bb_std_mult': 2.57702497158376, 'sideways_rsi_os': 14, 'sideways_rsi_ob': 84, 'sideways_adx_thresh': 6.061283206626841, 'sideways_atr_min_pct': 0.01567642571503672, 'sideways_atr_max_pct': 0.02610077081407486, 'sideways_tp_mult': 2.214149797662389, 'sideways_tsl_mult': 0.041135144385993624, 'sideways_time_stop': 23, 'sideways_use_sma': False, 'sideways_use_ema': True, 'sideways_use_atr': False, 'sideways_use_adx': True, 'sideways_use_spike': True, 'sideways_rsi_required': True}.
