[I 2025-08-31 11:14:36,818] Trial 621 finished with values: [-1000000000.0, 1000000000.0] and parameters: {'p_sma': 5, 'p_std': 26, 'p_atr': 12, 'p_adx': 9, 'rsi_period': 40, 'ema1': 15, 'ema2': 15, 'slip_atr_k': 0.02286845989699742, 'slip_spread_k': 0.6541853259425247, 'spread_hl_frac': 0.04826118484774988, 'bb_std_mult': 2.7695904407574563, 'rsi_os': 5, 'rsi_ob': 77, 'vol_spike': 0.2528083177833453, 'adx_thresh': 28.690986300032026, 'atr_min_pct': 0.004851388529658098, 'atr_max_pct': 0.10076952410737683, 'tp_mult': 1.1575512227230154, 'tsl_mult': 0.24062494030283485, 'strategy': 'breakout', 'time_stop': 72, 'use_sma': True, 'use_atr': False, 'use_adx': True, 'use_ema': True, 'use_spike': True, 'rsi_required': True, 'edge_k': 0.10437377685345416, 'edge_cap': 0.6945765511628473, 'bull_strategy': 'breakout', 'bull_bb_std_mult': 0.6070008207492319, 'bull_rsi_os': 9, 'bull_rsi_ob': 63, 'bull_adx_thresh': 32.94400209511974, 'bull_atr_min_pct': 0.0042182217862052765, 'bull_atr_max_pct': 0.03917738977659024, 'bull_tp_mult': 1.303489192786932, 'bull_tsl_mult': 0.4344412471037034, 'bull_time_stop': 120, 'bull_use_sma': True, 'bull_use_ema': True, 'bull_use_atr': False, 'bull_use_adx': False, 'bull_use_spike': False, 'bull_rsi_required': True, 'bear_strategy': 'breakout', 'bear_bb_std_mult': 2.7715024200389244, 'bear_rsi_os': 43, 'bear_rsi_ob': 50, 'bear_adx_thresh': 6.216699627480828, 'bear_atr_min_pct': 0.005785305665948257, 'bear_atr_max_pct': 0.09140481361904683, 'bear_tp_mult': 2.803281345191607, 'bear_tsl_mult': 0.4612277447326695, 'bear_time_stop': 78, 'bear_use_sma': False, 'bear_use_ema': True, 'bear_use_atr': False, 'bear_use_adx': False, 'bear_use_spike': True, 'bear_rsi_required': False, 'sideways_strategy': 'mean_reversion', 'sideways_bb_std_mult': 2.6915334667290565, 'sideways_rsi_os': 53, 'sideways_rsi_ob': 87, 'sideways_adx_thresh': 24.317515247800713, 'sideways_atr_min_pct': 0.019159034066765522, 'sideways_atr_max_pct': 0.047781368483401754, 'sideways_tp_mult': 2.0330443005059777, 'sideways_tsl_mult': 0.09056098282794987, 'sideways_time_stop': 252, 'sideways_use_sma': False, 'sideways_use_ema': False, 'sideways_use_atr': True, 'sideways_use_adx': False, 'sideways_use_spike': False, 'sideways_rsi_required': True}.
[I 2025-08-31 11:14:36,936] Trial 622 finished with values: [-1000000000.0, 1000000000.0] and parameters: {'p_sma': 16, 'p_std': 26, 'p_atr': 12, 'p_adx': 9, 'rsi_period': 79, 'ema1': 24, 'ema2': 54, 'slip_atr_k': 0.06174548130482503, 'slip_spread_k': 0.6504959195179314, 'spread_hl_frac': 0.009132340419996957, 'bb_std_mult': 2.759349334668536, 'rsi_os': 25, 'rsi_ob': 77, 'vol_spike': 0.17840765757306454, 'adx_thresh': 24.679352553878566, 'atr_min_pct': 0.005932062874437614, 'atr_max_pct': 0.09964676347078376, 'tp_mult': 2.557303073426993, 'tsl_mult': 0.24509718627518026, 'strategy': 'breakout', 'time_stop': 72, 'use_sma': True, 'use_atr': False, 'use_adx': True, 'use_ema': True, 'use_spike': True, 'rsi_required': True, 'edge_k': 0.35857576670602787, 'edge_cap': 0.702004989702175, 'bull_strategy': 'breakout', 'bull_bb_std_mult': 0.5931273601447006, 'bull_rsi_os': 25, 'bull_rsi_ob': 50, 'bull_adx_thresh': 27.968385158279233, 'bull_atr_min_pct': 0.005791682700654591, 'bull_atr_max_pct': 0.050672235644759325, 'bull_tp_mult': 1.3199313162340354, 'bull_tsl_mult': 0.40358564387264595, 'bull_time_stop': 159, 'bull_use_sma': True, 'bull_use_ema': True, 'bull_use_atr': False, 'bull_use_adx': True, 'bull_use_spike': True, 'bull_rsi_required': True, 'bear_strategy': 'mean_reversion', 'bear_bb_std_mult': 2.033672478402957, 'bear_rsi_os': 43, 'bear_rsi_ob': 53, 'bear_adx_thresh': 7.066951073452607, 'bear_atr_min_pct': 0.005662859563778188, 'bear_atr_max_pct': 0.0229247504736702, 'bear_tp_mult': 1.2321390253640478, 'bear_tsl_mult': 0.5062282629245908, 'bear_time_stop': 275, 'bear_use_sma': False, 'bear_use_ema': True, 'bear_use_atr': False, 'bear_use_adx': False, 'bear_use_spike': True, 'bear_rsi_required': False, 'sideways_strategy': 'breakout', 'sideways_bb_std_mult': 1.221010267545009, 'sideways_rsi_os': 24, 'sideways_rsi_ob': 94, 'sideways_adx_thresh': 18.905955166906605, 'sideways_atr_min_pct': 0.02401334399710274, 'sideways_atr_max_pct': 0.04793065923035396, 'sideways_tp_mult': 2.1312334805880466, 'sideways_tsl_mult': 0.4863152177284734, 'sideways_time_stop': 16, 'sideways_use_sma': False, 'sideways_use_ema': False, 'sideways_use_atr': True, 'sideways_use_adx': False, 'sideways_use_spike': False, 'sideways_rsi_required': True}.
[I 2025-08-31 11:15:08,572] Trial 624 finished with values: [-1000000000.0, 1000000000.0] and parameters: {'p_sma': 15, 'p_std': 26, 'p_atr': 25, 'p_adx': 15, 'rsi_period': 49, 'ema1': 15, 'ema2': 54, 'slip_atr_k': 0.14649242647614324, 'slip_spread_k': 0.6569008290962739, 'spread_hl_frac': 0.006935023066206072, 'bb_std_mult': 3.36616972736965, 'rsi_os': 24, 'rsi_ob': 75, 'vol_spike': 0.25492208904069286, 'adx_thresh': 27.837508946926192, 'atr_min_pct': 0.006181526851554769, 'atr_max_pct': 0.14882533776028467, 'tp_mult': 2.387051360564477, 'tsl_mult': 0.2887879600334206, 'strategy': 'breakout', 'time_stop': 71, 'use_sma': True, 'use_atr': False, 'use_adx': True, 'use_ema': True, 'use_spike': True, 'rsi_required': True, 'edge_k': 0.31807956157011835, 'edge_cap': 0.4883424952074742, 'bull_strategy': 'breakout', 'bull_bb_std_mult': 1.7552051453115871, 'bull_rsi_os': 30, 'bull_rsi_ob': 89, 'bull_adx_thresh': 12.62018148418209, 'bull_atr_min_pct': 0.0028976474473078944, 'bull_atr_max_pct': 0.038124426097431136, 'bull_tp_mult': 2.2250922058150904, 'bull_tsl_mult': 0.4338809161958505, 'bull_time_stop': 90, 'bull_use_sma': True, 'bull_use_ema': True, 'bull_use_atr': False, 'bull_use_adx': True, 'bull_use_spike': True, 'bull_rsi_required': True, 'bear_strategy': 'mean_reversion', 'bear_bb_std_mult': 1.994164252071295, 'bear_rsi_os': 43, 'bear_rsi_ob': 89, 'bear_adx_thresh': 6.105477616724191, 'bear_atr_min_pct': 0.020435605569624347, 'bear_atr_max_pct': 0.06284533188883627, 'bear_tp_mult': 2.8107850944807553, 'bear_tsl_mult': 0.5047679168141467, 'bear_time_stop': 288, 'bear_use_sma': False, 'bear_use_ema': True, 'bear_use_atr': False, 'bear_use_adx': False, 'bear_use_spike': True, 'bear_rsi_required': False, 'sideways_strategy': 'breakout', 'sideways_bb_std_mult': 1.212680547631345, 'sideways_rsi_os': 8, 'sideways_rsi_ob': 90, 'sideways_adx_thresh': 25.308889664131836, 'sideways_atr_min_pct': 0.010802392406850027, 'sideways_atr_max_pct': 0.03391634918420794, 'sideways_tp_mult': 1.4742847373210133, 'sideways_tsl_mult': 0.48314176576035006, 'sideways_time_stop': 25, 'sideways_use_sma': False, 'sideways_use_ema': False, 'sideways_use_atr': True, 'sideways_use_adx': False, 'sideways_use_spike': False, 'sideways_rsi_required': True}.
[I 2025-08-31 11:15:08,635] Trial 626 finished with values: [-1000000000.0, 1000000000.0] and parameters: {'p_sma': 44, 'p_std': 28, 'p_atr': 19, 'p_adx': 25, 'rsi_period': 53, 'ema1': 14, 'ema2': 47, 'slip_atr_k': 0.14567654172169953, 'slip_spread_k': 0.9574133937559977, 'spread_hl_frac': 0.0067908603506950955, 'bb_std_mult': 2.86894964309238, 'rsi_os': 24, 'rsi_ob': 74, 'vol_spike': 0.2768782736561125, 'adx_thresh': 5.787898133327733, 'atr_min_pct': 0.006729313023325589, 'atr_max_pct': 0.1431020965067012, 'tp_mult': 2.3945157811337614, 'tsl_mult': 0.40972795089719527, 'strategy': 'breakout', 'time_stop': 182, 'use_sma': False, 'use_atr': False, 'use_adx': True, 'use_ema': True, 'use_spike': True, 'rsi_required': True, 'edge_k': 1.8417278143914118, 'edge_cap': 0.4569845193478387, 'bull_strategy': 'breakout', 'bull_bb_std_mult': 1.7508699716072096, 'bull_rsi_os': 14, 'bull_rsi_ob': 70, 'bull_adx_thresh': 18.207637181898875, 'bull_atr_min_pct': 0.0028678430721303227, 'bull_atr_max_pct': 0.1320279834398494, 'bull_tp_mult': 1.9310600260164748, 'bull_tsl_mult': 0.49472396773886285, 'bull_time_stop': 69, 'bull_use_sma': False, 'bull_use_ema': False, 'bull_use_atr': False, 'bull_use_adx': True, 'bull_use_spike': True, 'bull_rsi_required': True, 'bear_strategy': 'mean_reversion', 'bear_bb_std_mult': 2.530237318830242, 'bear_rsi_os': 41, 'bear_rsi_ob': 75, 'bear_adx_thresh': 26.624643500577633, 'bear_atr_min_pct': 0.027582181020252578, 'bear_atr_max_pct': 0.12200145307669567, 'bear_tp_mult': 1.4494962362338097, 'bear_tsl_mult': 0.17664955920781744, 'bear_time_stop': 28, 'bear_use_sma': False, 'bear_use_ema': True, 'bear_use_atr': False, 'bear_use_adx': False, 'bear_use_spike': True, 'bear_rsi_required': False, 'sideways_strategy': 'breakout', 'sideways_bb_std_mult': 2.591774902741, 'sideways_rsi_os': 50, 'sideways_rsi_ob': 90, 'sideways_adx_thresh': 25.500972074238685, 'sideways_atr_min_pct': 0.017357675199826252, 'sideways_atr_max_pct': 0.07617842388897181, 'sideways_tp_mult': 1.967954364906709, 'sideways_tsl_mult': 0.07748220645750845, 'sideways_time_stop': 29, 'sideways_use_sma': False, 'sideways_use_ema': False, 'sideways_use_atr': False, 'sideways_use_adx': False, 'sideways_use_spike': False, 'sideways_rsi_required': True}.
[I 2025-08-31 11:15:08,828] Trial 623 finished with values: [-1000000000.0, 1000000000.0] and parameters: {'p_sma': 16, 'p_std': 26, 'p_atr': 26, 'p_adx': 15, 'rsi_period': 79, 'ema1': 15, 'ema2': 29, 'slip_atr_k': 0.023659058337321123, 'slip_spread_k': 0.7708389244861937, 'spread_hl_frac': 0.006854476367607285, 'bb_std_mult': 2.7823993092052133, 'rsi_os': 24, 'rsi_ob': 75, 'vol_spike': 0.08167539396068352, 'adx_thresh': 16.515929764629288, 'atr_min_pct': 0.010342836062714876, 'atr_max_pct': 0.10115050493799614, 'tp_mult': 2.7732904396889375, 'tsl_mult': 0.3359080463284329, 'strategy': 'breakout', 'time_stop': 36, 'use_sma': True, 'use_atr': False, 'use_adx': True, 'use_ema': True, 'use_spike': True, 'rsi_required': True, 'edge_k': 0.3318930887092213, 'edge_cap': 0.4854575621894533, 'bull_strategy': 'breakout', 'bull_bb_std_mult': 0.7780922948234941, 'bull_rsi_os': 45, 'bull_rsi_ob': 73, 'bull_adx_thresh': 18.195934316426236, 'bull_atr_min_pct': 0.0028471951557122272, 'bull_atr_max_pct': 0.08649145511619664, 'bull_tp_mult': 1.3098131270956106, 'bull_tsl_mult': 0.4347707662873953, 'bull_time_stop': 75, 'bull_use_sma': True, 'bull_use_ema': True, 'bull_use_atr': False, 'bull_use_adx': True, 'bull_use_spike': True, 'bull_rsi_required': True, 'bear_strategy': 'mean_reversion', 'bear_bb_std_mult': 2.021413616841633, 'bear_rsi_os': 49, 'bear_rsi_ob': 89, 'bear_adx_thresh': 27.358107683319492, 'bear_atr_min_pct': 0.027934056699757077, 'bear_atr_max_pct': 0.05820705618653821, 'bear_tp_mult': 1.2148382868317316, 'bear_tsl_mult': 0.5022419405958676, 'bear_time_stop': 105, 'bear_use_sma': False, 'bear_use_ema': True, 'bear_use_atr': False, 'bear_use_adx': False, 'bear_use_spike': True, 'bear_rsi_required': False, 'sideways_strategy': 'breakout', 'sideways_bb_std_mult': 0.9047657603715742, 'sideways_rsi_os': 5, 'sideways_rsi_ob': 87, 'sideways_adx_thresh': 25.047178649617184, 'sideways_atr_min_pct': 0.02214448265098897, 'sideways_atr_max_pct': 0.13676394828748817, 'sideways_tp_mult': 1.9726500218808705, 'sideways_tsl_mult': 0.070032610393179, 'sideways_time_stop': 155, 'sideways_use_sma': False, 'sideways_use_ema': False, 'sideways_use_atr': True, 'sideways_use_adx': False, 'sideways_use_spike': False, 'sideways_rsi_required': True}.
[I 2025-08-31 11:15:09,033] Trial 625 finished with values: [-1000000000.0, 1000000000.0] and parameters: {'p_sma': 47, 'p_std': 39, 'p_atr': 10, 'p_adx': 23, 'rsi_period': 30, 'ema1': 14, 'ema2': 55, 'slip_atr_k': 0.018527833780270016, 'slip_spread_k': 0.6484040982401849, 'spread_hl_frac': 0.03347226623277109, 'bb_std_mult': 2.839237496977936, 'rsi_os': 25, 'rsi_ob': 74, 'vol_spike': 0.08176902406635167, 'adx_thresh': 12.579832300067434, 'atr_min_pct': 0.029884291606893584, 'atr_max_pct': 0.14139420777018935, 'tp_mult': 2.559737928815094, 'tsl_mult': 0.29317245988423746, 'strategy': 'breakout', 'time_stop': 62, 'use_sma': False, 'use_atr': False, 'use_adx': True, 'use_ema': True, 'use_spike': True, 'rsi_required': True, 'edge_k': 0.33850532300740865, 'edge_cap': 0.48833944528740714, 'bull_strategy': 'breakout', 'bull_bb_std_mult': 0.7740970780851338, 'bull_rsi_os': 55, 'bull_rsi_ob': 70, 'bull_adx_thresh': 22.246946122811202, 'bull_atr_min_pct': 0.005969333559130444, 'bull_atr_max_pct': 0.08639141712278087, 'bull_tp_mult': 2.334370378857742, 'bull_tsl_mult': 0.37534901225927836, 'bull_time_stop': 238, 'bull_use_sma': False, 'bull_use_ema': True, 'bull_use_atr': False, 'bull_use_adx': True, 'bull_use_spike': True, 'bull_rsi_required': True, 'bear_strategy': 'mean_reversion', 'bear_bb_std_mult': 0.5607477689458049, 'bear_rsi_os': 37, 'bear_rsi_ob': 89, 'bear_adx_thresh': 7.139061014561554, 'bear_atr_min_pct': 0.004960642505649403, 'bear_atr_max_pct': 0.12327987831275207, 'bear_tp_mult': 1.447295040842738, 'bear_tsl_mult': 0.5021881865329286, 'bear_time_stop': 106, 'bear_use_sma': False, 'bear_use_ema': True, 'bear_use_atr': False, 'bear_use_adx': False, 'bear_use_spike': True, 'bear_rsi_required': False, 'sideways_strategy': 'breakout', 'sideways_bb_std_mult': 2.555931205452816, 'sideways_rsi_os': 5, 'sideways_rsi_ob': 90, 'sideways_adx_thresh': 19.01281977772487, 'sideways_atr_min_pct': 0.023940783510072255, 'sideways_atr_max_pct': 0.10711352414835265, 'sideways_tp_mult': 1.5048340825449702, 'sideways_tsl_mult': 0.07256347473447078, 'sideways_time_stop': 78, 'sideways_use_sma': False, 'sideways_use_ema': False, 'sideways_use_atr': True, 'sideways_use_adx': False, 'sideways_use_spike': False, 'sideways_rsi_required': True}.
[I 2025-08-31 11:15:41,010] Trial 627 finished with values: [-1000000000.0, 1000000000.0] and parameters: {'p_sma': 17, 'p_std': 28, 'p_atr': 10, 'p_adx': 27, 'rsi_period': 30, 'ema1': 14, 'ema2': 31, 'slip_atr_k': 0.007783793706887365, 'slip_spread_k': 0.2553152442549218, 'spread_hl_frac': 0.013251757400743202, 'bb_std_mult': 2.847085841968013, 'rsi_os': 47, 'rsi_ob': 79, 'vol_spike': 0.013343016459584522, 'adx_thresh': 30.041677523091398, 'atr_min_pct': 0.025205582835644648, 'atr_max_pct': 0.05242405196065783, 'tp_mult': 2.346816065710808, 'tsl_mult': 0.33621971970347575, 'strategy': 'breakout', 'time_stop': 36, 'use_sma': False, 'use_atr': False, 'use_adx': True, 'use_ema': False, 'use_spike': True, 'rsi_required': True, 'edge_k': 0.22059278576571148, 'edge_cap': 0.25935012813540936, 'bull_strategy': 'breakout', 'bull_bb_std_mult': 0.7768283856508376, 'bull_rsi_os': 17, 'bull_rsi_ob': 71, 'bull_adx_thresh': 20.923970044910703, 'bull_atr_min_pct': 0.0026677170205850836, 'bull_atr_max_pct': 0.08588873197352961, 'bull_tp_mult': 2.335849666836197, 'bull_tsl_mult': 0.5408734021004626, 'bull_time_stop': 68, 'bull_use_sma': False, 'bull_use_ema': False, 'bull_use_atr': False, 'bull_use_adx': False, 'bull_use_spike': False, 'bull_rsi_required': True, 'bear_strategy': 'breakout', 'bear_bb_std_mult': 0.9611084020861638, 'bear_rsi_os': 49, 'bear_rsi_ob': 75, 'bear_adx_thresh': 17.8054694082439, 'bear_atr_min_pct': 0.027747222929653488, 'bear_atr_max_pct': 0.10237447070599759, 'bear_tp_mult': 2.7568872836276825, 'bear_tsl_mult': 0.5490380088497139, 'bear_time_stop': 222, 'bear_use_sma': False, 'bear_use_ema': False, 'bear_use_atr': False, 'bear_use_adx': True, 'bear_use_spike': True, 'bear_rsi_required': True, 'sideways_strategy': 'mean_reversion', 'sideways_bb_std_mult': 2.6142675712296604, 'sideways_rsi_os': 5, 'sideways_rsi_ob': 77, 'sideways_adx_thresh': 21.014992286737222, 'sideways_atr_min_pct': 0.0186370092789475, 'sideways_atr_max_pct': 0.1360919830166155, 'sideways_tp_mult': 1.9673519448073493, 'sideways_tsl_mult': 0.07009411294257917, 'sideways_time_stop': 5, 'sideways_use_sma': False, 'sideways_use_ema': False, 'sideways_use_atr': False, 'sideways_use_adx': False, 'sideways_use_spike': False, 'sideways_rsi_required': True}.
[I 2025-08-31 11:15:41,023] Trial 628 finished with values: [-1000000000.0, 1000000000.0] and parameters: {'p_sma': 17, 'p_std': 29, 'p_atr': 10, 'p_adx': 20, 'rsi_period': 23, 'ema1': 20, 'ema2': 58, 'slip_atr_k': 0.01771610372669214, 'slip_spread_k': 0.6864821965126029, 'spread_hl_frac': 0.03449236554643132, 'bb_std_mult': 0.867149205354623, 'rsi_os': 27, 'rsi_ob': 79, 'vol_spike': 0.014620187408572793, 'adx_thresh': 29.8988588616199, 'atr_min_pct': 0.029899736809117818, 'atr_max_pct': 0.0948148933146863, 'tp_mult': 2.353524723758114, 'tsl_mult': 0.33273964921806287, 'strategy': 'breakout', 'time_stop': 36, 'use_sma': True, 'use_atr': False, 'use_adx': True, 'use_ema': False, 'use_spike': False, 'rsi_required': False, 'edge_k': 0.2275652685639267, 'edge_cap': 0.40772490318818666, 'bull_strategy': 'breakout', 'bull_bb_std_mult': 0.9623672349787102, 'bull_rsi_os': 15, 'bull_rsi_ob': 76, 'bull_adx_thresh': 31.258596943636984, 'bull_atr_min_pct': 0.0034464812425331953, 'bull_atr_max_pct': 0.08693971530741243, 'bull_tp_mult': 1.5716809975683919, 'bull_tsl_mult': 0.37572437330674363, 'bull_time_stop': 66, 'bull_use_sma': True, 'bull_use_ema': False, 'bull_use_atr': True, 'bull_use_adx': False, 'bull_use_spike': False, 'bull_rsi_required': True, 'bear_strategy': 'breakout', 'bear_bb_std_mult': 2.2662232183660023, 'bear_rsi_os': 40, 'bear_rsi_ob': 73, 'bear_adx_thresh': 23.664126501719526, 'bear_atr_min_pct': 0.005023704726935462, 'bear_atr_max_pct': 0.11286770803628267, 'bear_tp_mult': 2.753601264541471, 'bear_tsl_mult': 0.5439246443211392, 'bear_time_stop': 220, 'bear_use_sma': False, 'bear_use_ema': False, 'bear_use_atr': False, 'bear_use_adx': True, 'bear_use_spike': True, 'bear_rsi_required': True, 'sideways_strategy': 'mean_reversion', 'sideways_bb_std_mult': 2.662752171458678, 'sideways_rsi_os': 5, 'sideways_rsi_ob': 45, 'sideways_adx_thresh': 20.26326054918802, 'sideways_atr_min_pct': 0.020524059775472024, 'sideways_atr_max_pct': 0.09930329183112288, 'sideways_tp_mult': 2.419446694570766, 'sideways_tsl_mult': 0.06333624989720266, 'sideways_time_stop': 137, 'sideways_use_sma': False, 'sideways_use_ema': False, 'sideways_use_atr': False, 'sideways_use_adx': True, 'sideways_use_spike': True, 'sideways_rsi_required': False}.
[I 2025-08-31 11:15:41,446] Trial 629 finished with values: [-1000000000.0, 1000000000.0] and parameters: {'p_sma': 19, 'p_std': 29, 'p_atr': 10, 'p_adx': 14, 'rsi_period': 23, 'ema1': 14, 'ema2': 39, 'slip_atr_k': 0.2207623990157052, 'slip_spread_k': 0.5210972585359365, 'spread_hl_frac': 0.04232532303706049, 'bb_std_mult': 1.2832814561936605, 'rsi_os': 27, 'rsi_ob': 76, 'vol_spike': 0.20705511550615574, 'adx_thresh': 29.747390482401364, 'atr_min_pct': 4.07351153564519e-05, 'atr_max_pct': 0.08029982056376654, 'tp_mult': 1.6529761594983794, 'tsl_mult': 0.04282812123274227, 'strategy': 'breakout', 'time_stop': 79, 'use_sma': False, 'use_atr': False, 'use_adx': True, 'use_ema': False, 'use_spike': False, 'rsi_required': False, 'edge_k': 1.3375206173930207, 'edge_cap': 0.4096986747140259, 'bull_strategy': 'mean_reversion', 'bull_bb_std_mult': 2.0192167742200997, 'bull_rsi_os': 35, 'bull_rsi_ob': 77, 'bull_adx_thresh': 6.961609824120319, 'bull_atr_min_pct': 0.0035028481943817297, 'bull_atr_max_pct': 0.11408730199691415, 'bull_tp_mult': 1.8486996095856398, 'bull_tsl_mult': 0.027600253843019007, 'bull_time_stop': 65, 'bull_use_sma': False, 'bull_use_ema': False, 'bull_use_atr': True, 'bull_use_adx': False, 'bull_use_spike': False, 'bull_rsi_required': True, 'bear_strategy': 'breakout', 'bear_bb_std_mult': 2.474335831412057, 'bear_rsi_os': 38, 'bear_rsi_ob': 87, 'bear_adx_thresh': 6.748218129628109, 'bear_atr_min_pct': 0.005114179020159021, 'bear_atr_max_pct': 0.14271723947388767, 'bear_tp_mult': 2.5229248269143243, 'bear_tsl_mult': 0.21912691428530917, 'bear_time_stop': 41, 'bear_use_sma': True, 'bear_use_ema': False, 'bear_use_atr': False, 'bear_use_adx': True, 'bear_use_spike': True, 'bear_rsi_required': True, 'sideways_strategy': 'mean_reversion', 'sideways_bb_std_mult': 2.6623790980614284, 'sideways_rsi_os': 6, 'sideways_rsi_ob': 77, 'sideways_adx_thresh': 26.2646326096513, 'sideways_atr_min_pct': 0.018648818996734436, 'sideways_atr_max_pct': 0.12113835499826507, 'sideways_tp_mult': 1.898631020586081, 'sideways_tsl_mult': 0.9175737215647686, 'sideways_time_stop': 138, 'sideways_use_sma': False, 'sideways_use_ema': False, 'sideways_use_atr': False, 'sideways_use_adx': True, 'sideways_use_spike': True, 'sideways_rsi_required': False}.
