[I 2025-08-31 10:27:31,652] Trial 254 finished with values: [-1000000000.0, 1000000000.0] and parameters: {'p_sma': 12, 'p_std': 27, 'p_atr': 29, 'p_adx': 22, 'rsi_period': 70, 'ema1': 24, 'ema2': 55, 'slip_atr_k': 0.04184500152444156, 'slip_spread_k': 0.5183477610549722, 'spread_hl_frac': 0.015080453423353221, 'bb_std_mult': 0.5023871891155625, 'rsi_os': 21, 'rsi_ob': 55, 'vol_spike': 0.2798952451870209, 'adx_thresh': 28.37365021729973, 'atr_min_pct': 0.01465521101304397, 'atr_max_pct': 0.09060758108122914, 'tp_mult': 2.359567126167768, 'tsl_mult': 0.11289033968489098, 'strategy': 'mean_reversion', 'time_stop': 135, 'use_sma': True, 'use_atr': False, 'use_adx': True, 'use_ema': True, 'use_spike': False, 'rsi_required': False, 'edge_k': 0.0922126276748465, 'edge_cap': 0.8291926186802819, 'bull_strategy': 'mean_reversion', 'bull_bb_std_mult': 3.0906609575565422, 'bull_rsi_os': 39, 'bull_rsi_ob': 75, 'bull_adx_thresh': 18.20237565044728, 'bull_atr_min_pct': 0.0005728700708969349, 'bull_atr_max_pct': 0.14960305677438707, 'bull_tp_mult': 1.6064547160508074, 'bull_tsl_mult': 0.7356113307844525, 'bull_time_stop': 61, 'bull_use_sma': False, 'bull_use_ema': True, 'bull_use_atr': True, 'bull_use_adx': False, 'bull_use_spike': False, 'bull_rsi_required': True, 'bear_strategy': 'breakout', 'bear_bb_std_mult': 1.3569755358525302, 'bear_rsi_os': 39, 'bear_rsi_ob': 68, 'bear_adx_thresh': 15.647355239538534, 'bear_atr_min_pct': 0.016178692968887316, 'bear_atr_max_pct': 0.02061390167243953, 'bear_tp_mult': 2.1681926879406905, 'bear_tsl_mult': 0.5150126056736677, 'bear_time_stop': 44, 'bear_use_sma': False, 'bear_use_ema': True, 'bear_use_atr': False, 'bear_use_adx': False, 'bear_use_spike': True, 'bear_rsi_required': False, 'sideways_strategy': 'breakout', 'sideways_bb_std_mult': 2.6814720735855007, 'sideways_rsi_os': 10, 'sideways_rsi_ob': 80, 'sideways_adx_thresh': 6.947825004957869, 'sideways_atr_min_pct': 0.00457688376328394, 'sideways_atr_max_pct': 0.042700323110621975, 'sideways_tp_mult': 1.4950844374733412, 'sideways_tsl_mult': 0.8995477267874941, 'sideways_time_stop': 177, 'sideways_use_sma': True, 'sideways_use_ema': False, 'sideways_use_atr': False, 'sideways_use_adx': True, 'sideways_use_spike': True, 'sideways_rsi_required': True}.
[I 2025-08-31 10:27:31,814] Trial 252 finished with values: [-1000000000.0, 1000000000.0] and parameters: {'p_sma': 11, 'p_std': 25, 'p_atr': 16, 'p_adx': 12, 'rsi_period': 36, 'ema1': 23, 'ema2': 55, 'slip_atr_k': 0.0368638673988461, 'slip_spread_k': 0.9790799029574508, 'spread_hl_frac': 0.01538222054986334, 'bb_std_mult': 2.4096793510473495, 'rsi_os': 13, 'rsi_ob': 54, 'vol_spike': 0.2558851732704491, 'adx_thresh': 28.20904060211126, 'atr_min_pct': 0.00418498100392561, 'atr_max_pct': 0.09019873659309166, 'tp_mult': 1.3949718594018758, 'tsl_mult': 0.2750288659906849, 'strategy': 'breakout', 'time_stop': 227, 'use_sma': True, 'use_atr': True, 'use_adx': False, 'use_ema': True, 'use_spike': False, 'rsi_required': False, 'edge_k': 0.13535234606025717, 'edge_cap': 0.2578306323431641, 'bull_strategy': 'mean_reversion', 'bull_bb_std_mult': 2.002065780358916, 'bull_rsi_os': 10, 'bull_rsi_ob': 82, 'bull_adx_thresh': 23.155094820494426, 'bull_atr_min_pct': 0.00937925483070694, 'bull_atr_max_pct': 0.14757306989740404, 'bull_tp_mult': 1.881374215906108, 'bull_tsl_mult': 0.43067142933480723, 'bull_time_stop': 268, 'bull_use_sma': True, 'bull_use_ema': True, 'bull_use_atr': True, 'bull_use_adx': True, 'bull_use_spike': False, 'bull_rsi_required': False, 'bear_strategy': 'mean_reversion', 'bear_bb_std_mult': 1.3721787060647819, 'bear_rsi_os': 39, 'bear_rsi_ob': 69, 'bear_adx_thresh': 6.994004921345125, 'bear_atr_min_pct': 0.002756102700586403, 'bear_atr_max_pct': 0.11210134905673114, 'bear_tp_mult': 1.6293802727345479, 'bear_tsl_mult': 0.2068695877878326, 'bear_time_stop': 52, 'bear_use_sma': True, 'bear_use_ema': True, 'bear_use_atr': True, 'bear_use_adx': False, 'bear_use_spike': False, 'bear_rsi_required': False, 'sideways_strategy': 'breakout', 'sideways_bb_std_mult': 2.6463662996415804, 'sideways_rsi_os': 20, 'sideways_rsi_ob': 64, 'sideways_adx_thresh': 22.87267479143057, 'sideways_atr_min_pct': 0.0018555728401554363, 'sideways_atr_max_pct': 0.042741331370260635, 'sideways_tp_mult': 1.4778038743308821, 'sideways_tsl_mult': 0.06203686128030411, 'sideways_time_stop': 167, 'sideways_use_sma': False, 'sideways_use_ema': False, 'sideways_use_atr': True, 'sideways_use_adx': True, 'sideways_use_spike': False, 'sideways_rsi_required': True}.
[I 2025-08-31 10:27:32,188] Trial 253 finished with values: [-1000000000.0, 1000000000.0] and parameters: {'p_sma': 14, 'p_std': 25, 'p_atr': 17, 'p_adx': 15, 'rsi_period': 36, 'ema1': 23, 'ema2': 55, 'slip_atr_k': 0.039819986777988994, 'slip_spread_k': 0.6581066036552753, 'spread_hl_frac': 0.015298598607074635, 'bb_std_mult': 2.4488019512488157, 'rsi_os': 27, 'rsi_ob': 85, 'vol_spike': 0.2563740059401392, 'adx_thresh': 28.1357717941641, 'atr_min_pct': 0.0037033222271574523, 'atr_max_pct': 0.07097319289178211, 'tp_mult': 2.5234044153110653, 'tsl_mult': 0.11931352141741197, 'strategy': 'breakout', 'time_stop': 13, 'use_sma': True, 'use_atr': False, 'use_adx': True, 'use_ema': True, 'use_spike': True, 'rsi_required': False, 'edge_k': 0.12308403094941908, 'edge_cap': 0.8272289082097776, 'bull_strategy': 'breakout', 'bull_bb_std_mult': 1.3000343964156378, 'bull_rsi_os': 39, 'bull_rsi_ob': 75, 'bull_adx_thresh': 5.924763165198897, 'bull_atr_min_pct': 0.0005656687667123024, 'bull_atr_max_pct': 0.14749446204095515, 'bull_tp_mult': 1.8327336109213401, 'bull_tsl_mult': 0.7295039727156659, 'bull_time_stop': 64, 'bull_use_sma': True, 'bull_use_ema': True, 'bull_use_atr': True, 'bull_use_adx': True, 'bull_use_spike': False, 'bull_rsi_required': False, 'bear_strategy': 'mean_reversion', 'bear_bb_std_mult': 1.316286613731947, 'bear_rsi_os': 8, 'bear_rsi_ob': 67, 'bear_adx_thresh': 16.925031145447146, 'bear_atr_min_pct': 0.005194033939240789, 'bear_atr_max_pct': 0.036764908742466525, 'bear_tp_mult': 2.8770602681404753, 'bear_tsl_mult': 0.4880884333351547, 'bear_time_stop': 52, 'bear_use_sma': False, 'bear_use_ema': True, 'bear_use_atr': True, 'bear_use_adx': False, 'bear_use_spike': True, 'bear_rsi_required': False, 'sideways_strategy': 'breakout', 'sideways_bb_std_mult': 1.3891040339207363, 'sideways_rsi_os': 17, 'sideways_rsi_ob': 80, 'sideways_adx_thresh': 22.774183098438264, 'sideways_atr_min_pct': 0.004723544295625657, 'sideways_atr_max_pct': 0.040761957655312264, 'sideways_tp_mult': 2.1094216085476805, 'sideways_tsl_mult': 0.0667619057488114, 'sideways_time_stop': 184, 'sideways_use_sma': False, 'sideways_use_ema': False, 'sideways_use_atr': False, 'sideways_use_adx': True, 'sideways_use_spike': True, 'sideways_rsi_required': True}.
[I 2025-08-31 10:27:32,390] Trial 255 finished with values: [-0.018009270669957722, 0.01782294988643784] and parameters: {'p_sma': 45, 'p_std': 23, 'p_atr': 30, 'p_adx': 22, 'rsi_period': 82, 'ema1': 23, 'ema2': 55, 'slip_atr_k': 0.04498962643486418, 'slip_spread_k': 0.6537689302777436, 'spread_hl_frac': 0.03584800081994085, 'bb_std_mult': 0.5069854476177171, 'rsi_os': 21, 'rsi_ob': 54, 'vol_spike': 0.06544490618497184, 'adx_thresh': 34.436403456702536, 'atr_min_pct': 0.014638691353950451, 'atr_max_pct': 0.09096367902344768, 'tp_mult': 2.5376711082931083, 'tsl_mult': 0.6412286580401676, 'strategy': 'mean_reversion', 'time_stop': 214, 'use_sma': True, 'use_atr': False, 'use_adx': True, 'use_ema': True, 'use_spike': True, 'rsi_required': False, 'edge_k': 0.12316529946595245, 'edge_cap': 0.9182027311007458, 'bull_strategy': 'breakout', 'bull_bb_std_mult': 0.6555623803721702, 'bull_rsi_os': 39, 'bull_rsi_ob': 69, 'bull_adx_thresh': 26.16486024454271, 'bull_atr_min_pct': 0.0004582041694082234, 'bull_atr_max_pct': 0.12428992164228553, 'bull_tp_mult': 2.4776336085221216, 'bull_tsl_mult': 0.39057399367046275, 'bull_time_stop': 63, 'bull_use_sma': False, 'bull_use_ema': True, 'bull_use_atr': True, 'bull_use_adx': False, 'bull_use_spike': False, 'bull_rsi_required': True, 'bear_strategy': 'breakout', 'bear_bb_std_mult': 1.3476667617306926, 'bear_rsi_os': 39, 'bear_rsi_ob': 61, 'bear_adx_thresh': 16.893881825771892, 'bear_atr_min_pct': 0.016129302412987052, 'bear_atr_max_pct': 0.12371207404426134, 'bear_tp_mult': 2.018754822207714, 'bear_tsl_mult': 0.2017314933768351, 'bear_time_stop': 44, 'bear_use_sma': False, 'bear_use_ema': True, 'bear_use_atr': False, 'bear_use_adx': False, 'bear_use_spike': True, 'bear_rsi_required': False, 'sideways_strategy': 'breakout', 'sideways_bb_std_mult': 2.6706152840119963, 'sideways_rsi_os': 26, 'sideways_rsi_ob': 86, 'sideways_adx_thresh': 25.723758565213704, 'sideways_atr_min_pct': 0.02898775466396889, 'sideways_atr_max_pct': 0.0341985594744407, 'sideways_tp_mult': 2.085465762211209, 'sideways_tsl_mult': 0.9012975185535177, 'sideways_time_stop': 132, 'sideways_use_sma': True, 'sideways_use_ema': False, 'sideways_use_atr': False, 'sideways_use_adx': True, 'sideways_use_spike': True, 'sideways_rsi_required': True}.
[I 2025-08-31 10:27:32,903] Trial 259 finished with values: [-1000000000.0, 1000000000.0] and parameters: {'p_sma': 9, 'p_std': 24, 'p_atr': 30, 'p_adx': 16, 'rsi_period': 18, 'ema1': 10, 'ema2': 51, 'slip_atr_k': 0.20793379994457917, 'slip_spread_k': 0.22403875255073763, 'spread_hl_frac': 0.013605186863201793, 'bb_std_mult': 1.5060160830347522, 'rsi_os': 20, 'rsi_ob': 49, 'vol_spike': 0.0329317185841891, 'adx_thresh': 34.2415337729325, 'atr_min_pct': 0.005616029515417155, 'atr_max_pct': 0.0945438445978314, 'tp_mult': 2.4540639677117597, 'tsl_mult': 0.607914607649437, 'strategy': 'mean_reversion', 'time_stop': 215, 'use_sma': True, 'use_atr': True, 'use_adx': False, 'use_ema': False, 'use_spike': True, 'rsi_required': True, 'edge_k': 0.056926233626332756, 'edge_cap': 0.9813446034548852, 'bull_strategy': 'breakout', 'bull_bb_std_mult': 0.6212436052946448, 'bull_rsi_os': 42, 'bull_rsi_ob': 72, 'bull_adx_thresh': 25.852122777259783, 'bull_atr_min_pct': 0.0029764443482159448, 'bull_atr_max_pct': 0.131209935841557, 'bull_tp_mult': 1.3619659620508968, 'bull_tsl_mult': 0.39649776916422125, 'bull_time_stop': 292, 'bull_use_sma': False, 'bull_use_ema': False, 'bull_use_atr': False, 'bull_use_adx': False, 'bull_use_spike': True, 'bull_rsi_required': True, 'bear_strategy': 'breakout', 'bear_bb_std_mult': 3.310069118160961, 'bear_rsi_os': 40, 'bear_rsi_ob': 52, 'bear_adx_thresh': 8.766123081202236, 'bear_atr_min_pct': 0.028432564803299115, 'bear_atr_max_pct': 0.033277579390692376, 'bear_tp_mult': 2.7794728357063994, 'bear_tsl_mult': 0.5379920934104698, 'bear_time_stop': 33, 'bear_use_sma': False, 'bear_use_ema': True, 'bear_use_atr': False, 'bear_use_adx': True, 'bear_use_spike': True, 'bear_rsi_required': False, 'sideways_strategy': 'mean_reversion', 'sideways_bb_std_mult': 2.9007471057194927, 'sideways_rsi_os': 18, 'sideways_rsi_ob': 84, 'sideways_adx_thresh': 25.72813911188689, 'sideways_atr_min_pct': 0.0036540282937526573, 'sideways_atr_max_pct': 0.03512342771375914, 'sideways_tp_mult': 2.013031266414003, 'sideways_tsl_mult': 0.02664278189139127, 'sideways_time_stop': 52, 'sideways_use_sma': True, 'sideways_use_ema': False, 'sideways_use_atr': False, 'sideways_use_adx': True, 'sideways_use_spike': True, 'sideways_rsi_required': False}.
[I 2025-08-31 10:28:03,368] Trial 258 finished with values: [-0.028272832833043715, 0.028130806793225917] and parameters: {'p_sma': 35, 'p_std': 23, 'p_atr': 30, 'p_adx': 19, 'rsi_period': 82, 'ema1': 10, 'ema2': 13, 'slip_atr_k': 0.06922011767238287, 'slip_spread_k': 0.7152174124008983, 'spread_hl_frac': 0.04413532582462412, 'bb_std_mult': 1.185838440167581, 'rsi_os': 41, 'rsi_ob': 71, 'vol_spike': 0.009481013624903029, 'adx_thresh': 34.551370986815975, 'atr_min_pct': 0.005277447637059379, 'atr_max_pct': 0.025267563417674582, 'tp_mult': 2.4473774859360673, 'tsl_mult': 0.6291333950029442, 'strategy': 'mean_reversion', 'time_stop': 214, 'use_sma': True, 'use_atr': True, 'use_adx': False, 'use_ema': False, 'use_spike': True, 'rsi_required': True, 'edge_k': 1.5131867859059205, 'edge_cap': 0.9130679450635283, 'bull_strategy': 'breakout', 'bull_bb_std_mult': 0.6192090924387647, 'bull_rsi_os': 15, 'bull_rsi_ob': 54, 'bull_adx_thresh': 26.081717862321458, 'bull_atr_min_pct': 0.021042199451247467, 'bull_atr_max_pct': 0.12448883887598478, 'bull_tp_mult': 1.6531155655798253, 'bull_tsl_mult': 0.37853859128589606, 'bull_time_stop': 207, 'bull_use_sma': False, 'bull_use_ema': False, 'bull_use_atr': False, 'bull_use_adx': False, 'bull_use_spike': True, 'bull_rsi_required': True, 'bear_strategy': 'breakout', 'bear_bb_std_mult': 1.725125279805969, 'bear_rsi_os': 40, 'bear_rsi_ob': 52, 'bear_adx_thresh': 17.88330593942901, 'bear_atr_min_pct': 0.003775524199960978, 'bear_atr_max_pct': 0.08716045101885345, 'bear_tp_mult': 2.814166236576639, 'bear_tsl_mult': 0.5303897562672537, 'bear_time_stop': 248, 'bear_use_sma': False, 'bear_use_ema': True, 'bear_use_atr': False, 'bear_use_adx': True, 'bear_use_spike': True, 'bear_rsi_required': False, 'sideways_strategy': 'mean_reversion', 'sideways_bb_std_mult': 2.9038034269163773, 'sideways_rsi_os': 18, 'sideways_rsi_ob': 58, 'sideways_adx_thresh': 25.77074376170932, 'sideways_atr_min_pct': 0.003365112639414598, 'sideways_atr_max_pct': 0.03225933593303161, 'sideways_tp_mult': 2.0153686481130184, 'sideways_tsl_mult': 0.09978884508743902, 'sideways_time_stop': 93, 'sideways_use_sma': True, 'sideways_use_ema': False, 'sideways_use_atr': False, 'sideways_use_adx': True, 'sideways_use_spike': True, 'sideways_rsi_required': False}.
[I 2025-08-31 10:28:03,601] Trial 256 finished with values: [-1000000000.0, 1000000000.0] and parameters: {'p_sma': 35, 'p_std': 23, 'p_atr': 30, 'p_adx': 13, 'rsi_period': 46, 'ema1': 10, 'ema2': 44, 'slip_atr_k': 0.008758739660384384, 'slip_spread_k': 0.65684736484685, 'spread_hl_frac': 0.013632188096248735, 'bb_std_mult': 0.6221365315408647, 'rsi_os': 29, 'rsi_ob': 81, 'vol_spike': 0.2572074237985595, 'adx_thresh': 30.671245498907897, 'atr_min_pct': 0.003797325554273841, 'atr_max_pct': 0.09647568209353316, 'tp_mult': 2.5564849832371523, 'tsl_mult': 0.2808978600318569, 'strategy': 'breakout', 'time_stop': 215, 'use_sma': True, 'use_atr': True, 'use_adx': False, 'use_ema': True, 'use_spike': True, 'rsi_required': True, 'edge_k': 0.8579625830366449, 'edge_cap': 0.9191867568256669, 'bull_strategy': 'breakout', 'bull_bb_std_mult': 1.729844055171029, 'bull_rsi_os': 15, 'bull_rsi_ob': 69, 'bull_adx_thresh': 26.12887813230263, 'bull_atr_min_pct': 0.00297592042819075, 'bull_atr_max_pct': 0.14727641289982832, 'bull_tp_mult': 1.6534010894282938, 'bull_tsl_mult': 0.9258241187772244, 'bull_time_stop': 263, 'bull_use_sma': True, 'bull_use_ema': False, 'bull_use_atr': False, 'bull_use_adx': False, 'bull_use_spike': True, 'bull_rsi_required': True, 'bear_strategy': 'breakout', 'bear_bb_std_mult': 1.050343709692005, 'bear_rsi_os': 8, 'bear_rsi_ob': 72, 'bear_adx_thresh': 16.85141857081419, 'bear_atr_min_pct': 0.005344338190639793, 'bear_atr_max_pct': 0.08719064758940391, 'bear_tp_mult': 2.8771367666902545, 'bear_tsl_mult': 0.20922752485019208, 'bear_time_stop': 60, 'bear_use_sma': False, 'bear_use_ema': True, 'bear_use_atr': False, 'bear_use_adx': False, 'bear_use_spike': True, 'bear_rsi_required': False, 'sideways_strategy': 'mean_reversion', 'sideways_bb_std_mult': 2.821537027781745, 'sideways_rsi_os': 45, 'sideways_rsi_ob': 81, 'sideways_adx_thresh': 24.669179212853212, 'sideways_atr_min_pct': 0.027487681098303164, 'sideways_atr_max_pct': 0.03405033453511082, 'sideways_tp_mult': 2.085478928023155, 'sideways_tsl_mult': 0.10437855946879646, 'sideways_time_stop': 35, 'sideways_use_sma': False, 'sideways_use_ema': False, 'sideways_use_atr': False, 'sideways_use_adx': True, 'sideways_use_spike': True, 'sideways_rsi_required': True}.
[I 2025-08-31 10:28:03,876] Trial 257 finished with values: [-0.03714314234708904, 0.03613991909901094] and parameters: {'p_sma': 35, 'p_std': 23, 'p_atr': 18, 'p_adx': 21, 'rsi_period': 18, 'ema1': 15, 'ema2': 41, 'slip_atr_k': 0.22916102670266653, 'slip_spread_k': 0.7194853153524747, 'spread_hl_frac': 0.03601121212033427, 'bb_std_mult': 1.467796214721956, 'rsi_os': 29, 'rsi_ob': 71, 'vol_spike': 0.04085962431473354, 'adx_thresh': 30.67203879787444, 'atr_min_pct': 0.003519497043436557, 'atr_max_pct': 0.09592928639943676, 'tp_mult': 2.54740260845772, 'tsl_mult': 0.174825593592273, 'strategy': 'breakout', 'time_stop': 215, 'use_sma': True, 'use_atr': False, 'use_adx': True, 'use_ema': False, 'use_spike': True, 'rsi_required': True, 'edge_k': 0.867444916202997, 'edge_cap': 0.4886562776405112, 'bull_strategy': 'breakout', 'bull_bb_std_mult': 0.665866918521553, 'bull_rsi_os': 39, 'bull_rsi_ob': 70, 'bull_adx_thresh': 26.172385208647103, 'bull_atr_min_pct': 0.0030911216763160523, 'bull_atr_max_pct': 0.14336202412981186, 'bull_tp_mult': 2.448217055394621, 'bull_tsl_mult': 0.3921185533533973, 'bull_time_stop': 65, 'bull_use_sma': True, 'bull_use_ema': False, 'bull_use_atr': False, 'bull_use_adx': False, 'bull_use_spike': True, 'bull_rsi_required': True, 'bear_strategy': 'breakout', 'bear_bb_std_mult': 1.7098014119998381, 'bear_rsi_os': 35, 'bear_rsi_ob': 71, 'bear_adx_thresh': 21.927555540644022, 'bear_atr_min_pct': 0.005234285838764358, 'bear_atr_max_pct': 0.08002589058960335, 'bear_tp_mult': 1.1007660970058364, 'bear_tsl_mult': 0.5379981145285884, 'bear_time_stop': 183, 'bear_use_sma': False, 'bear_use_ema': True, 'bear_use_atr': False, 'bear_use_adx': True, 'bear_use_spike': True, 'bear_rsi_required': False, 'sideways_strategy': 'mean_reversion', 'sideways_bb_std_mult': 2.7970040636431053, 'sideways_rsi_os': 45, 'sideways_rsi_ob': 84, 'sideways_adx_thresh': 24.472667663492714, 'sideways_atr_min_pct': 0.003606484213573164, 'sideways_atr_max_pct': 0.07948083412627417, 'sideways_tp_mult': 2.0910127653808273, 'sideways_tsl_mult': 0.3810927657095141, 'sideways_time_stop': 52, 'sideways_use_sma': False, 'sideways_use_ema': False, 'sideways_use_atr': False, 'sideways_use_adx': True, 'sideways_use_spike': True, 'sideways_rsi_required': False}.
[I 2025-08-31 10:28:04,589] Trial 260 finished with values: [-0.042006710862449115, 0.041813479272266904] and parameters: {'p_sma': 44, 'p_std': 23, 'p_atr': 30, 'p_adx': 17, 'rsi_period': 10, 'ema1': 14, 'ema2': 32, 'slip_atr_k': 0.023381000784186645, 'slip_spread_k': 0.18128454050591336, 'spread_hl_frac': 0.012349790834036124, 'bb_std_mult': 0.6304770658741737, 'rsi_os': 41, 'rsi_ob': 74, 'vol_spike': 0.06703144002616415, 'adx_thresh': 30.820417152549574, 'atr_min_pct': 0.009949454954961322, 'atr_max_pct': 0.09566876680235484, 'tp_mult': 2.434334135568425, 'tsl_mult': 0.18836314402836335, 'strategy': 'breakout', 'time_stop': 34, 'use_sma': True, 'use_atr': True, 'use_adx': False, 'use_ema': True, 'use_spike': True, 'rsi_required': True, 'edge_k': 0.6102678717081631, 'edge_cap': 0.41332725580785146, 'bull_strategy': 'breakout', 'bull_bb_std_mult': 0.6957423382932693, 'bull_rsi_os': 25, 'bull_rsi_ob': 71, 'bull_adx_thresh': 24.721810101236183, 'bull_atr_min_pct': 0.002290774879485657, 'bull_atr_max_pct': 0.14420256973178325, 'bull_tp_mult': 1.1868188236898718, 'bull_tsl_mult': 0.07600659309128954, 'bull_time_stop': 70, 'bull_use_sma': True, 'bull_use_ema': False, 'bull_use_atr': False, 'bull_use_adx': False, 'bull_use_spike': True, 'bull_rsi_required': True, 'bear_strategy': 'breakout', 'bear_bb_std_mult': 3.4253755892365643, 'bear_rsi_os': 35, 'bear_rsi_ob': 89, 'bear_adx_thresh': 15.13289071663663, 'bear_atr_min_pct': 0.003478437539052224, 'bear_atr_max_pct': 0.07990715330772684, 'bear_tp_mult': 1.095020296624321, 'bear_tsl_mult': 0.5135857853643331, 'bear_time_stop': 250, 'bear_use_sma': False, 'bear_use_ema': True, 'bear_use_atr': False, 'bear_use_adx': False, 'bear_use_spike': True, 'bear_rsi_required': False, 'sideways_strategy': 'mean_reversion', 'sideways_bb_std_mult': 2.80917839194608, 'sideways_rsi_os': 43, 'sideways_rsi_ob': 86, 'sideways_adx_thresh': 17.375822561193587, 'sideways_atr_min_pct': 0.0037759655708482663, 'sideways_atr_max_pct': 0.03498763723467837, 'sideways_tp_mult': 2.3949385836647883, 'sideways_tsl_mult': 0.38645333652645253, 'sideways_time_stop': 34, 'sideways_use_sma': False, 'sideways_use_ema': False, 'sideways_use_atr': False, 'sideways_use_adx': False, 'sideways_use_spike': True, 'sideways_rsi_required': True}.
