[I 2025-08-31 11:05:17,139] Trial 549 finished with values: [-1000000000.0, 1000000000.0] and parameters: {'p_sma': 14, 'p_std': 29, 'p_atr': 23, 'p_adx': 14, 'rsi_period': 13, 'ema1': 6, 'ema2': 30, 'slip_atr_k': 0.05909131069661336, 'slip_spread_k': 0.1328904908420459, 'spread_hl_frac': 0.0074804320295972695, 'bb_std_mult': 2.7330279732050817, 'rsi_os': 48, 'rsi_ob': 76, 'vol_spike': 0.20684728521038392, 'adx_thresh': 30.78480646199945, 'atr_min_pct': 0.0037757682529048955, 'atr_max_pct': 0.14682435040830305, 'tp_mult': 2.3183471400783984, 'tsl_mult': 0.250491755264874, 'strategy': 'breakout', 'time_stop': 73, 'use_sma': True, 'use_atr': False, 'use_adx': True, 'use_ema': True, 'use_spike': True, 'rsi_required': True, 'edge_k': 1.2837276513394311, 'edge_cap': 0.4364700283591002, 'bull_strategy': 'breakout', 'bull_bb_std_mult': 0.7187221228004764, 'bull_rsi_os': 17, 'bull_rsi_ob': 61, 'bull_adx_thresh': 34.10857752729956, 'bull_atr_min_pct': 0.026961821658546894, 'bull_atr_max_pct': 0.11600117432518589, 'bull_tp_mult': 1.6857577418088603, 'bull_tsl_mult': 0.3987707851258261, 'bull_time_stop': 64, 'bull_use_sma': False, 'bull_use_ema': False, 'bull_use_atr': False, 'bull_use_adx': False, 'bull_use_spike': False, 'bull_rsi_required': False, 'bear_strategy': 'breakout', 'bear_bb_std_mult': 2.149750575106922, 'bear_rsi_os': 40, 'bear_rsi_ob': 95, 'bear_adx_thresh': 6.671684268967389, 'bear_atr_min_pct': 0.029314503563336893, 'bear_atr_max_pct': 0.14112142155997798, 'bear_tp_mult': 2.7976303822094173, 'bear_tsl_mult': 0.47911810837807267, 'bear_time_stop': 13, 'bear_use_sma': False, 'bear_use_ema': True, 'bear_use_atr': False, 'bear_use_adx': False, 'bear_use_spike': False, 'bear_rsi_required': False, 'sideways_strategy': 'mean_reversion', 'sideways_bb_std_mult': 3.0000417518066578, 'sideways_rsi_os': 8, 'sideways_rsi_ob': 72, 'sideways_adx_thresh': 15.379614043444867, 'sideways_atr_min_pct': 0.02017575683370927, 'sideways_atr_max_pct': 0.05581293525336846, 'sideways_tp_mult': 1.5025875397555786, 'sideways_tsl_mult': 0.1043466596044271, 'sideways_time_stop': 19, 'sideways_use_sma': False, 'sideways_use_ema': True, 'sideways_use_atr': False, 'sideways_use_adx': False, 'sideways_use_spike': False, 'sideways_rsi_required': True}.
[I 2025-08-31 11:05:17,463] Trial 550 finished with values: [-0.010346092087448633, 0.010044107167180552] and parameters: {'p_sma': 15, 'p_std': 25, 'p_atr': 16, 'p_adx': 14, 'rsi_period': 35, 'ema1': 14, 'ema2': 35, 'slip_atr_k': 0.025937713512810545, 'slip_spread_k': 0.5964105204774599, 'spread_hl_frac': 0.0072374336379204835, 'bb_std_mult': 2.687517830291518, 'rsi_os': 28, 'rsi_ob': 53, 'vol_spike': 0.2662435524725137, 'adx_thresh': 10.582953453253133, 'atr_min_pct': 0.018323676611468283, 'atr_max_pct': 0.1211735610029496, 'tp_mult': 2.3256678485128, 'tsl_mult': 0.24954097130754105, 'strategy': 'mean_reversion', 'time_stop': 85, 'use_sma': True, 'use_atr': False, 'use_adx': True, 'use_ema': True, 'use_spike': True, 'rsi_required': True, 'edge_k': 0.13207110796122035, 'edge_cap': 0.43666127930550197, 'bull_strategy': 'breakout', 'bull_bb_std_mult': 0.7249358719251405, 'bull_rsi_os': 11, 'bull_rsi_ob': 75, 'bull_adx_thresh': 6.882064522072348, 'bull_atr_min_pct': 0.014218352297264794, 'bull_atr_max_pct': 0.026388290946549077, 'bull_tp_mult': 1.6907499810425866, 'bull_tsl_mult': 0.39941141820025006, 'bull_time_stop': 234, 'bull_use_sma': False, 'bull_use_ema': False, 'bull_use_atr': False, 'bull_use_adx': False, 'bull_use_spike': False, 'bull_rsi_required': False, 'bear_strategy': 'breakout', 'bear_bb_std_mult': 1.4895751581444834, 'bear_rsi_os': 54, 'bear_rsi_ob': 95, 'bear_adx_thresh': 6.544304550378211, 'bear_atr_min_pct': 0.004056388178535956, 'bear_atr_max_pct': 0.14748489015490074, 'bear_tp_mult': 2.636510819027188, 'bear_tsl_mult': 0.8249736676085969, 'bear_time_stop': 20, 'bear_use_sma': False, 'bear_use_ema': True, 'bear_use_atr': False, 'bear_use_adx': False, 'bear_use_spike': False, 'bear_rsi_required': False, 'sideways_strategy': 'mean_reversion', 'sideways_bb_std_mult': 0.723374483270117, 'sideways_rsi_os': 8, 'sideways_rsi_ob': 70, 'sideways_adx_thresh': 32.89774580358044, 'sideways_atr_min_pct': 0.01833739926039874, 'sideways_atr_max_pct': 0.10601702025158627, 'sideways_tp_mult': 1.9194875693981435, 'sideways_tsl_mult': 0.10660025224908196, 'sideways_time_stop': 18, 'sideways_use_sma': True, 'sideways_use_ema': True, 'sideways_use_atr': False, 'sideways_use_adx': False, 'sideways_use_spike': False, 'sideways_rsi_required': True}.
[I 2025-08-31 11:05:17,610] Trial 548 finished with values: [-1000000000.0, 1000000000.0] and parameters: {'p_sma': 15, 'p_std': 33, 'p_atr': 10, 'p_adx': 14, 'rsi_period': 13, 'ema1': 12, 'ema2': 40, 'slip_atr_k': 0.09795007717181839, 'slip_spread_k': 0.9300771519872135, 'spread_hl_frac': 0.03392247095112831, 'bb_std_mult': 2.9585125746404866, 'rsi_os': 24, 'rsi_ob': 49, 'vol_spike': 0.24958574243494697, 'adx_thresh': 10.420613217935632, 'atr_min_pct': 0.007389461846066011, 'atr_max_pct': 0.09651767215402687, 'tp_mult': 2.3211191510323674, 'tsl_mult': 0.25367608765918714, 'strategy': 'breakout', 'time_stop': 60, 'use_sma': True, 'use_atr': False, 'use_adx': True, 'use_ema': True, 'use_spike': True, 'rsi_required': True, 'edge_k': 1.2862369611115643, 'edge_cap': 0.46407115897511436, 'bull_strategy': 'breakout', 'bull_bb_std_mult': 0.7680346702648277, 'bull_rsi_os': 22, 'bull_rsi_ob': 73, 'bull_adx_thresh': 30.838060383174376, 'bull_atr_min_pct': 0.0033072993083727367, 'bull_atr_max_pct': 0.07648166559833569, 'bull_tp_mult': 2.0728410856406865, 'bull_tsl_mult': 0.5017238318935913, 'bull_time_stop': 31, 'bull_use_sma': False, 'bull_use_ema': False, 'bull_use_atr': False, 'bull_use_adx': False, 'bull_use_spike': False, 'bull_rsi_required': False, 'bear_strategy': 'breakout', 'bear_bb_std_mult': 1.9798766247486248, 'bear_rsi_os': 40, 'bear_rsi_ob': 86, 'bear_adx_thresh': 11.725011518494156, 'bear_atr_min_pct': 0.022629048062347005, 'bear_atr_max_pct': 0.11175406707526295, 'bear_tp_mult': 1.382804524043813, 'bear_tsl_mult': 0.3946410857469276, 'bear_time_stop': 11, 'bear_use_sma': False, 'bear_use_ema': True, 'bear_use_atr': False, 'bear_use_adx': False, 'bear_use_spike': False, 'bear_rsi_required': False, 'sideways_strategy': 'mean_reversion', 'sideways_bb_std_mult': 2.5461975529087453, 'sideways_rsi_os': 37, 'sideways_rsi_ob': 89, 'sideways_adx_thresh': 24.85534268340702, 'sideways_atr_min_pct': 0.018468924045911765, 'sideways_atr_max_pct': 0.05815587324905297, 'sideways_tp_mult': 1.9032317124808047, 'sideways_tsl_mult': 0.1092048264062181, 'sideways_time_stop': 230, 'sideways_use_sma': False, 'sideways_use_ema': True, 'sideways_use_atr': False, 'sideways_use_adx': False, 'sideways_use_spike': False, 'sideways_rsi_required': True}.
[I 2025-08-31 11:05:20,493] Trial 552 finished with values: [-1000000000.0, 1000000000.0] and parameters: {'p_sma': 11, 'p_std': 29, 'p_atr': 16, 'p_adx': 14, 'rsi_period': 13, 'ema1': 19, 'ema2': 32, 'slip_atr_k': 0.026426416455389352, 'slip_spread_k': 0.9267151554946299, 'spread_hl_frac': 0.0075800298664038795, 'bb_std_mult': 2.6825075005244483, 'rsi_os': 40, 'rsi_ob': 79, 'vol_spike': 0.1940856497311967, 'adx_thresh': 22.821535176169068, 'atr_min_pct': 0.0066075500473365, 'atr_max_pct': 0.10185969960322672, 'tp_mult': 2.325650473439692, 'tsl_mult': 0.25958206022792946, 'strategy': 'breakout', 'time_stop': 95, 'use_sma': False, 'use_atr': False, 'use_adx': True, 'use_ema': True, 'use_spike': True, 'rsi_required': True, 'edge_k': 0.14735782538666697, 'edge_cap': 0.4379952939049903, 'bull_strategy': 'breakout', 'bull_bb_std_mult': 3.2341699408783056, 'bull_rsi_os': 8, 'bull_rsi_ob': 76, 'bull_adx_thresh': 16.554193134713373, 'bull_atr_min_pct': 0.02711781590415713, 'bull_atr_max_pct': 0.10242455432252669, 'bull_tp_mult': 1.0851585565332111, 'bull_tsl_mult': 0.479370610783993, 'bull_time_stop': 15, 'bull_use_sma': True, 'bull_use_ema': False, 'bull_use_atr': False, 'bull_use_adx': True, 'bull_use_spike': False, 'bull_rsi_required': False, 'bear_strategy': 'mean_reversion', 'bear_bb_std_mult': 1.961872131291953, 'bear_rsi_os': 44, 'bear_rsi_ob': 49, 'bear_adx_thresh': 31.955730281406662, 'bear_atr_min_pct': 0.022513775269392272, 'bear_atr_max_pct': 0.04091444631070936, 'bear_tp_mult': 2.8024933364749938, 'bear_tsl_mult': 0.2684397795684265, 'bear_time_stop': 22, 'bear_use_sma': False, 'bear_use_ema': True, 'bear_use_atr': False, 'bear_use_adx': False, 'bear_use_spike': True, 'bear_rsi_required': False, 'sideways_strategy': 'mean_reversion', 'sideways_bb_std_mult': 2.571587300217183, 'sideways_rsi_os': 8, 'sideways_rsi_ob': 72, 'sideways_adx_thresh': 6.312472481867507, 'sideways_atr_min_pct': 0.01833241949637424, 'sideways_atr_max_pct': 0.08874442479046782, 'sideways_tp_mult': 1.984076254055305, 'sideways_tsl_mult': 0.3773534330074152, 'sideways_time_stop': 38, 'sideways_use_sma': False, 'sideways_use_ema': False, 'sideways_use_atr': False, 'sideways_use_adx': False, 'sideways_use_spike': False, 'sideways_rsi_required': True}.
[I 2025-08-31 11:05:51,919] Trial 553 finished with values: [-1000000000.0, 1000000000.0] and parameters: {'p_sma': 44, 'p_std': 8, 'p_atr': 16, 'p_adx': 14, 'rsi_period': 49, 'ema1': 14, 'ema2': 57, 'slip_atr_k': 0.025468707594801823, 'slip_spread_k': 0.5313596788989027, 'spread_hl_frac': 0.008591106973498464, 'bb_std_mult': 3.223203797726714, 'rsi_os': 28, 'rsi_ob': 80, 'vol_spike': 0.019190555396466275, 'adx_thresh': 22.88046490607687, 'atr_min_pct': 0.005093357406990279, 'atr_max_pct': 0.09914565399607012, 'tp_mult': 2.4559556660209156, 'tsl_mult': 0.2672486409095983, 'strategy': 'breakout', 'time_stop': 180, 'use_sma': False, 'use_atr': True, 'use_adx': False, 'use_ema': True, 'use_spike': True, 'rsi_required': False, 'edge_k': 1.4084445442813984, 'edge_cap': 0.4966028315534948, 'bull_strategy': 'breakout', 'bull_bb_std_mult': 3.5924781141273847, 'bull_rsi_os': 11, 'bull_rsi_ob': 72, 'bull_adx_thresh': 17.64168234054546, 'bull_atr_min_pct': 0.01906033588688639, 'bull_atr_max_pct': 0.07660913386452167, 'bull_tp_mult': 2.0565156951263104, 'bull_tsl_mult': 0.9298153880704911, 'bull_time_stop': 82, 'bull_use_sma': True, 'bull_use_ema': False, 'bull_use_atr': True, 'bull_use_adx': True, 'bull_use_spike': False, 'bull_rsi_required': True, 'bear_strategy': 'mean_reversion', 'bear_bb_std_mult': 2.867949942306348, 'bear_rsi_os': 10, 'bear_rsi_ob': 49, 'bear_adx_thresh': 23.53604432725056, 'bear_atr_min_pct': 0.0062601414703566715, 'bear_atr_max_pct': 0.04040562101691987, 'bear_tp_mult': 1.3814018247268751, 'bear_tsl_mult': 0.7624208693406305, 'bear_time_stop': 182, 'bear_use_sma': False, 'bear_use_ema': True, 'bear_use_atr': False, 'bear_use_adx': False, 'bear_use_spike': True, 'bear_rsi_required': False, 'sideways_strategy': 'mean_reversion', 'sideways_bb_std_mult': 2.390118704655364, 'sideways_rsi_os': 49, 'sideways_rsi_ob': 49, 'sideways_adx_thresh': 6.3549069417822714, 'sideways_atr_min_pct': 0.01835227229863077, 'sideways_atr_max_pct': 0.03082524055111175, 'sideways_tp_mult': 2.5326944336686275, 'sideways_tsl_mult': 0.6882218868181493, 'sideways_time_stop': 193, 'sideways_use_sma': False, 'sideways_use_ema': False, 'sideways_use_atr': False, 'sideways_use_adx': True, 'sideways_use_spike': True, 'sideways_rsi_required': True}.
[I 2025-08-31 11:05:52,215] Trial 555 finished with values: [-1000000000.0, 1000000000.0] and parameters: {'p_sma': 11, 'p_std': 35, 'p_atr': 13, 'p_adx': 10, 'rsi_period': 49, 'ema1': 14, 'ema2': 21, 'slip_atr_k': 0.08513296461806527, 'slip_spread_k': 0.7269763972224921, 'spread_hl_frac': 0.04564081662960334, 'bb_std_mult': 1.012560011451108, 'rsi_os': 11, 'rsi_ob': 78, 'vol_spike': 0.2725087573308451, 'adx_thresh': 33.71602120041236, 'atr_min_pct': 0.005247652461962895, 'atr_max_pct': 0.10039996916309983, 'tp_mult': 2.4501757361733825, 'tsl_mult': 0.21370733597982858, 'strategy': 'breakout', 'time_stop': 76, 'use_sma': False, 'use_atr': True, 'use_adx': False, 'use_ema': False, 'use_spike': False, 'rsi_required': False, 'edge_k': 0.11754939152394303, 'edge_cap': 0.0508116711208314, 'bull_strategy': 'breakout', 'bull_bb_std_mult': 2.173904148027194, 'bull_rsi_os': 11, 'bull_rsi_ob': 64, 'bull_adx_thresh': 16.74622583929753, 'bull_atr_min_pct': 0.00985993908646269, 'bull_atr_max_pct': 0.017164688604695957, 'bull_tp_mult': 1.9497447638237975, 'bull_tsl_mult': 0.7059666868710499, 'bull_time_stop': 300, 'bull_use_sma': True, 'bull_use_ema': True, 'bull_use_atr': True, 'bull_use_adx': True, 'bull_use_spike': False, 'bull_rsi_required': True, 'bear_strategy': 'mean_reversion', 'bear_bb_std_mult': 2.6491550315192005, 'bear_rsi_os': 50, 'bear_rsi_ob': 76, 'bear_adx_thresh': 6.100674077826298, 'bear_atr_min_pct': 0.006304296749072959, 'bear_atr_max_pct': 0.03962465143221318, 'bear_tp_mult': 2.8343368065579533, 'bear_tsl_mult': 0.5786271847312302, 'bear_time_stop': 219, 'bear_use_sma': False, 'bear_use_ema': False, 'bear_use_atr': True, 'bear_use_adx': True, 'bear_use_spike': True, 'bear_rsi_required': True, 'sideways_strategy': 'breakout', 'sideways_bb_std_mult': 2.6882908625428668, 'sideways_rsi_os': 51, 'sideways_rsi_ob': 87, 'sideways_adx_thresh': 12.803102685992883, 'sideways_atr_min_pct': 0.02547057428519987, 'sideways_atr_max_pct': 0.030726814350617915, 'sideways_tp_mult': 1.126786889349674, 'sideways_tsl_mult': 0.08096013575697601, 'sideways_time_stop': 192, 'sideways_use_sma': False, 'sideways_use_ema': False, 'sideways_use_atr': False, 'sideways_use_adx': True, 'sideways_use_spike': True, 'sideways_rsi_required': False}.
[I 2025-08-31 11:05:52,553] Trial 554 finished with values: [-1000000000.0, 1000000000.0] and parameters: {'p_sma': 11, 'p_std': 16, 'p_atr': 16, 'p_adx': 14, 'rsi_period': 31, 'ema1': 14, 'ema2': 57, 'slip_atr_k': 0.0256082943090361, 'slip_spread_k': 0.9323038444600587, 'spread_hl_frac': 0.047411819625948454, 'bb_std_mult': 2.9438146357063646, 'rsi_os': 28, 'rsi_ob': 80, 'vol_spike': 0.27193570252544713, 'adx_thresh': 28.458185761741078, 'atr_min_pct': 0.00500209831153944, 'atr_max_pct': 0.08682737737751887, 'tp_mult': 1.9183906334878484, 'tsl_mult': 0.2088690772489123, 'strategy': 'breakout', 'time_stop': 77, 'use_sma': False, 'use_atr': True, 'use_adx': False, 'use_ema': True, 'use_spike': True, 'rsi_required': False, 'edge_k': 0.2672672265407974, 'edge_cap': 0.3467145829721763, 'bull_strategy': 'breakout', 'bull_bb_std_mult': 1.65309879662386, 'bull_rsi_os': 11, 'bull_rsi_ob': 76, 'bull_adx_thresh': 17.49883803088135, 'bull_atr_min_pct': 0.0038101342645195588, 'bull_atr_max_pct': 0.016808573400179036, 'bull_tp_mult': 1.5139013304686548, 'bull_tsl_mult': 0.7064815537789528, 'bull_time_stop': 165, 'bull_use_sma': True, 'bull_use_ema': True, 'bull_use_atr': True, 'bull_use_adx': True, 'bull_use_spike': False, 'bull_rsi_required': True, 'bear_strategy': 'mean_reversion', 'bear_bb_std_mult': 0.8721949396435253, 'bear_rsi_os': 36, 'bear_rsi_ob': 82, 'bear_adx_thresh': 5.529421157292489, 'bear_atr_min_pct': 0.006257343173702518, 'bear_atr_max_pct': 0.12966221167844177, 'bear_tp_mult': 1.8205831349991035, 'bear_tsl_mult': 0.24746810681063336, 'bear_time_stop': 20, 'bear_use_sma': False, 'bear_use_ema': False, 'bear_use_atr': True, 'bear_use_adx': False, 'bear_use_spike': True, 'bear_rsi_required': False, 'sideways_strategy': 'mean_reversion', 'sideways_bb_std_mult': 2.431102821293308, 'sideways_rsi_os': 50, 'sideways_rsi_ob': 88, 'sideways_adx_thresh': 28.07852635317666, 'sideways_atr_min_pct': 0.018221143848628323, 'sideways_atr_max_pct': 0.020015659090016614, 'sideways_tp_mult': 2.64998210550752, 'sideways_tsl_mult': 0.6857598092618772, 'sideways_time_stop': 153, 'sideways_use_sma': False, 'sideways_use_ema': False, 'sideways_use_atr': False, 'sideways_use_adx': True, 'sideways_use_spike': True, 'sideways_rsi_required': True}.
[I 2025-08-31 11:05:52,702] Trial 556 finished with values: [-1000000000.0, 1000000000.0] and parameters: {'p_sma': 13, 'p_std': 26, 'p_atr': 10, 'p_adx': 11, 'rsi_period': 77, 'ema1': 14, 'ema2': 55, 'slip_atr_k': 0.15117702858167575, 'slip_spread_k': 0.3848370138255369, 'spread_hl_frac': 0.04751953271457437, 'bb_std_mult': 2.259441984934037, 'rsi_os': 28, 'rsi_ob': 78, 'vol_spike': 0.27330252001605826, 'adx_thresh': 28.396106276288567, 'atr_min_pct': 0.005261834351553047, 'atr_max_pct': 0.10103318151107983, 'tp_mult': 2.5494499493581184, 'tsl_mult': 0.15347450139212448, 'strategy': 'mean_reversion', 'time_stop': 74, 'use_sma': False, 'use_atr': True, 'use_adx': False, 'use_ema': False, 'use_spike': False, 'rsi_required': False, 'edge_k': 0.2651969269601458, 'edge_cap': 0.5019413579059141, 'bull_strategy': 'breakout', 'bull_bb_std_mult': 0.8356355559066732, 'bull_rsi_os': 11, 'bull_rsi_ob': 90, 'bull_adx_thresh': 6.943802396117263, 'bull_atr_min_pct': 0.009572541163693066, 'bull_atr_max_pct': 0.08675705811764334, 'bull_tp_mult': 1.9449686169548865, 'bull_tsl_mult': 0.4507568632160149, 'bull_time_stop': 82, 'bull_use_sma': True, 'bull_use_ema': True, 'bull_use_atr': True, 'bull_use_adx': False, 'bull_use_spike': False, 'bull_rsi_required': True, 'bear_strategy': 'breakout', 'bear_bb_std_mult': 0.5856240752237718, 'bear_rsi_os': 39, 'bear_rsi_ob': 78, 'bear_adx_thresh': 6.363398009376038, 'bear_atr_min_pct': 0.006056339032919745, 'bear_atr_max_pct': 0.09205122518636322, 'bear_tp_mult': 2.680618122198853, 'bear_tsl_mult': 0.5013960886088864, 'bear_time_stop': 181, 'bear_use_sma': False, 'bear_use_ema': False, 'bear_use_atr': True, 'bear_use_adx': True, 'bear_use_spike': True, 'bear_rsi_required': True, 'sideways_strategy': 'breakout', 'sideways_bb_std_mult': 2.4112347700273054, 'sideways_rsi_os': 9, 'sideways_rsi_ob': 87, 'sideways_adx_thresh': 26.81584226491558, 'sideways_atr_min_pct': 0.016875299585044443, 'sideways_atr_max_pct': 0.106569651862704, 'sideways_tp_mult': 1.0834098355257629, 'sideways_tsl_mult': 0.6940362360136945, 'sideways_time_stop': 192, 'sideways_use_sma': True, 'sideways_use_ema': False, 'sideways_use_atr': False, 'sideways_use_adx': True, 'sideways_use_spike': True, 'sideways_rsi_required': False}.
[I 2025-08-31 11:06:24,232] Trial 558 finished with values: [-0.0740949959395244, 0.07361503132110826] and parameters: {'p_sma': 13, 'p_std': 51, 'p_atr': 11, 'p_adx': 23, 'rsi_period': 51, 'ema1': 14, 'ema2': 59, 'slip_atr_k': 0.15060513436069747, 'slip_spread_k': 0.5974625486194646, 'spread_hl_frac': 0.012244957214798367, 'bb_std_mult': 2.7858977592776215, 'rsi_os': 28, 'rsi_ob': 77, 'vol_spike': 0.2682193245109849, 'adx_thresh': 28.115506844431927, 'atr_min_pct': 0.0006120730817113784, 'atr_max_pct': 0.08905823003306387, 'tp_mult': 1.93011741866154, 'tsl_mult': 0.28727876099460853, 'strategy': 'mean_reversion', 'time_stop': 80, 'use_sma': True, 'use_atr': False, 'use_adx': True, 'use_ema': True, 'use_spike': True, 'rsi_required': True, 'edge_k': 0.23466937448578926, 'edge_cap': 0.4228022165857221, 'bull_strategy': 'mean_reversion', 'bull_bb_std_mult': 1.1527715850848814, 'bull_rsi_os': 11, 'bull_rsi_ob': 75, 'bull_adx_thresh': 6.901936898622042, 'bull_atr_min_pct': 0.006988986795959634, 'bull_atr_max_pct': 0.08738792550514617, 'bull_tp_mult': 1.5683752134821392, 'bull_tsl_mult': 0.355901841006778, 'bull_time_stop': 110, 'bull_use_sma': True, 'bull_use_ema': True, 'bull_use_atr': False, 'bull_use_adx': False, 'bull_use_spike': True, 'bull_rsi_required': True, 'bear_strategy': 'breakout', 'bear_bb_std_mult': 2.704791785358016, 'bear_rsi_os': 54, 'bear_rsi_ob': 83, 'bear_adx_thresh': 6.399315530473762, 'bear_atr_min_pct': 0.0013442511368093376, 'bear_atr_max_pct': 0.027779124103661693, 'bear_tp_mult': 1.8075925527616246, 'bear_tsl_mult': 0.4974729883895479, 'bear_time_stop': 35, 'bear_use_sma': True, 'bear_use_ema': False, 'bear_use_atr': True, 'bear_use_adx': False, 'bear_use_spike': True, 'bear_rsi_required': True, 'sideways_strategy': 'breakout', 'sideways_bb_std_mult': 2.9167468010823145, 'sideways_rsi_os': 10, 'sideways_rsi_ob': 87, 'sideways_adx_thresh': 28.26675680381534, 'sideways_atr_min_pct': 0.016621197791711128, 'sideways_atr_max_pct': 0.04915720038485137, 'sideways_tp_mult': 2.645440223169231, 'sideways_tsl_mult': 0.05815817845302056, 'sideways_time_stop': 114, 'sideways_use_sma': True, 'sideways_use_ema': False, 'sideways_use_atr': True, 'sideways_use_adx': False, 'sideways_use_spike': False, 'sideways_rsi_required': True}.
