[I 2025-08-31 10:54:57,383] Trial 470 finished with values: [-1000000000.0, 1000000000.0] and parameters: {'p_sma': 18, 'p_std': 22, 'p_atr': 9, 'p_adx': 10, 'rsi_period': 48, 'ema1': 10, 'ema2': 20, 'slip_atr_k': 0.1589820374410557, 'slip_spread_k': 0.8558394980619987, 'spread_hl_frac': 0.010052361179915738, 'bb_std_mult': 2.5253565859189404, 'rsi_os': 29, 'rsi_ob': 77, 'vol_spike': 0.07719417666547014, 'adx_thresh': 9.740348481517959, 'atr_min_pct': 0.0006483685572236213, 'atr_max_pct': 0.062369090597466204, 'tp_mult': 2.0398088589627927, 'tsl_mult': 0.25109881197910017, 'strategy': 'breakout', 'time_stop': 70, 'use_sma': True, 'use_atr': False, 'use_adx': True, 'use_ema': False, 'use_spike': True, 'rsi_required': True, 'edge_k': 0.2399023532998697, 'edge_cap': 0.47545399540309247, 'bull_strategy': 'breakout', 'bull_bb_std_mult': 1.5974546661505546, 'bull_rsi_os': 9, 'bull_rsi_ob': 74, 'bull_adx_thresh': 32.760579094182944, 'bull_atr_min_pct': 0.019374807161618133, 'bull_atr_max_pct': 0.07449241604453358, 'bull_tp_mult': 1.1569496603218645, 'bull_tsl_mult': 0.2141091231936907, 'bull_time_stop': 94, 'bull_use_sma': False, 'bull_use_ema': False, 'bull_use_atr': False, 'bull_use_adx': False, 'bull_use_spike': False, 'bull_rsi_required': False, 'bear_strategy': 'mean_reversion', 'bear_bb_std_mult': 1.9965204422088487, 'bear_rsi_os': 53, 'bear_rsi_ob': 91, 'bear_adx_thresh': 7.47365314641056, 'bear_atr_min_pct': 0.016456402563038104, 'bear_atr_max_pct': 0.14747560311990235, 'bear_tp_mult': 2.914057450113837, 'bear_tsl_mult': 0.12432950450887015, 'bear_time_stop': 32, 'bear_use_sma': True, 'bear_use_ema': False, 'bear_use_atr': True, 'bear_use_adx': True, 'bear_use_spike': True, 'bear_rsi_required': True, 'sideways_strategy': 'mean_reversion', 'sideways_bb_std_mult': 2.6554957218194715, 'sideways_rsi_os': 5, 'sideways_rsi_ob': 48, 'sideways_adx_thresh': 13.382378180201203, 'sideways_atr_min_pct': 0.02061709900941197, 'sideways_atr_max_pct': 0.141375066993645, 'sideways_tp_mult': 2.1552846073803242, 'sideways_tsl_mult': 0.1845398431319848, 'sideways_time_stop': 31, 'sideways_use_sma': False, 'sideways_use_ema': False, 'sideways_use_atr': True, 'sideways_use_adx': False, 'sideways_use_spike': False, 'sideways_rsi_required': True}.
[I 2025-08-31 10:54:57,728] Trial 468 finished with values: [-1000000000.0, 1000000000.0] and parameters: {'p_sma': 18, 'p_std': 7, 'p_atr': 18, 'p_adx': 15, 'rsi_period': 53, 'ema1': 14, 'ema2': 20, 'slip_atr_k': 0.023018927077987555, 'slip_spread_k': 0.3784944844909555, 'spread_hl_frac': 0.009510096147633524, 'bb_std_mult': 2.5240560423350047, 'rsi_os': 27, 'rsi_ob': 60, 'vol_spike': 0.07861556942327545, 'adx_thresh': 24.10468000773995, 'atr_min_pct': 0.00508746737686641, 'atr_max_pct': 0.015833346476575888, 'tp_mult': 2.7736574078501293, 'tsl_mult': 0.7833324556063723, 'strategy': 'breakout', 'time_stop': 68, 'use_sma': True, 'use_atr': False, 'use_adx': True, 'use_ema': True, 'use_spike': True, 'rsi_required': True, 'edge_k': 0.23542431313729395, 'edge_cap': 0.4601165999468264, 'bull_strategy': 'breakout', 'bull_bb_std_mult': 0.766022998821878, 'bull_rsi_os': 23, 'bull_rsi_ob': 74, 'bull_adx_thresh': 32.2173252643943, 'bull_atr_min_pct': 0.009364559597254726, 'bull_atr_max_pct': 0.059482815018278595, 'bull_tp_mult': 1.75089483903744, 'bull_tsl_mult': 0.21542210549516283, 'bull_time_stop': 117, 'bull_use_sma': False, 'bull_use_ema': False, 'bull_use_atr': False, 'bull_use_adx': False, 'bull_use_spike': False, 'bull_rsi_required': True, 'bear_strategy': 'mean_reversion', 'bear_bb_std_mult': 1.9499957827112457, 'bear_rsi_os': 26, 'bear_rsi_ob': 84, 'bear_adx_thresh': 6.522704353180907, 'bear_atr_min_pct': 0.00436983043589401, 'bear_atr_max_pct': 0.13281949573507856, 'bear_tp_mult': 2.132923977877347, 'bear_tsl_mult': 0.516128319641251, 'bear_time_stop': 20, 'bear_use_sma': False, 'bear_use_ema': False, 'bear_use_atr': True, 'bear_use_adx': False, 'bear_use_spike': True, 'bear_rsi_required': True, 'sideways_strategy': 'mean_reversion', 'sideways_bb_std_mult': 2.6546289017627482, 'sideways_rsi_os': 5, 'sideways_rsi_ob': 48, 'sideways_adx_thresh': 13.757170002706836, 'sideways_atr_min_pct': 0.020661825548692593, 'sideways_atr_max_pct': 0.14099774517266103, 'sideways_tp_mult': 2.489300527733744, 'sideways_tsl_mult': 0.20228978189807145, 'sideways_time_stop': 116, 'sideways_use_sma': False, 'sideways_use_ema': False, 'sideways_use_atr': True, 'sideways_use_adx': False, 'sideways_use_spike': False, 'sideways_rsi_required': True}.
[I 2025-08-31 10:54:57,925] Trial 469 finished with values: [-1000000000.0, 1000000000.0] and parameters: {'p_sma': 43, 'p_std': 43, 'p_atr': 8, 'p_adx': 15, 'rsi_period': 47, 'ema1': 7, 'ema2': 11, 'slip_atr_k': 0.05727318966049724, 'slip_spread_k': 0.6058178726222156, 'spread_hl_frac': 0.009416463447651078, 'bb_std_mult': 2.8169374932422295, 'rsi_os': 29, 'rsi_ob': 77, 'vol_spike': 0.08385570581958306, 'adx_thresh': 16.58820815693868, 'atr_min_pct': 0.0058732464168307075, 'atr_max_pct': 0.12081073312705026, 'tp_mult': 2.0293552276411595, 'tsl_mult': 0.25588933428172655, 'strategy': 'breakout', 'time_stop': 68, 'use_sma': True, 'use_atr': False, 'use_adx': True, 'use_ema': False, 'use_spike': True, 'rsi_required': True, 'edge_k': 0.24733209064662198, 'edge_cap': 0.470304123606011, 'bull_strategy': 'breakout', 'bull_bb_std_mult': 0.5881708345110963, 'bull_rsi_os': 13, 'bull_rsi_ob': 49, 'bull_adx_thresh': 32.324575024485405, 'bull_atr_min_pct': 0.028400490625403098, 'bull_atr_max_pct': 0.07086069896319248, 'bull_tp_mult': 2.291250554797927, 'bull_tsl_mult': 0.4010956868536796, 'bull_time_stop': 68, 'bull_use_sma': False, 'bull_use_ema': False, 'bull_use_atr': False, 'bull_use_adx': False, 'bull_use_spike': False, 'bull_rsi_required': True, 'bear_strategy': 'breakout', 'bear_bb_std_mult': 1.9729924866065802, 'bear_rsi_os': 41, 'bear_rsi_ob': 83, 'bear_adx_thresh': 7.47027968849349, 'bear_atr_min_pct': 0.02634269638922538, 'bear_atr_max_pct': 0.015963205201698083, 'bear_tp_mult': 2.9379376461314948, 'bear_tsl_mult': 0.4511427907566248, 'bear_time_stop': 21, 'bear_use_sma': True, 'bear_use_ema': False, 'bear_use_atr': True, 'bear_use_adx': True, 'bear_use_spike': True, 'bear_rsi_required': True, 'sideways_strategy': 'mean_reversion', 'sideways_bb_std_mult': 2.8586295111487834, 'sideways_rsi_os': 5, 'sideways_rsi_ob': 91, 'sideways_adx_thresh': 29.01896968036072, 'sideways_atr_min_pct': 0.013934220828639389, 'sideways_atr_max_pct': 0.0501427070668275, 'sideways_tp_mult': 1.916324513115106, 'sideways_tsl_mult': 0.1928604515589734, 'sideways_time_stop': 31, 'sideways_use_sma': False, 'sideways_use_ema': False, 'sideways_use_atr': True, 'sideways_use_adx': False, 'sideways_use_spike': False, 'sideways_rsi_required': True}.
[I 2025-08-31 10:54:58,169] Trial 471 finished with values: [-1000000000.0, 1000000000.0] and parameters: {'p_sma': 45, 'p_std': 42, 'p_atr': 10, 'p_adx': 10, 'rsi_period': 48, 'ema1': 10, 'ema2': 58, 'slip_atr_k': 0.018363006675678164, 'slip_spread_k': 0.7268415093495785, 'spread_hl_frac': 0.04899980386621814, 'bb_std_mult': 2.5170985257782026, 'rsi_os': 29, 'rsi_ob': 85, 'vol_spike': 0.27159126354822527, 'adx_thresh': 27.63149249283154, 'atr_min_pct': 0.006031012800878809, 'atr_max_pct': 0.0904131171085696, 'tp_mult': 2.751461236995709, 'tsl_mult': 0.25911126059035644, 'strategy': 'breakout', 'time_stop': 69, 'use_sma': True, 'use_atr': False, 'use_adx': True, 'use_ema': False, 'use_spike': True, 'rsi_required': True, 'edge_k': 1.4381446727154472, 'edge_cap': 0.4732919735240733, 'bull_strategy': 'mean_reversion', 'bull_bb_std_mult': 1.9144931733388475, 'bull_rsi_os': 23, 'bull_rsi_ob': 74, 'bull_adx_thresh': 32.247102728388576, 'bull_atr_min_pct': 0.0091929617821668, 'bull_atr_max_pct': 0.07463378451792914, 'bull_tp_mult': 1.6923312156461596, 'bull_tsl_mult': 0.2147720906853779, 'bull_time_stop': 66, 'bull_use_sma': False, 'bull_use_ema': False, 'bull_use_atr': False, 'bull_use_adx': False, 'bull_use_spike': False, 'bull_rsi_required': False, 'bear_strategy': 'mean_reversion', 'bear_bb_std_mult': 2.81805271848162, 'bear_rsi_os': 40, 'bear_rsi_ob': 89, 'bear_adx_thresh': 28.907461641632672, 'bear_atr_min_pct': 0.026362932988764975, 'bear_atr_max_pct': 0.13495167805240033, 'bear_tp_mult': 2.668001095594061, 'bear_tsl_mult': 0.8401378166430061, 'bear_time_stop': 285, 'bear_use_sma': True, 'bear_use_ema': False, 'bear_use_atr': True, 'bear_use_adx': True, 'bear_use_spike': True, 'bear_rsi_required': True, 'sideways_strategy': 'mean_reversion', 'sideways_bb_std_mult': 2.6690135172435516, 'sideways_rsi_os': 27, 'sideways_rsi_ob': 91, 'sideways_adx_thresh': 13.560993465337486, 'sideways_atr_min_pct': 0.020200245487918753, 'sideways_atr_max_pct': 0.020612785929114724, 'sideways_tp_mult': 2.0611687146637854, 'sideways_tsl_mult': 0.4494955352526681, 'sideways_time_stop': 33, 'sideways_use_sma': False, 'sideways_use_ema': True, 'sideways_use_atr': True, 'sideways_use_adx': False, 'sideways_use_spike': False, 'sideways_rsi_required': True}.
[I 2025-08-31 10:54:58,950] Trial 473 finished with values: [-1000000000.0, 1000000000.0] and parameters: {'p_sma': 56, 'p_std': 26, 'p_atr': 10, 'p_adx': 13, 'rsi_period': 46, 'ema1': 27, 'ema2': 58, 'slip_atr_k': 0.14876578291370737, 'slip_spread_k': 0.7272704135657446, 'spread_hl_frac': 0.049016117864837234, 'bb_std_mult': 3.035301527390982, 'rsi_os': 24, 'rsi_ob': 45, 'vol_spike': 0.23859768766816888, 'adx_thresh': 27.70812943946578, 'atr_min_pct': 0.0017157544955996376, 'atr_max_pct': 0.11313476460525453, 'tp_mult': 2.528687049185397, 'tsl_mult': 0.17619666002921758, 'strategy': 'mean_reversion', 'time_stop': 149, 'use_sma': True, 'use_atr': False, 'use_adx': True, 'use_ema': False, 'use_spike': True, 'rsi_required': True, 'edge_k': 0.17448772482278962, 'edge_cap': 0.6460695405323841, 'bull_strategy': 'mean_reversion', 'bull_bb_std_mult': 0.5993270588687774, 'bull_rsi_os': 13, 'bull_rsi_ob': 87, 'bull_adx_thresh': 7.47374414033386, 'bull_atr_min_pct': 0.028597279259698075, 'bull_atr_max_pct': 0.07057695417534095, 'bull_tp_mult': 2.8955329106600756, 'bull_tsl_mult': 0.3113263572121039, 'bull_time_stop': 67, 'bull_use_sma': True, 'bull_use_ema': False, 'bull_use_atr': False, 'bull_use_adx': False, 'bull_use_spike': False, 'bull_rsi_required': True, 'bear_strategy': 'breakout', 'bear_bb_std_mult': 2.0935422982885328, 'bear_rsi_os': 41, 'bear_rsi_ob': 89, 'bear_adx_thresh': 34.00700554226615, 'bear_atr_min_pct': 0.006491614109552785, 'bear_atr_max_pct': 0.06833259489069893, 'bear_tp_mult': 2.661008219132878, 'bear_tsl_mult': 0.5753867611861877, 'bear_time_stop': 101, 'bear_use_sma': True, 'bear_use_ema': True, 'bear_use_atr': False, 'bear_use_adx': True, 'bear_use_spike': True, 'bear_rsi_required': False, 'sideways_strategy': 'mean_reversion', 'sideways_bb_std_mult': 0.6882062635647064, 'sideways_rsi_os': 46, 'sideways_rsi_ob': 91, 'sideways_adx_thresh': 25.70441852070636, 'sideways_atr_min_pct': 0.017239643440842767, 'sideways_atr_max_pct': 0.021177836958261212, 'sideways_tp_mult': 2.0612130925148247, 'sideways_tsl_mult': 0.1131559445575942, 'sideways_time_stop': 34, 'sideways_use_sma': True, 'sideways_use_ema': True, 'sideways_use_atr': False, 'sideways_use_adx': False, 'sideways_use_spike': False, 'sideways_rsi_required': True}.
[I 2025-08-31 10:55:28,170] Trial 472 finished with values: [-1000000000.0, 1000000000.0] and parameters: {'p_sma': 45, 'p_std': 25, 'p_atr': 22, 'p_adx': 15, 'rsi_period': 45, 'ema1': 14, 'ema2': 58, 'slip_atr_k': 0.01896548381087855, 'slip_spread_k': 0.7326982772410187, 'spread_hl_frac': 0.009135349762559737, 'bb_std_mult': 2.3896104659560384, 'rsi_os': 27, 'rsi_ob': 87, 'vol_spike': 0.2705996578788405, 'adx_thresh': 8.995021894641615, 'atr_min_pct': 0.00495537459244263, 'atr_max_pct': 0.10060201433458013, 'tp_mult': 2.3801682530222736, 'tsl_mult': 0.4276154296539756, 'strategy': 'mean_reversion', 'time_stop': 158, 'use_sma': True, 'use_atr': False, 'use_adx': True, 'use_ema': False, 'use_spike': True, 'rsi_required': True, 'edge_k': 1.4443264929307293, 'edge_cap': 0.46498746075378916, 'bull_strategy': 'mean_reversion', 'bull_bb_std_mult': 1.2493416533536528, 'bull_rsi_os': 13, 'bull_rsi_ob': 74, 'bull_adx_thresh': 7.652388679597897, 'bull_atr_min_pct': 0.009147055606553751, 'bull_atr_max_pct': 0.08472704343870309, 'bull_tp_mult': 2.319730509095324, 'bull_tsl_mult': 0.6279593824905221, 'bull_time_stop': 296, 'bull_use_sma': False, 'bull_use_ema': False, 'bull_use_atr': False, 'bull_use_adx': False, 'bull_use_spike': False, 'bull_rsi_required': True, 'bear_strategy': 'breakout', 'bear_bb_std_mult': 2.8106264542097485, 'bear_rsi_os': 40, 'bear_rsi_ob': 84, 'bear_adx_thresh': 6.850720149677998, 'bear_atr_min_pct': 0.006537803768992865, 'bear_atr_max_pct': 0.13251345103454862, 'bear_tp_mult': 2.791895841573735, 'bear_tsl_mult': 0.5801718131659375, 'bear_time_stop': 287, 'bear_use_sma': False, 'bear_use_ema': False, 'bear_use_atr': True, 'bear_use_adx': True, 'bear_use_spike': True, 'bear_rsi_required': True, 'sideways_strategy': 'mean_reversion', 'sideways_bb_std_mult': 2.8570996416457906, 'sideways_rsi_os': 28, 'sideways_rsi_ob': 67, 'sideways_adx_thresh': 29.045358340249102, 'sideways_atr_min_pct': 0.01890295125082716, 'sideways_atr_max_pct': 0.10113098856256815, 'sideways_tp_mult': 1.8943953800746425, 'sideways_tsl_mult': 0.10335544699843845, 'sideways_time_stop': 35, 'sideways_use_sma': True, 'sideways_use_ema': True, 'sideways_use_atr': True, 'sideways_use_adx': False, 'sideways_use_spike': False, 'sideways_rsi_required': True}.
[I 2025-08-31 10:55:28,679] Trial 474 finished with values: [-1000000000.0, 1000000000.0] and parameters: {'p_sma': 56, 'p_std': 40, 'p_atr': 22, 'p_adx': 23, 'rsi_period': 45, 'ema1': 15, 'ema2': 58, 'slip_atr_k': 0.01737761623386458, 'slip_spread_k': 0.5752270668556492, 'spread_hl_frac': 0.008182522981235112, 'bb_std_mult': 2.3890202438177672, 'rsi_os': 36, 'rsi_ob': 79, 'vol_spike': 0.2084457574006977, 'adx_thresh': 29.31391403046819, 'atr_min_pct': 0.00751916411296603, 'atr_max_pct': 0.08733410766696402, 'tp_mult': 2.7197498644771985, 'tsl_mult': 0.2965942893612402, 'strategy': 'mean_reversion', 'time_stop': 125, 'use_sma': True, 'use_atr': False, 'use_adx': True, 'use_ema': True, 'use_spike': True, 'rsi_required': True, 'edge_k': 0.1787295279721816, 'edge_cap': 0.4195985585601556, 'bull_strategy': 'mean_reversion', 'bull_bb_std_mult': 0.6266541855441111, 'bull_rsi_os': 10, 'bull_rsi_ob': 54, 'bull_adx_thresh': 7.460849832346423, 'bull_atr_min_pct': 0.02636302349395058, 'bull_atr_max_pct': 0.08453487847003766, 'bull_tp_mult': 1.6936813751404307, 'bull_tsl_mult': 0.4427914553451388, 'bull_time_stop': 68, 'bull_use_sma': True, 'bull_use_ema': False, 'bull_use_atr': False, 'bull_use_adx': False, 'bull_use_spike': False, 'bull_rsi_required': False, 'bear_strategy': 'breakout', 'bear_bb_std_mult': 1.450887877498551, 'bear_rsi_os': 55, 'bear_rsi_ob': 89, 'bear_adx_thresh': 9.06259816192717, 'bear_atr_min_pct': 0.006552038576839363, 'bear_atr_max_pct': 0.14313829410334664, 'bear_tp_mult': 2.6677378967387653, 'bear_tsl_mult': 0.5881278910195613, 'bear_time_stop': 100, 'bear_use_sma': False, 'bear_use_ema': True, 'bear_use_atr': False, 'bear_use_adx': False, 'bear_use_spike': True, 'bear_rsi_required': False, 'sideways_strategy': 'mean_reversion', 'sideways_bb_std_mult': 2.742120441313025, 'sideways_rsi_os': 27, 'sideways_rsi_ob': 60, 'sideways_adx_thresh': 12.567970479211791, 'sideways_atr_min_pct': 0.019002231250712067, 'sideways_atr_max_pct': 0.06556650837041565, 'sideways_tp_mult': 2.073964101807894, 'sideways_tsl_mult': 0.06219352592189515, 'sideways_time_stop': 257, 'sideways_use_sma': True, 'sideways_use_ema': True, 'sideways_use_atr': False, 'sideways_use_adx': False, 'sideways_use_spike': False, 'sideways_rsi_required': True}.
[I 2025-08-31 10:55:28,943] Trial 475 finished with values: [-0.18539570480231504, 0.1849486663986026] and parameters: {'p_sma': 60, 'p_std': 40, 'p_atr': 22, 'p_adx': 13, 'rsi_period': 45, 'ema1': 14, 'ema2': 51, 'slip_atr_k': 0.22291516888690222, 'slip_spread_k': 0.6936926847454336, 'spread_hl_frac': 0.007779555225457189, 'bb_std_mult': 2.0735989742062317, 'rsi_os': 23, 'rsi_ob': 93, 'vol_spike': 0.2394484037442801, 'adx_thresh': 29.448197689132485, 'atr_min_pct': 0.0017006137525939075, 'atr_max_pct': 0.03807059882434606, 'tp_mult': 2.532210568171884, 'tsl_mult': 0.8837669547915806, 'strategy': 'mean_reversion', 'time_stop': 124, 'use_sma': True, 'use_atr': False, 'use_adx': True, 'use_ema': True, 'use_spike': True, 'rsi_required': True, 'edge_k': 0.17129586188086987, 'edge_cap': 0.5548975812023905, 'bull_strategy': 'mean_reversion', 'bull_bb_std_mult': 0.504948635437849, 'bull_rsi_os': 6, 'bull_rsi_ob': 54, 'bull_adx_thresh': 14.90700147449132, 'bull_atr_min_pct': 0.019888720934820123, 'bull_atr_max_pct': 0.09229039192249619, 'bull_tp_mult': 1.8321085245341941, 'bull_tsl_mult': 0.3227954505531428, 'bull_time_stop': 243, 'bull_use_sma': True, 'bull_use_ema': False, 'bull_use_atr': False, 'bull_use_adx': False, 'bull_use_spike': False, 'bull_rsi_required': True, 'bear_strategy': 'breakout', 'bear_bb_std_mult': 2.1539696545598552, 'bear_rsi_os': 51, 'bear_rsi_ob': 76, 'bear_adx_thresh': 5.001870679065962, 'bear_atr_min_pct': 0.00011895397304899011, 'bear_atr_max_pct': 0.14304103256911382, 'bear_tp_mult': 1.86070065210246, 'bear_tsl_mult': 0.5396431306405832, 'bear_time_stop': 100, 'bear_use_sma': False, 'bear_use_ema': True, 'bear_use_atr': False, 'bear_use_adx': False, 'bear_use_spike': False, 'bear_rsi_required': False, 'sideways_strategy': 'mean_reversion', 'sideways_bb_std_mult': 2.7425616402786237, 'sideways_rsi_os': 8, 'sideways_rsi_ob': 92, 'sideways_adx_thresh': 26.665428840663324, 'sideways_atr_min_pct': 0.017232415529089697, 'sideways_atr_max_pct': 0.010430484562867007, 'sideways_tp_mult': 1.9819039974966277, 'sideways_tsl_mult': 0.11058435848947612, 'sideways_time_stop': 25, 'sideways_use_sma': True, 'sideways_use_ema': True, 'sideways_use_atr': False, 'sideways_use_adx': False, 'sideways_use_spike': False, 'sideways_rsi_required': True}.
[I 2025-08-31 10:55:29,859] Trial 476 finished with values: [-1000000000.0, 1000000000.0] and parameters: {'p_sma': 13, 'p_std': 33, 'p_atr': 22, 'p_adx': 30, 'rsi_period': 43, 'ema1': 11, 'ema2': 51, 'slip_atr_k': 0.02790503905366859, 'slip_spread_k': 0.12294503354692854, 'spread_hl_frac': 0.008491454768808403, 'bb_std_mult': 2.2970961351748036, 'rsi_os': 25, 'rsi_ob': 67, 'vol_spike': 0.26037871629436876, 'adx_thresh': 29.89959865592136, 'atr_min_pct': 0.01577984707373243, 'atr_max_pct': 0.05359522095353804, 'tp_mult': 2.3799667422745494, 'tsl_mult': 0.21042648169354577, 'strategy': 'mean_reversion', 'time_stop': 123, 'use_sma': True, 'use_atr': False, 'use_adx': True, 'use_ema': True, 'use_spike': True, 'rsi_required': True, 'edge_k': 0.156346820581915, 'edge_cap': 0.4153089667647275, 'bull_strategy': 'breakout', 'bull_bb_std_mult': 0.7856396941715518, 'bull_rsi_os': 10, 'bull_rsi_ob': 95, 'bull_adx_thresh': 8.575348000920718, 'bull_atr_min_pct': 0.01978845466760175, 'bull_atr_max_pct': 0.018002249664428767, 'bull_tp_mult': 2.57341597346546, 'bull_tsl_mult': 0.6241438916265435, 'bull_time_stop': 6, 'bull_use_sma': True, 'bull_use_ema': False, 'bull_use_atr': False, 'bull_use_adx': False, 'bull_use_spike': False, 'bull_rsi_required': True, 'bear_strategy': 'breakout', 'bear_bb_std_mult': 1.7988572955439905, 'bear_rsi_os': 22, 'bear_rsi_ob': 87, 'bear_adx_thresh': 25.429568991761656, 'bear_atr_min_pct': 0.005786897655331423, 'bear_atr_max_pct': 0.1444046959624795, 'bear_tp_mult': 2.7932192682472627, 'bear_tsl_mult': 0.5490071546716925, 'bear_time_stop': 28, 'bear_use_sma': False, 'bear_use_ema': True, 'bear_use_atr': False, 'bear_use_adx': False, 'bear_use_spike': False, 'bear_rsi_required': False, 'sideways_strategy': 'mean_reversion', 'sideways_bb_std_mult': 2.740225303120083, 'sideways_rsi_os': 8, 'sideways_rsi_ob': 92, 'sideways_adx_thresh': 26.85083998114855, 'sideways_atr_min_pct': 0.019054877506931214, 'sideways_atr_max_pct': 0.03065872885206408, 'sideways_tp_mult': 1.877461298632837, 'sideways_tsl_mult': 0.10359100971550089, 'sideways_time_stop': 10, 'sideways_use_sma': True, 'sideways_use_ema': False, 'sideways_use_atr': False, 'sideways_use_adx': False, 'sideways_use_spike': False, 'sideways_rsi_required': True}.
