[I 2025-08-31 10:42:38,397] Trial 368 finished with values: [-1000000000.0, 1000000000.0] and parameters: {'p_sma': 28, 'p_std': 28, 'p_atr': 12, 'p_adx': 12, 'rsi_period': 27, 'ema1': 21, 'ema2': 27, 'slip_atr_k': 0.06241151615369468, 'slip_spread_k': 0.665776732093211, 'spread_hl_frac': 0.02657185823874511, 'bb_std_mult': 2.758269495830613, 'rsi_os': 23, 'rsi_ob': 76, 'vol_spike': 0.26448991870032856, 'adx_thresh': 27.282429662508456, 'atr_min_pct': 0.00555674361010468, 'atr_max_pct': 0.10580163459175695, 'tp_mult': 2.494856226319944, 'tsl_mult': 0.22507582480749652, 'strategy': 'breakout', 'time_stop': 94, 'use_sma': True, 'use_atr': False, 'use_adx': True, 'use_ema': True, 'use_spike': True, 'rsi_required': True, 'edge_k': 0.19627659590858743, 'edge_cap': 0.5162358020864888, 'bull_strategy': 'mean_reversion', 'bull_bb_std_mult': 0.737786582099946, 'bull_rsi_os': 6, 'bull_rsi_ob': 73, 'bull_adx_thresh': 7.024072823138227, 'bull_atr_min_pct': 0.023560223647077775, 'bull_atr_max_pct': 0.09113932552676332, 'bull_tp_mult': 1.8124421943357139, 'bull_tsl_mult': 0.3691319977051867, 'bull_time_stop': 146, 'bull_use_sma': True, 'bull_use_ema': False, 'bull_use_atr': False, 'bull_use_adx': False, 'bull_use_spike': False, 'bull_rsi_required': True, 'bear_strategy': 'breakout', 'bear_bb_std_mult': 1.8203282868585378, 'bear_rsi_os': 41, 'bear_rsi_ob': 81, 'bear_adx_thresh': 7.697589451816865, 'bear_atr_min_pct': 0.02422918280796625, 'bear_atr_max_pct': 0.1347550201245358, 'bear_tp_mult': 2.7452875920268354, 'bear_tsl_mult': 0.6180873401142528, 'bear_time_stop': 98, 'bear_use_sma': True, 'bear_use_ema': True, 'bear_use_atr': False, 'bear_use_adx': False, 'bear_use_spike': True, 'bear_rsi_required': False, 'sideways_strategy': 'mean_reversion', 'sideways_bb_std_mult': 1.4445270353796418, 'sideways_rsi_os': 5, 'sideways_rsi_ob': 93, 'sideways_adx_thresh': 11.111118031927335, 'sideways_atr_min_pct': 0.018551865437639356, 'sideways_atr_max_pct': 0.1173688958249911, 'sideways_tp_mult': 1.987745163557028, 'sideways_tsl_mult': 0.11952448705399431, 'sideways_time_stop': 96, 'sideways_use_sma': False, 'sideways_use_ema': True, 'sideways_use_atr': False, 'sideways_use_adx': False, 'sideways_use_spike': False, 'sideways_rsi_required': True}.
[I 2025-08-31 10:42:38,417] Trial 370 finished with values: [-1000000000.0, 1000000000.0] and parameters: {'p_sma': 27, 'p_std': 27, 'p_atr': 12, 'p_adx': 8, 'rsi_period': 28, 'ema1': 12, 'ema2': 14, 'slip_atr_k': 0.13082165558654144, 'slip_spread_k': 0.1691617486610667, 'spread_hl_frac': 0.04061906716958255, 'bb_std_mult': 2.5165264360025894, 'rsi_os': 27, 'rsi_ob': 78, 'vol_spike': 0.26497871491170033, 'adx_thresh': 27.36476841821669, 'atr_min_pct': 0.005383294646970333, 'atr_max_pct': 0.10625166610639485, 'tp_mult': 2.15302694295987, 'tsl_mult': 0.2573373299229493, 'strategy': 'breakout', 'time_stop': 65, 'use_sma': False, 'use_atr': False, 'use_adx': True, 'use_ema': True, 'use_spike': False, 'rsi_required': True, 'edge_k': 0.9791494518348527, 'edge_cap': 0.5206191357464276, 'bull_strategy': 'mean_reversion', 'bull_bb_std_mult': 0.7253056460804794, 'bull_rsi_os': 7, 'bull_rsi_ob': 75, 'bull_adx_thresh': 10.158649273804782, 'bull_atr_min_pct': 0.023341302930090853, 'bull_atr_max_pct': 0.09121700054264488, 'bull_tp_mult': 1.8121815065931266, 'bull_tsl_mult': 0.6866750180583046, 'bull_time_stop': 161, 'bull_use_sma': True, 'bull_use_ema': False, 'bull_use_atr': False, 'bull_use_adx': True, 'bull_use_spike': False, 'bull_rsi_required': False, 'bear_strategy': 'breakout', 'bear_bb_std_mult': 1.6663087137572772, 'bear_rsi_os': 31, 'bear_rsi_ob': 88, 'bear_adx_thresh': 5.030487391498711, 'bear_atr_min_pct': 0.005115406032741139, 'bear_atr_max_pct': 0.11261436952218223, 'bear_tp_mult': 2.742767620481695, 'bear_tsl_mult': 0.6202791878737764, 'bear_time_stop': 28, 'bear_use_sma': True, 'bear_use_ema': True, 'bear_use_atr': False, 'bear_use_adx': False, 'bear_use_spike': True, 'bear_rsi_required': False, 'sideways_strategy': 'mean_reversion', 'sideways_bb_std_mult': 1.8488161166777128, 'sideways_rsi_os': 5, 'sideways_rsi_ob': 92, 'sideways_adx_thresh': 25.646712888905977, 'sideways_atr_min_pct': 0.017502543667583182, 'sideways_atr_max_pct': 0.11783565225023257, 'sideways_tp_mult': 1.2579317736636, 'sideways_tsl_mult': 0.11935121543513294, 'sideways_time_stop': 211, 'sideways_use_sma': False, 'sideways_use_ema': True, 'sideways_use_atr': False, 'sideways_use_adx': False, 'sideways_use_spike': False, 'sideways_rsi_required': True}.
[I 2025-08-31 10:42:38,670] Trial 371 finished with values: [-1000000000.0, 1000000000.0] and parameters: {'p_sma': 16, 'p_std': 27, 'p_atr': 12, 'p_adx': 28, 'rsi_period': 35, 'ema1': 12, 'ema2': 11, 'slip_atr_k': 0.20536169935854243, 'slip_spread_k': 0.6585688983294106, 'spread_hl_frac': 0.040362795150872446, 'bb_std_mult': 2.5516725014418085, 'rsi_os': 29, 'rsi_ob': 78, 'vol_spike': 0.24724559260842624, 'adx_thresh': 14.60985760293863, 'atr_min_pct': 0.005486758668400562, 'atr_max_pct': 0.09737212776768668, 'tp_mult': 2.3481852414392157, 'tsl_mult': 0.15716370462813023, 'strategy': 'breakout', 'time_stop': 61, 'use_sma': False, 'use_atr': False, 'use_adx': True, 'use_ema': True, 'use_spike': False, 'rsi_required': True, 'edge_k': 0.7092963602449629, 'edge_cap': 0.48693124354505596, 'bull_strategy': 'mean_reversion', 'bull_bb_std_mult': 2.3858125981440073, 'bull_rsi_os': 6, 'bull_rsi_ob': 46, 'bull_adx_thresh': 10.015577857519032, 'bull_atr_min_pct': 0.022868862746950228, 'bull_atr_max_pct': 0.0899295943596716, 'bull_tp_mult': 1.9067177925709196, 'bull_tsl_mult': 0.38217502460577274, 'bull_time_stop': 162, 'bull_use_sma': False, 'bull_use_ema': False, 'bull_use_atr': False, 'bull_use_adx': True, 'bull_use_spike': False, 'bull_rsi_required': False, 'bear_strategy': 'breakout', 'bear_bb_std_mult': 3.268743788834361, 'bear_rsi_os': 31, 'bear_rsi_ob': 85, 'bear_adx_thresh': 5.026164039897698, 'bear_atr_min_pct': 0.005042960305745334, 'bear_atr_max_pct': 0.14454953324387873, 'bear_tp_mult': 2.8090956681885917, 'bear_tsl_mult': 0.4688185196816131, 'bear_time_stop': 27, 'bear_use_sma': True, 'bear_use_ema': True, 'bear_use_atr': False, 'bear_use_adx': False, 'bear_use_spike': False, 'bear_rsi_required': False, 'sideways_strategy': 'mean_reversion', 'sideways_bb_std_mult': 1.9595703144132783, 'sideways_rsi_os': 5, 'sideways_rsi_ob': 93, 'sideways_adx_thresh': 25.294012663736986, 'sideways_atr_min_pct': 0.017564573436196426, 'sideways_atr_max_pct': 0.055729178125317885, 'sideways_tp_mult': 1.8899584303914876, 'sideways_tsl_mult': 0.11088422349065238, 'sideways_time_stop': 210, 'sideways_use_sma': False, 'sideways_use_ema': True, 'sideways_use_atr': False, 'sideways_use_adx': False, 'sideways_use_spike': False, 'sideways_rsi_required': True}.
[I 2025-08-31 10:43:10,305] Trial 372 finished with values: [-1000000000.0, 1000000000.0] and parameters: {'p_sma': 16, 'p_std': 42, 'p_atr': 11, 'p_adx': 13, 'rsi_period': 48, 'ema1': 8, 'ema2': 40, 'slip_atr_k': 0.23920172097907183, 'slip_spread_k': 0.6529288735500346, 'spread_hl_frac': 0.008335233444022832, 'bb_std_mult': 2.571292934423309, 'rsi_os': 35, 'rsi_ob': 78, 'vol_spike': 0.0834232335577936, 'adx_thresh': 14.70843478868277, 'atr_min_pct': 0.02909316606920572, 'atr_max_pct': 0.1463682965660872, 'tp_mult': 2.4767520600726276, 'tsl_mult': 0.3545514865904352, 'strategy': 'breakout', 'time_stop': 78, 'use_sma': True, 'use_atr': False, 'use_adx': True, 'use_ema': True, 'use_spike': False, 'rsi_required': True, 'edge_k': 0.687601090783234, 'edge_cap': 0.5207371081253471, 'bull_strategy': 'breakout', 'bull_bb_std_mult': 0.7349671582947837, 'bull_rsi_os': 6, 'bull_rsi_ob': 46, 'bull_adx_thresh': 8.564760532490359, 'bull_atr_min_pct': 0.026143130158213478, 'bull_atr_max_pct': 0.09086962779941223, 'bull_tp_mult': 1.747932145085818, 'bull_tsl_mult': 0.37480986696433427, 'bull_time_stop': 261, 'bull_use_sma': False, 'bull_use_ema': False, 'bull_use_atr': False, 'bull_use_adx': False, 'bull_use_spike': False, 'bull_rsi_required': True, 'bear_strategy': 'breakout', 'bear_bb_std_mult': 2.189541828557315, 'bear_rsi_os': 41, 'bear_rsi_ob': 93, 'bear_adx_thresh': 5.034016703545777, 'bear_atr_min_pct': 0.026728127948956237, 'bear_atr_max_pct': 0.1336439649780427, 'bear_tp_mult': 2.812192745190859, 'bear_tsl_mult': 0.8121873145998182, 'bear_time_stop': 173, 'bear_use_sma': True, 'bear_use_ema': True, 'bear_use_atr': False, 'bear_use_adx': False, 'bear_use_spike': False, 'bear_rsi_required': False, 'sideways_strategy': 'mean_reversion', 'sideways_bb_std_mult': 2.8054794878796394, 'sideways_rsi_os': 6, 'sideways_rsi_ob': 92, 'sideways_adx_thresh': 25.025269117535, 'sideways_atr_min_pct': 0.015223018406057881, 'sideways_atr_max_pct': 0.05577019837380261, 'sideways_tp_mult': 1.9878856421963325, 'sideways_tsl_mult': 0.8689994765398525, 'sideways_time_stop': 208, 'sideways_use_sma': False, 'sideways_use_ema': False, 'sideways_use_atr': True, 'sideways_use_adx': False, 'sideways_use_spike': False, 'sideways_rsi_required': True}.
[I 2025-08-31 10:43:10,446] Trial 375 finished with values: [-1000000000.0, 1000000000.0] and parameters: {'p_sma': 18, 'p_std': 13, 'p_atr': 11, 'p_adx': 13, 'rsi_period': 48, 'ema1': 13, 'ema2': 58, 'slip_atr_k': 0.11699410382719153, 'slip_spread_k': 0.45164144502462367, 'spread_hl_frac': 0.03722708009507059, 'bb_std_mult': 2.6040566014725735, 'rsi_os': 25, 'rsi_ob': 50, 'vol_spike': 0.23599653921810132, 'adx_thresh': 28.420689879722264, 'atr_min_pct': 0.007304285657960045, 'atr_max_pct': 0.13383012432396293, 'tp_mult': 2.892738451739838, 'tsl_mult': 0.2902508743062959, 'strategy': 'breakout', 'time_stop': 78, 'use_sma': True, 'use_atr': False, 'use_adx': True, 'use_ema': True, 'use_spike': True, 'rsi_required': True, 'edge_k': 1.609793584731235, 'edge_cap': 0.4753076062165938, 'bull_strategy': 'breakout', 'bull_bb_std_mult': 1.473669901953256, 'bull_rsi_os': 13, 'bull_rsi_ob': 60, 'bull_adx_thresh': 8.26360780051963, 'bull_atr_min_pct': 0.017070630204922065, 'bull_atr_max_pct': 0.074683593575643, 'bull_tp_mult': 2.3733992358931624, 'bull_tsl_mult': 0.5205391699972907, 'bull_time_stop': 57, 'bull_use_sma': False, 'bull_use_ema': False, 'bull_use_atr': False, 'bull_use_adx': False, 'bull_use_spike': False, 'bull_rsi_required': True, 'bear_strategy': 'mean_reversion', 'bear_bb_std_mult': 2.471241063175618, 'bear_rsi_os': 11, 'bear_rsi_ob': 93, 'bear_adx_thresh': 6.891481005030586, 'bear_atr_min_pct': 0.02342249146098302, 'bear_atr_max_pct': 0.1265200974050011, 'bear_tp_mult': 2.8379135459242537, 'bear_tsl_mult': 0.8222777018615637, 'bear_time_stop': 180, 'bear_use_sma': False, 'bear_use_ema': False, 'bear_use_atr': True, 'bear_use_adx': False, 'bear_use_spike': False, 'bear_rsi_required': False, 'sideways_strategy': 'mean_reversion', 'sideways_bb_std_mult': 1.1970223893920104, 'sideways_rsi_os': 6, 'sideways_rsi_ob': 91, 'sideways_adx_thresh': 34.5212934815012, 'sideways_atr_min_pct': 0.01598193513460882, 'sideways_atr_max_pct': 0.13185064202200525, 'sideways_tp_mult': 1.9514700977083974, 'sideways_tsl_mult': 0.582468520318393, 'sideways_time_stop': 117, 'sideways_use_sma': False, 'sideways_use_ema': False, 'sideways_use_atr': True, 'sideways_use_adx': False, 'sideways_use_spike': False, 'sideways_rsi_required': True}.
[I 2025-08-31 10:43:10,535] Trial 373 finished with values: [-1000000000.0, 1000000000.0] and parameters: {'p_sma': 17, 'p_std': 32, 'p_atr': 11, 'p_adx': 13, 'rsi_period': 48, 'ema1': 8, 'ema2': 40, 'slip_atr_k': 0.1743786434846329, 'slip_spread_k': 0.6559569561411991, 'spread_hl_frac': 0.008147908896448255, 'bb_std_mult': 2.5628233107624174, 'rsi_os': 35, 'rsi_ob': 68, 'vol_spike': 0.2487930093824812, 'adx_thresh': 28.484950021693418, 'atr_min_pct': 0.006924024510599078, 'atr_max_pct': 0.09687572800397129, 'tp_mult': 2.9044789216162243, 'tsl_mult': 0.26603192252693364, 'strategy': 'breakout', 'time_stop': 79, 'use_sma': False, 'use_atr': False, 'use_adx': True, 'use_ema': True, 'use_spike': False, 'rsi_required': True, 'edge_k': 0.9829852855149603, 'edge_cap': 0.48021958392236275, 'bull_strategy': 'breakout', 'bull_bb_std_mult': 3.4748254121151225, 'bull_rsi_os': 13, 'bull_rsi_ob': 53, 'bull_adx_thresh': 8.484298318670271, 'bull_atr_min_pct': 0.017139449429491076, 'bull_atr_max_pct': 0.06747281691682516, 'bull_tp_mult': 1.7598817649710543, 'bull_tsl_mult': 0.3900458646774563, 'bull_time_stop': 57, 'bull_use_sma': False, 'bull_use_ema': False, 'bull_use_atr': False, 'bull_use_adx': True, 'bull_use_spike': False, 'bull_rsi_required': False, 'bear_strategy': 'breakout', 'bear_bb_std_mult': 2.440715600180803, 'bear_rsi_os': 11, 'bear_rsi_ob': 86, 'bear_adx_thresh': 5.449461202364083, 'bear_atr_min_pct': 0.00700164266114094, 'bear_atr_max_pct': 0.14182655500908928, 'bear_tp_mult': 2.79465667465855, 'bear_tsl_mult': 0.42527649331531925, 'bear_time_stop': 300, 'bear_use_sma': False, 'bear_use_ema': True, 'bear_use_atr': False, 'bear_use_adx': False, 'bear_use_spike': False, 'bear_rsi_required': False, 'sideways_strategy': 'mean_reversion', 'sideways_bb_std_mult': 2.8272533840912124, 'sideways_rsi_os': 6, 'sideways_rsi_ob': 94, 'sideways_adx_thresh': 7.330602745358348, 'sideways_atr_min_pct': 0.01823184615904967, 'sideways_atr_max_pct': 0.13244422434575842, 'sideways_tp_mult': 2.425110871983459, 'sideways_tsl_mult': 0.5905548336836595, 'sideways_time_stop': 287, 'sideways_use_sma': False, 'sideways_use_ema': False, 'sideways_use_atr': True, 'sideways_use_adx': False, 'sideways_use_spike': False, 'sideways_rsi_required': True}.
[I 2025-08-31 10:43:10,677] Trial 374 finished with values: [-1000000000.0, 1000000000.0] and parameters: {'p_sma': 16, 'p_std': 13, 'p_atr': 9, 'p_adx': 28, 'rsi_period': 48, 'ema1': 25, 'ema2': 25, 'slip_atr_k': 0.021081107328936356, 'slip_spread_k': 0.4677382911901189, 'spread_hl_frac': 0.008246511396510572, 'bb_std_mult': 1.915221242678051, 'rsi_os': 46, 'rsi_ob': 52, 'vol_spike': 0.17875366696310355, 'adx_thresh': 25.23995308237303, 'atr_min_pct': 0.007379332754108093, 'atr_max_pct': 0.14341713722611138, 'tp_mult': 2.0743368112732385, 'tsl_mult': 0.3265638006577318, 'strategy': 'breakout', 'time_stop': 78, 'use_sma': True, 'use_atr': False, 'use_adx': True, 'use_ema': True, 'use_spike': True, 'rsi_required': True, 'edge_k': 0.35992766232292284, 'edge_cap': 0.47890249742547836, 'bull_strategy': 'breakout', 'bull_bb_std_mult': 1.4362146365503754, 'bull_rsi_os': 15, 'bull_rsi_ob': 73, 'bull_adx_thresh': 8.576937323590338, 'bull_atr_min_pct': 0.007441320606121843, 'bull_atr_max_pct': 0.07531292154893075, 'bull_tp_mult': 2.637973549477566, 'bull_tsl_mult': 0.8431479407721018, 'bull_time_stop': 56, 'bull_use_sma': False, 'bull_use_ema': False, 'bull_use_atr': False, 'bull_use_adx': False, 'bull_use_spike': False, 'bull_rsi_required': True, 'bear_strategy': 'mean_reversion', 'bear_bb_std_mult': 2.4140436593410417, 'bear_rsi_os': 41, 'bear_rsi_ob': 87, 'bear_adx_thresh': 6.817701925864068, 'bear_atr_min_pct': 0.026925680125201953, 'bear_atr_max_pct': 0.1438785488513946, 'bear_tp_mult': 2.814820556788859, 'bear_tsl_mult': 0.46032086260331234, 'bear_time_stop': 21, 'bear_use_sma': False, 'bear_use_ema': True, 'bear_use_atr': False, 'bear_use_adx': False, 'bear_use_spike': False, 'bear_rsi_required': False, 'sideways_strategy': 'mean_reversion', 'sideways_bb_std_mult': 2.8140030426757345, 'sideways_rsi_os': 6, 'sideways_rsi_ob': 94, 'sideways_adx_thresh': 34.30160084592819, 'sideways_atr_min_pct': 0.018253923216685404, 'sideways_atr_max_pct': 0.04512045160533846, 'sideways_tp_mult': 2.5545680636620802, 'sideways_tsl_mult': 0.8657531773587899, 'sideways_time_stop': 125, 'sideways_use_sma': False, 'sideways_use_ema': False, 'sideways_use_atr': True, 'sideways_use_adx': False, 'sideways_use_spike': False, 'sideways_rsi_required': True}.
[I 2025-08-31 10:43:42,280] Trial 379 finished with values: [-1000000000.0, 1000000000.0] and parameters: {'p_sma': 19, 'p_std': 55, 'p_atr': 13, 'p_adx': 14, 'rsi_period': 80, 'ema1': 14, 'ema2': 36, 'slip_atr_k': 0.0066877183484748415, 'slip_spread_k': 0.9252306044562817, 'spread_hl_frac': 0.019587159542047095, 'bb_std_mult': 2.6756118681403613, 'rsi_os': 9, 'rsi_ob': 77, 'vol_spike': 0.15549210660745832, 'adx_thresh': 12.7341744962931, 'atr_min_pct': 0.006077087396721712, 'atr_max_pct': 0.09407684452416307, 'tp_mult': 2.4272697291083962, 'tsl_mult': 0.23189782220491462, 'strategy': 'breakout', 'time_stop': 113, 'use_sma': True, 'use_atr': False, 'use_adx': True, 'use_ema': False, 'use_spike': True, 'rsi_required': True, 'edge_k': 0.31402477057018985, 'edge_cap': 0.41134922121776263, 'bull_strategy': 'breakout', 'bull_bb_std_mult': 3.5978602375858704, 'bull_rsi_os': 34, 'bull_rsi_ob': 75, 'bull_adx_thresh': 5.798024258450063, 'bull_atr_min_pct': 0.019980932861688953, 'bull_atr_max_pct': 0.09391225723496047, 'bull_tp_mult': 2.053885325003968, 'bull_tsl_mult': 0.5831622398390852, 'bull_time_stop': 279, 'bull_use_sma': True, 'bull_use_ema': False, 'bull_use_atr': False, 'bull_use_adx': False, 'bull_use_spike': False, 'bull_rsi_required': True, 'bear_strategy': 'breakout', 'bear_bb_std_mult': 2.0514060504754026, 'bear_rsi_os': 45, 'bear_rsi_ob': 90, 'bear_adx_thresh': 8.342539319874692, 'bear_atr_min_pct': 0.0056003108760320245, 'bear_atr_max_pct': 0.1257436223733164, 'bear_tp_mult': 1.6109918429390877, 'bear_tsl_mult': 0.5876203265313095, 'bear_time_stop': 163, 'bear_use_sma': False, 'bear_use_ema': False, 'bear_use_atr': True, 'bear_use_adx': True, 'bear_use_spike': True, 'bear_rsi_required': True, 'sideways_strategy': 'mean_reversion', 'sideways_bb_std_mult': 0.7120369696406559, 'sideways_rsi_os': 8, 'sideways_rsi_ob': 91, 'sideways_adx_thresh': 19.76029984268381, 'sideways_atr_min_pct': 0.013993752994301023, 'sideways_atr_max_pct': 0.05009261048299297, 'sideways_tp_mult': 2.014911497168379, 'sideways_tsl_mult': 0.10272031668808257, 'sideways_time_stop': 200, 'sideways_use_sma': False, 'sideways_use_ema': False, 'sideways_use_atr': False, 'sideways_use_adx': False, 'sideways_use_spike': False, 'sideways_rsi_required': False}.
[I 2025-08-31 10:43:42,616] Trial 376 finished with values: [-1000000000.0, 1000000000.0] and parameters: {'p_sma': 18, 'p_std': 32, 'p_atr': 10, 'p_adx': 13, 'rsi_period': 52, 'ema1': 13, 'ema2': 58, 'slip_atr_k': 0.020508879074904673, 'slip_spread_k': 0.9124053944295123, 'spread_hl_frac': 0.01091345170922718, 'bb_std_mult': 2.6367647666363823, 'rsi_os': 25, 'rsi_ob': 85, 'vol_spike': 0.015475552974192092, 'adx_thresh': 11.854551685733156, 'atr_min_pct': 0.0010753952924699075, 'atr_max_pct': 0.13382347371342657, 'tp_mult': 2.4150480139107717, 'tsl_mult': 0.29100065113072937, 'strategy': 'breakout', 'time_stop': 79, 'use_sma': True, 'use_atr': False, 'use_adx': True, 'use_ema': False, 'use_spike': True, 'rsi_required': True, 'edge_k': 1.7184268175585715, 'edge_cap': 0.46433328594626305, 'bull_strategy': 'breakout', 'bull_bb_std_mult': 2.0950312262830284, 'bull_rsi_os': 17, 'bull_rsi_ob': 75, 'bull_adx_thresh': 8.548858278829254, 'bull_atr_min_pct': 0.009840308541268068, 'bull_atr_max_pct': 0.08122871717966779, 'bull_tp_mult': 2.639282611606637, 'bull_tsl_mult': 0.7950170665362991, 'bull_time_stop': 62, 'bull_use_sma': True, 'bull_use_ema': False, 'bull_use_atr': False, 'bull_use_adx': False, 'bull_use_spike': False, 'bull_rsi_required': True, 'bear_strategy': 'mean_reversion', 'bear_bb_std_mult': 2.434570984129007, 'bear_rsi_os': 54, 'bear_rsi_ob': 86, 'bear_adx_thresh': 6.975470895727729, 'bear_atr_min_pct': 0.018200422834855713, 'bear_atr_max_pct': 0.1257725306515498, 'bear_tp_mult': 2.8511804857313003, 'bear_tsl_mult': 0.5904346194652401, 'bear_time_stop': 21, 'bear_use_sma': False, 'bear_use_ema': False, 'bear_use_atr': True, 'bear_use_adx': True, 'bear_use_spike': True, 'bear_rsi_required': False, 'sideways_strategy': 'mean_reversion', 'sideways_bb_std_mult': 2.482188269787223, 'sideways_rsi_os': 6, 'sideways_rsi_ob': 94, 'sideways_adx_thresh': 16.158706811492586, 'sideways_atr_min_pct': 0.018069422378433498, 'sideways_atr_max_pct': 0.010407902214504189, 'sideways_tp_mult': 2.404527519308976, 'sideways_tsl_mult': 0.2757444396760685, 'sideways_time_stop': 121, 'sideways_use_sma': False, 'sideways_use_ema': False, 'sideways_use_atr': True, 'sideways_use_adx': False, 'sideways_use_spike': False, 'sideways_rsi_required': False}.
