[I 2025-08-31 11:19:31,130] Trial 656 finished with values: [-1000000000.0, 1000000000.0] and parameters: {'p_sma': 45, 'p_std': 27, 'p_atr': 25, 'p_adx': 16, 'rsi_period': 36, 'ema1': 29, 'ema2': 55, 'slip_atr_k': 0.012089012830775986, 'slip_spread_k': 0.7957208787610555, 'spread_hl_frac': 0.030230902657178982, 'bb_std_mult': 1.0787517932081423, 'rsi_os': 27, 'rsi_ob': 84, 'vol_spike': 0.2503556151032581, 'adx_thresh': 29.50595730753521, 'atr_min_pct': 0.007927804639421276, 'atr_max_pct': 0.06726229576024315, 'tp_mult': 1.229930638435203, 'tsl_mult': 0.4324790432344583, 'strategy': 'breakout', 'time_stop': 73, 'use_sma': True, 'use_atr': True, 'use_adx': False, 'use_ema': False, 'use_spike': True, 'rsi_required': True, 'edge_k': 0.2408933418017919, 'edge_cap': 0.38426854790998494, 'bull_strategy': 'breakout', 'bull_bb_std_mult': 0.7319522283401906, 'bull_rsi_os': 11, 'bull_rsi_ob': 80, 'bull_adx_thresh': 11.643737683256207, 'bull_atr_min_pct': 0.003712338943686725, 'bull_atr_max_pct': 0.09169298108461468, 'bull_tp_mult': 1.8715091261391297, 'bull_tsl_mult': 0.37993375787282285, 'bull_time_stop': 78, 'bull_use_sma': True, 'bull_use_ema': False, 'bull_use_atr': False, 'bull_use_adx': False, 'bull_use_spike': False, 'bull_rsi_required': False, 'bear_strategy': 'breakout', 'bear_bb_std_mult': 3.333567781691219, 'bear_rsi_os': 10, 'bear_rsi_ob': 85, 'bear_adx_thresh': 6.138548952740786, 'bear_atr_min_pct': 0.021144077608945707, 'bear_atr_max_pct': 0.13529256002858778, 'bear_tp_mult': 2.8726889557779813, 'bear_tsl_mult': 0.5827886144198873, 'bear_time_stop': 22, 'bear_use_sma': False, 'bear_use_ema': False, 'bear_use_atr': True, 'bear_use_adx': True, 'bear_use_spike': True, 'bear_rsi_required': False, 'sideways_strategy': 'mean_reversion', 'sideways_bb_std_mult': 3.535249497121707, 'sideways_rsi_os': 55, 'sideways_rsi_ob': 92, 'sideways_adx_thresh': 26.518195915791562, 'sideways_atr_min_pct': 0.020086434565802842, 'sideways_atr_max_pct': 0.0431544108909182, 'sideways_tp_mult': 2.184102751247476, 'sideways_tsl_mult': 0.6650148024214046, 'sideways_time_stop': 235, 'sideways_use_sma': False, 'sideways_use_ema': True, 'sideways_use_atr': False, 'sideways_use_adx': False, 'sideways_use_spike': False, 'sideways_rsi_required': True}.
[I 2025-08-31 11:19:31,529] Trial 657 finished with values: [-1000000000.0, 1000000000.0] and parameters: {'p_sma': 8, 'p_std': 11, 'p_atr': 22, 'p_adx': 16, 'rsi_period': 67, 'ema1': 10, 'ema2': 55, 'slip_atr_k': 0.022044241811150413, 'slip_spread_k': 0.6423492027288348, 'spread_hl_frac': 0.008145574524897843, 'bb_std_mult': 2.7331642346803013, 'rsi_os': 27, 'rsi_ob': 77, 'vol_spike': 0.2523292587135093, 'adx_thresh': 28.989457947411193, 'atr_min_pct': 0.018526857157657745, 'atr_max_pct': 0.067797990921251, 'tp_mult': 2.368586300257649, 'tsl_mult': 0.22639142373349425, 'strategy': 'breakout', 'time_stop': 75, 'use_sma': True, 'use_atr': True, 'use_adx': False, 'use_ema': False, 'use_spike': True, 'rsi_required': True, 'edge_k': 0.23173589556677673, 'edge_cap': 0.24509006665212246, 'bull_strategy': 'breakout', 'bull_bb_std_mult': 0.7302367199196318, 'bull_rsi_os': 11, 'bull_rsi_ob': 80, 'bull_adx_thresh': 14.192423184351522, 'bull_atr_min_pct': 0.0037194925889332494, 'bull_atr_max_pct': 0.09063737729044612, 'bull_tp_mult': 2.9114609638245863, 'bull_tsl_mult': 0.38419110865408707, 'bull_time_stop': 80, 'bull_use_sma': True, 'bull_use_ema': False, 'bull_use_atr': False, 'bull_use_adx': False, 'bull_use_spike': False, 'bull_rsi_required': False, 'bear_strategy': 'breakout', 'bear_bb_std_mult': 2.409853025827079, 'bear_rsi_os': 18, 'bear_rsi_ob': 85, 'bear_adx_thresh': 5.691878652240722, 'bear_atr_min_pct': 0.004434497000794492, 'bear_atr_max_pct': 0.13644786679164567, 'bear_tp_mult': 2.7996677867360074, 'bear_tsl_mult': 0.8841405206909823, 'bear_time_stop': 21, 'bear_use_sma': False, 'bear_use_ema': False, 'bear_use_atr': True, 'bear_use_adx': True, 'bear_use_spike': True, 'bear_rsi_required': False, 'sideways_strategy': 'mean_reversion', 'sideways_bb_std_mult': 3.540183265111619, 'sideways_rsi_os': 55, 'sideways_rsi_ob': 91, 'sideways_adx_thresh': 26.7720212203964, 'sideways_atr_min_pct': 0.019893661388002686, 'sideways_atr_max_pct': 0.03865302266225794, 'sideways_tp_mult': 2.211506377002405, 'sideways_tsl_mult': 0.9718360235219107, 'sideways_time_stop': 235, 'sideways_use_sma': False, 'sideways_use_ema': True, 'sideways_use_atr': True, 'sideways_use_adx': False, 'sideways_use_spike': False, 'sideways_rsi_required': True}.
[I 2025-08-31 11:20:04,131] Trial 662 finished with values: [-1000000000.0, 1000000000.0] and parameters: {'p_sma': 13, 'p_std': 29, 'p_atr': 20, 'p_adx': 12, 'rsi_period': 77, 'ema1': 13, 'ema2': 33, 'slip_atr_k': 0.02888649623681962, 'slip_spread_k': 0.6814082139235046, 'spread_hl_frac': 0.020140524835614262, 'bb_std_mult': 2.6077256075662265, 'rsi_os': 36, 'rsi_ob': 56, 'vol_spike': 0.28202302475026025, 'adx_thresh': 6.897748937744872, 'atr_min_pct': 0.006733267203938103, 'atr_max_pct': 0.04891963802386058, 'tp_mult': 2.429235379982449, 'tsl_mult': 0.2887182589195858, 'strategy': 'breakout', 'time_stop': 84, 'use_sma': False, 'use_atr': False, 'use_adx': True, 'use_ema': True, 'use_spike': False, 'rsi_required': False, 'edge_k': 1.6682648289341562, 'edge_cap': 0.162474240180699, 'bull_strategy': 'mean_reversion', 'bull_bb_std_mult': 0.9122895230224761, 'bull_rsi_os': 10, 'bull_rsi_ob': 67, 'bull_adx_thresh': 16.241562124035614, 'bull_atr_min_pct': 0.0029572879354249557, 'bull_atr_max_pct': 0.08329117725911148, 'bull_tp_mult': 1.6959315524081882, 'bull_tsl_mult': 0.3605625907921925, 'bull_time_stop': 88, 'bull_use_sma': False, 'bull_use_ema': False, 'bull_use_atr': True, 'bull_use_adx': True, 'bull_use_spike': True, 'bull_rsi_required': True, 'bear_strategy': 'mean_reversion', 'bear_bb_std_mult': 0.7797103837867654, 'bear_rsi_os': 31, 'bear_rsi_ob': 91, 'bear_adx_thresh': 7.047481861418623, 'bear_atr_min_pct': 0.005265309264465965, 'bear_atr_max_pct': 0.14259648701649125, 'bear_tp_mult': 1.5858049300863455, 'bear_tsl_mult': 0.38242681936508827, 'bear_time_stop': 30, 'bear_use_sma': True, 'bear_use_ema': True, 'bear_use_atr': False, 'bear_use_adx': False, 'bear_use_spike': False, 'bear_rsi_required': False, 'sideways_strategy': 'breakout', 'sideways_bb_std_mult': 3.03641569862476, 'sideways_rsi_os': 6, 'sideways_rsi_ob': 93, 'sideways_adx_thresh': 11.126376141035164, 'sideways_atr_min_pct': 0.0020911212240734486, 'sideways_atr_max_pct': 0.034515425272215836, 'sideways_tp_mult': 2.019915342606339, 'sideways_tsl_mult': 0.45401237958297586, 'sideways_time_stop': 35, 'sideways_use_sma': False, 'sideways_use_ema': False, 'sideways_use_atr': False, 'sideways_use_adx': True, 'sideways_use_spike': True, 'sideways_rsi_required': False}.
[I 2025-08-31 11:20:04,378] Trial 661 finished with values: [-1000000000.0, 1000000000.0] and parameters: {'p_sma': 13, 'p_std': 25, 'p_atr': 12, 'p_adx': 13, 'rsi_period': 7, 'ema1': 13, 'ema2': 50, 'slip_atr_k': 0.08754887231816015, 'slip_spread_k': 0.6416414717646377, 'spread_hl_frac': 0.040737483352310505, 'bb_std_mult': 3.1052303351265973, 'rsi_os': 25, 'rsi_ob': 56, 'vol_spike': 0.1285417470431415, 'adx_thresh': 33.492016521178144, 'atr_min_pct': 0.006895960525346376, 'atr_max_pct': 0.13024138320670353, 'tp_mult': 2.5260827821313634, 'tsl_mult': 0.228094576941973, 'strategy': 'breakout', 'time_stop': 65, 'use_sma': True, 'use_atr': False, 'use_adx': True, 'use_ema': True, 'use_spike': True, 'rsi_required': False, 'edge_k': 1.6676467950615916, 'edge_cap': 0.4490714776586109, 'bull_strategy': 'mean_reversion', 'bull_bb_std_mult': 2.1813719689070834, 'bull_rsi_os': 10, 'bull_rsi_ob': 79, 'bull_adx_thresh': 16.155927470713177, 'bull_atr_min_pct': 0.0029380266988237305, 'bull_atr_max_pct': 0.08296320683920562, 'bull_tp_mult': 2.87131984501129, 'bull_tsl_mult': 0.5236219538358451, 'bull_time_stop': 153, 'bull_use_sma': True, 'bull_use_ema': False, 'bull_use_atr': False, 'bull_use_adx': False, 'bull_use_spike': True, 'bull_rsi_required': True, 'bear_strategy': 'mean_reversion', 'bear_bb_std_mult': 2.1925686127212503, 'bear_rsi_os': 40, 'bear_rsi_ob': 91, 'bear_adx_thresh': 7.062799950783238, 'bear_atr_min_pct': 0.005321236868690895, 'bear_atr_max_pct': 0.13262614786875934, 'bear_tp_mult': 2.7746402892686115, 'bear_tsl_mult': 0.5589929574875111, 'bear_time_stop': 151, 'bear_use_sma': True, 'bear_use_ema': True, 'bear_use_atr': False, 'bear_use_adx': False, 'bear_use_spike': True, 'bear_rsi_required': False, 'sideways_strategy': 'breakout', 'sideways_bb_std_mult': 2.620533519913993, 'sideways_rsi_os': 6, 'sideways_rsi_ob': 93, 'sideways_adx_thresh': 27.684795957076613, 'sideways_atr_min_pct': 0.02836193738051364, 'sideways_atr_max_pct': 0.03850661006192187, 'sideways_tp_mult': 2.031139926392609, 'sideways_tsl_mult': 0.45561999682040677, 'sideways_time_stop': 117, 'sideways_use_sma': False, 'sideways_use_ema': False, 'sideways_use_atr': True, 'sideways_use_adx': True, 'sideways_use_spike': True, 'sideways_rsi_required': False}.
[I 2025-08-31 11:20:04,553] Trial 659 finished with values: [-1000000000.0, 1000000000.0] and parameters: {'p_sma': 33, 'p_std': 25, 'p_atr': 26, 'p_adx': 16, 'rsi_period': 8, 'ema1': 20, 'ema2': 56, 'slip_atr_k': 0.1781334674728626, 'slip_spread_k': 0.642671677141315, 'spread_hl_frac': 0.030306668043575118, 'bb_std_mult': 2.7389015272865063, 'rsi_os': 10, 'rsi_ob': 76, 'vol_spike': 0.1253823646892233, 'adx_thresh': 28.907187075405144, 'atr_min_pct': 0.005828769405223882, 'atr_max_pct': 0.036876599783606294, 'tp_mult': 2.5294451105961144, 'tsl_mult': 0.2264959743711569, 'strategy': 'breakout', 'time_stop': 172, 'use_sma': True, 'use_atr': True, 'use_adx': False, 'use_ema': True, 'use_spike': True, 'rsi_required': False, 'edge_k': 0.20586635600976763, 'edge_cap': 0.37833233615227757, 'bull_strategy': 'breakout', 'bull_bb_std_mult': 0.7084812832807461, 'bull_rsi_os': 11, 'bull_rsi_ob': 84, 'bull_adx_thresh': 21.434807122527324, 'bull_atr_min_pct': 0.003069654559658317, 'bull_atr_max_pct': 0.08380606433141276, 'bull_tp_mult': 1.4077348888908492, 'bull_tsl_mult': 0.34594273183715135, 'bull_time_stop': 77, 'bull_use_sma': True, 'bull_use_ema': False, 'bull_use_atr': False, 'bull_use_adx': False, 'bull_use_spike': False, 'bull_rsi_required': False, 'bear_strategy': 'mean_reversion', 'bear_bb_std_mult': 1.694420161131473, 'bear_rsi_os': 44, 'bear_rsi_ob': 95, 'bear_adx_thresh': 11.608985513620748, 'bear_atr_min_pct': 0.02224304134218119, 'bear_atr_max_pct': 0.14277970193886125, 'bear_tp_mult': 2.849917169728107, 'bear_tsl_mult': 0.5657970676238867, 'bear_time_stop': 51, 'bear_use_sma': False, 'bear_use_ema': True, 'bear_use_atr': False, 'bear_use_adx': False, 'bear_use_spike': True, 'bear_rsi_required': False, 'sideways_strategy': 'mean_reversion', 'sideways_bb_std_mult': 2.6318104887834677, 'sideways_rsi_os': 14, 'sideways_rsi_ob': 92, 'sideways_adx_thresh': 14.919250719632567, 'sideways_atr_min_pct': 0.019809502686410293, 'sideways_atr_max_pct': 0.03866388995620983, 'sideways_tp_mult': 1.284072057159573, 'sideways_tsl_mult': 0.6642952017858681, 'sideways_time_stop': 45, 'sideways_use_sma': False, 'sideways_use_ema': True, 'sideways_use_atr': False, 'sideways_use_adx': False, 'sideways_use_spike': True, 'sideways_rsi_required': True}.
[I 2025-08-31 11:20:04,682] Trial 660 finished with values: [-1000000000.0, 1000000000.0] and parameters: {'p_sma': 13, 'p_std': 25, 'p_atr': 15, 'p_adx': 12, 'rsi_period': 45, 'ema1': 10, 'ema2': 56, 'slip_atr_k': 0.047659489884205694, 'slip_spread_k': 0.651046585690862, 'spread_hl_frac': 0.009331389000531045, 'bb_std_mult': 2.6014148864270092, 'rsi_os': 18, 'rsi_ob': 46, 'vol_spike': 0.12710023151903874, 'adx_thresh': 28.829302507169235, 'atr_min_pct': 0.012471099394085312, 'atr_max_pct': 0.10261313514741541, 'tp_mult': 2.4026443080832403, 'tsl_mult': 0.31636020536595555, 'strategy': 'breakout', 'time_stop': 64, 'use_sma': True, 'use_atr': True, 'use_adx': False, 'use_ema': False, 'use_spike': True, 'rsi_required': False, 'edge_k': 0.19873331865643382, 'edge_cap': 0.47851764703883287, 'bull_strategy': 'breakout', 'bull_bb_std_mult': 0.6565078151428335, 'bull_rsi_os': 12, 'bull_rsi_ob': 79, 'bull_adx_thresh': 15.888740965088068, 'bull_atr_min_pct': 0.0037400665664363304, 'bull_atr_max_pct': 0.027297860856611116, 'bull_tp_mult': 1.6912305633356262, 'bull_tsl_mult': 0.26024600018003197, 'bull_time_stop': 180, 'bull_use_sma': True, 'bull_use_ema': False, 'bull_use_atr': False, 'bull_use_adx': False, 'bull_use_spike': False, 'bull_rsi_required': True, 'bear_strategy': 'mean_reversion', 'bear_bb_std_mult': 3.3325465359543784, 'bear_rsi_os': 38, 'bear_rsi_ob': 95, 'bear_adx_thresh': 11.355704842226581, 'bear_atr_min_pct': 0.005308326028449816, 'bear_atr_max_pct': 0.1416890499862443, 'bear_tp_mult': 1.5831529575309307, 'bear_tsl_mult': 0.25874387686615635, 'bear_time_stop': 249, 'bear_use_sma': False, 'bear_use_ema': False, 'bear_use_atr': False, 'bear_use_adx': True, 'bear_use_spike': True, 'bear_rsi_required': False, 'sideways_strategy': 'mean_reversion', 'sideways_bb_std_mult': 3.5322836239339317, 'sideways_rsi_os': 55, 'sideways_rsi_ob': 92, 'sideways_adx_thresh': 27.661913714152934, 'sideways_atr_min_pct': 0.02764704288908852, 'sideways_atr_max_pct': 0.03925107634339783, 'sideways_tp_mult': 2.1720472217809363, 'sideways_tsl_mult': 0.6671212148248621, 'sideways_time_stop': 36, 'sideways_use_sma': False, 'sideways_use_ema': True, 'sideways_use_atr': False, 'sideways_use_adx': False, 'sideways_use_spike': True, 'sideways_rsi_required': False}.
[I 2025-08-31 11:20:36,567] Trial 666 finished with values: [-1000000000.0, 1000000000.0] and parameters: {'p_sma': 53, 'p_std': 29, 'p_atr': 12, 'p_adx': 20, 'rsi_period': 50, 'ema1': 8, 'ema2': 45, 'slip_atr_k': 0.005053988090498108, 'slip_spread_k': 0.4195991725790398, 'spread_hl_frac': 0.04981485551120593, 'bb_std_mult': 2.5163816245493833, 'rsi_os': 55, 'rsi_ob': 87, 'vol_spike': 0.26835662926707643, 'adx_thresh': 28.281785795677198, 'atr_min_pct': 0.005251817632702066, 'atr_max_pct': 0.07589603303175374, 'tp_mult': 1.8097763055287448, 'tsl_mult': 0.27661349995929146, 'strategy': 'breakout', 'time_stop': 190, 'use_sma': False, 'use_atr': False, 'use_adx': True, 'use_ema': True, 'use_spike': False, 'rsi_required': True, 'edge_k': 0.15862195101884188, 'edge_cap': 0.21341587619052715, 'bull_strategy': 'breakout', 'bull_bb_std_mult': 0.9566129644659311, 'bull_rsi_os': 12, 'bull_rsi_ob': 77, 'bull_adx_thresh': 7.29565708098403, 'bull_atr_min_pct': 0.004188967178690604, 'bull_atr_max_pct': 0.09838485807432162, 'bull_tp_mult': 1.9958385337736184, 'bull_tsl_mult': 0.3995625891379308, 'bull_time_stop': 45, 'bull_use_sma': False, 'bull_use_ema': True, 'bull_use_atr': True, 'bull_use_adx': True, 'bull_use_spike': False, 'bull_rsi_required': True, 'bear_strategy': 'breakout', 'bear_bb_std_mult': 2.551172476512341, 'bear_rsi_os': 28, 'bear_rsi_ob': 57, 'bear_adx_thresh': 33.24703773595645, 'bear_atr_min_pct': 0.010010083065995955, 'bear_atr_max_pct': 0.13047283315077085, 'bear_tp_mult': 2.743267033082621, 'bear_tsl_mult': 0.4863473537115749, 'bear_time_stop': 140, 'bear_use_sma': False, 'bear_use_ema': True, 'bear_use_atr': False, 'bear_use_adx': False, 'bear_use_spike': False, 'bear_rsi_required': True, 'sideways_strategy': 'mean_reversion', 'sideways_bb_std_mult': 2.5258957240695707, 'sideways_rsi_os': 9, 'sideways_rsi_ob': 91, 'sideways_adx_thresh': 24.119490607410647, 'sideways_atr_min_pct': 0.017040555079200236, 'sideways_atr_max_pct': 0.03497545987342176, 'sideways_tp_mult': 1.9180604764430869, 'sideways_tsl_mult': 0.31648638611420843, 'sideways_time_stop': 11, 'sideways_use_sma': False, 'sideways_use_ema': False, 'sideways_use_atr': False, 'sideways_use_adx': False, 'sideways_use_spike': False, 'sideways_rsi_required': True}.
[I 2025-08-31 11:20:37,141] Trial 665 finished with values: [-1000000000.0, 1000000000.0] and parameters: {'p_sma': 12, 'p_std': 29, 'p_atr': 15, 'p_adx': 20, 'rsi_period': 45, 'ema1': 30, 'ema2': 12, 'slip_atr_k': 0.1652569599627139, 'slip_spread_k': 0.6629547418940015, 'spread_hl_frac': 0.03221362004620804, 'bb_std_mult': 2.545337057824615, 'rsi_os': 18, 'rsi_ob': 79, 'vol_spike': 0.26749279355319167, 'adx_thresh': 28.47458154505219, 'atr_min_pct': 0.005352527776002981, 'atr_max_pct': 0.10320324365642664, 'tp_mult': 1.8199037887562648, 'tsl_mult': 0.874615594710201, 'strategy': 'breakout', 'time_stop': 57, 'use_sma': True, 'use_atr': False, 'use_adx': True, 'use_ema': True, 'use_spike': False, 'rsi_required': True, 'edge_k': 0.2913927171322561, 'edge_cap': 0.4753638300535779, 'bull_strategy': 'breakout', 'bull_bb_std_mult': 0.6371251972286446, 'bull_rsi_os': 12, 'bull_rsi_ob': 77, 'bull_adx_thresh': 22.66431117940682, 'bull_atr_min_pct': 0.004571634569732955, 'bull_atr_max_pct': 0.12166724006233623, 'bull_tp_mult': 1.6885214417236605, 'bull_tsl_mult': 0.9775868111955808, 'bull_time_stop': 44, 'bull_use_sma': True, 'bull_use_ema': True, 'bull_use_atr': False, 'bull_use_adx': False, 'bull_use_spike': False, 'bull_rsi_required': True, 'bear_strategy': 'breakout', 'bear_bb_std_mult': 1.9848787496349902, 'bear_rsi_os': 38, 'bear_rsi_ob': 57, 'bear_adx_thresh': 25.892053620271756, 'bear_atr_min_pct': 0.008116808526759261, 'bear_atr_max_pct': 0.12974249213951786, 'bear_tp_mult': 2.7479886189411666, 'bear_tsl_mult': 0.45777448386886666, 'bear_time_stop': 85, 'bear_use_sma': False, 'bear_use_ema': True, 'bear_use_atr': False, 'bear_use_adx': False, 'bear_use_spike': True, 'bear_rsi_required': True, 'sideways_strategy': 'mean_reversion', 'sideways_bb_std_mult': 2.5384052533857835, 'sideways_rsi_os': 11, 'sideways_rsi_ob': 92, 'sideways_adx_thresh': 26.230154050649137, 'sideways_atr_min_pct': 0.021154853709555853, 'sideways_atr_max_pct': 0.09596246328069463, 'sideways_tp_mult': 1.934364115577002, 'sideways_tsl_mult': 0.08699073707131925, 'sideways_time_stop': 16, 'sideways_use_sma': False, 'sideways_use_ema': False, 'sideways_use_atr': False, 'sideways_use_adx': False, 'sideways_use_spike': False, 'sideways_rsi_required': True}.
[I 2025-08-31 11:20:37,261] Trial 664 finished with values: [-1000000000.0, 1000000000.0] and parameters: {'p_sma': 16, 'p_std': 29, 'p_atr': 28, 'p_adx': 15, 'rsi_period': 82, 'ema1': 8, 'ema2': 46, 'slip_atr_k': 0.022082262266536805, 'slip_spread_k': 0.41995612022802253, 'spread_hl_frac': 0.03651033892636882, 'bb_std_mult': 2.734865233329397, 'rsi_os': 18, 'rsi_ob': 93, 'vol_spike': 0.039674499804012914, 'adx_thresh': 28.522056882989926, 'atr_min_pct': 0.012513383621724387, 'atr_max_pct': 0.09891272948045807, 'tp_mult': 2.4060943154503858, 'tsl_mult': 0.3128556476101154, 'strategy': 'breakout', 'time_stop': 62, 'use_sma': True, 'use_atr': False, 'use_adx': True, 'use_ema': True, 'use_spike': True, 'rsi_required': True, 'edge_k': 0.387182347914505, 'edge_cap': 0.47615677482533936, 'bull_strategy': 'breakout', 'bull_bb_std_mult': 2.7798713107644226, 'bull_rsi_os': 12, 'bull_rsi_ob': 76, 'bull_adx_thresh': 8.843667318491624, 'bull_atr_min_pct': 0.004813391555771533, 'bull_atr_max_pct': 0.10375934649110813, 'bull_tp_mult': 1.684728387112076, 'bull_tsl_mult': 0.3532878222901679, 'bull_time_stop': 44, 'bull_use_sma': True, 'bull_use_ema': True, 'bull_use_atr': False, 'bull_use_adx': False, 'bull_use_spike': False, 'bull_rsi_required': True, 'bear_strategy': 'breakout', 'bear_bb_std_mult': 2.5678568922159135, 'bear_rsi_os': 33, 'bear_rsi_ob': 58, 'bear_adx_thresh': 6.2727741939735235, 'bear_atr_min_pct': 0.018132909487540816, 'bear_atr_max_pct': 0.14133509638722533, 'bear_tp_mult': 1.2782293502760067, 'bear_tsl_mult': 0.4839157965237728, 'bear_time_stop': 50, 'bear_use_sma': False, 'bear_use_ema': True, 'bear_use_atr': False, 'bear_use_adx': False, 'bear_use_spike': True, 'bear_rsi_required': False, 'sideways_strategy': 'mean_reversion', 'sideways_bb_std_mult': 2.542584224349277, 'sideways_rsi_os': 9, 'sideways_rsi_ob': 92, 'sideways_adx_thresh': 23.804144475643536, 'sideways_atr_min_pct': 0.018400144389061686, 'sideways_atr_max_pct': 0.03489702852769394, 'sideways_tp_mult': 1.4207884635008252, 'sideways_tsl_mult': 0.24758909884601155, 'sideways_time_stop': 168, 'sideways_use_sma': False, 'sideways_use_ema': False, 'sideways_use_atr': False, 'sideways_use_adx': False, 'sideways_use_spike': False, 'sideways_rsi_required': True}.
