[I 2025-08-31 10:04:40,427] Trial 84 finished with values: [-1000000000.0, 1000000000.0] and parameters: {'p_sma': 52, 'p_std': 51, 'p_atr': 7, 'p_adx': 13, 'rsi_period': 44, 'ema1': 24, 'ema2': 53, 'slip_atr_k': 0.00019215438374819982, 'slip_spread_k': 0.4591524568042644, 'spread_hl_frac': 0.003981707834860248, 'bb_std_mult': 1.6373851097846368, 'rsi_os': 28, 'rsi_ob': 67, 'vol_spike': 0.12546820316305754, 'adx_thresh': 14.51875600100533, 'atr_min_pct': 0.003435572396680806, 'atr_max_pct': 0.1348136289984453, 'tp_mult': 1.8147611854312091, 'tsl_mult': 0.7490652350089966, 'strategy': 'mean_reversion', 'time_stop': 181, 'use_sma': False, 'use_atr': True, 'use_adx': False, 'use_ema': True, 'use_spike': False, 'rsi_required': False, 'edge_k': 1.0310699155810494, 'edge_cap': 0.6424610869339353, 'bull_strategy': 'breakout', 'bull_bb_std_mult': 1.4914019465967356, 'bull_rsi_os': 24, 'bull_rsi_ob': 67, 'bull_adx_thresh': 12.554918437924666, 'bull_atr_min_pct': 0.006506316238000687, 'bull_atr_max_pct': 0.10072710981277315, 'bull_tp_mult': 2.7658285245432292, 'bull_tsl_mult': 0.7019993265063654, 'bull_time_stop': 111, 'bull_use_sma': False, 'bull_use_ema': False, 'bull_use_atr': True, 'bull_use_adx': False, 'bull_use_spike': True, 'bull_rsi_required': True, 'bear_strategy': 'mean_reversion', 'bear_bb_std_mult': 3.2943142303638155, 'bear_rsi_os': 55, 'bear_rsi_ob': 50, 'bear_adx_thresh': 27.43502199506066, 'bear_atr_min_pct': 0.008452053333786654, 'bear_atr_max_pct': 0.12637246874514854, 'bear_tp_mult': 2.8246978052136744, 'bear_tsl_mult': 0.06841383791218053, 'bear_time_stop': 103, 'bear_use_sma': True, 'bear_use_ema': False, 'bear_use_atr': True, 'bear_use_adx': False, 'bear_use_spike': True, 'bear_rsi_required': True, 'sideways_strategy': 'mean_reversion', 'sideways_bb_std_mult': 2.4799357575643355, 'sideways_rsi_os': 29, 'sideways_rsi_ob': 66, 'sideways_adx_thresh': 28.294738887083312, 'sideways_atr_min_pct': 0.009492854859895507, 'sideways_atr_max_pct': 0.10539764169391057, 'sideways_tp_mult': 1.7233280803564068, 'sideways_tsl_mult': 0.2509489164062389, 'sideways_time_stop': 162, 'sideways_use_sma': True, 'sideways_use_ema': True, 'sideways_use_atr': False, 'sideways_use_adx': True, 'sideways_use_spike': True, 'sideways_rsi_required': True}.
[I 2025-08-31 10:04:40,910] Trial 81 finished with values: [-1000000000.0, 1000000000.0] and parameters: {'p_sma': 55, 'p_std': 51, 'p_atr': 7, 'p_adx': 20, 'rsi_period': 39, 'ema1': 24, 'ema2': 53, 'slip_atr_k': 3.7830334455618564e-05, 'slip_spread_k': 0.9232433600954715, 'spread_hl_frac': 0.0054890259360797725, 'bb_std_mult': 1.6369695740043622, 'rsi_os': 23, 'rsi_ob': 60, 'vol_spike': 0.1281583075050103, 'adx_thresh': 12.735738919565875, 'atr_min_pct': 0.003596135886943857, 'atr_max_pct': 0.1134043055010918, 'tp_mult': 1.4566713622421474, 'tsl_mult': 0.7817379057076386, 'strategy': 'mean_reversion', 'time_stop': 63, 'use_sma': False, 'use_atr': True, 'use_adx': False, 'use_ema': True, 'use_spike': True, 'rsi_required': False, 'edge_k': 1.2867494985003973, 'edge_cap': 0.2456175139838539, 'bull_strategy': 'breakout', 'bull_bb_std_mult': 3.491106613053321, 'bull_rsi_os': 28, 'bull_rsi_ob': 67, 'bull_adx_thresh': 11.672415765701198, 'bull_atr_min_pct': 0.006225287745479556, 'bull_atr_max_pct': 0.11335009073945435, 'bull_tp_mult': 2.7609844618121406, 'bull_tsl_mult': 0.7431215705292007, 'bull_time_stop': 110, 'bull_use_sma': False, 'bull_use_ema': False, 'bull_use_atr': True, 'bull_use_adx': False, 'bull_use_spike': True, 'bull_rsi_required': True, 'bear_strategy': 'mean_reversion', 'bear_bb_std_mult': 3.334553848036892, 'bear_rsi_os': 26, 'bear_rsi_ob': 50, 'bear_adx_thresh': 22.607842771430132, 'bear_atr_min_pct': 0.007827569772011773, 'bear_atr_max_pct': 0.11428710304447463, 'bear_tp_mult': 2.707258863282637, 'bear_tsl_mult': 0.032538336985937305, 'bear_time_stop': 75, 'bear_use_sma': False, 'bear_use_ema': False, 'bear_use_atr': False, 'bear_use_adx': False, 'bear_use_spike': True, 'bear_rsi_required': True, 'sideways_strategy': 'breakout', 'sideways_bb_std_mult': 2.7098973782854188, 'sideways_rsi_os': 8, 'sideways_rsi_ob': 61, 'sideways_adx_thresh': 28.665525456387364, 'sideways_atr_min_pct': 0.011507057333722768, 'sideways_atr_max_pct': 0.086290689674001, 'sideways_tp_mult': 1.7375888752755502, 'sideways_tsl_mult': 0.1962706382824853, 'sideways_time_stop': 218, 'sideways_use_sma': True, 'sideways_use_ema': True, 'sideways_use_atr': False, 'sideways_use_adx': True, 'sideways_use_spike': True, 'sideways_rsi_required': True}.
[I 2025-08-31 10:04:40,953] Trial 83 finished with values: [-1000000000.0, 1000000000.0] and parameters: {'p_sma': 47, 'p_std': 58, 'p_atr': 7, 'p_adx': 14, 'rsi_period': 44, 'ema1': 10, 'ema2': 53, 'slip_atr_k': 0.001528511693517056, 'slip_spread_k': 0.46962300030578497, 'spread_hl_frac': 0.004136754373584342, 'bb_std_mult': 1.678120955283565, 'rsi_os': 23, 'rsi_ob': 57, 'vol_spike': 0.1523725917453636, 'adx_thresh': 12.755125485998558, 'atr_min_pct': 0.0029509030030365653, 'atr_max_pct': 0.1357314734995847, 'tp_mult': 1.8037965782500553, 'tsl_mult': 0.32432257645333284, 'strategy': 'mean_reversion', 'time_stop': 26, 'use_sma': False, 'use_atr': True, 'use_adx': False, 'use_ema': True, 'use_spike': False, 'rsi_required': False, 'edge_k': 1.0251863829677212, 'edge_cap': 0.6232524657891284, 'bull_strategy': 'breakout', 'bull_bb_std_mult': 3.1038170822981317, 'bull_rsi_os': 29, 'bull_rsi_ob': 67, 'bull_adx_thresh': 11.447087651293705, 'bull_atr_min_pct': 0.012565811270961059, 'bull_atr_max_pct': 0.11608646038536961, 'bull_tp_mult': 2.7470305258937353, 'bull_tsl_mult': 0.7061636425751102, 'bull_time_stop': 111, 'bull_use_sma': False, 'bull_use_ema': False, 'bull_use_atr': True, 'bull_use_adx': False, 'bull_use_spike': True, 'bull_rsi_required': True, 'bear_strategy': 'mean_reversion', 'bear_bb_std_mult': 3.261414443968052, 'bear_rsi_os': 52, 'bear_rsi_ob': 50, 'bear_adx_thresh': 27.486160921000135, 'bear_atr_min_pct': 0.007468316493736372, 'bear_atr_max_pct': 0.12097216348661347, 'bear_tp_mult': 2.5297833400984016, 'bear_tsl_mult': 0.13505632064930423, 'bear_time_stop': 105, 'bear_use_sma': True, 'bear_use_ema': False, 'bear_use_atr': True, 'bear_use_adx': False, 'bear_use_spike': True, 'bear_rsi_required': True, 'sideways_strategy': 'mean_reversion', 'sideways_bb_std_mult': 2.430728295162362, 'sideways_rsi_os': 29, 'sideways_rsi_ob': 62, 'sideways_adx_thresh': 28.51106523297969, 'sideways_atr_min_pct': 0.006890031573769025, 'sideways_atr_max_pct': 0.1022868787825924, 'sideways_tp_mult': 1.5228402947668265, 'sideways_tsl_mult': 0.18255356003991696, 'sideways_time_stop': 50, 'sideways_use_sma': True, 'sideways_use_ema': True, 'sideways_use_atr': False, 'sideways_use_adx': True, 'sideways_use_spike': True, 'sideways_rsi_required': True}.
[I 2025-08-31 10:04:41,090] Trial 82 finished with values: [-1000000000.0, 1000000000.0] and parameters: {'p_sma': 49, 'p_std': 51, 'p_atr': 7, 'p_adx': 25, 'rsi_period': 22, 'ema1': 24, 'ema2': 53, 'slip_atr_k': 0.0015390314738672022, 'slip_spread_k': 0.46103932783469204, 'spread_hl_frac': 0.005447537679550939, 'bb_std_mult': 1.641965796101673, 'rsi_os': 22, 'rsi_ob': 62, 'vol_spike': 0.1279654423412041, 'adx_thresh': 13.075684345227815, 'atr_min_pct': 0.003521509142129643, 'atr_max_pct': 0.13691522897911002, 'tp_mult': 1.8468694783230597, 'tsl_mult': 0.6182352581682709, 'strategy': 'mean_reversion', 'time_stop': 119, 'use_sma': False, 'use_atr': True, 'use_adx': False, 'use_ema': True, 'use_spike': True, 'rsi_required': False, 'edge_k': 0.9399991726128084, 'edge_cap': 0.6363822893251403, 'bull_strategy': 'breakout', 'bull_bb_std_mult': 3.4332115756554096, 'bull_rsi_os': 24, 'bull_rsi_ob': 57, 'bull_adx_thresh': 32.539454662510686, 'bull_atr_min_pct': 0.026835704906581916, 'bull_atr_max_pct': 0.11126662457606118, 'bull_tp_mult': 2.7676002749902917, 'bull_tsl_mult': 0.7087135932773714, 'bull_time_stop': 108, 'bull_use_sma': False, 'bull_use_ema': False, 'bull_use_atr': True, 'bull_use_adx': False, 'bull_use_spike': True, 'bull_rsi_required': True, 'bear_strategy': 'mean_reversion', 'bear_bb_std_mult': 3.404662635894632, 'bear_rsi_os': 26, 'bear_rsi_ob': 50, 'bear_adx_thresh': 18.943807041237385, 'bear_atr_min_pct': 0.007099122933139957, 'bear_atr_max_pct': 0.12669947708635143, 'bear_tp_mult': 2.7211792931986087, 'bear_tsl_mult': 0.07007081328226072, 'bear_time_stop': 78, 'bear_use_sma': False, 'bear_use_ema': False, 'bear_use_atr': False, 'bear_use_adx': False, 'bear_use_spike': True, 'bear_rsi_required': True, 'sideways_strategy': 'breakout', 'sideways_bb_std_mult': 2.486464571613133, 'sideways_rsi_os': 25, 'sideways_rsi_ob': 66, 'sideways_adx_thresh': 28.785418723749476, 'sideways_atr_min_pct': 0.004297980610507497, 'sideways_atr_max_pct': 0.10429265843332483, 'sideways_tp_mult': 2.3483233407217616, 'sideways_tsl_mult': 0.10211794762107182, 'sideways_time_stop': 54, 'sideways_use_sma': True, 'sideways_use_ema': True, 'sideways_use_atr': False, 'sideways_use_adx': True, 'sideways_use_spike': True, 'sideways_rsi_required': True}.
[I 2025-08-31 10:05:13,993] Trial 85 finished with values: [-1000000000.0, 1000000000.0] and parameters: {'p_sma': 48, 'p_std': 58, 'p_atr': 7, 'p_adx': 24, 'rsi_period': 22, 'ema1': 18, 'ema2': 52, 'slip_atr_k': 0.033262498642756336, 'slip_spread_k': 0.07793868148450522, 'spread_hl_frac': 0.0056347407466950114, 'bb_std_mult': 1.0175291582580466, 'rsi_os': 24, 'rsi_ob': 58, 'vol_spike': 0.15243604083675788, 'adx_thresh': 12.413952933475874, 'atr_min_pct': 0.001419781603489433, 'atr_max_pct': 0.03987211411163978, 'tp_mult': 1.4451846749190271, 'tsl_mult': 0.3335455511313286, 'strategy': 'mean_reversion', 'time_stop': 27, 'use_sma': False, 'use_atr': True, 'use_adx': True, 'use_ema': True, 'use_spike': False, 'rsi_required': False, 'edge_k': 1.159053062866517, 'edge_cap': 0.23713067182781605, 'bull_strategy': 'breakout', 'bull_bb_std_mult': 3.137772525948348, 'bull_rsi_os': 29, 'bull_rsi_ob': 61, 'bull_adx_thresh': 11.521610256293851, 'bull_atr_min_pct': 0.025932796222288758, 'bull_atr_max_pct': 0.13175139545670386, 'bull_tp_mult': 1.1690964309042018, 'bull_tsl_mult': 0.7962987219054449, 'bull_time_stop': 144, 'bull_use_sma': False, 'bull_use_ema': False, 'bull_use_atr': True, 'bull_use_adx': True, 'bull_use_spike': True, 'bull_rsi_required': False, 'bear_strategy': 'mean_reversion', 'bear_bb_std_mult': 3.2249998232247163, 'bear_rsi_os': 22, 'bear_rsi_ob': 53, 'bear_adx_thresh': 24.35519559394264, 'bear_atr_min_pct': 0.00704870082135943, 'bear_atr_max_pct': 0.1180969424771216, 'bear_tp_mult': 2.088468821981238, 'bear_tsl_mult': 0.16011175819837792, 'bear_time_stop': 127, 'bear_use_sma': True, 'bear_use_ema': False, 'bear_use_atr': True, 'bear_use_adx': False, 'bear_use_spike': True, 'bear_rsi_required': True, 'sideways_strategy': 'breakout', 'sideways_bb_std_mult': 2.900545556998548, 'sideways_rsi_os': 15, 'sideways_rsi_ob': 62, 'sideways_adx_thresh': 28.961046504667717, 'sideways_atr_min_pct': 0.006786499096087096, 'sideways_atr_max_pct': 0.06683009131171617, 'sideways_tp_mult': 1.5151425467167132, 'sideways_tsl_mult': 0.19665617060143598, 'sideways_time_stop': 54, 'sideways_use_sma': True, 'sideways_use_ema': True, 'sideways_use_atr': False, 'sideways_use_adx': True, 'sideways_use_spike': True, 'sideways_rsi_required': False}.
[I 2025-08-31 10:05:14,179] Trial 88 finished with values: [-1000000000.0, 1000000000.0] and parameters: {'p_sma': 58, 'p_std': 48, 'p_atr': 8, 'p_adx': 29, 'rsi_period': 24, 'ema1': 17, 'ema2': 58, 'slip_atr_k': 0.03461151361964612, 'slip_spread_k': 0.07602047650798144, 'spread_hl_frac': 0.008094940582375173, 'bb_std_mult': 1.7940246508330058, 'rsi_os': 25, 'rsi_ob': 52, 'vol_spike': 0.16142916485383604, 'adx_thresh': 10.653879001294607, 'atr_min_pct': 0.005659700349711493, 'atr_max_pct': 0.041250224349244774, 'tp_mult': 2.1574239253381844, 'tsl_mult': 0.8493586763706892, 'strategy': 'mean_reversion', 'time_stop': 81, 'use_sma': False, 'use_atr': False, 'use_adx': True, 'use_ema': True, 'use_spike': False, 'rsi_required': False, 'edge_k': 1.1930391480958358, 'edge_cap': 0.32203535397708083, 'bull_strategy': 'mean_reversion', 'bull_bb_std_mult': 0.5090175054330395, 'bull_rsi_os': 33, 'bull_rsi_ob': 65, 'bull_adx_thresh': 14.970755281184966, 'bull_atr_min_pct': 0.0051265468816020085, 'bull_atr_max_pct': 0.13115195763710902, 'bull_tp_mult': 2.6666075188878446, 'bull_tsl_mult': 0.7897259091324632, 'bull_time_stop': 165, 'bull_use_sma': True, 'bull_use_ema': True, 'bull_use_atr': True, 'bull_use_adx': True, 'bull_use_spike': True, 'bull_rsi_required': False, 'bear_strategy': 'breakout', 'bear_bb_std_mult': 2.945888993434223, 'bear_rsi_os': 21, 'bear_rsi_ob': 53, 'bear_adx_thresh': 25.933262083863934, 'bear_atr_min_pct': 0.013786766104989053, 'bear_atr_max_pct': 0.10195888800263407, 'bear_tp_mult': 2.0605944609746323, 'bear_tsl_mult': 0.1837407463650244, 'bear_time_stop': 88, 'bear_use_sma': True, 'bear_use_ema': False, 'bear_use_atr': True, 'bear_use_adx': False, 'bear_use_spike': False, 'bear_rsi_required': True, 'sideways_strategy': 'mean_reversion', 'sideways_bb_std_mult': 2.9601622499826874, 'sideways_rsi_os': 33, 'sideways_rsi_ob': 57, 'sideways_adx_thresh': 30.5198996414401, 'sideways_atr_min_pct': 0.014093739776227488, 'sideways_atr_max_pct': 0.09728913632197277, 'sideways_tp_mult': 1.8039240770863505, 'sideways_tsl_mult': 0.270062977408993, 'sideways_time_stop': 187, 'sideways_use_sma': True, 'sideways_use_ema': True, 'sideways_use_atr': True, 'sideways_use_adx': True, 'sideways_use_spike': True, 'sideways_rsi_required': False}.
[I 2025-08-31 10:05:14,279] Trial 87 finished with values: [-1000000000.0, 1000000000.0] and parameters: {'p_sma': 58, 'p_std': 56, 'p_atr': 10, 'p_adx': 25, 'rsi_period': 22, 'ema1': 16, 'ema2': 58, 'slip_atr_k': 0.032016394182260155, 'slip_spread_k': 0.07533703298871094, 'spread_hl_frac': 0.008766738112447893, 'bb_std_mult': 1.7768507267937415, 'rsi_os': 24, 'rsi_ob': 51, 'vol_spike': 0.1569142152208361, 'adx_thresh': 13.522615719674425, 'atr_min_pct': 0.0046227815550915746, 'atr_max_pct': 0.04010590755269232, 'tp_mult': 2.6945036528461666, 'tsl_mult': 0.7986595031384197, 'strategy': 'mean_reversion', 'time_stop': 50, 'use_sma': False, 'use_atr': False, 'use_adx': True, 'use_ema': True, 'use_spike': False, 'rsi_required': False, 'edge_k': 1.1323708863527304, 'edge_cap': 0.2348148915408031, 'bull_strategy': 'breakout', 'bull_bb_std_mult': 2.122471975823895, 'bull_rsi_os': 32, 'bull_rsi_ob': 61, 'bull_adx_thresh': 33.38257770680209, 'bull_atr_min_pct': 0.004659859008839146, 'bull_atr_max_pct': 0.12467895879972209, 'bull_tp_mult': 2.8361211396528208, 'bull_tsl_mult': 0.8043850728670663, 'bull_time_stop': 141, 'bull_use_sma': True, 'bull_use_ema': False, 'bull_use_atr': True, 'bull_use_adx': True, 'bull_use_spike': True, 'bull_rsi_required': False, 'bear_strategy': 'mean_reversion', 'bear_bb_std_mult': 2.978217772029253, 'bear_rsi_os': 22, 'bear_rsi_ob': 90, 'bear_adx_thresh': 24.087057172735207, 'bear_atr_min_pct': 0.01353000123454698, 'bear_atr_max_pct': 0.10777244271369976, 'bear_tp_mult': 2.2427710225518678, 'bear_tsl_mult': 0.21814082565846887, 'bear_time_stop': 126, 'bear_use_sma': True, 'bear_use_ema': False, 'bear_use_atr': True, 'bear_use_adx': False, 'bear_use_spike': False, 'bear_rsi_required': True, 'sideways_strategy': 'mean_reversion', 'sideways_bb_std_mult': 3.184338121982659, 'sideways_rsi_os': 25, 'sideways_rsi_ob': 57, 'sideways_adx_thresh': 25.63973242027993, 'sideways_atr_min_pct': 0.005582688124577314, 'sideways_atr_max_pct': 0.09780039481971305, 'sideways_tp_mult': 1.7966803107557132, 'sideways_tsl_mult': 0.2564005368654105, 'sideways_time_stop': 147, 'sideways_use_sma': True, 'sideways_use_ema': True, 'sideways_use_atr': False, 'sideways_use_adx': True, 'sideways_use_spike': True, 'sideways_rsi_required': False}.
[I 2025-08-31 10:05:14,404] Trial 86 finished with values: [-1000000000.0, 1000000000.0] and parameters: {'p_sma': 48, 'p_std': 49, 'p_atr': 10, 'p_adx': 29, 'rsi_period': 17, 'ema1': 10, 'ema2': 58, 'slip_atr_k': 0.031793320050332245, 'slip_spread_k': 0.0022727272838364287, 'spread_hl_frac': 0.00809159849371039, 'bb_std_mult': 1.7507124396616516, 'rsi_os': 24, 'rsi_ob': 58, 'vol_spike': 0.15161119956810018, 'adx_thresh': 13.258564293513468, 'atr_min_pct': 0.0017697498613384972, 'atr_max_pct': 0.04101229661980441, 'tp_mult': 2.1581246441325526, 'tsl_mult': 0.32922458931630105, 'strategy': 'mean_reversion', 'time_stop': 51, 'use_sma': False, 'use_atr': False, 'use_adx': True, 'use_ema': True, 'use_spike': False, 'rsi_required': False, 'edge_k': 1.1306548935475107, 'edge_cap': 0.3376576868817255, 'bull_strategy': 'breakout', 'bull_bb_std_mult': 3.127200384418845, 'bull_rsi_os': 30, 'bull_rsi_ob': 45, 'bull_adx_thresh': 15.145544954493584, 'bull_atr_min_pct': 0.003159429247055222, 'bull_atr_max_pct': 0.11555916739619487, 'bull_tp_mult': 2.679591547581813, 'bull_tsl_mult': 0.795143621572054, 'bull_time_stop': 163, 'bull_use_sma': False, 'bull_use_ema': False, 'bull_use_atr': True, 'bull_use_adx': True, 'bull_use_spike': True, 'bull_rsi_required': False, 'bear_strategy': 'mean_reversion', 'bear_bb_std_mult': 3.206949226426674, 'bear_rsi_os': 22, 'bear_rsi_ob': 90, 'bear_adx_thresh': 24.1443763319296, 'bear_atr_min_pct': 0.00012073508496187983, 'bear_atr_max_pct': 0.1192715730727879, 'bear_tp_mult': 2.5173799088310362, 'bear_tsl_mult': 0.1394748179534075, 'bear_time_stop': 126, 'bear_use_sma': True, 'bear_use_ema': False, 'bear_use_atr': True, 'bear_use_adx': False, 'bear_use_spike': False, 'bear_rsi_required': True, 'sideways_strategy': 'mean_reversion', 'sideways_bb_std_mult': 2.994505710867127, 'sideways_rsi_os': 46, 'sideways_rsi_ob': 55, 'sideways_adx_thresh': 25.811950509445253, 'sideways_atr_min_pct': 0.007356661463986062, 'sideways_atr_max_pct': 0.06542453925725897, 'sideways_tp_mult': 1.5530755426137022, 'sideways_tsl_mult': 0.1737427115327687, 'sideways_time_stop': 60, 'sideways_use_sma': True, 'sideways_use_ema': True, 'sideways_use_atr': False, 'sideways_use_adx': True, 'sideways_use_spike': True, 'sideways_rsi_required': False}.
[I 2025-08-31 10:05:14,736] Trial 92 finished with values: [-1000000000.0, 1000000000.0] and parameters: {'p_sma': 41, 'p_std': 53, 'p_atr': 24, 'p_adx': 30, 'rsi_period': 41, 'ema1': 20, 'ema2': 47, 'slip_atr_k': 0.047228020102502904, 'slip_spread_k': 0.5106078093903592, 'spread_hl_frac': 0.01226514065076708, 'bb_std_mult': 2.699711989314759, 'rsi_os': 19, 'rsi_ob': 65, 'vol_spike': 0.192629736521995, 'adx_thresh': 14.881008520036417, 'atr_min_pct': 0.011719160208601814, 'atr_max_pct': 0.010081900728415652, 'tp_mult': 2.5245225910694935, 'tsl_mult': 0.12471720267879194, 'strategy': 'breakout', 'time_stop': 17, 'use_sma': False, 'use_atr': False, 'use_adx': True, 'use_ema': True, 'use_spike': False, 'rsi_required': False, 'edge_k': 1.3691958955375814, 'edge_cap': 0.5371370881711589, 'bull_strategy': 'mean_reversion', 'bull_bb_std_mult': 1.8533816974957096, 'bull_rsi_os': 25, 'bull_rsi_ob': 53, 'bull_adx_thresh': 5.305128582455559, 'bull_atr_min_pct': 0.008618213523762368, 'bull_atr_max_pct': 0.041899349814104626, 'bull_tp_mult': 2.609654021031742, 'bull_tsl_mult': 0.6332732374707216, 'bull_time_stop': 102, 'bull_use_sma': False, 'bull_use_ema': True, 'bull_use_atr': True, 'bull_use_adx': True, 'bull_use_spike': True, 'bull_rsi_required': False, 'bear_strategy': 'breakout', 'bear_bb_std_mult': 3.0548639982363124, 'bear_rsi_os': 31, 'bear_rsi_ob': 56, 'bear_adx_thresh': 29.419851237814214, 'bear_atr_min_pct': 0.009446208530904431, 'bear_atr_max_pct': 0.14305569097920728, 'bear_tp_mult': 2.6527225524573237, 'bear_tsl_mult': 0.8476426641098315, 'bear_time_stop': 48, 'bear_use_sma': True, 'bear_use_ema': False, 'bear_use_atr': True, 'bear_use_adx': False, 'bear_use_spike': True, 'bear_rsi_required': True, 'sideways_strategy': 'mean_reversion', 'sideways_bb_std_mult': 0.7614221204447529, 'sideways_rsi_os': 36, 'sideways_rsi_ob': 72, 'sideways_adx_thresh': 27.792886325985044, 'sideways_atr_min_pct': 0.0013098377320669135, 'sideways_atr_max_pct': 0.0904324011262001, 'sideways_tp_mult': 1.4756227395997046, 'sideways_tsl_mult': 0.22750044862479116, 'sideways_time_stop': 97, 'sideways_use_sma': False, 'sideways_use_ema': True, 'sideways_use_atr': True, 'sideways_use_adx': True, 'sideways_use_spike': True, 'sideways_rsi_required': False}.
