[I 2025-08-31 10:38:57,738] Trial 345 finished with values: [-1000000000.0, 1000000000.0] and parameters: {'p_sma': 46, 'p_std': 28, 'p_atr': 12, 'p_adx': 14, 'rsi_period': 49, 'ema1': 12, 'ema2': 56, 'slip_atr_k': 0.21853270878969075, 'slip_spread_k': 0.7089159583698784, 'spread_hl_frac': 0.008665916840449341, 'bb_std_mult': 2.6761727719320976, 'rsi_os': 50, 'rsi_ob': 78, 'vol_spike': 0.18460245287554664, 'adx_thresh': 13.640426130034939, 'atr_min_pct': 0.00686571313832469, 'atr_max_pct': 0.10843397248096996, 'tp_mult': 2.7403337637403524, 'tsl_mult': 0.32017728217642943, 'strategy': 'mean_reversion', 'time_stop': 79, 'use_sma': True, 'use_atr': False, 'use_adx': True, 'use_ema': True, 'use_spike': False, 'rsi_required': True, 'edge_k': 0.40800889384823746, 'edge_cap': 0.45525047432635124, 'bull_strategy': 'mean_reversion', 'bull_bb_std_mult': 3.561341089124377, 'bull_rsi_os': 5, 'bull_rsi_ob': 75, 'bull_adx_thresh': 5.683516868338223, 'bull_atr_min_pct': 0.012990036250821539, 'bull_atr_max_pct': 0.08956105209214026, 'bull_tp_mult': 1.752741325060021, 'bull_tsl_mult': 0.38936170037047035, 'bull_time_stop': 73, 'bull_use_sma': True, 'bull_use_ema': False, 'bull_use_atr': False, 'bull_use_adx': False, 'bull_use_spike': False, 'bull_rsi_required': False, 'bear_strategy': 'breakout', 'bear_bb_std_mult': 2.1913643798977733, 'bear_rsi_os': 50, 'bear_rsi_ob': 78, 'bear_adx_thresh': 7.771940249613355, 'bear_atr_min_pct': 0.006006612006873869, 'bear_atr_max_pct': 0.12496523741972924, 'bear_tp_mult': 2.387107610585016, 'bear_tsl_mult': 0.22780675286938684, 'bear_time_stop': 22, 'bear_use_sma': False, 'bear_use_ema': True, 'bear_use_atr': True, 'bear_use_adx': False, 'bear_use_spike': True, 'bear_rsi_required': False, 'sideways_strategy': 'mean_reversion', 'sideways_bb_std_mult': 3.3512321543955803, 'sideways_rsi_os': 7, 'sideways_rsi_ob': 93, 'sideways_adx_thresh': 27.714065246323464, 'sideways_atr_min_pct': 0.01647578004969438, 'sideways_atr_max_pct': 0.051524741822578296, 'sideways_tp_mult': 1.9784655506999456, 'sideways_tsl_mult': 0.3089116199960691, 'sideways_time_stop': 24, 'sideways_use_sma': True, 'sideways_use_ema': False, 'sideways_use_atr': False, 'sideways_use_adx': False, 'sideways_use_spike': False, 'sideways_rsi_required': True}.
[I 2025-08-31 10:39:26,781] Trial 342 finished with values: [-1000000000.0, 1000000000.0] and parameters: {'p_sma': 41, 'p_std': 29, 'p_atr': 11, 'p_adx': 14, 'rsi_period': 49, 'ema1': 12, 'ema2': 58, 'slip_atr_k': 0.21974671365961507, 'slip_spread_k': 0.7072305901557066, 'spread_hl_frac': 0.008224857176727027, 'bb_std_mult': 2.2502250394180456, 'rsi_os': 43, 'rsi_ob': 78, 'vol_spike': 0.22869209686642167, 'adx_thresh': 10.635064573351134, 'atr_min_pct': 0.005806578036858899, 'atr_max_pct': 0.12200104079364117, 'tp_mult': 2.455245674925166, 'tsl_mult': 0.25383819319839657, 'strategy': 'breakout', 'time_stop': 70, 'use_sma': False, 'use_atr': False, 'use_adx': True, 'use_ema': True, 'use_spike': False, 'rsi_required': True, 'edge_k': 1.38433915575103, 'edge_cap': 0.45816151459010684, 'bull_strategy': 'breakout', 'bull_bb_std_mult': 2.821153949624729, 'bull_rsi_os': 12, 'bull_rsi_ob': 75, 'bull_adx_thresh': 6.6082663357983655, 'bull_atr_min_pct': 0.0038371306128152896, 'bull_atr_max_pct': 0.09045584589371572, 'bull_tp_mult': 1.7330440052254963, 'bull_tsl_mult': 0.38931787952473323, 'bull_time_stop': 221, 'bull_use_sma': True, 'bull_use_ema': False, 'bull_use_atr': False, 'bull_use_adx': False, 'bull_use_spike': False, 'bull_rsi_required': False, 'bear_strategy': 'mean_reversion', 'bear_bb_std_mult': 2.273478469110375, 'bear_rsi_os': 50, 'bear_rsi_ob': 87, 'bear_adx_thresh': 8.423013463097835, 'bear_atr_min_pct': 0.0076153443686693394, 'bear_atr_max_pct': 0.1331761123989521, 'bear_tp_mult': 1.7615794151729687, 'bear_tsl_mult': 0.5489726955830547, 'bear_time_stop': 30, 'bear_use_sma': True, 'bear_use_ema': True, 'bear_use_atr': True, 'bear_use_adx': False, 'bear_use_spike': True, 'bear_rsi_required': False, 'sideways_strategy': 'mean_reversion', 'sideways_bb_std_mult': 2.7459681433603578, 'sideways_rsi_os': 6, 'sideways_rsi_ob': 91, 'sideways_adx_thresh': 25.457268550275444, 'sideways_atr_min_pct': 0.016318246472172473, 'sideways_atr_max_pct': 0.07829886440410123, 'sideways_tp_mult': 1.740582121079887, 'sideways_tsl_mult': 0.813471060459365, 'sideways_time_stop': 25, 'sideways_use_sma': False, 'sideways_use_ema': False, 'sideways_use_atr': True, 'sideways_use_adx': False, 'sideways_use_spike': False, 'sideways_rsi_required': True}.
[I 2025-08-31 10:39:26,995] Trial 344 finished with values: [-1000000000.0, 1000000000.0] and parameters: {'p_sma': 47, 'p_std': 29, 'p_atr': 13, 'p_adx': 14, 'rsi_period': 84, 'ema1': 14, 'ema2': 56, 'slip_atr_k': 0.1515272518370372, 'slip_spread_k': 0.7026573341248967, 'spread_hl_frac': 0.008542388049181223, 'bb_std_mult': 2.658366678201082, 'rsi_os': 27, 'rsi_ob': 78, 'vol_spike': 0.2270395283636394, 'adx_thresh': 28.747458021185878, 'atr_min_pct': 0.006712880663428456, 'atr_max_pct': 0.09589984398840791, 'tp_mult': 2.4615713720341623, 'tsl_mult': 0.25903291843838216, 'strategy': 'breakout', 'time_stop': 69, 'use_sma': False, 'use_atr': False, 'use_adx': True, 'use_ema': True, 'use_spike': False, 'rsi_required': True, 'edge_k': 0.40438815460654065, 'edge_cap': 0.45447905572622094, 'bull_strategy': 'breakout', 'bull_bb_std_mult': 1.5395780081959378, 'bull_rsi_os': 12, 'bull_rsi_ob': 75, 'bull_adx_thresh': 6.538232496211198, 'bull_atr_min_pct': 0.010781863996018663, 'bull_atr_max_pct': 0.08535909577424365, 'bull_tp_mult': 1.7277745604191432, 'bull_tsl_mult': 0.3858895028480729, 'bull_time_stop': 75, 'bull_use_sma': True, 'bull_use_ema': False, 'bull_use_atr': False, 'bull_use_adx': False, 'bull_use_spike': False, 'bull_rsi_required': False, 'bear_strategy': 'breakout', 'bear_bb_std_mult': 2.2550245887219234, 'bear_rsi_os': 13, 'bear_rsi_ob': 80, 'bear_adx_thresh': 7.967163530110653, 'bear_atr_min_pct': 0.005894974339962292, 'bear_atr_max_pct': 0.12485702162579951, 'bear_tp_mult': 1.8133744360457182, 'bear_tsl_mult': 0.5420611695573142, 'bear_time_stop': 31, 'bear_use_sma': False, 'bear_use_ema': True, 'bear_use_atr': True, 'bear_use_adx': False, 'bear_use_spike': True, 'bear_rsi_required': False, 'sideways_strategy': 'mean_reversion', 'sideways_bb_std_mult': 2.6927131523063266, 'sideways_rsi_os': 7, 'sideways_rsi_ob': 93, 'sideways_adx_thresh': 25.443359168003358, 'sideways_atr_min_pct': 0.016526780244741208, 'sideways_atr_max_pct': 0.04835560299031539, 'sideways_tp_mult': 1.983180590301904, 'sideways_tsl_mult': 0.3631750855423749, 'sideways_time_stop': 26, 'sideways_use_sma': False, 'sideways_use_ema': False, 'sideways_use_atr': False, 'sideways_use_adx': False, 'sideways_use_spike': False, 'sideways_rsi_required': True}.
[I 2025-08-31 10:39:27,386] Trial 343 finished with values: [-1000000000.0, 1000000000.0] and parameters: {'p_sma': 16, 'p_std': 29, 'p_atr': 11, 'p_adx': 14, 'rsi_period': 49, 'ema1': 14, 'ema2': 26, 'slip_atr_k': 0.15098226651119592, 'slip_spread_k': 0.7130102281987987, 'spread_hl_frac': 0.008577549881313403, 'bb_std_mult': 2.6621741438486213, 'rsi_os': 27, 'rsi_ob': 77, 'vol_spike': 0.22818623154337725, 'adx_thresh': 28.6583076018393, 'atr_min_pct': 0.02560397293918569, 'atr_max_pct': 0.1316680040306036, 'tp_mult': 2.4529432249559777, 'tsl_mult': 0.2535873142607431, 'strategy': 'breakout', 'time_stop': 70, 'use_sma': False, 'use_atr': False, 'use_adx': True, 'use_ema': True, 'use_spike': False, 'rsi_required': True, 'edge_k': 1.3037480166384614, 'edge_cap': 0.5053995539332197, 'bull_strategy': 'breakout', 'bull_bb_std_mult': 0.7933096079326706, 'bull_rsi_os': 6, 'bull_rsi_ob': 75, 'bull_adx_thresh': 8.91898512511507, 'bull_atr_min_pct': 0.010793843243793363, 'bull_atr_max_pct': 0.1034475358876567, 'bull_tp_mult': 1.7294450985011025, 'bull_tsl_mult': 0.38919928035838336, 'bull_time_stop': 73, 'bull_use_sma': True, 'bull_use_ema': False, 'bull_use_atr': False, 'bull_use_adx': False, 'bull_use_spike': False, 'bull_rsi_required': False, 'bear_strategy': 'breakout', 'bear_bb_std_mult': 2.222800965621811, 'bear_rsi_os': 50, 'bear_rsi_ob': 80, 'bear_adx_thresh': 8.086484952668547, 'bear_atr_min_pct': 0.005981170552199195, 'bear_atr_max_pct': 0.12403041587026441, 'bear_tp_mult': 1.7687821001017072, 'bear_tsl_mult': 0.8550287229547655, 'bear_time_stop': 24, 'bear_use_sma': False, 'bear_use_ema': True, 'bear_use_atr': True, 'bear_use_adx': False, 'bear_use_spike': True, 'bear_rsi_required': False, 'sideways_strategy': 'mean_reversion', 'sideways_bb_std_mult': 1.621958956977827, 'sideways_rsi_os': 7, 'sideways_rsi_ob': 93, 'sideways_adx_thresh': 28.03572373396572, 'sideways_atr_min_pct': 0.016682023113550867, 'sideways_atr_max_pct': 0.04846832021880844, 'sideways_tp_mult': 1.9917220835382787, 'sideways_tsl_mult': 0.13097489002808133, 'sideways_time_stop': 26, 'sideways_use_sma': False, 'sideways_use_ema': False, 'sideways_use_atr': False, 'sideways_use_adx': False, 'sideways_use_spike': False, 'sideways_rsi_required': True}.
[I 2025-08-31 10:39:28,305] Trial 346 finished with values: [-1000000000.0, 1000000000.0] and parameters: {'p_sma': 41, 'p_std': 29, 'p_atr': 13, 'p_adx': 14, 'rsi_period': 54, 'ema1': 14, 'ema2': 21, 'slip_atr_k': 0.02533536752118914, 'slip_spread_k': 0.6806249391762913, 'spread_hl_frac': 0.04992897357668648, 'bb_std_mult': 2.7407121477734524, 'rsi_os': 24, 'rsi_ob': 77, 'vol_spike': 0.26568481896131546, 'adx_thresh': 28.868466184492057, 'atr_min_pct': 0.011951218888187117, 'atr_max_pct': 0.09443533325059449, 'tp_mult': 1.7032429955611939, 'tsl_mult': 0.24044352192907462, 'strategy': 'breakout', 'time_stop': 71, 'use_sma': True, 'use_atr': False, 'use_adx': True, 'use_ema': True, 'use_spike': False, 'rsi_required': True, 'edge_k': 1.5273343548053606, 'edge_cap': 0.5068635573822822, 'bull_strategy': 'breakout', 'bull_bb_std_mult': 3.2426555245946327, 'bull_rsi_os': 12, 'bull_rsi_ob': 74, 'bull_adx_thresh': 9.237324653631303, 'bull_atr_min_pct': 0.01112027216259345, 'bull_atr_max_pct': 0.07999581324103731, 'bull_tp_mult': 1.7227671070097628, 'bull_tsl_mult': 0.3938874875106461, 'bull_time_stop': 76, 'bull_use_sma': True, 'bull_use_ema': False, 'bull_use_atr': False, 'bull_use_adx': False, 'bull_use_spike': False, 'bull_rsi_required': True, 'bear_strategy': 'breakout', 'bear_bb_std_mult': 2.558758494940101, 'bear_rsi_os': 13, 'bear_rsi_ob': 89, 'bear_adx_thresh': 6.727941518237788, 'bear_atr_min_pct': 0.005809025805078782, 'bear_atr_max_pct': 0.14026711093030447, 'bear_tp_mult': 2.7716856134218064, 'bear_tsl_mult': 0.5495876596350348, 'bear_time_stop': 32, 'bear_use_sma': False, 'bear_use_ema': True, 'bear_use_atr': False, 'bear_use_adx': False, 'bear_use_spike': True, 'bear_rsi_required': True, 'sideways_strategy': 'mean_reversion', 'sideways_bb_std_mult': 2.160675261074579, 'sideways_rsi_os': 7, 'sideways_rsi_ob': 93, 'sideways_adx_thresh': 25.265299360657565, 'sideways_atr_min_pct': 0.01706180558951262, 'sideways_atr_max_pct': 0.04965899376441303, 'sideways_tp_mult': 1.9115193118761016, 'sideways_tsl_mult': 0.12944819358762816, 'sideways_time_stop': 19, 'sideways_use_sma': False, 'sideways_use_ema': False, 'sideways_use_atr': False, 'sideways_use_adx': False, 'sideways_use_spike': False, 'sideways_rsi_required': False}.
[I 2025-08-31 10:39:59,008] Trial 347 finished with values: [-1000000000.0, 1000000000.0] and parameters: {'p_sma': 16, 'p_std': 28, 'p_atr': 13, 'p_adx': 14, 'rsi_period': 9, 'ema1': 14, 'ema2': 18, 'slip_atr_k': 0.02468531113940972, 'slip_spread_k': 0.20349609673530356, 'spread_hl_frac': 0.01053984040006784, 'bb_std_mult': 2.7300745497371337, 'rsi_os': 28, 'rsi_ob': 77, 'vol_spike': 0.25767109851334574, 'adx_thresh': 28.65984136633215, 'atr_min_pct': 0.025500603177765254, 'atr_max_pct': 0.09617827201523682, 'tp_mult': 1.6826327281609295, 'tsl_mult': 0.24005189363898957, 'strategy': 'breakout', 'time_stop': 80, 'use_sma': True, 'use_atr': False, 'use_adx': True, 'use_ema': True, 'use_spike': True, 'rsi_required': True, 'edge_k': 0.3306991363435846, 'edge_cap': 0.4182067962714023, 'bull_strategy': 'breakout', 'bull_bb_std_mult': 0.6578554560872412, 'bull_rsi_os': 11, 'bull_rsi_ob': 74, 'bull_adx_thresh': 9.201039039406297, 'bull_atr_min_pct': 0.009009628316843321, 'bull_atr_max_pct': 0.0854113392397537, 'bull_tp_mult': 1.7201729683631142, 'bull_tsl_mult': 0.38342243562305184, 'bull_time_stop': 76, 'bull_use_sma': True, 'bull_use_ema': False, 'bull_use_atr': False, 'bull_use_adx': False, 'bull_use_spike': False, 'bull_rsi_required': True, 'bear_strategy': 'breakout', 'bear_bb_std_mult': 1.5818968003188933, 'bear_rsi_os': 33, 'bear_rsi_ob': 82, 'bear_adx_thresh': 6.569424182691125, 'bear_atr_min_pct': 0.006340764200567381, 'bear_atr_max_pct': 0.14231303657512137, 'bear_tp_mult': 2.7739090756507294, 'bear_tsl_mult': 0.848871161401688, 'bear_time_stop': 25, 'bear_use_sma': False, 'bear_use_ema': True, 'bear_use_atr': False, 'bear_use_adx': False, 'bear_use_spike': True, 'bear_rsi_required': True, 'sideways_strategy': 'mean_reversion', 'sideways_bb_std_mult': 2.6529896247318034, 'sideways_rsi_os': 7, 'sideways_rsi_ob': 93, 'sideways_adx_thresh': 25.408427224296393, 'sideways_atr_min_pct': 0.017058768270911618, 'sideways_atr_max_pct': 0.04697585875001969, 'sideways_tp_mult': 1.9147359168136708, 'sideways_tsl_mult': 0.9960450977261338, 'sideways_time_stop': 26, 'sideways_use_sma': False, 'sideways_use_ema': False, 'sideways_use_atr': False, 'sideways_use_adx': False, 'sideways_use_spike': False, 'sideways_rsi_required': False}.
[I 2025-08-31 10:39:59,732] Trial 350 finished with values: [-1000000000.0, 1000000000.0] and parameters: {'p_sma': 13, 'p_std': 28, 'p_atr': 11, 'p_adx': 13, 'rsi_period': 20, 'ema1': 13, 'ema2': 18, 'slip_atr_k': 0.11282009017840178, 'slip_spread_k': 0.19864578221855267, 'spread_hl_frac': 0.010219390840096716, 'bb_std_mult': 2.7701595215862898, 'rsi_os': 28, 'rsi_ob': 77, 'vol_spike': 0.02645002752519489, 'adx_thresh': 5.20663546700186, 'atr_min_pct': 0.006037191060598116, 'atr_max_pct': 0.09810884790206782, 'tp_mult': 2.3244052186043156, 'tsl_mult': 0.3061073316984999, 'strategy': 'mean_reversion', 'time_stop': 81, 'use_sma': True, 'use_atr': False, 'use_adx': True, 'use_ema': False, 'use_spike': True, 'rsi_required': True, 'edge_k': 0.31116964576882544, 'edge_cap': 0.42299359340098774, 'bull_strategy': 'mean_reversion', 'bull_bb_std_mult': 0.7660100351331665, 'bull_rsi_os': 14, 'bull_rsi_ob': 88, 'bull_adx_thresh': 7.241070147868213, 'bull_atr_min_pct': 0.006824503494462682, 'bull_atr_max_pct': 0.09751060629492922, 'bull_tp_mult': 2.2528883702817217, 'bull_tsl_mult': 0.919168347122387, 'bull_time_stop': 39, 'bull_use_sma': True, 'bull_use_ema': False, 'bull_use_atr': False, 'bull_use_adx': True, 'bull_use_spike': False, 'bull_rsi_required': True, 'bear_strategy': 'breakout', 'bear_bb_std_mult': 1.6023117730436247, 'bear_rsi_os': 44, 'bear_rsi_ob': 82, 'bear_adx_thresh': 6.456805923018007, 'bear_atr_min_pct': 0.006443362819871644, 'bear_atr_max_pct': 0.14383827933179139, 'bear_tp_mult': 2.834667261856711, 'bear_tsl_mult': 0.26795346299339673, 'bear_time_stop': 24, 'bear_use_sma': False, 'bear_use_ema': False, 'bear_use_atr': False, 'bear_use_adx': True, 'bear_use_spike': True, 'bear_rsi_required': True, 'sideways_strategy': 'mean_reversion', 'sideways_bb_std_mult': 2.671255240167761, 'sideways_rsi_os': 5, 'sideways_rsi_ob': 91, 'sideways_adx_thresh': 12.969088191576812, 'sideways_atr_min_pct': 0.01806044283490168, 'sideways_atr_max_pct': 0.04663607201102372, 'sideways_tp_mult': 2.91942574595226, 'sideways_tsl_mult': 0.11584030591427272, 'sideways_time_stop': 225, 'sideways_use_sma': True, 'sideways_use_ema': True, 'sideways_use_atr': False, 'sideways_use_adx': False, 'sideways_use_spike': False, 'sideways_rsi_required': False}.
[I 2025-08-31 10:40:00,061] Trial 349 finished with values: [-1000000000.0, 1000000000.0] and parameters: {'p_sma': 15, 'p_std': 28, 'p_atr': 11, 'p_adx': 13, 'rsi_period': 54, 'ema1': 13, 'ema2': 18, 'slip_atr_k': 0.02601573595007024, 'slip_spread_k': 0.6689939813107318, 'spread_hl_frac': 0.010370205081738844, 'bb_std_mult': 2.742609096638282, 'rsi_os': 24, 'rsi_ob': 77, 'vol_spike': 0.26546068241558235, 'adx_thresh': 15.674318107134615, 'atr_min_pct': 0.006009612724889258, 'atr_max_pct': 0.09427563867537304, 'tp_mult': 2.324971422667782, 'tsl_mult': 0.22706457735467128, 'strategy': 'mean_reversion', 'time_stop': 81, 'use_sma': True, 'use_atr': False, 'use_adx': True, 'use_ema': True, 'use_spike': True, 'rsi_required': True, 'edge_k': 1.9592467343486124, 'edge_cap': 0.4289716602615912, 'bull_strategy': 'mean_reversion', 'bull_bb_std_mult': 2.5757818017229885, 'bull_rsi_os': 14, 'bull_rsi_ob': 90, 'bull_adx_thresh': 7.2553636360818405, 'bull_atr_min_pct': 0.006701501165807037, 'bull_atr_max_pct': 0.09659450607333525, 'bull_tp_mult': 1.7989772871360343, 'bull_tsl_mult': 0.12464790823419492, 'bull_time_stop': 286, 'bull_use_sma': True, 'bull_use_ema': False, 'bull_use_atr': False, 'bull_use_adx': False, 'bull_use_spike': False, 'bull_rsi_required': True, 'bear_strategy': 'breakout', 'bear_bb_std_mult': 2.5323060207885733, 'bear_rsi_os': 21, 'bear_rsi_ob': 92, 'bear_adx_thresh': 6.7570685347154, 'bear_atr_min_pct': 0.0059596907825225824, 'bear_atr_max_pct': 0.13939848631755103, 'bear_tp_mult': 2.7774999436727863, 'bear_tsl_mult': 0.2674459736010375, 'bear_time_stop': 34, 'bear_use_sma': False, 'bear_use_ema': False, 'bear_use_atr': False, 'bear_use_adx': False, 'bear_use_spike': True, 'bear_rsi_required': True, 'sideways_strategy': 'mean_reversion', 'sideways_bb_std_mult': 2.6213823783720995, 'sideways_rsi_os': 5, 'sideways_rsi_ob': 91, 'sideways_adx_thresh': 25.26515333355369, 'sideways_atr_min_pct': 0.017160399984116233, 'sideways_atr_max_pct': 0.0458968431948231, 'sideways_tp_mult': 1.9353110787825945, 'sideways_tsl_mult': 0.9945756858306758, 'sideways_time_stop': 20, 'sideways_use_sma': True, 'sideways_use_ema': True, 'sideways_use_atr': False, 'sideways_use_adx': False, 'sideways_use_spike': False, 'sideways_rsi_required': False}.
[I 2025-08-31 10:40:00,203] Trial 348 finished with values: [-1000000000.0, 1000000000.0] and parameters: {'p_sma': 49, 'p_std': 28, 'p_atr': 11, 'p_adx': 13, 'rsi_period': 54, 'ema1': 13, 'ema2': 44, 'slip_atr_k': 0.09728018589979517, 'slip_spread_k': 0.04616852581988379, 'spread_hl_frac': 0.010550458774441935, 'bb_std_mult': 2.7187673425519185, 'rsi_os': 24, 'rsi_ob': 76, 'vol_spike': 0.26460912898305916, 'adx_thresh': 17.112843136102857, 'atr_min_pct': 0.025541091033142744, 'atr_max_pct': 0.09472193745451184, 'tp_mult': 1.6797998931219573, 'tsl_mult': 0.3034641793504427, 'strategy': 'breakout', 'time_stop': 83, 'use_sma': True, 'use_atr': False, 'use_adx': True, 'use_ema': True, 'use_spike': True, 'rsi_required': True, 'edge_k': 1.5446952007261008, 'edge_cap': 0.43091233026868736, 'bull_strategy': 'mean_reversion', 'bull_bb_std_mult': 2.9158351518558363, 'bull_rsi_os': 14, 'bull_rsi_ob': 74, 'bull_adx_thresh': 8.963208620155864, 'bull_atr_min_pct': 0.008872916430898482, 'bull_atr_max_pct': 0.09612703967676649, 'bull_tp_mult': 1.8698232318560917, 'bull_tsl_mult': 0.11598251281790739, 'bull_time_stop': 77, 'bull_use_sma': True, 'bull_use_ema': False, 'bull_use_atr': False, 'bull_use_adx': False, 'bull_use_spike': False, 'bull_rsi_required': True, 'bear_strategy': 'breakout', 'bear_bb_std_mult': 1.5997559055850512, 'bear_rsi_os': 24, 'bear_rsi_ob': 82, 'bear_adx_thresh': 6.619355074896793, 'bear_atr_min_pct': 0.006256128338262172, 'bear_atr_max_pct': 0.1204224307763978, 'bear_tp_mult': 2.7682244020524664, 'bear_tsl_mult': 0.3072866167188032, 'bear_time_stop': 22, 'bear_use_sma': False, 'bear_use_ema': True, 'bear_use_atr': False, 'bear_use_adx': False, 'bear_use_spike': True, 'bear_rsi_required': True, 'sideways_strategy': 'mean_reversion', 'sideways_bb_std_mult': 1.633530114450839, 'sideways_rsi_os': 5, 'sideways_rsi_ob': 91, 'sideways_adx_thresh': 32.51211917807402, 'sideways_atr_min_pct': 0.0171612029848107, 'sideways_atr_max_pct': 0.04697107477290484, 'sideways_tp_mult': 1.9239864564880198, 'sideways_tsl_mult': 0.9537602865641275, 'sideways_time_stop': 19, 'sideways_use_sma': False, 'sideways_use_ema': True, 'sideways_use_atr': False, 'sideways_use_adx': False, 'sideways_use_spike': False, 'sideways_rsi_required': False}.
