[I 2025-08-31 10:18:54,340] Trial 187 finished with values: [-1000000000.0, 1000000000.0] and parameters: {'p_sma': 38, 'p_std': 21, 'p_atr': 30, 'p_adx': 21, 'rsi_period': 16, 'ema1': 19, 'ema2': 19, 'slip_atr_k': 0.21582315604478516, 'slip_spread_k': 0.6427556491552373, 'spread_hl_frac': 0.013047712489585446, 'bb_std_mult': 0.7510240285834552, 'rsi_os': 22, 'rsi_ob': 45, 'vol_spike': 0.290714921246705, 'adx_thresh': 29.804334177143993, 'atr_min_pct': 0.021805919474697212, 'atr_max_pct': 0.02945247578240212, 'tp_mult': 2.875399289615313, 'tsl_mult': 0.603613542731943, 'strategy': 'breakout', 'time_stop': 256, 'use_sma': True, 'use_atr': False, 'use_adx': True, 'use_ema': True, 'use_spike': True, 'rsi_required': False, 'edge_k': 0.0020331865008050842, 'edge_cap': 0.9072789551213245, 'bull_strategy': 'breakout', 'bull_bb_std_mult': 0.6631740418088867, 'bull_rsi_os': 36, 'bull_rsi_ob': 88, 'bull_adx_thresh': 24.20313505941808, 'bull_atr_min_pct': 0.010810313188588815, 'bull_atr_max_pct': 0.14043050217028302, 'bull_tp_mult': 1.4178708279691643, 'bull_tsl_mult': 0.5622076429617169, 'bull_time_stop': 106, 'bull_use_sma': True, 'bull_use_ema': False, 'bull_use_atr': True, 'bull_use_adx': True, 'bull_use_spike': True, 'bull_rsi_required': True, 'bear_strategy': 'breakout', 'bear_bb_std_mult': 1.6033277686972731, 'bear_rsi_os': 6, 'bear_rsi_ob': 70, 'bear_adx_thresh': 14.161214546420402, 'bear_atr_min_pct': 0.004545777852265539, 'bear_atr_max_pct': 0.09459581201754588, 'bear_tp_mult': 1.1933716822187117, 'bear_tsl_mult': 0.6224047233843554, 'bear_time_stop': 50, 'bear_use_sma': False, 'bear_use_ema': True, 'bear_use_atr': False, 'bear_use_adx': False, 'bear_use_spike': True, 'bear_rsi_required': False, 'sideways_strategy': 'mean_reversion', 'sideways_bb_std_mult': 2.7894393866456735, 'sideways_rsi_os': 19, 'sideways_rsi_ob': 83, 'sideways_adx_thresh': 23.83564538679896, 'sideways_atr_min_pct': 0.006664196739992731, 'sideways_atr_max_pct': 0.037122784837175446, 'sideways_tp_mult': 2.078581328712772, 'sideways_tsl_mult': 0.6702086710677433, 'sideways_time_stop': 157, 'sideways_use_sma': False, 'sideways_use_ema': False, 'sideways_use_atr': False, 'sideways_use_adx': True, 'sideways_use_spike': True, 'sideways_rsi_required': True}.
[I 2025-08-31 10:18:54,455] Trial 188 finished with values: [-1000000000.0, 1000000000.0] and parameters: {'p_sma': 26, 'p_std': 23, 'p_atr': 17, 'p_adx': 21, 'rsi_period': 42, 'ema1': 15, 'ema2': 39, 'slip_atr_k': 0.034913900713995805, 'slip_spread_k': 0.6147555252624475, 'spread_hl_frac': 0.013552853272071659, 'bb_std_mult': 0.7582483861668251, 'rsi_os': 22, 'rsi_ob': 59, 'vol_spike': 0.28757942076141463, 'adx_thresh': 29.93399214604674, 'atr_min_pct': 0.005550619626746336, 'atr_max_pct': 0.07291105587337816, 'tp_mult': 2.9978448023985305, 'tsl_mult': 0.5973794030943849, 'strategy': 'breakout', 'time_stop': 212, 'use_sma': True, 'use_atr': False, 'use_adx': True, 'use_ema': True, 'use_spike': True, 'rsi_required': False, 'edge_k': 0.16823646333944878, 'edge_cap': 0.8594046656827432, 'bull_strategy': 'breakout', 'bull_bb_std_mult': 0.6550197345311768, 'bull_rsi_os': 9, 'bull_rsi_ob': 46, 'bull_adx_thresh': 23.93598504141281, 'bull_atr_min_pct': 0.010495102083474952, 'bull_atr_max_pct': 0.1143580382846875, 'bull_tp_mult': 1.4419073519404202, 'bull_tsl_mult': 0.5731610066294469, 'bull_time_stop': 107, 'bull_use_sma': True, 'bull_use_ema': False, 'bull_use_atr': True, 'bull_use_adx': False, 'bull_use_spike': True, 'bull_rsi_required': True, 'bear_strategy': 'breakout', 'bear_bb_std_mult': 1.1655660518720574, 'bear_rsi_os': 36, 'bear_rsi_ob': 68, 'bear_adx_thresh': 17.216234449149145, 'bear_atr_min_pct': 0.0049470534181161535, 'bear_atr_max_pct': 0.08034432448788793, 'bear_tp_mult': 2.6547448927989725, 'bear_tsl_mult': 0.5498674848713417, 'bear_time_stop': 50, 'bear_use_sma': False, 'bear_use_ema': True, 'bear_use_atr': False, 'bear_use_adx': False, 'bear_use_spike': True, 'bear_rsi_required': False, 'sideways_strategy': 'mean_reversion', 'sideways_bb_std_mult': 1.748888900400587, 'sideways_rsi_os': 49, 'sideways_rsi_ob': 60, 'sideways_adx_thresh': 16.769556370907637, 'sideways_atr_min_pct': 0.008838759538748043, 'sideways_atr_max_pct': 0.04554955162782015, 'sideways_tp_mult': 1.871529189803749, 'sideways_tsl_mult': 0.20776473044670024, 'sideways_time_stop': 47, 'sideways_use_sma': False, 'sideways_use_ema': False, 'sideways_use_atr': False, 'sideways_use_adx': True, 'sideways_use_spike': True, 'sideways_rsi_required': False}.
[I 2025-08-31 10:19:26,562] Trial 194 finished with values: [-1000000000.0, 1000000000.0] and parameters: {'p_sma': 6, 'p_std': 43, 'p_atr': 29, 'p_adx': 17, 'rsi_period': 30, 'ema1': 17, 'ema2': 56, 'slip_atr_k': 0.1917659437540237, 'slip_spread_k': 0.2695626196259262, 'spread_hl_frac': 0.04649805795799769, 'bb_std_mult': 0.6438807388368861, 'rsi_os': 26, 'rsi_ob': 53, 'vol_spike': 0.23785692970012304, 'adx_thresh': 27.800601831366766, 'atr_min_pct': 0.014311114134502128, 'atr_max_pct': 0.10703345329200413, 'tp_mult': 2.4273020498857356, 'tsl_mult': 0.6212525937896284, 'strategy': 'breakout', 'time_stop': 222, 'use_sma': True, 'use_atr': True, 'use_adx': False, 'use_ema': True, 'use_spike': True, 'rsi_required': True, 'edge_k': 1.5447962249835572, 'edge_cap': 0.8272325830368066, 'bull_strategy': 'mean_reversion', 'bull_bb_std_mult': 0.8502905873311323, 'bull_rsi_os': 41, 'bull_rsi_ob': 58, 'bull_adx_thresh': 24.63423435533387, 'bull_atr_min_pct': 0.0174006000485329, 'bull_atr_max_pct': 0.14333364713715882, 'bull_tp_mult': 2.226695264290705, 'bull_tsl_mult': 0.4518580304817381, 'bull_time_stop': 76, 'bull_use_sma': True, 'bull_use_ema': True, 'bull_use_atr': False, 'bull_use_adx': False, 'bull_use_spike': False, 'bull_rsi_required': False, 'bear_strategy': 'breakout', 'bear_bb_std_mult': 1.7066808614414013, 'bear_rsi_os': 38, 'bear_rsi_ob': 70, 'bear_adx_thresh': 15.889513511135648, 'bear_atr_min_pct': 0.0036917646752608222, 'bear_atr_max_pct': 0.03863690102032135, 'bear_tp_mult': 1.57556052471083, 'bear_tsl_mult': 0.5000813967913497, 'bear_time_stop': 215, 'bear_use_sma': False, 'bear_use_ema': True, 'bear_use_atr': False, 'bear_use_adx': False, 'bear_use_spike': False, 'bear_rsi_required': False, 'sideways_strategy': 'breakout', 'sideways_bb_std_mult': 2.015210174762933, 'sideways_rsi_os': 17, 'sideways_rsi_ob': 70, 'sideways_adx_thresh': 24.655652397438097, 'sideways_atr_min_pct': 0.00530849038243578, 'sideways_atr_max_pct': 0.03307878220506304, 'sideways_tp_mult': 2.1460540842667397, 'sideways_tsl_mult': 0.07425747563879043, 'sideways_time_stop': 29, 'sideways_use_sma': False, 'sideways_use_ema': False, 'sideways_use_atr': True, 'sideways_use_adx': False, 'sideways_use_spike': False, 'sideways_rsi_required': True}.
[I 2025-08-31 10:19:27,078] Trial 191 finished with values: [-1000000000.0, 1000000000.0] and parameters: {'p_sma': 25, 'p_std': 18, 'p_atr': 29, 'p_adx': 17, 'rsi_period': 43, 'ema1': 21, 'ema2': 40, 'slip_atr_k': 0.034986291562549544, 'slip_spread_k': 0.2690146414548159, 'spread_hl_frac': 0.013765320822096685, 'bb_std_mult': 1.3106524129230048, 'rsi_os': 31, 'rsi_ob': 45, 'vol_spike': 0.2385542535084861, 'adx_thresh': 29.835534599479555, 'atr_min_pct': 0.0030172003712856544, 'atr_max_pct': 0.0734493805939257, 'tp_mult': 2.4288062408204225, 'tsl_mult': 0.5840758829868951, 'strategy': 'breakout', 'time_stop': 223, 'use_sma': True, 'use_atr': True, 'use_adx': False, 'use_ema': True, 'use_spike': True, 'rsi_required': True, 'edge_k': 0.00831891135185564, 'edge_cap': 0.8501496600321571, 'bull_strategy': 'breakout', 'bull_bb_std_mult': 0.8535254350507187, 'bull_rsi_os': 36, 'bull_rsi_ob': 89, 'bull_adx_thresh': 24.235942931984862, 'bull_atr_min_pct': 0.01036747341323164, 'bull_atr_max_pct': 0.14253978946309112, 'bull_tp_mult': 1.865286299232986, 'bull_tsl_mult': 0.4521945063494861, 'bull_time_stop': 109, 'bull_use_sma': True, 'bull_use_ema': True, 'bull_use_atr': False, 'bull_use_adx': False, 'bull_use_spike': True, 'bull_rsi_required': False, 'bear_strategy': 'breakout', 'bear_bb_std_mult': 1.5021916820010337, 'bear_rsi_os': 36, 'bear_rsi_ob': 70, 'bear_adx_thresh': 15.872451004571666, 'bear_atr_min_pct': 0.003687732222168367, 'bear_atr_max_pct': 0.1462964854172874, 'bear_tp_mult': 1.8328590273954966, 'bear_tsl_mult': 0.6217563572277124, 'bear_time_stop': 48, 'bear_use_sma': False, 'bear_use_ema': True, 'bear_use_atr': False, 'bear_use_adx': False, 'bear_use_spike': False, 'bear_rsi_required': False, 'sideways_strategy': 'breakout', 'sideways_bb_std_mult': 2.0136725537253066, 'sideways_rsi_os': 17, 'sideways_rsi_ob': 79, 'sideways_adx_thresh': 24.741642504584007, 'sideways_atr_min_pct': 0.00526423811293083, 'sideways_atr_max_pct': 0.03797633680668998, 'sideways_tp_mult': 1.9347658788300197, 'sideways_tsl_mult': 0.0778620497282415, 'sideways_time_stop': 46, 'sideways_use_sma': False, 'sideways_use_ema': False, 'sideways_use_atr': False, 'sideways_use_adx': True, 'sideways_use_spike': True, 'sideways_rsi_required': True}.
[I 2025-08-31 10:19:27,182] Trial 192 finished with values: [-1000000000.0, 1000000000.0] and parameters: {'p_sma': 13, 'p_std': 32, 'p_atr': 29, 'p_adx': 17, 'rsi_period': 41, 'ema1': 15, 'ema2': 39, 'slip_atr_k': 0.20604886321112703, 'slip_spread_k': 0.667136915301694, 'spread_hl_frac': 0.012570445301826993, 'bb_std_mult': 1.3353768009560099, 'rsi_os': 22, 'rsi_ob': 45, 'vol_spike': 0.2377554394398023, 'adx_thresh': 27.916433187303493, 'atr_min_pct': 0.006582969582568941, 'atr_max_pct': 0.07357856397615872, 'tp_mult': 2.429472083384107, 'tsl_mult': 0.6253072390356622, 'strategy': 'breakout', 'time_stop': 222, 'use_sma': True, 'use_atr': True, 'use_adx': False, 'use_ema': True, 'use_spike': True, 'rsi_required': False, 'edge_k': 0.002691441391502014, 'edge_cap': 0.8303790035411737, 'bull_strategy': 'breakout', 'bull_bb_std_mult': 0.8634677565545469, 'bull_rsi_os': 44, 'bull_rsi_ob': 89, 'bull_adx_thresh': 6.20008605156214, 'bull_atr_min_pct': 0.017453836536019254, 'bull_atr_max_pct': 0.14179587019373313, 'bull_tp_mult': 2.2270948294019406, 'bull_tsl_mult': 0.46286011239592056, 'bull_time_stop': 72, 'bull_use_sma': True, 'bull_use_ema': True, 'bull_use_atr': True, 'bull_use_adx': False, 'bull_use_spike': False, 'bull_rsi_required': True, 'bear_strategy': 'breakout', 'bear_bb_std_mult': 1.1540914622631155, 'bear_rsi_os': 37, 'bear_rsi_ob': 70, 'bear_adx_thresh': 15.734595276024853, 'bear_atr_min_pct': 0.003775304491523638, 'bear_atr_max_pct': 0.10480743374324034, 'bear_tp_mult': 1.8397288782842198, 'bear_tsl_mult': 0.5028632254737645, 'bear_time_stop': 49, 'bear_use_sma': False, 'bear_use_ema': True, 'bear_use_atr': False, 'bear_use_adx': False, 'bear_use_spike': True, 'bear_rsi_required': False, 'sideways_strategy': 'breakout', 'sideways_bb_std_mult': 2.0271955262043466, 'sideways_rsi_os': 17, 'sideways_rsi_ob': 52, 'sideways_adx_thresh': 24.905009921238133, 'sideways_atr_min_pct': 0.0052056549802982615, 'sideways_atr_max_pct': 0.03812735560885119, 'sideways_tp_mult': 1.9455042481676674, 'sideways_tsl_mult': 0.08579431555479518, 'sideways_time_stop': 44, 'sideways_use_sma': False, 'sideways_use_ema': False, 'sideways_use_atr': False, 'sideways_use_adx': True, 'sideways_use_spike': True, 'sideways_rsi_required': False}.
[I 2025-08-31 10:19:27,263] Trial 193 finished with values: [-1000000000.0, 1000000000.0] and parameters: {'p_sma': 27, 'p_std': 42, 'p_atr': 17, 'p_adx': 17, 'rsi_period': 41, 'ema1': 15, 'ema2': 55, 'slip_atr_k': 0.19225796313452026, 'slip_spread_k': 0.6142647620356682, 'spread_hl_frac': 0.04323156680141222, 'bb_std_mult': 1.3756866598716044, 'rsi_os': 11, 'rsi_ob': 53, 'vol_spike': 0.23913714501964733, 'adx_thresh': 27.777391907591433, 'atr_min_pct': 0.006567109156040106, 'atr_max_pct': 0.10691299435308145, 'tp_mult': 2.435855256621647, 'tsl_mult': 0.6259593554384273, 'strategy': 'breakout', 'time_stop': 221, 'use_sma': True, 'use_atr': True, 'use_adx': False, 'use_ema': True, 'use_spike': True, 'rsi_required': False, 'edge_k': 0.2360672183917156, 'edge_cap': 0.3535449794880646, 'bull_strategy': 'mean_reversion', 'bull_bb_std_mult': 0.8478264966243929, 'bull_rsi_os': 9, 'bull_rsi_ob': 52, 'bull_adx_thresh': 6.532776723403657, 'bull_atr_min_pct': 0.0007476920123657626, 'bull_atr_max_pct': 0.14208685296188112, 'bull_tp_mult': 1.1429846443165297, 'bull_tsl_mult': 0.44045970403261303, 'bull_time_stop': 73, 'bull_use_sma': True, 'bull_use_ema': True, 'bull_use_atr': True, 'bull_use_adx': False, 'bull_use_spike': False, 'bull_rsi_required': True, 'bear_strategy': 'breakout', 'bear_bb_std_mult': 1.4966167273381314, 'bear_rsi_os': 15, 'bear_rsi_ob': 67, 'bear_adx_thresh': 18.48058090727938, 'bear_atr_min_pct': 0.003744548299120347, 'bear_atr_max_pct': 0.07898469690368391, 'bear_tp_mult': 2.6777103367576873, 'bear_tsl_mult': 0.5018883131805102, 'bear_time_stop': 30, 'bear_use_sma': False, 'bear_use_ema': True, 'bear_use_atr': False, 'bear_use_adx': False, 'bear_use_spike': False, 'bear_rsi_required': False, 'sideways_strategy': 'breakout', 'sideways_bb_std_mult': 3.2462061644656037, 'sideways_rsi_os': 49, 'sideways_rsi_ob': 85, 'sideways_adx_thresh': 24.710500444226074, 'sideways_atr_min_pct': 0.0052005347122114545, 'sideways_atr_max_pct': 0.030265382185625078, 'sideways_tp_mult': 2.1650067821063113, 'sideways_tsl_mult': 0.2048064982698164, 'sideways_time_stop': 47, 'sideways_use_sma': False, 'sideways_use_ema': False, 'sideways_use_atr': False, 'sideways_use_adx': True, 'sideways_use_spike': True, 'sideways_rsi_required': False}.
[I 2025-08-31 10:19:58,102] Trial 198 finished with values: [-0.033385830844237185, 0.032843105422581] and parameters: {'p_sma': 12, 'p_std': 37, 'p_atr': 13, 'p_adx': 18, 'rsi_period': 61, 'ema1': 16, 'ema2': 55, 'slip_atr_k': 0.136174809978337, 'slip_spread_k': 0.4996805323656216, 'spread_hl_frac': 0.02910095425533995, 'bb_std_mult': 0.5757241888099887, 'rsi_os': 29, 'rsi_ob': 56, 'vol_spike': 0.2285860071329876, 'adx_thresh': 28.71543944679497, 'atr_min_pct': 0.00492918480091855, 'atr_max_pct': 0.08977396843265763, 'tp_mult': 2.4653594240232883, 'tsl_mult': 0.5729302236169156, 'strategy': 'breakout', 'time_stop': 234, 'use_sma': True, 'use_atr': True, 'use_adx': False, 'use_ema': False, 'use_spike': True, 'rsi_required': False, 'edge_k': 1.8865516998783614, 'edge_cap': 0.4834151110215298, 'bull_strategy': 'breakout', 'bull_bb_std_mult': 1.8326764952253147, 'bull_rsi_os': 54, 'bull_rsi_ob': 77, 'bull_adx_thresh': 27.19790028583708, 'bull_atr_min_pct': 0.00829417375519438, 'bull_atr_max_pct': 0.1471729867330065, 'bull_tp_mult': 1.7550193683139284, 'bull_tsl_mult': 0.3889582241656433, 'bull_time_stop': 272, 'bull_use_sma': True, 'bull_use_ema': True, 'bull_use_atr': True, 'bull_use_adx': False, 'bull_use_spike': True, 'bull_rsi_required': True, 'bear_strategy': 'breakout', 'bear_bb_std_mult': 1.035690911509929, 'bear_rsi_os': 39, 'bear_rsi_ob': 46, 'bear_adx_thresh': 15.278305692953133, 'bear_atr_min_pct': 0.002064180684231493, 'bear_atr_max_pct': 0.08393449965717162, 'bear_tp_mult': 2.998469117064122, 'bear_tsl_mult': 0.5301447219197251, 'bear_time_stop': 276, 'bear_use_sma': False, 'bear_use_ema': True, 'bear_use_atr': False, 'bear_use_adx': True, 'bear_use_spike': True, 'bear_rsi_required': False, 'sideways_strategy': 'breakout', 'sideways_bb_std_mult': 0.5063305596790082, 'sideways_rsi_os': 20, 'sideways_rsi_ob': 95, 'sideways_adx_thresh': 22.426091467976015, 'sideways_atr_min_pct': 0.004461201729129046, 'sideways_atr_max_pct': 0.03155263804036239, 'sideways_tp_mult': 2.0252174460219474, 'sideways_tsl_mult': 0.10002250659701245, 'sideways_time_stop': 37, 'sideways_use_sma': False, 'sideways_use_ema': False, 'sideways_use_atr': True, 'sideways_use_adx': False, 'sideways_use_spike': False, 'sideways_rsi_required': True}.
[I 2025-08-31 10:19:58,512] Trial 197 finished with values: [-1000000000.0, 1000000000.0] and parameters: {'p_sma': 33, 'p_std': 38, 'p_atr': 30, 'p_adx': 18, 'rsi_period': 61, 'ema1': 16, 'ema2': 55, 'slip_atr_k': 0.023721113017157496, 'slip_spread_k': 0.4401547499895956, 'spread_hl_frac': 0.011971839060782877, 'bb_std_mult': 0.5508596214037147, 'rsi_os': 29, 'rsi_ob': 90, 'vol_spike': 0.2251688066337612, 'adx_thresh': 28.937683571948206, 'atr_min_pct': 0.005293443645186627, 'atr_max_pct': 0.09058359801244417, 'tp_mult': 2.4802646261926053, 'tsl_mult': 0.08996843299601942, 'strategy': 'breakout', 'time_stop': 241, 'use_sma': True, 'use_atr': True, 'use_adx': False, 'use_ema': False, 'use_spike': True, 'rsi_required': False, 'edge_k': 0.24094368588931026, 'edge_cap': 0.3433693429977257, 'bull_strategy': 'mean_reversion', 'bull_bb_std_mult': 0.7488528459089034, 'bull_rsi_os': 52, 'bull_rsi_ob': 63, 'bull_adx_thresh': 29.603955641669593, 'bull_atr_min_pct': 0.000854487001726334, 'bull_atr_max_pct': 0.146744904309366, 'bull_tp_mult': 1.7788118018840267, 'bull_tsl_mult': 0.38882937362963343, 'bull_time_stop': 116, 'bull_use_sma': True, 'bull_use_ema': True, 'bull_use_atr': True, 'bull_use_adx': False, 'bull_use_spike': True, 'bull_rsi_required': True, 'bear_strategy': 'breakout', 'bear_bb_std_mult': 1.2723642070445904, 'bear_rsi_os': 16, 'bear_rsi_ob': 68, 'bear_adx_thresh': 15.068693178522249, 'bear_atr_min_pct': 0.002583856846619357, 'bear_atr_max_pct': 0.1424015359050956, 'bear_tp_mult': 2.970750614290159, 'bear_tsl_mult': 0.5400348331293282, 'bear_time_stop': 30, 'bear_use_sma': False, 'bear_use_ema': True, 'bear_use_atr': False, 'bear_use_adx': True, 'bear_use_spike': True, 'bear_rsi_required': False, 'sideways_strategy': 'breakout', 'sideways_bb_std_mult': 1.9024627960603184, 'sideways_rsi_os': 18, 'sideways_rsi_ob': 82, 'sideways_adx_thresh': 32.30813170962884, 'sideways_atr_min_pct': 0.003821291145715419, 'sideways_atr_max_pct': 0.03049658427925844, 'sideways_tp_mult': 2.195277703417025, 'sideways_tsl_mult': 0.8042845632762899, 'sideways_time_stop': 36, 'sideways_use_sma': False, 'sideways_use_ema': False, 'sideways_use_atr': False, 'sideways_use_adx': False, 'sideways_use_spike': True, 'sideways_rsi_required': True}.
[I 2025-08-31 10:19:58,863] Trial 196 finished with values: [-0.02592884831550435, 0.025594451563240094] and parameters: {'p_sma': 11, 'p_std': 37, 'p_atr': 30, 'p_adx': 18, 'rsi_period': 61, 'ema1': 16, 'ema2': 55, 'slip_atr_k': 0.13920585270780506, 'slip_spread_k': 0.4416964479371411, 'spread_hl_frac': 0.028390373856063012, 'bb_std_mult': 0.5493647430041877, 'rsi_os': 11, 'rsi_ob': 75, 'vol_spike': 0.22210628840069907, 'adx_thresh': 22.279839824106112, 'atr_min_pct': 0.00642277871468748, 'atr_max_pct': 0.09062129722477032, 'tp_mult': 2.4599461003507135, 'tsl_mult': 0.6674377629475877, 'strategy': 'breakout', 'time_stop': 238, 'use_sma': True, 'use_atr': True, 'use_adx': False, 'use_ema': False, 'use_spike': True, 'rsi_required': False, 'edge_k': 1.8668707076498376, 'edge_cap': 0.8241281399022523, 'bull_strategy': 'mean_reversion', 'bull_bb_std_mult': 0.8567599994128108, 'bull_rsi_os': 54, 'bull_rsi_ob': 62, 'bull_adx_thresh': 27.436185057583273, 'bull_atr_min_pct': 0.0009053927147353583, 'bull_atr_max_pct': 0.14612380553183452, 'bull_tp_mult': 2.3369262903668306, 'bull_tsl_mult': 0.4160106658998764, 'bull_time_stop': 73, 'bull_use_sma': True, 'bull_use_ema': True, 'bull_use_atr': True, 'bull_use_adx': False, 'bull_use_spike': True, 'bull_rsi_required': True, 'bear_strategy': 'breakout', 'bear_bb_std_mult': 1.040597068438731, 'bear_rsi_os': 39, 'bear_rsi_ob': 47, 'bear_adx_thresh': 15.165817106372693, 'bear_atr_min_pct': 0.002162349764670257, 'bear_atr_max_pct': 0.07751647404679325, 'bear_tp_mult': 2.9967980308953637, 'bear_tsl_mult': 0.4798169791334249, 'bear_time_stop': 29, 'bear_use_sma': False, 'bear_use_ema': True, 'bear_use_atr': False, 'bear_use_adx': True, 'bear_use_spike': True, 'bear_rsi_required': False, 'sideways_strategy': 'breakout', 'sideways_bb_std_mult': 1.9068936165748531, 'sideways_rsi_os': 41, 'sideways_rsi_ob': 52, 'sideways_adx_thresh': 22.532949948177354, 'sideways_atr_min_pct': 0.0037418785715751385, 'sideways_atr_max_pct': 0.02512789231521359, 'sideways_tp_mult': 1.297625586783443, 'sideways_tsl_mult': 0.8063300102322819, 'sideways_time_stop': 36, 'sideways_use_sma': False, 'sideways_use_ema': False, 'sideways_use_atr': False, 'sideways_use_adx': True, 'sideways_use_spike': True, 'sideways_rsi_required': False}.
