[I 2025-08-31 10:40:31,027] Trial 351 finished with values: [-1000000000.0, 1000000000.0] and parameters: {'p_sma': 49, 'p_std': 28, 'p_atr': 11, 'p_adx': 13, 'rsi_period': 20, 'ema1': 13, 'ema2': 38, 'slip_atr_k': 0.06746523912822552, 'slip_spread_k': 0.05034469790772389, 'spread_hl_frac': 0.010335186255796628, 'bb_std_mult': 2.806036742745558, 'rsi_os': 29, 'rsi_ob': 76, 'vol_spike': 0.03108715990152719, 'adx_thresh': 9.98440270341799, 'atr_min_pct': 0.018156322310884494, 'atr_max_pct': 0.09879428768533091, 'tp_mult': 2.998807786407531, 'tsl_mult': 0.3103033968740217, 'strategy': 'mean_reversion', 'time_stop': 84, 'use_sma': True, 'use_atr': False, 'use_adx': True, 'use_ema': False, 'use_spike': True, 'rsi_required': True, 'edge_k': 1.1768230044786552, 'edge_cap': 0.43343581066920495, 'bull_strategy': 'mean_reversion', 'bull_bb_std_mult': 0.761941215049621, 'bull_rsi_os': 16, 'bull_rsi_ob': 90, 'bull_adx_thresh': 7.318263932395276, 'bull_atr_min_pct': 0.007090090339094628, 'bull_atr_max_pct': 0.09699726485984898, 'bull_tp_mult': 1.8054405765565795, 'bull_tsl_mult': 0.5596824831963081, 'bull_time_stop': 20, 'bull_use_sma': True, 'bull_use_ema': False, 'bull_use_atr': False, 'bull_use_adx': True, 'bull_use_spike': False, 'bull_rsi_required': True, 'bear_strategy': 'breakout', 'bear_bb_std_mult': 1.8473239574848177, 'bear_rsi_os': 44, 'bear_rsi_ob': 95, 'bear_adx_thresh': 5.609248501282441, 'bear_atr_min_pct': 0.0059086679565115655, 'bear_atr_max_pct': 0.1187619385741018, 'bear_tp_mult': 1.2177290107789593, 'bear_tsl_mult': 0.2584883649392329, 'bear_time_stop': 35, 'bear_use_sma': False, 'bear_use_ema': False, 'bear_use_atr': False, 'bear_use_adx': True, 'bear_use_spike': True, 'bear_rsi_required': False, 'sideways_strategy': 'mean_reversion', 'sideways_bb_std_mult': 0.8286167538828062, 'sideways_rsi_os': 5, 'sideways_rsi_ob': 91, 'sideways_adx_thresh': 30.36238175949208, 'sideways_atr_min_pct': 0.018445435443135885, 'sideways_atr_max_pct': 0.021595228084348404, 'sideways_tp_mult': 1.87745528887992, 'sideways_tsl_mult': 0.15574879506870687, 'sideways_time_stop': 145, 'sideways_use_sma': True, 'sideways_use_ema': True, 'sideways_use_atr': False, 'sideways_use_adx': False, 'sideways_use_spike': False, 'sideways_rsi_required': True}.
[I 2025-08-31 10:40:31,269] Trial 354 finished with values: [-1000000000.0, 1000000000.0] and parameters: {'p_sma': 44, 'p_std': 12, 'p_atr': 9, 'p_adx': 15, 'rsi_period': 69, 'ema1': 14, 'ema2': 56, 'slip_atr_k': 0.008855628950798581, 'slip_spread_k': 0.322209826150189, 'spread_hl_frac': 0.009182592893811188, 'bb_std_mult': 2.592018209359778, 'rsi_os': 40, 'rsi_ob': 79, 'vol_spike': 0.07083388368853556, 'adx_thresh': 19.322132083256815, 'atr_min_pct': 0.0021342220810891717, 'atr_max_pct': 0.09980564794956415, 'tp_mult': 2.994056775792183, 'tsl_mult': 0.28300350922217987, 'strategy': 'breakout', 'time_stop': 65, 'use_sma': True, 'use_atr': False, 'use_adx': True, 'use_ema': False, 'use_spike': True, 'rsi_required': True, 'edge_k': 0.19096717094787696, 'edge_cap': 0.4754665026634781, 'bull_strategy': 'breakout', 'bull_bb_std_mult': 1.2093929189600585, 'bull_rsi_os': 16, 'bull_rsi_ob': 77, 'bull_adx_thresh': 6.195892958151706, 'bull_atr_min_pct': 0.017294247905972292, 'bull_atr_max_pct': 0.09255504225486645, 'bull_tp_mult': 1.09085809615621, 'bull_tsl_mult': 0.3487330732040198, 'bull_time_stop': 64, 'bull_use_sma': False, 'bull_use_ema': False, 'bull_use_atr': False, 'bull_use_adx': True, 'bull_use_spike': False, 'bull_rsi_required': True, 'bear_strategy': 'breakout', 'bear_bb_std_mult': 2.1154128274328454, 'bear_rsi_os': 40, 'bear_rsi_ob': 84, 'bear_adx_thresh': 5.682207730910843, 'bear_atr_min_pct': 0.005661854350184037, 'bear_atr_max_pct': 0.13157394541398543, 'bear_tp_mult': 2.905127918063149, 'bear_tsl_mult': 0.48744900212981085, 'bear_time_stop': 34, 'bear_use_sma': True, 'bear_use_ema': True, 'bear_use_atr': False, 'bear_use_adx': True, 'bear_use_spike': False, 'bear_rsi_required': False, 'sideways_strategy': 'mean_reversion', 'sideways_bb_std_mult': 2.8060854738220296, 'sideways_rsi_os': 9, 'sideways_rsi_ob': 92, 'sideways_adx_thresh': 14.012907251979652, 'sideways_atr_min_pct': 0.018553525576733756, 'sideways_atr_max_pct': 0.024560700240547934, 'sideways_tp_mult': 2.2320853558806566, 'sideways_tsl_mult': 0.152430721457001, 'sideways_time_stop': 12, 'sideways_use_sma': False, 'sideways_use_ema': False, 'sideways_use_atr': True, 'sideways_use_adx': False, 'sideways_use_spike': False, 'sideways_rsi_required': True}.
[I 2025-08-31 10:40:31,483] Trial 353 finished with values: [-1000000000.0, 1000000000.0] and parameters: {'p_sma': 58, 'p_std': 30, 'p_atr': 9, 'p_adx': 15, 'rsi_period': 70, 'ema1': 29, 'ema2': 16, 'slip_atr_k': 0.1801219978824098, 'slip_spread_k': 0.6516885465021635, 'spread_hl_frac': 0.009320708630256355, 'bb_std_mult': 2.6024097865170743, 'rsi_os': 7, 'rsi_ob': 76, 'vol_spike': 0.27213046960775894, 'adx_thresh': 28.002043001383896, 'atr_min_pct': 0.010307494096157952, 'atr_max_pct': 0.10042120265264665, 'tp_mult': 1.0243038277549288, 'tsl_mult': 0.2855942993271166, 'strategy': 'breakout', 'time_stop': 65, 'use_sma': True, 'use_atr': False, 'use_adx': True, 'use_ema': False, 'use_spike': True, 'rsi_required': True, 'edge_k': 0.18791453682340753, 'edge_cap': 0.47492241148523745, 'bull_strategy': 'breakout', 'bull_bb_std_mult': 2.9145529358954745, 'bull_rsi_os': 16, 'bull_rsi_ob': 77, 'bull_adx_thresh': 5.889154141567222, 'bull_atr_min_pct': 0.008136131599938994, 'bull_atr_max_pct': 0.09316011605066946, 'bull_tp_mult': 1.1360918455840854, 'bull_tsl_mult': 0.05366808280174967, 'bull_time_stop': 228, 'bull_use_sma': False, 'bull_use_ema': False, 'bull_use_atr': False, 'bull_use_adx': False, 'bull_use_spike': False, 'bull_rsi_required': True, 'bear_strategy': 'breakout', 'bear_bb_std_mult': 2.0949667869707236, 'bear_rsi_os': 42, 'bear_rsi_ob': 89, 'bear_adx_thresh': 5.504733486249732, 'bear_atr_min_pct': 0.0052958109306347236, 'bear_atr_max_pct': 0.11741267500405332, 'bear_tp_mult': 2.902801808204133, 'bear_tsl_mult': 0.4806240404817979, 'bear_time_stop': 35, 'bear_use_sma': True, 'bear_use_ema': True, 'bear_use_atr': False, 'bear_use_adx': True, 'bear_use_spike': False, 'bear_rsi_required': False, 'sideways_strategy': 'mean_reversion', 'sideways_bb_std_mult': 2.7746785143053136, 'sideways_rsi_os': 9, 'sideways_rsi_ob': 91, 'sideways_adx_thresh': 29.126502675901094, 'sideways_atr_min_pct': 0.018502185310056245, 'sideways_atr_max_pct': 0.024645155093383816, 'sideways_tp_mult': 1.447344241114865, 'sideways_tsl_mult': 0.1528098200405632, 'sideways_time_stop': 13, 'sideways_use_sma': False, 'sideways_use_ema': False, 'sideways_use_atr': True, 'sideways_use_adx': False, 'sideways_use_spike': False, 'sideways_rsi_required': True}.
[I 2025-08-31 10:40:31,590] Trial 352 finished with values: [-1000000000.0, 1000000000.0] and parameters: {'p_sma': 17, 'p_std': 28, 'p_atr': 12, 'p_adx': 13, 'rsi_period': 47, 'ema1': 13, 'ema2': 38, 'slip_atr_k': 0.13517798167741552, 'slip_spread_k': 0.9994787548695521, 'spread_hl_frac': 0.006840266079052077, 'bb_std_mult': 2.6107636300423156, 'rsi_os': 26, 'rsi_ob': 76, 'vol_spike': 0.27049188202582375, 'adx_thresh': 27.919881323857414, 'atr_min_pct': 0.009481693530721598, 'atr_max_pct': 0.10084789700145978, 'tp_mult': 2.8509441847723593, 'tsl_mult': 0.28565648827538903, 'strategy': 'mean_reversion', 'time_stop': 86, 'use_sma': True, 'use_atr': False, 'use_adx': True, 'use_ema': True, 'use_spike': True, 'rsi_required': True, 'edge_k': 1.7804520968821635, 'edge_cap': 0.4346852698744284, 'bull_strategy': 'mean_reversion', 'bull_bb_std_mult': 2.585206808366928, 'bull_rsi_os': 16, 'bull_rsi_ob': 76, 'bull_adx_thresh': 5.828037584459105, 'bull_atr_min_pct': 0.008277355548866426, 'bull_atr_max_pct': 0.09509018955579089, 'bull_tp_mult': 1.7806658907237294, 'bull_tsl_mult': 0.34462447753363273, 'bull_time_stop': 67, 'bull_use_sma': True, 'bull_use_ema': False, 'bull_use_atr': False, 'bull_use_adx': False, 'bull_use_spike': False, 'bull_rsi_required': True, 'bear_strategy': 'breakout', 'bear_bb_std_mult': 2.6414876449426816, 'bear_rsi_os': 42, 'bear_rsi_ob': 92, 'bear_adx_thresh': 5.650595282277199, 'bear_atr_min_pct': 0.005489455488753434, 'bear_atr_max_pct': 0.12171606699731942, 'bear_tp_mult': 1.7072564908346686, 'bear_tsl_mult': 0.48030600192208617, 'bear_time_stop': 34, 'bear_use_sma': False, 'bear_use_ema': True, 'bear_use_atr': False, 'bear_use_adx': False, 'bear_use_spike': False, 'bear_rsi_required': False, 'sideways_strategy': 'mean_reversion', 'sideways_bb_std_mult': 2.759490153727317, 'sideways_rsi_os': 5, 'sideways_rsi_ob': 91, 'sideways_adx_thresh': 8.136988984723706, 'sideways_atr_min_pct': 0.018549679868660983, 'sideways_atr_max_pct': 0.02756238153642234, 'sideways_tp_mult': 1.8489728281419249, 'sideways_tsl_mult': 0.1551251660967017, 'sideways_time_stop': 9, 'sideways_use_sma': True, 'sideways_use_ema': True, 'sideways_use_atr': False, 'sideways_use_adx': False, 'sideways_use_spike': False, 'sideways_rsi_required': True}.
[I 2025-08-31 10:41:02,740] Trial 357 finished with values: [-1000000000.0, 1000000000.0] and parameters: {'p_sma': 17, 'p_std': 29, 'p_atr': 12, 'p_adx': 14, 'rsi_period': 47, 'ema1': 24, 'ema2': 46, 'slip_atr_k': 0.016020729082867488, 'slip_spread_k': 0.08592057058145613, 'spread_hl_frac': 0.007008375007964203, 'bb_std_mult': 2.6532127187865338, 'rsi_os': 26, 'rsi_ob': 80, 'vol_spike': 0.2030175880426393, 'adx_thresh': 14.169606494944386, 'atr_min_pct': 0.005516068540126376, 'atr_max_pct': 0.09684948724382766, 'tp_mult': 2.384766612659145, 'tsl_mult': 0.2655155556736761, 'strategy': 'breakout', 'time_stop': 73, 'use_sma': True, 'use_atr': False, 'use_adx': True, 'use_ema': True, 'use_spike': True, 'rsi_required': True, 'edge_k': 0.5835213641580734, 'edge_cap': 0.5026928756034903, 'bull_strategy': 'breakout', 'bull_bb_std_mult': 2.6768716329395876, 'bull_rsi_os': 7, 'bull_rsi_ob': 45, 'bull_adx_thresh': 8.122217559875685, 'bull_atr_min_pct': 0.02179743950520451, 'bull_atr_max_pct': 0.08911225521535406, 'bull_tp_mult': 1.7817666076971141, 'bull_tsl_mult': 0.31465146652011533, 'bull_time_stop': 68, 'bull_use_sma': True, 'bull_use_ema': False, 'bull_use_atr': False, 'bull_use_adx': False, 'bull_use_spike': False, 'bull_rsi_required': True, 'bear_strategy': 'mean_reversion', 'bear_bb_std_mult': 1.9093072005280705, 'bear_rsi_os': 18, 'bear_rsi_ob': 87, 'bear_adx_thresh': 8.95833945146595, 'bear_atr_min_pct': 0.005432123835728667, 'bear_atr_max_pct': 0.13505518772968253, 'bear_tp_mult': 2.83491078576865, 'bear_tsl_mult': 0.517986571792603, 'bear_time_stop': 27, 'bear_use_sma': False, 'bear_use_ema': True, 'bear_use_atr': False, 'bear_use_adx': False, 'bear_use_spike': True, 'bear_rsi_required': False, 'sideways_strategy': 'mean_reversion', 'sideways_bb_std_mult': 2.734899639217549, 'sideways_rsi_os': 6, 'sideways_rsi_ob': 94, 'sideways_adx_thresh': 26.29514332949562, 'sideways_atr_min_pct': 0.02033838874107998, 'sideways_atr_max_pct': 0.026961651874028547, 'sideways_tp_mult': 2.019611996432773, 'sideways_tsl_mult': 0.5485517073913655, 'sideways_time_stop': 5, 'sideways_use_sma': False, 'sideways_use_ema': False, 'sideways_use_atr': False, 'sideways_use_adx': False, 'sideways_use_spike': False, 'sideways_rsi_required': True}.
[I 2025-08-31 10:41:02,856] Trial 358 finished with values: [-1000000000.0, 1000000000.0] and parameters: {'p_sma': 13, 'p_std': 30, 'p_atr': 10, 'p_adx': 14, 'rsi_period': 72, 'ema1': 14, 'ema2': 29, 'slip_atr_k': 0.15951820522249155, 'slip_spread_k': 0.736288927446098, 'spread_hl_frac': 0.007163296412367931, 'bb_std_mult': 2.80465295061356, 'rsi_os': 26, 'rsi_ob': 80, 'vol_spike': 0.25336347847404217, 'adx_thresh': 6.14590022199873, 'atr_min_pct': 0.021248486563089225, 'atr_max_pct': 0.039570567513969375, 'tp_mult': 2.3818914058273792, 'tsl_mult': 0.3285020710047302, 'strategy': 'breakout', 'time_stop': 75, 'use_sma': False, 'use_atr': False, 'use_adx': True, 'use_ema': True, 'use_spike': True, 'rsi_required': True, 'edge_k': 1.8515116632743422, 'edge_cap': 0.3801346449433514, 'bull_strategy': 'breakout', 'bull_bb_std_mult': 3.0786498648600187, 'bull_rsi_os': 8, 'bull_rsi_ob': 63, 'bull_adx_thresh': 8.340023130893734, 'bull_atr_min_pct': 0.021659091420528128, 'bull_atr_max_pct': 0.08098228237682216, 'bull_tp_mult': 1.057062947337632, 'bull_tsl_mult': 0.607875059334949, 'bull_time_stop': 82, 'bull_use_sma': True, 'bull_use_ema': False, 'bull_use_atr': False, 'bull_use_adx': False, 'bull_use_spike': False, 'bull_rsi_required': False, 'bear_strategy': 'mean_reversion', 'bear_bb_std_mult': 1.6888544098974272, 'bear_rsi_os': 18, 'bear_rsi_ob': 88, 'bear_adx_thresh': 9.071091042623182, 'bear_atr_min_pct': 0.006827801672638427, 'bear_atr_max_pct': 0.14732832386544165, 'bear_tp_mult': 1.418411768376778, 'bear_tsl_mult': 0.5203341637092882, 'bear_time_stop': 114, 'bear_use_sma': False, 'bear_use_ema': True, 'bear_use_atr': False, 'bear_use_adx': False, 'bear_use_spike': True, 'bear_rsi_required': False, 'sideways_strategy': 'mean_reversion', 'sideways_bb_std_mult': 1.3311103398383886, 'sideways_rsi_os': 6, 'sideways_rsi_ob': 94, 'sideways_adx_thresh': 26.334605006859, 'sideways_atr_min_pct': 0.017772032891771077, 'sideways_atr_max_pct': 0.05404390164925475, 'sideways_tp_mult': 1.5828300295608848, 'sideways_tsl_mult': 0.09006385794561615, 'sideways_time_stop': 29, 'sideways_use_sma': False, 'sideways_use_ema': False, 'sideways_use_atr': False, 'sideways_use_adx': False, 'sideways_use_spike': False, 'sideways_rsi_required': True}.
[I 2025-08-31 10:41:03,019] Trial 356 finished with values: [-1000000000.0, 1000000000.0] and parameters: {'p_sma': 13, 'p_std': 31, 'p_atr': 12, 'p_adx': 15, 'rsi_period': 47, 'ema1': 14, 'ema2': 47, 'slip_atr_k': 0.015798808401910648, 'slip_spread_k': 0.08299100192177011, 'spread_hl_frac': 0.007065453040822366, 'bb_std_mult': 2.6672367289184797, 'rsi_os': 13, 'rsi_ob': 81, 'vol_spike': 0.27123169593123275, 'adx_thresh': 27.98361192301622, 'atr_min_pct': 0.0004209042860852316, 'atr_max_pct': 0.03941760902707425, 'tp_mult': 2.3859338083769908, 'tsl_mult': 0.27549312252783487, 'strategy': 'breakout', 'time_stop': 74, 'use_sma': True, 'use_atr': False, 'use_adx': True, 'use_ema': True, 'use_spike': True, 'rsi_required': True, 'edge_k': 0.23930675876812846, 'edge_cap': 0.476548926329971, 'bull_strategy': 'breakout', 'bull_bb_std_mult': 3.1507161597832534, 'bull_rsi_os': 9, 'bull_rsi_ob': 76, 'bull_adx_thresh': 5.576100114618541, 'bull_atr_min_pct': 0.00814228163416527, 'bull_atr_max_pct': 0.10639298151284228, 'bull_tp_mult': 1.8732295444418061, 'bull_tsl_mult': 0.7496229530641613, 'bull_time_stop': 68, 'bull_use_sma': False, 'bull_use_ema': False, 'bull_use_atr': False, 'bull_use_adx': False, 'bull_use_spike': False, 'bull_rsi_required': True, 'bear_strategy': 'mean_reversion', 'bear_bb_std_mult': 2.652912290684569, 'bear_rsi_os': 17, 'bear_rsi_ob': 89, 'bear_adx_thresh': 9.355550101998476, 'bear_atr_min_pct': 0.0054194415787633555, 'bear_atr_max_pct': 0.11561284380872841, 'bear_tp_mult': 1.8639892146520267, 'bear_tsl_mult': 0.652091099892659, 'bear_time_stop': 114, 'bear_use_sma': False, 'bear_use_ema': True, 'bear_use_atr': False, 'bear_use_adx': False, 'bear_use_spike': False, 'bear_rsi_required': False, 'sideways_strategy': 'mean_reversion', 'sideways_bb_std_mult': 2.7748120039093482, 'sideways_rsi_os': 6, 'sideways_rsi_ob': 94, 'sideways_adx_thresh': 29.402390912852226, 'sideways_atr_min_pct': 0.020101787941836077, 'sideways_atr_max_pct': 0.02546268589632531, 'sideways_tp_mult': 2.0169879351709197, 'sideways_tsl_mult': 0.09114436890391961, 'sideways_time_stop': 29, 'sideways_use_sma': False, 'sideways_use_ema': False, 'sideways_use_atr': False, 'sideways_use_adx': False, 'sideways_use_spike': False, 'sideways_rsi_required': True}.
[I 2025-08-31 10:41:03,141] Trial 355 finished with values: [-1000000000.0, 1000000000.0] and parameters: {'p_sma': 25, 'p_std': 30, 'p_atr': 10, 'p_adx': 15, 'rsi_period': 58, 'ema1': 29, 'ema2': 56, 'slip_atr_k': 0.22509141363218937, 'slip_spread_k': 0.7419888557179712, 'spread_hl_frac': 0.0071882530821289065, 'bb_std_mult': 2.6359818897705485, 'rsi_os': 26, 'rsi_ob': 81, 'vol_spike': 0.2720802510715677, 'adx_thresh': 6.260562343160144, 'atr_min_pct': 0.02167523361788349, 'atr_max_pct': 0.10105941580865428, 'tp_mult': 2.3901419474157723, 'tsl_mult': 0.2782514934599299, 'strategy': 'breakout', 'time_stop': 63, 'use_sma': True, 'use_atr': False, 'use_adx': True, 'use_ema': True, 'use_spike': True, 'rsi_required': True, 'edge_k': 0.24229847030274612, 'edge_cap': 0.4738364568842747, 'bull_strategy': 'breakout', 'bull_bb_std_mult': 1.234410632462434, 'bull_rsi_os': 8, 'bull_rsi_ob': 77, 'bull_adx_thresh': 6.045917317187696, 'bull_atr_min_pct': 0.01578694448469094, 'bull_atr_max_pct': 0.10661527287717176, 'bull_tp_mult': 1.1689836029937113, 'bull_tsl_mult': 0.22043401199362922, 'bull_time_stop': 67, 'bull_use_sma': False, 'bull_use_ema': False, 'bull_use_atr': False, 'bull_use_adx': False, 'bull_use_spike': False, 'bull_rsi_required': True, 'bear_strategy': 'mean_reversion', 'bear_bb_std_mult': 2.08815125722622, 'bear_rsi_os': 42, 'bear_rsi_ob': 84, 'bear_adx_thresh': 5.658872860507782, 'bear_atr_min_pct': 0.005353275733595795, 'bear_atr_max_pct': 0.13007030411921952, 'bear_tp_mult': 2.895788367272782, 'bear_tsl_mult': 0.5237621515171883, 'bear_time_stop': 30, 'bear_use_sma': True, 'bear_use_ema': True, 'bear_use_atr': False, 'bear_use_adx': False, 'bear_use_spike': False, 'bear_rsi_required': False, 'sideways_strategy': 'mean_reversion', 'sideways_bb_std_mult': 3.2850629967033838, 'sideways_rsi_os': 9, 'sideways_rsi_ob': 92, 'sideways_adx_thresh': 14.16484783895121, 'sideways_atr_min_pct': 0.017843163961016935, 'sideways_atr_max_pct': 0.024758542370207682, 'sideways_tp_mult': 1.462614876658451, 'sideways_tsl_mult': 0.0908515230651487, 'sideways_time_stop': 10, 'sideways_use_sma': False, 'sideways_use_ema': False, 'sideways_use_atr': True, 'sideways_use_adx': False, 'sideways_use_spike': False, 'sideways_rsi_required': True}.
[I 2025-08-31 10:41:34,756] Trial 361 finished with values: [-1000000000.0, 1000000000.0] and parameters: {'p_sma': 15, 'p_std': 30, 'p_atr': 10, 'p_adx': 12, 'rsi_period': 66, 'ema1': 26, 'ema2': 56, 'slip_atr_k': 0.22711531295489845, 'slip_spread_k': 0.5186676855324016, 'spread_hl_frac': 0.04856171351083108, 'bb_std_mult': 2.705099215605847, 'rsi_os': 25, 'rsi_ob': 78, 'vol_spike': 0.25715250907268183, 'adx_thresh': 24.343541435510165, 'atr_min_pct': 0.01616846125752084, 'atr_max_pct': 0.026688340124725478, 'tp_mult': 2.437467762224023, 'tsl_mult': 0.18878272188824508, 'strategy': 'breakout', 'time_stop': 55, 'use_sma': True, 'use_atr': False, 'use_adx': True, 'use_ema': True, 'use_spike': False, 'rsi_required': True, 'edge_k': 0.2626929808622652, 'edge_cap': 0.49703829232697133, 'bull_strategy': 'breakout', 'bull_bb_std_mult': 0.6824193809485678, 'bull_rsi_os': 11, 'bull_rsi_ob': 49, 'bull_adx_thresh': 6.627951689030176, 'bull_atr_min_pct': 0.016440714889441762, 'bull_atr_max_pct': 0.08792084364588912, 'bull_tp_mult': 1.7105351368532162, 'bull_tsl_mult': 0.36895929590167814, 'bull_time_stop': 213, 'bull_use_sma': True, 'bull_use_ema': False, 'bull_use_atr': False, 'bull_use_adx': True, 'bull_use_spike': False, 'bull_rsi_required': True, 'bear_strategy': 'breakout', 'bear_bb_std_mult': 1.966177398647217, 'bear_rsi_os': 40, 'bear_rsi_ob': 91, 'bear_adx_thresh': 7.268733131045117, 'bear_atr_min_pct': 0.006609194688444002, 'bear_atr_max_pct': 0.13052712629476665, 'bear_tp_mult': 2.853290880991769, 'bear_tsl_mult': 0.32791545097016656, 'bear_time_stop': 236, 'bear_use_sma': True, 'bear_use_ema': False, 'bear_use_atr': True, 'bear_use_adx': False, 'bear_use_spike': True, 'bear_rsi_required': False, 'sideways_strategy': 'mean_reversion', 'sideways_bb_std_mult': 2.639784667600072, 'sideways_rsi_os': 10, 'sideways_rsi_ob': 92, 'sideways_adx_thresh': 5.168393272860419, 'sideways_atr_min_pct': 0.017908378553487633, 'sideways_atr_max_pct': 0.052070724751697245, 'sideways_tp_mult': 1.9546696311836205, 'sideways_tsl_mult': 0.9130686428589803, 'sideways_time_stop': 21, 'sideways_use_sma': False, 'sideways_use_ema': False, 'sideways_use_atr': True, 'sideways_use_adx': False, 'sideways_use_spike': False, 'sideways_rsi_required': True}.
