[I 2025-08-31 11:51:23,810] Trial 872 finished with values: [-1000000000.0, 1000000000.0] and parameters: {'p_sma': 60, 'p_std': 28, 'p_atr': 15, 'p_adx': 26, 'rsi_period': 50, 'ema1': 12, 'ema2': 24, 'slip_atr_k': 0.1309454876863569, 'slip_spread_k': 0.15237330994733636, 'spread_hl_frac': 0.039816159629129974, 'bb_std_mult': 2.439291002122496, 'rsi_os': 33, 'rsi_ob': 93, 'vol_spike': 0.11774510604664866, 'adx_thresh': 19.93473644488348, 'atr_min_pct': 0.01249410776553598, 'atr_max_pct': 0.1345938561908346, 'tp_mult': 1.497740113840038, 'tsl_mult': 0.09960564626263091, 'strategy': 'breakout', 'time_stop': 191, 'use_sma': True, 'use_atr': True, 'use_adx': False, 'use_ema': False, 'use_spike': True, 'rsi_required': False, 'edge_k': 0.4515494117221521, 'edge_cap': 0.7298605167926642, 'bull_strategy': 'breakout', 'bull_bb_std_mult': 0.5571185626225806, 'bull_rsi_os': 25, 'bull_rsi_ob': 85, 'bull_adx_thresh': 13.769707388913345, 'bull_atr_min_pct': 0.0026053337413034037, 'bull_atr_max_pct': 0.024412459093904805, 'bull_tp_mult': 2.7232804801962263, 'bull_tsl_mult': 0.8147078037482639, 'bull_time_stop': 225, 'bull_use_sma': False, 'bull_use_ema': True, 'bull_use_atr': False, 'bull_use_adx': False, 'bull_use_spike': False, 'bull_rsi_required': True, 'bear_strategy': 'breakout', 'bear_bb_std_mult': 3.549609361401162, 'bear_rsi_os': 44, 'bear_rsi_ob': 71, 'bear_adx_thresh': 18.320562051602085, 'bear_atr_min_pct': 0.021060031681806927, 'bear_atr_max_pct': 0.13391506158246477, 'bear_tp_mult': 2.9101243082306505, 'bear_tsl_mult': 0.7853502928280366, 'bear_time_stop': 17, 'bear_use_sma': False, 'bear_use_ema': True, 'bear_use_atr': False, 'bear_use_adx': True, 'bear_use_spike': False, 'bear_rsi_required': True, 'sideways_strategy': 'breakout', 'sideways_bb_std_mult': 1.7996474942114666, 'sideways_rsi_os': 51, 'sideways_rsi_ob': 73, 'sideways_adx_thresh': 9.799225863769676, 'sideways_atr_min_pct': 0.017644668547626755, 'sideways_atr_max_pct': 0.041669655216822886, 'sideways_tp_mult': 2.86834447060461, 'sideways_tsl_mult': 0.4333250980635565, 'sideways_time_stop': 21, 'sideways_use_sma': False, 'sideways_use_ema': True, 'sideways_use_atr': True, 'sideways_use_adx': False, 'sideways_use_spike': True, 'sideways_rsi_required': True}.
[I 2025-08-31 11:51:59,807] Trial 877 finished with values: [-1000000000.0, 1000000000.0] and parameters: {'p_sma': 13, 'p_std': 37, 'p_atr': 15, 'p_adx': 14, 'rsi_period': 18, 'ema1': 13, 'ema2': 42, 'slip_atr_k': 0.2378423192200932, 'slip_spread_k': 0.18550832923843164, 'spread_hl_frac': 0.03199993385976346, 'bb_std_mult': 2.516131869774129, 'rsi_os': 31, 'rsi_ob': 92, 'vol_spike': 0.12804114653373175, 'adx_thresh': 12.644677949306324, 'atr_min_pct': 0.013108016037496915, 'atr_max_pct': 0.13680140739709318, 'tp_mult': 1.297279526280565, 'tsl_mult': 0.06655804818500073, 'strategy': 'breakout', 'time_stop': 127, 'use_sma': False, 'use_atr': True, 'use_adx': False, 'use_ema': True, 'use_spike': True, 'rsi_required': False, 'edge_k': 0.5006836743353755, 'edge_cap': 0.7900246401753295, 'bull_strategy': 'mean_reversion', 'bull_bb_std_mult': 1.8609671965656784, 'bull_rsi_os': 26, 'bull_rsi_ob': 82, 'bull_adx_thresh': 5.520355069120046, 'bull_atr_min_pct': 0.0231753825268724, 'bull_atr_max_pct': 0.1183746205062351, 'bull_tp_mult': 2.647522225912555, 'bull_tsl_mult': 0.859462493668502, 'bull_time_stop': 283, 'bull_use_sma': False, 'bull_use_ema': True, 'bull_use_atr': False, 'bull_use_adx': True, 'bull_use_spike': False, 'bull_rsi_required': False, 'bear_strategy': 'breakout', 'bear_bb_std_mult': 3.4174432518518594, 'bear_rsi_os': 48, 'bear_rsi_ob': 69, 'bear_adx_thresh': 34.41421304259939, 'bear_atr_min_pct': 0.009282793963233123, 'bear_atr_max_pct': 0.14262804152053782, 'bear_tp_mult': 1.8160596207624047, 'bear_tsl_mult': 0.846656035770469, 'bear_time_stop': 22, 'bear_use_sma': False, 'bear_use_ema': True, 'bear_use_atr': False, 'bear_use_adx': False, 'bear_use_spike': False, 'bear_rsi_required': True, 'sideways_strategy': 'breakout', 'sideways_bb_std_mult': 2.7124421055750236, 'sideways_rsi_os': 24, 'sideways_rsi_ob': 58, 'sideways_adx_thresh': 12.955144556200885, 'sideways_atr_min_pct': 0.022839077676599283, 'sideways_atr_max_pct': 0.0431599934814208, 'sideways_tp_mult': 2.9236839845526923, 'sideways_tsl_mult': 0.5045210022173522, 'sideways_time_stop': 14, 'sideways_use_sma': False, 'sideways_use_ema': False, 'sideways_use_atr': True, 'sideways_use_adx': False, 'sideways_use_spike': True, 'sideways_rsi_required': True}.
[I 2025-08-31 11:52:00,162] Trial 876 finished with values: [-0.048492890322940574, 0.04841901160586267] and parameters: {'p_sma': 41, 'p_std': 27, 'p_atr': 15, 'p_adx': 14, 'rsi_period': 50, 'ema1': 12, 'ema2': 43, 'slip_atr_k': 0.01876127620780907, 'slip_spread_k': 0.1775772255598994, 'spread_hl_frac': 0.0021552628556530534, 'bb_std_mult': 2.187090889988104, 'rsi_os': 31, 'rsi_ob': 64, 'vol_spike': 0.13662193369841752, 'adx_thresh': 31.706501165801512, 'atr_min_pct': 0.012740644499738678, 'atr_max_pct': 0.13604537789342908, 'tp_mult': 1.2715949198328744, 'tsl_mult': 0.09228129698874354, 'strategy': 'breakout', 'time_stop': 198, 'use_sma': True, 'use_atr': True, 'use_adx': False, 'use_ema': True, 'use_spike': True, 'rsi_required': False, 'edge_k': 0.4366220175757486, 'edge_cap': 0.7921005541833688, 'bull_strategy': 'mean_reversion', 'bull_bb_std_mult': 3.0545185565790094, 'bull_rsi_os': 24, 'bull_rsi_ob': 58, 'bull_adx_thresh': 5.502665146029551, 'bull_atr_min_pct': 0.0011134243275981778, 'bull_atr_max_pct': 0.09529945455408775, 'bull_tp_mult': 2.6965566346349203, 'bull_tsl_mult': 0.8560633513737745, 'bull_time_stop': 282, 'bull_use_sma': False, 'bull_use_ema': True, 'bull_use_atr': False, 'bull_use_adx': True, 'bull_use_spike': False, 'bull_rsi_required': True, 'bear_strategy': 'breakout', 'bear_bb_std_mult': 3.590455511468809, 'bear_rsi_os': 47, 'bear_rsi_ob': 71, 'bear_adx_thresh': 14.090589347923348, 'bear_atr_min_pct': 0.00307807154801085, 'bear_atr_max_pct': 0.05271780088494652, 'bear_tp_mult': 1.8180081235433265, 'bear_tsl_mult': 0.780125425710289, 'bear_time_stop': 24, 'bear_use_sma': False, 'bear_use_ema': True, 'bear_use_atr': False, 'bear_use_adx': False, 'bear_use_spike': False, 'bear_rsi_required': True, 'sideways_strategy': 'breakout', 'sideways_bb_std_mult': 0.8982239436902806, 'sideways_rsi_os': 24, 'sideways_rsi_ob': 95, 'sideways_adx_thresh': 13.00900478794692, 'sideways_atr_min_pct': 0.025640496344217244, 'sideways_atr_max_pct': 0.04205758440807554, 'sideways_tp_mult': 2.8407421734612828, 'sideways_tsl_mult': 0.39824612827074485, 'sideways_time_stop': 192, 'sideways_use_sma': False, 'sideways_use_ema': False, 'sideways_use_atr': True, 'sideways_use_adx': False, 'sideways_use_spike': True, 'sideways_rsi_required': True}.
[I 2025-08-31 11:52:01,041] Trial 874 finished with values: [-1000000000.0, 1000000000.0] and parameters: {'p_sma': 40, 'p_std': 28, 'p_atr': 15, 'p_adx': 14, 'rsi_period': 83, 'ema1': 12, 'ema2': 34, 'slip_atr_k': 0.16328371134626501, 'slip_spread_k': 0.17424837950852848, 'spread_hl_frac': 0.007302497038878985, 'bb_std_mult': 2.518572832639662, 'rsi_os': 31, 'rsi_ob': 91, 'vol_spike': 0.12874530556563876, 'adx_thresh': 31.465795808125286, 'atr_min_pct': 0.012910557881976394, 'atr_max_pct': 0.1364430873130591, 'tp_mult': 1.270916004587312, 'tsl_mult': 0.09304254648710852, 'strategy': 'breakout', 'time_stop': 201, 'use_sma': True, 'use_atr': True, 'use_adx': False, 'use_ema': False, 'use_spike': True, 'rsi_required': False, 'edge_k': 0.44980285018905586, 'edge_cap': 0.7931750116527193, 'bull_strategy': 'mean_reversion', 'bull_bb_std_mult': 0.5603855847552524, 'bull_rsi_os': 26, 'bull_rsi_ob': 83, 'bull_adx_thresh': 5.023399830367557, 'bull_atr_min_pct': 0.022863260649631595, 'bull_atr_max_pct': 0.09186681068676888, 'bull_tp_mult': 2.696813146969183, 'bull_tsl_mult': 0.8542631541771419, 'bull_time_stop': 281, 'bull_use_sma': False, 'bull_use_ema': True, 'bull_use_atr': False, 'bull_use_adx': False, 'bull_use_spike': False, 'bull_rsi_required': True, 'bear_strategy': 'breakout', 'bear_bb_std_mult': 3.3899791608409444, 'bear_rsi_os': 48, 'bear_rsi_ob': 71, 'bear_adx_thresh': 20.52923455555915, 'bear_atr_min_pct': 0.0086074501684898, 'bear_atr_max_pct': 0.031205781859793738, 'bear_tp_mult': 2.9134295761105555, 'bear_tsl_mult': 0.1975055164008901, 'bear_time_stop': 24, 'bear_use_sma': False, 'bear_use_ema': True, 'bear_use_atr': False, 'bear_use_adx': True, 'bear_use_spike': False, 'bear_rsi_required': True, 'sideways_strategy': 'breakout', 'sideways_bb_std_mult': 1.0450587400191234, 'sideways_rsi_os': 24, 'sideways_rsi_ob': 94, 'sideways_adx_thresh': 11.303548923878562, 'sideways_atr_min_pct': 0.0019792967441799, 'sideways_atr_max_pct': 0.12145294830520251, 'sideways_tp_mult': 2.9304257763695656, 'sideways_tsl_mult': 0.42968655099178515, 'sideways_time_stop': 115, 'sideways_use_sma': False, 'sideways_use_ema': True, 'sideways_use_atr': True, 'sideways_use_adx': False, 'sideways_use_spike': True, 'sideways_rsi_required': True}.
[I 2025-08-31 11:52:01,209] Trial 875 finished with values: [-1000000000.0, 1000000000.0] and parameters: {'p_sma': 39, 'p_std': 37, 'p_atr': 15, 'p_adx': 14, 'rsi_period': 50, 'ema1': 12, 'ema2': 24, 'slip_atr_k': 0.13891670929751476, 'slip_spread_k': 0.8189507006666006, 'spread_hl_frac': 0.00238084818755201, 'bb_std_mult': 2.4869804110556877, 'rsi_os': 32, 'rsi_ob': 92, 'vol_spike': 0.12605819411926134, 'adx_thresh': 31.620111728340333, 'atr_min_pct': 0.01294531069981119, 'atr_max_pct': 0.13629745545737218, 'tp_mult': 1.2751763459679224, 'tsl_mult': 0.09106692754615145, 'strategy': 'breakout', 'time_stop': 202, 'use_sma': True, 'use_atr': True, 'use_adx': False, 'use_ema': False, 'use_spike': True, 'rsi_required': False, 'edge_k': 0.4350181584443479, 'edge_cap': 0.7937199608943084, 'bull_strategy': 'mean_reversion', 'bull_bb_std_mult': 0.6176849498345471, 'bull_rsi_os': 24, 'bull_rsi_ob': 83, 'bull_adx_thresh': 5.4991190044905425, 'bull_atr_min_pct': 0.003993423749101846, 'bull_atr_max_pct': 0.09254459687383493, 'bull_tp_mult': 2.6447073643840877, 'bull_tsl_mult': 0.7796615119605923, 'bull_time_stop': 282, 'bull_use_sma': False, 'bull_use_ema': True, 'bull_use_atr': False, 'bull_use_adx': False, 'bull_use_spike': False, 'bull_rsi_required': True, 'bear_strategy': 'breakout', 'bear_bb_std_mult': 3.400067693025111, 'bear_rsi_os': 48, 'bear_rsi_ob': 71, 'bear_adx_thresh': 13.952471206414689, 'bear_atr_min_pct': 0.019659106790731455, 'bear_atr_max_pct': 0.053019477449411975, 'bear_tp_mult': 2.9041596496798854, 'bear_tsl_mult': 0.30460785143461977, 'bear_time_stop': 24, 'bear_use_sma': False, 'bear_use_ema': True, 'bear_use_atr': False, 'bear_use_adx': True, 'bear_use_spike': False, 'bear_rsi_required': True, 'sideways_strategy': 'breakout', 'sideways_bb_std_mult': 2.722234789336575, 'sideways_rsi_os': 51, 'sideways_rsi_ob': 60, 'sideways_adx_thresh': 11.43027232348813, 'sideways_atr_min_pct': 0.02736245139282699, 'sideways_atr_max_pct': 0.042297331807645555, 'sideways_tp_mult': 2.8381935580201283, 'sideways_tsl_mult': 0.797079913591407, 'sideways_time_stop': 20, 'sideways_use_sma': False, 'sideways_use_ema': True, 'sideways_use_atr': True, 'sideways_use_adx': False, 'sideways_use_spike': True, 'sideways_rsi_required': True}.
[I 2025-08-31 11:52:38,433] Trial 879 finished with values: [-1000000000.0, 1000000000.0] and parameters: {'p_sma': 15, 'p_std': 54, 'p_atr': 8, 'p_adx': 15, 'rsi_period': 7, 'ema1': 5, 'ema2': 35, 'slip_atr_k': 0.13715073358473676, 'slip_spread_k': 0.8154459462346824, 'spread_hl_frac': 0.00715851756288394, 'bb_std_mult': 2.2468146979715193, 'rsi_os': 32, 'rsi_ob': 91, 'vol_spike': 0.10841842071458488, 'adx_thresh': 9.83320107620158, 'atr_min_pct': 0.014777723765444341, 'atr_max_pct': 0.1405169961666571, 'tp_mult': 1.2520921983241522, 'tsl_mult': 0.08579482962479279, 'strategy': 'breakout', 'time_stop': 177, 'use_sma': True, 'use_atr': True, 'use_adx': False, 'use_ema': True, 'use_spike': False, 'rsi_required': False, 'edge_k': 0.4196587030863268, 'edge_cap': 0.7670695723843798, 'bull_strategy': 'breakout', 'bull_bb_std_mult': 0.6478373888423125, 'bull_rsi_os': 24, 'bull_rsi_ob': 83, 'bull_adx_thresh': 6.109447045007633, 'bull_atr_min_pct': 0.004260544791716053, 'bull_atr_max_pct': 0.044887311001783774, 'bull_tp_mult': 2.630491806975193, 'bull_tsl_mult': 0.7794864889775326, 'bull_time_stop': 18, 'bull_use_sma': False, 'bull_use_ema': True, 'bull_use_atr': False, 'bull_use_adx': False, 'bull_use_spike': True, 'bull_rsi_required': True, 'bear_strategy': 'breakout', 'bear_bb_std_mult': 0.869752320227402, 'bear_rsi_os': 49, 'bear_rsi_ob': 49, 'bear_adx_thresh': 13.42694262932741, 'bear_atr_min_pct': 0.02553209476999338, 'bear_atr_max_pct': 0.13804366438680593, 'bear_tp_mult': 2.875103083425148, 'bear_tsl_mult': 0.7364681383411444, 'bear_time_stop': 25, 'bear_use_sma': False, 'bear_use_ema': True, 'bear_use_atr': True, 'bear_use_adx': False, 'bear_use_spike': False, 'bear_rsi_required': True, 'sideways_strategy': 'breakout', 'sideways_bb_std_mult': 1.9801895627461565, 'sideways_rsi_os': 43, 'sideways_rsi_ob': 47, 'sideways_adx_thresh': 11.347131375393435, 'sideways_atr_min_pct': 0.01104254997694775, 'sideways_atr_max_pct': 0.04514905138223691, 'sideways_tp_mult': 2.9937051164385187, 'sideways_tsl_mult': 0.4643169206745866, 'sideways_time_stop': 280, 'sideways_use_sma': False, 'sideways_use_ema': False, 'sideways_use_atr': True, 'sideways_use_adx': False, 'sideways_use_spike': True, 'sideways_rsi_required': True}.
[I 2025-08-31 11:52:38,842] Trial 880 finished with values: [-0.03193328396276429, 0.03174893151625021] and parameters: {'p_sma': 47, 'p_std': 31, 'p_atr': 8, 'p_adx': 15, 'rsi_period': 26, 'ema1': 10, 'ema2': 42, 'slip_atr_k': 0.023466925866356007, 'slip_spread_k': 0.22154977807558343, 'spread_hl_frac': 0.005827043985836895, 'bb_std_mult': 2.237630541301178, 'rsi_os': 32, 'rsi_ob': 54, 'vol_spike': 0.1087268824965122, 'adx_thresh': 11.063174274081112, 'atr_min_pct': 0.021896981606076116, 'atr_max_pct': 0.14091782612496265, 'tp_mult': 1.1567533035090598, 'tsl_mult': 0.0694953511652945, 'strategy': 'breakout', 'time_stop': 201, 'use_sma': True, 'use_atr': True, 'use_adx': False, 'use_ema': True, 'use_spike': False, 'rsi_required': False, 'edge_k': 0.3759792043475242, 'edge_cap': 0.7690969555957329, 'bull_strategy': 'breakout', 'bull_bb_std_mult': 0.6036000448350409, 'bull_rsi_os': 27, 'bull_rsi_ob': 65, 'bull_adx_thresh': 6.103938948324771, 'bull_atr_min_pct': 0.004449741254382623, 'bull_atr_max_pct': 0.072042920873116, 'bull_tp_mult': 2.6306374572611704, 'bull_tsl_mult': 0.7924827139760456, 'bull_time_stop': 115, 'bull_use_sma': False, 'bull_use_ema': True, 'bull_use_atr': False, 'bull_use_adx': False, 'bull_use_spike': True, 'bull_rsi_required': False, 'bear_strategy': 'breakout', 'bear_bb_std_mult': 0.84701966232125, 'bear_rsi_os': 49, 'bear_rsi_ob': 72, 'bear_adx_thresh': 33.732862436674814, 'bear_atr_min_pct': 0.004566602590257873, 'bear_atr_max_pct': 0.1387573511323474, 'bear_tp_mult': 2.8572584745993335, 'bear_tsl_mult': 0.7380552647515977, 'bear_time_stop': 8, 'bear_use_sma': False, 'bear_use_ema': True, 'bear_use_atr': True, 'bear_use_adx': False, 'bear_use_spike': False, 'bear_rsi_required': True, 'sideways_strategy': 'breakout', 'sideways_bb_std_mult': 2.673403311238157, 'sideways_rsi_os': 43, 'sideways_rsi_ob': 94, 'sideways_adx_thresh': 11.57833263211887, 'sideways_atr_min_pct': 0.014711091010823468, 'sideways_atr_max_pct': 0.07272403181282956, 'sideways_tp_mult': 2.999214499912376, 'sideways_tsl_mult': 0.37323051902499094, 'sideways_time_stop': 238, 'sideways_use_sma': False, 'sideways_use_ema': False, 'sideways_use_atr': True, 'sideways_use_adx': False, 'sideways_use_spike': True, 'sideways_rsi_required': True}.
[I 2025-08-31 11:52:39,062] Trial 881 finished with values: [-1000000000.0, 1000000000.0] and parameters: {'p_sma': 16, 'p_std': 59, 'p_atr': 7, 'p_adx': 25, 'rsi_period': 52, 'ema1': 5, 'ema2': 42, 'slip_atr_k': 0.023759440354073413, 'slip_spread_k': 0.15223257069762, 'spread_hl_frac': 0.029506963213941403, 'bb_std_mult': 2.2297903029441537, 'rsi_os': 30, 'rsi_ob': 60, 'vol_spike': 0.09621920756221342, 'adx_thresh': 11.103618244829377, 'atr_min_pct': 0.022503028402235944, 'atr_max_pct': 0.1401217982670817, 'tp_mult': 1.370616511937143, 'tsl_mult': 0.0562515844713168, 'strategy': 'mean_reversion', 'time_stop': 154, 'use_sma': False, 'use_atr': True, 'use_adx': False, 'use_ema': True, 'use_spike': False, 'rsi_required': False, 'edge_k': 0.3858278102920353, 'edge_cap': 0.769072982668467, 'bull_strategy': 'breakout', 'bull_bb_std_mult': 1.6255919291810226, 'bull_rsi_os': 27, 'bull_rsi_ob': 81, 'bull_adx_thresh': 5.965417147679037, 'bull_atr_min_pct': 0.004352438990027776, 'bull_atr_max_pct': 0.07271138681831865, 'bull_tp_mult': 2.624201717750708, 'bull_tsl_mult': 0.7883758215885978, 'bull_time_stop': 114, 'bull_use_sma': False, 'bull_use_ema': True, 'bull_use_atr': False, 'bull_use_adx': False, 'bull_use_spike': True, 'bull_rsi_required': False, 'bear_strategy': 'mean_reversion', 'bear_bb_std_mult': 3.2111667351294044, 'bear_rsi_os': 49, 'bear_rsi_ob': 67, 'bear_adx_thresh': 5.688337854504924, 'bear_atr_min_pct': 0.014080340594438606, 'bear_atr_max_pct': 0.09297466659509701, 'bear_tp_mult': 2.85966563561163, 'bear_tsl_mult': 0.24200095172464142, 'bear_time_stop': 7, 'bear_use_sma': True, 'bear_use_ema': True, 'bear_use_atr': True, 'bear_use_adx': False, 'bear_use_spike': False, 'bear_rsi_required': True, 'sideways_strategy': 'breakout', 'sideways_bb_std_mult': 1.9706934813983792, 'sideways_rsi_os': 23, 'sideways_rsi_ob': 65, 'sideways_adx_thresh': 11.898462492418545, 'sideways_atr_min_pct': 0.014759333164879835, 'sideways_atr_max_pct': 0.07340003100097477, 'sideways_tp_mult': 2.971506967601197, 'sideways_tsl_mult': 0.4712435208378234, 'sideways_time_stop': 96, 'sideways_use_sma': True, 'sideways_use_ema': False, 'sideways_use_atr': True, 'sideways_use_adx': False, 'sideways_use_spike': True, 'sideways_rsi_required': True}.
[I 2025-08-31 11:52:39,194] Trial 878 finished with values: [-0.06168726804296221, 0.06151199624969495] and parameters: {'p_sma': 47, 'p_std': 60, 'p_atr': 15, 'p_adx': 15, 'rsi_period': 50, 'ema1': 11, 'ema2': 43, 'slip_atr_k': 0.018600223179528662, 'slip_spread_k': 0.9463052670529221, 'spread_hl_frac': 0.029842226289996835, 'bb_std_mult': 2.2475013605693026, 'rsi_os': 31, 'rsi_ob': 61, 'vol_spike': 0.13479128735228776, 'adx_thresh': 31.63967238881833, 'atr_min_pct': 0.012875739732253241, 'atr_max_pct': 0.1400578860703927, 'tp_mult': 1.2907128331020625, 'tsl_mult': 0.16567083858473408, 'strategy': 'breakout', 'time_stop': 200, 'use_sma': True, 'use_atr': True, 'use_adx': False, 'use_ema': True, 'use_spike': False, 'rsi_required': False, 'edge_k': 0.434986848284623, 'edge_cap': 0.8020378363408848, 'bull_strategy': 'breakout', 'bull_bb_std_mult': 3.0263426491573373, 'bull_rsi_os': 24, 'bull_rsi_ob': 59, 'bull_adx_thresh': 5.577777856979344, 'bull_atr_min_pct': 0.0014119113733104633, 'bull_atr_max_pct': 0.10214227959577228, 'bull_tp_mult': 2.6392784977906314, 'bull_tsl_mult': 0.84774748968678, 'bull_time_stop': 283, 'bull_use_sma': False, 'bull_use_ema': True, 'bull_use_atr': False, 'bull_use_adx': False, 'bull_use_spike': False, 'bull_rsi_required': True, 'bear_strategy': 'breakout', 'bear_bb_std_mult': 3.204823860247145, 'bear_rsi_os': 48, 'bear_rsi_ob': 71, 'bear_adx_thresh': 32.30338018553556, 'bear_atr_min_pct': 0.003161649064403851, 'bear_atr_max_pct': 0.054510055749410015, 'bear_tp_mult': 2.870701126157338, 'bear_tsl_mult': 0.27628355213019284, 'bear_time_stop': 6, 'bear_use_sma': False, 'bear_use_ema': True, 'bear_use_atr': True, 'bear_use_adx': False, 'bear_use_spike': False, 'bear_rsi_required': True, 'sideways_strategy': 'breakout', 'sideways_bb_std_mult': 2.163293356892423, 'sideways_rsi_os': 24, 'sideways_rsi_ob': 65, 'sideways_adx_thresh': 11.317570418850604, 'sideways_atr_min_pct': 0.025576848344133464, 'sideways_atr_max_pct': 0.04233828239043503, 'sideways_tp_mult': 2.9987482404939905, 'sideways_tsl_mult': 0.7599862434356673, 'sideways_time_stop': 21, 'sideways_use_sma': False, 'sideways_use_ema': False, 'sideways_use_atr': True, 'sideways_use_adx': False, 'sideways_use_spike': True, 'sideways_rsi_required': True}.
