[I 2025-08-31 10:47:56,884] Trial 414 finished with values: [-1000000000.0, 1000000000.0] and parameters: {'p_sma': 16, 'p_std': 26, 'p_atr': 17, 'p_adx': 13, 'rsi_period': 83, 'ema1': 15, 'ema2': 58, 'slip_atr_k': 0.15632881529433076, 'slip_spread_k': 0.7230699690213124, 'spread_hl_frac': 0.025040851565061188, 'bb_std_mult': 1.7823178220702087, 'rsi_os': 16, 'rsi_ob': 90, 'vol_spike': 0.2662133703513002, 'adx_thresh': 17.33910532945137, 'atr_min_pct': 0.024520077116105543, 'atr_max_pct': 0.09611911833017703, 'tp_mult': 2.476500533691674, 'tsl_mult': 0.059665575324948705, 'strategy': 'breakout', 'time_stop': 128, 'use_sma': True, 'use_atr': False, 'use_adx': True, 'use_ema': False, 'use_spike': True, 'rsi_required': True, 'edge_k': 1.3689371181788008, 'edge_cap': 0.3910901724561472, 'bull_strategy': 'breakout', 'bull_bb_std_mult': 0.67007136050377, 'bull_rsi_os': 11, 'bull_rsi_ob': 88, 'bull_adx_thresh': 6.7150740045123465, 'bull_atr_min_pct': 0.012514313655523036, 'bull_atr_max_pct': 0.08445712563780039, 'bull_tp_mult': 1.8019511356523779, 'bull_tsl_mult': 0.34464830321796314, 'bull_time_stop': 89, 'bull_use_sma': True, 'bull_use_ema': False, 'bull_use_atr': False, 'bull_use_adx': False, 'bull_use_spike': False, 'bull_rsi_required': True, 'bear_strategy': 'breakout', 'bear_bb_std_mult': 2.906035062046843, 'bear_rsi_os': 27, 'bear_rsi_ob': 87, 'bear_adx_thresh': 22.455487038574248, 'bear_atr_min_pct': 0.006132350289073327, 'bear_atr_max_pct': 0.04153173253069839, 'bear_tp_mult': 2.7497815011838638, 'bear_tsl_mult': 0.5106207010898889, 'bear_time_stop': 23, 'bear_use_sma': False, 'bear_use_ema': False, 'bear_use_atr': True, 'bear_use_adx': True, 'bear_use_spike': True, 'bear_rsi_required': True, 'sideways_strategy': 'mean_reversion', 'sideways_bb_std_mult': 2.987076902810461, 'sideways_rsi_os': 7, 'sideways_rsi_ob': 91, 'sideways_adx_thresh': 27.815935781689028, 'sideways_atr_min_pct': 0.029908998463166317, 'sideways_atr_max_pct': 0.027709621044176742, 'sideways_tp_mult': 1.6937579001202363, 'sideways_tsl_mult': 0.12485032454962261, 'sideways_time_stop': 5, 'sideways_use_sma': False, 'sideways_use_ema': False, 'sideways_use_atr': False, 'sideways_use_adx': False, 'sideways_use_spike': False, 'sideways_rsi_required': False}.
[I 2025-08-31 10:47:57,072] Trial 413 finished with values: [-1000000000.0, 1000000000.0] and parameters: {'p_sma': 16, 'p_std': 26, 'p_atr': 21, 'p_adx': 21, 'rsi_period': 82, 'ema1': 15, 'ema2': 29, 'slip_atr_k': 0.022561426916411116, 'slip_spread_k': 0.6844165703926484, 'spread_hl_frac': 0.02514121358236135, 'bb_std_mult': 3.348074432433652, 'rsi_os': 14, 'rsi_ob': 76, 'vol_spike': 0.11044323398540465, 'adx_thresh': 29.250945492928828, 'atr_min_pct': 0.00702021149485011, 'atr_max_pct': 0.06534629511308528, 'tp_mult': 1.3214108742113182, 'tsl_mult': 0.4076479722355979, 'strategy': 'breakout', 'time_stop': 59, 'use_sma': True, 'use_atr': False, 'use_adx': True, 'use_ema': False, 'use_spike': True, 'rsi_required': True, 'edge_k': 0.5825054118442687, 'edge_cap': 0.39319479963374704, 'bull_strategy': 'breakout', 'bull_bb_std_mult': 3.270364619052839, 'bull_rsi_os': 11, 'bull_rsi_ob': 81, 'bull_adx_thresh': 29.639226730242996, 'bull_atr_min_pct': 0.008517269668160023, 'bull_atr_max_pct': 0.09256880409782345, 'bull_tp_mult': 2.256034627148274, 'bull_tsl_mult': 0.3474076373944631, 'bull_time_stop': 71, 'bull_use_sma': True, 'bull_use_ema': False, 'bull_use_atr': False, 'bull_use_adx': False, 'bull_use_spike': False, 'bull_rsi_required': True, 'bear_strategy': 'breakout', 'bear_bb_std_mult': 1.6341610396360495, 'bear_rsi_os': 40, 'bear_rsi_ob': 87, 'bear_adx_thresh': 22.66688113984198, 'bear_atr_min_pct': 0.005931577014755821, 'bear_atr_max_pct': 0.12827555197764332, 'bear_tp_mult': 2.7289694397003146, 'bear_tsl_mult': 0.5048130117782785, 'bear_time_stop': 19, 'bear_use_sma': False, 'bear_use_ema': False, 'bear_use_atr': True, 'bear_use_adx': True, 'bear_use_spike': True, 'bear_rsi_required': True, 'sideways_strategy': 'mean_reversion', 'sideways_bb_std_mult': 0.7626804093661714, 'sideways_rsi_os': 53, 'sideways_rsi_ob': 95, 'sideways_adx_thresh': 30.061507952955473, 'sideways_atr_min_pct': 0.029773413213038256, 'sideways_atr_max_pct': 0.026688032843673326, 'sideways_tp_mult': 2.0465828711950746, 'sideways_tsl_mult': 0.13312359417521522, 'sideways_time_stop': 5, 'sideways_use_sma': False, 'sideways_use_ema': False, 'sideways_use_atr': False, 'sideways_use_adx': False, 'sideways_use_spike': False, 'sideways_rsi_required': False}.
[I 2025-08-31 10:47:57,163] Trial 415 finished with values: [-1000000000.0, 1000000000.0] and parameters: {'p_sma': 16, 'p_std': 28, 'p_atr': 17, 'p_adx': 14, 'rsi_period': 83, 'ema1': 14, 'ema2': 12, 'slip_atr_k': 0.230771661710506, 'slip_spread_k': 0.7211085827554401, 'spread_hl_frac': 0.025114584358036908, 'bb_std_mult': 1.6881587469123722, 'rsi_os': 27, 'rsi_ob': 95, 'vol_spike': 0.25708445441859884, 'adx_thresh': 33.07249633976243, 'atr_min_pct': 0.007626397051217017, 'atr_max_pct': 0.09845536280401955, 'tp_mult': 2.447832756343214, 'tsl_mult': 0.24721461280902185, 'strategy': 'breakout', 'time_stop': 93, 'use_sma': True, 'use_atr': False, 'use_adx': True, 'use_ema': False, 'use_spike': True, 'rsi_required': True, 'edge_k': 1.211062378218068, 'edge_cap': 0.4446902756278015, 'bull_strategy': 'breakout', 'bull_bb_std_mult': 1.113595425023067, 'bull_rsi_os': 10, 'bull_rsi_ob': 88, 'bull_adx_thresh': 30.131058371388928, 'bull_atr_min_pct': 0.008720276417528051, 'bull_atr_max_pct': 0.0840056286373505, 'bull_tp_mult': 2.009310430906591, 'bull_tsl_mult': 0.34777028441617636, 'bull_time_stop': 70, 'bull_use_sma': True, 'bull_use_ema': False, 'bull_use_atr': False, 'bull_use_adx': False, 'bull_use_spike': False, 'bull_rsi_required': True, 'bear_strategy': 'mean_reversion', 'bear_bb_std_mult': 1.6166231644392126, 'bear_rsi_os': 30, 'bear_rsi_ob': 49, 'bear_adx_thresh': 5.570203919542864, 'bear_atr_min_pct': 0.006128653990042378, 'bear_atr_max_pct': 0.14400827573485536, 'bear_tp_mult': 2.762199671272546, 'bear_tsl_mult': 0.505949189009124, 'bear_time_stop': 185, 'bear_use_sma': False, 'bear_use_ema': False, 'bear_use_atr': True, 'bear_use_adx': True, 'bear_use_spike': True, 'bear_rsi_required': True, 'sideways_strategy': 'mean_reversion', 'sideways_bb_std_mult': 1.0207712451853233, 'sideways_rsi_os': 35, 'sideways_rsi_ob': 91, 'sideways_adx_thresh': 16.89423729755939, 'sideways_atr_min_pct': 0.01049582073021527, 'sideways_atr_max_pct': 0.0183686811962022, 'sideways_tp_mult': 2.05072915148639, 'sideways_tsl_mult': 0.16814053887499192, 'sideways_time_stop': 281, 'sideways_use_sma': False, 'sideways_use_ema': False, 'sideways_use_atr': False, 'sideways_use_adx': False, 'sideways_use_spike': False, 'sideways_rsi_required': False}.
[I 2025-08-31 10:48:30,475] Trial 418 finished with values: [-1000000000.0, 1000000000.0] and parameters: {'p_sma': 19, 'p_std': 29, 'p_atr': 11, 'p_adx': 14, 'rsi_period': 57, 'ema1': 5, 'ema2': 54, 'slip_atr_k': 0.0955558181835495, 'slip_spread_k': 0.7669401250838217, 'spread_hl_frac': 0.0057448523380540135, 'bb_std_mult': 3.507334025693969, 'rsi_os': 33, 'rsi_ob': 78, 'vol_spike': 0.28720589240578365, 'adx_thresh': 29.115657497091, 'atr_min_pct': 0.004795014296301173, 'atr_max_pct': 0.09434259755138656, 'tp_mult': 2.3593819261812725, 'tsl_mult': 0.13944814276731343, 'strategy': 'breakout', 'time_stop': 94, 'use_sma': True, 'use_atr': False, 'use_adx': True, 'use_ema': True, 'use_spike': False, 'rsi_required': True, 'edge_k': 0.9240975881697816, 'edge_cap': 0.5087251160284686, 'bull_strategy': 'breakout', 'bull_bb_std_mult': 0.8051419077175777, 'bull_rsi_os': 32, 'bull_rsi_ob': 81, 'bull_adx_thresh': 5.029054058442227, 'bull_atr_min_pct': 0.020410302361344716, 'bull_atr_max_pct': 0.0984670423595386, 'bull_tp_mult': 1.7265727570252831, 'bull_tsl_mult': 0.40567325890480577, 'bull_time_stop': 289, 'bull_use_sma': True, 'bull_use_ema': False, 'bull_use_atr': False, 'bull_use_adx': False, 'bull_use_spike': False, 'bull_rsi_required': False, 'bear_strategy': 'mean_reversion', 'bear_bb_std_mult': 3.113258883270713, 'bear_rsi_os': 41, 'bear_rsi_ob': 90, 'bear_adx_thresh': 8.874439513073678, 'bear_atr_min_pct': 0.01757993251363453, 'bear_atr_max_pct': 0.12812562921664566, 'bear_tp_mult': 2.8018810152351996, 'bear_tsl_mult': 0.5700152547341684, 'bear_time_stop': 40, 'bear_use_sma': True, 'bear_use_ema': True, 'bear_use_atr': False, 'bear_use_adx': False, 'bear_use_spike': True, 'bear_rsi_required': False, 'sideways_strategy': 'mean_reversion', 'sideways_bb_std_mult': 0.529110701763118, 'sideways_rsi_os': 46, 'sideways_rsi_ob': 47, 'sideways_adx_thresh': 25.823029981512068, 'sideways_atr_min_pct': 0.0226938580671149, 'sideways_atr_max_pct': 0.06693598724859491, 'sideways_tp_mult': 2.048056590907688, 'sideways_tsl_mult': 0.14038667198989332, 'sideways_time_stop': 26, 'sideways_use_sma': False, 'sideways_use_ema': False, 'sideways_use_atr': False, 'sideways_use_adx': False, 'sideways_use_spike': False, 'sideways_rsi_required': True}.
[I 2025-08-31 10:48:30,482] Trial 417 finished with values: [-1000000000.0, 1000000000.0] and parameters: {'p_sma': 19, 'p_std': 28, 'p_atr': 26, 'p_adx': 14, 'rsi_period': 37, 'ema1': 6, 'ema2': 17, 'slip_atr_k': 0.094892569619167, 'slip_spread_k': 0.6510140424870084, 'spread_hl_frac': 0.042752891862228595, 'bb_std_mult': 2.9759039098208993, 'rsi_os': 26, 'rsi_ob': 78, 'vol_spike': 0.2662966838029415, 'adx_thresh': 11.365341657796536, 'atr_min_pct': 0.004929117599206436, 'atr_max_pct': 0.09894070399734071, 'tp_mult': 2.3722542580036716, 'tsl_mult': 0.21906772492215926, 'strategy': 'breakout', 'time_stop': 132, 'use_sma': True, 'use_atr': False, 'use_adx': True, 'use_ema': False, 'use_spike': False, 'rsi_required': True, 'edge_k': 1.5614167427116241, 'edge_cap': 0.9608626119341666, 'bull_strategy': 'breakout', 'bull_bb_std_mult': 0.5696014419348211, 'bull_rsi_os': 11, 'bull_rsi_ob': 74, 'bull_adx_thresh': 6.7565869508084235, 'bull_atr_min_pct': 0.00888633426388795, 'bull_atr_max_pct': 0.0312017201498469, 'bull_tp_mult': 1.8252792734001333, 'bull_tsl_mult': 0.34351659359152753, 'bull_time_stop': 288, 'bull_use_sma': True, 'bull_use_ema': False, 'bull_use_atr': False, 'bull_use_adx': False, 'bull_use_spike': False, 'bull_rsi_required': True, 'bear_strategy': 'breakout', 'bear_bb_std_mult': 2.0346129311060386, 'bear_rsi_os': 41, 'bear_rsi_ob': 58, 'bear_adx_thresh': 19.089460324636594, 'bear_atr_min_pct': 0.02746760276139347, 'bear_atr_max_pct': 0.12854132169754676, 'bear_tp_mult': 2.800410678268237, 'bear_tsl_mult': 0.7477603732915167, 'bear_time_stop': 11, 'bear_use_sma': True, 'bear_use_ema': True, 'bear_use_atr': False, 'bear_use_adx': True, 'bear_use_spike': True, 'bear_rsi_required': True, 'sideways_strategy': 'mean_reversion', 'sideways_bb_std_mult': 2.747925657562611, 'sideways_rsi_os': 35, 'sideways_rsi_ob': 92, 'sideways_adx_thresh': 25.92321284890944, 'sideways_atr_min_pct': 0.019036797036353786, 'sideways_atr_max_pct': 0.01777935948182812, 'sideways_tp_mult': 2.024499668350753, 'sideways_tsl_mult': 0.6773271684792588, 'sideways_time_stop': 282, 'sideways_use_sma': False, 'sideways_use_ema': False, 'sideways_use_atr': False, 'sideways_use_adx': False, 'sideways_use_spike': False, 'sideways_rsi_required': False}.
[I 2025-08-31 10:48:31,467] Trial 419 finished with values: [-1000000000.0, 1000000000.0] and parameters: {'p_sma': 18, 'p_std': 28, 'p_atr': 11, 'p_adx': 14, 'rsi_period': 52, 'ema1': 14, 'ema2': 55, 'slip_atr_k': 0.03039572154264387, 'slip_spread_k': 0.6465157755638392, 'spread_hl_frac': 0.042999413502160216, 'bb_std_mult': 3.5991433842820326, 'rsi_os': 26, 'rsi_ob': 78, 'vol_spike': 0.23620491516214953, 'adx_thresh': 28.841107030185725, 'atr_min_pct': 0.029775371925171865, 'atr_max_pct': 0.09784256588384327, 'tp_mult': 2.36909107842406, 'tsl_mult': 0.1288977574793661, 'strategy': 'breakout', 'time_stop': 94, 'use_sma': True, 'use_atr': False, 'use_adx': True, 'use_ema': True, 'use_spike': False, 'rsi_required': True, 'edge_k': 1.7651855729397905, 'edge_cap': 0.9509334480899021, 'bull_strategy': 'mean_reversion', 'bull_bb_std_mult': 1.1137123193544045, 'bull_rsi_os': 31, 'bull_rsi_ob': 74, 'bull_adx_thresh': 7.474349783606573, 'bull_atr_min_pct': 0.023957681857829205, 'bull_atr_max_pct': 0.03043453307174808, 'bull_tp_mult': 1.7410324045102186, 'bull_tsl_mult': 0.5485620043969384, 'bull_time_stop': 291, 'bull_use_sma': True, 'bull_use_ema': False, 'bull_use_atr': False, 'bull_use_adx': False, 'bull_use_spike': False, 'bull_rsi_required': False, 'bear_strategy': 'mean_reversion', 'bear_bb_std_mult': 1.7155107241733811, 'bear_rsi_os': 41, 'bear_rsi_ob': 94, 'bear_adx_thresh': 8.731094873190125, 'bear_atr_min_pct': 0.02762124752627956, 'bear_atr_max_pct': 0.12037902733292395, 'bear_tp_mult': 2.8026403782029634, 'bear_tsl_mult': 0.7501457260467713, 'bear_time_stop': 40, 'bear_use_sma': True, 'bear_use_ema': True, 'bear_use_atr': False, 'bear_use_adx': False, 'bear_use_spike': True, 'bear_rsi_required': False, 'sideways_strategy': 'mean_reversion', 'sideways_bb_std_mult': 0.9778818653601655, 'sideways_rsi_os': 5, 'sideways_rsi_ob': 92, 'sideways_adx_thresh': 26.197732648654362, 'sideways_atr_min_pct': 0.022705831779142725, 'sideways_atr_max_pct': 0.018557671676845182, 'sideways_tp_mult': 2.0171887944199973, 'sideways_tsl_mult': 0.6883369615562482, 'sideways_time_stop': 27, 'sideways_use_sma': False, 'sideways_use_ema': True, 'sideways_use_atr': False, 'sideways_use_adx': False, 'sideways_use_spike': False, 'sideways_rsi_required': True}.
[I 2025-08-31 10:48:31,470] Trial 420 finished with values: [-1000000000.0, 1000000000.0] and parameters: {'p_sma': 20, 'p_std': 28, 'p_atr': 11, 'p_adx': 27, 'rsi_period': 51, 'ema1': 5, 'ema2': 54, 'slip_atr_k': 0.03284361218167227, 'slip_spread_k': 0.6460324073814313, 'spread_hl_frac': 0.00614150344782512, 'bb_std_mult': 3.593117833090057, 'rsi_os': 53, 'rsi_ob': 78, 'vol_spike': 0.18867756452254447, 'adx_thresh': 30.176078400084194, 'atr_min_pct': 0.004844050721519322, 'atr_max_pct': 0.0512802354144372, 'tp_mult': 2.349593680900611, 'tsl_mult': 0.22158773098355727, 'strategy': 'breakout', 'time_stop': 75, 'use_sma': True, 'use_atr': False, 'use_adx': True, 'use_ema': True, 'use_spike': False, 'rsi_required': True, 'edge_k': 1.661422981432852, 'edge_cap': 0.9613688122354537, 'bull_strategy': 'mean_reversion', 'bull_bb_std_mult': 0.9488430997533333, 'bull_rsi_os': 32, 'bull_rsi_ob': 74, 'bull_adx_thresh': 21.751590784862415, 'bull_atr_min_pct': 0.02035510984728789, 'bull_atr_max_pct': 0.10045589014750933, 'bull_tp_mult': 2.5909242934084573, 'bull_tsl_mult': 0.40579724913814036, 'bull_time_stop': 52, 'bull_use_sma': True, 'bull_use_ema': False, 'bull_use_atr': False, 'bull_use_adx': False, 'bull_use_spike': False, 'bull_rsi_required': False, 'bear_strategy': 'breakout', 'bear_bb_std_mult': 0.5769800410413626, 'bear_rsi_os': 41, 'bear_rsi_ob': 45, 'bear_adx_thresh': 8.820987514176792, 'bear_atr_min_pct': 0.0178066580398563, 'bear_atr_max_pct': 0.11952207239337473, 'bear_tp_mult': 2.903218319556273, 'bear_tsl_mult': 0.5719590487054322, 'bear_time_stop': 39, 'bear_use_sma': True, 'bear_use_ema': True, 'bear_use_atr': False, 'bear_use_adx': False, 'bear_use_spike': True, 'bear_rsi_required': False, 'sideways_strategy': 'mean_reversion', 'sideways_bb_std_mult': 0.5534534626667114, 'sideways_rsi_os': 5, 'sideways_rsi_ob': 47, 'sideways_adx_thresh': 24.915564804540278, 'sideways_atr_min_pct': 0.019194647630495883, 'sideways_atr_max_pct': 0.08193580587209234, 'sideways_tp_mult': 1.9531569296027973, 'sideways_tsl_mult': 0.09774945785709221, 'sideways_time_stop': 26, 'sideways_use_sma': False, 'sideways_use_ema': True, 'sideways_use_atr': False, 'sideways_use_adx': False, 'sideways_use_spike': False, 'sideways_rsi_required': True}.
[I 2025-08-31 10:48:32,349] Trial 422 finished with values: [-1000000000.0, 1000000000.0] and parameters: {'p_sma': 57, 'p_std': 39, 'p_atr': 20, 'p_adx': 25, 'rsi_period': 51, 'ema1': 13, 'ema2': 57, 'slip_atr_k': 0.02704028411740744, 'slip_spread_k': 0.6658357649554335, 'spread_hl_frac': 0.009807724158097414, 'bb_std_mult': 2.8524386433828606, 'rsi_os': 23, 'rsi_ob': 77, 'vol_spike': 0.1906408340449606, 'adx_thresh': 19.848440599841524, 'atr_min_pct': 0.029806568670160634, 'atr_max_pct': 0.026962016818325232, 'tp_mult': 2.634328180198583, 'tsl_mult': 0.3481975404958736, 'strategy': 'breakout', 'time_stop': 75, 'use_sma': False, 'use_atr': False, 'use_adx': True, 'use_ema': True, 'use_spike': True, 'rsi_required': True, 'edge_k': 1.7679546985837051, 'edge_cap': 0.7413441026264449, 'bull_strategy': 'mean_reversion', 'bull_bb_std_mult': 0.8181998895276279, 'bull_rsi_os': 14, 'bull_rsi_ob': 56, 'bull_adx_thresh': 7.674211237072605, 'bull_atr_min_pct': 0.017669055322526814, 'bull_atr_max_pct': 0.011345925750405342, 'bull_tp_mult': 1.7846021967345491, 'bull_tsl_mult': 0.2781146478959668, 'bull_time_stop': 50, 'bull_use_sma': True, 'bull_use_ema': False, 'bull_use_atr': False, 'bull_use_adx': True, 'bull_use_spike': False, 'bull_rsi_required': False, 'bear_strategy': 'breakout', 'bear_bb_std_mult': 1.8212824999039947, 'bear_rsi_os': 38, 'bear_rsi_ob': 94, 'bear_adx_thresh': 27.626899561194712, 'bear_atr_min_pct': 0.022424221591652638, 'bear_atr_max_pct': 0.13829285458924317, 'bear_tp_mult': 2.8954120115142046, 'bear_tsl_mult': 0.46784565364790937, 'bear_time_stop': 31, 'bear_use_sma': False, 'bear_use_ema': True, 'bear_use_atr': False, 'bear_use_adx': False, 'bear_use_spike': True, 'bear_rsi_required': False, 'sideways_strategy': 'mean_reversion', 'sideways_bb_std_mult': 1.6808059457339635, 'sideways_rsi_os': 25, 'sideways_rsi_ob': 90, 'sideways_adx_thresh': 26.384844220431305, 'sideways_atr_min_pct': 0.014840655408435233, 'sideways_atr_max_pct': 0.09931280599991957, 'sideways_tp_mult': 1.940713178751713, 'sideways_tsl_mult': 0.09326420825461768, 'sideways_time_stop': 15, 'sideways_use_sma': False, 'sideways_use_ema': True, 'sideways_use_atr': False, 'sideways_use_adx': False, 'sideways_use_spike': False, 'sideways_rsi_required': True}.
[I 2025-08-31 10:49:02,501] Trial 424 finished with values: [-1000000000.0, 1000000000.0] and parameters: {'p_sma': 6, 'p_std': 30, 'p_atr': 20, 'p_adx': 15, 'rsi_period': 47, 'ema1': 7, 'ema2': 39, 'slip_atr_k': 0.20853238660984258, 'slip_spread_k': 0.6682433077803176, 'spread_hl_frac': 0.00951544126818213, 'bb_std_mult': 2.8541414192601406, 'rsi_os': 23, 'rsi_ob': 57, 'vol_spike': 0.2513214085256466, 'adx_thresh': 7.302318430921485, 'atr_min_pct': 0.006443320096572387, 'atr_max_pct': 0.05878883493400058, 'tp_mult': 2.2530019575505795, 'tsl_mult': 0.3435951954494303, 'strategy': 'breakout', 'time_stop': 67, 'use_sma': False, 'use_atr': False, 'use_adx': True, 'use_ema': True, 'use_spike': True, 'rsi_required': True, 'edge_k': 0.24463999962308347, 'edge_cap': 0.731713547132093, 'bull_strategy': 'breakout', 'bull_bb_std_mult': 0.817886240101888, 'bull_rsi_os': 14, 'bull_rsi_ob': 76, 'bull_adx_thresh': 5.727520009357531, 'bull_atr_min_pct': 0.01774547725075681, 'bull_atr_max_pct': 0.07276308869830428, 'bull_tp_mult': 1.7991504348415501, 'bull_tsl_mult': 0.4244138618568577, 'bull_time_stop': 140, 'bull_use_sma': True, 'bull_use_ema': False, 'bull_use_atr': False, 'bull_use_adx': True, 'bull_use_spike': False, 'bull_rsi_required': True, 'bear_strategy': 'breakout', 'bear_bb_std_mult': 1.8232001826510604, 'bear_rsi_os': 39, 'bear_rsi_ob': 77, 'bear_adx_thresh': 7.127718567952157, 'bear_atr_min_pct': 0.005449312524513437, 'bear_atr_max_pct': 0.13781281710257973, 'bear_tp_mult': 2.8807623467199206, 'bear_tsl_mult': 0.441037752729567, 'bear_time_stop': 29, 'bear_use_sma': False, 'bear_use_ema': True, 'bear_use_atr': False, 'bear_use_adx': False, 'bear_use_spike': True, 'bear_rsi_required': False, 'sideways_strategy': 'mean_reversion', 'sideways_bb_std_mult': 2.53263195636713, 'sideways_rsi_os': 7, 'sideways_rsi_ob': 57, 'sideways_adx_thresh': 26.594713067159002, 'sideways_atr_min_pct': 0.016974058642644226, 'sideways_atr_max_pct': 0.05348353521264454, 'sideways_tp_mult': 2.131530340037654, 'sideways_tsl_mult': 0.6070352186856269, 'sideways_time_stop': 16, 'sideways_use_sma': False, 'sideways_use_ema': False, 'sideways_use_atr': False, 'sideways_use_adx': False, 'sideways_use_spike': False, 'sideways_rsi_required': True}.
