[I 2025-08-31 10:33:32,285] Trial 297 finished with values: [-0.019783953739268556, 0.019727143535057962] and parameters: {'p_sma': 17, 'p_std': 15, 'p_atr': 17, 'p_adx': 18, 'rsi_period': 41, 'ema1': 28, 'ema2': 55, 'slip_atr_k': 0.006521911442556302, 'slip_spread_k': 0.4519508451902154, 'spread_hl_frac': 0.013200248107781136, 'bb_std_mult': 1.731028275774116, 'rsi_os': 26, 'rsi_ob': 75, 'vol_spike': 0.0646057244091222, 'adx_thresh': 29.60251261712579, 'atr_min_pct': 0.013656219641373604, 'atr_max_pct': 0.12616097988132313, 'tp_mult': 2.3972304743247133, 'tsl_mult': 0.9992752070131949, 'strategy': 'mean_reversion', 'time_stop': 243, 'use_sma': True, 'use_atr': False, 'use_adx': True, 'use_ema': True, 'use_spike': True, 'rsi_required': False, 'edge_k': 1.6875675959204055, 'edge_cap': 0.6577628169873548, 'bull_strategy': 'breakout', 'bull_bb_std_mult': 0.9093930857157266, 'bull_rsi_os': 40, 'bull_rsi_ob': 51, 'bull_adx_thresh': 25.047508012574784, 'bull_atr_min_pct': 0.0024648012148497586, 'bull_atr_max_pct': 0.04823787853436908, 'bull_tp_mult': 1.5927760168833098, 'bull_tsl_mult': 0.5797655544670415, 'bull_time_stop': 183, 'bull_use_sma': True, 'bull_use_ema': True, 'bull_use_atr': False, 'bull_use_adx': False, 'bull_use_spike': False, 'bull_rsi_required': False, 'bear_strategy': 'breakout', 'bear_bb_std_mult': 1.4809180194860174, 'bear_rsi_os': 43, 'bear_rsi_ob': 54, 'bear_adx_thresh': 14.587466546103238, 'bear_atr_min_pct': 0.0036066325154501862, 'bear_atr_max_pct': 0.14472946436266915, 'bear_tp_mult': 2.7116968699481525, 'bear_tsl_mult': 0.47509595486241857, 'bear_time_stop': 152, 'bear_use_sma': False, 'bear_use_ema': True, 'bear_use_atr': False, 'bear_use_adx': False, 'bear_use_spike': True, 'bear_rsi_required': False, 'sideways_strategy': 'breakout', 'sideways_bb_std_mult': 2.8691539407768487, 'sideways_rsi_os': 19, 'sideways_rsi_ob': 48, 'sideways_adx_thresh': 24.140177968812154, 'sideways_atr_min_pct': 0.0048103969454105664, 'sideways_atr_max_pct': 0.06706394137514195, 'sideways_tp_mult': 1.7958251399185645, 'sideways_tsl_mult': 0.7898633764788017, 'sideways_time_stop': 103, 'sideways_use_sma': True, 'sideways_use_ema': False, 'sideways_use_atr': False, 'sideways_use_adx': True, 'sideways_use_spike': True, 'sideways_rsi_required': True}.
[I 2025-08-31 10:33:32,401] Trial 299 finished with values: [-0.01836097387398672, 0.017927768940514233] and parameters: {'p_sma': 26, 'p_std': 60, 'p_atr': 30, 'p_adx': 16, 'rsi_period': 69, 'ema1': 15, 'ema2': 27, 'slip_atr_k': 0.004730992716559045, 'slip_spread_k': 0.6423455304205034, 'spread_hl_frac': 0.013101658856241621, 'bb_std_mult': 1.2248162321520684, 'rsi_os': 26, 'rsi_ob': 75, 'vol_spike': 0.06280812099167887, 'adx_thresh': 15.047411297871808, 'atr_min_pct': 0.02403965586124663, 'atr_max_pct': 0.029280368406124253, 'tp_mult': 2.128860414321839, 'tsl_mult': 0.9999815319459702, 'strategy': 'mean_reversion', 'time_stop': 263, 'use_sma': True, 'use_atr': False, 'use_adx': True, 'use_ema': True, 'use_spike': True, 'rsi_required': True, 'edge_k': 0.04759358735678079, 'edge_cap': 0.8039745250208894, 'bull_strategy': 'breakout', 'bull_bb_std_mult': 0.6951436769555079, 'bull_rsi_os': 40, 'bull_rsi_ob': 57, 'bull_adx_thresh': 29.979783739837615, 'bull_atr_min_pct': 0.002472597113309414, 'bull_atr_max_pct': 0.07756180726139543, 'bull_tp_mult': 1.8283323105152276, 'bull_tsl_mult': 0.5815611459863261, 'bull_time_stop': 271, 'bull_use_sma': True, 'bull_use_ema': False, 'bull_use_atr': False, 'bull_use_adx': True, 'bull_use_spike': True, 'bull_rsi_required': False, 'bear_strategy': 'breakout', 'bear_bb_std_mult': 1.4932624805630361, 'bear_rsi_os': 41, 'bear_rsi_ob': 54, 'bear_adx_thresh': 13.115298459266693, 'bear_atr_min_pct': 0.002700368696858101, 'bear_atr_max_pct': 0.07624393629784501, 'bear_tp_mult': 1.3166128128072576, 'bear_tsl_mult': 0.5096501140758601, 'bear_time_stop': 47, 'bear_use_sma': True, 'bear_use_ema': True, 'bear_use_atr': False, 'bear_use_adx': False, 'bear_use_spike': True, 'bear_rsi_required': False, 'sideways_strategy': 'mean_reversion', 'sideways_bb_std_mult': 1.4395071940513828, 'sideways_rsi_os': 17, 'sideways_rsi_ob': 48, 'sideways_adx_thresh': 24.43653220446652, 'sideways_atr_min_pct': 0.004847599442526876, 'sideways_atr_max_pct': 0.03706424156002648, 'sideways_tp_mult': 1.9654425085268328, 'sideways_tsl_mult': 0.6252621845826085, 'sideways_time_stop': 37, 'sideways_use_sma': True, 'sideways_use_ema': False, 'sideways_use_atr': True, 'sideways_use_adx': False, 'sideways_use_spike': False, 'sideways_rsi_required': True}.
[I 2025-08-31 10:33:32,737] Trial 300 finished with values: [-0.1377587660535613, 0.1376210296948815] and parameters: {'p_sma': 11, 'p_std': 27, 'p_atr': 28, 'p_adx': 16, 'rsi_period': 48, 'ema1': 16, 'ema2': 58, 'slip_atr_k': 0.017808573206533805, 'slip_spread_k': 0.6485767774334432, 'spread_hl_frac': 0.013010873304642564, 'bb_std_mult': 1.2843233787030828, 'rsi_os': 26, 'rsi_ob': 69, 'vol_spike': 0.28010994527826827, 'adx_thresh': 28.34180661026781, 'atr_min_pct': 0.0050796390265655245, 'atr_max_pct': 0.0858845742675068, 'tp_mult': 2.336056851443151, 'tsl_mult': 0.5738727164421717, 'strategy': 'mean_reversion', 'time_stop': 210, 'use_sma': True, 'use_atr': False, 'use_adx': True, 'use_ema': True, 'use_spike': False, 'rsi_required': True, 'edge_k': 0.7751307359216282, 'edge_cap': 0.8004211559716966, 'bull_strategy': 'breakout', 'bull_bb_std_mult': 0.6778040425532657, 'bull_rsi_os': 40, 'bull_rsi_ob': 72, 'bull_adx_thresh': 30.334917225423233, 'bull_atr_min_pct': 0.0020526285513910282, 'bull_atr_max_pct': 0.08332246197269272, 'bull_tp_mult': 1.8264412730082793, 'bull_tsl_mult': 0.4938593845210957, 'bull_time_stop': 5, 'bull_use_sma': False, 'bull_use_ema': False, 'bull_use_atr': False, 'bull_use_adx': True, 'bull_use_spike': True, 'bull_rsi_required': False, 'bear_strategy': 'breakout', 'bear_bb_std_mult': 1.818362512709044, 'bear_rsi_os': 33, 'bear_rsi_ob': 54, 'bear_adx_thresh': 14.583250493279085, 'bear_atr_min_pct': 0.0026478249064739116, 'bear_atr_max_pct': 0.10020099607255553, 'bear_tp_mult': 2.714971827860002, 'bear_tsl_mult': 0.4994577575315889, 'bear_time_stop': 46, 'bear_use_sma': True, 'bear_use_ema': True, 'bear_use_atr': False, 'bear_use_adx': False, 'bear_use_spike': True, 'bear_rsi_required': False, 'sideways_strategy': 'mean_reversion', 'sideways_bb_std_mult': 1.4236959890903185, 'sideways_rsi_os': 17, 'sideways_rsi_ob': 49, 'sideways_adx_thresh': 24.633225466102754, 'sideways_atr_min_pct': 0.0008812770592440573, 'sideways_atr_max_pct': 0.12474948656990996, 'sideways_tp_mult': 1.027246214651039, 'sideways_tsl_mult': 0.6237139370901839, 'sideways_time_stop': 46, 'sideways_use_sma': True, 'sideways_use_ema': False, 'sideways_use_atr': True, 'sideways_use_adx': False, 'sideways_use_spike': False, 'sideways_rsi_required': True}.
[I 2025-08-31 10:33:32,967] Trial 298 finished with values: [-0.046201493499036794, 0.04593623132160494] and parameters: {'p_sma': 40, 'p_std': 23, 'p_atr': 30, 'p_adx': 16, 'rsi_period': 41, 'ema1': 15, 'ema2': 58, 'slip_atr_k': 0.021785948669520883, 'slip_spread_k': 0.6379900462991046, 'spread_hl_frac': 0.012800925619767384, 'bb_std_mult': 1.2291772318882686, 'rsi_os': 26, 'rsi_ob': 56, 'vol_spike': 0.27969877884997857, 'adx_thresh': 15.017752026080156, 'atr_min_pct': 0.0050128849959169535, 'atr_max_pct': 0.08377411616369482, 'tp_mult': 2.3302158269456115, 'tsl_mult': 0.7201542914163246, 'strategy': 'mean_reversion', 'time_stop': 23, 'use_sma': True, 'use_atr': False, 'use_adx': True, 'use_ema': True, 'use_spike': True, 'rsi_required': False, 'edge_k': 0.05066383031926791, 'edge_cap': 0.894967988805686, 'bull_strategy': 'breakout', 'bull_bb_std_mult': 0.6813242796486718, 'bull_rsi_os': 40, 'bull_rsi_ob': 51, 'bull_adx_thresh': 22.425168344945664, 'bull_atr_min_pct': 0.0022193442199886903, 'bull_atr_max_pct': 0.049003784077765955, 'bull_tp_mult': 2.5411433848875156, 'bull_tsl_mult': 0.37126824166862993, 'bull_time_stop': 164, 'bull_use_sma': True, 'bull_use_ema': True, 'bull_use_atr': True, 'bull_use_adx': False, 'bull_use_spike': True, 'bull_rsi_required': True, 'bear_strategy': 'breakout', 'bear_bb_std_mult': 1.8102112774000596, 'bear_rsi_os': 37, 'bear_rsi_ob': 93, 'bear_adx_thresh': 13.145673130147141, 'bear_atr_min_pct': 0.00266835813777044, 'bear_atr_max_pct': 0.12628279965945963, 'bear_tp_mult': 2.7087389387946716, 'bear_tsl_mult': 0.7332622915084316, 'bear_time_stop': 167, 'bear_use_sma': True, 'bear_use_ema': True, 'bear_use_atr': False, 'bear_use_adx': False, 'bear_use_spike': True, 'bear_rsi_required': False, 'sideways_strategy': 'breakout', 'sideways_bb_std_mult': 2.6849797759682583, 'sideways_rsi_os': 16, 'sideways_rsi_ob': 83, 'sideways_adx_thresh': 24.780308765297633, 'sideways_atr_min_pct': 0.00489424089806848, 'sideways_atr_max_pct': 0.03666226417582552, 'sideways_tp_mult': 1.9558541596248393, 'sideways_tsl_mult': 0.7899216164630685, 'sideways_time_stop': 203, 'sideways_use_sma': True, 'sideways_use_ema': False, 'sideways_use_atr': False, 'sideways_use_adx': True, 'sideways_use_spike': True, 'sideways_rsi_required': True}.
[I 2025-08-31 10:34:04,192] Trial 301 finished with values: [-0.10411642691226775, 0.10397451401088194] and parameters: {'p_sma': 11, 'p_std': 27, 'p_atr': 19, 'p_adx': 19, 'rsi_period': 68, 'ema1': 14, 'ema2': 13, 'slip_atr_k': 0.016797271288241544, 'slip_spread_k': 0.03147792486112766, 'spread_hl_frac': 0.017314078905918795, 'bb_std_mult': 0.5971356934122561, 'rsi_os': 27, 'rsi_ob': 49, 'vol_spike': 0.28019749385428877, 'adx_thresh': 28.325907208151175, 'atr_min_pct': 0.007264116264305329, 'atr_max_pct': 0.08548562516709089, 'tp_mult': 2.0852867219846623, 'tsl_mult': 0.6679022077744219, 'strategy': 'breakout', 'time_stop': 209, 'use_sma': True, 'use_atr': False, 'use_adx': True, 'use_ema': True, 'use_spike': False, 'rsi_required': True, 'edge_k': 0.04292505778392354, 'edge_cap': 0.19646295647422818, 'bull_strategy': 'breakout', 'bull_bb_std_mult': 0.6747791247241084, 'bull_rsi_os': 40, 'bull_rsi_ob': 73, 'bull_adx_thresh': 26.814660012510593, 'bull_atr_min_pct': 0.024197904380722318, 'bull_atr_max_pct': 0.03476742331276339, 'bull_tp_mult': 1.8387991166275444, 'bull_tsl_mult': 0.26252638412789353, 'bull_time_stop': 194, 'bull_use_sma': False, 'bull_use_ema': False, 'bull_use_atr': True, 'bull_use_adx': True, 'bull_use_spike': True, 'bull_rsi_required': True, 'bear_strategy': 'breakout', 'bear_bb_std_mult': 2.294182190392417, 'bear_rsi_os': 41, 'bear_rsi_ob': 69, 'bear_adx_thresh': 13.445755932289215, 'bear_atr_min_pct': 0.005490869578006566, 'bear_atr_max_pct': 0.07581247010144312, 'bear_tp_mult': 2.7263994526345803, 'bear_tsl_mult': 0.5028444224691756, 'bear_time_stop': 44, 'bear_use_sma': True, 'bear_use_ema': True, 'bear_use_atr': False, 'bear_use_adx': False, 'bear_use_spike': True, 'bear_rsi_required': False, 'sideways_strategy': 'mean_reversion', 'sideways_bb_std_mult': 2.6263139420973407, 'sideways_rsi_os': 17, 'sideways_rsi_ob': 50, 'sideways_adx_thresh': 24.900525199814872, 'sideways_atr_min_pct': 0.0007987038304367641, 'sideways_atr_max_pct': 0.036241397073341834, 'sideways_tp_mult': 1.971638188673481, 'sideways_tsl_mult': 0.11876125189259222, 'sideways_time_stop': 172, 'sideways_use_sma': False, 'sideways_use_ema': False, 'sideways_use_atr': True, 'sideways_use_adx': False, 'sideways_use_spike': False, 'sideways_rsi_required': True}.
[I 2025-08-31 10:34:04,719] Trial 302 finished with values: [-0.02258272016293139, 0.022442617716278705] and parameters: {'p_sma': 11, 'p_std': 27, 'p_atr': 19, 'p_adx': 15, 'rsi_period': 48, 'ema1': 18, 'ema2': 13, 'slip_atr_k': 0.0185968114351731, 'slip_spread_k': 0.654320485173994, 'spread_hl_frac': 0.012197979659371975, 'bb_std_mult': 0.5915011890995903, 'rsi_os': 27, 'rsi_ob': 56, 'vol_spike': 0.2804438425685726, 'adx_thresh': 30.496198502110282, 'atr_min_pct': 0.029838665592719367, 'atr_max_pct': 0.053083832777668774, 'tp_mult': 2.3444366902247697, 'tsl_mult': 0.5666343080626193, 'strategy': 'breakout', 'time_stop': 218, 'use_sma': True, 'use_atr': False, 'use_adx': True, 'use_ema': True, 'use_spike': False, 'rsi_required': True, 'edge_k': 0.044065657630889876, 'edge_cap': 0.7982221687933051, 'bull_strategy': 'breakout', 'bull_bb_std_mult': 2.487936807571355, 'bull_rsi_os': 40, 'bull_rsi_ob': 49, 'bull_adx_thresh': 22.84881229381063, 'bull_atr_min_pct': 0.0005314804884743278, 'bull_atr_max_pct': 0.1465760896755504, 'bull_tp_mult': 2.5472636154932817, 'bull_tsl_mult': 0.24157033568921038, 'bull_time_stop': 176, 'bull_use_sma': False, 'bull_use_ema': False, 'bull_use_atr': True, 'bull_use_adx': True, 'bull_use_spike': True, 'bull_rsi_required': True, 'bear_strategy': 'breakout', 'bear_bb_std_mult': 3.364823287398562, 'bear_rsi_os': 28, 'bear_rsi_ob': 69, 'bear_adx_thresh': 13.361945211311923, 'bear_atr_min_pct': 0.02615702937817859, 'bear_atr_max_pct': 0.03944076345364908, 'bear_tp_mult': 2.7222842872235544, 'bear_tsl_mult': 0.5024378997389334, 'bear_time_stop': 44, 'bear_use_sma': True, 'bear_use_ema': True, 'bear_use_atr': False, 'bear_use_adx': False, 'bear_use_spike': True, 'bear_rsi_required': False, 'sideways_strategy': 'mean_reversion', 'sideways_bb_std_mult': 1.9682852231346888, 'sideways_rsi_os': 17, 'sideways_rsi_ob': 83, 'sideways_adx_thresh': 24.843643462175987, 'sideways_atr_min_pct': 0.004828714903308046, 'sideways_atr_max_pct': 0.036852223687148286, 'sideways_tp_mult': 2.3565286214121737, 'sideways_tsl_mult': 0.6478397768979994, 'sideways_time_stop': 112, 'sideways_use_sma': False, 'sideways_use_ema': False, 'sideways_use_atr': True, 'sideways_use_adx': False, 'sideways_use_spike': False, 'sideways_rsi_required': True}.
[I 2025-08-31 10:34:04,873] Trial 303 finished with values: [-1000000000.0, 1000000000.0] and parameters: {'p_sma': 15, 'p_std': 22, 'p_atr': 30, 'p_adx': 15, 'rsi_period': 47, 'ema1': 18, 'ema2': 25, 'slip_atr_k': 0.030054641066947614, 'slip_spread_k': 0.756593639215157, 'spread_hl_frac': 0.017193795928605288, 'bb_std_mult': 1.6222989162168517, 'rsi_os': 43, 'rsi_ob': 56, 'vol_spike': 0.2528690754821219, 'adx_thresh': 30.565127944843184, 'atr_min_pct': 0.027346162137167757, 'atr_max_pct': 0.08349953140990617, 'tp_mult': 2.495181721831147, 'tsl_mult': 0.6689341454144806, 'strategy': 'breakout', 'time_stop': 265, 'use_sma': True, 'use_atr': True, 'use_adx': False, 'use_ema': True, 'use_spike': True, 'rsi_required': False, 'edge_k': 0.6380272090433063, 'edge_cap': 0.893824446217652, 'bull_strategy': 'breakout', 'bull_bb_std_mult': 0.748409336998023, 'bull_rsi_os': 40, 'bull_rsi_ob': 73, 'bull_adx_thresh': 26.752751876100092, 'bull_atr_min_pct': 0.0018115431279166101, 'bull_atr_max_pct': 0.14684421251471275, 'bull_tp_mult': 1.665055305710826, 'bull_tsl_mult': 0.6562110057795545, 'bull_time_stop': 152, 'bull_use_sma': True, 'bull_use_ema': True, 'bull_use_atr': True, 'bull_use_adx': True, 'bull_use_spike': True, 'bull_rsi_required': True, 'bear_strategy': 'breakout', 'bear_bb_std_mult': 1.100974044195971, 'bear_rsi_os': 41, 'bear_rsi_ob': 93, 'bear_adx_thresh': 13.366838863364453, 'bear_atr_min_pct': 0.024623835510672314, 'bear_atr_max_pct': 0.08871896648674969, 'bear_tp_mult': 2.8600287938322495, 'bear_tsl_mult': 0.5369878229440532, 'bear_time_stop': 36, 'bear_use_sma': False, 'bear_use_ema': True, 'bear_use_atr': True, 'bear_use_adx': False, 'bear_use_spike': True, 'bear_rsi_required': False, 'sideways_strategy': 'breakout', 'sideways_bb_std_mult': 2.6885840035652566, 'sideways_rsi_os': 17, 'sideways_rsi_ob': 83, 'sideways_adx_thresh': 24.95642564902581, 'sideways_atr_min_pct': 0.0047030906455916375, 'sideways_atr_max_pct': 0.03643230394715303, 'sideways_tp_mult': 2.3638167621776676, 'sideways_tsl_mult': 0.5711967578490338, 'sideways_time_stop': 37, 'sideways_use_sma': False, 'sideways_use_ema': False, 'sideways_use_atr': True, 'sideways_use_adx': False, 'sideways_use_spike': False, 'sideways_rsi_required': True}.
[I 2025-08-31 10:34:04,991] Trial 304 finished with values: [-0.014276819888458747, 0.014281042505337408] and parameters: {'p_sma': 15, 'p_std': 45, 'p_atr': 15, 'p_adx': 15, 'rsi_period': 81, 'ema1': 18, 'ema2': 25, 'slip_atr_k': 0.02982354839062596, 'slip_spread_k': 0.6729828198297119, 'spread_hl_frac': 0.009936476463051673, 'bb_std_mult': 1.107530676289227, 'rsi_os': 24, 'rsi_ob': 49, 'vol_spike': 0.25632506467147925, 'adx_thresh': 30.943806285638264, 'atr_min_pct': 0.019851884734730235, 'atr_max_pct': 0.05360184126742169, 'tp_mult': 2.479580353658122, 'tsl_mult': 0.5872401495892862, 'strategy': 'breakout', 'time_stop': 266, 'use_sma': True, 'use_atr': True, 'use_adx': False, 'use_ema': True, 'use_spike': False, 'rsi_required': True, 'edge_k': 1.1256561746144007, 'edge_cap': 0.4298808966330709, 'bull_strategy': 'breakout', 'bull_bb_std_mult': 2.491986885649397, 'bull_rsi_os': 48, 'bull_rsi_ob': 73, 'bull_adx_thresh': 26.776164161936922, 'bull_atr_min_pct': 0.0002843425085776745, 'bull_atr_max_pct': 0.035791736524749394, 'bull_tp_mult': 1.6878095138122087, 'bull_tsl_mult': 0.40838575237461, 'bull_time_stop': 81, 'bull_use_sma': True, 'bull_use_ema': True, 'bull_use_atr': True, 'bull_use_adx': True, 'bull_use_spike': True, 'bull_rsi_required': True, 'bear_strategy': 'breakout', 'bear_bb_std_mult': 1.0977738017124894, 'bear_rsi_os': 41, 'bear_rsi_ob': 69, 'bear_adx_thresh': 16.828714396602553, 'bear_atr_min_pct': 0.021817655377980073, 'bear_atr_max_pct': 0.052814446880258714, 'bear_tp_mult': 2.778563571027209, 'bear_tsl_mult': 0.25631107549847393, 'bear_time_stop': 37, 'bear_use_sma': False, 'bear_use_ema': True, 'bear_use_atr': True, 'bear_use_adx': False, 'bear_use_spike': True, 'bear_rsi_required': False, 'sideways_strategy': 'breakout', 'sideways_bb_std_mult': 2.615427162926361, 'sideways_rsi_os': 6, 'sideways_rsi_ob': 95, 'sideways_adx_thresh': 23.042937620623164, 'sideways_atr_min_pct': 0.017993707211065867, 'sideways_atr_max_pct': 0.07125842957079445, 'sideways_tp_mult': 2.87791443238489, 'sideways_tsl_mult': 0.11147212577225504, 'sideways_time_stop': 188, 'sideways_use_sma': False, 'sideways_use_ema': False, 'sideways_use_atr': True, 'sideways_use_adx': False, 'sideways_use_spike': False, 'sideways_rsi_required': True}.
[I 2025-08-31 10:34:05,818] Trial 305 finished with values: [-1000000000.0, 1000000000.0] and parameters: {'p_sma': 16, 'p_std': 25, 'p_atr': 30, 'p_adx': 15, 'rsi_period': 34, 'ema1': 19, 'ema2': 54, 'slip_atr_k': 0.02942362700991375, 'slip_spread_k': 0.6686110235323827, 'spread_hl_frac': 0.029437276295869275, 'bb_std_mult': 0.6712829980339252, 'rsi_os': 24, 'rsi_ob': 66, 'vol_spike': 0.2523972470057812, 'adx_thresh': 31.014632016608967, 'atr_min_pct': 0.019957008803146024, 'atr_max_pct': 0.018932229574436334, 'tp_mult': 2.1267344916710966, 'tsl_mult': 0.09256760870725234, 'strategy': 'breakout', 'time_stop': 264, 'use_sma': True, 'use_atr': True, 'use_adx': False, 'use_ema': True, 'use_spike': True, 'rsi_required': False, 'edge_k': 1.2325163400052237, 'edge_cap': 0.5485650323896227, 'bull_strategy': 'breakout', 'bull_bb_std_mult': 1.648056646390001, 'bull_rsi_os': 28, 'bull_rsi_ob': 57, 'bull_adx_thresh': 23.122342201530522, 'bull_atr_min_pct': 0.0006273986123772064, 'bull_atr_max_pct': 0.026875181330835364, 'bull_tp_mult': 1.6930706480468913, 'bull_tsl_mult': 0.4123918573762779, 'bull_time_stop': 80, 'bull_use_sma': True, 'bull_use_ema': True, 'bull_use_atr': True, 'bull_use_adx': False, 'bull_use_spike': True, 'bull_rsi_required': True, 'bear_strategy': 'mean_reversion', 'bear_bb_std_mult': 3.5399118422443707, 'bear_rsi_os': 40, 'bear_rsi_ob': 67, 'bear_adx_thresh': 26.101654228708146, 'bear_atr_min_pct': 0.025275550805958624, 'bear_atr_max_pct': 0.08841133567149315, 'bear_tp_mult': 1.3124493711196334, 'bear_tsl_mult': 0.5390480176523984, 'bear_time_stop': 38, 'bear_use_sma': False, 'bear_use_ema': True, 'bear_use_atr': True, 'bear_use_adx': False, 'bear_use_spike': True, 'bear_rsi_required': False, 'sideways_strategy': 'breakout', 'sideways_bb_std_mult': 2.782490332570241, 'sideways_rsi_os': 17, 'sideways_rsi_ob': 56, 'sideways_adx_thresh': 12.104486264001428, 'sideways_atr_min_pct': 0.004327828991780716, 'sideways_atr_max_pct': 0.032183922773377185, 'sideways_tp_mult': 2.3522180630799108, 'sideways_tsl_mult': 0.6789354624567875, 'sideways_time_stop': 36, 'sideways_use_sma': False, 'sideways_use_ema': False, 'sideways_use_atr': False, 'sideways_use_adx': True, 'sideways_use_spike': True, 'sideways_rsi_required': True}.
