[I 2025-08-31 11:13:32,102] Trial 613 finished with values: [-0.09345929738784142, 0.09303282953487672] and parameters: {'p_sma': 51, 'p_std': 14, 'p_atr': 27, 'p_adx': 8, 'rsi_period': 47, 'ema1': 13, 'ema2': 41, 'slip_atr_k': 0.02120641529749343, 'slip_spread_k': 0.6814201598437309, 'spread_hl_frac': 0.010456355386215133, 'bb_std_mult': 2.6988586190704273, 'rsi_os': 17, 'rsi_ob': 52, 'vol_spike': 0.26887089906600853, 'adx_thresh': 34.136407535500375, 'atr_min_pct': 0.006296443280858825, 'atr_max_pct': 0.08531084402082315, 'tp_mult': 2.1557525501776307, 'tsl_mult': 0.6860139775413818, 'strategy': 'breakout', 'time_stop': 26, 'use_sma': True, 'use_atr': True, 'use_adx': False, 'use_ema': True, 'use_spike': True, 'rsi_required': False, 'edge_k': 0.8833286227222926, 'edge_cap': 0.4233454321686847, 'bull_strategy': 'mean_reversion', 'bull_bb_std_mult': 1.3898466474965279, 'bull_rsi_os': 13, 'bull_rsi_ob': 82, 'bull_adx_thresh': 7.637468180376855, 'bull_atr_min_pct': 0.005378108768574544, 'bull_atr_max_pct': 0.09207554695501953, 'bull_tp_mult': 1.0477381467667846, 'bull_tsl_mult': 0.47108360617851497, 'bull_time_stop': 56, 'bull_use_sma': True, 'bull_use_ema': False, 'bull_use_atr': True, 'bull_use_adx': False, 'bull_use_spike': False, 'bull_rsi_required': True, 'bear_strategy': 'breakout', 'bear_bb_std_mult': 1.8679622327934826, 'bear_rsi_os': 45, 'bear_rsi_ob': 86, 'bear_adx_thresh': 29.5079268870331, 'bear_atr_min_pct': 0.0020866821683501405, 'bear_atr_max_pct': 0.07099826188697708, 'bear_tp_mult': 2.7876136612417812, 'bear_tsl_mult': 0.5067330216765366, 'bear_time_stop': 29, 'bear_use_sma': True, 'bear_use_ema': False, 'bear_use_atr': True, 'bear_use_adx': False, 'bear_use_spike': True, 'bear_rsi_required': True, 'sideways_strategy': 'mean_reversion', 'sideways_bb_std_mult': 2.592982113863675, 'sideways_rsi_os': 9, 'sideways_rsi_ob': 53, 'sideways_adx_thresh': 23.6090884727028, 'sideways_atr_min_pct': 0.019032875839045352, 'sideways_atr_max_pct': 0.11510181145796564, 'sideways_tp_mult': 1.9191971190209547, 'sideways_tsl_mult': 0.512487933602638, 'sideways_time_stop': 244, 'sideways_use_sma': False, 'sideways_use_ema': True, 'sideways_use_atr': False, 'sideways_use_adx': True, 'sideways_use_spike': True, 'sideways_rsi_required': True}.
[I 2025-08-31 11:13:32,119] Trial 611 finished with values: [-1000000000.0, 1000000000.0] and parameters: {'p_sma': 34, 'p_std': 55, 'p_atr': 27, 'p_adx': 13, 'rsi_period': 46, 'ema1': 8, 'ema2': 41, 'slip_atr_k': 0.030611818796919488, 'slip_spread_k': 0.8126456461822213, 'spread_hl_frac': 0.01066678113251102, 'bb_std_mult': 2.683807810392486, 'rsi_os': 12, 'rsi_ob': 82, 'vol_spike': 0.1689876851948596, 'adx_thresh': 21.597788841608935, 'atr_min_pct': 0.007550970194530442, 'atr_max_pct': 0.08605883528166272, 'tp_mult': 2.4339791374798807, 'tsl_mult': 0.7661014455034543, 'strategy': 'breakout', 'time_stop': 69, 'use_sma': True, 'use_atr': True, 'use_adx': False, 'use_ema': True, 'use_spike': True, 'rsi_required': False, 'edge_k': 0.17262793563277476, 'edge_cap': 0.6687036204725028, 'bull_strategy': 'mean_reversion', 'bull_bb_std_mult': 0.8405163058370045, 'bull_rsi_os': 13, 'bull_rsi_ob': 74, 'bull_adx_thresh': 7.783705175544682, 'bull_atr_min_pct': 0.005147167733263175, 'bull_atr_max_pct': 0.09292094133042893, 'bull_tp_mult': 1.1391083728635591, 'bull_tsl_mult': 0.6172128544418298, 'bull_time_stop': 55, 'bull_use_sma': True, 'bull_use_ema': False, 'bull_use_atr': True, 'bull_use_adx': False, 'bull_use_spike': False, 'bull_rsi_required': True, 'bear_strategy': 'breakout', 'bear_bb_std_mult': 1.9101618184467473, 'bear_rsi_os': 23, 'bear_rsi_ob': 84, 'bear_adx_thresh': 33.48655464646197, 'bear_atr_min_pct': 0.0043637368320244615, 'bear_atr_max_pct': 0.09494679019850341, 'bear_tp_mult': 1.1187359489454174, 'bear_tsl_mult': 0.5353194978211149, 'bear_time_stop': 212, 'bear_use_sma': True, 'bear_use_ema': False, 'bear_use_atr': True, 'bear_use_adx': False, 'bear_use_spike': True, 'bear_rsi_required': True, 'sideways_strategy': 'mean_reversion', 'sideways_bb_std_mult': 2.7506026940711914, 'sideways_rsi_os': 45, 'sideways_rsi_ob': 69, 'sideways_adx_thresh': 23.294218738422025, 'sideways_atr_min_pct': 0.026702244553634465, 'sideways_atr_max_pct': 0.12690522920262007, 'sideways_tp_mult': 1.9331708320127359, 'sideways_tsl_mult': 0.1574163066082734, 'sideways_time_stop': 41, 'sideways_use_sma': False, 'sideways_use_ema': True, 'sideways_use_atr': False, 'sideways_use_adx': True, 'sideways_use_spike': True, 'sideways_rsi_required': True}.
[I 2025-08-31 11:13:32,268] Trial 612 finished with values: [-1000000000.0, 1000000000.0] and parameters: {'p_sma': 12, 'p_std': 27, 'p_atr': 27, 'p_adx': 13, 'rsi_period': 46, 'ema1': 13, 'ema2': 41, 'slip_atr_k': 0.02991131526016486, 'slip_spread_k': 0.6770705763344944, 'spread_hl_frac': 0.011292413162779891, 'bb_std_mult': 2.576693882967841, 'rsi_os': 12, 'rsi_ob': 91, 'vol_spike': 0.27000905683058224, 'adx_thresh': 27.788201265470693, 'atr_min_pct': 0.006304562789742399, 'atr_max_pct': 0.0858250501776244, 'tp_mult': 2.4392240612047154, 'tsl_mult': 0.16094080472934275, 'strategy': 'breakout', 'time_stop': 25, 'use_sma': True, 'use_atr': True, 'use_adx': False, 'use_ema': True, 'use_spike': True, 'rsi_required': False, 'edge_k': 0.17862090806629335, 'edge_cap': 0.4389542733286335, 'bull_strategy': 'mean_reversion', 'bull_bb_std_mult': 0.887707645376507, 'bull_rsi_os': 13, 'bull_rsi_ob': 93, 'bull_adx_thresh': 7.934126074978196, 'bull_atr_min_pct': 0.005266516544890097, 'bull_atr_max_pct': 0.09253922794598718, 'bull_tp_mult': 2.0101851915317352, 'bull_tsl_mult': 0.6140930531082113, 'bull_time_stop': 54, 'bull_use_sma': True, 'bull_use_ema': False, 'bull_use_atr': True, 'bull_use_adx': False, 'bull_use_spike': False, 'bull_rsi_required': True, 'bear_strategy': 'breakout', 'bear_bb_std_mult': 1.8659657855816234, 'bear_rsi_os': 10, 'bear_rsi_ob': 84, 'bear_adx_thresh': 19.9783563122822, 'bear_atr_min_pct': 0.014392025090312297, 'bear_atr_max_pct': 0.010292469294652551, 'bear_tp_mult': 2.729881486932731, 'bear_tsl_mult': 0.1056503273347359, 'bear_time_stop': 5, 'bear_use_sma': True, 'bear_use_ema': False, 'bear_use_atr': True, 'bear_use_adx': False, 'bear_use_spike': True, 'bear_rsi_required': True, 'sideways_strategy': 'mean_reversion', 'sideways_bb_std_mult': 2.7526837226614425, 'sideways_rsi_os': 9, 'sideways_rsi_ob': 75, 'sideways_adx_thresh': 23.497597370445458, 'sideways_atr_min_pct': 0.017833680307356575, 'sideways_atr_max_pct': 0.11338638783343902, 'sideways_tp_mult': 2.491200203420589, 'sideways_tsl_mult': 0.14542372048638913, 'sideways_time_stop': 38, 'sideways_use_sma': False, 'sideways_use_ema': True, 'sideways_use_atr': False, 'sideways_use_adx': True, 'sideways_use_spike': True, 'sideways_rsi_required': True}.
[I 2025-08-31 11:14:03,276] Trial 616 finished with values: [-0.030874258655195996, 0.030864830500662417] and parameters: {'p_sma': 14, 'p_std': 18, 'p_atr': 11, 'p_adx': 19, 'rsi_period': 48, 'ema1': 5, 'ema2': 52, 'slip_atr_k': 0.1573257100182874, 'slip_spread_k': 0.6203361738219971, 'spread_hl_frac': 0.021109055503635527, 'bb_std_mult': 2.58948136362793, 'rsi_os': 39, 'rsi_ob': 68, 'vol_spike': 0.26289021431845255, 'adx_thresh': 29.257781384131903, 'atr_min_pct': 0.0052781675960981034, 'atr_max_pct': 0.09554992652842359, 'tp_mult': 2.4615321171661875, 'tsl_mult': 0.5038649379843863, 'strategy': 'mean_reversion', 'time_stop': 281, 'use_sma': True, 'use_atr': False, 'use_adx': True, 'use_ema': False, 'use_spike': True, 'rsi_required': True, 'edge_k': 0.17175146004175532, 'edge_cap': 0.47229133541956947, 'bull_strategy': 'breakout', 'bull_bb_std_mult': 0.878665163305165, 'bull_rsi_os': 22, 'bull_rsi_ob': 74, 'bull_adx_thresh': 6.438882186438939, 'bull_atr_min_pct': 0.0032532611313070055, 'bull_atr_max_pct': 0.09486477388531074, 'bull_tp_mult': 2.027353535015378, 'bull_tsl_mult': 0.3443918313679391, 'bull_time_stop': 79, 'bull_use_sma': True, 'bull_use_ema': False, 'bull_use_atr': False, 'bull_use_adx': False, 'bull_use_spike': False, 'bull_rsi_required': False, 'bear_strategy': 'breakout', 'bear_bb_std_mult': 1.9397747194611403, 'bear_rsi_os': 38, 'bear_rsi_ob': 93, 'bear_adx_thresh': 5.107095784521821, 'bear_atr_min_pct': 0.004659011133428784, 'bear_atr_max_pct': 0.10829958735589372, 'bear_tp_mult': 2.8870435558303753, 'bear_tsl_mult': 0.7714653614789808, 'bear_time_stop': 7, 'bear_use_sma': False, 'bear_use_ema': True, 'bear_use_atr': False, 'bear_use_adx': True, 'bear_use_spike': False, 'bear_rsi_required': False, 'sideways_strategy': 'mean_reversion', 'sideways_bb_std_mult': 2.806108331754174, 'sideways_rsi_os': 37, 'sideways_rsi_ob': 89, 'sideways_adx_thresh': 27.37067912269613, 'sideways_atr_min_pct': 0.018077628714264292, 'sideways_atr_max_pct': 0.03712351400361475, 'sideways_tp_mult': 2.0650821855980146, 'sideways_tsl_mult': 0.7544258104584556, 'sideways_time_stop': 109, 'sideways_use_sma': True, 'sideways_use_ema': False, 'sideways_use_atr': False, 'sideways_use_adx': False, 'sideways_use_spike': False, 'sideways_rsi_required': False}.
[I 2025-08-31 11:14:03,727] Trial 618 finished with values: [-0.020908834681028776, 0.0210886121939229] and parameters: {'p_sma': 21, 'p_std': 29, 'p_atr': 14, 'p_adx': 15, 'rsi_period': 43, 'ema1': 5, 'ema2': 23, 'slip_atr_k': 0.08189640634074054, 'slip_spread_k': 0.5843724267371471, 'spread_hl_frac': 0.009568484401927327, 'bb_std_mult': 2.916091446662514, 'rsi_os': 28, 'rsi_ob': 66, 'vol_spike': 0.26325557116158316, 'adx_thresh': 29.23537277577907, 'atr_min_pct': 0.0020593428780348675, 'atr_max_pct': 0.08974812802205916, 'tp_mult': 2.485630367730338, 'tsl_mult': 0.5035212118495148, 'strategy': 'mean_reversion', 'time_stop': 10, 'use_sma': True, 'use_atr': False, 'use_adx': True, 'use_ema': False, 'use_spike': False, 'rsi_required': True, 'edge_k': 0.264454161604506, 'edge_cap': 0.22919515300719123, 'bull_strategy': 'breakout', 'bull_bb_std_mult': 3.290363920388977, 'bull_rsi_os': 9, 'bull_rsi_ob': 66, 'bull_adx_thresh': 6.569026698754474, 'bull_atr_min_pct': 0.0033221784473979957, 'bull_atr_max_pct': 0.07265609412418834, 'bull_tp_mult': 1.4941018103311867, 'bull_tsl_mult': 0.33860538550286823, 'bull_time_stop': 138, 'bull_use_sma': True, 'bull_use_ema': False, 'bull_use_atr': False, 'bull_use_adx': False, 'bull_use_spike': False, 'bull_rsi_required': False, 'bear_strategy': 'breakout', 'bear_bb_std_mult': 2.218001048328793, 'bear_rsi_os': 42, 'bear_rsi_ob': 81, 'bear_adx_thresh': 6.0000414705175755, 'bear_atr_min_pct': 0.005996289485737953, 'bear_atr_max_pct': 0.03606101082622504, 'bear_tp_mult': 2.8657822967018167, 'bear_tsl_mult': 0.2840551070723689, 'bear_time_stop': 256, 'bear_use_sma': False, 'bear_use_ema': True, 'bear_use_atr': False, 'bear_use_adx': True, 'bear_use_spike': False, 'bear_rsi_required': False, 'sideways_strategy': 'mean_reversion', 'sideways_bb_std_mult': 1.9575132894550187, 'sideways_rsi_os': 23, 'sideways_rsi_ob': 89, 'sideways_adx_thresh': 21.921201810717605, 'sideways_atr_min_pct': 0.01819483276469057, 'sideways_atr_max_pct': 0.03965553402957036, 'sideways_tp_mult': 2.0673369607331917, 'sideways_tsl_mult': 0.12237724838357848, 'sideways_time_stop': 54, 'sideways_use_sma': True, 'sideways_use_ema': False, 'sideways_use_atr': False, 'sideways_use_adx': False, 'sideways_use_spike': False, 'sideways_rsi_required': False}.
[I 2025-08-31 11:14:03,844] Trial 617 finished with values: [-1000000000.0, 1000000000.0] and parameters: {'p_sma': 14, 'p_std': 27, 'p_atr': 11, 'p_adx': 14, 'rsi_period': 61, 'ema1': 16, 'ema2': 52, 'slip_atr_k': 0.01749492691721863, 'slip_spread_k': 0.7151228266568272, 'spread_hl_frac': 0.01147951112747883, 'bb_std_mult': 2.9171906165584165, 'rsi_os': 45, 'rsi_ob': 68, 'vol_spike': 0.030699424603404163, 'adx_thresh': 29.280262643958068, 'atr_min_pct': 0.005237888957631067, 'atr_max_pct': 0.0887310304711346, 'tp_mult': 2.501632363527824, 'tsl_mult': 0.19189917505179938, 'strategy': 'mean_reversion', 'time_stop': 5, 'use_sma': True, 'use_atr': False, 'use_adx': True, 'use_ema': False, 'use_spike': False, 'rsi_required': True, 'edge_k': 0.25853581157100763, 'edge_cap': 0.4719086606711864, 'bull_strategy': 'breakout', 'bull_bb_std_mult': 3.189032536811068, 'bull_rsi_os': 8, 'bull_rsi_ob': 64, 'bull_adx_thresh': 20.12460619094989, 'bull_atr_min_pct': 0.004028414940503449, 'bull_atr_max_pct': 0.12393826002026459, 'bull_tp_mult': 2.091159991332454, 'bull_tsl_mult': 0.36753067216084306, 'bull_time_stop': 79, 'bull_use_sma': True, 'bull_use_ema': False, 'bull_use_atr': False, 'bull_use_adx': False, 'bull_use_spike': False, 'bull_rsi_required': False, 'bear_strategy': 'breakout', 'bear_bb_std_mult': 3.4915514121404754, 'bear_rsi_os': 41, 'bear_rsi_ob': 93, 'bear_adx_thresh': 12.108248091924207, 'bear_atr_min_pct': 0.007705086545350259, 'bear_atr_max_pct': 0.03533607884599418, 'bear_tp_mult': 2.8744678831806088, 'bear_tsl_mult': 0.09957963453480906, 'bear_time_stop': 254, 'bear_use_sma': False, 'bear_use_ema': True, 'bear_use_atr': False, 'bear_use_adx': True, 'bear_use_spike': False, 'bear_rsi_required': False, 'sideways_strategy': 'mean_reversion', 'sideways_bb_std_mult': 2.8055463258092193, 'sideways_rsi_os': 6, 'sideways_rsi_ob': 56, 'sideways_adx_thresh': 26.94150428911829, 'sideways_atr_min_pct': 0.018172606903622136, 'sideways_atr_max_pct': 0.03698211614624893, 'sideways_tp_mult': 2.0621550487724494, 'sideways_tsl_mult': 0.39214072010577544, 'sideways_time_stop': 23, 'sideways_use_sma': True, 'sideways_use_ema': False, 'sideways_use_atr': False, 'sideways_use_adx': False, 'sideways_use_spike': False, 'sideways_rsi_required': False}.
[I 2025-08-31 11:14:04,155] Trial 615 finished with values: [-1000000000.0, 1000000000.0] and parameters: {'p_sma': 51, 'p_std': 59, 'p_atr': 28, 'p_adx': 21, 'rsi_period': 43, 'ema1': 13, 'ema2': 57, 'slip_atr_k': 0.17184673958704555, 'slip_spread_k': 0.6135682561228968, 'spread_hl_frac': 0.01161463525370773, 'bb_std_mult': 2.6497919421400074, 'rsi_os': 16, 'rsi_ob': 77, 'vol_spike': 0.26711818226623674, 'adx_thresh': 29.16499295248714, 'atr_min_pct': 0.028603960874576263, 'atr_max_pct': 0.0901212000308827, 'tp_mult': 2.5059077911839034, 'tsl_mult': 0.8950961254535335, 'strategy': 'breakout', 'time_stop': 300, 'use_sma': True, 'use_atr': True, 'use_adx': False, 'use_ema': True, 'use_spike': True, 'rsi_required': True, 'edge_k': 0.1705421330759342, 'edge_cap': 0.4375398230591656, 'bull_strategy': 'mean_reversion', 'bull_bb_std_mult': 0.6186128447468786, 'bull_rsi_os': 52, 'bull_rsi_ob': 74, 'bull_adx_thresh': 6.4872758414177865, 'bull_atr_min_pct': 0.004047170510769771, 'bull_atr_max_pct': 0.024506830452742788, 'bull_tp_mult': 2.0367686565960788, 'bull_tsl_mult': 0.46273817774206755, 'bull_time_stop': 53, 'bull_use_sma': True, 'bull_use_ema': False, 'bull_use_atr': False, 'bull_use_adx': False, 'bull_use_spike': False, 'bull_rsi_required': False, 'bear_strategy': 'breakout', 'bear_bb_std_mult': 1.9250640232996166, 'bear_rsi_os': 45, 'bear_rsi_ob': 94, 'bear_adx_thresh': 19.878698072425998, 'bear_atr_min_pct': 0.02160825890027765, 'bear_atr_max_pct': 0.09452012033442822, 'bear_tp_mult': 2.806360444336645, 'bear_tsl_mult': 0.6537939855942877, 'bear_time_stop': 96, 'bear_use_sma': True, 'bear_use_ema': True, 'bear_use_atr': True, 'bear_use_adx': False, 'bear_use_spike': False, 'bear_rsi_required': False, 'sideways_strategy': 'mean_reversion', 'sideways_bb_std_mult': 2.8069802196429703, 'sideways_rsi_os': 6, 'sideways_rsi_ob': 89, 'sideways_adx_thresh': 27.170898690382913, 'sideways_atr_min_pct': 0.019110065100437217, 'sideways_atr_max_pct': 0.036580334710768075, 'sideways_tp_mult': 2.5144262273057825, 'sideways_tsl_mult': 0.11634080677849927, 'sideways_time_stop': 248, 'sideways_use_sma': False, 'sideways_use_ema': True, 'sideways_use_atr': False, 'sideways_use_adx': False, 'sideways_use_spike': False, 'sideways_rsi_required': True}.
[I 2025-08-31 11:14:35,870] Trial 619 finished with values: [-1000000000.0, 1000000000.0] and parameters: {'p_sma': 21, 'p_std': 59, 'p_atr': 12, 'p_adx': 21, 'rsi_period': 40, 'ema1': 16, 'ema2': 23, 'slip_atr_k': 0.06054436303688426, 'slip_spread_k': 0.5761131597222939, 'spread_hl_frac': 0.009392442428338069, 'bb_std_mult': 2.9878057844450843, 'rsi_os': 15, 'rsi_ob': 77, 'vol_spike': 0.023017184750402736, 'adx_thresh': 28.906908456701714, 'atr_min_pct': 0.028716086935529885, 'atr_max_pct': 0.08969447817713316, 'tp_mult': 2.509597638700916, 'tsl_mult': 0.2367560106826731, 'strategy': 'mean_reversion', 'time_stop': 14, 'use_sma': True, 'use_atr': False, 'use_adx': True, 'use_ema': True, 'use_spike': False, 'rsi_required': True, 'edge_k': 0.2585426853630391, 'edge_cap': 0.9510788824855484, 'bull_strategy': 'breakout', 'bull_bb_std_mult': 0.5955959766969245, 'bull_rsi_os': 52, 'bull_rsi_ob': 50, 'bull_adx_thresh': 6.86625342637542, 'bull_atr_min_pct': 0.004366269439808268, 'bull_atr_max_pct': 0.10056427629913228, 'bull_tp_mult': 2.0880770232235415, 'bull_tsl_mult': 0.4532025694737038, 'bull_time_stop': 20, 'bull_use_sma': True, 'bull_use_ema': False, 'bull_use_atr': False, 'bull_use_adx': False, 'bull_use_spike': False, 'bull_rsi_required': False, 'bear_strategy': 'breakout', 'bear_bb_std_mult': 2.221535362328156, 'bear_rsi_os': 42, 'bear_rsi_ob': 81, 'bear_adx_thresh': 24.542698207052325, 'bear_atr_min_pct': 0.005753790405343717, 'bear_atr_max_pct': 0.030719845872701414, 'bear_tp_mult': 2.377898015090902, 'bear_tsl_mult': 0.5715254381930794, 'bear_time_stop': 35, 'bear_use_sma': False, 'bear_use_ema': True, 'bear_use_atr': False, 'bear_use_adx': False, 'bear_use_spike': False, 'bear_rsi_required': False, 'sideways_strategy': 'mean_reversion', 'sideways_bb_std_mult': 1.9551137868317272, 'sideways_rsi_os': 24, 'sideways_rsi_ob': 94, 'sideways_adx_thresh': 21.75207696873585, 'sideways_atr_min_pct': 0.019326202804192907, 'sideways_atr_max_pct': 0.03985411262949987, 'sideways_tp_mult': 2.0199167309113815, 'sideways_tsl_mult': 0.3840917879360371, 'sideways_time_stop': 17, 'sideways_use_sma': True, 'sideways_use_ema': False, 'sideways_use_atr': False, 'sideways_use_adx': False, 'sideways_use_spike': False, 'sideways_rsi_required': True}.
[I 2025-08-31 11:14:36,791] Trial 620 finished with values: [-1000000000.0, 1000000000.0] and parameters: {'p_sma': 16, 'p_std': 43, 'p_atr': 12, 'p_adx': 30, 'rsi_period': 41, 'ema1': 23, 'ema2': 57, 'slip_atr_k': 0.09224512927885044, 'slip_spread_k': 0.7110261472584491, 'spread_hl_frac': 0.02270159209711863, 'bb_std_mult': 2.756300805764514, 'rsi_os': 45, 'rsi_ob': 77, 'vol_spike': 0.025037890855669903, 'adx_thresh': 24.516916412214968, 'atr_min_pct': 0.004932852413943388, 'atr_max_pct': 0.10019284505554756, 'tp_mult': 2.3151393134823466, 'tsl_mult': 0.18705562549687876, 'strategy': 'breakout', 'time_stop': 82, 'use_sma': True, 'use_atr': False, 'use_adx': True, 'use_ema': True, 'use_spike': True, 'rsi_required': True, 'edge_k': 0.13066919185526, 'edge_cap': 0.978586541946719, 'bull_strategy': 'breakout', 'bull_bb_std_mult': 0.5803223389014218, 'bull_rsi_os': 20, 'bull_rsi_ob': 75, 'bull_adx_thresh': 7.071615487832397, 'bull_atr_min_pct': 0.00407361381334984, 'bull_atr_max_pct': 0.024370122360970435, 'bull_tp_mult': 2.0930863175636394, 'bull_tsl_mult': 0.4064848678837092, 'bull_time_stop': 77, 'bull_use_sma': True, 'bull_use_ema': False, 'bull_use_atr': False, 'bull_use_adx': False, 'bull_use_spike': False, 'bull_rsi_required': True, 'bear_strategy': 'breakout', 'bear_bb_std_mult': 1.5718757954277685, 'bear_rsi_os': 21, 'bear_rsi_ob': 61, 'bear_adx_thresh': 27.252464457324123, 'bear_atr_min_pct': 0.007644211949882716, 'bear_atr_max_pct': 0.09010845123147125, 'bear_tp_mult': 1.2095691153000687, 'bear_tsl_mult': 0.6143156976776196, 'bear_time_stop': 78, 'bear_use_sma': False, 'bear_use_ema': True, 'bear_use_atr': False, 'bear_use_adx': False, 'bear_use_spike': True, 'bear_rsi_required': False, 'sideways_strategy': 'mean_reversion', 'sideways_bb_std_mult': 0.906083563225131, 'sideways_rsi_os': 53, 'sideways_rsi_ob': 87, 'sideways_adx_thresh': 24.628603695892036, 'sideways_atr_min_pct': 0.01944370267622796, 'sideways_atr_max_pct': 0.14298922144495094, 'sideways_tp_mult': 2.0214651375620956, 'sideways_tsl_mult': 0.0985268226826962, 'sideways_time_stop': 19, 'sideways_use_sma': False, 'sideways_use_ema': False, 'sideways_use_atr': False, 'sideways_use_adx': False, 'sideways_use_spike': False, 'sideways_rsi_required': True}.
