[I 2025-08-31 10:19:58,974] Trial 195 finished with values: [-0.04954362105489618, 0.04922578819945801] and parameters: {'p_sma': 13, 'p_std': 37, 'p_atr': 30, 'p_adx': 17, 'rsi_period': 60, 'ema1': 16, 'ema2': 55, 'slip_atr_k': 0.24432921437891467, 'slip_spread_k': 0.6655056203278285, 'spread_hl_frac': 0.012738203313989872, 'bb_std_mult': 0.5397508106899761, 'rsi_os': 12, 'rsi_ob': 75, 'vol_spike': 0.21828236397591366, 'adx_thresh': 21.058362975564926, 'atr_min_pct': 0.005152323688097918, 'atr_max_pct': 0.055743403592827596, 'tp_mult': 2.441629107884183, 'tsl_mult': 0.5832047078067465, 'strategy': 'breakout', 'time_stop': 241, 'use_sma': True, 'use_atr': True, 'use_adx': False, 'use_ema': False, 'use_spike': True, 'rsi_required': False, 'edge_k': 0.7975115404144405, 'edge_cap': 0.3575264176997618, 'bull_strategy': 'breakout', 'bull_bb_std_mult': 1.7826603811423227, 'bull_rsi_os': 44, 'bull_rsi_ob': 75, 'bull_adx_thresh': 21.953013265143927, 'bull_atr_min_pct': 0.0006441437150257038, 'bull_atr_max_pct': 0.14618078498345677, 'bull_tp_mult': 1.7517041137026177, 'bull_tsl_mult': 0.38116469199374103, 'bull_time_stop': 72, 'bull_use_sma': True, 'bull_use_ema': True, 'bull_use_atr': True, 'bull_use_adx': False, 'bull_use_spike': True, 'bull_rsi_required': True, 'bear_strategy': 'breakout', 'bear_bb_std_mult': 1.03050361891977, 'bear_rsi_os': 39, 'bear_rsi_ob': 47, 'bear_adx_thresh': 15.853457354741419, 'bear_atr_min_pct': 0.0022256328887646387, 'bear_atr_max_pct': 0.08456703936521043, 'bear_tp_mult': 2.4512580271189885, 'bear_tsl_mult': 0.4826792313638974, 'bear_time_stop': 32, 'bear_use_sma': False, 'bear_use_ema': True, 'bear_use_atr': False, 'bear_use_adx': True, 'bear_use_spike': True, 'bear_rsi_required': False, 'sideways_strategy': 'breakout', 'sideways_bb_std_mult': 1.8927634972971101, 'sideways_rsi_os': 18, 'sideways_rsi_ob': 82, 'sideways_adx_thresh': 22.524401544553253, 'sideways_atr_min_pct': 0.0038307850606605627, 'sideways_atr_max_pct': 0.03207011288606213, 'sideways_tp_mult': 2.029443994323646, 'sideways_tsl_mult': 0.08978157282952727, 'sideways_time_stop': 35, 'sideways_use_sma': False, 'sideways_use_ema': False, 'sideways_use_atr': False, 'sideways_use_adx': True, 'sideways_use_spike': True, 'sideways_rsi_required': True}.
[I 2025-08-31 10:20:29,837] Trial 202 finished with values: [-0.041297081021553605, 0.04131512293045929] and parameters: {'p_sma': 39, 'p_std': 7, 'p_atr': 21, 'p_adx': 16, 'rsi_period': 47, 'ema1': 17, 'ema2': 33, 'slip_atr_k': 0.02435979303847146, 'slip_spread_k': 0.709989754893067, 'spread_hl_frac': 0.04940799113236, 'bb_std_mult': 0.6818854211074632, 'rsi_os': 33, 'rsi_ob': 72, 'vol_spike': 0.2986488930205348, 'adx_thresh': 29.391947461827268, 'atr_min_pct': 0.02031730263420974, 'atr_max_pct': 0.1034502025408957, 'tp_mult': 2.3860314017715694, 'tsl_mult': 0.4185861484044679, 'strategy': 'breakout', 'time_stop': 231, 'use_sma': True, 'use_atr': True, 'use_adx': False, 'use_ema': True, 'use_spike': True, 'rsi_required': True, 'edge_k': 1.7949482749669765, 'edge_cap': 0.589575366668589, 'bull_strategy': 'breakout', 'bull_bb_std_mult': 2.0669436062845667, 'bull_rsi_os': 40, 'bull_rsi_ob': 78, 'bull_adx_thresh': 23.559808442457687, 'bull_atr_min_pct': 0.0014600128880777846, 'bull_atr_max_pct': 0.1352891457202897, 'bull_tp_mult': 2.021240334613296, 'bull_tsl_mult': 0.3439532162065534, 'bull_time_stop': 59, 'bull_use_sma': True, 'bull_use_ema': False, 'bull_use_atr': False, 'bull_use_adx': True, 'bull_use_spike': True, 'bull_rsi_required': False, 'bear_strategy': 'breakout', 'bear_bb_std_mult': 0.9011535886813322, 'bear_rsi_os': 13, 'bear_rsi_ob': 51, 'bear_adx_thresh': 17.355151317121422, 'bear_atr_min_pct': 0.004396016358321873, 'bear_atr_max_pct': 0.029845799597488308, 'bear_tp_mult': 2.754949180044049, 'bear_tsl_mult': 0.5564515616058621, 'bear_time_stop': 268, 'bear_use_sma': False, 'bear_use_ema': True, 'bear_use_atr': False, 'bear_use_adx': False, 'bear_use_spike': True, 'bear_rsi_required': False, 'sideways_strategy': 'mean_reversion', 'sideways_bb_std_mult': 0.6528740222073892, 'sideways_rsi_os': 15, 'sideways_rsi_ob': 54, 'sideways_adx_thresh': 34.17390441459625, 'sideways_atr_min_pct': 0.0059885773827990695, 'sideways_atr_max_pct': 0.0211698493938633, 'sideways_tp_mult': 2.048551466458166, 'sideways_tsl_mult': 0.45176361105644613, 'sideways_time_stop': 27, 'sideways_use_sma': False, 'sideways_use_ema': False, 'sideways_use_atr': True, 'sideways_use_adx': True, 'sideways_use_spike': False, 'sideways_rsi_required': True}.
[I 2025-08-31 10:20:30,149] Trial 201 finished with values: [-1000000000.0, 1000000000.0] and parameters: {'p_sma': 23, 'p_std': 11, 'p_atr': 18, 'p_adx': 16, 'rsi_period': 47, 'ema1': 17, 'ema2': 33, 'slip_atr_k': 0.17905445057502822, 'slip_spread_k': 0.9984327835916357, 'spread_hl_frac': 0.010885697271999667, 'bb_std_mult': 0.6633840284492117, 'rsi_os': 28, 'rsi_ob': 82, 'vol_spike': 0.2798547240097635, 'adx_thresh': 30.36689926787059, 'atr_min_pct': 0.00360717114934489, 'atr_max_pct': 0.10388910816412814, 'tp_mult': 2.370512834085309, 'tsl_mult': 0.5247305586414246, 'strategy': 'breakout', 'time_stop': 231, 'use_sma': True, 'use_atr': True, 'use_adx': False, 'use_ema': True, 'use_spike': True, 'rsi_required': False, 'edge_k': 0.814085145915943, 'edge_cap': 0.8904553212863853, 'bull_strategy': 'breakout', 'bull_bb_std_mult': 2.0520375897740943, 'bull_rsi_os': 40, 'bull_rsi_ob': 75, 'bull_adx_thresh': 23.515233253058284, 'bull_atr_min_pct': 0.018651667685551074, 'bull_atr_max_pct': 0.1361020162504531, 'bull_tp_mult': 1.0837876744794093, 'bull_tsl_mult': 0.3289083081818077, 'bull_time_stop': 59, 'bull_use_sma': True, 'bull_use_ema': True, 'bull_use_atr': True, 'bull_use_adx': False, 'bull_use_spike': True, 'bull_rsi_required': False, 'bear_strategy': 'breakout', 'bear_bb_std_mult': 1.3773478275695727, 'bear_rsi_os': 39, 'bear_rsi_ob': 87, 'bear_adx_thresh': 17.328001194670282, 'bear_atr_min_pct': 0.004176666591145116, 'bear_atr_max_pct': 0.08065402344787767, 'bear_tp_mult': 2.4276833833785005, 'bear_tsl_mult': 0.435794171087306, 'bear_time_stop': 242, 'bear_use_sma': False, 'bear_use_ema': True, 'bear_use_atr': False, 'bear_use_adx': False, 'bear_use_spike': True, 'bear_rsi_required': False, 'sideways_strategy': 'breakout', 'sideways_bb_std_mult': 0.6233480596680896, 'sideways_rsi_os': 15, 'sideways_rsi_ob': 67, 'sideways_adx_thresh': 23.52081228129875, 'sideways_atr_min_pct': 0.006046775235554849, 'sideways_atr_max_pct': 0.04994065925981897, 'sideways_tp_mult': 2.0369480571700525, 'sideways_tsl_mult': 0.1798219970141619, 'sideways_time_stop': 56, 'sideways_use_sma': False, 'sideways_use_ema': False, 'sideways_use_atr': False, 'sideways_use_adx': True, 'sideways_use_spike': False, 'sideways_rsi_required': True}.
[I 2025-08-31 10:20:30,392] Trial 199 finished with values: [-0.06528721912495095, 0.06513062430273363] and parameters: {'p_sma': 14, 'p_std': 10, 'p_atr': 21, 'p_adx': 16, 'rsi_period': 74, 'ema1': 17, 'ema2': 22, 'slip_atr_k': 0.023664400589381632, 'slip_spread_k': 0.698618979013829, 'spread_hl_frac': 0.04919555285971544, 'bb_std_mult': 0.6760066600547706, 'rsi_os': 24, 'rsi_ob': 76, 'vol_spike': 0.22140601644748423, 'adx_thresh': 15.543480128008628, 'atr_min_pct': 0.01761140656780319, 'atr_max_pct': 0.09387150106686212, 'tp_mult': 2.383688984192304, 'tsl_mult': 0.6754515814408576, 'strategy': 'breakout', 'time_stop': 239, 'use_sma': True, 'use_atr': True, 'use_adx': False, 'use_ema': False, 'use_spike': True, 'rsi_required': False, 'edge_k': 0.13898692495563164, 'edge_cap': 0.6365454773015667, 'bull_strategy': 'breakout', 'bull_bb_std_mult': 0.7698572933769753, 'bull_rsi_os': 40, 'bull_rsi_ob': 75, 'bull_adx_thresh': 22.082782134264974, 'bull_atr_min_pct': 0.0010837794138939942, 'bull_atr_max_pct': 0.14625562410042056, 'bull_tp_mult': 2.3199738555571616, 'bull_tsl_mult': 0.4099597165903609, 'bull_time_stop': 116, 'bull_use_sma': True, 'bull_use_ema': True, 'bull_use_atr': True, 'bull_use_adx': False, 'bull_use_spike': True, 'bull_rsi_required': True, 'bear_strategy': 'breakout', 'bear_bb_std_mult': 1.2701752263060522, 'bear_rsi_os': 39, 'bear_rsi_ob': 68, 'bear_adx_thresh': 17.245650520038943, 'bear_atr_min_pct': 0.0024068849269638006, 'bear_atr_max_pct': 0.14244164538505535, 'bear_tp_mult': 2.273407949797419, 'bear_tsl_mult': 0.6734274835270764, 'bear_time_stop': 57, 'bear_use_sma': False, 'bear_use_ema': True, 'bear_use_atr': False, 'bear_use_adx': True, 'bear_use_spike': True, 'bear_rsi_required': False, 'sideways_strategy': 'breakout', 'sideways_bb_std_mult': 1.921177344876067, 'sideways_rsi_os': 15, 'sideways_rsi_ob': 54, 'sideways_adx_thresh': 7.242429271744388, 'sideways_atr_min_pct': 0.0036825349274990805, 'sideways_atr_max_pct': 0.051806328583982736, 'sideways_tp_mult': 2.036565067715301, 'sideways_tsl_mult': 0.5549797559152748, 'sideways_time_stop': 58, 'sideways_use_sma': False, 'sideways_use_ema': False, 'sideways_use_atr': False, 'sideways_use_adx': True, 'sideways_use_spike': True, 'sideways_rsi_required': True}.
[I 2025-08-31 10:20:30,768] Trial 200 finished with values: [-0.0214694101516818, 0.02124897470609425] and parameters: {'p_sma': 11, 'p_std': 9, 'p_atr': 21, 'p_adx': 16, 'rsi_period': 47, 'ema1': 17, 'ema2': 50, 'slip_atr_k': 0.24410713550187174, 'slip_spread_k': 0.6975533630235203, 'spread_hl_frac': 0.02579067263098266, 'bb_std_mult': 0.6685263497972078, 'rsi_os': 24, 'rsi_ob': 76, 'vol_spike': 0.28088661597148135, 'adx_thresh': 29.442395518112615, 'atr_min_pct': 0.01531916959095947, 'atr_max_pct': 0.10421784717238225, 'tp_mult': 2.3800834031815272, 'tsl_mult': 0.44418534829892076, 'strategy': 'breakout', 'time_stop': 232, 'use_sma': True, 'use_atr': True, 'use_adx': False, 'use_ema': True, 'use_spike': True, 'rsi_required': False, 'edge_k': 0.13857222213098389, 'edge_cap': 0.6511459348212104, 'bull_strategy': 'breakout', 'bull_bb_std_mult': 0.7579550210506009, 'bull_rsi_os': 43, 'bull_rsi_ob': 66, 'bull_adx_thresh': 25.768359311050027, 'bull_atr_min_pct': 0.00010103223490271385, 'bull_atr_max_pct': 0.13496394053207256, 'bull_tp_mult': 2.0287653653988094, 'bull_tsl_mult': 0.4169065271456537, 'bull_time_stop': 59, 'bull_use_sma': True, 'bull_use_ema': True, 'bull_use_atr': True, 'bull_use_adx': False, 'bull_use_spike': True, 'bull_rsi_required': True, 'bear_strategy': 'breakout', 'bear_bb_std_mult': 1.8906133801427996, 'bear_rsi_os': 39, 'bear_rsi_ob': 51, 'bear_adx_thresh': 16.09243563264176, 'bear_atr_min_pct': 0.024906089689110754, 'bear_atr_max_pct': 0.029464711378488787, 'bear_tp_mult': 2.425407113195823, 'bear_tsl_mult': 0.5581170852334685, 'bear_time_stop': 57, 'bear_use_sma': False, 'bear_use_ema': True, 'bear_use_atr': False, 'bear_use_adx': False, 'bear_use_spike': True, 'bear_rsi_required': False, 'sideways_strategy': 'breakout', 'sideways_bb_std_mult': 0.7327881492130368, 'sideways_rsi_os': 41, 'sideways_rsi_ob': 80, 'sideways_adx_thresh': 23.38983122613994, 'sideways_atr_min_pct': 0.004661368425809491, 'sideways_atr_max_pct': 0.024712532766562746, 'sideways_tp_mult': 1.3070619295940296, 'sideways_tsl_mult': 0.7248257646160652, 'sideways_time_stop': 56, 'sideways_use_sma': False, 'sideways_use_ema': False, 'sideways_use_atr': False, 'sideways_use_adx': True, 'sideways_use_spike': True, 'sideways_rsi_required': True}.
[I 2025-08-31 10:21:01,911] Trial 206 finished with values: [-1000000000.0, 1000000000.0] and parameters: {'p_sma': 21, 'p_std': 35, 'p_atr': 29, 'p_adx': 17, 'rsi_period': 67, 'ema1': 18, 'ema2': 54, 'slip_atr_k': 0.16348564602950155, 'slip_spread_k': 0.586404896916945, 'spread_hl_frac': 0.011938759522490933, 'bb_std_mult': 0.7276266160440495, 'rsi_os': 27, 'rsi_ob': 73, 'vol_spike': 0.2710763290038646, 'adx_thresh': 28.584407906658733, 'atr_min_pct': 0.016133436281774972, 'atr_max_pct': 0.09872465858701887, 'tp_mult': 2.516260697953932, 'tsl_mult': 0.5626921599501231, 'strategy': 'breakout', 'time_stop': 113, 'use_sma': True, 'use_atr': False, 'use_adx': True, 'use_ema': True, 'use_spike': True, 'rsi_required': False, 'edge_k': 0.07356107644564595, 'edge_cap': 0.8621156477355155, 'bull_strategy': 'breakout', 'bull_bb_std_mult': 0.5534202982769479, 'bull_rsi_os': 49, 'bull_rsi_ob': 80, 'bull_adx_thresh': 25.028722071680278, 'bull_atr_min_pct': 0.002588245695612267, 'bull_atr_max_pct': 0.1498496878079978, 'bull_tp_mult': 1.6566714492839862, 'bull_tsl_mult': 0.4011743319861345, 'bull_time_stop': 256, 'bull_use_sma': True, 'bull_use_ema': True, 'bull_use_atr': True, 'bull_use_adx': False, 'bull_use_spike': False, 'bull_rsi_required': True, 'bear_strategy': 'breakout', 'bear_bb_std_mult': 1.1280625616787443, 'bear_rsi_os': 37, 'bear_rsi_ob': 91, 'bear_adx_thresh': 16.54611022161818, 'bear_atr_min_pct': 0.0051246074161829126, 'bear_atr_max_pct': 0.03424633096420214, 'bear_tp_mult': 1.6997057833063645, 'bear_tsl_mult': 0.917842840024524, 'bear_time_stop': 45, 'bear_use_sma': False, 'bear_use_ema': True, 'bear_use_atr': False, 'bear_use_adx': False, 'bear_use_spike': True, 'bear_rsi_required': False, 'sideways_strategy': 'breakout', 'sideways_bb_std_mult': 2.7350370545477567, 'sideways_rsi_os': 29, 'sideways_rsi_ob': 81, 'sideways_adx_thresh': 24.06306399445865, 'sideways_atr_min_pct': 0.004483900710301874, 'sideways_atr_max_pct': 0.03483372357638403, 'sideways_tp_mult': 1.9720583282621376, 'sideways_tsl_mult': 0.1395028238805111, 'sideways_time_stop': 27, 'sideways_use_sma': False, 'sideways_use_ema': False, 'sideways_use_atr': False, 'sideways_use_adx': False, 'sideways_use_spike': True, 'sideways_rsi_required': True}.
[I 2025-08-31 10:21:02,347] Trial 205 finished with values: [-1000000000.0, 1000000000.0] and parameters: {'p_sma': 19, 'p_std': 34, 'p_atr': 29, 'p_adx': 18, 'rsi_period': 67, 'ema1': 18, 'ema2': 45, 'slip_atr_k': 0.09900663645986606, 'slip_spread_k': 0.5893619508140485, 'spread_hl_frac': 0.01214505456752954, 'bb_std_mult': 0.6255450900392215, 'rsi_os': 27, 'rsi_ob': 74, 'vol_spike': 0.2726905872965028, 'adx_thresh': 28.580206083095444, 'atr_min_pct': 0.004118282672459583, 'atr_max_pct': 0.09803794033436969, 'tp_mult': 2.518830979110484, 'tsl_mult': 0.5649303562161194, 'strategy': 'breakout', 'time_stop': 216, 'use_sma': True, 'use_atr': False, 'use_adx': True, 'use_ema': True, 'use_spike': True, 'rsi_required': False, 'edge_k': 0.18472557042345428, 'edge_cap': 0.8578631788007535, 'bull_strategy': 'breakout', 'bull_bb_std_mult': 0.5438919901110998, 'bull_rsi_os': 42, 'bull_rsi_ob': 66, 'bull_adx_thresh': 25.93925559530393, 'bull_atr_min_pct': 0.02034913892127692, 'bull_atr_max_pct': 0.13029745527147832, 'bull_tp_mult': 1.6511791864744239, 'bull_tsl_mult': 0.410676413981018, 'bull_time_stop': 251, 'bull_use_sma': True, 'bull_use_ema': True, 'bull_use_atr': True, 'bull_use_adx': False, 'bull_use_spike': False, 'bull_rsi_required': True, 'bear_strategy': 'breakout', 'bear_bb_std_mult': 1.1497874267120405, 'bear_rsi_os': 37, 'bear_rsi_ob': 69, 'bear_adx_thresh': 16.364601604612044, 'bear_atr_min_pct': 0.01938575455773233, 'bear_atr_max_pct': 0.08220098903542453, 'bear_tp_mult': 2.20808399852545, 'bear_tsl_mult': 0.8009130878451807, 'bear_time_stop': 45, 'bear_use_sma': False, 'bear_use_ema': True, 'bear_use_atr': False, 'bear_use_adx': False, 'bear_use_spike': True, 'bear_rsi_required': False, 'sideways_strategy': 'breakout', 'sideways_bb_std_mult': 2.7113395031751493, 'sideways_rsi_os': 51, 'sideways_rsi_ob': 80, 'sideways_adx_thresh': 24.33238334301229, 'sideways_atr_min_pct': 0.00439730936201862, 'sideways_atr_max_pct': 0.03515881745414857, 'sideways_tp_mult': 1.9641969377722972, 'sideways_tsl_mult': 0.14280214489090653, 'sideways_time_stop': 26, 'sideways_use_sma': False, 'sideways_use_ema': False, 'sideways_use_atr': False, 'sideways_use_adx': True, 'sideways_use_spike': True, 'sideways_rsi_required': True}.
[I 2025-08-31 10:21:02,634] Trial 203 finished with values: [-1000000000.0, 1000000000.0] and parameters: {'p_sma': 19, 'p_std': 10, 'p_atr': 30, 'p_adx': 16, 'rsi_period': 74, 'ema1': 18, 'ema2': 24, 'slip_atr_k': 0.22262239761984767, 'slip_spread_k': 0.6778565699727406, 'spread_hl_frac': 0.01076982263036761, 'bb_std_mult': 0.6658535515098329, 'rsi_os': 24, 'rsi_ob': 83, 'vol_spike': 0.24894099019402477, 'adx_thresh': 15.090413501619945, 'atr_min_pct': 0.0036038478178684026, 'atr_max_pct': 0.0948969434158304, 'tp_mult': 2.376378425638772, 'tsl_mult': 0.5293751218067839, 'strategy': 'breakout', 'time_stop': 244, 'use_sma': True, 'use_atr': False, 'use_adx': True, 'use_ema': True, 'use_spike': True, 'rsi_required': False, 'edge_k': 0.14558737841459074, 'edge_cap': 0.8926072290885056, 'bull_strategy': 'breakout', 'bull_bb_std_mult': 0.5023469609138961, 'bull_rsi_os': 34, 'bull_rsi_ob': 86, 'bull_adx_thresh': 25.21514314503478, 'bull_atr_min_pct': 0.019031361049561376, 'bull_atr_max_pct': 0.14979691723949537, 'bull_tp_mult': 1.6648890075721603, 'bull_tsl_mult': 0.4228960012966604, 'bull_time_stop': 300, 'bull_use_sma': True, 'bull_use_ema': True, 'bull_use_atr': True, 'bull_use_adx': False, 'bull_use_spike': True, 'bull_rsi_required': True, 'bear_strategy': 'breakout', 'bear_bb_std_mult': 1.124465097011869, 'bear_rsi_os': 37, 'bear_rsi_ob': 63, 'bear_adx_thresh': 16.484033583285154, 'bear_atr_min_pct': 0.02484721116108756, 'bear_atr_max_pct': 0.08056894461627545, 'bear_tp_mult': 1.6246180360861484, 'bear_tsl_mult': 0.6770240723117013, 'bear_time_stop': 242, 'bear_use_sma': False, 'bear_use_ema': True, 'bear_use_atr': False, 'bear_use_adx': False, 'bear_use_spike': True, 'bear_rsi_required': False, 'sideways_strategy': 'breakout', 'sideways_bb_std_mult': 1.371123717499878, 'sideways_rsi_os': 20, 'sideways_rsi_ob': 80, 'sideways_adx_thresh': 12.907820041136077, 'sideways_atr_min_pct': 0.004672267083927931, 'sideways_atr_max_pct': 0.04891866846918309, 'sideways_tp_mult': 1.9610411384448232, 'sideways_tsl_mult': 0.36127452813844746, 'sideways_time_stop': 56, 'sideways_use_sma': False, 'sideways_use_ema': False, 'sideways_use_atr': False, 'sideways_use_adx': True, 'sideways_use_spike': True, 'sideways_rsi_required': True}.
[I 2025-08-31 10:21:02,774] Trial 204 finished with values: [-0.04361805270752428, 0.043452548458966386] and parameters: {'p_sma': 14, 'p_std': 9, 'p_atr': 23, 'p_adx': 17, 'rsi_period': 74, 'ema1': 18, 'ema2': 25, 'slip_atr_k': 0.0870653611538374, 'slip_spread_k': 0.5975403970888489, 'spread_hl_frac': 0.025798371918805782, 'bb_std_mult': 0.7267161934920381, 'rsi_os': 24, 'rsi_ob': 74, 'vol_spike': 0.27196622481197286, 'adx_thresh': 28.729041849077042, 'atr_min_pct': 0.017735922223051242, 'atr_max_pct': 0.09860657973260296, 'tp_mult': 2.4015507143083448, 'tsl_mult': 0.5525860792372669, 'strategy': 'breakout', 'time_stop': 217, 'use_sma': True, 'use_atr': False, 'use_adx': True, 'use_ema': True, 'use_spike': True, 'rsi_required': False, 'edge_k': 0.15805299327904998, 'edge_cap': 0.8649259214241944, 'bull_strategy': 'breakout', 'bull_bb_std_mult': 0.7761239906622576, 'bull_rsi_os': 42, 'bull_rsi_ob': 80, 'bull_adx_thresh': 26.13219218674049, 'bull_atr_min_pct': 0.00015748675611634302, 'bull_atr_max_pct': 0.1291222376137797, 'bull_tp_mult': 1.6666189297564271, 'bull_tsl_mult': 0.4079054420054067, 'bull_time_stop': 100, 'bull_use_sma': True, 'bull_use_ema': True, 'bull_use_atr': True, 'bull_use_adx': False, 'bull_use_spike': True, 'bull_rsi_required': True, 'bear_strategy': 'breakout', 'bear_bb_std_mult': 1.2602299338426426, 'bear_rsi_os': 37, 'bear_rsi_ob': 69, 'bear_adx_thresh': 23.189610163338983, 'bear_atr_min_pct': 0.00326507895935245, 'bear_atr_max_pct': 0.025051433403187218, 'bear_tp_mult': 2.0427112573935573, 'bear_tsl_mult': 0.6655675203040702, 'bear_time_stop': 43, 'bear_use_sma': False, 'bear_use_ema': True, 'bear_use_atr': False, 'bear_use_adx': False, 'bear_use_spike': True, 'bear_rsi_required': False, 'sideways_strategy': 'breakout', 'sideways_bb_std_mult': 2.716530280517462, 'sideways_rsi_os': 28, 'sideways_rsi_ob': 80, 'sideways_adx_thresh': 21.296476014544698, 'sideways_atr_min_pct': 0.004610702851716267, 'sideways_atr_max_pct': 0.03471855755560969, 'sideways_tp_mult': 1.9582982845854664, 'sideways_tsl_mult': 0.5380087549592916, 'sideways_time_stop': 53, 'sideways_use_sma': False, 'sideways_use_ema': False, 'sideways_use_atr': False, 'sideways_use_adx': True, 'sideways_use_spike': True, 'sideways_rsi_required': True}.
