[I 2025-08-31 10:59:17,666] Trial 503 finished with values: [-1000000000.0, 1000000000.0] and parameters: {'p_sma': 16, 'p_std': 48, 'p_atr': 24, 'p_adx': 12, 'rsi_period': 40, 'ema1': 15, 'ema2': 55, 'slip_atr_k': 0.05250280337265842, 'slip_spread_k': 0.6580913404163663, 'spread_hl_frac': 0.01170575877496461, 'bb_std_mult': 1.3001316300950365, 'rsi_os': 16, 'rsi_ob': 79, 'vol_spike': 0.1441701017976731, 'adx_thresh': 27.431414536383166, 'atr_min_pct': 0.005337761805155679, 'atr_max_pct': 0.1055538645990763, 'tp_mult': 1.1314044412473623, 'tsl_mult': 0.286564120898327, 'strategy': 'breakout', 'time_stop': 75, 'use_sma': True, 'use_atr': False, 'use_adx': True, 'use_ema': True, 'use_spike': True, 'rsi_required': True, 'edge_k': 0.6010620886562927, 'edge_cap': 0.42421179633083517, 'bull_strategy': 'breakout', 'bull_bb_std_mult': 0.6559895313156399, 'bull_rsi_os': 18, 'bull_rsi_ob': 74, 'bull_adx_thresh': 12.331776408414024, 'bull_atr_min_pct': 0.02942329201566502, 'bull_atr_max_pct': 0.10078986300895909, 'bull_tp_mult': 1.1208453731915098, 'bull_tsl_mult': 0.3347019623914227, 'bull_time_stop': 125, 'bull_use_sma': True, 'bull_use_ema': False, 'bull_use_atr': False, 'bull_use_adx': False, 'bull_use_spike': False, 'bull_rsi_required': True, 'bear_strategy': 'breakout', 'bear_bb_std_mult': 3.211114145083653, 'bear_rsi_os': 32, 'bear_rsi_ob': 93, 'bear_adx_thresh': 8.975451861387306, 'bear_atr_min_pct': 0.02102720131838945, 'bear_atr_max_pct': 0.1257659619079973, 'bear_tp_mult': 1.3251656057352692, 'bear_tsl_mult': 0.47678667852235646, 'bear_time_stop': 32, 'bear_use_sma': False, 'bear_use_ema': False, 'bear_use_atr': True, 'bear_use_adx': False, 'bear_use_spike': True, 'bear_rsi_required': True, 'sideways_strategy': 'mean_reversion', 'sideways_bb_std_mult': 1.9732244742439966, 'sideways_rsi_os': 7, 'sideways_rsi_ob': 93, 'sideways_adx_thresh': 31.505528860393245, 'sideways_atr_min_pct': 0.02630261958877292, 'sideways_atr_max_pct': 0.03669916831131522, 'sideways_tp_mult': 2.002350567393657, 'sideways_tsl_mult': 0.11270106446424764, 'sideways_time_stop': 107, 'sideways_use_sma': False, 'sideways_use_ema': False, 'sideways_use_atr': True, 'sideways_use_adx': False, 'sideways_use_spike': False, 'sideways_rsi_required': True}.
[I 2025-08-31 10:59:18,167] Trial 504 finished with values: [-1000000000.0, 1000000000.0] and parameters: {'p_sma': 52, 'p_std': 29, 'p_atr': 18, 'p_adx': 15, 'rsi_period': 23, 'ema1': 7, 'ema2': 59, 'slip_atr_k': 0.23325104056553872, 'slip_spread_k': 0.6592840554995971, 'spread_hl_frac': 0.010443434794981946, 'bb_std_mult': 2.462877759806569, 'rsi_os': 9, 'rsi_ob': 75, 'vol_spike': 0.12407615435908902, 'adx_thresh': 5.0022912514538245, 'atr_min_pct': 0.005441930289962706, 'atr_max_pct': 0.05640867018169236, 'tp_mult': 2.9519061118940115, 'tsl_mult': 0.8590498972950824, 'strategy': 'mean_reversion', 'time_stop': 64, 'use_sma': True, 'use_atr': False, 'use_adx': True, 'use_ema': True, 'use_spike': True, 'rsi_required': True, 'edge_k': 0.1577435581701802, 'edge_cap': 0.4680297471943471, 'bull_strategy': 'breakout', 'bull_bb_std_mult': 0.6260560135395926, 'bull_rsi_os': 9, 'bull_rsi_ob': 74, 'bull_adx_thresh': 6.247638337999161, 'bull_atr_min_pct': 0.029664504161992095, 'bull_atr_max_pct': 0.09860705403151727, 'bull_tp_mult': 1.3815668121674642, 'bull_tsl_mult': 0.28300771022791615, 'bull_time_stop': 52, 'bull_use_sma': False, 'bull_use_ema': False, 'bull_use_atr': False, 'bull_use_adx': False, 'bull_use_spike': False, 'bull_rsi_required': True, 'bear_strategy': 'breakout', 'bear_bb_std_mult': 2.577924190426974, 'bear_rsi_os': 14, 'bear_rsi_ob': 93, 'bear_adx_thresh': 7.512313734854697, 'bear_atr_min_pct': 0.00650414542319578, 'bear_atr_max_pct': 0.127240699099311, 'bear_tp_mult': 2.8087622098116913, 'bear_tsl_mult': 0.8598353838962045, 'bear_time_stop': 294, 'bear_use_sma': False, 'bear_use_ema': False, 'bear_use_atr': True, 'bear_use_adx': False, 'bear_use_spike': True, 'bear_rsi_required': True, 'sideways_strategy': 'mean_reversion', 'sideways_bb_std_mult': 1.87354797649486, 'sideways_rsi_os': 52, 'sideways_rsi_ob': 94, 'sideways_adx_thresh': 18.440953937547157, 'sideways_atr_min_pct': 0.009340648024915903, 'sideways_atr_max_pct': 0.08427038214589522, 'sideways_tp_mult': 2.005780133656009, 'sideways_tsl_mult': 0.23669353783729963, 'sideways_time_stop': 148, 'sideways_use_sma': True, 'sideways_use_ema': True, 'sideways_use_atr': True, 'sideways_use_adx': False, 'sideways_use_spike': False, 'sideways_rsi_required': True}.
[I 2025-08-31 10:59:19,428] Trial 506 finished with values: [-1000000000.0, 1000000000.0] and parameters: {'p_sma': 12, 'p_std': 29, 'p_atr': 9, 'p_adx': 15, 'rsi_period': 48, 'ema1': 15, 'ema2': 58, 'slip_atr_k': 0.16223310899935472, 'slip_spread_k': 0.1624637951876748, 'spread_hl_frac': 0.005519749666929155, 'bb_std_mult': 2.789318011321338, 'rsi_os': 9, 'rsi_ob': 79, 'vol_spike': 0.27030160435731326, 'adx_thresh': 18.6100181372122, 'atr_min_pct': 0.005711283829439018, 'atr_max_pct': 0.08773782886353453, 'tp_mult': 2.5602690661708616, 'tsl_mult': 0.8582028320054407, 'strategy': 'breakout', 'time_stop': 294, 'use_sma': True, 'use_atr': False, 'use_adx': True, 'use_ema': True, 'use_spike': True, 'rsi_required': True, 'edge_k': 0.33180145707783826, 'edge_cap': 0.41217936712394876, 'bull_strategy': 'breakout', 'bull_bb_std_mult': 0.7718546315398916, 'bull_rsi_os': 55, 'bull_rsi_ob': 83, 'bull_adx_thresh': 6.623937208118489, 'bull_atr_min_pct': 0.01498311148501151, 'bull_atr_max_pct': 0.12829539538685017, 'bull_tp_mult': 1.3780820987134519, 'bull_tsl_mult': 0.27533596594458154, 'bull_time_stop': 53, 'bull_use_sma': True, 'bull_use_ema': False, 'bull_use_atr': False, 'bull_use_adx': False, 'bull_use_spike': False, 'bull_rsi_required': True, 'bear_strategy': 'breakout', 'bear_bb_std_mult': 2.6262994035934017, 'bear_rsi_os': 7, 'bear_rsi_ob': 94, 'bear_adx_thresh': 26.42559254867549, 'bear_atr_min_pct': 0.009892785532636027, 'bear_atr_max_pct': 0.10705143593249292, 'bear_tp_mult': 1.5481276902724868, 'bear_tsl_mult': 0.5373900010229057, 'bear_time_stop': 34, 'bear_use_sma': True, 'bear_use_ema': False, 'bear_use_atr': True, 'bear_use_adx': False, 'bear_use_spike': True, 'bear_rsi_required': True, 'sideways_strategy': 'mean_reversion', 'sideways_bb_std_mult': 1.0812820487984593, 'sideways_rsi_os': 5, 'sideways_rsi_ob': 91, 'sideways_adx_thresh': 5.808869806547989, 'sideways_atr_min_pct': 0.01932371352603053, 'sideways_atr_max_pct': 0.03703461024477393, 'sideways_tp_mult': 2.0201928469836306, 'sideways_tsl_mult': 0.11260071583303345, 'sideways_time_stop': 261, 'sideways_use_sma': False, 'sideways_use_ema': False, 'sideways_use_atr': True, 'sideways_use_adx': False, 'sideways_use_spike': False, 'sideways_rsi_required': True}.
[I 2025-08-31 10:59:50,632] Trial 509 finished with values: [-1000000000.0, 1000000000.0] and parameters: {'p_sma': 12, 'p_std': 32, 'p_atr': 10, 'p_adx': 14, 'rsi_period': 48, 'ema1': 9, 'ema2': 56, 'slip_atr_k': 0.02796604178322932, 'slip_spread_k': 0.6160921188911146, 'spread_hl_frac': 0.006598155244570386, 'bb_std_mult': 2.766996220428334, 'rsi_os': 28, 'rsi_ob': 78, 'vol_spike': 0.2649640815054455, 'adx_thresh': 7.5805128803391835, 'atr_min_pct': 0.00839085664416699, 'atr_max_pct': 0.1017480461310685, 'tp_mult': 1.4076610379804508, 'tsl_mult': 0.1707302657333407, 'strategy': 'breakout', 'time_stop': 98, 'use_sma': True, 'use_atr': False, 'use_adx': True, 'use_ema': True, 'use_spike': True, 'rsi_required': True, 'edge_k': 0.31180377262624814, 'edge_cap': 0.9810000643442867, 'bull_strategy': 'mean_reversion', 'bull_bb_std_mult': 0.7639404426052306, 'bull_rsi_os': 31, 'bull_rsi_ob': 76, 'bull_adx_thresh': 5.119324573040926, 'bull_atr_min_pct': 0.01085817998919226, 'bull_atr_max_pct': 0.08965442048799839, 'bull_tp_mult': 1.7131403792623656, 'bull_tsl_mult': 0.39780880868235474, 'bull_time_stop': 79, 'bull_use_sma': True, 'bull_use_ema': False, 'bull_use_atr': False, 'bull_use_adx': False, 'bull_use_spike': False, 'bull_rsi_required': True, 'bear_strategy': 'breakout', 'bear_bb_std_mult': 1.4152204866324143, 'bear_rsi_os': 40, 'bear_rsi_ob': 75, 'bear_adx_thresh': 33.527603902715576, 'bear_atr_min_pct': 0.007039178772947733, 'bear_atr_max_pct': 0.10596224274137031, 'bear_tp_mult': 2.181934045430412, 'bear_tsl_mult': 0.5318168973278447, 'bear_time_stop': 43, 'bear_use_sma': True, 'bear_use_ema': True, 'bear_use_atr': False, 'bear_use_adx': False, 'bear_use_spike': False, 'bear_rsi_required': False, 'sideways_strategy': 'mean_reversion', 'sideways_bb_std_mult': 2.898449978176747, 'sideways_rsi_os': 5, 'sideways_rsi_ob': 88, 'sideways_adx_thresh': 24.298506547852565, 'sideways_atr_min_pct': 0.0198569740370473, 'sideways_atr_max_pct': 0.0609027100515871, 'sideways_tp_mult': 1.8943179239259502, 'sideways_tsl_mult': 0.1213709674074575, 'sideways_time_stop': 61, 'sideways_use_sma': False, 'sideways_use_ema': False, 'sideways_use_atr': False, 'sideways_use_adx': False, 'sideways_use_spike': False, 'sideways_rsi_required': True}.
[I 2025-08-31 10:59:50,845] Trial 510 finished with values: [-1000000000.0, 1000000000.0] and parameters: {'p_sma': 58, 'p_std': 59, 'p_atr': 10, 'p_adx': 14, 'rsi_period': 44, 'ema1': 26, 'ema2': 34, 'slip_atr_k': 0.1430147017352317, 'slip_spread_k': 0.24000260790944072, 'spread_hl_frac': 0.009446419845603226, 'bb_std_mult': 2.6891966438743697, 'rsi_os': 20, 'rsi_ob': 78, 'vol_spike': 0.24833797594036044, 'adx_thresh': 29.841197899203785, 'atr_min_pct': 0.008410669531598584, 'atr_max_pct': 0.10141011526335905, 'tp_mult': 1.3965094254011738, 'tsl_mult': 0.7644299659011649, 'strategy': 'breakout', 'time_stop': 97, 'use_sma': True, 'use_atr': False, 'use_adx': True, 'use_ema': True, 'use_spike': False, 'rsi_required': True, 'edge_k': 0.2879028973067512, 'edge_cap': 0.6217300411413805, 'bull_strategy': 'mean_reversion', 'bull_bb_std_mult': 1.8357249133411973, 'bull_rsi_os': 48, 'bull_rsi_ob': 75, 'bull_adx_thresh': 30.35080326702737, 'bull_atr_min_pct': 0.02570462125936751, 'bull_atr_max_pct': 0.08585444262247632, 'bull_tp_mult': 1.7564848467621885, 'bull_tsl_mult': 0.15854835521461835, 'bull_time_stop': 81, 'bull_use_sma': True, 'bull_use_ema': False, 'bull_use_atr': False, 'bull_use_adx': False, 'bull_use_spike': False, 'bull_rsi_required': True, 'bear_strategy': 'breakout', 'bear_bb_std_mult': 1.517243605610429, 'bear_rsi_os': 27, 'bear_rsi_ob': 64, 'bear_adx_thresh': 6.384826084476225, 'bear_atr_min_pct': 0.028434149788822742, 'bear_atr_max_pct': 0.024195267793789714, 'bear_tp_mult': 2.9459630512936745, 'bear_tsl_mult': 0.7767354218005136, 'bear_time_stop': 41, 'bear_use_sma': True, 'bear_use_ema': True, 'bear_use_atr': False, 'bear_use_adx': False, 'bear_use_spike': False, 'bear_rsi_required': False, 'sideways_strategy': 'mean_reversion', 'sideways_bb_std_mult': 1.6633561908511458, 'sideways_rsi_os': 5, 'sideways_rsi_ob': 88, 'sideways_adx_thresh': 34.80569350317479, 'sideways_atr_min_pct': 0.018511773718124416, 'sideways_atr_max_pct': 0.02315434885026543, 'sideways_tp_mult': 2.622175013569354, 'sideways_tsl_mult': 0.06765751798869812, 'sideways_time_stop': 6, 'sideways_use_sma': False, 'sideways_use_ema': False, 'sideways_use_atr': False, 'sideways_use_adx': False, 'sideways_use_spike': False, 'sideways_rsi_required': False}.
[I 2025-08-31 10:59:50,962] Trial 507 finished with values: [-1000000000.0, 1000000000.0] and parameters: {'p_sma': 52, 'p_std': 36, 'p_atr': 24, 'p_adx': 15, 'rsi_period': 51, 'ema1': 9, 'ema2': 59, 'slip_atr_k': 0.02976636052520787, 'slip_spread_k': 0.2978612274489456, 'spread_hl_frac': 0.006334157742076529, 'bb_std_mult': 2.790056675768212, 'rsi_os': 28, 'rsi_ob': 75, 'vol_spike': 0.27111745297496115, 'adx_thresh': 27.45921170348613, 'atr_min_pct': 0.005847160641890959, 'atr_max_pct': 0.10079994904061139, 'tp_mult': 1.4019605166332392, 'tsl_mult': 0.17716368868707605, 'strategy': 'breakout', 'time_stop': 76, 'use_sma': True, 'use_atr': False, 'use_adx': True, 'use_ema': True, 'use_spike': True, 'rsi_required': True, 'edge_k': 0.30250008479301094, 'edge_cap': 0.40393703152218835, 'bull_strategy': 'breakout', 'bull_bb_std_mult': 2.3884637529408126, 'bull_rsi_os': 33, 'bull_rsi_ob': 75, 'bull_adx_thresh': 6.397885495109446, 'bull_atr_min_pct': 0.011892527925483261, 'bull_atr_max_pct': 0.08528391220400786, 'bull_tp_mult': 1.3752246089281313, 'bull_tsl_mult': 0.39592566457160544, 'bull_time_stop': 79, 'bull_use_sma': True, 'bull_use_ema': False, 'bull_use_atr': False, 'bull_use_adx': False, 'bull_use_spike': False, 'bull_rsi_required': True, 'bear_strategy': 'breakout', 'bear_bb_std_mult': 1.4625725036466672, 'bear_rsi_os': 13, 'bear_rsi_ob': 83, 'bear_adx_thresh': 6.351050328406264, 'bear_atr_min_pct': 0.011883406505466515, 'bear_atr_max_pct': 0.12730978157060857, 'bear_tp_mult': 1.9600848442134307, 'bear_tsl_mult': 0.5348826272284009, 'bear_time_stop': 293, 'bear_use_sma': True, 'bear_use_ema': True, 'bear_use_atr': False, 'bear_use_adx': False, 'bear_use_spike': True, 'bear_rsi_required': False, 'sideways_strategy': 'mean_reversion', 'sideways_bb_std_mult': 1.0350815381235807, 'sideways_rsi_os': 39, 'sideways_rsi_ob': 75, 'sideways_adx_thresh': 18.34526064639457, 'sideways_atr_min_pct': 0.008606367047146912, 'sideways_atr_max_pct': 0.023037271183868266, 'sideways_tp_mult': 2.010362972170059, 'sideways_tsl_mult': 0.11844408202316672, 'sideways_time_stop': 14, 'sideways_use_sma': False, 'sideways_use_ema': False, 'sideways_use_atr': False, 'sideways_use_adx': False, 'sideways_use_spike': False, 'sideways_rsi_required': True}.
[I 2025-08-31 10:59:51,353] Trial 508 finished with values: [-1000000000.0, 1000000000.0] and parameters: {'p_sma': 12, 'p_std': 32, 'p_atr': 10, 'p_adx': 25, 'rsi_period': 81, 'ema1': 28, 'ema2': 34, 'slip_atr_k': 0.07840276152577597, 'slip_spread_k': 0.1663501074465678, 'spread_hl_frac': 0.006267624410724269, 'bb_std_mult': 2.471516067312508, 'rsi_os': 20, 'rsi_ob': 75, 'vol_spike': 0.2700547191910594, 'adx_thresh': 7.647362336557846, 'atr_min_pct': 0.005973064394592359, 'atr_max_pct': 0.08794661356123834, 'tp_mult': 1.5473789901329176, 'tsl_mult': 0.22897718861922045, 'strategy': 'breakout', 'time_stop': 293, 'use_sma': True, 'use_atr': False, 'use_adx': True, 'use_ema': True, 'use_spike': True, 'rsi_required': True, 'edge_k': 1.3771372560612976, 'edge_cap': 0.46452711529814655, 'bull_strategy': 'mean_reversion', 'bull_bb_std_mult': 3.4535391245392555, 'bull_rsi_os': 9, 'bull_rsi_ob': 86, 'bull_adx_thresh': 6.417327185505492, 'bull_atr_min_pct': 0.025944950880596604, 'bull_atr_max_pct': 0.08513120424374772, 'bull_tp_mult': 1.3730374780646701, 'bull_tsl_mult': 0.9984276140463291, 'bull_time_stop': 80, 'bull_use_sma': True, 'bull_use_ema': False, 'bull_use_atr': False, 'bull_use_adx': False, 'bull_use_spike': False, 'bull_rsi_required': True, 'bear_strategy': 'breakout', 'bear_bb_std_mult': 1.4411717846625849, 'bear_rsi_os': 14, 'bear_rsi_ob': 64, 'bear_adx_thresh': 6.2949564501843716, 'bear_atr_min_pct': 0.009660816994135357, 'bear_atr_max_pct': 0.04409793137588269, 'bear_tp_mult': 2.167188877435596, 'bear_tsl_mult': 0.634689041507634, 'bear_time_stop': 40, 'bear_use_sma': True, 'bear_use_ema': True, 'bear_use_atr': False, 'bear_use_adx': False, 'bear_use_spike': True, 'bear_rsi_required': False, 'sideways_strategy': 'mean_reversion', 'sideways_bb_std_mult': 1.0417736041493273, 'sideways_rsi_os': 5, 'sideways_rsi_ob': 89, 'sideways_adx_thresh': 18.461776555718835, 'sideways_atr_min_pct': 0.019410018219191943, 'sideways_atr_max_pct': 0.08008295895560247, 'sideways_tp_mult': 2.032478988755264, 'sideways_tsl_mult': 0.11757639537831074, 'sideways_time_stop': 6, 'sideways_use_sma': False, 'sideways_use_ema': True, 'sideways_use_atr': False, 'sideways_use_adx': False, 'sideways_use_spike': False, 'sideways_rsi_required': True}.
[I 2025-08-31 11:00:23,286] Trial 511 finished with values: [-1000000000.0, 1000000000.0] and parameters: {'p_sma': 19, 'p_std': 23, 'p_atr': 27, 'p_adx': 25, 'rsi_period': 33, 'ema1': 26, 'ema2': 10, 'slip_atr_k': 0.004502356414835484, 'slip_spread_k': 0.296834403407099, 'spread_hl_frac': 0.002615063771731256, 'bb_std_mult': 1.9543015343872412, 'rsi_os': 27, 'rsi_ob': 66, 'vol_spike': 0.24821349723737046, 'adx_thresh': 29.920162120063715, 'atr_min_pct': 0.006295964858435559, 'atr_max_pct': 0.12749805063700037, 'tp_mult': 2.105354861725754, 'tsl_mult': 0.9005004454093603, 'strategy': 'breakout', 'time_stop': 145, 'use_sma': False, 'use_atr': False, 'use_adx': True, 'use_ema': True, 'use_spike': False, 'rsi_required': True, 'edge_k': 0.003928535025005675, 'edge_cap': 0.39973519985675937, 'bull_strategy': 'breakout', 'bull_bb_std_mult': 2.5915351779310773, 'bull_rsi_os': 10, 'bull_rsi_ob': 72, 'bull_adx_thresh': 13.882846882058706, 'bull_atr_min_pct': 0.01823593079493274, 'bull_atr_max_pct': 0.06485479177074142, 'bull_tp_mult': 1.8612744387952278, 'bull_tsl_mult': 0.55494503892956, 'bull_time_stop': 91, 'bull_use_sma': True, 'bull_use_ema': False, 'bull_use_atr': False, 'bull_use_adx': True, 'bull_use_spike': False, 'bull_rsi_required': True, 'bear_strategy': 'breakout', 'bear_bb_std_mult': 2.1927390133405855, 'bear_rsi_os': 39, 'bear_rsi_ob': 64, 'bear_adx_thresh': 6.332351198320023, 'bear_atr_min_pct': 0.005053876658257216, 'bear_atr_max_pct': 0.1472086263083739, 'bear_tp_mult': 1.9529915920049434, 'bear_tsl_mult': 0.10825273332603075, 'bear_time_stop': 26, 'bear_use_sma': False, 'bear_use_ema': True, 'bear_use_atr': False, 'bear_use_adx': False, 'bear_use_spike': True, 'bear_rsi_required': False, 'sideways_strategy': 'mean_reversion', 'sideways_bb_std_mult': 1.6819678307456578, 'sideways_rsi_os': 44, 'sideways_rsi_ob': 69, 'sideways_adx_thresh': 27.255782500274172, 'sideways_atr_min_pct': 0.018310694971771686, 'sideways_atr_max_pct': 0.023280927356777205, 'sideways_tp_mult': 1.9675759660408714, 'sideways_tsl_mult': 0.9124226730725367, 'sideways_time_stop': 9, 'sideways_use_sma': False, 'sideways_use_ema': False, 'sideways_use_atr': False, 'sideways_use_adx': False, 'sideways_use_spike': False, 'sideways_rsi_required': False}.
[I 2025-08-31 11:00:23,548] Trial 514 finished with values: [-1000000000.0, 1000000000.0] and parameters: {'p_sma': 19, 'p_std': 22, 'p_atr': 26, 'p_adx': 13, 'rsi_period': 75, 'ema1': 12, 'ema2': 10, 'slip_atr_k': 0.21880181509862756, 'slip_spread_k': 0.4840260519519733, 'spread_hl_frac': 0.02603181195621273, 'bb_std_mult': 2.997373193317455, 'rsi_os': 5, 'rsi_ob': 64, 'vol_spike': 0.26084745630889333, 'adx_thresh': 33.245287923108556, 'atr_min_pct': 0.01270672606807461, 'atr_max_pct': 0.12836375666644007, 'tp_mult': 2.434228891135548, 'tsl_mult': 0.03805321169305215, 'strategy': 'mean_reversion', 'time_stop': 141, 'use_sma': False, 'use_atr': False, 'use_adx': True, 'use_ema': True, 'use_spike': False, 'rsi_required': True, 'edge_k': 0.2054892016978811, 'edge_cap': 0.357729691324892, 'bull_strategy': 'breakout', 'bull_bb_std_mult': 0.7078910584371562, 'bull_rsi_os': 11, 'bull_rsi_ob': 72, 'bull_adx_thresh': 14.023130377105984, 'bull_atr_min_pct': 0.02103000804602031, 'bull_atr_max_pct': 0.09320057288054229, 'bull_tp_mult': 2.439219554700413, 'bull_tsl_mult': 0.6020796670602108, 'bull_time_stop': 91, 'bull_use_sma': False, 'bull_use_ema': False, 'bull_use_atr': False, 'bull_use_adx': True, 'bull_use_spike': False, 'bull_rsi_required': True, 'bear_strategy': 'breakout', 'bear_bb_std_mult': 3.3882829393113507, 'bear_rsi_os': 38, 'bear_rsi_ob': 90, 'bear_adx_thresh': 5.547002421974797, 'bear_atr_min_pct': 0.005244601701453999, 'bear_atr_max_pct': 0.1447443189304579, 'bear_tp_mult': 2.77235092111433, 'bear_tsl_mult': 0.7199756550964833, 'bear_time_stop': 153, 'bear_use_sma': False, 'bear_use_ema': True, 'bear_use_atr': False, 'bear_use_adx': False, 'bear_use_spike': True, 'bear_rsi_required': False, 'sideways_strategy': 'mean_reversion', 'sideways_bb_std_mult': 2.7872031905278805, 'sideways_rsi_os': 44, 'sideways_rsi_ob': 91, 'sideways_adx_thresh': 27.564913650816056, 'sideways_atr_min_pct': 0.017051135707456123, 'sideways_atr_max_pct': 0.1314053431828989, 'sideways_tp_mult': 1.9709889893013777, 'sideways_tsl_mult': 0.1382939020476082, 'sideways_time_stop': 68, 'sideways_use_sma': True, 'sideways_use_ema': False, 'sideways_use_atr': False, 'sideways_use_adx': False, 'sideways_use_spike': False, 'sideways_rsi_required': False}.
