[I 2025-08-31 11:17:20,184] Trial 641 finished with values: [-0.01945831389077357, 0.020373096213087163] and parameters: {'p_sma': 49, 'p_std': 8, 'p_atr': 13, 'p_adx': 14, 'rsi_period': 48, 'ema1': 6, 'ema2': 48, 'slip_atr_k': 0.024932953925277754, 'slip_spread_k': 0.619982336822936, 'spread_hl_frac': 0.02404978354266073, 'bb_std_mult': 2.120736300118092, 'rsi_os': 23, 'rsi_ob': 45, 'vol_spike': 0.2476212706793181, 'adx_thresh': 14.691771887341353, 'atr_min_pct': 0.005546480762859454, 'atr_max_pct': 0.014607074593637442, 'tp_mult': 2.4507569825903044, 'tsl_mult': 0.733203742366949, 'strategy': 'breakout', 'time_stop': 76, 'use_sma': True, 'use_atr': False, 'use_adx': True, 'use_ema': False, 'use_spike': True, 'rsi_required': True, 'edge_k': 1.9321991210845462, 'edge_cap': 0.46011808550290056, 'bull_strategy': 'breakout', 'bull_bb_std_mult': 0.652932016397695, 'bull_rsi_os': 53, 'bull_rsi_ob': 75, 'bull_adx_thresh': 7.329820913548145, 'bull_atr_min_pct': 0.0038978391706549673, 'bull_atr_max_pct': 0.09033955819107503, 'bull_tp_mult': 1.9407388693015573, 'bull_tsl_mult': 0.6673259243349277, 'bull_time_stop': 219, 'bull_use_sma': True, 'bull_use_ema': False, 'bull_use_atr': False, 'bull_use_adx': False, 'bull_use_spike': False, 'bull_rsi_required': True, 'bear_strategy': 'breakout', 'bear_bb_std_mult': 3.5775661234242815, 'bear_rsi_os': 41, 'bear_rsi_ob': 79, 'bear_adx_thresh': 6.643634586138271, 'bear_atr_min_pct': 0.00621593125368597, 'bear_atr_max_pct': 0.13226868526770802, 'bear_tp_mult': 2.657045839246049, 'bear_tsl_mult': 0.8317734851633511, 'bear_time_stop': 34, 'bear_use_sma': False, 'bear_use_ema': False, 'bear_use_atr': False, 'bear_use_adx': True, 'bear_use_spike': True, 'bear_rsi_required': True, 'sideways_strategy': 'mean_reversion', 'sideways_bb_std_mult': 3.129861463287965, 'sideways_rsi_os': 7, 'sideways_rsi_ob': 92, 'sideways_adx_thresh': 24.398543879978895, 'sideways_atr_min_pct': 0.0072020323336713914, 'sideways_atr_max_pct': 0.04132500365107764, 'sideways_tp_mult': 2.850172452624263, 'sideways_tsl_mult': 0.10874419334143204, 'sideways_time_stop': 180, 'sideways_use_sma': False, 'sideways_use_ema': False, 'sideways_use_atr': True, 'sideways_use_adx': False, 'sideways_use_spike': False, 'sideways_rsi_required': True}.
[I 2025-08-31 11:17:20,571] Trial 642 finished with values: [-1000000000.0, 1000000000.0] and parameters: {'p_sma': 15, 'p_std': 37, 'p_atr': 7, 'p_adx': 12, 'rsi_period': 48, 'ema1': 13, 'ema2': 58, 'slip_atr_k': 0.04125636004734021, 'slip_spread_k': 0.6717725420461003, 'spread_hl_frac': 0.01157641699284518, 'bb_std_mult': 2.706099358352677, 'rsi_os': 22, 'rsi_ob': 45, 'vol_spike': 0.28600423907524003, 'adx_thresh': 27.009796225484713, 'atr_min_pct': 0.005581358318774893, 'atr_max_pct': 0.09351521551575616, 'tp_mult': 2.878890208251984, 'tsl_mult': 0.8449323889692711, 'strategy': 'breakout', 'time_stop': 76, 'use_sma': False, 'use_atr': False, 'use_adx': True, 'use_ema': False, 'use_spike': True, 'rsi_required': True, 'edge_k': 0.9271354308513803, 'edge_cap': 0.46211561307255206, 'bull_strategy': 'breakout', 'bull_bb_std_mult': 2.3774632224456504, 'bull_rsi_os': 28, 'bull_rsi_ob': 75, 'bull_adx_thresh': 7.402567109785966, 'bull_atr_min_pct': 0.003810403258222518, 'bull_atr_max_pct': 0.08861712116205908, 'bull_tp_mult': 2.8209351554177235, 'bull_tsl_mult': 0.3885770436978327, 'bull_time_stop': 74, 'bull_use_sma': False, 'bull_use_ema': False, 'bull_use_atr': False, 'bull_use_adx': False, 'bull_use_spike': False, 'bull_rsi_required': True, 'bear_strategy': 'mean_reversion', 'bear_bb_std_mult': 1.7997998794154888, 'bear_rsi_os': 32, 'bear_rsi_ob': 82, 'bear_adx_thresh': 6.570256958024598, 'bear_atr_min_pct': 0.011437744671056472, 'bear_atr_max_pct': 0.06930708843911886, 'bear_tp_mult': 2.648404760217562, 'bear_tsl_mult': 0.46351550197329716, 'bear_time_stop': 173, 'bear_use_sma': False, 'bear_use_ema': False, 'bear_use_atr': False, 'bear_use_adx': True, 'bear_use_spike': False, 'bear_rsi_required': True, 'sideways_strategy': 'mean_reversion', 'sideways_bb_std_mult': 2.8698076077384465, 'sideways_rsi_os': 7, 'sideways_rsi_ob': 92, 'sideways_adx_thresh': 24.826718590454377, 'sideways_atr_min_pct': 0.01668651667251344, 'sideways_atr_max_pct': 0.04158868300755273, 'sideways_tp_mult': 1.9367166919955436, 'sideways_tsl_mult': 0.10578198926011195, 'sideways_time_stop': 25, 'sideways_use_sma': False, 'sideways_use_ema': False, 'sideways_use_atr': True, 'sideways_use_adx': False, 'sideways_use_spike': False, 'sideways_rsi_required': True}.
[I 2025-08-31 11:17:20,742] Trial 639 finished with values: [-1000000000.0, 1000000000.0] and parameters: {'p_sma': 57, 'p_std': 6, 'p_atr': 13, 'p_adx': 13, 'rsi_period': 44, 'ema1': 13, 'ema2': 19, 'slip_atr_k': 0.22868630092660175, 'slip_spread_k': 0.8858936776840619, 'spread_hl_frac': 0.008884609398139273, 'bb_std_mult': 2.6704488140090246, 'rsi_os': 28, 'rsi_ob': 50, 'vol_spike': 0.2738712427314079, 'adx_thresh': 26.823316825615915, 'atr_min_pct': 0.020954578605359403, 'atr_max_pct': 0.10562192042256499, 'tp_mult': 2.2877336800117183, 'tsl_mult': 0.8410220641903999, 'strategy': 'breakout', 'time_stop': 66, 'use_sma': True, 'use_atr': False, 'use_adx': True, 'use_ema': False, 'use_spike': True, 'rsi_required': True, 'edge_k': 0.29121402988599643, 'edge_cap': 0.46319472367268316, 'bull_strategy': 'breakout', 'bull_bb_std_mult': 0.9235765137370431, 'bull_rsi_os': 18, 'bull_rsi_ob': 53, 'bull_adx_thresh': 8.27078692993623, 'bull_atr_min_pct': 0.0038732940962774715, 'bull_atr_max_pct': 0.013374205839967082, 'bull_tp_mult': 1.6650694260233445, 'bull_tsl_mult': 0.8737017627763455, 'bull_time_stop': 165, 'bull_use_sma': True, 'bull_use_ema': False, 'bull_use_atr': False, 'bull_use_adx': False, 'bull_use_spike': False, 'bull_rsi_required': False, 'bear_strategy': 'breakout', 'bear_bb_std_mult': 2.6955255548086967, 'bear_rsi_os': 41, 'bear_rsi_ob': 79, 'bear_adx_thresh': 5.95044745351739, 'bear_atr_min_pct': 0.01515550926579375, 'bear_atr_max_pct': 0.10654777368590879, 'bear_tp_mult': 2.94132783638511, 'bear_tsl_mult': 0.3000160855977538, 'bear_time_stop': 33, 'bear_use_sma': False, 'bear_use_ema': False, 'bear_use_atr': False, 'bear_use_adx': True, 'bear_use_spike': True, 'bear_rsi_required': True, 'sideways_strategy': 'mean_reversion', 'sideways_bb_std_mult': 2.7154258579785853, 'sideways_rsi_os': 7, 'sideways_rsi_ob': 59, 'sideways_adx_thresh': 24.63689692736806, 'sideways_atr_min_pct': 0.016799185248546938, 'sideways_atr_max_pct': 0.04113610728263119, 'sideways_tp_mult': 2.3179276591477125, 'sideways_tsl_mult': 0.824705621931392, 'sideways_time_stop': 21, 'sideways_use_sma': False, 'sideways_use_ema': False, 'sideways_use_atr': False, 'sideways_use_adx': False, 'sideways_use_spike': False, 'sideways_rsi_required': True}.
[I 2025-08-31 11:17:20,815] Trial 640 finished with values: [-0.021325727945404993, 0.022539497969844047] and parameters: {'p_sma': 30, 'p_std': 10, 'p_atr': 13, 'p_adx': 13, 'rsi_period': 44, 'ema1': 13, 'ema2': 35, 'slip_atr_k': 0.02519389576164602, 'slip_spread_k': 0.6217828897437109, 'spread_hl_frac': 0.04616204142312212, 'bb_std_mult': 2.694251474635832, 'rsi_os': 50, 'rsi_ob': 78, 'vol_spike': 0.14205234833406244, 'adx_thresh': 26.904499604023492, 'atr_min_pct': 0.02089648586442691, 'atr_max_pct': 0.02205328627072571, 'tp_mult': 2.2846803494940002, 'tsl_mult': 0.27946513216616237, 'strategy': 'breakout', 'time_stop': 65, 'use_sma': True, 'use_atr': False, 'use_adx': True, 'use_ema': False, 'use_spike': True, 'rsi_required': True, 'edge_k': 0.045631418985975, 'edge_cap': 0.4686084089309864, 'bull_strategy': 'breakout', 'bull_bb_std_mult': 1.6280870270940886, 'bull_rsi_os': 18, 'bull_rsi_ob': 75, 'bull_adx_thresh': 8.22419734835589, 'bull_atr_min_pct': 0.004011612685009571, 'bull_atr_max_pct': 0.032092288085754934, 'bull_tp_mult': 1.9496862628791833, 'bull_tsl_mult': 0.8716498666451045, 'bull_time_stop': 166, 'bull_use_sma': True, 'bull_use_ema': False, 'bull_use_atr': False, 'bull_use_adx': False, 'bull_use_spike': False, 'bull_rsi_required': False, 'bear_strategy': 'breakout', 'bear_bb_std_mult': 2.6974401580996936, 'bear_rsi_os': 40, 'bear_rsi_ob': 80, 'bear_adx_thresh': 30.919133890021097, 'bear_atr_min_pct': 0.004785120168291872, 'bear_atr_max_pct': 0.10878279046053531, 'bear_tp_mult': 1.342331242961571, 'bear_tsl_mult': 0.4846212886299243, 'bear_time_stop': 236, 'bear_use_sma': False, 'bear_use_ema': False, 'bear_use_atr': False, 'bear_use_adx': True, 'bear_use_spike': True, 'bear_rsi_required': False, 'sideways_strategy': 'mean_reversion', 'sideways_bb_std_mult': 1.3635176063722065, 'sideways_rsi_os': 7, 'sideways_rsi_ob': 92, 'sideways_adx_thresh': 25.51412228030787, 'sideways_atr_min_pct': 0.01657782562165853, 'sideways_atr_max_pct': 0.03963646623891044, 'sideways_tp_mult': 2.6982976386206117, 'sideways_tsl_mult': 0.8349549796427977, 'sideways_time_stop': 21, 'sideways_use_sma': False, 'sideways_use_ema': False, 'sideways_use_atr': False, 'sideways_use_adx': False, 'sideways_use_spike': False, 'sideways_rsi_required': True}.
[I 2025-08-31 11:17:52,596] Trial 643 finished with values: [-1000000000.0, 1000000000.0] and parameters: {'p_sma': 15, 'p_std': 6, 'p_atr': 12, 'p_adx': 15, 'rsi_period': 47, 'ema1': 12, 'ema2': 58, 'slip_atr_k': 0.10764641242261691, 'slip_spread_k': 0.19938652209944652, 'spread_hl_frac': 0.01180304738004286, 'bb_std_mult': 1.3563118457947865, 'rsi_os': 30, 'rsi_ob': 50, 'vol_spike': 0.2730379538328935, 'adx_thresh': 27.029420768351873, 'atr_min_pct': 0.020945497871310642, 'atr_max_pct': 0.0930966346906194, 'tp_mult': 2.4081751649937746, 'tsl_mult': 0.2356855373632777, 'strategy': 'breakout', 'time_stop': 160, 'use_sma': False, 'use_atr': False, 'use_adx': True, 'use_ema': True, 'use_spike': True, 'rsi_required': True, 'edge_k': 0.10921103102149214, 'edge_cap': 0.4658200125828417, 'bull_strategy': 'breakout', 'bull_bb_std_mult': 2.361438669167086, 'bull_rsi_os': 23, 'bull_rsi_ob': 56, 'bull_adx_thresh': 7.9261617205289365, 'bull_atr_min_pct': 0.003442708044159239, 'bull_atr_max_pct': 0.03386282628209798, 'bull_tp_mult': 1.6592134064268187, 'bull_tsl_mult': 0.18747083962157074, 'bull_time_stop': 34, 'bull_use_sma': False, 'bull_use_ema': True, 'bull_use_atr': False, 'bull_use_adx': True, 'bull_use_spike': False, 'bull_rsi_required': True, 'bear_strategy': 'mean_reversion', 'bear_bb_std_mult': 1.7787915794872764, 'bear_rsi_os': 40, 'bear_rsi_ob': 82, 'bear_adx_thresh': 7.453193005786638, 'bear_atr_min_pct': 0.015325751011328565, 'bear_atr_max_pct': 0.14391465568123643, 'bear_tp_mult': 2.9285758107133715, 'bear_tsl_mult': 0.5248491158146615, 'bear_time_stop': 62, 'bear_use_sma': False, 'bear_use_ema': True, 'bear_use_atr': False, 'bear_use_adx': False, 'bear_use_spike': False, 'bear_rsi_required': False, 'sideways_strategy': 'mean_reversion', 'sideways_bb_std_mult': 2.8566093548817117, 'sideways_rsi_os': 7, 'sideways_rsi_ob': 92, 'sideways_adx_thresh': 30.296710013603512, 'sideways_atr_min_pct': 0.018273898107444654, 'sideways_atr_max_pct': 0.03806122362298097, 'sideways_tp_mult': 1.867599687014113, 'sideways_tsl_mult': 0.9462388285569501, 'sideways_time_stop': 22, 'sideways_use_sma': False, 'sideways_use_ema': False, 'sideways_use_atr': False, 'sideways_use_adx': False, 'sideways_use_spike': False, 'sideways_rsi_required': True}.
[I 2025-08-31 11:17:52,881] Trial 644 finished with values: [-1000000000.0, 1000000000.0] and parameters: {'p_sma': 17, 'p_std': 30, 'p_atr': 21, 'p_adx': 29, 'rsi_period': 44, 'ema1': 12, 'ema2': 53, 'slip_atr_k': 0.028256148999401726, 'slip_spread_k': 0.7293064685153425, 'spread_hl_frac': 0.04599374569944756, 'bb_std_mult': 0.9982646695298019, 'rsi_os': 53, 'rsi_ob': 78, 'vol_spike': 0.27438931264646677, 'adx_thresh': 19.25466319144476, 'atr_min_pct': 0.0064264757341800025, 'atr_max_pct': 0.11373622922382429, 'tp_mult': 2.4243909940019552, 'tsl_mult': 0.7946883804665936, 'strategy': 'breakout', 'time_stop': 199, 'use_sma': True, 'use_atr': False, 'use_adx': True, 'use_ema': True, 'use_spike': True, 'rsi_required': True, 'edge_k': 0.05855655706702159, 'edge_cap': 0.42653013281202257, 'bull_strategy': 'breakout', 'bull_bb_std_mult': 2.5298188298064805, 'bull_rsi_os': 23, 'bull_rsi_ob': 56, 'bull_adx_thresh': 33.618414910483196, 'bull_atr_min_pct': 0.0033411385804075168, 'bull_atr_max_pct': 0.07462398650220067, 'bull_tp_mult': 1.6725876311303232, 'bull_tsl_mult': 0.19411240136618096, 'bull_time_stop': 275, 'bull_use_sma': True, 'bull_use_ema': True, 'bull_use_atr': False, 'bull_use_adx': True, 'bull_use_spike': True, 'bull_rsi_required': True, 'bear_strategy': 'breakout', 'bear_bb_std_mult': 2.838720147206416, 'bear_rsi_os': 51, 'bear_rsi_ob': 77, 'bear_adx_thresh': 29.007517903941515, 'bear_atr_min_pct': 0.004582090353069296, 'bear_atr_max_pct': 0.14528729678179475, 'bear_tp_mult': 2.941709763046547, 'bear_tsl_mult': 0.4916766742820195, 'bear_time_stop': 238, 'bear_use_sma': False, 'bear_use_ema': True, 'bear_use_atr': False, 'bear_use_adx': False, 'bear_use_spike': True, 'bear_rsi_required': False, 'sideways_strategy': 'breakout', 'sideways_bb_std_mult': 2.9633050471057247, 'sideways_rsi_os': 40, 'sideways_rsi_ob': 91, 'sideways_adx_thresh': 30.269017735426623, 'sideways_atr_min_pct': 0.018452136468927773, 'sideways_atr_max_pct': 0.03729910133089832, 'sideways_tp_mult': 2.3224810372465923, 'sideways_tsl_mult': 0.04341560829141257, 'sideways_time_stop': 96, 'sideways_use_sma': False, 'sideways_use_ema': False, 'sideways_use_atr': False, 'sideways_use_adx': False, 'sideways_use_spike': False, 'sideways_rsi_required': False}.
[I 2025-08-31 11:17:53,171] Trial 646 finished with values: [-1000000000.0, 1000000000.0] and parameters: {'p_sma': 15, 'p_std': 30, 'p_atr': 8, 'p_adx': 15, 'rsi_period': 47, 'ema1': 11, 'ema2': 14, 'slip_atr_k': 0.016701291103868466, 'slip_spread_k': 0.19831760238368473, 'spread_hl_frac': 0.010169007737677753, 'bb_std_mult': 0.9958190963361475, 'rsi_os': 20, 'rsi_ob': 54, 'vol_spike': 0.2641402446465473, 'adx_thresh': 9.985741044540884, 'atr_min_pct': 0.006527613973701926, 'atr_max_pct': 0.018033354855884455, 'tp_mult': 1.0613447108096028, 'tsl_mult': 0.4732773895051777, 'strategy': 'breakout', 'time_stop': 92, 'use_sma': False, 'use_atr': False, 'use_adx': True, 'use_ema': True, 'use_spike': False, 'rsi_required': False, 'edge_k': 0.12379660278948533, 'edge_cap': 0.3453351123318683, 'bull_strategy': 'breakout', 'bull_bb_std_mult': 2.524890431485807, 'bull_rsi_os': 47, 'bull_rsi_ob': 72, 'bull_adx_thresh': 5.372626977077815, 'bull_atr_min_pct': 0.0034338888325866224, 'bull_atr_max_pct': 0.08267227542505043, 'bull_tp_mult': 1.8584046512602617, 'bull_tsl_mult': 0.8260309367865262, 'bull_time_stop': 61, 'bull_use_sma': False, 'bull_use_ema': True, 'bull_use_atr': True, 'bull_use_adx': True, 'bull_use_spike': True, 'bull_rsi_required': True, 'bear_strategy': 'mean_reversion', 'bear_bb_std_mult': 2.831015633423618, 'bear_rsi_os': 40, 'bear_rsi_ob': 72, 'bear_adx_thresh': 7.385142631014265, 'bear_atr_min_pct': 0.005873999508357999, 'bear_atr_max_pct': 0.05526790352956274, 'bear_tp_mult': 1.7437867361528723, 'bear_tsl_mult': 0.5278966873053724, 'bear_time_stop': 28, 'bear_use_sma': False, 'bear_use_ema': True, 'bear_use_atr': False, 'bear_use_adx': False, 'bear_use_spike': False, 'bear_rsi_required': False, 'sideways_strategy': 'breakout', 'sideways_bb_std_mult': 2.825986972406614, 'sideways_rsi_os': 45, 'sideways_rsi_ob': 92, 'sideways_adx_thresh': 13.301056350320014, 'sideways_atr_min_pct': 0.012628164415139401, 'sideways_atr_max_pct': 0.03789612507856192, 'sideways_tp_mult': 1.8878155711989193, 'sideways_tsl_mult': 0.14596228468318806, 'sideways_time_stop': 289, 'sideways_use_sma': False, 'sideways_use_ema': False, 'sideways_use_atr': False, 'sideways_use_adx': True, 'sideways_use_spike': True, 'sideways_rsi_required': False}.
[I 2025-08-31 11:17:53,264] Trial 645 finished with values: [-1000000000.0, 1000000000.0] and parameters: {'p_sma': 15, 'p_std': 30, 'p_atr': 14, 'p_adx': 15, 'rsi_period': 47, 'ema1': 14, 'ema2': 14, 'slip_atr_k': 0.07155164399753178, 'slip_spread_k': 0.63895892224431, 'spread_hl_frac': 0.010507164673282993, 'bb_std_mult': 0.9828789139029839, 'rsi_os': 20, 'rsi_ob': 76, 'vol_spike': 0.21936416938859432, 'adx_thresh': 32.364945725239295, 'atr_min_pct': 0.02696366921024787, 'atr_max_pct': 0.13711905703360322, 'tp_mult': 2.421550640140494, 'tsl_mult': 0.2376849091372505, 'strategy': 'breakout', 'time_stop': 91, 'use_sma': False, 'use_atr': False, 'use_adx': True, 'use_ema': True, 'use_spike': False, 'rsi_required': False, 'edge_k': 0.1149840130134467, 'edge_cap': 0.42573872365765514, 'bull_strategy': 'breakout', 'bull_bb_std_mult': 2.536418886761719, 'bull_rsi_os': 12, 'bull_rsi_ob': 73, 'bull_adx_thresh': 30.078420105225117, 'bull_atr_min_pct': 0.0032282372025948664, 'bull_atr_max_pct': 0.0751946678553779, 'bull_tp_mult': 2.168415421927768, 'bull_tsl_mult': 0.19031400835600815, 'bull_time_stop': 207, 'bull_use_sma': False, 'bull_use_ema': True, 'bull_use_atr': True, 'bull_use_adx': True, 'bull_use_spike': True, 'bull_rsi_required': True, 'bear_strategy': 'mean_reversion', 'bear_bb_std_mult': 2.885049116164719, 'bear_rsi_os': 35, 'bear_rsi_ob': 77, 'bear_adx_thresh': 7.469518979917943, 'bear_atr_min_pct': 0.006249414102812514, 'bear_atr_max_pct': 0.047914446315545325, 'bear_tp_mult': 2.7776750964521897, 'bear_tsl_mult': 0.5255761274097791, 'bear_time_stop': 28, 'bear_use_sma': False, 'bear_use_ema': True, 'bear_use_atr': False, 'bear_use_adx': False, 'bear_use_spike': False, 'bear_rsi_required': False, 'sideways_strategy': 'breakout', 'sideways_bb_std_mult': 0.6398027062495022, 'sideways_rsi_os': 22, 'sideways_rsi_ob': 91, 'sideways_adx_thresh': 30.381248589012838, 'sideways_atr_min_pct': 0.018560104377292167, 'sideways_atr_max_pct': 0.03822464422707973, 'sideways_tp_mult': 1.8658355205947774, 'sideways_tsl_mult': 0.09523909199899658, 'sideways_time_stop': 222, 'sideways_use_sma': False, 'sideways_use_ema': False, 'sideways_use_atr': False, 'sideways_use_adx': True, 'sideways_use_spike': True, 'sideways_rsi_required': False}.
[I 2025-08-31 11:18:25,154] Trial 649 finished with values: [-1000000000.0, 1000000000.0] and parameters: {'p_sma': 10, 'p_std': 28, 'p_atr': 10, 'p_adx': 16, 'rsi_period': 49, 'ema1': 15, 'ema2': 55, 'slip_atr_k': 0.0561249800846063, 'slip_spread_k': 0.037735977682228916, 'spread_hl_frac': 0.01081177425710263, 'bb_std_mult': 1.4885765029974025, 'rsi_os': 31, 'rsi_ob': 75, 'vol_spike': 0.1959818489885506, 'adx_thresh': 11.43363459574639, 'atr_min_pct': 0.0040520120034520215, 'atr_max_pct': 0.09717085071618455, 'tp_mult': 2.457371178871574, 'tsl_mult': 0.2440417641963316, 'strategy': 'breakout', 'time_stop': 86, 'use_sma': True, 'use_atr': False, 'use_adx': True, 'use_ema': True, 'use_spike': False, 'rsi_required': True, 'edge_k': 1.543878993498185, 'edge_cap': 0.3946484498666676, 'bull_strategy': 'mean_reversion', 'bull_bb_std_mult': 1.1923012546865395, 'bull_rsi_os': 21, 'bull_rsi_ob': 73, 'bull_adx_thresh': 34.48161712127694, 'bull_atr_min_pct': 0.0031218704953343197, 'bull_atr_max_pct': 0.0948297513359153, 'bull_tp_mult': 1.5473938806980048, 'bull_tsl_mult': 0.722465898743619, 'bull_time_stop': 75, 'bull_use_sma': True, 'bull_use_ema': False, 'bull_use_atr': True, 'bull_use_adx': False, 'bull_use_spike': False, 'bull_rsi_required': True, 'bear_strategy': 'breakout', 'bear_bb_std_mult': 1.5689736554602751, 'bear_rsi_os': 42, 'bear_rsi_ob': 94, 'bear_adx_thresh': 13.784731381539947, 'bear_atr_min_pct': 0.005434368262344879, 'bear_atr_max_pct': 0.14994584027151403, 'bear_tp_mult': 1.1568518521319167, 'bear_tsl_mult': 0.41366511660346333, 'bear_time_stop': 45, 'bear_use_sma': True, 'bear_use_ema': True, 'bear_use_atr': False, 'bear_use_adx': False, 'bear_use_spike': True, 'bear_rsi_required': False, 'sideways_strategy': 'mean_reversion', 'sideways_bb_std_mult': 2.683314260630287, 'sideways_rsi_os': 42, 'sideways_rsi_ob': 93, 'sideways_adx_thresh': 9.07453268162404, 'sideways_atr_min_pct': 0.017553859530664816, 'sideways_atr_max_pct': 0.0360453649905047, 'sideways_tp_mult': 1.9887613330589562, 'sideways_tsl_mult': 0.09839536841547511, 'sideways_time_stop': 32, 'sideways_use_sma': False, 'sideways_use_ema': False, 'sideways_use_atr': True, 'sideways_use_adx': True, 'sideways_use_spike': False, 'sideways_rsi_required': True}.
