[I 2025-08-31 11:04:15,416] Trial 540 finished with values: [-1000000000.0, 1000000000.0] and parameters: {'p_sma': 17, 'p_std': 25, 'p_atr': 12, 'p_adx': 13, 'rsi_period': 45, 'ema1': 22, 'ema2': 31, 'slip_atr_k': 0.11048345859892932, 'slip_spread_k': 0.0013111830272630187, 'spread_hl_frac': 0.03815120226304236, 'bb_std_mult': 2.0028590079361233, 'rsi_os': 42, 'rsi_ob': 79, 'vol_spike': 0.2994460594132815, 'adx_thresh': 14.471170187225125, 'atr_min_pct': 0.005151528583605097, 'atr_max_pct': 0.10310367246885851, 'tp_mult': 2.9211773817161255, 'tsl_mult': 0.5189190976092107, 'strategy': 'breakout', 'time_stop': 82, 'use_sma': False, 'use_atr': False, 'use_adx': True, 'use_ema': False, 'use_spike': False, 'rsi_required': True, 'edge_k': 0.21142934829930488, 'edge_cap': 0.42352993889804824, 'bull_strategy': 'mean_reversion', 'bull_bb_std_mult': 0.8739900209011391, 'bull_rsi_os': 10, 'bull_rsi_ob': 77, 'bull_adx_thresh': 12.834601852102303, 'bull_atr_min_pct': 0.02166657350144897, 'bull_atr_max_pct': 0.09871943474606182, 'bull_tp_mult': 2.4959259242848133, 'bull_tsl_mult': 0.3598548694614171, 'bull_time_stop': 118, 'bull_use_sma': True, 'bull_use_ema': True, 'bull_use_atr': False, 'bull_use_adx': True, 'bull_use_spike': True, 'bull_rsi_required': True, 'bear_strategy': 'breakout', 'bear_bb_std_mult': 1.67565844013987, 'bear_rsi_os': 39, 'bear_rsi_ob': 57, 'bear_adx_thresh': 32.90137139135999, 'bear_atr_min_pct': 0.0061276052025045534, 'bear_atr_max_pct': 0.1285841151376366, 'bear_tp_mult': 2.761871564466069, 'bear_tsl_mult': 0.5366094243060799, 'bear_time_stop': 37, 'bear_use_sma': True, 'bear_use_ema': True, 'bear_use_atr': False, 'bear_use_adx': True, 'bear_use_spike': True, 'bear_rsi_required': True, 'sideways_strategy': 'breakout', 'sideways_bb_std_mult': 3.5990380152972588, 'sideways_rsi_os': 48, 'sideways_rsi_ob': 67, 'sideways_adx_thresh': 8.52686453887184, 'sideways_atr_min_pct': 0.019775278045094387, 'sideways_atr_max_pct': 0.0645447237776137, 'sideways_tp_mult': 2.76026112849456, 'sideways_tsl_mult': 0.2955468713008791, 'sideways_time_stop': 24, 'sideways_use_sma': False, 'sideways_use_ema': False, 'sideways_use_atr': True, 'sideways_use_adx': False, 'sideways_use_spike': False, 'sideways_rsi_required': False}.
[I 2025-08-31 11:04:15,565] Trial 542 finished with values: [-1000000000.0, 1000000000.0] and parameters: {'p_sma': 41, 'p_std': 28, 'p_atr': 11, 'p_adx': 13, 'rsi_period': 45, 'ema1': 13, 'ema2': 56, 'slip_atr_k': 0.11538647152887216, 'slip_spread_k': 0.49735373103378316, 'spread_hl_frac': 0.007838044932660765, 'bb_std_mult': 2.689141902602443, 'rsi_os': 27, 'rsi_ob': 79, 'vol_spike': 0.2577707991939528, 'adx_thresh': 31.797709435529804, 'atr_min_pct': 0.024536561788902983, 'atr_max_pct': 0.11207091897991103, 'tp_mult': 1.982531923530767, 'tsl_mult': 0.43340211633033027, 'strategy': 'breakout', 'time_stop': 82, 'use_sma': False, 'use_atr': False, 'use_adx': True, 'use_ema': True, 'use_spike': False, 'rsi_required': True, 'edge_k': 0.21690189729687115, 'edge_cap': 0.4824285391266822, 'bull_strategy': 'mean_reversion', 'bull_bb_std_mult': 0.5578802551285886, 'bull_rsi_os': 10, 'bull_rsi_ob': 74, 'bull_adx_thresh': 7.050128805936858, 'bull_atr_min_pct': 0.006392082174740812, 'bull_atr_max_pct': 0.09872141434464965, 'bull_tp_mult': 1.7657580134884845, 'bull_tsl_mult': 0.3700576597610088, 'bull_time_stop': 77, 'bull_use_sma': True, 'bull_use_ema': True, 'bull_use_atr': False, 'bull_use_adx': True, 'bull_use_spike': True, 'bull_rsi_required': False, 'bear_strategy': 'breakout', 'bear_bb_std_mult': 1.687557271772168, 'bear_rsi_os': 34, 'bear_rsi_ob': 91, 'bear_adx_thresh': 7.759123230267125, 'bear_atr_min_pct': 0.005945941577238487, 'bear_atr_max_pct': 0.034756557412834455, 'bear_tp_mult': 1.2036070627271647, 'bear_tsl_mult': 0.317146687044012, 'bear_time_stop': 244, 'bear_use_sma': False, 'bear_use_ema': True, 'bear_use_atr': False, 'bear_use_adx': False, 'bear_use_spike': True, 'bear_rsi_required': True, 'sideways_strategy': 'breakout', 'sideways_bb_std_mult': 1.3872610356369177, 'sideways_rsi_os': 33, 'sideways_rsi_ob': 68, 'sideways_adx_thresh': 29.680849787215248, 'sideways_atr_min_pct': 0.014786822468195925, 'sideways_atr_max_pct': 0.016987286037024492, 'sideways_tp_mult': 2.0028040388152637, 'sideways_tsl_mult': 0.17187165900672316, 'sideways_time_stop': 23, 'sideways_use_sma': False, 'sideways_use_ema': False, 'sideways_use_atr': True, 'sideways_use_adx': False, 'sideways_use_spike': False, 'sideways_rsi_required': False}.
[I 2025-08-31 11:04:15,807] Trial 539 finished with values: [-1000000000.0, 1000000000.0] and parameters: {'p_sma': 40, 'p_std': 31, 'p_atr': 12, 'p_adx': 13, 'rsi_period': 7, 'ema1': 22, 'ema2': 54, 'slip_atr_k': 0.11409261397395398, 'slip_spread_k': 0.7775010245800347, 'spread_hl_frac': 0.042158215550987525, 'bb_std_mult': 2.8314700254321026, 'rsi_os': 42, 'rsi_ob': 91, 'vol_spike': 0.24149474579580535, 'adx_thresh': 25.029524212008244, 'atr_min_pct': 0.024090221443018527, 'atr_max_pct': 0.06362829959773979, 'tp_mult': 1.2833137116265139, 'tsl_mult': 0.015088496572813637, 'strategy': 'breakout', 'time_stop': 81, 'use_sma': True, 'use_atr': True, 'use_adx': False, 'use_ema': True, 'use_spike': True, 'rsi_required': False, 'edge_k': 0.20553331320496485, 'edge_cap': 0.2093558380772636, 'bull_strategy': 'mean_reversion', 'bull_bb_std_mult': 0.8706672416161003, 'bull_rsi_os': 20, 'bull_rsi_ob': 74, 'bull_adx_thresh': 7.7435211477306005, 'bull_atr_min_pct': 0.01670642615789949, 'bull_atr_max_pct': 0.09800988121833219, 'bull_tp_mult': 1.9174404085747963, 'bull_tsl_mult': 0.43047076064116585, 'bull_time_stop': 70, 'bull_use_sma': True, 'bull_use_ema': True, 'bull_use_atr': True, 'bull_use_adx': False, 'bull_use_spike': True, 'bull_rsi_required': True, 'bear_strategy': 'breakout', 'bear_bb_std_mult': 2.2434200796955355, 'bear_rsi_os': 39, 'bear_rsi_ob': 91, 'bear_adx_thresh': 7.790948884861515, 'bear_atr_min_pct': 0.005237237382879161, 'bear_atr_max_pct': 0.05214283648856363, 'bear_tp_mult': 2.760565118826463, 'bear_tsl_mult': 0.5410936344549051, 'bear_time_stop': 37, 'bear_use_sma': False, 'bear_use_ema': False, 'bear_use_atr': True, 'bear_use_adx': False, 'bear_use_spike': True, 'bear_rsi_required': True, 'sideways_strategy': 'mean_reversion', 'sideways_bb_std_mult': 1.4134972097135972, 'sideways_rsi_os': 8, 'sideways_rsi_ob': 54, 'sideways_adx_thresh': 8.431034435158903, 'sideways_atr_min_pct': 0.017441162825556033, 'sideways_atr_max_pct': 0.03468087749260904, 'sideways_tp_mult': 2.766511452777623, 'sideways_tsl_mult': 0.7683117446105825, 'sideways_time_stop': 277, 'sideways_use_sma': False, 'sideways_use_ema': False, 'sideways_use_atr': True, 'sideways_use_adx': True, 'sideways_use_spike': True, 'sideways_rsi_required': True}.
[I 2025-08-31 11:04:47,044] Trial 543 finished with values: [-1000000000.0, 1000000000.0] and parameters: {'p_sma': 47, 'p_std': 10, 'p_atr': 11, 'p_adx': 16, 'rsi_period': 47, 'ema1': 15, 'ema2': 56, 'slip_atr_k': 0.03115335448016797, 'slip_spread_k': 0.5036047405495123, 'spread_hl_frac': 0.020077475013359037, 'bb_std_mult': 1.0742075340661659, 'rsi_os': 22, 'rsi_ob': 75, 'vol_spike': 0.2593841997440128, 'adx_thresh': 31.670282231226995, 'atr_min_pct': 0.010174077510609678, 'atr_max_pct': 0.014913676547232357, 'tp_mult': 2.413847313684906, 'tsl_mult': 0.6906688746459326, 'strategy': 'breakout', 'time_stop': 74, 'use_sma': True, 'use_atr': False, 'use_adx': True, 'use_ema': True, 'use_spike': True, 'rsi_required': True, 'edge_k': 1.8918003538519708, 'edge_cap': 0.4061331199083376, 'bull_strategy': 'breakout', 'bull_bb_std_mult': 3.105693478403107, 'bull_rsi_os': 46, 'bull_rsi_ob': 74, 'bull_adx_thresh': 22.294460340919645, 'bull_atr_min_pct': 0.01665009949704889, 'bull_atr_max_pct': 0.09084612853136818, 'bull_tp_mult': 1.7909802376739903, 'bull_tsl_mult': 0.3731467920858359, 'bull_time_stop': 249, 'bull_use_sma': True, 'bull_use_ema': False, 'bull_use_atr': False, 'bull_use_adx': False, 'bull_use_spike': False, 'bull_rsi_required': True, 'bear_strategy': 'breakout', 'bear_bb_std_mult': 1.8900494233457723, 'bear_rsi_os': 41, 'bear_rsi_ob': 88, 'bear_adx_thresh': 23.007051599416407, 'bear_atr_min_pct': 0.00914235690682122, 'bear_atr_max_pct': 0.1241774515901469, 'bear_tp_mult': 2.911944325995688, 'bear_tsl_mult': 0.31694046295524675, 'bear_time_stop': 30, 'bear_use_sma': False, 'bear_use_ema': True, 'bear_use_atr': False, 'bear_use_adx': False, 'bear_use_spike': True, 'bear_rsi_required': False, 'sideways_strategy': 'mean_reversion', 'sideways_bb_std_mult': 0.8024340702897228, 'sideways_rsi_os': 10, 'sideways_rsi_ob': 86, 'sideways_adx_thresh': 29.605382517249254, 'sideways_atr_min_pct': 0.019229109975715156, 'sideways_atr_max_pct': 0.10212577548268088, 'sideways_tp_mult': 2.0278602261558647, 'sideways_tsl_mult': 0.25781700800749446, 'sideways_time_stop': 39, 'sideways_use_sma': False, 'sideways_use_ema': False, 'sideways_use_atr': False, 'sideways_use_adx': False, 'sideways_use_spike': False, 'sideways_rsi_required': True}.
[I 2025-08-31 11:04:47,422] Trial 544 finished with values: [-1000000000.0, 1000000000.0] and parameters: {'p_sma': 18, 'p_std': 28, 'p_atr': 11, 'p_adx': 12, 'rsi_period': 47, 'ema1': 15, 'ema2': 56, 'slip_atr_k': 0.031297158859285204, 'slip_spread_k': 0.6717992116210639, 'spread_hl_frac': 0.043625961679936084, 'bb_std_mult': 2.765089603126692, 'rsi_os': 26, 'rsi_ob': 76, 'vol_spike': 0.259591980607991, 'adx_thresh': 29.795096886450178, 'atr_min_pct': 0.005843517736188783, 'atr_max_pct': 0.11102492717926259, 'tp_mult': 1.2845178460929172, 'tsl_mult': 0.41588713618954276, 'strategy': 'breakout', 'time_stop': 77, 'use_sma': True, 'use_atr': False, 'use_adx': True, 'use_ema': True, 'use_spike': True, 'rsi_required': True, 'edge_k': 1.8999947041729506, 'edge_cap': 0.40237747451923317, 'bull_strategy': 'breakout', 'bull_bb_std_mult': 3.108555503452386, 'bull_rsi_os': 46, 'bull_rsi_ob': 45, 'bull_adx_thresh': 5.956774803633877, 'bull_atr_min_pct': 0.004732519254055671, 'bull_atr_max_pct': 0.06782635418141254, 'bull_tp_mult': 1.759675038591235, 'bull_tsl_mult': 0.36886243353799875, 'bull_time_stop': 76, 'bull_use_sma': True, 'bull_use_ema': False, 'bull_use_atr': False, 'bull_use_adx': False, 'bull_use_spike': False, 'bull_rsi_required': True, 'bear_strategy': 'breakout', 'bear_bb_std_mult': 1.8520860089270181, 'bear_rsi_os': 41, 'bear_rsi_ob': 88, 'bear_adx_thresh': 6.017951379477067, 'bear_atr_min_pct': 0.015139534181886447, 'bear_atr_max_pct': 0.12377398698657568, 'bear_tp_mult': 2.9081627792388467, 'bear_tsl_mult': 0.4547007689627355, 'bear_time_stop': 31, 'bear_use_sma': False, 'bear_use_ema': True, 'bear_use_atr': False, 'bear_use_adx': False, 'bear_use_spike': True, 'bear_rsi_required': False, 'sideways_strategy': 'mean_reversion', 'sideways_bb_std_mult': 2.768236605930325, 'sideways_rsi_os': 5, 'sideways_rsi_ob': 93, 'sideways_adx_thresh': 25.68999575526473, 'sideways_atr_min_pct': 0.019355346250523327, 'sideways_atr_max_pct': 0.02725477737739959, 'sideways_tp_mult': 2.0320355811135284, 'sideways_tsl_mult': 0.05423996727307948, 'sideways_time_stop': 15, 'sideways_use_sma': False, 'sideways_use_ema': False, 'sideways_use_atr': False, 'sideways_use_adx': False, 'sideways_use_spike': False, 'sideways_rsi_required': True}.
[I 2025-08-31 11:04:47,579] Trial 545 finished with values: [-1000000000.0, 1000000000.0] and parameters: {'p_sma': 39, 'p_std': 33, 'p_atr': 27, 'p_adx': 15, 'rsi_period': 47, 'ema1': 15, 'ema2': 15, 'slip_atr_k': 0.03196891904976062, 'slip_spread_k': 0.9665155133743359, 'spread_hl_frac': 0.009659791788170393, 'bb_std_mult': 2.835805521605903, 'rsi_os': 22, 'rsi_ob': 75, 'vol_spike': 0.26153529070535597, 'adx_thresh': 9.39892092975046, 'atr_min_pct': 0.007473634977115666, 'atr_max_pct': 0.061516158332042534, 'tp_mult': 1.842178146312334, 'tsl_mult': 0.01842639957840453, 'strategy': 'breakout', 'time_stop': 61, 'use_sma': True, 'use_atr': False, 'use_adx': True, 'use_ema': True, 'use_spike': True, 'rsi_required': True, 'edge_k': 0.5521944201691871, 'edge_cap': 0.19813011954476245, 'bull_strategy': 'breakout', 'bull_bb_std_mult': 0.7877914022444972, 'bull_rsi_os': 36, 'bull_rsi_ob': 73, 'bull_adx_thresh': 5.902409211908006, 'bull_atr_min_pct': 0.004653167344383582, 'bull_atr_max_pct': 0.09062874859725498, 'bull_tp_mult': 1.787210171925743, 'bull_tsl_mult': 0.5385835039222815, 'bull_time_stop': 250, 'bull_use_sma': True, 'bull_use_ema': False, 'bull_use_atr': False, 'bull_use_adx': False, 'bull_use_spike': False, 'bull_rsi_required': True, 'bear_strategy': 'breakout', 'bear_bb_std_mult': 1.8402994665536183, 'bear_rsi_os': 41, 'bear_rsi_ob': 88, 'bear_adx_thresh': 6.038846201972569, 'bear_atr_min_pct': 0.019495396292182002, 'bear_atr_max_pct': 0.11098140685900301, 'bear_tp_mult': 2.90151182422394, 'bear_tsl_mult': 0.3942651691251844, 'bear_time_stop': 173, 'bear_use_sma': False, 'bear_use_ema': True, 'bear_use_atr': False, 'bear_use_adx': False, 'bear_use_spike': True, 'bear_rsi_required': False, 'sideways_strategy': 'mean_reversion', 'sideways_bb_std_mult': 2.768047766355837, 'sideways_rsi_os': 41, 'sideways_rsi_ob': 89, 'sideways_adx_thresh': 25.64125375235496, 'sideways_atr_min_pct': 0.01936367620317882, 'sideways_atr_max_pct': 0.10218021866694763, 'sideways_tp_mult': 2.041902934695342, 'sideways_tsl_mult': 0.2586941634015375, 'sideways_time_stop': 13, 'sideways_use_sma': False, 'sideways_use_ema': False, 'sideways_use_atr': False, 'sideways_use_adx': False, 'sideways_use_spike': False, 'sideways_rsi_required': True}.
[I 2025-08-31 11:04:47,999] Trial 546 finished with values: [-1000000000.0, 1000000000.0] and parameters: {'p_sma': 18, 'p_std': 33, 'p_atr': 11, 'p_adx': 16, 'rsi_period': 47, 'ema1': 21, 'ema2': 42, 'slip_atr_k': 0.24086954064015054, 'slip_spread_k': 0.6671831718894727, 'spread_hl_frac': 0.009726588608189547, 'bb_std_mult': 2.7586572440467565, 'rsi_os': 8, 'rsi_ob': 75, 'vol_spike': 0.2613422930977481, 'adx_thresh': 9.55572309761882, 'atr_min_pct': 0.007604071767556975, 'atr_max_pct': 0.09758266159795856, 'tp_mult': 2.409230302586919, 'tsl_mult': 0.0784103824132838, 'strategy': 'breakout', 'time_stop': 74, 'use_sma': True, 'use_atr': False, 'use_adx': True, 'use_ema': True, 'use_spike': True, 'rsi_required': True, 'edge_k': 1.6854170978388807, 'edge_cap': 0.76680672915035, 'bull_strategy': 'breakout', 'bull_bb_std_mult': 0.7884278250466542, 'bull_rsi_os': 46, 'bull_rsi_ob': 94, 'bull_adx_thresh': 6.003218173561045, 'bull_atr_min_pct': 0.004729964315109382, 'bull_atr_max_pct': 0.09162554066986985, 'bull_tp_mult': 1.7797014120159715, 'bull_tsl_mult': 0.002887075889903723, 'bull_time_stop': 62, 'bull_use_sma': False, 'bull_use_ema': False, 'bull_use_atr': False, 'bull_use_adx': False, 'bull_use_spike': False, 'bull_rsi_required': True, 'bear_strategy': 'breakout', 'bear_bb_std_mult': 3.5071640823075065, 'bear_rsi_os': 41, 'bear_rsi_ob': 46, 'bear_adx_thresh': 5.942407098300077, 'bear_atr_min_pct': 0.020839309189142174, 'bear_atr_max_pct': 0.0977399612959757, 'bear_tp_mult': 2.9112037085371134, 'bear_tsl_mult': 0.1808322641876836, 'bear_time_stop': 28, 'bear_use_sma': False, 'bear_use_ema': True, 'bear_use_atr': False, 'bear_use_adx': False, 'bear_use_spike': False, 'bear_rsi_required': False, 'sideways_strategy': 'mean_reversion', 'sideways_bb_std_mult': 2.7583184655461075, 'sideways_rsi_os': 47, 'sideways_rsi_ob': 93, 'sideways_adx_thresh': 30.42048840620764, 'sideways_atr_min_pct': 0.012399881486854615, 'sideways_atr_max_pct': 0.05775784920843681, 'sideways_tp_mult': 2.040243889232795, 'sideways_tsl_mult': 0.9285322237122925, 'sideways_time_stop': 13, 'sideways_use_sma': False, 'sideways_use_ema': True, 'sideways_use_atr': False, 'sideways_use_adx': False, 'sideways_use_spike': False, 'sideways_rsi_required': True}.
[I 2025-08-31 11:04:48,869] Trial 547 finished with values: [-1000000000.0, 1000000000.0] and parameters: {'p_sma': 18, 'p_std': 33, 'p_atr': 14, 'p_adx': 15, 'rsi_period': 34, 'ema1': 13, 'ema2': 48, 'slip_atr_k': 0.03764195074447466, 'slip_spread_k': 0.6706105566386301, 'spread_hl_frac': 0.009776323466068527, 'bb_std_mult': 3.092332677064254, 'rsi_os': 26, 'rsi_ob': 50, 'vol_spike': 0.2643182965675705, 'adx_thresh': 29.715999217375952, 'atr_min_pct': 0.02731321839843241, 'atr_max_pct': 0.01764452514348562, 'tp_mult': 1.8483455644651543, 'tsl_mult': 0.2440922579439163, 'strategy': 'breakout', 'time_stop': 60, 'use_sma': True, 'use_atr': False, 'use_adx': True, 'use_ema': True, 'use_spike': True, 'rsi_required': True, 'edge_k': 1.7463586147496224, 'edge_cap': 0.7002753185952095, 'bull_strategy': 'breakout', 'bull_bb_std_mult': 0.7762182146308656, 'bull_rsi_os': 36, 'bull_rsi_ob': 56, 'bull_adx_thresh': 6.199875745089662, 'bull_atr_min_pct': 0.00447926670486307, 'bull_atr_max_pct': 0.06875421138051115, 'bull_tp_mult': 1.7277524847718233, 'bull_tsl_mult': 0.5911902735362009, 'bull_time_stop': 144, 'bull_use_sma': False, 'bull_use_ema': False, 'bull_use_atr': False, 'bull_use_adx': False, 'bull_use_spike': False, 'bull_rsi_required': True, 'bear_strategy': 'breakout', 'bear_bb_std_mult': 2.1613097650521906, 'bear_rsi_os': 24, 'bear_rsi_ob': 95, 'bear_adx_thresh': 6.230101850688978, 'bear_atr_min_pct': 0.004355152983725742, 'bear_atr_max_pct': 0.14727611056017798, 'bear_tp_mult': 1.024478651558944, 'bear_tsl_mult': 0.48230119475306266, 'bear_time_stop': 300, 'bear_use_sma': False, 'bear_use_ema': True, 'bear_use_atr': False, 'bear_use_adx': False, 'bear_use_spike': False, 'bear_rsi_required': False, 'sideways_strategy': 'mean_reversion', 'sideways_bb_std_mult': 2.7547572560502673, 'sideways_rsi_os': 5, 'sideways_rsi_ob': 93, 'sideways_adx_thresh': 15.37001398464276, 'sideways_atr_min_pct': 0.018516934945242192, 'sideways_atr_max_pct': 0.058328914185137457, 'sideways_tp_mult': 1.913964947661975, 'sideways_tsl_mult': 0.09487952326152857, 'sideways_time_stop': 13, 'sideways_use_sma': False, 'sideways_use_ema': True, 'sideways_use_atr': False, 'sideways_use_adx': False, 'sideways_use_spike': False, 'sideways_rsi_required': True}.
[I 2025-08-31 11:04:49,574] Trial 551 finished with values: [-1000000000.0, 1000000000.0] and parameters: {'p_sma': 15, 'p_std': 45, 'p_atr': 18, 'p_adx': 14, 'rsi_period': 43, 'ema1': 10, 'ema2': 52, 'slip_atr_k': 0.09816364326755428, 'slip_spread_k': 0.6415780088354348, 'spread_hl_frac': 0.03246294335485641, 'bb_std_mult': 2.5834340373472706, 'rsi_os': 24, 'rsi_ob': 45, 'vol_spike': 0.250527047048337, 'adx_thresh': 30.630680071857967, 'atr_min_pct': 0.004045355621456955, 'atr_max_pct': 0.119264595337575, 'tp_mult': 1.0375895067502516, 'tsl_mult': 0.2947863326525328, 'strategy': 'mean_reversion', 'time_stop': 103, 'use_sma': True, 'use_atr': False, 'use_adx': True, 'use_ema': False, 'use_spike': False, 'rsi_required': True, 'edge_k': 1.3071427005147185, 'edge_cap': 0.4641153885026546, 'bull_strategy': 'breakout', 'bull_bb_std_mult': 0.6061261401050102, 'bull_rsi_os': 26, 'bull_rsi_ob': 75, 'bull_adx_thresh': 30.850036501050276, 'bull_atr_min_pct': 0.014300283052030752, 'bull_atr_max_pct': 0.02567748140888399, 'bull_tp_mult': 2.8085188504026535, 'bull_tsl_mult': 0.39626513916928935, 'bull_time_stop': 233, 'bull_use_sma': True, 'bull_use_ema': False, 'bull_use_atr': False, 'bull_use_adx': False, 'bull_use_spike': False, 'bull_rsi_required': False, 'bear_strategy': 'breakout', 'bear_bb_std_mult': 1.5286511479369072, 'bear_rsi_os': 28, 'bear_rsi_ob': 85, 'bear_adx_thresh': 6.826838383910087, 'bear_atr_min_pct': 0.007923416615349278, 'bear_atr_max_pct': 0.05840605496666077, 'bear_tp_mult': 2.9645856188303084, 'bear_tsl_mult': 0.5041819523124198, 'bear_time_stop': 15, 'bear_use_sma': True, 'bear_use_ema': True, 'bear_use_atr': False, 'bear_use_adx': True, 'bear_use_spike': True, 'bear_rsi_required': False, 'sideways_strategy': 'breakout', 'sideways_bb_std_mult': 2.8884183656747258, 'sideways_rsi_os': 55, 'sideways_rsi_ob': 70, 'sideways_adx_thresh': 24.931997332493367, 'sideways_atr_min_pct': 0.011066017040523193, 'sideways_atr_max_pct': 0.04209450782519795, 'sideways_tp_mult': 1.9327863822672506, 'sideways_tsl_mult': 0.10299583449564162, 'sideways_time_stop': 231, 'sideways_use_sma': True, 'sideways_use_ema': False, 'sideways_use_atr': False, 'sideways_use_adx': False, 'sideways_use_spike': False, 'sideways_rsi_required': False}.
