[I 2025-08-31 11:00:24,169] Trial 512 finished with values: [-1000000000.0, 1000000000.0] and parameters: {'p_sma': 18, 'p_std': 36, 'p_atr': 13, 'p_adx': 25, 'rsi_period': 15, 'ema1': 5, 'ema2': 56, 'slip_atr_k': 0.020015582142984382, 'slip_spread_k': 0.6796804862209777, 'spread_hl_frac': 0.0012423467238177055, 'bb_std_mult': 1.155018627214279, 'rsi_os': 27, 'rsi_ob': 76, 'vol_spike': 0.25745995911587694, 'adx_thresh': 28.18443319911392, 'atr_min_pct': 0.006200141075442367, 'atr_max_pct': 0.07127247909127299, 'tp_mult': 2.323593006564499, 'tsl_mult': 0.2295720007039036, 'strategy': 'breakout', 'time_stop': 84, 'use_sma': False, 'use_atr': False, 'use_adx': True, 'use_ema': True, 'use_spike': True, 'rsi_required': True, 'edge_k': 0.004437515041656875, 'edge_cap': 0.48951125932992356, 'bull_strategy': 'breakout', 'bull_bb_std_mult': 3.443668317710927, 'bull_rsi_os': 7, 'bull_rsi_ob': 72, 'bull_adx_thresh': 6.18330189657771, 'bull_atr_min_pct': 0.01830410802175585, 'bull_atr_max_pct': 0.09260510107548363, 'bull_tp_mult': 1.8618483176431342, 'bull_tsl_mult': 0.944792098037794, 'bull_time_stop': 36, 'bull_use_sma': True, 'bull_use_ema': False, 'bull_use_atr': False, 'bull_use_adx': True, 'bull_use_spike': False, 'bull_rsi_required': True, 'bear_strategy': 'breakout', 'bear_bb_std_mult': 0.6481940446918317, 'bear_rsi_os': 25, 'bear_rsi_ob': 82, 'bear_adx_thresh': 5.6115369596964255, 'bear_atr_min_pct': 0.011784844816127934, 'bear_atr_max_pct': 0.14486349997932935, 'bear_tp_mult': 2.2229188777844433, 'bear_tsl_mult': 0.636208901259751, 'bear_time_stop': 148, 'bear_use_sma': False, 'bear_use_ema': True, 'bear_use_atr': False, 'bear_use_adx': False, 'bear_use_spike': True, 'bear_rsi_required': False, 'sideways_strategy': 'mean_reversion', 'sideways_bb_std_mult': 2.791598934686553, 'sideways_rsi_os': 7, 'sideways_rsi_ob': 91, 'sideways_adx_thresh': 27.264285494807833, 'sideways_atr_min_pct': 0.017017712000634316, 'sideways_atr_max_pct': 0.07873223425293491, 'sideways_tp_mult': 1.6409848970004601, 'sideways_tsl_mult': 0.15403422352414348, 'sideways_time_stop': 16, 'sideways_use_sma': False, 'sideways_use_ema': True, 'sideways_use_atr': False, 'sideways_use_adx': False, 'sideways_use_spike': False, 'sideways_rsi_required': True}.
[I 2025-08-31 11:00:24,246] Trial 513 finished with values: [-1000000000.0, 1000000000.0] and parameters: {'p_sma': 23, 'p_std': 57, 'p_atr': 13, 'p_adx': 13, 'rsi_period': 81, 'ema1': 14, 'ema2': 56, 'slip_atr_k': 0.00453652158924607, 'slip_spread_k': 0.2024623896225619, 'spread_hl_frac': 0.021960020351568764, 'bb_std_mult': 1.6754052197256406, 'rsi_os': 27, 'rsi_ob': 82, 'vol_spike': 0.06772403122066455, 'adx_thresh': 28.082490794406066, 'atr_min_pct': 0.006488759740380176, 'atr_max_pct': 0.050357487140675554, 'tp_mult': 2.438636947653798, 'tsl_mult': 0.7164871715722592, 'strategy': 'mean_reversion', 'time_stop': 90, 'use_sma': False, 'use_atr': False, 'use_adx': True, 'use_ema': True, 'use_spike': True, 'rsi_required': True, 'edge_k': 1.8469178158663517, 'edge_cap': 0.2698649652760868, 'bull_strategy': 'breakout', 'bull_bb_std_mult': 2.5749422081184976, 'bull_rsi_os': 7, 'bull_rsi_ob': 68, 'bull_adx_thresh': 5.689503514618173, 'bull_atr_min_pct': 0.027550353039052962, 'bull_atr_max_pct': 0.12087174601001008, 'bull_tp_mult': 1.9768479248015003, 'bull_tsl_mult': 0.41627372514615224, 'bull_time_stop': 90, 'bull_use_sma': False, 'bull_use_ema': False, 'bull_use_atr': False, 'bull_use_adx': True, 'bull_use_spike': False, 'bull_rsi_required': True, 'bear_strategy': 'breakout', 'bear_bb_std_mult': 1.93109630865115, 'bear_rsi_os': 38, 'bear_rsi_ob': 90, 'bear_adx_thresh': 5.4915056349125875, 'bear_atr_min_pct': 0.023173334356031333, 'bear_atr_max_pct': 0.1450774409168813, 'bear_tp_mult': 2.776259017294622, 'bear_tsl_mult': 0.6304211002282731, 'bear_time_stop': 26, 'bear_use_sma': False, 'bear_use_ema': True, 'bear_use_atr': False, 'bear_use_adx': False, 'bear_use_spike': True, 'bear_rsi_required': False, 'sideways_strategy': 'mean_reversion', 'sideways_bb_std_mult': 3.0686176861911933, 'sideways_rsi_os': 30, 'sideways_rsi_ob': 93, 'sideways_adx_thresh': 11.922931580033161, 'sideways_atr_min_pct': 0.016996689433029257, 'sideways_atr_max_pct': 0.012923530027157376, 'sideways_tp_mult': 1.9675480754449808, 'sideways_tsl_mult': 0.8132780526258515, 'sideways_time_stop': 35, 'sideways_use_sma': True, 'sideways_use_ema': True, 'sideways_use_atr': False, 'sideways_use_adx': False, 'sideways_use_spike': False, 'sideways_rsi_required': True}.
[I 2025-08-31 11:00:55,886] Trial 518 finished with values: [-1000000000.0, 1000000000.0] and parameters: {'p_sma': 8, 'p_std': 44, 'p_atr': 12, 'p_adx': 14, 'rsi_period': 46, 'ema1': 8, 'ema2': 54, 'slip_atr_k': 0.18391838564473867, 'slip_spread_k': 0.9500609112696572, 'spread_hl_frac': 0.011913595205267122, 'bb_std_mult': 2.655043092829129, 'rsi_os': 25, 'rsi_ob': 77, 'vol_spike': 0.2842182827236991, 'adx_thresh': 29.108786547432846, 'atr_min_pct': 0.013573966933883031, 'atr_max_pct': 0.09674367323425988, 'tp_mult': 1.2278392683166042, 'tsl_mult': 0.25209656602752367, 'strategy': 'breakout', 'time_stop': 43, 'use_sma': True, 'use_atr': False, 'use_adx': True, 'use_ema': False, 'use_spike': True, 'rsi_required': True, 'edge_k': 0.08399318344384132, 'edge_cap': 0.45340764347944834, 'bull_strategy': 'breakout', 'bull_bb_std_mult': 1.0067009766720822, 'bull_rsi_os': 13, 'bull_rsi_ob': 78, 'bull_adx_thresh': 10.583608394261375, 'bull_atr_min_pct': 0.013787299919964897, 'bull_atr_max_pct': 0.07750543245076875, 'bull_tp_mult': 2.612058614048019, 'bull_tsl_mult': 0.38596173777066656, 'bull_time_stop': 196, 'bull_use_sma': True, 'bull_use_ema': False, 'bull_use_atr': False, 'bull_use_adx': False, 'bull_use_spike': False, 'bull_rsi_required': False, 'bear_strategy': 'mean_reversion', 'bear_bb_std_mult': 2.301839922958874, 'bear_rsi_os': 42, 'bear_rsi_ob': 92, 'bear_adx_thresh': 10.79949997110555, 'bear_atr_min_pct': 0.005716678252208469, 'bear_atr_max_pct': 0.14112895965361597, 'bear_tp_mult': 2.869987544953269, 'bear_tsl_mult': 0.9264929045104271, 'bear_time_stop': 16, 'bear_use_sma': False, 'bear_use_ema': True, 'bear_use_atr': False, 'bear_use_adx': True, 'bear_use_spike': False, 'bear_rsi_required': False, 'sideways_strategy': 'mean_reversion', 'sideways_bb_std_mult': 2.669663598352105, 'sideways_rsi_os': 31, 'sideways_rsi_ob': 85, 'sideways_adx_thresh': 14.508788091176166, 'sideways_atr_min_pct': 0.01309558011112351, 'sideways_atr_max_pct': 0.13653678856871487, 'sideways_tp_mult': 2.812286409849473, 'sideways_tsl_mult': 0.4059851396743862, 'sideways_time_stop': 240, 'sideways_use_sma': False, 'sideways_use_ema': False, 'sideways_use_atr': False, 'sideways_use_adx': False, 'sideways_use_spike': False, 'sideways_rsi_required': True}.
[I 2025-08-31 11:00:56,369] Trial 517 finished with values: [-1000000000.0, 1000000000.0] and parameters: {'p_sma': 17, 'p_std': 15, 'p_atr': 12, 'p_adx': 14, 'rsi_period': 46, 'ema1': 14, 'ema2': 37, 'slip_atr_k': 0.18335968115289536, 'slip_spread_k': 0.6003000152692908, 'spread_hl_frac': 0.030793915388411204, 'bb_std_mult': 3.508991004294283, 'rsi_os': 23, 'rsi_ob': 76, 'vol_spike': 0.044673572606072964, 'adx_thresh': 29.300195716479283, 'atr_min_pct': 0.007563192578322855, 'atr_max_pct': 0.09677569126155104, 'tp_mult': 1.6001821466988568, 'tsl_mult': 0.713324864276729, 'strategy': 'mean_reversion', 'time_stop': 89, 'use_sma': True, 'use_atr': False, 'use_adx': True, 'use_ema': False, 'use_spike': True, 'rsi_required': True, 'edge_k': 0.07770630432684172, 'edge_cap': 0.44778173339173843, 'bull_strategy': 'breakout', 'bull_bb_std_mult': 0.8194136520723706, 'bull_rsi_os': 13, 'bull_rsi_ob': 63, 'bull_adx_thresh': 9.8992906468266, 'bull_atr_min_pct': 0.01239599900883581, 'bull_atr_max_pct': 0.08005531577820102, 'bull_tp_mult': 1.7392160942185866, 'bull_tsl_mult': 0.026207571439543387, 'bull_time_stop': 67, 'bull_use_sma': False, 'bull_use_ema': False, 'bull_use_atr': False, 'bull_use_adx': False, 'bull_use_spike': False, 'bull_rsi_required': False, 'bear_strategy': 'mean_reversion', 'bear_bb_std_mult': 1.9280685215272197, 'bear_rsi_os': 49, 'bear_rsi_ob': 92, 'bear_adx_thresh': 10.955644675553517, 'bear_atr_min_pct': 0.0056048504646803105, 'bear_atr_max_pct': 0.14100436657251836, 'bear_tp_mult': 2.8652397299132213, 'bear_tsl_mult': 0.8948025356007738, 'bear_time_stop': 207, 'bear_use_sma': False, 'bear_use_ema': True, 'bear_use_atr': False, 'bear_use_adx': True, 'bear_use_spike': False, 'bear_rsi_required': False, 'sideways_strategy': 'mean_reversion', 'sideways_bb_std_mult': 3.0815080785767983, 'sideways_rsi_os': 40, 'sideways_rsi_ob': 93, 'sideways_adx_thresh': 11.697438451922649, 'sideways_atr_min_pct': 0.013351148566129187, 'sideways_atr_max_pct': 0.03067361570279687, 'sideways_tp_mult': 2.0945458821305043, 'sideways_tsl_mult': 0.8131254243428376, 'sideways_time_stop': 33, 'sideways_use_sma': True, 'sideways_use_ema': False, 'sideways_use_atr': False, 'sideways_use_adx': False, 'sideways_use_spike': False, 'sideways_rsi_required': True}.
[I 2025-08-31 11:00:56,842] Trial 516 finished with values: [-1000000000.0, 1000000000.0] and parameters: {'p_sma': 17, 'p_std': 57, 'p_atr': 12, 'p_adx': 27, 'rsi_period': 69, 'ema1': 5, 'ema2': 41, 'slip_atr_k': 0.17838225489322376, 'slip_spread_k': 0.26744607489593963, 'spread_hl_frac': 0.02203343923770075, 'bb_std_mult': 3.5171034572327122, 'rsi_os': 44, 'rsi_ob': 83, 'vol_spike': 0.10261969882736585, 'adx_thresh': 29.222864531522227, 'atr_min_pct': 0.022651132828912082, 'atr_max_pct': 0.047084908514142675, 'tp_mult': 2.34918852223436, 'tsl_mult': 0.14121104094462977, 'strategy': 'mean_reversion', 'time_stop': 167, 'use_sma': True, 'use_atr': False, 'use_adx': True, 'use_ema': True, 'use_spike': True, 'rsi_required': True, 'edge_k': 1.2386086276852637, 'edge_cap': 0.27079990372531676, 'bull_strategy': 'breakout', 'bull_bb_std_mult': 0.8273831995035347, 'bull_rsi_os': 11, 'bull_rsi_ob': 78, 'bull_adx_thresh': 10.21645071794569, 'bull_atr_min_pct': 0.013619105580136927, 'bull_atr_max_pct': 0.0801252030952681, 'bull_tp_mult': 1.7469344931388184, 'bull_tsl_mult': 0.4538727839910394, 'bull_time_stop': 66, 'bull_use_sma': True, 'bull_use_ema': False, 'bull_use_atr': False, 'bull_use_adx': False, 'bull_use_spike': False, 'bull_rsi_required': False, 'bear_strategy': 'mean_reversion', 'bear_bb_std_mult': 3.113842286250964, 'bear_rsi_os': 25, 'bear_rsi_ob': 87, 'bear_adx_thresh': 22.05075693189088, 'bear_atr_min_pct': 0.004583804589058337, 'bear_atr_max_pct': 0.134823785227691, 'bear_tp_mult': 1.4263487386186133, 'bear_tsl_mult': 0.5721384012463265, 'bear_time_stop': 278, 'bear_use_sma': False, 'bear_use_ema': True, 'bear_use_atr': False, 'bear_use_adx': False, 'bear_use_spike': False, 'bear_rsi_required': False, 'sideways_strategy': 'mean_reversion', 'sideways_bb_std_mult': 2.6674121054168918, 'sideways_rsi_os': 31, 'sideways_rsi_ob': 93, 'sideways_adx_thresh': 25.273534841939753, 'sideways_atr_min_pct': 0.013154408302242846, 'sideways_atr_max_pct': 0.1159534788867537, 'sideways_tp_mult': 2.6827820693690665, 'sideways_tsl_mult': 0.414204953761772, 'sideways_time_stop': 35, 'sideways_use_sma': True, 'sideways_use_ema': True, 'sideways_use_atr': False, 'sideways_use_adx': False, 'sideways_use_spike': False, 'sideways_rsi_required': True}.
[I 2025-08-31 11:00:56,941] Trial 515 finished with values: [-1000000000.0, 1000000000.0] and parameters: {'p_sma': 24, 'p_std': 27, 'p_atr': 13, 'p_adx': 13, 'rsi_period': 15, 'ema1': 12, 'ema2': 37, 'slip_atr_k': 0.018713653706834157, 'slip_spread_k': 0.6786966092754287, 'spread_hl_frac': 0.024025069214766284, 'bb_std_mult': 1.6810130152934897, 'rsi_os': 25, 'rsi_ob': 76, 'vol_spike': 0.25979276559327724, 'adx_thresh': 29.37009454120152, 'atr_min_pct': 0.012544684950837395, 'atr_max_pct': 0.05035836611713411, 'tp_mult': 1.2417125087710068, 'tsl_mult': 0.7159589323538229, 'strategy': 'mean_reversion', 'time_stop': 89, 'use_sma': False, 'use_atr': False, 'use_adx': True, 'use_ema': True, 'use_spike': True, 'rsi_required': True, 'edge_k': 0.10712394072616865, 'edge_cap': 0.4890160527124622, 'bull_strategy': 'breakout', 'bull_bb_std_mult': 0.7138515729903616, 'bull_rsi_os': 7, 'bull_rsi_ob': 68, 'bull_adx_thresh': 5.641693797218377, 'bull_atr_min_pct': 0.020891561401208115, 'bull_atr_max_pct': 0.12045043571921471, 'bull_tp_mult': 1.7656049207929254, 'bull_tsl_mult': 0.4110752837072089, 'bull_time_stop': 67, 'bull_use_sma': False, 'bull_use_ema': False, 'bull_use_atr': False, 'bull_use_adx': True, 'bull_use_spike': False, 'bull_rsi_required': False, 'bear_strategy': 'mean_reversion', 'bear_bb_std_mult': 1.9221436885693641, 'bear_rsi_os': 38, 'bear_rsi_ob': 82, 'bear_adx_thresh': 5.718029444295224, 'bear_atr_min_pct': 0.005714008927492889, 'bear_atr_max_pct': 0.14359103281557417, 'bear_tp_mult': 2.553370664257388, 'bear_tsl_mult': 0.9811618630274035, 'bear_time_stop': 154, 'bear_use_sma': False, 'bear_use_ema': True, 'bear_use_atr': False, 'bear_use_adx': False, 'bear_use_spike': True, 'bear_rsi_required': False, 'sideways_strategy': 'mean_reversion', 'sideways_bb_std_mult': 2.7824078600254025, 'sideways_rsi_os': 43, 'sideways_rsi_ob': 61, 'sideways_adx_thresh': 11.328896987042567, 'sideways_atr_min_pct': 0.013213461190550085, 'sideways_atr_max_pct': 0.07133229927937251, 'sideways_tp_mult': 1.9077133272944147, 'sideways_tsl_mult': 0.16697405204655152, 'sideways_time_stop': 237, 'sideways_use_sma': True, 'sideways_use_ema': False, 'sideways_use_atr': False, 'sideways_use_adx': False, 'sideways_use_spike': False, 'sideways_rsi_required': True}.
[I 2025-08-31 11:01:29,336] Trial 519 finished with values: [-1000000000.0, 1000000000.0] and parameters: {'p_sma': 49, 'p_std': 50, 'p_atr': 8, 'p_adx': 27, 'rsi_period': 84, 'ema1': 13, 'ema2': 47, 'slip_atr_k': 0.17454334177445135, 'slip_spread_k': 0.8297089459920926, 'spread_hl_frac': 0.019006345320080636, 'bb_std_mult': 3.5126116073605855, 'rsi_os': 23, 'rsi_ob': 76, 'vol_spike': 0.2648721197442026, 'adx_thresh': 29.159695938706076, 'atr_min_pct': 0.011062693970387102, 'atr_max_pct': 0.09900960092684677, 'tp_mult': 2.6659659175942796, 'tsl_mult': 0.1960238392770751, 'strategy': 'breakout', 'time_stop': 167, 'use_sma': True, 'use_atr': False, 'use_adx': True, 'use_ema': True, 'use_spike': True, 'rsi_required': True, 'edge_k': 0.12293805359247943, 'edge_cap': 0.5204416510179755, 'bull_strategy': 'mean_reversion', 'bull_bb_std_mult': 0.781406635053091, 'bull_rsi_os': 11, 'bull_rsi_ob': 74, 'bull_adx_thresh': 7.582691350699578, 'bull_atr_min_pct': 0.005299388073003485, 'bull_atr_max_pct': 0.07951278086314141, 'bull_tp_mult': 1.7517645593888964, 'bull_tsl_mult': 0.2433962220641926, 'bull_time_stop': 151, 'bull_use_sma': True, 'bull_use_ema': False, 'bull_use_atr': False, 'bull_use_adx': False, 'bull_use_spike': False, 'bull_rsi_required': False, 'bear_strategy': 'mean_reversion', 'bear_bb_std_mult': 1.5987245665376977, 'bear_rsi_os': 20, 'bear_rsi_ob': 87, 'bear_adx_thresh': 29.586465620012603, 'bear_atr_min_pct': 0.017221574253768985, 'bear_atr_max_pct': 0.1138426015332614, 'bear_tp_mult': 1.4259719124757853, 'bear_tsl_mult': 0.15864616902678058, 'bear_time_stop': 5, 'bear_use_sma': False, 'bear_use_ema': True, 'bear_use_atr': False, 'bear_use_adx': False, 'bear_use_spike': True, 'bear_rsi_required': False, 'sideways_strategy': 'mean_reversion', 'sideways_bb_std_mult': 2.844716990470296, 'sideways_rsi_os': 8, 'sideways_rsi_ob': 92, 'sideways_adx_thresh': 25.115541846810423, 'sideways_atr_min_pct': 0.01177891112622294, 'sideways_atr_max_pct': 0.028998318266000522, 'sideways_tp_mult': 1.9073650683175636, 'sideways_tsl_mult': 0.5874695015319445, 'sideways_time_stop': 159, 'sideways_use_sma': False, 'sideways_use_ema': False, 'sideways_use_atr': False, 'sideways_use_adx': False, 'sideways_use_spike': False, 'sideways_rsi_required': True}.
[I 2025-08-31 11:01:29,866] Trial 521 finished with values: [-1000000000.0, 1000000000.0] and parameters: {'p_sma': 15, 'p_std': 30, 'p_atr': 14, 'p_adx': 9, 'rsi_period': 64, 'ema1': 13, 'ema2': 27, 'slip_atr_k': 0.21061424267949969, 'slip_spread_k': 0.8426149224663355, 'spread_hl_frac': 0.008792565252356893, 'bb_std_mult': 2.9124209905961904, 'rsi_os': 18, 'rsi_ob': 78, 'vol_spike': 0.028272380783063475, 'adx_thresh': 30.39187081852133, 'atr_min_pct': 0.010802309242963827, 'atr_max_pct': 0.03570388979266258, 'tp_mult': 2.517925943299719, 'tsl_mult': 0.28875672255983387, 'strategy': 'breakout', 'time_stop': 58, 'use_sma': True, 'use_atr': True, 'use_adx': False, 'use_ema': True, 'use_spike': False, 'rsi_required': False, 'edge_k': 0.1310242404559871, 'edge_cap': 0.5021622854432694, 'bull_strategy': 'mean_reversion', 'bull_bb_std_mult': 3.5453026467907502, 'bull_rsi_os': 28, 'bull_rsi_ob': 76, 'bull_adx_thresh': 7.256494325208436, 'bull_atr_min_pct': 0.023609208597993644, 'bull_atr_max_pct': 0.08893550754192305, 'bull_tp_mult': 1.6359753354192699, 'bull_tsl_mult': 0.43082467826321413, 'bull_time_stop': 61, 'bull_use_sma': True, 'bull_use_ema': True, 'bull_use_atr': True, 'bull_use_adx': False, 'bull_use_spike': True, 'bull_rsi_required': True, 'bear_strategy': 'breakout', 'bear_bb_std_mult': 1.5868733182589967, 'bear_rsi_os': 40, 'bear_rsi_ob': 50, 'bear_adx_thresh': 9.718620163337365, 'bear_atr_min_pct': 0.017386144834478996, 'bear_atr_max_pct': 0.13681615593547258, 'bear_tp_mult': 2.713810448097366, 'bear_tsl_mult': 0.9979947507311953, 'bear_time_stop': 178, 'bear_use_sma': False, 'bear_use_ema': False, 'bear_use_atr': True, 'bear_use_adx': False, 'bear_use_spike': True, 'bear_rsi_required': True, 'sideways_strategy': 'breakout', 'sideways_bb_std_mult': 2.9591865988942168, 'sideways_rsi_os': 8, 'sideways_rsi_ob': 92, 'sideways_adx_thresh': 33.59746138318717, 'sideways_atr_min_pct': 0.02429516569140012, 'sideways_atr_max_pct': 0.0753966162759369, 'sideways_tp_mult': 1.9116524738276026, 'sideways_tsl_mult': 0.5800248590290806, 'sideways_time_stop': 26, 'sideways_use_sma': False, 'sideways_use_ema': False, 'sideways_use_atr': True, 'sideways_use_adx': True, 'sideways_use_spike': True, 'sideways_rsi_required': False}.
[I 2025-08-31 11:01:29,872] Trial 520 finished with values: [-1000000000.0, 1000000000.0] and parameters: {'p_sma': 15, 'p_std': 18, 'p_atr': 11, 'p_adx': 12, 'rsi_period': 84, 'ema1': 27, 'ema2': 27, 'slip_atr_k': 0.20964314994149014, 'slip_spread_k': 0.6814047665494779, 'spread_hl_frac': 0.008559677903747145, 'bb_std_mult': 0.9645481989522193, 'rsi_os': 44, 'rsi_ob': 78, 'vol_spike': 0.2146441051677044, 'adx_thresh': 26.009230639592417, 'atr_min_pct': 0.0116351323242237, 'atr_max_pct': 0.09063379281687234, 'tp_mult': 2.6758486699943704, 'tsl_mult': 0.28786121574130247, 'strategy': 'breakout', 'time_stop': 163, 'use_sma': True, 'use_atr': True, 'use_adx': False, 'use_ema': True, 'use_spike': True, 'rsi_required': False, 'edge_k': 1.2295461874767015, 'edge_cap': 0.5060666854197075, 'bull_strategy': 'mean_reversion', 'bull_bb_std_mult': 2.9055638271538924, 'bull_rsi_os': 24, 'bull_rsi_ob': 82, 'bull_adx_thresh': 15.753040371913754, 'bull_atr_min_pct': 0.01583398280672992, 'bull_atr_max_pct': 0.08898454424192571, 'bull_tp_mult': 1.6224488029267585, 'bull_tsl_mult': 0.887740954352395, 'bull_time_stop': 151, 'bull_use_sma': True, 'bull_use_ema': False, 'bull_use_atr': True, 'bull_use_adx': False, 'bull_use_spike': False, 'bull_rsi_required': True, 'bear_strategy': 'breakout', 'bear_bb_std_mult': 1.5902606764154141, 'bear_rsi_os': 40, 'bear_rsi_ob': 86, 'bear_adx_thresh': 7.4531734940152194, 'bear_atr_min_pct': 0.004207904697414368, 'bear_atr_max_pct': 0.1351253568108957, 'bear_tp_mult': 2.7265714422822738, 'bear_tsl_mult': 0.9848288719399856, 'bear_time_stop': 215, 'bear_use_sma': False, 'bear_use_ema': False, 'bear_use_atr': True, 'bear_use_adx': False, 'bear_use_spike': True, 'bear_rsi_required': False, 'sideways_strategy': 'mean_reversion', 'sideways_bb_std_mult': 2.85114032502884, 'sideways_rsi_os': 24, 'sideways_rsi_ob': 61, 'sideways_adx_thresh': 19.83989863292037, 'sideways_atr_min_pct': 0.02139702738015632, 'sideways_atr_max_pct': 0.07292708104882017, 'sideways_tp_mult': 1.408409667177995, 'sideways_tsl_mult': 0.07139673551812417, 'sideways_time_stop': 84, 'sideways_use_sma': False, 'sideways_use_ema': False, 'sideways_use_atr': False, 'sideways_use_adx': True, 'sideways_use_spike': True, 'sideways_rsi_required': True}.
