[I 2025-08-31 11:25:41,726] Trial 700 finished with values: [-0.009165666093422398, 0.00912328711582585] and parameters: {'p_sma': 12, 'p_std': 24, 'p_atr': 21, 'p_adx': 14, 'rsi_period': 53, 'ema1': 10, 'ema2': 40, 'slip_atr_k': 0.03533190521407199, 'slip_spread_k': 0.21117375896703044, 'spread_hl_frac': 0.006549269725699297, 'bb_std_mult': 2.8467828621457025, 'rsi_os': 32, 'rsi_ob': 91, 'vol_spike': 0.2806527566234141, 'adx_thresh': 32.62462177099911, 'atr_min_pct': 0.011108531692190237, 'atr_max_pct': 0.14421943196858777, 'tp_mult': 1.6362807958428662, 'tsl_mult': 0.13836702790583444, 'strategy': 'breakout', 'time_stop': 212, 'use_sma': True, 'use_atr': True, 'use_adx': False, 'use_ema': True, 'use_spike': True, 'rsi_required': False, 'edge_k': 0.35774466571818836, 'edge_cap': 0.5299970861575006, 'bull_strategy': 'breakout', 'bull_bb_std_mult': 0.6354179994958249, 'bull_rsi_os': 13, 'bull_rsi_ob': 82, 'bull_adx_thresh': 5.082598368121262, 'bull_atr_min_pct': 0.004121470370385152, 'bull_atr_max_pct': 0.1008835954438506, 'bull_tp_mult': 1.8288657892243496, 'bull_tsl_mult': 0.4149586107308112, 'bull_time_stop': 290, 'bull_use_sma': False, 'bull_use_ema': True, 'bull_use_atr': True, 'bull_use_adx': False, 'bull_use_spike': False, 'bull_rsi_required': True, 'bear_strategy': 'breakout', 'bear_bb_std_mult': 3.4593261886630047, 'bear_rsi_os': 53, 'bear_rsi_ob': 74, 'bear_adx_thresh': 6.092315812374972, 'bear_atr_min_pct': 0.003959510611483143, 'bear_atr_max_pct': 0.14116559996202632, 'bear_tp_mult': 1.7167188226350878, 'bear_tsl_mult': 0.72692384005698, 'bear_time_stop': 62, 'bear_use_sma': False, 'bear_use_ema': True, 'bear_use_atr': False, 'bear_use_adx': False, 'bear_use_spike': False, 'bear_rsi_required': False, 'sideways_strategy': 'breakout', 'sideways_bb_std_mult': 2.881220519542053, 'sideways_rsi_os': 26, 'sideways_rsi_ob': 94, 'sideways_adx_thresh': 9.572531531979841, 'sideways_atr_min_pct': 0.016415515929428647, 'sideways_atr_max_pct': 0.14808098411084164, 'sideways_tp_mult': 1.7867484055522977, 'sideways_tsl_mult': 0.3775005408505168, 'sideways_time_stop': 5, 'sideways_use_sma': False, 'sideways_use_ema': True, 'sideways_use_atr': True, 'sideways_use_adx': False, 'sideways_use_spike': True, 'sideways_rsi_required': True}.
[I 2025-08-31 11:25:41,740] Trial 701 finished with values: [-0.008858308252171265, 0.008907821134944245] and parameters: {'p_sma': 12, 'p_std': 24, 'p_atr': 21, 'p_adx': 14, 'rsi_period': 55, 'ema1': 11, 'ema2': 41, 'slip_atr_k': 0.030379581772357875, 'slip_spread_k': 0.18873624042642875, 'spread_hl_frac': 0.004724168613915785, 'bb_std_mult': 2.892425807785419, 'rsi_os': 29, 'rsi_ob': 95, 'vol_spike': 0.2778245777820515, 'adx_thresh': 31.15726147155097, 'atr_min_pct': 0.0111309744415853, 'atr_max_pct': 0.14999695971413932, 'tp_mult': 1.735962238214005, 'tsl_mult': 0.08542831216469532, 'strategy': 'breakout', 'time_stop': 212, 'use_sma': True, 'use_atr': False, 'use_adx': True, 'use_ema': True, 'use_spike': True, 'rsi_required': False, 'edge_k': 0.3576440561753447, 'edge_cap': 0.5145634249265735, 'bull_strategy': 'breakout', 'bull_bb_std_mult': 0.5079101837861846, 'bull_rsi_os': 13, 'bull_rsi_ob': 82, 'bull_adx_thresh': 5.101421048900799, 'bull_atr_min_pct': 0.004007959204360445, 'bull_atr_max_pct': 0.10083248643787585, 'bull_tp_mult': 1.913843277555098, 'bull_tsl_mult': 0.4259906250001293, 'bull_time_stop': 286, 'bull_use_sma': False, 'bull_use_ema': True, 'bull_use_atr': False, 'bull_use_adx': False, 'bull_use_spike': False, 'bull_rsi_required': True, 'bear_strategy': 'breakout', 'bear_bb_std_mult': 3.279180225514159, 'bear_rsi_os': 54, 'bear_rsi_ob': 75, 'bear_adx_thresh': 6.217359983587532, 'bear_atr_min_pct': 0.004142179187203221, 'bear_atr_max_pct': 0.13452421666346748, 'bear_tp_mult': 2.1037012445647654, 'bear_tsl_mult': 0.7305064100419643, 'bear_time_stop': 73, 'bear_use_sma': True, 'bear_use_ema': True, 'bear_use_atr': False, 'bear_use_adx': False, 'bear_use_spike': False, 'bear_rsi_required': False, 'sideways_strategy': 'breakout', 'sideways_bb_std_mult': 2.863324933807918, 'sideways_rsi_os': 26, 'sideways_rsi_ob': 94, 'sideways_adx_thresh': 12.806728330012536, 'sideways_atr_min_pct': 0.016537551528445847, 'sideways_atr_max_pct': 0.04219868748857442, 'sideways_tp_mult': 2.4510032464747855, 'sideways_tsl_mult': 0.37681854551608707, 'sideways_time_stop': 5, 'sideways_use_sma': False, 'sideways_use_ema': False, 'sideways_use_atr': True, 'sideways_use_adx': True, 'sideways_use_spike': True, 'sideways_rsi_required': True}.
[I 2025-08-31 11:26:15,680] Trial 706 finished with values: [-1000000000.0, 1000000000.0] and parameters: {'p_sma': 11, 'p_std': 30, 'p_atr': 23, 'p_adx': 13, 'rsi_period': 55, 'ema1': 11, 'ema2': 43, 'slip_atr_k': 0.031099921970095645, 'slip_spread_k': 0.18690448421625333, 'spread_hl_frac': 0.006910662711614623, 'bb_std_mult': 2.8443013672007895, 'rsi_os': 31, 'rsi_ob': 95, 'vol_spike': 0.2768310338858959, 'adx_thresh': 32.462530150435335, 'atr_min_pct': 0.012221282359793978, 'atr_max_pct': 0.1482780556979974, 'tp_mult': 1.7088889769853253, 'tsl_mult': 0.07720200774770156, 'strategy': 'breakout', 'time_stop': 193, 'use_sma': True, 'use_atr': False, 'use_adx': True, 'use_ema': True, 'use_spike': True, 'rsi_required': False, 'edge_k': 0.35540219413042656, 'edge_cap': 0.5197511318466972, 'bull_strategy': 'mean_reversion', 'bull_bb_std_mult': 0.6429989136664823, 'bull_rsi_os': 13, 'bull_rsi_ob': 84, 'bull_adx_thresh': 5.684634242281894, 'bull_atr_min_pct': 0.004043557491374898, 'bull_atr_max_pct': 0.10129308527944772, 'bull_tp_mult': 1.9023290104677009, 'bull_tsl_mult': 0.4009960298194227, 'bull_time_stop': 288, 'bull_use_sma': False, 'bull_use_ema': True, 'bull_use_atr': False, 'bull_use_adx': False, 'bull_use_spike': False, 'bull_rsi_required': True, 'bear_strategy': 'breakout', 'bear_bb_std_mult': 3.0868334224603484, 'bear_rsi_os': 55, 'bear_rsi_ob': 75, 'bear_adx_thresh': 6.034029498329185, 'bear_atr_min_pct': 0.0041074285202046005, 'bear_atr_max_pct': 0.13494604231551433, 'bear_tp_mult': 1.7724708077806925, 'bear_tsl_mult': 0.7626057553005513, 'bear_time_stop': 134, 'bear_use_sma': False, 'bear_use_ema': True, 'bear_use_atr': False, 'bear_use_adx': False, 'bear_use_spike': False, 'bear_rsi_required': False, 'sideways_strategy': 'breakout', 'sideways_bb_std_mult': 2.8408915543199473, 'sideways_rsi_os': 23, 'sideways_rsi_ob': 94, 'sideways_adx_thresh': 13.055803593777174, 'sideways_atr_min_pct': 0.01645862153195732, 'sideways_atr_max_pct': 0.04748406450664509, 'sideways_tp_mult': 2.8072246629566315, 'sideways_tsl_mult': 0.3778998680248418, 'sideways_time_stop': 5, 'sideways_use_sma': False, 'sideways_use_ema': False, 'sideways_use_atr': True, 'sideways_use_adx': False, 'sideways_use_spike': True, 'sideways_rsi_required': True}.
[I 2025-08-31 11:26:15,859] Trial 704 finished with values: [-0.008893514281739456, 0.009445630387060427] and parameters: {'p_sma': 12, 'p_std': 21, 'p_atr': 23, 'p_adx': 13, 'rsi_period': 55, 'ema1': 11, 'ema2': 42, 'slip_atr_k': 0.03247663163003815, 'slip_spread_k': 0.18621785968051013, 'spread_hl_frac': 0.0069386376577230055, 'bb_std_mult': 2.807804806746003, 'rsi_os': 30, 'rsi_ob': 95, 'vol_spike': 0.2808347037525803, 'adx_thresh': 32.238370192921295, 'atr_min_pct': 0.01215237530644833, 'atr_max_pct': 0.1499356493513233, 'tp_mult': 1.6200239366744644, 'tsl_mult': 0.073070192773061, 'strategy': 'breakout', 'time_stop': 191, 'use_sma': True, 'use_atr': False, 'use_adx': True, 'use_ema': True, 'use_spike': True, 'rsi_required': False, 'edge_k': 0.3339175312852373, 'edge_cap': 0.5133240786695978, 'bull_strategy': 'breakout', 'bull_bb_std_mult': 0.542876268175283, 'bull_rsi_os': 13, 'bull_rsi_ob': 82, 'bull_adx_thresh': 5.6764114990296815, 'bull_atr_min_pct': 0.003895116330130539, 'bull_atr_max_pct': 0.10084607735457475, 'bull_tp_mult': 1.8730651399621525, 'bull_tsl_mult': 0.398550378485789, 'bull_time_stop': 287, 'bull_use_sma': False, 'bull_use_ema': True, 'bull_use_atr': False, 'bull_use_adx': False, 'bull_use_spike': False, 'bull_rsi_required': True, 'bear_strategy': 'breakout', 'bear_bb_std_mult': 3.0821793532362105, 'bear_rsi_os': 52, 'bear_rsi_ob': 75, 'bear_adx_thresh': 6.1319651359288585, 'bear_atr_min_pct': 0.004101784873614966, 'bear_atr_max_pct': 0.13621437420284022, 'bear_tp_mult': 2.115924452823413, 'bear_tsl_mult': 0.7205950574844849, 'bear_time_stop': 184, 'bear_use_sma': False, 'bear_use_ema': True, 'bear_use_atr': False, 'bear_use_adx': False, 'bear_use_spike': False, 'bear_rsi_required': False, 'sideways_strategy': 'breakout', 'sideways_bb_std_mult': 2.8458541627375915, 'sideways_rsi_os': 27, 'sideways_rsi_ob': 94, 'sideways_adx_thresh': 8.991705630722578, 'sideways_atr_min_pct': 0.016514397693776328, 'sideways_atr_max_pct': 0.08284211908265134, 'sideways_tp_mult': 1.8324433536018196, 'sideways_tsl_mult': 0.34362035906000304, 'sideways_time_stop': 5, 'sideways_use_sma': False, 'sideways_use_ema': False, 'sideways_use_atr': True, 'sideways_use_adx': False, 'sideways_use_spike': True, 'sideways_rsi_required': True}.
[I 2025-08-31 11:26:16,316] Trial 705 finished with values: [-0.01570340209033183, 0.01593241476356433] and parameters: {'p_sma': 12, 'p_std': 17, 'p_atr': 10, 'p_adx': 14, 'rsi_period': 52, 'ema1': 12, 'ema2': 43, 'slip_atr_k': 0.033075093967770246, 'slip_spread_k': 0.18241169184809952, 'spread_hl_frac': 0.006973097887951197, 'bb_std_mult': 2.8090191858752362, 'rsi_os': 31, 'rsi_ob': 95, 'vol_spike': 0.2777562951402387, 'adx_thresh': 32.849987075353766, 'atr_min_pct': 0.012205359634242751, 'atr_max_pct': 0.14984261927397682, 'tp_mult': 1.6101518575700937, 'tsl_mult': 0.07683937651823236, 'strategy': 'breakout', 'time_stop': 192, 'use_sma': True, 'use_atr': False, 'use_adx': True, 'use_ema': True, 'use_spike': True, 'rsi_required': False, 'edge_k': 0.3405257871102668, 'edge_cap': 0.5120852365339101, 'bull_strategy': 'breakout', 'bull_bb_std_mult': 0.5451832158410181, 'bull_rsi_os': 13, 'bull_rsi_ob': 82, 'bull_adx_thresh': 5.011926663084505, 'bull_atr_min_pct': 0.003849532461994351, 'bull_atr_max_pct': 0.10201623368164711, 'bull_tp_mult': 1.888590977747988, 'bull_tsl_mult': 0.39839634845336597, 'bull_time_stop': 289, 'bull_use_sma': False, 'bull_use_ema': True, 'bull_use_atr': False, 'bull_use_adx': False, 'bull_use_spike': False, 'bull_rsi_required': True, 'bear_strategy': 'breakout', 'bear_bb_std_mult': 3.118226698426186, 'bear_rsi_os': 55, 'bear_rsi_ob': 74, 'bear_adx_thresh': 19.369996349658585, 'bear_atr_min_pct': 0.004220477525427529, 'bear_atr_max_pct': 0.13847896799466936, 'bear_tp_mult': 2.1166065813505255, 'bear_tsl_mult': 0.7646091639577032, 'bear_time_stop': 134, 'bear_use_sma': False, 'bear_use_ema': True, 'bear_use_atr': False, 'bear_use_adx': False, 'bear_use_spike': False, 'bear_rsi_required': False, 'sideways_strategy': 'breakout', 'sideways_bb_std_mult': 2.8400451493955465, 'sideways_rsi_os': 25, 'sideways_rsi_ob': 94, 'sideways_adx_thresh': 9.734920101465404, 'sideways_atr_min_pct': 0.016612651235568116, 'sideways_atr_max_pct': 0.14854495440878257, 'sideways_tp_mult': 1.9403154489600163, 'sideways_tsl_mult': 0.38144944912545836, 'sideways_time_stop': 5, 'sideways_use_sma': False, 'sideways_use_ema': False, 'sideways_use_atr': True, 'sideways_use_adx': False, 'sideways_use_spike': True, 'sideways_rsi_required': True}.
[I 2025-08-31 11:26:16,316] Trial 707 finished with values: [-0.04184801865172827, 0.04178765854860426] and parameters: {'p_sma': 13, 'p_std': 30, 'p_atr': 12, 'p_adx': 13, 'rsi_period': 52, 'ema1': 12, 'ema2': 43, 'slip_atr_k': 0.03183158864725467, 'slip_spread_k': 0.18723150442404812, 'spread_hl_frac': 0.007064209953244527, 'bb_std_mult': 2.829875067562842, 'rsi_os': 32, 'rsi_ob': 95, 'vol_spike': 0.2784388525169314, 'adx_thresh': 33.037351856104664, 'atr_min_pct': 0.012032954577095988, 'atr_max_pct': 0.14994592967685363, 'tp_mult': 1.753333031158187, 'tsl_mult': 0.07468338003009659, 'strategy': 'breakout', 'time_stop': 193, 'use_sma': False, 'use_atr': True, 'use_adx': False, 'use_ema': True, 'use_spike': False, 'rsi_required': False, 'edge_k': 0.3590175171937315, 'edge_cap': 0.5060164579764594, 'bull_strategy': 'mean_reversion', 'bull_bb_std_mult': 0.6484663952559719, 'bull_rsi_os': 12, 'bull_rsi_ob': 81, 'bull_adx_thresh': 5.874635914988367, 'bull_atr_min_pct': 0.028867081698571214, 'bull_atr_max_pct': 0.09662134814386471, 'bull_tp_mult': 1.9154796057155992, 'bull_tsl_mult': 0.9437590628761374, 'bull_time_stop': 290, 'bull_use_sma': False, 'bull_use_ema': True, 'bull_use_atr': False, 'bull_use_adx': False, 'bull_use_spike': False, 'bull_rsi_required': True, 'bear_strategy': 'breakout', 'bear_bb_std_mult': 3.0842969374113696, 'bear_rsi_os': 55, 'bear_rsi_ob': 74, 'bear_adx_thresh': 5.82509027604734, 'bear_atr_min_pct': 0.0024515502366180345, 'bear_atr_max_pct': 0.13795801766510446, 'bear_tp_mult': 2.850058350534032, 'bear_tsl_mult': 0.7148473261977059, 'bear_time_stop': 91, 'bear_use_sma': False, 'bear_use_ema': True, 'bear_use_atr': False, 'bear_use_adx': False, 'bear_use_spike': False, 'bear_rsi_required': False, 'sideways_strategy': 'breakout', 'sideways_bb_std_mult': 2.8349456664688413, 'sideways_rsi_os': 26, 'sideways_rsi_ob': 94, 'sideways_adx_thresh': 10.069850541985117, 'sideways_atr_min_pct': 0.016791150884867902, 'sideways_atr_max_pct': 0.07770155456790105, 'sideways_tp_mult': 1.9395119936844634, 'sideways_tsl_mult': 0.3518799328509671, 'sideways_time_stop': 5, 'sideways_use_sma': False, 'sideways_use_ema': False, 'sideways_use_atr': True, 'sideways_use_adx': False, 'sideways_use_spike': True, 'sideways_rsi_required': True}.
[I 2025-08-31 11:26:50,587] Trial 708 finished with values: [-1000000000.0, 1000000000.0] and parameters: {'p_sma': 12, 'p_std': 28, 'p_atr': 12, 'p_adx': 19, 'rsi_period': 52, 'ema1': 12, 'ema2': 43, 'slip_atr_k': 0.03173512818869817, 'slip_spread_k': 0.13887405878479678, 'spread_hl_frac': 0.0068310145316876035, 'bb_std_mult': 2.8225710948861367, 'rsi_os': 29, 'rsi_ob': 94, 'vol_spike': 0.28001599333002203, 'adx_thresh': 32.885154894828545, 'atr_min_pct': 0.012111454585289538, 'atr_max_pct': 0.1497278655060877, 'tp_mult': 1.7612565554855963, 'tsl_mult': 0.06065419926543657, 'strategy': 'breakout', 'time_stop': 203, 'use_sma': True, 'use_atr': True, 'use_adx': False, 'use_ema': False, 'use_spike': False, 'rsi_required': False, 'edge_k': 0.41155437943544615, 'edge_cap': 0.5028222530896043, 'bull_strategy': 'breakout', 'bull_bb_std_mult': 0.6845229218889964, 'bull_rsi_os': 12, 'bull_rsi_ob': 86, 'bull_adx_thresh': 5.700928077415625, 'bull_atr_min_pct': 0.004058836898603148, 'bull_atr_max_pct': 0.09585982020670095, 'bull_tp_mult': 1.8401000514809236, 'bull_tsl_mult': 0.14250801418852438, 'bull_time_stop': 292, 'bull_use_sma': False, 'bull_use_ema': True, 'bull_use_atr': True, 'bull_use_adx': True, 'bull_use_spike': False, 'bull_rsi_required': False, 'bear_strategy': 'mean_reversion', 'bear_bb_std_mult': 3.1614826700459333, 'bear_rsi_os': 53, 'bear_rsi_ob': 74, 'bear_adx_thresh': 5.018423471810923, 'bear_atr_min_pct': 0.004020115068716975, 'bear_atr_max_pct': 0.13830111235747417, 'bear_tp_mult': 1.4028973257974597, 'bear_tsl_mult': 0.7256753083018151, 'bear_time_stop': 171, 'bear_use_sma': False, 'bear_use_ema': True, 'bear_use_atr': True, 'bear_use_adx': True, 'bear_use_spike': False, 'bear_rsi_required': False, 'sideways_strategy': 'breakout', 'sideways_bb_std_mult': 2.827946331765678, 'sideways_rsi_os': 27, 'sideways_rsi_ob': 94, 'sideways_adx_thresh': 10.157761402915709, 'sideways_atr_min_pct': 0.01562847783617973, 'sideways_atr_max_pct': 0.12642896767448292, 'sideways_tp_mult': 1.929444895626638, 'sideways_tsl_mult': 0.35012126346329514, 'sideways_time_stop': 10, 'sideways_use_sma': False, 'sideways_use_ema': True, 'sideways_use_atr': True, 'sideways_use_adx': False, 'sideways_use_spike': True, 'sideways_rsi_required': True}.
[I 2025-08-31 11:26:50,629] Trial 710 finished with values: [-1000000000.0, 1000000000.0] and parameters: {'p_sma': 12, 'p_std': 27, 'p_atr': 18, 'p_adx': 19, 'rsi_period': 53, 'ema1': 11, 'ema2': 42, 'slip_atr_k': 0.04993975541450636, 'slip_spread_k': 0.13379985464937746, 'spread_hl_frac': 0.00659992909355926, 'bb_std_mult': 2.8835008704698395, 'rsi_os': 29, 'rsi_ob': 94, 'vol_spike': 0.2877298232634755, 'adx_thresh': 31.130168999236417, 'atr_min_pct': 0.011274881898752299, 'atr_max_pct': 0.14669104469935526, 'tp_mult': 1.6475669917127678, 'tsl_mult': 0.05558283627261868, 'strategy': 'breakout', 'time_stop': 203, 'use_sma': True, 'use_atr': True, 'use_adx': False, 'use_ema': False, 'use_spike': False, 'rsi_required': False, 'edge_k': 0.40332227494758877, 'edge_cap': 0.5589484781946009, 'bull_strategy': 'breakout', 'bull_bb_std_mult': 0.6614346405854198, 'bull_rsi_os': 12, 'bull_rsi_ob': 86, 'bull_adx_thresh': 5.716100332205716, 'bull_atr_min_pct': 0.005086267248719173, 'bull_atr_max_pct': 0.09801333293795622, 'bull_tp_mult': 1.8202959802120924, 'bull_tsl_mult': 0.41657664722227594, 'bull_time_stop': 295, 'bull_use_sma': False, 'bull_use_ema': True, 'bull_use_atr': True, 'bull_use_adx': True, 'bull_use_spike': False, 'bull_rsi_required': False, 'bear_strategy': 'mean_reversion', 'bear_bb_std_mult': 3.171080005051806, 'bear_rsi_os': 53, 'bear_rsi_ob': 75, 'bear_adx_thresh': 6.077948928859114, 'bear_atr_min_pct': 0.003938177872508233, 'bear_atr_max_pct': 0.1407571568757446, 'bear_tp_mult': 1.8901498284456155, 'bear_tsl_mult': 0.72867132032267, 'bear_time_stop': 194, 'bear_use_sma': False, 'bear_use_ema': True, 'bear_use_atr': True, 'bear_use_adx': True, 'bear_use_spike': False, 'bear_rsi_required': False, 'sideways_strategy': 'breakout', 'sideways_bb_std_mult': 3.1108372652727208, 'sideways_rsi_os': 23, 'sideways_rsi_ob': 95, 'sideways_adx_thresh': 11.030522466674222, 'sideways_atr_min_pct': 0.015302256392620759, 'sideways_atr_max_pct': 0.1319823307301667, 'sideways_tp_mult': 2.451894022157774, 'sideways_tsl_mult': 0.34934360152280663, 'sideways_time_stop': 5, 'sideways_use_sma': False, 'sideways_use_ema': True, 'sideways_use_atr': True, 'sideways_use_adx': False, 'sideways_use_spike': True, 'sideways_rsi_required': True}.
[I 2025-08-31 11:26:50,853] Trial 711 finished with values: [-1000000000.0, 1000000000.0] and parameters: {'p_sma': 12, 'p_std': 54, 'p_atr': 22, 'p_adx': 25, 'rsi_period': 53, 'ema1': 11, 'ema2': 42, 'slip_atr_k': 0.028279781467345017, 'slip_spread_k': 0.13952165322339294, 'spread_hl_frac': 0.005412094048292779, 'bb_std_mult': 2.9137541172567323, 'rsi_os': 29, 'rsi_ob': 94, 'vol_spike': 0.2832490419998493, 'adx_thresh': 32.05984197399333, 'atr_min_pct': 0.011239825454509574, 'atr_max_pct': 0.14618960891391827, 'tp_mult': 1.65227432160811, 'tsl_mult': 0.06051205414085077, 'strategy': 'breakout', 'time_stop': 204, 'use_sma': True, 'use_atr': True, 'use_adx': False, 'use_ema': False, 'use_spike': False, 'rsi_required': False, 'edge_k': 0.42678510580470297, 'edge_cap': 0.5501066015367994, 'bull_strategy': 'breakout', 'bull_bb_std_mult': 0.6679544381635123, 'bull_rsi_os': 14, 'bull_rsi_ob': 86, 'bull_adx_thresh': 5.7559587636055625, 'bull_atr_min_pct': 0.005219705681955974, 'bull_atr_max_pct': 0.09659189120724224, 'bull_tp_mult': 1.8242521617087177, 'bull_tsl_mult': 0.4132915237311956, 'bull_time_stop': 300, 'bull_use_sma': False, 'bull_use_ema': True, 'bull_use_atr': True, 'bull_use_adx': True, 'bull_use_spike': False, 'bull_rsi_required': False, 'bear_strategy': 'mean_reversion', 'bear_bb_std_mult': 3.1727456483698377, 'bear_rsi_os': 53, 'bear_rsi_ob': 75, 'bear_adx_thresh': 12.87591665954244, 'bear_atr_min_pct': 0.003690791466883947, 'bear_atr_max_pct': 0.14045201122101655, 'bear_tp_mult': 2.7922430894744608, 'bear_tsl_mult': 0.733886235278211, 'bear_time_stop': 39, 'bear_use_sma': False, 'bear_use_ema': True, 'bear_use_atr': True, 'bear_use_adx': True, 'bear_use_spike': False, 'bear_rsi_required': False, 'sideways_strategy': 'breakout', 'sideways_bb_std_mult': 0.5819502473335485, 'sideways_rsi_os': 28, 'sideways_rsi_ob': 95, 'sideways_adx_thresh': 11.812745898470563, 'sideways_atr_min_pct': 0.01474575498113046, 'sideways_atr_max_pct': 0.04429486880458587, 'sideways_tp_mult': 1.8669534465067317, 'sideways_tsl_mult': 0.34506869802959533, 'sideways_time_stop': 11, 'sideways_use_sma': False, 'sideways_use_ema': True, 'sideways_use_atr': True, 'sideways_use_adx': False, 'sideways_use_spike': True, 'sideways_rsi_required': True}.
