[I 2025-08-31 11:08:37,841] Trial 576 finished with values: [-0.17139756762550606, 0.17124117068634637] and parameters: {'p_sma': 60, 'p_std': 28, 'p_atr': 21, 'p_adx': 30, 'rsi_period': 48, 'ema1': 14, 'ema2': 56, 'slip_atr_k': 0.10337936905357688, 'slip_spread_k': 0.6262514809111572, 'spread_hl_frac': 0.03019544462024085, 'bb_std_mult': 2.7260581266587782, 'rsi_os': 27, 'rsi_ob': 77, 'vol_spike': 0.14025379641317148, 'adx_thresh': 19.698658997549533, 'atr_min_pct': 0.017241923164239458, 'atr_max_pct': 0.09047440842510329, 'tp_mult': 2.3366962052557616, 'tsl_mult': 0.2504085717873764, 'strategy': 'breakout', 'time_stop': 77, 'use_sma': True, 'use_atr': True, 'use_adx': False, 'use_ema': True, 'use_spike': True, 'rsi_required': False, 'edge_k': 0.13430868150245798, 'edge_cap': 0.7388857236241856, 'bull_strategy': 'mean_reversion', 'bull_bb_std_mult': 1.8751705073444302, 'bull_rsi_os': 8, 'bull_rsi_ob': 74, 'bull_adx_thresh': 9.547877834502055, 'bull_atr_min_pct': 0.004133136515074401, 'bull_atr_max_pct': 0.07283262009438213, 'bull_tp_mult': 1.6099752837595918, 'bull_tsl_mult': 0.19983724669561925, 'bull_time_stop': 71, 'bull_use_sma': False, 'bull_use_ema': True, 'bull_use_atr': True, 'bull_use_adx': False, 'bull_use_spike': True, 'bull_rsi_required': True, 'bear_strategy': 'breakout', 'bear_bb_std_mult': 2.787401041657043, 'bear_rsi_os': 26, 'bear_rsi_ob': 53, 'bear_adx_thresh': 26.082215242129667, 'bear_atr_min_pct': 0.004820567109604341, 'bear_atr_max_pct': 0.11288972402215855, 'bear_tp_mult': 2.735839662953306, 'bear_tsl_mult': 0.5433961596692681, 'bear_time_stop': 89, 'bear_use_sma': True, 'bear_use_ema': False, 'bear_use_atr': True, 'bear_use_adx': False, 'bear_use_spike': True, 'bear_rsi_required': True, 'sideways_strategy': 'breakout', 'sideways_bb_std_mult': 3.2350637431629385, 'sideways_rsi_os': 52, 'sideways_rsi_ob': 89, 'sideways_adx_thresh': 24.27121747236151, 'sideways_atr_min_pct': 0.0005259881325924715, 'sideways_atr_max_pct': 0.04035909607518929, 'sideways_tp_mult': 2.9027068021680225, 'sideways_tsl_mult': 0.11923200672575009, 'sideways_time_stop': 58, 'sideways_use_sma': False, 'sideways_use_ema': True, 'sideways_use_atr': True, 'sideways_use_adx': True, 'sideways_use_spike': True, 'sideways_rsi_required': True}.
[I 2025-08-31 11:09:09,412] Trial 579 finished with values: [-1000000000.0, 1000000000.0] and parameters: {'p_sma': 14, 'p_std': 29, 'p_atr': 26, 'p_adx': 14, 'rsi_period': 62, 'ema1': 13, 'ema2': 57, 'slip_atr_k': 0.07599187737514507, 'slip_spread_k': 0.07948131040135442, 'spread_hl_frac': 0.006780112952755279, 'bb_std_mult': 1.3702653253539159, 'rsi_os': 6, 'rsi_ob': 79, 'vol_spike': 0.2477985557437013, 'adx_thresh': 18.07696456083791, 'atr_min_pct': 0.02575122470427252, 'atr_max_pct': 0.06922927248325034, 'tp_mult': 2.4451633991180737, 'tsl_mult': 0.1802258123240019, 'strategy': 'mean_reversion', 'time_stop': 130, 'use_sma': False, 'use_atr': False, 'use_adx': True, 'use_ema': True, 'use_spike': True, 'rsi_required': True, 'edge_k': 0.1829476660856798, 'edge_cap': 0.46386057584931245, 'bull_strategy': 'breakout', 'bull_bb_std_mult': 0.8143991460503385, 'bull_rsi_os': 7, 'bull_rsi_ob': 67, 'bull_adx_thresh': 7.385792102198629, 'bull_atr_min_pct': 0.0031576667110366774, 'bull_atr_max_pct': 0.02979390514066476, 'bull_tp_mult': 1.6548370505069923, 'bull_tsl_mult': 0.3544411809190184, 'bull_time_stop': 25, 'bull_use_sma': True, 'bull_use_ema': False, 'bull_use_atr': False, 'bull_use_adx': False, 'bull_use_spike': False, 'bull_rsi_required': True, 'bear_strategy': 'breakout', 'bear_bb_std_mult': 1.6227696737068529, 'bear_rsi_os': 22, 'bear_rsi_ob': 81, 'bear_adx_thresh': 17.978468605110674, 'bear_atr_min_pct': 0.005672432592416061, 'bear_atr_max_pct': 0.09071403128672745, 'bear_tp_mult': 1.5895509124577512, 'bear_tsl_mult': 0.5215505912751784, 'bear_time_stop': 32, 'bear_use_sma': False, 'bear_use_ema': True, 'bear_use_atr': False, 'bear_use_adx': False, 'bear_use_spike': False, 'bear_rsi_required': False, 'sideways_strategy': 'mean_reversion', 'sideways_bb_std_mult': 2.7968710220320117, 'sideways_rsi_os': 5, 'sideways_rsi_ob': 84, 'sideways_adx_thresh': 14.162147635089797, 'sideways_atr_min_pct': 0.017796333829005223, 'sideways_atr_max_pct': 0.037670819397390316, 'sideways_tp_mult': 1.9983546221851456, 'sideways_tsl_mult': 0.15069823943571198, 'sideways_time_stop': 34, 'sideways_use_sma': True, 'sideways_use_ema': False, 'sideways_use_atr': False, 'sideways_use_adx': False, 'sideways_use_spike': False, 'sideways_rsi_required': True}.
[I 2025-08-31 11:09:09,501] Trial 580 finished with values: [-0.015616828387045145, 0.014942595135788531] and parameters: {'p_sma': 14, 'p_std': 29, 'p_atr': 11, 'p_adx': 29, 'rsi_period': 55, 'ema1': 13, 'ema2': 49, 'slip_atr_k': 0.06800683046008613, 'slip_spread_k': 0.6619504292756743, 'spread_hl_frac': 0.0017302385351114433, 'bb_std_mult': 2.8076723177396783, 'rsi_os': 13, 'rsi_ob': 89, 'vol_spike': 0.24833392095256437, 'adx_thresh': 29.750026335148036, 'atr_min_pct': 0.006355212058903289, 'atr_max_pct': 0.06992669377679733, 'tp_mult': 2.440280781131408, 'tsl_mult': 0.3039085858672075, 'strategy': 'mean_reversion', 'time_stop': 72, 'use_sma': False, 'use_atr': False, 'use_adx': True, 'use_ema': True, 'use_spike': True, 'rsi_required': True, 'edge_k': 0.19606455743499382, 'edge_cap': 0.10874728532937283, 'bull_strategy': 'breakout', 'bull_bb_std_mult': 0.549189404456278, 'bull_rsi_os': 7, 'bull_rsi_ob': 67, 'bull_adx_thresh': 7.457148180703027, 'bull_atr_min_pct': 0.003328459503061999, 'bull_atr_max_pct': 0.10115928687512273, 'bull_tp_mult': 1.653015831309988, 'bull_tsl_mult': 0.8436700682691826, 'bull_time_stop': 79, 'bull_use_sma': True, 'bull_use_ema': False, 'bull_use_atr': False, 'bull_use_adx': False, 'bull_use_spike': False, 'bull_rsi_required': True, 'bear_strategy': 'breakout', 'bear_bb_std_mult': 3.37582248410539, 'bear_rsi_os': 52, 'bear_rsi_ob': 65, 'bear_adx_thresh': 6.889549211505216, 'bear_atr_min_pct': 0.005686387666982714, 'bear_atr_max_pct': 0.10488002474725167, 'bear_tp_mult': 1.627200562418567, 'bear_tsl_mult': 0.5234206443166313, 'bear_time_stop': 31, 'bear_use_sma': False, 'bear_use_ema': True, 'bear_use_atr': False, 'bear_use_adx': False, 'bear_use_spike': False, 'bear_rsi_required': False, 'sideways_strategy': 'mean_reversion', 'sideways_bb_std_mult': 3.461817841616803, 'sideways_rsi_os': 5, 'sideways_rsi_ob': 87, 'sideways_adx_thresh': 26.66579272127444, 'sideways_atr_min_pct': 0.017742366532128042, 'sideways_atr_max_pct': 0.03794832347138318, 'sideways_tp_mult': 1.9988820122512776, 'sideways_tsl_mult': 0.3296419109772193, 'sideways_time_stop': 33, 'sideways_use_sma': True, 'sideways_use_ema': False, 'sideways_use_atr': False, 'sideways_use_adx': False, 'sideways_use_spike': False, 'sideways_rsi_required': True}.
[I 2025-08-31 11:09:10,508] Trial 577 finished with values: [-1000000000.0, 1000000000.0] and parameters: {'p_sma': 14, 'p_std': 27, 'p_atr': 9, 'p_adx': 14, 'rsi_period': 55, 'ema1': 14, 'ema2': 56, 'slip_atr_k': 0.12690206676846508, 'slip_spread_k': 0.18651669040316998, 'spread_hl_frac': 0.02691675022357868, 'bb_std_mult': 2.4514814324088907, 'rsi_os': 27, 'rsi_ob': 77, 'vol_spike': 0.18385147988565065, 'adx_thresh': 29.680800264052667, 'atr_min_pct': 0.003324923492825297, 'atr_max_pct': 0.04521221328689024, 'tp_mult': 2.441480622618313, 'tsl_mult': 0.24917538549089588, 'strategy': 'mean_reversion', 'time_stop': 75, 'use_sma': True, 'use_atr': False, 'use_adx': True, 'use_ema': True, 'use_spike': True, 'rsi_required': False, 'edge_k': 0.08814464291876963, 'edge_cap': 0.7402449759202612, 'bull_strategy': 'mean_reversion', 'bull_bb_std_mult': 1.8490927347989148, 'bull_rsi_os': 8, 'bull_rsi_ob': 74, 'bull_adx_thresh': 9.36200207967372, 'bull_atr_min_pct': 0.003213752546174209, 'bull_atr_max_pct': 0.1015314295249934, 'bull_tp_mult': 1.6321671851408508, 'bull_tsl_mult': 0.35499168312399576, 'bull_time_stop': 77, 'bull_use_sma': False, 'bull_use_ema': True, 'bull_use_atr': True, 'bull_use_adx': False, 'bull_use_spike': True, 'bull_rsi_required': True, 'bear_strategy': 'breakout', 'bear_bb_std_mult': 1.4260987242574077, 'bear_rsi_os': 44, 'bear_rsi_ob': 65, 'bear_adx_thresh': 19.20534078838347, 'bear_atr_min_pct': 0.004878731339866582, 'bear_atr_max_pct': 0.101747999820687, 'bear_tp_mult': 2.7445563136479443, 'bear_tsl_mult': 0.5401716943245063, 'bear_time_stop': 205, 'bear_use_sma': True, 'bear_use_ema': False, 'bear_use_atr': True, 'bear_use_adx': False, 'bear_use_spike': False, 'bear_rsi_required': True, 'sideways_strategy': 'breakout', 'sideways_bb_std_mult': 2.60635986843599, 'sideways_rsi_os': 5, 'sideways_rsi_ob': 87, 'sideways_adx_thresh': 9.37430075788604, 'sideways_atr_min_pct': 0.020347837799933606, 'sideways_atr_max_pct': 0.03966435241581267, 'sideways_tp_mult': 2.8984546686965382, 'sideways_tsl_mult': 0.12284823569862531, 'sideways_time_stop': 145, 'sideways_use_sma': True, 'sideways_use_ema': True, 'sideways_use_atr': True, 'sideways_use_adx': True, 'sideways_use_spike': True, 'sideways_rsi_required': True}.
[I 2025-08-31 11:09:11,002] Trial 578 finished with values: [-1000000000.0, 1000000000.0] and parameters: {'p_sma': 14, 'p_std': 27, 'p_atr': 12, 'p_adx': 14, 'rsi_period': 46, 'ema1': 12, 'ema2': 38, 'slip_atr_k': 0.141229581142785, 'slip_spread_k': 0.46786424782661057, 'spread_hl_frac': 0.03921867093175673, 'bb_std_mult': 2.4100823657283077, 'rsi_os': 27, 'rsi_ob': 77, 'vol_spike': 0.24686675805240565, 'adx_thresh': 30.00443015825815, 'atr_min_pct': 0.017317482027531035, 'atr_max_pct': 0.046173640921912326, 'tp_mult': 2.445277490740252, 'tsl_mult': 0.24078504585305271, 'strategy': 'mean_reversion', 'time_stop': 77, 'use_sma': True, 'use_atr': False, 'use_adx': True, 'use_ema': True, 'use_spike': True, 'rsi_required': False, 'edge_k': 0.19874844617781273, 'edge_cap': 0.7416909402095218, 'bull_strategy': 'mean_reversion', 'bull_bb_std_mult': 0.8194723747782525, 'bull_rsi_os': 8, 'bull_rsi_ob': 74, 'bull_adx_thresh': 7.332229687537994, 'bull_atr_min_pct': 0.003456685357077299, 'bull_atr_max_pct': 0.029119836264650888, 'bull_tp_mult': 1.6322080397575705, 'bull_tsl_mult': 0.08575423884603794, 'bull_time_stop': 77, 'bull_use_sma': False, 'bull_use_ema': True, 'bull_use_atr': True, 'bull_use_adx': False, 'bull_use_spike': True, 'bull_rsi_required': True, 'bear_strategy': 'breakout', 'bear_bb_std_mult': 1.4047126504126026, 'bear_rsi_os': 26, 'bear_rsi_ob': 65, 'bear_adx_thresh': 19.02150917363571, 'bear_atr_min_pct': 0.005045244543028118, 'bear_atr_max_pct': 0.11658654038460933, 'bear_tp_mult': 2.7762607345393002, 'bear_tsl_mult': 0.5341142048658265, 'bear_time_stop': 29, 'bear_use_sma': True, 'bear_use_ema': False, 'bear_use_atr': True, 'bear_use_adx': False, 'bear_use_spike': False, 'bear_rsi_required': True, 'sideways_strategy': 'breakout', 'sideways_bb_std_mult': 3.4736438233660403, 'sideways_rsi_os': 5, 'sideways_rsi_ob': 87, 'sideways_adx_thresh': 31.909746850867386, 'sideways_atr_min_pct': 0.017797578168235396, 'sideways_atr_max_pct': 0.04188778070410679, 'sideways_tp_mult': 2.009600236152121, 'sideways_tsl_mult': 0.6572649913123382, 'sideways_time_stop': 21, 'sideways_use_sma': True, 'sideways_use_ema': True, 'sideways_use_atr': True, 'sideways_use_adx': True, 'sideways_use_spike': True, 'sideways_rsi_required': True}.
[I 2025-08-31 11:09:41,979] Trial 582 finished with values: [-0.020802933603780716, 0.020621652941207668] and parameters: {'p_sma': 15, 'p_std': 27, 'p_atr': 11, 'p_adx': 13, 'rsi_period': 67, 'ema1': 15, 'ema2': 53, 'slip_atr_k': 0.12625493888023318, 'slip_spread_k': 0.657774531411535, 'spread_hl_frac': 0.044834935468034284, 'bb_std_mult': 2.8805605874174383, 'rsi_os': 19, 'rsi_ob': 74, 'vol_spike': 0.188452701989783, 'adx_thresh': 29.63787259581164, 'atr_min_pct': 0.007888454639615993, 'atr_max_pct': 0.09958994808743785, 'tp_mult': 2.7351241846221117, 'tsl_mult': 0.3101050047219082, 'strategy': 'mean_reversion', 'time_stop': 19, 'use_sma': True, 'use_atr': False, 'use_adx': True, 'use_ema': False, 'use_spike': True, 'rsi_required': True, 'edge_k': 1.61410178996924, 'edge_cap': 0.3921085324686986, 'bull_strategy': 'breakout', 'bull_bb_std_mult': 2.4304558760811927, 'bull_rsi_os': 37, 'bull_rsi_ob': 77, 'bull_adx_thresh': 7.2682217508681095, 'bull_atr_min_pct': 0.0030396026165221313, 'bull_atr_max_pct': 0.0859616399135281, 'bull_tp_mult': 2.11533498789768, 'bull_tsl_mult': 0.4276626660380647, 'bull_time_stop': 79, 'bull_use_sma': True, 'bull_use_ema': False, 'bull_use_atr': False, 'bull_use_adx': False, 'bull_use_spike': False, 'bull_rsi_required': False, 'bear_strategy': 'breakout', 'bear_bb_std_mult': 2.197314296352613, 'bear_rsi_os': 31, 'bear_rsi_ob': 65, 'bear_adx_thresh': 34.27795543680885, 'bear_atr_min_pct': 0.00670392384658113, 'bear_atr_max_pct': 0.10028334845290207, 'bear_tp_mult': 2.812733638853595, 'bear_tsl_mult': 0.4708284719705927, 'bear_time_stop': 165, 'bear_use_sma': False, 'bear_use_ema': True, 'bear_use_atr': False, 'bear_use_adx': True, 'bear_use_spike': False, 'bear_rsi_required': False, 'sideways_strategy': 'mean_reversion', 'sideways_bb_std_mult': 2.872928254897649, 'sideways_rsi_os': 5, 'sideways_rsi_ob': 86, 'sideways_adx_thresh': 27.09456455081441, 'sideways_atr_min_pct': 0.01868842087637874, 'sideways_atr_max_pct': 0.043128452012088724, 'sideways_tp_mult': 1.8885420574061365, 'sideways_tsl_mult': 0.3349625798405682, 'sideways_time_stop': 23, 'sideways_use_sma': True, 'sideways_use_ema': False, 'sideways_use_atr': False, 'sideways_use_adx': False, 'sideways_use_spike': False, 'sideways_rsi_required': True}.
[I 2025-08-31 11:09:42,634] Trial 584 finished with values: [-1000000000.0, 1000000000.0] and parameters: {'p_sma': 17, 'p_std': 28, 'p_atr': 11, 'p_adx': 28, 'rsi_period': 50, 'ema1': 12, 'ema2': 49, 'slip_atr_k': 0.23561809268257927, 'slip_spread_k': 0.65989103465207, 'spread_hl_frac': 0.00938304439620292, 'bb_std_mult': 3.040231300660135, 'rsi_os': 38, 'rsi_ob': 75, 'vol_spike': 0.2653242381494779, 'adx_thresh': 28.66221894430614, 'atr_min_pct': 0.006478422250161559, 'atr_max_pct': 0.09989786729217805, 'tp_mult': 2.508639854667704, 'tsl_mult': 0.3071961318677968, 'strategy': 'breakout', 'time_stop': 70, 'use_sma': False, 'use_atr': False, 'use_adx': True, 'use_ema': False, 'use_spike': False, 'rsi_required': True, 'edge_k': 0.24562842093525367, 'edge_cap': 0.44887756789951866, 'bull_strategy': 'breakout', 'bull_bb_std_mult': 0.521671486520811, 'bull_rsi_os': 19, 'bull_rsi_ob': 46, 'bull_adx_thresh': 6.677129617350813, 'bull_atr_min_pct': 0.004423292717529137, 'bull_atr_max_pct': 0.08711743816680786, 'bull_tp_mult': 1.9743537004724987, 'bull_tsl_mult': 0.4263168811404098, 'bull_time_stop': 88, 'bull_use_sma': True, 'bull_use_ema': False, 'bull_use_atr': False, 'bull_use_adx': False, 'bull_use_spike': False, 'bull_rsi_required': False, 'bear_strategy': 'breakout', 'bear_bb_std_mult': 1.8945233461199062, 'bear_rsi_os': 15, 'bear_rsi_ob': 92, 'bear_adx_thresh': 34.25770429439183, 'bear_atr_min_pct': 0.004110518955622498, 'bear_atr_max_pct': 0.09975282355559392, 'bear_tp_mult': 2.7954512718068854, 'bear_tsl_mult': 0.8980342076895882, 'bear_time_stop': 21, 'bear_use_sma': False, 'bear_use_ema': True, 'bear_use_atr': False, 'bear_use_adx': True, 'bear_use_spike': True, 'bear_rsi_required': False, 'sideways_strategy': 'mean_reversion', 'sideways_bb_std_mult': 2.77006563613244, 'sideways_rsi_os': 6, 'sideways_rsi_ob': 86, 'sideways_adx_thresh': 26.690915576049534, 'sideways_atr_min_pct': 0.008851669887889484, 'sideways_atr_max_pct': 0.03461565252855858, 'sideways_tp_mult': 2.355045432060347, 'sideways_tsl_mult': 0.33924937153751494, 'sideways_time_stop': 294, 'sideways_use_sma': False, 'sideways_use_ema': False, 'sideways_use_atr': False, 'sideways_use_adx': False, 'sideways_use_spike': False, 'sideways_rsi_required': False}.
[I 2025-08-31 11:09:42,810] Trial 583 finished with values: [-0.02040332991368754, 0.02022355278101137] and parameters: {'p_sma': 15, 'p_std': 29, 'p_atr': 11, 'p_adx': 29, 'rsi_period': 46, 'ema1': 12, 'ema2': 18, 'slip_atr_k': 0.14011327857092476, 'slip_spread_k': 0.47235239813898683, 'spread_hl_frac': 0.00549285556741896, 'bb_std_mult': 2.8388960195453516, 'rsi_os': 36, 'rsi_ob': 74, 'vol_spike': 0.26727770877009466, 'adx_thresh': 20.854591980609907, 'atr_min_pct': 0.0063296916213442704, 'atr_max_pct': 0.05845739803240736, 'tp_mult': 2.5815502145305658, 'tsl_mult': 0.30109142194834543, 'strategy': 'breakout', 'time_stop': 71, 'use_sma': True, 'use_atr': False, 'use_adx': True, 'use_ema': False, 'use_spike': True, 'rsi_required': True, 'edge_k': 1.203589814218714, 'edge_cap': 0.44897551430748783, 'bull_strategy': 'breakout', 'bull_bb_std_mult': 0.7924710044314245, 'bull_rsi_os': 19, 'bull_rsi_ob': 53, 'bull_adx_thresh': 6.9993531474652215, 'bull_atr_min_pct': 0.0029297626457411314, 'bull_atr_max_pct': 0.08700202920012748, 'bull_tp_mult': 1.8859094738938846, 'bull_tsl_mult': 0.4169048517285449, 'bull_time_stop': 79, 'bull_use_sma': True, 'bull_use_ema': False, 'bull_use_atr': False, 'bull_use_adx': False, 'bull_use_spike': False, 'bull_rsi_required': False, 'bear_strategy': 'breakout', 'bear_bb_std_mult': 1.5279537824938472, 'bear_rsi_os': 42, 'bear_rsi_ob': 83, 'bear_adx_thresh': 30.151555967234522, 'bear_atr_min_pct': 0.006649949881187497, 'bear_atr_max_pct': 0.10529551409332195, 'bear_tp_mult': 2.792229898510209, 'bear_tsl_mult': 0.14790967101490254, 'bear_time_stop': 23, 'bear_use_sma': False, 'bear_use_ema': True, 'bear_use_atr': False, 'bear_use_adx': True, 'bear_use_spike': True, 'bear_rsi_required': False, 'sideways_strategy': 'mean_reversion', 'sideways_bb_std_mult': 3.4946702097700153, 'sideways_rsi_os': 5, 'sideways_rsi_ob': 88, 'sideways_adx_thresh': 31.822932552619875, 'sideways_atr_min_pct': 0.018744291110832503, 'sideways_atr_max_pct': 0.03512061834274594, 'sideways_tp_mult': 1.8908704261659979, 'sideways_tsl_mult': 0.22925197986115303, 'sideways_time_stop': 21, 'sideways_use_sma': False, 'sideways_use_ema': False, 'sideways_use_atr': False, 'sideways_use_adx': False, 'sideways_use_spike': False, 'sideways_rsi_required': False}.
[I 2025-08-31 11:09:42,960] Trial 581 finished with values: [-0.03716503094236012, 0.03735614004574582] and parameters: {'p_sma': 42, 'p_std': 27, 'p_atr': 11, 'p_adx': 13, 'rsi_period': 35, 'ema1': 15, 'ema2': 22, 'slip_atr_k': 0.16491936031938045, 'slip_spread_k': 0.6589115711050241, 'spread_hl_frac': 0.044755503862845936, 'bb_std_mult': 2.8566963262905523, 'rsi_os': 19, 'rsi_ob': 75, 'vol_spike': 0.26241017780696424, 'adx_thresh': 29.648520261637852, 'atr_min_pct': 0.005750966611923764, 'atr_max_pct': 0.09923446142110605, 'tp_mult': 1.7791092289412933, 'tsl_mult': 0.3061927577094846, 'strategy': 'mean_reversion', 'time_stop': 156, 'use_sma': True, 'use_atr': False, 'use_adx': True, 'use_ema': False, 'use_spike': True, 'rsi_required': True, 'edge_k': 0.1869554162394661, 'edge_cap': 0.39478307636588167, 'bull_strategy': 'breakout', 'bull_bb_std_mult': 0.7864812759686517, 'bull_rsi_os': 37, 'bull_rsi_ob': 71, 'bull_adx_thresh': 6.874179653831002, 'bull_atr_min_pct': 0.0032507910235607196, 'bull_atr_max_pct': 0.08826619318676263, 'bull_tp_mult': 1.6164962281345034, 'bull_tsl_mult': 0.41560050688434774, 'bull_time_stop': 78, 'bull_use_sma': True, 'bull_use_ema': False, 'bull_use_atr': False, 'bull_use_adx': False, 'bull_use_spike': False, 'bull_rsi_required': False, 'bear_strategy': 'breakout', 'bear_bb_std_mult': 1.4967548315161143, 'bear_rsi_os': 43, 'bear_rsi_ob': 76, 'bear_adx_thresh': 7.202786846836638, 'bear_atr_min_pct': 0.006702572271827524, 'bear_atr_max_pct': 0.10487435285847026, 'bear_tp_mult': 1.6367628758888149, 'bear_tsl_mult': 0.720847974894007, 'bear_time_stop': 166, 'bear_use_sma': False, 'bear_use_ema': True, 'bear_use_atr': False, 'bear_use_adx': True, 'bear_use_spike': False, 'bear_rsi_required': False, 'sideways_strategy': 'mean_reversion', 'sideways_bb_std_mult': 2.7876384539180705, 'sideways_rsi_os': 5, 'sideways_rsi_ob': 86, 'sideways_adx_thresh': 31.73408042380037, 'sideways_atr_min_pct': 0.018668633766796, 'sideways_atr_max_pct': 0.041618504900213356, 'sideways_tp_mult': 1.8833569489584592, 'sideways_tsl_mult': 0.006599371191352468, 'sideways_time_stop': 22, 'sideways_use_sma': True, 'sideways_use_ema': False, 'sideways_use_atr': False, 'sideways_use_adx': False, 'sideways_use_spike': False, 'sideways_rsi_required': True}.
