[I 2025-08-31 11:32:06,505] Trial 746 finished with values: [-1000000000.0, 1000000000.0] and parameters: {'p_sma': 35, 'p_std': 15, 'p_atr': 23, 'p_adx': 21, 'rsi_period': 54, 'ema1': 12, 'ema2': 41, 'slip_atr_k': 0.19363060152666434, 'slip_spread_k': 0.13451909113778393, 'spread_hl_frac': 0.0029382270564906245, 'bb_std_mult': 3.411565085401678, 'rsi_os': 29, 'rsi_ob': 94, 'vol_spike': 0.07065967679723231, 'adx_thresh': 30.831396977694865, 'atr_min_pct': 0.009980763460298091, 'atr_max_pct': 0.14743354511520257, 'tp_mult': 1.8096220278367052, 'tsl_mult': 0.054277508897553214, 'strategy': 'breakout', 'time_stop': 208, 'use_sma': True, 'use_atr': False, 'use_adx': False, 'use_ema': False, 'use_spike': True, 'rsi_required': False, 'edge_k': 0.3029547584634461, 'edge_cap': 0.5341663129766764, 'bull_strategy': 'breakout', 'bull_bb_std_mult': 1.6927775221425665, 'bull_rsi_os': 24, 'bull_rsi_ob': 81, 'bull_adx_thresh': 17.11590130216818, 'bull_atr_min_pct': 0.002937183535274352, 'bull_atr_max_pct': 0.09754039070069334, 'bull_tp_mult': 1.8864095315176037, 'bull_tsl_mult': 0.1711659240463106, 'bull_time_stop': 292, 'bull_use_sma': False, 'bull_use_ema': True, 'bull_use_atr': True, 'bull_use_adx': False, 'bull_use_spike': True, 'bull_rsi_required': False, 'bear_strategy': 'mean_reversion', 'bear_bb_std_mult': 3.161553083583562, 'bear_rsi_os': 54, 'bear_rsi_ob': 75, 'bear_adx_thresh': 6.818703837573759, 'bear_atr_min_pct': 0.004111827940298226, 'bear_atr_max_pct': 0.02808505568749918, 'bear_tp_mult': 2.833168756503442, 'bear_tsl_mult': 0.6882560654079386, 'bear_time_stop': 124, 'bear_use_sma': False, 'bear_use_ema': True, 'bear_use_atr': False, 'bear_use_adx': True, 'bear_use_spike': False, 'bear_rsi_required': False, 'sideways_strategy': 'breakout', 'sideways_bb_std_mult': 2.8289576321148573, 'sideways_rsi_os': 25, 'sideways_rsi_ob': 60, 'sideways_adx_thresh': 9.650737715556051, 'sideways_atr_min_pct': 0.01720116005004538, 'sideways_atr_max_pct': 0.07467219217407908, 'sideways_tp_mult': 1.9092571014749262, 'sideways_tsl_mult': 0.4160991968524232, 'sideways_time_stop': 12, 'sideways_use_sma': False, 'sideways_use_ema': True, 'sideways_use_atr': True, 'sideways_use_adx': False, 'sideways_use_spike': True, 'sideways_rsi_required': True}.
[I 2025-08-31 11:32:40,459] Trial 750 finished with values: [-1000000000.0, 1000000000.0] and parameters: {'p_sma': 22, 'p_std': 31, 'p_atr': 23, 'p_adx': 8, 'rsi_period': 56, 'ema1': 11, 'ema2': 44, 'slip_atr_k': 0.0419476937531013, 'slip_spread_k': 0.13607437525490265, 'spread_hl_frac': 0.007503028735398973, 'bb_std_mult': 2.8234962420372955, 'rsi_os': 30, 'rsi_ob': 95, 'vol_spike': 0.1570552005199123, 'adx_thresh': 31.70607427505848, 'atr_min_pct': 0.009815844175961428, 'atr_max_pct': 0.14265728926880755, 'tp_mult': 1.754600593681696, 'tsl_mult': 0.07304071283228045, 'strategy': 'breakout', 'time_stop': 184, 'use_sma': True, 'use_atr': True, 'use_adx': False, 'use_ema': True, 'use_spike': False, 'rsi_required': False, 'edge_k': 0.3757964184541902, 'edge_cap': 0.5119164195868973, 'bull_strategy': 'breakout', 'bull_bb_std_mult': 2.868494141627871, 'bull_rsi_os': 35, 'bull_rsi_ob': 82, 'bull_adx_thresh': 20.049410022052566, 'bull_atr_min_pct': 0.003783044346370213, 'bull_atr_max_pct': 0.09658429881101263, 'bull_tp_mult': 2.382903763567853, 'bull_tsl_mult': 0.4280982109370277, 'bull_time_stop': 292, 'bull_use_sma': False, 'bull_use_ema': True, 'bull_use_atr': True, 'bull_use_adx': False, 'bull_use_spike': True, 'bull_rsi_required': True, 'bear_strategy': 'breakout', 'bear_bb_std_mult': 3.1271948915985264, 'bear_rsi_os': 50, 'bear_rsi_ob': 71, 'bear_adx_thresh': 5.565494116735513, 'bear_atr_min_pct': 0.019836326606354055, 'bear_atr_max_pct': 0.02916937117650583, 'bear_tp_mult': 2.9612413655231196, 'bear_tsl_mult': 0.7496915134560367, 'bear_time_stop': 40, 'bear_use_sma': False, 'bear_use_ema': True, 'bear_use_atr': False, 'bear_use_adx': False, 'bear_use_spike': False, 'bear_rsi_required': False, 'sideways_strategy': 'breakout', 'sideways_bb_std_mult': 1.2620246355849434, 'sideways_rsi_os': 24, 'sideways_rsi_ob': 49, 'sideways_adx_thresh': 12.90636846234506, 'sideways_atr_min_pct': 0.016496657701925037, 'sideways_atr_max_pct': 0.0885293961269741, 'sideways_tp_mult': 1.9909166017142605, 'sideways_tsl_mult': 0.38202895247609475, 'sideways_time_stop': 12, 'sideways_use_sma': False, 'sideways_use_ema': False, 'sideways_use_atr': True, 'sideways_use_adx': True, 'sideways_use_spike': True, 'sideways_rsi_required': True}.
[I 2025-08-31 11:32:40,605] Trial 751 finished with values: [-1000000000.0, 1000000000.0] and parameters: {'p_sma': 5, 'p_std': 32, 'p_atr': 12, 'p_adx': 10, 'rsi_period': 56, 'ema1': 11, 'ema2': 44, 'slip_atr_k': 0.16904277933542006, 'slip_spread_k': 0.24142511791117827, 'spread_hl_frac': 0.007866058970014257, 'bb_std_mult': 0.8329393734136672, 'rsi_os': 31, 'rsi_ob': 95, 'vol_spike': 0.21277373711699754, 'adx_thresh': 31.689343611106086, 'atr_min_pct': 0.012328426202122432, 'atr_max_pct': 0.14321679636637027, 'tp_mult': 1.7424324681751537, 'tsl_mult': 0.0658382860249478, 'strategy': 'mean_reversion', 'time_stop': 185, 'use_sma': True, 'use_atr': True, 'use_adx': True, 'use_ema': True, 'use_spike': False, 'rsi_required': False, 'edge_k': 0.5146821198636271, 'edge_cap': 0.5075370825853245, 'bull_strategy': 'breakout', 'bull_bb_std_mult': 0.5056845072155037, 'bull_rsi_os': 12, 'bull_rsi_ob': 84, 'bull_adx_thresh': 21.934007892762413, 'bull_atr_min_pct': 0.004147946469597726, 'bull_atr_max_pct': 0.1003546974223447, 'bull_tp_mult': 2.3667590203540034, 'bull_tsl_mult': 0.4390630950090819, 'bull_time_stop': 299, 'bull_use_sma': False, 'bull_use_ema': True, 'bull_use_atr': False, 'bull_use_adx': False, 'bull_use_spike': False, 'bull_rsi_required': True, 'bear_strategy': 'breakout', 'bear_bb_std_mult': 3.1977601508006868, 'bear_rsi_os': 50, 'bear_rsi_ob': 72, 'bear_adx_thresh': 5.655157210346865, 'bear_atr_min_pct': 0.02591027841589339, 'bear_atr_max_pct': 0.13177591917869297, 'bear_tp_mult': 2.961693923577708, 'bear_tsl_mult': 0.754821218608071, 'bear_time_stop': 248, 'bear_use_sma': False, 'bear_use_ema': True, 'bear_use_atr': False, 'bear_use_adx': False, 'bear_use_spike': False, 'bear_rsi_required': False, 'sideways_strategy': 'breakout', 'sideways_bb_std_mult': 2.354074851847228, 'sideways_rsi_os': 23, 'sideways_rsi_ob': 94, 'sideways_adx_thresh': 14.770782516125715, 'sideways_atr_min_pct': 0.006767893687417084, 'sideways_atr_max_pct': 0.09634050651190403, 'sideways_tp_mult': 1.984476698489471, 'sideways_tsl_mult': 0.38576665785725583, 'sideways_time_stop': 12, 'sideways_use_sma': True, 'sideways_use_ema': False, 'sideways_use_atr': True, 'sideways_use_adx': True, 'sideways_use_spike': True, 'sideways_rsi_required': True}.
[I 2025-08-31 11:32:40,851] Trial 749 finished with values: [-0.025425630045516456, 0.02562196123873656] and parameters: {'p_sma': 35, 'p_std': 21, 'p_atr': 23, 'p_adx': 15, 'rsi_period': 53, 'ema1': 11, 'ema2': 44, 'slip_atr_k': 0.025371630524911825, 'slip_spread_k': 0.2471645217485898, 'spread_hl_frac': 0.007329041772192316, 'bb_std_mult': 2.852175115731832, 'rsi_os': 31, 'rsi_ob': 95, 'vol_spike': 0.10551891513238731, 'adx_thresh': 31.56519302024601, 'atr_min_pct': 0.009821410274993177, 'atr_max_pct': 0.14362130548230628, 'tp_mult': 1.8124213425713807, 'tsl_mult': 0.06722563983562244, 'strategy': 'breakout', 'time_stop': 201, 'use_sma': True, 'use_atr': True, 'use_adx': False, 'use_ema': True, 'use_spike': False, 'rsi_required': False, 'edge_k': 0.36670904402798826, 'edge_cap': 0.5122339790020879, 'bull_strategy': 'breakout', 'bull_bb_std_mult': 0.6361908253935893, 'bull_rsi_os': 28, 'bull_rsi_ob': 84, 'bull_adx_thresh': 5.067749836728283, 'bull_atr_min_pct': 0.003961312322106617, 'bull_atr_max_pct': 0.09918322444641345, 'bull_tp_mult': 1.8847456485758136, 'bull_tsl_mult': 0.2752121678969992, 'bull_time_stop': 293, 'bull_use_sma': False, 'bull_use_ema': True, 'bull_use_atr': True, 'bull_use_adx': False, 'bull_use_spike': True, 'bull_rsi_required': True, 'bear_strategy': 'breakout', 'bear_bb_std_mult': 3.1896667191631356, 'bear_rsi_os': 54, 'bear_rsi_ob': 72, 'bear_adx_thresh': 5.831649865004156, 'bear_atr_min_pct': 0.004057603232899074, 'bear_atr_max_pct': 0.13227472541367682, 'bear_tp_mult': 2.027271965808814, 'bear_tsl_mult': 0.7383111835691432, 'bear_time_stop': 37, 'bear_use_sma': False, 'bear_use_ema': True, 'bear_use_atr': False, 'bear_use_adx': False, 'bear_use_spike': False, 'bear_rsi_required': False, 'sideways_strategy': 'breakout', 'sideways_bb_std_mult': 0.732134446698459, 'sideways_rsi_os': 23, 'sideways_rsi_ob': 50, 'sideways_adx_thresh': 11.080047623952318, 'sideways_atr_min_pct': 0.01713873419924154, 'sideways_atr_max_pct': 0.12342442057879059, 'sideways_tp_mult': 1.9788427107646123, 'sideways_tsl_mult': 0.4102768763884689, 'sideways_time_stop': 12, 'sideways_use_sma': False, 'sideways_use_ema': False, 'sideways_use_atr': True, 'sideways_use_adx': True, 'sideways_use_spike': True, 'sideways_rsi_required': True}.
[I 2025-08-31 11:32:41,460] Trial 748 finished with values: [-1000000000.0, 1000000000.0] and parameters: {'p_sma': 37, 'p_std': 18, 'p_atr': 12, 'p_adx': 15, 'rsi_period': 53, 'ema1': 12, 'ema2': 44, 'slip_atr_k': 0.16855222891053354, 'slip_spread_k': 0.12294425541212528, 'spread_hl_frac': 0.005158362855108122, 'bb_std_mult': 3.4015778131637346, 'rsi_os': 28, 'rsi_ob': 94, 'vol_spike': 0.2914002233898429, 'adx_thresh': 31.399990053914706, 'atr_min_pct': 0.012315223600581472, 'atr_max_pct': 0.1434801503624758, 'tp_mult': 1.7039429700945674, 'tsl_mult': 0.061512298341183366, 'strategy': 'breakout', 'time_stop': 201, 'use_sma': True, 'use_atr': True, 'use_adx': False, 'use_ema': False, 'use_spike': False, 'rsi_required': False, 'edge_k': 0.3544483666098618, 'edge_cap': 0.5805073751371538, 'bull_strategy': 'breakout', 'bull_bb_std_mult': 1.9219355826373263, 'bull_rsi_os': 31, 'bull_rsi_ob': 82, 'bull_adx_thresh': 29.498464213972888, 'bull_atr_min_pct': 0.0030580734113122726, 'bull_atr_max_pct': 0.09827865715069235, 'bull_tp_mult': 2.363507550136453, 'bull_tsl_mult': 0.42802787015118665, 'bull_time_stop': 300, 'bull_use_sma': False, 'bull_use_ema': True, 'bull_use_atr': True, 'bull_use_adx': False, 'bull_use_spike': True, 'bull_rsi_required': False, 'bear_strategy': 'mean_reversion', 'bear_bb_std_mult': 3.15614741432682, 'bear_rsi_os': 54, 'bear_rsi_ob': 71, 'bear_adx_thresh': 20.349877233657615, 'bear_atr_min_pct': 0.004292333041347468, 'bear_atr_max_pct': 0.14051738860498406, 'bear_tp_mult': 2.555601946217835, 'bear_tsl_mult': 0.7398836209400406, 'bear_time_stop': 124, 'bear_use_sma': False, 'bear_use_ema': True, 'bear_use_atr': False, 'bear_use_adx': True, 'bear_use_spike': False, 'bear_rsi_required': False, 'sideways_strategy': 'breakout', 'sideways_bb_std_mult': 0.7399078176137222, 'sideways_rsi_os': 23, 'sideways_rsi_ob': 94, 'sideways_adx_thresh': 8.233634065015252, 'sideways_atr_min_pct': 0.01721031945086889, 'sideways_atr_max_pct': 0.11730561750698013, 'sideways_tp_mult': 1.9869599068969463, 'sideways_tsl_mult': 0.3272701785187603, 'sideways_time_stop': 10, 'sideways_use_sma': False, 'sideways_use_ema': True, 'sideways_use_atr': True, 'sideways_use_adx': True, 'sideways_use_spike': True, 'sideways_rsi_required': True}.
[I 2025-08-31 11:33:17,817] Trial 752 finished with values: [-0.07144237726605274, 0.07155868706932375] and parameters: {'p_sma': 38, 'p_std': 32, 'p_atr': 12, 'p_adx': 10, 'rsi_period': 51, 'ema1': 10, 'ema2': 44, 'slip_atr_k': 0.16818342077408585, 'slip_spread_k': 0.25028733398408765, 'spread_hl_frac': 0.008063255056042896, 'bb_std_mult': 2.814774090094208, 'rsi_os': 30, 'rsi_ob': 95, 'vol_spike': 0.2925969898983518, 'adx_thresh': 31.61558623557823, 'atr_min_pct': 0.010724891819231287, 'atr_max_pct': 0.1498739375250159, 'tp_mult': 1.5339507933496668, 'tsl_mult': 0.11878595504374288, 'strategy': 'mean_reversion', 'time_stop': 202, 'use_sma': True, 'use_atr': False, 'use_adx': True, 'use_ema': True, 'use_spike': True, 'rsi_required': False, 'edge_k': 0.4364244090594388, 'edge_cap': 0.5083548376992932, 'bull_strategy': 'breakout', 'bull_bb_std_mult': 2.605796295960647, 'bull_rsi_os': 31, 'bull_rsi_ob': 84, 'bull_adx_thresh': 5.510938636971735, 'bull_atr_min_pct': 0.029265635391110684, 'bull_atr_max_pct': 0.06455021291049463, 'bull_tp_mult': 1.8443056972586234, 'bull_tsl_mult': 0.5639255002028289, 'bull_time_stop': 274, 'bull_use_sma': False, 'bull_use_ema': True, 'bull_use_atr': False, 'bull_use_adx': False, 'bull_use_spike': False, 'bull_rsi_required': True, 'bear_strategy': 'breakout', 'bear_bb_std_mult': 3.222006144653646, 'bear_rsi_os': 51, 'bear_rsi_ob': 72, 'bear_adx_thresh': 30.512372939382033, 'bear_atr_min_pct': 0.003126184985521735, 'bear_atr_max_pct': 0.13315380877508415, 'bear_tp_mult': 2.7915545314867645, 'bear_tsl_mult': 0.7801668067926893, 'bear_time_stop': 198, 'bear_use_sma': False, 'bear_use_ema': True, 'bear_use_atr': False, 'bear_use_adx': False, 'bear_use_spike': False, 'bear_rsi_required': False, 'sideways_strategy': 'breakout', 'sideways_bb_std_mult': 0.503180304454055, 'sideways_rsi_os': 23, 'sideways_rsi_ob': 94, 'sideways_adx_thresh': 14.956558463142205, 'sideways_atr_min_pct': 0.00689113457994622, 'sideways_atr_max_pct': 0.04055477346612601, 'sideways_tp_mult': 2.630441540162219, 'sideways_tsl_mult': 0.34114840562028514, 'sideways_time_stop': 12, 'sideways_use_sma': True, 'sideways_use_ema': False, 'sideways_use_atr': True, 'sideways_use_adx': True, 'sideways_use_spike': True, 'sideways_rsi_required': True}.
[I 2025-08-31 11:33:17,925] Trial 755 finished with values: [-1000000000.0, 1000000000.0] and parameters: {'p_sma': 32, 'p_std': 46, 'p_atr': 11, 'p_adx': 13, 'rsi_period': 51, 'ema1': 12, 'ema2': 40, 'slip_atr_k': 0.23329580339236428, 'slip_spread_k': 0.15738534509577912, 'spread_hl_frac': 0.007746552765495736, 'bb_std_mult': 2.9354330313921113, 'rsi_os': 30, 'rsi_ob': 92, 'vol_spike': 0.18952589078351892, 'adx_thresh': 33.676509014150106, 'atr_min_pct': 0.01074777692426966, 'atr_max_pct': 0.14686955997218568, 'tp_mult': 1.5986222540527621, 'tsl_mult': 0.11234427476171471, 'strategy': 'mean_reversion', 'time_stop': 211, 'use_sma': False, 'use_atr': False, 'use_adx': True, 'use_ema': True, 'use_spike': True, 'rsi_required': False, 'edge_k': 0.45577297950904344, 'edge_cap': 0.5537646125346029, 'bull_strategy': 'mean_reversion', 'bull_bb_std_mult': 0.6858266079388388, 'bull_rsi_os': 13, 'bull_rsi_ob': 83, 'bull_adx_thresh': 26.48083409150986, 'bull_atr_min_pct': 0.029207780503429627, 'bull_atr_max_pct': 0.0637746413584459, 'bull_tp_mult': 2.993807729535558, 'bull_tsl_mult': 0.6623284598088258, 'bull_time_stop': 274, 'bull_use_sma': False, 'bull_use_ema': True, 'bull_use_atr': False, 'bull_use_adx': False, 'bull_use_spike': False, 'bull_rsi_required': True, 'bear_strategy': 'breakout', 'bear_bb_std_mult': 3.1091976216947117, 'bear_rsi_os': 51, 'bear_rsi_ob': 74, 'bear_adx_thresh': 21.201914754874544, 'bear_atr_min_pct': 0.017653009660245765, 'bear_atr_max_pct': 0.13498870336357818, 'bear_tp_mult': 2.8041077262240544, 'bear_tsl_mult': 0.7821545888418683, 'bear_time_stop': 227, 'bear_use_sma': True, 'bear_use_ema': True, 'bear_use_atr': False, 'bear_use_adx': False, 'bear_use_spike': False, 'bear_rsi_required': True, 'sideways_strategy': 'breakout', 'sideways_bb_std_mult': 2.7469501049264244, 'sideways_rsi_os': 27, 'sideways_rsi_ob': 95, 'sideways_adx_thresh': 13.033960980264972, 'sideways_atr_min_pct': 0.0011548099493865135, 'sideways_atr_max_pct': 0.0435731428784451, 'sideways_tp_mult': 2.7571199020173314, 'sideways_tsl_mult': 0.3506928290307343, 'sideways_time_stop': 5, 'sideways_use_sma': True, 'sideways_use_ema': False, 'sideways_use_atr': True, 'sideways_use_adx': False, 'sideways_use_spike': True, 'sideways_rsi_required': True}.
[I 2025-08-31 11:33:18,043] Trial 754 finished with values: [-0.0658260941376273, 0.06603957058481023] and parameters: {'p_sma': 48, 'p_std': 22, 'p_atr': 12, 'p_adx': 12, 'rsi_period': 51, 'ema1': 10, 'ema2': 43, 'slip_atr_k': 0.10012729496060971, 'slip_spread_k': 0.16075136591757577, 'spread_hl_frac': 0.006541077454396677, 'bb_std_mult': 2.7840047156121748, 'rsi_os': 28, 'rsi_ob': 94, 'vol_spike': 0.13788405459049138, 'adx_thresh': 32.998826338670995, 'atr_min_pct': 0.01076050387585581, 'atr_max_pct': 0.1498261448380504, 'tp_mult': 1.6712077994774586, 'tsl_mult': 0.034924307018951724, 'strategy': 'breakout', 'time_stop': 212, 'use_sma': False, 'use_atr': False, 'use_adx': True, 'use_ema': True, 'use_spike': True, 'rsi_required': False, 'edge_k': 0.46873962219334653, 'edge_cap': 0.5618167414566487, 'bull_strategy': 'mean_reversion', 'bull_bb_std_mult': 1.984204685436892, 'bull_rsi_os': 13, 'bull_rsi_ob': 82, 'bull_adx_thresh': 29.370105348841037, 'bull_atr_min_pct': 0.0291623388468837, 'bull_atr_max_pct': 0.09338791714149677, 'bull_tp_mult': 1.8368797872311076, 'bull_tsl_mult': 0.5617619778500318, 'bull_time_stop': 281, 'bull_use_sma': False, 'bull_use_ema': True, 'bull_use_atr': False, 'bull_use_adx': False, 'bull_use_spike': False, 'bull_rsi_required': True, 'bear_strategy': 'breakout', 'bear_bb_std_mult': 3.114069407216026, 'bear_rsi_os': 51, 'bear_rsi_ob': 74, 'bear_adx_thresh': 21.02022057469421, 'bear_atr_min_pct': 0.0030697287866344753, 'bear_atr_max_pct': 0.14228324375707305, 'bear_tp_mult': 2.782909227852336, 'bear_tsl_mult': 0.7866972142524087, 'bear_time_stop': 35, 'bear_use_sma': True, 'bear_use_ema': True, 'bear_use_atr': False, 'bear_use_adx': False, 'bear_use_spike': False, 'bear_rsi_required': True, 'sideways_strategy': 'breakout', 'sideways_bb_std_mult': 0.5181598081021621, 'sideways_rsi_os': 27, 'sideways_rsi_ob': 94, 'sideways_adx_thresh': 13.918477852343837, 'sideways_atr_min_pct': 0.015792787823799722, 'sideways_atr_max_pct': 0.043190985749913986, 'sideways_tp_mult': 2.345568525350474, 'sideways_tsl_mult': 0.32972703790287594, 'sideways_time_stop': 5, 'sideways_use_sma': False, 'sideways_use_ema': False, 'sideways_use_atr': True, 'sideways_use_adx': False, 'sideways_use_spike': True, 'sideways_rsi_required': True}.
[I 2025-08-31 11:33:18,157] Trial 753 finished with values: [-0.024789309261960657, 0.02596529904902171] and parameters: {'p_sma': 32, 'p_std': 31, 'p_atr': 12, 'p_adx': 13, 'rsi_period': 51, 'ema1': 12, 'ema2': 43, 'slip_atr_k': 0.02472436935642175, 'slip_spread_k': 0.16999540609212688, 'spread_hl_frac': 0.00786412415089282, 'bb_std_mult': 2.81356203704762, 'rsi_os': 30, 'rsi_ob': 95, 'vol_spike': 0.2918719076047773, 'adx_thresh': 33.58610079573464, 'atr_min_pct': 0.0108350894469557, 'atr_max_pct': 0.1497456042028385, 'tp_mult': 1.5965473412025373, 'tsl_mult': 0.03746661261743557, 'strategy': 'breakout', 'time_stop': 201, 'use_sma': True, 'use_atr': False, 'use_adx': True, 'use_ema': True, 'use_spike': True, 'rsi_required': False, 'edge_k': 0.42611079057991136, 'edge_cap': 0.558965123431973, 'bull_strategy': 'mean_reversion', 'bull_bb_std_mult': 0.6290819777544838, 'bull_rsi_os': 12, 'bull_rsi_ob': 83, 'bull_adx_thresh': 5.626395824045243, 'bull_atr_min_pct': 0.0037136976326032503, 'bull_atr_max_pct': 0.12557065848562549, 'bull_tp_mult': 1.8399281383668034, 'bull_tsl_mult': 0.5617744263137588, 'bull_time_stop': 281, 'bull_use_sma': False, 'bull_use_ema': True, 'bull_use_atr': False, 'bull_use_adx': False, 'bull_use_spike': False, 'bull_rsi_required': True, 'bear_strategy': 'breakout', 'bear_bb_std_mult': 3.1185773813630404, 'bear_rsi_os': 51, 'bear_rsi_ob': 73, 'bear_adx_thresh': 6.095757199614873, 'bear_atr_min_pct': 0.004158616073362308, 'bear_atr_max_pct': 0.1428083524919325, 'bear_tp_mult': 2.4419058214599985, 'bear_tsl_mult': 0.7849546084246228, 'bear_time_stop': 198, 'bear_use_sma': True, 'bear_use_ema': True, 'bear_use_atr': False, 'bear_use_adx': False, 'bear_use_spike': False, 'bear_rsi_required': True, 'sideways_strategy': 'breakout', 'sideways_bb_std_mult': 1.5626062247385177, 'sideways_rsi_os': 27, 'sideways_rsi_ob': 95, 'sideways_adx_thresh': 11.065840499039192, 'sideways_atr_min_pct': 0.017158311596136063, 'sideways_atr_max_pct': 0.0424735552762429, 'sideways_tp_mult': 2.346786980667606, 'sideways_tsl_mult': 0.3418809939303345, 'sideways_time_stop': 13, 'sideways_use_sma': False, 'sideways_use_ema': False, 'sideways_use_atr': True, 'sideways_use_adx': False, 'sideways_use_spike': True, 'sideways_rsi_required': True}.
