[I 2025-09-01 05:05:41,592] Trial 370 finished with values: [-1000000000.0, 1000000000.0] and parameters: {'p_sma': 26, 'p_std': 58, 'p_atr': 11, 'p_adx': 17, 'rsi_period': 10, 'ema1': 18, 'ema2': 28, 'slip_atr_k': 0.008262579809679864, 'slip_spread_k': 0.29682492030827534, 'spread_hl_frac': 0.04613358505480031, 'bb_std_mult': 3.3677580082230554, 'rsi_os': 13, 'rsi_ob': 84, 'vol_spike': 0.2017069431086312, 'adx_thresh': 26.29921326309333, 'atr_min_pct': 0.023053583163610718, 'atr_max_pct': 0.02436345086079008, 'tp_mult': 2.622557891516732, 'tsl_mult': 0.9748308286779127, 'strategy': 'breakout', 'time_stop': 187, 'use_sma': False, 'use_atr': False, 'use_adx': False, 'use_ema': True, 'use_spike': False, 'rsi_required': False, 'edge_k': 0.6358328896467466, 'edge_cap': 0.5224429840103322, 'bull_strategy': 'breakout', 'bull_bb_std_mult': 2.348669582617949, 'bull_rsi_os': 23, 'bull_rsi_ob': 82, 'bull_adx_thresh': 22.739142436223666, 'bull_atr_min_pct': 0.017145129766465973, 'bull_atr_max_pct': 0.12199059279490584, 'bull_tp_mult': 1.5042894344861968, 'bull_tsl_mult': 0.04934811847574411, 'bull_time_stop': 232, 'bull_use_sma': False, 'bull_use_ema': False, 'bull_use_atr': False, 'bull_use_adx': False, 'bull_use_spike': False, 'bull_rsi_required': True, 'bear_strategy': 'mean_reversion', 'bear_bb_std_mult': 0.8648233093244486, 'bear_rsi_os': 12, 'bear_rsi_ob': 66, 'bear_adx_thresh': 29.5215509235249, 'bear_atr_min_pct': 0.011355615921547825, 'bear_atr_max_pct': 0.06435764161497598, 'bear_tp_mult': 1.271917964150827, 'bear_tsl_mult': 0.6366742876504283, 'bear_time_stop': 216, 'bear_use_sma': True, 'bear_use_ema': True, 'bear_use_atr': False, 'bear_use_adx': False, 'bear_use_spike': False, 'bear_rsi_required': True, 'sideways_strategy': 'breakout', 'sideways_bb_std_mult': 0.6826840423734103, 'sideways_rsi_os': 42, 'sideways_rsi_ob': 55, 'sideways_adx_thresh': 18.536506993750425, 'sideways_atr_min_pct': 0.0071989377222545425, 'sideways_atr_max_pct': 0.1085015862575976, 'sideways_tp_mult': 2.071007977535341, 'sideways_tsl_mult': 0.9186280889463265, 'sideways_time_stop': 181, 'sideways_use_sma': True, 'sideways_use_ema': True, 'sideways_use_atr': False, 'sideways_use_adx': True, 'sideways_use_spike': True, 'sideways_rsi_required': False}.
[I 2025-09-01 05:05:42,411] Trial 371 finished with values: [-1000000000.0, 1000000000.0] and parameters: {'p_sma': 25, 'p_std': 58, 'p_atr': 11, 'p_adx': 19, 'rsi_period': 10, 'ema1': 29, 'ema2': 30, 'slip_atr_k': 0.17059958180959456, 'slip_spread_k': 0.9844786669474976, 'spread_hl_frac': 0.04632986809302817, 'bb_std_mult': 3.3845984522384813, 'rsi_os': 27, 'rsi_ob': 90, 'vol_spike': 0.09670462423341392, 'adx_thresh': 30.776682488923665, 'atr_min_pct': 0.024471473425293662, 'atr_max_pct': 0.07355750294997727, 'tp_mult': 2.610731214617085, 'tsl_mult': 0.5682404981231497, 'strategy': 'breakout', 'time_stop': 28, 'use_sma': False, 'use_atr': False, 'use_adx': False, 'use_ema': True, 'use_spike': False, 'rsi_required': False, 'edge_k': 0.5262847324221854, 'edge_cap': 0.480752531179182, 'bull_strategy': 'breakout', 'bull_bb_std_mult': 0.5043140978411724, 'bull_rsi_os': 23, 'bull_rsi_ob': 74, 'bull_adx_thresh': 18.650825919333737, 'bull_atr_min_pct': 0.016977238906111424, 'bull_atr_max_pct': 0.12194650948040926, 'bull_tp_mult': 1.496407479724379, 'bull_tsl_mult': 0.39748445025153156, 'bull_time_stop': 233, 'bull_use_sma': False, 'bull_use_ema': False, 'bull_use_atr': False, 'bull_use_adx': False, 'bull_use_spike': False, 'bull_rsi_required': True, 'bear_strategy': 'mean_reversion', 'bear_bb_std_mult': 0.8483761727783661, 'bear_rsi_os': 13, 'bear_rsi_ob': 65, 'bear_adx_thresh': 28.203505264803525, 'bear_atr_min_pct': 0.029549698261435487, 'bear_atr_max_pct': 0.06366354610790269, 'bear_tp_mult': 1.4452024475886613, 'bear_tsl_mult': 0.6393039946201213, 'bear_time_stop': 216, 'bear_use_sma': True, 'bear_use_ema': True, 'bear_use_atr': False, 'bear_use_adx': False, 'bear_use_spike': False, 'bear_rsi_required': True, 'sideways_strategy': 'breakout', 'sideways_bb_std_mult': 0.7732690246241085, 'sideways_rsi_os': 48, 'sideways_rsi_ob': 54, 'sideways_adx_thresh': 26.32334604561952, 'sideways_atr_min_pct': 0.025336543463683865, 'sideways_atr_max_pct': 0.11036607684117415, 'sideways_tp_mult': 1.136136467809437, 'sideways_tsl_mult': 0.9458431716137984, 'sideways_time_stop': 182, 'sideways_use_sma': True, 'sideways_use_ema': True, 'sideways_use_atr': False, 'sideways_use_adx': True, 'sideways_use_spike': True, 'sideways_rsi_required': False}.
[I 2025-09-01 05:05:42,828] Trial 368 finished with values: [-1000000000.0, 1000000000.0] and parameters: {'p_sma': 26, 'p_std': 56, 'p_atr': 11, 'p_adx': 14, 'rsi_period': 10, 'ema1': 21, 'ema2': 30, 'slip_atr_k': 0.004911085014840839, 'slip_spread_k': 0.14866203701649505, 'spread_hl_frac': 0.036831152436734085, 'bb_std_mult': 3.46496450840859, 'rsi_os': 26, 'rsi_ob': 83, 'vol_spike': 0.1756724423212172, 'adx_thresh': 19.063550138082686, 'atr_min_pct': 0.023145699037267778, 'atr_max_pct': 0.055161980025233495, 'tp_mult': 2.898697828279623, 'tsl_mult': 0.999978751688334, 'strategy': 'breakout', 'time_stop': 179, 'use_sma': False, 'use_atr': False, 'use_adx': False, 'use_ema': True, 'use_spike': True, 'rsi_required': False, 'edge_k': 0.6378516936886427, 'edge_cap': 0.4781136861875941, 'bull_strategy': 'breakout', 'bull_bb_std_mult': 2.2225041217473813, 'bull_rsi_os': 25, 'bull_rsi_ob': 77, 'bull_adx_thresh': 28.31202861794675, 'bull_atr_min_pct': 0.0016948674132535007, 'bull_atr_max_pct': 0.06356176302736058, 'bull_tp_mult': 1.6038327222062665, 'bull_tsl_mult': 0.4366121019150445, 'bull_time_stop': 242, 'bull_use_sma': True, 'bull_use_ema': True, 'bull_use_atr': False, 'bull_use_adx': False, 'bull_use_spike': False, 'bull_rsi_required': True, 'bear_strategy': 'mean_reversion', 'bear_bb_std_mult': 0.7383037287337485, 'bear_rsi_os': 16, 'bear_rsi_ob': 66, 'bear_adx_thresh': 29.280257297492202, 'bear_atr_min_pct': 0.007720837902356862, 'bear_atr_max_pct': 0.06317958286362879, 'bear_tp_mult': 1.2792014918560746, 'bear_tsl_mult': 0.6179505533249953, 'bear_time_stop': 199, 'bear_use_sma': True, 'bear_use_ema': True, 'bear_use_atr': False, 'bear_use_adx': False, 'bear_use_spike': False, 'bear_rsi_required': True, 'sideways_strategy': 'breakout', 'sideways_bb_std_mult': 0.650978892883219, 'sideways_rsi_os': 47, 'sideways_rsi_ob': 55, 'sideways_adx_thresh': 18.698987457855484, 'sideways_atr_min_pct': 0.02543956017409828, 'sideways_atr_max_pct': 0.10883857961330852, 'sideways_tp_mult': 1.172397527702898, 'sideways_tsl_mult': 0.91411259125608, 'sideways_time_stop': 180, 'sideways_use_sma': False, 'sideways_use_ema': True, 'sideways_use_atr': False, 'sideways_use_adx': False, 'sideways_use_spike': True, 'sideways_rsi_required': False}.
[I 2025-09-01 05:06:21,934] Trial 375 finished with values: [-0.020093724989284634, 0.01991620335326869] and parameters: {'p_sma': 23, 'p_std': 58, 'p_atr': 20, 'p_adx': 19, 'rsi_period': 7, 'ema1': 29, 'ema2': 41, 'slip_atr_k': 0.1185791130021469, 'slip_spread_k': 0.6698372183393523, 'spread_hl_frac': 0.026336244577376197, 'bb_std_mult': 3.437605073616904, 'rsi_os': 22, 'rsi_ob': 91, 'vol_spike': 0.08966050189212785, 'adx_thresh': 16.65546567096034, 'atr_min_pct': 0.021792689652252548, 'atr_max_pct': 0.10478036078556988, 'tp_mult': 2.496488635461131, 'tsl_mult': 0.4959114719581357, 'strategy': 'breakout', 'time_stop': 211, 'use_sma': False, 'use_atr': True, 'use_adx': True, 'use_ema': True, 'use_spike': True, 'rsi_required': True, 'edge_k': 1.1887963292878438, 'edge_cap': 0.49165836305432004, 'bull_strategy': 'breakout', 'bull_bb_std_mult': 1.0459748217265419, 'bull_rsi_os': 23, 'bull_rsi_ob': 88, 'bull_adx_thresh': 10.932136050121734, 'bull_atr_min_pct': 0.0011460284318537191, 'bull_atr_max_pct': 0.1179873687894797, 'bull_tp_mult': 1.557806662883337, 'bull_tsl_mult': 0.580573066008681, 'bull_time_stop': 233, 'bull_use_sma': True, 'bull_use_ema': False, 'bull_use_atr': False, 'bull_use_adx': False, 'bull_use_spike': False, 'bull_rsi_required': True, 'bear_strategy': 'mean_reversion', 'bear_bb_std_mult': 0.816107504386179, 'bear_rsi_os': 18, 'bear_rsi_ob': 64, 'bear_adx_thresh': 30.9996912621853, 'bear_atr_min_pct': 0.028840275705240108, 'bear_atr_max_pct': 0.07006304796525485, 'bear_tp_mult': 1.189433283169621, 'bear_tsl_mult': 0.5847810870107586, 'bear_time_stop': 10, 'bear_use_sma': False, 'bear_use_ema': False, 'bear_use_atr': False, 'bear_use_adx': False, 'bear_use_spike': False, 'bear_rsi_required': False, 'sideways_strategy': 'breakout', 'sideways_bb_std_mult': 0.7194477761536848, 'sideways_rsi_os': 36, 'sideways_rsi_ob': 88, 'sideways_adx_thresh': 20.794888536766177, 'sideways_atr_min_pct': 0.026203427429109003, 'sideways_atr_max_pct': 0.035267334260794564, 'sideways_tp_mult': 1.0821242104898983, 'sideways_tsl_mult': 0.9879495853461316, 'sideways_time_stop': 193, 'sideways_use_sma': True, 'sideways_use_ema': False, 'sideways_use_atr': False, 'sideways_use_adx': False, 'sideways_use_spike': True, 'sideways_rsi_required': False}.
[I 2025-09-01 05:06:22,388] Trial 374 finished with values: [-0.04312026848245765, 0.04320061492727264] and parameters: {'p_sma': 24, 'p_std': 55, 'p_atr': 20, 'p_adx': 19, 'rsi_period': 9, 'ema1': 29, 'ema2': 41, 'slip_atr_k': 0.2148141014200997, 'slip_spread_k': 0.2772329430673406, 'spread_hl_frac': 0.047771358307893357, 'bb_std_mult': 3.5376927282612027, 'rsi_os': 19, 'rsi_ob': 91, 'vol_spike': 0.1829564761799711, 'adx_thresh': 12.973788642638139, 'atr_min_pct': 0.023778565255160665, 'atr_max_pct': 0.10891679016848496, 'tp_mult': 2.4864575714238457, 'tsl_mult': 0.02529580247297669, 'strategy': 'breakout', 'time_stop': 213, 'use_sma': False, 'use_atr': True, 'use_adx': True, 'use_ema': True, 'use_spike': True, 'rsi_required': True, 'edge_k': 0.5764379646075126, 'edge_cap': 0.48182086079136116, 'bull_strategy': 'breakout', 'bull_bb_std_mult': 3.0317855808622864, 'bull_rsi_os': 25, 'bull_rsi_ob': 87, 'bull_adx_thresh': 17.852676512805033, 'bull_atr_min_pct': 0.004865153100078366, 'bull_atr_max_pct': 0.11742790888251425, 'bull_tp_mult': 1.0565487330444066, 'bull_tsl_mult': 0.13235015595921534, 'bull_time_stop': 249, 'bull_use_sma': True, 'bull_use_ema': False, 'bull_use_atr': False, 'bull_use_adx': False, 'bull_use_spike': False, 'bull_rsi_required': True, 'bear_strategy': 'mean_reversion', 'bear_bb_std_mult': 0.7045168192353807, 'bear_rsi_os': 9, 'bear_rsi_ob': 64, 'bear_adx_thresh': 30.682118951038234, 'bear_atr_min_pct': 0.0017607662227380576, 'bear_atr_max_pct': 0.06093010005844611, 'bear_tp_mult': 1.1891467905177477, 'bear_tsl_mult': 0.5908310002060685, 'bear_time_stop': 27, 'bear_use_sma': False, 'bear_use_ema': False, 'bear_use_atr': False, 'bear_use_adx': False, 'bear_use_spike': False, 'bear_rsi_required': False, 'sideways_strategy': 'breakout', 'sideways_bb_std_mult': 0.6118103108737899, 'sideways_rsi_os': 36, 'sideways_rsi_ob': 60, 'sideways_adx_thresh': 19.16349583310662, 'sideways_atr_min_pct': 0.024663621603782493, 'sideways_atr_max_pct': 0.1195670379541518, 'sideways_tp_mult': 1.1769591997597564, 'sideways_tsl_mult': 0.9859934580215746, 'sideways_time_stop': 192, 'sideways_use_sma': True, 'sideways_use_ema': False, 'sideways_use_atr': False, 'sideways_use_adx': False, 'sideways_use_spike': True, 'sideways_rsi_required': False}.
[I 2025-09-01 05:06:22,887] Trial 373 finished with values: [-0.015846426347382314, 0.01568406442407864] and parameters: {'p_sma': 24, 'p_std': 58, 'p_atr': 18, 'p_adx': 19, 'rsi_period': 10, 'ema1': 29, 'ema2': 19, 'slip_atr_k': 0.04504074487174482, 'slip_spread_k': 0.20072271062877656, 'spread_hl_frac': 0.04788863721485921, 'bb_std_mult': 3.447869836195129, 'rsi_os': 27, 'rsi_ob': 90, 'vol_spike': 0.09633895204897003, 'adx_thresh': 16.273928464199354, 'atr_min_pct': 0.02422702617328276, 'atr_max_pct': 0.058273265627400164, 'tp_mult': 2.487101323284966, 'tsl_mult': 0.980334304853299, 'strategy': 'breakout', 'time_stop': 75, 'use_sma': False, 'use_atr': False, 'use_adx': False, 'use_ema': True, 'use_spike': True, 'rsi_required': False, 'edge_k': 0.5399212041831221, 'edge_cap': 0.47863148645682985, 'bull_strategy': 'breakout', 'bull_bb_std_mult': 1.0627804256393645, 'bull_rsi_os': 23, 'bull_rsi_ob': 88, 'bull_adx_thresh': 18.661032761602943, 'bull_atr_min_pct': 0.0012982378899225083, 'bull_atr_max_pct': 0.11737988535943526, 'bull_tp_mult': 1.5534803418691985, 'bull_tsl_mult': 0.0038251880143595485, 'bull_time_stop': 232, 'bull_use_sma': True, 'bull_use_ema': False, 'bull_use_atr': False, 'bull_use_adx': False, 'bull_use_spike': False, 'bull_rsi_required': True, 'bear_strategy': 'mean_reversion', 'bear_bb_std_mult': 0.82794417283438, 'bear_rsi_os': 16, 'bear_rsi_ob': 64, 'bear_adx_thresh': 28.406023007468725, 'bear_atr_min_pct': 0.02900536495832294, 'bear_atr_max_pct': 0.07040883020619268, 'bear_tp_mult': 1.4430606081493946, 'bear_tsl_mult': 0.5471825400713248, 'bear_time_stop': 228, 'bear_use_sma': True, 'bear_use_ema': False, 'bear_use_atr': False, 'bear_use_adx': False, 'bear_use_spike': False, 'bear_rsi_required': False, 'sideways_strategy': 'breakout', 'sideways_bb_std_mult': 0.7875395975334037, 'sideways_rsi_os': 36, 'sideways_rsi_ob': 56, 'sideways_adx_thresh': 13.04870323984288, 'sideways_atr_min_pct': 0.02922074459750682, 'sideways_atr_max_pct': 0.11759080099483954, 'sideways_tp_mult': 1.1442911920704097, 'sideways_tsl_mult': 0.9354841199477291, 'sideways_time_stop': 181, 'sideways_use_sma': True, 'sideways_use_ema': True, 'sideways_use_atr': False, 'sideways_use_adx': False, 'sideways_use_spike': True, 'sideways_rsi_required': False}.
[I 2025-09-01 05:06:23,301] Trial 372 finished with values: [-1000000000.0, 1000000000.0] and parameters: {'p_sma': 24, 'p_std': 58, 'p_atr': 27, 'p_adx': 19, 'rsi_period': 10, 'ema1': 18, 'ema2': 17, 'slip_atr_k': 0.006267164880321306, 'slip_spread_k': 0.2006206041592311, 'spread_hl_frac': 0.04766002070374205, 'bb_std_mult': 3.367303306603381, 'rsi_os': 26, 'rsi_ob': 91, 'vol_spike': 0.18260042940157933, 'adx_thresh': 16.337081730939065, 'atr_min_pct': 0.02194599173747458, 'atr_max_pct': 0.053665780259892305, 'tp_mult': 2.6021714858805765, 'tsl_mult': 0.9778972641977748, 'strategy': 'breakout', 'time_stop': 118, 'use_sma': False, 'use_atr': False, 'use_adx': False, 'use_ema': True, 'use_spike': False, 'rsi_required': False, 'edge_k': 0.5402897997446484, 'edge_cap': 0.4830917569993757, 'bull_strategy': 'breakout', 'bull_bb_std_mult': 1.2918937494305114, 'bull_rsi_os': 23, 'bull_rsi_ob': 94, 'bull_adx_thresh': 5.008787903082986, 'bull_atr_min_pct': 0.02181328986896192, 'bull_atr_max_pct': 0.11754242993305973, 'bull_tp_mult': 1.554924732128234, 'bull_tsl_mult': 0.40705283790176755, 'bull_time_stop': 231, 'bull_use_sma': True, 'bull_use_ema': False, 'bull_use_atr': False, 'bull_use_adx': False, 'bull_use_spike': False, 'bull_rsi_required': True, 'bear_strategy': 'mean_reversion', 'bear_bb_std_mult': 0.8552347028406561, 'bear_rsi_os': 12, 'bear_rsi_ob': 70, 'bear_adx_thresh': 32.622241572679066, 'bear_atr_min_pct': 0.011280660112757539, 'bear_atr_max_pct': 0.06195245372635415, 'bear_tp_mult': 1.4936490901829313, 'bear_tsl_mult': 0.506856957728117, 'bear_time_stop': 218, 'bear_use_sma': True, 'bear_use_ema': True, 'bear_use_atr': False, 'bear_use_adx': False, 'bear_use_spike': False, 'bear_rsi_required': True, 'sideways_strategy': 'breakout', 'sideways_bb_std_mult': 0.6048029257746657, 'sideways_rsi_os': 48, 'sideways_rsi_ob': 60, 'sideways_adx_thresh': 20.82682078323057, 'sideways_atr_min_pct': 0.015363755808863618, 'sideways_atr_max_pct': 0.10863564675768833, 'sideways_tp_mult': 1.1104610421331065, 'sideways_tsl_mult': 0.8358187100595538, 'sideways_time_stop': 180, 'sideways_use_sma': True, 'sideways_use_ema': True, 'sideways_use_atr': False, 'sideways_use_adx': False, 'sideways_use_spike': True, 'sideways_rsi_required': False}.
[I 2025-09-01 05:07:07,845] Trial 376 finished with values: [-0.028862578763501734, 0.028869717365153775] and parameters: {'p_sma': 24, 'p_std': 55, 'p_atr': 20, 'p_adx': 27, 'rsi_period': 7, 'ema1': 29, 'ema2': 17, 'slip_atr_k': 0.0456303809055313, 'slip_spread_k': 0.20066480136648934, 'spread_hl_frac': 0.04771297084252101, 'bb_std_mult': 3.560812864508517, 'rsi_os': 23, 'rsi_ob': 91, 'vol_spike': 0.0061799744737301154, 'adx_thresh': 21.831304954243382, 'atr_min_pct': 0.021611759156526612, 'atr_max_pct': 0.13726831015888974, 'tp_mult': 1.3128391478942256, 'tsl_mult': 0.7909589130863457, 'strategy': 'breakout', 'time_stop': 216, 'use_sma': False, 'use_atr': False, 'use_adx': True, 'use_ema': True, 'use_spike': True, 'rsi_required': True, 'edge_k': 0.9108778829555846, 'edge_cap': 0.49406213979991, 'bull_strategy': 'breakout', 'bull_bb_std_mult': 0.7507858964118621, 'bull_rsi_os': 25, 'bull_rsi_ob': 93, 'bull_adx_thresh': 16.51392182873424, 'bull_atr_min_pct': 0.001068299349485934, 'bull_atr_max_pct': 0.04531900390529975, 'bull_tp_mult': 1.5492824064723734, 'bull_tsl_mult': 0.5779103496140037, 'bull_time_stop': 248, 'bull_use_sma': True, 'bull_use_ema': False, 'bull_use_atr': False, 'bull_use_adx': False, 'bull_use_spike': False, 'bull_rsi_required': True, 'bear_strategy': 'mean_reversion', 'bear_bb_std_mult': 0.8076031958280445, 'bear_rsi_os': 6, 'bear_rsi_ob': 64, 'bear_adx_thresh': 27.796407517774256, 'bear_atr_min_pct': 0.0025551957387728967, 'bear_atr_max_pct': 0.07244890892758649, 'bear_tp_mult': 2.831897732940627, 'bear_tsl_mult': 0.512623373260796, 'bear_time_stop': 226, 'bear_use_sma': False, 'bear_use_ema': False, 'bear_use_atr': False, 'bear_use_adx': False, 'bear_use_spike': False, 'bear_rsi_required': False, 'sideways_strategy': 'breakout', 'sideways_bb_std_mult': 0.6070723340351837, 'sideways_rsi_os': 36, 'sideways_rsi_ob': 58, 'sideways_adx_thresh': 19.316819757361355, 'sideways_atr_min_pct': 0.022268940456155642, 'sideways_atr_max_pct': 0.028423008695534324, 'sideways_tp_mult': 1.0570624742514063, 'sideways_tsl_mult': 0.15908268103352347, 'sideways_time_stop': 12, 'sideways_use_sma': True, 'sideways_use_ema': False, 'sideways_use_atr': False, 'sideways_use_adx': False, 'sideways_use_spike': True, 'sideways_rsi_required': False}.
[I 2025-09-01 05:07:09,836] Trial 378 finished with values: [-1000000000.0, 1000000000.0] and parameters: {'p_sma': 23, 'p_std': 60, 'p_atr': 27, 'p_adx': 12, 'rsi_period': 7, 'ema1': 23, 'ema2': 29, 'slip_atr_k': 0.12059127988153642, 'slip_spread_k': 0.2066610410384046, 'spread_hl_frac': 0.020092174041591002, 'bb_std_mult': 3.437355341182473, 'rsi_os': 24, 'rsi_ob': 87, 'vol_spike': 0.2134994061875821, 'adx_thresh': 21.860076247216462, 'atr_min_pct': 0.021798520790840256, 'atr_max_pct': 0.1170793124981061, 'tp_mult': 1.2036180767924016, 'tsl_mult': 0.8070654441087806, 'strategy': 'mean_reversion', 'time_stop': 54, 'use_sma': False, 'use_atr': False, 'use_adx': True, 'use_ema': True, 'use_spike': False, 'rsi_required': True, 'edge_k': 0.9027517976531352, 'edge_cap': 0.4965178914953797, 'bull_strategy': 'breakout', 'bull_bb_std_mult': 0.8345785280918683, 'bull_rsi_os': 24, 'bull_rsi_ob': 93, 'bull_adx_thresh': 30.600568029235347, 'bull_atr_min_pct': 0.0023976296666490485, 'bull_atr_max_pct': 0.115258290472103, 'bull_tp_mult': 1.5490390752396985, 'bull_tsl_mult': 0.8993651447673029, 'bull_time_stop': 240, 'bull_use_sma': True, 'bull_use_ema': False, 'bull_use_atr': False, 'bull_use_adx': False, 'bull_use_spike': True, 'bull_rsi_required': True, 'bear_strategy': 'mean_reversion', 'bear_bb_std_mult': 0.8308885591812842, 'bear_rsi_os': 6, 'bear_rsi_ob': 87, 'bear_adx_thresh': 28.65467126712566, 'bear_atr_min_pct': 0.029009990227921254, 'bear_atr_max_pct': 0.0791486913735365, 'bear_tp_mult': 1.3385753498819666, 'bear_tsl_mult': 0.51095162203675, 'bear_time_stop': 209, 'bear_use_sma': False, 'bear_use_ema': False, 'bear_use_atr': False, 'bear_use_adx': False, 'bear_use_spike': True, 'bear_rsi_required': False, 'sideways_strategy': 'breakout', 'sideways_bb_std_mult': 0.7273446955370106, 'sideways_rsi_os': 39, 'sideways_rsi_ob': 56, 'sideways_adx_thresh': 7.041237749104804, 'sideways_atr_min_pct': 0.022320943570633835, 'sideways_atr_max_pct': 0.11481275240367952, 'sideways_tp_mult': 1.0580806548534707, 'sideways_tsl_mult': 0.9992323672921415, 'sideways_time_stop': 58, 'sideways_use_sma': True, 'sideways_use_ema': True, 'sideways_use_atr': False, 'sideways_use_adx': False, 'sideways_use_spike': True, 'sideways_rsi_required': False}.
