[I 2025-09-01 04:08:22,019] Trial 28 finished with values: [-1000000000.0, 1000000000.0] and parameters: {'p_sma': 53, 'p_std': 37, 'p_atr': 18, 'p_adx': 10, 'rsi_period': 7, 'ema1': 10, 'ema2': 25, 'slip_atr_k': 0.07221084323705435, 'slip_spread_k': 0.7784847313219555, 'spread_hl_frac': 0.03138063893376076, 'bb_std_mult': 2.6786437537100367, 'rsi_os': 28, 'rsi_ob': 56, 'vol_spike': 0.258225747518217, 'adx_thresh': 31.82866278729848, 'atr_min_pct': 0.008881300693010054, 'atr_max_pct': 0.0917763929250742, 'tp_mult': 2.4029515972079483, 'tsl_mult': 0.4504994243746224, 'strategy': 'breakout', 'time_stop': 113, 'use_sma': False, 'use_atr': True, 'use_adx': True, 'use_ema': True, 'use_spike': True, 'rsi_required': False, 'edge_k': 0.8115032973884838, 'edge_cap': 0.33374385007160523, 'bull_strategy': 'breakout', 'bull_bb_std_mult': 3.2641470788808706, 'bull_rsi_os': 28, 'bull_rsi_ob': 57, 'bull_adx_thresh': 15.8152923795694, 'bull_atr_min_pct': 0.004224069727430786, 'bull_atr_max_pct': 0.13491848448187674, 'bull_tp_mult': 1.3709130755200678, 'bull_tsl_mult': 0.4738843628699742, 'bull_time_stop': 151, 'bull_use_sma': False, 'bull_use_ema': False, 'bull_use_atr': True, 'bull_use_adx': True, 'bull_use_spike': True, 'bull_rsi_required': False, 'bear_strategy': 'mean_reversion', 'bear_bb_std_mult': 1.6389732081296615, 'bear_rsi_os': 50, 'bear_rsi_ob': 51, 'bear_adx_thresh': 19.233222265471706, 'bear_atr_min_pct': 0.004720431586354489, 'bear_atr_max_pct': 0.01558481610918834, 'bear_tp_mult': 2.073627503875587, 'bear_tsl_mult': 0.4548302750455468, 'bear_time_stop': 180, 'bear_use_sma': True, 'bear_use_ema': False, 'bear_use_atr': False, 'bear_use_adx': True, 'bear_use_spike': True, 'bear_rsi_required': True, 'sideways_strategy': 'mean_reversion', 'sideways_bb_std_mult': 2.3774633130200846, 'sideways_rsi_os': 7, 'sideways_rsi_ob': 94, 'sideways_adx_thresh': 31.27185468673899, 'sideways_atr_min_pct': 0.0004490877830774457, 'sideways_atr_max_pct': 0.10134342029936719, 'sideways_tp_mult': 2.4616687307037273, 'sideways_tsl_mult': 0.23941468830012647, 'sideways_time_stop': 50, 'sideways_use_sma': True, 'sideways_use_ema': True, 'sideways_use_atr': False, 'sideways_use_adx': True, 'sideways_use_spike': False, 'sideways_rsi_required': False}.
[I 2025-09-01 04:08:22,882] Trial 26 finished with values: [-1000000000.0, 1000000000.0] and parameters: {'p_sma': 38, 'p_std': 36, 'p_atr': 20, 'p_adx': 10, 'rsi_period': 29, 'ema1': 22, 'ema2': 27, 'slip_atr_k': 0.07974996249792621, 'slip_spread_k': 0.9921059263765581, 'spread_hl_frac': 0.010937436912347956, 'bb_std_mult': 2.695381798100188, 'rsi_os': 30, 'rsi_ob': 65, 'vol_spike': 0.2631440504187702, 'adx_thresh': 19.862448869687004, 'atr_min_pct': 0.0207514520276553, 'atr_max_pct': 0.09253401110394516, 'tp_mult': 1.5553665219368809, 'tsl_mult': 0.4555246835908733, 'strategy': 'breakout', 'time_stop': 77, 'use_sma': True, 'use_atr': True, 'use_adx': True, 'use_ema': True, 'use_spike': True, 'rsi_required': False, 'edge_k': 0.7988737709664195, 'edge_cap': 0.7808974381198731, 'bull_strategy': 'breakout', 'bull_bb_std_mult': 3.540502341811395, 'bull_rsi_os': 27, 'bull_rsi_ob': 56, 'bull_adx_thresh': 14.159604279201067, 'bull_atr_min_pct': 0.003946931123602885, 'bull_atr_max_pct': 0.0986590254715683, 'bull_tp_mult': 1.3199026130953604, 'bull_tsl_mult': 0.4543919360580695, 'bull_time_stop': 153, 'bull_use_sma': False, 'bull_use_ema': False, 'bull_use_atr': False, 'bull_use_adx': True, 'bull_use_spike': True, 'bull_rsi_required': True, 'bear_strategy': 'breakout', 'bear_bb_std_mult': 1.6065008286023115, 'bear_rsi_os': 49, 'bear_rsi_ob': 53, 'bear_adx_thresh': 17.71575248038409, 'bear_atr_min_pct': 0.005110998561721106, 'bear_atr_max_pct': 0.14958406004726366, 'bear_tp_mult': 1.454094266244637, 'bear_tsl_mult': 0.45240579228297506, 'bear_time_stop': 78, 'bear_use_sma': True, 'bear_use_ema': True, 'bear_use_atr': False, 'bear_use_adx': True, 'bear_use_spike': True, 'bear_rsi_required': True, 'sideways_strategy': 'mean_reversion', 'sideways_bb_std_mult': 2.4178051795438193, 'sideways_rsi_os': 5, 'sideways_rsi_ob': 76, 'sideways_adx_thresh': 26.214654891388406, 'sideways_atr_min_pct': 0.02278198608966763, 'sideways_atr_max_pct': 0.09796236988170662, 'sideways_tp_mult': 1.4976421335947145, 'sideways_tsl_mult': 0.8369126291982776, 'sideways_time_stop': 47, 'sideways_use_sma': False, 'sideways_use_ema': True, 'sideways_use_atr': True, 'sideways_use_adx': True, 'sideways_use_spike': True, 'sideways_rsi_required': False}.
[I 2025-09-01 04:08:23,052] Trial 30 finished with values: [-1000000000.0, 1000000000.0] and parameters: {'p_sma': 51, 'p_std': 15, 'p_atr': 21, 'p_adx': 14, 'rsi_period': 12, 'ema1': 24, 'ema2': 42, 'slip_atr_k': 0.05750592940142592, 'slip_spread_k': 0.8497668008210081, 'spread_hl_frac': 0.012044252931681699, 'bb_std_mult': 0.8910054377528578, 'rsi_os': 51, 'rsi_ob': 86, 'vol_spike': 0.14441108163057928, 'adx_thresh': 12.511855294570806, 'atr_min_pct': 0.02338651435690611, 'atr_max_pct': 0.010241020819486135, 'tp_mult': 1.2386293083309727, 'tsl_mult': 0.6104493342175297, 'strategy': 'breakout', 'time_stop': 63, 'use_sma': False, 'use_atr': False, 'use_adx': False, 'use_ema': True, 'use_spike': True, 'rsi_required': False, 'edge_k': 1.9944403406671316, 'edge_cap': 0.8458918927993375, 'bull_strategy': 'mean_reversion', 'bull_bb_std_mult': 2.8668386378561146, 'bull_rsi_os': 40, 'bull_rsi_ob': 45, 'bull_adx_thresh': 16.304603539154822, 'bull_atr_min_pct': 0.018452496805503076, 'bull_atr_max_pct': 0.052511824983105276, 'bull_tp_mult': 1.7799452779224156, 'bull_tsl_mult': 0.7840956321200463, 'bull_time_stop': 231, 'bull_use_sma': True, 'bull_use_ema': False, 'bull_use_atr': True, 'bull_use_adx': True, 'bull_use_spike': True, 'bull_rsi_required': False, 'bear_strategy': 'breakout', 'bear_bb_std_mult': 3.0651317301584533, 'bear_rsi_os': 18, 'bear_rsi_ob': 45, 'bear_adx_thresh': 15.57228980177422, 'bear_atr_min_pct': 0.0056406706272052135, 'bear_atr_max_pct': 0.06790242324343129, 'bear_tp_mult': 1.3069765011062837, 'bear_tsl_mult': 0.3374703131733386, 'bear_time_stop': 189, 'bear_use_sma': True, 'bear_use_ema': False, 'bear_use_atr': False, 'bear_use_adx': True, 'bear_use_spike': True, 'bear_rsi_required': True, 'sideways_strategy': 'breakout', 'sideways_bb_std_mult': 3.1371302896673843, 'sideways_rsi_os': 11, 'sideways_rsi_ob': 59, 'sideways_adx_thresh': 16.427865497712816, 'sideways_atr_min_pct': 0.0034994690965465865, 'sideways_atr_max_pct': 0.12124669575090644, 'sideways_tp_mult': 2.464319022810235, 'sideways_tsl_mult': 0.8585661788372787, 'sideways_time_stop': 43, 'sideways_use_sma': True, 'sideways_use_ema': False, 'sideways_use_atr': True, 'sideways_use_adx': False, 'sideways_use_spike': False, 'sideways_rsi_required': True}.
[I 2025-09-01 04:09:04,927] Trial 29 finished with values: [-1000000000.0, 1000000000.0] and parameters: {'p_sma': 50, 'p_std': 37, 'p_atr': 20, 'p_adx': 19, 'rsi_period': 9, 'ema1': 24, 'ema2': 41, 'slip_atr_k': 0.06454243531341285, 'slip_spread_k': 0.7800281823469847, 'spread_hl_frac': 0.004706010940154934, 'bb_std_mult': 0.8264082158533248, 'rsi_os': 31, 'rsi_ob': 89, 'vol_spike': 0.2533609627123416, 'adx_thresh': 19.248049059560525, 'atr_min_pct': 0.023864260351144022, 'atr_max_pct': 0.04879522037802157, 'tp_mult': 1.2370874034772015, 'tsl_mult': 0.6039158912181135, 'strategy': 'breakout', 'time_stop': 78, 'use_sma': False, 'use_atr': True, 'use_adx': False, 'use_ema': True, 'use_spike': True, 'rsi_required': False, 'edge_k': 0.8137387467825972, 'edge_cap': 0.864945594359533, 'bull_strategy': 'breakout', 'bull_bb_std_mult': 3.3999744996938777, 'bull_rsi_os': 28, 'bull_rsi_ob': 56, 'bull_adx_thresh': 11.19858010579238, 'bull_atr_min_pct': 0.018798392465744003, 'bull_atr_max_pct': 0.07547655211564593, 'bull_tp_mult': 1.840071591957811, 'bull_tsl_mult': 0.743993166236248, 'bull_time_stop': 296, 'bull_use_sma': True, 'bull_use_ema': False, 'bull_use_atr': True, 'bull_use_adx': True, 'bull_use_spike': True, 'bull_rsi_required': False, 'bear_strategy': 'breakout', 'bear_bb_std_mult': 3.0062933544906905, 'bear_rsi_os': 17, 'bear_rsi_ob': 53, 'bear_adx_thresh': 18.214992305715477, 'bear_atr_min_pct': 0.017696219305201467, 'bear_atr_max_pct': 0.08102003966035737, 'bear_tp_mult': 1.3089137811537743, 'bear_tsl_mult': 0.48512625091486933, 'bear_time_stop': 194, 'bear_use_sma': True, 'bear_use_ema': False, 'bear_use_atr': False, 'bear_use_adx': True, 'bear_use_spike': True, 'bear_rsi_required': True, 'sideways_strategy': 'breakout', 'sideways_bb_std_mult': 3.5503123404022254, 'sideways_rsi_os': 10, 'sideways_rsi_ob': 60, 'sideways_adx_thresh': 16.665693230750396, 'sideways_atr_min_pct': 0.0038472011622356327, 'sideways_atr_max_pct': 0.12209015325425801, 'sideways_tp_mult': 2.4277398049158223, 'sideways_tsl_mult': 0.033961752012280466, 'sideways_time_stop': 300, 'sideways_use_sma': True, 'sideways_use_ema': False, 'sideways_use_atr': True, 'sideways_use_adx': False, 'sideways_use_spike': False, 'sideways_rsi_required': False}.
[I 2025-09-01 04:09:07,395] Trial 32 finished with values: [-1000000000.0, 1000000000.0] and parameters: {'p_sma': 52, 'p_std': 15, 'p_atr': 22, 'p_adx': 19, 'rsi_period': 43, 'ema1': 25, 'ema2': 40, 'slip_atr_k': 0.05755241423541857, 'slip_spread_k': 0.8868618612522063, 'spread_hl_frac': 0.0034850603364900597, 'bb_std_mult': 0.7828045324501369, 'rsi_os': 42, 'rsi_ob': 88, 'vol_spike': 0.13708055862249158, 'adx_thresh': 13.483210985953379, 'atr_min_pct': 0.024979542263098634, 'atr_max_pct': 0.04168354415464974, 'tp_mult': 1.218943171275431, 'tsl_mult': 0.6090013129205907, 'strategy': 'breakout', 'time_stop': 49, 'use_sma': False, 'use_atr': False, 'use_adx': False, 'use_ema': False, 'use_spike': True, 'rsi_required': True, 'edge_k': 0.5674189484860614, 'edge_cap': 0.6513603730671884, 'bull_strategy': 'mean_reversion', 'bull_bb_std_mult': 2.11586331590588, 'bull_rsi_os': 41, 'bull_rsi_ob': 69, 'bull_adx_thresh': 11.405703359990136, 'bull_atr_min_pct': 0.018375473831169185, 'bull_atr_max_pct': 0.049251177986254335, 'bull_tp_mult': 2.9962167518022578, 'bull_tsl_mult': 0.789007875129144, 'bull_time_stop': 234, 'bull_use_sma': True, 'bull_use_ema': False, 'bull_use_atr': True, 'bull_use_adx': True, 'bull_use_spike': True, 'bull_rsi_required': False, 'bear_strategy': 'breakout', 'bear_bb_std_mult': 3.0502227740407646, 'bear_rsi_os': 18, 'bear_rsi_ob': 80, 'bear_adx_thresh': 14.916067572691862, 'bear_atr_min_pct': 0.0180053938833858, 'bear_atr_max_pct': 0.06720364135827431, 'bear_tp_mult': 1.3144904662145969, 'bear_tsl_mult': 0.3434784872126704, 'bear_time_stop': 233, 'bear_use_sma': True, 'bear_use_ema': False, 'bear_use_atr': True, 'bear_use_adx': False, 'bear_use_spike': True, 'bear_rsi_required': False, 'sideways_strategy': 'breakout', 'sideways_bb_std_mult': 3.0083981926672307, 'sideways_rsi_os': 13, 'sideways_rsi_ob': 60, 'sideways_adx_thresh': 5.077000931021892, 'sideways_atr_min_pct': 0.0028529158704733927, 'sideways_atr_max_pct': 0.12169281262313797, 'sideways_tp_mult': 2.5139500884400774, 'sideways_tsl_mult': 0.7572074624682845, 'sideways_time_stop': 285, 'sideways_use_sma': True, 'sideways_use_ema': False, 'sideways_use_atr': True, 'sideways_use_adx': False, 'sideways_use_spike': False, 'sideways_rsi_required': True}.
[I 2025-09-01 04:09:07,704] Trial 33 finished with values: [-1000000000.0, 1000000000.0] and parameters: {'p_sma': 41, 'p_std': 26, 'p_atr': 25, 'p_adx': 19, 'rsi_period': 44, 'ema1': 25, 'ema2': 42, 'slip_atr_k': 0.0431534977926506, 'slip_spread_k': 0.8980725623382403, 'spread_hl_frac': 0.003841088915895234, 'bb_std_mult': 1.5423559708422323, 'rsi_os': 42, 'rsi_ob': 95, 'vol_spike': 0.21516810530872643, 'adx_thresh': 10.32411400885134, 'atr_min_pct': 0.024999995754584874, 'atr_max_pct': 0.04152012911767319, 'tp_mult': 1.2408389985897919, 'tsl_mult': 0.7151666270629881, 'strategy': 'breakout', 'time_stop': 162, 'use_sma': False, 'use_atr': False, 'use_adx': False, 'use_ema': False, 'use_spike': True, 'rsi_required': True, 'edge_k': 0.5884819214495403, 'edge_cap': 0.6431780157627692, 'bull_strategy': 'mean_reversion', 'bull_bb_std_mult': 2.2033130035860826, 'bull_rsi_os': 19, 'bull_rsi_ob': 68, 'bull_adx_thresh': 22.01031205770417, 'bull_atr_min_pct': 0.017562030376870177, 'bull_atr_max_pct': 0.08262143892070177, 'bull_tp_mult': 1.7691699595708648, 'bull_tsl_mult': 0.7334515140587662, 'bull_time_stop': 293, 'bull_use_sma': True, 'bull_use_ema': False, 'bull_use_atr': True, 'bull_use_adx': True, 'bull_use_spike': True, 'bull_rsi_required': False, 'bear_strategy': 'breakout', 'bear_bb_std_mult': 3.1473455456579433, 'bear_rsi_os': 12, 'bear_rsi_ob': 48, 'bear_adx_thresh': 33.08221173788828, 'bear_atr_min_pct': 0.01826991542944523, 'bear_atr_max_pct': 0.09107431488169147, 'bear_tp_mult': 1.6722581884039813, 'bear_tsl_mult': 0.35523679332851743, 'bear_time_stop': 225, 'bear_use_sma': False, 'bear_use_ema': False, 'bear_use_atr': True, 'bear_use_adx': False, 'bear_use_spike': False, 'bear_rsi_required': False, 'sideways_strategy': 'breakout', 'sideways_bb_std_mult': 3.5543050377269103, 'sideways_rsi_os': 23, 'sideways_rsi_ob': 53, 'sideways_adx_thresh': 13.577776178977988, 'sideways_atr_min_pct': 0.004591967908741258, 'sideways_atr_max_pct': 0.12174803715385209, 'sideways_tp_mult': 2.930522770389032, 'sideways_tsl_mult': 0.7745522189829243, 'sideways_time_stop': 170, 'sideways_use_sma': True, 'sideways_use_ema': False, 'sideways_use_atr': True, 'sideways_use_adx': False, 'sideways_use_spike': False, 'sideways_rsi_required': True}.
[I 2025-09-01 04:09:07,975] Trial 31 finished with values: [-1000000000.0, 1000000000.0] and parameters: {'p_sma': 42, 'p_std': 5, 'p_atr': 20, 'p_adx': 19, 'rsi_period': 44, 'ema1': 25, 'ema2': 39, 'slip_atr_k': 0.05551333984710767, 'slip_spread_k': 0.8870664770308458, 'spread_hl_frac': 0.012598418457445523, 'bb_std_mult': 1.5318234524788155, 'rsi_os': 52, 'rsi_ob': 89, 'vol_spike': 0.1407302870454655, 'adx_thresh': 13.349046101746069, 'atr_min_pct': 0.029779573254607877, 'atr_max_pct': 0.0420996917646071, 'tp_mult': 1.219207043806914, 'tsl_mult': 0.583793071085761, 'strategy': 'breakout', 'time_stop': 67, 'use_sma': False, 'use_atr': False, 'use_adx': False, 'use_ema': False, 'use_spike': True, 'rsi_required': True, 'edge_k': 0.5473304471328151, 'edge_cap': 0.8479825155406273, 'bull_strategy': 'mean_reversion', 'bull_bb_std_mult': 2.9347431987455614, 'bull_rsi_os': 25, 'bull_rsi_ob': 68, 'bull_adx_thresh': 23.366762249070245, 'bull_atr_min_pct': 0.017329962049557755, 'bull_atr_max_pct': 0.0824197695226978, 'bull_tp_mult': 1.806618579573054, 'bull_tsl_mult': 0.7589470792510772, 'bull_time_stop': 234, 'bull_use_sma': True, 'bull_use_ema': False, 'bull_use_atr': True, 'bull_use_adx': True, 'bull_use_spike': True, 'bull_rsi_required': False, 'bear_strategy': 'breakout', 'bear_bb_std_mult': 3.0280902386842756, 'bear_rsi_os': 18, 'bear_rsi_ob': 47, 'bear_adx_thresh': 16.32371207005795, 'bear_atr_min_pct': 0.018961883127426117, 'bear_atr_max_pct': 0.06737720220061896, 'bear_tp_mult': 1.3262583118117686, 'bear_tsl_mult': 0.3183924630744771, 'bear_time_stop': 207, 'bear_use_sma': True, 'bear_use_ema': False, 'bear_use_atr': False, 'bear_use_adx': True, 'bear_use_spike': True, 'bear_rsi_required': False, 'sideways_strategy': 'breakout', 'sideways_bb_std_mult': 3.1102916688333444, 'sideways_rsi_os': 12, 'sideways_rsi_ob': 57, 'sideways_adx_thresh': 13.392473918750479, 'sideways_atr_min_pct': 0.004574450831740793, 'sideways_atr_max_pct': 0.12182920317777747, 'sideways_tp_mult': 2.3942085541690896, 'sideways_tsl_mult': 0.8687937896246362, 'sideways_time_stop': 174, 'sideways_use_sma': True, 'sideways_use_ema': False, 'sideways_use_atr': True, 'sideways_use_adx': False, 'sideways_use_spike': False, 'sideways_rsi_required': True}.
[I 2025-09-01 04:09:51,489] Trial 34 finished with values: [-0.045922173768983665, 0.045819407553306955] and parameters: {'p_sma': 56, 'p_std': 26, 'p_atr': 16, 'p_adx': 13, 'rsi_period': 45, 'ema1': 26, 'ema2': 50, 'slip_atr_k': 0.03988497212431076, 'slip_spread_k': 0.894792827879253, 'spread_hl_frac': 0.005103053488227494, 'bb_std_mult': 1.5688679940842487, 'rsi_os': 24, 'rsi_ob': 94, 'vol_spike': 0.21476589922642111, 'adx_thresh': 23.642518118035625, 'atr_min_pct': 0.017717476070575534, 'atr_max_pct': 0.03803937845166915, 'tp_mult': 1.6320368439631383, 'tsl_mult': 0.5681394432663724, 'strategy': 'breakout', 'time_stop': 112, 'use_sma': False, 'use_atr': False, 'use_adx': True, 'use_ema': False, 'use_spike': True, 'rsi_required': True, 'edge_k': 0.49957721112237297, 'edge_cap': 0.6338080662901198, 'bull_strategy': 'mean_reversion', 'bull_bb_std_mult': 1.7119510113058123, 'bull_rsi_os': 55, 'bull_rsi_ob': 68, 'bull_adx_thresh': 22.178526111974225, 'bull_atr_min_pct': 0.024838840146759744, 'bull_atr_max_pct': 0.05915138496539928, 'bull_tp_mult': 2.9988838098048864, 'bull_tsl_mult': 0.5879981442586527, 'bull_time_stop': 233, 'bull_use_sma': False, 'bull_use_ema': False, 'bull_use_atr': True, 'bull_use_adx': True, 'bull_use_spike': True, 'bull_rsi_required': False, 'bear_strategy': 'breakout', 'bear_bb_std_mult': 3.520145282604533, 'bear_rsi_os': 13, 'bear_rsi_ob': 48, 'bear_adx_thresh': 21.241348523820776, 'bear_atr_min_pct': 0.019676875949186615, 'bear_atr_max_pct': 0.030373352729002184, 'bear_tp_mult': 1.696129468785165, 'bear_tsl_mult': 0.3393309216127788, 'bear_time_stop': 230, 'bear_use_sma': False, 'bear_use_ema': False, 'bear_use_atr': True, 'bear_use_adx': False, 'bear_use_spike': True, 'bear_rsi_required': False, 'sideways_strategy': 'mean_reversion', 'sideways_bb_std_mult': 2.7620049156195554, 'sideways_rsi_os': 29, 'sideways_rsi_ob': 54, 'sideways_adx_thresh': 5.1944528044540785, 'sideways_atr_min_pct': 0.00010160637446747164, 'sideways_atr_max_pct': 0.13788356876519592, 'sideways_tp_mult': 2.984405352997161, 'sideways_tsl_mult': 0.7527634334894595, 'sideways_time_stop': 186, 'sideways_use_sma': True, 'sideways_use_ema': True, 'sideways_use_atr': True, 'sideways_use_adx': True, 'sideways_use_spike': False, 'sideways_rsi_required': True}.
[I 2025-09-01 04:09:54,617] Trial 35 finished with values: [-0.08898556281190995, 0.08883786381097981] and parameters: {'p_sma': 60, 'p_std': 7, 'p_atr': 25, 'p_adx': 12, 'rsi_period': 23, 'ema1': 20, 'ema2': 51, 'slip_atr_k': 0.10622321500571216, 'slip_spread_k': 0.9324638744770585, 'spread_hl_frac': 0.049359304298205814, 'bb_std_mult': 1.427549900437143, 'rsi_os': 24, 'rsi_ob': 93, 'vol_spike': 0.21444089593308857, 'adx_thresh': 21.91379484744637, 'atr_min_pct': 0.01873909683721147, 'atr_max_pct': 0.06012133551061276, 'tp_mult': 1.653560963047513, 'tsl_mult': 0.7108120304138736, 'strategy': 'breakout', 'time_stop': 115, 'use_sma': True, 'use_atr': False, 'use_adx': True, 'use_ema': False, 'use_spike': True, 'rsi_required': True, 'edge_k': 0.5439310988480519, 'edge_cap': 0.4677418180682447, 'bull_strategy': 'mean_reversion', 'bull_bb_std_mult': 1.771292463157133, 'bull_rsi_os': 51, 'bull_rsi_ob': 69, 'bull_adx_thresh': 22.431153997336313, 'bull_atr_min_pct': 0.025390414403305802, 'bull_atr_max_pct': 0.08392730915703227, 'bull_tp_mult': 2.1265847218008527, 'bull_tsl_mult': 0.6493824762085276, 'bull_time_stop': 75, 'bull_use_sma': False, 'bull_use_ema': False, 'bull_use_atr': True, 'bull_use_adx': True, 'bull_use_spike': True, 'bull_rsi_required': False, 'bear_strategy': 'breakout', 'bear_bb_std_mult': 3.4854783698221334, 'bear_rsi_os': 9, 'bear_rsi_ob': 48, 'bear_adx_thresh': 31.114326404402043, 'bear_atr_min_pct': 0.02153738722816065, 'bear_atr_max_pct': 0.0370547139589183, 'bear_tp_mult': 1.7084573719506746, 'bear_tsl_mult': 0.3702804290116166, 'bear_time_stop': 136, 'bear_use_sma': False, 'bear_use_ema': True, 'bear_use_atr': True, 'bear_use_adx': False, 'bear_use_spike': False, 'bear_rsi_required': False, 'sideways_strategy': 'mean_reversion', 'sideways_bb_std_mult': 3.2610257181036753, 'sideways_rsi_os': 28, 'sideways_rsi_ob': 53, 'sideways_adx_thresh': 20.501236848145197, 'sideways_atr_min_pct': 5.987505754649408e-05, 'sideways_atr_max_pct': 0.13941532125176684, 'sideways_tp_mult': 2.072341322799396, 'sideways_tsl_mult': 0.9413977739983586, 'sideways_time_stop': 180, 'sideways_use_sma': False, 'sideways_use_ema': True, 'sideways_use_atr': True, 'sideways_use_adx': True, 'sideways_use_spike': False, 'sideways_rsi_required': True}.
