[I 2025-09-01 05:16:56,168] Trial 431 finished with values: [-1000000000.0, 1000000000.0] and parameters: {'p_sma': 22, 'p_std': 34, 'p_atr': 27, 'p_adx': 19, 'rsi_period': 9, 'ema1': 29, 'ema2': 28, 'slip_atr_k': 0.06814283369871896, 'slip_spread_k': 0.5475553120262545, 'spread_hl_frac': 4.6752964022366006e-05, 'bb_std_mult': 3.398713907553257, 'rsi_os': 54, 'rsi_ob': 86, 'vol_spike': 0.23099898474476319, 'adx_thresh': 18.654808660818173, 'atr_min_pct': 0.022311812817154993, 'atr_max_pct': 0.03427172616422349, 'tp_mult': 1.69805349156464, 'tsl_mult': 0.9870134197645503, 'strategy': 'breakout', 'time_stop': 58, 'use_sma': False, 'use_atr': False, 'use_adx': False, 'use_ema': True, 'use_spike': True, 'rsi_required': False, 'edge_k': 1.2717201412540646, 'edge_cap': 0.45559701690651677, 'bull_strategy': 'breakout', 'bull_bb_std_mult': 2.8114243173913316, 'bull_rsi_os': 25, 'bull_rsi_ob': 88, 'bull_adx_thresh': 19.22788111658484, 'bull_atr_min_pct': 0.018781414622397807, 'bull_atr_max_pct': 0.11666263469678063, 'bull_tp_mult': 1.8106677309819668, 'bull_tsl_mult': 0.40372900080974966, 'bull_time_stop': 6, 'bull_use_sma': False, 'bull_use_ema': True, 'bull_use_atr': False, 'bull_use_adx': False, 'bull_use_spike': False, 'bull_rsi_required': True, 'bear_strategy': 'mean_reversion', 'bear_bb_std_mult': 2.4329765458448342, 'bear_rsi_os': 10, 'bear_rsi_ob': 64, 'bear_adx_thresh': 29.084163089871982, 'bear_atr_min_pct': 0.029408747233014808, 'bear_atr_max_pct': 0.06028184603505438, 'bear_tp_mult': 1.2420643387620522, 'bear_tsl_mult': 0.5571355142740498, 'bear_time_stop': 191, 'bear_use_sma': True, 'bear_use_ema': False, 'bear_use_atr': False, 'bear_use_adx': False, 'bear_use_spike': False, 'bear_rsi_required': False, 'sideways_strategy': 'breakout', 'sideways_bb_std_mult': 1.7360598253861619, 'sideways_rsi_os': 13, 'sideways_rsi_ob': 84, 'sideways_adx_thresh': 13.942860121161349, 'sideways_atr_min_pct': 0.021473536330804798, 'sideways_atr_max_pct': 0.11062731549556001, 'sideways_tp_mult': 1.6350141622833356, 'sideways_tsl_mult': 0.6160111164442336, 'sideways_time_stop': 186, 'sideways_use_sma': True, 'sideways_use_ema': True, 'sideways_use_atr': False, 'sideways_use_adx': True, 'sideways_use_spike': True, 'sideways_rsi_required': False}.
[I 2025-09-01 05:16:56,486] Trial 433 finished with values: [-1000000000.0, 1000000000.0] and parameters: {'p_sma': 43, 'p_std': 57, 'p_atr': 27, 'p_adx': 23, 'rsi_period': 9, 'ema1': 29, 'ema2': 29, 'slip_atr_k': 0.05155659190882485, 'slip_spread_k': 0.2954016198662801, 'spread_hl_frac': 0.04832646981754701, 'bb_std_mult': 1.7405759827608582, 'rsi_os': 5, 'rsi_ob': 87, 'vol_spike': 0.21842161437480348, 'adx_thresh': 18.398113274658247, 'atr_min_pct': 0.011031198316110845, 'atr_max_pct': 0.13039939316910065, 'tp_mult': 2.510508767528812, 'tsl_mult': 0.9983404061154041, 'strategy': 'mean_reversion', 'time_stop': 53, 'use_sma': False, 'use_atr': False, 'use_adx': True, 'use_ema': True, 'use_spike': True, 'rsi_required': False, 'edge_k': 1.273881127374949, 'edge_cap': 0.5135769279898489, 'bull_strategy': 'breakout', 'bull_bb_std_mult': 2.7734216194019607, 'bull_rsi_os': 53, 'bull_rsi_ob': 56, 'bull_adx_thresh': 6.506147361359492, 'bull_atr_min_pct': 0.0028921603435823873, 'bull_atr_max_pct': 0.07162470105165805, 'bull_tp_mult': 1.5820229622549415, 'bull_tsl_mult': 0.9678598559971509, 'bull_time_stop': 147, 'bull_use_sma': True, 'bull_use_ema': True, 'bull_use_atr': False, 'bull_use_adx': False, 'bull_use_spike': False, 'bull_rsi_required': True, 'bear_strategy': 'mean_reversion', 'bear_bb_std_mult': 0.7227075848455543, 'bear_rsi_os': 11, 'bear_rsi_ob': 68, 'bear_adx_thresh': 29.068150381744488, 'bear_atr_min_pct': 0.029403749108961454, 'bear_atr_max_pct': 0.1003070656499225, 'bear_tp_mult': 1.3447654162374056, 'bear_tsl_mult': 0.6481002299574772, 'bear_time_stop': 162, 'bear_use_sma': False, 'bear_use_ema': True, 'bear_use_atr': False, 'bear_use_adx': False, 'bear_use_spike': False, 'bear_rsi_required': False, 'sideways_strategy': 'breakout', 'sideways_bb_std_mult': 1.7359972223293394, 'sideways_rsi_os': 47, 'sideways_rsi_ob': 87, 'sideways_adx_thresh': 20.131274202580816, 'sideways_atr_min_pct': 0.02363377138974085, 'sideways_atr_max_pct': 0.11140627655554403, 'sideways_tp_mult': 1.4502556387231984, 'sideways_tsl_mult': 0.9633017291408444, 'sideways_time_stop': 179, 'sideways_use_sma': True, 'sideways_use_ema': True, 'sideways_use_atr': False, 'sideways_use_adx': False, 'sideways_use_spike': True, 'sideways_rsi_required': False}.
[I 2025-09-01 05:17:37,182] Trial 437 finished with values: [-1000000000.0, 1000000000.0] and parameters: {'p_sma': 24, 'p_std': 57, 'p_atr': 26, 'p_adx': 14, 'rsi_period': 31, 'ema1': 25, 'ema2': 38, 'slip_atr_k': 0.24434712631705538, 'slip_spread_k': 0.5807263008259356, 'spread_hl_frac': 0.04870269588860474, 'bb_std_mult': 3.2791361794447607, 'rsi_os': 20, 'rsi_ob': 64, 'vol_spike': 0.20447914868318584, 'adx_thresh': 25.08398268688802, 'atr_min_pct': 0.02364776458097114, 'atr_max_pct': 0.13921539245178027, 'tp_mult': 2.4660360694112313, 'tsl_mult': 0.9440171760568007, 'strategy': 'mean_reversion', 'time_stop': 153, 'use_sma': False, 'use_atr': False, 'use_adx': True, 'use_ema': True, 'use_spike': True, 'rsi_required': True, 'edge_k': 1.9978446053727281, 'edge_cap': 0.4982267643904148, 'bull_strategy': 'breakout', 'bull_bb_std_mult': 2.985646067344864, 'bull_rsi_os': 6, 'bull_rsi_ob': 90, 'bull_adx_thresh': 18.376156762865698, 'bull_atr_min_pct': 0.029063563006708575, 'bull_atr_max_pct': 0.12295862486432342, 'bull_tp_mult': 1.5334003060622416, 'bull_tsl_mult': 0.5105523185473907, 'bull_time_stop': 124, 'bull_use_sma': True, 'bull_use_ema': False, 'bull_use_atr': False, 'bull_use_adx': True, 'bull_use_spike': False, 'bull_rsi_required': True, 'bear_strategy': 'breakout', 'bear_bb_std_mult': 0.8530975898117623, 'bear_rsi_os': 53, 'bear_rsi_ob': 66, 'bear_adx_thresh': 28.536820073798072, 'bear_atr_min_pct': 0.02998365158595622, 'bear_atr_max_pct': 0.07709914601362565, 'bear_tp_mult': 1.2846350748447188, 'bear_tsl_mult': 0.5949434091454896, 'bear_time_stop': 200, 'bear_use_sma': True, 'bear_use_ema': True, 'bear_use_atr': False, 'bear_use_adx': False, 'bear_use_spike': False, 'bear_rsi_required': False, 'sideways_strategy': 'breakout', 'sideways_bb_std_mult': 2.403522434746059, 'sideways_rsi_os': 40, 'sideways_rsi_ob': 53, 'sideways_adx_thresh': 9.015618521394195, 'sideways_atr_min_pct': 0.025355492595442498, 'sideways_atr_max_pct': 0.05739583817074459, 'sideways_tp_mult': 1.690968530102842, 'sideways_tsl_mult': 0.9811753498372633, 'sideways_time_stop': 199, 'sideways_use_sma': False, 'sideways_use_ema': False, 'sideways_use_atr': True, 'sideways_use_adx': False, 'sideways_use_spike': True, 'sideways_rsi_required': True}.
[I 2025-09-01 05:17:37,714] Trial 434 finished with values: [-1000000000.0, 1000000000.0] and parameters: {'p_sma': 26, 'p_std': 57, 'p_atr': 27, 'p_adx': 29, 'rsi_period': 72, 'ema1': 16, 'ema2': 30, 'slip_atr_k': 0.054004186081884675, 'slip_spread_k': 0.26420606044879613, 'spread_hl_frac': 0.04854845243933222, 'bb_std_mult': 1.7349402502167983, 'rsi_os': 25, 'rsi_ob': 84, 'vol_spike': 0.23235088436384754, 'adx_thresh': 9.353970807847878, 'atr_min_pct': 0.023606011095851975, 'atr_max_pct': 0.11893236547456464, 'tp_mult': 2.4650785572806755, 'tsl_mult': 0.9420155042621489, 'strategy': 'mean_reversion', 'time_stop': 52, 'use_sma': False, 'use_atr': False, 'use_adx': True, 'use_ema': True, 'use_spike': True, 'rsi_required': True, 'edge_k': 1.84618491507194, 'edge_cap': 0.30658806626975793, 'bull_strategy': 'breakout', 'bull_bb_std_mult': 0.9463584711124629, 'bull_rsi_os': 6, 'bull_rsi_ob': 88, 'bull_adx_thresh': 19.335189205313664, 'bull_atr_min_pct': 0.0008673050131070433, 'bull_atr_max_pct': 0.10925277857853496, 'bull_tp_mult': 1.8905990890990891, 'bull_tsl_mult': 0.40580422635379226, 'bull_time_stop': 236, 'bull_use_sma': True, 'bull_use_ema': True, 'bull_use_atr': False, 'bull_use_adx': True, 'bull_use_spike': False, 'bull_rsi_required': True, 'bear_strategy': 'breakout', 'bear_bb_std_mult': 0.8559069228586301, 'bear_rsi_os': 12, 'bear_rsi_ob': 68, 'bear_adx_thresh': 28.955552051602503, 'bear_atr_min_pct': 0.029520012672367073, 'bear_atr_max_pct': 0.054992281068511985, 'bear_tp_mult': 1.311142863387024, 'bear_tsl_mult': 0.6457613717788151, 'bear_time_stop': 161, 'bear_use_sma': True, 'bear_use_ema': True, 'bear_use_atr': False, 'bear_use_adx': False, 'bear_use_spike': False, 'bear_rsi_required': False, 'sideways_strategy': 'breakout', 'sideways_bb_std_mult': 0.8651047771251543, 'sideways_rsi_os': 40, 'sideways_rsi_ob': 54, 'sideways_adx_thresh': 13.939582463723319, 'sideways_atr_min_pct': 0.023484782045387755, 'sideways_atr_max_pct': 0.10830189207746752, 'sideways_tp_mult': 1.6171933195552803, 'sideways_tsl_mult': 0.9244029611961573, 'sideways_time_stop': 177, 'sideways_use_sma': False, 'sideways_use_ema': True, 'sideways_use_atr': True, 'sideways_use_adx': False, 'sideways_use_spike': True, 'sideways_rsi_required': True}.
[I 2025-09-01 05:17:38,223] Trial 436 finished with values: [-1000000000.0, 1000000000.0] and parameters: {'p_sma': 60, 'p_std': 57, 'p_atr': 26, 'p_adx': 18, 'rsi_period': 7, 'ema1': 24, 'ema2': 30, 'slip_atr_k': 0.012686420610476236, 'slip_spread_k': 0.3331043492373059, 'spread_hl_frac': 0.04869845018795975, 'bb_std_mult': 2.360679992195419, 'rsi_os': 25, 'rsi_ob': 84, 'vol_spike': 0.2063614600118875, 'adx_thresh': 13.171064442921292, 'atr_min_pct': 0.015329562961297356, 'atr_max_pct': 0.11903616920060323, 'tp_mult': 2.5189046297903603, 'tsl_mult': 0.9994038856628341, 'strategy': 'mean_reversion', 'time_stop': 52, 'use_sma': False, 'use_atr': False, 'use_adx': True, 'use_ema': True, 'use_spike': True, 'rsi_required': True, 'edge_k': 0.21184687335125751, 'edge_cap': 0.3037035624450043, 'bull_strategy': 'breakout', 'bull_bb_std_mult': 2.4169530538950728, 'bull_rsi_os': 5, 'bull_rsi_ob': 90, 'bull_adx_thresh': 6.854986018319845, 'bull_atr_min_pct': 0.013121266392882778, 'bull_atr_max_pct': 0.12238541264030856, 'bull_tp_mult': 1.320560630557448, 'bull_tsl_mult': 0.41784019574219133, 'bull_time_stop': 92, 'bull_use_sma': True, 'bull_use_ema': False, 'bull_use_atr': False, 'bull_use_adx': True, 'bull_use_spike': False, 'bull_rsi_required': True, 'bear_strategy': 'breakout', 'bear_bb_std_mult': 0.732554229489504, 'bear_rsi_os': 11, 'bear_rsi_ob': 68, 'bear_adx_thresh': 29.11348557071691, 'bear_atr_min_pct': 0.02950900314674204, 'bear_atr_max_pct': 0.027171076668054704, 'bear_tp_mult': 1.3049314444480327, 'bear_tsl_mult': 0.6469656576384846, 'bear_time_stop': 202, 'bear_use_sma': False, 'bear_use_ema': True, 'bear_use_atr': False, 'bear_use_adx': False, 'bear_use_spike': False, 'bear_rsi_required': False, 'sideways_strategy': 'breakout', 'sideways_bb_std_mult': 2.4220540967436537, 'sideways_rsi_os': 44, 'sideways_rsi_ob': 91, 'sideways_adx_thresh': 22.17479002549119, 'sideways_atr_min_pct': 0.02550410672656761, 'sideways_atr_max_pct': 0.04959542689277986, 'sideways_tp_mult': 1.6023896279351328, 'sideways_tsl_mult': 0.9655243308595357, 'sideways_time_stop': 199, 'sideways_use_sma': False, 'sideways_use_ema': True, 'sideways_use_atr': True, 'sideways_use_adx': False, 'sideways_use_spike': True, 'sideways_rsi_required': True}.
[I 2025-09-01 05:17:38,515] Trial 435 finished with values: [-1000000000.0, 1000000000.0] and parameters: {'p_sma': 26, 'p_std': 57, 'p_atr': 27, 'p_adx': 23, 'rsi_period': 26, 'ema1': 14, 'ema2': 30, 'slip_atr_k': 0.011118602945166487, 'slip_spread_k': 0.333926273538131, 'spread_hl_frac': 0.04872496306401345, 'bb_std_mult': 3.2789340895595864, 'rsi_os': 5, 'rsi_ob': 85, 'vol_spike': 0.23170417982807207, 'adx_thresh': 13.202568884116669, 'atr_min_pct': 0.023642771654348603, 'atr_max_pct': 0.11803249994034089, 'tp_mult': 1.7084827072417534, 'tsl_mult': 0.9457064316587963, 'strategy': 'mean_reversion', 'time_stop': 53, 'use_sma': False, 'use_atr': False, 'use_adx': True, 'use_ema': True, 'use_spike': True, 'rsi_required': True, 'edge_k': 0.5850752229361336, 'edge_cap': 0.9316854317515844, 'bull_strategy': 'breakout', 'bull_bb_std_mult': 2.981582672028003, 'bull_rsi_os': 5, 'bull_rsi_ob': 88, 'bull_adx_thresh': 24.117097512184614, 'bull_atr_min_pct': 0.01969387872061769, 'bull_atr_max_pct': 0.12268101482538783, 'bull_tp_mult': 1.6326378230608423, 'bull_tsl_mult': 0.5147042007292991, 'bull_time_stop': 236, 'bull_use_sma': True, 'bull_use_ema': True, 'bull_use_atr': False, 'bull_use_adx': True, 'bull_use_spike': False, 'bull_rsi_required': True, 'bear_strategy': 'breakout', 'bear_bb_std_mult': 0.8471134023421867, 'bear_rsi_os': 53, 'bear_rsi_ob': 67, 'bear_adx_thresh': 28.937063500843287, 'bear_atr_min_pct': 0.02484139676423601, 'bear_atr_max_pct': 0.06676613278156279, 'bear_tp_mult': 1.3076636175248553, 'bear_tsl_mult': 0.6455241713653824, 'bear_time_stop': 202, 'bear_use_sma': True, 'bear_use_ema': True, 'bear_use_atr': False, 'bear_use_adx': False, 'bear_use_spike': False, 'bear_rsi_required': False, 'sideways_strategy': 'breakout', 'sideways_bb_std_mult': 3.0161338217571125, 'sideways_rsi_os': 40, 'sideways_rsi_ob': 87, 'sideways_adx_thresh': 33.08484613595946, 'sideways_atr_min_pct': 0.01463348963710469, 'sideways_atr_max_pct': 0.1080505727299661, 'sideways_tp_mult': 1.5680197575575372, 'sideways_tsl_mult': 0.9689912282289249, 'sideways_time_stop': 177, 'sideways_use_sma': False, 'sideways_use_ema': True, 'sideways_use_atr': True, 'sideways_use_adx': False, 'sideways_use_spike': True, 'sideways_rsi_required': True}.
[I 2025-09-01 05:18:16,561] Trial 441 finished with values: [-1000000000.0, 1000000000.0] and parameters: {'p_sma': 53, 'p_std': 55, 'p_atr': 7, 'p_adx': 10, 'rsi_period': 7, 'ema1': 5, 'ema2': 32, 'slip_atr_k': 0.003123604668875249, 'slip_spread_k': 0.38909770458410425, 'spread_hl_frac': 0.012551866252484745, 'bb_std_mult': 3.4737642673561724, 'rsi_os': 21, 'rsi_ob': 65, 'vol_spike': 0.039634914332507126, 'adx_thresh': 14.080348384040809, 'atr_min_pct': 0.024133804363191853, 'atr_max_pct': 0.0728911338939911, 'tp_mult': 1.432939649709442, 'tsl_mult': 0.9585468366597245, 'strategy': 'breakout', 'time_stop': 187, 'use_sma': False, 'use_atr': True, 'use_adx': False, 'use_ema': False, 'use_spike': False, 'rsi_required': False, 'edge_k': 0.048846578067646695, 'edge_cap': 0.7898860152469213, 'bull_strategy': 'breakout', 'bull_bb_std_mult': 2.328061654415337, 'bull_rsi_os': 47, 'bull_rsi_ob': 46, 'bull_adx_thresh': 21.96642432620647, 'bull_atr_min_pct': 0.021598955999144034, 'bull_atr_max_pct': 0.04383781176510204, 'bull_tp_mult': 1.475282709531576, 'bull_tsl_mult': 0.45097908426322036, 'bull_time_stop': 242, 'bull_use_sma': True, 'bull_use_ema': False, 'bull_use_atr': False, 'bull_use_adx': False, 'bull_use_spike': True, 'bull_rsi_required': True, 'bear_strategy': 'mean_reversion', 'bear_bb_std_mult': 0.9367442041786281, 'bear_rsi_os': 8, 'bear_rsi_ob': 65, 'bear_adx_thresh': 29.74978606629254, 'bear_atr_min_pct': 0.02821562193202547, 'bear_atr_max_pct': 0.03176324034815308, 'bear_tp_mult': 1.3617846587979707, 'bear_tsl_mult': 0.29057282534407375, 'bear_time_stop': 180, 'bear_use_sma': True, 'bear_use_ema': False, 'bear_use_atr': False, 'bear_use_adx': False, 'bear_use_spike': True, 'bear_rsi_required': True, 'sideways_strategy': 'breakout', 'sideways_bb_std_mult': 0.6911362841852927, 'sideways_rsi_os': 45, 'sideways_rsi_ob': 55, 'sideways_adx_thresh': 19.527187967142677, 'sideways_atr_min_pct': 0.02420080145017679, 'sideways_atr_max_pct': 0.1494597719598092, 'sideways_tp_mult': 1.7805549312223257, 'sideways_tsl_mult': 0.08983070026189516, 'sideways_time_stop': 181, 'sideways_use_sma': True, 'sideways_use_ema': False, 'sideways_use_atr': False, 'sideways_use_adx': False, 'sideways_use_spike': True, 'sideways_rsi_required': False}.
[I 2025-09-01 05:18:17,281] Trial 440 finished with values: [-0.021974640410169943, 0.02181678886630691] and parameters: {'p_sma': 46, 'p_std': 32, 'p_atr': 26, 'p_adx': 18, 'rsi_period': 26, 'ema1': 5, 'ema2': 44, 'slip_atr_k': 0.04162351262540795, 'slip_spread_k': 0.007895375206895261, 'spread_hl_frac': 0.04570002241793284, 'bb_std_mult': 2.0903651764903843, 'rsi_os': 35, 'rsi_ob': 62, 'vol_spike': 0.22041284562302588, 'adx_thresh': 13.87427027945496, 'atr_min_pct': 0.02308688766801492, 'atr_max_pct': 0.10759010794927197, 'tp_mult': 2.6481066484003826, 'tsl_mult': 0.7110603366042849, 'strategy': 'breakout', 'time_stop': 191, 'use_sma': False, 'use_atr': True, 'use_adx': False, 'use_ema': False, 'use_spike': False, 'rsi_required': False, 'edge_k': 0.04050914418432072, 'edge_cap': 0.870192256755631, 'bull_strategy': 'breakout', 'bull_bb_std_mult': 3.394687870484183, 'bull_rsi_os': 45, 'bull_rsi_ob': 89, 'bull_adx_thresh': 16.658414177876626, 'bull_atr_min_pct': 0.0016811239871447376, 'bull_atr_max_pct': 0.11170266095254017, 'bull_tp_mult': 1.6377475232781946, 'bull_tsl_mult': 0.6264630013510808, 'bull_time_stop': 32, 'bull_use_sma': True, 'bull_use_ema': False, 'bull_use_atr': False, 'bull_use_adx': False, 'bull_use_spike': True, 'bull_rsi_required': True, 'bear_strategy': 'mean_reversion', 'bear_bb_std_mult': 3.578388011937327, 'bear_rsi_os': 7, 'bear_rsi_ob': 72, 'bear_adx_thresh': 28.595319981779063, 'bear_atr_min_pct': 0.024657277087676874, 'bear_atr_max_pct': 0.06794188362549508, 'bear_tp_mult': 1.3959531867502788, 'bear_tsl_mult': 0.6255506690353059, 'bear_time_stop': 246, 'bear_use_sma': True, 'bear_use_ema': False, 'bear_use_atr': False, 'bear_use_adx': False, 'bear_use_spike': True, 'bear_rsi_required': True, 'sideways_strategy': 'breakout', 'sideways_bb_std_mult': 0.6882821539660728, 'sideways_rsi_os': 22, 'sideways_rsi_ob': 55, 'sideways_adx_thresh': 19.32946084324693, 'sideways_atr_min_pct': 0.02455502723576315, 'sideways_atr_max_pct': 0.103364292359611, 'sideways_tp_mult': 1.7923515465992166, 'sideways_tsl_mult': 0.7162225624991061, 'sideways_time_stop': 170, 'sideways_use_sma': True, 'sideways_use_ema': False, 'sideways_use_atr': False, 'sideways_use_adx': False, 'sideways_use_spike': True, 'sideways_rsi_required': False}.
[I 2025-09-01 05:18:18,242] Trial 438 finished with values: [-0.011423620498608789, 0.011607600894277516] and parameters: {'p_sma': 59, 'p_std': 32, 'p_atr': 7, 'p_adx': 18, 'rsi_period': 53, 'ema1': 24, 'ema2': 31, 'slip_atr_k': 0.013028417204629952, 'slip_spread_k': 0.39711824596954226, 'spread_hl_frac': 0.047348959073931496, 'bb_std_mult': 2.077776298655535, 'rsi_os': 25, 'rsi_ob': 88, 'vol_spike': 0.20757117593544666, 'adx_thresh': 13.693238016090119, 'atr_min_pct': 0.003773952637920387, 'atr_max_pct': 0.11970394039764759, 'tp_mult': 2.513907619978967, 'tsl_mult': 0.9438760187911648, 'strategy': 'breakout', 'time_stop': 183, 'use_sma': False, 'use_atr': True, 'use_adx': False, 'use_ema': True, 'use_spike': True, 'rsi_required': False, 'edge_k': 0.21572081127696086, 'edge_cap': 0.5052034454933044, 'bull_strategy': 'breakout', 'bull_bb_std_mult': 0.9047784938632015, 'bull_rsi_os': 49, 'bull_rsi_ob': 89, 'bull_adx_thresh': 5.611475413473789, 'bull_atr_min_pct': 0.013193303653681081, 'bull_atr_max_pct': 0.10899087969250028, 'bull_tp_mult': 1.2545954663529695, 'bull_tsl_mult': 0.20111000559509273, 'bull_time_stop': 92, 'bull_use_sma': True, 'bull_use_ema': False, 'bull_use_atr': False, 'bull_use_adx': True, 'bull_use_spike': False, 'bull_rsi_required': True, 'bear_strategy': 'breakout', 'bear_bb_std_mult': 3.594712355255867, 'bear_rsi_os': 8, 'bear_rsi_ob': 67, 'bear_adx_thresh': 29.202234868686254, 'bear_atr_min_pct': 0.007523418003364996, 'bear_atr_max_pct': 0.06662137944533113, 'bear_tp_mult': 1.315084160590731, 'bear_tsl_mult': 0.6364201070771839, 'bear_time_stop': 202, 'bear_use_sma': True, 'bear_use_ema': False, 'bear_use_atr': False, 'bear_use_adx': False, 'bear_use_spike': False, 'bear_rsi_required': False, 'sideways_strategy': 'breakout', 'sideways_bb_std_mult': 0.6878407508064858, 'sideways_rsi_os': 44, 'sideways_rsi_ob': 54, 'sideways_adx_thresh': 23.01113577355067, 'sideways_atr_min_pct': 0.004456530474535595, 'sideways_atr_max_pct': 0.10301408900319048, 'sideways_tp_mult': 1.577025054397993, 'sideways_tsl_mult': 0.9996307641200916, 'sideways_time_stop': 175, 'sideways_use_sma': False, 'sideways_use_ema': True, 'sideways_use_atr': True, 'sideways_use_adx': False, 'sideways_use_spike': True, 'sideways_rsi_required': True}.
