[I 2025-09-01 04:20:57,672] Trial 110 finished with values: [-1000000000.0, 1000000000.0] and parameters: {'p_sma': 24, 'p_std': 44, 'p_atr': 22, 'p_adx': 25, 'rsi_period': 27, 'ema1': 12, 'ema2': 40, 'slip_atr_k': 0.1169850923043407, 'slip_spread_k': 0.4293245786495317, 'spread_hl_frac': 0.044417358794559963, 'bb_std_mult': 3.351136944220036, 'rsi_os': 11, 'rsi_ob': 64, 'vol_spike': 0.1007230267299215, 'adx_thresh': 10.811877600573727, 'atr_min_pct': 0.028118923381431883, 'atr_max_pct': 0.0336176784341574, 'tp_mult': 1.1881559178909618, 'tsl_mult': 0.5847288457917474, 'strategy': 'breakout', 'time_stop': 41, 'use_sma': True, 'use_atr': True, 'use_adx': True, 'use_ema': False, 'use_spike': True, 'rsi_required': False, 'edge_k': 0.573657681577938, 'edge_cap': 0.7399441142587792, 'bull_strategy': 'breakout', 'bull_bb_std_mult': 1.2679721491263538, 'bull_rsi_os': 53, 'bull_rsi_ob': 84, 'bull_adx_thresh': 21.5746681834752, 'bull_atr_min_pct': 0.012314497366509167, 'bull_atr_max_pct': 0.06929338535327291, 'bull_tp_mult': 1.279425227364262, 'bull_tsl_mult': 0.7550517257985931, 'bull_time_stop': 212, 'bull_use_sma': False, 'bull_use_ema': False, 'bull_use_atr': True, 'bull_use_adx': False, 'bull_use_spike': False, 'bull_rsi_required': False, 'bear_strategy': 'mean_reversion', 'bear_bb_std_mult': 2.3267973620984073, 'bear_rsi_os': 43, 'bear_rsi_ob': 82, 'bear_adx_thresh': 24.920524457466183, 'bear_atr_min_pct': 0.010194750518964478, 'bear_atr_max_pct': 0.01063468727365427, 'bear_tp_mult': 1.439100675878574, 'bear_tsl_mult': 0.7954250388832194, 'bear_time_stop': 270, 'bear_use_sma': True, 'bear_use_ema': False, 'bear_use_atr': True, 'bear_use_adx': False, 'bear_use_spike': True, 'bear_rsi_required': False, 'sideways_strategy': 'breakout', 'sideways_bb_std_mult': 2.7347627329370625, 'sideways_rsi_os': 21, 'sideways_rsi_ob': 61, 'sideways_adx_thresh': 25.971501013025794, 'sideways_atr_min_pct': 0.028018858429130905, 'sideways_atr_max_pct': 0.011327306324570463, 'sideways_tp_mult': 1.6685973873754958, 'sideways_tsl_mult': 0.8797499576266851, 'sideways_time_stop': 152, 'sideways_use_sma': False, 'sideways_use_ema': True, 'sideways_use_atr': False, 'sideways_use_adx': True, 'sideways_use_spike': False, 'sideways_rsi_required': False}.
[I 2025-09-01 04:20:58,985] Trial 108 finished with values: [-1000000000.0, 1000000000.0] and parameters: {'p_sma': 24, 'p_std': 54, 'p_atr': 18, 'p_adx': 28, 'rsi_period': 27, 'ema1': 13, 'ema2': 40, 'slip_atr_k': 0.12075776296544583, 'slip_spread_k': 0.47951844744628425, 'spread_hl_frac': 0.009461638114436077, 'bb_std_mult': 3.3660537206763896, 'rsi_os': 45, 'rsi_ob': 86, 'vol_spike': 0.1199357469830672, 'adx_thresh': 10.926248484973833, 'atr_min_pct': 0.020303932440863356, 'atr_max_pct': 0.03411035150354527, 'tp_mult': 1.98945975240868, 'tsl_mult': 0.9132990655026778, 'strategy': 'breakout', 'time_stop': 42, 'use_sma': False, 'use_atr': False, 'use_adx': True, 'use_ema': False, 'use_spike': True, 'rsi_required': True, 'edge_k': 0.753813343131333, 'edge_cap': 0.7793687674468835, 'bull_strategy': 'mean_reversion', 'bull_bb_std_mult': 1.496029331086611, 'bull_rsi_os': 29, 'bull_rsi_ob': 64, 'bull_adx_thresh': 11.107087747246231, 'bull_atr_min_pct': 0.028390999793994835, 'bull_atr_max_pct': 0.13411681814140491, 'bull_tp_mult': 1.733293117060485, 'bull_tsl_mult': 0.6353276264666433, 'bull_time_stop': 256, 'bull_use_sma': False, 'bull_use_ema': False, 'bull_use_atr': False, 'bull_use_adx': True, 'bull_use_spike': True, 'bull_rsi_required': True, 'bear_strategy': 'breakout', 'bear_bb_std_mult': 3.3194455356508246, 'bear_rsi_os': 19, 'bear_rsi_ob': 45, 'bear_adx_thresh': 15.666351638336169, 'bear_atr_min_pct': 0.009682368633402046, 'bear_atr_max_pct': 0.08067206597137386, 'bear_tp_mult': 2.7141198852902537, 'bear_tsl_mult': 0.668014522390305, 'bear_time_stop': 141, 'bear_use_sma': True, 'bear_use_ema': False, 'bear_use_atr': False, 'bear_use_adx': True, 'bear_use_spike': False, 'bear_rsi_required': False, 'sideways_strategy': 'mean_reversion', 'sideways_bb_std_mult': 3.005891144350432, 'sideways_rsi_os': 11, 'sideways_rsi_ob': 61, 'sideways_adx_thresh': 21.2319464309812, 'sideways_atr_min_pct': 0.02818142148348597, 'sideways_atr_max_pct': 0.010647780454436026, 'sideways_tp_mult': 1.8644526557376857, 'sideways_tsl_mult': 0.8627120950075129, 'sideways_time_stop': 148, 'sideways_use_sma': True, 'sideways_use_ema': True, 'sideways_use_atr': True, 'sideways_use_adx': True, 'sideways_use_spike': False, 'sideways_rsi_required': True}.
[I 2025-09-01 04:20:59,454] Trial 109 finished with values: [-1000000000.0, 1000000000.0] and parameters: {'p_sma': 10, 'p_std': 21, 'p_atr': 18, 'p_adx': 26, 'rsi_period': 52, 'ema1': 12, 'ema2': 40, 'slip_atr_k': 0.15406002724347923, 'slip_spread_k': 0.4732433497493939, 'spread_hl_frac': 0.009599363510334594, 'bb_std_mult': 3.3655356895638606, 'rsi_os': 20, 'rsi_ob': 70, 'vol_spike': 0.11962406729926435, 'adx_thresh': 10.55106475612225, 'atr_min_pct': 0.027887612505475855, 'atr_max_pct': 0.03512929081336605, 'tp_mult': 1.1846274064627216, 'tsl_mult': 0.9038168838398961, 'strategy': 'breakout', 'time_stop': 195, 'use_sma': True, 'use_atr': False, 'use_adx': True, 'use_ema': False, 'use_spike': True, 'rsi_required': True, 'edge_k': 0.7534629646016551, 'edge_cap': 0.6856695043126879, 'bull_strategy': 'mean_reversion', 'bull_bb_std_mult': 1.2716689245229411, 'bull_rsi_os': 31, 'bull_rsi_ob': 64, 'bull_adx_thresh': 11.941526031471398, 'bull_atr_min_pct': 0.012451514768436285, 'bull_atr_max_pct': 0.06968731986636112, 'bull_tp_mult': 2.6114281422769783, 'bull_tsl_mult': 0.7605870633802911, 'bull_time_stop': 257, 'bull_use_sma': False, 'bull_use_ema': False, 'bull_use_atr': True, 'bull_use_adx': False, 'bull_use_spike': False, 'bull_rsi_required': False, 'bear_strategy': 'mean_reversion', 'bear_bb_std_mult': 3.5383786263097012, 'bear_rsi_os': 15, 'bear_rsi_ob': 95, 'bear_adx_thresh': 24.73180564983959, 'bear_atr_min_pct': 0.011781314819924206, 'bear_atr_max_pct': 0.010112902371919114, 'bear_tp_mult': 1.4533240979949205, 'bear_tsl_mult': 0.38653606661709317, 'bear_time_stop': 267, 'bear_use_sma': True, 'bear_use_ema': False, 'bear_use_atr': True, 'bear_use_adx': False, 'bear_use_spike': True, 'bear_rsi_required': False, 'sideways_strategy': 'breakout', 'sideways_bb_std_mult': 2.9768463600957937, 'sideways_rsi_os': 25, 'sideways_rsi_ob': 61, 'sideways_adx_thresh': 25.853831575547876, 'sideways_atr_min_pct': 0.002561557370440665, 'sideways_atr_max_pct': 0.09389837102482385, 'sideways_tp_mult': 1.8493395412741214, 'sideways_tsl_mult': 0.45586130071069986, 'sideways_time_stop': 213, 'sideways_use_sma': True, 'sideways_use_ema': True, 'sideways_use_atr': False, 'sideways_use_adx': True, 'sideways_use_spike': False, 'sideways_rsi_required': True}.
[I 2025-09-01 04:20:59,823] Trial 111 finished with values: [-1000000000.0, 1000000000.0] and parameters: {'p_sma': 24, 'p_std': 21, 'p_atr': 22, 'p_adx': 26, 'rsi_period': 7, 'ema1': 21, 'ema2': 40, 'slip_atr_k': 0.11674185730547484, 'slip_spread_k': 0.4172084635123218, 'spread_hl_frac': 0.010151348362072071, 'bb_std_mult': 3.3160347690469103, 'rsi_os': 15, 'rsi_ob': 65, 'vol_spike': 0.23848426345450197, 'adx_thresh': 7.37529966646952, 'atr_min_pct': 0.027790453423277788, 'atr_max_pct': 0.03472539648103816, 'tp_mult': 1.1795447876052754, 'tsl_mult': 0.4010805623756834, 'strategy': 'breakout', 'time_stop': 191, 'use_sma': True, 'use_atr': True, 'use_adx': True, 'use_ema': False, 'use_spike': True, 'rsi_required': False, 'edge_k': 0.7193989730401856, 'edge_cap': 0.22629889354293004, 'bull_strategy': 'breakout', 'bull_bb_std_mult': 0.8927731245055344, 'bull_rsi_os': 51, 'bull_rsi_ob': 67, 'bull_adx_thresh': 5.032605222111615, 'bull_atr_min_pct': 0.012338273167837636, 'bull_atr_max_pct': 0.07048842953743653, 'bull_tp_mult': 1.9097863385462628, 'bull_tsl_mult': 0.75859025169194, 'bull_time_stop': 255, 'bull_use_sma': False, 'bull_use_ema': False, 'bull_use_atr': True, 'bull_use_adx': False, 'bull_use_spike': False, 'bull_rsi_required': False, 'bear_strategy': 'mean_reversion', 'bear_bb_std_mult': 0.6189461716250793, 'bear_rsi_os': 43, 'bear_rsi_ob': 62, 'bear_adx_thresh': 15.721535884003503, 'bear_atr_min_pct': 0.010326399112881447, 'bear_atr_max_pct': 0.13173303974839828, 'bear_tp_mult': 1.4261981753451987, 'bear_tsl_mult': 0.7996558910774743, 'bear_time_stop': 114, 'bear_use_sma': True, 'bear_use_ema': False, 'bear_use_atr': True, 'bear_use_adx': False, 'bear_use_spike': False, 'bear_rsi_required': False, 'sideways_strategy': 'breakout', 'sideways_bb_std_mult': 0.9249422583980822, 'sideways_rsi_os': 23, 'sideways_rsi_ob': 92, 'sideways_adx_thresh': 28.34447003186183, 'sideways_atr_min_pct': 0.0028374641476655916, 'sideways_atr_max_pct': 0.1378566985950839, 'sideways_tp_mult': 1.9316868889096521, 'sideways_tsl_mult': 0.8751628733783465, 'sideways_time_stop': 237, 'sideways_use_sma': False, 'sideways_use_ema': True, 'sideways_use_atr': False, 'sideways_use_adx': True, 'sideways_use_spike': False, 'sideways_rsi_required': False}.
[I 2025-09-01 04:21:39,228] Trial 114 finished with values: [-1000000000.0, 1000000000.0] and parameters: {'p_sma': 30, 'p_std': 30, 'p_atr': 20, 'p_adx': 9, 'rsi_period': 64, 'ema1': 23, 'ema2': 42, 'slip_atr_k': 0.05499964003362838, 'slip_spread_k': 0.8023950150364759, 'spread_hl_frac': 0.0017634918310152556, 'bb_std_mult': 2.514094217946098, 'rsi_os': 16, 'rsi_ob': 51, 'vol_spike': 0.1454535121260027, 'adx_thresh': 24.112168123512973, 'atr_min_pct': 0.02280392885517366, 'atr_max_pct': 0.02939395294340126, 'tp_mult': 1.0112805274559942, 'tsl_mult': 0.3382584294219866, 'strategy': 'mean_reversion', 'time_stop': 155, 'use_sma': False, 'use_atr': False, 'use_adx': True, 'use_ema': True, 'use_spike': False, 'rsi_required': False, 'edge_k': 0.9635838414350321, 'edge_cap': 0.6490728317331944, 'bull_strategy': 'mean_reversion', 'bull_bb_std_mult': 0.9917616395870417, 'bull_rsi_os': 22, 'bull_rsi_ob': 94, 'bull_adx_thresh': 22.55596422048916, 'bull_atr_min_pct': 0.01605171781176403, 'bull_atr_max_pct': 0.05049658146123784, 'bull_tp_mult': 1.9908050233675947, 'bull_tsl_mult': 0.45363371963907256, 'bull_time_stop': 219, 'bull_use_sma': False, 'bull_use_ema': True, 'bull_use_atr': False, 'bull_use_adx': True, 'bull_use_spike': True, 'bull_rsi_required': True, 'bear_strategy': 'breakout', 'bear_bb_std_mult': 3.402874279669482, 'bear_rsi_os': 18, 'bear_rsi_ob': 70, 'bear_adx_thresh': 21.944582894342126, 'bear_atr_min_pct': 0.014103252979778763, 'bear_atr_max_pct': 0.0919298909697164, 'bear_tp_mult': 1.384339634247074, 'bear_tsl_mult': 0.42997229193670167, 'bear_time_stop': 178, 'bear_use_sma': False, 'bear_use_ema': True, 'bear_use_atr': False, 'bear_use_adx': True, 'bear_use_spike': False, 'bear_rsi_required': True, 'sideways_strategy': 'mean_reversion', 'sideways_bb_std_mult': 3.0817449843892986, 'sideways_rsi_os': 17, 'sideways_rsi_ob': 95, 'sideways_adx_thresh': 19.57451851750671, 'sideways_atr_min_pct': 7.690921044485859e-05, 'sideways_atr_max_pct': 0.018169265887741815, 'sideways_tp_mult': 1.983107319674544, 'sideways_tsl_mult': 0.8390548370263334, 'sideways_time_stop': 126, 'sideways_use_sma': True, 'sideways_use_ema': False, 'sideways_use_atr': True, 'sideways_use_adx': True, 'sideways_use_spike': False, 'sideways_rsi_required': True}.
[I 2025-09-01 04:21:39,561] Trial 113 finished with values: [-1000000000.0, 1000000000.0] and parameters: {'p_sma': 30, 'p_std': 30, 'p_atr': 30, 'p_adx': 23, 'rsi_period': 51, 'ema1': 8, 'ema2': 15, 'slip_atr_k': 0.06109516824294206, 'slip_spread_k': 0.7976238645134697, 'spread_hl_frac': 0.010422210316680593, 'bb_std_mult': 1.0209400102918216, 'rsi_os': 19, 'rsi_ob': 70, 'vol_spike': 0.14263042705586057, 'adx_thresh': 7.437410197534758, 'atr_min_pct': 0.022809969644439456, 'atr_max_pct': 0.13183443356198105, 'tp_mult': 1.375511561338534, 'tsl_mult': 0.20710435436124675, 'strategy': 'mean_reversion', 'time_stop': 199, 'use_sma': True, 'use_atr': True, 'use_adx': True, 'use_ema': True, 'use_spike': False, 'rsi_required': False, 'edge_k': 0.49125261158635036, 'edge_cap': 0.9504628315650988, 'bull_strategy': 'breakout', 'bull_bb_std_mult': 0.8767835235353099, 'bull_rsi_os': 31, 'bull_rsi_ob': 95, 'bull_adx_thresh': 11.672476423955299, 'bull_atr_min_pct': 0.016273456367563957, 'bull_atr_max_pct': 0.08002969967925803, 'bull_tp_mult': 1.9127919780437403, 'bull_tsl_mult': 0.9642193722023582, 'bull_time_stop': 190, 'bull_use_sma': False, 'bull_use_ema': True, 'bull_use_atr': True, 'bull_use_adx': False, 'bull_use_spike': False, 'bull_rsi_required': False, 'bear_strategy': 'mean_reversion', 'bear_bb_std_mult': 3.4182666821643126, 'bear_rsi_os': 15, 'bear_rsi_ob': 70, 'bear_adx_thresh': 32.01313794007645, 'bear_atr_min_pct': 0.011569521000958196, 'bear_atr_max_pct': 0.0923278928955685, 'bear_tp_mult': 1.4478474300172688, 'bear_tsl_mult': 0.05576188591417025, 'bear_time_stop': 175, 'bear_use_sma': False, 'bear_use_ema': True, 'bear_use_atr': True, 'bear_use_adx': False, 'bear_use_spike': True, 'bear_rsi_required': True, 'sideways_strategy': 'breakout', 'sideways_bb_std_mult': 3.242743268492768, 'sideways_rsi_os': 25, 'sideways_rsi_ob': 56, 'sideways_adx_thresh': 33.74049343250052, 'sideways_atr_min_pct': 7.355802113361432e-05, 'sideways_atr_max_pct': 0.04404049879772526, 'sideways_tp_mult': 1.9780829699393272, 'sideways_tsl_mult': 0.6198594213140143, 'sideways_time_stop': 125, 'sideways_use_sma': False, 'sideways_use_ema': False, 'sideways_use_atr': False, 'sideways_use_adx': True, 'sideways_use_spike': True, 'sideways_rsi_required': True}.
[I 2025-09-01 04:21:39,980] Trial 112 finished with values: [-1000000000.0, 1000000000.0] and parameters: {'p_sma': 28, 'p_std': 13, 'p_atr': 23, 'p_adx': 23, 'rsi_period': 26, 'ema1': 25, 'ema2': 59, 'slip_atr_k': 0.05858377292115825, 'slip_spread_k': 0.797045049482156, 'spread_hl_frac': 0.0102275504836076, 'bb_std_mult': 1.046046780469444, 'rsi_os': 19, 'rsi_ob': 51, 'vol_spike': 0.009841241082281432, 'adx_thresh': 6.825739856473014, 'atr_min_pct': 0.022999147488164597, 'atr_max_pct': 0.035573436608934486, 'tp_mult': 1.927201936525367, 'tsl_mult': 0.3559680532779645, 'strategy': 'breakout', 'time_stop': 31, 'use_sma': False, 'use_atr': False, 'use_adx': True, 'use_ema': False, 'use_spike': True, 'rsi_required': True, 'edge_k': 0.7497258428136331, 'edge_cap': 0.6923091006509783, 'bull_strategy': 'mean_reversion', 'bull_bb_std_mult': 1.1083934107134417, 'bull_rsi_os': 55, 'bull_rsi_ob': 70, 'bull_adx_thresh': 11.740342226484287, 'bull_atr_min_pct': 0.01351104913481831, 'bull_atr_max_pct': 0.08234436610015819, 'bull_tp_mult': 1.9068156944719425, 'bull_tsl_mult': 0.5793448496812141, 'bull_time_stop': 256, 'bull_use_sma': False, 'bull_use_ema': False, 'bull_use_atr': False, 'bull_use_adx': True, 'bull_use_spike': True, 'bull_rsi_required': True, 'bear_strategy': 'breakout', 'bear_bb_std_mult': 3.1002009505949366, 'bear_rsi_os': 49, 'bear_rsi_ob': 45, 'bear_adx_thresh': 20.460784057189976, 'bear_atr_min_pct': 0.011588381119718482, 'bear_atr_max_pct': 0.09391170491881513, 'bear_tp_mult': 1.285968387371383, 'bear_tsl_mult': 0.10928634703383783, 'bear_time_stop': 114, 'bear_use_sma': False, 'bear_use_ema': False, 'bear_use_atr': False, 'bear_use_adx': False, 'bear_use_spike': False, 'bear_rsi_required': False, 'sideways_strategy': 'breakout', 'sideways_bb_std_mult': 0.5032426760811648, 'sideways_rsi_os': 25, 'sideways_rsi_ob': 91, 'sideways_adx_thresh': 21.284512266129084, 'sideways_atr_min_pct': 0.0027786249523671746, 'sideways_atr_max_pct': 0.046262874256466045, 'sideways_tp_mult': 1.8230110814133176, 'sideways_tsl_mult': 0.7519583085226257, 'sideways_time_stop': 125, 'sideways_use_sma': True, 'sideways_use_ema': True, 'sideways_use_atr': True, 'sideways_use_adx': True, 'sideways_use_spike': False, 'sideways_rsi_required': True}.
[I 2025-09-01 04:21:40,514] Trial 115 finished with values: [-1000000000.0, 1000000000.0] and parameters: {'p_sma': 7, 'p_std': 30, 'p_atr': 28, 'p_adx': 9, 'rsi_period': 64, 'ema1': 23, 'ema2': 59, 'slip_atr_k': 0.017670196655847445, 'slip_spread_k': 0.5856931743910057, 'spread_hl_frac': 0.039606284632583824, 'bb_std_mult': 1.0246596407180864, 'rsi_os': 39, 'rsi_ob': 58, 'vol_spike': 0.23362104096446024, 'adx_thresh': 23.09792112262202, 'atr_min_pct': 0.023033970458721055, 'atr_max_pct': 0.029554886952285156, 'tp_mult': 1.367846305351196, 'tsl_mult': 0.34335947583425885, 'strategy': 'mean_reversion', 'time_stop': 16, 'use_sma': False, 'use_atr': False, 'use_adx': True, 'use_ema': True, 'use_spike': False, 'rsi_required': True, 'edge_k': 0.47853807654297165, 'edge_cap': 0.6496633702795406, 'bull_strategy': 'mean_reversion', 'bull_bb_std_mult': 0.9537853817416218, 'bull_rsi_os': 6, 'bull_rsi_ob': 81, 'bull_adx_thresh': 14.15354995469778, 'bull_atr_min_pct': 0.016119045199991078, 'bull_atr_max_pct': 0.0819173163142197, 'bull_tp_mult': 2.004420673995573, 'bull_tsl_mult': 0.9576620729092612, 'bull_time_stop': 235, 'bull_use_sma': False, 'bull_use_ema': True, 'bull_use_atr': False, 'bull_use_adx': True, 'bull_use_spike': True, 'bull_rsi_required': True, 'bear_strategy': 'breakout', 'bear_bb_std_mult': 3.4318318323269166, 'bear_rsi_os': 49, 'bear_rsi_ob': 46, 'bear_adx_thresh': 20.148321731305217, 'bear_atr_min_pct': 0.011252878466209482, 'bear_atr_max_pct': 0.0927781420978632, 'bear_tp_mult': 1.2932467481213834, 'bear_tsl_mult': 0.3004632537075107, 'bear_time_stop': 178, 'bear_use_sma': False, 'bear_use_ema': True, 'bear_use_atr': False, 'bear_use_adx': True, 'bear_use_spike': True, 'bear_rsi_required': True, 'sideways_strategy': 'mean_reversion', 'sideways_bb_std_mult': 3.135135684655258, 'sideways_rsi_os': 17, 'sideways_rsi_ob': 90, 'sideways_adx_thresh': 19.528777884175383, 'sideways_atr_min_pct': 4.747173631658203e-05, 'sideways_atr_max_pct': 0.08452370293932035, 'sideways_tp_mult': 1.9841796085001642, 'sideways_tsl_mult': 0.8009752486002315, 'sideways_time_stop': 126, 'sideways_use_sma': True, 'sideways_use_ema': False, 'sideways_use_atr': True, 'sideways_use_adx': True, 'sideways_use_spike': True, 'sideways_rsi_required': True}.
[I 2025-09-01 04:21:40,830] Trial 117 finished with values: [-1000000000.0, 1000000000.0] and parameters: {'p_sma': 27, 'p_std': 47, 'p_atr': 10, 'p_adx': 12, 'rsi_period': 32, 'ema1': 11, 'ema2': 26, 'slip_atr_k': 0.03794219154399841, 'slip_spread_k': 0.10597511020346762, 'spread_hl_frac': 0.03969530906592286, 'bb_std_mult': 1.4686954176881617, 'rsi_os': 39, 'rsi_ob': 91, 'vol_spike': 0.011222830528734712, 'adx_thresh': 9.629466039064454, 'atr_min_pct': 0.026922433036987388, 'atr_max_pct': 0.015165275886388076, 'tp_mult': 2.14914337303225, 'tsl_mult': 0.8283356728841651, 'strategy': 'breakout', 'time_stop': 15, 'use_sma': False, 'use_atr': False, 'use_adx': False, 'use_ema': False, 'use_spike': True, 'rsi_required': True, 'edge_k': 0.9259305989531359, 'edge_cap': 0.6149920887699774, 'bull_strategy': 'mean_reversion', 'bull_bb_std_mult': 1.1201383303432322, 'bull_rsi_os': 6, 'bull_rsi_ob': 70, 'bull_adx_thresh': 14.07904253436215, 'bull_atr_min_pct': 0.0031090705133395655, 'bull_atr_max_pct': 0.08212761029125193, 'bull_tp_mult': 1.4880144867972163, 'bull_tsl_mult': 0.7878082520989342, 'bull_time_stop': 245, 'bull_use_sma': True, 'bull_use_ema': False, 'bull_use_atr': False, 'bull_use_adx': True, 'bull_use_spike': True, 'bull_rsi_required': True, 'bear_strategy': 'breakout', 'bear_bb_std_mult': 3.1983584401307157, 'bear_rsi_os': 21, 'bear_rsi_ob': 89, 'bear_adx_thresh': 20.253511463691154, 'bear_atr_min_pct': 0.01485412827724087, 'bear_atr_max_pct': 0.0993131622811971, 'bear_tp_mult': 1.5360256293144112, 'bear_tsl_mult': 0.5066333465144592, 'bear_time_stop': 165, 'bear_use_sma': True, 'bear_use_ema': False, 'bear_use_atr': False, 'bear_use_adx': True, 'bear_use_spike': True, 'bear_rsi_required': False, 'sideways_strategy': 'mean_reversion', 'sideways_bb_std_mult': 3.128772153401617, 'sideways_rsi_os': 27, 'sideways_rsi_ob': 89, 'sideways_adx_thresh': 20.298052682254713, 'sideways_atr_min_pct': 0.000575857092301037, 'sideways_atr_max_pct': 0.11415802852281652, 'sideways_tp_mult': 2.2492055684899563, 'sideways_tsl_mult': 0.7789564144148513, 'sideways_time_stop': 70, 'sideways_use_sma': True, 'sideways_use_ema': True, 'sideways_use_atr': True, 'sideways_use_adx': False, 'sideways_use_spike': False, 'sideways_rsi_required': True}.
