[I 2025-09-01 04:50:15,344] Trial 279 finished with values: [-1000000000.0, 1000000000.0] and parameters: {'p_sma': 41, 'p_std': 44, 'p_atr': 25, 'p_adx': 29, 'rsi_period': 69, 'ema1': 29, 'ema2': 26, 'slip_atr_k': 0.05358204547491556, 'slip_spread_k': 0.417841586817224, 'spread_hl_frac': 0.04458690406540687, 'bb_std_mult': 0.830754049864437, 'rsi_os': 49, 'rsi_ob': 54, 'vol_spike': 0.24782612445646715, 'adx_thresh': 12.887041056068027, 'atr_min_pct': 0.0005818426320466104, 'atr_max_pct': 0.14945075039171857, 'tp_mult': 2.374682523646236, 'tsl_mult': 0.8290794645999329, 'strategy': 'mean_reversion', 'time_stop': 19, 'use_sma': True, 'use_atr': False, 'use_adx': False, 'use_ema': False, 'use_spike': True, 'rsi_required': False, 'edge_k': 0.6553366036284627, 'edge_cap': 0.11253351335405837, 'bull_strategy': 'mean_reversion', 'bull_bb_std_mult': 2.375343845491096, 'bull_rsi_os': 34, 'bull_rsi_ob': 88, 'bull_adx_thresh': 34.11235634787401, 'bull_atr_min_pct': 0.0020711573563610996, 'bull_atr_max_pct': 0.047673922637927225, 'bull_tp_mult': 1.875487033907454, 'bull_tsl_mult': 0.3985578564443237, 'bull_time_stop': 221, 'bull_use_sma': True, 'bull_use_ema': True, 'bull_use_atr': True, 'bull_use_adx': True, 'bull_use_spike': False, 'bull_rsi_required': False, 'bear_strategy': 'breakout', 'bear_bb_std_mult': 2.6277562702485926, 'bear_rsi_os': 47, 'bear_rsi_ob': 57, 'bear_adx_thresh': 12.351462698326234, 'bear_atr_min_pct': 0.019143352139720664, 'bear_atr_max_pct': 0.10848813872860033, 'bear_tp_mult': 1.134001022269363, 'bear_tsl_mult': 0.10520110474671304, 'bear_time_stop': 108, 'bear_use_sma': True, 'bear_use_ema': False, 'bear_use_atr': True, 'bear_use_adx': True, 'bear_use_spike': False, 'bear_rsi_required': False, 'sideways_strategy': 'mean_reversion', 'sideways_bb_std_mult': 1.4308110617308831, 'sideways_rsi_os': 21, 'sideways_rsi_ob': 48, 'sideways_adx_thresh': 23.296813978056758, 'sideways_atr_min_pct': 0.02326885835983506, 'sideways_atr_max_pct': 0.0909505343143224, 'sideways_tp_mult': 2.7993854537081195, 'sideways_tsl_mult': 0.5306905256444241, 'sideways_time_stop': 177, 'sideways_use_sma': True, 'sideways_use_ema': False, 'sideways_use_atr': True, 'sideways_use_adx': False, 'sideways_use_spike': False, 'sideways_rsi_required': False}.
[I 2025-09-01 04:50:15,984] Trial 277 finished with values: [-1000000000.0, 1000000000.0] and parameters: {'p_sma': 17, 'p_std': 43, 'p_atr': 25, 'p_adx': 22, 'rsi_period': 13, 'ema1': 27, 'ema2': 26, 'slip_atr_k': 0.007669538430429236, 'slip_spread_k': 0.236940001186909, 'spread_hl_frac': 0.0060544422376808266, 'bb_std_mult': 2.82196431505387, 'rsi_os': 42, 'rsi_ob': 54, 'vol_spike': 0.0040191959245999, 'adx_thresh': 15.280444396313595, 'atr_min_pct': 0.011933775742094503, 'atr_max_pct': 0.10818577727644828, 'tp_mult': 2.413445012970504, 'tsl_mult': 0.9194475967128624, 'strategy': 'mean_reversion', 'time_stop': 17, 'use_sma': True, 'use_atr': False, 'use_adx': False, 'use_ema': True, 'use_spike': True, 'rsi_required': False, 'edge_k': 0.6561769631264339, 'edge_cap': 0.7178174667249375, 'bull_strategy': 'breakout', 'bull_bb_std_mult': 2.599925708730613, 'bull_rsi_os': 27, 'bull_rsi_ob': 75, 'bull_adx_thresh': 33.22931890667247, 'bull_atr_min_pct': 0.017693698261193984, 'bull_atr_max_pct': 0.04846516468380495, 'bull_tp_mult': 2.829144073434195, 'bull_tsl_mult': 0.8644318648902813, 'bull_time_stop': 219, 'bull_use_sma': True, 'bull_use_ema': True, 'bull_use_atr': False, 'bull_use_adx': True, 'bull_use_spike': False, 'bull_rsi_required': True, 'bear_strategy': 'breakout', 'bear_bb_std_mult': 2.3763408275917506, 'bear_rsi_os': 45, 'bear_rsi_ob': 57, 'bear_adx_thresh': 12.44122052731822, 'bear_atr_min_pct': 0.029435356994987987, 'bear_atr_max_pct': 0.13218635627280864, 'bear_tp_mult': 1.010464570053297, 'bear_tsl_mult': 0.1044511209408005, 'bear_time_stop': 189, 'bear_use_sma': True, 'bear_use_ema': False, 'bear_use_atr': True, 'bear_use_adx': True, 'bear_use_spike': False, 'bear_rsi_required': False, 'sideways_strategy': 'mean_reversion', 'sideways_bb_std_mult': 2.4162509066760105, 'sideways_rsi_os': 34, 'sideways_rsi_ob': 86, 'sideways_adx_thresh': 17.420197911110993, 'sideways_atr_min_pct': 0.023384767629393653, 'sideways_atr_max_pct': 0.016489558903302726, 'sideways_tp_mult': 2.4536095385117793, 'sideways_tsl_mult': 0.9411570584979454, 'sideways_time_stop': 213, 'sideways_use_sma': True, 'sideways_use_ema': True, 'sideways_use_atr': True, 'sideways_use_adx': False, 'sideways_use_spike': True, 'sideways_rsi_required': False}.
[I 2025-09-01 04:50:16,176] Trial 281 finished with values: [-1000000000.0, 1000000000.0] and parameters: {'p_sma': 48, 'p_std': 7, 'p_atr': 28, 'p_adx': 30, 'rsi_period': 70, 'ema1': 16, 'ema2': 26, 'slip_atr_k': 0.07959136352728818, 'slip_spread_k': 0.16130119561551415, 'spread_hl_frac': 0.044991794015525964, 'bb_std_mult': 2.3318654012496465, 'rsi_os': 48, 'rsi_ob': 57, 'vol_spike': 0.07144848672638172, 'adx_thresh': 15.072161668326538, 'atr_min_pct': 0.013916335830817193, 'atr_max_pct': 0.10965129730884779, 'tp_mult': 1.3489831577849252, 'tsl_mult': 0.9626491222110344, 'strategy': 'breakout', 'time_stop': 17, 'use_sma': True, 'use_atr': False, 'use_adx': False, 'use_ema': True, 'use_spike': True, 'rsi_required': False, 'edge_k': 0.22603459290295536, 'edge_cap': 0.12748711051469916, 'bull_strategy': 'mean_reversion', 'bull_bb_std_mult': 2.366304882926588, 'bull_rsi_os': 20, 'bull_rsi_ob': 87, 'bull_adx_thresh': 22.15014612095287, 'bull_atr_min_pct': 0.01030262623360019, 'bull_atr_max_pct': 0.129032346546624, 'bull_tp_mult': 1.6081978591660904, 'bull_tsl_mult': 0.4716520185259012, 'bull_time_stop': 241, 'bull_use_sma': True, 'bull_use_ema': True, 'bull_use_atr': True, 'bull_use_adx': True, 'bull_use_spike': False, 'bull_rsi_required': False, 'bear_strategy': 'breakout', 'bear_bb_std_mult': 1.1863013579274033, 'bear_rsi_os': 47, 'bear_rsi_ob': 94, 'bear_adx_thresh': 27.445485782043413, 'bear_atr_min_pct': 0.021595732388928906, 'bear_atr_max_pct': 0.14335463445669774, 'bear_tp_mult': 1.71949976714875, 'bear_tsl_mult': 0.17219404360145568, 'bear_time_stop': 171, 'bear_use_sma': True, 'bear_use_ema': False, 'bear_use_atr': True, 'bear_use_adx': True, 'bear_use_spike': False, 'bear_rsi_required': False, 'sideways_strategy': 'mean_reversion', 'sideways_bb_std_mult': 1.5205121002474096, 'sideways_rsi_os': 19, 'sideways_rsi_ob': 48, 'sideways_adx_thresh': 18.795631793592392, 'sideways_atr_min_pct': 0.010489553159370828, 'sideways_atr_max_pct': 0.1418054565200345, 'sideways_tp_mult': 2.7832073261034385, 'sideways_tsl_mult': 0.9547949182345055, 'sideways_time_stop': 156, 'sideways_use_sma': True, 'sideways_use_ema': True, 'sideways_use_atr': True, 'sideways_use_adx': False, 'sideways_use_spike': False, 'sideways_rsi_required': False}.
[I 2025-09-01 04:50:57,847] Trial 282 finished with values: [-0.03170685284722552, 0.03153554134380709] and parameters: {'p_sma': 49, 'p_std': 40, 'p_atr': 28, 'p_adx': 24, 'rsi_period': 70, 'ema1': 16, 'ema2': 26, 'slip_atr_k': 0.13830419241515893, 'slip_spread_k': 0.7445372975835138, 'spread_hl_frac': 0.04176153313571214, 'bb_std_mult': 2.642126754445487, 'rsi_os': 16, 'rsi_ob': 55, 'vol_spike': 0.07544668501771333, 'adx_thresh': 32.72941483316915, 'atr_min_pct': 0.0009698872106018233, 'atr_max_pct': 0.12675531759228761, 'tp_mult': 2.4169383560795463, 'tsl_mult': 0.8369830957344965, 'strategy': 'breakout', 'time_stop': 88, 'use_sma': True, 'use_atr': False, 'use_adx': False, 'use_ema': True, 'use_spike': True, 'rsi_required': False, 'edge_k': 0.08373462434897005, 'edge_cap': 0.131201496322299, 'bull_strategy': 'mean_reversion', 'bull_bb_std_mult': 2.5018438321107506, 'bull_rsi_os': 20, 'bull_rsi_ob': 90, 'bull_adx_thresh': 18.023495389634334, 'bull_atr_min_pct': 0.0018749872266107604, 'bull_atr_max_pct': 0.027578449947266055, 'bull_tp_mult': 2.0432068737234306, 'bull_tsl_mult': 0.47999141389552724, 'bull_time_stop': 232, 'bull_use_sma': True, 'bull_use_ema': False, 'bull_use_atr': True, 'bull_use_adx': False, 'bull_use_spike': True, 'bull_rsi_required': False, 'bear_strategy': 'mean_reversion', 'bear_bb_std_mult': 1.188350465311516, 'bear_rsi_os': 46, 'bear_rsi_ob': 94, 'bear_adx_thresh': 9.981689881527585, 'bear_atr_min_pct': 0.029437738255578924, 'bear_atr_max_pct': 0.052248466571308654, 'bear_tp_mult': 1.1678594232212998, 'bear_tsl_mult': 0.5832331828042518, 'bear_time_stop': 174, 'bear_use_sma': True, 'bear_use_ema': False, 'bear_use_atr': True, 'bear_use_adx': True, 'bear_use_spike': True, 'bear_rsi_required': False, 'sideways_strategy': 'mean_reversion', 'sideways_bb_std_mult': 1.516730399710773, 'sideways_rsi_os': 20, 'sideways_rsi_ob': 52, 'sideways_adx_thresh': 18.889009999020587, 'sideways_atr_min_pct': 0.01517152949339887, 'sideways_atr_max_pct': 0.08420437637204123, 'sideways_tp_mult': 2.7833191460891284, 'sideways_tsl_mult': 0.955701501838099, 'sideways_time_stop': 193, 'sideways_use_sma': True, 'sideways_use_ema': True, 'sideways_use_atr': False, 'sideways_use_adx': False, 'sideways_use_spike': False, 'sideways_rsi_required': True}.
[I 2025-09-01 04:50:57,997] Trial 284 finished with values: [-1000000000.0, 1000000000.0] and parameters: {'p_sma': 48, 'p_std': 46, 'p_atr': 28, 'p_adx': 13, 'rsi_period': 62, 'ema1': 28, 'ema2': 17, 'slip_atr_k': 0.00519572189146901, 'slip_spread_k': 0.6515934569293447, 'spread_hl_frac': 0.04155142441033144, 'bb_std_mult': 1.6183250943404417, 'rsi_os': 47, 'rsi_ob': 57, 'vol_spike': 0.18163016790253483, 'adx_thresh': 14.89169832674712, 'atr_min_pct': 0.012627513936941146, 'atr_max_pct': 0.12636746506991875, 'tp_mult': 1.227889189124, 'tsl_mult': 0.9630596287750188, 'strategy': 'breakout', 'time_stop': 92, 'use_sma': True, 'use_atr': True, 'use_adx': True, 'use_ema': True, 'use_spike': False, 'rsi_required': True, 'edge_k': 0.21036676943782573, 'edge_cap': 0.13459346809568284, 'bull_strategy': 'mean_reversion', 'bull_bb_std_mult': 1.211763995306094, 'bull_rsi_os': 50, 'bull_rsi_ob': 89, 'bull_adx_thresh': 27.068726215529544, 'bull_atr_min_pct': 0.01004286820229006, 'bull_atr_max_pct': 0.12971345557700856, 'bull_tp_mult': 1.6055555361361533, 'bull_tsl_mult': 0.48176565542861116, 'bull_time_stop': 230, 'bull_use_sma': False, 'bull_use_ema': False, 'bull_use_atr': True, 'bull_use_adx': False, 'bull_use_spike': True, 'bull_rsi_required': False, 'bear_strategy': 'mean_reversion', 'bear_bb_std_mult': 1.1719161698123277, 'bear_rsi_os': 11, 'bear_rsi_ob': 91, 'bear_adx_thresh': 11.326035662324738, 'bear_atr_min_pct': 0.01692936248165124, 'bear_atr_max_pct': 0.052455556084302885, 'bear_tp_mult': 1.0922748179992208, 'bear_tsl_mult': 0.17761522394790016, 'bear_time_stop': 199, 'bear_use_sma': False, 'bear_use_ema': False, 'bear_use_atr': False, 'bear_use_adx': False, 'bear_use_spike': True, 'bear_rsi_required': False, 'sideways_strategy': 'breakout', 'sideways_bb_std_mult': 1.5222358871774522, 'sideways_rsi_os': 28, 'sideways_rsi_ob': 52, 'sideways_adx_thresh': 18.743168760863536, 'sideways_atr_min_pct': 0.01050109532859484, 'sideways_atr_max_pct': 0.061375565504857565, 'sideways_tp_mult': 1.0587697844020112, 'sideways_tsl_mult': 0.6173492835664467, 'sideways_time_stop': 232, 'sideways_use_sma': True, 'sideways_use_ema': True, 'sideways_use_atr': False, 'sideways_use_adx': True, 'sideways_use_spike': False, 'sideways_rsi_required': True}.
[I 2025-09-01 04:50:58,132] Trial 283 finished with values: [-0.054732828754332385, 0.0546171675891183] and parameters: {'p_sma': 33, 'p_std': 6, 'p_atr': 24, 'p_adx': 24, 'rsi_period': 43, 'ema1': 16, 'ema2': 26, 'slip_atr_k': 0.06498504681477225, 'slip_spread_k': 0.30613671449174956, 'spread_hl_frac': 0.01319221266255173, 'bb_std_mult': 1.2248527272950454, 'rsi_os': 34, 'rsi_ob': 57, 'vol_spike': 0.26572769888665476, 'adx_thresh': 15.036232941244705, 'atr_min_pct': 0.011836743373907178, 'atr_max_pct': 0.12105286509258222, 'tp_mult': 1.4700857924923811, 'tsl_mult': 0.03390339793696323, 'strategy': 'breakout', 'time_stop': 256, 'use_sma': True, 'use_atr': True, 'use_adx': True, 'use_ema': True, 'use_spike': False, 'rsi_required': True, 'edge_k': 1.500864510367018, 'edge_cap': 0.712834764847717, 'bull_strategy': 'mean_reversion', 'bull_bb_std_mult': 2.8814528762671223, 'bull_rsi_os': 30, 'bull_rsi_ob': 90, 'bull_adx_thresh': 21.923857240598696, 'bull_atr_min_pct': 0.0006282594501243169, 'bull_atr_max_pct': 0.12975411802689837, 'bull_tp_mult': 1.5978554585019469, 'bull_tsl_mult': 0.8504338572672164, 'bull_time_stop': 229, 'bull_use_sma': False, 'bull_use_ema': False, 'bull_use_atr': True, 'bull_use_adx': False, 'bull_use_spike': True, 'bull_rsi_required': False, 'bear_strategy': 'mean_reversion', 'bear_bb_std_mult': 1.197160572533212, 'bear_rsi_os': 46, 'bear_rsi_ob': 94, 'bear_adx_thresh': 9.83327683149431, 'bear_atr_min_pct': 0.02945944600566531, 'bear_atr_max_pct': 0.13222804780506045, 'bear_tp_mult': 2.6089243755233658, 'bear_tsl_mult': 0.30006318744213056, 'bear_time_stop': 282, 'bear_use_sma': False, 'bear_use_ema': False, 'bear_use_atr': False, 'bear_use_adx': False, 'bear_use_spike': True, 'bear_rsi_required': False, 'sideways_strategy': 'mean_reversion', 'sideways_bb_std_mult': 2.763556911329024, 'sideways_rsi_os': 54, 'sideways_rsi_ob': 53, 'sideways_adx_thresh': 18.901059463975773, 'sideways_atr_min_pct': 0.010442524722154012, 'sideways_atr_max_pct': 0.10458912314917403, 'sideways_tp_mult': 2.350308502984509, 'sideways_tsl_mult': 0.9293397645172798, 'sideways_time_stop': 231, 'sideways_use_sma': True, 'sideways_use_ema': True, 'sideways_use_atr': False, 'sideways_use_adx': True, 'sideways_use_spike': False, 'sideways_rsi_required': True}.
[I 2025-09-01 04:50:58,145] Trial 285 finished with values: [-0.015881978777677275, 0.015743387963903142] and parameters: {'p_sma': 21, 'p_std': 46, 'p_atr': 28, 'p_adx': 15, 'rsi_period': 7, 'ema1': 30, 'ema2': 37, 'slip_atr_k': 0.0002056585701247297, 'slip_spread_k': 0.3537169389566896, 'spread_hl_frac': 0.04196313040236484, 'bb_std_mult': 1.0081771438104783, 'rsi_os': 47, 'rsi_ob': 87, 'vol_spike': 0.27007671552301377, 'adx_thresh': 10.204715924683514, 'atr_min_pct': 0.0019980829173170747, 'atr_max_pct': 0.020290239622999973, 'tp_mult': 2.4892507976210956, 'tsl_mult': 0.9523937864974008, 'strategy': 'breakout', 'time_stop': 37, 'use_sma': True, 'use_atr': True, 'use_adx': True, 'use_ema': True, 'use_spike': False, 'rsi_required': True, 'edge_k': 0.3586708460004481, 'edge_cap': 0.273425480714638, 'bull_strategy': 'mean_reversion', 'bull_bb_std_mult': 1.0033751245043143, 'bull_rsi_os': 30, 'bull_rsi_ob': 85, 'bull_adx_thresh': 27.00837116454411, 'bull_atr_min_pct': 0.000910552357598265, 'bull_atr_max_pct': 0.12321351705415459, 'bull_tp_mult': 2.9728407107871795, 'bull_tsl_mult': 0.4239823940234965, 'bull_time_stop': 230, 'bull_use_sma': False, 'bull_use_ema': False, 'bull_use_atr': True, 'bull_use_adx': False, 'bull_use_spike': True, 'bull_rsi_required': False, 'bear_strategy': 'mean_reversion', 'bear_bb_std_mult': 1.1021101002011995, 'bear_rsi_os': 49, 'bear_rsi_ob': 91, 'bear_adx_thresh': 9.926305149047753, 'bear_atr_min_pct': 0.028414428574281097, 'bear_atr_max_pct': 0.10498996452026096, 'bear_tp_mult': 2.0139101336549685, 'bear_tsl_mult': 0.14249236311140318, 'bear_time_stop': 273, 'bear_use_sma': False, 'bear_use_ema': True, 'bear_use_atr': False, 'bear_use_adx': False, 'bear_use_spike': True, 'bear_rsi_required': False, 'sideways_strategy': 'breakout', 'sideways_bb_std_mult': 1.2503611920690108, 'sideways_rsi_os': 9, 'sideways_rsi_ob': 51, 'sideways_adx_thresh': 15.968675726387575, 'sideways_atr_min_pct': 0.022369866279049577, 'sideways_atr_max_pct': 0.06070174194674821, 'sideways_tp_mult': 2.746271303654858, 'sideways_tsl_mult': 0.21279649104922904, 'sideways_time_stop': 193, 'sideways_use_sma': True, 'sideways_use_ema': True, 'sideways_use_atr': False, 'sideways_use_adx': True, 'sideways_use_spike': False, 'sideways_rsi_required': True}.
[I 2025-09-01 04:51:40,901] Trial 286 finished with values: [-1000000000.0, 1000000000.0] and parameters: {'p_sma': 11, 'p_std': 41, 'p_atr': 27, 'p_adx': 18, 'rsi_period': 61, 'ema1': 5, 'ema2': 48, 'slip_atr_k': 0.00030356353380085483, 'slip_spread_k': 0.5375769136620383, 'spread_hl_frac': 0.04316650932442155, 'bb_std_mult': 1.0357036605156484, 'rsi_os': 12, 'rsi_ob': 58, 'vol_spike': 0.1254936826122277, 'adx_thresh': 9.337556997004649, 'atr_min_pct': 0.0020711698367509735, 'atr_max_pct': 0.14144389011789638, 'tp_mult': 2.311275648615034, 'tsl_mult': 0.8754526068557051, 'strategy': 'breakout', 'time_stop': 130, 'use_sma': True, 'use_atr': False, 'use_adx': False, 'use_ema': True, 'use_spike': True, 'rsi_required': False, 'edge_k': 0.43946150065234313, 'edge_cap': 0.41048380135637097, 'bull_strategy': 'breakout', 'bull_bb_std_mult': 0.9936678054647883, 'bull_rsi_os': 26, 'bull_rsi_ob': 85, 'bull_adx_thresh': 16.84950932848013, 'bull_atr_min_pct': 0.0011781919714965471, 'bull_atr_max_pct': 0.09558398708629925, 'bull_tp_mult': 2.217339259290229, 'bull_tsl_mult': 0.3451031032209158, 'bull_time_stop': 293, 'bull_use_sma': True, 'bull_use_ema': False, 'bull_use_atr': False, 'bull_use_adx': False, 'bull_use_spike': False, 'bull_rsi_required': True, 'bear_strategy': 'mean_reversion', 'bear_bb_std_mult': 1.092835401601166, 'bear_rsi_os': 49, 'bear_rsi_ob': 60, 'bear_adx_thresh': 13.6501811451254, 'bear_atr_min_pct': 0.028683391907180722, 'bear_atr_max_pct': 0.11461238069582946, 'bear_tp_mult': 1.3677223892188068, 'bear_tsl_mult': 0.14980674453500406, 'bear_time_stop': 231, 'bear_use_sma': True, 'bear_use_ema': True, 'bear_use_atr': True, 'bear_use_adx': True, 'bear_use_spike': False, 'bear_rsi_required': True, 'sideways_strategy': 'breakout', 'sideways_bb_std_mult': 3.2877340254246215, 'sideways_rsi_os': 9, 'sideways_rsi_ob': 50, 'sideways_adx_thresh': 15.939880860876798, 'sideways_atr_min_pct': 0.018123171872713895, 'sideways_atr_max_pct': 0.010125382055838641, 'sideways_tp_mult': 2.7369730282330615, 'sideways_tsl_mult': 0.654291814197803, 'sideways_time_stop': 191, 'sideways_use_sma': False, 'sideways_use_ema': True, 'sideways_use_atr': False, 'sideways_use_adx': False, 'sideways_use_spike': True, 'sideways_rsi_required': False}.
[I 2025-09-01 04:51:41,508] Trial 287 finished with values: [-1000000000.0, 1000000000.0] and parameters: {'p_sma': 10, 'p_std': 41, 'p_atr': 23, 'p_adx': 18, 'rsi_period': 55, 'ema1': 26, 'ema2': 29, 'slip_atr_k': 2.4538629605735604e-05, 'slip_spread_k': 0.35614251863788876, 'spread_hl_frac': 0.040078177158690734, 'bb_std_mult': 1.040600493662689, 'rsi_os': 44, 'rsi_ob': 52, 'vol_spike': 0.2422524035305036, 'adx_thresh': 11.338241207855948, 'atr_min_pct': 0.00209392195626617, 'atr_max_pct': 0.11441291208019923, 'tp_mult': 2.3304005897989812, 'tsl_mult': 0.8697600165272334, 'strategy': 'breakout', 'time_stop': 131, 'use_sma': True, 'use_atr': False, 'use_adx': False, 'use_ema': True, 'use_spike': True, 'rsi_required': False, 'edge_k': 0.4370142604625895, 'edge_cap': 0.35854673925872926, 'bull_strategy': 'breakout', 'bull_bb_std_mult': 1.5697031526848528, 'bull_rsi_os': 26, 'bull_rsi_ob': 85, 'bull_adx_thresh': 17.260787374949178, 'bull_atr_min_pct': 0.006289947565256974, 'bull_atr_max_pct': 0.12339531036859779, 'bull_tp_mult': 1.6663386009479457, 'bull_tsl_mult': 0.3415567595022268, 'bull_time_stop': 213, 'bull_use_sma': True, 'bull_use_ema': False, 'bull_use_atr': False, 'bull_use_adx': False, 'bull_use_spike': False, 'bull_rsi_required': True, 'bear_strategy': 'mean_reversion', 'bear_bb_std_mult': 0.9369501444760642, 'bear_rsi_os': 52, 'bear_rsi_ob': 60, 'bear_adx_thresh': 13.325135582823545, 'bear_atr_min_pct': 0.023422788202022784, 'bear_atr_max_pct': 0.1033561371820591, 'bear_tp_mult': 1.0877658787629338, 'bear_tsl_mult': 0.13972513548862178, 'bear_time_stop': 274, 'bear_use_sma': True, 'bear_use_ema': True, 'bear_use_atr': True, 'bear_use_adx': True, 'bear_use_spike': False, 'bear_rsi_required': True, 'sideways_strategy': 'breakout', 'sideways_bb_std_mult': 1.1414148006701095, 'sideways_rsi_os': 32, 'sideways_rsi_ob': 50, 'sideways_adx_thresh': 17.809183059657776, 'sideways_atr_min_pct': 0.006706312049799837, 'sideways_atr_max_pct': 0.09523114543315137, 'sideways_tp_mult': 2.7220648911679755, 'sideways_tsl_mult': 0.9674511752005539, 'sideways_time_stop': 191, 'sideways_use_sma': False, 'sideways_use_ema': True, 'sideways_use_atr': False, 'sideways_use_adx': False, 'sideways_use_spike': True, 'sideways_rsi_required': False}.
