[I 2025-09-01 05:24:55,847] Trial 475 finished with values: [-1000000000.0, 1000000000.0] and parameters: {'p_sma': 59, 'p_std': 31, 'p_atr': 8, 'p_adx': 18, 'rsi_period': 53, 'ema1': 25, 'ema2': 32, 'slip_atr_k': 0.020186402109111358, 'slip_spread_k': 0.375390221240299, 'spread_hl_frac': 0.015428475542293733, 'bb_std_mult': 2.22514310257732, 'rsi_os': 25, 'rsi_ob': 88, 'vol_spike': 0.20427972422338125, 'adx_thresh': 12.897111760973488, 'atr_min_pct': 0.003368748173769775, 'atr_max_pct': 0.12904621306954572, 'tp_mult': 2.2611164944405737, 'tsl_mult': 0.9297632343222912, 'strategy': 'breakout', 'time_stop': 190, 'use_sma': False, 'use_atr': True, 'use_adx': False, 'use_ema': True, 'use_spike': True, 'rsi_required': False, 'edge_k': 0.20301229058894948, 'edge_cap': 0.9541882421028179, 'bull_strategy': 'breakout', 'bull_bb_std_mult': 0.7661558379502476, 'bull_rsi_os': 51, 'bull_rsi_ob': 81, 'bull_adx_thresh': 6.1585891678213605, 'bull_atr_min_pct': 0.013154928012824512, 'bull_atr_max_pct': 0.10741724119008163, 'bull_tp_mult': 1.174241293639031, 'bull_tsl_mult': 0.20431927912400094, 'bull_time_stop': 89, 'bull_use_sma': True, 'bull_use_ema': False, 'bull_use_atr': False, 'bull_use_adx': True, 'bull_use_spike': True, 'bull_rsi_required': True, 'bear_strategy': 'breakout', 'bear_bb_std_mult': 3.599070305161118, 'bear_rsi_os': 5, 'bear_rsi_ob': 68, 'bear_adx_thresh': 21.954177013519356, 'bear_atr_min_pct': 0.006832742073294804, 'bear_atr_max_pct': 0.06877992228500429, 'bear_tp_mult': 1.267737632916122, 'bear_tsl_mult': 0.637049827909905, 'bear_time_stop': 188, 'bear_use_sma': True, 'bear_use_ema': True, 'bear_use_atr': False, 'bear_use_adx': False, 'bear_use_spike': True, 'bear_rsi_required': False, 'sideways_strategy': 'breakout', 'sideways_bb_std_mult': 0.5150159738809699, 'sideways_rsi_os': 43, 'sideways_rsi_ob': 53, 'sideways_adx_thresh': 22.57063407345576, 'sideways_atr_min_pct': 0.00555461837626915, 'sideways_atr_max_pct': 0.0992444543986422, 'sideways_tp_mult': 1.6311457388360755, 'sideways_tsl_mult': 0.9998790962377406, 'sideways_time_stop': 171, 'sideways_use_sma': False, 'sideways_use_ema': True, 'sideways_use_atr': True, 'sideways_use_adx': False, 'sideways_use_spike': True, 'sideways_rsi_required': True}.
[I 2025-09-01 05:25:40,678] Trial 480 finished with values: [-0.02317555626475909, 0.022991716823428113] and parameters: {'p_sma': 60, 'p_std': 33, 'p_atr': 7, 'p_adx': 18, 'rsi_period': 51, 'ema1': 23, 'ema2': 31, 'slip_atr_k': 0.015485462038806616, 'slip_spread_k': 0.454026338566501, 'spread_hl_frac': 0.0471323161738183, 'bb_std_mult': 2.1143252589998385, 'rsi_os': 26, 'rsi_ob': 70, 'vol_spike': 0.05531577443025844, 'adx_thresh': 13.560866433495773, 'atr_min_pct': 0.004122945905024237, 'atr_max_pct': 0.12556330159080475, 'tp_mult': 2.510939076694033, 'tsl_mult': 0.4803261399230198, 'strategy': 'breakout', 'time_stop': 195, 'use_sma': False, 'use_atr': True, 'use_adx': False, 'use_ema': True, 'use_spike': False, 'rsi_required': False, 'edge_k': 0.11545971323587689, 'edge_cap': 0.054744926104578706, 'bull_strategy': 'breakout', 'bull_bb_std_mult': 0.9221943720789186, 'bull_rsi_os': 47, 'bull_rsi_ob': 88, 'bull_adx_thresh': 5.692105487228743, 'bull_atr_min_pct': 0.011862022235892071, 'bull_atr_max_pct': 0.10925307068949235, 'bull_tp_mult': 1.27872821280599, 'bull_tsl_mult': 0.17911699688860327, 'bull_time_stop': 101, 'bull_use_sma': False, 'bull_use_ema': False, 'bull_use_atr': False, 'bull_use_adx': True, 'bull_use_spike': False, 'bull_rsi_required': True, 'bear_strategy': 'breakout', 'bear_bb_std_mult': 3.4437706469415037, 'bear_rsi_os': 8, 'bear_rsi_ob': 67, 'bear_adx_thresh': 30.692991361038807, 'bear_atr_min_pct': 0.007981713273787086, 'bear_atr_max_pct': 0.06742123496984812, 'bear_tp_mult': 2.1921917465421594, 'bear_tsl_mult': 0.6209508668748841, 'bear_time_stop': 181, 'bear_use_sma': True, 'bear_use_ema': False, 'bear_use_atr': False, 'bear_use_adx': False, 'bear_use_spike': False, 'bear_rsi_required': True, 'sideways_strategy': 'breakout', 'sideways_bb_std_mult': 2.536306142015613, 'sideways_rsi_os': 44, 'sideways_rsi_ob': 54, 'sideways_adx_thresh': 23.470188965015957, 'sideways_atr_min_pct': 0.003629371730486047, 'sideways_atr_max_pct': 0.10205632377197321, 'sideways_tp_mult': 1.5386581424317949, 'sideways_tsl_mult': 0.2394615760104986, 'sideways_time_stop': 162, 'sideways_use_sma': False, 'sideways_use_ema': True, 'sideways_use_atr': True, 'sideways_use_adx': True, 'sideways_use_spike': True, 'sideways_rsi_required': True}.
[I 2025-09-01 05:25:41,226] Trial 481 finished with values: [-0.033646392961766636, 0.03356010805466138] and parameters: {'p_sma': 56, 'p_std': 33, 'p_atr': 7, 'p_adx': 18, 'rsi_period': 51, 'ema1': 23, 'ema2': 31, 'slip_atr_k': 0.022069160016532557, 'slip_spread_k': 0.4411232023294678, 'spread_hl_frac': 0.047012059845302025, 'bb_std_mult': 1.9321441368478403, 'rsi_os': 26, 'rsi_ob': 91, 'vol_spike': 0.051000124013005424, 'adx_thresh': 13.477682660350261, 'atr_min_pct': 0.0055406501663982305, 'atr_max_pct': 0.12389810704544357, 'tp_mult': 1.744534967428041, 'tsl_mult': 0.8918020334885433, 'strategy': 'breakout', 'time_stop': 197, 'use_sma': False, 'use_atr': True, 'use_adx': False, 'use_ema': True, 'use_spike': False, 'rsi_required': False, 'edge_k': 0.1914434550792283, 'edge_cap': 0.5295490067974988, 'bull_strategy': 'breakout', 'bull_bb_std_mult': 0.9166364637177661, 'bull_rsi_os': 47, 'bull_rsi_ob': 76, 'bull_adx_thresh': 5.658746272998651, 'bull_atr_min_pct': 0.014610375450933211, 'bull_atr_max_pct': 0.10929354581469605, 'bull_tp_mult': 1.273992021364847, 'bull_tsl_mult': 0.14669340036303988, 'bull_time_stop': 100, 'bull_use_sma': False, 'bull_use_ema': False, 'bull_use_atr': False, 'bull_use_adx': True, 'bull_use_spike': False, 'bull_rsi_required': True, 'bear_strategy': 'breakout', 'bear_bb_std_mult': 3.4312072916638616, 'bear_rsi_os': 8, 'bear_rsi_ob': 67, 'bear_adx_thresh': 23.12707514815025, 'bear_atr_min_pct': 0.008006466142102193, 'bear_atr_max_pct': 0.07139338076731563, 'bear_tp_mult': 1.3099379716746908, 'bear_tsl_mult': 0.6875473266649167, 'bear_time_stop': 103, 'bear_use_sma': True, 'bear_use_ema': False, 'bear_use_atr': False, 'bear_use_adx': False, 'bear_use_spike': False, 'bear_rsi_required': True, 'sideways_strategy': 'breakout', 'sideways_bb_std_mult': 2.6061389140439095, 'sideways_rsi_os': 44, 'sideways_rsi_ob': 90, 'sideways_adx_thresh': 23.94084540131938, 'sideways_atr_min_pct': 0.0030993370546730896, 'sideways_atr_max_pct': 0.10295088014792105, 'sideways_tp_mult': 1.494871043603208, 'sideways_tsl_mult': 0.9755295152022094, 'sideways_time_stop': 156, 'sideways_use_sma': False, 'sideways_use_ema': True, 'sideways_use_atr': True, 'sideways_use_adx': True, 'sideways_use_spike': True, 'sideways_rsi_required': True}.
[I 2025-09-01 05:25:41,770] Trial 478 finished with values: [-0.021350353848034187, 0.021183443801777314] and parameters: {'p_sma': 60, 'p_std': 31, 'p_atr': 7, 'p_adx': 18, 'rsi_period': 53, 'ema1': 23, 'ema2': 32, 'slip_atr_k': 0.02015433003741157, 'slip_spread_k': 0.44394786351319865, 'spread_hl_frac': 0.024511376509364982, 'bb_std_mult': 2.111874650032875, 'rsi_os': 25, 'rsi_ob': 70, 'vol_spike': 0.20087512296400611, 'adx_thresh': 13.136180023813129, 'atr_min_pct': 0.005330818838630865, 'atr_max_pct': 0.12023889997364406, 'tp_mult': 2.829691384097475, 'tsl_mult': 0.8329245001194985, 'strategy': 'breakout', 'time_stop': 196, 'use_sma': False, 'use_atr': True, 'use_adx': False, 'use_ema': True, 'use_spike': True, 'rsi_required': False, 'edge_k': 0.20899109234235538, 'edge_cap': 0.49605397030195497, 'bull_strategy': 'breakout', 'bull_bb_std_mult': 0.8006408021288196, 'bull_rsi_os': 51, 'bull_rsi_ob': 81, 'bull_adx_thresh': 6.347538941572588, 'bull_atr_min_pct': 0.013248598645772514, 'bull_atr_max_pct': 0.10760406996512949, 'bull_tp_mult': 1.3364161792738272, 'bull_tsl_mult': 0.1994884353932081, 'bull_time_stop': 90, 'bull_use_sma': True, 'bull_use_ema': False, 'bull_use_atr': False, 'bull_use_adx': True, 'bull_use_spike': False, 'bull_rsi_required': True, 'bear_strategy': 'breakout', 'bear_bb_std_mult': 3.4266851439458756, 'bear_rsi_os': 5, 'bear_rsi_ob': 67, 'bear_adx_thresh': 18.552047469419712, 'bear_atr_min_pct': 0.008070246816848392, 'bear_atr_max_pct': 0.06642057221043438, 'bear_tp_mult': 1.2960028565482775, 'bear_tsl_mult': 0.03359976883123006, 'bear_time_stop': 189, 'bear_use_sma': True, 'bear_use_ema': True, 'bear_use_atr': False, 'bear_use_adx': False, 'bear_use_spike': False, 'bear_rsi_required': True, 'sideways_strategy': 'breakout', 'sideways_bb_std_mult': 0.7073483980338698, 'sideways_rsi_os': 44, 'sideways_rsi_ob': 54, 'sideways_adx_thresh': 23.886809388714884, 'sideways_atr_min_pct': 0.003809730863165001, 'sideways_atr_max_pct': 0.09910360421931114, 'sideways_tp_mult': 1.6303937241569353, 'sideways_tsl_mult': 0.9790571433270138, 'sideways_time_stop': 166, 'sideways_use_sma': False, 'sideways_use_ema': True, 'sideways_use_atr': True, 'sideways_use_adx': False, 'sideways_use_spike': True, 'sideways_rsi_required': True}.
[I 2025-09-01 05:25:42,130] Trial 479 finished with values: [-0.022580546090965825, 0.022399971958762598] and parameters: {'p_sma': 60, 'p_std': 33, 'p_atr': 7, 'p_adx': 18, 'rsi_period': 51, 'ema1': 23, 'ema2': 32, 'slip_atr_k': 0.026791634083422222, 'slip_spread_k': 0.4380620994458889, 'spread_hl_frac': 0.02435700481370092, 'bb_std_mult': 2.127225882148697, 'rsi_os': 25, 'rsi_ob': 46, 'vol_spike': 0.056645334716301676, 'adx_thresh': 13.248683019641538, 'atr_min_pct': 0.005316502673474383, 'atr_max_pct': 0.1284479417883029, 'tp_mult': 2.840279022411269, 'tsl_mult': 0.6266200071129067, 'strategy': 'breakout', 'time_stop': 194, 'use_sma': False, 'use_atr': True, 'use_adx': False, 'use_ema': True, 'use_spike': False, 'rsi_required': False, 'edge_k': 0.19945922007775158, 'edge_cap': 0.531314688894701, 'bull_strategy': 'breakout', 'bull_bb_std_mult': 0.893528019676355, 'bull_rsi_os': 47, 'bull_rsi_ob': 73, 'bull_adx_thresh': 6.5283650162014535, 'bull_atr_min_pct': 0.012003651081114343, 'bull_atr_max_pct': 0.10758946462798724, 'bull_tp_mult': 1.3325662960503273, 'bull_tsl_mult': 0.18323167975086718, 'bull_time_stop': 101, 'bull_use_sma': False, 'bull_use_ema': False, 'bull_use_atr': False, 'bull_use_adx': True, 'bull_use_spike': True, 'bull_rsi_required': True, 'bear_strategy': 'breakout', 'bear_bb_std_mult': 3.5948560109002807, 'bear_rsi_os': 6, 'bear_rsi_ob': 67, 'bear_adx_thresh': 28.89397438127921, 'bear_atr_min_pct': 0.008106250162437914, 'bear_atr_max_pct': 0.06632464039516321, 'bear_tp_mult': 1.3089919302694268, 'bear_tsl_mult': 0.6667008639245176, 'bear_time_stop': 188, 'bear_use_sma': True, 'bear_use_ema': False, 'bear_use_atr': False, 'bear_use_adx': False, 'bear_use_spike': True, 'bear_rsi_required': True, 'sideways_strategy': 'breakout', 'sideways_bb_std_mult': 0.7078903198731608, 'sideways_rsi_os': 44, 'sideways_rsi_ob': 54, 'sideways_adx_thresh': 23.77412133675581, 'sideways_atr_min_pct': 0.0037667725826305465, 'sideways_atr_max_pct': 0.09893761973374887, 'sideways_tp_mult': 1.623547732174851, 'sideways_tsl_mult': 0.9792953368570965, 'sideways_time_stop': 168, 'sideways_use_sma': False, 'sideways_use_ema': True, 'sideways_use_atr': True, 'sideways_use_adx': True, 'sideways_use_spike': True, 'sideways_rsi_required': True}.
[I 2025-09-01 05:26:26,276] Trial 482 finished with values: [-0.04168987085929843, 0.04160556217861464] and parameters: {'p_sma': 56, 'p_std': 33, 'p_atr': 7, 'p_adx': 18, 'rsi_period': 48, 'ema1': 24, 'ema2': 31, 'slip_atr_k': 0.03165635295675017, 'slip_spread_k': 0.4276603891027938, 'spread_hl_frac': 0.00865024914903718, 'bb_std_mult': 1.9226017238238116, 'rsi_os': 25, 'rsi_ob': 90, 'vol_spike': 0.00022482322820777112, 'adx_thresh': 7.698759487685763, 'atr_min_pct': 0.004027618833578161, 'atr_max_pct': 0.12097832825515148, 'tp_mult': 1.648593308951358, 'tsl_mult': 0.6106884209284764, 'strategy': 'breakout', 'time_stop': 186, 'use_sma': False, 'use_atr': True, 'use_adx': False, 'use_ema': True, 'use_spike': False, 'rsi_required': False, 'edge_k': 0.18754063492175066, 'edge_cap': 0.5297542437077137, 'bull_strategy': 'breakout', 'bull_bb_std_mult': 0.8334256162134895, 'bull_rsi_os': 48, 'bull_rsi_ob': 89, 'bull_adx_thresh': 6.4924636864090655, 'bull_atr_min_pct': 0.012228476190831354, 'bull_atr_max_pct': 0.10866913041779386, 'bull_tp_mult': 1.2819272549018508, 'bull_tsl_mult': 0.14737449507730796, 'bull_time_stop': 99, 'bull_use_sma': True, 'bull_use_ema': False, 'bull_use_atr': False, 'bull_use_adx': True, 'bull_use_spike': False, 'bull_rsi_required': True, 'bear_strategy': 'breakout', 'bear_bb_std_mult': 3.471657416841513, 'bear_rsi_os': 6, 'bear_rsi_ob': 67, 'bear_adx_thresh': 16.614516860685985, 'bear_atr_min_pct': 0.006184798326690001, 'bear_atr_max_pct': 0.07150983701903472, 'bear_tp_mult': 2.009642254347099, 'bear_tsl_mult': 0.37509416937991347, 'bear_time_stop': 104, 'bear_use_sma': True, 'bear_use_ema': False, 'bear_use_atr': False, 'bear_use_adx': False, 'bear_use_spike': False, 'bear_rsi_required': True, 'sideways_strategy': 'breakout', 'sideways_bb_std_mult': 0.6867395122267352, 'sideways_rsi_os': 47, 'sideways_rsi_ob': 54, 'sideways_adx_thresh': 23.85954998468363, 'sideways_atr_min_pct': 0.00287307983642236, 'sideways_atr_max_pct': 0.10413694818041061, 'sideways_tp_mult': 1.505290358753979, 'sideways_tsl_mult': 0.9777514552581524, 'sideways_time_stop': 156, 'sideways_use_sma': False, 'sideways_use_ema': True, 'sideways_use_atr': True, 'sideways_use_adx': False, 'sideways_use_spike': True, 'sideways_rsi_required': True}.
[I 2025-09-01 05:26:26,762] Trial 484 finished with values: [-0.024431355682265732, 0.02457746043753587] and parameters: {'p_sma': 57, 'p_std': 29, 'p_atr': 7, 'p_adx': 17, 'rsi_period': 48, 'ema1': 24, 'ema2': 33, 'slip_atr_k': 0.02649368611962872, 'slip_spread_k': 0.4136888058151438, 'spread_hl_frac': 0.048385394287291265, 'bb_std_mult': 2.0269769323199047, 'rsi_os': 28, 'rsi_ob': 89, 'vol_spike': 0.1912841734161811, 'adx_thresh': 31.549708769619397, 'atr_min_pct': 0.004076713909885803, 'atr_max_pct': 0.12368258901115838, 'tp_mult': 1.6509401207540344, 'tsl_mult': 0.6602530600450944, 'strategy': 'breakout', 'time_stop': 186, 'use_sma': False, 'use_atr': True, 'use_adx': True, 'use_ema': False, 'use_spike': True, 'rsi_required': False, 'edge_k': 0.15870974502537177, 'edge_cap': 0.7047956905429384, 'bull_strategy': 'breakout', 'bull_bb_std_mult': 0.85229171480328, 'bull_rsi_os': 48, 'bull_rsi_ob': 90, 'bull_adx_thresh': 7.068666462252989, 'bull_atr_min_pct': 0.012519068222005032, 'bull_atr_max_pct': 0.10399030799247883, 'bull_tp_mult': 1.2360253612424168, 'bull_tsl_mult': 0.21618983113400214, 'bull_time_stop': 78, 'bull_use_sma': True, 'bull_use_ema': True, 'bull_use_atr': False, 'bull_use_adx': True, 'bull_use_spike': False, 'bull_rsi_required': True, 'bear_strategy': 'breakout', 'bear_bb_std_mult': 3.4906279169630956, 'bear_rsi_os': 9, 'bear_rsi_ob': 68, 'bear_adx_thresh': 29.155049834750518, 'bear_atr_min_pct': 0.008821611134387439, 'bear_atr_max_pct': 0.07056523459478131, 'bear_tp_mult': 2.5131162030237033, 'bear_tsl_mult': 0.36575772710402754, 'bear_time_stop': 62, 'bear_use_sma': True, 'bear_use_ema': False, 'bear_use_atr': False, 'bear_use_adx': False, 'bear_use_spike': False, 'bear_rsi_required': False, 'sideways_strategy': 'breakout', 'sideways_bb_std_mult': 2.8948864857435113, 'sideways_rsi_os': 46, 'sideways_rsi_ob': 54, 'sideways_adx_thresh': 21.787430825094273, 'sideways_atr_min_pct': 0.003982021222655727, 'sideways_atr_max_pct': 0.10483224337462226, 'sideways_tp_mult': 1.5353736301646987, 'sideways_tsl_mult': 0.018968658219760015, 'sideways_time_stop': 58, 'sideways_use_sma': False, 'sideways_use_ema': False, 'sideways_use_atr': True, 'sideways_use_adx': False, 'sideways_use_spike': True, 'sideways_rsi_required': True}.
[I 2025-09-01 05:26:27,236] Trial 485 finished with values: [-0.026708500246252487, 0.02665429458759126] and parameters: {'p_sma': 57, 'p_std': 30, 'p_atr': 8, 'p_adx': 17, 'rsi_period': 54, 'ema1': 24, 'ema2': 34, 'slip_atr_k': 0.20713365972125006, 'slip_spread_k': 0.4087127534905707, 'spread_hl_frac': 0.048696367017048166, 'bb_std_mult': 2.01313022355836, 'rsi_os': 28, 'rsi_ob': 51, 'vol_spike': 0.1906628553416974, 'adx_thresh': 33.62371269099476, 'atr_min_pct': 0.00408266366173613, 'atr_max_pct': 0.12035916118653697, 'tp_mult': 2.510170646980725, 'tsl_mult': 0.5853558864232792, 'strategy': 'breakout', 'time_stop': 169, 'use_sma': False, 'use_atr': True, 'use_adx': True, 'use_ema': False, 'use_spike': True, 'rsi_required': False, 'edge_k': 0.16557874440842638, 'edge_cap': 0.3252778843861066, 'bull_strategy': 'breakout', 'bull_bb_std_mult': 0.95287571026609, 'bull_rsi_os': 48, 'bull_rsi_ob': 89, 'bull_adx_thresh': 5.012366661656015, 'bull_atr_min_pct': 0.012539845477782297, 'bull_atr_max_pct': 0.09530780279815175, 'bull_tp_mult': 1.2022498390548741, 'bull_tsl_mult': 0.22372813469257594, 'bull_time_stop': 95, 'bull_use_sma': True, 'bull_use_ema': True, 'bull_use_atr': False, 'bull_use_adx': True, 'bull_use_spike': False, 'bull_rsi_required': True, 'bear_strategy': 'breakout', 'bear_bb_std_mult': 3.499262663957776, 'bear_rsi_os': 9, 'bear_rsi_ob': 76, 'bear_adx_thresh': 29.333720825731305, 'bear_atr_min_pct': 0.00607778361965073, 'bear_atr_max_pct': 0.06932046066572385, 'bear_tp_mult': 1.3356963382007154, 'bear_tsl_mult': 0.997604949010887, 'bear_time_stop': 67, 'bear_use_sma': True, 'bear_use_ema': False, 'bear_use_atr': False, 'bear_use_adx': False, 'bear_use_spike': False, 'bear_rsi_required': False, 'sideways_strategy': 'breakout', 'sideways_bb_std_mult': 2.892110567752944, 'sideways_rsi_os': 47, 'sideways_rsi_ob': 53, 'sideways_adx_thresh': 21.802903795611932, 'sideways_atr_min_pct': 0.00414890657541082, 'sideways_atr_max_pct': 0.061437315542910424, 'sideways_tp_mult': 1.5376726180842966, 'sideways_tsl_mult': 0.9996416242191996, 'sideways_time_stop': 291, 'sideways_use_sma': False, 'sideways_use_ema': False, 'sideways_use_atr': True, 'sideways_use_adx': False, 'sideways_use_spike': True, 'sideways_rsi_required': True}.
[I 2025-09-01 05:26:27,256] Trial 483 finished with values: [-0.02425696565568325, 0.0243942420407671] and parameters: {'p_sma': 60, 'p_std': 29, 'p_atr': 7, 'p_adx': 18, 'rsi_period': 49, 'ema1': 24, 'ema2': 33, 'slip_atr_k': 0.029759231352236695, 'slip_spread_k': 0.41855651356377827, 'spread_hl_frac': 0.04815272764520511, 'bb_std_mult': 1.9764097371472982, 'rsi_os': 25, 'rsi_ob': 67, 'vol_spike': 0.18953967849521547, 'adx_thresh': 31.63020240606861, 'atr_min_pct': 0.005473111185220243, 'atr_max_pct': 0.12041707473284002, 'tp_mult': 2.531525596494749, 'tsl_mult': 0.8685553866996081, 'strategy': 'breakout', 'time_stop': 184, 'use_sma': False, 'use_atr': True, 'use_adx': True, 'use_ema': True, 'use_spike': True, 'rsi_required': False, 'edge_k': 0.16010434315474517, 'edge_cap': 0.5002868972724867, 'bull_strategy': 'breakout', 'bull_bb_std_mult': 0.8271250497834691, 'bull_rsi_os': 48, 'bull_rsi_ob': 89, 'bull_adx_thresh': 6.694860726471614, 'bull_atr_min_pct': 0.012201418523043373, 'bull_atr_max_pct': 0.09573750155448113, 'bull_tp_mult': 1.320209746543756, 'bull_tsl_mult': 0.20713420000387425, 'bull_time_stop': 95, 'bull_use_sma': True, 'bull_use_ema': False, 'bull_use_atr': False, 'bull_use_adx': True, 'bull_use_spike': False, 'bull_rsi_required': True, 'bear_strategy': 'breakout', 'bear_bb_std_mult': 3.4991561865703322, 'bear_rsi_os': 6, 'bear_rsi_ob': 68, 'bear_adx_thresh': 18.22314881709052, 'bear_atr_min_pct': 0.006266183010281621, 'bear_atr_max_pct': 0.06999099700436703, 'bear_tp_mult': 1.3282046619255452, 'bear_tsl_mult': 0.0016346483380751953, 'bear_time_stop': 63, 'bear_use_sma': True, 'bear_use_ema': False, 'bear_use_atr': False, 'bear_use_adx': False, 'bear_use_spike': False, 'bear_rsi_required': False, 'sideways_strategy': 'breakout', 'sideways_bb_std_mult': 0.7304636635252859, 'sideways_rsi_os': 47, 'sideways_rsi_ob': 54, 'sideways_adx_thresh': 23.811782979529156, 'sideways_atr_min_pct': 0.0039579300289566315, 'sideways_atr_max_pct': 0.10453308192294529, 'sideways_tp_mult': 1.5451978285016053, 'sideways_tsl_mult': 0.3046977168894406, 'sideways_time_stop': 176, 'sideways_use_sma': False, 'sideways_use_ema': False, 'sideways_use_atr': True, 'sideways_use_adx': False, 'sideways_use_spike': True, 'sideways_rsi_required': True}.
