[I 2025-09-01 04:47:21,956] Trial 259 finished with values: [-1000000000.0, 1000000000.0] and parameters: {'p_sma': 18, 'p_std': 9, 'p_atr': 22, 'p_adx': 20, 'rsi_period': 56, 'ema1': 29, 'ema2': 27, 'slip_atr_k': 0.011554038391772785, 'slip_spread_k': 0.33027777935400104, 'spread_hl_frac': 0.042524056231656934, 'bb_std_mult': 2.188442126332448, 'rsi_os': 45, 'rsi_ob': 85, 'vol_spike': 0.2645674107118228, 'adx_thresh': 13.746515755915029, 'atr_min_pct': 0.024205681245226675, 'atr_max_pct': 0.08590530790756983, 'tp_mult': 1.1410661809888534, 'tsl_mult': 0.7707672032184851, 'strategy': 'mean_reversion', 'time_stop': 29, 'use_sma': False, 'use_atr': True, 'use_adx': False, 'use_ema': False, 'use_spike': False, 'rsi_required': False, 'edge_k': 0.3070795540531006, 'edge_cap': 0.18237453047144375, 'bull_strategy': 'breakout', 'bull_bb_std_mult': 0.7875871696090928, 'bull_rsi_os': 29, 'bull_rsi_ob': 76, 'bull_adx_thresh': 19.88330075842677, 'bull_atr_min_pct': 0.008325932184969385, 'bull_atr_max_pct': 0.14210983038006464, 'bull_tp_mult': 1.720067664167761, 'bull_tsl_mult': 0.08018876220875953, 'bull_time_stop': 224, 'bull_use_sma': True, 'bull_use_ema': False, 'bull_use_atr': False, 'bull_use_adx': True, 'bull_use_spike': False, 'bull_rsi_required': True, 'bear_strategy': 'breakout', 'bear_bb_std_mult': 2.14266609580814, 'bear_rsi_os': 46, 'bear_rsi_ob': 58, 'bear_adx_thresh': 12.847672784721846, 'bear_atr_min_pct': 0.015015117995348392, 'bear_atr_max_pct': 0.04763178419876444, 'bear_tp_mult': 1.0109178832755563, 'bear_tsl_mult': 0.19302063700278121, 'bear_time_stop': 76, 'bear_use_sma': True, 'bear_use_ema': True, 'bear_use_atr': True, 'bear_use_adx': True, 'bear_use_spike': False, 'bear_rsi_required': False, 'sideways_strategy': 'mean_reversion', 'sideways_bb_std_mult': 1.4539124274304425, 'sideways_rsi_os': 46, 'sideways_rsi_ob': 45, 'sideways_adx_thresh': 18.225902948017715, 'sideways_atr_min_pct': 0.023867372740252246, 'sideways_atr_max_pct': 0.08170244704535375, 'sideways_tp_mult': 2.725009110076298, 'sideways_tsl_mult': 0.467808549662578, 'sideways_time_stop': 191, 'sideways_use_sma': True, 'sideways_use_ema': False, 'sideways_use_atr': True, 'sideways_use_adx': False, 'sideways_use_spike': True, 'sideways_rsi_required': True}.
[I 2025-09-01 04:47:22,826] Trial 262 finished with values: [-0.017921731068442415, 0.01776864123279129] and parameters: {'p_sma': 52, 'p_std': 46, 'p_atr': 30, 'p_adx': 18, 'rsi_period': 56, 'ema1': 29, 'ema2': 45, 'slip_atr_k': 0.06508517175144099, 'slip_spread_k': 0.28899891085312945, 'spread_hl_frac': 0.028866073748868258, 'bb_std_mult': 0.7545575264606839, 'rsi_os': 31, 'rsi_ob': 74, 'vol_spike': 0.2380233649468368, 'adx_thresh': 12.725176691420305, 'atr_min_pct': 0.02131220687203985, 'atr_max_pct': 0.04450182699961904, 'tp_mult': 1.9077082849177889, 'tsl_mult': 0.9206530377355129, 'strategy': 'breakout', 'time_stop': 289, 'use_sma': True, 'use_atr': True, 'use_adx': False, 'use_ema': True, 'use_spike': True, 'rsi_required': False, 'edge_k': 0.6059878183179848, 'edge_cap': 0.16826676532233073, 'bull_strategy': 'mean_reversion', 'bull_bb_std_mult': 0.5057465603704694, 'bull_rsi_os': 34, 'bull_rsi_ob': 52, 'bull_adx_thresh': 31.185952618683295, 'bull_atr_min_pct': 0.0018204892539419688, 'bull_atr_max_pct': 0.0743739902635827, 'bull_tp_mult': 1.4173896544539542, 'bull_tsl_mult': 0.08509461089765807, 'bull_time_stop': 269, 'bull_use_sma': True, 'bull_use_ema': False, 'bull_use_atr': True, 'bull_use_adx': True, 'bull_use_spike': False, 'bull_rsi_required': False, 'bear_strategy': 'breakout', 'bear_bb_std_mult': 1.0854760855734131, 'bear_rsi_os': 43, 'bear_rsi_ob': 85, 'bear_adx_thresh': 11.93579278547679, 'bear_atr_min_pct': 0.029335248682001092, 'bear_atr_max_pct': 0.07084317034936038, 'bear_tp_mult': 2.347104319759429, 'bear_tsl_mult': 0.11032019153245405, 'bear_time_stop': 205, 'bear_use_sma': True, 'bear_use_ema': False, 'bear_use_atr': True, 'bear_use_adx': True, 'bear_use_spike': False, 'bear_rsi_required': False, 'sideways_strategy': 'mean_reversion', 'sideways_bb_std_mult': 1.5845623006333116, 'sideways_rsi_os': 45, 'sideways_rsi_ob': 95, 'sideways_adx_thresh': 12.392526854937126, 'sideways_atr_min_pct': 0.022327637511343056, 'sideways_atr_max_pct': 0.06567407767566324, 'sideways_tp_mult': 2.858066204959593, 'sideways_tsl_mult': 0.25841685487440386, 'sideways_time_stop': 281, 'sideways_use_sma': True, 'sideways_use_ema': True, 'sideways_use_atr': True, 'sideways_use_adx': False, 'sideways_use_spike': False, 'sideways_rsi_required': False}.
[I 2025-09-01 04:47:23,424] Trial 263 finished with values: [-0.0466249455706238, 0.04644380601944775] and parameters: {'p_sma': 52, 'p_std': 39, 'p_atr': 10, 'p_adx': 18, 'rsi_period': 63, 'ema1': 25, 'ema2': 27, 'slip_atr_k': 0.1277467115593684, 'slip_spread_k': 0.2916728306096214, 'spread_hl_frac': 0.042150901398516336, 'bb_std_mult': 3.5370495205065575, 'rsi_os': 48, 'rsi_ob': 74, 'vol_spike': 0.20757753498470574, 'adx_thresh': 13.560071282490703, 'atr_min_pct': 0.0209924171374776, 'atr_max_pct': 0.12274587550659533, 'tp_mult': 1.158632381825507, 'tsl_mult': 0.9106887795929373, 'strategy': 'breakout', 'time_stop': 37, 'use_sma': True, 'use_atr': False, 'use_adx': False, 'use_ema': True, 'use_spike': True, 'rsi_required': False, 'edge_k': 0.8917126702241461, 'edge_cap': 0.16965733072825828, 'bull_strategy': 'mean_reversion', 'bull_bb_std_mult': 2.152338665490942, 'bull_rsi_os': 32, 'bull_rsi_ob': 90, 'bull_adx_thresh': 19.290033741888863, 'bull_atr_min_pct': 0.0016915146500244567, 'bull_atr_max_pct': 0.13688658250333854, 'bull_tp_mult': 1.012176792103906, 'bull_tsl_mult': 0.4147790250771517, 'bull_time_stop': 76, 'bull_use_sma': True, 'bull_use_ema': False, 'bull_use_atr': True, 'bull_use_adx': False, 'bull_use_spike': False, 'bull_rsi_required': False, 'bear_strategy': 'mean_reversion', 'bear_bb_std_mult': 1.2603315555182804, 'bear_rsi_os': 12, 'bear_rsi_ob': 76, 'bear_adx_thresh': 15.016162999684415, 'bear_atr_min_pct': 0.02842983415643825, 'bear_atr_max_pct': 0.03832415034533788, 'bear_tp_mult': 2.352168809092765, 'bear_tsl_mult': 0.2610208439470746, 'bear_time_stop': 193, 'bear_use_sma': True, 'bear_use_ema': False, 'bear_use_atr': True, 'bear_use_adx': True, 'bear_use_spike': False, 'bear_rsi_required': False, 'sideways_strategy': 'mean_reversion', 'sideways_bb_std_mult': 2.2884574730905114, 'sideways_rsi_os': 37, 'sideways_rsi_ob': 94, 'sideways_adx_thresh': 7.502142416692557, 'sideways_atr_min_pct': 0.022239107827378833, 'sideways_atr_max_pct': 0.08699773882744863, 'sideways_tp_mult': 2.8774580889678236, 'sideways_tsl_mult': 0.46102526958772744, 'sideways_time_stop': 247, 'sideways_use_sma': True, 'sideways_use_ema': True, 'sideways_use_atr': False, 'sideways_use_adx': False, 'sideways_use_spike': False, 'sideways_rsi_required': False}.
[I 2025-09-01 04:48:02,791] Trial 265 finished with values: [-1000000000.0, 1000000000.0] and parameters: {'p_sma': 8, 'p_std': 14, 'p_atr': 24, 'p_adx': 18, 'rsi_period': 65, 'ema1': 30, 'ema2': 27, 'slip_atr_k': 0.1296285277509127, 'slip_spread_k': 0.08110055455562892, 'spread_hl_frac': 0.03969232478928073, 'bb_std_mult': 0.7390043279869964, 'rsi_os': 17, 'rsi_ob': 74, 'vol_spike': 0.24367265452666634, 'adx_thresh': 23.918884140229704, 'atr_min_pct': 0.00858641426946544, 'atr_max_pct': 0.12210977219932144, 'tp_mult': 2.5803898141676425, 'tsl_mult': 0.7233012205632465, 'strategy': 'breakout', 'time_stop': 219, 'use_sma': True, 'use_atr': False, 'use_adx': False, 'use_ema': True, 'use_spike': True, 'rsi_required': False, 'edge_k': 0.5980039719710054, 'edge_cap': 0.13339177049273312, 'bull_strategy': 'mean_reversion', 'bull_bb_std_mult': 1.4286120284044088, 'bull_rsi_os': 32, 'bull_rsi_ob': 57, 'bull_adx_thresh': 7.878316752260098, 'bull_atr_min_pct': 0.0012410226341440318, 'bull_atr_max_pct': 0.01351334962797894, 'bull_tp_mult': 1.2707156423620325, 'bull_tsl_mult': 0.4156801735930097, 'bull_time_stop': 289, 'bull_use_sma': True, 'bull_use_ema': True, 'bull_use_atr': True, 'bull_use_adx': False, 'bull_use_spike': False, 'bull_rsi_required': False, 'bear_strategy': 'mean_reversion', 'bear_bb_std_mult': 2.2797262243212066, 'bear_rsi_os': 50, 'bear_rsi_ob': 60, 'bear_adx_thresh': 32.55294438210346, 'bear_atr_min_pct': 0.029986631577762515, 'bear_atr_max_pct': 0.14400873411159146, 'bear_tp_mult': 2.3671748471309795, 'bear_tsl_mult': 0.15112394160491274, 'bear_time_stop': 241, 'bear_use_sma': True, 'bear_use_ema': False, 'bear_use_atr': True, 'bear_use_adx': True, 'bear_use_spike': False, 'bear_rsi_required': False, 'sideways_strategy': 'mean_reversion', 'sideways_bb_std_mult': 3.46458835928164, 'sideways_rsi_os': 36, 'sideways_rsi_ob': 49, 'sideways_adx_thresh': 32.37264009485166, 'sideways_atr_min_pct': 0.02229567022947612, 'sideways_atr_max_pct': 0.08817814018858729, 'sideways_tp_mult': 2.187999088595626, 'sideways_tsl_mult': 0.9340594190609539, 'sideways_time_stop': 252, 'sideways_use_sma': True, 'sideways_use_ema': True, 'sideways_use_atr': False, 'sideways_use_adx': False, 'sideways_use_spike': False, 'sideways_rsi_required': False}.
[I 2025-09-01 04:48:03,345] Trial 267 finished with values: [-1000000000.0, 1000000000.0] and parameters: {'p_sma': 59, 'p_std': 14, 'p_atr': 26, 'p_adx': 18, 'rsi_period': 67, 'ema1': 30, 'ema2': 14, 'slip_atr_k': 0.004393117233397278, 'slip_spread_k': 0.9972208899428182, 'spread_hl_frac': 0.046314308852918595, 'bb_std_mult': 0.7533555826550256, 'rsi_os': 10, 'rsi_ob': 56, 'vol_spike': 0.14990670975625153, 'adx_thresh': 24.194657356218112, 'atr_min_pct': 0.0026703738000114705, 'atr_max_pct': 0.11316056909561652, 'tp_mult': 2.608114431895402, 'tsl_mult': 0.40632912997983506, 'strategy': 'breakout', 'time_stop': 14, 'use_sma': True, 'use_atr': False, 'use_adx': True, 'use_ema': True, 'use_spike': True, 'rsi_required': False, 'edge_k': 0.5887016518306137, 'edge_cap': 0.8705508792559388, 'bull_strategy': 'mean_reversion', 'bull_bb_std_mult': 2.4818077992014684, 'bull_rsi_os': 43, 'bull_rsi_ob': 72, 'bull_adx_thresh': 25.299744611704174, 'bull_atr_min_pct': 0.003251479658381052, 'bull_atr_max_pct': 0.06718826631383226, 'bull_tp_mult': 1.2900701872776827, 'bull_tsl_mult': 0.2066469395888625, 'bull_time_stop': 127, 'bull_use_sma': True, 'bull_use_ema': True, 'bull_use_atr': True, 'bull_use_adx': False, 'bull_use_spike': True, 'bull_rsi_required': False, 'bear_strategy': 'mean_reversion', 'bear_bb_std_mult': 2.011046460194065, 'bear_rsi_os': 43, 'bear_rsi_ob': 56, 'bear_adx_thresh': 14.235025281814771, 'bear_atr_min_pct': 0.012263474819031913, 'bear_atr_max_pct': 0.1440446549999757, 'bear_tp_mult': 2.418099458298975, 'bear_tsl_mult': 0.6513374797451928, 'bear_time_stop': 244, 'bear_use_sma': True, 'bear_use_ema': False, 'bear_use_atr': True, 'bear_use_adx': True, 'bear_use_spike': True, 'bear_rsi_required': False, 'sideways_strategy': 'mean_reversion', 'sideways_bb_std_mult': 1.590895590933905, 'sideways_rsi_os': 24, 'sideways_rsi_ob': 72, 'sideways_adx_thresh': 27.556235956793387, 'sideways_atr_min_pct': 0.014078371759327517, 'sideways_atr_max_pct': 0.06536083439573458, 'sideways_tp_mult': 2.8463270279543544, 'sideways_tsl_mult': 0.25960952604470844, 'sideways_time_stop': 281, 'sideways_use_sma': True, 'sideways_use_ema': True, 'sideways_use_atr': False, 'sideways_use_adx': False, 'sideways_use_spike': False, 'sideways_rsi_required': False}.
[I 2025-09-01 04:48:03,738] Trial 264 finished with values: [-1000000000.0, 1000000000.0] and parameters: {'p_sma': 18, 'p_std': 54, 'p_atr': 26, 'p_adx': 15, 'rsi_period': 20, 'ema1': 30, 'ema2': 27, 'slip_atr_k': 0.006066155895674999, 'slip_spread_k': 0.35740716693558083, 'spread_hl_frac': 0.007441488750694808, 'bb_std_mult': 1.134396065866547, 'rsi_os': 48, 'rsi_ob': 74, 'vol_spike': 0.14745290012016224, 'adx_thresh': 13.790186553057364, 'atr_min_pct': 0.02108329809618893, 'atr_max_pct': 0.043702913667642646, 'tp_mult': 1.7074940129491563, 'tsl_mult': 0.7216977219484642, 'strategy': 'breakout', 'time_stop': 289, 'use_sma': True, 'use_atr': False, 'use_adx': False, 'use_ema': True, 'use_spike': True, 'rsi_required': False, 'edge_k': 0.6139770541627623, 'edge_cap': 0.13397298833023547, 'bull_strategy': 'mean_reversion', 'bull_bb_std_mult': 1.8902912349172378, 'bull_rsi_os': 32, 'bull_rsi_ob': 90, 'bull_adx_thresh': 19.242655776857028, 'bull_atr_min_pct': 0.02906193313508753, 'bull_atr_max_pct': 0.12510963194571642, 'bull_tp_mult': 2.3501100021561943, 'bull_tsl_mult': 0.9745083874590095, 'bull_time_stop': 203, 'bull_use_sma': True, 'bull_use_ema': False, 'bull_use_atr': True, 'bull_use_adx': False, 'bull_use_spike': False, 'bull_rsi_required': False, 'bear_strategy': 'mean_reversion', 'bear_bb_std_mult': 1.269411298900253, 'bear_rsi_os': 43, 'bear_rsi_ob': 59, 'bear_adx_thresh': 13.198843996621662, 'bear_atr_min_pct': 0.015285955394098058, 'bear_atr_max_pct': 0.14414561036493242, 'bear_tp_mult': 2.355707495933795, 'bear_tsl_mult': 0.14440192481645153, 'bear_time_stop': 194, 'bear_use_sma': True, 'bear_use_ema': False, 'bear_use_atr': True, 'bear_use_adx': True, 'bear_use_spike': False, 'bear_rsi_required': False, 'sideways_strategy': 'mean_reversion', 'sideways_bb_std_mult': 3.5346824400801253, 'sideways_rsi_os': 45, 'sideways_rsi_ob': 82, 'sideways_adx_thresh': 27.768519724954817, 'sideways_atr_min_pct': 0.005987344948598962, 'sideways_atr_max_pct': 0.06637196277973878, 'sideways_tp_mult': 2.5327334018363596, 'sideways_tsl_mult': 0.4643169505474681, 'sideways_time_stop': 192, 'sideways_use_sma': True, 'sideways_use_ema': True, 'sideways_use_atr': False, 'sideways_use_adx': False, 'sideways_use_spike': False, 'sideways_rsi_required': False}.
[I 2025-09-01 04:48:04,126] Trial 266 finished with values: [-1000000000.0, 1000000000.0] and parameters: {'p_sma': 20, 'p_std': 39, 'p_atr': 8, 'p_adx': 18, 'rsi_period': 52, 'ema1': 30, 'ema2': 14, 'slip_atr_k': 0.13053917264279918, 'slip_spread_k': 0.05744447868256514, 'spread_hl_frac': 0.016270095931980394, 'bb_std_mult': 0.8724014698280932, 'rsi_os': 10, 'rsi_ob': 74, 'vol_spike': 0.24432714942948802, 'adx_thresh': 19.848447257807567, 'atr_min_pct': 0.002630309172754459, 'atr_max_pct': 0.1241771316217043, 'tp_mult': 2.467120187624778, 'tsl_mult': 0.9623075986479015, 'strategy': 'breakout', 'time_stop': 220, 'use_sma': True, 'use_atr': False, 'use_adx': False, 'use_ema': True, 'use_spike': True, 'rsi_required': False, 'edge_k': 1.6165499430410015, 'edge_cap': 0.932523678248234, 'bull_strategy': 'mean_reversion', 'bull_bb_std_mult': 1.3210845765328334, 'bull_rsi_os': 32, 'bull_rsi_ob': 57, 'bull_adx_thresh': 19.321480850246076, 'bull_atr_min_pct': 0.0013330671484425877, 'bull_atr_max_pct': 0.12588900238659706, 'bull_tp_mult': 2.90135548144188, 'bull_tsl_mult': 0.40777801592739327, 'bull_time_stop': 201, 'bull_use_sma': True, 'bull_use_ema': True, 'bull_use_atr': True, 'bull_use_adx': False, 'bull_use_spike': False, 'bull_rsi_required': False, 'bear_strategy': 'mean_reversion', 'bear_bb_std_mult': 1.251911270015965, 'bear_rsi_os': 43, 'bear_rsi_ob': 88, 'bear_adx_thresh': 14.588036182817884, 'bear_atr_min_pct': 0.02997095217196012, 'bear_atr_max_pct': 0.10968667835830591, 'bear_tp_mult': 2.5187289634168275, 'bear_tsl_mult': 0.14918644790917718, 'bear_time_stop': 204, 'bear_use_sma': True, 'bear_use_ema': False, 'bear_use_atr': True, 'bear_use_adx': True, 'bear_use_spike': False, 'bear_rsi_required': False, 'sideways_strategy': 'mean_reversion', 'sideways_bb_std_mult': 1.5947354200933703, 'sideways_rsi_os': 52, 'sideways_rsi_ob': 49, 'sideways_adx_thresh': 12.15309667572948, 'sideways_atr_min_pct': 0.02781331868712751, 'sideways_atr_max_pct': 0.08769326414347887, 'sideways_tp_mult': 2.855281097781636, 'sideways_tsl_mult': 0.09586099030105089, 'sideways_time_stop': 284, 'sideways_use_sma': True, 'sideways_use_ema': True, 'sideways_use_atr': False, 'sideways_use_adx': False, 'sideways_use_spike': False, 'sideways_rsi_required': False}.
[I 2025-09-01 04:48:49,012] Trial 270 finished with values: [-1000000000.0, 1000000000.0] and parameters: {'p_sma': 23, 'p_std': 36, 'p_atr': 13, 'p_adx': 19, 'rsi_period': 51, 'ema1': 15, 'ema2': 45, 'slip_atr_k': 0.21217932026753542, 'slip_spread_k': 0.3051987463753755, 'spread_hl_frac': 0.01604020523042468, 'bb_std_mult': 3.094314803341187, 'rsi_os': 47, 'rsi_ob': 71, 'vol_spike': 0.13203918284304, 'adx_thresh': 29.862728486115564, 'atr_min_pct': 5.862328415448732e-06, 'atr_max_pct': 0.06387561032688835, 'tp_mult': 2.4637489626353366, 'tsl_mult': 0.9751902222284213, 'strategy': 'breakout', 'time_stop': 300, 'use_sma': True, 'use_atr': False, 'use_adx': False, 'use_ema': False, 'use_spike': True, 'rsi_required': True, 'edge_k': 1.6103049316913096, 'edge_cap': 0.6795977157374907, 'bull_strategy': 'mean_reversion', 'bull_bb_std_mult': 2.4027548488038715, 'bull_rsi_os': 24, 'bull_rsi_ob': 93, 'bull_adx_thresh': 18.546616029934523, 'bull_atr_min_pct': 0.02444382852937331, 'bull_atr_max_pct': 0.11208695565398913, 'bull_tp_mult': 1.9708411155775054, 'bull_tsl_mult': 0.3868656124500799, 'bull_time_stop': 198, 'bull_use_sma': False, 'bull_use_ema': False, 'bull_use_atr': True, 'bull_use_adx': True, 'bull_use_spike': False, 'bull_rsi_required': False, 'bear_strategy': 'breakout', 'bear_bb_std_mult': 2.9619194542072, 'bear_rsi_os': 48, 'bear_rsi_ob': 58, 'bear_adx_thresh': 13.306368210222143, 'bear_atr_min_pct': 0.029475038552272143, 'bear_atr_max_pct': 0.1404561397056896, 'bear_tp_mult': 1.0507060622138467, 'bear_tsl_mult': 0.11513770774917939, 'bear_time_stop': 5, 'bear_use_sma': False, 'bear_use_ema': False, 'bear_use_atr': False, 'bear_use_adx': False, 'bear_use_spike': False, 'bear_rsi_required': True, 'sideways_strategy': 'mean_reversion', 'sideways_bb_std_mult': 1.5497536321938084, 'sideways_rsi_os': 9, 'sideways_rsi_ob': 76, 'sideways_adx_thresh': 6.698285299568113, 'sideways_atr_min_pct': 0.023436475941858402, 'sideways_atr_max_pct': 0.10158239645036295, 'sideways_tp_mult': 2.7754206016406213, 'sideways_tsl_mult': 0.9635888471838835, 'sideways_time_stop': 47, 'sideways_use_sma': True, 'sideways_use_ema': False, 'sideways_use_atr': True, 'sideways_use_adx': True, 'sideways_use_spike': False, 'sideways_rsi_required': True}.
[I 2025-09-01 04:48:49,683] Trial 271 finished with values: [-1000000000.0, 1000000000.0] and parameters: {'p_sma': 14, 'p_std': 43, 'p_atr': 14, 'p_adx': 19, 'rsi_period': 63, 'ema1': 29, 'ema2': 30, 'slip_atr_k': 0.21183432933637658, 'slip_spread_k': 0.30387320352538344, 'spread_hl_frac': 0.04418129946887988, 'bb_std_mult': 2.9450791672960888, 'rsi_os': 24, 'rsi_ob': 72, 'vol_spike': 0.2530300720491858, 'adx_thresh': 34.23484168981232, 'atr_min_pct': 0.019645728887302323, 'atr_max_pct': 0.06436643136657488, 'tp_mult': 1.3994297686703288, 'tsl_mult': 0.8718203509413689, 'strategy': 'breakout', 'time_stop': 20, 'use_sma': True, 'use_atr': False, 'use_adx': True, 'use_ema': False, 'use_spike': True, 'rsi_required': True, 'edge_k': 1.1131618558194472, 'edge_cap': 0.5682078575097896, 'bull_strategy': 'mean_reversion', 'bull_bb_std_mult': 2.4152640038727715, 'bull_rsi_os': 46, 'bull_rsi_ob': 60, 'bull_adx_thresh': 18.37252185932239, 'bull_atr_min_pct': 2.6767898598578275e-05, 'bull_atr_max_pct': 0.07462361771392169, 'bull_tp_mult': 1.6733392772925337, 'bull_tsl_mult': 0.37656500503590984, 'bull_time_stop': 167, 'bull_use_sma': False, 'bull_use_ema': False, 'bull_use_atr': True, 'bull_use_adx': True, 'bull_use_spike': True, 'bull_rsi_required': False, 'bear_strategy': 'breakout', 'bear_bb_std_mult': 1.1421976711022357, 'bear_rsi_os': 25, 'bear_rsi_ob': 58, 'bear_adx_thresh': 34.054041544788305, 'bear_atr_min_pct': 0.005195985077007748, 'bear_atr_max_pct': 0.0712835938106593, 'bear_tp_mult': 2.9978147666476787, 'bear_tsl_mult': 0.1202815115162077, 'bear_time_stop': 211, 'bear_use_sma': False, 'bear_use_ema': True, 'bear_use_atr': False, 'bear_use_adx': False, 'bear_use_spike': True, 'bear_rsi_required': True, 'sideways_strategy': 'mean_reversion', 'sideways_bb_std_mult': 1.7653148982911786, 'sideways_rsi_os': 9, 'sideways_rsi_ob': 69, 'sideways_adx_thresh': 15.855013295106948, 'sideways_atr_min_pct': 0.020804940187788754, 'sideways_atr_max_pct': 0.07656755039315455, 'sideways_tp_mult': 2.1221171761596342, 'sideways_tsl_mult': 0.5715810077796445, 'sideways_time_stop': 163, 'sideways_use_sma': False, 'sideways_use_ema': False, 'sideways_use_atr': True, 'sideways_use_adx': True, 'sideways_use_spike': False, 'sideways_rsi_required': True}.
