[I 2025-09-01 04:16:08,827] Trial 81 finished with values: [-1000000000.0, 1000000000.0] and parameters: {'p_sma': 43, 'p_std': 43, 'p_atr': 17, 'p_adx': 20, 'rsi_period': 21, 'ema1': 23, 'ema2': 28, 'slip_atr_k': 0.19143504218294266, 'slip_spread_k': 0.9598281986603758, 'spread_hl_frac': 0.0032361213536235937, 'bb_std_mult': 2.9281060289747485, 'rsi_os': 40, 'rsi_ob': 94, 'vol_spike': 0.2880288845992235, 'adx_thresh': 5.641628786308138, 'atr_min_pct': 0.012285564858908212, 'atr_max_pct': 0.08321834493277297, 'tp_mult': 1.789802702862121, 'tsl_mult': 0.3828010305178542, 'strategy': 'breakout', 'time_stop': 115, 'use_sma': False, 'use_atr': False, 'use_adx': True, 'use_ema': False, 'use_spike': True, 'rsi_required': True, 'edge_k': 0.5225161607688339, 'edge_cap': 0.09435043161806161, 'bull_strategy': 'mean_reversion', 'bull_bb_std_mult': 1.1761413197449908, 'bull_rsi_os': 43, 'bull_rsi_ob': 74, 'bull_adx_thresh': 14.853553795371713, 'bull_atr_min_pct': 0.01748504025311799, 'bull_atr_max_pct': 0.07766624297534154, 'bull_tp_mult': 2.347531461931176, 'bull_tsl_mult': 0.6481197892163185, 'bull_time_stop': 286, 'bull_use_sma': False, 'bull_use_ema': False, 'bull_use_atr': True, 'bull_use_adx': True, 'bull_use_spike': False, 'bull_rsi_required': False, 'bear_strategy': 'breakout', 'bear_bb_std_mult': 3.246260696364993, 'bear_rsi_os': 14, 'bear_rsi_ob': 94, 'bear_adx_thresh': 27.581318654955215, 'bear_atr_min_pct': 0.023390535684476542, 'bear_atr_max_pct': 0.11761162016766402, 'bear_tp_mult': 1.7345168289871153, 'bear_tsl_mult': 0.43673227784402846, 'bear_time_stop': 171, 'bear_use_sma': True, 'bear_use_ema': False, 'bear_use_atr': False, 'bear_use_adx': True, 'bear_use_spike': True, 'bear_rsi_required': False, 'sideways_strategy': 'mean_reversion', 'sideways_bb_std_mult': 1.0662334926110062, 'sideways_rsi_os': 13, 'sideways_rsi_ob': 58, 'sideways_adx_thresh': 16.88063445912593, 'sideways_atr_min_pct': 0.01040679696156933, 'sideways_atr_max_pct': 0.11911923284950938, 'sideways_tp_mult': 1.4516948997063068, 'sideways_tsl_mult': 0.5227675199636572, 'sideways_time_stop': 66, 'sideways_use_sma': True, 'sideways_use_ema': True, 'sideways_use_atr': True, 'sideways_use_adx': True, 'sideways_use_spike': False, 'sideways_rsi_required': True}.
[I 2025-09-01 04:16:52,171] Trial 85 finished with values: [-1000000000.0, 1000000000.0] and parameters: {'p_sma': 39, 'p_std': 39, 'p_atr': 25, 'p_adx': 11, 'rsi_period': 25, 'ema1': 21, 'ema2': 41, 'slip_atr_k': 0.011569804906061396, 'slip_spread_k': 0.756561194183285, 'spread_hl_frac': 0.014465080962794278, 'bb_std_mult': 2.198294620678976, 'rsi_os': 45, 'rsi_ob': 90, 'vol_spike': 0.19347805621500896, 'adx_thresh': 26.546998567635015, 'atr_min_pct': 0.018236394750387144, 'atr_max_pct': 0.03310564988305442, 'tp_mult': 1.4672808825800965, 'tsl_mult': 0.5154184386633954, 'strategy': 'breakout', 'time_stop': 134, 'use_sma': False, 'use_atr': False, 'use_adx': True, 'use_ema': False, 'use_spike': True, 'rsi_required': True, 'edge_k': 0.7814533375881054, 'edge_cap': 0.057797052523222425, 'bull_strategy': 'mean_reversion', 'bull_bb_std_mult': 1.9458088820812152, 'bull_rsi_os': 23, 'bull_rsi_ob': 61, 'bull_adx_thresh': 32.99467106516621, 'bull_atr_min_pct': 0.02319085186818915, 'bull_atr_max_pct': 0.12543502890803135, 'bull_tp_mult': 2.051015534549358, 'bull_tsl_mult': 0.7078315498048816, 'bull_time_stop': 205, 'bull_use_sma': False, 'bull_use_ema': False, 'bull_use_atr': True, 'bull_use_adx': True, 'bull_use_spike': True, 'bull_rsi_required': False, 'bear_strategy': 'breakout', 'bear_bb_std_mult': 1.2759768314922106, 'bear_rsi_os': 17, 'bear_rsi_ob': 88, 'bear_adx_thresh': 25.336916828937788, 'bear_atr_min_pct': 0.02575428030363876, 'bear_atr_max_pct': 0.08952521870950476, 'bear_tp_mult': 1.9038891637694253, 'bear_tsl_mult': 0.3732640083448623, 'bear_time_stop': 68, 'bear_use_sma': False, 'bear_use_ema': False, 'bear_use_atr': False, 'bear_use_adx': True, 'bear_use_spike': False, 'bear_rsi_required': False, 'sideways_strategy': 'mean_reversion', 'sideways_bb_std_mult': 1.8328200423998116, 'sideways_rsi_os': 40, 'sideways_rsi_ob': 57, 'sideways_adx_thresh': 12.83791632130901, 'sideways_atr_min_pct': 0.0041376179018474055, 'sideways_atr_max_pct': 0.13607070143172836, 'sideways_tp_mult': 1.2822167567015152, 'sideways_tsl_mult': 0.9306329991418252, 'sideways_time_stop': 296, 'sideways_use_sma': True, 'sideways_use_ema': False, 'sideways_use_atr': True, 'sideways_use_adx': True, 'sideways_use_spike': False, 'sideways_rsi_required': True}.
[I 2025-09-01 04:16:52,570] Trial 83 finished with values: [-1000000000.0, 1000000000.0] and parameters: {'p_sma': 46, 'p_std': 32, 'p_atr': 25, 'p_adx': 18, 'rsi_period': 47, 'ema1': 17, 'ema2': 16, 'slip_atr_k': 0.006804770652851941, 'slip_spread_k': 0.9716309068340363, 'spread_hl_frac': 0.022477273410459946, 'bb_std_mult': 0.9795904293511869, 'rsi_os': 29, 'rsi_ob': 94, 'vol_spike': 0.28713936214136926, 'adx_thresh': 15.752100995687474, 'atr_min_pct': 0.018092198186232, 'atr_max_pct': 0.04197744341197719, 'tp_mult': 1.822233958371492, 'tsl_mult': 0.33987521321318537, 'strategy': 'breakout', 'time_stop': 94, 'use_sma': False, 'use_atr': False, 'use_adx': True, 'use_ema': False, 'use_spike': True, 'rsi_required': True, 'edge_k': 0.7962530434411051, 'edge_cap': 0.3598409271165086, 'bull_strategy': 'mean_reversion', 'bull_bb_std_mult': 1.3381674734257645, 'bull_rsi_os': 44, 'bull_rsi_ob': 87, 'bull_adx_thresh': 9.652640975949009, 'bull_atr_min_pct': 0.016890970098603696, 'bull_atr_max_pct': 0.026468669582448034, 'bull_tp_mult': 2.016792795350179, 'bull_tsl_mult': 0.7093882200229051, 'bull_time_stop': 265, 'bull_use_sma': False, 'bull_use_ema': False, 'bull_use_atr': True, 'bull_use_adx': True, 'bull_use_spike': True, 'bull_rsi_required': False, 'bear_strategy': 'breakout', 'bear_bb_std_mult': 1.2661220906189024, 'bear_rsi_os': 14, 'bear_rsi_ob': 87, 'bear_adx_thresh': 27.423570415667257, 'bear_atr_min_pct': 0.00440165942445696, 'bear_atr_max_pct': 0.09047238202473362, 'bear_tp_mult': 1.920089586271137, 'bear_tsl_mult': 0.2170282309686043, 'bear_time_stop': 220, 'bear_use_sma': True, 'bear_use_ema': False, 'bear_use_atr': False, 'bear_use_adx': True, 'bear_use_spike': False, 'bear_rsi_required': False, 'sideways_strategy': 'mean_reversion', 'sideways_bb_std_mult': 1.9322446818262342, 'sideways_rsi_os': 33, 'sideways_rsi_ob': 83, 'sideways_adx_thresh': 22.737418532608395, 'sideways_atr_min_pct': 0.00403581538969156, 'sideways_atr_max_pct': 0.13578283625379123, 'sideways_tp_mult': 1.3199340200717586, 'sideways_tsl_mult': 0.9353559984357654, 'sideways_time_stop': 279, 'sideways_use_sma': True, 'sideways_use_ema': False, 'sideways_use_atr': True, 'sideways_use_adx': True, 'sideways_use_spike': False, 'sideways_rsi_required': True}.
[I 2025-09-01 04:16:52,758] Trial 82 finished with values: [-1000000000.0, 1000000000.0] and parameters: {'p_sma': 31, 'p_std': 43, 'p_atr': 17, 'p_adx': 9, 'rsi_period': 34, 'ema1': 5, 'ema2': 46, 'slip_atr_k': 0.20104147183608315, 'slip_spread_k': 0.9670328862805181, 'spread_hl_frac': 0.026594357339173907, 'bb_std_mult': 2.921999191142044, 'rsi_os': 40, 'rsi_ob': 94, 'vol_spike': 0.2852554856238041, 'adx_thresh': 25.815443149175234, 'atr_min_pct': 0.01258799072022286, 'atr_max_pct': 0.014258337712722037, 'tp_mult': 1.8083866387994942, 'tsl_mult': 0.3909092153802209, 'strategy': 'breakout', 'time_stop': 148, 'use_sma': False, 'use_atr': False, 'use_adx': True, 'use_ema': False, 'use_spike': False, 'rsi_required': True, 'edge_k': 1.248890171465349, 'edge_cap': 0.06792502155108887, 'bull_strategy': 'mean_reversion', 'bull_bb_std_mult': 1.1751558721961932, 'bull_rsi_os': 23, 'bull_rsi_ob': 77, 'bull_adx_thresh': 9.57087334780879, 'bull_atr_min_pct': 0.017614901968073828, 'bull_atr_max_pct': 0.11318361041489569, 'bull_tp_mult': 1.7443126031482323, 'bull_tsl_mult': 0.7131159339598251, 'bull_time_stop': 269, 'bull_use_sma': False, 'bull_use_ema': False, 'bull_use_atr': True, 'bull_use_adx': True, 'bull_use_spike': False, 'bull_rsi_required': False, 'bear_strategy': 'breakout', 'bear_bb_std_mult': 3.2479279150321245, 'bear_rsi_os': 14, 'bear_rsi_ob': 85, 'bear_adx_thresh': 10.687452736417155, 'bear_atr_min_pct': 0.023636109120571784, 'bear_atr_max_pct': 0.0888462906470649, 'bear_tp_mult': 1.7157704956260222, 'bear_tsl_mult': 0.22252324306914084, 'bear_time_stop': 291, 'bear_use_sma': True, 'bear_use_ema': False, 'bear_use_atr': False, 'bear_use_adx': True, 'bear_use_spike': True, 'bear_rsi_required': False, 'sideways_strategy': 'mean_reversion', 'sideways_bb_std_mult': 2.2701303995563062, 'sideways_rsi_os': 33, 'sideways_rsi_ob': 76, 'sideways_adx_thresh': 12.602320664607795, 'sideways_atr_min_pct': 0.010107003206079308, 'sideways_atr_max_pct': 0.11802257250956295, 'sideways_tp_mult': 1.093222397409519, 'sideways_tsl_mult': 0.9603550727783006, 'sideways_time_stop': 295, 'sideways_use_sma': True, 'sideways_use_ema': True, 'sideways_use_atr': True, 'sideways_use_adx': True, 'sideways_use_spike': False, 'sideways_rsi_required': True}.
[I 2025-09-01 04:16:53,220] Trial 84 finished with values: [-1000000000.0, 1000000000.0] and parameters: {'p_sma': 31, 'p_std': 36, 'p_atr': 9, 'p_adx': 18, 'rsi_period': 25, 'ema1': 21, 'ema2': 41, 'slip_atr_k': 0.03609488529666931, 'slip_spread_k': 0.7672365730675043, 'spread_hl_frac': 0.023091530626268477, 'bb_std_mult': 0.9965312882991995, 'rsi_os': 44, 'rsi_ob': 94, 'vol_spike': 0.1967209476019273, 'adx_thresh': 33.488208690755386, 'atr_min_pct': 0.012013413914330409, 'atr_max_pct': 0.05111721272741619, 'tp_mult': 1.4936062397072, 'tsl_mult': 0.5134667307631179, 'strategy': 'breakout', 'time_stop': 137, 'use_sma': False, 'use_atr': False, 'use_adx': True, 'use_ema': False, 'use_spike': True, 'rsi_required': True, 'edge_k': 0.7927175070831713, 'edge_cap': 0.35733421980278557, 'bull_strategy': 'mean_reversion', 'bull_bb_std_mult': 1.1649847211207858, 'bull_rsi_os': 23, 'bull_rsi_ob': 87, 'bull_adx_thresh': 9.561740990838045, 'bull_atr_min_pct': 0.02297050073668054, 'bull_atr_max_pct': 0.025850742976661546, 'bull_tp_mult': 2.327525609002153, 'bull_tsl_mult': 0.7117808668958321, 'bull_time_stop': 163, 'bull_use_sma': False, 'bull_use_ema': False, 'bull_use_atr': True, 'bull_use_adx': True, 'bull_use_spike': True, 'bull_rsi_required': False, 'bear_strategy': 'breakout', 'bear_bb_std_mult': 1.260786743728929, 'bear_rsi_os': 16, 'bear_rsi_ob': 56, 'bear_adx_thresh': 11.880141779658006, 'bear_atr_min_pct': 0.02291232859503993, 'bear_atr_max_pct': 0.08825110657076254, 'bear_tp_mult': 1.2610289264058858, 'bear_tsl_mult': 0.20960617795647263, 'bear_time_stop': 173, 'bear_use_sma': True, 'bear_use_ema': False, 'bear_use_atr': False, 'bear_use_adx': True, 'bear_use_spike': True, 'bear_rsi_required': False, 'sideways_strategy': 'mean_reversion', 'sideways_bb_std_mult': 1.9168992805831568, 'sideways_rsi_os': 33, 'sideways_rsi_ob': 58, 'sideways_adx_thresh': 18.371735868861823, 'sideways_atr_min_pct': 0.012604045402724908, 'sideways_atr_max_pct': 0.11710281196836811, 'sideways_tp_mult': 1.2834053018014997, 'sideways_tsl_mult': 0.9431447686300882, 'sideways_time_stop': 282, 'sideways_use_sma': True, 'sideways_use_ema': True, 'sideways_use_atr': True, 'sideways_use_adx': True, 'sideways_use_spike': False, 'sideways_rsi_required': True}.
[I 2025-09-01 04:16:53,644] Trial 89 finished with values: [-1000000000.0, 1000000000.0] and parameters: {'p_sma': 26, 'p_std': 58, 'p_atr': 27, 'p_adx': 15, 'rsi_period': 37, 'ema1': 25, 'ema2': 35, 'slip_atr_k': 0.05008899115796445, 'slip_spread_k': 0.6600209829046351, 'spread_hl_frac': 0.017309553254251347, 'bb_std_mult': 0.6789868022931412, 'rsi_os': 42, 'rsi_ob': 83, 'vol_spike': 0.12695290374094126, 'adx_thresh': 12.129840082115466, 'atr_min_pct': 0.023578602862570994, 'atr_max_pct': 0.023419246437770075, 'tp_mult': 2.324522140489948, 'tsl_mult': 0.7565313330615036, 'strategy': 'breakout', 'time_stop': 93, 'use_sma': False, 'use_atr': True, 'use_adx': False, 'use_ema': True, 'use_spike': True, 'rsi_required': False, 'edge_k': 0.2672925091063585, 'edge_cap': 0.8897759918487733, 'bull_strategy': 'breakout', 'bull_bb_std_mult': 0.861563821666841, 'bull_rsi_os': 20, 'bull_rsi_ob': 51, 'bull_adx_thresh': 16.373496256382047, 'bull_atr_min_pct': 0.012937105871280332, 'bull_atr_max_pct': 0.047721538666284806, 'bull_tp_mult': 1.860979232967114, 'bull_tsl_mult': 0.22211521160822006, 'bull_time_stop': 54, 'bull_use_sma': True, 'bull_use_ema': False, 'bull_use_atr': True, 'bull_use_adx': True, 'bull_use_spike': True, 'bull_rsi_required': False, 'bear_strategy': 'breakout', 'bear_bb_std_mult': 3.10356779641765, 'bear_rsi_os': 19, 'bear_rsi_ob': 45, 'bear_adx_thresh': 19.394635954803743, 'bear_atr_min_pct': 0.002557955772212916, 'bear_atr_max_pct': 0.08298515101669998, 'bear_tp_mult': 1.6101472099553749, 'bear_tsl_mult': 0.32827050830389903, 'bear_time_stop': 249, 'bear_use_sma': False, 'bear_use_ema': False, 'bear_use_atr': True, 'bear_use_adx': False, 'bear_use_spike': True, 'bear_rsi_required': False, 'sideways_strategy': 'breakout', 'sideways_bb_std_mult': 3.322749980562457, 'sideways_rsi_os': 53, 'sideways_rsi_ob': 61, 'sideways_adx_thresh': 23.744613432053622, 'sideways_atr_min_pct': 0.01755492410451859, 'sideways_atr_max_pct': 0.04829942892371895, 'sideways_tp_mult': 2.4816895931223564, 'sideways_tsl_mult': 0.872170805179973, 'sideways_time_stop': 26, 'sideways_use_sma': False, 'sideways_use_ema': True, 'sideways_use_atr': True, 'sideways_use_adx': False, 'sideways_use_spike': True, 'sideways_rsi_required': False}.
[I 2025-09-01 04:17:36,576] Trial 86 finished with values: [-1000000000.0, 1000000000.0] and parameters: {'p_sma': 46, 'p_std': 13, 'p_atr': 14, 'p_adx': 9, 'rsi_period': 35, 'ema1': 16, 'ema2': 41, 'slip_atr_k': 0.08147225347719457, 'slip_spread_k': 0.6667343393027243, 'spread_hl_frac': 0.04984568869380757, 'bb_std_mult': 0.9581493481758899, 'rsi_os': 43, 'rsi_ob': 92, 'vol_spike': 0.1501566924592753, 'adx_thresh': 29.75647037819861, 'atr_min_pct': 0.010435094865689373, 'atr_max_pct': 0.05230374527680705, 'tp_mult': 1.2826611504654655, 'tsl_mult': 0.7814705085890915, 'strategy': 'breakout', 'time_stop': 92, 'use_sma': False, 'use_atr': False, 'use_adx': False, 'use_ema': False, 'use_spike': True, 'rsi_required': True, 'edge_k': 0.829904837614974, 'edge_cap': 0.3553854714105358, 'bull_strategy': 'mean_reversion', 'bull_bb_std_mult': 2.1812298451014045, 'bull_rsi_os': 18, 'bull_rsi_ob': 87, 'bull_adx_thresh': 9.523412370582944, 'bull_atr_min_pct': 0.013192284295613393, 'bull_atr_max_pct': 0.11411025233939848, 'bull_tp_mult': 1.8528101776762655, 'bull_tsl_mult': 0.17775255790070377, 'bull_time_stop': 264, 'bull_use_sma': True, 'bull_use_ema': False, 'bull_use_atr': True, 'bull_use_adx': True, 'bull_use_spike': True, 'bull_rsi_required': False, 'bear_strategy': 'breakout', 'bear_bb_std_mult': 2.9468905073069447, 'bear_rsi_os': 16, 'bear_rsi_ob': 56, 'bear_adx_thresh': 10.391241085926579, 'bear_atr_min_pct': 0.003987833126713778, 'bear_atr_max_pct': 0.0808137184216223, 'bear_tp_mult': 1.022543314076724, 'bear_tsl_mult': 0.3374498523401059, 'bear_time_stop': 244, 'bear_use_sma': True, 'bear_use_ema': False, 'bear_use_atr': True, 'bear_use_adx': False, 'bear_use_spike': True, 'bear_rsi_required': False, 'sideways_strategy': 'mean_reversion', 'sideways_bb_std_mult': 3.311596263173285, 'sideways_rsi_os': 15, 'sideways_rsi_ob': 59, 'sideways_adx_thresh': 18.456487123460548, 'sideways_atr_min_pct': 0.006827483757009931, 'sideways_atr_max_pct': 0.04999742836050384, 'sideways_tp_mult': 1.379101440605592, 'sideways_tsl_mult': 0.9700929930805695, 'sideways_time_stop': 26, 'sideways_use_sma': True, 'sideways_use_ema': True, 'sideways_use_atr': True, 'sideways_use_adx': True, 'sideways_use_spike': False, 'sideways_rsi_required': True}.
[I 2025-09-01 04:17:38,418] Trial 88 finished with values: [-1000000000.0, 1000000000.0] and parameters: {'p_sma': 54, 'p_std': 35, 'p_atr': 14, 'p_adx': 29, 'rsi_period': 18, 'ema1': 26, 'ema2': 24, 'slip_atr_k': 0.08346475186051273, 'slip_spread_k': 0.6851369010492999, 'spread_hl_frac': 0.007338235034392857, 'bb_std_mult': 1.9668236140706794, 'rsi_os': 43, 'rsi_ob': 92, 'vol_spike': 0.15112704423693027, 'adx_thresh': 33.38104082184762, 'atr_min_pct': 0.020325215495001644, 'atr_max_pct': 0.02272823281403888, 'tp_mult': 2.3367159597440037, 'tsl_mult': 0.7766896069392073, 'strategy': 'breakout', 'time_stop': 109, 'use_sma': False, 'use_atr': True, 'use_adx': False, 'use_ema': True, 'use_spike': True, 'rsi_required': False, 'edge_k': 0.27016155099262973, 'edge_cap': 0.79556354263661, 'bull_strategy': 'breakout', 'bull_bb_std_mult': 2.2488985854072086, 'bull_rsi_os': 32, 'bull_rsi_ob': 65, 'bull_adx_thresh': 11.759708106673521, 'bull_atr_min_pct': 0.012976455662889175, 'bull_atr_max_pct': 0.08522425762542571, 'bull_tp_mult': 1.8459425103027516, 'bull_tsl_mult': 0.29914639991990577, 'bull_time_stop': 164, 'bull_use_sma': True, 'bull_use_ema': False, 'bull_use_atr': True, 'bull_use_adx': True, 'bull_use_spike': True, 'bull_rsi_required': False, 'bear_strategy': 'breakout', 'bear_bb_std_mult': 2.957458584677985, 'bear_rsi_os': 16, 'bear_rsi_ob': 56, 'bear_adx_thresh': 23.415832393148637, 'bear_atr_min_pct': 0.003248761925634584, 'bear_atr_max_pct': 0.08586672572183698, 'bear_tp_mult': 1.01092824110301, 'bear_tsl_mult': 0.3294534918199582, 'bear_time_stop': 248, 'bear_use_sma': False, 'bear_use_ema': False, 'bear_use_atr': True, 'bear_use_adx': False, 'bear_use_spike': True, 'bear_rsi_required': False, 'sideways_strategy': 'breakout', 'sideways_bb_std_mult': 1.5598926437602385, 'sideways_rsi_os': 16, 'sideways_rsi_ob': 58, 'sideways_adx_thresh': 20.91765024005224, 'sideways_atr_min_pct': 0.0025553783766014138, 'sideways_atr_max_pct': 0.09021558293320878, 'sideways_tp_mult': 2.387023883307623, 'sideways_tsl_mult': 0.15962475661283282, 'sideways_time_stop': 105, 'sideways_use_sma': False, 'sideways_use_ema': True, 'sideways_use_atr': True, 'sideways_use_adx': False, 'sideways_use_spike': True, 'sideways_rsi_required': False}.
[I 2025-09-01 04:17:38,436] Trial 87 finished with values: [-0.08476625059544363, 0.08464544246122617] and parameters: {'p_sma': 26, 'p_std': 11, 'p_atr': 14, 'p_adx': 9, 'rsi_period': 36, 'ema1': 6, 'ema2': 36, 'slip_atr_k': 0.03385775475418804, 'slip_spread_k': 0.646542325458801, 'spread_hl_frac': 0.04914951223855248, 'bb_std_mult': 1.9565322191221368, 'rsi_os': 44, 'rsi_ob': 92, 'vol_spike': 0.20059508468011902, 'adx_thresh': 30.59022589353102, 'atr_min_pct': 0.02022892214061003, 'atr_max_pct': 0.05242371515545437, 'tp_mult': 1.9380178421895558, 'tsl_mult': 0.4567043835911594, 'strategy': 'breakout', 'time_stop': 167, 'use_sma': False, 'use_atr': False, 'use_adx': False, 'use_ema': True, 'use_spike': True, 'rsi_required': True, 'edge_k': 0.6685292086061255, 'edge_cap': 0.808747201808506, 'bull_strategy': 'mean_reversion', 'bull_bb_std_mult': 2.146069778082138, 'bull_rsi_os': 18, 'bull_rsi_ob': 65, 'bull_adx_thresh': 11.896758494947104, 'bull_atr_min_pct': 0.00022129696770286332, 'bull_atr_max_pct': 0.06130260598623578, 'bull_tp_mult': 2.13712071766304, 'bull_tsl_mult': 0.1394142252231768, 'bull_time_stop': 50, 'bull_use_sma': True, 'bull_use_ema': False, 'bull_use_atr': True, 'bull_use_adx': True, 'bull_use_spike': True, 'bull_rsi_required': False, 'bear_strategy': 'breakout', 'bear_bb_std_mult': 3.111543487552085, 'bear_rsi_os': 19, 'bear_rsi_ob': 56, 'bear_adx_thresh': 10.335529850219729, 'bear_atr_min_pct': 0.00325246272307113, 'bear_atr_max_pct': 0.08271700730474198, 'bear_tp_mult': 1.5701871638649167, 'bear_tsl_mult': 0.9190257941305144, 'bear_time_stop': 23, 'bear_use_sma': True, 'bear_use_ema': False, 'bear_use_atr': True, 'bear_use_adx': False, 'bear_use_spike': True, 'bear_rsi_required': False, 'sideways_strategy': 'breakout', 'sideways_bb_std_mult': 1.5195157204766936, 'sideways_rsi_os': 16, 'sideways_rsi_ob': 59, 'sideways_adx_thresh': 18.659356744735817, 'sideways_atr_min_pct': 0.0030042203082617045, 'sideways_atr_max_pct': 0.05307980343168855, 'sideways_tp_mult': 1.9258902377835128, 'sideways_tsl_mult': 0.9623638173039745, 'sideways_time_stop': 26, 'sideways_use_sma': False, 'sideways_use_ema': True, 'sideways_use_atr': True, 'sideways_use_adx': False, 'sideways_use_spike': True, 'sideways_rsi_required': True}.
