[I 2025-09-01 05:40:05,508] Trial 557 finished with values: [-1000000000.0, 1000000000.0] and parameters: {'p_sma': 7, 'p_std': 25, 'p_atr': 7, 'p_adx': 13, 'rsi_period': 24, 'ema1': 25, 'ema2': 47, 'slip_atr_k': 0.01647758275549669, 'slip_spread_k': 0.9257329517147086, 'spread_hl_frac': 0.04837464749523399, 'bb_std_mult': 1.5166759972317623, 'rsi_os': 28, 'rsi_ob': 81, 'vol_spike': 0.21581143945925915, 'adx_thresh': 13.766186687453096, 'atr_min_pct': 0.004438817831293092, 'atr_max_pct': 0.11741410939995608, 'tp_mult': 2.0408293187575213, 'tsl_mult': 0.8541029409556067, 'strategy': 'breakout', 'time_stop': 299, 'use_sma': False, 'use_atr': True, 'use_adx': False, 'use_ema': True, 'use_spike': False, 'rsi_required': True, 'edge_k': 0.10730473454237827, 'edge_cap': 0.49838698038490586, 'bull_strategy': 'breakout', 'bull_bb_std_mult': 3.067662112441135, 'bull_rsi_os': 49, 'bull_rsi_ob': 91, 'bull_adx_thresh': 6.40906824969843, 'bull_atr_min_pct': 0.00896356569120799, 'bull_atr_max_pct': 0.046044279484411366, 'bull_tp_mult': 2.402880520896474, 'bull_tsl_mult': 0.2826399959417715, 'bull_time_stop': 13, 'bull_use_sma': True, 'bull_use_ema': False, 'bull_use_atr': False, 'bull_use_adx': True, 'bull_use_spike': True, 'bull_rsi_required': True, 'bear_strategy': 'breakout', 'bear_bb_std_mult': 3.5017806102546825, 'bear_rsi_os': 9, 'bear_rsi_ob': 68, 'bear_adx_thresh': 29.869108544935038, 'bear_atr_min_pct': 0.009120977802776901, 'bear_atr_max_pct': 0.06169027597737866, 'bear_tp_mult': 1.4088999156118265, 'bear_tsl_mult': 0.8917244238448634, 'bear_time_stop': 208, 'bear_use_sma': False, 'bear_use_ema': False, 'bear_use_atr': False, 'bear_use_adx': False, 'bear_use_spike': True, 'bear_rsi_required': False, 'sideways_strategy': 'breakout', 'sideways_bb_std_mult': 0.6920379520823478, 'sideways_rsi_os': 27, 'sideways_rsi_ob': 92, 'sideways_adx_thresh': 8.439075240580332, 'sideways_atr_min_pct': 0.007588495404363491, 'sideways_atr_max_pct': 0.14826620898614318, 'sideways_tp_mult': 1.5551468162662314, 'sideways_tsl_mult': 0.9446838214820008, 'sideways_time_stop': 250, 'sideways_use_sma': False, 'sideways_use_ema': True, 'sideways_use_atr': True, 'sideways_use_adx': False, 'sideways_use_spike': True, 'sideways_rsi_required': True}.
[I 2025-09-01 05:40:06,042] Trial 559 finished with values: [-0.24344753824860543, 0.24324020275931443] and parameters: {'p_sma': 38, 'p_std': 35, 'p_atr': 7, 'p_adx': 11, 'rsi_period': 48, 'ema1': 18, 'ema2': 12, 'slip_atr_k': 0.20026311197101143, 'slip_spread_k': 0.41421412840552835, 'spread_hl_frac': 0.0489071783225597, 'bb_std_mult': 2.0525900090834566, 'rsi_os': 27, 'rsi_ob': 60, 'vol_spike': 0.11815205504216136, 'adx_thresh': 24.840499557500923, 'atr_min_pct': 0.004014495465545064, 'atr_max_pct': 0.060517589754040646, 'tp_mult': 2.710941446317805, 'tsl_mult': 0.5721256457698893, 'strategy': 'mean_reversion', 'time_stop': 193, 'use_sma': False, 'use_atr': True, 'use_adx': False, 'use_ema': True, 'use_spike': False, 'rsi_required': True, 'edge_k': 0.31333547565179587, 'edge_cap': 0.4851528856448359, 'bull_strategy': 'breakout', 'bull_bb_std_mult': 3.0620373614101046, 'bull_rsi_os': 16, 'bull_rsi_ob': 91, 'bull_adx_thresh': 6.126175567252799, 'bull_atr_min_pct': 0.012496033975207876, 'bull_atr_max_pct': 0.019630307817514014, 'bull_tp_mult': 2.7273677292602594, 'bull_tsl_mult': 0.7500907020620844, 'bull_time_stop': 103, 'bull_use_sma': True, 'bull_use_ema': False, 'bull_use_atr': True, 'bull_use_adx': True, 'bull_use_spike': True, 'bull_rsi_required': False, 'bear_strategy': 'breakout', 'bear_bb_std_mult': 3.4740512829893015, 'bear_rsi_os': 25, 'bear_rsi_ob': 68, 'bear_adx_thresh': 31.493019078609805, 'bear_atr_min_pct': 0.005906576647325802, 'bear_atr_max_pct': 0.06205853704050508, 'bear_tp_mult': 1.1698427017843724, 'bear_tsl_mult': 0.8984309842204643, 'bear_time_stop': 98, 'bear_use_sma': False, 'bear_use_ema': False, 'bear_use_atr': False, 'bear_use_adx': False, 'bear_use_spike': True, 'bear_rsi_required': False, 'sideways_strategy': 'breakout', 'sideways_bb_std_mult': 2.3618263628056853, 'sideways_rsi_os': 48, 'sideways_rsi_ob': 70, 'sideways_adx_thresh': 23.447276471604006, 'sideways_atr_min_pct': 0.0005686188841681362, 'sideways_atr_max_pct': 0.0999921930125456, 'sideways_tp_mult': 1.7182395183437986, 'sideways_tsl_mult': 0.5203456869229187, 'sideways_time_stop': 276, 'sideways_use_sma': False, 'sideways_use_ema': True, 'sideways_use_atr': True, 'sideways_use_adx': False, 'sideways_use_spike': True, 'sideways_rsi_required': True}.
[I 2025-09-01 05:40:46,825] Trial 561 finished with values: [-1000000000.0, 1000000000.0] and parameters: {'p_sma': 60, 'p_std': 31, 'p_atr': 8, 'p_adx': 17, 'rsi_period': 48, 'ema1': 24, 'ema2': 49, 'slip_atr_k': 0.198685351774483, 'slip_spread_k': 0.4048482701239192, 'spread_hl_frac': 0.04574480635157222, 'bb_std_mult': 2.879175048405402, 'rsi_os': 24, 'rsi_ob': 60, 'vol_spike': 0.11798575617594517, 'adx_thresh': 13.612145085623037, 'atr_min_pct': 0.029501206486159566, 'atr_max_pct': 0.1216343406726715, 'tp_mult': 2.8871638215440187, 'tsl_mult': 0.3706677592121903, 'strategy': 'mean_reversion', 'time_stop': 185, 'use_sma': False, 'use_atr': True, 'use_adx': False, 'use_ema': True, 'use_spike': False, 'rsi_required': False, 'edge_k': 0.2536194136222908, 'edge_cap': 0.8200538650626283, 'bull_strategy': 'breakout', 'bull_bb_std_mult': 0.6454180438847482, 'bull_rsi_os': 52, 'bull_rsi_ob': 90, 'bull_adx_thresh': 22.35645205240737, 'bull_atr_min_pct': 0.012220098362238372, 'bull_atr_max_pct': 0.020000721708501597, 'bull_tp_mult': 2.8092458302477077, 'bull_tsl_mult': 0.29416763090821785, 'bull_time_stop': 87, 'bull_use_sma': True, 'bull_use_ema': False, 'bull_use_atr': True, 'bull_use_adx': True, 'bull_use_spike': True, 'bull_rsi_required': False, 'bear_strategy': 'breakout', 'bear_bb_std_mult': 3.491614730774021, 'bear_rsi_os': 7, 'bear_rsi_ob': 48, 'bear_adx_thresh': 7.509711249504123, 'bear_atr_min_pct': 0.006054037247551364, 'bear_atr_max_pct': 0.07216244524617987, 'bear_tp_mult': 1.4056046308579875, 'bear_tsl_mult': 0.6741202573157582, 'bear_time_stop': 219, 'bear_use_sma': False, 'bear_use_ema': False, 'bear_use_atr': False, 'bear_use_adx': False, 'bear_use_spike': True, 'bear_rsi_required': False, 'sideways_strategy': 'mean_reversion', 'sideways_bb_std_mult': 0.8902982549207568, 'sideways_rsi_os': 23, 'sideways_rsi_ob': 56, 'sideways_adx_thresh': 23.565946252559193, 'sideways_atr_min_pct': 0.017851584820101504, 'sideways_atr_max_pct': 0.10727203411275218, 'sideways_tp_mult': 1.7131167212661669, 'sideways_tsl_mult': 0.23497818064278692, 'sideways_time_stop': 204, 'sideways_use_sma': False, 'sideways_use_ema': False, 'sideways_use_atr': True, 'sideways_use_adx': False, 'sideways_use_spike': True, 'sideways_rsi_required': True}.
[I 2025-09-01 05:40:47,404] Trial 562 finished with values: [-1000000000.0, 1000000000.0] and parameters: {'p_sma': 59, 'p_std': 31, 'p_atr': 21, 'p_adx': 29, 'rsi_period': 48, 'ema1': 24, 'ema2': 33, 'slip_atr_k': 0.05621363389345087, 'slip_spread_k': 0.4144912352008037, 'spread_hl_frac': 0.011515185669374945, 'bb_std_mult': 2.874930870221758, 'rsi_os': 27, 'rsi_ob': 69, 'vol_spike': 0.1400455548501494, 'adx_thresh': 24.38267768348318, 'atr_min_pct': 0.007541049373184146, 'atr_max_pct': 0.05972741547083048, 'tp_mult': 1.2974129269064303, 'tsl_mult': 0.9604384948189736, 'strategy': 'mean_reversion', 'time_stop': 101, 'use_sma': False, 'use_atr': True, 'use_adx': False, 'use_ema': False, 'use_spike': True, 'rsi_required': False, 'edge_k': 1.571901410539826, 'edge_cap': 0.07344679817980487, 'bull_strategy': 'breakout', 'bull_bb_std_mult': 0.654724560349613, 'bull_rsi_os': 52, 'bull_rsi_ob': 94, 'bull_adx_thresh': 5.805435104707285, 'bull_atr_min_pct': 0.012281394586557063, 'bull_atr_max_pct': 0.10014490325240592, 'bull_tp_mult': 1.194740714930647, 'bull_tsl_mult': 0.5486114520552527, 'bull_time_stop': 87, 'bull_use_sma': True, 'bull_use_ema': True, 'bull_use_atr': True, 'bull_use_adx': True, 'bull_use_spike': False, 'bull_rsi_required': False, 'bear_strategy': 'breakout', 'bear_bb_std_mult': 3.4488537775990338, 'bear_rsi_os': 5, 'bear_rsi_ob': 70, 'bear_adx_thresh': 28.06500696376792, 'bear_atr_min_pct': 0.009943767223440555, 'bear_atr_max_pct': 0.07232985170260602, 'bear_tp_mult': 1.176080237461409, 'bear_tsl_mult': 0.846408740124494, 'bear_time_stop': 218, 'bear_use_sma': True, 'bear_use_ema': False, 'bear_use_atr': False, 'bear_use_adx': False, 'bear_use_spike': False, 'bear_rsi_required': False, 'sideways_strategy': 'mean_reversion', 'sideways_bb_std_mult': 0.5020191749727656, 'sideways_rsi_os': 48, 'sideways_rsi_ob': 90, 'sideways_adx_thresh': 23.380389018997953, 'sideways_atr_min_pct': 0.006088914742996275, 'sideways_atr_max_pct': 0.1065450058928157, 'sideways_tp_mult': 1.7018090276836868, 'sideways_tsl_mult': 0.9803604124402909, 'sideways_time_stop': 174, 'sideways_use_sma': False, 'sideways_use_ema': False, 'sideways_use_atr': True, 'sideways_use_adx': False, 'sideways_use_spike': True, 'sideways_rsi_required': True}.
[I 2025-09-01 05:40:47,838] Trial 560 finished with values: [-1000000000.0, 1000000000.0] and parameters: {'p_sma': 38, 'p_std': 49, 'p_atr': 8, 'p_adx': 17, 'rsi_period': 72, 'ema1': 11, 'ema2': 55, 'slip_atr_k': 0.02242617647514429, 'slip_spread_k': 0.40261903647606406, 'spread_hl_frac': 0.04798892757621188, 'bb_std_mult': 2.0794699538282515, 'rsi_os': 28, 'rsi_ob': 72, 'vol_spike': 0.21530849370420305, 'adx_thresh': 14.469745442272474, 'atr_min_pct': 0.0040082474920347215, 'atr_max_pct': 0.12240526381450806, 'tp_mult': 2.767013423733153, 'tsl_mult': 0.3017140651161534, 'strategy': 'mean_reversion', 'time_stop': 193, 'use_sma': False, 'use_atr': True, 'use_adx': False, 'use_ema': True, 'use_spike': False, 'rsi_required': False, 'edge_k': 1.4068743033566276, 'edge_cap': 0.47103228129258173, 'bull_strategy': 'breakout', 'bull_bb_std_mult': 0.919176075800628, 'bull_rsi_os': 52, 'bull_rsi_ob': 90, 'bull_adx_thresh': 11.521120722349005, 'bull_atr_min_pct': 0.008764693904453428, 'bull_atr_max_pct': 0.047683067846124166, 'bull_tp_mult': 1.1924620734508928, 'bull_tsl_mult': 0.2969276829264311, 'bull_time_stop': 86, 'bull_use_sma': True, 'bull_use_ema': False, 'bull_use_atr': True, 'bull_use_adx': True, 'bull_use_spike': True, 'bull_rsi_required': False, 'bear_strategy': 'breakout', 'bear_bb_std_mult': 3.479049906208833, 'bear_rsi_os': 51, 'bear_rsi_ob': 66, 'bear_adx_thresh': 27.355370119889095, 'bear_atr_min_pct': 0.006240666101288557, 'bear_atr_max_pct': 0.022840260531847706, 'bear_tp_mult': 1.4110159899726873, 'bear_tsl_mult': 0.6184431323667327, 'bear_time_stop': 108, 'bear_use_sma': False, 'bear_use_ema': False, 'bear_use_atr': False, 'bear_use_adx': False, 'bear_use_spike': True, 'bear_rsi_required': False, 'sideways_strategy': 'mean_reversion', 'sideways_bb_std_mult': 2.726219669345868, 'sideways_rsi_os': 14, 'sideways_rsi_ob': 52, 'sideways_adx_thresh': 23.5056690670213, 'sideways_atr_min_pct': 0.013186925906107129, 'sideways_atr_max_pct': 0.10653398739141925, 'sideways_tp_mult': 1.7451746908846646, 'sideways_tsl_mult': 0.23247253386867062, 'sideways_time_stop': 175, 'sideways_use_sma': False, 'sideways_use_ema': False, 'sideways_use_atr': True, 'sideways_use_adx': False, 'sideways_use_spike': True, 'sideways_rsi_required': True}.
[I 2025-09-01 05:40:48,029] Trial 563 finished with values: [-1000000000.0, 1000000000.0] and parameters: {'p_sma': 60, 'p_std': 31, 'p_atr': 8, 'p_adx': 17, 'rsi_period': 54, 'ema1': 8, 'ema2': 16, 'slip_atr_k': 0.020811916118565105, 'slip_spread_k': 0.12635728373241895, 'spread_hl_frac': 0.01164164192742216, 'bb_std_mult': 1.4355887323379197, 'rsi_os': 24, 'rsi_ob': 85, 'vol_spike': 0.19883417564315664, 'adx_thresh': 14.445825068847434, 'atr_min_pct': 0.005978636946591381, 'atr_max_pct': 0.12238709933690464, 'tp_mult': 1.0139671044012264, 'tsl_mult': 0.9593493149121349, 'strategy': 'mean_reversion', 'time_stop': 221, 'use_sma': False, 'use_atr': True, 'use_adx': False, 'use_ema': False, 'use_spike': True, 'rsi_required': False, 'edge_k': 0.2449858414102234, 'edge_cap': 0.46436780183482207, 'bull_strategy': 'breakout', 'bull_bb_std_mult': 0.9166737756837979, 'bull_rsi_os': 12, 'bull_rsi_ob': 94, 'bull_adx_thresh': 11.808626413318288, 'bull_atr_min_pct': 0.013459430649998466, 'bull_atr_max_pct': 0.10677727170544085, 'bull_tp_mult': 1.197103926778153, 'bull_tsl_mult': 0.1942171743004129, 'bull_time_stop': 299, 'bull_use_sma': True, 'bull_use_ema': True, 'bull_use_atr': True, 'bull_use_adx': True, 'bull_use_spike': False, 'bull_rsi_required': False, 'bear_strategy': 'breakout', 'bear_bb_std_mult': 2.3561806956862443, 'bear_rsi_os': 7, 'bear_rsi_ob': 84, 'bear_adx_thresh': 23.11445071496509, 'bear_atr_min_pct': 0.020227634556948773, 'bear_atr_max_pct': 0.044216313116608494, 'bear_tp_mult': 1.3206568496770101, 'bear_tsl_mult': 0.6258641758020881, 'bear_time_stop': 110, 'bear_use_sma': True, 'bear_use_ema': False, 'bear_use_atr': False, 'bear_use_adx': False, 'bear_use_spike': False, 'bear_rsi_required': False, 'sideways_strategy': 'mean_reversion', 'sideways_bb_std_mult': 3.261019031659947, 'sideways_rsi_os': 23, 'sideways_rsi_ob': 76, 'sideways_adx_thresh': 22.417433819109174, 'sideways_atr_min_pct': 0.004636683004045501, 'sideways_atr_max_pct': 0.10682385058560348, 'sideways_tp_mult': 1.6697379775302437, 'sideways_tsl_mult': 0.22999496288681842, 'sideways_time_stop': 84, 'sideways_use_sma': False, 'sideways_use_ema': False, 'sideways_use_atr': True, 'sideways_use_adx': False, 'sideways_use_spike': True, 'sideways_rsi_required': True}.
[I 2025-09-01 05:41:31,911] Trial 567 finished with values: [-0.019409984022997873, 0.019668281548180625] and parameters: {'p_sma': 57, 'p_std': 33, 'p_atr': 7, 'p_adx': 23, 'rsi_period': 57, 'ema1': 24, 'ema2': 30, 'slip_atr_k': 0.11023335329383321, 'slip_spread_k': 0.49096063699095627, 'spread_hl_frac': 0.007933359436692, 'bb_std_mult': 1.9050246336599186, 'rsi_os': 25, 'rsi_ob': 86, 'vol_spike': 0.20875432016719175, 'adx_thresh': 12.477423591620575, 'atr_min_pct': 0.003248390753650042, 'atr_max_pct': 0.11672062699518809, 'tp_mult': 2.5994685904264725, 'tsl_mult': 0.17498429424648831, 'strategy': 'breakout', 'time_stop': 265, 'use_sma': False, 'use_atr': True, 'use_adx': True, 'use_ema': True, 'use_spike': True, 'rsi_required': False, 'edge_k': 0.20323674948474854, 'edge_cap': 0.2905197042942636, 'bull_strategy': 'mean_reversion', 'bull_bb_std_mult': 0.7961069239419127, 'bull_rsi_os': 40, 'bull_rsi_ob': 88, 'bull_adx_thresh': 5.631238969017952, 'bull_atr_min_pct': 0.013841543042998838, 'bull_atr_max_pct': 0.10991030165988618, 'bull_tp_mult': 1.2897294831902064, 'bull_tsl_mult': 0.23334987926919798, 'bull_time_stop': 158, 'bull_use_sma': False, 'bull_use_ema': False, 'bull_use_atr': False, 'bull_use_adx': True, 'bull_use_spike': False, 'bull_rsi_required': True, 'bear_strategy': 'breakout', 'bear_bb_std_mult': 3.3526547449226918, 'bear_rsi_os': 10, 'bear_rsi_ob': 92, 'bear_adx_thresh': 28.99234778202488, 'bear_atr_min_pct': 0.007691248990034586, 'bear_atr_max_pct': 0.06595683474793007, 'bear_tp_mult': 1.2242548645745845, 'bear_tsl_mult': 0.654146142145888, 'bear_time_stop': 186, 'bear_use_sma': True, 'bear_use_ema': True, 'bear_use_atr': True, 'bear_use_adx': True, 'bear_use_spike': False, 'bear_rsi_required': True, 'sideways_strategy': 'breakout', 'sideways_bb_std_mult': 3.3464460684747594, 'sideways_rsi_os': 44, 'sideways_rsi_ob': 84, 'sideways_adx_thresh': 22.76775171747084, 'sideways_atr_min_pct': 0.004197730624591363, 'sideways_atr_max_pct': 0.10211153352447777, 'sideways_tp_mult': 1.5906478368026382, 'sideways_tsl_mult': 0.9998195824042467, 'sideways_time_stop': 238, 'sideways_use_sma': False, 'sideways_use_ema': True, 'sideways_use_atr': True, 'sideways_use_adx': True, 'sideways_use_spike': False, 'sideways_rsi_required': True}.
[I 2025-09-01 05:41:32,612] Trial 566 finished with values: [-0.021530830516919175, 0.021614988892631883] and parameters: {'p_sma': 60, 'p_std': 33, 'p_atr': 7, 'p_adx': 23, 'rsi_period': 54, 'ema1': 20, 'ema2': 16, 'slip_atr_k': 0.187286218258025, 'slip_spread_k': 0.12121064967718992, 'spread_hl_frac': 0.03543977324377555, 'bb_std_mult': 2.114693714349477, 'rsi_os': 13, 'rsi_ob': 86, 'vol_spike': 0.21050426473779682, 'adx_thresh': 9.873309942026895, 'atr_min_pct': 0.006204692290246951, 'atr_max_pct': 0.03725416099934333, 'tp_mult': 2.5895737372931165, 'tsl_mult': 0.785511118883778, 'strategy': 'breakout', 'time_stop': 179, 'use_sma': False, 'use_atr': True, 'use_adx': True, 'use_ema': False, 'use_spike': True, 'rsi_required': False, 'edge_k': 1.7101877189180392, 'edge_cap': 0.5935046406174165, 'bull_strategy': 'mean_reversion', 'bull_bb_std_mult': 0.7929688333666203, 'bull_rsi_os': 50, 'bull_rsi_ob': 72, 'bull_adx_thresh': 30.519212820859156, 'bull_atr_min_pct': 0.013901401596263643, 'bull_atr_max_pct': 0.10645867510581614, 'bull_tp_mult': 1.323012977081895, 'bull_tsl_mult': 0.6079361599448878, 'bull_time_stop': 79, 'bull_use_sma': False, 'bull_use_ema': True, 'bull_use_atr': False, 'bull_use_adx': True, 'bull_use_spike': False, 'bull_rsi_required': True, 'bear_strategy': 'breakout', 'bear_bb_std_mult': 3.3535836957354963, 'bear_rsi_os': 38, 'bear_rsi_ob': 66, 'bear_adx_thresh': 10.179444351758615, 'bear_atr_min_pct': 0.020126809801849735, 'bear_atr_max_pct': 0.06574885500595833, 'bear_tp_mult': 1.3095603723650688, 'bear_tsl_mult': 0.65223942777526, 'bear_time_stop': 201, 'bear_use_sma': True, 'bear_use_ema': True, 'bear_use_atr': False, 'bear_use_adx': True, 'bear_use_spike': False, 'bear_rsi_required': True, 'sideways_strategy': 'breakout', 'sideways_bb_std_mult': 3.3466889001962112, 'sideways_rsi_os': 53, 'sideways_rsi_ob': 84, 'sideways_adx_thresh': 22.201924439236638, 'sideways_atr_min_pct': 0.004485621208748129, 'sideways_atr_max_pct': 0.10221169340464084, 'sideways_tp_mult': 1.6188912921022307, 'sideways_tsl_mult': 0.6019751745570416, 'sideways_time_stop': 83, 'sideways_use_sma': False, 'sideways_use_ema': True, 'sideways_use_atr': True, 'sideways_use_adx': True, 'sideways_use_spike': False, 'sideways_rsi_required': True}.
[I 2025-09-01 05:41:33,017] Trial 565 finished with values: [-1000000000.0, 1000000000.0] and parameters: {'p_sma': 57, 'p_std': 50, 'p_atr': 10, 'p_adx': 17, 'rsi_period': 71, 'ema1': 13, 'ema2': 30, 'slip_atr_k': 0.009594719241472257, 'slip_spread_k': 0.1557796253697606, 'spread_hl_frac': 0.031909410741674527, 'bb_std_mult': 2.0904585820158132, 'rsi_os': 25, 'rsi_ob': 86, 'vol_spike': 0.20943309772508142, 'adx_thresh': 14.18569801804008, 'atr_min_pct': 0.005946109366445692, 'atr_max_pct': 0.12285580098092191, 'tp_mult': 1.6810011385994055, 'tsl_mult': 0.7442330701129937, 'strategy': 'breakout', 'time_stop': 221, 'use_sma': False, 'use_atr': True, 'use_adx': False, 'use_ema': True, 'use_spike': True, 'rsi_required': False, 'edge_k': 0.19922132189421127, 'edge_cap': 0.36259122004345223, 'bull_strategy': 'mean_reversion', 'bull_bb_std_mult': 0.9220567910721715, 'bull_rsi_os': 50, 'bull_rsi_ob': 88, 'bull_adx_thresh': 5.552806853917563, 'bull_atr_min_pct': 0.01374872968932126, 'bull_atr_max_pct': 0.07288220015491535, 'bull_tp_mult': 1.309032904451053, 'bull_tsl_mult': 0.19130137969247915, 'bull_time_stop': 79, 'bull_use_sma': True, 'bull_use_ema': False, 'bull_use_atr': False, 'bull_use_adx': True, 'bull_use_spike': False, 'bull_rsi_required': True, 'bear_strategy': 'breakout', 'bear_bb_std_mult': 3.5487644916592074, 'bear_rsi_os': 10, 'bear_rsi_ob': 66, 'bear_adx_thresh': 27.41294744516957, 'bear_atr_min_pct': 0.0077353567287657245, 'bear_atr_max_pct': 0.06681119791481248, 'bear_tp_mult': 1.3109508211323448, 'bear_tsl_mult': 0.2365270865891203, 'bear_time_stop': 110, 'bear_use_sma': True, 'bear_use_ema': True, 'bear_use_atr': False, 'bear_use_adx': True, 'bear_use_spike': False, 'bear_rsi_required': True, 'sideways_strategy': 'breakout', 'sideways_bb_std_mult': 0.6163232488138121, 'sideways_rsi_os': 44, 'sideways_rsi_ob': 65, 'sideways_adx_thresh': 29.700847988219053, 'sideways_atr_min_pct': 0.013759768145002032, 'sideways_atr_max_pct': 0.10187748578734496, 'sideways_tp_mult': 1.619519698331171, 'sideways_tsl_mult': 0.9831802580496828, 'sideways_time_stop': 156, 'sideways_use_sma': False, 'sideways_use_ema': True, 'sideways_use_atr': True, 'sideways_use_adx': False, 'sideways_use_spike': False, 'sideways_rsi_required': True}.
