[I 2025-09-01 05:18:18,454] Trial 439 finished with values: [-1000000000.0, 1000000000.0] and parameters: {'p_sma': 33, 'p_std': 55, 'p_atr': 12, 'p_adx': 18, 'rsi_period': 7, 'ema1': 14, 'ema2': 31, 'slip_atr_k': 0.01183548865851774, 'slip_spread_k': 0.4323659469284639, 'spread_hl_frac': 0.04727830370188576, 'bb_std_mult': 2.0702585777462956, 'rsi_os': 21, 'rsi_ob': 65, 'vol_spike': 0.20720732882099652, 'adx_thresh': 13.876483367827213, 'atr_min_pct': 0.022919735483137835, 'atr_max_pct': 0.08299971745365353, 'tp_mult': 1.0687016135460146, 'tsl_mult': 0.95751815381558, 'strategy': 'breakout', 'time_stop': 44, 'use_sma': False, 'use_atr': True, 'use_adx': False, 'use_ema': False, 'use_spike': False, 'rsi_required': False, 'edge_k': 0.7254308438717832, 'edge_cap': 0.47170980058544704, 'bull_strategy': 'breakout', 'bull_bb_std_mult': 2.429388924107251, 'bull_rsi_os': 25, 'bull_rsi_ob': 89, 'bull_adx_thresh': 16.92800614323823, 'bull_atr_min_pct': 0.027913274422615854, 'bull_atr_max_pct': 0.043867390088813234, 'bull_tp_mult': 1.2614120409202862, 'bull_tsl_mult': 0.20423569440215616, 'bull_time_stop': 240, 'bull_use_sma': True, 'bull_use_ema': False, 'bull_use_atr': False, 'bull_use_adx': False, 'bull_use_spike': False, 'bull_rsi_required': True, 'bear_strategy': 'mean_reversion', 'bear_bb_std_mult': 2.8587264150931455, 'bear_rsi_os': 8, 'bear_rsi_ob': 65, 'bear_adx_thresh': 29.473839293713265, 'bear_atr_min_pct': 0.028475058504179498, 'bear_atr_max_pct': 0.06745556536176409, 'bear_tp_mult': 1.381953417690017, 'bear_tsl_mult': 0.6308144313432328, 'bear_time_stop': 110, 'bear_use_sma': True, 'bear_use_ema': False, 'bear_use_atr': False, 'bear_use_adx': False, 'bear_use_spike': False, 'bear_rsi_required': True, 'sideways_strategy': 'breakout', 'sideways_bb_std_mult': 0.6879080284354581, 'sideways_rsi_os': 44, 'sideways_rsi_ob': 55, 'sideways_adx_thresh': 32.71617295568112, 'sideways_atr_min_pct': 0.024312116401961122, 'sideways_atr_max_pct': 0.11323934630154184, 'sideways_tp_mult': 1.5623842347640893, 'sideways_tsl_mult': 0.9987256908131752, 'sideways_time_stop': 171, 'sideways_use_sma': True, 'sideways_use_ema': True, 'sideways_use_atr': False, 'sideways_use_adx': False, 'sideways_use_spike': True, 'sideways_rsi_required': False}.
[I 2025-09-01 05:18:58,072] Trial 443 finished with values: [-0.027409111181967316, 0.02727973402838736] and parameters: {'p_sma': 34, 'p_std': 59, 'p_atr': 10, 'p_adx': 9, 'rsi_period': 42, 'ema1': 28, 'ema2': 27, 'slip_atr_k': 0.19621925789126093, 'slip_spread_k': 0.6406237358488908, 'spread_hl_frac': 0.04696333337813847, 'bb_std_mult': 3.351039782652689, 'rsi_os': 22, 'rsi_ob': 88, 'vol_spike': 0.21811115476251486, 'adx_thresh': 15.490859123439215, 'atr_min_pct': 0.02286198547877917, 'atr_max_pct': 0.08285935592141133, 'tp_mult': 2.572846196777685, 'tsl_mult': 0.758993722402468, 'strategy': 'breakout', 'time_stop': 23, 'use_sma': False, 'use_atr': False, 'use_adx': False, 'use_ema': True, 'use_spike': True, 'rsi_required': False, 'edge_k': 0.7230057432150955, 'edge_cap': 0.4996569524123656, 'bull_strategy': 'breakout', 'bull_bb_std_mult': 2.2340722270722444, 'bull_rsi_os': 24, 'bull_rsi_ob': 91, 'bull_adx_thresh': 15.669757199536571, 'bull_atr_min_pct': 0.0014206233726688567, 'bull_atr_max_pct': 0.11983370907296219, 'bull_tp_mult': 2.6888473287505663, 'bull_tsl_mult': 0.37653758398581144, 'bull_time_stop': 113, 'bull_use_sma': False, 'bull_use_ema': False, 'bull_use_atr': False, 'bull_use_adx': False, 'bull_use_spike': False, 'bull_rsi_required': True, 'bear_strategy': 'mean_reversion', 'bear_bb_std_mult': 0.694110549526648, 'bear_rsi_os': 12, 'bear_rsi_ob': 63, 'bear_adx_thresh': 29.547482629285636, 'bear_atr_min_pct': 0.028701365945074265, 'bear_atr_max_pct': 0.06570904923279866, 'bear_tp_mult': 2.6309098081277633, 'bear_tsl_mult': 0.8595182993324182, 'bear_time_stop': 267, 'bear_use_sma': True, 'bear_use_ema': False, 'bear_use_atr': False, 'bear_use_adx': False, 'bear_use_spike': False, 'bear_rsi_required': False, 'sideways_strategy': 'breakout', 'sideways_bb_std_mult': 0.7996022983464816, 'sideways_rsi_os': 23, 'sideways_rsi_ob': 57, 'sideways_adx_thresh': 16.308192521770504, 'sideways_atr_min_pct': 0.004788200135512946, 'sideways_atr_max_pct': 0.11247969413794781, 'sideways_tp_mult': 1.5074951366089664, 'sideways_tsl_mult': 0.8300373264614493, 'sideways_time_stop': 25, 'sideways_use_sma': True, 'sideways_use_ema': True, 'sideways_use_atr': False, 'sideways_use_adx': True, 'sideways_use_spike': True, 'sideways_rsi_required': False}.
[I 2025-09-01 05:18:59,567] Trial 442 finished with values: [-0.019664979673181038, 0.01954616716176978] and parameters: {'p_sma': 34, 'p_std': 59, 'p_atr': 8, 'p_adx': 11, 'rsi_period': 53, 'ema1': 28, 'ema2': 44, 'slip_atr_k': 0.022903216918551336, 'slip_spread_k': 0.998437866897721, 'spread_hl_frac': 0.04549210998782432, 'bb_std_mult': 1.2503893066059262, 'rsi_os': 22, 'rsi_ob': 88, 'vol_spike': 0.21919217405969732, 'adx_thresh': 15.542956406434381, 'atr_min_pct': 0.022962478934547052, 'atr_max_pct': 0.10991653652817643, 'tp_mult': 1.0650165339674804, 'tsl_mult': 0.680177632705806, 'strategy': 'breakout', 'time_stop': 43, 'use_sma': False, 'use_atr': True, 'use_adx': False, 'use_ema': True, 'use_spike': True, 'rsi_required': False, 'edge_k': 0.7164064754162697, 'edge_cap': 0.47028689705613286, 'bull_strategy': 'breakout', 'bull_bb_std_mult': 2.2515957535633686, 'bull_rsi_os': 25, 'bull_rsi_ob': 91, 'bull_adx_thresh': 10.138477047935819, 'bull_atr_min_pct': 0.001664551136589937, 'bull_atr_max_pct': 0.11333377560452247, 'bull_tp_mult': 2.1838347685914696, 'bull_tsl_mult': 0.06440063915277816, 'bull_time_stop': 254, 'bull_use_sma': False, 'bull_use_ema': False, 'bull_use_atr': False, 'bull_use_adx': False, 'bull_use_spike': False, 'bull_rsi_required': True, 'bear_strategy': 'mean_reversion', 'bear_bb_std_mult': 0.6789766095387118, 'bear_rsi_os': 10, 'bear_rsi_ob': 81, 'bear_adx_thresh': 28.531932745427824, 'bear_atr_min_pct': 0.028988632498889912, 'bear_atr_max_pct': 0.06455490779938139, 'bear_tp_mult': 1.4098936101916681, 'bear_tsl_mult': 0.8553792961567565, 'bear_time_stop': 265, 'bear_use_sma': True, 'bear_use_ema': False, 'bear_use_atr': False, 'bear_use_adx': False, 'bear_use_spike': False, 'bear_rsi_required': False, 'sideways_strategy': 'breakout', 'sideways_bb_std_mult': 2.260562091849612, 'sideways_rsi_os': 35, 'sideways_rsi_ob': 57, 'sideways_adx_thresh': 16.14418461093309, 'sideways_atr_min_pct': 0.024532706265236685, 'sideways_atr_max_pct': 0.10325808365960826, 'sideways_tp_mult': 1.4031442911962948, 'sideways_tsl_mult': 0.9999056586942459, 'sideways_time_stop': 20, 'sideways_use_sma': True, 'sideways_use_ema': True, 'sideways_use_atr': False, 'sideways_use_adx': True, 'sideways_use_spike': True, 'sideways_rsi_required': False}.
[I 2025-09-01 05:19:00,028] Trial 445 finished with values: [-0.016741118236749397, 0.01688634450172643] and parameters: {'p_sma': 59, 'p_std': 35, 'p_atr': 7, 'p_adx': 17, 'rsi_period': 51, 'ema1': 23, 'ema2': 34, 'slip_atr_k': 0.026278716559848973, 'slip_spread_k': 0.4162806904233845, 'spread_hl_frac': 0.04966545850434049, 'bb_std_mult': 2.1454830017343873, 'rsi_os': 27, 'rsi_ob': 90, 'vol_spike': 0.19401079832510515, 'adx_thresh': 12.153493254452563, 'atr_min_pct': 0.0040214607763165745, 'atr_max_pct': 0.1259914194561159, 'tp_mult': 2.4168735440469775, 'tsl_mult': 0.9217043671876723, 'strategy': 'breakout', 'time_stop': 173, 'use_sma': False, 'use_atr': True, 'use_adx': False, 'use_ema': True, 'use_spike': True, 'rsi_required': False, 'edge_k': 0.14855018099992934, 'edge_cap': 0.532959485084432, 'bull_strategy': 'breakout', 'bull_bb_std_mult': 0.8336745607497568, 'bull_rsi_os': 49, 'bull_rsi_ob': 48, 'bull_adx_thresh': 5.350501344100979, 'bull_atr_min_pct': 0.012202388026991574, 'bull_atr_max_pct': 0.10224952026148193, 'bull_tp_mult': 1.2108411593353805, 'bull_tsl_mult': 0.16666893610627836, 'bull_time_stop': 113, 'bull_use_sma': False, 'bull_use_ema': False, 'bull_use_atr': False, 'bull_use_adx': True, 'bull_use_spike': False, 'bull_rsi_required': True, 'bear_strategy': 'breakout', 'bear_bb_std_mult': 3.315019249812386, 'bear_rsi_os': 7, 'bear_rsi_ob': 70, 'bear_adx_thresh': 29.73750080934424, 'bear_atr_min_pct': 0.007578342107302685, 'bear_atr_max_pct': 0.07313762601382244, 'bear_tp_mult': 1.331003747158744, 'bear_tsl_mult': 0.67580135076488, 'bear_time_stop': 195, 'bear_use_sma': False, 'bear_use_ema': False, 'bear_use_atr': False, 'bear_use_adx': False, 'bear_use_spike': False, 'bear_rsi_required': False, 'sideways_strategy': 'breakout', 'sideways_bb_std_mult': 0.6101712209614323, 'sideways_rsi_os': 45, 'sideways_rsi_ob': 52, 'sideways_adx_thresh': 23.330578075105375, 'sideways_atr_min_pct': 0.0042776394577220085, 'sideways_atr_max_pct': 0.1034208618999146, 'sideways_tp_mult': 1.591634206085573, 'sideways_tsl_mult': 0.9977518855723448, 'sideways_time_stop': 160, 'sideways_use_sma': False, 'sideways_use_ema': True, 'sideways_use_atr': True, 'sideways_use_adx': True, 'sideways_use_spike': True, 'sideways_rsi_required': True}.
[I 2025-09-01 05:19:00,222] Trial 444 finished with values: [-0.01455193468408833, 0.014794448583164288] and parameters: {'p_sma': 59, 'p_std': 32, 'p_atr': 7, 'p_adx': 17, 'rsi_period': 53, 'ema1': 24, 'ema2': 34, 'slip_atr_k': 0.02586888746544954, 'slip_spread_k': 0.4579285724984336, 'spread_hl_frac': 0.04985343960350933, 'bb_std_mult': 2.6786338919134467, 'rsi_os': 26, 'rsi_ob': 90, 'vol_spike': 0.2005071187495114, 'adx_thresh': 12.654442130590724, 'atr_min_pct': 0.004122399173403039, 'atr_max_pct': 0.1271161614171453, 'tp_mult': 2.410294083173875, 'tsl_mult': 0.9264206815890992, 'strategy': 'breakout', 'time_stop': 180, 'use_sma': False, 'use_atr': True, 'use_adx': False, 'use_ema': True, 'use_spike': True, 'rsi_required': False, 'edge_k': 0.1588894981502976, 'edge_cap': 0.5350713793007463, 'bull_strategy': 'breakout', 'bull_bb_std_mult': 0.8881836002994479, 'bull_rsi_os': 49, 'bull_rsi_ob': 91, 'bull_adx_thresh': 5.672170683468834, 'bull_atr_min_pct': 0.013884619503827904, 'bull_atr_max_pct': 0.0944509767997629, 'bull_tp_mult': 1.2645321339201696, 'bull_tsl_mult': 0.20481668418605395, 'bull_time_stop': 99, 'bull_use_sma': False, 'bull_use_ema': False, 'bull_use_atr': False, 'bull_use_adx': True, 'bull_use_spike': False, 'bull_rsi_required': True, 'bear_strategy': 'breakout', 'bear_bb_std_mult': 3.4822122024201216, 'bear_rsi_os': 7, 'bear_rsi_ob': 71, 'bear_adx_thresh': 29.9937730647813, 'bear_atr_min_pct': 0.007429914956388422, 'bear_atr_max_pct': 0.07408053146330879, 'bear_tp_mult': 1.34052295452182, 'bear_tsl_mult': 0.6701754360479342, 'bear_time_stop': 187, 'bear_use_sma': False, 'bear_use_ema': False, 'bear_use_atr': False, 'bear_use_adx': False, 'bear_use_spike': False, 'bear_rsi_required': False, 'sideways_strategy': 'breakout', 'sideways_bb_std_mult': 0.5872475671508455, 'sideways_rsi_os': 44, 'sideways_rsi_ob': 52, 'sideways_adx_thresh': 23.09311816837347, 'sideways_atr_min_pct': 0.004330288360947802, 'sideways_atr_max_pct': 0.10123684170403362, 'sideways_tp_mult': 1.5602241361580882, 'sideways_tsl_mult': 0.9989345723554937, 'sideways_time_stop': 159, 'sideways_use_sma': False, 'sideways_use_ema': True, 'sideways_use_atr': True, 'sideways_use_adx': True, 'sideways_use_spike': True, 'sideways_rsi_required': True}.
[I 2025-09-01 05:19:41,287] Trial 446 finished with values: [-0.03850097572242028, 0.03841479614370985] and parameters: {'p_sma': 59, 'p_std': 27, 'p_atr': 7, 'p_adx': 17, 'rsi_period': 53, 'ema1': 23, 'ema2': 34, 'slip_atr_k': 0.02382596394898482, 'slip_spread_k': 0.40879262652130244, 'spread_hl_frac': 0.04952359106449494, 'bb_std_mult': 2.1573529897006916, 'rsi_os': 27, 'rsi_ob': 90, 'vol_spike': 0.2018816130971344, 'adx_thresh': 12.444660674981172, 'atr_min_pct': 0.003823952095194776, 'atr_max_pct': 0.12694318307088495, 'tp_mult': 2.4061173308304857, 'tsl_mult': 0.9236155919429738, 'strategy': 'breakout', 'time_stop': 177, 'use_sma': False, 'use_atr': True, 'use_adx': False, 'use_ema': True, 'use_spike': True, 'rsi_required': False, 'edge_k': 0.13736243319988756, 'edge_cap': 0.5301018888691493, 'bull_strategy': 'breakout', 'bull_bb_std_mult': 0.8990171910746753, 'bull_rsi_os': 49, 'bull_rsi_ob': 90, 'bull_adx_thresh': 5.610382259953853, 'bull_atr_min_pct': 0.011971522044975678, 'bull_atr_max_pct': 0.0969527401943983, 'bull_tp_mult': 1.2172265247077472, 'bull_tsl_mult': 0.16681939996509573, 'bull_time_stop': 80, 'bull_use_sma': False, 'bull_use_ema': False, 'bull_use_atr': False, 'bull_use_adx': True, 'bull_use_spike': False, 'bull_rsi_required': True, 'bear_strategy': 'breakout', 'bear_bb_std_mult': 3.509536768875714, 'bear_rsi_os': 7, 'bear_rsi_ob': 70, 'bear_adx_thresh': 30.154721100616324, 'bear_atr_min_pct': 0.007541013070122462, 'bear_atr_max_pct': 0.07276171980255158, 'bear_tp_mult': 1.3320945885477047, 'bear_tsl_mult': 0.6754421119050926, 'bear_time_stop': 185, 'bear_use_sma': False, 'bear_use_ema': False, 'bear_use_atr': False, 'bear_use_adx': False, 'bear_use_spike': False, 'bear_rsi_required': False, 'sideways_strategy': 'breakout', 'sideways_bb_std_mult': 0.5560984382119761, 'sideways_rsi_os': 45, 'sideways_rsi_ob': 52, 'sideways_adx_thresh': 23.03146041344124, 'sideways_atr_min_pct': 0.0030988953076545437, 'sideways_atr_max_pct': 0.1016416811175883, 'sideways_tp_mult': 1.5837356615430085, 'sideways_tsl_mult': 0.9969342192715114, 'sideways_time_stop': 159, 'sideways_use_sma': False, 'sideways_use_ema': True, 'sideways_use_atr': True, 'sideways_use_adx': True, 'sideways_use_spike': True, 'sideways_rsi_required': True}.
[I 2025-09-01 05:19:41,812] Trial 448 finished with values: [-0.014155668056073378, 0.014298220166445538] and parameters: {'p_sma': 59, 'p_std': 30, 'p_atr': 7, 'p_adx': 17, 'rsi_period': 52, 'ema1': 23, 'ema2': 33, 'slip_atr_k': 0.026091477795257847, 'slip_spread_k': 0.4069915581462439, 'spread_hl_frac': 0.04987118581585008, 'bb_std_mult': 2.141854706603474, 'rsi_os': 27, 'rsi_ob': 90, 'vol_spike': 0.20037864874794464, 'adx_thresh': 12.684259143711142, 'atr_min_pct': 0.0036121875254422225, 'atr_max_pct': 0.12762208097980784, 'tp_mult': 2.414952063408493, 'tsl_mult': 0.9151216377673962, 'strategy': 'breakout', 'time_stop': 181, 'use_sma': False, 'use_atr': True, 'use_adx': False, 'use_ema': True, 'use_spike': True, 'rsi_required': False, 'edge_k': 0.17345766815320965, 'edge_cap': 0.5317249274935473, 'bull_strategy': 'breakout', 'bull_bb_std_mult': 0.8918208281006275, 'bull_rsi_os': 49, 'bull_rsi_ob': 60, 'bull_adx_thresh': 6.094516690634986, 'bull_atr_min_pct': 0.0121358282367264, 'bull_atr_max_pct': 0.10320262828978712, 'bull_tp_mult': 1.2949052678762345, 'bull_tsl_mult': 0.1656942402571176, 'bull_time_stop': 96, 'bull_use_sma': True, 'bull_use_ema': False, 'bull_use_atr': False, 'bull_use_adx': True, 'bull_use_spike': True, 'bull_rsi_required': True, 'bear_strategy': 'breakout', 'bear_bb_std_mult': 3.4820621294677103, 'bear_rsi_os': 7, 'bear_rsi_ob': 70, 'bear_adx_thresh': 30.071685425540068, 'bear_atr_min_pct': 0.0075268194223837605, 'bear_atr_max_pct': 0.07276767565550525, 'bear_tp_mult': 1.3433766791454684, 'bear_tsl_mult': 0.6624938870828071, 'bear_time_stop': 187, 'bear_use_sma': False, 'bear_use_ema': False, 'bear_use_atr': False, 'bear_use_adx': False, 'bear_use_spike': True, 'bear_rsi_required': False, 'sideways_strategy': 'breakout', 'sideways_bb_std_mult': 0.5299181806968698, 'sideways_rsi_os': 44, 'sideways_rsi_ob': 52, 'sideways_adx_thresh': 23.006798065942107, 'sideways_atr_min_pct': 0.00442952347199657, 'sideways_atr_max_pct': 0.10079309414574808, 'sideways_tp_mult': 1.560037624818619, 'sideways_tsl_mult': 0.9982794441964266, 'sideways_time_stop': 157, 'sideways_use_sma': False, 'sideways_use_ema': True, 'sideways_use_atr': True, 'sideways_use_adx': False, 'sideways_use_spike': True, 'sideways_rsi_required': True}.
[I 2025-09-01 05:19:42,145] Trial 449 finished with values: [-0.013663523281324697, 0.013611780130213028] and parameters: {'p_sma': 59, 'p_std': 32, 'p_atr': 7, 'p_adx': 17, 'rsi_period': 53, 'ema1': 23, 'ema2': 34, 'slip_atr_k': 0.02838784179909014, 'slip_spread_k': 0.4085974894919404, 'spread_hl_frac': 0.04908183054068103, 'bb_std_mult': 2.1455099512625604, 'rsi_os': 26, 'rsi_ob': 90, 'vol_spike': 0.20037994868261583, 'adx_thresh': 11.859180805370928, 'atr_min_pct': 0.00374720641913749, 'atr_max_pct': 0.12496690414528151, 'tp_mult': 2.4006020900278613, 'tsl_mult': 0.9194334115827923, 'strategy': 'breakout', 'time_stop': 206, 'use_sma': False, 'use_atr': True, 'use_adx': False, 'use_ema': True, 'use_spike': True, 'rsi_required': False, 'edge_k': 0.15564965046310508, 'edge_cap': 0.9950826160173829, 'bull_strategy': 'breakout', 'bull_bb_std_mult': 0.8905088812214847, 'bull_rsi_os': 49, 'bull_rsi_ob': 90, 'bull_adx_thresh': 5.674837088544447, 'bull_atr_min_pct': 0.013465349581905543, 'bull_atr_max_pct': 0.10417271967132682, 'bull_tp_mult': 1.2498464346867857, 'bull_tsl_mult': 0.19232392420824346, 'bull_time_stop': 102, 'bull_use_sma': True, 'bull_use_ema': False, 'bull_use_atr': False, 'bull_use_adx': True, 'bull_use_spike': True, 'bull_rsi_required': True, 'bear_strategy': 'breakout', 'bear_bb_std_mult': 3.5978290169962266, 'bear_rsi_os': 7, 'bear_rsi_ob': 69, 'bear_adx_thresh': 30.189681047720654, 'bear_atr_min_pct': 0.007766543502378636, 'bear_atr_max_pct': 0.07336256439729807, 'bear_tp_mult': 1.3271531291640397, 'bear_tsl_mult': 0.6871305777984181, 'bear_time_stop': 191, 'bear_use_sma': False, 'bear_use_ema': False, 'bear_use_atr': False, 'bear_use_adx': False, 'bear_use_spike': True, 'bear_rsi_required': False, 'sideways_strategy': 'breakout', 'sideways_bb_std_mult': 0.6107185882317231, 'sideways_rsi_os': 45, 'sideways_rsi_ob': 52, 'sideways_adx_thresh': 22.873466615386562, 'sideways_atr_min_pct': 0.004481470629372635, 'sideways_atr_max_pct': 0.10133314830758548, 'sideways_tp_mult': 1.58674820840622, 'sideways_tsl_mult': 0.9916992174368814, 'sideways_time_stop': 156, 'sideways_use_sma': False, 'sideways_use_ema': True, 'sideways_use_atr': True, 'sideways_use_adx': False, 'sideways_use_spike': True, 'sideways_rsi_required': True}.
[I 2025-09-01 05:19:42,369] Trial 447 finished with values: [-0.016521773323345923, 0.01666295064227892] and parameters: {'p_sma': 59, 'p_std': 27, 'p_atr': 7, 'p_adx': 17, 'rsi_period': 53, 'ema1': 23, 'ema2': 34, 'slip_atr_k': 0.028514973182221598, 'slip_spread_k': 0.40781755220644184, 'spread_hl_frac': 0.049647793725601436, 'bb_std_mult': 2.1715907023597913, 'rsi_os': 26, 'rsi_ob': 90, 'vol_spike': 0.20134721148832802, 'adx_thresh': 12.558811133602921, 'atr_min_pct': 0.003814325730800953, 'atr_max_pct': 0.12675097365532614, 'tp_mult': 2.41395765050938, 'tsl_mult': 0.9113925800655469, 'strategy': 'breakout', 'time_stop': 182, 'use_sma': False, 'use_atr': True, 'use_adx': False, 'use_ema': True, 'use_spike': True, 'rsi_required': False, 'edge_k': 0.15560951811035173, 'edge_cap': 0.5277278477018547, 'bull_strategy': 'breakout', 'bull_bb_std_mult': 0.8910083871498801, 'bull_rsi_os': 49, 'bull_rsi_ob': 87, 'bull_adx_thresh': 5.393946074477864, 'bull_atr_min_pct': 0.012085967399932559, 'bull_atr_max_pct': 0.0946444649016552, 'bull_tp_mult': 1.206930623348726, 'bull_tsl_mult': 0.15531666975339417, 'bull_time_stop': 97, 'bull_use_sma': True, 'bull_use_ema': False, 'bull_use_atr': False, 'bull_use_adx': True, 'bull_use_spike': False, 'bull_rsi_required': True, 'bear_strategy': 'breakout', 'bear_bb_std_mult': 3.4817507828405514, 'bear_rsi_os': 7, 'bear_rsi_ob': 70, 'bear_adx_thresh': 29.85544729008912, 'bear_atr_min_pct': 0.007459812935173808, 'bear_atr_max_pct': 0.07245726630896973, 'bear_tp_mult': 1.3428403490756708, 'bear_tsl_mult': 0.6825245054372001, 'bear_time_stop': 189, 'bear_use_sma': False, 'bear_use_ema': False, 'bear_use_atr': False, 'bear_use_adx': False, 'bear_use_spike': False, 'bear_rsi_required': False, 'sideways_strategy': 'breakout', 'sideways_bb_std_mult': 0.5276928758871805, 'sideways_rsi_os': 45, 'sideways_rsi_ob': 52, 'sideways_adx_thresh': 23.14275962700794, 'sideways_atr_min_pct': 0.0042856016127907435, 'sideways_atr_max_pct': 0.10132853973192953, 'sideways_tp_mult': 1.5917806375761514, 'sideways_tsl_mult': 0.9987047415268798, 'sideways_time_stop': 158, 'sideways_use_sma': False, 'sideways_use_ema': True, 'sideways_use_atr': True, 'sideways_use_adx': False, 'sideways_use_spike': True, 'sideways_rsi_required': True}.
