[I 2025-09-01 04:48:49,894] Trial 269 finished with values: [-0.02009285567322039, 0.020403122121287132] and parameters: {'p_sma': 14, 'p_std': 42, 'p_atr': 13, 'p_adx': 15, 'rsi_period': 15, 'ema1': 30, 'ema2': 32, 'slip_atr_k': 1.783154340827454e-05, 'slip_spread_k': 0.3581254179242238, 'spread_hl_frac': 0.006932836133706134, 'bb_std_mult': 0.8365163184906241, 'rsi_os': 47, 'rsi_ob': 54, 'vol_spike': 0.23413938134061427, 'adx_thresh': 19.52550658622801, 'atr_min_pct': 0.004620948334937008, 'atr_max_pct': 0.04482672438470672, 'tp_mult': 2.004622688308827, 'tsl_mult': 0.9201858609387387, 'strategy': 'breakout', 'time_stop': 22, 'use_sma': True, 'use_atr': False, 'use_adx': False, 'use_ema': True, 'use_spike': True, 'rsi_required': True, 'edge_k': 1.6179192799042788, 'edge_cap': 0.13672543465399203, 'bull_strategy': 'mean_reversion', 'bull_bb_std_mult': 1.9868421078587388, 'bull_rsi_os': 13, 'bull_rsi_ob': 93, 'bull_adx_thresh': 18.75954468844726, 'bull_atr_min_pct': 0.0010229845007345812, 'bull_atr_max_pct': 0.12543036846546057, 'bull_tp_mult': 1.6616179609021893, 'bull_tsl_mult': 0.8146518047863577, 'bull_time_stop': 213, 'bull_use_sma': False, 'bull_use_ema': False, 'bull_use_atr': True, 'bull_use_adx': False, 'bull_use_spike': False, 'bull_rsi_required': False, 'bear_strategy': 'mean_reversion', 'bear_bb_std_mult': 1.0325992479444637, 'bear_rsi_os': 48, 'bear_rsi_ob': 59, 'bear_adx_thresh': 13.197081584243952, 'bear_atr_min_pct': 0.004955332424990319, 'bear_atr_max_pct': 0.06978994688949464, 'bear_tp_mult': 1.0593317788437258, 'bear_tsl_mult': 0.12370624477336829, 'bear_time_stop': 121, 'bear_use_sma': False, 'bear_use_ema': False, 'bear_use_atr': False, 'bear_use_adx': False, 'bear_use_spike': False, 'bear_rsi_required': True, 'sideways_strategy': 'mean_reversion', 'sideways_bb_std_mult': 1.5528377258559232, 'sideways_rsi_os': 7, 'sideways_rsi_ob': 82, 'sideways_adx_thresh': 6.553374334233833, 'sideways_atr_min_pct': 0.024749180271385236, 'sideways_atr_max_pct': 0.10129213627318183, 'sideways_tp_mult': 2.773759463768311, 'sideways_tsl_mult': 0.9607106125837013, 'sideways_time_stop': 164, 'sideways_use_sma': True, 'sideways_use_ema': True, 'sideways_use_atr': False, 'sideways_use_adx': True, 'sideways_use_spike': False, 'sideways_rsi_required': False}.
[I 2025-09-01 04:48:50,186] Trial 268 finished with values: [-0.034228127537443975, 0.03405190934629259] and parameters: {'p_sma': 44, 'p_std': 36, 'p_atr': 8, 'p_adx': 19, 'rsi_period': 19, 'ema1': 30, 'ema2': 31, 'slip_atr_k': 7.860793829968486e-05, 'slip_spread_k': 0.0524302121809333, 'spread_hl_frac': 0.029191910102590653, 'bb_std_mult': 2.952492268247159, 'rsi_os': 8, 'rsi_ob': 56, 'vol_spike': 0.13228852558301424, 'adx_thresh': 19.469165963361792, 'atr_min_pct': 0.0025914675632685265, 'atr_max_pct': 0.1132449057491629, 'tp_mult': 1.6880429119960754, 'tsl_mult': 0.9232777552168628, 'strategy': 'breakout', 'time_stop': 9, 'use_sma': True, 'use_atr': False, 'use_adx': True, 'use_ema': True, 'use_spike': True, 'rsi_required': True, 'edge_k': 1.3742226843494696, 'edge_cap': 0.6041697192609201, 'bull_strategy': 'mean_reversion', 'bull_bb_std_mult': 1.9879499704017456, 'bull_rsi_os': 15, 'bull_rsi_ob': 93, 'bull_adx_thresh': 18.564694947632056, 'bull_atr_min_pct': 0.0012052022131836253, 'bull_atr_max_pct': 0.03296959668451318, 'bull_tp_mult': 1.9730308835222448, 'bull_tsl_mult': 0.8091589756973231, 'bull_time_stop': 198, 'bull_use_sma': False, 'bull_use_ema': False, 'bull_use_atr': True, 'bull_use_adx': False, 'bull_use_spike': True, 'bull_rsi_required': False, 'bear_strategy': 'mean_reversion', 'bear_bb_std_mult': 1.1397674511127265, 'bear_rsi_os': 48, 'bear_rsi_ob': 88, 'bear_adx_thresh': 14.272271421366316, 'bear_atr_min_pct': 0.0021552130203049795, 'bear_atr_max_pct': 0.13950653120416331, 'bear_tp_mult': 2.463650860032344, 'bear_tsl_mult': 0.1259984991912062, 'bear_time_stop': 204, 'bear_use_sma': False, 'bear_use_ema': False, 'bear_use_atr': False, 'bear_use_adx': False, 'bear_use_spike': True, 'bear_rsi_required': True, 'sideways_strategy': 'mean_reversion', 'sideways_bb_std_mult': 1.5798996717649376, 'sideways_rsi_os': 23, 'sideways_rsi_ob': 76, 'sideways_adx_thresh': 19.12568074743094, 'sideways_atr_min_pct': 0.027339788896735287, 'sideways_atr_max_pct': 0.10099842711937337, 'sideways_tp_mult': 1.8010288172379978, 'sideways_tsl_mult': 0.9584425836153334, 'sideways_time_stop': 282, 'sideways_use_sma': True, 'sideways_use_ema': True, 'sideways_use_atr': False, 'sideways_use_adx': True, 'sideways_use_spike': False, 'sideways_rsi_required': False}.
[I 2025-09-01 04:49:32,315] Trial 274 finished with values: [-0.029583699704734845, 0.029436368699785765] and parameters: {'p_sma': 30, 'p_std': 42, 'p_atr': 28, 'p_adx': 28, 'rsi_period': 65, 'ema1': 30, 'ema2': 24, 'slip_atr_k': 7.436325503120546e-05, 'slip_spread_k': 0.275830042680447, 'spread_hl_frac': 0.04138051629143058, 'bb_std_mult': 1.0443952034365998, 'rsi_os': 31, 'rsi_ob': 51, 'vol_spike': 0.23390012513158523, 'adx_thresh': 16.067556830405767, 'atr_min_pct': 0.004648862293664256, 'atr_max_pct': 0.11899100184936415, 'tp_mult': 2.1680523334681348, 'tsl_mult': 0.37124932908006664, 'strategy': 'breakout', 'time_stop': 81, 'use_sma': False, 'use_atr': False, 'use_adx': False, 'use_ema': True, 'use_spike': True, 'rsi_required': False, 'edge_k': 0.6934871991391109, 'edge_cap': 0.46085628025896674, 'bull_strategy': 'mean_reversion', 'bull_bb_std_mult': 2.285900818378616, 'bull_rsi_os': 15, 'bull_rsi_ob': 89, 'bull_adx_thresh': 9.23397394641387, 'bull_atr_min_pct': 0.0008693979351000423, 'bull_atr_max_pct': 0.05694290234134765, 'bull_tp_mult': 1.6871838325760797, 'bull_tsl_mult': 0.3180776768588937, 'bull_time_stop': 212, 'bull_use_sma': True, 'bull_use_ema': False, 'bull_use_atr': True, 'bull_use_adx': False, 'bull_use_spike': False, 'bull_rsi_required': False, 'bear_strategy': 'mean_reversion', 'bear_bb_std_mult': 1.0276993534232834, 'bear_rsi_os': 32, 'bear_rsi_ob': 55, 'bear_adx_thresh': 29.448779718236253, 'bear_atr_min_pct': 0.02015018679771114, 'bear_atr_max_pct': 0.14725117540356264, 'bear_tp_mult': 2.7844866423946026, 'bear_tsl_mult': 0.17300929539052773, 'bear_time_stop': 203, 'bear_use_sma': True, 'bear_use_ema': False, 'bear_use_atr': True, 'bear_use_adx': True, 'bear_use_spike': False, 'bear_rsi_required': False, 'sideways_strategy': 'breakout', 'sideways_bb_std_mult': 1.351031334469665, 'sideways_rsi_os': 7, 'sideways_rsi_ob': 73, 'sideways_adx_thresh': 16.79859370449372, 'sideways_atr_min_pct': 0.024967271539296353, 'sideways_atr_max_pct': 0.09653579736164825, 'sideways_tp_mult': 1.7398745250547218, 'sideways_tsl_mult': 0.9804854980052452, 'sideways_time_stop': 184, 'sideways_use_sma': True, 'sideways_use_ema': True, 'sideways_use_atr': False, 'sideways_use_adx': False, 'sideways_use_spike': False, 'sideways_rsi_required': False}.
[I 2025-09-01 04:49:32,914] Trial 275 finished with values: [-1000000000.0, 1000000000.0] and parameters: {'p_sma': 20, 'p_std': 44, 'p_atr': 30, 'p_adx': 17, 'rsi_period': 62, 'ema1': 28, 'ema2': 24, 'slip_atr_k': 0.17384596646258713, 'slip_spread_k': 0.2761010450774166, 'spread_hl_frac': 0.02255046335280231, 'bb_std_mult': 1.3141676710317136, 'rsi_os': 31, 'rsi_ob': 46, 'vol_spike': 0.240194546637822, 'adx_thresh': 14.26882917752329, 'atr_min_pct': 0.0015611719047568195, 'atr_max_pct': 0.047919815769735266, 'tp_mult': 2.512148171164905, 'tsl_mult': 0.9974033336134744, 'strategy': 'breakout', 'time_stop': 23, 'use_sma': False, 'use_atr': False, 'use_adx': False, 'use_ema': True, 'use_spike': True, 'rsi_required': False, 'edge_k': 0.8149526591691765, 'edge_cap': 0.8283661397697301, 'bull_strategy': 'mean_reversion', 'bull_bb_std_mult': 2.280862699207711, 'bull_rsi_os': 13, 'bull_rsi_ob': 89, 'bull_adx_thresh': 23.125107252426048, 'bull_atr_min_pct': 0.02526312736738713, 'bull_atr_max_pct': 0.10719471720858226, 'bull_tp_mult': 1.752350764980838, 'bull_tsl_mult': 0.3090307882091421, 'bull_time_stop': 214, 'bull_use_sma': True, 'bull_use_ema': False, 'bull_use_atr': True, 'bull_use_adx': False, 'bull_use_spike': False, 'bull_rsi_required': False, 'bear_strategy': 'mean_reversion', 'bear_bb_std_mult': 1.0267473110214962, 'bear_rsi_os': 45, 'bear_rsi_ob': 55, 'bear_adx_thresh': 15.299460355525177, 'bear_atr_min_pct': 0.028389927468693843, 'bear_atr_max_pct': 0.09661152485585801, 'bear_tp_mult': 2.116213986468241, 'bear_tsl_mult': 0.5462454846719105, 'bear_time_stop': 50, 'bear_use_sma': True, 'bear_use_ema': False, 'bear_use_atr': True, 'bear_use_adx': True, 'bear_use_spike': False, 'bear_rsi_required': False, 'sideways_strategy': 'breakout', 'sideways_bb_std_mult': 1.374220275681924, 'sideways_rsi_os': 7, 'sideways_rsi_ob': 79, 'sideways_adx_thresh': 16.67971710836474, 'sideways_atr_min_pct': 0.02464550001987835, 'sideways_atr_max_pct': 0.09743502173445703, 'sideways_tp_mult': 1.3110967833941771, 'sideways_tsl_mult': 0.9858551896303982, 'sideways_time_stop': 74, 'sideways_use_sma': False, 'sideways_use_ema': True, 'sideways_use_atr': False, 'sideways_use_adx': False, 'sideways_use_spike': False, 'sideways_rsi_required': False}.
[I 2025-09-01 04:49:33,142] Trial 273 finished with values: [-0.03394741827289949, 0.034200786810572606] and parameters: {'p_sma': 44, 'p_std': 42, 'p_atr': 27, 'p_adx': 22, 'rsi_period': 15, 'ema1': 30, 'ema2': 24, 'slip_atr_k': 0.042121996690099944, 'slip_spread_k': 0.281164081155166, 'spread_hl_frac': 0.0062180602590880055, 'bb_std_mult': 0.9163797498125632, 'rsi_os': 46, 'rsi_ob': 56, 'vol_spike': 0.2348573437863305, 'adx_thresh': 14.316816949259769, 'atr_min_pct': 0.004309059697652216, 'atr_max_pct': 0.0736591772827065, 'tp_mult': 1.3093168382993594, 'tsl_mult': 0.9228272578454355, 'strategy': 'breakout', 'time_stop': 10, 'use_sma': False, 'use_atr': False, 'use_adx': False, 'use_ema': True, 'use_spike': True, 'rsi_required': False, 'edge_k': 0.7112471367592889, 'edge_cap': 0.16189061563611062, 'bull_strategy': 'breakout', 'bull_bb_std_mult': 2.588866023169833, 'bull_rsi_os': 27, 'bull_rsi_ob': 74, 'bull_adx_thresh': 18.874814881824296, 'bull_atr_min_pct': 0.017738069608742378, 'bull_atr_max_pct': 0.03232278259890433, 'bull_tp_mult': 1.7589514756672364, 'bull_tsl_mult': 0.8757984936935653, 'bull_time_stop': 214, 'bull_use_sma': True, 'bull_use_ema': False, 'bull_use_atr': False, 'bull_use_adx': False, 'bull_use_spike': False, 'bull_rsi_required': True, 'bear_strategy': 'mean_reversion', 'bear_bb_std_mult': 2.405379646509717, 'bear_rsi_os': 31, 'bear_rsi_ob': 55, 'bear_adx_thresh': 24.770615675719167, 'bear_atr_min_pct': 0.0021829252971703617, 'bear_atr_max_pct': 0.14715843988510244, 'bear_tp_mult': 1.0533182163240828, 'bear_tsl_mult': 0.5372677814739047, 'bear_time_stop': 120, 'bear_use_sma': True, 'bear_use_ema': False, 'bear_use_atr': True, 'bear_use_adx': True, 'bear_use_spike': False, 'bear_rsi_required': False, 'sideways_strategy': 'breakout', 'sideways_bb_std_mult': 1.3652240683775314, 'sideways_rsi_os': 34, 'sideways_rsi_ob': 79, 'sideways_adx_thresh': 16.65425932983826, 'sideways_atr_min_pct': 0.018978650829166565, 'sideways_atr_max_pct': 0.05604596288170823, 'sideways_tp_mult': 1.2047084146898126, 'sideways_tsl_mult': 0.9862222451249487, 'sideways_time_stop': 183, 'sideways_use_sma': True, 'sideways_use_ema': True, 'sideways_use_atr': False, 'sideways_use_adx': False, 'sideways_use_spike': True, 'sideways_rsi_required': False}.
[I 2025-09-01 04:49:33,538] Trial 272 finished with values: [-1000000000.0, 1000000000.0] and parameters: {'p_sma': 14, 'p_std': 42, 'p_atr': 27, 'p_adx': 22, 'rsi_period': 14, 'ema1': 17, 'ema2': 31, 'slip_atr_k': 0.0017502390908696935, 'slip_spread_k': 0.2850975630678087, 'spread_hl_frac': 0.04998070085662005, 'bb_std_mult': 1.3285532700791465, 'rsi_os': 43, 'rsi_ob': 56, 'vol_spike': 0.23811837622635412, 'adx_thresh': 14.33326637715789, 'atr_min_pct': 0.001504410641907577, 'atr_max_pct': 0.04885230466964174, 'tp_mult': 1.8937252098757469, 'tsl_mult': 0.922938508639685, 'strategy': 'breakout', 'time_stop': 80, 'use_sma': False, 'use_atr': False, 'use_adx': True, 'use_ema': True, 'use_spike': True, 'rsi_required': True, 'edge_k': 1.8755573244491235, 'edge_cap': 0.161478114407634, 'bull_strategy': 'mean_reversion', 'bull_bb_std_mult': 2.294563618816872, 'bull_rsi_os': 40, 'bull_rsi_ob': 60, 'bull_adx_thresh': 18.599260359603424, 'bull_atr_min_pct': 0.0009710511551374299, 'bull_atr_max_pct': 0.13247939319948016, 'bull_tp_mult': 2.596835683380448, 'bull_tsl_mult': 0.37331367277321376, 'bull_time_stop': 88, 'bull_use_sma': False, 'bull_use_ema': False, 'bull_use_atr': True, 'bull_use_adx': False, 'bull_use_spike': True, 'bull_rsi_required': False, 'bear_strategy': 'mean_reversion', 'bear_bb_std_mult': 1.023768727275241, 'bear_rsi_os': 35, 'bear_rsi_ob': 55, 'bear_adx_thresh': 29.785235170064833, 'bear_atr_min_pct': 0.0049252183486060645, 'bear_atr_max_pct': 0.1472069045092261, 'bear_tp_mult': 2.246949985254925, 'bear_tsl_mult': 0.5435076751303326, 'bear_time_stop': 212, 'bear_use_sma': False, 'bear_use_ema': True, 'bear_use_atr': False, 'bear_use_adx': False, 'bear_use_spike': True, 'bear_rsi_required': True, 'sideways_strategy': 'mean_reversion', 'sideways_bb_std_mult': 1.3744517625410015, 'sideways_rsi_os': 7, 'sideways_rsi_ob': 70, 'sideways_adx_thresh': 16.698088793897682, 'sideways_atr_min_pct': 0.024681084638900428, 'sideways_atr_max_pct': 0.09800447425426832, 'sideways_tp_mult': 2.7407672117017117, 'sideways_tsl_mult': 0.9809452347950885, 'sideways_time_stop': 183, 'sideways_use_sma': False, 'sideways_use_ema': True, 'sideways_use_atr': False, 'sideways_use_adx': True, 'sideways_use_spike': False, 'sideways_rsi_required': False}.
[I 2025-09-01 04:49:34,475] Trial 276 finished with values: [-1000000000.0, 1000000000.0] and parameters: {'p_sma': 41, 'p_std': 44, 'p_atr': 27, 'p_adx': 19, 'rsi_period': 82, 'ema1': 18, 'ema2': 32, 'slip_atr_k': 0.016661681791086944, 'slip_spread_k': 0.946130699087635, 'spread_hl_frac': 0.043679877200599904, 'bb_std_mult': 0.8277367343233536, 'rsi_os': 54, 'rsi_ob': 54, 'vol_spike': 0.02666678687773011, 'adx_thresh': 7.80592743154871, 'atr_min_pct': 0.0014642652693044613, 'atr_max_pct': 0.11773038722003615, 'tp_mult': 1.9952622912645452, 'tsl_mult': 0.6582702968931428, 'strategy': 'mean_reversion', 'time_stop': 137, 'use_sma': False, 'use_atr': False, 'use_adx': False, 'use_ema': True, 'use_spike': True, 'rsi_required': False, 'edge_k': 0.6522567879753052, 'edge_cap': 0.8326781356275625, 'bull_strategy': 'mean_reversion', 'bull_bb_std_mult': 2.5843400625423962, 'bull_rsi_os': 27, 'bull_rsi_ob': 88, 'bull_adx_thresh': 20.095852408200177, 'bull_atr_min_pct': 0.01786298207893422, 'bull_atr_max_pct': 0.1066562540169557, 'bull_tp_mult': 2.816268340659609, 'bull_tsl_mult': 0.2717947741163821, 'bull_time_stop': 270, 'bull_use_sma': True, 'bull_use_ema': False, 'bull_use_atr': False, 'bull_use_adx': False, 'bull_use_spike': False, 'bull_rsi_required': True, 'bear_strategy': 'mean_reversion', 'bear_bb_std_mult': 2.6515700581401656, 'bear_rsi_os': 45, 'bear_rsi_ob': 57, 'bear_adx_thresh': 24.94266020174205, 'bear_atr_min_pct': 0.02756161834423367, 'bear_atr_max_pct': 0.018725080314640534, 'bear_tp_mult': 1.1257040989666185, 'bear_tsl_mult': 0.10239259890284183, 'bear_time_stop': 52, 'bear_use_sma': True, 'bear_use_ema': False, 'bear_use_atr': True, 'bear_use_adx': True, 'bear_use_spike': False, 'bear_rsi_required': False, 'sideways_strategy': 'mean_reversion', 'sideways_bb_std_mult': 2.536644799469019, 'sideways_rsi_os': 34, 'sideways_rsi_ob': 79, 'sideways_adx_thresh': 16.49213408759523, 'sideways_atr_min_pct': 0.019139288508889435, 'sideways_atr_max_pct': 0.09073795454375959, 'sideways_tp_mult': 2.445714032182529, 'sideways_tsl_mult': 0.9405105899976444, 'sideways_time_stop': 178, 'sideways_use_sma': False, 'sideways_use_ema': True, 'sideways_use_atr': False, 'sideways_use_adx': False, 'sideways_use_spike': False, 'sideways_rsi_required': False}.
[I 2025-09-01 04:49:34,789] Trial 280 finished with values: [-1000000000.0, 1000000000.0] and parameters: {'p_sma': 17, 'p_std': 59, 'p_atr': 25, 'p_adx': 25, 'rsi_period': 59, 'ema1': 29, 'ema2': 52, 'slip_atr_k': 0.007904249798872307, 'slip_spread_k': 0.6092425579964963, 'spread_hl_frac': 0.020406066440489007, 'bb_std_mult': 1.4944384509130229, 'rsi_os': 51, 'rsi_ob': 58, 'vol_spike': 0.25032166936736383, 'adx_thresh': 15.364392383745068, 'atr_min_pct': 0.0005183325742686321, 'atr_max_pct': 0.1056214775142034, 'tp_mult': 1.094187692884024, 'tsl_mult': 0.582911014090955, 'strategy': 'mean_reversion', 'time_stop': 163, 'use_sma': True, 'use_atr': True, 'use_adx': False, 'use_ema': False, 'use_spike': False, 'rsi_required': False, 'edge_k': 1.71870598809419, 'edge_cap': 0.09009828889940506, 'bull_strategy': 'breakout', 'bull_bb_std_mult': 2.674193471403462, 'bull_rsi_os': 17, 'bull_rsi_ob': 91, 'bull_adx_thresh': 34.37467311232578, 'bull_atr_min_pct': 0.01179473518413069, 'bull_atr_max_pct': 0.12722105897564492, 'bull_tp_mult': 1.8667990452243657, 'bull_tsl_mult': 0.39954592257038957, 'bull_time_stop': 220, 'bull_use_sma': True, 'bull_use_ema': True, 'bull_use_atr': True, 'bull_use_adx': True, 'bull_use_spike': False, 'bull_rsi_required': False, 'bear_strategy': 'breakout', 'bear_bb_std_mult': 1.7521522182133529, 'bear_rsi_os': 40, 'bear_rsi_ob': 81, 'bear_adx_thresh': 5.940151059252166, 'bear_atr_min_pct': 0.029244811900501454, 'bear_atr_max_pct': 0.02565163193768169, 'bear_tp_mult': 1.010228816228412, 'bear_tsl_mult': 0.1307223630659524, 'bear_time_stop': 110, 'bear_use_sma': True, 'bear_use_ema': False, 'bear_use_atr': True, 'bear_use_adx': True, 'bear_use_spike': False, 'bear_rsi_required': False, 'sideways_strategy': 'mean_reversion', 'sideways_bb_std_mult': 1.4444093823704853, 'sideways_rsi_os': 6, 'sideways_rsi_ob': 85, 'sideways_adx_thresh': 17.72661354550351, 'sideways_atr_min_pct': 0.0230121482561318, 'sideways_atr_max_pct': 0.09323818847674294, 'sideways_tp_mult': 2.822328019717929, 'sideways_tsl_mult': 0.35116835264635793, 'sideways_time_stop': 212, 'sideways_use_sma': True, 'sideways_use_ema': False, 'sideways_use_atr': True, 'sideways_use_adx': False, 'sideways_use_spike': True, 'sideways_rsi_required': False}.
[I 2025-09-01 04:50:14,733] Trial 278 finished with values: [-1000000000.0, 1000000000.0] and parameters: {'p_sma': 42, 'p_std': 44, 'p_atr': 25, 'p_adx': 19, 'rsi_period': 33, 'ema1': 27, 'ema2': 29, 'slip_atr_k': 0.01644519991718859, 'slip_spread_k': 0.17835819177484685, 'spread_hl_frac': 0.04502174775980474, 'bb_std_mult': 2.31836258542156, 'rsi_os': 49, 'rsi_ob': 54, 'vol_spike': 0.24969090233021604, 'adx_thresh': 12.88332910344606, 'atr_min_pct': 0.0005190340147011782, 'atr_max_pct': 0.1096757702958917, 'tp_mult': 1.8874802688472752, 'tsl_mult': 0.6527137679372442, 'strategy': 'mean_reversion', 'time_stop': 22, 'use_sma': True, 'use_atr': False, 'use_adx': False, 'use_ema': False, 'use_spike': True, 'rsi_required': False, 'edge_k': 0.6516110162947766, 'edge_cap': 0.11725543899663587, 'bull_strategy': 'mean_reversion', 'bull_bb_std_mult': 2.338823175635577, 'bull_rsi_os': 40, 'bull_rsi_ob': 88, 'bull_adx_thresh': 19.98500830891932, 'bull_atr_min_pct': 0.0020808047954209525, 'bull_atr_max_pct': 0.1331424415853006, 'bull_tp_mult': 1.8561302354589586, 'bull_tsl_mult': 0.39690488656481004, 'bull_time_stop': 222, 'bull_use_sma': True, 'bull_use_ema': True, 'bull_use_atr': True, 'bull_use_adx': True, 'bull_use_spike': False, 'bull_rsi_required': False, 'bear_strategy': 'breakout', 'bear_bb_std_mult': 2.678189373079443, 'bear_rsi_os': 40, 'bear_rsi_ob': 57, 'bear_adx_thresh': 30.34051936883717, 'bear_atr_min_pct': 0.02743776324059672, 'bear_atr_max_pct': 0.017824887505650915, 'bear_tp_mult': 1.0107481283703281, 'bear_tsl_mult': 0.09906415063832849, 'bear_time_stop': 211, 'bear_use_sma': True, 'bear_use_ema': True, 'bear_use_atr': True, 'bear_use_adx': True, 'bear_use_spike': False, 'bear_rsi_required': False, 'sideways_strategy': 'mean_reversion', 'sideways_bb_std_mult': 0.9810993838064404, 'sideways_rsi_os': 6, 'sideways_rsi_ob': 48, 'sideways_adx_thresh': 10.521637267302166, 'sideways_atr_min_pct': 0.0232288158564497, 'sideways_atr_max_pct': 0.09049809259402417, 'sideways_tp_mult': 1.3648194376316276, 'sideways_tsl_mult': 0.16933624374625333, 'sideways_time_stop': 179, 'sideways_use_sma': True, 'sideways_use_ema': False, 'sideways_use_atr': True, 'sideways_use_adx': False, 'sideways_use_spike': False, 'sideways_rsi_required': False}.
