[I 2025-09-01 05:46:45,409] Trial 596 finished with values: [-1000000000.0, 1000000000.0] and parameters: {'p_sma': 11, 'p_std': 28, 'p_atr': 21, 'p_adx': 19, 'rsi_period': 51, 'ema1': 9, 'ema2': 43, 'slip_atr_k': 0.2315201954504878, 'slip_spread_k': 0.37045416555606353, 'spread_hl_frac': 0.04993673531021883, 'bb_std_mult': 2.1903939008887776, 'rsi_os': 24, 'rsi_ob': 92, 'vol_spike': 0.20958101319315817, 'adx_thresh': 19.929396443291193, 'atr_min_pct': 0.006715249975518074, 'atr_max_pct': 0.12383984602161943, 'tp_mult': 1.7673756018441262, 'tsl_mult': 0.01792204078377141, 'strategy': 'breakout', 'time_stop': 161, 'use_sma': False, 'use_atr': True, 'use_adx': False, 'use_ema': True, 'use_spike': False, 'rsi_required': False, 'edge_k': 1.0544574606104649, 'edge_cap': 0.5275010256121454, 'bull_strategy': 'mean_reversion', 'bull_bb_std_mult': 0.8632139172053389, 'bull_rsi_os': 47, 'bull_rsi_ob': 60, 'bull_adx_thresh': 13.015145559748824, 'bull_atr_min_pct': 0.011915588201864974, 'bull_atr_max_pct': 0.1096407885383222, 'bull_tp_mult': 2.7768351255942045, 'bull_tsl_mult': 0.1408637794669097, 'bull_time_stop': 102, 'bull_use_sma': True, 'bull_use_ema': False, 'bull_use_atr': False, 'bull_use_adx': True, 'bull_use_spike': True, 'bull_rsi_required': True, 'bear_strategy': 'breakout', 'bear_bb_std_mult': 3.490857527106469, 'bear_rsi_os': 6, 'bear_rsi_ob': 75, 'bear_adx_thresh': 30.016195355976052, 'bear_atr_min_pct': 0.011078814966281405, 'bear_atr_max_pct': 0.06894566281613274, 'bear_tp_mult': 1.2462219898909386, 'bear_tsl_mult': 0.6291174314714518, 'bear_time_stop': 214, 'bear_use_sma': False, 'bear_use_ema': True, 'bear_use_atr': False, 'bear_use_adx': False, 'bear_use_spike': True, 'bear_rsi_required': True, 'sideways_strategy': 'mean_reversion', 'sideways_bb_std_mult': 1.9505050823950283, 'sideways_rsi_os': 45, 'sideways_rsi_ob': 54, 'sideways_adx_thresh': 26.814829462675792, 'sideways_atr_min_pct': 0.014543628975566113, 'sideways_atr_max_pct': 0.09609728966687947, 'sideways_tp_mult': 1.5991032461567665, 'sideways_tsl_mult': 0.9669118546794847, 'sideways_time_stop': 150, 'sideways_use_sma': False, 'sideways_use_ema': False, 'sideways_use_atr': True, 'sideways_use_adx': False, 'sideways_use_spike': False, 'sideways_rsi_required': True}.
[I 2025-09-01 05:46:46,778] Trial 593 finished with values: [-1000000000.0, 1000000000.0] and parameters: {'p_sma': 35, 'p_std': 28, 'p_atr': 8, 'p_adx': 19, 'rsi_period': 55, 'ema1': 9, 'ema2': 32, 'slip_atr_k': 0.16693317750960424, 'slip_spread_k': 0.07163237635208741, 'spread_hl_frac': 0.048753841261876416, 'bb_std_mult': 1.2329175540924524, 'rsi_os': 27, 'rsi_ob': 51, 'vol_spike': 0.19931662540714082, 'adx_thresh': 19.54516057820964, 'atr_min_pct': 0.004131040379610224, 'atr_max_pct': 0.12063378541449245, 'tp_mult': 2.5229001940010005, 'tsl_mult': 0.9155021825814127, 'strategy': 'mean_reversion', 'time_stop': 186, 'use_sma': False, 'use_atr': True, 'use_adx': False, 'use_ema': True, 'use_spike': True, 'rsi_required': False, 'edge_k': 0.15878154043638196, 'edge_cap': 0.4144802170344557, 'bull_strategy': 'breakout', 'bull_bb_std_mult': 3.4705563883329544, 'bull_rsi_os': 14, 'bull_rsi_ob': 87, 'bull_adx_thresh': 5.487372158538606, 'bull_atr_min_pct': 0.013205177843668998, 'bull_atr_max_pct': 0.10524156601648775, 'bull_tp_mult': 1.354389496770502, 'bull_tsl_mult': 0.7225288534083578, 'bull_time_stop': 100, 'bull_use_sma': True, 'bull_use_ema': False, 'bull_use_atr': False, 'bull_use_adx': True, 'bull_use_spike': False, 'bull_rsi_required': True, 'bear_strategy': 'breakout', 'bear_bb_std_mult': 3.5007957396216622, 'bear_rsi_os': 18, 'bear_rsi_ob': 66, 'bear_adx_thresh': 31.510173593919035, 'bear_atr_min_pct': 0.0009617445919400149, 'bear_atr_max_pct': 0.12490758962720183, 'bear_tp_mult': 1.6880533367901072, 'bear_tsl_mult': 0.66969027338751, 'bear_time_stop': 296, 'bear_use_sma': True, 'bear_use_ema': False, 'bear_use_atr': False, 'bear_use_adx': False, 'bear_use_spike': False, 'bear_rsi_required': False, 'sideways_strategy': 'breakout', 'sideways_bb_std_mult': 0.7486293926437231, 'sideways_rsi_os': 46, 'sideways_rsi_ob': 56, 'sideways_adx_thresh': 34.65399477776195, 'sideways_atr_min_pct': 0.014787247450848902, 'sideways_atr_max_pct': 0.09514982420922156, 'sideways_tp_mult': 2.297129682479024, 'sideways_tsl_mult': 0.969388480235492, 'sideways_time_stop': 182, 'sideways_use_sma': False, 'sideways_use_ema': True, 'sideways_use_atr': True, 'sideways_use_adx': False, 'sideways_use_spike': True, 'sideways_rsi_required': True}.
[I 2025-09-01 05:46:47,063] Trial 594 finished with values: [-1000000000.0, 1000000000.0] and parameters: {'p_sma': 5, 'p_std': 32, 'p_atr': 7, 'p_adx': 19, 'rsi_period': 51, 'ema1': 24, 'ema2': 32, 'slip_atr_k': 0.12134401933599964, 'slip_spread_k': 0.6720291789310033, 'spread_hl_frac': 0.047061768100942654, 'bb_std_mult': 1.7747408272815444, 'rsi_os': 27, 'rsi_ob': 71, 'vol_spike': 0.19908829852295898, 'adx_thresh': 12.736780097071676, 'atr_min_pct': 0.028627991547101665, 'atr_max_pct': 0.047563893629109205, 'tp_mult': 2.6178597137889716, 'tsl_mult': 0.5419108218251181, 'strategy': 'breakout', 'time_stop': 159, 'use_sma': False, 'use_atr': True, 'use_adx': False, 'use_ema': True, 'use_spike': False, 'rsi_required': False, 'edge_k': 1.51264736710794, 'edge_cap': 0.4155237431382099, 'bull_strategy': 'mean_reversion', 'bull_bb_std_mult': 0.8786255714519917, 'bull_rsi_os': 15, 'bull_rsi_ob': 49, 'bull_adx_thresh': 14.143412152079925, 'bull_atr_min_pct': 0.012930919880959, 'bull_atr_max_pct': 0.09384339525396165, 'bull_tp_mult': 2.670731173633187, 'bull_tsl_mult': 0.1655903980178372, 'bull_time_stop': 155, 'bull_use_sma': True, 'bull_use_ema': False, 'bull_use_atr': False, 'bull_use_adx': True, 'bull_use_spike': True, 'bull_rsi_required': True, 'bear_strategy': 'breakout', 'bear_bb_std_mult': 3.5242867940437965, 'bear_rsi_os': 6, 'bear_rsi_ob': 65, 'bear_adx_thresh': 19.208668438976122, 'bear_atr_min_pct': 0.00848613217245039, 'bear_atr_max_pct': 0.06823160488645252, 'bear_tp_mult': 2.9189200075445907, 'bear_tsl_mult': 0.7215556263038165, 'bear_time_stop': 212, 'bear_use_sma': False, 'bear_use_ema': True, 'bear_use_atr': False, 'bear_use_adx': False, 'bear_use_spike': True, 'bear_rsi_required': True, 'sideways_strategy': 'breakout', 'sideways_bb_std_mult': 0.71886505156311, 'sideways_rsi_os': 46, 'sideways_rsi_ob': 69, 'sideways_adx_thresh': 23.92881324502405, 'sideways_atr_min_pct': 0.004615722062095095, 'sideways_atr_max_pct': 0.09624429133365864, 'sideways_tp_mult': 2.2947037099997925, 'sideways_tsl_mult': 0.08595078688134139, 'sideways_time_stop': 173, 'sideways_use_sma': False, 'sideways_use_ema': True, 'sideways_use_atr': True, 'sideways_use_adx': False, 'sideways_use_spike': False, 'sideways_rsi_required': True}.
[I 2025-09-01 05:47:18,157] Trial 597 finished with values: [-1000000000.0, 1000000000.0] and parameters: {'p_sma': 8, 'p_std': 33, 'p_atr': 7, 'p_adx': 19, 'rsi_period': 46, 'ema1': 25, 'ema2': 30, 'slip_atr_k': 0.05013040630455838, 'slip_spread_k': 0.35103146163034804, 'spread_hl_frac': 0.047507179760891964, 'bb_std_mult': 2.2068141191098856, 'rsi_os': 25, 'rsi_ob': 91, 'vol_spike': 0.10819664790636249, 'adx_thresh': 19.27107881191595, 'atr_min_pct': 0.005003878010072025, 'atr_max_pct': 0.07802266821324087, 'tp_mult': 2.4562837668811714, 'tsl_mult': 0.5461892696074084, 'strategy': 'breakout', 'time_stop': 188, 'use_sma': False, 'use_atr': True, 'use_adx': False, 'use_ema': True, 'use_spike': True, 'rsi_required': False, 'edge_k': 0.9206767976477986, 'edge_cap': 0.6599249367237044, 'bull_strategy': 'breakout', 'bull_bb_std_mult': 0.848421825898502, 'bull_rsi_os': 33, 'bull_rsi_ob': 52, 'bull_adx_thresh': 5.537525147477991, 'bull_atr_min_pct': 0.013054399738149832, 'bull_atr_max_pct': 0.10438252775751326, 'bull_tp_mult': 1.3498883663157815, 'bull_tsl_mult': 0.16058996553286084, 'bull_time_stop': 67, 'bull_use_sma': True, 'bull_use_ema': False, 'bull_use_atr': False, 'bull_use_adx': True, 'bull_use_spike': False, 'bull_rsi_required': True, 'bear_strategy': 'breakout', 'bear_bb_std_mult': 3.464921812145587, 'bear_rsi_os': 6, 'bear_rsi_ob': 68, 'bear_adx_thresh': 30.16407828496239, 'bear_atr_min_pct': 0.010779729146342006, 'bear_atr_max_pct': 0.06800385812034705, 'bear_tp_mult': 2.5151408267442825, 'bear_tsl_mult': 0.062455230080678825, 'bear_time_stop': 204, 'bear_use_sma': False, 'bear_use_ema': False, 'bear_use_atr': False, 'bear_use_adx': False, 'bear_use_spike': False, 'bear_rsi_required': False, 'sideways_strategy': 'breakout', 'sideways_bb_std_mult': 3.0854902707780623, 'sideways_rsi_os': 25, 'sideways_rsi_ob': 55, 'sideways_adx_thresh': 26.823300847557544, 'sideways_atr_min_pct': 0.005331080502218527, 'sideways_atr_max_pct': 0.08037353569657836, 'sideways_tp_mult': 1.6089925932046025, 'sideways_tsl_mult': 0.1859175803217446, 'sideways_time_stop': 210, 'sideways_use_sma': False, 'sideways_use_ema': True, 'sideways_use_atr': True, 'sideways_use_adx': False, 'sideways_use_spike': True, 'sideways_rsi_required': True}.
[I 2025-09-01 05:47:18,609] Trial 598 finished with values: [-1000000000.0, 1000000000.0] and parameters: {'p_sma': 9, 'p_std': 33, 'p_atr': 15, 'p_adx': 14, 'rsi_period': 54, 'ema1': 24, 'ema2': 31, 'slip_atr_k': 0.01403401175398127, 'slip_spread_k': 0.35575167393489465, 'spread_hl_frac': 0.04640488004539919, 'bb_std_mult': 3.092290793684623, 'rsi_os': 36, 'rsi_ob': 87, 'vol_spike': 0.10665431923528615, 'adx_thresh': 12.687290209560029, 'atr_min_pct': 0.028086814447678254, 'atr_max_pct': 0.10036529537802405, 'tp_mult': 2.459852362244899, 'tsl_mult': 0.9649103353180744, 'strategy': 'breakout', 'time_stop': 188, 'use_sma': False, 'use_atr': True, 'use_adx': False, 'use_ema': True, 'use_spike': True, 'rsi_required': False, 'edge_k': 0.16134775953122224, 'edge_cap': 0.41290808912155186, 'bull_strategy': 'breakout', 'bull_bb_std_mult': 0.8934035487543377, 'bull_rsi_os': 50, 'bull_rsi_ob': 82, 'bull_adx_thresh': 6.713399903267989, 'bull_atr_min_pct': 0.013384575934536782, 'bull_atr_max_pct': 0.10481453971445902, 'bull_tp_mult': 1.1762529199305753, 'bull_tsl_mult': 0.16857862545944913, 'bull_time_stop': 90, 'bull_use_sma': True, 'bull_use_ema': False, 'bull_use_atr': False, 'bull_use_adx': True, 'bull_use_spike': False, 'bull_rsi_required': True, 'bear_strategy': 'breakout', 'bear_bb_std_mult': 3.4600568561117395, 'bear_rsi_os': 18, 'bear_rsi_ob': 65, 'bear_adx_thresh': 30.606409969981314, 'bear_atr_min_pct': 0.018229426038689385, 'bear_atr_max_pct': 0.11693965036978576, 'bear_tp_mult': 1.2997740430003533, 'bear_tsl_mult': 0.36570109761701497, 'bear_time_stop': 205, 'bear_use_sma': True, 'bear_use_ema': False, 'bear_use_atr': False, 'bear_use_adx': True, 'bear_use_spike': False, 'bear_rsi_required': False, 'sideways_strategy': 'breakout', 'sideways_bb_std_mult': 0.9202127764566377, 'sideways_rsi_os': 41, 'sideways_rsi_ob': 56, 'sideways_adx_thresh': 22.591913966487883, 'sideways_atr_min_pct': 0.00532366237797645, 'sideways_atr_max_pct': 0.08050601658056479, 'sideways_tp_mult': 1.484360680256194, 'sideways_tsl_mult': 0.0022646670050942563, 'sideways_time_stop': 182, 'sideways_use_sma': False, 'sideways_use_ema': True, 'sideways_use_atr': True, 'sideways_use_adx': False, 'sideways_use_spike': True, 'sideways_rsi_required': True}.
[I 2025-09-01 05:47:18,952] Trial 599 finished with values: [-0.013469803346628395, 0.01464495342116724] and parameters: {'p_sma': 7, 'p_std': 32, 'p_atr': 8, 'p_adx': 14, 'rsi_period': 35, 'ema1': 23, 'ema2': 48, 'slip_atr_k': 0.04977536865268478, 'slip_spread_k': 0.44227069397366814, 'spread_hl_frac': 0.009168537186539712, 'bb_std_mult': 3.0802315388241372, 'rsi_os': 43, 'rsi_ob': 76, 'vol_spike': 0.21339408466888374, 'adx_thresh': 14.753322981897789, 'atr_min_pct': 0.005369330403487792, 'atr_max_pct': 0.0907208034641514, 'tp_mult': 2.4273651393193485, 'tsl_mult': 0.6239269870413666, 'strategy': 'breakout', 'time_stop': 180, 'use_sma': False, 'use_atr': True, 'use_adx': False, 'use_ema': True, 'use_spike': True, 'rsi_required': True, 'edge_k': 0.22559648481845876, 'edge_cap': 0.664215879819883, 'bull_strategy': 'breakout', 'bull_bb_std_mult': 1.7044468235228563, 'bull_rsi_os': 48, 'bull_rsi_ob': 52, 'bull_adx_thresh': 34.99142546638179, 'bull_atr_min_pct': 0.013510698002984316, 'bull_atr_max_pct': 0.11272366508390443, 'bull_tp_mult': 2.4941095820939836, 'bull_tsl_mult': 0.11967565084628452, 'bull_time_stop': 89, 'bull_use_sma': True, 'bull_use_ema': False, 'bull_use_atr': False, 'bull_use_adx': True, 'bull_use_spike': False, 'bull_rsi_required': True, 'bear_strategy': 'breakout', 'bear_bb_std_mult': 3.4398362802841773, 'bear_rsi_os': 55, 'bear_rsi_ob': 91, 'bear_adx_thresh': 28.90814028212199, 'bear_atr_min_pct': 0.005742040012186504, 'bear_atr_max_pct': 0.06168411221093267, 'bear_tp_mult': 1.2888395850031826, 'bear_tsl_mult': 0.2719018947208823, 'bear_time_stop': 118, 'bear_use_sma': True, 'bear_use_ema': False, 'bear_use_atr': True, 'bear_use_adx': True, 'bear_use_spike': False, 'bear_rsi_required': False, 'sideways_strategy': 'breakout', 'sideways_bb_std_mult': 0.5774192814536946, 'sideways_rsi_os': 41, 'sideways_rsi_ob': 53, 'sideways_adx_thresh': 23.20266507904674, 'sideways_atr_min_pct': 0.0030689917501280743, 'sideways_atr_max_pct': 0.10074556734486595, 'sideways_tp_mult': 1.4926828942818857, 'sideways_tsl_mult': 0.18271891607850504, 'sideways_time_stop': 211, 'sideways_use_sma': False, 'sideways_use_ema': True, 'sideways_use_atr': True, 'sideways_use_adx': False, 'sideways_use_spike': True, 'sideways_rsi_required': True}.
Starting optimization (600 trials, n_jobs=4) | multi-objective=True
Saved trials CSV -> runs/REAL_FUT_SHORT_US_EU_ret/h0-1-2-3_r0.03_s912/trials_metrics.csv
Saved Pareto plot -> runs/REAL_FUT_SHORT_US_EU_ret/h0-1-2-3_r0.03_s912/pareto_return_vs_drawdown.png
Top-K under DD cap: [550] (agg='median')
=== Selected trial(s) ===
top_k=1 selected_trial_numbers=[550] primary=550
ret%_train=-0.04% dd%_train=0.00% trades=1
ret%_test=0.52% dd%_test=-0.03% pnl_test=104.14 trades_test=4
Dumped TEST trades -> runs/REAL_FUT_SHORT_US_EU_ret/h0-1-2-3_r0.03_s912/test_trades.csv
WFO fold 1: OOS PnL=0.00 trades=0 win_rate=0.00% avg=0.000000 ret%=0.00% maxDD=0.000000 maxDD%=0.00%
WFO fold 2: OOS PnL=104.14 trades=4 win_rate=75.00% avg=26.034665 ret%=0.52% maxDD=-6.665252 maxDD%=-0.03%
WFO fold 3: OOS PnL=0.00 trades=0 win_rate=0.00% avg=0.000000 ret%=0.00% maxDD=0.000000 maxDD%=0.00%
WFO fold 4: OOS PnL=0.00 trades=0 win_rate=0.00% avg=0.000000 ret%=0.00% maxDD=0.000000 maxDD%=0.00%
WFO fold 5: OOS PnL=0.00 trades=0 win_rate=0.00% avg=0.000000 ret%=0.00% maxDD=0.000000 maxDD%=0.00%
WFO fold 6: OOS PnL=0.00 trades=0 win_rate=0.00% avg=0.000000 ret%=0.00% maxDD=0.000000 maxDD%=0.00%
WFO summary: meanPnL=17.36 stdPnL=38.81 meanWR=12.50% meanAvg=4.339111 meanRet%=0.09% worstDD=-6.665252 worstDD%=-0.03% folds=6 trades=4
Wrote runs/REAL_FUT_SHORT_US_EU_ret/h0-1-2-3_r0.03_s912/strategy_profile.json
=== ECHO SELECTED PARAMS (JSON) ===
{
  "adx_thresh": 13.814063493963799,
  "aggregate_params": "median",
  "atr_max_pct": 0.054810852078696216,
  "atr_min_pct": 0.015059490372076646,
  "bar_priority": "stop_first",
  "bb_std_mult": 1.3327115422089888,
  "bear_adx_thresh": 17.652084897933655,
  "bear_atr_max_pct": 0.049367679975591355,
  "bear_atr_min_pct": 0.008299851442574684,
  "bear_bb_std_mult": 3.472087679724112,
  "bear_rsi_ob": 77,
  "bear_rsi_os": 8,
  "bear_rsi_required": false,
  "bear_strategy": "breakout",
  "bear_time_stop": 237,
  "bear_tp_mult": 1.3508801332960876,
  "bear_tsl_mult": 0.6430002098941571,
  "bear_use_adx": false,
  "bear_use_atr": true,
  "bear_use_ema": false,
  "bear_use_sma": true,
  "bear_use_spike": false,
  "bull_adx_thresh": 5.015069355012274,
  "bull_atr_max_pct": 0.09632635616149214,
  "bull_atr_min_pct": 0.013111890251299652,
  "bull_bb_std_mult": 1.063768449714821,
  "bull_rsi_ob": 63,
  "bull_rsi_os": 50,
  "bull_rsi_required": true,
  "bull_strategy": "breakout",
  "bull_time_stop": 110,
  "bull_tp_mult": 1.1555611010090618,
  "bull_tsl_mult": 0.12849728536590554,
  "bull_use_adx": true,
  "bull_use_atr": false,
  "bull_use_ema": false,
  "bull_use_sma": true,
  "bull_use_spike": false,
  "cooldown_bars": 30,
  "daily_loss_limit_pct": 0.12,
  "edge_cap": 0.4658799554139923,
  "edge_k": 0.1651946060756575,
  "ema1": 26,
  "ema2": 31,
  "embargo_bars": 150,
  "fee": 0.001,
  "fill_timing": "next_open",
  "include_hours_set": "{0, 1, 2, 3}",
  "lockout_bars": 100,
  "max_consec_losses": 7,
  "max_notional_pct_equity": 1.0,
  "min_notional": 5.0,
  "ml_thresh": 0.0,
  "objective": "multi",
  "p_adx": 18,
  "p_atr": 22,
  "p_sma": 50,
  "p_std": 48,
  "participation_cap": 1.0,
  "price_step": 0.0001,
  "proba_temp": 1.0,
  "qty_step": 0.0001,
  "regime_adapt": true,
  "regime_band": 0.006,
  "regime_fast": 50,
  "regime_overrides": {
    "bear": {
      "adx": 20.0,
      "allowed_sides": [
        "long",
        "short"
      ],
      "atr_range": [
        0.0015,
        0.06
      ],
      "bb_std_mult": 1.2571599337995167,
      "mode": "breakout",
      "rsi_required": true,
      "time_stop_bars": 122,
      "tp_mult": 1.7149673432024581,
      "tsl_mult": 0.25,
      "use_adx": true,
      "use_atr": true
    },
    "bull": {
      "adx": 18.0,
      "allowed_sides": [
        "long",
        "short"
      ],
      "atr_range": [
        0.0008,
        0.06
      ],
      "bb_std_mult": 2.0169431746748376,
      "mode": "mean_reversion",
      "rsi_required": false,
      "time_stop_bars": 214,
      "tp_mult": 1.9194251920826044,
      "tsl_mult": 0.6891458682949287,
      "use_adx": true,
      "use_atr": true
    },
    "sideways": {
      "adx": 15.0,
      "allowed_sides": [
        "long",
        "short"
      ],
      "atr_range": [
        0.001,
        0.14
      ],
      "bb_std_mult": 1.5828092896467827,
      "mode": "breakout",
      "rsi_required": true,
      "time_stop_bars": 235,
      "tp_mult": 2.341879695778944,
      "tsl_mult": 0.651967765830165,
      "use_adx": true,
      "use_atr": true
    }
  },
  "regime_slow": 200,
  "risk_min_stop_frac": 0.001,
  "risk_per_trade": 0.03,
  "risk_stop_atr_mult": 1.0,
  "round_exits": true,
  "rsi_key": "rsi54",
  "rsi_ob": 91,
  "rsi_os": 54,
  "rsi_period": 54,
  "rsi_required": false,
  "select_top_k": 1,
  "session_end": 24,
  "session_start": 0,
  "sides": "short",
  "sideways_adx_thresh": 34.191600346835315,
  "sideways_atr_max_pct": 0.09779346980923923,
  "sideways_atr_min_pct": 0.0056469684406293495,
  "sideways_bb_std_mult": 0.798907898253135,
  "sideways_rsi_ob": 80,
  "sideways_rsi_os": 42,
  "sideways_rsi_required": true,
  "sideways_strategy": "breakout",
  "sideways_time_stop": 98,
  "sideways_tp_mult": 1.614931830795632,
  "sideways_tsl_mult": 0.262459577797018,
  "sideways_use_adx": false,
  "sideways_use_atr": true,
  "sideways_use_ema": true,
  "sideways_use_sma": false,
  "sideways_use_spike": true,
  "slip_atr_k": 0.010425457283009733,
  "slip_spread_k": 0.38494765070061576,
  "slippage": 0.0006,
  "spread_hl_frac": 0.04686259232389596,
  "start_equity": 20000.0,
  "stop_extra_slip": 0.0,
  "strategy": "breakout",
  "time_stop": 202,
  "tp_mult": 2.5184181359572366,
  "tsl_mult": 0.9054330814942828,
  "use_adx": false,
  "use_atr": true,
  "use_ema": true,
  "use_ml": false,
  "use_sma": false,
  "use_spike": true,
  "vol_spike": 0.187238510415675,
  "wfo_folds": 6
}
Wrote runs/REAL_FUT_SHORT_US_EU_ret/h0-1-2-3_r0.03_s912/best_params.pkl
