[I 2025-09-01 04:06:59,686] Trial 20 finished with values: [-1000000000.0, 1000000000.0] and parameters: {'p_sma': 24, 'p_std': 60, 'p_atr': 12, 'p_adx': 15, 'rsi_period': 38, 'ema1': 18, 'ema2': 38, 'slip_atr_k': 0.11776522059594088, 'slip_spread_k': 0.8273221452785857, 'spread_hl_frac': 0.02469917565393792, 'bb_std_mult': 2.8529631851455077, 'rsi_os': 7, 'rsi_ob': 49, 'vol_spike': 0.11479664442419432, 'adx_thresh': 16.567113350256683, 'atr_min_pct': 0.005432345884828658, 'atr_max_pct': 0.12315930230263619, 'tp_mult': 1.0225183714186654, 'tsl_mult': 0.3567776973654211, 'strategy': 'mean_reversion', 'time_stop': 234, 'use_sma': False, 'use_atr': False, 'use_adx': True, 'use_ema': False, 'use_spike': False, 'rsi_required': True, 'edge_k': 0.3635880001972663, 'edge_cap': 0.25057750215815316, 'bull_strategy': 'mean_reversion', 'bull_bb_std_mult': 2.6171362429774647, 'bull_rsi_os': 5, 'bull_rsi_ob': 95, 'bull_adx_thresh': 26.704376571124197, 'bull_atr_min_pct': 0.010620558102051189, 'bull_atr_max_pct': 0.12827995075742715, 'bull_tp_mult': 2.262358561711939, 'bull_tsl_mult': 0.1000450956710115, 'bull_time_stop': 108, 'bull_use_sma': False, 'bull_use_ema': True, 'bull_use_atr': True, 'bull_use_adx': False, 'bull_use_spike': False, 'bull_rsi_required': False, 'bear_strategy': 'mean_reversion', 'bear_bb_std_mult': 1.4494653999514224, 'bear_rsi_os': 34, 'bear_rsi_ob': 65, 'bear_adx_thresh': 12.498518668390265, 'bear_atr_min_pct': 0.007775443044698977, 'bear_atr_max_pct': 0.11772921231404952, 'bear_tp_mult': 1.8953506640998896, 'bear_tsl_mult': 0.5582919326033194, 'bear_time_stop': 96, 'bear_use_sma': True, 'bear_use_ema': False, 'bear_use_atr': False, 'bear_use_adx': True, 'bear_use_spike': True, 'bear_rsi_required': False, 'sideways_strategy': 'mean_reversion', 'sideways_bb_std_mult': 1.8893750395003968, 'sideways_rsi_os': 16, 'sideways_rsi_ob': 87, 'sideways_adx_thresh': 7.790006837601222, 'sideways_atr_min_pct': 0.011978030040526172, 'sideways_atr_max_pct': 0.08671747898553839, 'sideways_tp_mult': 1.7138461621618644, 'sideways_tsl_mult': 0.683659920815017, 'sideways_time_stop': 67, 'sideways_use_sma': True, 'sideways_use_ema': True, 'sideways_use_atr': False, 'sideways_use_adx': True, 'sideways_use_spike': False, 'sideways_rsi_required': True}.
[I 2025-09-01 04:06:59,870] Trial 18 finished with values: [-1000000000.0, 1000000000.0] and parameters: {'p_sma': 20, 'p_std': 20, 'p_atr': 15, 'p_adx': 8, 'rsi_period': 18, 'ema1': 17, 'ema2': 32, 'slip_atr_k': 0.18556479715201632, 'slip_spread_k': 0.5982189359255135, 'spread_hl_frac': 0.020902179729135665, 'bb_std_mult': 1.833245617994822, 'rsi_os': 33, 'rsi_ob': 78, 'vol_spike': 0.1160754214264284, 'adx_thresh': 7.074399841453754, 'atr_min_pct': 0.004405306954873452, 'atr_max_pct': 0.14715087146750613, 'tp_mult': 1.0702123135508121, 'tsl_mult': 0.318240488069999, 'strategy': 'mean_reversion', 'time_stop': 5, 'use_sma': False, 'use_atr': False, 'use_adx': True, 'use_ema': False, 'use_spike': False, 'rsi_required': True, 'edge_k': 0.41441559509188813, 'edge_cap': 0.2393361465636386, 'bull_strategy': 'mean_reversion', 'bull_bb_std_mult': 2.4282177560932308, 'bull_rsi_os': 40, 'bull_rsi_ob': 75, 'bull_adx_thresh': 24.969195783691713, 'bull_atr_min_pct': 0.010590455013134098, 'bull_atr_max_pct': 0.01367322590765957, 'bull_tp_mult': 2.297044338422353, 'bull_tsl_mult': 0.0823860181154547, 'bull_time_stop': 115, 'bull_use_sma': False, 'bull_use_ema': True, 'bull_use_atr': True, 'bull_use_adx': False, 'bull_use_spike': False, 'bull_rsi_required': False, 'bear_strategy': 'mean_reversion', 'bear_bb_std_mult': 1.3592631253038827, 'bear_rsi_os': 39, 'bear_rsi_ob': 64, 'bear_adx_thresh': 9.863368706921772, 'bear_atr_min_pct': 0.008506148230017985, 'bear_atr_max_pct': 0.11226893447376454, 'bear_tp_mult': 1.8947657170943202, 'bear_tsl_mult': 0.5603988249678796, 'bear_time_stop': 121, 'bear_use_sma': False, 'bear_use_ema': False, 'bear_use_atr': False, 'bear_use_adx': True, 'bear_use_spike': False, 'bear_rsi_required': False, 'sideways_strategy': 'mean_reversion', 'sideways_bb_std_mult': 1.0339614947572449, 'sideways_rsi_os': 44, 'sideways_rsi_ob': 88, 'sideways_adx_thresh': 10.994903730484962, 'sideways_atr_min_pct': 0.012066485584396424, 'sideways_atr_max_pct': 0.08603839125795087, 'sideways_tp_mult': 1.6283520901381325, 'sideways_tsl_mult': 0.47552747427281866, 'sideways_time_stop': 71, 'sideways_use_sma': True, 'sideways_use_ema': True, 'sideways_use_atr': False, 'sideways_use_adx': True, 'sideways_use_spike': False, 'sideways_rsi_required': True}.
[I 2025-09-01 04:06:59,982] Trial 21 finished with values: [-1000000000.0, 1000000000.0] and parameters: {'p_sma': 25, 'p_std': 19, 'p_atr': 12, 'p_adx': 16, 'rsi_period': 38, 'ema1': 19, 'ema2': 12, 'slip_atr_k': 0.1212779411305704, 'slip_spread_k': 0.0018691501525125442, 'spread_hl_frac': 0.025664171845722852, 'bb_std_mult': 0.994425649653, 'rsi_os': 14, 'rsi_ob': 46, 'vol_spike': 0.11007054435939417, 'adx_thresh': 6.529843690143281, 'atr_min_pct': 0.0053375542803337905, 'atr_max_pct': 0.1212268115511799, 'tp_mult': 1.0528617351208862, 'tsl_mult': 0.22211732128692702, 'strategy': 'mean_reversion', 'time_stop': 45, 'use_sma': True, 'use_atr': False, 'use_adx': True, 'use_ema': False, 'use_spike': False, 'rsi_required': True, 'edge_k': 0.3341180312242956, 'edge_cap': 0.24444521806189268, 'bull_strategy': 'mean_reversion', 'bull_bb_std_mult': 2.276141969682011, 'bull_rsi_os': 55, 'bull_rsi_ob': 94, 'bull_adx_thresh': 13.429162837282686, 'bull_atr_min_pct': 0.011344795793813627, 'bull_atr_max_pct': 0.1265933004960712, 'bull_tp_mult': 2.4045389632859226, 'bull_tsl_mult': 0.5012143063894232, 'bull_time_stop': 264, 'bull_use_sma': False, 'bull_use_ema': True, 'bull_use_atr': False, 'bull_use_adx': False, 'bull_use_spike': False, 'bull_rsi_required': True, 'bear_strategy': 'breakout', 'bear_bb_std_mult': 2.321514205051034, 'bear_rsi_os': 23, 'bear_rsi_ob': 62, 'bear_adx_thresh': 24.474586680493317, 'bear_atr_min_pct': 0.02453392904387354, 'bear_atr_max_pct': 0.12169697989849781, 'bear_tp_mult': 1.4984516917588433, 'bear_tsl_mult': 0.22837218366593062, 'bear_time_stop': 97, 'bear_use_sma': True, 'bear_use_ema': True, 'bear_use_atr': False, 'bear_use_adx': True, 'bear_use_spike': True, 'bear_rsi_required': False, 'sideways_strategy': 'mean_reversion', 'sideways_bb_std_mult': 0.5957837797944918, 'sideways_rsi_os': 42, 'sideways_rsi_ob': 88, 'sideways_adx_thresh': 10.626552845674746, 'sideways_atr_min_pct': 0.01158535786016322, 'sideways_atr_max_pct': 0.08572013220295732, 'sideways_tp_mult': 1.6452247620087905, 'sideways_tsl_mult': 0.6954236803352754, 'sideways_time_stop': 74, 'sideways_use_sma': False, 'sideways_use_ema': True, 'sideways_use_atr': True, 'sideways_use_adx': True, 'sideways_use_spike': True, 'sideways_rsi_required': True}.
[I 2025-09-01 04:07:39,746] Trial 19 finished with values: [-1000000000.0, 1000000000.0] and parameters: {'p_sma': 23, 'p_std': 60, 'p_atr': 14, 'p_adx': 15, 'rsi_period': 17, 'ema1': 17, 'ema2': 33, 'slip_atr_k': 0.17267909297177553, 'slip_spread_k': 0.6329873109641901, 'spread_hl_frac': 0.0251160207875256, 'bb_std_mult': 1.93480803021207, 'rsi_os': 11, 'rsi_ob': 76, 'vol_spike': 0.11364154769199512, 'adx_thresh': 16.30549914883236, 'atr_min_pct': 0.005579512651729202, 'atr_max_pct': 0.1274180915634824, 'tp_mult': 2.1955672431345454, 'tsl_mult': 0.3565712717186524, 'strategy': 'mean_reversion', 'time_stop': 19, 'use_sma': False, 'use_atr': False, 'use_adx': True, 'use_ema': False, 'use_spike': False, 'rsi_required': True, 'edge_k': 0.36333802657837694, 'edge_cap': 0.22551822023075835, 'bull_strategy': 'mean_reversion', 'bull_bb_std_mult': 2.3827959149750266, 'bull_rsi_os': 14, 'bull_rsi_ob': 64, 'bull_adx_thresh': 25.716160567448668, 'bull_atr_min_pct': 0.020504431601352492, 'bull_atr_max_pct': 0.13072130096892626, 'bull_tp_mult': 2.3612476884954816, 'bull_tsl_mult': 0.008141425779936318, 'bull_time_stop': 110, 'bull_use_sma': False, 'bull_use_ema': True, 'bull_use_atr': True, 'bull_use_adx': False, 'bull_use_spike': False, 'bull_rsi_required': False, 'bear_strategy': 'mean_reversion', 'bear_bb_std_mult': 1.4127470305013716, 'bear_rsi_os': 37, 'bear_rsi_ob': 64, 'bear_adx_thresh': 10.972728039771399, 'bear_atr_min_pct': 0.007214135540353831, 'bear_atr_max_pct': 0.11839768351099658, 'bear_tp_mult': 1.8865206670681611, 'bear_tsl_mult': 0.6328002889137643, 'bear_time_stop': 117, 'bear_use_sma': False, 'bear_use_ema': False, 'bear_use_atr': False, 'bear_use_adx': True, 'bear_use_spike': True, 'bear_rsi_required': False, 'sideways_strategy': 'mean_reversion', 'sideways_bb_std_mult': 0.5461425705879193, 'sideways_rsi_os': 18, 'sideways_rsi_ob': 85, 'sideways_adx_thresh': 9.530723305376041, 'sideways_atr_min_pct': 0.01259466408798637, 'sideways_atr_max_pct': 0.08500934494063954, 'sideways_tp_mult': 1.0400064160057991, 'sideways_tsl_mult': 0.5005780238747486, 'sideways_time_stop': 74, 'sideways_use_sma': True, 'sideways_use_ema': True, 'sideways_use_atr': False, 'sideways_use_adx': True, 'sideways_use_spike': False, 'sideways_rsi_required': True}.
[I 2025-09-01 04:07:42,094] Trial 24 finished with values: [-1000000000.0, 1000000000.0] and parameters: {'p_sma': 29, 'p_std': 52, 'p_atr': 14, 'p_adx': 11, 'rsi_period': 31, 'ema1': 20, 'ema2': 40, 'slip_atr_k': 0.1597594669525236, 'slip_spread_k': 0.8786265959009696, 'spread_hl_frac': 0.008806261791366697, 'bb_std_mult': 1.0262931836862117, 'rsi_os': 45, 'rsi_ob': 94, 'vol_spike': 0.1936247863472412, 'adx_thresh': 21.374667251794463, 'atr_min_pct': 0.022147568067185673, 'atr_max_pct': 0.03339920870463819, 'tp_mult': 2.224001129764022, 'tsl_mult': 0.398304294784753, 'strategy': 'breakout', 'time_stop': 143, 'use_sma': False, 'use_atr': False, 'use_adx': True, 'use_ema': False, 'use_spike': True, 'rsi_required': True, 'edge_k': 0.7279330358681759, 'edge_cap': 0.724820348245492, 'bull_strategy': 'mean_reversion', 'bull_bb_std_mult': 1.0532784870837386, 'bull_rsi_os': 13, 'bull_rsi_ob': 65, 'bull_adx_thresh': 14.020087662806706, 'bull_atr_min_pct': 0.013354033417982903, 'bull_atr_max_pct': 0.08288511546971701, 'bull_tp_mult': 1.8065307874245795, 'bull_tsl_mult': 0.7199078343803856, 'bull_time_stop': 252, 'bull_use_sma': False, 'bull_use_ema': False, 'bull_use_atr': True, 'bull_use_adx': True, 'bull_use_spike': True, 'bull_rsi_required': False, 'bear_strategy': 'breakout', 'bear_bb_std_mult': 3.560557789596581, 'bear_rsi_os': 16, 'bear_rsi_ob': 45, 'bear_adx_thresh': 22.24861406569396, 'bear_atr_min_pct': 0.011379736924943713, 'bear_atr_max_pct': 0.08416262514650576, 'bear_tp_mult': 1.5574816331875383, 'bear_tsl_mult': 0.4286349404531352, 'bear_time_stop': 152, 'bear_use_sma': True, 'bear_use_ema': False, 'bear_use_atr': False, 'bear_use_adx': True, 'bear_use_spike': True, 'bear_rsi_required': False, 'sideways_strategy': 'mean_reversion', 'sideways_bb_std_mult': 2.9600522767088764, 'sideways_rsi_os': 26, 'sideways_rsi_ob': 58, 'sideways_adx_thresh': 19.146540672935714, 'sideways_atr_min_pct': 0.0021823819854277088, 'sideways_atr_max_pct': 0.13130031883912813, 'sideways_tp_mult': 2.0178519872505625, 'sideways_tsl_mult': 0.887904399663096, 'sideways_time_stop': 107, 'sideways_use_sma': True, 'sideways_use_ema': True, 'sideways_use_atr': True, 'sideways_use_adx': True, 'sideways_use_spike': False, 'sideways_rsi_required': True}.
[I 2025-09-01 04:07:42,758] Trial 22 finished with values: [-1000000000.0, 1000000000.0] and parameters: {'p_sma': 38, 'p_std': 21, 'p_atr': 13, 'p_adx': 22, 'rsi_period': 23, 'ema1': 23, 'ema2': 30, 'slip_atr_k': 0.16524116040679582, 'slip_spread_k': 0.6705111924758961, 'spread_hl_frac': 0.01006942248709403, 'bb_std_mult': 1.0723853988427496, 'rsi_os': 45, 'rsi_ob': 65, 'vol_spike': 0.1863495338623095, 'adx_thresh': 5.238012719704292, 'atr_min_pct': 0.0056103840681121005, 'atr_max_pct': 0.03294142561227648, 'tp_mult': 1.5496934197562264, 'tsl_mult': 0.1982211157148752, 'strategy': 'mean_reversion', 'time_stop': 8, 'use_sma': True, 'use_atr': False, 'use_adx': True, 'use_ema': False, 'use_spike': False, 'rsi_required': True, 'edge_k': 0.30697522678418876, 'edge_cap': 0.7627215449684667, 'bull_strategy': 'mean_reversion', 'bull_bb_std_mult': 1.0627732413969275, 'bull_rsi_os': 16, 'bull_rsi_ob': 64, 'bull_adx_thresh': 14.012355167734182, 'bull_atr_min_pct': 0.011842945546017, 'bull_atr_max_pct': 0.0957583460243755, 'bull_tp_mult': 1.023712759441615, 'bull_tsl_mult': 0.7318001943236379, 'bull_time_stop': 255, 'bull_use_sma': False, 'bull_use_ema': True, 'bull_use_atr': False, 'bull_use_adx': False, 'bull_use_spike': False, 'bull_rsi_required': True, 'bear_strategy': 'breakout', 'bear_bb_std_mult': 2.2188734345327843, 'bear_rsi_os': 22, 'bear_rsi_ob': 58, 'bear_adx_thresh': 24.010868209702373, 'bear_atr_min_pct': 0.024265232897593827, 'bear_atr_max_pct': 0.14943380297520592, 'bear_tp_mult': 1.5464128905601737, 'bear_tsl_mult': 0.6859760454201722, 'bear_time_stop': 151, 'bear_use_sma': True, 'bear_use_ema': True, 'bear_use_atr': False, 'bear_use_adx': True, 'bear_use_spike': True, 'bear_rsi_required': False, 'sideways_strategy': 'mean_reversion', 'sideways_bb_std_mult': 0.6164495100792144, 'sideways_rsi_os': 41, 'sideways_rsi_ob': 85, 'sideways_adx_thresh': 26.23760644796288, 'sideways_atr_min_pct': 0.022308502610711777, 'sideways_atr_max_pct': 0.09036573444829106, 'sideways_tp_mult': 1.5332065907681998, 'sideways_tsl_mult': 0.4961456587040805, 'sideways_time_stop': 96, 'sideways_use_sma': False, 'sideways_use_ema': True, 'sideways_use_atr': True, 'sideways_use_adx': True, 'sideways_use_spike': True, 'sideways_rsi_required': True}.
[I 2025-09-01 04:07:43,148] Trial 23 finished with values: [-1000000000.0, 1000000000.0] and parameters: {'p_sma': 39, 'p_std': 37, 'p_atr': 13, 'p_adx': 23, 'rsi_period': 31, 'ema1': 21, 'ema2': 11, 'slip_atr_k': 0.1505653767573832, 'slip_spread_k': 0.6709450242999223, 'spread_hl_frac': 0.00979107009328317, 'bb_std_mult': 1.1689159844109773, 'rsi_os': 46, 'rsi_ob': 66, 'vol_spike': 0.16951534625079345, 'adx_thresh': 12.92237859946988, 'atr_min_pct': 0.019106698404957233, 'atr_max_pct': 0.02589890688492219, 'tp_mult': 1.565217624575854, 'tsl_mult': 0.17993601546436652, 'strategy': 'mean_reversion', 'time_stop': 139, 'use_sma': True, 'use_atr': False, 'use_adx': True, 'use_ema': False, 'use_spike': False, 'rsi_required': True, 'edge_k': 0.693217405895058, 'edge_cap': 0.7592241900587493, 'bull_strategy': 'mean_reversion', 'bull_bb_std_mult': 1.0678290166393185, 'bull_rsi_os': 14, 'bull_rsi_ob': 64, 'bull_adx_thresh': 13.30160861471147, 'bull_atr_min_pct': 0.012615736389578816, 'bull_atr_max_pct': 0.09594122064405358, 'bull_tp_mult': 1.033498632948974, 'bull_tsl_mult': 0.47679271021712205, 'bull_time_stop': 270, 'bull_use_sma': False, 'bull_use_ema': True, 'bull_use_atr': False, 'bull_use_adx': False, 'bull_use_spike': True, 'bull_rsi_required': True, 'bear_strategy': 'breakout', 'bear_bb_std_mult': 2.403710204760265, 'bear_rsi_os': 24, 'bear_rsi_ob': 57, 'bear_adx_thresh': 24.51403600197286, 'bear_atr_min_pct': 0.011143547536893018, 'bear_atr_max_pct': 0.14428194619070567, 'bear_tp_mult': 1.530051716660761, 'bear_tsl_mult': 0.23957753655042796, 'bear_time_stop': 81, 'bear_use_sma': True, 'bear_use_ema': True, 'bear_use_atr': False, 'bear_use_adx': True, 'bear_use_spike': True, 'bear_rsi_required': False, 'sideways_strategy': 'mean_reversion', 'sideways_bb_std_mult': 0.5434541359689977, 'sideways_rsi_os': 41, 'sideways_rsi_ob': 75, 'sideways_adx_thresh': 18.97492033346484, 'sideways_atr_min_pct': 0.023065509683189, 'sideways_atr_max_pct': 0.14952628080200486, 'sideways_tp_mult': 1.9592589759784391, 'sideways_tsl_mult': 0.8232520143913348, 'sideways_time_stop': 95, 'sideways_use_sma': False, 'sideways_use_ema': True, 'sideways_use_atr': True, 'sideways_use_adx': True, 'sideways_use_spike': True, 'sideways_rsi_required': True}.
[I 2025-09-01 04:08:16,088] Trial 25 finished with values: [-0.02870520620950423, 0.028553956683616058] and parameters: {'p_sma': 39, 'p_std': 37, 'p_atr': 19, 'p_adx': 11, 'rsi_period': 27, 'ema1': 22, 'ema2': 41, 'slip_atr_k': 0.08329827352151326, 'slip_spread_k': 0.8794086101370766, 'spread_hl_frac': 0.009984897489841577, 'bb_std_mult': 0.8629987517642506, 'rsi_os': 44, 'rsi_ob': 95, 'vol_spike': 0.19562188357923724, 'adx_thresh': 21.13906847974151, 'atr_min_pct': 0.022033386895413516, 'atr_max_pct': 0.0304700768021592, 'tp_mult': 1.5812483460050972, 'tsl_mult': 0.45482885947049273, 'strategy': 'breakout', 'time_stop': 108, 'use_sma': False, 'use_atr': False, 'use_adx': True, 'use_ema': False, 'use_spike': True, 'rsi_required': True, 'edge_k': 0.7277102814721563, 'edge_cap': 0.6930752845465034, 'bull_strategy': 'mean_reversion', 'bull_bb_std_mult': 1.1869228541063648, 'bull_rsi_os': 26, 'bull_rsi_ob': 65, 'bull_adx_thresh': 12.909446771874702, 'bull_atr_min_pct': 0.013240673307237358, 'bull_atr_max_pct': 0.07870198654279514, 'bull_tp_mult': 1.7933223096028512, 'bull_tsl_mult': 0.7329562518322988, 'bull_time_stop': 240, 'bull_use_sma': False, 'bull_use_ema': False, 'bull_use_atr': True, 'bull_use_adx': True, 'bull_use_spike': True, 'bull_rsi_required': False, 'bear_strategy': 'breakout', 'bear_bb_std_mult': 3.4862588473989167, 'bear_rsi_os': 17, 'bear_rsi_ob': 45, 'bear_adx_thresh': 21.14100745757918, 'bear_atr_min_pct': 0.012313168214040004, 'bear_atr_max_pct': 0.08310263059858239, 'bear_tp_mult': 1.4511179518410657, 'bear_tsl_mult': 0.43863611299893357, 'bear_time_stop': 152, 'bear_use_sma': True, 'bear_use_ema': False, 'bear_use_atr': False, 'bear_use_adx': True, 'bear_use_spike': True, 'bear_rsi_required': False, 'sideways_strategy': 'mean_reversion', 'sideways_bb_std_mult': 3.0072009732583465, 'sideways_rsi_os': 26, 'sideways_rsi_ob': 58, 'sideways_adx_thresh': 18.82321514370358, 'sideways_atr_min_pct': 0.0008158206887770806, 'sideways_atr_max_pct': 0.12905161854831135, 'sideways_tp_mult': 1.9635623458291473, 'sideways_tsl_mult': 0.8545081379117295, 'sideways_time_stop': 43, 'sideways_use_sma': True, 'sideways_use_ema': True, 'sideways_use_atr': True, 'sideways_use_adx': True, 'sideways_use_spike': False, 'sideways_rsi_required': True}.
[I 2025-09-01 04:08:21,165] Trial 27 finished with values: [-1000000000.0, 1000000000.0] and parameters: {'p_sma': 13, 'p_std': 37, 'p_atr': 19, 'p_adx': 10, 'rsi_period': 28, 'ema1': 11, 'ema2': 24, 'slip_atr_k': 0.08823347339433968, 'slip_spread_k': 0.754193893030433, 'spread_hl_frac': 0.03176356492685923, 'bb_std_mult': 0.8370836618132542, 'rsi_os': 29, 'rsi_ob': 57, 'vol_spike': 0.25940300600633537, 'adx_thresh': 19.923396885686163, 'atr_min_pct': 0.00916356668667918, 'atr_max_pct': 0.054667207049969135, 'tp_mult': 2.455432456246276, 'tsl_mult': 0.4249726413907842, 'strategy': 'breakout', 'time_stop': 88, 'use_sma': False, 'use_atr': True, 'use_adx': True, 'use_ema': True, 'use_spike': True, 'rsi_required': False, 'edge_k': 0.8440438369354005, 'edge_cap': 0.497660661114934, 'bull_strategy': 'breakout', 'bull_bb_std_mult': 3.5696264724654725, 'bull_rsi_os': 28, 'bull_rsi_ob': 56, 'bull_adx_thresh': 12.448878834689795, 'bull_atr_min_pct': 0.005278885024302635, 'bull_atr_max_pct': 0.07100318513541722, 'bull_tp_mult': 1.3403835009491476, 'bull_tsl_mult': 0.48817573252937174, 'bull_time_stop': 156, 'bull_use_sma': False, 'bull_use_ema': False, 'bull_use_atr': True, 'bull_use_adx': True, 'bull_use_spike': True, 'bull_rsi_required': False, 'bear_strategy': 'mean_reversion', 'bear_bb_std_mult': 1.5502398563579018, 'bear_rsi_os': 50, 'bear_rsi_ob': 51, 'bear_adx_thresh': 18.927301224846623, 'bear_atr_min_pct': 0.003928345460954167, 'bear_atr_max_pct': 0.015011829302815305, 'bear_tp_mult': 2.0776978538478152, 'bear_tsl_mult': 0.4429561556956726, 'bear_time_stop': 78, 'bear_use_sma': True, 'bear_use_ema': False, 'bear_use_atr': False, 'bear_use_adx': True, 'bear_use_spike': True, 'bear_rsi_required': True, 'sideways_strategy': 'mean_reversion', 'sideways_bb_std_mult': 2.3359292385715715, 'sideways_rsi_os': 5, 'sideways_rsi_ob': 95, 'sideways_adx_thresh': 30.935202780898326, 'sideways_atr_min_pct': 0.02302622218021876, 'sideways_atr_max_pct': 0.1496982199805764, 'sideways_tp_mult': 1.8970838309910274, 'sideways_tsl_mult': 0.012855486599349653, 'sideways_time_stop': 41, 'sideways_use_sma': True, 'sideways_use_ema': True, 'sideways_use_atr': False, 'sideways_use_adx': True, 'sideways_use_spike': False, 'sideways_rsi_required': False}.
