[I 2025-09-01 05:31:59,887] Trial 511 finished with values: [-1000000000.0, 1000000000.0] and parameters: {'p_sma': 60, 'p_std': 36, 'p_atr': 7, 'p_adx': 18, 'rsi_period': 49, 'ema1': 25, 'ema2': 35, 'slip_atr_k': 0.12551463428634746, 'slip_spread_k': 0.4355472356353425, 'spread_hl_frac': 0.022056945371419084, 'bb_std_mult': 2.095789885448393, 'rsi_os': 24, 'rsi_ob': 88, 'vol_spike': 0.19846497596483276, 'adx_thresh': 14.071407980904048, 'atr_min_pct': 0.016847376600720734, 'atr_max_pct': 0.029407844804192042, 'tp_mult': 2.5304528443602137, 'tsl_mult': 0.5218356855548061, 'strategy': 'breakout', 'time_stop': 188, 'use_sma': False, 'use_atr': True, 'use_adx': True, 'use_ema': True, 'use_spike': False, 'rsi_required': False, 'edge_k': 0.2907398274447044, 'edge_cap': 0.6840685112935203, 'bull_strategy': 'breakout', 'bull_bb_std_mult': 0.9764412992064564, 'bull_rsi_os': 47, 'bull_rsi_ob': 88, 'bull_adx_thresh': 6.683395757789407, 'bull_atr_min_pct': 0.012464202990190017, 'bull_atr_max_pct': 0.05764844105704095, 'bull_tp_mult': 1.2668995659036075, 'bull_tsl_mult': 0.2543055190905995, 'bull_time_stop': 89, 'bull_use_sma': True, 'bull_use_ema': False, 'bull_use_atr': False, 'bull_use_adx': True, 'bull_use_spike': True, 'bull_rsi_required': True, 'bear_strategy': 'breakout', 'bear_bb_std_mult': 3.4689807895363147, 'bear_rsi_os': 7, 'bear_rsi_ob': 74, 'bear_adx_thresh': 27.44088046372033, 'bear_atr_min_pct': 0.00952890006022104, 'bear_atr_max_pct': 0.07498234152928455, 'bear_tp_mult': 2.912796258107864, 'bear_tsl_mult': 0.6222477993116812, 'bear_time_stop': 57, 'bear_use_sma': True, 'bear_use_ema': True, 'bear_use_atr': False, 'bear_use_adx': False, 'bear_use_spike': True, 'bear_rsi_required': False, 'sideways_strategy': 'breakout', 'sideways_bb_std_mult': 0.5604594789896387, 'sideways_rsi_os': 44, 'sideways_rsi_ob': 55, 'sideways_adx_thresh': 25.596289067634284, 'sideways_atr_min_pct': 0.004709414188721149, 'sideways_atr_max_pct': 0.09752008199739816, 'sideways_tp_mult': 1.4664971591675657, 'sideways_tsl_mult': 0.6353225308330116, 'sideways_time_stop': 150, 'sideways_use_sma': False, 'sideways_use_ema': True, 'sideways_use_atr': True, 'sideways_use_adx': False, 'sideways_use_spike': True, 'sideways_rsi_required': True}.
[I 2025-09-01 05:32:40,029] Trial 516 finished with values: [-1000000000.0, 1000000000.0] and parameters: {'p_sma': 58, 'p_std': 35, 'p_atr': 8, 'p_adx': 25, 'rsi_period': 51, 'ema1': 26, 'ema2': 34, 'slip_atr_k': 0.012496943687200873, 'slip_spread_k': 0.35964777548998333, 'spread_hl_frac': 0.015077004385568357, 'bb_std_mult': 2.1843521726050854, 'rsi_os': 25, 'rsi_ob': 68, 'vol_spike': 0.20908741569913014, 'adx_thresh': 12.660997026129984, 'atr_min_pct': 0.0026529310014811133, 'atr_max_pct': 0.06602421350214237, 'tp_mult': 2.2868084870058647, 'tsl_mult': 0.9438985102923644, 'strategy': 'breakout', 'time_stop': 206, 'use_sma': False, 'use_atr': True, 'use_adx': False, 'use_ema': True, 'use_spike': True, 'rsi_required': False, 'edge_k': 0.14791748169613927, 'edge_cap': 0.5377572043971744, 'bull_strategy': 'breakout', 'bull_bb_std_mult': 0.8125295651911744, 'bull_rsi_os': 51, 'bull_rsi_ob': 85, 'bull_adx_thresh': 7.978241094853535, 'bull_atr_min_pct': 0.01433673814280604, 'bull_atr_max_pct': 0.017872703208657782, 'bull_tp_mult': 1.2985027689191402, 'bull_tsl_mult': 0.21145747944460905, 'bull_time_stop': 104, 'bull_use_sma': True, 'bull_use_ema': False, 'bull_use_atr': False, 'bull_use_adx': True, 'bull_use_spike': False, 'bull_rsi_required': True, 'bear_strategy': 'breakout', 'bear_bb_std_mult': 3.594486995838308, 'bear_rsi_os': 25, 'bear_rsi_ob': 66, 'bear_adx_thresh': 29.11343838999346, 'bear_atr_min_pct': 0.008234033443508525, 'bear_atr_max_pct': 0.06506936390709893, 'bear_tp_mult': 1.2765872296943648, 'bear_tsl_mult': 0.7530835624436392, 'bear_time_stop': 86, 'bear_use_sma': True, 'bear_use_ema': False, 'bear_use_atr': False, 'bear_use_adx': False, 'bear_use_spike': False, 'bear_rsi_required': False, 'sideways_strategy': 'breakout', 'sideways_bb_std_mult': 1.1009438911730123, 'sideways_rsi_os': 24, 'sideways_rsi_ob': 52, 'sideways_adx_thresh': 23.581444952000446, 'sideways_atr_min_pct': 0.0025807024340157997, 'sideways_atr_max_pct': 0.10046155364126363, 'sideways_tp_mult': 1.5943222549909302, 'sideways_tsl_mult': 0.5719235423576607, 'sideways_time_stop': 93, 'sideways_use_sma': False, 'sideways_use_ema': False, 'sideways_use_atr': True, 'sideways_use_adx': False, 'sideways_use_spike': True, 'sideways_rsi_required': True}.
[I 2025-09-01 05:32:40,823] Trial 517 finished with values: [-1000000000.0, 1000000000.0] and parameters: {'p_sma': 58, 'p_std': 34, 'p_atr': 8, 'p_adx': 28, 'rsi_period': 74, 'ema1': 26, 'ema2': 34, 'slip_atr_k': 0.01162239097887995, 'slip_spread_k': 0.35814641791022567, 'spread_hl_frac': 0.029365582154220218, 'bb_std_mult': 2.190862099644777, 'rsi_os': 8, 'rsi_ob': 90, 'vol_spike': 0.12628708670806582, 'adx_thresh': 12.483528938826879, 'atr_min_pct': 0.003400202045584665, 'atr_max_pct': 0.11732245580305206, 'tp_mult': 2.3749555434861396, 'tsl_mult': 0.9056309150942493, 'strategy': 'breakout', 'time_stop': 177, 'use_sma': False, 'use_atr': True, 'use_adx': False, 'use_ema': True, 'use_spike': True, 'rsi_required': False, 'edge_k': 0.15267659003669576, 'edge_cap': 0.7256241439956004, 'bull_strategy': 'breakout', 'bull_bb_std_mult': 0.8220805942305529, 'bull_rsi_os': 51, 'bull_rsi_ob': 85, 'bull_adx_thresh': 5.049882035151486, 'bull_atr_min_pct': 0.014431803391083426, 'bull_atr_max_pct': 0.10252260634926431, 'bull_tp_mult': 1.3582658478752925, 'bull_tsl_mult': 0.18035983187589072, 'bull_time_stop': 105, 'bull_use_sma': True, 'bull_use_ema': False, 'bull_use_atr': False, 'bull_use_adx': True, 'bull_use_spike': False, 'bull_rsi_required': True, 'bear_strategy': 'breakout', 'bear_bb_std_mult': 3.549484767981377, 'bear_rsi_os': 39, 'bear_rsi_ob': 52, 'bear_adx_thresh': 34.02206989147528, 'bear_atr_min_pct': 0.008115255946455235, 'bear_atr_max_pct': 0.090502883027228, 'bear_tp_mult': 1.2980788002069896, 'bear_tsl_mult': 0.6670616110826246, 'bear_time_stop': 181, 'bear_use_sma': True, 'bear_use_ema': False, 'bear_use_atr': False, 'bear_use_adx': False, 'bear_use_spike': False, 'bear_rsi_required': False, 'sideways_strategy': 'breakout', 'sideways_bb_std_mult': 0.7724547677778189, 'sideways_rsi_os': 14, 'sideways_rsi_ob': 91, 'sideways_adx_thresh': 23.795606172262087, 'sideways_atr_min_pct': 0.0025655335564512905, 'sideways_atr_max_pct': 0.1004268923971371, 'sideways_tp_mult': 1.6018468888148993, 'sideways_tsl_mult': 0.9790709835428212, 'sideways_time_stop': 18, 'sideways_use_sma': False, 'sideways_use_ema': False, 'sideways_use_atr': True, 'sideways_use_adx': False, 'sideways_use_spike': True, 'sideways_rsi_required': True}.
[I 2025-09-01 05:32:42,122] Trial 515 finished with values: [-1000000000.0, 1000000000.0] and parameters: {'p_sma': 58, 'p_std': 35, 'p_atr': 7, 'p_adx': 14, 'rsi_period': 52, 'ema1': 24, 'ema2': 34, 'slip_atr_k': 0.022737163098570323, 'slip_spread_k': 0.4031527842668899, 'spread_hl_frac': 0.028970766927465297, 'bb_std_mult': 2.162460120841034, 'rsi_os': 25, 'rsi_ob': 79, 'vol_spike': 0.21329326940795096, 'adx_thresh': 12.503053513502321, 'atr_min_pct': 0.006000402551934354, 'atr_max_pct': 0.11829812875866595, 'tp_mult': 2.5367786959362455, 'tsl_mult': 0.8187137045691999, 'strategy': 'breakout', 'time_stop': 188, 'use_sma': False, 'use_atr': True, 'use_adx': False, 'use_ema': True, 'use_spike': True, 'rsi_required': False, 'edge_k': 0.14494591920672853, 'edge_cap': 0.5270164013103692, 'bull_strategy': 'breakout', 'bull_bb_std_mult': 0.8693304262281414, 'bull_rsi_os': 51, 'bull_rsi_ob': 93, 'bull_adx_thresh': 8.197213733154303, 'bull_atr_min_pct': 0.012281345600744452, 'bull_atr_max_pct': 0.11208683048778981, 'bull_tp_mult': 1.286004482629163, 'bull_tsl_mult': 0.2195996560116961, 'bull_time_stop': 105, 'bull_use_sma': True, 'bull_use_ema': False, 'bull_use_atr': False, 'bull_use_adx': True, 'bull_use_spike': False, 'bull_rsi_required': True, 'bear_strategy': 'breakout', 'bear_bb_std_mult': 3.4665805414734723, 'bear_rsi_os': 37, 'bear_rsi_ob': 88, 'bear_adx_thresh': 29.31410623041901, 'bear_atr_min_pct': 0.008213590715557717, 'bear_atr_max_pct': 0.11518097598857366, 'bear_tp_mult': 2.6722196020488633, 'bear_tsl_mult': 0.6372194791495008, 'bear_time_stop': 132, 'bear_use_sma': True, 'bear_use_ema': False, 'bear_use_atr': False, 'bear_use_adx': False, 'bear_use_spike': False, 'bear_rsi_required': False, 'sideways_strategy': 'breakout', 'sideways_bb_std_mult': 3.0403570560195536, 'sideways_rsi_os': 30, 'sideways_rsi_ob': 94, 'sideways_adx_thresh': 23.610247214371565, 'sideways_atr_min_pct': 0.002772332966927496, 'sideways_atr_max_pct': 0.1007224305265176, 'sideways_tp_mult': 1.5922142908467711, 'sideways_tsl_mult': 0.5931340210190189, 'sideways_time_stop': 160, 'sideways_use_sma': False, 'sideways_use_ema': True, 'sideways_use_atr': True, 'sideways_use_adx': False, 'sideways_use_spike': True, 'sideways_rsi_required': True}.
[I 2025-09-01 05:32:42,652] Trial 514 finished with values: [-0.04898882740495314, 0.04880852706239545] and parameters: {'p_sma': 58, 'p_std': 33, 'p_atr': 7, 'p_adx': 18, 'rsi_period': 44, 'ema1': 25, 'ema2': 34, 'slip_atr_k': 0.12702967715256466, 'slip_spread_k': 0.4322886936144297, 'spread_hl_frac': 0.02155369339306968, 'bb_std_mult': 2.1184702939207027, 'rsi_os': 25, 'rsi_ob': 90, 'vol_spike': 0.12564297209627373, 'adx_thresh': 12.58447330418108, 'atr_min_pct': 0.016948347964562557, 'atr_max_pct': 0.11823873043411327, 'tp_mult': 2.5384742475377626, 'tsl_mult': 0.14067900969443248, 'strategy': 'breakout', 'time_stop': 189, 'use_sma': False, 'use_atr': True, 'use_adx': True, 'use_ema': True, 'use_spike': True, 'rsi_required': False, 'edge_k': 0.26508516946824756, 'edge_cap': 0.5391750034315776, 'bull_strategy': 'breakout', 'bull_bb_std_mult': 0.9552501049452927, 'bull_rsi_os': 51, 'bull_rsi_ob': 92, 'bull_adx_thresh': 6.150143702841058, 'bull_atr_min_pct': 0.012362983980580803, 'bull_atr_max_pct': 0.06181404558691671, 'bull_tp_mult': 1.2556743781902455, 'bull_tsl_mult': 0.2553697265183247, 'bull_time_stop': 89, 'bull_use_sma': True, 'bull_use_ema': False, 'bull_use_atr': False, 'bull_use_adx': True, 'bull_use_spike': False, 'bull_rsi_required': True, 'bear_strategy': 'breakout', 'bear_bb_std_mult': 3.384728763527887, 'bear_rsi_os': 7, 'bear_rsi_ob': 51, 'bear_adx_thresh': 34.138669918974735, 'bear_atr_min_pct': 0.009539264069331739, 'bear_atr_max_pct': 0.0345173733995662, 'bear_tp_mult': 2.052278627131956, 'bear_tsl_mult': 0.6216157655642814, 'bear_time_stop': 16, 'bear_use_sma': True, 'bear_use_ema': False, 'bear_use_atr': False, 'bear_use_adx': False, 'bear_use_spike': False, 'bear_rsi_required': False, 'sideways_strategy': 'breakout', 'sideways_bb_std_mult': 3.2252417191514375, 'sideways_rsi_os': 44, 'sideways_rsi_ob': 68, 'sideways_adx_thresh': 23.776529717240457, 'sideways_atr_min_pct': 0.002868350415693178, 'sideways_atr_max_pct': 0.1008874020556819, 'sideways_tp_mult': 1.602734216235348, 'sideways_tsl_mult': 0.5698110467509242, 'sideways_time_stop': 161, 'sideways_use_sma': False, 'sideways_use_ema': True, 'sideways_use_atr': True, 'sideways_use_adx': False, 'sideways_use_spike': True, 'sideways_rsi_required': True}.
[I 2025-09-01 05:33:23,599] Trial 519 finished with values: [-1000000000.0, 1000000000.0] and parameters: {'p_sma': 56, 'p_std': 29, 'p_atr': 7, 'p_adx': 27, 'rsi_period': 53, 'ema1': 25, 'ema2': 22, 'slip_atr_k': 0.022914653969528388, 'slip_spread_k': 0.40767350100891786, 'spread_hl_frac': 0.0108199597376438, 'bb_std_mult': 1.991198394061466, 'rsi_os': 9, 'rsi_ob': 45, 'vol_spike': 0.21243533082406746, 'adx_thresh': 27.58025846478417, 'atr_min_pct': 0.01810852273049761, 'atr_max_pct': 0.1186003963402629, 'tp_mult': 2.564819350952765, 'tsl_mult': 0.18359678698897164, 'strategy': 'breakout', 'time_stop': 175, 'use_sma': False, 'use_atr': True, 'use_adx': False, 'use_ema': True, 'use_spike': True, 'rsi_required': False, 'edge_k': 0.24714326983596527, 'edge_cap': 0.6372017898876969, 'bull_strategy': 'breakout', 'bull_bb_std_mult': 0.9395888836486428, 'bull_rsi_os': 49, 'bull_rsi_ob': 91, 'bull_adx_thresh': 6.258379997003267, 'bull_atr_min_pct': 0.012476538301185279, 'bull_atr_max_pct': 0.11185517052461742, 'bull_tp_mult': 1.2351518676121576, 'bull_tsl_mult': 0.15488992662228274, 'bull_time_stop': 76, 'bull_use_sma': True, 'bull_use_ema': False, 'bull_use_atr': False, 'bull_use_adx': True, 'bull_use_spike': False, 'bull_rsi_required': True, 'bear_strategy': 'breakout', 'bear_bb_std_mult': 3.482979110589648, 'bear_rsi_os': 8, 'bear_rsi_ob': 50, 'bear_adx_thresh': 28.361609521866743, 'bear_atr_min_pct': 0.007324978353343876, 'bear_atr_max_pct': 0.03506446553160353, 'bear_tp_mult': 2.034422057728237, 'bear_tsl_mult': 0.045800574592471055, 'bear_time_stop': 134, 'bear_use_sma': True, 'bear_use_ema': False, 'bear_use_atr': False, 'bear_use_adx': False, 'bear_use_spike': False, 'bear_rsi_required': False, 'sideways_strategy': 'breakout', 'sideways_bb_std_mult': 0.5616660925931929, 'sideways_rsi_os': 30, 'sideways_rsi_ob': 54, 'sideways_adx_thresh': 21.429903422472467, 'sideways_atr_min_pct': 0.0034990947112289446, 'sideways_atr_max_pct': 0.10641104917586937, 'sideways_tp_mult': 1.5489466363078928, 'sideways_tsl_mult': 0.9997838750732463, 'sideways_time_stop': 161, 'sideways_use_sma': False, 'sideways_use_ema': True, 'sideways_use_atr': True, 'sideways_use_adx': False, 'sideways_use_spike': True, 'sideways_rsi_required': True}.
[I 2025-09-01 05:33:24,249] Trial 518 finished with values: [-0.02559890643914553, 0.025824551485314682] and parameters: {'p_sma': 58, 'p_std': 31, 'p_atr': 7, 'p_adx': 14, 'rsi_period': 46, 'ema1': 22, 'ema2': 51, 'slip_atr_k': 0.10375110845831158, 'slip_spread_k': 0.4087694068476599, 'spread_hl_frac': 0.016523691301114536, 'bb_std_mult': 2.047051514293313, 'rsi_os': 8, 'rsi_ob': 45, 'vol_spike': 0.21475550495828064, 'adx_thresh': 19.923199386925578, 'atr_min_pct': 0.0035882538731115206, 'atr_max_pct': 0.12410939385425013, 'tp_mult': 2.3574590491733005, 'tsl_mult': 0.8218680862990501, 'strategy': 'breakout', 'time_stop': 174, 'use_sma': False, 'use_atr': True, 'use_adx': False, 'use_ema': True, 'use_spike': True, 'rsi_required': False, 'edge_k': 0.25731090063693585, 'edge_cap': 0.6304591914793194, 'bull_strategy': 'breakout', 'bull_bb_std_mult': 0.9157922143220592, 'bull_rsi_os': 52, 'bull_rsi_ob': 91, 'bull_adx_thresh': 5.035779885178634, 'bull_atr_min_pct': 0.013146443069541594, 'bull_atr_max_pct': 0.11159721930031918, 'bull_tp_mult': 1.3593267277152266, 'bull_tsl_mult': 0.14981512864164487, 'bull_time_stop': 76, 'bull_use_sma': True, 'bull_use_ema': False, 'bull_use_atr': False, 'bull_use_adx': True, 'bull_use_spike': False, 'bull_rsi_required': True, 'bear_strategy': 'breakout', 'bear_bb_std_mult': 3.457092908573225, 'bear_rsi_os': 8, 'bear_rsi_ob': 95, 'bear_adx_thresh': 22.72018258196426, 'bear_atr_min_pct': 0.007895317176272638, 'bear_atr_max_pct': 0.03451062335298662, 'bear_tp_mult': 1.1944644738653247, 'bear_tsl_mult': 0.9128175979307915, 'bear_time_stop': 182, 'bear_use_sma': True, 'bear_use_ema': False, 'bear_use_atr': False, 'bear_use_adx': False, 'bear_use_spike': False, 'bear_rsi_required': False, 'sideways_strategy': 'breakout', 'sideways_bb_std_mult': 2.9548538171770895, 'sideways_rsi_os': 42, 'sideways_rsi_ob': 68, 'sideways_adx_thresh': 21.332080448030773, 'sideways_atr_min_pct': 0.003992918362387029, 'sideways_atr_max_pct': 0.10218871554165081, 'sideways_tp_mult': 1.4747889277699409, 'sideways_tsl_mult': 0.9782294663176249, 'sideways_time_stop': 173, 'sideways_use_sma': False, 'sideways_use_ema': True, 'sideways_use_atr': True, 'sideways_use_adx': False, 'sideways_use_spike': True, 'sideways_rsi_required': True}.
[I 2025-09-01 05:33:25,053] Trial 521 finished with values: [-0.016528267189221735, 0.016737621888376016] and parameters: {'p_sma': 59, 'p_std': 31, 'p_atr': 9, 'p_adx': 8, 'rsi_period': 53, 'ema1': 23, 'ema2': 18, 'slip_atr_k': 0.017880077225845663, 'slip_spread_k': 0.4067881955456375, 'spread_hl_frac': 0.016262838137409828, 'bb_std_mult': 1.9860657689556862, 'rsi_os': 34, 'rsi_ob': 87, 'vol_spike': 0.2060900233630587, 'adx_thresh': 13.93684244403867, 'atr_min_pct': 0.0035108241924490836, 'atr_max_pct': 0.047501595581316135, 'tp_mult': 2.573554284452623, 'tsl_mult': 0.9226949835375768, 'strategy': 'breakout', 'time_stop': 172, 'use_sma': False, 'use_atr': True, 'use_adx': False, 'use_ema': True, 'use_spike': True, 'rsi_required': False, 'edge_k': 0.2359960457410381, 'edge_cap': 0.6351808665438067, 'bull_strategy': 'breakout', 'bull_bb_std_mult': 0.9103558593453807, 'bull_rsi_os': 49, 'bull_rsi_ob': 89, 'bull_adx_thresh': 5.590824717128298, 'bull_atr_min_pct': 0.01393665878095614, 'bull_atr_max_pct': 0.031315676126673395, 'bull_tp_mult': 1.1584488995936706, 'bull_tsl_mult': 0.15075757494888656, 'bull_time_stop': 94, 'bull_use_sma': True, 'bull_use_ema': False, 'bull_use_atr': False, 'bull_use_adx': True, 'bull_use_spike': False, 'bull_rsi_required': True, 'bear_strategy': 'breakout', 'bear_bb_std_mult': 3.544686866222188, 'bear_rsi_os': 8, 'bear_rsi_ob': 68, 'bear_adx_thresh': 20.449983003451987, 'bear_atr_min_pct': 0.00726044818123299, 'bear_atr_max_pct': 0.07068259363349075, 'bear_tp_mult': 1.207795683091875, 'bear_tsl_mult': 0.04578740856740893, 'bear_time_stop': 206, 'bear_use_sma': False, 'bear_use_ema': False, 'bear_use_atr': False, 'bear_use_adx': False, 'bear_use_spike': False, 'bear_rsi_required': False, 'sideways_strategy': 'breakout', 'sideways_bb_std_mult': 0.5654503077697035, 'sideways_rsi_os': 42, 'sideways_rsi_ob': 78, 'sideways_adx_thresh': 21.447644438583794, 'sideways_atr_min_pct': 0.003672167350099293, 'sideways_atr_max_pct': 0.029833699213913753, 'sideways_tp_mult': 1.5334160872285276, 'sideways_tsl_mult': 0.961439173407011, 'sideways_time_stop': 171, 'sideways_use_sma': False, 'sideways_use_ema': True, 'sideways_use_atr': True, 'sideways_use_adx': False, 'sideways_use_spike': True, 'sideways_rsi_required': True}.
[I 2025-09-01 05:33:25,413] Trial 520 finished with values: [-1000000000.0, 1000000000.0] and parameters: {'p_sma': 56, 'p_std': 29, 'p_atr': 7, 'p_adx': 18, 'rsi_period': 47, 'ema1': 22, 'ema2': 52, 'slip_atr_k': 0.01653236208667132, 'slip_spread_k': 0.405070207545061, 'spread_hl_frac': 0.030619242726407602, 'bb_std_mult': 2.3276072404858548, 'rsi_os': 33, 'rsi_ob': 71, 'vol_spike': 0.20610494986640568, 'adx_thresh': 13.7338230602538, 'atr_min_pct': 0.008204035599567387, 'atr_max_pct': 0.12360332048407946, 'tp_mult': 1.1640562756392896, 'tsl_mult': 0.1360215632115752, 'strategy': 'breakout', 'time_stop': 172, 'use_sma': False, 'use_atr': True, 'use_adx': False, 'use_ema': True, 'use_spike': True, 'rsi_required': False, 'edge_k': 0.19555766914129025, 'edge_cap': 0.9630844208068263, 'bull_strategy': 'breakout', 'bull_bb_std_mult': 0.9380364599120391, 'bull_rsi_os': 49, 'bull_rsi_ob': 90, 'bull_adx_thresh': 6.224769054452321, 'bull_atr_min_pct': 0.013325659242015748, 'bull_atr_max_pct': 0.11171199682349697, 'bull_tp_mult': 1.2428159843033864, 'bull_tsl_mult': 0.15382099740977356, 'bull_time_stop': 77, 'bull_use_sma': True, 'bull_use_ema': False, 'bull_use_atr': False, 'bull_use_adx': True, 'bull_use_spike': False, 'bull_rsi_required': True, 'bear_strategy': 'breakout', 'bear_bb_std_mult': 3.346853583672484, 'bear_rsi_os': 8, 'bear_rsi_ob': 68, 'bear_adx_thresh': 28.518857018039704, 'bear_atr_min_pct': 0.00737849512678796, 'bear_atr_max_pct': 0.034583101221115825, 'bear_tp_mult': 2.211297057472006, 'bear_tsl_mult': 0.642155529537779, 'bear_time_stop': 206, 'bear_use_sma': False, 'bear_use_ema': False, 'bear_use_atr': False, 'bear_use_adx': False, 'bear_use_spike': False, 'bear_rsi_required': False, 'sideways_strategy': 'breakout', 'sideways_bb_std_mult': 0.5713840633667812, 'sideways_rsi_os': 29, 'sideways_rsi_ob': 86, 'sideways_adx_thresh': 22.294361903460864, 'sideways_atr_min_pct': 0.00363402140331846, 'sideways_atr_max_pct': 0.05303131860397535, 'sideways_tp_mult': 1.5330485653848769, 'sideways_tsl_mult': 0.9584093494387255, 'sideways_time_stop': 172, 'sideways_use_sma': False, 'sideways_use_ema': True, 'sideways_use_atr': True, 'sideways_use_adx': False, 'sideways_use_spike': True, 'sideways_rsi_required': True}.
