[I 2025-09-01 04:18:58,747] Trial 99 finished with values: [-1000000000.0, 1000000000.0] and parameters: {'p_sma': 39, 'p_std': 32, 'p_atr': 19, 'p_adx': 10, 'rsi_period': 56, 'ema1': 19, 'ema2': 38, 'slip_atr_k': 0.07437353979931331, 'slip_spread_k': 0.9127120998275443, 'spread_hl_frac': 0.013416077801642744, 'bb_std_mult': 0.6894918859041825, 'rsi_os': 41, 'rsi_ob': 74, 'vol_spike': 0.27378517307558, 'adx_thresh': 18.900805992678098, 'atr_min_pct': 0.02533324324364331, 'atr_max_pct': 0.020120908633364146, 'tp_mult': 2.1862739657022763, 'tsl_mult': 0.49862341598238474, 'strategy': 'breakout', 'time_stop': 128, 'use_sma': False, 'use_atr': False, 'use_adx': False, 'use_ema': True, 'use_spike': True, 'rsi_required': True, 'edge_k': 0.1535490737123918, 'edge_cap': 0.8387284556802563, 'bull_strategy': 'mean_reversion', 'bull_bb_std_mult': 3.2632808917103806, 'bull_rsi_os': 24, 'bull_rsi_ob': 54, 'bull_adx_thresh': 24.589616948136904, 'bull_atr_min_pct': 0.007471680584937381, 'bull_atr_max_pct': 0.1498720081445252, 'bull_tp_mult': 1.5212964417610133, 'bull_tsl_mult': 0.7297972189381723, 'bull_time_stop': 233, 'bull_use_sma': True, 'bull_use_ema': False, 'bull_use_atr': True, 'bull_use_adx': True, 'bull_use_spike': True, 'bull_rsi_required': False, 'bear_strategy': 'breakout', 'bear_bb_std_mult': 3.3561191088113826, 'bear_rsi_os': 40, 'bear_rsi_ob': 48, 'bear_adx_thresh': 19.640991949304556, 'bear_atr_min_pct': 0.012858203298517133, 'bear_atr_max_pct': 0.10713307051214413, 'bear_tp_mult': 2.5680146212108053, 'bear_tsl_mult': 0.35982311415710583, 'bear_time_stop': 124, 'bear_use_sma': False, 'bear_use_ema': False, 'bear_use_atr': False, 'bear_use_adx': True, 'bear_use_spike': True, 'bear_rsi_required': False, 'sideways_strategy': 'mean_reversion', 'sideways_bb_std_mult': 3.204817329879744, 'sideways_rsi_os': 6, 'sideways_rsi_ob': 62, 'sideways_adx_thresh': 15.81844880022308, 'sideways_atr_min_pct': 0.0032879348572826157, 'sideways_atr_max_pct': 0.12436606614678411, 'sideways_tp_mult': 1.7795457011599187, 'sideways_tsl_mult': 0.7922482527012624, 'sideways_time_stop': 195, 'sideways_use_sma': True, 'sideways_use_ema': True, 'sideways_use_atr': True, 'sideways_use_adx': False, 'sideways_use_spike': True, 'sideways_rsi_required': True}.
[I 2025-09-01 04:19:36,861] Trial 102 finished with values: [-1000000000.0, 1000000000.0] and parameters: {'p_sma': 37, 'p_std': 10, 'p_atr': 22, 'p_adx': 10, 'rsi_period': 55, 'ema1': 19, 'ema2': 45, 'slip_atr_k': 0.12852738966654345, 'slip_spread_k': 0.3787952447841168, 'spread_hl_frac': 0.006109827596601638, 'bb_std_mult': 1.8486726245193057, 'rsi_os': 44, 'rsi_ob': 73, 'vol_spike': 0.13764668415688186, 'adx_thresh': 19.902580090743598, 'atr_min_pct': 0.02547691945982645, 'atr_max_pct': 0.1439487619731401, 'tp_mult': 2.8620614705007936, 'tsl_mult': 0.1609002286824875, 'strategy': 'breakout', 'time_stop': 169, 'use_sma': True, 'use_atr': True, 'use_adx': False, 'use_ema': False, 'use_spike': True, 'rsi_required': False, 'edge_k': 1.8057366194411584, 'edge_cap': 0.7301632819761211, 'bull_strategy': 'breakout', 'bull_bb_std_mult': 1.3777316622653106, 'bull_rsi_os': 24, 'bull_rsi_ob': 48, 'bull_adx_thresh': 24.776717959345007, 'bull_atr_min_pct': 0.007416143141130131, 'bull_atr_max_pct': 0.09939774011996114, 'bull_tp_mult': 1.405010533267626, 'bull_tsl_mult': 0.7354315676785724, 'bull_time_stop': 75, 'bull_use_sma': True, 'bull_use_ema': False, 'bull_use_atr': True, 'bull_use_adx': True, 'bull_use_spike': True, 'bull_rsi_required': False, 'bear_strategy': 'breakout', 'bear_bb_std_mult': 3.5145789662319906, 'bear_rsi_os': 17, 'bear_rsi_ob': 49, 'bear_adx_thresh': 17.223565577659212, 'bear_atr_min_pct': 0.012667671923077693, 'bear_atr_max_pct': 0.07672140274997001, 'bear_tp_mult': 2.532587829883994, 'bear_tsl_mult': 0.42324554460407726, 'bear_time_stop': 232, 'bear_use_sma': False, 'bear_use_ema': False, 'bear_use_atr': False, 'bear_use_adx': True, 'bear_use_spike': True, 'bear_rsi_required': False, 'sideways_strategy': 'breakout', 'sideways_bb_std_mult': 3.1744164392734233, 'sideways_rsi_os': 6, 'sideways_rsi_ob': 86, 'sideways_adx_thresh': 5.919555799695388, 'sideways_atr_min_pct': 0.0033920112727338636, 'sideways_atr_max_pct': 0.06406813942981077, 'sideways_tp_mult': 1.7803465523879414, 'sideways_tsl_mult': 0.23269146548760888, 'sideways_time_stop': 6, 'sideways_use_sma': True, 'sideways_use_ema': True, 'sideways_use_atr': True, 'sideways_use_adx': True, 'sideways_use_spike': False, 'sideways_rsi_required': False}.
[I 2025-09-01 04:19:36,916] Trial 103 finished with values: [-0.11210269036338538, 0.11195270960747061] and parameters: {'p_sma': 48, 'p_std': 42, 'p_atr': 18, 'p_adx': 10, 'rsi_period': 23, 'ema1': 6, 'ema2': 31, 'slip_atr_k': 0.0682428364576344, 'slip_spread_k': 0.863526114522347, 'spread_hl_frac': 0.030106587072847347, 'bb_std_mult': 1.8118078658757175, 'rsi_os': 44, 'rsi_ob': 92, 'vol_spike': 0.252128275266594, 'adx_thresh': 20.175303089530964, 'atr_min_pct': 0.01370492219768894, 'atr_max_pct': 0.025787457579010617, 'tp_mult': 2.279438917742318, 'tsl_mult': 0.14098842526101135, 'strategy': 'breakout', 'time_stop': 166, 'use_sma': True, 'use_atr': True, 'use_adx': False, 'use_ema': False, 'use_spike': True, 'rsi_required': False, 'edge_k': 0.5612456037973178, 'edge_cap': 0.558336767969861, 'bull_strategy': 'breakout', 'bull_bb_std_mult': 1.5860769217771233, 'bull_rsi_os': 27, 'bull_rsi_ob': 65, 'bull_adx_thresh': 29.360981028896852, 'bull_atr_min_pct': 0.02579788096018502, 'bull_atr_max_pct': 0.030473845339714027, 'bull_tp_mult': 1.7879347642922578, 'bull_tsl_mult': 0.8778294112637359, 'bull_time_stop': 272, 'bull_use_sma': True, 'bull_use_ema': False, 'bull_use_atr': True, 'bull_use_adx': True, 'bull_use_spike': True, 'bull_rsi_required': False, 'bear_strategy': 'breakout', 'bear_bb_std_mult': 1.909402310365134, 'bear_rsi_os': 17, 'bear_rsi_ob': 51, 'bear_adx_thresh': 34.066637883783876, 'bear_atr_min_pct': 0.007017202177243335, 'bear_atr_max_pct': 0.1465798594919272, 'bear_tp_mult': 2.2751454039843244, 'bear_tsl_mult': 0.25379167792266666, 'bear_time_stop': 152, 'bear_use_sma': True, 'bear_use_ema': False, 'bear_use_atr': False, 'bear_use_adx': True, 'bear_use_spike': True, 'bear_rsi_required': False, 'sideways_strategy': 'breakout', 'sideways_bb_std_mult': 2.6270961271078885, 'sideways_rsi_os': 37, 'sideways_rsi_ob': 59, 'sideways_adx_thresh': 22.401732417642926, 'sideways_atr_min_pct': 0.001051330114358128, 'sideways_atr_max_pct': 0.06292118239320363, 'sideways_tp_mult': 2.1365086008150174, 'sideways_tsl_mult': 0.21931281206689918, 'sideways_time_stop': 271, 'sideways_use_sma': True, 'sideways_use_ema': True, 'sideways_use_atr': True, 'sideways_use_adx': True, 'sideways_use_spike': False, 'sideways_rsi_required': False}.
[I 2025-09-01 04:19:37,763] Trial 100 finished with values: [-1000000000.0, 1000000000.0] and parameters: {'p_sma': 38, 'p_std': 9, 'p_atr': 19, 'p_adx': 10, 'rsi_period': 55, 'ema1': 6, 'ema2': 38, 'slip_atr_k': 0.07547673093107798, 'slip_spread_k': 0.9125615843060741, 'spread_hl_frac': 0.029958390694426247, 'bb_std_mult': 0.5574591614819016, 'rsi_os': 41, 'rsi_ob': 55, 'vol_spike': 0.0679930154608577, 'adx_thresh': 14.231159723757983, 'atr_min_pct': 0.025244018955206744, 'atr_max_pct': 0.04013043902372886, 'tp_mult': 2.221783143048154, 'tsl_mult': 0.4969157347105231, 'strategy': 'breakout', 'time_stop': 284, 'use_sma': False, 'use_atr': False, 'use_adx': False, 'use_ema': True, 'use_spike': True, 'rsi_required': True, 'edge_k': 0.1266911969072695, 'edge_cap': 0.5451171012606761, 'bull_strategy': 'mean_reversion', 'bull_bb_std_mult': 3.284004995358094, 'bull_rsi_os': 24, 'bull_rsi_ob': 54, 'bull_adx_thresh': 29.54213503874525, 'bull_atr_min_pct': 0.009880003541618613, 'bull_atr_max_pct': 0.0849825476663521, 'bull_tp_mult': 1.3914650736222642, 'bull_tsl_mult': 0.7341243104848422, 'bull_time_stop': 102, 'bull_use_sma': True, 'bull_use_ema': False, 'bull_use_atr': True, 'bull_use_adx': True, 'bull_use_spike': True, 'bull_rsi_required': False, 'bear_strategy': 'breakout', 'bear_bb_std_mult': 1.8710484491825912, 'bear_rsi_os': 39, 'bear_rsi_ob': 48, 'bear_adx_thresh': 19.57217317510603, 'bear_atr_min_pct': 0.013090964135329331, 'bear_atr_max_pct': 0.0746975629180811, 'bear_tp_mult': 2.568532397639032, 'bear_tsl_mult': 0.4990548351995898, 'bear_time_stop': 233, 'bear_use_sma': False, 'bear_use_ema': False, 'bear_use_atr': False, 'bear_use_adx': True, 'bear_use_spike': True, 'bear_rsi_required': False, 'sideways_strategy': 'mean_reversion', 'sideways_bb_std_mult': 2.8795487545068275, 'sideways_rsi_os': 36, 'sideways_rsi_ob': 63, 'sideways_adx_thresh': 17.080740262693272, 'sideways_atr_min_pct': 0.0009238524742973698, 'sideways_atr_max_pct': 0.06384245608554173, 'sideways_tp_mult': 1.767682290248854, 'sideways_tsl_mult': 0.01728206478504224, 'sideways_time_stop': 192, 'sideways_use_sma': True, 'sideways_use_ema': True, 'sideways_use_atr': True, 'sideways_use_adx': False, 'sideways_use_spike': True, 'sideways_rsi_required': True}.
[I 2025-09-01 04:19:37,775] Trial 101 finished with values: [-0.07028052658448791, 0.07009953985317709] and parameters: {'p_sma': 37, 'p_std': 30, 'p_atr': 19, 'p_adx': 11, 'rsi_period': 23, 'ema1': 6, 'ema2': 40, 'slip_atr_k': 0.17168814229001794, 'slip_spread_k': 0.8991270774543898, 'spread_hl_frac': 0.014160059655828481, 'bb_std_mult': 0.581947801093355, 'rsi_os': 41, 'rsi_ob': 73, 'vol_spike': 0.07009597162226229, 'adx_thresh': 14.252677605872982, 'atr_min_pct': 0.02514003755140417, 'atr_max_pct': 0.08810399539583114, 'tp_mult': 2.1422306990635427, 'tsl_mult': 0.16632114475701826, 'strategy': 'breakout', 'time_stop': 37, 'use_sma': True, 'use_atr': True, 'use_adx': False, 'use_ema': True, 'use_spike': True, 'rsi_required': True, 'edge_k': 0.565930146570585, 'edge_cap': 0.8269449238999507, 'bull_strategy': 'breakout', 'bull_bb_std_mult': 1.6783647389524023, 'bull_rsi_os': 24, 'bull_rsi_ob': 48, 'bull_adx_thresh': 12.616622543506748, 'bull_atr_min_pct': 0.007536669656906952, 'bull_atr_max_pct': 0.06471710071633577, 'bull_tp_mult': 1.5144728317791938, 'bull_tsl_mult': 0.6473474018465123, 'bull_time_stop': 117, 'bull_use_sma': True, 'bull_use_ema': False, 'bull_use_atr': True, 'bull_use_adx': False, 'bull_use_spike': True, 'bull_rsi_required': False, 'bear_strategy': 'mean_reversion', 'bear_bb_std_mult': 1.9069410160712574, 'bear_rsi_os': 43, 'bear_rsi_ob': 48, 'bear_adx_thresh': 34.723609070250035, 'bear_atr_min_pct': 0.013220780190871044, 'bear_atr_max_pct': 0.10489753431618593, 'bear_tp_mult': 2.0475357806878933, 'bear_tsl_mult': 0.38600817999407316, 'bear_time_stop': 269, 'bear_use_sma': False, 'bear_use_ema': False, 'bear_use_atr': False, 'bear_use_adx': True, 'bear_use_spike': True, 'bear_rsi_required': False, 'sideways_strategy': 'breakout', 'sideways_bb_std_mult': 3.1671158822579115, 'sideways_rsi_os': 31, 'sideways_rsi_ob': 86, 'sideways_adx_thresh': 22.666268814645456, 'sideways_atr_min_pct': 0.001055382160574301, 'sideways_atr_max_pct': 0.06371093660458774, 'sideways_tp_mult': 1.942886087909003, 'sideways_tsl_mult': 0.29975105284070264, 'sideways_time_stop': 145, 'sideways_use_sma': True, 'sideways_use_ema': True, 'sideways_use_atr': False, 'sideways_use_adx': True, 'sideways_use_spike': False, 'sideways_rsi_required': True}.
[I 2025-09-01 04:20:18,264] Trial 107 finished with values: [-0.18597563780105408, 0.18582411357784717] and parameters: {'p_sma': 34, 'p_std': 7, 'p_atr': 8, 'p_adx': 22, 'rsi_period': 28, 'ema1': 21, 'ema2': 42, 'slip_atr_k': 0.05003194250874672, 'slip_spread_k': 0.8352706725747514, 'spread_hl_frac': 0.008244118424707325, 'bb_std_mult': 3.118846480819834, 'rsi_os': 42, 'rsi_ob': 76, 'vol_spike': 0.0822201896886641, 'adx_thresh': 21.38599536120208, 'atr_min_pct': 0.006227279577327896, 'atr_max_pct': 0.09187404209326988, 'tp_mult': 1.2916539643207363, 'tsl_mult': 0.4591451094068837, 'strategy': 'mean_reversion', 'time_stop': 31, 'use_sma': False, 'use_atr': False, 'use_adx': True, 'use_ema': False, 'use_spike': True, 'rsi_required': True, 'edge_k': 1.0251785981556965, 'edge_cap': 0.7953699986259748, 'bull_strategy': 'mean_reversion', 'bull_bb_std_mult': 2.5613650275734647, 'bull_rsi_os': 22, 'bull_rsi_ob': 66, 'bull_adx_thresh': 12.613273055561235, 'bull_atr_min_pct': 0.011376376273762699, 'bull_atr_max_pct': 0.07576824259707889, 'bull_tp_mult': 2.4226227867399173, 'bull_tsl_mult': 0.6853585762813719, 'bull_time_stop': 120, 'bull_use_sma': False, 'bull_use_ema': True, 'bull_use_atr': True, 'bull_use_adx': False, 'bull_use_spike': True, 'bull_rsi_required': False, 'bear_strategy': 'mean_reversion', 'bear_bb_std_mult': 1.5197617477047851, 'bear_rsi_os': 13, 'bear_rsi_ob': 66, 'bear_adx_thresh': 22.771364157391382, 'bear_atr_min_pct': 0.014361449457774744, 'bear_atr_max_pct': 0.12194480591636819, 'bear_tp_mult': 1.5690741573054958, 'bear_tsl_mult': 0.42464788704022155, 'bear_time_stop': 168, 'bear_use_sma': True, 'bear_use_ema': True, 'bear_use_atr': True, 'bear_use_adx': False, 'bear_use_spike': True, 'bear_rsi_required': True, 'sideways_strategy': 'mean_reversion', 'sideways_bb_std_mult': 2.0591310474039597, 'sideways_rsi_os': 35, 'sideways_rsi_ob': 56, 'sideways_adx_thresh': 18.515007902505708, 'sideways_atr_min_pct': 0.0013724117730670035, 'sideways_atr_max_pct': 0.03276782941201545, 'sideways_tp_mult': 1.8546458398879297, 'sideways_tsl_mult': 0.29689226276452063, 'sideways_time_stop': 141, 'sideways_use_sma': True, 'sideways_use_ema': False, 'sideways_use_atr': False, 'sideways_use_adx': True, 'sideways_use_spike': False, 'sideways_rsi_required': True}.
[I 2025-09-01 04:20:19,000] Trial 106 finished with values: [-0.07035092576263724, 0.07018132956366996] and parameters: {'p_sma': 57, 'p_std': 21, 'p_atr': 8, 'p_adx': 22, 'rsi_period': 7, 'ema1': 10, 'ema2': 41, 'slip_atr_k': 0.12012942417653755, 'slip_spread_k': 0.8334644745995456, 'spread_hl_frac': 0.010220345238412663, 'bb_std_mult': 3.139942959960323, 'rsi_os': 15, 'rsi_ob': 88, 'vol_spike': 0.009813429649277366, 'adx_thresh': 23.07782647324481, 'atr_min_pct': 0.0007511565742691802, 'atr_max_pct': 0.08979291145567045, 'tp_mult': 1.284808739098836, 'tsl_mult': 0.4503831759924848, 'strategy': 'mean_reversion', 'time_stop': 37, 'use_sma': False, 'use_atr': False, 'use_adx': True, 'use_ema': False, 'use_spike': True, 'rsi_required': True, 'edge_k': 0.4862124727727135, 'edge_cap': 0.787361365909893, 'bull_strategy': 'mean_reversion', 'bull_bb_std_mult': 1.4861008314948387, 'bull_rsi_os': 51, 'bull_rsi_ob': 94, 'bull_adx_thresh': 12.85913401295589, 'bull_atr_min_pct': 0.011316686089498491, 'bull_atr_max_pct': 0.08169959471413725, 'bull_tp_mult': 1.2952031116911142, 'bull_tsl_mult': 0.6432390184134849, 'bull_time_stop': 257, 'bull_use_sma': False, 'bull_use_ema': True, 'bull_use_atr': True, 'bull_use_adx': False, 'bull_use_spike': True, 'bull_rsi_required': False, 'bear_strategy': 'mean_reversion', 'bear_bb_std_mult': 3.5289397800484696, 'bear_rsi_os': 15, 'bear_rsi_ob': 89, 'bear_adx_thresh': 22.630316392234377, 'bear_atr_min_pct': 0.010080322379321554, 'bear_atr_max_pct': 0.09289992204896774, 'bear_tp_mult': 1.4358222162141263, 'bear_tsl_mult': 0.5006478375048982, 'bear_time_stop': 166, 'bear_use_sma': True, 'bear_use_ema': True, 'bear_use_atr': True, 'bear_use_adx': False, 'bear_use_spike': True, 'bear_rsi_required': True, 'sideways_strategy': 'mean_reversion', 'sideways_bb_std_mult': 2.994614887847897, 'sideways_rsi_os': 35, 'sideways_rsi_ob': 52, 'sideways_adx_thresh': 18.60504416223651, 'sideways_atr_min_pct': 0.002479909796946537, 'sideways_atr_max_pct': 0.09269069101033303, 'sideways_tp_mult': 1.867100025685961, 'sideways_tsl_mult': 0.6053178656172069, 'sideways_time_stop': 141, 'sideways_use_sma': True, 'sideways_use_ema': False, 'sideways_use_atr': False, 'sideways_use_adx': True, 'sideways_use_spike': False, 'sideways_rsi_required': True}.
[I 2025-09-01 04:20:19,548] Trial 105 finished with values: [-1000000000.0, 1000000000.0] and parameters: {'p_sma': 34, 'p_std': 38, 'p_atr': 18, 'p_adx': 13, 'rsi_period': 23, 'ema1': 6, 'ema2': 42, 'slip_atr_k': 0.07118049612133559, 'slip_spread_k': 0.8653571737208786, 'spread_hl_frac': 0.03060802296211353, 'bb_std_mult': 0.9132665362438356, 'rsi_os': 41, 'rsi_ob': 77, 'vol_spike': 0.07520945790878357, 'adx_thresh': 21.246676045440328, 'atr_min_pct': 0.015537250364825889, 'atr_max_pct': 0.025620346864492355, 'tp_mult': 1.7623064329987197, 'tsl_mult': 0.4535506597742495, 'strategy': 'breakout', 'time_stop': 75, 'use_sma': False, 'use_atr': False, 'use_adx': True, 'use_ema': False, 'use_spike': True, 'rsi_required': True, 'edge_k': 0.7643161284265947, 'edge_cap': 0.5482152694117606, 'bull_strategy': 'mean_reversion', 'bull_bb_std_mult': 1.5940077474300391, 'bull_rsi_os': 31, 'bull_rsi_ob': 65, 'bull_adx_thresh': 12.93741896164587, 'bull_atr_min_pct': 0.010047522722741172, 'bull_atr_max_pct': 0.08570557716946588, 'bull_tp_mult': 1.7788803871914929, 'bull_tsl_mult': 0.6554155313247604, 'bull_time_stop': 115, 'bull_use_sma': False, 'bull_use_ema': False, 'bull_use_atr': True, 'bull_use_adx': True, 'bull_use_spike': True, 'bull_rsi_required': False, 'bear_strategy': 'breakout', 'bear_bb_std_mult': 3.5207513252065947, 'bear_rsi_os': 13, 'bear_rsi_ob': 95, 'bear_adx_thresh': 34.499568024603185, 'bear_atr_min_pct': 0.007736355156302603, 'bear_atr_max_pct': 0.07449952499333894, 'bear_tp_mult': 1.580036566790668, 'bear_tsl_mult': 0.3872759143382141, 'bear_time_stop': 152, 'bear_use_sma': True, 'bear_use_ema': False, 'bear_use_atr': False, 'bear_use_adx': True, 'bear_use_spike': True, 'bear_rsi_required': False, 'sideways_strategy': 'mean_reversion', 'sideways_bb_std_mult': 3.0040105720800714, 'sideways_rsi_os': 35, 'sideways_rsi_ob': 59, 'sideways_adx_thresh': 8.783588147491775, 'sideways_atr_min_pct': 0.0024406754202849403, 'sideways_atr_max_pct': 0.09352621420927965, 'sideways_tp_mult': 1.8753291706667892, 'sideways_tsl_mult': 0.48225048736579224, 'sideways_time_stop': 268, 'sideways_use_sma': True, 'sideways_use_ema': True, 'sideways_use_atr': True, 'sideways_use_adx': True, 'sideways_use_spike': False, 'sideways_rsi_required': True}.
[I 2025-09-01 04:20:20,081] Trial 104 finished with values: [-1000000000.0, 1000000000.0] and parameters: {'p_sma': 34, 'p_std': 8, 'p_atr': 8, 'p_adx': 13, 'rsi_period': 23, 'ema1': 6, 'ema2': 31, 'slip_atr_k': 0.07042258138055349, 'slip_spread_k': 0.836465607394176, 'spread_hl_frac': 0.0302516084386371, 'bb_std_mult': 2.7672350460231856, 'rsi_os': 10, 'rsi_ob': 77, 'vol_spike': 0.12164883464537365, 'adx_thresh': 21.220979263831914, 'atr_min_pct': 0.01581917357541171, 'atr_max_pct': 0.025728881508755817, 'tp_mult': 2.2560774801643553, 'tsl_mult': 0.45085298509927085, 'strategy': 'breakout', 'time_stop': 76, 'use_sma': False, 'use_atr': False, 'use_adx': True, 'use_ema': False, 'use_spike': True, 'rsi_required': True, 'edge_k': 0.8400212406200461, 'edge_cap': 0.786829133700867, 'bull_strategy': 'mean_reversion', 'bull_bb_std_mult': 1.5299451803407507, 'bull_rsi_os': 28, 'bull_rsi_ob': 65, 'bull_adx_thresh': 12.35046727654187, 'bull_atr_min_pct': 0.009638365822024928, 'bull_atr_max_pct': 0.08497842668480521, 'bull_tp_mult': 2.490015814552878, 'bull_tsl_mult': 0.6795267516412125, 'bull_time_stop': 117, 'bull_use_sma': False, 'bull_use_ema': False, 'bull_use_atr': True, 'bull_use_adx': True, 'bull_use_spike': True, 'bull_rsi_required': False, 'bear_strategy': 'breakout', 'bear_bb_std_mult': 3.3226068009299627, 'bear_rsi_os': 13, 'bear_rsi_ob': 77, 'bear_adx_thresh': 22.708335951479246, 'bear_atr_min_pct': 0.007172953880592451, 'bear_atr_max_pct': 0.14513926227201407, 'bear_tp_mult': 2.2771080793584693, 'bear_tsl_mult': 0.4958802171246839, 'bear_time_stop': 152, 'bear_use_sma': True, 'bear_use_ema': False, 'bear_use_atr': False, 'bear_use_adx': True, 'bear_use_spike': True, 'bear_rsi_required': False, 'sideways_strategy': 'mean_reversion', 'sideways_bb_std_mult': 2.616080787621337, 'sideways_rsi_os': 37, 'sideways_rsi_ob': 61, 'sideways_adx_thresh': 18.47431412956435, 'sideways_atr_min_pct': 0.0011440255636461373, 'sideways_atr_max_pct': 0.05573484266813288, 'sideways_tp_mult': 1.8529461122265527, 'sideways_tsl_mult': 0.31555099649088203, 'sideways_time_stop': 213, 'sideways_use_sma': True, 'sideways_use_ema': True, 'sideways_use_atr': True, 'sideways_use_adx': True, 'sideways_use_spike': False, 'sideways_rsi_required': True}.
