[I 2025-09-01 04:54:37,499] Trial 303 finished with values: [-0.014350473516201001, 0.014265408312109946] and parameters: {'p_sma': 25, 'p_std': 57, 'p_atr': 27, 'p_adx': 19, 'rsi_period': 8, 'ema1': 29, 'ema2': 29, 'slip_atr_k': 0.005880092797882714, 'slip_spread_k': 0.2918183868162736, 'spread_hl_frac': 0.04616795722275603, 'bb_std_mult': 3.440072797234144, 'rsi_os': 23, 'rsi_ob': 87, 'vol_spike': 0.2212649322884168, 'adx_thresh': 14.44450140220726, 'atr_min_pct': 0.023423567892192063, 'atr_max_pct': 0.11480542696669051, 'tp_mult': 2.5340477331430242, 'tsl_mult': 0.9777057388378161, 'strategy': 'breakout', 'time_stop': 34, 'use_sma': False, 'use_atr': False, 'use_adx': False, 'use_ema': True, 'use_spike': True, 'rsi_required': False, 'edge_k': 0.5686023501437822, 'edge_cap': 0.49790293224877635, 'bull_strategy': 'breakout', 'bull_bb_std_mult': 2.3310758909799305, 'bull_rsi_os': 25, 'bull_rsi_ob': 89, 'bull_adx_thresh': 18.078572486727836, 'bull_atr_min_pct': 0.0014925989949820695, 'bull_atr_max_pct': 0.11845608221948355, 'bull_tp_mult': 1.5627885953275273, 'bull_tsl_mult': 0.4176869954336184, 'bull_time_stop': 238, 'bull_use_sma': True, 'bull_use_ema': False, 'bull_use_atr': False, 'bull_use_adx': False, 'bull_use_spike': False, 'bull_rsi_required': True, 'bear_strategy': 'mean_reversion', 'bear_bb_std_mult': 0.7832876728115479, 'bear_rsi_os': 10, 'bear_rsi_ob': 65, 'bear_adx_thresh': 28.897072290361073, 'bear_atr_min_pct': 0.029464853247043565, 'bear_atr_max_pct': 0.06200359303445324, 'bear_tp_mult': 1.3134504848389228, 'bear_tsl_mult': 0.6031653254615787, 'bear_time_stop': 206, 'bear_use_sma': True, 'bear_use_ema': False, 'bear_use_atr': False, 'bear_use_adx': False, 'bear_use_spike': False, 'bear_rsi_required': False, 'sideways_strategy': 'breakout', 'sideways_bb_std_mult': 0.7466142464676513, 'sideways_rsi_os': 42, 'sideways_rsi_ob': 55, 'sideways_adx_thresh': 18.11149508141281, 'sideways_atr_min_pct': 0.023969607557425426, 'sideways_atr_max_pct': 0.11044535506990288, 'sideways_tp_mult': 1.5690732446416162, 'sideways_tsl_mult': 0.9787695540994045, 'sideways_time_stop': 180, 'sideways_use_sma': True, 'sideways_use_ema': True, 'sideways_use_atr': False, 'sideways_use_adx': False, 'sideways_use_spike': True, 'sideways_rsi_required': False}.
[I 2025-09-01 04:55:22,380] Trial 308 finished with values: [-1000000000.0, 1000000000.0] and parameters: {'p_sma': 34, 'p_std': 44, 'p_atr': 12, 'p_adx': 19, 'rsi_period': 59, 'ema1': 30, 'ema2': 29, 'slip_atr_k': 0.005942231691484551, 'slip_spread_k': 0.23496882658491478, 'spread_hl_frac': 0.043270266128394755, 'bb_std_mult': 2.701401332382891, 'rsi_os': 25, 'rsi_ob': 57, 'vol_spike': 0.08249871164701765, 'adx_thresh': 27.396268268168765, 'atr_min_pct': 0.0005298309177954565, 'atr_max_pct': 0.0612394708797922, 'tp_mult': 2.524870190037229, 'tsl_mult': 0.9518611543873432, 'strategy': 'breakout', 'time_stop': 48, 'use_sma': True, 'use_atr': False, 'use_adx': False, 'use_ema': False, 'use_spike': True, 'rsi_required': False, 'edge_k': 1.548633121817272, 'edge_cap': 0.17092083605418948, 'bull_strategy': 'mean_reversion', 'bull_bb_std_mult': 2.3910736484907207, 'bull_rsi_os': 27, 'bull_rsi_ob': 89, 'bull_adx_thresh': 32.5414505399807, 'bull_atr_min_pct': 0.021045586213185967, 'bull_atr_max_pct': 0.1497753128439262, 'bull_tp_mult': 1.3642420796827293, 'bull_tsl_mult': 0.3588120233047224, 'bull_time_stop': 265, 'bull_use_sma': True, 'bull_use_ema': True, 'bull_use_atr': True, 'bull_use_adx': True, 'bull_use_spike': False, 'bull_rsi_required': False, 'bear_strategy': 'breakout', 'bear_bb_std_mult': 1.0075047146966318, 'bear_rsi_os': 50, 'bear_rsi_ob': 58, 'bear_adx_thresh': 13.707253463735965, 'bear_atr_min_pct': 0.025076266061373864, 'bear_atr_max_pct': 0.1473753198514284, 'bear_tp_mult': 2.0211581187608303, 'bear_tsl_mult': 0.18574978286041965, 'bear_time_stop': 210, 'bear_use_sma': True, 'bear_use_ema': True, 'bear_use_atr': True, 'bear_use_adx': True, 'bear_use_spike': False, 'bear_rsi_required': True, 'sideways_strategy': 'mean_reversion', 'sideways_bb_std_mult': 3.3645831852120596, 'sideways_rsi_os': 8, 'sideways_rsi_ob': 67, 'sideways_adx_thresh': 22.38448557115354, 'sideways_atr_min_pct': 0.023538021978959996, 'sideways_atr_max_pct': 0.09653637348364348, 'sideways_tp_mult': 1.57249116267221, 'sideways_tsl_mult': 0.9695451709524979, 'sideways_time_stop': 197, 'sideways_use_sma': False, 'sideways_use_ema': False, 'sideways_use_atr': True, 'sideways_use_adx': False, 'sideways_use_spike': False, 'sideways_rsi_required': True}.
[I 2025-09-01 04:55:23,209] Trial 307 finished with values: [-0.03133686221742904, 0.03119435520184608] and parameters: {'p_sma': 20, 'p_std': 44, 'p_atr': 12, 'p_adx': 11, 'rsi_period': 25, 'ema1': 29, 'ema2': 46, 'slip_atr_k': 0.22325353296379902, 'slip_spread_k': 0.5824428599510512, 'spread_hl_frac': 0.042874830986899544, 'bb_std_mult': 0.8554856250596352, 'rsi_os': 48, 'rsi_ob': 57, 'vol_spike': 0.08367565100006363, 'adx_thresh': 14.53142418661897, 'atr_min_pct': 0.0006948444835491945, 'atr_max_pct': 0.05908110445334655, 'tp_mult': 1.955173643553595, 'tsl_mult': 0.9157843287134096, 'strategy': 'breakout', 'time_stop': 242, 'use_sma': True, 'use_atr': False, 'use_adx': False, 'use_ema': True, 'use_spike': True, 'rsi_required': False, 'edge_k': 0.5359255900575688, 'edge_cap': 0.11204875909541387, 'bull_strategy': 'mean_reversion', 'bull_bb_std_mult': 1.7337909261562565, 'bull_rsi_os': 27, 'bull_rsi_ob': 89, 'bull_adx_thresh': 16.054893247309202, 'bull_atr_min_pct': 0.0009161221703236645, 'bull_atr_max_pct': 0.018084514159018468, 'bull_tp_mult': 1.5556813428640937, 'bull_tsl_mult': 0.4988320855037388, 'bull_time_stop': 224, 'bull_use_sma': True, 'bull_use_ema': False, 'bull_use_atr': True, 'bull_use_adx': False, 'bull_use_spike': False, 'bull_rsi_required': False, 'bear_strategy': 'mean_reversion', 'bear_bb_std_mult': 0.9611354512593875, 'bear_rsi_os': 45, 'bear_rsi_ob': 69, 'bear_adx_thresh': 6.700923144321024, 'bear_atr_min_pct': 0.028777183484685942, 'bear_atr_max_pct': 0.14742205466374533, 'bear_tp_mult': 1.483783426663107, 'bear_tsl_mult': 0.810251449377033, 'bear_time_stop': 206, 'bear_use_sma': True, 'bear_use_ema': False, 'bear_use_atr': True, 'bear_use_adx': True, 'bear_use_spike': False, 'bear_rsi_required': False, 'sideways_strategy': 'breakout', 'sideways_bb_std_mult': 1.5506028981298325, 'sideways_rsi_os': 8, 'sideways_rsi_ob': 63, 'sideways_adx_thresh': 16.818417346862088, 'sideways_atr_min_pct': 0.02365438985356678, 'sideways_atr_max_pct': 0.12691265553170292, 'sideways_tp_mult': 2.826884174561049, 'sideways_tsl_mult': 0.10480715903871929, 'sideways_time_stop': 206, 'sideways_use_sma': True, 'sideways_use_ema': False, 'sideways_use_atr': False, 'sideways_use_adx': False, 'sideways_use_spike': True, 'sideways_rsi_required': False}.
[I 2025-09-01 04:55:23,588] Trial 309 finished with values: [-1000000000.0, 1000000000.0] and parameters: {'p_sma': 60, 'p_std': 12, 'p_atr': 12, 'p_adx': 19, 'rsi_period': 58, 'ema1': 9, 'ema2': 45, 'slip_atr_k': 0.19215017742422133, 'slip_spread_k': 0.2383391470607308, 'spread_hl_frac': 0.04346850944528935, 'bb_std_mult': 2.6972035779382395, 'rsi_os': 46, 'rsi_ob': 57, 'vol_spike': 0.1963185991024764, 'adx_thresh': 26.851690624934474, 'atr_min_pct': 0.020043920850434643, 'atr_max_pct': 0.06665486297761243, 'tp_mult': 2.364766250032189, 'tsl_mult': 0.5569411229609719, 'strategy': 'mean_reversion', 'time_stop': 56, 'use_sma': True, 'use_atr': True, 'use_adx': True, 'use_ema': False, 'use_spike': False, 'rsi_required': True, 'edge_k': 1.948287769892501, 'edge_cap': 0.18815747596605784, 'bull_strategy': 'mean_reversion', 'bull_bb_std_mult': 2.405269714043484, 'bull_rsi_os': 27, 'bull_rsi_ob': 82, 'bull_adx_thresh': 18.891582844600055, 'bull_atr_min_pct': 0.0006917939316544762, 'bull_atr_max_pct': 0.131550918012355, 'bull_tp_mult': 2.170091688274132, 'bull_tsl_mult': 0.354207515440123, 'bull_time_stop': 224, 'bull_use_sma': False, 'bull_use_ema': True, 'bull_use_atr': True, 'bull_use_adx': True, 'bull_use_spike': True, 'bull_rsi_required': False, 'bear_strategy': 'breakout', 'bear_bb_std_mult': 1.0649148488022646, 'bear_rsi_os': 23, 'bear_rsi_ob': 58, 'bear_adx_thresh': 28.759221354914636, 'bear_atr_min_pct': 0.008447299883587918, 'bear_atr_max_pct': 0.057549827770269985, 'bear_tp_mult': 1.7512265084489946, 'bear_tsl_mult': 0.12599115774273684, 'bear_time_stop': 159, 'bear_use_sma': False, 'bear_use_ema': False, 'bear_use_atr': True, 'bear_use_adx': True, 'bear_use_spike': True, 'bear_rsi_required': False, 'sideways_strategy': 'mean_reversion', 'sideways_bb_std_mult': 2.1210930588708536, 'sideways_rsi_os': 15, 'sideways_rsi_ob': 91, 'sideways_adx_thresh': 16.299062973179684, 'sideways_atr_min_pct': 0.023432933607917428, 'sideways_atr_max_pct': 0.09615802810783552, 'sideways_tp_mult': 2.7099757072476076, 'sideways_tsl_mult': 0.9756671280023392, 'sideways_time_stop': 110, 'sideways_use_sma': True, 'sideways_use_ema': False, 'sideways_use_atr': True, 'sideways_use_adx': True, 'sideways_use_spike': False, 'sideways_rsi_required': True}.
[I 2025-09-01 04:55:24,116] Trial 310 finished with values: [-1000000000.0, 1000000000.0] and parameters: {'p_sma': 27, 'p_std': 55, 'p_atr': 28, 'p_adx': 11, 'rsi_period': 8, 'ema1': 28, 'ema2': 31, 'slip_atr_k': 0.024348559855641157, 'slip_spread_k': 0.24670946323356624, 'spread_hl_frac': 0.047119519986606066, 'bb_std_mult': 3.442418604589472, 'rsi_os': 23, 'rsi_ob': 89, 'vol_spike': 0.18412319675259725, 'adx_thresh': 30.471172547522634, 'atr_min_pct': 0.02367398460957683, 'atr_max_pct': 0.11123638658184967, 'tp_mult': 2.622528934020995, 'tsl_mult': 0.9917982226248054, 'strategy': 'mean_reversion', 'time_stop': 48, 'use_sma': False, 'use_atr': True, 'use_adx': True, 'use_ema': False, 'use_spike': False, 'rsi_required': True, 'edge_k': 0.5226683313840068, 'edge_cap': 0.4548091815226302, 'bull_strategy': 'breakout', 'bull_bb_std_mult': 1.7171305087428452, 'bull_rsi_os': 17, 'bull_rsi_ob': 66, 'bull_adx_thresh': 16.719295545197333, 'bull_atr_min_pct': 0.003259436573442665, 'bull_atr_max_pct': 0.11524987388224146, 'bull_tp_mult': 1.518350719400009, 'bull_tsl_mult': 0.46709164712733053, 'bull_time_stop': 269, 'bull_use_sma': False, 'bull_use_ema': True, 'bull_use_atr': False, 'bull_use_adx': True, 'bull_use_spike': True, 'bull_rsi_required': True, 'bear_strategy': 'breakout', 'bear_bb_std_mult': 0.7536337769092623, 'bear_rsi_os': 7, 'bear_rsi_ob': 65, 'bear_adx_thresh': 28.623377648313298, 'bear_atr_min_pct': 0.02704053340109336, 'bear_atr_max_pct': 0.061893542722534556, 'bear_tp_mult': 1.3931798902308312, 'bear_tsl_mult': 0.5712737649418724, 'bear_time_stop': 223, 'bear_use_sma': False, 'bear_use_ema': False, 'bear_use_atr': False, 'bear_use_adx': False, 'bear_use_spike': True, 'bear_rsi_required': False, 'sideways_strategy': 'breakout', 'sideways_bb_std_mult': 0.7659873687893538, 'sideways_rsi_os': 44, 'sideways_rsi_ob': 60, 'sideways_adx_thresh': 19.386301963894972, 'sideways_atr_min_pct': 0.025255275338386132, 'sideways_atr_max_pct': 0.12489236770028485, 'sideways_tp_mult': 1.5499193094243124, 'sideways_tsl_mult': 0.9824988499942181, 'sideways_time_stop': 111, 'sideways_use_sma': True, 'sideways_use_ema': False, 'sideways_use_atr': True, 'sideways_use_adx': True, 'sideways_use_spike': True, 'sideways_rsi_required': True}.
[I 2025-09-01 04:56:01,912] Trial 314 finished with values: [-1000000000.0, 1000000000.0] and parameters: {'p_sma': 24, 'p_std': 59, 'p_atr': 28, 'p_adx': 20, 'rsi_period': 7, 'ema1': 28, 'ema2': 32, 'slip_atr_k': 0.017934831383342877, 'slip_spread_k': 0.25951275335829976, 'spread_hl_frac': 0.048239097641024214, 'bb_std_mult': 3.4188076967945773, 'rsi_os': 20, 'rsi_ob': 79, 'vol_spike': 0.19474793659552092, 'adx_thresh': 13.057256773547683, 'atr_min_pct': 0.024423799985874645, 'atr_max_pct': 0.108501569299035, 'tp_mult': 2.6045659300067356, 'tsl_mult': 0.9927640003178051, 'strategy': 'breakout', 'time_stop': 43, 'use_sma': False, 'use_atr': False, 'use_adx': False, 'use_ema': True, 'use_spike': True, 'rsi_required': False, 'edge_k': 0.4974495832467511, 'edge_cap': 0.4935425147118059, 'bull_strategy': 'breakout', 'bull_bb_std_mult': 3.2280723354747316, 'bull_rsi_os': 18, 'bull_rsi_ob': 90, 'bull_adx_thresh': 16.654652443393, 'bull_atr_min_pct': 0.002474546316355691, 'bull_atr_max_pct': 0.11607099929826803, 'bull_tp_mult': 1.4435947144168677, 'bull_tsl_mult': 0.4594238845556863, 'bull_time_stop': 251, 'bull_use_sma': True, 'bull_use_ema': False, 'bull_use_atr': False, 'bull_use_adx': False, 'bull_use_spike': False, 'bull_rsi_required': True, 'bear_strategy': 'mean_reversion', 'bear_bb_std_mult': 0.6280720218567659, 'bear_rsi_os': 10, 'bear_rsi_ob': 64, 'bear_adx_thresh': 30.830027707352844, 'bear_atr_min_pct': 0.028021183482723727, 'bear_atr_max_pct': 0.06281308876889392, 'bear_tp_mult': 1.3221360628584506, 'bear_tsl_mult': 0.6567038039197711, 'bear_time_stop': 216, 'bear_use_sma': True, 'bear_use_ema': False, 'bear_use_atr': False, 'bear_use_adx': False, 'bear_use_spike': False, 'bear_rsi_required': False, 'sideways_strategy': 'breakout', 'sideways_bb_std_mult': 0.7040307572357182, 'sideways_rsi_os': 38, 'sideways_rsi_ob': 56, 'sideways_adx_thresh': 19.48615152758935, 'sideways_atr_min_pct': 0.02507425758175802, 'sideways_atr_max_pct': 0.11573854533069107, 'sideways_tp_mult': 1.6245629102897639, 'sideways_tsl_mult': 0.9841153873401622, 'sideways_time_stop': 161, 'sideways_use_sma': True, 'sideways_use_ema': True, 'sideways_use_atr': False, 'sideways_use_adx': False, 'sideways_use_spike': True, 'sideways_rsi_required': False}.
[I 2025-09-01 04:56:02,442] Trial 313 finished with values: [-1000000000.0, 1000000000.0] and parameters: {'p_sma': 27, 'p_std': 58, 'p_atr': 28, 'p_adx': 20, 'rsi_period': 7, 'ema1': 28, 'ema2': 31, 'slip_atr_k': 0.01852120785483112, 'slip_spread_k': 0.2535931482823787, 'spread_hl_frac': 0.04799464460726897, 'bb_std_mult': 3.46003844266902, 'rsi_os': 23, 'rsi_ob': 86, 'vol_spike': 0.17643318583037337, 'adx_thresh': 13.076328903625198, 'atr_min_pct': 0.02361033481525553, 'atr_max_pct': 0.1102001265381965, 'tp_mult': 2.6054348131237086, 'tsl_mult': 0.9829780908249577, 'strategy': 'mean_reversion', 'time_stop': 45, 'use_sma': False, 'use_atr': False, 'use_adx': True, 'use_ema': True, 'use_spike': False, 'rsi_required': True, 'edge_k': 0.5297623278982353, 'edge_cap': 0.44277305615030693, 'bull_strategy': 'breakout', 'bull_bb_std_mult': 1.069140008229867, 'bull_rsi_os': 22, 'bull_rsi_ob': 90, 'bull_adx_thresh': 16.66783429424534, 'bull_atr_min_pct': 0.0027820195557227813, 'bull_atr_max_pct': 0.11425299639093417, 'bull_tp_mult': 1.4284753393084941, 'bull_tsl_mult': 0.45552579015331957, 'bull_time_stop': 248, 'bull_use_sma': False, 'bull_use_ema': False, 'bull_use_atr': False, 'bull_use_adx': False, 'bull_use_spike': True, 'bull_rsi_required': True, 'bear_strategy': 'mean_reversion', 'bear_bb_std_mult': 0.7673775569575254, 'bear_rsi_os': 7, 'bear_rsi_ob': 65, 'bear_adx_thresh': 26.93536190967983, 'bear_atr_min_pct': 0.027915151792417003, 'bear_atr_max_pct': 0.06246997915977435, 'bear_tp_mult': 1.3123721826782506, 'bear_tsl_mult': 0.659999581159843, 'bear_time_stop': 216, 'bear_use_sma': False, 'bear_use_ema': False, 'bear_use_atr': False, 'bear_use_adx': False, 'bear_use_spike': True, 'bear_rsi_required': False, 'sideways_strategy': 'breakout', 'sideways_bb_std_mult': 0.7602960408291727, 'sideways_rsi_os': 38, 'sideways_rsi_ob': 60, 'sideways_adx_thresh': 19.35021329406531, 'sideways_atr_min_pct': 0.025185555690147406, 'sideways_atr_max_pct': 0.11591313709405801, 'sideways_tp_mult': 1.6084526202422036, 'sideways_tsl_mult': 0.9984891742793894, 'sideways_time_stop': 161, 'sideways_use_sma': True, 'sideways_use_ema': True, 'sideways_use_atr': False, 'sideways_use_adx': True, 'sideways_use_spike': True, 'sideways_rsi_required': False}.
[I 2025-09-01 04:56:03,009] Trial 312 finished with values: [-1000000000.0, 1000000000.0] and parameters: {'p_sma': 27, 'p_std': 56, 'p_atr': 28, 'p_adx': 20, 'rsi_period': 7, 'ema1': 28, 'ema2': 31, 'slip_atr_k': 0.0181692284710898, 'slip_spread_k': 0.2446856941152642, 'spread_hl_frac': 0.047990422121455774, 'bb_std_mult': 3.425551409945211, 'rsi_os': 24, 'rsi_ob': 86, 'vol_spike': 0.1966586119528692, 'adx_thresh': 13.20044473274806, 'atr_min_pct': 0.023505462763636957, 'atr_max_pct': 0.11008969925163177, 'tp_mult': 2.6039225730740676, 'tsl_mult': 0.9933863542639729, 'strategy': 'mean_reversion', 'time_stop': 52, 'use_sma': False, 'use_atr': True, 'use_adx': True, 'use_ema': False, 'use_spike': False, 'rsi_required': True, 'edge_k': 0.4993598008597989, 'edge_cap': 0.4883080470325361, 'bull_strategy': 'breakout', 'bull_bb_std_mult': 3.2712060910698133, 'bull_rsi_os': 17, 'bull_rsi_ob': 90, 'bull_adx_thresh': 17.04426013978441, 'bull_atr_min_pct': 0.0028411982730639565, 'bull_atr_max_pct': 0.11413329469719811, 'bull_tp_mult': 1.462614783016662, 'bull_tsl_mult': 0.44251323478432486, 'bull_time_stop': 252, 'bull_use_sma': False, 'bull_use_ema': True, 'bull_use_atr': False, 'bull_use_adx': True, 'bull_use_spike': True, 'bull_rsi_required': True, 'bear_strategy': 'breakout', 'bear_bb_std_mult': 0.76644270652514, 'bear_rsi_os': 10, 'bear_rsi_ob': 65, 'bear_adx_thresh': 30.583428146841552, 'bear_atr_min_pct': 0.027315729046864613, 'bear_atr_max_pct': 0.06229061814394675, 'bear_tp_mult': 1.3952292211813808, 'bear_tsl_mult': 0.6615446208168791, 'bear_time_stop': 224, 'bear_use_sma': False, 'bear_use_ema': False, 'bear_use_atr': False, 'bear_use_adx': False, 'bear_use_spike': True, 'bear_rsi_required': False, 'sideways_strategy': 'breakout', 'sideways_bb_std_mult': 0.7517530886570738, 'sideways_rsi_os': 40, 'sideways_rsi_ob': 56, 'sideways_adx_thresh': 19.09444740731711, 'sideways_atr_min_pct': 0.02494493009471768, 'sideways_atr_max_pct': 0.11613252869485274, 'sideways_tp_mult': 1.5378358741937137, 'sideways_tsl_mult': 0.9794933606594842, 'sideways_time_stop': 110, 'sideways_use_sma': True, 'sideways_use_ema': True, 'sideways_use_atr': True, 'sideways_use_adx': True, 'sideways_use_spike': True, 'sideways_rsi_required': True}.
[I 2025-09-01 04:56:03,344] Trial 311 finished with values: [-1000000000.0, 1000000000.0] and parameters: {'p_sma': 25, 'p_std': 56, 'p_atr': 28, 'p_adx': 20, 'rsi_period': 9, 'ema1': 28, 'ema2': 32, 'slip_atr_k': 0.02372422994237543, 'slip_spread_k': 0.2215410188902124, 'spread_hl_frac': 0.04823640639964268, 'bb_std_mult': 3.418293536775753, 'rsi_os': 24, 'rsi_ob': 89, 'vol_spike': 0.19936653697188023, 'adx_thresh': 13.240490463205186, 'atr_min_pct': 0.02468745894718203, 'atr_max_pct': 0.11023108550274154, 'tp_mult': 2.6260364722491083, 'tsl_mult': 0.9912602505727813, 'strategy': 'mean_reversion', 'time_stop': 44, 'use_sma': False, 'use_atr': True, 'use_adx': True, 'use_ema': True, 'use_spike': False, 'rsi_required': True, 'edge_k': 0.53610633417939, 'edge_cap': 0.45515188131672873, 'bull_strategy': 'breakout', 'bull_bb_std_mult': 2.3492806801964723, 'bull_rsi_os': 18, 'bull_rsi_ob': 88, 'bull_adx_thresh': 16.531140008622867, 'bull_atr_min_pct': 0.002864859997747821, 'bull_atr_max_pct': 0.11476778352607232, 'bull_tp_mult': 1.529061800271742, 'bull_tsl_mult': 0.45599797618837234, 'bull_time_stop': 252, 'bull_use_sma': False, 'bull_use_ema': False, 'bull_use_atr': False, 'bull_use_adx': False, 'bull_use_spike': True, 'bull_rsi_required': True, 'bear_strategy': 'mean_reversion', 'bear_bb_std_mult': 0.7669813979418614, 'bear_rsi_os': 9, 'bear_rsi_ob': 64, 'bear_adx_thresh': 28.70177814701249, 'bear_atr_min_pct': 0.02775154941803498, 'bear_atr_max_pct': 0.06058463966197327, 'bear_tp_mult': 1.40884227835822, 'bear_tsl_mult': 0.652066303094836, 'bear_time_stop': 222, 'bear_use_sma': False, 'bear_use_ema': False, 'bear_use_atr': False, 'bear_use_adx': False, 'bear_use_spike': True, 'bear_rsi_required': False, 'sideways_strategy': 'breakout', 'sideways_bb_std_mult': 0.7394603746706783, 'sideways_rsi_os': 40, 'sideways_rsi_ob': 63, 'sideways_adx_thresh': 19.62843984797709, 'sideways_atr_min_pct': 0.025056125444618486, 'sideways_atr_max_pct': 0.11081709850223957, 'sideways_tp_mult': 1.5406213378978464, 'sideways_tsl_mult': 0.9812811663403558, 'sideways_time_stop': 160, 'sideways_use_sma': True, 'sideways_use_ema': True, 'sideways_use_atr': False, 'sideways_use_adx': True, 'sideways_use_spike': True, 'sideways_rsi_required': False}.
