[I 2025-09-01 04:05:41,809] Trial 12 finished with values: [-1000000000.0, 1000000000.0] and parameters: {'p_sma': 11, 'p_std': 57, 'p_atr': 9, 'p_adx': 18, 'rsi_period': 38, 'ema1': 30, 'ema2': 35, 'slip_atr_k': 0.2469770533438214, 'slip_spread_k': 0.11695383376359292, 'spread_hl_frac': 0.02907630636425994, 'bb_std_mult': 1.388858278419981, 'rsi_os': 49, 'rsi_ob': 84, 'vol_spike': 0.07143424183935367, 'adx_thresh': 24.1612053715657, 'atr_min_pct': 0.015962160089245725, 'atr_max_pct': 0.014127377568261885, 'tp_mult': 1.3820839521663464, 'tsl_mult': 0.8143865721936339, 'strategy': 'breakout', 'time_stop': 169, 'use_sma': False, 'use_atr': False, 'use_adx': True, 'use_ema': True, 'use_spike': True, 'rsi_required': False, 'edge_k': 0.12142361116375233, 'edge_cap': 0.9256236187473023, 'bull_strategy': 'mean_reversion', 'bull_bb_std_mult': 1.56173890122946, 'bull_rsi_os': 20, 'bull_rsi_ob': 81, 'bull_adx_thresh': 6.128423304740669, 'bull_atr_min_pct': 0.001555719845821879, 'bull_atr_max_pct': 0.09707091911006802, 'bull_tp_mult': 2.6022202972628774, 'bull_tsl_mult': 0.9024497266380211, 'bull_time_stop': 239, 'bull_use_sma': False, 'bull_use_ema': False, 'bull_use_atr': False, 'bull_use_adx': True, 'bull_use_spike': False, 'bull_rsi_required': True, 'bear_strategy': 'breakout', 'bear_bb_std_mult': 2.2418787131677, 'bear_rsi_os': 55, 'bear_rsi_ob': 86, 'bear_adx_thresh': 26.861217394076334, 'bear_atr_min_pct': 0.017350234511317314, 'bear_atr_max_pct': 0.12623121298887166, 'bear_tp_mult': 1.7089053345365373, 'bear_tsl_mult': 0.433311906853442, 'bear_time_stop': 36, 'bear_use_sma': True, 'bear_use_ema': False, 'bear_use_atr': True, 'bear_use_adx': False, 'bear_use_spike': True, 'bear_rsi_required': True, 'sideways_strategy': 'mean_reversion', 'sideways_bb_std_mult': 3.4170189963880455, 'sideways_rsi_os': 25, 'sideways_rsi_ob': 78, 'sideways_adx_thresh': 27.615975390283623, 'sideways_atr_min_pct': 0.0067757399117830824, 'sideways_atr_max_pct': 0.05116809809257959, 'sideways_tp_mult': 2.175923617668512, 'sideways_tsl_mult': 0.17371735927236254, 'sideways_time_stop': 210, 'sideways_use_sma': True, 'sideways_use_ema': False, 'sideways_use_atr': False, 'sideways_use_adx': False, 'sideways_use_spike': False, 'sideways_rsi_required': False}.
[I 2025-09-01 04:05:42,240] Trial 6 finished with values: [-1000000000.0, 1000000000.0] and parameters: {'p_sma': 33, 'p_std': 26, 'p_atr': 23, 'p_adx': 21, 'rsi_period': 9, 'ema1': 6, 'ema2': 18, 'slip_atr_k': 0.12096813464530132, 'slip_spread_k': 0.29038041569877104, 'spread_hl_frac': 0.004043289144995549, 'bb_std_mult': 2.2395113626825385, 'rsi_os': 27, 'rsi_ob': 69, 'vol_spike': 0.028758178742284222, 'adx_thresh': 29.473270936101216, 'atr_min_pct': 0.0070801397246683445, 'atr_max_pct': 0.07878324754945576, 'tp_mult': 2.014446842680394, 'tsl_mult': 0.11009913731495802, 'strategy': 'mean_reversion', 'time_stop': 254, 'use_sma': False, 'use_atr': True, 'use_adx': True, 'use_ema': True, 'use_spike': True, 'rsi_required': False, 'edge_k': 0.7238219179534007, 'edge_cap': 0.9966384504147899, 'bull_strategy': 'mean_reversion', 'bull_bb_std_mult': 1.5836140736122337, 'bull_rsi_os': 23, 'bull_rsi_ob': 50, 'bull_adx_thresh': 6.741623740583261, 'bull_atr_min_pct': 0.02708493994362097, 'bull_atr_max_pct': 0.1212373042929729, 'bull_tp_mult': 1.995208415197578, 'bull_tsl_mult': 0.8140686547044123, 'bull_time_stop': 13, 'bull_use_sma': True, 'bull_use_ema': True, 'bull_use_atr': False, 'bull_use_adx': False, 'bull_use_spike': True, 'bull_rsi_required': True, 'bear_strategy': 'mean_reversion', 'bear_bb_std_mult': 1.8176154693722661, 'bear_rsi_os': 12, 'bear_rsi_ob': 95, 'bear_adx_thresh': 15.20071103573088, 'bear_atr_min_pct': 0.012884631312309738, 'bear_atr_max_pct': 0.05369248410276041, 'bear_tp_mult': 2.2150496506201214, 'bear_tsl_mult': 0.7413248657558006, 'bear_time_stop': 256, 'bear_use_sma': True, 'bear_use_ema': False, 'bear_use_atr': False, 'bear_use_adx': True, 'bear_use_spike': True, 'bear_rsi_required': True, 'sideways_strategy': 'mean_reversion', 'sideways_bb_std_mult': 3.3608280701362556, 'sideways_rsi_os': 6, 'sideways_rsi_ob': 81, 'sideways_adx_thresh': 28.27566209859139, 'sideways_atr_min_pct': 0.007177849674412707, 'sideways_atr_max_pct': 0.10050996160844318, 'sideways_tp_mult': 1.3339243362748998, 'sideways_tsl_mult': 0.6356480307757969, 'sideways_time_stop': 113, 'sideways_use_sma': True, 'sideways_use_ema': False, 'sideways_use_atr': False, 'sideways_use_adx': True, 'sideways_use_spike': True, 'sideways_rsi_required': False}.
[I 2025-09-01 04:06:17,869] Trial 9 finished with values: [-1000000000.0, 1000000000.0] and parameters: {'p_sma': 44, 'p_std': 11, 'p_atr': 19, 'p_adx': 28, 'rsi_period': 47, 'ema1': 9, 'ema2': 45, 'slip_atr_k': 0.014845439476899563, 'slip_spread_k': 0.3190104384563738, 'spread_hl_frac': 0.041655952174978444, 'bb_std_mult': 1.3259727919081001, 'rsi_os': 22, 'rsi_ob': 70, 'vol_spike': 0.23175692547694837, 'adx_thresh': 25.380647234528144, 'atr_min_pct': 0.014532666531334263, 'atr_max_pct': 0.07083533206970377, 'tp_mult': 1.6997432830578818, 'tsl_mult': 0.9757608830262626, 'strategy': 'breakout', 'time_stop': 218, 'use_sma': False, 'use_atr': True, 'use_adx': True, 'use_ema': True, 'use_spike': False, 'rsi_required': False, 'edge_k': 1.4553641430890243, 'edge_cap': 0.31804130119508295, 'bull_strategy': 'breakout', 'bull_bb_std_mult': 1.439183513667574, 'bull_rsi_os': 21, 'bull_rsi_ob': 59, 'bull_adx_thresh': 7.633062581112319, 'bull_atr_min_pct': 0.02992150130574269, 'bull_atr_max_pct': 0.14648368042821666, 'bull_tp_mult': 2.613159052414503, 'bull_tsl_mult': 0.946759526307324, 'bull_time_stop': 179, 'bull_use_sma': False, 'bull_use_ema': False, 'bull_use_atr': True, 'bull_use_adx': True, 'bull_use_spike': True, 'bull_rsi_required': True, 'bear_strategy': 'mean_reversion', 'bear_bb_std_mult': 0.8733712254145312, 'bear_rsi_os': 46, 'bear_rsi_ob': 72, 'bear_adx_thresh': 21.267931333653653, 'bear_atr_min_pct': 0.0025799928140866346, 'bear_atr_max_pct': 0.07458017512143407, 'bear_tp_mult': 1.233518653864593, 'bear_tsl_mult': 0.8232691957763288, 'bear_time_stop': 210, 'bear_use_sma': True, 'bear_use_ema': False, 'bear_use_atr': True, 'bear_use_adx': False, 'bear_use_spike': True, 'bear_rsi_required': False, 'sideways_strategy': 'breakout', 'sideways_bb_std_mult': 1.5558798720635212, 'sideways_rsi_os': 48, 'sideways_rsi_ob': 47, 'sideways_adx_thresh': 16.369654089502426, 'sideways_atr_min_pct': 0.008801801672377041, 'sideways_atr_max_pct': 0.10946122898597045, 'sideways_tp_mult': 1.3499420128678115, 'sideways_tsl_mult': 0.3273041447591465, 'sideways_time_stop': 14, 'sideways_use_sma': False, 'sideways_use_ema': False, 'sideways_use_atr': True, 'sideways_use_adx': False, 'sideways_use_spike': False, 'sideways_rsi_required': False}.
[I 2025-09-01 04:06:19,128] Trial 11 finished with values: [-1000000000.0, 1000000000.0] and parameters: {'p_sma': 7, 'p_std': 10, 'p_atr': 8, 'p_adx': 21, 'rsi_period': 64, 'ema1': 12, 'ema2': 17, 'slip_atr_k': 0.040745549931488406, 'slip_spread_k': 0.39567765914838704, 'spread_hl_frac': 0.007746798506602937, 'bb_std_mult': 0.6385956094413436, 'rsi_os': 46, 'rsi_ob': 61, 'vol_spike': 0.06286143190671024, 'adx_thresh': 27.798517504162913, 'atr_min_pct': 0.01031593974266008, 'atr_max_pct': 0.07820602438077776, 'tp_mult': 1.7959902005999409, 'tsl_mult': 0.5322980226442671, 'strategy': 'mean_reversion', 'time_stop': 186, 'use_sma': True, 'use_atr': True, 'use_adx': False, 'use_ema': False, 'use_spike': False, 'rsi_required': True, 'edge_k': 0.6271426739673882, 'edge_cap': 0.3761764684141794, 'bull_strategy': 'mean_reversion', 'bull_bb_std_mult': 1.8906427412961433, 'bull_rsi_os': 25, 'bull_rsi_ob': 83, 'bull_adx_thresh': 8.940730794664239, 'bull_atr_min_pct': 0.015736105888618353, 'bull_atr_max_pct': 0.11194082531604978, 'bull_tp_mult': 1.310236678979332, 'bull_tsl_mult': 0.5745991140233214, 'bull_time_stop': 42, 'bull_use_sma': True, 'bull_use_ema': True, 'bull_use_atr': True, 'bull_use_adx': False, 'bull_use_spike': True, 'bull_rsi_required': False, 'bear_strategy': 'mean_reversion', 'bear_bb_std_mult': 0.6461009525481883, 'bear_rsi_os': 47, 'bear_rsi_ob': 51, 'bear_adx_thresh': 34.2295795283337, 'bear_atr_min_pct': 0.002126717996490518, 'bear_atr_max_pct': 0.05894240360544945, 'bear_tp_mult': 2.2152366900110945, 'bear_tsl_mult': 0.11187388203825788, 'bear_time_stop': 33, 'bear_use_sma': True, 'bear_use_ema': True, 'bear_use_atr': True, 'bear_use_adx': False, 'bear_use_spike': True, 'bear_rsi_required': False, 'sideways_strategy': 'breakout', 'sideways_bb_std_mult': 2.8519038733877373, 'sideways_rsi_os': 33, 'sideways_rsi_ob': 74, 'sideways_adx_thresh': 21.80320126139731, 'sideways_atr_min_pct': 0.01945853186167075, 'sideways_atr_max_pct': 0.13067788930654112, 'sideways_tp_mult': 1.7270301644296138, 'sideways_tsl_mult': 0.0949375767044831, 'sideways_time_stop': 240, 'sideways_use_sma': True, 'sideways_use_ema': False, 'sideways_use_atr': False, 'sideways_use_adx': False, 'sideways_use_spike': True, 'sideways_rsi_required': False}.
[I 2025-09-01 04:06:20,644] Trial 14 finished with values: [-1000000000.0, 1000000000.0] and parameters: {'p_sma': 15, 'p_std': 45, 'p_atr': 17, 'p_adx': 17, 'rsi_period': 83, 'ema1': 13, 'ema2': 26, 'slip_atr_k': 0.21335163660609757, 'slip_spread_k': 0.5210089747073681, 'spread_hl_frac': 0.016477197813567927, 'bb_std_mult': 0.5838848678370757, 'rsi_os': 40, 'rsi_ob': 71, 'vol_spike': 0.26603572255695124, 'adx_thresh': 34.94147313178497, 'atr_min_pct': 0.00025507232065249096, 'atr_max_pct': 0.04773472847513225, 'tp_mult': 1.8638788840956546, 'tsl_mult': 0.30716695162582, 'strategy': 'mean_reversion', 'time_stop': 296, 'use_sma': False, 'use_atr': False, 'use_adx': False, 'use_ema': False, 'use_spike': False, 'rsi_required': True, 'edge_k': 1.2771501985128317, 'edge_cap': 0.059506067550939484, 'bull_strategy': 'mean_reversion', 'bull_bb_std_mult': 0.5162220617461684, 'bull_rsi_os': 29, 'bull_rsi_ob': 71, 'bull_adx_thresh': 18.06863902929722, 'bull_atr_min_pct': 0.01586032709874674, 'bull_atr_max_pct': 0.14994145135759163, 'bull_tp_mult': 1.5580815218964281, 'bull_tsl_mult': 0.34106955422937096, 'bull_time_stop': 204, 'bull_use_sma': False, 'bull_use_ema': True, 'bull_use_atr': True, 'bull_use_adx': False, 'bull_use_spike': True, 'bull_rsi_required': False, 'bear_strategy': 'mean_reversion', 'bear_bb_std_mult': 0.8791907446540765, 'bear_rsi_os': 55, 'bear_rsi_ob': 75, 'bear_adx_thresh': 7.73073024167009, 'bear_atr_min_pct': 0.00013561995491626468, 'bear_atr_max_pct': 0.09597850497527456, 'bear_tp_mult': 2.431616904557373, 'bear_tsl_mult': 0.9667226125962467, 'bear_time_stop': 174, 'bear_use_sma': True, 'bear_use_ema': False, 'bear_use_atr': False, 'bear_use_adx': True, 'bear_use_spike': False, 'bear_rsi_required': False, 'sideways_strategy': 'breakout', 'sideways_bb_std_mult': 1.4565734694567265, 'sideways_rsi_os': 51, 'sideways_rsi_ob': 69, 'sideways_adx_thresh': 23.209853096819625, 'sideways_atr_min_pct': 0.016702479693647007, 'sideways_atr_max_pct': 0.14539299425073787, 'sideways_tp_mult': 1.3863392659998968, 'sideways_tsl_mult': 0.3459745746282181, 'sideways_time_stop': 16, 'sideways_use_sma': True, 'sideways_use_ema': True, 'sideways_use_atr': False, 'sideways_use_adx': False, 'sideways_use_spike': False, 'sideways_rsi_required': True}.
[I 2025-09-01 04:06:21,841] Trial 13 finished with values: [-1000000000.0, 1000000000.0] and parameters: {'p_sma': 5, 'p_std': 43, 'p_atr': 30, 'p_adx': 7, 'rsi_period': 74, 'ema1': 14, 'ema2': 17, 'slip_atr_k': 0.22239324247887599, 'slip_spread_k': 0.45152612508131257, 'spread_hl_frac': 0.016834994650106266, 'bb_std_mult': 1.563818064454978, 'rsi_os': 38, 'rsi_ob': 70, 'vol_spike': 0.2963234187388317, 'adx_thresh': 34.19712865163887, 'atr_min_pct': 0.0011315412762727183, 'atr_max_pct': 0.06490740579938102, 'tp_mult': 1.7287622873996398, 'tsl_mult': 0.04492933086602535, 'strategy': 'mean_reversion', 'time_stop': 293, 'use_sma': False, 'use_atr': False, 'use_adx': False, 'use_ema': True, 'use_spike': False, 'rsi_required': False, 'edge_k': 0.9269062904805921, 'edge_cap': 0.09644712842288299, 'bull_strategy': 'mean_reversion', 'bull_bb_std_mult': 2.538502727532513, 'bull_rsi_os': 34, 'bull_rsi_ob': 73, 'bull_adx_thresh': 19.758849527515963, 'bull_atr_min_pct': 0.02238533019863532, 'bull_atr_max_pct': 0.14690658122808808, 'bull_tp_mult': 1.6249490601585832, 'bull_tsl_mult': 0.3303470855332101, 'bull_time_stop': 200, 'bull_use_sma': False, 'bull_use_ema': True, 'bull_use_atr': True, 'bull_use_adx': False, 'bull_use_spike': True, 'bull_rsi_required': True, 'bear_strategy': 'mean_reversion', 'bear_bb_std_mult': 1.1411415568607586, 'bear_rsi_os': 54, 'bear_rsi_ob': 75, 'bear_adx_thresh': 12.484664420997076, 'bear_atr_min_pct': 0.0008169855063841977, 'bear_atr_max_pct': 0.09240265070235042, 'bear_tp_mult': 1.1712631663786754, 'bear_tsl_mult': 0.9635902155944954, 'bear_time_stop': 295, 'bear_use_sma': True, 'bear_use_ema': False, 'bear_use_atr': False, 'bear_use_adx': True, 'bear_use_spike': False, 'bear_rsi_required': False, 'sideways_strategy': 'breakout', 'sideways_bb_std_mult': 1.444816302592118, 'sideways_rsi_os': 52, 'sideways_rsi_ob': 67, 'sideways_adx_thresh': 23.667567790313253, 'sideways_atr_min_pct': 0.016459776450812508, 'sideways_atr_max_pct': 0.11051914211730658, 'sideways_tp_mult': 1.32087413249978, 'sideways_tsl_mult': 0.990077671332921, 'sideways_time_stop': 10, 'sideways_use_sma': False, 'sideways_use_ema': True, 'sideways_use_atr': False, 'sideways_use_adx': False, 'sideways_use_spike': False, 'sideways_rsi_required': True}.
[I 2025-09-01 04:06:57,351] Trial 15 finished with values: [-1000000000.0, 1000000000.0] and parameters: {'p_sma': 15, 'p_std': 45, 'p_atr': 29, 'p_adx': 7, 'rsi_period': 72, 'ema1': 13, 'ema2': 22, 'slip_atr_k': 0.2098851764834352, 'slip_spread_k': 0.5031084145994666, 'spread_hl_frac': 0.015341561841271289, 'bb_std_mult': 0.532833792861678, 'rsi_os': 38, 'rsi_ob': 63, 'vol_spike': 0.2986953133115398, 'adx_thresh': 34.54687880947674, 'atr_min_pct': 0.001745708302067547, 'atr_max_pct': 0.14163479461661488, 'tp_mult': 1.9626328798054298, 'tsl_mult': 0.003016402300563714, 'strategy': 'mean_reversion', 'time_stop': 300, 'use_sma': False, 'use_atr': False, 'use_adx': False, 'use_ema': False, 'use_spike': False, 'rsi_required': True, 'edge_k': 1.1350048256832812, 'edge_cap': 0.15010305887276848, 'bull_strategy': 'mean_reversion', 'bull_bb_std_mult': 0.6711942842476342, 'bull_rsi_os': 34, 'bull_rsi_ob': 75, 'bull_adx_thresh': 18.097453921251933, 'bull_atr_min_pct': 0.015898406178163037, 'bull_atr_max_pct': 0.010472528555422397, 'bull_tp_mult': 1.5509860003205538, 'bull_tsl_mult': 0.3560783408257928, 'bull_time_stop': 216, 'bull_use_sma': False, 'bull_use_ema': True, 'bull_use_atr': True, 'bull_use_adx': False, 'bull_use_spike': True, 'bull_rsi_required': False, 'bear_strategy': 'mean_reversion', 'bear_bb_std_mult': 1.1702216757816657, 'bear_rsi_os': 55, 'bear_rsi_ob': 45, 'bear_adx_thresh': 7.04092447238701, 'bear_atr_min_pct': 0.007379705642038725, 'bear_atr_max_pct': 0.010564264061357548, 'bear_tp_mult': 2.491645900637093, 'bear_tsl_mult': 0.10797572991854282, 'bear_time_stop': 5, 'bear_use_sma': False, 'bear_use_ema': False, 'bear_use_atr': False, 'bear_use_adx': True, 'bear_use_spike': False, 'bear_rsi_required': False, 'sideways_strategy': 'breakout', 'sideways_bb_std_mult': 1.4147762697527466, 'sideways_rsi_os': 46, 'sideways_rsi_ob': 65, 'sideways_adx_thresh': 23.14905438989449, 'sideways_atr_min_pct': 0.01663243602152075, 'sideways_atr_max_pct': 0.13371315708385523, 'sideways_tp_mult': 1.6691987116012925, 'sideways_tsl_mult': 0.9584075735741606, 'sideways_time_stop': 22, 'sideways_use_sma': True, 'sideways_use_ema': True, 'sideways_use_atr': False, 'sideways_use_adx': False, 'sideways_use_spike': False, 'sideways_rsi_required': True}.
[I 2025-09-01 04:06:57,901] Trial 16 finished with values: [-1000000000.0, 1000000000.0] and parameters: {'p_sma': 19, 'p_std': 43, 'p_atr': 30, 'p_adx': 7, 'rsi_period': 16, 'ema1': 14, 'ema2': 30, 'slip_atr_k': 0.19998555865880152, 'slip_spread_k': 0.5780448846140279, 'spread_hl_frac': 0.015336835549802037, 'bb_std_mult': 1.77327039142946, 'rsi_os': 37, 'rsi_ob': 77, 'vol_spike': 0.2976622897474896, 'adx_thresh': 34.9507294982245, 'atr_min_pct': 0.0013996992713997476, 'atr_max_pct': 0.14885496456066688, 'tp_mult': 2.106343036367698, 'tsl_mult': 0.005458318940990248, 'strategy': 'mean_reversion', 'time_stop': 273, 'use_sma': False, 'use_atr': False, 'use_adx': False, 'use_ema': False, 'use_spike': False, 'rsi_required': True, 'edge_k': 0.9786369179538845, 'edge_cap': 0.09055101089402107, 'bull_strategy': 'mean_reversion', 'bull_bb_std_mult': 0.8061712909312304, 'bull_rsi_os': 35, 'bull_rsi_ob': 75, 'bull_adx_thresh': 18.360598941318383, 'bull_atr_min_pct': 0.021385988031404422, 'bull_atr_max_pct': 0.1442569219401074, 'bull_tp_mult': 1.5938528285135738, 'bull_tsl_mult': 0.33324277518911605, 'bull_time_stop': 214, 'bull_use_sma': False, 'bull_use_ema': True, 'bull_use_atr': True, 'bull_use_adx': False, 'bull_use_spike': True, 'bull_rsi_required': False, 'bear_strategy': 'mean_reversion', 'bear_bb_std_mult': 1.1675915625254571, 'bear_rsi_os': 37, 'bear_rsi_ob': 81, 'bear_adx_thresh': 6.802077110376526, 'bear_atr_min_pct': 0.008764648916528759, 'bear_atr_max_pct': 0.10289565467277346, 'bear_tp_mult': 2.5226582923748992, 'bear_tsl_mult': 0.597391452477175, 'bear_time_stop': 137, 'bear_use_sma': False, 'bear_use_ema': False, 'bear_use_atr': False, 'bear_use_adx': True, 'bear_use_spike': False, 'bear_rsi_required': False, 'sideways_strategy': 'breakout', 'sideways_bb_std_mult': 1.3994882714427908, 'sideways_rsi_os': 45, 'sideways_rsi_ob': 67, 'sideways_adx_thresh': 22.90963802789958, 'sideways_atr_min_pct': 0.017405543391531414, 'sideways_atr_max_pct': 0.11694655597396673, 'sideways_tp_mult': 1.0472431484892004, 'sideways_tsl_mult': 0.4220413534619966, 'sideways_time_stop': 12, 'sideways_use_sma': True, 'sideways_use_ema': True, 'sideways_use_atr': False, 'sideways_use_adx': True, 'sideways_use_spike': False, 'sideways_rsi_required': True}.
[I 2025-09-01 04:06:58,958] Trial 17 finished with values: [-1000000000.0, 1000000000.0] and parameters: {'p_sma': 20, 'p_std': 42, 'p_atr': 30, 'p_adx': 8, 'rsi_period': 17, 'ema1': 16, 'ema2': 35, 'slip_atr_k': 0.19429081733636094, 'slip_spread_k': 0.5529650871842394, 'spread_hl_frac': 0.018924462206151106, 'bb_std_mult': 1.7555490436608303, 'rsi_os': 35, 'rsi_ob': 75, 'vol_spike': 0.11534650748271141, 'adx_thresh': 16.455525272377777, 'atr_min_pct': 0.00019557422811393205, 'atr_max_pct': 0.14758433842064345, 'tp_mult': 2.1558099130892656, 'tsl_mult': 0.32687476164720475, 'strategy': 'mean_reversion', 'time_stop': 242, 'use_sma': False, 'use_atr': False, 'use_adx': True, 'use_ema': False, 'use_spike': False, 'rsi_required': True, 'edge_k': 1.0595977665924037, 'edge_cap': 0.19071131427477336, 'bull_strategy': 'mean_reversion', 'bull_bb_std_mult': 2.5085950671784065, 'bull_rsi_os': 36, 'bull_rsi_ob': 74, 'bull_adx_thresh': 25.376064400095146, 'bull_atr_min_pct': 0.021861938237300663, 'bull_atr_max_pct': 0.013238977877296512, 'bull_tp_mult': 1.629153956449037, 'bull_tsl_mult': 0.10182634459838075, 'bull_time_stop': 107, 'bull_use_sma': False, 'bull_use_ema': True, 'bull_use_atr': True, 'bull_use_adx': False, 'bull_use_spike': True, 'bull_rsi_required': False, 'bear_strategy': 'mean_reversion', 'bear_bb_std_mult': 1.347048643065684, 'bear_rsi_os': 37, 'bear_rsi_ob': 64, 'bear_adx_thresh': 12.091774114490239, 'bear_atr_min_pct': 0.008151463542876802, 'bear_atr_max_pct': 0.10154838749954848, 'bear_tp_mult': 1.8759684240982488, 'bear_tsl_mult': 0.5836518037806252, 'bear_time_stop': 298, 'bear_use_sma': False, 'bear_use_ema': False, 'bear_use_atr': False, 'bear_use_adx': True, 'bear_use_spike': False, 'bear_rsi_required': False, 'sideways_strategy': 'mean_reversion', 'sideways_bb_std_mult': 1.1869942106419364, 'sideways_rsi_os': 19, 'sideways_rsi_ob': 65, 'sideways_adx_thresh': 10.198827770108412, 'sideways_atr_min_pct': 0.01533973767145158, 'sideways_atr_max_pct': 0.11268459562680039, 'sideways_tp_mult': 1.0137372741132034, 'sideways_tsl_mult': 0.9793322873629591, 'sideways_time_stop': 64, 'sideways_use_sma': True, 'sideways_use_ema': True, 'sideways_use_atr': False, 'sideways_use_adx': True, 'sideways_use_spike': False, 'sideways_rsi_required': True}.
