[I 2025-09-01 04:12:42,560] Trial 52 finished with values: [-1000000000.0, 1000000000.0] and parameters: {'p_sma': 8, 'p_std': 41, 'p_atr': 16, 'p_adx': 25, 'rsi_period': 68, 'ema1': 15, 'ema2': 36, 'slip_atr_k': 0.24394536180096793, 'slip_spread_k': 0.8527199215436482, 'spread_hl_frac': 0.018747759620633467, 'bb_std_mult': 1.370374870172423, 'rsi_os': 54, 'rsi_ob': 91, 'vol_spike': 0.03828864350943033, 'adx_thresh': 32.45965786778507, 'atr_min_pct': 0.016783306363489573, 'atr_max_pct': 0.1137254605931246, 'tp_mult': 2.034631920075549, 'tsl_mult': 0.5274669446417578, 'strategy': 'breakout', 'time_stop': 39, 'use_sma': False, 'use_atr': False, 'use_adx': True, 'use_ema': False, 'use_spike': True, 'rsi_required': True, 'edge_k': 0.9082823190392848, 'edge_cap': 0.9287381871288733, 'bull_strategy': 'mean_reversion', 'bull_bb_std_mult': 0.6595174937196713, 'bull_rsi_os': 18, 'bull_rsi_ob': 58, 'bull_adx_thresh': 10.561381929540497, 'bull_atr_min_pct': 0.009834676427519543, 'bull_atr_max_pct': 0.024690751594353688, 'bull_tp_mult': 1.7020737591595605, 'bull_tsl_mult': 0.6195455322541373, 'bull_time_stop': 221, 'bull_use_sma': False, 'bull_use_ema': False, 'bull_use_atr': True, 'bull_use_adx': True, 'bull_use_spike': True, 'bull_rsi_required': False, 'bear_strategy': 'breakout', 'bear_bb_std_mult': 3.199539733191785, 'bear_rsi_os': 20, 'bear_rsi_ob': 67, 'bear_adx_thresh': 30.481374089694633, 'bear_atr_min_pct': 0.012950021724621664, 'bear_atr_max_pct': 0.0483542128323462, 'bear_tp_mult': 2.327149801276631, 'bear_tsl_mult': 0.745832158431405, 'bear_time_stop': 11, 'bear_use_sma': True, 'bear_use_ema': False, 'bear_use_atr': False, 'bear_use_adx': False, 'bear_use_spike': False, 'bear_rsi_required': False, 'sideways_strategy': 'mean_reversion', 'sideways_bb_std_mult': 2.8613664417550053, 'sideways_rsi_os': 16, 'sideways_rsi_ob': 78, 'sideways_adx_thresh': 32.41374909094638, 'sideways_atr_min_pct': 0.013382969220540324, 'sideways_atr_max_pct': 0.01963805660780047, 'sideways_tp_mult': 2.8268175659481574, 'sideways_tsl_mult': 0.3101442706548875, 'sideways_time_stop': 113, 'sideways_use_sma': False, 'sideways_use_ema': True, 'sideways_use_atr': True, 'sideways_use_adx': False, 'sideways_use_spike': True, 'sideways_rsi_required': True}.
[I 2025-09-01 04:12:43,115] Trial 53 finished with values: [-1000000000.0, 1000000000.0] and parameters: {'p_sma': 9, 'p_std': 41, 'p_atr': 10, 'p_adx': 24, 'rsi_period': 72, 'ema1': 27, 'ema2': 29, 'slip_atr_k': 0.04471445028518995, 'slip_spread_k': 0.9934705795460791, 'spread_hl_frac': 0.01845296103458491, 'bb_std_mult': 1.3389940687286364, 'rsi_os': 9, 'rsi_ob': 54, 'vol_spike': 0.05336122647799402, 'adx_thresh': 32.08949988858433, 'atr_min_pct': 0.016547767008778715, 'atr_max_pct': 0.017050870372632573, 'tp_mult': 1.3439001138033233, 'tsl_mult': 0.5569193117110758, 'strategy': 'breakout', 'time_stop': 207, 'use_sma': True, 'use_atr': False, 'use_adx': True, 'use_ema': False, 'use_spike': True, 'rsi_required': True, 'edge_k': 0.6646193923458773, 'edge_cap': 0.8088134200763576, 'bull_strategy': 'mean_reversion', 'bull_bb_std_mult': 0.5109632870126879, 'bull_rsi_os': 37, 'bull_rsi_ob': 48, 'bull_adx_thresh': 11.067114302026917, 'bull_atr_min_pct': 0.027051391015979455, 'bull_atr_max_pct': 0.08755420062996787, 'bull_tp_mult': 1.6930088697517358, 'bull_tsl_mult': 0.6204243631055968, 'bull_time_stop': 220, 'bull_use_sma': False, 'bull_use_ema': False, 'bull_use_atr': True, 'bull_use_adx': True, 'bull_use_spike': True, 'bull_rsi_required': False, 'bear_strategy': 'breakout', 'bear_bb_std_mult': 1.9954715992273033, 'bear_rsi_os': 42, 'bear_rsi_ob': 69, 'bear_adx_thresh': 28.713483970665614, 'bear_atr_min_pct': 0.009688236716270223, 'bear_atr_max_pct': 0.10165348130530416, 'bear_tp_mult': 2.9077665944956776, 'bear_tsl_mult': 0.7010532280134097, 'bear_time_stop': 10, 'bear_use_sma': False, 'bear_use_ema': False, 'bear_use_atr': False, 'bear_use_adx': True, 'bear_use_spike': False, 'bear_rsi_required': False, 'sideways_strategy': 'breakout', 'sideways_bb_std_mult': 1.6492741454028907, 'sideways_rsi_os': 24, 'sideways_rsi_ob': 79, 'sideways_adx_thresh': 11.932267571458627, 'sideways_atr_min_pct': 0.013560012708397086, 'sideways_atr_max_pct': 0.1282185122487693, 'sideways_tp_mult': 2.8083595855264747, 'sideways_tsl_mult': 0.3484977024677154, 'sideways_time_stop': 225, 'sideways_use_sma': False, 'sideways_use_ema': True, 'sideways_use_atr': True, 'sideways_use_adx': False, 'sideways_use_spike': True, 'sideways_rsi_required': True}.
[I 2025-09-01 04:12:44,058] Trial 56 finished with values: [-1000000000.0, 1000000000.0] and parameters: {'p_sma': 17, 'p_std': 25, 'p_atr': 18, 'p_adx': 14, 'rsi_period': 20, 'ema1': 18, 'ema2': 14, 'slip_atr_k': 0.09559705316300308, 'slip_spread_k': 0.9302825491490863, 'spread_hl_frac': 0.04392430967235544, 'bb_std_mult': 2.090063758976823, 'rsi_os': 44, 'rsi_ob': 90, 'vol_spike': 0.2776202166690917, 'adx_thresh': 31.33093787194486, 'atr_min_pct': 0.017435608505072715, 'atr_max_pct': 0.13370526135851524, 'tp_mult': 1.3366984742997028, 'tsl_mult': 0.11173927239352327, 'strategy': 'mean_reversion', 'time_stop': 145, 'use_sma': False, 'use_atr': False, 'use_adx': False, 'use_ema': True, 'use_spike': True, 'rsi_required': True, 'edge_k': 1.696035982409656, 'edge_cap': 0.4545338861685826, 'bull_strategy': 'mean_reversion', 'bull_bb_std_mult': 0.6554244156932636, 'bull_rsi_os': 5, 'bull_rsi_ob': 72, 'bull_adx_thresh': 10.332964808610283, 'bull_atr_min_pct': 0.027570799543309328, 'bull_atr_max_pct': 0.08950416631312358, 'bull_tp_mult': 1.2365720071823247, 'bull_tsl_mult': 0.6116394911888556, 'bull_time_stop': 213, 'bull_use_sma': False, 'bull_use_ema': True, 'bull_use_atr': True, 'bull_use_adx': False, 'bull_use_spike': True, 'bull_rsi_required': False, 'bear_strategy': 'breakout', 'bear_bb_std_mult': 3.1555054589672022, 'bear_rsi_os': 26, 'bear_rsi_ob': 45, 'bear_adx_thresh': 31.25956255522342, 'bear_atr_min_pct': 0.003292454183176745, 'bear_atr_max_pct': 0.09842443378463801, 'bear_tp_mult': 2.9120557808144016, 'bear_tsl_mult': 0.7583744542669013, 'bear_time_stop': 130, 'bear_use_sma': True, 'bear_use_ema': True, 'bear_use_atr': True, 'bear_use_adx': True, 'bear_use_spike': False, 'bear_rsi_required': False, 'sideways_strategy': 'mean_reversion', 'sideways_bb_std_mult': 2.142460554112141, 'sideways_rsi_os': 24, 'sideways_rsi_ob': 45, 'sideways_adx_thresh': 32.319153171860236, 'sideways_atr_min_pct': 0.018141025822228922, 'sideways_atr_max_pct': 0.10634320924400954, 'sideways_tp_mult': 2.2094588858374755, 'sideways_tsl_mult': 0.36389090083532116, 'sideways_time_stop': 5, 'sideways_use_sma': False, 'sideways_use_ema': False, 'sideways_use_atr': True, 'sideways_use_adx': True, 'sideways_use_spike': False, 'sideways_rsi_required': True}.
[I 2025-09-01 04:13:26,699] Trial 60 finished with values: [-1000000000.0, 1000000000.0] and parameters: {'p_sma': 36, 'p_std': 56, 'p_atr': 24, 'p_adx': 17, 'rsi_period': 41, 'ema1': 23, 'ema2': 33, 'slip_atr_k': 0.07117155708078837, 'slip_spread_k': 0.9180783671872234, 'spread_hl_frac': 0.014606360600713651, 'bb_std_mult': 3.4439849825977213, 'rsi_os': 32, 'rsi_ob': 74, 'vol_spike': 0.188396026935885, 'adx_thresh': 25.774097185365434, 'atr_min_pct': 0.02248070641664026, 'atr_max_pct': 0.08474170089767712, 'tp_mult': 1.6348528343914195, 'tsl_mult': 0.3830360439146878, 'strategy': 'mean_reversion', 'time_stop': 26, 'use_sma': False, 'use_atr': False, 'use_adx': True, 'use_ema': False, 'use_spike': False, 'rsi_required': True, 'edge_k': 1.0215481500693624, 'edge_cap': 0.3749549931896673, 'bull_strategy': 'mean_reversion', 'bull_bb_std_mult': 2.024890124002268, 'bull_rsi_os': 8, 'bull_rsi_ob': 63, 'bull_adx_thresh': 6.677360678785822, 'bull_atr_min_pct': 0.016452046632471663, 'bull_atr_max_pct': 0.11913005121263952, 'bull_tp_mult': 2.230467979459476, 'bull_tsl_mult': 0.26674099282698355, 'bull_time_stop': 262, 'bull_use_sma': False, 'bull_use_ema': True, 'bull_use_atr': False, 'bull_use_adx': False, 'bull_use_spike': False, 'bull_rsi_required': True, 'bear_strategy': 'mean_reversion', 'bear_bb_std_mult': 0.7331693040935392, 'bear_rsi_os': 8, 'bear_rsi_ob': 80, 'bear_adx_thresh': 23.05783657201541, 'bear_atr_min_pct': 0.01659703259638893, 'bear_atr_max_pct': 0.09340938103156145, 'bear_tp_mult': 1.124052000033164, 'bear_tsl_mult': 0.8605841012003536, 'bear_time_stop': 105, 'bear_use_sma': True, 'bear_use_ema': False, 'bear_use_atr': False, 'bear_use_adx': True, 'bear_use_spike': True, 'bear_rsi_required': False, 'sideways_strategy': 'mean_reversion', 'sideways_bb_std_mult': 1.2281762521842203, 'sideways_rsi_os': 29, 'sideways_rsi_ob': 69, 'sideways_adx_thresh': 24.10793129258773, 'sideways_atr_min_pct': 0.010755124912357765, 'sideways_atr_max_pct': 0.09365496744731862, 'sideways_tp_mult': 1.5435907713361132, 'sideways_tsl_mult': 0.11599620111775222, 'sideways_time_stop': 25, 'sideways_use_sma': True, 'sideways_use_ema': True, 'sideways_use_atr': False, 'sideways_use_adx': True, 'sideways_use_spike': False, 'sideways_rsi_required': True}.
[I 2025-09-01 04:13:27,726] Trial 58 finished with values: [-1000000000.0, 1000000000.0] and parameters: {'p_sma': 16, 'p_std': 15, 'p_atr': 18, 'p_adx': 15, 'rsi_period': 19, 'ema1': 19, 'ema2': 13, 'slip_atr_k': 0.09342264876168645, 'slip_spread_k': 0.9179176080982886, 'spread_hl_frac': 0.04725436902447306, 'bb_std_mult': 3.463857577703009, 'rsi_os': 43, 'rsi_ob': 72, 'vol_spike': 0.24490481645549977, 'adx_thresh': 23.732717831026005, 'atr_min_pct': 0.0227626798769618, 'atr_max_pct': 0.13357379648853235, 'tp_mult': 1.6530298149448988, 'tsl_mult': 0.3614901033320498, 'strategy': 'mean_reversion', 'time_stop': 280, 'use_sma': False, 'use_atr': False, 'use_adx': True, 'use_ema': False, 'use_spike': False, 'rsi_required': True, 'edge_k': 1.5922970103226608, 'edge_cap': 0.6117549281377073, 'bull_strategy': 'mean_reversion', 'bull_bb_std_mult': 0.813957934424449, 'bull_rsi_os': 9, 'bull_rsi_ob': 72, 'bull_adx_thresh': 17.089755460320866, 'bull_atr_min_pct': 0.012266306430961552, 'bull_atr_max_pct': 0.08818812270598526, 'bull_tp_mult': 2.205456120460836, 'bull_tsl_mult': 0.19348041566750318, 'bull_time_stop': 209, 'bull_use_sma': False, 'bull_use_ema': True, 'bull_use_atr': False, 'bull_use_adx': False, 'bull_use_spike': False, 'bull_rsi_required': True, 'bear_strategy': 'mean_reversion', 'bear_bb_std_mult': 0.5003669883582982, 'bear_rsi_os': 10, 'bear_rsi_ob': 50, 'bear_adx_thresh': 16.751147805785283, 'bear_atr_min_pct': 0.009791786711382117, 'bear_atr_max_pct': 0.09706416109899164, 'bear_tp_mult': 1.9745812234182711, 'bear_tsl_mult': 0.82160540396705, 'bear_time_stop': 129, 'bear_use_sma': True, 'bear_use_ema': False, 'bear_use_atr': False, 'bear_use_adx': True, 'bear_use_spike': True, 'bear_rsi_required': False, 'sideways_strategy': 'mean_reversion', 'sideways_bb_std_mult': 3.402806247763052, 'sideways_rsi_os': 24, 'sideways_rsi_ob': 45, 'sideways_adx_thresh': 24.88432999583975, 'sideways_atr_min_pct': 0.021032498216425034, 'sideways_atr_max_pct': 0.12781004346172306, 'sideways_tp_mult': 2.220136954589199, 'sideways_tsl_mult': 0.0957455881183526, 'sideways_time_stop': 30, 'sideways_use_sma': True, 'sideways_use_ema': True, 'sideways_use_atr': False, 'sideways_use_adx': True, 'sideways_use_spike': False, 'sideways_rsi_required': True}.
[I 2025-09-01 04:13:28,375] Trial 59 finished with values: [-1000000000.0, 1000000000.0] and parameters: {'p_sma': 35, 'p_std': 5, 'p_atr': 18, 'p_adx': 14, 'rsi_period': 77, 'ema1': 18, 'ema2': 60, 'slip_atr_k': 0.08868068410943278, 'slip_spread_k': 0.9193505170402907, 'spread_hl_frac': 0.04573063571055085, 'bb_std_mult': 2.084544355346109, 'rsi_os': 32, 'rsi_ob': 93, 'vol_spike': 0.1924922963196206, 'adx_thresh': 8.256698286337686, 'atr_min_pct': 0.02239157292906859, 'atr_max_pct': 0.140083613906148, 'tp_mult': 2.6092234333134896, 'tsl_mult': 0.12313660070621346, 'strategy': 'mean_reversion', 'time_stop': 101, 'use_sma': False, 'use_atr': False, 'use_adx': False, 'use_ema': False, 'use_spike': False, 'rsi_required': True, 'edge_k': 1.6155666485719935, 'edge_cap': 0.438261108545795, 'bull_strategy': 'mean_reversion', 'bull_bb_std_mult': 1.9986410626109714, 'bull_rsi_os': 8, 'bull_rsi_ob': 71, 'bull_adx_thresh': 17.307910380024136, 'bull_atr_min_pct': 0.01171613246941815, 'bull_atr_max_pct': 0.11932393989398857, 'bull_tp_mult': 2.203153340898252, 'bull_tsl_mult': 0.4204658606202487, 'bull_time_stop': 262, 'bull_use_sma': False, 'bull_use_ema': True, 'bull_use_atr': False, 'bull_use_adx': False, 'bull_use_spike': False, 'bull_rsi_required': True, 'bear_strategy': 'mean_reversion', 'bear_bb_std_mult': 0.785536294855748, 'bear_rsi_os': 26, 'bear_rsi_ob': 79, 'bear_adx_thresh': 16.422365391236955, 'bear_atr_min_pct': 0.02224705807214064, 'bear_atr_max_pct': 0.09415542690175928, 'bear_tp_mult': 1.1143609827155445, 'bear_tsl_mult': 0.8340762066471279, 'bear_time_stop': 129, 'bear_use_sma': True, 'bear_use_ema': True, 'bear_use_atr': False, 'bear_use_adx': True, 'bear_use_spike': True, 'bear_rsi_required': False, 'sideways_strategy': 'mean_reversion', 'sideways_bb_std_mult': 3.417056625818198, 'sideways_rsi_os': 30, 'sideways_rsi_ob': 68, 'sideways_adx_thresh': 21.603157986956575, 'sideways_atr_min_pct': 0.01101447985534175, 'sideways_atr_max_pct': 0.10751694402694711, 'sideways_tp_mult': 2.2096301366223816, 'sideways_tsl_mult': 0.09544022900587512, 'sideways_time_stop': 31, 'sideways_use_sma': True, 'sideways_use_ema': True, 'sideways_use_atr': False, 'sideways_use_adx': True, 'sideways_use_spike': False, 'sideways_rsi_required': True}.
[I 2025-09-01 04:13:28,376] Trial 57 finished with values: [-1000000000.0, 1000000000.0] and parameters: {'p_sma': 18, 'p_std': 24, 'p_atr': 18, 'p_adx': 14, 'rsi_period': 27, 'ema1': 18, 'ema2': 53, 'slip_atr_k': 0.09396497654312211, 'slip_spread_k': 0.9401054326027851, 'spread_hl_frac': 1.1555565272446805e-05, 'bb_std_mult': 2.3111667675565557, 'rsi_os': 32, 'rsi_ob': 91, 'vol_spike': 0.24402329068866235, 'adx_thresh': 31.983842579860717, 'atr_min_pct': 0.022753101464558462, 'atr_max_pct': 0.046273517095245895, 'tp_mult': 1.6260953516813768, 'tsl_mult': 0.10791043916696419, 'strategy': 'mean_reversion', 'time_stop': 53, 'use_sma': False, 'use_atr': False, 'use_adx': True, 'use_ema': False, 'use_spike': False, 'rsi_required': True, 'edge_k': 1.6885823792271009, 'edge_cap': 0.4449326399208899, 'bull_strategy': 'mean_reversion', 'bull_bb_std_mult': 0.5510206600716612, 'bull_rsi_os': 30, 'bull_rsi_ob': 72, 'bull_adx_thresh': 17.292542918382825, 'bull_atr_min_pct': 0.008257460023102629, 'bull_atr_max_pct': 0.09084513528206352, 'bull_tp_mult': 1.223610473931528, 'bull_tsl_mult': 0.2583887333514192, 'bull_time_stop': 218, 'bull_use_sma': False, 'bull_use_ema': True, 'bull_use_atr': False, 'bull_use_adx': False, 'bull_use_spike': False, 'bull_rsi_required': True, 'bear_strategy': 'mean_reversion', 'bear_bb_std_mult': 3.1753148869453316, 'bear_rsi_os': 8, 'bear_rsi_ob': 50, 'bear_adx_thresh': 5.470384873561343, 'bear_atr_min_pct': 0.009825550327491894, 'bear_atr_max_pct': 0.09656631494398583, 'bear_tp_mult': 1.9972453164502975, 'bear_tsl_mult': 0.5337125373580874, 'bear_time_stop': 131, 'bear_use_sma': True, 'bear_use_ema': False, 'bear_use_atr': False, 'bear_use_adx': True, 'bear_use_spike': True, 'bear_rsi_required': False, 'sideways_strategy': 'mean_reversion', 'sideways_bb_std_mult': 2.1410612895643912, 'sideways_rsi_os': 26, 'sideways_rsi_ob': 69, 'sideways_adx_thresh': 27.467509058215246, 'sideways_atr_min_pct': 0.02086540063626266, 'sideways_atr_max_pct': 0.05050464258538821, 'sideways_tp_mult': 2.2070017025674993, 'sideways_tsl_mult': 0.3523212251869935, 'sideways_time_stop': 257, 'sideways_use_sma': True, 'sideways_use_ema': True, 'sideways_use_atr': False, 'sideways_use_adx': True, 'sideways_use_spike': False, 'sideways_rsi_required': True}.
[I 2025-09-01 04:14:04,104] Trial 64 finished with values: [-1000000000.0, 1000000000.0] and parameters: {'p_sma': 27, 'p_std': 45, 'p_atr': 15, 'p_adx': 8, 'rsi_period': 31, 'ema1': 21, 'ema2': 21, 'slip_atr_k': 0.1825008897234365, 'slip_spread_k': 0.009676250528613872, 'spread_hl_frac': 0.00859620285787565, 'bb_std_mult': 0.633243055867994, 'rsi_os': 39, 'rsi_ob': 45, 'vol_spike': 0.20464548194361654, 'adx_thresh': 14.951073772965044, 'atr_min_pct': 0.0036960672293617075, 'atr_max_pct': 0.05915942856410289, 'tp_mult': 1.524009947992867, 'tsl_mult': 0.4722907033512941, 'strategy': 'breakout', 'time_stop': 85, 'use_sma': True, 'use_atr': True, 'use_adx': True, 'use_ema': True, 'use_spike': True, 'rsi_required': True, 'edge_k': 0.741280894905949, 'edge_cap': 0.31170526315591596, 'bull_strategy': 'breakout', 'bull_bb_std_mult': 2.7197987776672843, 'bull_rsi_os': 26, 'bull_rsi_ob': 68, 'bull_adx_thresh': 12.555434133450584, 'bull_atr_min_pct': 0.010375831435222542, 'bull_atr_max_pct': 0.10160222989793487, 'bull_tp_mult': 2.0356714961247886, 'bull_tsl_mult': 0.7018848959760581, 'bull_time_stop': 128, 'bull_use_sma': False, 'bull_use_ema': False, 'bull_use_atr': True, 'bull_use_adx': True, 'bull_use_spike': True, 'bull_rsi_required': False, 'bear_strategy': 'breakout', 'bear_bb_std_mult': 3.3357530278398717, 'bear_rsi_os': 16, 'bear_rsi_ob': 73, 'bear_adx_thresh': 22.084210582117702, 'bear_atr_min_pct': 0.006021069574155899, 'bear_atr_max_pct': 0.07929998999643897, 'bear_tp_mult': 1.4098405727808099, 'bear_tsl_mult': 0.63343132091699, 'bear_time_stop': 150, 'bear_use_sma': False, 'bear_use_ema': False, 'bear_use_atr': False, 'bear_use_adx': True, 'bear_use_spike': True, 'bear_rsi_required': True, 'sideways_strategy': 'mean_reversion', 'sideways_bb_std_mult': 3.1174080634504513, 'sideways_rsi_os': 55, 'sideways_rsi_ob': 92, 'sideways_adx_thresh': 22.062006347456652, 'sideways_atr_min_pct': 0.001348410224103455, 'sideways_atr_max_pct': 0.1155199336507518, 'sideways_tp_mult': 1.422893584741886, 'sideways_tsl_mult': 0.99336814053432, 'sideways_time_stop': 88, 'sideways_use_sma': True, 'sideways_use_ema': True, 'sideways_use_atr': True, 'sideways_use_adx': True, 'sideways_use_spike': False, 'sideways_rsi_required': False}.
[I 2025-09-01 04:14:04,810] Trial 61 finished with values: [-1000000000.0, 1000000000.0] and parameters: {'p_sma': 49, 'p_std': 50, 'p_atr': 15, 'p_adx': 8, 'rsi_period': 26, 'ema1': 19, 'ema2': 44, 'slip_atr_k': 0.08427001019451863, 'slip_spread_k': 0.8123544689942326, 'spread_hl_frac': 0.02306228466600701, 'bb_std_mult': 0.615462644507295, 'rsi_os': 37, 'rsi_ob': 59, 'vol_spike': 0.24303267968057787, 'adx_thresh': 9.563960925614907, 'atr_min_pct': 0.0030514933662069837, 'atr_max_pct': 0.0606820498650546, 'tp_mult': 1.513308120145781, 'tsl_mult': 0.9439659146743976, 'strategy': 'mean_reversion', 'time_stop': 268, 'use_sma': False, 'use_atr': False, 'use_adx': True, 'use_ema': False, 'use_spike': False, 'rsi_required': True, 'edge_k': 0.740908639124101, 'edge_cap': 0.600235559550683, 'bull_strategy': 'mean_reversion', 'bull_bb_std_mult': 0.9359480594992906, 'bull_rsi_os': 30, 'bull_rsi_ob': 78, 'bull_adx_thresh': 17.48468666324139, 'bull_atr_min_pct': 0.012098198384913546, 'bull_atr_max_pct': 0.10264677768848071, 'bull_tp_mult': 2.727768406145369, 'bull_tsl_mult': 0.41617697851934066, 'bull_time_stop': 129, 'bull_use_sma': False, 'bull_use_ema': True, 'bull_use_atr': False, 'bull_use_adx': False, 'bull_use_spike': False, 'bull_rsi_required': True, 'bear_strategy': 'mean_reversion', 'bear_bb_std_mult': 0.5246371735553255, 'bear_rsi_os': 26, 'bear_rsi_ob': 49, 'bear_adx_thresh': 8.448572459774356, 'bear_atr_min_pct': 0.006396813247468207, 'bear_atr_max_pct': 0.07838014007682664, 'bear_tp_mult': 1.9856159394175534, 'bear_tsl_mult': 0.07015304388124771, 'bear_time_stop': 142, 'bear_use_sma': True, 'bear_use_ema': False, 'bear_use_atr': False, 'bear_use_adx': True, 'bear_use_spike': True, 'bear_rsi_required': False, 'sideways_strategy': 'mean_reversion', 'sideways_bb_std_mult': 3.4108764727462715, 'sideways_rsi_os': 26, 'sideways_rsi_ob': 47, 'sideways_adx_thresh': 27.12961959185556, 'sideways_atr_min_pct': 0.02129159528257541, 'sideways_atr_max_pct': 0.11353005125027038, 'sideways_tp_mult': 2.016858339008111, 'sideways_tsl_mult': 0.6919988386343215, 'sideways_time_stop': 254, 'sideways_use_sma': True, 'sideways_use_ema': True, 'sideways_use_atr': False, 'sideways_use_adx': True, 'sideways_use_spike': False, 'sideways_rsi_required': True}.
