[I 2025-09-01 04:56:53,135] Trial 316 finished with values: [-1000000000.0, 1000000000.0] and parameters: {'p_sma': 25, 'p_std': 56, 'p_atr': 28, 'p_adx': 9, 'rsi_period': 12, 'ema1': 28, 'ema2': 30, 'slip_atr_k': 0.016090891791689863, 'slip_spread_k': 0.2612780208462991, 'spread_hl_frac': 0.04705192304035385, 'bb_std_mult': 3.3715046639771824, 'rsi_os': 26, 'rsi_ob': 84, 'vol_spike': 0.16648377235030734, 'adx_thresh': 13.752395277227508, 'atr_min_pct': 0.02296198769227743, 'atr_max_pct': 0.10457582045850813, 'tp_mult': 2.579710117570986, 'tsl_mult': 0.9823425504589126, 'strategy': 'breakout', 'time_stop': 39, 'use_sma': False, 'use_atr': False, 'use_adx': False, 'use_ema': True, 'use_spike': True, 'rsi_required': False, 'edge_k': 0.4531453699189778, 'edge_cap': 0.5522284695265035, 'bull_strategy': 'breakout', 'bull_bb_std_mult': 2.3366682997861314, 'bull_rsi_os': 18, 'bull_rsi_ob': 63, 'bull_adx_thresh': 17.419974997325507, 'bull_atr_min_pct': 0.0024381727788631738, 'bull_atr_max_pct': 0.11785889744599404, 'bull_tp_mult': 1.5120867245905463, 'bull_tsl_mult': 0.4464024769317984, 'bull_time_stop': 241, 'bull_use_sma': True, 'bull_use_ema': False, 'bull_use_atr': False, 'bull_use_adx': False, 'bull_use_spike': False, 'bull_rsi_required': True, 'bear_strategy': 'mean_reversion', 'bear_bb_std_mult': 0.6779356551770566, 'bear_rsi_os': 12, 'bear_rsi_ob': 67, 'bear_adx_thresh': 31.7032101080303, 'bear_atr_min_pct': 0.027172650135109822, 'bear_atr_max_pct': 0.059598289840625825, 'bear_tp_mult': 1.5723118886567773, 'bear_tsl_mult': 0.49452971495815806, 'bear_time_stop': 220, 'bear_use_sma': True, 'bear_use_ema': True, 'bear_use_atr': False, 'bear_use_adx': False, 'bear_use_spike': False, 'bear_rsi_required': True, 'sideways_strategy': 'breakout', 'sideways_bb_std_mult': 0.6842782858470609, 'sideways_rsi_os': 40, 'sideways_rsi_ob': 58, 'sideways_adx_thresh': 18.903563735997775, 'sideways_atr_min_pct': 0.024622672570826645, 'sideways_atr_max_pct': 0.11020439545751243, 'sideways_tp_mult': 1.6788395799223266, 'sideways_tsl_mult': 0.9567657689913173, 'sideways_time_stop': 171, 'sideways_use_sma': False, 'sideways_use_ema': True, 'sideways_use_atr': False, 'sideways_use_adx': False, 'sideways_use_spike': True, 'sideways_rsi_required': False}.
[I 2025-09-01 04:56:53,744] Trial 318 finished with values: [-1000000000.0, 1000000000.0] and parameters: {'p_sma': 23, 'p_std': 57, 'p_atr': 27, 'p_adx': 18, 'rsi_period': 11, 'ema1': 27, 'ema2': 30, 'slip_atr_k': 0.015597037550929862, 'slip_spread_k': 0.2675621823766499, 'spread_hl_frac': 0.046835790305650715, 'bb_std_mult': 3.526901178349929, 'rsi_os': 25, 'rsi_ob': 80, 'vol_spike': 0.21196841200698763, 'adx_thresh': 13.524996482144084, 'atr_min_pct': 0.02297075753831245, 'atr_max_pct': 0.10531601361155062, 'tp_mult': 2.569783921771138, 'tsl_mult': 0.9768753800058362, 'strategy': 'breakout', 'time_stop': 39, 'use_sma': False, 'use_atr': False, 'use_adx': False, 'use_ema': True, 'use_spike': True, 'rsi_required': False, 'edge_k': 0.43965624893368016, 'edge_cap': 0.5427701970821026, 'bull_strategy': 'breakout', 'bull_bb_std_mult': 2.4936086450985213, 'bull_rsi_os': 13, 'bull_rsi_ob': 88, 'bull_adx_thresh': 17.55579880321624, 'bull_atr_min_pct': 0.0022806618336587477, 'bull_atr_max_pct': 0.1112731715135981, 'bull_tp_mult': 1.515694430467366, 'bull_tsl_mult': 0.43757001196410966, 'bull_time_stop': 263, 'bull_use_sma': True, 'bull_use_ema': False, 'bull_use_atr': False, 'bull_use_adx': False, 'bull_use_spike': False, 'bull_rsi_required': True, 'bear_strategy': 'mean_reversion', 'bear_bb_std_mult': 0.6586727464508877, 'bear_rsi_os': 21, 'bear_rsi_ob': 67, 'bear_adx_thresh': 27.72320170632906, 'bear_atr_min_pct': 0.017853166776277445, 'bear_atr_max_pct': 0.058979698330346865, 'bear_tp_mult': 1.5356665224014865, 'bear_tsl_mult': 0.6873418897679882, 'bear_time_stop': 215, 'bear_use_sma': True, 'bear_use_ema': True, 'bear_use_atr': False, 'bear_use_adx': False, 'bear_use_spike': False, 'bear_rsi_required': True, 'sideways_strategy': 'breakout', 'sideways_bb_std_mult': 0.6598161298604354, 'sideways_rsi_os': 46, 'sideways_rsi_ob': 66, 'sideways_adx_thresh': 18.533924597265607, 'sideways_atr_min_pct': 0.005266727366710846, 'sideways_atr_max_pct': 0.11085003343465405, 'sideways_tp_mult': 1.3072968197053725, 'sideways_tsl_mult': 0.023459886360670923, 'sideways_time_stop': 173, 'sideways_use_sma': False, 'sideways_use_ema': True, 'sideways_use_atr': False, 'sideways_use_adx': False, 'sideways_use_spike': True, 'sideways_rsi_required': False}.
[I 2025-09-01 04:56:53,976] Trial 317 finished with values: [-1000000000.0, 1000000000.0] and parameters: {'p_sma': 25, 'p_std': 57, 'p_atr': 29, 'p_adx': 18, 'rsi_period': 10, 'ema1': 27, 'ema2': 30, 'slip_atr_k': 0.01574385750179415, 'slip_spread_k': 0.2196080196436771, 'spread_hl_frac': 0.0461210478327845, 'bb_std_mult': 3.348928488890929, 'rsi_os': 27, 'rsi_ob': 87, 'vol_spike': 0.2038613187691723, 'adx_thresh': 13.81793832971702, 'atr_min_pct': 0.022816811198785557, 'atr_max_pct': 0.11309650868591067, 'tp_mult': 2.648816375788678, 'tsl_mult': 0.9766371287242944, 'strategy': 'breakout', 'time_stop': 41, 'use_sma': False, 'use_atr': False, 'use_adx': False, 'use_ema': True, 'use_spike': True, 'rsi_required': False, 'edge_k': 0.5800977760876678, 'edge_cap': 0.5434127350865107, 'bull_strategy': 'breakout', 'bull_bb_std_mult': 2.5267521363465217, 'bull_rsi_os': 38, 'bull_rsi_ob': 58, 'bull_adx_thresh': 17.5602696527896, 'bull_atr_min_pct': 0.003934225075473436, 'bull_atr_max_pct': 0.11211071498582782, 'bull_tp_mult': 1.5348960368694273, 'bull_tsl_mult': 0.4483031859486168, 'bull_time_stop': 260, 'bull_use_sma': True, 'bull_use_ema': False, 'bull_use_atr': False, 'bull_use_adx': False, 'bull_use_spike': False, 'bull_rsi_required': True, 'bear_strategy': 'mean_reversion', 'bear_bb_std_mult': 0.679275103104142, 'bear_rsi_os': 21, 'bear_rsi_ob': 67, 'bear_adx_thresh': 27.85353609360976, 'bear_atr_min_pct': 0.02802135468642259, 'bear_atr_max_pct': 0.05929534334011576, 'bear_tp_mult': 1.6047753363185386, 'bear_tsl_mult': 0.6812094720132484, 'bear_time_stop': 221, 'bear_use_sma': True, 'bear_use_ema': True, 'bear_use_atr': False, 'bear_use_adx': False, 'bear_use_spike': False, 'bear_rsi_required': True, 'sideways_strategy': 'breakout', 'sideways_bb_std_mult': 0.6828555923626478, 'sideways_rsi_os': 36, 'sideways_rsi_ob': 66, 'sideways_adx_thresh': 18.58969246258806, 'sideways_atr_min_pct': 0.02664736688001411, 'sideways_atr_max_pct': 0.11011534232026438, 'sideways_tp_mult': 1.4658806137808653, 'sideways_tsl_mult': 0.9472725055276555, 'sideways_time_stop': 172, 'sideways_use_sma': False, 'sideways_use_ema': True, 'sideways_use_atr': False, 'sideways_use_adx': False, 'sideways_use_spike': True, 'sideways_rsi_required': False}.
[I 2025-09-01 04:56:54,164] Trial 315 finished with values: [-1000000000.0, 1000000000.0] and parameters: {'p_sma': 29, 'p_std': 58, 'p_atr': 28, 'p_adx': 9, 'rsi_period': 9, 'ema1': 28, 'ema2': 30, 'slip_atr_k': 0.01848831832081178, 'slip_spread_k': 0.26230422764714045, 'spread_hl_frac': 0.04705809232483827, 'bb_std_mult': 3.498192792558119, 'rsi_os': 24, 'rsi_ob': 88, 'vol_spike': 0.16827710929742196, 'adx_thresh': 13.367515688113611, 'atr_min_pct': 0.02324385487421058, 'atr_max_pct': 0.11124203762823567, 'tp_mult': 2.5840970116234545, 'tsl_mult': 0.9902454062644361, 'strategy': 'breakout', 'time_stop': 44, 'use_sma': False, 'use_atr': False, 'use_adx': False, 'use_ema': True, 'use_spike': True, 'rsi_required': False, 'edge_k': 1.0427197252180302, 'edge_cap': 0.5614562297259597, 'bull_strategy': 'breakout', 'bull_bb_std_mult': 2.3365031891529564, 'bull_rsi_os': 21, 'bull_rsi_ob': 58, 'bull_adx_thresh': 17.228005045888942, 'bull_atr_min_pct': 0.0028267909392136205, 'bull_atr_max_pct': 0.11375320179412378, 'bull_tp_mult': 1.5140776257545243, 'bull_tsl_mult': 0.4419107802723317, 'bull_time_stop': 257, 'bull_use_sma': True, 'bull_use_ema': False, 'bull_use_atr': False, 'bull_use_adx': False, 'bull_use_spike': False, 'bull_rsi_required': True, 'bear_strategy': 'mean_reversion', 'bear_bb_std_mult': 0.6912915005399498, 'bear_rsi_os': 21, 'bear_rsi_ob': 67, 'bear_adx_thresh': 27.048952685258936, 'bear_atr_min_pct': 0.027971331363524216, 'bear_atr_max_pct': 0.060328397671643955, 'bear_tp_mult': 1.5882443219213682, 'bear_tsl_mult': 0.49645086279717054, 'bear_time_stop': 221, 'bear_use_sma': True, 'bear_use_ema': False, 'bear_use_atr': False, 'bear_use_adx': False, 'bear_use_spike': False, 'bear_rsi_required': False, 'sideways_strategy': 'breakout', 'sideways_bb_std_mult': 0.6932639224247235, 'sideways_rsi_os': 40, 'sideways_rsi_ob': 65, 'sideways_adx_thresh': 18.645087814129283, 'sideways_atr_min_pct': 0.024728325236699232, 'sideways_atr_max_pct': 0.10960209430086122, 'sideways_tp_mult': 1.460341200415154, 'sideways_tsl_mult': 0.996136745558375, 'sideways_time_stop': 171, 'sideways_use_sma': True, 'sideways_use_ema': True, 'sideways_use_atr': False, 'sideways_use_adx': False, 'sideways_use_spike': True, 'sideways_rsi_required': False}.
[I 2025-09-01 04:57:35,821] Trial 321 finished with values: [-1000000000.0, 1000000000.0] and parameters: {'p_sma': 29, 'p_std': 58, 'p_atr': 27, 'p_adx': 19, 'rsi_period': 14, 'ema1': 28, 'ema2': 33, 'slip_atr_k': 0.027130175143292565, 'slip_spread_k': 0.26854053129109734, 'spread_hl_frac': 0.045681151315061744, 'bb_std_mult': 3.598331837035329, 'rsi_os': 29, 'rsi_ob': 77, 'vol_spike': 0.15775521414549282, 'adx_thresh': 12.134165199045723, 'atr_min_pct': 0.021929321675757906, 'atr_max_pct': 0.11428054366399613, 'tp_mult': 2.6738736847605082, 'tsl_mult': 0.9970974276724368, 'strategy': 'breakout', 'time_stop': 40, 'use_sma': False, 'use_atr': False, 'use_adx': False, 'use_ema': True, 'use_spike': True, 'rsi_required': False, 'edge_k': 0.5759837979052123, 'edge_cap': 0.5828519619106942, 'bull_strategy': 'breakout', 'bull_bb_std_mult': 2.251615015519912, 'bull_rsi_os': 35, 'bull_rsi_ob': 87, 'bull_adx_thresh': 15.217526615528206, 'bull_atr_min_pct': 0.0020983037325251423, 'bull_atr_max_pct': 0.1186707832779429, 'bull_tp_mult': 1.4772781842280025, 'bull_tsl_mult': 0.43235330407193484, 'bull_time_stop': 282, 'bull_use_sma': True, 'bull_use_ema': False, 'bull_use_atr': False, 'bull_use_adx': False, 'bull_use_spike': False, 'bull_rsi_required': True, 'bear_strategy': 'mean_reversion', 'bear_bb_std_mult': 0.5853572781415282, 'bear_rsi_os': 26, 'bear_rsi_ob': 65, 'bear_adx_thresh': 29.369613300470117, 'bear_atr_min_pct': 0.0240198044137384, 'bear_atr_max_pct': 0.0673037531312059, 'bear_tp_mult': 1.6681473459596372, 'bear_tsl_mult': 0.5964590385989671, 'bear_time_stop': 212, 'bear_use_sma': True, 'bear_use_ema': False, 'bear_use_atr': False, 'bear_use_adx': False, 'bear_use_spike': False, 'bear_rsi_required': False, 'sideways_strategy': 'breakout', 'sideways_bb_std_mult': 0.8140368241155, 'sideways_rsi_os': 33, 'sideways_rsi_ob': 65, 'sideways_adx_thresh': 20.20599131971874, 'sideways_atr_min_pct': 0.024417858723867845, 'sideways_atr_max_pct': 0.10702305895866578, 'sideways_tp_mult': 1.7529818370693884, 'sideways_tsl_mult': 0.9996558142425674, 'sideways_time_stop': 39, 'sideways_use_sma': True, 'sideways_use_ema': True, 'sideways_use_atr': False, 'sideways_use_adx': False, 'sideways_use_spike': True, 'sideways_rsi_required': False}.
[I 2025-09-01 04:57:36,069] Trial 320 finished with values: [-1000000000.0, 1000000000.0] and parameters: {'p_sma': 30, 'p_std': 54, 'p_atr': 27, 'p_adx': 19, 'rsi_period': 14, 'ema1': 28, 'ema2': 33, 'slip_atr_k': 0.012991783476504854, 'slip_spread_k': 0.2675538370101929, 'spread_hl_frac': 0.045667881218254026, 'bb_std_mult': 3.5099984712597716, 'rsi_os': 29, 'rsi_ob': 91, 'vol_spike': 0.1574735406025015, 'adx_thresh': 14.068040353637695, 'atr_min_pct': 0.021895976027483416, 'atr_max_pct': 0.11315846028922086, 'tp_mult': 2.5662362908913887, 'tsl_mult': 0.9983796563906204, 'strategy': 'breakout', 'time_stop': 38, 'use_sma': False, 'use_atr': False, 'use_adx': False, 'use_ema': True, 'use_spike': True, 'rsi_required': False, 'edge_k': 0.5579748137263447, 'edge_cap': 0.5150428060942953, 'bull_strategy': 'breakout', 'bull_bb_std_mult': 2.267563691738762, 'bull_rsi_os': 20, 'bull_rsi_ob': 71, 'bull_adx_thresh': 17.506133520284408, 'bull_atr_min_pct': 0.0021048789266098905, 'bull_atr_max_pct': 0.1185293239436431, 'bull_tp_mult': 1.4809586066326128, 'bull_tsl_mult': 0.4305312292602213, 'bull_time_stop': 244, 'bull_use_sma': True, 'bull_use_ema': False, 'bull_use_atr': False, 'bull_use_adx': False, 'bull_use_spike': False, 'bull_rsi_required': True, 'bear_strategy': 'mean_reversion', 'bear_bb_std_mult': 0.5504483883224272, 'bear_rsi_os': 13, 'bear_rsi_ob': 65, 'bear_adx_thresh': 26.079105909940427, 'bear_atr_min_pct': 0.02837397578554558, 'bear_atr_max_pct': 0.06840699893626742, 'bear_tp_mult': 1.6930836246616674, 'bear_tsl_mult': 0.5170881751606624, 'bear_time_stop': 212, 'bear_use_sma': True, 'bear_use_ema': False, 'bear_use_atr': False, 'bear_use_adx': False, 'bear_use_spike': False, 'bear_rsi_required': False, 'sideways_strategy': 'breakout', 'sideways_bb_std_mult': 0.6013160924678107, 'sideways_rsi_os': 47, 'sideways_rsi_ob': 71, 'sideways_adx_thresh': 20.24103660129046, 'sideways_atr_min_pct': 0.025738554710427894, 'sideways_atr_max_pct': 0.10617144573219645, 'sideways_tp_mult': 1.7739791793763604, 'sideways_tsl_mult': 0.9665356067119208, 'sideways_time_stop': 41, 'sideways_use_sma': True, 'sideways_use_ema': True, 'sideways_use_atr': False, 'sideways_use_adx': False, 'sideways_use_spike': True, 'sideways_rsi_required': False}.
[I 2025-09-01 04:57:36,453] Trial 322 finished with values: [-1000000000.0, 1000000000.0] and parameters: {'p_sma': 23, 'p_std': 60, 'p_atr': 27, 'p_adx': 10, 'rsi_period': 14, 'ema1': 28, 'ema2': 30, 'slip_atr_k': 0.15756370223198038, 'slip_spread_k': 0.27860109810773703, 'spread_hl_frac': 0.04559055001349982, 'bb_std_mult': 3.31432741315279, 'rsi_os': 22, 'rsi_ob': 82, 'vol_spike': 0.2769075064131828, 'adx_thresh': 14.059466230958224, 'atr_min_pct': 0.02198205918516364, 'atr_max_pct': 0.11391417406810839, 'tp_mult': 2.672761278767741, 'tsl_mult': 0.9997935974994565, 'strategy': 'breakout', 'time_stop': 49, 'use_sma': False, 'use_atr': False, 'use_adx': False, 'use_ema': True, 'use_spike': True, 'rsi_required': False, 'edge_k': 0.5590309016904378, 'edge_cap': 0.5119540382664635, 'bull_strategy': 'breakout', 'bull_bb_std_mult': 2.2951842779356086, 'bull_rsi_os': 33, 'bull_rsi_ob': 87, 'bull_adx_thresh': 17.925031065300384, 'bull_atr_min_pct': 0.002029009159899897, 'bull_atr_max_pct': 0.11834037610158636, 'bull_tp_mult': 1.528107816620135, 'bull_tsl_mult': 0.41793631444802526, 'bull_time_stop': 246, 'bull_use_sma': True, 'bull_use_ema': False, 'bull_use_atr': False, 'bull_use_adx': False, 'bull_use_spike': False, 'bull_rsi_required': True, 'bear_strategy': 'mean_reversion', 'bear_bb_std_mult': 0.5816820446516576, 'bear_rsi_os': 14, 'bear_rsi_ob': 63, 'bear_adx_thresh': 26.0625463121374, 'bear_atr_min_pct': 0.0287223998270952, 'bear_atr_max_pct': 0.06829112521436885, 'bear_tp_mult': 1.7058979466946278, 'bear_tsl_mult': 0.5231862237441947, 'bear_time_stop': 211, 'bear_use_sma': True, 'bear_use_ema': False, 'bear_use_atr': False, 'bear_use_adx': False, 'bear_use_spike': False, 'bear_rsi_required': False, 'sideways_strategy': 'breakout', 'sideways_bb_std_mult': 0.5814401945788241, 'sideways_rsi_os': 47, 'sideways_rsi_ob': 71, 'sideways_adx_thresh': 20.785525217293813, 'sideways_atr_min_pct': 0.029464743402296434, 'sideways_atr_max_pct': 0.12125360519428502, 'sideways_tp_mult': 1.751741719317123, 'sideways_tsl_mult': 0.5539640624778189, 'sideways_time_stop': 222, 'sideways_use_sma': True, 'sideways_use_ema': True, 'sideways_use_atr': False, 'sideways_use_adx': False, 'sideways_use_spike': True, 'sideways_rsi_required': False}.
[I 2025-09-01 04:57:36,668] Trial 319 finished with values: [-1000000000.0, 1000000000.0] and parameters: {'p_sma': 29, 'p_std': 57, 'p_atr': 29, 'p_adx': 19, 'rsi_period': 10, 'ema1': 28, 'ema2': 30, 'slip_atr_k': 0.15663854851275222, 'slip_spread_k': 0.26985812037143764, 'spread_hl_frac': 0.04595524868611756, 'bb_std_mult': 3.535292413925622, 'rsi_os': 22, 'rsi_ob': 80, 'vol_spike': 0.17142894536102016, 'adx_thresh': 14.011721397512424, 'atr_min_pct': 0.022011874506327942, 'atr_max_pct': 0.11378899859684195, 'tp_mult': 2.574728484828497, 'tsl_mult': 0.995896932280121, 'strategy': 'breakout', 'time_stop': 42, 'use_sma': False, 'use_atr': False, 'use_adx': False, 'use_ema': True, 'use_spike': True, 'rsi_required': False, 'edge_k': 0.5658199295625591, 'edge_cap': 0.5355526542166654, 'bull_strategy': 'breakout', 'bull_bb_std_mult': 2.500800294612838, 'bull_rsi_os': 14, 'bull_rsi_ob': 88, 'bull_adx_thresh': 17.738592913683775, 'bull_atr_min_pct': 0.0023108960107133753, 'bull_atr_max_pct': 0.11796008743449608, 'bull_tp_mult': 1.521459708359836, 'bull_tsl_mult': 0.44380247650747295, 'bull_time_stop': 262, 'bull_use_sma': True, 'bull_use_ema': False, 'bull_use_atr': False, 'bull_use_adx': False, 'bull_use_spike': False, 'bull_rsi_required': True, 'bear_strategy': 'mean_reversion', 'bear_bb_std_mult': 0.5728878166015192, 'bear_rsi_os': 21, 'bear_rsi_ob': 66, 'bear_adx_thresh': 27.55118916697046, 'bear_atr_min_pct': 0.028326336903434886, 'bear_atr_max_pct': 0.06683623797894733, 'bear_tp_mult': 1.701753941086804, 'bear_tsl_mult': 0.691689991338049, 'bear_time_stop': 212, 'bear_use_sma': True, 'bear_use_ema': False, 'bear_use_atr': False, 'bear_use_adx': False, 'bear_use_spike': False, 'bear_rsi_required': False, 'sideways_strategy': 'breakout', 'sideways_bb_std_mult': 0.5970062859000469, 'sideways_rsi_os': 53, 'sideways_rsi_ob': 65, 'sideways_adx_thresh': 20.102604137247983, 'sideways_atr_min_pct': 0.026826757943951618, 'sideways_atr_max_pct': 0.1207580140415121, 'sideways_tp_mult': 1.3132030356274633, 'sideways_tsl_mult': 0.5440435435256417, 'sideways_time_stop': 174, 'sideways_use_sma': True, 'sideways_use_ema': True, 'sideways_use_atr': False, 'sideways_use_adx': False, 'sideways_use_spike': True, 'sideways_rsi_required': False}.
[I 2025-09-01 04:58:16,692] Trial 323 finished with values: [-1000000000.0, 1000000000.0] and parameters: {'p_sma': 23, 'p_std': 60, 'p_atr': 27, 'p_adx': 10, 'rsi_period': 11, 'ema1': 28, 'ema2': 30, 'slip_atr_k': 0.011133748785573109, 'slip_spread_k': 0.2818970897405234, 'spread_hl_frac': 0.046385644707539336, 'bb_std_mult': 3.3438371598629817, 'rsi_os': 22, 'rsi_ob': 82, 'vol_spike': 0.14418587420574175, 'adx_thresh': 33.97269834308169, 'atr_min_pct': 0.025220902410615927, 'atr_max_pct': 0.11449827743267298, 'tp_mult': 2.550770087361932, 'tsl_mult': 0.9632775899788396, 'strategy': 'breakout', 'time_stop': 36, 'use_sma': False, 'use_atr': False, 'use_adx': False, 'use_ema': False, 'use_spike': True, 'rsi_required': False, 'edge_k': 0.7785155281440413, 'edge_cap': 0.46884144378240716, 'bull_strategy': 'breakout', 'bull_bb_std_mult': 1.46132395858486, 'bull_rsi_os': 9, 'bull_rsi_ob': 88, 'bull_adx_thresh': 17.84877232338141, 'bull_atr_min_pct': 0.003408962536871926, 'bull_atr_max_pct': 0.1109187339675051, 'bull_tp_mult': 1.5479447490364904, 'bull_tsl_mult': 0.4226798700463509, 'bull_time_stop': 272, 'bull_use_sma': True, 'bull_use_ema': True, 'bull_use_atr': False, 'bull_use_adx': True, 'bull_use_spike': False, 'bull_rsi_required': True, 'bear_strategy': 'breakout', 'bear_bb_std_mult': 0.8611051175518043, 'bear_rsi_os': 14, 'bear_rsi_ob': 63, 'bear_adx_thresh': 29.877476870324116, 'bear_atr_min_pct': 0.028476589728479232, 'bear_atr_max_pct': 0.06485252598048283, 'bear_tp_mult': 1.4892056935968245, 'bear_tsl_mult': 0.5645436942734297, 'bear_time_stop': 210, 'bear_use_sma': True, 'bear_use_ema': False, 'bear_use_atr': False, 'bear_use_adx': False, 'bear_use_spike': False, 'bear_rsi_required': False, 'sideways_strategy': 'breakout', 'sideways_bb_std_mult': 0.9031447509467634, 'sideways_rsi_os': 53, 'sideways_rsi_ob': 55, 'sideways_adx_thresh': 18.347973189942664, 'sideways_atr_min_pct': 0.024248761348253878, 'sideways_atr_max_pct': 0.11987658059179303, 'sideways_tp_mult': 1.7095637958417411, 'sideways_tsl_mult': 0.924207640885031, 'sideways_time_stop': 150, 'sideways_use_sma': True, 'sideways_use_ema': False, 'sideways_use_atr': True, 'sideways_use_adx': False, 'sideways_use_spike': True, 'sideways_rsi_required': True}.
