[I 2025-09-01 04:15:27,610] Trial 73 finished with values: [-1000000000.0, 1000000000.0] and parameters: {'p_sma': 54, 'p_std': 33, 'p_atr': 13, 'p_adx': 16, 'rsi_period': 22, 'ema1': 24, 'ema2': 49, 'slip_atr_k': 0.2341557388796372, 'slip_spread_k': 0.6149074820264099, 'spread_hl_frac': 0.040925302971188585, 'bb_std_mult': 1.1063847546013945, 'rsi_os': 27, 'rsi_ob': 62, 'vol_spike': 0.09768180627501305, 'adx_thresh': 21.586684634976606, 'atr_min_pct': 0.007613873730785508, 'atr_max_pct': 0.0458533030529288, 'tp_mult': 2.9814216789338057, 'tsl_mult': 0.5741192498856698, 'strategy': 'breakout', 'time_stop': 69, 'use_sma': True, 'use_atr': False, 'use_adx': True, 'use_ema': False, 'use_spike': True, 'rsi_required': False, 'edge_k': 1.9792186231757702, 'edge_cap': 0.7372837193458458, 'bull_strategy': 'mean_reversion', 'bull_bb_std_mult': 1.6835272266509698, 'bull_rsi_os': 27, 'bull_rsi_ob': 70, 'bull_adx_thresh': 20.87067626923305, 'bull_atr_min_pct': 0.0151137289078138, 'bull_atr_max_pct': 0.08357407126983887, 'bull_tp_mult': 1.9511983347544906, 'bull_tsl_mult': 0.7718404350045213, 'bull_time_stop': 72, 'bull_use_sma': False, 'bull_use_ema': False, 'bull_use_atr': True, 'bull_use_adx': True, 'bull_use_spike': True, 'bull_rsi_required': False, 'bear_strategy': 'breakout', 'bear_bb_std_mult': 3.479521606955151, 'bear_rsi_os': 6, 'bear_rsi_ob': 47, 'bear_adx_thresh': 24.065500053612023, 'bear_atr_min_pct': 0.01180808138355255, 'bear_atr_max_pct': 0.03824238193399399, 'bear_tp_mult': 2.4472862657913454, 'bear_tsl_mult': 0.0600790786347683, 'bear_time_stop': 88, 'bear_use_sma': True, 'bear_use_ema': False, 'bear_use_atr': False, 'bear_use_adx': True, 'bear_use_spike': True, 'bear_rsi_required': True, 'sideways_strategy': 'mean_reversion', 'sideways_bb_std_mult': 3.06056957353547, 'sideways_rsi_os': 27, 'sideways_rsi_ob': 51, 'sideways_adx_thresh': 19.979369135184893, 'sideways_atr_min_pct': 0.02643654337396778, 'sideways_atr_max_pct': 0.09963894329213102, 'sideways_tp_mult': 1.8963340073261852, 'sideways_tsl_mult': 0.40119833185862996, 'sideways_time_stop': 76, 'sideways_use_sma': True, 'sideways_use_ema': True, 'sideways_use_atr': True, 'sideways_use_adx': True, 'sideways_use_spike': False, 'sideways_rsi_required': True}.
[I 2025-09-01 04:15:27,887] Trial 71 finished with values: [-1000000000.0, 1000000000.0] and parameters: {'p_sma': 5, 'p_std': 39, 'p_atr': 21, 'p_adx': 13, 'rsi_period': 13, 'ema1': 24, 'ema2': 49, 'slip_atr_k': 0.22021155403781112, 'slip_spread_k': 0.24314028586284048, 'spread_hl_frac': 0.010652948090740503, 'bb_std_mult': 0.8258922869752872, 'rsi_os': 27, 'rsi_ob': 62, 'vol_spike': 0.17374503301104222, 'adx_thresh': 21.73576659837952, 'atr_min_pct': 0.01941618919477176, 'atr_max_pct': 0.026831415286712946, 'tp_mult': 2.066743731155541, 'tsl_mult': 0.3072517474214212, 'strategy': 'breakout', 'time_stop': 243, 'use_sma': False, 'use_atr': False, 'use_adx': False, 'use_ema': True, 'use_spike': True, 'rsi_required': False, 'edge_k': 0.00845730888018914, 'edge_cap': 0.755178801759537, 'bull_strategy': 'mean_reversion', 'bull_bb_std_mult': 1.025536317395835, 'bull_rsi_os': 25, 'bull_rsi_ob': 59, 'bull_adx_thresh': 30.845700875535552, 'bull_atr_min_pct': 0.015368191717873594, 'bull_atr_max_pct': 0.07339593049111658, 'bull_tp_mult': 1.9597371887461783, 'bull_tsl_mult': 0.8300037031559221, 'bull_time_stop': 240, 'bull_use_sma': True, 'bull_use_ema': False, 'bull_use_atr': True, 'bull_use_adx': True, 'bull_use_spike': True, 'bull_rsi_required': False, 'bear_strategy': 'breakout', 'bear_bb_std_mult': 1.05754254593244, 'bear_rsi_os': 34, 'bear_rsi_ob': 47, 'bear_adx_thresh': 19.014236571173637, 'bear_atr_min_pct': 0.019212658196477436, 'bear_atr_max_pct': 0.06329867126186928, 'bear_tp_mult': 2.1573740790577296, 'bear_tsl_mult': 0.41020797012450233, 'bear_time_stop': 184, 'bear_use_sma': True, 'bear_use_ema': False, 'bear_use_atr': True, 'bear_use_adx': False, 'bear_use_spike': True, 'bear_rsi_required': False, 'sideways_strategy': 'breakout', 'sideways_bb_std_mult': 2.814685068264281, 'sideways_rsi_os': 18, 'sideways_rsi_ob': 55, 'sideways_adx_thresh': 19.71270556739222, 'sideways_atr_min_pct': 0.026428612872499525, 'sideways_atr_max_pct': 0.09689617193542224, 'sideways_tp_mult': 1.5975588030830035, 'sideways_tsl_mult': 0.893273747326832, 'sideways_time_stop': 18, 'sideways_use_sma': False, 'sideways_use_ema': True, 'sideways_use_atr': True, 'sideways_use_adx': False, 'sideways_use_spike': True, 'sideways_rsi_required': True}.
[I 2025-09-01 04:15:28,459] Trial 76 finished with values: [-1000000000.0, 1000000000.0] and parameters: {'p_sma': 36, 'p_std': 38, 'p_atr': 24, 'p_adx': 10, 'rsi_period': 39, 'ema1': 20, 'ema2': 39, 'slip_atr_k': 0.06413510317524249, 'slip_spread_k': 0.874058349362147, 'spread_hl_frac': 0.007906464325114628, 'bb_std_mult': 0.8551109930628895, 'rsi_os': 5, 'rsi_ob': 48, 'vol_spike': 0.16756297929442798, 'adx_thresh': 19.434487808900446, 'atr_min_pct': 0.023467335858431755, 'atr_max_pct': 0.02879665998295497, 'tp_mult': 1.5942831739894547, 'tsl_mult': 0.3054457419239328, 'strategy': 'mean_reversion', 'time_stop': 104, 'use_sma': False, 'use_atr': False, 'use_adx': True, 'use_ema': True, 'use_spike': True, 'rsi_required': True, 'edge_k': 0.005031277933617795, 'edge_cap': 0.88621251891119, 'bull_strategy': 'mean_reversion', 'bull_bb_std_mult': 1.5173120770229787, 'bull_rsi_os': 12, 'bull_rsi_ob': 65, 'bull_adx_thresh': 13.239316098741478, 'bull_atr_min_pct': 0.0028204842752734306, 'bull_atr_max_pct': 0.09377397620874003, 'bull_tp_mult': 1.7635862706560774, 'bull_tsl_mult': 0.6711715735718529, 'bull_time_stop': 254, 'bull_use_sma': False, 'bull_use_ema': True, 'bull_use_atr': False, 'bull_use_adx': False, 'bull_use_spike': True, 'bull_rsi_required': True, 'bear_strategy': 'mean_reversion', 'bear_bb_std_mult': 3.3973330434041777, 'bear_rsi_os': 24, 'bear_rsi_ob': 45, 'bear_adx_thresh': 21.762470784012173, 'bear_atr_min_pct': 0.01658703266707851, 'bear_atr_max_pct': 0.06251490512267241, 'bear_tp_mult': 1.570187319246946, 'bear_tsl_mult': 0.5604419773277908, 'bear_time_stop': 157, 'bear_use_sma': False, 'bear_use_ema': True, 'bear_use_atr': False, 'bear_use_adx': True, 'bear_use_spike': False, 'bear_rsi_required': False, 'sideways_strategy': 'mean_reversion', 'sideways_bb_std_mult': 1.2636555655438702, 'sideways_rsi_os': 42, 'sideways_rsi_ob': 90, 'sideways_adx_thresh': 16.149967636395584, 'sideways_atr_min_pct': 0.005405695708327255, 'sideways_atr_max_pct': 0.12721128908126267, 'sideways_tp_mult': 2.3473722972095086, 'sideways_tsl_mult': 0.7892786920402056, 'sideways_time_stop': 39, 'sideways_use_sma': False, 'sideways_use_ema': True, 'sideways_use_atr': False, 'sideways_use_adx': True, 'sideways_use_spike': False, 'sideways_rsi_required': False}.
[I 2025-09-01 04:15:28,475] Trial 77 finished with values: [-1000000000.0, 1000000000.0] and parameters: {'p_sma': 60, 'p_std': 37, 'p_atr': 19, 'p_adx': 7, 'rsi_period': 29, 'ema1': 10, 'ema2': 10, 'slip_atr_k': 0.1583015351730627, 'slip_spread_k': 0.37440056366722924, 'spread_hl_frac': 0.005046792159934566, 'bb_std_mult': 1.618975846805898, 'rsi_os': 51, 'rsi_ob': 49, 'vol_spike': 0.16345970940497828, 'adx_thresh': 23.447193847137832, 'atr_min_pct': 0.014876967283015005, 'atr_max_pct': 0.037142381662653344, 'tp_mult': 1.5807007481568638, 'tsl_mult': 0.43882749896125134, 'strategy': 'mean_reversion', 'time_stop': 101, 'use_sma': True, 'use_atr': True, 'use_adx': True, 'use_ema': False, 'use_spike': True, 'rsi_required': True, 'edge_k': 1.08624288096717, 'edge_cap': 0.2908893218870711, 'bull_strategy': 'breakout', 'bull_bb_std_mult': 0.7265772833704371, 'bull_rsi_os': 34, 'bull_rsi_ob': 64, 'bull_adx_thresh': 13.452547962398956, 'bull_atr_min_pct': 0.01345225365971948, 'bull_atr_max_pct': 0.05556304326543729, 'bull_tp_mult': 1.8299988739607447, 'bull_tsl_mult': 0.0034722903900618607, 'bull_time_stop': 256, 'bull_use_sma': False, 'bull_use_ema': True, 'bull_use_atr': False, 'bull_use_adx': False, 'bull_use_spike': True, 'bull_rsi_required': True, 'bear_strategy': 'mean_reversion', 'bear_bb_std_mult': 1.761525396489295, 'bear_rsi_os': 24, 'bear_rsi_ob': 45, 'bear_adx_thresh': 21.629680333845016, 'bear_atr_min_pct': 0.01662333943861856, 'bear_atr_max_pct': 0.05322288881577357, 'bear_tp_mult': 2.312767261474941, 'bear_tsl_mult': 0.532963923687441, 'bear_time_stop': 158, 'bear_use_sma': False, 'bear_use_ema': True, 'bear_use_atr': False, 'bear_use_adx': True, 'bear_use_spike': False, 'bear_rsi_required': True, 'sideways_strategy': 'mean_reversion', 'sideways_bb_std_mult': 2.602211507662745, 'sideways_rsi_os': 46, 'sideways_rsi_ob': 60, 'sideways_adx_thresh': 14.297486265332072, 'sideways_atr_min_pct': 0.0053402478936326455, 'sideways_atr_max_pct': 0.127079806392054, 'sideways_tp_mult': 2.1416539293725703, 'sideways_tsl_mult': 0.8491892626699175, 'sideways_time_stop': 38, 'sideways_use_sma': True, 'sideways_use_ema': True, 'sideways_use_atr': False, 'sideways_use_adx': True, 'sideways_use_spike': False, 'sideways_rsi_required': False}.
[I 2025-09-01 04:15:28,481] Trial 75 finished with values: [-1000000000.0, 1000000000.0] and parameters: {'p_sma': 35, 'p_std': 33, 'p_atr': 12, 'p_adx': 16, 'rsi_period': 29, 'ema1': 20, 'ema2': 39, 'slip_atr_k': 0.1602936250773655, 'slip_spread_k': 0.8513754675823666, 'spread_hl_frac': 0.016872741043850104, 'bb_std_mult': 0.77217072072701, 'rsi_os': 5, 'rsi_ob': 50, 'vol_spike': 0.16439329039875805, 'adx_thresh': 19.38161831991038, 'atr_min_pct': 0.015015655205504994, 'atr_max_pct': 0.04597166300963898, 'tp_mult': 1.4038424566038703, 'tsl_mult': 0.28537179120909806, 'strategy': 'mean_reversion', 'time_stop': 69, 'use_sma': True, 'use_atr': False, 'use_adx': True, 'use_ema': True, 'use_spike': True, 'rsi_required': True, 'edge_k': 1.9769943302954789, 'edge_cap': 0.3980840092462428, 'bull_strategy': 'mean_reversion', 'bull_bb_std_mult': 2.352538399393957, 'bull_rsi_os': 34, 'bull_rsi_ob': 45, 'bull_adx_thresh': 13.366186424505283, 'bull_atr_min_pct': 0.01548611017832043, 'bull_atr_max_pct': 0.05384593388490816, 'bull_tp_mult': 1.077323917365181, 'bull_tsl_mult': 0.03515765537457061, 'bull_time_stop': 226, 'bull_use_sma': False, 'bull_use_ema': True, 'bull_use_atr': False, 'bull_use_adx': False, 'bull_use_spike': True, 'bull_rsi_required': True, 'bear_strategy': 'mean_reversion', 'bear_bb_std_mult': 3.474200214806565, 'bear_rsi_os': 45, 'bear_rsi_ob': 47, 'bear_adx_thresh': 21.454551277016346, 'bear_atr_min_pct': 0.016773975198771957, 'bear_atr_max_pct': 0.08681199800410663, 'bear_tp_mult': 1.5082476450675044, 'bear_tsl_mult': 0.5497394670684022, 'bear_time_stop': 159, 'bear_use_sma': True, 'bear_use_ema': True, 'bear_use_atr': False, 'bear_use_adx': True, 'bear_use_spike': True, 'bear_rsi_required': True, 'sideways_strategy': 'mean_reversion', 'sideways_bb_std_mult': 1.308394354085074, 'sideways_rsi_os': 45, 'sideways_rsi_ob': 74, 'sideways_adx_thresh': 20.586252186717477, 'sideways_atr_min_pct': 0.004977887000915526, 'sideways_atr_max_pct': 0.12584138429496092, 'sideways_tp_mult': 2.986436744260011, 'sideways_tsl_mult': 0.4281790663020558, 'sideways_time_stop': 41, 'sideways_use_sma': False, 'sideways_use_ema': True, 'sideways_use_atr': False, 'sideways_use_adx': True, 'sideways_use_spike': False, 'sideways_rsi_required': False}.
[I 2025-09-01 04:15:28,965] Trial 78 finished with values: [-1000000000.0, 1000000000.0] and parameters: {'p_sma': 60, 'p_std': 36, 'p_atr': 19, 'p_adx': 7, 'rsi_period': 28, 'ema1': 22, 'ema2': 10, 'slip_atr_k': 0.1253851990897191, 'slip_spread_k': 0.5515294408975686, 'spread_hl_frac': 0.0052147480633132, 'bb_std_mult': 1.628038205254164, 'rsi_os': 52, 'rsi_ob': 79, 'vol_spike': 0.22944814218992607, 'adx_thresh': 25.054268655027528, 'atr_min_pct': 0.021733441284871736, 'atr_max_pct': 0.03688892376687721, 'tp_mult': 1.4133811891808457, 'tsl_mult': 0.441255596774671, 'strategy': 'mean_reversion', 'time_stop': 196, 'use_sma': True, 'use_atr': True, 'use_adx': True, 'use_ema': False, 'use_spike': False, 'rsi_required': True, 'edge_k': 0.9626973562983749, 'edge_cap': 0.9920163774570252, 'bull_strategy': 'breakout', 'bull_bb_std_mult': 0.7890042251788878, 'bull_rsi_os': 29, 'bull_rsi_ob': 69, 'bull_adx_thresh': 23.785932760642396, 'bull_atr_min_pct': 0.029469680493442892, 'bull_atr_max_pct': 0.05436267023433089, 'bull_tp_mult': 1.1225096208001737, 'bull_tsl_mult': 0.0260286456899414, 'bull_time_stop': 227, 'bull_use_sma': False, 'bull_use_ema': True, 'bull_use_atr': False, 'bull_use_adx': False, 'bull_use_spike': False, 'bull_rsi_required': True, 'bear_strategy': 'mean_reversion', 'bear_bb_std_mult': 1.7794676150738828, 'bear_rsi_os': 47, 'bear_rsi_ob': 49, 'bear_adx_thresh': 20.823165264582116, 'bear_atr_min_pct': 0.021195242190758336, 'bear_atr_max_pct': 0.05199641837814245, 'bear_tp_mult': 1.486738611978445, 'bear_tsl_mult': 0.5221551113907962, 'bear_time_stop': 118, 'bear_use_sma': True, 'bear_use_ema': True, 'bear_use_atr': False, 'bear_use_adx': True, 'bear_use_spike': True, 'bear_rsi_required': True, 'sideways_strategy': 'mean_reversion', 'sideways_bb_std_mult': 3.1828862577046753, 'sideways_rsi_os': 9, 'sideways_rsi_ob': 60, 'sideways_adx_thresh': 14.010832085641416, 'sideways_atr_min_pct': 0.003024617080307139, 'sideways_atr_max_pct': 0.1478898431372736, 'sideways_tp_mult': 2.102652869012002, 'sideways_tsl_mult': 0.854789393413706, 'sideways_time_stop': 49, 'sideways_use_sma': True, 'sideways_use_ema': True, 'sideways_use_atr': False, 'sideways_use_adx': True, 'sideways_use_spike': False, 'sideways_rsi_required': False}.
[I 2025-09-01 04:16:04,480] Trial 74 finished with values: [-1000000000.0, 1000000000.0] and parameters: {'p_sma': 5, 'p_std': 34, 'p_atr': 12, 'p_adx': 16, 'rsi_period': 21, 'ema1': 20, 'ema2': 39, 'slip_atr_k': 0.0637993278429615, 'slip_spread_k': 0.4628192973527415, 'spread_hl_frac': 0.0026234826614678986, 'bb_std_mult': 0.8420581047582129, 'rsi_os': 50, 'rsi_ob': 62, 'vol_spike': 0.16517204661254847, 'adx_thresh': 23.54542054409611, 'atr_min_pct': 0.007192731344863065, 'atr_max_pct': 0.027547392645585898, 'tp_mult': 2.877965644536791, 'tsl_mult': 0.2990198445173349, 'strategy': 'breakout', 'time_stop': 69, 'use_sma': True, 'use_atr': False, 'use_adx': True, 'use_ema': False, 'use_spike': True, 'rsi_required': True, 'edge_k': 0.5249087001599898, 'edge_cap': 0.2724417832122294, 'bull_strategy': 'mean_reversion', 'bull_bb_std_mult': 0.747007827448407, 'bull_rsi_os': 27, 'bull_rsi_ob': 69, 'bull_adx_thresh': 13.438861128612935, 'bull_atr_min_pct': 0.015137862844629953, 'bull_atr_max_pct': 0.05544005086389925, 'bull_tp_mult': 1.9465808246533776, 'bull_tsl_mult': 0.7677108165881574, 'bull_time_stop': 228, 'bull_use_sma': False, 'bull_use_ema': False, 'bull_use_atr': True, 'bull_use_adx': False, 'bull_use_spike': True, 'bull_rsi_required': False, 'bear_strategy': 'mean_reversion', 'bear_bb_std_mult': 1.754744320334856, 'bear_rsi_os': 6, 'bear_rsi_ob': 47, 'bear_adx_thresh': 23.832385272548144, 'bear_atr_min_pct': 0.016639765368041494, 'bear_atr_max_pct': 0.05446410668517169, 'bear_tp_mult': 1.4941387949096838, 'bear_tsl_mult': 0.5468089545312402, 'bear_time_stop': 158, 'bear_use_sma': True, 'bear_use_ema': False, 'bear_use_atr': False, 'bear_use_adx': True, 'bear_use_spike': True, 'bear_rsi_required': True, 'sideways_strategy': 'mean_reversion', 'sideways_bb_std_mult': 1.2831964212542508, 'sideways_rsi_os': 46, 'sideways_rsi_ob': 51, 'sideways_adx_thresh': 19.975980277436914, 'sideways_atr_min_pct': 0.005434786660796382, 'sideways_atr_max_pct': 0.09830730191113177, 'sideways_tp_mult': 1.463753121075614, 'sideways_tsl_mult': 0.7715731188106261, 'sideways_time_stop': 45, 'sideways_use_sma': True, 'sideways_use_ema': True, 'sideways_use_atr': False, 'sideways_use_adx': True, 'sideways_use_spike': False, 'sideways_rsi_required': True}.
[I 2025-09-01 04:16:08,121] Trial 79 finished with values: [-1000000000.0, 1000000000.0] and parameters: {'p_sma': 43, 'p_std': 43, 'p_atr': 17, 'p_adx': 22, 'rsi_period': 33, 'ema1': 22, 'ema2': 46, 'slip_atr_k': 0.19948906866242866, 'slip_spread_k': 0.5467341405606652, 'spread_hl_frac': 0.01973927968750895, 'bb_std_mult': 2.8643958205856572, 'rsi_os': 50, 'rsi_ob': 94, 'vol_spike': 0.22591464866896022, 'adx_thresh': 24.95214024581121, 'atr_min_pct': 0.021435735604645772, 'atr_max_pct': 0.08387715649429431, 'tp_mult': 1.6955793130429662, 'tsl_mult': 0.38028834428311975, 'strategy': 'breakout', 'time_stop': 149, 'use_sma': False, 'use_atr': True, 'use_adx': True, 'use_ema': False, 'use_spike': False, 'rsi_required': True, 'edge_k': 1.2443973567467004, 'edge_cap': 0.9820929590978911, 'bull_strategy': 'breakout', 'bull_bb_std_mult': 1.837533408057994, 'bull_rsi_os': 28, 'bull_rsi_ob': 82, 'bull_adx_thresh': 14.748019024689624, 'bull_atr_min_pct': 0.011260837952939976, 'bull_atr_max_pct': 0.07821310283127568, 'bull_tp_mult': 2.937872858961576, 'bull_tsl_mult': 0.7492048628064559, 'bull_time_stop': 191, 'bull_use_sma': False, 'bull_use_ema': False, 'bull_use_atr': True, 'bull_use_adx': True, 'bull_use_spike': False, 'bull_rsi_required': False, 'bear_strategy': 'breakout', 'bear_bb_std_mult': 3.271093324542665, 'bear_rsi_os': 19, 'bear_rsi_ob': 49, 'bear_adx_thresh': 17.429799448091174, 'bear_atr_min_pct': 0.01460399985238139, 'bear_atr_max_pct': 0.02405704883806318, 'bear_tp_mult': 1.4642537936707964, 'bear_tsl_mult': 0.446122341782331, 'bear_time_stop': 284, 'bear_use_sma': True, 'bear_use_ema': False, 'bear_use_atr': False, 'bear_use_adx': True, 'bear_use_spike': True, 'bear_rsi_required': False, 'sideways_strategy': 'mean_reversion', 'sideways_bb_std_mult': 1.1183933575274279, 'sideways_rsi_os': 13, 'sideways_rsi_ob': 71, 'sideways_adx_thresh': 16.72152610518056, 'sideways_atr_min_pct': 0.010042452190211236, 'sideways_atr_max_pct': 0.1470921883180146, 'sideways_tp_mult': 1.1148275236329772, 'sideways_tsl_mult': 0.2645948636057657, 'sideways_time_stop': 50, 'sideways_use_sma': True, 'sideways_use_ema': True, 'sideways_use_atr': True, 'sideways_use_adx': True, 'sideways_use_spike': False, 'sideways_rsi_required': True}.
[I 2025-09-01 04:16:08,330] Trial 80 finished with values: [-0.03252765616931852, 0.03234602111133726] and parameters: {'p_sma': 31, 'p_std': 43, 'p_atr': 17, 'p_adx': 20, 'rsi_period': 33, 'ema1': 22, 'ema2': 46, 'slip_atr_k': 0.12602356478995388, 'slip_spread_k': 0.9618644523936867, 'spread_hl_frac': 0.0024661478750412904, 'bb_std_mult': 1.9322697062668894, 'rsi_os': 40, 'rsi_ob': 94, 'vol_spike': 0.1974319001525828, 'adx_thresh': 33.71525696903745, 'atr_min_pct': 0.021596074410261068, 'atr_max_pct': 0.08662178871588193, 'tp_mult': 2.876329124701553, 'tsl_mult': 0.3791572667066389, 'strategy': 'breakout', 'time_stop': 144, 'use_sma': False, 'use_atr': True, 'use_adx': True, 'use_ema': False, 'use_spike': False, 'rsi_required': True, 'edge_k': 0.5260806947531217, 'edge_cap': 0.21677659136565036, 'bull_strategy': 'breakout', 'bull_bb_std_mult': 1.1751197519209158, 'bull_rsi_os': 28, 'bull_rsi_ob': 69, 'bull_adx_thresh': 14.768423582341232, 'bull_atr_min_pct': 0.000136164409938664, 'bull_atr_max_pct': 0.07870909715646923, 'bull_tp_mult': 2.3300678642145285, 'bull_tsl_mult': 0.7438111024194448, 'bull_time_stop': 231, 'bull_use_sma': False, 'bull_use_ema': False, 'bull_use_atr': True, 'bull_use_adx': True, 'bull_use_spike': False, 'bull_rsi_required': False, 'bear_strategy': 'breakout', 'bear_bb_std_mult': 3.25755526751977, 'bear_rsi_os': 19, 'bear_rsi_ob': 95, 'bear_adx_thresh': 10.689953390528792, 'bear_atr_min_pct': 0.02301374694341508, 'bear_atr_max_pct': 0.09011978570354288, 'bear_tp_mult': 1.5855764149131193, 'bear_tsl_mult': 0.5912805083882151, 'bear_time_stop': 117, 'bear_use_sma': True, 'bear_use_ema': False, 'bear_use_atr': False, 'bear_use_adx': True, 'bear_use_spike': True, 'bear_rsi_required': False, 'sideways_strategy': 'mean_reversion', 'sideways_bb_std_mult': 2.458188552633471, 'sideways_rsi_os': 14, 'sideways_rsi_ob': 59, 'sideways_adx_thresh': 22.779414708173235, 'sideways_atr_min_pct': 0.010049077737090012, 'sideways_atr_max_pct': 0.14693495361790157, 'sideways_tp_mult': 1.4388393915690112, 'sideways_tsl_mult': 0.530668206653084, 'sideways_time_stop': 275, 'sideways_use_sma': True, 'sideways_use_ema': True, 'sideways_use_atr': True, 'sideways_use_adx': True, 'sideways_use_spike': False, 'sideways_rsi_required': True}.
