[I 2025-09-01 05:27:11,795] Trial 486 finished with values: [-0.01591242902381307, 0.01636004793637416] and parameters: {'p_sma': 57, 'p_std': 30, 'p_atr': 8, 'p_adx': 17, 'rsi_period': 54, 'ema1': 25, 'ema2': 33, 'slip_atr_k': 0.014907651641476566, 'slip_spread_k': 0.4066314971259389, 'spread_hl_frac': 0.048389054483074595, 'bb_std_mult': 2.0416066180941828, 'rsi_os': 26, 'rsi_ob': 48, 'vol_spike': 0.1937795246368607, 'adx_thresh': 10.524482985097665, 'atr_min_pct': 0.0030658718573140873, 'atr_max_pct': 0.1229246358100783, 'tp_mult': 1.5112660475434154, 'tsl_mult': 0.09207118268769643, 'strategy': 'breakout', 'time_stop': 170, 'use_sma': False, 'use_atr': True, 'use_adx': True, 'use_ema': False, 'use_spike': True, 'rsi_required': False, 'edge_k': 0.1439867330776856, 'edge_cap': 0.7053078415639951, 'bull_strategy': 'breakout', 'bull_bb_std_mult': 0.9529018526472246, 'bull_rsi_os': 50, 'bull_rsi_ob': 50, 'bull_adx_thresh': 5.015641464412993, 'bull_atr_min_pct': 0.01348089066472196, 'bull_atr_max_pct': 0.09598063352424087, 'bull_tp_mult': 1.2521371396923124, 'bull_tsl_mult': 0.216646282347076, 'bull_time_stop': 86, 'bull_use_sma': True, 'bull_use_ema': True, 'bull_use_atr': False, 'bull_use_adx': True, 'bull_use_spike': False, 'bull_rsi_required': True, 'bear_strategy': 'breakout', 'bear_bb_std_mult': 3.5111196034589107, 'bear_rsi_os': 8, 'bear_rsi_ob': 69, 'bear_adx_thresh': 27.8140984707238, 'bear_atr_min_pct': 0.009151986528775179, 'bear_atr_max_pct': 0.06981482931783031, 'bear_tp_mult': 2.5866554141080074, 'bear_tsl_mult': 0.6266224179789487, 'bear_time_stop': 68, 'bear_use_sma': True, 'bear_use_ema': False, 'bear_use_atr': False, 'bear_use_adx': False, 'bear_use_spike': False, 'bear_rsi_required': False, 'sideways_strategy': 'breakout', 'sideways_bb_std_mult': 0.5779520024127894, 'sideways_rsi_os': 47, 'sideways_rsi_ob': 85, 'sideways_adx_thresh': 21.80362602197047, 'sideways_atr_min_pct': 0.004107139431711951, 'sideways_atr_max_pct': 0.10486302904400169, 'sideways_tp_mult': 1.549902471764237, 'sideways_tsl_mult': 0.40743090339587507, 'sideways_time_stop': 69, 'sideways_use_sma': False, 'sideways_use_ema': False, 'sideways_use_atr': True, 'sideways_use_adx': False, 'sideways_use_spike': True, 'sideways_rsi_required': True}.
[I 2025-09-01 05:27:13,097] Trial 488 finished with values: [-1000000000.0, 1000000000.0] and parameters: {'p_sma': 58, 'p_std': 32, 'p_atr': 8, 'p_adx': 16, 'rsi_period': 55, 'ema1': 25, 'ema2': 33, 'slip_atr_k': 0.014660161865693865, 'slip_spread_k': 0.40129111848232946, 'spread_hl_frac': 0.04726510834549574, 'bb_std_mult': 2.0715559631850278, 'rsi_os': 26, 'rsi_ob': 89, 'vol_spike': 0.20967763035680326, 'adx_thresh': 12.44614215356015, 'atr_min_pct': 0.0033010264276433386, 'atr_max_pct': 0.12497871159972279, 'tp_mult': 1.7957655293775527, 'tsl_mult': 0.557314736237346, 'strategy': 'mean_reversion', 'time_stop': 184, 'use_sma': False, 'use_atr': True, 'use_adx': False, 'use_ema': True, 'use_spike': True, 'rsi_required': False, 'edge_k': 0.33790391797179503, 'edge_cap': 0.5012277824050151, 'bull_strategy': 'breakout', 'bull_bb_std_mult': 0.9493452736553151, 'bull_rsi_os': 50, 'bull_rsi_ob': 87, 'bull_adx_thresh': 5.704235032856651, 'bull_atr_min_pct': 0.013495543733347028, 'bull_atr_max_pct': 0.10188027929087234, 'bull_tp_mult': 1.1499295438848853, 'bull_tsl_mult': 0.17788980696796994, 'bull_time_stop': 106, 'bull_use_sma': True, 'bull_use_ema': False, 'bull_use_atr': False, 'bull_use_adx': True, 'bull_use_spike': False, 'bull_rsi_required': True, 'bear_strategy': 'breakout', 'bear_bb_std_mult': 3.538983174973179, 'bear_rsi_os': 7, 'bear_rsi_ob': 69, 'bear_adx_thresh': 27.896959646045534, 'bear_atr_min_pct': 0.007348873492908873, 'bear_atr_max_pct': 0.06625309228632724, 'bear_tp_mult': 1.233852443820899, 'bear_tsl_mult': 0.30876751209071535, 'bear_time_stop': 139, 'bear_use_sma': False, 'bear_use_ema': False, 'bear_use_atr': False, 'bear_use_adx': False, 'bear_use_spike': False, 'bear_rsi_required': False, 'sideways_strategy': 'breakout', 'sideways_bb_std_mult': 0.7357875560036895, 'sideways_rsi_os': 45, 'sideways_rsi_ob': 85, 'sideways_adx_thresh': 24.663485854203742, 'sideways_atr_min_pct': 0.005018007445415004, 'sideways_atr_max_pct': 0.01953167246636009, 'sideways_tp_mult': 1.684238907245012, 'sideways_tsl_mult': 0.3083737839881681, 'sideways_time_stop': 252, 'sideways_use_sma': False, 'sideways_use_ema': True, 'sideways_use_atr': True, 'sideways_use_adx': False, 'sideways_use_spike': True, 'sideways_rsi_required': True}.
[I 2025-09-01 05:27:13,686] Trial 489 finished with values: [-1000000000.0, 1000000000.0] and parameters: {'p_sma': 58, 'p_std': 32, 'p_atr': 8, 'p_adx': 16, 'rsi_period': 54, 'ema1': 25, 'ema2': 35, 'slip_atr_k': 0.015692928589539728, 'slip_spread_k': 0.362243000286836, 'spread_hl_frac': 0.009968268193702078, 'bb_std_mult': 2.1897230637169396, 'rsi_os': 41, 'rsi_ob': 89, 'vol_spike': 0.028043856961698962, 'adx_thresh': 11.78094038995731, 'atr_min_pct': 0.0030208192779532512, 'atr_max_pct': 0.12335804177778456, 'tp_mult': 1.7955201462568386, 'tsl_mult': 0.30700328151407663, 'strategy': 'mean_reversion', 'time_stop': 171, 'use_sma': False, 'use_atr': True, 'use_adx': False, 'use_ema': True, 'use_spike': True, 'rsi_required': True, 'edge_k': 0.24803201625977092, 'edge_cap': 0.49512087238845676, 'bull_strategy': 'breakout', 'bull_bb_std_mult': 0.934082947600782, 'bull_rsi_os': 50, 'bull_rsi_ob': 92, 'bull_adx_thresh': 5.600395954035696, 'bull_atr_min_pct': 0.013341187955205017, 'bull_atr_max_pct': 0.10138638981733382, 'bull_tp_mult': 1.2408861842500805, 'bull_tsl_mult': 0.18865925589934934, 'bull_time_stop': 85, 'bull_use_sma': True, 'bull_use_ema': False, 'bull_use_atr': False, 'bull_use_adx': True, 'bull_use_spike': False, 'bull_rsi_required': True, 'bear_strategy': 'breakout', 'bear_bb_std_mult': 3.5986546903156307, 'bear_rsi_os': 8, 'bear_rsi_ob': 71, 'bear_adx_thresh': 28.111170874278542, 'bear_atr_min_pct': 0.009229494273817272, 'bear_atr_max_pct': 0.07419872523060637, 'bear_tp_mult': 1.9024557013730925, 'bear_tsl_mult': 0.6253060546849253, 'bear_time_stop': 5, 'bear_use_sma': False, 'bear_use_ema': False, 'bear_use_atr': False, 'bear_use_adx': False, 'bear_use_spike': False, 'bear_rsi_required': False, 'sideways_strategy': 'breakout', 'sideways_bb_std_mult': 3.1123558639262026, 'sideways_rsi_os': 45, 'sideways_rsi_ob': 85, 'sideways_adx_thresh': 24.76176521934209, 'sideways_atr_min_pct': 0.0050625851372163915, 'sideways_atr_max_pct': 0.019894523448741035, 'sideways_tp_mult': 1.6733375484942008, 'sideways_tsl_mult': 0.7940431559251757, 'sideways_time_stop': 175, 'sideways_use_sma': False, 'sideways_use_ema': True, 'sideways_use_atr': True, 'sideways_use_adx': False, 'sideways_use_spike': True, 'sideways_rsi_required': True}.
[I 2025-09-01 05:27:14,045] Trial 487 finished with values: [-1000000000.0, 1000000000.0] and parameters: {'p_sma': 58, 'p_std': 32, 'p_atr': 8, 'p_adx': 16, 'rsi_period': 55, 'ema1': 25, 'ema2': 33, 'slip_atr_k': 0.014937626501810367, 'slip_spread_k': 0.39699235169363883, 'spread_hl_frac': 0.04705994621711067, 'bb_std_mult': 2.069402077486445, 'rsi_os': 26, 'rsi_ob': 67, 'vol_spike': 0.2081554370392752, 'adx_thresh': 12.110602441338573, 'atr_min_pct': 0.0029744479103449885, 'atr_max_pct': 0.12362076031281813, 'tp_mult': 1.5169713953490283, 'tsl_mult': 0.9361004024048076, 'strategy': 'mean_reversion', 'time_stop': 182, 'use_sma': False, 'use_atr': True, 'use_adx': False, 'use_ema': True, 'use_spike': True, 'rsi_required': False, 'edge_k': 0.3313934217242853, 'edge_cap': 0.5006403794438302, 'bull_strategy': 'breakout', 'bull_bb_std_mult': 0.8680143492827586, 'bull_rsi_os': 50, 'bull_rsi_ob': 91, 'bull_adx_thresh': 5.893745948465259, 'bull_atr_min_pct': 0.013592862919506466, 'bull_atr_max_pct': 0.10352804609662547, 'bull_tp_mult': 1.2375261475486914, 'bull_tsl_mult': 0.2606529130591857, 'bull_time_stop': 107, 'bull_use_sma': True, 'bull_use_ema': False, 'bull_use_atr': False, 'bull_use_adx': True, 'bull_use_spike': False, 'bull_rsi_required': True, 'bear_strategy': 'breakout', 'bear_bb_std_mult': 3.539991663545508, 'bear_rsi_os': 40, 'bear_rsi_ob': 70, 'bear_adx_thresh': 30.5079667885731, 'bear_atr_min_pct': 0.007663761844371414, 'bear_atr_max_pct': 0.014065196534160593, 'bear_tp_mult': 2.5693544112198445, 'bear_tsl_mult': 0.005219928229585558, 'bear_time_stop': 91, 'bear_use_sma': False, 'bear_use_ema': False, 'bear_use_atr': False, 'bear_use_adx': False, 'bear_use_spike': False, 'bear_rsi_required': False, 'sideways_strategy': 'breakout', 'sideways_bb_std_mult': 3.1222140480494325, 'sideways_rsi_os': 46, 'sideways_rsi_ob': 51, 'sideways_adx_thresh': 24.872455086885825, 'sideways_atr_min_pct': 0.004924264302285442, 'sideways_atr_max_pct': 0.020482043839505797, 'sideways_tp_mult': 1.6755040805242194, 'sideways_tsl_mult': 0.2998028575798376, 'sideways_time_stop': 42, 'sideways_use_sma': False, 'sideways_use_ema': True, 'sideways_use_atr': True, 'sideways_use_adx': False, 'sideways_use_spike': True, 'sideways_rsi_required': True}.
[I 2025-09-01 05:27:58,710] Trial 491 finished with values: [-1000000000.0, 1000000000.0] and parameters: {'p_sma': 58, 'p_std': 35, 'p_atr': 8, 'p_adx': 18, 'rsi_period': 51, 'ema1': 25, 'ema2': 36, 'slip_atr_k': 0.21842822577383758, 'slip_spread_k': 0.3867453912199945, 'spread_hl_frac': 0.0468168980603083, 'bb_std_mult': 1.8695525043635994, 'rsi_os': 33, 'rsi_ob': 92, 'vol_spike': 0.027227020173847122, 'adx_thresh': 13.788885047096542, 'atr_min_pct': 0.0029562254533199274, 'atr_max_pct': 0.12322687576466333, 'tp_mult': 2.5461054204591433, 'tsl_mult': 0.9342440899056167, 'strategy': 'breakout', 'time_stop': 170, 'use_sma': False, 'use_atr': True, 'use_adx': False, 'use_ema': True, 'use_spike': True, 'rsi_required': True, 'edge_k': 0.2708772422939783, 'edge_cap': 0.5932661069004319, 'bull_strategy': 'breakout', 'bull_bb_std_mult': 1.0879946100317313, 'bull_rsi_os': 50, 'bull_rsi_ob': 91, 'bull_adx_thresh': 5.825576982163733, 'bull_atr_min_pct': 0.014773488351696697, 'bull_atr_max_pct': 0.10379071656119296, 'bull_tp_mult': 1.2581502663390547, 'bull_tsl_mult': 0.24926796030325854, 'bull_time_stop': 86, 'bull_use_sma': False, 'bull_use_ema': False, 'bull_use_atr': False, 'bull_use_adx': True, 'bull_use_spike': True, 'bull_rsi_required': True, 'bear_strategy': 'breakout', 'bear_bb_std_mult': 3.5656595786333187, 'bear_rsi_os': 40, 'bear_rsi_ob': 68, 'bear_adx_thresh': 9.555288498230144, 'bear_atr_min_pct': 0.009305860098407217, 'bear_atr_max_pct': 0.08548985026147554, 'bear_tp_mult': 1.3763695844309067, 'bear_tsl_mult': 0.6234785674733216, 'bear_time_stop': 196, 'bear_use_sma': True, 'bear_use_ema': False, 'bear_use_atr': False, 'bear_use_adx': False, 'bear_use_spike': True, 'bear_rsi_required': False, 'sideways_strategy': 'breakout', 'sideways_bb_std_mult': 1.8983306183776831, 'sideways_rsi_os': 43, 'sideways_rsi_ob': 51, 'sideways_adx_thresh': 23.135735010900042, 'sideways_atr_min_pct': 0.006042635601455118, 'sideways_atr_max_pct': 0.10201167065955206, 'sideways_tp_mult': 1.5715359194463745, 'sideways_tsl_mult': 0.5125646345329816, 'sideways_time_stop': 175, 'sideways_use_sma': False, 'sideways_use_ema': True, 'sideways_use_atr': True, 'sideways_use_adx': True, 'sideways_use_spike': True, 'sideways_rsi_required': True}.
[I 2025-09-01 05:27:59,371] Trial 490 finished with values: [-1000000000.0, 1000000000.0] and parameters: {'p_sma': 58, 'p_std': 32, 'p_atr': 8, 'p_adx': 16, 'rsi_period': 54, 'ema1': 25, 'ema2': 31, 'slip_atr_k': 0.015177088258537166, 'slip_spread_k': 0.39422224187937105, 'spread_hl_frac': 0.011768353852850862, 'bb_std_mult': 1.886616301183559, 'rsi_os': 40, 'rsi_ob': 89, 'vol_spike': 0.10213248694665028, 'adx_thresh': 13.704885787458675, 'atr_min_pct': 0.0031155057156159504, 'atr_max_pct': 0.051204466604598764, 'tp_mult': 2.5488547264871286, 'tsl_mult': 0.562568534931349, 'strategy': 'mean_reversion', 'time_stop': 172, 'use_sma': False, 'use_atr': True, 'use_adx': False, 'use_ema': True, 'use_spike': True, 'rsi_required': True, 'edge_k': 0.2785912187047357, 'edge_cap': 0.5833342655465121, 'bull_strategy': 'breakout', 'bull_bb_std_mult': 0.9405320057129702, 'bull_rsi_os': 49, 'bull_rsi_ob': 50, 'bull_adx_thresh': 5.889025465703238, 'bull_atr_min_pct': 0.013514283649099746, 'bull_atr_max_pct': 0.09978717564091791, 'bull_tp_mult': 1.148167892253844, 'bull_tsl_mult': 0.18584331329654918, 'bull_time_stop': 104, 'bull_use_sma': True, 'bull_use_ema': False, 'bull_use_atr': False, 'bull_use_adx': True, 'bull_use_spike': True, 'bull_rsi_required': True, 'bear_strategy': 'breakout', 'bear_bb_std_mult': 3.5415617129689756, 'bear_rsi_os': 8, 'bear_rsi_ob': 70, 'bear_adx_thresh': 27.940780578479874, 'bear_atr_min_pct': 0.008734251302128637, 'bear_atr_max_pct': 0.09442516115620034, 'bear_tp_mult': 1.9125178283924675, 'bear_tsl_mult': 0.6310379134299028, 'bear_time_stop': 200, 'bear_use_sma': False, 'bear_use_ema': False, 'bear_use_atr': False, 'bear_use_adx': False, 'bear_use_spike': True, 'bear_rsi_required': False, 'sideways_strategy': 'breakout', 'sideways_bb_std_mult': 0.6503128855848125, 'sideways_rsi_os': 27, 'sideways_rsi_ob': 51, 'sideways_adx_thresh': 24.677204122905863, 'sideways_atr_min_pct': 0.0059034191212689845, 'sideways_atr_max_pct': 0.10192834733650993, 'sideways_tp_mult': 1.6884718270054264, 'sideways_tsl_mult': 0.45016802150128116, 'sideways_time_stop': 175, 'sideways_use_sma': False, 'sideways_use_ema': True, 'sideways_use_atr': True, 'sideways_use_adx': False, 'sideways_use_spike': True, 'sideways_rsi_required': True}.
[I 2025-09-01 05:27:59,717] Trial 492 finished with values: [-1000000000.0, 1000000000.0] and parameters: {'p_sma': 55, 'p_std': 30, 'p_atr': 7, 'p_adx': 18, 'rsi_period': 51, 'ema1': 25, 'ema2': 20, 'slip_atr_k': 0.014968844326505635, 'slip_spread_k': 0.3895008334343172, 'spread_hl_frac': 0.046638098584810515, 'bb_std_mult': 2.0491841932809414, 'rsi_os': 10, 'rsi_ob': 48, 'vol_spike': 0.21177884279963533, 'adx_thresh': 13.744008537202198, 'atr_min_pct': 0.002994189855383778, 'atr_max_pct': 0.11956164910352607, 'tp_mult': 1.505255455265305, 'tsl_mult': 0.3292361746962625, 'strategy': 'breakout', 'time_stop': 203, 'use_sma': False, 'use_atr': True, 'use_adx': False, 'use_ema': False, 'use_spike': True, 'rsi_required': False, 'edge_k': 0.30982924925712774, 'edge_cap': 0.5522189261603524, 'bull_strategy': 'breakout', 'bull_bb_std_mult': 1.082614938717336, 'bull_rsi_os': 50, 'bull_rsi_ob': 79, 'bull_adx_thresh': 6.189331975028379, 'bull_atr_min_pct': 0.0148199954418758, 'bull_atr_max_pct': 0.10362412731911533, 'bull_tp_mult': 1.2613962854196643, 'bull_tsl_mult': 0.26893545001655333, 'bull_time_stop': 77, 'bull_use_sma': False, 'bull_use_ema': True, 'bull_use_atr': False, 'bull_use_adx': True, 'bull_use_spike': True, 'bull_rsi_required': True, 'bear_strategy': 'breakout', 'bear_bb_std_mult': 3.5975035407387566, 'bear_rsi_os': 40, 'bear_rsi_ob': 68, 'bear_adx_thresh': 9.614290687289296, 'bear_atr_min_pct': 0.008717925801984787, 'bear_atr_max_pct': 0.013831338809964386, 'bear_tp_mult': 1.3843393515123337, 'bear_tsl_mult': 0.2620395700324464, 'bear_time_stop': 27, 'bear_use_sma': True, 'bear_use_ema': False, 'bear_use_atr': False, 'bear_use_adx': False, 'bear_use_spike': True, 'bear_rsi_required': False, 'sideways_strategy': 'breakout', 'sideways_bb_std_mult': 0.6498751042576086, 'sideways_rsi_os': 43, 'sideways_rsi_ob': 93, 'sideways_adx_thresh': 23.089129521012723, 'sideways_atr_min_pct': 0.005971417016563368, 'sideways_atr_max_pct': 0.0399404091133808, 'sideways_tp_mult': 1.5727960023243548, 'sideways_tsl_mult': 0.9716456627993596, 'sideways_time_stop': 114, 'sideways_use_sma': False, 'sideways_use_ema': True, 'sideways_use_atr': True, 'sideways_use_adx': True, 'sideways_use_spike': True, 'sideways_rsi_required': True}.
[I 2025-09-01 05:27:59,909] Trial 493 finished with values: [-1000000000.0, 1000000000.0] and parameters: {'p_sma': 55, 'p_std': 35, 'p_atr': 7, 'p_adx': 18, 'rsi_period': 51, 'ema1': 24, 'ema2': 19, 'slip_atr_k': 0.013575335930523891, 'slip_spread_k': 0.37056219317658895, 'spread_hl_frac': 0.019104505353649638, 'bb_std_mult': 1.9774761208538123, 'rsi_os': 7, 'rsi_ob': 61, 'vol_spike': 0.21078879000942616, 'adx_thresh': 13.981146472912467, 'atr_min_pct': 0.0030357236817353285, 'atr_max_pct': 0.05141156002932335, 'tp_mult': 2.5289219972040913, 'tsl_mult': 0.32729019522689473, 'strategy': 'breakout', 'time_stop': 173, 'use_sma': False, 'use_atr': True, 'use_adx': False, 'use_ema': False, 'use_spike': False, 'rsi_required': True, 'edge_k': 0.2879961554257259, 'edge_cap': 0.7776700766920878, 'bull_strategy': 'breakout', 'bull_bb_std_mult': 1.0865860597044397, 'bull_rsi_os': 50, 'bull_rsi_ob': 62, 'bull_adx_thresh': 7.505047745695159, 'bull_atr_min_pct': 0.011268395561731284, 'bull_atr_max_pct': 0.10457140918350662, 'bull_tp_mult': 1.278866348967092, 'bull_tsl_mult': 0.23889123189830302, 'bull_time_stop': 76, 'bull_use_sma': False, 'bull_use_ema': True, 'bull_use_atr': False, 'bull_use_adx': True, 'bull_use_spike': True, 'bull_rsi_required': True, 'bear_strategy': 'breakout', 'bear_bb_std_mult': 3.598690015570853, 'bear_rsi_os': 8, 'bear_rsi_ob': 67, 'bear_adx_thresh': 5.705763935642599, 'bear_atr_min_pct': 0.008762881172184753, 'bear_atr_max_pct': 0.04653344436803605, 'bear_tp_mult': 1.4056614777753267, 'bear_tsl_mult': 0.3446777804008651, 'bear_time_stop': 26, 'bear_use_sma': True, 'bear_use_ema': True, 'bear_use_atr': False, 'bear_use_adx': False, 'bear_use_spike': True, 'bear_rsi_required': False, 'sideways_strategy': 'breakout', 'sideways_bb_std_mult': 0.6571831118734486, 'sideways_rsi_os': 15, 'sideways_rsi_ob': 53, 'sideways_adx_thresh': 23.155446116156284, 'sideways_atr_min_pct': 0.005999489009214112, 'sideways_atr_max_pct': 0.039216678890351776, 'sideways_tp_mult': 1.5664221764123631, 'sideways_tsl_mult': 0.4570358545237365, 'sideways_time_stop': 175, 'sideways_use_sma': False, 'sideways_use_ema': True, 'sideways_use_atr': True, 'sideways_use_adx': True, 'sideways_use_spike': True, 'sideways_rsi_required': True}.
[I 2025-09-01 05:28:48,133] Trial 496 finished with values: [-0.043724627048599585, 0.04361226424353468] and parameters: {'p_sma': 60, 'p_std': 34, 'p_atr': 7, 'p_adx': 17, 'rsi_period': 52, 'ema1': 24, 'ema2': 31, 'slip_atr_k': 0.13230355030614926, 'slip_spread_k': 0.41792970487008, 'spread_hl_frac': 0.04873236633593198, 'bb_std_mult': 2.1172945219310866, 'rsi_os': 25, 'rsi_ob': 73, 'vol_spike': 0.19850421905183963, 'adx_thresh': 10.713557894583806, 'atr_min_pct': 0.004423703610129785, 'atr_max_pct': 0.09223573356620703, 'tp_mult': 2.7498412173130116, 'tsl_mult': 0.11118022442589232, 'strategy': 'breakout', 'time_stop': 187, 'use_sma': False, 'use_atr': True, 'use_adx': True, 'use_ema': True, 'use_spike': False, 'rsi_required': False, 'edge_k': 0.2353426798205376, 'edge_cap': 0.8794755847696417, 'bull_strategy': 'breakout', 'bull_bb_std_mult': 1.016812106766307, 'bull_rsi_os': 48, 'bull_rsi_ob': 88, 'bull_adx_thresh': 5.000897492508059, 'bull_atr_min_pct': 0.01300344769228876, 'bull_atr_max_pct': 0.11126808367000073, 'bull_tp_mult': 1.3010816060891348, 'bull_tsl_mult': 0.20777330036988484, 'bull_time_stop': 89, 'bull_use_sma': True, 'bull_use_ema': False, 'bull_use_atr': False, 'bull_use_adx': True, 'bull_use_spike': False, 'bull_rsi_required': True, 'bear_strategy': 'breakout', 'bear_bb_std_mult': 3.5291071436904544, 'bear_rsi_os': 9, 'bear_rsi_ob': 72, 'bear_adx_thresh': 28.811407116707542, 'bear_atr_min_pct': 0.006684933355907016, 'bear_atr_max_pct': 0.11779601998773595, 'bear_tp_mult': 2.2627687347109635, 'bear_tsl_mult': 0.4040594807727979, 'bear_time_stop': 204, 'bear_use_sma': True, 'bear_use_ema': True, 'bear_use_atr': False, 'bear_use_adx': False, 'bear_use_spike': False, 'bear_rsi_required': True, 'sideways_strategy': 'breakout', 'sideways_bb_std_mult': 0.5926199655060547, 'sideways_rsi_os': 44, 'sideways_rsi_ob': 55, 'sideways_adx_thresh': 22.68897955877844, 'sideways_atr_min_pct': 0.0032335157669597424, 'sideways_atr_max_pct': 0.10559477379494661, 'sideways_tp_mult': 1.4846408631518075, 'sideways_tsl_mult': 0.9793593378072749, 'sideways_time_stop': 76, 'sideways_use_sma': False, 'sideways_use_ema': False, 'sideways_use_atr': True, 'sideways_use_adx': False, 'sideways_use_spike': True, 'sideways_rsi_required': True}.
