[I 2025-09-01 05:23:32,003] Trial 467 finished with values: [-0.013737784334830083, 0.013585525716412184] and parameters: {'p_sma': 57, 'p_std': 30, 'p_atr': 7, 'p_adx': 16, 'rsi_period': 50, 'ema1': 25, 'ema2': 32, 'slip_atr_k': 0.02695255726949354, 'slip_spread_k': 0.37856140168407115, 'spread_hl_frac': 0.04815119936023849, 'bb_std_mult': 1.9301505046098955, 'rsi_os': 26, 'rsi_ob': 89, 'vol_spike': 0.20521950752918403, 'adx_thresh': 13.024533208093215, 'atr_min_pct': 0.0033614920354039803, 'atr_max_pct': 0.12474565910068582, 'tp_mult': 1.5203489409861215, 'tsl_mult': 0.9295878688184482, 'strategy': 'breakout', 'time_stop': 189, 'use_sma': False, 'use_atr': True, 'use_adx': False, 'use_ema': False, 'use_spike': False, 'rsi_required': True, 'edge_k': 0.24872807050481915, 'edge_cap': 0.5639239820399012, 'bull_strategy': 'breakout', 'bull_bb_std_mult': 0.8807897950824851, 'bull_rsi_os': 49, 'bull_rsi_ob': 90, 'bull_adx_thresh': 6.562896910999334, 'bull_atr_min_pct': 0.013080042181671093, 'bull_atr_max_pct': 0.10836785338816123, 'bull_tp_mult': 1.243987605404109, 'bull_tsl_mult': 0.23499167359042636, 'bull_time_stop': 82, 'bull_use_sma': True, 'bull_use_ema': True, 'bull_use_atr': False, 'bull_use_adx': True, 'bull_use_spike': False, 'bull_rsi_required': True, 'bear_strategy': 'breakout', 'bear_bb_std_mult': 3.5344069508002365, 'bear_rsi_os': 8, 'bear_rsi_ob': 70, 'bear_adx_thresh': 29.252003809482662, 'bear_atr_min_pct': 0.006939108259504104, 'bear_atr_max_pct': 0.06912918006647292, 'bear_tp_mult': 1.2767700692982829, 'bear_tsl_mult': 0.6676523912183051, 'bear_time_stop': 99, 'bear_use_sma': True, 'bear_use_ema': False, 'bear_use_atr': False, 'bear_use_adx': False, 'bear_use_spike': False, 'bear_rsi_required': False, 'sideways_strategy': 'breakout', 'sideways_bb_std_mult': 0.5522052482198763, 'sideways_rsi_os': 46, 'sideways_rsi_ob': 53, 'sideways_adx_thresh': 23.926103429095, 'sideways_atr_min_pct': 0.004659733919263974, 'sideways_atr_max_pct': 0.09961514270535375, 'sideways_tp_mult': 1.5355777310791257, 'sideways_tsl_mult': 0.9981637771444656, 'sideways_time_stop': 149, 'sideways_use_sma': False, 'sideways_use_ema': True, 'sideways_use_atr': True, 'sideways_use_adx': False, 'sideways_use_spike': True, 'sideways_rsi_required': True}.
[I 2025-09-01 05:23:32,455] Trial 466 finished with values: [-0.015169150236533646, 0.015322062466998104] and parameters: {'p_sma': 58, 'p_std': 31, 'p_atr': 7, 'p_adx': 16, 'rsi_period': 51, 'ema1': 24, 'ema2': 32, 'slip_atr_k': 0.02610924416592166, 'slip_spread_k': 0.43496323265587306, 'spread_hl_frac': 0.04800102231562788, 'bb_std_mult': 1.949450852316499, 'rsi_os': 26, 'rsi_ob': 90, 'vol_spike': 0.20707371930440377, 'adx_thresh': 13.017613522098378, 'atr_min_pct': 0.0033555023994051598, 'atr_max_pct': 0.12290992423939814, 'tp_mult': 2.4548870467693544, 'tsl_mult': 0.8880342224111649, 'strategy': 'breakout', 'time_stop': 174, 'use_sma': False, 'use_atr': True, 'use_adx': False, 'use_ema': False, 'use_spike': False, 'rsi_required': True, 'edge_k': 0.20355350029612884, 'edge_cap': 0.5637902841233395, 'bull_strategy': 'breakout', 'bull_bb_std_mult': 0.861808205138996, 'bull_rsi_os': 50, 'bull_rsi_ob': 59, 'bull_adx_thresh': 6.243237737848121, 'bull_atr_min_pct': 0.01388851210598999, 'bull_atr_max_pct': 0.10198460520429162, 'bull_tp_mult': 1.252540408457596, 'bull_tsl_mult': 0.22343198938170925, 'bull_time_stop': 82, 'bull_use_sma': True, 'bull_use_ema': True, 'bull_use_atr': False, 'bull_use_adx': True, 'bull_use_spike': True, 'bull_rsi_required': True, 'bear_strategy': 'breakout', 'bear_bb_std_mult': 3.535173916403082, 'bear_rsi_os': 7, 'bear_rsi_ob': 69, 'bear_adx_thresh': 29.096816601330776, 'bear_atr_min_pct': 0.007106792472528057, 'bear_atr_max_pct': 0.06909688027832024, 'bear_tp_mult': 1.2545810919699145, 'bear_tsl_mult': 0.6646818904672225, 'bear_time_stop': 196, 'bear_use_sma': False, 'bear_use_ema': False, 'bear_use_atr': False, 'bear_use_adx': False, 'bear_use_spike': True, 'bear_rsi_required': False, 'sideways_strategy': 'breakout', 'sideways_bb_std_mult': 0.5012140033636059, 'sideways_rsi_os': 45, 'sideways_rsi_ob': 52, 'sideways_adx_thresh': 23.997315576425216, 'sideways_atr_min_pct': 0.004519515204768476, 'sideways_atr_max_pct': 0.10002697528461524, 'sideways_tp_mult': 1.5293966895239794, 'sideways_tsl_mult': 0.9968419927680368, 'sideways_time_stop': 163, 'sideways_use_sma': False, 'sideways_use_ema': True, 'sideways_use_atr': True, 'sideways_use_adx': False, 'sideways_use_spike': True, 'sideways_rsi_required': True}.
[I 2025-09-01 05:24:12,460] Trial 472 finished with values: [-1000000000.0, 1000000000.0] and parameters: {'p_sma': 58, 'p_std': 34, 'p_atr': 7, 'p_adx': 17, 'rsi_period': 55, 'ema1': 24, 'ema2': 32, 'slip_atr_k': 0.018772658611744084, 'slip_spread_k': 0.42022630522584037, 'spread_hl_frac': 0.04770583739242094, 'bb_std_mult': 1.9944733715735599, 'rsi_os': 27, 'rsi_ob': 90, 'vol_spike': 0.2070618621538886, 'adx_thresh': 13.320468768985975, 'atr_min_pct': 0.004616957165633368, 'atr_max_pct': 0.1229036026898712, 'tp_mult': 2.508427427873788, 'tsl_mult': 0.3892129848226955, 'strategy': 'breakout', 'time_stop': 175, 'use_sma': False, 'use_atr': True, 'use_adx': False, 'use_ema': True, 'use_spike': True, 'rsi_required': True, 'edge_k': 0.2631542393162202, 'edge_cap': 0.5720565461600493, 'bull_strategy': 'breakout', 'bull_bb_std_mult': 1.0183991035405446, 'bull_rsi_os': 49, 'bull_rsi_ob': 60, 'bull_adx_thresh': 5.038310186917245, 'bull_atr_min_pct': 0.014094959399730694, 'bull_atr_max_pct': 0.10162090372971275, 'bull_tp_mult': 1.2362104037798425, 'bull_tsl_mult': 0.16436328053750943, 'bull_time_stop': 84, 'bull_use_sma': True, 'bull_use_ema': False, 'bull_use_atr': False, 'bull_use_adx': True, 'bull_use_spike': False, 'bull_rsi_required': True, 'bear_strategy': 'breakout', 'bear_bb_std_mult': 3.4198640995615612, 'bear_rsi_os': 7, 'bear_rsi_ob': 69, 'bear_adx_thresh': 19.525046317792405, 'bear_atr_min_pct': 0.008699212060439327, 'bear_atr_max_pct': 0.07698520510036252, 'bear_tp_mult': 1.361805702691564, 'bear_tsl_mult': 0.6335165993326541, 'bear_time_stop': 199, 'bear_use_sma': False, 'bear_use_ema': False, 'bear_use_atr': False, 'bear_use_adx': False, 'bear_use_spike': False, 'bear_rsi_required': False, 'sideways_strategy': 'breakout', 'sideways_bb_std_mult': 0.6368546660324848, 'sideways_rsi_os': 45, 'sideways_rsi_ob': 51, 'sideways_adx_thresh': 23.10162989073683, 'sideways_atr_min_pct': 0.004695289165615885, 'sideways_atr_max_pct': 0.10350250596146739, 'sideways_tp_mult': 1.5860104762485272, 'sideways_tsl_mult': 0.9843117351359617, 'sideways_time_stop': 174, 'sideways_use_sma': False, 'sideways_use_ema': True, 'sideways_use_atr': True, 'sideways_use_adx': False, 'sideways_use_spike': True, 'sideways_rsi_required': True}.
[I 2025-09-01 05:24:13,808] Trial 473 finished with values: [-1000000000.0, 1000000000.0] and parameters: {'p_sma': 58, 'p_std': 34, 'p_atr': 8, 'p_adx': 17, 'rsi_period': 55, 'ema1': 24, 'ema2': 32, 'slip_atr_k': 0.01714961453096786, 'slip_spread_k': 0.37742766226298513, 'spread_hl_frac': 0.04791205000389324, 'bb_std_mult': 2.0187078081995624, 'rsi_os': 26, 'rsi_ob': 89, 'vol_spike': 0.2067160998563124, 'adx_thresh': 12.99139162314889, 'atr_min_pct': 0.004744209684629433, 'atr_max_pct': 0.12082214841076465, 'tp_mult': 2.213124162805944, 'tsl_mult': 0.8927512269811094, 'strategy': 'mean_reversion', 'time_stop': 178, 'use_sma': False, 'use_atr': True, 'use_adx': False, 'use_ema': True, 'use_spike': True, 'rsi_required': True, 'edge_k': 0.2673795051479071, 'edge_cap': 0.5112855701103616, 'bull_strategy': 'breakout', 'bull_bb_std_mult': 1.0098948078611718, 'bull_rsi_os': 48, 'bull_rsi_ob': 60, 'bull_adx_thresh': 5.084905427712348, 'bull_atr_min_pct': 0.01397168116432828, 'bull_atr_max_pct': 0.10709103017654921, 'bull_tp_mult': 1.237278174178973, 'bull_tsl_mult': 0.24072961537224621, 'bull_time_stop': 84, 'bull_use_sma': True, 'bull_use_ema': False, 'bull_use_atr': False, 'bull_use_adx': True, 'bull_use_spike': False, 'bull_rsi_required': True, 'bear_strategy': 'breakout', 'bear_bb_std_mult': 3.517347520801705, 'bear_rsi_os': 7, 'bear_rsi_ob': 69, 'bear_adx_thresh': 28.904869957045552, 'bear_atr_min_pct': 0.007271729249361284, 'bear_atr_max_pct': 0.06887220239447941, 'bear_tp_mult': 1.3752468823383162, 'bear_tsl_mult': 0.6339336196519579, 'bear_time_stop': 197, 'bear_use_sma': True, 'bear_use_ema': False, 'bear_use_atr': False, 'bear_use_adx': False, 'bear_use_spike': False, 'bear_rsi_required': False, 'sideways_strategy': 'breakout', 'sideways_bb_std_mult': 0.6635231516504493, 'sideways_rsi_os': 46, 'sideways_rsi_ob': 54, 'sideways_adx_thresh': 22.858053084350246, 'sideways_atr_min_pct': 0.004849541739859096, 'sideways_atr_max_pct': 0.10422740352788751, 'sideways_tp_mult': 1.572886371956344, 'sideways_tsl_mult': 0.9833307270340638, 'sideways_time_stop': 147, 'sideways_use_sma': False, 'sideways_use_ema': True, 'sideways_use_atr': True, 'sideways_use_adx': False, 'sideways_use_spike': True, 'sideways_rsi_required': True}.
[I 2025-09-01 05:24:14,283] Trial 471 finished with values: [-1000000000.0, 1000000000.0] and parameters: {'p_sma': 58, 'p_std': 34, 'p_atr': 8, 'p_adx': 17, 'rsi_period': 55, 'ema1': 24, 'ema2': 32, 'slip_atr_k': 0.018982104707069486, 'slip_spread_k': 0.37809652821528716, 'spread_hl_frac': 0.04795193161578577, 'bb_std_mult': 2.211302813012196, 'rsi_os': 27, 'rsi_ob': 88, 'vol_spike': 0.20594299832959437, 'adx_thresh': 12.919109992067732, 'atr_min_pct': 0.004760785482452559, 'atr_max_pct': 0.12150108534087949, 'tp_mult': 2.209789289123978, 'tsl_mult': 0.9253992380791296, 'strategy': 'breakout', 'time_stop': 179, 'use_sma': False, 'use_atr': True, 'use_adx': False, 'use_ema': True, 'use_spike': True, 'rsi_required': True, 'edge_k': 0.2723727067713827, 'edge_cap': 0.5201605923163896, 'bull_strategy': 'breakout', 'bull_bb_std_mult': 1.009008843308944, 'bull_rsi_os': 49, 'bull_rsi_ob': 68, 'bull_adx_thresh': 6.061412267947966, 'bull_atr_min_pct': 0.013910008242934545, 'bull_atr_max_pct': 0.1075912929019486, 'bull_tp_mult': 1.242568763822227, 'bull_tsl_mult': 0.16782008263507203, 'bull_time_stop': 81, 'bull_use_sma': True, 'bull_use_ema': False, 'bull_use_atr': False, 'bull_use_adx': True, 'bull_use_spike': False, 'bull_rsi_required': True, 'bear_strategy': 'breakout', 'bear_bb_std_mult': 3.5270713672750853, 'bear_rsi_os': 7, 'bear_rsi_ob': 69, 'bear_adx_thresh': 21.82755295982969, 'bear_atr_min_pct': 0.008844960057588539, 'bear_atr_max_pct': 0.06889111353316255, 'bear_tp_mult': 1.3643958946368562, 'bear_tsl_mult': 0.6318078344384879, 'bear_time_stop': 198, 'bear_use_sma': False, 'bear_use_ema': False, 'bear_use_atr': False, 'bear_use_adx': False, 'bear_use_spike': False, 'bear_rsi_required': False, 'sideways_strategy': 'breakout', 'sideways_bb_std_mult': 0.618871722179493, 'sideways_rsi_os': 46, 'sideways_rsi_ob': 52, 'sideways_adx_thresh': 22.486436575514325, 'sideways_atr_min_pct': 0.004554103036936769, 'sideways_atr_max_pct': 0.10518008828340666, 'sideways_tp_mult': 1.5773698175693656, 'sideways_tsl_mult': 0.9963313849346108, 'sideways_time_stop': 173, 'sideways_use_sma': False, 'sideways_use_ema': True, 'sideways_use_atr': True, 'sideways_use_adx': False, 'sideways_use_spike': True, 'sideways_rsi_required': True}.
[I 2025-09-01 05:24:14,294] Trial 470 finished with values: [-1000000000.0, 1000000000.0] and parameters: {'p_sma': 58, 'p_std': 31, 'p_atr': 8, 'p_adx': 17, 'rsi_period': 55, 'ema1': 24, 'ema2': 33, 'slip_atr_k': 0.016728185601856307, 'slip_spread_k': 0.4220339809970413, 'spread_hl_frac': 0.04775537027506839, 'bb_std_mult': 2.0115393027389743, 'rsi_os': 27, 'rsi_ob': 88, 'vol_spike': 0.2085828816446425, 'adx_thresh': 12.880208054253277, 'atr_min_pct': 0.004879746140233997, 'atr_max_pct': 0.12879697945411323, 'tp_mult': 2.509538930518451, 'tsl_mult': 0.3810602812197697, 'strategy': 'breakout', 'time_stop': 177, 'use_sma': False, 'use_atr': True, 'use_adx': False, 'use_ema': True, 'use_spike': True, 'rsi_required': True, 'edge_k': 0.2367350630865159, 'edge_cap': 0.5165066219216622, 'bull_strategy': 'breakout', 'bull_bb_std_mult': 1.0043919883254766, 'bull_rsi_os': 49, 'bull_rsi_ob': 88, 'bull_adx_thresh': 5.169755836197609, 'bull_atr_min_pct': 0.014045698314594573, 'bull_atr_max_pct': 0.10224195166805572, 'bull_tp_mult': 1.1774352631504716, 'bull_tsl_mult': 0.2446082511280066, 'bull_time_stop': 83, 'bull_use_sma': True, 'bull_use_ema': False, 'bull_use_atr': False, 'bull_use_adx': True, 'bull_use_spike': False, 'bull_rsi_required': True, 'bear_strategy': 'breakout', 'bear_bb_std_mult': 3.5347058015772883, 'bear_rsi_os': 7, 'bear_rsi_ob': 69, 'bear_adx_thresh': 6.972806825829181, 'bear_atr_min_pct': 0.007263240478060056, 'bear_atr_max_pct': 0.07676728674292331, 'bear_tp_mult': 1.3744062211366574, 'bear_tsl_mult': 0.632732870521843, 'bear_time_stop': 198, 'bear_use_sma': False, 'bear_use_ema': False, 'bear_use_atr': False, 'bear_use_adx': False, 'bear_use_spike': False, 'bear_rsi_required': False, 'sideways_strategy': 'breakout', 'sideways_bb_std_mult': 0.6191637901005697, 'sideways_rsi_os': 45, 'sideways_rsi_ob': 52, 'sideways_adx_thresh': 23.23569705480541, 'sideways_atr_min_pct': 0.004835514205412308, 'sideways_atr_max_pct': 0.10393110995933426, 'sideways_tp_mult': 1.5730033052395542, 'sideways_tsl_mult': 0.9970539220100524, 'sideways_time_stop': 172, 'sideways_use_sma': False, 'sideways_use_ema': True, 'sideways_use_atr': True, 'sideways_use_adx': False, 'sideways_use_spike': True, 'sideways_rsi_required': True}.
[I 2025-09-01 05:24:55,090] Trial 476 finished with values: [-1000000000.0, 1000000000.0] and parameters: {'p_sma': 59, 'p_std': 31, 'p_atr': 7, 'p_adx': 18, 'rsi_period': 53, 'ema1': 25, 'ema2': 32, 'slip_atr_k': 0.03429229973502458, 'slip_spread_k': 0.37870486062644765, 'spread_hl_frac': 0.04860755757504326, 'bb_std_mult': 2.0834135800599474, 'rsi_os': 25, 'rsi_ob': 88, 'vol_spike': 0.2024628525091456, 'adx_thresh': 13.125239942588765, 'atr_min_pct': 0.003155519429488699, 'atr_max_pct': 0.12199189073819297, 'tp_mult': 2.468900107450184, 'tsl_mult': 0.9304749242491435, 'strategy': 'mean_reversion', 'time_stop': 190, 'use_sma': False, 'use_atr': True, 'use_adx': True, 'use_ema': False, 'use_spike': True, 'rsi_required': False, 'edge_k': 0.3312969360405847, 'edge_cap': 0.5594325699094255, 'bull_strategy': 'breakout', 'bull_bb_std_mult': 0.7651858945232024, 'bull_rsi_os': 51, 'bull_rsi_ob': 89, 'bull_adx_thresh': 7.020622856596745, 'bull_atr_min_pct': 0.01293682304340377, 'bull_atr_max_pct': 0.09999544966809806, 'bull_tp_mult': 1.298715772925786, 'bull_tsl_mult': 0.20220499774618148, 'bull_time_stop': 90, 'bull_use_sma': True, 'bull_use_ema': True, 'bull_use_atr': False, 'bull_use_adx': True, 'bull_use_spike': True, 'bull_rsi_required': True, 'bear_strategy': 'breakout', 'bear_bb_std_mult': 3.580559756384587, 'bear_rsi_os': 8, 'bear_rsi_ob': 67, 'bear_adx_thresh': 30.253493440085222, 'bear_atr_min_pct': 0.006917048455364932, 'bear_atr_max_pct': 0.06796311451547705, 'bear_tp_mult': 1.2598770686664842, 'bear_tsl_mult': 0.6706093158744368, 'bear_time_stop': 50, 'bear_use_sma': True, 'bear_use_ema': True, 'bear_use_atr': False, 'bear_use_adx': False, 'bear_use_spike': True, 'bear_rsi_required': False, 'sideways_strategy': 'breakout', 'sideways_bb_std_mult': 0.516546524768879, 'sideways_rsi_os': 43, 'sideways_rsi_ob': 80, 'sideways_adx_thresh': 22.434347968913247, 'sideways_atr_min_pct': 0.005525299413479312, 'sideways_atr_max_pct': 0.09945347416383164, 'sideways_tp_mult': 1.644559547234536, 'sideways_tsl_mult': 0.9745823417394298, 'sideways_time_stop': 239, 'sideways_use_sma': False, 'sideways_use_ema': True, 'sideways_use_atr': True, 'sideways_use_adx': False, 'sideways_use_spike': True, 'sideways_rsi_required': True}.
[I 2025-09-01 05:24:55,469] Trial 474 finished with values: [-1000000000.0, 1000000000.0] and parameters: {'p_sma': 59, 'p_std': 31, 'p_atr': 8, 'p_adx': 18, 'rsi_period': 53, 'ema1': 24, 'ema2': 32, 'slip_atr_k': 0.017576490823041763, 'slip_spread_k': 0.3809041076007446, 'spread_hl_frac': 0.04775979539749707, 'bb_std_mult': 2.224172362373423, 'rsi_os': 25, 'rsi_ob': 88, 'vol_spike': 0.20732875712474502, 'adx_thresh': 12.948106101595135, 'atr_min_pct': 0.004732857073635388, 'atr_max_pct': 0.12050663828741423, 'tp_mult': 2.480047027974756, 'tsl_mult': 0.9342431874671718, 'strategy': 'mean_reversion', 'time_stop': 180, 'use_sma': False, 'use_atr': True, 'use_adx': False, 'use_ema': True, 'use_spike': True, 'rsi_required': True, 'edge_k': 0.25034771487533836, 'edge_cap': 0.5073448588304375, 'bull_strategy': 'breakout', 'bull_bb_std_mult': 0.7763579408879602, 'bull_rsi_os': 51, 'bull_rsi_ob': 53, 'bull_adx_thresh': 6.029283849236399, 'bull_atr_min_pct': 0.014126284191152704, 'bull_atr_max_pct': 0.09868762247651722, 'bull_tp_mult': 1.1842037744791238, 'bull_tsl_mult': 0.24382456831055677, 'bull_time_stop': 90, 'bull_use_sma': True, 'bull_use_ema': False, 'bull_use_atr': False, 'bull_use_adx': True, 'bull_use_spike': False, 'bull_rsi_required': True, 'bear_strategy': 'breakout', 'bear_bb_std_mult': 3.5342809502261003, 'bear_rsi_os': 5, 'bear_rsi_ob': 68, 'bear_adx_thresh': 10.522670807785044, 'bear_atr_min_pct': 0.0070677903047556235, 'bear_atr_max_pct': 0.06911533592807717, 'bear_tp_mult': 1.2610703685871616, 'bear_tsl_mult': 0.6454713064574402, 'bear_time_stop': 98, 'bear_use_sma': True, 'bear_use_ema': True, 'bear_use_atr': False, 'bear_use_adx': False, 'bear_use_spike': False, 'bear_rsi_required': False, 'sideways_strategy': 'breakout', 'sideways_bb_std_mult': 3.3159193987645406, 'sideways_rsi_os': 43, 'sideways_rsi_ob': 53, 'sideways_adx_thresh': 22.566768929227138, 'sideways_atr_min_pct': 0.004706695975403582, 'sideways_atr_max_pct': 0.04340704870010296, 'sideways_tp_mult': 1.6381717968923184, 'sideways_tsl_mult': 0.9983342925065398, 'sideways_time_stop': 148, 'sideways_use_sma': False, 'sideways_use_ema': True, 'sideways_use_atr': True, 'sideways_use_adx': False, 'sideways_use_spike': True, 'sideways_rsi_required': True}.
[I 2025-09-01 05:24:55,704] Trial 477 finished with values: [-1000000000.0, 1000000000.0] and parameters: {'p_sma': 59, 'p_std': 31, 'p_atr': 7, 'p_adx': 18, 'rsi_period': 52, 'ema1': 25, 'ema2': 32, 'slip_atr_k': 0.02597677700930647, 'slip_spread_k': 0.38105210592402566, 'spread_hl_frac': 0.024834898277323388, 'bb_std_mult': 2.1089561129116325, 'rsi_os': 25, 'rsi_ob': 88, 'vol_spike': 0.2015103261380145, 'adx_thresh': 11.46290160679774, 'atr_min_pct': 0.00332588729510043, 'atr_max_pct': 0.1218288961439788, 'tp_mult': 2.4731235576345725, 'tsl_mult': 0.25806907125766865, 'strategy': 'mean_reversion', 'time_stop': 191, 'use_sma': False, 'use_atr': True, 'use_adx': True, 'use_ema': False, 'use_spike': True, 'rsi_required': False, 'edge_k': 0.21030594556942628, 'edge_cap': 0.9078391149750755, 'bull_strategy': 'breakout', 'bull_bb_std_mult': 0.739202095221834, 'bull_rsi_os': 51, 'bull_rsi_ob': 90, 'bull_adx_thresh': 6.71162729238246, 'bull_atr_min_pct': 0.012917728819688251, 'bull_atr_max_pct': 0.10747660419679408, 'bull_tp_mult': 1.3283347213397694, 'bull_tsl_mult': 0.21688558517828666, 'bull_time_stop': 91, 'bull_use_sma': True, 'bull_use_ema': True, 'bull_use_atr': False, 'bull_use_adx': True, 'bull_use_spike': True, 'bull_rsi_required': True, 'bear_strategy': 'breakout', 'bear_bb_std_mult': 3.5855262113115733, 'bear_rsi_os': 5, 'bear_rsi_ob': 67, 'bear_adx_thresh': 28.983613911064236, 'bear_atr_min_pct': 0.006850813470410611, 'bear_atr_max_pct': 0.06725882035527626, 'bear_tp_mult': 1.266318755290462, 'bear_tsl_mult': 0.6587334192263423, 'bear_time_stop': 175, 'bear_use_sma': True, 'bear_use_ema': True, 'bear_use_atr': False, 'bear_use_adx': False, 'bear_use_spike': True, 'bear_rsi_required': False, 'sideways_strategy': 'breakout', 'sideways_bb_std_mult': 3.3231674777907836, 'sideways_rsi_os': 43, 'sideways_rsi_ob': 54, 'sideways_adx_thresh': 22.41622000975943, 'sideways_atr_min_pct': 0.0055722855222158935, 'sideways_atr_max_pct': 0.09953096739668611, 'sideways_tp_mult': 1.6308222823803298, 'sideways_tsl_mult': 0.7684623769762118, 'sideways_time_stop': 167, 'sideways_use_sma': False, 'sideways_use_ema': True, 'sideways_use_atr': True, 'sideways_use_adx': False, 'sideways_use_spike': True, 'sideways_rsi_required': True}.
