[I 2025-09-01 04:33:24,030] Trial 180 finished with values: [-1000000000.0, 1000000000.0] and parameters: {'p_sma': 19, 'p_std': 60, 'p_atr': 24, 'p_adx': 19, 'rsi_period': 64, 'ema1': 13, 'ema2': 23, 'slip_atr_k': 0.24756743106445966, 'slip_spread_k': 0.29345685310506137, 'spread_hl_frac': 0.042746260608800817, 'bb_std_mult': 2.5031440603597654, 'rsi_os': 47, 'rsi_ob': 79, 'vol_spike': 0.24829341205374, 'adx_thresh': 33.28580058558921, 'atr_min_pct': 0.001234641356133675, 'atr_max_pct': 0.0562229417337115, 'tp_mult': 2.6192668340505096, 'tsl_mult': 0.982265362683779, 'strategy': 'breakout', 'time_stop': 16, 'use_sma': True, 'use_atr': False, 'use_adx': False, 'use_ema': True, 'use_spike': True, 'rsi_required': False, 'edge_k': 0.5022456924010799, 'edge_cap': 0.11248917318809981, 'bull_strategy': 'mean_reversion', 'bull_bb_std_mult': 2.324875853864161, 'bull_rsi_os': 19, 'bull_rsi_ob': 89, 'bull_adx_thresh': 19.200293396116262, 'bull_atr_min_pct': 0.0296841128644858, 'bull_atr_max_pct': 0.014636635818395763, 'bull_tp_mult': 1.1931728448594203, 'bull_tsl_mult': 0.48738312832263475, 'bull_time_stop': 157, 'bull_use_sma': True, 'bull_use_ema': False, 'bull_use_atr': True, 'bull_use_adx': False, 'bull_use_spike': False, 'bull_rsi_required': False, 'bear_strategy': 'mean_reversion', 'bear_bb_std_mult': 2.318887407460692, 'bear_rsi_os': 38, 'bear_rsi_ob': 66, 'bear_adx_thresh': 13.612686663704556, 'bear_atr_min_pct': 0.029928052003348908, 'bear_atr_max_pct': 0.014938319440926925, 'bear_tp_mult': 1.0738206397370587, 'bear_tsl_mult': 0.05422852072088946, 'bear_time_stop': 279, 'bear_use_sma': True, 'bear_use_ema': False, 'bear_use_atr': True, 'bear_use_adx': True, 'bear_use_spike': False, 'bear_rsi_required': False, 'sideways_strategy': 'mean_reversion', 'sideways_bb_std_mult': 2.0191424403960907, 'sideways_rsi_os': 41, 'sideways_rsi_ob': 49, 'sideways_adx_thresh': 33.71796118202452, 'sideways_atr_min_pct': 0.02416364368508614, 'sideways_atr_max_pct': 0.09163232006110364, 'sideways_tp_mult': 1.5788608016854095, 'sideways_tsl_mult': 0.9185952443483967, 'sideways_time_stop': 209, 'sideways_use_sma': True, 'sideways_use_ema': True, 'sideways_use_atr': False, 'sideways_use_adx': False, 'sideways_use_spike': False, 'sideways_rsi_required': False}.
[I 2025-09-01 04:33:24,351] Trial 182 finished with values: [-1000000000.0, 1000000000.0] and parameters: {'p_sma': 43, 'p_std': 14, 'p_atr': 9, 'p_adx': 26, 'rsi_period': 65, 'ema1': 28, 'ema2': 57, 'slip_atr_k': 0.18743628156651457, 'slip_spread_k': 0.2992213421311338, 'spread_hl_frac': 0.03557473523601026, 'bb_std_mult': 1.0419903198502352, 'rsi_os': 47, 'rsi_ob': 55, 'vol_spike': 0.06230917301511214, 'adx_thresh': 14.710435696544009, 'atr_min_pct': 1.287473306533734e-05, 'atr_max_pct': 0.06890947633757945, 'tp_mult': 2.2011174184443316, 'tsl_mult': 0.8559956961573006, 'strategy': 'mean_reversion', 'time_stop': 16, 'use_sma': True, 'use_atr': False, 'use_adx': False, 'use_ema': True, 'use_spike': True, 'rsi_required': False, 'edge_k': 1.747264039920138, 'edge_cap': 0.20330902305140708, 'bull_strategy': 'breakout', 'bull_bb_std_mult': 2.1687878720171843, 'bull_rsi_os': 19, 'bull_rsi_ob': 89, 'bull_adx_thresh': 19.43312275605334, 'bull_atr_min_pct': 0.02968316651055327, 'bull_atr_max_pct': 0.1282989279862712, 'bull_tp_mult': 1.6045823648288013, 'bull_tsl_mult': 0.41743099817304113, 'bull_time_stop': 156, 'bull_use_sma': True, 'bull_use_ema': False, 'bull_use_atr': True, 'bull_use_adx': False, 'bull_use_spike': False, 'bull_rsi_required': False, 'bear_strategy': 'mean_reversion', 'bear_bb_std_mult': 2.2542319422198833, 'bear_rsi_os': 44, 'bear_rsi_ob': 93, 'bear_adx_thresh': 13.766274387762872, 'bear_atr_min_pct': 0.029966005244247397, 'bear_atr_max_pct': 0.14183138214540536, 'bear_tp_mult': 1.192581014514837, 'bear_tsl_mult': 0.05022279649701722, 'bear_time_stop': 8, 'bear_use_sma': True, 'bear_use_ema': True, 'bear_use_atr': True, 'bear_use_adx': True, 'bear_use_spike': False, 'bear_rsi_required': True, 'sideways_strategy': 'mean_reversion', 'sideways_bb_std_mult': 1.495306906142313, 'sideways_rsi_os': 9, 'sideways_rsi_ob': 46, 'sideways_adx_thresh': 14.933875358947375, 'sideways_atr_min_pct': 0.02111442460599961, 'sideways_atr_max_pct': 0.09270595437598086, 'sideways_tp_mult': 1.1141209387443596, 'sideways_tsl_mult': 0.9544192511508404, 'sideways_time_stop': 180, 'sideways_use_sma': True, 'sideways_use_ema': False, 'sideways_use_atr': False, 'sideways_use_adx': False, 'sideways_use_spike': False, 'sideways_rsi_required': False}.
[I 2025-09-01 04:33:24,662] Trial 179 finished with values: [-1000000000.0, 1000000000.0] and parameters: {'p_sma': 49, 'p_std': 6, 'p_atr': 25, 'p_adx': 19, 'rsi_period': 63, 'ema1': 15, 'ema2': 29, 'slip_atr_k': 0.24927850878800797, 'slip_spread_k': 0.3462985866539128, 'spread_hl_frac': 0.04326722170201341, 'bb_std_mult': 1.8816384454211854, 'rsi_os': 25, 'rsi_ob': 52, 'vol_spike': 0.22899485066910447, 'adx_thresh': 32.753081519478705, 'atr_min_pct': 3.591973459339136e-05, 'atr_max_pct': 0.12217223065838377, 'tp_mult': 2.0306859015492833, 'tsl_mult': 0.8588459730677821, 'strategy': 'mean_reversion', 'time_stop': 24, 'use_sma': True, 'use_atr': False, 'use_adx': False, 'use_ema': True, 'use_spike': True, 'rsi_required': False, 'edge_k': 1.7384329320130307, 'edge_cap': 0.10902699472326319, 'bull_strategy': 'mean_reversion', 'bull_bb_std_mult': 1.9228585716480495, 'bull_rsi_os': 10, 'bull_rsi_ob': 89, 'bull_adx_thresh': 19.156428346852106, 'bull_atr_min_pct': 8.090324318373249e-06, 'bull_atr_max_pct': 0.03824331886699698, 'bull_tp_mult': 1.2439118200899393, 'bull_tsl_mult': 0.39315727034009323, 'bull_time_stop': 160, 'bull_use_sma': True, 'bull_use_ema': True, 'bull_use_atr': False, 'bull_use_adx': False, 'bull_use_spike': False, 'bull_rsi_required': True, 'bear_strategy': 'mean_reversion', 'bear_bb_std_mult': 2.17729448557244, 'bear_rsi_os': 38, 'bear_rsi_ob': 84, 'bear_adx_thresh': 14.900330521504142, 'bear_atr_min_pct': 0.028731500013146494, 'bear_atr_max_pct': 0.139765208607864, 'bear_tp_mult': 1.1893723430304837, 'bear_tsl_mult': 0.8602086878970658, 'bear_time_stop': 198, 'bear_use_sma': True, 'bear_use_ema': False, 'bear_use_atr': True, 'bear_use_adx': True, 'bear_use_spike': False, 'bear_rsi_required': False, 'sideways_strategy': 'mean_reversion', 'sideways_bb_std_mult': 3.5715690329134464, 'sideways_rsi_os': 44, 'sideways_rsi_ob': 93, 'sideways_adx_thresh': 15.957103155645605, 'sideways_atr_min_pct': 0.020824929130293546, 'sideways_atr_max_pct': 0.0990382794971443, 'sideways_tp_mult': 2.836155374383079, 'sideways_tsl_mult': 0.3305531885051629, 'sideways_time_stop': 264, 'sideways_use_sma': True, 'sideways_use_ema': True, 'sideways_use_atr': False, 'sideways_use_adx': False, 'sideways_use_spike': False, 'sideways_rsi_required': False}.
[I 2025-09-01 04:34:06,352] Trial 186 finished with values: [-0.07604422225244689, 0.07579465576087999] and parameters: {'p_sma': 18, 'p_std': 44, 'p_atr': 26, 'p_adx': 30, 'rsi_period': 9, 'ema1': 29, 'ema2': 27, 'slip_atr_k': 0.000298121407597322, 'slip_spread_k': 0.3230326072855052, 'spread_hl_frac': 0.04002280557957362, 'bb_std_mult': 0.8478571931410802, 'rsi_os': 46, 'rsi_ob': 57, 'vol_spike': 0.12901303137743397, 'adx_thresh': 15.07843865528621, 'atr_min_pct': 0.029997784619202092, 'atr_max_pct': 0.0955659643024362, 'tp_mult': 1.065248913188357, 'tsl_mult': 0.938407757220518, 'strategy': 'breakout', 'time_stop': 39, 'use_sma': True, 'use_atr': True, 'use_adx': False, 'use_ema': True, 'use_spike': True, 'rsi_required': False, 'edge_k': 1.3922519308660595, 'edge_cap': 0.5057624484595532, 'bull_strategy': 'breakout', 'bull_bb_std_mult': 2.363562786449913, 'bull_rsi_os': 27, 'bull_rsi_ob': 87, 'bull_adx_thresh': 8.311766096644707, 'bull_atr_min_pct': 0.0014292540556410643, 'bull_atr_max_pct': 0.12501397930728317, 'bull_tp_mult': 1.5134948724215278, 'bull_tsl_mult': 0.38028016139193893, 'bull_time_stop': 219, 'bull_use_sma': True, 'bull_use_ema': False, 'bull_use_atr': True, 'bull_use_adx': False, 'bull_use_spike': False, 'bull_rsi_required': False, 'bear_strategy': 'mean_reversion', 'bear_bb_std_mult': 1.4006051723075097, 'bear_rsi_os': 48, 'bear_rsi_ob': 55, 'bear_adx_thresh': 5.015298003765828, 'bear_atr_min_pct': 0.0018940751090796883, 'bear_atr_max_pct': 0.05553126425596752, 'bear_tp_mult': 2.047587718781759, 'bear_tsl_mult': 0.9725206270429319, 'bear_time_stop': 74, 'bear_use_sma': False, 'bear_use_ema': False, 'bear_use_atr': True, 'bear_use_adx': True, 'bear_use_spike': False, 'bear_rsi_required': False, 'sideways_strategy': 'breakout', 'sideways_bb_std_mult': 0.9885789179625564, 'sideways_rsi_os': 49, 'sideways_rsi_ob': 87, 'sideways_adx_thresh': 5.003979874358238, 'sideways_atr_min_pct': 0.012074627199213317, 'sideways_atr_max_pct': 0.08703703453983025, 'sideways_tp_mult': 2.8836624713276153, 'sideways_tsl_mult': 0.3678708916526164, 'sideways_time_stop': 171, 'sideways_use_sma': False, 'sideways_use_ema': True, 'sideways_use_atr': False, 'sideways_use_adx': False, 'sideways_use_spike': False, 'sideways_rsi_required': False}.
[I 2025-09-01 04:34:07,442] Trial 185 finished with values: [-0.0412377517182968, 0.0410918259559118] and parameters: {'p_sma': 18, 'p_std': 11, 'p_atr': 26, 'p_adx': 29, 'rsi_period': 59, 'ema1': 30, 'ema2': 29, 'slip_atr_k': 0.00013062422895297727, 'slip_spread_k': 0.32543911325921604, 'spread_hl_frac': 0.039279411297625154, 'bb_std_mult': 0.8763631888225014, 'rsi_os': 11, 'rsi_ob': 72, 'vol_spike': 0.02375699169766443, 'adx_thresh': 28.967799554722482, 'atr_min_pct': 0.009927459109912298, 'atr_max_pct': 0.12179116462814472, 'tp_mult': 1.0953204819651055, 'tsl_mult': 0.22342707232094144, 'strategy': 'breakout', 'time_stop': 213, 'use_sma': True, 'use_atr': True, 'use_adx': False, 'use_ema': True, 'use_spike': True, 'rsi_required': False, 'edge_k': 0.587103216659771, 'edge_cap': 0.4876276063363126, 'bull_strategy': 'breakout', 'bull_bb_std_mult': 2.3677228187193937, 'bull_rsi_os': 8, 'bull_rsi_ob': 46, 'bull_adx_thresh': 17.219919953547567, 'bull_atr_min_pct': 0.001144529260451049, 'bull_atr_max_pct': 0.040087339195079216, 'bull_tp_mult': 1.4939763695222832, 'bull_tsl_mult': 0.38387180632826023, 'bull_time_stop': 222, 'bull_use_sma': True, 'bull_use_ema': False, 'bull_use_atr': True, 'bull_use_adx': False, 'bull_use_spike': False, 'bull_rsi_required': False, 'bear_strategy': 'mean_reversion', 'bear_bb_std_mult': 1.1651560128609675, 'bear_rsi_os': 48, 'bear_rsi_ob': 55, 'bear_adx_thresh': 14.902686656073485, 'bear_atr_min_pct': 0.028615412400587827, 'bear_atr_max_pct': 0.05643131718140112, 'bear_tp_mult': 1.0488310918793928, 'bear_tsl_mult': 0.9658930655171636, 'bear_time_stop': 83, 'bear_use_sma': False, 'bear_use_ema': False, 'bear_use_atr': True, 'bear_use_adx': True, 'bear_use_spike': False, 'bear_rsi_required': False, 'sideways_strategy': 'breakout', 'sideways_bb_std_mult': 0.6199877239871137, 'sideways_rsi_os': 6, 'sideways_rsi_ob': 85, 'sideways_adx_thresh': 34.32370365958517, 'sideways_atr_min_pct': 0.01689868741979706, 'sideways_atr_max_pct': 0.09528267959374066, 'sideways_tp_mult': 2.28827025183754, 'sideways_tsl_mult': 0.28870368518375966, 'sideways_time_stop': 173, 'sideways_use_sma': False, 'sideways_use_ema': True, 'sideways_use_atr': False, 'sideways_use_adx': False, 'sideways_use_spike': False, 'sideways_rsi_required': False}.
[I 2025-09-01 04:34:08,730] Trial 183 finished with values: [-0.018513052212309367, 0.018336107171235346] and parameters: {'p_sma': 49, 'p_std': 44, 'p_atr': 26, 'p_adx': 24, 'rsi_period': 59, 'ema1': 30, 'ema2': 29, 'slip_atr_k': 0.0026826277950574694, 'slip_spread_k': 0.32137345734287387, 'spread_hl_frac': 0.031321432715770925, 'bb_std_mult': 1.0352773232211692, 'rsi_os': 24, 'rsi_ob': 55, 'vol_spike': 0.044059751904251696, 'adx_thresh': 14.940098297564917, 'atr_min_pct': 0.011122028370576536, 'atr_max_pct': 0.11909715373948551, 'tp_mult': 1.0889423944308343, 'tsl_mult': 0.9350163085213101, 'strategy': 'breakout', 'time_stop': 250, 'use_sma': True, 'use_atr': True, 'use_adx': False, 'use_ema': True, 'use_spike': True, 'rsi_required': False, 'edge_k': 1.7619179464778185, 'edge_cap': 0.19911753403847307, 'bull_strategy': 'breakout', 'bull_bb_std_mult': 1.6712061423105564, 'bull_rsi_os': 8, 'bull_rsi_ob': 87, 'bull_adx_thresh': 17.314094882974842, 'bull_atr_min_pct': 0.0012344667737471018, 'bull_atr_max_pct': 0.1438487706385285, 'bull_tp_mult': 2.556682897895691, 'bull_tsl_mult': 0.4168105067251585, 'bull_time_stop': 226, 'bull_use_sma': True, 'bull_use_ema': False, 'bull_use_atr': True, 'bull_use_adx': False, 'bull_use_spike': False, 'bull_rsi_required': False, 'bear_strategy': 'mean_reversion', 'bear_bb_std_mult': 1.9183360740684008, 'bear_rsi_os': 44, 'bear_rsi_ob': 62, 'bear_adx_thresh': 13.791053288824745, 'bear_atr_min_pct': 0.028903589798844442, 'bear_atr_max_pct': 0.06051783380619666, 'bear_tp_mult': 1.8657002432944971, 'bear_tsl_mult': 0.09645472630933175, 'bear_time_stop': 196, 'bear_use_sma': False, 'bear_use_ema': True, 'bear_use_atr': True, 'bear_use_adx': True, 'bear_use_spike': False, 'bear_rsi_required': False, 'sideways_strategy': 'mean_reversion', 'sideways_bb_std_mult': 3.571136178888822, 'sideways_rsi_os': 9, 'sideways_rsi_ob': 85, 'sideways_adx_thresh': 23.183129863187126, 'sideways_atr_min_pct': 0.02110035297737555, 'sideways_atr_max_pct': 0.093129954351915, 'sideways_tp_mult': 2.903170799141072, 'sideways_tsl_mult': 0.37670733487830826, 'sideways_time_stop': 97, 'sideways_use_sma': True, 'sideways_use_ema': True, 'sideways_use_atr': False, 'sideways_use_adx': False, 'sideways_use_spike': False, 'sideways_rsi_required': False}.
[I 2025-09-01 04:34:08,732] Trial 184 finished with values: [-0.015522596198712768, 0.015343888630823426] and parameters: {'p_sma': 49, 'p_std': 44, 'p_atr': 26, 'p_adx': 29, 'rsi_period': 54, 'ema1': 30, 'ema2': 29, 'slip_atr_k': 0.00285692830748343, 'slip_spread_k': 0.5660932705178625, 'spread_hl_frac': 0.039030458211581694, 'bb_std_mult': 1.030259030470609, 'rsi_os': 10, 'rsi_ob': 55, 'vol_spike': 0.13252147379117576, 'adx_thresh': 14.795777379561393, 'atr_min_pct': 0.00843984817707139, 'atr_max_pct': 0.1207335561505167, 'tp_mult': 2.571375968041831, 'tsl_mult': 0.9394333367965847, 'strategy': 'breakout', 'time_stop': 251, 'use_sma': True, 'use_atr': True, 'use_adx': False, 'use_ema': True, 'use_spike': True, 'rsi_required': False, 'edge_k': 0.5755713589625308, 'edge_cap': 0.20046137731680863, 'bull_strategy': 'breakout', 'bull_bb_std_mult': 2.122534556280426, 'bull_rsi_os': 27, 'bull_rsi_ob': 50, 'bull_adx_thresh': 18.26747390278779, 'bull_atr_min_pct': 0.0013136536555386226, 'bull_atr_max_pct': 0.04190885651010988, 'bull_tp_mult': 1.5086371359018482, 'bull_tsl_mult': 0.414591107498239, 'bull_time_stop': 218, 'bull_use_sma': True, 'bull_use_ema': False, 'bull_use_atr': True, 'bull_use_adx': False, 'bull_use_spike': False, 'bull_rsi_required': False, 'bear_strategy': 'mean_reversion', 'bear_bb_std_mult': 1.164794100486052, 'bear_rsi_os': 44, 'bear_rsi_ob': 74, 'bear_adx_thresh': 14.749991207043333, 'bear_atr_min_pct': 0.028728611934842635, 'bear_atr_max_pct': 0.14460206801319733, 'bear_tp_mult': 2.025751834003338, 'bear_tsl_mult': 0.09620603304134467, 'bear_time_stop': 197, 'bear_use_sma': False, 'bear_use_ema': True, 'bear_use_atr': True, 'bear_use_adx': True, 'bear_use_spike': False, 'bear_rsi_required': False, 'sideways_strategy': 'mean_reversion', 'sideways_bb_std_mult': 0.882450860642314, 'sideways_rsi_os': 9, 'sideways_rsi_ob': 78, 'sideways_adx_thresh': 15.945710930854963, 'sideways_atr_min_pct': 0.020352232883504805, 'sideways_atr_max_pct': 0.09444899125735794, 'sideways_tp_mult': 1.08458766014123, 'sideways_tsl_mult': 0.9514562191831228, 'sideways_time_stop': 179, 'sideways_use_sma': True, 'sideways_use_ema': True, 'sideways_use_atr': False, 'sideways_use_adx': False, 'sideways_use_spike': False, 'sideways_rsi_required': False}.
[I 2025-09-01 04:34:49,841] Trial 189 finished with values: [-0.03719817913701606, 0.03702121555282026] and parameters: {'p_sma': 45, 'p_std': 40, 'p_atr': 11, 'p_adx': 21, 'rsi_period': 59, 'ema1': 9, 'ema2': 47, 'slip_atr_k': 0.0040156433768954985, 'slip_spread_k': 0.2461435628944793, 'spread_hl_frac': 0.040659753078776756, 'bb_std_mult': 1.1456127734952122, 'rsi_os': 47, 'rsi_ob': 57, 'vol_spike': 0.021263279513801053, 'adx_thresh': 15.90921854695948, 'atr_min_pct': 0.002074583087465478, 'atr_max_pct': 0.11875914313600741, 'tp_mult': 1.8566221111843748, 'tsl_mult': 0.895808346055603, 'strategy': 'breakout', 'time_stop': 9, 'use_sma': True, 'use_atr': True, 'use_adx': False, 'use_ema': True, 'use_spike': True, 'rsi_required': False, 'edge_k': 0.5947204380287807, 'edge_cap': 0.4083838778722376, 'bull_strategy': 'mean_reversion', 'bull_bb_std_mult': 2.464100321987401, 'bull_rsi_os': 8, 'bull_rsi_ob': 88, 'bull_adx_thresh': 17.390696126042293, 'bull_atr_min_pct': 0.0010512730403147326, 'bull_atr_max_pct': 0.1214962988937102, 'bull_tp_mult': 1.1320839361723647, 'bull_tsl_mult': 0.37105501173879474, 'bull_time_stop': 223, 'bull_use_sma': True, 'bull_use_ema': False, 'bull_use_atr': True, 'bull_use_adx': False, 'bull_use_spike': False, 'bull_rsi_required': False, 'bear_strategy': 'mean_reversion', 'bear_bb_std_mult': 1.018982405632572, 'bear_rsi_os': 46, 'bear_rsi_ob': 58, 'bear_adx_thresh': 28.27480050093926, 'bear_atr_min_pct': 0.028746573043726246, 'bear_atr_max_pct': 0.144954014990255, 'bear_tp_mult': 1.0324396840923395, 'bear_tsl_mult': 0.09937803649685781, 'bear_time_stop': 213, 'bear_use_sma': True, 'bear_use_ema': True, 'bear_use_atr': True, 'bear_use_adx': True, 'bear_use_spike': False, 'bear_rsi_required': False, 'sideways_strategy': 'mean_reversion', 'sideways_bb_std_mult': 0.6459661563274766, 'sideways_rsi_os': 6, 'sideways_rsi_ob': 77, 'sideways_adx_thresh': 17.117462968625652, 'sideways_atr_min_pct': 0.008825393716909387, 'sideways_atr_max_pct': 0.09432981734924152, 'sideways_tp_mult': 1.3986448817889954, 'sideways_tsl_mult': 0.9569247793995893, 'sideways_time_stop': 178, 'sideways_use_sma': True, 'sideways_use_ema': True, 'sideways_use_atr': False, 'sideways_use_adx': False, 'sideways_use_spike': True, 'sideways_rsi_required': False}.
[I 2025-09-01 04:34:50,278] Trial 188 finished with values: [-1000000000.0, 1000000000.0] and parameters: {'p_sma': 17, 'p_std': 39, 'p_atr': 11, 'p_adx': 21, 'rsi_period': 60, 'ema1': 30, 'ema2': 33, 'slip_atr_k': 0.0042964244895048465, 'slip_spread_k': 0.5665193140149193, 'spread_hl_frac': 0.039196443723382005, 'bb_std_mult': 1.0976834068138988, 'rsi_os': 12, 'rsi_ob': 55, 'vol_spike': 0.2536476481770425, 'adx_thresh': 15.981799494970469, 'atr_min_pct': 0.006348040378998972, 'atr_max_pct': 0.12033431086064443, 'tp_mult': 2.561353749456677, 'tsl_mult': 0.07021033360130158, 'strategy': 'breakout', 'time_stop': 212, 'use_sma': True, 'use_atr': True, 'use_adx': False, 'use_ema': True, 'use_spike': True, 'rsi_required': False, 'edge_k': 0.6006472386287537, 'edge_cap': 0.2924436611080385, 'bull_strategy': 'mean_reversion', 'bull_bb_std_mult': 2.2927989133340643, 'bull_rsi_os': 8, 'bull_rsi_ob': 88, 'bull_adx_thresh': 17.203139023012618, 'bull_atr_min_pct': 0.0029398857720520175, 'bull_atr_max_pct': 0.12144703340593618, 'bull_tp_mult': 2.566532783083677, 'bull_tsl_mult': 0.09829229922021421, 'bull_time_stop': 225, 'bull_use_sma': True, 'bull_use_ema': False, 'bull_use_atr': True, 'bull_use_adx': False, 'bull_use_spike': False, 'bull_rsi_required': False, 'bear_strategy': 'mean_reversion', 'bear_bb_std_mult': 1.150913419989596, 'bear_rsi_os': 50, 'bear_rsi_ob': 57, 'bear_adx_thresh': 13.586162593807497, 'bear_atr_min_pct': 0.028552142227139594, 'bear_atr_max_pct': 0.14565879618586713, 'bear_tp_mult': 1.0416286780382191, 'bear_tsl_mult': 0.10221667266982759, 'bear_time_stop': 214, 'bear_use_sma': True, 'bear_use_ema': True, 'bear_use_atr': True, 'bear_use_adx': True, 'bear_use_spike': False, 'bear_rsi_required': False, 'sideways_strategy': 'mean_reversion', 'sideways_bb_std_mult': 0.8880151301692418, 'sideways_rsi_os': 6, 'sideways_rsi_ob': 81, 'sideways_adx_thresh': 16.920540986997086, 'sideways_atr_min_pct': 0.008656651033457159, 'sideways_atr_max_pct': 0.09458618720652273, 'sideways_tp_mult': 1.411869655453481, 'sideways_tsl_mult': 0.2474378170562337, 'sideways_time_stop': 177, 'sideways_use_sma': False, 'sideways_use_ema': True, 'sideways_use_atr': False, 'sideways_use_adx': False, 'sideways_use_spike': True, 'sideways_rsi_required': False}.
