[I 2025-09-01 04:26:37,099] Trial 143 finished with values: [-1000000000.0, 1000000000.0] and parameters: {'p_sma': 7, 'p_std': 50, 'p_atr': 17, 'p_adx': 17, 'rsi_period': 43, 'ema1': 26, 'ema2': 28, 'slip_atr_k': 9.240102972121503e-05, 'slip_spread_k': 0.2930255590251561, 'spread_hl_frac': 0.03660406197262547, 'bb_std_mult': 0.5031333437833656, 'rsi_os': 47, 'rsi_ob': 57, 'vol_spike': 0.2909947069364953, 'adx_thresh': 15.779106373936031, 'atr_min_pct': 0.004543615931535081, 'atr_max_pct': 0.08861233288692674, 'tp_mult': 2.99674615833216, 'tsl_mult': 0.8723169448629805, 'strategy': 'breakout', 'time_stop': 22, 'use_sma': True, 'use_atr': False, 'use_adx': False, 'use_ema': True, 'use_spike': True, 'rsi_required': False, 'edge_k': 1.5757138130765151, 'edge_cap': 0.16190478512562606, 'bull_strategy': 'mean_reversion', 'bull_bb_std_mult': 2.2870583741162673, 'bull_rsi_os': 41, 'bull_rsi_ob': 83, 'bull_adx_thresh': 23.92390718154352, 'bull_atr_min_pct': 0.0009668016851845005, 'bull_atr_max_pct': 0.12720928705912612, 'bull_tp_mult': 2.644988413084107, 'bull_tsl_mult': 0.23612723762707932, 'bull_time_stop': 195, 'bull_use_sma': True, 'bull_use_ema': False, 'bull_use_atr': True, 'bull_use_adx': False, 'bull_use_spike': False, 'bull_rsi_required': False, 'bear_strategy': 'mean_reversion', 'bear_bb_std_mult': 0.9474579577458917, 'bear_rsi_os': 46, 'bear_rsi_ob': 68, 'bear_adx_thresh': 13.460398467963316, 'bear_atr_min_pct': 0.024886244562186296, 'bear_atr_max_pct': 0.10700436644625583, 'bear_tp_mult': 2.917040355900144, 'bear_tsl_mult': 0.14070069025459087, 'bear_time_stop': 198, 'bear_use_sma': True, 'bear_use_ema': False, 'bear_use_atr': True, 'bear_use_adx': True, 'bear_use_spike': False, 'bear_rsi_required': False, 'sideways_strategy': 'mean_reversion', 'sideways_bb_std_mult': 1.4488880154555983, 'sideways_rsi_os': 7, 'sideways_rsi_ob': 52, 'sideways_adx_thresh': 31.523197812257788, 'sideways_atr_min_pct': 0.003384054089991712, 'sideways_atr_max_pct': 0.09260638731090617, 'sideways_tp_mult': 2.6162734108479846, 'sideways_tsl_mult': 0.4184392013642046, 'sideways_time_stop': 195, 'sideways_use_sma': True, 'sideways_use_ema': False, 'sideways_use_atr': False, 'sideways_use_adx': False, 'sideways_use_spike': False, 'sideways_rsi_required': False}.
[I 2025-09-01 04:26:37,644] Trial 145 finished with values: [-1000000000.0, 1000000000.0] and parameters: {'p_sma': 16, 'p_std': 43, 'p_atr': 26, 'p_adx': 19, 'rsi_period': 62, 'ema1': 30, 'ema2': 28, 'slip_atr_k': 0.0009847704700495295, 'slip_spread_k': 0.2913605486083431, 'spread_hl_frac': 0.03623537977418066, 'bb_std_mult': 0.9239963996704953, 'rsi_os': 47, 'rsi_ob': 55, 'vol_spike': 0.24764264057032925, 'adx_thresh': 13.809974367402848, 'atr_min_pct': 0.0006465169899744502, 'atr_max_pct': 0.12830000686143964, 'tp_mult': 2.5038397501395995, 'tsl_mult': 0.8867109260924179, 'strategy': 'breakout', 'time_stop': 22, 'use_sma': True, 'use_atr': False, 'use_adx': False, 'use_ema': True, 'use_spike': True, 'rsi_required': False, 'edge_k': 0.5096324476553842, 'edge_cap': 0.1676543893109586, 'bull_strategy': 'mean_reversion', 'bull_bb_std_mult': 2.244111216052616, 'bull_rsi_os': 30, 'bull_rsi_ob': 89, 'bull_adx_thresh': 18.745964983564555, 'bull_atr_min_pct': 0.0010479203638609534, 'bull_atr_max_pct': 0.12694565840901448, 'bull_tp_mult': 1.64336862666935, 'bull_tsl_mult': 0.38630859642516807, 'bull_time_stop': 193, 'bull_use_sma': True, 'bull_use_ema': False, 'bull_use_atr': True, 'bull_use_adx': False, 'bull_use_spike': False, 'bull_rsi_required': False, 'bear_strategy': 'mean_reversion', 'bear_bb_std_mult': 0.9642314258715208, 'bear_rsi_os': 45, 'bear_rsi_ob': 57, 'bear_adx_thresh': 14.237232178796788, 'bear_atr_min_pct': 0.029766011976146672, 'bear_atr_max_pct': 0.14951091157400923, 'bear_tp_mult': 1.054747702241196, 'bear_tsl_mult': 0.13840512717896797, 'bear_time_stop': 203, 'bear_use_sma': True, 'bear_use_ema': False, 'bear_use_atr': True, 'bear_use_adx': True, 'bear_use_spike': False, 'bear_rsi_required': False, 'sideways_strategy': 'mean_reversion', 'sideways_bb_std_mult': 1.4278909579496253, 'sideways_rsi_os': 7, 'sideways_rsi_ob': 49, 'sideways_adx_thresh': 17.294652360804687, 'sideways_atr_min_pct': 0.02710320837742681, 'sideways_atr_max_pct': 0.08303808065359077, 'sideways_tp_mult': 2.6361687229330184, 'sideways_tsl_mult': 0.9806412623542045, 'sideways_time_stop': 195, 'sideways_use_sma': True, 'sideways_use_ema': True, 'sideways_use_atr': False, 'sideways_use_adx': False, 'sideways_use_spike': False, 'sideways_rsi_required': False}.
[I 2025-09-01 04:26:37,769] Trial 146 finished with values: [-1000000000.0, 1000000000.0] and parameters: {'p_sma': 14, 'p_std': 44, 'p_atr': 28, 'p_adx': 19, 'rsi_period': 61, 'ema1': 30, 'ema2': 28, 'slip_atr_k': 0.002026553541857769, 'slip_spread_k': 0.2858554767924026, 'spread_hl_frac': 0.03769195481005195, 'bb_std_mult': 0.9265403034613481, 'rsi_os': 47, 'rsi_ob': 55, 'vol_spike': 0.048304563117402444, 'adx_thresh': 14.466748758571542, 'atr_min_pct': 0.000697753276301926, 'atr_max_pct': 0.12969958689697, 'tp_mult': 2.460853741637695, 'tsl_mult': 0.8674808138384098, 'strategy': 'breakout', 'time_stop': 33, 'use_sma': True, 'use_atr': False, 'use_adx': False, 'use_ema': True, 'use_spike': True, 'rsi_required': False, 'edge_k': 0.5887433572652258, 'edge_cap': 0.13873627104059985, 'bull_strategy': 'mean_reversion', 'bull_bb_std_mult': 2.48048882712544, 'bull_rsi_os': 30, 'bull_rsi_ob': 89, 'bull_adx_thresh': 17.704294210862507, 'bull_atr_min_pct': 0.0012673278176661825, 'bull_atr_max_pct': 0.1268648103061273, 'bull_tp_mult': 1.6402591928383699, 'bull_tsl_mult': 0.3731551967025825, 'bull_time_stop': 193, 'bull_use_sma': True, 'bull_use_ema': False, 'bull_use_atr': True, 'bull_use_adx': False, 'bull_use_spike': False, 'bull_rsi_required': False, 'bear_strategy': 'mean_reversion', 'bear_bb_std_mult': 0.9457595955966885, 'bear_rsi_os': 45, 'bear_rsi_ob': 61, 'bear_adx_thresh': 12.993168274140082, 'bear_atr_min_pct': 0.028811474894673044, 'bear_atr_max_pct': 0.1498405687321082, 'bear_tp_mult': 1.0543727665028677, 'bear_tsl_mult': 0.1392761418458322, 'bear_time_stop': 195, 'bear_use_sma': True, 'bear_use_ema': False, 'bear_use_atr': True, 'bear_use_adx': True, 'bear_use_spike': False, 'bear_rsi_required': False, 'sideways_strategy': 'mean_reversion', 'sideways_bb_std_mult': 1.2554942565844707, 'sideways_rsi_os': 6, 'sideways_rsi_ob': 49, 'sideways_adx_thresh': 17.461622675733754, 'sideways_atr_min_pct': 0.023667765148169467, 'sideways_atr_max_pct': 0.09070536662292171, 'sideways_tp_mult': 2.7781041145110317, 'sideways_tsl_mult': 0.9513281887704473, 'sideways_time_stop': 197, 'sideways_use_sma': True, 'sideways_use_ema': True, 'sideways_use_atr': False, 'sideways_use_adx': False, 'sideways_use_spike': False, 'sideways_rsi_required': False}.
[I 2025-09-01 04:27:21,145] Trial 147 finished with values: [-1000000000.0, 1000000000.0] and parameters: {'p_sma': 14, 'p_std': 43, 'p_atr': 26, 'p_adx': 19, 'rsi_period': 58, 'ema1': 30, 'ema2': 27, 'slip_atr_k': 0.007104811782943434, 'slip_spread_k': 0.33591374781817573, 'spread_hl_frac': 0.03697075459914785, 'bb_std_mult': 0.9535018182938211, 'rsi_os': 45, 'rsi_ob': 63, 'vol_spike': 0.2227510019064583, 'adx_thresh': 13.642024839588123, 'atr_min_pct': 4.955472479033934e-06, 'atr_max_pct': 0.11560092493870863, 'tp_mult': 2.459372553368858, 'tsl_mult': 0.8794405073620122, 'strategy': 'breakout', 'time_stop': 21, 'use_sma': True, 'use_atr': False, 'use_adx': False, 'use_ema': True, 'use_spike': True, 'rsi_required': False, 'edge_k': 0.5892222512221861, 'edge_cap': 0.13859162742852804, 'bull_strategy': 'mean_reversion', 'bull_bb_std_mult': 2.458293726113919, 'bull_rsi_os': 30, 'bull_rsi_ob': 89, 'bull_adx_thresh': 18.86966239613118, 'bull_atr_min_pct': 0.000808716410321706, 'bull_atr_max_pct': 0.12703204444536775, 'bull_tp_mult': 1.4378614583848797, 'bull_tsl_mult': 0.35764991190536116, 'bull_time_stop': 192, 'bull_use_sma': True, 'bull_use_ema': False, 'bull_use_atr': True, 'bull_use_adx': False, 'bull_use_spike': False, 'bull_rsi_required': False, 'bear_strategy': 'mean_reversion', 'bear_bb_std_mult': 1.0398006479638575, 'bear_rsi_os': 45, 'bear_rsi_ob': 60, 'bear_adx_thresh': 13.091294630103494, 'bear_atr_min_pct': 0.029047789651106454, 'bear_atr_max_pct': 0.14729196152815963, 'bear_tp_mult': 1.0648502183188668, 'bear_tsl_mult': 0.18138242735893145, 'bear_time_stop': 194, 'bear_use_sma': True, 'bear_use_ema': False, 'bear_use_atr': True, 'bear_use_adx': True, 'bear_use_spike': False, 'bear_rsi_required': False, 'sideways_strategy': 'mean_reversion', 'sideways_bb_std_mult': 1.2342056594810564, 'sideways_rsi_os': 6, 'sideways_rsi_ob': 49, 'sideways_adx_thresh': 17.314999847189668, 'sideways_atr_min_pct': 0.02359476831933574, 'sideways_atr_max_pct': 0.09589567794214102, 'sideways_tp_mult': 2.719309347033152, 'sideways_tsl_mult': 0.06188434972027018, 'sideways_time_stop': 187, 'sideways_use_sma': True, 'sideways_use_ema': True, 'sideways_use_atr': False, 'sideways_use_adx': False, 'sideways_use_spike': False, 'sideways_rsi_required': False}.
[I 2025-09-01 04:27:21,623] Trial 150 finished with values: [-0.02087536232886178, 0.020724792107415357] and parameters: {'p_sma': 17, 'p_std': 17, 'p_atr': 26, 'p_adx': 21, 'rsi_period': 58, 'ema1': 29, 'ema2': 30, 'slip_atr_k': 0.011551452338728199, 'slip_spread_k': 0.3456358441683027, 'spread_hl_frac': 0.04343982282755163, 'bb_std_mult': 1.1810476784514434, 'rsi_os': 45, 'rsi_ob': 63, 'vol_spike': 0.22380980171174814, 'adx_thresh': 11.94370478242568, 'atr_min_pct': 0.0017629683504460166, 'atr_max_pct': 0.11689250653661856, 'tp_mult': 2.270612421971109, 'tsl_mult': 0.9235443396283295, 'strategy': 'breakout', 'time_stop': 27, 'use_sma': True, 'use_atr': True, 'use_adx': False, 'use_ema': True, 'use_spike': True, 'rsi_required': False, 'edge_k': 1.4407378974297984, 'edge_cap': 0.18610882788113844, 'bull_strategy': 'breakout', 'bull_bb_std_mult': 2.4261629712753625, 'bull_rsi_os': 28, 'bull_rsi_ob': 85, 'bull_adx_thresh': 16.825750672456806, 'bull_atr_min_pct': 0.0022433582708327373, 'bull_atr_max_pct': 0.12057077469646238, 'bull_tp_mult': 1.555453361956171, 'bull_tsl_mult': 0.2901815733987981, 'bull_time_stop': 200, 'bull_use_sma': True, 'bull_use_ema': False, 'bull_use_atr': False, 'bull_use_adx': False, 'bull_use_spike': False, 'bull_rsi_required': True, 'bear_strategy': 'mean_reversion', 'bear_bb_std_mult': 1.0498610186671478, 'bear_rsi_os': 47, 'bear_rsi_ob': 58, 'bear_adx_thresh': 9.946739016916801, 'bear_atr_min_pct': 0.02812026957239365, 'bear_atr_max_pct': 0.1467123250371691, 'bear_tp_mult': 1.0912175862678681, 'bear_tsl_mult': 0.18827791214340633, 'bear_time_stop': 191, 'bear_use_sma': True, 'bear_use_ema': False, 'bear_use_atr': True, 'bear_use_adx': True, 'bear_use_spike': False, 'bear_rsi_required': False, 'sideways_strategy': 'breakout', 'sideways_bb_std_mult': 1.525668760809296, 'sideways_rsi_os': 10, 'sideways_rsi_ob': 50, 'sideways_adx_thresh': 18.514519820217913, 'sideways_atr_min_pct': 0.024507779811926318, 'sideways_atr_max_pct': 0.09544644852425195, 'sideways_tp_mult': 2.792764490280255, 'sideways_tsl_mult': 0.9058089445695345, 'sideways_time_stop': 186, 'sideways_use_sma': False, 'sideways_use_ema': True, 'sideways_use_atr': False, 'sideways_use_adx': False, 'sideways_use_spike': True, 'sideways_rsi_required': False}.
[I 2025-09-01 04:27:21,904] Trial 148 finished with values: [-1000000000.0, 1000000000.0] and parameters: {'p_sma': 14, 'p_std': 44, 'p_atr': 26, 'p_adx': 19, 'rsi_period': 58, 'ema1': 30, 'ema2': 27, 'slip_atr_k': 0.02146519421205984, 'slip_spread_k': 0.34377705114548035, 'spread_hl_frac': 0.04236153819617344, 'bb_std_mult': 0.9507092286509397, 'rsi_os': 45, 'rsi_ob': 63, 'vol_spike': 0.22318457705337238, 'adx_thresh': 14.885074267973522, 'atr_min_pct': 4.68370256358541e-05, 'atr_max_pct': 0.11465678102900724, 'tp_mult': 2.4826817206673057, 'tsl_mult': 0.846425603556934, 'strategy': 'breakout', 'time_stop': 27, 'use_sma': True, 'use_atr': True, 'use_adx': False, 'use_ema': True, 'use_spike': True, 'rsi_required': False, 'edge_k': 0.5942104744474644, 'edge_cap': 0.17363097283631035, 'bull_strategy': 'breakout', 'bull_bb_std_mult': 2.497755002614314, 'bull_rsi_os': 30, 'bull_rsi_ob': 89, 'bull_adx_thresh': 18.724756656599514, 'bull_atr_min_pct': 0.001923728851296026, 'bull_atr_max_pct': 0.12068929885229773, 'bull_tp_mult': 1.5542095344112352, 'bull_tsl_mult': 0.2857762238360607, 'bull_time_stop': 215, 'bull_use_sma': True, 'bull_use_ema': False, 'bull_use_atr': True, 'bull_use_adx': False, 'bull_use_spike': False, 'bull_rsi_required': False, 'bear_strategy': 'mean_reversion', 'bear_bb_std_mult': 1.0164473523559594, 'bear_rsi_os': 47, 'bear_rsi_ob': 61, 'bear_adx_thresh': 8.2624150632116, 'bear_atr_min_pct': 0.02896728088025919, 'bear_atr_max_pct': 0.1495114717162417, 'bear_tp_mult': 1.0524507655990458, 'bear_tsl_mult': 0.17999697813339133, 'bear_time_stop': 191, 'bear_use_sma': True, 'bear_use_ema': False, 'bear_use_atr': True, 'bear_use_adx': True, 'bear_use_spike': False, 'bear_rsi_required': False, 'sideways_strategy': 'mean_reversion', 'sideways_bb_std_mult': 1.2015853890566064, 'sideways_rsi_os': 6, 'sideways_rsi_ob': 50, 'sideways_adx_thresh': 17.306261543453612, 'sideways_atr_min_pct': 0.02703557497112242, 'sideways_atr_max_pct': 0.08468363168349671, 'sideways_tp_mult': 2.807842281326198, 'sideways_tsl_mult': 0.9502572840402842, 'sideways_time_stop': 189, 'sideways_use_sma': True, 'sideways_use_ema': True, 'sideways_use_atr': False, 'sideways_use_adx': False, 'sideways_use_spike': True, 'sideways_rsi_required': False}.
[I 2025-09-01 04:27:22,233] Trial 149 finished with values: [-0.025057058947608346, 0.024902573668816475] and parameters: {'p_sma': 17, 'p_std': 16, 'p_atr': 24, 'p_adx': 21, 'rsi_period': 58, 'ema1': 29, 'ema2': 27, 'slip_atr_k': 0.010202371949010946, 'slip_spread_k': 0.34298773813599776, 'spread_hl_frac': 0.042754265558736466, 'bb_std_mult': 0.9723864605365543, 'rsi_os': 45, 'rsi_ob': 63, 'vol_spike': 0.22394088454241373, 'adx_thresh': 14.908115484484332, 'atr_min_pct': 0.0018131346885172815, 'atr_max_pct': 0.11623144302101923, 'tp_mult': 2.562712279774813, 'tsl_mult': 0.9058885442312776, 'strategy': 'breakout', 'time_stop': 276, 'use_sma': True, 'use_atr': True, 'use_adx': False, 'use_ema': True, 'use_spike': True, 'rsi_required': False, 'edge_k': 0.6092800997809703, 'edge_cap': 0.19240527224335868, 'bull_strategy': 'breakout', 'bull_bb_std_mult': 2.182925521229646, 'bull_rsi_os': 28, 'bull_rsi_ob': 86, 'bull_adx_thresh': 16.795511028424105, 'bull_atr_min_pct': 0.0019373422064236367, 'bull_atr_max_pct': 0.12185732264241546, 'bull_tp_mult': 1.5670587775523104, 'bull_tsl_mult': 0.34361971631283017, 'bull_time_stop': 184, 'bull_use_sma': True, 'bull_use_ema': False, 'bull_use_atr': False, 'bull_use_adx': False, 'bull_use_spike': False, 'bull_rsi_required': True, 'bear_strategy': 'mean_reversion', 'bear_bb_std_mult': 1.0595428958807873, 'bear_rsi_os': 47, 'bear_rsi_ob': 61, 'bear_adx_thresh': 8.150703900073392, 'bear_atr_min_pct': 0.02919774352053486, 'bear_atr_max_pct': 0.14600042639084934, 'bear_tp_mult': 1.105542029578121, 'bear_tsl_mult': 0.19197222355094107, 'bear_time_stop': 194, 'bear_use_sma': True, 'bear_use_ema': False, 'bear_use_atr': True, 'bear_use_adx': True, 'bear_use_spike': False, 'bear_rsi_required': False, 'sideways_strategy': 'breakout', 'sideways_bb_std_mult': 1.202116568411272, 'sideways_rsi_os': 5, 'sideways_rsi_ob': 50, 'sideways_adx_thresh': 24.660327158158307, 'sideways_atr_min_pct': 0.02263405192366358, 'sideways_atr_max_pct': 0.09517947856967969, 'sideways_tp_mult': 2.708857902811962, 'sideways_tsl_mult': 0.06446345285387789, 'sideways_time_stop': 185, 'sideways_use_sma': False, 'sideways_use_ema': True, 'sideways_use_atr': False, 'sideways_use_adx': False, 'sideways_use_spike': True, 'sideways_rsi_required': False}.
[I 2025-09-01 04:28:05,128] Trial 154 finished with values: [-1000000000.0, 1000000000.0] and parameters: {'p_sma': 18, 'p_std': 41, 'p_atr': 24, 'p_adx': 20, 'rsi_period': 57, 'ema1': 29, 'ema2': 30, 'slip_atr_k': 0.010036615555788494, 'slip_spread_k': 0.2552560993178422, 'spread_hl_frac': 0.0426593223576489, 'bb_std_mult': 1.1781579100387183, 'rsi_os': 46, 'rsi_ob': 59, 'vol_spike': 0.23929240970712695, 'adx_thresh': 14.804485887594847, 'atr_min_pct': 0.0018131893833239793, 'atr_max_pct': 0.12280064391475343, 'tp_mult': 2.599466177886083, 'tsl_mult': 0.9074480936837155, 'strategy': 'breakout', 'time_stop': 300, 'use_sma': True, 'use_atr': True, 'use_adx': False, 'use_ema': True, 'use_spike': False, 'rsi_required': False, 'edge_k': 1.453865079376074, 'edge_cap': 0.18777208848570426, 'bull_strategy': 'breakout', 'bull_bb_std_mult': 2.4096853002284937, 'bull_rsi_os': 28, 'bull_rsi_ob': 86, 'bull_adx_thresh': 16.638978303286223, 'bull_atr_min_pct': 0.0025145588671756326, 'bull_atr_max_pct': 0.13232318907094093, 'bull_tp_mult': 1.624379926723519, 'bull_tsl_mult': 0.44368320965564473, 'bull_time_stop': 203, 'bull_use_sma': True, 'bull_use_ema': False, 'bull_use_atr': False, 'bull_use_adx': False, 'bull_use_spike': False, 'bull_rsi_required': True, 'bear_strategy': 'mean_reversion', 'bear_bb_std_mult': 0.8063728153753302, 'bear_rsi_os': 48, 'bear_rsi_ob': 58, 'bear_adx_thresh': 9.973930709325206, 'bear_atr_min_pct': 0.029865239226626098, 'bear_atr_max_pct': 0.14574449180598578, 'bear_tp_mult': 1.1080797564304816, 'bear_tsl_mult': 0.08188137503080574, 'bear_time_stop': 188, 'bear_use_sma': False, 'bear_use_ema': False, 'bear_use_atr': True, 'bear_use_adx': False, 'bear_use_spike': False, 'bear_rsi_required': False, 'sideways_strategy': 'breakout', 'sideways_bb_std_mult': 0.7101960339826696, 'sideways_rsi_os': 10, 'sideways_rsi_ob': 81, 'sideways_adx_thresh': 18.61552041748948, 'sideways_atr_min_pct': 0.022370153402643606, 'sideways_atr_max_pct': 0.09642042813989203, 'sideways_tp_mult': 2.7912116446169217, 'sideways_tsl_mult': 0.9076961897225143, 'sideways_time_stop': 207, 'sideways_use_sma': False, 'sideways_use_ema': True, 'sideways_use_atr': False, 'sideways_use_adx': False, 'sideways_use_spike': True, 'sideways_rsi_required': False}.
[I 2025-09-01 04:28:05,152] Trial 153 finished with values: [-1000000000.0, 1000000000.0] and parameters: {'p_sma': 17, 'p_std': 45, 'p_atr': 24, 'p_adx': 20, 'rsi_period': 64, 'ema1': 29, 'ema2': 26, 'slip_atr_k': 0.01052152990755052, 'slip_spread_k': 0.2645490463114348, 'spread_hl_frac': 0.03331334643488773, 'bb_std_mult': 1.164201577542877, 'rsi_os': 13, 'rsi_ob': 47, 'vol_spike': 0.23029105363335534, 'adx_thresh': 14.742952362328783, 'atr_min_pct': 0.0017997813570475307, 'atr_max_pct': 0.1190489247717835, 'tp_mult': 2.5874687080566616, 'tsl_mult': 0.91585118691764, 'strategy': 'breakout', 'time_stop': 270, 'use_sma': True, 'use_atr': True, 'use_adx': False, 'use_ema': True, 'use_spike': False, 'rsi_required': False, 'edge_k': 0.050950503209395204, 'edge_cap': 0.19383359913429454, 'bull_strategy': 'breakout', 'bull_bb_std_mult': 2.1446860228707645, 'bull_rsi_os': 28, 'bull_rsi_ob': 86, 'bull_adx_thresh': 16.568073372089128, 'bull_atr_min_pct': 0.0018565142312300196, 'bull_atr_max_pct': 0.1328178154277635, 'bull_tp_mult': 1.5427195751799323, 'bull_tsl_mult': 0.328825418991921, 'bull_time_stop': 201, 'bull_use_sma': True, 'bull_use_ema': False, 'bull_use_atr': False, 'bull_use_adx': False, 'bull_use_spike': False, 'bull_rsi_required': True, 'bear_strategy': 'mean_reversion', 'bear_bb_std_mult': 0.75536837895344, 'bear_rsi_os': 43, 'bear_rsi_ob': 58, 'bear_adx_thresh': 15.064273072072456, 'bear_atr_min_pct': 0.02808738481021194, 'bear_atr_max_pct': 0.1450449060183175, 'bear_tp_mult': 1.0969174020629462, 'bear_tsl_mult': 0.09423562582984185, 'bear_time_stop': 187, 'bear_use_sma': False, 'bear_use_ema': False, 'bear_use_atr': True, 'bear_use_adx': False, 'bear_use_spike': False, 'bear_rsi_required': False, 'sideways_strategy': 'breakout', 'sideways_bb_std_mult': 0.7326746496550876, 'sideways_rsi_os': 10, 'sideways_rsi_ob': 51, 'sideways_adx_thresh': 26.937379606156284, 'sideways_atr_min_pct': 0.028991622479120287, 'sideways_atr_max_pct': 0.09718573474965041, 'sideways_tp_mult': 2.6942672473669953, 'sideways_tsl_mult': 0.9067424774047179, 'sideways_time_stop': 183, 'sideways_use_sma': False, 'sideways_use_ema': True, 'sideways_use_atr': False, 'sideways_use_adx': False, 'sideways_use_spike': True, 'sideways_rsi_required': False}.
