[I 2025-09-01 04:45:59,131] Trial 250 finished with values: [-1000000000.0, 1000000000.0] and parameters: {'p_sma': 35, 'p_std': 41, 'p_atr': 25, 'p_adx': 23, 'rsi_period': 61, 'ema1': 10, 'ema2': 28, 'slip_atr_k': 0.16751786322337828, 'slip_spread_k': 0.3194176088969438, 'spread_hl_frac': 0.04019910262298792, 'bb_std_mult': 0.9186660869704322, 'rsi_os': 6, 'rsi_ob': 78, 'vol_spike': 0.09150970371543979, 'adx_thresh': 15.470321858905624, 'atr_min_pct': 0.0007835121602864067, 'atr_max_pct': 0.1465069851668953, 'tp_mult': 2.7538454674513564, 'tsl_mult': 0.9297870435284774, 'strategy': 'breakout', 'time_stop': 105, 'use_sma': True, 'use_atr': False, 'use_adx': False, 'use_ema': True, 'use_spike': True, 'rsi_required': False, 'edge_k': 0.548970922491675, 'edge_cap': 0.14663411326189357, 'bull_strategy': 'mean_reversion', 'bull_bb_std_mult': 3.5350272889360568, 'bull_rsi_os': 28, 'bull_rsi_ob': 88, 'bull_adx_thresh': 17.787970862532593, 'bull_atr_min_pct': 0.004952744875878039, 'bull_atr_max_pct': 0.11920286000889255, 'bull_tp_mult': 1.6295506751893527, 'bull_tsl_mult': 0.3677582955019634, 'bull_time_stop': 68, 'bull_use_sma': False, 'bull_use_ema': False, 'bull_use_atr': True, 'bull_use_adx': False, 'bull_use_spike': False, 'bull_rsi_required': False, 'bear_strategy': 'mean_reversion', 'bear_bb_std_mult': 1.2227083354831505, 'bear_rsi_os': 29, 'bear_rsi_ob': 82, 'bear_adx_thresh': 14.499552465234347, 'bear_atr_min_pct': 0.020954952796726458, 'bear_atr_max_pct': 0.05991247555535657, 'bear_tp_mult': 1.082818793610725, 'bear_tsl_mult': 0.12566904319406075, 'bear_time_stop': 92, 'bear_use_sma': True, 'bear_use_ema': False, 'bear_use_atr': True, 'bear_use_adx': True, 'bear_use_spike': False, 'bear_rsi_required': False, 'sideways_strategy': 'mean_reversion', 'sideways_bb_std_mult': 2.6635974963767355, 'sideways_rsi_os': 7, 'sideways_rsi_ob': 92, 'sideways_adx_thresh': 17.05359150346469, 'sideways_atr_min_pct': 0.022923041345965376, 'sideways_atr_max_pct': 0.07145044912587097, 'sideways_tp_mult': 2.248589956063752, 'sideways_tsl_mult': 0.3697389714673412, 'sideways_time_stop': 174, 'sideways_use_sma': True, 'sideways_use_ema': True, 'sideways_use_atr': False, 'sideways_use_adx': True, 'sideways_use_spike': False, 'sideways_rsi_required': False}.
[I 2025-09-01 04:46:40,727] Trial 254 finished with values: [-1000000000.0, 1000000000.0] and parameters: {'p_sma': 37, 'p_std': 33, 'p_atr': 26, 'p_adx': 7, 'rsi_period': 60, 'ema1': 29, 'ema2': 26, 'slip_atr_k': 0.004012345703459983, 'slip_spread_k': 0.2917224348886584, 'spread_hl_frac': 0.03363696249623407, 'bb_std_mult': 0.8570223668559916, 'rsi_os': 38, 'rsi_ob': 54, 'vol_spike': 0.25844440490033854, 'adx_thresh': 14.858032760711442, 'atr_min_pct': 0.0012107556194675714, 'atr_max_pct': 0.11675588025968021, 'tp_mult': 1.5243219605017868, 'tsl_mult': 0.9376753151990463, 'strategy': 'breakout', 'time_stop': 22, 'use_sma': False, 'use_atr': False, 'use_adx': False, 'use_ema': True, 'use_spike': True, 'rsi_required': True, 'edge_k': 0.6550050081625334, 'edge_cap': 0.14669154169314935, 'bull_strategy': 'mean_reversion', 'bull_bb_std_mult': 2.3314176032199847, 'bull_rsi_os': 27, 'bull_rsi_ob': 55, 'bull_adx_thresh': 27.8125730156589, 'bull_atr_min_pct': 0.000526376152818179, 'bull_atr_max_pct': 0.12121038181912104, 'bull_tp_mult': 2.5096454865569857, 'bull_tsl_mult': 0.16122886517418195, 'bull_time_stop': 110, 'bull_use_sma': False, 'bull_use_ema': True, 'bull_use_atr': True, 'bull_use_adx': False, 'bull_use_spike': True, 'bull_rsi_required': False, 'bear_strategy': 'mean_reversion', 'bear_bb_std_mult': 2.8829836884872195, 'bear_rsi_os': 44, 'bear_rsi_ob': 66, 'bear_adx_thresh': 26.43967015297823, 'bear_atr_min_pct': 0.022381823555430128, 'bear_atr_max_pct': 0.11827582019888466, 'bear_tp_mult': 1.7815319043556717, 'bear_tsl_mult': 0.7568945886091237, 'bear_time_stop': 224, 'bear_use_sma': True, 'bear_use_ema': False, 'bear_use_atr': False, 'bear_use_adx': False, 'bear_use_spike': False, 'bear_rsi_required': False, 'sideways_strategy': 'mean_reversion', 'sideways_bb_std_mult': 1.5989127761613255, 'sideways_rsi_os': 8, 'sideways_rsi_ob': 47, 'sideways_adx_thresh': 16.306057729806984, 'sideways_atr_min_pct': 0.023508822812646556, 'sideways_atr_max_pct': 0.09052480344272254, 'sideways_tp_mult': 2.8101643160338807, 'sideways_tsl_mult': 0.9775248998925642, 'sideways_time_stop': 171, 'sideways_use_sma': False, 'sideways_use_ema': True, 'sideways_use_atr': False, 'sideways_use_adx': True, 'sideways_use_spike': False, 'sideways_rsi_required': False}.
[I 2025-09-01 04:46:41,025] Trial 253 finished with values: [-0.026605187313392342, 0.026417349947201015] and parameters: {'p_sma': 55, 'p_std': 51, 'p_atr': 26, 'p_adx': 23, 'rsi_period': 61, 'ema1': 10, 'ema2': 28, 'slip_atr_k': 0.16868149855921494, 'slip_spread_k': 0.4873502013806006, 'spread_hl_frac': 0.04403460738916805, 'bb_std_mult': 3.404137547794427, 'rsi_os': 20, 'rsi_ob': 57, 'vol_spike': 0.22514656839263075, 'adx_thresh': 14.58522899677939, 'atr_min_pct': 0.026179596748953596, 'atr_max_pct': 0.112661277304185, 'tp_mult': 1.034281021308093, 'tsl_mult': 0.900259737901401, 'strategy': 'breakout', 'time_stop': 191, 'use_sma': True, 'use_atr': False, 'use_adx': True, 'use_ema': False, 'use_spike': True, 'rsi_required': True, 'edge_k': 0.9849202893430168, 'edge_cap': 0.23936195371408797, 'bull_strategy': 'breakout', 'bull_bb_std_mult': 3.5523861241338306, 'bull_rsi_os': 28, 'bull_rsi_ob': 55, 'bull_adx_thresh': 10.128014282493073, 'bull_atr_min_pct': 0.0006469123325344556, 'bull_atr_max_pct': 0.04009032787003076, 'bull_tp_mult': 1.668390356376781, 'bull_tsl_mult': 0.0051822986747216415, 'bull_time_stop': 216, 'bull_use_sma': False, 'bull_use_ema': True, 'bull_use_atr': False, 'bull_use_adx': False, 'bull_use_spike': True, 'bull_rsi_required': True, 'bear_strategy': 'mean_reversion', 'bear_bb_std_mult': 1.188044834149881, 'bear_rsi_os': 44, 'bear_rsi_ob': 57, 'bear_adx_thresh': 7.780128224957293, 'bear_atr_min_pct': 0.026155083736236123, 'bear_atr_max_pct': 0.12466935989671342, 'bear_tp_mult': 1.8194744112431511, 'bear_tsl_mult': 0.9102968684433097, 'bear_time_stop': 206, 'bear_use_sma': False, 'bear_use_ema': False, 'bear_use_atr': False, 'bear_use_adx': False, 'bear_use_spike': False, 'bear_rsi_required': False, 'sideways_strategy': 'breakout', 'sideways_bb_std_mult': 1.4989714769520275, 'sideways_rsi_os': 8, 'sideways_rsi_ob': 46, 'sideways_adx_thresh': 16.14527954027129, 'sideways_atr_min_pct': 0.017342805976761883, 'sideways_atr_max_pct': 0.09367234498508092, 'sideways_tp_mult': 2.934581737506753, 'sideways_tsl_mult': 0.5966691817220301, 'sideways_time_stop': 175, 'sideways_use_sma': False, 'sideways_use_ema': True, 'sideways_use_atr': False, 'sideways_use_adx': True, 'sideways_use_spike': False, 'sideways_rsi_required': True}.
[I 2025-09-01 04:46:41,239] Trial 256 finished with values: [-0.019155002203116944, 0.01909444663927415] and parameters: {'p_sma': 16, 'p_std': 10, 'p_atr': 27, 'p_adx': 18, 'rsi_period': 57, 'ema1': 29, 'ema2': 27, 'slip_atr_k': 0.043446669922555, 'slip_spread_k': 0.26417182114194404, 'spread_hl_frac': 0.043281839171891254, 'bb_std_mult': 0.8297065421424906, 'rsi_os': 38, 'rsi_ob': 54, 'vol_spike': 0.26444622428675824, 'adx_thresh': 16.367999122548476, 'atr_min_pct': 0.02642143808999365, 'atr_max_pct': 0.044386779458118905, 'tp_mult': 2.4291725048687978, 'tsl_mult': 0.8785754718520074, 'strategy': 'mean_reversion', 'time_stop': 22, 'use_sma': False, 'use_atr': False, 'use_adx': True, 'use_ema': False, 'use_spike': True, 'rsi_required': True, 'edge_k': 0.6429801454133313, 'edge_cap': 0.18134213652504105, 'bull_strategy': 'breakout', 'bull_bb_std_mult': 0.7769306585120879, 'bull_rsi_os': 32, 'bull_rsi_ob': 75, 'bull_adx_thresh': 27.626970402964584, 'bull_atr_min_pct': 0.0006099754961841385, 'bull_atr_max_pct': 0.1292253254024462, 'bull_tp_mult': 1.710659859012325, 'bull_tsl_mult': 0.004267942086038479, 'bull_time_stop': 223, 'bull_use_sma': True, 'bull_use_ema': True, 'bull_use_atr': False, 'bull_use_adx': False, 'bull_use_spike': True, 'bull_rsi_required': True, 'bear_strategy': 'mean_reversion', 'bear_bb_std_mult': 1.1472257062602635, 'bear_rsi_os': 44, 'bear_rsi_ob': 66, 'bear_adx_thresh': 26.59338719942444, 'bear_atr_min_pct': 0.017732713750918262, 'bear_atr_max_pct': 0.12163243812872968, 'bear_tp_mult': 1.779375117521008, 'bear_tsl_mult': 0.9027579928542896, 'bear_time_stop': 220, 'bear_use_sma': False, 'bear_use_ema': False, 'bear_use_atr': False, 'bear_use_adx': False, 'bear_use_spike': False, 'bear_rsi_required': False, 'sideways_strategy': 'breakout', 'sideways_bb_std_mult': 1.4842717283651854, 'sideways_rsi_os': 8, 'sideways_rsi_ob': 45, 'sideways_adx_thresh': 13.209705227463214, 'sideways_atr_min_pct': 0.007956679580375029, 'sideways_atr_max_pct': 0.13088948072518514, 'sideways_tp_mult': 2.5582848073792883, 'sideways_tsl_mult': 0.9794683462432703, 'sideways_time_stop': 193, 'sideways_use_sma': False, 'sideways_use_ema': True, 'sideways_use_atr': False, 'sideways_use_adx': False, 'sideways_use_spike': False, 'sideways_rsi_required': True}.
[I 2025-09-01 04:46:41,424] Trial 255 finished with values: [-0.030931621951153843, 0.030778091440362487] and parameters: {'p_sma': 16, 'p_std': 33, 'p_atr': 21, 'p_adx': 23, 'rsi_period': 60, 'ema1': 7, 'ema2': 20, 'slip_atr_k': 0.0054006904991963115, 'slip_spread_k': 0.3221384871681068, 'spread_hl_frac': 0.023483320310177008, 'bb_std_mult': 2.8853611522957507, 'rsi_os': 38, 'rsi_ob': 85, 'vol_spike': 0.25965541675695664, 'adx_thresh': 14.832302642091562, 'atr_min_pct': 0.0265690478206664, 'atr_max_pct': 0.08086609977274822, 'tp_mult': 2.37321487665114, 'tsl_mult': 0.9512359181885418, 'strategy': 'breakout', 'time_stop': 193, 'use_sma': False, 'use_atr': False, 'use_adx': False, 'use_ema': True, 'use_spike': True, 'rsi_required': True, 'edge_k': 1.7997415137747657, 'edge_cap': 0.1590871420654303, 'bull_strategy': 'breakout', 'bull_bb_std_mult': 0.7830458124958208, 'bull_rsi_os': 27, 'bull_rsi_ob': 82, 'bull_adx_thresh': 10.475224519524112, 'bull_atr_min_pct': 0.0005523018783268329, 'bull_atr_max_pct': 0.1188234285942705, 'bull_tp_mult': 2.109243358646354, 'bull_tsl_mult': 0.3672130122956621, 'bull_time_stop': 222, 'bull_use_sma': True, 'bull_use_ema': True, 'bull_use_atr': False, 'bull_use_adx': False, 'bull_use_spike': True, 'bull_rsi_required': True, 'bear_strategy': 'mean_reversion', 'bear_bb_std_mult': 1.1449563897979809, 'bear_rsi_os': 29, 'bear_rsi_ob': 66, 'bear_adx_thresh': 12.764614118344166, 'bear_atr_min_pct': 0.02240525179259732, 'bear_atr_max_pct': 0.12444199108383197, 'bear_tp_mult': 1.1110515481370913, 'bear_tsl_mult': 0.10154576457532694, 'bear_time_stop': 219, 'bear_use_sma': True, 'bear_use_ema': False, 'bear_use_atr': False, 'bear_use_adx': False, 'bear_use_spike': False, 'bear_rsi_required': False, 'sideways_strategy': 'breakout', 'sideways_bb_std_mult': 1.500352011324877, 'sideways_rsi_os': 8, 'sideways_rsi_ob': 47, 'sideways_adx_thresh': 13.517147841746604, 'sideways_atr_min_pct': 0.007921853779769958, 'sideways_atr_max_pct': 0.02889280458506465, 'sideways_tp_mult': 2.8089546890763453, 'sideways_tsl_mult': 0.6920638547391362, 'sideways_time_stop': 174, 'sideways_use_sma': False, 'sideways_use_ema': True, 'sideways_use_atr': False, 'sideways_use_adx': False, 'sideways_use_spike': False, 'sideways_rsi_required': True}.
[I 2025-09-01 04:46:42,106] Trial 257 finished with values: [-1000000000.0, 1000000000.0] and parameters: {'p_sma': 16, 'p_std': 43, 'p_atr': 21, 'p_adx': 20, 'rsi_period': 37, 'ema1': 20, 'ema2': 20, 'slip_atr_k': 0.01053628477005497, 'slip_spread_k': 0.32831448243192246, 'spread_hl_frac': 0.04292844920081707, 'bb_std_mult': 1.8710623590359259, 'rsi_os': 50, 'rsi_ob': 85, 'vol_spike': 0.24815268753801364, 'adx_thresh': 13.930715250440677, 'atr_min_pct': 0.026514550434380307, 'atr_max_pct': 0.1350228724134328, 'tp_mult': 2.3932659244561387, 'tsl_mult': 0.9494952211884229, 'strategy': 'mean_reversion', 'time_stop': 30, 'use_sma': False, 'use_atr': False, 'use_adx': True, 'use_ema': False, 'use_spike': False, 'rsi_required': True, 'edge_k': 0.9971059587965911, 'edge_cap': 0.2324658043668537, 'bull_strategy': 'breakout', 'bull_bb_std_mult': 0.6151591754247197, 'bull_rsi_os': 55, 'bull_rsi_ob': 91, 'bull_adx_thresh': 7.153091751803437, 'bull_atr_min_pct': 0.0006230165356844248, 'bull_atr_max_pct': 0.13010702779269945, 'bull_tp_mult': 2.101340577325947, 'bull_tsl_mult': 0.9326388376707417, 'bull_time_stop': 209, 'bull_use_sma': True, 'bull_use_ema': False, 'bull_use_atr': False, 'bull_use_adx': False, 'bull_use_spike': True, 'bull_rsi_required': True, 'bear_strategy': 'mean_reversion', 'bear_bb_std_mult': 1.135419548808798, 'bear_rsi_os': 45, 'bear_rsi_ob': 57, 'bear_adx_thresh': 12.843156803402762, 'bear_atr_min_pct': 0.017528704281290934, 'bear_atr_max_pct': 0.13701416780290948, 'bear_tp_mult': 1.0511919279018478, 'bear_tsl_mult': 0.1990052856435462, 'bear_time_stop': 193, 'bear_use_sma': False, 'bear_use_ema': False, 'bear_use_atr': False, 'bear_use_adx': False, 'bear_use_spike': False, 'bear_rsi_required': False, 'sideways_strategy': 'breakout', 'sideways_bb_std_mult': 1.4742861387126858, 'sideways_rsi_os': 8, 'sideways_rsi_ob': 46, 'sideways_adx_thresh': 5.913127009230797, 'sideways_atr_min_pct': 0.02389852091115964, 'sideways_atr_max_pct': 0.13104825379834548, 'sideways_tp_mult': 2.6455102240985116, 'sideways_tsl_mult': 0.6864153808645412, 'sideways_time_stop': 226, 'sideways_use_sma': False, 'sideways_use_ema': True, 'sideways_use_atr': False, 'sideways_use_adx': False, 'sideways_use_spike': False, 'sideways_rsi_required': True}.
[I 2025-09-01 04:46:42,119] Trial 260 finished with values: [-1000000000.0, 1000000000.0] and parameters: {'p_sma': 6, 'p_std': 57, 'p_atr': 27, 'p_adx': 20, 'rsi_period': 58, 'ema1': 20, 'ema2': 16, 'slip_atr_k': 0.013333547388349496, 'slip_spread_k': 0.2617829248341617, 'spread_hl_frac': 0.0254995947165627, 'bb_std_mult': 2.2144082644414422, 'rsi_os': 50, 'rsi_ob': 83, 'vol_spike': 0.2483665971170371, 'adx_thresh': 16.460282383603186, 'atr_min_pct': 0.024147469758304674, 'atr_max_pct': 0.13442048244562757, 'tp_mult': 2.4302791182112937, 'tsl_mult': 0.8846736052488672, 'strategy': 'mean_reversion', 'time_stop': 30, 'use_sma': True, 'use_atr': True, 'use_adx': True, 'use_ema': False, 'use_spike': False, 'rsi_required': False, 'edge_k': 0.5143824956058307, 'edge_cap': 0.19251381716277394, 'bull_strategy': 'mean_reversion', 'bull_bb_std_mult': 2.3155162749115155, 'bull_rsi_os': 29, 'bull_rsi_ob': 91, 'bull_adx_thresh': 19.97233108723594, 'bull_atr_min_pct': 0.009331299201272382, 'bull_atr_max_pct': 0.090132814048525, 'bull_tp_mult': 1.568983302245319, 'bull_tsl_mult': 0.3481986050620489, 'bull_time_stop': 208, 'bull_use_sma': True, 'bull_use_ema': False, 'bull_use_atr': True, 'bull_use_adx': True, 'bull_use_spike': False, 'bull_rsi_required': False, 'bear_strategy': 'breakout', 'bear_bb_std_mult': 1.0507847242305226, 'bear_rsi_os': 47, 'bear_rsi_ob': 58, 'bear_adx_thresh': 12.860944179422118, 'bear_atr_min_pct': 0.028892006072801013, 'bear_atr_max_pct': 0.013006595545658056, 'bear_tp_mult': 1.056367770717644, 'bear_tsl_mult': 0.08497528445867353, 'bear_time_stop': 74, 'bear_use_sma': True, 'bear_use_ema': True, 'bear_use_atr': True, 'bear_use_adx': True, 'bear_use_spike': True, 'bear_rsi_required': True, 'sideways_strategy': 'mean_reversion', 'sideways_bb_std_mult': 1.2996711881270302, 'sideways_rsi_os': 5, 'sideways_rsi_ob': 51, 'sideways_adx_thresh': 18.23865097740161, 'sideways_atr_min_pct': 0.01594943896032573, 'sideways_atr_max_pct': 0.13032779357645743, 'sideways_tp_mult': 1.6220721309139083, 'sideways_tsl_mult': 0.1477176331582189, 'sideways_time_stop': 200, 'sideways_use_sma': True, 'sideways_use_ema': False, 'sideways_use_atr': True, 'sideways_use_adx': False, 'sideways_use_spike': True, 'sideways_rsi_required': False}.
[I 2025-09-01 04:46:42,833] Trial 261 finished with values: [-1000000000.0, 1000000000.0] and parameters: {'p_sma': 18, 'p_std': 46, 'p_atr': 27, 'p_adx': 26, 'rsi_period': 57, 'ema1': 29, 'ema2': 16, 'slip_atr_k': 0.04709030757526436, 'slip_spread_k': 0.2545874954154787, 'spread_hl_frac': 0.02539590018762063, 'bb_std_mult': 0.8050013014027415, 'rsi_os': 45, 'rsi_ob': 59, 'vol_spike': 0.23817513469078094, 'adx_thresh': 16.470563363821217, 'atr_min_pct': 0.028379339298030194, 'atr_max_pct': 0.012619933268338629, 'tp_mult': 1.8058907411920684, 'tsl_mult': 0.7816242502835897, 'strategy': 'mean_reversion', 'time_stop': 70, 'use_sma': True, 'use_atr': True, 'use_adx': False, 'use_ema': True, 'use_spike': False, 'rsi_required': False, 'edge_k': 0.5051276215969305, 'edge_cap': 0.18623017565149796, 'bull_strategy': 'mean_reversion', 'bull_bb_std_mult': 1.6399167500617098, 'bull_rsi_os': 29, 'bull_rsi_ob': 71, 'bull_adx_thresh': 31.04731016619236, 'bull_atr_min_pct': 0.0015505014649620115, 'bull_atr_max_pct': 0.12829354137916538, 'bull_tp_mult': 1.4026627344825737, 'bull_tsl_mult': 0.3116565728415934, 'bull_time_stop': 225, 'bull_use_sma': True, 'bull_use_ema': False, 'bull_use_atr': True, 'bull_use_adx': True, 'bull_use_spike': False, 'bull_rsi_required': False, 'bear_strategy': 'breakout', 'bear_bb_std_mult': 1.0902733721875453, 'bear_rsi_os': 46, 'bear_rsi_ob': 85, 'bear_adx_thresh': 11.863955093247915, 'bear_atr_min_pct': 0.029134666121626743, 'bear_atr_max_pct': 0.04797770522004617, 'bear_tp_mult': 1.1488976533193986, 'bear_tsl_mult': 0.07350465176151888, 'bear_time_stop': 216, 'bear_use_sma': True, 'bear_use_ema': True, 'bear_use_atr': True, 'bear_use_adx': True, 'bear_use_spike': True, 'bear_rsi_required': True, 'sideways_strategy': 'mean_reversion', 'sideways_bb_std_mult': 1.307953322411087, 'sideways_rsi_os': 5, 'sideways_rsi_ob': 90, 'sideways_adx_thresh': 18.2278409280124, 'sideways_atr_min_pct': 0.025238133874709693, 'sideways_atr_max_pct': 0.08080876386293717, 'sideways_tp_mult': 2.7280908993785062, 'sideways_tsl_mult': 0.13638203166957036, 'sideways_time_stop': 200, 'sideways_use_sma': True, 'sideways_use_ema': False, 'sideways_use_atr': True, 'sideways_use_adx': False, 'sideways_use_spike': True, 'sideways_rsi_required': False}.
[I 2025-09-01 04:47:20,787] Trial 258 finished with values: [-1000000000.0, 1000000000.0] and parameters: {'p_sma': 52, 'p_std': 9, 'p_atr': 22, 'p_adx': 20, 'rsi_period': 36, 'ema1': 25, 'ema2': 58, 'slip_atr_k': 0.013044489132781861, 'slip_spread_k': 0.32873842065594183, 'spread_hl_frac': 0.04257008092141761, 'bb_std_mult': 3.204307958701567, 'rsi_os': 49, 'rsi_ob': 85, 'vol_spike': 0.20709985700255346, 'adx_thresh': 12.682107012582767, 'atr_min_pct': 0.01061751011021772, 'atr_max_pct': 0.08052162419972496, 'tp_mult': 2.833020714025736, 'tsl_mult': 0.8850121069946781, 'strategy': 'mean_reversion', 'time_stop': 73, 'use_sma': False, 'use_atr': True, 'use_adx': False, 'use_ema': True, 'use_spike': False, 'rsi_required': False, 'edge_k': 1.8030760632990952, 'edge_cap': 0.17696249704843128, 'bull_strategy': 'mean_reversion', 'bull_bb_std_mult': 2.121220190287162, 'bull_rsi_os': 52, 'bull_rsi_ob': 52, 'bull_adx_thresh': 31.11856018120381, 'bull_atr_min_pct': 0.0233931788861645, 'bull_atr_max_pct': 0.024812519036500988, 'bull_tp_mult': 1.7086998988537647, 'bull_tsl_mult': 0.25187895775497426, 'bull_time_stop': 78, 'bull_use_sma': True, 'bull_use_ema': False, 'bull_use_atr': True, 'bull_use_adx': False, 'bull_use_spike': False, 'bull_rsi_required': False, 'bear_strategy': 'mean_reversion', 'bear_bb_std_mult': 2.1069177567207777, 'bear_rsi_os': 46, 'bear_rsi_ob': 56, 'bear_adx_thresh': 11.576288655583529, 'bear_atr_min_pct': 0.029107880588582373, 'bear_atr_max_pct': 0.1359518189853131, 'bear_tp_mult': 2.8743015340163667, 'bear_tsl_mult': 0.09621970602133181, 'bear_time_stop': 219, 'bear_use_sma': True, 'bear_use_ema': False, 'bear_use_atr': True, 'bear_use_adx': True, 'bear_use_spike': False, 'bear_rsi_required': False, 'sideways_strategy': 'mean_reversion', 'sideways_bb_std_mult': 1.463831681444736, 'sideways_rsi_os': 5, 'sideways_rsi_ob': 94, 'sideways_adx_thresh': 13.523668373727926, 'sideways_atr_min_pct': 0.023807721410900835, 'sideways_atr_max_pct': 0.13272579706010262, 'sideways_tp_mult': 2.5845152459852865, 'sideways_tsl_mult': 0.13662219963317113, 'sideways_time_stop': 200, 'sideways_use_sma': True, 'sideways_use_ema': True, 'sideways_use_atr': False, 'sideways_use_adx': False, 'sideways_use_spike': False, 'sideways_rsi_required': False}.
