[I 2025-09-01 04:37:40,225] Trial 207 finished with values: [-1000000000.0, 1000000000.0] and parameters: {'p_sma': 47, 'p_std': 43, 'p_atr': 7, 'p_adx': 19, 'rsi_period': 65, 'ema1': 30, 'ema2': 30, 'slip_atr_k': 0.23989530042151708, 'slip_spread_k': 0.24814544075153366, 'spread_hl_frac': 0.019281934096114017, 'bb_std_mult': 0.92455215611852, 'rsi_os': 48, 'rsi_ob': 69, 'vol_spike': 0.15630607663986953, 'adx_thresh': 9.91986122941666, 'atr_min_pct': 0.009610459849142348, 'atr_max_pct': 0.1366964513509552, 'tp_mult': 1.8575010808044703, 'tsl_mult': 0.19526087232538525, 'strategy': 'breakout', 'time_stop': 293, 'use_sma': True, 'use_atr': True, 'use_adx': False, 'use_ema': True, 'use_spike': False, 'rsi_required': False, 'edge_k': 1.8477629811364318, 'edge_cap': 0.19418318058867634, 'bull_strategy': 'breakout', 'bull_bb_std_mult': 3.339185011477156, 'bull_rsi_os': 28, 'bull_rsi_ob': 91, 'bull_adx_thresh': 19.89358380137962, 'bull_atr_min_pct': 0.020674168880279287, 'bull_atr_max_pct': 0.1476089497882685, 'bull_tp_mult': 1.7398374572872128, 'bull_tsl_mult': 0.40420531346478494, 'bull_time_stop': 82, 'bull_use_sma': True, 'bull_use_ema': False, 'bull_use_atr': False, 'bull_use_adx': False, 'bull_use_spike': False, 'bull_rsi_required': True, 'bear_strategy': 'mean_reversion', 'bear_bb_std_mult': 1.2893477059524305, 'bear_rsi_os': 47, 'bear_rsi_ob': 60, 'bear_adx_thresh': 10.876302153430935, 'bear_atr_min_pct': 0.029337626233696734, 'bear_atr_max_pct': 0.1112921242994735, 'bear_tp_mult': 1.022366276251023, 'bear_tsl_mult': 0.8884115550208601, 'bear_time_stop': 189, 'bear_use_sma': True, 'bear_use_ema': True, 'bear_use_atr': True, 'bear_use_adx': True, 'bear_use_spike': False, 'bear_rsi_required': True, 'sideways_strategy': 'breakout', 'sideways_bb_std_mult': 1.4965182360787852, 'sideways_rsi_os': 48, 'sideways_rsi_ob': 46, 'sideways_adx_thresh': 26.777586347287247, 'sideways_atr_min_pct': 0.022554410757977747, 'sideways_atr_max_pct': 0.09822420510447019, 'sideways_tp_mult': 2.74298818559294, 'sideways_tsl_mult': 0.5540974247313482, 'sideways_time_stop': 184, 'sideways_use_sma': True, 'sideways_use_ema': False, 'sideways_use_atr': False, 'sideways_use_adx': False, 'sideways_use_spike': True, 'sideways_rsi_required': False}.
[I 2025-09-01 04:38:29,329] Trial 210 finished with values: [-1000000000.0, 1000000000.0] and parameters: {'p_sma': 47, 'p_std': 43, 'p_atr': 30, 'p_adx': 8, 'rsi_period': 65, 'ema1': 29, 'ema2': 25, 'slip_atr_k': 0.240406564875787, 'slip_spread_k': 0.21433168537181924, 'spread_hl_frac': 0.01976463423464848, 'bb_std_mult': 0.9408708851701127, 'rsi_os': 28, 'rsi_ob': 69, 'vol_spike': 0.15753421424178055, 'adx_thresh': 9.759545589033346, 'atr_min_pct': 0.0012782099738995795, 'atr_max_pct': 0.06439999863132245, 'tp_mult': 2.4044268326142118, 'tsl_mult': 0.873014299097358, 'strategy': 'breakout', 'time_stop': 25, 'use_sma': True, 'use_atr': False, 'use_adx': False, 'use_ema': True, 'use_spike': False, 'rsi_required': False, 'edge_k': 1.1284904188536822, 'edge_cap': 0.1963641089565873, 'bull_strategy': 'breakout', 'bull_bb_std_mult': 2.223113301567591, 'bull_rsi_os': 28, 'bull_rsi_ob': 84, 'bull_adx_thresh': 20.923690934474383, 'bull_atr_min_pct': 0.02367712302984013, 'bull_atr_max_pct': 0.14756870993477733, 'bull_tp_mult': 1.7256175819785726, 'bull_tsl_mult': 0.4123644681963689, 'bull_time_stop': 185, 'bull_use_sma': True, 'bull_use_ema': False, 'bull_use_atr': False, 'bull_use_adx': False, 'bull_use_spike': False, 'bull_rsi_required': True, 'bear_strategy': 'mean_reversion', 'bear_bb_std_mult': 1.2095110154093593, 'bear_rsi_os': 47, 'bear_rsi_ob': 79, 'bear_adx_thresh': 10.757494060633434, 'bear_atr_min_pct': 0.02997430516037049, 'bear_atr_max_pct': 0.12415648741924123, 'bear_tp_mult': 1.0957557915707579, 'bear_tsl_mult': 0.13794745572932196, 'bear_time_stop': 251, 'bear_use_sma': True, 'bear_use_ema': False, 'bear_use_atr': True, 'bear_use_adx': True, 'bear_use_spike': False, 'bear_rsi_required': True, 'sideways_strategy': 'mean_reversion', 'sideways_bb_std_mult': 1.0709994895047426, 'sideways_rsi_os': 20, 'sideways_rsi_ob': 71, 'sideways_adx_thresh': 10.50111380624982, 'sideways_atr_min_pct': 0.022657566190426033, 'sideways_atr_max_pct': 0.09902371357734119, 'sideways_tp_mult': 2.66033133987752, 'sideways_tsl_mult': 0.9800259306469883, 'sideways_time_stop': 187, 'sideways_use_sma': True, 'sideways_use_ema': False, 'sideways_use_atr': False, 'sideways_use_adx': False, 'sideways_use_spike': False, 'sideways_rsi_required': False}.
[I 2025-09-01 04:38:30,196] Trial 208 finished with values: [-1000000000.0, 1000000000.0] and parameters: {'p_sma': 13, 'p_std': 58, 'p_atr': 7, 'p_adx': 19, 'rsi_period': 38, 'ema1': 30, 'ema2': 30, 'slip_atr_k': 0.010520486254111464, 'slip_spread_k': 0.29003241132989627, 'spread_hl_frac': 0.02593514783717371, 'bb_std_mult': 0.9610996154383333, 'rsi_os': 28, 'rsi_ob': 69, 'vol_spike': 0.25829916040319356, 'adx_thresh': 5.020935178382951, 'atr_min_pct': 0.001022121218249037, 'atr_max_pct': 0.11641606543856636, 'tp_mult': 2.4090350045583313, 'tsl_mult': 0.6663215769858302, 'strategy': 'breakout', 'time_stop': 24, 'use_sma': True, 'use_atr': True, 'use_adx': False, 'use_ema': True, 'use_spike': False, 'rsi_required': False, 'edge_k': 1.0246496101558469, 'edge_cap': 0.21421556648309173, 'bull_strategy': 'breakout', 'bull_bb_std_mult': 3.335137817492776, 'bull_rsi_os': 44, 'bull_rsi_ob': 86, 'bull_adx_thresh': 19.752395655878438, 'bull_atr_min_pct': 0.022397259498599515, 'bull_atr_max_pct': 0.057781915906294105, 'bull_tp_mult': 1.7276319770074107, 'bull_tsl_mult': 0.40917461317886467, 'bull_time_stop': 199, 'bull_use_sma': True, 'bull_use_ema': False, 'bull_use_atr': False, 'bull_use_adx': False, 'bull_use_spike': False, 'bull_rsi_required': True, 'bear_strategy': 'mean_reversion', 'bear_bb_std_mult': 1.293359141508952, 'bear_rsi_os': 47, 'bear_rsi_ob': 60, 'bear_adx_thresh': 11.703656919335288, 'bear_atr_min_pct': 0.029397048148895835, 'bear_atr_max_pct': 0.02775405231675479, 'bear_tp_mult': 1.0148317973258474, 'bear_tsl_mult': 0.13877048641869344, 'bear_time_stop': 221, 'bear_use_sma': True, 'bear_use_ema': True, 'bear_use_atr': True, 'bear_use_adx': True, 'bear_use_spike': False, 'bear_rsi_required': True, 'sideways_strategy': 'breakout', 'sideways_bb_std_mult': 1.0622970631570463, 'sideways_rsi_os': 55, 'sideways_rsi_ob': 46, 'sideways_adx_thresh': 17.374258442047978, 'sideways_atr_min_pct': 0.02229070126892668, 'sideways_atr_max_pct': 0.09799280996207937, 'sideways_tp_mult': 2.7475671294438095, 'sideways_tsl_mult': 0.9803796808756359, 'sideways_time_stop': 183, 'sideways_use_sma': True, 'sideways_use_ema': False, 'sideways_use_atr': False, 'sideways_use_adx': False, 'sideways_use_spike': True, 'sideways_rsi_required': False}.
[I 2025-09-01 04:38:30,607] Trial 209 finished with values: [-1000000000.0, 1000000000.0] and parameters: {'p_sma': 32, 'p_std': 41, 'p_atr': 28, 'p_adx': 19, 'rsi_period': 84, 'ema1': 29, 'ema2': 25, 'slip_atr_k': 0.013083028270269038, 'slip_spread_k': 0.29879069084552634, 'spread_hl_frac': 0.040989548260635424, 'bb_std_mult': 0.9528065758726333, 'rsi_os': 18, 'rsi_ob': 75, 'vol_spike': 0.2592110413093651, 'adx_thresh': 13.27630750589854, 'atr_min_pct': 0.001373305896846895, 'atr_max_pct': 0.11533654993242742, 'tp_mult': 2.410764816064999, 'tsl_mult': 0.6365749864039962, 'strategy': 'breakout', 'time_stop': 25, 'use_sma': True, 'use_atr': True, 'use_adx': False, 'use_ema': True, 'use_spike': False, 'rsi_required': False, 'edge_k': 1.6764414290444147, 'edge_cap': 0.19404362782908313, 'bull_strategy': 'breakout', 'bull_bb_std_mult': 2.4732089432912767, 'bull_rsi_os': 28, 'bull_rsi_ob': 86, 'bull_adx_thresh': 19.68652195671729, 'bull_atr_min_pct': 0.022723414703422953, 'bull_atr_max_pct': 0.11424652546955126, 'bull_tp_mult': 1.7397566333131105, 'bull_tsl_mult': 0.4101841572597781, 'bull_time_stop': 187, 'bull_use_sma': True, 'bull_use_ema': False, 'bull_use_atr': False, 'bull_use_adx': False, 'bull_use_spike': False, 'bull_rsi_required': True, 'bear_strategy': 'mean_reversion', 'bear_bb_std_mult': 0.9092538514126973, 'bear_rsi_os': 47, 'bear_rsi_ob': 59, 'bear_adx_thresh': 27.08853557707787, 'bear_atr_min_pct': 0.02949254961148175, 'bear_atr_max_pct': 0.14608695683746312, 'bear_tp_mult': 1.0130233969101123, 'bear_tsl_mult': 0.8831478170755227, 'bear_time_stop': 261, 'bear_use_sma': True, 'bear_use_ema': True, 'bear_use_atr': True, 'bear_use_adx': True, 'bear_use_spike': False, 'bear_rsi_required': True, 'sideways_strategy': 'mean_reversion', 'sideways_bb_std_mult': 1.4904816324471493, 'sideways_rsi_os': 19, 'sideways_rsi_ob': 70, 'sideways_adx_thresh': 25.284740248941944, 'sideways_atr_min_pct': 0.022415956150501418, 'sideways_atr_max_pct': 0.09157748581811151, 'sideways_tp_mult': 2.7452605195429256, 'sideways_tsl_mult': 0.9786442358842645, 'sideways_time_stop': 274, 'sideways_use_sma': True, 'sideways_use_ema': False, 'sideways_use_atr': False, 'sideways_use_adx': False, 'sideways_use_spike': True, 'sideways_rsi_required': False}.
[I 2025-09-01 04:38:31,110] Trial 211 finished with values: [-1000000000.0, 1000000000.0] and parameters: {'p_sma': 14, 'p_std': 43, 'p_atr': 28, 'p_adx': 20, 'rsi_period': 63, 'ema1': 28, 'ema2': 24, 'slip_atr_k': 0.01186740629804975, 'slip_spread_k': 0.20429739584405357, 'spread_hl_frac': 0.041677451740193036, 'bb_std_mult': 1.6524079704982875, 'rsi_os': 28, 'rsi_ob': 59, 'vol_spike': 0.24295645774319397, 'adx_thresh': 13.37772676452771, 'atr_min_pct': 0.0012565016615164754, 'atr_max_pct': 0.11476311806505869, 'tp_mult': 2.4026780657723674, 'tsl_mult': 0.28581842161006504, 'strategy': 'breakout', 'time_stop': 22, 'use_sma': True, 'use_atr': False, 'use_adx': False, 'use_ema': True, 'use_spike': False, 'rsi_required': False, 'edge_k': 0.6881144740645506, 'edge_cap': 0.13041755484852113, 'bull_strategy': 'mean_reversion', 'bull_bb_std_mult': 2.243131522432395, 'bull_rsi_os': 39, 'bull_rsi_ob': 86, 'bull_adx_thresh': 33.790796468486036, 'bull_atr_min_pct': 0.028778236116373902, 'bull_atr_max_pct': 0.1344304062567383, 'bull_tp_mult': 2.4907344758175665, 'bull_tsl_mult': 0.421567411512923, 'bull_time_stop': 185, 'bull_use_sma': True, 'bull_use_ema': False, 'bull_use_atr': False, 'bull_use_adx': False, 'bull_use_spike': False, 'bull_rsi_required': True, 'bear_strategy': 'mean_reversion', 'bear_bb_std_mult': 0.9019861749939576, 'bear_rsi_os': 49, 'bear_rsi_ob': 72, 'bear_adx_thresh': 14.197051304300437, 'bear_atr_min_pct': 0.029352322062719774, 'bear_atr_max_pct': 0.10325441438231009, 'bear_tp_mult': 1.0909086410809563, 'bear_tsl_mult': 0.13326863317317106, 'bear_time_stop': 62, 'bear_use_sma': True, 'bear_use_ema': False, 'bear_use_atr': True, 'bear_use_adx': True, 'bear_use_spike': False, 'bear_rsi_required': False, 'sideways_strategy': 'mean_reversion', 'sideways_bb_std_mult': 1.043794164733811, 'sideways_rsi_os': 9, 'sideways_rsi_ob': 82, 'sideways_adx_thresh': 32.106765450683596, 'sideways_atr_min_pct': 0.012794503203286985, 'sideways_atr_max_pct': 0.08997397230898738, 'sideways_tp_mult': 2.361869362123457, 'sideways_tsl_mult': 0.9801481427089463, 'sideways_time_stop': 276, 'sideways_use_sma': True, 'sideways_use_ema': True, 'sideways_use_atr': False, 'sideways_use_adx': False, 'sideways_use_spike': False, 'sideways_rsi_required': False}.
[I 2025-09-01 04:39:16,099] Trial 212 finished with values: [-1000000000.0, 1000000000.0] and parameters: {'p_sma': 53, 'p_std': 41, 'p_atr': 24, 'p_adx': 20, 'rsi_period': 63, 'ema1': 30, 'ema2': 11, 'slip_atr_k': 0.011565622855227865, 'slip_spread_k': 0.2994381863047044, 'spread_hl_frac': 0.02401912914136321, 'bb_std_mult': 1.0401707029148415, 'rsi_os': 44, 'rsi_ob': 58, 'vol_spike': 0.25833906141464014, 'adx_thresh': 13.289400373270702, 'atr_min_pct': 4.5538713408298714e-05, 'atr_max_pct': 0.11541474535323669, 'tp_mult': 2.091524854298653, 'tsl_mult': 0.5947168460829688, 'strategy': 'breakout', 'time_stop': 16, 'use_sma': True, 'use_atr': False, 'use_adx': False, 'use_ema': True, 'use_spike': True, 'rsi_required': False, 'edge_k': 1.6637137782429827, 'edge_cap': 0.08271039543688637, 'bull_strategy': 'mean_reversion', 'bull_bb_std_mult': 2.5382814024526077, 'bull_rsi_os': 44, 'bull_rsi_ob': 89, 'bull_adx_thresh': 19.58248568294301, 'bull_atr_min_pct': 0.02250518366398943, 'bull_atr_max_pct': 0.13451366228839529, 'bull_tp_mult': 1.6882057209556032, 'bull_tsl_mult': 0.992483981036179, 'bull_time_stop': 201, 'bull_use_sma': True, 'bull_use_ema': False, 'bull_use_atr': True, 'bull_use_adx': False, 'bull_use_spike': False, 'bull_rsi_required': False, 'bear_strategy': 'mean_reversion', 'bear_bb_std_mult': 0.9273838170159078, 'bear_rsi_os': 46, 'bear_rsi_ob': 59, 'bear_adx_thresh': 12.550806088198847, 'bear_atr_min_pct': 0.029421406719533087, 'bear_atr_max_pct': 0.14061278678352626, 'bear_tp_mult': 2.595686192529095, 'bear_tsl_mult': 0.018656838628926198, 'bear_time_stop': 62, 'bear_use_sma': True, 'bear_use_ema': False, 'bear_use_atr': True, 'bear_use_adx': False, 'bear_use_spike': False, 'bear_rsi_required': False, 'sideways_strategy': 'mean_reversion', 'sideways_bb_std_mult': 1.3796369141336826, 'sideways_rsi_os': 9, 'sideways_rsi_ob': 52, 'sideways_adx_thresh': 25.351420626665945, 'sideways_atr_min_pct': 0.0245422048531162, 'sideways_atr_max_pct': 0.0890121194232179, 'sideways_tp_mult': 2.7494261748430837, 'sideways_tsl_mult': 0.9356730204230854, 'sideways_time_stop': 192, 'sideways_use_sma': True, 'sideways_use_ema': True, 'sideways_use_atr': False, 'sideways_use_adx': False, 'sideways_use_spike': False, 'sideways_rsi_required': False}.
[I 2025-09-01 04:39:16,347] Trial 214 finished with values: [-1000000000.0, 1000000000.0] and parameters: {'p_sma': 5, 'p_std': 43, 'p_atr': 27, 'p_adx': 23, 'rsi_period': 62, 'ema1': 18, 'ema2': 11, 'slip_atr_k': 0.1967576179544031, 'slip_spread_k': 0.1262138868495825, 'spread_hl_frac': 0.021114168023592277, 'bb_std_mult': 1.5663363604273384, 'rsi_os': 45, 'rsi_ob': 58, 'vol_spike': 0.24962006043935148, 'adx_thresh': 14.5834560006163, 'atr_min_pct': 0.0003472640099964639, 'atr_max_pct': 0.11788475504903038, 'tp_mult': 2.451235330758143, 'tsl_mult': 0.8950539653424117, 'strategy': 'breakout', 'time_stop': 13, 'use_sma': True, 'use_atr': False, 'use_adx': False, 'use_ema': True, 'use_spike': True, 'rsi_required': False, 'edge_k': 0.5237769723419745, 'edge_cap': 0.1281896727749306, 'bull_strategy': 'mean_reversion', 'bull_bb_std_mult': 2.2897866721798485, 'bull_rsi_os': 39, 'bull_rsi_ob': 89, 'bull_adx_thresh': 18.355962462628607, 'bull_atr_min_pct': 0.0005802547209444905, 'bull_atr_max_pct': 0.13417135617795634, 'bull_tp_mult': 1.683685282697388, 'bull_tsl_mult': 0.3500673541107386, 'bull_time_stop': 170, 'bull_use_sma': True, 'bull_use_ema': False, 'bull_use_atr': True, 'bull_use_adx': False, 'bull_use_spike': False, 'bull_rsi_required': False, 'bear_strategy': 'mean_reversion', 'bear_bb_std_mult': 1.097761367628951, 'bear_rsi_os': 46, 'bear_rsi_ob': 56, 'bear_adx_thresh': 14.143580492797755, 'bear_atr_min_pct': 0.019745561499751475, 'bear_atr_max_pct': 0.024550155570778408, 'bear_tp_mult': 1.0812463119091662, 'bear_tsl_mult': 0.079373770804612, 'bear_time_stop': 238, 'bear_use_sma': True, 'bear_use_ema': False, 'bear_use_atr': True, 'bear_use_adx': False, 'bear_use_spike': False, 'bear_rsi_required': False, 'sideways_strategy': 'mean_reversion', 'sideways_bb_std_mult': 1.4155713630070903, 'sideways_rsi_os': 9, 'sideways_rsi_ob': 49, 'sideways_adx_thresh': 8.157709000526971, 'sideways_atr_min_pct': 0.009462833943911887, 'sideways_atr_max_pct': 0.08823770346396495, 'sideways_tp_mult': 2.8454771024072594, 'sideways_tsl_mult': 0.9407969641047905, 'sideways_time_stop': 179, 'sideways_use_sma': True, 'sideways_use_ema': True, 'sideways_use_atr': False, 'sideways_use_adx': False, 'sideways_use_spike': False, 'sideways_rsi_required': False}.
[I 2025-09-01 04:39:16,602] Trial 213 finished with values: [-0.03472746956060113, 0.03455945325332535] and parameters: {'p_sma': 32, 'p_std': 45, 'p_atr': 27, 'p_adx': 18, 'rsi_period': 49, 'ema1': 28, 'ema2': 25, 'slip_atr_k': 0.20317646062070902, 'slip_spread_k': 0.12405878101815138, 'spread_hl_frac': 0.045399100478169696, 'bb_std_mult': 1.0370620758490627, 'rsi_os': 44, 'rsi_ob': 76, 'vol_spike': 0.2413540834449754, 'adx_thresh': 13.401141667521703, 'atr_min_pct': 0.006746540099283495, 'atr_max_pct': 0.07120810961018198, 'tp_mult': 2.535116676620532, 'tsl_mult': 0.9245982967585535, 'strategy': 'breakout', 'time_stop': 17, 'use_sma': True, 'use_atr': False, 'use_adx': False, 'use_ema': True, 'use_spike': True, 'rsi_required': False, 'edge_k': 0.5174800164232496, 'edge_cap': 0.13194739506475262, 'bull_strategy': 'mean_reversion', 'bull_bb_std_mult': 2.527296719724941, 'bull_rsi_os': 26, 'bull_rsi_ob': 90, 'bull_adx_thresh': 18.29037739365396, 'bull_atr_min_pct': 0.0005207345966368249, 'bull_atr_max_pct': 0.13405145385138864, 'bull_tp_mult': 1.678495613736043, 'bull_tsl_mult': 0.5409254562313798, 'bull_time_stop': 96, 'bull_use_sma': True, 'bull_use_ema': False, 'bull_use_atr': True, 'bull_use_adx': False, 'bull_use_spike': False, 'bull_rsi_required': False, 'bear_strategy': 'mean_reversion', 'bear_bb_std_mult': 0.8877973132578258, 'bear_rsi_os': 42, 'bear_rsi_ob': 68, 'bear_adx_thresh': 14.185334771157464, 'bear_atr_min_pct': 0.0064213830259732575, 'bear_atr_max_pct': 0.03436521931125696, 'bear_tp_mult': 1.6846732024106479, 'bear_tsl_mult': 0.014909656506557845, 'bear_time_stop': 100, 'bear_use_sma': True, 'bear_use_ema': False, 'bear_use_atr': True, 'bear_use_adx': False, 'bear_use_spike': False, 'bear_rsi_required': False, 'sideways_strategy': 'mean_reversion', 'sideways_bb_std_mult': 1.4335347993376395, 'sideways_rsi_os': 10, 'sideways_rsi_ob': 49, 'sideways_adx_thresh': 18.326693230303565, 'sideways_atr_min_pct': 0.013044921411497639, 'sideways_atr_max_pct': 0.08922504761264821, 'sideways_tp_mult': 2.7045978863593647, 'sideways_tsl_mult': 0.9392905463683666, 'sideways_time_stop': 134, 'sideways_use_sma': True, 'sideways_use_ema': True, 'sideways_use_atr': False, 'sideways_use_adx': False, 'sideways_use_spike': False, 'sideways_rsi_required': False}.
[I 2025-09-01 04:39:16,951] Trial 215 finished with values: [-1000000000.0, 1000000000.0] and parameters: {'p_sma': 16, 'p_std': 45, 'p_atr': 12, 'p_adx': 18, 'rsi_period': 19, 'ema1': 30, 'ema2': 60, 'slip_atr_k': 0.0056930938150386145, 'slip_spread_k': 0.35236690350150723, 'spread_hl_frac': 0.04527565993425861, 'bb_std_mult': 1.5350039178792323, 'rsi_os': 49, 'rsi_ob': 57, 'vol_spike': 0.2506136324882004, 'adx_thresh': 14.746234070552337, 'atr_min_pct': 0.00035992809466900194, 'atr_max_pct': 0.12156169321421431, 'tp_mult': 2.44958679701267, 'tsl_mult': 0.894058225434005, 'strategy': 'breakout', 'time_stop': 14, 'use_sma': True, 'use_atr': False, 'use_adx': False, 'use_ema': True, 'use_spike': True, 'rsi_required': False, 'edge_k': 0.51334781404588, 'edge_cap': 0.5773958527747489, 'bull_strategy': 'mean_reversion', 'bull_bb_std_mult': 2.3072563871924396, 'bull_rsi_os': 26, 'bull_rsi_ob': 89, 'bull_adx_thresh': 18.381160578741046, 'bull_atr_min_pct': 0.0005119998333654668, 'bull_atr_max_pct': 0.12727520153017802, 'bull_tp_mult': 1.6792195906932945, 'bull_tsl_mult': 0.35045571584689683, 'bull_time_stop': 208, 'bull_use_sma': True, 'bull_use_ema': True, 'bull_use_atr': True, 'bull_use_adx': False, 'bull_use_spike': False, 'bull_rsi_required': False, 'bear_strategy': 'mean_reversion', 'bear_bb_std_mult': 1.0934749855377703, 'bear_rsi_os': 46, 'bear_rsi_ob': 74, 'bear_adx_thresh': 13.352871586340983, 'bear_atr_min_pct': 0.02892702491794837, 'bear_atr_max_pct': 0.1414421976334582, 'bear_tp_mult': 1.1385401594937492, 'bear_tsl_mult': 0.7010964902031613, 'bear_time_stop': 32, 'bear_use_sma': True, 'bear_use_ema': False, 'bear_use_atr': True, 'bear_use_adx': False, 'bear_use_spike': False, 'bear_rsi_required': False, 'sideways_strategy': 'mean_reversion', 'sideways_bb_std_mult': 1.382910477768431, 'sideways_rsi_os': 34, 'sideways_rsi_ob': 66, 'sideways_adx_thresh': 9.728998091657639, 'sideways_atr_min_pct': 0.01102601844186879, 'sideways_atr_max_pct': 0.08680771958438256, 'sideways_tp_mult': 2.4320356584883114, 'sideways_tsl_mult': 0.9496140854420051, 'sideways_time_stop': 133, 'sideways_use_sma': True, 'sideways_use_ema': True, 'sideways_use_atr': False, 'sideways_use_adx': False, 'sideways_use_spike': False, 'sideways_rsi_required': False}.
