[I 2025-09-01 05:42:56,735] Trial 577 finished with values: [-1000000000.0, 1000000000.0] and parameters: {'p_sma': 32, 'p_std': 38, 'p_atr': 8, 'p_adx': 18, 'rsi_period': 56, 'ema1': 24, 'ema2': 33, 'slip_atr_k': 0.020293469043948038, 'slip_spread_k': 0.3985473341787607, 'spread_hl_frac': 0.03717782164489295, 'bb_std_mult': 1.9662750431125327, 'rsi_os': 55, 'rsi_ob': 88, 'vol_spike': 0.08661815438397187, 'adx_thresh': 12.135190527918569, 'atr_min_pct': 0.0036680158139185846, 'atr_max_pct': 0.11960630332414324, 'tp_mult': 1.4646923415173314, 'tsl_mult': 0.8900686895353543, 'strategy': 'mean_reversion', 'time_stop': 174, 'use_sma': False, 'use_atr': True, 'use_adx': False, 'use_ema': False, 'use_spike': False, 'rsi_required': False, 'edge_k': 0.12417439347435888, 'edge_cap': 0.5111981951445126, 'bull_strategy': 'breakout', 'bull_bb_std_mult': 0.8413058168337746, 'bull_rsi_os': 38, 'bull_rsi_ob': 90, 'bull_adx_thresh': 21.526412632782133, 'bull_atr_min_pct': 0.010958852012354938, 'bull_atr_max_pct': 0.08073555989890606, 'bull_tp_mult': 1.2471876975027918, 'bull_tsl_mult': 0.2505418484796827, 'bull_time_stop': 63, 'bull_use_sma': True, 'bull_use_ema': True, 'bull_use_atr': True, 'bull_use_adx': True, 'bull_use_spike': True, 'bull_rsi_required': False, 'bear_strategy': 'breakout', 'bear_bb_std_mult': 3.5309141934122463, 'bear_rsi_os': 9, 'bear_rsi_ob': 87, 'bear_adx_thresh': 23.962348616656413, 'bear_atr_min_pct': 0.008263501794807549, 'bear_atr_max_pct': 0.06336257728941753, 'bear_tp_mult': 1.2225892177612188, 'bear_tsl_mult': 0.6406583427597677, 'bear_time_stop': 203, 'bear_use_sma': False, 'bear_use_ema': False, 'bear_use_atr': False, 'bear_use_adx': False, 'bear_use_spike': True, 'bear_rsi_required': False, 'sideways_strategy': 'mean_reversion', 'sideways_bb_std_mult': 0.740165321673375, 'sideways_rsi_os': 43, 'sideways_rsi_ob': 52, 'sideways_adx_thresh': 11.57594375528403, 'sideways_atr_min_pct': 0.016886207137111447, 'sideways_atr_max_pct': 0.09998971943305503, 'sideways_tp_mult': 1.4632713003184221, 'sideways_tsl_mult': 0.8511140730142245, 'sideways_time_stop': 30, 'sideways_use_sma': False, 'sideways_use_ema': False, 'sideways_use_atr': True, 'sideways_use_adx': False, 'sideways_use_spike': True, 'sideways_rsi_required': True}.
[I 2025-09-01 05:43:40,503] Trial 578 finished with values: [-1000000000.0, 1000000000.0] and parameters: {'p_sma': 42, 'p_std': 22, 'p_atr': 8, 'p_adx': 18, 'rsi_period': 55, 'ema1': 24, 'ema2': 39, 'slip_atr_k': 0.0268940531083387, 'slip_spread_k': 0.397337944491089, 'spread_hl_frac': 2.8541689488417732e-05, 'bb_std_mult': 1.9558288680760438, 'rsi_os': 23, 'rsi_ob': 88, 'vol_spike': 0.1515378269934465, 'adx_thresh': 13.535324012519437, 'atr_min_pct': 0.0036408655682026374, 'atr_max_pct': 0.022666507688417853, 'tp_mult': 2.817629264853431, 'tsl_mult': 0.8862667732159939, 'strategy': 'mean_reversion', 'time_stop': 171, 'use_sma': False, 'use_atr': True, 'use_adx': False, 'use_ema': False, 'use_spike': False, 'rsi_required': False, 'edge_k': 0.12095923882550687, 'edge_cap': 0.5086591460267277, 'bull_strategy': 'breakout', 'bull_bb_std_mult': 1.516407428097105, 'bull_rsi_os': 51, 'bull_rsi_ob': 62, 'bull_adx_thresh': 5.89847443591407, 'bull_atr_min_pct': 0.017699539675375228, 'bull_atr_max_pct': 0.14725397856065875, 'bull_tp_mult': 2.6147737896552696, 'bull_tsl_mult': 0.25211469403618525, 'bull_time_stop': 107, 'bull_use_sma': True, 'bull_use_ema': True, 'bull_use_atr': True, 'bull_use_adx': True, 'bull_use_spike': True, 'bull_rsi_required': False, 'bear_strategy': 'breakout', 'bear_bb_std_mult': 3.5235212292751554, 'bear_rsi_os': 9, 'bear_rsi_ob': 87, 'bear_adx_thresh': 24.19636805938363, 'bear_atr_min_pct': 0.008516424712815406, 'bear_atr_max_pct': 0.06543232346500448, 'bear_tp_mult': 1.217444454563869, 'bear_tsl_mult': 0.02327399048082457, 'bear_time_stop': 73, 'bear_use_sma': False, 'bear_use_ema': False, 'bear_use_atr': False, 'bear_use_adx': False, 'bear_use_spike': True, 'bear_rsi_required': False, 'sideways_strategy': 'mean_reversion', 'sideways_bb_std_mult': 0.7487423546496577, 'sideways_rsi_os': 43, 'sideways_rsi_ob': 52, 'sideways_adx_thresh': 22.882941558308495, 'sideways_atr_min_pct': 0.01675481170393683, 'sideways_atr_max_pct': 0.06851520782694685, 'sideways_tp_mult': 1.4663209492425364, 'sideways_tsl_mult': 0.9782669920954471, 'sideways_time_stop': 177, 'sideways_use_sma': False, 'sideways_use_ema': False, 'sideways_use_atr': True, 'sideways_use_adx': False, 'sideways_use_spike': True, 'sideways_rsi_required': True}.
[I 2025-09-01 05:43:40,505] Trial 579 finished with values: [-1000000000.0, 1000000000.0] and parameters: {'p_sma': 56, 'p_std': 22, 'p_atr': 12, 'p_adx': 16, 'rsi_period': 41, 'ema1': 16, 'ema2': 33, 'slip_atr_k': 0.06276892269919512, 'slip_spread_k': 0.4226988104497212, 'spread_hl_frac': 0.027016451651721306, 'bb_std_mult': 2.1429206416328914, 'rsi_os': 14, 'rsi_ob': 52, 'vol_spike': 0.2168528160354807, 'adx_thresh': 11.825754839722645, 'atr_min_pct': 0.014585656659800897, 'atr_max_pct': 0.07253069743493193, 'tp_mult': 2.520330075537248, 'tsl_mult': 0.8936850145939376, 'strategy': 'mean_reversion', 'time_stop': 172, 'use_sma': False, 'use_atr': True, 'use_adx': False, 'use_ema': False, 'use_spike': False, 'rsi_required': False, 'edge_k': 0.12583080177474193, 'edge_cap': 0.7067295601035661, 'bull_strategy': 'breakout', 'bull_bb_std_mult': 0.8561040300880977, 'bull_rsi_os': 55, 'bull_rsi_ob': 91, 'bull_adx_thresh': 31.33100758882258, 'bull_atr_min_pct': 0.011814075100524792, 'bull_atr_max_pct': 0.14673204986531152, 'bull_tp_mult': 1.266592335910352, 'bull_tsl_mult': 0.24827865891735, 'bull_time_stop': 286, 'bull_use_sma': True, 'bull_use_ema': True, 'bull_use_atr': True, 'bull_use_adx': True, 'bull_use_spike': True, 'bull_rsi_required': False, 'bear_strategy': 'breakout', 'bear_bb_std_mult': 2.793637205311925, 'bear_rsi_os': 8, 'bear_rsi_ob': 81, 'bear_adx_thresh': 24.03022456931228, 'bear_atr_min_pct': 0.019054942153071894, 'bear_atr_max_pct': 0.06300266209021806, 'bear_tp_mult': 1.3733325799585594, 'bear_tsl_mult': 0.6278904034150502, 'bear_time_stop': 203, 'bear_use_sma': False, 'bear_use_ema': False, 'bear_use_atr': False, 'bear_use_adx': False, 'bear_use_spike': True, 'bear_rsi_required': False, 'sideways_strategy': 'mean_reversion', 'sideways_bb_std_mult': 2.8013258623092714, 'sideways_rsi_os': 43, 'sideways_rsi_ob': 53, 'sideways_adx_thresh': 24.546589008449715, 'sideways_atr_min_pct': 0.0037516126568286007, 'sideways_atr_max_pct': 0.06767981240001542, 'sideways_tp_mult': 2.075680223992325, 'sideways_tsl_mult': 0.6577004617437107, 'sideways_time_stop': 170, 'sideways_use_sma': False, 'sideways_use_ema': False, 'sideways_use_atr': True, 'sideways_use_adx': False, 'sideways_use_spike': True, 'sideways_rsi_required': True}.
[I 2025-09-01 05:43:40,761] Trial 576 finished with values: [-1000000000.0, 1000000000.0] and parameters: {'p_sma': 58, 'p_std': 37, 'p_atr': 8, 'p_adx': 18, 'rsi_period': 56, 'ema1': 25, 'ema2': 45, 'slip_atr_k': 0.017948150574288318, 'slip_spread_k': 0.3944679708772288, 'spread_hl_frac': 0.045460849617911935, 'bb_std_mult': 1.9533677579081605, 'rsi_os': 26, 'rsi_ob': 87, 'vol_spike': 0.1940424600972967, 'adx_thresh': 30.25126449360745, 'atr_min_pct': 0.008483065556827967, 'atr_max_pct': 0.11904867225404768, 'tp_mult': 2.3410380057541094, 'tsl_mult': 0.9321422849300923, 'strategy': 'breakout', 'time_stop': 112, 'use_sma': False, 'use_atr': True, 'use_adx': True, 'use_ema': True, 'use_spike': False, 'rsi_required': False, 'edge_k': 0.8739436917227466, 'edge_cap': 0.7363634027095087, 'bull_strategy': 'breakout', 'bull_bb_std_mult': 2.699657389955008, 'bull_rsi_os': 11, 'bull_rsi_ob': 74, 'bull_adx_thresh': 5.927631291633705, 'bull_atr_min_pct': 0.010893964428546319, 'bull_atr_max_pct': 0.11416895197578289, 'bull_tp_mult': 1.2649930711008825, 'bull_tsl_mult': 0.9554094398310607, 'bull_time_stop': 91, 'bull_use_sma': False, 'bull_use_ema': False, 'bull_use_atr': False, 'bull_use_adx': True, 'bull_use_spike': True, 'bull_rsi_required': True, 'bear_strategy': 'breakout', 'bear_bb_std_mult': 1.378487651439621, 'bear_rsi_os': 20, 'bear_rsi_ob': 68, 'bear_adx_thresh': 28.241373360435855, 'bear_atr_min_pct': 0.014627752053198252, 'bear_atr_max_pct': 0.11942237747424483, 'bear_tp_mult': 1.2723331202227566, 'bear_tsl_mult': 0.6445637284841658, 'bear_time_stop': 91, 'bear_use_sma': False, 'bear_use_ema': False, 'bear_use_atr': False, 'bear_use_adx': False, 'bear_use_spike': True, 'bear_rsi_required': False, 'sideways_strategy': 'mean_reversion', 'sideways_bb_std_mult': 0.6919748860211709, 'sideways_rsi_os': 31, 'sideways_rsi_ob': 52, 'sideways_adx_thresh': 22.82884021453504, 'sideways_atr_min_pct': 0.0035025912095703327, 'sideways_atr_max_pct': 0.1374347460378373, 'sideways_tp_mult': 1.5756893300923431, 'sideways_tsl_mult': 0.9810852772404859, 'sideways_time_stop': 187, 'sideways_use_sma': False, 'sideways_use_ema': True, 'sideways_use_atr': True, 'sideways_use_adx': True, 'sideways_use_spike': True, 'sideways_rsi_required': True}.
[I 2025-09-01 05:43:41,796] Trial 580 finished with values: [-1000000000.0, 1000000000.0] and parameters: {'p_sma': 45, 'p_std': 34, 'p_atr': 18, 'p_adx': 18, 'rsi_period': 31, 'ema1': 16, 'ema2': 31, 'slip_atr_k': 0.1329210378808995, 'slip_spread_k': 0.4247141247023866, 'spread_hl_frac': 0.04534630523289276, 'bb_std_mult': 2.133869416841135, 'rsi_os': 14, 'rsi_ob': 87, 'vol_spike': 0.21658150563465958, 'adx_thresh': 14.77309480264281, 'atr_min_pct': 0.0030749291099066095, 'atr_max_pct': 0.11657727861740513, 'tp_mult': 2.992789711224288, 'tsl_mult': 0.9409561757132159, 'strategy': 'breakout', 'time_stop': 171, 'use_sma': False, 'use_atr': True, 'use_adx': False, 'use_ema': True, 'use_spike': True, 'rsi_required': False, 'edge_k': 0.8671030112283902, 'edge_cap': 0.05066923347375757, 'bull_strategy': 'breakout', 'bull_bb_std_mult': 1.5066541929828126, 'bull_rsi_os': 55, 'bull_rsi_ob': 76, 'bull_adx_thresh': 5.8445284024984, 'bull_atr_min_pct': 0.007006227637401861, 'bull_atr_max_pct': 0.028082519229693, 'bull_tp_mult': 1.2556832195198293, 'bull_tsl_mult': 0.7801063040643932, 'bull_time_stop': 107, 'bull_use_sma': True, 'bull_use_ema': False, 'bull_use_atr': False, 'bull_use_adx': True, 'bull_use_spike': False, 'bull_rsi_required': True, 'bear_strategy': 'breakout', 'bear_bb_std_mult': 1.731867800026203, 'bear_rsi_os': 20, 'bear_rsi_ob': 67, 'bear_adx_thresh': 29.338549274065134, 'bear_atr_min_pct': 0.007201716007264032, 'bear_atr_max_pct': 0.07165325575749719, 'bear_tp_mult': 1.5884181093751526, 'bear_tsl_mult': 0.025139486804316824, 'bear_time_stop': 125, 'bear_use_sma': True, 'bear_use_ema': False, 'bear_use_atr': False, 'bear_use_adx': True, 'bear_use_spike': False, 'bear_rsi_required': False, 'sideways_strategy': 'mean_reversion', 'sideways_bb_std_mult': 0.6670525975166537, 'sideways_rsi_os': 21, 'sideways_rsi_ob': 75, 'sideways_adx_thresh': 24.41684553510341, 'sideways_atr_min_pct': 0.0034199136307694828, 'sideways_atr_max_pct': 0.10779852679535404, 'sideways_tp_mult': 1.5760775053064848, 'sideways_tsl_mult': 0.9800136192118724, 'sideways_time_stop': 169, 'sideways_use_sma': False, 'sideways_use_ema': False, 'sideways_use_atr': True, 'sideways_use_adx': False, 'sideways_use_spike': True, 'sideways_rsi_required': True}.
[I 2025-09-01 05:44:29,835] Trial 583 finished with values: [-1000000000.0, 1000000000.0] and parameters: {'p_sma': 60, 'p_std': 32, 'p_atr': 7, 'p_adx': 30, 'rsi_period': 31, 'ema1': 15, 'ema2': 51, 'slip_atr_k': 0.13134864650023348, 'slip_spread_k': 0.83429840039592, 'spread_hl_frac': 0.047732620782992834, 'bb_std_mult': 2.104114765056197, 'rsi_os': 41, 'rsi_ob': 90, 'vol_spike': 0.21849634762073505, 'adx_thresh': 8.69290756442125, 'atr_min_pct': 0.002949672428516497, 'atr_max_pct': 0.11632258793167795, 'tp_mult': 1.8267009271152879, 'tsl_mult': 0.9504760174437807, 'strategy': 'breakout', 'time_stop': 179, 'use_sma': False, 'use_atr': True, 'use_adx': False, 'use_ema': True, 'use_spike': True, 'rsi_required': False, 'edge_k': 0.9808206804983696, 'edge_cap': 0.44189839417147675, 'bull_strategy': 'mean_reversion', 'bull_bb_std_mult': 3.3059677562493777, 'bull_rsi_os': 49, 'bull_rsi_ob': 89, 'bull_adx_thresh': 29.76311137940689, 'bull_atr_min_pct': 0.005673861023099663, 'bull_atr_max_pct': 0.028637972981505083, 'bull_tp_mult': 1.8486858309064889, 'bull_tsl_mult': 0.21942405024082562, 'bull_time_stop': 85, 'bull_use_sma': True, 'bull_use_ema': False, 'bull_use_atr': False, 'bull_use_adx': True, 'bull_use_spike': False, 'bull_rsi_required': True, 'bear_strategy': 'breakout', 'bear_bb_std_mult': 3.4370656041445034, 'bear_rsi_os': 8, 'bear_rsi_ob': 67, 'bear_adx_thresh': 29.44834443757872, 'bear_atr_min_pct': 0.007022216516968214, 'bear_atr_max_pct': 0.07239300946673076, 'bear_tp_mult': 1.8366730739238726, 'bear_tsl_mult': 0.9255683449448701, 'bear_time_stop': 41, 'bear_use_sma': True, 'bear_use_ema': True, 'bear_use_atr': False, 'bear_use_adx': True, 'bear_use_spike': False, 'bear_rsi_required': True, 'sideways_strategy': 'breakout', 'sideways_bb_std_mult': 0.8423171350028869, 'sideways_rsi_os': 45, 'sideways_rsi_ob': 75, 'sideways_adx_thresh': 21.981677987594338, 'sideways_atr_min_pct': 0.005950422093103226, 'sideways_atr_max_pct': 0.10718008525639175, 'sideways_tp_mult': 1.658567265789205, 'sideways_tsl_mult': 0.9352428078042786, 'sideways_time_stop': 168, 'sideways_use_sma': False, 'sideways_use_ema': True, 'sideways_use_atr': True, 'sideways_use_adx': False, 'sideways_use_spike': False, 'sideways_rsi_required': True}.
[I 2025-09-01 05:44:30,489] Trial 582 finished with values: [-1000000000.0, 1000000000.0] and parameters: {'p_sma': 60, 'p_std': 34, 'p_atr': 7, 'p_adx': 26, 'rsi_period': 30, 'ema1': 15, 'ema2': 31, 'slip_atr_k': 0.13103784692341117, 'slip_spread_k': 0.6504618874518182, 'spread_hl_frac': 0.04801990808706777, 'bb_std_mult': 2.0838011829286107, 'rsi_os': 10, 'rsi_ob': 90, 'vol_spike': 0.17961783241718576, 'adx_thresh': 25.848664034835753, 'atr_min_pct': 0.01194540622863359, 'atr_max_pct': 0.015408908630295023, 'tp_mult': 1.3999518478843216, 'tsl_mult': 0.42187067103933606, 'strategy': 'breakout', 'time_stop': 181, 'use_sma': False, 'use_atr': True, 'use_adx': False, 'use_ema': True, 'use_spike': True, 'rsi_required': False, 'edge_k': 0.003662016262677259, 'edge_cap': 0.2702529201615278, 'bull_strategy': 'mean_reversion', 'bull_bb_std_mult': 0.9432532268081615, 'bull_rsi_os': 49, 'bull_rsi_ob': 89, 'bull_adx_thresh': 5.490977865754113, 'bull_atr_min_pct': 0.022108665020034186, 'bull_atr_max_pct': 0.05762768320492474, 'bull_tp_mult': 2.9115325137056676, 'bull_tsl_mult': 0.21039392400918228, 'bull_time_stop': 83, 'bull_use_sma': True, 'bull_use_ema': False, 'bull_use_atr': False, 'bull_use_adx': True, 'bull_use_spike': False, 'bull_rsi_required': True, 'bear_strategy': 'breakout', 'bear_bb_std_mult': 1.706469053386885, 'bear_rsi_os': 23, 'bear_rsi_ob': 67, 'bear_adx_thresh': 29.357912319240036, 'bear_atr_min_pct': 0.0073872778414780915, 'bear_atr_max_pct': 0.07134652518178342, 'bear_tp_mult': 1.3219510874296103, 'bear_tsl_mult': 0.8740209579293183, 'bear_time_stop': 252, 'bear_use_sma': True, 'bear_use_ema': True, 'bear_use_atr': False, 'bear_use_adx': True, 'bear_use_spike': False, 'bear_rsi_required': True, 'sideways_strategy': 'breakout', 'sideways_bb_std_mult': 0.5691046822556487, 'sideways_rsi_os': 15, 'sideways_rsi_ob': 66, 'sideways_adx_thresh': 21.78067371696611, 'sideways_atr_min_pct': 0.005822159238371125, 'sideways_atr_max_pct': 0.04191798134586344, 'sideways_tp_mult': 1.6689642643058444, 'sideways_tsl_mult': 0.944330644496453, 'sideways_time_stop': 166, 'sideways_use_sma': False, 'sideways_use_ema': True, 'sideways_use_atr': True, 'sideways_use_adx': False, 'sideways_use_spike': False, 'sideways_rsi_required': True}.
[I 2025-09-01 05:44:30,525] Trial 584 finished with values: [-1000000000.0, 1000000000.0] and parameters: {'p_sma': 60, 'p_std': 32, 'p_atr': 7, 'p_adx': 12, 'rsi_period': 53, 'ema1': 21, 'ema2': 51, 'slip_atr_k': 0.04219138287784607, 'slip_spread_k': 0.8341899503536374, 'spread_hl_frac': 0.023642249998011025, 'bb_std_mult': 1.868792653650521, 'rsi_os': 24, 'rsi_ob': 62, 'vol_spike': 0.20564041022007545, 'adx_thresh': 31.909533511118077, 'atr_min_pct': 0.0157072237051432, 'atr_max_pct': 0.12527622523900775, 'tp_mult': 2.396403458588898, 'tsl_mult': 0.03579994744866716, 'strategy': 'breakout', 'time_stop': 191, 'use_sma': False, 'use_atr': True, 'use_adx': False, 'use_ema': True, 'use_spike': True, 'rsi_required': False, 'edge_k': 0.183254877532744, 'edge_cap': 0.4672339219753939, 'bull_strategy': 'mean_reversion', 'bull_bb_std_mult': 0.7903712785530701, 'bull_rsi_os': 49, 'bull_rsi_ob': 93, 'bull_adx_thresh': 6.51032589783857, 'bull_atr_min_pct': 0.026595030531796928, 'bull_atr_max_pct': 0.05783876717266265, 'bull_tp_mult': 1.2129152468670774, 'bull_tsl_mult': 0.21890713368088166, 'bull_time_stop': 84, 'bull_use_sma': True, 'bull_use_ema': False, 'bull_use_atr': False, 'bull_use_adx': True, 'bull_use_spike': False, 'bull_rsi_required': True, 'bear_strategy': 'breakout', 'bear_bb_std_mult': 3.5968281373926354, 'bear_rsi_os': 7, 'bear_rsi_ob': 94, 'bear_adx_thresh': 30.362304925445883, 'bear_atr_min_pct': 0.009394040065294597, 'bear_atr_max_pct': 0.0731169836729993, 'bear_tp_mult': 1.8073941247022083, 'bear_tsl_mult': 0.7579562417376017, 'bear_time_stop': 215, 'bear_use_sma': True, 'bear_use_ema': True, 'bear_use_atr': False, 'bear_use_adx': True, 'bear_use_spike': False, 'bear_rsi_required': True, 'sideways_strategy': 'breakout', 'sideways_bb_std_mult': 0.8680221022117326, 'sideways_rsi_os': 29, 'sideways_rsi_ob': 55, 'sideways_adx_thresh': 31.067896023782353, 'sideways_atr_min_pct': 0.008599384969266717, 'sideways_atr_max_pct': 0.1057634664730208, 'sideways_tp_mult': 1.6680023759628066, 'sideways_tsl_mult': 0.9458564539054327, 'sideways_time_stop': 178, 'sideways_use_sma': False, 'sideways_use_ema': True, 'sideways_use_atr': True, 'sideways_use_adx': False, 'sideways_use_spike': False, 'sideways_rsi_required': True}.
[I 2025-09-01 05:44:31,522] Trial 581 finished with values: [-1000000000.0, 1000000000.0] and parameters: {'p_sma': 60, 'p_std': 34, 'p_atr': 20, 'p_adx': 26, 'rsi_period': 21, 'ema1': 25, 'ema2': 31, 'slip_atr_k': 0.017054543820422388, 'slip_spread_k': 0.35219068188909625, 'spread_hl_frac': 0.04780125982725927, 'bb_std_mult': 2.114487089811442, 'rsi_os': 9, 'rsi_ob': 87, 'vol_spike': 0.2165587641288557, 'adx_thresh': 32.37279960150161, 'atr_min_pct': 0.002996096318986746, 'atr_max_pct': 0.11765821556304318, 'tp_mult': 1.8372007003310273, 'tsl_mult': 0.9369635863295115, 'strategy': 'breakout', 'time_stop': 179, 'use_sma': False, 'use_atr': True, 'use_adx': False, 'use_ema': True, 'use_spike': True, 'rsi_required': False, 'edge_k': 0.1840217014354602, 'edge_cap': 0.47928749096778706, 'bull_strategy': 'breakout', 'bull_bb_std_mult': 0.7712758360747901, 'bull_rsi_os': 49, 'bull_rsi_ob': 69, 'bull_adx_thresh': 8.219250093828226, 'bull_atr_min_pct': 0.007040065614463289, 'bull_atr_max_pct': 0.06714659195899918, 'bull_tp_mult': 1.226652475948123, 'bull_tsl_mult': 0.2195244272665292, 'bull_time_stop': 84, 'bull_use_sma': True, 'bull_use_ema': False, 'bull_use_atr': False, 'bull_use_adx': True, 'bull_use_spike': False, 'bull_rsi_required': True, 'bear_strategy': 'breakout', 'bear_bb_std_mult': 3.422788794585656, 'bear_rsi_os': 7, 'bear_rsi_ob': 69, 'bear_adx_thresh': 29.37234574762033, 'bear_atr_min_pct': 0.0020981719295405897, 'bear_atr_max_pct': 0.07057440382518419, 'bear_tp_mult': 1.3306728731941753, 'bear_tsl_mult': 0.6050164263352822, 'bear_time_stop': 279, 'bear_use_sma': True, 'bear_use_ema': False, 'bear_use_atr': False, 'bear_use_adx': True, 'bear_use_spike': False, 'bear_rsi_required': False, 'sideways_strategy': 'breakout', 'sideways_bb_std_mult': 0.6599169604491834, 'sideways_rsi_os': 15, 'sideways_rsi_ob': 78, 'sideways_adx_thresh': 12.763275962673273, 'sideways_atr_min_pct': 0.002262807865765845, 'sideways_atr_max_pct': 0.041838347407522535, 'sideways_tp_mult': 1.5867575387520465, 'sideways_tsl_mult': 0.9819248202059775, 'sideways_time_stop': 168, 'sideways_use_sma': False, 'sideways_use_ema': True, 'sideways_use_atr': True, 'sideways_use_adx': False, 'sideways_use_spike': True, 'sideways_rsi_required': True}.
