[I 2025-09-01 05:36:49,014] Trial 543 finished with values: [-0.02740239430595559, 0.027614253565527918] and parameters: {'p_sma': 59, 'p_std': 30, 'p_atr': 7, 'p_adx': 17, 'rsi_period': 75, 'ema1': 24, 'ema2': 42, 'slip_atr_k': 0.07436571099618511, 'slip_spread_k': 0.4341659890167639, 'spread_hl_frac': 0.020272375032568214, 'bb_std_mult': 2.7388319126254945, 'rsi_os': 43, 'rsi_ob': 90, 'vol_spike': 0.202417157132626, 'adx_thresh': 14.394414708576434, 'atr_min_pct': 0.016047698134496375, 'atr_max_pct': 0.11740773304918312, 'tp_mult': 2.5556614735979943, 'tsl_mult': 0.8797313969253621, 'strategy': 'mean_reversion', 'time_stop': 176, 'use_sma': False, 'use_atr': True, 'use_adx': True, 'use_ema': True, 'use_spike': True, 'rsi_required': True, 'edge_k': 0.2775279975199787, 'edge_cap': 0.5278383883007504, 'bull_strategy': 'breakout', 'bull_bb_std_mult': 0.9770471697070671, 'bull_rsi_os': 52, 'bull_rsi_ob': 50, 'bull_adx_thresh': 5.591368092921086, 'bull_atr_min_pct': 0.011878886017326125, 'bull_atr_max_pct': 0.11212606816637263, 'bull_tp_mult': 1.3766478699577929, 'bull_tsl_mult': 0.10861115256540266, 'bull_time_stop': 114, 'bull_use_sma': True, 'bull_use_ema': False, 'bull_use_atr': True, 'bull_use_adx': True, 'bull_use_spike': True, 'bull_rsi_required': False, 'bear_strategy': 'breakout', 'bear_bb_std_mult': 2.927674921524775, 'bear_rsi_os': 53, 'bear_rsi_ob': 49, 'bear_adx_thresh': 28.353450237935384, 'bear_atr_min_pct': 0.006261536718799348, 'bear_atr_max_pct': 0.018355565612638243, 'bear_tp_mult': 2.3819897451864565, 'bear_tsl_mult': 0.6015059660657425, 'bear_time_stop': 154, 'bear_use_sma': False, 'bear_use_ema': False, 'bear_use_atr': False, 'bear_use_adx': True, 'bear_use_spike': True, 'bear_rsi_required': False, 'sideways_strategy': 'mean_reversion', 'sideways_bb_std_mult': 0.6208885230866154, 'sideways_rsi_os': 46, 'sideways_rsi_ob': 51, 'sideways_adx_thresh': 30.65556589251556, 'sideways_atr_min_pct': 0.004047396140507986, 'sideways_atr_max_pct': 0.04652321197987964, 'sideways_tp_mult': 2.623664399110866, 'sideways_tsl_mult': 0.5011509845696279, 'sideways_time_stop': 232, 'sideways_use_sma': False, 'sideways_use_ema': False, 'sideways_use_atr': True, 'sideways_use_adx': False, 'sideways_use_spike': False, 'sideways_rsi_required': True}.
[I 2025-09-01 05:36:50,895] Trial 541 finished with values: [-0.0913726653079373, 0.0912154012671935] and parameters: {'p_sma': 59, 'p_std': 30, 'p_atr': 8, 'p_adx': 17, 'rsi_period': 82, 'ema1': 24, 'ema2': 43, 'slip_atr_k': 0.02482974736585769, 'slip_spread_k': 0.4372846603842506, 'spread_hl_frac': 0.012895251591942507, 'bb_std_mult': 2.723620666796133, 'rsi_os': 37, 'rsi_ob': 90, 'vol_spike': 0.00881859761571191, 'adx_thresh': 14.39935838553154, 'atr_min_pct': 0.0032976767575490775, 'atr_max_pct': 0.04084597875643133, 'tp_mult': 2.556834262667687, 'tsl_mult': 0.8775793719207738, 'strategy': 'mean_reversion', 'time_stop': 178, 'use_sma': True, 'use_atr': True, 'use_adx': False, 'use_ema': True, 'use_spike': False, 'rsi_required': True, 'edge_k': 0.2623410264138779, 'edge_cap': 0.5245492852478802, 'bull_strategy': 'mean_reversion', 'bull_bb_std_mult': 0.9678458424371982, 'bull_rsi_os': 48, 'bull_rsi_ob': 92, 'bull_adx_thresh': 7.724559187416357, 'bull_atr_min_pct': 0.014809431911028056, 'bull_atr_max_pct': 0.1131198551281294, 'bull_tp_mult': 1.3375203574881152, 'bull_tsl_mult': 0.20448703257989784, 'bull_time_stop': 173, 'bull_use_sma': True, 'bull_use_ema': False, 'bull_use_atr': True, 'bull_use_adx': True, 'bull_use_spike': False, 'bull_rsi_required': False, 'bear_strategy': 'breakout', 'bear_bb_std_mult': 3.542607345629779, 'bear_rsi_os': 9, 'bear_rsi_ob': 68, 'bear_adx_thresh': 28.93701780971297, 'bear_atr_min_pct': 0.005698307292617078, 'bear_atr_max_pct': 0.1344812133371883, 'bear_tp_mult': 1.2406045235801095, 'bear_tsl_mult': 0.6076579852095257, 'bear_time_stop': 201, 'bear_use_sma': False, 'bear_use_ema': True, 'bear_use_atr': False, 'bear_use_adx': False, 'bear_use_spike': True, 'bear_rsi_required': True, 'sideways_strategy': 'breakout', 'sideways_bb_std_mult': 2.2380763194916415, 'sideways_rsi_os': 46, 'sideways_rsi_ob': 51, 'sideways_adx_thresh': 22.087972789031163, 'sideways_atr_min_pct': 0.001430195102824423, 'sideways_atr_max_pct': 0.06618681629553601, 'sideways_tp_mult': 1.4634376399979947, 'sideways_tsl_mult': 0.9999224097603617, 'sideways_time_stop': 162, 'sideways_use_sma': False, 'sideways_use_ema': True, 'sideways_use_atr': True, 'sideways_use_adx': False, 'sideways_use_spike': False, 'sideways_rsi_required': True}.
[I 2025-09-01 05:36:50,896] Trial 540 finished with values: [-1000000000.0, 1000000000.0] and parameters: {'p_sma': 58, 'p_std': 30, 'p_atr': 8, 'p_adx': 17, 'rsi_period': 56, 'ema1': 24, 'ema2': 42, 'slip_atr_k': 0.024669090402268543, 'slip_spread_k': 0.4335716595591098, 'spread_hl_frac': 0.04759830158224786, 'bb_std_mult': 1.9815445081571061, 'rsi_os': 35, 'rsi_ob': 93, 'vol_spike': 0.20795600730092614, 'adx_thresh': 11.370255530236673, 'atr_min_pct': 0.02799695613726404, 'atr_max_pct': 0.1454541857653504, 'tp_mult': 2.6555295889608974, 'tsl_mult': 0.23694509343373316, 'strategy': 'mean_reversion', 'time_stop': 178, 'use_sma': False, 'use_atr': True, 'use_adx': False, 'use_ema': True, 'use_spike': True, 'rsi_required': False, 'edge_k': 0.2654399534328723, 'edge_cap': 0.5183054107846143, 'bull_strategy': 'breakout', 'bull_bb_std_mult': 0.9687390524237223, 'bull_rsi_os': 48, 'bull_rsi_ob': 88, 'bull_adx_thresh': 6.405969993874195, 'bull_atr_min_pct': 0.012625009903616312, 'bull_atr_max_pct': 0.11272032125379003, 'bull_tp_mult': 1.336767892152606, 'bull_tsl_mult': 0.27416183855727333, 'bull_time_stop': 137, 'bull_use_sma': True, 'bull_use_ema': False, 'bull_use_atr': True, 'bull_use_adx': True, 'bull_use_spike': False, 'bull_rsi_required': False, 'bear_strategy': 'breakout', 'bear_bb_std_mult': 3.4804950756070325, 'bear_rsi_os': 10, 'bear_rsi_ob': 69, 'bear_adx_thresh': 28.764404869309903, 'bear_atr_min_pct': 0.005110351752807935, 'bear_atr_max_pct': 0.04019764737228935, 'bear_tp_mult': 2.3177352054475913, 'bear_tsl_mult': 0.612249728010328, 'bear_time_stop': 154, 'bear_use_sma': True, 'bear_use_ema': False, 'bear_use_atr': False, 'bear_use_adx': False, 'bear_use_spike': False, 'bear_rsi_required': False, 'sideways_strategy': 'breakout', 'sideways_bb_std_mult': 1.8741453132828427, 'sideways_rsi_os': 46, 'sideways_rsi_ob': 83, 'sideways_adx_thresh': 21.805104796104843, 'sideways_atr_min_pct': 0.004651106788599704, 'sideways_atr_max_pct': 0.10740637513632935, 'sideways_tp_mult': 2.459244604099195, 'sideways_tsl_mult': 0.3346837948124348, 'sideways_time_stop': 163, 'sideways_use_sma': False, 'sideways_use_ema': True, 'sideways_use_atr': True, 'sideways_use_adx': False, 'sideways_use_spike': True, 'sideways_rsi_required': True}.
[I 2025-09-01 05:36:51,099] Trial 542 finished with values: [-0.025008790291780825, 0.024850286685522683] and parameters: {'p_sma': 59, 'p_std': 8, 'p_atr': 8, 'p_adx': 27, 'rsi_period': 48, 'ema1': 24, 'ema2': 31, 'slip_atr_k': 0.0710938524137718, 'slip_spread_k': 0.43565423425641614, 'spread_hl_frac': 0.04990028897622686, 'bb_std_mult': 2.0374578908045655, 'rsi_os': 28, 'rsi_ob': 92, 'vol_spike': 0.20090160009538505, 'adx_thresh': 5.018042112921547, 'atr_min_pct': 0.0033218283157080124, 'atr_max_pct': 0.11765640110525882, 'tp_mult': 2.5726080379250003, 'tsl_mult': 0.9360019161455124, 'strategy': 'mean_reversion', 'time_stop': 177, 'use_sma': True, 'use_atr': True, 'use_adx': False, 'use_ema': True, 'use_spike': False, 'rsi_required': True, 'edge_k': 0.27674328682996585, 'edge_cap': 0.523551105757766, 'bull_strategy': 'mean_reversion', 'bull_bb_std_mult': 0.9557185969426509, 'bull_rsi_os': 48, 'bull_rsi_ob': 92, 'bull_adx_thresh': 6.379418302562062, 'bull_atr_min_pct': 0.012181024900631403, 'bull_atr_max_pct': 0.07758787851246982, 'bull_tp_mult': 1.3367465964527645, 'bull_tsl_mult': 0.20530346182810147, 'bull_time_stop': 102, 'bull_use_sma': True, 'bull_use_ema': False, 'bull_use_atr': True, 'bull_use_adx': True, 'bull_use_spike': True, 'bull_rsi_required': False, 'bear_strategy': 'breakout', 'bear_bb_std_mult': 3.541600482982077, 'bear_rsi_os': 9, 'bear_rsi_ob': 69, 'bear_adx_thresh': 28.62774870958393, 'bear_atr_min_pct': 0.005040609085603371, 'bear_atr_max_pct': 0.1020721206171683, 'bear_tp_mult': 1.3048422545804201, 'bear_tsl_mult': 0.9534079548004905, 'bear_time_stop': 154, 'bear_use_sma': False, 'bear_use_ema': True, 'bear_use_atr': False, 'bear_use_adx': False, 'bear_use_spike': True, 'bear_rsi_required': True, 'sideways_strategy': 'breakout', 'sideways_bb_std_mult': 0.62724932433282, 'sideways_rsi_os': 45, 'sideways_rsi_ob': 51, 'sideways_adx_thresh': 21.723266806908594, 'sideways_atr_min_pct': 0.0038783661844288423, 'sideways_atr_max_pct': 0.10398986295254946, 'sideways_tp_mult': 2.4216544512091045, 'sideways_tsl_mult': 0.9991366783892646, 'sideways_time_stop': 37, 'sideways_use_sma': False, 'sideways_use_ema': True, 'sideways_use_atr': True, 'sideways_use_adx': False, 'sideways_use_spike': False, 'sideways_rsi_required': True}.
[I 2025-09-01 05:37:39,263] Trial 547 finished with values: [-1000000000.0, 1000000000.0] and parameters: {'p_sma': 44, 'p_std': 32, 'p_atr': 9, 'p_adx': 30, 'rsi_period': 51, 'ema1': 22, 'ema2': 30, 'slip_atr_k': 0.010377995167098092, 'slip_spread_k': 0.4052550200248127, 'spread_hl_frac': 0.00959797245039431, 'bb_std_mult': 2.4954021653751624, 'rsi_os': 26, 'rsi_ob': 87, 'vol_spike': 0.2064006767194629, 'adx_thresh': 33.12016365009667, 'atr_min_pct': 0.004093181023434741, 'atr_max_pct': 0.13847625082751122, 'tp_mult': 2.4888963323110174, 'tsl_mult': 0.6005498846113894, 'strategy': 'breakout', 'time_stop': 183, 'use_sma': False, 'use_atr': True, 'use_adx': True, 'use_ema': False, 'use_spike': True, 'rsi_required': False, 'edge_k': 0.13149195624267035, 'edge_cap': 0.8607796485678756, 'bull_strategy': 'breakout', 'bull_bb_std_mult': 0.7283887605411883, 'bull_rsi_os': 45, 'bull_rsi_ob': 53, 'bull_adx_thresh': 5.700345056975539, 'bull_atr_min_pct': 0.013318500025632337, 'bull_atr_max_pct': 0.0930545181702033, 'bull_tp_mult': 1.2517130712229936, 'bull_tsl_mult': 0.23231298723921762, 'bull_time_stop': 87, 'bull_use_sma': True, 'bull_use_ema': True, 'bull_use_atr': False, 'bull_use_adx': True, 'bull_use_spike': False, 'bull_rsi_required': True, 'bear_strategy': 'breakout', 'bear_bb_std_mult': 1.7904759058102393, 'bear_rsi_os': 7, 'bear_rsi_ob': 73, 'bear_adx_thresh': 8.934743239939808, 'bear_atr_min_pct': 0.022031131599799084, 'bear_atr_max_pct': 0.06901671755666135, 'bear_tp_mult': 2.0976036775117173, 'bear_tsl_mult': 0.7376041344414233, 'bear_time_stop': 184, 'bear_use_sma': True, 'bear_use_ema': False, 'bear_use_atr': False, 'bear_use_adx': True, 'bear_use_spike': False, 'bear_rsi_required': False, 'sideways_strategy': 'mean_reversion', 'sideways_bb_std_mult': 0.8210775935689174, 'sideways_rsi_os': 44, 'sideways_rsi_ob': 95, 'sideways_adx_thresh': 24.01533041337168, 'sideways_atr_min_pct': 0.0034010571023812995, 'sideways_atr_max_pct': 0.055143801412265984, 'sideways_tp_mult': 1.654864543844257, 'sideways_tsl_mult': 0.9460399205913834, 'sideways_time_stop': 169, 'sideways_use_sma': False, 'sideways_use_ema': False, 'sideways_use_atr': True, 'sideways_use_adx': False, 'sideways_use_spike': True, 'sideways_rsi_required': True}.
[I 2025-09-01 05:37:39,985] Trial 546 finished with values: [-0.015334015693072467, 0.015256123418052955] and parameters: {'p_sma': 57, 'p_std': 21, 'p_atr': 18, 'p_adx': 15, 'rsi_period': 48, 'ema1': 24, 'ema2': 30, 'slip_atr_k': 0.011426487522092158, 'slip_spread_k': 0.40306291528917065, 'spread_hl_frac': 0.04709122630511965, 'bb_std_mult': 2.060384288489642, 'rsi_os': 29, 'rsi_ob': 46, 'vol_spike': 0.19813248661750352, 'adx_thresh': 14.131980279427971, 'atr_min_pct': 0.005877784845312815, 'atr_max_pct': 0.12116096434534716, 'tp_mult': 2.461624060425014, 'tsl_mult': 0.04593330338783225, 'strategy': 'breakout', 'time_stop': 167, 'use_sma': False, 'use_atr': True, 'use_adx': False, 'use_ema': False, 'use_spike': True, 'rsi_required': False, 'edge_k': 0.17005206245492946, 'edge_cap': 0.0678564588796346, 'bull_strategy': 'breakout', 'bull_bb_std_mult': 1.5616272544586205, 'bull_rsi_os': 45, 'bull_rsi_ob': 68, 'bull_adx_thresh': 5.583105552228322, 'bull_atr_min_pct': 0.01398551059929765, 'bull_atr_max_pct': 0.09685241138955991, 'bull_tp_mult': 1.1722148493235354, 'bull_tsl_mult': 0.20329382135255536, 'bull_time_stop': 86, 'bull_use_sma': True, 'bull_use_ema': True, 'bull_use_atr': False, 'bull_use_adx': True, 'bull_use_spike': True, 'bull_rsi_required': True, 'bear_strategy': 'breakout', 'bear_bb_std_mult': 1.7737937996368824, 'bear_rsi_os': 7, 'bear_rsi_ob': 67, 'bear_adx_thresh': 29.926041647974788, 'bear_atr_min_pct': 0.0028489207528998514, 'bear_atr_max_pct': 0.08773990048309926, 'bear_tp_mult': 1.301170196920275, 'bear_tsl_mult': 0.392188912274673, 'bear_time_stop': 234, 'bear_use_sma': True, 'bear_use_ema': False, 'bear_use_atr': False, 'bear_use_adx': True, 'bear_use_spike': False, 'bear_rsi_required': False, 'sideways_strategy': 'mean_reversion', 'sideways_bb_std_mult': 0.8256420978588, 'sideways_rsi_os': 25, 'sideways_rsi_ob': 55, 'sideways_adx_thresh': 22.55562432833219, 'sideways_atr_min_pct': 0.0032265931802931995, 'sideways_atr_max_pct': 0.10366261940270302, 'sideways_tp_mult': 1.4924104870255246, 'sideways_tsl_mult': 0.8183949787186833, 'sideways_time_stop': 169, 'sideways_use_sma': False, 'sideways_use_ema': False, 'sideways_use_atr': True, 'sideways_use_adx': False, 'sideways_use_spike': True, 'sideways_rsi_required': True}.
[I 2025-09-01 05:37:40,304] Trial 545 finished with values: [-0.029446914363453702, 0.03040152616313989] and parameters: {'p_sma': 57, 'p_std': 32, 'p_atr': 9, 'p_adx': 15, 'rsi_period': 33, 'ema1': 24, 'ema2': 30, 'slip_atr_k': 0.11945605280744753, 'slip_spread_k': 0.8138628639805026, 'spread_hl_frac': 0.047711428064704534, 'bb_std_mult': 2.0726126123107504, 'rsi_os': 26, 'rsi_ob': 87, 'vol_spike': 0.14728623232874397, 'adx_thresh': 26.740771602944907, 'atr_min_pct': 0.004019581346609829, 'atr_max_pct': 0.1388311644950911, 'tp_mult': 2.459117330636687, 'tsl_mult': 0.9347122332107944, 'strategy': 'breakout', 'time_stop': 184, 'use_sma': False, 'use_atr': True, 'use_adx': False, 'use_ema': False, 'use_spike': True, 'rsi_required': False, 'edge_k': 0.16342262670660895, 'edge_cap': 0.42034653585961956, 'bull_strategy': 'breakout', 'bull_bb_std_mult': 0.7190113897713728, 'bull_rsi_os': 51, 'bull_rsi_ob': 68, 'bull_adx_thresh': 5.60470860181029, 'bull_atr_min_pct': 0.014036591347665304, 'bull_atr_max_pct': 0.05422916327068382, 'bull_tp_mult': 2.841584729452071, 'bull_tsl_mult': 0.23046089711152262, 'bull_time_stop': 95, 'bull_use_sma': True, 'bull_use_ema': True, 'bull_use_atr': False, 'bull_use_adx': True, 'bull_use_spike': True, 'bull_rsi_required': True, 'bear_strategy': 'breakout', 'bear_bb_std_mult': 3.5444818334604875, 'bear_rsi_os': 7, 'bear_rsi_ob': 67, 'bear_adx_thresh': 16.39443825454714, 'bear_atr_min_pct': 0.0013191099249258657, 'bear_atr_max_pct': 0.028444875682909633, 'bear_tp_mult': 1.3027647411852714, 'bear_tsl_mult': 0.21785793106806178, 'bear_time_stop': 194, 'bear_use_sma': True, 'bear_use_ema': False, 'bear_use_atr': False, 'bear_use_adx': True, 'bear_use_spike': False, 'bear_rsi_required': False, 'sideways_strategy': 'mean_reversion', 'sideways_bb_std_mult': 1.9939300414511862, 'sideways_rsi_os': 45, 'sideways_rsi_ob': 55, 'sideways_adx_thresh': 23.924820210144507, 'sideways_atr_min_pct': 0.0032078011019995613, 'sideways_atr_max_pct': 0.10305522601954642, 'sideways_tp_mult': 1.645801275405701, 'sideways_tsl_mult': 0.9780348271948602, 'sideways_time_stop': 170, 'sideways_use_sma': False, 'sideways_use_ema': False, 'sideways_use_atr': True, 'sideways_use_adx': False, 'sideways_use_spike': True, 'sideways_rsi_required': True}.
[I 2025-09-01 05:37:40,963] Trial 544 finished with values: [-0.03840967911983184, 0.03823119123047338] and parameters: {'p_sma': 50, 'p_std': 32, 'p_atr': 9, 'p_adx': 18, 'rsi_period': 82, 'ema1': 22, 'ema2': 30, 'slip_atr_k': 0.21363138609818216, 'slip_spread_k': 0.3929873075213126, 'spread_hl_frac': 0.047561244147012266, 'bb_std_mult': 2.0368147254622637, 'rsi_os': 26, 'rsi_ob': 91, 'vol_spike': 0.2054909690013033, 'adx_thresh': 11.507938430692793, 'atr_min_pct': 0.003398128877836219, 'atr_max_pct': 0.14510057535126708, 'tp_mult': 2.4647865186152087, 'tsl_mult': 0.9106622280152257, 'strategy': 'mean_reversion', 'time_stop': 167, 'use_sma': False, 'use_atr': True, 'use_adx': False, 'use_ema': False, 'use_spike': True, 'rsi_required': False, 'edge_k': 0.15988890390987787, 'edge_cap': 0.8566568927474678, 'bull_strategy': 'breakout', 'bull_bb_std_mult': 0.9708922456373003, 'bull_rsi_os': 45, 'bull_rsi_ob': 88, 'bull_adx_thresh': 7.755001611531862, 'bull_atr_min_pct': 0.014684862578962902, 'bull_atr_max_pct': 0.09728214254884958, 'bull_tp_mult': 1.2536959014535183, 'bull_tsl_mult': 0.20260825579979777, 'bull_time_stop': 50, 'bull_use_sma': True, 'bull_use_ema': True, 'bull_use_atr': True, 'bull_use_adx': True, 'bull_use_spike': False, 'bull_rsi_required': False, 'bear_strategy': 'breakout', 'bear_bb_std_mult': 2.057031766851611, 'bear_rsi_os': 8, 'bear_rsi_ob': 77, 'bear_adx_thresh': 19.55652405645929, 'bear_atr_min_pct': 0.0051329545478403255, 'bear_atr_max_pct': 0.13548650603600426, 'bear_tp_mult': 2.101660407590591, 'bear_tsl_mult': 0.7328909239673594, 'bear_time_stop': 202, 'bear_use_sma': True, 'bear_use_ema': False, 'bear_use_atr': False, 'bear_use_adx': False, 'bear_use_spike': False, 'bear_rsi_required': False, 'sideways_strategy': 'breakout', 'sideways_bb_std_mult': 0.8068561591351775, 'sideways_rsi_os': 45, 'sideways_rsi_ob': 82, 'sideways_adx_thresh': 21.760534964949922, 'sideways_atr_min_pct': 0.003162668764933962, 'sideways_atr_max_pct': 0.10411123649818911, 'sideways_tp_mult': 1.4943665899019714, 'sideways_tsl_mult': 0.8140769457182361, 'sideways_time_stop': 163, 'sideways_use_sma': False, 'sideways_use_ema': True, 'sideways_use_atr': True, 'sideways_use_adx': False, 'sideways_use_spike': True, 'sideways_rsi_required': True}.
[I 2025-09-01 05:38:32,979] Trial 548 finished with values: [-1000000000.0, 1000000000.0] and parameters: {'p_sma': 10, 'p_std': 36, 'p_atr': 18, 'p_adx': 15, 'rsi_period': 69, 'ema1': 12, 'ema2': 30, 'slip_atr_k': 0.0207588293393397, 'slip_spread_k': 0.38366875972091946, 'spread_hl_frac': 0.03357323211133824, 'bb_std_mult': 2.1351829632841297, 'rsi_os': 32, 'rsi_ob': 88, 'vol_spike': 0.09937500187688847, 'adx_thresh': 26.620570016365306, 'atr_min_pct': 0.004080876052663457, 'atr_max_pct': 0.054283963693266366, 'tp_mult': 2.39349716419787, 'tsl_mult': 0.9096199302622724, 'strategy': 'breakout', 'time_stop': 168, 'use_sma': False, 'use_atr': True, 'use_adx': False, 'use_ema': False, 'use_spike': True, 'rsi_required': False, 'edge_k': 0.1654278907096724, 'edge_cap': 0.7648286685454674, 'bull_strategy': 'breakout', 'bull_bb_std_mult': 1.0623373386258907, 'bull_rsi_os': 51, 'bull_rsi_ob': 65, 'bull_adx_thresh': 5.554105803252417, 'bull_atr_min_pct': 0.014269149348434675, 'bull_atr_max_pct': 0.09667931562864573, 'bull_tp_mult': 1.1648680688823552, 'bull_tsl_mult': 0.13096518023890888, 'bull_time_stop': 52, 'bull_use_sma': True, 'bull_use_ema': True, 'bull_use_atr': False, 'bull_use_adx': True, 'bull_use_spike': False, 'bull_rsi_required': True, 'bear_strategy': 'breakout', 'bear_bb_std_mult': 3.273113692617713, 'bear_rsi_os': 8, 'bear_rsi_ob': 67, 'bear_adx_thresh': 30.52767893439822, 'bear_atr_min_pct': 0.002641719511335393, 'bear_atr_max_pct': 0.08912614491052827, 'bear_tp_mult': 1.2804809837506559, 'bear_tsl_mult': 0.2907531657488102, 'bear_time_stop': 192, 'bear_use_sma': True, 'bear_use_ema': False, 'bear_use_atr': True, 'bear_use_adx': False, 'bear_use_spike': False, 'bear_rsi_required': False, 'sideways_strategy': 'breakout', 'sideways_bb_std_mult': 0.5095206681864054, 'sideways_rsi_os': 17, 'sideways_rsi_ob': 55, 'sideways_adx_thresh': 25.02345214932061, 'sideways_atr_min_pct': 0.0054107871586009035, 'sideways_atr_max_pct': 0.09691050495729996, 'sideways_tp_mult': 1.6124734829548661, 'sideways_tsl_mult': 0.9748497536351217, 'sideways_time_stop': 172, 'sideways_use_sma': False, 'sideways_use_ema': True, 'sideways_use_atr': True, 'sideways_use_adx': False, 'sideways_use_spike': True, 'sideways_rsi_required': True}.
