[I 2025-09-01 04:29:43,577] Trial 159 finished with values: [-1000000000.0, 1000000000.0] and parameters: {'p_sma': 17, 'p_std': 56, 'p_atr': 27, 'p_adx': 19, 'rsi_period': 63, 'ema1': 16, 'ema2': 30, 'slip_atr_k': 0.014994315664992559, 'slip_spread_k': 0.2298997400530971, 'spread_hl_frac': 0.044547829647924246, 'bb_std_mult': 1.0697468333814526, 'rsi_os': 35, 'rsi_ob': 58, 'vol_spike': 0.2514452250549571, 'adx_thresh': 11.651906704947654, 'atr_min_pct': 0.0013542717815261396, 'atr_max_pct': 0.11287401477637152, 'tp_mult': 2.29593608355134, 'tsl_mult': 0.9324898831220139, 'strategy': 'breakout', 'time_stop': 13, 'use_sma': True, 'use_atr': False, 'use_adx': False, 'use_ema': True, 'use_spike': True, 'rsi_required': False, 'edge_k': 1.0718886708086526, 'edge_cap': 0.09929931410126874, 'bull_strategy': 'mean_reversion', 'bull_bb_std_mult': 2.300624985617754, 'bull_rsi_os': 31, 'bull_rsi_ob': 91, 'bull_adx_thresh': 18.004484780542022, 'bull_atr_min_pct': 0.0018893369679322035, 'bull_atr_max_pct': 0.12171684532357932, 'bull_tp_mult': 1.062410012933972, 'bull_tsl_mult': 0.4026700495667976, 'bull_time_stop': 214, 'bull_use_sma': True, 'bull_use_ema': False, 'bull_use_atr': True, 'bull_use_adx': False, 'bull_use_spike': False, 'bull_rsi_required': False, 'bear_strategy': 'mean_reversion', 'bear_bb_std_mult': 0.7154384238482376, 'bear_rsi_os': 54, 'bear_rsi_ob': 61, 'bear_adx_thresh': 12.233871492667715, 'bear_atr_min_pct': 0.02919996407728714, 'bear_atr_max_pct': 0.1425913584737186, 'bear_tp_mult': 1.120506390674306, 'bear_tsl_mult': 0.16168091237514037, 'bear_time_stop': 207, 'bear_use_sma': True, 'bear_use_ema': False, 'bear_use_atr': True, 'bear_use_adx': True, 'bear_use_spike': False, 'bear_rsi_required': False, 'sideways_strategy': 'mean_reversion', 'sideways_bb_std_mult': 1.3189212492400866, 'sideways_rsi_os': 8, 'sideways_rsi_ob': 48, 'sideways_adx_thresh': 24.59623803324717, 'sideways_atr_min_pct': 0.024153957603017414, 'sideways_atr_max_pct': 0.08895710414953123, 'sideways_tp_mult': 2.8691594510752667, 'sideways_tsl_mult': 0.9996868981575763, 'sideways_time_stop': 232, 'sideways_use_sma': True, 'sideways_use_ema': True, 'sideways_use_atr': False, 'sideways_use_adx': False, 'sideways_use_spike': False, 'sideways_rsi_required': False}.
[I 2025-09-01 04:30:32,612] Trial 163 finished with values: [-1000000000.0, 1000000000.0] and parameters: {'p_sma': 17, 'p_std': 17, 'p_atr': 25, 'p_adx': 21, 'rsi_period': 59, 'ema1': 29, 'ema2': 29, 'slip_atr_k': 0.016029535464703783, 'slip_spread_k': 0.3170642300066608, 'spread_hl_frac': 0.04417904382867304, 'bb_std_mult': 2.6065277485478924, 'rsi_os': 7, 'rsi_ob': 58, 'vol_spike': 0.25781964844429056, 'adx_thresh': 13.593720819248245, 'atr_min_pct': 0.0012238183444442485, 'atr_max_pct': 0.12376237303346603, 'tp_mult': 2.356045505359327, 'tsl_mult': 0.9000999360773639, 'strategy': 'mean_reversion', 'time_stop': 30, 'use_sma': True, 'use_atr': False, 'use_adx': False, 'use_ema': True, 'use_spike': False, 'rsi_required': False, 'edge_k': 1.829745553561444, 'edge_cap': 0.1820556385045049, 'bull_strategy': 'mean_reversion', 'bull_bb_std_mult': 2.201847549164185, 'bull_rsi_os': 31, 'bull_rsi_ob': 88, 'bull_adx_thresh': 19.36713990848803, 'bull_atr_min_pct': 0.0035270726664491927, 'bull_atr_max_pct': 0.11834161791460698, 'bull_tp_mult': 1.6553206840208845, 'bull_tsl_mult': 0.4355084382103038, 'bull_time_stop': 142, 'bull_use_sma': True, 'bull_use_ema': True, 'bull_use_atr': False, 'bull_use_adx': False, 'bull_use_spike': False, 'bull_rsi_required': True, 'bear_strategy': 'mean_reversion', 'bear_bb_std_mult': 0.6967292866352952, 'bear_rsi_os': 53, 'bear_rsi_ob': 61, 'bear_adx_thresh': 12.239536659455899, 'bear_atr_min_pct': 0.01831604517844213, 'bear_atr_max_pct': 0.1478338676740678, 'bear_tp_mult': 1.9479671796710636, 'bear_tsl_mult': 0.1248678988765799, 'bear_time_stop': 201, 'bear_use_sma': True, 'bear_use_ema': False, 'bear_use_atr': True, 'bear_use_adx': True, 'bear_use_spike': False, 'bear_rsi_required': True, 'sideways_strategy': 'mean_reversion', 'sideways_bb_std_mult': 1.3244171908170899, 'sideways_rsi_os': 8, 'sideways_rsi_ob': 70, 'sideways_adx_thresh': 8.540181579206601, 'sideways_atr_min_pct': 0.022572996689973274, 'sideways_atr_max_pct': 0.03264806057875729, 'sideways_tp_mult': 2.8154869425753826, 'sideways_tsl_mult': 0.19292724479041895, 'sideways_time_stop': 219, 'sideways_use_sma': True, 'sideways_use_ema': False, 'sideways_use_atr': False, 'sideways_use_adx': False, 'sideways_use_spike': False, 'sideways_rsi_required': False}.
[I 2025-09-01 04:30:33,459] Trial 165 finished with values: [-1000000000.0, 1000000000.0] and parameters: {'p_sma': 20, 'p_std': 43, 'p_atr': 26, 'p_adx': 20, 'rsi_period': 60, 'ema1': 29, 'ema2': 25, 'slip_atr_k': 0.006495655263742347, 'slip_spread_k': 0.3116575167790952, 'spread_hl_frac': 0.038387528641449946, 'bb_std_mult': 0.9922018442804081, 'rsi_os': 22, 'rsi_ob': 56, 'vol_spike': 0.2357099289988556, 'adx_thresh': 13.563722823487751, 'atr_min_pct': 0.0019953312738159625, 'atr_max_pct': 0.11336782826935413, 'tp_mult': 2.508655438466862, 'tsl_mult': 0.8462352729016973, 'strategy': 'breakout', 'time_stop': 11, 'use_sma': True, 'use_atr': False, 'use_adx': False, 'use_ema': True, 'use_spike': True, 'rsi_required': False, 'edge_k': 1.1636788882391347, 'edge_cap': 0.2183518583467283, 'bull_strategy': 'mean_reversion', 'bull_bb_std_mult': 2.4020518301909783, 'bull_rsi_os': 28, 'bull_rsi_ob': 90, 'bull_adx_thresh': 18.344903332493644, 'bull_atr_min_pct': 0.0020625317332788017, 'bull_atr_max_pct': 0.010054209909575798, 'bull_tp_mult': 1.6625759484446787, 'bull_tsl_mult': 0.3784313921408387, 'bull_time_stop': 215, 'bull_use_sma': True, 'bull_use_ema': False, 'bull_use_atr': True, 'bull_use_adx': False, 'bull_use_spike': False, 'bull_rsi_required': False, 'bear_strategy': 'mean_reversion', 'bear_bb_std_mult': 0.6718827364350155, 'bear_rsi_os': 33, 'bear_rsi_ob': 59, 'bear_adx_thresh': 14.617908292764016, 'bear_atr_min_pct': 0.026710668758499905, 'bear_atr_max_pct': 0.1369775646718238, 'bear_tp_mult': 1.0758044225351076, 'bear_tsl_mult': 0.0818146996757492, 'bear_time_stop': 206, 'bear_use_sma': True, 'bear_use_ema': True, 'bear_use_atr': True, 'bear_use_adx': True, 'bear_use_spike': False, 'bear_rsi_required': False, 'sideways_strategy': 'mean_reversion', 'sideways_bb_std_mult': 1.1289402444451793, 'sideways_rsi_os': 47, 'sideways_rsi_ob': 48, 'sideways_adx_thresh': 18.117433224832393, 'sideways_atr_min_pct': 0.02194267875720347, 'sideways_atr_max_pct': 0.025102350770899874, 'sideways_tp_mult': 2.723452636976168, 'sideways_tsl_mult': 0.8992572502502392, 'sideways_time_stop': 175, 'sideways_use_sma': True, 'sideways_use_ema': True, 'sideways_use_atr': False, 'sideways_use_adx': False, 'sideways_use_spike': False, 'sideways_rsi_required': False}.
[I 2025-09-01 04:30:33,768] Trial 166 finished with values: [-1000000000.0, 1000000000.0] and parameters: {'p_sma': 20, 'p_std': 43, 'p_atr': 26, 'p_adx': 20, 'rsi_period': 60, 'ema1': 29, 'ema2': 25, 'slip_atr_k': 0.004139124467322032, 'slip_spread_k': 0.02913751948707255, 'spread_hl_frac': 0.04598843827578003, 'bb_std_mult': 0.8554573716184265, 'rsi_os': 48, 'rsi_ob': 56, 'vol_spike': 0.24450569056209503, 'adx_thresh': 13.695503067256102, 'atr_min_pct': 0.00296559122917103, 'atr_max_pct': 0.11811902796024025, 'tp_mult': 2.4235802689022896, 'tsl_mult': 0.9586049683322453, 'strategy': 'breakout', 'time_stop': 278, 'use_sma': True, 'use_atr': False, 'use_adx': False, 'use_ema': True, 'use_spike': True, 'rsi_required': False, 'edge_k': 1.1724433360085453, 'edge_cap': 0.43275393436791176, 'bull_strategy': 'mean_reversion', 'bull_bb_std_mult': 2.0547906131035343, 'bull_rsi_os': 16, 'bull_rsi_ob': 87, 'bull_adx_thresh': 33.82007152686908, 'bull_atr_min_pct': 0.0023377323161783083, 'bull_atr_max_pct': 0.1299034741480448, 'bull_tp_mult': 2.945094491495098, 'bull_tsl_mult': 0.4289083638891741, 'bull_time_stop': 139, 'bull_use_sma': True, 'bull_use_ema': False, 'bull_use_atr': True, 'bull_use_adx': False, 'bull_use_spike': False, 'bull_rsi_required': False, 'bear_strategy': 'mean_reversion', 'bear_bb_std_mult': 1.289791571855177, 'bear_rsi_os': 41, 'bear_rsi_ob': 59, 'bear_adx_thresh': 14.245791072893107, 'bear_atr_min_pct': 0.02876814519746707, 'bear_atr_max_pct': 0.14651621639165568, 'bear_tp_mult': 2.1682645384523664, 'bear_tsl_mult': 0.25260810193254346, 'bear_time_stop': 56, 'bear_use_sma': True, 'bear_use_ema': True, 'bear_use_atr': True, 'bear_use_adx': True, 'bear_use_spike': False, 'bear_rsi_required': False, 'sideways_strategy': 'mean_reversion', 'sideways_bb_std_mult': 2.2568133867402467, 'sideways_rsi_os': 6, 'sideways_rsi_ob': 50, 'sideways_adx_thresh': 16.746950166095232, 'sideways_atr_min_pct': 0.02580342929116892, 'sideways_atr_max_pct': 0.02497954738796901, 'sideways_tp_mult': 2.740841048344421, 'sideways_tsl_mult': 0.8885222704436085, 'sideways_time_stop': 174, 'sideways_use_sma': False, 'sideways_use_ema': True, 'sideways_use_atr': False, 'sideways_use_adx': False, 'sideways_use_spike': False, 'sideways_rsi_required': False}.
[I 2025-09-01 04:30:34,120] Trial 164 finished with values: [-1000000000.0, 1000000000.0] and parameters: {'p_sma': 20, 'p_std': 43, 'p_atr': 26, 'p_adx': 20, 'rsi_period': 59, 'ema1': 29, 'ema2': 25, 'slip_atr_k': 0.006575573649398731, 'slip_spread_k': 0.3167712224359099, 'spread_hl_frac': 0.046057312749536214, 'bb_std_mult': 0.9884579825148808, 'rsi_os': 6, 'rsi_ob': 56, 'vol_spike': 0.23579963515423105, 'adx_thresh': 34.47500156866588, 'atr_min_pct': 0.0029460504991104444, 'atr_max_pct': 0.11288101145988041, 'tp_mult': 2.4998159985135606, 'tsl_mult': 0.9609077636781955, 'strategy': 'breakout', 'time_stop': 177, 'use_sma': True, 'use_atr': False, 'use_adx': False, 'use_ema': True, 'use_spike': True, 'rsi_required': False, 'edge_k': 0.30980536717771723, 'edge_cap': 0.43554843978868485, 'bull_strategy': 'mean_reversion', 'bull_bb_std_mult': 2.4231366862774055, 'bull_rsi_os': 16, 'bull_rsi_ob': 88, 'bull_adx_thresh': 18.14766325034066, 'bull_atr_min_pct': 0.0021887668043702856, 'bull_atr_max_pct': 0.010060499671095027, 'bull_tp_mult': 1.6689903000093302, 'bull_tsl_mult': 0.44153338293073857, 'bull_time_stop': 14, 'bull_use_sma': True, 'bull_use_ema': False, 'bull_use_atr': True, 'bull_use_adx': False, 'bull_use_spike': False, 'bull_rsi_required': False, 'bear_strategy': 'mean_reversion', 'bear_bb_std_mult': 0.5522479722230071, 'bear_rsi_os': 41, 'bear_rsi_ob': 60, 'bear_adx_thresh': 14.311770068756621, 'bear_atr_min_pct': 0.005331688130997329, 'bear_atr_max_pct': 0.14141036407937158, 'bear_tp_mult': 1.0955815888116989, 'bear_tsl_mult': 0.16628680091418785, 'bear_time_stop': 57, 'bear_use_sma': True, 'bear_use_ema': True, 'bear_use_atr': True, 'bear_use_adx': True, 'bear_use_spike': False, 'bear_rsi_required': False, 'sideways_strategy': 'mean_reversion', 'sideways_bb_std_mult': 2.3381138849878376, 'sideways_rsi_os': 5, 'sideways_rsi_ob': 48, 'sideways_adx_thresh': 17.15069032194124, 'sideways_atr_min_pct': 0.02192869824623876, 'sideways_atr_max_pct': 0.02865900112266155, 'sideways_tp_mult': 2.721068128801241, 'sideways_tsl_mult': 0.20682531610573968, 'sideways_time_stop': 176, 'sideways_use_sma': True, 'sideways_use_ema': True, 'sideways_use_atr': False, 'sideways_use_adx': False, 'sideways_use_spike': False, 'sideways_rsi_required': False}.
[I 2025-09-01 04:31:17,819] Trial 167 finished with values: [-1000000000.0, 1000000000.0] and parameters: {'p_sma': 20, 'p_std': 26, 'p_atr': 26, 'p_adx': 20, 'rsi_period': 60, 'ema1': 28, 'ema2': 26, 'slip_atr_k': 0.005876491452014486, 'slip_spread_k': 0.02590984052722589, 'spread_hl_frac': 0.038141154073801524, 'bb_std_mult': 0.9863684618840338, 'rsi_os': 48, 'rsi_ob': 56, 'vol_spike': 0.23727520002834962, 'adx_thresh': 15.621402144397806, 'atr_min_pct': 0.0028807183417616984, 'atr_max_pct': 0.11722350863870601, 'tp_mult': 2.5110935817641162, 'tsl_mult': 0.9488544630015683, 'strategy': 'breakout', 'time_stop': 19, 'use_sma': True, 'use_atr': True, 'use_adx': False, 'use_ema': True, 'use_spike': True, 'rsi_required': False, 'edge_k': 1.199653554640712, 'edge_cap': 0.314270767701322, 'bull_strategy': 'breakout', 'bull_bb_std_mult': 2.4177910903972593, 'bull_rsi_os': 28, 'bull_rsi_ob': 86, 'bull_adx_thresh': 30.63603975011791, 'bull_atr_min_pct': 0.0023579600191820566, 'bull_atr_max_pct': 0.01986568010741576, 'bull_tp_mult': 1.5754514961777404, 'bull_tsl_mult': 0.3739341797070674, 'bull_time_stop': 224, 'bull_use_sma': True, 'bull_use_ema': False, 'bull_use_atr': True, 'bull_use_adx': False, 'bull_use_spike': False, 'bull_rsi_required': False, 'bear_strategy': 'mean_reversion', 'bear_bb_std_mult': 1.0838641990540985, 'bear_rsi_os': 33, 'bear_rsi_ob': 59, 'bear_adx_thresh': 14.168843883472054, 'bear_atr_min_pct': 0.026676829738350175, 'bear_atr_max_pct': 0.13721243357359472, 'bear_tp_mult': 2.1243239390470188, 'bear_tsl_mult': 0.0858568270544588, 'bear_time_stop': 193, 'bear_use_sma': True, 'bear_use_ema': True, 'bear_use_atr': True, 'bear_use_adx': True, 'bear_use_spike': False, 'bear_rsi_required': False, 'sideways_strategy': 'mean_reversion', 'sideways_bb_std_mult': 1.4173103206740887, 'sideways_rsi_os': 5, 'sideways_rsi_ob': 50, 'sideways_adx_thresh': 16.648832168131097, 'sideways_atr_min_pct': 0.02169582079114566, 'sideways_atr_max_pct': 0.022991897528259232, 'sideways_tp_mult': 2.727910034915781, 'sideways_tsl_mult': 0.8784956685482941, 'sideways_time_stop': 201, 'sideways_use_sma': False, 'sideways_use_ema': True, 'sideways_use_atr': False, 'sideways_use_adx': False, 'sideways_use_spike': False, 'sideways_rsi_required': False}.
[I 2025-09-01 04:31:18,366] Trial 169 finished with values: [-1000000000.0, 1000000000.0] and parameters: {'p_sma': 16, 'p_std': 45, 'p_atr': 28, 'p_adx': 19, 'rsi_period': 53, 'ema1': 30, 'ema2': 26, 'slip_atr_k': 0.007982511310938759, 'slip_spread_k': 0.3843623038152302, 'spread_hl_frac': 0.041260703731297386, 'bb_std_mult': 1.2874826053544668, 'rsi_os': 30, 'rsi_ob': 54, 'vol_spike': 0.2390537830052361, 'adx_thresh': 16.91696465421786, 'atr_min_pct': 0.003080359059099935, 'atr_max_pct': 0.12069067654915717, 'tp_mult': 2.4853214418095044, 'tsl_mult': 0.2620800515642204, 'strategy': 'breakout', 'time_stop': 176, 'use_sma': True, 'use_atr': True, 'use_adx': False, 'use_ema': True, 'use_spike': True, 'rsi_required': False, 'edge_k': 0.5403663586159084, 'edge_cap': 0.3142070165046151, 'bull_strategy': 'breakout', 'bull_bb_std_mult': 2.4330093972591897, 'bull_rsi_os': 27, 'bull_rsi_ob': 85, 'bull_adx_thresh': 30.190968182126067, 'bull_atr_min_pct': 0.0009213254986923377, 'bull_atr_max_pct': 0.13949561601154759, 'bull_tp_mult': 2.2560709221872624, 'bull_tsl_mult': 0.46878007153207246, 'bull_time_stop': 291, 'bull_use_sma': True, 'bull_use_ema': False, 'bull_use_atr': True, 'bull_use_adx': False, 'bull_use_spike': False, 'bull_rsi_required': False, 'bear_strategy': 'mean_reversion', 'bear_bb_std_mult': 0.5761723873136724, 'bear_rsi_os': 36, 'bear_rsi_ob': 72, 'bear_adx_thresh': 13.26892420586058, 'bear_atr_min_pct': 0.028238559232148065, 'bear_atr_max_pct': 0.14196324925101908, 'bear_tp_mult': 2.4895823160135993, 'bear_tsl_mult': 0.1920024941240408, 'bear_time_stop': 191, 'bear_use_sma': False, 'bear_use_ema': False, 'bear_use_atr': True, 'bear_use_adx': True, 'bear_use_spike': False, 'bear_rsi_required': False, 'sideways_strategy': 'breakout', 'sideways_bb_std_mult': 1.7320484715442974, 'sideways_rsi_os': 5, 'sideways_rsi_ob': 51, 'sideways_adx_thresh': 16.197607139487868, 'sideways_atr_min_pct': 0.023887738478042625, 'sideways_atr_max_pct': 0.09788389747217817, 'sideways_tp_mult': 2.673320769216475, 'sideways_tsl_mult': 0.9404541317160946, 'sideways_time_stop': 203, 'sideways_use_sma': False, 'sideways_use_ema': True, 'sideways_use_atr': False, 'sideways_use_adx': False, 'sideways_use_spike': True, 'sideways_rsi_required': False}.
[I 2025-09-01 04:31:18,915] Trial 168 finished with values: [-1000000000.0, 1000000000.0] and parameters: {'p_sma': 16, 'p_std': 42, 'p_atr': 26, 'p_adx': 18, 'rsi_period': 58, 'ema1': 30, 'ema2': 26, 'slip_atr_k': 0.007176894335533048, 'slip_spread_k': 0.26541364400004874, 'spread_hl_frac': 0.041542489807596915, 'bb_std_mult': 0.897154057849021, 'rsi_os': 48, 'rsi_ob': 54, 'vol_spike': 0.24300671955942313, 'adx_thresh': 27.169921059241666, 'atr_min_pct': 0.00038517181682131037, 'atr_max_pct': 0.12001929993892725, 'tp_mult': 2.444137532832232, 'tsl_mult': 0.9534330310375508, 'strategy': 'breakout', 'time_stop': 276, 'use_sma': True, 'use_atr': True, 'use_adx': False, 'use_ema': True, 'use_spike': True, 'rsi_required': False, 'edge_k': 0.6207333163111085, 'edge_cap': 0.43426687363202093, 'bull_strategy': 'breakout', 'bull_bb_std_mult': 2.0727420945527593, 'bull_rsi_os': 27, 'bull_rsi_ob': 87, 'bull_adx_thresh': 20.746720061558463, 'bull_atr_min_pct': 0.002248115421937178, 'bull_atr_max_pct': 0.020039133813289756, 'bull_tp_mult': 2.934115197638668, 'bull_tsl_mult': 0.3620404562404478, 'bull_time_stop': 35, 'bull_use_sma': True, 'bull_use_ema': False, 'bull_use_atr': True, 'bull_use_adx': False, 'bull_use_spike': False, 'bull_rsi_required': False, 'bear_strategy': 'mean_reversion', 'bear_bb_std_mult': 0.5805880334886186, 'bear_rsi_os': 41, 'bear_rsi_ob': 77, 'bear_adx_thresh': 13.980364513317527, 'bear_atr_min_pct': 0.028288326072709334, 'bear_atr_max_pct': 0.1446248165421788, 'bear_tp_mult': 2.154832793998103, 'bear_tsl_mult': 0.18725134639537627, 'bear_time_stop': 189, 'bear_use_sma': False, 'bear_use_ema': True, 'bear_use_atr': True, 'bear_use_adx': True, 'bear_use_spike': False, 'bear_rsi_required': False, 'sideways_strategy': 'breakout', 'sideways_bb_std_mult': 1.6896555509810383, 'sideways_rsi_os': 5, 'sideways_rsi_ob': 51, 'sideways_adx_thresh': 7.2559065434080114, 'sideways_atr_min_pct': 0.025687442877664897, 'sideways_atr_max_pct': 0.09486205479973957, 'sideways_tp_mult': 2.7718194454121883, 'sideways_tsl_mult': 0.9394977654073168, 'sideways_time_stop': 185, 'sideways_use_sma': False, 'sideways_use_ema': True, 'sideways_use_atr': False, 'sideways_use_adx': False, 'sideways_use_spike': True, 'sideways_rsi_required': False}.
[I 2025-09-01 04:31:19,124] Trial 170 finished with values: [-1000000000.0, 1000000000.0] and parameters: {'p_sma': 16, 'p_std': 45, 'p_atr': 27, 'p_adx': 18, 'rsi_period': 40, 'ema1': 30, 'ema2': 27, 'slip_atr_k': 0.009267753560547789, 'slip_spread_k': 0.340351812889097, 'spread_hl_frac': 0.04146961683870357, 'bb_std_mult': 2.1547063689625494, 'rsi_os': 30, 'rsi_ob': 54, 'vol_spike': 0.23967323458631878, 'adx_thresh': 16.740475650755418, 'atr_min_pct': 0.003395126540899105, 'atr_max_pct': 0.11960346924522376, 'tp_mult': 2.448513078591016, 'tsl_mult': 0.9169663129769684, 'strategy': 'breakout', 'time_stop': 19, 'use_sma': True, 'use_atr': True, 'use_adx': False, 'use_ema': True, 'use_spike': True, 'rsi_required': False, 'edge_k': 1.2249633871688965, 'edge_cap': 0.8665048770556667, 'bull_strategy': 'breakout', 'bull_bb_std_mult': 2.5252855682936506, 'bull_rsi_os': 26, 'bull_rsi_ob': 85, 'bull_adx_thresh': 30.349639628442155, 'bull_atr_min_pct': 0.004427689210791718, 'bull_atr_max_pct': 0.12475109568028209, 'bull_tp_mult': 1.579550484101459, 'bull_tsl_mult': 0.46746323385898936, 'bull_time_stop': 223, 'bull_use_sma': True, 'bull_use_ema': False, 'bull_use_atr': True, 'bull_use_adx': False, 'bull_use_spike': False, 'bull_rsi_required': False, 'bear_strategy': 'mean_reversion', 'bear_bb_std_mult': 1.104754926001582, 'bear_rsi_os': 35, 'bear_rsi_ob': 79, 'bear_adx_thresh': 13.27028868111002, 'bear_atr_min_pct': 0.027969305728000063, 'bear_atr_max_pct': 0.14368992046853166, 'bear_tp_mult': 2.748300794815197, 'bear_tsl_mult': 0.669560966291215, 'bear_time_stop': 257, 'bear_use_sma': False, 'bear_use_ema': False, 'bear_use_atr': True, 'bear_use_adx': False, 'bear_use_spike': False, 'bear_rsi_required': False, 'sideways_strategy': 'breakout', 'sideways_bb_std_mult': 1.4080832581108478, 'sideways_rsi_os': 10, 'sideways_rsi_ob': 51, 'sideways_adx_thresh': 16.434365774617778, 'sideways_atr_min_pct': 0.023804039678305203, 'sideways_atr_max_pct': 0.059355084313289536, 'sideways_tp_mult': 2.780388470785921, 'sideways_tsl_mult': 0.06112639377189455, 'sideways_time_stop': 202, 'sideways_use_sma': False, 'sideways_use_ema': True, 'sideways_use_atr': False, 'sideways_use_adx': False, 'sideways_use_spike': True, 'sideways_rsi_required': False}.
