[I 2025-09-01 05:45:20,370] Trial 586 finished with values: [-1000000000.0, 1000000000.0] and parameters: {'p_sma': 57, 'p_std': 30, 'p_atr': 20, 'p_adx': 27, 'rsi_period': 21, 'ema1': 24, 'ema2': 58, 'slip_atr_k': 0.00899090674089214, 'slip_spread_k': 0.7439665441443285, 'spread_hl_frac': 0.0461425463104702, 'bb_std_mult': 2.1900409072129623, 'rsi_os': 29, 'rsi_ob': 82, 'vol_spike': 0.12986251857999986, 'adx_thresh': 13.50755224742841, 'atr_min_pct': 0.019727809268575782, 'atr_max_pct': 0.12747891074723053, 'tp_mult': 2.1890034250578694, 'tsl_mult': 0.9630039038068413, 'strategy': 'breakout', 'time_stop': 206, 'use_sma': True, 'use_atr': True, 'use_adx': False, 'use_ema': True, 'use_spike': True, 'rsi_required': True, 'edge_k': 0.23507386059089, 'edge_cap': 0.4838841110604594, 'bull_strategy': 'breakout', 'bull_bb_std_mult': 0.7664465368634454, 'bull_rsi_os': 51, 'bull_rsi_ob': 67, 'bull_adx_thresh': 7.97404036995489, 'bull_atr_min_pct': 0.014391113323380791, 'bull_atr_max_pct': 0.035142909579438254, 'bull_tp_mult': 2.0809979560703464, 'bull_tsl_mult': 0.6562885987849003, 'bull_time_stop': 166, 'bull_use_sma': True, 'bull_use_ema': False, 'bull_use_atr': False, 'bull_use_adx': True, 'bull_use_spike': False, 'bull_rsi_required': True, 'bear_strategy': 'breakout', 'bear_bb_std_mult': 3.503555495110159, 'bear_rsi_os': 50, 'bear_rsi_ob': 69, 'bear_adx_thresh': 15.473425630547338, 'bear_atr_min_pct': 0.006618338028445687, 'bear_atr_max_pct': 0.06364075734251572, 'bear_tp_mult': 2.5944055257711183, 'bear_tsl_mult': 0.6029312149114604, 'bear_time_stop': 20, 'bear_use_sma': True, 'bear_use_ema': False, 'bear_use_atr': True, 'bear_use_adx': False, 'bear_use_spike': False, 'bear_rsi_required': False, 'sideways_strategy': 'breakout', 'sideways_bb_std_mult': 0.6618470878375644, 'sideways_rsi_os': 51, 'sideways_rsi_ob': 53, 'sideways_adx_thresh': 9.614350443044883, 'sideways_atr_min_pct': 0.006925218116694722, 'sideways_atr_max_pct': 0.09872890588414263, 'sideways_tp_mult': 2.478736748968601, 'sideways_tsl_mult': 0.9997097423288753, 'sideways_time_stop': 75, 'sideways_use_sma': False, 'sideways_use_ema': True, 'sideways_use_atr': True, 'sideways_use_adx': False, 'sideways_use_spike': True, 'sideways_rsi_required': True}.
[I 2025-09-01 05:45:20,915] Trial 585 finished with values: [-0.024663244198759315, 0.024596989571474423] and parameters: {'p_sma': 57, 'p_std': 30, 'p_atr': 24, 'p_adx': 26, 'rsi_period': 27, 'ema1': 24, 'ema2': 30, 'slip_atr_k': 0.012592535111613902, 'slip_spread_k': 0.5697961907345643, 'spread_hl_frac': 0.034269446520963975, 'bb_std_mult': 1.9027675912315432, 'rsi_os': 29, 'rsi_ob': 90, 'vol_spike': 0.20599772098476216, 'adx_thresh': 31.849337059286572, 'atr_min_pct': 0.01583381466265427, 'atr_max_pct': 0.12724382530452857, 'tp_mult': 2.4708172440166916, 'tsl_mult': 0.47195128528043717, 'strategy': 'breakout', 'time_stop': 191, 'use_sma': False, 'use_atr': True, 'use_adx': False, 'use_ema': True, 'use_spike': True, 'rsi_required': True, 'edge_k': 0.7783153520467735, 'edge_cap': 0.47449890741907713, 'bull_strategy': 'breakout', 'bull_bb_std_mult': 0.7375895737191516, 'bull_rsi_os': 51, 'bull_rsi_ob': 88, 'bull_adx_thresh': 8.239745444693805, 'bull_atr_min_pct': 0.02726602162372245, 'bull_atr_max_pct': 0.03970868261179439, 'bull_tp_mult': 1.1998844467398926, 'bull_tsl_mult': 0.18153989468826512, 'bull_time_stop': 79, 'bull_use_sma': True, 'bull_use_ema': False, 'bull_use_atr': False, 'bull_use_adx': True, 'bull_use_spike': False, 'bull_rsi_required': True, 'bear_strategy': 'breakout', 'bear_bb_std_mult': 3.599370813575097, 'bear_rsi_os': 7, 'bear_rsi_ob': 69, 'bear_adx_thresh': 15.454570915569445, 'bear_atr_min_pct': 0.009430486259530043, 'bear_atr_max_pct': 0.011122315147952769, 'bear_tp_mult': 1.3287838484651335, 'bear_tsl_mult': 0.6157297197174239, 'bear_time_stop': 19, 'bear_use_sma': True, 'bear_use_ema': False, 'bear_use_atr': True, 'bear_use_adx': False, 'bear_use_spike': False, 'bear_rsi_required': False, 'sideways_strategy': 'breakout', 'sideways_bb_std_mult': 0.5694493944886121, 'sideways_rsi_os': 51, 'sideways_rsi_ob': 55, 'sideways_adx_thresh': 12.656532853309265, 'sideways_atr_min_pct': 0.0027048645163350402, 'sideways_atr_max_pct': 0.027693229969848084, 'sideways_tp_mult': 2.204107455141726, 'sideways_tsl_mult': 0.9982125548263487, 'sideways_time_stop': 291, 'sideways_use_sma': False, 'sideways_use_ema': True, 'sideways_use_atr': True, 'sideways_use_adx': False, 'sideways_use_spike': True, 'sideways_rsi_required': True}.
[I 2025-09-01 05:45:21,408] Trial 588 finished with values: [-1000000000.0, 1000000000.0] and parameters: {'p_sma': 58, 'p_std': 30, 'p_atr': 30, 'p_adx': 17, 'rsi_period': 27, 'ema1': 22, 'ema2': 22, 'slip_atr_k': 0.008896988154247627, 'slip_spread_k': 0.41647652536855073, 'spread_hl_frac': 0.04580807367134919, 'bb_std_mult': 2.025470263127144, 'rsi_os': 29, 'rsi_ob': 85, 'vol_spike': 0.032324343642416556, 'adx_thresh': 13.788057922392712, 'atr_min_pct': 0.01948375649231063, 'atr_max_pct': 0.12211229063831089, 'tp_mult': 2.558308353728109, 'tsl_mult': 0.21624935019580244, 'strategy': 'breakout', 'time_stop': 212, 'use_sma': True, 'use_atr': True, 'use_adx': True, 'use_ema': False, 'use_spike': True, 'rsi_required': True, 'edge_k': 0.7833841121926285, 'edge_cap': 0.8899327330679975, 'bull_strategy': 'breakout', 'bull_bb_std_mult': 1.0772889014882554, 'bull_rsi_os': 51, 'bull_rsi_ob': 90, 'bull_adx_thresh': 32.80868262642423, 'bull_atr_min_pct': 0.014258951705814918, 'bull_atr_max_pct': 0.1393127239812419, 'bull_tp_mult': 1.2879721630019632, 'bull_tsl_mult': 0.6428779040858967, 'bull_time_stop': 74, 'bull_use_sma': False, 'bull_use_ema': True, 'bull_use_atr': True, 'bull_use_adx': True, 'bull_use_spike': False, 'bull_rsi_required': False, 'bear_strategy': 'breakout', 'bear_bb_std_mult': 2.9545383932268456, 'bear_rsi_os': 50, 'bear_rsi_ob': 70, 'bear_adx_thresh': 28.55612433845878, 'bear_atr_min_pct': 0.006436374445005439, 'bear_atr_max_pct': 0.015644034804853116, 'bear_tp_mult': 1.3849764542135699, 'bear_tsl_mult': 0.48262137172778896, 'bear_time_stop': 196, 'bear_use_sma': True, 'bear_use_ema': False, 'bear_use_atr': True, 'bear_use_adx': False, 'bear_use_spike': False, 'bear_rsi_required': False, 'sideways_strategy': 'breakout', 'sideways_bb_std_mult': 1.2409223061868557, 'sideways_rsi_os': 42, 'sideways_rsi_ob': 55, 'sideways_adx_thresh': 27.929203895979548, 'sideways_atr_min_pct': 0.004342618118113844, 'sideways_atr_max_pct': 0.09926491515732748, 'sideways_tp_mult': 2.19331682772957, 'sideways_tsl_mult': 0.9988833350790177, 'sideways_time_stop': 177, 'sideways_use_sma': False, 'sideways_use_ema': True, 'sideways_use_atr': True, 'sideways_use_adx': True, 'sideways_use_spike': True, 'sideways_rsi_required': True}.
[I 2025-09-01 05:45:21,817] Trial 587 finished with values: [-1000000000.0, 1000000000.0] and parameters: {'p_sma': 55, 'p_std': 30, 'p_atr': 20, 'p_adx': 27, 'rsi_period': 20, 'ema1': 19, 'ema2': 58, 'slip_atr_k': 0.009189637696132336, 'slip_spread_k': 0.7367312442424259, 'spread_hl_frac': 0.025695276768238958, 'bb_std_mult': 0.6216646608329639, 'rsi_os': 29, 'rsi_ob': 85, 'vol_spike': 0.1923777648937972, 'adx_thresh': 13.543802784016721, 'atr_min_pct': 0.004160445051937184, 'atr_max_pct': 0.1271765422793662, 'tp_mult': 2.561900392820785, 'tsl_mult': 0.9683700441253973, 'strategy': 'breakout', 'time_stop': 187, 'use_sma': True, 'use_atr': True, 'use_adx': False, 'use_ema': True, 'use_spike': True, 'rsi_required': True, 'edge_k': 0.24177898466283568, 'edge_cap': 0.8813080795664916, 'bull_strategy': 'breakout', 'bull_bb_std_mult': 1.0706946188872435, 'bull_rsi_os': 51, 'bull_rsi_ob': 90, 'bull_adx_thresh': 6.706996288343223, 'bull_atr_min_pct': 0.019743271862795696, 'bull_atr_max_pct': 0.10721720685086825, 'bull_tp_mult': 1.225640762987148, 'bull_tsl_mult': 0.02252033241165846, 'bull_time_stop': 75, 'bull_use_sma': True, 'bull_use_ema': False, 'bull_use_atr': False, 'bull_use_adx': True, 'bull_use_spike': False, 'bull_rsi_required': True, 'bear_strategy': 'breakout', 'bear_bb_std_mult': 1.8754158916206456, 'bear_rsi_os': 10, 'bear_rsi_ob': 69, 'bear_adx_thresh': 20.64740188278948, 'bear_atr_min_pct': 0.006470154973202198, 'bear_atr_max_pct': 0.10950242488817613, 'bear_tp_mult': 1.3681003296633578, 'bear_tsl_mult': 0.6044125081626882, 'bear_time_stop': 195, 'bear_use_sma': True, 'bear_use_ema': False, 'bear_use_atr': True, 'bear_use_adx': False, 'bear_use_spike': False, 'bear_rsi_required': False, 'sideways_strategy': 'breakout', 'sideways_bb_std_mult': 0.6807675811670337, 'sideways_rsi_os': 51, 'sideways_rsi_ob': 53, 'sideways_adx_thresh': 23.930165035709827, 'sideways_atr_min_pct': 0.004243956592147996, 'sideways_atr_max_pct': 0.0374013387188599, 'sideways_tp_mult': 1.5921039902762013, 'sideways_tsl_mult': 0.35791454636791653, 'sideways_time_stop': 107, 'sideways_use_sma': False, 'sideways_use_ema': True, 'sideways_use_atr': True, 'sideways_use_adx': False, 'sideways_use_spike': True, 'sideways_rsi_required': True}.
[I 2025-09-01 05:46:02,660] Trial 592 finished with values: [-1000000000.0, 1000000000.0] and parameters: {'p_sma': 59, 'p_std': 24, 'p_atr': 7, 'p_adx': 22, 'rsi_period': 53, 'ema1': 23, 'ema2': 41, 'slip_atr_k': 0.10108511778725797, 'slip_spread_k': 0.4487948023968678, 'spread_hl_frac': 0.005636862823514832, 'bb_std_mult': 3.0108808874853827, 'rsi_os': 6, 'rsi_ob': 88, 'vol_spike': 0.03797162811865459, 'adx_thresh': 14.09981126908247, 'atr_min_pct': 0.0037490247420914496, 'atr_max_pct': 0.11967702828557782, 'tp_mult': 1.1684205186350098, 'tsl_mult': 0.9174729993821306, 'strategy': 'mean_reversion', 'time_stop': 90, 'use_sma': False, 'use_atr': True, 'use_adx': True, 'use_ema': False, 'use_spike': True, 'rsi_required': False, 'edge_k': 0.30776802914699786, 'edge_cap': 0.5699009173926639, 'bull_strategy': 'breakout', 'bull_bb_std_mult': 0.9153553052386401, 'bull_rsi_os': 39, 'bull_rsi_ob': 92, 'bull_adx_thresh': 24.654366409806695, 'bull_atr_min_pct': 0.02121969817409817, 'bull_atr_max_pct': 0.10210603111423974, 'bull_tp_mult': 2.030651831694419, 'bull_tsl_mult': 0.19588687520437317, 'bull_time_stop': 100, 'bull_use_sma': False, 'bull_use_ema': True, 'bull_use_atr': True, 'bull_use_adx': True, 'bull_use_spike': False, 'bull_rsi_required': False, 'bear_strategy': 'breakout', 'bear_bb_std_mult': 3.1697114718978368, 'bear_rsi_os': 9, 'bear_rsi_ob': 72, 'bear_adx_thresh': 27.859537034933986, 'bear_atr_min_pct': 0.007848978720377904, 'bear_atr_max_pct': 0.1049546535513787, 'bear_tp_mult': 1.4591835796356032, 'bear_tsl_mult': 0.8138595724279979, 'bear_time_stop': 185, 'bear_use_sma': True, 'bear_use_ema': False, 'bear_use_atr': False, 'bear_use_adx': False, 'bear_use_spike': False, 'bear_rsi_required': False, 'sideways_strategy': 'breakout', 'sideways_bb_std_mult': 0.7860721898306116, 'sideways_rsi_os': 13, 'sideways_rsi_ob': 61, 'sideways_adx_thresh': 23.073525872769785, 'sideways_atr_min_pct': 0.020436408169057174, 'sideways_atr_max_pct': 0.056829760475001205, 'sideways_tp_mult': 2.535499938246983, 'sideways_tsl_mult': 0.9128546756811557, 'sideways_time_stop': 156, 'sideways_use_sma': False, 'sideways_use_ema': False, 'sideways_use_atr': True, 'sideways_use_adx': True, 'sideways_use_spike': True, 'sideways_rsi_required': True}.
[I 2025-09-01 05:46:03,865] Trial 590 finished with values: [-1000000000.0, 1000000000.0] and parameters: {'p_sma': 55, 'p_std': 36, 'p_atr': 7, 'p_adx': 7, 'rsi_period': 54, 'ema1': 22, 'ema2': 30, 'slip_atr_k': 0.1647945440179984, 'slip_spread_k': 0.4129961235915378, 'spread_hl_frac': 0.04863573053691413, 'bb_std_mult': 2.035228643269222, 'rsi_os': 34, 'rsi_ob': 85, 'vol_spike': 0.1897695965437199, 'adx_thresh': 33.817024181967334, 'atr_min_pct': 0.004113795332151575, 'atr_max_pct': 0.12104251379865999, 'tp_mult': 1.1788701333621385, 'tsl_mult': 0.19752478285478364, 'strategy': 'mean_reversion', 'time_stop': 75, 'use_sma': True, 'use_atr': True, 'use_adx': True, 'use_ema': False, 'use_spike': True, 'rsi_required': False, 'edge_k': 1.8724269211911757, 'edge_cap': 0.5632025034595727, 'bull_strategy': 'breakout', 'bull_bb_std_mult': 0.5755102871614893, 'bull_rsi_os': 42, 'bull_rsi_ob': 90, 'bull_adx_thresh': 5.0231487342603724, 'bull_atr_min_pct': 0.029093854286064695, 'bull_atr_max_pct': 0.13922074717180977, 'bull_tp_mult': 1.2811533116666158, 'bull_tsl_mult': 0.18653706169434356, 'bull_time_stop': 115, 'bull_use_sma': False, 'bull_use_ema': True, 'bull_use_atr': True, 'bull_use_adx': True, 'bull_use_spike': False, 'bull_rsi_required': False, 'bear_strategy': 'breakout', 'bear_bb_std_mult': 1.8974991672578936, 'bear_rsi_os': 10, 'bear_rsi_ob': 66, 'bear_adx_thresh': 28.47272856408941, 'bear_atr_min_pct': 0.007725254791547183, 'bear_atr_max_pct': 0.10967017361236564, 'bear_tp_mult': 1.3872180389509865, 'bear_tsl_mult': 0.6712231431144363, 'bear_time_stop': 83, 'bear_use_sma': True, 'bear_use_ema': False, 'bear_use_atr': False, 'bear_use_adx': False, 'bear_use_spike': False, 'bear_rsi_required': False, 'sideways_strategy': 'breakout', 'sideways_bb_std_mult': 1.2104656456267793, 'sideways_rsi_os': 18, 'sideways_rsi_ob': 81, 'sideways_adx_thresh': 23.029401269850595, 'sideways_atr_min_pct': 0.028230091826337664, 'sideways_atr_max_pct': 0.10405962443102762, 'sideways_tp_mult': 1.507951929885599, 'sideways_tsl_mult': 0.4096762206683754, 'sideways_time_stop': 180, 'sideways_use_sma': False, 'sideways_use_ema': True, 'sideways_use_atr': True, 'sideways_use_adx': True, 'sideways_use_spike': True, 'sideways_rsi_required': True}.
[I 2025-09-01 05:46:04,448] Trial 589 finished with values: [-1000000000.0, 1000000000.0] and parameters: {'p_sma': 55, 'p_std': 31, 'p_atr': 7, 'p_adx': 22, 'rsi_period': 53, 'ema1': 22, 'ema2': 32, 'slip_atr_k': 0.08568638103519072, 'slip_spread_k': 0.05691837524532628, 'spread_hl_frac': 0.04896096581197779, 'bb_std_mult': 1.2089225432314303, 'rsi_os': 7, 'rsi_ob': 73, 'vol_spike': 0.19953939225708014, 'adx_thresh': 13.796268905042295, 'atr_min_pct': 0.004031920932995486, 'atr_max_pct': 0.12080607261263833, 'tp_mult': 2.541978372883233, 'tsl_mult': 0.9159371341194705, 'strategy': 'mean_reversion', 'time_stop': 89, 'use_sma': True, 'use_atr': True, 'use_adx': True, 'use_ema': False, 'use_spike': True, 'rsi_required': False, 'edge_k': 0.3004605946343503, 'edge_cap': 0.564515581166511, 'bull_strategy': 'breakout', 'bull_bb_std_mult': 0.9635679784576112, 'bull_rsi_os': 50, 'bull_rsi_ob': 90, 'bull_adx_thresh': 5.014409953383433, 'bull_atr_min_pct': 0.019852634511319682, 'bull_atr_max_pct': 0.10181960827176151, 'bull_tp_mult': 1.2746597506455395, 'bull_tsl_mult': 0.7254132234695396, 'bull_time_stop': 152, 'bull_use_sma': False, 'bull_use_ema': True, 'bull_use_atr': True, 'bull_use_adx': True, 'bull_use_spike': False, 'bull_rsi_required': False, 'bear_strategy': 'breakout', 'bear_bb_std_mult': 2.534045650383844, 'bear_rsi_os': 36, 'bear_rsi_ob': 72, 'bear_adx_thresh': 28.63075508350902, 'bear_atr_min_pct': 0.00792973551382096, 'bear_atr_max_pct': 0.10780431369912379, 'bear_tp_mult': 2.90372469868685, 'bear_tsl_mult': 0.48946308942316374, 'bear_time_stop': 296, 'bear_use_sma': True, 'bear_use_ema': False, 'bear_use_atr': False, 'bear_use_adx': False, 'bear_use_spike': False, 'bear_rsi_required': False, 'sideways_strategy': 'breakout', 'sideways_bb_std_mult': 2.976307039586449, 'sideways_rsi_os': 13, 'sideways_rsi_ob': 57, 'sideways_adx_thresh': 23.953879149992066, 'sideways_atr_min_pct': 0.004129200599530028, 'sideways_atr_max_pct': 0.10322550553633274, 'sideways_tp_mult': 2.3747782034343174, 'sideways_tsl_mult': 0.9628009481459997, 'sideways_time_stop': 5, 'sideways_use_sma': False, 'sideways_use_ema': True, 'sideways_use_atr': True, 'sideways_use_adx': True, 'sideways_use_spike': True, 'sideways_rsi_required': True}.
[I 2025-09-01 05:46:04,449] Trial 591 finished with values: [-0.022053183908656848, 0.021873009463308238] and parameters: {'p_sma': 55, 'p_std': 31, 'p_atr': 7, 'p_adx': 25, 'rsi_period': 53, 'ema1': 26, 'ema2': 32, 'slip_atr_k': 0.10018545598914755, 'slip_spread_k': 0.6769945761706806, 'spread_hl_frac': 0.006097488614560994, 'bb_std_mult': 1.227745701126961, 'rsi_os': 27, 'rsi_ob': 71, 'vol_spike': 0.1997802901622328, 'adx_thresh': 13.490949194423928, 'atr_min_pct': 0.004282730266485548, 'atr_max_pct': 0.1200733609325497, 'tp_mult': 2.6178883506769797, 'tsl_mult': 0.9088405409432166, 'strategy': 'mean_reversion', 'time_stop': 239, 'use_sma': False, 'use_atr': True, 'use_adx': False, 'use_ema': True, 'use_spike': True, 'rsi_required': False, 'edge_k': 1.4580694197743373, 'edge_cap': 0.5663049471782251, 'bull_strategy': 'breakout', 'bull_bb_std_mult': 3.4437025478615677, 'bull_rsi_os': 15, 'bull_rsi_ob': 49, 'bull_adx_thresh': 24.24839188601824, 'bull_atr_min_pct': 0.012786678343778477, 'bull_atr_max_pct': 0.10697857646520609, 'bull_tp_mult': 1.0680478861516751, 'bull_tsl_mult': 0.18178249286415077, 'bull_time_stop': 116, 'bull_use_sma': True, 'bull_use_ema': False, 'bull_use_atr': False, 'bull_use_adx': True, 'bull_use_spike': False, 'bull_rsi_required': True, 'bear_strategy': 'breakout', 'bear_bb_std_mult': 3.5267951385122256, 'bear_rsi_os': 36, 'bear_rsi_ob': 72, 'bear_adx_thresh': 28.058476250522098, 'bear_atr_min_pct': 0.007852947333224341, 'bear_atr_max_pct': 0.06491868088218915, 'bear_tp_mult': 2.8951995959445664, 'bear_tsl_mult': 0.6685303122657464, 'bear_time_stop': 187, 'bear_use_sma': True, 'bear_use_ema': False, 'bear_use_atr': False, 'bear_use_adx': False, 'bear_use_spike': False, 'bear_rsi_required': False, 'sideways_strategy': 'breakout', 'sideways_bb_std_mult': 3.013582034464238, 'sideways_rsi_os': 46, 'sideways_rsi_ob': 69, 'sideways_adx_thresh': 23.884888165495568, 'sideways_atr_min_pct': 0.004723766456819029, 'sideways_atr_max_pct': 0.10360555893721304, 'sideways_tp_mult': 2.2952168303262463, 'sideways_tsl_mult': 0.9073536594221968, 'sideways_time_stop': 108, 'sideways_use_sma': False, 'sideways_use_ema': True, 'sideways_use_atr': True, 'sideways_use_adx': False, 'sideways_use_spike': True, 'sideways_rsi_required': True}.
[I 2025-09-01 05:46:45,001] Trial 595 finished with values: [-1000000000.0, 1000000000.0] and parameters: {'p_sma': 58, 'p_std': 28, 'p_atr': 9, 'p_adx': 8, 'rsi_period': 51, 'ema1': 9, 'ema2': 43, 'slip_atr_k': 0.022490631421469245, 'slip_spread_k': 0.5248066002112763, 'spread_hl_frac': 0.04689701629205514, 'bb_std_mult': 1.6331381654178367, 'rsi_os': 24, 'rsi_ob': 51, 'vol_spike': 0.16025137058053798, 'adx_thresh': 17.01214693090793, 'atr_min_pct': 0.009524232641914075, 'atr_max_pct': 0.11534870439657388, 'tp_mult': 2.511891715166868, 'tsl_mult': 0.9476303803171379, 'strategy': 'breakout', 'time_stop': 161, 'use_sma': False, 'use_atr': True, 'use_adx': False, 'use_ema': True, 'use_spike': False, 'rsi_required': False, 'edge_k': 1.627869935127464, 'edge_cap': 0.5244679888436482, 'bull_strategy': 'mean_reversion', 'bull_bb_std_mult': 1.2038857945178316, 'bull_rsi_os': 47, 'bull_rsi_ob': 88, 'bull_adx_thresh': 6.068808043073959, 'bull_atr_min_pct': 0.012029051388330702, 'bull_atr_max_pct': 0.10975421907503234, 'bull_tp_mult': 1.3304827284088543, 'bull_tsl_mult': 0.0912216341977673, 'bull_time_stop': 101, 'bull_use_sma': True, 'bull_use_ema': False, 'bull_use_atr': False, 'bull_use_adx': True, 'bull_use_spike': True, 'bull_rsi_required': True, 'bear_strategy': 'breakout', 'bear_bb_std_mult': 3.597330910310504, 'bear_rsi_os': 42, 'bear_rsi_ob': 75, 'bear_adx_thresh': 31.223830240935328, 'bear_atr_min_pct': 0.021816341855318996, 'bear_atr_max_pct': 0.12587354245316534, 'bear_tp_mult': 1.6788500972143585, 'bear_tsl_mult': 0.628956718929491, 'bear_time_stop': 212, 'bear_use_sma': False, 'bear_use_ema': True, 'bear_use_atr': False, 'bear_use_adx': False, 'bear_use_spike': True, 'bear_rsi_required': True, 'sideways_strategy': 'mean_reversion', 'sideways_bb_std_mult': 0.7718285910219165, 'sideways_rsi_os': 45, 'sideways_rsi_ob': 54, 'sideways_adx_thresh': 22.1786327386189, 'sideways_atr_min_pct': 0.012387370727541442, 'sideways_atr_max_pct': 0.04486630341683309, 'sideways_tp_mult': 1.1607960172305503, 'sideways_tsl_mult': 0.9707802095954658, 'sideways_time_stop': 173, 'sideways_use_sma': False, 'sideways_use_ema': False, 'sideways_use_atr': True, 'sideways_use_adx': False, 'sideways_use_spike': False, 'sideways_rsi_required': True}.
