[I 2025-09-01 04:25:13,784] Trial 136 finished with values: [-1000000000.0, 1000000000.0] and parameters: {'p_sma': 19, 'p_std': 47, 'p_atr': 16, 'p_adx': 16, 'rsi_period': 66, 'ema1': 29, 'ema2': 22, 'slip_atr_k': 0.13379003332630066, 'slip_spread_k': 0.3983922858659541, 'spread_hl_frac': 0.0024231578471583925, 'bb_std_mult': 2.3496016440431893, 'rsi_os': 49, 'rsi_ob': 53, 'vol_spike': 0.2992611122454341, 'adx_thresh': 13.02374172734822, 'atr_min_pct': 0.013192349358597881, 'atr_max_pct': 0.1095340295512276, 'tp_mult': 2.920923994908513, 'tsl_mult': 0.9962863639703526, 'strategy': 'mean_reversion', 'time_stop': 10, 'use_sma': True, 'use_atr': True, 'use_adx': False, 'use_ema': True, 'use_spike': False, 'rsi_required': False, 'edge_k': 0.35667502020788283, 'edge_cap': 0.07927595633620381, 'bull_strategy': 'breakout', 'bull_bb_std_mult': 3.478193449675226, 'bull_rsi_os': 13, 'bull_rsi_ob': 79, 'bull_adx_thresh': 19.864214317636264, 'bull_atr_min_pct': 0.025376380951447786, 'bull_atr_max_pct': 0.13682887495570056, 'bull_tp_mult': 2.788076273758893, 'bull_tsl_mult': 0.06417303310402606, 'bull_time_stop': 101, 'bull_use_sma': True, 'bull_use_ema': True, 'bull_use_atr': True, 'bull_use_adx': False, 'bull_use_spike': False, 'bull_rsi_required': False, 'bear_strategy': 'mean_reversion', 'bear_bb_std_mult': 1.2004197572391, 'bear_rsi_os': 51, 'bear_rsi_ob': 55, 'bear_adx_thresh': 25.761296063905174, 'bear_atr_min_pct': 0.025380988614009302, 'bear_atr_max_pct': 0.13421524517488648, 'bear_tp_mult': 1.1471277635435084, 'bear_tsl_mult': 0.36052240453854173, 'bear_time_stop': 223, 'bear_use_sma': True, 'bear_use_ema': True, 'bear_use_atr': True, 'bear_use_adx': True, 'bear_use_spike': False, 'bear_rsi_required': True, 'sideways_strategy': 'mean_reversion', 'sideways_bb_std_mult': 1.343331140794144, 'sideways_rsi_os': 7, 'sideways_rsi_ob': 45, 'sideways_adx_thresh': 14.243505002917669, 'sideways_atr_min_pct': 0.018061772419332878, 'sideways_atr_max_pct': 0.08730302495199971, 'sideways_tp_mult': 2.921116515607835, 'sideways_tsl_mult': 0.9585615455146032, 'sideways_time_stop': 167, 'sideways_use_sma': False, 'sideways_use_ema': True, 'sideways_use_atr': False, 'sideways_use_adx': False, 'sideways_use_spike': False, 'sideways_rsi_required': False}.
[I 2025-09-01 04:25:14,322] Trial 138 finished with values: [-1000000000.0, 1000000000.0] and parameters: {'p_sma': 19, 'p_std': 46, 'p_atr': 13, 'p_adx': 15, 'rsi_period': 59, 'ema1': 28, 'ema2': 25, 'slip_atr_k': 0.13396963278027973, 'slip_spread_k': 0.27829237356977776, 'spread_hl_frac': 0.0022118223618609323, 'bb_std_mult': 0.5811131070845836, 'rsi_os': 48, 'rsi_ob': 52, 'vol_spike': 0.2749990126130584, 'adx_thresh': 28.822474967925466, 'atr_min_pct': 0.016342454516768867, 'atr_max_pct': 0.07878241727269894, 'tp_mult': 2.5413953339312334, 'tsl_mult': 0.9532424986490818, 'strategy': 'breakout', 'time_stop': 29, 'use_sma': True, 'use_atr': False, 'use_adx': False, 'use_ema': True, 'use_spike': True, 'rsi_required': False, 'edge_k': 0.3658744382932939, 'edge_cap': 0.09058660800150166, 'bull_strategy': 'mean_reversion', 'bull_bb_std_mult': 2.3816327430496567, 'bull_rsi_os': 12, 'bull_rsi_ob': 91, 'bull_adx_thresh': 22.42367930086325, 'bull_atr_min_pct': 0.004225546000080552, 'bull_atr_max_pct': 0.1372594686508046, 'bull_tp_mult': 1.8119825769555729, 'bull_tsl_mult': 0.6649017844845317, 'bull_time_stop': 228, 'bull_use_sma': True, 'bull_use_ema': False, 'bull_use_atr': True, 'bull_use_adx': False, 'bull_use_spike': False, 'bull_rsi_required': False, 'bear_strategy': 'mean_reversion', 'bear_bb_std_mult': 1.1850995713022536, 'bear_rsi_os': 23, 'bear_rsi_ob': 63, 'bear_adx_thresh': 11.451900849246798, 'bear_atr_min_pct': 0.02555777764413654, 'bear_atr_max_pct': 0.12745773365376897, 'bear_tp_mult': 1.0140183488774126, 'bear_tsl_mult': 0.39751202546336073, 'bear_time_stop': 212, 'bear_use_sma': True, 'bear_use_ema': False, 'bear_use_atr': True, 'bear_use_adx': True, 'bear_use_spike': False, 'bear_rsi_required': False, 'sideways_strategy': 'mean_reversion', 'sideways_bb_std_mult': 1.362092625184329, 'sideways_rsi_os': 8, 'sideways_rsi_ob': 47, 'sideways_adx_thresh': 15.581425281161243, 'sideways_atr_min_pct': 0.025023409008557207, 'sideways_atr_max_pct': 0.10376534968078453, 'sideways_tp_mult': 2.6634571761276042, 'sideways_tsl_mult': 0.3851314811753872, 'sideways_time_stop': 147, 'sideways_use_sma': True, 'sideways_use_ema': False, 'sideways_use_atr': False, 'sideways_use_adx': False, 'sideways_use_spike': False, 'sideways_rsi_required': False}.
[I 2025-09-01 04:25:15,090] Trial 133 finished with values: [-1000000000.0, 1000000000.0] and parameters: {'p_sma': 21, 'p_std': 46, 'p_atr': 16, 'p_adx': 16, 'rsi_period': 49, 'ema1': 28, 'ema2': 24, 'slip_atr_k': 0.20889744066373678, 'slip_spread_k': 0.16810740102741475, 'spread_hl_frac': 0.0009544584699331345, 'bb_std_mult': 0.8315241480104856, 'rsi_os': 49, 'rsi_ob': 60, 'vol_spike': 0.29384060437412624, 'adx_thresh': 12.781193828112688, 'atr_min_pct': 0.01301814139014075, 'atr_max_pct': 0.11020274263937577, 'tp_mult': 2.803910082925236, 'tsl_mult': 0.9727369322019315, 'strategy': 'mean_reversion', 'time_stop': 5, 'use_sma': True, 'use_atr': False, 'use_adx': False, 'use_ema': True, 'use_spike': True, 'rsi_required': False, 'edge_k': 0.5365899009712329, 'edge_cap': 0.10864580713315741, 'bull_strategy': 'mean_reversion', 'bull_bb_std_mult': 2.6086847019302377, 'bull_rsi_os': 27, 'bull_rsi_ob': 79, 'bull_adx_thresh': 21.394015274941403, 'bull_atr_min_pct': 0.02159966480553911, 'bull_atr_max_pct': 0.13667356189454066, 'bull_tp_mult': 1.7484666177316075, 'bull_tsl_mult': 0.07028667688357215, 'bull_time_stop': 210, 'bull_use_sma': True, 'bull_use_ema': True, 'bull_use_atr': True, 'bull_use_adx': False, 'bull_use_spike': False, 'bull_rsi_required': False, 'bear_strategy': 'mean_reversion', 'bear_bb_std_mult': 1.5041222935397658, 'bear_rsi_os': 51, 'bear_rsi_ob': 59, 'bear_adx_thresh': 23.539087205307638, 'bear_atr_min_pct': 0.02696438620739152, 'bear_atr_max_pct': 0.14004631204996112, 'bear_tp_mult': 1.1549829219115004, 'bear_tsl_mult': 0.35224797969377286, 'bear_time_stop': 214, 'bear_use_sma': False, 'bear_use_ema': True, 'bear_use_atr': True, 'bear_use_adx': False, 'bear_use_spike': False, 'bear_rsi_required': True, 'sideways_strategy': 'breakout', 'sideways_bb_std_mult': 1.374852582994769, 'sideways_rsi_os': 9, 'sideways_rsi_ob': 46, 'sideways_adx_thresh': 14.742009116591532, 'sideways_atr_min_pct': 0.0021870862758616018, 'sideways_atr_max_pct': 0.1005089769579545, 'sideways_tp_mult': 2.9974328073245924, 'sideways_tsl_mult': 0.9258370736876156, 'sideways_time_stop': 148, 'sideways_use_sma': True, 'sideways_use_ema': True, 'sideways_use_atr': False, 'sideways_use_adx': False, 'sideways_use_spike': True, 'sideways_rsi_required': False}.
[I 2025-09-01 04:25:17,101] Trial 137 finished with values: [-1000000000.0, 1000000000.0] and parameters: {'p_sma': 19, 'p_std': 45, 'p_atr': 11, 'p_adx': 17, 'rsi_period': 66, 'ema1': 28, 'ema2': 25, 'slip_atr_k': 0.14631250082981295, 'slip_spread_k': 0.3076136607919796, 'spread_hl_frac': 0.0023069612416862376, 'bb_std_mult': 0.8015037612073828, 'rsi_os': 49, 'rsi_ob': 53, 'vol_spike': 0.29967498964898065, 'adx_thresh': 12.745706406304818, 'atr_min_pct': 0.01542876342611287, 'atr_max_pct': 0.11826566421009548, 'tp_mult': 2.8885092881978545, 'tsl_mult': 0.9537865175888139, 'strategy': 'breakout', 'time_stop': 12, 'use_sma': True, 'use_atr': False, 'use_adx': False, 'use_ema': True, 'use_spike': True, 'rsi_required': False, 'edge_k': 1.6374329953635778, 'edge_cap': 0.14651579367646334, 'bull_strategy': 'mean_reversion', 'bull_bb_std_mult': 2.3620367811573497, 'bull_rsi_os': 38, 'bull_rsi_ob': 90, 'bull_adx_thresh': 19.91552827177746, 'bull_atr_min_pct': 0.005848792053018314, 'bull_atr_max_pct': 0.1224716701903079, 'bull_tp_mult': 2.696843675037453, 'bull_tsl_mult': 0.3109653589394662, 'bull_time_stop': 229, 'bull_use_sma': True, 'bull_use_ema': False, 'bull_use_atr': True, 'bull_use_adx': False, 'bull_use_spike': False, 'bull_rsi_required': False, 'bear_strategy': 'mean_reversion', 'bear_bb_std_mult': 1.11959325375568, 'bear_rsi_os': 23, 'bear_rsi_ob': 55, 'bear_adx_thresh': 25.860324854214884, 'bear_atr_min_pct': 0.025489276845452782, 'bear_atr_max_pct': 0.12752501644312275, 'bear_tp_mult': 1.0119293996560264, 'bear_tsl_mult': 0.39011206658850844, 'bear_time_stop': 212, 'bear_use_sma': True, 'bear_use_ema': False, 'bear_use_atr': True, 'bear_use_adx': True, 'bear_use_spike': False, 'bear_rsi_required': False, 'sideways_strategy': 'mean_reversion', 'sideways_bb_std_mult': 1.5726205964881652, 'sideways_rsi_os': 7, 'sideways_rsi_ob': 47, 'sideways_adx_thresh': 15.654502692410677, 'sideways_atr_min_pct': 0.018587536081569458, 'sideways_atr_max_pct': 0.10383833504941971, 'sideways_tp_mult': 2.92244462681751, 'sideways_tsl_mult': 0.5432869002297754, 'sideways_time_stop': 203, 'sideways_use_sma': True, 'sideways_use_ema': True, 'sideways_use_atr': False, 'sideways_use_adx': False, 'sideways_use_spike': False, 'sideways_rsi_required': False}.
[I 2025-09-01 04:25:54,421] Trial 139 finished with values: [-0.01828258720201792, 0.018046364881889234] and parameters: {'p_sma': 19, 'p_std': 45, 'p_atr': 17, 'p_adx': 17, 'rsi_period': 62, 'ema1': 28, 'ema2': 25, 'slip_atr_k': 0.0001514286549446353, 'slip_spread_k': 0.2920430462264386, 'spread_hl_frac': 0.001635740640419684, 'bb_std_mult': 0.5924289444746, 'rsi_os': 47, 'rsi_ob': 47, 'vol_spike': 0.2896972487154575, 'adx_thresh': 15.953469745466167, 'atr_min_pct': 0.004623256551458262, 'atr_max_pct': 0.09483215148385377, 'tp_mult': 2.559040295812254, 'tsl_mult': 0.9549226280089206, 'strategy': 'breakout', 'time_stop': 22, 'use_sma': True, 'use_atr': False, 'use_adx': False, 'use_ema': True, 'use_spike': True, 'rsi_required': False, 'edge_k': 1.6431857554067513, 'edge_cap': 0.1600250700422897, 'bull_strategy': 'mean_reversion', 'bull_bb_std_mult': 2.438421640444168, 'bull_rsi_os': 39, 'bull_rsi_ob': 91, 'bull_adx_thresh': 18.873596660356124, 'bull_atr_min_pct': 0.004754336201907948, 'bull_atr_max_pct': 0.127650910190651, 'bull_tp_mult': 2.6634890517547687, 'bull_tsl_mult': 0.3898913594972129, 'bull_time_stop': 217, 'bull_use_sma': True, 'bull_use_ema': False, 'bull_use_atr': True, 'bull_use_adx': False, 'bull_use_spike': False, 'bull_rsi_required': False, 'bear_strategy': 'mean_reversion', 'bear_bb_std_mult': 1.0777834190184672, 'bear_rsi_os': 47, 'bear_rsi_ob': 61, 'bear_adx_thresh': 22.431887390628106, 'bear_atr_min_pct': 0.02669141926950267, 'bear_atr_max_pct': 0.12515103542955963, 'bear_tp_mult': 2.838559424353323, 'bear_tsl_mult': 0.14388738778570792, 'bear_time_stop': 216, 'bear_use_sma': True, 'bear_use_ema': False, 'bear_use_atr': True, 'bear_use_adx': True, 'bear_use_spike': False, 'bear_rsi_required': False, 'sideways_strategy': 'mean_reversion', 'sideways_bb_std_mult': 1.4214990767097553, 'sideways_rsi_os': 7, 'sideways_rsi_ob': 49, 'sideways_adx_thresh': 30.096743803810703, 'sideways_atr_min_pct': 0.0024598551735009406, 'sideways_atr_max_pct': 0.09611318683073855, 'sideways_tp_mult': 2.6622880732033076, 'sideways_tsl_mult': 0.388144131519497, 'sideways_time_stop': 183, 'sideways_use_sma': True, 'sideways_use_ema': False, 'sideways_use_atr': False, 'sideways_use_adx': False, 'sideways_use_spike': False, 'sideways_rsi_required': False}.
[I 2025-09-01 04:25:55,049] Trial 142 finished with values: [-0.0326815954510532, 0.03253612740624308] and parameters: {'p_sma': 17, 'p_std': 43, 'p_atr': 17, 'p_adx': 19, 'rsi_period': 57, 'ema1': 30, 'ema2': 23, 'slip_atr_k': 0.2484706128314424, 'slip_spread_k': 0.029709735690917394, 'spread_hl_frac': 0.04290561069704603, 'bb_std_mult': 3.003380253713667, 'rsi_os': 47, 'rsi_ob': 55, 'vol_spike': 0.2871482879436553, 'adx_thresh': 17.842497363111395, 'atr_min_pct': 0.0006452011870585958, 'atr_max_pct': 0.12910976717162456, 'tp_mult': 2.48612608148463, 'tsl_mult': 0.9230629939357788, 'strategy': 'breakout', 'time_stop': 20, 'use_sma': True, 'use_atr': False, 'use_adx': False, 'use_ema': True, 'use_spike': True, 'rsi_required': False, 'edge_k': 0.6019378272766883, 'edge_cap': 0.05138709331966235, 'bull_strategy': 'mean_reversion', 'bull_bb_std_mult': 3.3244119904059213, 'bull_rsi_os': 30, 'bull_rsi_ob': 84, 'bull_adx_thresh': 18.840874115505226, 'bull_atr_min_pct': 0.0014791520244067605, 'bull_atr_max_pct': 0.12800300794284847, 'bull_tp_mult': 2.2659321365725487, 'bull_tsl_mult': 0.2274252053953445, 'bull_time_stop': 218, 'bull_use_sma': True, 'bull_use_ema': False, 'bull_use_atr': True, 'bull_use_adx': False, 'bull_use_spike': False, 'bull_rsi_required': False, 'bear_strategy': 'mean_reversion', 'bear_bb_std_mult': 1.7169356547258412, 'bear_rsi_os': 34, 'bear_rsi_ob': 53, 'bear_adx_thresh': 22.28508555863153, 'bear_atr_min_pct': 0.028931727897144183, 'bear_atr_max_pct': 0.14933347597916227, 'bear_tp_mult': 1.1097450003840197, 'bear_tsl_mult': 0.1376142308556647, 'bear_time_stop': 202, 'bear_use_sma': True, 'bear_use_ema': False, 'bear_use_atr': True, 'bear_use_adx': True, 'bear_use_spike': False, 'bear_rsi_required': False, 'sideways_strategy': 'mean_reversion', 'sideways_bb_std_mult': 1.4936122461309627, 'sideways_rsi_os': 10, 'sideways_rsi_ob': 49, 'sideways_adx_thresh': 17.010426260863618, 'sideways_atr_min_pct': 0.003090078850060308, 'sideways_atr_max_pct': 0.09873038411681005, 'sideways_tp_mult': 2.7723558570358007, 'sideways_tsl_mult': 0.9792410385802074, 'sideways_time_stop': 178, 'sideways_use_sma': True, 'sideways_use_ema': False, 'sideways_use_atr': False, 'sideways_use_adx': False, 'sideways_use_spike': False, 'sideways_rsi_required': False}.
[I 2025-09-01 04:25:55,604] Trial 141 finished with values: [-0.015349884693966143, 0.015233983543263706] and parameters: {'p_sma': 17, 'p_std': 43, 'p_atr': 26, 'p_adx': 19, 'rsi_period': 61, 'ema1': 30, 'ema2': 27, 'slip_atr_k': 0.0001756963601588224, 'slip_spread_k': 0.3025904829376383, 'spread_hl_frac': 0.04230029846642429, 'bb_std_mult': 0.9344973389072999, 'rsi_os': 47, 'rsi_ob': 56, 'vol_spike': 0.2473214823263858, 'adx_thresh': 14.697633615916397, 'atr_min_pct': 0.0007613849432410863, 'atr_max_pct': 0.11845099973911434, 'tp_mult': 2.4752854653123935, 'tsl_mult': 0.9274354165028557, 'strategy': 'breakout', 'time_stop': 22, 'use_sma': True, 'use_atr': False, 'use_adx': False, 'use_ema': True, 'use_spike': True, 'rsi_required': False, 'edge_k': 0.5899017903542684, 'edge_cap': 0.15309443267314374, 'bull_strategy': 'mean_reversion', 'bull_bb_std_mult': 2.332065725073697, 'bull_rsi_os': 28, 'bull_rsi_ob': 89, 'bull_adx_thresh': 18.89620205564034, 'bull_atr_min_pct': 0.0009280403131009599, 'bull_atr_max_pct': 0.12785144672916704, 'bull_tp_mult': 1.6426583837113664, 'bull_tsl_mult': 0.3831118131075786, 'bull_time_stop': 216, 'bull_use_sma': True, 'bull_use_ema': False, 'bull_use_atr': True, 'bull_use_adx': False, 'bull_use_spike': False, 'bull_rsi_required': False, 'bear_strategy': 'mean_reversion', 'bear_bb_std_mult': 1.1051451211729522, 'bear_rsi_os': 46, 'bear_rsi_ob': 57, 'bear_adx_thresh': 13.400168329754777, 'bear_atr_min_pct': 0.02994441193684558, 'bear_atr_max_pct': 0.14784145711650012, 'bear_tp_mult': 1.0480571144809891, 'bear_tsl_mult': 0.13583152150136696, 'bear_time_stop': 201, 'bear_use_sma': True, 'bear_use_ema': False, 'bear_use_atr': True, 'bear_use_adx': True, 'bear_use_spike': False, 'bear_rsi_required': False, 'sideways_strategy': 'mean_reversion', 'sideways_bb_std_mult': 1.4478470380185988, 'sideways_rsi_os': 7, 'sideways_rsi_ob': 48, 'sideways_adx_thresh': 17.121304550856564, 'sideways_atr_min_pct': 0.023620165535732908, 'sideways_atr_max_pct': 0.09316451969492426, 'sideways_tp_mult': 2.7886019840040537, 'sideways_tsl_mult': 0.9723856205739924, 'sideways_time_stop': 184, 'sideways_use_sma': True, 'sideways_use_ema': True, 'sideways_use_atr': False, 'sideways_use_adx': False, 'sideways_use_spike': False, 'sideways_rsi_required': False}.
[I 2025-09-01 04:25:55,906] Trial 140 finished with values: [-1000000000.0, 1000000000.0] and parameters: {'p_sma': 16, 'p_std': 42, 'p_atr': 17, 'p_adx': 17, 'rsi_period': 62, 'ema1': 30, 'ema2': 27, 'slip_atr_k': 0.07708013595546703, 'slip_spread_k': 0.3087592142656531, 'spread_hl_frac': 0.024322089137616278, 'bb_std_mult': 3.024999817796769, 'rsi_os': 52, 'rsi_ob': 56, 'vol_spike': 0.288874070069992, 'adx_thresh': 15.976270330464187, 'atr_min_pct': 0.015558962669217921, 'atr_max_pct': 0.1203417555434168, 'tp_mult': 2.910417268435222, 'tsl_mult': 0.9244448299142154, 'strategy': 'breakout', 'time_stop': 21, 'use_sma': True, 'use_atr': False, 'use_adx': False, 'use_ema': True, 'use_spike': True, 'rsi_required': False, 'edge_k': 0.5195515111432459, 'edge_cap': 0.1532875191571999, 'bull_strategy': 'mean_reversion', 'bull_bb_std_mult': 2.5780261793775696, 'bull_rsi_os': 26, 'bull_rsi_ob': 50, 'bull_adx_thresh': 23.635588098884526, 'bull_atr_min_pct': 0.023866365298696148, 'bull_atr_max_pct': 0.1437140840022163, 'bull_tp_mult': 1.7126193866078205, 'bull_tsl_mult': 0.23387421103489742, 'bull_time_stop': 213, 'bull_use_sma': True, 'bull_use_ema': False, 'bull_use_atr': True, 'bull_use_adx': False, 'bull_use_spike': False, 'bull_rsi_required': False, 'bear_strategy': 'mean_reversion', 'bear_bb_std_mult': 1.1178123086491174, 'bear_rsi_os': 34, 'bear_rsi_ob': 57, 'bear_adx_thresh': 22.313870342957024, 'bear_atr_min_pct': 0.029995076695928786, 'bear_atr_max_pct': 0.14305995272372649, 'bear_tp_mult': 2.8362711114184522, 'bear_tsl_mult': 0.3139415964749364, 'bear_time_stop': 204, 'bear_use_sma': True, 'bear_use_ema': False, 'bear_use_atr': True, 'bear_use_adx': True, 'bear_use_spike': False, 'bear_rsi_required': False, 'sideways_strategy': 'mean_reversion', 'sideways_bb_std_mult': 1.4523686412521664, 'sideways_rsi_os': 7, 'sideways_rsi_ob': 47, 'sideways_adx_thresh': 29.746103157085244, 'sideways_atr_min_pct': 0.002319212715932053, 'sideways_atr_max_pct': 0.09288865249700137, 'sideways_tp_mult': 2.623442062249354, 'sideways_tsl_mult': 0.9797149950440113, 'sideways_time_stop': 180, 'sideways_use_sma': True, 'sideways_use_ema': True, 'sideways_use_atr': False, 'sideways_use_adx': False, 'sideways_use_spike': False, 'sideways_rsi_required': False}.
[I 2025-09-01 04:26:36,001] Trial 144 finished with values: [-1000000000.0, 1000000000.0] and parameters: {'p_sma': 7, 'p_std': 49, 'p_atr': 17, 'p_adx': 17, 'rsi_period': 62, 'ema1': 26, 'ema2': 29, 'slip_atr_k': 0.00040272016381128655, 'slip_spread_k': 0.0994725967307849, 'spread_hl_frac': 0.04713795018637043, 'bb_std_mult': 0.5041391656015234, 'rsi_os': 47, 'rsi_ob': 55, 'vol_spike': 0.2887771756564706, 'adx_thresh': 16.156956700695545, 'atr_min_pct': 0.0006939480637436404, 'atr_max_pct': 0.08929301907250446, 'tp_mult': 2.7186443434534935, 'tsl_mult': 0.8838680971929096, 'strategy': 'breakout', 'time_stop': 34, 'use_sma': True, 'use_atr': False, 'use_adx': False, 'use_ema': True, 'use_spike': True, 'rsi_required': False, 'edge_k': 1.5904926305007503, 'edge_cap': 0.16034613771741013, 'bull_strategy': 'mean_reversion', 'bull_bb_std_mult': 2.2867885625894018, 'bull_rsi_os': 47, 'bull_rsi_ob': 93, 'bull_adx_thresh': 17.711369697449207, 'bull_atr_min_pct': 0.0014061004357263998, 'bull_atr_max_pct': 0.12750965284342106, 'bull_tp_mult': 2.539512286967961, 'bull_tsl_mult': 0.3932193018488072, 'bull_time_stop': 198, 'bull_use_sma': True, 'bull_use_ema': False, 'bull_use_atr': True, 'bull_use_adx': False, 'bull_use_spike': False, 'bull_rsi_required': False, 'bear_strategy': 'mean_reversion', 'bear_bb_std_mult': 0.9551454673530396, 'bear_rsi_os': 46, 'bear_rsi_ob': 65, 'bear_adx_thresh': 22.38587313895777, 'bear_atr_min_pct': 0.02394131114223899, 'bear_atr_max_pct': 0.12081213279131961, 'bear_tp_mult': 2.830433025995081, 'bear_tsl_mult': 0.13939670116452801, 'bear_time_stop': 238, 'bear_use_sma': True, 'bear_use_ema': False, 'bear_use_atr': True, 'bear_use_adx': True, 'bear_use_spike': False, 'bear_rsi_required': False, 'sideways_strategy': 'mean_reversion', 'sideways_bb_std_mult': 1.4492083383287984, 'sideways_rsi_os': 7, 'sideways_rsi_ob': 49, 'sideways_adx_thresh': 31.59025535752185, 'sideways_atr_min_pct': 0.0037887940084339686, 'sideways_atr_max_pct': 0.09156133936532936, 'sideways_tp_mult': 2.40031266668654, 'sideways_tsl_mult': 0.4386137600060877, 'sideways_time_stop': 197, 'sideways_use_sma': True, 'sideways_use_ema': False, 'sideways_use_atr': False, 'sideways_use_adx': False, 'sideways_use_spike': False, 'sideways_rsi_required': False}.
