[I 2025-09-01 04:36:10,671] Trial 197 finished with values: [-1000000000.0, 1000000000.0] and parameters: {'p_sma': 19, 'p_std': 44, 'p_atr': 26, 'p_adx': 19, 'rsi_period': 61, 'ema1': 30, 'ema2': 27, 'slip_atr_k': 0.22806163747844777, 'slip_spread_k': 0.3235439306504938, 'spread_hl_frac': 0.04346287968055862, 'bb_std_mult': 0.9959952757492774, 'rsi_os': 21, 'rsi_ob': 56, 'vol_spike': 0.04443087296945106, 'adx_thresh': 28.73602503405798, 'atr_min_pct': 0.0016744597263572095, 'atr_max_pct': 0.12594741885310715, 'tp_mult': 2.4882172306494548, 'tsl_mult': 0.9111022773342573, 'strategy': 'breakout', 'time_stop': 20, 'use_sma': True, 'use_atr': False, 'use_adx': False, 'use_ema': True, 'use_spike': True, 'rsi_required': False, 'edge_k': 0.256594647877332, 'edge_cap': 0.1726879339545326, 'bull_strategy': 'mean_reversion', 'bull_bb_std_mult': 1.8166563444895958, 'bull_rsi_os': 49, 'bull_rsi_ob': 51, 'bull_adx_thresh': 5.795086227080462, 'bull_atr_min_pct': 0.026632847216566356, 'bull_atr_max_pct': 0.13104459741754193, 'bull_tp_mult': 1.6116455798402145, 'bull_tsl_mult': 0.5064754869117345, 'bull_time_stop': 134, 'bull_use_sma': True, 'bull_use_ema': True, 'bull_use_atr': True, 'bull_use_adx': False, 'bull_use_spike': False, 'bull_rsi_required': False, 'bear_strategy': 'mean_reversion', 'bear_bb_std_mult': 1.04680803136494, 'bear_rsi_os': 44, 'bear_rsi_ob': 58, 'bear_adx_thresh': 33.65177346507301, 'bear_atr_min_pct': 0.0002604664965900061, 'bear_atr_max_pct': 0.14973088805252155, 'bear_tp_mult': 1.8750759589650159, 'bear_tsl_mult': 0.6311656105265032, 'bear_time_stop': 198, 'bear_use_sma': False, 'bear_use_ema': False, 'bear_use_atr': True, 'bear_use_adx': False, 'bear_use_spike': False, 'bear_rsi_required': False, 'sideways_strategy': 'mean_reversion', 'sideways_bb_std_mult': 1.2997584321389006, 'sideways_rsi_os': 8, 'sideways_rsi_ob': 48, 'sideways_adx_thresh': 18.912761150660536, 'sideways_atr_min_pct': 0.014438171569625468, 'sideways_atr_max_pct': 0.04261299302493572, 'sideways_tp_mult': 2.7950725134047465, 'sideways_tsl_mult': 0.9595867245075803, 'sideways_time_stop': 198, 'sideways_use_sma': True, 'sideways_use_ema': True, 'sideways_use_atr': False, 'sideways_use_adx': False, 'sideways_use_spike': False, 'sideways_rsi_required': False}.
[I 2025-09-01 04:36:52,429] Trial 202 finished with values: [-0.02402134518412946, 0.023826391554015] and parameters: {'p_sma': 47, 'p_std': 45, 'p_atr': 28, 'p_adx': 28, 'rsi_period': 57, 'ema1': 29, 'ema2': 30, 'slip_atr_k': 0.2399681008320662, 'slip_spread_k': 0.19889572677978617, 'spread_hl_frac': 0.04193563596140671, 'bb_std_mult': 0.8512223839153905, 'rsi_os': 36, 'rsi_ob': 66, 'vol_spike': 0.23298803311658622, 'adx_thresh': 14.172533448257253, 'atr_min_pct': 0.0005510010170121867, 'atr_max_pct': 0.12187693645616354, 'tp_mult': 2.5265906488779906, 'tsl_mult': 0.9430748189397421, 'strategy': 'mean_reversion', 'time_stop': 32, 'use_sma': True, 'use_atr': False, 'use_adx': False, 'use_ema': True, 'use_spike': False, 'rsi_required': False, 'edge_k': 0.6905894166358355, 'edge_cap': 0.47159844904052317, 'bull_strategy': 'mean_reversion', 'bull_bb_std_mult': 2.359345667186326, 'bull_rsi_os': 30, 'bull_rsi_ob': 83, 'bull_adx_thresh': 18.367208045303347, 'bull_atr_min_pct': 0.0018140555847590747, 'bull_atr_max_pct': 0.129386657724658, 'bull_tp_mult': 1.6740147269770496, 'bull_tsl_mult': 0.9282549872152367, 'bull_time_stop': 200, 'bull_use_sma': True, 'bull_use_ema': False, 'bull_use_atr': True, 'bull_use_adx': False, 'bull_use_spike': False, 'bull_rsi_required': False, 'bear_strategy': 'mean_reversion', 'bear_bb_std_mult': 1.1123178174043444, 'bear_rsi_os': 47, 'bear_rsi_ob': 60, 'bear_adx_thresh': 12.65748207801094, 'bear_atr_min_pct': 0.015866040232893636, 'bear_atr_max_pct': 0.11360728828119025, 'bear_tp_mult': 1.017709031740331, 'bear_tsl_mult': 0.0729892443261051, 'bear_time_stop': 208, 'bear_use_sma': True, 'bear_use_ema': False, 'bear_use_atr': True, 'bear_use_adx': True, 'bear_use_spike': False, 'bear_rsi_required': True, 'sideways_strategy': 'mean_reversion', 'sideways_bb_std_mult': 1.050562976675652, 'sideways_rsi_os': 11, 'sideways_rsi_ob': 50, 'sideways_adx_thresh': 16.4732864275299, 'sideways_atr_min_pct': 0.024551151290925523, 'sideways_atr_max_pct': 0.09854055931750343, 'sideways_tp_mult': 1.230447259128657, 'sideways_tsl_mult': 0.9313789544420763, 'sideways_time_stop': 132, 'sideways_use_sma': False, 'sideways_use_ema': False, 'sideways_use_atr': False, 'sideways_use_adx': False, 'sideways_use_spike': False, 'sideways_rsi_required': False}.
[I 2025-09-01 04:36:53,000] Trial 201 finished with values: [-1000000000.0, 1000000000.0] and parameters: {'p_sma': 18, 'p_std': 46, 'p_atr': 27, 'p_adx': 20, 'rsi_period': 68, 'ema1': 29, 'ema2': 58, 'slip_atr_k': 0.16184079566895598, 'slip_spread_k': 0.09064201388029242, 'spread_hl_frac': 0.041662602988971564, 'bb_std_mult': 0.8502534900240204, 'rsi_os': 49, 'rsi_ob': 66, 'vol_spike': 0.23306539007146948, 'adx_thresh': 7.894270332623904, 'atr_min_pct': 0.0007101038043392145, 'atr_max_pct': 0.12605460061958318, 'tp_mult': 2.519488868485461, 'tsl_mult': 0.9719014498957682, 'strategy': 'mean_reversion', 'time_stop': 34, 'use_sma': True, 'use_atr': False, 'use_adx': False, 'use_ema': True, 'use_spike': True, 'rsi_required': False, 'edge_k': 0.2553940897110737, 'edge_cap': 0.47587274659712026, 'bull_strategy': 'mean_reversion', 'bull_bb_std_mult': 2.3575972213748844, 'bull_rsi_os': 30, 'bull_rsi_ob': 83, 'bull_adx_thresh': 18.027799727776916, 'bull_atr_min_pct': 0.001771599006772767, 'bull_atr_max_pct': 0.12931404290008905, 'bull_tp_mult': 1.569386470026506, 'bull_tsl_mult': 0.33202383089693094, 'bull_time_stop': 135, 'bull_use_sma': True, 'bull_use_ema': True, 'bull_use_atr': True, 'bull_use_adx': False, 'bull_use_spike': False, 'bull_rsi_required': False, 'bear_strategy': 'mean_reversion', 'bear_bb_std_mult': 1.1202485831163194, 'bear_rsi_os': 47, 'bear_rsi_ob': 86, 'bear_adx_thresh': 33.03844370357821, 'bear_atr_min_pct': 0.029084167177142604, 'bear_atr_max_pct': 0.14429895581502392, 'bear_tp_mult': 2.938401347281549, 'bear_tsl_mult': 0.18210115032384172, 'bear_time_stop': 201, 'bear_use_sma': True, 'bear_use_ema': False, 'bear_use_atr': True, 'bear_use_adx': False, 'bear_use_spike': False, 'bear_rsi_required': False, 'sideways_strategy': 'mean_reversion', 'sideways_bb_std_mult': 3.463479229630935, 'sideways_rsi_os': 51, 'sideways_rsi_ob': 50, 'sideways_adx_thresh': 6.470466228214624, 'sideways_atr_min_pct': 0.023713149570093753, 'sideways_atr_max_pct': 0.06939841898132842, 'sideways_tp_mult': 1.6424402904663815, 'sideways_tsl_mult': 0.5027778129670657, 'sideways_time_stop': 78, 'sideways_use_sma': False, 'sideways_use_ema': True, 'sideways_use_atr': False, 'sideways_use_adx': False, 'sideways_use_spike': False, 'sideways_rsi_required': False}.
[I 2025-09-01 04:36:53,334] Trial 200 finished with values: [-1000000000.0, 1000000000.0] and parameters: {'p_sma': 10, 'p_std': 45, 'p_atr': 29, 'p_adx': 7, 'rsi_period': 58, 'ema1': 29, 'ema2': 27, 'slip_atr_k': 0.16232284869915775, 'slip_spread_k': 0.7429234652983329, 'spread_hl_frac': 0.042340558661852074, 'bb_std_mult': 0.785258101728785, 'rsi_os': 22, 'rsi_ob': 82, 'vol_spike': 0.23617172841845083, 'adx_thresh': 8.517912260659429, 'atr_min_pct': 0.0006864183566023508, 'atr_max_pct': 0.10662226401495124, 'tp_mult': 2.505763542056102, 'tsl_mult': 0.9659979615993673, 'strategy': 'mean_reversion', 'time_stop': 202, 'use_sma': True, 'use_atr': False, 'use_adx': False, 'use_ema': True, 'use_spike': True, 'rsi_required': False, 'edge_k': 0.7202490162916116, 'edge_cap': 0.16037018199760705, 'bull_strategy': 'mean_reversion', 'bull_bb_std_mult': 2.3598432165131236, 'bull_rsi_os': 29, 'bull_rsi_ob': 88, 'bull_adx_thresh': 15.4404395652154, 'bull_atr_min_pct': 0.0016104001159608157, 'bull_atr_max_pct': 0.09735880925917179, 'bull_tp_mult': 1.5518236068845708, 'bull_tsl_mult': 0.5129546172119922, 'bull_time_stop': 210, 'bull_use_sma': True, 'bull_use_ema': False, 'bull_use_atr': True, 'bull_use_adx': False, 'bull_use_spike': False, 'bull_rsi_required': False, 'bear_strategy': 'mean_reversion', 'bear_bb_std_mult': 1.1089262632042478, 'bear_rsi_os': 45, 'bear_rsi_ob': 57, 'bear_adx_thresh': 14.721279449272188, 'bear_atr_min_pct': 0.028919739039587625, 'bear_atr_max_pct': 0.04386565536867484, 'bear_tp_mult': 2.9524243707156312, 'bear_tsl_mult': 0.17662557828652103, 'bear_time_stop': 195, 'bear_use_sma': True, 'bear_use_ema': False, 'bear_use_atr': True, 'bear_use_adx': True, 'bear_use_spike': False, 'bear_rsi_required': False, 'sideways_strategy': 'mean_reversion', 'sideways_bb_std_mult': 1.2879726529202127, 'sideways_rsi_os': 11, 'sideways_rsi_ob': 50, 'sideways_adx_thresh': 27.88286169734282, 'sideways_atr_min_pct': 0.023826730308708733, 'sideways_atr_max_pct': 0.06752178811947615, 'sideways_tp_mult': 1.2258579940764247, 'sideways_tsl_mult': 0.9658253456725129, 'sideways_time_stop': 192, 'sideways_use_sma': False, 'sideways_use_ema': True, 'sideways_use_atr': False, 'sideways_use_adx': False, 'sideways_use_spike': False, 'sideways_rsi_required': False}.
[I 2025-09-01 04:36:53,508] Trial 199 finished with values: [-1000000000.0, 1000000000.0] and parameters: {'p_sma': 45, 'p_std': 42, 'p_atr': 25, 'p_adx': 28, 'rsi_period': 57, 'ema1': 9, 'ema2': 27, 'slip_atr_k': 0.0005206983639012728, 'slip_spread_k': 0.2821170732720651, 'spread_hl_frac': 0.042439198237437255, 'bb_std_mult': 0.8640145221059843, 'rsi_os': 23, 'rsi_ob': 53, 'vol_spike': 0.2337521040395753, 'adx_thresh': 14.17874736406859, 'atr_min_pct': 0.0007018433134647899, 'atr_max_pct': 0.12449494483748838, 'tp_mult': 2.5039517720601103, 'tsl_mult': 0.9434390499425149, 'strategy': 'mean_reversion', 'time_stop': 160, 'use_sma': True, 'use_atr': False, 'use_adx': False, 'use_ema': True, 'use_spike': True, 'rsi_required': False, 'edge_k': 0.5661838618716573, 'edge_cap': 0.4760466939614844, 'bull_strategy': 'mean_reversion', 'bull_bb_std_mult': 2.3645477192013766, 'bull_rsi_os': 14, 'bull_rsi_ob': 88, 'bull_adx_thresh': 18.770891526716433, 'bull_atr_min_pct': 0.001616375407764487, 'bull_atr_max_pct': 0.12497535037008879, 'bull_tp_mult': 1.56102147941938, 'bull_tsl_mult': 0.9260545778903331, 'bull_time_stop': 134, 'bull_use_sma': True, 'bull_use_ema': True, 'bull_use_atr': True, 'bull_use_adx': False, 'bull_use_spike': False, 'bull_rsi_required': False, 'bear_strategy': 'mean_reversion', 'bear_bb_std_mult': 1.0974920668638404, 'bear_rsi_os': 45, 'bear_rsi_ob': 55, 'bear_adx_thresh': 33.265261048262374, 'bear_atr_min_pct': 0.015878081929595937, 'bear_atr_max_pct': 0.04976686765084357, 'bear_tp_mult': 2.4429009853073467, 'bear_tsl_mult': 0.17555490183604797, 'bear_time_stop': 207, 'bear_use_sma': False, 'bear_use_ema': False, 'bear_use_atr': True, 'bear_use_adx': True, 'bear_use_spike': False, 'bear_rsi_required': False, 'sideways_strategy': 'mean_reversion', 'sideways_bb_std_mult': 1.3340552023523184, 'sideways_rsi_os': 7, 'sideways_rsi_ob': 50, 'sideways_adx_thresh': 34.535263103221304, 'sideways_atr_min_pct': 0.02381501815165812, 'sideways_atr_max_pct': 0.04183508350731967, 'sideways_tp_mult': 2.905361253727192, 'sideways_tsl_mult': 0.038731700317961026, 'sideways_time_stop': 169, 'sideways_use_sma': False, 'sideways_use_ema': True, 'sideways_use_atr': False, 'sideways_use_adx': False, 'sideways_use_spike': False, 'sideways_rsi_required': False}.
[I 2025-09-01 04:36:54,208] Trial 204 finished with values: [-1000000000.0, 1000000000.0] and parameters: {'p_sma': 42, 'p_std': 42, 'p_atr': 25, 'p_adx': 18, 'rsi_period': 58, 'ema1': 30, 'ema2': 48, 'slip_atr_k': 0.0002163530041899066, 'slip_spread_k': 0.6116627133488428, 'spread_hl_frac': 0.040486210762728826, 'bb_std_mult': 0.8676183987842552, 'rsi_os': 51, 'rsi_ob': 82, 'vol_spike': 0.019931813983791957, 'adx_thresh': 14.263914765850778, 'atr_min_pct': 0.0006646952226323531, 'atr_max_pct': 0.10840411986964346, 'tp_mult': 2.4293971910604477, 'tsl_mult': 0.9386726480019324, 'strategy': 'mean_reversion', 'time_stop': 204, 'use_sma': True, 'use_atr': False, 'use_adx': False, 'use_ema': True, 'use_spike': False, 'rsi_required': False, 'edge_k': 1.4754208970920792, 'edge_cap': 0.15247465760794596, 'bull_strategy': 'mean_reversion', 'bull_bb_std_mult': 2.2904214227866913, 'bull_rsi_os': 28, 'bull_rsi_ob': 88, 'bull_adx_thresh': 25.38191768875433, 'bull_atr_min_pct': 0.0007542134608681643, 'bull_atr_max_pct': 0.12698845248134116, 'bull_tp_mult': 1.6671758429873285, 'bull_tsl_mult': 0.17390163120382118, 'bull_time_stop': 21, 'bull_use_sma': True, 'bull_use_ema': False, 'bull_use_atr': True, 'bull_use_adx': False, 'bull_use_spike': False, 'bull_rsi_required': False, 'bear_strategy': 'mean_reversion', 'bear_bb_std_mult': 1.1881073733054688, 'bear_rsi_os': 45, 'bear_rsi_ob': 82, 'bear_adx_thresh': 12.885931948520733, 'bear_atr_min_pct': 0.029915936346498306, 'bear_atr_max_pct': 0.11555878430772189, 'bear_tp_mult': 2.8688745033383265, 'bear_tsl_mult': 0.11695128749474916, 'bear_time_stop': 208, 'bear_use_sma': True, 'bear_use_ema': False, 'bear_use_atr': True, 'bear_use_adx': True, 'bear_use_spike': False, 'bear_rsi_required': True, 'sideways_strategy': 'mean_reversion', 'sideways_bb_std_mult': 2.075760906382573, 'sideways_rsi_os': 7, 'sideways_rsi_ob': 80, 'sideways_adx_thresh': 16.57886404284223, 'sideways_atr_min_pct': 0.02406350687968898, 'sideways_atr_max_pct': 0.08409359083340852, 'sideways_tp_mult': 2.8581223109759746, 'sideways_tsl_mult': 0.9312456069303191, 'sideways_time_stop': 176, 'sideways_use_sma': False, 'sideways_use_ema': False, 'sideways_use_atr': False, 'sideways_use_adx': False, 'sideways_use_spike': False, 'sideways_rsi_required': False}.
[I 2025-09-01 04:37:38,322] Trial 203 finished with values: [-0.019252614994092254, 0.019139277691288908] and parameters: {'p_sma': 18, 'p_std': 43, 'p_atr': 28, 'p_adx': 20, 'rsi_period': 84, 'ema1': 29, 'ema2': 31, 'slip_atr_k': 0.00011811134223065074, 'slip_spread_k': 0.08715780077147672, 'spread_hl_frac': 0.04174332325042563, 'bb_std_mult': 0.864849576805041, 'rsi_os': 23, 'rsi_ob': 66, 'vol_spike': 0.2360073545850534, 'adx_thresh': 8.402932851698802, 'atr_min_pct': 0.0006919847115995317, 'atr_max_pct': 0.10773025740578814, 'tp_mult': 2.5299592493404077, 'tsl_mult': 0.9634683201831286, 'strategy': 'mean_reversion', 'time_stop': 161, 'use_sma': True, 'use_atr': False, 'use_adx': False, 'use_ema': True, 'use_spike': False, 'rsi_required': False, 'edge_k': 0.407887244616881, 'edge_cap': 0.08581695985096116, 'bull_strategy': 'mean_reversion', 'bull_bb_std_mult': 2.307342250511364, 'bull_rsi_os': 28, 'bull_rsi_ob': 86, 'bull_adx_thresh': 15.304186417391353, 'bull_atr_min_pct': 0.000756853349853718, 'bull_atr_max_pct': 0.1280489393276124, 'bull_tp_mult': 1.567691920629731, 'bull_tsl_mult': 0.3419322283590719, 'bull_time_stop': 200, 'bull_use_sma': True, 'bull_use_ema': False, 'bull_use_atr': True, 'bull_use_adx': False, 'bull_use_spike': False, 'bull_rsi_required': False, 'bear_strategy': 'mean_reversion', 'bear_bb_std_mult': 1.1018133108577752, 'bear_rsi_os': 47, 'bear_rsi_ob': 60, 'bear_adx_thresh': 27.033920945724226, 'bear_atr_min_pct': 0.01576872447091829, 'bear_atr_max_pct': 0.06605698899198803, 'bear_tp_mult': 2.9312844738415005, 'bear_tsl_mult': 0.17092969049681755, 'bear_time_stop': 208, 'bear_use_sma': True, 'bear_use_ema': False, 'bear_use_atr': True, 'bear_use_adx': True, 'bear_use_spike': False, 'bear_rsi_required': True, 'sideways_strategy': 'mean_reversion', 'sideways_bb_std_mult': 3.505764585248637, 'sideways_rsi_os': 7, 'sideways_rsi_ob': 50, 'sideways_adx_thresh': 27.485868172922544, 'sideways_atr_min_pct': 0.023587464393709467, 'sideways_atr_max_pct': 0.09861343378992941, 'sideways_tp_mult': 1.6652824709615743, 'sideways_tsl_mult': 0.9408783744327596, 'sideways_time_stop': 276, 'sideways_use_sma': False, 'sideways_use_ema': False, 'sideways_use_atr': False, 'sideways_use_adx': False, 'sideways_use_spike': False, 'sideways_rsi_required': False}.
[I 2025-09-01 04:37:38,949] Trial 205 finished with values: [-0.019462244986748756, 0.01928254178099299] and parameters: {'p_sma': 46, 'p_std': 43, 'p_atr': 25, 'p_adx': 28, 'rsi_period': 84, 'ema1': 30, 'ema2': 29, 'slip_atr_k': 0.0015100852146539107, 'slip_spread_k': 0.6888219843390655, 'spread_hl_frac': 0.04058029421312269, 'bb_std_mult': 0.9325964934323844, 'rsi_os': 48, 'rsi_ob': 53, 'vol_spike': 0.25808703185463505, 'adx_thresh': 9.730355629357952, 'atr_min_pct': 0.001052835005074316, 'atr_max_pct': 0.12138932904674729, 'tp_mult': 2.4440217780371323, 'tsl_mult': 0.9352397585755254, 'strategy': 'breakout', 'time_stop': 293, 'use_sma': True, 'use_atr': True, 'use_adx': False, 'use_ema': True, 'use_spike': False, 'rsi_required': False, 'edge_k': 1.4994076112589065, 'edge_cap': 0.12875770308150755, 'bull_strategy': 'breakout', 'bull_bb_std_mult': 2.295060678846133, 'bull_rsi_os': 28, 'bull_rsi_ob': 88, 'bull_adx_thresh': 18.839116560868362, 'bull_atr_min_pct': 0.0007547469356467696, 'bull_atr_max_pct': 0.1275478600813298, 'bull_tp_mult': 1.6665376364813484, 'bull_tsl_mult': 0.9231697047150436, 'bull_time_stop': 7, 'bull_use_sma': True, 'bull_use_ema': False, 'bull_use_atr': False, 'bull_use_adx': False, 'bull_use_spike': False, 'bull_rsi_required': True, 'bear_strategy': 'mean_reversion', 'bear_bb_std_mult': 1.3135096535298008, 'bear_rsi_os': 46, 'bear_rsi_ob': 56, 'bear_adx_thresh': 12.653558958608789, 'bear_atr_min_pct': 0.02994995499119699, 'bear_atr_max_pct': 0.12358407011841274, 'bear_tp_mult': 1.0249436160915868, 'bear_tsl_mult': 0.1316239092041468, 'bear_time_stop': 208, 'bear_use_sma': True, 'bear_use_ema': False, 'bear_use_atr': True, 'bear_use_adx': True, 'bear_use_spike': False, 'bear_rsi_required': True, 'sideways_strategy': 'breakout', 'sideways_bb_std_mult': 1.366766572614336, 'sideways_rsi_os': 54, 'sideways_rsi_ob': 46, 'sideways_adx_thresh': 10.87553386743667, 'sideways_atr_min_pct': 0.02420795821329493, 'sideways_atr_max_pct': 0.09891527826444418, 'sideways_tp_mult': 2.475757884774865, 'sideways_tsl_mult': 0.5522381451390846, 'sideways_time_stop': 178, 'sideways_use_sma': True, 'sideways_use_ema': False, 'sideways_use_atr': False, 'sideways_use_adx': False, 'sideways_use_spike': False, 'sideways_rsi_required': False}.
[I 2025-09-01 04:37:39,460] Trial 206 finished with values: [-0.022995233775203405, 0.02283245062927142] and parameters: {'p_sma': 18, 'p_std': 41, 'p_atr': 7, 'p_adx': 18, 'rsi_period': 38, 'ema1': 30, 'ema2': 48, 'slip_atr_k': 0.0002098696677661775, 'slip_spread_k': 0.6038112995841278, 'spread_hl_frac': 0.021608255707481813, 'bb_std_mult': 0.916521181939197, 'rsi_os': 18, 'rsi_ob': 75, 'vol_spike': 0.1581852409972123, 'adx_thresh': 13.42020611584793, 'atr_min_pct': 0.0010269317928145712, 'atr_max_pct': 0.1158705206693208, 'tp_mult': 1.8820462637760873, 'tsl_mult': 0.19618470404783905, 'strategy': 'breakout', 'time_stop': 293, 'use_sma': True, 'use_atr': True, 'use_adx': False, 'use_ema': True, 'use_spike': False, 'rsi_required': False, 'edge_k': 1.5004992067387917, 'edge_cap': 0.19160704977954968, 'bull_strategy': 'breakout', 'bull_bb_std_mult': 2.303537092771213, 'bull_rsi_os': 27, 'bull_rsi_ob': 86, 'bull_adx_thresh': 19.76179557257826, 'bull_atr_min_pct': 0.0007029795525884568, 'bull_atr_max_pct': 0.12783313485825834, 'bull_tp_mult': 1.7406185352575747, 'bull_tsl_mult': 0.41135735773873744, 'bull_time_stop': 24, 'bull_use_sma': True, 'bull_use_ema': False, 'bull_use_atr': False, 'bull_use_adx': False, 'bull_use_spike': False, 'bull_rsi_required': True, 'bear_strategy': 'mean_reversion', 'bear_bb_std_mult': 1.1963020801768203, 'bear_rsi_os': 46, 'bear_rsi_ob': 81, 'bear_adx_thresh': 12.847672515078239, 'bear_atr_min_pct': 0.029929920522615085, 'bear_atr_max_pct': 0.12393915095455672, 'bear_tp_mult': 1.013174937336059, 'bear_tsl_mult': 0.8852324833537909, 'bear_time_stop': 221, 'bear_use_sma': True, 'bear_use_ema': True, 'bear_use_atr': True, 'bear_use_adx': True, 'bear_use_spike': False, 'bear_rsi_required': True, 'sideways_strategy': 'breakout', 'sideways_bb_std_mult': 2.109694699917287, 'sideways_rsi_os': 20, 'sideways_rsi_ob': 46, 'sideways_adx_thresh': 8.322058966395424, 'sideways_atr_min_pct': 0.02447336477215371, 'sideways_atr_max_pct': 0.09799550897970097, 'sideways_tp_mult': 2.4437279188605356, 'sideways_tsl_mult': 0.9361281083142408, 'sideways_time_stop': 273, 'sideways_use_sma': True, 'sideways_use_ema': False, 'sideways_use_atr': False, 'sideways_use_adx': False, 'sideways_use_spike': True, 'sideways_rsi_required': False}.
