[I 2025-09-01 05:30:32,271] Trial 505 finished with values: [-0.028975681405001508, 0.028899339385375082] and parameters: {'p_sma': 59, 'p_std': 32, 'p_atr': 8, 'p_adx': 17, 'rsi_period': 54, 'ema1': 24, 'ema2': 33, 'slip_atr_k': 0.21022529216771724, 'slip_spread_k': 0.38999278708268387, 'spread_hl_frac': 0.0030326977273631983, 'bb_std_mult': 2.1873491597861676, 'rsi_os': 27, 'rsi_ob': 91, 'vol_spike': 0.013349688833029005, 'adx_thresh': 22.743051622978598, 'atr_min_pct': 0.005190655331359546, 'atr_max_pct': 0.05730609353814234, 'tp_mult': 1.8863827291060655, 'tsl_mult': 0.9278610216841882, 'strategy': 'mean_reversion', 'time_stop': 195, 'use_sma': False, 'use_atr': True, 'use_adx': False, 'use_ema': True, 'use_spike': True, 'rsi_required': True, 'edge_k': 0.20172489867704585, 'edge_cap': 0.47516524932872484, 'bull_strategy': 'breakout', 'bull_bb_std_mult': 0.7191535745312443, 'bull_rsi_os': 49, 'bull_rsi_ob': 90, 'bull_adx_thresh': 5.724952337040698, 'bull_atr_min_pct': 0.011313858728301046, 'bull_atr_max_pct': 0.08946919265365538, 'bull_tp_mult': 1.2226018368975764, 'bull_tsl_mult': 0.19484757946405978, 'bull_time_stop': 98, 'bull_use_sma': True, 'bull_use_ema': False, 'bull_use_atr': False, 'bull_use_adx': True, 'bull_use_spike': False, 'bull_rsi_required': True, 'bear_strategy': 'breakout', 'bear_bb_std_mult': 3.537287618997042, 'bear_rsi_os': 9, 'bear_rsi_ob': 69, 'bear_adx_thresh': 30.497177229497584, 'bear_atr_min_pct': 0.005815489031545584, 'bear_atr_max_pct': 0.02987541010046335, 'bear_tp_mult': 2.13513159413636, 'bear_tsl_mult': 0.7055490522675055, 'bear_time_stop': 157, 'bear_use_sma': False, 'bear_use_ema': False, 'bear_use_atr': False, 'bear_use_adx': False, 'bear_use_spike': False, 'bear_rsi_required': True, 'sideways_strategy': 'breakout', 'sideways_bb_std_mult': 2.3098257988283635, 'sideways_rsi_os': 46, 'sideways_rsi_ob': 82, 'sideways_adx_thresh': 24.225249368152664, 'sideways_atr_min_pct': 0.0040132381215362035, 'sideways_atr_max_pct': 0.06297867611641085, 'sideways_tp_mult': 1.5714691396333027, 'sideways_tsl_mult': 0.7553776093045186, 'sideways_time_stop': 166, 'sideways_use_sma': False, 'sideways_use_ema': True, 'sideways_use_atr': True, 'sideways_use_adx': False, 'sideways_use_spike': True, 'sideways_rsi_required': True}.
[I 2025-09-01 05:30:32,646] Trial 504 finished with values: [-0.020911496806692798, 0.02071247290217103] and parameters: {'p_sma': 57, 'p_std': 31, 'p_atr': 8, 'p_adx': 26, 'rsi_period': 54, 'ema1': 23, 'ema2': 58, 'slip_atr_k': 0.1828722221543016, 'slip_spread_k': 0.3835284298606279, 'spread_hl_frac': 0.0033645576040168476, 'bb_std_mult': 1.9416296128244008, 'rsi_os': 28, 'rsi_ob': 91, 'vol_spike': 0.2013782598367235, 'adx_thresh': 23.89754894949775, 'atr_min_pct': 0.005176834280548466, 'atr_max_pct': 0.07928049379800459, 'tp_mult': 2.148391250999431, 'tsl_mult': 0.06350665781132059, 'strategy': 'mean_reversion', 'time_stop': 164, 'use_sma': False, 'use_atr': True, 'use_adx': False, 'use_ema': True, 'use_spike': True, 'rsi_required': True, 'edge_k': 0.22806868278893672, 'edge_cap': 0.4772355166505504, 'bull_strategy': 'breakout', 'bull_bb_std_mult': 0.9496278890407808, 'bull_rsi_os': 46, 'bull_rsi_ob': 90, 'bull_adx_thresh': 5.772722280441945, 'bull_atr_min_pct': 0.011801212270921645, 'bull_atr_max_pct': 0.10625143146448358, 'bull_tp_mult': 1.2143643998376132, 'bull_tsl_mult': 0.20017592042963994, 'bull_time_stop': 98, 'bull_use_sma': True, 'bull_use_ema': False, 'bull_use_atr': False, 'bull_use_adx': True, 'bull_use_spike': False, 'bull_rsi_required': True, 'bear_strategy': 'breakout', 'bear_bb_std_mult': 3.3504308070081623, 'bear_rsi_os': 9, 'bear_rsi_ob': 69, 'bear_adx_thresh': 30.393091283195613, 'bear_atr_min_pct': 0.007039741593432378, 'bear_atr_max_pct': 0.11093030371962644, 'bear_tp_mult': 1.3325755808731368, 'bear_tsl_mult': 0.6719802335240889, 'bear_time_stop': 272, 'bear_use_sma': True, 'bear_use_ema': False, 'bear_use_atr': False, 'bear_use_adx': False, 'bear_use_spike': False, 'bear_rsi_required': True, 'sideways_strategy': 'breakout', 'sideways_bb_std_mult': 2.0937840793057823, 'sideways_rsi_os': 45, 'sideways_rsi_ob': 53, 'sideways_adx_thresh': 21.60499094716245, 'sideways_atr_min_pct': 0.004293996382704907, 'sideways_atr_max_pct': 0.06374778083157184, 'sideways_tp_mult': 1.5699999018758772, 'sideways_tsl_mult': 0.7389390453885822, 'sideways_time_stop': 168, 'sideways_use_sma': False, 'sideways_use_ema': True, 'sideways_use_atr': True, 'sideways_use_adx': False, 'sideways_use_spike': True, 'sideways_rsi_required': True}.
[I 2025-09-01 05:31:13,910] Trial 506 finished with values: [-0.01988108814059253, 0.02014288684330197] and parameters: {'p_sma': 57, 'p_std': 31, 'p_atr': 8, 'p_adx': 17, 'rsi_period': 54, 'ema1': 24, 'ema2': 32, 'slip_atr_k': 0.039227954899195144, 'slip_spread_k': 0.3911914263878437, 'spread_hl_frac': 0.04671060206092929, 'bb_std_mult': 1.9439095723646416, 'rsi_os': 26, 'rsi_ob': 63, 'vol_spike': 0.08674748836912305, 'adx_thresh': 23.750419846182687, 'atr_min_pct': 0.005229803641513646, 'atr_max_pct': 0.03845044704508289, 'tp_mult': 1.4076794484301383, 'tsl_mult': 0.9384501247665007, 'strategy': 'mean_reversion', 'time_stop': 199, 'use_sma': False, 'use_atr': True, 'use_adx': False, 'use_ema': True, 'use_spike': True, 'rsi_required': True, 'edge_k': 0.1835419708053827, 'edge_cap': 0.4755715615378977, 'bull_strategy': 'breakout', 'bull_bb_std_mult': 0.9068282250997262, 'bull_rsi_os': 49, 'bull_rsi_ob': 69, 'bull_adx_thresh': 5.576096253188877, 'bull_atr_min_pct': 0.015114464912582073, 'bull_atr_max_pct': 0.14983465072856392, 'bull_tp_mult': 1.3139503387479352, 'bull_tsl_mult': 0.19693042727419885, 'bull_time_stop': 95, 'bull_use_sma': False, 'bull_use_ema': False, 'bull_use_atr': False, 'bull_use_adx': True, 'bull_use_spike': False, 'bull_rsi_required': True, 'bear_strategy': 'breakout', 'bear_bb_std_mult': 3.595463071561418, 'bear_rsi_os': 9, 'bear_rsi_ob': 45, 'bear_adx_thresh': 8.036764329602978, 'bear_atr_min_pct': 0.005681179656103635, 'bear_atr_max_pct': 0.06611237942601109, 'bear_tp_mult': 1.355480686298109, 'bear_tsl_mult': 0.7052006832645725, 'bear_time_stop': 171, 'bear_use_sma': False, 'bear_use_ema': False, 'bear_use_atr': False, 'bear_use_adx': False, 'bear_use_spike': False, 'bear_rsi_required': True, 'sideways_strategy': 'breakout', 'sideways_bb_std_mult': 0.6863227058218748, 'sideways_rsi_os': 46, 'sideways_rsi_ob': 74, 'sideways_adx_thresh': 23.288168731026634, 'sideways_atr_min_pct': 0.004006667019415953, 'sideways_atr_max_pct': 0.10299619186734758, 'sideways_tp_mult': 1.555327532506264, 'sideways_tsl_mult': 0.8428490722716688, 'sideways_time_stop': 173, 'sideways_use_sma': False, 'sideways_use_ema': True, 'sideways_use_atr': True, 'sideways_use_adx': True, 'sideways_use_spike': True, 'sideways_rsi_required': True}.
[I 2025-09-01 05:31:14,868] Trial 508 finished with values: [-1000000000.0, 1000000000.0] and parameters: {'p_sma': 57, 'p_std': 31, 'p_atr': 7, 'p_adx': 18, 'rsi_period': 54, 'ema1': 24, 'ema2': 11, 'slip_atr_k': 0.059229581011865456, 'slip_spread_k': 0.37551025938726057, 'spread_hl_frac': 0.04631467183204713, 'bb_std_mult': 1.9358289696199746, 'rsi_os': 24, 'rsi_ob': 89, 'vol_spike': 0.07461949369137238, 'adx_thresh': 29.49932507303869, 'atr_min_pct': 0.0057334583456773456, 'atr_max_pct': 0.08019560113098974, 'tp_mult': 2.1680925947956977, 'tsl_mult': 0.7354313545542402, 'strategy': 'breakout', 'time_stop': 184, 'use_sma': False, 'use_atr': True, 'use_adx': False, 'use_ema': False, 'use_spike': True, 'rsi_required': True, 'edge_k': 0.1842043263181416, 'edge_cap': 0.47612386233283743, 'bull_strategy': 'breakout', 'bull_bb_std_mult': 0.879767752491679, 'bull_rsi_os': 49, 'bull_rsi_ob': 74, 'bull_adx_thresh': 5.836319672975702, 'bull_atr_min_pct': 0.013687521517794234, 'bull_atr_max_pct': 0.09921683761491101, 'bull_tp_mult': 1.325460738616301, 'bull_tsl_mult': 0.23588318110363865, 'bull_time_stop': 110, 'bull_use_sma': False, 'bull_use_ema': True, 'bull_use_atr': False, 'bull_use_adx': True, 'bull_use_spike': False, 'bull_rsi_required': True, 'bear_strategy': 'breakout', 'bear_bb_std_mult': 3.5159819514186372, 'bear_rsi_os': 55, 'bear_rsi_ob': 68, 'bear_adx_thresh': 17.319033955331214, 'bear_atr_min_pct': 0.00636222769189778, 'bear_atr_max_pct': 0.06715469397139219, 'bear_tp_mult': 1.3672559045184132, 'bear_tsl_mult': 0.9737677643338187, 'bear_time_stop': 208, 'bear_use_sma': True, 'bear_use_ema': False, 'bear_use_atr': False, 'bear_use_adx': False, 'bear_use_spike': False, 'bear_rsi_required': True, 'sideways_strategy': 'breakout', 'sideways_bb_std_mult': 0.7520815915676798, 'sideways_rsi_os': 26, 'sideways_rsi_ob': 67, 'sideways_adx_thresh': 23.00495422428543, 'sideways_atr_min_pct': 0.005284593927600063, 'sideways_atr_max_pct': 0.10315822766045873, 'sideways_tp_mult': 2.963636818774194, 'sideways_tsl_mult': 0.17067120548581555, 'sideways_time_stop': 179, 'sideways_use_sma': False, 'sideways_use_ema': True, 'sideways_use_atr': True, 'sideways_use_adx': True, 'sideways_use_spike': True, 'sideways_rsi_required': True}.
[I 2025-09-01 05:31:14,893] Trial 507 finished with values: [-1000000000.0, 1000000000.0] and parameters: {'p_sma': 57, 'p_std': 32, 'p_atr': 9, 'p_adx': 18, 'rsi_period': 53, 'ema1': 24, 'ema2': 40, 'slip_atr_k': 0.2261261422296808, 'slip_spread_k': 0.38008286448492884, 'spread_hl_frac': 0.017808330971841136, 'bb_std_mult': 2.1709959345218377, 'rsi_os': 27, 'rsi_ob': 63, 'vol_spike': 0.0741264718485733, 'adx_thresh': 17.599755956378978, 'atr_min_pct': 0.00505805826876197, 'atr_max_pct': 0.12162691376348883, 'tp_mult': 1.4592965020188557, 'tsl_mult': 0.026196959800670105, 'strategy': 'mean_reversion', 'time_stop': 183, 'use_sma': False, 'use_atr': True, 'use_adx': False, 'use_ema': False, 'use_spike': True, 'rsi_required': True, 'edge_k': 0.17669192216012491, 'edge_cap': 0.47987515998758334, 'bull_strategy': 'breakout', 'bull_bb_std_mult': 0.9045444036809831, 'bull_rsi_os': 49, 'bull_rsi_ob': 47, 'bull_adx_thresh': 5.729338678168409, 'bull_atr_min_pct': 0.011521128744089353, 'bull_atr_max_pct': 0.0985609592519677, 'bull_tp_mult': 1.1120863107436614, 'bull_tsl_mult': 0.23646017265462474, 'bull_time_stop': 97, 'bull_use_sma': False, 'bull_use_ema': True, 'bull_use_atr': False, 'bull_use_adx': True, 'bull_use_spike': False, 'bull_rsi_required': True, 'bear_strategy': 'breakout', 'bear_bb_std_mult': 3.5268030839133986, 'bear_rsi_os': 9, 'bear_rsi_ob': 92, 'bear_adx_thresh': 8.142456154376438, 'bear_atr_min_pct': 0.00602059013262355, 'bear_atr_max_pct': 0.02462533260815529, 'bear_tp_mult': 1.3624321510062802, 'bear_tsl_mult': 0.8770776756493692, 'bear_time_stop': 285, 'bear_use_sma': False, 'bear_use_ema': False, 'bear_use_atr': False, 'bear_use_adx': False, 'bear_use_spike': False, 'bear_rsi_required': True, 'sideways_strategy': 'breakout', 'sideways_bb_std_mult': 0.7021869386740628, 'sideways_rsi_os': 45, 'sideways_rsi_ob': 74, 'sideways_adx_thresh': 23.41068172624591, 'sideways_atr_min_pct': 0.005109351335179652, 'sideways_atr_max_pct': 0.10556985896085924, 'sideways_tp_mult': 1.5612380926063365, 'sideways_tsl_mult': 0.12744068859959068, 'sideways_time_stop': 178, 'sideways_use_sma': False, 'sideways_use_ema': True, 'sideways_use_atr': True, 'sideways_use_adx': True, 'sideways_use_spike': True, 'sideways_rsi_required': True}.
[I 2025-09-01 05:31:15,267] Trial 509 finished with values: [-1000000000.0, 1000000000.0] and parameters: {'p_sma': 57, 'p_std': 36, 'p_atr': 7, 'p_adx': 18, 'rsi_period': 50, 'ema1': 24, 'ema2': 40, 'slip_atr_k': 0.23127582259790908, 'slip_spread_k': 0.4110198703323318, 'spread_hl_frac': 0.03522501228452564, 'bb_std_mult': 2.100487438555256, 'rsi_os': 26, 'rsi_ob': 88, 'vol_spike': 0.19605716514532073, 'adx_thresh': 29.309230084444305, 'atr_min_pct': 0.004530823263134746, 'atr_max_pct': 0.024644435388278832, 'tp_mult': 2.9809177892210004, 'tsl_mult': 0.8580715135305534, 'strategy': 'breakout', 'time_stop': 182, 'use_sma': False, 'use_atr': True, 'use_adx': False, 'use_ema': False, 'use_spike': True, 'rsi_required': False, 'edge_k': 0.3003937590450104, 'edge_cap': 0.8327738353065945, 'bull_strategy': 'breakout', 'bull_bb_std_mult': 0.8851422028946059, 'bull_rsi_os': 50, 'bull_rsi_ob': 86, 'bull_adx_thresh': 5.602291688449982, 'bull_atr_min_pct': 0.013544525301594484, 'bull_atr_max_pct': 0.06503085462633112, 'bull_tp_mult': 1.1139912664261613, 'bull_tsl_mult': 0.13954385118040857, 'bull_time_stop': 71, 'bull_use_sma': False, 'bull_use_ema': True, 'bull_use_atr': False, 'bull_use_adx': True, 'bull_use_spike': True, 'bull_rsi_required': True, 'bear_strategy': 'breakout', 'bear_bb_std_mult': 3.522575484984657, 'bear_rsi_os': 9, 'bear_rsi_ob': 68, 'bear_adx_thresh': 18.97698687109911, 'bear_atr_min_pct': 0.005346879234142185, 'bear_atr_max_pct': 0.07431085538562658, 'bear_tp_mult': 1.2661581480720296, 'bear_tsl_mult': 0.6170083296150198, 'bear_time_stop': 169, 'bear_use_sma': False, 'bear_use_ema': False, 'bear_use_atr': False, 'bear_use_adx': False, 'bear_use_spike': True, 'bear_rsi_required': False, 'sideways_strategy': 'breakout', 'sideways_bb_std_mult': 0.6678334921461544, 'sideways_rsi_os': 26, 'sideways_rsi_ob': 72, 'sideways_adx_thresh': 23.32844720824701, 'sideways_atr_min_pct': 0.0052238767764406675, 'sideways_atr_max_pct': 0.1038013544875886, 'sideways_tp_mult': 1.656360524445548, 'sideways_tsl_mult': 0.9677360345162499, 'sideways_time_stop': 179, 'sideways_use_sma': False, 'sideways_use_ema': True, 'sideways_use_atr': True, 'sideways_use_adx': True, 'sideways_use_spike': True, 'sideways_rsi_required': True}.
[I 2025-09-01 05:31:56,580] Trial 513 finished with values: [-0.01944471816251736, 0.019297884579194558] and parameters: {'p_sma': 60, 'p_std': 29, 'p_atr': 7, 'p_adx': 13, 'rsi_period': 52, 'ema1': 25, 'ema2': 15, 'slip_atr_k': 0.01988746982470966, 'slip_spread_k': 0.4221282051493785, 'spread_hl_frac': 0.03857707527624332, 'bb_std_mult': 2.0837750552249785, 'rsi_os': 24, 'rsi_ob': 89, 'vol_spike': 0.06503482480039152, 'adx_thresh': 11.555087309462639, 'atr_min_pct': 0.0024933991612258507, 'atr_max_pct': 0.1487648311942679, 'tp_mult': 1.1314241519293897, 'tsl_mult': 0.5122083712344243, 'strategy': 'breakout', 'time_stop': 190, 'use_sma': False, 'use_atr': True, 'use_adx': True, 'use_ema': True, 'use_spike': False, 'rsi_required': False, 'edge_k': 0.2731200720885681, 'edge_cap': 0.4972598264658846, 'bull_strategy': 'breakout', 'bull_bb_std_mult': 0.9749747638652941, 'bull_rsi_os': 47, 'bull_rsi_ob': 88, 'bull_adx_thresh': 6.855238945902709, 'bull_atr_min_pct': 0.0127018896937685, 'bull_atr_max_pct': 0.08297693006291801, 'bull_tp_mult': 1.2535107133821586, 'bull_tsl_mult': 0.28011227181654164, 'bull_time_stop': 87, 'bull_use_sma': True, 'bull_use_ema': False, 'bull_use_atr': False, 'bull_use_adx': True, 'bull_use_spike': True, 'bull_rsi_required': True, 'bear_strategy': 'breakout', 'bear_bb_std_mult': 3.5997214488967044, 'bear_rsi_os': 51, 'bear_rsi_ob': 67, 'bear_adx_thresh': 21.12492263588393, 'bear_atr_min_pct': 0.007088181329440258, 'bear_atr_max_pct': 0.06998432873397956, 'bear_tp_mult': 1.4010866524433483, 'bear_tsl_mult': 0.6153189670878506, 'bear_time_stop': 208, 'bear_use_sma': True, 'bear_use_ema': True, 'bear_use_atr': False, 'bear_use_adx': False, 'bear_use_spike': True, 'bear_rsi_required': False, 'sideways_strategy': 'breakout', 'sideways_bb_std_mult': 3.5914139505844633, 'sideways_rsi_os': 45, 'sideways_rsi_ob': 56, 'sideways_adx_thresh': 22.67617323735686, 'sideways_atr_min_pct': 0.004737069485578485, 'sideways_atr_max_pct': 0.09764629364363327, 'sideways_tp_mult': 1.6388948562990497, 'sideways_tsl_mult': 0.6424714345714887, 'sideways_time_stop': 125, 'sideways_use_sma': False, 'sideways_use_ema': False, 'sideways_use_atr': True, 'sideways_use_adx': False, 'sideways_use_spike': True, 'sideways_rsi_required': True}.
[I 2025-09-01 05:31:58,755] Trial 512 finished with values: [-0.07625434103365647, 0.07616592730737562] and parameters: {'p_sma': 60, 'p_std': 33, 'p_atr': 7, 'p_adx': 18, 'rsi_period': 49, 'ema1': 25, 'ema2': 35, 'slip_atr_k': 0.047646469115433035, 'slip_spread_k': 0.4333708276859401, 'spread_hl_frac': 0.04640332759874016, 'bb_std_mult': 2.1013736847860667, 'rsi_os': 24, 'rsi_ob': 88, 'vol_spike': 0.06709247995504287, 'adx_thresh': 14.151302693417952, 'atr_min_pct': 0.004534252470596211, 'atr_max_pct': 0.1219031093654583, 'tp_mult': 1.1314686432855425, 'tsl_mult': 0.5278275902922143, 'strategy': 'breakout', 'time_stop': 193, 'use_sma': False, 'use_atr': True, 'use_adx': True, 'use_ema': True, 'use_spike': False, 'rsi_required': False, 'edge_k': 0.28642418518308743, 'edge_cap': 0.6826639650981514, 'bull_strategy': 'breakout', 'bull_bb_std_mult': 0.9859772736155122, 'bull_rsi_os': 47, 'bull_rsi_ob': 88, 'bull_adx_thresh': 6.826061904245518, 'bull_atr_min_pct': 0.013325223768661437, 'bull_atr_max_pct': 0.06236125372958784, 'bull_tp_mult': 1.2446316222341778, 'bull_tsl_mult': 0.13072999191777263, 'bull_time_stop': 88, 'bull_use_sma': True, 'bull_use_ema': False, 'bull_use_atr': False, 'bull_use_adx': True, 'bull_use_spike': True, 'bull_rsi_required': True, 'bear_strategy': 'breakout', 'bear_bb_std_mult': 3.4029992302402228, 'bear_rsi_os': 7, 'bear_rsi_ob': 75, 'bear_adx_thresh': 27.45080576389494, 'bear_atr_min_pct': 0.00686803248245704, 'bear_atr_max_pct': 0.07474710723319267, 'bear_tp_mult': 2.609327942886125, 'bear_tsl_mult': 0.616244450197165, 'bear_time_stop': 241, 'bear_use_sma': True, 'bear_use_ema': True, 'bear_use_atr': False, 'bear_use_adx': False, 'bear_use_spike': True, 'bear_rsi_required': False, 'sideways_strategy': 'breakout', 'sideways_bb_std_mult': 0.655642910895008, 'sideways_rsi_os': 44, 'sideways_rsi_ob': 55, 'sideways_adx_thresh': 22.607623786494013, 'sideways_atr_min_pct': 0.0019775712054616707, 'sideways_atr_max_pct': 0.04404361770934316, 'sideways_tp_mult': 1.651573920752165, 'sideways_tsl_mult': 0.6432743245014787, 'sideways_time_stop': 152, 'sideways_use_sma': False, 'sideways_use_ema': True, 'sideways_use_atr': True, 'sideways_use_adx': False, 'sideways_use_spike': True, 'sideways_rsi_required': True}.
[I 2025-09-01 05:31:59,580] Trial 510 finished with values: [-1000000000.0, 1000000000.0] and parameters: {'p_sma': 60, 'p_std': 33, 'p_atr': 7, 'p_adx': 7, 'rsi_period': 52, 'ema1': 24, 'ema2': 15, 'slip_atr_k': 0.2233937702790818, 'slip_spread_k': 0.4305257247357578, 'spread_hl_frac': 0.02126448251041289, 'bb_std_mult': 2.10425077290452, 'rsi_os': 24, 'rsi_ob': 89, 'vol_spike': 0.06322687628736376, 'adx_thresh': 17.84613610421163, 'atr_min_pct': 0.00435043054266116, 'atr_max_pct': 0.12184334424726326, 'tp_mult': 2.52252234324373, 'tsl_mult': 0.5155951758053318, 'strategy': 'breakout', 'time_stop': 184, 'use_sma': False, 'use_atr': True, 'use_adx': True, 'use_ema': False, 'use_spike': True, 'rsi_required': False, 'edge_k': 0.31072165476807767, 'edge_cap': 0.2668173640676536, 'bull_strategy': 'breakout', 'bull_bb_std_mult': 0.8721208978306028, 'bull_rsi_os': 50, 'bull_rsi_ob': 45, 'bull_adx_thresh': 6.32952263627649, 'bull_atr_min_pct': 0.013518552273824529, 'bull_atr_max_pct': 0.0981210449611151, 'bull_tp_mult': 1.109752366320186, 'bull_tsl_mult': 0.23355898730095515, 'bull_time_stop': 88, 'bull_use_sma': False, 'bull_use_ema': True, 'bull_use_atr': False, 'bull_use_adx': True, 'bull_use_spike': True, 'bull_rsi_required': True, 'bear_strategy': 'breakout', 'bear_bb_std_mult': 3.5112376778970753, 'bear_rsi_os': 37, 'bear_rsi_ob': 74, 'bear_adx_thresh': 29.110106432110904, 'bear_atr_min_pct': 0.006382326949209963, 'bear_atr_max_pct': 0.07330577506615124, 'bear_tp_mult': 1.2488093423396216, 'bear_tsl_mult': 0.9734055592240952, 'bear_time_stop': 115, 'bear_use_sma': True, 'bear_use_ema': False, 'bear_use_atr': False, 'bear_use_adx': False, 'bear_use_spike': True, 'bear_rsi_required': False, 'sideways_strategy': 'breakout', 'sideways_bb_std_mult': 3.5976210883314517, 'sideways_rsi_os': 16, 'sideways_rsi_ob': 67, 'sideways_adx_thresh': 22.78000234038143, 'sideways_atr_min_pct': 0.005376329076349739, 'sideways_atr_max_pct': 0.10632566815059334, 'sideways_tp_mult': 1.656379465099348, 'sideways_tsl_mult': 0.9997261940895936, 'sideways_time_stop': 105, 'sideways_use_sma': False, 'sideways_use_ema': True, 'sideways_use_atr': True, 'sideways_use_adx': True, 'sideways_use_spike': True, 'sideways_rsi_required': True}.
