[I 2025-09-01 04:41:37,984] Trial 225 finished with values: [-0.028156629936373023, 0.02799208499136254] and parameters: {'p_sma': 28, 'p_std': 43, 'p_atr': 26, 'p_adx': 19, 'rsi_period': 62, 'ema1': 30, 'ema2': 50, 'slip_atr_k': 0.15209267836886653, 'slip_spread_k': 0.7029376675960549, 'spread_hl_frac': 0.04151973504612983, 'bb_std_mult': 0.9066000399864269, 'rsi_os': 46, 'rsi_ob': 56, 'vol_spike': 0.18920270349728774, 'adx_thresh': 34.963391305255456, 'atr_min_pct': 0.007241496026239485, 'atr_max_pct': 0.11889831627402815, 'tp_mult': 2.459689901950203, 'tsl_mult': 0.9619964959494257, 'strategy': 'breakout', 'time_stop': 150, 'use_sma': True, 'use_atr': True, 'use_adx': False, 'use_ema': True, 'use_spike': True, 'rsi_required': False, 'edge_k': 0.601331808156237, 'edge_cap': 0.5297919769200169, 'bull_strategy': 'mean_reversion', 'bull_bb_std_mult': 2.2133021911303907, 'bull_rsi_os': 30, 'bull_rsi_ob': 88, 'bull_adx_thresh': 17.96237709888276, 'bull_atr_min_pct': 0.0011542351986602853, 'bull_atr_max_pct': 0.12362755320487924, 'bull_tp_mult': 1.596730860264435, 'bull_tsl_mult': 0.3925750214419833, 'bull_time_stop': 230, 'bull_use_sma': True, 'bull_use_ema': False, 'bull_use_atr': True, 'bull_use_adx': False, 'bull_use_spike': False, 'bull_rsi_required': False, 'bear_strategy': 'mean_reversion', 'bear_bb_std_mult': 1.0786793605228138, 'bear_rsi_os': 46, 'bear_rsi_ob': 56, 'bear_adx_thresh': 31.431414341766214, 'bear_atr_min_pct': 0.029984024500408057, 'bear_atr_max_pct': 0.06625513454413243, 'bear_tp_mult': 2.281779528926544, 'bear_tsl_mult': 0.13351846383346822, 'bear_time_stop': 210, 'bear_use_sma': True, 'bear_use_ema': True, 'bear_use_atr': True, 'bear_use_adx': True, 'bear_use_spike': False, 'bear_rsi_required': True, 'sideways_strategy': 'mean_reversion', 'sideways_bb_std_mult': 1.3719132953671271, 'sideways_rsi_os': 6, 'sideways_rsi_ob': 64, 'sideways_adx_thresh': 17.102905203074233, 'sideways_atr_min_pct': 0.02427866823495107, 'sideways_atr_max_pct': 0.03419389097259355, 'sideways_tp_mult': 1.6772906469981912, 'sideways_tsl_mult': 0.9609990731996356, 'sideways_time_stop': 181, 'sideways_use_sma': True, 'sideways_use_ema': False, 'sideways_use_atr': False, 'sideways_use_adx': False, 'sideways_use_spike': True, 'sideways_rsi_required': False}.
[I 2025-09-01 04:41:38,177] Trial 226 finished with values: [-1000000000.0, 1000000000.0] and parameters: {'p_sma': 40, 'p_std': 42, 'p_atr': 27, 'p_adx': 19, 'rsi_period': 62, 'ema1': 30, 'ema2': 31, 'slip_atr_k': 0.0004010813635266907, 'slip_spread_k': 0.3056185663945086, 'spread_hl_frac': 0.04184340607611755, 'bb_std_mult': 3.2824797340316225, 'rsi_os': 15, 'rsi_ob': 55, 'vol_spike': 0.2484558453086327, 'adx_thresh': 26.881031905417757, 'atr_min_pct': 0.011565584310787368, 'atr_max_pct': 0.05655021922411131, 'tp_mult': 1.5974317629741774, 'tsl_mult': 0.9779951526203918, 'strategy': 'breakout', 'time_stop': 43, 'use_sma': True, 'use_atr': False, 'use_adx': False, 'use_ema': True, 'use_spike': True, 'rsi_required': False, 'edge_k': 1.5255252238408117, 'edge_cap': 0.17319009101083793, 'bull_strategy': 'mean_reversion', 'bull_bb_std_mult': 2.7887789189154466, 'bull_rsi_os': 29, 'bull_rsi_ob': 56, 'bull_adx_thresh': 34.99822445231418, 'bull_atr_min_pct': 0.0012144774353332489, 'bull_atr_max_pct': 0.12467299490983956, 'bull_tp_mult': 1.643972046253128, 'bull_tsl_mult': 0.3889451145730272, 'bull_time_stop': 213, 'bull_use_sma': True, 'bull_use_ema': False, 'bull_use_atr': True, 'bull_use_adx': False, 'bull_use_spike': False, 'bull_rsi_required': False, 'bear_strategy': 'mean_reversion', 'bear_bb_std_mult': 1.0719802054775358, 'bear_rsi_os': 45, 'bear_rsi_ob': 56, 'bear_adx_thresh': 31.858651083204414, 'bear_atr_min_pct': 0.00603787204628559, 'bear_atr_max_pct': 0.040817723954905655, 'bear_tp_mult': 2.0202106939710176, 'bear_tsl_mult': 0.13421249136561111, 'bear_time_stop': 208, 'bear_use_sma': True, 'bear_use_ema': True, 'bear_use_atr': True, 'bear_use_adx': False, 'bear_use_spike': False, 'bear_rsi_required': True, 'sideways_strategy': 'mean_reversion', 'sideways_bb_std_mult': 1.3630834356380084, 'sideways_rsi_os': 5, 'sideways_rsi_ob': 64, 'sideways_adx_thresh': 29.080954634841746, 'sideways_atr_min_pct': 0.024493111931087577, 'sideways_atr_max_pct': 0.03827538296142262, 'sideways_tp_mult': 2.7882311571918836, 'sideways_tsl_mult': 0.9689516933487753, 'sideways_time_stop': 180, 'sideways_use_sma': True, 'sideways_use_ema': False, 'sideways_use_atr': False, 'sideways_use_adx': False, 'sideways_use_spike': True, 'sideways_rsi_required': False}.
[I 2025-09-01 04:41:38,525] Trial 224 finished with values: [-1000000000.0, 1000000000.0] and parameters: {'p_sma': 19, 'p_std': 55, 'p_atr': 26, 'p_adx': 19, 'rsi_period': 62, 'ema1': 30, 'ema2': 51, 'slip_atr_k': 0.004584969480295129, 'slip_spread_k': 0.3057759216620228, 'spread_hl_frac': 0.042149733078156434, 'bb_std_mult': 1.7931090417012137, 'rsi_os': 46, 'rsi_ob': 56, 'vol_spike': 0.13639780482257238, 'adx_thresh': 15.535731327554192, 'atr_min_pct': 0.006897602335273237, 'atr_max_pct': 0.14209713076280453, 'tp_mult': 2.4680563660986494, 'tsl_mult': 0.9564108803134975, 'strategy': 'breakout', 'time_stop': 42, 'use_sma': True, 'use_atr': True, 'use_adx': False, 'use_ema': True, 'use_spike': True, 'rsi_required': False, 'edge_k': 0.6008187409846019, 'edge_cap': 0.9483265672047555, 'bull_strategy': 'mean_reversion', 'bull_bb_std_mult': 2.647457797378816, 'bull_rsi_os': 29, 'bull_rsi_ob': 92, 'bull_adx_thresh': 17.994310033958875, 'bull_atr_min_pct': 0.0013103728276500763, 'bull_atr_max_pct': 0.12282536655732185, 'bull_tp_mult': 1.5892951783706608, 'bull_tsl_mult': 0.3925287933258822, 'bull_time_stop': 215, 'bull_use_sma': True, 'bull_use_ema': False, 'bull_use_atr': True, 'bull_use_adx': False, 'bull_use_spike': False, 'bull_rsi_required': False, 'bear_strategy': 'mean_reversion', 'bear_bb_std_mult': 1.0680164527496367, 'bear_rsi_os': 46, 'bear_rsi_ob': 56, 'bear_adx_thresh': 28.117504776286452, 'bear_atr_min_pct': 0.006197504860450795, 'bear_atr_max_pct': 0.06521910278629431, 'bear_tp_mult': 1.0522153759763482, 'bear_tsl_mult': 0.27788064402548873, 'bear_time_stop': 208, 'bear_use_sma': True, 'bear_use_ema': True, 'bear_use_atr': True, 'bear_use_adx': True, 'bear_use_spike': False, 'bear_rsi_required': False, 'sideways_strategy': 'mean_reversion', 'sideways_bb_std_mult': 1.5213029294148794, 'sideways_rsi_os': 7, 'sideways_rsi_ob': 49, 'sideways_adx_thresh': 17.141797208559762, 'sideways_atr_min_pct': 0.019976796137308732, 'sideways_atr_max_pct': 0.02102208245110266, 'sideways_tp_mult': 2.4853310252049203, 'sideways_tsl_mult': 0.9613868286246137, 'sideways_time_stop': 180, 'sideways_use_sma': False, 'sideways_use_ema': True, 'sideways_use_atr': False, 'sideways_use_adx': False, 'sideways_use_spike': True, 'sideways_rsi_required': False}.
[I 2025-09-01 04:42:21,368] Trial 229 finished with values: [-0.04727014762322701, 0.04718359232901879] and parameters: {'p_sma': 21, 'p_std': 5, 'p_atr': 23, 'p_adx': 20, 'rsi_period': 16, 'ema1': 5, 'ema2': 50, 'slip_atr_k': 0.003015113564083036, 'slip_spread_k': 0.33970474936270945, 'spread_hl_frac': 0.04195673144041528, 'bb_std_mult': 0.9051345661461511, 'rsi_os': 9, 'rsi_ob': 56, 'vol_spike': 0.05309323282859177, 'adx_thresh': 26.219338439804805, 'atr_min_pct': 0.0023082231522595312, 'atr_max_pct': 0.11952481301174701, 'tp_mult': 2.3480917893081563, 'tsl_mult': 0.9834370267601842, 'strategy': 'breakout', 'time_stop': 24, 'use_sma': True, 'use_atr': True, 'use_adx': False, 'use_ema': True, 'use_spike': False, 'rsi_required': False, 'edge_k': 0.5558040871876023, 'edge_cap': 0.1780739116597708, 'bull_strategy': 'breakout', 'bull_bb_std_mult': 0.5482622966974011, 'bull_rsi_os': 29, 'bull_rsi_ob': 74, 'bull_adx_thresh': 26.357759365484707, 'bull_atr_min_pct': 0.001186910625339974, 'bull_atr_max_pct': 0.12288836800972493, 'bull_tp_mult': 1.5949505798611905, 'bull_tsl_mult': 0.881084935694598, 'bull_time_stop': 209, 'bull_use_sma': True, 'bull_use_ema': False, 'bull_use_atr': False, 'bull_use_adx': False, 'bull_use_spike': False, 'bull_rsi_required': True, 'bear_strategy': 'mean_reversion', 'bear_bb_std_mult': 3.0290596493699904, 'bear_rsi_os': 45, 'bear_rsi_ob': 56, 'bear_adx_thresh': 12.538869759711377, 'bear_atr_min_pct': 0.029949865330857903, 'bear_atr_max_pct': 0.0657831858186631, 'bear_tp_mult': 1.0664340528746095, 'bear_tsl_mult': 0.15808687584116835, 'bear_time_stop': 275, 'bear_use_sma': True, 'bear_use_ema': True, 'bear_use_atr': True, 'bear_use_adx': True, 'bear_use_spike': False, 'bear_rsi_required': True, 'sideways_strategy': 'mean_reversion', 'sideways_bb_std_mult': 1.3408392687816673, 'sideways_rsi_os': 5, 'sideways_rsi_ob': 64, 'sideways_adx_thresh': 11.305894513840808, 'sideways_atr_min_pct': 0.025250807667784866, 'sideways_atr_max_pct': 0.03127920871235933, 'sideways_tp_mult': 2.8852931066005985, 'sideways_tsl_mult': 0.08319854755357103, 'sideways_time_stop': 185, 'sideways_use_sma': True, 'sideways_use_ema': False, 'sideways_use_atr': False, 'sideways_use_adx': False, 'sideways_use_spike': True, 'sideways_rsi_required': True}.
[I 2025-09-01 04:42:22,369] Trial 231 finished with values: [-0.06257116174902533, 0.062439745092121524] and parameters: {'p_sma': 50, 'p_std': 25, 'p_atr': 25, 'p_adx': 20, 'rsi_period': 12, 'ema1': 27, 'ema2': 27, 'slip_atr_k': 0.0002146101303412596, 'slip_spread_k': 0.33534183863691785, 'spread_hl_frac': 0.03991727577858171, 'bb_std_mult': 0.9217581749937067, 'rsi_os': 45, 'rsi_ob': 53, 'vol_spike': 0.188432964850275, 'adx_thresh': 25.917649796246316, 'atr_min_pct': 0.029226976241945174, 'atr_max_pct': 0.11745052047409729, 'tp_mult': 1.9633051853665984, 'tsl_mult': 0.10133231988004104, 'strategy': 'breakout', 'time_stop': 27, 'use_sma': True, 'use_atr': True, 'use_adx': True, 'use_ema': True, 'use_spike': False, 'rsi_required': False, 'edge_k': 0.5605210038314395, 'edge_cap': 0.14832399910304134, 'bull_strategy': 'breakout', 'bull_bb_std_mult': 3.199084154991269, 'bull_rsi_os': 11, 'bull_rsi_ob': 53, 'bull_adx_thresh': 19.70207258374096, 'bull_atr_min_pct': 7.453484153721601e-06, 'bull_atr_max_pct': 0.13079458859735316, 'bull_tp_mult': 1.5969399335259244, 'bull_tsl_mult': 0.3600460810319515, 'bull_time_stop': 228, 'bull_use_sma': False, 'bull_use_ema': False, 'bull_use_atr': False, 'bull_use_adx': False, 'bull_use_spike': False, 'bull_rsi_required': True, 'bear_strategy': 'mean_reversion', 'bear_bb_std_mult': 1.2237729291408102, 'bear_rsi_os': 45, 'bear_rsi_ob': 58, 'bear_adx_thresh': 9.159688915207964, 'bear_atr_min_pct': 0.0030096360791609118, 'bear_atr_max_pct': 0.14364310392044805, 'bear_tp_mult': 2.286075073154556, 'bear_tsl_mult': 0.7977096297550379, 'bear_time_stop': 191, 'bear_use_sma': True, 'bear_use_ema': False, 'bear_use_atr': False, 'bear_use_adx': True, 'bear_use_spike': False, 'bear_rsi_required': True, 'sideways_strategy': 'mean_reversion', 'sideways_bb_std_mult': 2.192495006346322, 'sideways_rsi_os': 32, 'sideways_rsi_ob': 79, 'sideways_adx_thresh': 24.068249691363594, 'sideways_atr_min_pct': 0.019254952725939425, 'sideways_atr_max_pct': 0.09493662162175562, 'sideways_tp_mult': 1.6973502830759741, 'sideways_tsl_mult': 0.9199463429228746, 'sideways_time_stop': 173, 'sideways_use_sma': True, 'sideways_use_ema': True, 'sideways_use_atr': False, 'sideways_use_adx': True, 'sideways_use_spike': False, 'sideways_rsi_required': True}.
[I 2025-09-01 04:42:22,376] Trial 228 finished with values: [-0.021738908608891716, 0.021595479841015692] and parameters: {'p_sma': 26, 'p_std': 42, 'p_atr': 24, 'p_adx': 19, 'rsi_period': 45, 'ema1': 30, 'ema2': 50, 'slip_atr_k': 0.00030661384578407907, 'slip_spread_k': 0.3072470839565994, 'spread_hl_frac': 0.0418520927196484, 'bb_std_mult': 0.8998269686588948, 'rsi_os': 46, 'rsi_ob': 55, 'vol_spike': 0.24983534951303593, 'adx_thresh': 26.173813390571596, 'atr_min_pct': 0.00252369726123086, 'atr_max_pct': 0.11807336594417767, 'tp_mult': 2.4821168190240064, 'tsl_mult': 0.8758082274527271, 'strategy': 'breakout', 'time_stop': 44, 'use_sma': True, 'use_atr': True, 'use_adx': False, 'use_ema': True, 'use_spike': True, 'rsi_required': False, 'edge_k': 0.5675522164755248, 'edge_cap': 0.17397484808643648, 'bull_strategy': 'breakout', 'bull_bb_std_mult': 2.226238285444993, 'bull_rsi_os': 36, 'bull_rsi_ob': 52, 'bull_adx_thresh': 20.563715382179534, 'bull_atr_min_pct': 0.001027962983010131, 'bull_atr_max_pct': 0.09095763393067613, 'bull_tp_mult': 1.5957786970957073, 'bull_tsl_mult': 0.4360615253508707, 'bull_time_stop': 215, 'bull_use_sma': True, 'bull_use_ema': False, 'bull_use_atr': False, 'bull_use_adx': False, 'bull_use_spike': False, 'bull_rsi_required': True, 'bear_strategy': 'mean_reversion', 'bear_bb_std_mult': 1.101359597157531, 'bear_rsi_os': 49, 'bear_rsi_ob': 56, 'bear_adx_thresh': 31.98874391044364, 'bear_atr_min_pct': 0.029544937395003735, 'bear_atr_max_pct': 0.1490302628516913, 'bear_tp_mult': 1.0614689009285159, 'bear_tsl_mult': 0.13375515762998022, 'bear_time_stop': 190, 'bear_use_sma': True, 'bear_use_ema': True, 'bear_use_atr': True, 'bear_use_adx': True, 'bear_use_spike': False, 'bear_rsi_required': True, 'sideways_strategy': 'mean_reversion', 'sideways_bb_std_mult': 1.3449842302620754, 'sideways_rsi_os': 5, 'sideways_rsi_ob': 47, 'sideways_adx_thresh': 17.37387311142855, 'sideways_atr_min_pct': 0.025337588097442756, 'sideways_atr_max_pct': 0.09647254965785682, 'sideways_tp_mult': 2.77928166839079, 'sideways_tsl_mult': 0.183168683375861, 'sideways_time_stop': 13, 'sideways_use_sma': True, 'sideways_use_ema': False, 'sideways_use_atr': False, 'sideways_use_adx': False, 'sideways_use_spike': True, 'sideways_rsi_required': True}.
[I 2025-09-01 04:42:22,742] Trial 230 finished with values: [-0.024342032200213026, 0.02425371948357169] and parameters: {'p_sma': 15, 'p_std': 22, 'p_atr': 26, 'p_adx': 20, 'rsi_period': 45, 'ema1': 12, 'ema2': 50, 'slip_atr_k': 0.004311819333709532, 'slip_spread_k': 0.6823836823151692, 'spread_hl_frac': 0.03900582917057082, 'bb_std_mult': 0.9077463659183701, 'rsi_os': 46, 'rsi_ob': 66, 'vol_spike': 0.2559859420225444, 'adx_thresh': 25.739929893426137, 'atr_min_pct': 0.0026392834556038915, 'atr_max_pct': 0.09481232770139492, 'tp_mult': 2.4543130439932783, 'tsl_mult': 0.9423492377157952, 'strategy': 'breakout', 'time_stop': 150, 'use_sma': True, 'use_atr': True, 'use_adx': False, 'use_ema': True, 'use_spike': False, 'rsi_required': False, 'edge_k': 0.5620441396250369, 'edge_cap': 0.1467092509236991, 'bull_strategy': 'breakout', 'bull_bb_std_mult': 0.5099561637976726, 'bull_rsi_os': 29, 'bull_rsi_ob': 53, 'bull_adx_thresh': 26.13478447312309, 'bull_atr_min_pct': 2.070521106153358e-05, 'bull_atr_max_pct': 0.13110239143484018, 'bull_tp_mult': 1.5896417619835712, 'bull_tsl_mult': 0.3574855481430729, 'bull_time_stop': 204, 'bull_use_sma': True, 'bull_use_ema': False, 'bull_use_atr': False, 'bull_use_adx': False, 'bull_use_spike': False, 'bull_rsi_required': True, 'bear_strategy': 'mean_reversion', 'bear_bb_std_mult': 2.005659075838464, 'bear_rsi_os': 5, 'bear_rsi_ob': 56, 'bear_adx_thresh': 18.03642745981751, 'bear_atr_min_pct': 0.02999050702104615, 'bear_atr_max_pct': 0.14959039672880667, 'bear_tp_mult': 1.0665318151930407, 'bear_tsl_mult': 0.2766313557767429, 'bear_time_stop': 182, 'bear_use_sma': True, 'bear_use_ema': True, 'bear_use_atr': True, 'bear_use_adx': True, 'bear_use_spike': False, 'bear_rsi_required': True, 'sideways_strategy': 'mean_reversion', 'sideways_bb_std_mult': 2.3158853823918952, 'sideways_rsi_os': 8, 'sideways_rsi_ob': 47, 'sideways_adx_thresh': 15.345151887255765, 'sideways_atr_min_pct': 0.02538403520575203, 'sideways_atr_max_pct': 0.10235897264965929, 'sideways_tp_mult': 2.883532098314895, 'sideways_tsl_mult': 0.4453652750283265, 'sideways_time_stop': 171, 'sideways_use_sma': True, 'sideways_use_ema': True, 'sideways_use_atr': False, 'sideways_use_adx': False, 'sideways_use_spike': True, 'sideways_rsi_required': True}.
[I 2025-09-01 04:43:09,650] Trial 233 finished with values: [-1000000000.0, 1000000000.0] and parameters: {'p_sma': 26, 'p_std': 43, 'p_atr': 26, 'p_adx': 17, 'rsi_period': 60, 'ema1': 30, 'ema2': 27, 'slip_atr_k': 0.030330795418095177, 'slip_spread_k': 0.2740611145800207, 'spread_hl_frac': 0.03127176891122333, 'bb_std_mult': 0.7903058934009743, 'rsi_os': 47, 'rsi_ob': 58, 'vol_spike': 0.25372838582093016, 'adx_thresh': 15.200872647784367, 'atr_min_pct': 0.0010693046065820453, 'atr_max_pct': 0.118977465350644, 'tp_mult': 2.451976868112748, 'tsl_mult': 0.9411080625614803, 'strategy': 'breakout', 'time_stop': 13, 'use_sma': True, 'use_atr': False, 'use_adx': False, 'use_ema': True, 'use_spike': True, 'rsi_required': False, 'edge_k': 0.17982992699151046, 'edge_cap': 0.3403788107830581, 'bull_strategy': 'mean_reversion', 'bull_bb_std_mult': 2.229906206827925, 'bull_rsi_os': 41, 'bull_rsi_ob': 81, 'bull_adx_thresh': 20.813963416523947, 'bull_atr_min_pct': 0.027731840322903503, 'bull_atr_max_pct': 0.1316973241665856, 'bull_tp_mult': 1.6352498435648515, 'bull_tsl_mult': 0.04908007366413747, 'bull_time_stop': 279, 'bull_use_sma': True, 'bull_use_ema': False, 'bull_use_atr': True, 'bull_use_adx': False, 'bull_use_spike': False, 'bull_rsi_required': False, 'bear_strategy': 'mean_reversion', 'bear_bb_std_mult': 1.8376189136537289, 'bear_rsi_os': 49, 'bear_rsi_ob': 78, 'bear_adx_thresh': 13.987631588164607, 'bear_atr_min_pct': 0.016109228504445804, 'bear_atr_max_pct': 0.1498110826898538, 'bear_tp_mult': 1.1076914382780927, 'bear_tsl_mult': 0.7337281917934809, 'bear_time_stop': 197, 'bear_use_sma': False, 'bear_use_ema': False, 'bear_use_atr': True, 'bear_use_adx': True, 'bear_use_spike': False, 'bear_rsi_required': False, 'sideways_strategy': 'breakout', 'sideways_bb_std_mult': 1.2025969303164605, 'sideways_rsi_os': 8, 'sideways_rsi_ob': 47, 'sideways_adx_thresh': 17.59861705385737, 'sideways_atr_min_pct': 0.024122236546480567, 'sideways_atr_max_pct': 0.11936385323469072, 'sideways_tp_mult': 2.8204913668270377, 'sideways_tsl_mult': 0.183670771993879, 'sideways_time_stop': 189, 'sideways_use_sma': True, 'sideways_use_ema': True, 'sideways_use_atr': False, 'sideways_use_adx': False, 'sideways_use_spike': False, 'sideways_rsi_required': False}.
[I 2025-09-01 04:43:10,150] Trial 235 finished with values: [-1000000000.0, 1000000000.0] and parameters: {'p_sma': 26, 'p_std': 22, 'p_atr': 26, 'p_adx': 19, 'rsi_period': 45, 'ema1': 30, 'ema2': 29, 'slip_atr_k': 0.008388892652004773, 'slip_spread_k': 0.2822582232759864, 'spread_hl_frac': 0.03133127800991876, 'bb_std_mult': 0.9805909540397958, 'rsi_os': 31, 'rsi_ob': 67, 'vol_spike': 0.2539576819466951, 'adx_thresh': 14.811093782738865, 'atr_min_pct': 0.0009714559613888372, 'atr_max_pct': 0.09360111562984368, 'tp_mult': 1.4401579494244379, 'tsl_mult': 0.9086256332233913, 'strategy': 'mean_reversion', 'time_stop': 171, 'use_sma': True, 'use_atr': False, 'use_adx': False, 'use_ema': True, 'use_spike': True, 'rsi_required': False, 'edge_k': 0.6738923372861719, 'edge_cap': 0.531604513074658, 'bull_strategy': 'mean_reversion', 'bull_bb_std_mult': 1.7425812690593623, 'bull_rsi_os': 27, 'bull_rsi_ob': 87, 'bull_adx_thresh': 20.606597760803627, 'bull_atr_min_pct': 0.006052087159931054, 'bull_atr_max_pct': 0.13142591559687322, 'bull_tp_mult': 2.7876390699462963, 'bull_tsl_mult': 0.3599913256654791, 'bull_time_stop': 276, 'bull_use_sma': True, 'bull_use_ema': False, 'bull_use_atr': True, 'bull_use_adx': False, 'bull_use_spike': False, 'bull_rsi_required': False, 'bear_strategy': 'mean_reversion', 'bear_bb_std_mult': 1.113235282798505, 'bear_rsi_os': 49, 'bear_rsi_ob': 80, 'bear_adx_thresh': 17.870208350431913, 'bear_atr_min_pct': 0.02995561230397001, 'bear_atr_max_pct': 0.14910311852379632, 'bear_tp_mult': 1.0535778299280871, 'bear_tsl_mult': 0.7370551765954478, 'bear_time_stop': 197, 'bear_use_sma': False, 'bear_use_ema': False, 'bear_use_atr': True, 'bear_use_adx': False, 'bear_use_spike': False, 'bear_rsi_required': False, 'sideways_strategy': 'breakout', 'sideways_bb_std_mult': 2.34209815058316, 'sideways_rsi_os': 47, 'sideways_rsi_ob': 47, 'sideways_adx_thresh': 17.62017089404228, 'sideways_atr_min_pct': 0.024016651751536267, 'sideways_atr_max_pct': 0.1190831607902022, 'sideways_tp_mult': 2.8170150357418, 'sideways_tsl_mult': 0.441985529237349, 'sideways_time_stop': 195, 'sideways_use_sma': True, 'sideways_use_ema': True, 'sideways_use_atr': False, 'sideways_use_adx': False, 'sideways_use_spike': False, 'sideways_rsi_required': False}.
