[I 2025-09-01 05:20:26,119] Trial 453 finished with values: [-0.017558596109603752, 0.01781610183319076] and parameters: {'p_sma': 58, 'p_std': 32, 'p_atr': 7, 'p_adx': 17, 'rsi_period': 52, 'ema1': 24, 'ema2': 34, 'slip_atr_k': 0.025028136719393506, 'slip_spread_k': 0.4015341580641777, 'spread_hl_frac': 0.049944862056369235, 'bb_std_mult': 2.0600255724527523, 'rsi_os': 26, 'rsi_ob': 89, 'vol_spike': 0.2008344143548547, 'adx_thresh': 12.3773751198153, 'atr_min_pct': 0.003707199306717367, 'atr_max_pct': 0.12502769229831306, 'tp_mult': 2.4382415191925157, 'tsl_mult': 0.9091696301319406, 'strategy': 'breakout', 'time_stop': 183, 'use_sma': False, 'use_atr': True, 'use_adx': False, 'use_ema': True, 'use_spike': True, 'rsi_required': False, 'edge_k': 0.19230231242001097, 'edge_cap': 0.9952711295883311, 'bull_strategy': 'breakout', 'bull_bb_std_mult': 0.8522971813561852, 'bull_rsi_os': 45, 'bull_rsi_ob': 65, 'bull_adx_thresh': 5.580053072273856, 'bull_atr_min_pct': 0.013667658288711745, 'bull_atr_max_pct': 0.10572984920918294, 'bull_tp_mult': 1.2661504221833744, 'bull_tsl_mult': 0.1905182278747609, 'bull_time_stop': 87, 'bull_use_sma': True, 'bull_use_ema': False, 'bull_use_atr': False, 'bull_use_adx': True, 'bull_use_spike': True, 'bull_rsi_required': True, 'bear_strategy': 'breakout', 'bear_bb_std_mult': 3.5838114116244295, 'bear_rsi_os': 7, 'bear_rsi_ob': 69, 'bear_adx_thresh': 30.11457287991453, 'bear_atr_min_pct': 0.007550576735551879, 'bear_atr_max_pct': 0.07207493082555153, 'bear_tp_mult': 1.287179604067085, 'bear_tsl_mult': 0.6589106240517812, 'bear_time_stop': 196, 'bear_use_sma': False, 'bear_use_ema': False, 'bear_use_atr': False, 'bear_use_adx': False, 'bear_use_spike': True, 'bear_rsi_required': False, 'sideways_strategy': 'breakout', 'sideways_bb_std_mult': 0.6166445283879453, 'sideways_rsi_os': 44, 'sideways_rsi_ob': 52, 'sideways_adx_thresh': 23.680182678211043, 'sideways_atr_min_pct': 0.00426487880301497, 'sideways_atr_max_pct': 0.10170655351572404, 'sideways_tp_mult': 1.5366889049451258, 'sideways_tsl_mult': 0.9993206206461557, 'sideways_time_stop': 163, 'sideways_use_sma': False, 'sideways_use_ema': False, 'sideways_use_atr': True, 'sideways_use_adx': False, 'sideways_use_spike': True, 'sideways_rsi_required': True}.
[I 2025-09-01 05:20:26,822] Trial 452 finished with values: [-0.016431066832976238, 0.01668118006980208] and parameters: {'p_sma': 58, 'p_std': 32, 'p_atr': 7, 'p_adx': 17, 'rsi_period': 54, 'ema1': 24, 'ema2': 34, 'slip_atr_k': 0.02901519425607905, 'slip_spread_k': 0.38949095003765705, 'spread_hl_frac': 0.04890788457333564, 'bb_std_mult': 2.053314679654314, 'rsi_os': 27, 'rsi_ob': 90, 'vol_spike': 0.20000595612841376, 'adx_thresh': 12.369410106273715, 'atr_min_pct': 0.003652472620241231, 'atr_max_pct': 0.12440100372948516, 'tp_mult': 2.4507495708539184, 'tsl_mult': 0.9247310370401843, 'strategy': 'breakout', 'time_stop': 182, 'use_sma': False, 'use_atr': True, 'use_adx': False, 'use_ema': False, 'use_spike': True, 'rsi_required': True, 'edge_k': 0.1616402818379765, 'edge_cap': 0.5553360438241568, 'bull_strategy': 'breakout', 'bull_bb_std_mult': 0.821838889338538, 'bull_rsi_os': 44, 'bull_rsi_ob': 48, 'bull_adx_thresh': 6.056990095790469, 'bull_atr_min_pct': 0.013676723736840594, 'bull_atr_max_pct': 0.10492007617576372, 'bull_tp_mult': 1.2641287624828337, 'bull_tsl_mult': 0.18876358074256339, 'bull_time_stop': 90, 'bull_use_sma': True, 'bull_use_ema': True, 'bull_use_atr': False, 'bull_use_adx': True, 'bull_use_spike': True, 'bull_rsi_required': True, 'bear_strategy': 'breakout', 'bear_bb_std_mult': 3.581683116932615, 'bear_rsi_os': 7, 'bear_rsi_ob': 70, 'bear_adx_thresh': 30.05103171043418, 'bear_atr_min_pct': 0.007283372924316176, 'bear_atr_max_pct': 0.07523389668335526, 'bear_tp_mult': 1.285799620644579, 'bear_tsl_mult': 0.6590637019510499, 'bear_time_stop': 197, 'bear_use_sma': False, 'bear_use_ema': False, 'bear_use_atr': False, 'bear_use_adx': False, 'bear_use_spike': True, 'bear_rsi_required': False, 'sideways_strategy': 'breakout', 'sideways_bb_std_mult': 0.618100698230465, 'sideways_rsi_os': 44, 'sideways_rsi_ob': 52, 'sideways_adx_thresh': 23.860570629238957, 'sideways_atr_min_pct': 0.004233110005675873, 'sideways_atr_max_pct': 0.10134058919704084, 'sideways_tp_mult': 1.5370916816307048, 'sideways_tsl_mult': 0.9904232196349159, 'sideways_time_stop': 171, 'sideways_use_sma': False, 'sideways_use_ema': True, 'sideways_use_atr': True, 'sideways_use_adx': False, 'sideways_use_spike': True, 'sideways_rsi_required': True}.
[I 2025-09-01 05:20:27,518] Trial 450 finished with values: [-0.014744797198297577, 0.014900399801341693] and parameters: {'p_sma': 58, 'p_std': 32, 'p_atr': 7, 'p_adx': 17, 'rsi_period': 52, 'ema1': 25, 'ema2': 34, 'slip_atr_k': 0.021833403519605558, 'slip_spread_k': 0.39718154441101977, 'spread_hl_frac': 0.0499912492460808, 'bb_std_mult': 2.047762102211826, 'rsi_os': 26, 'rsi_ob': 90, 'vol_spike': 0.2008228270211431, 'adx_thresh': 12.454896407415562, 'atr_min_pct': 0.003562032348233782, 'atr_max_pct': 0.12514243432173403, 'tp_mult': 2.448826604260453, 'tsl_mult': 0.92787872926964, 'strategy': 'breakout', 'time_stop': 206, 'use_sma': False, 'use_atr': True, 'use_adx': False, 'use_ema': True, 'use_spike': True, 'rsi_required': False, 'edge_k': 0.20136547782095637, 'edge_cap': 0.5531656310788845, 'bull_strategy': 'breakout', 'bull_bb_std_mult': 0.8334122744335666, 'bull_rsi_os': 50, 'bull_rsi_ob': 87, 'bull_adx_thresh': 6.001416379672093, 'bull_atr_min_pct': 0.01367981855626396, 'bull_atr_max_pct': 0.10272469917372941, 'bull_tp_mult': 1.2649259115741693, 'bull_tsl_mult': 0.19035376164002715, 'bull_time_stop': 97, 'bull_use_sma': True, 'bull_use_ema': True, 'bull_use_atr': False, 'bull_use_adx': True, 'bull_use_spike': True, 'bull_rsi_required': True, 'bear_strategy': 'breakout', 'bear_bb_std_mult': 3.597954735941494, 'bear_rsi_os': 7, 'bear_rsi_ob': 69, 'bear_adx_thresh': 30.01329916857154, 'bear_atr_min_pct': 0.007381092927930613, 'bear_atr_max_pct': 0.07315682495083847, 'bear_tp_mult': 1.29673501535501, 'bear_tsl_mult': 0.6586279182875208, 'bear_time_stop': 186, 'bear_use_sma': False, 'bear_use_ema': False, 'bear_use_atr': False, 'bear_use_adx': False, 'bear_use_spike': True, 'bear_rsi_required': False, 'sideways_strategy': 'breakout', 'sideways_bb_std_mult': 0.6151028211263165, 'sideways_rsi_os': 44, 'sideways_rsi_ob': 53, 'sideways_adx_thresh': 23.13759200469888, 'sideways_atr_min_pct': 0.004415336458072115, 'sideways_atr_max_pct': 0.10061822880747656, 'sideways_tp_mult': 1.5517535040979027, 'sideways_tsl_mult': 0.9956487881283514, 'sideways_time_stop': 163, 'sideways_use_sma': False, 'sideways_use_ema': False, 'sideways_use_atr': True, 'sideways_use_adx': False, 'sideways_use_spike': True, 'sideways_rsi_required': True}.
[I 2025-09-01 05:20:28,985] Trial 451 finished with values: [-0.018342311029011737, 0.018584411820455546] and parameters: {'p_sma': 58, 'p_std': 31, 'p_atr': 7, 'p_adx': 17, 'rsi_period': 52, 'ema1': 24, 'ema2': 33, 'slip_atr_k': 0.030839296553539463, 'slip_spread_k': 0.39508516338111743, 'spread_hl_frac': 0.04920170092688737, 'bb_std_mult': 2.053460525449856, 'rsi_os': 26, 'rsi_ob': 90, 'vol_spike': 0.1999305232555918, 'adx_thresh': 11.5334780173769, 'atr_min_pct': 0.003822217878914464, 'atr_max_pct': 0.12401375754788531, 'tp_mult': 2.44137070978642, 'tsl_mult': 0.9262766621099235, 'strategy': 'breakout', 'time_stop': 180, 'use_sma': False, 'use_atr': True, 'use_adx': False, 'use_ema': False, 'use_spike': True, 'rsi_required': True, 'edge_k': 0.16941630838753977, 'edge_cap': 0.5419206865805245, 'bull_strategy': 'breakout', 'bull_bb_std_mult': 0.8231972512687151, 'bull_rsi_os': 50, 'bull_rsi_ob': 78, 'bull_adx_thresh': 6.011194476704081, 'bull_atr_min_pct': 0.013282885455100134, 'bull_atr_max_pct': 0.10357507729520381, 'bull_tp_mult': 1.2672582887980242, 'bull_tsl_mult': 0.20139418205199366, 'bull_time_stop': 91, 'bull_use_sma': True, 'bull_use_ema': True, 'bull_use_atr': False, 'bull_use_adx': True, 'bull_use_spike': True, 'bull_rsi_required': True, 'bear_strategy': 'breakout', 'bear_bb_std_mult': 3.595597576209892, 'bear_rsi_os': 7, 'bear_rsi_ob': 71, 'bear_adx_thresh': 29.9047207268141, 'bear_atr_min_pct': 0.00768861128689672, 'bear_atr_max_pct': 0.0745155423392286, 'bear_tp_mult': 1.293479144356768, 'bear_tsl_mult': 0.657815005413057, 'bear_time_stop': 186, 'bear_use_sma': False, 'bear_use_ema': False, 'bear_use_atr': False, 'bear_use_adx': False, 'bear_use_spike': True, 'bear_rsi_required': False, 'sideways_strategy': 'breakout', 'sideways_bb_std_mult': 0.6439099314984956, 'sideways_rsi_os': 44, 'sideways_rsi_ob': 53, 'sideways_adx_thresh': 23.758624609140956, 'sideways_atr_min_pct': 0.004202889474992214, 'sideways_atr_max_pct': 0.10131636092258321, 'sideways_tp_mult': 1.5627403347981512, 'sideways_tsl_mult': 0.9970007618695224, 'sideways_time_stop': 164, 'sideways_use_sma': False, 'sideways_use_ema': True, 'sideways_use_atr': True, 'sideways_use_adx': False, 'sideways_use_spike': True, 'sideways_rsi_required': True}.
[I 2025-09-01 05:21:12,463] Trial 457 finished with values: [-0.013856007055778163, 0.013806834972286405] and parameters: {'p_sma': 59, 'p_std': 33, 'p_atr': 7, 'p_adx': 17, 'rsi_period': 53, 'ema1': 24, 'ema2': 34, 'slip_atr_k': 0.024777282803958592, 'slip_spread_k': 0.41993387672952687, 'spread_hl_frac': 0.04913714795550987, 'bb_std_mult': 2.143964435218417, 'rsi_os': 26, 'rsi_ob': 90, 'vol_spike': 0.20309565910135435, 'adx_thresh': 12.342208975508433, 'atr_min_pct': 0.004252559903438484, 'atr_max_pct': 0.12527155119943204, 'tp_mult': 2.4748546948946157, 'tsl_mult': 0.9120165840635419, 'strategy': 'breakout', 'time_stop': 183, 'use_sma': False, 'use_atr': True, 'use_adx': False, 'use_ema': True, 'use_spike': True, 'rsi_required': False, 'edge_k': 0.25094219273912965, 'edge_cap': 0.5600884811980348, 'bull_strategy': 'breakout', 'bull_bb_std_mult': 0.8987786644597442, 'bull_rsi_os': 47, 'bull_rsi_ob': 48, 'bull_adx_thresh': 5.5945527499773435, 'bull_atr_min_pct': 0.01374289757771577, 'bull_atr_max_pct': 0.10588566899519447, 'bull_tp_mult': 1.3033461604939474, 'bull_tsl_mult': 0.1893093964450201, 'bull_time_stop': 97, 'bull_use_sma': False, 'bull_use_ema': False, 'bull_use_atr': False, 'bull_use_adx': True, 'bull_use_spike': True, 'bull_rsi_required': True, 'bear_strategy': 'breakout', 'bear_bb_std_mult': 3.529624736497323, 'bear_rsi_os': 7, 'bear_rsi_ob': 69, 'bear_adx_thresh': 29.70091523825472, 'bear_atr_min_pct': 0.007411246911391694, 'bear_atr_max_pct': 0.07177388751373542, 'bear_tp_mult': 1.3336638248604673, 'bear_tsl_mult': 0.6589316120682187, 'bear_time_stop': 187, 'bear_use_sma': True, 'bear_use_ema': False, 'bear_use_atr': False, 'bear_use_adx': False, 'bear_use_spike': True, 'bear_rsi_required': False, 'sideways_strategy': 'breakout', 'sideways_bb_std_mult': 0.5260896355970148, 'sideways_rsi_os': 44, 'sideways_rsi_ob': 52, 'sideways_adx_thresh': 22.873814884643302, 'sideways_atr_min_pct': 0.004480459006315555, 'sideways_atr_max_pct': 0.10100203696874097, 'sideways_tp_mult': 1.539905832717614, 'sideways_tsl_mult': 0.9923880307750519, 'sideways_time_stop': 161, 'sideways_use_sma': False, 'sideways_use_ema': False, 'sideways_use_atr': True, 'sideways_use_adx': True, 'sideways_use_spike': True, 'sideways_rsi_required': True}.
[I 2025-09-01 05:21:13,412] Trial 456 finished with values: [-0.018068338188594324, 0.01841438888999705] and parameters: {'p_sma': 59, 'p_std': 32, 'p_atr': 7, 'p_adx': 17, 'rsi_period': 52, 'ema1': 24, 'ema2': 33, 'slip_atr_k': 0.024582002199596133, 'slip_spread_k': 0.4199931816602743, 'spread_hl_frac': 0.049565323868277056, 'bb_std_mult': 2.0570469186194873, 'rsi_os': 26, 'rsi_ob': 90, 'vol_spike': 0.20525928160898715, 'adx_thresh': 12.258125235946434, 'atr_min_pct': 0.0036350725008791125, 'atr_max_pct': 0.12304189557221337, 'tp_mult': 2.450880143229657, 'tsl_mult': 0.9229983673325872, 'strategy': 'breakout', 'time_stop': 194, 'use_sma': False, 'use_atr': True, 'use_adx': False, 'use_ema': False, 'use_spike': True, 'rsi_required': False, 'edge_k': 0.15631342060657466, 'edge_cap': 0.5500133598871433, 'bull_strategy': 'breakout', 'bull_bb_std_mult': 0.8833430550061172, 'bull_rsi_os': 49, 'bull_rsi_ob': 48, 'bull_adx_thresh': 5.9958189013462775, 'bull_atr_min_pct': 0.01359629317006969, 'bull_atr_max_pct': 0.10273074673635084, 'bull_tp_mult': 1.271132501913917, 'bull_tsl_mult': 0.21791210293033791, 'bull_time_stop': 91, 'bull_use_sma': False, 'bull_use_ema': True, 'bull_use_atr': False, 'bull_use_adx': True, 'bull_use_spike': True, 'bull_rsi_required': True, 'bear_strategy': 'breakout', 'bear_bb_std_mult': 3.5668407307801275, 'bear_rsi_os': 7, 'bear_rsi_ob': 69, 'bear_adx_thresh': 29.947287597014604, 'bear_atr_min_pct': 0.00738780028827158, 'bear_atr_max_pct': 0.07380746540643543, 'bear_tp_mult': 1.3214286952101224, 'bear_tsl_mult': 0.6508984558053912, 'bear_time_stop': 187, 'bear_use_sma': True, 'bear_use_ema': False, 'bear_use_atr': False, 'bear_use_adx': False, 'bear_use_spike': True, 'bear_rsi_required': False, 'sideways_strategy': 'breakout', 'sideways_bb_std_mult': 0.6171419473415697, 'sideways_rsi_os': 45, 'sideways_rsi_ob': 52, 'sideways_adx_thresh': 23.495376696431485, 'sideways_atr_min_pct': 0.004212781842713985, 'sideways_atr_max_pct': 0.10074279714367229, 'sideways_tp_mult': 1.5468323234024426, 'sideways_tsl_mult': 0.998575893430885, 'sideways_time_stop': 165, 'sideways_use_sma': False, 'sideways_use_ema': False, 'sideways_use_atr': True, 'sideways_use_adx': True, 'sideways_use_spike': True, 'sideways_rsi_required': True}.
[I 2025-09-01 05:21:14,029] Trial 454 finished with values: [-0.015940332525603673, 0.01620641204692193] and parameters: {'p_sma': 58, 'p_std': 32, 'p_atr': 7, 'p_adx': 17, 'rsi_period': 52, 'ema1': 24, 'ema2': 33, 'slip_atr_k': 0.021393427567971655, 'slip_spread_k': 0.4159120834202358, 'spread_hl_frac': 0.04983381703718524, 'bb_std_mult': 2.0431047416771517, 'rsi_os': 26, 'rsi_ob': 90, 'vol_spike': 0.19903909323158245, 'adx_thresh': 12.139252161153992, 'atr_min_pct': 0.003664071450789228, 'atr_max_pct': 0.12519129980331492, 'tp_mult': 2.440884282989753, 'tsl_mult': 0.9266192378874416, 'strategy': 'breakout', 'time_stop': 184, 'use_sma': False, 'use_atr': True, 'use_adx': False, 'use_ema': False, 'use_spike': True, 'rsi_required': True, 'edge_k': 0.18378699231146756, 'edge_cap': 0.5575171631955588, 'bull_strategy': 'breakout', 'bull_bb_std_mult': 0.8536487912114726, 'bull_rsi_os': 49, 'bull_rsi_ob': 88, 'bull_adx_thresh': 6.0937968625812635, 'bull_atr_min_pct': 0.01371667337919415, 'bull_atr_max_pct': 0.10326382316783364, 'bull_tp_mult': 1.2974158854905058, 'bull_tsl_mult': 0.1921397534878407, 'bull_time_stop': 93, 'bull_use_sma': True, 'bull_use_ema': True, 'bull_use_atr': False, 'bull_use_adx': True, 'bull_use_spike': True, 'bull_rsi_required': True, 'bear_strategy': 'breakout', 'bear_bb_std_mult': 3.5912976479048715, 'bear_rsi_os': 7, 'bear_rsi_ob': 69, 'bear_adx_thresh': 29.645201918429283, 'bear_atr_min_pct': 0.007347748276282154, 'bear_atr_max_pct': 0.07412164895014235, 'bear_tp_mult': 1.290845999633689, 'bear_tsl_mult': 0.6558558335631888, 'bear_time_stop': 188, 'bear_use_sma': True, 'bear_use_ema': False, 'bear_use_atr': False, 'bear_use_adx': False, 'bear_use_spike': True, 'bear_rsi_required': False, 'sideways_strategy': 'breakout', 'sideways_bb_std_mult': 0.6048930168019011, 'sideways_rsi_os': 44, 'sideways_rsi_ob': 52, 'sideways_adx_thresh': 23.81196636525197, 'sideways_atr_min_pct': 0.004371838040808587, 'sideways_atr_max_pct': 0.10177020390286085, 'sideways_tp_mult': 1.5485121608843568, 'sideways_tsl_mult': 0.9959823009244702, 'sideways_time_stop': 171, 'sideways_use_sma': False, 'sideways_use_ema': False, 'sideways_use_atr': True, 'sideways_use_adx': False, 'sideways_use_spike': True, 'sideways_rsi_required': True}.
[I 2025-09-01 05:21:14,038] Trial 455 finished with values: [-0.016713475257689736, 0.016963038847867734] and parameters: {'p_sma': 59, 'p_std': 32, 'p_atr': 7, 'p_adx': 17, 'rsi_period': 52, 'ema1': 24, 'ema2': 33, 'slip_atr_k': 0.028657423472961588, 'slip_spread_k': 0.3940098939895563, 'spread_hl_frac': 0.04921279481037883, 'bb_std_mult': 2.075038238648436, 'rsi_os': 26, 'rsi_ob': 90, 'vol_spike': 0.1993632421924957, 'adx_thresh': 11.849406567477642, 'atr_min_pct': 0.00366017608883852, 'atr_max_pct': 0.12470759895230127, 'tp_mult': 2.422232652097331, 'tsl_mult': 0.9242805862400492, 'strategy': 'breakout', 'time_stop': 167, 'use_sma': False, 'use_atr': True, 'use_adx': False, 'use_ema': False, 'use_spike': True, 'rsi_required': True, 'edge_k': 0.1769404196360673, 'edge_cap': 0.5629461034458698, 'bull_strategy': 'breakout', 'bull_bb_std_mult': 0.8656942381501305, 'bull_rsi_os': 49, 'bull_rsi_ob': 65, 'bull_adx_thresh': 6.0053203467941945, 'bull_atr_min_pct': 0.013652043580886519, 'bull_atr_max_pct': 0.10487199456768523, 'bull_tp_mult': 1.2481005958788736, 'bull_tsl_mult': 0.21594636733006584, 'bull_time_stop': 95, 'bull_use_sma': True, 'bull_use_ema': True, 'bull_use_atr': False, 'bull_use_adx': True, 'bull_use_spike': True, 'bull_rsi_required': True, 'bear_strategy': 'breakout', 'bear_bb_std_mult': 3.596909479645428, 'bear_rsi_os': 7, 'bear_rsi_ob': 70, 'bear_adx_thresh': 29.809650144999843, 'bear_atr_min_pct': 0.007250496043057885, 'bear_atr_max_pct': 0.07468219344452523, 'bear_tp_mult': 1.2946029683570903, 'bear_tsl_mult': 0.6590123103622308, 'bear_time_stop': 186, 'bear_use_sma': True, 'bear_use_ema': False, 'bear_use_atr': False, 'bear_use_adx': False, 'bear_use_spike': True, 'bear_rsi_required': False, 'sideways_strategy': 'breakout', 'sideways_bb_std_mult': 0.5093191416311315, 'sideways_rsi_os': 44, 'sideways_rsi_ob': 53, 'sideways_adx_thresh': 23.89041142055661, 'sideways_atr_min_pct': 0.004325289888349638, 'sideways_atr_max_pct': 0.10182409763431825, 'sideways_tp_mult': 1.545319073462094, 'sideways_tsl_mult': 0.9991084797562327, 'sideways_time_stop': 165, 'sideways_use_sma': False, 'sideways_use_ema': False, 'sideways_use_atr': True, 'sideways_use_adx': False, 'sideways_use_spike': True, 'sideways_rsi_required': True}.
[I 2025-09-01 05:21:59,439] Trial 459 finished with values: [-0.014050948580840883, 0.01440221006429696] and parameters: {'p_sma': 59, 'p_std': 33, 'p_atr': 7, 'p_adx': 17, 'rsi_period': 54, 'ema1': 24, 'ema2': 34, 'slip_atr_k': 0.023717486883217058, 'slip_spread_k': 0.42238145018533463, 'spread_hl_frac': 0.04805736928237618, 'bb_std_mult': 2.157164170696179, 'rsi_os': 26, 'rsi_ob': 90, 'vol_spike': 0.1979507426588404, 'adx_thresh': 12.257712694198785, 'atr_min_pct': 0.003507496072322328, 'atr_max_pct': 0.12494948149141384, 'tp_mult': 2.4858379911230295, 'tsl_mult': 0.9244711160228778, 'strategy': 'breakout', 'time_stop': 184, 'use_sma': False, 'use_atr': True, 'use_adx': False, 'use_ema': True, 'use_spike': True, 'rsi_required': False, 'edge_k': 0.21353750218545747, 'edge_cap': 0.5655777261566192, 'bull_strategy': 'breakout', 'bull_bb_std_mult': 0.8845920402553795, 'bull_rsi_os': 49, 'bull_rsi_ob': 73, 'bull_adx_thresh': 5.410320230426238, 'bull_atr_min_pct': 0.012749935099146344, 'bull_atr_max_pct': 0.10537751182443994, 'bull_tp_mult': 1.3070294031753034, 'bull_tsl_mult': 0.18621912672380486, 'bull_time_stop': 96, 'bull_use_sma': False, 'bull_use_ema': False, 'bull_use_atr': False, 'bull_use_adx': True, 'bull_use_spike': True, 'bull_rsi_required': True, 'bear_strategy': 'breakout', 'bear_bb_std_mult': 3.5189005740001633, 'bear_rsi_os': 6, 'bear_rsi_ob': 69, 'bear_adx_thresh': 29.58683380805106, 'bear_atr_min_pct': 0.007298788024504973, 'bear_atr_max_pct': 0.07186203064206298, 'bear_tp_mult': 1.3346441834940213, 'bear_tsl_mult': 0.6578901574021135, 'bear_time_stop': 194, 'bear_use_sma': True, 'bear_use_ema': False, 'bear_use_atr': False, 'bear_use_adx': False, 'bear_use_spike': True, 'bear_rsi_required': False, 'sideways_strategy': 'breakout', 'sideways_bb_std_mult': 0.6255365027587894, 'sideways_rsi_os': 45, 'sideways_rsi_ob': 52, 'sideways_adx_thresh': 22.720208138594604, 'sideways_atr_min_pct': 0.004441817163075209, 'sideways_atr_max_pct': 0.10033420696683361, 'sideways_tp_mult': 1.5400672253124912, 'sideways_tsl_mult': 0.9996588564590171, 'sideways_time_stop': 160, 'sideways_use_sma': False, 'sideways_use_ema': False, 'sideways_use_atr': True, 'sideways_use_adx': True, 'sideways_use_spike': True, 'sideways_rsi_required': True}.
