[I 2025-09-01 04:53:04,440] Trial 296 finished with values: [-1000000000.0, 1000000000.0] and parameters: {'p_sma': 19, 'p_std': 17, 'p_atr': 25, 'p_adx': 8, 'rsi_period': 62, 'ema1': 14, 'ema2': 60, 'slip_atr_k': 0.1844256790408999, 'slip_spread_k': 0.28936114366075333, 'spread_hl_frac': 0.041311876325089036, 'bb_std_mult': 2.4216700157620594, 'rsi_os': 45, 'rsi_ob': 55, 'vol_spike': 0.24438123199900408, 'adx_thresh': 13.82531969347918, 'atr_min_pct': 0.029524498360629894, 'atr_max_pct': 0.040914481910050836, 'tp_mult': 2.111685800731676, 'tsl_mult': 0.06096695242231953, 'strategy': 'breakout', 'time_stop': 12, 'use_sma': True, 'use_atr': False, 'use_adx': False, 'use_ema': True, 'use_spike': False, 'rsi_required': False, 'edge_k': 0.5965400415748604, 'edge_cap': 0.1464720268068449, 'bull_strategy': 'mean_reversion', 'bull_bb_std_mult': 2.231687017319871, 'bull_rsi_os': 24, 'bull_rsi_ob': 91, 'bull_adx_thresh': 18.887107726507157, 'bull_atr_min_pct': 2.5666508439329085e-05, 'bull_atr_max_pct': 0.13425927775698238, 'bull_tp_mult': 1.1700382561051117, 'bull_tsl_mult': 0.37854461662554495, 'bull_time_stop': 211, 'bull_use_sma': True, 'bull_use_ema': True, 'bull_use_atr': True, 'bull_use_adx': True, 'bull_use_spike': True, 'bull_rsi_required': False, 'bear_strategy': 'breakout', 'bear_bb_std_mult': 1.380029143904971, 'bear_rsi_os': 48, 'bear_rsi_ob': 73, 'bear_adx_thresh': 13.25126930830893, 'bear_atr_min_pct': 0.010733205754626218, 'bear_atr_max_pct': 0.032129725896953766, 'bear_tp_mult': 1.0638688822037565, 'bear_tsl_mult': 0.9513915777073543, 'bear_time_stop': 252, 'bear_use_sma': True, 'bear_use_ema': False, 'bear_use_atr': True, 'bear_use_adx': True, 'bear_use_spike': True, 'bear_rsi_required': False, 'sideways_strategy': 'mean_reversion', 'sideways_bb_std_mult': 1.4706418419899199, 'sideways_rsi_os': 6, 'sideways_rsi_ob': 46, 'sideways_adx_thresh': 8.086226613051124, 'sideways_atr_min_pct': 0.01233083992464952, 'sideways_atr_max_pct': 0.04765798868285423, 'sideways_tp_mult': 2.8934253201543423, 'sideways_tsl_mult': 0.21638318463146428, 'sideways_time_stop': 21, 'sideways_use_sma': True, 'sideways_use_ema': True, 'sideways_use_atr': True, 'sideways_use_adx': False, 'sideways_use_spike': False, 'sideways_rsi_required': False}.
[I 2025-09-01 04:53:49,863] Trial 301 finished with values: [-1000000000.0, 1000000000.0] and parameters: {'p_sma': 13, 'p_std': 45, 'p_atr': 26, 'p_adx': 7, 'rsi_period': 84, 'ema1': 13, 'ema2': 23, 'slip_atr_k': 0.012614830770349972, 'slip_spread_k': 0.3240939140364554, 'spread_hl_frac': 0.04376691019579877, 'bb_std_mult': 2.115557076268565, 'rsi_os': 49, 'rsi_ob': 56, 'vol_spike': 0.25234636432278007, 'adx_thresh': 12.268021430634924, 'atr_min_pct': 0.001086105757846829, 'atr_max_pct': 0.12097295573957066, 'tp_mult': 2.4339160710222747, 'tsl_mult': 0.3540687777315754, 'strategy': 'mean_reversion', 'time_stop': 208, 'use_sma': True, 'use_atr': False, 'use_adx': False, 'use_ema': True, 'use_spike': True, 'rsi_required': False, 'edge_k': 0.14046405644929993, 'edge_cap': 0.1753867566300307, 'bull_strategy': 'mean_reversion', 'bull_bb_std_mult': 0.8653269565376933, 'bull_rsi_os': 29, 'bull_rsi_ob': 50, 'bull_adx_thresh': 11.001480351938538, 'bull_atr_min_pct': 0.000998709851329999, 'bull_atr_max_pct': 0.127499194504528, 'bull_tp_mult': 2.8831466360277895, 'bull_tsl_mult': 0.14337922146003862, 'bull_time_stop': 60, 'bull_use_sma': True, 'bull_use_ema': False, 'bull_use_atr': True, 'bull_use_adx': False, 'bull_use_spike': False, 'bull_rsi_required': False, 'bear_strategy': 'mean_reversion', 'bear_bb_std_mult': 1.1185015894460644, 'bear_rsi_os': 45, 'bear_rsi_ob': 54, 'bear_adx_thresh': 17.112172552403692, 'bear_atr_min_pct': 0.029401039889183182, 'bear_atr_max_pct': 0.14991135599273797, 'bear_tp_mult': 2.7154984404992746, 'bear_tsl_mult': 0.12361616152161042, 'bear_time_stop': 188, 'bear_use_sma': True, 'bear_use_ema': False, 'bear_use_atr': True, 'bear_use_adx': True, 'bear_use_spike': False, 'bear_rsi_required': False, 'sideways_strategy': 'mean_reversion', 'sideways_bb_std_mult': 1.638163636564987, 'sideways_rsi_os': 8, 'sideways_rsi_ob': 75, 'sideways_adx_thresh': 17.19225154911759, 'sideways_atr_min_pct': 0.009626496805418681, 'sideways_atr_max_pct': 0.09080895057996997, 'sideways_tp_mult': 1.437329034854692, 'sideways_tsl_mult': 0.9998507037054319, 'sideways_time_stop': 177, 'sideways_use_sma': False, 'sideways_use_ema': False, 'sideways_use_atr': False, 'sideways_use_adx': False, 'sideways_use_spike': False, 'sideways_rsi_required': True}.
[I 2025-09-01 04:53:50,251] Trial 300 finished with values: [-1000000000.0, 1000000000.0] and parameters: {'p_sma': 18, 'p_std': 46, 'p_atr': 26, 'p_adx': 20, 'rsi_period': 79, 'ema1': 7, 'ema2': 23, 'slip_atr_k': 0.011036614151921203, 'slip_spread_k': 0.3147727070858003, 'spread_hl_frac': 0.028478759282256506, 'bb_std_mult': 1.1371815124412574, 'rsi_os': 48, 'rsi_ob': 56, 'vol_spike': 0.25057514310167267, 'adx_thresh': 17.14670255650409, 'atr_min_pct': 0.0010132563946689608, 'atr_max_pct': 0.09080301083326674, 'tp_mult': 2.65214528865013, 'tsl_mult': 0.9401003125454005, 'strategy': 'breakout', 'time_stop': 22, 'use_sma': True, 'use_atr': False, 'use_adx': False, 'use_ema': True, 'use_spike': True, 'rsi_required': False, 'edge_k': 0.48048363280239315, 'edge_cap': 0.6216014807056174, 'bull_strategy': 'mean_reversion', 'bull_bb_std_mult': 2.3094768193378026, 'bull_rsi_os': 22, 'bull_rsi_ob': 47, 'bull_adx_thresh': 5.282639048440778, 'bull_atr_min_pct': 0.016623334030963544, 'bull_atr_max_pct': 0.12710364429281343, 'bull_tp_mult': 1.7113310695938106, 'bull_tsl_mult': 0.1484267804602954, 'bull_time_stop': 43, 'bull_use_sma': True, 'bull_use_ema': True, 'bull_use_atr': True, 'bull_use_adx': True, 'bull_use_spike': False, 'bull_rsi_required': False, 'bear_strategy': 'breakout', 'bear_bb_std_mult': 1.5685390478684615, 'bear_rsi_os': 47, 'bear_rsi_ob': 56, 'bear_adx_thresh': 16.833492428462858, 'bear_atr_min_pct': 0.01411779486980339, 'bear_atr_max_pct': 0.1439866980162219, 'bear_tp_mult': 1.053020126067947, 'bear_tsl_mult': 0.8641117424739073, 'bear_time_stop': 206, 'bear_use_sma': True, 'bear_use_ema': False, 'bear_use_atr': True, 'bear_use_adx': True, 'bear_use_spike': False, 'bear_rsi_required': False, 'sideways_strategy': 'mean_reversion', 'sideways_bb_std_mult': 3.584681647550416, 'sideways_rsi_os': 12, 'sideways_rsi_ob': 57, 'sideways_adx_thresh': 17.210978842668474, 'sideways_atr_min_pct': 0.022785317561055892, 'sideways_atr_max_pct': 0.08917128791625417, 'sideways_tp_mult': 2.7783656665367715, 'sideways_tsl_mult': 0.2766955775460296, 'sideways_time_stop': 197, 'sideways_use_sma': True, 'sideways_use_ema': False, 'sideways_use_atr': True, 'sideways_use_adx': False, 'sideways_use_spike': False, 'sideways_rsi_required': True}.
[I 2025-09-01 04:53:51,413] Trial 298 finished with values: [-1000000000.0, 1000000000.0] and parameters: {'p_sma': 18, 'p_std': 53, 'p_atr': 25, 'p_adx': 8, 'rsi_period': 61, 'ema1': 11, 'ema2': 23, 'slip_atr_k': 0.011278499481058038, 'slip_spread_k': 0.28498399728812324, 'spread_hl_frac': 0.04104594662921537, 'bb_std_mult': 2.1157881502889127, 'rsi_os': 21, 'rsi_ob': 62, 'vol_spike': 0.26928863749540194, 'adx_thresh': 13.522011470804529, 'atr_min_pct': 0.001157598074468722, 'atr_max_pct': 0.12005888263909666, 'tp_mult': 2.439682519261894, 'tsl_mult': 0.9379235724834443, 'strategy': 'breakout', 'time_stop': 181, 'use_sma': True, 'use_atr': False, 'use_adx': False, 'use_ema': True, 'use_spike': True, 'rsi_required': False, 'edge_k': 0.483508690441546, 'edge_cap': 0.5109021157616486, 'bull_strategy': 'mean_reversion', 'bull_bb_std_mult': 2.3138583465650093, 'bull_rsi_os': 24, 'bull_rsi_ob': 73, 'bull_adx_thresh': 20.907154648500228, 'bull_atr_min_pct': 0.007998500777081793, 'bull_atr_max_pct': 0.072104976015345, 'bull_tp_mult': 1.7063999568181838, 'bull_tsl_mult': 0.5574922375782899, 'bull_time_stop': 217, 'bull_use_sma': True, 'bull_use_ema': False, 'bull_use_atr': True, 'bull_use_adx': False, 'bull_use_spike': False, 'bull_rsi_required': False, 'bear_strategy': 'mean_reversion', 'bear_bb_std_mult': 3.0616028989969335, 'bear_rsi_os': 48, 'bear_rsi_ob': 56, 'bear_adx_thresh': 13.04236927376817, 'bear_atr_min_pct': 0.006745026401975123, 'bear_atr_max_pct': 0.09997484743022544, 'bear_tp_mult': 1.303257715170255, 'bear_tsl_mult': 0.12464737415268462, 'bear_time_stop': 205, 'bear_use_sma': True, 'bear_use_ema': False, 'bear_use_atr': True, 'bear_use_adx': True, 'bear_use_spike': False, 'bear_rsi_required': False, 'sideways_strategy': 'mean_reversion', 'sideways_bb_std_mult': 0.7597053179123567, 'sideways_rsi_os': 42, 'sideways_rsi_ob': 47, 'sideways_adx_thresh': 17.228368080209698, 'sideways_atr_min_pct': 0.02268115301510431, 'sideways_atr_max_pct': 0.08929131939245813, 'sideways_tp_mult': 2.771224531552149, 'sideways_tsl_mult': 0.722606511905628, 'sideways_time_stop': 64, 'sideways_use_sma': True, 'sideways_use_ema': True, 'sideways_use_atr': False, 'sideways_use_adx': False, 'sideways_use_spike': False, 'sideways_rsi_required': False}.
[I 2025-09-01 04:53:51,804] Trial 299 finished with values: [-1000000000.0, 1000000000.0] and parameters: {'p_sma': 18, 'p_std': 53, 'p_atr': 7, 'p_adx': 8, 'rsi_period': 61, 'ema1': 29, 'ema2': 23, 'slip_atr_k': 0.012359449042168931, 'slip_spread_k': 0.29039720877318176, 'spread_hl_frac': 0.04106726873564506, 'bb_std_mult': 1.1530530255384934, 'rsi_os': 46, 'rsi_ob': 56, 'vol_spike': 0.250695372960352, 'adx_thresh': 17.138603422342385, 'atr_min_pct': 0.00746360769209134, 'atr_max_pct': 0.1211511584080417, 'tp_mult': 2.436485498696004, 'tsl_mult': 0.8955447134232213, 'strategy': 'breakout', 'time_stop': 11, 'use_sma': True, 'use_atr': False, 'use_adx': False, 'use_ema': True, 'use_spike': True, 'rsi_required': False, 'edge_k': 0.4866324587394156, 'edge_cap': 0.5062218647734998, 'bull_strategy': 'mean_reversion', 'bull_bb_std_mult': 3.1585051384944474, 'bull_rsi_os': 29, 'bull_rsi_ob': 50, 'bull_adx_thresh': 21.158556092454, 'bull_atr_min_pct': 0.013439110939242476, 'bull_atr_max_pct': 0.05945000978938343, 'bull_tp_mult': 1.723454225002759, 'bull_tsl_mult': 0.4183115614967975, 'bull_time_stop': 153, 'bull_use_sma': True, 'bull_use_ema': False, 'bull_use_atr': True, 'bull_use_adx': False, 'bull_use_spike': False, 'bull_rsi_required': False, 'bear_strategy': 'mean_reversion', 'bear_bb_std_mult': 1.1237391722637504, 'bear_rsi_os': 48, 'bear_rsi_ob': 85, 'bear_adx_thresh': 5.109600049086676, 'bear_atr_min_pct': 0.029433642510537036, 'bear_atr_max_pct': 0.022745875822214663, 'bear_tp_mult': 1.049416845125013, 'bear_tsl_mult': 0.16506462655097237, 'bear_time_stop': 188, 'bear_use_sma': True, 'bear_use_ema': False, 'bear_use_atr': True, 'bear_use_adx': True, 'bear_use_spike': False, 'bear_rsi_required': False, 'sideways_strategy': 'mean_reversion', 'sideways_bb_std_mult': 1.6468531187439222, 'sideways_rsi_os': 42, 'sideways_rsi_ob': 47, 'sideways_adx_thresh': 19.604918689259115, 'sideways_atr_min_pct': 0.016202076504831506, 'sideways_atr_max_pct': 0.08928085660289184, 'sideways_tp_mult': 2.7732923138161247, 'sideways_tsl_mult': 0.9974185845578265, 'sideways_time_stop': 139, 'sideways_use_sma': True, 'sideways_use_ema': True, 'sideways_use_atr': False, 'sideways_use_adx': False, 'sideways_use_spike': False, 'sideways_rsi_required': False}.
[I 2025-09-01 04:53:52,561] Trial 305 finished with values: [-1000000000.0, 1000000000.0] and parameters: {'p_sma': 17, 'p_std': 34, 'p_atr': 29, 'p_adx': 19, 'rsi_period': 67, 'ema1': 24, 'ema2': 28, 'slip_atr_k': 0.0600784415063694, 'slip_spread_k': 0.8223287649047876, 'spread_hl_frac': 0.04249976467117536, 'bb_std_mult': 3.256920485801238, 'rsi_os': 50, 'rsi_ob': 58, 'vol_spike': 0.01483714759194199, 'adx_thresh': 6.795141958326491, 'atr_min_pct': 0.014701928027247261, 'atr_max_pct': 0.08334226578322579, 'tp_mult': 2.5834207560593847, 'tsl_mult': 0.16158778450963268, 'strategy': 'mean_reversion', 'time_stop': 33, 'use_sma': False, 'use_atr': False, 'use_adx': False, 'use_ema': True, 'use_spike': True, 'rsi_required': False, 'edge_k': 0.5693012551615729, 'edge_cap': 0.14182135408460705, 'bull_strategy': 'breakout', 'bull_bb_std_mult': 2.042605907949285, 'bull_rsi_os': 42, 'bull_rsi_ob': 87, 'bull_adx_thresh': 18.2164241302168, 'bull_atr_min_pct': 0.001544039491232128, 'bull_atr_max_pct': 0.12054466719736316, 'bull_tp_mult': 1.5800216243566678, 'bull_tsl_mult': 0.3884303365655878, 'bull_time_stop': 237, 'bull_use_sma': True, 'bull_use_ema': False, 'bull_use_atr': False, 'bull_use_adx': False, 'bull_use_spike': False, 'bull_rsi_required': True, 'bear_strategy': 'mean_reversion', 'bear_bb_std_mult': 0.8007157414769976, 'bear_rsi_os': 46, 'bear_rsi_ob': 59, 'bear_adx_thresh': 14.83303528105775, 'bear_atr_min_pct': 0.028631841697165664, 'bear_atr_max_pct': 0.13904956411347058, 'bear_tp_mult': 1.2457460767128747, 'bear_tsl_mult': 0.0732488703518524, 'bear_time_stop': 200, 'bear_use_sma': True, 'bear_use_ema': True, 'bear_use_atr': False, 'bear_use_adx': False, 'bear_use_spike': False, 'bear_rsi_required': True, 'sideways_strategy': 'breakout', 'sideways_bb_std_mult': 1.3391493937347034, 'sideways_rsi_os': 7, 'sideways_rsi_ob': 48, 'sideways_adx_thresh': 15.795707324259718, 'sideways_atr_min_pct': 0.023803648996487743, 'sideways_atr_max_pct': 0.09978030196074993, 'sideways_tp_mult': 2.3976393378773655, 'sideways_tsl_mult': 0.856327586746353, 'sideways_time_stop': 181, 'sideways_use_sma': False, 'sideways_use_ema': True, 'sideways_use_atr': False, 'sideways_use_adx': False, 'sideways_use_spike': True, 'sideways_rsi_required': False}.
[I 2025-09-01 04:54:36,696] Trial 306 finished with values: [-1000000000.0, 1000000000.0] and parameters: {'p_sma': 15, 'p_std': 40, 'p_atr': 27, 'p_adx': 17, 'rsi_period': 57, 'ema1': 30, 'ema2': 56, 'slip_atr_k': 0.004913243584806621, 'slip_spread_k': 0.723674763243542, 'spread_hl_frac': 0.04634521878842482, 'bb_std_mult': 1.811558765994349, 'rsi_os': 23, 'rsi_ob': 87, 'vol_spike': 0.2376902791860639, 'adx_thresh': 18.61963953353639, 'atr_min_pct': 0.001850666219577732, 'atr_max_pct': 0.11156167718387265, 'tp_mult': 2.9414497571803233, 'tsl_mult': 0.9821741725064074, 'strategy': 'breakout', 'time_stop': 232, 'use_sma': False, 'use_atr': True, 'use_adx': False, 'use_ema': True, 'use_spike': True, 'rsi_required': True, 'edge_k': 0.6187012572573962, 'edge_cap': 0.07511748485093248, 'bull_strategy': 'breakout', 'bull_bb_std_mult': 2.090898046604032, 'bull_rsi_os': 31, 'bull_rsi_ob': 89, 'bull_adx_thresh': 19.47221862943368, 'bull_atr_min_pct': 0.02023727238519743, 'bull_atr_max_pct': 0.07676040008850267, 'bull_tp_mult': 2.677104139882855, 'bull_tsl_mult': 0.8944355634280788, 'bull_time_stop': 14, 'bull_use_sma': True, 'bull_use_ema': False, 'bull_use_atr': False, 'bull_use_adx': False, 'bull_use_spike': False, 'bull_rsi_required': True, 'bear_strategy': 'mean_reversion', 'bear_bb_std_mult': 1.043315465932755, 'bear_rsi_os': 28, 'bear_rsi_ob': 76, 'bear_adx_thresh': 19.321558097362455, 'bear_atr_min_pct': 0.029429601964937505, 'bear_atr_max_pct': 0.14279861807207522, 'bear_tp_mult': 1.1321240476391659, 'bear_tsl_mult': 0.16012949745504268, 'bear_time_stop': 215, 'bear_use_sma': True, 'bear_use_ema': False, 'bear_use_atr': False, 'bear_use_adx': False, 'bear_use_spike': False, 'bear_rsi_required': False, 'sideways_strategy': 'mean_reversion', 'sideways_bb_std_mult': 1.423919897304324, 'sideways_rsi_os': 29, 'sideways_rsi_ob': 55, 'sideways_adx_thresh': 18.187055397205697, 'sideways_atr_min_pct': 0.02431109991800929, 'sideways_atr_max_pct': 0.14663632823894163, 'sideways_tp_mult': 2.615052298812321, 'sideways_tsl_mult': 0.487474822897255, 'sideways_time_stop': 171, 'sideways_use_sma': True, 'sideways_use_ema': True, 'sideways_use_atr': False, 'sideways_use_adx': False, 'sideways_use_spike': False, 'sideways_rsi_required': False}.
[I 2025-09-01 04:54:37,133] Trial 302 finished with values: [-1000000000.0, 1000000000.0] and parameters: {'p_sma': 18, 'p_std': 57, 'p_atr': 7, 'p_adx': 26, 'rsi_period': 67, 'ema1': 29, 'ema2': 56, 'slip_atr_k': 0.1232148521071515, 'slip_spread_k': 0.2914694723125504, 'spread_hl_frac': 0.04628671424251341, 'bb_std_mult': 1.7564187924725323, 'rsi_os': 21, 'rsi_ob': 53, 'vol_spike': 0.23828653574243866, 'adx_thresh': 14.49350643323859, 'atr_min_pct': 0.01458897078340856, 'atr_max_pct': 0.12422355381593966, 'tp_mult': 2.217982752645527, 'tsl_mult': 0.9025963718378792, 'strategy': 'breakout', 'time_stop': 34, 'use_sma': False, 'use_atr': False, 'use_adx': False, 'use_ema': True, 'use_spike': True, 'rsi_required': False, 'edge_k': 0.016393983997850303, 'edge_cap': 0.10348989066287309, 'bull_strategy': 'breakout', 'bull_bb_std_mult': 2.9461598084180713, 'bull_rsi_os': 12, 'bull_rsi_ob': 87, 'bull_adx_thresh': 16.057060695802647, 'bull_atr_min_pct': 0.001622417220358496, 'bull_atr_max_pct': 0.09871677679112117, 'bull_tp_mult': 1.5719454784999178, 'bull_tsl_mult': 0.41567893077665663, 'bull_time_stop': 153, 'bull_use_sma': True, 'bull_use_ema': False, 'bull_use_atr': False, 'bull_use_adx': False, 'bull_use_spike': False, 'bull_rsi_required': True, 'bear_strategy': 'mean_reversion', 'bear_bb_std_mult': 0.8202095014009516, 'bear_rsi_os': 46, 'bear_rsi_ob': 69, 'bear_adx_thresh': 5.244768192412881, 'bear_atr_min_pct': 0.029983651253724344, 'bear_atr_max_pct': 0.14203945918687425, 'bear_tp_mult': 1.2470296133552825, 'bear_tsl_mult': 0.6095940005056997, 'bear_time_stop': 202, 'bear_use_sma': True, 'bear_use_ema': False, 'bear_use_atr': False, 'bear_use_adx': False, 'bear_use_spike': False, 'bear_rsi_required': False, 'sideways_strategy': 'breakout', 'sideways_bb_std_mult': 1.3346945073798042, 'sideways_rsi_os': 42, 'sideways_rsi_ob': 62, 'sideways_adx_thresh': 18.11362099673768, 'sideways_atr_min_pct': 0.0285898226411409, 'sideways_atr_max_pct': 0.09977490276490354, 'sideways_tp_mult': 2.8051470989679834, 'sideways_tsl_mult': 0.8517468964421475, 'sideways_time_stop': 62, 'sideways_use_sma': True, 'sideways_use_ema': True, 'sideways_use_atr': False, 'sideways_use_adx': False, 'sideways_use_spike': True, 'sideways_rsi_required': False}.
[I 2025-09-01 04:54:37,340] Trial 304 finished with values: [-1000000000.0, 1000000000.0] and parameters: {'p_sma': 25, 'p_std': 44, 'p_atr': 9, 'p_adx': 17, 'rsi_period': 60, 'ema1': 29, 'ema2': 12, 'slip_atr_k': 0.005237689032669988, 'slip_spread_k': 0.36757435850152825, 'spread_hl_frac': 0.042545556997953274, 'bb_std_mult': 0.8512145917259373, 'rsi_os': 14, 'rsi_ob': 83, 'vol_spike': 0.21878529909461134, 'adx_thresh': 6.888972977292859, 'atr_min_pct': 0.0018828959295922483, 'atr_max_pct': 0.010384002455686839, 'tp_mult': 2.5148790776770036, 'tsl_mult': 0.9003753708392463, 'strategy': 'breakout', 'time_stop': 241, 'use_sma': False, 'use_atr': False, 'use_adx': False, 'use_ema': True, 'use_spike': True, 'rsi_required': False, 'edge_k': 0.6264733950513135, 'edge_cap': 0.08247954266076855, 'bull_strategy': 'breakout', 'bull_bb_std_mult': 2.1461446136360505, 'bull_rsi_os': 48, 'bull_rsi_ob': 89, 'bull_adx_thresh': 18.156480806315443, 'bull_atr_min_pct': 0.02749325907683408, 'bull_atr_max_pct': 0.04245161909216443, 'bull_tp_mult': 1.3268691126021075, 'bull_tsl_mult': 0.4213764145951384, 'bull_time_stop': 69, 'bull_use_sma': True, 'bull_use_ema': False, 'bull_use_atr': False, 'bull_use_adx': False, 'bull_use_spike': False, 'bull_rsi_required': True, 'bear_strategy': 'mean_reversion', 'bear_bb_std_mult': 1.0188925964815327, 'bear_rsi_os': 28, 'bear_rsi_ob': 69, 'bear_adx_thresh': 13.613340222225975, 'bear_atr_min_pct': 0.02944205262427496, 'bear_atr_max_pct': 0.1469893432760488, 'bear_tp_mult': 1.1169891676028396, 'bear_tsl_mult': 0.6081410066614414, 'bear_time_stop': 202, 'bear_use_sma': True, 'bear_use_ema': True, 'bear_use_atr': False, 'bear_use_adx': False, 'bear_use_spike': False, 'bear_rsi_required': True, 'sideways_strategy': 'breakout', 'sideways_bb_std_mult': 1.41242416603666, 'sideways_rsi_os': 29, 'sideways_rsi_ob': 67, 'sideways_adx_thresh': 19.714046336187895, 'sideways_atr_min_pct': 0.024133216941738558, 'sideways_atr_max_pct': 0.14583658236637137, 'sideways_tp_mult': 2.0227874732542466, 'sideways_tsl_mult': 0.7775962717925009, 'sideways_time_stop': 120, 'sideways_use_sma': False, 'sideways_use_ema': True, 'sideways_use_atr': False, 'sideways_use_adx': False, 'sideways_use_spike': True, 'sideways_rsi_required': False}.
