[I 2025-09-01 05:38:33,576] Trial 551 finished with values: [-1000000000.0, 1000000000.0] and parameters: {'p_sma': 60, 'p_std': 33, 'p_atr': 7, 'p_adx': 25, 'rsi_period': 37, 'ema1': 12, 'ema2': 31, 'slip_atr_k': 0.010346459271744627, 'slip_spread_k': 0.3597286334516063, 'spread_hl_frac': 0.04674540831048141, 'bb_std_mult': 0.5106141531568074, 'rsi_os': 29, 'rsi_ob': 95, 'vol_spike': 0.18596965987526062, 'adx_thresh': 6.646734573764226, 'atr_min_pct': 0.005838573861065962, 'atr_max_pct': 0.1204838723038875, 'tp_mult': 2.9209612548957136, 'tsl_mult': 0.9564731245521816, 'strategy': 'breakout', 'time_stop': 137, 'use_sma': False, 'use_atr': True, 'use_adx': True, 'use_ema': True, 'use_spike': True, 'rsi_required': False, 'edge_k': 1.1498722788757247, 'edge_cap': 0.5076322233933921, 'bull_strategy': 'breakout', 'bull_bb_std_mult': 1.5936334214973327, 'bull_rsi_os': 50, 'bull_rsi_ob': 75, 'bull_adx_thresh': 5.017435963533732, 'bull_atr_min_pct': 0.01643387381138237, 'bull_atr_max_pct': 0.1443150581682431, 'bull_tp_mult': 1.1420646310602762, 'bull_tsl_mult': 0.20488668399412166, 'bull_time_stop': 70, 'bull_use_sma': False, 'bull_use_ema': False, 'bull_use_atr': False, 'bull_use_adx': True, 'bull_use_spike': False, 'bull_rsi_required': True, 'bear_strategy': 'breakout', 'bear_bb_std_mult': 3.2980290269348984, 'bear_rsi_os': 27, 'bear_rsi_ob': 67, 'bear_adx_thresh': 17.66552764335546, 'bear_atr_min_pct': 0.00831555432695072, 'bear_atr_max_pct': 0.08824364290457368, 'bear_tp_mult': 2.1598706326388912, 'bear_tsl_mult': 0.7869406712364757, 'bear_time_stop': 236, 'bear_use_sma': True, 'bear_use_ema': False, 'bear_use_atr': True, 'bear_use_adx': False, 'bear_use_spike': False, 'bear_rsi_required': False, 'sideways_strategy': 'breakout', 'sideways_bb_std_mult': 0.6584439024483085, 'sideways_rsi_os': 25, 'sideways_rsi_ob': 54, 'sideways_adx_thresh': 25.311189730113046, 'sideways_atr_min_pct': 0.005321323253944104, 'sideways_atr_max_pct': 0.09887775471534817, 'sideways_tp_mult': 1.593023402582161, 'sideways_tsl_mult': 0.9611304248205172, 'sideways_time_stop': 182, 'sideways_use_sma': False, 'sideways_use_ema': True, 'sideways_use_atr': True, 'sideways_use_adx': True, 'sideways_use_spike': True, 'sideways_rsi_required': True}.
[I 2025-09-01 05:38:33,960] Trial 550 finished with values: [-1000000000.0, 1000000000.0] and parameters: {'p_sma': 50, 'p_std': 48, 'p_atr': 22, 'p_adx': 18, 'rsi_period': 54, 'ema1': 26, 'ema2': 31, 'slip_atr_k': 0.010425457283009733, 'slip_spread_k': 0.38494765070061576, 'spread_hl_frac': 0.04686259232389596, 'bb_std_mult': 1.3327115422089888, 'rsi_os': 54, 'rsi_ob': 91, 'vol_spike': 0.187238510415675, 'adx_thresh': 13.814063493963799, 'atr_min_pct': 0.015059490372076646, 'atr_max_pct': 0.054810852078696216, 'tp_mult': 2.5184181359572366, 'tsl_mult': 0.9054330814942828, 'strategy': 'breakout', 'time_stop': 202, 'use_sma': False, 'use_atr': True, 'use_adx': False, 'use_ema': True, 'use_spike': True, 'rsi_required': False, 'edge_k': 0.1651946060756575, 'edge_cap': 0.4658799554139923, 'bull_strategy': 'breakout', 'bull_bb_std_mult': 1.063768449714821, 'bull_rsi_os': 50, 'bull_rsi_ob': 63, 'bull_adx_thresh': 5.015069355012274, 'bull_atr_min_pct': 0.013111890251299652, 'bull_atr_max_pct': 0.09632635616149214, 'bull_tp_mult': 1.1555611010090618, 'bull_tsl_mult': 0.12849728536590554, 'bull_time_stop': 110, 'bull_use_sma': True, 'bull_use_ema': False, 'bull_use_atr': False, 'bull_use_adx': True, 'bull_use_spike': False, 'bull_rsi_required': True, 'bear_strategy': 'breakout', 'bear_bb_std_mult': 3.472087679724112, 'bear_rsi_os': 8, 'bear_rsi_ob': 77, 'bear_adx_thresh': 17.652084897933655, 'bear_atr_min_pct': 0.008299851442574684, 'bear_atr_max_pct': 0.049367679975591355, 'bear_tp_mult': 1.3508801332960876, 'bear_tsl_mult': 0.6430002098941571, 'bear_time_stop': 237, 'bear_use_sma': True, 'bear_use_ema': False, 'bear_use_atr': True, 'bear_use_adx': False, 'bear_use_spike': False, 'bear_rsi_required': False, 'sideways_strategy': 'breakout', 'sideways_bb_std_mult': 0.798907898253135, 'sideways_rsi_os': 42, 'sideways_rsi_ob': 80, 'sideways_adx_thresh': 34.191600346835315, 'sideways_atr_min_pct': 0.0056469684406293495, 'sideways_atr_max_pct': 0.09779346980923923, 'sideways_tp_mult': 1.614931830795632, 'sideways_tsl_mult': 0.262459577797018, 'sideways_time_stop': 98, 'sideways_use_sma': False, 'sideways_use_ema': True, 'sideways_use_atr': True, 'sideways_use_adx': False, 'sideways_use_spike': True, 'sideways_rsi_required': True}.
[I 2025-09-01 05:38:34,257] Trial 549 finished with values: [-0.02364565636452065, 0.02336315924692328] and parameters: {'p_sma': 50, 'p_std': 33, 'p_atr': 22, 'p_adx': 12, 'rsi_period': 33, 'ema1': 23, 'ema2': 31, 'slip_atr_k': 0.14901381490379, 'slip_spread_k': 0.38216976754937493, 'spread_hl_frac': 0.04689083524510731, 'bb_std_mult': 2.118393993490819, 'rsi_os': 32, 'rsi_ob': 46, 'vol_spike': 0.0995723922764935, 'adx_thresh': 22.47814941430865, 'atr_min_pct': 0.002360878675725284, 'atr_max_pct': 0.07591088654207714, 'tp_mult': 2.4376682510746295, 'tsl_mult': 0.9050662010290492, 'strategy': 'breakout', 'time_stop': 166, 'use_sma': False, 'use_atr': True, 'use_adx': False, 'use_ema': True, 'use_spike': True, 'rsi_required': False, 'edge_k': 0.17044975514055516, 'edge_cap': 0.3317295362059042, 'bull_strategy': 'breakout', 'bull_bb_std_mult': 0.8341147418514038, 'bull_rsi_os': 47, 'bull_rsi_ob': 82, 'bull_adx_thresh': 7.254587301279489, 'bull_atr_min_pct': 0.006461637075551934, 'bull_atr_max_pct': 0.010560146988485397, 'bull_tp_mult': 1.1538241430850515, 'bull_tsl_mult': 0.20331556201232914, 'bull_time_stop': 95, 'bull_use_sma': True, 'bull_use_ema': False, 'bull_use_atr': False, 'bull_use_adx': True, 'bull_use_spike': False, 'bull_rsi_required': True, 'bear_strategy': 'breakout', 'bear_bb_std_mult': 2.0531737968356207, 'bear_rsi_os': 8, 'bear_rsi_ob': 67, 'bear_adx_thresh': 16.660963021685156, 'bear_atr_min_pct': 0.008291808162107388, 'bear_atr_max_pct': 0.12703266472890826, 'bear_tp_mult': 1.3472541047339401, 'bear_tsl_mult': 0.2943446600902686, 'bear_time_stop': 231, 'bear_use_sma': True, 'bear_use_ema': False, 'bear_use_atr': True, 'bear_use_adx': False, 'bear_use_spike': False, 'bear_rsi_required': False, 'sideways_strategy': 'breakout', 'sideways_bb_std_mult': 0.7806291581900053, 'sideways_rsi_os': 45, 'sideways_rsi_ob': 55, 'sideways_adx_thresh': 24.855230305254462, 'sideways_atr_min_pct': 0.003113751404830933, 'sideways_atr_max_pct': 0.09724115286314719, 'sideways_tp_mult': 1.494258221968115, 'sideways_tsl_mult': 0.9668361712698322, 'sideways_time_stop': 13, 'sideways_use_sma': False, 'sideways_use_ema': True, 'sideways_use_atr': True, 'sideways_use_adx': False, 'sideways_use_spike': True, 'sideways_rsi_required': True}.
[I 2025-09-01 05:39:17,157] Trial 555 finished with values: [-1000000000.0, 1000000000.0] and parameters: {'p_sma': 54, 'p_std': 21, 'p_atr': 16, 'p_adx': 7, 'rsi_period': 79, 'ema1': 15, 'ema2': 32, 'slip_atr_k': 0.015733414908887192, 'slip_spread_k': 0.41018899738001874, 'spread_hl_frac': 0.04562932747339116, 'bb_std_mult': 2.1803207628767853, 'rsi_os': 25, 'rsi_ob': 76, 'vol_spike': 0.19681499037743475, 'adx_thresh': 28.396962584966445, 'atr_min_pct': 0.0026786192547806394, 'atr_max_pct': 0.08763970227101003, 'tp_mult': 1.7397625077767596, 'tsl_mult': 0.947429159081173, 'strategy': 'breakout', 'time_stop': 81, 'use_sma': True, 'use_atr': True, 'use_adx': True, 'use_ema': True, 'use_spike': True, 'rsi_required': False, 'edge_k': 0.20794434464648662, 'edge_cap': 0.5424499153473683, 'bull_strategy': 'mean_reversion', 'bull_bb_std_mult': 1.4222575430973379, 'bull_rsi_os': 41, 'bull_rsi_ob': 87, 'bull_adx_thresh': 25.05534722520394, 'bull_atr_min_pct': 0.011492327467301467, 'bull_atr_max_pct': 0.10364413563494772, 'bull_tp_mult': 1.2673534126657382, 'bull_tsl_mult': 0.25663978637922785, 'bull_time_stop': 90, 'bull_use_sma': False, 'bull_use_ema': False, 'bull_use_atr': False, 'bull_use_adx': True, 'bull_use_spike': False, 'bull_rsi_required': True, 'bear_strategy': 'breakout', 'bear_bb_std_mult': 1.6675643055229827, 'bear_rsi_os': 6, 'bear_rsi_ob': 79, 'bear_adx_thresh': 29.635464128610387, 'bear_atr_min_pct': 0.0074210493274149865, 'bear_atr_max_pct': 0.0654280293268093, 'bear_tp_mult': 1.2532802092353004, 'bear_tsl_mult': 0.3910336407828925, 'bear_time_stop': 48, 'bear_use_sma': True, 'bear_use_ema': True, 'bear_use_atr': False, 'bear_use_adx': True, 'bear_use_spike': False, 'bear_rsi_required': True, 'sideways_strategy': 'mean_reversion', 'sideways_bb_std_mult': 1.6845248620388578, 'sideways_rsi_os': 44, 'sideways_rsi_ob': 53, 'sideways_adx_thresh': 22.54165639404078, 'sideways_atr_min_pct': 0.004298271623038557, 'sideways_atr_max_pct': 0.1425535947750222, 'sideways_tp_mult': 1.4373801027943607, 'sideways_tsl_mult': 0.8886049322988259, 'sideways_time_stop': 284, 'sideways_use_sma': False, 'sideways_use_ema': False, 'sideways_use_atr': True, 'sideways_use_adx': True, 'sideways_use_spike': False, 'sideways_rsi_required': True}.
[I 2025-09-01 05:39:18,280] Trial 554 finished with values: [-0.06114142087450003, 0.0618436109026949] and parameters: {'p_sma': 54, 'p_std': 19, 'p_atr': 16, 'p_adx': 18, 'rsi_period': 56, 'ema1': 23, 'ema2': 32, 'slip_atr_k': 0.15004317887664365, 'slip_spread_k': 0.616960703240997, 'spread_hl_frac': 0.04923082020563712, 'bb_std_mult': 2.3603657146138817, 'rsi_os': 25, 'rsi_ob': 88, 'vol_spike': 0.21103853880232523, 'adx_thresh': 8.033276387351423, 'atr_min_pct': 0.0023803015362303436, 'atr_max_pct': 0.08765545885937727, 'tp_mult': 2.540015144257112, 'tsl_mult': 0.9419691771620718, 'strategy': 'breakout', 'time_stop': 83, 'use_sma': True, 'use_atr': True, 'use_adx': False, 'use_ema': True, 'use_spike': True, 'rsi_required': False, 'edge_k': 1.1022020303541868, 'edge_cap': 0.5410321305793274, 'bull_strategy': 'mean_reversion', 'bull_bb_std_mult': 0.8485557586373709, 'bull_rsi_os': 47, 'bull_rsi_ob': 87, 'bull_adx_thresh': 7.081373248264946, 'bull_atr_min_pct': 0.01146468049350459, 'bull_atr_max_pct': 0.01157078000672232, 'bull_tp_mult': 1.2378002321961248, 'bull_tsl_mult': 0.16288118628860412, 'bull_time_stop': 93, 'bull_use_sma': False, 'bull_use_ema': False, 'bull_use_atr': False, 'bull_use_adx': True, 'bull_use_spike': False, 'bull_rsi_required': True, 'bear_strategy': 'breakout', 'bear_bb_std_mult': 3.599299150277682, 'bear_rsi_os': 52, 'bear_rsi_ob': 67, 'bear_adx_thresh': 5.0386532491349225, 'bear_atr_min_pct': 0.007086703461380511, 'bear_atr_max_pct': 0.11238919190722452, 'bear_tp_mult': 1.246473372434516, 'bear_tsl_mult': 0.6295426473224872, 'bear_time_stop': 176, 'bear_use_sma': True, 'bear_use_ema': True, 'bear_use_atr': False, 'bear_use_adx': True, 'bear_use_spike': False, 'bear_rsi_required': True, 'sideways_strategy': 'mean_reversion', 'sideways_bb_std_mult': 1.6944153278364937, 'sideways_rsi_os': 43, 'sideways_rsi_ob': 53, 'sideways_adx_thresh': 31.70351928729189, 'sideways_atr_min_pct': 0.002192454025225104, 'sideways_atr_max_pct': 0.07307858938202137, 'sideways_tp_mult': 1.4986902414462298, 'sideways_tsl_mult': 0.9827138313513822, 'sideways_time_stop': 15, 'sideways_use_sma': False, 'sideways_use_ema': False, 'sideways_use_atr': True, 'sideways_use_adx': True, 'sideways_use_spike': False, 'sideways_rsi_required': True}.
[I 2025-09-01 05:39:19,574] Trial 553 finished with values: [-1000000000.0, 1000000000.0] and parameters: {'p_sma': 54, 'p_std': 25, 'p_atr': 7, 'p_adx': 13, 'rsi_period': 44, 'ema1': 23, 'ema2': 32, 'slip_atr_k': 0.013202852618767169, 'slip_spread_k': 0.17942055604688056, 'spread_hl_frac': 0.0022130263544285975, 'bb_std_mult': 2.14944279097901, 'rsi_os': 25, 'rsi_ob': 81, 'vol_spike': 0.08027108677542143, 'adx_thresh': 7.8409761543914716, 'atr_min_pct': 0.0024117399989948864, 'atr_max_pct': 0.11715626374761536, 'tp_mult': 2.529653978362819, 'tsl_mult': 0.4897358836902571, 'strategy': 'breakout', 'time_stop': 298, 'use_sma': True, 'use_atr': True, 'use_adx': False, 'use_ema': True, 'use_spike': True, 'rsi_required': False, 'edge_k': 1.1111855847564684, 'edge_cap': 0.4422895732439558, 'bull_strategy': 'mean_reversion', 'bull_bb_std_mult': 1.30291253747041, 'bull_rsi_os': 47, 'bull_rsi_ob': 84, 'bull_adx_thresh': 7.083555530595545, 'bull_atr_min_pct': 0.013105705745483826, 'bull_atr_max_pct': 0.10382916909224932, 'bull_tp_mult': 2.1364986895050624, 'bull_tsl_mult': 0.9981669102792555, 'bull_time_stop': 128, 'bull_use_sma': True, 'bull_use_ema': False, 'bull_use_atr': False, 'bull_use_adx': True, 'bull_use_spike': False, 'bull_rsi_required': True, 'bear_strategy': 'breakout', 'bear_bb_std_mult': 3.597002188776354, 'bear_rsi_os': 9, 'bear_rsi_ob': 53, 'bear_adx_thresh': 29.78597472011158, 'bear_atr_min_pct': 0.007427364617274351, 'bear_atr_max_pct': 0.0928542821869188, 'bear_tp_mult': 2.7204310402527025, 'bear_tsl_mult': 0.6436803286923359, 'bear_time_stop': 51, 'bear_use_sma': True, 'bear_use_ema': True, 'bear_use_atr': False, 'bear_use_adx': True, 'bear_use_spike': False, 'bear_rsi_required': True, 'sideways_strategy': 'breakout', 'sideways_bb_std_mult': 1.7848665471647882, 'sideways_rsi_os': 42, 'sideways_rsi_ob': 93, 'sideways_adx_thresh': 10.135686367897874, 'sideways_atr_min_pct': 0.007408526969741688, 'sideways_atr_max_pct': 0.10061469171336106, 'sideways_tp_mult': 1.5085568209377291, 'sideways_tsl_mult': 0.2697023625778472, 'sideways_time_stop': 14, 'sideways_use_sma': False, 'sideways_use_ema': True, 'sideways_use_atr': True, 'sideways_use_adx': False, 'sideways_use_spike': False, 'sideways_rsi_required': True}.
[I 2025-09-01 05:39:20,155] Trial 552 finished with values: [-1000000000.0, 1000000000.0] and parameters: {'p_sma': 40, 'p_std': 28, 'p_atr': 7, 'p_adx': 18, 'rsi_period': 44, 'ema1': 26, 'ema2': 32, 'slip_atr_k': 0.010665179942835706, 'slip_spread_k': 0.3692298893787466, 'spread_hl_frac': 0.002173909356382505, 'bb_std_mult': 2.163173002048959, 'rsi_os': 54, 'rsi_ob': 95, 'vol_spike': 0.18945445418538392, 'adx_thresh': 22.333112772702368, 'atr_min_pct': 0.0024551717846034576, 'atr_max_pct': 0.1201549119598831, 'tp_mult': 2.533642192912027, 'tsl_mult': 0.851911228382726, 'strategy': 'breakout', 'time_stop': 82, 'use_sma': True, 'use_atr': True, 'use_adx': True, 'use_ema': True, 'use_spike': True, 'rsi_required': False, 'edge_k': 1.0853931903501701, 'edge_cap': 0.4995639327542309, 'bull_strategy': 'breakout', 'bull_bb_std_mult': 1.2974565949176644, 'bull_rsi_os': 43, 'bull_rsi_ob': 87, 'bull_adx_thresh': 7.162710004507778, 'bull_atr_min_pct': 0.013159017478935449, 'bull_atr_max_pct': 0.08504861433812598, 'bull_tp_mult': 1.1352466665047085, 'bull_tsl_mult': 0.21198019534505516, 'bull_time_stop': 73, 'bull_use_sma': False, 'bull_use_ema': False, 'bull_use_atr': False, 'bull_use_adx': True, 'bull_use_spike': False, 'bull_rsi_required': True, 'bear_strategy': 'breakout', 'bear_bb_std_mult': 3.0687571573879477, 'bear_rsi_os': 9, 'bear_rsi_ob': 67, 'bear_adx_thresh': 17.55926482507418, 'bear_atr_min_pct': 0.017020850161284712, 'bear_atr_max_pct': 0.09326445963804476, 'bear_tp_mult': 1.348435083522818, 'bear_tsl_mult': 0.39044976128287007, 'bear_time_stop': 208, 'bear_use_sma': True, 'bear_use_ema': False, 'bear_use_atr': True, 'bear_use_adx': False, 'bear_use_spike': False, 'bear_rsi_required': False, 'sideways_strategy': 'breakout', 'sideways_bb_std_mult': 3.4922256166001207, 'sideways_rsi_os': 42, 'sideways_rsi_ob': 88, 'sideways_adx_thresh': 22.729526554140136, 'sideways_atr_min_pct': 0.005025455821888519, 'sideways_atr_max_pct': 0.07371489569728217, 'sideways_tp_mult': 2.254404254290714, 'sideways_tsl_mult': 0.9509330849933691, 'sideways_time_stop': 182, 'sideways_use_sma': False, 'sideways_use_ema': True, 'sideways_use_atr': True, 'sideways_use_adx': True, 'sideways_use_spike': True, 'sideways_rsi_required': True}.
[I 2025-09-01 05:40:04,586] Trial 556 finished with values: [-1000000000.0, 1000000000.0] and parameters: {'p_sma': 12, 'p_std': 18, 'p_atr': 7, 'p_adx': 18, 'rsi_period': 44, 'ema1': 25, 'ema2': 32, 'slip_atr_k': 0.01696020556247061, 'slip_spread_k': 0.35205381772624617, 'spread_hl_frac': 0.0486991489119817, 'bb_std_mult': 1.6833055079614696, 'rsi_os': 42, 'rsi_ob': 80, 'vol_spike': 0.07957427381239773, 'adx_thresh': 7.461841370131058, 'atr_min_pct': 0.0042645026679818555, 'atr_max_pct': 0.11941040854402889, 'tp_mult': 1.5594550494312496, 'tsl_mult': 0.09005175675897215, 'strategy': 'breakout', 'time_stop': 156, 'use_sma': True, 'use_atr': True, 'use_adx': False, 'use_ema': True, 'use_spike': True, 'rsi_required': True, 'edge_k': 0.3109503535629303, 'edge_cap': 0.49836902939893357, 'bull_strategy': 'breakout', 'bull_bb_std_mult': 1.3166992944129172, 'bull_rsi_os': 48, 'bull_rsi_ob': 84, 'bull_adx_thresh': 34.083258829257005, 'bull_atr_min_pct': 0.010235208994050327, 'bull_atr_max_pct': 0.08401398392508042, 'bull_tp_mult': 2.399112421837196, 'bull_tsl_mult': 0.16616206094831604, 'bull_time_stop': 121, 'bull_use_sma': True, 'bull_use_ema': False, 'bull_use_atr': False, 'bull_use_adx': True, 'bull_use_spike': False, 'bull_rsi_required': True, 'bear_strategy': 'breakout', 'bear_bb_std_mult': 3.546793274871739, 'bear_rsi_os': 24, 'bear_rsi_ob': 68, 'bear_adx_thresh': 29.728632332110642, 'bear_atr_min_pct': 0.009153379951819914, 'bear_atr_max_pct': 0.11291150075376127, 'bear_tp_mult': 2.7248440727846908, 'bear_tsl_mult': 0.4559460037536156, 'bear_time_stop': 208, 'bear_use_sma': True, 'bear_use_ema': False, 'bear_use_atr': False, 'bear_use_adx': False, 'bear_use_spike': False, 'bear_rsi_required': False, 'sideways_strategy': 'breakout', 'sideways_bb_std_mult': 0.70062456669223, 'sideways_rsi_os': 27, 'sideways_rsi_ob': 73, 'sideways_adx_thresh': 23.4635649249844, 'sideways_atr_min_pct': 0.01612275560834134, 'sideways_atr_max_pct': 0.14654849580853957, 'sideways_tp_mult': 1.5609027703211416, 'sideways_tsl_mult': 0.7867687867355959, 'sideways_time_stop': 274, 'sideways_use_sma': False, 'sideways_use_ema': True, 'sideways_use_atr': True, 'sideways_use_adx': False, 'sideways_use_spike': True, 'sideways_rsi_required': True}.
[I 2025-09-01 05:40:04,573] Trial 558 finished with values: [-1000000000.0, 1000000000.0] and parameters: {'p_sma': 57, 'p_std': 15, 'p_atr': 7, 'p_adx': 18, 'rsi_period': 29, 'ema1': 25, 'ema2': 19, 'slip_atr_k': 0.20384336826405855, 'slip_spread_k': 0.3541927356038893, 'spread_hl_frac': 0.019021235210486345, 'bb_std_mult': 2.064142554190148, 'rsi_os': 40, 'rsi_ob': 87, 'vol_spike': 0.19974073955144184, 'adx_thresh': 13.955555331710569, 'atr_min_pct': 0.01758257174261523, 'atr_max_pct': 0.06304579030225063, 'tp_mult': 2.2569108097130592, 'tsl_mult': 0.05438234853042123, 'strategy': 'breakout', 'time_stop': 278, 'use_sma': False, 'use_atr': True, 'use_adx': True, 'use_ema': True, 'use_spike': False, 'rsi_required': True, 'edge_k': 0.10621529650586004, 'edge_cap': 0.4942815950979201, 'bull_strategy': 'breakout', 'bull_bb_std_mult': 3.0624207455126395, 'bull_rsi_os': 49, 'bull_rsi_ob': 78, 'bull_adx_thresh': 6.281401054256044, 'bull_atr_min_pct': 0.025424784498683278, 'bull_atr_max_pct': 0.0845186718837313, 'bull_tp_mult': 1.0862033891741862, 'bull_tsl_mult': 0.890606488850439, 'bull_time_stop': 105, 'bull_use_sma': True, 'bull_use_ema': False, 'bull_use_atr': False, 'bull_use_adx': True, 'bull_use_spike': True, 'bull_rsi_required': True, 'bear_strategy': 'breakout', 'bear_bb_std_mult': 2.5927870929413586, 'bear_rsi_os': 6, 'bear_rsi_ob': 82, 'bear_adx_thresh': 28.463393527084136, 'bear_atr_min_pct': 0.01713108702340741, 'bear_atr_max_pct': 0.061781046908942754, 'bear_tp_mult': 2.5570244361702414, 'bear_tsl_mult': 0.9006494788098669, 'bear_time_stop': 208, 'bear_use_sma': False, 'bear_use_ema': False, 'bear_use_atr': False, 'bear_use_adx': False, 'bear_use_spike': True, 'bear_rsi_required': False, 'sideways_strategy': 'breakout', 'sideways_bb_std_mult': 2.3401455620378657, 'sideways_rsi_os': 27, 'sideways_rsi_ob': 73, 'sideways_adx_thresh': 22.723563286091398, 'sideways_atr_min_pct': 0.0038423105158085944, 'sideways_atr_max_pct': 0.14759696305043563, 'sideways_tp_mult': 1.5600605395593368, 'sideways_tsl_mult': 0.4812334724321549, 'sideways_time_stop': 276, 'sideways_use_sma': False, 'sideways_use_ema': True, 'sideways_use_atr': True, 'sideways_use_adx': False, 'sideways_use_spike': True, 'sideways_rsi_required': True}.
