[I 2025-09-01 05:33:26,267] Trial 524 finished with values: [-1000000000.0, 1000000000.0] and parameters: {'p_sma': 59, 'p_std': 32, 'p_atr': 8, 'p_adx': 17, 'rsi_period': 36, 'ema1': 22, 'ema2': 31, 'slip_atr_k': 0.16406172290519944, 'slip_spread_k': 0.38147777532943694, 'spread_hl_frac': 0.048140511816893036, 'bb_std_mult': 1.8258921931353398, 'rsi_os': 30, 'rsi_ob': 50, 'vol_spike': 0.19225402967656785, 'adx_thresh': 13.507619005526474, 'atr_min_pct': 0.006952328276384359, 'atr_max_pct': 0.1251309063417619, 'tp_mult': 2.439749284194477, 'tsl_mult': 0.9440715346118493, 'strategy': 'mean_reversion', 'time_stop': 181, 'use_sma': False, 'use_atr': True, 'use_adx': False, 'use_ema': False, 'use_spike': False, 'rsi_required': True, 'edge_k': 0.18409041820068317, 'edge_cap': 0.4979142326597013, 'bull_strategy': 'mean_reversion', 'bull_bb_std_mult': 1.03843210791157, 'bull_rsi_os': 48, 'bull_rsi_ob': 66, 'bull_adx_thresh': 6.053679199234937, 'bull_atr_min_pct': 0.013142570163726365, 'bull_atr_max_pct': 0.06816649634600658, 'bull_tp_mult': 1.2082967369660274, 'bull_tsl_mult': 0.18988114124462152, 'bull_time_stop': 99, 'bull_use_sma': False, 'bull_use_ema': True, 'bull_use_atr': False, 'bull_use_adx': True, 'bull_use_spike': False, 'bull_rsi_required': True, 'bear_strategy': 'breakout', 'bear_bb_std_mult': 3.5945057524764072, 'bear_rsi_os': 28, 'bear_rsi_ob': 67, 'bear_adx_thresh': 30.036403951173263, 'bear_atr_min_pct': 0.006537437160789538, 'bear_atr_max_pct': 0.06827700155496406, 'bear_tp_mult': 2.492289166119303, 'bear_tsl_mult': 0.6803307929154048, 'bear_time_stop': 197, 'bear_use_sma': False, 'bear_use_ema': True, 'bear_use_atr': False, 'bear_use_adx': False, 'bear_use_spike': False, 'bear_rsi_required': True, 'sideways_strategy': 'breakout', 'sideways_bb_std_mult': 0.7359425402566833, 'sideways_rsi_os': 47, 'sideways_rsi_ob': 86, 'sideways_adx_thresh': 22.249145587367327, 'sideways_atr_min_pct': 0.004777673580514965, 'sideways_atr_max_pct': 0.10551386928499953, 'sideways_tp_mult': 1.5283376817417909, 'sideways_tsl_mult': 0.0658606000566444, 'sideways_time_stop': 45, 'sideways_use_sma': False, 'sideways_use_ema': False, 'sideways_use_atr': True, 'sideways_use_adx': True, 'sideways_use_spike': True, 'sideways_rsi_required': True}.
[I 2025-09-01 05:33:26,295] Trial 522 finished with values: [-1000000000.0, 1000000000.0] and parameters: {'p_sma': 59, 'p_std': 31, 'p_atr': 8, 'p_adx': 29, 'rsi_period': 55, 'ema1': 23, 'ema2': 13, 'slip_atr_k': 0.01649378392026291, 'slip_spread_k': 0.3721142531487509, 'spread_hl_frac': 0.008226325511726237, 'bb_std_mult': 1.814526092319438, 'rsi_os': 30, 'rsi_ob': 50, 'vol_spike': 0.20706147205125436, 'adx_thresh': 13.520570352681181, 'atr_min_pct': 0.003515923748432838, 'atr_max_pct': 0.011024115124049494, 'tp_mult': 2.4167642257374795, 'tsl_mult': 0.9265442091176901, 'strategy': 'mean_reversion', 'time_stop': 172, 'use_sma': False, 'use_atr': True, 'use_adx': False, 'use_ema': False, 'use_spike': True, 'rsi_required': False, 'edge_k': 0.19304203684514254, 'edge_cap': 0.49724099881333456, 'bull_strategy': 'breakout', 'bull_bb_std_mult': 1.0187827345458718, 'bull_rsi_os': 48, 'bull_rsi_ob': 89, 'bull_adx_thresh': 5.51341555775792, 'bull_atr_min_pct': 0.013280366786228733, 'bull_atr_max_pct': 0.05201411323762199, 'bull_tp_mult': 1.32746523791072, 'bull_tsl_mult': 0.19032805136616324, 'bull_time_stop': 67, 'bull_use_sma': True, 'bull_use_ema': True, 'bull_use_atr': False, 'bull_use_adx': True, 'bull_use_spike': False, 'bull_rsi_required': True, 'bear_strategy': 'breakout', 'bear_bb_std_mult': 3.551444691914567, 'bear_rsi_os': 8, 'bear_rsi_ob': 68, 'bear_adx_thresh': 30.15258932610662, 'bear_atr_min_pct': 0.006432604571878836, 'bear_atr_max_pct': 0.0695492762900949, 'bear_tp_mult': 2.2193864541184687, 'bear_tsl_mult': 0.6902535372101344, 'bear_time_stop': 205, 'bear_use_sma': False, 'bear_use_ema': False, 'bear_use_atr': False, 'bear_use_adx': False, 'bear_use_spike': False, 'bear_rsi_required': False, 'sideways_strategy': 'breakout', 'sideways_bb_std_mult': 0.7738046269606098, 'sideways_rsi_os': 47, 'sideways_rsi_ob': 54, 'sideways_adx_thresh': 22.306433695720678, 'sideways_atr_min_pct': 0.0038424513462166836, 'sideways_atr_max_pct': 0.10531420406222854, 'sideways_tp_mult': 1.468737660374599, 'sideways_tsl_mult': 0.06812470487011668, 'sideways_time_stop': 138, 'sideways_use_sma': False, 'sideways_use_ema': True, 'sideways_use_atr': True, 'sideways_use_adx': False, 'sideways_use_spike': True, 'sideways_rsi_required': True}.
[I 2025-09-01 05:34:03,267] Trial 525 finished with values: [-1000000000.0, 1000000000.0] and parameters: {'p_sma': 59, 'p_std': 32, 'p_atr': 8, 'p_adx': 17, 'rsi_period': 55, 'ema1': 24, 'ema2': 31, 'slip_atr_k': 0.09464608961412917, 'slip_spread_k': 0.3599904615485145, 'spread_hl_frac': 0.049907130894802226, 'bb_std_mult': 2.0597075574000527, 'rsi_os': 26, 'rsi_ob': 61, 'vol_spike': 0.1856870245353428, 'adx_thresh': 14.406081438280054, 'atr_min_pct': 0.0026307992904300486, 'atr_max_pct': 0.12564391587316667, 'tp_mult': 2.490924449915357, 'tsl_mult': 0.45975757241963544, 'strategy': 'mean_reversion', 'time_stop': 182, 'use_sma': False, 'use_atr': True, 'use_adx': False, 'use_ema': False, 'use_spike': False, 'rsi_required': True, 'edge_k': 0.2049313783164271, 'edge_cap': 0.5070730695420109, 'bull_strategy': 'mean_reversion', 'bull_bb_std_mult': 1.017638112091064, 'bull_rsi_os': 47, 'bull_rsi_ob': 61, 'bull_adx_thresh': 5.620273708513827, 'bull_atr_min_pct': 0.01308223429800656, 'bull_atr_max_pct': 0.09256964979761806, 'bull_tp_mult': 1.304635030974926, 'bull_tsl_mult': 0.18926184928206602, 'bull_time_stop': 118, 'bull_use_sma': False, 'bull_use_ema': True, 'bull_use_atr': True, 'bull_use_adx': True, 'bull_use_spike': False, 'bull_rsi_required': False, 'bear_strategy': 'breakout', 'bear_bb_std_mult': 3.5937215680254098, 'bear_rsi_os': 32, 'bear_rsi_ob': 67, 'bear_adx_thresh': 10.799872370754558, 'bear_atr_min_pct': 0.006562035750073594, 'bear_atr_max_pct': 0.06400345751444635, 'bear_tp_mult': 1.4281242373542478, 'bear_tsl_mult': 0.688758010616109, 'bear_time_stop': 257, 'bear_use_sma': True, 'bear_use_ema': True, 'bear_use_atr': False, 'bear_use_adx': False, 'bear_use_spike': False, 'bear_rsi_required': True, 'sideways_strategy': 'breakout', 'sideways_bb_std_mult': 0.7610355440430322, 'sideways_rsi_os': 18, 'sideways_rsi_ob': 54, 'sideways_adx_thresh': 22.76242301297493, 'sideways_atr_min_pct': 0.004630520524125649, 'sideways_atr_max_pct': 0.05917883534428015, 'sideways_tp_mult': 1.6282519985720318, 'sideways_tsl_mult': 0.98135361224214, 'sideways_time_stop': 215, 'sideways_use_sma': False, 'sideways_use_ema': False, 'sideways_use_atr': True, 'sideways_use_adx': True, 'sideways_use_spike': True, 'sideways_rsi_required': True}.
[I 2025-09-01 05:34:05,178] Trial 523 finished with values: [-0.025554862929588085, 0.025603570092738774] and parameters: {'p_sma': 59, 'p_std': 32, 'p_atr': 8, 'p_adx': 8, 'rsi_period': 55, 'ema1': 23, 'ema2': 37, 'slip_atr_k': 0.018623707717070618, 'slip_spread_k': 0.370426026358824, 'spread_hl_frac': 0.037521253610034534, 'bb_std_mult': 1.8292163876120697, 'rsi_os': 27, 'rsi_ob': 77, 'vol_spike': 0.20537974910446263, 'adx_thresh': 14.235266789825582, 'atr_min_pct': 0.0026009550370251055, 'atr_max_pct': 0.12687203921571671, 'tp_mult': 2.4180515470137105, 'tsl_mult': 0.9465180632799629, 'strategy': 'mean_reversion', 'time_stop': 180, 'use_sma': False, 'use_atr': True, 'use_adx': False, 'use_ema': False, 'use_spike': False, 'rsi_required': True, 'edge_k': 0.20413831747282576, 'edge_cap': 0.24056900431860623, 'bull_strategy': 'mean_reversion', 'bull_bb_std_mult': 1.0148570728401705, 'bull_rsi_os': 48, 'bull_rsi_ob': 77, 'bull_adx_thresh': 5.77959639681809, 'bull_atr_min_pct': 0.013699420463205903, 'bull_atr_max_pct': 0.031181368265821408, 'bull_tp_mult': 1.1592454587749925, 'bull_tsl_mult': 0.18671608539295897, 'bull_time_stop': 95, 'bull_use_sma': True, 'bull_use_ema': True, 'bull_use_atr': False, 'bull_use_adx': True, 'bull_use_spike': False, 'bull_rsi_required': True, 'bear_strategy': 'breakout', 'bear_bb_std_mult': 3.5968387108514444, 'bear_rsi_os': 33, 'bear_rsi_ob': 78, 'bear_adx_thresh': 30.24019281325138, 'bear_atr_min_pct': 0.007279763158708586, 'bear_atr_max_pct': 0.06810268193398769, 'bear_tp_mult': 1.4239130797992747, 'bear_tsl_mult': 0.6846389588685571, 'bear_time_stop': 206, 'bear_use_sma': False, 'bear_use_ema': True, 'bear_use_atr': False, 'bear_use_adx': False, 'bear_use_spike': False, 'bear_rsi_required': True, 'sideways_strategy': 'breakout', 'sideways_bb_std_mult': 1.1740194361809322, 'sideways_rsi_os': 46, 'sideways_rsi_ob': 77, 'sideways_adx_thresh': 22.18718134518836, 'sideways_atr_min_pct': 0.003621354206389373, 'sideways_atr_max_pct': 0.10513730286302328, 'sideways_tp_mult': 2.3294358212371025, 'sideways_tsl_mult': 0.20628394010424228, 'sideways_time_stop': 295, 'sideways_use_sma': False, 'sideways_use_ema': True, 'sideways_use_atr': True, 'sideways_use_adx': False, 'sideways_use_spike': True, 'sideways_rsi_required': True}.
[I 2025-09-01 05:34:07,790] Trial 527 finished with values: [-0.013986955815108004, 0.014146255119533288] and parameters: {'p_sma': 60, 'p_std': 28, 'p_atr': 7, 'p_adx': 11, 'rsi_period': 55, 'ema1': 24, 'ema2': 31, 'slip_atr_k': 0.011441264269336282, 'slip_spread_k': 0.4797077925518709, 'spread_hl_frac': 0.04676044598981358, 'bb_std_mult': 2.053868537542451, 'rsi_os': 26, 'rsi_ob': 61, 'vol_spike': 0.18609078881400637, 'adx_thresh': 34.40979045110418, 'atr_min_pct': 0.0026013337630897346, 'atr_max_pct': 0.14158734156686875, 'tp_mult': 2.5002361247738762, 'tsl_mult': 0.4629758150442157, 'strategy': 'breakout', 'time_stop': 196, 'use_sma': False, 'use_atr': True, 'use_adx': False, 'use_ema': True, 'use_spike': False, 'rsi_required': True, 'edge_k': 0.0830863581175865, 'edge_cap': 0.9160321809140433, 'bull_strategy': 'mean_reversion', 'bull_bb_std_mult': 0.6749752097174695, 'bull_rsi_os': 50, 'bull_rsi_ob': 71, 'bull_adx_thresh': 6.921781053894216, 'bull_atr_min_pct': 0.014177411617648569, 'bull_atr_max_pct': 0.04770869142790638, 'bull_tp_mult': 1.30228465901984, 'bull_tsl_mult': 0.22164973215349904, 'bull_time_stop': 112, 'bull_use_sma': True, 'bull_use_ema': False, 'bull_use_atr': True, 'bull_use_adx': True, 'bull_use_spike': False, 'bull_rsi_required': False, 'bear_strategy': 'breakout', 'bear_bb_std_mult': 3.5967589493739904, 'bear_rsi_os': 6, 'bear_rsi_ob': 80, 'bear_adx_thresh': 30.967616076621955, 'bear_atr_min_pct': 0.00881447055649255, 'bear_atr_max_pct': 0.017785318717827812, 'bear_tp_mult': 2.8397708507486255, 'bear_tsl_mult': 0.6081445429013657, 'bear_time_stop': 214, 'bear_use_sma': True, 'bear_use_ema': True, 'bear_use_atr': False, 'bear_use_adx': False, 'bear_use_spike': True, 'bear_rsi_required': True, 'sideways_strategy': 'breakout', 'sideways_bb_std_mult': 0.6917588645129834, 'sideways_rsi_os': 55, 'sideways_rsi_ob': 56, 'sideways_adx_thresh': 23.0261337169498, 'sideways_atr_min_pct': 0.004555733671809404, 'sideways_atr_max_pct': 0.056578767958331, 'sideways_tp_mult': 1.6456636166799268, 'sideways_tsl_mult': 0.8159056386200385, 'sideways_time_stop': 180, 'sideways_use_sma': False, 'sideways_use_ema': True, 'sideways_use_atr': True, 'sideways_use_adx': False, 'sideways_use_spike': True, 'sideways_rsi_required': True}.
[I 2025-09-01 05:34:08,037] Trial 526 finished with values: [-1000000000.0, 1000000000.0] and parameters: {'p_sma': 54, 'p_std': 28, 'p_atr': 8, 'p_adx': 11, 'rsi_period': 55, 'ema1': 24, 'ema2': 31, 'slip_atr_k': 0.03333957845900816, 'slip_spread_k': 0.36600764731475777, 'spread_hl_frac': 0.04669054649928354, 'bb_std_mult': 2.6437138528301567, 'rsi_os': 37, 'rsi_ob': 61, 'vol_spike': 0.19839516125549525, 'adx_thresh': 19.027213420385493, 'atr_min_pct': 0.004157946071562467, 'atr_max_pct': 0.128628958657716, 'tp_mult': 2.507180727489336, 'tsl_mult': 0.9143920136291431, 'strategy': 'mean_reversion', 'time_stop': 182, 'use_sma': False, 'use_atr': True, 'use_adx': False, 'use_ema': False, 'use_spike': True, 'rsi_required': True, 'edge_k': 0.35218199380186166, 'edge_cap': 0.5740954405479797, 'bull_strategy': 'breakout', 'bull_bb_std_mult': 0.6812139818941948, 'bull_rsi_os': 53, 'bull_rsi_ob': 51, 'bull_adx_thresh': 5.512660702711292, 'bull_atr_min_pct': 0.010933920150032105, 'bull_atr_max_pct': 0.04887160554895845, 'bull_tp_mult': 1.3060443465514964, 'bull_tsl_mult': 0.20487953718977872, 'bull_time_stop': 93, 'bull_use_sma': True, 'bull_use_ema': True, 'bull_use_atr': True, 'bull_use_adx': True, 'bull_use_spike': False, 'bull_rsi_required': False, 'bear_strategy': 'breakout', 'bear_bb_std_mult': 3.5340778617617854, 'bear_rsi_os': 33, 'bear_rsi_ob': 90, 'bear_adx_thresh': 10.935525302322334, 'bear_atr_min_pct': 0.008775687230077078, 'bear_atr_max_pct': 0.06331751680771727, 'bear_tp_mult': 1.2469844178873326, 'bear_tsl_mult': 0.6614268265523877, 'bear_time_stop': 212, 'bear_use_sma': True, 'bear_use_ema': False, 'bear_use_atr': False, 'bear_use_adx': False, 'bear_use_spike': False, 'bear_rsi_required': False, 'sideways_strategy': 'breakout', 'sideways_bb_std_mult': 2.4801547887874458, 'sideways_rsi_os': 45, 'sideways_rsi_ob': 54, 'sideways_adx_thresh': 22.798628385842672, 'sideways_atr_min_pct': 0.0055005136600107946, 'sideways_atr_max_pct': 0.059170674547523075, 'sideways_tp_mult': 1.6232180512406857, 'sideways_tsl_mult': 0.37785817454237214, 'sideways_time_stop': 243, 'sideways_use_sma': False, 'sideways_use_ema': True, 'sideways_use_atr': True, 'sideways_use_adx': False, 'sideways_use_spike': True, 'sideways_rsi_required': True}.
[I 2025-09-01 05:34:46,588] Trial 531 finished with values: [-1000000000.0, 1000000000.0] and parameters: {'p_sma': 60, 'p_std': 13, 'p_atr': 7, 'p_adx': 10, 'rsi_period': 51, 'ema1': 25, 'ema2': 33, 'slip_atr_k': 0.013197239596180549, 'slip_spread_k': 0.4260791925431177, 'spread_hl_frac': 0.04750764777421486, 'bb_std_mult': 1.5928310417301765, 'rsi_os': 26, 'rsi_ob': 88, 'vol_spike': 0.04375483924145311, 'adx_thresh': 30.920976360771228, 'atr_min_pct': 0.010058627319533466, 'atr_max_pct': 0.019921474763390193, 'tp_mult': 2.591405509589753, 'tsl_mult': 0.2778370764464929, 'strategy': 'breakout', 'time_stop': 194, 'use_sma': False, 'use_atr': True, 'use_adx': True, 'use_ema': True, 'use_spike': True, 'rsi_required': False, 'edge_k': 0.2445862213681964, 'edge_cap': 0.7970783385744622, 'bull_strategy': 'breakout', 'bull_bb_std_mult': 0.7726836072974899, 'bull_rsi_os': 50, 'bull_rsi_ob': 86, 'bull_adx_thresh': 7.119745477797582, 'bull_atr_min_pct': 0.012154875680433323, 'bull_atr_max_pct': 0.1072796473899046, 'bull_tp_mult': 1.0499515146096272, 'bull_tsl_mult': 0.2278027961100476, 'bull_time_stop': 110, 'bull_use_sma': True, 'bull_use_ema': False, 'bull_use_atr': False, 'bull_use_adx': True, 'bull_use_spike': True, 'bull_rsi_required': True, 'bear_strategy': 'breakout', 'bear_bb_std_mult': 3.4819697405415595, 'bear_rsi_os': 35, 'bear_rsi_ob': 80, 'bear_adx_thresh': 24.688892947003186, 'bear_atr_min_pct': 0.00890875744897861, 'bear_atr_max_pct': 0.06651044483667093, 'bear_tp_mult': 2.8435278453909207, 'bear_tsl_mult': 0.6049413255121296, 'bear_time_stop': 189, 'bear_use_sma': True, 'bear_use_ema': False, 'bear_use_atr': False, 'bear_use_adx': False, 'bear_use_spike': True, 'bear_rsi_required': False, 'sideways_strategy': 'mean_reversion', 'sideways_bb_std_mult': 0.6822599755225078, 'sideways_rsi_os': 12, 'sideways_rsi_ob': 89, 'sideways_adx_thresh': 23.092368661190864, 'sideways_atr_min_pct': 0.00572011986053125, 'sideways_atr_max_pct': 0.0497662208656973, 'sideways_tp_mult': 1.4986423469813477, 'sideways_tsl_mult': 0.9508932149976019, 'sideways_time_stop': 257, 'sideways_use_sma': False, 'sideways_use_ema': False, 'sideways_use_atr': True, 'sideways_use_adx': False, 'sideways_use_spike': True, 'sideways_rsi_required': True}.
[I 2025-09-01 05:34:46,794] Trial 529 finished with values: [-1000000000.0, 1000000000.0] and parameters: {'p_sma': 5, 'p_std': 13, 'p_atr': 7, 'p_adx': 9, 'rsi_period': 50, 'ema1': 24, 'ema2': 48, 'slip_atr_k': 0.19241063134599615, 'slip_spread_k': 0.48492109655196014, 'spread_hl_frac': 0.04739436072736436, 'bb_std_mult': 2.639195305492743, 'rsi_os': 39, 'rsi_ob': 88, 'vol_spike': 0.022647108117129944, 'adx_thresh': 20.799262830057103, 'atr_min_pct': 0.004253174237469211, 'atr_max_pct': 0.14172933314959302, 'tp_mult': 2.5013490690596156, 'tsl_mult': 0.6392173398502667, 'strategy': 'breakout', 'time_stop': 197, 'use_sma': False, 'use_atr': True, 'use_adx': True, 'use_ema': True, 'use_spike': True, 'rsi_required': False, 'edge_k': 0.3387981354751359, 'edge_cap': 0.5750508003468562, 'bull_strategy': 'breakout', 'bull_bb_std_mult': 0.8117902281896591, 'bull_rsi_os': 53, 'bull_rsi_ob': 87, 'bull_adx_thresh': 6.8956433150476775, 'bull_atr_min_pct': 0.011723570574348233, 'bull_atr_max_pct': 0.1056704086223185, 'bull_tp_mult': 1.2083419853846102, 'bull_tsl_mult': 0.2173881181203127, 'bull_time_stop': 93, 'bull_use_sma': True, 'bull_use_ema': False, 'bull_use_atr': True, 'bull_use_adx': True, 'bull_use_spike': True, 'bull_rsi_required': False, 'bear_strategy': 'breakout', 'bear_bb_std_mult': 3.51610615874165, 'bear_rsi_os': 6, 'bear_rsi_ob': 93, 'bear_adx_thresh': 30.894792448405383, 'bear_atr_min_pct': 0.008505224616322206, 'bear_atr_max_pct': 0.12951024758327534, 'bear_tp_mult': 2.8132137491337903, 'bear_tsl_mult': 0.6567934463039824, 'bear_time_stop': 212, 'bear_use_sma': True, 'bear_use_ema': False, 'bear_use_atr': False, 'bear_use_adx': False, 'bear_use_spike': True, 'bear_rsi_required': False, 'sideways_strategy': 'mean_reversion', 'sideways_bb_std_mult': 0.6539634579674999, 'sideways_rsi_os': 55, 'sideways_rsi_ob': 52, 'sideways_adx_thresh': 25.261482199703835, 'sideways_atr_min_pct': 0.0056892852361011305, 'sideways_atr_max_pct': 0.09741477175051581, 'sideways_tp_mult': 2.9946917868374743, 'sideways_tsl_mult': 0.9788723644614464, 'sideways_time_stop': 27, 'sideways_use_sma': False, 'sideways_use_ema': True, 'sideways_use_atr': True, 'sideways_use_adx': False, 'sideways_use_spike': True, 'sideways_rsi_required': True}.
[I 2025-09-01 05:34:47,255] Trial 530 finished with values: [-1000000000.0, 1000000000.0] and parameters: {'p_sma': 56, 'p_std': 30, 'p_atr': 9, 'p_adx': 18, 'rsi_period': 50, 'ema1': 24, 'ema2': 32, 'slip_atr_k': 0.01208865484593635, 'slip_spread_k': 0.4156333945962112, 'spread_hl_frac': 0.046450948858745296, 'bb_std_mult': 1.89915772424878, 'rsi_os': 26, 'rsi_ob': 52, 'vol_spike': 0.04502285984436878, 'adx_thresh': 21.506330918491116, 'atr_min_pct': 0.029980808228988947, 'atr_max_pct': 0.14224740976174016, 'tp_mult': 2.4989912830075585, 'tsl_mult': 0.2747412291504595, 'strategy': 'breakout', 'time_stop': 200, 'use_sma': False, 'use_atr': True, 'use_adx': True, 'use_ema': True, 'use_spike': True, 'rsi_required': False, 'edge_k': 0.07323848437814784, 'edge_cap': 0.9394976158777928, 'bull_strategy': 'breakout', 'bull_bb_std_mult': 0.7593799715261871, 'bull_rsi_os': 50, 'bull_rsi_ob': 71, 'bull_adx_thresh': 6.996591306644824, 'bull_atr_min_pct': 0.010698387159665633, 'bull_atr_max_pct': 0.10192827909575726, 'bull_tp_mult': 1.2319904671182287, 'bull_tsl_mult': 0.21697651873227597, 'bull_time_stop': 83, 'bull_use_sma': True, 'bull_use_ema': False, 'bull_use_atr': True, 'bull_use_adx': True, 'bull_use_spike': False, 'bull_rsi_required': False, 'bear_strategy': 'breakout', 'bear_bb_std_mult': 3.4941221788752803, 'bear_rsi_os': 34, 'bear_rsi_ob': 86, 'bear_adx_thresh': 30.868003719668952, 'bear_atr_min_pct': 0.008671119633980515, 'bear_atr_max_pct': 0.06385362613828117, 'bear_tp_mult': 2.79869770300876, 'bear_tsl_mult': 0.6087604850295658, 'bear_time_stop': 213, 'bear_use_sma': True, 'bear_use_ema': False, 'bear_use_atr': False, 'bear_use_adx': False, 'bear_use_spike': False, 'bear_rsi_required': False, 'sideways_strategy': 'mean_reversion', 'sideways_bb_std_mult': 0.6857516284636089, 'sideways_rsi_os': 45, 'sideways_rsi_ob': 56, 'sideways_adx_thresh': 24.33640247475037, 'sideways_atr_min_pct': 0.005589690673438081, 'sideways_atr_max_pct': 0.03531357985944485, 'sideways_tp_mult': 1.637812694710762, 'sideways_tsl_mult': 0.9517495244838424, 'sideways_time_stop': 180, 'sideways_use_sma': False, 'sideways_use_ema': True, 'sideways_use_atr': True, 'sideways_use_adx': False, 'sideways_use_spike': True, 'sideways_rsi_required': True}.
