[I 2025-09-01 04:22:20,315] Trial 120 finished with values: [-0.02851213240525463, 0.028360141128039626] and parameters: {'p_sma': 15, 'p_std': 40, 'p_atr': 17, 'p_adx': 14, 'rsi_period': 74, 'ema1': 30, 'ema2': 18, 'slip_atr_k': 0.09587874431463791, 'slip_spread_k': 0.5149865419791566, 'spread_hl_frac': 0.004515188442609848, 'bb_std_mult': 0.7065328919392411, 'rsi_os': 48, 'rsi_ob': 93, 'vol_spike': 0.253326382719707, 'adx_thresh': 17.88699716093044, 'atr_min_pct': 0.017324039730316022, 'atr_max_pct': 0.13847245412038708, 'tp_mult': 2.5271679902008435, 'tsl_mult': 0.47968392059695447, 'strategy': 'breakout', 'time_stop': 61, 'use_sma': False, 'use_atr': False, 'use_adx': False, 'use_ema': False, 'use_spike': True, 'rsi_required': True, 'edge_k': 0.6961191047196826, 'edge_cap': 0.20897245609872256, 'bull_strategy': 'mean_reversion', 'bull_bb_std_mult': 2.810382424457317, 'bull_rsi_os': 27, 'bull_rsi_ob': 68, 'bull_adx_thresh': 15.16597721462266, 'bull_atr_min_pct': 0.014698818862099432, 'bull_atr_max_pct': 0.103811589277229, 'bull_tp_mult': 1.6889557459467457, 'bull_tsl_mult': 0.6857534792223142, 'bull_time_stop': 236, 'bull_use_sma': True, 'bull_use_ema': False, 'bull_use_atr': True, 'bull_use_adx': True, 'bull_use_spike': True, 'bull_rsi_required': False, 'bear_strategy': 'breakout', 'bear_bb_std_mult': 1.6864134520952163, 'bear_rsi_os': 17, 'bear_rsi_ob': 47, 'bear_adx_thresh': 21.362337209610804, 'bear_atr_min_pct': 0.028554270731312073, 'bear_atr_max_pct': 0.0850161149353506, 'bear_tp_mult': 1.204455486248383, 'bear_tsl_mult': 0.4510128529603255, 'bear_time_stop': 144, 'bear_use_sma': True, 'bear_use_ema': False, 'bear_use_atr': False, 'bear_use_adx': True, 'bear_use_spike': True, 'bear_rsi_required': False, 'sideways_strategy': 'mean_reversion', 'sideways_bb_std_mult': 1.662183488922413, 'sideways_rsi_os': 14, 'sideways_rsi_ob': 49, 'sideways_adx_thresh': 17.604025199886664, 'sideways_atr_min_pct': 0.001323065698672186, 'sideways_atr_max_pct': 0.11129394993703905, 'sideways_tp_mult': 2.7421833506514535, 'sideways_tsl_mult': 0.9853043835233366, 'sideways_time_stop': 167, 'sideways_use_sma': True, 'sideways_use_ema': True, 'sideways_use_atr': True, 'sideways_use_adx': False, 'sideways_use_spike': False, 'sideways_rsi_required': False}.
[I 2025-09-01 04:22:20,902] Trial 116 finished with values: [-1000000000.0, 1000000000.0] and parameters: {'p_sma': 40, 'p_std': 13, 'p_atr': 20, 'p_adx': 12, 'rsi_period': 73, 'ema1': 25, 'ema2': 26, 'slip_atr_k': 0.10822320916877654, 'slip_spread_k': 0.8858610592673051, 'spread_hl_frac': 0.0402486814490373, 'bb_std_mult': 0.7192372383363314, 'rsi_os': 19, 'rsi_ob': 57, 'vol_spike': 0.27001893085092676, 'adx_thresh': 17.80954767154565, 'atr_min_pct': 0.02648681523256693, 'atr_max_pct': 0.08754127658710371, 'tp_mult': 2.1306168282764437, 'tsl_mult': 0.8252214939958498, 'strategy': 'mean_reversion', 'time_stop': 14, 'use_sma': False, 'use_atr': False, 'use_adx': False, 'use_ema': False, 'use_spike': False, 'rsi_required': True, 'edge_k': 0.4799152788988853, 'edge_cap': 0.9587090770052673, 'bull_strategy': 'mean_reversion', 'bull_bb_std_mult': 1.1259490736084867, 'bull_rsi_os': 6, 'bull_rsi_ob': 70, 'bull_adx_thresh': 14.393449758347424, 'bull_atr_min_pct': 0.014740438127231413, 'bull_atr_max_pct': 0.08089948560172426, 'bull_tp_mult': 1.5107580224351767, 'bull_tsl_mult': 0.9610571519904735, 'bull_time_stop': 234, 'bull_use_sma': True, 'bull_use_ema': True, 'bull_use_atr': True, 'bull_use_adx': True, 'bull_use_spike': True, 'bull_rsi_required': False, 'bear_strategy': 'breakout', 'bear_bb_std_mult': 3.452422603154501, 'bear_rsi_os': 49, 'bear_rsi_ob': 46, 'bear_adx_thresh': 32.16440321256409, 'bear_atr_min_pct': 0.011375352678446471, 'bear_atr_max_pct': 0.09448790090091289, 'bear_tp_mult': 1.2786858010170934, 'bear_tsl_mult': 0.1136683487855904, 'bear_time_stop': 133, 'bear_use_sma': True, 'bear_use_ema': True, 'bear_use_atr': False, 'bear_use_adx': True, 'bear_use_spike': True, 'bear_rsi_required': True, 'sideways_strategy': 'mean_reversion', 'sideways_bb_std_mult': 3.1424447133552253, 'sideways_rsi_os': 27, 'sideways_rsi_ob': 88, 'sideways_adx_thresh': 20.4266888002353, 'sideways_atr_min_pct': 0.0007388137683361402, 'sideways_atr_max_pct': 0.11426587839113858, 'sideways_tp_mult': 2.073868089224991, 'sideways_tsl_mult': 0.1618732831484237, 'sideways_time_stop': 116, 'sideways_use_sma': True, 'sideways_use_ema': False, 'sideways_use_atr': True, 'sideways_use_adx': False, 'sideways_use_spike': True, 'sideways_rsi_required': True}.
[I 2025-09-01 04:22:21,443] Trial 119 finished with values: [-1000000000.0, 1000000000.0] and parameters: {'p_sma': 15, 'p_std': 59, 'p_atr': 16, 'p_adx': 12, 'rsi_period': 75, 'ema1': 11, 'ema2': 44, 'slip_atr_k': 0.08878263099267228, 'slip_spread_k': 0.8900491307590782, 'spread_hl_frac': 0.014856374995582053, 'bb_std_mult': 1.7198661841533063, 'rsi_os': 48, 'rsi_ob': 93, 'vol_spike': 0.268461341853559, 'adx_thresh': 22.104548530431213, 'atr_min_pct': 0.007880798804712836, 'atr_max_pct': 0.06448337844942864, 'tp_mult': 2.5350399559804284, 'tsl_mult': 0.4820790294136699, 'strategy': 'breakout', 'time_stop': 220, 'use_sma': False, 'use_atr': False, 'use_adx': False, 'use_ema': False, 'use_spike': True, 'rsi_required': True, 'edge_k': 1.7465723994163032, 'edge_cap': 0.4998250738258822, 'bull_strategy': 'mean_reversion', 'bull_bb_std_mult': 2.8380096928917076, 'bull_rsi_os': 26, 'bull_rsi_ob': 63, 'bull_adx_thresh': 5.833127882579202, 'bull_atr_min_pct': 0.01449952693419845, 'bull_atr_max_pct': 0.04375511693672627, 'bull_tp_mult': 1.1606155286828552, 'bull_tsl_mult': 0.6865306073043456, 'bull_time_stop': 245, 'bull_use_sma': True, 'bull_use_ema': False, 'bull_use_atr': True, 'bull_use_adx': True, 'bull_use_spike': True, 'bull_rsi_required': False, 'bear_strategy': 'breakout', 'bear_bb_std_mult': 0.8464087254184043, 'bear_rsi_os': 19, 'bear_rsi_ob': 89, 'bear_adx_thresh': 21.53033317405264, 'bear_atr_min_pct': 0.013469770251011608, 'bear_atr_max_pct': 0.07789216758794454, 'bear_tp_mult': 1.3457947996991795, 'bear_tsl_mult': 0.45046171557447795, 'bear_time_stop': 96, 'bear_use_sma': True, 'bear_use_ema': False, 'bear_use_atr': False, 'bear_use_adx': True, 'bear_use_spike': True, 'bear_rsi_required': False, 'sideways_strategy': 'mean_reversion', 'sideways_bb_std_mult': 2.880325753381045, 'sideways_rsi_os': 14, 'sideways_rsi_ob': 52, 'sideways_adx_thresh': 20.23489483310134, 'sideways_atr_min_pct': 0.0008928401313326111, 'sideways_atr_max_pct': 0.11291405431379885, 'sideways_tp_mult': 2.0422548942607555, 'sideways_tsl_mult': 0.14446630988243786, 'sideways_time_stop': 68, 'sideways_use_sma': True, 'sideways_use_ema': True, 'sideways_use_atr': True, 'sideways_use_adx': False, 'sideways_use_spike': False, 'sideways_rsi_required': False}.
[I 2025-09-01 04:22:21,880] Trial 118 finished with values: [-1000000000.0, 1000000000.0] and parameters: {'p_sma': 53, 'p_std': 35, 'p_atr': 10, 'p_adx': 12, 'rsi_period': 74, 'ema1': 11, 'ema2': 18, 'slip_atr_k': 0.10844284947936554, 'slip_spread_k': 0.8961675940343283, 'spread_hl_frac': 0.015592355864010563, 'bb_std_mult': 1.450272604402898, 'rsi_os': 48, 'rsi_ob': 91, 'vol_spike': 0.2532074896645349, 'adx_thresh': 22.07574173424952, 'atr_min_pct': 0.017200414953434762, 'atr_max_pct': 0.044318968904087375, 'tp_mult': 2.1366673875997004, 'tsl_mult': 0.42871287139299863, 'strategy': 'mean_reversion', 'time_stop': 215, 'use_sma': False, 'use_atr': False, 'use_adx': False, 'use_ema': False, 'use_spike': False, 'rsi_required': True, 'edge_k': 0.8572886441082814, 'edge_cap': 0.7167166400350071, 'bull_strategy': 'mean_reversion', 'bull_bb_std_mult': 2.884336954987069, 'bull_rsi_os': 6, 'bull_rsi_ob': 47, 'bull_adx_thresh': 13.90662792474355, 'bull_atr_min_pct': 0.002689443258051795, 'bull_atr_max_pct': 0.10432926731775558, 'bull_tp_mult': 1.810832325467527, 'bull_tsl_mult': 0.5227492351756637, 'bull_time_stop': 221, 'bull_use_sma': True, 'bull_use_ema': True, 'bull_use_atr': True, 'bull_use_adx': True, 'bull_use_spike': True, 'bull_rsi_required': False, 'bear_strategy': 'breakout', 'bear_bb_std_mult': 1.6793832565604196, 'bear_rsi_os': 21, 'bear_rsi_ob': 47, 'bear_adx_thresh': 21.436767841153316, 'bear_atr_min_pct': 0.013402768817415613, 'bear_atr_max_pct': 0.08535326424401632, 'bear_tp_mult': 1.5142209964941147, 'bear_tsl_mult': 0.4627422307734654, 'bear_time_stop': 25, 'bear_use_sma': True, 'bear_use_ema': True, 'bear_use_atr': False, 'bear_use_adx': True, 'bear_use_spike': True, 'bear_rsi_required': True, 'sideways_strategy': 'mean_reversion', 'sideways_bb_std_mult': 2.881124402547876, 'sideways_rsi_os': 27, 'sideways_rsi_ob': 66, 'sideways_adx_thresh': 20.284645173137214, 'sideways_atr_min_pct': 0.0008101088523032267, 'sideways_atr_max_pct': 0.11271197708868508, 'sideways_tp_mult': 2.074889023724139, 'sideways_tsl_mult': 0.8054630854092342, 'sideways_time_stop': 85, 'sideways_use_sma': True, 'sideways_use_ema': False, 'sideways_use_atr': True, 'sideways_use_adx': False, 'sideways_use_spike': True, 'sideways_rsi_required': True}.
[I 2025-09-01 04:23:05,187] Trial 123 finished with values: [-1000000000.0, 1000000000.0] and parameters: {'p_sma': 15, 'p_std': 40, 'p_atr': 16, 'p_adx': 17, 'rsi_period': 68, 'ema1': 29, 'ema2': 19, 'slip_atr_k': 0.09759211159384566, 'slip_spread_k': 0.5217441144458325, 'spread_hl_frac': 0.0041623774889035445, 'bb_std_mult': 3.5672412288251314, 'rsi_os': 53, 'rsi_ob': 88, 'vol_spike': 0.26147729714960594, 'adx_thresh': 16.48187692698119, 'atr_min_pct': 0.016949278880748774, 'atr_max_pct': 0.12621564160281512, 'tp_mult': 2.4236887951710964, 'tsl_mult': 0.534512291275641, 'strategy': 'breakout', 'time_stop': 54, 'use_sma': False, 'use_atr': True, 'use_adx': False, 'use_ema': False, 'use_spike': True, 'rsi_required': True, 'edge_k': 0.6036717399021294, 'edge_cap': 0.2169077807937928, 'bull_strategy': 'breakout', 'bull_bb_std_mult': 2.704769978951239, 'bull_rsi_os': 33, 'bull_rsi_ob': 68, 'bull_adx_thresh': 18.156843178514688, 'bull_atr_min_pct': 0.018129340756328736, 'bull_atr_max_pct': 0.12382553246298167, 'bull_tp_mult': 1.6843336197846257, 'bull_tsl_mult': 0.5981759004665053, 'bull_time_stop': 46, 'bull_use_sma': True, 'bull_use_ema': False, 'bull_use_atr': True, 'bull_use_adx': True, 'bull_use_spike': True, 'bull_rsi_required': False, 'bear_strategy': 'breakout', 'bear_bb_std_mult': 1.6027369106535558, 'bear_rsi_os': 30, 'bear_rsi_ob': 53, 'bear_adx_thresh': 18.801292274932596, 'bear_atr_min_pct': 0.028476245530043083, 'bear_atr_max_pct': 0.08481023226619969, 'bear_tp_mult': 1.197864544684606, 'bear_tsl_mult': 0.7252671239484485, 'bear_time_stop': 144, 'bear_use_sma': True, 'bear_use_ema': False, 'bear_use_atr': False, 'bear_use_adx': True, 'bear_use_spike': True, 'bear_rsi_required': False, 'sideways_strategy': 'mean_reversion', 'sideways_bb_std_mult': 1.67214335621497, 'sideways_rsi_os': 11, 'sideways_rsi_ob': 48, 'sideways_adx_thresh': 17.76570905412365, 'sideways_atr_min_pct': 0.004077213277155981, 'sideways_atr_max_pct': 0.1068713697195176, 'sideways_tp_mult': 2.846920948687704, 'sideways_tsl_mult': 0.995014505867186, 'sideways_time_stop': 172, 'sideways_use_sma': False, 'sideways_use_ema': True, 'sideways_use_atr': True, 'sideways_use_adx': False, 'sideways_use_spike': False, 'sideways_rsi_required': False}.
[I 2025-09-01 04:23:05,208] Trial 122 finished with values: [-1000000000.0, 1000000000.0] and parameters: {'p_sma': 15, 'p_std': 40, 'p_atr': 16, 'p_adx': 17, 'rsi_period': 75, 'ema1': 30, 'ema2': 19, 'slip_atr_k': 0.08978941695029809, 'slip_spread_k': 0.6249382443459195, 'spread_hl_frac': 0.004320742408830226, 'bb_std_mult': 0.789174334976781, 'rsi_os': 53, 'rsi_ob': 87, 'vol_spike': 0.25468177270449566, 'adx_thresh': 16.197543346850836, 'atr_min_pct': 0.017191882482728765, 'atr_max_pct': 0.1248708597226881, 'tp_mult': 2.8342072180570757, 'tsl_mult': 0.475955013246815, 'strategy': 'breakout', 'time_stop': 56, 'use_sma': False, 'use_atr': True, 'use_adx': False, 'use_ema': False, 'use_spike': True, 'rsi_required': True, 'edge_k': 1.5380908165088634, 'edge_cap': 0.20562607799439658, 'bull_strategy': 'breakout', 'bull_bb_std_mult': 2.746282833612335, 'bull_rsi_os': 33, 'bull_rsi_ob': 73, 'bull_adx_thresh': 18.61584169013893, 'bull_atr_min_pct': 0.018395335491392058, 'bull_atr_max_pct': 0.10843117680249618, 'bull_tp_mult': 1.6825312369305585, 'bull_tsl_mult': 0.5933288185071757, 'bull_time_stop': 222, 'bull_use_sma': True, 'bull_use_ema': False, 'bull_use_atr': True, 'bull_use_adx': True, 'bull_use_spike': True, 'bull_rsi_required': False, 'bear_strategy': 'breakout', 'bear_bb_std_mult': 1.6471785087009632, 'bear_rsi_os': 29, 'bear_rsi_ob': 53, 'bear_adx_thresh': 18.935120025706375, 'bear_atr_min_pct': 0.02849765678226133, 'bear_atr_max_pct': 0.045971802778879446, 'bear_tp_mult': 1.0840795128617455, 'bear_tsl_mult': 0.024847693668568538, 'bear_time_stop': 146, 'bear_use_sma': True, 'bear_use_ema': False, 'bear_use_atr': False, 'bear_use_adx': True, 'bear_use_spike': True, 'bear_rsi_required': False, 'sideways_strategy': 'mean_reversion', 'sideways_bb_std_mult': 1.651202140328841, 'sideways_rsi_os': 14, 'sideways_rsi_ob': 48, 'sideways_adx_thresh': 15.618315543329361, 'sideways_atr_min_pct': 0.0034754843745035094, 'sideways_atr_max_pct': 0.10756272750875182, 'sideways_tp_mult': 2.75679430073112, 'sideways_tsl_mult': 0.9954686154730664, 'sideways_time_stop': 173, 'sideways_use_sma': False, 'sideways_use_ema': True, 'sideways_use_atr': True, 'sideways_use_adx': False, 'sideways_use_spike': False, 'sideways_rsi_required': False}.
[I 2025-09-01 04:23:05,946] Trial 121 finished with values: [-1000000000.0, 1000000000.0] and parameters: {'p_sma': 15, 'p_std': 40, 'p_atr': 16, 'p_adx': 20, 'rsi_period': 75, 'ema1': 30, 'ema2': 18, 'slip_atr_k': 0.11048760938378717, 'slip_spread_k': 0.504589921806489, 'spread_hl_frac': 0.004232102584809467, 'bb_std_mult': 3.598193168659238, 'rsi_os': 53, 'rsi_ob': 88, 'vol_spike': 0.26862035746263724, 'adx_thresh': 14.298278479279496, 'atr_min_pct': 0.017107826738961024, 'atr_max_pct': 0.13918550349890835, 'tp_mult': 2.4106535959830375, 'tsl_mult': 0.4778900238582252, 'strategy': 'breakout', 'time_stop': 49, 'use_sma': False, 'use_atr': False, 'use_adx': False, 'use_ema': False, 'use_spike': True, 'rsi_required': True, 'edge_k': 0.6962505496535789, 'edge_cap': 0.20460650949526976, 'bull_strategy': 'mean_reversion', 'bull_bb_std_mult': 2.820514155214678, 'bull_rsi_os': 10, 'bull_rsi_ob': 73, 'bull_adx_thresh': 16.275111936291278, 'bull_atr_min_pct': 0.018406780733753344, 'bull_atr_max_pct': 0.10445688733402025, 'bull_tp_mult': 1.5895822308441243, 'bull_tsl_mult': 0.6077145086474722, 'bull_time_stop': 80, 'bull_use_sma': True, 'bull_use_ema': False, 'bull_use_atr': True, 'bull_use_adx': True, 'bull_use_spike': True, 'bull_rsi_required': False, 'bear_strategy': 'breakout', 'bear_bb_std_mult': 1.6679241052653015, 'bear_rsi_os': 19, 'bear_rsi_ob': 51, 'bear_adx_thresh': 30.087030786903824, 'bear_atr_min_pct': 0.0284190434973398, 'bear_atr_max_pct': 0.08462381882145242, 'bear_tp_mult': 1.2048198829980803, 'bear_tsl_mult': 0.5191679984595807, 'bear_time_stop': 91, 'bear_use_sma': True, 'bear_use_ema': False, 'bear_use_atr': False, 'bear_use_adx': True, 'bear_use_spike': True, 'bear_rsi_required': False, 'sideways_strategy': 'mean_reversion', 'sideways_bb_std_mult': 1.615828683462651, 'sideways_rsi_os': 12, 'sideways_rsi_ob': 48, 'sideways_adx_thresh': 14.567313810378165, 'sideways_atr_min_pct': 0.021824642250556792, 'sideways_atr_max_pct': 0.10838244121818834, 'sideways_tp_mult': 2.5538875379253754, 'sideways_tsl_mult': 0.9907975109549524, 'sideways_time_stop': 180, 'sideways_use_sma': True, 'sideways_use_ema': True, 'sideways_use_atr': True, 'sideways_use_adx': False, 'sideways_use_spike': False, 'sideways_rsi_required': False}.
[I 2025-09-01 04:23:06,601] Trial 124 finished with values: [-1000000000.0, 1000000000.0] and parameters: {'p_sma': 15, 'p_std': 40, 'p_atr': 17, 'p_adx': 14, 'rsi_period': 82, 'ema1': 29, 'ema2': 20, 'slip_atr_k': 0.09637289264060105, 'slip_spread_k': 0.5186554785055172, 'spread_hl_frac': 0.0037846796624851223, 'bb_std_mult': 0.6547840276705507, 'rsi_os': 52, 'rsi_ob': 90, 'vol_spike': 0.2612021229823356, 'adx_thresh': 16.46620398450545, 'atr_min_pct': 0.014299343135491211, 'atr_max_pct': 0.11673127130119366, 'tp_mult': 2.3755686842266375, 'tsl_mult': 0.5327270839672489, 'strategy': 'breakout', 'time_stop': 50, 'use_sma': False, 'use_atr': True, 'use_adx': False, 'use_ema': False, 'use_spike': True, 'rsi_required': True, 'edge_k': 0.6975654304734835, 'edge_cap': 0.19912210003910177, 'bull_strategy': 'breakout', 'bull_bb_std_mult': 3.111514231241507, 'bull_rsi_os': 33, 'bull_rsi_ob': 68, 'bull_adx_thresh': 18.412772786611235, 'bull_atr_min_pct': 0.018280877067696155, 'bull_atr_max_pct': 0.10895817767793053, 'bull_tp_mult': 1.6845962166464756, 'bull_tsl_mult': 0.5989349330456343, 'bull_time_stop': 63, 'bull_use_sma': True, 'bull_use_ema': False, 'bull_use_atr': True, 'bull_use_adx': True, 'bull_use_spike': True, 'bull_rsi_required': False, 'bear_strategy': 'breakout', 'bear_bb_std_mult': 1.3748208917265117, 'bear_rsi_os': 30, 'bear_rsi_ob': 51, 'bear_adx_thresh': 29.70548292271136, 'bear_atr_min_pct': 0.02861098867146394, 'bear_atr_max_pct': 0.0997467144028136, 'bear_tp_mult': 1.1113528795679182, 'bear_tsl_mult': 0.037721425588229274, 'bear_time_stop': 67, 'bear_use_sma': True, 'bear_use_ema': False, 'bear_use_atr': False, 'bear_use_adx': True, 'bear_use_spike': True, 'bear_rsi_required': False, 'sideways_strategy': 'mean_reversion', 'sideways_bb_std_mult': 1.716897015134621, 'sideways_rsi_os': 12, 'sideways_rsi_ob': 49, 'sideways_adx_thresh': 17.89232021058929, 'sideways_atr_min_pct': 0.004272413900945276, 'sideways_atr_max_pct': 0.107527977952448, 'sideways_tp_mult': 2.8673271929054223, 'sideways_tsl_mult': 0.9920904715284664, 'sideways_time_stop': 177, 'sideways_use_sma': False, 'sideways_use_ema': True, 'sideways_use_atr': True, 'sideways_use_adx': False, 'sideways_use_spike': False, 'sideways_rsi_required': False}.
[I 2025-09-01 04:23:46,459] Trial 127 finished with values: [-1000000000.0, 1000000000.0] and parameters: {'p_sma': 18, 'p_std': 42, 'p_atr': 17, 'p_adx': 20, 'rsi_period': 82, 'ema1': 29, 'ema2': 23, 'slip_atr_k': 0.09807405805627753, 'slip_spread_k': 0.35673038909157573, 'spread_hl_frac': 0.002893435429665021, 'bb_std_mult': 0.5528649872433693, 'rsi_os': 50, 'rsi_ob': 89, 'vol_spike': 0.29442805465228666, 'adx_thresh': 11.757079912019892, 'atr_min_pct': 0.016150593143687473, 'atr_max_pct': 0.10710674744637044, 'tp_mult': 2.540868791643508, 'tsl_mult': 0.5668679657924299, 'strategy': 'breakout', 'time_stop': 24, 'use_sma': True, 'use_atr': False, 'use_adx': False, 'use_ema': True, 'use_spike': True, 'rsi_required': False, 'edge_k': 1.9072967653646133, 'edge_cap': 0.2531852991398742, 'bull_strategy': 'mean_reversion', 'bull_bb_std_mult': 3.0940791552155664, 'bull_rsi_os': 28, 'bull_rsi_ob': 69, 'bull_adx_thresh': 20.279861722155935, 'bull_atr_min_pct': 0.016995880771263138, 'bull_atr_max_pct': 0.1164484431640869, 'bull_tp_mult': 1.7209377418678706, 'bull_tsl_mult': 0.6385908339052075, 'bull_time_stop': 60, 'bull_use_sma': True, 'bull_use_ema': False, 'bull_use_atr': True, 'bull_use_adx': False, 'bull_use_spike': False, 'bull_rsi_required': False, 'bear_strategy': 'mean_reversion', 'bear_bb_std_mult': 1.4514071979736252, 'bear_rsi_os': 37, 'bear_rsi_ob': 50, 'bear_adx_thresh': 6.161838799133253, 'bear_atr_min_pct': 0.02940540611847898, 'bear_atr_max_pct': 0.029062523101849654, 'bear_tp_mult': 1.0880326825358584, 'bear_tsl_mult': 0.4105203710998234, 'bear_time_stop': 138, 'bear_use_sma': True, 'bear_use_ema': False, 'bear_use_atr': True, 'bear_use_adx': True, 'bear_use_spike': False, 'bear_rsi_required': False, 'sideways_strategy': 'mean_reversion', 'sideways_bb_std_mult': 1.4772227418061772, 'sideways_rsi_os': 15, 'sideways_rsi_ob': 50, 'sideways_adx_thresh': 16.3528409561401, 'sideways_atr_min_pct': 0.01582976827233039, 'sideways_atr_max_pct': 0.09596958351392758, 'sideways_tp_mult': 2.89097608929491, 'sideways_tsl_mult': 0.9727066102098, 'sideways_time_stop': 167, 'sideways_use_sma': True, 'sideways_use_ema': True, 'sideways_use_atr': False, 'sideways_use_adx': False, 'sideways_use_spike': False, 'sideways_rsi_required': False}.
