[I 2025-09-01 04:28:05,769] Trial 151 finished with values: [-0.02312357921078423, 0.022976548751706887] and parameters: {'p_sma': 17, 'p_std': 16, 'p_atr': 27, 'p_adx': 20, 'rsi_period': 57, 'ema1': 29, 'ema2': 30, 'slip_atr_k': 0.014782414857869486, 'slip_spread_k': 0.25546306122249685, 'spread_hl_frac': 0.04245842143387393, 'bb_std_mult': 1.165500182661318, 'rsi_os': 45, 'rsi_ob': 72, 'vol_spike': 0.23299811277871738, 'adx_thresh': 11.892946749344292, 'atr_min_pct': 0.0025724145931843856, 'atr_max_pct': 0.12359890404766814, 'tp_mult': 2.2408360098407885, 'tsl_mult': 0.904142735149166, 'strategy': 'breakout', 'time_stop': 272, 'use_sma': True, 'use_atr': True, 'use_adx': False, 'use_ema': True, 'use_spike': False, 'rsi_required': False, 'edge_k': 1.4226336699124773, 'edge_cap': 0.1808188477134352, 'bull_strategy': 'breakout', 'bull_bb_std_mult': 2.1589072979597788, 'bull_rsi_os': 29, 'bull_rsi_ob': 91, 'bull_adx_thresh': 16.97667626113088, 'bull_atr_min_pct': 0.002001170952135295, 'bull_atr_max_pct': 0.12034435835658788, 'bull_tp_mult': 1.5493456241175207, 'bull_tsl_mult': 0.27691147860878734, 'bull_time_stop': 217, 'bull_use_sma': True, 'bull_use_ema': False, 'bull_use_atr': False, 'bull_use_adx': False, 'bull_use_spike': False, 'bull_rsi_required': True, 'bear_strategy': 'mean_reversion', 'bear_bb_std_mult': 1.054773546027529, 'bear_rsi_os': 47, 'bear_rsi_ob': 58, 'bear_adx_thresh': 10.083187731854913, 'bear_atr_min_pct': 0.028070785570067175, 'bear_atr_max_pct': 0.14564826651321225, 'bear_tp_mult': 1.1085948926213016, 'bear_tsl_mult': 0.09173808366842154, 'bear_time_stop': 189, 'bear_use_sma': True, 'bear_use_ema': False, 'bear_use_atr': True, 'bear_use_adx': False, 'bear_use_spike': False, 'bear_rsi_required': False, 'sideways_strategy': 'breakout', 'sideways_bb_std_mult': 1.1779348589669278, 'sideways_rsi_os': 10, 'sideways_rsi_ob': 50, 'sideways_adx_thresh': 18.09771367984695, 'sideways_atr_min_pct': 0.022574685516923574, 'sideways_atr_max_pct': 0.08314764437595763, 'sideways_tp_mult': 2.804246868424631, 'sideways_tsl_mult': 0.9998179291169622, 'sideways_time_stop': 185, 'sideways_use_sma': False, 'sideways_use_ema': True, 'sideways_use_atr': False, 'sideways_use_adx': False, 'sideways_use_spike': True, 'sideways_rsi_required': False}.
[I 2025-09-01 04:28:06,479] Trial 152 finished with values: [-0.02169664236098301, 0.02155025635978782] and parameters: {'p_sma': 17, 'p_std': 16, 'p_atr': 27, 'p_adx': 20, 'rsi_period': 64, 'ema1': 29, 'ema2': 30, 'slip_atr_k': 0.010318078231638717, 'slip_spread_k': 0.2615636652021167, 'spread_hl_frac': 0.04274745893569734, 'bb_std_mult': 1.1665648122694792, 'rsi_os': 36, 'rsi_ob': 59, 'vol_spike': 0.23134447437223238, 'adx_thresh': 12.163011077127642, 'atr_min_pct': 0.0017558897019401623, 'atr_max_pct': 0.12223090696924199, 'tp_mult': 2.565221021491509, 'tsl_mult': 0.9144424008342151, 'strategy': 'breakout', 'time_stop': 272, 'use_sma': True, 'use_atr': True, 'use_adx': False, 'use_ema': True, 'use_spike': True, 'rsi_required': False, 'edge_k': 1.4466489747647309, 'edge_cap': 0.1888637829629145, 'bull_strategy': 'breakout', 'bull_bb_std_mult': 2.145792597689316, 'bull_rsi_os': 28, 'bull_rsi_ob': 86, 'bull_adx_thresh': 18.16243679377632, 'bull_atr_min_pct': 0.0020557556879472767, 'bull_atr_max_pct': 0.12060067737852567, 'bull_tp_mult': 1.5506669534516822, 'bull_tsl_mult': 0.4383054237833099, 'bull_time_stop': 215, 'bull_use_sma': True, 'bull_use_ema': False, 'bull_use_atr': False, 'bull_use_adx': False, 'bull_use_spike': False, 'bull_rsi_required': True, 'bear_strategy': 'mean_reversion', 'bear_bb_std_mult': 0.7224775756807906, 'bear_rsi_os': 47, 'bear_rsi_ob': 58, 'bear_adx_thresh': 14.904110582889853, 'bear_atr_min_pct': 0.029931716512121866, 'bear_atr_max_pct': 0.14500179174072333, 'bear_tp_mult': 1.1152952090429877, 'bear_tsl_mult': 0.08692409813685581, 'bear_time_stop': 184, 'bear_use_sma': True, 'bear_use_ema': False, 'bear_use_atr': True, 'bear_use_adx': True, 'bear_use_spike': False, 'bear_rsi_required': False, 'sideways_strategy': 'breakout', 'sideways_bb_std_mult': 1.169465956602295, 'sideways_rsi_os': 10, 'sideways_rsi_ob': 51, 'sideways_adx_thresh': 18.58926597770105, 'sideways_atr_min_pct': 0.02248791509868052, 'sideways_atr_max_pct': 0.08262423650774244, 'sideways_tp_mult': 2.8030735996570093, 'sideways_tsl_mult': 0.9991328294534747, 'sideways_time_stop': 205, 'sideways_use_sma': False, 'sideways_use_ema': True, 'sideways_use_atr': False, 'sideways_use_adx': False, 'sideways_use_spike': True, 'sideways_rsi_required': False}.
[I 2025-09-01 04:28:57,933] Trial 157 finished with values: [-0.01973164102628233, 0.019607027429688867] and parameters: {'p_sma': 17, 'p_std': 17, 'p_atr': 27, 'p_adx': 21, 'rsi_period': 60, 'ema1': 29, 'ema2': 30, 'slip_atr_k': 0.005773532013961486, 'slip_spread_k': 0.31822095464599864, 'spread_hl_frac': 0.0346264877312851, 'bb_std_mult': 1.067376135739987, 'rsi_os': 31, 'rsi_ob': 58, 'vol_spike': 0.25723731855978543, 'adx_thresh': 8.712677147822962, 'atr_min_pct': 0.002740352518422066, 'atr_max_pct': 0.11295669461993632, 'tp_mult': 2.299328320817119, 'tsl_mult': 0.9440559447839564, 'strategy': 'breakout', 'time_stop': 27, 'use_sma': True, 'use_atr': False, 'use_adx': False, 'use_ema': True, 'use_spike': True, 'rsi_required': False, 'edge_k': 1.2197588060546876, 'edge_cap': 0.2412363879975205, 'bull_strategy': 'mean_reversion', 'bull_bb_std_mult': 2.058503418704941, 'bull_rsi_os': 31, 'bull_rsi_ob': 91, 'bull_adx_thresh': 17.88963690972697, 'bull_atr_min_pct': 0.002164283239834212, 'bull_atr_max_pct': 0.11715443606693943, 'bull_tp_mult': 2.2797723438027377, 'bull_tsl_mult': 0.3444983321640014, 'bull_time_stop': 221, 'bull_use_sma': True, 'bull_use_ema': False, 'bull_use_atr': True, 'bull_use_adx': False, 'bull_use_spike': False, 'bull_rsi_required': False, 'bear_strategy': 'mean_reversion', 'bear_bb_std_mult': 0.635671382968165, 'bear_rsi_os': 47, 'bear_rsi_ob': 60, 'bear_adx_thresh': 11.994340373425267, 'bear_atr_min_pct': 0.029370695931072503, 'bear_atr_max_pct': 0.1435395948795157, 'bear_tp_mult': 2.1337191113398903, 'bear_tsl_mult': 0.11885821113063083, 'bear_time_stop': 209, 'bear_use_sma': True, 'bear_use_ema': False, 'bear_use_atr': True, 'bear_use_adx': True, 'bear_use_spike': False, 'bear_rsi_required': True, 'sideways_strategy': 'mean_reversion', 'sideways_bb_std_mult': 1.62149026744827, 'sideways_rsi_os': 8, 'sideways_rsi_ob': 77, 'sideways_adx_thresh': 18.023288394676225, 'sideways_atr_min_pct': 0.024827938632413307, 'sideways_atr_max_pct': 0.0825012484988303, 'sideways_tp_mult': 2.844177840595152, 'sideways_tsl_mult': 0.20368064897690147, 'sideways_time_stop': 219, 'sideways_use_sma': True, 'sideways_use_ema': False, 'sideways_use_atr': False, 'sideways_use_adx': False, 'sideways_use_spike': False, 'sideways_rsi_required': False}.
[I 2025-09-01 04:28:59,897] Trial 155 finished with values: [-1000000000.0, 1000000000.0] and parameters: {'p_sma': 12, 'p_std': 56, 'p_atr': 27, 'p_adx': 19, 'rsi_period': 61, 'ema1': 30, 'ema2': 32, 'slip_atr_k': 0.015057047219344172, 'slip_spread_k': 0.23156195278733976, 'spread_hl_frac': 0.03513810732724136, 'bb_std_mult': 2.0308116954828677, 'rsi_os': 44, 'rsi_ob': 61, 'vol_spike': 0.2493136402910519, 'adx_thresh': 8.740351896499513, 'atr_min_pct': 0.0025477398798577355, 'atr_max_pct': 0.10295099047783296, 'tp_mult': 2.286041861303588, 'tsl_mult': 0.939975357151871, 'strategy': 'breakout', 'time_stop': 19, 'use_sma': True, 'use_atr': False, 'use_adx': False, 'use_ema': True, 'use_spike': True, 'rsi_required': False, 'edge_k': 1.0841648126151062, 'edge_cap': 0.10076804064394347, 'bull_strategy': 'mean_reversion', 'bull_bb_std_mult': 2.326122317424573, 'bull_rsi_os': 29, 'bull_rsi_ob': 91, 'bull_adx_thresh': 17.00997868391964, 'bull_atr_min_pct': 3.7563659962251304e-06, 'bull_atr_max_pct': 0.12142567613434649, 'bull_tp_mult': 1.066343200362272, 'bull_tsl_mult': 0.3354906762884545, 'bull_time_stop': 184, 'bull_use_sma': True, 'bull_use_ema': False, 'bull_use_atr': True, 'bull_use_adx': False, 'bull_use_spike': False, 'bull_rsi_required': False, 'bear_strategy': 'mean_reversion', 'bear_bb_std_mult': 0.8831395667127605, 'bear_rsi_os': 47, 'bear_rsi_ob': 57, 'bear_adx_thresh': 11.141877702014366, 'bear_atr_min_pct': 0.0299594978537633, 'bear_atr_max_pct': 0.14364264901881146, 'bear_tp_mult': 2.071808629308147, 'bear_tsl_mult': 0.2000609976266584, 'bear_time_stop': 210, 'bear_use_sma': True, 'bear_use_ema': False, 'bear_use_atr': True, 'bear_use_adx': True, 'bear_use_spike': False, 'bear_rsi_required': False, 'sideways_strategy': 'mean_reversion', 'sideways_bb_std_mult': 1.5300678511268968, 'sideways_rsi_os': 5, 'sideways_rsi_ob': 48, 'sideways_adx_thresh': 5.82423731349318, 'sideways_atr_min_pct': 0.024926209310491287, 'sideways_atr_max_pct': 0.08931508019190103, 'sideways_tp_mult': 2.8644083979284134, 'sideways_tsl_mult': 0.9957806614002483, 'sideways_time_stop': 237, 'sideways_use_sma': True, 'sideways_use_ema': True, 'sideways_use_atr': False, 'sideways_use_adx': False, 'sideways_use_spike': False, 'sideways_rsi_required': False}.
[I 2025-09-01 04:29:00,681] Trial 156 finished with values: [-1000000000.0, 1000000000.0] and parameters: {'p_sma': 16, 'p_std': 53, 'p_atr': 27, 'p_adx': 19, 'rsi_period': 61, 'ema1': 30, 'ema2': 31, 'slip_atr_k': 0.005801606774290443, 'slip_spread_k': 0.2268417617650093, 'spread_hl_frac': 0.04868324958121942, 'bb_std_mult': 1.0750035422103308, 'rsi_os': 35, 'rsi_ob': 61, 'vol_spike': 0.24949879252956486, 'adx_thresh': 11.850400662832476, 'atr_min_pct': 0.0025288606296880655, 'atr_max_pct': 0.10359321920663578, 'tp_mult': 2.263014196759393, 'tsl_mult': 0.9309901664485586, 'strategy': 'breakout', 'time_stop': 13, 'use_sma': True, 'use_atr': False, 'use_adx': False, 'use_ema': True, 'use_spike': True, 'rsi_required': False, 'edge_k': 1.0798259922846212, 'edge_cap': 0.23574590681611118, 'bull_strategy': 'mean_reversion', 'bull_bb_std_mult': 2.3279161765732956, 'bull_rsi_os': 35, 'bull_rsi_ob': 91, 'bull_adx_thresh': 17.818457745076262, 'bull_atr_min_pct': 0.0004349119337024465, 'bull_atr_max_pct': 0.12296426956955052, 'bull_tp_mult': 1.0358650963001317, 'bull_tsl_mult': 0.34934827755322095, 'bull_time_stop': 216, 'bull_use_sma': True, 'bull_use_ema': False, 'bull_use_atr': True, 'bull_use_adx': False, 'bull_use_spike': False, 'bull_rsi_required': False, 'bear_strategy': 'mean_reversion', 'bear_bb_std_mult': 0.8794557550117073, 'bear_rsi_os': 47, 'bear_rsi_ob': 57, 'bear_adx_thresh': 11.358292022871284, 'bear_atr_min_pct': 0.029991326531316063, 'bear_atr_max_pct': 0.1428106634378061, 'bear_tp_mult': 1.1231237628082629, 'bear_tsl_mult': 0.1606444645498528, 'bear_time_stop': 208, 'bear_use_sma': True, 'bear_use_ema': False, 'bear_use_atr': True, 'bear_use_adx': True, 'bear_use_spike': False, 'bear_rsi_required': False, 'sideways_strategy': 'mean_reversion', 'sideways_bb_std_mult': 1.496609743777546, 'sideways_rsi_os': 8, 'sideways_rsi_ob': 78, 'sideways_adx_thresh': 10.026191374291432, 'sideways_atr_min_pct': 0.024617870673852973, 'sideways_atr_max_pct': 0.08917757341805446, 'sideways_tp_mult': 2.887761848276788, 'sideways_tsl_mult': 0.9696561525497159, 'sideways_time_stop': 232, 'sideways_use_sma': True, 'sideways_use_ema': True, 'sideways_use_atr': False, 'sideways_use_adx': False, 'sideways_use_spike': False, 'sideways_rsi_required': False}.
[I 2025-09-01 04:29:01,194] Trial 158 finished with values: [-0.018201242279412333, 0.01807222813295894] and parameters: {'p_sma': 16, 'p_std': 18, 'p_atr': 27, 'p_adx': 21, 'rsi_period': 60, 'ema1': 29, 'ema2': 30, 'slip_atr_k': 0.017044122681334383, 'slip_spread_k': 0.35894461143181644, 'spread_hl_frac': 0.044574584499427854, 'bb_std_mult': 1.0608761136105516, 'rsi_os': 29, 'rsi_ob': 57, 'vol_spike': 0.24793573381563422, 'adx_thresh': 13.644762024950115, 'atr_min_pct': 0.002709664834541557, 'atr_max_pct': 0.12284826621553627, 'tp_mult': 2.3476912706008317, 'tsl_mult': 0.9298773674829115, 'strategy': 'breakout', 'time_stop': 13, 'use_sma': True, 'use_atr': False, 'use_adx': False, 'use_ema': True, 'use_spike': True, 'rsi_required': False, 'edge_k': 1.0874896151725908, 'edge_cap': 0.1768753839283301, 'bull_strategy': 'mean_reversion', 'bull_bb_std_mult': 2.329227619897264, 'bull_rsi_os': 31, 'bull_rsi_ob': 91, 'bull_adx_thresh': 19.151700022384187, 'bull_atr_min_pct': 0.002091419182185645, 'bull_atr_max_pct': 0.12090568073467764, 'bull_tp_mult': 2.2694614241397013, 'bull_tsl_mult': 0.43201565599512737, 'bull_time_stop': 217, 'bull_use_sma': True, 'bull_use_ema': False, 'bull_use_atr': True, 'bull_use_adx': False, 'bull_use_spike': False, 'bull_rsi_required': False, 'bear_strategy': 'mean_reversion', 'bear_bb_std_mult': 0.6976783352259512, 'bear_rsi_os': 47, 'bear_rsi_ob': 59, 'bear_adx_thresh': 11.686358890397335, 'bear_atr_min_pct': 0.02996043779068791, 'bear_atr_max_pct': 0.14257948421289998, 'bear_tp_mult': 2.068875658060019, 'bear_tsl_mult': 0.16269444459219626, 'bear_time_stop': 207, 'bear_use_sma': True, 'bear_use_ema': False, 'bear_use_atr': True, 'bear_use_adx': True, 'bear_use_spike': False, 'bear_rsi_required': False, 'sideways_strategy': 'mean_reversion', 'sideways_bb_std_mult': 1.3025694121643836, 'sideways_rsi_os': 5, 'sideways_rsi_ob': 77, 'sideways_adx_thresh': 28.437605528007293, 'sideways_atr_min_pct': 0.024582902215270628, 'sideways_atr_max_pct': 0.0892625380008275, 'sideways_tp_mult': 2.7240009580400253, 'sideways_tsl_mult': 0.9996222650549978, 'sideways_time_stop': 185, 'sideways_use_sma': True, 'sideways_use_ema': True, 'sideways_use_atr': False, 'sideways_use_adx': False, 'sideways_use_spike': False, 'sideways_rsi_required': False}.
[I 2025-09-01 04:29:42,365] Trial 160 finished with values: [-0.0215101938971215, 0.02138375051263488] and parameters: {'p_sma': 17, 'p_std': 17, 'p_atr': 25, 'p_adx': 21, 'rsi_period': 64, 'ema1': 29, 'ema2': 30, 'slip_atr_k': 0.00533295305535566, 'slip_spread_k': 0.3181347024316946, 'spread_hl_frac': 0.04456714236651596, 'bb_std_mult': 1.0257546682818495, 'rsi_os': 7, 'rsi_ob': 58, 'vol_spike': 0.2567687612238798, 'adx_thresh': 11.920529284882788, 'atr_min_pct': 0.001477035258673055, 'atr_max_pct': 0.12378227231549702, 'tp_mult': 2.3439093314341233, 'tsl_mult': 0.9002044981478725, 'strategy': 'breakout', 'time_stop': 14, 'use_sma': True, 'use_atr': False, 'use_adx': False, 'use_ema': True, 'use_spike': True, 'rsi_required': False, 'edge_k': 1.1782270014546, 'edge_cap': 0.4247105000189763, 'bull_strategy': 'mean_reversion', 'bull_bb_std_mult': 2.1877892517177564, 'bull_rsi_os': 28, 'bull_rsi_ob': 88, 'bull_adx_thresh': 17.963157357157503, 'bull_atr_min_pct': 0.002008021287147323, 'bull_atr_max_pct': 0.1181656673363075, 'bull_tp_mult': 2.2832907211801294, 'bull_tsl_mult': 0.4348878037569593, 'bull_time_stop': 215, 'bull_use_sma': True, 'bull_use_ema': False, 'bull_use_atr': False, 'bull_use_adx': False, 'bull_use_spike': False, 'bull_rsi_required': True, 'bear_strategy': 'mean_reversion', 'bear_bb_std_mult': 0.7032332893039572, 'bear_rsi_os': 54, 'bear_rsi_ob': 63, 'bear_adx_thresh': 12.534122838884477, 'bear_atr_min_pct': 0.029168104955331498, 'bear_atr_max_pct': 0.13725387182452775, 'bear_tp_mult': 1.1182678853453023, 'bear_tsl_mult': 0.16556929606608126, 'bear_time_stop': 207, 'bear_use_sma': True, 'bear_use_ema': False, 'bear_use_atr': True, 'bear_use_adx': True, 'bear_use_spike': False, 'bear_rsi_required': False, 'sideways_strategy': 'mean_reversion', 'sideways_bb_std_mult': 1.3201297255188835, 'sideways_rsi_os': 8, 'sideways_rsi_ob': 50, 'sideways_adx_thresh': 28.477326660416836, 'sideways_atr_min_pct': 0.022967765827173046, 'sideways_atr_max_pct': 0.025946210695095985, 'sideways_tp_mult': 2.7264997085075615, 'sideways_tsl_mult': 0.2682579822452764, 'sideways_time_stop': 219, 'sideways_use_sma': True, 'sideways_use_ema': False, 'sideways_use_atr': False, 'sideways_use_adx': False, 'sideways_use_spike': False, 'sideways_rsi_required': False}.
[I 2025-09-01 04:29:42,916] Trial 161 finished with values: [-1000000000.0, 1000000000.0] and parameters: {'p_sma': 17, 'p_std': 18, 'p_atr': 25, 'p_adx': 21, 'rsi_period': 64, 'ema1': 16, 'ema2': 29, 'slip_atr_k': 0.01627546126947993, 'slip_spread_k': 0.36382857933725166, 'spread_hl_frac': 0.04472329962002597, 'bb_std_mult': 2.614863904143081, 'rsi_os': 29, 'rsi_ob': 58, 'vol_spike': 0.2553331871959656, 'adx_thresh': 11.284788354127652, 'atr_min_pct': 0.0014153512149944222, 'atr_max_pct': 0.12408814223889535, 'tp_mult': 2.5652865124257604, 'tsl_mult': 0.0824920133192969, 'strategy': 'mean_reversion', 'time_stop': 43, 'use_sma': True, 'use_atr': False, 'use_adx': False, 'use_ema': True, 'use_spike': True, 'rsi_required': False, 'edge_k': 0.6379055938047588, 'edge_cap': 0.17753233380896064, 'bull_strategy': 'mean_reversion', 'bull_bb_std_mult': 2.1878565539140413, 'bull_rsi_os': 31, 'bull_rsi_ob': 88, 'bull_adx_thresh': 32.315104032280445, 'bull_atr_min_pct': 0.003411280230509307, 'bull_atr_max_pct': 0.11771904141797115, 'bull_tp_mult': 2.309404084251199, 'bull_tsl_mult': 0.41143820245179535, 'bull_time_stop': 220, 'bull_use_sma': True, 'bull_use_ema': True, 'bull_use_atr': False, 'bull_use_adx': False, 'bull_use_spike': False, 'bull_rsi_required': True, 'bear_strategy': 'mean_reversion', 'bear_bb_std_mult': 0.7268029607883886, 'bear_rsi_os': 54, 'bear_rsi_ob': 54, 'bear_adx_thresh': 12.583918595767035, 'bear_atr_min_pct': 0.029230871625288767, 'bear_atr_max_pct': 0.14682838826619446, 'bear_tp_mult': 1.0150884980332582, 'bear_tsl_mult': 0.10559445012003489, 'bear_time_stop': 201, 'bear_use_sma': True, 'bear_use_ema': False, 'bear_use_atr': True, 'bear_use_adx': True, 'bear_use_spike': False, 'bear_rsi_required': True, 'sideways_strategy': 'mean_reversion', 'sideways_bb_std_mult': 1.6053363079781442, 'sideways_rsi_os': 8, 'sideways_rsi_ob': 73, 'sideways_adx_thresh': 24.66686356693748, 'sideways_atr_min_pct': 0.023008073224692827, 'sideways_atr_max_pct': 0.01867999366490925, 'sideways_tp_mult': 2.8284355407013986, 'sideways_tsl_mult': 0.9400135363449331, 'sideways_time_stop': 218, 'sideways_use_sma': True, 'sideways_use_ema': False, 'sideways_use_atr': False, 'sideways_use_adx': False, 'sideways_use_spike': False, 'sideways_rsi_required': False}.
[I 2025-09-01 04:29:43,135] Trial 162 finished with values: [-1000000000.0, 1000000000.0] and parameters: {'p_sma': 18, 'p_std': 16, 'p_atr': 25, 'p_adx': 18, 'rsi_period': 64, 'ema1': 16, 'ema2': 27, 'slip_atr_k': 0.013627152034234728, 'slip_spread_k': 0.3268967178213991, 'spread_hl_frac': 0.044102774176267276, 'bb_std_mult': 2.6938007871187533, 'rsi_os': 46, 'rsi_ob': 58, 'vol_spike': 0.2582928085482101, 'adx_thresh': 5.833219417330184, 'atr_min_pct': 0.001281832158099236, 'atr_max_pct': 0.12335780020288659, 'tp_mult': 2.341289859417612, 'tsl_mult': 0.8998407382236724, 'strategy': 'mean_reversion', 'time_stop': 27, 'use_sma': True, 'use_atr': False, 'use_adx': False, 'use_ema': True, 'use_spike': False, 'rsi_required': False, 'edge_k': 0.18836120657865496, 'edge_cap': 0.17759529062091378, 'bull_strategy': 'mean_reversion', 'bull_bb_std_mult': 2.2075062607071194, 'bull_rsi_os': 31, 'bull_rsi_ob': 88, 'bull_adx_thresh': 19.405652712671184, 'bull_atr_min_pct': 0.0036589709358706484, 'bull_atr_max_pct': 0.11708109425172877, 'bull_tp_mult': 1.6483234474442818, 'bull_tsl_mult': 0.4115124688438654, 'bull_time_stop': 148, 'bull_use_sma': True, 'bull_use_ema': True, 'bull_use_atr': False, 'bull_use_adx': False, 'bull_use_spike': False, 'bull_rsi_required': True, 'bear_strategy': 'mean_reversion', 'bear_bb_std_mult': 0.6962287153743721, 'bear_rsi_os': 55, 'bear_rsi_ob': 63, 'bear_adx_thresh': 12.143942566179621, 'bear_atr_min_pct': 0.029146285241203787, 'bear_atr_max_pct': 0.1473129015351985, 'bear_tp_mult': 1.0115035088716413, 'bear_tsl_mult': 0.12099635437607481, 'bear_time_stop': 199, 'bear_use_sma': True, 'bear_use_ema': False, 'bear_use_atr': True, 'bear_use_adx': True, 'bear_use_spike': False, 'bear_rsi_required': True, 'sideways_strategy': 'mean_reversion', 'sideways_bb_std_mult': 1.3185223159257768, 'sideways_rsi_os': 9, 'sideways_rsi_ob': 75, 'sideways_adx_thresh': 17.95357257868229, 'sideways_atr_min_pct': 0.023097997330663377, 'sideways_atr_max_pct': 0.036635107795431755, 'sideways_tp_mult': 2.831349326860915, 'sideways_tsl_mult': 0.26630434706402234, 'sideways_time_stop': 183, 'sideways_use_sma': True, 'sideways_use_ema': False, 'sideways_use_atr': False, 'sideways_use_adx': False, 'sideways_use_spike': False, 'sideways_rsi_required': False}.
