[I 2025-09-01 05:00:28,049] Trial 342 finished with values: [-1000000000.0, 1000000000.0] and parameters: {'p_sma': 31, 'p_std': 56, 'p_atr': 21, 'p_adx': 20, 'rsi_period': 7, 'ema1': 20, 'ema2': 58, 'slip_atr_k': 0.2440422797329332, 'slip_spread_k': 0.6275363547595891, 'spread_hl_frac': 0.044993015572129015, 'bb_std_mult': 3.4984136363755223, 'rsi_os': 21, 'rsi_ob': 94, 'vol_spike': 0.20464935801189296, 'adx_thresh': 24.707805536993057, 'atr_min_pct': 0.025943619873942836, 'atr_max_pct': 0.015931029311945316, 'tp_mult': 2.8444949427781, 'tsl_mult': 0.2833370554080116, 'strategy': 'breakout', 'time_stop': 283, 'use_sma': False, 'use_atr': False, 'use_adx': False, 'use_ema': False, 'use_spike': True, 'rsi_required': False, 'edge_k': 0.30475428142346583, 'edge_cap': 0.6479673100037547, 'bull_strategy': 'breakout', 'bull_bb_std_mult': 2.2611198060724744, 'bull_rsi_os': 40, 'bull_rsi_ob': 86, 'bull_adx_thresh': 13.297511113121963, 'bull_atr_min_pct': 0.023130149836670978, 'bull_atr_max_pct': 0.1164367897129877, 'bull_tp_mult': 1.5862567564276815, 'bull_tsl_mult': 0.4308476764980097, 'bull_time_stop': 190, 'bull_use_sma': True, 'bull_use_ema': True, 'bull_use_atr': False, 'bull_use_adx': True, 'bull_use_spike': False, 'bull_rsi_required': True, 'bear_strategy': 'breakout', 'bear_bb_std_mult': 0.9004432405667806, 'bear_rsi_os': 26, 'bear_rsi_ob': 65, 'bear_adx_thresh': 28.171981251869436, 'bear_atr_min_pct': 0.0007376574673161503, 'bear_atr_max_pct': 0.06566177217787907, 'bear_tp_mult': 2.0529942182228735, 'bear_tsl_mult': 0.9001007506540072, 'bear_time_stop': 216, 'bear_use_sma': True, 'bear_use_ema': False, 'bear_use_atr': False, 'bear_use_adx': False, 'bear_use_spike': False, 'bear_rsi_required': False, 'sideways_strategy': 'breakout', 'sideways_bb_std_mult': 0.5434338457205827, 'sideways_rsi_os': 37, 'sideways_rsi_ob': 53, 'sideways_adx_thresh': 11.168678074766323, 'sideways_atr_min_pct': 0.023840715034315875, 'sideways_atr_max_pct': 0.10415550258586323, 'sideways_tp_mult': 1.4903736116585442, 'sideways_tsl_mult': 0.9811921194346348, 'sideways_time_stop': 99, 'sideways_use_sma': True, 'sideways_use_ema': False, 'sideways_use_atr': True, 'sideways_use_adx': False, 'sideways_use_spike': True, 'sideways_rsi_required': True}.
[I 2025-09-01 05:00:29,305] Trial 344 finished with values: [-1000000000.0, 1000000000.0] and parameters: {'p_sma': 28, 'p_std': 56, 'p_atr': 28, 'p_adx': 18, 'rsi_period': 7, 'ema1': 20, 'ema2': 30, 'slip_atr_k': 0.008979972624675365, 'slip_spread_k': 0.32222207616167714, 'spread_hl_frac': 0.048578527968108666, 'bb_std_mult': 3.2233296324954965, 'rsi_os': 30, 'rsi_ob': 64, 'vol_spike': 0.1538352865389756, 'adx_thresh': 13.713929688020018, 'atr_min_pct': 0.025955078756504536, 'atr_max_pct': 0.022027785630712532, 'tp_mult': 2.0099602359135798, 'tsl_mult': 0.432011856788543, 'strategy': 'breakout', 'time_stop': 171, 'use_sma': False, 'use_atr': False, 'use_adx': False, 'use_ema': False, 'use_spike': True, 'rsi_required': False, 'edge_k': 0.9519348527880988, 'edge_cap': 0.6546160750101002, 'bull_strategy': 'breakout', 'bull_bb_std_mult': 1.3587566984754509, 'bull_rsi_os': 35, 'bull_rsi_ob': 55, 'bull_adx_thresh': 25.1763299809836, 'bull_atr_min_pct': 0.026045924740788803, 'bull_atr_max_pct': 0.1181454255205257, 'bull_tp_mult': 2.71438758537275, 'bull_tsl_mult': 0.4018706484608351, 'bull_time_stop': 192, 'bull_use_sma': True, 'bull_use_ema': True, 'bull_use_atr': False, 'bull_use_adx': False, 'bull_use_spike': False, 'bull_rsi_required': True, 'bear_strategy': 'mean_reversion', 'bear_bb_std_mult': 0.9188735350591912, 'bear_rsi_os': 20, 'bear_rsi_ob': 65, 'bear_adx_thresh': 29.09140774131839, 'bear_atr_min_pct': 0.028051257346381652, 'bear_atr_max_pct': 0.054239254413854056, 'bear_tp_mult': 2.1946913037646834, 'bear_tsl_mult': 0.5868915335780862, 'bear_time_stop': 14, 'bear_use_sma': True, 'bear_use_ema': False, 'bear_use_atr': False, 'bear_use_adx': False, 'bear_use_spike': False, 'bear_rsi_required': False, 'sideways_strategy': 'breakout', 'sideways_bb_std_mult': 0.8375646721175396, 'sideways_rsi_os': 43, 'sideways_rsi_ob': 75, 'sideways_adx_thresh': 11.547102808972676, 'sideways_atr_min_pct': 0.02466360647948643, 'sideways_atr_max_pct': 0.12251779129201988, 'sideways_tp_mult': 1.7182213941201432, 'sideways_tsl_mult': 0.6061364041875812, 'sideways_time_stop': 91, 'sideways_use_sma': True, 'sideways_use_ema': False, 'sideways_use_atr': False, 'sideways_use_adx': False, 'sideways_use_spike': True, 'sideways_rsi_required': True}.
[I 2025-09-01 05:01:14,730] Trial 343 finished with values: [-1000000000.0, 1000000000.0] and parameters: {'p_sma': 25, 'p_std': 51, 'p_atr': 19, 'p_adx': 30, 'rsi_period': 7, 'ema1': 20, 'ema2': 30, 'slip_atr_k': 0.049961913145462805, 'slip_spread_k': 0.3224260810952696, 'spread_hl_frac': 0.048442399081363566, 'bb_std_mult': 3.254848566024453, 'rsi_os': 21, 'rsi_ob': 94, 'vol_spike': 0.28170398426418297, 'adx_thresh': 14.199370966791093, 'atr_min_pct': 0.023355285298950805, 'atr_max_pct': 0.09752061195300439, 'tp_mult': 1.6606204696560127, 'tsl_mult': 0.9998417477600243, 'strategy': 'breakout', 'time_stop': 251, 'use_sma': False, 'use_atr': False, 'use_adx': False, 'use_ema': False, 'use_spike': True, 'rsi_required': False, 'edge_k': 0.5892463077891681, 'edge_cap': 0.646052106143627, 'bull_strategy': 'breakout', 'bull_bb_std_mult': 0.580423529569253, 'bull_rsi_os': 43, 'bull_rsi_ob': 54, 'bull_adx_thresh': 17.461206946176464, 'bull_atr_min_pct': 0.02384352976517683, 'bull_atr_max_pct': 0.03716325923639906, 'bull_tp_mult': 2.4684761682357235, 'bull_tsl_mult': 0.02611092444020302, 'bull_time_stop': 192, 'bull_use_sma': True, 'bull_use_ema': True, 'bull_use_atr': False, 'bull_use_adx': False, 'bull_use_spike': False, 'bull_rsi_required': True, 'bear_strategy': 'mean_reversion', 'bear_bb_std_mult': 0.6128973070917253, 'bear_rsi_os': 19, 'bear_rsi_ob': 67, 'bear_adx_thresh': 33.53186434618357, 'bear_atr_min_pct': 0.018383128484532895, 'bear_atr_max_pct': 0.054563911314688324, 'bear_tp_mult': 1.9533351713125364, 'bear_tsl_mult': 0.5308221108814732, 'bear_time_stop': 205, 'bear_use_sma': True, 'bear_use_ema': False, 'bear_use_atr': False, 'bear_use_adx': False, 'bear_use_spike': False, 'bear_rsi_required': False, 'sideways_strategy': 'breakout', 'sideways_bb_std_mult': 0.8684418482165719, 'sideways_rsi_os': 51, 'sideways_rsi_ob': 53, 'sideways_adx_thresh': 24.290837348562583, 'sideways_atr_min_pct': 0.005733367853372947, 'sideways_atr_max_pct': 0.13514220754986078, 'sideways_tp_mult': 1.3483838905924408, 'sideways_tsl_mult': 0.5849434936130968, 'sideways_time_stop': 70, 'sideways_use_sma': True, 'sideways_use_ema': False, 'sideways_use_atr': False, 'sideways_use_adx': False, 'sideways_use_spike': True, 'sideways_rsi_required': True}.
[I 2025-09-01 05:01:15,235] Trial 346 finished with values: [-1000000000.0, 1000000000.0] and parameters: {'p_sma': 26, 'p_std': 51, 'p_atr': 28, 'p_adx': 18, 'rsi_period': 14, 'ema1': 24, 'ema2': 37, 'slip_atr_k': 0.010069068910888096, 'slip_spread_k': 0.31407096521650124, 'spread_hl_frac': 0.04870363563978675, 'bb_std_mult': 3.5089002226656123, 'rsi_os': 27, 'rsi_ob': 81, 'vol_spike': 0.15114892363788474, 'adx_thresh': 5.09643472329541, 'atr_min_pct': 0.027303971426129097, 'atr_max_pct': 0.07764335380906792, 'tp_mult': 2.50557403776179, 'tsl_mult': 0.7473448846058894, 'strategy': 'mean_reversion', 'time_stop': 261, 'use_sma': False, 'use_atr': False, 'use_adx': False, 'use_ema': False, 'use_spike': True, 'rsi_required': False, 'edge_k': 0.9618169608488616, 'edge_cap': 0.543406023932023, 'bull_strategy': 'breakout', 'bull_bb_std_mult': 0.5771960325448848, 'bull_rsi_os': 44, 'bull_rsi_ob': 91, 'bull_adx_thresh': 30.024707288512154, 'bull_atr_min_pct': 0.026044515676472483, 'bull_atr_max_pct': 0.12111677798932982, 'bull_tp_mult': 1.5032021851187243, 'bull_tsl_mult': 0.8207872233693922, 'bull_time_stop': 180, 'bull_use_sma': True, 'bull_use_ema': True, 'bull_use_atr': False, 'bull_use_adx': False, 'bull_use_spike': True, 'bull_rsi_required': True, 'bear_strategy': 'mean_reversion', 'bear_bb_std_mult': 0.5987271440973687, 'bear_rsi_os': 16, 'bear_rsi_ob': 67, 'bear_adx_thresh': 28.851376295072505, 'bear_atr_min_pct': 0.01860173242690707, 'bear_atr_max_pct': 0.05971976739265931, 'bear_tp_mult': 1.9547221563622503, 'bear_tsl_mult': 0.5342472048498412, 'bear_time_stop': 138, 'bear_use_sma': True, 'bear_use_ema': True, 'bear_use_atr': False, 'bear_use_adx': False, 'bear_use_spike': True, 'bear_rsi_required': True, 'sideways_strategy': 'breakout', 'sideways_bb_std_mult': 0.8672733757160301, 'sideways_rsi_os': 48, 'sideways_rsi_ob': 75, 'sideways_adx_thresh': 17.940373377125272, 'sideways_atr_min_pct': 0.02501340328825627, 'sideways_atr_max_pct': 0.13400494148011347, 'sideways_tp_mult': 1.0773883008339187, 'sideways_tsl_mult': 0.9996627830062413, 'sideways_time_stop': 242, 'sideways_use_sma': False, 'sideways_use_ema': False, 'sideways_use_atr': False, 'sideways_use_adx': False, 'sideways_use_spike': True, 'sideways_rsi_required': True}.
[I 2025-09-01 05:01:15,779] Trial 345 finished with values: [-1000000000.0, 1000000000.0] and parameters: {'p_sma': 28, 'p_std': 51, 'p_atr': 28, 'p_adx': 20, 'rsi_period': 7, 'ema1': 25, 'ema2': 29, 'slip_atr_k': 0.00881569009576625, 'slip_spread_k': 0.3253586761603726, 'spread_hl_frac': 0.048300753846138966, 'bb_std_mult': 3.2489386633657573, 'rsi_os': 23, 'rsi_ob': 89, 'vol_spike': 0.2111650915249686, 'adx_thresh': 5.392901425255719, 'atr_min_pct': 0.027692105029833894, 'atr_max_pct': 0.1152622730248995, 'tp_mult': 1.5001403666879125, 'tsl_mult': 0.9779359677529698, 'strategy': 'breakout', 'time_stop': 199, 'use_sma': False, 'use_atr': False, 'use_adx': False, 'use_ema': False, 'use_spike': True, 'rsi_required': False, 'edge_k': 0.612676441064355, 'edge_cap': 0.5475272446696698, 'bull_strategy': 'breakout', 'bull_bb_std_mult': 2.3072943573072706, 'bull_rsi_os': 33, 'bull_rsi_ob': 54, 'bull_adx_thresh': 17.272254891058502, 'bull_atr_min_pct': 0.023010991174370332, 'bull_atr_max_pct': 0.1209960050960389, 'bull_tp_mult': 2.41771153860508, 'bull_tsl_mult': 0.2155295880654975, 'bull_time_stop': 182, 'bull_use_sma': True, 'bull_use_ema': True, 'bull_use_atr': False, 'bull_use_adx': True, 'bull_use_spike': False, 'bull_rsi_required': True, 'bear_strategy': 'breakout', 'bear_bb_std_mult': 0.5539340656864018, 'bear_rsi_os': 36, 'bear_rsi_ob': 65, 'bear_adx_thresh': 29.014275678638178, 'bear_atr_min_pct': 0.02127675857415163, 'bear_atr_max_pct': 0.05978481211128284, 'bear_tp_mult': 1.9629754198879672, 'bear_tsl_mult': 0.5376482193408747, 'bear_time_stop': 246, 'bear_use_sma': True, 'bear_use_ema': False, 'bear_use_atr': False, 'bear_use_adx': False, 'bear_use_spike': False, 'bear_rsi_required': False, 'sideways_strategy': 'breakout', 'sideways_bb_std_mult': 0.8771611497328305, 'sideways_rsi_os': 43, 'sideways_rsi_ob': 72, 'sideways_adx_thresh': 5.52005809460567, 'sideways_atr_min_pct': 0.0058733417790095, 'sideways_atr_max_pct': 0.13342889146642214, 'sideways_tp_mult': 1.509061386023243, 'sideways_tsl_mult': 0.5794056747709484, 'sideways_time_stop': 5, 'sideways_use_sma': True, 'sideways_use_ema': False, 'sideways_use_atr': True, 'sideways_use_adx': False, 'sideways_use_spike': True, 'sideways_rsi_required': True}.
[I 2025-09-01 05:01:16,635] Trial 347 finished with values: [-1000000000.0, 1000000000.0] and parameters: {'p_sma': 25, 'p_std': 51, 'p_atr': 19, 'p_adx': 20, 'rsi_period': 14, 'ema1': 29, 'ema2': 38, 'slip_atr_k': 0.00802287423224263, 'slip_spread_k': 0.4291488835638824, 'spread_hl_frac': 0.04774448501615475, 'bb_std_mult': 3.508977904060762, 'rsi_os': 25, 'rsi_ob': 89, 'vol_spike': 0.18052243472859192, 'adx_thresh': 5.458137883934173, 'atr_min_pct': 0.02363703985676207, 'atr_max_pct': 0.0774439354850218, 'tp_mult': 2.51413092323481, 'tsl_mult': 0.9784427550796186, 'strategy': 'mean_reversion', 'time_stop': 41, 'use_sma': False, 'use_atr': False, 'use_adx': True, 'use_ema': True, 'use_spike': False, 'rsi_required': True, 'edge_k': 0.6116650273193296, 'edge_cap': 0.5596979144415001, 'bull_strategy': 'breakout', 'bull_bb_std_mult': 1.643955803189555, 'bull_rsi_os': 23, 'bull_rsi_ob': 91, 'bull_adx_thresh': 9.876426297744564, 'bull_atr_min_pct': 0.02415361995659617, 'bull_atr_max_pct': 0.03714470932400451, 'bull_tp_mult': 2.43242190380404, 'bull_tsl_mult': 0.4024577384980691, 'bull_time_stop': 266, 'bull_use_sma': False, 'bull_use_ema': False, 'bull_use_atr': False, 'bull_use_adx': False, 'bull_use_spike': True, 'bull_rsi_required': True, 'bear_strategy': 'mean_reversion', 'bear_bb_std_mult': 0.6897122248683634, 'bear_rsi_os': 13, 'bear_rsi_ob': 63, 'bear_adx_thresh': 33.3981217281334, 'bear_atr_min_pct': 0.01882465034379609, 'bear_atr_max_pct': 0.06060250112236102, 'bear_tp_mult': 1.2615540314432996, 'bear_tsl_mult': 0.6062465839997923, 'bear_time_stop': 134, 'bear_use_sma': False, 'bear_use_ema': True, 'bear_use_atr': False, 'bear_use_adx': False, 'bear_use_spike': True, 'bear_rsi_required': True, 'sideways_strategy': 'breakout', 'sideways_bb_std_mult': 0.716535008824043, 'sideways_rsi_os': 22, 'sideways_rsi_ob': 70, 'sideways_adx_thresh': 24.2356236266003, 'sideways_atr_min_pct': 0.022988043594495824, 'sideways_atr_max_pct': 0.13402703617776848, 'sideways_tp_mult': 1.3459937562007602, 'sideways_tsl_mult': 0.40018410660519166, 'sideways_time_stop': 175, 'sideways_use_sma': False, 'sideways_use_ema': True, 'sideways_use_atr': False, 'sideways_use_adx': True, 'sideways_use_spike': True, 'sideways_rsi_required': False}.
[I 2025-09-01 05:02:00,886] Trial 351 finished with values: [-1000000000.0, 1000000000.0] and parameters: {'p_sma': 27, 'p_std': 59, 'p_atr': 29, 'p_adx': 17, 'rsi_period': 10, 'ema1': 22, 'ema2': 28, 'slip_atr_k': 0.13645120013988574, 'slip_spread_k': 0.5023443431211831, 'spread_hl_frac': 0.04692700272538489, 'bb_std_mult': 3.5977977783408033, 'rsi_os': 25, 'rsi_ob': 80, 'vol_spike': 0.29924464813660034, 'adx_thresh': 11.781275411742767, 'atr_min_pct': 0.02699762505688673, 'atr_max_pct': 0.11603994948892415, 'tp_mult': 2.590670179373036, 'tsl_mult': 0.11677305666176496, 'strategy': 'breakout', 'time_stop': 32, 'use_sma': False, 'use_atr': True, 'use_adx': True, 'use_ema': True, 'use_spike': False, 'rsi_required': True, 'edge_k': 1.2837945077405017, 'edge_cap': 0.6109774290341858, 'bull_strategy': 'breakout', 'bull_bb_std_mult': 2.386174525140912, 'bull_rsi_os': 14, 'bull_rsi_ob': 88, 'bull_adx_thresh': 6.967046425902231, 'bull_atr_min_pct': 0.015844522575376656, 'bull_atr_max_pct': 0.11814998243862103, 'bull_tp_mult': 1.3813744327031103, 'bull_tsl_mult': 0.97628430874185, 'bull_time_stop': 142, 'bull_use_sma': False, 'bull_use_ema': False, 'bull_use_atr': False, 'bull_use_adx': False, 'bull_use_spike': False, 'bull_rsi_required': True, 'bear_strategy': 'mean_reversion', 'bear_bb_std_mult': 2.2103647495289227, 'bear_rsi_os': 12, 'bear_rsi_ob': 63, 'bear_adx_thresh': 26.71537274441968, 'bear_atr_min_pct': 0.017062502481852097, 'bear_atr_max_pct': 0.06415018411552922, 'bear_tp_mult': 1.6556073559777214, 'bear_tsl_mult': 0.6407404328246084, 'bear_time_stop': 117, 'bear_use_sma': False, 'bear_use_ema': False, 'bear_use_atr': False, 'bear_use_adx': False, 'bear_use_spike': False, 'bear_rsi_required': False, 'sideways_strategy': 'breakout', 'sideways_bb_std_mult': 0.7616400357888526, 'sideways_rsi_os': 28, 'sideways_rsi_ob': 55, 'sideways_adx_thresh': 19.733328661375648, 'sideways_atr_min_pct': 0.014262560606796648, 'sideways_atr_max_pct': 0.10700572080882319, 'sideways_tp_mult': 2.0212237466511525, 'sideways_tsl_mult': 0.799589401158979, 'sideways_time_stop': 177, 'sideways_use_sma': True, 'sideways_use_ema': True, 'sideways_use_atr': False, 'sideways_use_adx': True, 'sideways_use_spike': True, 'sideways_rsi_required': False}.
[I 2025-09-01 05:02:01,764] Trial 349 finished with values: [-1000000000.0, 1000000000.0] and parameters: {'p_sma': 28, 'p_std': 59, 'p_atr': 29, 'p_adx': 15, 'rsi_period': 13, 'ema1': 22, 'ema2': 28, 'slip_atr_k': 0.13474356782365718, 'slip_spread_k': 0.5092240395684298, 'spread_hl_frac': 0.047250361866374886, 'bb_std_mult': 3.599379265875742, 'rsi_os': 23, 'rsi_ob': 89, 'vol_spike': 0.22438737004728707, 'adx_thresh': 14.999275511924505, 'atr_min_pct': 0.024834117364856433, 'atr_max_pct': 0.03876074494123934, 'tp_mult': 2.586088371314671, 'tsl_mult': 0.9773417533612195, 'strategy': 'breakout', 'time_stop': 41, 'use_sma': False, 'use_atr': False, 'use_adx': True, 'use_ema': True, 'use_spike': False, 'rsi_required': True, 'edge_k': 1.6460304018415273, 'edge_cap': 0.6140609079063397, 'bull_strategy': 'breakout', 'bull_bb_std_mult': 2.8373029998287267, 'bull_rsi_os': 23, 'bull_rsi_ob': 88, 'bull_adx_thresh': 26.516779442973135, 'bull_atr_min_pct': 0.015670093754914353, 'bull_atr_max_pct': 0.12003597558012724, 'bull_tp_mult': 2.3635764661165517, 'bull_tsl_mult': 0.7235008378916566, 'bull_time_stop': 141, 'bull_use_sma': False, 'bull_use_ema': False, 'bull_use_atr': False, 'bull_use_adx': True, 'bull_use_spike': False, 'bull_rsi_required': True, 'bear_strategy': 'breakout', 'bear_bb_std_mult': 0.720357106626265, 'bear_rsi_os': 36, 'bear_rsi_ob': 63, 'bear_adx_thresh': 26.926389424875573, 'bear_atr_min_pct': 0.02125383190913698, 'bear_atr_max_pct': 0.060607137874810764, 'bear_tp_mult': 2.316179908728988, 'bear_tsl_mult': 0.7963440725421234, 'bear_time_stop': 114, 'bear_use_sma': False, 'bear_use_ema': False, 'bear_use_atr': False, 'bear_use_adx': False, 'bear_use_spike': False, 'bear_rsi_required': True, 'sideways_strategy': 'breakout', 'sideways_bb_std_mult': 0.7143481157094166, 'sideways_rsi_os': 26, 'sideways_rsi_ob': 81, 'sideways_adx_thresh': 19.56714278677407, 'sideways_atr_min_pct': 0.022968564947956568, 'sideways_atr_max_pct': 0.10831372967380075, 'sideways_tp_mult': 1.7938236355594503, 'sideways_tsl_mult': 0.39252394325686046, 'sideways_time_stop': 174, 'sideways_use_sma': True, 'sideways_use_ema': True, 'sideways_use_atr': True, 'sideways_use_adx': True, 'sideways_use_spike': True, 'sideways_rsi_required': False}.
[I 2025-09-01 05:02:02,232] Trial 350 finished with values: [-1000000000.0, 1000000000.0] and parameters: {'p_sma': 27, 'p_std': 59, 'p_atr': 14, 'p_adx': 19, 'rsi_period': 21, 'ema1': 22, 'ema2': 18, 'slip_atr_k': 0.020974703167773397, 'slip_spread_k': 0.7898129136317869, 'spread_hl_frac': 0.04718895200565882, 'bb_std_mult': 3.4065187859777564, 'rsi_os': 24, 'rsi_ob': 93, 'vol_spike': 0.272535071505536, 'adx_thresh': 20.25149555087148, 'atr_min_pct': 0.024841808099754593, 'atr_max_pct': 0.11643986197152342, 'tp_mult': 1.2566768278361025, 'tsl_mult': 0.9505033442524129, 'strategy': 'mean_reversion', 'time_stop': 40, 'use_sma': False, 'use_atr': False, 'use_adx': True, 'use_ema': True, 'use_spike': False, 'rsi_required': True, 'edge_k': 0.4739024650775706, 'edge_cap': 0.6059114708964936, 'bull_strategy': 'breakout', 'bull_bb_std_mult': 1.6734362679289987, 'bull_rsi_os': 7, 'bull_rsi_ob': 92, 'bull_adx_thresh': 26.590614808803334, 'bull_atr_min_pct': 0.002230815069981025, 'bull_atr_max_pct': 0.10673345717130639, 'bull_tp_mult': 2.306436124611352, 'bull_tsl_mult': 0.7297460798686972, 'bull_time_stop': 264, 'bull_use_sma': False, 'bull_use_ema': False, 'bull_use_atr': False, 'bull_use_adx': False, 'bull_use_spike': True, 'bull_rsi_required': True, 'bear_strategy': 'mean_reversion', 'bear_bb_std_mult': 0.6989505694894385, 'bear_rsi_os': 7, 'bear_rsi_ob': 63, 'bear_adx_thresh': 30.479877349365225, 'bear_atr_min_pct': 0.01622185320126629, 'bear_atr_max_pct': 0.0638288826277234, 'bear_tp_mult': 2.318111247310554, 'bear_tsl_mult': 0.8022739903357206, 'bear_time_stop': 211, 'bear_use_sma': False, 'bear_use_ema': True, 'bear_use_atr': False, 'bear_use_adx': False, 'bear_use_spike': True, 'bear_rsi_required': True, 'sideways_strategy': 'breakout', 'sideways_bb_std_mult': 0.7498544245801803, 'sideways_rsi_os': 28, 'sideways_rsi_ob': 78, 'sideways_adx_thresh': 32.666273234500935, 'sideways_atr_min_pct': 0.022858810203702777, 'sideways_atr_max_pct': 0.1443821010520795, 'sideways_tp_mult': 1.013717541780583, 'sideways_tsl_mult': 0.33781655556864976, 'sideways_time_stop': 175, 'sideways_use_sma': False, 'sideways_use_ema': True, 'sideways_use_atr': False, 'sideways_use_adx': True, 'sideways_use_spike': True, 'sideways_rsi_required': False}.
