[I 2025-09-01 05:15:34,478] Trial 421 finished with values: [-0.022600031611223703, 0.022458975477040795] and parameters: {'p_sma': 36, 'p_std': 54, 'p_atr': 28, 'p_adx': 20, 'rsi_period': 10, 'ema1': 17, 'ema2': 46, 'slip_atr_k': 0.016887759169137727, 'slip_spread_k': 0.758561268205783, 'spread_hl_frac': 0.044446055319814284, 'bb_std_mult': 3.3578351557348105, 'rsi_os': 37, 'rsi_ob': 85, 'vol_spike': 0.21438520138808415, 'adx_thresh': 15.91836290257815, 'atr_min_pct': 0.006454455325686713, 'atr_max_pct': 0.11623113342665162, 'tp_mult': 1.9643751167112566, 'tsl_mult': 0.4334746619255137, 'strategy': 'mean_reversion', 'time_stop': 39, 'use_sma': False, 'use_atr': False, 'use_adx': False, 'use_ema': False, 'use_spike': True, 'rsi_required': False, 'edge_k': 1.9337513087371228, 'edge_cap': 0.47639939708068, 'bull_strategy': 'breakout', 'bull_bb_std_mult': 0.6551006040168685, 'bull_rsi_os': 21, 'bull_rsi_ob': 85, 'bull_adx_thresh': 13.680061088098107, 'bull_atr_min_pct': 0.0004041511315811786, 'bull_atr_max_pct': 0.03365728890203104, 'bull_tp_mult': 2.331418141806386, 'bull_tsl_mult': 0.38526071694199165, 'bull_time_stop': 248, 'bull_use_sma': True, 'bull_use_ema': False, 'bull_use_atr': False, 'bull_use_adx': False, 'bull_use_spike': False, 'bull_rsi_required': True, 'bear_strategy': 'mean_reversion', 'bear_bb_std_mult': 0.6353537231267951, 'bear_rsi_os': 8, 'bear_rsi_ob': 66, 'bear_adx_thresh': 28.101113871520212, 'bear_atr_min_pct': 0.010191757838674605, 'bear_atr_max_pct': 0.06413365086159835, 'bear_tp_mult': 1.4062898524624465, 'bear_tsl_mult': 0.6345496708947285, 'bear_time_stop': 208, 'bear_use_sma': True, 'bear_use_ema': True, 'bear_use_atr': False, 'bear_use_adx': False, 'bear_use_spike': False, 'bear_rsi_required': False, 'sideways_strategy': 'breakout', 'sideways_bb_std_mult': 0.5529966959671746, 'sideways_rsi_os': 38, 'sideways_rsi_ob': 54, 'sideways_adx_thresh': 15.538848246858567, 'sideways_atr_min_pct': 0.018420072140639565, 'sideways_atr_max_pct': 0.1167338809161287, 'sideways_tp_mult': 2.4061058847610597, 'sideways_tsl_mult': 0.6714948744935754, 'sideways_time_stop': 210, 'sideways_use_sma': False, 'sideways_use_ema': True, 'sideways_use_atr': False, 'sideways_use_adx': False, 'sideways_use_spike': True, 'sideways_rsi_required': True}.
[I 2025-09-01 05:15:35,033] Trial 424 finished with values: [-0.04069090555016297, 0.04059069718750297] and parameters: {'p_sma': 25, 'p_std': 5, 'p_atr': 21, 'p_adx': 20, 'rsi_period': 12, 'ema1': 27, 'ema2': 55, 'slip_atr_k': 0.07744016076292198, 'slip_spread_k': 0.2579728453233616, 'spread_hl_frac': 0.021094382820975748, 'bb_std_mult': 2.2738964405549558, 'rsi_os': 24, 'rsi_ob': 85, 'vol_spike': 0.22734103727002086, 'adx_thresh': 30.420676415004948, 'atr_min_pct': 0.0064020223897956925, 'atr_max_pct': 0.11357669739812465, 'tp_mult': 1.9563354758492058, 'tsl_mult': 0.9664126977852362, 'strategy': 'breakout', 'time_stop': 36, 'use_sma': False, 'use_atr': False, 'use_adx': False, 'use_ema': False, 'use_spike': False, 'rsi_required': False, 'edge_k': 0.666117491951185, 'edge_cap': 0.48235315566076725, 'bull_strategy': 'breakout', 'bull_bb_std_mult': 0.6318584169485633, 'bull_rsi_os': 26, 'bull_rsi_ob': 95, 'bull_adx_thresh': 32.83783340785244, 'bull_atr_min_pct': 1.641198954111748e-05, 'bull_atr_max_pct': 0.1008439577449875, 'bull_tp_mult': 2.3354178746324377, 'bull_tsl_mult': 0.426087984907204, 'bull_time_stop': 73, 'bull_use_sma': True, 'bull_use_ema': False, 'bull_use_atr': False, 'bull_use_adx': False, 'bull_use_spike': True, 'bull_rsi_required': True, 'bear_strategy': 'mean_reversion', 'bear_bb_std_mult': 0.8163996948382689, 'bear_rsi_os': 9, 'bear_rsi_ob': 49, 'bear_adx_thresh': 28.069072644064107, 'bear_atr_min_pct': 0.028634881763507095, 'bear_atr_max_pct': 0.06365318809730645, 'bear_tp_mult': 1.3481666779692063, 'bear_tsl_mult': 0.9321137974936402, 'bear_time_stop': 215, 'bear_use_sma': True, 'bear_use_ema': False, 'bear_use_atr': False, 'bear_use_adx': False, 'bear_use_spike': True, 'bear_rsi_required': False, 'sideways_strategy': 'breakout', 'sideways_bb_std_mult': 0.5798246481788365, 'sideways_rsi_os': 38, 'sideways_rsi_ob': 57, 'sideways_adx_thresh': 15.566738668952048, 'sideways_atr_min_pct': 0.022729371267703018, 'sideways_atr_max_pct': 0.11630780962639414, 'sideways_tp_mult': 1.6589403528768563, 'sideways_tsl_mult': 0.3192470133512417, 'sideways_time_stop': 158, 'sideways_use_sma': True, 'sideways_use_ema': True, 'sideways_use_atr': False, 'sideways_use_adx': False, 'sideways_use_spike': True, 'sideways_rsi_required': False}.
[I 2025-09-01 05:16:13,204] Trial 428 finished with values: [-1000000000.0, 1000000000.0] and parameters: {'p_sma': 38, 'p_std': 57, 'p_atr': 14, 'p_adx': 25, 'rsi_period': 50, 'ema1': 28, 'ema2': 37, 'slip_atr_k': 0.008612750845013034, 'slip_spread_k': 0.11844199448117726, 'spread_hl_frac': 0.016872415094273507, 'bb_std_mult': 2.962854042984241, 'rsi_os': 23, 'rsi_ob': 87, 'vol_spike': 0.22304378606397884, 'adx_thresh': 15.024260505854826, 'atr_min_pct': 0.02456309511054559, 'atr_max_pct': 0.11286368224899825, 'tp_mult': 2.870370479796748, 'tsl_mult': 0.041580512157017024, 'strategy': 'breakout', 'time_stop': 288, 'use_sma': False, 'use_atr': True, 'use_adx': False, 'use_ema': True, 'use_spike': False, 'rsi_required': False, 'edge_k': 1.3852597553758383, 'edge_cap': 0.5525591405478754, 'bull_strategy': 'breakout', 'bull_bb_std_mult': 1.2128007923149156, 'bull_rsi_os': 26, 'bull_rsi_ob': 83, 'bull_adx_thresh': 17.435376681518925, 'bull_atr_min_pct': 0.004069479725795963, 'bull_atr_max_pct': 0.025671475922520767, 'bull_tp_mult': 1.6010634616517014, 'bull_tsl_mult': 0.677149920627488, 'bull_time_stop': 237, 'bull_use_sma': True, 'bull_use_ema': False, 'bull_use_atr': False, 'bull_use_adx': False, 'bull_use_spike': True, 'bull_rsi_required': True, 'bear_strategy': 'mean_reversion', 'bear_bb_std_mult': 1.867847409718875, 'bear_rsi_os': 9, 'bear_rsi_ob': 61, 'bear_adx_thresh': 28.9316118727848, 'bear_atr_min_pct': 0.008219759388892165, 'bear_atr_max_pct': 0.08086663142565184, 'bear_tp_mult': 1.2802505096222214, 'bear_tsl_mult': 0.6128803373470288, 'bear_time_stop': 300, 'bear_use_sma': False, 'bear_use_ema': False, 'bear_use_atr': False, 'bear_use_adx': False, 'bear_use_spike': True, 'bear_rsi_required': True, 'sideways_strategy': 'breakout', 'sideways_bb_std_mult': 3.5245314628596214, 'sideways_rsi_os': 39, 'sideways_rsi_ob': 57, 'sideways_adx_thresh': 21.09287504964798, 'sideways_atr_min_pct': 0.017092727844643715, 'sideways_atr_max_pct': 0.10649316144670687, 'sideways_tp_mult': 1.2893756591363914, 'sideways_tsl_mult': 0.5370331850332286, 'sideways_time_stop': 169, 'sideways_use_sma': True, 'sideways_use_ema': False, 'sideways_use_atr': False, 'sideways_use_adx': False, 'sideways_use_spike': True, 'sideways_rsi_required': False}.
[I 2025-09-01 05:16:13,613] Trial 427 finished with values: [-1000000000.0, 1000000000.0] and parameters: {'p_sma': 25, 'p_std': 6, 'p_atr': 14, 'p_adx': 19, 'rsi_period': 12, 'ema1': 28, 'ema2': 28, 'slip_atr_k': 0.00464926864722921, 'slip_spread_k': 0.04179088693722993, 'spread_hl_frac': 0.018326300351071155, 'bb_std_mult': 2.9077274065487737, 'rsi_os': 24, 'rsi_ob': 47, 'vol_spike': 0.2239924409064875, 'adx_thresh': 15.024567038118834, 'atr_min_pct': 0.024456119065611886, 'atr_max_pct': 0.113223779574678, 'tp_mult': 2.5631118857812223, 'tsl_mult': 0.12693926255190013, 'strategy': 'breakout', 'time_stop': 31, 'use_sma': False, 'use_atr': True, 'use_adx': False, 'use_ema': True, 'use_spike': False, 'rsi_required': False, 'edge_k': 0.5793347429156458, 'edge_cap': 0.5122704944831685, 'bull_strategy': 'breakout', 'bull_bb_std_mult': 1.208437674779943, 'bull_rsi_os': 26, 'bull_rsi_ob': 83, 'bull_adx_thresh': 17.435724762566036, 'bull_atr_min_pct': 0.004373078587851626, 'bull_atr_max_pct': 0.02453525576972928, 'bull_tp_mult': 2.959580854007699, 'bull_tsl_mult': 0.44565508380902547, 'bull_time_stop': 72, 'bull_use_sma': True, 'bull_use_ema': False, 'bull_use_atr': False, 'bull_use_adx': False, 'bull_use_spike': True, 'bull_rsi_required': True, 'bear_strategy': 'mean_reversion', 'bear_bb_std_mult': 0.8025744393739896, 'bear_rsi_os': 9, 'bear_rsi_ob': 95, 'bear_adx_thresh': 17.545222329320712, 'bear_atr_min_pct': 0.01786029061252121, 'bear_atr_max_pct': 0.0628278955569133, 'bear_tp_mult': 1.3347130842254973, 'bear_tsl_mult': 0.9293533997101744, 'bear_time_stop': 229, 'bear_use_sma': True, 'bear_use_ema': False, 'bear_use_atr': False, 'bear_use_adx': False, 'bear_use_spike': True, 'bear_rsi_required': True, 'sideways_strategy': 'breakout', 'sideways_bb_std_mult': 0.6693556566746589, 'sideways_rsi_os': 39, 'sideways_rsi_ob': 93, 'sideways_adx_thresh': 19.91735391852354, 'sideways_atr_min_pct': 0.023119191776287067, 'sideways_atr_max_pct': 0.10425195128022524, 'sideways_tp_mult': 1.2973998948659382, 'sideways_tsl_mult': 0.8701701453177721, 'sideways_time_stop': 279, 'sideways_use_sma': True, 'sideways_use_ema': False, 'sideways_use_atr': False, 'sideways_use_adx': False, 'sideways_use_spike': True, 'sideways_rsi_required': False}.
[I 2025-09-01 05:16:14,174] Trial 425 finished with values: [-0.015354234020700686, 0.015207552821059907] and parameters: {'p_sma': 22, 'p_std': 57, 'p_atr': 29, 'p_adx': 20, 'rsi_period': 12, 'ema1': 28, 'ema2': 19, 'slip_atr_k': 0.008649193702946752, 'slip_spread_k': 0.314234162605215, 'spread_hl_frac': 0.032599784114862855, 'bb_std_mult': 2.876233981036494, 'rsi_os': 24, 'rsi_ob': 85, 'vol_spike': 0.22302513209469405, 'adx_thresh': 15.052076497599648, 'atr_min_pct': 0.023615035226916416, 'atr_max_pct': 0.11353936718966329, 'tp_mult': 1.7148228062159396, 'tsl_mult': 0.9794669076146566, 'strategy': 'breakout', 'time_stop': 288, 'use_sma': False, 'use_atr': False, 'use_adx': False, 'use_ema': True, 'use_spike': False, 'rsi_required': False, 'edge_k': 1.5434185195224328, 'edge_cap': 0.46907023859193603, 'bull_strategy': 'breakout', 'bull_bb_std_mult': 2.3126145256734545, 'bull_rsi_os': 26, 'bull_rsi_ob': 95, 'bull_adx_thresh': 17.305016959818833, 'bull_atr_min_pct': 0.00034904252440320547, 'bull_atr_max_pct': 0.11656316950724144, 'bull_tp_mult': 1.822970476918526, 'bull_tsl_mult': 0.6711690461583356, 'bull_time_stop': 126, 'bull_use_sma': True, 'bull_use_ema': False, 'bull_use_atr': False, 'bull_use_adx': False, 'bull_use_spike': True, 'bull_rsi_required': True, 'bear_strategy': 'mean_reversion', 'bear_bb_std_mult': 2.42741678625584, 'bear_rsi_os': 9, 'bear_rsi_ob': 49, 'bear_adx_thresh': 29.15640510689366, 'bear_atr_min_pct': 0.024755638750298948, 'bear_atr_max_pct': 0.06515319804815566, 'bear_tp_mult': 1.401662329259269, 'bear_tsl_mult': 0.598812379090454, 'bear_time_stop': 216, 'bear_use_sma': True, 'bear_use_ema': False, 'bear_use_atr': False, 'bear_use_adx': False, 'bear_use_spike': True, 'bear_rsi_required': False, 'sideways_strategy': 'breakout', 'sideways_bb_std_mult': 0.8225444700353101, 'sideways_rsi_os': 13, 'sideways_rsi_ob': 57, 'sideways_adx_thresh': 32.0566261862045, 'sideways_atr_min_pct': 0.023196852153364627, 'sideways_atr_max_pct': 0.10640220374865995, 'sideways_tp_mult': 1.2938036318965507, 'sideways_tsl_mult': 0.3016223241086933, 'sideways_time_stop': 169, 'sideways_use_sma': True, 'sideways_use_ema': True, 'sideways_use_atr': False, 'sideways_use_adx': False, 'sideways_use_spike': True, 'sideways_rsi_required': False}.
[I 2025-09-01 05:16:14,498] Trial 426 finished with values: [-0.06718919085235064, 0.06705707157291592] and parameters: {'p_sma': 22, 'p_std': 6, 'p_atr': 14, 'p_adx': 22, 'rsi_period': 49, 'ema1': 12, 'ema2': 28, 'slip_atr_k': 0.06843896178372225, 'slip_spread_k': 0.30855183370078687, 'spread_hl_frac': 0.04634938569550415, 'bb_std_mult': 3.386893435720777, 'rsi_os': 24, 'rsi_ob': 86, 'vol_spike': 0.22358891541219028, 'adx_thresh': 14.999925624594884, 'atr_min_pct': 0.012715182471060097, 'atr_max_pct': 0.11302906482191905, 'tp_mult': 2.582351150234554, 'tsl_mult': 0.9808087018481798, 'strategy': 'breakout', 'time_stop': 289, 'use_sma': False, 'use_atr': True, 'use_adx': False, 'use_ema': True, 'use_spike': False, 'rsi_required': False, 'edge_k': 0.54444855864263, 'edge_cap': 0.5542796427890906, 'bull_strategy': 'breakout', 'bull_bb_std_mult': 3.2366988889154054, 'bull_rsi_os': 26, 'bull_rsi_ob': 83, 'bull_adx_thresh': 17.25458009325383, 'bull_atr_min_pct': 0.00033843468964538624, 'bull_atr_max_pct': 0.01155375673250586, 'bull_tp_mult': 2.947556153563794, 'bull_tsl_mult': 0.6723716500888393, 'bull_time_stop': 245, 'bull_use_sma': True, 'bull_use_ema': False, 'bull_use_atr': False, 'bull_use_adx': False, 'bull_use_spike': True, 'bull_rsi_required': True, 'bear_strategy': 'mean_reversion', 'bear_bb_std_mult': 0.7722338510656122, 'bear_rsi_os': 9, 'bear_rsi_ob': 62, 'bear_adx_thresh': 27.99025127949351, 'bear_atr_min_pct': 0.010620502829084541, 'bear_atr_max_pct': 0.08132506248680854, 'bear_tp_mult': 1.3849363738031704, 'bear_tsl_mult': 0.6034320189592963, 'bear_time_stop': 215, 'bear_use_sma': True, 'bear_use_ema': False, 'bear_use_atr': False, 'bear_use_adx': False, 'bear_use_spike': True, 'bear_rsi_required': True, 'sideways_strategy': 'breakout', 'sideways_bb_std_mult': 0.8077384389003137, 'sideways_rsi_os': 37, 'sideways_rsi_ob': 57, 'sideways_adx_thresh': 19.539324167666418, 'sideways_atr_min_pct': 0.022772849540887694, 'sideways_atr_max_pct': 0.10607761335569056, 'sideways_tp_mult': 1.6541566229921139, 'sideways_tsl_mult': 0.8690635415839982, 'sideways_time_stop': 136, 'sideways_use_sma': True, 'sideways_use_ema': True, 'sideways_use_atr': False, 'sideways_use_adx': False, 'sideways_use_spike': True, 'sideways_rsi_required': False}.
[I 2025-09-01 05:16:15,219] Trial 430 finished with values: [-1000000000.0, 1000000000.0] and parameters: {'p_sma': 40, 'p_std': 23, 'p_atr': 29, 'p_adx': 21, 'rsi_period': 24, 'ema1': 29, 'ema2': 53, 'slip_atr_k': 0.008374399035457095, 'slip_spread_k': 0.542433049345601, 'spread_hl_frac': 0.04611484790696667, 'bb_std_mult': 3.401152906360856, 'rsi_os': 53, 'rsi_ob': 49, 'vol_spike': 0.2298346479470783, 'adx_thresh': 27.26858628107049, 'atr_min_pct': 0.022461247224901913, 'atr_max_pct': 0.020932984323226274, 'tp_mult': 2.5923033494463983, 'tsl_mult': 0.4577060178787256, 'strategy': 'breakout', 'time_stop': 46, 'use_sma': False, 'use_atr': False, 'use_adx': False, 'use_ema': True, 'use_spike': True, 'rsi_required': False, 'edge_k': 0.5232663517140702, 'edge_cap': 0.4584094658907547, 'bull_strategy': 'breakout', 'bull_bb_std_mult': 2.3089381116098586, 'bull_rsi_os': 22, 'bull_rsi_ob': 92, 'bull_adx_thresh': 29.92972346778465, 'bull_atr_min_pct': 0.018845156201028467, 'bull_atr_max_pct': 0.11632505129339694, 'bull_tp_mult': 1.8245081484101262, 'bull_tsl_mult': 0.4683708829275621, 'bull_time_stop': 6, 'bull_use_sma': False, 'bull_use_ema': False, 'bull_use_atr': False, 'bull_use_adx': False, 'bull_use_spike': False, 'bull_rsi_required': True, 'bear_strategy': 'mean_reversion', 'bear_bb_std_mult': 2.706035549562621, 'bear_rsi_os': 10, 'bear_rsi_ob': 64, 'bear_adx_thresh': 30.274207645895565, 'bear_atr_min_pct': 0.022932689481597397, 'bear_atr_max_pct': 0.12178303931094428, 'bear_tp_mult': 1.2310455191411689, 'bear_tsl_mult': 0.5583174573861407, 'bear_time_stop': 193, 'bear_use_sma': True, 'bear_use_ema': False, 'bear_use_atr': False, 'bear_use_adx': False, 'bear_use_spike': False, 'bear_rsi_required': False, 'sideways_strategy': 'breakout', 'sideways_bb_std_mult': 1.0883779052290037, 'sideways_rsi_os': 44, 'sideways_rsi_ob': 55, 'sideways_adx_thresh': 32.103371011897956, 'sideways_atr_min_pct': 0.029921790851340946, 'sideways_atr_max_pct': 0.11010871064292153, 'sideways_tp_mult': 2.12656082771095, 'sideways_tsl_mult': 0.9572814013702537, 'sideways_time_stop': 185, 'sideways_use_sma': True, 'sideways_use_ema': True, 'sideways_use_atr': False, 'sideways_use_adx': True, 'sideways_use_spike': True, 'sideways_rsi_required': False}.
[I 2025-09-01 05:16:55,315] Trial 432 finished with values: [-1000000000.0, 1000000000.0] and parameters: {'p_sma': 27, 'p_std': 59, 'p_atr': 27, 'p_adx': 30, 'rsi_period': 9, 'ema1': 29, 'ema2': 29, 'slip_atr_k': 0.1499446203113432, 'slip_spread_k': 0.29232600354381116, 'spread_hl_frac': 0.045805495679808066, 'bb_std_mult': 3.5476519152833523, 'rsi_os': 23, 'rsi_ob': 88, 'vol_spike': 0.2285863474304515, 'adx_thresh': 26.733532064089907, 'atr_min_pct': 0.022538042207327108, 'atr_max_pct': 0.1303934775005279, 'tp_mult': 2.0698996398238974, 'tsl_mult': 0.29864035301175496, 'strategy': 'breakout', 'time_stop': 60, 'use_sma': False, 'use_atr': False, 'use_adx': False, 'use_ema': True, 'use_spike': True, 'rsi_required': False, 'edge_k': 1.530928611614719, 'edge_cap': 0.6736808846741762, 'bull_strategy': 'breakout', 'bull_bb_std_mult': 2.521258766329734, 'bull_rsi_os': 24, 'bull_rsi_ob': 63, 'bull_adx_thresh': 12.642874416086556, 'bull_atr_min_pct': 0.0021085603940767844, 'bull_atr_max_pct': 0.11589894045355037, 'bull_tp_mult': 1.5769789516208337, 'bull_tsl_mult': 0.11984018868469737, 'bull_time_stop': 148, 'bull_use_sma': False, 'bull_use_ema': True, 'bull_use_atr': False, 'bull_use_adx': False, 'bull_use_spike': False, 'bull_rsi_required': True, 'bear_strategy': 'mean_reversion', 'bear_bb_std_mult': 0.7529475025720916, 'bear_rsi_os': 11, 'bear_rsi_ob': 64, 'bear_adx_thresh': 29.215751526040922, 'bear_atr_min_pct': 0.01947024612169062, 'bear_atr_max_pct': 0.10098546479221243, 'bear_tp_mult': 1.2363794171239082, 'bear_tsl_mult': 0.566093647469435, 'bear_time_stop': 192, 'bear_use_sma': False, 'bear_use_ema': False, 'bear_use_atr': False, 'bear_use_adx': False, 'bear_use_spike': False, 'bear_rsi_required': False, 'sideways_strategy': 'breakout', 'sideways_bb_std_mult': 0.9276924122843677, 'sideways_rsi_os': 16, 'sideways_rsi_ob': 56, 'sideways_adx_thresh': 11.837807455995609, 'sideways_atr_min_pct': 0.0214817530853032, 'sideways_atr_max_pct': 0.03128914899382871, 'sideways_tp_mult': 1.475938384339411, 'sideways_tsl_mult': 0.6202983254933461, 'sideways_time_stop': 246, 'sideways_use_sma': True, 'sideways_use_ema': True, 'sideways_use_atr': False, 'sideways_use_adx': True, 'sideways_use_spike': True, 'sideways_rsi_required': False}.
[I 2025-09-01 05:16:55,626] Trial 429 finished with values: [-0.019495187921022117, 0.01935198431071021] and parameters: {'p_sma': 24, 'p_std': 23, 'p_atr': 15, 'p_adx': 19, 'rsi_period': 9, 'ema1': 28, 'ema2': 28, 'slip_atr_k': 0.003995307281425267, 'slip_spread_k': 0.3107202102522186, 'spread_hl_frac': 0.03232045236204406, 'bb_std_mult': 1.8490520706044984, 'rsi_os': 23, 'rsi_ob': 87, 'vol_spike': 0.21988617921139117, 'adx_thresh': 13.753650231269479, 'atr_min_pct': 0.01127273648217943, 'atr_max_pct': 0.1308432945849213, 'tp_mult': 2.0686811817000836, 'tsl_mult': 0.9822228563770482, 'strategy': 'breakout', 'time_stop': 30, 'use_sma': False, 'use_atr': False, 'use_adx': False, 'use_ema': True, 'use_spike': True, 'rsi_required': False, 'edge_k': 1.2645423768385309, 'edge_cap': 0.5187610823938217, 'bull_strategy': 'breakout', 'bull_bb_std_mult': 2.270520372285616, 'bull_rsi_os': 25, 'bull_rsi_ob': 87, 'bull_adx_thresh': 12.68562329984914, 'bull_atr_min_pct': 0.002358024669713918, 'bull_atr_max_pct': 0.11686726895980265, 'bull_tp_mult': 1.5806983084136397, 'bull_tsl_mult': 0.03538195420030693, 'bull_time_stop': 64, 'bull_use_sma': True, 'bull_use_ema': False, 'bull_use_atr': False, 'bull_use_adx': False, 'bull_use_spike': False, 'bull_rsi_required': True, 'bear_strategy': 'mean_reversion', 'bear_bb_std_mult': 2.4268140844871797, 'bear_rsi_os': 10, 'bear_rsi_ob': 64, 'bear_adx_thresh': 29.963163244700564, 'bear_atr_min_pct': 0.022881256092223842, 'bear_atr_max_pct': 0.060972851007862, 'bear_tp_mult': 1.250693431983318, 'bear_tsl_mult': 0.6091244123238242, 'bear_time_stop': 192, 'bear_use_sma': True, 'bear_use_ema': False, 'bear_use_atr': False, 'bear_use_adx': False, 'bear_use_spike': False, 'bear_rsi_required': False, 'sideways_strategy': 'breakout', 'sideways_bb_std_mult': 0.805011439149472, 'sideways_rsi_os': 13, 'sideways_rsi_ob': 55, 'sideways_adx_thresh': 20.184054202245648, 'sideways_atr_min_pct': 0.01273286674566797, 'sideways_atr_max_pct': 0.11024576080822689, 'sideways_tp_mult': 1.4480258997125328, 'sideways_tsl_mult': 0.9556396001075884, 'sideways_time_stop': 186, 'sideways_use_sma': True, 'sideways_use_ema': True, 'sideways_use_atr': False, 'sideways_use_adx': False, 'sideways_use_spike': True, 'sideways_rsi_required': False}.
