[I 2025-09-01 05:08:51,884] Trial 386 finished with values: [-1000000000.0, 1000000000.0] and parameters: {'p_sma': 54, 'p_std': 55, 'p_atr': 27, 'p_adx': 16, 'rsi_period': 9, 'ema1': 29, 'ema2': 54, 'slip_atr_k': 0.005396779104412102, 'slip_spread_k': 0.3427000869014423, 'spread_hl_frac': 0.01379246784446899, 'bb_std_mult': 3.2418770816255016, 'rsi_os': 24, 'rsi_ob': 90, 'vol_spike': 0.2262906573234739, 'adx_thresh': 6.193846957898593, 'atr_min_pct': 0.017703426312634128, 'atr_max_pct': 0.1140743562281365, 'tp_mult': 2.6835764991458104, 'tsl_mult': 0.9432041419535286, 'strategy': 'breakout', 'time_stop': 235, 'use_sma': False, 'use_atr': True, 'use_adx': False, 'use_ema': True, 'use_spike': False, 'rsi_required': False, 'edge_k': 0.5856759708565626, 'edge_cap': 0.47361911878301066, 'bull_strategy': 'breakout', 'bull_bb_std_mult': 2.31345258692982, 'bull_rsi_os': 26, 'bull_rsi_ob': 87, 'bull_adx_thresh': 17.173793641744084, 'bull_atr_min_pct': 0.002023108781809632, 'bull_atr_max_pct': 0.11883690602426417, 'bull_tp_mult': 2.5846187416448156, 'bull_tsl_mult': 0.42045050653683597, 'bull_time_stop': 245, 'bull_use_sma': True, 'bull_use_ema': True, 'bull_use_atr': False, 'bull_use_adx': False, 'bull_use_spike': False, 'bull_rsi_required': True, 'bear_strategy': 'mean_reversion', 'bear_bb_std_mult': 2.997905128071963, 'bear_rsi_os': 14, 'bear_rsi_ob': 62, 'bear_adx_thresh': 29.954437612561264, 'bear_atr_min_pct': 0.02996435328750252, 'bear_atr_max_pct': 0.0659785830238068, 'bear_tp_mult': 1.371716156025594, 'bear_tsl_mult': 0.670888050236915, 'bear_time_stop': 11, 'bear_use_sma': True, 'bear_use_ema': False, 'bear_use_atr': False, 'bear_use_adx': False, 'bear_use_spike': False, 'bear_rsi_required': False, 'sideways_strategy': 'breakout', 'sideways_bb_std_mult': 2.8201821493228314, 'sideways_rsi_os': 45, 'sideways_rsi_ob': 57, 'sideways_adx_thresh': 18.174822910316983, 'sideways_atr_min_pct': 0.028786443510761754, 'sideways_atr_max_pct': 0.10547574187608258, 'sideways_tp_mult': 1.9231229834693697, 'sideways_tsl_mult': 0.9522332176755308, 'sideways_time_stop': 34, 'sideways_use_sma': False, 'sideways_use_ema': False, 'sideways_use_atr': False, 'sideways_use_adx': False, 'sideways_use_spike': True, 'sideways_rsi_required': True}.
[I 2025-09-01 05:09:41,007] Trial 391 finished with values: [-1000000000.0, 1000000000.0] and parameters: {'p_sma': 25, 'p_std': 24, 'p_atr': 13, 'p_adx': 11, 'rsi_period': 73, 'ema1': 29, 'ema2': 57, 'slip_atr_k': 0.02224837584155223, 'slip_spread_k': 0.04803533258782067, 'spread_hl_frac': 0.00696773075489809, 'bb_std_mult': 3.34244833242364, 'rsi_os': 23, 'rsi_ob': 87, 'vol_spike': 0.163910780404544, 'adx_thresh': 22.65469562348662, 'atr_min_pct': 0.020744551045001215, 'atr_max_pct': 0.11808404804348667, 'tp_mult': 2.5612964418098576, 'tsl_mult': 0.5946086376957116, 'strategy': 'breakout', 'time_stop': 27, 'use_sma': False, 'use_atr': False, 'use_adx': True, 'use_ema': True, 'use_spike': True, 'rsi_required': True, 'edge_k': 0.6733356667020775, 'edge_cap': 0.8874821026818298, 'bull_strategy': 'breakout', 'bull_bb_std_mult': 2.4308951127048517, 'bull_rsi_os': 54, 'bull_rsi_ob': 91, 'bull_adx_thresh': 12.117870123451912, 'bull_atr_min_pct': 0.018495773584275402, 'bull_atr_max_pct': 0.14175615415310477, 'bull_tp_mult': 2.87158992232138, 'bull_tsl_mult': 0.3956794167801141, 'bull_time_stop': 248, 'bull_use_sma': True, 'bull_use_ema': False, 'bull_use_atr': False, 'bull_use_adx': False, 'bull_use_spike': False, 'bull_rsi_required': True, 'bear_strategy': 'mean_reversion', 'bear_bb_std_mult': 2.300197950048708, 'bear_rsi_os': 11, 'bear_rsi_ob': 79, 'bear_adx_thresh': 31.225030916536568, 'bear_atr_min_pct': 0.02822359278339408, 'bear_atr_max_pct': 0.1173906421181678, 'bear_tp_mult': 1.2928848750482096, 'bear_tsl_mult': 0.579415893190203, 'bear_time_stop': 203, 'bear_use_sma': False, 'bear_use_ema': True, 'bear_use_atr': False, 'bear_use_adx': False, 'bear_use_spike': False, 'bear_rsi_required': True, 'sideways_strategy': 'breakout', 'sideways_bb_std_mult': 1.8198295059902019, 'sideways_rsi_os': 41, 'sideways_rsi_ob': 58, 'sideways_adx_thresh': 19.127715831041105, 'sideways_atr_min_pct': 0.021318885220430107, 'sideways_atr_max_pct': 0.11823013204613764, 'sideways_tp_mult': 1.46806797372215, 'sideways_tsl_mult': 0.48743412151510696, 'sideways_time_stop': 80, 'sideways_use_sma': True, 'sideways_use_ema': True, 'sideways_use_atr': False, 'sideways_use_adx': False, 'sideways_use_spike': True, 'sideways_rsi_required': False}.
[I 2025-09-01 05:09:42,054] Trial 390 finished with values: [-0.04265755794123893, 0.04246816467766664] and parameters: {'p_sma': 25, 'p_std': 20, 'p_atr': 26, 'p_adx': 19, 'rsi_period': 9, 'ema1': 29, 'ema2': 42, 'slip_atr_k': 0.0056830830993684035, 'slip_spread_k': 0.5961741395986336, 'spread_hl_frac': 0.006911595396128484, 'bb_std_mult': 1.392712931189354, 'rsi_os': 23, 'rsi_ob': 87, 'vol_spike': 0.06928323779050094, 'adx_thresh': 14.559329490195113, 'atr_min_pct': 0.020780604070236925, 'atr_max_pct': 0.11779349178463784, 'tp_mult': 2.5872129771161196, 'tsl_mult': 0.7679812641320136, 'strategy': 'breakout', 'time_stop': 228, 'use_sma': False, 'use_atr': False, 'use_adx': True, 'use_ema': True, 'use_spike': False, 'rsi_required': True, 'edge_k': 0.6873213730910662, 'edge_cap': 0.49326722787784527, 'bull_strategy': 'breakout', 'bull_bb_std_mult': 2.311251254767349, 'bull_rsi_os': 23, 'bull_rsi_ob': 91, 'bull_adx_thresh': 15.488003069401254, 'bull_atr_min_pct': 0.0010524160849259487, 'bull_atr_max_pct': 0.11026162287627134, 'bull_tp_mult': 1.188554598845589, 'bull_tsl_mult': 0.44553776762028835, 'bull_time_stop': 249, 'bull_use_sma': True, 'bull_use_ema': False, 'bull_use_atr': False, 'bull_use_adx': False, 'bull_use_spike': False, 'bull_rsi_required': True, 'bear_strategy': 'mean_reversion', 'bear_bb_std_mult': 2.3188375488555315, 'bear_rsi_os': 13, 'bear_rsi_ob': 78, 'bear_adx_thresh': 31.02135882799382, 'bear_atr_min_pct': 0.015401119859481801, 'bear_atr_max_pct': 0.06537817993785075, 'bear_tp_mult': 1.413022457835484, 'bear_tsl_mult': 0.5422578258377677, 'bear_time_stop': 204, 'bear_use_sma': False, 'bear_use_ema': True, 'bear_use_atr': False, 'bear_use_adx': False, 'bear_use_spike': False, 'bear_rsi_required': True, 'sideways_strategy': 'breakout', 'sideways_bb_std_mult': 1.812304740951032, 'sideways_rsi_os': 38, 'sideways_rsi_ob': 58, 'sideways_adx_thresh': 29.719952239892674, 'sideways_atr_min_pct': 0.003776144384771087, 'sideways_atr_max_pct': 0.10363622443381439, 'sideways_tp_mult': 2.040421471604944, 'sideways_tsl_mult': 0.28477429407481275, 'sideways_time_stop': 33, 'sideways_use_sma': True, 'sideways_use_ema': True, 'sideways_use_atr': False, 'sideways_use_adx': False, 'sideways_use_spike': True, 'sideways_rsi_required': False}.
[I 2025-09-01 05:09:44,187] Trial 388 finished with values: [-1000000000.0, 1000000000.0] and parameters: {'p_sma': 50, 'p_std': 20, 'p_atr': 26, 'p_adx': 19, 'rsi_period': 9, 'ema1': 29, 'ema2': 57, 'slip_atr_k': 0.005202369756757739, 'slip_spread_k': 0.27347559379601394, 'spread_hl_frac': 0.007028864312389891, 'bb_std_mult': 3.327366120778911, 'rsi_os': 23, 'rsi_ob': 87, 'vol_spike': 0.20076678573144885, 'adx_thresh': 14.760278829684463, 'atr_min_pct': 0.022205309922464812, 'atr_max_pct': 0.11730756848017102, 'tp_mult': 2.591115388798858, 'tsl_mult': 0.9491624827166502, 'strategy': 'breakout', 'time_stop': 275, 'use_sma': False, 'use_atr': False, 'use_adx': True, 'use_ema': True, 'use_spike': False, 'rsi_required': True, 'edge_k': 0.6954187512186593, 'edge_cap': 0.9204675973832671, 'bull_strategy': 'breakout', 'bull_bb_std_mult': 2.2971368743230123, 'bull_rsi_os': 23, 'bull_rsi_ob': 61, 'bull_adx_thresh': 23.53090320175167, 'bull_atr_min_pct': 0.014385372149506314, 'bull_atr_max_pct': 0.11031226374202567, 'bull_tp_mult': 2.068396648817091, 'bull_tsl_mult': 0.4580526874194197, 'bull_time_stop': 250, 'bull_use_sma': True, 'bull_use_ema': False, 'bull_use_atr': False, 'bull_use_adx': False, 'bull_use_spike': False, 'bull_rsi_required': True, 'bear_strategy': 'mean_reversion', 'bear_bb_std_mult': 3.0114843282122035, 'bear_rsi_os': 13, 'bear_rsi_ob': 63, 'bear_adx_thresh': 30.750731359199815, 'bear_atr_min_pct': 0.029997266252449785, 'bear_atr_max_pct': 0.06525656609852667, 'bear_tp_mult': 1.4233322714612737, 'bear_tsl_mult': 0.5453644666045556, 'bear_time_stop': 203, 'bear_use_sma': False, 'bear_use_ema': True, 'bear_use_atr': False, 'bear_use_adx': False, 'bear_use_spike': False, 'bear_rsi_required': True, 'sideways_strategy': 'breakout', 'sideways_bb_std_mult': 1.83029486106935, 'sideways_rsi_os': 41, 'sideways_rsi_ob': 58, 'sideways_adx_thresh': 25.02984214165133, 'sideways_atr_min_pct': 0.003708052483543582, 'sideways_atr_max_pct': 0.11090570365656353, 'sideways_tp_mult': 1.5979358823799066, 'sideways_tsl_mult': 0.48769314116440726, 'sideways_time_stop': 261, 'sideways_use_sma': True, 'sideways_use_ema': True, 'sideways_use_atr': False, 'sideways_use_adx': False, 'sideways_use_spike': True, 'sideways_rsi_required': False}.
[I 2025-09-01 05:09:45,203] Trial 389 finished with values: [-0.018371480001645568, 0.0182087045728069] and parameters: {'p_sma': 25, 'p_std': 59, 'p_atr': 13, 'p_adx': 19, 'rsi_period': 9, 'ema1': 29, 'ema2': 29, 'slip_atr_k': 0.0054577527605750445, 'slip_spread_k': 0.5953811194099066, 'spread_hl_frac': 0.026462221428553912, 'bb_std_mult': 1.4028565064870218, 'rsi_os': 23, 'rsi_ob': 87, 'vol_spike': 0.20010610810705265, 'adx_thresh': 34.894698928827964, 'atr_min_pct': 0.02034408979967215, 'atr_max_pct': 0.11783321280189077, 'tp_mult': 2.582963816551965, 'tsl_mult': 0.4175434089418526, 'strategy': 'breakout', 'time_stop': 228, 'use_sma': False, 'use_atr': False, 'use_adx': True, 'use_ema': True, 'use_spike': False, 'rsi_required': True, 'edge_k': 1.2147487301478195, 'edge_cap': 0.5338692834976451, 'bull_strategy': 'breakout', 'bull_bb_std_mult': 2.3108180043567987, 'bull_rsi_os': 23, 'bull_rsi_ob': 91, 'bull_adx_thresh': 7.55240612881251, 'bull_atr_min_pct': 0.0012921125326739212, 'bull_atr_max_pct': 0.10961699542413057, 'bull_tp_mult': 1.588394430402559, 'bull_tsl_mult': 0.84829218057479, 'bull_time_stop': 246, 'bull_use_sma': True, 'bull_use_ema': False, 'bull_use_atr': False, 'bull_use_adx': False, 'bull_use_spike': False, 'bull_rsi_required': True, 'bear_strategy': 'mean_reversion', 'bear_bb_std_mult': 0.7398304174207441, 'bear_rsi_os': 13, 'bear_rsi_ob': 62, 'bear_adx_thresh': 30.958658892551988, 'bear_atr_min_pct': 0.015369257375749203, 'bear_atr_max_pct': 0.06509544563903916, 'bear_tp_mult': 2.8830508840132167, 'bear_tsl_mult': 0.698972197779117, 'bear_time_stop': 202, 'bear_use_sma': False, 'bear_use_ema': True, 'bear_use_atr': False, 'bear_use_adx': False, 'bear_use_spike': False, 'bear_rsi_required': True, 'sideways_strategy': 'breakout', 'sideways_bb_std_mult': 1.976212947258663, 'sideways_rsi_os': 38, 'sideways_rsi_ob': 58, 'sideways_adx_thresh': 28.43724951736182, 'sideways_atr_min_pct': 0.029578605274786923, 'sideways_atr_max_pct': 0.10340840314043521, 'sideways_tp_mult': 2.379547942620562, 'sideways_tsl_mult': 0.28243858130290933, 'sideways_time_stop': 265, 'sideways_use_sma': True, 'sideways_use_ema': True, 'sideways_use_atr': False, 'sideways_use_adx': False, 'sideways_use_spike': True, 'sideways_rsi_required': False}.
[I 2025-09-01 05:10:31,058] Trial 393 finished with values: [-1000000000.0, 1000000000.0] and parameters: {'p_sma': 27, 'p_std': 58, 'p_atr': 8, 'p_adx': 18, 'rsi_period': 47, 'ema1': 26, 'ema2': 29, 'slip_atr_k': 0.01943173133696676, 'slip_spread_k': 0.7314567584164992, 'spread_hl_frac': 0.027925451546756658, 'bb_std_mult': 3.416944954005866, 'rsi_os': 22, 'rsi_ob': 89, 'vol_spike': 0.2778366541112809, 'adx_thresh': 13.438365160976971, 'atr_min_pct': 0.019842095357252124, 'atr_max_pct': 0.10370070487643836, 'tp_mult': 1.3766001125824996, 'tsl_mult': 0.5374880782609948, 'strategy': 'breakout', 'time_stop': 34, 'use_sma': False, 'use_atr': False, 'use_adx': False, 'use_ema': True, 'use_spike': True, 'rsi_required': False, 'edge_k': 0.50843192312416, 'edge_cap': 0.31956707925303146, 'bull_strategy': 'breakout', 'bull_bb_std_mult': 1.7867013153232278, 'bull_rsi_os': 23, 'bull_rsi_ob': 69, 'bull_adx_thresh': 17.860132161241804, 'bull_atr_min_pct': 0.014373827209834902, 'bull_atr_max_pct': 0.05999689774231662, 'bull_tp_mult': 2.0506512870761755, 'bull_tsl_mult': 0.8430048586402037, 'bull_time_stop': 228, 'bull_use_sma': True, 'bull_use_ema': False, 'bull_use_atr': False, 'bull_use_adx': False, 'bull_use_spike': False, 'bull_rsi_required': True, 'bear_strategy': 'mean_reversion', 'bear_bb_std_mult': 0.7345223376579773, 'bear_rsi_os': 5, 'bear_rsi_ob': 62, 'bear_adx_thresh': 7.833400650544286, 'bear_atr_min_pct': 0.0034281407631457823, 'bear_atr_max_pct': 0.06242262555725791, 'bear_tp_mult': 2.879245117516952, 'bear_tsl_mult': 0.5830342275373603, 'bear_time_stop': 196, 'bear_use_sma': True, 'bear_use_ema': False, 'bear_use_atr': False, 'bear_use_adx': False, 'bear_use_spike': False, 'bear_rsi_required': False, 'sideways_strategy': 'breakout', 'sideways_bb_std_mult': 1.9911864337380725, 'sideways_rsi_os': 50, 'sideways_rsi_ob': 54, 'sideways_adx_thresh': 25.043181143043228, 'sideways_atr_min_pct': 0.011817963024105023, 'sideways_atr_max_pct': 0.11157621594256421, 'sideways_tp_mult': 1.5885454723647527, 'sideways_tsl_mult': 0.9417400615817803, 'sideways_time_stop': 262, 'sideways_use_sma': True, 'sideways_use_ema': True, 'sideways_use_atr': False, 'sideways_use_adx': False, 'sideways_use_spike': True, 'sideways_rsi_required': False}.
[I 2025-09-01 05:10:31,644] Trial 394 finished with values: [-1000000000.0, 1000000000.0] and parameters: {'p_sma': 27, 'p_std': 59, 'p_atr': 9, 'p_adx': 18, 'rsi_period': 8, 'ema1': 26, 'ema2': 14, 'slip_atr_k': 0.010120264249113962, 'slip_spread_k': 0.36486517477019903, 'spread_hl_frac': 0.02816435010330703, 'bb_std_mult': 2.230956372689815, 'rsi_os': 22, 'rsi_ob': 88, 'vol_spike': 0.1143319359330008, 'adx_thresh': 34.979232484284914, 'atr_min_pct': 0.013612470839475673, 'atr_max_pct': 0.1337663216679384, 'tp_mult': 1.3517829329489368, 'tsl_mult': 0.5412279710396523, 'strategy': 'breakout', 'time_stop': 35, 'use_sma': False, 'use_atr': False, 'use_adx': False, 'use_ema': True, 'use_spike': True, 'rsi_required': False, 'edge_k': 1.7645244100761053, 'edge_cap': 0.5398516490478822, 'bull_strategy': 'breakout', 'bull_bb_std_mult': 1.7967992782909779, 'bull_rsi_os': 25, 'bull_rsi_ob': 70, 'bull_adx_thresh': 17.88824576544587, 'bull_atr_min_pct': 0.0038217608824925725, 'bull_atr_max_pct': 0.029376261334230443, 'bull_tp_mult': 2.6442163268079777, 'bull_tsl_mult': 0.8309795349879618, 'bull_time_stop': 107, 'bull_use_sma': True, 'bull_use_ema': False, 'bull_use_atr': False, 'bull_use_adx': False, 'bull_use_spike': False, 'bull_rsi_required': True, 'bear_strategy': 'mean_reversion', 'bear_bb_std_mult': 0.7401573001204095, 'bear_rsi_os': 17, 'bear_rsi_ob': 75, 'bear_adx_thresh': 18.697308299421316, 'bear_atr_min_pct': 0.009386511908574051, 'bear_atr_max_pct': 0.06152288309580005, 'bear_tp_mult': 1.210060565130124, 'bear_tsl_mult': 0.6316933474470996, 'bear_time_stop': 177, 'bear_use_sma': True, 'bear_use_ema': False, 'bear_use_atr': False, 'bear_use_adx': False, 'bear_use_spike': False, 'bear_rsi_required': False, 'sideways_strategy': 'breakout', 'sideways_bb_std_mult': 3.07142709229715, 'sideways_rsi_os': 49, 'sideways_rsi_ob': 51, 'sideways_adx_thresh': 5.072543009988401, 'sideways_atr_min_pct': 0.024205289907871037, 'sideways_atr_max_pct': 0.11097570300909054, 'sideways_tp_mult': 1.5268330906332956, 'sideways_tsl_mult': 0.9390443812374183, 'sideways_time_stop': 184, 'sideways_use_sma': True, 'sideways_use_ema': True, 'sideways_use_atr': False, 'sideways_use_adx': False, 'sideways_use_spike': True, 'sideways_rsi_required': False}.
[I 2025-09-01 05:10:31,904] Trial 392 finished with values: [-0.019230046714853954, 0.019072090234452388] and parameters: {'p_sma': 27, 'p_std': 59, 'p_atr': 9, 'p_adx': 18, 'rsi_period': 9, 'ema1': 29, 'ema2': 29, 'slip_atr_k': 0.004293451483096122, 'slip_spread_k': 0.7262687223743641, 'spread_hl_frac': 0.04713434566718423, 'bb_std_mult': 3.4121009932664017, 'rsi_os': 22, 'rsi_ob': 88, 'vol_spike': 0.2109612094304499, 'adx_thresh': 11.144636922538005, 'atr_min_pct': 0.004969059999206623, 'atr_max_pct': 0.11665344928171772, 'tp_mult': 1.3498592612263778, 'tsl_mult': 0.9502912309411782, 'strategy': 'breakout', 'time_stop': 247, 'use_sma': False, 'use_atr': False, 'use_adx': False, 'use_ema': True, 'use_spike': True, 'rsi_required': False, 'edge_k': 1.7723455482771107, 'edge_cap': 0.5348213952073082, 'bull_strategy': 'breakout', 'bull_bb_std_mult': 2.2651595530944193, 'bull_rsi_os': 25, 'bull_rsi_ob': 70, 'bull_adx_thresh': 16.29777511029061, 'bull_atr_min_pct': 0.001078777441671282, 'bull_atr_max_pct': 0.1113674548052094, 'bull_tp_mult': 2.053518455445559, 'bull_tsl_mult': 0.46164722528171703, 'bull_time_stop': 101, 'bull_use_sma': True, 'bull_use_ema': False, 'bull_use_atr': False, 'bull_use_adx': False, 'bull_use_spike': False, 'bull_rsi_required': True, 'bear_strategy': 'mean_reversion', 'bear_bb_std_mult': 0.7540824729815075, 'bear_rsi_os': 13, 'bear_rsi_ob': 63, 'bear_adx_thresh': 8.827820628746954, 'bear_atr_min_pct': 0.023981962185864507, 'bear_atr_max_pct': 0.03866237334646767, 'bear_tp_mult': 2.698587120273844, 'bear_tsl_mult': 0.5402843709710257, 'bear_time_stop': 124, 'bear_use_sma': True, 'bear_use_ema': False, 'bear_use_atr': False, 'bear_use_adx': False, 'bear_use_spike': False, 'bear_rsi_required': False, 'sideways_strategy': 'breakout', 'sideways_bb_std_mult': 0.6878211911529919, 'sideways_rsi_os': 38, 'sideways_rsi_ob': 53, 'sideways_adx_thresh': 17.585831891969523, 'sideways_atr_min_pct': 0.029681329208876533, 'sideways_atr_max_pct': 0.11200601499362071, 'sideways_tp_mult': 2.0394445011778766, 'sideways_tsl_mult': 0.2784141147749717, 'sideways_time_stop': 185, 'sideways_use_sma': True, 'sideways_use_ema': True, 'sideways_use_atr': False, 'sideways_use_adx': False, 'sideways_use_spike': True, 'sideways_rsi_required': False}.
[I 2025-09-01 05:10:32,888] Trial 395 finished with values: [-1000000000.0, 1000000000.0] and parameters: {'p_sma': 27, 'p_std': 59, 'p_atr': 9, 'p_adx': 18, 'rsi_period': 47, 'ema1': 27, 'ema2': 29, 'slip_atr_k': 0.20052622634881218, 'slip_spread_k': 0.3126733492043744, 'spread_hl_frac': 0.027599537471939217, 'bb_std_mult': 3.39833840916002, 'rsi_os': 22, 'rsi_ob': 88, 'vol_spike': 0.21079073224311384, 'adx_thresh': 13.471997154988962, 'atr_min_pct': 0.007791349566083118, 'atr_max_pct': 0.08999651049462853, 'tp_mult': 1.3732314746634253, 'tsl_mult': 0.27485502459219735, 'strategy': 'breakout', 'time_stop': 197, 'use_sma': False, 'use_atr': False, 'use_adx': False, 'use_ema': True, 'use_spike': True, 'rsi_required': False, 'edge_k': 1.2202679210991518, 'edge_cap': 0.53786583064603, 'bull_strategy': 'breakout', 'bull_bb_std_mult': 1.4988970393127228, 'bull_rsi_os': 25, 'bull_rsi_ob': 70, 'bull_adx_thresh': 17.723464279289107, 'bull_atr_min_pct': 0.028305460359384742, 'bull_atr_max_pct': 0.05349523101757289, 'bull_tp_mult': 1.62204470574948, 'bull_tsl_mult': 0.6044662046563827, 'bull_time_stop': 117, 'bull_use_sma': True, 'bull_use_ema': False, 'bull_use_atr': False, 'bull_use_adx': False, 'bull_use_spike': False, 'bull_rsi_required': True, 'bear_strategy': 'mean_reversion', 'bear_bb_std_mult': 0.7222654128389787, 'bear_rsi_os': 9, 'bear_rsi_ob': 66, 'bear_adx_thresh': 7.363440580046097, 'bear_atr_min_pct': 0.0289490529926538, 'bear_atr_max_pct': 0.06202835807476485, 'bear_tp_mult': 2.5736755775261875, 'bear_tsl_mult': 0.6983587221659233, 'bear_time_stop': 196, 'bear_use_sma': True, 'bear_use_ema': False, 'bear_use_atr': False, 'bear_use_adx': False, 'bear_use_spike': False, 'bear_rsi_required': False, 'sideways_strategy': 'breakout', 'sideways_bb_std_mult': 0.6888916506604784, 'sideways_rsi_os': 44, 'sideways_rsi_ob': 53, 'sideways_adx_thresh': 28.029060915089126, 'sideways_atr_min_pct': 0.011630132360006769, 'sideways_atr_max_pct': 0.110854778445084, 'sideways_tp_mult': 2.3627971626841027, 'sideways_tsl_mult': 0.9327661731085704, 'sideways_time_stop': 185, 'sideways_use_sma': True, 'sideways_use_ema': True, 'sideways_use_atr': False, 'sideways_use_adx': False, 'sideways_use_spike': True, 'sideways_rsi_required': False}.
