[I 2025-09-01 05:07:10,858] Trial 377 finished with values: [-0.022498724593677966, 0.022299720137653255] and parameters: {'p_sma': 24, 'p_std': 58, 'p_atr': 27, 'p_adx': 27, 'rsi_period': 7, 'ema1': 9, 'ema2': 29, 'slip_atr_k': 0.23760812818345137, 'slip_spread_k': 0.3026784424114619, 'spread_hl_frac': 0.034562608351993714, 'bb_std_mult': 3.541072987884953, 'rsi_os': 23, 'rsi_ob': 85, 'vol_spike': 0.1353066971148871, 'adx_thresh': 16.589703369095993, 'atr_min_pct': 0.024795826942406753, 'atr_max_pct': 0.045909381624919025, 'tp_mult': 1.9245169806203402, 'tsl_mult': 0.7942741074941924, 'strategy': 'mean_reversion', 'time_stop': 119, 'use_sma': False, 'use_atr': False, 'use_adx': False, 'use_ema': True, 'use_spike': True, 'rsi_required': False, 'edge_k': 0.004951355919129541, 'edge_cap': 0.4929373128938956, 'bull_strategy': 'breakout', 'bull_bb_std_mult': 3.5823763313797374, 'bull_rsi_os': 24, 'bull_rsi_ob': 89, 'bull_adx_thresh': 11.274264399585531, 'bull_atr_min_pct': 0.0011110138709189857, 'bull_atr_max_pct': 0.05577907644398435, 'bull_tp_mult': 1.5538844565204672, 'bull_tsl_mult': 0.49885824274050394, 'bull_time_stop': 232, 'bull_use_sma': True, 'bull_use_ema': False, 'bull_use_atr': False, 'bull_use_adx': False, 'bull_use_spike': True, 'bull_rsi_required': True, 'bear_strategy': 'mean_reversion', 'bear_bb_std_mult': 1.8054979817322285, 'bear_rsi_os': 6, 'bear_rsi_ob': 64, 'bear_adx_thresh': 28.272898467516594, 'bear_atr_min_pct': 0.029007551927368952, 'bear_atr_max_pct': 0.07250628969786044, 'bear_tp_mult': 1.6129553237213303, 'bear_tsl_mult': 0.5126838185855853, 'bear_time_stop': 226, 'bear_use_sma': True, 'bear_use_ema': False, 'bear_use_atr': False, 'bear_use_adx': False, 'bear_use_spike': True, 'bear_rsi_required': False, 'sideways_strategy': 'breakout', 'sideways_bb_std_mult': 0.7139562115321553, 'sideways_rsi_os': 44, 'sideways_rsi_ob': 56, 'sideways_adx_thresh': 17.74553728270851, 'sideways_atr_min_pct': 0.026127301124616167, 'sideways_atr_max_pct': 0.0343627891243086, 'sideways_tp_mult': 1.0947630565742876, 'sideways_tsl_mult': 0.983935324383581, 'sideways_time_stop': 178, 'sideways_use_sma': True, 'sideways_use_ema': True, 'sideways_use_atr': False, 'sideways_use_adx': False, 'sideways_use_spike': True, 'sideways_rsi_required': False}.
[I 2025-09-01 05:07:11,818] Trial 379 finished with values: [-1000000000.0, 1000000000.0] and parameters: {'p_sma': 23, 'p_std': 57, 'p_atr': 27, 'p_adx': 23, 'rsi_period': 7, 'ema1': 9, 'ema2': 31, 'slip_atr_k': 0.2368052586899518, 'slip_spread_k': 0.29659711102869957, 'spread_hl_frac': 0.019808640229877564, 'bb_std_mult': 3.5409259979312764, 'rsi_os': 23, 'rsi_ob': 88, 'vol_spike': 0.13301212789227718, 'adx_thresh': 15.389136946282724, 'atr_min_pct': 0.02493875670752227, 'atr_max_pct': 0.045774770474552195, 'tp_mult': 2.518521457469624, 'tsl_mult': 0.8111802739459946, 'strategy': 'mean_reversion', 'time_stop': 40, 'use_sma': False, 'use_atr': False, 'use_adx': True, 'use_ema': True, 'use_spike': True, 'rsi_required': True, 'edge_k': 0.4632982632456534, 'edge_cap': 0.504715898245309, 'bull_strategy': 'breakout', 'bull_bb_std_mult': 1.1480166943371115, 'bull_rsi_os': 25, 'bull_rsi_ob': 89, 'bull_adx_thresh': 18.71246373092055, 'bull_atr_min_pct': 0.02696329848522476, 'bull_atr_max_pct': 0.11345443207214348, 'bull_tp_mult': 1.539364649931901, 'bull_tsl_mult': 0.5708018415104815, 'bull_time_stop': 240, 'bull_use_sma': True, 'bull_use_ema': False, 'bull_use_atr': False, 'bull_use_adx': False, 'bull_use_spike': True, 'bull_rsi_required': True, 'bear_strategy': 'mean_reversion', 'bear_bb_std_mult': 3.11522573320271, 'bear_rsi_os': 6, 'bear_rsi_ob': 64, 'bear_adx_thresh': 28.622311786469556, 'bear_atr_min_pct': 0.02578883851984308, 'bear_atr_max_pct': 0.054161246932265414, 'bear_tp_mult': 1.3289525567381968, 'bear_tsl_mult': 0.5878253542198855, 'bear_time_stop': 150, 'bear_use_sma': False, 'bear_use_ema': False, 'bear_use_atr': False, 'bear_use_adx': False, 'bear_use_spike': True, 'bear_rsi_required': False, 'sideways_strategy': 'breakout', 'sideways_bb_std_mult': 0.8258559236670908, 'sideways_rsi_os': 39, 'sideways_rsi_ob': 56, 'sideways_adx_thresh': 17.927312919750683, 'sideways_atr_min_pct': 0.022067082065138244, 'sideways_atr_max_pct': 0.11488572766488454, 'sideways_tp_mult': 1.4070070034084747, 'sideways_tsl_mult': 0.15310359385307526, 'sideways_time_stop': 252, 'sideways_use_sma': True, 'sideways_use_ema': True, 'sideways_use_atr': False, 'sideways_use_adx': False, 'sideways_use_spike': True, 'sideways_rsi_required': False}.
[I 2025-09-01 05:07:59,818] Trial 380 finished with values: [-1000000000.0, 1000000000.0] and parameters: {'p_sma': 23, 'p_std': 57, 'p_atr': 28, 'p_adx': 26, 'rsi_period': 7, 'ema1': 29, 'ema2': 28, 'slip_atr_k': 0.012272949904766847, 'slip_spread_k': 0.4667883840947727, 'spread_hl_frac': 0.034209191245309606, 'bb_std_mult': 1.6628171253097146, 'rsi_os': 22, 'rsi_ob': 87, 'vol_spike': 0.01726694921908703, 'adx_thresh': 15.190223169367739, 'atr_min_pct': 0.0057581989650196605, 'atr_max_pct': 0.05812537102206965, 'tp_mult': 1.1955102496118992, 'tsl_mult': 0.9766826119470364, 'strategy': 'mean_reversion', 'time_stop': 77, 'use_sma': False, 'use_atr': False, 'use_adx': False, 'use_ema': True, 'use_spike': True, 'rsi_required': False, 'edge_k': 0.4509542115575943, 'edge_cap': 0.5158824400134177, 'bull_strategy': 'breakout', 'bull_bb_std_mult': 1.0981908541827645, 'bull_rsi_os': 24, 'bull_rsi_ob': 89, 'bull_adx_thresh': 24.75023471910238, 'bull_atr_min_pct': 0.0025442216248013428, 'bull_atr_max_pct': 0.11458890478737194, 'bull_tp_mult': 2.984243224124044, 'bull_tsl_mult': 0.005946183129002469, 'bull_time_stop': 238, 'bull_use_sma': True, 'bull_use_ema': False, 'bull_use_atr': False, 'bull_use_adx': True, 'bull_use_spike': True, 'bull_rsi_required': True, 'bear_strategy': 'breakout', 'bear_bb_std_mult': 0.662814053669742, 'bear_rsi_os': 8, 'bear_rsi_ob': 87, 'bear_adx_thresh': 28.409951290426275, 'bear_atr_min_pct': 0.028617542359986668, 'bear_atr_max_pct': 0.07041315023004013, 'bear_tp_mult': 1.3258575912003705, 'bear_tsl_mult': 0.5564739910709028, 'bear_time_stop': 209, 'bear_use_sma': True, 'bear_use_ema': False, 'bear_use_atr': False, 'bear_use_adx': False, 'bear_use_spike': True, 'bear_rsi_required': False, 'sideways_strategy': 'breakout', 'sideways_bb_std_mult': 0.8159090515542122, 'sideways_rsi_os': 43, 'sideways_rsi_ob': 56, 'sideways_adx_thresh': 17.807386121698986, 'sideways_atr_min_pct': 0.004932317576193284, 'sideways_atr_max_pct': 0.11498945320572257, 'sideways_tp_mult': 1.8394239753400639, 'sideways_tsl_mult': 0.9999827258579289, 'sideways_time_stop': 118, 'sideways_use_sma': True, 'sideways_use_ema': True, 'sideways_use_atr': True, 'sideways_use_adx': False, 'sideways_use_spike': True, 'sideways_rsi_required': False}.
[I 2025-09-01 05:08:00,897] Trial 382 finished with values: [-1000000000.0, 1000000000.0] and parameters: {'p_sma': 25, 'p_std': 29, 'p_atr': 28, 'p_adx': 20, 'rsi_period': 11, 'ema1': 28, 'ema2': 31, 'slip_atr_k': 0.013572723082431792, 'slip_spread_k': 0.6670471254977501, 'spread_hl_frac': 0.0454672150997711, 'bb_std_mult': 3.4385627933533067, 'rsi_os': 22, 'rsi_ob': 88, 'vol_spike': 0.2885928439346791, 'adx_thresh': 15.238797622926157, 'atr_min_pct': 0.024322700899374466, 'atr_max_pct': 0.037238753507373136, 'tp_mult': 2.5158617058620987, 'tsl_mult': 0.9814707514371518, 'strategy': 'breakout', 'time_stop': 265, 'use_sma': False, 'use_atr': False, 'use_adx': False, 'use_ema': False, 'use_spike': True, 'rsi_required': False, 'edge_k': 0.46352034772840434, 'edge_cap': 0.5197845825404703, 'bull_strategy': 'breakout', 'bull_bb_std_mult': 2.3659496861483666, 'bull_rsi_os': 25, 'bull_rsi_ob': 88, 'bull_adx_thresh': 18.758471505650267, 'bull_atr_min_pct': 0.020544683483222765, 'bull_atr_max_pct': 0.10876776104537088, 'bull_tp_mult': 1.4584761172505134, 'bull_tsl_mult': 0.3885406008404937, 'bull_time_stop': 239, 'bull_use_sma': False, 'bull_use_ema': False, 'bull_use_atr': False, 'bull_use_adx': True, 'bull_use_spike': False, 'bull_rsi_required': True, 'bear_strategy': 'breakout', 'bear_bb_std_mult': 0.6697601908836878, 'bear_rsi_os': 10, 'bear_rsi_ob': 65, 'bear_adx_thresh': 29.95446222358597, 'bear_atr_min_pct': 0.025569185438306587, 'bear_atr_max_pct': 0.011953899071850002, 'bear_tp_mult': 1.311743528956561, 'bear_tsl_mult': 0.552996190332803, 'bear_time_stop': 55, 'bear_use_sma': True, 'bear_use_ema': False, 'bear_use_atr': False, 'bear_use_adx': False, 'bear_use_spike': False, 'bear_rsi_required': False, 'sideways_strategy': 'breakout', 'sideways_bb_std_mult': 0.8902243313562057, 'sideways_rsi_os': 40, 'sideways_rsi_ob': 54, 'sideways_adx_thresh': 13.170064197521345, 'sideways_atr_min_pct': 0.023589310492203894, 'sideways_atr_max_pct': 0.11372669946739608, 'sideways_tp_mult': 1.8073734513869586, 'sideways_tsl_mult': 0.9644653116799985, 'sideways_time_stop': 169, 'sideways_use_sma': True, 'sideways_use_ema': True, 'sideways_use_atr': True, 'sideways_use_adx': True, 'sideways_use_spike': True, 'sideways_rsi_required': False}.
[I 2025-09-01 05:08:01,817] Trial 381 finished with values: [-1000000000.0, 1000000000.0] and parameters: {'p_sma': 46, 'p_std': 57, 'p_atr': 28, 'p_adx': 20, 'rsi_period': 11, 'ema1': 9, 'ema2': 31, 'slip_atr_k': 0.012985625098115836, 'slip_spread_k': 0.29237202725891, 'spread_hl_frac': 0.045425902489585945, 'bb_std_mult': 3.446035897169648, 'rsi_os': 22, 'rsi_ob': 85, 'vol_spike': 0.29093067018712193, 'adx_thresh': 15.27542911191637, 'atr_min_pct': 0.024707789567371102, 'atr_max_pct': 0.10657022209458736, 'tp_mult': 2.522576689122053, 'tsl_mult': 0.9789855801340028, 'strategy': 'mean_reversion', 'time_stop': 40, 'use_sma': False, 'use_atr': False, 'use_adx': False, 'use_ema': False, 'use_spike': True, 'rsi_required': False, 'edge_k': 0.4640844882964844, 'edge_cap': 0.51623788902216, 'bull_strategy': 'breakout', 'bull_bb_std_mult': 1.1449205936712419, 'bull_rsi_os': 25, 'bull_rsi_ob': 89, 'bull_adx_thresh': 18.63940002751653, 'bull_atr_min_pct': 0.020334575637612474, 'bull_atr_max_pct': 0.11818393689067835, 'bull_tp_mult': 1.471639554036096, 'bull_tsl_mult': 0.16446701318766072, 'bull_time_stop': 232, 'bull_use_sma': False, 'bull_use_ema': False, 'bull_use_atr': False, 'bull_use_adx': True, 'bull_use_spike': True, 'bull_rsi_required': True, 'bear_strategy': 'breakout', 'bear_bb_std_mult': 2.067962770268008, 'bear_rsi_os': 8, 'bear_rsi_ob': 65, 'bear_adx_thresh': 28.187457731192005, 'bear_atr_min_pct': 0.025523146847147037, 'bear_atr_max_pct': 0.053892449476237496, 'bear_tp_mult': 1.382807080072441, 'bear_tsl_mult': 0.6667343394509327, 'bear_time_stop': 150, 'bear_use_sma': True, 'bear_use_ema': False, 'bear_use_atr': False, 'bear_use_adx': False, 'bear_use_spike': True, 'bear_rsi_required': False, 'sideways_strategy': 'breakout', 'sideways_bb_std_mult': 0.8257538050215211, 'sideways_rsi_os': 43, 'sideways_rsi_ob': 56, 'sideways_adx_thresh': 13.204955960645869, 'sideways_atr_min_pct': 0.02348970249875965, 'sideways_atr_max_pct': 0.11376343695115004, 'sideways_tp_mult': 1.7012675822470391, 'sideways_tsl_mult': 0.9863927953163156, 'sideways_time_stop': 163, 'sideways_use_sma': True, 'sideways_use_ema': True, 'sideways_use_atr': True, 'sideways_use_adx': True, 'sideways_use_spike': True, 'sideways_rsi_required': False}.
[I 2025-09-01 05:08:03,049] Trial 383 finished with values: [-1000000000.0, 1000000000.0] and parameters: {'p_sma': 57, 'p_std': 57, 'p_atr': 21, 'p_adx': 20, 'rsi_period': 11, 'ema1': 28, 'ema2': 59, 'slip_atr_k': 0.14241341838551075, 'slip_spread_k': 0.3344713833994257, 'spread_hl_frac': 0.04555734226731938, 'bb_std_mult': 1.963269161983484, 'rsi_os': 22, 'rsi_ob': 85, 'vol_spike': 0.2284048877607413, 'adx_thresh': 13.757272867355663, 'atr_min_pct': 0.01027592354089081, 'atr_max_pct': 0.05005453004470875, 'tp_mult': 2.6988508186370206, 'tsl_mult': 0.9784490063970499, 'strategy': 'breakout', 'time_stop': 31, 'use_sma': False, 'use_atr': False, 'use_adx': False, 'use_ema': False, 'use_spike': True, 'rsi_required': False, 'edge_k': 1.0617943588342627, 'edge_cap': 0.5217339503700217, 'bull_strategy': 'breakout', 'bull_bb_std_mult': 1.066226980244818, 'bull_rsi_os': 24, 'bull_rsi_ob': 88, 'bull_adx_thresh': 18.169064017698922, 'bull_atr_min_pct': 0.002490987391106665, 'bull_atr_max_pct': 0.0949695367130807, 'bull_tp_mult': 1.4739563993114224, 'bull_tsl_mult': 0.257699584212734, 'bull_time_stop': 235, 'bull_use_sma': False, 'bull_use_ema': True, 'bull_use_atr': False, 'bull_use_adx': True, 'bull_use_spike': False, 'bull_rsi_required': True, 'bear_strategy': 'breakout', 'bear_bb_std_mult': 0.9005219356908203, 'bear_rsi_os': 8, 'bear_rsi_ob': 65, 'bear_adx_thresh': 28.963647595184746, 'bear_atr_min_pct': 0.022248098297472336, 'bear_atr_max_pct': 0.010123659893656864, 'bear_tp_mult': 1.3591572673631473, 'bear_tsl_mult': 0.6448209807749719, 'bear_time_stop': 37, 'bear_use_sma': True, 'bear_use_ema': False, 'bear_use_atr': False, 'bear_use_adx': False, 'bear_use_spike': False, 'bear_rsi_required': False, 'sideways_strategy': 'breakout', 'sideways_bb_std_mult': 0.9194862032040927, 'sideways_rsi_os': 43, 'sideways_rsi_ob': 54, 'sideways_adx_thresh': 30.964527011472583, 'sideways_atr_min_pct': 0.017562617657912213, 'sideways_atr_max_pct': 0.1180770301397434, 'sideways_tp_mult': 1.7221857253273885, 'sideways_tsl_mult': 0.9999449060440943, 'sideways_time_stop': 164, 'sideways_use_sma': False, 'sideways_use_ema': True, 'sideways_use_atr': True, 'sideways_use_adx': True, 'sideways_use_spike': True, 'sideways_rsi_required': True}.
[I 2025-09-01 05:08:48,850] Trial 385 finished with values: [-1000000000.0, 1000000000.0] and parameters: {'p_sma': 6, 'p_std': 31, 'p_atr': 18, 'p_adx': 22, 'rsi_period': 9, 'ema1': 12, 'ema2': 28, 'slip_atr_k': 0.14509132103148692, 'slip_spread_k': 0.8110206662471808, 'spread_hl_frac': 0.013624269692331034, 'bb_std_mult': 3.231646597621957, 'rsi_os': 24, 'rsi_ob': 85, 'vol_spike': 0.22522543388689198, 'adx_thresh': 6.221298596868136, 'atr_min_pct': 0.025588914497346408, 'atr_max_pct': 0.10657805428923241, 'tp_mult': 2.6995788931870455, 'tsl_mult': 0.4974297172128405, 'strategy': 'breakout', 'time_stop': 294, 'use_sma': False, 'use_atr': True, 'use_adx': False, 'use_ema': False, 'use_spike': True, 'rsi_required': False, 'edge_k': 1.4774489677777658, 'edge_cap': 0.468365766355136, 'bull_strategy': 'breakout', 'bull_bb_std_mult': 3.1409213054348433, 'bull_rsi_os': 26, 'bull_rsi_ob': 56, 'bull_adx_thresh': 17.122265022222557, 'bull_atr_min_pct': 0.01047309328151274, 'bull_atr_max_pct': 0.11904317066933745, 'bull_tp_mult': 2.7478247743569115, 'bull_tsl_mult': 0.41673411553775874, 'bull_time_stop': 233, 'bull_use_sma': False, 'bull_use_ema': True, 'bull_use_atr': False, 'bull_use_adx': False, 'bull_use_spike': False, 'bull_rsi_required': True, 'bear_strategy': 'mean_reversion', 'bear_bb_std_mult': 3.2735123474246164, 'bear_rsi_os': 15, 'bear_rsi_ob': 65, 'bear_adx_thresh': 29.13008053395399, 'bear_atr_min_pct': 0.029531967539306522, 'bear_atr_max_pct': 0.06638979935152196, 'bear_tp_mult': 1.3937802509826775, 'bear_tsl_mult': 0.6609136718310527, 'bear_time_stop': 270, 'bear_use_sma': True, 'bear_use_ema': False, 'bear_use_atr': False, 'bear_use_adx': False, 'bear_use_spike': False, 'bear_rsi_required': False, 'sideways_strategy': 'breakout', 'sideways_bb_std_mult': 2.841452206691925, 'sideways_rsi_os': 45, 'sideways_rsi_ob': 57, 'sideways_adx_thresh': 18.438295334397054, 'sideways_atr_min_pct': 0.023510757168050383, 'sideways_atr_max_pct': 0.10745624163272074, 'sideways_tp_mult': 1.72966402016081, 'sideways_tsl_mult': 0.881332199194498, 'sideways_time_stop': 194, 'sideways_use_sma': False, 'sideways_use_ema': False, 'sideways_use_atr': False, 'sideways_use_adx': True, 'sideways_use_spike': True, 'sideways_rsi_required': True}.
[I 2025-09-01 05:08:49,773] Trial 384 finished with values: [-1000000000.0, 1000000000.0] and parameters: {'p_sma': 6, 'p_std': 29, 'p_atr': 18, 'p_adx': 20, 'rsi_period': 11, 'ema1': 28, 'ema2': 28, 'slip_atr_k': 0.015471732277834528, 'slip_spread_k': 0.2661437447115659, 'spread_hl_frac': 0.009041597217138982, 'bb_std_mult': 3.4598818373287035, 'rsi_os': 24, 'rsi_ob': 85, 'vol_spike': 0.2242936026034384, 'adx_thresh': 13.811139336069415, 'atr_min_pct': 0.02403041984420087, 'atr_max_pct': 0.11372066654076628, 'tp_mult': 2.5179765888561287, 'tsl_mult': 0.6386657536786515, 'strategy': 'breakout', 'time_stop': 88, 'use_sma': False, 'use_atr': True, 'use_adx': False, 'use_ema': False, 'use_spike': True, 'rsi_required': False, 'edge_k': 0.597323236499234, 'edge_cap': 0.7709453726399185, 'bull_strategy': 'breakout', 'bull_bb_std_mult': 2.3890894956272115, 'bull_rsi_os': 26, 'bull_rsi_ob': 88, 'bull_adx_thresh': 18.17137105109342, 'bull_atr_min_pct': 0.020957671009546625, 'bull_atr_max_pct': 0.050482031599073024, 'bull_tp_mult': 2.1495702854620022, 'bull_tsl_mult': 0.7467846209820186, 'bull_time_stop': 233, 'bull_use_sma': False, 'bull_use_ema': True, 'bull_use_atr': False, 'bull_use_adx': True, 'bull_use_spike': False, 'bull_rsi_required': True, 'bear_strategy': 'breakout', 'bear_bb_std_mult': 0.7863722622962652, 'bear_rsi_os': 10, 'bear_rsi_ob': 92, 'bear_adx_thresh': 27.815098879172073, 'bear_atr_min_pct': 0.02697784458442023, 'bear_atr_max_pct': 0.059632266770456514, 'bear_tp_mult': 1.2687624045401023, 'bear_tsl_mult': 0.6653373937224514, 'bear_time_stop': 36, 'bear_use_sma': True, 'bear_use_ema': False, 'bear_use_atr': False, 'bear_use_adx': False, 'bear_use_spike': False, 'bear_rsi_required': False, 'sideways_strategy': 'breakout', 'sideways_bb_std_mult': 2.831501598870577, 'sideways_rsi_os': 40, 'sideways_rsi_ob': 53, 'sideways_adx_thresh': 13.777938835959475, 'sideways_atr_min_pct': 0.02355584220970576, 'sideways_atr_max_pct': 0.10684435200715808, 'sideways_tp_mult': 1.7144803421748362, 'sideways_tsl_mult': 0.11518442622215552, 'sideways_time_stop': 164, 'sideways_use_sma': False, 'sideways_use_ema': False, 'sideways_use_atr': True, 'sideways_use_adx': True, 'sideways_use_spike': True, 'sideways_rsi_required': True}.
[I 2025-09-01 05:08:49,811] Trial 387 finished with values: [-1000000000.0, 1000000000.0] and parameters: {'p_sma': 27, 'p_std': 55, 'p_atr': 15, 'p_adx': 16, 'rsi_period': 9, 'ema1': 15, 'ema2': 33, 'slip_atr_k': 0.2223547820135759, 'slip_spread_k': 0.935186729052672, 'spread_hl_frac': 0.014101599202614036, 'bb_std_mult': 3.278259205367827, 'rsi_os': 24, 'rsi_ob': 90, 'vol_spike': 0.193169916808477, 'adx_thresh': 12.878727592864855, 'atr_min_pct': 0.0256857090780263, 'atr_max_pct': 0.06673329660295109, 'tp_mult': 2.4796892514219224, 'tsl_mult': 0.9491967046369572, 'strategy': 'breakout', 'time_stop': 135, 'use_sma': False, 'use_atr': True, 'use_adx': False, 'use_ema': True, 'use_spike': False, 'rsi_required': False, 'edge_k': 0.11671660652938742, 'edge_cap': 0.4615665944975734, 'bull_strategy': 'breakout', 'bull_bb_std_mult': 2.2960513404275007, 'bull_rsi_os': 26, 'bull_rsi_ob': 47, 'bull_adx_thresh': 16.827019201448756, 'bull_atr_min_pct': 0.0019056086264375438, 'bull_atr_max_pct': 0.06951773379391595, 'bull_tp_mult': 2.2388900069521687, 'bull_tsl_mult': 0.4105534849162348, 'bull_time_stop': 36, 'bull_use_sma': True, 'bull_use_ema': True, 'bull_use_atr': False, 'bull_use_adx': False, 'bull_use_spike': False, 'bull_rsi_required': True, 'bear_strategy': 'mean_reversion', 'bear_bb_std_mult': 0.7939550477063737, 'bear_rsi_os': 10, 'bear_rsi_ob': 90, 'bear_adx_thresh': 30.18354186338008, 'bear_atr_min_pct': 0.02955650921956433, 'bear_atr_max_pct': 0.05984017902436975, 'bear_tp_mult': 1.2626873697719674, 'bear_tsl_mult': 0.6724391541248245, 'bear_time_stop': 9, 'bear_use_sma': True, 'bear_use_ema': False, 'bear_use_atr': False, 'bear_use_adx': False, 'bear_use_spike': False, 'bear_rsi_required': False, 'sideways_strategy': 'breakout', 'sideways_bb_std_mult': 0.7443854626965322, 'sideways_rsi_os': 45, 'sideways_rsi_ob': 53, 'sideways_adx_thresh': 18.33879306987732, 'sideways_atr_min_pct': 0.028433401903194568, 'sideways_atr_max_pct': 0.10631834421641985, 'sideways_tp_mult': 1.9297152117152263, 'sideways_tsl_mult': 0.11118541310054558, 'sideways_time_stop': 194, 'sideways_use_sma': False, 'sideways_use_ema': False, 'sideways_use_atr': False, 'sideways_use_adx': False, 'sideways_use_spike': True, 'sideways_rsi_required': True}.
