[I 2025-09-01 04:43:10,815] Trial 232 finished with values: [-0.028571180561448806, 0.028484942202977242] and parameters: {'p_sma': 15, 'p_std': 27, 'p_atr': 26, 'p_adx': 20, 'rsi_period': 64, 'ema1': 14, 'ema2': 27, 'slip_atr_k': 0.010230284456929382, 'slip_spread_k': 0.5380967857474095, 'spread_hl_frac': 0.016964179788736336, 'bb_std_mult': 0.8080715890379888, 'rsi_os': 13, 'rsi_ob': 53, 'vol_spike': 0.06346520376034266, 'adx_thresh': 14.835288792009834, 'atr_min_pct': 0.0011413064279952054, 'atr_max_pct': 0.07684618424604672, 'tp_mult': 2.582890797705308, 'tsl_mult': 0.09953106302859605, 'strategy': 'breakout', 'time_stop': 148, 'use_sma': True, 'use_atr': False, 'use_adx': True, 'use_ema': True, 'use_spike': True, 'rsi_required': False, 'edge_k': 0.47426497245266563, 'edge_cap': 0.25842316013035915, 'bull_strategy': 'breakout', 'bull_bb_std_mult': 2.2233551536553824, 'bull_rsi_os': 11, 'bull_rsi_ob': 87, 'bull_adx_thresh': 20.414422292808343, 'bull_atr_min_pct': 2.2141492537050577e-05, 'bull_atr_max_pct': 0.1311222253676074, 'bull_tp_mult': 2.754037649538294, 'bull_tsl_mult': 0.054290299833775146, 'bull_time_stop': 230, 'bull_use_sma': False, 'bull_use_ema': False, 'bull_use_atr': False, 'bull_use_adx': False, 'bull_use_spike': False, 'bull_rsi_required': True, 'bear_strategy': 'mean_reversion', 'bear_bb_std_mult': 1.8428110343167594, 'bear_rsi_os': 5, 'bear_rsi_ob': 58, 'bear_adx_thresh': 9.359116697416278, 'bear_atr_min_pct': 0.0028391872104427847, 'bear_atr_max_pct': 0.14988997775654345, 'bear_tp_mult': 1.121009256867623, 'bear_tsl_mult': 0.7841021411318694, 'bear_time_stop': 191, 'bear_use_sma': True, 'bear_use_ema': False, 'bear_use_atr': False, 'bear_use_adx': True, 'bear_use_spike': False, 'bear_rsi_required': False, 'sideways_strategy': 'breakout', 'sideways_bb_std_mult': 1.232718311466041, 'sideways_rsi_os': 22, 'sideways_rsi_ob': 47, 'sideways_adx_thresh': 15.278843428899565, 'sideways_atr_min_pct': 0.02150903102319538, 'sideways_atr_max_pct': 0.14976844773763714, 'sideways_tp_mult': 1.146977256701366, 'sideways_tsl_mult': 0.9227007880605465, 'sideways_time_stop': 193, 'sideways_use_sma': True, 'sideways_use_ema': True, 'sideways_use_atr': False, 'sideways_use_adx': True, 'sideways_use_spike': False, 'sideways_rsi_required': True}.
[I 2025-09-01 04:43:10,832] Trial 234 finished with values: [-0.0253514157130581, 0.025219343452714725] and parameters: {'p_sma': 15, 'p_std': 19, 'p_atr': 26, 'p_adx': 14, 'rsi_period': 60, 'ema1': 30, 'ema2': 29, 'slip_atr_k': 0.031005028766744824, 'slip_spread_k': 0.27676828385929875, 'spread_hl_frac': 0.04299808567974253, 'bb_std_mult': 1.0034281891844639, 'rsi_os': 47, 'rsi_ob': 67, 'vol_spike': 0.25345527535893847, 'adx_thresh': 28.044460949920346, 'atr_min_pct': 0.0009777008819085503, 'atr_max_pct': 0.11696452483669499, 'tp_mult': 2.438757279216377, 'tsl_mult': 0.9325222897261883, 'strategy': 'breakout', 'time_stop': 268, 'use_sma': True, 'use_atr': False, 'use_adx': False, 'use_ema': True, 'use_spike': True, 'rsi_required': False, 'edge_k': 1.2638891338561882, 'edge_cap': 0.5283028950813634, 'bull_strategy': 'mean_reversion', 'bull_bb_std_mult': 2.3846567051733376, 'bull_rsi_os': 36, 'bull_rsi_ob': 87, 'bull_adx_thresh': 29.458477829424304, 'bull_atr_min_pct': 0.0006498266632604325, 'bull_atr_max_pct': 0.13162183740370756, 'bull_tp_mult': 1.6318564077948914, 'bull_tsl_mult': 0.44057435118874805, 'bull_time_stop': 278, 'bull_use_sma': True, 'bull_use_ema': False, 'bull_use_atr': True, 'bull_use_adx': False, 'bull_use_spike': False, 'bull_rsi_required': False, 'bear_strategy': 'mean_reversion', 'bear_bb_std_mult': 2.7645064141710085, 'bear_rsi_os': 6, 'bear_rsi_ob': 55, 'bear_adx_thresh': 13.85031086718194, 'bear_atr_min_pct': 0.02470798318479592, 'bear_atr_max_pct': 0.14936946809595464, 'bear_tp_mult': 1.0965344766121223, 'bear_tsl_mult': 0.7321254694635686, 'bear_time_stop': 180, 'bear_use_sma': False, 'bear_use_ema': False, 'bear_use_atr': True, 'bear_use_adx': True, 'bear_use_spike': False, 'bear_rsi_required': False, 'sideways_strategy': 'breakout', 'sideways_bb_std_mult': 0.8150066043237456, 'sideways_rsi_os': 41, 'sideways_rsi_ob': 47, 'sideways_adx_thresh': 30.451979176370237, 'sideways_atr_min_pct': 0.024171367398257638, 'sideways_atr_max_pct': 0.09155677282051035, 'sideways_tp_mult': 2.8096992012861746, 'sideways_tsl_mult': 0.4152920997502988, 'sideways_time_stop': 263, 'sideways_use_sma': True, 'sideways_use_ema': True, 'sideways_use_atr': False, 'sideways_use_adx': False, 'sideways_use_spike': False, 'sideways_rsi_required': False}.
[I 2025-09-01 04:43:54,181] Trial 237 finished with values: [-1000000000.0, 1000000000.0] and parameters: {'p_sma': 15, 'p_std': 42, 'p_atr': 26, 'p_adx': 19, 'rsi_period': 64, 'ema1': 29, 'ema2': 34, 'slip_atr_k': 5.592138730112369e-06, 'slip_spread_k': 0.30052723201244136, 'spread_hl_frac': 0.017577994354117017, 'bb_std_mult': 0.8853623448949532, 'rsi_os': 48, 'rsi_ob': 57, 'vol_spike': 0.06158361620729663, 'adx_thresh': 14.508884677455267, 'atr_min_pct': 4.5649598034467795e-05, 'atr_max_pct': 0.11514516364646293, 'tp_mult': 1.2487622071042996, 'tsl_mult': 0.2537010461496999, 'strategy': 'breakout', 'time_stop': 268, 'use_sma': True, 'use_atr': False, 'use_adx': False, 'use_ema': False, 'use_spike': True, 'rsi_required': False, 'edge_k': 0.6236003532683811, 'edge_cap': 0.12172265870574103, 'bull_strategy': 'mean_reversion', 'bull_bb_std_mult': 2.321916894559641, 'bull_rsi_os': 28, 'bull_rsi_ob': 88, 'bull_adx_thresh': 24.44465521394976, 'bull_atr_min_pct': 0.0009289055268465158, 'bull_atr_max_pct': 0.033118609750254956, 'bull_tp_mult': 2.169218772348403, 'bull_tsl_mult': 0.42894854983289843, 'bull_time_stop': 219, 'bull_use_sma': True, 'bull_use_ema': True, 'bull_use_atr': True, 'bull_use_adx': False, 'bull_use_spike': False, 'bull_rsi_required': False, 'bear_strategy': 'mean_reversion', 'bear_bb_std_mult': 1.0708298103503906, 'bear_rsi_os': 10, 'bear_rsi_ob': 54, 'bear_adx_thresh': 6.280620113416887, 'bear_atr_min_pct': 0.00937384492057675, 'bear_atr_max_pct': 0.14496548312053995, 'bear_tp_mult': 1.1079954804988676, 'bear_tsl_mult': 0.1194307767116369, 'bear_time_stop': 183, 'bear_use_sma': True, 'bear_use_ema': False, 'bear_use_atr': True, 'bear_use_adx': True, 'bear_use_spike': True, 'bear_rsi_required': False, 'sideways_strategy': 'mean_reversion', 'sideways_bb_std_mult': 0.5457603421077772, 'sideways_rsi_os': 54, 'sideways_rsi_ob': 48, 'sideways_adx_thresh': 30.59033968441925, 'sideways_atr_min_pct': 0.023518028553082437, 'sideways_atr_max_pct': 0.09167883573649703, 'sideways_tp_mult': 2.7694581925682527, 'sideways_tsl_mult': 0.41158089949786497, 'sideways_time_stop': 64, 'sideways_use_sma': False, 'sideways_use_ema': True, 'sideways_use_atr': False, 'sideways_use_adx': False, 'sideways_use_spike': False, 'sideways_rsi_required': False}.
[I 2025-09-01 04:43:54,655] Trial 239 finished with values: [-1000000000.0, 1000000000.0] and parameters: {'p_sma': 17, 'p_std': 19, 'p_atr': 27, 'p_adx': 19, 'rsi_period': 77, 'ema1': 19, 'ema2': 34, 'slip_atr_k': 0.17892943434374856, 'slip_spread_k': 0.30698442056091696, 'spread_hl_frac': 0.03888531302922654, 'bb_std_mult': 2.394497332457566, 'rsi_os': 48, 'rsi_ob': 60, 'vol_spike': 0.24050322939485516, 'adx_thresh': 31.894998540673754, 'atr_min_pct': 3.2306583241244104e-05, 'atr_max_pct': 0.01732315663100671, 'tp_mult': 2.484150407626169, 'tsl_mult': 0.8802558983088478, 'strategy': 'breakout', 'time_stop': 20, 'use_sma': True, 'use_atr': False, 'use_adx': False, 'use_ema': False, 'use_spike': True, 'rsi_required': False, 'edge_k': 0.6224472594742276, 'edge_cap': 0.14720286480657066, 'bull_strategy': 'mean_reversion', 'bull_bb_std_mult': 2.3560589686335898, 'bull_rsi_os': 21, 'bull_rsi_ob': 90, 'bull_adx_thresh': 24.28935839419185, 'bull_atr_min_pct': 0.010858860580706734, 'bull_atr_max_pct': 0.09278672457731416, 'bull_tp_mult': 1.645335981244014, 'bull_tsl_mult': 0.441165551104166, 'bull_time_stop': 221, 'bull_use_sma': True, 'bull_use_ema': True, 'bull_use_atr': True, 'bull_use_adx': False, 'bull_use_spike': False, 'bull_rsi_required': False, 'bear_strategy': 'mean_reversion', 'bear_bb_std_mult': 1.3157771183315157, 'bear_rsi_os': 48, 'bear_rsi_ob': 55, 'bear_adx_thresh': 31.031303233616114, 'bear_atr_min_pct': 0.024472108857838824, 'bear_atr_max_pct': 0.14549942492601778, 'bear_tp_mult': 1.6492420854202343, 'bear_tsl_mult': 0.6753655377832712, 'bear_time_stop': 205, 'bear_use_sma': True, 'bear_use_ema': True, 'bear_use_atr': True, 'bear_use_adx': True, 'bear_use_spike': True, 'bear_rsi_required': False, 'sideways_strategy': 'mean_reversion', 'sideways_bb_std_mult': 1.4624321690512012, 'sideways_rsi_os': 6, 'sideways_rsi_ob': 48, 'sideways_adx_thresh': 16.810580562801547, 'sideways_atr_min_pct': 0.013641816794565912, 'sideways_atr_max_pct': 0.09717322728943162, 'sideways_tp_mult': 2.7667393374324156, 'sideways_tsl_mult': 0.9724074243103182, 'sideways_time_stop': 34, 'sideways_use_sma': False, 'sideways_use_ema': False, 'sideways_use_atr': False, 'sideways_use_adx': False, 'sideways_use_spike': True, 'sideways_rsi_required': False}.
[I 2025-09-01 04:43:54,860] Trial 236 finished with values: [-1000000000.0, 1000000000.0] and parameters: {'p_sma': 17, 'p_std': 22, 'p_atr': 26, 'p_adx': 19, 'rsi_period': 76, 'ema1': 11, 'ema2': 29, 'slip_atr_k': 0.008980961725978329, 'slip_spread_k': 0.7138317426855149, 'spread_hl_frac': 0.043276209084798505, 'bb_std_mult': 1.0067854224678072, 'rsi_os': 14, 'rsi_ob': 80, 'vol_spike': 0.23778061872274117, 'adx_thresh': 28.06660344621268, 'atr_min_pct': 6.970973198546361e-05, 'atr_max_pct': 0.11554149726759, 'tp_mult': 2.9590845071843113, 'tsl_mult': 0.6266266991246434, 'strategy': 'mean_reversion', 'time_stop': 153, 'use_sma': True, 'use_atr': False, 'use_adx': False, 'use_ema': True, 'use_spike': True, 'rsi_required': False, 'edge_k': 0.46544457127711136, 'edge_cap': 0.1246607620990289, 'bull_strategy': 'mean_reversion', 'bull_bb_std_mult': 2.3928573927668895, 'bull_rsi_os': 27, 'bull_rsi_ob': 87, 'bull_adx_thresh': 18.466375058749335, 'bull_atr_min_pct': 0.02101324128097659, 'bull_atr_max_pct': 0.02207575313163075, 'bull_tp_mult': 1.5446115596401326, 'bull_tsl_mult': 0.36061367749136014, 'bull_time_stop': 203, 'bull_use_sma': True, 'bull_use_ema': False, 'bull_use_atr': True, 'bull_use_adx': False, 'bull_use_spike': False, 'bull_rsi_required': False, 'bear_strategy': 'mean_reversion', 'bear_bb_std_mult': 1.1039576853244162, 'bear_rsi_os': 6, 'bear_rsi_ob': 93, 'bear_adx_thresh': 17.933068246803117, 'bear_atr_min_pct': 0.009222236207687081, 'bear_atr_max_pct': 0.14571476044649123, 'bear_tp_mult': 1.0518954874160409, 'bear_tsl_mult': 0.11382959076518688, 'bear_time_stop': 185, 'bear_use_sma': True, 'bear_use_ema': False, 'bear_use_atr': True, 'bear_use_adx': False, 'bear_use_spike': False, 'bear_rsi_required': False, 'sideways_strategy': 'mean_reversion', 'sideways_bb_std_mult': 2.1058556461005127, 'sideways_rsi_os': 6, 'sideways_rsi_ob': 48, 'sideways_adx_thresh': 16.73105786637295, 'sideways_atr_min_pct': 0.023742565092110823, 'sideways_atr_max_pct': 0.0963932641196986, 'sideways_tp_mult': 2.787455826597793, 'sideways_tsl_mult': 0.2275872573458111, 'sideways_time_stop': 17, 'sideways_use_sma': False, 'sideways_use_ema': True, 'sideways_use_atr': False, 'sideways_use_adx': False, 'sideways_use_spike': False, 'sideways_rsi_required': False}.
[I 2025-09-01 04:43:55,151] Trial 238 finished with values: [-0.04172866806098319, 0.04155573498722332] and parameters: {'p_sma': 15, 'p_std': 16, 'p_atr': 24, 'p_adx': 19, 'rsi_period': 63, 'ema1': 18, 'ema2': 13, 'slip_atr_k': 0.015457564471881775, 'slip_spread_k': 0.004135128909387553, 'spread_hl_frac': 0.017864984595437935, 'bb_std_mult': 1.0754772689056595, 'rsi_os': 48, 'rsi_ob': 60, 'vol_spike': 0.06342676124038488, 'adx_thresh': 24.696737198266526, 'atr_min_pct': 0.0016782682942650439, 'atr_max_pct': 0.09990350418700855, 'tp_mult': 2.0565123298435375, 'tsl_mult': 0.2703480481358218, 'strategy': 'breakout', 'time_stop': 19, 'use_sma': True, 'use_atr': False, 'use_adx': False, 'use_ema': False, 'use_spike': True, 'rsi_required': False, 'edge_k': 0.6340743615000116, 'edge_cap': 0.12389743451387529, 'bull_strategy': 'mean_reversion', 'bull_bb_std_mult': 2.3605848949491297, 'bull_rsi_os': 28, 'bull_rsi_ob': 88, 'bull_adx_thresh': 18.48510593852866, 'bull_atr_min_pct': 0.0010216488934277038, 'bull_atr_max_pct': 0.12578304702137177, 'bull_tp_mult': 1.5329850622027363, 'bull_tsl_mult': 0.43458796323714854, 'bull_time_stop': 46, 'bull_use_sma': True, 'bull_use_ema': True, 'bull_use_atr': False, 'bull_use_adx': False, 'bull_use_spike': False, 'bull_rsi_required': True, 'bear_strategy': 'mean_reversion', 'bear_bb_std_mult': 2.7404252016831094, 'bear_rsi_os': 48, 'bear_rsi_ob': 54, 'bear_adx_thresh': 7.087023919796927, 'bear_atr_min_pct': 0.0014719990123244157, 'bear_atr_max_pct': 0.14533529195679937, 'bear_tp_mult': 1.9495427995482915, 'bear_tsl_mult': 0.9494354664304216, 'bear_time_stop': 185, 'bear_use_sma': True, 'bear_use_ema': False, 'bear_use_atr': True, 'bear_use_adx': True, 'bear_use_spike': False, 'bear_rsi_required': False, 'sideways_strategy': 'mean_reversion', 'sideways_bb_std_mult': 1.9445217901941816, 'sideways_rsi_os': 6, 'sideways_rsi_ob': 48, 'sideways_adx_thresh': 15.376610475992406, 'sideways_atr_min_pct': 0.021817373377194953, 'sideways_atr_max_pct': 0.0916811893166975, 'sideways_tp_mult': 2.7561935408576352, 'sideways_tsl_mult': 0.964610022804131, 'sideways_time_stop': 262, 'sideways_use_sma': False, 'sideways_use_ema': True, 'sideways_use_atr': False, 'sideways_use_adx': False, 'sideways_use_spike': False, 'sideways_rsi_required': False}.
[I 2025-09-01 04:43:55,910] Trial 240 finished with values: [-1000000000.0, 1000000000.0] and parameters: {'p_sma': 28, 'p_std': 19, 'p_atr': 27, 'p_adx': 14, 'rsi_period': 9, 'ema1': 19, 'ema2': 35, 'slip_atr_k': 0.14119696757453754, 'slip_spread_k': 0.6874609686020146, 'spread_hl_frac': 0.02166369713177567, 'bb_std_mult': 1.0756205376855592, 'rsi_os': 55, 'rsi_ob': 64, 'vol_spike': 0.0805623828352043, 'adx_thresh': 25.015310897320553, 'atr_min_pct': 0.0016356257094843965, 'atr_max_pct': 0.0989470346804813, 'tp_mult': 2.481508292926389, 'tsl_mult': 0.3223655653073353, 'strategy': 'mean_reversion', 'time_stop': 19, 'use_sma': False, 'use_atr': False, 'use_adx': False, 'use_ema': True, 'use_spike': True, 'rsi_required': False, 'edge_k': 0.5810939081368179, 'edge_cap': 0.15365362370365238, 'bull_strategy': 'mean_reversion', 'bull_bb_std_mult': 1.382361762933498, 'bull_rsi_os': 5, 'bull_rsi_ob': 90, 'bull_adx_thresh': 18.688555842698843, 'bull_atr_min_pct': 0.0022539599594490443, 'bull_atr_max_pct': 0.1261205973362359, 'bull_tp_mult': 1.5430104884904108, 'bull_tsl_mult': 0.38510769700773345, 'bull_time_stop': 205, 'bull_use_sma': True, 'bull_use_ema': False, 'bull_use_atr': True, 'bull_use_adx': False, 'bull_use_spike': False, 'bull_rsi_required': False, 'bear_strategy': 'mean_reversion', 'bear_bb_std_mult': 2.5492428018911273, 'bear_rsi_os': 47, 'bear_rsi_ob': 74, 'bear_adx_thresh': 12.3271210808622, 'bear_atr_min_pct': 0.02950269648221257, 'bear_atr_max_pct': 0.1421006811838794, 'bear_tp_mult': 1.017402356480912, 'bear_tsl_mult': 0.9979195668510985, 'bear_time_stop': 42, 'bear_use_sma': True, 'bear_use_ema': True, 'bear_use_atr': True, 'bear_use_adx': False, 'bear_use_spike': False, 'bear_rsi_required': True, 'sideways_strategy': 'mean_reversion', 'sideways_bb_std_mult': 1.9414427452922123, 'sideways_rsi_os': 41, 'sideways_rsi_ob': 48, 'sideways_adx_thresh': 16.52103335331862, 'sideways_atr_min_pct': 0.024367454178815334, 'sideways_atr_max_pct': 0.09643861577428842, 'sideways_tp_mult': 2.77538484673335, 'sideways_tsl_mult': 0.9796798766727608, 'sideways_time_stop': 205, 'sideways_use_sma': True, 'sideways_use_ema': False, 'sideways_use_atr': False, 'sideways_use_adx': False, 'sideways_use_spike': True, 'sideways_rsi_required': False}.
[I 2025-09-01 04:44:35,679] Trial 242 finished with values: [-0.016952584873804466, 0.016741346002041343] and parameters: {'p_sma': 57, 'p_std': 16, 'p_atr': 25, 'p_adx': 22, 'rsi_period': 41, 'ema1': 29, 'ema2': 54, 'slip_atr_k': 0.13803373841152036, 'slip_spread_k': 0.7684944133248112, 'spread_hl_frac': 0.027757993567617288, 'bb_std_mult': 3.3922881602929698, 'rsi_os': 38, 'rsi_ob': 55, 'vol_spike': 0.07779949604575745, 'adx_thresh': 15.431194233020666, 'atr_min_pct': 0.0015799530116313986, 'atr_max_pct': 0.09888096860434785, 'tp_mult': 2.4421425566854387, 'tsl_mult': 0.9364392596875926, 'strategy': 'breakout', 'time_stop': 118, 'use_sma': False, 'use_atr': True, 'use_adx': False, 'use_ema': True, 'use_spike': False, 'rsi_required': False, 'edge_k': 0.05113640733467084, 'edge_cap': 0.16874669144571847, 'bull_strategy': 'breakout', 'bull_bb_std_mult': 2.137174939911726, 'bull_rsi_os': 30, 'bull_rsi_ob': 95, 'bull_adx_thresh': 29.071127922751106, 'bull_atr_min_pct': 0.0017211259995715737, 'bull_atr_max_pct': 0.041882218241252496, 'bull_tp_mult': 2.8870757812828014, 'bull_tsl_mult': 0.38372253669404893, 'bull_time_stop': 44, 'bull_use_sma': True, 'bull_use_ema': False, 'bull_use_atr': False, 'bull_use_adx': True, 'bull_use_spike': False, 'bull_rsi_required': True, 'bear_strategy': 'breakout', 'bear_bb_std_mult': 2.7538481679086217, 'bear_rsi_os': 47, 'bear_rsi_ob': 81, 'bear_adx_thresh': 7.157946740541647, 'bear_atr_min_pct': 0.029381635270765302, 'bear_atr_max_pct': 0.1414277379307227, 'bear_tp_mult': 1.0109950348723518, 'bear_tsl_mult': 0.15063441032341543, 'bear_time_stop': 43, 'bear_use_sma': True, 'bear_use_ema': False, 'bear_use_atr': True, 'bear_use_adx': True, 'bear_use_spike': False, 'bear_rsi_required': True, 'sideways_strategy': 'mean_reversion', 'sideways_bb_std_mult': 2.664836349265324, 'sideways_rsi_os': 8, 'sideways_rsi_ob': 92, 'sideways_adx_thresh': 22.050459316371168, 'sideways_atr_min_pct': 0.012011113864842186, 'sideways_atr_max_pct': 0.0527066743228181, 'sideways_tp_mult': 2.863777042011073, 'sideways_tsl_mult': 0.14272811894140225, 'sideways_time_stop': 265, 'sideways_use_sma': True, 'sideways_use_ema': False, 'sideways_use_atr': True, 'sideways_use_adx': False, 'sideways_use_spike': False, 'sideways_rsi_required': False}.
[I 2025-09-01 04:44:37,345] Trial 243 finished with values: [-1000000000.0, 1000000000.0] and parameters: {'p_sma': 57, 'p_std': 44, 'p_atr': 8, 'p_adx': 25, 'rsi_period': 59, 'ema1': 29, 'ema2': 56, 'slip_atr_k': 0.00445667899503778, 'slip_spread_k': 0.7712381395928762, 'spread_hl_frac': 0.027509458050481238, 'bb_std_mult': 0.8888466720531247, 'rsi_os': 46, 'rsi_ob': 65, 'vol_spike': 0.17151766726265874, 'adx_thresh': 14.137632997287952, 'atr_min_pct': 0.0008661839782040547, 'atr_max_pct': 0.068381894847671, 'tp_mult': 2.4485718877119576, 'tsl_mult': 0.014462164367117558, 'strategy': 'mean_reversion', 'time_stop': 28, 'use_sma': False, 'use_atr': True, 'use_adx': True, 'use_ema': True, 'use_spike': False, 'rsi_required': True, 'edge_k': 0.04690578673394197, 'edge_cap': 0.16779157007973433, 'bull_strategy': 'breakout', 'bull_bb_std_mult': 3.030330531904924, 'bull_rsi_os': 47, 'bull_rsi_ob': 90, 'bull_adx_thresh': 19.459776087214777, 'bull_atr_min_pct': 0.0025595361460447903, 'bull_atr_max_pct': 0.12753656252267329, 'bull_tp_mult': 1.4574781304161477, 'bull_tsl_mult': 0.8370014257719112, 'bull_time_stop': 213, 'bull_use_sma': True, 'bull_use_ema': False, 'bull_use_atr': True, 'bull_use_adx': True, 'bull_use_spike': True, 'bull_rsi_required': False, 'bear_strategy': 'breakout', 'bear_bb_std_mult': 2.528133907688416, 'bear_rsi_os': 46, 'bear_rsi_ob': 57, 'bear_adx_thresh': 12.600005194560584, 'bear_atr_min_pct': 0.029202002243871324, 'bear_atr_max_pct': 0.14182709469855762, 'bear_tp_mult': 1.0177365724437402, 'bear_tsl_mult': 0.1450037780319991, 'bear_time_stop': 211, 'bear_use_sma': False, 'bear_use_ema': True, 'bear_use_atr': False, 'bear_use_adx': True, 'bear_use_spike': False, 'bear_rsi_required': True, 'sideways_strategy': 'mean_reversion', 'sideways_bb_std_mult': 1.6714666483770309, 'sideways_rsi_os': 17, 'sideways_rsi_ob': 50, 'sideways_adx_thresh': 17.800475803136592, 'sideways_atr_min_pct': 0.02554488254769332, 'sideways_atr_max_pct': 0.052738244080749556, 'sideways_tp_mult': 2.85100254965816, 'sideways_tsl_mult': 0.49911225115229724, 'sideways_time_stop': 119, 'sideways_use_sma': True, 'sideways_use_ema': False, 'sideways_use_atr': True, 'sideways_use_adx': False, 'sideways_use_spike': True, 'sideways_rsi_required': True}.
