[I 2025-09-01 05:11:12,079] Trial 398 finished with values: [-1000000000.0, 1000000000.0] and parameters: {'p_sma': 25, 'p_std': 35, 'p_atr': 29, 'p_adx': 17, 'rsi_period': 32, 'ema1': 13, 'ema2': 29, 'slip_atr_k': 0.01376949537773306, 'slip_spread_k': 0.40897303704888693, 'spread_hl_frac': 0.022334203156535434, 'bb_std_mult': 1.569061164065298, 'rsi_os': 21, 'rsi_ob': 86, 'vol_spike': 0.22048309926192625, 'adx_thresh': 28.11289098252719, 'atr_min_pct': 0.016368323398702225, 'atr_max_pct': 0.030531181289400855, 'tp_mult': 1.5970187067821542, 'tsl_mult': 0.40989024958918574, 'strategy': 'mean_reversion', 'time_stop': 203, 'use_sma': False, 'use_atr': False, 'use_adx': False, 'use_ema': True, 'use_spike': True, 'rsi_required': False, 'edge_k': 0.5669054780093015, 'edge_cap': 0.5047940133877618, 'bull_strategy': 'breakout', 'bull_bb_std_mult': 2.555581583258954, 'bull_rsi_os': 24, 'bull_rsi_ob': 67, 'bull_adx_thresh': 16.412007783630553, 'bull_atr_min_pct': 0.005697397041068199, 'bull_atr_max_pct': 0.12341380611790861, 'bull_tp_mult': 1.627939875689223, 'bull_tsl_mult': 0.07688065652771453, 'bull_time_stop': 101, 'bull_use_sma': True, 'bull_use_ema': False, 'bull_use_atr': False, 'bull_use_adx': False, 'bull_use_spike': True, 'bull_rsi_required': True, 'bear_strategy': 'mean_reversion', 'bear_bb_std_mult': 0.857580267595662, 'bear_rsi_os': 9, 'bear_rsi_ob': 66, 'bear_adx_thresh': 26.912247980091685, 'bear_atr_min_pct': 0.028621185188898706, 'bear_atr_max_pct': 0.036942835447296624, 'bear_tp_mult': 1.3158855130356621, 'bear_tsl_mult': 0.690191061434293, 'bear_time_stop': 130, 'bear_use_sma': True, 'bear_use_ema': False, 'bear_use_atr': False, 'bear_use_adx': False, 'bear_use_spike': True, 'bear_rsi_required': False, 'sideways_strategy': 'breakout', 'sideways_bb_std_mult': 2.585219479609126, 'sideways_rsi_os': 41, 'sideways_rsi_ob': 55, 'sideways_adx_thresh': 10.71675936778159, 'sideways_atr_min_pct': 0.02950398178222948, 'sideways_atr_max_pct': 0.03988782830919925, 'sideways_tp_mult': 1.6476007814173086, 'sideways_tsl_mult': 0.7332040300083122, 'sideways_time_stop': 171, 'sideways_use_sma': True, 'sideways_use_ema': True, 'sideways_use_atr': False, 'sideways_use_adx': False, 'sideways_use_spike': True, 'sideways_rsi_required': False}.
[I 2025-09-01 05:11:12,628] Trial 396 finished with values: [-0.016169220718701083, 0.01601171632190773] and parameters: {'p_sma': 25, 'p_std': 59, 'p_atr': 27, 'p_adx': 18, 'rsi_period': 8, 'ema1': 13, 'ema2': 47, 'slip_atr_k': 0.008474280703302011, 'slip_spread_k': 0.28856400452407077, 'spread_hl_frac': 0.031109009821805592, 'bb_std_mult': 3.3769218223207487, 'rsi_os': 22, 'rsi_ob': 88, 'vol_spike': 0.21660082628951224, 'adx_thresh': 34.926881240583995, 'atr_min_pct': 0.005003159425279159, 'atr_max_pct': 0.09034719463057711, 'tp_mult': 1.6126319493018637, 'tsl_mult': 0.36606626421276023, 'strategy': 'breakout', 'time_stop': 166, 'use_sma': False, 'use_atr': False, 'use_adx': False, 'use_ema': True, 'use_spike': True, 'rsi_required': False, 'edge_k': 1.2098827200016502, 'edge_cap': 0.5017843349072973, 'bull_strategy': 'breakout', 'bull_bb_std_mult': 2.5680700282807822, 'bull_rsi_os': 25, 'bull_rsi_ob': 79, 'bull_adx_thresh': 16.19581051838133, 'bull_atr_min_pct': 0.0012592277788641701, 'bull_atr_max_pct': 0.07932515573596931, 'bull_tp_mult': 1.5897214579294725, 'bull_tsl_mult': 0.38548682075727625, 'bull_time_stop': 242, 'bull_use_sma': True, 'bull_use_ema': False, 'bull_use_atr': False, 'bull_use_adx': False, 'bull_use_spike': False, 'bull_rsi_required': True, 'bear_strategy': 'mean_reversion', 'bear_bb_std_mult': 0.881665573131244, 'bear_rsi_os': 9, 'bear_rsi_ob': 80, 'bear_adx_thresh': 18.598629191276995, 'bear_atr_min_pct': 0.02927914345742734, 'bear_atr_max_pct': 0.05851220313764876, 'bear_tp_mult': 1.206997347770961, 'bear_tsl_mult': 0.6287645784209581, 'bear_time_stop': 128, 'bear_use_sma': True, 'bear_use_ema': False, 'bear_use_atr': False, 'bear_use_adx': False, 'bear_use_spike': False, 'bear_rsi_required': False, 'sideways_strategy': 'breakout', 'sideways_bb_std_mult': 0.6828275204057339, 'sideways_rsi_os': 42, 'sideways_rsi_ob': 88, 'sideways_adx_thresh': 22.526798165748815, 'sideways_atr_min_pct': 0.020498450210578664, 'sideways_atr_max_pct': 0.11010261233220629, 'sideways_tp_mult': 2.56085967673221, 'sideways_tsl_mult': 0.9656423233013618, 'sideways_time_stop': 185, 'sideways_use_sma': True, 'sideways_use_ema': True, 'sideways_use_atr': False, 'sideways_use_adx': False, 'sideways_use_spike': True, 'sideways_rsi_required': False}.
[I 2025-09-01 05:11:13,116] Trial 399 finished with values: [-1000000000.0, 1000000000.0] and parameters: {'p_sma': 25, 'p_std': 10, 'p_atr': 28, 'p_adx': 17, 'rsi_period': 8, 'ema1': 28, 'ema2': 33, 'slip_atr_k': 0.22873285095845486, 'slip_spread_k': 0.8704142588087018, 'spread_hl_frac': 0.046833775098633804, 'bb_std_mult': 3.0615917248329376, 'rsi_os': 21, 'rsi_ob': 86, 'vol_spike': 0.2195911783764914, 'adx_thresh': 32.11124828934916, 'atr_min_pct': 0.005150742185668114, 'atr_max_pct': 0.11094502502913804, 'tp_mult': 1.620324183571403, 'tsl_mult': 0.961178295132223, 'strategy': 'mean_reversion', 'time_stop': 49, 'use_sma': False, 'use_atr': False, 'use_adx': False, 'use_ema': True, 'use_spike': True, 'rsi_required': False, 'edge_k': 0.5545551308990933, 'edge_cap': 0.5052335747465957, 'bull_strategy': 'breakout', 'bull_bb_std_mult': 2.6223240161525885, 'bull_rsi_os': 24, 'bull_rsi_ob': 92, 'bull_adx_thresh': 16.199720138011628, 'bull_atr_min_pct': 0.011263247940165111, 'bull_atr_max_pct': 0.09813481891724128, 'bull_tp_mult': 1.011648019004584, 'bull_tsl_mult': 0.3928032177085613, 'bull_time_stop': 239, 'bull_use_sma': True, 'bull_use_ema': False, 'bull_use_atr': False, 'bull_use_adx': True, 'bull_use_spike': True, 'bull_rsi_required': True, 'bear_strategy': 'breakout', 'bear_bb_std_mult': 0.8924342102793899, 'bear_rsi_os': 9, 'bear_rsi_ob': 64, 'bear_adx_thresh': 26.79629748384963, 'bear_atr_min_pct': 0.01279126733896285, 'bear_atr_max_pct': 0.03836155654043045, 'bear_tp_mult': 1.30518068604299, 'bear_tsl_mult': 0.6322685782830252, 'bear_time_stop': 213, 'bear_use_sma': True, 'bear_use_ema': False, 'bear_use_atr': False, 'bear_use_adx': False, 'bear_use_spike': True, 'bear_rsi_required': False, 'sideways_strategy': 'breakout', 'sideways_bb_std_mult': 2.9549416412149148, 'sideways_rsi_os': 42, 'sideways_rsi_ob': 55, 'sideways_adx_thresh': 9.510011298151964, 'sideways_atr_min_pct': 0.024975687512003755, 'sideways_atr_max_pct': 0.10840554590148026, 'sideways_tp_mult': 1.3297670106184196, 'sideways_tsl_mult': 0.9698962577332849, 'sideways_time_stop': 235, 'sideways_use_sma': True, 'sideways_use_ema': True, 'sideways_use_atr': True, 'sideways_use_adx': False, 'sideways_use_spike': True, 'sideways_rsi_required': False}.
[I 2025-09-01 05:11:13,578] Trial 397 finished with values: [-0.06337580571376167, 0.06320057491700813] and parameters: {'p_sma': 25, 'p_std': 10, 'p_atr': 27, 'p_adx': 19, 'rsi_period': 28, 'ema1': 27, 'ema2': 29, 'slip_atr_k': 0.20142446753923418, 'slip_spread_k': 0.3148555531223619, 'spread_hl_frac': 0.026499334835048315, 'bb_std_mult': 3.0656050493415528, 'rsi_os': 21, 'rsi_ob': 86, 'vol_spike': 0.21315327905386733, 'adx_thresh': 27.88132938708796, 'atr_min_pct': 0.023669540941335037, 'atr_max_pct': 0.11153469884681397, 'tp_mult': 1.6161651494981262, 'tsl_mult': 0.697319095305563, 'strategy': 'mean_reversion', 'time_stop': 94, 'use_sma': False, 'use_atr': False, 'use_adx': False, 'use_ema': True, 'use_spike': True, 'rsi_required': False, 'edge_k': 0.2466539453042237, 'edge_cap': 0.4999701112193631, 'bull_strategy': 'breakout', 'bull_bb_std_mult': 2.6566873370334783, 'bull_rsi_os': 24, 'bull_rsi_ob': 67, 'bull_adx_thresh': 16.413982007621446, 'bull_atr_min_pct': 0.0011282314078651177, 'bull_atr_max_pct': 0.0743977752150932, 'bull_tp_mult': 1.6197055250440755, 'bull_tsl_mult': 0.10123012083471938, 'bull_time_stop': 19, 'bull_use_sma': True, 'bull_use_ema': False, 'bull_use_atr': False, 'bull_use_adx': False, 'bull_use_spike': True, 'bull_rsi_required': True, 'bear_strategy': 'mean_reversion', 'bear_bb_std_mult': 0.8578488369179366, 'bear_rsi_os': 9, 'bear_rsi_ob': 71, 'bear_adx_thresh': 26.65542449798683, 'bear_atr_min_pct': 0.020579041807553707, 'bear_atr_max_pct': 0.0677909443914588, 'bear_tp_mult': 1.2951548547244907, 'bear_tsl_mult': 0.9822797425428709, 'bear_time_stop': 128, 'bear_use_sma': True, 'bear_use_ema': False, 'bear_use_atr': False, 'bear_use_adx': False, 'bear_use_spike': True, 'bear_rsi_required': False, 'sideways_strategy': 'breakout', 'sideways_bb_std_mult': 0.7681290856772078, 'sideways_rsi_os': 42, 'sideways_rsi_ob': 52, 'sideways_adx_thresh': 10.787346449340111, 'sideways_atr_min_pct': 0.02931538506810353, 'sideways_atr_max_pct': 0.10923535125764064, 'sideways_tp_mult': 1.3410876813977066, 'sideways_tsl_mult': 0.9669359619554171, 'sideways_time_stop': 173, 'sideways_use_sma': True, 'sideways_use_ema': True, 'sideways_use_atr': False, 'sideways_use_adx': False, 'sideways_use_spike': True, 'sideways_rsi_required': False}.
[I 2025-09-01 05:11:53,026] Trial 402 finished with values: [-1000000000.0, 1000000000.0] and parameters: {'p_sma': 58, 'p_std': 49, 'p_atr': 27, 'p_adx': 25, 'rsi_period': 7, 'ema1': 11, 'ema2': 28, 'slip_atr_k': 0.24942796978166804, 'slip_spread_k': 0.2913832195960587, 'spread_hl_frac': 0.04914167334235897, 'bb_std_mult': 3.340331111733395, 'rsi_os': 24, 'rsi_ob': 87, 'vol_spike': 0.21456372643873028, 'adx_thresh': 15.99675762442052, 'atr_min_pct': 0.023660617263021266, 'atr_max_pct': 0.11411710510348763, 'tp_mult': 2.4825593287650167, 'tsl_mult': 0.07927378376941258, 'strategy': 'breakout', 'time_stop': 173, 'use_sma': False, 'use_atr': False, 'use_adx': True, 'use_ema': False, 'use_spike': False, 'rsi_required': True, 'edge_k': 0.5137159021634996, 'edge_cap': 0.46620310654412017, 'bull_strategy': 'breakout', 'bull_bb_std_mult': 1.9923187308872494, 'bull_rsi_os': 26, 'bull_rsi_ob': 66, 'bull_adx_thresh': 33.49904353439027, 'bull_atr_min_pct': 0.00046863852120971054, 'bull_atr_max_pct': 0.07825710350268272, 'bull_tp_mult': 2.5239045237027016, 'bull_tsl_mult': 0.9162934031834483, 'bull_time_stop': 241, 'bull_use_sma': False, 'bull_use_ema': False, 'bull_use_atr': False, 'bull_use_adx': False, 'bull_use_spike': False, 'bull_rsi_required': True, 'bear_strategy': 'mean_reversion', 'bear_bb_std_mult': 1.7233819097003853, 'bear_rsi_os': 10, 'bear_rsi_ob': 67, 'bear_adx_thresh': 27.64138023019939, 'bear_atr_min_pct': 0.029230514623505933, 'bear_atr_max_pct': 0.06973367827006703, 'bear_tp_mult': 1.4556243854854292, 'bear_tsl_mult': 0.5989154274061538, 'bear_time_stop': 211, 'bear_use_sma': False, 'bear_use_ema': True, 'bear_use_atr': False, 'bear_use_adx': False, 'bear_use_spike': False, 'bear_rsi_required': True, 'sideways_strategy': 'breakout', 'sideways_bb_std_mult': 0.7780304905568309, 'sideways_rsi_os': 42, 'sideways_rsi_ob': 55, 'sideways_adx_thresh': 20.599007074192603, 'sideways_atr_min_pct': 0.02729785327509738, 'sideways_atr_max_pct': 0.10954285397625271, 'sideways_tp_mult': 1.4137400692314501, 'sideways_tsl_mult': 0.0019849216541731884, 'sideways_time_stop': 47, 'sideways_use_sma': True, 'sideways_use_ema': False, 'sideways_use_atr': False, 'sideways_use_adx': True, 'sideways_use_spike': True, 'sideways_rsi_required': False}.
[I 2025-09-01 05:11:53,454] Trial 403 finished with values: [-0.015633738314626333, 0.015486791074652883] and parameters: {'p_sma': 24, 'p_std': 37, 'p_atr': 27, 'p_adx': 15, 'rsi_period': 34, 'ema1': 29, 'ema2': 38, 'slip_atr_k': 0.004569943090378275, 'slip_spread_k': 0.0027064454711067665, 'spread_hl_frac': 0.030511329081051478, 'bb_std_mult': 3.4840797265201755, 'rsi_os': 24, 'rsi_ob': 87, 'vol_spike': 0.21661709075696073, 'adx_thresh': 10.953785022078613, 'atr_min_pct': 0.022520555401992343, 'atr_max_pct': 0.09986871744629112, 'tp_mult': 2.468690267853857, 'tsl_mult': 0.35269310284560906, 'strategy': 'breakout', 'time_stop': 169, 'use_sma': False, 'use_atr': False, 'use_adx': True, 'use_ema': False, 'use_spike': False, 'rsi_required': True, 'edge_k': 0.6056000691603758, 'edge_cap': 0.4718625845874041, 'bull_strategy': 'breakout', 'bull_bb_std_mult': 2.8907567641825467, 'bull_rsi_os': 26, 'bull_rsi_ob': 63, 'bull_adx_thresh': 33.479442353367745, 'bull_atr_min_pct': 0.0003629240306343533, 'bull_atr_max_pct': 0.11623142655167912, 'bull_tp_mult': 1.9469285437304193, 'bull_tsl_mult': 0.696242293291599, 'bull_time_stop': 243, 'bull_use_sma': False, 'bull_use_ema': False, 'bull_use_atr': False, 'bull_use_adx': True, 'bull_use_spike': False, 'bull_rsi_required': True, 'bear_strategy': 'breakout', 'bear_bb_std_mult': 1.7432734127864873, 'bear_rsi_os': 12, 'bear_rsi_ob': 67, 'bear_adx_thresh': 8.978536821400063, 'bear_atr_min_pct': 0.024460981490282203, 'bear_atr_max_pct': 0.05878282536178071, 'bear_tp_mult': 2.521307625083406, 'bear_tsl_mult': 0.6027933379995457, 'bear_time_stop': 209, 'bear_use_sma': False, 'bear_use_ema': True, 'bear_use_atr': False, 'bear_use_adx': False, 'bear_use_spike': False, 'bear_rsi_required': True, 'sideways_strategy': 'breakout', 'sideways_bb_std_mult': 0.7750584991996766, 'sideways_rsi_os': 42, 'sideways_rsi_ob': 55, 'sideways_adx_thresh': 14.517701068530137, 'sideways_atr_min_pct': 0.020533979956569803, 'sideways_atr_max_pct': 0.11246720236992118, 'sideways_tp_mult': 2.5472448550575995, 'sideways_tsl_mult': 0.977777406186588, 'sideways_time_stop': 177, 'sideways_use_sma': True, 'sideways_use_ema': False, 'sideways_use_atr': True, 'sideways_use_adx': True, 'sideways_use_spike': True, 'sideways_rsi_required': True}.
[I 2025-09-01 05:11:53,652] Trial 401 finished with values: [-1000000000.0, 1000000000.0] and parameters: {'p_sma': 37, 'p_std': 10, 'p_atr': 27, 'p_adx': 17, 'rsi_period': 35, 'ema1': 28, 'ema2': 33, 'slip_atr_k': 0.0042480605451128434, 'slip_spread_k': 0.8561577091201779, 'spread_hl_frac': 0.029960522306218814, 'bb_std_mult': 3.5171091459450343, 'rsi_os': 25, 'rsi_ob': 86, 'vol_spike': 0.2170871754197028, 'adx_thresh': 32.95457209526427, 'atr_min_pct': 0.0224830164423191, 'atr_max_pct': 0.11092238062798974, 'tp_mult': 2.4878218564962244, 'tsl_mult': 0.9607905915132625, 'strategy': 'breakout', 'time_stop': 126, 'use_sma': False, 'use_atr': False, 'use_adx': False, 'use_ema': False, 'use_spike': True, 'rsi_required': False, 'edge_k': 0.6006230916818914, 'edge_cap': 0.9733528531427292, 'bull_strategy': 'breakout', 'bull_bb_std_mult': 2.9152115560489, 'bull_rsi_os': 26, 'bull_rsi_ob': 90, 'bull_adx_thresh': 31.73177369538991, 'bull_atr_min_pct': 0.024567886043204798, 'bull_atr_max_pct': 0.11583045487046813, 'bull_tp_mult': 1.9415021441480853, 'bull_tsl_mult': 0.3887966627278112, 'bull_time_stop': 17, 'bull_use_sma': False, 'bull_use_ema': False, 'bull_use_atr': False, 'bull_use_adx': True, 'bull_use_spike': True, 'bull_rsi_required': True, 'bear_strategy': 'breakout', 'bear_bb_std_mult': 0.8790586500907633, 'bear_rsi_os': 12, 'bear_rsi_ob': 80, 'bear_adx_thresh': 27.70467777910687, 'bear_atr_min_pct': 0.029169700587167138, 'bear_atr_max_pct': 0.0881580388800793, 'bear_tp_mult': 1.265553201842731, 'bear_tsl_mult': 0.605387544497857, 'bear_time_stop': 212, 'bear_use_sma': True, 'bear_use_ema': False, 'bear_use_atr': False, 'bear_use_adx': False, 'bear_use_spike': True, 'bear_rsi_required': False, 'sideways_strategy': 'breakout', 'sideways_bb_std_mult': 0.7692096300894313, 'sideways_rsi_os': 42, 'sideways_rsi_ob': 55, 'sideways_adx_thresh': 21.061445885788032, 'sideways_atr_min_pct': 0.024855796352323888, 'sideways_atr_max_pct': 0.10946350436108043, 'sideways_tp_mult': 1.972084365900238, 'sideways_tsl_mult': 0.9712724288690403, 'sideways_time_stop': 173, 'sideways_use_sma': True, 'sideways_use_ema': True, 'sideways_use_atr': True, 'sideways_use_adx': True, 'sideways_use_spike': True, 'sideways_rsi_required': False}.
[I 2025-09-01 05:11:53,985] Trial 400 finished with values: [-0.039041501155514524, 0.038882565878073545] and parameters: {'p_sma': 24, 'p_std': 10, 'p_atr': 28, 'p_adx': 17, 'rsi_period': 29, 'ema1': 29, 'ema2': 28, 'slip_atr_k': 0.03388369714595563, 'slip_spread_k': 0.8682996132018126, 'spread_hl_frac': 0.04677931518932467, 'bb_std_mult': 3.5167067944460655, 'rsi_os': 24, 'rsi_ob': 86, 'vol_spike': 0.2169807338720983, 'adx_thresh': 10.973099735642736, 'atr_min_pct': 0.023607179714197717, 'atr_max_pct': 0.11136569115048779, 'tp_mult': 2.47460256551967, 'tsl_mult': 0.3616598423119306, 'strategy': 'breakout', 'time_stop': 46, 'use_sma': False, 'use_atr': False, 'use_adx': False, 'use_ema': False, 'use_spike': True, 'rsi_required': False, 'edge_k': 0.49930257974976017, 'edge_cap': 0.4686250538536474, 'bull_strategy': 'breakout', 'bull_bb_std_mult': 2.3641736169563954, 'bull_rsi_os': 26, 'bull_rsi_ob': 90, 'bull_adx_thresh': 32.13603589666348, 'bull_atr_min_pct': 0.0006450412357121369, 'bull_atr_max_pct': 0.08672231071824787, 'bull_tp_mult': 2.50378622033716, 'bull_tsl_mult': 0.22804726529783448, 'bull_time_stop': 241, 'bull_use_sma': False, 'bull_use_ema': False, 'bull_use_atr': False, 'bull_use_adx': True, 'bull_use_spike': False, 'bull_rsi_required': True, 'bear_strategy': 'breakout', 'bear_bb_std_mult': 0.9052972080173337, 'bear_rsi_os': 11, 'bear_rsi_ob': 64, 'bear_adx_thresh': 8.740821333721707, 'bear_atr_min_pct': 0.02372866292331905, 'bear_atr_max_pct': 0.06901465524704503, 'bear_tp_mult': 2.692277371887557, 'bear_tsl_mult': 0.25222386339197156, 'bear_time_stop': 212, 'bear_use_sma': True, 'bear_use_ema': False, 'bear_use_atr': False, 'bear_use_adx': False, 'bear_use_spike': False, 'bear_rsi_required': False, 'sideways_strategy': 'breakout', 'sideways_bb_std_mult': 0.7578240430487733, 'sideways_rsi_os': 42, 'sideways_rsi_ob': 55, 'sideways_adx_thresh': 20.055311271187907, 'sideways_atr_min_pct': 0.024784278787543645, 'sideways_atr_max_pct': 0.10824401105580056, 'sideways_tp_mult': 2.0020539850328483, 'sideways_tsl_mult': 0.9743950699384027, 'sideways_time_stop': 50, 'sideways_use_sma': True, 'sideways_use_ema': True, 'sideways_use_atr': True, 'sideways_use_adx': True, 'sideways_use_spike': True, 'sideways_rsi_required': False}.
[I 2025-09-01 05:12:36,904] Trial 407 finished with values: [-1000000000.0, 1000000000.0] and parameters: {'p_sma': 23, 'p_std': 60, 'p_atr': 27, 'p_adx': 13, 'rsi_period': 9, 'ema1': 23, 'ema2': 31, 'slip_atr_k': 0.18490512856930583, 'slip_spread_k': 0.27600755543613054, 'spread_hl_frac': 0.04434088168010772, 'bb_std_mult': 3.427301641678938, 'rsi_os': 23, 'rsi_ob': 88, 'vol_spike': 0.2295981342732659, 'adx_thresh': 19.453034450546518, 'atr_min_pct': 0.02294702337850566, 'atr_max_pct': 0.09593554347783936, 'tp_mult': 2.0343090350575883, 'tsl_mult': 0.9873401042104759, 'strategy': 'breakout', 'time_stop': 166, 'use_sma': False, 'use_atr': True, 'use_adx': True, 'use_ema': True, 'use_spike': True, 'rsi_required': True, 'edge_k': 0.6195983208614857, 'edge_cap': 0.8459788137343931, 'bull_strategy': 'breakout', 'bull_bb_std_mult': 2.267083490004566, 'bull_rsi_os': 25, 'bull_rsi_ob': 73, 'bull_adx_thresh': 27.1749309100494, 'bull_atr_min_pct': 0.0027276029340650935, 'bull_atr_max_pct': 0.14576272913353838, 'bull_tp_mult': 1.5774938387930695, 'bull_tsl_mult': 0.7995005058093705, 'bull_time_stop': 229, 'bull_use_sma': True, 'bull_use_ema': True, 'bull_use_atr': False, 'bull_use_adx': False, 'bull_use_spike': False, 'bull_rsi_required': True, 'bear_strategy': 'mean_reversion', 'bear_bb_std_mult': 0.6747145876598029, 'bear_rsi_os': 11, 'bear_rsi_ob': 83, 'bear_adx_thresh': 29.43851840075847, 'bear_atr_min_pct': 0.006768448720867277, 'bear_atr_max_pct': 0.05854255012990955, 'bear_tp_mult': 2.749651677243001, 'bear_tsl_mult': 0.5897529927670916, 'bear_time_stop': 203, 'bear_use_sma': False, 'bear_use_ema': True, 'bear_use_atr': False, 'bear_use_adx': False, 'bear_use_spike': False, 'bear_rsi_required': False, 'sideways_strategy': 'breakout', 'sideways_bb_std_mult': 2.3636728801138682, 'sideways_rsi_os': 43, 'sideways_rsi_ob': 54, 'sideways_adx_thresh': 20.6987471148042, 'sideways_atr_min_pct': 0.02633033120620581, 'sideways_atr_max_pct': 0.11219170203329855, 'sideways_tp_mult': 2.559696637927138, 'sideways_tsl_mult': 0.953316818529036, 'sideways_time_stop': 189, 'sideways_use_sma': False, 'sideways_use_ema': True, 'sideways_use_atr': False, 'sideways_use_adx': False, 'sideways_use_spike': True, 'sideways_rsi_required': True}.
