[I 2025-09-01 05:28:48,694] Trial 495 finished with values: [-1000000000.0, 1000000000.0] and parameters: {'p_sma': 55, 'p_std': 30, 'p_atr': 7, 'p_adx': 18, 'rsi_period': 50, 'ema1': 24, 'ema2': 31, 'slip_atr_k': 0.021848453891382937, 'slip_spread_k': 0.3629968108459932, 'spread_hl_frac': 0.04871325037735348, 'bb_std_mult': 2.2749481169404544, 'rsi_os': 25, 'rsi_ob': 48, 'vol_spike': 0.2109046051907675, 'adx_thresh': 10.341115577137971, 'atr_min_pct': 0.004417055520544125, 'atr_max_pct': 0.11940326224278534, 'tp_mult': 2.4931515866255802, 'tsl_mult': 0.3333280276564234, 'strategy': 'breakout', 'time_stop': 178, 'use_sma': False, 'use_atr': True, 'use_adx': True, 'use_ema': False, 'use_spike': False, 'rsi_required': False, 'edge_k': 0.10150457149153888, 'edge_cap': 0.5476102068552978, 'bull_strategy': 'breakout', 'bull_bb_std_mult': 1.0542659393262797, 'bull_rsi_os': 52, 'bull_rsi_ob': 88, 'bull_adx_thresh': 7.467359982186183, 'bull_atr_min_pct': 0.014526143727876735, 'bull_atr_max_pct': 0.10606554929792761, 'bull_tp_mult': 1.290560438867777, 'bull_tsl_mult': 0.22140732767996024, 'bull_time_stop': 91, 'bull_use_sma': False, 'bull_use_ema': True, 'bull_use_atr': False, 'bull_use_adx': True, 'bull_use_spike': False, 'bull_rsi_required': True, 'bear_strategy': 'breakout', 'bear_bb_std_mult': 3.421795047449645, 'bear_rsi_os': 9, 'bear_rsi_ob': 67, 'bear_adx_thresh': 28.567961572270697, 'bear_atr_min_pct': 0.008376480351192147, 'bear_atr_max_pct': 0.06502242349415728, 'bear_tp_mult': 1.2214451145088066, 'bear_tsl_mult': 0.2677262138532944, 'bear_time_stop': 202, 'bear_use_sma': True, 'bear_use_ema': True, 'bear_use_atr': False, 'bear_use_adx': False, 'bear_use_spike': False, 'bear_rsi_required': False, 'sideways_strategy': 'breakout', 'sideways_bb_std_mult': 0.633111263817696, 'sideways_rsi_os': 21, 'sideways_rsi_ob': 76, 'sideways_adx_thresh': 22.081442009475193, 'sideways_atr_min_pct': 0.0032696243876933523, 'sideways_atr_max_pct': 0.03920621752643022, 'sideways_tp_mult': 1.6053657049904018, 'sideways_tsl_mult': 0.9743573324542691, 'sideways_time_stop': 69, 'sideways_use_sma': False, 'sideways_use_ema': False, 'sideways_use_atr': True, 'sideways_use_adx': True, 'sideways_use_spike': True, 'sideways_rsi_required': True}.
[I 2025-09-01 05:28:49,887] Trial 497 finished with values: [-0.047870600871270486, 0.047698541047309084] and parameters: {'p_sma': 60, 'p_std': 34, 'p_atr': 7, 'p_adx': 17, 'rsi_period': 53, 'ema1': 24, 'ema2': 31, 'slip_atr_k': 0.10919076332449752, 'slip_spread_k': 0.4175172068333554, 'spread_hl_frac': 0.04871352779755441, 'bb_std_mult': 2.1454149411604866, 'rsi_os': 25, 'rsi_ob': 73, 'vol_spike': 0.1948015507163636, 'adx_thresh': 12.987092502287284, 'atr_min_pct': 0.004491694762404981, 'atr_max_pct': 0.11923972587926515, 'tp_mult': 2.4662280187329397, 'tsl_mult': 0.10950317255049319, 'strategy': 'breakout', 'time_stop': 189, 'use_sma': False, 'use_atr': True, 'use_adx': True, 'use_ema': True, 'use_spike': False, 'rsi_required': False, 'edge_k': 0.11098998593996064, 'edge_cap': 0.6620704935829067, 'bull_strategy': 'breakout', 'bull_bb_std_mult': 1.003145737710411, 'bull_rsi_os': 48, 'bull_rsi_ob': 55, 'bull_adx_thresh': 7.3265618297485835, 'bull_atr_min_pct': 0.012837206682617477, 'bull_atr_max_pct': 0.11016338461520059, 'bull_tp_mult': 1.3609827876634213, 'bull_tsl_mult': 0.21421293535466537, 'bull_time_stop': 93, 'bull_use_sma': True, 'bull_use_ema': False, 'bull_use_atr': False, 'bull_use_adx': True, 'bull_use_spike': False, 'bull_rsi_required': True, 'bear_strategy': 'breakout', 'bear_bb_std_mult': 3.3970486110367526, 'bear_rsi_os': 38, 'bear_rsi_ob': 67, 'bear_adx_thresh': 28.516186288581427, 'bear_atr_min_pct': 0.00678967128391282, 'bear_atr_max_pct': 0.09797959858177252, 'bear_tp_mult': 1.2871054022206998, 'bear_tsl_mult': 0.41234534950873547, 'bear_time_stop': 202, 'bear_use_sma': True, 'bear_use_ema': True, 'bear_use_atr': False, 'bear_use_adx': False, 'bear_use_spike': False, 'bear_rsi_required': True, 'sideways_strategy': 'breakout', 'sideways_bb_std_mult': 0.5894385295947523, 'sideways_rsi_os': 44, 'sideways_rsi_ob': 55, 'sideways_adx_thresh': 22.187973580111233, 'sideways_atr_min_pct': 0.0032939160091940292, 'sideways_atr_max_pct': 0.07372823007264645, 'sideways_tp_mult': 1.6102413220875855, 'sideways_tsl_mult': 0.97510511253813, 'sideways_time_stop': 65, 'sideways_use_sma': False, 'sideways_use_ema': False, 'sideways_use_atr': True, 'sideways_use_adx': False, 'sideways_use_spike': True, 'sideways_rsi_required': True}.
[I 2025-09-01 05:28:51,311] Trial 494 finished with values: [-1000000000.0, 1000000000.0] and parameters: {'p_sma': 60, 'p_std': 34, 'p_atr': 7, 'p_adx': 18, 'rsi_period': 52, 'ema1': 24, 'ema2': 31, 'slip_atr_k': 0.014911392063121358, 'slip_spread_k': 0.36476730989471673, 'spread_hl_frac': 0.04889482106498072, 'bb_std_mult': 2.2526511073239153, 'rsi_os': 12, 'rsi_ob': 87, 'vol_spike': 0.2109031213297615, 'adx_thresh': 7.028006943529958, 'atr_min_pct': 0.003135902892016278, 'atr_max_pct': 0.11954877653441873, 'tp_mult': 2.4608738025200223, 'tsl_mult': 0.20124731979726168, 'strategy': 'breakout', 'time_stop': 176, 'use_sma': False, 'use_atr': True, 'use_adx': False, 'use_ema': False, 'use_spike': False, 'rsi_required': False, 'edge_k': 0.10453147084942016, 'edge_cap': 0.5532837031384377, 'bull_strategy': 'breakout', 'bull_bb_std_mult': 1.0333446692358934, 'bull_rsi_os': 48, 'bull_rsi_ob': 94, 'bull_adx_thresh': 7.423157317231601, 'bull_atr_min_pct': 0.012958413835469628, 'bull_atr_max_pct': 0.09919616479916624, 'bull_tp_mult': 1.2796958151743498, 'bull_tsl_mult': 0.2269110414366723, 'bull_time_stop': 81, 'bull_use_sma': True, 'bull_use_ema': True, 'bull_use_atr': False, 'bull_use_adx': True, 'bull_use_spike': True, 'bull_rsi_required': True, 'bear_strategy': 'breakout', 'bear_bb_std_mult': 3.538237972164829, 'bear_rsi_os': 8, 'bear_rsi_ob': 67, 'bear_adx_thresh': 28.561025960624846, 'bear_atr_min_pct': 0.008473507998439718, 'bear_atr_max_pct': 0.04227892961786568, 'bear_tp_mult': 1.2796868271470971, 'bear_tsl_mult': 0.644746037937183, 'bear_time_stop': 200, 'bear_use_sma': True, 'bear_use_ema': True, 'bear_use_atr': False, 'bear_use_adx': False, 'bear_use_spike': True, 'bear_rsi_required': False, 'sideways_strategy': 'breakout', 'sideways_bb_std_mult': 0.5761825866300369, 'sideways_rsi_os': 19, 'sideways_rsi_ob': 55, 'sideways_adx_thresh': 22.534974744680895, 'sideways_atr_min_pct': 0.003334631965687487, 'sideways_atr_max_pct': 0.10542186239867221, 'sideways_tp_mult': 1.6118690591290374, 'sideways_tsl_mult': 0.46759922148877786, 'sideways_time_stop': 6, 'sideways_use_sma': False, 'sideways_use_ema': False, 'sideways_use_atr': True, 'sideways_use_adx': False, 'sideways_use_spike': True, 'sideways_rsi_required': True}.
[I 2025-09-01 05:29:37,158] Trial 498 finished with values: [-1000000000.0, 1000000000.0] and parameters: {'p_sma': 57, 'p_std': 30, 'p_atr': 7, 'p_adx': 18, 'rsi_period': 56, 'ema1': 23, 'ema2': 31, 'slip_atr_k': 0.020325986831835476, 'slip_spread_k': 0.4249110286281255, 'spread_hl_frac': 0.047661442606330866, 'bb_std_mult': 2.2598674699207115, 'rsi_os': 52, 'rsi_ob': 87, 'vol_spike': 0.21068389462337822, 'adx_thresh': 13.160595058602091, 'atr_min_pct': 0.003793158756293403, 'atr_max_pct': 0.13480548501114606, 'tp_mult': 2.46605523874913, 'tsl_mult': 0.9005483954570467, 'strategy': 'breakout', 'time_stop': 177, 'use_sma': False, 'use_atr': True, 'use_adx': True, 'use_ema': True, 'use_spike': True, 'rsi_required': False, 'edge_k': 0.13108395479785362, 'edge_cap': 0.43834350889109447, 'bull_strategy': 'breakout', 'bull_bb_std_mult': 0.8345197491871823, 'bull_rsi_os': 52, 'bull_rsi_ob': 54, 'bull_adx_thresh': 6.922684062236569, 'bull_atr_min_pct': 0.014463050493395658, 'bull_atr_max_pct': 0.110103222072464, 'bull_tp_mult': 1.355541560388699, 'bull_tsl_mult': 0.21181503967325876, 'bull_time_stop': 93, 'bull_use_sma': True, 'bull_use_ema': False, 'bull_use_atr': False, 'bull_use_adx': True, 'bull_use_spike': False, 'bull_rsi_required': True, 'bear_strategy': 'breakout', 'bear_bb_std_mult': 3.4313256414831566, 'bear_rsi_os': 32, 'bear_rsi_ob': 83, 'bear_adx_thresh': 6.517090786312885, 'bear_atr_min_pct': 0.00798895655845084, 'bear_atr_max_pct': 0.06401855159641262, 'bear_tp_mult': 1.219886061081805, 'bear_tsl_mult': 0.647080984726142, 'bear_time_stop': 203, 'bear_use_sma': True, 'bear_use_ema': False, 'bear_use_atr': False, 'bear_use_adx': False, 'bear_use_spike': False, 'bear_rsi_required': False, 'sideways_strategy': 'breakout', 'sideways_bb_std_mult': 3.405490647608044, 'sideways_rsi_os': 19, 'sideways_rsi_ob': 80, 'sideways_adx_thresh': 22.12792867798381, 'sideways_atr_min_pct': 0.004650715735783614, 'sideways_atr_max_pct': 0.01560322493141493, 'sideways_tp_mult': 1.6143086909589277, 'sideways_tsl_mult': 0.9999069277605019, 'sideways_time_stop': 69, 'sideways_use_sma': False, 'sideways_use_ema': False, 'sideways_use_atr': True, 'sideways_use_adx': False, 'sideways_use_spike': True, 'sideways_rsi_required': True}.
[I 2025-09-01 05:29:37,855] Trial 499 finished with values: [-0.021521025671838667, 0.0216072746949095] and parameters: {'p_sma': 59, 'p_std': 33, 'p_atr': 7, 'p_adx': 17, 'rsi_period': 56, 'ema1': 23, 'ema2': 31, 'slip_atr_k': 0.16848668300915653, 'slip_spread_k': 0.45244884789779033, 'spread_hl_frac': 0.04783586320904402, 'bb_std_mult': 2.1052389681625483, 'rsi_os': 52, 'rsi_ob': 87, 'vol_spike': 0.19531326374420976, 'adx_thresh': 28.665458503181938, 'atr_min_pct': 0.003664469709787955, 'atr_max_pct': 0.13325256952401163, 'tp_mult': 2.4645101820439637, 'tsl_mult': 0.8979398547176257, 'strategy': 'breakout', 'time_stop': 189, 'use_sma': False, 'use_atr': True, 'use_adx': False, 'use_ema': True, 'use_spike': True, 'rsi_required': False, 'edge_k': 0.2236469026865272, 'edge_cap': 0.37068376489093763, 'bull_strategy': 'breakout', 'bull_bb_std_mult': 0.8111292882129779, 'bull_rsi_os': 48, 'bull_rsi_ob': 54, 'bull_adx_thresh': 6.4499556773093705, 'bull_atr_min_pct': 0.01280253554060327, 'bull_atr_max_pct': 0.10931954537442837, 'bull_tp_mult': 1.1909375475527866, 'bull_tsl_mult': 0.17025045887269158, 'bull_time_stop': 82, 'bull_use_sma': True, 'bull_use_ema': False, 'bull_use_atr': False, 'bull_use_adx': True, 'bull_use_spike': False, 'bull_rsi_required': True, 'bear_strategy': 'breakout', 'bear_bb_std_mult': 3.478191565329596, 'bear_rsi_os': 7, 'bear_rsi_ob': 84, 'bear_adx_thresh': 29.57110485390673, 'bear_atr_min_pct': 0.007746773480751212, 'bear_atr_max_pct': 0.13258529668332425, 'bear_tp_mult': 1.2962524429235935, 'bear_tsl_mult': 0.6513339391401392, 'bear_time_stop': 198, 'bear_use_sma': True, 'bear_use_ema': False, 'bear_use_atr': False, 'bear_use_adx': False, 'bear_use_spike': False, 'bear_rsi_required': False, 'sideways_strategy': 'breakout', 'sideways_bb_std_mult': 0.733916778958311, 'sideways_rsi_os': 44, 'sideways_rsi_ob': 88, 'sideways_adx_thresh': 22.25547743524157, 'sideways_atr_min_pct': 0.004496944958414342, 'sideways_atr_max_pct': 0.09810582354686996, 'sideways_tp_mult': 1.510580173298026, 'sideways_tsl_mult': 0.41992552870446875, 'sideways_time_stop': 272, 'sideways_use_sma': False, 'sideways_use_ema': True, 'sideways_use_atr': True, 'sideways_use_adx': False, 'sideways_use_spike': True, 'sideways_rsi_required': True}.
[I 2025-09-01 05:29:38,385] Trial 500 finished with values: [-1000000000.0, 1000000000.0] and parameters: {'p_sma': 59, 'p_std': 33, 'p_atr': 7, 'p_adx': 12, 'rsi_period': 56, 'ema1': 23, 'ema2': 32, 'slip_atr_k': 0.15342626020697922, 'slip_spread_k': 0.45327132507014356, 'spread_hl_frac': 0.04750727487606219, 'bb_std_mult': 2.0288754249711514, 'rsi_os': 52, 'rsi_ob': 87, 'vol_spike': 0.20476206546512096, 'adx_thresh': 13.441321738543094, 'atr_min_pct': 0.0037135201612296526, 'atr_max_pct': 0.08817847461311996, 'tp_mult': 1.3188873020144323, 'tsl_mult': 0.2261607065222641, 'strategy': 'breakout', 'time_stop': 178, 'use_sma': False, 'use_atr': True, 'use_adx': False, 'use_ema': True, 'use_spike': True, 'rsi_required': False, 'edge_k': 0.1309790144169757, 'edge_cap': 0.5146136650722037, 'bull_strategy': 'breakout', 'bull_bb_std_mult': 0.8339865391650313, 'bull_rsi_os': 52, 'bull_rsi_ob': 59, 'bull_adx_thresh': 6.481810012979008, 'bull_atr_min_pct': 0.013883321477838025, 'bull_atr_max_pct': 0.10946913674838102, 'bull_tp_mult': 1.1779470553566005, 'bull_tsl_mult': 0.17074606402396636, 'bull_time_stop': 81, 'bull_use_sma': True, 'bull_use_ema': False, 'bull_use_atr': False, 'bull_use_adx': True, 'bull_use_spike': False, 'bull_rsi_required': True, 'bear_strategy': 'breakout', 'bear_bb_std_mult': 3.5997186113025967, 'bear_rsi_os': 8, 'bear_rsi_ob': 48, 'bear_adx_thresh': 29.624059375804965, 'bear_atr_min_pct': 0.0076889614167460355, 'bear_atr_max_pct': 0.06549966386424455, 'bear_tp_mult': 2.757491221306326, 'bear_tsl_mult': 0.650126669167155, 'bear_time_stop': 194, 'bear_use_sma': True, 'bear_use_ema': False, 'bear_use_atr': False, 'bear_use_adx': False, 'bear_use_spike': False, 'bear_rsi_required': False, 'sideways_strategy': 'breakout', 'sideways_bb_std_mult': 3.4329943462297696, 'sideways_rsi_os': 43, 'sideways_rsi_ob': 53, 'sideways_adx_thresh': 23.364420015914778, 'sideways_atr_min_pct': 0.005390927556844254, 'sideways_atr_max_pct': 0.012405091359632997, 'sideways_tp_mult': 1.5070266662524183, 'sideways_tsl_mult': 0.999608697790606, 'sideways_time_stop': 87, 'sideways_use_sma': False, 'sideways_use_ema': True, 'sideways_use_atr': True, 'sideways_use_adx': False, 'sideways_use_spike': True, 'sideways_rsi_required': True}.
[I 2025-09-01 05:29:38,724] Trial 501 finished with values: [-0.02375138447766645, 0.023830299971824315] and parameters: {'p_sma': 57, 'p_std': 30, 'p_atr': 7, 'p_adx': 18, 'rsi_period': 56, 'ema1': 23, 'ema2': 59, 'slip_atr_k': 0.18338204301247815, 'slip_spread_k': 0.47162545767203934, 'spread_hl_frac': 0.04757787836430025, 'bb_std_mult': 1.9968849967388167, 'rsi_os': 28, 'rsi_ob': 87, 'vol_spike': 0.20356577069210965, 'adx_thresh': 13.473623225879349, 'atr_min_pct': 0.0038771432694579863, 'atr_max_pct': 0.13574827924187582, 'tp_mult': 1.5778488405955, 'tsl_mult': 0.8836032676367016, 'strategy': 'breakout', 'time_stop': 166, 'use_sma': False, 'use_atr': True, 'use_adx': False, 'use_ema': True, 'use_spike': True, 'rsi_required': False, 'edge_k': 0.23383597925889218, 'edge_cap': 0.4367783922296461, 'bull_strategy': 'breakout', 'bull_bb_std_mult': 0.7954575523726828, 'bull_rsi_os': 46, 'bull_rsi_ob': 90, 'bull_adx_thresh': 5.003607981651018, 'bull_atr_min_pct': 0.014010645891714215, 'bull_atr_max_pct': 0.10986348851022404, 'bull_tp_mult': 1.1724969583656455, 'bull_tsl_mult': 0.1742744534498656, 'bull_time_stop': 85, 'bull_use_sma': True, 'bull_use_ema': False, 'bull_use_atr': False, 'bull_use_adx': True, 'bull_use_spike': False, 'bull_rsi_required': True, 'bear_strategy': 'breakout', 'bear_bb_std_mult': 3.4694116614701302, 'bear_rsi_os': 6, 'bear_rsi_ob': 47, 'bear_adx_thresh': 29.670928390796398, 'bear_atr_min_pct': 0.007831062159122697, 'bear_atr_max_pct': 0.0785257506308074, 'bear_tp_mult': 1.3183029943149753, 'bear_tsl_mult': 0.6633546521732722, 'bear_time_stop': 193, 'bear_use_sma': True, 'bear_use_ema': False, 'bear_use_atr': False, 'bear_use_adx': False, 'bear_use_spike': False, 'bear_rsi_required': False, 'sideways_strategy': 'breakout', 'sideways_bb_std_mult': 0.7382567098635413, 'sideways_rsi_os': 43, 'sideways_rsi_ob': 53, 'sideways_adx_thresh': 21.556520650425295, 'sideways_atr_min_pct': 0.004369798642342773, 'sideways_atr_max_pct': 0.09884162533809095, 'sideways_tp_mult': 1.5090280651647707, 'sideways_tsl_mult': 0.40772414249167016, 'sideways_time_stop': 168, 'sideways_use_sma': False, 'sideways_use_ema': True, 'sideways_use_atr': True, 'sideways_use_adx': False, 'sideways_use_spike': True, 'sideways_rsi_required': True}.
[I 2025-09-01 05:30:30,432] Trial 502 finished with values: [-0.04497535330179048, 0.04476964041899199] and parameters: {'p_sma': 59, 'p_std': 32, 'p_atr': 8, 'p_adx': 26, 'rsi_period': 56, 'ema1': 23, 'ema2': 32, 'slip_atr_k': 0.1806931601962829, 'slip_spread_k': 0.46174052666137916, 'spread_hl_frac': 0.03296184605734264, 'bb_std_mult': 2.0322633858942685, 'rsi_os': 42, 'rsi_ob': 88, 'vol_spike': 0.012529755932873865, 'adx_thresh': 32.53006687350483, 'atr_min_pct': 0.003723559593529438, 'atr_max_pct': 0.12775197208219158, 'tp_mult': 1.8644764490364647, 'tsl_mult': 0.07694231438263394, 'strategy': 'breakout', 'time_stop': 163, 'use_sma': False, 'use_atr': True, 'use_adx': False, 'use_ema': True, 'use_spike': True, 'rsi_required': False, 'edge_k': 0.22341504714650115, 'edge_cap': 0.5140623075739018, 'bull_strategy': 'breakout', 'bull_bb_std_mult': 0.7202441735924529, 'bull_rsi_os': 46, 'bull_rsi_ob': 89, 'bull_adx_thresh': 6.203063730906978, 'bull_atr_min_pct': 0.011538254799218729, 'bull_atr_max_pct': 0.10657302918369083, 'bull_tp_mult': 1.1951943965897196, 'bull_tsl_mult': 0.16522325868616022, 'bull_time_stop': 84, 'bull_use_sma': True, 'bull_use_ema': False, 'bull_use_atr': False, 'bull_use_adx': True, 'bull_use_spike': False, 'bull_rsi_required': True, 'bear_strategy': 'breakout', 'bear_bb_std_mult': 3.5277346924711614, 'bear_rsi_os': 7, 'bear_rsi_ob': 69, 'bear_adx_thresh': 29.520313753293273, 'bear_atr_min_pct': 0.007593188982248662, 'bear_atr_max_pct': 0.06770481303325995, 'bear_tp_mult': 1.3225723775873508, 'bear_tsl_mult': 0.2392098117960939, 'bear_time_stop': 249, 'bear_use_sma': True, 'bear_use_ema': False, 'bear_use_atr': False, 'bear_use_adx': False, 'bear_use_spike': False, 'bear_rsi_required': False, 'sideways_strategy': 'breakout', 'sideways_bb_std_mult': 2.055649771376278, 'sideways_rsi_os': 43, 'sideways_rsi_ob': 53, 'sideways_adx_thresh': 24.20431448758939, 'sideways_atr_min_pct': 0.0026425854873368656, 'sideways_atr_max_pct': 0.02724188407748676, 'sideways_tp_mult': 1.5158366846765767, 'sideways_tsl_mult': 0.7425559742870753, 'sideways_time_stop': 167, 'sideways_use_sma': False, 'sideways_use_ema': True, 'sideways_use_atr': True, 'sideways_use_adx': False, 'sideways_use_spike': True, 'sideways_rsi_required': True}.
[I 2025-09-01 05:30:31,868] Trial 503 finished with values: [-0.022152425773270035, 0.022150567191973385] and parameters: {'p_sma': 59, 'p_std': 28, 'p_atr': 8, 'p_adx': 17, 'rsi_period': 49, 'ema1': 23, 'ema2': 32, 'slip_atr_k': 0.17913336567111868, 'slip_spread_k': 0.3930632605231531, 'spread_hl_frac': 0.0013234974820526303, 'bb_std_mult': 2.0195966132369807, 'rsi_os': 36, 'rsi_ob': 69, 'vol_spike': 0.20336651538717998, 'adx_thresh': 23.146995986996, 'atr_min_pct': 0.003724198786178156, 'atr_max_pct': 0.07479581384484285, 'tp_mult': 2.1324474956950965, 'tsl_mult': 0.9415759478406928, 'strategy': 'mean_reversion', 'time_stop': 200, 'use_sma': False, 'use_atr': True, 'use_adx': False, 'use_ema': True, 'use_spike': True, 'rsi_required': False, 'edge_k': 0.24200448871562652, 'edge_cap': 0.5148290753505333, 'bull_strategy': 'breakout', 'bull_bb_std_mult': 0.7296232086628678, 'bull_rsi_os': 46, 'bull_rsi_ob': 72, 'bull_adx_thresh': 5.004661504284954, 'bull_atr_min_pct': 0.015170012438022414, 'bull_atr_max_pct': 0.1059350517196179, 'bull_tp_mult': 1.2165845787292096, 'bull_tsl_mult': 0.19577952254448247, 'bull_time_stop': 100, 'bull_use_sma': True, 'bull_use_ema': False, 'bull_use_atr': False, 'bull_use_adx': True, 'bull_use_spike': False, 'bull_rsi_required': True, 'bear_strategy': 'breakout', 'bear_bb_std_mult': 3.5930115079183818, 'bear_rsi_os': 6, 'bear_rsi_ob': 45, 'bear_adx_thresh': 29.963122166841647, 'bear_atr_min_pct': 0.007215637698821883, 'bear_atr_max_pct': 0.0786988650761236, 'bear_tp_mult': 1.3285149789952413, 'bear_tsl_mult': 0.707050913684254, 'bear_time_stop': 193, 'bear_use_sma': True, 'bear_use_ema': False, 'bear_use_atr': False, 'bear_use_adx': False, 'bear_use_spike': False, 'bear_rsi_required': False, 'sideways_strategy': 'breakout', 'sideways_bb_std_mult': 2.0753424733185506, 'sideways_rsi_os': 43, 'sideways_rsi_ob': 53, 'sideways_adx_thresh': 24.205425559671706, 'sideways_atr_min_pct': 0.004203728953793026, 'sideways_atr_max_pct': 0.1003842787692025, 'sideways_tp_mult': 1.5422641993812762, 'sideways_tsl_mult': 0.3497132085321819, 'sideways_time_stop': 166, 'sideways_use_sma': False, 'sideways_use_ema': True, 'sideways_use_atr': True, 'sideways_use_adx': False, 'sideways_use_spike': True, 'sideways_rsi_required': True}.
