[I 2025-09-01 04:11:22,590] Trial 42 finished with values: [-1000000000.0, 1000000000.0] and parameters: {'p_sma': 32, 'p_std': 31, 'p_atr': 22, 'p_adx': 9, 'rsi_period': 35, 'ema1': 29, 'ema2': 47, 'slip_atr_k': 0.1419054952276014, 'slip_spread_k': 0.7222789039970678, 'spread_hl_frac': 0.00633102473370269, 'bb_std_mult': 0.6877629110097128, 'rsi_os': 16, 'rsi_ob': 81, 'vol_spike': 0.08429275398491747, 'adx_thresh': 18.317380343923087, 'atr_min_pct': 0.020724539250695107, 'atr_max_pct': 0.028394439332122032, 'tp_mult': 1.875724049140393, 'tsl_mult': 0.8605309464369446, 'strategy': 'breakout', 'time_stop': 133, 'use_sma': False, 'use_atr': True, 'use_adx': True, 'use_ema': False, 'use_spike': True, 'rsi_required': True, 'edge_k': 1.131903997845922, 'edge_cap': 0.5553313082028046, 'bull_strategy': 'breakout', 'bull_bb_std_mult': 1.2207862993949565, 'bull_rsi_os': 32, 'bull_rsi_ob': 90, 'bull_adx_thresh': 27.84147576371159, 'bull_atr_min_pct': 0.014306100430306909, 'bull_atr_max_pct': 0.035920778701299935, 'bull_tp_mult': 1.463725389069881, 'bull_tsl_mult': 0.5450876556464167, 'bull_time_stop': 5, 'bull_use_sma': False, 'bull_use_ema': False, 'bull_use_atr': False, 'bull_use_adx': True, 'bull_use_spike': True, 'bull_rsi_required': True, 'bear_strategy': 'breakout', 'bear_bb_std_mult': 3.294614524712724, 'bear_rsi_os': 32, 'bear_rsi_ob': 92, 'bear_adx_thresh': 26.95083388509511, 'bear_atr_min_pct': 0.02641301162316271, 'bear_atr_max_pct': 0.08360703553886051, 'bear_tp_mult': 2.610326633112382, 'bear_tsl_mult': 0.1882658122313246, 'bear_time_stop': 176, 'bear_use_sma': True, 'bear_use_ema': False, 'bear_use_atr': False, 'bear_use_adx': True, 'bear_use_spike': True, 'bear_rsi_required': False, 'sideways_strategy': 'mean_reversion', 'sideways_bb_std_mult': 2.5500451643877575, 'sideways_rsi_os': 23, 'sideways_rsi_ob': 62, 'sideways_adx_thresh': 6.968044666305262, 'sideways_atr_min_pct': 0.006600331259155075, 'sideways_atr_max_pct': 0.037902811834524625, 'sideways_tp_mult': 1.851594434318305, 'sideways_tsl_mult': 0.6446078189785945, 'sideways_time_stop': 124, 'sideways_use_sma': True, 'sideways_use_ema': True, 'sideways_use_atr': True, 'sideways_use_adx': True, 'sideways_use_spike': False, 'sideways_rsi_required': False}.
[I 2025-09-01 04:11:22,966] Trial 43 finished with values: [-1000000000.0, 1000000000.0] and parameters: {'p_sma': 29, 'p_std': 30, 'p_atr': 22, 'p_adx': 30, 'rsi_period': 51, 'ema1': 29, 'ema2': 45, 'slip_atr_k': 0.13763451162129658, 'slip_spread_k': 0.7358258858844479, 'spread_hl_frac': 0.03902409741544229, 'bb_std_mult': 1.2108944278768456, 'rsi_os': 34, 'rsi_ob': 85, 'vol_spike': 0.01423039840411397, 'adx_thresh': 26.451468608908932, 'atr_min_pct': 0.029296597423568632, 'atr_max_pct': 0.03244899510838004, 'tp_mult': 2.760619308262515, 'tsl_mult': 0.8663752507900189, 'strategy': 'breakout', 'time_stop': 155, 'use_sma': False, 'use_atr': True, 'use_adx': True, 'use_ema': False, 'use_spike': True, 'rsi_required': False, 'edge_k': 1.521503201489255, 'edge_cap': 0.5751679816444921, 'bull_strategy': 'breakout', 'bull_bb_std_mult': 1.2744690454545768, 'bull_rsi_os': 23, 'bull_rsi_ob': 60, 'bull_adx_thresh': 8.802438793313467, 'bull_atr_min_pct': 0.0241152517023885, 'bull_atr_max_pct': 0.1075996042652039, 'bull_tp_mult': 1.4324403325648134, 'bull_tsl_mult': 0.5504838015385471, 'bull_time_stop': 33, 'bull_use_sma': True, 'bull_use_ema': False, 'bull_use_atr': True, 'bull_use_adx': True, 'bull_use_spike': True, 'bull_rsi_required': False, 'bear_strategy': 'breakout', 'bear_bb_std_mult': 2.775801941559258, 'bear_rsi_os': 31, 'bear_rsi_ob': 91, 'bear_adx_thresh': 26.615382005095167, 'bear_atr_min_pct': 0.024325488071645574, 'bear_atr_max_pct': 0.05821781804951485, 'bear_tp_mult': 2.676385920905113, 'bear_tsl_mult': 0.16806514943968037, 'bear_time_stop': 169, 'bear_use_sma': True, 'bear_use_ema': False, 'bear_use_atr': False, 'bear_use_adx': True, 'bear_use_spike': True, 'bear_rsi_required': True, 'sideways_strategy': 'mean_reversion', 'sideways_bb_std_mult': 1.9900850576266647, 'sideways_rsi_os': 32, 'sideways_rsi_ob': 62, 'sideways_adx_thresh': 6.603837256254247, 'sideways_atr_min_pct': 0.019476063754068712, 'sideways_atr_max_pct': 0.07407346524016876, 'sideways_tp_mult': 1.18805160254127, 'sideways_tsl_mult': 0.732717598820147, 'sideways_time_stop': 134, 'sideways_use_sma': True, 'sideways_use_ema': True, 'sideways_use_atr': True, 'sideways_use_adx': True, 'sideways_use_spike': False, 'sideways_rsi_required': False}.
[I 2025-09-01 04:12:02,471] Trial 49 finished with values: [-1000000000.0, 1000000000.0] and parameters: {'p_sma': 48, 'p_std': 34, 'p_atr': 7, 'p_adx': 11, 'rsi_period': 60, 'ema1': 20, 'ema2': 57, 'slip_atr_k': 0.07728901346093779, 'slip_spread_k': 0.43050637438230904, 'spread_hl_frac': 0.013320064299817936, 'bb_std_mult': 0.5007884640837859, 'rsi_os': 34, 'rsi_ob': 88, 'vol_spike': 0.22443091895538517, 'adx_thresh': 20.923668579986515, 'atr_min_pct': 0.029068103016093003, 'atr_max_pct': 0.06825610947198124, 'tp_mult': 1.7547452239788524, 'tsl_mult': 0.2560313052565042, 'strategy': 'breakout', 'time_stop': 175, 'use_sma': False, 'use_atr': False, 'use_adx': False, 'use_ema': True, 'use_spike': True, 'rsi_required': False, 'edge_k': 0.44146119232076303, 'edge_cap': 0.7042718304800969, 'bull_strategy': 'mean_reversion', 'bull_bb_std_mult': 1.4296960650668376, 'bull_rsi_os': 54, 'bull_rsi_ob': 53, 'bull_adx_thresh': 15.332435941279481, 'bull_atr_min_pct': 0.006659643092209281, 'bull_atr_max_pct': 0.0737509859379414, 'bull_tp_mult': 1.8782498139825052, 'bull_tsl_mult': 0.912506057503038, 'bull_time_stop': 281, 'bull_use_sma': True, 'bull_use_ema': False, 'bull_use_atr': True, 'bull_use_adx': True, 'bull_use_spike': True, 'bull_rsi_required': False, 'bear_strategy': 'breakout', 'bear_bb_std_mult': 2.904411113140349, 'bear_rsi_os': 13, 'bear_rsi_ob': 60, 'bear_adx_thresh': 20.033709927875115, 'bear_atr_min_pct': 0.010548415879976583, 'bear_atr_max_pct': 0.10611031767562593, 'bear_tp_mult': 1.190898756102683, 'bear_tsl_mult': 0.30785228504825024, 'bear_time_stop': 277, 'bear_use_sma': True, 'bear_use_ema': False, 'bear_use_atr': True, 'bear_use_adx': False, 'bear_use_spike': True, 'bear_rsi_required': True, 'sideways_strategy': 'mean_reversion', 'sideways_bb_std_mult': 2.945611625144374, 'sideways_rsi_os': 36, 'sideways_rsi_ob': 56, 'sideways_adx_thresh': 34.887340533880156, 'sideways_atr_min_pct': 0.02947934129940321, 'sideways_atr_max_pct': 0.10425324304969975, 'sideways_tp_mult': 2.59250105695017, 'sideways_tsl_mult': 0.19775038335679979, 'sideways_time_stop': 158, 'sideways_use_sma': True, 'sideways_use_ema': False, 'sideways_use_atr': True, 'sideways_use_adx': True, 'sideways_use_spike': False, 'sideways_rsi_required': True}.
[I 2025-09-01 04:12:04,481] Trial 50 finished with values: [-1000000000.0, 1000000000.0] and parameters: {'p_sma': 56, 'p_std': 34, 'p_atr': 17, 'p_adx': 11, 'rsi_period': 58, 'ema1': 8, 'ema2': 21, 'slip_atr_k': 0.0006653388248975406, 'slip_spread_k': 0.3280105368796786, 'spread_hl_frac': 0.00170152144670822, 'bb_std_mult': 0.5026994835122593, 'rsi_os': 41, 'rsi_ob': 89, 'vol_spike': 0.21930308728427456, 'adx_thresh': 28.182874360140588, 'atr_min_pct': 0.012174507473905038, 'atr_max_pct': 0.054315746404898266, 'tp_mult': 2.3096294280537815, 'tsl_mult': 0.77988162166194, 'strategy': 'breakout', 'time_stop': 186, 'use_sma': False, 'use_atr': False, 'use_adx': False, 'use_ema': True, 'use_spike': True, 'rsi_required': False, 'edge_k': 0.46463926772500197, 'edge_cap': 0.705327500289679, 'bull_strategy': 'mean_reversion', 'bull_bb_std_mult': 1.4683826303543581, 'bull_rsi_os': 52, 'bull_rsi_ob': 71, 'bull_adx_thresh': 15.736690590032179, 'bull_atr_min_pct': 0.006733851188648939, 'bull_atr_max_pct': 0.06797835452635756, 'bull_tp_mult': 1.897714100844356, 'bull_tsl_mult': 0.9282724096481254, 'bull_time_stop': 246, 'bull_use_sma': True, 'bull_use_ema': False, 'bull_use_atr': True, 'bull_use_adx': True, 'bull_use_spike': True, 'bull_rsi_required': False, 'bear_strategy': 'breakout', 'bear_bb_std_mult': 2.5729988156507217, 'bear_rsi_os': 14, 'bear_rsi_ob': 60, 'bear_adx_thresh': 20.26523420383038, 'bear_atr_min_pct': 0.020340105332512258, 'bear_atr_max_pct': 0.10987027776303916, 'bear_tp_mult': 1.640463888796548, 'bear_tsl_mult': 0.29012413516198066, 'bear_time_stop': 206, 'bear_use_sma': False, 'bear_use_ema': True, 'bear_use_atr': True, 'bear_use_adx': False, 'bear_use_spike': False, 'bear_rsi_required': False, 'sideways_strategy': 'breakout', 'sideways_bb_std_mult': 2.994365730245338, 'sideways_rsi_os': 37, 'sideways_rsi_ob': 50, 'sideways_adx_thresh': 15.163019392240226, 'sideways_atr_min_pct': 0.014545239387504488, 'sideways_atr_max_pct': 0.058739260746968947, 'sideways_tp_mult': 2.6020946122268613, 'sideways_tsl_mult': 0.5742697643755543, 'sideways_time_stop': 91, 'sideways_use_sma': True, 'sideways_use_ema': False, 'sideways_use_atr': True, 'sideways_use_adx': False, 'sideways_use_spike': False, 'sideways_rsi_required': True}.
[I 2025-09-01 04:12:05,107] Trial 47 finished with values: [-1000000000.0, 1000000000.0] and parameters: {'p_sma': 56, 'p_std': 40, 'p_atr': 7, 'p_adx': 30, 'rsi_period': 62, 'ema1': 7, 'ema2': 57, 'slip_atr_k': 0.022780984639916138, 'slip_spread_k': 0.30489272247328564, 'spread_hl_frac': 0.013566666532143465, 'bb_std_mult': 2.412048454257982, 'rsi_os': 55, 'rsi_ob': 87, 'vol_spike': 0.02195979786347213, 'adx_thresh': 27.355670152844514, 'atr_min_pct': 0.022188037542180645, 'atr_max_pct': 0.0711668894306643, 'tp_mult': 1.9869758694940742, 'tsl_mult': 0.2466722309939144, 'strategy': 'breakout', 'time_stop': 180, 'use_sma': False, 'use_atr': False, 'use_adx': True, 'use_ema': False, 'use_spike': True, 'rsi_required': False, 'edge_k': 0.4684245794667311, 'edge_cap': 0.9256598708128994, 'bull_strategy': 'mean_reversion', 'bull_bb_std_mult': 1.247978099199428, 'bull_rsi_os': 52, 'bull_rsi_ob': 85, 'bull_adx_thresh': 7.934347502849339, 'bull_atr_min_pct': 0.006662728069752144, 'bull_atr_max_pct': 0.039386473455951566, 'bull_tp_mult': 1.4436402374381565, 'bull_tsl_mult': 0.8333059192462774, 'bull_time_stop': 276, 'bull_use_sma': True, 'bull_use_ema': False, 'bull_use_atr': True, 'bull_use_adx': True, 'bull_use_spike': True, 'bull_rsi_required': False, 'bear_strategy': 'breakout', 'bear_bb_std_mult': 2.545581414082052, 'bear_rsi_os': 21, 'bear_rsi_ob': 68, 'bear_adx_thresh': 19.890819304615245, 'bear_atr_min_pct': 0.026432477981834675, 'bear_atr_max_pct': 0.11179699641005385, 'bear_tp_mult': 1.6672364169463645, 'bear_tsl_mult': 0.2833014513070622, 'bear_time_stop': 163, 'bear_use_sma': True, 'bear_use_ema': False, 'bear_use_atr': False, 'bear_use_adx': False, 'bear_use_spike': True, 'bear_rsi_required': True, 'sideways_strategy': 'mean_reversion', 'sideways_bb_std_mult': 2.9276255523443666, 'sideways_rsi_os': 35, 'sideways_rsi_ob': 62, 'sideways_adx_thresh': 29.158186644625744, 'sideways_atr_min_pct': 0.028749543788770926, 'sideways_atr_max_pct': 0.02512332695520946, 'sideways_tp_mult': 2.681780799295596, 'sideways_tsl_mult': 0.5664455392293728, 'sideways_time_stop': 125, 'sideways_use_sma': True, 'sideways_use_ema': True, 'sideways_use_atr': True, 'sideways_use_adx': True, 'sideways_use_spike': False, 'sideways_rsi_required': False}.
[I 2025-09-01 04:12:05,524] Trial 48 finished with values: [-1000000000.0, 1000000000.0] and parameters: {'p_sma': 9, 'p_std': 41, 'p_atr': 7, 'p_adx': 24, 'rsi_period': 54, 'ema1': 7, 'ema2': 56, 'slip_atr_k': 0.021653408470126617, 'slip_spread_k': 0.32628546853942064, 'spread_hl_frac': 0.0121945877250703, 'bb_std_mult': 0.9553120405284222, 'rsi_os': 35, 'rsi_ob': 87, 'vol_spike': 0.21665201046298158, 'adx_thresh': 20.95977489349796, 'atr_min_pct': 0.016694416888489525, 'atr_max_pct': 0.06173496204379079, 'tp_mult': 1.7855372985174431, 'tsl_mult': 0.23759097996671957, 'strategy': 'breakout', 'time_stop': 181, 'use_sma': False, 'use_atr': False, 'use_adx': True, 'use_ema': False, 'use_spike': True, 'rsi_required': False, 'edge_k': 0.6728293453167484, 'edge_cap': 0.7231135437737563, 'bull_strategy': 'mean_reversion', 'bull_bb_std_mult': 1.4244732396329967, 'bull_rsi_os': 37, 'bull_rsi_ob': 53, 'bull_adx_thresh': 15.714002337189367, 'bull_atr_min_pct': 0.006504302499738587, 'bull_atr_max_pct': 0.10578761885748231, 'bull_tp_mult': 1.888710805038612, 'bull_tsl_mult': 0.8981060478236788, 'bull_time_stop': 277, 'bull_use_sma': True, 'bull_use_ema': False, 'bull_use_atr': True, 'bull_use_adx': True, 'bull_use_spike': True, 'bull_rsi_required': False, 'bear_strategy': 'breakout', 'bear_bb_std_mult': 2.869955142402807, 'bear_rsi_os': 21, 'bear_rsi_ob': 59, 'bear_adx_thresh': 19.968868127693746, 'bear_atr_min_pct': 0.020587807956896048, 'bear_atr_max_pct': 0.09754621597784352, 'bear_tp_mult': 1.6275021037960826, 'bear_tsl_mult': 0.27765971201261197, 'bear_time_stop': 165, 'bear_use_sma': True, 'bear_use_ema': False, 'bear_use_atr': False, 'bear_use_adx': False, 'bear_use_spike': True, 'bear_rsi_required': False, 'sideways_strategy': 'mean_reversion', 'sideways_bb_std_mult': 2.9364376820257023, 'sideways_rsi_os': 35, 'sideways_rsi_ob': 56, 'sideways_adx_thresh': 34.986438022439614, 'sideways_atr_min_pct': 0.01371070482395246, 'sideways_atr_max_pct': 0.026987440031308284, 'sideways_tp_mult': 2.594587069525633, 'sideways_tsl_mult': 0.5734208468551409, 'sideways_time_stop': 118, 'sideways_use_sma': True, 'sideways_use_ema': True, 'sideways_use_atr': True, 'sideways_use_adx': True, 'sideways_use_spike': False, 'sideways_rsi_required': True}.
[I 2025-09-01 04:12:06,054] Trial 54 finished with values: [-1000000000.0, 1000000000.0] and parameters: {'p_sma': 45, 'p_std': 47, 'p_atr': 16, 'p_adx': 12, 'rsi_period': 66, 'ema1': 15, 'ema2': 37, 'slip_atr_k': 0.10871425395067355, 'slip_spread_k': 0.9931077963242569, 'spread_hl_frac': 0.017940084029049338, 'bb_std_mult': 1.3541706025339173, 'rsi_os': 21, 'rsi_ob': 53, 'vol_spike': 0.1801685007364505, 'adx_thresh': 15.24879884168147, 'atr_min_pct': 0.025913420342929944, 'atr_max_pct': 0.019471421605442255, 'tp_mult': 1.4338592786077233, 'tsl_mult': 0.5078922002888105, 'strategy': 'breakout', 'time_stop': 108, 'use_sma': True, 'use_atr': False, 'use_adx': True, 'use_ema': False, 'use_spike': True, 'rsi_required': True, 'edge_k': 1.3784768013617366, 'edge_cap': 0.4782914170472174, 'bull_strategy': 'mean_reversion', 'bull_bb_std_mult': 1.758246781216352, 'bull_rsi_os': 20, 'bull_rsi_ob': 78, 'bull_adx_thresh': 10.362606939403838, 'bull_atr_min_pct': 0.00924476746924735, 'bull_atr_max_pct': 0.022185768999151374, 'bull_tp_mult': 1.6634289693516342, 'bull_tsl_mult': 0.9883728570019443, 'bull_time_stop': 197, 'bull_use_sma': False, 'bull_use_ema': False, 'bull_use_atr': True, 'bull_use_adx': True, 'bull_use_spike': False, 'bull_rsi_required': False, 'bear_strategy': 'breakout', 'bear_bb_std_mult': 3.5495595216334896, 'bear_rsi_os': 9, 'bear_rsi_ob': 48, 'bear_adx_thresh': 22.186670287684265, 'bear_atr_min_pct': 0.02952996301709332, 'bear_atr_max_pct': 0.046267739868400784, 'bear_tp_mult': 2.238463333863164, 'bear_tsl_mult': 0.899069912187461, 'bear_time_stop': 106, 'bear_use_sma': False, 'bear_use_ema': True, 'bear_use_atr': True, 'bear_use_adx': True, 'bear_use_spike': False, 'bear_rsi_required': False, 'sideways_strategy': 'breakout', 'sideways_bb_std_mult': 2.510333535800628, 'sideways_rsi_os': 29, 'sideways_rsi_ob': 51, 'sideways_adx_thresh': 11.631470217508381, 'sideways_atr_min_pct': 0.0018847667074679067, 'sideways_atr_max_pct': 0.1354004208668065, 'sideways_tp_mult': 2.8108915246676087, 'sideways_tsl_mult': 0.8763880434199756, 'sideways_time_stop': 225, 'sideways_use_sma': False, 'sideways_use_ema': True, 'sideways_use_atr': True, 'sideways_use_adx': False, 'sideways_use_spike': True, 'sideways_rsi_required': True}.
[I 2025-09-01 04:12:06,197] Trial 55 finished with values: [-1000000000.0, 1000000000.0] and parameters: {'p_sma': 59, 'p_std': 27, 'p_atr': 10, 'p_adx': 9, 'rsi_period': 13, 'ema1': 27, 'ema2': 29, 'slip_atr_k': 0.03942648561031706, 'slip_spread_k': 0.8522336277374457, 'spread_hl_frac': 0.020476761612776617, 'bb_std_mult': 1.0524834575061228, 'rsi_os': 8, 'rsi_ob': 92, 'vol_spike': 0.04068248967934826, 'adx_thresh': 24.222778658638006, 'atr_min_pct': 0.019651042967707984, 'atr_max_pct': 0.012527707918706124, 'tp_mult': 1.475775386129574, 'tsl_mult': 0.5499218370207083, 'strategy': 'breakout', 'time_stop': 208, 'use_sma': True, 'use_atr': False, 'use_adx': True, 'use_ema': False, 'use_spike': True, 'rsi_required': True, 'edge_k': 0.9333491855607182, 'edge_cap': 0.8130648072370512, 'bull_strategy': 'mean_reversion', 'bull_bb_std_mult': 1.6175112923065516, 'bull_rsi_os': 26, 'bull_rsi_ob': 62, 'bull_adx_thresh': 11.67128457270485, 'bull_atr_min_pct': 0.0013682753414220577, 'bull_atr_max_pct': 0.077481313349746, 'bull_tp_mult': 2.548090228053967, 'bull_tsl_mult': 0.40371553274734284, 'bull_time_stop': 225, 'bull_use_sma': False, 'bull_use_ema': False, 'bull_use_atr': True, 'bull_use_adx': True, 'bull_use_spike': True, 'bull_rsi_required': False, 'bear_strategy': 'mean_reversion', 'bear_bb_std_mult': 2.0869896689057206, 'bear_rsi_os': 41, 'bear_rsi_ob': 47, 'bear_adx_thresh': 13.86181020470146, 'bear_atr_min_pct': 0.013827978835961444, 'bear_atr_max_pct': 0.12993461624505773, 'bear_tp_mult': 1.7788501691493561, 'bear_tsl_mult': 0.3963489933969855, 'bear_time_stop': 35, 'bear_use_sma': False, 'bear_use_ema': False, 'bear_use_atr': False, 'bear_use_adx': True, 'bear_use_spike': False, 'bear_rsi_required': False, 'sideways_strategy': 'mean_reversion', 'sideways_bb_std_mult': 2.851175888316653, 'sideways_rsi_os': 19, 'sideways_rsi_ob': 80, 'sideways_adx_thresh': 20.462074373888832, 'sideways_atr_min_pct': 0.005741857409921008, 'sideways_atr_max_pct': 0.012646550920695734, 'sideways_tp_mult': 2.3159037277888688, 'sideways_tsl_mult': 0.9135106596306576, 'sideways_time_stop': 187, 'sideways_use_sma': False, 'sideways_use_ema': True, 'sideways_use_atr': False, 'sideways_use_adx': True, 'sideways_use_spike': True, 'sideways_rsi_required': True}.
[I 2025-09-01 04:12:41,997] Trial 51 finished with values: [-1000000000.0, 1000000000.0] and parameters: {'p_sma': 44, 'p_std': 41, 'p_atr': 16, 'p_adx': 24, 'rsi_period': 69, 'ema1': 7, 'ema2': 37, 'slip_atr_k': 0.2432402124355209, 'slip_spread_k': 0.330295723198727, 'spread_hl_frac': 0.0017510552573554456, 'bb_std_mult': 1.3630430051535336, 'rsi_os': 55, 'rsi_ob': 53, 'vol_spike': 0.160556654610254, 'adx_thresh': 28.757436959987984, 'atr_min_pct': 0.01634618463129311, 'atr_max_pct': 0.0192129357046354, 'tp_mult': 1.3427214865873285, 'tsl_mult': 0.9941654555293551, 'strategy': 'breakout', 'time_stop': 208, 'use_sma': False, 'use_atr': False, 'use_adx': False, 'use_ema': True, 'use_spike': True, 'rsi_required': True, 'edge_k': 1.3479961236023006, 'edge_cap': 0.9214941287381353, 'bull_strategy': 'mean_reversion', 'bull_bb_std_mult': 1.6378388734360079, 'bull_rsi_os': 37, 'bull_rsi_ob': 85, 'bull_adx_thresh': 10.6817228078638, 'bull_atr_min_pct': 0.026429303677919253, 'bull_atr_max_pct': 0.0680746197114515, 'bull_tp_mult': 1.6955775414626917, 'bull_tsl_mult': 0.6235139821624057, 'bull_time_stop': 249, 'bull_use_sma': False, 'bull_use_ema': False, 'bull_use_atr': True, 'bull_use_adx': True, 'bull_use_spike': True, 'bull_rsi_required': False, 'bear_strategy': 'breakout', 'bear_bb_std_mult': 2.0062943951696917, 'bear_rsi_os': 20, 'bear_rsi_ob': 46, 'bear_adx_thresh': 29.07997545795712, 'bear_atr_min_pct': 0.013704007621511374, 'bear_atr_max_pct': 0.13537222602747756, 'bear_tp_mult': 1.6330588654225844, 'bear_tsl_mult': 0.7096176285734892, 'bear_time_stop': 209, 'bear_use_sma': False, 'bear_use_ema': True, 'bear_use_atr': True, 'bear_use_adx': False, 'bear_use_spike': False, 'bear_rsi_required': False, 'sideways_strategy': 'breakout', 'sideways_bb_std_mult': 1.7275894398180995, 'sideways_rsi_os': 15, 'sideways_rsi_ob': 80, 'sideways_adx_thresh': 32.78323983782697, 'sideways_atr_min_pct': 0.014302000068392108, 'sideways_atr_max_pct': 0.06166611092404403, 'sideways_tp_mult': 2.7032630027709468, 'sideways_tsl_mult': 0.5978936957120794, 'sideways_time_stop': 221, 'sideways_use_sma': False, 'sideways_use_ema': False, 'sideways_use_atr': True, 'sideways_use_adx': False, 'sideways_use_spike': True, 'sideways_rsi_required': True}.
