[I 2025-09-01 04:14:05,277] Trial 63 finished with values: [-1000000000.0, 1000000000.0] and parameters: {'p_sma': 22, 'p_std': 45, 'p_atr': 15, 'p_adx': 21, 'rsi_period': 31, 'ema1': 21, 'ema2': 43, 'slip_atr_k': 0.17942346728134306, 'slip_spread_k': 0.7858805221593487, 'spread_hl_frac': 0.009120623342471925, 'bb_std_mult': 0.6205849690968638, 'rsi_os': 38, 'rsi_ob': 93, 'vol_spike': 0.2076152336264011, 'adx_thresh': 20.447759227525058, 'atr_min_pct': 0.024477223369989597, 'atr_max_pct': 0.060001105901546045, 'tp_mult': 1.537290168330153, 'tsl_mult': 0.4789280974326794, 'strategy': 'breakout', 'time_stop': 82, 'use_sma': True, 'use_atr': True, 'use_adx': True, 'use_ema': True, 'use_spike': True, 'rsi_required': True, 'edge_k': 0.7111933438070973, 'edge_cap': 0.5196078375206872, 'bull_strategy': 'breakout', 'bull_bb_std_mult': 1.1438736340019595, 'bull_rsi_os': 45, 'bull_rsi_ob': 67, 'bull_adx_thresh': 12.308181425851018, 'bull_atr_min_pct': 0.010753829202306948, 'bull_atr_max_pct': 0.07954925269021954, 'bull_tp_mult': 2.7521727486156067, 'bull_tsl_mult': 0.7015755988401091, 'bull_time_stop': 131, 'bull_use_sma': False, 'bull_use_ema': False, 'bull_use_atr': True, 'bull_use_adx': True, 'bull_use_spike': True, 'bull_rsi_required': False, 'bear_strategy': 'breakout', 'bear_bb_std_mult': 0.9678641089807043, 'bear_rsi_os': 15, 'bear_rsi_ob': 73, 'bear_adx_thresh': 22.84296768511929, 'bear_atr_min_pct': 0.0062527706794384946, 'bear_atr_max_pct': 0.0787519757393188, 'bear_tp_mult': 1.3916657626810385, 'bear_tsl_mult': 0.4806347516420376, 'bear_time_stop': 146, 'bear_use_sma': False, 'bear_use_ema': False, 'bear_use_atr': False, 'bear_use_adx': True, 'bear_use_spike': True, 'bear_rsi_required': True, 'sideways_strategy': 'mean_reversion', 'sideways_bb_std_mult': 0.954308697167116, 'sideways_rsi_os': 8, 'sideways_rsi_ob': 83, 'sideways_adx_thresh': 15.357150023272055, 'sideways_atr_min_pct': 0.00014890914172576504, 'sideways_atr_max_pct': 0.11246404864400895, 'sideways_tp_mult': 1.9685147626490629, 'sideways_tsl_mult': 0.817902726910513, 'sideways_time_stop': 59, 'sideways_use_sma': True, 'sideways_use_ema': True, 'sideways_use_atr': True, 'sideways_use_adx': True, 'sideways_use_spike': False, 'sideways_rsi_required': False}.
[I 2025-09-01 04:14:05,799] Trial 62 finished with values: [-1000000000.0, 1000000000.0] and parameters: {'p_sma': 25, 'p_std': 46, 'p_atr': 15, 'p_adx': 8, 'rsi_period': 78, 'ema1': 21, 'ema2': 53, 'slip_atr_k': 0.17940216361703437, 'slip_spread_k': 0.8022706137365881, 'spread_hl_frac': 0.02752729934163433, 'bb_std_mult': 2.467628918833313, 'rsi_os': 37, 'rsi_ob': 60, 'vol_spike': 0.20711608453707345, 'adx_thresh': 20.572574401887692, 'atr_min_pct': 0.024541262254667427, 'atr_max_pct': 0.059457887717706964, 'tp_mult': 2.5991681495140404, 'tsl_mult': 0.48212940995448766, 'strategy': 'mean_reversion', 'time_stop': 87, 'use_sma': True, 'use_atr': True, 'use_adx': True, 'use_ema': False, 'use_spike': False, 'rsi_required': True, 'edge_k': 0.7479350054274126, 'edge_cap': 0.6888709066911026, 'bull_strategy': 'breakout', 'bull_bb_std_mult': 2.7093339714483724, 'bull_rsi_os': 30, 'bull_rsi_ob': 67, 'bull_adx_thresh': 12.351052283217996, 'bull_atr_min_pct': 0.00849604146485572, 'bull_atr_max_pct': 0.042951916912136595, 'bull_tp_mult': 2.469139434201492, 'bull_tsl_mult': 0.42291410953243325, 'bull_time_stop': 199, 'bull_use_sma': False, 'bull_use_ema': True, 'bull_use_atr': True, 'bull_use_adx': False, 'bull_use_spike': False, 'bull_rsi_required': False, 'bear_strategy': 'mean_reversion', 'bear_bb_std_mult': 3.432193661408279, 'bear_rsi_os': 26, 'bear_rsi_ob': 71, 'bear_adx_thresh': 5.46358766776954, 'bear_atr_min_pct': 0.001372748176730991, 'bear_atr_max_pct': 0.07202104047884, 'bear_tp_mult': 1.379631051231292, 'bear_tsl_mult': 0.6237184481109141, 'bear_time_stop': 147, 'bear_use_sma': True, 'bear_use_ema': True, 'bear_use_atr': False, 'bear_use_adx': True, 'bear_use_spike': True, 'bear_rsi_required': True, 'sideways_strategy': 'mean_reversion', 'sideways_bb_std_mult': 0.8351404302515009, 'sideways_rsi_os': 55, 'sideways_rsi_ob': 66, 'sideways_adx_thresh': 21.782488608312168, 'sideways_atr_min_pct': 0.00122307363902893, 'sideways_atr_max_pct': 0.1408333627737738, 'sideways_tp_mult': 2.006235105245433, 'sideways_tsl_mult': 0.8258502700324264, 'sideways_time_stop': 248, 'sideways_use_sma': True, 'sideways_use_ema': True, 'sideways_use_atr': False, 'sideways_use_adx': True, 'sideways_use_spike': False, 'sideways_rsi_required': False}.
[I 2025-09-01 04:14:45,552] Trial 65 finished with values: [-1000000000.0, 1000000000.0] and parameters: {'p_sma': 22, 'p_std': 18, 'p_atr': 29, 'p_adx': 28, 'rsi_period': 25, 'ema1': 23, 'ema2': 43, 'slip_atr_k': 0.1256011516476703, 'slip_spread_k': 0.8123724480337615, 'spread_hl_frac': 0.028452862331974263, 'bb_std_mult': 0.9132697268551778, 'rsi_os': 37, 'rsi_ob': 93, 'vol_spike': 0.15687523668111183, 'adx_thresh': 20.633509775261686, 'atr_min_pct': 0.024272393098394136, 'atr_max_pct': 0.03639328359466032, 'tp_mult': 1.9102113690799667, 'tsl_mult': 0.421307590151086, 'strategy': 'breakout', 'time_stop': 122, 'use_sma': False, 'use_atr': True, 'use_adx': True, 'use_ema': False, 'use_spike': False, 'rsi_required': True, 'edge_k': 0.8883963616410548, 'edge_cap': 0.5243804470229123, 'bull_strategy': 'breakout', 'bull_bb_std_mult': 0.9437342701175668, 'bull_rsi_os': 21, 'bull_rsi_ob': 66, 'bull_adx_thresh': 14.654200784194856, 'bull_atr_min_pct': 0.012844381244292352, 'bull_atr_max_pct': 0.06407218589511335, 'bull_tp_mult': 2.8486006127902233, 'bull_tsl_mult': 0.8054509960699303, 'bull_time_stop': 92, 'bull_use_sma': False, 'bull_use_ema': False, 'bull_use_atr': True, 'bull_use_adx': True, 'bull_use_spike': True, 'bull_rsi_required': False, 'bear_strategy': 'breakout', 'bear_bb_std_mult': 3.4433173642478736, 'bear_rsi_os': 11, 'bear_rsi_ob': 83, 'bear_adx_thresh': 8.951277880900097, 'bear_atr_min_pct': 0.0008654562623883807, 'bear_atr_max_pct': 0.07279422490256553, 'bear_tp_mult': 1.2443673655163174, 'bear_tsl_mult': 0.4817726517285675, 'bear_time_stop': 144, 'bear_use_sma': True, 'bear_use_ema': False, 'bear_use_atr': False, 'bear_use_adx': True, 'bear_use_spike': True, 'bear_rsi_required': False, 'sideways_strategy': 'breakout', 'sideways_bb_std_mult': 3.2385290399667555, 'sideways_rsi_os': 49, 'sideways_rsi_ob': 65, 'sideways_adx_thresh': 15.160018055168537, 'sideways_atr_min_pct': 0.008097399579615614, 'sideways_atr_max_pct': 0.1397254947997731, 'sideways_tp_mult': 2.0343829359408554, 'sideways_tsl_mult': 0.8203194532273084, 'sideways_time_stop': 59, 'sideways_use_sma': True, 'sideways_use_ema': False, 'sideways_use_atr': True, 'sideways_use_adx': True, 'sideways_use_spike': False, 'sideways_rsi_required': True}.
[I 2025-09-01 04:14:46,226] Trial 66 finished with values: [-0.21915238191284914, 0.21904147464479615] and parameters: {'p_sma': 22, 'p_std': 39, 'p_atr': 29, 'p_adx': 27, 'rsi_period': 78, 'ema1': 23, 'ema2': 34, 'slip_atr_k': 0.23264160486884972, 'slip_spread_k': 0.2546252021824075, 'spread_hl_frac': 0.026777598282057932, 'bb_std_mult': 1.136425309960845, 'rsi_os': 51, 'rsi_ob': 93, 'vol_spike': 0.17759186698140983, 'adx_thresh': 17.32178222473142, 'atr_min_pct': 0.02396790846777303, 'atr_max_pct': 0.09887494653980419, 'tp_mult': 1.7222736870691613, 'tsl_mult': 0.41440997198502577, 'strategy': 'breakout', 'time_stop': 231, 'use_sma': True, 'use_atr': True, 'use_adx': True, 'use_ema': False, 'use_spike': True, 'rsi_required': False, 'edge_k': 1.8930340856041659, 'edge_cap': 0.3822483537865139, 'bull_strategy': 'breakout', 'bull_bb_std_mult': 1.0660895088423064, 'bull_rsi_os': 45, 'bull_rsi_ob': 67, 'bull_adx_thresh': 19.195055347599926, 'bull_atr_min_pct': 0.019719444346664894, 'bull_atr_max_pct': 0.07899634345886368, 'bull_tp_mult': 2.8947982383076707, 'bull_tsl_mult': 0.8152108703311742, 'bull_time_stop': 88, 'bull_use_sma': False, 'bull_use_ema': False, 'bull_use_atr': True, 'bull_use_adx': True, 'bull_use_spike': True, 'bull_rsi_required': False, 'bear_strategy': 'breakout', 'bear_bb_std_mult': 3.4428721266947067, 'bear_rsi_os': 11, 'bear_rsi_ob': 84, 'bear_adx_thresh': 23.60504344818669, 'bear_atr_min_pct': 0.0013561243746738373, 'bear_atr_max_pct': 0.03976791371930183, 'bear_tp_mult': 1.8310531262423284, 'bear_tsl_mult': 0.4752390816540717, 'bear_time_stop': 47, 'bear_use_sma': True, 'bear_use_ema': True, 'bear_use_atr': True, 'bear_use_adx': False, 'bear_use_spike': True, 'bear_rsi_required': True, 'sideways_strategy': 'breakout', 'sideways_bb_std_mult': 0.8316266159866836, 'sideways_rsi_os': 50, 'sideways_rsi_ob': 83, 'sideways_adx_thresh': 14.969377524924521, 'sideways_atr_min_pct': 0.00012398634568434668, 'sideways_atr_max_pct': 0.14233620603382377, 'sideways_tp_mult': 1.232947028365517, 'sideways_tsl_mult': 0.8182475543331518, 'sideways_time_stop': 55, 'sideways_use_sma': True, 'sideways_use_ema': False, 'sideways_use_atr': True, 'sideways_use_adx': True, 'sideways_use_spike': False, 'sideways_rsi_required': False}.
[I 2025-09-01 04:14:46,735] Trial 67 finished with values: [-1000000000.0, 1000000000.0] and parameters: {'p_sma': 13, 'p_std': 18, 'p_atr': 29, 'p_adx': 12, 'rsi_period': 84, 'ema1': 23, 'ema2': 34, 'slip_atr_k': 0.11374916834732428, 'slip_spread_k': 0.07474785991696498, 'spread_hl_frac': 0.015748527524796822, 'bb_std_mult': 0.9073040308017573, 'rsi_os': 47, 'rsi_ob': 67, 'vol_spike': 0.13079266441845028, 'adx_thresh': 17.04857863100284, 'atr_min_pct': 0.02590002588915, 'atr_max_pct': 0.10841905513656114, 'tp_mult': 1.7086681295620911, 'tsl_mult': 0.414953692376162, 'strategy': 'breakout', 'time_stop': 122, 'use_sma': False, 'use_atr': False, 'use_adx': False, 'use_ema': False, 'use_spike': False, 'rsi_required': False, 'edge_k': 0.8639326271601772, 'edge_cap': 0.1650272845205692, 'bull_strategy': 'mean_reversion', 'bull_bb_std_mult': 3.093766836044325, 'bull_rsi_os': 21, 'bull_rsi_ob': 92, 'bull_adx_thresh': 19.28469642138059, 'bull_atr_min_pct': 0.020394342607192154, 'bull_atr_max_pct': 0.14005616860078365, 'bull_tp_mult': 1.593968459541484, 'bull_tsl_mult': 0.798754108480632, 'bull_time_stop': 168, 'bull_use_sma': True, 'bull_use_ema': False, 'bull_use_atr': True, 'bull_use_adx': True, 'bull_use_spike': True, 'bull_rsi_required': False, 'bear_strategy': 'breakout', 'bear_bb_std_mult': 3.5957662237293917, 'bear_rsi_os': 12, 'bear_rsi_ob': 46, 'bear_adx_thresh': 25.359782718975573, 'bear_atr_min_pct': 0.00035417851000232, 'bear_atr_max_pct': 0.07211558982206283, 'bear_tp_mult': 1.829954628738296, 'bear_tsl_mult': 0.9944036638940424, 'bear_time_stop': 52, 'bear_use_sma': True, 'bear_use_ema': True, 'bear_use_atr': True, 'bear_use_adx': False, 'bear_use_spike': True, 'bear_rsi_required': False, 'sideways_strategy': 'breakout', 'sideways_bb_std_mult': 0.7241739854348535, 'sideways_rsi_os': 49, 'sideways_rsi_ob': 65, 'sideways_adx_thresh': 18.00037832825375, 'sideways_atr_min_pct': 0.007890823768669009, 'sideways_atr_max_pct': 0.14237743732776303, 'sideways_tp_mult': 1.7419811897289865, 'sideways_tsl_mult': 0.8409851569579997, 'sideways_time_stop': 59, 'sideways_use_sma': True, 'sideways_use_ema': False, 'sideways_use_atr': True, 'sideways_use_adx': False, 'sideways_use_spike': True, 'sideways_rsi_required': True}.
[I 2025-09-01 04:14:47,004] Trial 68 finished with values: [-1000000000.0, 1000000000.0] and parameters: {'p_sma': 12, 'p_std': 54, 'p_atr': 26, 'p_adx': 27, 'rsi_period': 15, 'ema1': 24, 'ema2': 32, 'slip_atr_k': 0.11288923590664154, 'slip_spread_k': 0.06079512260049086, 'spread_hl_frac': 0.010938500195308308, 'bb_std_mult': 1.1121426921746518, 'rsi_os': 47, 'rsi_ob': 67, 'vol_spike': 0.18421514257539304, 'adx_thresh': 17.154914332093856, 'atr_min_pct': 0.019728296027579063, 'atr_max_pct': 0.11335006309014459, 'tp_mult': 1.1408920510215608, 'tsl_mult': 0.4206231727628815, 'strategy': 'breakout', 'time_stop': 123, 'use_sma': False, 'use_atr': False, 'use_adx': False, 'use_ema': False, 'use_spike': True, 'rsi_required': False, 'edge_k': 0.8848570670566529, 'edge_cap': 0.1494341826579932, 'bull_strategy': 'mean_reversion', 'bull_bb_std_mult': 3.1138470039328587, 'bull_rsi_os': 25, 'bull_rsi_ob': 63, 'bull_adx_thresh': 19.325896018589837, 'bull_atr_min_pct': 0.0205770537511518, 'bull_atr_max_pct': 0.06631186795399643, 'bull_tp_mult': 1.541875037781554, 'bull_tsl_mult': 0.7984850412657749, 'bull_time_stop': 89, 'bull_use_sma': True, 'bull_use_ema': False, 'bull_use_atr': True, 'bull_use_adx': True, 'bull_use_spike': True, 'bull_rsi_required': False, 'bear_strategy': 'breakout', 'bear_bb_std_mult': 3.5955574452635832, 'bear_rsi_os': 11, 'bear_rsi_ob': 52, 'bear_adx_thresh': 18.246446671284207, 'bear_atr_min_pct': 0.022462638385352583, 'bear_atr_max_pct': 0.030626805216160506, 'bear_tp_mult': 1.2307873148639472, 'bear_tsl_mult': 0.41040954480622394, 'bear_time_stop': 185, 'bear_use_sma': True, 'bear_use_ema': False, 'bear_use_atr': True, 'bear_use_adx': False, 'bear_use_spike': True, 'bear_rsi_required': False, 'sideways_strategy': 'breakout', 'sideways_bb_std_mult': 2.775924644028074, 'sideways_rsi_os': 51, 'sideways_rsi_ob': 64, 'sideways_adx_thresh': 17.63267728785956, 'sideways_atr_min_pct': 0.007646281512369003, 'sideways_atr_max_pct': 0.08069168451472628, 'sideways_tp_mult': 1.598276302162661, 'sideways_tsl_mult': 0.9038327125216792, 'sideways_time_stop': 54, 'sideways_use_sma': True, 'sideways_use_ema': False, 'sideways_use_atr': True, 'sideways_use_adx': False, 'sideways_use_spike': True, 'sideways_rsi_required': True}.
[I 2025-09-01 04:14:47,357] Trial 72 finished with values: [-1000000000.0, 1000000000.0] and parameters: {'p_sma': 41, 'p_std': 39, 'p_atr': 21, 'p_adx': 13, 'rsi_period': 33, 'ema1': 12, 'ema2': 19, 'slip_atr_k': 0.05138731065367214, 'slip_spread_k': 0.20191558326094622, 'spread_hl_frac': 0.03221461085345161, 'bb_std_mult': 2.606180573599621, 'rsi_os': 13, 'rsi_ob': 95, 'vol_spike': 0.17612473481683372, 'adx_thresh': 19.117196726493184, 'atr_min_pct': 0.02811379943390036, 'atr_max_pct': 0.02358119294302717, 'tp_mult': 2.0777244780937667, 'tsl_mult': 0.6428888976143737, 'strategy': 'breakout', 'time_stop': 247, 'use_sma': False, 'use_atr': False, 'use_adx': True, 'use_ema': True, 'use_spike': True, 'rsi_required': True, 'edge_k': 0.61530813806467, 'edge_cap': 0.7613068531786921, 'bull_strategy': 'mean_reversion', 'bull_bb_std_mult': 1.0651348953683308, 'bull_rsi_os': 16, 'bull_rsi_ob': 58, 'bull_adx_thresh': 31.187928486134318, 'bull_atr_min_pct': 0.016456564016680414, 'bull_atr_max_pct': 0.0728269035723584, 'bull_tp_mult': 2.143451365841165, 'bull_tsl_mult': 0.5231482785703014, 'bull_time_stop': 241, 'bull_use_sma': False, 'bull_use_ema': False, 'bull_use_atr': True, 'bull_use_adx': True, 'bull_use_spike': True, 'bull_rsi_required': False, 'bear_strategy': 'breakout', 'bear_bb_std_mult': 1.0262846340419878, 'bear_rsi_os': 35, 'bear_rsi_ob': 77, 'bear_adx_thresh': 32.96085046267358, 'bear_atr_min_pct': 0.01929712513140148, 'bear_atr_max_pct': 0.06369298190265191, 'bear_tp_mult': 2.1044368840261476, 'bear_tsl_mult': 0.45562921061708306, 'bear_time_stop': 194, 'bear_use_sma': False, 'bear_use_ema': False, 'bear_use_atr': False, 'bear_use_adx': True, 'bear_use_spike': False, 'bear_rsi_required': False, 'sideways_strategy': 'mean_reversion', 'sideways_bb_std_mult': 3.031029413959564, 'sideways_rsi_os': 21, 'sideways_rsi_ob': 72, 'sideways_adx_thresh': 19.118220062353192, 'sideways_atr_min_pct': 0.015770416554516435, 'sideways_atr_max_pct': 0.13388251333488033, 'sideways_tp_mult': 1.2706210920554426, 'sideways_tsl_mult': 0.9598614796722574, 'sideways_time_stop': 19, 'sideways_use_sma': False, 'sideways_use_ema': True, 'sideways_use_atr': True, 'sideways_use_adx': True, 'sideways_use_spike': False, 'sideways_rsi_required': True}.
[I 2025-09-01 04:15:26,711] Trial 69 finished with values: [-1000000000.0, 1000000000.0] and parameters: {'p_sma': 13, 'p_std': 8, 'p_atr': 21, 'p_adx': 10, 'rsi_period': 14, 'ema1': 26, 'ema2': 49, 'slip_atr_k': 0.22428380425692218, 'slip_spread_k': 0.050003655388654644, 'spread_hl_frac': 0.03437018382057614, 'bb_std_mult': 1.1077128042526703, 'rsi_os': 26, 'rsi_ob': 68, 'vol_spike': 0.17867667969136802, 'adx_thresh': 21.85388373667001, 'atr_min_pct': 0.026279427511335746, 'atr_max_pct': 0.1009070611505204, 'tp_mult': 1.1298333017354536, 'tsl_mult': 0.6450483490456158, 'strategy': 'breakout', 'time_stop': 234, 'use_sma': False, 'use_atr': False, 'use_adx': False, 'use_ema': False, 'use_spike': True, 'rsi_required': False, 'edge_k': 0.611169365464725, 'edge_cap': 0.17566113560307683, 'bull_strategy': 'mean_reversion', 'bull_bb_std_mult': 1.3735726615195354, 'bull_rsi_os': 25, 'bull_rsi_ob': 92, 'bull_adx_thresh': 31.836871152075528, 'bull_atr_min_pct': 0.01994989494142285, 'bull_atr_max_pct': 0.14091359658287295, 'bull_tp_mult': 1.5598523112548124, 'bull_tsl_mult': 0.8248898125462857, 'bull_time_stop': 239, 'bull_use_sma': True, 'bull_use_ema': False, 'bull_use_atr': True, 'bull_use_adx': True, 'bull_use_spike': True, 'bull_rsi_required': False, 'bear_strategy': 'breakout', 'bear_bb_std_mult': 3.555508991427173, 'bear_rsi_os': 53, 'bear_rsi_ob': 52, 'bear_adx_thresh': 18.38337154650249, 'bear_atr_min_pct': 0.011790306740074016, 'bear_atr_max_pct': 0.03602618815046074, 'bear_tp_mult': 1.8124575865033854, 'bear_tsl_mult': 0.9877209857833545, 'bear_time_stop': 185, 'bear_use_sma': True, 'bear_use_ema': False, 'bear_use_atr': True, 'bear_use_adx': False, 'bear_use_spike': True, 'bear_rsi_required': False, 'sideways_strategy': 'breakout', 'sideways_bb_std_mult': 2.7932461352927764, 'sideways_rsi_os': 39, 'sideways_rsi_ob': 55, 'sideways_adx_thresh': 9.352611201589113, 'sideways_atr_min_pct': 0.024222672394167883, 'sideways_atr_max_pct': 0.07913308031389236, 'sideways_tp_mult': 1.7158071001340542, 'sideways_tsl_mult': 0.8987555823371244, 'sideways_time_stop': 82, 'sideways_use_sma': True, 'sideways_use_ema': False, 'sideways_use_atr': True, 'sideways_use_adx': False, 'sideways_use_spike': True, 'sideways_rsi_required': True}.
[I 2025-09-01 04:15:27,291] Trial 70 finished with values: [-1000000000.0, 1000000000.0] and parameters: {'p_sma': 41, 'p_std': 35, 'p_atr': 21, 'p_adx': 12, 'rsi_period': 15, 'ema1': 24, 'ema2': 49, 'slip_atr_k': 0.23436785292229018, 'slip_spread_k': 0.06867611501864662, 'spread_hl_frac': 0.033584687995288215, 'bb_std_mult': 1.0904664838706042, 'rsi_os': 47, 'rsi_ob': 68, 'vol_spike': 0.18313363396331614, 'adx_thresh': 17.31504822300225, 'atr_min_pct': 0.019741789518879314, 'atr_max_pct': 0.09701611473410361, 'tp_mult': 1.1201557057706775, 'tsl_mult': 0.6510539071999387, 'strategy': 'breakout', 'time_stop': 223, 'use_sma': False, 'use_atr': False, 'use_adx': False, 'use_ema': False, 'use_spike': True, 'rsi_required': False, 'edge_k': 0.6101484960161565, 'edge_cap': 0.1810060494886036, 'bull_strategy': 'mean_reversion', 'bull_bb_std_mult': 1.0215099117283444, 'bull_rsi_os': 15, 'bull_rsi_ob': 63, 'bull_adx_thresh': 19.38518958927586, 'bull_atr_min_pct': 0.019706597801387313, 'bull_atr_max_pct': 0.13993161726391953, 'bull_tp_mult': 1.5885987276359446, 'bull_tsl_mult': 0.7758285316907715, 'bull_time_stop': 241, 'bull_use_sma': True, 'bull_use_ema': False, 'bull_use_atr': True, 'bull_use_adx': True, 'bull_use_spike': True, 'bull_rsi_required': False, 'bear_strategy': 'breakout', 'bear_bb_std_mult': 3.5998927932803557, 'bear_rsi_os': 53, 'bear_rsi_ob': 52, 'bear_adx_thresh': 18.494136213675933, 'bear_atr_min_pct': 0.01221578160576397, 'bear_atr_max_pct': 0.041227184256856654, 'bear_tp_mult': 1.8029870891599897, 'bear_tsl_mult': 0.4024337611315365, 'bear_time_stop': 49, 'bear_use_sma': True, 'bear_use_ema': False, 'bear_use_atr': True, 'bear_use_adx': False, 'bear_use_spike': True, 'bear_rsi_required': False, 'sideways_strategy': 'breakout', 'sideways_bb_std_mult': 2.819829599402147, 'sideways_rsi_os': 20, 'sideways_rsi_ob': 55, 'sideways_adx_thresh': 17.885055821563217, 'sideways_atr_min_pct': 0.024237941437613167, 'sideways_atr_max_pct': 0.08061471544988136, 'sideways_tp_mult': 1.7323308248424556, 'sideways_tsl_mult': 0.9058316851969181, 'sideways_time_stop': 81, 'sideways_use_sma': True, 'sideways_use_ema': False, 'sideways_use_atr': True, 'sideways_use_adx': False, 'sideways_use_spike': True, 'sideways_rsi_required': True}.
