[I 2025-09-01 04:34:50,614] Trial 187 finished with values: [-1000000000.0, 1000000000.0] and parameters: {'p_sma': 15, 'p_std': 40, 'p_atr': 11, 'p_adx': 20, 'rsi_period': 59, 'ema1': 30, 'ema2': 26, 'slip_atr_k': 0.0036501601989930165, 'slip_spread_k': 0.2575190854930473, 'spread_hl_frac': 0.04519636955728067, 'bb_std_mult': 2.262937804207437, 'rsi_os': 48, 'rsi_ob': 71, 'vol_spike': 0.2552695365661681, 'adx_thresh': 13.933271644534118, 'atr_min_pct': 0.011451927135691105, 'atr_max_pct': 0.11792125279723711, 'tp_mult': 2.562987527916479, 'tsl_mult': 0.07766140743836597, 'strategy': 'breakout', 'time_stop': 8, 'use_sma': True, 'use_atr': True, 'use_adx': False, 'use_ema': True, 'use_spike': True, 'rsi_required': False, 'edge_k': 0.5919454496113431, 'edge_cap': 0.9036056204861769, 'bull_strategy': 'mean_reversion', 'bull_bb_std_mult': 2.466002835719532, 'bull_rsi_os': 8, 'bull_rsi_ob': 45, 'bull_adx_thresh': 17.11485605240369, 'bull_atr_min_pct': 0.002726409264380547, 'bull_atr_max_pct': 0.14336318164141454, 'bull_tp_mult': 2.2009202204164655, 'bull_tsl_mult': 0.9031649245722354, 'bull_time_stop': 225, 'bull_use_sma': True, 'bull_use_ema': False, 'bull_use_atr': True, 'bull_use_adx': False, 'bull_use_spike': False, 'bull_rsi_required': False, 'bear_strategy': 'mean_reversion', 'bear_bb_std_mult': 1.9118326186142531, 'bear_rsi_os': 46, 'bear_rsi_ob': 58, 'bear_adx_thresh': 13.765618167189098, 'bear_atr_min_pct': 0.02865605765732559, 'bear_atr_max_pct': 0.06033297043487524, 'bear_tp_mult': 1.0510004587659783, 'bear_tsl_mult': 0.09596558821551399, 'bear_time_stop': 215, 'bear_use_sma': True, 'bear_use_ema': True, 'bear_use_atr': True, 'bear_use_adx': True, 'bear_use_spike': False, 'bear_rsi_required': False, 'sideways_strategy': 'mean_reversion', 'sideways_bb_std_mult': 0.6226655225558884, 'sideways_rsi_os': 6, 'sideways_rsi_ob': 77, 'sideways_adx_thresh': 16.829609595654937, 'sideways_atr_min_pct': 0.00877823297488086, 'sideways_atr_max_pct': 0.0946634237641209, 'sideways_tp_mult': 1.4895173305732707, 'sideways_tsl_mult': 0.2892123726146018, 'sideways_time_stop': 95, 'sideways_use_sma': True, 'sideways_use_ema': True, 'sideways_use_atr': False, 'sideways_use_adx': False, 'sideways_use_spike': True, 'sideways_rsi_required': False}.
[I 2025-09-01 04:34:50,627] Trial 190 finished with values: [-1000000000.0, 1000000000.0] and parameters: {'p_sma': 15, 'p_std': 20, 'p_atr': 11, 'p_adx': 21, 'rsi_period': 59, 'ema1': 30, 'ema2': 26, 'slip_atr_k': 0.003650497995582135, 'slip_spread_k': 0.2443099632517597, 'spread_hl_frac': 0.04064024263240261, 'bb_std_mult': 1.1120187123792067, 'rsi_os': 9, 'rsi_ob': 55, 'vol_spike': 0.2536319195823783, 'adx_thresh': 15.994945994868914, 'atr_min_pct': 0.004952297647811922, 'atr_max_pct': 0.11854268510963717, 'tp_mult': 2.316580730438472, 'tsl_mult': 0.8918379165716178, 'strategy': 'breakout', 'time_stop': 32, 'use_sma': True, 'use_atr': True, 'use_adx': False, 'use_ema': True, 'use_spike': True, 'rsi_required': False, 'edge_k': 0.08312507020686477, 'edge_cap': 0.9020628292666015, 'bull_strategy': 'mean_reversion', 'bull_bb_std_mult': 2.4225609335004115, 'bull_rsi_os': 46, 'bull_rsi_ob': 46, 'bull_adx_thresh': 18.298419460415868, 'bull_atr_min_pct': 0.0028492832821887817, 'bull_atr_max_pct': 0.12032192417300398, 'bull_tp_mult': 1.7024937267632254, 'bull_tsl_mult': 0.270845985602944, 'bull_time_stop': 225, 'bull_use_sma': True, 'bull_use_ema': False, 'bull_use_atr': True, 'bull_use_adx': False, 'bull_use_spike': False, 'bull_rsi_required': False, 'bear_strategy': 'mean_reversion', 'bear_bb_std_mult': 1.1554628987139588, 'bear_rsi_os': 46, 'bear_rsi_ob': 57, 'bear_adx_thresh': 13.440250802971274, 'bear_atr_min_pct': 0.02746595387190756, 'bear_atr_max_pct': 0.14382292598567556, 'bear_tp_mult': 1.030813931792929, 'bear_tsl_mult': 0.20666036692089848, 'bear_time_stop': 213, 'bear_use_sma': True, 'bear_use_ema': True, 'bear_use_atr': True, 'bear_use_adx': True, 'bear_use_spike': False, 'bear_rsi_required': False, 'sideways_strategy': 'mean_reversion', 'sideways_bb_std_mult': 1.3902617494710745, 'sideways_rsi_os': 6, 'sideways_rsi_ob': 48, 'sideways_adx_thresh': 16.869645967499263, 'sideways_atr_min_pct': 0.016669151659408514, 'sideways_atr_max_pct': 0.09458317095559163, 'sideways_tp_mult': 2.307089155044633, 'sideways_tsl_mult': 0.9963820354393157, 'sideways_time_stop': 95, 'sideways_use_sma': True, 'sideways_use_ema': True, 'sideways_use_atr': False, 'sideways_use_adx': False, 'sideways_use_spike': True, 'sideways_rsi_required': False}.
[I 2025-09-01 04:35:28,252] Trial 192 finished with values: [-0.05401835261483645, 0.053833597163425645] and parameters: {'p_sma': 17, 'p_std': 23, 'p_atr': 26, 'p_adx': 18, 'rsi_period': 42, 'ema1': 17, 'ema2': 47, 'slip_atr_k': 0.2168346375484797, 'slip_spread_k': 0.36688836314947737, 'spread_hl_frac': 0.04188901760209225, 'bb_std_mult': 0.9367783570674237, 'rsi_os': 47, 'rsi_ob': 57, 'vol_spike': 0.10888609357879947, 'adx_thresh': 14.579461675920111, 'atr_min_pct': 0.008195001906593138, 'atr_max_pct': 0.07584806359498204, 'tp_mult': 2.703181061054603, 'tsl_mult': 0.22685124486236063, 'strategy': 'breakout', 'time_stop': 140, 'use_sma': True, 'use_atr': False, 'use_adx': False, 'use_ema': True, 'use_spike': False, 'rsi_required': False, 'edge_k': 0.6565691898281442, 'edge_cap': 0.39753781168648683, 'bull_strategy': 'breakout', 'bull_bb_std_mult': 2.3930449274585577, 'bull_rsi_os': 28, 'bull_rsi_ob': 91, 'bull_adx_thresh': 7.288113260608947, 'bull_atr_min_pct': 0.0008583994090300999, 'bull_atr_max_pct': 0.13524323972930416, 'bull_tp_mult': 1.144788768036236, 'bull_tsl_mult': 0.4267795720665563, 'bull_time_stop': 124, 'bull_use_sma': True, 'bull_use_ema': False, 'bull_use_atr': False, 'bull_use_adx': False, 'bull_use_spike': False, 'bull_rsi_required': True, 'bear_strategy': 'mean_reversion', 'bear_bb_std_mult': 1.0520679690791213, 'bear_rsi_os': 48, 'bear_rsi_ob': 56, 'bear_adx_thresh': 12.057914535502869, 'bear_atr_min_pct': 0.021698680435657366, 'bear_atr_max_pct': 0.1475545500592608, 'bear_tp_mult': 1.0882378112327635, 'bear_tsl_mult': 0.7743754131671867, 'bear_time_stop': 84, 'bear_use_sma': True, 'bear_use_ema': False, 'bear_use_atr': True, 'bear_use_adx': False, 'bear_use_spike': False, 'bear_rsi_required': True, 'sideways_strategy': 'breakout', 'sideways_bb_std_mult': 1.4433502028075835, 'sideways_rsi_os': 9, 'sideways_rsi_ob': 46, 'sideways_adx_thresh': 17.753890214576522, 'sideways_atr_min_pct': 0.02290710639195094, 'sideways_atr_max_pct': 0.09105576440040575, 'sideways_tp_mult': 2.7076622995093396, 'sideways_tsl_mult': 0.4705827362880789, 'sideways_time_stop': 183, 'sideways_use_sma': True, 'sideways_use_ema': False, 'sideways_use_atr': False, 'sideways_use_adx': False, 'sideways_use_spike': False, 'sideways_rsi_required': False}.
[I 2025-09-01 04:35:28,589] Trial 193 finished with values: [-0.020501383639325854, 0.02032290829897287] and parameters: {'p_sma': 45, 'p_std': 44, 'p_atr': 23, 'p_adx': 24, 'rsi_period': 42, 'ema1': 30, 'ema2': 27, 'slip_atr_k': 5.98642279774278e-05, 'slip_spread_k': 0.3687795023053973, 'spread_hl_frac': 0.04242622958625587, 'bb_std_mult': 2.4207858821456205, 'rsi_os': 47, 'rsi_ob': 57, 'vol_spike': 0.10886670728417266, 'adx_thresh': 15.210768861070086, 'atr_min_pct': 0.0018796325110604513, 'atr_max_pct': 0.08121058383704595, 'tp_mult': 2.471899141344018, 'tsl_mult': 0.9171008013328329, 'strategy': 'breakout', 'time_stop': 21, 'use_sma': True, 'use_atr': False, 'use_adx': False, 'use_ema': True, 'use_spike': False, 'rsi_required': False, 'edge_k': 0.657738815667017, 'edge_cap': 0.163074223347449, 'bull_strategy': 'breakout', 'bull_bb_std_mult': 2.3395236752779436, 'bull_rsi_os': 28, 'bull_rsi_ob': 86, 'bull_adx_thresh': 17.8849893751421, 'bull_atr_min_pct': 0.0009249165306213323, 'bull_atr_max_pct': 0.04188369721802911, 'bull_tp_mult': 1.617919213489911, 'bull_tsl_mult': 0.9344287268059337, 'bull_time_stop': 217, 'bull_use_sma': True, 'bull_use_ema': False, 'bull_use_atr': False, 'bull_use_adx': False, 'bull_use_spike': False, 'bull_rsi_required': True, 'bear_strategy': 'mean_reversion', 'bear_bb_std_mult': 1.032652495599208, 'bear_rsi_os': 48, 'bear_rsi_ob': 56, 'bear_adx_thresh': 33.22281900971624, 'bear_atr_min_pct': 0.017630968508788928, 'bear_atr_max_pct': 0.025703181290024975, 'bear_tp_mult': 1.746520261445421, 'bear_tsl_mult': 0.17114073048557873, 'bear_time_stop': 196, 'bear_use_sma': True, 'bear_use_ema': False, 'bear_use_atr': True, 'bear_use_adx': False, 'bear_use_spike': False, 'bear_rsi_required': True, 'sideways_strategy': 'breakout', 'sideways_bb_std_mult': 3.4747001441084313, 'sideways_rsi_os': 9, 'sideways_rsi_ob': 47, 'sideways_adx_thresh': 17.670584899257367, 'sideways_atr_min_pct': 0.022768128665649125, 'sideways_atr_max_pct': 0.09054985033898219, 'sideways_tp_mult': 2.784057807171739, 'sideways_tsl_mult': 0.589303677130983, 'sideways_time_stop': 184, 'sideways_use_sma': True, 'sideways_use_ema': False, 'sideways_use_atr': False, 'sideways_use_adx': False, 'sideways_use_spike': False, 'sideways_rsi_required': False}.
[I 2025-09-01 04:35:28,911] Trial 191 finished with values: [-1000000000.0, 1000000000.0] and parameters: {'p_sma': 16, 'p_std': 52, 'p_atr': 26, 'p_adx': 20, 'rsi_period': 54, 'ema1': 5, 'ema2': 26, 'slip_atr_k': 0.003808475775469629, 'slip_spread_k': 0.5642033416335717, 'spread_hl_frac': 0.0409218514241086, 'bb_std_mult': 2.4131657700910223, 'rsi_os': 48, 'rsi_ob': 55, 'vol_spike': 0.0006485758754101456, 'adx_thresh': 15.845615901936982, 'atr_min_pct': 0.002207767924649384, 'atr_max_pct': 0.11939590010314062, 'tp_mult': 2.68917748668904, 'tsl_mult': 0.225426366019573, 'strategy': 'breakout', 'time_stop': 9, 'use_sma': True, 'use_atr': False, 'use_adx': False, 'use_ema': True, 'use_spike': True, 'rsi_required': False, 'edge_k': 0.5898302857121827, 'edge_cap': 0.9036236005484378, 'bull_strategy': 'mean_reversion', 'bull_bb_std_mult': 2.1118622725534015, 'bull_rsi_os': 26, 'bull_rsi_ob': 57, 'bull_adx_thresh': 17.520930228211242, 'bull_atr_min_pct': 0.019144548088779786, 'bull_atr_max_pct': 0.04656028335143934, 'bull_tp_mult': 2.5654021884893403, 'bull_tsl_mult': 0.37320351654185324, 'bull_time_stop': 228, 'bull_use_sma': True, 'bull_use_ema': False, 'bull_use_atr': True, 'bull_use_adx': False, 'bull_use_spike': False, 'bull_rsi_required': False, 'bear_strategy': 'mean_reversion', 'bear_bb_std_mult': 1.156426145290501, 'bear_rsi_os': 46, 'bear_rsi_ob': 57, 'bear_adx_thresh': 13.536096530832186, 'bear_atr_min_pct': 0.01741495932838977, 'bear_atr_max_pct': 0.14475360610870602, 'bear_tp_mult': 1.758239568589321, 'bear_tsl_mult': 0.09439578678164359, 'bear_time_stop': 84, 'bear_use_sma': True, 'bear_use_ema': False, 'bear_use_atr': True, 'bear_use_adx': True, 'bear_use_spike': False, 'bear_rsi_required': False, 'sideways_strategy': 'mean_reversion', 'sideways_bb_std_mult': 1.3907022433935203, 'sideways_rsi_os': 6, 'sideways_rsi_ob': 77, 'sideways_adx_thresh': 23.411513222756433, 'sideways_atr_min_pct': 0.006196741313632813, 'sideways_atr_max_pct': 0.09581071911465525, 'sideways_tp_mult': 2.2847974904641943, 'sideways_tsl_mult': 0.9971352607042602, 'sideways_time_stop': 180, 'sideways_use_sma': True, 'sideways_use_ema': True, 'sideways_use_atr': False, 'sideways_use_adx': False, 'sideways_use_spike': False, 'sideways_rsi_required': False}.
[I 2025-09-01 04:35:29,201] Trial 194 finished with values: [-0.05769432953229747, 0.05715477753273044] and parameters: {'p_sma': 17, 'p_std': 44, 'p_atr': 23, 'p_adx': 24, 'rsi_period': 61, 'ema1': 17, 'ema2': 15, 'slip_atr_k': 0.22878321343040903, 'slip_spread_k': 0.3160500097412776, 'spread_hl_frac': 0.042277890344699844, 'bb_std_mult': 0.9429728032636139, 'rsi_os': 47, 'rsi_ob': 57, 'vol_spike': 0.045370679719652765, 'adx_thresh': 29.100133105640758, 'atr_min_pct': 0.02869473970455682, 'atr_max_pct': 0.08149893951766833, 'tp_mult': 2.4843293937546704, 'tsl_mult': 0.9236451935986183, 'strategy': 'breakout', 'time_stop': 248, 'use_sma': True, 'use_atr': False, 'use_adx': False, 'use_ema': True, 'use_spike': False, 'rsi_required': False, 'edge_k': 0.6513382099055559, 'edge_cap': 0.16561037255263422, 'bull_strategy': 'breakout', 'bull_bb_std_mult': 1.8308220107326274, 'bull_rsi_os': 50, 'bull_rsi_ob': 91, 'bull_adx_thresh': 5.811525308203656, 'bull_atr_min_pct': 0.0012013011670349355, 'bull_atr_max_pct': 0.13125015962202782, 'bull_tp_mult': 1.1149976131388026, 'bull_tsl_mult': 0.3769122834996682, 'bull_time_stop': 215, 'bull_use_sma': True, 'bull_use_ema': False, 'bull_use_atr': False, 'bull_use_adx': False, 'bull_use_spike': False, 'bull_rsi_required': True, 'bear_strategy': 'mean_reversion', 'bear_bb_std_mult': 1.0521833940368366, 'bear_rsi_os': 48, 'bear_rsi_ob': 56, 'bear_adx_thresh': 12.158119927951107, 'bear_atr_min_pct': 0.00032078842119187545, 'bear_atr_max_pct': 0.14745857040815288, 'bear_tp_mult': 1.0786822951751602, 'bear_tsl_mult': 0.6357882408163458, 'bear_time_stop': 195, 'bear_use_sma': True, 'bear_use_ema': False, 'bear_use_atr': True, 'bear_use_adx': False, 'bear_use_spike': False, 'bear_rsi_required': True, 'sideways_strategy': 'breakout', 'sideways_bb_std_mult': 1.4632972595279252, 'sideways_rsi_os': 8, 'sideways_rsi_ob': 47, 'sideways_adx_thresh': 17.619161502999013, 'sideways_atr_min_pct': 0.022769696128901864, 'sideways_atr_max_pct': 0.08990955038576315, 'sideways_tp_mult': 2.7960461160889087, 'sideways_tsl_mult': 0.5869658107998534, 'sideways_time_stop': 186, 'sideways_use_sma': True, 'sideways_use_ema': False, 'sideways_use_atr': False, 'sideways_use_adx': False, 'sideways_use_spike': False, 'sideways_rsi_required': False}.
[I 2025-09-01 04:36:08,073] Trial 196 finished with values: [-1000000000.0, 1000000000.0] and parameters: {'p_sma': 16, 'p_std': 52, 'p_atr': 26, 'p_adx': 25, 'rsi_period': 61, 'ema1': 14, 'ema2': 16, 'slip_atr_k': 0.010661285740809729, 'slip_spread_k': 0.3190973755902849, 'spread_hl_frac': 0.04338997707759648, 'bb_std_mult': 1.021552103639891, 'rsi_os': 46, 'rsi_ob': 56, 'vol_spike': 0.2455778865399369, 'adx_thresh': 15.15636016242844, 'atr_min_pct': 0.0019937620870078675, 'atr_max_pct': 0.11381205784514387, 'tp_mult': 2.473828122361239, 'tsl_mult': 0.9146007186925442, 'strategy': 'breakout', 'time_stop': 185, 'use_sma': True, 'use_atr': False, 'use_adx': False, 'use_ema': True, 'use_spike': True, 'rsi_required': False, 'edge_k': 0.6240578013063576, 'edge_cap': 0.33394870223687245, 'bull_strategy': 'mean_reversion', 'bull_bb_std_mult': 1.8102219780410613, 'bull_rsi_os': 49, 'bull_rsi_ob': 51, 'bull_adx_thresh': 6.271119509817163, 'bull_atr_min_pct': 0.026859834748995864, 'bull_atr_max_pct': 0.04494279312798436, 'bull_tp_mult': 1.6188824726882507, 'bull_tsl_mult': 0.3704952690658109, 'bull_time_stop': 219, 'bull_use_sma': True, 'bull_use_ema': False, 'bull_use_atr': True, 'bull_use_adx': False, 'bull_use_spike': False, 'bull_rsi_required': False, 'bear_strategy': 'mean_reversion', 'bear_bb_std_mult': 1.0308326557849061, 'bear_rsi_os': 44, 'bear_rsi_ob': 58, 'bear_adx_thresh': 28.21563374087738, 'bear_atr_min_pct': 0.02290096431917367, 'bear_atr_max_pct': 0.14984179548607204, 'bear_tp_mult': 1.0811463096376241, 'bear_tsl_mult': 0.6366183786321162, 'bear_time_stop': 204, 'bear_use_sma': False, 'bear_use_ema': False, 'bear_use_atr': True, 'bear_use_adx': True, 'bear_use_spike': False, 'bear_rsi_required': False, 'sideways_strategy': 'mean_reversion', 'sideways_bb_std_mult': 1.5375638959299063, 'sideways_rsi_os': 8, 'sideways_rsi_ob': 48, 'sideways_adx_thresh': 18.63304574645117, 'sideways_atr_min_pct': 0.026475003687721682, 'sideways_atr_max_pct': 0.08783127489847457, 'sideways_tp_mult': 2.7921834275629873, 'sideways_tsl_mult': 0.999502203173845, 'sideways_time_stop': 197, 'sideways_use_sma': True, 'sideways_use_ema': True, 'sideways_use_atr': False, 'sideways_use_adx': False, 'sideways_use_spike': False, 'sideways_rsi_required': False}.
[I 2025-09-01 04:36:09,541] Trial 198 finished with values: [-1000000000.0, 1000000000.0] and parameters: {'p_sma': 19, 'p_std': 42, 'p_atr': 26, 'p_adx': 19, 'rsi_period': 61, 'ema1': 30, 'ema2': 29, 'slip_atr_k': 0.007971633237150149, 'slip_spread_k': 0.2816242780657084, 'spread_hl_frac': 0.04346168351516753, 'bb_std_mult': 3.20090554989513, 'rsi_os': 46, 'rsi_ob': 56, 'vol_spike': 0.24432167725996692, 'adx_thresh': 15.208034064197587, 'atr_min_pct': 0.0017748267172929533, 'atr_max_pct': 0.04916445541689053, 'tp_mult': 2.4737284002958213, 'tsl_mult': 0.801166714123806, 'strategy': 'breakout', 'time_stop': 185, 'use_sma': True, 'use_atr': False, 'use_adx': False, 'use_ema': True, 'use_spike': True, 'rsi_required': False, 'edge_k': 0.5446826380330041, 'edge_cap': 0.18708715736586573, 'bull_strategy': 'mean_reversion', 'bull_bb_std_mult': 2.018929179907541, 'bull_rsi_os': 27, 'bull_rsi_ob': 93, 'bull_adx_thresh': 18.74226934132188, 'bull_atr_min_pct': 0.008957519687286955, 'bull_atr_max_pct': 0.12427811554945353, 'bull_tp_mult': 1.6217397220968606, 'bull_tsl_mult': 0.40234490289010616, 'bull_time_stop': 218, 'bull_use_sma': True, 'bull_use_ema': True, 'bull_use_atr': True, 'bull_use_adx': False, 'bull_use_spike': False, 'bull_rsi_required': False, 'bear_strategy': 'mean_reversion', 'bear_bb_std_mult': 1.0012384172276338, 'bear_rsi_os': 44, 'bear_rsi_ob': 55, 'bear_adx_thresh': 29.048182067811705, 'bear_atr_min_pct': 0.018436659341507892, 'bear_atr_max_pct': 0.05047974546291818, 'bear_tp_mult': 2.2255028660423535, 'bear_tsl_mult': 0.22516171257581846, 'bear_time_stop': 205, 'bear_use_sma': False, 'bear_use_ema': False, 'bear_use_atr': True, 'bear_use_adx': True, 'bear_use_spike': False, 'bear_rsi_required': False, 'sideways_strategy': 'mean_reversion', 'sideways_bb_std_mult': 1.5606486211622772, 'sideways_rsi_os': 7, 'sideways_rsi_ob': 48, 'sideways_adx_thresh': 34.23248959756515, 'sideways_atr_min_pct': 0.02643529793081476, 'sideways_atr_max_pct': 0.040901515262678184, 'sideways_tp_mult': 1.3475138677939345, 'sideways_tsl_mult': 0.6657467653596857, 'sideways_time_stop': 171, 'sideways_use_sma': True, 'sideways_use_ema': True, 'sideways_use_atr': False, 'sideways_use_adx': False, 'sideways_use_spike': False, 'sideways_rsi_required': False}.
[I 2025-09-01 04:36:09,968] Trial 195 finished with values: [-0.050763020543947435, 0.050587524069093406] and parameters: {'p_sma': 9, 'p_std': 11, 'p_atr': 26, 'p_adx': 24, 'rsi_period': 54, 'ema1': 9, 'ema2': 27, 'slip_atr_k': 0.2267505252627507, 'slip_spread_k': 0.31759570473819837, 'spread_hl_frac': 0.04296825250515548, 'bb_std_mult': 1.0124159386126999, 'rsi_os': 46, 'rsi_ob': 56, 'vol_spike': 0.044744375654815635, 'adx_thresh': 15.219277454523453, 'atr_min_pct': 0.0020384272517064506, 'atr_max_pct': 0.11358534097722643, 'tp_mult': 2.4977486706093206, 'tsl_mult': 0.007856172898336511, 'strategy': 'breakout', 'time_stop': 19, 'use_sma': True, 'use_atr': False, 'use_adx': False, 'use_ema': True, 'use_spike': True, 'rsi_required': False, 'edge_k': 0.6255603563075026, 'edge_cap': 0.16541755050944965, 'bull_strategy': 'mean_reversion', 'bull_bb_std_mult': 2.1469806485874967, 'bull_rsi_os': 14, 'bull_rsi_ob': 87, 'bull_adx_thresh': 5.973847949197996, 'bull_atr_min_pct': 0.0013659573384538128, 'bull_atr_max_pct': 0.12525810831900208, 'bull_tp_mult': 1.6159263302675322, 'bull_tsl_mult': 0.3723819030983784, 'bull_time_stop': 217, 'bull_use_sma': True, 'bull_use_ema': False, 'bull_use_atr': True, 'bull_use_adx': False, 'bull_use_spike': False, 'bull_rsi_required': False, 'bear_strategy': 'mean_reversion', 'bear_bb_std_mult': 1.0108583547807233, 'bear_rsi_os': 44, 'bear_rsi_ob': 58, 'bear_adx_thresh': 14.521615739685798, 'bear_atr_min_pct': 0.0187648174909269, 'bear_atr_max_pct': 0.044813551601352926, 'bear_tp_mult': 1.8736642218389208, 'bear_tsl_mult': 0.1693931899047294, 'bear_time_stop': 195, 'bear_use_sma': False, 'bear_use_ema': False, 'bear_use_atr': True, 'bear_use_adx': True, 'bear_use_spike': False, 'bear_rsi_required': False, 'sideways_strategy': 'mean_reversion', 'sideways_bb_std_mult': 1.280679847927968, 'sideways_rsi_os': 8, 'sideways_rsi_ob': 48, 'sideways_adx_thresh': 34.584515830417736, 'sideways_atr_min_pct': 0.015014116272837864, 'sideways_atr_max_pct': 0.10203008467730539, 'sideways_tp_mult': 2.7957140132523595, 'sideways_tsl_mult': 0.9592562042169187, 'sideways_time_stop': 197, 'sideways_use_sma': True, 'sideways_use_ema': True, 'sideways_use_atr': False, 'sideways_use_adx': False, 'sideways_use_spike': False, 'sideways_rsi_required': False}.
