[I 2025-09-01 05:34:47,504] Trial 528 finished with values: [-1000000000.0, 1000000000.0] and parameters: {'p_sma': 60, 'p_std': 13, 'p_atr': 7, 'p_adx': 9, 'rsi_period': 50, 'ema1': 24, 'ema2': 56, 'slip_atr_k': 0.03589143289290507, 'slip_spread_k': 0.3881623735835953, 'spread_hl_frac': 0.005780713033990102, 'bb_std_mult': 1.9026702864156597, 'rsi_os': 27, 'rsi_ob': 88, 'vol_spike': 0.03480452672763562, 'adx_thresh': 9.003931976474028, 'atr_min_pct': 0.010012098350005383, 'atr_max_pct': 0.019605827205449927, 'tp_mult': 2.501155185773435, 'tsl_mult': 0.6441202729033012, 'strategy': 'breakout', 'time_stop': 195, 'use_sma': False, 'use_atr': True, 'use_adx': True, 'use_ema': True, 'use_spike': True, 'rsi_required': False, 'edge_k': 0.37337974509929894, 'edge_cap': 0.9158657392927312, 'bull_strategy': 'breakout', 'bull_bb_std_mult': 0.7930898562223437, 'bull_rsi_os': 50, 'bull_rsi_ob': 87, 'bull_adx_thresh': 6.956822278979266, 'bull_atr_min_pct': 0.013822373087204213, 'bull_atr_max_pct': 0.10501967541790572, 'bull_tp_mult': 1.2068451145014043, 'bull_tsl_mult': 0.21264048186119808, 'bull_time_stop': 92, 'bull_use_sma': True, 'bull_use_ema': False, 'bull_use_atr': False, 'bull_use_adx': True, 'bull_use_spike': True, 'bull_rsi_required': True, 'bear_strategy': 'breakout', 'bear_bb_std_mult': 3.5323412884937904, 'bear_rsi_os': 34, 'bear_rsi_ob': 71, 'bear_adx_thresh': 31.184459263943598, 'bear_atr_min_pct': 0.009054757088001459, 'bear_atr_max_pct': 0.06352999589766933, 'bear_tp_mult': 2.861040527210721, 'bear_tsl_mult': 0.6623814508334092, 'bear_time_stop': 212, 'bear_use_sma': True, 'bear_use_ema': False, 'bear_use_atr': False, 'bear_use_adx': False, 'bear_use_spike': True, 'bear_rsi_required': False, 'sideways_strategy': 'mean_reversion', 'sideways_bb_std_mult': 0.8153943657442301, 'sideways_rsi_os': 55, 'sideways_rsi_ob': 71, 'sideways_adx_thresh': 22.936489673231033, 'sideways_atr_min_pct': 0.006657079283749161, 'sideways_atr_max_pct': 0.10258160287988971, 'sideways_tp_mult': 2.3351120278438753, 'sideways_tsl_mult': 0.21550079706293868, 'sideways_time_stop': 179, 'sideways_use_sma': False, 'sideways_use_ema': True, 'sideways_use_atr': True, 'sideways_use_adx': False, 'sideways_use_spike': True, 'sideways_rsi_required': True}.
[I 2025-09-01 05:35:26,529] Trial 535 finished with values: [-1000000000.0, 1000000000.0] and parameters: {'p_sma': 56, 'p_std': 34, 'p_atr': 7, 'p_adx': 16, 'rsi_period': 80, 'ema1': 25, 'ema2': 33, 'slip_atr_k': 0.08229111963516042, 'slip_spread_k': 0.4506203911936586, 'spread_hl_frac': 0.048348034213619315, 'bb_std_mult': 2.239644705968832, 'rsi_os': 24, 'rsi_ob': 86, 'vol_spike': 0.10722304546674596, 'adx_thresh': 12.9740870281594, 'atr_min_pct': 0.004523345527743821, 'atr_max_pct': 0.12053292634439801, 'tp_mult': 1.997401258047368, 'tsl_mult': 0.8977219782971468, 'strategy': 'breakout', 'time_stop': 166, 'use_sma': False, 'use_atr': True, 'use_adx': False, 'use_ema': True, 'use_spike': False, 'rsi_required': False, 'edge_k': 0.1262181366002239, 'edge_cap': 0.4575125377766852, 'bull_strategy': 'mean_reversion', 'bull_bb_std_mult': 0.8934450560196866, 'bull_rsi_os': 47, 'bull_rsi_ob': 57, 'bull_adx_thresh': 5.105078119951262, 'bull_atr_min_pct': 0.014297487180359125, 'bull_atr_max_pct': 0.14104839198642127, 'bull_tp_mult': 2.465743581161334, 'bull_tsl_mult': 0.25638358199395095, 'bull_time_stop': 99, 'bull_use_sma': False, 'bull_use_ema': False, 'bull_use_atr': False, 'bull_use_adx': True, 'bull_use_spike': False, 'bull_rsi_required': True, 'bear_strategy': 'breakout', 'bear_bb_std_mult': 2.2172774704435163, 'bear_rsi_os': 6, 'bear_rsi_ob': 66, 'bear_adx_thresh': 28.85578259360662, 'bear_atr_min_pct': 0.007966623404944058, 'bear_atr_max_pct': 0.0712900823165319, 'bear_tp_mult': 1.3345391818740908, 'bear_tsl_mult': 0.6360269793405876, 'bear_time_stop': 32, 'bear_use_sma': True, 'bear_use_ema': True, 'bear_use_atr': False, 'bear_use_adx': True, 'bear_use_spike': False, 'bear_rsi_required': True, 'sideways_strategy': 'breakout', 'sideways_bb_std_mult': 2.6416081075220994, 'sideways_rsi_os': 43, 'sideways_rsi_ob': 55, 'sideways_adx_thresh': 24.35280169738363, 'sideways_atr_min_pct': 0.00437876375270278, 'sideways_atr_max_pct': 0.09795591943378984, 'sideways_tp_mult': 1.5755942139598242, 'sideways_tsl_mult': 0.9998639411332084, 'sideways_time_stop': 225, 'sideways_use_sma': False, 'sideways_use_ema': False, 'sideways_use_atr': True, 'sideways_use_adx': True, 'sideways_use_spike': False, 'sideways_rsi_required': True}.
[I 2025-09-01 05:35:27,997] Trial 532 finished with values: [-1000000000.0, 1000000000.0] and parameters: {'p_sma': 56, 'p_std': 34, 'p_atr': 7, 'p_adx': 18, 'rsi_period': 53, 'ema1': 25, 'ema2': 10, 'slip_atr_k': 0.012071918784256496, 'slip_spread_k': 0.4665755662255794, 'spread_hl_frac': 0.025435433027384283, 'bb_std_mult': 2.2428929312268138, 'rsi_os': 24, 'rsi_ob': 86, 'vol_spike': 0.21358740641185026, 'adx_thresh': 34.428903085238915, 'atr_min_pct': 0.004748712421738261, 'atr_max_pct': 0.03295764978621726, 'tp_mult': 1.9968627684166882, 'tsl_mult': 0.7707708139593218, 'strategy': 'breakout', 'time_stop': 159, 'use_sma': False, 'use_atr': True, 'use_adx': False, 'use_ema': True, 'use_spike': True, 'rsi_required': False, 'edge_k': 0.07306226242656619, 'edge_cap': 0.5174633280359661, 'bull_strategy': 'breakout', 'bull_bb_std_mult': 1.1383079693581406, 'bull_rsi_os': 50, 'bull_rsi_ob': 57, 'bull_adx_thresh': 5.130113469983714, 'bull_atr_min_pct': 0.015296315329389621, 'bull_atr_max_pct': 0.038201204943931144, 'bull_tp_mult': 1.2105008407726991, 'bull_tsl_mult': 0.23369466683787649, 'bull_time_stop': 81, 'bull_use_sma': False, 'bull_use_ema': False, 'bull_use_atr': False, 'bull_use_adx': True, 'bull_use_spike': False, 'bull_rsi_required': True, 'bear_strategy': 'breakout', 'bear_bb_std_mult': 3.4089649498183126, 'bear_rsi_os': 5, 'bear_rsi_ob': 71, 'bear_adx_thresh': 27.934002716766933, 'bear_atr_min_pct': 0.007820046930844092, 'bear_atr_max_pct': 0.06303993521390734, 'bear_tp_mult': 2.4215507669116274, 'bear_tsl_mult': 0.6333945444423034, 'bear_time_stop': 200, 'bear_use_sma': True, 'bear_use_ema': False, 'bear_use_atr': False, 'bear_use_adx': False, 'bear_use_spike': False, 'bear_rsi_required': False, 'sideways_strategy': 'breakout', 'sideways_bb_std_mult': 2.667088775565918, 'sideways_rsi_os': 42, 'sideways_rsi_ob': 56, 'sideways_adx_thresh': 23.09612307819336, 'sideways_atr_min_pct': 0.006374050424647332, 'sideways_atr_max_pct': 0.023500223832677768, 'sideways_tp_mult': 1.694715750047979, 'sideways_tsl_mult': 0.716180654289303, 'sideways_time_stop': 52, 'sideways_use_sma': False, 'sideways_use_ema': True, 'sideways_use_atr': True, 'sideways_use_adx': True, 'sideways_use_spike': True, 'sideways_rsi_required': True}.
[I 2025-09-01 05:35:28,418] Trial 533 finished with values: [-1000000000.0, 1000000000.0] and parameters: {'p_sma': 56, 'p_std': 34, 'p_atr': 7, 'p_adx': 18, 'rsi_period': 53, 'ema1': 25, 'ema2': 56, 'slip_atr_k': 0.24062415587397312, 'slip_spread_k': 0.398689742387197, 'spread_hl_frac': 0.0463917758377203, 'bb_std_mult': 2.277107112745779, 'rsi_os': 24, 'rsi_ob': 89, 'vol_spike': 0.2147185244594901, 'adx_thresh': 21.595242315746322, 'atr_min_pct': 0.004906879045838869, 'atr_max_pct': 0.14992266121944087, 'tp_mult': 1.9195532307838494, 'tsl_mult': 0.9501199267934056, 'strategy': 'breakout', 'time_stop': 189, 'use_sma': False, 'use_atr': True, 'use_adx': False, 'use_ema': True, 'use_spike': True, 'rsi_required': False, 'edge_k': 0.08047009450237005, 'edge_cap': 0.8989566844496382, 'bull_strategy': 'breakout', 'bull_bb_std_mult': 0.8919450798290166, 'bull_rsi_os': 50, 'bull_rsi_ob': 89, 'bull_adx_thresh': 5.016831106565632, 'bull_atr_min_pct': 0.01573930272396669, 'bull_atr_max_pct': 0.10307039850696334, 'bull_tp_mult': 1.2260776961868507, 'bull_tsl_mult': 0.24394804779073942, 'bull_time_stop': 82, 'bull_use_sma': False, 'bull_use_ema': False, 'bull_use_atr': False, 'bull_use_adx': True, 'bull_use_spike': False, 'bull_rsi_required': True, 'bear_strategy': 'breakout', 'bear_bb_std_mult': 3.4050940580969105, 'bear_rsi_os': 6, 'bear_rsi_ob': 66, 'bear_adx_thresh': 27.779738557790274, 'bear_atr_min_pct': 0.00808217611970123, 'bear_atr_max_pct': 0.10736444915664045, 'bear_tp_mult': 1.3320514628138156, 'bear_tsl_mult': 0.6359469282665449, 'bear_time_stop': 35, 'bear_use_sma': True, 'bear_use_ema': False, 'bear_use_atr': False, 'bear_use_adx': False, 'bear_use_spike': False, 'bear_rsi_required': False, 'sideways_strategy': 'breakout', 'sideways_bb_std_mult': 0.7171576176735599, 'sideways_rsi_os': 43, 'sideways_rsi_ob': 71, 'sideways_adx_thresh': 24.34612864613327, 'sideways_atr_min_pct': 0.006489734030490581, 'sideways_atr_max_pct': 0.10254249277168676, 'sideways_tp_mult': 1.5922808190944502, 'sideways_tsl_mult': 0.025134217622780286, 'sideways_time_stop': 180, 'sideways_use_sma': False, 'sideways_use_ema': True, 'sideways_use_atr': True, 'sideways_use_adx': True, 'sideways_use_spike': True, 'sideways_rsi_required': True}.
[I 2025-09-01 05:35:28,736] Trial 534 finished with values: [-1000000000.0, 1000000000.0] and parameters: {'p_sma': 60, 'p_std': 34, 'p_atr': 7, 'p_adx': 18, 'rsi_period': 53, 'ema1': 25, 'ema2': 38, 'slip_atr_k': 0.14427926856836834, 'slip_spread_k': 0.9038059489267464, 'spread_hl_frac': 0.048701735100185446, 'bb_std_mult': 2.227447028137832, 'rsi_os': 24, 'rsi_ob': 87, 'vol_spike': 0.2148061200620181, 'adx_thresh': 13.15298131074006, 'atr_min_pct': 0.012370394088268939, 'atr_max_pct': 0.033323311341105125, 'tp_mult': 1.2415013803334018, 'tsl_mult': 0.6896980703231125, 'strategy': 'breakout', 'time_stop': 191, 'use_sma': False, 'use_atr': True, 'use_adx': False, 'use_ema': True, 'use_spike': True, 'rsi_required': False, 'edge_k': 0.2306004780909727, 'edge_cap': 0.45784829132872246, 'bull_strategy': 'mean_reversion', 'bull_bb_std_mult': 1.1364318455308513, 'bull_rsi_os': 47, 'bull_rsi_ob': 89, 'bull_adx_thresh': 5.03386904890286, 'bull_atr_min_pct': 0.014207408730537656, 'bull_atr_max_pct': 0.10847882850732274, 'bull_tp_mult': 1.1801314924608302, 'bull_tsl_mult': 0.17080294444376243, 'bull_time_stop': 83, 'bull_use_sma': False, 'bull_use_ema': False, 'bull_use_atr': False, 'bull_use_adx': True, 'bull_use_spike': False, 'bull_rsi_required': True, 'bear_strategy': 'breakout', 'bear_bb_std_mult': 3.599558627712449, 'bear_rsi_os': 9, 'bear_rsi_ob': 66, 'bear_adx_thresh': 27.887879709626805, 'bear_atr_min_pct': 0.0077126320644277, 'bear_atr_max_pct': 0.07099451967902876, 'bear_tp_mult': 2.4568230409854954, 'bear_tsl_mult': 0.6358465768847311, 'bear_time_stop': 144, 'bear_use_sma': True, 'bear_use_ema': True, 'bear_use_atr': False, 'bear_use_adx': False, 'bear_use_spike': False, 'bear_rsi_required': True, 'sideways_strategy': 'breakout', 'sideways_bb_std_mult': 0.7175911060340151, 'sideways_rsi_os': 43, 'sideways_rsi_ob': 55, 'sideways_adx_thresh': 23.03741762893463, 'sideways_atr_min_pct': 0.004514217055704782, 'sideways_atr_max_pct': 0.024590303097762327, 'sideways_tp_mult': 1.5736547076568028, 'sideways_tsl_mult': 0.09737395082273681, 'sideways_time_stop': 222, 'sideways_use_sma': False, 'sideways_use_ema': True, 'sideways_use_atr': True, 'sideways_use_adx': True, 'sideways_use_spike': True, 'sideways_rsi_required': True}.
[I 2025-09-01 05:36:06,885] Trial 539 finished with values: [-1000000000.0, 1000000000.0] and parameters: {'p_sma': 58, 'p_std': 33, 'p_atr': 8, 'p_adx': 24, 'rsi_period': 57, 'ema1': 23, 'ema2': 60, 'slip_atr_k': 0.158927533001786, 'slip_spread_k': 0.9704680140800502, 'spread_hl_frac': 0.004251265000195178, 'bb_std_mult': 2.145632134339132, 'rsi_os': 11, 'rsi_ob': 66, 'vol_spike': 0.1939858625571912, 'adx_thresh': 11.963687028787717, 'atr_min_pct': 0.002861714673368064, 'atr_max_pct': 0.12040371047023153, 'tp_mult': 2.6104559710174104, 'tsl_mult': 0.4042932424782977, 'strategy': 'breakout', 'time_stop': 207, 'use_sma': True, 'use_atr': True, 'use_adx': False, 'use_ema': True, 'use_spike': False, 'rsi_required': False, 'edge_k': 0.31682827783762735, 'edge_cap': 0.489154712820552, 'bull_strategy': 'breakout', 'bull_bb_std_mult': 0.867849524965604, 'bull_rsi_os': 49, 'bull_rsi_ob': 90, 'bull_adx_thresh': 5.926482451702732, 'bull_atr_min_pct': 0.01273137830593865, 'bull_atr_max_pct': 0.10848497154052594, 'bull_tp_mult': 1.2856866558057691, 'bull_tsl_mult': 0.17223569734256727, 'bull_time_stop': 100, 'bull_use_sma': True, 'bull_use_ema': False, 'bull_use_atr': False, 'bull_use_adx': True, 'bull_use_spike': False, 'bull_rsi_required': True, 'bear_strategy': 'breakout', 'bear_bb_std_mult': 3.13768559344012, 'bear_rsi_os': 41, 'bear_rsi_ob': 76, 'bear_adx_thresh': 29.384037770115402, 'bear_atr_min_pct': 0.006866246984486104, 'bear_atr_max_pct': 0.06740847944903716, 'bear_tp_mult': 1.9876252542940025, 'bear_tsl_mult': 0.3216840844297326, 'bear_time_stop': 192, 'bear_use_sma': True, 'bear_use_ema': False, 'bear_use_atr': True, 'bear_use_adx': True, 'bear_use_spike': False, 'bear_rsi_required': False, 'sideways_strategy': 'breakout', 'sideways_bb_std_mult': 2.15731991240705, 'sideways_rsi_os': 20, 'sideways_rsi_ob': 53, 'sideways_adx_thresh': 26.323311357196545, 'sideways_atr_min_pct': 0.005004913181420777, 'sideways_atr_max_pct': 0.032950396003579754, 'sideways_tp_mult': 2.512538160526045, 'sideways_tsl_mult': 0.9788916305000119, 'sideways_time_stop': 115, 'sideways_use_sma': False, 'sideways_use_ema': False, 'sideways_use_atr': True, 'sideways_use_adx': False, 'sideways_use_spike': False, 'sideways_rsi_required': True}.
[I 2025-09-01 05:36:09,674] Trial 536 finished with values: [-1000000000.0, 1000000000.0] and parameters: {'p_sma': 60, 'p_std': 33, 'p_atr': 7, 'p_adx': 24, 'rsi_period': 53, 'ema1': 23, 'ema2': 32, 'slip_atr_k': 0.23708832588799522, 'slip_spread_k': 0.8941241132367479, 'spread_hl_frac': 0.04590440799022179, 'bb_std_mult': 1.98375495383097, 'rsi_os': 12, 'rsi_ob': 93, 'vol_spike': 0.21423435901673446, 'adx_thresh': 34.253066591808995, 'atr_min_pct': 0.004828516964346798, 'atr_max_pct': 0.09680283071376973, 'tp_mult': 1.2198297496426522, 'tsl_mult': 0.9562842366343791, 'strategy': 'breakout', 'time_stop': 189, 'use_sma': False, 'use_atr': True, 'use_adx': False, 'use_ema': True, 'use_spike': True, 'rsi_required': False, 'edge_k': 0.22366191341497357, 'edge_cap': 0.5181141060922089, 'bull_strategy': 'breakout', 'bull_bb_std_mult': 1.123545114952498, 'bull_rsi_os': 49, 'bull_rsi_ob': 89, 'bull_adx_thresh': 6.425182836556907, 'bull_atr_min_pct': 0.015440652917386473, 'bull_atr_max_pct': 0.1088907836955613, 'bull_tp_mult': 1.9958173555242622, 'bull_tsl_mult': 0.17688815551774334, 'bull_time_stop': 162, 'bull_use_sma': False, 'bull_use_ema': False, 'bull_use_atr': False, 'bull_use_adx': True, 'bull_use_spike': False, 'bull_rsi_required': True, 'bear_strategy': 'breakout', 'bear_bb_std_mult': 3.4163268733939147, 'bear_rsi_os': 30, 'bear_rsi_ob': 66, 'bear_adx_thresh': 29.164967860108906, 'bear_atr_min_pct': 0.007732159701934685, 'bear_atr_max_pct': 0.08427147795267946, 'bear_tp_mult': 2.9984623153493604, 'bear_tsl_mult': 0.8193232363165528, 'bear_time_stop': 199, 'bear_use_sma': True, 'bear_use_ema': False, 'bear_use_atr': False, 'bear_use_adx': False, 'bear_use_spike': False, 'bear_rsi_required': False, 'sideways_strategy': 'breakout', 'sideways_bb_std_mult': 0.7294521594507832, 'sideways_rsi_os': 43, 'sideways_rsi_ob': 56, 'sideways_adx_thresh': 23.425399504405327, 'sideways_atr_min_pct': 0.004817464767547568, 'sideways_atr_max_pct': 0.023458576021202195, 'sideways_tp_mult': 1.6827418538048418, 'sideways_tsl_mult': 0.9697444131037272, 'sideways_time_stop': 181, 'sideways_use_sma': False, 'sideways_use_ema': True, 'sideways_use_atr': True, 'sideways_use_adx': True, 'sideways_use_spike': True, 'sideways_rsi_required': True}.
[I 2025-09-01 05:36:09,854] Trial 537 finished with values: [-0.03595656466552577, 0.0357525979252725] and parameters: {'p_sma': 58, 'p_std': 30, 'p_atr': 8, 'p_adx': 22, 'rsi_period': 52, 'ema1': 26, 'ema2': 17, 'slip_atr_k': 0.17509171753347355, 'slip_spread_k': 0.5176818100991922, 'spread_hl_frac': 0.04596674689395987, 'bb_std_mult': 1.9833149825523484, 'rsi_os': 25, 'rsi_ob': 89, 'vol_spike': 0.19378893017815094, 'adx_thresh': 13.170063382460587, 'atr_min_pct': 0.013727633296660876, 'atr_max_pct': 0.09713839685134804, 'tp_mult': 1.9169178774880615, 'tsl_mult': 0.6892153411782658, 'strategy': 'breakout', 'time_stop': 189, 'use_sma': False, 'use_atr': True, 'use_adx': False, 'use_ema': True, 'use_spike': True, 'rsi_required': False, 'edge_k': 0.22409375720330926, 'edge_cap': 0.490887941651922, 'bull_strategy': 'breakout', 'bull_bb_std_mult': 0.8697543974173024, 'bull_rsi_os': 49, 'bull_rsi_ob': 89, 'bull_adx_thresh': 6.321146382341321, 'bull_atr_min_pct': 0.012810224398685979, 'bull_atr_max_pct': 0.10846439801764066, 'bull_tp_mult': 1.2838118293562233, 'bull_tsl_mult': 0.17916315410602768, 'bull_time_stop': 137, 'bull_use_sma': True, 'bull_use_ema': False, 'bull_use_atr': False, 'bull_use_adx': True, 'bull_use_spike': False, 'bull_rsi_required': True, 'bear_strategy': 'breakout', 'bear_bb_std_mult': 3.4396141899715578, 'bear_rsi_os': 41, 'bear_rsi_ob': 66, 'bear_adx_thresh': 29.396501115311143, 'bear_atr_min_pct': 0.0067323239550508285, 'bear_atr_max_pct': 0.06671010584128777, 'bear_tp_mult': 1.3733357053030426, 'bear_tsl_mult': 0.3470124374256465, 'bear_time_stop': 142, 'bear_use_sma': True, 'bear_use_ema': False, 'bear_use_atr': True, 'bear_use_adx': False, 'bear_use_spike': False, 'bear_rsi_required': False, 'sideways_strategy': 'breakout', 'sideways_bb_std_mult': 1.8764293059686636, 'sideways_rsi_os': 52, 'sideways_rsi_ob': 54, 'sideways_adx_thresh': 23.41841219942098, 'sideways_atr_min_pct': 0.0045890185037078075, 'sideways_atr_max_pct': 0.10693374808757304, 'sideways_tp_mult': 1.5754723165717077, 'sideways_tsl_mult': 0.9696396181776438, 'sideways_time_stop': 176, 'sideways_use_sma': False, 'sideways_use_ema': True, 'sideways_use_atr': True, 'sideways_use_adx': False, 'sideways_use_spike': True, 'sideways_rsi_required': True}.
[I 2025-09-01 05:36:10,221] Trial 538 finished with values: [-1000000000.0, 1000000000.0] and parameters: {'p_sma': 58, 'p_std': 38, 'p_atr': 8, 'p_adx': 24, 'rsi_period': 52, 'ema1': 23, 'ema2': 31, 'slip_atr_k': 0.1735946790679243, 'slip_spread_k': 0.9493597490611614, 'spread_hl_frac': 0.04889935761506211, 'bb_std_mult': 1.9917370722518386, 'rsi_os': 6, 'rsi_ob': 93, 'vol_spike': 0.005920695691983696, 'adx_thresh': 13.162879008347133, 'atr_min_pct': 0.013904606486994014, 'atr_max_pct': 0.09703315034028331, 'tp_mult': 2.62036895014475, 'tsl_mult': 0.7145998475502857, 'strategy': 'breakout', 'time_stop': 188, 'use_sma': True, 'use_atr': True, 'use_adx': False, 'use_ema': True, 'use_spike': False, 'rsi_required': False, 'edge_k': 0.22856391100993906, 'edge_cap': 0.48748387830210577, 'bull_strategy': 'mean_reversion', 'bull_bb_std_mult': 0.8649447820190975, 'bull_rsi_os': 54, 'bull_rsi_ob': 90, 'bull_adx_thresh': 6.057585141136549, 'bull_atr_min_pct': 0.012691378109073483, 'bull_atr_max_pct': 0.10906288286957515, 'bull_tp_mult': 1.2770905201985148, 'bull_tsl_mult': 0.17677196516555904, 'bull_time_stop': 102, 'bull_use_sma': True, 'bull_use_ema': False, 'bull_use_atr': False, 'bull_use_adx': True, 'bull_use_spike': False, 'bull_rsi_required': True, 'bear_strategy': 'breakout', 'bear_bb_std_mult': 3.5987572230104834, 'bear_rsi_os': 10, 'bear_rsi_ob': 69, 'bear_adx_thresh': 29.201773689795697, 'bear_atr_min_pct': 0.006777427035141873, 'bear_atr_max_pct': 0.04076523453371714, 'bear_tp_mult': 1.3791317679481798, 'bear_tsl_mult': 0.9506039508530192, 'bear_time_stop': 146, 'bear_use_sma': True, 'bear_use_ema': True, 'bear_use_atr': True, 'bear_use_adx': False, 'bear_use_spike': False, 'bear_rsi_required': True, 'sideways_strategy': 'breakout', 'sideways_bb_std_mult': 2.233487298732573, 'sideways_rsi_os': 20, 'sideways_rsi_ob': 53, 'sideways_adx_thresh': 26.034942240738243, 'sideways_atr_min_pct': 0.0049876467927449635, 'sideways_atr_max_pct': 0.010623270130774506, 'sideways_tp_mult': 1.5576775030011616, 'sideways_tsl_mult': 0.999596569361059, 'sideways_time_stop': 176, 'sideways_use_sma': False, 'sideways_use_ema': True, 'sideways_use_atr': True, 'sideways_use_adx': False, 'sideways_use_spike': True, 'sideways_rsi_required': True}.
