[I 2025-09-01 04:58:17,063] Trial 325 finished with values: [-1000000000.0, 1000000000.0] and parameters: {'p_sma': 28, 'p_std': 55, 'p_atr': 10, 'p_adx': 13, 'rsi_period': 11, 'ema1': 29, 'ema2': 29, 'slip_atr_k': 0.17774599888659573, 'slip_spread_k': 0.3029449092276635, 'spread_hl_frac': 0.046680818116586496, 'bb_std_mult': 3.369282985152281, 'rsi_os': 20, 'rsi_ob': 78, 'vol_spike': 0.2189703926722959, 'adx_thresh': 14.479281260916, 'atr_min_pct': 0.024878298971084376, 'atr_max_pct': 0.1084472468434709, 'tp_mult': 2.544811798992868, 'tsl_mult': 0.970334181471957, 'strategy': 'breakout', 'time_stop': 35, 'use_sma': False, 'use_atr': True, 'use_adx': False, 'use_ema': False, 'use_spike': True, 'rsi_required': False, 'edge_k': 0.4828217485201034, 'edge_cap': 0.4193550089912015, 'bull_strategy': 'breakout', 'bull_bb_std_mult': 2.187414882558097, 'bull_rsi_os': 34, 'bull_rsi_ob': 45, 'bull_adx_thresh': 6.500232258726253, 'bull_atr_min_pct': 0.019458051217927187, 'bull_atr_max_pct': 0.11819613675853513, 'bull_tp_mult': 1.572570856282908, 'bull_tsl_mult': 0.4771630881107639, 'bull_time_stop': 274, 'bull_use_sma': True, 'bull_use_ema': True, 'bull_use_atr': False, 'bull_use_adx': True, 'bull_use_spike': False, 'bull_rsi_required': True, 'bear_strategy': 'breakout', 'bear_bb_std_mult': 0.8448110245476643, 'bear_rsi_os': 33, 'bear_rsi_ob': 66, 'bear_adx_thresh': 30.01115124243055, 'bear_atr_min_pct': 0.02874869428506232, 'bear_atr_max_pct': 0.06399825872723347, 'bear_tp_mult': 1.4736419332018038, 'bear_tsl_mult': 0.5605343662503225, 'bear_time_stop': 125, 'bear_use_sma': True, 'bear_use_ema': False, 'bear_use_atr': False, 'bear_use_adx': False, 'bear_use_spike': False, 'bear_rsi_required': False, 'sideways_strategy': 'breakout', 'sideways_bb_std_mult': 0.8365343356187864, 'sideways_rsi_os': 49, 'sideways_rsi_ob': 73, 'sideways_adx_thresh': 18.24716831115828, 'sideways_atr_min_pct': 0.017023294930180895, 'sideways_atr_max_pct': 0.12807429408423907, 'sideways_tp_mult': 1.3871164565621232, 'sideways_tsl_mult': 0.07171925490299769, 'sideways_time_stop': 177, 'sideways_use_sma': True, 'sideways_use_ema': False, 'sideways_use_atr': True, 'sideways_use_adx': False, 'sideways_use_spike': True, 'sideways_rsi_required': True}.
[I 2025-09-01 04:58:17,476] Trial 326 finished with values: [-1000000000.0, 1000000000.0] and parameters: {'p_sma': 26, 'p_std': 55, 'p_atr': 27, 'p_adx': 29, 'rsi_period': 12, 'ema1': 29, 'ema2': 29, 'slip_atr_k': 0.17967387184622022, 'slip_spread_k': 0.2955958035516822, 'spread_hl_frac': 0.0488764149810873, 'bb_std_mult': 3.372761919216859, 'rsi_os': 27, 'rsi_ob': 75, 'vol_spike': 0.14153762071147571, 'adx_thresh': 34.05912180408922, 'atr_min_pct': 0.025424950310659434, 'atr_max_pct': 0.10801476195578424, 'tp_mult': 2.543465065417433, 'tsl_mult': 0.9647964181534825, 'strategy': 'breakout', 'time_stop': 37, 'use_sma': False, 'use_atr': True, 'use_adx': False, 'use_ema': False, 'use_spike': True, 'rsi_required': False, 'edge_k': 1.8536002157239615, 'edge_cap': 0.4320610857672738, 'bull_strategy': 'breakout', 'bull_bb_std_mult': 2.159081045832063, 'bull_rsi_os': 15, 'bull_rsi_ob': 92, 'bull_adx_thresh': 17.948050926360427, 'bull_atr_min_pct': 0.019075750263511094, 'bull_atr_max_pct': 0.1099444300581167, 'bull_tp_mult': 1.567934477925109, 'bull_tsl_mult': 0.48152054152441404, 'bull_time_stop': 274, 'bull_use_sma': True, 'bull_use_ema': True, 'bull_use_atr': False, 'bull_use_adx': True, 'bull_use_spike': False, 'bull_rsi_required': True, 'bear_strategy': 'breakout', 'bear_bb_std_mult': 0.8675415258943241, 'bear_rsi_os': 5, 'bear_rsi_ob': 64, 'bear_adx_thresh': 30.06737630457793, 'bear_atr_min_pct': 0.028705910915992776, 'bear_atr_max_pct': 0.05568761869527166, 'bear_tp_mult': 1.4752376082877885, 'bear_tsl_mult': 0.776887646831489, 'bear_time_stop': 208, 'bear_use_sma': True, 'bear_use_ema': False, 'bear_use_atr': False, 'bear_use_adx': False, 'bear_use_spike': False, 'bear_rsi_required': False, 'sideways_strategy': 'breakout', 'sideways_bb_std_mult': 0.9099942104225557, 'sideways_rsi_os': 49, 'sideways_rsi_ob': 68, 'sideways_adx_thresh': 18.12481869352697, 'sideways_atr_min_pct': 0.014773360774681912, 'sideways_atr_max_pct': 0.12420904075146437, 'sideways_tp_mult': 1.8263338350072922, 'sideways_tsl_mult': 0.9246432205145427, 'sideways_time_stop': 80, 'sideways_use_sma': True, 'sideways_use_ema': False, 'sideways_use_atr': True, 'sideways_use_adx': False, 'sideways_use_spike': True, 'sideways_rsi_required': True}.
[I 2025-09-01 04:58:17,640] Trial 324 finished with values: [-1000000000.0, 1000000000.0] and parameters: {'p_sma': 23, 'p_std': 59, 'p_atr': 10, 'p_adx': 10, 'rsi_period': 12, 'ema1': 28, 'ema2': 30, 'slip_atr_k': 0.1573065618230087, 'slip_spread_k': 0.8498111796933852, 'spread_hl_frac': 0.04919089746314308, 'bb_std_mult': 3.2974853012259464, 'rsi_os': 22, 'rsi_ob': 78, 'vol_spike': 0.14299517081961416, 'adx_thresh': 5.7772963811850495, 'atr_min_pct': 0.025446875536368103, 'atr_max_pct': 0.10734376289076758, 'tp_mult': 2.5301386478858645, 'tsl_mult': 0.9696385946412693, 'strategy': 'breakout', 'time_stop': 51, 'use_sma': False, 'use_atr': False, 'use_adx': False, 'use_ema': False, 'use_spike': True, 'rsi_required': False, 'edge_k': 0.5528984702719746, 'edge_cap': 0.4284022814005185, 'bull_strategy': 'breakout', 'bull_bb_std_mult': 2.182801048988187, 'bull_rsi_os': 9, 'bull_rsi_ob': 46, 'bull_adx_thresh': 17.87418100041556, 'bull_atr_min_pct': 0.010950793634158703, 'bull_atr_max_pct': 0.11706117535009357, 'bull_tp_mult': 1.5710157133033464, 'bull_tsl_mult': 0.4191872074766328, 'bull_time_stop': 268, 'bull_use_sma': True, 'bull_use_ema': True, 'bull_use_atr': False, 'bull_use_adx': True, 'bull_use_spike': False, 'bull_rsi_required': True, 'bear_strategy': 'breakout', 'bear_bb_std_mult': 0.8477274097841684, 'bear_rsi_os': 33, 'bear_rsi_ob': 63, 'bear_adx_thresh': 32.28854658132495, 'bear_atr_min_pct': 0.028454574983230285, 'bear_atr_max_pct': 0.06475151692455071, 'bear_tp_mult': 1.285113592020567, 'bear_tsl_mult': 0.7690731390454175, 'bear_time_stop': 94, 'bear_use_sma': True, 'bear_use_ema': False, 'bear_use_atr': False, 'bear_use_adx': False, 'bear_use_spike': False, 'bear_rsi_required': False, 'sideways_strategy': 'breakout', 'sideways_bb_std_mult': 0.9288653156888708, 'sideways_rsi_os': 52, 'sideways_rsi_ob': 69, 'sideways_adx_thresh': 18.193303362319266, 'sideways_atr_min_pct': 0.024337499653389782, 'sideways_atr_max_pct': 0.1191378036690637, 'sideways_tp_mult': 1.3833785326962051, 'sideways_tsl_mult': 0.7554934365887574, 'sideways_time_stop': 178, 'sideways_use_sma': True, 'sideways_use_ema': False, 'sideways_use_atr': True, 'sideways_use_adx': False, 'sideways_use_spike': True, 'sideways_rsi_required': True}.
[I 2025-09-01 04:59:00,786] Trial 327 finished with values: [-1000000000.0, 1000000000.0] and parameters: {'p_sma': 22, 'p_std': 59, 'p_atr': 10, 'p_adx': 27, 'rsi_period': 12, 'ema1': 29, 'ema2': 29, 'slip_atr_k': 0.03653406060316321, 'slip_spread_k': 0.10634772692235472, 'spread_hl_frac': 0.0492579792061627, 'bb_std_mult': 3.4656832064631313, 'rsi_os': 20, 'rsi_ob': 73, 'vol_spike': 0.21828436661999803, 'adx_thresh': 14.531852946606618, 'atr_min_pct': 0.02056020653994684, 'atr_max_pct': 0.10766134835215277, 'tp_mult': 2.527147506917466, 'tsl_mult': 0.9723008691210966, 'strategy': 'breakout', 'time_stop': 53, 'use_sma': False, 'use_atr': True, 'use_adx': False, 'use_ema': False, 'use_spike': True, 'rsi_required': False, 'edge_k': 0.8493360937411554, 'edge_cap': 0.42217797429416165, 'bull_strategy': 'breakout', 'bull_bb_std_mult': 2.1895231384223535, 'bull_rsi_os': 23, 'bull_rsi_ob': 45, 'bull_adx_thresh': 16.90201618482027, 'bull_atr_min_pct': 0.0017534777849388707, 'bull_atr_max_pct': 0.11696811900764417, 'bull_tp_mult': 1.5695631198668347, 'bull_tsl_mult': 0.48484534359001197, 'bull_time_stop': 287, 'bull_use_sma': True, 'bull_use_ema': True, 'bull_use_atr': False, 'bull_use_adx': True, 'bull_use_spike': False, 'bull_rsi_required': True, 'bear_strategy': 'breakout', 'bear_bb_std_mult': 0.8374637588804583, 'bear_rsi_os': 5, 'bear_rsi_ob': 64, 'bear_adx_thresh': 32.78065690826803, 'bear_atr_min_pct': 0.028800898465806954, 'bear_atr_max_pct': 0.06382464525690323, 'bear_tp_mult': 1.2828354436140168, 'bear_tsl_mult': 0.6216824180958562, 'bear_time_stop': 65, 'bear_use_sma': True, 'bear_use_ema': True, 'bear_use_atr': False, 'bear_use_adx': False, 'bear_use_spike': False, 'bear_rsi_required': True, 'sideways_strategy': 'breakout', 'sideways_bb_std_mult': 0.8442541578600093, 'sideways_rsi_os': 43, 'sideways_rsi_ob': 73, 'sideways_adx_thresh': 29.080925478214944, 'sideways_atr_min_pct': 0.024145679735490363, 'sideways_atr_max_pct': 0.1339070252527813, 'sideways_tp_mult': 1.6540302372700804, 'sideways_tsl_mult': 0.07591678784809147, 'sideways_time_stop': 179, 'sideways_use_sma': False, 'sideways_use_ema': False, 'sideways_use_atr': True, 'sideways_use_adx': False, 'sideways_use_spike': True, 'sideways_rsi_required': True}.
[I 2025-09-01 04:59:01,211] Trial 329 finished with values: [-1000000000.0, 1000000000.0] and parameters: {'p_sma': 24, 'p_std': 59, 'p_atr': 28, 'p_adx': 18, 'rsi_period': 8, 'ema1': 29, 'ema2': 29, 'slip_atr_k': 0.010701877298925657, 'slip_spread_k': 0.3113858585068123, 'spread_hl_frac': 0.047610842657033525, 'bb_std_mult': 3.4729915946983834, 'rsi_os': 19, 'rsi_ob': 83, 'vol_spike': 0.17743984210769156, 'adx_thresh': 32.40072946928457, 'atr_min_pct': 0.02581379386135978, 'atr_max_pct': 0.07088999915702557, 'tp_mult': 2.6341145067082588, 'tsl_mult': 0.9626782286148936, 'strategy': 'mean_reversion', 'time_stop': 54, 'use_sma': False, 'use_atr': False, 'use_adx': True, 'use_ema': True, 'use_spike': False, 'rsi_required': True, 'edge_k': 0.08984778394049298, 'edge_cap': 0.4853440415429994, 'bull_strategy': 'breakout', 'bull_bb_std_mult': 2.429446979449809, 'bull_rsi_os': 22, 'bull_rsi_ob': 61, 'bull_adx_thresh': 16.890240276529685, 'bull_atr_min_pct': 0.0016345053456173237, 'bull_atr_max_pct': 0.11619003219414065, 'bull_tp_mult': 1.480049869780865, 'bull_tsl_mult': 0.7874474558227701, 'bull_time_stop': 295, 'bull_use_sma': False, 'bull_use_ema': False, 'bull_use_atr': False, 'bull_use_adx': False, 'bull_use_spike': True, 'bull_rsi_required': True, 'bear_strategy': 'mean_reversion', 'bear_bb_std_mult': 0.8141024007843187, 'bear_rsi_os': 24, 'bear_rsi_ob': 65, 'bear_adx_thresh': 31.230389706319293, 'bear_atr_min_pct': 0.01988572964947359, 'bear_atr_max_pct': 0.05629482600171923, 'bear_tp_mult': 1.7900854844463918, 'bear_tsl_mult': 0.6269595566695393, 'bear_time_stop': 235, 'bear_use_sma': False, 'bear_use_ema': True, 'bear_use_atr': False, 'bear_use_adx': False, 'bear_use_spike': True, 'bear_rsi_required': True, 'sideways_strategy': 'breakout', 'sideways_bb_std_mult': 0.7672586307414194, 'sideways_rsi_os': 45, 'sideways_rsi_ob': 61, 'sideways_adx_thresh': 29.061291551179508, 'sideways_atr_min_pct': 0.024268104192053903, 'sideways_atr_max_pct': 0.11318022482393306, 'sideways_tp_mult': 1.6700635678499038, 'sideways_tsl_mult': 0.24992896749036142, 'sideways_time_stop': 179, 'sideways_use_sma': False, 'sideways_use_ema': True, 'sideways_use_atr': False, 'sideways_use_adx': True, 'sideways_use_spike': True, 'sideways_rsi_required': False}.
[I 2025-09-01 04:59:02,035] Trial 328 finished with values: [-1000000000.0, 1000000000.0] and parameters: {'p_sma': 26, 'p_std': 55, 'p_atr': 27, 'p_adx': 15, 'rsi_period': 12, 'ema1': 29, 'ema2': 29, 'slip_atr_k': 0.19686600321744743, 'slip_spread_k': 0.923808683971741, 'spread_hl_frac': 0.04736693080213003, 'bb_std_mult': 3.4535294687355567, 'rsi_os': 19, 'rsi_ob': 72, 'vol_spike': 0.1383382112225341, 'adx_thresh': 28.488843816774807, 'atr_min_pct': 0.021120579452770988, 'atr_max_pct': 0.10682155370273631, 'tp_mult': 2.544322795356183, 'tsl_mult': 0.9720336884019529, 'strategy': 'mean_reversion', 'time_stop': 34, 'use_sma': False, 'use_atr': False, 'use_adx': True, 'use_ema': True, 'use_spike': False, 'rsi_required': True, 'edge_k': 0.8407716790548834, 'edge_cap': 0.49177699626786936, 'bull_strategy': 'breakout', 'bull_bb_std_mult': 2.4346784044125402, 'bull_rsi_os': 19, 'bull_rsi_ob': 90, 'bull_adx_thresh': 27.60581669739998, 'bull_atr_min_pct': 0.001588661260379484, 'bull_atr_max_pct': 0.11622221577553352, 'bull_tp_mult': 1.411642842913709, 'bull_tsl_mult': 0.4135699725225792, 'bull_time_stop': 238, 'bull_use_sma': False, 'bull_use_ema': False, 'bull_use_atr': False, 'bull_use_adx': False, 'bull_use_spike': True, 'bull_rsi_required': True, 'bear_strategy': 'mean_reversion', 'bear_bb_std_mult': 0.8507413319288287, 'bear_rsi_os': 16, 'bear_rsi_ob': 64, 'bear_adx_thresh': 32.2233453344697, 'bear_atr_min_pct': 0.028849595107529522, 'bear_atr_max_pct': 0.0564762338134833, 'bear_tp_mult': 1.350640930932657, 'bear_tsl_mult': 0.7701937249927611, 'bear_time_stop': 96, 'bear_use_sma': False, 'bear_use_ema': True, 'bear_use_atr': False, 'bear_use_adx': False, 'bear_use_spike': True, 'bear_rsi_required': True, 'sideways_strategy': 'breakout', 'sideways_bb_std_mult': 0.7908460591156259, 'sideways_rsi_os': 25, 'sideways_rsi_ob': 59, 'sideways_adx_thresh': 28.981466803641396, 'sideways_atr_min_pct': 0.004505804126195763, 'sideways_atr_max_pct': 0.1133633480452785, 'sideways_tp_mult': 1.8211880571318213, 'sideways_tsl_mult': 0.7486765575136938, 'sideways_time_stop': 167, 'sideways_use_sma': False, 'sideways_use_ema': True, 'sideways_use_atr': False, 'sideways_use_adx': True, 'sideways_use_spike': True, 'sideways_rsi_required': False}.
[I 2025-09-01 04:59:02,233] Trial 330 finished with values: [-1000000000.0, 1000000000.0] and parameters: {'p_sma': 24, 'p_std': 55, 'p_atr': 27, 'p_adx': 16, 'rsi_period': 16, 'ema1': 29, 'ema2': 31, 'slip_atr_k': 0.07118097632412398, 'slip_spread_k': 0.10623183722024909, 'spread_hl_frac': 0.04683268662487483, 'bb_std_mult': 3.4554202491286548, 'rsi_os': 18, 'rsi_ob': 84, 'vol_spike': 0.18992684069012578, 'adx_thresh': 10.798501551149348, 'atr_min_pct': 0.020577195224096838, 'atr_max_pct': 0.11545857147071131, 'tp_mult': 2.578294620433554, 'tsl_mult': 0.9735308919471359, 'strategy': 'mean_reversion', 'time_stop': 45, 'use_sma': False, 'use_atr': False, 'use_adx': True, 'use_ema': True, 'use_spike': False, 'rsi_required': True, 'edge_k': 0.869230926289797, 'edge_cap': 0.49248055237625304, 'bull_strategy': 'breakout', 'bull_bb_std_mult': 2.416344956447257, 'bull_rsi_os': 19, 'bull_rsi_ob': 95, 'bull_adx_thresh': 16.98121904403733, 'bull_atr_min_pct': 0.00162674881213515, 'bull_atr_max_pct': 0.12059741671946478, 'bull_tp_mult': 1.4776933220182218, 'bull_tsl_mult': 0.45654610106672266, 'bull_time_stop': 295, 'bull_use_sma': False, 'bull_use_ema': False, 'bull_use_atr': False, 'bull_use_adx': False, 'bull_use_spike': True, 'bull_rsi_required': True, 'bear_strategy': 'mean_reversion', 'bear_bb_std_mult': 0.715820275160403, 'bear_rsi_os': 24, 'bear_rsi_ob': 64, 'bear_adx_thresh': 31.169264817475003, 'bear_atr_min_pct': 0.01232143988463422, 'bear_atr_max_pct': 0.058067101869309336, 'bear_tp_mult': 1.8008131780563261, 'bear_tsl_mult': 0.438606701672088, 'bear_time_stop': 36, 'bear_use_sma': False, 'bear_use_ema': True, 'bear_use_atr': False, 'bear_use_adx': False, 'bear_use_spike': True, 'bear_rsi_required': True, 'sideways_strategy': 'breakout', 'sideways_bb_std_mult': 0.8062244671615814, 'sideways_rsi_os': 55, 'sideways_rsi_ob': 59, 'sideways_adx_thresh': 19.05811447860377, 'sideways_atr_min_pct': 0.011065100256259605, 'sideways_atr_max_pct': 0.07607827557247165, 'sideways_tp_mult': 1.5942791408631254, 'sideways_tsl_mult': 0.9518746845029018, 'sideways_time_stop': 168, 'sideways_use_sma': False, 'sideways_use_ema': True, 'sideways_use_atr': False, 'sideways_use_adx': True, 'sideways_use_spike': True, 'sideways_rsi_required': False}.
[I 2025-09-01 04:59:43,307] Trial 334 finished with values: [-1000000000.0, 1000000000.0] and parameters: {'p_sma': 27, 'p_std': 58, 'p_atr': 28, 'p_adx': 19, 'rsi_period': 8, 'ema1': 6, 'ema2': 30, 'slip_atr_k': 0.01015424174998064, 'slip_spread_k': 0.18560900750157644, 'spread_hl_frac': 0.04541785465749997, 'bb_std_mult': 3.562375108961883, 'rsi_os': 26, 'rsi_ob': 90, 'vol_spike': 0.21115758815201496, 'adx_thresh': 12.665259823831793, 'atr_min_pct': 0.023991690586194513, 'atr_max_pct': 0.1109115844924412, 'tp_mult': 2.609242792027291, 'tsl_mult': 0.9979351109562623, 'strategy': 'breakout', 'time_stop': 34, 'use_sma': False, 'use_atr': False, 'use_adx': False, 'use_ema': True, 'use_spike': True, 'rsi_required': False, 'edge_k': 0.5092775859019771, 'edge_cap': 0.5764092071443372, 'bull_strategy': 'breakout', 'bull_bb_std_mult': 1.251468597098972, 'bull_rsi_os': 11, 'bull_rsi_ob': 89, 'bull_adx_thresh': 28.852743415061585, 'bull_atr_min_pct': 0.012625387548296675, 'bull_atr_max_pct': 0.11963292243866722, 'bull_tp_mult': 1.5396111787522886, 'bull_tsl_mult': 0.40758277225347056, 'bull_time_stop': 255, 'bull_use_sma': True, 'bull_use_ema': False, 'bull_use_atr': False, 'bull_use_adx': False, 'bull_use_spike': False, 'bull_rsi_required': True, 'bear_strategy': 'mean_reversion', 'bear_bb_std_mult': 0.6329431612638805, 'bear_rsi_os': 31, 'bear_rsi_ob': 66, 'bear_adx_thresh': 26.543762500225025, 'bear_atr_min_pct': 0.02909132326419023, 'bear_atr_max_pct': 0.07110585072997273, 'bear_tp_mult': 1.5359225603000632, 'bear_tsl_mult': 0.5889701515051936, 'bear_time_stop': 291, 'bear_use_sma': True, 'bear_use_ema': False, 'bear_use_atr': False, 'bear_use_adx': False, 'bear_use_spike': False, 'bear_rsi_required': False, 'sideways_strategy': 'breakout', 'sideways_bb_std_mult': 0.7514284760441168, 'sideways_rsi_os': 51, 'sideways_rsi_ob': 54, 'sideways_adx_thresh': 18.69207112999323, 'sideways_atr_min_pct': 0.01343386780417487, 'sideways_atr_max_pct': 0.10574026489275096, 'sideways_tp_mult': 1.8933779266259498, 'sideways_tsl_mult': 0.9701893538050724, 'sideways_time_stop': 184, 'sideways_use_sma': True, 'sideways_use_ema': True, 'sideways_use_atr': False, 'sideways_use_adx': False, 'sideways_use_spike': True, 'sideways_rsi_required': False}.
[I 2025-09-01 04:59:43,312] Trial 333 finished with values: [-1000000000.0, 1000000000.0] and parameters: {'p_sma': 25, 'p_std': 58, 'p_atr': 27, 'p_adx': 21, 'rsi_period': 21, 'ema1': 29, 'ema2': 31, 'slip_atr_k': 0.010285136494908538, 'slip_spread_k': 0.5611671271881826, 'spread_hl_frac': 0.045363485423475534, 'bb_std_mult': 3.5590050484591487, 'rsi_os': 25, 'rsi_ob': 91, 'vol_spike': 0.1850110540270644, 'adx_thresh': 29.633093505590896, 'atr_min_pct': 0.02415651080131483, 'atr_max_pct': 0.10258287115521249, 'tp_mult': 2.9955454070741228, 'tsl_mult': 0.9820444707807546, 'strategy': 'breakout', 'time_stop': 44, 'use_sma': False, 'use_atr': False, 'use_adx': False, 'use_ema': True, 'use_spike': True, 'rsi_required': False, 'edge_k': 0.6021425872199072, 'edge_cap': 0.5982734199349031, 'bull_strategy': 'breakout', 'bull_bb_std_mult': 0.9170434293925609, 'bull_rsi_os': 41, 'bull_rsi_ob': 67, 'bull_adx_thresh': 18.323348448196022, 'bull_atr_min_pct': 0.012747179023992599, 'bull_atr_max_pct': 0.1199961944421246, 'bull_tp_mult': 1.4422535395090432, 'bull_tsl_mult': 0.4542375575850159, 'bull_time_stop': 244, 'bull_use_sma': True, 'bull_use_ema': False, 'bull_use_atr': False, 'bull_use_adx': False, 'bull_use_spike': False, 'bull_rsi_required': True, 'bear_strategy': 'mean_reversion', 'bear_bb_std_mult': 0.5087669470535046, 'bear_rsi_os': 30, 'bear_rsi_ob': 66, 'bear_adx_thresh': 24.329531415645103, 'bear_atr_min_pct': 0.026474202008838755, 'bear_atr_max_pct': 0.07079801331462125, 'bear_tp_mult': 1.638724776911406, 'bear_tsl_mult': 0.4555823312638414, 'bear_time_stop': 227, 'bear_use_sma': True, 'bear_use_ema': False, 'bear_use_atr': False, 'bear_use_adx': False, 'bear_use_spike': False, 'bear_rsi_required': False, 'sideways_strategy': 'breakout', 'sideways_bb_std_mult': 0.7081532947478244, 'sideways_rsi_os': 50, 'sideways_rsi_ob': 62, 'sideways_adx_thresh': 18.985429565687753, 'sideways_atr_min_pct': 0.013079181253495664, 'sideways_atr_max_pct': 0.1301081050083145, 'sideways_tp_mult': 1.899165304107613, 'sideways_tsl_mult': 0.9454627273837918, 'sideways_time_stop': 30, 'sideways_use_sma': True, 'sideways_use_ema': True, 'sideways_use_atr': False, 'sideways_use_adx': False, 'sideways_use_spike': True, 'sideways_rsi_required': False}.
