[I 2025-09-01 05:14:07,589] Trial 415 finished with values: [-0.01814300365059829, 0.017969260146627305] and parameters: {'p_sma': 24, 'p_std': 58, 'p_atr': 14, 'p_adx': 18, 'rsi_period': 39, 'ema1': 21, 'ema2': 30, 'slip_atr_k': 0.07972464661524423, 'slip_spread_k': 0.0033401786281929136, 'spread_hl_frac': 0.03210187074464133, 'bb_std_mult': 2.9949740888249865, 'rsi_os': 23, 'rsi_ob': 89, 'vol_spike': 0.2310404061384808, 'adx_thresh': 12.69291365349452, 'atr_min_pct': 0.010973662931793231, 'atr_max_pct': 0.013520585495949283, 'tp_mult': 1.1156302435162742, 'tsl_mult': 0.9618910123850228, 'strategy': 'breakout', 'time_stop': 59, 'use_sma': False, 'use_atr': False, 'use_adx': False, 'use_ema': True, 'use_spike': True, 'rsi_required': False, 'edge_k': 1.2619512198873035, 'edge_cap': 0.4863878647805643, 'bull_strategy': 'breakout', 'bull_bb_std_mult': 2.1523555459892716, 'bull_rsi_os': 24, 'bull_rsi_ob': 63, 'bull_adx_thresh': 10.418335473303854, 'bull_atr_min_pct': 0.0012397064728096319, 'bull_atr_max_pct': 0.1196150181838617, 'bull_tp_mult': 2.3197776226781786, 'bull_tsl_mult': 0.40762029010463596, 'bull_time_stop': 58, 'bull_use_sma': True, 'bull_use_ema': False, 'bull_use_atr': False, 'bull_use_adx': False, 'bull_use_spike': True, 'bull_rsi_required': True, 'bear_strategy': 'mean_reversion', 'bear_bb_std_mult': 1.5663736857279582, 'bear_rsi_os': 8, 'bear_rsi_ob': 89, 'bear_adx_thresh': 30.40187002770064, 'bear_atr_min_pct': 0.028002076291616527, 'bear_atr_max_pct': 0.05474379365488131, 'bear_tp_mult': 1.4482684442440967, 'bear_tsl_mult': 0.5767044821483204, 'bear_time_stop': 291, 'bear_use_sma': True, 'bear_use_ema': False, 'bear_use_atr': False, 'bear_use_adx': False, 'bear_use_spike': True, 'bear_rsi_required': False, 'sideways_strategy': 'breakout', 'sideways_bb_std_mult': 2.7441267059695513, 'sideways_rsi_os': 43, 'sideways_rsi_ob': 55, 'sideways_adx_thresh': 20.067962757712447, 'sideways_atr_min_pct': 0.006411089531972286, 'sideways_atr_max_pct': 0.10667547874130531, 'sideways_tp_mult': 1.853775671157485, 'sideways_tsl_mult': 0.04975862746649362, 'sideways_time_stop': 157, 'sideways_use_sma': True, 'sideways_use_ema': True, 'sideways_use_atr': False, 'sideways_use_adx': False, 'sideways_use_spike': True, 'sideways_rsi_required': False}.
[I 2025-09-01 05:14:08,187] Trial 412 finished with values: [-0.020121295492934177, 0.01994858489706011] and parameters: {'p_sma': 28, 'p_std': 58, 'p_atr': 16, 'p_adx': 18, 'rsi_period': 8, 'ema1': 19, 'ema2': 49, 'slip_atr_k': 0.09195628532145113, 'slip_spread_k': 0.7057432453673436, 'spread_hl_frac': 0.02335830528341219, 'bb_std_mult': 2.7926310497197395, 'rsi_os': 22, 'rsi_ob': 87, 'vol_spike': 0.22576331531229582, 'adx_thresh': 12.771959895560874, 'atr_min_pct': 0.009008426605033187, 'atr_max_pct': 0.10846596147075292, 'tp_mult': 2.6303840954394486, 'tsl_mult': 0.15708150608075694, 'strategy': 'breakout', 'time_stop': 71, 'use_sma': False, 'use_atr': False, 'use_adx': True, 'use_ema': True, 'use_spike': True, 'rsi_required': True, 'edge_k': 0.3987437093190678, 'edge_cap': 0.6944138277968563, 'bull_strategy': 'breakout', 'bull_bb_std_mult': 1.8912694486502781, 'bull_rsi_os': 23, 'bull_rsi_ob': 64, 'bull_adx_thresh': 9.13433356406746, 'bull_atr_min_pct': 0.0014961439864656536, 'bull_atr_max_pct': 0.015838178743251108, 'bull_tp_mult': 1.3487284131811734, 'bull_tsl_mult': 0.4027148272280806, 'bull_time_stop': 253, 'bull_use_sma': True, 'bull_use_ema': False, 'bull_use_atr': False, 'bull_use_adx': False, 'bull_use_spike': True, 'bull_rsi_required': True, 'bear_strategy': 'mean_reversion', 'bear_bb_std_mult': 1.519657393263634, 'bear_rsi_os': 10, 'bear_rsi_ob': 51, 'bear_adx_thresh': 28.958649461446498, 'bear_atr_min_pct': 0.027892580064198737, 'bear_atr_max_pct': 0.1271005383564832, 'bear_tp_mult': 1.3560150429446105, 'bear_tsl_mult': 0.625396521489812, 'bear_time_stop': 170, 'bear_use_sma': True, 'bear_use_ema': False, 'bear_use_atr': False, 'bear_use_adx': False, 'bear_use_spike': True, 'bear_rsi_required': False, 'sideways_strategy': 'breakout', 'sideways_bb_std_mult': 3.198481317121322, 'sideways_rsi_os': 42, 'sideways_rsi_ob': 56, 'sideways_adx_thresh': 22.747331299862438, 'sideways_atr_min_pct': 0.01575819314756234, 'sideways_atr_max_pct': 0.013349780971019867, 'sideways_tp_mult': 2.52030459970873, 'sideways_tsl_mult': 0.3623494740325377, 'sideways_time_stop': 122, 'sideways_use_sma': True, 'sideways_use_ema': True, 'sideways_use_atr': False, 'sideways_use_adx': False, 'sideways_use_spike': True, 'sideways_rsi_required': False}.
[I 2025-09-01 05:14:50,593] Trial 416 finished with values: [-1000000000.0, 1000000000.0] and parameters: {'p_sma': 11, 'p_std': 58, 'p_atr': 30, 'p_adx': 12, 'rsi_period': 39, 'ema1': 25, 'ema2': 30, 'slip_atr_k': 0.09845841989667181, 'slip_spread_k': 0.23640096210457165, 'spread_hl_frac': 0.031155096973308528, 'bb_std_mult': 2.795135942488751, 'rsi_os': 21, 'rsi_ob': 86, 'vol_spike': 0.21088222837399825, 'adx_thresh': 20.359807201575244, 'atr_min_pct': 0.009263249552074762, 'atr_max_pct': 0.012784743646460109, 'tp_mult': 2.608358271158301, 'tsl_mult': 0.938460449567875, 'strategy': 'breakout', 'time_stop': 247, 'use_sma': False, 'use_atr': False, 'use_adx': False, 'use_ema': True, 'use_spike': True, 'rsi_required': False, 'edge_k': 0.5222410582426816, 'edge_cap': 0.2630440036681721, 'bull_strategy': 'breakout', 'bull_bb_std_mult': 1.8666581778557116, 'bull_rsi_os': 22, 'bull_rsi_ob': 81, 'bull_adx_thresh': 17.339625770869493, 'bull_atr_min_pct': 0.0023282087570852855, 'bull_atr_max_pct': 0.10537918620766576, 'bull_tp_mult': 1.3870436952027723, 'bull_tsl_mult': 0.8646898197126807, 'bull_time_stop': 228, 'bull_use_sma': True, 'bull_use_ema': False, 'bull_use_atr': False, 'bull_use_adx': False, 'bull_use_spike': False, 'bull_rsi_required': True, 'bear_strategy': 'mean_reversion', 'bear_bb_std_mult': 1.9663008322522137, 'bear_rsi_os': 8, 'bear_rsi_ob': 91, 'bear_adx_thresh': 34.97099210127723, 'bear_atr_min_pct': 0.029973430529730206, 'bear_atr_max_pct': 0.049185401452625774, 'bear_tp_mult': 1.4396852469865271, 'bear_tsl_mult': 0.5809247448043628, 'bear_time_stop': 290, 'bear_use_sma': True, 'bear_use_ema': False, 'bear_use_atr': False, 'bear_use_adx': False, 'bear_use_spike': False, 'bear_rsi_required': False, 'sideways_strategy': 'breakout', 'sideways_bb_std_mult': 3.186329711727288, 'sideways_rsi_os': 42, 'sideways_rsi_ob': 55, 'sideways_adx_thresh': 19.940305257153284, 'sideways_atr_min_pct': 0.023948380760898492, 'sideways_atr_max_pct': 0.11001028193615871, 'sideways_tp_mult': 1.5537018745642595, 'sideways_tsl_mult': 0.561361283268199, 'sideways_time_stop': 106, 'sideways_use_sma': True, 'sideways_use_ema': True, 'sideways_use_atr': False, 'sideways_use_adx': False, 'sideways_use_spike': True, 'sideways_rsi_required': False}.
[I 2025-09-01 05:14:51,710] Trial 418 finished with values: [-0.019274213009059404, 0.01911814914961979] and parameters: {'p_sma': 52, 'p_std': 59, 'p_atr': 29, 'p_adx': 20, 'rsi_period': 7, 'ema1': 10, 'ema2': 30, 'slip_atr_k': 0.008492418918605818, 'slip_spread_k': 0.23423850332912166, 'spread_hl_frac': 0.044711591231619115, 'bb_std_mult': 1.998901552142561, 'rsi_os': 21, 'rsi_ob': 86, 'vol_spike': 0.2139733202573117, 'adx_thresh': 20.374369225713217, 'atr_min_pct': 0.011051014568928437, 'atr_max_pct': 0.10820643022738244, 'tp_mult': 1.9687180679521543, 'tsl_mult': 0.9437686453308609, 'strategy': 'breakout', 'time_stop': 253, 'use_sma': False, 'use_atr': False, 'use_adx': False, 'use_ema': True, 'use_spike': True, 'rsi_required': False, 'edge_k': 1.9496069684637007, 'edge_cap': 0.4830695333096059, 'bull_strategy': 'breakout', 'bull_bb_std_mult': 2.1605022772956133, 'bull_rsi_os': 24, 'bull_rsi_ob': 85, 'bull_adx_thresh': 17.3367275957503, 'bull_atr_min_pct': 0.0003852409850320865, 'bull_atr_max_pct': 0.025780698299365024, 'bull_tp_mult': 1.3809655744309177, 'bull_tsl_mult': 0.8732554423297927, 'bull_time_stop': 228, 'bull_use_sma': True, 'bull_use_ema': False, 'bull_use_atr': False, 'bull_use_adx': False, 'bull_use_spike': False, 'bull_rsi_required': True, 'bear_strategy': 'mean_reversion', 'bear_bb_std_mult': 0.6628568188128005, 'bear_rsi_os': 8, 'bear_rsi_ob': 66, 'bear_adx_thresh': 28.345722411196615, 'bear_atr_min_pct': 0.010518386629293983, 'bear_atr_max_pct': 0.1204784042768366, 'bear_tp_mult': 2.400473745301475, 'bear_tsl_mult': 0.590406610553662, 'bear_time_stop': 279, 'bear_use_sma': True, 'bear_use_ema': False, 'bear_use_atr': False, 'bear_use_adx': False, 'bear_use_spike': False, 'bear_rsi_required': False, 'sideways_strategy': 'breakout', 'sideways_bb_std_mult': 0.5615348753672528, 'sideways_rsi_os': 46, 'sideways_rsi_ob': 54, 'sideways_adx_thresh': 22.02165852133433, 'sideways_atr_min_pct': 0.02395015740967022, 'sideways_atr_max_pct': 0.10898442942607106, 'sideways_tp_mult': 1.0139177181987868, 'sideways_tsl_mult': 0.539062351118803, 'sideways_time_stop': 190, 'sideways_use_sma': True, 'sideways_use_ema': True, 'sideways_use_atr': False, 'sideways_use_adx': False, 'sideways_use_spike': True, 'sideways_rsi_required': False}.
[I 2025-09-01 05:14:51,957] Trial 419 finished with values: [-1000000000.0, 1000000000.0] and parameters: {'p_sma': 8, 'p_std': 58, 'p_atr': 29, 'p_adx': 20, 'rsi_period': 39, 'ema1': 21, 'ema2': 30, 'slip_atr_k': 0.1732993894311271, 'slip_spread_k': 0.22754222804357574, 'spread_hl_frac': 0.048208783322036514, 'bb_std_mult': 0.6095799764251295, 'rsi_os': 39, 'rsi_ob': 86, 'vol_spike': 0.21199017840897494, 'adx_thresh': 23.687602675889018, 'atr_min_pct': 0.023298864208255155, 'atr_max_pct': 0.041567021533965985, 'tp_mult': 2.9423436809608234, 'tsl_mult': 0.9435452958197273, 'strategy': 'breakout', 'time_stop': 253, 'use_sma': False, 'use_atr': False, 'use_adx': False, 'use_ema': True, 'use_spike': True, 'rsi_required': False, 'edge_k': 0.5025118729345834, 'edge_cap': 0.7524413945413475, 'bull_strategy': 'breakout', 'bull_bb_std_mult': 2.131210957367479, 'bull_rsi_os': 24, 'bull_rsi_ob': 92, 'bull_adx_thresh': 29.05775414731449, 'bull_atr_min_pct': 0.009439648622086088, 'bull_atr_max_pct': 0.11928914568994084, 'bull_tp_mult': 1.1435333110154282, 'bull_tsl_mult': 0.4456927252092526, 'bull_time_stop': 228, 'bull_use_sma': True, 'bull_use_ema': False, 'bull_use_atr': False, 'bull_use_adx': True, 'bull_use_spike': False, 'bull_rsi_required': True, 'bear_strategy': 'breakout', 'bear_bb_std_mult': 0.68323244415492, 'bear_rsi_os': 9, 'bear_rsi_ob': 77, 'bear_adx_thresh': 28.309807994726974, 'bear_atr_min_pct': 0.029543863571417257, 'bear_atr_max_pct': 0.0161787121353565, 'bear_tp_mult': 2.4674808406383066, 'bear_tsl_mult': 0.5886940542433854, 'bear_time_stop': 292, 'bear_use_sma': True, 'bear_use_ema': False, 'bear_use_atr': False, 'bear_use_adx': False, 'bear_use_spike': False, 'bear_rsi_required': False, 'sideways_strategy': 'breakout', 'sideways_bb_std_mult': 0.7156821857935804, 'sideways_rsi_os': 17, 'sideways_rsi_ob': 53, 'sideways_adx_thresh': 21.854804019849976, 'sideways_atr_min_pct': 0.023920992354357493, 'sideways_atr_max_pct': 0.01753987109984937, 'sideways_tp_mult': 1.0106404034848238, 'sideways_tsl_mult': 0.9997144922465261, 'sideways_time_stop': 84, 'sideways_use_sma': True, 'sideways_use_ema': True, 'sideways_use_atr': True, 'sideways_use_adx': False, 'sideways_use_spike': True, 'sideways_rsi_required': False}.
[I 2025-09-01 05:14:51,967] Trial 417 finished with values: [-1000000000.0, 1000000000.0] and parameters: {'p_sma': 28, 'p_std': 58, 'p_atr': 27, 'p_adx': 20, 'rsi_period': 7, 'ema1': 29, 'ema2': 29, 'slip_atr_k': 0.01511105286820177, 'slip_spread_k': 0.7053125980237537, 'spread_hl_frac': 0.02324340232217279, 'bb_std_mult': 2.0072596464686296, 'rsi_os': 21, 'rsi_ob': 45, 'vol_spike': 0.20929492324427798, 'adx_thresh': 15.784029221952565, 'atr_min_pct': 0.009030413298365493, 'atr_max_pct': 0.1092450661584173, 'tp_mult': 2.6218056077732776, 'tsl_mult': 0.43628962420972206, 'strategy': 'breakout', 'time_stop': 255, 'use_sma': False, 'use_atr': False, 'use_adx': False, 'use_ema': True, 'use_spike': True, 'rsi_required': False, 'edge_k': 1.9254448164482696, 'edge_cap': 0.7502330826123744, 'bull_strategy': 'breakout', 'bull_bb_std_mult': 3.325403158661385, 'bull_rsi_os': 24, 'bull_rsi_ob': 51, 'bull_adx_thresh': 9.486688994841492, 'bull_atr_min_pct': 0.022497811835131325, 'bull_atr_max_pct': 0.11926528938220236, 'bull_tp_mult': 1.576134910961106, 'bull_tsl_mult': 0.4172448506453342, 'bull_time_stop': 248, 'bull_use_sma': True, 'bull_use_ema': False, 'bull_use_atr': False, 'bull_use_adx': False, 'bull_use_spike': False, 'bull_rsi_required': True, 'bear_strategy': 'mean_reversion', 'bear_bb_std_mult': 1.9642427382188545, 'bear_rsi_os': 8, 'bear_rsi_ob': 70, 'bear_adx_thresh': 30.38043763253372, 'bear_atr_min_pct': 0.009892374675550864, 'bear_atr_max_pct': 0.021561777342296293, 'bear_tp_mult': 1.4545347166677696, 'bear_tsl_mult': 0.5794280160741575, 'bear_time_stop': 208, 'bear_use_sma': True, 'bear_use_ema': False, 'bear_use_atr': False, 'bear_use_adx': False, 'bear_use_spike': False, 'bear_rsi_required': False, 'sideways_strategy': 'breakout', 'sideways_bb_std_mult': 1.9165855908511886, 'sideways_rsi_os': 40, 'sideways_rsi_ob': 55, 'sideways_adx_thresh': 21.727277490080223, 'sideways_atr_min_pct': 0.024491532695900625, 'sideways_atr_max_pct': 0.02396311781913347, 'sideways_tp_mult': 1.525389207560285, 'sideways_tsl_mult': 0.6794608359357872, 'sideways_time_stop': 191, 'sideways_use_sma': True, 'sideways_use_ema': True, 'sideways_use_atr': False, 'sideways_use_adx': False, 'sideways_use_spike': True, 'sideways_rsi_required': False}.
[I 2025-09-01 05:14:52,849] Trial 422 finished with values: [-1000000000.0, 1000000000.0] and parameters: {'p_sma': 56, 'p_std': 15, 'p_atr': 28, 'p_adx': 18, 'rsi_period': 10, 'ema1': 10, 'ema2': 46, 'slip_atr_k': 0.1618677237480523, 'slip_spread_k': 0.7748707693242698, 'spread_hl_frac': 0.04480142514641312, 'bb_std_mult': 3.287296350870543, 'rsi_os': 55, 'rsi_ob': 89, 'vol_spike': 0.2162099467662385, 'adx_thresh': 13.56362368476732, 'atr_min_pct': 0.022639162210763817, 'atr_max_pct': 0.11641746337418364, 'tp_mult': 2.532887983728721, 'tsl_mult': 0.9650698535549116, 'strategy': 'mean_reversion', 'time_stop': 40, 'use_sma': False, 'use_atr': False, 'use_adx': False, 'use_ema': False, 'use_spike': True, 'rsi_required': False, 'edge_k': 0.8099734337938527, 'edge_cap': 0.5164001289416992, 'bull_strategy': 'breakout', 'bull_bb_std_mult': 2.1853291820162464, 'bull_rsi_os': 25, 'bull_rsi_ob': 86, 'bull_adx_thresh': 18.23786639567528, 'bull_atr_min_pct': 0.0032229658781771286, 'bull_atr_max_pct': 0.08103377343131032, 'bull_tp_mult': 2.107504726165243, 'bull_tsl_mult': 0.3839766904330149, 'bull_time_stop': 39, 'bull_use_sma': False, 'bull_use_ema': True, 'bull_use_atr': False, 'bull_use_adx': True, 'bull_use_spike': False, 'bull_rsi_required': True, 'bear_strategy': 'breakout', 'bear_bb_std_mult': 0.9319852380571317, 'bear_rsi_os': 12, 'bear_rsi_ob': 66, 'bear_adx_thresh': 5.888414165761809, 'bear_atr_min_pct': 0.02660081531346931, 'bear_atr_max_pct': 0.05513207071586851, 'bear_tp_mult': 2.795113653581592, 'bear_tsl_mult': 0.6365509265161577, 'bear_time_stop': 78, 'bear_use_sma': True, 'bear_use_ema': True, 'bear_use_atr': False, 'bear_use_adx': False, 'bear_use_spike': False, 'bear_rsi_required': False, 'sideways_strategy': 'breakout', 'sideways_bb_std_mult': 2.749382852531891, 'sideways_rsi_os': 46, 'sideways_rsi_ob': 54, 'sideways_adx_thresh': 7.487287330313949, 'sideways_atr_min_pct': 0.006232972239489697, 'sideways_atr_max_pct': 0.11019427141485137, 'sideways_tp_mult': 1.83541719801075, 'sideways_tsl_mult': 0.6485556904369941, 'sideways_time_stop': 286, 'sideways_use_sma': False, 'sideways_use_ema': True, 'sideways_use_atr': True, 'sideways_use_adx': True, 'sideways_use_spike': True, 'sideways_rsi_required': True}.
[I 2025-09-01 05:15:33,080] Trial 423 finished with values: [-1000000000.0, 1000000000.0] and parameters: {'p_sma': 52, 'p_std': 54, 'p_atr': 28, 'p_adx': 18, 'rsi_period': 10, 'ema1': 10, 'ema2': 13, 'slip_atr_k': 0.026707043447351093, 'slip_spread_k': 0.4865843019039646, 'spread_hl_frac': 0.04471709768932808, 'bb_std_mult': 2.576572162968558, 'rsi_os': 24, 'rsi_ob': 89, 'vol_spike': 0.21595049259421784, 'adx_thresh': 30.16635244134126, 'atr_min_pct': 0.02390872450917451, 'atr_max_pct': 0.11562745382777713, 'tp_mult': 2.1482329618506704, 'tsl_mult': 0.9702919715741518, 'strategy': 'mean_reversion', 'time_stop': 40, 'use_sma': False, 'use_atr': False, 'use_adx': False, 'use_ema': False, 'use_spike': True, 'rsi_required': False, 'edge_k': 0.6491811305103605, 'edge_cap': 0.48556531922811674, 'bull_strategy': 'breakout', 'bull_bb_std_mult': 2.1722402238268814, 'bull_rsi_os': 25, 'bull_rsi_ob': 86, 'bull_adx_thresh': 14.068632603763847, 'bull_atr_min_pct': 0.026532038967821144, 'bull_atr_max_pct': 0.12012368367159025, 'bull_tp_mult': 1.4551067454759479, 'bull_tsl_mult': 0.7664887936843668, 'bull_time_stop': 40, 'bull_use_sma': False, 'bull_use_ema': True, 'bull_use_atr': False, 'bull_use_adx': True, 'bull_use_spike': False, 'bull_rsi_required': True, 'bear_strategy': 'breakout', 'bear_bb_std_mult': 3.3626849303076547, 'bear_rsi_os': 12, 'bear_rsi_ob': 93, 'bear_adx_thresh': 28.38817302264299, 'bear_atr_min_pct': 0.016418071139560547, 'bear_atr_max_pct': 0.09106645804140912, 'bear_tp_mult': 2.427638358509744, 'bear_tsl_mult': 0.6208674802437923, 'bear_time_stop': 280, 'bear_use_sma': True, 'bear_use_ema': True, 'bear_use_atr': False, 'bear_use_adx': False, 'bear_use_spike': False, 'bear_rsi_required': False, 'sideways_strategy': 'breakout', 'sideways_bb_std_mult': 0.5896071176890403, 'sideways_rsi_os': 46, 'sideways_rsi_ob': 54, 'sideways_adx_thresh': 15.814086502185777, 'sideways_atr_min_pct': 0.01847320911222557, 'sideways_atr_max_pct': 0.11614063703714644, 'sideways_tp_mult': 1.834340984493657, 'sideways_tsl_mult': 0.9355634109198286, 'sideways_time_stop': 154, 'sideways_use_sma': False, 'sideways_use_ema': True, 'sideways_use_atr': True, 'sideways_use_adx': True, 'sideways_use_spike': True, 'sideways_rsi_required': True}.
[I 2025-09-01 05:15:34,000] Trial 420 finished with values: [-1000000000.0, 1000000000.0] and parameters: {'p_sma': 56, 'p_std': 55, 'p_atr': 28, 'p_adx': 20, 'rsi_period': 7, 'ema1': 28, 'ema2': 46, 'slip_atr_k': 0.07950167465248434, 'slip_spread_k': 0.26062485781410516, 'spread_hl_frac': 0.04466510084328385, 'bb_std_mult': 2.5430707997135196, 'rsi_os': 11, 'rsi_ob': 89, 'vol_spike': 0.2132996699036396, 'adx_thresh': 24.4435867204466, 'atr_min_pct': 0.02330158692539019, 'atr_max_pct': 0.143742647487768, 'tp_mult': 2.958399613563013, 'tsl_mult': 0.9630773068841646, 'strategy': 'breakout', 'time_stop': 34, 'use_sma': False, 'use_atr': False, 'use_adx': False, 'use_ema': False, 'use_spike': True, 'rsi_required': False, 'edge_k': 0.8088092937942841, 'edge_cap': 0.48697449111262964, 'bull_strategy': 'breakout', 'bull_bb_std_mult': 2.1358069978219048, 'bull_rsi_os': 24, 'bull_rsi_ob': 58, 'bull_adx_thresh': 18.297639246467565, 'bull_atr_min_pct': 0.009717353293193365, 'bull_atr_max_pct': 0.0351517469340728, 'bull_tp_mult': 1.1411250826033417, 'bull_tsl_mult': 0.42451844235450226, 'bull_time_stop': 229, 'bull_use_sma': True, 'bull_use_ema': False, 'bull_use_atr': False, 'bull_use_adx': True, 'bull_use_spike': False, 'bull_rsi_required': True, 'bear_strategy': 'breakout', 'bear_bb_std_mult': 0.6687308417763816, 'bear_rsi_os': 12, 'bear_rsi_ob': 89, 'bear_adx_thresh': 28.475408348226484, 'bear_atr_min_pct': 0.028614514934486513, 'bear_atr_max_pct': 0.02059097081762124, 'bear_tp_mult': 1.4762687895581132, 'bear_tsl_mult': 0.5905201994725471, 'bear_time_stop': 78, 'bear_use_sma': True, 'bear_use_ema': False, 'bear_use_atr': False, 'bear_use_adx': False, 'bear_use_spike': False, 'bear_rsi_required': False, 'sideways_strategy': 'breakout', 'sideways_bb_std_mult': 0.7385197495584025, 'sideways_rsi_os': 46, 'sideways_rsi_ob': 53, 'sideways_adx_thresh': 23.61990425858409, 'sideways_atr_min_pct': 0.006530362286924076, 'sideways_atr_max_pct': 0.11527842121019599, 'sideways_tp_mult': 1.5026714668697196, 'sideways_tsl_mult': 0.6779818815154939, 'sideways_time_stop': 208, 'sideways_use_sma': True, 'sideways_use_ema': True, 'sideways_use_atr': True, 'sideways_use_adx': False, 'sideways_use_spike': True, 'sideways_rsi_required': False}.
