[I 2025-09-01 05:04:16,600] Trial 360 finished with values: [-0.022624702887380055, 0.022454454650703153] and parameters: {'p_sma': 24, 'p_std': 57, 'p_atr': 22, 'p_adx': 21, 'rsi_period': 9, 'ema1': 29, 'ema2': 10, 'slip_atr_k': 0.08992510350667375, 'slip_spread_k': 0.3002286048371369, 'spread_hl_frac': 0.04486980097015354, 'bb_std_mult': 3.3061474142904177, 'rsi_os': 29, 'rsi_ob': 86, 'vol_spike': 0.21710078463558022, 'adx_thresh': 18.186125551275882, 'atr_min_pct': 0.02882017864728885, 'atr_max_pct': 0.09299275540002126, 'tp_mult': 1.4221759783710994, 'tsl_mult': 0.9651621555587112, 'strategy': 'breakout', 'time_stop': 30, 'use_sma': False, 'use_atr': True, 'use_adx': False, 'use_ema': True, 'use_spike': True, 'rsi_required': False, 'edge_k': 0.7387849254939457, 'edge_cap': 0.5020394963581375, 'bull_strategy': 'breakout', 'bull_bb_std_mult': 3.5192970754809627, 'bull_rsi_os': 24, 'bull_rsi_ob': 87, 'bull_adx_thresh': 17.67361272772069, 'bull_atr_min_pct': 0.0013713559135909077, 'bull_atr_max_pct': 0.09185996865857517, 'bull_tp_mult': 1.4764369457757356, 'bull_tsl_mult': 0.7738268798113435, 'bull_time_stop': 237, 'bull_use_sma': True, 'bull_use_ema': False, 'bull_use_atr': False, 'bull_use_adx': True, 'bull_use_spike': False, 'bull_rsi_required': True, 'bear_strategy': 'breakout', 'bear_bb_std_mult': 0.8133785731124203, 'bear_rsi_os': 22, 'bear_rsi_ob': 66, 'bear_adx_thresh': 23.515631393188833, 'bear_atr_min_pct': 0.004274114507813962, 'bear_atr_max_pct': 0.056431869687821566, 'bear_tp_mult': 1.231087075050194, 'bear_tsl_mult': 0.5682858909544087, 'bear_time_stop': 255, 'bear_use_sma': True, 'bear_use_ema': False, 'bear_use_atr': False, 'bear_use_adx': False, 'bear_use_spike': False, 'bear_rsi_required': False, 'sideways_strategy': 'breakout', 'sideways_bb_std_mult': 1.0076664861740345, 'sideways_rsi_os': 41, 'sideways_rsi_ob': 55, 'sideways_adx_thresh': 27.224865885338637, 'sideways_atr_min_pct': 0.009161387175910047, 'sideways_atr_max_pct': 0.0792179884601931, 'sideways_tp_mult': 2.1600867432932915, 'sideways_tsl_mult': 0.636271708538957, 'sideways_time_stop': 144, 'sideways_use_sma': True, 'sideways_use_ema': True, 'sideways_use_atr': True, 'sideways_use_adx': False, 'sideways_use_spike': True, 'sideways_rsi_required': False}.
[I 2025-09-01 05:04:17,750] Trial 361 finished with values: [-1000000000.0, 1000000000.0] and parameters: {'p_sma': 25, 'p_std': 57, 'p_atr': 28, 'p_adx': 18, 'rsi_period': 8, 'ema1': 7, 'ema2': 12, 'slip_atr_k': 0.006343616822209212, 'slip_spread_k': 0.21935381301745185, 'spread_hl_frac': 0.04449286049691192, 'bb_std_mult': 3.3184282165530155, 'rsi_os': 17, 'rsi_ob': 87, 'vol_spike': 0.21698055937181743, 'adx_thresh': 13.358244255965033, 'atr_min_pct': 0.018898849327773044, 'atr_max_pct': 0.11265725868271728, 'tp_mult': 2.5552467021358045, 'tsl_mult': 0.9598946592240485, 'strategy': 'breakout', 'time_stop': 36, 'use_sma': False, 'use_atr': False, 'use_adx': False, 'use_ema': False, 'use_spike': True, 'rsi_required': False, 'edge_k': 0.17306481304788812, 'edge_cap': 0.5039630533253376, 'bull_strategy': 'breakout', 'bull_bb_std_mult': 2.4628930277402072, 'bull_rsi_os': 24, 'bull_rsi_ob': 64, 'bull_adx_thresh': 8.707638842895324, 'bull_atr_min_pct': 0.011778592679611387, 'bull_atr_max_pct': 0.1126815141258625, 'bull_tp_mult': 2.009567144021867, 'bull_tsl_mult': 0.47067396080219503, 'bull_time_stop': 234, 'bull_use_sma': True, 'bull_use_ema': False, 'bull_use_atr': False, 'bull_use_adx': True, 'bull_use_spike': False, 'bull_rsi_required': True, 'bear_strategy': 'breakout', 'bear_bb_std_mult': 0.8283932063740675, 'bear_rsi_os': 8, 'bear_rsi_ob': 65, 'bear_adx_thresh': 27.279510015324803, 'bear_atr_min_pct': 0.028376905799748563, 'bear_atr_max_pct': 0.05746789723814221, 'bear_tp_mult': 1.2247053069275642, 'bear_tsl_mult': 0.5740138280751477, 'bear_time_stop': 71, 'bear_use_sma': True, 'bear_use_ema': False, 'bear_use_atr': False, 'bear_use_adx': False, 'bear_use_spike': False, 'bear_rsi_required': False, 'sideways_strategy': 'breakout', 'sideways_bb_std_mult': 0.5002157180164829, 'sideways_rsi_os': 44, 'sideways_rsi_ob': 58, 'sideways_adx_thresh': 12.368795410158857, 'sideways_atr_min_pct': 0.016428681397915566, 'sideways_atr_max_pct': 0.07827104304623825, 'sideways_tp_mult': 2.1630776450501146, 'sideways_tsl_mult': 0.43113491045609664, 'sideways_time_stop': 143, 'sideways_use_sma': True, 'sideways_use_ema': True, 'sideways_use_atr': True, 'sideways_use_adx': False, 'sideways_use_spike': True, 'sideways_rsi_required': True}.
[I 2025-09-01 05:04:18,264] Trial 363 finished with values: [-1000000000.0, 1000000000.0] and parameters: {'p_sma': 25, 'p_std': 58, 'p_atr': 28, 'p_adx': 28, 'rsi_period': 8, 'ema1': 13, 'ema2': 15, 'slip_atr_k': 0.030750884454604825, 'slip_spread_k': 0.7546316420428769, 'spread_hl_frac': 0.04475224429712794, 'bb_std_mult': 3.481853594217317, 'rsi_os': 15, 'rsi_ob': 86, 'vol_spike': 0.22143690354345102, 'adx_thresh': 14.817731772066416, 'atr_min_pct': 0.022619161395591305, 'atr_max_pct': 0.11330416680106062, 'tp_mult': 2.557839495129709, 'tsl_mult': 0.9609342609821268, 'strategy': 'mean_reversion', 'time_stop': 37, 'use_sma': False, 'use_atr': False, 'use_adx': False, 'use_ema': False, 'use_spike': True, 'rsi_required': False, 'edge_k': 1.8933798967312017, 'edge_cap': 0.5012904063244135, 'bull_strategy': 'breakout', 'bull_bb_std_mult': 2.468592030304591, 'bull_rsi_os': 25, 'bull_rsi_ob': 84, 'bull_adx_thresh': 14.577137127303772, 'bull_atr_min_pct': 0.009252384037618504, 'bull_atr_max_pct': 0.09087270729572441, 'bull_tp_mult': 1.2320435128234388, 'bull_tsl_mult': 0.6217634881174011, 'bull_time_stop': 235, 'bull_use_sma': True, 'bull_use_ema': False, 'bull_use_atr': False, 'bull_use_adx': False, 'bull_use_spike': True, 'bull_rsi_required': True, 'bear_strategy': 'mean_reversion', 'bear_bb_std_mult': 0.7892934987269906, 'bear_rsi_os': 22, 'bear_rsi_ob': 67, 'bear_adx_thresh': 27.32853493257743, 'bear_atr_min_pct': 0.008782732251144652, 'bear_atr_max_pct': 0.05649883382674028, 'bear_tp_mult': 1.3135077829026, 'bear_tsl_mult': 0.5615722718623347, 'bear_time_stop': 255, 'bear_use_sma': True, 'bear_use_ema': False, 'bear_use_atr': False, 'bear_use_adx': False, 'bear_use_spike': True, 'bear_rsi_required': False, 'sideways_strategy': 'breakout', 'sideways_bb_std_mult': 0.6756833123041107, 'sideways_rsi_os': 44, 'sideways_rsi_ob': 62, 'sideways_adx_thresh': 27.12116879452541, 'sideways_atr_min_pct': 0.027784293405807438, 'sideways_atr_max_pct': 0.11766617677544529, 'sideways_tp_mult': 2.220800704700476, 'sideways_tsl_mult': 0.9586953749597443, 'sideways_time_stop': 218, 'sideways_use_sma': True, 'sideways_use_ema': True, 'sideways_use_atr': False, 'sideways_use_adx': False, 'sideways_use_spike': True, 'sideways_rsi_required': True}.
[I 2025-09-01 05:04:18,594] Trial 362 finished with values: [-1000000000.0, 1000000000.0] and parameters: {'p_sma': 24, 'p_std': 58, 'p_atr': 23, 'p_adx': 24, 'rsi_period': 9, 'ema1': 7, 'ema2': 29, 'slip_atr_k': 0.08503323171001714, 'slip_spread_k': 0.07661895710918643, 'spread_hl_frac': 0.049981877389030656, 'bb_std_mult': 3.310501088899309, 'rsi_os': 31, 'rsi_ob': 86, 'vol_spike': 0.20685944198884812, 'adx_thresh': 9.024941420327968, 'atr_min_pct': 0.02266243151952813, 'atr_max_pct': 0.11415801216285501, 'tp_mult': 2.55277663708575, 'tsl_mult': 0.9594526939430208, 'strategy': 'mean_reversion', 'time_stop': 36, 'use_sma': False, 'use_atr': False, 'use_adx': False, 'use_ema': False, 'use_spike': True, 'rsi_required': False, 'edge_k': 0.7456546030664576, 'edge_cap': 0.5023330800478881, 'bull_strategy': 'breakout', 'bull_bb_std_mult': 2.47877683925222, 'bull_rsi_os': 24, 'bull_rsi_ob': 72, 'bull_adx_thresh': 14.72205550224913, 'bull_atr_min_pct': 0.007458261332554326, 'bull_atr_max_pct': 0.10345145363848604, 'bull_tp_mult': 1.221304984569832, 'bull_tsl_mult': 0.4604805160829495, 'bull_time_stop': 237, 'bull_use_sma': True, 'bull_use_ema': False, 'bull_use_atr': False, 'bull_use_adx': True, 'bull_use_spike': True, 'bull_rsi_required': True, 'bear_strategy': 'breakout', 'bear_bb_std_mult': 0.8035949517311336, 'bear_rsi_os': 11, 'bear_rsi_ob': 67, 'bear_adx_thresh': 23.880796353449817, 'bear_atr_min_pct': 0.02749260357077645, 'bear_atr_max_pct': 0.057235076780143654, 'bear_tp_mult': 1.2139506859650848, 'bear_tsl_mult': 0.5701988173164503, 'bear_time_stop': 165, 'bear_use_sma': True, 'bear_use_ema': False, 'bear_use_atr': False, 'bear_use_adx': False, 'bear_use_spike': True, 'bear_rsi_required': False, 'sideways_strategy': 'breakout', 'sideways_bb_std_mult': 0.9786058458228397, 'sideways_rsi_os': 41, 'sideways_rsi_ob': 60, 'sideways_adx_thresh': 33.77822911156629, 'sideways_atr_min_pct': 0.024173373011820147, 'sideways_atr_max_pct': 0.11466538249446108, 'sideways_tp_mult': 2.2087955095912193, 'sideways_tsl_mult': 0.9611855219877384, 'sideways_time_stop': 142, 'sideways_use_sma': True, 'sideways_use_ema': True, 'sideways_use_atr': True, 'sideways_use_adx': False, 'sideways_use_spike': True, 'sideways_rsi_required': True}.
[I 2025-09-01 05:04:58,413] Trial 367 finished with values: [-1000000000.0, 1000000000.0] and parameters: {'p_sma': 26, 'p_std': 56, 'p_atr': 27, 'p_adx': 13, 'rsi_period': 7, 'ema1': 28, 'ema2': 35, 'slip_atr_k': 0.039030942962961945, 'slip_spread_k': 0.2523588069058063, 'spread_hl_frac': 0.03350318548181425, 'bb_std_mult': 3.490492513086921, 'rsi_os': 20, 'rsi_ob': 88, 'vol_spike': 0.19666839233565367, 'adx_thresh': 7.349677706934639, 'atr_min_pct': 0.023583387684781493, 'atr_max_pct': 0.10994163222179254, 'tp_mult': 2.185168529052026, 'tsl_mult': 0.09594162700499193, 'strategy': 'breakout', 'time_stop': 45, 'use_sma': False, 'use_atr': False, 'use_adx': True, 'use_ema': True, 'use_spike': True, 'rsi_required': True, 'edge_k': 1.3299259920687032, 'edge_cap': 0.5216422823063457, 'bull_strategy': 'breakout', 'bull_bb_std_mult': 0.9830170719902196, 'bull_rsi_os': 22, 'bull_rsi_ob': 62, 'bull_adx_thresh': 17.199692266432574, 'bull_atr_min_pct': 0.0031376679753148794, 'bull_atr_max_pct': 0.11920833358299159, 'bull_tp_mult': 2.9130213368113567, 'bull_tsl_mult': 0.3970797671692908, 'bull_time_stop': 245, 'bull_use_sma': True, 'bull_use_ema': True, 'bull_use_atr': False, 'bull_use_adx': False, 'bull_use_spike': False, 'bull_rsi_required': True, 'bear_strategy': 'mean_reversion', 'bear_bb_std_mult': 0.7698072340131611, 'bear_rsi_os': 10, 'bear_rsi_ob': 62, 'bear_adx_thresh': 26.16714157723759, 'bear_atr_min_pct': 0.013734012616247257, 'bear_atr_max_pct': 0.051858373124157704, 'bear_tp_mult': 1.3661064185784426, 'bear_tsl_mult': 0.6172623564018399, 'bear_time_stop': 44, 'bear_use_sma': False, 'bear_use_ema': False, 'bear_use_atr': False, 'bear_use_adx': False, 'bear_use_spike': False, 'bear_rsi_required': False, 'sideways_strategy': 'breakout', 'sideways_bb_std_mult': 0.842539451439357, 'sideways_rsi_os': 39, 'sideways_rsi_ob': 52, 'sideways_adx_thresh': 10.122633490757044, 'sideways_atr_min_pct': 0.02369579989718776, 'sideways_atr_max_pct': 0.10331665937153, 'sideways_tp_mult': 1.9555738674002234, 'sideways_tsl_mult': 0.9783404876807388, 'sideways_time_stop': 167, 'sideways_use_sma': False, 'sideways_use_ema': False, 'sideways_use_atr': False, 'sideways_use_adx': False, 'sideways_use_spike': True, 'sideways_rsi_required': False}.
[I 2025-09-01 05:04:58,804] Trial 366 finished with values: [-1000000000.0, 1000000000.0] and parameters: {'p_sma': 26, 'p_std': 56, 'p_atr': 27, 'p_adx': 7, 'rsi_period': 7, 'ema1': 28, 'ema2': 35, 'slip_atr_k': 0.01290788615150853, 'slip_spread_k': 0.24277206163221604, 'spread_hl_frac': 0.036119173450877284, 'bb_std_mult': 3.474826626307366, 'rsi_os': 20, 'rsi_ob': 88, 'vol_spike': 0.19256493358266413, 'adx_thresh': 21.113389205636928, 'atr_min_pct': 0.02373159069967936, 'atr_max_pct': 0.08540811703286894, 'tp_mult': 1.0798005320076438, 'tsl_mult': 0.5101682159108959, 'strategy': 'breakout', 'time_stop': 224, 'use_sma': False, 'use_atr': False, 'use_adx': True, 'use_ema': True, 'use_spike': True, 'rsi_required': True, 'edge_k': 1.3404179582134126, 'edge_cap': 0.47837550310348076, 'bull_strategy': 'breakout', 'bull_bb_std_mult': 2.21365358227134, 'bull_rsi_os': 22, 'bull_rsi_ob': 77, 'bull_adx_thresh': 28.361928412734297, 'bull_atr_min_pct': 0.0033700004867126105, 'bull_atr_max_pct': 0.022783252779041016, 'bull_tp_mult': 1.6071119883038336, 'bull_tsl_mult': 0.4335668735294238, 'bull_time_stop': 245, 'bull_use_sma': True, 'bull_use_ema': True, 'bull_use_atr': False, 'bull_use_adx': False, 'bull_use_spike': False, 'bull_rsi_required': True, 'bear_strategy': 'mean_reversion', 'bear_bb_std_mult': 0.7599085446454024, 'bear_rsi_os': 15, 'bear_rsi_ob': 83, 'bear_adx_thresh': 26.518812352847586, 'bear_atr_min_pct': 0.028997810834321198, 'bear_atr_max_pct': 0.051589942981201814, 'bear_tp_mult': 1.3995029636855743, 'bear_tsl_mult': 0.6134461508834996, 'bear_time_stop': 199, 'bear_use_sma': False, 'bear_use_ema': False, 'bear_use_atr': False, 'bear_use_adx': False, 'bear_use_spike': False, 'bear_rsi_required': False, 'sideways_strategy': 'breakout', 'sideways_bb_std_mult': 0.8337056740050417, 'sideways_rsi_os': 38, 'sideways_rsi_ob': 52, 'sideways_adx_thresh': 30.14217828212054, 'sideways_atr_min_pct': 0.023837022058774086, 'sideways_atr_max_pct': 0.10493800189229385, 'sideways_tp_mult': 2.319690197564803, 'sideways_tsl_mult': 0.8941805745268114, 'sideways_time_stop': 167, 'sideways_use_sma': False, 'sideways_use_ema': False, 'sideways_use_atr': False, 'sideways_use_adx': False, 'sideways_use_spike': True, 'sideways_rsi_required': False}.
[I 2025-09-01 05:04:59,937] Trial 364 finished with values: [-1000000000.0, 1000000000.0] and parameters: {'p_sma': 25, 'p_std': 56, 'p_atr': 28, 'p_adx': 28, 'rsi_period': 8, 'ema1': 28, 'ema2': 52, 'slip_atr_k': 0.005372708158370639, 'slip_spread_k': 0.23531813182572714, 'spread_hl_frac': 0.015038223456452077, 'bb_std_mult': 3.4983189659432288, 'rsi_os': 17, 'rsi_ob': 88, 'vol_spike': 0.22529721166813557, 'adx_thresh': 14.447763038967837, 'atr_min_pct': 0.02232022975983038, 'atr_max_pct': 0.14722750199593043, 'tp_mult': 2.9063627989475367, 'tsl_mult': 0.9485545698544684, 'strategy': 'mean_reversion', 'time_stop': 36, 'use_sma': False, 'use_atr': False, 'use_adx': False, 'use_ema': False, 'use_spike': True, 'rsi_required': False, 'edge_k': 1.3400187582806482, 'edge_cap': 0.5191144357635027, 'bull_strategy': 'breakout', 'bull_bb_std_mult': 3.3833167354625058, 'bull_rsi_os': 25, 'bull_rsi_ob': 90, 'bull_adx_thresh': 15.219254564587466, 'bull_atr_min_pct': 0.00733807825324913, 'bull_atr_max_pct': 0.013112155215251747, 'bull_tp_mult': 1.6128201355715688, 'bull_tsl_mult': 0.4694308686022606, 'bull_time_stop': 241, 'bull_use_sma': True, 'bull_use_ema': True, 'bull_use_atr': False, 'bull_use_adx': False, 'bull_use_spike': True, 'bull_rsi_required': True, 'bear_strategy': 'mean_reversion', 'bear_bb_std_mult': 0.7695956490351443, 'bear_rsi_os': 11, 'bear_rsi_ob': 67, 'bear_adx_thresh': 27.307235595410955, 'bear_atr_min_pct': 0.005528618847363399, 'bear_atr_max_pct': 0.05780998586934512, 'bear_tp_mult': 1.313712112164483, 'bear_tsl_mult': 0.6092715597094381, 'bear_time_stop': 46, 'bear_use_sma': True, 'bear_use_ema': False, 'bear_use_atr': False, 'bear_use_adx': False, 'bear_use_spike': True, 'bear_rsi_required': False, 'sideways_strategy': 'breakout', 'sideways_bb_std_mult': 0.5187428701738445, 'sideways_rsi_os': 46, 'sideways_rsi_ob': 62, 'sideways_adx_thresh': 33.83687869740088, 'sideways_atr_min_pct': 0.02427529201174162, 'sideways_atr_max_pct': 0.11203212946915714, 'sideways_tp_mult': 2.2166274061899065, 'sideways_tsl_mult': 0.43416747736824607, 'sideways_time_stop': 128, 'sideways_use_sma': False, 'sideways_use_ema': True, 'sideways_use_atr': False, 'sideways_use_adx': False, 'sideways_use_spike': True, 'sideways_rsi_required': True}.
[I 2025-09-01 05:05:00,672] Trial 365 finished with values: [-1000000000.0, 1000000000.0] and parameters: {'p_sma': 26, 'p_std': 56, 'p_atr': 27, 'p_adx': 24, 'rsi_period': 8, 'ema1': 11, 'ema2': 35, 'slip_atr_k': 0.02694215470413712, 'slip_spread_k': 0.2539534662412246, 'spread_hl_frac': 0.03622837620510396, 'bb_std_mult': 3.478747921349002, 'rsi_os': 15, 'rsi_ob': 83, 'vol_spike': 0.20769390531171977, 'adx_thresh': 14.573888638623416, 'atr_min_pct': 0.02287675824998845, 'atr_max_pct': 0.08589592210738613, 'tp_mult': 2.6487502029525944, 'tsl_mult': 0.9993617763757363, 'strategy': 'mean_reversion', 'time_stop': 49, 'use_sma': False, 'use_atr': False, 'use_adx': False, 'use_ema': False, 'use_spike': True, 'rsi_required': False, 'edge_k': 0.6342089963867875, 'edge_cap': 0.4784929903845345, 'bull_strategy': 'breakout', 'bull_bb_std_mult': 2.225649244338881, 'bull_rsi_os': 25, 'bull_rsi_ob': 90, 'bull_adx_thresh': 23.00820273950331, 'bull_atr_min_pct': 0.003071248438172181, 'bull_atr_max_pct': 0.06648280504501479, 'bull_tp_mult': 1.5895151293800265, 'bull_tsl_mult': 0.44309932623853976, 'bull_time_stop': 243, 'bull_use_sma': True, 'bull_use_ema': True, 'bull_use_atr': False, 'bull_use_adx': False, 'bull_use_spike': True, 'bull_rsi_required': True, 'bear_strategy': 'mean_reversion', 'bear_bb_std_mult': 0.7716225225833634, 'bear_rsi_os': 23, 'bear_rsi_ob': 67, 'bear_adx_thresh': 29.407965985596885, 'bear_atr_min_pct': 0.027658418502914294, 'bear_atr_max_pct': 0.04209645075485102, 'bear_tp_mult': 1.3725841481131171, 'bear_tsl_mult': 0.6162997259541679, 'bear_time_stop': 102, 'bear_use_sma': True, 'bear_use_ema': False, 'bear_use_atr': False, 'bear_use_adx': False, 'bear_use_spike': True, 'bear_rsi_required': False, 'sideways_strategy': 'breakout', 'sideways_bb_std_mult': 0.6543150473388519, 'sideways_rsi_os': 46, 'sideways_rsi_ob': 52, 'sideways_adx_thresh': 23.240698476796087, 'sideways_atr_min_pct': 0.00714915803271598, 'sideways_atr_max_pct': 0.10465804121030549, 'sideways_tp_mult': 2.259100745584578, 'sideways_tsl_mult': 0.966684765985146, 'sideways_time_stop': 218, 'sideways_use_sma': False, 'sideways_use_ema': True, 'sideways_use_atr': False, 'sideways_use_adx': False, 'sideways_use_spike': True, 'sideways_rsi_required': True}.
[I 2025-09-01 05:05:40,611] Trial 369 finished with values: [-1000000000.0, 1000000000.0] and parameters: {'p_sma': 26, 'p_std': 56, 'p_atr': 11, 'p_adx': 29, 'rsi_period': 10, 'ema1': 10, 'ema2': 30, 'slip_atr_k': 0.07446213277167416, 'slip_spread_k': 0.14309600222359653, 'spread_hl_frac': 0.046229801020163774, 'bb_std_mult': 3.372685278938583, 'rsi_os': 40, 'rsi_ob': 84, 'vol_spike': 0.17321573853462194, 'adx_thresh': 23.31933391129111, 'atr_min_pct': 0.023083472922456147, 'atr_max_pct': 0.11804201813848814, 'tp_mult': 2.6491666348586587, 'tsl_mult': 0.31817039567069727, 'strategy': 'breakout', 'time_stop': 45, 'use_sma': False, 'use_atr': False, 'use_adx': False, 'use_ema': True, 'use_spike': True, 'rsi_required': False, 'edge_k': 0.41015038140069415, 'edge_cap': 0.5321938129280768, 'bull_strategy': 'breakout', 'bull_bb_std_mult': 2.5407179043849464, 'bull_rsi_os': 25, 'bull_rsi_ob': 90, 'bull_adx_thresh': 17.75216296608029, 'bull_atr_min_pct': 0.0017403147353746307, 'bull_atr_max_pct': 0.12241662301238404, 'bull_tp_mult': 1.495922571415041, 'bull_tsl_mult': 0.18771439834966525, 'bull_time_stop': 243, 'bull_use_sma': False, 'bull_use_ema': False, 'bull_use_atr': False, 'bull_use_adx': False, 'bull_use_spike': False, 'bull_rsi_required': True, 'bear_strategy': 'mean_reversion', 'bear_bb_std_mult': 0.7372563482841683, 'bear_rsi_os': 20, 'bear_rsi_ob': 66, 'bear_adx_thresh': 29.50705250758458, 'bear_atr_min_pct': 0.005697249730626188, 'bear_atr_max_pct': 0.06401665444208775, 'bear_tp_mult': 1.264505642925879, 'bear_tsl_mult': 0.5978601228291357, 'bear_time_stop': 200, 'bear_use_sma': True, 'bear_use_ema': True, 'bear_use_atr': False, 'bear_use_adx': False, 'bear_use_spike': False, 'bear_rsi_required': True, 'sideways_strategy': 'breakout', 'sideways_bb_std_mult': 0.7709467613476167, 'sideways_rsi_os': 42, 'sideways_rsi_ob': 64, 'sideways_adx_thresh': 18.54306654367531, 'sideways_atr_min_pct': 0.025309962284022887, 'sideways_atr_max_pct': 0.11217957720189978, 'sideways_tp_mult': 2.4967264625915955, 'sideways_tsl_mult': 0.9146979219618804, 'sideways_time_stop': 130, 'sideways_use_sma': True, 'sideways_use_ema': True, 'sideways_use_atr': False, 'sideways_use_adx': True, 'sideways_use_spike': True, 'sideways_rsi_required': False}.
