[I 2025-09-01 04:51:42,325] Trial 288 finished with values: [-1000000000.0, 1000000000.0] and parameters: {'p_sma': 16, 'p_std': 41, 'p_atr': 27, 'p_adx': 18, 'rsi_period': 64, 'ema1': 5, 'ema2': 48, 'slip_atr_k': 0.0007435200769071279, 'slip_spread_k': 0.34506760145395154, 'spread_hl_frac': 0.04350241072184158, 'bb_std_mult': 1.013625127529229, 'rsi_os': 47, 'rsi_ob': 76, 'vol_spike': 0.1637717968438433, 'adx_thresh': 31.398532450015146, 'atr_min_pct': 7.379562727932135e-06, 'atr_max_pct': 0.11492966599124742, 'tp_mult': 2.321396344613809, 'tsl_mult': 0.20822664567201582, 'strategy': 'breakout', 'time_stop': 38, 'use_sma': True, 'use_atr': False, 'use_adx': False, 'use_ema': True, 'use_spike': True, 'rsi_required': False, 'edge_k': 0.9384899653029254, 'edge_cap': 0.4093874584873778, 'bull_strategy': 'breakout', 'bull_bb_std_mult': 3.4349953777798765, 'bull_rsi_os': 7, 'bull_rsi_ob': 86, 'bull_adx_thresh': 17.53202764352632, 'bull_atr_min_pct': 0.0026846354325279634, 'bull_atr_max_pct': 0.12324791164166635, 'bull_tp_mult': 2.211681917413909, 'bull_tsl_mult': 0.43050058111177975, 'bull_time_stop': 208, 'bull_use_sma': True, 'bull_use_ema': False, 'bull_use_atr': False, 'bull_use_adx': False, 'bull_use_spike': False, 'bull_rsi_required': True, 'bear_strategy': 'mean_reversion', 'bear_bb_std_mult': 0.9510924419410204, 'bear_rsi_os': 49, 'bear_rsi_ob': 59, 'bear_adx_thresh': 15.790123910422613, 'bear_atr_min_pct': 0.003693776644760489, 'bear_atr_max_pct': 0.10345175592043575, 'bear_tp_mult': 1.0941353928436712, 'bear_tsl_mult': 0.1436403518375283, 'bear_time_stop': 274, 'bear_use_sma': True, 'bear_use_ema': True, 'bear_use_atr': True, 'bear_use_adx': True, 'bear_use_spike': False, 'bear_rsi_required': True, 'sideways_strategy': 'breakout', 'sideways_bb_std_mult': 1.2797778590024567, 'sideways_rsi_os': 9, 'sideways_rsi_ob': 49, 'sideways_adx_thresh': 17.51077311288275, 'sideways_atr_min_pct': 0.017788792643310115, 'sideways_atr_max_pct': 0.09431643663882244, 'sideways_tp_mult': 2.7430504169851813, 'sideways_tsl_mult': 0.9051451255605572, 'sideways_time_stop': 101, 'sideways_use_sma': True, 'sideways_use_ema': True, 'sideways_use_atr': False, 'sideways_use_adx': False, 'sideways_use_spike': True, 'sideways_rsi_required': False}.
[I 2025-09-01 04:51:42,327] Trial 289 finished with values: [-1000000000.0, 1000000000.0] and parameters: {'p_sma': 16, 'p_std': 27, 'p_atr': 27, 'p_adx': 18, 'rsi_period': 64, 'ema1': 5, 'ema2': 10, 'slip_atr_k': 0.00036434081808396396, 'slip_spread_k': 0.33874838965861503, 'spread_hl_frac': 0.04026715036923068, 'bb_std_mult': 1.0122915468195959, 'rsi_os': 47, 'rsi_ob': 81, 'vol_spike': 0.0964675236417466, 'adx_thresh': 16.022735180198598, 'atr_min_pct': 0.022303860409900095, 'atr_max_pct': 0.14103734162266213, 'tp_mult': 2.3138244597014257, 'tsl_mult': 0.3008397833843489, 'strategy': 'breakout', 'time_stop': 27, 'use_sma': True, 'use_atr': False, 'use_adx': False, 'use_ema': True, 'use_spike': True, 'rsi_required': False, 'edge_k': 1.3081774354465898, 'edge_cap': 0.21031567411270208, 'bull_strategy': 'breakout', 'bull_bb_std_mult': 2.4502871781207216, 'bull_rsi_os': 7, 'bull_rsi_ob': 80, 'bull_adx_thresh': 17.255906864240487, 'bull_atr_min_pct': 0.002762385598857547, 'bull_atr_max_pct': 0.14581171663760628, 'bull_tp_mult': 1.0946018985525376, 'bull_tsl_mult': 0.3489882930924145, 'bull_time_stop': 111, 'bull_use_sma': True, 'bull_use_ema': False, 'bull_use_atr': False, 'bull_use_adx': False, 'bull_use_spike': False, 'bull_rsi_required': True, 'bear_strategy': 'mean_reversion', 'bear_bb_std_mult': 1.0760522319330468, 'bear_rsi_os': 52, 'bear_rsi_ob': 63, 'bear_adx_thresh': 16.03975471390708, 'bear_atr_min_pct': 0.02835235910672586, 'bear_atr_max_pct': 0.12109986598190153, 'bear_tp_mult': 1.6180667277168175, 'bear_tsl_mult': 0.14277627663476763, 'bear_time_stop': 231, 'bear_use_sma': True, 'bear_use_ema': True, 'bear_use_atr': True, 'bear_use_adx': True, 'bear_use_spike': False, 'bear_rsi_required': True, 'sideways_strategy': 'breakout', 'sideways_bb_std_mult': 3.255257721934452, 'sideways_rsi_os': 9, 'sideways_rsi_ob': 49, 'sideways_adx_thresh': 17.83721836519463, 'sideways_atr_min_pct': 0.026139568828757263, 'sideways_atr_max_pct': 0.0946867692592741, 'sideways_tp_mult': 2.665330560044536, 'sideways_tsl_mult': 0.9986070937129837, 'sideways_time_stop': 187, 'sideways_use_sma': True, 'sideways_use_ema': True, 'sideways_use_atr': False, 'sideways_use_adx': False, 'sideways_use_spike': True, 'sideways_rsi_required': False}.
[I 2025-09-01 04:52:21,864] Trial 292 finished with values: [-0.03213377619660418, 0.03196387245894838] and parameters: {'p_sma': 39, 'p_std': 47, 'p_atr': 26, 'p_adx': 19, 'rsi_period': 59, 'ema1': 30, 'ema2': 36, 'slip_atr_k': 0.23216628170248835, 'slip_spread_k': 0.2570129213827583, 'spread_hl_frac': 0.037884684983903294, 'bb_std_mult': 0.9082866223790463, 'rsi_os': 18, 'rsi_ob': 49, 'vol_spike': 0.25874630566510787, 'adx_thresh': 20.764056758155288, 'atr_min_pct': 0.003327744666883627, 'atr_max_pct': 0.05208517744724907, 'tp_mult': 2.4900885117718756, 'tsl_mult': 0.9090372438517096, 'strategy': 'breakout', 'time_stop': 115, 'use_sma': False, 'use_atr': True, 'use_adx': True, 'use_ema': False, 'use_spike': True, 'rsi_required': True, 'edge_k': 0.5263421253910054, 'edge_cap': 0.7431123245088128, 'bull_strategy': 'mean_reversion', 'bull_bb_std_mult': 0.6930236515527526, 'bull_rsi_os': 28, 'bull_rsi_ob': 94, 'bull_adx_thresh': 19.5349193190464, 'bull_atr_min_pct': 0.0004772383709370255, 'bull_atr_max_pct': 0.12594636440975335, 'bull_tp_mult': 1.4781403632861208, 'bull_tsl_mult': 0.37685263008818143, 'bull_time_stop': 122, 'bull_use_sma': False, 'bull_use_ema': False, 'bull_use_atr': True, 'bull_use_adx': False, 'bull_use_spike': False, 'bull_rsi_required': False, 'bear_strategy': 'mean_reversion', 'bear_bb_std_mult': 3.1751614040869596, 'bear_rsi_os': 44, 'bear_rsi_ob': 52, 'bear_adx_thresh': 14.054892767443974, 'bear_atr_min_pct': 0.02895820682530414, 'bear_atr_max_pct': 0.14586872211670213, 'bear_tp_mult': 1.8603130892813848, 'bear_tsl_mult': 0.2162323250670296, 'bear_time_stop': 260, 'bear_use_sma': False, 'bear_use_ema': False, 'bear_use_atr': False, 'bear_use_adx': False, 'bear_use_spike': False, 'bear_rsi_required': False, 'sideways_strategy': 'mean_reversion', 'sideways_bb_std_mult': 0.8735577185981798, 'sideways_rsi_os': 7, 'sideways_rsi_ob': 45, 'sideways_adx_thresh': 33.18471490802278, 'sideways_atr_min_pct': 0.023927463494938035, 'sideways_atr_max_pct': 0.08547696082872504, 'sideways_tp_mult': 2.8394286383599776, 'sideways_tsl_mult': 0.9704552891252454, 'sideways_time_stop': 240, 'sideways_use_sma': True, 'sideways_use_ema': False, 'sideways_use_atr': False, 'sideways_use_adx': True, 'sideways_use_spike': False, 'sideways_rsi_required': True}.
[I 2025-09-01 04:52:22,322] Trial 293 finished with values: [-1000000000.0, 1000000000.0] and parameters: {'p_sma': 39, 'p_std': 25, 'p_atr': 26, 'p_adx': 19, 'rsi_period': 59, 'ema1': 30, 'ema2': 36, 'slip_atr_k': 0.007135550662924387, 'slip_spread_k': 0.3139223793545869, 'spread_hl_frac': 0.026892752844448965, 'bb_std_mult': 0.9439621830890331, 'rsi_os': 18, 'rsi_ob': 50, 'vol_spike': 0.25924778822111694, 'adx_thresh': 23.142351404546233, 'atr_min_pct': 0.019202111648463686, 'atr_max_pct': 0.11783918109942382, 'tp_mult': 2.4868122777653374, 'tsl_mult': 0.12998718467193093, 'strategy': 'breakout', 'time_stop': 27, 'use_sma': False, 'use_atr': True, 'use_adx': True, 'use_ema': False, 'use_spike': True, 'rsi_required': True, 'edge_k': 0.5291309302482298, 'edge_cap': 0.16191447323645805, 'bull_strategy': 'mean_reversion', 'bull_bb_std_mult': 0.6647575438184323, 'bull_rsi_os': 38, 'bull_rsi_ob': 78, 'bull_adx_thresh': 19.601357660321312, 'bull_atr_min_pct': 0.02832390955007484, 'bull_atr_max_pct': 0.08683030155078172, 'bull_tp_mult': 1.8083777297068262, 'bull_tsl_mult': 0.36876840267167615, 'bull_time_stop': 178, 'bull_use_sma': False, 'bull_use_ema': False, 'bull_use_atr': True, 'bull_use_adx': False, 'bull_use_spike': False, 'bull_rsi_required': False, 'bear_strategy': 'mean_reversion', 'bear_bb_std_mult': 0.5089206343067152, 'bear_rsi_os': 44, 'bear_rsi_ob': 58, 'bear_adx_thresh': 14.24961456296457, 'bear_atr_min_pct': 0.02996057899568448, 'bear_atr_max_pct': 0.1498746508251178, 'bear_tp_mult': 1.528664050341803, 'bear_tsl_mult': 0.22115899143228873, 'bear_time_stop': 265, 'bear_use_sma': False, 'bear_use_ema': False, 'bear_use_atr': False, 'bear_use_adx': False, 'bear_use_spike': False, 'bear_rsi_required': False, 'sideways_strategy': 'mean_reversion', 'sideways_bb_std_mult': 0.8683958022885221, 'sideways_rsi_os': 26, 'sideways_rsi_ob': 45, 'sideways_adx_thresh': 31.224647997431738, 'sideways_atr_min_pct': 0.02208388693821828, 'sideways_atr_max_pct': 0.021618138598625186, 'sideways_tp_mult': 2.8465587558497054, 'sideways_tsl_mult': 0.3203064701986331, 'sideways_time_stop': 269, 'sideways_use_sma': True, 'sideways_use_ema': False, 'sideways_use_atr': False, 'sideways_use_adx': True, 'sideways_use_spike': False, 'sideways_rsi_required': True}.
[I 2025-09-01 04:52:22,744] Trial 291 finished with values: [-1000000000.0, 1000000000.0] and parameters: {'p_sma': 16, 'p_std': 42, 'p_atr': 26, 'p_adx': 19, 'rsi_period': 11, 'ema1': 30, 'ema2': 54, 'slip_atr_k': 0.11324199773719755, 'slip_spread_k': 0.3450935156221935, 'spread_hl_frac': 0.03784221636898032, 'bb_std_mult': 2.545507912332246, 'rsi_os': 47, 'rsi_ob': 81, 'vol_spike': 0.258603516197321, 'adx_thresh': 15.620987738054493, 'atr_min_pct': 0.0013459738498321355, 'atr_max_pct': 0.11737128113079938, 'tp_mult': 1.6182535491419359, 'tsl_mult': 0.18708520269549794, 'strategy': 'breakout', 'time_stop': 38, 'use_sma': False, 'use_atr': True, 'use_adx': True, 'use_ema': False, 'use_spike': True, 'rsi_required': True, 'edge_k': 0.3478505186942107, 'edge_cap': 0.21528768620573235, 'bull_strategy': 'mean_reversion', 'bull_bb_std_mult': 3.433967135601561, 'bull_rsi_os': 28, 'bull_rsi_ob': 78, 'bull_adx_thresh': 19.08155825072964, 'bull_atr_min_pct': 0.02196052665371956, 'bull_atr_max_pct': 0.11558345913585685, 'bull_tp_mult': 1.5040336204976807, 'bull_tsl_mult': 0.42910083808106664, 'bull_time_stop': 53, 'bull_use_sma': False, 'bull_use_ema': False, 'bull_use_atr': True, 'bull_use_adx': False, 'bull_use_spike': False, 'bull_rsi_required': False, 'bear_strategy': 'mean_reversion', 'bear_bb_std_mult': 0.639648486409724, 'bear_rsi_os': 24, 'bear_rsi_ob': 62, 'bear_adx_thresh': 14.23586375592433, 'bear_atr_min_pct': 0.0038312157635939266, 'bear_atr_max_pct': 0.14572162523667723, 'bear_tp_mult': 1.987132225111361, 'bear_tsl_mult': 0.701430509650489, 'bear_time_stop': 262, 'bear_use_sma': False, 'bear_use_ema': False, 'bear_use_atr': False, 'bear_use_adx': False, 'bear_use_spike': False, 'bear_rsi_required': False, 'sideways_strategy': 'mean_reversion', 'sideways_bb_std_mult': 1.2663226999908108, 'sideways_rsi_os': 48, 'sideways_rsi_ob': 49, 'sideways_adx_thresh': 25.80595347002662, 'sideways_atr_min_pct': 0.025832612100844622, 'sideways_atr_max_pct': 0.09389968500056357, 'sideways_tp_mult': 1.1453891234542664, 'sideways_tsl_mult': 0.902715449119607, 'sideways_time_stop': 186, 'sideways_use_sma': True, 'sideways_use_ema': True, 'sideways_use_atr': False, 'sideways_use_adx': True, 'sideways_use_spike': False, 'sideways_rsi_required': False}.
[I 2025-09-01 04:52:23,029] Trial 290 finished with values: [-1000000000.0, 1000000000.0] and parameters: {'p_sma': 16, 'p_std': 31, 'p_atr': 30, 'p_adx': 21, 'rsi_period': 64, 'ema1': 30, 'ema2': 60, 'slip_atr_k': 0.23310224426156778, 'slip_spread_k': 0.2584117381633809, 'spread_hl_frac': 0.04028039800734069, 'bb_std_mult': 0.9433793064784923, 'rsi_os': 47, 'rsi_ob': 55, 'vol_spike': 0.24197163106688044, 'adx_thresh': 31.34254090962248, 'atr_min_pct': 7.91128780349001e-07, 'atr_max_pct': 0.020446253681790268, 'tp_mult': 2.4883080128393567, 'tsl_mult': 0.7995472239983263, 'strategy': 'breakout', 'time_stop': 26, 'use_sma': True, 'use_atr': False, 'use_adx': True, 'use_ema': False, 'use_spike': True, 'rsi_required': False, 'edge_k': 0.3607453404068498, 'edge_cap': 0.20987799286475597, 'bull_strategy': 'mean_reversion', 'bull_bb_std_mult': 2.450054692921985, 'bull_rsi_os': 28, 'bull_rsi_ob': 85, 'bull_adx_thresh': 17.618955691472777, 'bull_atr_min_pct': 0.00623390655964131, 'bull_atr_max_pct': 0.1241394485226306, 'bull_tp_mult': 1.484974507952652, 'bull_tsl_mult': 0.36977172714463424, 'bull_time_stop': 175, 'bull_use_sma': False, 'bull_use_ema': False, 'bull_use_atr': True, 'bull_use_adx': False, 'bull_use_spike': False, 'bull_rsi_required': False, 'bear_strategy': 'mean_reversion', 'bear_bb_std_mult': 1.4438561236996033, 'bear_rsi_os': 55, 'bear_rsi_ob': 73, 'bear_adx_thresh': 15.774743593163976, 'bear_atr_min_pct': 0.02797730287549365, 'bear_atr_max_pct': 0.14579092808726918, 'bear_tp_mult': 1.8555530716734732, 'bear_tsl_mult': 0.7116583808617396, 'bear_time_stop': 194, 'bear_use_sma': False, 'bear_use_ema': True, 'bear_use_atr': True, 'bear_use_adx': True, 'bear_use_spike': False, 'bear_rsi_required': False, 'sideways_strategy': 'mean_reversion', 'sideways_bb_std_mult': 2.232342421388543, 'sideways_rsi_os': 50, 'sideways_rsi_ob': 95, 'sideways_adx_thresh': 12.775359665260794, 'sideways_atr_min_pct': 0.006859369223129224, 'sideways_atr_max_pct': 0.0476901515405218, 'sideways_tp_mult': 2.6640597987590353, 'sideways_tsl_mult': 0.2129903774022739, 'sideways_time_stop': 187, 'sideways_use_sma': True, 'sideways_use_ema': True, 'sideways_use_atr': False, 'sideways_use_adx': True, 'sideways_use_spike': False, 'sideways_rsi_required': False}.
[I 2025-09-01 04:53:03,890] Trial 297 finished with values: [-1000000000.0, 1000000000.0] and parameters: {'p_sma': 19, 'p_std': 43, 'p_atr': 25, 'p_adx': 20, 'rsi_period': 62, 'ema1': 21, 'ema2': 28, 'slip_atr_k': 0.006363989482416462, 'slip_spread_k': 0.9730759970102497, 'spread_hl_frac': 0.042059021557981885, 'bb_std_mult': 2.452688450962702, 'rsi_os': 45, 'rsi_ob': 59, 'vol_spike': 0.05271248691717713, 'adx_thresh': 10.174309324455873, 'atr_min_pct': 0.018319484683780453, 'atr_max_pct': 0.13107231674294417, 'tp_mult': 2.5531558069345643, 'tsl_mult': 0.6085455149204343, 'strategy': 'mean_reversion', 'time_stop': 13, 'use_sma': True, 'use_atr': False, 'use_adx': False, 'use_ema': True, 'use_spike': False, 'rsi_required': False, 'edge_k': 0.5851587825794071, 'edge_cap': 0.2842496836825103, 'bull_strategy': 'mean_reversion', 'bull_bb_std_mult': 2.252311205113684, 'bull_rsi_os': 10, 'bull_rsi_ob': 91, 'bull_adx_thresh': 20.33543755812415, 'bull_atr_min_pct': 0.0036463761646576224, 'bull_atr_max_pct': 0.13428501139914237, 'bull_tp_mult': 2.9715482108719957, 'bull_tsl_mult': 0.29223566636380177, 'bull_time_stop': 208, 'bull_use_sma': True, 'bull_use_ema': True, 'bull_use_atr': True, 'bull_use_adx': True, 'bull_use_spike': True, 'bull_rsi_required': False, 'bear_strategy': 'breakout', 'bear_bb_std_mult': 1.3141898707479744, 'bear_rsi_os': 36, 'bear_rsi_ob': 78, 'bear_adx_thresh': 11.800571440184981, 'bear_atr_min_pct': 0.028855225898123005, 'bear_atr_max_pct': 0.14116199699970705, 'bear_tp_mult': 1.917971238754831, 'bear_tsl_mult': 0.033975403984868424, 'bear_time_stop': 198, 'bear_use_sma': True, 'bear_use_ema': False, 'bear_use_atr': True, 'bear_use_adx': True, 'bear_use_spike': True, 'bear_rsi_required': False, 'sideways_strategy': 'mean_reversion', 'sideways_bb_std_mult': 1.4286251851783547, 'sideways_rsi_os': 6, 'sideways_rsi_ob': 89, 'sideways_adx_thresh': 14.579208745476965, 'sideways_atr_min_pct': 0.021312057488758997, 'sideways_atr_max_pct': 0.13732332628650823, 'sideways_tp_mult': 2.91326955162663, 'sideways_tsl_mult': 0.9582759458434429, 'sideways_time_stop': 166, 'sideways_use_sma': False, 'sideways_use_ema': True, 'sideways_use_atr': True, 'sideways_use_adx': False, 'sideways_use_spike': False, 'sideways_rsi_required': False}.
[I 2025-09-01 04:53:03,920] Trial 294 finished with values: [-1000000000.0, 1000000000.0] and parameters: {'p_sma': 21, 'p_std': 43, 'p_atr': 30, 'p_adx': 21, 'rsi_period': 17, 'ema1': 14, 'ema2': 28, 'slip_atr_k': 0.008544815879852934, 'slip_spread_k': 0.30830420503297273, 'spread_hl_frac': 0.008275088688637296, 'bb_std_mult': 1.9100782669423255, 'rsi_os': 45, 'rsi_ob': 47, 'vol_spike': 0.03862432152800603, 'adx_thresh': 10.173715090030113, 'atr_min_pct': 0.009224093212377021, 'atr_max_pct': 0.11790785340157851, 'tp_mult': 2.1069430838810397, 'tsl_mult': 0.6175608138343782, 'strategy': 'breakout', 'time_stop': 25, 'use_sma': True, 'use_atr': True, 'use_adx': True, 'use_ema': False, 'use_spike': False, 'rsi_required': True, 'edge_k': 1.2099161144120847, 'edge_cap': 0.1589376560693315, 'bull_strategy': 'mean_reversion', 'bull_bb_std_mult': 2.229712984761424, 'bull_rsi_os': 45, 'bull_rsi_ob': 91, 'bull_adx_thresh': 19.006220531880405, 'bull_atr_min_pct': 0.005312073645100968, 'bull_atr_max_pct': 0.13802065237113703, 'bull_tp_mult': 1.6514598430614529, 'bull_tsl_mult': 0.1814562433821028, 'bull_time_stop': 210, 'bull_use_sma': False, 'bull_use_ema': False, 'bull_use_atr': True, 'bull_use_adx': False, 'bull_use_spike': True, 'bull_rsi_required': False, 'bear_strategy': 'mean_reversion', 'bear_bb_std_mult': 1.446486092593165, 'bear_rsi_os': 44, 'bear_rsi_ob': 74, 'bear_adx_thresh': 13.34879951149437, 'bear_atr_min_pct': 0.029964198248511143, 'bear_atr_max_pct': 0.14951566363816998, 'bear_tp_mult': 1.0605752410552052, 'bear_tsl_mult': 0.9526166735865547, 'bear_time_stop': 195, 'bear_use_sma': False, 'bear_use_ema': False, 'bear_use_atr': True, 'bear_use_adx': True, 'bear_use_spike': True, 'bear_rsi_required': False, 'sideways_strategy': 'mean_reversion', 'sideways_bb_std_mult': 0.668302280176114, 'sideways_rsi_os': 7, 'sideways_rsi_ob': 46, 'sideways_adx_thresh': 8.027500318988395, 'sideways_atr_min_pct': 0.021923458527499575, 'sideways_atr_max_pct': 0.045542905689287205, 'sideways_tp_mult': 2.912430011516187, 'sideways_tsl_mult': 0.8205710934977579, 'sideways_time_stop': 165, 'sideways_use_sma': True, 'sideways_use_ema': True, 'sideways_use_atr': False, 'sideways_use_adx': True, 'sideways_use_spike': False, 'sideways_rsi_required': False}.
[I 2025-09-01 04:53:04,204] Trial 295 finished with values: [-1000000000.0, 1000000000.0] and parameters: {'p_sma': 21, 'p_std': 43, 'p_atr': 25, 'p_adx': 8, 'rsi_period': 17, 'ema1': 14, 'ema2': 28, 'slip_atr_k': 0.11606311067541822, 'slip_spread_k': 0.2939669548787894, 'spread_hl_frac': 0.032427451821130146, 'bb_std_mult': 2.4330312126372378, 'rsi_os': 27, 'rsi_ob': 61, 'vol_spike': 0.24376639501856937, 'adx_thresh': 10.142301897725071, 'atr_min_pct': 0.0012799438676554756, 'atr_max_pct': 0.11963474036909946, 'tp_mult': 2.099584644444237, 'tsl_mult': 0.0569024477235226, 'strategy': 'breakout', 'time_stop': 11, 'use_sma': True, 'use_atr': False, 'use_adx': False, 'use_ema': True, 'use_spike': False, 'rsi_required': False, 'edge_k': 0.3811953399763609, 'edge_cap': 0.2785395775087577, 'bull_strategy': 'mean_reversion', 'bull_bb_std_mult': 2.217665785247695, 'bull_rsi_os': 53, 'bull_rsi_ob': 92, 'bull_adx_thresh': 21.12705712625751, 'bull_atr_min_pct': 0.0051443467127654345, 'bull_atr_max_pct': 0.13778089417614975, 'bull_tp_mult': 1.6480015598969364, 'bull_tsl_mult': 0.5543976422929637, 'bull_time_stop': 210, 'bull_use_sma': True, 'bull_use_ema': False, 'bull_use_atr': True, 'bull_use_adx': False, 'bull_use_spike': True, 'bull_rsi_required': False, 'bear_strategy': 'mean_reversion', 'bear_bb_std_mult': 1.3332085633195858, 'bear_rsi_os': 55, 'bear_rsi_ob': 73, 'bear_adx_thresh': 11.828910154360488, 'bear_atr_min_pct': 0.007144716392972077, 'bear_atr_max_pct': 0.02990286515585741, 'bear_tp_mult': 1.923954704802062, 'bear_tsl_mult': 0.7153279249293143, 'bear_time_stop': 197, 'bear_use_sma': True, 'bear_use_ema': False, 'bear_use_atr': True, 'bear_use_adx': True, 'bear_use_spike': True, 'bear_rsi_required': False, 'sideways_strategy': 'mean_reversion', 'sideways_bb_std_mult': 1.4202365471369904, 'sideways_rsi_os': 6, 'sideways_rsi_ob': 95, 'sideways_adx_thresh': 25.724830931578758, 'sideways_atr_min_pct': 0.012398796217186772, 'sideways_atr_max_pct': 0.13659452773863404, 'sideways_tp_mult': 1.1433446476970643, 'sideways_tsl_mult': 0.2173987248396631, 'sideways_time_stop': 24, 'sideways_use_sma': True, 'sideways_use_ema': True, 'sideways_use_atr': False, 'sideways_use_adx': False, 'sideways_use_spike': False, 'sideways_rsi_required': False}.
