[I 2025-09-01 04:44:38,078] Trial 244 finished with values: [-1000000000.0, 1000000000.0] and parameters: {'p_sma': 19, 'p_std': 44, 'p_atr': 14, 'p_adx': 8, 'rsi_period': 60, 'ema1': 12, 'ema2': 27, 'slip_atr_k': 0.005733958280953065, 'slip_spread_k': 0.7770277070695397, 'spread_hl_frac': 0.04276745502171259, 'bb_std_mult': 2.5679799172607014, 'rsi_os': 46, 'rsi_ob': 55, 'vol_spike': 0.2463340646479516, 'adx_thresh': 15.071367738757123, 'atr_min_pct': 0.027288481557506575, 'atr_max_pct': 0.1196923948446649, 'tp_mult': 2.4202443923958974, 'tsl_mult': 0.9338264290676415, 'strategy': 'breakout', 'time_stop': 26, 'use_sma': True, 'use_atr': True, 'use_adx': True, 'use_ema': True, 'use_spike': False, 'rsi_required': True, 'edge_k': 1.995153385224445, 'edge_cap': 0.17573824796744222, 'bull_strategy': 'breakout', 'bull_bb_std_mult': 3.010555715128086, 'bull_rsi_os': 35, 'bull_rsi_ob': 95, 'bull_adx_thresh': 19.235355274357875, 'bull_atr_min_pct': 0.019832827862373382, 'bull_atr_max_pct': 0.1290711175625192, 'bull_tp_mult': 2.4475791684873043, 'bull_tsl_mult': 0.3361460005619925, 'bull_time_stop': 8, 'bull_use_sma': False, 'bull_use_ema': False, 'bull_use_atr': False, 'bull_use_adx': True, 'bull_use_spike': True, 'bull_rsi_required': True, 'bear_strategy': 'breakout', 'bear_bb_std_mult': 2.812025485343871, 'bear_rsi_os': 46, 'bear_rsi_ob': 57, 'bear_adx_thresh': 13.519300338667154, 'bear_atr_min_pct': 0.029958758243049423, 'bear_atr_max_pct': 0.14981599217789676, 'bear_tp_mult': 1.0113746974758304, 'bear_tsl_mult': 0.6132780452327893, 'bear_time_stop': 192, 'bear_use_sma': False, 'bear_use_ema': False, 'bear_use_atr': False, 'bear_use_adx': True, 'bear_use_spike': False, 'bear_rsi_required': False, 'sideways_strategy': 'breakout', 'sideways_bb_std_mult': 0.8014030260651539, 'sideways_rsi_os': 8, 'sideways_rsi_ob': 50, 'sideways_adx_thresh': 22.037582514693483, 'sideways_atr_min_pct': 0.01178135270377749, 'sideways_atr_max_pct': 0.05134572617005958, 'sideways_tp_mult': 2.8702332028555464, 'sideways_tsl_mult': 0.7375375539684281, 'sideways_time_stop': 186, 'sideways_use_sma': True, 'sideways_use_ema': True, 'sideways_use_atr': True, 'sideways_use_adx': True, 'sideways_use_spike': False, 'sideways_rsi_required': True}.
[I 2025-09-01 04:44:38,519] Trial 241 finished with values: [-0.11655582667471387, 0.11612710152258929] and parameters: {'p_sma': 19, 'p_std': 44, 'p_atr': 25, 'p_adx': 18, 'rsi_period': 58, 'ema1': 29, 'ema2': 54, 'slip_atr_k': 0.2175560000260608, 'slip_spread_k': 0.6884841723603137, 'spread_hl_frac': 0.04268457564260093, 'bb_std_mult': 1.066861262988994, 'rsi_os': 46, 'rsi_ob': 55, 'vol_spike': 0.24677925424700872, 'adx_thresh': 16.80822980464311, 'atr_min_pct': 0.001691893550536666, 'atr_max_pct': 0.11728327479377647, 'tp_mult': 2.051041159001166, 'tsl_mult': 0.17445248868035407, 'strategy': 'mean_reversion', 'time_stop': 234, 'use_sma': False, 'use_atr': False, 'use_adx': False, 'use_ema': True, 'use_spike': False, 'rsi_required': False, 'edge_k': 1.969857526569707, 'edge_cap': 0.2945966831372847, 'bull_strategy': 'mean_reversion', 'bull_bb_std_mult': 2.411423970975913, 'bull_rsi_os': 5, 'bull_rsi_ob': 89, 'bull_adx_thresh': 8.599074027577323, 'bull_atr_min_pct': 0.0024917345986123843, 'bull_atr_max_pct': 0.12620144228554833, 'bull_tp_mult': 1.7040645349340235, 'bull_tsl_mult': 0.3835563695088956, 'bull_time_stop': 212, 'bull_use_sma': True, 'bull_use_ema': False, 'bull_use_atr': True, 'bull_use_adx': True, 'bull_use_spike': False, 'bull_rsi_required': False, 'bear_strategy': 'breakout', 'bear_bb_std_mult': 2.7471160907813297, 'bear_rsi_os': 47, 'bear_rsi_ob': 59, 'bear_adx_thresh': 12.195774515861004, 'bear_atr_min_pct': 0.0012061609131989726, 'bear_atr_max_pct': 0.14238301293297925, 'bear_tp_mult': 1.0212774708123527, 'bear_tsl_mult': 0.14837187483128442, 'bear_time_stop': 41, 'bear_use_sma': True, 'bear_use_ema': False, 'bear_use_atr': True, 'bear_use_adx': False, 'bear_use_spike': False, 'bear_rsi_required': True, 'sideways_strategy': 'mean_reversion', 'sideways_bb_std_mult': 3.3694193331137017, 'sideways_rsi_os': 41, 'sideways_rsi_ob': 84, 'sideways_adx_thresh': 15.564810429981563, 'sideways_atr_min_pct': 0.011547714217695485, 'sideways_atr_max_pct': 0.05159376153741154, 'sideways_tp_mult': 1.5133841685309166, 'sideways_tsl_mult': 0.9989545818660122, 'sideways_time_stop': 14, 'sideways_use_sma': True, 'sideways_use_ema': True, 'sideways_use_atr': True, 'sideways_use_adx': False, 'sideways_use_spike': False, 'sideways_rsi_required': False}.
[I 2025-09-01 04:45:18,551] Trial 245 finished with values: [-0.017079956176446642, 0.01691898616296266] and parameters: {'p_sma': 19, 'p_std': 44, 'p_atr': 8, 'p_adx': 19, 'rsi_period': 60, 'ema1': 30, 'ema2': 54, 'slip_atr_k': 0.004617160935865585, 'slip_spread_k': 0.3325113376232227, 'spread_hl_frac': 0.04273466869483692, 'bb_std_mult': 3.40679807672404, 'rsi_os': 46, 'rsi_ob': 55, 'vol_spike': 0.24866899292397762, 'adx_thresh': 34.925313872463704, 'atr_min_pct': 0.0008765686133924798, 'atr_max_pct': 0.14743948718096872, 'tp_mult': 2.4492810700248278, 'tsl_mult': 0.9389627160869568, 'strategy': 'breakout', 'time_stop': 236, 'use_sma': False, 'use_atr': True, 'use_adx': True, 'use_ema': True, 'use_spike': False, 'rsi_required': True, 'edge_k': 0.0931729262288361, 'edge_cap': 0.28666680271184264, 'bull_strategy': 'breakout', 'bull_bb_std_mult': 2.2681693393766325, 'bull_rsi_os': 35, 'bull_rsi_ob': 89, 'bull_adx_thresh': 19.351927610892357, 'bull_atr_min_pct': 0.0016416393282527807, 'bull_atr_max_pct': 0.04178217031587713, 'bull_tp_mult': 1.7013781677657207, 'bull_tsl_mult': 0.33586466916399565, 'bull_time_stop': 212, 'bull_use_sma': False, 'bull_use_ema': False, 'bull_use_atr': True, 'bull_use_adx': True, 'bull_use_spike': True, 'bull_rsi_required': False, 'bear_strategy': 'breakout', 'bear_bb_std_mult': 1.230131788463827, 'bear_rsi_os': 46, 'bear_rsi_ob': 71, 'bear_adx_thresh': 13.721263122256417, 'bear_atr_min_pct': 0.0293584637775854, 'bear_atr_max_pct': 0.1294109607107667, 'bear_tp_mult': 1.0782532443734056, 'bear_tsl_mult': 0.14868099071055652, 'bear_time_stop': 210, 'bear_use_sma': False, 'bear_use_ema': False, 'bear_use_atr': False, 'bear_use_adx': True, 'bear_use_spike': False, 'bear_rsi_required': True, 'sideways_strategy': 'mean_reversion', 'sideways_bb_std_mult': 0.7979066848030238, 'sideways_rsi_os': 8, 'sideways_rsi_ob': 87, 'sideways_adx_thresh': 17.76840901607458, 'sideways_atr_min_pct': 0.023025727761897326, 'sideways_atr_max_pct': 0.07156211308022356, 'sideways_tp_mult': 2.864940315770471, 'sideways_tsl_mult': 0.6940340582422341, 'sideways_time_stop': 184, 'sideways_use_sma': True, 'sideways_use_ema': True, 'sideways_use_atr': True, 'sideways_use_adx': True, 'sideways_use_spike': False, 'sideways_rsi_required': True}.
[I 2025-09-01 04:45:19,107] Trial 247 finished with values: [-1000000000.0, 1000000000.0] and parameters: {'p_sma': 17, 'p_std': 42, 'p_atr': 9, 'p_adx': 19, 'rsi_period': 41, 'ema1': 30, 'ema2': 25, 'slip_atr_k': 0.21967041053481873, 'slip_spread_k': 0.4457369381227514, 'spread_hl_frac': 0.0413653684507262, 'bb_std_mult': 0.9779469603965016, 'rsi_os': 47, 'rsi_ob': 48, 'vol_spike': 0.11329439487914579, 'adx_thresh': 15.585064739993946, 'atr_min_pct': 0.005428087879481543, 'atr_max_pct': 0.12516239579114455, 'tp_mult': 2.5085298500083173, 'tsl_mult': 0.9131422613985601, 'strategy': 'breakout', 'time_stop': 122, 'use_sma': True, 'use_atr': False, 'use_adx': False, 'use_ema': True, 'use_spike': True, 'rsi_required': False, 'edge_k': 0.6645812185511031, 'edge_cap': 0.0999571043922016, 'bull_strategy': 'mean_reversion', 'bull_bb_std_mult': 2.1890326733386987, 'bull_rsi_os': 30, 'bull_rsi_ob': 89, 'bull_adx_thresh': 32.43120046919642, 'bull_atr_min_pct': 0.006987387665378953, 'bull_atr_max_pct': 0.01748217727404519, 'bull_tp_mult': 2.6376503928732973, 'bull_tsl_mult': 0.39186101980209836, 'bull_time_stop': 147, 'bull_use_sma': True, 'bull_use_ema': False, 'bull_use_atr': True, 'bull_use_adx': False, 'bull_use_spike': False, 'bull_rsi_required': False, 'bear_strategy': 'mean_reversion', 'bear_bb_std_mult': 0.9841395881055542, 'bear_rsi_os': 44, 'bear_rsi_ob': 90, 'bear_adx_thresh': 13.796688373628808, 'bear_atr_min_pct': 0.02942370496744673, 'bear_atr_max_pct': 0.12973075518422916, 'bear_tp_mult': 1.071599287922811, 'bear_tsl_mult': 0.16569843001029758, 'bear_time_stop': 200, 'bear_use_sma': True, 'bear_use_ema': False, 'bear_use_atr': True, 'bear_use_adx': True, 'bear_use_spike': True, 'bear_rsi_required': False, 'sideways_strategy': 'mean_reversion', 'sideways_bb_std_mult': 1.387148761662355, 'sideways_rsi_os': 50, 'sideways_rsi_ob': 67, 'sideways_adx_thresh': 26.462424783721367, 'sideways_atr_min_pct': 0.022926391684899745, 'sideways_atr_max_pct': 0.10122983876008056, 'sideways_tp_mult': 1.5031586955958682, 'sideways_tsl_mult': 0.9988043381058069, 'sideways_time_stop': 9, 'sideways_use_sma': True, 'sideways_use_ema': True, 'sideways_use_atr': False, 'sideways_use_adx': False, 'sideways_use_spike': False, 'sideways_rsi_required': False}.
[I 2025-09-01 04:45:19,642] Trial 248 finished with values: [-1000000000.0, 1000000000.0] and parameters: {'p_sma': 17, 'p_std': 41, 'p_atr': 9, 'p_adx': 28, 'rsi_period': 40, 'ema1': 30, 'ema2': 25, 'slip_atr_k': 0.003551599697723788, 'slip_spread_k': 0.44381168710760815, 'spread_hl_frac': 0.04056335149480274, 'bb_std_mult': 0.9830910114539064, 'rsi_os': 5, 'rsi_ob': 58, 'vol_spike': 0.03469237686406837, 'adx_thresh': 31.34941394317884, 'atr_min_pct': 0.0007930819117736533, 'atr_max_pct': 0.12408427068802301, 'tp_mult': 2.504100663893621, 'tsl_mult': 0.6844856873440517, 'strategy': 'breakout', 'time_stop': 5, 'use_sma': True, 'use_atr': False, 'use_adx': False, 'use_ema': True, 'use_spike': True, 'rsi_required': False, 'edge_k': 0.5511692227313959, 'edge_cap': 0.10188366728606646, 'bull_strategy': 'mean_reversion', 'bull_bb_std_mult': 2.2715645734225145, 'bull_rsi_os': 30, 'bull_rsi_ob': 91, 'bull_adx_thresh': 29.51453730466931, 'bull_atr_min_pct': 0.019099580319349465, 'bull_atr_max_pct': 0.05285652731614621, 'bull_tp_mult': 1.6370834808829633, 'bull_tsl_mult': 0.11207163355440852, 'bull_time_stop': 218, 'bull_use_sma': True, 'bull_use_ema': False, 'bull_use_atr': True, 'bull_use_adx': False, 'bull_use_spike': False, 'bull_rsi_required': False, 'bear_strategy': 'mean_reversion', 'bear_bb_std_mult': 0.9776821906040865, 'bear_rsi_os': 8, 'bear_rsi_ob': 71, 'bear_adx_thresh': 13.77443316601611, 'bear_atr_min_pct': 0.029419415683342602, 'bear_atr_max_pct': 0.12908300575840664, 'bear_tp_mult': 1.079885609513335, 'bear_tsl_mult': 0.8189366372581108, 'bear_time_stop': 200, 'bear_use_sma': True, 'bear_use_ema': False, 'bear_use_atr': True, 'bear_use_adx': True, 'bear_use_spike': True, 'bear_rsi_required': False, 'sideways_strategy': 'mean_reversion', 'sideways_bb_std_mult': 1.39146477781878, 'sideways_rsi_os': 7, 'sideways_rsi_ob': 92, 'sideways_adx_thresh': 17.32588484722863, 'sideways_atr_min_pct': 0.028995816388470617, 'sideways_atr_max_pct': 0.0853041083563925, 'sideways_tp_mult': 2.2504382002236856, 'sideways_tsl_mult': 0.947919947087784, 'sideways_time_stop': 88, 'sideways_use_sma': True, 'sideways_use_ema': True, 'sideways_use_atr': False, 'sideways_use_adx': False, 'sideways_use_spike': False, 'sideways_rsi_required': False}.
[I 2025-09-01 04:45:19,872] Trial 246 finished with values: [-0.04622932925672252, 0.04605981070930311] and parameters: {'p_sma': 19, 'p_std': 12, 'p_atr': 25, 'p_adx': 19, 'rsi_period': 72, 'ema1': 12, 'ema2': 25, 'slip_atr_k': 0.1926587944999612, 'slip_spread_k': 0.4571567296376808, 'spread_hl_frac': 0.0411939551537763, 'bb_std_mult': 0.9713518056603548, 'rsi_os': 47, 'rsi_ob': 55, 'vol_spike': 0.11441790980238528, 'adx_thresh': 15.598243256767999, 'atr_min_pct': 0.0006740634536519993, 'atr_max_pct': 0.1207108739010475, 'tp_mult': 2.509581799298385, 'tsl_mult': 0.9335951298682762, 'strategy': 'breakout', 'time_stop': 14, 'use_sma': True, 'use_atr': False, 'use_adx': False, 'use_ema': True, 'use_spike': False, 'rsi_required': False, 'edge_k': 0.5629010046231427, 'edge_cap': 0.37990840670854276, 'bull_strategy': 'mean_reversion', 'bull_bb_std_mult': 2.2567903604368222, 'bull_rsi_os': 36, 'bull_rsi_ob': 89, 'bull_adx_thresh': 15.96675452274106, 'bull_atr_min_pct': 0.001762168188514405, 'bull_atr_max_pct': 0.05118282011055723, 'bull_tp_mult': 1.627665566474867, 'bull_tsl_mult': 0.33290505082770894, 'bull_time_stop': 6, 'bull_use_sma': False, 'bull_use_ema': False, 'bull_use_atr': True, 'bull_use_adx': True, 'bull_use_spike': False, 'bull_rsi_required': False, 'bear_strategy': 'breakout', 'bear_bb_std_mult': 0.9800984996608548, 'bear_rsi_os': 47, 'bear_rsi_ob': 59, 'bear_adx_thresh': 13.56189948118745, 'bear_atr_min_pct': 0.02996655165072081, 'bear_atr_max_pct': 0.14737035352597558, 'bear_tp_mult': 1.07218037745707, 'bear_tsl_mult': 0.1655344727395098, 'bear_time_stop': 198, 'bear_use_sma': True, 'bear_use_ema': False, 'bear_use_atr': True, 'bear_use_adx': True, 'bear_use_spike': False, 'bear_rsi_required': False, 'sideways_strategy': 'mean_reversion', 'sideways_bb_std_mult': 2.665867858147794, 'sideways_rsi_os': 7, 'sideways_rsi_ob': 49, 'sideways_adx_thresh': 17.57779907058473, 'sideways_atr_min_pct': 0.023003961667047077, 'sideways_atr_max_pct': 0.0719131564795798, 'sideways_tp_mult': 1.4908470858465104, 'sideways_tsl_mult': 0.9517753783087419, 'sideways_time_stop': 186, 'sideways_use_sma': True, 'sideways_use_ema': True, 'sideways_use_atr': True, 'sideways_use_adx': True, 'sideways_use_spike': False, 'sideways_rsi_required': False}.
[I 2025-09-01 04:45:57,670] Trial 251 finished with values: [-0.023468167070216595, 0.023251005892270474] and parameters: {'p_sma': 35, 'p_std': 12, 'p_atr': 25, 'p_adx': 20, 'rsi_period': 61, 'ema1': 24, 'ema2': 28, 'slip_atr_k': 0.19118848088175064, 'slip_spread_k': 0.3197300032296497, 'spread_hl_frac': 0.04118105275050734, 'bb_std_mult': 3.4187451270187386, 'rsi_os': 38, 'rsi_ob': 56, 'vol_spike': 0.23097252058701007, 'adx_thresh': 15.524890894706468, 'atr_min_pct': 0.024116989627323532, 'atr_max_pct': 0.12109468411548595, 'tp_mult': 1.1374983040679538, 'tsl_mult': 0.9403601028238752, 'strategy': 'breakout', 'time_stop': 22, 'use_sma': True, 'use_atr': True, 'use_adx': False, 'use_ema': True, 'use_spike': True, 'rsi_required': False, 'edge_k': 0.9695805739858425, 'edge_cap': 0.14059165196235118, 'bull_strategy': 'breakout', 'bull_bb_std_mult': 2.273638907948142, 'bull_rsi_os': 29, 'bull_rsi_ob': 52, 'bull_adx_thresh': 34.354458555955205, 'bull_atr_min_pct': 0.0008602892656254186, 'bull_atr_max_pct': 0.12086964068844658, 'bull_tp_mult': 1.291166080981659, 'bull_tsl_mult': 0.30986763159737607, 'bull_time_stop': 223, 'bull_use_sma': False, 'bull_use_ema': True, 'bull_use_atr': False, 'bull_use_adx': False, 'bull_use_spike': False, 'bull_rsi_required': True, 'bear_strategy': 'mean_reversion', 'bear_bb_std_mult': 1.2247269895142434, 'bear_rsi_os': 29, 'bear_rsi_ob': 56, 'bear_adx_thresh': 14.495254914014986, 'bear_atr_min_pct': 0.02105878294084068, 'bear_atr_max_pct': 0.10929938562174207, 'bear_tp_mult': 1.8461744113600824, 'bear_tsl_mult': 0.07901082941238431, 'bear_time_stop': 207, 'bear_use_sma': True, 'bear_use_ema': False, 'bear_use_atr': True, 'bear_use_adx': True, 'bear_use_spike': False, 'bear_rsi_required': False, 'sideways_strategy': 'breakout', 'sideways_bb_std_mult': 2.6875712775968075, 'sideways_rsi_os': 8, 'sideways_rsi_ob': 46, 'sideways_adx_thresh': 17.116316538752404, 'sideways_atr_min_pct': 0.022996385988400987, 'sideways_atr_max_pct': 0.13338702421310483, 'sideways_tp_mult': 1.2591288533064615, 'sideways_tsl_mult': 0.9669504068752636, 'sideways_time_stop': 175, 'sideways_use_sma': True, 'sideways_use_ema': False, 'sideways_use_atr': False, 'sideways_use_adx': True, 'sideways_use_spike': False, 'sideways_rsi_required': False}.
[I 2025-09-01 04:45:58,264] Trial 252 finished with values: [-1000000000.0, 1000000000.0] and parameters: {'p_sma': 55, 'p_std': 8, 'p_atr': 29, 'p_adx': 20, 'rsi_period': 61, 'ema1': 24, 'ema2': 28, 'slip_atr_k': 3.8904067546743324e-05, 'slip_spread_k': 0.4831540949530166, 'spread_hl_frac': 0.04449400520593104, 'bb_std_mult': 1.4032823669450356, 'rsi_os': 26, 'rsi_ob': 57, 'vol_spike': 0.230353707203816, 'adx_thresh': 14.498042087161496, 'atr_min_pct': 0.002320377257447208, 'atr_max_pct': 0.11199341713132115, 'tp_mult': 1.0248973607711287, 'tsl_mult': 0.9017362590534809, 'strategy': 'breakout', 'time_stop': 98, 'use_sma': True, 'use_atr': True, 'use_adx': True, 'use_ema': False, 'use_spike': True, 'rsi_required': False, 'edge_k': 1.2482937784497843, 'edge_cap': 0.763409508176811, 'bull_strategy': 'breakout', 'bull_bb_std_mult': 2.456745367579318, 'bull_rsi_os': 28, 'bull_rsi_ob': 88, 'bull_adx_thresh': 17.73636007215098, 'bull_atr_min_pct': 0.02608379524275559, 'bull_atr_max_pct': 0.04064448351282748, 'bull_tp_mult': 1.673935445859968, 'bull_tsl_mult': 0.40796335924464844, 'bull_time_stop': 29, 'bull_use_sma': True, 'bull_use_ema': True, 'bull_use_atr': False, 'bull_use_adx': False, 'bull_use_spike': False, 'bull_rsi_required': True, 'bear_strategy': 'mean_reversion', 'bear_bb_std_mult': 1.212620578537402, 'bear_rsi_os': 45, 'bear_rsi_ob': 82, 'bear_adx_thresh': 14.663872919505135, 'bear_atr_min_pct': 0.028910066684795534, 'bear_atr_max_pct': 0.14736483716668602, 'bear_tp_mult': 1.15660641632531, 'bear_tsl_mult': 0.2371512442697224, 'bear_time_stop': 206, 'bear_use_sma': False, 'bear_use_ema': True, 'bear_use_atr': True, 'bear_use_adx': True, 'bear_use_spike': False, 'bear_rsi_required': True, 'sideways_strategy': 'breakout', 'sideways_bb_std_mult': 1.4964690140727528, 'sideways_rsi_os': 30, 'sideways_rsi_ob': 46, 'sideways_adx_thresh': 29.77706920224535, 'sideways_atr_min_pct': 0.024518922747572572, 'sideways_atr_max_pct': 0.09350124034867335, 'sideways_tp_mult': 1.2533475587897058, 'sideways_tsl_mult': 0.37579697554138436, 'sideways_time_stop': 55, 'sideways_use_sma': True, 'sideways_use_ema': False, 'sideways_use_atr': False, 'sideways_use_adx': False, 'sideways_use_spike': True, 'sideways_rsi_required': True}.
[I 2025-09-01 04:45:58,837] Trial 249 finished with values: [-1000000000.0, 1000000000.0] and parameters: {'p_sma': 36, 'p_std': 50, 'p_atr': 25, 'p_adx': 19, 'rsi_period': 80, 'ema1': 30, 'ema2': 25, 'slip_atr_k': 0.000655167426780306, 'slip_spread_k': 0.4575002357565527, 'spread_hl_frac': 0.04077990499131775, 'bb_std_mult': 0.9520773111511834, 'rsi_os': 6, 'rsi_ob': 78, 'vol_spike': 0.2288171388983095, 'adx_thresh': 15.515478999810997, 'atr_min_pct': 0.0006977302332509009, 'atr_max_pct': 0.12067925909806848, 'tp_mult': 1.5431572162313165, 'tsl_mult': 0.9025965667000163, 'strategy': 'breakout', 'time_stop': 121, 'use_sma': True, 'use_atr': False, 'use_adx': False, 'use_ema': True, 'use_spike': True, 'rsi_required': False, 'edge_k': 0.5555786341780501, 'edge_cap': 0.3799549298122282, 'bull_strategy': 'mean_reversion', 'bull_bb_std_mult': 2.273189828673808, 'bull_rsi_os': 37, 'bull_rsi_ob': 89, 'bull_adx_thresh': 29.34430290528538, 'bull_atr_min_pct': 0.00154492678203773, 'bull_atr_max_pct': 0.12272817414103648, 'bull_tp_mult': 1.6277484898256493, 'bull_tsl_mult': 0.11488453275898586, 'bull_time_stop': 217, 'bull_use_sma': False, 'bull_use_ema': False, 'bull_use_atr': True, 'bull_use_adx': False, 'bull_use_spike': False, 'bull_rsi_required': False, 'bear_strategy': 'mean_reversion', 'bear_bb_std_mult': 1.9701882826267338, 'bear_rsi_os': 8, 'bear_rsi_ob': 71, 'bear_adx_thresh': 13.796010016760583, 'bear_atr_min_pct': 0.026043284081109865, 'bear_atr_max_pct': 0.1472877994821046, 'bear_tp_mult': 2.1934396900165365, 'bear_tsl_mult': 0.7552609088912894, 'bear_time_stop': 200, 'bear_use_sma': True, 'bear_use_ema': False, 'bear_use_atr': True, 'bear_use_adx': True, 'bear_use_spike': True, 'bear_rsi_required': False, 'sideways_strategy': 'mean_reversion', 'sideways_bb_std_mult': 1.4128355780926047, 'sideways_rsi_os': 30, 'sideways_rsi_ob': 87, 'sideways_adx_thresh': 17.203116912210312, 'sideways_atr_min_pct': 0.022985721626925765, 'sideways_atr_max_pct': 0.09372158156926945, 'sideways_tp_mult': 2.931264356190248, 'sideways_tsl_mult': 0.03602072726692662, 'sideways_time_stop': 87, 'sideways_use_sma': True, 'sideways_use_ema': True, 'sideways_use_atr': False, 'sideways_use_adx': True, 'sideways_use_spike': False, 'sideways_rsi_required': False}.
