[I 2025-09-01 04:23:47,318] Trial 126 finished with values: [-1000000000.0, 1000000000.0] and parameters: {'p_sma': 18, 'p_std': 42, 'p_atr': 17, 'p_adx': 20, 'rsi_period': 60, 'ema1': 30, 'ema2': 22, 'slip_atr_k': 0.09321891768972662, 'slip_spread_k': 0.35581193078475576, 'spread_hl_frac': 0.002899316369451304, 'bb_std_mult': 0.6568043692223412, 'rsi_os': 50, 'rsi_ob': 46, 'vol_spike': 0.24215447724356398, 'adx_thresh': 14.208403945675615, 'atr_min_pct': 0.014273967355539692, 'atr_max_pct': 0.14960199991476075, 'tp_mult': 2.3965628095765967, 'tsl_mult': 0.5231081356691697, 'strategy': 'breakout', 'time_stop': 47, 'use_sma': True, 'use_atr': False, 'use_adx': False, 'use_ema': True, 'use_spike': True, 'rsi_required': False, 'edge_k': 0.7007305993935553, 'edge_cap': 0.12798728826550748, 'bull_strategy': 'mean_reversion', 'bull_bb_std_mult': 3.072124648112652, 'bull_rsi_os': 29, 'bull_rsi_ob': 68, 'bull_adx_thresh': 20.61328768849405, 'bull_atr_min_pct': 0.015602084184625572, 'bull_atr_max_pct': 0.1164088066209385, 'bull_tp_mult': 1.6009335004197218, 'bull_tsl_mult': 0.6371378157932965, 'bull_time_stop': 64, 'bull_use_sma': True, 'bull_use_ema': False, 'bull_use_atr': True, 'bull_use_adx': False, 'bull_use_spike': False, 'bull_rsi_required': False, 'bear_strategy': 'mean_reversion', 'bear_bb_std_mult': 1.4338861802881393, 'bear_rsi_os': 37, 'bear_rsi_ob': 50, 'bear_adx_thresh': 30.150128628018358, 'bear_atr_min_pct': 0.029662515361063593, 'bear_atr_max_pct': 0.032308356109693376, 'bear_tp_mult': 1.0883487086584285, 'bear_tsl_mult': 0.5181888396211547, 'bear_time_stop': 41, 'bear_use_sma': True, 'bear_use_ema': False, 'bear_use_atr': True, 'bear_use_adx': True, 'bear_use_spike': False, 'bear_rsi_required': False, 'sideways_strategy': 'mean_reversion', 'sideways_bb_std_mult': 1.4873065587216556, 'sideways_rsi_os': 14, 'sideways_rsi_ob': 47, 'sideways_adx_thresh': 16.368795878681787, 'sideways_atr_min_pct': 0.01563601481759822, 'sideways_atr_max_pct': 0.07415345599641995, 'sideways_tp_mult': 2.5646301359998525, 'sideways_tsl_mult': 0.9482204297008388, 'sideways_time_stop': 163, 'sideways_use_sma': True, 'sideways_use_ema': True, 'sideways_use_atr': False, 'sideways_use_adx': False, 'sideways_use_spike': False, 'sideways_rsi_required': False}.
[I 2025-09-01 04:23:47,571] Trial 125 finished with values: [-1000000000.0, 1000000000.0] and parameters: {'p_sma': 17, 'p_std': 41, 'p_atr': 17, 'p_adx': 21, 'rsi_period': 70, 'ema1': 30, 'ema2': 21, 'slip_atr_k': 0.09579145672737747, 'slip_spread_k': 0.49883018545835645, 'spread_hl_frac': 0.0012319760139605763, 'bb_std_mult': 0.6616129349907135, 'rsi_os': 50, 'rsi_ob': 81, 'vol_spike': 0.28251441265557037, 'adx_thresh': 13.975541507828844, 'atr_min_pct': 0.014258879415065324, 'atr_max_pct': 0.10588866037826991, 'tp_mult': 2.3812652797705955, 'tsl_mult': 0.5277858531289971, 'strategy': 'breakout', 'time_stop': 48, 'use_sma': True, 'use_atr': False, 'use_adx': False, 'use_ema': True, 'use_spike': True, 'rsi_required': False, 'edge_k': 0.6498963448779373, 'edge_cap': 0.12299611312251471, 'bull_strategy': 'mean_reversion', 'bull_bb_std_mult': 3.0172093663255515, 'bull_rsi_os': 29, 'bull_rsi_ob': 69, 'bull_adx_thresh': 20.39115978720519, 'bull_atr_min_pct': 0.016982298959858266, 'bull_atr_max_pct': 0.11108581453796634, 'bull_tp_mult': 1.6045944937839691, 'bull_tsl_mult': 0.6425706504164288, 'bull_time_stop': 176, 'bull_use_sma': True, 'bull_use_ema': False, 'bull_use_atr': True, 'bull_use_adx': False, 'bull_use_spike': False, 'bull_rsi_required': False, 'bear_strategy': 'mean_reversion', 'bear_bb_std_mult': 1.3461998483910564, 'bear_rsi_os': 37, 'bear_rsi_ob': 50, 'bear_adx_thresh': 22.447649855419133, 'bear_atr_min_pct': 0.029808032511339712, 'bear_atr_max_pct': 0.13911046063611365, 'bear_tp_mult': 1.2183201390322775, 'bear_tsl_mult': 0.40873284368476975, 'bear_time_stop': 70, 'bear_use_sma': True, 'bear_use_ema': False, 'bear_use_atr': True, 'bear_use_adx': True, 'bear_use_spike': False, 'bear_rsi_required': False, 'sideways_strategy': 'mean_reversion', 'sideways_bb_std_mult': 1.5395139620350973, 'sideways_rsi_os': 12, 'sideways_rsi_ob': 46, 'sideways_adx_thresh': 16.33264783465054, 'sideways_atr_min_pct': 0.029877145378201422, 'sideways_atr_max_pct': 0.05410233230729165, 'sideways_tp_mult': 2.5274328020714787, 'sideways_tsl_mult': 0.9711654668577191, 'sideways_time_stop': 180, 'sideways_use_sma': True, 'sideways_use_ema': True, 'sideways_use_atr': False, 'sideways_use_adx': False, 'sideways_use_spike': False, 'sideways_rsi_required': False}.
[I 2025-09-01 04:23:47,821] Trial 128 finished with values: [-0.023677944094326997, 0.023584451982175854] and parameters: {'p_sma': 18, 'p_std': 42, 'p_atr': 17, 'p_adx': 16, 'rsi_period': 70, 'ema1': 30, 'ema2': 23, 'slip_atr_k': 0.07942014628892416, 'slip_spread_k': 0.3489523084796359, 'spread_hl_frac': 0.0013845438936685344, 'bb_std_mult': 0.7409262764722678, 'rsi_os': 49, 'rsi_ob': 47, 'vol_spike': 0.2806739146444948, 'adx_thresh': 15.546301951993424, 'atr_min_pct': 0.01604625364592118, 'atr_max_pct': 0.10550086474320992, 'tp_mult': 2.539777662041876, 'tsl_mult': 0.971886010568391, 'strategy': 'breakout', 'time_stop': 7, 'use_sma': True, 'use_atr': False, 'use_adx': False, 'use_ema': True, 'use_spike': True, 'rsi_required': False, 'edge_k': 0.6259835926794639, 'edge_cap': 0.12432698806022993, 'bull_strategy': 'mean_reversion', 'bull_bb_std_mult': 2.9628418517637347, 'bull_rsi_os': 27, 'bull_rsi_ob': 76, 'bull_adx_thresh': 20.227956973241998, 'bull_atr_min_pct': 0.015547700491453448, 'bull_atr_max_pct': 0.13025613956183196, 'bull_tp_mult': 1.732132770685063, 'bull_tsl_mult': 0.6655899839190876, 'bull_time_stop': 231, 'bull_use_sma': True, 'bull_use_ema': False, 'bull_use_atr': True, 'bull_use_adx': False, 'bull_use_spike': False, 'bull_rsi_required': False, 'bear_strategy': 'mean_reversion', 'bear_bb_std_mult': 1.461590080458862, 'bear_rsi_os': 17, 'bear_rsi_ob': 50, 'bear_adx_thresh': 22.41473040315007, 'bear_atr_min_pct': 0.02941964942157942, 'bear_atr_max_pct': 0.13997496763695516, 'bear_tp_mult': 1.0709287807496768, 'bear_tsl_mult': 0.41062896445380404, 'bear_time_stop': 216, 'bear_use_sma': True, 'bear_use_ema': False, 'bear_use_atr': True, 'bear_use_adx': True, 'bear_use_spike': False, 'bear_rsi_required': False, 'sideways_strategy': 'mean_reversion', 'sideways_bb_std_mult': 1.493981945036091, 'sideways_rsi_os': 9, 'sideways_rsi_ob': 46, 'sideways_adx_thresh': 16.64635668242541, 'sideways_atr_min_pct': 0.0016351840440874629, 'sideways_atr_max_pct': 0.10059816403449443, 'sideways_tp_mult': 2.9753581671021143, 'sideways_tsl_mult': 0.9725038249440903, 'sideways_time_stop': 167, 'sideways_use_sma': True, 'sideways_use_ema': True, 'sideways_use_atr': False, 'sideways_use_adx': False, 'sideways_use_spike': False, 'sideways_rsi_required': False}.
[I 2025-09-01 04:24:29,122] Trial 129 finished with values: [-1000000000.0, 1000000000.0] and parameters: {'p_sma': 11, 'p_std': 38, 'p_atr': 15, 'p_adx': 15, 'rsi_period': 70, 'ema1': 30, 'ema2': 12, 'slip_atr_k': 0.08529466621946827, 'slip_spread_k': 0.2552396444974594, 'spread_hl_frac': 0.0019667365746369454, 'bb_std_mult': 0.7516593076413925, 'rsi_os': 50, 'rsi_ob': 93, 'vol_spike': 0.2787745804715977, 'adx_thresh': 15.401023780028954, 'atr_min_pct': 0.01778828555796119, 'atr_max_pct': 0.1318551120602964, 'tp_mult': 2.6571393915746704, 'tsl_mult': 0.5129086703335436, 'strategy': 'breakout', 'time_stop': 24, 'use_sma': True, 'use_atr': False, 'use_adx': False, 'use_ema': False, 'use_spike': True, 'rsi_required': True, 'edge_k': 0.5740283710623884, 'edge_cap': 0.12874332019276208, 'bull_strategy': 'mean_reversion', 'bull_bb_std_mult': 2.9739578802905444, 'bull_rsi_os': 42, 'bull_rsi_ob': 75, 'bull_adx_thresh': 34.638592658271094, 'bull_atr_min_pct': 0.015059145254657963, 'bull_atr_max_pct': 0.1303736512203456, 'bull_tp_mult': 1.5973473727093788, 'bull_tsl_mult': 0.6535264567311346, 'bull_time_stop': 175, 'bull_use_sma': True, 'bull_use_ema': False, 'bull_use_atr': False, 'bull_use_adx': True, 'bull_use_spike': True, 'bull_rsi_required': True, 'bear_strategy': 'breakout', 'bear_bb_std_mult': 2.04946475651684, 'bear_rsi_os': 17, 'bear_rsi_ob': 49, 'bear_adx_thresh': 7.38257443693832, 'bear_atr_min_pct': 0.027773256095486663, 'bear_atr_max_pct': 0.11457229491785548, 'bear_tp_mult': 1.0610569650492494, 'bear_tsl_mult': 0.5655725713851376, 'bear_time_stop': 42, 'bear_use_sma': False, 'bear_use_ema': False, 'bear_use_atr': True, 'bear_use_adx': False, 'bear_use_spike': False, 'bear_rsi_required': False, 'sideways_strategy': 'breakout', 'sideways_bb_std_mult': 1.7914732648573914, 'sideways_rsi_os': 9, 'sideways_rsi_ob': 46, 'sideways_adx_thresh': 16.795826605907713, 'sideways_atr_min_pct': 0.029909745078387413, 'sideways_atr_max_pct': 0.07245150006030969, 'sideways_tp_mult': 2.75849185318176, 'sideways_tsl_mult': 0.9497533077754616, 'sideways_time_stop': 159, 'sideways_use_sma': True, 'sideways_use_ema': False, 'sideways_use_atr': True, 'sideways_use_adx': False, 'sideways_use_spike': False, 'sideways_rsi_required': False}.
[I 2025-09-01 04:24:30,877] Trial 130 finished with values: [-1000000000.0, 1000000000.0] and parameters: {'p_sma': 13, 'p_std': 38, 'p_atr': 15, 'p_adx': 18, 'rsi_period': 71, 'ema1': 28, 'ema2': 13, 'slip_atr_k': 0.08581943244634299, 'slip_spread_k': 0.44427336570843845, 'spread_hl_frac': 0.0051751658356750194, 'bb_std_mult': 0.7318108720913752, 'rsi_os': 7, 'rsi_ob': 92, 'vol_spike': 0.27983363591026267, 'adx_thresh': 15.221378746293114, 'atr_min_pct': 0.018728861567446235, 'atr_max_pct': 0.13664910117669432, 'tp_mult': 2.7143966234191, 'tsl_mult': 0.6140538640027178, 'strategy': 'mean_reversion', 'time_stop': 63, 'use_sma': False, 'use_atr': False, 'use_adx': False, 'use_ema': False, 'use_spike': False, 'rsi_required': True, 'edge_k': 0.5447786890229935, 'edge_cap': 0.2686705880414254, 'bull_strategy': 'mean_reversion', 'bull_bb_std_mult': 2.1022093158572615, 'bull_rsi_os': 42, 'bull_rsi_ob': 76, 'bull_adx_thresh': 22.67679937855859, 'bull_atr_min_pct': 0.014883057982544775, 'bull_atr_max_pct': 0.13066707791670734, 'bull_tp_mult': 1.558041426325564, 'bull_tsl_mult': 0.6656114279002061, 'bull_time_stop': 207, 'bull_use_sma': True, 'bull_use_ema': True, 'bull_use_atr': False, 'bull_use_adx': True, 'bull_use_spike': True, 'bull_rsi_required': True, 'bear_strategy': 'breakout', 'bear_bb_std_mult': 2.0843250733438743, 'bear_rsi_os': 17, 'bear_rsi_ob': 92, 'bear_adx_thresh': 23.344599775511558, 'bear_atr_min_pct': 0.02744637656124431, 'bear_atr_max_pct': 0.08809640088707558, 'bear_tp_mult': 2.992342214852006, 'bear_tsl_mult': 0.5702061043179812, 'bear_time_stop': 131, 'bear_use_sma': False, 'bear_use_ema': True, 'bear_use_atr': False, 'bear_use_adx': False, 'bear_use_spike': True, 'bear_rsi_required': True, 'sideways_strategy': 'breakout', 'sideways_bb_std_mult': 1.798891886879114, 'sideways_rsi_os': 10, 'sideways_rsi_ob': 50, 'sideways_adx_thresh': 17.326996050994808, 'sideways_atr_min_pct': 0.002043717501636736, 'sideways_atr_max_pct': 0.07775810413650326, 'sideways_tp_mult': 2.7373783725569667, 'sideways_tsl_mult': 0.9219654259607839, 'sideways_time_stop': 159, 'sideways_use_sma': True, 'sideways_use_ema': False, 'sideways_use_atr': True, 'sideways_use_adx': False, 'sideways_use_spike': True, 'sideways_rsi_required': False}.
[I 2025-09-01 04:24:31,469] Trial 131 finished with values: [-1000000000.0, 1000000000.0] and parameters: {'p_sma': 21, 'p_std': 44, 'p_atr': 15, 'p_adx': 18, 'rsi_period': 47, 'ema1': 27, 'ema2': 24, 'slip_atr_k': 0.20977758919583744, 'slip_spread_k': 0.19072500632541384, 'spread_hl_frac': 0.0007929529130260154, 'bb_std_mult': 0.8775073697862776, 'rsi_os': 54, 'rsi_ob': 48, 'vol_spike': 0.29368382015343175, 'adx_thresh': 15.338590615940692, 'atr_min_pct': 0.015584136701765118, 'atr_max_pct': 0.09677522582296778, 'tp_mult': 2.631477750031933, 'tsl_mult': 0.970533263269221, 'strategy': 'breakout', 'time_stop': 6, 'use_sma': True, 'use_atr': False, 'use_adx': False, 'use_ema': True, 'use_spike': True, 'rsi_required': False, 'edge_k': 0.431615823916856, 'edge_cap': 0.11531096251040124, 'bull_strategy': 'mean_reversion', 'bull_bb_std_mult': 3.1868623958579625, 'bull_rsi_os': 27, 'bull_rsi_ob': 77, 'bull_adx_thresh': 21.39095964245734, 'bull_atr_min_pct': 0.021882298704268277, 'bull_atr_max_pct': 0.13049650863463144, 'bull_tp_mult': 1.7469633741288597, 'bull_tsl_mult': 0.5648873563882871, 'bull_time_stop': 208, 'bull_use_sma': True, 'bull_use_ema': False, 'bull_use_atr': False, 'bull_use_adx': False, 'bull_use_spike': False, 'bull_rsi_required': True, 'bear_strategy': 'mean_reversion', 'bear_bb_std_mult': 1.5178242888808036, 'bear_rsi_os': 18, 'bear_rsi_ob': 54, 'bear_adx_thresh': 23.259248346119524, 'bear_atr_min_pct': 0.027508396951842196, 'bear_atr_max_pct': 0.13971885360884134, 'bear_tp_mult': 1.0499671471243415, 'bear_tsl_mult': 0.3460496811635542, 'bear_time_stop': 218, 'bear_use_sma': False, 'bear_use_ema': False, 'bear_use_atr': True, 'bear_use_adx': False, 'bear_use_spike': False, 'bear_rsi_required': False, 'sideways_strategy': 'breakout', 'sideways_bb_std_mult': 1.3673204517654307, 'sideways_rsi_os': 9, 'sideways_rsi_ob': 46, 'sideways_adx_thresh': 15.283543938907256, 'sideways_atr_min_pct': 0.004751505185654266, 'sideways_atr_max_pct': 0.1011291334750504, 'sideways_tp_mult': 2.9886844062510725, 'sideways_tsl_mult': 0.922928631794996, 'sideways_time_stop': 154, 'sideways_use_sma': True, 'sideways_use_ema': True, 'sideways_use_atr': False, 'sideways_use_adx': False, 'sideways_use_spike': True, 'sideways_rsi_required': False}.
[I 2025-09-01 04:24:31,479] Trial 132 finished with values: [-1000000000.0, 1000000000.0] and parameters: {'p_sma': 21, 'p_std': 44, 'p_atr': 15, 'p_adx': 18, 'rsi_period': 47, 'ema1': 27, 'ema2': 24, 'slip_atr_k': 0.04497912738874729, 'slip_spread_k': 0.27850097260977535, 'spread_hl_frac': 0.0007650270332339939, 'bb_std_mult': 0.7554318835326572, 'rsi_os': 51, 'rsi_ob': 60, 'vol_spike': 0.2943662988219756, 'adx_thresh': 14.790072490340329, 'atr_min_pct': 0.014916869953251973, 'atr_max_pct': 0.10195950889690948, 'tp_mult': 2.6470499514105286, 'tsl_mult': 0.9724970726823272, 'strategy': 'breakout', 'time_stop': 5, 'use_sma': True, 'use_atr': False, 'use_adx': False, 'use_ema': True, 'use_spike': True, 'rsi_required': False, 'edge_k': 0.41994455312770795, 'edge_cap': 0.11921821359186603, 'bull_strategy': 'mean_reversion', 'bull_bb_std_mult': 3.189907212589218, 'bull_rsi_os': 27, 'bull_rsi_ob': 77, 'bull_adx_thresh': 21.2472782829926, 'bull_atr_min_pct': 0.02148517316494715, 'bull_atr_max_pct': 0.13283868616345834, 'bull_tp_mult': 1.7595770268324584, 'bull_tsl_mult': 0.5642446715884951, 'bull_time_stop': 206, 'bull_use_sma': True, 'bull_use_ema': False, 'bull_use_atr': False, 'bull_use_adx': False, 'bull_use_spike': False, 'bull_rsi_required': True, 'bear_strategy': 'mean_reversion', 'bear_bb_std_mult': 1.5071404540135427, 'bear_rsi_os': 17, 'bear_rsi_ob': 58, 'bear_adx_thresh': 24.107604443353644, 'bear_atr_min_pct': 0.027790782678368327, 'bear_atr_max_pct': 0.14156344883201147, 'bear_tp_mult': 1.1550581253452137, 'bear_tsl_mult': 0.371586501905967, 'bear_time_stop': 218, 'bear_use_sma': False, 'bear_use_ema': False, 'bear_use_atr': True, 'bear_use_adx': False, 'bear_use_spike': False, 'bear_rsi_required': False, 'sideways_strategy': 'breakout', 'sideways_bb_std_mult': 1.3986846085511928, 'sideways_rsi_os': 8, 'sideways_rsi_ob': 46, 'sideways_adx_thresh': 13.480501141262772, 'sideways_atr_min_pct': 0.020051162436924303, 'sideways_atr_max_pct': 0.1003564795183159, 'sideways_tp_mult': 2.9877164007669905, 'sideways_tsl_mult': 0.9290100768232692, 'sideways_time_stop': 153, 'sideways_use_sma': True, 'sideways_use_ema': True, 'sideways_use_atr': False, 'sideways_use_adx': False, 'sideways_use_spike': True, 'sideways_rsi_required': False}.
[I 2025-09-01 04:24:31,881] Trial 134 finished with values: [-1000000000.0, 1000000000.0] and parameters: {'p_sma': 17, 'p_std': 47, 'p_atr': 16, 'p_adx': 16, 'rsi_period': 79, 'ema1': 29, 'ema2': 22, 'slip_atr_k': 0.1751796687695348, 'slip_spread_k': 0.16962897414575906, 'spread_hl_frac': 0.00037298971530340484, 'bb_std_mult': 2.2923531974857334, 'rsi_os': 49, 'rsi_ob': 45, 'vol_spike': 0.029836639018780794, 'adx_thresh': 13.166757295683901, 'atr_min_pct': 0.01319139798154704, 'atr_max_pct': 0.11112999314935651, 'tp_mult': 2.8001419047972957, 'tsl_mult': 0.997971968504979, 'strategy': 'mean_reversion', 'time_stop': 37, 'use_sma': True, 'use_atr': True, 'use_adx': False, 'use_ema': True, 'use_spike': False, 'rsi_required': False, 'edge_k': 1.3226717301895836, 'edge_cap': 0.07447769236962928, 'bull_strategy': 'breakout', 'bull_bb_std_mult': 3.4855217104016893, 'bull_rsi_os': 25, 'bull_rsi_ob': 79, 'bull_adx_thresh': 19.611178894884482, 'bull_atr_min_pct': 0.025674449270804364, 'bull_atr_max_pct': 0.13615236852019474, 'bull_tp_mult': 2.997135361198894, 'bull_tsl_mult': 0.6915247340217103, 'bull_time_stop': 100, 'bull_use_sma': True, 'bull_use_ema': True, 'bull_use_atr': True, 'bull_use_adx': False, 'bull_use_spike': False, 'bull_rsi_required': False, 'bear_strategy': 'mean_reversion', 'bear_bb_std_mult': 1.5830510008492316, 'bear_rsi_os': 15, 'bear_rsi_ob': 59, 'bear_adx_thresh': 9.341906688550202, 'bear_atr_min_pct': 0.029247423630396778, 'bear_atr_max_pct': 0.1340162801038396, 'bear_tp_mult': 1.170100616874588, 'bear_tsl_mult': 0.3615324542097126, 'bear_time_stop': 227, 'bear_use_sma': True, 'bear_use_ema': True, 'bear_use_atr': True, 'bear_use_adx': True, 'bear_use_spike': False, 'bear_rsi_required': True, 'sideways_strategy': 'mean_reversion', 'sideways_bb_std_mult': 1.1690520714453152, 'sideways_rsi_os': 5, 'sideways_rsi_ob': 45, 'sideways_adx_thresh': 14.374474126923868, 'sideways_atr_min_pct': 0.0015678183957800675, 'sideways_atr_max_pct': 0.08887070513693865, 'sideways_tp_mult': 2.9420350236874713, 'sideways_tsl_mult': 0.969263880956107, 'sideways_time_stop': 166, 'sideways_use_sma': False, 'sideways_use_ema': True, 'sideways_use_atr': False, 'sideways_use_adx': False, 'sideways_use_spike': False, 'sideways_rsi_required': False}.
[I 2025-09-01 04:24:31,892] Trial 135 finished with values: [-1000000000.0, 1000000000.0] and parameters: {'p_sma': 19, 'p_std': 46, 'p_atr': 16, 'p_adx': 16, 'rsi_period': 66, 'ema1': 29, 'ema2': 22, 'slip_atr_k': 0.14556325663134184, 'slip_spread_k': 0.22526996904341884, 'spread_hl_frac': 0.00019376020782265607, 'bb_std_mult': 0.8269818883873278, 'rsi_os': 49, 'rsi_ob': 45, 'vol_spike': 0.03350270304037245, 'adx_thresh': 13.059535086530882, 'atr_min_pct': 0.013000329624282709, 'atr_max_pct': 0.10975755408200082, 'tp_mult': 2.778607299104589, 'tsl_mult': 0.9924488158537261, 'strategy': 'mean_reversion', 'time_stop': 36, 'use_sma': True, 'use_atr': True, 'use_adx': False, 'use_ema': True, 'use_spike': False, 'rsi_required': False, 'edge_k': 0.6280524546270895, 'edge_cap': 0.14851963927158146, 'bull_strategy': 'breakout', 'bull_bb_std_mult': 3.5991468905344637, 'bull_rsi_os': 36, 'bull_rsi_ob': 80, 'bull_adx_thresh': 21.78653444937225, 'bull_atr_min_pct': 0.0056943155278876886, 'bull_atr_max_pct': 0.12423905715281569, 'bull_tp_mult': 2.832779066209787, 'bull_tsl_mult': 0.6211526366347844, 'bull_time_stop': 233, 'bull_use_sma': True, 'bull_use_ema': True, 'bull_use_atr': True, 'bull_use_adx': False, 'bull_use_spike': False, 'bull_rsi_required': False, 'bear_strategy': 'mean_reversion', 'bear_bb_std_mult': 1.350271574959591, 'bear_rsi_os': 15, 'bear_rsi_ob': 55, 'bear_adx_thresh': 25.612630792805945, 'bear_atr_min_pct': 0.029191131513920568, 'bear_atr_max_pct': 0.13404041602458547, 'bear_tp_mult': 1.1682896422529658, 'bear_tsl_mult': 0.3851918511930822, 'bear_time_stop': 227, 'bear_use_sma': True, 'bear_use_ema': True, 'bear_use_atr': True, 'bear_use_adx': True, 'bear_use_spike': False, 'bear_rsi_required': True, 'sideways_strategy': 'mean_reversion', 'sideways_bb_std_mult': 1.547921702158005, 'sideways_rsi_os': 5, 'sideways_rsi_ob': 45, 'sideways_adx_thresh': 11.086459616365438, 'sideways_atr_min_pct': 0.018521111635343396, 'sideways_atr_max_pct': 0.0873007446519732, 'sideways_tp_mult': 2.9428127799183224, 'sideways_tsl_mult': 0.5218062474412359, 'sideways_time_stop': 167, 'sideways_use_sma': False, 'sideways_use_ema': True, 'sideways_use_atr': False, 'sideways_use_adx': False, 'sideways_use_spike': False, 'sideways_rsi_required': False}.
