[I 2025-09-01 04:31:58,438] Trial 174 finished with values: [-1000000000.0, 1000000000.0] and parameters: {'p_sma': 18, 'p_std': 41, 'p_atr': 25, 'p_adx': 29, 'rsi_period': 56, 'ema1': 8, 'ema2': 28, 'slip_atr_k': 0.0002881610832951305, 'slip_spread_k': 0.2995715858583456, 'spread_hl_frac': 0.04762294136178128, 'bb_std_mult': 3.4793391454411946, 'rsi_os': 46, 'rsi_ob': 57, 'vol_spike': 0.09080545965034768, 'adx_thresh': 15.441523691381091, 'atr_min_pct': 0.0009243686665516246, 'atr_max_pct': 0.11601875544098292, 'tp_mult': 2.5822704881568934, 'tsl_mult': 0.9278727086015656, 'strategy': 'mean_reversion', 'time_stop': 31, 'use_sma': True, 'use_atr': False, 'use_adx': False, 'use_ema': True, 'use_spike': False, 'rsi_required': False, 'edge_k': 1.2966983673279016, 'edge_cap': 0.135041959551297, 'bull_strategy': 'mean_reversion', 'bull_bb_std_mult': 2.345177370810038, 'bull_rsi_os': 29, 'bull_rsi_ob': 92, 'bull_adx_thresh': 18.707858074419416, 'bull_atr_min_pct': 0.001464830158474646, 'bull_atr_max_pct': 0.12922232311371157, 'bull_tp_mult': 2.4284211547951458, 'bull_tsl_mult': 0.3113940016440056, 'bull_time_stop': 203, 'bull_use_sma': True, 'bull_use_ema': False, 'bull_use_atr': False, 'bull_use_adx': False, 'bull_use_spike': False, 'bull_rsi_required': True, 'bear_strategy': 'mean_reversion', 'bear_bb_std_mult': 2.840138612027139, 'bear_rsi_os': 51, 'bear_rsi_ob': 64, 'bear_adx_thresh': 12.775592952847157, 'bear_atr_min_pct': 0.02957724218801015, 'bear_atr_max_pct': 0.021893390573495375, 'bear_tp_mult': 1.0467920069965249, 'bear_tsl_mult': 0.11539704980382273, 'bear_time_stop': 182, 'bear_use_sma': True, 'bear_use_ema': False, 'bear_use_atr': True, 'bear_use_adx': False, 'bear_use_spike': False, 'bear_rsi_required': True, 'sideways_strategy': 'mean_reversion', 'sideways_bb_std_mult': 1.6029939023291022, 'sideways_rsi_os': 39, 'sideways_rsi_ob': 47, 'sideways_adx_thresh': 28.539131398820505, 'sideways_atr_min_pct': 0.02318589619019913, 'sideways_atr_max_pct': 0.08630388812787579, 'sideways_tp_mult': 1.1814361973594605, 'sideways_tsl_mult': 0.9730604360236202, 'sideways_time_stop': 192, 'sideways_use_sma': True, 'sideways_use_ema': False, 'sideways_use_atr': False, 'sideways_use_adx': False, 'sideways_use_spike': False, 'sideways_rsi_required': False}.
[I 2025-09-01 04:31:59,102] Trial 173 finished with values: [-1000000000.0, 1000000000.0] and parameters: {'p_sma': 14, 'p_std': 48, 'p_atr': 27, 'p_adx': 18, 'rsi_period': 56, 'ema1': 8, 'ema2': 28, 'slip_atr_k': 0.02441450184756852, 'slip_spread_k': 0.2778699962829419, 'spread_hl_frac': 0.048020770412836644, 'bb_std_mult': 3.497722750062158, 'rsi_os': 43, 'rsi_ob': 57, 'vol_spike': 0.09103082013892996, 'adx_thresh': 12.416044053749271, 'atr_min_pct': 0.0021612832495467938, 'atr_max_pct': 0.1276054501708966, 'tp_mult': 2.4075853745685585, 'tsl_mult': 0.8088030019451354, 'strategy': 'breakout', 'time_stop': 241, 'use_sma': True, 'use_atr': False, 'use_adx': False, 'use_ema': True, 'use_spike': False, 'rsi_required': False, 'edge_k': 1.928068068172921, 'edge_cap': 0.138231530151396, 'bull_strategy': 'mean_reversion', 'bull_bb_std_mult': 2.2286353779197707, 'bull_rsi_os': 29, 'bull_rsi_ob': 93, 'bull_adx_thresh': 19.985623491910445, 'bull_atr_min_pct': 0.004313002243339867, 'bull_atr_max_pct': 0.02925319480722685, 'bull_tp_mult': 1.6235496408738075, 'bull_tsl_mult': 0.3209041406062777, 'bull_time_stop': 205, 'bull_use_sma': True, 'bull_use_ema': False, 'bull_use_atr': True, 'bull_use_adx': False, 'bull_use_spike': False, 'bull_rsi_required': False, 'bear_strategy': 'mean_reversion', 'bear_bb_std_mult': 1.2381153996961536, 'bear_rsi_os': 52, 'bear_rsi_ob': 54, 'bear_adx_thresh': 12.919396169659247, 'bear_atr_min_pct': 0.0207538814782832, 'bear_atr_max_pct': 0.14930477614599924, 'bear_tp_mult': 2.642097840720015, 'bear_tsl_mult': 0.12729540194973385, 'bear_time_stop': 218, 'bear_use_sma': True, 'bear_use_ema': False, 'bear_use_atr': True, 'bear_use_adx': False, 'bear_use_spike': False, 'bear_rsi_required': True, 'sideways_strategy': 'mean_reversion', 'sideways_bb_std_mult': 1.5067017876202713, 'sideways_rsi_os': 53, 'sideways_rsi_ob': 84, 'sideways_adx_thresh': 28.578227534588066, 'sideways_atr_min_pct': 0.023204753135541642, 'sideways_atr_max_pct': 0.08296357857049097, 'sideways_tp_mult': 1.0173829665945746, 'sideways_tsl_mult': 0.9725226343331262, 'sideways_time_stop': 245, 'sideways_use_sma': True, 'sideways_use_ema': False, 'sideways_use_atr': False, 'sideways_use_adx': False, 'sideways_use_spike': False, 'sideways_rsi_required': False}.
[I 2025-09-01 04:31:59,824] Trial 172 finished with values: [-1000000000.0, 1000000000.0] and parameters: {'p_sma': 12, 'p_std': 42, 'p_atr': 27, 'p_adx': 18, 'rsi_period': 66, 'ema1': 8, 'ema2': 28, 'slip_atr_k': 0.024235734606135827, 'slip_spread_k': 0.2708016217936664, 'spread_hl_frac': 0.04720680450535799, 'bb_std_mult': 0.8931935817100967, 'rsi_os': 45, 'rsi_ob': 54, 'vol_spike': 0.2626186279922859, 'adx_thresh': 12.273749161324176, 'atr_min_pct': 0.003825159781670181, 'atr_max_pct': 0.1273828979153015, 'tp_mult': 2.4261302311313666, 'tsl_mult': 0.922092199549361, 'strategy': 'breakout', 'time_stop': 263, 'use_sma': True, 'use_atr': False, 'use_adx': False, 'use_ema': True, 'use_spike': False, 'rsi_required': False, 'edge_k': 0.44774868571403525, 'edge_cap': 0.1379436383195921, 'bull_strategy': 'mean_reversion', 'bull_bb_std_mult': 2.523748753911727, 'bull_rsi_os': 29, 'bull_rsi_ob': 92, 'bull_adx_thresh': 20.391523815239, 'bull_atr_min_pct': 0.0008511596470740081, 'bull_atr_max_pct': 0.13038663724679758, 'bull_tp_mult': 2.382412253543486, 'bull_tsl_mult': 0.35071630495629647, 'bull_time_stop': 31, 'bull_use_sma': True, 'bull_use_ema': False, 'bull_use_atr': True, 'bull_use_adx': False, 'bull_use_spike': False, 'bull_rsi_required': False, 'bear_strategy': 'mean_reversion', 'bear_bb_std_mult': 1.242303038278488, 'bear_rsi_os': 27, 'bear_rsi_ob': 64, 'bear_adx_thresh': 12.830540248140883, 'bear_atr_min_pct': 0.020325985940756797, 'bear_atr_max_pct': 0.020143578239643717, 'bear_tp_mult': 2.64917351239964, 'bear_tsl_mult': 0.12433227403379626, 'bear_time_stop': 184, 'bear_use_sma': False, 'bear_use_ema': False, 'bear_use_atr': True, 'bear_use_adx': False, 'bear_use_spike': False, 'bear_rsi_required': False, 'sideways_strategy': 'breakout', 'sideways_bb_std_mult': 1.623342195188509, 'sideways_rsi_os': 52, 'sideways_rsi_ob': 47, 'sideways_adx_thresh': 12.62309638452803, 'sideways_atr_min_pct': 0.02335152441760597, 'sideways_atr_max_pct': 0.07690125421842707, 'sideways_tp_mult': 2.7691045485741435, 'sideways_tsl_mult': 0.004731843161379423, 'sideways_time_stop': 184, 'sideways_use_sma': True, 'sideways_use_ema': True, 'sideways_use_atr': False, 'sideways_use_adx': False, 'sideways_use_spike': True, 'sideways_rsi_required': False}.
[I 2025-09-01 04:32:00,205] Trial 171 finished with values: [-1000000000.0, 1000000000.0] and parameters: {'p_sma': 18, 'p_std': 41, 'p_atr': 27, 'p_adx': 18, 'rsi_period': 57, 'ema1': 8, 'ema2': 28, 'slip_atr_k': 0.02061111894884428, 'slip_spread_k': 0.2719053414906726, 'spread_hl_frac': 0.04743380853587142, 'bb_std_mult': 2.1359123611301456, 'rsi_os': 45, 'rsi_ob': 54, 'vol_spike': 0.2647298929441956, 'adx_thresh': 27.64566930490164, 'atr_min_pct': 0.0006405913100926383, 'atr_max_pct': 0.11598699193035328, 'tp_mult': 2.440915929640661, 'tsl_mult': 0.6856043788284576, 'strategy': 'breakout', 'time_stop': 27, 'use_sma': True, 'use_atr': False, 'use_adx': False, 'use_ema': True, 'use_spike': False, 'rsi_required': False, 'edge_k': 0.6317298768196344, 'edge_cap': 0.14192646012438534, 'bull_strategy': 'mean_reversion', 'bull_bb_std_mult': 2.338335885241501, 'bull_rsi_os': 29, 'bull_rsi_ob': 90, 'bull_adx_thresh': 20.15007506171991, 'bull_atr_min_pct': 0.004546345455748944, 'bull_atr_max_pct': 0.02977573863372654, 'bull_tp_mult': 1.6926180912901438, 'bull_tsl_mult': 0.35979346531609696, 'bull_time_stop': 40, 'bull_use_sma': True, 'bull_use_ema': False, 'bull_use_atr': True, 'bull_use_adx': False, 'bull_use_spike': False, 'bull_rsi_required': False, 'bear_strategy': 'mean_reversion', 'bear_bb_std_mult': 1.2275966131220992, 'bear_rsi_os': 51, 'bear_rsi_ob': 53, 'bear_adx_thresh': 12.680929501493301, 'bear_atr_min_pct': 0.028122636664149644, 'bear_atr_max_pct': 0.14532829849413098, 'bear_tp_mult': 2.6635850802792294, 'bear_tsl_mult': 0.12505074735990543, 'bear_time_stop': 298, 'bear_use_sma': False, 'bear_use_ema': False, 'bear_use_atr': True, 'bear_use_adx': False, 'bear_use_spike': False, 'bear_rsi_required': False, 'sideways_strategy': 'breakout', 'sideways_bb_std_mult': 1.6055479806553334, 'sideways_rsi_os': 10, 'sideways_rsi_ob': 47, 'sideways_adx_thresh': 17.955748270428902, 'sideways_atr_min_pct': 0.025084199836358838, 'sideways_atr_max_pct': 0.09598718386872186, 'sideways_tp_mult': 2.7569772006817126, 'sideways_tsl_mult': 0.978154750111009, 'sideways_time_stop': 191, 'sideways_use_sma': True, 'sideways_use_ema': True, 'sideways_use_atr': False, 'sideways_use_adx': False, 'sideways_use_spike': True, 'sideways_rsi_required': False}.
[I 2025-09-01 04:32:45,368] Trial 175 finished with values: [-1000000000.0, 1000000000.0] and parameters: {'p_sma': 14, 'p_std': 42, 'p_atr': 27, 'p_adx': 19, 'rsi_period': 67, 'ema1': 30, 'ema2': 53, 'slip_atr_k': 0.023872025445992973, 'slip_spread_k': 0.7085509881369066, 'spread_hl_frac': 0.032568569303073946, 'bb_std_mult': 2.76405094317329, 'rsi_os': 43, 'rsi_ob': 59, 'vol_spike': 0.26349568419008, 'adx_thresh': 17.71799592634388, 'atr_min_pct': 0.0040597237207416585, 'atr_max_pct': 0.010298187537729361, 'tp_mult': 2.382394391267711, 'tsl_mult': 0.8966410649709448, 'strategy': 'breakout', 'time_stop': 239, 'use_sma': True, 'use_atr': False, 'use_adx': False, 'use_ema': True, 'use_spike': False, 'rsi_required': False, 'edge_k': 1.920934401916051, 'edge_cap': 0.15275868343020713, 'bull_strategy': 'mean_reversion', 'bull_bb_std_mult': 2.2508961231559095, 'bull_rsi_os': 25, 'bull_rsi_ob': 90, 'bull_adx_thresh': 20.184975279318365, 'bull_atr_min_pct': 0.000593048321062252, 'bull_atr_max_pct': 0.12477693029527782, 'bull_tp_mult': 1.3438572954504195, 'bull_tsl_mult': 0.3421397434390228, 'bull_time_stop': 208, 'bull_use_sma': True, 'bull_use_ema': True, 'bull_use_atr': True, 'bull_use_adx': False, 'bull_use_spike': False, 'bull_rsi_required': False, 'bear_strategy': 'mean_reversion', 'bear_bb_std_mult': 2.4815427799100718, 'bear_rsi_os': 27, 'bear_rsi_ob': 56, 'bear_adx_thresh': 16.38671022347964, 'bear_atr_min_pct': 0.029474461072390944, 'bear_atr_max_pct': 0.14918213787693893, 'bear_tp_mult': 2.6510507360833997, 'bear_tsl_mult': 0.14542521952374354, 'bear_time_stop': 295, 'bear_use_sma': True, 'bear_use_ema': False, 'bear_use_atr': True, 'bear_use_adx': True, 'bear_use_spike': False, 'bear_rsi_required': False, 'sideways_strategy': 'mean_reversion', 'sideways_bb_std_mult': 2.188400596052572, 'sideways_rsi_os': 7, 'sideways_rsi_ob': 49, 'sideways_adx_thresh': 30.372977608337298, 'sideways_atr_min_pct': 0.024769164160178367, 'sideways_atr_max_pct': 0.0808022071282323, 'sideways_tp_mult': 1.0351743269915725, 'sideways_tsl_mult': 0.977536981785173, 'sideways_time_stop': 248, 'sideways_use_sma': True, 'sideways_use_ema': True, 'sideways_use_atr': False, 'sideways_use_adx': False, 'sideways_use_spike': False, 'sideways_rsi_required': False}.
[I 2025-09-01 04:32:46,301] Trial 178 finished with values: [-1000000000.0, 1000000000.0] and parameters: {'p_sma': 22, 'p_std': 24, 'p_atr': 25, 'p_adx': 19, 'rsi_period': 62, 'ema1': 15, 'ema2': 30, 'slip_atr_k': 0.011886509322727144, 'slip_spread_k': 0.3389930560289482, 'spread_hl_frac': 0.028249633170251042, 'bb_std_mult': 1.6968010955713835, 'rsi_os': 26, 'rsi_ob': 52, 'vol_spike': 0.22949768887748365, 'adx_thresh': 17.751676101651455, 'atr_min_pct': 0.001698596939868009, 'atr_max_pct': 0.1227737722220501, 'tp_mult': 2.5423766331891433, 'tsl_mult': 0.7475842259324547, 'strategy': 'mean_reversion', 'time_stop': 26, 'use_sma': True, 'use_atr': False, 'use_adx': False, 'use_ema': True, 'use_spike': True, 'rsi_required': False, 'edge_k': 0.5493155853218383, 'edge_cap': 0.1609344874828037, 'bull_strategy': 'mean_reversion', 'bull_bb_std_mult': 2.258319092600411, 'bull_rsi_os': 25, 'bull_rsi_ob': 90, 'bull_adx_thresh': 27.931948768214856, 'bull_atr_min_pct': 0.0015717864333853757, 'bull_atr_max_pct': 0.03609460654782363, 'bull_tp_mult': 1.3526083726549243, 'bull_tsl_mult': 0.39249660331917396, 'bull_time_stop': 212, 'bull_use_sma': True, 'bull_use_ema': True, 'bull_use_atr': False, 'bull_use_adx': False, 'bull_use_spike': False, 'bull_rsi_required': True, 'bear_strategy': 'mean_reversion', 'bear_bb_std_mult': 2.4707193349935515, 'bear_rsi_os': 31, 'bear_rsi_ob': 56, 'bear_adx_thresh': 15.444378225596143, 'bear_atr_min_pct': 0.029356930702981374, 'bear_atr_max_pct': 0.147981085337231, 'bear_tp_mult': 1.1256481243789729, 'bear_tsl_mult': 0.15298688288354179, 'bear_time_stop': 288, 'bear_use_sma': True, 'bear_use_ema': False, 'bear_use_atr': True, 'bear_use_adx': True, 'bear_use_spike': False, 'bear_rsi_required': False, 'sideways_strategy': 'mean_reversion', 'sideways_bb_std_mult': 2.412513151165477, 'sideways_rsi_os': 44, 'sideways_rsi_ob': 94, 'sideways_adx_thresh': 15.963611897011935, 'sideways_atr_min_pct': 0.022472724962487537, 'sideways_atr_max_pct': 0.015074148293616904, 'sideways_tp_mult': 2.8090796093079593, 'sideways_tsl_mult': 0.12145752024929646, 'sideways_time_stop': 258, 'sideways_use_sma': True, 'sideways_use_ema': True, 'sideways_use_atr': False, 'sideways_use_adx': False, 'sideways_use_spike': False, 'sideways_rsi_required': False}.
[I 2025-09-01 04:32:46,722] Trial 177 finished with values: [-1000000000.0, 1000000000.0] and parameters: {'p_sma': 23, 'p_std': 44, 'p_atr': 28, 'p_adx': 19, 'rsi_period': 62, 'ema1': 13, 'ema2': 52, 'slip_atr_k': 0.019493990338934036, 'slip_spread_k': 0.3448703933780153, 'spread_hl_frac': 0.04322392142772732, 'bb_std_mult': 1.724457137428201, 'rsi_os': 33, 'rsi_ob': 59, 'vol_spike': 0.24725885550733834, 'adx_thresh': 33.33554389405909, 'atr_min_pct': 0.00018821301648374894, 'atr_max_pct': 0.14528940047572073, 'tp_mult': 2.626330132357088, 'tsl_mult': 0.7462486521007947, 'strategy': 'breakout', 'time_stop': 27, 'use_sma': True, 'use_atr': False, 'use_adx': False, 'use_ema': True, 'use_spike': True, 'rsi_required': False, 'edge_k': 0.5560663888130002, 'edge_cap': 0.053986750633749414, 'bull_strategy': 'mean_reversion', 'bull_bb_std_mult': 2.2612071236199327, 'bull_rsi_os': 25, 'bull_rsi_ob': 90, 'bull_adx_thresh': 28.541160049238492, 'bull_atr_min_pct': 0.0004477344919129958, 'bull_atr_max_pct': 0.13329300309040712, 'bull_tp_mult': 1.7097252757488857, 'bull_tsl_mult': 0.39586052075121175, 'bull_time_stop': 284, 'bull_use_sma': True, 'bull_use_ema': True, 'bull_use_atr': False, 'bull_use_adx': False, 'bull_use_spike': False, 'bull_rsi_required': True, 'bear_strategy': 'mean_reversion', 'bear_bb_std_mult': 2.7259971381970134, 'bear_rsi_os': 38, 'bear_rsi_ob': 84, 'bear_adx_thresh': 15.190088375779645, 'bear_atr_min_pct': 0.02936951738476753, 'bear_atr_max_pct': 0.14969040591264998, 'bear_tp_mult': 1.1327317210176917, 'bear_tsl_mult': 0.15098679926779854, 'bear_time_stop': 288, 'bear_use_sma': True, 'bear_use_ema': False, 'bear_use_atr': True, 'bear_use_adx': True, 'bear_use_spike': False, 'bear_rsi_required': False, 'sideways_strategy': 'mean_reversion', 'sideways_bb_std_mult': 1.862023717485136, 'sideways_rsi_os': 7, 'sideways_rsi_ob': 49, 'sideways_adx_thresh': 17.85303652056531, 'sideways_atr_min_pct': 0.025118238085339552, 'sideways_atr_max_pct': 0.09916317645431266, 'sideways_tp_mult': 2.840604946996328, 'sideways_tsl_mult': 0.9150281074689571, 'sideways_time_stop': 189, 'sideways_use_sma': True, 'sideways_use_ema': True, 'sideways_use_atr': False, 'sideways_use_adx': False, 'sideways_use_spike': False, 'sideways_rsi_required': False}.
[I 2025-09-01 04:32:47,106] Trial 176 finished with values: [-1000000000.0, 1000000000.0] and parameters: {'p_sma': 12, 'p_std': 60, 'p_atr': 25, 'p_adx': 19, 'rsi_period': 63, 'ema1': 15, 'ema2': 55, 'slip_atr_k': 0.02012153798240479, 'slip_spread_k': 0.40500060085332756, 'spread_hl_frac': 0.034635874268804, 'bb_std_mult': 3.0000605612669724, 'rsi_os': 45, 'rsi_ob': 79, 'vol_spike': 0.2661611569215317, 'adx_thresh': 33.3939092895314, 'atr_min_pct': 0.0011039850363701793, 'atr_max_pct': 0.116059400947708, 'tp_mult': 2.3824274225775057, 'tsl_mult': 0.7265419366515826, 'strategy': 'breakout', 'time_stop': 226, 'use_sma': True, 'use_atr': False, 'use_adx': False, 'use_ema': True, 'use_spike': True, 'rsi_required': False, 'edge_k': 0.4669582598249596, 'edge_cap': 0.1133801167107322, 'bull_strategy': 'mean_reversion', 'bull_bb_std_mult': 2.6428035931012293, 'bull_rsi_os': 25, 'bull_rsi_ob': 90, 'bull_adx_thresh': 28.53247666581816, 'bull_atr_min_pct': 5.993547595447538e-06, 'bull_atr_max_pct': 0.13367319871515426, 'bull_tp_mult': 2.384997702618013, 'bull_tsl_mult': 0.34673041601293797, 'bull_time_stop': 212, 'bull_use_sma': True, 'bull_use_ema': True, 'bull_use_atr': True, 'bull_use_adx': False, 'bull_use_spike': False, 'bull_rsi_required': False, 'bear_strategy': 'mean_reversion', 'bear_bb_std_mult': 0.8249213142944742, 'bear_rsi_os': 27, 'bear_rsi_ob': 53, 'bear_adx_thresh': 15.583393869064357, 'bear_atr_min_pct': 0.029322578626287475, 'bear_atr_max_pct': 0.1471226235859641, 'bear_tp_mult': 1.1281984353460135, 'bear_tsl_mult': 0.15203876841806951, 'bear_time_stop': 296, 'bear_use_sma': True, 'bear_use_ema': False, 'bear_use_atr': True, 'bear_use_adx': True, 'bear_use_spike': False, 'bear_rsi_required': False, 'sideways_strategy': 'mean_reversion', 'sideways_bb_std_mult': 1.8690287166474397, 'sideways_rsi_os': 43, 'sideways_rsi_ob': 68, 'sideways_adx_thresh': 33.086738162044966, 'sideways_atr_min_pct': 0.024810597259790096, 'sideways_atr_max_pct': 0.014049293697020987, 'sideways_tp_mult': 1.5560164708118083, 'sideways_tsl_mult': 0.0029370598347415733, 'sideways_time_stop': 190, 'sideways_use_sma': True, 'sideways_use_ema': True, 'sideways_use_atr': False, 'sideways_use_adx': False, 'sideways_use_spike': False, 'sideways_rsi_required': False}.
[I 2025-09-01 04:33:24,006] Trial 181 finished with values: [-1000000000.0, 1000000000.0] and parameters: {'p_sma': 55, 'p_std': 46, 'p_atr': 26, 'p_adx': 27, 'rsi_period': 63, 'ema1': 29, 'ema2': 55, 'slip_atr_k': 0.18740591707496704, 'slip_spread_k': 0.2982458043758375, 'spread_hl_frac': 0.035303389602200114, 'bb_std_mult': 2.4839316014185298, 'rsi_os': 17, 'rsi_ob': 84, 'vol_spike': 0.24802334737519122, 'adx_thresh': 14.305181456582096, 'atr_min_pct': 0.0011217175184147477, 'atr_max_pct': 0.111861930517922, 'tp_mult': 2.3647865579472134, 'tsl_mult': 0.8471608747257281, 'strategy': 'mean_reversion', 'time_stop': 227, 'use_sma': True, 'use_atr': False, 'use_adx': False, 'use_ema': True, 'use_spike': True, 'rsi_required': False, 'edge_k': 0.5166868348354712, 'edge_cap': 0.11505055121118296, 'bull_strategy': 'mean_reversion', 'bull_bb_std_mult': 1.943125892810684, 'bull_rsi_os': 54, 'bull_rsi_ob': 89, 'bull_adx_thresh': 19.161072689691686, 'bull_atr_min_pct': 0.02795978653883606, 'bull_atr_max_pct': 0.12874937593828997, 'bull_tp_mult': 1.2227520943971983, 'bull_tsl_mult': 0.2916191607892258, 'bull_time_stop': 159, 'bull_use_sma': True, 'bull_use_ema': False, 'bull_use_atr': True, 'bull_use_adx': False, 'bull_use_spike': False, 'bull_rsi_required': False, 'bear_strategy': 'mean_reversion', 'bear_bb_std_mult': 2.226401862017072, 'bear_rsi_os': 44, 'bear_rsi_ob': 58, 'bear_adx_thresh': 11.747526278424502, 'bear_atr_min_pct': 0.02998668020303614, 'bear_atr_max_pct': 0.13818021169478464, 'bear_tp_mult': 1.1849535756423235, 'bear_tsl_mult': 0.05923279331374942, 'bear_time_stop': 15, 'bear_use_sma': True, 'bear_use_ema': False, 'bear_use_atr': True, 'bear_use_adx': True, 'bear_use_spike': False, 'bear_rsi_required': True, 'sideways_strategy': 'mean_reversion', 'sideways_bb_std_mult': 2.0090900380129044, 'sideways_rsi_os': 8, 'sideways_rsi_ob': 68, 'sideways_adx_thresh': 11.914818340697133, 'sideways_atr_min_pct': 0.024254559041007505, 'sideways_atr_max_pct': 0.09170407583933829, 'sideways_tp_mult': 2.68258050882473, 'sideways_tsl_mult': 0.9586706357307767, 'sideways_time_stop': 288, 'sideways_use_sma': True, 'sideways_use_ema': False, 'sideways_use_atr': False, 'sideways_use_adx': False, 'sideways_use_spike': False, 'sideways_rsi_required': False}.
