[I 2025-09-01 05:21:59,863] Trial 461 finished with values: [-1000000000.0, 1000000000.0] and parameters: {'p_sma': 60, 'p_std': 32, 'p_atr': 8, 'p_adx': 17, 'rsi_period': 54, 'ema1': 23, 'ema2': 33, 'slip_atr_k': 0.020472866843787574, 'slip_spread_k': 0.399608058400641, 'spread_hl_frac': 0.04962334349535536, 'bb_std_mult': 2.16298046259561, 'rsi_os': 27, 'rsi_ob': 89, 'vol_spike': 0.19638898908379612, 'adx_thresh': 12.565996977892613, 'atr_min_pct': 0.004108101118207421, 'atr_max_pct': 0.12558801785669435, 'tp_mult': 2.498160686759987, 'tsl_mult': 0.9104410594296819, 'strategy': 'mean_reversion', 'time_stop': 185, 'use_sma': False, 'use_atr': True, 'use_adx': True, 'use_ema': True, 'use_spike': True, 'rsi_required': False, 'edge_k': 0.22790114748291274, 'edge_cap': 0.37234450471390057, 'bull_strategy': 'breakout', 'bull_bb_std_mult': 0.962435883563705, 'bull_rsi_os': 47, 'bull_rsi_ob': 87, 'bull_adx_thresh': 5.425289675379777, 'bull_atr_min_pct': 0.01247635517751811, 'bull_atr_max_pct': 0.10590073678924532, 'bull_tp_mult': 1.2043508886728562, 'bull_tsl_mult': 0.18853774790776553, 'bull_time_stop': 95, 'bull_use_sma': False, 'bull_use_ema': False, 'bull_use_atr': False, 'bull_use_adx': True, 'bull_use_spike': False, 'bull_rsi_required': True, 'bear_strategy': 'breakout', 'bear_bb_std_mult': 3.4709659033855402, 'bear_rsi_os': 6, 'bear_rsi_ob': 68, 'bear_adx_thresh': 20.99641423052797, 'bear_atr_min_pct': 0.00814806074703106, 'bear_atr_max_pct': 0.0724971818421309, 'bear_tp_mult': 1.335756935152055, 'bear_tsl_mult': 0.6559318347393703, 'bear_time_stop': 192, 'bear_use_sma': True, 'bear_use_ema': True, 'bear_use_atr': False, 'bear_use_adx': False, 'bear_use_spike': False, 'bear_rsi_required': True, 'sideways_strategy': 'breakout', 'sideways_bb_std_mult': 0.5405764279218538, 'sideways_rsi_os': 44, 'sideways_rsi_ob': 53, 'sideways_adx_thresh': 22.756699954962254, 'sideways_atr_min_pct': 0.005105942591941547, 'sideways_atr_max_pct': 0.10088573848993948, 'sideways_tp_mult': 1.6058065753434965, 'sideways_tsl_mult': 0.9948990232468254, 'sideways_time_stop': 169, 'sideways_use_sma': False, 'sideways_use_ema': False, 'sideways_use_atr': True, 'sideways_use_adx': True, 'sideways_use_spike': True, 'sideways_rsi_required': True}.
[I 2025-09-01 05:22:00,149] Trial 458 finished with values: [-0.013895270566830598, 0.014037869302928156] and parameters: {'p_sma': 59, 'p_std': 33, 'p_atr': 7, 'p_adx': 17, 'rsi_period': 54, 'ema1': 24, 'ema2': 33, 'slip_atr_k': 0.0260908979853274, 'slip_spread_k': 0.42163459104051537, 'spread_hl_frac': 0.04814818408452713, 'bb_std_mult': 2.1529255916933763, 'rsi_os': 26, 'rsi_ob': 89, 'vol_spike': 0.20483497391661148, 'adx_thresh': 12.3884835578529, 'atr_min_pct': 0.004109687706096597, 'atr_max_pct': 0.12483002113483861, 'tp_mult': 2.4662169525222604, 'tsl_mult': 0.9230464250280139, 'strategy': 'breakout', 'time_stop': 181, 'use_sma': False, 'use_atr': True, 'use_adx': False, 'use_ema': True, 'use_spike': True, 'rsi_required': False, 'edge_k': 0.22954137531256327, 'edge_cap': 0.37100712400204827, 'bull_strategy': 'breakout', 'bull_bb_std_mult': 0.8841407239786039, 'bull_rsi_os': 49, 'bull_rsi_ob': 53, 'bull_adx_thresh': 5.344719723679963, 'bull_atr_min_pct': 0.012648114644181132, 'bull_atr_max_pct': 0.10456844055542339, 'bull_tp_mult': 1.3059113237757678, 'bull_tsl_mult': 0.18424251548316853, 'bull_time_stop': 95, 'bull_use_sma': False, 'bull_use_ema': False, 'bull_use_atr': False, 'bull_use_adx': True, 'bull_use_spike': True, 'bull_rsi_required': True, 'bear_strategy': 'breakout', 'bear_bb_std_mult': 3.531611823397898, 'bear_rsi_os': 7, 'bear_rsi_ob': 69, 'bear_adx_thresh': 29.79794234661401, 'bear_atr_min_pct': 0.007194276693545735, 'bear_atr_max_pct': 0.07264464309328973, 'bear_tp_mult': 1.3364870240548536, 'bear_tsl_mult': 0.6540356195997996, 'bear_time_stop': 186, 'bear_use_sma': True, 'bear_use_ema': False, 'bear_use_atr': False, 'bear_use_adx': False, 'bear_use_spike': True, 'bear_rsi_required': False, 'sideways_strategy': 'breakout', 'sideways_bb_std_mult': 0.5961299193799078, 'sideways_rsi_os': 44, 'sideways_rsi_ob': 53, 'sideways_adx_thresh': 22.976528888409447, 'sideways_atr_min_pct': 0.004437850654980547, 'sideways_atr_max_pct': 0.10125286465823444, 'sideways_tp_mult': 1.5423212020365196, 'sideways_tsl_mult': 0.9957581723194817, 'sideways_time_stop': 162, 'sideways_use_sma': False, 'sideways_use_ema': False, 'sideways_use_atr': True, 'sideways_use_adx': True, 'sideways_use_spike': True, 'sideways_rsi_required': True}.
[I 2025-09-01 05:22:00,602] Trial 460 finished with values: [-1000000000.0, 1000000000.0] and parameters: {'p_sma': 60, 'p_std': 33, 'p_atr': 8, 'p_adx': 17, 'rsi_period': 54, 'ema1': 23, 'ema2': 34, 'slip_atr_k': 0.022524386602038864, 'slip_spread_k': 0.40076875047251015, 'spread_hl_frac': 0.047897497905328545, 'bb_std_mult': 2.152089906758251, 'rsi_os': 27, 'rsi_ob': 90, 'vol_spike': 0.1970174529921029, 'adx_thresh': 12.340806591054914, 'atr_min_pct': 0.004342170694787802, 'atr_max_pct': 0.12644175699666055, 'tp_mult': 2.483846669994504, 'tsl_mult': 0.9165078391404048, 'strategy': 'mean_reversion', 'time_stop': 184, 'use_sma': False, 'use_atr': True, 'use_adx': True, 'use_ema': True, 'use_spike': True, 'rsi_required': False, 'edge_k': 0.22854046003913084, 'edge_cap': 0.9946178288722591, 'bull_strategy': 'breakout', 'bull_bb_std_mult': 0.9503815876196754, 'bull_rsi_os': 48, 'bull_rsi_ob': 87, 'bull_adx_thresh': 5.286411798350547, 'bull_atr_min_pct': 0.012491431581002571, 'bull_atr_max_pct': 0.10502127394425913, 'bull_tp_mult': 1.2005690892516288, 'bull_tsl_mult': 0.1871322642676306, 'bull_time_stop': 97, 'bull_use_sma': False, 'bull_use_ema': False, 'bull_use_atr': False, 'bull_use_adx': True, 'bull_use_spike': False, 'bull_rsi_required': True, 'bear_strategy': 'breakout', 'bear_bb_std_mult': 3.4816526843818996, 'bear_rsi_os': 6, 'bear_rsi_ob': 69, 'bear_adx_thresh': 29.544755418408666, 'bear_atr_min_pct': 0.008300357302420926, 'bear_atr_max_pct': 0.07200764950780443, 'bear_tp_mult': 1.3348984565343711, 'bear_tsl_mult': 0.6501027619601258, 'bear_time_stop': 180, 'bear_use_sma': True, 'bear_use_ema': True, 'bear_use_atr': False, 'bear_use_adx': False, 'bear_use_spike': False, 'bear_rsi_required': True, 'sideways_strategy': 'breakout', 'sideways_bb_std_mult': 0.6110191009116723, 'sideways_rsi_os': 44, 'sideways_rsi_ob': 53, 'sideways_adx_thresh': 22.84117741869816, 'sideways_atr_min_pct': 0.005255677456686355, 'sideways_atr_max_pct': 0.10232737246459543, 'sideways_tp_mult': 1.6053307789434306, 'sideways_tsl_mult': 0.9908146692553412, 'sideways_time_stop': 170, 'sideways_use_sma': False, 'sideways_use_ema': False, 'sideways_use_atr': True, 'sideways_use_adx': True, 'sideways_use_spike': True, 'sideways_rsi_required': True}.
[I 2025-09-01 05:22:42,753] Trial 462 finished with values: [-1000000000.0, 1000000000.0] and parameters: {'p_sma': 60, 'p_std': 33, 'p_atr': 7, 'p_adx': 17, 'rsi_period': 54, 'ema1': 24, 'ema2': 34, 'slip_atr_k': 0.021698170466895136, 'slip_spread_k': 0.3989699476408873, 'spread_hl_frac': 0.04967983266769515, 'bb_std_mult': 2.1599410351182087, 'rsi_os': 26, 'rsi_ob': 89, 'vol_spike': 0.19560669395703528, 'adx_thresh': 12.245061502109806, 'atr_min_pct': 0.004199925494223019, 'atr_max_pct': 0.12672780064996203, 'tp_mult': 2.4904822036760357, 'tsl_mult': 0.9146866007129398, 'strategy': 'mean_reversion', 'time_stop': 183, 'use_sma': False, 'use_atr': True, 'use_adx': True, 'use_ema': True, 'use_spike': False, 'rsi_required': False, 'edge_k': 0.2279862715616805, 'edge_cap': 0.9856105843397321, 'bull_strategy': 'breakout', 'bull_bb_std_mult': 0.9769588931989509, 'bull_rsi_os': 48, 'bull_rsi_ob': 87, 'bull_adx_thresh': 5.360525503060684, 'bull_atr_min_pct': 0.01269120494086324, 'bull_atr_max_pct': 0.10488127942830791, 'bull_tp_mult': 1.303520429020909, 'bull_tsl_mult': 0.1918209383954802, 'bull_time_stop': 97, 'bull_use_sma': False, 'bull_use_ema': False, 'bull_use_atr': False, 'bull_use_adx': True, 'bull_use_spike': False, 'bull_rsi_required': True, 'bear_strategy': 'breakout', 'bear_bb_std_mult': 3.4754118220187644, 'bear_rsi_os': 6, 'bear_rsi_ob': 69, 'bear_adx_thresh': 29.540114024577726, 'bear_atr_min_pct': 0.008232123163099474, 'bear_atr_max_pct': 0.07093745897961509, 'bear_tp_mult': 1.3359587538381779, 'bear_tsl_mult': 0.6565155929196755, 'bear_time_stop': 192, 'bear_use_sma': True, 'bear_use_ema': True, 'bear_use_atr': False, 'bear_use_adx': False, 'bear_use_spike': True, 'bear_rsi_required': True, 'sideways_strategy': 'breakout', 'sideways_bb_std_mult': 0.602925019656767, 'sideways_rsi_os': 44, 'sideways_rsi_ob': 52, 'sideways_adx_thresh': 22.907262774761612, 'sideways_atr_min_pct': 0.005225426065986536, 'sideways_atr_max_pct': 0.10209321454821625, 'sideways_tp_mult': 1.6097732034885242, 'sideways_tsl_mult': 0.9950562111162243, 'sideways_time_stop': 161, 'sideways_use_sma': False, 'sideways_use_ema': False, 'sideways_use_atr': True, 'sideways_use_adx': True, 'sideways_use_spike': True, 'sideways_rsi_required': True}.
[I 2025-09-01 05:22:43,615] Trial 465 finished with values: [-0.016209985207497835, 0.01647947261653296] and parameters: {'p_sma': 58, 'p_std': 31, 'p_atr': 7, 'p_adx': 16, 'rsi_period': 51, 'ema1': 24, 'ema2': 32, 'slip_atr_k': 0.0204050364226381, 'slip_spread_k': 0.4298025411435326, 'spread_hl_frac': 0.04803838905501861, 'bb_std_mult': 1.9497898111552014, 'rsi_os': 26, 'rsi_ob': 89, 'vol_spike': 0.2049018878690513, 'adx_thresh': 13.103606550301038, 'atr_min_pct': 0.0034668819655904676, 'atr_max_pct': 0.12238190670494886, 'tp_mult': 2.405318068983176, 'tsl_mult': 0.9286517833312192, 'strategy': 'breakout', 'time_stop': 174, 'use_sma': False, 'use_atr': True, 'use_adx': False, 'use_ema': False, 'use_spike': False, 'rsi_required': True, 'edge_k': 0.19727522496049366, 'edge_cap': 0.5619693152383101, 'bull_strategy': 'breakout', 'bull_bb_std_mult': 0.8964008750536987, 'bull_rsi_os': 49, 'bull_rsi_ob': 65, 'bull_adx_thresh': 6.337942676189665, 'bull_atr_min_pct': 0.013838093756851185, 'bull_atr_max_pct': 0.1016425081453755, 'bull_tp_mult': 1.3003403245163587, 'bull_tsl_mult': 0.23444841954880788, 'bull_time_stop': 86, 'bull_use_sma': True, 'bull_use_ema': True, 'bull_use_atr': False, 'bull_use_adx': True, 'bull_use_spike': True, 'bull_rsi_required': True, 'bear_strategy': 'breakout', 'bear_bb_std_mult': 3.5311650772610608, 'bear_rsi_os': 7, 'bear_rsi_ob': 69, 'bear_adx_thresh': 21.60973895393065, 'bear_atr_min_pct': 0.0071169208693703636, 'bear_atr_max_pct': 0.07007855491100944, 'bear_tp_mult': 1.296306294469494, 'bear_tsl_mult': 0.6614542693741251, 'bear_time_stop': 195, 'bear_use_sma': False, 'bear_use_ema': False, 'bear_use_atr': False, 'bear_use_adx': False, 'bear_use_spike': True, 'bear_rsi_required': False, 'sideways_strategy': 'breakout', 'sideways_bb_std_mult': 0.5753821139754307, 'sideways_rsi_os': 44, 'sideways_rsi_ob': 52, 'sideways_adx_thresh': 24.21284544450962, 'sideways_atr_min_pct': 0.004267573799049737, 'sideways_atr_max_pct': 0.10364567298006476, 'sideways_tp_mult': 1.5346336142265502, 'sideways_tsl_mult': 0.9951745152051527, 'sideways_time_stop': 163, 'sideways_use_sma': False, 'sideways_use_ema': True, 'sideways_use_atr': True, 'sideways_use_adx': False, 'sideways_use_spike': True, 'sideways_rsi_required': True}.
[I 2025-09-01 05:22:44,372] Trial 463 finished with values: [-0.015305392446398058, 0.015254581414909173] and parameters: {'p_sma': 58, 'p_std': 33, 'p_atr': 7, 'p_adx': 17, 'rsi_period': 54, 'ema1': 24, 'ema2': 34, 'slip_atr_k': 0.02716475627515924, 'slip_spread_k': 0.42364365926923325, 'spread_hl_frac': 0.047861003637281525, 'bb_std_mult': 1.9329533641002294, 'rsi_os': 26, 'rsi_ob': 90, 'vol_spike': 0.20340844418506862, 'adx_thresh': 11.922324691439332, 'atr_min_pct': 0.0032938233418265683, 'atr_max_pct': 0.12774354218267195, 'tp_mult': 2.3978436960681715, 'tsl_mult': 0.923543258181172, 'strategy': 'mean_reversion', 'time_stop': 183, 'use_sma': False, 'use_atr': True, 'use_adx': False, 'use_ema': False, 'use_spike': False, 'rsi_required': True, 'edge_k': 0.2581439405456921, 'edge_cap': 0.5688586400274344, 'bull_strategy': 'breakout', 'bull_bb_std_mult': 0.8599943152600495, 'bull_rsi_os': 48, 'bull_rsi_ob': 87, 'bull_adx_thresh': 5.057999945409806, 'bull_atr_min_pct': 0.01394630949405488, 'bull_atr_max_pct': 0.10590657506278356, 'bull_tp_mult': 1.3144366084281176, 'bull_tsl_mult': 0.23129633823081233, 'bull_time_stop': 86, 'bull_use_sma': True, 'bull_use_ema': True, 'bull_use_atr': False, 'bull_use_adx': True, 'bull_use_spike': False, 'bull_rsi_required': True, 'bear_strategy': 'breakout', 'bear_bb_std_mult': 3.524764860972417, 'bear_rsi_os': 7, 'bear_rsi_ob': 69, 'bear_adx_thresh': 29.48294373819176, 'bear_atr_min_pct': 0.00705195810672185, 'bear_atr_max_pct': 0.06889179704198758, 'bear_tp_mult': 1.2689204643478857, 'bear_tsl_mult': 0.6518864643435318, 'bear_time_stop': 194, 'bear_use_sma': True, 'bear_use_ema': False, 'bear_use_atr': False, 'bear_use_adx': False, 'bear_use_spike': True, 'bear_rsi_required': False, 'sideways_strategy': 'breakout', 'sideways_bb_std_mult': 0.60754872329268, 'sideways_rsi_os': 44, 'sideways_rsi_ob': 53, 'sideways_adx_thresh': 23.917681340995294, 'sideways_atr_min_pct': 0.004508460181530275, 'sideways_atr_max_pct': 0.10295145303771516, 'sideways_tp_mult': 1.5356738317013674, 'sideways_tsl_mult': 0.9953871336906819, 'sideways_time_stop': 163, 'sideways_use_sma': False, 'sideways_use_ema': True, 'sideways_use_atr': True, 'sideways_use_adx': False, 'sideways_use_spike': True, 'sideways_rsi_required': True}.
[I 2025-09-01 05:22:44,372] Trial 464 finished with values: [-0.014353379185052417, 0.014202906721802912] and parameters: {'p_sma': 58, 'p_std': 33, 'p_atr': 7, 'p_adx': 16, 'rsi_period': 54, 'ema1': 24, 'ema2': 32, 'slip_atr_k': 0.020819524502922154, 'slip_spread_k': 0.43200008566472103, 'spread_hl_frac': 0.04834269656789436, 'bb_std_mult': 2.1183796896274143, 'rsi_os': 26, 'rsi_ob': 90, 'vol_spike': 0.2016847603831034, 'adx_thresh': 11.676630560751889, 'atr_min_pct': 0.0034869104483951693, 'atr_max_pct': 0.1249730169094671, 'tp_mult': 2.4825040320187153, 'tsl_mult': 0.9143624544470459, 'strategy': 'mean_reversion', 'time_stop': 184, 'use_sma': False, 'use_atr': True, 'use_adx': False, 'use_ema': False, 'use_spike': False, 'rsi_required': True, 'edge_k': 0.20090069690257661, 'edge_cap': 0.7297482334595797, 'bull_strategy': 'breakout', 'bull_bb_std_mult': 0.8629899959356142, 'bull_rsi_os': 48, 'bull_rsi_ob': 87, 'bull_adx_thresh': 5.038724518876736, 'bull_atr_min_pct': 0.013762650057810657, 'bull_atr_max_pct': 0.10362513334280504, 'bull_tp_mult': 1.2996209326538735, 'bull_tsl_mult': 0.17868195166808473, 'bull_time_stop': 86, 'bull_use_sma': True, 'bull_use_ema': True, 'bull_use_atr': False, 'bull_use_adx': True, 'bull_use_spike': False, 'bull_rsi_required': True, 'bear_strategy': 'breakout', 'bear_bb_std_mult': 3.598368958716539, 'bear_rsi_os': 7, 'bear_rsi_ob': 69, 'bear_adx_thresh': 29.3954727847288, 'bear_atr_min_pct': 0.007190962378700491, 'bear_atr_max_pct': 0.07131084923493314, 'bear_tp_mult': 1.2874338376295018, 'bear_tsl_mult': 0.6571178268669448, 'bear_time_stop': 196, 'bear_use_sma': True, 'bear_use_ema': False, 'bear_use_atr': False, 'bear_use_adx': False, 'bear_use_spike': True, 'bear_rsi_required': False, 'sideways_strategy': 'breakout', 'sideways_bb_std_mult': 0.5130222326898672, 'sideways_rsi_os': 44, 'sideways_rsi_ob': 52, 'sideways_adx_thresh': 22.81909756919371, 'sideways_atr_min_pct': 0.004551088183772069, 'sideways_atr_max_pct': 0.10259053394783096, 'sideways_tp_mult': 1.5357492424606736, 'sideways_tsl_mult': 0.9973564434042173, 'sideways_time_stop': 164, 'sideways_use_sma': False, 'sideways_use_ema': True, 'sideways_use_atr': True, 'sideways_use_adx': False, 'sideways_use_spike': True, 'sideways_rsi_required': True}.
[I 2025-09-01 05:23:31,197] Trial 469 finished with values: [-0.029789075620934802, 0.02960467014571356] and parameters: {'p_sma': 57, 'p_std': 30, 'p_atr': 7, 'p_adx': 16, 'rsi_period': 50, 'ema1': 25, 'ema2': 32, 'slip_atr_k': 0.018995800895550183, 'slip_spread_k': 0.4329261387334017, 'spread_hl_frac': 0.047962407330743646, 'bb_std_mult': 1.9304985798769707, 'rsi_os': 26, 'rsi_ob': 89, 'vol_spike': 0.2050118692696272, 'adx_thresh': 13.382210553099366, 'atr_min_pct': 0.0033248833964184153, 'atr_max_pct': 0.12247266850080873, 'tp_mult': 2.3843816450499493, 'tsl_mult': 0.850563890726586, 'strategy': 'breakout', 'time_stop': 175, 'use_sma': False, 'use_atr': True, 'use_adx': False, 'use_ema': False, 'use_spike': False, 'rsi_required': False, 'edge_k': 0.195209097295629, 'edge_cap': 0.5151989626150718, 'bull_strategy': 'breakout', 'bull_bb_std_mult': 0.9092744422754633, 'bull_rsi_os': 50, 'bull_rsi_ob': 90, 'bull_adx_thresh': 6.628233089764654, 'bull_atr_min_pct': 0.013087438043946291, 'bull_atr_max_pct': 0.10017297704495233, 'bull_tp_mult': 1.2938183373359644, 'bull_tsl_mult': 0.22734286671821471, 'bull_time_stop': 105, 'bull_use_sma': True, 'bull_use_ema': True, 'bull_use_atr': False, 'bull_use_adx': True, 'bull_use_spike': False, 'bull_rsi_required': True, 'bear_strategy': 'breakout', 'bear_bb_std_mult': 3.5225804272912087, 'bear_rsi_os': 8, 'bear_rsi_ob': 68, 'bear_adx_thresh': 29.39476098993458, 'bear_atr_min_pct': 0.006491765003823868, 'bear_atr_max_pct': 0.06971276416655109, 'bear_tp_mult': 1.287126106615816, 'bear_tsl_mult': 0.6763919320920815, 'bear_time_stop': 195, 'bear_use_sma': True, 'bear_use_ema': False, 'bear_use_atr': False, 'bear_use_adx': False, 'bear_use_spike': False, 'bear_rsi_required': False, 'sideways_strategy': 'breakout', 'sideways_bb_std_mult': 0.6466085444600855, 'sideways_rsi_os': 45, 'sideways_rsi_ob': 53, 'sideways_adx_thresh': 24.339241859321877, 'sideways_atr_min_pct': 0.003560514605018738, 'sideways_atr_max_pct': 0.09929357918735815, 'sideways_tp_mult': 1.52169108739677, 'sideways_tsl_mult': 0.981342525704766, 'sideways_time_stop': 168, 'sideways_use_sma': False, 'sideways_use_ema': True, 'sideways_use_atr': True, 'sideways_use_adx': False, 'sideways_use_spike': True, 'sideways_rsi_required': True}.
[I 2025-09-01 05:23:31,524] Trial 468 finished with values: [-0.031048571865686103, 0.03086390400452884] and parameters: {'p_sma': 57, 'p_std': 30, 'p_atr': 7, 'p_adx': 16, 'rsi_period': 50, 'ema1': 25, 'ema2': 32, 'slip_atr_k': 0.01859181204187423, 'slip_spread_k': 0.4451971165086522, 'spread_hl_frac': 0.04831825469630234, 'bb_std_mult': 1.9535514930341866, 'rsi_os': 28, 'rsi_ob': 89, 'vol_spike': 0.20388470582880133, 'adx_thresh': 13.329629025513187, 'atr_min_pct': 0.0032399182048880384, 'atr_max_pct': 0.12225972535137127, 'tp_mult': 2.379477516707765, 'tsl_mult': 0.8892156562849737, 'strategy': 'breakout', 'time_stop': 190, 'use_sma': False, 'use_atr': True, 'use_adx': False, 'use_ema': False, 'use_spike': False, 'rsi_required': False, 'edge_k': 0.2675902659522814, 'edge_cap': 0.7321609050033152, 'bull_strategy': 'breakout', 'bull_bb_std_mult': 0.9098531463260041, 'bull_rsi_os': 50, 'bull_rsi_ob': 57, 'bull_adx_thresh': 6.356429460595683, 'bull_atr_min_pct': 0.012935245697017789, 'bull_atr_max_pct': 0.10714576256481687, 'bull_tp_mult': 1.3108234209437222, 'bull_tsl_mult': 0.2269485695789497, 'bull_time_stop': 104, 'bull_use_sma': True, 'bull_use_ema': True, 'bull_use_atr': False, 'bull_use_adx': True, 'bull_use_spike': False, 'bull_rsi_required': True, 'bear_strategy': 'breakout', 'bear_bb_std_mult': 3.5410819034452197, 'bear_rsi_os': 8, 'bear_rsi_ob': 68, 'bear_adx_thresh': 29.0719889596966, 'bear_atr_min_pct': 0.00652510143647275, 'bear_atr_max_pct': 0.07018612777329995, 'bear_tp_mult': 1.265047695751423, 'bear_tsl_mult': 0.6479848895881783, 'bear_time_stop': 21, 'bear_use_sma': True, 'bear_use_ema': False, 'bear_use_atr': False, 'bear_use_adx': False, 'bear_use_spike': False, 'bear_rsi_required': False, 'sideways_strategy': 'breakout', 'sideways_bb_std_mult': 0.5716831402642764, 'sideways_rsi_os': 45, 'sideways_rsi_ob': 54, 'sideways_adx_thresh': 24.360316340989257, 'sideways_atr_min_pct': 0.00353149396470512, 'sideways_atr_max_pct': 0.10022510813263122, 'sideways_tp_mult': 1.5201636455815482, 'sideways_tsl_mult': 0.9809993608650134, 'sideways_time_stop': 169, 'sideways_use_sma': False, 'sideways_use_ema': True, 'sideways_use_atr': True, 'sideways_use_adx': False, 'sideways_use_spike': True, 'sideways_rsi_required': True}.
