[I 2025-09-01 04:40:04,878] Trial 217 finished with values: [-1000000000.0, 1000000000.0] and parameters: {'p_sma': 16, 'p_std': 45, 'p_atr': 12, 'p_adx': 18, 'rsi_period': 49, 'ema1': 10, 'ema2': 28, 'slip_atr_k': 0.2037206950530731, 'slip_spread_k': 0.16599095773690303, 'spread_hl_frac': 0.0447980747900707, 'bb_std_mult': 3.065011157581875, 'rsi_os': 49, 'rsi_ob': 54, 'vol_spike': 0.24065223863282878, 'adx_thresh': 6.120504457186712, 'atr_min_pct': 0.0060078197773172255, 'atr_max_pct': 0.12278146577408423, 'tp_mult': 2.5587200927527727, 'tsl_mult': 0.14047140924403217, 'strategy': 'mean_reversion', 'time_stop': 32, 'use_sma': True, 'use_atr': False, 'use_adx': True, 'use_ema': True, 'use_spike': True, 'rsi_required': False, 'edge_k': 0.4019315823566028, 'edge_cap': 0.15416201904495758, 'bull_strategy': 'mean_reversion', 'bull_bb_std_mult': 0.7134226945387663, 'bull_rsi_os': 26, 'bull_rsi_ob': 90, 'bull_adx_thresh': 19.016646750011414, 'bull_atr_min_pct': 0.0005976496349656575, 'bull_atr_max_pct': 0.1287640179054926, 'bull_tp_mult': 2.717456107101586, 'bull_tsl_mult': 0.4584521754904163, 'bull_time_stop': 236, 'bull_use_sma': False, 'bull_use_ema': True, 'bull_use_atr': True, 'bull_use_adx': False, 'bull_use_spike': False, 'bull_rsi_required': False, 'bear_strategy': 'mean_reversion', 'bear_bb_std_mult': 1.0021271486308296, 'bear_rsi_os': 7, 'bear_rsi_ob': 87, 'bear_adx_thresh': 13.357000686147364, 'bear_atr_min_pct': 0.00801130890236668, 'bear_atr_max_pct': 0.03459272313090181, 'bear_tp_mult': 2.7779360404335605, 'bear_tsl_mult': 0.15950981930650013, 'bear_time_stop': 30, 'bear_use_sma': True, 'bear_use_ema': False, 'bear_use_atr': True, 'bear_use_adx': True, 'bear_use_spike': False, 'bear_rsi_required': False, 'sideways_strategy': 'mean_reversion', 'sideways_bb_std_mult': 2.5693010279323145, 'sideways_rsi_os': 7, 'sideways_rsi_ob': 47, 'sideways_adx_thresh': 9.13463968092339, 'sideways_atr_min_pct': 0.007339721912152453, 'sideways_atr_max_pct': 0.09297537680773399, 'sideways_tp_mult': 2.1597384183592663, 'sideways_tsl_mult': 0.6283288421734199, 'sideways_time_stop': 188, 'sideways_use_sma': True, 'sideways_use_ema': True, 'sideways_use_atr': False, 'sideways_use_adx': True, 'sideways_use_spike': False, 'sideways_rsi_required': False}.
[I 2025-09-01 04:40:04,890] Trial 216 finished with values: [-1000000000.0, 1000000000.0] and parameters: {'p_sma': 16, 'p_std': 45, 'p_atr': 27, 'p_adx': 18, 'rsi_period': 50, 'ema1': 7, 'ema2': 28, 'slip_atr_k': 0.005780876592128618, 'slip_spread_k': 0.2698248097117967, 'spread_hl_frac': 0.04068370460662879, 'bb_std_mult': 1.9819881913387447, 'rsi_os': 36, 'rsi_ob': 57, 'vol_spike': 0.25162371582709625, 'adx_thresh': 9.008906285512444, 'atr_min_pct': 0.00045928766145452213, 'atr_max_pct': 0.12240868495867809, 'tp_mult': 2.5419478551918884, 'tsl_mult': 0.9109300606101737, 'strategy': 'mean_reversion', 'time_stop': 31, 'use_sma': True, 'use_atr': False, 'use_adx': True, 'use_ema': True, 'use_spike': True, 'rsi_required': False, 'edge_k': 0.6339517873526949, 'edge_cap': 0.14721286128622255, 'bull_strategy': 'mean_reversion', 'bull_bb_std_mult': 2.429172653239619, 'bull_rsi_os': 26, 'bull_rsi_ob': 49, 'bull_adx_thresh': 18.93788120416987, 'bull_atr_min_pct': 0.0007082555181277897, 'bull_atr_max_pct': 0.12653718482888165, 'bull_tp_mult': 1.6534335762241275, 'bull_tsl_mult': 0.45666431812329966, 'bull_time_stop': 208, 'bull_use_sma': False, 'bull_use_ema': True, 'bull_use_atr': True, 'bull_use_adx': False, 'bull_use_spike': False, 'bull_rsi_required': False, 'bear_strategy': 'mean_reversion', 'bear_bb_std_mult': 0.9958279274459885, 'bear_rsi_os': 45, 'bear_rsi_ob': 91, 'bear_adx_thresh': 13.188382202265316, 'bear_atr_min_pct': 0.0040134684279211075, 'bear_atr_max_pct': 0.1434206381223287, 'bear_tp_mult': 2.490484779406344, 'bear_tsl_mult': 0.0010346107590550602, 'bear_time_stop': 31, 'bear_use_sma': True, 'bear_use_ema': False, 'bear_use_atr': True, 'bear_use_adx': True, 'bear_use_spike': False, 'bear_rsi_required': False, 'sideways_strategy': 'mean_reversion', 'sideways_bb_std_mult': 1.4270935205477058, 'sideways_rsi_os': 7, 'sideways_rsi_ob': 74, 'sideways_adx_thresh': 18.268260346424658, 'sideways_atr_min_pct': 0.023328798552106372, 'sideways_atr_max_pct': 0.09277243336181026, 'sideways_tp_mult': 2.696280327793281, 'sideways_tsl_mult': 0.3926908134947248, 'sideways_time_stop': 299, 'sideways_use_sma': True, 'sideways_use_ema': True, 'sideways_use_atr': False, 'sideways_use_adx': True, 'sideways_use_spike': False, 'sideways_rsi_required': False}.
[I 2025-09-01 04:40:05,853] Trial 218 finished with values: [-1000000000.0, 1000000000.0] and parameters: {'p_sma': 16, 'p_std': 45, 'p_atr': 25, 'p_adx': 18, 'rsi_period': 60, 'ema1': 29, 'ema2': 28, 'slip_atr_k': 0.20419759760726527, 'slip_spread_k': 0.3806188878924156, 'spread_hl_frac': 0.043899720380222856, 'bb_std_mult': 2.0376658088760187, 'rsi_os': 49, 'rsi_ob': 55, 'vol_spike': 0.2443202725391449, 'adx_thresh': 30.149642347358796, 'atr_min_pct': 0.0005313128155286055, 'atr_max_pct': 0.12158994644162083, 'tp_mult': 2.542914106355945, 'tsl_mult': 0.9190805974426111, 'strategy': 'mean_reversion', 'time_stop': 34, 'use_sma': True, 'use_atr': False, 'use_adx': True, 'use_ema': True, 'use_spike': True, 'rsi_required': False, 'edge_k': 0.5663540014268499, 'edge_cap': 0.589812740832714, 'bull_strategy': 'mean_reversion', 'bull_bb_std_mult': 2.3039410469426924, 'bull_rsi_os': 26, 'bull_rsi_ob': 49, 'bull_adx_thresh': 19.061181125257914, 'bull_atr_min_pct': 0.024826075320439567, 'bull_atr_max_pct': 0.128019455060526, 'bull_tp_mult': 2.068119774404118, 'bull_tsl_mult': 0.534245302332837, 'bull_time_stop': 94, 'bull_use_sma': False, 'bull_use_ema': True, 'bull_use_atr': True, 'bull_use_adx': False, 'bull_use_spike': False, 'bull_rsi_required': False, 'bear_strategy': 'mean_reversion', 'bear_bb_std_mult': 2.6039408376977473, 'bear_rsi_os': 42, 'bear_rsi_ob': 68, 'bear_adx_thresh': 13.175600395504466, 'bear_atr_min_pct': 0.007868703316970524, 'bear_atr_max_pct': 0.03448464529692209, 'bear_tp_mult': 1.1435682647757537, 'bear_tsl_mult': 0.1070454832078011, 'bear_time_stop': 103, 'bear_use_sma': True, 'bear_use_ema': False, 'bear_use_atr': True, 'bear_use_adx': True, 'bear_use_spike': False, 'bear_rsi_required': False, 'sideways_strategy': 'mean_reversion', 'sideways_bb_std_mult': 1.4483949990480711, 'sideways_rsi_os': 39, 'sideways_rsi_ob': 74, 'sideways_adx_thresh': 9.338698622071743, 'sideways_atr_min_pct': 0.023364537168538427, 'sideways_atr_max_pct': 0.12358933687998612, 'sideways_tp_mult': 2.694140467558695, 'sideways_tsl_mult': 0.9470653973060399, 'sideways_time_stop': 190, 'sideways_use_sma': True, 'sideways_use_ema': True, 'sideways_use_atr': False, 'sideways_use_adx': True, 'sideways_use_spike': False, 'sideways_rsi_required': False}.
[I 2025-09-01 04:40:06,183] Trial 219 finished with values: [-1000000000.0, 1000000000.0] and parameters: {'p_sma': 17, 'p_std': 44, 'p_atr': 13, 'p_adx': 27, 'rsi_period': 60, 'ema1': 29, 'ema2': 28, 'slip_atr_k': 0.0001212091588271323, 'slip_spread_k': 0.38211782448599335, 'spread_hl_frac': 0.04387247853020847, 'bb_std_mult': 2.0485503785985104, 'rsi_os': 36, 'rsi_ob': 54, 'vol_spike': 0.24354868386334785, 'adx_thresh': 6.510191942284793, 'atr_min_pct': 0.008370288579913347, 'atr_max_pct': 0.12999363455302457, 'tp_mult': 2.5393838836871967, 'tsl_mult': 0.14591838546185387, 'strategy': 'mean_reversion', 'time_stop': 34, 'use_sma': True, 'use_atr': False, 'use_adx': True, 'use_ema': True, 'use_spike': True, 'rsi_required': False, 'edge_k': 1.3454477581863824, 'edge_cap': 0.8572794945050026, 'bull_strategy': 'mean_reversion', 'bull_bb_std_mult': 2.4126398429622027, 'bull_rsi_os': 27, 'bull_rsi_ob': 59, 'bull_adx_thresh': 18.944533076150286, 'bull_atr_min_pct': 0.00010299487639411908, 'bull_atr_max_pct': 0.12942877733605557, 'bull_tp_mult': 2.852418879318803, 'bull_tsl_mult': 0.029696017006397457, 'bull_time_stop': 107, 'bull_use_sma': False, 'bull_use_ema': True, 'bull_use_atr': True, 'bull_use_adx': False, 'bull_use_spike': False, 'bull_rsi_required': False, 'bear_strategy': 'mean_reversion', 'bear_bb_std_mult': 1.1833011752816645, 'bear_rsi_os': 42, 'bear_rsi_ob': 69, 'bear_adx_thresh': 13.012693125069386, 'bear_atr_min_pct': 0.029988508584308893, 'bear_atr_max_pct': 0.14672734500754803, 'bear_tp_mult': 2.354037641000132, 'bear_tsl_mult': 0.1580832793670211, 'bear_time_stop': 17, 'bear_use_sma': True, 'bear_use_ema': False, 'bear_use_atr': True, 'bear_use_adx': True, 'bear_use_spike': False, 'bear_rsi_required': False, 'sideways_strategy': 'mean_reversion', 'sideways_bb_std_mult': 1.4538213981561405, 'sideways_rsi_os': 38, 'sideways_rsi_ob': 47, 'sideways_adx_thresh': 18.185883129260386, 'sideways_atr_min_pct': 0.023257170913005505, 'sideways_atr_max_pct': 0.1226128049860403, 'sideways_tp_mult': 2.6887309284127197, 'sideways_tsl_mult': 0.6446211065140085, 'sideways_time_stop': 290, 'sideways_use_sma': True, 'sideways_use_ema': True, 'sideways_use_atr': False, 'sideways_use_adx': True, 'sideways_use_spike': False, 'sideways_rsi_required': False}.
[I 2025-09-01 04:40:53,304] Trial 221 finished with values: [-1000000000.0, 1000000000.0] and parameters: {'p_sma': 18, 'p_std': 47, 'p_atr': 25, 'p_adx': 30, 'rsi_period': 61, 'ema1': 29, 'ema2': 26, 'slip_atr_k': 0.007342644199709423, 'slip_spread_k': 0.3759980205474767, 'spread_hl_frac': 0.04382056161699913, 'bb_std_mult': 2.8268244133597213, 'rsi_os': 33, 'rsi_ob': 50, 'vol_spike': 0.10246386169644628, 'adx_thresh': 13.824366085243906, 'atr_min_pct': 0.0015787374389694274, 'atr_max_pct': 0.11014851235452608, 'tp_mult': 2.528884067638387, 'tsl_mult': 0.9315624154684421, 'strategy': 'breakout', 'time_stop': 84, 'use_sma': True, 'use_atr': False, 'use_adx': False, 'use_ema': True, 'use_spike': True, 'rsi_required': False, 'edge_k': 1.4322070650360839, 'edge_cap': 0.9969161662409852, 'bull_strategy': 'mean_reversion', 'bull_bb_std_mult': 2.3138351312794088, 'bull_rsi_os': 17, 'bull_rsi_ob': 59, 'bull_adx_thresh': 17.79550452361954, 'bull_atr_min_pct': 0.0019734606760594756, 'bull_atr_max_pct': 0.10114913270699691, 'bull_tp_mult': 2.2690113288462728, 'bull_tsl_mult': 0.20147362619056752, 'bull_time_stop': 96, 'bull_use_sma': True, 'bull_use_ema': False, 'bull_use_atr': True, 'bull_use_adx': False, 'bull_use_spike': False, 'bull_rsi_required': False, 'bear_strategy': 'mean_reversion', 'bear_bb_std_mult': 1.177736692741267, 'bear_rsi_os': 43, 'bear_rsi_ob': 57, 'bear_adx_thresh': 16.881225022120926, 'bear_atr_min_pct': 0.028013105126701916, 'bear_atr_max_pct': 0.016018266804364814, 'bear_tp_mult': 1.057564349253576, 'bear_tsl_mult': 0.11804466330421858, 'bear_time_stop': 201, 'bear_use_sma': False, 'bear_use_ema': False, 'bear_use_atr': True, 'bear_use_adx': True, 'bear_use_spike': False, 'bear_rsi_required': False, 'sideways_strategy': 'breakout', 'sideways_bb_std_mult': 1.5534299407962107, 'sideways_rsi_os': 39, 'sideways_rsi_ob': 89, 'sideways_adx_thresh': 16.090228783493956, 'sideways_atr_min_pct': 0.023402727112310603, 'sideways_atr_max_pct': 0.04650229992805364, 'sideways_tp_mult': 1.0836508232350313, 'sideways_tsl_mult': 0.12569891701572639, 'sideways_time_stop': 291, 'sideways_use_sma': True, 'sideways_use_ema': True, 'sideways_use_atr': False, 'sideways_use_adx': False, 'sideways_use_spike': False, 'sideways_rsi_required': False}.
[I 2025-09-01 04:40:53,948] Trial 222 finished with values: [-1000000000.0, 1000000000.0] and parameters: {'p_sma': 18, 'p_std': 41, 'p_atr': 26, 'p_adx': 27, 'rsi_period': 46, 'ema1': 30, 'ema2': 26, 'slip_atr_k': 0.007652678085015949, 'slip_spread_k': 0.5899866884645435, 'spread_hl_frac': 0.0426564987976605, 'bb_std_mult': 0.8236063200953895, 'rsi_os': 47, 'rsi_ob': 85, 'vol_spike': 0.1022106957355055, 'adx_thresh': 14.219136523334724, 'atr_min_pct': 0.001295009308244459, 'atr_max_pct': 0.11188281762800481, 'tp_mult': 1.7485226736335022, 'tsl_mult': 0.9499885247557853, 'strategy': 'breakout', 'time_stop': 251, 'use_sma': True, 'use_atr': False, 'use_adx': False, 'use_ema': True, 'use_spike': True, 'rsi_required': False, 'edge_k': 1.4312604932374033, 'edge_cap': 0.9720505331701222, 'bull_strategy': 'mean_reversion', 'bull_bb_std_mult': 2.922046634167255, 'bull_rsi_os': 53, 'bull_rsi_ob': 92, 'bull_adx_thresh': 31.87691274949269, 'bull_atr_min_pct': 0.0020067182574684444, 'bull_atr_max_pct': 0.10086608633868135, 'bull_tp_mult': 1.7826374855758127, 'bull_tsl_mult': 0.326526452072543, 'bull_time_stop': 55, 'bull_use_sma': True, 'bull_use_ema': False, 'bull_use_atr': True, 'bull_use_adx': False, 'bull_use_spike': False, 'bull_rsi_required': False, 'bear_strategy': 'mean_reversion', 'bear_bb_std_mult': 1.1501213812802882, 'bear_rsi_os': 48, 'bear_rsi_ob': 57, 'bear_adx_thresh': 8.38298652144947, 'bear_atr_min_pct': 0.004609594219365727, 'bear_atr_max_pct': 0.14696672105492437, 'bear_tp_mult': 2.711595849238386, 'bear_tsl_mult': 0.8420262777366152, 'bear_time_stop': 18, 'bear_use_sma': False, 'bear_use_ema': False, 'bear_use_atr': True, 'bear_use_adx': True, 'bear_use_spike': False, 'bear_rsi_required': False, 'sideways_strategy': 'breakout', 'sideways_bb_std_mult': 1.5399512645271562, 'sideways_rsi_os': 10, 'sideways_rsi_ob': 49, 'sideways_adx_thresh': 16.373002315140333, 'sideways_atr_min_pct': 0.020110882889642814, 'sideways_atr_max_pct': 0.058296694020747046, 'sideways_tp_mult': 2.8331706872826268, 'sideways_tsl_mult': 0.999269118677157, 'sideways_time_stop': 112, 'sideways_use_sma': False, 'sideways_use_ema': True, 'sideways_use_atr': False, 'sideways_use_adx': False, 'sideways_use_spike': False, 'sideways_rsi_required': False}.
[I 2025-09-01 04:40:54,239] Trial 220 finished with values: [-0.018533266492598566, 0.018415789381701606] and parameters: {'p_sma': 17, 'p_std': 47, 'p_atr': 23, 'p_adx': 30, 'rsi_period': 77, 'ema1': 29, 'ema2': 50, 'slip_atr_k': 0.007814787947472476, 'slip_spread_k': 0.38621852591368383, 'spread_hl_frac': 0.04359175917157799, 'bb_std_mult': 1.0751211383927974, 'rsi_os': 55, 'rsi_ob': 50, 'vol_spike': 0.2429932466383797, 'adx_thresh': 26.19573539459511, 'atr_min_pct': 0.0015534829195257842, 'atr_max_pct': 0.07039761302981717, 'tp_mult': 2.463018372602586, 'tsl_mult': 0.9249672327739699, 'strategy': 'breakout', 'time_stop': 39, 'use_sma': True, 'use_atr': False, 'use_adx': False, 'use_ema': True, 'use_spike': True, 'rsi_required': False, 'edge_k': 0.5767479314561623, 'edge_cap': 0.2498720033659912, 'bull_strategy': 'mean_reversion', 'bull_bb_std_mult': 1.726977230052821, 'bull_rsi_os': 30, 'bull_rsi_ob': 92, 'bull_adx_thresh': 8.799427052538867, 'bull_atr_min_pct': 6.916471525507189e-05, 'bull_atr_max_pct': 0.13116454395728427, 'bull_tp_mult': 2.763459806978667, 'bull_tsl_mult': 0.5402763175563319, 'bull_time_stop': 210, 'bull_use_sma': True, 'bull_use_ema': False, 'bull_use_atr': True, 'bull_use_adx': False, 'bull_use_spike': False, 'bull_rsi_required': False, 'bear_strategy': 'mean_reversion', 'bear_bb_std_mult': 1.1916974962030147, 'bear_rsi_os': 42, 'bear_rsi_ob': 57, 'bear_adx_thresh': 16.11389826399246, 'bear_atr_min_pct': 0.005827716845207848, 'bear_atr_max_pct': 0.1499775708199098, 'bear_tp_mult': 2.285267512994009, 'bear_tsl_mult': 0.11687731955106716, 'bear_time_stop': 203, 'bear_use_sma': False, 'bear_use_ema': False, 'bear_use_atr': True, 'bear_use_adx': True, 'bear_use_spike': False, 'bear_rsi_required': False, 'sideways_strategy': 'breakout', 'sideways_bb_std_mult': 1.5525528326151654, 'sideways_rsi_os': 5, 'sideways_rsi_ob': 89, 'sideways_adx_thresh': 16.12928952917595, 'sideways_atr_min_pct': 0.020108649001118847, 'sideways_atr_max_pct': 0.10065931250453675, 'sideways_tp_mult': 2.8319402296724543, 'sideways_tsl_mult': 0.17702798036382966, 'sideways_time_stop': 184, 'sideways_use_sma': True, 'sideways_use_ema': True, 'sideways_use_atr': False, 'sideways_use_adx': False, 'sideways_use_spike': False, 'sideways_rsi_required': False}.
[I 2025-09-01 04:40:54,559] Trial 223 finished with values: [-1000000000.0, 1000000000.0] and parameters: {'p_sma': 18, 'p_std': 48, 'p_atr': 26, 'p_adx': 22, 'rsi_period': 62, 'ema1': 30, 'ema2': 26, 'slip_atr_k': 0.1539877310871672, 'slip_spread_k': 0.6392373957380708, 'spread_hl_frac': 0.04162214657659915, 'bb_std_mult': 2.7531224564229166, 'rsi_os': 33, 'rsi_ob': 56, 'vol_spike': 0.27293644606356277, 'adx_thresh': 13.911164027975387, 'atr_min_pct': 0.010961358892098363, 'atr_max_pct': 0.05586947616878661, 'tp_mult': 2.4560886280844456, 'tsl_mult': 0.9577493223724985, 'strategy': 'breakout', 'time_stop': 62, 'use_sma': True, 'use_atr': False, 'use_adx': False, 'use_ema': True, 'use_spike': True, 'rsi_required': False, 'edge_k': 1.4321509444466018, 'edge_cap': 0.95249004437119, 'bull_strategy': 'mean_reversion', 'bull_bb_std_mult': 2.767123342035015, 'bull_rsi_os': 30, 'bull_rsi_ob': 92, 'bull_adx_thresh': 23.113762401515334, 'bull_atr_min_pct': 0.0019893669322301162, 'bull_atr_max_pct': 0.13853743010699063, 'bull_tp_mult': 2.280734785876756, 'bull_tsl_mult': 0.3929324945090536, 'bull_time_stop': 300, 'bull_use_sma': True, 'bull_use_ema': False, 'bull_use_atr': True, 'bull_use_adx': False, 'bull_use_spike': False, 'bull_rsi_required': False, 'bear_strategy': 'mean_reversion', 'bear_bb_std_mult': 1.1511495028498213, 'bear_rsi_os': 25, 'bear_rsi_ob': 57, 'bear_adx_thresh': 16.14893689968561, 'bear_atr_min_pct': 0.005781592923545452, 'bear_atr_max_pct': 0.14734400359731434, 'bear_tp_mult': 1.234211649250994, 'bear_tsl_mult': 0.8395744376103491, 'bear_time_stop': 202, 'bear_use_sma': False, 'bear_use_ema': False, 'bear_use_atr': True, 'bear_use_adx': True, 'bear_use_spike': False, 'bear_rsi_required': False, 'sideways_strategy': 'breakout', 'sideways_bb_std_mult': 1.5615781461723777, 'sideways_rsi_os': 10, 'sideways_rsi_ob': 45, 'sideways_adx_thresh': 16.190619771119476, 'sideways_atr_min_pct': 0.02460484649074921, 'sideways_atr_max_pct': 0.03749989614472879, 'sideways_tp_mult': 2.831314921741068, 'sideways_tsl_mult': 0.3335997311277835, 'sideways_time_stop': 182, 'sideways_use_sma': False, 'sideways_use_ema': True, 'sideways_use_atr': False, 'sideways_use_adx': False, 'sideways_use_spike': False, 'sideways_rsi_required': False}.
[I 2025-09-01 04:41:37,449] Trial 227 finished with values: [-0.015772166511147212, 0.01561491278955675] and parameters: {'p_sma': 50, 'p_std': 54, 'p_atr': 27, 'p_adx': 19, 'rsi_period': 77, 'ema1': 12, 'ema2': 29, 'slip_atr_k': 0.0037232105393004006, 'slip_spread_k': 0.30436553869862343, 'spread_hl_frac': 0.04220101536718432, 'bb_std_mult': 1.0462727750419765, 'rsi_os': 46, 'rsi_ob': 55, 'vol_spike': 0.24065669571929973, 'adx_thresh': 31.285882013986463, 'atr_min_pct': 0.006826498407854887, 'atr_max_pct': 0.0681876888843283, 'tp_mult': 2.4573142921340305, 'tsl_mult': 0.9760733757979856, 'strategy': 'breakout', 'time_stop': 22, 'use_sma': True, 'use_atr': True, 'use_adx': False, 'use_ema': True, 'use_spike': True, 'rsi_required': False, 'edge_k': 0.5659267945219862, 'edge_cap': 0.18066225323799767, 'bull_strategy': 'breakout', 'bull_bb_std_mult': 2.2176514577732322, 'bull_rsi_os': 29, 'bull_rsi_ob': 81, 'bull_adx_thresh': 24.319296009422484, 'bull_atr_min_pct': 0.0012113120697058893, 'bull_atr_max_pct': 0.1316893284905962, 'bull_tp_mult': 1.5982324689095135, 'bull_tsl_mult': 0.051973476380706096, 'bull_time_stop': 210, 'bull_use_sma': True, 'bull_use_ema': False, 'bull_use_atr': True, 'bull_use_adx': False, 'bull_use_spike': False, 'bull_rsi_required': False, 'bear_strategy': 'mean_reversion', 'bear_bb_std_mult': 1.0622650844820387, 'bear_rsi_os': 45, 'bear_rsi_ob': 56, 'bear_adx_thresh': 6.685978309415974, 'bear_atr_min_pct': 0.029953636661833448, 'bear_atr_max_pct': 0.14907596802498263, 'bear_tp_mult': 2.0227335934457, 'bear_tsl_mult': 0.7509285562190728, 'bear_time_stop': 190, 'bear_use_sma': True, 'bear_use_ema': True, 'bear_use_atr': True, 'bear_use_adx': False, 'bear_use_spike': False, 'bear_rsi_required': True, 'sideways_strategy': 'mean_reversion', 'sideways_bb_std_mult': 1.1810027611320568, 'sideways_rsi_os': 5, 'sideways_rsi_ob': 49, 'sideways_adx_thresh': 11.084692545971174, 'sideways_atr_min_pct': 0.025249261721156, 'sideways_atr_max_pct': 0.09646846652632413, 'sideways_tp_mult': 2.778773377737945, 'sideways_tsl_mult': 0.17882752671089847, 'sideways_time_stop': 17, 'sideways_use_sma': True, 'sideways_use_ema': False, 'sideways_use_atr': False, 'sideways_use_adx': False, 'sideways_use_spike': True, 'sideways_rsi_required': False}.
