[I 2025-09-01 04:09:55,178] Trial 36 finished with values: [-0.13153961862688934, 0.13140288421032245] and parameters: {'p_sma': 59, 'p_std': 5, 'p_atr': 17, 'p_adx': 13, 'rsi_period': 21, 'ema1': 28, 'ema2': 55, 'slip_atr_k': 0.101054736962783, 'slip_spread_k': 0.9469292811788314, 'spread_hl_frac': 0.04854510371379524, 'bb_std_mult': 2.1877700489294027, 'rsi_os': 24, 'rsi_ob': 92, 'vol_spike': 0.1756521961350844, 'adx_thresh': 25.81541699052723, 'atr_min_pct': 0.017782597484259154, 'atr_max_pct': 0.05928671848385508, 'tp_mult': 1.4743210849884048, 'tsl_mult': 0.5479426562284853, 'strategy': 'breakout', 'time_stop': 112, 'use_sma': True, 'use_atr': False, 'use_adx': True, 'use_ema': False, 'use_spike': True, 'rsi_required': True, 'edge_k': 1.7053593982342221, 'edge_cap': 0.46351223263225877, 'bull_strategy': 'mean_reversion', 'bull_bb_std_mult': 1.745319458493162, 'bull_rsi_os': 48, 'bull_rsi_ob': 78, 'bull_adx_thresh': 33.14020113316161, 'bull_atr_min_pct': 0.00813590010767714, 'bull_atr_max_pct': 0.06150005984051575, 'bull_tp_mult': 2.1634060985946113, 'bull_tsl_mult': 0.996414118928625, 'bull_time_stop': 198, 'bull_use_sma': False, 'bull_use_ema': False, 'bull_use_atr': True, 'bull_use_adx': True, 'bull_use_spike': False, 'bull_rsi_required': False, 'bear_strategy': 'breakout', 'bear_bb_std_mult': 3.5920180998027362, 'bear_rsi_os': 9, 'bear_rsi_ob': 48, 'bear_adx_thresh': 22.232475967906897, 'bear_atr_min_pct': 0.015372728186330911, 'bear_atr_max_pct': 0.041287771983916685, 'bear_tp_mult': 1.024229026820638, 'bear_tsl_mult': 0.8759163425131938, 'bear_time_stop': 136, 'bear_use_sma': False, 'bear_use_ema': True, 'bear_use_atr': True, 'bear_use_adx': False, 'bear_use_spike': False, 'bear_rsi_required': False, 'sideways_strategy': 'mean_reversion', 'sideways_bb_std_mult': 2.7896856422401926, 'sideways_rsi_os': 29, 'sideways_rsi_ob': 53, 'sideways_adx_thresh': 21.14743122074585, 'sideways_atr_min_pct': 3.2000043552677325e-05, 'sideways_atr_max_pct': 0.1389706718866261, 'sideways_tp_mult': 2.1742498716610448, 'sideways_tsl_mult': 0.9048123340667714, 'sideways_time_stop': 32, 'sideways_use_sma': False, 'sideways_use_ema': True, 'sideways_use_atr': True, 'sideways_use_adx': True, 'sideways_use_spike': True, 'sideways_rsi_required': True}.
[I 2025-09-01 04:09:55,507] Trial 37 finished with values: [-0.06303039560540669, 0.06299160341577716] and parameters: {'p_sma': 60, 'p_std': 49, 'p_atr': 17, 'p_adx': 13, 'rsi_period': 25, 'ema1': 29, 'ema2': 52, 'slip_atr_k': 0.10995867727334988, 'slip_spread_k': 0.9979469841487081, 'spread_hl_frac': 0.04943138935872608, 'bb_std_mult': 2.2437746410432537, 'rsi_os': 24, 'rsi_ob': 92, 'vol_spike': 0.012748445340835496, 'adx_thresh': 21.945922415163697, 'atr_min_pct': 0.018442788291444228, 'atr_max_pct': 0.062231618545661366, 'tp_mult': 1.6552030895805154, 'tsl_mult': 0.7021206274227885, 'strategy': 'breakout', 'time_stop': 110, 'use_sma': True, 'use_atr': False, 'use_adx': True, 'use_ema': False, 'use_spike': True, 'rsi_required': True, 'edge_k': 1.5580748139607956, 'edge_cap': 0.452300562975764, 'bull_strategy': 'mean_reversion', 'bull_bb_std_mult': 1.6641715975149016, 'bull_rsi_os': 48, 'bull_rsi_ob': 61, 'bull_adx_thresh': 32.9107171724314, 'bull_atr_min_pct': 0.008389469550497634, 'bull_atr_max_pct': 0.0626728054444686, 'bull_tp_mult': 2.0486833887831697, 'bull_tsl_mult': 0.6518598194260132, 'bull_time_stop': 69, 'bull_use_sma': False, 'bull_use_ema': False, 'bull_use_atr': False, 'bull_use_adx': True, 'bull_use_spike': False, 'bull_rsi_required': True, 'bear_strategy': 'breakout', 'bear_bb_std_mult': 3.4731500707967236, 'bear_rsi_os': 10, 'bear_rsi_ob': 49, 'bear_adx_thresh': 20.80914677933264, 'bear_atr_min_pct': 0.014993250778832077, 'bear_atr_max_pct': 0.03586882731260141, 'bear_tp_mult': 1.046835489453251, 'bear_tsl_mult': 0.8602399485433507, 'bear_time_stop': 167, 'bear_use_sma': False, 'bear_use_ema': True, 'bear_use_atr': True, 'bear_use_adx': False, 'bear_use_spike': False, 'bear_rsi_required': False, 'sideways_strategy': 'mean_reversion', 'sideways_bb_std_mult': 2.7086309701854843, 'sideways_rsi_os': 28, 'sideways_rsi_ob': 50, 'sideways_adx_thresh': 20.817119005240464, 'sideways_atr_min_pct': 0.0001760741049357012, 'sideways_atr_max_pct': 0.13809892792000664, 'sideways_tp_mult': 2.0883263089340005, 'sideways_tsl_mult': 0.9138666377895746, 'sideways_time_stop': 30, 'sideways_use_sma': False, 'sideways_use_ema': True, 'sideways_use_atr': True, 'sideways_use_adx': True, 'sideways_use_spike': True, 'sideways_rsi_required': True}.
[I 2025-09-01 04:10:37,156] Trial 38 finished with values: [-1000000000.0, 1000000000.0] and parameters: {'p_sma': 56, 'p_std': 23, 'p_atr': 27, 'p_adx': 13, 'rsi_period': 24, 'ema1': 5, 'ema2': 54, 'slip_atr_k': 0.10082493155612884, 'slip_spread_k': 0.9415069327669577, 'spread_hl_frac': 0.04930414736570736, 'bb_std_mult': 3.0212890141153865, 'rsi_os': 25, 'rsi_ob': 93, 'vol_spike': 0.17265053982301415, 'adx_thresh': 22.141249710624376, 'atr_min_pct': 0.018172730443942443, 'atr_max_pct': 0.021538434285507398, 'tp_mult': 1.442004548344678, 'tsl_mult': 0.7244568098418065, 'strategy': 'breakout', 'time_stop': 111, 'use_sma': True, 'use_atr': False, 'use_adx': True, 'use_ema': False, 'use_spike': True, 'rsi_required': True, 'edge_k': 0.21660924410523752, 'edge_cap': 0.9897349015901002, 'bull_strategy': 'mean_reversion', 'bull_bb_std_mult': 1.7922548623304293, 'bull_rsi_os': 49, 'bull_rsi_ob': 80, 'bull_adx_thresh': 31.60561218204517, 'bull_atr_min_pct': 0.008731790328483757, 'bull_atr_max_pct': 0.059840635464254686, 'bull_tp_mult': 2.077959158392296, 'bull_tsl_mult': 0.6770800566628074, 'bull_time_stop': 184, 'bull_use_sma': False, 'bull_use_ema': False, 'bull_use_atr': False, 'bull_use_adx': True, 'bull_use_spike': False, 'bull_rsi_required': True, 'bear_strategy': 'breakout', 'bear_bb_std_mult': 3.4816789369097205, 'bear_rsi_os': 9, 'bear_rsi_ob': 54, 'bear_adx_thresh': 21.209361793413372, 'bear_atr_min_pct': 0.02185518465645421, 'bear_atr_max_pct': 0.026850578826202037, 'bear_tp_mult': 1.0667410914728648, 'bear_tsl_mult': 0.5142376389245116, 'bear_time_stop': 265, 'bear_use_sma': False, 'bear_use_ema': True, 'bear_use_atr': True, 'bear_use_adx': False, 'bear_use_spike': False, 'bear_rsi_required': False, 'sideways_strategy': 'mean_reversion', 'sideways_bb_std_mult': 2.7013028674649022, 'sideways_rsi_os': 27, 'sideways_rsi_ob': 53, 'sideways_adx_thresh': 20.666139138381382, 'sideways_atr_min_pct': 0.008620306023001767, 'sideways_atr_max_pct': 0.14018792868925523, 'sideways_tp_mult': 2.10501832212129, 'sideways_tsl_mult': 0.9425153300419977, 'sideways_time_stop': 35, 'sideways_use_sma': False, 'sideways_use_ema': True, 'sideways_use_atr': True, 'sideways_use_adx': True, 'sideways_use_spike': True, 'sideways_rsi_required': True}.
[I 2025-09-01 04:10:38,780] Trial 40 finished with values: [-1000000000.0, 1000000000.0] and parameters: {'p_sma': 33, 'p_std': 52, 'p_atr': 25, 'p_adx': 12, 'rsi_period': 23, 'ema1': 20, 'ema2': 51, 'slip_atr_k': 0.10037783295112321, 'slip_spread_k': 0.20520057781262696, 'spread_hl_frac': 0.006670778289549633, 'bb_std_mult': 3.2574530555812062, 'rsi_os': 17, 'rsi_ob': 82, 'vol_spike': 0.20547268052862347, 'adx_thresh': 22.684132878614484, 'atr_min_pct': 0.021001570292910325, 'atr_max_pct': 0.0241061213286846, 'tp_mult': 1.6545691140222853, 'tsl_mult': 0.7047238128663794, 'strategy': 'breakout', 'time_stop': 132, 'use_sma': True, 'use_atr': False, 'use_adx': True, 'use_ema': False, 'use_spike': True, 'rsi_required': True, 'edge_k': 1.1495724941111163, 'edge_cap': 0.6381496341249164, 'bull_strategy': 'mean_reversion', 'bull_bb_std_mult': 1.1626085536404278, 'bull_rsi_os': 32, 'bull_rsi_ob': 90, 'bull_adx_thresh': 28.587075476500104, 'bull_atr_min_pct': 0.014763507455394852, 'bull_atr_max_pct': 0.0344162736313136, 'bull_tp_mult': 1.9440768779130408, 'bull_tsl_mult': 0.6796203388483266, 'bull_time_stop': 61, 'bull_use_sma': False, 'bull_use_ema': False, 'bull_use_atr': False, 'bull_use_adx': True, 'bull_use_spike': False, 'bull_rsi_required': True, 'bear_strategy': 'breakout', 'bear_bb_std_mult': 3.3666795283250983, 'bear_rsi_os': 28, 'bear_rsi_ob': 55, 'bear_adx_thresh': 31.02431502525873, 'bear_atr_min_pct': 0.015327209353990045, 'bear_atr_max_pct': 0.085735112841793, 'bear_tp_mult': 1.7225995095230442, 'bear_tsl_mult': 0.5070573717393265, 'bear_time_stop': 161, 'bear_use_sma': True, 'bear_use_ema': True, 'bear_use_atr': False, 'bear_use_adx': True, 'bear_use_spike': True, 'bear_rsi_required': False, 'sideways_strategy': 'mean_reversion', 'sideways_bb_std_mult': 2.6826915231377906, 'sideways_rsi_os': 21, 'sideways_rsi_ob': 45, 'sideways_adx_thresh': 25.197948332215553, 'sideways_atr_min_pct': 0.009592392361549979, 'sideways_atr_max_pct': 0.037254739076399125, 'sideways_tp_mult': 1.7904815984062472, 'sideways_tsl_mult': 0.6407133145290046, 'sideways_time_stop': 204, 'sideways_use_sma': False, 'sideways_use_ema': True, 'sideways_use_atr': True, 'sideways_use_adx': True, 'sideways_use_spike': False, 'sideways_rsi_required': True}.
[I 2025-09-01 04:10:39,174] Trial 39 finished with values: [-1000000000.0, 1000000000.0] and parameters: {'p_sma': 32, 'p_std': 51, 'p_atr': 27, 'p_adx': 13, 'rsi_period': 24, 'ema1': 28, 'ema2': 51, 'slip_atr_k': 0.1071092573906677, 'slip_spread_k': 0.9450431125082246, 'spread_hl_frac': 0.005848095370610513, 'bb_std_mult': 3.1628243788326627, 'rsi_os': 25, 'rsi_ob': 92, 'vol_spike': 0.08548147657404571, 'adx_thresh': 22.70643935850764, 'atr_min_pct': 0.018560165562311343, 'atr_max_pct': 0.030654006809418568, 'tp_mult': 1.6377094111197266, 'tsl_mult': 0.6954428686610543, 'strategy': 'breakout', 'time_stop': 116, 'use_sma': True, 'use_atr': False, 'use_adx': True, 'use_ema': False, 'use_spike': True, 'rsi_required': True, 'edge_k': 1.1854284204186234, 'edge_cap': 0.6699766290943437, 'bull_strategy': 'mean_reversion', 'bull_bb_std_mult': 1.86992098467031, 'bull_rsi_os': 46, 'bull_rsi_ob': 61, 'bull_adx_thresh': 34.932757416053605, 'bull_atr_min_pct': 0.024262632812456407, 'bull_atr_max_pct': 0.05768829022905973, 'bull_tp_mult': 2.0865474785946105, 'bull_tsl_mult': 0.6539052287368301, 'bull_time_stop': 182, 'bull_use_sma': False, 'bull_use_ema': False, 'bull_use_atr': False, 'bull_use_adx': True, 'bull_use_spike': False, 'bull_rsi_required': True, 'bear_strategy': 'breakout', 'bear_bb_std_mult': 3.5087949777218723, 'bear_rsi_os': 28, 'bear_rsi_ob': 48, 'bear_adx_thresh': 20.73987224256266, 'bear_atr_min_pct': 0.015805008339259775, 'bear_atr_max_pct': 0.03631778880435038, 'bear_tp_mult': 1.045556163130684, 'bear_tsl_mult': 0.14817742851959304, 'bear_time_stop': 164, 'bear_use_sma': False, 'bear_use_ema': True, 'bear_use_atr': True, 'bear_use_adx': False, 'bear_use_spike': False, 'bear_rsi_required': False, 'sideways_strategy': 'mean_reversion', 'sideways_bb_std_mult': 2.7349676086039003, 'sideways_rsi_os': 28, 'sideways_rsi_ob': 53, 'sideways_adx_thresh': 7.804225566401822, 'sideways_atr_min_pct': 0.009160900290622737, 'sideways_atr_max_pct': 0.14013486374900208, 'sideways_tp_mult': 2.084136390750269, 'sideways_tsl_mult': 0.9291749617379736, 'sideways_time_stop': 200, 'sideways_use_sma': False, 'sideways_use_ema': True, 'sideways_use_atr': True, 'sideways_use_adx': True, 'sideways_use_spike': True, 'sideways_rsi_required': True}.
[I 2025-09-01 04:10:39,711] Trial 41 finished with values: [-1000000000.0, 1000000000.0] and parameters: {'p_sma': 33, 'p_std': 30, 'p_atr': 28, 'p_adx': 9, 'rsi_period': 27, 'ema1': 28, 'ema2': 49, 'slip_atr_k': 0.13283332048178514, 'slip_spread_k': 0.1432170452761964, 'spread_hl_frac': 0.006930561491491932, 'bb_std_mult': 3.23926477718939, 'rsi_os': 17, 'rsi_ob': 84, 'vol_spike': 0.2009272490259443, 'adx_thresh': 22.6635416946297, 'atr_min_pct': 0.020888986052507223, 'atr_max_pct': 0.030014003945606667, 'tp_mult': 1.8494496551634438, 'tsl_mult': 0.6658268268113048, 'strategy': 'breakout', 'time_stop': 129, 'use_sma': True, 'use_atr': True, 'use_adx': True, 'use_ema': False, 'use_spike': True, 'rsi_required': True, 'edge_k': 0.21604007969118444, 'edge_cap': 0.6702250731401291, 'bull_strategy': 'breakout', 'bull_bb_std_mult': 0.9370536597349076, 'bull_rsi_os': 32, 'bull_rsi_ob': 89, 'bull_adx_thresh': 28.63955056838137, 'bull_atr_min_pct': 0.014034468840774496, 'bull_atr_max_pct': 0.061542744686200385, 'bull_tp_mult': 1.9847512570926444, 'bull_tsl_mult': 0.8629428367289999, 'bull_time_stop': 5, 'bull_use_sma': False, 'bull_use_ema': False, 'bull_use_atr': False, 'bull_use_adx': True, 'bull_use_spike': False, 'bull_rsi_required': True, 'bear_strategy': 'breakout', 'bear_bb_std_mult': 3.3955953845047766, 'bear_rsi_os': 29, 'bear_rsi_ob': 54, 'bear_adx_thresh': 26.474381768922267, 'bear_atr_min_pct': 0.015563811796644435, 'bear_atr_max_pct': 0.0884105933459296, 'bear_tp_mult': 2.639234785513815, 'bear_tsl_mult': 0.15749819948987281, 'bear_time_stop': 257, 'bear_use_sma': True, 'bear_use_ema': False, 'bear_use_atr': False, 'bear_use_adx': True, 'bear_use_spike': True, 'bear_rsi_required': False, 'sideways_strategy': 'mean_reversion', 'sideways_bb_std_mult': 2.6604434167782394, 'sideways_rsi_os': 22, 'sideways_rsi_ob': 72, 'sideways_adx_thresh': 7.683168577071566, 'sideways_atr_min_pct': 0.00648663172523159, 'sideways_atr_max_pct': 0.04124615017274144, 'sideways_tp_mult': 1.8213379884799485, 'sideways_tsl_mult': 0.6414735106431855, 'sideways_time_stop': 132, 'sideways_use_sma': True, 'sideways_use_ema': True, 'sideways_use_atr': True, 'sideways_use_adx': True, 'sideways_use_spike': True, 'sideways_rsi_required': False}.
[I 2025-09-01 04:10:40,030] Trial 45 finished with values: [-1000000000.0, 1000000000.0] and parameters: {'p_sma': 47, 'p_std': 29, 'p_atr': 23, 'p_adx': 26, 'rsi_period': 35, 'ema1': 22, 'ema2': 44, 'slip_atr_k': 0.030900580542522413, 'slip_spread_k': 0.7351611384280932, 'spread_hl_frac': 0.03784999024458774, 'bb_std_mult': 0.7285983047804536, 'rsi_os': 21, 'rsi_ob': 95, 'vol_spike': 0.0002511138160554427, 'adx_thresh': 18.26830565380852, 'atr_min_pct': 0.027112005642875102, 'atr_max_pct': 0.017105994479276597, 'tp_mult': 2.7502315055136095, 'tsl_mult': 0.4877898403539064, 'strategy': 'breakout', 'time_stop': 99, 'use_sma': False, 'use_atr': True, 'use_adx': True, 'use_ema': False, 'use_spike': True, 'rsi_required': False, 'edge_k': 1.7836757238863383, 'edge_cap': 0.5507130478023687, 'bull_strategy': 'breakout', 'bull_bb_std_mult': 1.2862288463839227, 'bull_rsi_os': 24, 'bull_rsi_ob': 66, 'bull_adx_thresh': 5.10684155285912, 'bull_atr_min_pct': 0.02452974766342589, 'bull_atr_max_pct': 0.08954472827453543, 'bull_tp_mult': 1.7221805404004384, 'bull_tsl_mult': 0.5666692112176271, 'bull_time_stop': 85, 'bull_use_sma': True, 'bull_use_ema': False, 'bull_use_atr': True, 'bull_use_adx': True, 'bull_use_spike': True, 'bull_rsi_required': False, 'bear_strategy': 'breakout', 'bear_bb_std_mult': 2.802887414331391, 'bear_rsi_os': 5, 'bear_rsi_ob': 50, 'bear_adx_thresh': 22.961873036534286, 'bear_atr_min_pct': 0.0277355160076763, 'bear_atr_max_pct': 0.07514458487627042, 'bear_tp_mult': 1.411860455557873, 'bear_tsl_mult': 0.38253069143430735, 'bear_time_stop': 127, 'bear_use_sma': True, 'bear_use_ema': False, 'bear_use_atr': False, 'bear_use_adx': True, 'bear_use_spike': True, 'bear_rsi_required': True, 'sideways_strategy': 'mean_reversion', 'sideways_bb_std_mult': 3.295852765325065, 'sideways_rsi_os': 31, 'sideways_rsi_ob': 63, 'sideways_adx_thresh': 33.67806436796494, 'sideways_atr_min_pct': 0.025532167328997424, 'sideways_atr_max_pct': 0.06926771541831982, 'sideways_tp_mult': 2.2860930150968404, 'sideways_tsl_mult': 0.7390130180681285, 'sideways_time_stop': 255, 'sideways_use_sma': True, 'sideways_use_ema': True, 'sideways_use_atr': True, 'sideways_use_adx': True, 'sideways_use_spike': False, 'sideways_rsi_required': False}.
[I 2025-09-01 04:11:20,048] Trial 46 finished with values: [-1000000000.0, 1000000000.0] and parameters: {'p_sma': 29, 'p_std': 48, 'p_atr': 11, 'p_adx': 11, 'rsi_period': 49, 'ema1': 30, 'ema2': 37, 'slip_atr_k': 0.1403950076899342, 'slip_spread_k': 0.8249020838550285, 'spread_hl_frac': 0.021896709552414653, 'bb_std_mult': 1.2214669258954807, 'rsi_os': 49, 'rsi_ob': 91, 'vol_spike': 0.2349743457499063, 'adx_thresh': 24.76313593868283, 'atr_min_pct': 0.013454826259647489, 'atr_max_pct': 0.03930234450772361, 'tp_mult': 2.9486155815397215, 'tsl_mult': 0.8595362081721908, 'strategy': 'breakout', 'time_stop': 159, 'use_sma': False, 'use_atr': True, 'use_adx': True, 'use_ema': True, 'use_spike': True, 'rsi_required': True, 'edge_k': 1.496100390164769, 'edge_cap': 0.596463433461816, 'bull_strategy': 'breakout', 'bull_bb_std_mult': 1.5307033569832504, 'bull_rsi_os': 22, 'bull_rsi_ob': 61, 'bull_adx_thresh': 9.419627116451224, 'bull_atr_min_pct': 0.01336215472235448, 'bull_atr_max_pct': 0.1091230326796875, 'bull_tp_mult': 1.4791975932672532, 'bull_tsl_mult': 0.19495865440947352, 'bull_time_stop': 37, 'bull_use_sma': False, 'bull_use_ema': False, 'bull_use_atr': True, 'bull_use_adx': True, 'bull_use_spike': True, 'bull_rsi_required': False, 'bear_strategy': 'breakout', 'bear_bb_std_mult': 3.2507849541118907, 'bear_rsi_os': 32, 'bear_rsi_ob': 90, 'bear_adx_thresh': 25.961788219914574, 'bear_atr_min_pct': 0.012693085320353155, 'bear_atr_max_pct': 0.05808296208205199, 'bear_tp_mult': 2.755236314249383, 'bear_tsl_mult': 0.006075851238540986, 'bear_time_stop': 139, 'bear_use_sma': True, 'bear_use_ema': False, 'bear_use_atr': True, 'bear_use_adx': True, 'bear_use_spike': True, 'bear_rsi_required': False, 'sideways_strategy': 'mean_reversion', 'sideways_bb_std_mult': 3.192846771239515, 'sideways_rsi_os': 38, 'sideways_rsi_ob': 49, 'sideways_adx_thresh': 17.556530170171648, 'sideways_atr_min_pct': 0.019399843335423567, 'sideways_atr_max_pct': 0.07444283521797712, 'sideways_tp_mult': 1.170628848665575, 'sideways_tsl_mult': 0.7955544225834257, 'sideways_time_stop': 144, 'sideways_use_sma': True, 'sideways_use_ema': False, 'sideways_use_atr': True, 'sideways_use_adx': True, 'sideways_use_spike': False, 'sideways_rsi_required': True}.
[I 2025-09-01 04:11:21,940] Trial 44 finished with values: [-1000000000.0, 1000000000.0] and parameters: {'p_sma': 28, 'p_std': 31, 'p_atr': 23, 'p_adx': 30, 'rsi_period': 35, 'ema1': 22, 'ema2': 47, 'slip_atr_k': 0.13460546959919634, 'slip_spread_k': 0.7114799429099445, 'spread_hl_frac': 0.037385481452883125, 'bb_std_mult': 0.7260604420866044, 'rsi_os': 49, 'rsi_ob': 95, 'vol_spike': 0.019620156468595745, 'adx_thresh': 18.356461283026256, 'atr_min_pct': 0.02097341416510951, 'atr_max_pct': 0.03622073007159763, 'tp_mult': 2.729109746980072, 'tsl_mult': 0.8888555137535614, 'strategy': 'breakout', 'time_stop': 94, 'use_sma': False, 'use_atr': True, 'use_adx': True, 'use_ema': False, 'use_spike': True, 'rsi_required': True, 'edge_k': 1.469164352251558, 'edge_cap': 0.5801135930802314, 'bull_strategy': 'breakout', 'bull_bb_std_mult': 0.8197176634885364, 'bull_rsi_os': 23, 'bull_rsi_ob': 66, 'bull_adx_thresh': 8.388409422088149, 'bull_atr_min_pct': 0.014084768310169284, 'bull_atr_max_pct': 0.08855185047258934, 'bull_tp_mult': 1.4634439033981308, 'bull_tsl_mult': 0.8584517360561128, 'bull_time_stop': 15, 'bull_use_sma': False, 'bull_use_ema': False, 'bull_use_atr': True, 'bull_use_adx': True, 'bull_use_spike': True, 'bull_rsi_required': False, 'bear_strategy': 'breakout', 'bear_bb_std_mult': 3.297250359303175, 'bear_rsi_os': 32, 'bear_rsi_ob': 86, 'bear_adx_thresh': 26.292613581309617, 'bear_atr_min_pct': 0.026904303472305532, 'bear_atr_max_pct': 0.07651107424345154, 'bear_tp_mult': 2.808419156662293, 'bear_tsl_mult': 0.3679732694996156, 'bear_time_stop': 137, 'bear_use_sma': True, 'bear_use_ema': False, 'bear_use_atr': False, 'bear_use_adx': True, 'bear_use_spike': True, 'bear_rsi_required': True, 'sideways_strategy': 'mean_reversion', 'sideways_bb_std_mult': 3.291520822317998, 'sideways_rsi_os': 32, 'sideways_rsi_ob': 72, 'sideways_adx_thresh': 29.365505889074445, 'sideways_atr_min_pct': 0.025658955538828895, 'sideways_atr_max_pct': 0.07016782100878909, 'sideways_tp_mult': 1.8364046903663793, 'sideways_tsl_mult': 0.7384878523295497, 'sideways_time_stop': 138, 'sideways_use_sma': True, 'sideways_use_ema': True, 'sideways_use_atr': True, 'sideways_use_adx': True, 'sideways_use_spike': False, 'sideways_rsi_required': False}.
