[I 2025-09-01 05:02:02,401] Trial 348 finished with values: [-1000000000.0, 1000000000.0] and parameters: {'p_sma': 27, 'p_std': 52, 'p_atr': 29, 'p_adx': 26, 'rsi_period': 13, 'ema1': 22, 'ema2': 29, 'slip_atr_k': 0.13759908152624759, 'slip_spread_k': 0.28000241937395204, 'spread_hl_frac': 0.01871499576130995, 'bb_std_mult': 3.528983881424258, 'rsi_os': 25, 'rsi_ob': 89, 'vol_spike': 0.2974223513526626, 'adx_thresh': 15.554311074273345, 'atr_min_pct': 0.027365396342544288, 'atr_max_pct': 0.11557430682166299, 'tp_mult': 2.5118801308291596, 'tsl_mult': 0.9804749491608921, 'strategy': 'mean_reversion', 'time_stop': 159, 'use_sma': False, 'use_atr': False, 'use_adx': True, 'use_ema': True, 'use_spike': False, 'rsi_required': True, 'edge_k': 1.6990930925675753, 'edge_cap': 0.6221299261587107, 'bull_strategy': 'breakout', 'bull_bb_std_mult': 1.6195471210466845, 'bull_rsi_os': 50, 'bull_rsi_ob': 91, 'bull_adx_thresh': 33.21114770185967, 'bull_atr_min_pct': 0.0023274515795771228, 'bull_atr_max_pct': 0.10823251368946667, 'bull_tp_mult': 2.3833753587979682, 'bull_tsl_mult': 0.7095948664391152, 'bull_time_stop': 182, 'bull_use_sma': False, 'bull_use_ema': False, 'bull_use_atr': False, 'bull_use_adx': False, 'bull_use_spike': True, 'bull_rsi_required': True, 'bear_strategy': 'mean_reversion', 'bear_bb_std_mult': 0.7143181109116025, 'bear_rsi_os': 14, 'bear_rsi_ob': 63, 'bear_adx_thresh': 30.4623891758828, 'bear_atr_min_pct': 0.021336603379115342, 'bear_atr_max_pct': 0.060088115656560685, 'bear_tp_mult': 1.6544304939288257, 'bear_tsl_mult': 0.6449961477973695, 'bear_time_stop': 211, 'bear_use_sma': False, 'bear_use_ema': True, 'bear_use_atr': False, 'bear_use_adx': False, 'bear_use_spike': True, 'bear_rsi_required': True, 'sideways_strategy': 'breakout', 'sideways_bb_std_mult': 0.7216670896319575, 'sideways_rsi_os': 54, 'sideways_rsi_ob': 78, 'sideways_adx_thresh': 19.65481557193614, 'sideways_atr_min_pct': 0.023012334119210866, 'sideways_atr_max_pct': 0.14322505517846018, 'sideways_tp_mult': 2.0007708114048546, 'sideways_tsl_mult': 0.18532065950058202, 'sideways_time_stop': 172, 'sideways_use_sma': False, 'sideways_use_ema': True, 'sideways_use_atr': False, 'sideways_use_adx': True, 'sideways_use_spike': True, 'sideways_rsi_required': False}.
[I 2025-09-01 05:02:47,593] Trial 354 finished with values: [-1000000000.0, 1000000000.0] and parameters: {'p_sma': 22, 'p_std': 56, 'p_atr': 15, 'p_adx': 19, 'rsi_period': 9, 'ema1': 8, 'ema2': 43, 'slip_atr_k': 0.14976265683424067, 'slip_spread_k': 0.2842833378926429, 'spread_hl_frac': 0.04479973109682317, 'bb_std_mult': 3.423149337421863, 'rsi_os': 14, 'rsi_ob': 75, 'vol_spike': 0.16326702557504952, 'adx_thresh': 25.609955233325536, 'atr_min_pct': 0.023324597046782265, 'atr_max_pct': 0.043602907864909723, 'tp_mult': 1.5542967622389425, 'tsl_mult': 0.6743835034741523, 'strategy': 'breakout', 'time_stop': 100, 'use_sma': False, 'use_atr': False, 'use_adx': False, 'use_ema': True, 'use_spike': True, 'rsi_required': False, 'edge_k': 0.5303591848478885, 'edge_cap': 0.45815109946068144, 'bull_strategy': 'breakout', 'bull_bb_std_mult': 2.088648341601182, 'bull_rsi_os': 46, 'bull_rsi_ob': 49, 'bull_adx_thresh': 18.37772312118887, 'bull_atr_min_pct': 0.025119074339054585, 'bull_atr_max_pct': 0.11547507146173012, 'bull_tp_mult': 1.5978669281013782, 'bull_tsl_mult': 0.44185048009371686, 'bull_time_stop': 85, 'bull_use_sma': True, 'bull_use_ema': False, 'bull_use_atr': False, 'bull_use_adx': False, 'bull_use_spike': False, 'bull_rsi_required': True, 'bear_strategy': 'mean_reversion', 'bear_bb_std_mult': 2.48297033990616, 'bear_rsi_os': 38, 'bear_rsi_ob': 64, 'bear_adx_thresh': 34.665561112339695, 'bear_atr_min_pct': 0.02942239460218211, 'bear_atr_max_pct': 0.06919534022077221, 'bear_tp_mult': 1.7491896130880067, 'bear_tsl_mult': 0.46699724994191566, 'bear_time_stop': 60, 'bear_use_sma': True, 'bear_use_ema': False, 'bear_use_atr': False, 'bear_use_adx': False, 'bear_use_spike': False, 'bear_rsi_required': False, 'sideways_strategy': 'breakout', 'sideways_bb_std_mult': 0.8013177615056472, 'sideways_rsi_os': 18, 'sideways_rsi_ob': 61, 'sideways_adx_thresh': 17.79029147802531, 'sideways_atr_min_pct': 0.01867586307975512, 'sideways_atr_max_pct': 0.06930913625738591, 'sideways_tp_mult': 2.1109350730769334, 'sideways_tsl_mult': 0.19286157975229257, 'sideways_time_stop': 153, 'sideways_use_sma': True, 'sideways_use_ema': True, 'sideways_use_atr': False, 'sideways_use_adx': False, 'sideways_use_spike': True, 'sideways_rsi_required': False}.
[I 2025-09-01 05:02:48,873] Trial 352 finished with values: [-1000000000.0, 1000000000.0] and parameters: {'p_sma': 23, 'p_std': 58, 'p_atr': 14, 'p_adx': 19, 'rsi_period': 13, 'ema1': 26, 'ema2': 53, 'slip_atr_k': 0.014545066142655171, 'slip_spread_k': 0.278545886439046, 'spread_hl_frac': 0.04623365187624654, 'bb_std_mult': 3.399485510788171, 'rsi_os': 23, 'rsi_ob': 77, 'vol_spike': 0.2721536393743056, 'adx_thresh': 25.571614800760607, 'atr_min_pct': 0.024394298661029157, 'atr_max_pct': 0.027653165448349566, 'tp_mult': 1.5581111573529776, 'tsl_mult': 0.0018673313944140846, 'strategy': 'breakout', 'time_stop': 47, 'use_sma': False, 'use_atr': False, 'use_adx': False, 'use_ema': True, 'use_spike': True, 'rsi_required': False, 'edge_k': 1.6748061536822614, 'edge_cap': 0.4585312559604105, 'bull_strategy': 'breakout', 'bull_bb_std_mult': 2.3268010276012294, 'bull_rsi_os': 46, 'bull_rsi_ob': 89, 'bull_adx_thresh': 18.010328865031482, 'bull_atr_min_pct': 0.013749583700922408, 'bull_atr_max_pct': 0.11664704870048727, 'bull_tp_mult': 1.9229775322984033, 'bull_tsl_mult': 0.9958380523421532, 'bull_time_stop': 85, 'bull_use_sma': True, 'bull_use_ema': False, 'bull_use_atr': False, 'bull_use_adx': False, 'bull_use_spike': False, 'bull_rsi_required': True, 'bear_strategy': 'mean_reversion', 'bear_bb_std_mult': 1.9252804290581091, 'bear_rsi_os': 7, 'bear_rsi_ob': 64, 'bear_adx_thresh': 27.790702196438044, 'bear_atr_min_pct': 0.029355694204600755, 'bear_atr_max_pct': 0.07498105417291295, 'bear_tp_mult': 1.4459558070661689, 'bear_tsl_mult': 0.47697730008784034, 'bear_time_stop': 202, 'bear_use_sma': True, 'bear_use_ema': False, 'bear_use_atr': False, 'bear_use_adx': False, 'bear_use_spike': False, 'bear_rsi_required': False, 'sideways_strategy': 'breakout', 'sideways_bb_std_mult': 0.715699065188815, 'sideways_rsi_os': 39, 'sideways_rsi_ob': 81, 'sideways_adx_thresh': 31.740638991591684, 'sideways_atr_min_pct': 0.023337586484496787, 'sideways_atr_max_pct': 0.06005597306641701, 'sideways_tp_mult': 2.0924661039702865, 'sideways_tsl_mult': 0.3466123626160631, 'sideways_time_stop': 157, 'sideways_use_sma': True, 'sideways_use_ema': True, 'sideways_use_atr': False, 'sideways_use_adx': False, 'sideways_use_spike': True, 'sideways_rsi_required': False}.
[I 2025-09-01 05:02:49,417] Trial 353 finished with values: [-1000000000.0, 1000000000.0] and parameters: {'p_sma': 22, 'p_std': 54, 'p_atr': 27, 'p_adx': 19, 'rsi_period': 22, 'ema1': 17, 'ema2': 44, 'slip_atr_k': 0.020081075229957057, 'slip_spread_k': 0.7946543879497987, 'spread_hl_frac': 0.04618504398156645, 'bb_std_mult': 3.40238162837743, 'rsi_os': 34, 'rsi_ob': 75, 'vol_spike': 0.27213640584535853, 'adx_thresh': 15.840338589555625, 'atr_min_pct': 0.02332857827986344, 'atr_max_pct': 0.11542708619469953, 'tp_mult': 2.24005677063942, 'tsl_mult': 0.9527507669954811, 'strategy': 'breakout', 'time_stop': 159, 'use_sma': False, 'use_atr': False, 'use_adx': False, 'use_ema': True, 'use_spike': True, 'rsi_required': False, 'edge_k': 0.4918614528135178, 'edge_cap': 0.45299782271295125, 'bull_strategy': 'breakout', 'bull_bb_std_mult': 2.088084322465678, 'bull_rsi_os': 21, 'bull_rsi_ob': 89, 'bull_adx_thresh': 18.202966689836494, 'bull_atr_min_pct': 0.002253614010002824, 'bull_atr_max_pct': 0.11653777705614309, 'bull_tp_mult': 2.6092669653293497, 'bull_tsl_mult': 0.5271882483308257, 'bull_time_stop': 245, 'bull_use_sma': True, 'bull_use_ema': False, 'bull_use_atr': False, 'bull_use_adx': False, 'bull_use_spike': False, 'bull_rsi_required': True, 'bear_strategy': 'mean_reversion', 'bear_bb_std_mult': 2.494919425481559, 'bear_rsi_os': 7, 'bear_rsi_ob': 64, 'bear_adx_thresh': 30.54590050179425, 'bear_atr_min_pct': 0.013195805754779535, 'bear_atr_max_pct': 0.07531005524799732, 'bear_tp_mult': 1.739337529739028, 'bear_tsl_mult': 0.680635907155876, 'bear_time_stop': 156, 'bear_use_sma': True, 'bear_use_ema': True, 'bear_use_atr': False, 'bear_use_adx': False, 'bear_use_spike': False, 'bear_rsi_required': False, 'sideways_strategy': 'breakout', 'sideways_bb_std_mult': 0.7715388521742305, 'sideways_rsi_os': 24, 'sideways_rsi_ob': 63, 'sideways_adx_thresh': 6.295832483754362, 'sideways_atr_min_pct': 0.0197896230467045, 'sideways_atr_max_pct': 0.06938049476933311, 'sideways_tp_mult': 2.1082127681041882, 'sideways_tsl_mult': 0.9567401251671201, 'sideways_time_stop': 185, 'sideways_use_sma': True, 'sideways_use_ema': True, 'sideways_use_atr': False, 'sideways_use_adx': False, 'sideways_use_spike': True, 'sideways_rsi_required': False}.
[I 2025-09-01 05:02:50,150] Trial 355 finished with values: [-0.019334688249841192, 0.01915978653162626] and parameters: {'p_sma': 23, 'p_std': 56, 'p_atr': 15, 'p_adx': 21, 'rsi_period': 9, 'ema1': 26, 'ema2': 42, 'slip_atr_k': 0.08942417723322134, 'slip_spread_k': 0.23741226254739556, 'spread_hl_frac': 0.044701950235692164, 'bb_std_mult': 3.346583487754013, 'rsi_os': 15, 'rsi_ob': 86, 'vol_spike': 0.11259076580784298, 'adx_thresh': 25.38777656528539, 'atr_min_pct': 0.02350192590052045, 'atr_max_pct': 0.11273963224941652, 'tp_mult': 1.2025271813167904, 'tsl_mult': 0.0010136350952343331, 'strategy': 'breakout', 'time_stop': 45, 'use_sma': False, 'use_atr': True, 'use_adx': False, 'use_ema': True, 'use_spike': True, 'rsi_required': False, 'edge_k': 0.5337137627609976, 'edge_cap': 0.4593298561531179, 'bull_strategy': 'breakout', 'bull_bb_std_mult': 2.333455865586876, 'bull_rsi_os': 21, 'bull_rsi_ob': 89, 'bull_adx_thresh': 8.87723509169648, 'bull_atr_min_pct': 0.0014380100377741898, 'bull_atr_max_pct': 0.022088115132341074, 'bull_tp_mult': 1.9255577272791211, 'bull_tsl_mult': 0.4233642562309691, 'bull_time_stop': 245, 'bull_use_sma': True, 'bull_use_ema': False, 'bull_use_atr': False, 'bull_use_adx': False, 'bull_use_spike': False, 'bull_rsi_required': True, 'bear_strategy': 'mean_reversion', 'bear_bb_std_mult': 1.619870719290112, 'bear_rsi_os': 34, 'bear_rsi_ob': 65, 'bear_adx_thresh': 34.895970471476794, 'bear_atr_min_pct': 0.02956979862788613, 'bear_atr_max_pct': 0.06847821162575675, 'bear_tp_mult': 1.5516098298438048, 'bear_tsl_mult': 0.5765053357153455, 'bear_time_stop': 79, 'bear_use_sma': True, 'bear_use_ema': False, 'bear_use_atr': False, 'bear_use_adx': False, 'bear_use_spike': False, 'bear_rsi_required': False, 'sideways_strategy': 'breakout', 'sideways_bb_std_mult': 0.9861062954072282, 'sideways_rsi_os': 33, 'sideways_rsi_ob': 64, 'sideways_adx_thresh': 6.442556824971197, 'sideways_atr_min_pct': 0.015376311238022324, 'sideways_atr_max_pct': 0.06909622236982536, 'sideways_tp_mult': 2.118403910948841, 'sideways_tsl_mult': 0.9585500601848918, 'sideways_time_stop': 153, 'sideways_use_sma': True, 'sideways_use_ema': True, 'sideways_use_atr': False, 'sideways_use_adx': False, 'sideways_use_spike': True, 'sideways_rsi_required': False}.
[I 2025-09-01 05:03:34,036] Trial 356 finished with values: [-0.017937431990181496, 0.017833990400224802] and parameters: {'p_sma': 26, 'p_std': 54, 'p_atr': 27, 'p_adx': 21, 'rsi_period': 10, 'ema1': 17, 'ema2': 28, 'slip_atr_k': 0.08929086641147424, 'slip_spread_k': 0.7602228622319174, 'spread_hl_frac': 0.04604055189991877, 'bb_std_mult': 3.35510155212149, 'rsi_os': 15, 'rsi_ob': 92, 'vol_spike': 0.17381691788781495, 'adx_thresh': 21.243473598621055, 'atr_min_pct': 0.018986691270956976, 'atr_max_pct': 0.02681268882900331, 'tp_mult': 2.7863702588407455, 'tsl_mult': 0.9542330461690977, 'strategy': 'breakout', 'time_stop': 46, 'use_sma': False, 'use_atr': True, 'use_adx': False, 'use_ema': True, 'use_spike': True, 'rsi_required': False, 'edge_k': 1.8945014904773347, 'edge_cap': 0.34679204790340296, 'bull_strategy': 'breakout', 'bull_bb_std_mult': 2.336035297451127, 'bull_rsi_os': 22, 'bull_rsi_ob': 89, 'bull_adx_thresh': 18.054262206373313, 'bull_atr_min_pct': 0.0013135033284943753, 'bull_atr_max_pct': 0.12191216278388649, 'bull_tp_mult': 1.9369620185882446, 'bull_tsl_mult': 0.42556838117722473, 'bull_time_stop': 38, 'bull_use_sma': True, 'bull_use_ema': False, 'bull_use_atr': False, 'bull_use_adx': True, 'bull_use_spike': False, 'bull_rsi_required': True, 'bear_strategy': 'breakout', 'bear_bb_std_mult': 0.805092775095047, 'bear_rsi_os': 22, 'bear_rsi_ob': 66, 'bear_adx_thresh': 31.850847781679473, 'bear_atr_min_pct': 0.013722747330602525, 'bear_atr_max_pct': 0.058039037641788624, 'bear_tp_mult': 1.8420044180601303, 'bear_tsl_mult': 0.6854097295887567, 'bear_time_stop': 149, 'bear_use_sma': True, 'bear_use_ema': False, 'bear_use_atr': False, 'bear_use_adx': False, 'bear_use_spike': False, 'bear_rsi_required': False, 'sideways_strategy': 'breakout', 'sideways_bb_std_mult': 0.978514533890483, 'sideways_rsi_os': 35, 'sideways_rsi_ob': 63, 'sideways_adx_thresh': 6.40472292443553, 'sideways_atr_min_pct': 0.00914842179761895, 'sideways_atr_max_pct': 0.07909886146796899, 'sideways_tp_mult': 1.5839912211091793, 'sideways_tsl_mult': 0.9573981275806276, 'sideways_time_stop': 130, 'sideways_use_sma': True, 'sideways_use_ema': True, 'sideways_use_atr': True, 'sideways_use_adx': False, 'sideways_use_spike': True, 'sideways_rsi_required': False}.
[I 2025-09-01 05:03:34,553] Trial 357 finished with values: [-0.024651555103237688, 0.024462506388785683] and parameters: {'p_sma': 24, 'p_std': 54, 'p_atr': 27, 'p_adx': 21, 'rsi_period': 16, 'ema1': 17, 'ema2': 21, 'slip_atr_k': 0.057131939376635923, 'slip_spread_k': 0.9579273206247669, 'spread_hl_frac': 0.024464254536250785, 'bb_std_mult': 3.163330029835781, 'rsi_os': 29, 'rsi_ob': 92, 'vol_spike': 0.169849837916474, 'adx_thresh': 14.11066626666916, 'atr_min_pct': 0.028802757653201193, 'atr_max_pct': 0.11111352833808183, 'tp_mult': 1.7314518784943158, 'tsl_mult': 0.39095679822514245, 'strategy': 'breakout', 'time_stop': 30, 'use_sma': False, 'use_atr': True, 'use_adx': False, 'use_ema': True, 'use_spike': True, 'rsi_required': False, 'edge_k': 0.5640619541426806, 'edge_cap': 0.34707596469369545, 'bull_strategy': 'breakout', 'bull_bb_std_mult': 3.0932847984531024, 'bull_rsi_os': 10, 'bull_rsi_ob': 89, 'bull_adx_thresh': 18.481893588199338, 'bull_atr_min_pct': 0.0013549814109091868, 'bull_atr_max_pct': 0.12144444684480421, 'bull_tp_mult': 2.7836874785532926, 'bull_tsl_mult': 0.4171464868121632, 'bull_time_stop': 164, 'bull_use_sma': True, 'bull_use_ema': False, 'bull_use_atr': False, 'bull_use_adx': True, 'bull_use_spike': False, 'bull_rsi_required': True, 'bear_strategy': 'breakout', 'bear_bb_std_mult': 0.8194460589412218, 'bear_rsi_os': 35, 'bear_rsi_ob': 66, 'bear_adx_thresh': 31.791369261049393, 'bear_atr_min_pct': 0.0046115164489370294, 'bear_atr_max_pct': 0.0677376863720775, 'bear_tp_mult': 1.5459032468950402, 'bear_tsl_mult': 0.6830921081107846, 'bear_time_stop': 284, 'bear_use_sma': True, 'bear_use_ema': False, 'bear_use_atr': False, 'bear_use_adx': False, 'bear_use_spike': False, 'bear_rsi_required': False, 'sideways_strategy': 'breakout', 'sideways_bb_std_mult': 0.95041785010264, 'sideways_rsi_os': 34, 'sideways_rsi_ob': 54, 'sideways_adx_thresh': 17.852292076962712, 'sideways_atr_min_pct': 0.009382395929723363, 'sideways_atr_max_pct': 0.12426936550220807, 'sideways_tp_mult': 1.5714276250232868, 'sideways_tsl_mult': 0.6997836810298802, 'sideways_time_stop': 188, 'sideways_use_sma': True, 'sideways_use_ema': True, 'sideways_use_atr': True, 'sideways_use_adx': False, 'sideways_use_spike': True, 'sideways_rsi_required': False}.
[I 2025-09-01 05:03:34,869] Trial 358 finished with values: [-0.02201452746660726, 0.021826640028857074] and parameters: {'p_sma': 29, 'p_std': 53, 'p_atr': 22, 'p_adx': 18, 'rsi_period': 16, 'ema1': 29, 'ema2': 21, 'slip_atr_k': 0.18860227290598552, 'slip_spread_k': 0.24423200501826348, 'spread_hl_frac': 0.036426238437204626, 'bb_std_mult': 3.1493445138065272, 'rsi_os': 18, 'rsi_ob': 86, 'vol_spike': 0.09302602167253564, 'adx_thresh': 14.177762072248427, 'atr_min_pct': 0.021983339088193943, 'atr_max_pct': 0.11061317581177582, 'tp_mult': 2.552451955177945, 'tsl_mult': 0.2446629455254612, 'strategy': 'breakout', 'time_stop': 31, 'use_sma': False, 'use_atr': True, 'use_adx': False, 'use_ema': True, 'use_spike': True, 'rsi_required': False, 'edge_k': 0.5451180079605508, 'edge_cap': 0.34591090282188514, 'bull_strategy': 'breakout', 'bull_bb_std_mult': 3.5126070873509665, 'bull_rsi_os': 10, 'bull_rsi_ob': 88, 'bull_adx_thresh': 17.533098447305186, 'bull_atr_min_pct': 0.0016372084834405055, 'bull_atr_max_pct': 0.12168582517464963, 'bull_tp_mult': 1.5499177517415734, 'bull_tsl_mult': 0.4203386019855895, 'bull_time_stop': 26, 'bull_use_sma': True, 'bull_use_ema': False, 'bull_use_atr': False, 'bull_use_adx': True, 'bull_use_spike': False, 'bull_rsi_required': True, 'bear_strategy': 'breakout', 'bear_bb_std_mult': 2.893310252452398, 'bear_rsi_os': 22, 'bear_rsi_ob': 66, 'bear_adx_thresh': 23.814626588175607, 'bear_atr_min_pct': 0.028243283593699486, 'bear_atr_max_pct': 0.06706785109916093, 'bear_tp_mult': 1.5142107072786806, 'bear_tsl_mult': 0.7182763062399755, 'bear_time_stop': 71, 'bear_use_sma': True, 'bear_use_ema': False, 'bear_use_atr': False, 'bear_use_adx': False, 'bear_use_spike': False, 'bear_rsi_required': False, 'sideways_strategy': 'breakout', 'sideways_bb_std_mult': 0.9902266251588221, 'sideways_rsi_os': 48, 'sideways_rsi_ob': 69, 'sideways_adx_thresh': 26.922019572701384, 'sideways_atr_min_pct': 0.024475489448191917, 'sideways_atr_max_pct': 0.1234740384006495, 'sideways_tp_mult': 1.6313877203425649, 'sideways_tsl_mult': 0.9368759077839611, 'sideways_time_stop': 188, 'sideways_use_sma': True, 'sideways_use_ema': True, 'sideways_use_atr': True, 'sideways_use_adx': False, 'sideways_use_spike': True, 'sideways_rsi_required': False}.
[I 2025-09-01 05:03:35,210] Trial 359 finished with values: [-0.02381830752679548, 0.02364787645734834] and parameters: {'p_sma': 24, 'p_std': 57, 'p_atr': 23, 'p_adx': 18, 'rsi_period': 9, 'ema1': 15, 'ema2': 21, 'slip_atr_k': 0.08720892655013499, 'slip_spread_k': 0.07591651395792881, 'spread_hl_frac': 0.012209041071751118, 'bb_std_mult': 3.322937356411111, 'rsi_os': 31, 'rsi_ob': 86, 'vol_spike': 0.03234460087127772, 'adx_thresh': 14.025839675925347, 'atr_min_pct': 0.01908608360258837, 'atr_max_pct': 0.11244495323300888, 'tp_mult': 2.800830291271663, 'tsl_mult': 0.24084731948759036, 'strategy': 'breakout', 'time_stop': 30, 'use_sma': False, 'use_atr': True, 'use_adx': False, 'use_ema': True, 'use_spike': True, 'rsi_required': False, 'edge_k': 1.5718148607968963, 'edge_cap': 0.5053909307342632, 'bull_strategy': 'breakout', 'bull_bb_std_mult': 2.3490662234461452, 'bull_rsi_os': 24, 'bull_rsi_ob': 71, 'bull_adx_thresh': 8.738212332253445, 'bull_atr_min_pct': 0.0014021142126227322, 'bull_atr_max_pct': 0.11243736317369639, 'bull_tp_mult': 1.5623655292307084, 'bull_tsl_mult': 0.42082226377787074, 'bull_time_stop': 236, 'bull_use_sma': True, 'bull_use_ema': False, 'bull_use_atr': False, 'bull_use_adx': True, 'bull_use_spike': False, 'bull_rsi_required': True, 'bear_strategy': 'breakout', 'bear_bb_std_mult': 1.6438577770087148, 'bear_rsi_os': 27, 'bear_rsi_ob': 65, 'bear_adx_thresh': 31.776158315519385, 'bear_atr_min_pct': 0.004331501139661034, 'bear_atr_max_pct': 0.06765851694035874, 'bear_tp_mult': 1.2339193363228984, 'bear_tsl_mult': 0.7135645897276313, 'bear_time_stop': 80, 'bear_use_sma': True, 'bear_use_ema': False, 'bear_use_atr': False, 'bear_use_adx': False, 'bear_use_spike': False, 'bear_rsi_required': False, 'sideways_strategy': 'breakout', 'sideways_bb_std_mult': 0.9501727427877444, 'sideways_rsi_os': 35, 'sideways_rsi_ob': 58, 'sideways_adx_thresh': 17.797082651761276, 'sideways_atr_min_pct': 0.024721078676832903, 'sideways_atr_max_pct': 0.055336870106149176, 'sideways_tp_mult': 2.1673837077970948, 'sideways_tsl_mult': 0.7000443310146452, 'sideways_time_stop': 188, 'sideways_use_sma': True, 'sideways_use_ema': True, 'sideways_use_atr': True, 'sideways_use_adx': False, 'sideways_use_spike': True, 'sideways_rsi_required': False}.
