[I 2025-09-01 05:41:33,378] Trial 564 finished with values: [-0.03331721229287066, 0.033228026966451996] and parameters: {'p_sma': 59, 'p_std': 31, 'p_atr': 10, 'p_adx': 17, 'rsi_period': 54, 'ema1': 13, 'ema2': 55, 'slip_atr_k': 0.14184352950461365, 'slip_spread_k': 0.4624848489191098, 'spread_hl_frac': 0.04709313087620629, 'bb_std_mult': 1.4406315742984463, 'rsi_os': 25, 'rsi_ob': 89, 'vol_spike': 0.21013034907472652, 'adx_thresh': 14.490930902044846, 'atr_min_pct': 0.006038322295740939, 'atr_max_pct': 0.1289228069258503, 'tp_mult': 2.5869379734072493, 'tsl_mult': 0.9560476426551918, 'strategy': 'breakout', 'time_stop': 101, 'use_sma': False, 'use_atr': True, 'use_adx': False, 'use_ema': False, 'use_spike': True, 'rsi_required': False, 'edge_k': 0.21284732631211087, 'edge_cap': 0.06909082559756347, 'bull_strategy': 'mean_reversion', 'bull_bb_std_mult': 0.9225865046111708, 'bull_rsi_os': 46, 'bull_rsi_ob': 88, 'bull_adx_thresh': 5.634424718834293, 'bull_atr_min_pct': 0.013482865420129542, 'bull_atr_max_pct': 0.10029288181414514, 'bull_tp_mult': 1.3153878234040968, 'bull_tsl_mult': 0.19462657521616547, 'bull_time_stop': 28, 'bull_use_sma': True, 'bull_use_ema': True, 'bull_use_atr': False, 'bull_use_adx': True, 'bull_use_spike': False, 'bull_rsi_required': True, 'bear_strategy': 'breakout', 'bear_bb_std_mult': 1.468105792841735, 'bear_rsi_os': 54, 'bear_rsi_ob': 66, 'bear_adx_thresh': 29.060785041435725, 'bear_atr_min_pct': 0.007683501437052875, 'bear_atr_max_pct': 0.044425787866883316, 'bear_tp_mult': 2.651906579910676, 'bear_tsl_mult': 0.61937417033212, 'bear_time_stop': 110, 'bear_use_sma': True, 'bear_use_ema': True, 'bear_use_atr': False, 'bear_use_adx': False, 'bear_use_spike': False, 'bear_rsi_required': True, 'sideways_strategy': 'breakout', 'sideways_bb_std_mult': 2.7143374329766203, 'sideways_rsi_os': 44, 'sideways_rsi_ob': 84, 'sideways_adx_thresh': 22.250159438821274, 'sideways_atr_min_pct': 0.003865446205443642, 'sideways_atr_max_pct': 0.10394693572052341, 'sideways_tp_mult': 1.6162616813027835, 'sideways_tsl_mult': 0.6049767398759864, 'sideways_time_stop': 82, 'sideways_use_sma': False, 'sideways_use_ema': True, 'sideways_use_atr': True, 'sideways_use_adx': False, 'sideways_use_spike': False, 'sideways_rsi_required': True}.
[I 2025-09-01 05:42:12,655] Trial 568 finished with values: [-1000000000.0, 1000000000.0] and parameters: {'p_sma': 59, 'p_std': 32, 'p_atr': 7, 'p_adx': 18, 'rsi_period': 52, 'ema1': 7, 'ema2': 20, 'slip_atr_k': 0.18896313624178587, 'slip_spread_k': 0.46120129278431415, 'spread_hl_frac': 0.047021058770836933, 'bb_std_mult': 0.6846559425836036, 'rsi_os': 25, 'rsi_ob': 89, 'vol_spike': 0.2104919175625451, 'adx_thresh': 5.798832881251029, 'atr_min_pct': 0.002978739718782029, 'atr_max_pct': 0.09264896739948246, 'tp_mult': 2.486654014369456, 'tsl_mult': 0.6688298298307582, 'strategy': 'breakout', 'time_stop': 183, 'use_sma': False, 'use_atr': True, 'use_adx': False, 'use_ema': True, 'use_spike': True, 'rsi_required': False, 'edge_k': 0.21085607464316575, 'edge_cap': 0.5145658282673596, 'bull_strategy': 'mean_reversion', 'bull_bb_std_mult': 0.8562153880902125, 'bull_rsi_os': 46, 'bull_rsi_ob': 79, 'bull_adx_thresh': 30.4069332021167, 'bull_atr_min_pct': 0.013840485548005706, 'bull_atr_max_pct': 0.11132833483507495, 'bull_tp_mult': 1.3224866031551528, 'bull_tsl_mult': 0.6082514080983019, 'bull_time_stop': 97, 'bull_use_sma': True, 'bull_use_ema': False, 'bull_use_atr': False, 'bull_use_adx': True, 'bull_use_spike': False, 'bull_rsi_required': True, 'bear_strategy': 'breakout', 'bear_bb_std_mult': 1.4765900934404548, 'bear_rsi_os': 8, 'bear_rsi_ob': 90, 'bear_adx_thresh': 6.371708599971621, 'bear_atr_min_pct': 0.006901849392696742, 'bear_atr_max_pct': 0.0672556705360385, 'bear_tp_mult': 2.648852376026014, 'bear_tsl_mult': 0.6045000356370007, 'bear_time_stop': 201, 'bear_use_sma': True, 'bear_use_ema': True, 'bear_use_atr': False, 'bear_use_adx': True, 'bear_use_spike': False, 'bear_rsi_required': True, 'sideways_strategy': 'breakout', 'sideways_bb_std_mult': 0.6269492636438194, 'sideways_rsi_os': 44, 'sideways_rsi_ob': 54, 'sideways_adx_thresh': 7.422341563881481, 'sideways_atr_min_pct': 0.01932209941245778, 'sideways_atr_max_pct': 0.10027325796784832, 'sideways_tp_mult': 1.627624037848021, 'sideways_tsl_mult': 0.14032885985083143, 'sideways_time_stop': 59, 'sideways_use_sma': False, 'sideways_use_ema': True, 'sideways_use_atr': True, 'sideways_use_adx': False, 'sideways_use_spike': False, 'sideways_rsi_required': True}.
[I 2025-09-01 05:42:12,986] Trial 571 finished with values: [-1000000000.0, 1000000000.0] and parameters: {'p_sma': 48, 'p_std': 35, 'p_atr': 17, 'p_adx': 28, 'rsi_period': 52, 'ema1': 18, 'ema2': 31, 'slip_atr_k': 0.24975859525920588, 'slip_spread_k': 0.37172687019065626, 'spread_hl_frac': 0.02260367417190038, 'bb_std_mult': 2.2142398468527325, 'rsi_os': 24, 'rsi_ob': 88, 'vol_spike': 0.01947894999610511, 'adx_thresh': 5.703219194151803, 'atr_min_pct': 0.005104217089001412, 'atr_max_pct': 0.12517411219431082, 'tp_mult': 2.4942743990456178, 'tsl_mult': 0.44948670519678213, 'strategy': 'breakout', 'time_stop': 185, 'use_sma': True, 'use_atr': True, 'use_adx': False, 'use_ema': True, 'use_spike': True, 'rsi_required': True, 'edge_k': 0.3624842559018365, 'edge_cap': 0.3910163385626541, 'bull_strategy': 'breakout', 'bull_bb_std_mult': 3.1686892534673206, 'bull_rsi_os': 49, 'bull_rsi_ob': 58, 'bull_adx_thresh': 6.570975923805564, 'bull_atr_min_pct': 0.01483402093987483, 'bull_atr_max_pct': 0.11124119331946876, 'bull_tp_mult': 2.2188327020398755, 'bull_tsl_mult': 0.21904129716367984, 'bull_time_stop': 97, 'bull_use_sma': True, 'bull_use_ema': False, 'bull_use_atr': False, 'bull_use_adx': True, 'bull_use_spike': False, 'bull_rsi_required': True, 'bear_strategy': 'breakout', 'bear_bb_std_mult': 2.261334963886352, 'bear_rsi_os': 28, 'bear_rsi_ob': 46, 'bear_adx_thresh': 30.125915783305352, 'bear_atr_min_pct': 0.011740014790999589, 'bear_atr_max_pct': 0.06893471412955299, 'bear_tp_mult': 1.3606787235899906, 'bear_tsl_mult': 0.4261984404768802, 'bear_time_stop': 198, 'bear_use_sma': True, 'bear_use_ema': False, 'bear_use_atr': True, 'bear_use_adx': False, 'bear_use_spike': False, 'bear_rsi_required': False, 'sideways_strategy': 'breakout', 'sideways_bb_std_mult': 2.441199791994453, 'sideways_rsi_os': 47, 'sideways_rsi_ob': 54, 'sideways_adx_thresh': 5.790209964107751, 'sideways_atr_min_pct': 0.027562335530338877, 'sideways_atr_max_pct': 0.09586366916615276, 'sideways_tp_mult': 1.5291639035199618, 'sideways_tsl_mult': 0.15117971560509652, 'sideways_time_stop': 136, 'sideways_use_sma': False, 'sideways_use_ema': True, 'sideways_use_atr': True, 'sideways_use_adx': False, 'sideways_use_spike': True, 'sideways_rsi_required': True}.
[I 2025-09-01 05:42:13,308] Trial 569 finished with values: [-1000000000.0, 1000000000.0] and parameters: {'p_sma': 47, 'p_std': 35, 'p_atr': 7, 'p_adx': 18, 'rsi_period': 52, 'ema1': 7, 'ema2': 30, 'slip_atr_k': 0.008504332979446534, 'slip_spread_k': 0.3705415129128904, 'spread_hl_frac': 0.01436628478951684, 'bb_std_mult': 2.0478123921685287, 'rsi_os': 24, 'rsi_ob': 89, 'vol_spike': 0.20368539198171162, 'adx_thresh': 10.71209460660271, 'atr_min_pct': 0.005267076621817306, 'atr_max_pct': 0.13047344778385062, 'tp_mult': 2.0878217426213816, 'tsl_mult': 0.7562235958506313, 'strategy': 'breakout', 'time_stop': 185, 'use_sma': False, 'use_atr': True, 'use_adx': False, 'use_ema': True, 'use_spike': True, 'rsi_required': False, 'edge_k': 0.21877804656594596, 'edge_cap': 0.2267083906320791, 'bull_strategy': 'breakout', 'bull_bb_std_mult': 1.0074425217177658, 'bull_rsi_os': 46, 'bull_rsi_ob': 89, 'bull_adx_thresh': 28.066719648811137, 'bull_atr_min_pct': 0.023209609518015067, 'bull_atr_max_pct': 0.07338477314876005, 'bull_tp_mult': 2.2367313830933466, 'bull_tsl_mult': 0.7036359022116734, 'bull_time_stop': 98, 'bull_use_sma': True, 'bull_use_ema': False, 'bull_use_atr': False, 'bull_use_adx': True, 'bull_use_spike': False, 'bull_rsi_required': True, 'bear_strategy': 'breakout', 'bear_bb_std_mult': 3.558065004487729, 'bear_rsi_os': 39, 'bear_rsi_ob': 66, 'bear_adx_thresh': 6.111512748221669, 'bear_atr_min_pct': 0.012847701483744351, 'bear_atr_max_pct': 0.06826082676751544, 'bear_tp_mult': 2.2814665172097226, 'bear_tsl_mult': 0.6750754570908087, 'bear_time_stop': 260, 'bear_use_sma': True, 'bear_use_ema': False, 'bear_use_atr': False, 'bear_use_adx': False, 'bear_use_spike': False, 'bear_rsi_required': False, 'sideways_strategy': 'breakout', 'sideways_bb_std_mult': 0.6150509632959688, 'sideways_rsi_os': 44, 'sideways_rsi_ob': 54, 'sideways_adx_thresh': 29.55754937512348, 'sideways_atr_min_pct': 0.011037608639639901, 'sideways_atr_max_pct': 0.10438056958276197, 'sideways_tp_mult': 1.637457752808803, 'sideways_tsl_mult': 0.4366150250508879, 'sideways_time_stop': 133, 'sideways_use_sma': False, 'sideways_use_ema': True, 'sideways_use_atr': True, 'sideways_use_adx': False, 'sideways_use_spike': True, 'sideways_rsi_required': True}.
[I 2025-09-01 05:42:13,698] Trial 570 finished with values: [-1000000000.0, 1000000000.0] and parameters: {'p_sma': 59, 'p_std': 29, 'p_atr': 17, 'p_adx': 28, 'rsi_period': 51, 'ema1': 23, 'ema2': 36, 'slip_atr_k': 0.014886734184553607, 'slip_spread_k': 0.46287363250863456, 'spread_hl_frac': 0.04691133884636749, 'bb_std_mult': 2.202787705960428, 'rsi_os': 26, 'rsi_ob': 89, 'vol_spike': 0.20278908891035818, 'adx_thresh': 31.015615679552873, 'atr_min_pct': 0.018507889674427545, 'atr_max_pct': 0.13041940062559598, 'tp_mult': 2.4886048988307965, 'tsl_mult': 0.9233043010963063, 'strategy': 'breakout', 'time_stop': 147, 'use_sma': False, 'use_atr': True, 'use_adx': False, 'use_ema': True, 'use_spike': True, 'rsi_required': True, 'edge_k': 0.35980633107260607, 'edge_cap': 0.5466254313416149, 'bull_strategy': 'breakout', 'bull_bb_std_mult': 0.9985304414630386, 'bull_rsi_os': 46, 'bull_rsi_ob': 89, 'bull_adx_thresh': 6.632148877603984, 'bull_atr_min_pct': 0.023413779062692673, 'bull_atr_max_pct': 0.11104940579919732, 'bull_tp_mult': 1.2333299365391517, 'bull_tsl_mult': 0.17862690351962024, 'bull_time_stop': 96, 'bull_use_sma': True, 'bull_use_ema': False, 'bull_use_atr': False, 'bull_use_adx': True, 'bull_use_spike': False, 'bull_rsi_required': True, 'bear_strategy': 'breakout', 'bear_bb_std_mult': 3.597782752607732, 'bear_rsi_os': 28, 'bear_rsi_ob': 46, 'bear_adx_thresh': 6.184966393374756, 'bear_atr_min_pct': 0.006902088342961505, 'bear_atr_max_pct': 0.06822347368751841, 'bear_tp_mult': 2.6450462800002383, 'bear_tsl_mult': 0.5955028217176199, 'bear_time_stop': 262, 'bear_use_sma': True, 'bear_use_ema': False, 'bear_use_atr': True, 'bear_use_adx': False, 'bear_use_spike': False, 'bear_rsi_required': False, 'sideways_strategy': 'breakout', 'sideways_bb_std_mult': 2.576928872798084, 'sideways_rsi_os': 33, 'sideways_rsi_ob': 54, 'sideways_adx_thresh': 7.737747816297377, 'sideways_atr_min_pct': 0.02760632338762441, 'sideways_atr_max_pct': 0.016137066680266418, 'sideways_tp_mult': 1.5254061247386108, 'sideways_tsl_mult': 0.9628937455234143, 'sideways_time_stop': 119, 'sideways_use_sma': False, 'sideways_use_ema': True, 'sideways_use_atr': True, 'sideways_use_adx': False, 'sideways_use_spike': True, 'sideways_rsi_required': True}.
[I 2025-09-01 05:42:54,755] Trial 572 finished with values: [-1000000000.0, 1000000000.0] and parameters: {'p_sma': 48, 'p_std': 29, 'p_atr': 23, 'p_adx': 28, 'rsi_period': 50, 'ema1': 23, 'ema2': 36, 'slip_atr_k': 0.24575405382130966, 'slip_spread_k': 0.378198784769285, 'spread_hl_frac': 0.01459004229574824, 'bb_std_mult': 2.323712106814355, 'rsi_os': 27, 'rsi_ob': 49, 'vol_spike': 0.04955731590940082, 'adx_thresh': 12.806080727698824, 'atr_min_pct': 0.013049366856511608, 'atr_max_pct': 0.13264470946847753, 'tp_mult': 2.664362114714149, 'tsl_mult': 0.2570823582622569, 'strategy': 'breakout', 'time_stop': 144, 'use_sma': True, 'use_atr': True, 'use_adx': False, 'use_ema': True, 'use_spike': True, 'rsi_required': True, 'edge_k': 0.344503584807907, 'edge_cap': 0.23064765680555888, 'bull_strategy': 'breakout', 'bull_bb_std_mult': 2.86586586344601, 'bull_rsi_os': 48, 'bull_rsi_ob': 86, 'bull_adx_thresh': 5.0022307012637555, 'bull_atr_min_pct': 0.01276336400093984, 'bull_atr_max_pct': 0.1048769748870727, 'bull_tp_mult': 2.5683637314519108, 'bull_tsl_mult': 0.2184731494868923, 'bull_time_stop': 97, 'bull_use_sma': True, 'bull_use_ema': False, 'bull_use_atr': False, 'bull_use_adx': True, 'bull_use_spike': False, 'bull_rsi_required': True, 'bear_strategy': 'breakout', 'bear_bb_std_mult': 2.143544896254404, 'bear_rsi_os': 5, 'bear_rsi_ob': 46, 'bear_adx_thresh': 32.49754859922565, 'bear_atr_min_pct': 0.012759144398474104, 'bear_atr_max_pct': 0.09823449333239367, 'bear_tp_mult': 1.8784987218647935, 'bear_tsl_mult': 0.6684959881419461, 'bear_time_stop': 164, 'bear_use_sma': True, 'bear_use_ema': False, 'bear_use_atr': True, 'bear_use_adx': False, 'bear_use_spike': False, 'bear_rsi_required': False, 'sideways_strategy': 'breakout', 'sideways_bb_std_mult': 1.0418740034042782, 'sideways_rsi_os': 46, 'sideways_rsi_ob': 54, 'sideways_adx_thresh': 21.217234894844218, 'sideways_atr_min_pct': 0.005056932636366829, 'sideways_atr_max_pct': 0.07764083258809659, 'sideways_tp_mult': 1.5467403928245769, 'sideways_tsl_mult': 0.9602788035540647, 'sideways_time_stop': 122, 'sideways_use_sma': False, 'sideways_use_ema': True, 'sideways_use_atr': True, 'sideways_use_adx': False, 'sideways_use_spike': True, 'sideways_rsi_required': True}.
[I 2025-09-01 05:42:55,358] Trial 573 finished with values: [-1000000000.0, 1000000000.0] and parameters: {'p_sma': 58, 'p_std': 7, 'p_atr': 7, 'p_adx': 18, 'rsi_period': 56, 'ema1': 25, 'ema2': 53, 'slip_atr_k': 0.013408572625457698, 'slip_spread_k': 0.09722521077861923, 'spread_hl_frac': 0.046312105797392575, 'bb_std_mult': 2.0384349530070245, 'rsi_os': 26, 'rsi_ob': 64, 'vol_spike': 0.20099161954660968, 'adx_thresh': 10.85134790342908, 'atr_min_pct': 0.004740525836144979, 'atr_max_pct': 0.13276897074915547, 'tp_mult': 2.4352238292140793, 'tsl_mult': 0.9270802955014881, 'strategy': 'breakout', 'time_stop': 198, 'use_sma': False, 'use_atr': True, 'use_adx': True, 'use_ema': True, 'use_spike': True, 'rsi_required': False, 'edge_k': 0.2687909031810304, 'edge_cap': 0.543085238061428, 'bull_strategy': 'breakout', 'bull_bb_std_mult': 1.022044584590728, 'bull_rsi_os': 48, 'bull_rsi_ob': 56, 'bull_adx_thresh': 23.38948135196956, 'bull_atr_min_pct': 0.023568248719957476, 'bull_atr_max_pct': 0.08823084125911838, 'bull_tp_mult': 1.3874065833927314, 'bull_tsl_mult': 0.15348459480679733, 'bull_time_stop': 93, 'bull_use_sma': False, 'bull_use_ema': False, 'bull_use_atr': False, 'bull_use_adx': True, 'bull_use_spike': False, 'bull_rsi_required': True, 'bear_strategy': 'breakout', 'bear_bb_std_mult': 3.5934715548529756, 'bear_rsi_os': 29, 'bear_rsi_ob': 68, 'bear_adx_thresh': 28.49786717716921, 'bear_atr_min_pct': 0.0034005716995937543, 'bear_atr_max_pct': 0.0823374085200364, 'bear_tp_mult': 1.2772309180353667, 'bear_tsl_mult': 0.6977402692526489, 'bear_time_stop': 191, 'bear_use_sma': True, 'bear_use_ema': False, 'bear_use_atr': False, 'bear_use_adx': False, 'bear_use_spike': False, 'bear_rsi_required': False, 'sideways_strategy': 'breakout', 'sideways_bb_std_mult': 1.040912022989537, 'sideways_rsi_os': 11, 'sideways_rsi_ob': 56, 'sideways_adx_thresh': 33.33014415975237, 'sideways_atr_min_pct': 0.010796531362579128, 'sideways_atr_max_pct': 0.1383882514354825, 'sideways_tp_mult': 1.5315481963898925, 'sideways_tsl_mult': 0.9997011744777742, 'sideways_time_stop': 185, 'sideways_use_sma': False, 'sideways_use_ema': True, 'sideways_use_atr': True, 'sideways_use_adx': True, 'sideways_use_spike': True, 'sideways_rsi_required': True}.
[I 2025-09-01 05:42:55,549] Trial 574 finished with values: [-1000000000.0, 1000000000.0] and parameters: {'p_sma': 58, 'p_std': 29, 'p_atr': 19, 'p_adx': 10, 'rsi_period': 50, 'ema1': 23, 'ema2': 14, 'slip_atr_k': 0.21835124996405011, 'slip_spread_k': 0.3843394050392374, 'spread_hl_frac': 0.01755485661066388, 'bb_std_mult': 2.3023529764248165, 'rsi_os': 39, 'rsi_ob': 78, 'vol_spike': 0.1980996553022059, 'adx_thresh': 13.068156781907415, 'atr_min_pct': 0.004563595654403842, 'atr_max_pct': 0.028083473972178363, 'tp_mult': 2.445322804086573, 'tsl_mult': 0.25620083751999323, 'strategy': 'breakout', 'time_stop': 200, 'use_sma': True, 'use_atr': True, 'use_adx': True, 'use_ema': True, 'use_spike': True, 'rsi_required': True, 'edge_k': 0.2698523150930975, 'edge_cap': 0.5430920711804816, 'bull_strategy': 'breakout', 'bull_bb_std_mult': 1.9332612284867077, 'bull_rsi_os': 48, 'bull_rsi_ob': 86, 'bull_adx_thresh': 26.236056339911812, 'bull_atr_min_pct': 0.012889205972072897, 'bull_atr_max_pct': 0.11410150061133173, 'bull_tp_mult': 1.3780682286783459, 'bull_tsl_mult': 0.9529943848118094, 'bull_time_stop': 92, 'bull_use_sma': False, 'bull_use_ema': False, 'bull_use_atr': False, 'bull_use_adx': True, 'bull_use_spike': False, 'bull_rsi_required': True, 'bear_strategy': 'breakout', 'bear_bb_std_mult': 2.651878135045006, 'bear_rsi_os': 6, 'bear_rsi_ob': 88, 'bear_adx_thresh': 30.641666602790604, 'bear_atr_min_pct': 0.01428582496280258, 'bear_atr_max_pct': 0.0811743862169461, 'bear_tp_mult': 1.2727051983160234, 'bear_tsl_mult': 0.696376657126155, 'bear_time_stop': 225, 'bear_use_sma': True, 'bear_use_ema': False, 'bear_use_atr': True, 'bear_use_adx': False, 'bear_use_spike': False, 'bear_rsi_required': False, 'sideways_strategy': 'breakout', 'sideways_bb_std_mult': 2.5681899232214147, 'sideways_rsi_os': 11, 'sideways_rsi_ob': 56, 'sideways_adx_thresh': 21.04995681600757, 'sideways_atr_min_pct': 0.005118078719044605, 'sideways_atr_max_pct': 0.12970039936237654, 'sideways_tp_mult': 1.5456848706247217, 'sideways_tsl_mult': 0.38420197758237856, 'sideways_time_stop': 187, 'sideways_use_sma': False, 'sideways_use_ema': True, 'sideways_use_atr': True, 'sideways_use_adx': True, 'sideways_use_spike': True, 'sideways_rsi_required': True}.
[I 2025-09-01 05:42:55,849] Trial 575 finished with values: [-1000000000.0, 1000000000.0] and parameters: {'p_sma': 36, 'p_std': 33, 'p_atr': 8, 'p_adx': 18, 'rsi_period': 50, 'ema1': 24, 'ema2': 33, 'slip_atr_k': 0.026802470486114255, 'slip_spread_k': 0.39295977708991536, 'spread_hl_frac': 0.0498701855623583, 'bb_std_mult': 2.006344203607508, 'rsi_os': 51, 'rsi_ob': 64, 'vol_spike': 0.05705295150247716, 'adx_thresh': 12.907814877064038, 'atr_min_pct': 0.01307350073500757, 'atr_max_pct': 0.023972433676642167, 'tp_mult': 2.5530069543584375, 'tsl_mult': 0.25671785515069045, 'strategy': 'breakout', 'time_stop': 199, 'use_sma': True, 'use_atr': True, 'use_adx': True, 'use_ema': True, 'use_spike': False, 'rsi_required': False, 'edge_k': 0.28418933699578086, 'edge_cap': 0.9706878628155773, 'bull_strategy': 'breakout', 'bull_bb_std_mult': 2.889209022237742, 'bull_rsi_os': 9, 'bull_rsi_ob': 46, 'bull_adx_thresh': 25.88647212422401, 'bull_atr_min_pct': 0.017807664993242763, 'bull_atr_max_pct': 0.07907029947629396, 'bull_tp_mult': 2.621339115221435, 'bull_tsl_mult': 0.15754029800856034, 'bull_time_stop': 91, 'bull_use_sma': False, 'bull_use_ema': False, 'bull_use_atr': False, 'bull_use_adx': True, 'bull_use_spike': True, 'bull_rsi_required': True, 'bear_strategy': 'breakout', 'bear_bb_std_mult': 3.5399320503423772, 'bear_rsi_os': 31, 'bear_rsi_ob': 87, 'bear_adx_thresh': 33.25452184980429, 'bear_atr_min_pct': 0.008709829393717573, 'bear_atr_max_pct': 0.07685715622863326, 'bear_tp_mult': 1.277957557772203, 'bear_tsl_mult': 0.6428965874107463, 'bear_time_stop': 92, 'bear_use_sma': False, 'bear_use_ema': False, 'bear_use_atr': False, 'bear_use_adx': False, 'bear_use_spike': True, 'bear_rsi_required': False, 'sideways_strategy': 'breakout', 'sideways_bb_std_mult': 0.7442620822457773, 'sideways_rsi_os': 11, 'sideways_rsi_ob': 57, 'sideways_adx_thresh': 11.550930163746978, 'sideways_atr_min_pct': 0.005154112903180235, 'sideways_atr_max_pct': 0.13791258564567677, 'sideways_tp_mult': 2.5843666366613265, 'sideways_tsl_mult': 0.8558230853419463, 'sideways_time_stop': 185, 'sideways_use_sma': False, 'sideways_use_ema': True, 'sideways_use_atr': True, 'sideways_use_adx': True, 'sideways_use_spike': True, 'sideways_rsi_required': True}.
