[I 2025-09-01 05:12:37,337] Trial 404 finished with values: [-1000000000.0, 1000000000.0] and parameters: {'p_sma': 9, 'p_std': 60, 'p_atr': 19, 'p_adx': 15, 'rsi_period': 34, 'ema1': 6, 'ema2': 51, 'slip_atr_k': 0.062035257497033466, 'slip_spread_k': 0.2729450348911413, 'spread_hl_frac': 0.029893421475116373, 'bb_std_mult': 3.507475153420976, 'rsi_os': 25, 'rsi_ob': 88, 'vol_spike': 0.21883646503386234, 'adx_thresh': 29.113159922989148, 'atr_min_pct': 0.022563833069689884, 'atr_max_pct': 0.10003726306548592, 'tp_mult': 2.781208677534336, 'tsl_mult': 0.35036130821957856, 'strategy': 'breakout', 'time_stop': 127, 'use_sma': False, 'use_atr': True, 'use_adx': False, 'use_ema': False, 'use_spike': True, 'rsi_required': False, 'edge_k': 0.617490953016954, 'edge_cap': 0.44138235238649376, 'bull_strategy': 'breakout', 'bull_bb_std_mult': 2.35622017946652, 'bull_rsi_os': 26, 'bull_rsi_ob': 75, 'bull_adx_thresh': 19.098854239231315, 'bull_atr_min_pct': 0.0014573233353289093, 'bull_atr_max_pct': 0.11627338300340262, 'bull_tp_mult': 1.9414661586262703, 'bull_tsl_mult': 0.6937467570826217, 'bull_time_stop': 241, 'bull_use_sma': False, 'bull_use_ema': True, 'bull_use_atr': False, 'bull_use_adx': True, 'bull_use_spike': False, 'bull_rsi_required': True, 'bear_strategy': 'breakout', 'bear_bb_std_mult': 0.7871458227330028, 'bear_rsi_os': 11, 'bear_rsi_ob': 65, 'bear_adx_thresh': 29.56699481799315, 'bear_atr_min_pct': 0.00674407845163711, 'bear_atr_max_pct': 0.10569577279040504, 'bear_tp_mult': 1.2478417668608714, 'bear_tsl_mult': 0.6034703669816434, 'bear_time_stop': 143, 'bear_use_sma': True, 'bear_use_ema': False, 'bear_use_atr': False, 'bear_use_adx': False, 'bear_use_spike': False, 'bear_rsi_required': False, 'sideways_strategy': 'breakout', 'sideways_bb_std_mult': 2.489358201094306, 'sideways_rsi_os': 43, 'sideways_rsi_ob': 54, 'sideways_adx_thresh': 21.145082409787857, 'sideways_atr_min_pct': 0.024136111927767896, 'sideways_atr_max_pct': 0.11291110712925953, 'sideways_tp_mult': 1.9770420882390751, 'sideways_tsl_mult': 0.7807401287811793, 'sideways_time_stop': 177, 'sideways_use_sma': True, 'sideways_use_ema': True, 'sideways_use_atr': True, 'sideways_use_adx': True, 'sideways_use_spike': True, 'sideways_rsi_required': True}.
[I 2025-09-01 05:12:37,653] Trial 405 finished with values: [-1000000000.0, 1000000000.0] and parameters: {'p_sma': 23, 'p_std': 26, 'p_atr': 27, 'p_adx': 19, 'rsi_period': 77, 'ema1': 28, 'ema2': 47, 'slip_atr_k': 0.1247941138549649, 'slip_spread_k': 0.8381954393766633, 'spread_hl_frac': 0.0035780687533433844, 'bb_std_mult': 3.513388576263014, 'rsi_os': 25, 'rsi_ob': 88, 'vol_spike': 0.2198684483578175, 'adx_thresh': 14.06490528877492, 'atr_min_pct': 0.023132834976225706, 'atr_max_pct': 0.06118587328565949, 'tp_mult': 2.5321879179682942, 'tsl_mult': 0.996573669408918, 'strategy': 'breakout', 'time_stop': 125, 'use_sma': False, 'use_atr': True, 'use_adx': False, 'use_ema': False, 'use_spike': True, 'rsi_required': False, 'edge_k': 0.6140642715151922, 'edge_cap': 0.8522685713575029, 'bull_strategy': 'breakout', 'bull_bb_std_mult': 2.377739134150192, 'bull_rsi_os': 25, 'bull_rsi_ob': 90, 'bull_adx_thresh': 31.976286442411208, 'bull_atr_min_pct': 0.02477688330545781, 'bull_atr_max_pct': 0.11456544514203926, 'bull_tp_mult': 1.5159027108529144, 'bull_tsl_mult': 0.8085889817719174, 'bull_time_stop': 131, 'bull_use_sma': False, 'bull_use_ema': True, 'bull_use_atr': False, 'bull_use_adx': True, 'bull_use_spike': False, 'bull_rsi_required': True, 'bear_strategy': 'breakout', 'bear_bb_std_mult': 2.14091912710457, 'bear_rsi_os': 11, 'bear_rsi_ob': 65, 'bear_adx_thresh': 29.850663737840556, 'bear_atr_min_pct': 0.02897734897445586, 'bear_atr_max_pct': 0.0957859480976865, 'bear_tp_mult': 2.953369291495194, 'bear_tsl_mult': 0.6040667859385327, 'bear_time_stop': 206, 'bear_use_sma': True, 'bear_use_ema': False, 'bear_use_atr': False, 'bear_use_adx': False, 'bear_use_spike': False, 'bear_rsi_required': False, 'sideways_strategy': 'breakout', 'sideways_bb_std_mult': 0.6507673474345949, 'sideways_rsi_os': 42, 'sideways_rsi_ob': 55, 'sideways_adx_thresh': 14.20593723235407, 'sideways_atr_min_pct': 0.00841048005033218, 'sideways_atr_max_pct': 0.11222082949246927, 'sideways_tp_mult': 1.9609635701769625, 'sideways_tsl_mult': 0.9777006076843561, 'sideways_time_stop': 176, 'sideways_use_sma': True, 'sideways_use_ema': True, 'sideways_use_atr': True, 'sideways_use_adx': True, 'sideways_use_spike': True, 'sideways_rsi_required': True}.
[I 2025-09-01 05:12:37,868] Trial 406 finished with values: [-1000000000.0, 1000000000.0] and parameters: {'p_sma': 23, 'p_std': 26, 'p_atr': 28, 'p_adx': 15, 'rsi_period': 77, 'ema1': 8, 'ema2': 31, 'slip_atr_k': 0.11360661605044238, 'slip_spread_k': 0.27940845827629773, 'spread_hl_frac': 0.04693694812556166, 'bb_std_mult': 3.4547391498485136, 'rsi_os': 24, 'rsi_ob': 88, 'vol_spike': 0.2213436407746794, 'adx_thresh': 14.208706608763547, 'atr_min_pct': 0.023595388464814328, 'atr_max_pct': 0.06245840923729371, 'tp_mult': 1.0106009473605664, 'tsl_mult': 0.3548989621099637, 'strategy': 'breakout', 'time_stop': 144, 'use_sma': False, 'use_atr': True, 'use_adx': True, 'use_ema': True, 'use_spike': True, 'rsi_required': True, 'edge_k': 0.6123271744810372, 'edge_cap': 0.445972051312015, 'bull_strategy': 'breakout', 'bull_bb_std_mult': 2.3654624882578945, 'bull_rsi_os': 25, 'bull_rsi_ob': 87, 'bull_adx_thresh': 27.242106146764726, 'bull_atr_min_pct': 0.00822045096412975, 'bull_atr_max_pct': 0.08680921972339808, 'bull_tp_mult': 1.5138604661264934, 'bull_tsl_mult': 0.4291819252550099, 'bull_time_stop': 242, 'bull_use_sma': True, 'bull_use_ema': True, 'bull_use_atr': False, 'bull_use_adx': False, 'bull_use_spike': False, 'bull_rsi_required': True, 'bear_strategy': 'mean_reversion', 'bear_bb_std_mult': 2.809448641358392, 'bear_rsi_os': 11, 'bear_rsi_ob': 85, 'bear_adx_thresh': 29.468218151407047, 'bear_atr_min_pct': 0.024193048597126898, 'bear_atr_max_pct': 0.10552801459078112, 'bear_tp_mult': 2.964766894241139, 'bear_tsl_mult': 0.5996309756503786, 'bear_time_stop': 205, 'bear_use_sma': True, 'bear_use_ema': True, 'bear_use_atr': False, 'bear_use_adx': False, 'bear_use_spike': False, 'bear_rsi_required': False, 'sideways_strategy': 'breakout', 'sideways_bb_std_mult': 0.6686510077271822, 'sideways_rsi_os': 43, 'sideways_rsi_ob': 54, 'sideways_adx_thresh': 14.71352855297256, 'sideways_atr_min_pct': 0.02402212180782888, 'sideways_atr_max_pct': 0.11335836344183331, 'sideways_tp_mult': 2.5791985921280234, 'sideways_tsl_mult': 0.9828957322889098, 'sideways_time_stop': 73, 'sideways_use_sma': True, 'sideways_use_ema': True, 'sideways_use_atr': False, 'sideways_use_adx': False, 'sideways_use_spike': True, 'sideways_rsi_required': True}.
[I 2025-09-01 05:13:17,816] Trial 411 finished with values: [-1000000000.0, 1000000000.0] and parameters: {'p_sma': 26, 'p_std': 56, 'p_atr': 26, 'p_adx': 19, 'rsi_period': 11, 'ema1': 6, 'ema2': 27, 'slip_atr_k': 0.009024901566401927, 'slip_spread_k': 0.3341025409383788, 'spread_hl_frac': 0.0050146718944023665, 'bb_std_mult': 3.5980135824474884, 'rsi_os': 22, 'rsi_ob': 87, 'vol_spike': 0.21129110001611778, 'adx_thresh': 14.697711039954651, 'atr_min_pct': 0.024079646472232655, 'atr_max_pct': 0.0689324379375171, 'tp_mult': 2.5566666008720977, 'tsl_mult': 0.9997632602411596, 'strategy': 'mean_reversion', 'time_stop': 27, 'use_sma': False, 'use_atr': False, 'use_adx': False, 'use_ema': True, 'use_spike': False, 'rsi_required': False, 'edge_k': 1.8127993046511823, 'edge_cap': 0.8104078262444299, 'bull_strategy': 'breakout', 'bull_bb_std_mult': 2.2623092329709182, 'bull_rsi_os': 48, 'bull_rsi_ob': 49, 'bull_adx_thresh': 18.771941136011826, 'bull_atr_min_pct': 0.015108916417316797, 'bull_atr_max_pct': 0.021011022051739568, 'bull_tp_mult': 1.5836663708381378, 'bull_tsl_mult': 0.45473584651060195, 'bull_time_stop': 48, 'bull_use_sma': True, 'bull_use_ema': False, 'bull_use_atr': False, 'bull_use_adx': False, 'bull_use_spike': False, 'bull_rsi_required': True, 'bear_strategy': 'mean_reversion', 'bear_bb_std_mult': 0.7979042688087881, 'bear_rsi_os': 9, 'bear_rsi_ob': 68, 'bear_adx_thresh': 20.039383042473574, 'bear_atr_min_pct': 0.012080891736853824, 'bear_atr_max_pct': 0.058782125811713326, 'bear_tp_mult': 1.1932700323189194, 'bear_tsl_mult': 0.6191956955869192, 'bear_time_stop': 196, 'bear_use_sma': False, 'bear_use_ema': False, 'bear_use_atr': False, 'bear_use_adx': False, 'bear_use_spike': False, 'bear_rsi_required': True, 'sideways_strategy': 'breakout', 'sideways_bb_std_mult': 2.050387209944689, 'sideways_rsi_os': 41, 'sideways_rsi_ob': 56, 'sideways_adx_thresh': 14.982317785607679, 'sideways_atr_min_pct': 0.023341614725704524, 'sideways_atr_max_pct': 0.10831363014944162, 'sideways_tp_mult': 1.7771254484414227, 'sideways_tsl_mult': 0.9573291319277258, 'sideways_time_stop': 268, 'sideways_use_sma': False, 'sideways_use_ema': False, 'sideways_use_atr': False, 'sideways_use_adx': False, 'sideways_use_spike': True, 'sideways_rsi_required': False}.
[I 2025-09-01 05:13:17,879] Trial 408 finished with values: [-1000000000.0, 1000000000.0] and parameters: {'p_sma': 26, 'p_std': 56, 'p_atr': 19, 'p_adx': 19, 'rsi_period': 11, 'ema1': 6, 'ema2': 27, 'slip_atr_k': 0.018750234683858013, 'slip_spread_k': 0.27974691884216385, 'spread_hl_frac': 0.04724172540590771, 'bb_std_mult': 3.4708791045484255, 'rsi_os': 25, 'rsi_ob': 88, 'vol_spike': 0.22074929965027057, 'adx_thresh': 14.18980074568747, 'atr_min_pct': 0.023227215764485293, 'atr_max_pct': 0.11517160483001744, 'tp_mult': 1.4757447149289358, 'tsl_mult': 0.9868848119540532, 'strategy': 'breakout', 'time_stop': 111, 'use_sma': False, 'use_atr': True, 'use_adx': False, 'use_ema': True, 'use_spike': False, 'rsi_required': False, 'edge_k': 0.5442407163486287, 'edge_cap': 0.8115409201414273, 'bull_strategy': 'breakout', 'bull_bb_std_mult': 2.3827365317496456, 'bull_rsi_os': 51, 'bull_rsi_ob': 59, 'bull_adx_thresh': 18.839615619930786, 'bull_atr_min_pct': 0.00799439569771648, 'bull_atr_max_pct': 0.11289276901681938, 'bull_tp_mult': 1.5115726754968113, 'bull_tsl_mult': 0.43072076879213306, 'bull_time_stop': 244, 'bull_use_sma': True, 'bull_use_ema': True, 'bull_use_atr': False, 'bull_use_adx': False, 'bull_use_spike': False, 'bull_rsi_required': True, 'bear_strategy': 'mean_reversion', 'bear_bb_std_mult': 0.7606309422114459, 'bear_rsi_os': 11, 'bear_rsi_ob': 65, 'bear_adx_thresh': 29.667339092575205, 'bear_atr_min_pct': 0.01442819993204709, 'bear_atr_max_pct': 0.05833362060180575, 'bear_tp_mult': 1.1938720389749058, 'bear_tsl_mult': 0.6037003767928594, 'bear_time_stop': 220, 'bear_use_sma': True, 'bear_use_ema': False, 'bear_use_atr': False, 'bear_use_adx': False, 'bear_use_spike': False, 'bear_rsi_required': True, 'sideways_strategy': 'breakout', 'sideways_bb_std_mult': 2.1742503419756045, 'sideways_rsi_os': 41, 'sideways_rsi_ob': 54, 'sideways_adx_thresh': 14.991420461522699, 'sideways_atr_min_pct': 0.020496528275002125, 'sideways_atr_max_pct': 0.11242146360821881, 'sideways_tp_mult': 1.222855565692767, 'sideways_tsl_mult': 0.809704271763658, 'sideways_time_stop': 180, 'sideways_use_sma': True, 'sideways_use_ema': False, 'sideways_use_atr': False, 'sideways_use_adx': False, 'sideways_use_spike': True, 'sideways_rsi_required': True}.
[I 2025-09-01 05:13:18,247] Trial 409 finished with values: [-1000000000.0, 1000000000.0] and parameters: {'p_sma': 26, 'p_std': 56, 'p_atr': 26, 'p_adx': 19, 'rsi_period': 81, 'ema1': 19, 'ema2': 39, 'slip_atr_k': 0.010013676612253605, 'slip_spread_k': 0.3299654987982823, 'spread_hl_frac': 0.04724573715866967, 'bb_std_mult': 3.3672253129735514, 'rsi_os': 22, 'rsi_ob': 87, 'vol_spike': 0.2238384888164482, 'adx_thresh': 14.364137027228468, 'atr_min_pct': 0.023278572238920006, 'atr_max_pct': 0.11509135212740014, 'tp_mult': 2.537870333609041, 'tsl_mult': 0.7356234058297346, 'strategy': 'breakout', 'time_stop': 28, 'use_sma': False, 'use_atr': False, 'use_adx': False, 'use_ema': True, 'use_spike': False, 'rsi_required': False, 'edge_k': 0.566042080502155, 'edge_cap': 0.5296563970924629, 'bull_strategy': 'breakout', 'bull_bb_std_mult': 1.4020342569175686, 'bull_rsi_os': 51, 'bull_rsi_ob': 79, 'bull_adx_thresh': 7.638410510623702, 'bull_atr_min_pct': 0.001771288376404606, 'bull_atr_max_pct': 0.11311875265403887, 'bull_tp_mult': 1.5053302180254937, 'bull_tsl_mult': 0.4662663511348224, 'bull_time_stop': 234, 'bull_use_sma': True, 'bull_use_ema': False, 'bull_use_atr': False, 'bull_use_adx': False, 'bull_use_spike': False, 'bull_rsi_required': True, 'bear_strategy': 'mean_reversion', 'bear_bb_std_mult': 2.5639223051385116, 'bear_rsi_os': 10, 'bear_rsi_ob': 86, 'bear_adx_thresh': 28.733541788837854, 'bear_atr_min_pct': 0.027761776748852846, 'bear_atr_max_pct': 0.05785600626108953, 'bear_tp_mult': 2.955683603371906, 'bear_tsl_mult': 0.61908247976975, 'bear_time_stop': 239, 'bear_use_sma': True, 'bear_use_ema': False, 'bear_use_atr': False, 'bear_use_adx': False, 'bear_use_spike': False, 'bear_rsi_required': True, 'sideways_strategy': 'breakout', 'sideways_bb_std_mult': 2.1913906025274827, 'sideways_rsi_os': 41, 'sideways_rsi_ob': 56, 'sideways_adx_thresh': 14.606922565664537, 'sideways_atr_min_pct': 0.019534987457529157, 'sideways_atr_max_pct': 0.11255894311839473, 'sideways_tp_mult': 1.3869058773750846, 'sideways_tsl_mult': 0.9829649928842551, 'sideways_time_stop': 181, 'sideways_use_sma': True, 'sideways_use_ema': False, 'sideways_use_atr': False, 'sideways_use_adx': False, 'sideways_use_spike': True, 'sideways_rsi_required': False}.
[I 2025-09-01 05:13:18,479] Trial 410 finished with values: [-1000000000.0, 1000000000.0] and parameters: {'p_sma': 26, 'p_std': 56, 'p_atr': 26, 'p_adx': 19, 'rsi_period': 10, 'ema1': 19, 'ema2': 49, 'slip_atr_k': 0.1135567877209838, 'slip_spread_k': 0.28810565155192924, 'spread_hl_frac': 0.005110135939430108, 'bb_std_mult': 3.4419232410489995, 'rsi_os': 8, 'rsi_ob': 87, 'vol_spike': 0.22384138371371815, 'adx_thresh': 14.533435884353697, 'atr_min_pct': 0.024055514803346015, 'atr_max_pct': 0.068892117265409, 'tp_mult': 2.5528276279231994, 'tsl_mult': 0.17964966449786057, 'strategy': 'mean_reversion', 'time_stop': 105, 'use_sma': False, 'use_atr': False, 'use_adx': True, 'use_ema': True, 'use_spike': False, 'rsi_required': True, 'edge_k': 1.0172823958041082, 'edge_cap': 0.5340373897387977, 'bull_strategy': 'breakout', 'bull_bb_std_mult': 2.2509706948829504, 'bull_rsi_os': 52, 'bull_rsi_ob': 84, 'bull_adx_thresh': 34.903027075509726, 'bull_atr_min_pct': 0.0016835991160334485, 'bull_atr_max_pct': 0.12281516711330581, 'bull_tp_mult': 1.5141673897395203, 'bull_tsl_mult': 0.4917420304215102, 'bull_time_stop': 255, 'bull_use_sma': True, 'bull_use_ema': False, 'bull_use_atr': False, 'bull_use_adx': False, 'bull_use_spike': False, 'bull_rsi_required': True, 'bear_strategy': 'mean_reversion', 'bear_bb_std_mult': 3.2057414758841176, 'bear_rsi_os': 10, 'bear_rsi_ob': 52, 'bear_adx_thresh': 20.11976359040163, 'bear_atr_min_pct': 0.029531474292970507, 'bear_atr_max_pct': 0.0446118750774264, 'bear_tp_mult': 1.3637945361245403, 'bear_tsl_mult': 0.6214938213981115, 'bear_time_stop': 220, 'bear_use_sma': False, 'bear_use_ema': True, 'bear_use_atr': False, 'bear_use_adx': False, 'bear_use_spike': False, 'bear_rsi_required': True, 'sideways_strategy': 'breakout', 'sideways_bb_std_mult': 0.8530910217646152, 'sideways_rsi_os': 41, 'sideways_rsi_ob': 56, 'sideways_adx_thresh': 15.084211917439944, 'sideways_atr_min_pct': 0.013971854178783756, 'sideways_atr_max_pct': 0.11427320662344112, 'sideways_tp_mult': 1.2392645485485612, 'sideways_tsl_mult': 0.9828682730760969, 'sideways_time_stop': 226, 'sideways_use_sma': False, 'sideways_use_ema': False, 'sideways_use_atr': False, 'sideways_use_adx': False, 'sideways_use_spike': True, 'sideways_rsi_required': False}.
[I 2025-09-01 05:14:05,482] Trial 414 finished with values: [-0.030169970003320112, 0.03001419743892599] and parameters: {'p_sma': 24, 'p_std': 37, 'p_atr': 13, 'p_adx': 7, 'rsi_period': 8, 'ema1': 29, 'ema2': 19, 'slip_atr_k': 0.004304008564009462, 'slip_spread_k': 0.2960412640170621, 'spread_hl_frac': 0.045840120939076676, 'bb_std_mult': 3.1725137793663913, 'rsi_os': 23, 'rsi_ob': 89, 'vol_spike': 0.22938169257488444, 'adx_thresh': 12.698692006085297, 'atr_min_pct': 0.02284410541064778, 'atr_max_pct': 0.11965861601411902, 'tp_mult': 1.2755776986927976, 'tsl_mult': 0.2146228916087432, 'strategy': 'mean_reversion', 'time_stop': 66, 'use_sma': False, 'use_atr': False, 'use_adx': True, 'use_ema': True, 'use_spike': True, 'rsi_required': True, 'edge_k': 1.0199082714534882, 'edge_cap': 0.48706363718657497, 'bull_strategy': 'breakout', 'bull_bb_std_mult': 2.4539698642662677, 'bull_rsi_os': 55, 'bull_rsi_ob': 89, 'bull_adx_thresh': 10.813668308512886, 'bull_atr_min_pct': 0.001309832966328367, 'bull_atr_max_pct': 0.015087783917577799, 'bull_tp_mult': 1.1001181172141967, 'bull_tsl_mult': 0.40433798482309763, 'bull_time_stop': 57, 'bull_use_sma': True, 'bull_use_ema': False, 'bull_use_atr': False, 'bull_use_adx': False, 'bull_use_spike': True, 'bull_rsi_required': True, 'bear_strategy': 'mean_reversion', 'bear_bb_std_mult': 3.226551541443102, 'bear_rsi_os': 10, 'bear_rsi_ob': 67, 'bear_adx_thresh': 25.939100637636564, 'bear_atr_min_pct': 0.028461614758584573, 'bear_atr_max_pct': 0.1124305565354751, 'bear_tp_mult': 2.2406067774552447, 'bear_tsl_mult': 0.5723028717445141, 'bear_time_stop': 200, 'bear_use_sma': False, 'bear_use_ema': True, 'bear_use_atr': False, 'bear_use_adx': False, 'bear_use_spike': True, 'bear_rsi_required': False, 'sideways_strategy': 'breakout', 'sideways_bb_std_mult': 3.422243980702387, 'sideways_rsi_os': 43, 'sideways_rsi_ob': 56, 'sideways_adx_thresh': 20.1788448117238, 'sideways_atr_min_pct': 0.00997232237112192, 'sideways_atr_max_pct': 0.10663360406555293, 'sideways_tp_mult': 2.2928417015664824, 'sideways_tsl_mult': 0.9331189897707332, 'sideways_time_stop': 93, 'sideways_use_sma': False, 'sideways_use_ema': True, 'sideways_use_atr': False, 'sideways_use_adx': False, 'sideways_use_spike': True, 'sideways_rsi_required': False}.
[I 2025-09-01 05:14:06,250] Trial 413 finished with values: [-1000000000.0, 1000000000.0] and parameters: {'p_sma': 42, 'p_std': 37, 'p_atr': 13, 'p_adx': 9, 'rsi_period': 8, 'ema1': 29, 'ema2': 11, 'slip_atr_k': 0.0997897230072461, 'slip_spread_k': 0.3063158755638496, 'spread_hl_frac': 0.010754145480712109, 'bb_std_mult': 1.490472905818411, 'rsi_os': 23, 'rsi_ob': 87, 'vol_spike': 0.22838068353437133, 'adx_thresh': 17.324723114722538, 'atr_min_pct': 0.024139110092080054, 'atr_max_pct': 0.11939996896469841, 'tp_mult': 1.2639672255453784, 'tsl_mult': 0.15689521582383287, 'strategy': 'breakout', 'time_stop': 57, 'use_sma': False, 'use_atr': False, 'use_adx': True, 'use_ema': True, 'use_spike': True, 'rsi_required': True, 'edge_k': 0.5705849413794088, 'edge_cap': 0.5352062118051758, 'bull_strategy': 'breakout', 'bull_bb_std_mult': 2.457281756168225, 'bull_rsi_os': 23, 'bull_rsi_ob': 89, 'bull_adx_thresh': 25.613406077773593, 'bull_atr_min_pct': 0.0162359026165576, 'bull_atr_max_pct': 0.12279762099587892, 'bull_tp_mult': 1.4152010990892392, 'bull_tsl_mult': 0.5289705474943222, 'bull_time_stop': 235, 'bull_use_sma': True, 'bull_use_ema': False, 'bull_use_atr': False, 'bull_use_adx': False, 'bull_use_spike': True, 'bull_rsi_required': True, 'bear_strategy': 'mean_reversion', 'bear_bb_std_mult': 1.6009409816337563, 'bear_rsi_os': 10, 'bear_rsi_ob': 63, 'bear_adx_thresh': 28.727670723954777, 'bear_atr_min_pct': 0.027679640401772176, 'bear_atr_max_pct': 0.062260135349473326, 'bear_tp_mult': 2.531454135480349, 'bear_tsl_mult': 0.5786739162616661, 'bear_time_stop': 122, 'bear_use_sma': True, 'bear_use_ema': False, 'bear_use_atr': False, 'bear_use_adx': False, 'bear_use_spike': True, 'bear_rsi_required': False, 'sideways_strategy': 'breakout', 'sideways_bb_std_mult': 0.8761450291879016, 'sideways_rsi_os': 42, 'sideways_rsi_ob': 56, 'sideways_adx_thresh': 22.38878090526438, 'sideways_atr_min_pct': 0.009842353816637756, 'sideways_atr_max_pct': 0.10590731547429018, 'sideways_tp_mult': 1.377601710073333, 'sideways_tsl_mult': 0.042891174237445207, 'sideways_time_stop': 228, 'sideways_use_sma': True, 'sideways_use_ema': True, 'sideways_use_atr': False, 'sideways_use_adx': False, 'sideways_use_spike': True, 'sideways_rsi_required': False}.
