[I 2025-08-30 19:51:57,645] Trial 576 finished with values: [-1000000000.0, 1000000000.0] and parameters: {'p_sma': 30, 'p_std': 51, 'p_atr': 29, 'p_adx': 8, 'rsi_period': 50, 'ema1': 16, 'ema2': 18, 'slip_atr_k': 0.1915361559206049, 'slip_spread_k': 0.38544521702325735, 'spread_hl_frac': 0.0031156115328870387, 'bb_std_mult': 0.8090619360564937, 'rsi_os': 37, 'rsi_ob': 59, 'vol_spike': 0.12591647442395923, 'adx_thresh': 23.439615309219167, 'atr_min_pct': 0.0232936187553209, 'atr_max_pct': 0.13711869197985418, 'tp_mult': 2.5783299125886385, 'tsl_mult': 0.6039414286683663, 'strategy': 'mean_reversion', 'time_stop': 32, 'use_sma': False, 'use_atr': False, 'use_adx': False, 'use_ema': False, 'use_spike': True, 'rsi_required': False, 'edge_k': 0.1405735531047461, 'edge_cap': 0.24540801846265664, 'bull_strategy': 'breakout', 'bull_bb_std_mult': 1.852914663097745, 'bull_rsi_os': 14, 'bull_rsi_ob': 73, 'bull_adx_thresh': 25.522596031438113, 'bull_atr_min_pct': 0.004732505319273349, 'bull_atr_max_pct': 0.07079788799344877, 'bull_tp_mult': 2.2020323449678028, 'bull_tsl_mult': 0.691829255545809, 'bull_time_stop': 232, 'bull_use_sma': True, 'bull_use_ema': False, 'bull_use_atr': True, 'bull_use_adx': False, 'bull_use_spike': True, 'bull_rsi_required': True, 'bear_strategy': 'breakout', 'bear_bb_std_mult': 3.3080423490233657, 'bear_rsi_os': 29, 'bear_rsi_ob': 85, 'bear_adx_thresh': 16.69479341462235, 'bear_atr_min_pct': 0.017553838463463815, 'bear_atr_max_pct': 0.11189030909319267, 'bear_tp_mult': 1.7206547131134393, 'bear_tsl_mult': 0.9972550297440297, 'bear_time_stop': 214, 'bear_use_sma': True, 'bear_use_ema': True, 'bear_use_atr': False, 'bear_use_adx': False, 'bear_use_spike': False, 'bear_rsi_required': False, 'sideways_strategy': 'breakout', 'sideways_bb_std_mult': 2.0719117801463676, 'sideways_rsi_os': 18, 'sideways_rsi_ob': 77, 'sideways_adx_thresh': 10.660421995352745, 'sideways_atr_min_pct': 0.020586461113851817, 'sideways_atr_max_pct': 0.11601373929786964, 'sideways_tp_mult': 1.8877578847396521, 'sideways_tsl_mult': 0.6128356113468701, 'sideways_time_stop': 286, 'sideways_use_sma': False, 'sideways_use_ema': True, 'sideways_use_atr': False, 'sideways_use_adx': False, 'sideways_use_spike': False, 'sideways_rsi_required': True}.
[I 2025-08-30 19:51:57,766] Trial 575 finished with values: [-1000000000.0, 1000000000.0] and parameters: {'p_sma': 43, 'p_std': 26, 'p_atr': 15, 'p_adx': 29, 'rsi_period': 50, 'ema1': 16, 'ema2': 18, 'slip_atr_k': 0.09052156428129447, 'slip_spread_k': 0.3857715110973381, 'spread_hl_frac': 3.132734820343597e-05, 'bb_std_mult': 1.114097856998034, 'rsi_os': 30, 'rsi_ob': 59, 'vol_spike': 0.03189266050595002, 'adx_thresh': 6.282545655748201, 'atr_min_pct': 0.023142472495172362, 'atr_max_pct': 0.0809722297117215, 'tp_mult': 2.07432142035288, 'tsl_mult': 0.7635701130433599, 'strategy': 'breakout', 'time_stop': 215, 'use_sma': False, 'use_atr': True, 'use_adx': False, 'use_ema': False, 'use_spike': True, 'rsi_required': False, 'edge_k': 1.8786462880220285, 'edge_cap': 0.24520474723858568, 'bull_strategy': 'mean_reversion', 'bull_bb_std_mult': 1.9083705490032714, 'bull_rsi_os': 48, 'bull_rsi_ob': 73, 'bull_adx_thresh': 7.813257653177779, 'bull_atr_min_pct': 0.028807161282059183, 'bull_atr_max_pct': 0.13122527057894742, 'bull_tp_mult': 2.231831276941837, 'bull_tsl_mult': 0.9992983698507274, 'bull_time_stop': 173, 'bull_use_sma': True, 'bull_use_ema': False, 'bull_use_atr': True, 'bull_use_adx': False, 'bull_use_spike': True, 'bull_rsi_required': True, 'bear_strategy': 'breakout', 'bear_bb_std_mult': 1.082424567202943, 'bear_rsi_os': 42, 'bear_rsi_ob': 85, 'bear_adx_thresh': 16.13146407856614, 'bear_atr_min_pct': 0.014634278894048629, 'bear_atr_max_pct': 0.057758957537065427, 'bear_tp_mult': 1.7288540440940878, 'bear_tsl_mult': 0.08763528366892169, 'bear_time_stop': 45, 'bear_use_sma': True, 'bear_use_ema': True, 'bear_use_atr': True, 'bear_use_adx': True, 'bear_use_spike': False, 'bear_rsi_required': False, 'sideways_strategy': 'breakout', 'sideways_bb_std_mult': 2.7405681082150526, 'sideways_rsi_os': 18, 'sideways_rsi_ob': 67, 'sideways_adx_thresh': 9.993684385601423, 'sideways_atr_min_pct': 0.019762781608407196, 'sideways_atr_max_pct': 0.14451329379675143, 'sideways_tp_mult': 1.8833418275559501, 'sideways_tsl_mult': 0.2053382134695536, 'sideways_time_stop': 294, 'sideways_use_sma': True, 'sideways_use_ema': True, 'sideways_use_atr': False, 'sideways_use_adx': False, 'sideways_use_spike': False, 'sideways_rsi_required': False}.
[I 2025-08-30 19:52:31,065] Trial 581 finished with values: [-1000000000.0, 1000000000.0] and parameters: {'p_sma': 41, 'p_std': 14, 'p_atr': 10, 'p_adx': 22, 'rsi_period': 54, 'ema1': 24, 'ema2': 16, 'slip_atr_k': 0.016026578467847392, 'slip_spread_k': 0.4473354277921899, 'spread_hl_frac': 0.004888853700730956, 'bb_std_mult': 1.052192712870781, 'rsi_os': 13, 'rsi_ob': 56, 'vol_spike': 0.26012531223757485, 'adx_thresh': 34.573113186941036, 'atr_min_pct': 0.02173560530605499, 'atr_max_pct': 0.13150346393451318, 'tp_mult': 2.3300937717318977, 'tsl_mult': 0.12244024751891613, 'strategy': 'breakout', 'time_stop': 175, 'use_sma': False, 'use_atr': True, 'use_adx': True, 'use_ema': True, 'use_spike': False, 'rsi_required': True, 'edge_k': 1.9593227637377684, 'edge_cap': 0.5329152225182279, 'bull_strategy': 'mean_reversion', 'bull_bb_std_mult': 2.9674909691144684, 'bull_rsi_os': 55, 'bull_rsi_ob': 72, 'bull_adx_thresh': 25.718266517653817, 'bull_atr_min_pct': 0.002223755121587231, 'bull_atr_max_pct': 0.12669442945561502, 'bull_tp_mult': 1.670609065569759, 'bull_tsl_mult': 0.9578575951232143, 'bull_time_stop': 160, 'bull_use_sma': False, 'bull_use_ema': True, 'bull_use_atr': False, 'bull_use_adx': True, 'bull_use_spike': True, 'bull_rsi_required': False, 'bear_strategy': 'breakout', 'bear_bb_std_mult': 3.1917358005962795, 'bear_rsi_os': 45, 'bear_rsi_ob': 80, 'bear_adx_thresh': 22.5113576876728, 'bear_atr_min_pct': 0.015477805928985915, 'bear_atr_max_pct': 0.062389535530211926, 'bear_tp_mult': 1.7016096841215522, 'bear_tsl_mult': 0.9616209455268703, 'bear_time_stop': 41, 'bear_use_sma': False, 'bear_use_ema': False, 'bear_use_atr': True, 'bear_use_adx': True, 'bear_use_spike': True, 'bear_rsi_required': True, 'sideways_strategy': 'breakout', 'sideways_bb_std_mult': 3.492573009989516, 'sideways_rsi_os': 17, 'sideways_rsi_ob': 63, 'sideways_adx_thresh': 26.266280436097677, 'sideways_atr_min_pct': 0.019407937010673858, 'sideways_atr_max_pct': 0.12157124473390647, 'sideways_tp_mult': 2.5905731804320977, 'sideways_tsl_mult': 0.7318051179181588, 'sideways_time_stop': 266, 'sideways_use_sma': True, 'sideways_use_ema': False, 'sideways_use_atr': True, 'sideways_use_adx': True, 'sideways_use_spike': True, 'sideways_rsi_required': False}.
[I 2025-08-30 19:52:31,467] Trial 579 finished with values: [-1000000000.0, 1000000000.0] and parameters: {'p_sma': 8, 'p_std': 29, 'p_atr': 29, 'p_adx': 14, 'rsi_period': 54, 'ema1': 18, 'ema2': 17, 'slip_atr_k': 0.0174064490703305, 'slip_spread_k': 0.4320926304923002, 'spread_hl_frac': 0.005185665044842716, 'bb_std_mult': 1.0292781352204354, 'rsi_os': 12, 'rsi_ob': 56, 'vol_spike': 0.03204842850323032, 'adx_thresh': 20.845525252550868, 'atr_min_pct': 0.02363921098112508, 'atr_max_pct': 0.031940604542373935, 'tp_mult': 2.063651889522616, 'tsl_mult': 0.7728341406854113, 'strategy': 'mean_reversion', 'time_stop': 214, 'use_sma': False, 'use_atr': False, 'use_adx': True, 'use_ema': True, 'use_spike': False, 'rsi_required': False, 'edge_k': 0.0733218968850223, 'edge_cap': 0.2420471005780772, 'bull_strategy': 'breakout', 'bull_bb_std_mult': 1.9784385152697896, 'bull_rsi_os': 51, 'bull_rsi_ob': 94, 'bull_adx_thresh': 25.572949037498354, 'bull_atr_min_pct': 0.008426404553591164, 'bull_atr_max_pct': 0.1255323539285515, 'bull_tp_mult': 1.444398088801541, 'bull_tsl_mult': 0.9990754145669423, 'bull_time_stop': 139, 'bull_use_sma': False, 'bull_use_ema': False, 'bull_use_atr': False, 'bull_use_adx': True, 'bull_use_spike': True, 'bull_rsi_required': False, 'bear_strategy': 'breakout', 'bear_bb_std_mult': 3.294720938520307, 'bear_rsi_os': 45, 'bear_rsi_ob': 61, 'bear_adx_thresh': 6.0196488680160884, 'bear_atr_min_pct': 0.014405007523218731, 'bear_atr_max_pct': 0.0613497135153733, 'bear_tp_mult': 1.6866164493523552, 'bear_tsl_mult': 0.11990848286444288, 'bear_time_stop': 84, 'bear_use_sma': True, 'bear_use_ema': False, 'bear_use_atr': False, 'bear_use_adx': False, 'bear_use_spike': False, 'bear_rsi_required': False, 'sideways_strategy': 'breakout', 'sideways_bb_std_mult': 2.0759156309805857, 'sideways_rsi_os': 17, 'sideways_rsi_ob': 59, 'sideways_adx_thresh': 10.500568604803183, 'sideways_atr_min_pct': 0.020441637027732103, 'sideways_atr_max_pct': 0.08011366184413896, 'sideways_tp_mult': 1.9146027082145318, 'sideways_tsl_mult': 0.20731765154087584, 'sideways_time_stop': 264, 'sideways_use_sma': False, 'sideways_use_ema': True, 'sideways_use_atr': False, 'sideways_use_adx': True, 'sideways_use_spike': False, 'sideways_rsi_required': True}.
[I 2025-08-30 19:52:31,806] Trial 578 finished with values: [-1000000000.0, 1000000000.0] and parameters: {'p_sma': 32, 'p_std': 26, 'p_atr': 10, 'p_adx': 29, 'rsi_period': 54, 'ema1': 24, 'ema2': 17, 'slip_atr_k': 0.017803594708628013, 'slip_spread_k': 0.44787166229284725, 'spread_hl_frac': 0.022894057759475554, 'bb_std_mult': 1.1269040667299486, 'rsi_os': 12, 'rsi_ob': 59, 'vol_spike': 0.030369597313338874, 'adx_thresh': 18.88650903547715, 'atr_min_pct': 0.024811324800531397, 'atr_max_pct': 0.1267770673101347, 'tp_mult': 2.0778977023279803, 'tsl_mult': 0.7292883873367966, 'strategy': 'breakout', 'time_stop': 48, 'use_sma': False, 'use_atr': True, 'use_adx': False, 'use_ema': True, 'use_spike': False, 'rsi_required': False, 'edge_k': 0.5209732007328332, 'edge_cap': 0.4486907993223907, 'bull_strategy': 'mean_reversion', 'bull_bb_std_mult': 1.9414192495337022, 'bull_rsi_os': 49, 'bull_rsi_ob': 73, 'bull_adx_thresh': 25.7070891886636, 'bull_atr_min_pct': 0.008332898370108161, 'bull_atr_max_pct': 0.11539222133027843, 'bull_tp_mult': 2.1980689266681703, 'bull_tsl_mult': 0.7315178368047403, 'bull_time_stop': 175, 'bull_use_sma': False, 'bull_use_ema': False, 'bull_use_atr': True, 'bull_use_adx': False, 'bull_use_spike': True, 'bull_rsi_required': False, 'bear_strategy': 'breakout', 'bear_bb_std_mult': 2.019490500341209, 'bear_rsi_os': 44, 'bear_rsi_ob': 85, 'bear_adx_thresh': 5.003581985771709, 'bear_atr_min_pct': 0.014474195164741627, 'bear_atr_max_pct': 0.06081281548852165, 'bear_tp_mult': 1.6936071746211907, 'bear_tsl_mult': 0.599679707832525, 'bear_time_stop': 45, 'bear_use_sma': True, 'bear_use_ema': True, 'bear_use_atr': True, 'bear_use_adx': True, 'bear_use_spike': False, 'bear_rsi_required': False, 'sideways_strategy': 'breakout', 'sideways_bb_std_mult': 3.061359062940393, 'sideways_rsi_os': 18, 'sideways_rsi_ob': 53, 'sideways_adx_thresh': 10.039219531511486, 'sideways_atr_min_pct': 0.020470016189334177, 'sideways_atr_max_pct': 0.1164542489716923, 'sideways_tp_mult': 2.240874721862605, 'sideways_tsl_mult': 0.69305533482951, 'sideways_time_stop': 134, 'sideways_use_sma': True, 'sideways_use_ema': True, 'sideways_use_atr': False, 'sideways_use_adx': True, 'sideways_use_spike': False, 'sideways_rsi_required': False}.
[I 2025-08-30 19:52:31,987] Trial 580 finished with values: [-0.0346510447039684, 0.03445889873725915] and parameters: {'p_sma': 43, 'p_std': 30, 'p_atr': 9, 'p_adx': 22, 'rsi_period': 54, 'ema1': 24, 'ema2': 12, 'slip_atr_k': 0.016977678672915754, 'slip_spread_k': 0.4402981462403155, 'spread_hl_frac': 0.004665187640482942, 'bb_std_mult': 1.0999285010008335, 'rsi_os': 54, 'rsi_ob': 60, 'vol_spike': 0.028386835534891082, 'adx_thresh': 20.922533530120496, 'atr_min_pct': 0.024823690267941758, 'atr_max_pct': 0.07961292004497508, 'tp_mult': 2.0623762155041034, 'tsl_mult': 0.9996522960727866, 'strategy': 'breakout', 'time_stop': 192, 'use_sma': False, 'use_atr': True, 'use_adx': True, 'use_ema': True, 'use_spike': False, 'rsi_required': True, 'edge_k': 0.775528919340494, 'edge_cap': 0.37201421245734034, 'bull_strategy': 'mean_reversion', 'bull_bb_std_mult': 1.9651490018805546, 'bull_rsi_os': 46, 'bull_rsi_ob': 93, 'bull_adx_thresh': 25.725106723691567, 'bull_atr_min_pct': 0.021656104503409313, 'bull_atr_max_pct': 0.08242955016103869, 'bull_tp_mult': 2.1160550854598315, 'bull_tsl_mult': 0.9554482479897612, 'bull_time_stop': 172, 'bull_use_sma': False, 'bull_use_ema': True, 'bull_use_atr': False, 'bull_use_adx': True, 'bull_use_spike': True, 'bull_rsi_required': False, 'bear_strategy': 'breakout', 'bear_bb_std_mult': 0.5294042545933582, 'bear_rsi_os': 45, 'bear_rsi_ob': 61, 'bear_adx_thresh': 6.058992368699744, 'bear_atr_min_pct': 0.0027495804014029887, 'bear_atr_max_pct': 0.06148434723686716, 'bear_tp_mult': 1.6570498160521485, 'bear_tsl_mult': 0.1198366506173876, 'bear_time_stop': 87, 'bear_use_sma': False, 'bear_use_ema': False, 'bear_use_atr': True, 'bear_use_adx': True, 'bear_use_spike': False, 'bear_rsi_required': False, 'sideways_strategy': 'breakout', 'sideways_bb_std_mult': 3.0588869456361865, 'sideways_rsi_os': 27, 'sideways_rsi_ob': 59, 'sideways_adx_thresh': 11.200360767019152, 'sideways_atr_min_pct': 0.01969581191152495, 'sideways_atr_max_pct': 0.07452627171334462, 'sideways_tp_mult': 2.399622936144521, 'sideways_tsl_mult': 0.20551839667646693, 'sideways_time_stop': 87, 'sideways_use_sma': True, 'sideways_use_ema': True, 'sideways_use_atr': False, 'sideways_use_adx': True, 'sideways_use_spike': True, 'sideways_rsi_required': False}.
[I 2025-08-30 19:52:32,849] Trial 584 finished with values: [-1000000000.0, 1000000000.0] and parameters: {'p_sma': 26, 'p_std': 29, 'p_atr': 9, 'p_adx': 25, 'rsi_period': 16, 'ema1': 29, 'ema2': 44, 'slip_atr_k': 0.2004220147539153, 'slip_spread_k': 0.43411900407807225, 'spread_hl_frac': 0.03316936106590507, 'bb_std_mult': 0.9047409383328671, 'rsi_os': 48, 'rsi_ob': 78, 'vol_spike': 0.043324094489413954, 'adx_thresh': 20.055095690930692, 'atr_min_pct': 0.023932301932413618, 'atr_max_pct': 0.02022534932317735, 'tp_mult': 2.2061956517578447, 'tsl_mult': 0.29867398955389207, 'strategy': 'breakout', 'time_stop': 166, 'use_sma': False, 'use_atr': True, 'use_adx': False, 'use_ema': False, 'use_spike': True, 'rsi_required': True, 'edge_k': 0.8874154130567522, 'edge_cap': 0.0941024159015274, 'bull_strategy': 'mean_reversion', 'bull_bb_std_mult': 1.7897385672339474, 'bull_rsi_os': 21, 'bull_rsi_ob': 71, 'bull_adx_thresh': 23.808047870759285, 'bull_atr_min_pct': 0.025472408503743323, 'bull_atr_max_pct': 0.10762918440586704, 'bull_tp_mult': 1.8712278781366072, 'bull_tsl_mult': 0.9605313371890773, 'bull_time_stop': 122, 'bull_use_sma': True, 'bull_use_ema': True, 'bull_use_atr': False, 'bull_use_adx': True, 'bull_use_spike': True, 'bull_rsi_required': True, 'bear_strategy': 'breakout', 'bear_bb_std_mult': 1.5696370135917905, 'bear_rsi_os': 44, 'bear_rsi_ob': 73, 'bear_adx_thresh': 28.692391504998305, 'bear_atr_min_pct': 0.02078091349487294, 'bear_atr_max_pct': 0.022505135788452216, 'bear_tp_mult': 1.7589009370307984, 'bear_tsl_mult': 0.8893301148471561, 'bear_time_stop': 37, 'bear_use_sma': False, 'bear_use_ema': False, 'bear_use_atr': True, 'bear_use_adx': True, 'bear_use_spike': False, 'bear_rsi_required': True, 'sideways_strategy': 'breakout', 'sideways_bb_std_mult': 2.1704594749974278, 'sideways_rsi_os': 28, 'sideways_rsi_ob': 58, 'sideways_adx_thresh': 11.292855923371057, 'sideways_atr_min_pct': 0.018467581271051522, 'sideways_atr_max_pct': 0.09014438444532306, 'sideways_tp_mult': 1.7830041104566328, 'sideways_tsl_mult': 0.5910582705408874, 'sideways_time_stop': 70, 'sideways_use_sma': True, 'sideways_use_ema': False, 'sideways_use_atr': False, 'sideways_use_adx': False, 'sideways_use_spike': True, 'sideways_rsi_required': False}.
[I 2025-08-30 19:52:32,876] Trial 585 finished with values: [-1000000000.0, 1000000000.0] and parameters: {'p_sma': 41, 'p_std': 53, 'p_atr': 11, 'p_adx': 8, 'rsi_period': 31, 'ema1': 6, 'ema2': 34, 'slip_atr_k': 0.0793739588312074, 'slip_spread_k': 0.398234294529909, 'spread_hl_frac': 0.0027903663048265276, 'bb_std_mult': 0.8953578024207193, 'rsi_os': 39, 'rsi_ob': 57, 'vol_spike': 0.20971564477344962, 'adx_thresh': 7.519633410853203, 'atr_min_pct': 0.023786285769703507, 'atr_max_pct': 0.012981895434979476, 'tp_mult': 2.67261009418595, 'tsl_mult': 0.29392096888825636, 'strategy': 'breakout', 'time_stop': 12, 'use_sma': False, 'use_atr': True, 'use_adx': False, 'use_ema': False, 'use_spike': True, 'rsi_required': True, 'edge_k': 0.923774475393192, 'edge_cap': 0.21281349339581268, 'bull_strategy': 'mean_reversion', 'bull_bb_std_mult': 2.403333911300939, 'bull_rsi_os': 50, 'bull_rsi_ob': 76, 'bull_adx_thresh': 23.787833208315647, 'bull_atr_min_pct': 0.025640483436410316, 'bull_atr_max_pct': 0.024808550441239655, 'bull_tp_mult': 2.940518542200336, 'bull_tsl_mult': 0.9640143444367835, 'bull_time_stop': 125, 'bull_use_sma': True, 'bull_use_ema': False, 'bull_use_atr': False, 'bull_use_adx': True, 'bull_use_spike': True, 'bull_rsi_required': True, 'bear_strategy': 'breakout', 'bear_bb_std_mult': 1.556814924928765, 'bear_rsi_os': 16, 'bear_rsi_ob': 83, 'bear_adx_thresh': 6.810889682313611, 'bear_atr_min_pct': 0.013626457788423828, 'bear_atr_max_pct': 0.06902612490015769, 'bear_tp_mult': 1.3620604675116694, 'bear_tsl_mult': 0.8285637550972005, 'bear_time_stop': 36, 'bear_use_sma': True, 'bear_use_ema': False, 'bear_use_atr': True, 'bear_use_adx': True, 'bear_use_spike': True, 'bear_rsi_required': True, 'sideways_strategy': 'mean_reversion', 'sideways_bb_std_mult': 2.195056114450665, 'sideways_rsi_os': 50, 'sideways_rsi_ob': 58, 'sideways_adx_thresh': 18.40124106124909, 'sideways_atr_min_pct': 0.018761871987690897, 'sideways_atr_max_pct': 0.11966554775997268, 'sideways_tp_mult': 1.7741295814306632, 'sideways_tsl_mult': 0.5941157182147447, 'sideways_time_stop': 269, 'sideways_use_sma': True, 'sideways_use_ema': False, 'sideways_use_atr': True, 'sideways_use_adx': False, 'sideways_use_spike': False, 'sideways_rsi_required': False}.
[I 2025-08-30 19:52:34,791] Trial 586 finished with values: [-1000000000.0, 1000000000.0] and parameters: {'p_sma': 15, 'p_std': 54, 'p_atr': 7, 'p_adx': 12, 'rsi_period': 56, 'ema1': 23, 'ema2': 42, 'slip_atr_k': 0.24560267540231284, 'slip_spread_k': 0.08092425331599873, 'spread_hl_frac': 0.002102757566521281, 'bb_std_mult': 3.292773635068449, 'rsi_os': 28, 'rsi_ob': 57, 'vol_spike': 0.21215096398305183, 'adx_thresh': 17.946121871147543, 'atr_min_pct': 0.022628783282180383, 'atr_max_pct': 0.013342942413814007, 'tp_mult': 1.1118377313024752, 'tsl_mult': 0.739293954990175, 'strategy': 'breakout', 'time_stop': 55, 'use_sma': False, 'use_atr': True, 'use_adx': False, 'use_ema': False, 'use_spike': True, 'rsi_required': True, 'edge_k': 0.12630864581191223, 'edge_cap': 0.7636494353391515, 'bull_strategy': 'mean_reversion', 'bull_bb_std_mult': 2.1295779726364934, 'bull_rsi_os': 30, 'bull_rsi_ob': 51, 'bull_adx_thresh': 34.14690384516236, 'bull_atr_min_pct': 0.0021865301807075296, 'bull_atr_max_pct': 0.023672374465228897, 'bull_tp_mult': 2.3102461085021804, 'bull_tsl_mult': 0.9308995664007395, 'bull_time_stop': 54, 'bull_use_sma': True, 'bull_use_ema': False, 'bull_use_atr': False, 'bull_use_adx': True, 'bull_use_spike': True, 'bull_rsi_required': True, 'bear_strategy': 'breakout', 'bear_bb_std_mult': 3.0312145111958575, 'bear_rsi_os': 9, 'bear_rsi_ob': 82, 'bear_adx_thresh': 11.027062661104642, 'bear_atr_min_pct': 0.012600652050693151, 'bear_atr_max_pct': 0.06979795791619758, 'bear_tp_mult': 2.541304943468856, 'bear_tsl_mult': 0.9218741842043419, 'bear_time_stop': 60, 'bear_use_sma': True, 'bear_use_ema': False, 'bear_use_atr': True, 'bear_use_adx': True, 'bear_use_spike': True, 'bear_rsi_required': False, 'sideways_strategy': 'mean_reversion', 'sideways_bb_std_mult': 2.357950236972317, 'sideways_rsi_os': 50, 'sideways_rsi_ob': 60, 'sideways_adx_thresh': 9.036736273883509, 'sideways_atr_min_pct': 0.01851092564567195, 'sideways_atr_max_pct': 0.12000009424777174, 'sideways_tp_mult': 2.023943789484338, 'sideways_tsl_mult': 0.5462883629430535, 'sideways_time_stop': 272, 'sideways_use_sma': True, 'sideways_use_ema': True, 'sideways_use_atr': True, 'sideways_use_adx': False, 'sideways_use_spike': False, 'sideways_rsi_required': False}.
