[I 2025-08-30 20:06:38,389] Trial 681 finished with values: [-1000000000.0, 1000000000.0] and parameters: {'p_sma': 14, 'p_std': 29, 'p_atr': 14, 'p_adx': 9, 'rsi_period': 57, 'ema1': 23, 'ema2': 53, 'slip_atr_k': 0.02417797523374876, 'slip_spread_k': 0.7154645869264389, 'spread_hl_frac': 0.02083125114487243, 'bb_std_mult': 1.023936431250097, 'rsi_os': 33, 'rsi_ob': 61, 'vol_spike': 0.205542404189393, 'adx_thresh': 24.998698093203352, 'atr_min_pct': 0.022794218402941883, 'atr_max_pct': 0.08778095547988561, 'tp_mult': 1.4541823939903393, 'tsl_mult': 0.27613769281884915, 'strategy': 'breakout', 'time_stop': 150, 'use_sma': False, 'use_atr': True, 'use_adx': False, 'use_ema': True, 'use_spike': False, 'rsi_required': False, 'edge_k': 0.25743173477826575, 'edge_cap': 0.07133972977347552, 'bull_strategy': 'mean_reversion', 'bull_bb_std_mult': 2.002831022241199, 'bull_rsi_os': 25, 'bull_rsi_ob': 74, 'bull_adx_thresh': 30.48783426790034, 'bull_atr_min_pct': 0.014194952894677974, 'bull_atr_max_pct': 0.09212238852169338, 'bull_tp_mult': 1.7533086215988936, 'bull_tsl_mult': 0.402869061264719, 'bull_time_stop': 195, 'bull_use_sma': False, 'bull_use_ema': False, 'bull_use_atr': True, 'bull_use_adx': False, 'bull_use_spike': True, 'bull_rsi_required': False, 'bear_strategy': 'breakout', 'bear_bb_std_mult': 3.1126321586371293, 'bear_rsi_os': 47, 'bear_rsi_ob': 84, 'bear_adx_thresh': 5.889458202990565, 'bear_atr_min_pct': 0.01346448880852157, 'bear_atr_max_pct': 0.053599960293762156, 'bear_tp_mult': 2.2037043294148986, 'bear_tsl_mult': 0.7552579130611268, 'bear_time_stop': 45, 'bear_use_sma': True, 'bear_use_ema': False, 'bear_use_atr': True, 'bear_use_adx': True, 'bear_use_spike': True, 'bear_rsi_required': False, 'sideways_strategy': 'mean_reversion', 'sideways_bb_std_mult': 2.1536190313978607, 'sideways_rsi_os': 13, 'sideways_rsi_ob': 67, 'sideways_adx_thresh': 10.577971349210879, 'sideways_atr_min_pct': 0.027592125943496214, 'sideways_atr_max_pct': 0.135589271454491, 'sideways_tp_mult': 2.99734207482796, 'sideways_tsl_mult': 0.674040196892222, 'sideways_time_stop': 199, 'sideways_use_sma': True, 'sideways_use_ema': True, 'sideways_use_atr': True, 'sideways_use_adx': True, 'sideways_use_spike': False, 'sideways_rsi_required': False}.
[I 2025-08-30 20:06:39,498] Trial 688 finished with values: [-1000000000.0, 1000000000.0] and parameters: {'p_sma': 41, 'p_std': 23, 'p_atr': 10, 'p_adx': 28, 'rsi_period': 79, 'ema1': 25, 'ema2': 18, 'slip_atr_k': 0.1465026807138938, 'slip_spread_k': 0.44205428199194785, 'spread_hl_frac': 0.005105787225722755, 'bb_std_mult': 0.8856660464260558, 'rsi_os': 53, 'rsi_ob': 94, 'vol_spike': 0.026418972549891458, 'adx_thresh': 5.7415496273950115, 'atr_min_pct': 0.024346296496106187, 'atr_max_pct': 0.1378905684176269, 'tp_mult': 2.503961156905943, 'tsl_mult': 0.5289407973616826, 'strategy': 'mean_reversion', 'time_stop': 57, 'use_sma': False, 'use_atr': True, 'use_adx': True, 'use_ema': False, 'use_spike': True, 'rsi_required': True, 'edge_k': 0.07627220696544804, 'edge_cap': 0.2895605399599602, 'bull_strategy': 'mean_reversion', 'bull_bb_std_mult': 2.8313173925898174, 'bull_rsi_os': 39, 'bull_rsi_ob': 64, 'bull_adx_thresh': 15.745956117004724, 'bull_atr_min_pct': 0.0028915839058638155, 'bull_atr_max_pct': 0.12353718044082991, 'bull_tp_mult': 1.6096635536618087, 'bull_tsl_mult': 0.9204266327952537, 'bull_time_stop': 173, 'bull_use_sma': True, 'bull_use_ema': True, 'bull_use_atr': False, 'bull_use_adx': True, 'bull_use_spike': False, 'bull_rsi_required': True, 'bear_strategy': 'mean_reversion', 'bear_bb_std_mult': 1.7290344502541517, 'bear_rsi_os': 50, 'bear_rsi_ob': 83, 'bear_adx_thresh': 33.385327997441166, 'bear_atr_min_pct': 0.01693897918893049, 'bear_atr_max_pct': 0.06218713476737295, 'bear_tp_mult': 1.3351056525917198, 'bear_tsl_mult': 0.08548316754635585, 'bear_time_stop': 33, 'bear_use_sma': False, 'bear_use_ema': False, 'bear_use_atr': True, 'bear_use_adx': True, 'bear_use_spike': False, 'bear_rsi_required': True, 'sideways_strategy': 'breakout', 'sideways_bb_std_mult': 2.331798109061154, 'sideways_rsi_os': 30, 'sideways_rsi_ob': 60, 'sideways_adx_thresh': 9.99405640212771, 'sideways_atr_min_pct': 0.018807649128088962, 'sideways_atr_max_pct': 0.0875875066054759, 'sideways_tp_mult': 1.4573463952284, 'sideways_tsl_mult': 0.6442989963345427, 'sideways_time_stop': 209, 'sideways_use_sma': True, 'sideways_use_ema': False, 'sideways_use_atr': False, 'sideways_use_adx': False, 'sideways_use_spike': True, 'sideways_rsi_required': False}.
[I 2025-08-30 20:07:14,109] Trial 687 finished with values: [-1000000000.0, 1000000000.0] and parameters: {'p_sma': 42, 'p_std': 27, 'p_atr': 10, 'p_adx': 29, 'rsi_period': 51, 'ema1': 23, 'ema2': 19, 'slip_atr_k': 0.1616009403904592, 'slip_spread_k': 0.8694306362414572, 'spread_hl_frac': 0.004013188456056471, 'bb_std_mult': 0.9151831572337354, 'rsi_os': 38, 'rsi_ob': 61, 'vol_spike': 0.029970784966817418, 'adx_thresh': 17.51086690363966, 'atr_min_pct': 0.02430341967933276, 'atr_max_pct': 0.0869407698547795, 'tp_mult': 2.4952636969540403, 'tsl_mult': 0.6091471414652645, 'strategy': 'mean_reversion', 'time_stop': 113, 'use_sma': False, 'use_atr': True, 'use_adx': True, 'use_ema': False, 'use_spike': True, 'rsi_required': True, 'edge_k': 0.07006101463055425, 'edge_cap': 0.30281647368765874, 'bull_strategy': 'mean_reversion', 'bull_bb_std_mult': 1.7926063864230979, 'bull_rsi_os': 50, 'bull_rsi_ob': 64, 'bull_adx_thresh': 24.13966148244944, 'bull_atr_min_pct': 0.026739610457842743, 'bull_atr_max_pct': 0.023997580048388374, 'bull_tp_mult': 1.5992820252252629, 'bull_tsl_mult': 0.3997897273069662, 'bull_time_stop': 181, 'bull_use_sma': True, 'bull_use_ema': True, 'bull_use_atr': False, 'bull_use_adx': True, 'bull_use_spike': False, 'bull_rsi_required': True, 'bear_strategy': 'mean_reversion', 'bear_bb_std_mult': 3.3082160515629253, 'bear_rsi_os': 50, 'bear_rsi_ob': 83, 'bear_adx_thresh': 26.514431919584123, 'bear_atr_min_pct': 0.02189381604573056, 'bear_atr_max_pct': 0.11043049905290686, 'bear_tp_mult': 1.745622067783937, 'bear_tsl_mult': 0.3638905194696537, 'bear_time_stop': 33, 'bear_use_sma': False, 'bear_use_ema': False, 'bear_use_atr': True, 'bear_use_adx': True, 'bear_use_spike': False, 'bear_rsi_required': True, 'sideways_strategy': 'breakout', 'sideways_bb_std_mult': 2.2516441615824214, 'sideways_rsi_os': 14, 'sideways_rsi_ob': 60, 'sideways_adx_thresh': 10.00125749896334, 'sideways_atr_min_pct': 0.018905301748175264, 'sideways_atr_max_pct': 0.12090802059240385, 'sideways_tp_mult': 1.9272093699829829, 'sideways_tsl_mult': 0.7122225593618198, 'sideways_time_stop': 209, 'sideways_use_sma': True, 'sideways_use_ema': False, 'sideways_use_atr': True, 'sideways_use_adx': False, 'sideways_use_spike': True, 'sideways_rsi_required': False}.
[I 2025-08-30 20:07:16,557] Trial 686 finished with values: [-1000000000.0, 1000000000.0] and parameters: {'p_sma': 41, 'p_std': 10, 'p_atr': 17, 'p_adx': 14, 'rsi_period': 53, 'ema1': 25, 'ema2': 18, 'slip_atr_k': 0.11172259449675717, 'slip_spread_k': 0.7710211836767862, 'spread_hl_frac': 0.005425821269109857, 'bb_std_mult': 0.8971191985890181, 'rsi_os': 38, 'rsi_ob': 77, 'vol_spike': 0.02807159960541572, 'adx_thresh': 16.655407399179072, 'atr_min_pct': 0.022675898093564687, 'atr_max_pct': 0.08693587644043674, 'tp_mult': 2.2962223520762484, 'tsl_mult': 0.523655779284727, 'strategy': 'mean_reversion', 'time_stop': 27, 'use_sma': False, 'use_atr': True, 'use_adx': False, 'use_ema': False, 'use_spike': True, 'rsi_required': True, 'edge_k': 0.07305777016125281, 'edge_cap': 0.29117790982300956, 'bull_strategy': 'mean_reversion', 'bull_bb_std_mult': 3.4571509270194984, 'bull_rsi_os': 47, 'bull_rsi_ob': 72, 'bull_adx_thresh': 24.275226864936265, 'bull_atr_min_pct': 0.007880491553518491, 'bull_atr_max_pct': 0.07886705673306914, 'bull_tp_mult': 2.6741132843608426, 'bull_tsl_mult': 0.9250840900490536, 'bull_time_stop': 280, 'bull_use_sma': True, 'bull_use_ema': True, 'bull_use_atr': False, 'bull_use_adx': True, 'bull_use_spike': False, 'bull_rsi_required': True, 'bear_strategy': 'mean_reversion', 'bear_bb_std_mult': 1.732126455456155, 'bear_rsi_os': 41, 'bear_rsi_ob': 84, 'bear_adx_thresh': 33.34811136055451, 'bear_atr_min_pct': 0.01592189935726866, 'bear_atr_max_pct': 0.07675534787185732, 'bear_tp_mult': 2.033832871800354, 'bear_tsl_mult': 0.10580550532486269, 'bear_time_stop': 35, 'bear_use_sma': False, 'bear_use_ema': False, 'bear_use_atr': True, 'bear_use_adx': True, 'bear_use_spike': False, 'bear_rsi_required': False, 'sideways_strategy': 'breakout', 'sideways_bb_std_mult': 2.0042019626805128, 'sideways_rsi_os': 14, 'sideways_rsi_ob': 71, 'sideways_adx_thresh': 15.71817653228932, 'sideways_atr_min_pct': 0.019719516508543523, 'sideways_atr_max_pct': 0.049959908171849005, 'sideways_tp_mult': 2.7165257836976826, 'sideways_tsl_mult': 0.6426748033195689, 'sideways_time_stop': 199, 'sideways_use_sma': True, 'sideways_use_ema': True, 'sideways_use_atr': False, 'sideways_use_adx': False, 'sideways_use_spike': True, 'sideways_rsi_required': False}.
[I 2025-08-30 20:07:16,557] Trial 685 finished with values: [-1000000000.0, 1000000000.0] and parameters: {'p_sma': 39, 'p_std': 23, 'p_atr': 30, 'p_adx': 24, 'rsi_period': 33, 'ema1': 25, 'ema2': 18, 'slip_atr_k': 0.11115118291517528, 'slip_spread_k': 0.7777627485581249, 'spread_hl_frac': 0.005624031356521706, 'bb_std_mult': 0.8995615152140576, 'rsi_os': 46, 'rsi_ob': 79, 'vol_spike': 0.21727877873105633, 'adx_thresh': 26.97145072599663, 'atr_min_pct': 0.02433446767023107, 'atr_max_pct': 0.14220531594863817, 'tp_mult': 2.4862242641498433, 'tsl_mult': 0.6965220852967247, 'strategy': 'mean_reversion', 'time_stop': 58, 'use_sma': False, 'use_atr': True, 'use_adx': False, 'use_ema': False, 'use_spike': True, 'rsi_required': True, 'edge_k': 0.16904878268621004, 'edge_cap': 0.23317250987900126, 'bull_strategy': 'mean_reversion', 'bull_bb_std_mult': 3.4859201756695226, 'bull_rsi_os': 47, 'bull_rsi_ob': 64, 'bull_adx_thresh': 23.541237049590084, 'bull_atr_min_pct': 0.0029430755781836263, 'bull_atr_max_pct': 0.10012410075876914, 'bull_tp_mult': 2.127194887802823, 'bull_tsl_mult': 0.9996978573990224, 'bull_time_stop': 172, 'bull_use_sma': True, 'bull_use_ema': True, 'bull_use_atr': False, 'bull_use_adx': True, 'bull_use_spike': False, 'bull_rsi_required': True, 'bear_strategy': 'mean_reversion', 'bear_bb_std_mult': 3.309236057057576, 'bear_rsi_os': 41, 'bear_rsi_ob': 84, 'bear_adx_thresh': 6.026562385145602, 'bear_atr_min_pct': 0.01704618518851333, 'bear_atr_max_pct': 0.06002508646683556, 'bear_tp_mult': 1.7503949762324957, 'bear_tsl_mult': 0.3720648349314525, 'bear_time_stop': 34, 'bear_use_sma': False, 'bear_use_ema': False, 'bear_use_atr': True, 'bear_use_adx': True, 'bear_use_spike': False, 'bear_rsi_required': False, 'sideways_strategy': 'breakout', 'sideways_bb_std_mult': 2.6403921872158724, 'sideways_rsi_os': 30, 'sideways_rsi_ob': 60, 'sideways_adx_thresh': 9.890802886467927, 'sideways_atr_min_pct': 0.01879506497092208, 'sideways_atr_max_pct': 0.08437019270475485, 'sideways_tp_mult': 1.562115482303948, 'sideways_tsl_mult': 0.675716322072276, 'sideways_time_stop': 155, 'sideways_use_sma': True, 'sideways_use_ema': True, 'sideways_use_atr': False, 'sideways_use_adx': False, 'sideways_use_spike': True, 'sideways_rsi_required': False}.
[I 2025-08-30 20:07:17,243] Trial 689 finished with values: [-1000000000.0, 1000000000.0] and parameters: {'p_sma': 58, 'p_std': 27, 'p_atr': 17, 'p_adx': 23, 'rsi_period': 14, 'ema1': 19, 'ema2': 19, 'slip_atr_k': 0.15588824445539323, 'slip_spread_k': 0.42861596178906136, 'spread_hl_frac': 0.0038045451611321184, 'bb_std_mult': 0.5025246915008665, 'rsi_os': 44, 'rsi_ob': 58, 'vol_spike': 0.25934795396079424, 'adx_thresh': 21.22154205844963, 'atr_min_pct': 1.647884602212421e-05, 'atr_max_pct': 0.11194184735749034, 'tp_mult': 2.436823005544831, 'tsl_mult': 0.6103903953287338, 'strategy': 'mean_reversion', 'time_stop': 38, 'use_sma': False, 'use_atr': False, 'use_adx': False, 'use_ema': False, 'use_spike': True, 'rsi_required': True, 'edge_k': 0.652237844519516, 'edge_cap': 0.23186555806656664, 'bull_strategy': 'breakout', 'bull_bb_std_mult': 1.8007320754455964, 'bull_rsi_os': 50, 'bull_rsi_ob': 82, 'bull_adx_thresh': 26.27528709266966, 'bull_atr_min_pct': 0.0038937662582348024, 'bull_atr_max_pct': 0.024256832436521485, 'bull_tp_mult': 2.1348428451172463, 'bull_tsl_mult': 0.9634701379500813, 'bull_time_stop': 184, 'bull_use_sma': True, 'bull_use_ema': False, 'bull_use_atr': False, 'bull_use_adx': True, 'bull_use_spike': True, 'bull_rsi_required': True, 'bear_strategy': 'breakout', 'bear_bb_std_mult': 3.2026439096310493, 'bear_rsi_os': 49, 'bear_rsi_ob': 82, 'bear_adx_thresh': 8.575655035171398, 'bear_atr_min_pct': 0.015857860942253495, 'bear_atr_max_pct': 0.07592224990416524, 'bear_tp_mult': 1.748577096654778, 'bear_tsl_mult': 0.10229416849396542, 'bear_time_stop': 35, 'bear_use_sma': True, 'bear_use_ema': False, 'bear_use_atr': False, 'bear_use_adx': False, 'bear_use_spike': False, 'bear_rsi_required': False, 'sideways_strategy': 'breakout', 'sideways_bb_std_mult': 2.6445810644548526, 'sideways_rsi_os': 23, 'sideways_rsi_ob': 71, 'sideways_adx_thresh': 8.743987511252145, 'sideways_atr_min_pct': 0.019612341269610475, 'sideways_atr_max_pct': 0.050932162338530956, 'sideways_tp_mult': 1.9168478691778619, 'sideways_tsl_mult': 0.7149206934025828, 'sideways_time_stop': 259, 'sideways_use_sma': False, 'sideways_use_ema': True, 'sideways_use_atr': False, 'sideways_use_adx': False, 'sideways_use_spike': False, 'sideways_rsi_required': True}.
[I 2025-08-30 20:07:50,871] Trial 690 finished with values: [-1000000000.0, 1000000000.0] and parameters: {'p_sma': 26, 'p_std': 25, 'p_atr': 30, 'p_adx': 23, 'rsi_period': 53, 'ema1': 24, 'ema2': 60, 'slip_atr_k': 0.11190123285600746, 'slip_spread_k': 0.4211814797056575, 'spread_hl_frac': 0.005435788980784971, 'bb_std_mult': 1.126504078535762, 'rsi_os': 39, 'rsi_ob': 76, 'vol_spike': 0.04276154733552929, 'adx_thresh': 18.16258589165223, 'atr_min_pct': 0.02344872873289239, 'atr_max_pct': 0.06418050256217854, 'tp_mult': 2.18490327274838, 'tsl_mult': 0.22768689687569388, 'strategy': 'breakout', 'time_stop': 37, 'use_sma': True, 'use_atr': False, 'use_adx': False, 'use_ema': False, 'use_spike': True, 'rsi_required': True, 'edge_k': 0.6575113428915039, 'edge_cap': 0.452594064774564, 'bull_strategy': 'breakout', 'bull_bb_std_mult': 1.8421917683842306, 'bull_rsi_os': 22, 'bull_rsi_ob': 82, 'bull_adx_thresh': 26.27010346859866, 'bull_atr_min_pct': 0.0037657734649771592, 'bull_atr_max_pct': 0.07764698278684372, 'bull_tp_mult': 2.223770459514986, 'bull_tsl_mult': 0.9598359408925381, 'bull_time_stop': 166, 'bull_use_sma': True, 'bull_use_ema': False, 'bull_use_atr': False, 'bull_use_adx': True, 'bull_use_spike': True, 'bull_rsi_required': True, 'bear_strategy': 'breakout', 'bear_bb_std_mult': 3.2207516145093225, 'bear_rsi_os': 33, 'bear_rsi_ob': 77, 'bear_adx_thresh': 34.262765741108026, 'bear_atr_min_pct': 0.00850215282963562, 'bear_atr_max_pct': 0.06031959715806939, 'bear_tp_mult': 1.8142010628316876, 'bear_tsl_mult': 0.10590510425898166, 'bear_time_stop': 165, 'bear_use_sma': True, 'bear_use_ema': False, 'bear_use_atr': False, 'bear_use_adx': False, 'bear_use_spike': False, 'bear_rsi_required': False, 'sideways_strategy': 'breakout', 'sideways_bb_std_mult': 2.6678721521836155, 'sideways_rsi_os': 43, 'sideways_rsi_ob': 45, 'sideways_adx_thresh': 8.640450566524862, 'sideways_atr_min_pct': 0.0198219166212717, 'sideways_atr_max_pct': 0.12969434896623452, 'sideways_tp_mult': 1.884070262929713, 'sideways_tsl_mult': 0.24671825869770453, 'sideways_time_stop': 257, 'sideways_use_sma': False, 'sideways_use_ema': True, 'sideways_use_atr': False, 'sideways_use_adx': False, 'sideways_use_spike': False, 'sideways_rsi_required': True}.
[I 2025-08-30 20:07:52,013] Trial 692 finished with values: [-1000000000.0, 1000000000.0] and parameters: {'p_sma': 27, 'p_std': 25, 'p_atr': 10, 'p_adx': 18, 'rsi_period': 52, 'ema1': 24, 'ema2': 16, 'slip_atr_k': 0.15603548255228905, 'slip_spread_k': 0.4200230383756662, 'spread_hl_frac': 0.01844692730034444, 'bb_std_mult': 1.1068078735706535, 'rsi_os': 35, 'rsi_ob': 68, 'vol_spike': 0.07191410816503627, 'adx_thresh': 18.146230510165815, 'atr_min_pct': 0.00022404717220535393, 'atr_max_pct': 0.018449073038106695, 'tp_mult': 2.1132618412393036, 'tsl_mult': 0.7376447171487276, 'strategy': 'breakout', 'time_stop': 211, 'use_sma': True, 'use_atr': False, 'use_adx': False, 'use_ema': True, 'use_spike': False, 'rsi_required': True, 'edge_k': 1.013221050218809, 'edge_cap': 0.25302188110898494, 'bull_strategy': 'breakout', 'bull_bb_std_mult': 1.8780792340365642, 'bull_rsi_os': 51, 'bull_rsi_ob': 76, 'bull_adx_thresh': 32.846722846948616, 'bull_atr_min_pct': 0.00399636903287892, 'bull_atr_max_pct': 0.02647570358557488, 'bull_tp_mult': 2.2159159269172837, 'bull_tsl_mult': 0.6458309492154445, 'bull_time_stop': 165, 'bull_use_sma': True, 'bull_use_ema': False, 'bull_use_atr': False, 'bull_use_adx': True, 'bull_use_spike': True, 'bull_rsi_required': False, 'bear_strategy': 'breakout', 'bear_bb_std_mult': 3.2445754547060486, 'bear_rsi_os': 10, 'bear_rsi_ob': 77, 'bear_adx_thresh': 7.556056919818996, 'bear_atr_min_pct': 0.01478231338825736, 'bear_atr_max_pct': 0.03509037432491056, 'bear_tp_mult': 2.5294847372335276, 'bear_tsl_mult': 0.9137139356077892, 'bear_time_stop': 179, 'bear_use_sma': True, 'bear_use_ema': True, 'bear_use_atr': False, 'bear_use_adx': False, 'bear_use_spike': False, 'bear_rsi_required': False, 'sideways_strategy': 'breakout', 'sideways_bb_std_mult': 0.5018409529747225, 'sideways_rsi_os': 16, 'sideways_rsi_ob': 55, 'sideways_adx_thresh': 8.708870294857732, 'sideways_atr_min_pct': 0.002001790691450714, 'sideways_atr_max_pct': 0.12925003230179546, 'sideways_tp_mult': 1.8317064210685026, 'sideways_tsl_mult': 0.38384963350606316, 'sideways_time_stop': 255, 'sideways_use_sma': False, 'sideways_use_ema': True, 'sideways_use_atr': False, 'sideways_use_adx': False, 'sideways_use_spike': False, 'sideways_rsi_required': True}.
[I 2025-08-30 20:07:52,250] Trial 691 finished with values: [-1000000000.0, 1000000000.0] and parameters: {'p_sma': 7, 'p_std': 25, 'p_atr': 10, 'p_adx': 18, 'rsi_period': 49, 'ema1': 24, 'ema2': 15, 'slip_atr_k': 0.003392801344497126, 'slip_spread_k': 0.4182833916580311, 'spread_hl_frac': 0.0034556701607492656, 'bb_std_mult': 2.9707368514561336, 'rsi_os': 42, 'rsi_ob': 46, 'vol_spike': 0.10301286624888659, 'adx_thresh': 18.14758320229995, 'atr_min_pct': 1.035741453503207e-05, 'atr_max_pct': 0.07872220608900005, 'tp_mult': 2.1102321381839184, 'tsl_mult': 0.7380514172305007, 'strategy': 'breakout', 'time_stop': 37, 'use_sma': True, 'use_atr': False, 'use_adx': False, 'use_ema': True, 'use_spike': False, 'rsi_required': True, 'edge_k': 0.6636329496233438, 'edge_cap': 0.19457586546486225, 'bull_strategy': 'breakout', 'bull_bb_std_mult': 1.8905268606130787, 'bull_rsi_os': 51, 'bull_rsi_ob': 57, 'bull_adx_thresh': 33.03318086235321, 'bull_atr_min_pct': 0.02874310898257247, 'bull_atr_max_pct': 0.026588320100769475, 'bull_tp_mult': 2.2111172907853063, 'bull_tsl_mult': 0.9642941210153672, 'bull_time_stop': 65, 'bull_use_sma': True, 'bull_use_ema': False, 'bull_use_atr': False, 'bull_use_adx': True, 'bull_use_spike': True, 'bull_rsi_required': False, 'bear_strategy': 'breakout', 'bear_bb_std_mult': 3.215702942360931, 'bear_rsi_os': 31, 'bear_rsi_ob': 54, 'bear_adx_thresh': 8.981359432111773, 'bear_atr_min_pct': 0.014404983307755753, 'bear_atr_max_pct': 0.06101488094262893, 'bear_tp_mult': 1.8317364342959168, 'bear_tsl_mult': 0.12628321289153804, 'bear_time_stop': 64, 'bear_use_sma': True, 'bear_use_ema': True, 'bear_use_atr': False, 'bear_use_adx': False, 'bear_use_spike': False, 'bear_rsi_required': False, 'sideways_strategy': 'breakout', 'sideways_bb_std_mult': 0.9925310102945568, 'sideways_rsi_os': 16, 'sideways_rsi_ob': 62, 'sideways_adx_thresh': 8.453587847783409, 'sideways_atr_min_pct': 0.016786542625097583, 'sideways_atr_max_pct': 0.1135839015162469, 'sideways_tp_mult': 1.8703665600750896, 'sideways_tsl_mult': 0.11959684639099843, 'sideways_time_stop': 268, 'sideways_use_sma': False, 'sideways_use_ema': True, 'sideways_use_atr': False, 'sideways_use_adx': False, 'sideways_use_spike': False, 'sideways_rsi_required': True}.
