[I 2025-08-30 20:18:26,886] Trial 767 finished with values: [-1000000000.0, 1000000000.0] and parameters: {'p_sma': 49, 'p_std': 57, 'p_atr': 10, 'p_adx': 9, 'rsi_period': 53, 'ema1': 20, 'ema2': 17, 'slip_atr_k': 0.2112877650943689, 'slip_spread_k': 0.4041679251585068, 'spread_hl_frac': 0.003926078198681709, 'bb_std_mult': 3.5444059397611873, 'rsi_os': 37, 'rsi_ob': 53, 'vol_spike': 0.2197936401642813, 'adx_thresh': 27.455836735290838, 'atr_min_pct': 0.02386651060479116, 'atr_max_pct': 0.13120470937977782, 'tp_mult': 2.1324332086424755, 'tsl_mult': 0.7125113793822642, 'strategy': 'breakout', 'time_stop': 98, 'use_sma': False, 'use_atr': False, 'use_adx': True, 'use_ema': True, 'use_spike': False, 'rsi_required': True, 'edge_k': 1.677562013570292, 'edge_cap': 0.12168174144224958, 'bull_strategy': 'breakout', 'bull_bb_std_mult': 2.517969744291182, 'bull_rsi_os': 50, 'bull_rsi_ob': 95, 'bull_adx_thresh': 21.309341183512757, 'bull_atr_min_pct': 0.009953595329474704, 'bull_atr_max_pct': 0.12187558218660702, 'bull_tp_mult': 2.2268501964561582, 'bull_tsl_mult': 0.21057528731256098, 'bull_time_stop': 175, 'bull_use_sma': True, 'bull_use_ema': False, 'bull_use_atr': True, 'bull_use_adx': False, 'bull_use_spike': True, 'bull_rsi_required': False, 'bear_strategy': 'mean_reversion', 'bear_bb_std_mult': 3.380997552529951, 'bear_rsi_os': 43, 'bear_rsi_ob': 92, 'bear_adx_thresh': 6.742409983139246, 'bear_atr_min_pct': 0.019545115559022695, 'bear_atr_max_pct': 0.05601130526784093, 'bear_tp_mult': 1.6988477488535398, 'bear_tsl_mult': 0.6262734320955976, 'bear_time_stop': 92, 'bear_use_sma': True, 'bear_use_ema': True, 'bear_use_atr': False, 'bear_use_adx': False, 'bear_use_spike': True, 'bear_rsi_required': False, 'sideways_strategy': 'breakout', 'sideways_bb_std_mult': 1.4341970260522847, 'sideways_rsi_os': 42, 'sideways_rsi_ob': 50, 'sideways_adx_thresh': 9.112961264152048, 'sideways_atr_min_pct': 0.020230152577235684, 'sideways_atr_max_pct': 0.13321139799179227, 'sideways_tp_mult': 1.839537570223972, 'sideways_tsl_mult': 0.6039258037645736, 'sideways_time_stop': 265, 'sideways_use_sma': True, 'sideways_use_ema': False, 'sideways_use_atr': True, 'sideways_use_adx': False, 'sideways_use_spike': False, 'sideways_rsi_required': False}.
[I 2025-08-30 20:18:27,171] Trial 764 finished with values: [-1000000000.0, 1000000000.0] and parameters: {'p_sma': 49, 'p_std': 57, 'p_atr': 10, 'p_adx': 9, 'rsi_period': 58, 'ema1': 11, 'ema2': 17, 'slip_atr_k': 0.023854880906576406, 'slip_spread_k': 0.43383877174229035, 'spread_hl_frac': 0.006269862355072553, 'bb_std_mult': 0.8911652407538946, 'rsi_os': 25, 'rsi_ob': 57, 'vol_spike': 0.028306686155281133, 'adx_thresh': 20.51973230910431, 'atr_min_pct': 0.028511378508385178, 'atr_max_pct': 0.09017153291111119, 'tp_mult': 2.1326695248740757, 'tsl_mult': 0.6962657167858002, 'strategy': 'breakout', 'time_stop': 169, 'use_sma': False, 'use_atr': True, 'use_adx': True, 'use_ema': True, 'use_spike': False, 'rsi_required': True, 'edge_k': 0.25569762920953976, 'edge_cap': 0.2441876946066628, 'bull_strategy': 'mean_reversion', 'bull_bb_std_mult': 3.0223697315763816, 'bull_rsi_os': 50, 'bull_rsi_ob': 95, 'bull_adx_thresh': 25.473087902468116, 'bull_atr_min_pct': 0.011496763679600883, 'bull_atr_max_pct': 0.10954056171013898, 'bull_tp_mult': 1.1126798991281306, 'bull_tsl_mult': 0.9792372734752955, 'bull_time_stop': 183, 'bull_use_sma': False, 'bull_use_ema': False, 'bull_use_atr': False, 'bull_use_adx': False, 'bull_use_spike': True, 'bull_rsi_required': False, 'bear_strategy': 'mean_reversion', 'bear_bb_std_mult': 3.2777338839010457, 'bear_rsi_os': 43, 'bear_rsi_ob': 47, 'bear_adx_thresh': 5.6678895797840045, 'bear_atr_min_pct': 0.008936451398926737, 'bear_atr_max_pct': 0.14940029464146554, 'bear_tp_mult': 1.7915617364274534, 'bear_tsl_mult': 0.07579322396880092, 'bear_time_stop': 89, 'bear_use_sma': True, 'bear_use_ema': False, 'bear_use_atr': True, 'bear_use_adx': True, 'bear_use_spike': False, 'bear_rsi_required': False, 'sideways_strategy': 'breakout', 'sideways_bb_std_mult': 2.0249255776922706, 'sideways_rsi_os': 42, 'sideways_rsi_ob': 58, 'sideways_adx_thresh': 9.230865033154513, 'sideways_atr_min_pct': 0.027333724988310597, 'sideways_atr_max_pct': 0.1324978393938341, 'sideways_tp_mult': 1.828807005532788, 'sideways_tsl_mult': 0.5988456239545025, 'sideways_time_stop': 272, 'sideways_use_sma': True, 'sideways_use_ema': True, 'sideways_use_atr': False, 'sideways_use_adx': True, 'sideways_use_spike': False, 'sideways_rsi_required': False}.
[I 2025-08-30 20:18:27,975] Trial 765 finished with values: [-1000000000.0, 1000000000.0] and parameters: {'p_sma': 36, 'p_std': 43, 'p_atr': 10, 'p_adx': 20, 'rsi_period': 54, 'ema1': 11, 'ema2': 17, 'slip_atr_k': 0.011760698669733713, 'slip_spread_k': 0.3481623732525783, 'spread_hl_frac': 0.0038323263235260988, 'bb_std_mult': 0.8949547307960344, 'rsi_os': 39, 'rsi_ob': 57, 'vol_spike': 0.03782676570580927, 'adx_thresh': 16.79974062414545, 'atr_min_pct': 0.02096444898493946, 'atr_max_pct': 0.1305477893344684, 'tp_mult': 1.5095090765169992, 'tsl_mult': 0.7073472916303203, 'strategy': 'mean_reversion', 'time_stop': 29, 'use_sma': True, 'use_atr': True, 'use_adx': True, 'use_ema': True, 'use_spike': False, 'rsi_required': False, 'edge_k': 1.6690337017083516, 'edge_cap': 0.37162015890995537, 'bull_strategy': 'mean_reversion', 'bull_bb_std_mult': 2.9950967247456033, 'bull_rsi_os': 50, 'bull_rsi_ob': 72, 'bull_adx_thresh': 21.270875859083354, 'bull_atr_min_pct': 0.002321040235983777, 'bull_atr_max_pct': 0.10808653899319767, 'bull_tp_mult': 2.2241015117657525, 'bull_tsl_mult': 0.15773533392528977, 'bull_time_stop': 185, 'bull_use_sma': True, 'bull_use_ema': False, 'bull_use_atr': False, 'bull_use_adx': False, 'bull_use_spike': True, 'bull_rsi_required': False, 'bear_strategy': 'mean_reversion', 'bear_bb_std_mult': 1.6417529413817886, 'bear_rsi_os': 24, 'bear_rsi_ob': 63, 'bear_adx_thresh': 26.753461155542336, 'bear_atr_min_pct': 0.019847420456316697, 'bear_atr_max_pct': 0.056502550931185495, 'bear_tp_mult': 1.6994107616316294, 'bear_tsl_mult': 0.08256694002255287, 'bear_time_stop': 87, 'bear_use_sma': True, 'bear_use_ema': False, 'bear_use_atr': True, 'bear_use_adx': True, 'bear_use_spike': False, 'bear_rsi_required': False, 'sideways_strategy': 'breakout', 'sideways_bb_std_mult': 2.008536372337518, 'sideways_rsi_os': 18, 'sideways_rsi_ob': 93, 'sideways_adx_thresh': 24.847062042852194, 'sideways_atr_min_pct': 0.01993779113119701, 'sideways_atr_max_pct': 0.11843778461162031, 'sideways_tp_mult': 2.117079473419095, 'sideways_tsl_mult': 0.0974108768901224, 'sideways_time_stop': 272, 'sideways_use_sma': True, 'sideways_use_ema': True, 'sideways_use_atr': False, 'sideways_use_adx': False, 'sideways_use_spike': False, 'sideways_rsi_required': False}.
[I 2025-08-30 20:18:28,542] Trial 768 finished with values: [-1000000000.0, 1000000000.0] and parameters: {'p_sma': 22, 'p_std': 50, 'p_atr': 29, 'p_adx': 8, 'rsi_period': 58, 'ema1': 24, 'ema2': 17, 'slip_atr_k': 0.02207191140059925, 'slip_spread_k': 0.8579043485914195, 'spread_hl_frac': 0.004103950413714692, 'bb_std_mult': 3.0235842500784096, 'rsi_os': 39, 'rsi_ob': 57, 'vol_spike': 0.0385604832571405, 'adx_thresh': 20.214094294994133, 'atr_min_pct': 0.027727924597813446, 'atr_max_pct': 0.13121152032403194, 'tp_mult': 2.015304995591849, 'tsl_mult': 0.5114719101963574, 'strategy': 'breakout', 'time_stop': 29, 'use_sma': False, 'use_atr': True, 'use_adx': True, 'use_ema': True, 'use_spike': False, 'rsi_required': True, 'edge_k': 0.26022524633988764, 'edge_cap': 0.406836574030781, 'bull_strategy': 'breakout', 'bull_bb_std_mult': 1.7903379816318914, 'bull_rsi_os': 48, 'bull_rsi_ob': 94, 'bull_adx_thresh': 24.730415522552672, 'bull_atr_min_pct': 0.001898092841193957, 'bull_atr_max_pct': 0.10879061032453502, 'bull_tp_mult': 1.9881478748654784, 'bull_tsl_mult': 0.19538622843158127, 'bull_time_stop': 255, 'bull_use_sma': True, 'bull_use_ema': False, 'bull_use_atr': True, 'bull_use_adx': False, 'bull_use_spike': True, 'bull_rsi_required': False, 'bear_strategy': 'mean_reversion', 'bear_bb_std_mult': 1.4779468263329134, 'bear_rsi_os': 30, 'bear_rsi_ob': 92, 'bear_adx_thresh': 5.054550570643948, 'bear_atr_min_pct': 0.018659638950722264, 'bear_atr_max_pct': 0.05619700938023901, 'bear_tp_mult': 1.7045753198858147, 'bear_tsl_mult': 0.15071969255954082, 'bear_time_stop': 37, 'bear_use_sma': True, 'bear_use_ema': True, 'bear_use_atr': True, 'bear_use_adx': True, 'bear_use_spike': True, 'bear_rsi_required': True, 'sideways_strategy': 'breakout', 'sideways_bb_std_mult': 1.9994044032076617, 'sideways_rsi_os': 18, 'sideways_rsi_ob': 58, 'sideways_adx_thresh': 9.174987101872503, 'sideways_atr_min_pct': 0.020179589624853982, 'sideways_atr_max_pct': 0.12079569950165872, 'sideways_tp_mult': 1.1128972925338658, 'sideways_tsl_mult': 0.5935071261545217, 'sideways_time_stop': 281, 'sideways_use_sma': True, 'sideways_use_ema': False, 'sideways_use_atr': True, 'sideways_use_adx': False, 'sideways_use_spike': False, 'sideways_rsi_required': False}.
[I 2025-08-30 20:18:29,488] Trial 772 finished with values: [-1000000000.0, 1000000000.0] and parameters: {'p_sma': 5, 'p_std': 29, 'p_atr': 17, 'p_adx': 29, 'rsi_period': 29, 'ema1': 24, 'ema2': 27, 'slip_atr_k': 0.017777615640221248, 'slip_spread_k': 0.6509495448100333, 'spread_hl_frac': 0.02384499186113884, 'bb_std_mult': 0.8419699019459348, 'rsi_os': 12, 'rsi_ob': 67, 'vol_spike': 0.25485310664889965, 'adx_thresh': 28.302938107406312, 'atr_min_pct': 0.025843100209867062, 'atr_max_pct': 0.01011913875987383, 'tp_mult': 2.202422900667068, 'tsl_mult': 0.7469381127783268, 'strategy': 'breakout', 'time_stop': 46, 'use_sma': False, 'use_atr': True, 'use_adx': False, 'use_ema': False, 'use_spike': True, 'rsi_required': True, 'edge_k': 0.8929315477069812, 'edge_cap': 0.7456088168878625, 'bull_strategy': 'mean_reversion', 'bull_bb_std_mult': 3.2736176352921924, 'bull_rsi_os': 48, 'bull_rsi_ob': 79, 'bull_adx_thresh': 18.688224171401746, 'bull_atr_min_pct': 0.017934196513778616, 'bull_atr_max_pct': 0.0920393352081102, 'bull_tp_mult': 1.1711189693749553, 'bull_tsl_mult': 0.890040641110093, 'bull_time_stop': 195, 'bull_use_sma': True, 'bull_use_ema': False, 'bull_use_atr': False, 'bull_use_adx': True, 'bull_use_spike': True, 'bull_rsi_required': True, 'bear_strategy': 'breakout', 'bear_bb_std_mult': 3.3432342511076896, 'bear_rsi_os': 45, 'bear_rsi_ob': 85, 'bear_adx_thresh': 5.0049560414503755, 'bear_atr_min_pct': 0.01607460273193064, 'bear_atr_max_pct': 0.0650011283641006, 'bear_tp_mult': 1.7874979150985952, 'bear_tsl_mult': 0.12342212404313724, 'bear_time_stop': 43, 'bear_use_sma': True, 'bear_use_ema': False, 'bear_use_atr': True, 'bear_use_adx': True, 'bear_use_spike': False, 'bear_rsi_required': True, 'sideways_strategy': 'mean_reversion', 'sideways_bb_std_mult': 2.86173994644988, 'sideways_rsi_os': 24, 'sideways_rsi_ob': 59, 'sideways_adx_thresh': 9.965392822670847, 'sideways_atr_min_pct': 0.006968458008950285, 'sideways_atr_max_pct': 0.05338006139199172, 'sideways_tp_mult': 1.7379258287380757, 'sideways_tsl_mult': 0.7851255685044471, 'sideways_time_stop': 96, 'sideways_use_sma': False, 'sideways_use_ema': True, 'sideways_use_atr': False, 'sideways_use_adx': False, 'sideways_use_spike': False, 'sideways_rsi_required': True}.
[I 2025-08-30 20:19:01,480] Trial 771 finished with values: [-1000000000.0, 1000000000.0] and parameters: {'p_sma': 32, 'p_std': 29, 'p_atr': 17, 'p_adx': 8, 'rsi_period': 52, 'ema1': 24, 'ema2': 19, 'slip_atr_k': 0.01906550678094429, 'slip_spread_k': 0.9444571075851503, 'spread_hl_frac': 0.004949148658067195, 'bb_std_mult': 0.9638942586575174, 'rsi_os': 37, 'rsi_ob': 52, 'vol_spike': 0.17326926515439792, 'adx_thresh': 19.355371522812916, 'atr_min_pct': 0.02702270982290427, 'atr_max_pct': 0.02849745235009471, 'tp_mult': 2.1861232070818826, 'tsl_mult': 0.7521589809158359, 'strategy': 'breakout', 'time_stop': 69, 'use_sma': False, 'use_atr': True, 'use_adx': False, 'use_ema': False, 'use_spike': True, 'rsi_required': True, 'edge_k': 0.13612106695620454, 'edge_cap': 0.20602642658483636, 'bull_strategy': 'breakout', 'bull_bb_std_mult': 1.7738614231038785, 'bull_rsi_os': 48, 'bull_rsi_ob': 55, 'bull_adx_thresh': 10.82646132288415, 'bull_atr_min_pct': 0.017162126741180388, 'bull_atr_max_pct': 0.11770297553663658, 'bull_tp_mult': 2.328271121533762, 'bull_tsl_mult': 0.8806545131736813, 'bull_time_stop': 39, 'bull_use_sma': True, 'bull_use_ema': False, 'bull_use_atr': True, 'bull_use_adx': True, 'bull_use_spike': True, 'bull_rsi_required': True, 'bear_strategy': 'breakout', 'bear_bb_std_mult': 1.4847251287424108, 'bear_rsi_os': 12, 'bear_rsi_ob': 85, 'bear_adx_thresh': 5.070643619499474, 'bear_atr_min_pct': 0.015951215198366925, 'bear_atr_max_pct': 0.04460297042746848, 'bear_tp_mult': 2.12862626907562, 'bear_tsl_mult': 0.15454318341754664, 'bear_time_stop': 101, 'bear_use_sma': True, 'bear_use_ema': True, 'bear_use_atr': True, 'bear_use_adx': True, 'bear_use_spike': True, 'bear_rsi_required': True, 'sideways_strategy': 'breakout', 'sideways_bb_std_mult': 1.951952192951373, 'sideways_rsi_os': 15, 'sideways_rsi_ob': 59, 'sideways_adx_thresh': 12.820894524142613, 'sideways_atr_min_pct': 0.018843293850778303, 'sideways_atr_max_pct': 0.12268813089480135, 'sideways_tp_mult': 1.735253429198833, 'sideways_tsl_mult': 0.6554066140710708, 'sideways_time_stop': 282, 'sideways_use_sma': True, 'sideways_use_ema': False, 'sideways_use_atr': True, 'sideways_use_adx': False, 'sideways_use_spike': False, 'sideways_rsi_required': False}.
[I 2025-08-30 20:19:02,024] Trial 769 finished with values: [-1000000000.0, 1000000000.0] and parameters: {'p_sma': 5, 'p_std': 29, 'p_atr': 29, 'p_adx': 26, 'rsi_period': 24, 'ema1': 11, 'ema2': 19, 'slip_atr_k': 0.018515035401344165, 'slip_spread_k': 0.3476897603366594, 'spread_hl_frac': 0.006448483160254892, 'bb_std_mult': 0.8644592915675526, 'rsi_os': 27, 'rsi_ob': 57, 'vol_spike': 0.03853106356775909, 'adx_thresh': 5.6846347437699976, 'atr_min_pct': 0.02111917741090789, 'atr_max_pct': 0.10987472780057198, 'tp_mult': 2.9681648385198747, 'tsl_mult': 0.7473491262358614, 'strategy': 'breakout', 'time_stop': 29, 'use_sma': False, 'use_atr': True, 'use_adx': False, 'use_ema': False, 'use_spike': True, 'rsi_required': True, 'edge_k': 0.24295957953082165, 'edge_cap': 0.20496637189766126, 'bull_strategy': 'mean_reversion', 'bull_bb_std_mult': 1.776142661351092, 'bull_rsi_os': 48, 'bull_rsi_ob': 79, 'bull_adx_thresh': 31.215728004070215, 'bull_atr_min_pct': 0.0019022312464047231, 'bull_atr_max_pct': 0.10930557766166057, 'bull_tp_mult': 2.1575871308915056, 'bull_tsl_mult': 0.9486632878219315, 'bull_time_stop': 181, 'bull_use_sma': True, 'bull_use_ema': False, 'bull_use_atr': False, 'bull_use_adx': True, 'bull_use_spike': True, 'bull_rsi_required': True, 'bear_strategy': 'breakout', 'bear_bb_std_mult': 3.5039521679086545, 'bear_rsi_os': 44, 'bear_rsi_ob': 82, 'bear_adx_thresh': 5.049870294550751, 'bear_atr_min_pct': 0.015151491736126867, 'bear_atr_max_pct': 0.07311638220241175, 'bear_tp_mult': 1.8071987026146057, 'bear_tsl_mult': 0.7588616453175491, 'bear_time_stop': 161, 'bear_use_sma': True, 'bear_use_ema': False, 'bear_use_atr': True, 'bear_use_adx': True, 'bear_use_spike': False, 'bear_rsi_required': True, 'sideways_strategy': 'breakout', 'sideways_bb_std_mult': 2.014272127936524, 'sideways_rsi_os': 18, 'sideways_rsi_ob': 62, 'sideways_adx_thresh': 29.337210370713592, 'sideways_atr_min_pct': 0.019950930800989083, 'sideways_atr_max_pct': 0.12265440310648612, 'sideways_tp_mult': 1.7512977235427616, 'sideways_tsl_mult': 0.09292874305224835, 'sideways_time_stop': 96, 'sideways_use_sma': True, 'sideways_use_ema': True, 'sideways_use_atr': False, 'sideways_use_adx': False, 'sideways_use_spike': False, 'sideways_rsi_required': False}.
[I 2025-08-30 20:19:02,580] Trial 770 finished with values: [-1000000000.0, 1000000000.0] and parameters: {'p_sma': 28, 'p_std': 36, 'p_atr': 11, 'p_adx': 8, 'rsi_period': 54, 'ema1': 14, 'ema2': 20, 'slip_atr_k': 0.020717856776678575, 'slip_spread_k': 0.3528801498808219, 'spread_hl_frac': 0.003988281156513926, 'bb_std_mult': 3.036338311064796, 'rsi_os': 12, 'rsi_ob': 55, 'vol_spike': 0.17109042112792305, 'adx_thresh': 19.544076124635193, 'atr_min_pct': 0.027643562338630828, 'atr_max_pct': 0.06415730286114765, 'tp_mult': 1.9991350092670752, 'tsl_mult': 0.0016708199844410743, 'strategy': 'breakout', 'time_stop': 210, 'use_sma': False, 'use_atr': True, 'use_adx': False, 'use_ema': False, 'use_spike': True, 'rsi_required': True, 'edge_k': 0.1473860402587605, 'edge_cap': 0.1985620016178948, 'bull_strategy': 'mean_reversion', 'bull_bb_std_mult': 2.835468967015607, 'bull_rsi_os': 53, 'bull_rsi_ob': 55, 'bull_adx_thresh': 31.358510531197602, 'bull_atr_min_pct': 0.0192310607666566, 'bull_atr_max_pct': 0.03284162835164476, 'bull_tp_mult': 2.152846583918936, 'bull_tsl_mult': 0.8788633015098366, 'bull_time_stop': 163, 'bull_use_sma': True, 'bull_use_ema': False, 'bull_use_atr': False, 'bull_use_adx': True, 'bull_use_spike': True, 'bull_rsi_required': True, 'bear_strategy': 'breakout', 'bear_bb_std_mult': 3.4889123251062806, 'bear_rsi_os': 12, 'bear_rsi_ob': 60, 'bear_adx_thresh': 5.009493717662763, 'bear_atr_min_pct': 0.0159949978286555, 'bear_atr_max_pct': 0.04469637897317439, 'bear_tp_mult': 1.8069685051937254, 'bear_tsl_mult': 0.1503300973658745, 'bear_time_stop': 160, 'bear_use_sma': True, 'bear_use_ema': False, 'bear_use_atr': True, 'bear_use_adx': True, 'bear_use_spike': True, 'bear_rsi_required': True, 'sideways_strategy': 'breakout', 'sideways_bb_std_mult': 2.571411465460229, 'sideways_rsi_os': 15, 'sideways_rsi_ob': 48, 'sideways_adx_thresh': 9.921269470386875, 'sideways_atr_min_pct': 0.016191548170059494, 'sideways_atr_max_pct': 0.12241292582186737, 'sideways_tp_mult': 1.7367552573017233, 'sideways_tsl_mult': 0.2854279643917639, 'sideways_time_stop': 281, 'sideways_use_sma': True, 'sideways_use_ema': True, 'sideways_use_atr': False, 'sideways_use_adx': False, 'sideways_use_spike': False, 'sideways_rsi_required': False}.
[I 2025-08-30 20:19:04,048] Trial 773 finished with values: [-1000000000.0, 1000000000.0] and parameters: {'p_sma': 9, 'p_std': 28, 'p_atr': 11, 'p_adx': 22, 'rsi_period': 9, 'ema1': 25, 'ema2': 20, 'slip_atr_k': 0.004084523485445482, 'slip_spread_k': 0.3774344539312794, 'spread_hl_frac': 0.043238165048723715, 'bb_std_mult': 1.735670206314629, 'rsi_os': 49, 'rsi_ob': 65, 'vol_spike': 0.2378670656525585, 'adx_thresh': 5.637240802798736, 'atr_min_pct': 0.024484372239105212, 'atr_max_pct': 0.1420827158304624, 'tp_mult': 2.3186741634570827, 'tsl_mult': 0.7537896639425732, 'strategy': 'breakout', 'time_stop': 36, 'use_sma': False, 'use_atr': True, 'use_adx': False, 'use_ema': False, 'use_spike': True, 'rsi_required': True, 'edge_k': 0.14915574998479506, 'edge_cap': 0.20566540098835462, 'bull_strategy': 'mean_reversion', 'bull_bb_std_mult': 2.8751053811759077, 'bull_rsi_os': 53, 'bull_rsi_ob': 55, 'bull_adx_thresh': 31.244284272139023, 'bull_atr_min_pct': 0.002943882285739282, 'bull_atr_max_pct': 0.11702481358259983, 'bull_tp_mult': 2.321587100204442, 'bull_tsl_mult': 0.9478641884154146, 'bull_time_stop': 42, 'bull_use_sma': True, 'bull_use_ema': True, 'bull_use_atr': False, 'bull_use_adx': True, 'bull_use_spike': False, 'bull_rsi_required': True, 'bear_strategy': 'breakout', 'bear_bb_std_mult': 3.2024424713414326, 'bear_rsi_os': 44, 'bear_rsi_ob': 82, 'bear_adx_thresh': 6.174272856643104, 'bear_atr_min_pct': 0.006367995102751191, 'bear_atr_max_pct': 0.05179260427635424, 'bear_tp_mult': 1.3182587068493579, 'bear_tsl_mult': 0.10576862944251397, 'bear_time_stop': 162, 'bear_use_sma': True, 'bear_use_ema': False, 'bear_use_atr': True, 'bear_use_adx': True, 'bear_use_spike': False, 'bear_rsi_required': False, 'sideways_strategy': 'breakout', 'sideways_bb_std_mult': 2.05710910655649, 'sideways_rsi_os': 15, 'sideways_rsi_ob': 62, 'sideways_adx_thresh': 11.013015226224857, 'sideways_atr_min_pct': 0.01894289642468813, 'sideways_atr_max_pct': 0.14690069944932024, 'sideways_tp_mult': 1.6989808827010089, 'sideways_tsl_mult': 0.6656479368923399, 'sideways_time_stop': 287, 'sideways_use_sma': True, 'sideways_use_ema': True, 'sideways_use_atr': False, 'sideways_use_adx': False, 'sideways_use_spike': True, 'sideways_rsi_required': False}.
