[I 2025-08-30 18:57:14,928] Trial 168 finished with values: [-1000000000.0, 1000000000.0] and parameters: {'p_sma': 38, 'p_std': 44, 'p_atr': 10, 'p_adx': 8, 'rsi_period': 50, 'ema1': 14, 'ema2': 20, 'slip_atr_k': 0.21677621467840408, 'slip_spread_k': 0.413716090129372, 'spread_hl_frac': 0.027183432778698387, 'bb_std_mult': 0.88633651443987, 'rsi_os': 19, 'rsi_ob': 81, 'vol_spike': 0.20217086586551908, 'adx_thresh': 16.760822084566353, 'atr_min_pct': 0.02031131492757022, 'atr_max_pct': 0.14096319946444916, 'tp_mult': 1.4489806551078783, 'tsl_mult': 0.9114627405409537, 'strategy': 'breakout', 'time_stop': 28, 'use_sma': False, 'use_atr': True, 'use_adx': True, 'use_ema': False, 'use_spike': True, 'rsi_required': True, 'edge_k': 1.4037301457655886, 'edge_cap': 0.16994655244093843, 'bull_strategy': 'mean_reversion', 'bull_bb_std_mult': 0.7487627042773521, 'bull_rsi_os': 28, 'bull_rsi_ob': 75, 'bull_adx_thresh': 19.063180881645216, 'bull_atr_min_pct': 0.018406731845781094, 'bull_atr_max_pct': 0.030099845419183986, 'bull_tp_mult': 2.29784404420296, 'bull_tsl_mult': 0.9709970226691125, 'bull_time_stop': 49, 'bull_use_sma': True, 'bull_use_ema': False, 'bull_use_atr': False, 'bull_use_adx': False, 'bull_use_spike': True, 'bull_rsi_required': True, 'bear_strategy': 'breakout', 'bear_bb_std_mult': 3.191687815448085, 'bear_rsi_os': 50, 'bear_rsi_ob': 81, 'bear_adx_thresh': 9.335635666910921, 'bear_atr_min_pct': 0.013963743634053862, 'bear_atr_max_pct': 0.07005787398421907, 'bear_tp_mult': 1.6927884873371637, 'bear_tsl_mult': 0.6437996708402459, 'bear_time_stop': 8, 'bear_use_sma': True, 'bear_use_ema': False, 'bear_use_atr': True, 'bear_use_adx': True, 'bear_use_spike': False, 'bear_rsi_required': False, 'sideways_strategy': 'mean_reversion', 'sideways_bb_std_mult': 0.9175791493988237, 'sideways_rsi_os': 16, 'sideways_rsi_ob': 65, 'sideways_adx_thresh': 8.071660201066837, 'sideways_atr_min_pct': 0.01815822648498211, 'sideways_atr_max_pct': 0.03627492879596824, 'sideways_tp_mult': 2.488715056912575, 'sideways_tsl_mult': 0.25169216710714837, 'sideways_time_stop': 31, 'sideways_use_sma': True, 'sideways_use_ema': True, 'sideways_use_atr': False, 'sideways_use_adx': False, 'sideways_use_spike': True, 'sideways_rsi_required': False}.
[I 2025-08-30 18:57:47,327] Trial 175 finished with values: [-1000000000.0, 1000000000.0] and parameters: {'p_sma': 59, 'p_std': 22, 'p_atr': 9, 'p_adx': 30, 'rsi_period': 55, 'ema1': 8, 'ema2': 18, 'slip_atr_k': 0.07223038263671047, 'slip_spread_k': 0.9636938729206335, 'spread_hl_frac': 0.042082498800833, 'bb_std_mult': 2.8603775812552765, 'rsi_os': 11, 'rsi_ob': 74, 'vol_spike': 0.03305833197833872, 'adx_thresh': 9.772235399918019, 'atr_min_pct': 0.022912541785299303, 'atr_max_pct': 0.1274309629164028, 'tp_mult': 2.7173279912839137, 'tsl_mult': 0.7013932931614438, 'strategy': 'breakout', 'time_stop': 24, 'use_sma': True, 'use_atr': True, 'use_adx': False, 'use_ema': False, 'use_spike': True, 'rsi_required': False, 'edge_k': 0.15246806698530874, 'edge_cap': 0.2576565135678394, 'bull_strategy': 'breakout', 'bull_bb_std_mult': 3.1004652282909384, 'bull_rsi_os': 49, 'bull_rsi_ob': 71, 'bull_adx_thresh': 24.328345988177464, 'bull_atr_min_pct': 0.003152833028635234, 'bull_atr_max_pct': 0.03894043886133628, 'bull_tp_mult': 2.239076153637704, 'bull_tsl_mult': 0.9619640922196941, 'bull_time_stop': 195, 'bull_use_sma': True, 'bull_use_ema': False, 'bull_use_atr': False, 'bull_use_adx': True, 'bull_use_spike': False, 'bull_rsi_required': False, 'bear_strategy': 'breakout', 'bear_bb_std_mult': 1.2525184228632145, 'bear_rsi_os': 37, 'bear_rsi_ob': 51, 'bear_adx_thresh': 14.754699322251305, 'bear_atr_min_pct': 0.010033065568642297, 'bear_atr_max_pct': 0.05783219547676228, 'bear_tp_mult': 1.8591810621552933, 'bear_tsl_mult': 0.395908846234915, 'bear_time_stop': 118, 'bear_use_sma': False, 'bear_use_ema': False, 'bear_use_atr': False, 'bear_use_adx': False, 'bear_use_spike': True, 'bear_rsi_required': True, 'sideways_strategy': 'breakout', 'sideways_bb_std_mult': 2.108373640202475, 'sideways_rsi_os': 39, 'sideways_rsi_ob': 93, 'sideways_adx_thresh': 21.9689290093281, 'sideways_atr_min_pct': 0.020003078427165286, 'sideways_atr_max_pct': 0.11903023267466319, 'sideways_tp_mult': 1.8067037116913869, 'sideways_tsl_mult': 0.45160206814974546, 'sideways_time_stop': 18, 'sideways_use_sma': True, 'sideways_use_ema': False, 'sideways_use_atr': True, 'sideways_use_adx': False, 'sideways_use_spike': False, 'sideways_rsi_required': False}.
[I 2025-08-30 18:57:47,983] Trial 173 finished with values: [-1000000000.0, 1000000000.0] and parameters: {'p_sma': 22, 'p_std': 26, 'p_atr': 9, 'p_adx': 30, 'rsi_period': 56, 'ema1': 14, 'ema2': 36, 'slip_atr_k': 0.10595334674458926, 'slip_spread_k': 0.7329658202883249, 'spread_hl_frac': 0.04259586799435631, 'bb_std_mult': 3.257590842827363, 'rsi_os': 17, 'rsi_ob': 56, 'vol_spike': 0.105766518091664, 'adx_thresh': 16.691331855515653, 'atr_min_pct': 0.0033527585723681346, 'atr_max_pct': 0.12602484563097144, 'tp_mult': 2.8832703801952047, 'tsl_mult': 0.7250598509479955, 'strategy': 'breakout', 'time_stop': 102, 'use_sma': False, 'use_atr': True, 'use_adx': False, 'use_ema': False, 'use_spike': True, 'rsi_required': True, 'edge_k': 0.1506103029405252, 'edge_cap': 0.17207343993047408, 'bull_strategy': 'mean_reversion', 'bull_bb_std_mult': 1.83959746213838, 'bull_rsi_os': 15, 'bull_rsi_ob': 75, 'bull_adx_thresh': 18.86671035320214, 'bull_atr_min_pct': 0.01786701361348646, 'bull_atr_max_pct': 0.07686228303862792, 'bull_tp_mult': 2.244347042889938, 'bull_tsl_mult': 0.966126206597709, 'bull_time_stop': 194, 'bull_use_sma': True, 'bull_use_ema': False, 'bull_use_atr': False, 'bull_use_adx': True, 'bull_use_spike': True, 'bull_rsi_required': True, 'bear_strategy': 'breakout', 'bear_bb_std_mult': 1.3834365286667487, 'bear_rsi_os': 5, 'bear_rsi_ob': 80, 'bear_adx_thresh': 18.122294991194817, 'bear_atr_min_pct': 0.02329952099555435, 'bear_atr_max_pct': 0.09572638013196522, 'bear_tp_mult': 2.8447041969648117, 'bear_tsl_mult': 0.07564409090578164, 'bear_time_stop': 222, 'bear_use_sma': False, 'bear_use_ema': False, 'bear_use_atr': False, 'bear_use_adx': False, 'bear_use_spike': True, 'bear_rsi_required': False, 'sideways_strategy': 'breakout', 'sideways_bb_std_mult': 1.4382086865916963, 'sideways_rsi_os': 31, 'sideways_rsi_ob': 90, 'sideways_adx_thresh': 22.18552866113984, 'sideways_atr_min_pct': 0.017708801429359457, 'sideways_atr_max_pct': 0.07177133545031653, 'sideways_tp_mult': 1.9690442727221102, 'sideways_tsl_mult': 0.45752222724001973, 'sideways_time_stop': 161, 'sideways_use_sma': True, 'sideways_use_ema': True, 'sideways_use_atr': True, 'sideways_use_adx': False, 'sideways_use_spike': False, 'sideways_rsi_required': False}.
[I 2025-08-30 18:57:48,588] Trial 172 finished with values: [-1000000000.0, 1000000000.0] and parameters: {'p_sma': 21, 'p_std': 22, 'p_atr': 13, 'p_adx': 30, 'rsi_period': 40, 'ema1': 24, 'ema2': 58, 'slip_atr_k': 0.10435729075734632, 'slip_spread_k': 0.880072225224915, 'spread_hl_frac': 0.0022822540857412657, 'bb_std_mult': 1.83661236930453, 'rsi_os': 16, 'rsi_ob': 56, 'vol_spike': 0.13412071292323563, 'adx_thresh': 32.50057490801339, 'atr_min_pct': 0.02936439130544203, 'atr_max_pct': 0.14278338550742964, 'tp_mult': 1.1117073383684513, 'tsl_mult': 0.8048274223560776, 'strategy': 'breakout', 'time_stop': 24, 'use_sma': False, 'use_atr': True, 'use_adx': True, 'use_ema': False, 'use_spike': True, 'rsi_required': True, 'edge_k': 0.10121771867450274, 'edge_cap': 0.17938283309584502, 'bull_strategy': 'mean_reversion', 'bull_bb_std_mult': 0.8258960637686723, 'bull_rsi_os': 45, 'bull_rsi_ob': 71, 'bull_adx_thresh': 19.100005845359362, 'bull_atr_min_pct': 0.00824239820525356, 'bull_atr_max_pct': 0.13359745040399268, 'bull_tp_mult': 2.25262970319119, 'bull_tsl_mult': 0.9028875416659827, 'bull_time_stop': 256, 'bull_use_sma': True, 'bull_use_ema': False, 'bull_use_atr': False, 'bull_use_adx': False, 'bull_use_spike': True, 'bull_rsi_required': True, 'bear_strategy': 'breakout', 'bear_bb_std_mult': 1.320012232452438, 'bear_rsi_os': 34, 'bear_rsi_ob': 51, 'bear_adx_thresh': 5.005345326545686, 'bear_atr_min_pct': 0.028489533593928938, 'bear_atr_max_pct': 0.08103334694906078, 'bear_tp_mult': 2.858201446861544, 'bear_tsl_mult': 0.4040371907494815, 'bear_time_stop': 40, 'bear_use_sma': False, 'bear_use_ema': False, 'bear_use_atr': True, 'bear_use_adx': True, 'bear_use_spike': False, 'bear_rsi_required': False, 'sideways_strategy': 'breakout', 'sideways_bb_std_mult': 2.577212783657635, 'sideways_rsi_os': 31, 'sideways_rsi_ob': 65, 'sideways_adx_thresh': 21.9172535493508, 'sideways_atr_min_pct': 0.02022427655116647, 'sideways_atr_max_pct': 0.07122923772846432, 'sideways_tp_mult': 1.9658674676020689, 'sideways_tsl_mult': 0.5340362652053635, 'sideways_time_stop': 33, 'sideways_use_sma': True, 'sideways_use_ema': True, 'sideways_use_atr': False, 'sideways_use_adx': False, 'sideways_use_spike': False, 'sideways_rsi_required': False}.
[I 2025-08-30 18:57:48,702] Trial 174 finished with values: [-1000000000.0, 1000000000.0] and parameters: {'p_sma': 56, 'p_std': 41, 'p_atr': 9, 'p_adx': 24, 'rsi_period': 51, 'ema1': 8, 'ema2': 35, 'slip_atr_k': 0.14309114025033684, 'slip_spread_k': 0.1739223181891722, 'spread_hl_frac': 0.049939119244494984, 'bb_std_mult': 0.9675397591092667, 'rsi_os': 16, 'rsi_ob': 53, 'vol_spike': 0.030015456190703692, 'adx_thresh': 8.274485085308639, 'atr_min_pct': 0.02280504267397233, 'atr_max_pct': 0.09238658943129673, 'tp_mult': 1.8802672425407552, 'tsl_mult': 0.8123420947856381, 'strategy': 'breakout', 'time_stop': 30, 'use_sma': False, 'use_atr': True, 'use_adx': False, 'use_ema': False, 'use_spike': True, 'rsi_required': True, 'edge_k': 0.1524980986383422, 'edge_cap': 0.2122712802873517, 'bull_strategy': 'breakout', 'bull_bb_std_mult': 1.8387947147745356, 'bull_rsi_os': 50, 'bull_rsi_ob': 70, 'bull_adx_thresh': 24.392522904689077, 'bull_atr_min_pct': 0.00028499359175368976, 'bull_atr_max_pct': 0.077237792946055, 'bull_tp_mult': 1.8625203441035947, 'bull_tsl_mult': 0.9652856426496326, 'bull_time_stop': 193, 'bull_use_sma': True, 'bull_use_ema': False, 'bull_use_atr': False, 'bull_use_adx': True, 'bull_use_spike': True, 'bull_rsi_required': False, 'bear_strategy': 'breakout', 'bear_bb_std_mult': 3.1835637489807214, 'bear_rsi_os': 31, 'bear_rsi_ob': 52, 'bear_adx_thresh': 14.139520051281469, 'bear_atr_min_pct': 0.00513061554160252, 'bear_atr_max_pct': 0.09430159769313702, 'bear_tp_mult': 1.5585509639642317, 'bear_tsl_mult': 0.4048133870426735, 'bear_time_stop': 207, 'bear_use_sma': False, 'bear_use_ema': False, 'bear_use_atr': False, 'bear_use_adx': False, 'bear_use_spike': True, 'bear_rsi_required': True, 'sideways_strategy': 'breakout', 'sideways_bb_std_mult': 1.4250581612178017, 'sideways_rsi_os': 5, 'sideways_rsi_ob': 62, 'sideways_adx_thresh': 18.698447277782844, 'sideways_atr_min_pct': 0.029939738026957874, 'sideways_atr_max_pct': 0.07121615682016336, 'sideways_tp_mult': 1.8171744582919784, 'sideways_tsl_mult': 0.9256269954356723, 'sideways_time_stop': 190, 'sideways_use_sma': True, 'sideways_use_ema': True, 'sideways_use_atr': True, 'sideways_use_adx': False, 'sideways_use_spike': False, 'sideways_rsi_required': False}.
[I 2025-08-30 18:58:20,932] Trial 178 finished with values: [-1000000000.0, 1000000000.0] and parameters: {'p_sma': 12, 'p_std': 24, 'p_atr': 17, 'p_adx': 7, 'rsi_period': 48, 'ema1': 25, 'ema2': 53, 'slip_atr_k': 0.03371363822412351, 'slip_spread_k': 0.03310435845715398, 'spread_hl_frac': 0.005762699737389189, 'bb_std_mult': 2.943820044396504, 'rsi_os': 24, 'rsi_ob': 64, 'vol_spike': 0.03773098076247463, 'adx_thresh': 20.40440060841074, 'atr_min_pct': 0.025094112977540377, 'atr_max_pct': 0.13622162668955906, 'tp_mult': 2.122477769774359, 'tsl_mult': 0.6198047440356443, 'strategy': 'mean_reversion', 'time_stop': 256, 'use_sma': True, 'use_atr': True, 'use_adx': False, 'use_ema': True, 'use_spike': False, 'rsi_required': False, 'edge_k': 1.2753222511664937, 'edge_cap': 0.5358052306152414, 'bull_strategy': 'mean_reversion', 'bull_bb_std_mult': 1.0434324461692563, 'bull_rsi_os': 48, 'bull_rsi_ob': 64, 'bull_adx_thresh': 23.374992405894222, 'bull_atr_min_pct': 0.0020071626600631724, 'bull_atr_max_pct': 0.02023726220961885, 'bull_tp_mult': 2.1499616690490697, 'bull_tsl_mult': 0.9990477245140336, 'bull_time_stop': 13, 'bull_use_sma': True, 'bull_use_ema': True, 'bull_use_atr': True, 'bull_use_adx': True, 'bull_use_spike': False, 'bull_rsi_required': True, 'bear_strategy': 'mean_reversion', 'bear_bb_std_mult': 3.3612387691287733, 'bear_rsi_os': 17, 'bear_rsi_ob': 61, 'bear_adx_thresh': 7.204443238905233, 'bear_atr_min_pct': 0.013221650325065564, 'bear_atr_max_pct': 0.013484563269025765, 'bear_tp_mult': 1.285031813741653, 'bear_tsl_mult': 0.032067785482158745, 'bear_time_stop': 36, 'bear_use_sma': True, 'bear_use_ema': True, 'bear_use_atr': True, 'bear_use_adx': True, 'bear_use_spike': False, 'bear_rsi_required': False, 'sideways_strategy': 'breakout', 'sideways_bb_std_mult': 2.0862761416981535, 'sideways_rsi_os': 50, 'sideways_rsi_ob': 58, 'sideways_adx_thresh': 9.947331757783225, 'sideways_atr_min_pct': 0.00781829568814143, 'sideways_atr_max_pct': 0.05274283805994491, 'sideways_tp_mult': 1.856122525292898, 'sideways_tsl_mult': 0.6841236553133915, 'sideways_time_stop': 171, 'sideways_use_sma': False, 'sideways_use_ema': False, 'sideways_use_atr': False, 'sideways_use_adx': False, 'sideways_use_spike': False, 'sideways_rsi_required': False}.
[I 2025-08-30 18:58:21,191] Trial 179 finished with values: [-1000000000.0, 1000000000.0] and parameters: {'p_sma': 43, 'p_std': 24, 'p_atr': 22, 'p_adx': 7, 'rsi_period': 34, 'ema1': 25, 'ema2': 12, 'slip_atr_k': 0.061611634872974094, 'slip_spread_k': 0.4496425134151859, 'spread_hl_frac': 0.005850255856315212, 'bb_std_mult': 1.0564906942024006, 'rsi_os': 36, 'rsi_ob': 64, 'vol_spike': 0.20787496903459074, 'adx_thresh': 18.09310306006633, 'atr_min_pct': 0.025033829758652315, 'atr_max_pct': 0.04029831307540407, 'tp_mult': 2.3447646067135395, 'tsl_mult': 0.6204574041060191, 'strategy': 'mean_reversion', 'time_stop': 167, 'use_sma': True, 'use_atr': True, 'use_adx': False, 'use_ema': True, 'use_spike': False, 'rsi_required': False, 'edge_k': 1.2518187737487574, 'edge_cap': 0.9604763009419574, 'bull_strategy': 'mean_reversion', 'bull_bb_std_mult': 2.9348815219666395, 'bull_rsi_os': 48, 'bull_rsi_ob': 63, 'bull_adx_thresh': 8.952625834133379, 'bull_atr_min_pct': 0.0018102470883611678, 'bull_atr_max_pct': 0.08823084173556005, 'bull_tp_mult': 2.1432342842840186, 'bull_tsl_mult': 0.738686124650166, 'bull_time_stop': 203, 'bull_use_sma': True, 'bull_use_ema': True, 'bull_use_atr': True, 'bull_use_adx': True, 'bull_use_spike': False, 'bull_rsi_required': True, 'bear_strategy': 'mean_reversion', 'bear_bb_std_mult': 3.365867417768038, 'bear_rsi_os': 15, 'bear_rsi_ob': 84, 'bear_adx_thresh': 7.423836792429783, 'bear_atr_min_pct': 0.007985440817245032, 'bear_atr_max_pct': 0.05714320338656989, 'bear_tp_mult': 1.2807578944762086, 'bear_tsl_mult': 0.9404434323546105, 'bear_time_stop': 33, 'bear_use_sma': True, 'bear_use_ema': True, 'bear_use_atr': True, 'bear_use_adx': True, 'bear_use_spike': False, 'bear_rsi_required': False, 'sideways_strategy': 'breakout', 'sideways_bb_std_mult': 2.225779647403427, 'sideways_rsi_os': 19, 'sideways_rsi_ob': 58, 'sideways_adx_thresh': 10.767954442218947, 'sideways_atr_min_pct': 0.014078176436088925, 'sideways_atr_max_pct': 0.11235685649253777, 'sideways_tp_mult': 1.7741865577005915, 'sideways_tsl_mult': 0.1444888931874539, 'sideways_time_stop': 68, 'sideways_use_sma': False, 'sideways_use_ema': False, 'sideways_use_atr': False, 'sideways_use_adx': False, 'sideways_use_spike': False, 'sideways_rsi_required': False}.
[I 2025-08-30 18:58:21,714] Trial 176 finished with values: [-1000000000.0, 1000000000.0] and parameters: {'p_sma': 56, 'p_std': 41, 'p_atr': 9, 'p_adx': 24, 'rsi_period': 51, 'ema1': 24, 'ema2': 16, 'slip_atr_k': 0.10466730539931332, 'slip_spread_k': 0.38212682738591003, 'spread_hl_frac': 0.01974672246105713, 'bb_std_mult': 2.9446756262895133, 'rsi_os': 16, 'rsi_ob': 64, 'vol_spike': 0.10521398775467777, 'adx_thresh': 12.013947664139476, 'atr_min_pct': 0.003889160378659757, 'atr_max_pct': 0.13605194188879188, 'tp_mult': 1.9897141346448444, 'tsl_mult': 0.07418712924033649, 'strategy': 'breakout', 'time_stop': 31, 'use_sma': False, 'use_atr': True, 'use_adx': False, 'use_ema': True, 'use_spike': False, 'rsi_required': True, 'edge_k': 0.8257562796899105, 'edge_cap': 0.21277148726141362, 'bull_strategy': 'mean_reversion', 'bull_bb_std_mult': 2.9601175553620513, 'bull_rsi_os': 50, 'bull_rsi_ob': 70, 'bull_adx_thresh': 26.19636817519945, 'bull_atr_min_pct': 0.008518481358252505, 'bull_atr_max_pct': 0.08926084728917177, 'bull_tp_mult': 1.1849691186743465, 'bull_tsl_mult': 0.18061882236532906, 'bull_time_stop': 202, 'bull_use_sma': True, 'bull_use_ema': False, 'bull_use_atr': False, 'bull_use_adx': True, 'bull_use_spike': True, 'bull_rsi_required': False, 'bear_strategy': 'breakout', 'bear_bb_std_mult': 3.3586985446905184, 'bear_rsi_os': 44, 'bear_rsi_ob': 80, 'bear_adx_thresh': 17.456322749983393, 'bear_atr_min_pct': 0.022790970475643907, 'bear_atr_max_pct': 0.05733257817195707, 'bear_tp_mult': 2.830009882891211, 'bear_tsl_mult': 0.13279823416058278, 'bear_time_stop': 33, 'bear_use_sma': False, 'bear_use_ema': False, 'bear_use_atr': False, 'bear_use_adx': False, 'bear_use_spike': False, 'bear_rsi_required': False, 'sideways_strategy': 'breakout', 'sideways_bb_std_mult': 2.0998227025986163, 'sideways_rsi_os': 30, 'sideways_rsi_ob': 62, 'sideways_adx_thresh': 20.067196924192118, 'sideways_atr_min_pct': 0.01687626196883234, 'sideways_atr_max_pct': 0.11212867852917481, 'sideways_tp_mult': 1.1501679070551543, 'sideways_tsl_mult': 0.6844177628952779, 'sideways_time_stop': 274, 'sideways_use_sma': True, 'sideways_use_ema': True, 'sideways_use_atr': False, 'sideways_use_adx': False, 'sideways_use_spike': False, 'sideways_rsi_required': False}.
[I 2025-08-30 18:58:21,726] Trial 177 finished with values: [-0.01706775858637466, 0.016992982116008064] and parameters: {'p_sma': 34, 'p_std': 26, 'p_atr': 26, 'p_adx': 7, 'rsi_period': 28, 'ema1': 17, 'ema2': 12, 'slip_atr_k': 0.1426083468417413, 'slip_spread_k': 0.4449583835505735, 'spread_hl_frac': 0.019273152017666946, 'bb_std_mult': 2.9398273255196212, 'rsi_os': 36, 'rsi_ob': 53, 'vol_spike': 0.028827202234017593, 'adx_thresh': 18.179314048100867, 'atr_min_pct': 0.029538656963258317, 'atr_max_pct': 0.1364252120609818, 'tp_mult': 1.252587134913783, 'tsl_mult': 0.49239312820006326, 'strategy': 'mean_reversion', 'time_stop': 255, 'use_sma': False, 'use_atr': True, 'use_adx': False, 'use_ema': True, 'use_spike': False, 'rsi_required': True, 'edge_k': 0.8360399559185051, 'edge_cap': 0.2110170887052616, 'bull_strategy': 'breakout', 'bull_bb_std_mult': 1.9860700466172467, 'bull_rsi_os': 50, 'bull_rsi_ob': 93, 'bull_adx_thresh': 34.32799833671075, 'bull_atr_min_pct': 0.0017054146505762597, 'bull_atr_max_pct': 0.0167289798529792, 'bull_tp_mult': 2.147867327189213, 'bull_tsl_mult': 0.7394106386947168, 'bull_time_stop': 87, 'bull_use_sma': True, 'bull_use_ema': False, 'bull_use_atr': False, 'bull_use_adx': True, 'bull_use_spike': True, 'bull_rsi_required': False, 'bear_strategy': 'breakout', 'bear_bb_std_mult': 3.353693688759984, 'bear_rsi_os': 17, 'bear_rsi_ob': 84, 'bear_adx_thresh': 17.184711037006252, 'bear_atr_min_pct': 0.007983207954984407, 'bear_atr_max_pct': 0.08713442055027351, 'bear_tp_mult': 1.6448800358856976, 'bear_tsl_mult': 0.9292967232271645, 'bear_time_stop': 32, 'bear_use_sma': True, 'bear_use_ema': False, 'bear_use_atr': True, 'bear_use_adx': True, 'bear_use_spike': False, 'bear_rsi_required': True, 'sideways_strategy': 'breakout', 'sideways_bb_std_mult': 0.5059509836291063, 'sideways_rsi_os': 19, 'sideways_rsi_ob': 58, 'sideways_adx_thresh': 10.683492631166004, 'sideways_atr_min_pct': 0.012414919997703118, 'sideways_atr_max_pct': 0.11234360267608437, 'sideways_tp_mult': 1.1496092966392273, 'sideways_tsl_mult': 0.9299346243715895, 'sideways_time_stop': 273, 'sideways_use_sma': True, 'sideways_use_ema': True, 'sideways_use_atr': False, 'sideways_use_adx': False, 'sideways_use_spike': False, 'sideways_rsi_required': False}.
