[I 2025-08-30 18:58:22,171] Trial 180 finished with values: [-1000000000.0, 1000000000.0] and parameters: {'p_sma': 5, 'p_std': 29, 'p_atr': 26, 'p_adx': 8, 'rsi_period': 82, 'ema1': 30, 'ema2': 45, 'slip_atr_k': 0.06262637897880222, 'slip_spread_k': 0.45149233605691835, 'spread_hl_frac': 0.018108424050703523, 'bb_std_mult': 1.2118434579946502, 'rsi_os': 54, 'rsi_ob': 77, 'vol_spike': 0.001120912000077752, 'adx_thresh': 7.21440457550678, 'atr_min_pct': 0.02215179971094292, 'atr_max_pct': 0.030784048744263805, 'tp_mult': 2.0086707556661096, 'tsl_mult': 0.48940157076691904, 'strategy': 'mean_reversion', 'time_stop': 221, 'use_sma': False, 'use_atr': False, 'use_adx': False, 'use_ema': True, 'use_spike': False, 'rsi_required': True, 'edge_k': 0.8366442607754417, 'edge_cap': 0.9698050216927174, 'bull_strategy': 'breakout', 'bull_bb_std_mult': 1.992423824635068, 'bull_rsi_os': 51, 'bull_rsi_ob': 73, 'bull_adx_thresh': 27.557576913243302, 'bull_atr_min_pct': 0.004854319912129738, 'bull_atr_max_pct': 0.11759262990430536, 'bull_tp_mult': 2.9473158198451728, 'bull_tsl_mult': 0.9255782244047969, 'bull_time_stop': 292, 'bull_use_sma': True, 'bull_use_ema': False, 'bull_use_atr': False, 'bull_use_adx': True, 'bull_use_spike': True, 'bull_rsi_required': False, 'bear_strategy': 'breakout', 'bear_bb_std_mult': 3.072483169358266, 'bear_rsi_os': 44, 'bear_rsi_ob': 84, 'bear_adx_thresh': 6.475493942882951, 'bear_atr_min_pct': 0.008477770928359227, 'bear_atr_max_pct': 0.05728965771880688, 'bear_tp_mult': 2.949312669237457, 'bear_tsl_mult': 0.9312253543935909, 'bear_time_stop': 148, 'bear_use_sma': True, 'bear_use_ema': False, 'bear_use_atr': True, 'bear_use_adx': True, 'bear_use_spike': False, 'bear_rsi_required': False, 'sideways_strategy': 'breakout', 'sideways_bb_std_mult': 2.1920459516315796, 'sideways_rsi_os': 18, 'sideways_rsi_ob': 51, 'sideways_adx_thresh': 8.463844022194545, 'sideways_atr_min_pct': 0.01899873513148697, 'sideways_atr_max_pct': 0.04356385829606375, 'sideways_tp_mult': 1.7852384607560208, 'sideways_tsl_mult': 0.21539141871115502, 'sideways_time_stop': 256, 'sideways_use_sma': True, 'sideways_use_ema': True, 'sideways_use_atr': False, 'sideways_use_adx': False, 'sideways_use_spike': False, 'sideways_rsi_required': False}.
[I 2025-08-30 18:58:53,658] Trial 183 finished with values: [-1000000000.0, 1000000000.0] and parameters: {'p_sma': 44, 'p_std': 58, 'p_atr': 10, 'p_adx': 11, 'rsi_period': 28, 'ema1': 17, 'ema2': 45, 'slip_atr_k': 0.027149292667787407, 'slip_spread_k': 0.14377973148717804, 'spread_hl_frac': 0.025382506568248656, 'bb_std_mult': 1.1895779805061881, 'rsi_os': 55, 'rsi_ob': 59, 'vol_spike': 0.04958755874807738, 'adx_thresh': 7.450014583881453, 'atr_min_pct': 0.008042541590072266, 'atr_max_pct': 0.02920227963971693, 'tp_mult': 1.7990877504950338, 'tsl_mult': 0.4551813137486497, 'strategy': 'breakout', 'time_stop': 15, 'use_sma': False, 'use_atr': False, 'use_adx': False, 'use_ema': False, 'use_spike': True, 'rsi_required': True, 'edge_k': 0.015759523064370284, 'edge_cap': 0.28447274109301424, 'bull_strategy': 'breakout', 'bull_bb_std_mult': 1.8892881753913078, 'bull_rsi_os': 51, 'bull_rsi_ob': 92, 'bull_adx_thresh': 27.57091386333826, 'bull_atr_min_pct': 0.02187042558670494, 'bull_atr_max_pct': 0.09329544744783616, 'bull_tp_mult': 2.992886271359273, 'bull_tsl_mult': 0.9200340935017453, 'bull_time_stop': 67, 'bull_use_sma': False, 'bull_use_ema': False, 'bull_use_atr': False, 'bull_use_adx': True, 'bull_use_spike': True, 'bull_rsi_required': True, 'bear_strategy': 'breakout', 'bear_bb_std_mult': 3.049809345266529, 'bear_rsi_os': 22, 'bear_rsi_ob': 58, 'bear_adx_thresh': 10.377475851568319, 'bear_atr_min_pct': 0.01565864222070241, 'bear_atr_max_pct': 0.05317944185475224, 'bear_tp_mult': 2.7289138744339914, 'bear_tsl_mult': 0.11409993234918145, 'bear_time_stop': 55, 'bear_use_sma': True, 'bear_use_ema': False, 'bear_use_atr': True, 'bear_use_adx': True, 'bear_use_spike': False, 'bear_rsi_required': False, 'sideways_strategy': 'breakout', 'sideways_bb_std_mult': 1.931731969966119, 'sideways_rsi_os': 42, 'sideways_rsi_ob': 59, 'sideways_adx_thresh': 23.131472141199218, 'sideways_atr_min_pct': 0.018965622644122444, 'sideways_atr_max_pct': 0.12796101578574312, 'sideways_tp_mult': 1.542976911586793, 'sideways_tsl_mult': 0.7193318327285706, 'sideways_time_stop': 209, 'sideways_use_sma': True, 'sideways_use_ema': True, 'sideways_use_atr': False, 'sideways_use_adx': True, 'sideways_use_spike': False, 'sideways_rsi_required': True}.
[I 2025-08-30 18:58:54,373] Trial 181 finished with values: [-1000000000.0, 1000000000.0] and parameters: {'p_sma': 26, 'p_std': 58, 'p_atr': 10, 'p_adx': 11, 'rsi_period': 28, 'ema1': 24, 'ema2': 17, 'slip_atr_k': 0.02610049958961113, 'slip_spread_k': 0.14017375440869517, 'spread_hl_frac': 0.019105138620255195, 'bb_std_mult': 0.8117971633854255, 'rsi_os': 35, 'rsi_ob': 76, 'vol_spike': 0.049833411174504884, 'adx_thresh': 19.402714668083505, 'atr_min_pct': 0.024581402056171382, 'atr_max_pct': 0.13426102299639378, 'tp_mult': 2.2142618779631076, 'tsl_mult': 0.6684928855201799, 'strategy': 'breakout', 'time_stop': 108, 'use_sma': False, 'use_atr': False, 'use_adx': False, 'use_ema': False, 'use_spike': True, 'rsi_required': True, 'edge_k': 0.0008724257933066804, 'edge_cap': 0.7570305808363629, 'bull_strategy': 'breakout', 'bull_bb_std_mult': 1.9900065253755153, 'bull_rsi_os': 49, 'bull_rsi_ob': 93, 'bull_adx_thresh': 26.367658295617055, 'bull_atr_min_pct': 0.02195792716727019, 'bull_atr_max_pct': 0.02583792036504589, 'bull_tp_mult': 2.0692764543225373, 'bull_tsl_mult': 0.18112697957182683, 'bull_time_stop': 71, 'bull_use_sma': False, 'bull_use_ema': False, 'bull_use_atr': False, 'bull_use_adx': True, 'bull_use_spike': True, 'bull_rsi_required': False, 'bear_strategy': 'breakout', 'bear_bb_std_mult': 2.7027636772833623, 'bear_rsi_os': 44, 'bear_rsi_ob': 83, 'bear_adx_thresh': 6.4997121615078735, 'bear_atr_min_pct': 0.01560293077217458, 'bear_atr_max_pct': 0.05304107205410141, 'bear_tp_mult': 2.9560301668242754, 'bear_tsl_mult': 0.1339849421430958, 'bear_time_stop': 27, 'bear_use_sma': True, 'bear_use_ema': False, 'bear_use_atr': True, 'bear_use_adx': True, 'bear_use_spike': False, 'bear_rsi_required': True, 'sideways_strategy': 'breakout', 'sideways_bb_std_mult': 1.9325166689571571, 'sideways_rsi_os': 13, 'sideways_rsi_ob': 84, 'sideways_adx_thresh': 19.96936102098722, 'sideways_atr_min_pct': 0.0032097419555363483, 'sideways_atr_max_pct': 0.12709442248224467, 'sideways_tp_mult': 2.918594775839532, 'sideways_tsl_mult': 0.7148941446346151, 'sideways_time_stop': 275, 'sideways_use_sma': True, 'sideways_use_ema': True, 'sideways_use_atr': False, 'sideways_use_adx': True, 'sideways_use_spike': False, 'sideways_rsi_required': True}.
[I 2025-08-30 18:58:54,515] Trial 182 finished with values: [-1000000000.0, 1000000000.0] and parameters: {'p_sma': 5, 'p_std': 58, 'p_atr': 15, 'p_adx': 8, 'rsi_period': 80, 'ema1': 30, 'ema2': 30, 'slip_atr_k': 0.025660694582795983, 'slip_spread_k': 0.14468431090109796, 'spread_hl_frac': 0.005049851589876842, 'bb_std_mult': 2.7104922472070445, 'rsi_os': 55, 'rsi_ob': 59, 'vol_spike': 0.04763221524898484, 'adx_thresh': 19.527453712725954, 'atr_min_pct': 0.02449768653712111, 'atr_max_pct': 0.13087241773071662, 'tp_mult': 1.8062101314710584, 'tsl_mult': 0.67329617716068, 'strategy': 'breakout', 'time_stop': 38, 'use_sma': False, 'use_atr': False, 'use_adx': False, 'use_ema': False, 'use_spike': True, 'rsi_required': True, 'edge_k': 0.9333311248549098, 'edge_cap': 0.2844205618610418, 'bull_strategy': 'breakout', 'bull_bb_std_mult': 1.970799351987643, 'bull_rsi_os': 51, 'bull_rsi_ob': 73, 'bull_adx_thresh': 14.88633887165865, 'bull_atr_min_pct': 0.01677137220844901, 'bull_atr_max_pct': 0.015524781357364015, 'bull_tp_mult': 2.54706753117656, 'bull_tsl_mult': 0.922638128743684, 'bull_time_stop': 69, 'bull_use_sma': False, 'bull_use_ema': False, 'bull_use_atr': False, 'bull_use_adx': True, 'bull_use_spike': True, 'bull_rsi_required': True, 'bear_strategy': 'breakout', 'bear_bb_std_mult': 3.243663305955519, 'bear_rsi_os': 47, 'bear_rsi_ob': 58, 'bear_adx_thresh': 10.413713372931866, 'bear_atr_min_pct': 0.015574040150198863, 'bear_atr_max_pct': 0.024040851676501065, 'bear_tp_mult': 2.376506848403486, 'bear_tsl_mult': 0.10845796632584871, 'bear_time_stop': 27, 'bear_use_sma': True, 'bear_use_ema': False, 'bear_use_atr': True, 'bear_use_adx': True, 'bear_use_spike': False, 'bear_rsi_required': True, 'sideways_strategy': 'breakout', 'sideways_bb_std_mult': 0.5096376533669089, 'sideways_rsi_os': 13, 'sideways_rsi_ob': 59, 'sideways_adx_thresh': 13.413555276970637, 'sideways_atr_min_pct': 0.019170738456188156, 'sideways_atr_max_pct': 0.12815930202445747, 'sideways_tp_mult': 1.8991545782562014, 'sideways_tsl_mult': 0.00423741515405246, 'sideways_time_stop': 206, 'sideways_use_sma': True, 'sideways_use_ema': True, 'sideways_use_atr': False, 'sideways_use_adx': True, 'sideways_use_spike': False, 'sideways_rsi_required': True}.
[I 2025-08-30 18:58:54,932] Trial 184 finished with values: [-1000000000.0, 1000000000.0] and parameters: {'p_sma': 26, 'p_std': 26, 'p_atr': 10, 'p_adx': 11, 'rsi_period': 53, 'ema1': 12, 'ema2': 18, 'slip_atr_k': 0.025392209770941643, 'slip_spread_k': 0.4304542861931991, 'spread_hl_frac': 0.0047819943915403465, 'bb_std_mult': 3.155068129340335, 'rsi_os': 38, 'rsi_ob': 59, 'vol_spike': 0.04814942913726831, 'adx_thresh': 27.461965901527567, 'atr_min_pct': 0.024478392624685028, 'atr_max_pct': 0.13350835599677274, 'tp_mult': 2.195006188020069, 'tsl_mult': 0.6661556214539317, 'strategy': 'breakout', 'time_stop': 40, 'use_sma': False, 'use_atr': True, 'use_adx': False, 'use_ema': False, 'use_spike': True, 'rsi_required': True, 'edge_k': 0.003714116710226617, 'edge_cap': 0.7835224691139311, 'bull_strategy': 'mean_reversion', 'bull_bb_std_mult': 3.2686335368204524, 'bull_rsi_os': 50, 'bull_rsi_ob': 93, 'bull_adx_thresh': 25.278438199877463, 'bull_atr_min_pct': 0.016933742625532437, 'bull_atr_max_pct': 0.12592636555956296, 'bull_tp_mult': 2.072759816514076, 'bull_tsl_mult': 0.9800576102674567, 'bull_time_stop': 71, 'bull_use_sma': False, 'bull_use_ema': False, 'bull_use_atr': False, 'bull_use_adx': True, 'bull_use_spike': True, 'bull_rsi_required': True, 'bear_strategy': 'breakout', 'bear_bb_std_mult': 1.468706313430303, 'bear_rsi_os': 48, 'bear_rsi_ob': 46, 'bear_adx_thresh': 10.446450108890325, 'bear_atr_min_pct': 0.015704232959226974, 'bear_atr_max_pct': 0.08628098982773635, 'bear_tp_mult': 1.6618368053341812, 'bear_tsl_mult': 0.8877425660765768, 'bear_time_stop': 28, 'bear_use_sma': True, 'bear_use_ema': False, 'bear_use_atr': True, 'bear_use_adx': True, 'bear_use_spike': False, 'bear_rsi_required': True, 'sideways_strategy': 'breakout', 'sideways_bb_std_mult': 1.9274106059880838, 'sideways_rsi_os': 13, 'sideways_rsi_ob': 59, 'sideways_adx_thresh': 9.410689424783905, 'sideways_atr_min_pct': 0.024653883311788326, 'sideways_atr_max_pct': 0.12640753656050743, 'sideways_tp_mult': 1.9002205605063478, 'sideways_tsl_mult': 0.718558096136181, 'sideways_time_stop': 280, 'sideways_use_sma': True, 'sideways_use_ema': True, 'sideways_use_atr': False, 'sideways_use_adx': True, 'sideways_use_spike': True, 'sideways_rsi_required': True}.
[I 2025-08-30 18:59:27,053] Trial 188 finished with values: [-1000000000.0, 1000000000.0] and parameters: {'p_sma': 41, 'p_std': 7, 'p_atr': 11, 'p_adx': 9, 'rsi_period': 49, 'ema1': 23, 'ema2': 42, 'slip_atr_k': 0.24901149649018495, 'slip_spread_k': 0.3464175409450594, 'spread_hl_frac': 0.002367619681218582, 'bb_std_mult': 1.6973933196238762, 'rsi_os': 37, 'rsi_ob': 54, 'vol_spike': 0.027384427133442163, 'adx_thresh': 18.591076049407004, 'atr_min_pct': 0.02327095255486201, 'atr_max_pct': 0.058749799872590845, 'tp_mult': 1.247290405434018, 'tsl_mult': 0.9348513879432818, 'strategy': 'breakout', 'time_stop': 142, 'use_sma': True, 'use_atr': True, 'use_adx': True, 'use_ema': False, 'use_spike': True, 'rsi_required': False, 'edge_k': 0.4674318858541284, 'edge_cap': 0.7058067016810007, 'bull_strategy': 'mean_reversion', 'bull_bb_std_mult': 1.787036386992472, 'bull_rsi_os': 24, 'bull_rsi_ob': 72, 'bull_adx_thresh': 33.97330483981988, 'bull_atr_min_pct': 0.0029657871728250547, 'bull_atr_max_pct': 0.1127938159495425, 'bull_tp_mult': 2.1177640324789633, 'bull_tsl_mult': 0.9815995789165495, 'bull_time_stop': 185, 'bull_use_sma': True, 'bull_use_ema': True, 'bull_use_atr': True, 'bull_use_adx': True, 'bull_use_spike': False, 'bull_rsi_required': True, 'bear_strategy': 'mean_reversion', 'bear_bb_std_mult': 2.4195182295236917, 'bear_rsi_os': 8, 'bear_rsi_ob': 86, 'bear_adx_thresh': 12.870495271906474, 'bear_atr_min_pct': 0.018959893570920205, 'bear_atr_max_pct': 0.12200275807135452, 'bear_tp_mult': 1.7754136035026105, 'bear_tsl_mult': 0.08008047189608397, 'bear_time_stop': 264, 'bear_use_sma': True, 'bear_use_ema': True, 'bear_use_atr': True, 'bear_use_adx': True, 'bear_use_spike': True, 'bear_rsi_required': False, 'sideways_strategy': 'mean_reversion', 'sideways_bb_std_mult': 2.077402461681948, 'sideways_rsi_os': 16, 'sideways_rsi_ob': 57, 'sideways_adx_thresh': 10.482961648694138, 'sideways_atr_min_pct': 0.01543952411880861, 'sideways_atr_max_pct': 0.11584991085892409, 'sideways_tp_mult': 1.7480179578761779, 'sideways_tsl_mult': 0.6563809235490505, 'sideways_time_stop': 231, 'sideways_use_sma': False, 'sideways_use_ema': False, 'sideways_use_atr': True, 'sideways_use_adx': False, 'sideways_use_spike': True, 'sideways_rsi_required': False}.
[I 2025-08-30 18:59:27,964] Trial 187 finished with values: [-1000000000.0, 1000000000.0] and parameters: {'p_sma': 41, 'p_std': 26, 'p_atr': 11, 'p_adx': 28, 'rsi_period': 58, 'ema1': 23, 'ema2': 18, 'slip_atr_k': 0.019152339561356972, 'slip_spread_k': 0.4436824597740146, 'spread_hl_frac': 0.0029479396986331215, 'bb_std_mult': 1.6892359058742277, 'rsi_os': 45, 'rsi_ob': 57, 'vol_spike': 0.028270610473623614, 'adx_thresh': 18.464064629809602, 'atr_min_pct': 0.010418071159971176, 'atr_max_pct': 0.13371923186240006, 'tp_mult': 1.2735207291023962, 'tsl_mult': 0.9379485015959697, 'strategy': 'breakout', 'time_stop': 153, 'use_sma': True, 'use_atr': True, 'use_adx': False, 'use_ema': False, 'use_spike': True, 'rsi_required': False, 'edge_k': 0.20149648522196645, 'edge_cap': 0.8363626815006865, 'bull_strategy': 'mean_reversion', 'bull_bb_std_mult': 1.8020528777024396, 'bull_rsi_os': 32, 'bull_rsi_ob': 48, 'bull_adx_thresh': 25.672720332545513, 'bull_atr_min_pct': 0.0030647767082057067, 'bull_atr_max_pct': 0.05328308718588085, 'bull_tp_mult': 2.1638397299129486, 'bull_tsl_mult': 0.34646071054076844, 'bull_time_stop': 185, 'bull_use_sma': True, 'bull_use_ema': True, 'bull_use_atr': True, 'bull_use_adx': True, 'bull_use_spike': True, 'bull_rsi_required': True, 'bear_strategy': 'mean_reversion', 'bear_bb_std_mult': 3.4250886767632336, 'bear_rsi_os': 26, 'bear_rsi_ob': 86, 'bear_adx_thresh': 9.666806638260413, 'bear_atr_min_pct': 0.014833876001108186, 'bear_atr_max_pct': 0.0848231824949814, 'bear_tp_mult': 1.6513715884698383, 'bear_tsl_mult': 0.17752560959712255, 'bear_time_stop': 47, 'bear_use_sma': True, 'bear_use_ema': False, 'bear_use_atr': True, 'bear_use_adx': True, 'bear_use_spike': True, 'bear_rsi_required': False, 'sideways_strategy': 'mean_reversion', 'sideways_bb_std_mult': 2.37648275721235, 'sideways_rsi_os': 15, 'sideways_rsi_ob': 57, 'sideways_adx_thresh': 9.574245440298272, 'sideways_atr_min_pct': 0.022495641359948665, 'sideways_atr_max_pct': 0.11563709221828421, 'sideways_tp_mult': 2.6858203240418854, 'sideways_tsl_mult': 0.6572593941546503, 'sideways_time_stop': 241, 'sideways_use_sma': True, 'sideways_use_ema': True, 'sideways_use_atr': True, 'sideways_use_adx': False, 'sideways_use_spike': True, 'sideways_rsi_required': False}.
[I 2025-08-30 18:59:28,225] Trial 186 finished with values: [-1000000000.0, 1000000000.0] and parameters: {'p_sma': 41, 'p_std': 26, 'p_atr': 11, 'p_adx': 14, 'rsi_period': 53, 'ema1': 12, 'ema2': 42, 'slip_atr_k': 0.249239843079882, 'slip_spread_k': 0.7019822845140951, 'spread_hl_frac': 0.004953318760632155, 'bb_std_mult': 3.4872601536483923, 'rsi_os': 51, 'rsi_ob': 57, 'vol_spike': 0.2922494158832794, 'adx_thresh': 18.632785689277682, 'atr_min_pct': 0.006264622336105127, 'atr_max_pct': 0.13025463976392498, 'tp_mult': 2.1622189683473754, 'tsl_mult': 0.9357515954261468, 'strategy': 'breakout', 'time_stop': 269, 'use_sma': False, 'use_atr': True, 'use_adx': False, 'use_ema': False, 'use_spike': True, 'rsi_required': True, 'edge_k': 0.21575796669020497, 'edge_cap': 0.5856447232671567, 'bull_strategy': 'mean_reversion', 'bull_bb_std_mult': 1.815840872517013, 'bull_rsi_os': 23, 'bull_rsi_ob': 72, 'bull_adx_thresh': 34.4271552562102, 'bull_atr_min_pct': 0.0030562960609903105, 'bull_atr_max_pct': 0.11403544404069749, 'bull_tp_mult': 2.1662032255718047, 'bull_tsl_mult': 0.3454149400516433, 'bull_time_stop': 186, 'bull_use_sma': True, 'bull_use_ema': False, 'bull_use_atr': False, 'bull_use_adx': True, 'bull_use_spike': True, 'bull_rsi_required': True, 'bear_strategy': 'breakout', 'bear_bb_std_mult': 1.4892926558965267, 'bear_rsi_os': 26, 'bear_rsi_ob': 45, 'bear_adx_thresh': 9.644919848113528, 'bear_atr_min_pct': 0.011632221390436763, 'bear_atr_max_pct': 0.08459094598224269, 'bear_tp_mult': 1.6494968593016925, 'bear_tsl_mult': 0.87713217466909, 'bear_time_stop': 180, 'bear_use_sma': True, 'bear_use_ema': False, 'bear_use_atr': True, 'bear_use_adx': True, 'bear_use_spike': False, 'bear_rsi_required': True, 'sideways_strategy': 'mean_reversion', 'sideways_bb_std_mult': 3.493273417483806, 'sideways_rsi_os': 15, 'sideways_rsi_ob': 57, 'sideways_adx_thresh': 31.227973164356435, 'sideways_atr_min_pct': 0.015428195906457928, 'sideways_atr_max_pct': 0.11552202817056074, 'sideways_tp_mult': 1.3864794373312086, 'sideways_tsl_mult': 0.6607913147061706, 'sideways_time_stop': 269, 'sideways_use_sma': True, 'sideways_use_ema': True, 'sideways_use_atr': False, 'sideways_use_adx': False, 'sideways_use_spike': True, 'sideways_rsi_required': False}.
[I 2025-08-30 18:59:28,345] Trial 185 finished with values: [-1000000000.0, 1000000000.0] and parameters: {'p_sma': 41, 'p_std': 26, 'p_atr': 28, 'p_adx': 9, 'rsi_period': 53, 'ema1': 23, 'ema2': 30, 'slip_atr_k': 0.15482236697648225, 'slip_spread_k': 0.49864177332769377, 'spread_hl_frac': 0.004994229439168822, 'bb_std_mult': 0.8285941580871496, 'rsi_os': 38, 'rsi_ob': 57, 'vol_spike': 0.027717549755279444, 'adx_thresh': 33.9649291766923, 'atr_min_pct': 0.01031223513442792, 'atr_max_pct': 0.13368641685952634, 'tp_mult': 2.194815747657617, 'tsl_mult': 0.8313869558193504, 'strategy': 'breakout', 'time_stop': 269, 'use_sma': False, 'use_atr': True, 'use_adx': False, 'use_ema': False, 'use_spike': True, 'rsi_required': True, 'edge_k': 0.638774990901293, 'edge_cap': 0.7830535093660225, 'bull_strategy': 'mean_reversion', 'bull_bb_std_mult': 1.973067049088277, 'bull_rsi_os': 49, 'bull_rsi_ob': 48, 'bull_adx_thresh': 34.40854214749284, 'bull_atr_min_pct': 0.003051430759472758, 'bull_atr_max_pct': 0.025618468523125236, 'bull_tp_mult': 2.560829863907971, 'bull_tsl_mult': 0.9777801158526167, 'bull_time_stop': 187, 'bull_use_sma': True, 'bull_use_ema': False, 'bull_use_atr': False, 'bull_use_adx': True, 'bull_use_spike': True, 'bull_rsi_required': True, 'bear_strategy': 'breakout', 'bear_bb_std_mult': 3.234280626567854, 'bear_rsi_os': 47, 'bear_rsi_ob': 86, 'bear_adx_thresh': 16.74423850345364, 'bear_atr_min_pct': 0.011501513546783243, 'bear_atr_max_pct': 0.050086570543952054, 'bear_tp_mult': 1.7612955678202873, 'bear_tsl_mult': 0.11001128237502304, 'bear_time_stop': 236, 'bear_use_sma': True, 'bear_use_ema': False, 'bear_use_atr': True, 'bear_use_adx': True, 'bear_use_spike': False, 'bear_rsi_required': True, 'sideways_strategy': 'mean_reversion', 'sideways_bb_std_mult': 0.5091617963946846, 'sideways_rsi_os': 13, 'sideways_rsi_ob': 57, 'sideways_adx_thresh': 31.487264842781585, 'sideways_atr_min_pct': 0.0033805321934130463, 'sideways_atr_max_pct': 0.1158195995205017, 'sideways_tp_mult': 1.905777712495548, 'sideways_tsl_mult': 0.012193058727579087, 'sideways_time_stop': 278, 'sideways_use_sma': True, 'sideways_use_ema': True, 'sideways_use_atr': False, 'sideways_use_adx': False, 'sideways_use_spike': True, 'sideways_rsi_required': True}.
