[I 2025-08-30 19:11:41,631] Trial 279 finished with values: [-0.02157844686324295, 0.02144534870234471] and parameters: {'p_sma': 40, 'p_std': 5, 'p_atr': 8, 'p_adx': 9, 'rsi_period': 20, 'ema1': 24, 'ema2': 21, 'slip_atr_k': 0.040605789605531795, 'slip_spread_k': 0.200698964495844, 'spread_hl_frac': 0.039441983248426044, 'bb_std_mult': 3.1990926900014696, 'rsi_os': 43, 'rsi_ob': 56, 'vol_spike': 0.2783127053775772, 'adx_thresh': 31.93380325158884, 'atr_min_pct': 0.006084517389340497, 'atr_max_pct': 0.13678943780441408, 'tp_mult': 2.267688657822934, 'tsl_mult': 0.7484334438186645, 'strategy': 'mean_reversion', 'time_stop': 31, 'use_sma': False, 'use_atr': False, 'use_adx': False, 'use_ema': False, 'use_spike': False, 'rsi_required': True, 'edge_k': 1.5715246640247105, 'edge_cap': 0.13893626730495018, 'bull_strategy': 'breakout', 'bull_bb_std_mult': 1.8288995998512472, 'bull_rsi_os': 12, 'bull_rsi_ob': 63, 'bull_adx_thresh': 25.128718696057312, 'bull_atr_min_pct': 0.001958426878849259, 'bull_atr_max_pct': 0.02165569899575367, 'bull_tp_mult': 2.2674776711502678, 'bull_tsl_mult': 0.8795816474826359, 'bull_time_stop': 205, 'bull_use_sma': False, 'bull_use_ema': True, 'bull_use_atr': True, 'bull_use_adx': True, 'bull_use_spike': True, 'bull_rsi_required': False, 'bear_strategy': 'mean_reversion', 'bear_bb_std_mult': 3.297637615683799, 'bear_rsi_os': 44, 'bear_rsi_ob': 85, 'bear_adx_thresh': 34.711005624901745, 'bear_atr_min_pct': 0.008276842145537668, 'bear_atr_max_pct': 0.057391851093888654, 'bear_tp_mult': 2.5396804113341847, 'bear_tsl_mult': 0.12224763976094702, 'bear_time_stop': 33, 'bear_use_sma': True, 'bear_use_ema': False, 'bear_use_atr': False, 'bear_use_adx': False, 'bear_use_spike': False, 'bear_rsi_required': False, 'sideways_strategy': 'mean_reversion', 'sideways_bb_std_mult': 2.040413051791222, 'sideways_rsi_os': 16, 'sideways_rsi_ob': 58, 'sideways_adx_thresh': 8.011198610379674, 'sideways_atr_min_pct': 0.014784317359913295, 'sideways_atr_max_pct': 0.02824703741542163, 'sideways_tp_mult': 2.02996730468713, 'sideways_tsl_mult': 0.6671564526683298, 'sideways_time_stop': 266, 'sideways_use_sma': True, 'sideways_use_ema': True, 'sideways_use_atr': False, 'sideways_use_adx': True, 'sideways_use_spike': True, 'sideways_rsi_required': True}.
[I 2025-08-30 19:11:41,736] Trial 280 finished with values: [-1000000000.0, 1000000000.0] and parameters: {'p_sma': 51, 'p_std': 27, 'p_atr': 8, 'p_adx': 13, 'rsi_period': 56, 'ema1': 16, 'ema2': 49, 'slip_atr_k': 0.15066734790598169, 'slip_spread_k': 0.4195441032700375, 'spread_hl_frac': 0.003034189096334582, 'bb_std_mult': 1.6233780593398008, 'rsi_os': 34, 'rsi_ob': 56, 'vol_spike': 0.23054208717772337, 'adx_thresh': 29.059863397379893, 'atr_min_pct': 0.02377990260572041, 'atr_max_pct': 0.12971395376481348, 'tp_mult': 2.20790819575865, 'tsl_mult': 0.44509157044574604, 'strategy': 'mean_reversion', 'time_stop': 30, 'use_sma': False, 'use_atr': False, 'use_adx': True, 'use_ema': False, 'use_spike': False, 'rsi_required': True, 'edge_k': 0.1410941937791907, 'edge_cap': 0.13922268331883553, 'bull_strategy': 'breakout', 'bull_bb_std_mult': 1.585358841831063, 'bull_rsi_os': 49, 'bull_rsi_ob': 80, 'bull_adx_thresh': 28.236899796842504, 'bull_atr_min_pct': 0.013942753387344704, 'bull_atr_max_pct': 0.12580009140636222, 'bull_tp_mult': 1.4831179042671725, 'bull_tsl_mult': 0.8845531800403239, 'bull_time_stop': 201, 'bull_use_sma': False, 'bull_use_ema': True, 'bull_use_atr': True, 'bull_use_adx': False, 'bull_use_spike': True, 'bull_rsi_required': False, 'bear_strategy': 'mean_reversion', 'bear_bb_std_mult': 3.337934813080196, 'bear_rsi_os': 45, 'bear_rsi_ob': 83, 'bear_adx_thresh': 7.025043348530978, 'bear_atr_min_pct': 0.015045184806265748, 'bear_atr_max_pct': 0.060131304148996985, 'bear_tp_mult': 1.1226271611368133, 'bear_tsl_mult': 0.6651238995911931, 'bear_time_stop': 39, 'bear_use_sma': True, 'bear_use_ema': False, 'bear_use_atr': False, 'bear_use_adx': False, 'bear_use_spike': False, 'bear_rsi_required': False, 'sideways_strategy': 'mean_reversion', 'sideways_bb_std_mult': 2.0367316588962847, 'sideways_rsi_os': 16, 'sideways_rsi_ob': 58, 'sideways_adx_thresh': 10.432413659667196, 'sideways_atr_min_pct': 0.0018648508524683576, 'sideways_atr_max_pct': 0.11980757944158267, 'sideways_tp_mult': 2.154729151180857, 'sideways_tsl_mult': 0.6582044999228637, 'sideways_time_stop': 262, 'sideways_use_sma': True, 'sideways_use_ema': True, 'sideways_use_atr': False, 'sideways_use_adx': True, 'sideways_use_spike': True, 'sideways_rsi_required': True}.
[I 2025-08-30 19:12:16,672] Trial 284 finished with values: [-1000000000.0, 1000000000.0] and parameters: {'p_sma': 22, 'p_std': 26, 'p_atr': 13, 'p_adx': 9, 'rsi_period': 19, 'ema1': 24, 'ema2': 16, 'slip_atr_k': 0.10005873198690295, 'slip_spread_k': 0.23533775302550003, 'spread_hl_frac': 0.006780770429852194, 'bb_std_mult': 0.8669433699254809, 'rsi_os': 6, 'rsi_ob': 58, 'vol_spike': 0.061211206494176065, 'adx_thresh': 31.18866588211898, 'atr_min_pct': 0.01738896955149941, 'atr_max_pct': 0.11082181292627487, 'tp_mult': 2.6537232337692274, 'tsl_mult': 0.18064111323756005, 'strategy': 'breakout', 'time_stop': 40, 'use_sma': False, 'use_atr': True, 'use_adx': True, 'use_ema': True, 'use_spike': True, 'rsi_required': True, 'edge_k': 0.30183944618556957, 'edge_cap': 0.8822312024555938, 'bull_strategy': 'mean_reversion', 'bull_bb_std_mult': 1.151486189290548, 'bull_rsi_os': 12, 'bull_rsi_ob': 73, 'bull_adx_thresh': 26.159663634845067, 'bull_atr_min_pct': 0.024355383336937333, 'bull_atr_max_pct': 0.05609763773401655, 'bull_tp_mult': 2.5249109656649145, 'bull_tsl_mult': 0.9963910860956969, 'bull_time_stop': 260, 'bull_use_sma': True, 'bull_use_ema': False, 'bull_use_atr': False, 'bull_use_adx': True, 'bull_use_spike': True, 'bull_rsi_required': True, 'bear_strategy': 'breakout', 'bear_bb_std_mult': 3.272077958871649, 'bear_rsi_os': 39, 'bear_rsi_ob': 57, 'bear_adx_thresh': 9.911298679395673, 'bear_atr_min_pct': 0.016238695905098872, 'bear_atr_max_pct': 0.03559914800467366, 'bear_tp_mult': 1.6478649912373395, 'bear_tsl_mult': 0.10658081214460695, 'bear_time_stop': 284, 'bear_use_sma': True, 'bear_use_ema': False, 'bear_use_atr': True, 'bear_use_adx': True, 'bear_use_spike': True, 'bear_rsi_required': False, 'sideways_strategy': 'breakout', 'sideways_bb_std_mult': 1.831324223325578, 'sideways_rsi_os': 18, 'sideways_rsi_ob': 73, 'sideways_adx_thresh': 13.926651314708334, 'sideways_atr_min_pct': 0.014233669541688176, 'sideways_atr_max_pct': 0.0921384276613293, 'sideways_tp_mult': 1.987643520014259, 'sideways_tsl_mult': 0.6856887555421762, 'sideways_time_stop': 279, 'sideways_use_sma': True, 'sideways_use_ema': True, 'sideways_use_atr': False, 'sideways_use_adx': False, 'sideways_use_spike': False, 'sideways_rsi_required': False}.
[I 2025-08-30 19:12:17,378] Trial 283 finished with values: [-1000000000.0, 1000000000.0] and parameters: {'p_sma': 47, 'p_std': 42, 'p_atr': 12, 'p_adx': 9, 'rsi_period': 41, 'ema1': 29, 'ema2': 48, 'slip_atr_k': 0.1519534809443353, 'slip_spread_k': 0.3354214129739771, 'spread_hl_frac': 0.0031540573659479395, 'bb_std_mult': 2.4190090628239567, 'rsi_os': 34, 'rsi_ob': 58, 'vol_spike': 0.03838993813550626, 'adx_thresh': 13.74712487277825, 'atr_min_pct': 0.024303041461362505, 'atr_max_pct': 0.13995830341336438, 'tp_mult': 2.1845569579407607, 'tsl_mult': 0.7034400454166884, 'strategy': 'breakout', 'time_stop': 42, 'use_sma': False, 'use_atr': True, 'use_adx': True, 'use_ema': True, 'use_spike': True, 'rsi_required': True, 'edge_k': 1.4111633259616676, 'edge_cap': 0.26119269542700807, 'bull_strategy': 'mean_reversion', 'bull_bb_std_mult': 0.9394728447159986, 'bull_rsi_os': 29, 'bull_rsi_ob': 72, 'bull_adx_thresh': 25.78171374471665, 'bull_atr_min_pct': 0.013766896066589384, 'bull_atr_max_pct': 0.022127692589944535, 'bull_tp_mult': 1.489344721715768, 'bull_tsl_mult': 0.9617245658581185, 'bull_time_stop': 201, 'bull_use_sma': True, 'bull_use_ema': False, 'bull_use_atr': True, 'bull_use_adx': True, 'bull_use_spike': True, 'bull_rsi_required': False, 'bear_strategy': 'breakout', 'bear_bb_std_mult': 3.286170371750988, 'bear_rsi_os': 44, 'bear_rsi_ob': 83, 'bear_adx_thresh': 34.78989357291911, 'bear_atr_min_pct': 0.015054962627456392, 'bear_atr_max_pct': 0.056342372376264535, 'bear_tp_mult': 2.56807239288249, 'bear_tsl_mult': 0.12646995160611316, 'bear_time_stop': 283, 'bear_use_sma': True, 'bear_use_ema': False, 'bear_use_atr': True, 'bear_use_adx': True, 'bear_use_spike': True, 'bear_rsi_required': False, 'sideways_strategy': 'breakout', 'sideways_bb_std_mult': 3.182117940463736, 'sideways_rsi_os': 18, 'sideways_rsi_ob': 54, 'sideways_adx_thresh': 26.34475981588212, 'sideways_atr_min_pct': 0.014008942827966218, 'sideways_atr_max_pct': 0.11882561220350876, 'sideways_tp_mult': 2.126538931771057, 'sideways_tsl_mult': 0.4668997375552695, 'sideways_time_stop': 142, 'sideways_use_sma': True, 'sideways_use_ema': True, 'sideways_use_atr': False, 'sideways_use_adx': False, 'sideways_use_spike': False, 'sideways_rsi_required': False}.
[I 2025-08-30 19:12:17,776] Trial 282 finished with values: [-1000000000.0, 1000000000.0] and parameters: {'p_sma': 14, 'p_std': 27, 'p_atr': 19, 'p_adx': 9, 'rsi_period': 20, 'ema1': 24, 'ema2': 48, 'slip_atr_k': 0.03309752532793051, 'slip_spread_k': 0.23261429262186512, 'spread_hl_frac': 0.038803038879236175, 'bb_std_mult': 3.399786850090897, 'rsi_os': 34, 'rsi_ob': 56, 'vol_spike': 0.2318406866216856, 'adx_thresh': 19.847886107792043, 'atr_min_pct': 0.001631394763723459, 'atr_max_pct': 0.08032876527391816, 'tp_mult': 2.6460022207180494, 'tsl_mult': 0.7159848298491827, 'strategy': 'breakout', 'time_stop': 41, 'use_sma': False, 'use_atr': True, 'use_adx': True, 'use_ema': False, 'use_spike': True, 'rsi_required': True, 'edge_k': 1.40456619825593, 'edge_cap': 0.4031535423887167, 'bull_strategy': 'mean_reversion', 'bull_bb_std_mult': 1.7963136646175435, 'bull_rsi_os': 12, 'bull_rsi_ob': 74, 'bull_adx_thresh': 28.06291943505551, 'bull_atr_min_pct': 0.002809857388489058, 'bull_atr_max_pct': 0.03877198491011313, 'bull_tp_mult': 1.4514532793965773, 'bull_tsl_mult': 0.9850481635911148, 'bull_time_stop': 202, 'bull_use_sma': True, 'bull_use_ema': False, 'bull_use_atr': False, 'bull_use_adx': True, 'bull_use_spike': True, 'bull_rsi_required': True, 'bear_strategy': 'breakout', 'bear_bb_std_mult': 3.274857785467038, 'bear_rsi_os': 23, 'bear_rsi_ob': 83, 'bear_adx_thresh': 34.60484418485571, 'bear_atr_min_pct': 0.01511267013769202, 'bear_atr_max_pct': 0.03570921695716975, 'bear_tp_mult': 1.6537973183794608, 'bear_tsl_mult': 0.9514156906736255, 'bear_time_stop': 51, 'bear_use_sma': True, 'bear_use_ema': False, 'bear_use_atr': True, 'bear_use_adx': True, 'bear_use_spike': False, 'bear_rsi_required': False, 'sideways_strategy': 'breakout', 'sideways_bb_std_mult': 0.7631772647426811, 'sideways_rsi_os': 38, 'sideways_rsi_ob': 57, 'sideways_adx_thresh': 13.569885512065122, 'sideways_atr_min_pct': 0.01739508123811053, 'sideways_atr_max_pct': 0.04891111572258151, 'sideways_tp_mult': 2.135073767385588, 'sideways_tsl_mult': 0.467489565296044, 'sideways_time_stop': 266, 'sideways_use_sma': True, 'sideways_use_ema': True, 'sideways_use_atr': False, 'sideways_use_adx': False, 'sideways_use_spike': False, 'sideways_rsi_required': False}.
[I 2025-08-30 19:12:17,870] Trial 281 finished with values: [-1000000000.0, 1000000000.0] and parameters: {'p_sma': 40, 'p_std': 27, 'p_atr': 12, 'p_adx': 9, 'rsi_period': 54, 'ema1': 27, 'ema2': 21, 'slip_atr_k': 0.03328275587806656, 'slip_spread_k': 0.24312429082393205, 'spread_hl_frac': 0.03896240324997817, 'bb_std_mult': 3.174916701451961, 'rsi_os': 5, 'rsi_ob': 58, 'vol_spike': 0.27777938661892265, 'adx_thresh': 12.509954471481922, 'atr_min_pct': 0.0013115179463815806, 'atr_max_pct': 0.014087283307098894, 'tp_mult': 2.20279424371398, 'tsl_mult': 0.7088927946762833, 'strategy': 'mean_reversion', 'time_stop': 40, 'use_sma': False, 'use_atr': False, 'use_adx': True, 'use_ema': False, 'use_spike': False, 'rsi_required': True, 'edge_k': 1.0112065051246244, 'edge_cap': 0.39983365060149234, 'bull_strategy': 'breakout', 'bull_bb_std_mult': 2.1967720842496012, 'bull_rsi_os': 12, 'bull_rsi_ob': 73, 'bull_adx_thresh': 28.541574579006962, 'bull_atr_min_pct': 0.024315989883554157, 'bull_atr_max_pct': 0.02235257752231976, 'bull_tp_mult': 1.4567715948806121, 'bull_tsl_mult': 0.900750841703862, 'bull_time_stop': 188, 'bull_use_sma': True, 'bull_use_ema': False, 'bull_use_atr': False, 'bull_use_adx': False, 'bull_use_spike': True, 'bull_rsi_required': True, 'bear_strategy': 'breakout', 'bear_bb_std_mult': 3.25992215354598, 'bear_rsi_os': 39, 'bear_rsi_ob': 83, 'bear_adx_thresh': 6.910436035913402, 'bear_atr_min_pct': 0.021936975065869543, 'bear_atr_max_pct': 0.06022946979746926, 'bear_tp_mult': 2.5338801499627532, 'bear_tsl_mult': 0.12757761657309544, 'bear_time_stop': 51, 'bear_use_sma': True, 'bear_use_ema': False, 'bear_use_atr': False, 'bear_use_adx': False, 'bear_use_spike': False, 'bear_rsi_required': False, 'sideways_strategy': 'mean_reversion', 'sideways_bb_std_mult': 1.3690794088514355, 'sideways_rsi_os': 18, 'sideways_rsi_ob': 48, 'sideways_adx_thresh': 26.293979472278817, 'sideways_atr_min_pct': 0.014807068081590316, 'sideways_atr_max_pct': 0.01029414591536515, 'sideways_tp_mult': 2.1335591420355087, 'sideways_tsl_mult': 0.6848932192212666, 'sideways_time_stop': 261, 'sideways_use_sma': True, 'sideways_use_ema': True, 'sideways_use_atr': False, 'sideways_use_adx': False, 'sideways_use_spike': True, 'sideways_rsi_required': False}.
[I 2025-08-30 19:12:50,626] Trial 287 finished with values: [-0.02813041883816436, 0.028064766870450293] and parameters: {'p_sma': 43, 'p_std': 25, 'p_atr': 14, 'p_adx': 18, 'rsi_period': 54, 'ema1': 20, 'ema2': 52, 'slip_atr_k': 0.010398493287267264, 'slip_spread_k': 0.3902611014135504, 'spread_hl_frac': 0.01756459723989899, 'bb_std_mult': 0.7889508361770312, 'rsi_os': 11, 'rsi_ob': 58, 'vol_spike': 0.28571934548064193, 'adx_thresh': 33.385685406706855, 'atr_min_pct': 0.014531433601467384, 'atr_max_pct': 0.13687610829747543, 'tp_mult': 1.02316140618947, 'tsl_mult': 0.9990399765051687, 'strategy': 'breakout', 'time_stop': 65, 'use_sma': True, 'use_atr': True, 'use_adx': False, 'use_ema': False, 'use_spike': True, 'rsi_required': False, 'edge_k': 0.1853476933961935, 'edge_cap': 0.27547203334710624, 'bull_strategy': 'mean_reversion', 'bull_bb_std_mult': 2.0068393872610684, 'bull_rsi_os': 19, 'bull_rsi_ob': 91, 'bull_adx_thresh': 21.470247552366693, 'bull_atr_min_pct': 0.001274397976459834, 'bull_atr_max_pct': 0.014326526418236549, 'bull_tp_mult': 2.2497068627056183, 'bull_tsl_mult': 0.9656262199895178, 'bull_time_stop': 164, 'bull_use_sma': True, 'bull_use_ema': False, 'bull_use_atr': False, 'bull_use_adx': True, 'bull_use_spike': True, 'bull_rsi_required': True, 'bear_strategy': 'breakout', 'bear_bb_std_mult': 1.9837740889800954, 'bear_rsi_os': 43, 'bear_rsi_ob': 84, 'bear_adx_thresh': 6.165457587977262, 'bear_atr_min_pct': 0.016489374533811697, 'bear_atr_max_pct': 0.043261596783141384, 'bear_tp_mult': 1.7867827303306985, 'bear_tsl_mult': 0.8203682316775753, 'bear_time_stop': 24, 'bear_use_sma': False, 'bear_use_ema': False, 'bear_use_atr': True, 'bear_use_adx': True, 'bear_use_spike': False, 'bear_rsi_required': False, 'sideways_strategy': 'breakout', 'sideways_bb_std_mult': 2.18161036842038, 'sideways_rsi_os': 14, 'sideways_rsi_ob': 48, 'sideways_adx_thresh': 34.891526540446236, 'sideways_atr_min_pct': 0.019260516908368584, 'sideways_atr_max_pct': 0.07439883022899166, 'sideways_tp_mult': 1.0794376974354996, 'sideways_tsl_mult': 0.33685693361306657, 'sideways_time_stop': 272, 'sideways_use_sma': True, 'sideways_use_ema': True, 'sideways_use_atr': True, 'sideways_use_adx': False, 'sideways_use_spike': False, 'sideways_rsi_required': False}.
[I 2025-08-30 19:12:50,937] Trial 286 finished with values: [-1000000000.0, 1000000000.0] and parameters: {'p_sma': 42, 'p_std': 25, 'p_atr': 19, 'p_adx': 16, 'rsi_period': 29, 'ema1': 24, 'ema2': 31, 'slip_atr_k': 0.028211814294125878, 'slip_spread_k': 0.08474246149574671, 'spread_hl_frac': 0.008244335098381224, 'bb_std_mult': 1.3319820033486254, 'rsi_os': 12, 'rsi_ob': 57, 'vol_spike': 0.28795713831920156, 'adx_thresh': 19.664687668794635, 'atr_min_pct': 0.0018978738648049564, 'atr_max_pct': 0.13621109650702073, 'tp_mult': 2.159244434485816, 'tsl_mult': 0.7182806183637857, 'strategy': 'breakout', 'time_stop': 78, 'use_sma': False, 'use_atr': True, 'use_adx': False, 'use_ema': False, 'use_spike': True, 'rsi_required': False, 'edge_k': 1.558367093139506, 'edge_cap': 0.40691038953789666, 'bull_strategy': 'mean_reversion', 'bull_bb_std_mult': 1.7878455290700266, 'bull_rsi_os': 34, 'bull_rsi_ob': 63, 'bull_adx_thresh': 24.149330653886455, 'bull_atr_min_pct': 0.0027262190353375924, 'bull_atr_max_pct': 0.0394123696263565, 'bull_tp_mult': 2.142273166688978, 'bull_tsl_mult': 0.9118707783904912, 'bull_time_stop': 187, 'bull_use_sma': True, 'bull_use_ema': False, 'bull_use_atr': False, 'bull_use_adx': True, 'bull_use_spike': True, 'bull_rsi_required': True, 'bear_strategy': 'breakout', 'bear_bb_std_mult': 3.416947113108261, 'bear_rsi_os': 22, 'bear_rsi_ob': 84, 'bear_adx_thresh': 32.791316099321406, 'bear_atr_min_pct': 0.020299707398815838, 'bear_atr_max_pct': 0.015766002870584092, 'bear_tp_mult': 1.7898440909924669, 'bear_tsl_mult': 0.15451646604530034, 'bear_time_stop': 50, 'bear_use_sma': True, 'bear_use_ema': False, 'bear_use_atr': True, 'bear_use_adx': True, 'bear_use_spike': False, 'bear_rsi_required': False, 'sideways_strategy': 'breakout', 'sideways_bb_std_mult': 0.7678090736995995, 'sideways_rsi_os': 5, 'sideways_rsi_ob': 55, 'sideways_adx_thresh': 8.126022821098259, 'sideways_atr_min_pct': 0.01728745690486837, 'sideways_atr_max_pct': 0.11035974047506997, 'sideways_tp_mult': 1.014304010603189, 'sideways_tsl_mult': 0.5666819914854127, 'sideways_time_stop': 270, 'sideways_use_sma': True, 'sideways_use_ema': True, 'sideways_use_atr': False, 'sideways_use_adx': False, 'sideways_use_spike': False, 'sideways_rsi_required': False}.
[I 2025-08-30 19:12:51,634] Trial 288 finished with values: [-1000000000.0, 1000000000.0] and parameters: {'p_sma': 6, 'p_std': 25, 'p_atr': 11, 'p_adx': 7, 'rsi_period': 50, 'ema1': 8, 'ema2': 60, 'slip_atr_k': 0.027727382459887706, 'slip_spread_k': 0.07112609474301756, 'spread_hl_frac': 0.043129560232701515, 'bb_std_mult': 2.332291627496557, 'rsi_os': 43, 'rsi_ob': 57, 'vol_spike': 0.12073651433197287, 'adx_thresh': 33.02046901998999, 'atr_min_pct': 0.022792993820058356, 'atr_max_pct': 0.1373367686344787, 'tp_mult': 1.0234587998418112, 'tsl_mult': 0.7322503290873268, 'strategy': 'breakout', 'time_stop': 178, 'use_sma': True, 'use_atr': True, 'use_adx': False, 'use_ema': False, 'use_spike': True, 'rsi_required': False, 'edge_k': 1.562824582562814, 'edge_cap': 0.25719765596012373, 'bull_strategy': 'mean_reversion', 'bull_bb_std_mult': 2.0148142389277615, 'bull_rsi_os': 6, 'bull_rsi_ob': 86, 'bull_adx_thresh': 5.1585766358663445, 'bull_atr_min_pct': 0.0012818551100126686, 'bull_atr_max_pct': 0.015480029109341925, 'bull_tp_mult': 1.11199979831216, 'bull_tsl_mult': 0.9486460284839182, 'bull_time_stop': 164, 'bull_use_sma': True, 'bull_use_ema': False, 'bull_use_atr': False, 'bull_use_adx': True, 'bull_use_spike': False, 'bull_rsi_required': True, 'bear_strategy': 'breakout', 'bear_bb_std_mult': 3.4039165177911492, 'bear_rsi_os': 43, 'bear_rsi_ob': 81, 'bear_adx_thresh': 8.303419304606628, 'bear_atr_min_pct': 0.019986707817307187, 'bear_atr_max_pct': 0.09851611252416784, 'bear_tp_mult': 1.2047890117007367, 'bear_tsl_mult': 0.09837402316779864, 'bear_time_stop': 28, 'bear_use_sma': False, 'bear_use_ema': True, 'bear_use_atr': True, 'bear_use_adx': True, 'bear_use_spike': False, 'bear_rsi_required': False, 'sideways_strategy': 'breakout', 'sideways_bb_std_mult': 2.1893873544134834, 'sideways_rsi_os': 14, 'sideways_rsi_ob': 69, 'sideways_adx_thresh': 8.227379598632904, 'sideways_atr_min_pct': 0.019292842997728002, 'sideways_atr_max_pct': 0.11169153518793402, 'sideways_tp_mult': 1.6843886029100616, 'sideways_tsl_mult': 0.32643615477518384, 'sideways_time_stop': 235, 'sideways_use_sma': False, 'sideways_use_ema': True, 'sideways_use_atr': True, 'sideways_use_adx': False, 'sideways_use_spike': False, 'sideways_rsi_required': False}.
