[I 2025-08-30 19:54:14,036] Trial 594 finished with values: [-1000000000.0, 1000000000.0] and parameters: {'p_sma': 41, 'p_std': 28, 'p_atr': 17, 'p_adx': 20, 'rsi_period': 7, 'ema1': 25, 'ema2': 16, 'slip_atr_k': 0.14075826962783367, 'slip_spread_k': 0.632684678344469, 'spread_hl_frac': 0.047148894422555106, 'bb_std_mult': 3.4571029735984444, 'rsi_os': 22, 'rsi_ob': 55, 'vol_spike': 0.01954225438326081, 'adx_thresh': 8.593102810725005, 'atr_min_pct': 0.019072636723917076, 'atr_max_pct': 0.13969151129430452, 'tp_mult': 1.0511108218771763, 'tsl_mult': 0.6657445635436532, 'strategy': 'breakout', 'time_stop': 38, 'use_sma': False, 'use_atr': True, 'use_adx': False, 'use_ema': False, 'use_spike': True, 'rsi_required': False, 'edge_k': 0.13746735236703375, 'edge_cap': 0.6980173194660628, 'bull_strategy': 'mean_reversion', 'bull_bb_std_mult': 0.8498298628507608, 'bull_rsi_os': 39, 'bull_rsi_ob': 83, 'bull_adx_thresh': 26.338526034516402, 'bull_atr_min_pct': 0.003478934832491506, 'bull_atr_max_pct': 0.1467830771262285, 'bull_tp_mult': 1.2459592031444053, 'bull_tsl_mult': 0.0013605660714287038, 'bull_time_stop': 181, 'bull_use_sma': True, 'bull_use_ema': True, 'bull_use_atr': True, 'bull_use_adx': False, 'bull_use_spike': True, 'bull_rsi_required': True, 'bear_strategy': 'breakout', 'bear_bb_std_mult': 3.2419113672613444, 'bear_rsi_os': 42, 'bear_rsi_ob': 84, 'bear_adx_thresh': 7.779788472242318, 'bear_atr_min_pct': 0.017091346106997658, 'bear_atr_max_pct': 0.05176701636776959, 'bear_tp_mult': 1.7840050282064046, 'bear_tsl_mult': 0.5044655859305417, 'bear_time_stop': 50, 'bear_use_sma': False, 'bear_use_ema': True, 'bear_use_atr': True, 'bear_use_adx': True, 'bear_use_spike': True, 'bear_rsi_required': True, 'sideways_strategy': 'mean_reversion', 'sideways_bb_std_mult': 0.6482921071618766, 'sideways_rsi_os': 16, 'sideways_rsi_ob': 55, 'sideways_adx_thresh': 8.248035193288908, 'sideways_atr_min_pct': 0.02000436786056553, 'sideways_atr_max_pct': 0.07140024879819587, 'sideways_tp_mult': 1.8030240219626734, 'sideways_tsl_mult': 0.8821251429038421, 'sideways_time_stop': 281, 'sideways_use_sma': True, 'sideways_use_ema': False, 'sideways_use_atr': True, 'sideways_use_adx': False, 'sideways_use_spike': True, 'sideways_rsi_required': False}.
[I 2025-08-30 19:54:14,821] Trial 595 finished with values: [-1000000000.0, 1000000000.0] and parameters: {'p_sma': 51, 'p_std': 36, 'p_atr': 11, 'p_adx': 24, 'rsi_period': 53, 'ema1': 24, 'ema2': 60, 'slip_atr_k': 0.139742031402795, 'slip_spread_k': 0.3820213524683663, 'spread_hl_frac': 0.0058308730927122444, 'bb_std_mult': 0.940419517079043, 'rsi_os': 34, 'rsi_ob': 67, 'vol_spike': 0.016311643985576125, 'adx_thresh': 17.444750004442064, 'atr_min_pct': 0.0011150690443727518, 'atr_max_pct': 0.09582632925226733, 'tp_mult': 2.9071816743929006, 'tsl_mult': 0.7285393850437252, 'strategy': 'breakout', 'time_stop': 38, 'use_sma': False, 'use_atr': True, 'use_adx': False, 'use_ema': False, 'use_spike': True, 'rsi_required': False, 'edge_k': 0.2152530371630615, 'edge_cap': 0.2241627419905112, 'bull_strategy': 'mean_reversion', 'bull_bb_std_mult': 1.8562288628224235, 'bull_rsi_os': 34, 'bull_rsi_ob': 70, 'bull_adx_thresh': 17.472574396770266, 'bull_atr_min_pct': 0.0036470146837951625, 'bull_atr_max_pct': 0.02158449699636603, 'bull_tp_mult': 2.1880635177150976, 'bull_tsl_mult': 0.865750693607408, 'bull_time_stop': 188, 'bull_use_sma': True, 'bull_use_ema': True, 'bull_use_atr': True, 'bull_use_adx': False, 'bull_use_spike': True, 'bull_rsi_required': True, 'bear_strategy': 'breakout', 'bear_bb_std_mult': 1.4544318339436861, 'bear_rsi_os': 47, 'bear_rsi_ob': 84, 'bear_adx_thresh': 5.57552497159408, 'bear_atr_min_pct': 0.013749581432743367, 'bear_atr_max_pct': 0.08431751088246672, 'bear_tp_mult': 1.826071970965314, 'bear_tsl_mult': 0.631266674977806, 'bear_time_stop': 51, 'bear_use_sma': False, 'bear_use_ema': True, 'bear_use_atr': True, 'bear_use_adx': True, 'bear_use_spike': True, 'bear_rsi_required': True, 'sideways_strategy': 'mean_reversion', 'sideways_bb_std_mult': 1.8196468042485787, 'sideways_rsi_os': 16, 'sideways_rsi_ob': 82, 'sideways_adx_thresh': 7.903238444915223, 'sideways_atr_min_pct': 0.019967856138095333, 'sideways_atr_max_pct': 0.026695096076093508, 'sideways_tp_mult': 1.6885897270925276, 'sideways_tsl_mult': 0.4036223476925699, 'sideways_time_stop': 216, 'sideways_use_sma': True, 'sideways_use_ema': False, 'sideways_use_atr': True, 'sideways_use_adx': False, 'sideways_use_spike': True, 'sideways_rsi_required': False}.
[I 2025-08-30 19:54:15,475] Trial 596 finished with values: [-1000000000.0, 1000000000.0] and parameters: {'p_sma': 41, 'p_std': 26, 'p_atr': 11, 'p_adx': 7, 'rsi_period': 62, 'ema1': 25, 'ema2': 16, 'slip_atr_k': 0.011367576010778306, 'slip_spread_k': 0.03493099109483133, 'spread_hl_frac': 0.00610459403113813, 'bb_std_mult': 0.682227901941016, 'rsi_os': 8, 'rsi_ob': 54, 'vol_spike': 0.056569169417000055, 'adx_thresh': 12.36590394575006, 'atr_min_pct': 0.023487235344472425, 'atr_max_pct': 0.13119159038769426, 'tp_mult': 1.5322309602149098, 'tsl_mult': 0.7249784875158467, 'strategy': 'breakout', 'time_stop': 76, 'use_sma': False, 'use_atr': True, 'use_adx': False, 'use_ema': False, 'use_spike': True, 'rsi_required': False, 'edge_k': 0.25447186601067506, 'edge_cap': 0.2361747886215123, 'bull_strategy': 'mean_reversion', 'bull_bb_std_mult': 2.033784521409969, 'bull_rsi_os': 38, 'bull_rsi_ob': 81, 'bull_adx_thresh': 17.355360318769126, 'bull_atr_min_pct': 0.003690874131401524, 'bull_atr_max_pct': 0.11009077374873337, 'bull_tp_mult': 1.5154511473368029, 'bull_tsl_mult': 0.7837728917712082, 'bull_time_stop': 186, 'bull_use_sma': True, 'bull_use_ema': False, 'bull_use_atr': True, 'bull_use_adx': False, 'bull_use_spike': True, 'bull_rsi_required': True, 'bear_strategy': 'breakout', 'bear_bb_std_mult': 3.230274390653571, 'bear_rsi_os': 53, 'bear_rsi_ob': 84, 'bear_adx_thresh': 19.18084107885108, 'bear_atr_min_pct': 0.004895533539769851, 'bear_atr_max_pct': 0.05828181779338227, 'bear_tp_mult': 1.7334263535916934, 'bear_tsl_mult': 0.635739696944001, 'bear_time_stop': 48, 'bear_use_sma': False, 'bear_use_ema': True, 'bear_use_atr': True, 'bear_use_adx': True, 'bear_use_spike': True, 'bear_rsi_required': True, 'sideways_strategy': 'mean_reversion', 'sideways_bb_std_mult': 1.3880340613308824, 'sideways_rsi_os': 34, 'sideways_rsi_ob': 57, 'sideways_adx_thresh': 8.152853778282703, 'sideways_atr_min_pct': 0.01983013600012265, 'sideways_atr_max_pct': 0.02675967718387163, 'sideways_tp_mult': 1.6906510984229344, 'sideways_tsl_mult': 0.8836998848800234, 'sideways_time_stop': 215, 'sideways_use_sma': True, 'sideways_use_ema': False, 'sideways_use_atr': True, 'sideways_use_adx': False, 'sideways_use_spike': False, 'sideways_rsi_required': False}.
[I 2025-08-30 19:54:49,139] Trial 600 finished with values: [-1000000000.0, 1000000000.0] and parameters: {'p_sma': 21, 'p_std': 18, 'p_atr': 9, 'p_adx': 10, 'rsi_period': 25, 'ema1': 24, 'ema2': 20, 'slip_atr_k': 0.11359750332167717, 'slip_spread_k': 0.16661586578606413, 'spread_hl_frac': 0.04097659129777841, 'bb_std_mult': 0.8585556192232999, 'rsi_os': 36, 'rsi_ob': 46, 'vol_spike': 0.07001372644262795, 'adx_thresh': 26.531728740764127, 'atr_min_pct': 0.02775450973152846, 'atr_max_pct': 0.1268218897766723, 'tp_mult': 1.3302337588625273, 'tsl_mult': 0.7583180769702129, 'strategy': 'breakout', 'time_stop': 47, 'use_sma': False, 'use_atr': True, 'use_adx': False, 'use_ema': True, 'use_spike': False, 'rsi_required': True, 'edge_k': 0.1689975877544134, 'edge_cap': 0.18951605236060823, 'bull_strategy': 'mean_reversion', 'bull_bb_std_mult': 1.7130326517668653, 'bull_rsi_os': 49, 'bull_rsi_ob': 71, 'bull_adx_thresh': 25.16405108562096, 'bull_atr_min_pct': 0.0025685395734821423, 'bull_atr_max_pct': 0.13985183381969318, 'bull_tp_mult': 2.0922119845907603, 'bull_tsl_mult': 0.9788377939681835, 'bull_time_stop': 180, 'bull_use_sma': False, 'bull_use_ema': False, 'bull_use_atr': False, 'bull_use_adx': True, 'bull_use_spike': True, 'bull_rsi_required': False, 'bear_strategy': 'breakout', 'bear_bb_std_mult': 3.413563214755487, 'bear_rsi_os': 45, 'bear_rsi_ob': 60, 'bear_adx_thresh': 5.659548898430602, 'bear_atr_min_pct': 0.010010139896862693, 'bear_atr_max_pct': 0.07859963930928547, 'bear_tp_mult': 1.6301713259088597, 'bear_tsl_mult': 0.37969145196627374, 'bear_time_stop': 30, 'bear_use_sma': True, 'bear_use_ema': False, 'bear_use_atr': True, 'bear_use_adx': True, 'bear_use_spike': False, 'bear_rsi_required': False, 'sideways_strategy': 'breakout', 'sideways_bb_std_mult': 1.2535472420372313, 'sideways_rsi_os': 19, 'sideways_rsi_ob': 58, 'sideways_adx_thresh': 13.390291996054966, 'sideways_atr_min_pct': 0.015616405691027563, 'sideways_atr_max_pct': 0.13701812713227457, 'sideways_tp_mult': 1.0111189835551981, 'sideways_tsl_mult': 0.4667942746967927, 'sideways_time_stop': 288, 'sideways_use_sma': True, 'sideways_use_ema': True, 'sideways_use_atr': False, 'sideways_use_adx': True, 'sideways_use_spike': False, 'sideways_rsi_required': False}.
[I 2025-08-30 19:54:49,342] Trial 598 finished with values: [-1000000000.0, 1000000000.0] and parameters: {'p_sma': 23, 'p_std': 23, 'p_atr': 12, 'p_adx': 7, 'rsi_period': 62, 'ema1': 23, 'ema2': 15, 'slip_atr_k': 0.011382580787163515, 'slip_spread_k': 0.041016793304550714, 'spread_hl_frac': 0.005357922683288062, 'bb_std_mult': 0.9394139947505085, 'rsi_os': 5, 'rsi_ob': 54, 'vol_spike': 0.04439603784542665, 'adx_thresh': 32.214826984090834, 'atr_min_pct': 0.026566071907946416, 'atr_max_pct': 0.09477658498672586, 'tp_mult': 2.4170623113149454, 'tsl_mult': 0.7280274948886187, 'strategy': 'breakout', 'time_stop': 76, 'use_sma': False, 'use_atr': True, 'use_adx': False, 'use_ema': True, 'use_spike': False, 'rsi_required': True, 'edge_k': 0.15110557239892214, 'edge_cap': 0.9981231788016562, 'bull_strategy': 'mean_reversion', 'bull_bb_std_mult': 2.032397275335208, 'bull_rsi_os': 49, 'bull_rsi_ob': 71, 'bull_adx_thresh': 17.239959880999226, 'bull_atr_min_pct': 0.013001593904291533, 'bull_atr_max_pct': 0.030945786661473976, 'bull_tp_mult': 2.3012226294138367, 'bull_tsl_mult': 0.09827210510090217, 'bull_time_stop': 185, 'bull_use_sma': False, 'bull_use_ema': False, 'bull_use_atr': False, 'bull_use_adx': True, 'bull_use_spike': True, 'bull_rsi_required': False, 'bear_strategy': 'breakout', 'bear_bb_std_mult': 1.46220352190665, 'bear_rsi_os': 54, 'bear_rsi_ob': 76, 'bear_adx_thresh': 9.273887832999334, 'bear_atr_min_pct': 0.026962010449143106, 'bear_atr_max_pct': 0.05777366767948365, 'bear_tp_mult': 1.8403836822969153, 'bear_tsl_mult': 0.044458437300407175, 'bear_time_stop': 33, 'bear_use_sma': True, 'bear_use_ema': False, 'bear_use_atr': True, 'bear_use_adx': True, 'bear_use_spike': False, 'bear_rsi_required': False, 'sideways_strategy': 'breakout', 'sideways_bb_std_mult': 2.040761278930861, 'sideways_rsi_os': 17, 'sideways_rsi_ob': 57, 'sideways_adx_thresh': 32.59661549186114, 'sideways_atr_min_pct': 0.01790994256340759, 'sideways_atr_max_pct': 0.1272438600879191, 'sideways_tp_mult': 2.4733805370069146, 'sideways_tsl_mult': 0.40873724594539673, 'sideways_time_stop': 272, 'sideways_use_sma': True, 'sideways_use_ema': True, 'sideways_use_atr': False, 'sideways_use_adx': True, 'sideways_use_spike': False, 'sideways_rsi_required': False}.
[I 2025-08-30 19:54:49,565] Trial 597 finished with values: [-1000000000.0, 1000000000.0] and parameters: {'p_sma': 54, 'p_std': 50, 'p_atr': 30, 'p_adx': 13, 'rsi_period': 62, 'ema1': 24, 'ema2': 16, 'slip_atr_k': 0.23090642975936015, 'slip_spread_k': 0.36934049126393514, 'spread_hl_frac': 0.03927906973961741, 'bb_std_mult': 0.8533497688379654, 'rsi_os': 25, 'rsi_ob': 54, 'vol_spike': 0.14385114684955852, 'adx_thresh': 12.902845482809674, 'atr_min_pct': 0.023480134952387287, 'atr_max_pct': 0.12890219684923276, 'tp_mult': 1.3380661096187683, 'tsl_mult': 0.755724532284398, 'strategy': 'breakout', 'time_stop': 38, 'use_sma': False, 'use_atr': True, 'use_adx': False, 'use_ema': True, 'use_spike': False, 'rsi_required': False, 'edge_k': 0.14603516248414883, 'edge_cap': 0.6053492461643151, 'bull_strategy': 'mean_reversion', 'bull_bb_std_mult': 2.0350285084445554, 'bull_rsi_os': 49, 'bull_rsi_ob': 62, 'bull_adx_thresh': 17.299521172200336, 'bull_atr_min_pct': 0.01281453558405948, 'bull_atr_max_pct': 0.025446983276957838, 'bull_tp_mult': 2.287191016480207, 'bull_tsl_mult': 0.38962952056609623, 'bull_time_stop': 104, 'bull_use_sma': False, 'bull_use_ema': False, 'bull_use_atr': True, 'bull_use_adx': False, 'bull_use_spike': True, 'bull_rsi_required': False, 'bear_strategy': 'breakout', 'bear_bb_std_mult': 3.4078924811714377, 'bear_rsi_os': 54, 'bear_rsi_ob': 84, 'bear_adx_thresh': 7.7114973931278, 'bear_atr_min_pct': 0.006484691144932138, 'bear_atr_max_pct': 0.09092713119955073, 'bear_tp_mult': 2.654479833559849, 'bear_tsl_mult': 0.04735357576147839, 'bear_time_stop': 172, 'bear_use_sma': True, 'bear_use_ema': True, 'bear_use_atr': True, 'bear_use_adx': True, 'bear_use_spike': False, 'bear_rsi_required': False, 'sideways_strategy': 'breakout', 'sideways_bb_std_mult': 0.666375227146426, 'sideways_rsi_os': 19, 'sideways_rsi_ob': 57, 'sideways_adx_thresh': 32.439014635336235, 'sideways_atr_min_pct': 0.020001773073042448, 'sideways_atr_max_pct': 0.027421892955302694, 'sideways_tp_mult': 1.734896448390359, 'sideways_tsl_mult': 0.4111080429449189, 'sideways_time_stop': 50, 'sideways_use_sma': True, 'sideways_use_ema': True, 'sideways_use_atr': True, 'sideways_use_adx': True, 'sideways_use_spike': False, 'sideways_rsi_required': False}.
[I 2025-08-30 19:54:49,658] Trial 599 finished with values: [-1000000000.0, 1000000000.0] and parameters: {'p_sma': 20, 'p_std': 24, 'p_atr': 12, 'p_adx': 7, 'rsi_period': 51, 'ema1': 23, 'ema2': 15, 'slip_atr_k': 0.011343101556231113, 'slip_spread_k': 0.4270029572001339, 'spread_hl_frac': 0.00992494835417438, 'bb_std_mult': 0.8532284648643187, 'rsi_os': 25, 'rsi_ob': 64, 'vol_spike': 0.04334183680455711, 'adx_thresh': 12.862200452979355, 'atr_min_pct': 0.023526152806534913, 'atr_max_pct': 0.1444590610842965, 'tp_mult': 1.5234147854176783, 'tsl_mult': 0.7232064274101737, 'strategy': 'breakout', 'time_stop': 79, 'use_sma': False, 'use_atr': True, 'use_adx': False, 'use_ema': True, 'use_spike': False, 'rsi_required': True, 'edge_k': 0.16111370406194364, 'edge_cap': 0.1896004761247426, 'bull_strategy': 'mean_reversion', 'bull_bb_std_mult': 2.8734166561219316, 'bull_rsi_os': 47, 'bull_rsi_ob': 71, 'bull_adx_thresh': 12.23702872339685, 'bull_atr_min_pct': 0.012781267325794918, 'bull_atr_max_pct': 0.026857219336363373, 'bull_tp_mult': 1.5071921995191524, 'bull_tsl_mult': 0.4194030124984578, 'bull_time_stop': 207, 'bull_use_sma': False, 'bull_use_ema': False, 'bull_use_atr': False, 'bull_use_adx': True, 'bull_use_spike': True, 'bull_rsi_required': False, 'bear_strategy': 'breakout', 'bear_bb_std_mult': 3.4098176514744094, 'bear_rsi_os': 43, 'bear_rsi_ob': 81, 'bear_adx_thresh': 19.14766455255689, 'bear_atr_min_pct': 0.01475784509215487, 'bear_atr_max_pct': 0.09339220807176934, 'bear_tp_mult': 1.7371647585637122, 'bear_tsl_mult': 0.2972423907123709, 'bear_time_stop': 31, 'bear_use_sma': True, 'bear_use_ema': False, 'bear_use_atr': True, 'bear_use_adx': True, 'bear_use_spike': False, 'bear_rsi_required': False, 'sideways_strategy': 'breakout', 'sideways_bb_std_mult': 1.32146934380821, 'sideways_rsi_os': 35, 'sideways_rsi_ob': 57, 'sideways_adx_thresh': 31.84674145564391, 'sideways_atr_min_pct': 0.009286816169097756, 'sideways_atr_max_pct': 0.12327178882658729, 'sideways_tp_mult': 1.5504680915064255, 'sideways_tsl_mult': 0.6567314503061855, 'sideways_time_stop': 287, 'sideways_use_sma': True, 'sideways_use_ema': True, 'sideways_use_atr': False, 'sideways_use_adx': True, 'sideways_use_spike': False, 'sideways_rsi_required': False}.
[I 2025-08-30 19:55:24,250] Trial 603 finished with values: [-1000000000.0, 1000000000.0] and parameters: {'p_sma': 36, 'p_std': 25, 'p_atr': 10, 'p_adx': 8, 'rsi_period': 49, 'ema1': 23, 'ema2': 18, 'slip_atr_k': 0.020342539815587972, 'slip_spread_k': 0.4258142781523501, 'spread_hl_frac': 0.004392106980481752, 'bb_std_mult': 2.3012777456168743, 'rsi_os': 37, 'rsi_ob': 57, 'vol_spike': 0.037454682200069526, 'adx_thresh': 18.84611068155943, 'atr_min_pct': 0.022942064816625064, 'atr_max_pct': 0.1444531555241431, 'tp_mult': 2.179571845901399, 'tsl_mult': 0.9387816301822987, 'strategy': 'breakout', 'time_stop': 20, 'use_sma': False, 'use_atr': True, 'use_adx': False, 'use_ema': False, 'use_spike': True, 'rsi_required': True, 'edge_k': 0.10819095849275741, 'edge_cap': 0.2056876188259521, 'bull_strategy': 'mean_reversion', 'bull_bb_std_mult': 3.5008751275608443, 'bull_rsi_os': 48, 'bull_rsi_ob': 57, 'bull_adx_thresh': 12.171078817285295, 'bull_atr_min_pct': 0.02380056456289499, 'bull_atr_max_pct': 0.02629940983883775, 'bull_tp_mult': 2.2384579455249014, 'bull_tsl_mult': 0.9811574307167629, 'bull_time_stop': 206, 'bull_use_sma': True, 'bull_use_ema': False, 'bull_use_atr': False, 'bull_use_adx': True, 'bull_use_spike': True, 'bull_rsi_required': True, 'bear_strategy': 'breakout', 'bear_bb_std_mult': 3.3199582689818308, 'bear_rsi_os': 42, 'bear_rsi_ob': 80, 'bear_adx_thresh': 5.03464229167907, 'bear_atr_min_pct': 0.025625065481010005, 'bear_atr_max_pct': 0.0961630869131406, 'bear_tp_mult': 1.7409768203030687, 'bear_tsl_mult': 0.7865844175774435, 'bear_time_stop': 39, 'bear_use_sma': True, 'bear_use_ema': False, 'bear_use_atr': True, 'bear_use_adx': True, 'bear_use_spike': False, 'bear_rsi_required': False, 'sideways_strategy': 'breakout', 'sideways_bb_std_mult': 2.1230964207491145, 'sideways_rsi_os': 22, 'sideways_rsi_ob': 59, 'sideways_adx_thresh': 20.69591291043891, 'sideways_atr_min_pct': 0.019273743055709308, 'sideways_atr_max_pct': 0.12211349784510704, 'sideways_tp_mult': 1.6005741347375817, 'sideways_tsl_mult': 0.8081273085484741, 'sideways_time_stop': 14, 'sideways_use_sma': True, 'sideways_use_ema': True, 'sideways_use_atr': False, 'sideways_use_adx': False, 'sideways_use_spike': False, 'sideways_rsi_required': False}.
[I 2025-08-30 19:55:24,573] Trial 601 finished with values: [-1000000000.0, 1000000000.0] and parameters: {'p_sma': 24, 'p_std': 16, 'p_atr': 24, 'p_adx': 8, 'rsi_period': 79, 'ema1': 23, 'ema2': 14, 'slip_atr_k': 0.18505917274320757, 'slip_spread_k': 0.4556914925077692, 'spread_hl_frac': 0.016728383843740563, 'bb_std_mult': 1.0575951231801497, 'rsi_os': 45, 'rsi_ob': 51, 'vol_spike': 0.04444416340128572, 'adx_thresh': 9.441761969011118, 'atr_min_pct': 0.022924206977993248, 'atr_max_pct': 0.1363479092379135, 'tp_mult': 2.176799464077054, 'tsl_mult': 0.939674183331194, 'strategy': 'breakout', 'time_stop': 146, 'use_sma': False, 'use_atr': True, 'use_adx': False, 'use_ema': True, 'use_spike': False, 'rsi_required': True, 'edge_k': 0.9771232826619796, 'edge_cap': 0.835862492579296, 'bull_strategy': 'mean_reversion', 'bull_bb_std_mult': 1.7746964569159194, 'bull_rsi_os': 47, 'bull_rsi_ob': 46, 'bull_adx_thresh': 8.969551223255635, 'bull_atr_min_pct': 0.009534492395281199, 'bull_atr_max_pct': 0.03145571120202908, 'bull_tp_mult': 2.2703298032875288, 'bull_tsl_mult': 0.37480056871025846, 'bull_time_stop': 205, 'bull_use_sma': False, 'bull_use_ema': False, 'bull_use_atr': False, 'bull_use_adx': True, 'bull_use_spike': True, 'bull_rsi_required': False, 'bear_strategy': 'breakout', 'bear_bb_std_mult': 3.2960311141731307, 'bear_rsi_os': 43, 'bear_rsi_ob': 77, 'bear_adx_thresh': 10.370811519468111, 'bear_atr_min_pct': 0.006488123461023855, 'bear_atr_max_pct': 0.12822976583177512, 'bear_tp_mult': 1.8582441390167797, 'bear_tsl_mult': 0.4203775040426308, 'bear_time_stop': 33, 'bear_use_sma': True, 'bear_use_ema': False, 'bear_use_atr': True, 'bear_use_adx': True, 'bear_use_spike': False, 'bear_rsi_required': False, 'sideways_strategy': 'breakout', 'sideways_bb_std_mult': 2.2481817800401407, 'sideways_rsi_os': 13, 'sideways_rsi_ob': 61, 'sideways_adx_thresh': 20.592806232530286, 'sideways_atr_min_pct': 0.009209316896884923, 'sideways_atr_max_pct': 0.12683892513194345, 'sideways_tp_mult': 1.7318933605035725, 'sideways_tsl_mult': 0.6652744121135646, 'sideways_time_stop': 53, 'sideways_use_sma': True, 'sideways_use_ema': True, 'sideways_use_atr': False, 'sideways_use_adx': True, 'sideways_use_spike': False, 'sideways_rsi_required': False}.
