[I 2025-08-30 19:15:05,883] Trial 306 finished with values: [-0.046994221411644665, 0.04688885075019861] and parameters: {'p_sma': 39, 'p_std': 31, 'p_atr': 10, 'p_adx': 19, 'rsi_period': 62, 'ema1': 12, 'ema2': 17, 'slip_atr_k': 0.03820228888754176, 'slip_spread_k': 0.8168551857575714, 'spread_hl_frac': 0.02612249221673095, 'bb_std_mult': 2.2146567371917976, 'rsi_os': 26, 'rsi_ob': 86, 'vol_spike': 0.19003729785942997, 'adx_thresh': 17.01425226905817, 'atr_min_pct': 0.024216449334632996, 'atr_max_pct': 0.1435595711201674, 'tp_mult': 2.3370367644270957, 'tsl_mult': 0.11807560481355145, 'strategy': 'breakout', 'time_stop': 5, 'use_sma': False, 'use_atr': True, 'use_adx': False, 'use_ema': False, 'use_spike': True, 'rsi_required': False, 'edge_k': 0.08035752484370529, 'edge_cap': 0.10414410186711504, 'bull_strategy': 'mean_reversion', 'bull_bb_std_mult': 1.837463451829181, 'bull_rsi_os': 49, 'bull_rsi_ob': 73, 'bull_adx_thresh': 24.602280178758534, 'bull_atr_min_pct': 0.022253874968428584, 'bull_atr_max_pct': 0.049833266714669845, 'bull_tp_mult': 2.077394810010785, 'bull_tsl_mult': 0.5368979367734777, 'bull_time_stop': 192, 'bull_use_sma': True, 'bull_use_ema': False, 'bull_use_atr': False, 'bull_use_adx': False, 'bull_use_spike': True, 'bull_rsi_required': True, 'bear_strategy': 'breakout', 'bear_bb_std_mult': 1.2001645665813414, 'bear_rsi_os': 44, 'bear_rsi_ob': 91, 'bear_adx_thresh': 5.696935908994341, 'bear_atr_min_pct': 0.002088704719923142, 'bear_atr_max_pct': 0.06164464401648167, 'bear_tp_mult': 2.0068942947807398, 'bear_tsl_mult': 0.020472182698509145, 'bear_time_stop': 27, 'bear_use_sma': False, 'bear_use_ema': False, 'bear_use_atr': True, 'bear_use_adx': True, 'bear_use_spike': False, 'bear_rsi_required': False, 'sideways_strategy': 'breakout', 'sideways_bb_std_mult': 1.7122960178111561, 'sideways_rsi_os': 13, 'sideways_rsi_ob': 58, 'sideways_adx_thresh': 8.877833195404811, 'sideways_atr_min_pct': 0.023366260092009924, 'sideways_atr_max_pct': 0.11729903207505796, 'sideways_tp_mult': 2.960412983558609, 'sideways_tsl_mult': 0.6511418308932979, 'sideways_time_stop': 269, 'sideways_use_sma': True, 'sideways_use_ema': False, 'sideways_use_atr': False, 'sideways_use_adx': False, 'sideways_use_spike': False, 'sideways_rsi_required': False}.
[I 2025-08-30 19:15:37,566] Trial 307 finished with values: [-0.055676379775097096, 0.05561592866073092] and parameters: {'p_sma': 40, 'p_std': 32, 'p_atr': 10, 'p_adx': 7, 'rsi_period': 53, 'ema1': 15, 'ema2': 17, 'slip_atr_k': 0.24398181295757426, 'slip_spread_k': 0.48782977869890165, 'spread_hl_frac': 0.03075626221095547, 'bb_std_mult': 2.20637315801536, 'rsi_os': 39, 'rsi_ob': 58, 'vol_spike': 0.04902950450113789, 'adx_thresh': 17.10848025623211, 'atr_min_pct': 0.02404345141249639, 'atr_max_pct': 0.09292886917480254, 'tp_mult': 2.2451812991196225, 'tsl_mult': 0.6901276660984964, 'strategy': 'breakout', 'time_stop': 156, 'use_sma': False, 'use_atr': True, 'use_adx': True, 'use_ema': False, 'use_spike': True, 'rsi_required': True, 'edge_k': 0.8634956082301162, 'edge_cap': 0.6386115651330384, 'bull_strategy': 'mean_reversion', 'bull_bb_std_mult': 1.828389645106647, 'bull_rsi_os': 49, 'bull_rsi_ob': 74, 'bull_adx_thresh': 24.449216531732077, 'bull_atr_min_pct': 0.0024624765829247266, 'bull_atr_max_pct': 0.049735088459493364, 'bull_tp_mult': 2.9007444306911125, 'bull_tsl_mult': 0.9707487886745325, 'bull_time_stop': 191, 'bull_use_sma': True, 'bull_use_ema': False, 'bull_use_atr': True, 'bull_use_adx': False, 'bull_use_spike': False, 'bull_rsi_required': True, 'bear_strategy': 'breakout', 'bear_bb_std_mult': 3.3548445317297473, 'bear_rsi_os': 44, 'bear_rsi_ob': 91, 'bear_adx_thresh': 5.530650580058517, 'bear_atr_min_pct': 0.004026463356623095, 'bear_atr_max_pct': 0.05818988105643682, 'bear_tp_mult': 1.7641403662324142, 'bear_tsl_mult': 0.12262305173505672, 'bear_time_stop': 185, 'bear_use_sma': True, 'bear_use_ema': False, 'bear_use_atr': True, 'bear_use_adx': True, 'bear_use_spike': False, 'bear_rsi_required': False, 'sideways_strategy': 'breakout', 'sideways_bb_std_mult': 1.7170511540427618, 'sideways_rsi_os': 23, 'sideways_rsi_ob': 45, 'sideways_adx_thresh': 11.066208403993913, 'sideways_atr_min_pct': 0.02630074889249051, 'sideways_atr_max_pct': 0.11896880534978871, 'sideways_tp_mult': 1.8952001260637006, 'sideways_tsl_mult': 0.10894258196803158, 'sideways_time_stop': 270, 'sideways_use_sma': True, 'sideways_use_ema': False, 'sideways_use_atr': False, 'sideways_use_adx': False, 'sideways_use_spike': False, 'sideways_rsi_required': False}.
[I 2025-08-30 19:15:38,748] Trial 310 finished with values: [-1000000000.0, 1000000000.0] and parameters: {'p_sma': 41, 'p_std': 33, 'p_atr': 10, 'p_adx': 17, 'rsi_period': 55, 'ema1': 28, 'ema2': 16, 'slip_atr_k': 0.0803053293916152, 'slip_spread_k': 0.4879692506675122, 'spread_hl_frac': 0.004262234429370241, 'bb_std_mult': 1.2455564022823449, 'rsi_os': 35, 'rsi_ob': 58, 'vol_spike': 0.046116638808001424, 'adx_thresh': 30.015141984878618, 'atr_min_pct': 0.023533246207166913, 'atr_max_pct': 0.13897294618034675, 'tp_mult': 2.1788405426651094, 'tsl_mult': 0.6423784047101978, 'strategy': 'breakout', 'time_stop': 233, 'use_sma': False, 'use_atr': True, 'use_adx': False, 'use_ema': True, 'use_spike': False, 'rsi_required': True, 'edge_k': 0.8478623245011148, 'edge_cap': 0.9188560874373413, 'bull_strategy': 'mean_reversion', 'bull_bb_std_mult': 1.7600634310269792, 'bull_rsi_os': 53, 'bull_rsi_ob': 72, 'bull_adx_thresh': 10.412629107132405, 'bull_atr_min_pct': 0.0031714586239769906, 'bull_atr_max_pct': 0.02004588869634902, 'bull_tp_mult': 2.984929712343209, 'bull_tsl_mult': 0.30075635602145223, 'bull_time_stop': 237, 'bull_use_sma': False, 'bull_use_ema': True, 'bull_use_atr': True, 'bull_use_adx': True, 'bull_use_spike': False, 'bull_rsi_required': False, 'bear_strategy': 'breakout', 'bear_bb_std_mult': 3.3358503261633325, 'bear_rsi_os': 43, 'bear_rsi_ob': 84, 'bear_adx_thresh': 5.006640523708722, 'bear_atr_min_pct': 0.027180264961105354, 'bear_atr_max_pct': 0.0584538487948144, 'bear_tp_mult': 1.6147082896523686, 'bear_tsl_mult': 0.14305017703772616, 'bear_time_stop': 81, 'bear_use_sma': True, 'bear_use_ema': True, 'bear_use_atr': True, 'bear_use_adx': True, 'bear_use_spike': True, 'bear_rsi_required': False, 'sideways_strategy': 'breakout', 'sideways_bb_std_mult': 1.8065153827716707, 'sideways_rsi_os': 15, 'sideways_rsi_ob': 60, 'sideways_adx_thresh': 16.53242130815633, 'sideways_atr_min_pct': 0.018852883634354042, 'sideways_atr_max_pct': 0.037751770278196616, 'sideways_tp_mult': 1.8871465376227272, 'sideways_tsl_mult': 0.6961181018412789, 'sideways_time_stop': 270, 'sideways_use_sma': False, 'sideways_use_ema': True, 'sideways_use_atr': False, 'sideways_use_adx': True, 'sideways_use_spike': False, 'sideways_rsi_required': True}.
[I 2025-08-30 19:15:38,981] Trial 309 finished with values: [-1000000000.0, 1000000000.0] and parameters: {'p_sma': 40, 'p_std': 18, 'p_atr': 25, 'p_adx': 7, 'rsi_period': 53, 'ema1': 6, 'ema2': 17, 'slip_atr_k': 0.03856127917605624, 'slip_spread_k': 0.8994484476402438, 'spread_hl_frac': 0.004301044310599409, 'bb_std_mult': 1.2801449589880156, 'rsi_os': 39, 'rsi_ob': 82, 'vol_spike': 0.04695759492000365, 'adx_thresh': 23.25917688230065, 'atr_min_pct': 0.021854675208713144, 'atr_max_pct': 0.13777990558714032, 'tp_mult': 2.902503917503807, 'tsl_mult': 0.6490771648137006, 'strategy': 'breakout', 'time_stop': 165, 'use_sma': False, 'use_atr': True, 'use_adx': False, 'use_ema': False, 'use_spike': False, 'rsi_required': True, 'edge_k': 0.8539175438360107, 'edge_cap': 0.7952014157091198, 'bull_strategy': 'mean_reversion', 'bull_bb_std_mult': 1.7523932843253458, 'bull_rsi_os': 49, 'bull_rsi_ob': 60, 'bull_adx_thresh': 27.642890943213917, 'bull_atr_min_pct': 0.0030141775118511776, 'bull_atr_max_pct': 0.04907954070299288, 'bull_tp_mult': 1.061359471245527, 'bull_tsl_mult': 0.9557998217778287, 'bull_time_stop': 184, 'bull_use_sma': True, 'bull_use_ema': True, 'bull_use_atr': True, 'bull_use_adx': True, 'bull_use_spike': False, 'bull_rsi_required': True, 'bear_strategy': 'breakout', 'bear_bb_std_mult': 3.335316954649677, 'bear_rsi_os': 43, 'bear_rsi_ob': 69, 'bear_adx_thresh': 5.056217514664323, 'bear_atr_min_pct': 0.027429579389681557, 'bear_atr_max_pct': 0.058685017732392514, 'bear_tp_mult': 1.843459914272561, 'bear_tsl_mult': 0.794373752372074, 'bear_time_stop': 47, 'bear_use_sma': True, 'bear_use_ema': True, 'bear_use_atr': True, 'bear_use_adx': True, 'bear_use_spike': True, 'bear_rsi_required': False, 'sideways_strategy': 'breakout', 'sideways_bb_std_mult': 1.885436618069214, 'sideways_rsi_os': 52, 'sideways_rsi_ob': 94, 'sideways_adx_thresh': 9.489243101342975, 'sideways_atr_min_pct': 0.02619906603348763, 'sideways_atr_max_pct': 0.11535899802088219, 'sideways_tp_mult': 1.9114749114796303, 'sideways_tsl_mult': 0.5989665107105397, 'sideways_time_stop': 270, 'sideways_use_sma': False, 'sideways_use_ema': True, 'sideways_use_atr': False, 'sideways_use_adx': False, 'sideways_use_spike': False, 'sideways_rsi_required': False}.
[I 2025-08-30 19:15:38,981] Trial 308 finished with values: [-1000000000.0, 1000000000.0] and parameters: {'p_sma': 11, 'p_std': 33, 'p_atr': 10, 'p_adx': 7, 'rsi_period': 53, 'ema1': 15, 'ema2': 17, 'slip_atr_k': 0.16450686017304592, 'slip_spread_k': 0.3604840911833854, 'spread_hl_frac': 0.02561350857809401, 'bb_std_mult': 1.8327680313983856, 'rsi_os': 39, 'rsi_ob': 58, 'vol_spike': 0.2646855774165152, 'adx_thresh': 18.19846366949116, 'atr_min_pct': 0.023981041696595855, 'atr_max_pct': 0.13435947983576493, 'tp_mult': 1.7323149971690897, 'tsl_mult': 0.6844402883851428, 'strategy': 'breakout', 'time_stop': 45, 'use_sma': False, 'use_atr': True, 'use_adx': False, 'use_ema': False, 'use_spike': False, 'rsi_required': True, 'edge_k': 0.22395721048113468, 'edge_cap': 0.11262820532052265, 'bull_strategy': 'mean_reversion', 'bull_bb_std_mult': 1.8513639171218517, 'bull_rsi_os': 47, 'bull_rsi_ob': 52, 'bull_adx_thresh': 24.48549259511736, 'bull_atr_min_pct': 0.0032274719475281883, 'bull_atr_max_pct': 0.023388939636150734, 'bull_tp_mult': 1.2115843086484825, 'bull_tsl_mult': 0.9630828350908245, 'bull_time_stop': 189, 'bull_use_sma': True, 'bull_use_ema': False, 'bull_use_atr': True, 'bull_use_adx': True, 'bull_use_spike': False, 'bull_rsi_required': True, 'bear_strategy': 'breakout', 'bear_bb_std_mult': 2.924888520091487, 'bear_rsi_os': 43, 'bear_rsi_ob': 75, 'bear_adx_thresh': 5.514558109948342, 'bear_atr_min_pct': 0.024355873445676114, 'bear_atr_max_pct': 0.01811391422961843, 'bear_tp_mult': 1.7844231878282788, 'bear_tsl_mult': 0.17820043350974468, 'bear_time_stop': 46, 'bear_use_sma': True, 'bear_use_ema': False, 'bear_use_atr': True, 'bear_use_adx': True, 'bear_use_spike': False, 'bear_rsi_required': False, 'sideways_strategy': 'breakout', 'sideways_bb_std_mult': 0.9257489791378808, 'sideways_rsi_os': 52, 'sideways_rsi_ob': 59, 'sideways_adx_thresh': 10.88486023193834, 'sideways_atr_min_pct': 0.025248540093129615, 'sideways_atr_max_pct': 0.11488418007113292, 'sideways_tp_mult': 1.8864172438319546, 'sideways_tsl_mult': 0.6932683481348076, 'sideways_time_stop': 22, 'sideways_use_sma': True, 'sideways_use_ema': True, 'sideways_use_atr': False, 'sideways_use_adx': False, 'sideways_use_spike': False, 'sideways_rsi_required': False}.
[I 2025-08-30 19:15:39,731] Trial 314 finished with values: [-1000000000.0, 1000000000.0] and parameters: {'p_sma': 43, 'p_std': 30, 'p_atr': 16, 'p_adx': 30, 'rsi_period': 50, 'ema1': 23, 'ema2': 16, 'slip_atr_k': 0.025808397629447255, 'slip_spread_k': 0.20614896373946778, 'spread_hl_frac': 0.0030064514316900832, 'bb_std_mult': 0.9653441563016478, 'rsi_os': 52, 'rsi_ob': 55, 'vol_spike': 0.20473308084497488, 'adx_thresh': 19.299422383051656, 'atr_min_pct': 0.02539027594726624, 'atr_max_pct': 0.14924319635165786, 'tp_mult': 2.9899778021439394, 'tsl_mult': 0.9626901988654915, 'strategy': 'mean_reversion', 'time_stop': 30, 'use_sma': True, 'use_atr': False, 'use_adx': False, 'use_ema': True, 'use_spike': True, 'rsi_required': True, 'edge_k': 1.6487815684123255, 'edge_cap': 0.23906880532248279, 'bull_strategy': 'breakout', 'bull_bb_std_mult': 1.2465386961902962, 'bull_rsi_os': 51, 'bull_rsi_ob': 45, 'bull_adx_thresh': 20.139725261915586, 'bull_atr_min_pct': 0.0008297830776060533, 'bull_atr_max_pct': 0.0424197664471459, 'bull_tp_mult': 2.215758192132045, 'bull_tsl_mult': 0.3411370913196059, 'bull_time_stop': 207, 'bull_use_sma': False, 'bull_use_ema': False, 'bull_use_atr': False, 'bull_use_adx': True, 'bull_use_spike': True, 'bull_rsi_required': False, 'bear_strategy': 'breakout', 'bear_bb_std_mult': 0.7039195109377627, 'bear_rsi_os': 45, 'bear_rsi_ob': 87, 'bear_adx_thresh': 6.255023926379401, 'bear_atr_min_pct': 0.01060984200890599, 'bear_atr_max_pct': 0.03105383412631043, 'bear_tp_mult': 1.7213381959839993, 'bear_tsl_mult': 0.060212690516637433, 'bear_time_stop': 56, 'bear_use_sma': True, 'bear_use_ema': False, 'bear_use_atr': False, 'bear_use_adx': False, 'bear_use_spike': False, 'bear_rsi_required': True, 'sideways_strategy': 'mean_reversion', 'sideways_bb_std_mult': 2.0548293683732886, 'sideways_rsi_os': 18, 'sideways_rsi_ob': 51, 'sideways_adx_thresh': 9.802565569789538, 'sideways_atr_min_pct': 0.019836531811122375, 'sideways_atr_max_pct': 0.1274470398791874, 'sideways_tp_mult': 1.782397665092953, 'sideways_tsl_mult': 0.4429806238139705, 'sideways_time_stop': 243, 'sideways_use_sma': True, 'sideways_use_ema': True, 'sideways_use_atr': False, 'sideways_use_adx': True, 'sideways_use_spike': True, 'sideways_rsi_required': True}.
[I 2025-08-30 19:16:13,463] Trial 311 finished with values: [-1000000000.0, 1000000000.0] and parameters: {'p_sma': 41, 'p_std': 34, 'p_atr': 10, 'p_adx': 8, 'rsi_period': 39, 'ema1': 23, 'ema2': 16, 'slip_atr_k': 0.11687288371476981, 'slip_spread_k': 0.35646635929240617, 'spread_hl_frac': 0.004537049055921688, 'bb_std_mult': 1.7994113260261295, 'rsi_os': 52, 'rsi_ob': 55, 'vol_spike': 0.15265000091607384, 'adx_thresh': 14.448028454213102, 'atr_min_pct': 0.023271485011821018, 'atr_max_pct': 0.1489916161493421, 'tp_mult': 1.8665138341744347, 'tsl_mult': 0.7321125082130531, 'strategy': 'breakout', 'time_stop': 46, 'use_sma': True, 'use_atr': True, 'use_adx': False, 'use_ema': True, 'use_spike': False, 'rsi_required': True, 'edge_k': 0.4248795667403361, 'edge_cap': 0.9063771916675455, 'bull_strategy': 'mean_reversion', 'bull_bb_std_mult': 1.757418730834541, 'bull_rsi_os': 53, 'bull_rsi_ob': 72, 'bull_adx_thresh': 26.343143054874684, 'bull_atr_min_pct': 0.0008018864839906431, 'bull_atr_max_pct': 0.1461894593638473, 'bull_tp_mult': 1.213862480698608, 'bull_tsl_mult': 0.34261599618497907, 'bull_time_stop': 184, 'bull_use_sma': False, 'bull_use_ema': True, 'bull_use_atr': True, 'bull_use_adx': True, 'bull_use_spike': False, 'bull_rsi_required': False, 'bear_strategy': 'breakout', 'bear_bb_std_mult': 3.3087607725425063, 'bear_rsi_os': 43, 'bear_rsi_ob': 69, 'bear_adx_thresh': 5.13928235310966, 'bear_atr_min_pct': 0.010516471688153851, 'bear_atr_max_pct': 0.06551660101904767, 'bear_tp_mult': 2.1590222844081275, 'bear_tsl_mult': 0.14587294154259897, 'bear_time_stop': 44, 'bear_use_sma': True, 'bear_use_ema': True, 'bear_use_atr': True, 'bear_use_adx': True, 'bear_use_spike': True, 'bear_rsi_required': False, 'sideways_strategy': 'breakout', 'sideways_bb_std_mult': 2.450574384340257, 'sideways_rsi_os': 15, 'sideways_rsi_ob': 51, 'sideways_adx_thresh': 10.028135651807059, 'sideways_atr_min_pct': 0.025495882556913003, 'sideways_atr_max_pct': 0.12701551458191004, 'sideways_tp_mult': 1.792314493963885, 'sideways_tsl_mult': 0.7014525414077434, 'sideways_time_stop': 129, 'sideways_use_sma': False, 'sideways_use_ema': True, 'sideways_use_atr': False, 'sideways_use_adx': True, 'sideways_use_spike': True, 'sideways_rsi_required': True}.
[I 2025-08-30 19:16:13,947] Trial 313 finished with values: [-0.016815766436376722, 0.016838620075063787] and parameters: {'p_sma': 53, 'p_std': 19, 'p_atr': 16, 'p_adx': 8, 'rsi_period': 73, 'ema1': 23, 'ema2': 16, 'slip_atr_k': 0.01660833401948952, 'slip_spread_k': 0.4473502252720826, 'spread_hl_frac': 0.007186748111604531, 'bb_std_mult': 0.9788013594994704, 'rsi_os': 20, 'rsi_ob': 93, 'vol_spike': 0.15308918196465535, 'adx_thresh': 7.925558620957247, 'atr_min_pct': 0.008679868999238772, 'atr_max_pct': 0.129754938559692, 'tp_mult': 2.019971568490605, 'tsl_mult': 0.9580035014392256, 'strategy': 'mean_reversion', 'time_stop': 243, 'use_sma': True, 'use_atr': False, 'use_adx': False, 'use_ema': True, 'use_spike': True, 'rsi_required': True, 'edge_k': 1.9962037738431695, 'edge_cap': 0.44525709496554244, 'bull_strategy': 'breakout', 'bull_bb_std_mult': 2.04462964644491, 'bull_rsi_os': 18, 'bull_rsi_ob': 45, 'bull_adx_thresh': 26.222989577572434, 'bull_atr_min_pct': 0.0007966954199913078, 'bull_atr_max_pct': 0.036201156478021634, 'bull_tp_mult': 2.216974567255468, 'bull_tsl_mult': 0.07304674941209482, 'bull_time_stop': 110, 'bull_use_sma': False, 'bull_use_ema': False, 'bull_use_atr': False, 'bull_use_adx': True, 'bull_use_spike': True, 'bull_rsi_required': False, 'bear_strategy': 'breakout', 'bear_bb_std_mult': 0.6597814452772599, 'bear_rsi_os': 45, 'bear_rsi_ob': 82, 'bear_adx_thresh': 6.232898748251166, 'bear_atr_min_pct': 0.010371722571741883, 'bear_atr_max_pct': 0.0675263794459005, 'bear_tp_mult': 1.9527935240802214, 'bear_tsl_mult': 0.05293287907332961, 'bear_time_stop': 242, 'bear_use_sma': True, 'bear_use_ema': False, 'bear_use_atr': False, 'bear_use_adx': False, 'bear_use_spike': False, 'bear_rsi_required': True, 'sideways_strategy': 'mean_reversion', 'sideways_bb_std_mult': 2.549846380099665, 'sideways_rsi_os': 31, 'sideways_rsi_ob': 59, 'sideways_adx_thresh': 10.066631743918398, 'sideways_atr_min_pct': 0.018064798533077374, 'sideways_atr_max_pct': 0.1216683597099266, 'sideways_tp_mult': 1.614663538585932, 'sideways_tsl_mult': 0.6691499332912766, 'sideways_time_stop': 264, 'sideways_use_sma': True, 'sideways_use_ema': True, 'sideways_use_atr': False, 'sideways_use_adx': True, 'sideways_use_spike': True, 'sideways_rsi_required': True}.
[I 2025-08-30 19:16:14,391] Trial 312 finished with values: [-1000000000.0, 1000000000.0] and parameters: {'p_sma': 8, 'p_std': 19, 'p_atr': 24, 'p_adx': 30, 'rsi_period': 50, 'ema1': 23, 'ema2': 16, 'slip_atr_k': 0.023684935966542205, 'slip_spread_k': 0.3572690267512517, 'spread_hl_frac': 0.002943723058578406, 'bb_std_mult': 0.6321867372811474, 'rsi_os': 20, 'rsi_ob': 82, 'vol_spike': 0.012870004113500127, 'adx_thresh': 23.376315457330122, 'atr_min_pct': 0.01825742908178197, 'atr_max_pct': 0.11445423419637948, 'tp_mult': 1.5369301409058829, 'tsl_mult': 0.7309811363649708, 'strategy': 'breakout', 'time_stop': 44, 'use_sma': True, 'use_atr': False, 'use_adx': False, 'use_ema': False, 'use_spike': False, 'rsi_required': True, 'edge_k': 1.997062135732508, 'edge_cap': 0.24281127756030962, 'bull_strategy': 'breakout', 'bull_bb_std_mult': 2.064415222426301, 'bull_rsi_os': 32, 'bull_rsi_ob': 45, 'bull_adx_thresh': 26.34673369913858, 'bull_atr_min_pct': 0.003108961681052906, 'bull_atr_max_pct': 0.023715977292018083, 'bull_tp_mult': 1.2075392173439239, 'bull_tsl_mult': 0.26337606339281605, 'bull_time_stop': 110, 'bull_use_sma': True, 'bull_use_ema': False, 'bull_use_atr': False, 'bull_use_adx': True, 'bull_use_spike': True, 'bull_rsi_required': True, 'bear_strategy': 'breakout', 'bear_bb_std_mult': 3.1262555944525436, 'bear_rsi_os': 43, 'bear_rsi_ob': 68, 'bear_adx_thresh': 5.962070964134233, 'bear_atr_min_pct': 0.019330176334462323, 'bear_atr_max_pct': 0.05542770012061025, 'bear_tp_mult': 1.8521684887859604, 'bear_tsl_mult': 0.7826389954535291, 'bear_time_stop': 45, 'bear_use_sma': True, 'bear_use_ema': True, 'bear_use_atr': False, 'bear_use_adx': False, 'bear_use_spike': False, 'bear_rsi_required': True, 'sideways_strategy': 'mean_reversion', 'sideways_bb_std_mult': 0.8931668162142881, 'sideways_rsi_os': 55, 'sideways_rsi_ob': 67, 'sideways_adx_thresh': 9.739156787632306, 'sideways_atr_min_pct': 0.024199431842486404, 'sideways_atr_max_pct': 0.12787120530757914, 'sideways_tp_mult': 1.7875178779867587, 'sideways_tsl_mult': 0.60791041522513, 'sideways_time_stop': 187, 'sideways_use_sma': True, 'sideways_use_ema': True, 'sideways_use_atr': False, 'sideways_use_adx': False, 'sideways_use_spike': True, 'sideways_rsi_required': False}.
