[I 2025-08-30 19:05:18,355] Trial 233 finished with values: [-1000000000.0, 1000000000.0] and parameters: {'p_sma': 43, 'p_std': 23, 'p_atr': 11, 'p_adx': 8, 'rsi_period': 47, 'ema1': 23, 'ema2': 16, 'slip_atr_k': 0.017868081353594203, 'slip_spread_k': 0.41455912556113655, 'spread_hl_frac': 0.00101215705562566, 'bb_std_mult': 0.943067926606362, 'rsi_os': 38, 'rsi_ob': 56, 'vol_spike': 0.20985532924162534, 'adx_thresh': 34.81690086601863, 'atr_min_pct': 0.015741093392955596, 'atr_max_pct': 0.042759494211284436, 'tp_mult': 2.2211205811284915, 'tsl_mult': 0.4176319070762647, 'strategy': 'mean_reversion', 'time_stop': 71, 'use_sma': True, 'use_atr': True, 'use_adx': False, 'use_ema': True, 'use_spike': False, 'rsi_required': False, 'edge_k': 0.09665001521193833, 'edge_cap': 0.3774817338243017, 'bull_strategy': 'mean_reversion', 'bull_bb_std_mult': 2.018301114135075, 'bull_rsi_os': 52, 'bull_rsi_ob': 46, 'bull_adx_thresh': 27.064864980170775, 'bull_atr_min_pct': 0.0028443443510857086, 'bull_atr_max_pct': 0.07972505070773307, 'bull_tp_mult': 2.4118221332671506, 'bull_tsl_mult': 0.15400172353763342, 'bull_time_stop': 5, 'bull_use_sma': True, 'bull_use_ema': False, 'bull_use_atr': True, 'bull_use_adx': True, 'bull_use_spike': False, 'bull_rsi_required': True, 'bear_strategy': 'mean_reversion', 'bear_bb_std_mult': 2.6559060029537087, 'bear_rsi_os': 40, 'bear_rsi_ob': 87, 'bear_adx_thresh': 32.275398525554436, 'bear_atr_min_pct': 0.017466150066909276, 'bear_atr_max_pct': 0.05826790623783665, 'bear_tp_mult': 1.6884923308264395, 'bear_tsl_mult': 0.9755874869251193, 'bear_time_stop': 234, 'bear_use_sma': False, 'bear_use_ema': True, 'bear_use_atr': True, 'bear_use_adx': True, 'bear_use_spike': False, 'bear_rsi_required': False, 'sideways_strategy': 'breakout', 'sideways_bb_std_mult': 2.5294432261124484, 'sideways_rsi_os': 16, 'sideways_rsi_ob': 87, 'sideways_adx_thresh': 29.78457697880484, 'sideways_atr_min_pct': 0.017987325161182042, 'sideways_atr_max_pct': 0.11846623924596514, 'sideways_tp_mult': 2.7200079735833347, 'sideways_tsl_mult': 0.1272195726740133, 'sideways_time_stop': 16, 'sideways_use_sma': False, 'sideways_use_ema': False, 'sideways_use_atr': False, 'sideways_use_adx': False, 'sideways_use_spike': False, 'sideways_rsi_required': True}.
[I 2025-08-30 19:05:19,288] Trial 235 finished with values: [-0.02590492262289734, 0.02583409351945965] and parameters: {'p_sma': 57, 'p_std': 22, 'p_atr': 9, 'p_adx': 12, 'rsi_period': 84, 'ema1': 23, 'ema2': 15, 'slip_atr_k': 0.019928720133735832, 'slip_spread_k': 0.9455453697115588, 'spread_hl_frac': 0.004847461368992327, 'bb_std_mult': 0.9415437511764415, 'rsi_os': 38, 'rsi_ob': 66, 'vol_spike': 0.2109324685608295, 'adx_thresh': 19.19976098402489, 'atr_min_pct': 0.02876241490443244, 'atr_max_pct': 0.13289287338461775, 'tp_mult': 2.2225875017296604, 'tsl_mult': 0.1488334879098051, 'strategy': 'breakout', 'time_stop': 261, 'use_sma': False, 'use_atr': True, 'use_adx': False, 'use_ema': False, 'use_spike': False, 'rsi_required': True, 'edge_k': 0.05536295371237336, 'edge_cap': 0.23634616302339373, 'bull_strategy': 'mean_reversion', 'bull_bb_std_mult': 1.9450197528998705, 'bull_rsi_os': 48, 'bull_rsi_ob': 65, 'bull_adx_thresh': 26.902600420027476, 'bull_atr_min_pct': 0.002113309476323931, 'bull_atr_max_pct': 0.06910999008436124, 'bull_tp_mult': 2.4105976225652244, 'bull_tsl_mult': 0.36811950896357365, 'bull_time_stop': 26, 'bull_use_sma': True, 'bull_use_ema': False, 'bull_use_atr': False, 'bull_use_adx': True, 'bull_use_spike': True, 'bull_rsi_required': True, 'bear_strategy': 'mean_reversion', 'bear_bb_std_mult': 2.636337794593619, 'bear_rsi_os': 31, 'bear_rsi_ob': 81, 'bear_adx_thresh': 14.787589702226366, 'bear_atr_min_pct': 0.013748488207628305, 'bear_atr_max_pct': 0.1467828644261618, 'bear_tp_mult': 2.097063459815976, 'bear_tsl_mult': 0.26044488069290345, 'bear_time_stop': 39, 'bear_use_sma': False, 'bear_use_ema': False, 'bear_use_atr': True, 'bear_use_adx': True, 'bear_use_spike': False, 'bear_rsi_required': True, 'sideways_strategy': 'breakout', 'sideways_bb_std_mult': 1.9892896966312095, 'sideways_rsi_os': 34, 'sideways_rsi_ob': 59, 'sideways_adx_thresh': 28.699523809371836, 'sideways_atr_min_pct': 0.010610518564246382, 'sideways_atr_max_pct': 0.1170624319478107, 'sideways_tp_mult': 1.7388676876404696, 'sideways_tsl_mult': 0.6451797146796526, 'sideways_time_stop': 266, 'sideways_use_sma': True, 'sideways_use_ema': False, 'sideways_use_atr': False, 'sideways_use_adx': False, 'sideways_use_spike': False, 'sideways_rsi_required': False}.
[I 2025-08-30 19:05:55,231] Trial 236 finished with values: [-1000000000.0, 1000000000.0] and parameters: {'p_sma': 41, 'p_std': 31, 'p_atr': 9, 'p_adx': 28, 'rsi_period': 34, 'ema1': 23, 'ema2': 15, 'slip_atr_k': 0.019903082932007744, 'slip_spread_k': 0.7976053886338693, 'spread_hl_frac': 0.004955215623974285, 'bb_std_mult': 0.9274586459857737, 'rsi_os': 38, 'rsi_ob': 61, 'vol_spike': 0.11057948918866797, 'adx_thresh': 18.97746395671405, 'atr_min_pct': 0.02438766137885589, 'atr_max_pct': 0.1329308503307812, 'tp_mult': 2.2241559786310225, 'tsl_mult': 0.04129590348781381, 'strategy': 'breakout', 'time_stop': 29, 'use_sma': False, 'use_atr': True, 'use_adx': False, 'use_ema': False, 'use_spike': True, 'rsi_required': True, 'edge_k': 1.1607807520478353, 'edge_cap': 0.24490982716594387, 'bull_strategy': 'mean_reversion', 'bull_bb_std_mult': 1.9553456664214433, 'bull_rsi_os': 33, 'bull_rsi_ob': 73, 'bull_adx_thresh': 27.02907367182304, 'bull_atr_min_pct': 0.001954233029701052, 'bull_atr_max_pct': 0.10956359690718166, 'bull_tp_mult': 2.165013442321354, 'bull_tsl_mult': 0.9984302932797855, 'bull_time_stop': 27, 'bull_use_sma': True, 'bull_use_ema': False, 'bull_use_atr': False, 'bull_use_adx': True, 'bull_use_spike': True, 'bull_rsi_required': True, 'bear_strategy': 'mean_reversion', 'bear_bb_std_mult': 3.3482609656190263, 'bear_rsi_os': 43, 'bear_rsi_ob': 72, 'bear_adx_thresh': 9.063608219741813, 'bear_atr_min_pct': 0.01597498692044059, 'bear_atr_max_pct': 0.06056713667869467, 'bear_tp_mult': 2.0962989937424186, 'bear_tsl_mult': 0.5211647460315656, 'bear_time_stop': 38, 'bear_use_sma': True, 'bear_use_ema': False, 'bear_use_atr': True, 'bear_use_adx': True, 'bear_use_spike': False, 'bear_rsi_required': True, 'sideways_strategy': 'breakout', 'sideways_bb_std_mult': 1.9716972932696974, 'sideways_rsi_os': 16, 'sideways_rsi_ob': 59, 'sideways_adx_thresh': 5.899468046487691, 'sideways_atr_min_pct': 0.008086101020916767, 'sideways_atr_max_pct': 0.08557813817144998, 'sideways_tp_mult': 1.754381364914708, 'sideways_tsl_mult': 0.1462513193390736, 'sideways_time_stop': 268, 'sideways_use_sma': True, 'sideways_use_ema': True, 'sideways_use_atr': False, 'sideways_use_adx': False, 'sideways_use_spike': False, 'sideways_rsi_required': True}.
[I 2025-08-30 19:05:55,634] Trial 237 finished with values: [-0.024993182159347094, 0.024916529437053317] and parameters: {'p_sma': 58, 'p_std': 21, 'p_atr': 14, 'p_adx': 23, 'rsi_period': 78, 'ema1': 24, 'ema2': 15, 'slip_atr_k': 0.020565524173205497, 'slip_spread_k': 0.47000601494425875, 'spread_hl_frac': 0.005121014313883876, 'bb_std_mult': 2.7808247843468736, 'rsi_os': 38, 'rsi_ob': 60, 'vol_spike': 0.1126070290231678, 'adx_thresh': 19.020184579904473, 'atr_min_pct': 0.015674585809641043, 'atr_max_pct': 0.1336528584845958, 'tp_mult': 1.0832413420146303, 'tsl_mult': 0.022591878122386888, 'strategy': 'breakout', 'time_stop': 261, 'use_sma': False, 'use_atr': True, 'use_adx': False, 'use_ema': False, 'use_spike': True, 'rsi_required': True, 'edge_k': 0.16114428598881295, 'edge_cap': 0.9418296995269495, 'bull_strategy': 'mean_reversion', 'bull_bb_std_mult': 1.9935470274244667, 'bull_rsi_os': 51, 'bull_rsi_ob': 65, 'bull_adx_thresh': 27.038764767251806, 'bull_atr_min_pct': 0.0017844936688962477, 'bull_atr_max_pct': 0.029565885538578328, 'bull_tp_mult': 1.1623900725479284, 'bull_tsl_mult': 0.9316978729609806, 'bull_time_stop': 176, 'bull_use_sma': True, 'bull_use_ema': False, 'bull_use_atr': False, 'bull_use_adx': True, 'bull_use_spike': True, 'bull_rsi_required': True, 'bear_strategy': 'mean_reversion', 'bear_bb_std_mult': 1.04254200225226, 'bear_rsi_os': 14, 'bear_rsi_ob': 93, 'bear_adx_thresh': 14.572333186000765, 'bear_atr_min_pct': 0.01596310471608468, 'bear_atr_max_pct': 0.05495945016801064, 'bear_tp_mult': 1.686878709923764, 'bear_tsl_mult': 0.9688353314954113, 'bear_time_stop': 35, 'bear_use_sma': True, 'bear_use_ema': False, 'bear_use_atr': True, 'bear_use_adx': True, 'bear_use_spike': True, 'bear_rsi_required': True, 'sideways_strategy': 'breakout', 'sideways_bb_std_mult': 2.0810930637705063, 'sideways_rsi_os': 17, 'sideways_rsi_ob': 56, 'sideways_adx_thresh': 28.819588943787377, 'sideways_atr_min_pct': 0.0203821160026242, 'sideways_atr_max_pct': 0.04389398892953399, 'sideways_tp_mult': 1.3576397519371743, 'sideways_tsl_mult': 0.12953336156692224, 'sideways_time_stop': 67, 'sideways_use_sma': True, 'sideways_use_ema': True, 'sideways_use_atr': True, 'sideways_use_adx': False, 'sideways_use_spike': False, 'sideways_rsi_required': False}.
[I 2025-08-30 19:05:56,245] Trial 238 finished with values: [-0.026168105817739873, 0.026099254611352252] and parameters: {'p_sma': 39, 'p_std': 21, 'p_atr': 9, 'p_adx': 7, 'rsi_period': 65, 'ema1': 25, 'ema2': 20, 'slip_atr_k': 0.020771614375897675, 'slip_spread_k': 0.5689442648441377, 'spread_hl_frac': 0.005053760752231783, 'bb_std_mult': 2.798255229577186, 'rsi_os': 36, 'rsi_ob': 60, 'vol_spike': 0.11243721956188474, 'adx_thresh': 19.076886145972377, 'atr_min_pct': 0.02345848719646453, 'atr_max_pct': 0.13291963828153577, 'tp_mult': 1.094278631415571, 'tsl_mult': 0.6893824108599026, 'strategy': 'breakout', 'time_stop': 261, 'use_sma': False, 'use_atr': True, 'use_adx': True, 'use_ema': False, 'use_spike': True, 'rsi_required': True, 'edge_k': 1.4989279563354125, 'edge_cap': 0.24923392696893518, 'bull_strategy': 'mean_reversion', 'bull_bb_std_mult': 1.7430577694465752, 'bull_rsi_os': 50, 'bull_rsi_ob': 73, 'bull_adx_thresh': 7.913364435304171, 'bull_atr_min_pct': 0.0015760525831755266, 'bull_atr_max_pct': 0.10986545282916281, 'bull_tp_mult': 2.1085438974088717, 'bull_tsl_mult': 0.977877085614588, 'bull_time_stop': 182, 'bull_use_sma': True, 'bull_use_ema': False, 'bull_use_atr': False, 'bull_use_adx': True, 'bull_use_spike': True, 'bull_rsi_required': True, 'bear_strategy': 'breakout', 'bear_bb_std_mult': 1.056322467849541, 'bear_rsi_os': 15, 'bear_rsi_ob': 72, 'bear_adx_thresh': 14.41213549869513, 'bear_atr_min_pct': 0.016086347447404274, 'bear_atr_max_pct': 0.1415966407380092, 'bear_tp_mult': 1.8216646876288172, 'bear_tsl_mult': 0.03823990414595613, 'bear_time_stop': 44, 'bear_use_sma': True, 'bear_use_ema': False, 'bear_use_atr': True, 'bear_use_adx': True, 'bear_use_spike': True, 'bear_rsi_required': True, 'sideways_strategy': 'breakout', 'sideways_bb_std_mult': 2.0888626221784103, 'sideways_rsi_os': 22, 'sideways_rsi_ob': 56, 'sideways_adx_thresh': 14.647174822869673, 'sideways_atr_min_pct': 0.019975930872495773, 'sideways_atr_max_pct': 0.05880113528317158, 'sideways_tp_mult': 1.1358425205363964, 'sideways_tsl_mult': 0.6262137322819189, 'sideways_time_stop': 151, 'sideways_use_sma': True, 'sideways_use_ema': True, 'sideways_use_atr': True, 'sideways_use_adx': False, 'sideways_use_spike': False, 'sideways_rsi_required': False}.
[I 2025-08-30 19:05:56,419] Trial 239 finished with values: [-1000000000.0, 1000000000.0] and parameters: {'p_sma': 39, 'p_std': 16, 'p_atr': 9, 'p_adx': 12, 'rsi_period': 78, 'ema1': 25, 'ema2': 15, 'slip_atr_k': 0.022709340805252907, 'slip_spread_k': 0.9433067630334715, 'spread_hl_frac': 0.009419827397796786, 'bb_std_mult': 1.071451217126417, 'rsi_os': 36, 'rsi_ob': 61, 'vol_spike': 0.1106674510839536, 'adx_thresh': 19.061340211987257, 'atr_min_pct': 0.00016848922330718434, 'atr_max_pct': 0.08859934207560947, 'tp_mult': 2.1975019024811706, 'tsl_mult': 0.04642929085633235, 'strategy': 'breakout', 'time_stop': 149, 'use_sma': False, 'use_atr': True, 'use_adx': True, 'use_ema': False, 'use_spike': True, 'rsi_required': True, 'edge_k': 1.6755118022412767, 'edge_cap': 0.45137889449704743, 'bull_strategy': 'mean_reversion', 'bull_bb_std_mult': 1.946598442261839, 'bull_rsi_os': 50, 'bull_rsi_ob': 73, 'bull_adx_thresh': 25.150188294224378, 'bull_atr_min_pct': 0.024713654200581248, 'bull_atr_max_pct': 0.06828918848037854, 'bull_tp_mult': 2.646919692676697, 'bull_tsl_mult': 0.8185931220961786, 'bull_time_stop': 183, 'bull_use_sma': True, 'bull_use_ema': False, 'bull_use_atr': False, 'bull_use_adx': True, 'bull_use_spike': True, 'bull_rsi_required': True, 'bear_strategy': 'breakout', 'bear_bb_std_mult': 0.5936562090758308, 'bear_rsi_os': 46, 'bear_rsi_ob': 93, 'bear_adx_thresh': 8.301933227402007, 'bear_atr_min_pct': 0.015848254420252533, 'bear_atr_max_pct': 0.05565257955447075, 'bear_tp_mult': 1.801676148904797, 'bear_tsl_mult': 0.09087984018496949, 'bear_time_stop': 33, 'bear_use_sma': True, 'bear_use_ema': False, 'bear_use_atr': True, 'bear_use_adx': True, 'bear_use_spike': True, 'bear_rsi_required': True, 'sideways_strategy': 'breakout', 'sideways_bb_std_mult': 3.3222392359898376, 'sideways_rsi_os': 33, 'sideways_rsi_ob': 56, 'sideways_adx_thresh': 6.128808232887055, 'sideways_atr_min_pct': 0.008305736108246168, 'sideways_atr_max_pct': 0.12634267383150374, 'sideways_tp_mult': 1.9385311964189835, 'sideways_tsl_mult': 0.8960321970818156, 'sideways_time_stop': 280, 'sideways_use_sma': True, 'sideways_use_ema': True, 'sideways_use_atr': True, 'sideways_use_adx': False, 'sideways_use_spike': True, 'sideways_rsi_required': False}.
[I 2025-08-30 19:06:30,706] Trial 240 finished with values: [-0.035558471257422064, 0.03544768221353623] and parameters: {'p_sma': 39, 'p_std': 22, 'p_atr': 10, 'p_adx': 7, 'rsi_period': 50, 'ema1': 19, 'ema2': 20, 'slip_atr_k': 0.19444567416260056, 'slip_spread_k': 0.3937753181877015, 'spread_hl_frac': 0.00408266985481145, 'bb_std_mult': 3.2739884594303232, 'rsi_os': 12, 'rsi_ob': 54, 'vol_spike': 0.18455044156886116, 'adx_thresh': 19.26210985147708, 'atr_min_pct': 2.2712878999282468e-05, 'atr_max_pct': 0.08682880481580257, 'tp_mult': 2.7554320033483544, 'tsl_mult': 0.15962364626666842, 'strategy': 'breakout', 'time_stop': 256, 'use_sma': False, 'use_atr': False, 'use_adx': True, 'use_ema': False, 'use_spike': True, 'rsi_required': True, 'edge_k': 0.15342514829702383, 'edge_cap': 0.24421879948689035, 'bull_strategy': 'mean_reversion', 'bull_bb_std_mult': 1.7633876793936527, 'bull_rsi_os': 50, 'bull_rsi_ob': 72, 'bull_adx_thresh': 25.503415674093095, 'bull_atr_min_pct': 0.0014823912244336839, 'bull_atr_max_pct': 0.02922406494713684, 'bull_tp_mult': 1.1814526081349954, 'bull_tsl_mult': 0.36833155705517795, 'bull_time_stop': 178, 'bull_use_sma': True, 'bull_use_ema': False, 'bull_use_atr': False, 'bull_use_adx': False, 'bull_use_spike': True, 'bull_rsi_required': True, 'bear_strategy': 'breakout', 'bear_bb_std_mult': 3.435246008479177, 'bear_rsi_os': 46, 'bear_rsi_ob': 92, 'bear_adx_thresh': 5.149556951640644, 'bear_atr_min_pct': 0.01279568472416967, 'bear_atr_max_pct': 0.05478431662617822, 'bear_tp_mult': 1.8032741437016646, 'bear_tsl_mult': 0.16921055127983553, 'bear_time_stop': 182, 'bear_use_sma': True, 'bear_use_ema': False, 'bear_use_atr': True, 'bear_use_adx': True, 'bear_use_spike': True, 'bear_rsi_required': False, 'sideways_strategy': 'mean_reversion', 'sideways_bb_std_mult': 0.6112592964009766, 'sideways_rsi_os': 43, 'sideways_rsi_ob': 56, 'sideways_adx_thresh': 10.963510452914912, 'sideways_atr_min_pct': 0.02040009227060152, 'sideways_atr_max_pct': 0.04460506356264096, 'sideways_tp_mult': 1.4217357558677022, 'sideways_tsl_mult': 0.8062536337797948, 'sideways_time_stop': 280, 'sideways_use_sma': True, 'sideways_use_ema': True, 'sideways_use_atr': True, 'sideways_use_adx': False, 'sideways_use_spike': True, 'sideways_rsi_required': False}.
[I 2025-08-30 19:06:31,247] Trial 243 finished with values: [-0.03336893568678356, 0.033261993971861026] and parameters: {'p_sma': 33, 'p_std': 21, 'p_atr': 14, 'p_adx': 7, 'rsi_period': 83, 'ema1': 24, 'ema2': 20, 'slip_atr_k': 0.16666205136648277, 'slip_spread_k': 0.6334030176415386, 'spread_hl_frac': 0.004002002783716283, 'bb_std_mult': 2.669248367495731, 'rsi_os': 25, 'rsi_ob': 66, 'vol_spike': 0.03546795891060324, 'adx_thresh': 5.808976561373758, 'atr_min_pct': 0.02339489670235208, 'atr_max_pct': 0.06139859259926812, 'tp_mult': 1.0921795857204153, 'tsl_mult': 0.0017916934447780308, 'strategy': 'breakout', 'time_stop': 262, 'use_sma': False, 'use_atr': False, 'use_adx': False, 'use_ema': False, 'use_spike': True, 'rsi_required': True, 'edge_k': 1.9703177393468692, 'edge_cap': 0.2362725919833334, 'bull_strategy': 'mean_reversion', 'bull_bb_std_mult': 1.7576710873053563, 'bull_rsi_os': 51, 'bull_rsi_ob': 95, 'bull_adx_thresh': 24.145319724816776, 'bull_atr_min_pct': 0.0014554429200050905, 'bull_atr_max_pct': 0.04445933537330961, 'bull_tp_mult': 1.1545203351963846, 'bull_tsl_mult': 0.21128206079622258, 'bull_time_stop': 176, 'bull_use_sma': True, 'bull_use_ema': False, 'bull_use_atr': False, 'bull_use_adx': True, 'bull_use_spike': True, 'bull_rsi_required': True, 'bear_strategy': 'breakout', 'bear_bb_std_mult': 1.0722846634052767, 'bear_rsi_os': 6, 'bear_rsi_ob': 83, 'bear_adx_thresh': 5.073406356841563, 'bear_atr_min_pct': 0.015034759728449565, 'bear_atr_max_pct': 0.05383066520872093, 'bear_tp_mult': 1.0564256326496806, 'bear_tsl_mult': 0.16464361760769947, 'bear_time_stop': 256, 'bear_use_sma': True, 'bear_use_ema': False, 'bear_use_atr': True, 'bear_use_adx': True, 'bear_use_spike': True, 'bear_rsi_required': False, 'sideways_strategy': 'mean_reversion', 'sideways_bb_std_mult': 2.072989519698422, 'sideways_rsi_os': 22, 'sideways_rsi_ob': 57, 'sideways_adx_thresh': 10.920447839954205, 'sideways_atr_min_pct': 0.020500704745097194, 'sideways_atr_max_pct': 0.11025949816502259, 'sideways_tp_mult': 1.413029411318194, 'sideways_tsl_mult': 0.6363456973060581, 'sideways_time_stop': 187, 'sideways_use_sma': True, 'sideways_use_ema': True, 'sideways_use_atr': True, 'sideways_use_adx': False, 'sideways_use_spike': False, 'sideways_rsi_required': False}.
[I 2025-08-30 19:06:32,038] Trial 242 finished with values: [-0.03344558702422096, 0.03336531406453098] and parameters: {'p_sma': 39, 'p_std': 21, 'p_atr': 19, 'p_adx': 7, 'rsi_period': 84, 'ema1': 19, 'ema2': 22, 'slip_atr_k': 0.1880576800568723, 'slip_spread_k': 0.40008642529236355, 'spread_hl_frac': 0.004061492145166711, 'bb_std_mult': 1.7657198241221708, 'rsi_os': 36, 'rsi_ob': 54, 'vol_spike': 0.036037058324278295, 'adx_thresh': 13.266703761924095, 'atr_min_pct': 0.029008034279225586, 'atr_max_pct': 0.06022702628901439, 'tp_mult': 1.756000267303094, 'tsl_mult': 0.6850439245862968, 'strategy': 'breakout', 'time_stop': 229, 'use_sma': False, 'use_atr': False, 'use_adx': True, 'use_ema': False, 'use_spike': True, 'rsi_required': True, 'edge_k': 1.687863691723377, 'edge_cap': 0.10516900244674549, 'bull_strategy': 'mean_reversion', 'bull_bb_std_mult': 2.367150292529011, 'bull_rsi_os': 50, 'bull_rsi_ob': 72, 'bull_adx_thresh': 7.5613837182641, 'bull_atr_min_pct': 0.0018510341119605893, 'bull_atr_max_pct': 0.028583669627095853, 'bull_tp_mult': 2.664752274278807, 'bull_tsl_mult': 0.3714715975799293, 'bull_time_stop': 180, 'bull_use_sma': True, 'bull_use_ema': False, 'bull_use_atr': False, 'bull_use_adx': True, 'bull_use_spike': True, 'bull_rsi_required': True, 'bear_strategy': 'breakout', 'bear_bb_std_mult': 2.969550729915677, 'bear_rsi_os': 46, 'bear_rsi_ob': 81, 'bear_adx_thresh': 5.066385314026304, 'bear_atr_min_pct': 0.015020431683599695, 'bear_atr_max_pct': 0.1324160530847843, 'bear_tp_mult': 1.720763256842237, 'bear_tsl_mult': 0.17049803185374113, 'bear_time_stop': 255, 'bear_use_sma': True, 'bear_use_ema': False, 'bear_use_atr': True, 'bear_use_adx': True, 'bear_use_spike': True, 'bear_rsi_required': False, 'sideways_strategy': 'mean_reversion', 'sideways_bb_std_mult': 2.087871077112064, 'sideways_rsi_os': 9, 'sideways_rsi_ob': 57, 'sideways_adx_thresh': 14.44478889179495, 'sideways_atr_min_pct': 0.02032821237825043, 'sideways_atr_max_pct': 0.1146674800505072, 'sideways_tp_mult': 1.9336331605910182, 'sideways_tsl_mult': 0.6166682488678278, 'sideways_time_stop': 280, 'sideways_use_sma': True, 'sideways_use_ema': True, 'sideways_use_atr': True, 'sideways_use_adx': False, 'sideways_use_spike': True, 'sideways_rsi_required': False}.
