[I 2025-08-30 20:03:02,431] Trial 660 finished with values: [-0.039703929626110246, 0.03971402907652451] and parameters: {'p_sma': 45, 'p_std': 56, 'p_atr': 11, 'p_adx': 7, 'rsi_period': 72, 'ema1': 25, 'ema2': 16, 'slip_atr_k': 0.03305613825357549, 'slip_spread_k': 0.43513773846489306, 'spread_hl_frac': 0.003937284122540746, 'bb_std_mult': 1.061934485556659, 'rsi_os': 35, 'rsi_ob': 52, 'vol_spike': 0.05849689025655455, 'adx_thresh': 18.906775047512156, 'atr_min_pct': 0.021915878580246788, 'atr_max_pct': 0.1231411334856927, 'tp_mult': 2.0868935307127368, 'tsl_mult': 0.548953086291408, 'strategy': 'breakout', 'time_stop': 41, 'use_sma': True, 'use_atr': False, 'use_adx': True, 'use_ema': True, 'use_spike': False, 'rsi_required': False, 'edge_k': 1.5874884784575651, 'edge_cap': 0.2536401807719375, 'bull_strategy': 'breakout', 'bull_bb_std_mult': 1.8492166130977377, 'bull_rsi_os': 32, 'bull_rsi_ob': 95, 'bull_adx_thresh': 24.147294501396175, 'bull_atr_min_pct': 0.004280553510149594, 'bull_atr_max_pct': 0.01949635319239681, 'bull_tp_mult': 1.6965580266770575, 'bull_tsl_mult': 0.9995436509179871, 'bull_time_stop': 167, 'bull_use_sma': False, 'bull_use_ema': False, 'bull_use_atr': True, 'bull_use_adx': False, 'bull_use_spike': True, 'bull_rsi_required': False, 'bear_strategy': 'breakout', 'bear_bb_std_mult': 2.150881298226572, 'bear_rsi_os': 51, 'bear_rsi_ob': 82, 'bear_adx_thresh': 5.583909397665185, 'bear_atr_min_pct': 0.0022775202649422156, 'bear_atr_max_pct': 0.13621597011359782, 'bear_tp_mult': 1.6962275928077943, 'bear_tsl_mult': 0.8188862033796063, 'bear_time_stop': 24, 'bear_use_sma': True, 'bear_use_ema': True, 'bear_use_atr': False, 'bear_use_adx': False, 'bear_use_spike': True, 'bear_rsi_required': True, 'sideways_strategy': 'mean_reversion', 'sideways_bb_std_mult': 1.9883552256804813, 'sideways_rsi_os': 17, 'sideways_rsi_ob': 94, 'sideways_adx_thresh': 9.393635368829324, 'sideways_atr_min_pct': 0.020054242669990077, 'sideways_atr_max_pct': 0.11719041145437976, 'sideways_tp_mult': 1.7109398330921286, 'sideways_tsl_mult': 0.6559152012302352, 'sideways_time_stop': 182, 'sideways_use_sma': False, 'sideways_use_ema': False, 'sideways_use_atr': True, 'sideways_use_adx': True, 'sideways_use_spike': False, 'sideways_rsi_required': True}.
[I 2025-08-30 20:03:02,587] Trial 658 finished with values: [-1000000000.0, 1000000000.0] and parameters: {'p_sma': 37, 'p_std': 60, 'p_atr': 11, 'p_adx': 7, 'rsi_period': 74, 'ema1': 21, 'ema2': 24, 'slip_atr_k': 0.025041673811073285, 'slip_spread_k': 0.4344394859332409, 'spread_hl_frac': 0.006464342051032055, 'bb_std_mult': 1.5585181607382825, 'rsi_os': 10, 'rsi_ob': 47, 'vol_spike': 0.1652959969429036, 'adx_thresh': 27.854037624273598, 'atr_min_pct': 0.028847334979088476, 'atr_max_pct': 0.14559815972538132, 'tp_mult': 1.2037331743515516, 'tsl_mult': 0.3566002972578404, 'strategy': 'breakout', 'time_stop': 44, 'use_sma': False, 'use_atr': False, 'use_adx': True, 'use_ema': True, 'use_spike': False, 'rsi_required': False, 'edge_k': 1.9866588550697741, 'edge_cap': 0.7590370977511581, 'bull_strategy': 'breakout', 'bull_bb_std_mult': 1.8554675858867928, 'bull_rsi_os': 52, 'bull_rsi_ob': 77, 'bull_adx_thresh': 26.556009824321542, 'bull_atr_min_pct': 0.004245867936246796, 'bull_atr_max_pct': 0.024696213745632745, 'bull_tp_mult': 2.1207030398072226, 'bull_tsl_mult': 0.602104943331751, 'bull_time_stop': 235, 'bull_use_sma': False, 'bull_use_ema': False, 'bull_use_atr': True, 'bull_use_adx': False, 'bull_use_spike': True, 'bull_rsi_required': False, 'bear_strategy': 'breakout', 'bear_bb_std_mult': 3.1691651053911203, 'bear_rsi_os': 49, 'bear_rsi_ob': 85, 'bear_adx_thresh': 5.933068785620441, 'bear_atr_min_pct': 0.011267409204578912, 'bear_atr_max_pct': 0.08203782282452368, 'bear_tp_mult': 1.672863597136556, 'bear_tsl_mult': 0.3270485216865199, 'bear_time_stop': 91, 'bear_use_sma': True, 'bear_use_ema': True, 'bear_use_atr': False, 'bear_use_adx': False, 'bear_use_spike': True, 'bear_rsi_required': True, 'sideways_strategy': 'mean_reversion', 'sideways_bb_std_mult': 2.00466881562649, 'sideways_rsi_os': 16, 'sideways_rsi_ob': 73, 'sideways_adx_thresh': 9.386922418019774, 'sideways_atr_min_pct': 0.0077008393172227204, 'sideways_atr_max_pct': 0.11746375815507847, 'sideways_tp_mult': 2.2855156590728387, 'sideways_tsl_mult': 0.7441742030850167, 'sideways_time_stop': 182, 'sideways_use_sma': False, 'sideways_use_ema': False, 'sideways_use_atr': True, 'sideways_use_adx': True, 'sideways_use_spike': False, 'sideways_rsi_required': True}.
[I 2025-08-30 20:03:02,958] Trial 659 finished with values: [-1000000000.0, 1000000000.0] and parameters: {'p_sma': 47, 'p_std': 25, 'p_atr': 12, 'p_adx': 7, 'rsi_period': 50, 'ema1': 24, 'ema2': 19, 'slip_atr_k': 0.21807592263987743, 'slip_spread_k': 0.4339816814928837, 'spread_hl_frac': 0.04532992204172835, 'bb_std_mult': 1.069444276200182, 'rsi_os': 34, 'rsi_ob': 56, 'vol_spike': 0.05964709646629643, 'adx_thresh': 27.95333893830105, 'atr_min_pct': 0.021931794737096805, 'atr_max_pct': 0.1456101459457821, 'tp_mult': 2.0220971331766404, 'tsl_mult': 0.7189670954577967, 'strategy': 'breakout', 'time_stop': 41, 'use_sma': True, 'use_atr': False, 'use_adx': True, 'use_ema': True, 'use_spike': False, 'rsi_required': False, 'edge_k': 0.21747359115835493, 'edge_cap': 0.7110451296572645, 'bull_strategy': 'breakout', 'bull_bb_std_mult': 1.8376237100689647, 'bull_rsi_os': 52, 'bull_rsi_ob': 51, 'bull_adx_thresh': 26.61819956213434, 'bull_atr_min_pct': 0.01059912996245398, 'bull_atr_max_pct': 0.12013560145280773, 'bull_tp_mult': 1.472285937337566, 'bull_tsl_mult': 0.9536874800869103, 'bull_time_stop': 192, 'bull_use_sma': False, 'bull_use_ema': False, 'bull_use_atr': True, 'bull_use_adx': False, 'bull_use_spike': True, 'bull_rsi_required': False, 'bear_strategy': 'breakout', 'bear_bb_std_mult': 0.8279895309579164, 'bear_rsi_os': 48, 'bear_rsi_ob': 82, 'bear_adx_thresh': 24.96683776205158, 'bear_atr_min_pct': 0.016411178207453792, 'bear_atr_max_pct': 0.13736321747806216, 'bear_tp_mult': 1.653469033651219, 'bear_tsl_mult': 0.32862506283826076, 'bear_time_stop': 38, 'bear_use_sma': True, 'bear_use_ema': False, 'bear_use_atr': False, 'bear_use_adx': False, 'bear_use_spike': True, 'bear_rsi_required': True, 'sideways_strategy': 'mean_reversion', 'sideways_bb_std_mult': 2.1458087096244887, 'sideways_rsi_os': 16, 'sideways_rsi_ob': 64, 'sideways_adx_thresh': 9.404518673982345, 'sideways_atr_min_pct': 0.014807353666507256, 'sideways_atr_max_pct': 0.12161770142490835, 'sideways_tp_mult': 1.7082612775036212, 'sideways_tsl_mult': 0.6869285693138736, 'sideways_time_stop': 284, 'sideways_use_sma': False, 'sideways_use_ema': False, 'sideways_use_atr': True, 'sideways_use_adx': True, 'sideways_use_spike': False, 'sideways_rsi_required': True}.
[I 2025-08-30 20:03:03,053] Trial 657 finished with values: [-1000000000.0, 1000000000.0] and parameters: {'p_sma': 47, 'p_std': 27, 'p_atr': 11, 'p_adx': 19, 'rsi_period': 53, 'ema1': 24, 'ema2': 41, 'slip_atr_k': 0.02403886489640223, 'slip_spread_k': 0.9866776571635059, 'spread_hl_frac': 0.0018533731709991577, 'bb_std_mult': 2.8322569432224807, 'rsi_os': 34, 'rsi_ob': 56, 'vol_spike': 0.16532781412692, 'adx_thresh': 19.58359063631497, 'atr_min_pct': 0.02453023812749633, 'atr_max_pct': 0.11883454023252031, 'tp_mult': 2.110758364700556, 'tsl_mult': 0.20045719516622934, 'strategy': 'breakout', 'time_stop': 41, 'use_sma': False, 'use_atr': True, 'use_adx': True, 'use_ema': True, 'use_spike': False, 'rsi_required': False, 'edge_k': 0.1613665080226128, 'edge_cap': 0.13696958817160682, 'bull_strategy': 'mean_reversion', 'bull_bb_std_mult': 1.3579936561432264, 'bull_rsi_os': 52, 'bull_rsi_ob': 77, 'bull_adx_thresh': 24.76898918791967, 'bull_atr_min_pct': 0.018411747261507242, 'bull_atr_max_pct': 0.024917308671698234, 'bull_tp_mult': 2.73496313482232, 'bull_tsl_mult': 0.7607740645173401, 'bull_time_stop': 235, 'bull_use_sma': False, 'bull_use_ema': False, 'bull_use_atr': True, 'bull_use_adx': False, 'bull_use_spike': True, 'bull_rsi_required': False, 'bear_strategy': 'breakout', 'bear_bb_std_mult': 3.1840281630140295, 'bear_rsi_os': 48, 'bear_rsi_ob': 85, 'bear_adx_thresh': 5.977063574602353, 'bear_atr_min_pct': 0.016284425994550055, 'bear_atr_max_pct': 0.0805251167133838, 'bear_tp_mult': 1.6929332157291677, 'bear_tsl_mult': 0.092290026317108, 'bear_time_stop': 39, 'bear_use_sma': True, 'bear_use_ema': True, 'bear_use_atr': True, 'bear_use_adx': True, 'bear_use_spike': True, 'bear_rsi_required': True, 'sideways_strategy': 'mean_reversion', 'sideways_bb_std_mult': 2.111879589102661, 'sideways_rsi_os': 49, 'sideways_rsi_ob': 57, 'sideways_adx_thresh': 33.51392369696454, 'sideways_atr_min_pct': 0.021702221678871043, 'sideways_atr_max_pct': 0.018726598979694822, 'sideways_tp_mult': 1.8889231848223922, 'sideways_tsl_mult': 0.6907336329761345, 'sideways_time_stop': 296, 'sideways_use_sma': True, 'sideways_use_ema': False, 'sideways_use_atr': True, 'sideways_use_adx': True, 'sideways_use_spike': False, 'sideways_rsi_required': False}.
[I 2025-08-30 20:03:38,084] Trial 661 finished with values: [-1000000000.0, 1000000000.0] and parameters: {'p_sma': 47, 'p_std': 23, 'p_atr': 12, 'p_adx': 11, 'rsi_period': 50, 'ema1': 24, 'ema2': 24, 'slip_atr_k': 0.01846176319047245, 'slip_spread_k': 0.387639955921691, 'spread_hl_frac': 0.0038997051452667277, 'bb_std_mult': 0.952736716639479, 'rsi_os': 24, 'rsi_ob': 55, 'vol_spike': 0.16522868464410378, 'adx_thresh': 19.3979333766063, 'atr_min_pct': 0.02914419598038677, 'atr_max_pct': 0.1453691751599396, 'tp_mult': 2.0175641982832255, 'tsl_mult': 0.7135247337399235, 'strategy': 'breakout', 'time_stop': 30, 'use_sma': False, 'use_atr': True, 'use_adx': False, 'use_ema': True, 'use_spike': False, 'rsi_required': False, 'edge_k': 0.033338131820151745, 'edge_cap': 0.7608291899568425, 'bull_strategy': 'mean_reversion', 'bull_bb_std_mult': 1.7756489976589487, 'bull_rsi_os': 55, 'bull_rsi_ob': 61, 'bull_adx_thresh': 16.595351633869612, 'bull_atr_min_pct': 0.02056576003630634, 'bull_atr_max_pct': 0.11961579147872214, 'bull_tp_mult': 2.138567191015057, 'bull_tsl_mult': 0.758973232752211, 'bull_time_stop': 231, 'bull_use_sma': False, 'bull_use_ema': False, 'bull_use_atr': True, 'bull_use_adx': False, 'bull_use_spike': True, 'bull_rsi_required': False, 'bear_strategy': 'breakout', 'bear_bb_std_mult': 3.29700469449828, 'bear_rsi_os': 49, 'bear_rsi_ob': 85, 'bear_adx_thresh': 30.128221957028252, 'bear_atr_min_pct': 0.016602475945648558, 'bear_atr_max_pct': 0.07161640430388282, 'bear_tp_mult': 1.7319139456707322, 'bear_tsl_mult': 0.09548080951321941, 'bear_time_stop': 39, 'bear_use_sma': True, 'bear_use_ema': True, 'bear_use_atr': True, 'bear_use_adx': True, 'bear_use_spike': False, 'bear_rsi_required': False, 'sideways_strategy': 'breakout', 'sideways_bb_std_mult': 2.2272701423948624, 'sideways_rsi_os': 16, 'sideways_rsi_ob': 63, 'sideways_adx_thresh': 12.976541164748177, 'sideways_atr_min_pct': 0.018086088683589588, 'sideways_atr_max_pct': 0.0233978177876224, 'sideways_tp_mult': 2.6520113810512336, 'sideways_tsl_mult': 0.4404261903842059, 'sideways_time_stop': 284, 'sideways_use_sma': True, 'sideways_use_ema': True, 'sideways_use_atr': True, 'sideways_use_adx': True, 'sideways_use_spike': False, 'sideways_rsi_required': False}.
[I 2025-08-30 20:03:38,230] Trial 663 finished with values: [-1000000000.0, 1000000000.0] and parameters: {'p_sma': 34, 'p_std': 34, 'p_atr': 20, 'p_adx': 11, 'rsi_period': 51, 'ema1': 7, 'ema2': 17, 'slip_atr_k': 0.01906096609657945, 'slip_spread_k': 0.16082242447290107, 'spread_hl_frac': 0.004652948070822921, 'bb_std_mult': 0.9482243918554963, 'rsi_os': 30, 'rsi_ob': 54, 'vol_spike': 0.10996598809585564, 'adx_thresh': 19.696683257820368, 'atr_min_pct': 0.02454087417817612, 'atr_max_pct': 0.13642278230787544, 'tp_mult': 2.2948211382176815, 'tsl_mult': 0.20287969634092207, 'strategy': 'breakout', 'time_stop': 176, 'use_sma': False, 'use_atr': True, 'use_adx': False, 'use_ema': False, 'use_spike': True, 'rsi_required': True, 'edge_k': 0.05594251705185525, 'edge_cap': 0.21100738737890262, 'bull_strategy': 'mean_reversion', 'bull_bb_std_mult': 1.6240245485891949, 'bull_rsi_os': 49, 'bull_rsi_ob': 60, 'bull_adx_thresh': 13.874681478926023, 'bull_atr_min_pct': 0.020545138218205982, 'bull_atr_max_pct': 0.029044078973434466, 'bull_tp_mult': 2.72896000875954, 'bull_tsl_mult': 0.9811623585293215, 'bull_time_stop': 188, 'bull_use_sma': True, 'bull_use_ema': False, 'bull_use_atr': False, 'bull_use_adx': True, 'bull_use_spike': True, 'bull_rsi_required': True, 'bear_strategy': 'breakout', 'bear_bb_std_mult': 3.314225411255385, 'bear_rsi_os': 50, 'bear_rsi_ob': 56, 'bear_adx_thresh': 7.984042051583481, 'bear_atr_min_pct': 0.014412714339344473, 'bear_atr_max_pct': 0.07196819837769881, 'bear_tp_mult': 1.7430801316832885, 'bear_tsl_mult': 0.24661931512781793, 'bear_time_stop': 138, 'bear_use_sma': True, 'bear_use_ema': False, 'bear_use_atr': True, 'bear_use_adx': True, 'bear_use_spike': False, 'bear_rsi_required': False, 'sideways_strategy': 'breakout', 'sideways_bb_std_mult': 0.9342517890298196, 'sideways_rsi_os': 27, 'sideways_rsi_ob': 57, 'sideways_adx_thresh': 10.376684425627353, 'sideways_atr_min_pct': 0.0181753817073515, 'sideways_atr_max_pct': 0.1269987511479434, 'sideways_tp_mult': 2.44678305382494, 'sideways_tsl_mult': 0.9678130212032561, 'sideways_time_stop': 144, 'sideways_use_sma': True, 'sideways_use_ema': True, 'sideways_use_atr': False, 'sideways_use_adx': False, 'sideways_use_spike': False, 'sideways_rsi_required': False}.
[I 2025-08-30 20:03:38,577] Trial 662 finished with values: [-0.02706058493557484, 0.026963062470789743] and parameters: {'p_sma': 46, 'p_std': 27, 'p_atr': 26, 'p_adx': 22, 'rsi_period': 50, 'ema1': 24, 'ema2': 34, 'slip_atr_k': 0.018871355161345586, 'slip_spread_k': 0.38580155454917303, 'spread_hl_frac': 0.04365837582783931, 'bb_std_mult': 0.9411588634416901, 'rsi_os': 23, 'rsi_ob': 55, 'vol_spike': 0.011134653098195835, 'adx_thresh': 19.61267219845662, 'atr_min_pct': 0.024912311832014648, 'atr_max_pct': 0.13515269976193775, 'tp_mult': 1.6666781104576003, 'tsl_mult': 0.19704627725949575, 'strategy': 'breakout', 'time_stop': 29, 'use_sma': True, 'use_atr': True, 'use_adx': False, 'use_ema': False, 'use_spike': True, 'rsi_required': True, 'edge_k': 0.19548685889682438, 'edge_cap': 0.20871209984720376, 'bull_strategy': 'mean_reversion', 'bull_bb_std_mult': 1.7206474478687686, 'bull_rsi_os': 49, 'bull_rsi_ob': 68, 'bull_adx_thresh': 13.80327432595702, 'bull_atr_min_pct': 0.0017183817737151667, 'bull_atr_max_pct': 0.028846288045001413, 'bull_tp_mult': 2.71819306017818, 'bull_tsl_mult': 0.9797524944360226, 'bull_time_stop': 192, 'bull_use_sma': True, 'bull_use_ema': False, 'bull_use_atr': False, 'bull_use_adx': True, 'bull_use_spike': True, 'bull_rsi_required': True, 'bear_strategy': 'breakout', 'bear_bb_std_mult': 2.3883833079214347, 'bear_rsi_os': 48, 'bear_rsi_ob': 56, 'bear_adx_thresh': 6.971545753912032, 'bear_atr_min_pct': 0.018082734814154785, 'bear_atr_max_pct': 0.052329825057776946, 'bear_tp_mult': 1.5763692144037464, 'bear_tsl_mult': 0.09361082862496654, 'bear_time_stop': 33, 'bear_use_sma': True, 'bear_use_ema': False, 'bear_use_atr': True, 'bear_use_adx': True, 'bear_use_spike': False, 'bear_rsi_required': False, 'sideways_strategy': 'breakout', 'sideways_bb_std_mult': 1.8539742900414042, 'sideways_rsi_os': 15, 'sideways_rsi_ob': 57, 'sideways_adx_thresh': 14.222600293704375, 'sideways_atr_min_pct': 0.01814979646131118, 'sideways_atr_max_pct': 0.12207787461549663, 'sideways_tp_mult': 2.394030266237546, 'sideways_tsl_mult': 0.3094374733471291, 'sideways_time_stop': 146, 'sideways_use_sma': True, 'sideways_use_ema': True, 'sideways_use_atr': False, 'sideways_use_adx': False, 'sideways_use_spike': False, 'sideways_rsi_required': False}.
[I 2025-08-30 20:03:38,708] Trial 664 finished with values: [-1000000000.0, 1000000000.0] and parameters: {'p_sma': 34, 'p_std': 51, 'p_atr': 7, 'p_adx': 10, 'rsi_period': 22, 'ema1': 23, 'ema2': 17, 'slip_atr_k': 0.020668455529466674, 'slip_spread_k': 0.15715429966737582, 'spread_hl_frac': 0.04992342245299884, 'bb_std_mult': 0.9569187429530676, 'rsi_os': 30, 'rsi_ob': 54, 'vol_spike': 0.03874573007938097, 'adx_thresh': 20.581375393150996, 'atr_min_pct': 0.017899973902625016, 'atr_max_pct': 0.13638810524178885, 'tp_mult': 2.748882650555341, 'tsl_mult': 0.6888538052635619, 'strategy': 'breakout', 'time_stop': 30, 'use_sma': False, 'use_atr': True, 'use_adx': False, 'use_ema': False, 'use_spike': True, 'rsi_required': True, 'edge_k': 0.04618844352258655, 'edge_cap': 0.21293069974609286, 'bull_strategy': 'mean_reversion', 'bull_bb_std_mult': 1.6344383316265545, 'bull_rsi_os': 49, 'bull_rsi_ob': 60, 'bull_adx_thresh': 9.842327732353628, 'bull_atr_min_pct': 0.003317401251918289, 'bull_atr_max_pct': 0.028119820326143494, 'bull_tp_mult': 2.8535460791382223, 'bull_tsl_mult': 0.9717184386084305, 'bull_time_stop': 6, 'bull_use_sma': True, 'bull_use_ema': False, 'bull_use_atr': False, 'bull_use_adx': True, 'bull_use_spike': True, 'bull_rsi_required': True, 'bear_strategy': 'breakout', 'bear_bb_std_mult': 2.35449329988621, 'bear_rsi_os': 40, 'bear_rsi_ob': 56, 'bear_adx_thresh': 6.728577786252267, 'bear_atr_min_pct': 0.014168194986344305, 'bear_atr_max_pct': 0.052224284006785165, 'bear_tp_mult': 1.7267144823421032, 'bear_tsl_mult': 0.24979166001038033, 'bear_time_stop': 262, 'bear_use_sma': True, 'bear_use_ema': False, 'bear_use_atr': True, 'bear_use_adx': True, 'bear_use_spike': False, 'bear_rsi_required': False, 'sideways_strategy': 'breakout', 'sideways_bb_std_mult': 2.2030877849418187, 'sideways_rsi_os': 18, 'sideways_rsi_ob': 74, 'sideways_adx_thresh': 14.14361345700581, 'sideways_atr_min_pct': 0.01810442511729508, 'sideways_atr_max_pct': 0.12632158276684144, 'sideways_tp_mult': 2.494286842765495, 'sideways_tsl_mult': 0.9024802515634498, 'sideways_time_stop': 262, 'sideways_use_sma': True, 'sideways_use_ema': True, 'sideways_use_atr': False, 'sideways_use_adx': False, 'sideways_use_spike': False, 'sideways_rsi_required': False}.
[I 2025-08-30 20:04:14,426] Trial 665 finished with values: [-1000000000.0, 1000000000.0] and parameters: {'p_sma': 38, 'p_std': 18, 'p_atr': 10, 'p_adx': 9, 'rsi_period': 52, 'ema1': 25, 'ema2': 17, 'slip_atr_k': 0.010360604351983799, 'slip_spread_k': 0.4619338971067575, 'spread_hl_frac': 0.00464474997766804, 'bb_std_mult': 0.8806022528172752, 'rsi_os': 40, 'rsi_ob': 58, 'vol_spike': 0.04041772576562111, 'adx_thresh': 20.539147245846518, 'atr_min_pct': 0.008009703601903215, 'atr_max_pct': 0.14974068293687723, 'tp_mult': 2.1763848795048197, 'tsl_mult': 0.5666956749467499, 'strategy': 'breakout', 'time_stop': 17, 'use_sma': False, 'use_atr': True, 'use_adx': False, 'use_ema': False, 'use_spike': True, 'rsi_required': True, 'edge_k': 1.3638635001456898, 'edge_cap': 0.21795131200625825, 'bull_strategy': 'mean_reversion', 'bull_bb_std_mult': 1.6392048130219639, 'bull_rsi_os': 49, 'bull_rsi_ob': 74, 'bull_adx_thresh': 10.20514232150225, 'bull_atr_min_pct': 0.0032907310284713606, 'bull_atr_max_pct': 0.02871598946411068, 'bull_tp_mult': 2.857465258055493, 'bull_tsl_mult': 0.19683278587706082, 'bull_time_stop': 185, 'bull_use_sma': True, 'bull_use_ema': False, 'bull_use_atr': False, 'bull_use_adx': True, 'bull_use_spike': True, 'bull_rsi_required': True, 'bear_strategy': 'breakout', 'bear_bb_std_mult': 3.237504900289071, 'bear_rsi_os': 48, 'bear_rsi_ob': 73, 'bear_adx_thresh': 6.670884431385133, 'bear_atr_min_pct': 0.018149537686756277, 'bear_atr_max_pct': 0.06289294089202394, 'bear_tp_mult': 1.7912556134370825, 'bear_tsl_mult': 0.9716577584383401, 'bear_time_stop': 138, 'bear_use_sma': True, 'bear_use_ema': False, 'bear_use_atr': True, 'bear_use_adx': True, 'bear_use_spike': False, 'bear_rsi_required': False, 'sideways_strategy': 'breakout', 'sideways_bb_std_mult': 1.820480029035443, 'sideways_rsi_os': 18, 'sideways_rsi_ob': 55, 'sideways_adx_thresh': 10.349093901817104, 'sideways_atr_min_pct': 0.01927878738738148, 'sideways_atr_max_pct': 0.07019488396672842, 'sideways_tp_mult': 2.900324955636745, 'sideways_tsl_mult': 0.9111994472703369, 'sideways_time_stop': 123, 'sideways_use_sma': True, 'sideways_use_ema': True, 'sideways_use_atr': False, 'sideways_use_adx': False, 'sideways_use_spike': False, 'sideways_rsi_required': False}.
