[I 2025-08-30 18:56:06,839] Trial 163 finished with values: [-1000000000.0, 1000000000.0] and parameters: {'p_sma': 42, 'p_std': 48, 'p_atr': 9, 'p_adx': 19, 'rsi_period': 37, 'ema1': 15, 'ema2': 15, 'slip_atr_k': 0.009825179593308125, 'slip_spread_k': 0.9166772581954074, 'spread_hl_frac': 0.003786479317898876, 'bb_std_mult': 2.288382942528797, 'rsi_os': 38, 'rsi_ob': 61, 'vol_spike': 0.15777951142010113, 'adx_thresh': 17.876219368368826, 'atr_min_pct': 0.016283797103037956, 'atr_max_pct': 0.1461530150185488, 'tp_mult': 2.2392127473393812, 'tsl_mult': 0.8534732391737778, 'strategy': 'breakout', 'time_stop': 127, 'use_sma': False, 'use_atr': True, 'use_adx': False, 'use_ema': False, 'use_spike': False, 'rsi_required': True, 'edge_k': 0.15187659676812643, 'edge_cap': 0.13267745995462538, 'bull_strategy': 'mean_reversion', 'bull_bb_std_mult': 1.570232614361278, 'bull_rsi_os': 47, 'bull_rsi_ob': 54, 'bull_adx_thresh': 7.780858227879776, 'bull_atr_min_pct': 0.004224325561923146, 'bull_atr_max_pct': 0.03456996323095544, 'bull_tp_mult': 2.231825193708779, 'bull_tsl_mult': 0.997729226084252, 'bull_time_stop': 214, 'bull_use_sma': True, 'bull_use_ema': False, 'bull_use_atr': False, 'bull_use_adx': True, 'bull_use_spike': True, 'bull_rsi_required': True, 'bear_strategy': 'breakout', 'bear_bb_std_mult': 3.1540368901471134, 'bear_rsi_os': 18, 'bear_rsi_ob': 85, 'bear_adx_thresh': 31.510029743478228, 'bear_atr_min_pct': 0.014124037694035058, 'bear_atr_max_pct': 0.14052388497728197, 'bear_tp_mult': 1.2240453590070628, 'bear_tsl_mult': 0.12565909644887222, 'bear_time_stop': 21, 'bear_use_sma': True, 'bear_use_ema': True, 'bear_use_atr': True, 'bear_use_adx': True, 'bear_use_spike': False, 'bear_rsi_required': False, 'sideways_strategy': 'breakout', 'sideways_bb_std_mult': 3.2333508301877574, 'sideways_rsi_os': 18, 'sideways_rsi_ob': 55, 'sideways_adx_thresh': 9.356864795342798, 'sideways_atr_min_pct': 0.019700172676923547, 'sideways_atr_max_pct': 0.12337838312952891, 'sideways_tp_mult': 1.4589684048080485, 'sideways_tsl_mult': 0.6172238533166654, 'sideways_time_stop': 129, 'sideways_use_sma': False, 'sideways_use_ema': True, 'sideways_use_atr': False, 'sideways_use_adx': False, 'sideways_use_spike': False, 'sideways_rsi_required': False}.
[I 2025-08-30 18:56:06,967] Trial 161 finished with values: [-1000000000.0, 1000000000.0] and parameters: {'p_sma': 17, 'p_std': 27, 'p_atr': 24, 'p_adx': 10, 'rsi_period': 52, 'ema1': 23, 'ema2': 15, 'slip_atr_k': 0.011441368458775938, 'slip_spread_k': 0.9221197606730249, 'spread_hl_frac': 0.0036435709295487713, 'bb_std_mult': 0.6372721905183656, 'rsi_os': 31, 'rsi_ob': 85, 'vol_spike': 0.1210996808398063, 'adx_thresh': 30.59625071971655, 'atr_min_pct': 0.02366843344732482, 'atr_max_pct': 0.04658668299619234, 'tp_mult': 2.7857252245096857, 'tsl_mult': 0.6719762193262637, 'strategy': 'mean_reversion', 'time_stop': 238, 'use_sma': False, 'use_atr': True, 'use_adx': False, 'use_ema': False, 'use_spike': False, 'rsi_required': True, 'edge_k': 0.24952340276734505, 'edge_cap': 0.05790159825447161, 'bull_strategy': 'mean_reversion', 'bull_bb_std_mult': 1.8104083194656555, 'bull_rsi_os': 47, 'bull_rsi_ob': 53, 'bull_adx_thresh': 6.233140855810586, 'bull_atr_min_pct': 0.010544920924287965, 'bull_atr_max_pct': 0.10024113581695002, 'bull_tp_mult': 1.3338915449918143, 'bull_tsl_mult': 0.9857670945885211, 'bull_time_stop': 300, 'bull_use_sma': True, 'bull_use_ema': False, 'bull_use_atr': False, 'bull_use_adx': True, 'bull_use_spike': True, 'bull_rsi_required': True, 'bear_strategy': 'breakout', 'bear_bb_std_mult': 2.1702446125383377, 'bear_rsi_os': 45, 'bear_rsi_ob': 85, 'bear_adx_thresh': 20.19542928247223, 'bear_atr_min_pct': 0.01522106804488702, 'bear_atr_max_pct': 0.13816698861904467, 'bear_tp_mult': 1.7481392100396624, 'bear_tsl_mult': 0.1035166957473657, 'bear_time_stop': 20, 'bear_use_sma': True, 'bear_use_ema': True, 'bear_use_atr': True, 'bear_use_adx': True, 'bear_use_spike': False, 'bear_rsi_required': False, 'sideways_strategy': 'breakout', 'sideways_bb_std_mult': 1.8436377026514026, 'sideways_rsi_os': 44, 'sideways_rsi_ob': 55, 'sideways_adx_thresh': 11.291410728386765, 'sideways_atr_min_pct': 0.010223870056547766, 'sideways_atr_max_pct': 0.021515835518081623, 'sideways_tp_mult': 2.4156588908849788, 'sideways_tsl_mult': 0.7021202221201174, 'sideways_time_stop': 289, 'sideways_use_sma': False, 'sideways_use_ema': True, 'sideways_use_atr': False, 'sideways_use_adx': False, 'sideways_use_spike': False, 'sideways_rsi_required': False}.
[I 2025-08-30 18:56:39,942] Trial 167 finished with values: [-1000000000.0, 1000000000.0] and parameters: {'p_sma': 28, 'p_std': 37, 'p_atr': 20, 'p_adx': 22, 'rsi_period': 32, 'ema1': 5, 'ema2': 55, 'slip_atr_k': 0.018401154924767786, 'slip_spread_k': 0.4390711030908626, 'spread_hl_frac': 0.0049170600815082, 'bb_std_mult': 0.9666481721504079, 'rsi_os': 37, 'rsi_ob': 51, 'vol_spike': 0.2719564471756134, 'adx_thresh': 10.849522094987394, 'atr_min_pct': 0.02404589692658851, 'atr_max_pct': 0.13233129040332486, 'tp_mult': 1.016721909214536, 'tsl_mult': 0.9786111085158198, 'strategy': 'breakout', 'time_stop': 159, 'use_sma': False, 'use_atr': False, 'use_adx': False, 'use_ema': False, 'use_spike': True, 'rsi_required': True, 'edge_k': 0.044553915601354244, 'edge_cap': 0.23784713816689157, 'bull_strategy': 'mean_reversion', 'bull_bb_std_mult': 1.7239975618656327, 'bull_rsi_os': 53, 'bull_rsi_ob': 73, 'bull_adx_thresh': 25.85118570438948, 'bull_atr_min_pct': 0.002016583723261667, 'bull_atr_max_pct': 0.023952523891187547, 'bull_tp_mult': 1.7191247290701173, 'bull_tsl_mult': 0.5352934207179755, 'bull_time_stop': 174, 'bull_use_sma': False, 'bull_use_ema': True, 'bull_use_atr': False, 'bull_use_adx': True, 'bull_use_spike': True, 'bull_rsi_required': True, 'bear_strategy': 'breakout', 'bear_bb_std_mult': 3.284853736775126, 'bear_rsi_os': 40, 'bear_rsi_ob': 83, 'bear_adx_thresh': 7.81110763493656, 'bear_atr_min_pct': 0.019883196120923055, 'bear_atr_max_pct': 0.06580721701302844, 'bear_tp_mult': 1.9309501815641483, 'bear_tsl_mult': 0.17092951058445877, 'bear_time_stop': 198, 'bear_use_sma': True, 'bear_use_ema': False, 'bear_use_atr': True, 'bear_use_adx': True, 'bear_use_spike': False, 'bear_rsi_required': False, 'sideways_strategy': 'mean_reversion', 'sideways_bb_std_mult': 0.7313338711454496, 'sideways_rsi_os': 35, 'sideways_rsi_ob': 71, 'sideways_adx_thresh': 28.0006151313589, 'sideways_atr_min_pct': 0.021201184311145923, 'sideways_atr_max_pct': 0.11399198362211602, 'sideways_tp_mult': 1.819231662229709, 'sideways_tsl_mult': 0.36823536400995277, 'sideways_time_stop': 82, 'sideways_use_sma': True, 'sideways_use_ema': False, 'sideways_use_atr': False, 'sideways_use_adx': True, 'sideways_use_spike': True, 'sideways_rsi_required': True}.
[I 2025-08-30 18:56:40,509] Trial 164 finished with values: [-1000000000.0, 1000000000.0] and parameters: {'p_sma': 29, 'p_std': 27, 'p_atr': 16, 'p_adx': 16, 'rsi_period': 69, 'ema1': 15, 'ema2': 19, 'slip_atr_k': 0.011722473384376153, 'slip_spread_k': 0.09955727476691556, 'spread_hl_frac': 0.0041476200455610795, 'bb_std_mult': 3.5905523533552084, 'rsi_os': 37, 'rsi_ob': 62, 'vol_spike': 0.15570214806628194, 'adx_thresh': 17.875662433249534, 'atr_min_pct': 0.024056526933477613, 'atr_max_pct': 0.04485903036968026, 'tp_mult': 2.2382964675950574, 'tsl_mult': 0.9686841966413502, 'strategy': 'breakout', 'time_stop': 235, 'use_sma': False, 'use_atr': True, 'use_adx': False, 'use_ema': False, 'use_spike': True, 'rsi_required': True, 'edge_k': 1.3734400596628418, 'edge_cap': 0.23579318377638345, 'bull_strategy': 'mean_reversion', 'bull_bb_std_mult': 0.7274020216000221, 'bull_rsi_os': 53, 'bull_rsi_ob': 53, 'bull_adx_thresh': 25.774086440258497, 'bull_atr_min_pct': 0.022790937320196627, 'bull_atr_max_pct': 0.02338431338380749, 'bull_tp_mult': 1.3801825737198419, 'bull_tsl_mult': 0.9758791157964926, 'bull_time_stop': 172, 'bull_use_sma': True, 'bull_use_ema': False, 'bull_use_atr': False, 'bull_use_adx': True, 'bull_use_spike': True, 'bull_rsi_required': True, 'bear_strategy': 'breakout', 'bear_bb_std_mult': 3.300535510656505, 'bear_rsi_os': 40, 'bear_rsi_ob': 85, 'bear_adx_thresh': 8.071643821773218, 'bear_atr_min_pct': 0.015002079642316065, 'bear_atr_max_pct': 0.06564252772153469, 'bear_tp_mult': 1.7206484809508347, 'bear_tsl_mult': 0.11878643113314306, 'bear_time_stop': 10, 'bear_use_sma': True, 'bear_use_ema': True, 'bear_use_atr': True, 'bear_use_adx': True, 'bear_use_spike': False, 'bear_rsi_required': False, 'sideways_strategy': 'breakout', 'sideways_bb_std_mult': 2.0219348578828598, 'sideways_rsi_os': 16, 'sideways_rsi_ob': 57, 'sideways_adx_thresh': 9.314170400363523, 'sideways_atr_min_pct': 0.019584134735072232, 'sideways_atr_max_pct': 0.1241131133690451, 'sideways_tp_mult': 2.500092168536823, 'sideways_tsl_mult': 0.6357512924018889, 'sideways_time_stop': 263, 'sideways_use_sma': False, 'sideways_use_ema': True, 'sideways_use_atr': False, 'sideways_use_adx': False, 'sideways_use_spike': True, 'sideways_rsi_required': False}.
[I 2025-08-30 18:56:40,634] Trial 165 finished with values: [-1000000000.0, 1000000000.0] and parameters: {'p_sma': 38, 'p_std': 48, 'p_atr': 25, 'p_adx': 19, 'rsi_period': 50, 'ema1': 5, 'ema2': 15, 'slip_atr_k': 0.01312271395611124, 'slip_spread_k': 0.10252842772132342, 'spread_hl_frac': 0.003975301502116414, 'bb_std_mult': 0.8897584752421841, 'rsi_os': 7, 'rsi_ob': 62, 'vol_spike': 0.1550122365724496, 'adx_thresh': 26.87775322916766, 'atr_min_pct': 0.023888943367060114, 'atr_max_pct': 0.13237247458756818, 'tp_mult': 2.3290048773492815, 'tsl_mult': 0.5862431245716475, 'strategy': 'breakout', 'time_stop': 124, 'use_sma': False, 'use_atr': False, 'use_adx': False, 'use_ema': False, 'use_spike': True, 'rsi_required': True, 'edge_k': 0.13529582942890309, 'edge_cap': 0.2323392868743213, 'bull_strategy': 'mean_reversion', 'bull_bb_std_mult': 1.7475185331975522, 'bull_rsi_os': 52, 'bull_rsi_ob': 53, 'bull_adx_thresh': 25.870590498729293, 'bull_atr_min_pct': 0.010347450518808782, 'bull_atr_max_pct': 0.06840861346859342, 'bull_tp_mult': 1.7395126121133224, 'bull_tsl_mult': 0.5346778061823567, 'bull_time_stop': 122, 'bull_use_sma': True, 'bull_use_ema': False, 'bull_use_atr': False, 'bull_use_adx': True, 'bull_use_spike': True, 'bull_rsi_required': True, 'bear_strategy': 'breakout', 'bear_bb_std_mult': 3.2998704951908513, 'bear_rsi_os': 50, 'bear_rsi_ob': 85, 'bear_adx_thresh': 6.091833920143854, 'bear_atr_min_pct': 0.014285972355994755, 'bear_atr_max_pct': 0.07512637529934989, 'bear_tp_mult': 1.711785654005875, 'bear_tsl_mult': 0.6635666031352765, 'bear_time_stop': 10, 'bear_use_sma': True, 'bear_use_ema': False, 'bear_use_atr': True, 'bear_use_adx': True, 'bear_use_spike': False, 'bear_rsi_required': False, 'sideways_strategy': 'mean_reversion', 'sideways_bb_std_mult': 2.013182037204438, 'sideways_rsi_os': 35, 'sideways_rsi_ob': 47, 'sideways_adx_thresh': 27.97051516263273, 'sideways_atr_min_pct': 0.021191488392894215, 'sideways_atr_max_pct': 0.12281714262456794, 'sideways_tp_mult': 1.613817697891284, 'sideways_tsl_mult': 0.7066495584892697, 'sideways_time_stop': 263, 'sideways_use_sma': True, 'sideways_use_ema': True, 'sideways_use_atr': False, 'sideways_use_adx': False, 'sideways_use_spike': True, 'sideways_rsi_required': True}.
[I 2025-08-30 18:56:40,913] Trial 166 finished with values: [-1000000000.0, 1000000000.0] and parameters: {'p_sma': 38, 'p_std': 11, 'p_atr': 25, 'p_adx': 26, 'rsi_period': 52, 'ema1': 23, 'ema2': 14, 'slip_atr_k': 0.01815301355756018, 'slip_spread_k': 0.09649859555823426, 'spread_hl_frac': 0.00376212259918058, 'bb_std_mult': 0.8917590490373652, 'rsi_os': 31, 'rsi_ob': 52, 'vol_spike': 0.24742229306077396, 'adx_thresh': 15.48907908599314, 'atr_min_pct': 0.02387802883644656, 'atr_max_pct': 0.04662949012561929, 'tp_mult': 2.1797074421297538, 'tsl_mult': 0.5817829500510912, 'strategy': 'breakout', 'time_stop': 50, 'use_sma': False, 'use_atr': False, 'use_adx': False, 'use_ema': False, 'use_spike': True, 'rsi_required': True, 'edge_k': 0.04872355814639617, 'edge_cap': 0.8766905130858766, 'bull_strategy': 'mean_reversion', 'bull_bb_std_mult': 1.737134664925712, 'bull_rsi_os': 52, 'bull_rsi_ob': 73, 'bull_adx_thresh': 14.431051231533518, 'bull_atr_min_pct': 0.010469584390369692, 'bull_atr_max_pct': 0.10627289951556854, 'bull_tp_mult': 2.2904397518154105, 'bull_tsl_mult': 0.4683789302154641, 'bull_time_stop': 170, 'bull_use_sma': False, 'bull_use_ema': True, 'bull_use_atr': False, 'bull_use_adx': True, 'bull_use_spike': True, 'bull_rsi_required': True, 'bear_strategy': 'breakout', 'bear_bb_std_mult': 3.308433563412627, 'bear_rsi_os': 43, 'bear_rsi_ob': 83, 'bear_adx_thresh': 8.289863698128482, 'bear_atr_min_pct': 0.019703183749281147, 'bear_atr_max_pct': 0.07494797979450586, 'bear_tp_mult': 1.9343077813014022, 'bear_tsl_mult': 0.6484181504155508, 'bear_time_stop': 28, 'bear_use_sma': True, 'bear_use_ema': False, 'bear_use_atr': True, 'bear_use_adx': True, 'bear_use_spike': False, 'bear_rsi_required': False, 'sideways_strategy': 'mean_reversion', 'sideways_bb_std_mult': 2.0075622909069852, 'sideways_rsi_os': 15, 'sideways_rsi_ob': 86, 'sideways_adx_thresh': 10.552572502735895, 'sideways_atr_min_pct': 0.021370520459885696, 'sideways_atr_max_pct': 0.09027902076367986, 'sideways_tp_mult': 1.6851874562424445, 'sideways_tsl_mult': 0.6448791964745582, 'sideways_time_stop': 263, 'sideways_use_sma': True, 'sideways_use_ema': True, 'sideways_use_atr': False, 'sideways_use_adx': True, 'sideways_use_spike': True, 'sideways_rsi_required': True}.
[I 2025-08-30 18:57:13,523] Trial 171 finished with values: [-1000000000.0, 1000000000.0] and parameters: {'p_sma': 41, 'p_std': 28, 'p_atr': 10, 'p_adx': 8, 'rsi_period': 18, 'ema1': 22, 'ema2': 20, 'slip_atr_k': 0.22035460912506483, 'slip_spread_k': 0.41455471636381697, 'spread_hl_frac': 0.04508225857320037, 'bb_std_mult': 1.93348113534306, 'rsi_os': 34, 'rsi_ob': 81, 'vol_spike': 0.036624713089574976, 'adx_thresh': 18.774577733831407, 'atr_min_pct': 0.028090178262597444, 'atr_max_pct': 0.14052548528922473, 'tp_mult': 1.3289804276010784, 'tsl_mult': 0.12074750127615824, 'strategy': 'breakout', 'time_stop': 29, 'use_sma': False, 'use_atr': True, 'use_adx': True, 'use_ema': False, 'use_spike': True, 'rsi_required': True, 'edge_k': 0.19589755347384308, 'edge_cap': 0.6427018867527168, 'bull_strategy': 'mean_reversion', 'bull_bb_std_mult': 1.9299002339131626, 'bull_rsi_os': 28, 'bull_rsi_ob': 45, 'bull_adx_thresh': 25.109243701589776, 'bull_atr_min_pct': 0.026318254277994717, 'bull_atr_max_pct': 0.02927937755015614, 'bull_tp_mult': 2.0799176109077586, 'bull_tsl_mult': 0.1146359069304485, 'bull_time_stop': 46, 'bull_use_sma': True, 'bull_use_ema': False, 'bull_use_atr': True, 'bull_use_adx': False, 'bull_use_spike': True, 'bull_rsi_required': True, 'bear_strategy': 'mean_reversion', 'bear_bb_std_mult': 3.4322675522393578, 'bear_rsi_os': 24, 'bear_rsi_ob': 81, 'bear_adx_thresh': 5.844524926231298, 'bear_atr_min_pct': 0.0255313465725242, 'bear_atr_max_pct': 0.061074799101494145, 'bear_tp_mult': 2.235109533045726, 'bear_tsl_mult': 0.5160180266210029, 'bear_time_stop': 63, 'bear_use_sma': True, 'bear_use_ema': False, 'bear_use_atr': True, 'bear_use_adx': True, 'bear_use_spike': False, 'bear_rsi_required': False, 'sideways_strategy': 'breakout', 'sideways_bb_std_mult': 1.681444779681201, 'sideways_rsi_os': 46, 'sideways_rsi_ob': 60, 'sideways_adx_thresh': 8.145886509523129, 'sideways_atr_min_pct': 0.018271001075810527, 'sideways_atr_max_pct': 0.11759088969722202, 'sideways_tp_mult': 1.8464594142827975, 'sideways_tsl_mult': 0.26613131285242864, 'sideways_time_stop': 100, 'sideways_use_sma': True, 'sideways_use_ema': False, 'sideways_use_atr': False, 'sideways_use_adx': False, 'sideways_use_spike': False, 'sideways_rsi_required': False}.
[I 2025-08-30 18:57:14,465] Trial 170 finished with values: [-1000000000.0, 1000000000.0] and parameters: {'p_sma': 53, 'p_std': 12, 'p_atr': 10, 'p_adx': 26, 'rsi_period': 17, 'ema1': 24, 'ema2': 58, 'slip_atr_k': 0.22247698844290067, 'slip_spread_k': 0.41974019142562025, 'spread_hl_frac': 0.027457820197793813, 'bb_std_mult': 1.8323180226025153, 'rsi_os': 20, 'rsi_ob': 81, 'vol_spike': 0.14008598464797753, 'adx_thresh': 33.26555249116733, 'atr_min_pct': 0.022426183888023383, 'atr_max_pct': 0.14148075729340182, 'tp_mult': 2.1796120348297707, 'tsl_mult': 0.9169125077735758, 'strategy': 'breakout', 'time_stop': 51, 'use_sma': False, 'use_atr': True, 'use_adx': True, 'use_ema': False, 'use_spike': True, 'rsi_required': True, 'edge_k': 0.0986951064408884, 'edge_cap': 0.8715257148259004, 'bull_strategy': 'mean_reversion', 'bull_bb_std_mult': 0.5336777191842903, 'bull_rsi_os': 45, 'bull_rsi_ob': 71, 'bull_adx_thresh': 19.412798900461148, 'bull_atr_min_pct': 0.0011276842076744955, 'bull_atr_max_pct': 0.030402096667589126, 'bull_tp_mult': 2.2824220885699944, 'bull_tsl_mult': 0.13186136554246686, 'bull_time_stop': 47, 'bull_use_sma': False, 'bull_use_ema': True, 'bull_use_atr': True, 'bull_use_adx': False, 'bull_use_spike': True, 'bull_rsi_required': True, 'bear_strategy': 'mean_reversion', 'bear_bb_std_mult': 0.5919338408322283, 'bear_rsi_os': 43, 'bear_rsi_ob': 83, 'bear_adx_thresh': 24.68150107502106, 'bear_atr_min_pct': 0.028888134346289916, 'bear_atr_max_pct': 0.07042696752887162, 'bear_tp_mult': 1.7906073324421048, 'bear_tsl_mult': 0.19033188012569321, 'bear_time_stop': 41, 'bear_use_sma': True, 'bear_use_ema': False, 'bear_use_atr': True, 'bear_use_adx': True, 'bear_use_spike': False, 'bear_rsi_required': False, 'sideways_strategy': 'breakout', 'sideways_bb_std_mult': 0.9511985539475152, 'sideways_rsi_os': 15, 'sideways_rsi_ob': 65, 'sideways_adx_thresh': 24.723155689802354, 'sideways_atr_min_pct': 0.018440668424353077, 'sideways_atr_max_pct': 0.09152360156470321, 'sideways_tp_mult': 1.6874705963252863, 'sideways_tsl_mult': 0.24218298573387187, 'sideways_time_stop': 279, 'sideways_use_sma': True, 'sideways_use_ema': True, 'sideways_use_atr': False, 'sideways_use_adx': True, 'sideways_use_spike': False, 'sideways_rsi_required': False}.
[I 2025-08-30 18:57:14,620] Trial 169 finished with values: [-1000000000.0, 1000000000.0] and parameters: {'p_sma': 23, 'p_std': 28, 'p_atr': 25, 'p_adx': 26, 'rsi_period': 18, 'ema1': 22, 'ema2': 20, 'slip_atr_k': 0.1846865399457408, 'slip_spread_k': 0.8682070007511737, 'spread_hl_frac': 0.0006697567447373487, 'bb_std_mult': 2.1476779423233627, 'rsi_os': 19, 'rsi_ob': 56, 'vol_spike': 0.16862379748985343, 'adx_thresh': 32.61809237488235, 'atr_min_pct': 0.028129853135411595, 'atr_max_pct': 0.140500352156434, 'tp_mult': 2.893410303208997, 'tsl_mult': 0.03003830599323437, 'strategy': 'breakout', 'time_stop': 50, 'use_sma': False, 'use_atr': False, 'use_adx': True, 'use_ema': False, 'use_spike': True, 'rsi_required': True, 'edge_k': 0.10074733794145439, 'edge_cap': 0.6875601798567939, 'bull_strategy': 'mean_reversion', 'bull_bb_std_mult': 1.9365757072845502, 'bull_rsi_os': 52, 'bull_rsi_ob': 75, 'bull_adx_thresh': 19.051178721114592, 'bull_atr_min_pct': 0.026299366663569912, 'bull_atr_max_pct': 0.13383785668571435, 'bull_tp_mult': 1.6052343664563207, 'bull_tsl_mult': 0.12215388980389508, 'bull_time_stop': 184, 'bull_use_sma': False, 'bull_use_ema': True, 'bull_use_atr': False, 'bull_use_adx': False, 'bull_use_spike': True, 'bull_rsi_required': True, 'bear_strategy': 'breakout', 'bear_bb_std_mult': 1.3571448673938895, 'bear_rsi_os': 43, 'bear_rsi_ob': 81, 'bear_adx_thresh': 5.6802051033889525, 'bear_atr_min_pct': 0.014306789045598806, 'bear_atr_max_pct': 0.061030433732259415, 'bear_tp_mult': 1.8024919394514158, 'bear_tsl_mult': 0.47279390598361076, 'bear_time_stop': 42, 'bear_use_sma': True, 'bear_use_ema': False, 'bear_use_atr': True, 'bear_use_adx': True, 'bear_use_spike': False, 'bear_rsi_required': False, 'sideways_strategy': 'mean_reversion', 'sideways_bb_std_mult': 1.996945399464892, 'sideways_rsi_os': 16, 'sideways_rsi_ob': 65, 'sideways_adx_thresh': 14.920862919866007, 'sideways_atr_min_pct': 0.018031732247070855, 'sideways_atr_max_pct': 0.03744226743985284, 'sideways_tp_mult': 1.6868147493132186, 'sideways_tsl_mult': 0.5468936265676796, 'sideways_time_stop': 281, 'sideways_use_sma': True, 'sideways_use_ema': True, 'sideways_use_atr': False, 'sideways_use_adx': True, 'sideways_use_spike': False, 'sideways_rsi_required': True}.
