[I 2025-08-30 20:23:10,423] Trial 801 finished with values: [-1000000000.0, 1000000000.0] and parameters: {'p_sma': 38, 'p_std': 41, 'p_atr': 10, 'p_adx': 15, 'rsi_period': 54, 'ema1': 24, 'ema2': 18, 'slip_atr_k': 0.009717959594526935, 'slip_spread_k': 0.42717966507700894, 'spread_hl_frac': 0.02030889319440008, 'bb_std_mult': 0.9223090307138556, 'rsi_os': 38, 'rsi_ob': 83, 'vol_spike': 0.05049725259308542, 'adx_thresh': 7.5636069097011145, 'atr_min_pct': 0.0007662893983119198, 'atr_max_pct': 0.14450867264567227, 'tp_mult': 1.1744741358908997, 'tsl_mult': 0.5467641434031242, 'strategy': 'breakout', 'time_stop': 41, 'use_sma': False, 'use_atr': True, 'use_adx': False, 'use_ema': True, 'use_spike': False, 'rsi_required': True, 'edge_k': 1.4373985216892935, 'edge_cap': 0.24367667545888624, 'bull_strategy': 'mean_reversion', 'bull_bb_std_mult': 1.9002730857285839, 'bull_rsi_os': 41, 'bull_rsi_ob': 85, 'bull_adx_thresh': 14.366448954965563, 'bull_atr_min_pct': 0.029993474756786966, 'bull_atr_max_pct': 0.027315761847380146, 'bull_tp_mult': 2.047950785809032, 'bull_tsl_mult': 0.9669734089267992, 'bull_time_stop': 187, 'bull_use_sma': False, 'bull_use_ema': False, 'bull_use_atr': False, 'bull_use_adx': False, 'bull_use_spike': True, 'bull_rsi_required': False, 'bear_strategy': 'mean_reversion', 'bear_bb_std_mult': 2.813410926581208, 'bear_rsi_os': 45, 'bear_rsi_ob': 82, 'bear_adx_thresh': 5.8512551876536145, 'bear_atr_min_pct': 0.014392842302434095, 'bear_atr_max_pct': 0.11655970687252223, 'bear_tp_mult': 1.8076081203477328, 'bear_tsl_mult': 0.4645288300772274, 'bear_time_stop': 39, 'bear_use_sma': True, 'bear_use_ema': False, 'bear_use_atr': True, 'bear_use_adx': True, 'bear_use_spike': True, 'bear_rsi_required': False, 'sideways_strategy': 'breakout', 'sideways_bb_std_mult': 2.1266201011900305, 'sideways_rsi_os': 25, 'sideways_rsi_ob': 57, 'sideways_adx_thresh': 8.537065827777024, 'sideways_atr_min_pct': 0.020597582471584552, 'sideways_atr_max_pct': 0.028744467389504154, 'sideways_tp_mult': 1.3993062294918555, 'sideways_tsl_mult': 0.3546149046348406, 'sideways_time_stop': 170, 'sideways_use_sma': True, 'sideways_use_ema': True, 'sideways_use_atr': False, 'sideways_use_adx': True, 'sideways_use_spike': False, 'sideways_rsi_required': False}.
[I 2025-08-30 20:23:10,621] Trial 802 finished with values: [-1000000000.0, 1000000000.0] and parameters: {'p_sma': 38, 'p_std': 27, 'p_atr': 10, 'p_adx': 9, 'rsi_period': 53, 'ema1': 24, 'ema2': 55, 'slip_atr_k': 0.11544880016436986, 'slip_spread_k': 0.8249732161426913, 'spread_hl_frac': 0.031250259629874405, 'bb_std_mult': 1.9917896029137443, 'rsi_os': 38, 'rsi_ob': 57, 'vol_spike': 0.05113773801434101, 'adx_thresh': 33.53615176818589, 'atr_min_pct': 0.022818259574540797, 'atr_max_pct': 0.1446127245774211, 'tp_mult': 2.1151999876639884, 'tsl_mult': 0.7464137464946297, 'strategy': 'breakout', 'time_stop': 47, 'use_sma': False, 'use_atr': True, 'use_adx': True, 'use_ema': True, 'use_spike': False, 'rsi_required': True, 'edge_k': 0.061472306820386374, 'edge_cap': 0.47854301050146997, 'bull_strategy': 'mean_reversion', 'bull_bb_std_mult': 2.2418529085063064, 'bull_rsi_os': 41, 'bull_rsi_ob': 85, 'bull_adx_thresh': 26.737586846627423, 'bull_atr_min_pct': 0.0033154932263854105, 'bull_atr_max_pct': 0.10571772671746832, 'bull_tp_mult': 1.7798667179130792, 'bull_tsl_mult': 0.9990675047314082, 'bull_time_stop': 188, 'bull_use_sma': True, 'bull_use_ema': False, 'bull_use_atr': False, 'bull_use_adx': False, 'bull_use_spike': True, 'bull_rsi_required': False, 'bear_strategy': 'mean_reversion', 'bear_bb_std_mult': 2.8992904274979825, 'bear_rsi_os': 10, 'bear_rsi_ob': 82, 'bear_adx_thresh': 6.147038491875937, 'bear_atr_min_pct': 0.0221051812217754, 'bear_atr_max_pct': 0.1390184193290708, 'bear_tp_mult': 2.382557791238561, 'bear_tsl_mult': 0.09602098312072613, 'bear_time_stop': 37, 'bear_use_sma': True, 'bear_use_ema': False, 'bear_use_atr': True, 'bear_use_adx': True, 'bear_use_spike': True, 'bear_rsi_required': True, 'sideways_strategy': 'mean_reversion', 'sideways_bb_std_mult': 2.1608485247419518, 'sideways_rsi_os': 40, 'sideways_rsi_ob': 58, 'sideways_adx_thresh': 11.79595724146041, 'sideways_atr_min_pct': 0.00346833087718877, 'sideways_atr_max_pct': 0.040115496310418476, 'sideways_tp_mult': 2.89384541438735, 'sideways_tsl_mult': 0.1958552404675063, 'sideways_time_stop': 117, 'sideways_use_sma': False, 'sideways_use_ema': True, 'sideways_use_atr': False, 'sideways_use_adx': False, 'sideways_use_spike': False, 'sideways_rsi_required': True}.
[I 2025-08-30 20:23:10,713] Trial 803 finished with values: [-1000000000.0, 1000000000.0] and parameters: {'p_sma': 30, 'p_std': 28, 'p_atr': 10, 'p_adx': 21, 'rsi_period': 53, 'ema1': 8, 'ema2': 19, 'slip_atr_k': 0.02586721395719784, 'slip_spread_k': 0.8334543001428187, 'spread_hl_frac': 0.005468909708237232, 'bb_std_mult': 2.797247040202328, 'rsi_os': 15, 'rsi_ob': 57, 'vol_spike': 0.18969490355576016, 'adx_thresh': 17.474160888888775, 'atr_min_pct': 0.02235896736852622, 'atr_max_pct': 0.03143574557128837, 'tp_mult': 2.1148408803111485, 'tsl_mult': 0.7330150003140685, 'strategy': 'mean_reversion', 'time_stop': 45, 'use_sma': False, 'use_atr': True, 'use_adx': True, 'use_ema': True, 'use_spike': False, 'rsi_required': False, 'edge_k': 1.7437232304019998, 'edge_cap': 0.6446493824018348, 'bull_strategy': 'mean_reversion', 'bull_bb_std_mult': 0.714157054116914, 'bull_rsi_os': 28, 'bull_rsi_ob': 72, 'bull_adx_thresh': 26.591606657898982, 'bull_atr_min_pct': 0.008058603952785676, 'bull_atr_max_pct': 0.022331547568941047, 'bull_tp_mult': 1.7822161295163592, 'bull_tsl_mult': 0.9642875537122076, 'bull_time_stop': 181, 'bull_use_sma': True, 'bull_use_ema': False, 'bull_use_atr': False, 'bull_use_adx': False, 'bull_use_spike': True, 'bull_rsi_required': False, 'bear_strategy': 'mean_reversion', 'bear_bb_std_mult': 3.426661755308159, 'bear_rsi_os': 45, 'bear_rsi_ob': 82, 'bear_adx_thresh': 6.250852444360959, 'bear_atr_min_pct': 0.01269179489034137, 'bear_atr_max_pct': 0.10323797817019084, 'bear_tp_mult': 2.376601840242675, 'bear_tsl_mult': 0.10272454933739773, 'bear_time_stop': 38, 'bear_use_sma': True, 'bear_use_ema': False, 'bear_use_atr': True, 'bear_use_adx': True, 'bear_use_spike': True, 'bear_rsi_required': True, 'sideways_strategy': 'mean_reversion', 'sideways_bb_std_mult': 2.170846130322782, 'sideways_rsi_os': 25, 'sideways_rsi_ob': 61, 'sideways_adx_thresh': 8.3713952025747, 'sideways_atr_min_pct': 0.005958770541646745, 'sideways_atr_max_pct': 0.10181279828970188, 'sideways_tp_mult': 1.8630535395423113, 'sideways_tsl_mult': 0.41936844531502326, 'sideways_time_stop': 29, 'sideways_use_sma': False, 'sideways_use_ema': True, 'sideways_use_atr': False, 'sideways_use_adx': False, 'sideways_use_spike': False, 'sideways_rsi_required': True}.
[I 2025-08-30 20:23:11,693] Trial 806 finished with values: [-1000000000.0, 1000000000.0] and parameters: {'p_sma': 22, 'p_std': 21, 'p_atr': 20, 'p_adx': 13, 'rsi_period': 78, 'ema1': 16, 'ema2': 29, 'slip_atr_k': 0.016610218358064272, 'slip_spread_k': 0.38686751427905514, 'spread_hl_frac': 0.00213670563421778, 'bb_std_mult': 2.0888874747455866, 'rsi_os': 52, 'rsi_ob': 69, 'vol_spike': 0.04184469061472845, 'adx_thresh': 20.528603481594118, 'atr_min_pct': 0.023745946115885454, 'atr_max_pct': 0.13177770351713738, 'tp_mult': 2.6266969343387765, 'tsl_mult': 0.7596205617919118, 'strategy': 'mean_reversion', 'time_stop': 24, 'use_sma': False, 'use_atr': True, 'use_adx': False, 'use_ema': False, 'use_spike': True, 'rsi_required': False, 'edge_k': 0.09722132299470775, 'edge_cap': 0.7948603604107936, 'bull_strategy': 'mean_reversion', 'bull_bb_std_mult': 1.0722586583304095, 'bull_rsi_os': 49, 'bull_rsi_ob': 74, 'bull_adx_thresh': 24.342736309343774, 'bull_atr_min_pct': 0.0021099355659929156, 'bull_atr_max_pct': 0.03088697297544544, 'bull_tp_mult': 2.1954283739615645, 'bull_tsl_mult': 0.9786337055702754, 'bull_time_stop': 112, 'bull_use_sma': True, 'bull_use_ema': False, 'bull_use_atr': False, 'bull_use_adx': True, 'bull_use_spike': True, 'bull_rsi_required': True, 'bear_strategy': 'breakout', 'bear_bb_std_mult': 0.5040082762650251, 'bear_rsi_os': 55, 'bear_rsi_ob': 69, 'bear_adx_thresh': 30.823317962916562, 'bear_atr_min_pct': 0.01526310896310474, 'bear_atr_max_pct': 0.10676294262819626, 'bear_tp_mult': 2.000236727010469, 'bear_tsl_mult': 0.3062786904338903, 'bear_time_stop': 31, 'bear_use_sma': True, 'bear_use_ema': False, 'bear_use_atr': True, 'bear_use_adx': True, 'bear_use_spike': False, 'bear_rsi_required': False, 'sideways_strategy': 'breakout', 'sideways_bb_std_mult': 1.9180354111210498, 'sideways_rsi_os': 17, 'sideways_rsi_ob': 58, 'sideways_adx_thresh': 9.168368690373534, 'sideways_atr_min_pct': 0.018207475342976783, 'sideways_atr_max_pct': 0.022651136595166696, 'sideways_tp_mult': 1.9166599726814746, 'sideways_tsl_mult': 0.04822825471916942, 'sideways_time_stop': 42, 'sideways_use_sma': True, 'sideways_use_ema': True, 'sideways_use_atr': False, 'sideways_use_adx': False, 'sideways_use_spike': False, 'sideways_rsi_required': False}.
[I 2025-08-30 20:23:44,110] Trial 805 finished with values: [-1000000000.0, 1000000000.0] and parameters: {'p_sma': 48, 'p_std': 31, 'p_atr': 22, 'p_adx': 9, 'rsi_period': 78, 'ema1': 23, 'ema2': 19, 'slip_atr_k': 0.024297183094169995, 'slip_spread_k': 0.4593245557053848, 'spread_hl_frac': 0.002185951750114975, 'bb_std_mult': 0.9951272818507861, 'rsi_os': 35, 'rsi_ob': 69, 'vol_spike': 0.2483251269501181, 'adx_thresh': 17.841686875048673, 'atr_min_pct': 0.022047910993138752, 'atr_max_pct': 0.053136587629902365, 'tp_mult': 2.81963115049567, 'tsl_mult': 0.7580608295802822, 'strategy': 'mean_reversion', 'time_stop': 17, 'use_sma': False, 'use_atr': True, 'use_adx': True, 'use_ema': True, 'use_spike': False, 'rsi_required': False, 'edge_k': 0.4007658596901075, 'edge_cap': 0.6869073540013476, 'bull_strategy': 'mean_reversion', 'bull_bb_std_mult': 1.808664880267276, 'bull_rsi_os': 12, 'bull_rsi_ob': 88, 'bull_adx_thresh': 26.324364150856674, 'bull_atr_min_pct': 0.02020471188934651, 'bull_atr_max_pct': 0.10534018190184358, 'bull_tp_mult': 2.9960653909497816, 'bull_tsl_mult': 0.9777479785318978, 'bull_time_stop': 171, 'bull_use_sma': True, 'bull_use_ema': False, 'bull_use_atr': False, 'bull_use_adx': False, 'bull_use_spike': True, 'bull_rsi_required': False, 'bear_strategy': 'mean_reversion', 'bear_bb_std_mult': 1.320328737442029, 'bear_rsi_os': 42, 'bear_rsi_ob': 61, 'bear_adx_thresh': 30.271015643187432, 'bear_atr_min_pct': 0.015489232884805528, 'bear_atr_max_pct': 0.022967076825536073, 'bear_tp_mult': 1.20212641419809, 'bear_tsl_mult': 0.10367201646533725, 'bear_time_stop': 72, 'bear_use_sma': True, 'bear_use_ema': False, 'bear_use_atr': True, 'bear_use_adx': True, 'bear_use_spike': False, 'bear_rsi_required': True, 'sideways_strategy': 'mean_reversion', 'sideways_bb_std_mult': 1.9029268434463567, 'sideways_rsi_os': 7, 'sideways_rsi_ob': 58, 'sideways_adx_thresh': 11.969925405672258, 'sideways_atr_min_pct': 0.018112363422248434, 'sideways_atr_max_pct': 0.12019059456460054, 'sideways_tp_mult': 2.895573580205546, 'sideways_tsl_mult': 0.6984503193737299, 'sideways_time_stop': 259, 'sideways_use_sma': False, 'sideways_use_ema': True, 'sideways_use_atr': False, 'sideways_use_adx': False, 'sideways_use_spike': False, 'sideways_rsi_required': True}.
[I 2025-08-30 20:23:44,741] Trial 804 finished with values: [-1000000000.0, 1000000000.0] and parameters: {'p_sma': 48, 'p_std': 28, 'p_atr': 22, 'p_adx': 10, 'rsi_period': 51, 'ema1': 24, 'ema2': 18, 'slip_atr_k': 0.01600143673821195, 'slip_spread_k': 0.5445973853627207, 'spread_hl_frac': 0.01918356021233969, 'bb_std_mult': 1.9805693135678495, 'rsi_os': 15, 'rsi_ob': 57, 'vol_spike': 0.05317207440515057, 'adx_thresh': 8.815353345465553, 'atr_min_pct': 0.022690839008263897, 'atr_max_pct': 0.11338054379255771, 'tp_mult': 2.2129273740157656, 'tsl_mult': 0.744494362766168, 'strategy': 'mean_reversion', 'time_stop': 15, 'use_sma': False, 'use_atr': True, 'use_adx': True, 'use_ema': True, 'use_spike': False, 'rsi_required': False, 'edge_k': 1.298489245265619, 'edge_cap': 0.24308451068744602, 'bull_strategy': 'mean_reversion', 'bull_bb_std_mult': 1.586132251089124, 'bull_rsi_os': 5, 'bull_rsi_ob': 75, 'bull_adx_thresh': 26.6167347920236, 'bull_atr_min_pct': 0.003093080345527263, 'bull_atr_max_pct': 0.027203199650061346, 'bull_tp_mult': 1.0315338580905422, 'bull_tsl_mult': 0.9806064827457941, 'bull_time_stop': 181, 'bull_use_sma': True, 'bull_use_ema': False, 'bull_use_atr': False, 'bull_use_adx': False, 'bull_use_spike': True, 'bull_rsi_required': False, 'bear_strategy': 'mean_reversion', 'bear_bb_std_mult': 3.165262020134249, 'bear_rsi_os': 54, 'bear_rsi_ob': 82, 'bear_adx_thresh': 5.6901728331175505, 'bear_atr_min_pct': 0.015466885899464647, 'bear_atr_max_pct': 0.05060071501338077, 'bear_tp_mult': 2.391000762723158, 'bear_tsl_mult': 0.09914870869454606, 'bear_time_stop': 30, 'bear_use_sma': True, 'bear_use_ema': False, 'bear_use_atr': True, 'bear_use_adx': True, 'bear_use_spike': True, 'bear_rsi_required': True, 'sideways_strategy': 'mean_reversion', 'sideways_bb_std_mult': 1.895422004976861, 'sideways_rsi_os': 12, 'sideways_rsi_ob': 57, 'sideways_adx_thresh': 11.859055268173698, 'sideways_atr_min_pct': 0.0197182200285254, 'sideways_atr_max_pct': 0.1129509074031185, 'sideways_tp_mult': 1.904314313923557, 'sideways_tsl_mult': 0.7015783598555575, 'sideways_time_stop': 259, 'sideways_use_sma': False, 'sideways_use_ema': True, 'sideways_use_atr': False, 'sideways_use_adx': False, 'sideways_use_spike': False, 'sideways_rsi_required': True}.
[I 2025-08-30 20:23:44,877] Trial 807 finished with values: [-0.03246151150848797, 0.032390007095678436] and parameters: {'p_sma': 48, 'p_std': 22, 'p_atr': 20, 'p_adx': 8, 'rsi_period': 48, 'ema1': 23, 'ema2': 12, 'slip_atr_k': 0.07298205892820636, 'slip_spread_k': 0.3821107266783002, 'spread_hl_frac': 0.001820576766620678, 'bb_std_mult': 2.074649087258948, 'rsi_os': 35, 'rsi_ob': 69, 'vol_spike': 0.10320095678027166, 'adx_thresh': 8.696381648984094, 'atr_min_pct': 0.023658957079596532, 'atr_max_pct': 0.04321329563705554, 'tp_mult': 1.5675241187531328, 'tsl_mult': 0.5892517208460429, 'strategy': 'mean_reversion', 'time_stop': 27, 'use_sma': False, 'use_atr': True, 'use_adx': False, 'use_ema': False, 'use_spike': True, 'rsi_required': False, 'edge_k': 0.09348475309290852, 'edge_cap': 0.14932492999728902, 'bull_strategy': 'mean_reversion', 'bull_bb_std_mult': 1.0700308135539567, 'bull_rsi_os': 49, 'bull_rsi_ob': 74, 'bull_adx_thresh': 24.28860991468299, 'bull_atr_min_pct': 0.0015559452386252576, 'bull_atr_max_pct': 0.032551589542795384, 'bull_tp_mult': 1.6351122110025305, 'bull_tsl_mult': 0.9818995014287298, 'bull_time_stop': 170, 'bull_use_sma': True, 'bull_use_ema': False, 'bull_use_atr': False, 'bull_use_adx': True, 'bull_use_spike': True, 'bull_rsi_required': True, 'bear_strategy': 'breakout', 'bear_bb_std_mult': 3.1499832573310176, 'bear_rsi_os': 42, 'bear_rsi_ob': 84, 'bear_adx_thresh': 30.638149043254355, 'bear_atr_min_pct': 0.015802685995191162, 'bear_atr_max_pct': 0.050136466211477715, 'bear_tp_mult': 1.6300438975054905, 'bear_tsl_mult': 0.6786205529619064, 'bear_time_stop': 51, 'bear_use_sma': True, 'bear_use_ema': False, 'bear_use_atr': True, 'bear_use_adx': True, 'bear_use_spike': False, 'bear_rsi_required': False, 'sideways_strategy': 'breakout', 'sideways_bb_std_mult': 1.7278839020515526, 'sideways_rsi_os': 17, 'sideways_rsi_ob': 58, 'sideways_adx_thresh': 22.81208532980965, 'sideways_atr_min_pct': 0.01800429476658509, 'sideways_atr_max_pct': 0.08296536759646284, 'sideways_tp_mult': 1.7608922756640715, 'sideways_tsl_mult': 0.6970693457325288, 'sideways_time_stop': 256, 'sideways_use_sma': True, 'sideways_use_ema': True, 'sideways_use_atr': False, 'sideways_use_adx': False, 'sideways_use_spike': False, 'sideways_rsi_required': False}.
[I 2025-08-30 20:23:46,544] Trial 808 finished with values: [-0.024746733581333724, 0.024639727278889766] and parameters: {'p_sma': 35, 'p_std': 25, 'p_atr': 9, 'p_adx': 10, 'rsi_period': 56, 'ema1': 24, 'ema2': 12, 'slip_atr_k': 0.1518986589721812, 'slip_spread_k': 0.45435619867955496, 'spread_hl_frac': 0.008989697821854256, 'bb_std_mult': 0.9953863049238116, 'rsi_os': 35, 'rsi_ob': 93, 'vol_spike': 0.14704384129331033, 'adx_thresh': 19.126057434964146, 'atr_min_pct': 0.008492381343165507, 'atr_max_pct': 0.024866691330065055, 'tp_mult': 2.2120216082645836, 'tsl_mult': 0.06538910756700206, 'strategy': 'breakout', 'time_stop': 122, 'use_sma': False, 'use_atr': True, 'use_adx': False, 'use_ema': False, 'use_spike': True, 'rsi_required': True, 'edge_k': 0.8315584684671772, 'edge_cap': 0.1457387144926261, 'bull_strategy': 'mean_reversion', 'bull_bb_std_mult': 1.8069166475849794, 'bull_rsi_os': 51, 'bull_rsi_ob': 71, 'bull_adx_thresh': 27.993668631877508, 'bull_atr_min_pct': 0.0016327560012447018, 'bull_atr_max_pct': 0.07554855072546689, 'bull_tp_mult': 2.526434049142486, 'bull_tsl_mult': 0.983139366408354, 'bull_time_stop': 180, 'bull_use_sma': True, 'bull_use_ema': False, 'bull_use_atr': True, 'bull_use_adx': True, 'bull_use_spike': True, 'bull_rsi_required': True, 'bear_strategy': 'breakout', 'bear_bb_std_mult': 3.151162621884871, 'bear_rsi_os': 42, 'bear_rsi_ob': 61, 'bear_adx_thresh': 29.700218226635286, 'bear_atr_min_pct': 0.015502629785522762, 'bear_atr_max_pct': 0.08196043983644545, 'bear_tp_mult': 1.739085695976343, 'bear_tsl_mult': 0.5005777623079114, 'bear_time_stop': 126, 'bear_use_sma': True, 'bear_use_ema': True, 'bear_use_atr': True, 'bear_use_adx': True, 'bear_use_spike': False, 'bear_rsi_required': False, 'sideways_strategy': 'breakout', 'sideways_bb_std_mult': 3.0247989636560693, 'sideways_rsi_os': 48, 'sideways_rsi_ob': 56, 'sideways_adx_thresh': 6.27475181029912, 'sideways_atr_min_pct': 0.0193113516200602, 'sideways_atr_max_pct': 0.03306599788454736, 'sideways_tp_mult': 1.7713487971000983, 'sideways_tsl_mult': 0.5719835510393371, 'sideways_time_stop': 61, 'sideways_use_sma': True, 'sideways_use_ema': True, 'sideways_use_atr': True, 'sideways_use_adx': False, 'sideways_use_spike': False, 'sideways_rsi_required': False}.
[I 2025-08-30 20:24:23,502] Trial 812 finished with values: [-1000000000.0, 1000000000.0] and parameters: {'p_sma': 33, 'p_std': 15, 'p_atr': 13, 'p_adx': 8, 'rsi_period': 62, 'ema1': 28, 'ema2': 17, 'slip_atr_k': 0.06548390569064481, 'slip_spread_k': 0.9297302194556069, 'spread_hl_frac': 0.010278951487358898, 'bb_std_mult': 2.4727874149750306, 'rsi_os': 37, 'rsi_ob': 46, 'vol_spike': 0.03112780693743512, 'adx_thresh': 18.618669629065828, 'atr_min_pct': 0.025704029083912755, 'atr_max_pct': 0.047074070497782394, 'tp_mult': 2.260414020666169, 'tsl_mult': 0.7154192224251984, 'strategy': 'breakout', 'time_stop': 8, 'use_sma': True, 'use_atr': False, 'use_adx': False, 'use_ema': False, 'use_spike': True, 'rsi_required': True, 'edge_k': 1.1683382313418753, 'edge_cap': 0.1976313075915017, 'bull_strategy': 'breakout', 'bull_bb_std_mult': 1.673209362617679, 'bull_rsi_os': 8, 'bull_rsi_ob': 48, 'bull_adx_thresh': 28.927639835551716, 'bull_atr_min_pct': 0.0061850183744615525, 'bull_atr_max_pct': 0.02267512809336684, 'bull_tp_mult': 1.9550514723609014, 'bull_tsl_mult': 0.9419485244592739, 'bull_time_stop': 56, 'bull_use_sma': True, 'bull_use_ema': True, 'bull_use_atr': True, 'bull_use_adx': True, 'bull_use_spike': False, 'bull_rsi_required': True, 'bear_strategy': 'breakout', 'bear_bb_std_mult': 3.321867982144158, 'bear_rsi_os': 45, 'bear_rsi_ob': 81, 'bear_adx_thresh': 10.197277174042366, 'bear_atr_min_pct': 0.02448540533735974, 'bear_atr_max_pct': 0.07061930180502081, 'bear_tp_mult': 2.7665564956515682, 'bear_tsl_mult': 0.1583871172578622, 'bear_time_stop': 19, 'bear_use_sma': False, 'bear_use_ema': True, 'bear_use_atr': False, 'bear_use_adx': False, 'bear_use_spike': False, 'bear_rsi_required': False, 'sideways_strategy': 'breakout', 'sideways_bb_std_mult': 1.9899988791550915, 'sideways_rsi_os': 22, 'sideways_rsi_ob': 65, 'sideways_adx_thresh': 13.492554937276703, 'sideways_atr_min_pct': 0.0021629019752876857, 'sideways_atr_max_pct': 0.07118593903637187, 'sideways_tp_mult': 1.8489830891771972, 'sideways_tsl_mult': 0.6701755660956935, 'sideways_time_stop': 204, 'sideways_use_sma': True, 'sideways_use_ema': False, 'sideways_use_atr': True, 'sideways_use_adx': False, 'sideways_use_spike': True, 'sideways_rsi_required': False}.
