[I 2025-08-30 20:17:16,895] Trial 759 finished with values: [-1000000000.0, 1000000000.0] and parameters: {'p_sma': 38, 'p_std': 26, 'p_atr': 9, 'p_adx': 15, 'rsi_period': 16, 'ema1': 24, 'ema2': 15, 'slip_atr_k': 0.040170748354451336, 'slip_spread_k': 0.14333407682006621, 'spread_hl_frac': 0.027022117703950754, 'bb_std_mult': 1.0696472905119125, 'rsi_os': 37, 'rsi_ob': 60, 'vol_spike': 0.03072180442673284, 'adx_thresh': 22.577065900365923, 'atr_min_pct': 0.0231785693425925, 'atr_max_pct': 0.04486706416578607, 'tp_mult': 2.7772532267405965, 'tsl_mult': 0.8500575762370881, 'strategy': 'breakout', 'time_stop': 21, 'use_sma': True, 'use_atr': False, 'use_adx': False, 'use_ema': False, 'use_spike': True, 'rsi_required': True, 'edge_k': 0.17983232282422656, 'edge_cap': 0.26056526456796797, 'bull_strategy': 'mean_reversion', 'bull_bb_std_mult': 1.5835218562778997, 'bull_rsi_os': 17, 'bull_rsi_ob': 45, 'bull_adx_thresh': 8.079896682525282, 'bull_atr_min_pct': 0.0058444638544786764, 'bull_atr_max_pct': 0.1254018767562749, 'bull_tp_mult': 1.3285011740899164, 'bull_tsl_mult': 0.9323245425394545, 'bull_time_stop': 180, 'bull_use_sma': True, 'bull_use_ema': True, 'bull_use_atr': False, 'bull_use_adx': True, 'bull_use_spike': False, 'bull_rsi_required': True, 'bear_strategy': 'breakout', 'bear_bb_std_mult': 3.160717648042772, 'bear_rsi_os': 21, 'bear_rsi_ob': 86, 'bear_adx_thresh': 6.489877122348958, 'bear_atr_min_pct': 0.014253894856395404, 'bear_atr_max_pct': 0.1276154801416285, 'bear_tp_mult': 1.7496308335983652, 'bear_tsl_mult': 0.7176839719777226, 'bear_time_stop': 44, 'bear_use_sma': False, 'bear_use_ema': False, 'bear_use_atr': False, 'bear_use_adx': False, 'bear_use_spike': False, 'bear_rsi_required': False, 'sideways_strategy': 'mean_reversion', 'sideways_bb_std_mult': 2.1267557665895716, 'sideways_rsi_os': 14, 'sideways_rsi_ob': 57, 'sideways_adx_thresh': 26.625822224110056, 'sideways_atr_min_pct': 0.020670421975831625, 'sideways_atr_max_pct': 0.11448518399952527, 'sideways_tp_mult': 1.9490399551446407, 'sideways_tsl_mult': 0.7598352253327133, 'sideways_time_stop': 230, 'sideways_use_sma': False, 'sideways_use_ema': False, 'sideways_use_atr': False, 'sideways_use_adx': False, 'sideways_use_spike': True, 'sideways_rsi_required': True}.
[I 2025-08-30 20:17:17,297] Trial 757 finished with values: [-1000000000.0, 1000000000.0] and parameters: {'p_sma': 47, 'p_std': 26, 'p_atr': 28, 'p_adx': 7, 'rsi_period': 51, 'ema1': 12, 'ema2': 15, 'slip_atr_k': 0.025817542957881114, 'slip_spread_k': 0.7540453427940529, 'spread_hl_frac': 0.02683202609313158, 'bb_std_mult': 1.0347707914252828, 'rsi_os': 34, 'rsi_ob': 78, 'vol_spike': 0.016935377546478007, 'adx_thresh': 22.74235636249636, 'atr_min_pct': 0.023264055857016033, 'atr_max_pct': 0.14677347701494445, 'tp_mult': 2.13888266079584, 'tsl_mult': 0.39839926482515886, 'strategy': 'breakout', 'time_stop': 21, 'use_sma': False, 'use_atr': True, 'use_adx': False, 'use_ema': False, 'use_spike': True, 'rsi_required': True, 'edge_k': 0.05533139780441522, 'edge_cap': 0.258420641014233, 'bull_strategy': 'mean_reversion', 'bull_bb_std_mult': 1.8608669719295192, 'bull_rsi_os': 22, 'bull_rsi_ob': 73, 'bull_adx_thresh': 26.295185175011284, 'bull_atr_min_pct': 0.0029485443993343395, 'bull_atr_max_pct': 0.13892151233352035, 'bull_tp_mult': 1.678093130752495, 'bull_tsl_mult': 0.9312337195272421, 'bull_time_stop': 218, 'bull_use_sma': True, 'bull_use_ema': False, 'bull_use_atr': False, 'bull_use_adx': True, 'bull_use_spike': True, 'bull_rsi_required': True, 'bear_strategy': 'breakout', 'bear_bb_std_mult': 0.6231983753721981, 'bear_rsi_os': 44, 'bear_rsi_ob': 94, 'bear_adx_thresh': 6.433894448706843, 'bear_atr_min_pct': 0.014405224656992888, 'bear_atr_max_pct': 0.06104113982406189, 'bear_tp_mult': 2.05982876105919, 'bear_tsl_mult': 0.17622217605761875, 'bear_time_stop': 176, 'bear_use_sma': True, 'bear_use_ema': False, 'bear_use_atr': True, 'bear_use_adx': True, 'bear_use_spike': False, 'bear_rsi_required': False, 'sideways_strategy': 'mean_reversion', 'sideways_bb_std_mult': 1.9261789853069886, 'sideways_rsi_os': 27, 'sideways_rsi_ob': 55, 'sideways_adx_thresh': 19.573179069317252, 'sideways_atr_min_pct': 0.017594583634859273, 'sideways_atr_max_pct': 0.11460256142509637, 'sideways_tp_mult': 1.9326617578267244, 'sideways_tsl_mult': 0.6488439800823262, 'sideways_time_stop': 256, 'sideways_use_sma': False, 'sideways_use_ema': True, 'sideways_use_atr': False, 'sideways_use_adx': False, 'sideways_use_spike': False, 'sideways_rsi_required': True}.
[I 2025-08-30 20:17:17,454] Trial 756 finished with values: [-1000000000.0, 1000000000.0] and parameters: {'p_sma': 47, 'p_std': 26, 'p_atr': 9, 'p_adx': 7, 'rsi_period': 51, 'ema1': 12, 'ema2': 15, 'slip_atr_k': 0.03979900974515875, 'slip_spread_k': 0.4410512137716267, 'spread_hl_frac': 0.004697616643760123, 'bb_std_mult': 1.0804874601439873, 'rsi_os': 34, 'rsi_ob': 60, 'vol_spike': 0.05065932856121427, 'adx_thresh': 18.536780409554474, 'atr_min_pct': 0.02330988486231998, 'atr_max_pct': 0.13566149863099924, 'tp_mult': 2.2831971638888713, 'tsl_mult': 0.7677799718679424, 'strategy': 'breakout', 'time_stop': 20, 'use_sma': False, 'use_atr': True, 'use_adx': False, 'use_ema': False, 'use_spike': True, 'rsi_required': True, 'edge_k': 0.1786139315647386, 'edge_cap': 0.5862127748295313, 'bull_strategy': 'mean_reversion', 'bull_bb_std_mult': 1.830157606102137, 'bull_rsi_os': 34, 'bull_rsi_ob': 45, 'bull_adx_thresh': 25.1474085498697, 'bull_atr_min_pct': 0.012507895847168118, 'bull_atr_max_pct': 0.047746605421168355, 'bull_tp_mult': 2.0757888198400187, 'bull_tsl_mult': 0.26478872066107784, 'bull_time_stop': 244, 'bull_use_sma': True, 'bull_use_ema': False, 'bull_use_atr': False, 'bull_use_adx': True, 'bull_use_spike': True, 'bull_rsi_required': True, 'bear_strategy': 'breakout', 'bear_bb_std_mult': 3.117502809031245, 'bear_rsi_os': 14, 'bear_rsi_ob': 68, 'bear_adx_thresh': 6.101652772467923, 'bear_atr_min_pct': 0.014244214761931375, 'bear_atr_max_pct': 0.08865350455969523, 'bear_tp_mult': 1.5978135010463272, 'bear_tsl_mult': 0.17446628395323194, 'bear_time_stop': 21, 'bear_use_sma': True, 'bear_use_ema': False, 'bear_use_atr': True, 'bear_use_adx': True, 'bear_use_spike': False, 'bear_rsi_required': False, 'sideways_strategy': 'mean_reversion', 'sideways_bb_std_mult': 2.110181749021846, 'sideways_rsi_os': 8, 'sideways_rsi_ob': 55, 'sideways_adx_thresh': 12.162617250744638, 'sideways_atr_min_pct': 0.014369010926315056, 'sideways_atr_max_pct': 0.10414284928888737, 'sideways_tp_mult': 1.190341743480146, 'sideways_tsl_mult': 0.5202521952547304, 'sideways_time_stop': 191, 'sideways_use_sma': False, 'sideways_use_ema': True, 'sideways_use_atr': False, 'sideways_use_adx': False, 'sideways_use_spike': False, 'sideways_rsi_required': True}.
[I 2025-08-30 20:17:17,744] Trial 758 finished with values: [-0.05305371811837234, 0.0529770927278786] and parameters: {'p_sma': 47, 'p_std': 6, 'p_atr': 28, 'p_adx': 10, 'rsi_period': 50, 'ema1': 21, 'ema2': 15, 'slip_atr_k': 0.17354871823614815, 'slip_spread_k': 0.553582925245497, 'spread_hl_frac': 0.004869292857195895, 'bb_std_mult': 1.078306076117029, 'rsi_os': 23, 'rsi_ob': 60, 'vol_spike': 0.021262426512974917, 'adx_thresh': 18.487659178476665, 'atr_min_pct': 0.007109743557523142, 'atr_max_pct': 0.08180407732245737, 'tp_mult': 1.0779826671638562, 'tsl_mult': 0.4709264180664853, 'strategy': 'mean_reversion', 'time_stop': 33, 'use_sma': True, 'use_atr': True, 'use_adx': False, 'use_ema': False, 'use_spike': True, 'rsi_required': False, 'edge_k': 0.1806983415567628, 'edge_cap': 0.057449106635156566, 'bull_strategy': 'mean_reversion', 'bull_bb_std_mult': 1.8616372345632097, 'bull_rsi_os': 52, 'bull_rsi_ob': 71, 'bull_adx_thresh': 26.37732088395618, 'bull_atr_min_pct': 0.0010815784897098243, 'bull_atr_max_pct': 0.018318597903958355, 'bull_tp_mult': 2.0845853984590588, 'bull_tsl_mult': 0.6462922728334415, 'bull_time_stop': 141, 'bull_use_sma': True, 'bull_use_ema': False, 'bull_use_atr': False, 'bull_use_adx': True, 'bull_use_spike': True, 'bull_rsi_required': True, 'bear_strategy': 'breakout', 'bear_bb_std_mult': 0.6313217087987109, 'bear_rsi_os': 33, 'bear_rsi_ob': 87, 'bear_adx_thresh': 16.79678673601117, 'bear_atr_min_pct': 0.014287099488134919, 'bear_atr_max_pct': 0.06052588299302872, 'bear_tp_mult': 1.7420693099361773, 'bear_tsl_mult': 0.17776405971029324, 'bear_time_stop': 24, 'bear_use_sma': True, 'bear_use_ema': False, 'bear_use_atr': True, 'bear_use_adx': True, 'bear_use_spike': False, 'bear_rsi_required': False, 'sideways_strategy': 'mean_reversion', 'sideways_bb_std_mult': 2.124574042678128, 'sideways_rsi_os': 14, 'sideways_rsi_ob': 55, 'sideways_adx_thresh': 15.22447793309694, 'sideways_atr_min_pct': 0.017729251194461955, 'sideways_atr_max_pct': 0.1150210099243603, 'sideways_tp_mult': 1.7211119325687447, 'sideways_tsl_mult': 0.6869629686709637, 'sideways_time_stop': 256, 'sideways_use_sma': False, 'sideways_use_ema': True, 'sideways_use_atr': False, 'sideways_use_adx': False, 'sideways_use_spike': True, 'sideways_rsi_required': True}.
[I 2025-08-30 20:17:53,028] Trial 763 finished with values: [-1000000000.0, 1000000000.0] and parameters: {'p_sma': 7, 'p_std': 25, 'p_atr': 11, 'p_adx': 8, 'rsi_period': 21, 'ema1': 23, 'ema2': 48, 'slip_atr_k': 0.013253865704236992, 'slip_spread_k': 0.2165927122476664, 'spread_hl_frac': 0.04132016025300831, 'bb_std_mult': 0.7627172337432155, 'rsi_os': 36, 'rsi_ob': 63, 'vol_spike': 0.03846697214153117, 'adx_thresh': 24.429468098101665, 'atr_min_pct': 0.022616747534313926, 'atr_max_pct': 0.09814679403054426, 'tp_mult': 2.277248219458663, 'tsl_mult': 0.343137228954439, 'strategy': 'breakout', 'time_stop': 54, 'use_sma': False, 'use_atr': False, 'use_adx': False, 'use_ema': False, 'use_spike': True, 'rsi_required': True, 'edge_k': 0.09203247456239816, 'edge_cap': 0.824413073744178, 'bull_strategy': 'breakout', 'bull_bb_std_mult': 3.5204757877435453, 'bull_rsi_os': 37, 'bull_rsi_ob': 62, 'bull_adx_thresh': 25.50616949684717, 'bull_atr_min_pct': 0.02708011828348324, 'bull_atr_max_pct': 0.14532635788525455, 'bull_tp_mult': 2.823758049414877, 'bull_tsl_mult': 0.3039108529108566, 'bull_time_stop': 59, 'bull_use_sma': False, 'bull_use_ema': True, 'bull_use_atr': True, 'bull_use_adx': True, 'bull_use_spike': False, 'bull_rsi_required': True, 'bear_strategy': 'breakout', 'bear_bb_std_mult': 3.298638102088109, 'bear_rsi_os': 46, 'bear_rsi_ob': 83, 'bear_adx_thresh': 5.556232070794102, 'bear_atr_min_pct': 0.027751076597155033, 'bear_atr_max_pct': 0.11945597183762532, 'bear_tp_mult': 2.6781334801499512, 'bear_tsl_mult': 0.8171073367294595, 'bear_time_stop': 254, 'bear_use_sma': False, 'bear_use_ema': True, 'bear_use_atr': False, 'bear_use_adx': False, 'bear_use_spike': True, 'bear_rsi_required': False, 'sideways_strategy': 'breakout', 'sideways_bb_std_mult': 1.2752286309854797, 'sideways_rsi_os': 10, 'sideways_rsi_ob': 56, 'sideways_adx_thresh': 8.717395624024762, 'sideways_atr_min_pct': 0.0188306227705464, 'sideways_atr_max_pct': 0.05874370334548003, 'sideways_tp_mult': 1.7767760254865053, 'sideways_tsl_mult': 0.7277246097448148, 'sideways_time_stop': 49, 'sideways_use_sma': True, 'sideways_use_ema': False, 'sideways_use_atr': True, 'sideways_use_adx': True, 'sideways_use_spike': False, 'sideways_rsi_required': False}.
[I 2025-08-30 20:17:53,683] Trial 760 finished with values: [-0.024302758296807725, 0.02423458823228968] and parameters: {'p_sma': 47, 'p_std': 25, 'p_atr': 15, 'p_adx': 7, 'rsi_period': 27, 'ema1': 23, 'ema2': 16, 'slip_atr_k': 0.025755232427923647, 'slip_spread_k': 0.4441352001622167, 'spread_hl_frac': 0.02971895964436686, 'bb_std_mult': 1.0463827975316224, 'rsi_os': 36, 'rsi_ob': 58, 'vol_spike': 0.052564855328740986, 'adx_thresh': 18.362786879629798, 'atr_min_pct': 0.02238970988648684, 'atr_max_pct': 0.13576967952198526, 'tp_mult': 1.4199075232085525, 'tsl_mult': 0.338077926266009, 'strategy': 'breakout', 'time_stop': 34, 'use_sma': False, 'use_atr': True, 'use_adx': False, 'use_ema': False, 'use_spike': True, 'rsi_required': True, 'edge_k': 0.09402820666237287, 'edge_cap': 0.24017846674544116, 'bull_strategy': 'mean_reversion', 'bull_bb_std_mult': 1.852322363618438, 'bull_rsi_os': 52, 'bull_rsi_ob': 71, 'bull_adx_thresh': 26.451322055840176, 'bull_atr_min_pct': 0.001220087024873406, 'bull_atr_max_pct': 0.13828664827974946, 'bull_tp_mult': 1.1030319134221038, 'bull_tsl_mult': 0.6439027127464159, 'bull_time_stop': 76, 'bull_use_sma': False, 'bull_use_ema': False, 'bull_use_atr': False, 'bull_use_adx': True, 'bull_use_spike': True, 'bull_rsi_required': True, 'bear_strategy': 'breakout', 'bear_bb_std_mult': 3.1273907722476544, 'bear_rsi_os': 46, 'bear_rsi_ob': 83, 'bear_adx_thresh': 5.913961459934943, 'bear_atr_min_pct': 0.012059267495030961, 'bear_atr_max_pct': 0.09371795290736952, 'bear_tp_mult': 2.055516578944163, 'bear_tsl_mult': 0.19368741099853873, 'bear_time_stop': 231, 'bear_use_sma': True, 'bear_use_ema': False, 'bear_use_atr': True, 'bear_use_adx': True, 'bear_use_spike': False, 'bear_rsi_required': False, 'sideways_strategy': 'breakout', 'sideways_bb_std_mult': 1.9165637033038974, 'sideways_rsi_os': 27, 'sideways_rsi_ob': 55, 'sideways_adx_thresh': 17.663909934231526, 'sideways_atr_min_pct': 0.017494002553537072, 'sideways_atr_max_pct': 0.10929875872243051, 'sideways_tp_mult': 1.7844044370116916, 'sideways_tsl_mult': 0.689503712701229, 'sideways_time_stop': 251, 'sideways_use_sma': True, 'sideways_use_ema': True, 'sideways_use_atr': False, 'sideways_use_adx': True, 'sideways_use_spike': False, 'sideways_rsi_required': False}.
[I 2025-08-30 20:17:53,781] Trial 761 finished with values: [-0.0292052181093142, 0.029137285056333003] and parameters: {'p_sma': 46, 'p_std': 6, 'p_atr': 11, 'p_adx': 9, 'rsi_period': 49, 'ema1': 23, 'ema2': 42, 'slip_atr_k': 0.01175724917915023, 'slip_spread_k': 0.44720254719907154, 'spread_hl_frac': 0.03851209863404774, 'bb_std_mult': 0.7731858123525913, 'rsi_os': 26, 'rsi_ob': 58, 'vol_spike': 0.07653148227262116, 'adx_thresh': 18.496280923364, 'atr_min_pct': 0.006986771620381549, 'atr_max_pct': 0.13450545268543254, 'tp_mult': 2.268584941228618, 'tsl_mult': 0.7028979646614496, 'strategy': 'breakout', 'time_stop': 52, 'use_sma': False, 'use_atr': True, 'use_adx': False, 'use_ema': False, 'use_spike': True, 'rsi_required': True, 'edge_k': 0.6031895155762605, 'edge_cap': 0.2390303099304797, 'bull_strategy': 'mean_reversion', 'bull_bb_std_mult': 2.976747553361016, 'bull_rsi_os': 13, 'bull_rsi_ob': 71, 'bull_adx_thresh': 25.349071456315503, 'bull_atr_min_pct': 0.0010014352619421626, 'bull_atr_max_pct': 0.14415581603262284, 'bull_tp_mult': 2.8274718471965774, 'bull_tsl_mult': 0.27514982301757235, 'bull_time_stop': 95, 'bull_use_sma': False, 'bull_use_ema': False, 'bull_use_atr': False, 'bull_use_adx': True, 'bull_use_spike': True, 'bull_rsi_required': True, 'bear_strategy': 'breakout', 'bear_bb_std_mult': 3.2824902159357867, 'bear_rsi_os': 24, 'bear_rsi_ob': 80, 'bear_adx_thresh': 5.593910307530169, 'bear_atr_min_pct': 0.011787336705701808, 'bear_atr_max_pct': 0.09223860127336835, 'bear_tp_mult': 1.599545816246752, 'bear_tsl_mult': 0.9252312509575698, 'bear_time_stop': 229, 'bear_use_sma': True, 'bear_use_ema': False, 'bear_use_atr': True, 'bear_use_adx': True, 'bear_use_spike': False, 'bear_rsi_required': False, 'sideways_strategy': 'breakout', 'sideways_bb_std_mult': 1.2494819467081788, 'sideways_rsi_os': 10, 'sideways_rsi_ob': 57, 'sideways_adx_thresh': 24.52771295772862, 'sideways_atr_min_pct': 0.012329470733805723, 'sideways_atr_max_pct': 0.11902478358173033, 'sideways_tp_mult': 2.7092287022598334, 'sideways_tsl_mult': 0.6868114424004305, 'sideways_time_stop': 272, 'sideways_use_sma': True, 'sideways_use_ema': True, 'sideways_use_atr': False, 'sideways_use_adx': True, 'sideways_use_spike': False, 'sideways_rsi_required': False}.
[I 2025-08-30 20:17:53,922] Trial 762 finished with values: [-1000000000.0, 1000000000.0] and parameters: {'p_sma': 35, 'p_std': 25, 'p_atr': 10, 'p_adx': 10, 'rsi_period': 49, 'ema1': 23, 'ema2': 58, 'slip_atr_k': 0.14882056370114147, 'slip_spread_k': 0.4338552458398053, 'spread_hl_frac': 0.0019874815627794794, 'bb_std_mult': 0.9832565713747491, 'rsi_os': 43, 'rsi_ob': 62, 'vol_spike': 0.2902281481617466, 'adx_thresh': 24.52681814753121, 'atr_min_pct': 0.022553763883666856, 'atr_max_pct': 0.13410888782949848, 'tp_mult': 1.2704627822647623, 'tsl_mult': 0.47270588879380643, 'strategy': 'mean_reversion', 'time_stop': 33, 'use_sma': True, 'use_atr': True, 'use_adx': False, 'use_ema': False, 'use_spike': True, 'rsi_required': False, 'edge_k': 0.6056076564905533, 'edge_cap': 0.8240510971988557, 'bull_strategy': 'mean_reversion', 'bull_bb_std_mult': 1.8968759604809846, 'bull_rsi_os': 51, 'bull_rsi_ob': 72, 'bull_adx_thresh': 20.651168635916157, 'bull_atr_min_pct': 0.0009258986457507112, 'bull_atr_max_pct': 0.10187661330532588, 'bull_tp_mult': 2.2061887958110726, 'bull_tsl_mult': 0.9774384902739447, 'bull_time_stop': 185, 'bull_use_sma': False, 'bull_use_ema': True, 'bull_use_atr': False, 'bull_use_adx': True, 'bull_use_spike': False, 'bull_rsi_required': True, 'bear_strategy': 'breakout', 'bear_bb_std_mult': 3.254777971593005, 'bear_rsi_os': 31, 'bear_rsi_ob': 47, 'bear_adx_thresh': 5.810406133994764, 'bear_atr_min_pct': 0.01500962491769449, 'bear_atr_max_pct': 0.12022698640308829, 'bear_tp_mult': 1.7468516979813626, 'bear_tsl_mult': 0.0780902848169637, 'bear_time_stop': 242, 'bear_use_sma': False, 'bear_use_ema': False, 'bear_use_atr': True, 'bear_use_adx': True, 'bear_use_spike': False, 'bear_rsi_required': False, 'sideways_strategy': 'breakout', 'sideways_bb_std_mult': 2.0254205045934834, 'sideways_rsi_os': 21, 'sideways_rsi_ob': 52, 'sideways_adx_thresh': 15.442059184676427, 'sideways_atr_min_pct': 0.02372028921330864, 'sideways_atr_max_pct': 0.05904743387873615, 'sideways_tp_mult': 2.5135140649008654, 'sideways_tsl_mult': 0.688355060913619, 'sideways_time_stop': 272, 'sideways_use_sma': True, 'sideways_use_ema': True, 'sideways_use_atr': False, 'sideways_use_adx': True, 'sideways_use_spike': True, 'sideways_rsi_required': False}.
[I 2025-08-30 20:17:54,981] Trial 766 finished with values: [-1000000000.0, 1000000000.0] and parameters: {'p_sma': 49, 'p_std': 32, 'p_atr': 19, 'p_adx': 9, 'rsi_period': 53, 'ema1': 28, 'ema2': 55, 'slip_atr_k': 0.053183454196665605, 'slip_spread_k': 0.40252851701673154, 'spread_hl_frac': 0.0018703478162355146, 'bb_std_mult': 0.9593154369724018, 'rsi_os': 43, 'rsi_ob': 80, 'vol_spike': 0.02945079504421834, 'adx_thresh': 16.988574954549396, 'atr_min_pct': 0.023875434976061784, 'atr_max_pct': 0.020970759790651994, 'tp_mult': 1.5243617815551052, 'tsl_mult': 0.7861187038849751, 'strategy': 'mean_reversion', 'time_stop': 153, 'use_sma': True, 'use_atr': False, 'use_adx': True, 'use_ema': True, 'use_spike': False, 'rsi_required': False, 'edge_k': 0.14394466630338923, 'edge_cap': 0.15509467460129572, 'bull_strategy': 'mean_reversion', 'bull_bb_std_mult': 1.9764998698302123, 'bull_rsi_os': 50, 'bull_rsi_ob': 72, 'bull_adx_thresh': 21.28170503040393, 'bull_atr_min_pct': 0.027851975175087446, 'bull_atr_max_pct': 0.022506148735966694, 'bull_tp_mult': 2.191156442057751, 'bull_tsl_mult': 0.97866448015913, 'bull_time_stop': 186, 'bull_use_sma': True, 'bull_use_ema': True, 'bull_use_atr': False, 'bull_use_adx': False, 'bull_use_spike': False, 'bull_rsi_required': False, 'bear_strategy': 'mean_reversion', 'bear_bb_std_mult': 1.6013661948441653, 'bear_rsi_os': 43, 'bear_rsi_ob': 55, 'bear_adx_thresh': 6.729594200317629, 'bear_atr_min_pct': 0.019694459108014626, 'bear_atr_max_pct': 0.02163670178763398, 'bear_tp_mult': 2.3502313072387957, 'bear_tsl_mult': 0.08414531324601054, 'bear_time_stop': 93, 'bear_use_sma': False, 'bear_use_ema': False, 'bear_use_atr': False, 'bear_use_adx': False, 'bear_use_spike': False, 'bear_rsi_required': False, 'sideways_strategy': 'breakout', 'sideways_bb_std_mult': 1.4225715656357762, 'sideways_rsi_os': 47, 'sideways_rsi_ob': 50, 'sideways_adx_thresh': 13.913575693808717, 'sideways_atr_min_pct': 0.01896920003968087, 'sideways_atr_max_pct': 0.13266418269748842, 'sideways_tp_mult': 1.834504352105436, 'sideways_tsl_mult': 0.46160569874780544, 'sideways_time_stop': 56, 'sideways_use_sma': True, 'sideways_use_ema': True, 'sideways_use_atr': False, 'sideways_use_adx': False, 'sideways_use_spike': True, 'sideways_rsi_required': False}.
