[I 2025-08-30 18:47:39,443] Trial 98 finished with values: [-1000000000.0, 1000000000.0] and parameters: {'p_sma': 56, 'p_std': 43, 'p_atr': 23, 'p_adx': 9, 'rsi_period': 50, 'ema1': 25, 'ema2': 20, 'slip_atr_k': 0.05584031806770158, 'slip_spread_k': 0.72313405817348, 'spread_hl_frac': 0.005486512023340932, 'bb_std_mult': 0.9688140062621903, 'rsi_os': 32, 'rsi_ob': 63, 'vol_spike': 0.18963600547178228, 'adx_thresh': 13.703979295757467, 'atr_min_pct': 0.025307532990312753, 'atr_max_pct': 0.12521539867034742, 'tp_mult': 2.0893718266464556, 'tsl_mult': 0.35087746575507106, 'strategy': 'breakout', 'time_stop': 49, 'use_sma': False, 'use_atr': True, 'use_adx': False, 'use_ema': False, 'use_spike': True, 'rsi_required': True, 'edge_k': 0.05890234369351342, 'edge_cap': 0.2653094025628191, 'bull_strategy': 'breakout', 'bull_bb_std_mult': 1.622708902375356, 'bull_rsi_os': 53, 'bull_rsi_ob': 47, 'bull_adx_thresh': 27.60256397466045, 'bull_atr_min_pct': 0.005920708836413234, 'bull_atr_max_pct': 0.04320968288839812, 'bull_tp_mult': 2.292540556487316, 'bull_tsl_mult': 0.9108414056040077, 'bull_time_stop': 187, 'bull_use_sma': True, 'bull_use_ema': False, 'bull_use_atr': True, 'bull_use_adx': True, 'bull_use_spike': True, 'bull_rsi_required': False, 'bear_strategy': 'breakout', 'bear_bb_std_mult': 0.7780469340175431, 'bear_rsi_os': 41, 'bear_rsi_ob': 64, 'bear_adx_thresh': 9.895045186762028, 'bear_atr_min_pct': 0.017416635084005004, 'bear_atr_max_pct': 0.051989500180917914, 'bear_tp_mult': 2.8113011423759855, 'bear_tsl_mult': 0.766243817527732, 'bear_time_stop': 37, 'bear_use_sma': False, 'bear_use_ema': False, 'bear_use_atr': True, 'bear_use_adx': True, 'bear_use_spike': False, 'bear_rsi_required': False, 'sideways_strategy': 'breakout', 'sideways_bb_std_mult': 2.976679246800482, 'sideways_rsi_os': 39, 'sideways_rsi_ob': 60, 'sideways_adx_thresh': 5.670222283290681, 'sideways_atr_min_pct': 0.029599215162041018, 'sideways_atr_max_pct': 0.08742914264321829, 'sideways_tp_mult': 2.347751801200184, 'sideways_tsl_mult': 0.000955583649607683, 'sideways_time_stop': 252, 'sideways_use_sma': True, 'sideways_use_ema': True, 'sideways_use_atr': False, 'sideways_use_adx': False, 'sideways_use_spike': False, 'sideways_rsi_required': False}.
[I 2025-08-30 18:48:13,174] Trial 102 finished with values: [-0.016292946777150652, 0.016308631673767546] and parameters: {'p_sma': 56, 'p_std': 25, 'p_atr': 14, 'p_adx': 14, 'rsi_period': 50, 'ema1': 30, 'ema2': 20, 'slip_atr_k': 0.035187460674742654, 'slip_spread_k': 0.7084140442814217, 'spread_hl_frac': 0.0015519076874805065, 'bb_std_mult': 2.3981737572268433, 'rsi_os': 36, 'rsi_ob': 58, 'vol_spike': 0.11593011253873015, 'adx_thresh': 20.297728393414978, 'atr_min_pct': 0.026922210956252402, 'atr_max_pct': 0.12517019730514292, 'tp_mult': 1.013388683435217, 'tsl_mult': 0.6870686399004525, 'strategy': 'breakout', 'time_stop': 109, 'use_sma': False, 'use_atr': True, 'use_adx': False, 'use_ema': False, 'use_spike': True, 'rsi_required': True, 'edge_k': 0.22777844876086611, 'edge_cap': 0.08578371031942497, 'bull_strategy': 'breakout', 'bull_bb_std_mult': 3.1703065437051414, 'bull_rsi_os': 34, 'bull_rsi_ob': 80, 'bull_adx_thresh': 23.23344356640983, 'bull_atr_min_pct': 0.0011474560828926262, 'bull_atr_max_pct': 0.044466888080270384, 'bull_tp_mult': 2.302628364546775, 'bull_tsl_mult': 0.9594020553402915, 'bull_time_stop': 123, 'bull_use_sma': True, 'bull_use_ema': False, 'bull_use_atr': False, 'bull_use_adx': True, 'bull_use_spike': True, 'bull_rsi_required': False, 'bear_strategy': 'breakout', 'bear_bb_std_mult': 3.594376309631807, 'bear_rsi_os': 41, 'bear_rsi_ob': 76, 'bear_adx_thresh': 24.720591846102607, 'bear_atr_min_pct': 0.02030895940816479, 'bear_atr_max_pct': 0.06494171164192121, 'bear_tp_mult': 2.766324991134893, 'bear_tsl_mult': 0.043776543178979443, 'bear_time_stop': 13, 'bear_use_sma': False, 'bear_use_ema': False, 'bear_use_atr': False, 'bear_use_adx': False, 'bear_use_spike': False, 'bear_rsi_required': True, 'sideways_strategy': 'breakout', 'sideways_bb_std_mult': 1.5073575820903984, 'sideways_rsi_os': 13, 'sideways_rsi_ob': 45, 'sideways_adx_thresh': 17.913943081543948, 'sideways_atr_min_pct': 0.025594579866069316, 'sideways_atr_max_pct': 0.028788635343493844, 'sideways_tp_mult': 1.8739623930829021, 'sideways_tsl_mult': 0.5181575559890166, 'sideways_time_stop': 72, 'sideways_use_sma': True, 'sideways_use_ema': False, 'sideways_use_atr': False, 'sideways_use_adx': False, 'sideways_use_spike': False, 'sideways_rsi_required': False}.
[I 2025-08-30 18:48:13,868] Trial 101 finished with values: [-1000000000.0, 1000000000.0] and parameters: {'p_sma': 40, 'p_std': 60, 'p_atr': 10, 'p_adx': 15, 'rsi_period': 20, 'ema1': 24, 'ema2': 33, 'slip_atr_k': 0.012035428546990105, 'slip_spread_k': 0.3778555037270916, 'spread_hl_frac': 0.001380180757403171, 'bb_std_mult': 1.9949164881727557, 'rsi_os': 32, 'rsi_ob': 64, 'vol_spike': 0.045904328625623436, 'adx_thresh': 20.435730185399173, 'atr_min_pct': 0.010651053428158088, 'atr_max_pct': 0.12645531203416507, 'tp_mult': 2.774352533317903, 'tsl_mult': 0.7490716882961909, 'strategy': 'breakout', 'time_stop': 276, 'use_sma': False, 'use_atr': True, 'use_adx': False, 'use_ema': False, 'use_spike': True, 'rsi_required': True, 'edge_k': 0.14260949715188942, 'edge_cap': 0.2664843786684166, 'bull_strategy': 'breakout', 'bull_bb_std_mult': 1.8361489899498995, 'bull_rsi_os': 26, 'bull_rsi_ob': 70, 'bull_adx_thresh': 9.445970153428837, 'bull_atr_min_pct': 0.008530768054601746, 'bull_atr_max_pct': 0.019525651465625786, 'bull_tp_mult': 1.9950690406803475, 'bull_tsl_mult': 0.19711140263124122, 'bull_time_stop': 118, 'bull_use_sma': True, 'bull_use_ema': False, 'bull_use_atr': False, 'bull_use_adx': True, 'bull_use_spike': True, 'bull_rsi_required': False, 'bear_strategy': 'breakout', 'bear_bb_std_mult': 1.651320846886526, 'bear_rsi_os': 33, 'bear_rsi_ob': 76, 'bear_adx_thresh': 24.37359719491634, 'bear_atr_min_pct': 0.01742791349580208, 'bear_atr_max_pct': 0.04449252881277467, 'bear_tp_mult': 2.7633812970514966, 'bear_tsl_mult': 0.7409266710962352, 'bear_time_stop': 18, 'bear_use_sma': False, 'bear_use_ema': False, 'bear_use_atr': True, 'bear_use_adx': True, 'bear_use_spike': False, 'bear_rsi_required': True, 'sideways_strategy': 'breakout', 'sideways_bb_std_mult': 1.495484358236555, 'sideways_rsi_os': 40, 'sideways_rsi_ob': 55, 'sideways_adx_thresh': 18.249597678860745, 'sideways_atr_min_pct': 0.029222887410112187, 'sideways_atr_max_pct': 0.05148092212121532, 'sideways_tp_mult': 1.8710496620638772, 'sideways_tsl_mult': 0.35350163885587627, 'sideways_time_stop': 272, 'sideways_use_sma': True, 'sideways_use_ema': True, 'sideways_use_atr': False, 'sideways_use_adx': False, 'sideways_use_spike': False, 'sideways_rsi_required': False}.
[I 2025-08-30 18:48:13,974] Trial 103 finished with values: [-1000000000.0, 1000000000.0] and parameters: {'p_sma': 16, 'p_std': 26, 'p_atr': 8, 'p_adx': 8, 'rsi_period': 40, 'ema1': 30, 'ema2': 11, 'slip_atr_k': 0.16804606220262608, 'slip_spread_k': 0.4208233402273088, 'spread_hl_frac': 0.02081619667467975, 'bb_std_mult': 0.5109784276775027, 'rsi_os': 53, 'rsi_ob': 58, 'vol_spike': 0.1608374764844385, 'adx_thresh': 17.919475509739037, 'atr_min_pct': 0.026924089665728984, 'atr_max_pct': 0.06649955579984605, 'tp_mult': 2.1886133929840117, 'tsl_mult': 0.6594350421092735, 'strategy': 'breakout', 'time_stop': 276, 'use_sma': False, 'use_atr': True, 'use_adx': True, 'use_ema': False, 'use_spike': True, 'rsi_required': True, 'edge_k': 0.14393152732926212, 'edge_cap': 0.14763054158182376, 'bull_strategy': 'breakout', 'bull_bb_std_mult': 1.854772613293314, 'bull_rsi_os': 34, 'bull_rsi_ob': 70, 'bull_adx_thresh': 23.12937777452843, 'bull_atr_min_pct': 0.023888326208948263, 'bull_atr_max_pct': 0.12164748699736679, 'bull_tp_mult': 2.7655850154423502, 'bull_tsl_mult': 0.21303562744815563, 'bull_time_stop': 25, 'bull_use_sma': True, 'bull_use_ema': False, 'bull_use_atr': False, 'bull_use_adx': True, 'bull_use_spike': False, 'bull_rsi_required': True, 'bear_strategy': 'breakout', 'bear_bb_std_mult': 1.7037303561979744, 'bear_rsi_os': 32, 'bear_rsi_ob': 69, 'bear_adx_thresh': 21.057486958674208, 'bear_atr_min_pct': 0.020590489784684723, 'bear_atr_max_pct': 0.04427908512410441, 'bear_tp_mult': 1.8807128231450227, 'bear_tsl_mult': 0.04030700413984761, 'bear_time_stop': 15, 'bear_use_sma': False, 'bear_use_ema': False, 'bear_use_atr': False, 'bear_use_adx': False, 'bear_use_spike': False, 'bear_rsi_required': True, 'sideways_strategy': 'breakout', 'sideways_bb_std_mult': 1.9630596029978822, 'sideways_rsi_os': 13, 'sideways_rsi_ob': 92, 'sideways_adx_thresh': 12.941483509740728, 'sideways_atr_min_pct': 0.025073010002790393, 'sideways_atr_max_pct': 0.05142159447616644, 'sideways_tp_mult': 2.5824701707122193, 'sideways_tsl_mult': 0.5072998658898845, 'sideways_time_stop': 183, 'sideways_use_sma': True, 'sideways_use_ema': False, 'sideways_use_atr': False, 'sideways_use_adx': False, 'sideways_use_spike': False, 'sideways_rsi_required': False}.
[I 2025-08-30 18:48:14,239] Trial 100 finished with values: [-1000000000.0, 1000000000.0] and parameters: {'p_sma': 40, 'p_std': 60, 'p_atr': 10, 'p_adx': 8, 'rsi_period': 30, 'ema1': 25, 'ema2': 20, 'slip_atr_k': 0.05605795587298629, 'slip_spread_k': 0.7334940840122943, 'spread_hl_frac': 0.010054831019674904, 'bb_std_mult': 0.9603236096009811, 'rsi_os': 40, 'rsi_ob': 90, 'vol_spike': 0.19494660005664194, 'adx_thresh': 23.99166672222107, 'atr_min_pct': 0.021410415378064172, 'atr_max_pct': 0.08523689601665388, 'tp_mult': 2.167011614449456, 'tsl_mult': 0.6818903297558354, 'strategy': 'breakout', 'time_stop': 190, 'use_sma': False, 'use_atr': True, 'use_adx': False, 'use_ema': False, 'use_spike': True, 'rsi_required': True, 'edge_k': 0.07548226874850444, 'edge_cap': 0.5910063510337111, 'bull_strategy': 'breakout', 'bull_bb_std_mult': 1.833356909781607, 'bull_rsi_os': 37, 'bull_rsi_ob': 80, 'bull_adx_thresh': 23.262683476863906, 'bull_atr_min_pct': 0.01380222107091043, 'bull_atr_max_pct': 0.022518010102189435, 'bull_tp_mult': 2.4426839557645144, 'bull_tsl_mult': 0.16990507918043274, 'bull_time_stop': 183, 'bull_use_sma': True, 'bull_use_ema': False, 'bull_use_atr': False, 'bull_use_adx': True, 'bull_use_spike': True, 'bull_rsi_required': False, 'bear_strategy': 'breakout', 'bear_bb_std_mult': 1.7502437365452588, 'bear_rsi_os': 15, 'bear_rsi_ob': 68, 'bear_adx_thresh': 30.784880630428827, 'bear_atr_min_pct': 0.021163359534436287, 'bear_atr_max_pct': 0.05210754413390427, 'bear_tp_mult': 1.8865675663412782, 'bear_tsl_mult': 0.22006800140301574, 'bear_time_stop': 15, 'bear_use_sma': False, 'bear_use_ema': False, 'bear_use_atr': True, 'bear_use_adx': True, 'bear_use_spike': False, 'bear_rsi_required': True, 'sideways_strategy': 'breakout', 'sideways_bb_std_mult': 3.0551308317925723, 'sideways_rsi_os': 26, 'sideways_rsi_ob': 61, 'sideways_adx_thresh': 10.673726962357165, 'sideways_atr_min_pct': 0.025642367194041296, 'sideways_atr_max_pct': 0.030094210059828812, 'sideways_tp_mult': 2.3681172004127444, 'sideways_tsl_mult': 0.513525194123389, 'sideways_time_stop': 272, 'sideways_use_sma': True, 'sideways_use_ema': True, 'sideways_use_atr': False, 'sideways_use_adx': False, 'sideways_use_spike': False, 'sideways_rsi_required': False}.
[I 2025-08-30 18:48:44,722] Trial 104 finished with values: [-1000000000.0, 1000000000.0] and parameters: {'p_sma': 40, 'p_std': 26, 'p_atr': 8, 'p_adx': 15, 'rsi_period': 19, 'ema1': 27, 'ema2': 43, 'slip_atr_k': 0.16939278067094954, 'slip_spread_k': 0.427178721704689, 'spread_hl_frac': 0.010095830892305022, 'bb_std_mult': 3.096958141178036, 'rsi_os': 36, 'rsi_ob': 70, 'vol_spike': 0.04563029947050407, 'adx_thresh': 23.577935905492502, 'atr_min_pct': 0.026879286887785743, 'atr_max_pct': 0.08967273637793025, 'tp_mult': 1.2154915272082143, 'tsl_mult': 0.6815730237151011, 'strategy': 'breakout', 'time_stop': 43, 'use_sma': False, 'use_atr': True, 'use_adx': True, 'use_ema': False, 'use_spike': True, 'rsi_required': True, 'edge_k': 0.21562525022582568, 'edge_cap': 0.09077900925701338, 'bull_strategy': 'breakout', 'bull_bb_std_mult': 0.6320084291249817, 'bull_rsi_os': 33, 'bull_rsi_ob': 71, 'bull_adx_thresh': 22.954703273924324, 'bull_atr_min_pct': 0.023967806063821682, 'bull_atr_max_pct': 0.018532532141612473, 'bull_tp_mult': 2.1414459074595076, 'bull_tsl_mult': 0.9574310818624097, 'bull_time_stop': 116, 'bull_use_sma': True, 'bull_use_ema': False, 'bull_use_atr': False, 'bull_use_adx': True, 'bull_use_spike': False, 'bull_rsi_required': True, 'bear_strategy': 'breakout', 'bear_bb_std_mult': 1.7200127941603753, 'bear_rsi_os': 44, 'bear_rsi_ob': 76, 'bear_adx_thresh': 6.663143816913127, 'bear_atr_min_pct': 0.012545118971846146, 'bear_atr_max_pct': 0.08568615075509582, 'bear_tp_mult': 1.8931678866281747, 'bear_tsl_mult': 0.16015942583459158, 'bear_time_stop': 16, 'bear_use_sma': True, 'bear_use_ema': False, 'bear_use_atr': False, 'bear_use_adx': False, 'bear_use_spike': False, 'bear_rsi_required': True, 'sideways_strategy': 'breakout', 'sideways_bb_std_mult': 2.1165678071412444, 'sideways_rsi_os': 26, 'sideways_rsi_ob': 91, 'sideways_adx_thresh': 15.562606381382498, 'sideways_atr_min_pct': 0.025870493716361537, 'sideways_atr_max_pct': 0.04364872014008468, 'sideways_tp_mult': 1.880254073153047, 'sideways_tsl_mult': 0.5158734854781902, 'sideways_time_stop': 272, 'sideways_use_sma': True, 'sideways_use_ema': False, 'sideways_use_atr': False, 'sideways_use_adx': False, 'sideways_use_spike': False, 'sideways_rsi_required': False}.
[I 2025-08-30 18:48:44,978] Trial 107 finished with values: [-0.056064917874936504, 0.05587359511191658] and parameters: {'p_sma': 36, 'p_std': 21, 'p_atr': 11, 'p_adx': 30, 'rsi_period': 47, 'ema1': 19, 'ema2': 52, 'slip_atr_k': 0.03523599146065973, 'slip_spread_k': 0.9890725521139275, 'spread_hl_frac': 0.016693091877427964, 'bb_std_mult': 2.4923777334174213, 'rsi_os': 36, 'rsi_ob': 55, 'vol_spike': 0.04152494973984428, 'adx_thresh': 15.009673494606679, 'atr_min_pct': 7.448035239174776e-05, 'atr_max_pct': 0.1453110229681564, 'tp_mult': 1.16128108157661, 'tsl_mult': 0.8757477702927472, 'strategy': 'breakout', 'time_stop': 167, 'use_sma': False, 'use_atr': False, 'use_adx': True, 'use_ema': True, 'use_spike': True, 'rsi_required': False, 'edge_k': 0.2306674073993274, 'edge_cap': 0.6528670785867509, 'bull_strategy': 'mean_reversion', 'bull_bb_std_mult': 3.208291399056736, 'bull_rsi_os': 31, 'bull_rsi_ob': 72, 'bull_adx_thresh': 6.896588100362083, 'bull_atr_min_pct': 0.0011098567174339326, 'bull_atr_max_pct': 0.10973227468415825, 'bull_tp_mult': 1.6456607250767534, 'bull_tsl_mult': 0.9569526160460357, 'bull_time_stop': 176, 'bull_use_sma': True, 'bull_use_ema': True, 'bull_use_atr': False, 'bull_use_adx': False, 'bull_use_spike': True, 'bull_rsi_required': True, 'bear_strategy': 'breakout', 'bear_bb_std_mult': 3.505540606116872, 'bear_rsi_os': 44, 'bear_rsi_ob': 87, 'bear_adx_thresh': 6.593995539530535, 'bear_atr_min_pct': 0.0016021492631749078, 'bear_atr_max_pct': 0.06339523355715022, 'bear_tp_mult': 1.6321497529000812, 'bear_tsl_mult': 0.16701021876564429, 'bear_time_stop': 23, 'bear_use_sma': True, 'bear_use_ema': False, 'bear_use_atr': False, 'bear_use_adx': False, 'bear_use_spike': True, 'bear_rsi_required': False, 'sideways_strategy': 'mean_reversion', 'sideways_bb_std_mult': 2.1164707152807707, 'sideways_rsi_os': 17, 'sideways_rsi_ob': 57, 'sideways_adx_thresh': 15.909379220459005, 'sideways_atr_min_pct': 0.013396494266140105, 'sideways_atr_max_pct': 0.11652211112891193, 'sideways_tp_mult': 2.654960952960508, 'sideways_tsl_mult': 0.5791935250314847, 'sideways_time_stop': 73, 'sideways_use_sma': True, 'sideways_use_ema': False, 'sideways_use_atr': False, 'sideways_use_adx': False, 'sideways_use_spike': False, 'sideways_rsi_required': False}.
[I 2025-08-30 18:48:44,979] Trial 105 finished with values: [-0.041216332016002166, 0.041137508920030444] and parameters: {'p_sma': 47, 'p_std': 25, 'p_atr': 8, 'p_adx': 8, 'rsi_period': 16, 'ema1': 10, 'ema2': 53, 'slip_atr_k': 0.17151268524339291, 'slip_spread_k': 0.42988995487397474, 'spread_hl_frac': 0.020160513646324374, 'bb_std_mult': 0.8274532550920959, 'rsi_os': 36, 'rsi_ob': 55, 'vol_spike': 0.1447806802082613, 'adx_thresh': 14.695141509050226, 'atr_min_pct': 0.008228335674155353, 'atr_max_pct': 0.0674268404588541, 'tp_mult': 1.1896158461248425, 'tsl_mult': 0.6741360018696202, 'strategy': 'breakout', 'time_stop': 43, 'use_sma': False, 'use_atr': False, 'use_adx': True, 'use_ema': False, 'use_spike': True, 'rsi_required': True, 'edge_k': 0.22257899046800492, 'edge_cap': 0.09140256401972091, 'bull_strategy': 'mean_reversion', 'bull_bb_std_mult': 0.9430946239343825, 'bull_rsi_os': 35, 'bull_rsi_ob': 72, 'bull_adx_thresh': 23.118111665357876, 'bull_atr_min_pct': 0.0012033833541727826, 'bull_atr_max_pct': 0.12856534425562607, 'bull_tp_mult': 2.1471744315998245, 'bull_tsl_mult': 0.952514801992115, 'bull_time_stop': 202, 'bull_use_sma': True, 'bull_use_ema': False, 'bull_use_atr': False, 'bull_use_adx': False, 'bull_use_spike': False, 'bull_rsi_required': True, 'bear_strategy': 'breakout', 'bear_bb_std_mult': 2.47745523033964, 'bear_rsi_os': 44, 'bear_rsi_ob': 79, 'bear_adx_thresh': 6.527677174397911, 'bear_atr_min_pct': 0.02066278494763298, 'bear_atr_max_pct': 0.06419026828305087, 'bear_tp_mult': 1.6327408347496997, 'bear_tsl_mult': 0.05024351469271761, 'bear_time_stop': 14, 'bear_use_sma': True, 'bear_use_ema': False, 'bear_use_atr': False, 'bear_use_adx': False, 'bear_use_spike': False, 'bear_rsi_required': True, 'sideways_strategy': 'breakout', 'sideways_bb_std_mult': 2.7193704914752868, 'sideways_rsi_os': 17, 'sideways_rsi_ob': 92, 'sideways_adx_thresh': 17.396498819111113, 'sideways_atr_min_pct': 0.012897138341796158, 'sideways_atr_max_pct': 0.06656444751405735, 'sideways_tp_mult': 1.6269344247284885, 'sideways_tsl_mult': 0.5080896238574637, 'sideways_time_stop': 79, 'sideways_use_sma': True, 'sideways_use_ema': False, 'sideways_use_atr': False, 'sideways_use_adx': False, 'sideways_use_spike': False, 'sideways_rsi_required': False}.
[I 2025-08-30 18:48:45,428] Trial 106 finished with values: [-0.053894093771554075, 0.0536643807867976] and parameters: {'p_sma': 42, 'p_std': 21, 'p_atr': 11, 'p_adx': 7, 'rsi_period': 61, 'ema1': 10, 'ema2': 44, 'slip_atr_k': 0.17617965960090895, 'slip_spread_k': 0.36516677224958927, 'spread_hl_frac': 0.009999149387927262, 'bb_std_mult': 1.2553974932309888, 'rsi_os': 36, 'rsi_ob': 45, 'vol_spike': 0.14106916187002036, 'adx_thresh': 14.814223675043495, 'atr_min_pct': 0.008558729192111814, 'atr_max_pct': 0.08854394131682114, 'tp_mult': 1.1493650890603317, 'tsl_mult': 0.6992783047156186, 'strategy': 'breakout', 'time_stop': 45, 'use_sma': False, 'use_atr': False, 'use_adx': False, 'use_ema': True, 'use_spike': True, 'rsi_required': True, 'edge_k': 0.22489734068871448, 'edge_cap': 0.0924322229641916, 'bull_strategy': 'mean_reversion', 'bull_bb_std_mult': 0.5751753387558267, 'bull_rsi_os': 30, 'bull_rsi_ob': 72, 'bull_adx_thresh': 7.188034596180881, 'bull_atr_min_pct': 0.0013581547823522647, 'bull_atr_max_pct': 0.09586751794220584, 'bull_tp_mult': 2.5850887732646033, 'bull_tsl_mult': 0.9572906491661626, 'bull_time_stop': 202, 'bull_use_sma': True, 'bull_use_ema': True, 'bull_use_atr': False, 'bull_use_adx': False, 'bull_use_spike': True, 'bull_rsi_required': True, 'bear_strategy': 'breakout', 'bear_bb_std_mult': 3.0132374559692012, 'bear_rsi_os': 44, 'bear_rsi_ob': 90, 'bear_adx_thresh': 30.454948430134877, 'bear_atr_min_pct': 0.0025953964455468857, 'bear_atr_max_pct': 0.06374536263111744, 'bear_tp_mult': 1.6420784599071472, 'bear_tsl_mult': 0.16044580708525616, 'bear_time_stop': 24, 'bear_use_sma': True, 'bear_use_ema': False, 'bear_use_atr': False, 'bear_use_adx': False, 'bear_use_spike': False, 'bear_rsi_required': False, 'sideways_strategy': 'mean_reversion', 'sideways_bb_std_mult': 2.7105026813932405, 'sideways_rsi_os': 26, 'sideways_rsi_ob': 57, 'sideways_adx_thresh': 25.72488438047727, 'sideways_atr_min_pct': 0.013141852737008509, 'sideways_atr_max_pct': 0.017191298669463784, 'sideways_tp_mult': 1.4383083846095321, 'sideways_tsl_mult': 0.635871252567659, 'sideways_time_stop': 281, 'sideways_use_sma': True, 'sideways_use_ema': True, 'sideways_use_atr': False, 'sideways_use_adx': False, 'sideways_use_spike': False, 'sideways_rsi_required': False}.
