[I 2025-08-30 20:20:14,866] Trial 783 finished with values: [-0.022689524570337016, 0.02262126838916102] and parameters: {'p_sma': 53, 'p_std': 17, 'p_atr': 10, 'p_adx': 8, 'rsi_period': 49, 'ema1': 10, 'ema2': 47, 'slip_atr_k': 0.015418728968770366, 'slip_spread_k': 0.40586431604498197, 'spread_hl_frac': 0.0015374307654155068, 'bb_std_mult': 1.1211873385546722, 'rsi_os': 32, 'rsi_ob': 56, 'vol_spike': 0.2833050329746505, 'adx_thresh': 10.187145451043852, 'atr_min_pct': 0.01180756473743233, 'atr_max_pct': 0.12575197236171864, 'tp_mult': 2.401630785420274, 'tsl_mult': 0.9991009695620243, 'strategy': 'breakout', 'time_stop': 244, 'use_sma': False, 'use_atr': True, 'use_adx': True, 'use_ema': True, 'use_spike': False, 'rsi_required': True, 'edge_k': 0.19938922152833927, 'edge_cap': 0.25868499763846536, 'bull_strategy': 'mean_reversion', 'bull_bb_std_mult': 1.8987989422237157, 'bull_rsi_os': 18, 'bull_rsi_ob': 73, 'bull_adx_thresh': 25.792721855199247, 'bull_atr_min_pct': 0.0018053381828358412, 'bull_atr_max_pct': 0.14999507230992395, 'bull_tp_mult': 2.1896900837180393, 'bull_tsl_mult': 0.9806305040416251, 'bull_time_stop': 176, 'bull_use_sma': False, 'bull_use_ema': False, 'bull_use_atr': False, 'bull_use_adx': False, 'bull_use_spike': True, 'bull_rsi_required': False, 'bear_strategy': 'mean_reversion', 'bear_bb_std_mult': 0.7988532910247625, 'bear_rsi_os': 19, 'bear_rsi_ob': 53, 'bear_adx_thresh': 8.16803798429326, 'bear_atr_min_pct': 0.01699461633355681, 'bear_atr_max_pct': 0.05653468310396031, 'bear_tp_mult': 1.6610722429823528, 'bear_tsl_mult': 0.0644915584375671, 'bear_time_stop': 211, 'bear_use_sma': True, 'bear_use_ema': False, 'bear_use_atr': True, 'bear_use_adx': True, 'bear_use_spike': True, 'bear_rsi_required': False, 'sideways_strategy': 'mean_reversion', 'sideways_bb_std_mult': 2.092394060135409, 'sideways_rsi_os': 54, 'sideways_rsi_ob': 88, 'sideways_adx_thresh': 8.698549214805608, 'sideways_atr_min_pct': 0.0131725141405937, 'sideways_atr_max_pct': 0.11216429845423488, 'sideways_tp_mult': 1.897197835412437, 'sideways_tsl_mult': 0.6678769878365332, 'sideways_time_stop': 264, 'sideways_use_sma': False, 'sideways_use_ema': True, 'sideways_use_atr': False, 'sideways_use_adx': True, 'sideways_use_spike': False, 'sideways_rsi_required': True}.
[I 2025-08-30 20:20:49,480] Trial 785 finished with values: [-1000000000.0, 1000000000.0] and parameters: {'p_sma': 56, 'p_std': 27, 'p_atr': 10, 'p_adx': 9, 'rsi_period': 55, 'ema1': 22, 'ema2': 53, 'slip_atr_k': 0.013214060603694532, 'slip_spread_k': 0.40240679240047417, 'spread_hl_frac': 0.028308028616787054, 'bb_std_mult': 0.9219819325137819, 'rsi_os': 38, 'rsi_ob': 56, 'vol_spike': 0.05895753194905551, 'adx_thresh': 18.861114707087108, 'atr_min_pct': 0.021928773000582075, 'atr_max_pct': 0.11724987235921089, 'tp_mult': 2.4288864805116352, 'tsl_mult': 0.7968749968455435, 'strategy': 'mean_reversion', 'time_stop': 283, 'use_sma': False, 'use_atr': True, 'use_adx': True, 'use_ema': True, 'use_spike': False, 'rsi_required': True, 'edge_k': 0.19721485477324616, 'edge_cap': 0.5332710581729813, 'bull_strategy': 'mean_reversion', 'bull_bb_std_mult': 1.8913620278135153, 'bull_rsi_os': 15, 'bull_rsi_ob': 73, 'bull_adx_thresh': 17.831353528590977, 'bull_atr_min_pct': 0.015895498556990996, 'bull_atr_max_pct': 0.05873559126062684, 'bull_tp_mult': 2.185719061735103, 'bull_tsl_mult': 0.4384545447079122, 'bull_time_stop': 176, 'bull_use_sma': True, 'bull_use_ema': False, 'bull_use_atr': False, 'bull_use_adx': False, 'bull_use_spike': True, 'bull_rsi_required': False, 'bear_strategy': 'mean_reversion', 'bear_bb_std_mult': 3.337547426830882, 'bear_rsi_os': 9, 'bear_rsi_ob': 84, 'bear_adx_thresh': 15.858592055657457, 'bear_atr_min_pct': 0.010356696366557474, 'bear_atr_max_pct': 0.05600423060516662, 'bear_tp_mult': 1.425104041562991, 'bear_tsl_mult': 0.35195891825559045, 'bear_time_stop': 143, 'bear_use_sma': True, 'bear_use_ema': False, 'bear_use_atr': True, 'bear_use_adx': True, 'bear_use_spike': True, 'bear_rsi_required': False, 'sideways_strategy': 'mean_reversion', 'sideways_bb_std_mult': 2.1073016825319004, 'sideways_rsi_os': 54, 'sideways_rsi_ob': 77, 'sideways_adx_thresh': 25.595677237823594, 'sideways_atr_min_pct': 0.01951630051922149, 'sideways_atr_max_pct': 0.09626493301998375, 'sideways_tp_mult': 1.8690042957725272, 'sideways_tsl_mult': 0.6676441478605335, 'sideways_time_stop': 240, 'sideways_use_sma': False, 'sideways_use_ema': True, 'sideways_use_atr': False, 'sideways_use_adx': False, 'sideways_use_spike': False, 'sideways_rsi_required': True}.
[I 2025-08-30 20:20:49,754] Trial 784 finished with values: [-0.03654064464465079, 0.03645975200383718] and parameters: {'p_sma': 55, 'p_std': 27, 'p_atr': 18, 'p_adx': 9, 'rsi_period': 49, 'ema1': 24, 'ema2': 47, 'slip_atr_k': 0.1988121253933443, 'slip_spread_k': 0.09510991299271032, 'spread_hl_frac': 0.04593462292998988, 'bb_std_mult': 0.941308954721781, 'rsi_os': 32, 'rsi_ob': 58, 'vol_spike': 0.05666099667267266, 'adx_thresh': 31.430503803087895, 'atr_min_pct': 0.014570505481662537, 'atr_max_pct': 0.13384162602010016, 'tp_mult': 2.145651359951287, 'tsl_mult': 0.6339569916126707, 'strategy': 'mean_reversion', 'time_stop': 43, 'use_sma': False, 'use_atr': True, 'use_adx': True, 'use_ema': True, 'use_spike': False, 'rsi_required': True, 'edge_k': 0.20412778468800297, 'edge_cap': 0.1751596185471851, 'bull_strategy': 'mean_reversion', 'bull_bb_std_mult': 0.8578475449655656, 'bull_rsi_os': 24, 'bull_rsi_ob': 73, 'bull_adx_thresh': 23.684803647363324, 'bull_atr_min_pct': 0.0016377813895070517, 'bull_atr_max_pct': 0.02910776653922656, 'bull_tp_mult': 1.813304358486874, 'bull_tsl_mult': 0.7742624223785509, 'bull_time_stop': 176, 'bull_use_sma': True, 'bull_use_ema': False, 'bull_use_atr': False, 'bull_use_adx': False, 'bull_use_spike': True, 'bull_rsi_required': False, 'bear_strategy': 'mean_reversion', 'bear_bb_std_mult': 3.342881287127473, 'bear_rsi_os': 19, 'bear_rsi_ob': 85, 'bear_adx_thresh': 16.088596770349277, 'bear_atr_min_pct': 0.0019240054505153068, 'bear_atr_max_pct': 0.05508395616747615, 'bear_tp_mult': 1.8342889384234553, 'bear_tsl_mult': 0.062244065340448414, 'bear_time_stop': 262, 'bear_use_sma': True, 'bear_use_ema': False, 'bear_use_atr': True, 'bear_use_adx': True, 'bear_use_spike': True, 'bear_rsi_required': False, 'sideways_strategy': 'mean_reversion', 'sideways_bb_std_mult': 2.0839321928630006, 'sideways_rsi_os': 16, 'sideways_rsi_ob': 77, 'sideways_adx_thresh': 7.7849240783328595, 'sideways_atr_min_pct': 0.019471506539248274, 'sideways_atr_max_pct': 0.08590763398332, 'sideways_tp_mult': 1.4861051303594457, 'sideways_tsl_mult': 0.6658277422733575, 'sideways_time_stop': 105, 'sideways_use_sma': False, 'sideways_use_ema': True, 'sideways_use_atr': False, 'sideways_use_adx': False, 'sideways_use_spike': False, 'sideways_rsi_required': True}.
[I 2025-08-30 20:20:49,881] Trial 787 finished with values: [-1000000000.0, 1000000000.0] and parameters: {'p_sma': 34, 'p_std': 26, 'p_atr': 14, 'p_adx': 9, 'rsi_period': 13, 'ema1': 23, 'ema2': 17, 'slip_atr_k': 0.04507054910441449, 'slip_spread_k': 0.3940788947305973, 'spread_hl_frac': 0.045886439011470215, 'bb_std_mult': 0.6568533138513384, 'rsi_os': 40, 'rsi_ob': 86, 'vol_spike': 0.1594828359663891, 'adx_thresh': 18.875461365395065, 'atr_min_pct': 0.019274195713437303, 'atr_max_pct': 0.13482111991997164, 'tp_mult': 2.263251213318714, 'tsl_mult': 0.7948146704304476, 'strategy': 'mean_reversion', 'time_stop': 25, 'use_sma': False, 'use_atr': True, 'use_adx': True, 'use_ema': False, 'use_spike': True, 'rsi_required': True, 'edge_k': 0.7140731643526994, 'edge_cap': 0.17994378525136884, 'bull_strategy': 'mean_reversion', 'bull_bb_std_mult': 0.6395442065363652, 'bull_rsi_os': 16, 'bull_rsi_ob': 67, 'bull_adx_thresh': 5.847564656325808, 'bull_atr_min_pct': 0.002349866426954899, 'bull_atr_max_pct': 0.06789315141850154, 'bull_tp_mult': 1.8877112431231002, 'bull_tsl_mult': 0.9336442076660091, 'bull_time_stop': 294, 'bull_use_sma': True, 'bull_use_ema': False, 'bull_use_atr': False, 'bull_use_adx': True, 'bull_use_spike': True, 'bull_rsi_required': False, 'bear_strategy': 'mean_reversion', 'bear_bb_std_mult': 3.3168047603094695, 'bear_rsi_os': 15, 'bear_rsi_ob': 84, 'bear_adx_thresh': 5.715718595802755, 'bear_atr_min_pct': 0.015544575127158905, 'bear_atr_max_pct': 0.1356259167877481, 'bear_tp_mult': 1.8550092889723113, 'bear_tsl_mult': 0.5687007105144577, 'bear_time_stop': 25, 'bear_use_sma': True, 'bear_use_ema': False, 'bear_use_atr': True, 'bear_use_adx': True, 'bear_use_spike': False, 'bear_rsi_required': True, 'sideways_strategy': 'mean_reversion', 'sideways_bb_std_mult': 2.230846039082269, 'sideways_rsi_os': 17, 'sideways_rsi_ob': 70, 'sideways_adx_thresh': 32.07440627874561, 'sideways_atr_min_pct': 0.019572522119358407, 'sideways_atr_max_pct': 0.09601192104338846, 'sideways_tp_mult': 1.8013895810301486, 'sideways_tsl_mult': 0.6487617996763527, 'sideways_time_stop': 279, 'sideways_use_sma': False, 'sideways_use_ema': True, 'sideways_use_atr': False, 'sideways_use_adx': False, 'sideways_use_spike': False, 'sideways_rsi_required': True}.
[I 2025-08-30 20:20:50,175] Trial 786 finished with values: [-0.02205937073152786, 0.021961869693502122] and parameters: {'p_sma': 34, 'p_std': 24, 'p_atr': 27, 'p_adx': 11, 'rsi_period': 64, 'ema1': 22, 'ema2': 32, 'slip_atr_k': 0.02624444508228234, 'slip_spread_k': 0.39849351596008487, 'spread_hl_frac': 0.00182340674391961, 'bb_std_mult': 0.6574332821068851, 'rsi_os': 37, 'rsi_ob': 56, 'vol_spike': 0.0346846267639749, 'adx_thresh': 18.835324640972715, 'atr_min_pct': 0.011481580760596688, 'atr_max_pct': 0.11689670383867184, 'tp_mult': 1.3747709038172742, 'tsl_mult': 0.6959538580749213, 'strategy': 'mean_reversion', 'time_stop': 283, 'use_sma': False, 'use_atr': True, 'use_adx': True, 'use_ema': True, 'use_spike': False, 'rsi_required': True, 'edge_k': 0.7107868643701305, 'edge_cap': 0.5392231474195849, 'bull_strategy': 'mean_reversion', 'bull_bb_std_mult': 0.8602881684001282, 'bull_rsi_os': 47, 'bull_rsi_ob': 70, 'bull_adx_thresh': 23.40463396028592, 'bull_atr_min_pct': 0.001633322111722818, 'bull_atr_max_pct': 0.041842995480084244, 'bull_tp_mult': 1.4072812773894054, 'bull_tsl_mult': 0.9356043670784593, 'bull_time_stop': 175, 'bull_use_sma': True, 'bull_use_ema': False, 'bull_use_atr': False, 'bull_use_adx': False, 'bull_use_spike': True, 'bull_rsi_required': False, 'bear_strategy': 'mean_reversion', 'bear_bb_std_mult': 1.1296788686490316, 'bear_rsi_os': 15, 'bear_rsi_ob': 57, 'bear_adx_thresh': 9.43891112163817, 'bear_atr_min_pct': 0.015632948984857644, 'bear_atr_max_pct': 0.05477208737896151, 'bear_tp_mult': 1.6776806256410532, 'bear_tsl_mult': 0.055837472270392915, 'bear_time_stop': 26, 'bear_use_sma': True, 'bear_use_ema': False, 'bear_use_atr': True, 'bear_use_adx': True, 'bear_use_spike': True, 'bear_rsi_required': False, 'sideways_strategy': 'mean_reversion', 'sideways_bb_std_mult': 2.0816546198361143, 'sideways_rsi_os': 17, 'sideways_rsi_ob': 58, 'sideways_adx_thresh': 30.078513934792483, 'sideways_atr_min_pct': 0.013648953918835038, 'sideways_atr_max_pct': 0.11135117353394956, 'sideways_tp_mult': 1.8057460726478562, 'sideways_tsl_mult': 0.3844467694779284, 'sideways_time_stop': 277, 'sideways_use_sma': False, 'sideways_use_ema': True, 'sideways_use_atr': False, 'sideways_use_adx': False, 'sideways_use_spike': False, 'sideways_rsi_required': True}.
[I 2025-08-30 20:21:24,953] Trial 791 finished with values: [-0.02906747992256331, 0.029029000510586104] and parameters: {'p_sma': 36, 'p_std': 25, 'p_atr': 25, 'p_adx': 23, 'rsi_period': 56, 'ema1': 24, 'ema2': 23, 'slip_atr_k': 0.13766691662004135, 'slip_spread_k': 0.4436684147796658, 'spread_hl_frac': 0.004718959676042221, 'bb_std_mult': 1.8642601812729236, 'rsi_os': 45, 'rsi_ob': 45, 'vol_spike': 0.03273563466197668, 'adx_thresh': 23.654495689363742, 'atr_min_pct': 0.01015144547991444, 'atr_max_pct': 0.14116410550222705, 'tp_mult': 1.323851888429561, 'tsl_mult': 0.7718347006910299, 'strategy': 'breakout', 'time_stop': 59, 'use_sma': False, 'use_atr': True, 'use_adx': False, 'use_ema': False, 'use_spike': True, 'rsi_required': False, 'edge_k': 0.08814478163478523, 'edge_cap': 0.3495955896820002, 'bull_strategy': 'mean_reversion', 'bull_bb_std_mult': 2.0426126200589776, 'bull_rsi_os': 49, 'bull_rsi_ob': 71, 'bull_adx_thresh': 24.715493305584886, 'bull_atr_min_pct': 0.00027613260066074174, 'bull_atr_max_pct': 0.020967150130499754, 'bull_tp_mult': 2.2450954575863995, 'bull_tsl_mult': 0.37975335078435835, 'bull_time_stop': 148, 'bull_use_sma': True, 'bull_use_ema': False, 'bull_use_atr': False, 'bull_use_adx': True, 'bull_use_spike': True, 'bull_rsi_required': True, 'bear_strategy': 'breakout', 'bear_bb_std_mult': 3.2442045577171994, 'bear_rsi_os': 43, 'bear_rsi_ob': 70, 'bear_adx_thresh': 6.927211778298741, 'bear_atr_min_pct': 0.018018251048269276, 'bear_atr_max_pct': 0.05925248106519359, 'bear_tp_mult': 1.7832750648835014, 'bear_tsl_mult': 0.09643642402133709, 'bear_time_stop': 53, 'bear_use_sma': True, 'bear_use_ema': False, 'bear_use_atr': True, 'bear_use_adx': True, 'bear_use_spike': False, 'bear_rsi_required': True, 'sideways_strategy': 'breakout', 'sideways_bb_std_mult': 1.940784371779868, 'sideways_rsi_os': 20, 'sideways_rsi_ob': 59, 'sideways_adx_thresh': 23.74864622986142, 'sideways_atr_min_pct': 0.016986049315612536, 'sideways_atr_max_pct': 0.12001074825358117, 'sideways_tp_mult': 1.8461628403227093, 'sideways_tsl_mult': 0.9253579054319189, 'sideways_time_stop': 268, 'sideways_use_sma': True, 'sideways_use_ema': True, 'sideways_use_atr': False, 'sideways_use_adx': False, 'sideways_use_spike': False, 'sideways_rsi_required': False}.
[I 2025-08-30 20:21:25,349] Trial 788 finished with values: [-0.024887220583136305, 0.024863005440378436] and parameters: {'p_sma': 60, 'p_std': 24, 'p_atr': 19, 'p_adx': 23, 'rsi_period': 12, 'ema1': 23, 'ema2': 14, 'slip_atr_k': 0.13684640092050385, 'slip_spread_k': 0.17921668570674926, 'spread_hl_frac': 0.004395650114120423, 'bb_std_mult': 2.868646788011686, 'rsi_os': 40, 'rsi_ob': 58, 'vol_spike': 0.03225972584445451, 'adx_thresh': 29.709824742657133, 'atr_min_pct': 0.02517009098226237, 'atr_max_pct': 0.13474936229863793, 'tp_mult': 2.2734019618995203, 'tsl_mult': 0.6331017039356999, 'strategy': 'mean_reversion', 'time_stop': 25, 'use_sma': False, 'use_atr': True, 'use_adx': False, 'use_ema': False, 'use_spike': True, 'rsi_required': True, 'edge_k': 0.4980501234024146, 'edge_cap': 0.23933446984504603, 'bull_strategy': 'mean_reversion', 'bull_bb_std_mult': 1.325075382983303, 'bull_rsi_os': 47, 'bull_rsi_ob': 67, 'bull_adx_thresh': 23.930814944453708, 'bull_atr_min_pct': 0.0024065796035661418, 'bull_atr_max_pct': 0.03823470827537613, 'bull_tp_mult': 1.867142292666908, 'bull_tsl_mult': 0.24184663878448487, 'bull_time_stop': 197, 'bull_use_sma': True, 'bull_use_ema': False, 'bull_use_atr': False, 'bull_use_adx': True, 'bull_use_spike': True, 'bull_rsi_required': True, 'bear_strategy': 'breakout', 'bear_bb_std_mult': 2.3641425445506448, 'bear_rsi_os': 7, 'bear_rsi_ob': 83, 'bear_adx_thresh': 32.920115433834056, 'bear_atr_min_pct': 0.0006228700299334665, 'bear_atr_max_pct': 0.01715414865810834, 'bear_tp_mult': 1.8546547205706083, 'bear_tsl_mult': 0.4341093955948892, 'bear_time_stop': 25, 'bear_use_sma': True, 'bear_use_ema': False, 'bear_use_atr': True, 'bear_use_adx': True, 'bear_use_spike': False, 'bear_rsi_required': True, 'sideways_strategy': 'breakout', 'sideways_bb_std_mult': 1.1679395330503453, 'sideways_rsi_os': 6, 'sideways_rsi_ob': 56, 'sideways_adx_thresh': 9.701835720627559, 'sideways_atr_min_pct': 0.01875502661777327, 'sideways_atr_max_pct': 0.08705284476165237, 'sideways_tp_mult': 1.8090313583975497, 'sideways_tsl_mult': 0.24979959922322453, 'sideways_time_stop': 275, 'sideways_use_sma': True, 'sideways_use_ema': True, 'sideways_use_atr': False, 'sideways_use_adx': False, 'sideways_use_spike': False, 'sideways_rsi_required': False}.
[I 2025-08-30 20:21:25,350] Trial 790 finished with values: [-0.028156288942269736, 0.028075827574798637] and parameters: {'p_sma': 18, 'p_std': 24, 'p_atr': 27, 'p_adx': 7, 'rsi_period': 40, 'ema1': 17, 'ema2': 23, 'slip_atr_k': 0.13629787068028126, 'slip_spread_k': 0.881159494865593, 'spread_hl_frac': 0.004468353104056134, 'bb_std_mult': 1.873175162249377, 'rsi_os': 37, 'rsi_ob': 59, 'vol_spike': 0.264533916521815, 'adx_thresh': 18.214236129169986, 'atr_min_pct': 0.025284345537966414, 'atr_max_pct': 0.07649305685289375, 'tp_mult': 1.3257592062085226, 'tsl_mult': 0.7338796881095141, 'strategy': 'breakout', 'time_stop': 61, 'use_sma': False, 'use_atr': True, 'use_adx': False, 'use_ema': False, 'use_spike': True, 'rsi_required': True, 'edge_k': 0.09553646583497266, 'edge_cap': 0.35244288147512415, 'bull_strategy': 'mean_reversion', 'bull_bb_std_mult': 1.3315280975298243, 'bull_rsi_os': 46, 'bull_rsi_ob': 70, 'bull_adx_thresh': 25.04316812157965, 'bull_atr_min_pct': 0.0004779619920590103, 'bull_atr_max_pct': 0.03723282491844609, 'bull_tp_mult': 2.222211359394217, 'bull_tsl_mult': 0.23561594933423652, 'bull_time_stop': 201, 'bull_use_sma': True, 'bull_use_ema': False, 'bull_use_atr': False, 'bull_use_adx': True, 'bull_use_spike': True, 'bull_rsi_required': True, 'bear_strategy': 'breakout', 'bear_bb_std_mult': 1.1340481898576096, 'bear_rsi_os': 6, 'bear_rsi_ob': 57, 'bear_adx_thresh': 7.088239706412294, 'bear_atr_min_pct': 0.0274677148015971, 'bear_atr_max_pct': 0.05939680322529637, 'bear_tp_mult': 1.6769553598794058, 'bear_tsl_mult': 0.800786013770642, 'bear_time_stop': 41, 'bear_use_sma': True, 'bear_use_ema': False, 'bear_use_atr': True, 'bear_use_adx': True, 'bear_use_spike': False, 'bear_rsi_required': False, 'sideways_strategy': 'breakout', 'sideways_bb_std_mult': 0.6715169301596213, 'sideways_rsi_os': 17, 'sideways_rsi_ob': 56, 'sideways_adx_thresh': 27.944569535429373, 'sideways_atr_min_pct': 0.009756405518636189, 'sideways_atr_max_pct': 0.12102541323686314, 'sideways_tp_mult': 1.8116097134162839, 'sideways_tsl_mult': 0.6920368193587995, 'sideways_time_stop': 276, 'sideways_use_sma': True, 'sideways_use_ema': True, 'sideways_use_atr': False, 'sideways_use_adx': False, 'sideways_use_spike': False, 'sideways_rsi_required': False}.
[I 2025-08-30 20:21:25,422] Trial 789 finished with values: [-1000000000.0, 1000000000.0] and parameters: {'p_sma': 59, 'p_std': 24, 'p_atr': 11, 'p_adx': 7, 'rsi_period': 70, 'ema1': 23, 'ema2': 14, 'slip_atr_k': 0.22670452250305262, 'slip_spread_k': 0.8773293207791113, 'spread_hl_frac': 0.004517249432589148, 'bb_std_mult': 1.8839006290351261, 'rsi_os': 40, 'rsi_ob': 77, 'vol_spike': 0.26323827861016647, 'adx_thresh': 18.229410967641044, 'atr_min_pct': 0.024964007421104342, 'atr_max_pct': 0.095760273387219, 'tp_mult': 2.7045829628886637, 'tsl_mult': 0.6809218949416029, 'strategy': 'breakout', 'time_stop': 35, 'use_sma': False, 'use_atr': True, 'use_adx': False, 'use_ema': False, 'use_spike': True, 'rsi_required': True, 'edge_k': 0.7075349412091037, 'edge_cap': 0.23402426301552706, 'bull_strategy': 'mean_reversion', 'bull_bb_std_mult': 2.0403448874036014, 'bull_rsi_os': 44, 'bull_rsi_ob': 70, 'bull_adx_thresh': 24.908706256831348, 'bull_atr_min_pct': 0.010759615689856478, 'bull_atr_max_pct': 0.13483214012059042, 'bull_tp_mult': 2.2328089759445433, 'bull_tsl_mult': 0.5768858099560041, 'bull_time_stop': 201, 'bull_use_sma': True, 'bull_use_ema': False, 'bull_use_atr': False, 'bull_use_adx': True, 'bull_use_spike': True, 'bull_rsi_required': True, 'bear_strategy': 'breakout', 'bear_bb_std_mult': 2.365089392529418, 'bear_rsi_os': 44, 'bear_rsi_ob': 83, 'bear_adx_thresh': 32.74330422216583, 'bear_atr_min_pct': 0.02735773064853822, 'bear_atr_max_pct': 0.1336816427338986, 'bear_tp_mult': 1.6778657043470637, 'bear_tsl_mult': 0.09654409610965689, 'bear_time_stop': 16, 'bear_use_sma': True, 'bear_use_ema': False, 'bear_use_atr': True, 'bear_use_adx': True, 'bear_use_spike': False, 'bear_rsi_required': True, 'sideways_strategy': 'breakout', 'sideways_bb_std_mult': 2.2165401343152475, 'sideways_rsi_os': 50, 'sideways_rsi_ob': 58, 'sideways_adx_thresh': 23.734402957866163, 'sideways_atr_min_pct': 0.018764841785019363, 'sideways_atr_max_pct': 0.1196245298033562, 'sideways_tp_mult': 1.8000299497079608, 'sideways_tsl_mult': 0.8070730125342279, 'sideways_time_stop': 277, 'sideways_use_sma': True, 'sideways_use_ema': True, 'sideways_use_atr': False, 'sideways_use_adx': False, 'sideways_use_spike': False, 'sideways_rsi_required': False}.
