[I 2025-08-30 19:02:56,151] Trial 217 finished with values: [-1000000000.0, 1000000000.0] and parameters: {'p_sma': 44, 'p_std': 30, 'p_atr': 17, 'p_adx': 9, 'rsi_period': 50, 'ema1': 20, 'ema2': 14, 'slip_atr_k': 0.019534941549074848, 'slip_spread_k': 0.42921067151337616, 'spread_hl_frac': 0.02407165946546442, 'bb_std_mult': 0.8733078462852931, 'rsi_os': 29, 'rsi_ob': 50, 'vol_spike': 0.05703510213074635, 'adx_thresh': 17.02681674068392, 'atr_min_pct': 0.022539899716045714, 'atr_max_pct': 0.13016769919330104, 'tp_mult': 1.5506644746067308, 'tsl_mult': 0.3134315795199202, 'strategy': 'mean_reversion', 'time_stop': 215, 'use_sma': False, 'use_atr': True, 'use_adx': False, 'use_ema': True, 'use_spike': False, 'rsi_required': True, 'edge_k': 0.09680198782641929, 'edge_cap': 0.7563699240699077, 'bull_strategy': 'mean_reversion', 'bull_bb_std_mult': 1.823745266672825, 'bull_rsi_os': 49, 'bull_rsi_ob': 71, 'bull_adx_thresh': 9.84015826558829, 'bull_atr_min_pct': 0.001085240233724711, 'bull_atr_max_pct': 0.02312901201357319, 'bull_tp_mult': 1.9048730071757176, 'bull_tsl_mult': 0.6466228973809445, 'bull_time_stop': 37, 'bull_use_sma': True, 'bull_use_ema': False, 'bull_use_atr': True, 'bull_use_adx': True, 'bull_use_spike': False, 'bull_rsi_required': False, 'bear_strategy': 'breakout', 'bear_bb_std_mult': 2.878721175911756, 'bear_rsi_os': 33, 'bear_rsi_ob': 82, 'bear_adx_thresh': 25.528602719067372, 'bear_atr_min_pct': 0.006306270880713744, 'bear_atr_max_pct': 0.06350433385716044, 'bear_tp_mult': 2.1304400529558394, 'bear_tsl_mult': 0.12072947387084494, 'bear_time_stop': 38, 'bear_use_sma': False, 'bear_use_ema': True, 'bear_use_atr': True, 'bear_use_adx': True, 'bear_use_spike': False, 'bear_rsi_required': False, 'sideways_strategy': 'breakout', 'sideways_bb_std_mult': 1.9666753167933846, 'sideways_rsi_os': 15, 'sideways_rsi_ob': 73, 'sideways_adx_thresh': 25.373065074655226, 'sideways_atr_min_pct': 0.019447592645414492, 'sideways_atr_max_pct': 0.11268129874348033, 'sideways_tp_mult': 1.8711348323982289, 'sideways_tsl_mult': 0.28306708435351025, 'sideways_time_stop': 199, 'sideways_use_sma': False, 'sideways_use_ema': False, 'sideways_use_atr': False, 'sideways_use_adx': False, 'sideways_use_spike': False, 'sideways_rsi_required': False}.
[I 2025-08-30 19:02:56,201] Trial 219 finished with values: [-1000000000.0, 1000000000.0] and parameters: {'p_sma': 31, 'p_std': 27, 'p_atr': 17, 'p_adx': 9, 'rsi_period': 68, 'ema1': 23, 'ema2': 17, 'slip_atr_k': 0.07384339465743754, 'slip_spread_k': 0.4234976529537534, 'spread_hl_frac': 0.024057406257591386, 'bb_std_mult': 0.8709370633624046, 'rsi_os': 37, 'rsi_ob': 50, 'vol_spike': 0.055408474507078656, 'adx_thresh': 16.900171534041373, 'atr_min_pct': 0.029980398988862393, 'atr_max_pct': 0.11307250908685826, 'tp_mult': 2.305995630511436, 'tsl_mult': 0.7622793390657832, 'strategy': 'mean_reversion', 'time_stop': 38, 'use_sma': False, 'use_atr': True, 'use_adx': False, 'use_ema': True, 'use_spike': False, 'rsi_required': True, 'edge_k': 1.609565952930671, 'edge_cap': 0.6291166448689435, 'bull_strategy': 'mean_reversion', 'bull_bb_std_mult': 1.8062240969348728, 'bull_rsi_os': 51, 'bull_rsi_ob': 73, 'bull_adx_thresh': 9.800942552357238, 'bull_atr_min_pct': 0.0007840310208613284, 'bull_atr_max_pct': 0.02337067015957707, 'bull_tp_mult': 1.9127649192985694, 'bull_tsl_mult': 0.576181057139858, 'bull_time_stop': 151, 'bull_use_sma': True, 'bull_use_ema': False, 'bull_use_atr': True, 'bull_use_adx': True, 'bull_use_spike': False, 'bull_rsi_required': True, 'bear_strategy': 'breakout', 'bear_bb_std_mult': 1.7710773378016802, 'bear_rsi_os': 34, 'bear_rsi_ob': 82, 'bear_adx_thresh': 25.83841404794701, 'bear_atr_min_pct': 0.010784659967860016, 'bear_atr_max_pct': 0.06295805098078261, 'bear_tp_mult': 2.186885565789409, 'bear_tsl_mult': 0.8337166616746039, 'bear_time_stop': 92, 'bear_use_sma': False, 'bear_use_ema': True, 'bear_use_atr': True, 'bear_use_adx': True, 'bear_use_spike': False, 'bear_rsi_required': False, 'sideways_strategy': 'breakout', 'sideways_bb_std_mult': 1.6228690028653365, 'sideways_rsi_os': 51, 'sideways_rsi_ob': 56, 'sideways_adx_thresh': 15.371261118020477, 'sideways_atr_min_pct': 0.01939329926570051, 'sideways_atr_max_pct': 0.09417288154537977, 'sideways_tp_mult': 1.4663636316763013, 'sideways_tsl_mult': 0.6594279859102075, 'sideways_time_stop': 217, 'sideways_use_sma': False, 'sideways_use_ema': False, 'sideways_use_atr': False, 'sideways_use_adx': False, 'sideways_use_spike': False, 'sideways_rsi_required': True}.
[I 2025-08-30 19:03:26,955] Trial 218 finished with values: [-1000000000.0, 1000000000.0] and parameters: {'p_sma': 40, 'p_std': 30, 'p_atr': 24, 'p_adx': 9, 'rsi_period': 36, 'ema1': 23, 'ema2': 54, 'slip_atr_k': 0.019524531989737116, 'slip_spread_k': 0.3051829665064634, 'spread_hl_frac': 0.04086256631985541, 'bb_std_mult': 0.8446193109077571, 'rsi_os': 37, 'rsi_ob': 53, 'vol_spike': 0.0385686968257388, 'adx_thresh': 31.212983101172632, 'atr_min_pct': 0.02287934677767622, 'atr_max_pct': 0.13063536507954782, 'tp_mult': 2.307647692902236, 'tsl_mult': 0.7632454063766239, 'strategy': 'mean_reversion', 'time_stop': 213, 'use_sma': False, 'use_atr': True, 'use_adx': False, 'use_ema': True, 'use_spike': False, 'rsi_required': True, 'edge_k': 1.6234728979177526, 'edge_cap': 0.5593996833621716, 'bull_strategy': 'mean_reversion', 'bull_bb_std_mult': 1.8298786266526206, 'bull_rsi_os': 51, 'bull_rsi_ob': 72, 'bull_adx_thresh': 16.428599982497545, 'bull_atr_min_pct': 0.02821531414272426, 'bull_atr_max_pct': 0.023032971463523667, 'bull_tp_mult': 1.0911311932909948, 'bull_tsl_mult': 0.7143377763218108, 'bull_time_stop': 223, 'bull_use_sma': True, 'bull_use_ema': False, 'bull_use_atr': True, 'bull_use_adx': True, 'bull_use_spike': False, 'bull_rsi_required': True, 'bear_strategy': 'breakout', 'bear_bb_std_mult': 2.7651101130289484, 'bear_rsi_os': 44, 'bear_rsi_ob': 82, 'bear_adx_thresh': 7.421226914402935, 'bear_atr_min_pct': 0.021572267810606373, 'bear_atr_max_pct': 0.11936780627286601, 'bear_tp_mult': 1.2172142980948308, 'bear_tsl_mult': 0.46997379765462644, 'bear_time_stop': 94, 'bear_use_sma': False, 'bear_use_ema': True, 'bear_use_atr': True, 'bear_use_adx': True, 'bear_use_spike': False, 'bear_rsi_required': False, 'sideways_strategy': 'breakout', 'sideways_bb_std_mult': 1.9801098415164107, 'sideways_rsi_os': 17, 'sideways_rsi_ob': 76, 'sideways_adx_thresh': 25.410053054817286, 'sideways_atr_min_pct': 0.01953792719034164, 'sideways_atr_max_pct': 0.1135925110862919, 'sideways_tp_mult': 1.4722383438411544, 'sideways_tsl_mult': 0.662612266597671, 'sideways_time_stop': 216, 'sideways_use_sma': False, 'sideways_use_ema': False, 'sideways_use_atr': False, 'sideways_use_adx': False, 'sideways_use_spike': False, 'sideways_rsi_required': True}.
[I 2025-08-30 19:03:27,588] Trial 216 finished with values: [-0.016370055962590446, 0.016290349953912823] and parameters: {'p_sma': 40, 'p_std': 46, 'p_atr': 29, 'p_adx': 9, 'rsi_period': 50, 'ema1': 17, 'ema2': 56, 'slip_atr_k': 0.020751068563136757, 'slip_spread_k': 0.42347865282385205, 'spread_hl_frac': 0.004331425047228415, 'bb_std_mult': 2.300722001185765, 'rsi_os': 29, 'rsi_ob': 53, 'vol_spike': 0.030416343113932542, 'adx_thresh': 34.520602571658806, 'atr_min_pct': 0.011416387272245958, 'atr_max_pct': 0.09534196454303313, 'tp_mult': 2.0549991792915785, 'tsl_mult': 0.7591964860496808, 'strategy': 'breakout', 'time_stop': 33, 'use_sma': False, 'use_atr': True, 'use_adx': False, 'use_ema': True, 'use_spike': False, 'rsi_required': True, 'edge_k': 1.6144316610872553, 'edge_cap': 0.5646683002716283, 'bull_strategy': 'mean_reversion', 'bull_bb_std_mult': 1.8403118986211062, 'bull_rsi_os': 48, 'bull_rsi_ob': 73, 'bull_adx_thresh': 9.627963920788932, 'bull_atr_min_pct': 0.000767930948870469, 'bull_atr_max_pct': 0.024461370278312845, 'bull_tp_mult': 1.6766000930596276, 'bull_tsl_mult': 0.6556277611778617, 'bull_time_stop': 190, 'bull_use_sma': True, 'bull_use_ema': False, 'bull_use_atr': True, 'bull_use_adx': True, 'bull_use_spike': False, 'bull_rsi_required': True, 'bear_strategy': 'breakout', 'bear_bb_std_mult': 1.9394437035593775, 'bear_rsi_os': 47, 'bear_rsi_ob': 72, 'bear_adx_thresh': 7.7023208388555755, 'bear_atr_min_pct': 0.006301534433291737, 'bear_atr_max_pct': 0.05726342025430857, 'bear_tp_mult': 2.093095869352215, 'bear_tsl_mult': 0.5941116367907331, 'bear_time_stop': 38, 'bear_use_sma': False, 'bear_use_ema': True, 'bear_use_atr': True, 'bear_use_adx': True, 'bear_use_spike': False, 'bear_rsi_required': False, 'sideways_strategy': 'breakout', 'sideways_bb_std_mult': 2.190606109139857, 'sideways_rsi_os': 29, 'sideways_rsi_ob': 73, 'sideways_adx_thresh': 18.00188118165798, 'sideways_atr_min_pct': 0.01953660873398748, 'sideways_atr_max_pct': 0.11330350382108116, 'sideways_tp_mult': 2.597079667606237, 'sideways_tsl_mult': 0.647511754484283, 'sideways_time_stop': 199, 'sideways_use_sma': False, 'sideways_use_ema': False, 'sideways_use_atr': False, 'sideways_use_adx': False, 'sideways_use_spike': False, 'sideways_rsi_required': False}.
[I 2025-08-30 19:03:30,503] Trial 221 finished with values: [-1000000000.0, 1000000000.0] and parameters: {'p_sma': 40, 'p_std': 26, 'p_atr': 26, 'p_adx': 27, 'rsi_period': 39, 'ema1': 11, 'ema2': 23, 'slip_atr_k': 0.023054093466951073, 'slip_spread_k': 0.45450616572611097, 'spread_hl_frac': 0.0044549222448032905, 'bb_std_mult': 3.390383762012358, 'rsi_os': 37, 'rsi_ob': 59, 'vol_spike': 0.18113485580821287, 'adx_thresh': 19.37814983847333, 'atr_min_pct': 0.019184593147697628, 'atr_max_pct': 0.13366370392535742, 'tp_mult': 2.245552223615612, 'tsl_mult': 0.7819180464475438, 'strategy': 'breakout', 'time_stop': 34, 'use_sma': False, 'use_atr': True, 'use_adx': False, 'use_ema': False, 'use_spike': True, 'rsi_required': True, 'edge_k': 0.18516020518585805, 'edge_cap': 0.2690392698031917, 'bull_strategy': 'mean_reversion', 'bull_bb_std_mult': 2.058253932228324, 'bull_rsi_os': 53, 'bull_rsi_ob': 72, 'bull_adx_thresh': 15.449989352447455, 'bull_atr_min_pct': 0.019463860410921283, 'bull_atr_max_pct': 0.05082682950280013, 'bull_tp_mult': 2.1413557107775123, 'bull_tsl_mult': 0.9808638552475695, 'bull_time_stop': 182, 'bull_use_sma': True, 'bull_use_ema': False, 'bull_use_atr': False, 'bull_use_adx': True, 'bull_use_spike': True, 'bull_rsi_required': True, 'bear_strategy': 'mean_reversion', 'bear_bb_std_mult': 3.40902306170912, 'bear_rsi_os': 13, 'bear_rsi_ob': 66, 'bear_adx_thresh': 7.803419981599694, 'bear_atr_min_pct': 0.009347922071554557, 'bear_atr_max_pct': 0.032703932173379864, 'bear_tp_mult': 1.6790750662473009, 'bear_tsl_mult': 0.0911550849105668, 'bear_time_stop': 153, 'bear_use_sma': True, 'bear_use_ema': False, 'bear_use_atr': True, 'bear_use_adx': True, 'bear_use_spike': True, 'bear_rsi_required': True, 'sideways_strategy': 'breakout', 'sideways_bb_std_mult': 1.3292707947956024, 'sideways_rsi_os': 17, 'sideways_rsi_ob': 58, 'sideways_adx_thresh': 11.895555653306962, 'sideways_atr_min_pct': 0.02000478672194637, 'sideways_atr_max_pct': 0.03323275687172092, 'sideways_tp_mult': 1.3058395677961676, 'sideways_tsl_mult': 0.6934131444776608, 'sideways_time_stop': 281, 'sideways_use_sma': True, 'sideways_use_ema': True, 'sideways_use_atr': True, 'sideways_use_adx': False, 'sideways_use_spike': False, 'sideways_rsi_required': False}.
[I 2025-08-30 19:03:30,592] Trial 220 finished with values: [-1000000000.0, 1000000000.0] and parameters: {'p_sma': 40, 'p_std': 27, 'p_atr': 29, 'p_adx': 13, 'rsi_period': 68, 'ema1': 23, 'ema2': 38, 'slip_atr_k': 0.15259105149634097, 'slip_spread_k': 0.30532159741038534, 'spread_hl_frac': 0.003962119740765285, 'bb_std_mult': 2.2730154773455173, 'rsi_os': 37, 'rsi_ob': 53, 'vol_spike': 0.0367774540618462, 'adx_thresh': 19.735196528070936, 'atr_min_pct': 0.02450718738786133, 'atr_max_pct': 0.09479057345336536, 'tp_mult': 2.2992397113602734, 'tsl_mult': 0.7587777442611044, 'strategy': 'breakout', 'time_stop': 34, 'use_sma': False, 'use_atr': True, 'use_adx': False, 'use_ema': False, 'use_spike': True, 'rsi_required': True, 'edge_k': 0.1905756098353293, 'edge_cap': 0.2645228864971744, 'bull_strategy': 'mean_reversion', 'bull_bb_std_mult': 2.8225219338668577, 'bull_rsi_os': 51, 'bull_rsi_ob': 72, 'bull_adx_thresh': 15.568189770270275, 'bull_atr_min_pct': 0.028225979139964552, 'bull_atr_max_pct': 0.024428437084697694, 'bull_tp_mult': 2.142167940576206, 'bull_tsl_mult': 0.6137968171586288, 'bull_time_stop': 179, 'bull_use_sma': True, 'bull_use_ema': False, 'bull_use_atr': False, 'bull_use_adx': True, 'bull_use_spike': True, 'bull_rsi_required': True, 'bear_strategy': 'breakout', 'bear_bb_std_mult': 1.7687431399743796, 'bear_rsi_os': 44, 'bear_rsi_ob': 85, 'bear_adx_thresh': 30.320696889918114, 'bear_atr_min_pct': 0.016258271205282972, 'bear_atr_max_pct': 0.05794272447429367, 'bear_tp_mult': 2.188599279086886, 'bear_tsl_mult': 0.4644199072453687, 'bear_time_stop': 202, 'bear_use_sma': True, 'bear_use_ema': False, 'bear_use_atr': True, 'bear_use_adx': True, 'bear_use_spike': True, 'bear_rsi_required': False, 'sideways_strategy': 'breakout', 'sideways_bb_std_mult': 2.1642465965364037, 'sideways_rsi_os': 17, 'sideways_rsi_ob': 56, 'sideways_adx_thresh': 11.793987462785491, 'sideways_atr_min_pct': 0.01999888600607861, 'sideways_atr_max_pct': 0.03382694350300502, 'sideways_tp_mult': 1.769826233921119, 'sideways_tsl_mult': 0.6569995419277439, 'sideways_time_stop': 226, 'sideways_use_sma': True, 'sideways_use_ema': True, 'sideways_use_atr': True, 'sideways_use_adx': False, 'sideways_use_spike': False, 'sideways_rsi_required': True}.
[I 2025-08-30 19:04:08,366] Trial 222 finished with values: [-1000000000.0, 1000000000.0] and parameters: {'p_sma': 40, 'p_std': 37, 'p_atr': 13, 'p_adx': 7, 'rsi_period': 13, 'ema1': 24, 'ema2': 56, 'slip_atr_k': 0.038288892490527235, 'slip_spread_k': 0.45671858499501333, 'spread_hl_frac': 0.014180095324993765, 'bb_std_mult': 2.469999797262378, 'rsi_os': 6, 'rsi_ob': 59, 'vol_spike': 0.24709539893469662, 'adx_thresh': 19.778941534410787, 'atr_min_pct': 0.013275268053194846, 'atr_max_pct': 0.10765415338209942, 'tp_mult': 1.6262242180468935, 'tsl_mult': 0.7151091418832549, 'strategy': 'breakout', 'time_stop': 25, 'use_sma': False, 'use_atr': True, 'use_adx': True, 'use_ema': False, 'use_spike': True, 'rsi_required': True, 'edge_k': 0.2141514175687145, 'edge_cap': 0.26237233677064803, 'bull_strategy': 'mean_reversion', 'bull_bb_std_mult': 3.1562698122893025, 'bull_rsi_os': 49, 'bull_rsi_ob': 74, 'bull_adx_thresh': 24.714444263553226, 'bull_atr_min_pct': 0.0035538032787879167, 'bull_atr_max_pct': 0.0317148254890642, 'bull_tp_mult': 2.1427630523337045, 'bull_tsl_mult': 0.6698240008400564, 'bull_time_stop': 205, 'bull_use_sma': True, 'bull_use_ema': False, 'bull_use_atr': False, 'bull_use_adx': False, 'bull_use_spike': True, 'bull_rsi_required': True, 'bear_strategy': 'mean_reversion', 'bear_bb_std_mult': 3.5829798634251873, 'bear_rsi_os': 23, 'bear_rsi_ob': 70, 'bear_adx_thresh': 30.603701582985735, 'bear_atr_min_pct': 0.015222096205083961, 'bear_atr_max_pct': 0.038441563728157456, 'bear_tp_mult': 1.6103629051801633, 'bear_tsl_mult': 0.2351071549037151, 'bear_time_stop': 192, 'bear_use_sma': True, 'bear_use_ema': False, 'bear_use_atr': True, 'bear_use_adx': True, 'bear_use_spike': True, 'bear_rsi_required': True, 'sideways_strategy': 'mean_reversion', 'sideways_bb_std_mult': 2.1789514979061906, 'sideways_rsi_os': 29, 'sideways_rsi_ob': 60, 'sideways_adx_thresh': 9.106622522833684, 'sideways_atr_min_pct': 0.018811545934566423, 'sideways_atr_max_pct': 0.11775673764842261, 'sideways_tp_mult': 1.7758430189875583, 'sideways_tsl_mult': 0.6986827028540249, 'sideways_time_stop': 224, 'sideways_use_sma': True, 'sideways_use_ema': True, 'sideways_use_atr': True, 'sideways_use_adx': False, 'sideways_use_spike': True, 'sideways_rsi_required': False}.
[I 2025-08-30 19:04:09,890] Trial 223 finished with values: [-1000000000.0, 1000000000.0] and parameters: {'p_sma': 40, 'p_std': 34, 'p_atr': 30, 'p_adx': 7, 'rsi_period': 21, 'ema1': 11, 'ema2': 34, 'slip_atr_k': 0.024783402946358432, 'slip_spread_k': 0.9959598116490458, 'spread_hl_frac': 0.014556911651160818, 'bb_std_mult': 2.3086914989084195, 'rsi_os': 27, 'rsi_ob': 51, 'vol_spike': 0.2493085406591018, 'adx_thresh': 22.566364172070614, 'atr_min_pct': 0.01949910976965423, 'atr_max_pct': 0.10733621161328513, 'tp_mult': 1.1862530401678226, 'tsl_mult': 0.716589880845327, 'strategy': 'breakout', 'time_stop': 35, 'use_sma': False, 'use_atr': False, 'use_adx': True, 'use_ema': False, 'use_spike': True, 'rsi_required': True, 'edge_k': 0.7901817490135978, 'edge_cap': 0.2608033572900988, 'bull_strategy': 'mean_reversion', 'bull_bb_std_mult': 3.165344584536857, 'bull_rsi_os': 53, 'bull_rsi_ob': 74, 'bull_adx_thresh': 22.46671605251864, 'bull_atr_min_pct': 0.00337291855202491, 'bull_atr_max_pct': 0.12974759380137846, 'bull_tp_mult': 2.2689639214835426, 'bull_tsl_mult': 0.6201561627442493, 'bull_time_stop': 205, 'bull_use_sma': True, 'bull_use_ema': False, 'bull_use_atr': False, 'bull_use_adx': True, 'bull_use_spike': True, 'bull_rsi_required': True, 'bear_strategy': 'mean_reversion', 'bear_bb_std_mult': 2.209891808257495, 'bear_rsi_os': 45, 'bear_rsi_ob': 70, 'bear_adx_thresh': 21.776855185457084, 'bear_atr_min_pct': 0.02641050076821866, 'bear_atr_max_pct': 0.012155308514923593, 'bear_tp_mult': 2.2728461140291585, 'bear_tsl_mult': 0.09743992578787054, 'bear_time_stop': 224, 'bear_use_sma': True, 'bear_use_ema': False, 'bear_use_atr': True, 'bear_use_adx': True, 'bear_use_spike': True, 'bear_rsi_required': True, 'sideways_strategy': 'breakout', 'sideways_bb_std_mult': 2.1781579763082464, 'sideways_rsi_os': 46, 'sideways_rsi_ob': 60, 'sideways_adx_thresh': 9.10245609641057, 'sideways_atr_min_pct': 0.020130348170895804, 'sideways_atr_max_pct': 0.03245435072287429, 'sideways_tp_mult': 1.7658652023651598, 'sideways_tsl_mult': 0.3105956401997257, 'sideways_time_stop': 279, 'sideways_use_sma': True, 'sideways_use_ema': True, 'sideways_use_atr': True, 'sideways_use_adx': False, 'sideways_use_spike': True, 'sideways_rsi_required': False}.
[I 2025-08-30 19:04:10,176] Trial 225 finished with values: [-1000000000.0, 1000000000.0] and parameters: {'p_sma': 41, 'p_std': 39, 'p_atr': 10, 'p_adx': 18, 'rsi_period': 51, 'ema1': 24, 'ema2': 34, 'slip_atr_k': 0.0288094986064917, 'slip_spread_k': 0.9693668375727276, 'spread_hl_frac': 0.011825378594640218, 'bb_std_mult': 1.9977923804116078, 'rsi_os': 28, 'rsi_ob': 52, 'vol_spike': 0.045312415694427406, 'adx_thresh': 22.53524383949379, 'atr_min_pct': 0.01793536201426435, 'atr_max_pct': 0.03437665105369538, 'tp_mult': 2.1782063288753424, 'tsl_mult': 0.7190357084637319, 'strategy': 'breakout', 'time_stop': 40, 'use_sma': False, 'use_atr': False, 'use_adx': True, 'use_ema': False, 'use_spike': True, 'rsi_required': True, 'edge_k': 0.9704385893198391, 'edge_cap': 0.2449137663704994, 'bull_strategy': 'mean_reversion', 'bull_bb_std_mult': 2.4489573535395586, 'bull_rsi_os': 49, 'bull_rsi_ob': 71, 'bull_adx_thresh': 24.77857667990256, 'bull_atr_min_pct': 0.0035304006211884635, 'bull_atr_max_pct': 0.13026000628370904, 'bull_tp_mult': 2.2501987789936275, 'bull_tsl_mult': 0.6735139725553085, 'bull_time_stop': 187, 'bull_use_sma': False, 'bull_use_ema': False, 'bull_use_atr': False, 'bull_use_adx': False, 'bull_use_spike': True, 'bull_rsi_required': True, 'bear_strategy': 'breakout', 'bear_bb_std_mult': 1.1735929694296505, 'bear_rsi_os': 45, 'bear_rsi_ob': 56, 'bear_adx_thresh': 6.91078531976351, 'bear_atr_min_pct': 0.026071786699537726, 'bear_atr_max_pct': 0.05225551504893018, 'bear_tp_mult': 2.049008393501927, 'bear_tsl_mult': 0.11187210989710035, 'bear_time_stop': 226, 'bear_use_sma': True, 'bear_use_ema': False, 'bear_use_atr': False, 'bear_use_adx': False, 'bear_use_spike': False, 'bear_rsi_required': False, 'sideways_strategy': 'mean_reversion', 'sideways_bb_std_mult': 2.0378171752386107, 'sideways_rsi_os': 15, 'sideways_rsi_ob': 59, 'sideways_adx_thresh': 9.065912598125921, 'sideways_atr_min_pct': 0.01875039000778798, 'sideways_atr_max_pct': 0.09925778546394406, 'sideways_tp_mult': 1.6988851225893473, 'sideways_tsl_mult': 0.6805981530402866, 'sideways_time_stop': 158, 'sideways_use_sma': True, 'sideways_use_ema': True, 'sideways_use_atr': False, 'sideways_use_adx': True, 'sideways_use_spike': True, 'sideways_rsi_required': False}.
