[I 2025-08-30 20:00:42,581] Trial 639 finished with values: [-0.01981479893706073, 0.019833807924873777] and parameters: {'p_sma': 39, 'p_std': 30, 'p_atr': 23, 'p_adx': 8, 'rsi_period': 47, 'ema1': 12, 'ema2': 39, 'slip_atr_k': 0.02786763738545538, 'slip_spread_k': 0.37465306431191886, 'spread_hl_frac': 0.0038245823944399425, 'bb_std_mult': 2.2119370116230708, 'rsi_os': 27, 'rsi_ob': 58, 'vol_spike': 0.05226666103283659, 'adx_thresh': 19.504023830231656, 'atr_min_pct': 0.023574832674978948, 'atr_max_pct': 0.08394098314643283, 'tp_mult': 2.8585357468766386, 'tsl_mult': 0.7027685615266487, 'strategy': 'breakout', 'time_stop': 65, 'use_sma': False, 'use_atr': True, 'use_adx': False, 'use_ema': False, 'use_spike': True, 'rsi_required': True, 'edge_k': 0.0694407363701827, 'edge_cap': 0.2172844017077382, 'bull_strategy': 'mean_reversion', 'bull_bb_std_mult': 1.894692005935965, 'bull_rsi_os': 50, 'bull_rsi_ob': 56, 'bull_adx_thresh': 25.181821767794432, 'bull_atr_min_pct': 0.0011418055972210964, 'bull_atr_max_pct': 0.021870312338123844, 'bull_tp_mult': 2.1414158905374854, 'bull_tsl_mult': 0.2881689068848744, 'bull_time_stop': 185, 'bull_use_sma': False, 'bull_use_ema': False, 'bull_use_atr': False, 'bull_use_adx': True, 'bull_use_spike': True, 'bull_rsi_required': True, 'bear_strategy': 'breakout', 'bear_bb_std_mult': 1.3965918345834436, 'bear_rsi_os': 20, 'bear_rsi_ob': 84, 'bear_adx_thresh': 6.340587633888122, 'bear_atr_min_pct': 0.00713100217241743, 'bear_atr_max_pct': 0.059269910475241216, 'bear_tp_mult': 1.862108378971679, 'bear_tsl_mult': 0.6581861298127207, 'bear_time_stop': 293, 'bear_use_sma': True, 'bear_use_ema': False, 'bear_use_atr': True, 'bear_use_adx': True, 'bear_use_spike': False, 'bear_rsi_required': False, 'sideways_strategy': 'breakout', 'sideways_bb_std_mult': 2.1061464481215855, 'sideways_rsi_os': 16, 'sideways_rsi_ob': 49, 'sideways_adx_thresh': 30.61217832542459, 'sideways_atr_min_pct': 0.018707706355164284, 'sideways_atr_max_pct': 0.060390052121820886, 'sideways_tp_mult': 1.7433831783266867, 'sideways_tsl_mult': 0.6709532937546137, 'sideways_time_stop': 31, 'sideways_use_sma': True, 'sideways_use_ema': True, 'sideways_use_atr': False, 'sideways_use_adx': True, 'sideways_use_spike': False, 'sideways_rsi_required': False}.
[I 2025-08-30 20:00:43,052] Trial 640 finished with values: [-1000000000.0, 1000000000.0] and parameters: {'p_sma': 11, 'p_std': 27, 'p_atr': 23, 'p_adx': 8, 'rsi_period': 54, 'ema1': 15, 'ema2': 55, 'slip_atr_k': 0.005833521941022922, 'slip_spread_k': 0.41803617192589176, 'spread_hl_frac': 0.04037302402277231, 'bb_std_mult': 0.9457876222097527, 'rsi_os': 34, 'rsi_ob': 62, 'vol_spike': 0.052343662415445816, 'adx_thresh': 7.891594874712084, 'atr_min_pct': 0.006508772832219846, 'atr_max_pct': 0.13554585148799053, 'tp_mult': 2.106454901127805, 'tsl_mult': 0.7101849366530658, 'strategy': 'breakout', 'time_stop': 64, 'use_sma': False, 'use_atr': True, 'use_adx': False, 'use_ema': False, 'use_spike': True, 'rsi_required': True, 'edge_k': 0.13822539620532087, 'edge_cap': 0.5758873983676436, 'bull_strategy': 'mean_reversion', 'bull_bb_std_mult': 1.8928089001482113, 'bull_rsi_os': 50, 'bull_rsi_ob': 68, 'bull_adx_thresh': 8.45662257518009, 'bull_atr_min_pct': 0.0011953431735094652, 'bull_atr_max_pct': 0.030522594276154336, 'bull_tp_mult': 2.149238615299227, 'bull_tsl_mult': 0.9803188710369056, 'bull_time_stop': 261, 'bull_use_sma': False, 'bull_use_ema': False, 'bull_use_atr': False, 'bull_use_adx': True, 'bull_use_spike': True, 'bull_rsi_required': True, 'bear_strategy': 'breakout', 'bear_bb_std_mult': 0.9712484157944536, 'bear_rsi_os': 20, 'bear_rsi_ob': 84, 'bear_adx_thresh': 6.286625422627328, 'bear_atr_min_pct': 0.028051713495186103, 'bear_atr_max_pct': 0.13240057276903147, 'bear_tp_mult': 1.8613241119203372, 'bear_tsl_mult': 0.8695618587581115, 'bear_time_stop': 42, 'bear_use_sma': True, 'bear_use_ema': False, 'bear_use_atr': True, 'bear_use_adx': True, 'bear_use_spike': False, 'bear_rsi_required': False, 'sideways_strategy': 'breakout', 'sideways_bb_std_mult': 1.9578464097833257, 'sideways_rsi_os': 32, 'sideways_rsi_ob': 57, 'sideways_adx_thresh': 8.341506292408315, 'sideways_atr_min_pct': 0.01890966250781535, 'sideways_atr_max_pct': 0.06263126523584989, 'sideways_tp_mult': 2.973913249692896, 'sideways_tsl_mult': 0.6691276033705693, 'sideways_time_stop': 255, 'sideways_use_sma': True, 'sideways_use_ema': True, 'sideways_use_atr': False, 'sideways_use_adx': True, 'sideways_use_spike': False, 'sideways_rsi_required': False}.
[I 2025-08-30 20:00:43,215] Trial 642 finished with values: [-0.027406183333833378, 0.027337136195666606] and parameters: {'p_sma': 59, 'p_std': 19, 'p_atr': 9, 'p_adx': 27, 'rsi_period': 50, 'ema1': 9, 'ema2': 19, 'slip_atr_k': 0.023931704681029942, 'slip_spread_k': 0.8279184068949641, 'spread_hl_frac': 0.003815503538157711, 'bb_std_mult': 2.2172539661902744, 'rsi_os': 21, 'rsi_ob': 58, 'vol_spike': 0.051694601288363784, 'adx_thresh': 17.764894156405276, 'atr_min_pct': 0.020123514821468347, 'atr_max_pct': 0.08248640347995928, 'tp_mult': 2.999459136287149, 'tsl_mult': 0.4973162436746919, 'strategy': 'breakout', 'time_stop': 15, 'use_sma': False, 'use_atr': True, 'use_adx': True, 'use_ema': False, 'use_spike': True, 'rsi_required': False, 'edge_k': 1.1155968693586085, 'edge_cap': 0.21235895732731724, 'bull_strategy': 'mean_reversion', 'bull_bb_std_mult': 0.8957749919884699, 'bull_rsi_os': 52, 'bull_rsi_ob': 79, 'bull_adx_thresh': 7.422514766260038, 'bull_atr_min_pct': 0.0015205363939058843, 'bull_atr_max_pct': 0.021630537476123833, 'bull_tp_mult': 2.90152403281266, 'bull_tsl_mult': 0.283745507372658, 'bull_time_stop': 221, 'bull_use_sma': False, 'bull_use_ema': False, 'bull_use_atr': True, 'bull_use_adx': False, 'bull_use_spike': True, 'bull_rsi_required': True, 'bear_strategy': 'breakout', 'bear_bb_std_mult': 3.3324064103336544, 'bear_rsi_os': 47, 'bear_rsi_ob': 84, 'bear_adx_thresh': 6.000534687426854, 'bear_atr_min_pct': 0.02812973176413333, 'bear_atr_max_pct': 0.13250671928915086, 'bear_tp_mult': 2.872347949375758, 'bear_tsl_mult': 0.12877795873929468, 'bear_time_stop': 246, 'bear_use_sma': True, 'bear_use_ema': True, 'bear_use_atr': True, 'bear_use_adx': True, 'bear_use_spike': True, 'bear_rsi_required': False, 'sideways_strategy': 'mean_reversion', 'sideways_bb_std_mult': 0.833453383105222, 'sideways_rsi_os': 25, 'sideways_rsi_ob': 50, 'sideways_adx_thresh': 8.345193516538547, 'sideways_atr_min_pct': 0.018708903829326728, 'sideways_atr_max_pct': 0.07862771876910558, 'sideways_tp_mult': 1.7564638601750142, 'sideways_tsl_mult': 0.48686535534273745, 'sideways_time_stop': 293, 'sideways_use_sma': True, 'sideways_use_ema': True, 'sideways_use_atr': True, 'sideways_use_adx': True, 'sideways_use_spike': False, 'sideways_rsi_required': False}.
[I 2025-08-30 20:00:43,401] Trial 641 finished with values: [-1000000000.0, 1000000000.0] and parameters: {'p_sma': 37, 'p_std': 40, 'p_atr': 9, 'p_adx': 27, 'rsi_period': 51, 'ema1': 15, 'ema2': 21, 'slip_atr_k': 0.005087435394481804, 'slip_spread_k': 0.36790671339768943, 'spread_hl_frac': 0.0040388501099025845, 'bb_std_mult': 3.4194346087639413, 'rsi_os': 27, 'rsi_ob': 62, 'vol_spike': 0.05164871000216772, 'adx_thresh': 17.974971379854907, 'atr_min_pct': 0.02343652492452302, 'atr_max_pct': 0.13474750664444834, 'tp_mult': 2.14411726949041, 'tsl_mult': 0.2556201644563544, 'strategy': 'breakout', 'time_stop': 65, 'use_sma': False, 'use_atr': True, 'use_adx': False, 'use_ema': False, 'use_spike': True, 'rsi_required': True, 'edge_k': 0.8231608350845762, 'edge_cap': 0.38229915681732596, 'bull_strategy': 'mean_reversion', 'bull_bb_std_mult': 0.9023533602939566, 'bull_rsi_os': 13, 'bull_rsi_ob': 46, 'bull_adx_thresh': 28.697543621444964, 'bull_atr_min_pct': 0.028128540199584152, 'bull_atr_max_pct': 0.021781113223246787, 'bull_tp_mult': 1.1929564676595201, 'bull_tsl_mult': 0.07218241954817267, 'bull_time_stop': 183, 'bull_use_sma': False, 'bull_use_ema': False, 'bull_use_atr': True, 'bull_use_adx': False, 'bull_use_spike': True, 'bull_rsi_required': True, 'bear_strategy': 'breakout', 'bear_bb_std_mult': 1.0050617042211842, 'bear_rsi_os': 5, 'bear_rsi_ob': 88, 'bear_adx_thresh': 5.022977541137017, 'bear_atr_min_pct': 0.014709799862373056, 'bear_atr_max_pct': 0.142917144617319, 'bear_tp_mult': 1.757450331432333, 'bear_tsl_mult': 0.11987677473893438, 'bear_time_stop': 41, 'bear_use_sma': True, 'bear_use_ema': True, 'bear_use_atr': True, 'bear_use_adx': True, 'bear_use_spike': True, 'bear_rsi_required': False, 'sideways_strategy': 'mean_reversion', 'sideways_bb_std_mult': 0.7775013349950564, 'sideways_rsi_os': 16, 'sideways_rsi_ob': 57, 'sideways_adx_thresh': 8.410530736429532, 'sideways_atr_min_pct': 0.0064999010971087175, 'sideways_atr_max_pct': 0.06152753251637126, 'sideways_tp_mult': 1.5018580198066218, 'sideways_tsl_mult': 0.6931772679926191, 'sideways_time_stop': 281, 'sideways_use_sma': True, 'sideways_use_ema': True, 'sideways_use_atr': True, 'sideways_use_adx': True, 'sideways_use_spike': False, 'sideways_rsi_required': False}.
[I 2025-08-30 20:01:16,150] Trial 644 finished with values: [-1000000000.0, 1000000000.0] and parameters: {'p_sma': 44, 'p_std': 26, 'p_atr': 13, 'p_adx': 9, 'rsi_period': 15, 'ema1': 18, 'ema2': 22, 'slip_atr_k': 0.020063387121578735, 'slip_spread_k': 0.3672040980771112, 'spread_hl_frac': 0.002419375904801349, 'bb_std_mult': 0.7229511473688561, 'rsi_os': 6, 'rsi_ob': 56, 'vol_spike': 0.27637319585668485, 'adx_thresh': 34.91774809108028, 'atr_min_pct': 0.024066932260108004, 'atr_max_pct': 0.13279170079499353, 'tp_mult': 2.7050255125179015, 'tsl_mult': 0.7738160028783034, 'strategy': 'breakout', 'time_stop': 29, 'use_sma': True, 'use_atr': False, 'use_adx': True, 'use_ema': False, 'use_spike': True, 'rsi_required': False, 'edge_k': 0.017978724053713258, 'edge_cap': 0.39518392533751345, 'bull_strategy': 'breakout', 'bull_bb_std_mult': 1.7673247109778474, 'bull_rsi_os': 18, 'bull_rsi_ob': 74, 'bull_adx_thresh': 27.335092012395144, 'bull_atr_min_pct': 0.02819518744375689, 'bull_atr_max_pct': 0.02501921136619438, 'bull_tp_mult': 1.789584987323373, 'bull_tsl_mult': 0.9998891508150486, 'bull_time_stop': 221, 'bull_use_sma': True, 'bull_use_ema': False, 'bull_use_atr': True, 'bull_use_adx': False, 'bull_use_spike': True, 'bull_rsi_required': True, 'bear_strategy': 'breakout', 'bear_bb_std_mult': 2.4929815777051694, 'bear_rsi_os': 5, 'bear_rsi_ob': 86, 'bear_adx_thresh': 13.986162019699643, 'bear_atr_min_pct': 0.013399626281726704, 'bear_atr_max_pct': 0.049914053266228234, 'bear_tp_mult': 2.089290042252333, 'bear_tsl_mult': 0.39297927919400755, 'bear_time_stop': 31, 'bear_use_sma': True, 'bear_use_ema': True, 'bear_use_atr': False, 'bear_use_adx': False, 'bear_use_spike': True, 'bear_rsi_required': True, 'sideways_strategy': 'mean_reversion', 'sideways_bb_std_mult': 1.8716191244344715, 'sideways_rsi_os': 45, 'sideways_rsi_ob': 56, 'sideways_adx_thresh': 10.19219196526338, 'sideways_atr_min_pct': 0.004534129879802713, 'sideways_atr_max_pct': 0.12388509394595544, 'sideways_tp_mult': 1.504302195864414, 'sideways_tsl_mult': 0.7111491983036877, 'sideways_time_stop': 281, 'sideways_use_sma': False, 'sideways_use_ema': False, 'sideways_use_atr': True, 'sideways_use_adx': False, 'sideways_use_spike': False, 'sideways_rsi_required': True}.
[I 2025-08-30 20:01:16,721] Trial 645 finished with values: [-1000000000.0, 1000000000.0] and parameters: {'p_sma': 44, 'p_std': 26, 'p_atr': 9, 'p_adx': 9, 'rsi_period': 51, 'ema1': 24, 'ema2': 18, 'slip_atr_k': 0.020146990261210845, 'slip_spread_k': 0.45411163885915645, 'spread_hl_frac': 0.002748766803486389, 'bb_std_mult': 0.7167805724149148, 'rsi_os': 36, 'rsi_ob': 60, 'vol_spike': 0.26845685060586016, 'adx_thresh': 24.23691207740571, 'atr_min_pct': 0.02389088583327389, 'atr_max_pct': 0.13239858867968166, 'tp_mult': 1.9153994136575687, 'tsl_mult': 0.7731994815267519, 'strategy': 'breakout', 'time_stop': 85, 'use_sma': True, 'use_atr': False, 'use_adx': False, 'use_ema': True, 'use_spike': False, 'rsi_required': False, 'edge_k': 0.1348995436728137, 'edge_cap': 0.3936959881125909, 'bull_strategy': 'breakout', 'bull_bb_std_mult': 1.7493772095663647, 'bull_rsi_os': 21, 'bull_rsi_ob': 92, 'bull_adx_thresh': 28.184112698711658, 'bull_atr_min_pct': 0.003238566006380364, 'bull_atr_max_pct': 0.07632597419497184, 'bull_tp_mult': 1.9583302646464196, 'bull_tsl_mult': 0.9433542698946739, 'bull_time_stop': 180, 'bull_use_sma': True, 'bull_use_ema': False, 'bull_use_atr': True, 'bull_use_adx': False, 'bull_use_spike': True, 'bull_rsi_required': False, 'bear_strategy': 'breakout', 'bear_bb_std_mult': 1.0493486663036067, 'bear_rsi_os': 49, 'bear_rsi_ob': 81, 'bear_adx_thresh': 13.645661229747214, 'bear_atr_min_pct': 0.013544634986934846, 'bear_atr_max_pct': 0.04970836136748477, 'bear_tp_mult': 1.7595270761293669, 'bear_tsl_mult': 0.7101258139093223, 'bear_time_stop': 31, 'bear_use_sma': True, 'bear_use_ema': True, 'bear_use_atr': False, 'bear_use_adx': False, 'bear_use_spike': True, 'bear_rsi_required': True, 'sideways_strategy': 'mean_reversion', 'sideways_bb_std_mult': 1.9369362513159352, 'sideways_rsi_os': 14, 'sideways_rsi_ob': 77, 'sideways_adx_thresh': 10.06516554459846, 'sideways_atr_min_pct': 0.019562858026073677, 'sideways_atr_max_pct': 0.08192428633109096, 'sideways_tp_mult': 1.9519561633621116, 'sideways_tsl_mult': 0.7228125784251455, 'sideways_time_stop': 281, 'sideways_use_sma': False, 'sideways_use_ema': False, 'sideways_use_atr': True, 'sideways_use_adx': False, 'sideways_use_spike': False, 'sideways_rsi_required': True}.
[I 2025-08-30 20:01:16,844] Trial 646 finished with values: [-1000000000.0, 1000000000.0] and parameters: {'p_sma': 44, 'p_std': 26, 'p_atr': 10, 'p_adx': 23, 'rsi_period': 40, 'ema1': 27, 'ema2': 57, 'slip_atr_k': 0.23610894680843347, 'slip_spread_k': 0.4429270172922345, 'spread_hl_frac': 0.005057913750347512, 'bb_std_mult': 1.650818013633718, 'rsi_os': 36, 'rsi_ob': 65, 'vol_spike': 0.26501767472558563, 'adx_thresh': 18.708796390623277, 'atr_min_pct': 0.0240084817586388, 'atr_max_pct': 0.13292062461592202, 'tp_mult': 1.8093330474232956, 'tsl_mult': 0.771098375572795, 'strategy': 'breakout', 'time_stop': 28, 'use_sma': True, 'use_atr': False, 'use_adx': True, 'use_ema': True, 'use_spike': False, 'rsi_required': False, 'edge_k': 0.4125707264256354, 'edge_cap': 0.24078466940459778, 'bull_strategy': 'breakout', 'bull_bb_std_mult': 1.7523205668337383, 'bull_rsi_os': 51, 'bull_rsi_ob': 74, 'bull_adx_thresh': 26.396556963912072, 'bull_atr_min_pct': 0.005222693725203979, 'bull_atr_max_pct': 0.08992322308190687, 'bull_tp_mult': 2.6289474953009426, 'bull_tsl_mult': 0.9550341317883805, 'bull_time_stop': 117, 'bull_use_sma': True, 'bull_use_ema': False, 'bull_use_atr': False, 'bull_use_adx': True, 'bull_use_spike': True, 'bull_rsi_required': False, 'bear_strategy': 'breakout', 'bear_bb_std_mult': 3.2933311734892032, 'bear_rsi_os': 44, 'bear_rsi_ob': 80, 'bear_adx_thresh': 5.553984960099485, 'bear_atr_min_pct': 0.005130490172287108, 'bear_atr_max_pct': 0.02074879710711549, 'bear_tp_mult': 2.477471896183399, 'bear_tsl_mult': 0.3968270342790597, 'bear_time_stop': 31, 'bear_use_sma': True, 'bear_use_ema': False, 'bear_use_atr': False, 'bear_use_adx': False, 'bear_use_spike': False, 'bear_rsi_required': True, 'sideways_strategy': 'breakout', 'sideways_bb_std_mult': 1.920974727154154, 'sideways_rsi_os': 29, 'sideways_rsi_ob': 92, 'sideways_adx_thresh': 9.417583814164097, 'sideways_atr_min_pct': 0.019522344460441494, 'sideways_atr_max_pct': 0.12331650086549678, 'sideways_tp_mult': 1.8089187128944637, 'sideways_tsl_mult': 0.7165901879129858, 'sideways_time_stop': 271, 'sideways_use_sma': False, 'sideways_use_ema': False, 'sideways_use_atr': False, 'sideways_use_adx': False, 'sideways_use_spike': False, 'sideways_rsi_required': True}.
[I 2025-08-30 20:01:17,349] Trial 643 finished with values: [-0.018735886139943037, 0.019163946160814373] and parameters: {'p_sma': 44, 'p_std': 40, 'p_atr': 9, 'p_adx': 9, 'rsi_period': 15, 'ema1': 27, 'ema2': 22, 'slip_atr_k': 0.019683884606384042, 'slip_spread_k': 0.6170609382512832, 'spread_hl_frac': 0.0023373606051182837, 'bb_std_mult': 0.7146067988821723, 'rsi_os': 34, 'rsi_ob': 58, 'vol_spike': 0.09350670554517826, 'adx_thresh': 17.743142125774135, 'atr_min_pct': 0.01989866888207298, 'atr_max_pct': 0.13347305151527256, 'tp_mult': 2.0932879661851898, 'tsl_mult': 0.4970943695696503, 'strategy': 'breakout', 'time_stop': 29, 'use_sma': True, 'use_atr': False, 'use_adx': True, 'use_ema': False, 'use_spike': True, 'rsi_required': False, 'edge_k': 0.1503353122282404, 'edge_cap': 0.38951657774511045, 'bull_strategy': 'breakout', 'bull_bb_std_mult': 1.7482124002836323, 'bull_rsi_os': 52, 'bull_rsi_ob': 74, 'bull_adx_thresh': 8.510523188367578, 'bull_atr_min_pct': 0.0015320622395147223, 'bull_atr_max_pct': 0.06196583153145058, 'bull_tp_mult': 2.0539761044563334, 'bull_tsl_mult': 0.9454780820624359, 'bull_time_stop': 180, 'bull_use_sma': True, 'bull_use_ema': False, 'bull_use_atr': True, 'bull_use_adx': False, 'bull_use_spike': True, 'bull_rsi_required': True, 'bear_strategy': 'breakout', 'bear_bb_std_mult': 2.6834888481216903, 'bear_rsi_os': 51, 'bear_rsi_ob': 83, 'bear_adx_thresh': 29.011565711570057, 'bear_atr_min_pct': 0.005479034498677003, 'bear_atr_max_pct': 0.13130025064642495, 'bear_tp_mult': 1.7659794610329973, 'bear_tsl_mult': 0.16640013493628608, 'bear_time_stop': 39, 'bear_use_sma': True, 'bear_use_ema': True, 'bear_use_atr': False, 'bear_use_adx': False, 'bear_use_spike': True, 'bear_rsi_required': False, 'sideways_strategy': 'mean_reversion', 'sideways_bb_std_mult': 0.7852950549992233, 'sideways_rsi_os': 14, 'sideways_rsi_ob': 92, 'sideways_adx_thresh': 8.612658207886891, 'sideways_atr_min_pct': 0.01945478288790032, 'sideways_atr_max_pct': 0.1235423293028005, 'sideways_tp_mult': 1.7694535134252007, 'sideways_tsl_mult': 0.6910110935539254, 'sideways_time_stop': 282, 'sideways_use_sma': False, 'sideways_use_ema': True, 'sideways_use_atr': True, 'sideways_use_adx': False, 'sideways_use_spike': False, 'sideways_rsi_required': True}.
[I 2025-08-30 20:01:18,272] Trial 648 finished with values: [-1000000000.0, 1000000000.0] and parameters: {'p_sma': 40, 'p_std': 55, 'p_atr': 10, 'p_adx': 16, 'rsi_period': 58, 'ema1': 27, 'ema2': 16, 'slip_atr_k': 0.02936210089825725, 'slip_spread_k': 0.6103162179852106, 'spread_hl_frac': 0.005027636908232665, 'bb_std_mult': 3.3406811727065904, 'rsi_os': 50, 'rsi_ob': 57, 'vol_spike': 0.022318162666950025, 'adx_thresh': 18.597140381187113, 'atr_min_pct': 0.01837116904538389, 'atr_max_pct': 0.1273942823730456, 'tp_mult': 1.8062380184721363, 'tsl_mult': 0.7340460505553368, 'strategy': 'mean_reversion', 'time_stop': 23, 'use_sma': False, 'use_atr': True, 'use_adx': False, 'use_ema': False, 'use_spike': True, 'rsi_required': True, 'edge_k': 0.4242064235281433, 'edge_cap': 0.2479038306303935, 'bull_strategy': 'mean_reversion', 'bull_bb_std_mult': 2.750817401873616, 'bull_rsi_os': 24, 'bull_rsi_ob': 71, 'bull_adx_thresh': 25.648480285141613, 'bull_atr_min_pct': 0.005154680765735258, 'bull_atr_max_pct': 0.02839450130231365, 'bull_tp_mult': 2.6339503914490012, 'bull_tsl_mult': 0.9999978000513162, 'bull_time_stop': 154, 'bull_use_sma': True, 'bull_use_ema': True, 'bull_use_atr': False, 'bull_use_adx': True, 'bull_use_spike': False, 'bull_rsi_required': True, 'bear_strategy': 'mean_reversion', 'bear_bb_std_mult': 1.23350585577329, 'bear_rsi_os': 14, 'bear_rsi_ob': 47, 'bear_adx_thresh': 7.519981013964221, 'bear_atr_min_pct': 0.017347796072771343, 'bear_atr_max_pct': 0.05498886686190606, 'bear_tp_mult': 1.782639980083072, 'bear_tsl_mult': 0.562423563116776, 'bear_time_stop': 25, 'bear_use_sma': False, 'bear_use_ema': False, 'bear_use_atr': True, 'bear_use_adx': True, 'bear_use_spike': False, 'bear_rsi_required': False, 'sideways_strategy': 'breakout', 'sideways_bb_std_mult': 3.202086511798962, 'sideways_rsi_os': 18, 'sideways_rsi_ob': 59, 'sideways_adx_thresh': 27.364328022362233, 'sideways_atr_min_pct': 0.009908107855557789, 'sideways_atr_max_pct': 0.013446355948437794, 'sideways_tp_mult': 1.812816867368386, 'sideways_tsl_mult': 0.6410989766523582, 'sideways_time_stop': 271, 'sideways_use_sma': True, 'sideways_use_ema': True, 'sideways_use_atr': False, 'sideways_use_adx': False, 'sideways_use_spike': True, 'sideways_rsi_required': False}.
