[I 2025-08-30 19:33:53,002] Trial 444 finished with values: [-1000000000.0, 1000000000.0] and parameters: {'p_sma': 39, 'p_std': 17, 'p_atr': 11, 'p_adx': 7, 'rsi_period': 53, 'ema1': 25, 'ema2': 37, 'slip_atr_k': 0.014537295441017412, 'slip_spread_k': 0.5397768786725102, 'spread_hl_frac': 0.0022168135795420625, 'bb_std_mult': 0.9754150534324809, 'rsi_os': 37, 'rsi_ob': 56, 'vol_spike': 0.039974736279247636, 'adx_thresh': 6.185060036193805, 'atr_min_pct': 0.015685553265742776, 'atr_max_pct': 0.137616567156753, 'tp_mult': 2.391044075766374, 'tsl_mult': 0.5219706618554913, 'strategy': 'mean_reversion', 'time_stop': 49, 'use_sma': True, 'use_atr': False, 'use_adx': True, 'use_ema': True, 'use_spike': False, 'rsi_required': True, 'edge_k': 1.997450818159249, 'edge_cap': 0.22199108752235197, 'bull_strategy': 'mean_reversion', 'bull_bb_std_mult': 2.8962775930357156, 'bull_rsi_os': 17, 'bull_rsi_ob': 86, 'bull_adx_thresh': 26.88903466176913, 'bull_atr_min_pct': 0.002033819973037877, 'bull_atr_max_pct': 0.11144634045620361, 'bull_tp_mult': 1.9002211129777706, 'bull_tsl_mult': 0.9784049737744246, 'bull_time_stop': 185, 'bull_use_sma': False, 'bull_use_ema': True, 'bull_use_atr': True, 'bull_use_adx': False, 'bull_use_spike': True, 'bull_rsi_required': True, 'bear_strategy': 'mean_reversion', 'bear_bb_std_mult': 3.2094292437623504, 'bear_rsi_os': 45, 'bear_rsi_ob': 84, 'bear_adx_thresh': 26.891529784201133, 'bear_atr_min_pct': 0.014673717457527824, 'bear_atr_max_pct': 0.010499448022911084, 'bear_tp_mult': 1.8223436742523347, 'bear_tsl_mult': 0.5504729558543253, 'bear_time_stop': 10, 'bear_use_sma': False, 'bear_use_ema': True, 'bear_use_atr': True, 'bear_use_adx': True, 'bear_use_spike': False, 'bear_rsi_required': True, 'sideways_strategy': 'mean_reversion', 'sideways_bb_std_mult': 1.7627868439872474, 'sideways_rsi_os': 18, 'sideways_rsi_ob': 57, 'sideways_adx_thresh': 34.71148499755813, 'sideways_atr_min_pct': 0.0196627970684416, 'sideways_atr_max_pct': 0.1173549466568253, 'sideways_tp_mult': 1.6504145548516673, 'sideways_tsl_mult': 0.38783776551173166, 'sideways_time_stop': 83, 'sideways_use_sma': False, 'sideways_use_ema': True, 'sideways_use_atr': False, 'sideways_use_adx': True, 'sideways_use_spike': False, 'sideways_rsi_required': True}.
[I 2025-08-30 19:33:53,318] Trial 443 finished with values: [-1000000000.0, 1000000000.0] and parameters: {'p_sma': 39, 'p_std': 17, 'p_atr': 11, 'p_adx': 24, 'rsi_period': 53, 'ema1': 25, 'ema2': 18, 'slip_atr_k': 0.07164360849390587, 'slip_spread_k': 0.7943202204578248, 'spread_hl_frac': 0.0023495976408948903, 'bb_std_mult': 1.0601669281426889, 'rsi_os': 37, 'rsi_ob': 56, 'vol_spike': 0.08674033845104448, 'adx_thresh': 22.132000527201328, 'atr_min_pct': 0.0031170085366040174, 'atr_max_pct': 0.08978991276464389, 'tp_mult': 2.377870384422532, 'tsl_mult': 0.7450849160603651, 'strategy': 'mean_reversion', 'time_stop': 26, 'use_sma': True, 'use_atr': False, 'use_adx': True, 'use_ema': True, 'use_spike': False, 'rsi_required': True, 'edge_k': 0.1394921785523155, 'edge_cap': 0.572757292184158, 'bull_strategy': 'mean_reversion', 'bull_bb_std_mult': 1.8283456539271654, 'bull_rsi_os': 11, 'bull_rsi_ob': 94, 'bull_adx_thresh': 14.6106140042282, 'bull_atr_min_pct': 0.0021255511354989686, 'bull_atr_max_pct': 0.11668511882371871, 'bull_tp_mult': 2.888896168421123, 'bull_tsl_mult': 0.9456002554356338, 'bull_time_stop': 295, 'bull_use_sma': False, 'bull_use_ema': True, 'bull_use_atr': True, 'bull_use_adx': False, 'bull_use_spike': True, 'bull_rsi_required': True, 'bear_strategy': 'mean_reversion', 'bear_bb_std_mult': 3.20352996515442, 'bear_rsi_os': 45, 'bear_rsi_ob': 84, 'bear_adx_thresh': 23.401696867827045, 'bear_atr_min_pct': 0.01628916033299911, 'bear_atr_max_pct': 0.05224912594672402, 'bear_tp_mult': 2.9225481253287438, 'bear_tsl_mult': 0.2710344240564151, 'bear_time_stop': 5, 'bear_use_sma': False, 'bear_use_ema': True, 'bear_use_atr': True, 'bear_use_adx': True, 'bear_use_spike': False, 'bear_rsi_required': True, 'sideways_strategy': 'mean_reversion', 'sideways_bb_std_mult': 1.0139111780709718, 'sideways_rsi_os': 27, 'sideways_rsi_ob': 83, 'sideways_adx_thresh': 30.828966358744847, 'sideways_atr_min_pct': 0.0279402016970274, 'sideways_atr_max_pct': 0.04271545399600085, 'sideways_tp_mult': 2.494143176478398, 'sideways_tsl_mult': 0.6503916500977434, 'sideways_time_stop': 273, 'sideways_use_sma': False, 'sideways_use_ema': True, 'sideways_use_atr': False, 'sideways_use_adx': True, 'sideways_use_spike': False, 'sideways_rsi_required': True}.
[I 2025-08-30 19:33:53,481] Trial 442 finished with values: [-1000000000.0, 1000000000.0] and parameters: {'p_sma': 46, 'p_std': 25, 'p_atr': 27, 'p_adx': 15, 'rsi_period': 44, 'ema1': 22, 'ema2': 36, 'slip_atr_k': 0.01639873912342425, 'slip_spread_k': 0.8575324288879295, 'spread_hl_frac': 0.029324917580120853, 'bb_std_mult': 2.6400033269867165, 'rsi_os': 37, 'rsi_ob': 59, 'vol_spike': 0.17859256679376384, 'adx_thresh': 27.003925432712542, 'atr_min_pct': 0.0029850659019184256, 'atr_max_pct': 0.08925991730684556, 'tp_mult': 2.1321124711921438, 'tsl_mult': 0.3747028234923986, 'strategy': 'breakout', 'time_stop': 219, 'use_sma': True, 'use_atr': True, 'use_adx': True, 'use_ema': True, 'use_spike': False, 'rsi_required': True, 'edge_k': 1.1661972722930956, 'edge_cap': 0.5680384094013451, 'bull_strategy': 'mean_reversion', 'bull_bb_std_mult': 2.882109698593805, 'bull_rsi_os': 50, 'bull_rsi_ob': 64, 'bull_adx_thresh': 25.357073968867702, 'bull_atr_min_pct': 0.0017190809762687338, 'bull_atr_max_pct': 0.052178541115009316, 'bull_tp_mult': 2.247656661303896, 'bull_tsl_mult': 0.9500102747474362, 'bull_time_stop': 296, 'bull_use_sma': False, 'bull_use_ema': True, 'bull_use_atr': False, 'bull_use_adx': True, 'bull_use_spike': True, 'bull_rsi_required': True, 'bear_strategy': 'breakout', 'bear_bb_std_mult': 3.216702302646222, 'bear_rsi_os': 45, 'bear_rsi_ob': 84, 'bear_adx_thresh': 6.60455318289045, 'bear_atr_min_pct': 0.01632271751207488, 'bear_atr_max_pct': 0.034101215927231365, 'bear_tp_mult': 1.7116223518551195, 'bear_tsl_mult': 0.4116551242777697, 'bear_time_stop': 26, 'bear_use_sma': False, 'bear_use_ema': False, 'bear_use_atr': True, 'bear_use_adx': True, 'bear_use_spike': False, 'bear_rsi_required': False, 'sideways_strategy': 'breakout', 'sideways_bb_std_mult': 1.4707124696476144, 'sideways_rsi_os': 11, 'sideways_rsi_ob': 53, 'sideways_adx_thresh': 30.863005348729686, 'sideways_atr_min_pct': 0.004909485571641923, 'sideways_atr_max_pct': 0.1170216617821803, 'sideways_tp_mult': 1.7828593225362301, 'sideways_tsl_mult': 0.4499583743587813, 'sideways_time_stop': 272, 'sideways_use_sma': True, 'sideways_use_ema': True, 'sideways_use_atr': False, 'sideways_use_adx': True, 'sideways_use_spike': False, 'sideways_rsi_required': False}.
[I 2025-08-30 19:33:53,608] Trial 441 finished with values: [-0.01941130606105146, 0.019308834730848892] and parameters: {'p_sma': 41, 'p_std': 25, 'p_atr': 8, 'p_adx': 28, 'rsi_period': 44, 'ema1': 26, 'ema2': 18, 'slip_atr_k': 0.016251457435561646, 'slip_spread_k': 0.3486019775019362, 'spread_hl_frac': 0.0041168275406654325, 'bb_std_mult': 0.9707275996225468, 'rsi_os': 35, 'rsi_ob': 59, 'vol_spike': 0.08589375335701145, 'adx_thresh': 26.99214287795016, 'atr_min_pct': 0.01575847595251304, 'atr_max_pct': 0.13828855002712906, 'tp_mult': 2.1021553730176117, 'tsl_mult': 0.6842242211069501, 'strategy': 'breakout', 'time_stop': 37, 'use_sma': False, 'use_atr': True, 'use_adx': False, 'use_ema': False, 'use_spike': True, 'rsi_required': False, 'edge_k': 0.2325727867695223, 'edge_cap': 0.21434218976752165, 'bull_strategy': 'mean_reversion', 'bull_bb_std_mult': 1.7403463735913673, 'bull_rsi_os': 52, 'bull_rsi_ob': 72, 'bull_adx_thresh': 23.358917305904914, 'bull_atr_min_pct': 0.0018299704457647769, 'bull_atr_max_pct': 0.030379722842804983, 'bull_tp_mult': 2.2169199878502357, 'bull_tsl_mult': 0.5806019463448691, 'bull_time_stop': 79, 'bull_use_sma': True, 'bull_use_ema': False, 'bull_use_atr': False, 'bull_use_adx': True, 'bull_use_spike': True, 'bull_rsi_required': True, 'bear_strategy': 'breakout', 'bear_bb_std_mult': 3.3560257454845703, 'bear_rsi_os': 45, 'bear_rsi_ob': 86, 'bear_adx_thresh': 31.721088243974222, 'bear_atr_min_pct': 0.024451890076421172, 'bear_atr_max_pct': 0.033609262224937986, 'bear_tp_mult': 2.690956848408607, 'bear_tsl_mult': 0.2761364906949416, 'bear_time_stop': 221, 'bear_use_sma': False, 'bear_use_ema': False, 'bear_use_atr': False, 'bear_use_adx': False, 'bear_use_spike': False, 'bear_rsi_required': True, 'sideways_strategy': 'breakout', 'sideways_bb_std_mult': 1.9498124387694877, 'sideways_rsi_os': 17, 'sideways_rsi_ob': 83, 'sideways_adx_thresh': 15.078525200325437, 'sideways_atr_min_pct': 0.018584950212211817, 'sideways_atr_max_pct': 0.12583425303022328, 'sideways_tp_mult': 1.793180161235728, 'sideways_tsl_mult': 0.6768183910282808, 'sideways_time_stop': 261, 'sideways_use_sma': True, 'sideways_use_ema': True, 'sideways_use_atr': False, 'sideways_use_adx': False, 'sideways_use_spike': True, 'sideways_rsi_required': False}.
[I 2025-08-30 19:34:27,156] Trial 447 finished with values: [-1000000000.0, 1000000000.0] and parameters: {'p_sma': 44, 'p_std': 25, 'p_atr': 10, 'p_adx': 7, 'rsi_period': 51, 'ema1': 21, 'ema2': 15, 'slip_atr_k': 0.2027710883285747, 'slip_spread_k': 0.35391608010288306, 'spread_hl_frac': 0.004884636466877722, 'bb_std_mult': 1.1862334319519605, 'rsi_os': 44, 'rsi_ob': 86, 'vol_spike': 0.22579617494471896, 'adx_thresh': 13.392973438390921, 'atr_min_pct': 0.0014046830247659136, 'atr_max_pct': 0.12124409511351826, 'tp_mult': 2.104949853487454, 'tsl_mult': 0.6843249961321995, 'strategy': 'breakout', 'time_stop': 5, 'use_sma': False, 'use_atr': True, 'use_adx': False, 'use_ema': False, 'use_spike': True, 'rsi_required': True, 'edge_k': 0.22790126995774695, 'edge_cap': 0.15299802422966785, 'bull_strategy': 'breakout', 'bull_bb_std_mult': 1.75140382902267, 'bull_rsi_os': 50, 'bull_rsi_ob': 82, 'bull_adx_thresh': 5.951471558771374, 'bull_atr_min_pct': 0.024738498615337848, 'bull_atr_max_pct': 0.027602964443479015, 'bull_tp_mult': 2.1654390007244166, 'bull_tsl_mult': 0.9767055431377413, 'bull_time_stop': 269, 'bull_use_sma': True, 'bull_use_ema': False, 'bull_use_atr': False, 'bull_use_adx': True, 'bull_use_spike': True, 'bull_rsi_required': False, 'bear_strategy': 'breakout', 'bear_bb_std_mult': 3.2746696105232402, 'bear_rsi_os': 42, 'bear_rsi_ob': 81, 'bear_adx_thresh': 7.621637329173002, 'bear_atr_min_pct': 0.013911918318648304, 'bear_atr_max_pct': 0.05578298300840436, 'bear_tp_mult': 2.340954538945317, 'bear_tsl_mult': 0.09723700104249985, 'bear_time_stop': 252, 'bear_use_sma': True, 'bear_use_ema': False, 'bear_use_atr': True, 'bear_use_adx': True, 'bear_use_spike': False, 'bear_rsi_required': False, 'sideways_strategy': 'breakout', 'sideways_bb_std_mult': 1.8556530982046462, 'sideways_rsi_os': 17, 'sideways_rsi_ob': 59, 'sideways_adx_thresh': 9.472316018225607, 'sideways_atr_min_pct': 0.01878579774258604, 'sideways_atr_max_pct': 0.12219378853786966, 'sideways_tp_mult': 1.3830334841619631, 'sideways_tsl_mult': 0.8011040178722355, 'sideways_time_stop': 279, 'sideways_use_sma': True, 'sideways_use_ema': False, 'sideways_use_atr': False, 'sideways_use_adx': False, 'sideways_use_spike': False, 'sideways_rsi_required': False}.
[I 2025-08-30 19:34:27,283] Trial 446 finished with values: [-1000000000.0, 1000000000.0] and parameters: {'p_sma': 46, 'p_std': 25, 'p_atr': 10, 'p_adx': 7, 'rsi_period': 45, 'ema1': 21, 'ema2': 14, 'slip_atr_k': 0.015874027371245825, 'slip_spread_k': 0.35507315594673555, 'spread_hl_frac': 0.013339150833476872, 'bb_std_mult': 2.128929943234198, 'rsi_os': 16, 'rsi_ob': 85, 'vol_spike': 0.06763766097186266, 'adx_thresh': 17.54701166203604, 'atr_min_pct': 0.0012624191074952391, 'atr_max_pct': 0.06255605871313322, 'tp_mult': 2.106482842848873, 'tsl_mult': 0.6833691285036185, 'strategy': 'breakout', 'time_stop': 61, 'use_sma': False, 'use_atr': True, 'use_adx': False, 'use_ema': False, 'use_spike': True, 'rsi_required': True, 'edge_k': 1.154246162117978, 'edge_cap': 0.2660570967106241, 'bull_strategy': 'breakout', 'bull_bb_std_mult': 2.3191310872302857, 'bull_rsi_os': 50, 'bull_rsi_ob': 70, 'bull_adx_thresh': 5.8917522650376934, 'bull_atr_min_pct': 0.0034699471299857497, 'bull_atr_max_pct': 0.028381161388384653, 'bull_tp_mult': 2.250111034608971, 'bull_tsl_mult': 0.08861823605492902, 'bull_time_stop': 226, 'bull_use_sma': True, 'bull_use_ema': False, 'bull_use_atr': False, 'bull_use_adx': True, 'bull_use_spike': True, 'bull_rsi_required': False, 'bear_strategy': 'breakout', 'bear_bb_std_mult': 1.7270284929730277, 'bear_rsi_os': 47, 'bear_rsi_ob': 64, 'bear_adx_thresh': 31.932967939535775, 'bear_atr_min_pct': 0.009399863748333716, 'bear_atr_max_pct': 0.032793919158606716, 'bear_tp_mult': 1.696809605748181, 'bear_tsl_mult': 0.0868598636905625, 'bear_time_stop': 195, 'bear_use_sma': True, 'bear_use_ema': False, 'bear_use_atr': True, 'bear_use_adx': True, 'bear_use_spike': False, 'bear_rsi_required': False, 'sideways_strategy': 'breakout', 'sideways_bb_std_mult': 1.8807460933978961, 'sideways_rsi_os': 17, 'sideways_rsi_ob': 58, 'sideways_adx_thresh': 18.27442603225589, 'sideways_atr_min_pct': 0.018693606410246345, 'sideways_atr_max_pct': 0.11076035665365114, 'sideways_tp_mult': 1.0155540071029567, 'sideways_tsl_mult': 0.680856598683499, 'sideways_time_stop': 279, 'sideways_use_sma': True, 'sideways_use_ema': False, 'sideways_use_atr': False, 'sideways_use_adx': False, 'sideways_use_spike': False, 'sideways_rsi_required': False}.
[I 2025-08-30 19:34:27,582] Trial 445 finished with values: [-1000000000.0, 1000000000.0] and parameters: {'p_sma': 41, 'p_std': 25, 'p_atr': 10, 'p_adx': 22, 'rsi_period': 51, 'ema1': 20, 'ema2': 18, 'slip_atr_k': 0.0785861341308885, 'slip_spread_k': 0.3550302001162371, 'spread_hl_frac': 0.043053213935209805, 'bb_std_mult': 2.3885435978706786, 'rsi_os': 37, 'rsi_ob': 47, 'vol_spike': 0.19947127595971625, 'adx_thresh': 22.215165234964566, 'atr_min_pct': 0.005256989086209092, 'atr_max_pct': 0.06278679696301222, 'tp_mult': 2.117630306162078, 'tsl_mult': 0.38259098321511903, 'strategy': 'breakout', 'time_stop': 28, 'use_sma': False, 'use_atr': True, 'use_adx': False, 'use_ema': False, 'use_spike': True, 'rsi_required': True, 'edge_k': 0.1447307267188397, 'edge_cap': 0.2676518124947047, 'bull_strategy': 'breakout', 'bull_bb_std_mult': 1.7616651420615073, 'bull_rsi_os': 50, 'bull_rsi_ob': 70, 'bull_adx_thresh': 15.876412839234368, 'bull_atr_min_pct': 0.003391257003815149, 'bull_atr_max_pct': 0.028425954005520157, 'bull_tp_mult': 2.245781381983716, 'bull_tsl_mult': 0.09039967184103381, 'bull_time_stop': 195, 'bull_use_sma': True, 'bull_use_ema': False, 'bull_use_atr': False, 'bull_use_adx': True, 'bull_use_spike': True, 'bull_rsi_required': False, 'bear_strategy': 'breakout', 'bear_bb_std_mult': 3.233959482282114, 'bear_rsi_os': 46, 'bear_rsi_ob': 72, 'bear_adx_thresh': 23.57562877324994, 'bear_atr_min_pct': 0.024380421037128223, 'bear_atr_max_pct': 0.01662828917056698, 'bear_tp_mult': 2.331374986632607, 'bear_tsl_mult': 0.1559708168874801, 'bear_time_stop': 182, 'bear_use_sma': False, 'bear_use_ema': False, 'bear_use_atr': True, 'bear_use_adx': True, 'bear_use_spike': False, 'bear_rsi_required': False, 'sideways_strategy': 'breakout', 'sideways_bb_std_mult': 1.8736597763440468, 'sideways_rsi_os': 17, 'sideways_rsi_ob': 63, 'sideways_adx_thresh': 9.363523865113098, 'sideways_atr_min_pct': 0.023323554405890942, 'sideways_atr_max_pct': 0.06972950505507466, 'sideways_tp_mult': 1.7265923857167755, 'sideways_tsl_mult': 0.6496070375099317, 'sideways_time_stop': 229, 'sideways_use_sma': True, 'sideways_use_ema': False, 'sideways_use_atr': False, 'sideways_use_adx': False, 'sideways_use_spike': False, 'sideways_rsi_required': False}.
[I 2025-08-30 19:34:27,582] Trial 448 finished with values: [-1000000000.0, 1000000000.0] and parameters: {'p_sma': 58, 'p_std': 26, 'p_atr': 10, 'p_adx': 7, 'rsi_period': 51, 'ema1': 24, 'ema2': 18, 'slip_atr_k': 0.044323394675093414, 'slip_spread_k': 0.46925106753110224, 'spread_hl_frac': 0.04311617983606236, 'bb_std_mult': 2.7348965117875004, 'rsi_os': 16, 'rsi_ob': 85, 'vol_spike': 0.05029126640118704, 'adx_thresh': 18.726243580594133, 'atr_min_pct': 0.013189213102367049, 'atr_max_pct': 0.1370547341785842, 'tp_mult': 2.1189884522786144, 'tsl_mult': 0.6822861684447747, 'strategy': 'breakout', 'time_stop': 172, 'use_sma': False, 'use_atr': True, 'use_adx': False, 'use_ema': False, 'use_spike': True, 'rsi_required': True, 'edge_k': 0.7736776313527144, 'edge_cap': 0.2694092670459554, 'bull_strategy': 'breakout', 'bull_bb_std_mult': 1.7421280931115999, 'bull_rsi_os': 50, 'bull_rsi_ob': 72, 'bull_adx_thresh': 29.916044592339382, 'bull_atr_min_pct': 0.003502062182134326, 'bull_atr_max_pct': 0.029039860483777914, 'bull_tp_mult': 2.195729947752129, 'bull_tsl_mult': 0.9330631004918036, 'bull_time_stop': 197, 'bull_use_sma': True, 'bull_use_ema': False, 'bull_use_atr': False, 'bull_use_adx': True, 'bull_use_spike': True, 'bull_rsi_required': False, 'bear_strategy': 'breakout', 'bear_bb_std_mult': 0.8861011238482221, 'bear_rsi_os': 42, 'bear_rsi_ob': 85, 'bear_adx_thresh': 20.53999235867628, 'bear_atr_min_pct': 0.013915069473804482, 'bear_atr_max_pct': 0.02064453374428478, 'bear_tp_mult': 2.193800645861257, 'bear_tsl_mult': 0.08859599566123116, 'bear_time_stop': 103, 'bear_use_sma': True, 'bear_use_ema': False, 'bear_use_atr': True, 'bear_use_adx': True, 'bear_use_spike': False, 'bear_rsi_required': False, 'sideways_strategy': 'breakout', 'sideways_bb_std_mult': 1.8989653493416467, 'sideways_rsi_os': 17, 'sideways_rsi_ob': 58, 'sideways_adx_thresh': 15.210608861663331, 'sideways_atr_min_pct': 0.01848969613032922, 'sideways_atr_max_pct': 0.14980569118573128, 'sideways_tp_mult': 1.7262474383797028, 'sideways_tsl_mult': 0.23674269778013335, 'sideways_time_stop': 52, 'sideways_use_sma': True, 'sideways_use_ema': False, 'sideways_use_atr': False, 'sideways_use_adx': False, 'sideways_use_spike': False, 'sideways_rsi_required': False}.
[I 2025-08-30 19:35:00,819] Trial 449 finished with values: [-1000000000.0, 1000000000.0] and parameters: {'p_sma': 41, 'p_std': 43, 'p_atr': 10, 'p_adx': 20, 'rsi_period': 35, 'ema1': 11, 'ema2': 18, 'slip_atr_k': 0.04535434234154713, 'slip_spread_k': 0.46660810699943805, 'spread_hl_frac': 0.04346495012129807, 'bb_std_mult': 0.8177068248337775, 'rsi_os': 27, 'rsi_ob': 72, 'vol_spike': 0.05004533370584295, 'adx_thresh': 24.54030669482122, 'atr_min_pct': 0.021346140518026142, 'atr_max_pct': 0.07686384691621499, 'tp_mult': 2.534940261337711, 'tsl_mult': 0.7347414170676405, 'strategy': 'breakout', 'time_stop': 35, 'use_sma': False, 'use_atr': True, 'use_adx': False, 'use_ema': False, 'use_spike': True, 'rsi_required': True, 'edge_k': 0.03605291318109967, 'edge_cap': 0.264136618768374, 'bull_strategy': 'breakout', 'bull_bb_std_mult': 1.8778488759937801, 'bull_rsi_os': 9, 'bull_rsi_ob': 76, 'bull_adx_thresh': 31.808503317889148, 'bull_atr_min_pct': 0.003401980458289577, 'bull_atr_max_pct': 0.03030802419636383, 'bull_tp_mult': 2.219982345671135, 'bull_tsl_mult': 0.9616886489787095, 'bull_time_stop': 197, 'bull_use_sma': True, 'bull_use_ema': False, 'bull_use_atr': False, 'bull_use_adx': True, 'bull_use_spike': False, 'bull_rsi_required': False, 'bear_strategy': 'breakout', 'bear_bb_std_mult': 3.369118515279339, 'bear_rsi_os': 47, 'bear_rsi_ob': 85, 'bear_adx_thresh': 6.309954340488411, 'bear_atr_min_pct': 0.024401842794341655, 'bear_atr_max_pct': 0.05889050027846517, 'bear_tp_mult': 1.914258906624133, 'bear_tsl_mult': 0.154852894998298, 'bear_time_stop': 39, 'bear_use_sma': True, 'bear_use_ema': False, 'bear_use_atr': True, 'bear_use_adx': True, 'bear_use_spike': False, 'bear_rsi_required': False, 'sideways_strategy': 'breakout', 'sideways_bb_std_mult': 1.9155178289452632, 'sideways_rsi_os': 7, 'sideways_rsi_ob': 64, 'sideways_adx_thresh': 15.250223856055698, 'sideways_atr_min_pct': 0.02336151710339815, 'sideways_atr_max_pct': 0.11158036221210581, 'sideways_tp_mult': 1.7326867689102037, 'sideways_tsl_mult': 0.6769538200411794, 'sideways_time_stop': 54, 'sideways_use_sma': True, 'sideways_use_ema': False, 'sideways_use_atr': False, 'sideways_use_adx': False, 'sideways_use_spike': False, 'sideways_rsi_required': False}.
