[I 2025-08-30 19:16:15,423] Trial 315 finished with values: [-0.021900600314267882, 0.02187377188329078] and parameters: {'p_sma': 34, 'p_std': 34, 'p_atr': 11, 'p_adx': 8, 'rsi_period': 74, 'ema1': 26, 'ema2': 18, 'slip_atr_k': 0.010078620346933987, 'slip_spread_k': 0.4474701535697187, 'spread_hl_frac': 0.04988474516837058, 'bb_std_mult': 1.0408994702631138, 'rsi_os': 25, 'rsi_ob': 56, 'vol_spike': 0.15044744678733707, 'adx_thresh': 9.982893798789394, 'atr_min_pct': 0.02322973226179002, 'atr_max_pct': 0.11474335394520735, 'tp_mult': 1.9803707545436975, 'tsl_mult': 0.7302538718698542, 'strategy': 'breakout', 'time_stop': 36, 'use_sma': True, 'use_atr': True, 'use_adx': True, 'use_ema': False, 'use_spike': True, 'rsi_required': True, 'edge_k': 0.14420151051466068, 'edge_cap': 0.5471888541949594, 'bull_strategy': 'mean_reversion', 'bull_bb_std_mult': 1.933287132274031, 'bull_rsi_os': 50, 'bull_rsi_ob': 62, 'bull_adx_thresh': 26.317109698262115, 'bull_atr_min_pct': 0.0017860840735893172, 'bull_atr_max_pct': 0.1461813312820473, 'bull_tp_mult': 1.613844468113544, 'bull_tsl_mult': 0.9399889958836072, 'bull_time_stop': 144, 'bull_use_sma': True, 'bull_use_ema': False, 'bull_use_atr': False, 'bull_use_adx': True, 'bull_use_spike': True, 'bull_rsi_required': True, 'bear_strategy': 'breakout', 'bear_bb_std_mult': 3.1334976401031054, 'bear_rsi_os': 45, 'bear_rsi_ob': 82, 'bear_adx_thresh': 5.884855110731265, 'bear_atr_min_pct': 0.014677338704111639, 'bear_atr_max_pct': 0.06753463920693843, 'bear_tp_mult': 1.6659350349732631, 'bear_tsl_mult': 0.08410049037370906, 'bear_time_stop': 143, 'bear_use_sma': True, 'bear_use_ema': False, 'bear_use_atr': True, 'bear_use_adx': True, 'bear_use_spike': False, 'bear_rsi_required': True, 'sideways_strategy': 'breakout', 'sideways_bb_std_mult': 2.079957354377702, 'sideways_rsi_os': 55, 'sideways_rsi_ob': 59, 'sideways_adx_thresh': 21.69100474107063, 'sideways_atr_min_pct': 0.003763021630329544, 'sideways_atr_max_pct': 0.13669629654756232, 'sideways_tp_mult': 2.1944919991107836, 'sideways_tsl_mult': 0.4974557988086261, 'sideways_time_stop': 34, 'sideways_use_sma': True, 'sideways_use_ema': True, 'sideways_use_atr': False, 'sideways_use_adx': False, 'sideways_use_spike': True, 'sideways_rsi_required': False}.
[I 2025-08-30 19:16:15,909] Trial 318 finished with values: [-1000000000.0, 1000000000.0] and parameters: {'p_sma': 52, 'p_std': 31, 'p_atr': 11, 'p_adx': 9, 'rsi_period': 73, 'ema1': 25, 'ema2': 19, 'slip_atr_k': 0.009128390203273851, 'slip_spread_k': 0.978443733549583, 'spread_hl_frac': 0.007347911062295731, 'bb_std_mult': 1.0141730564418168, 'rsi_os': 50, 'rsi_ob': 56, 'vol_spike': 0.05875260648357352, 'adx_thresh': 19.569151958255702, 'atr_min_pct': 0.013989408794109284, 'atr_max_pct': 0.0543938872083268, 'tp_mult': 1.9565067960675482, 'tsl_mult': 0.7085449721378513, 'strategy': 'mean_reversion', 'time_stop': 23, 'use_sma': False, 'use_atr': True, 'use_adx': True, 'use_ema': False, 'use_spike': True, 'rsi_required': True, 'edge_k': 1.1880418518124154, 'edge_cap': 0.6638987595283189, 'bull_strategy': 'mean_reversion', 'bull_bb_std_mult': 0.7068133874620735, 'bull_rsi_os': 36, 'bull_rsi_ob': 62, 'bull_adx_thresh': 18.263844772709916, 'bull_atr_min_pct': 0.029521681986634095, 'bull_atr_max_pct': 0.03669742608325076, 'bull_tp_mult': 1.8710088688382234, 'bull_tsl_mult': 0.9826922129249918, 'bull_time_stop': 148, 'bull_use_sma': True, 'bull_use_ema': False, 'bull_use_atr': False, 'bull_use_adx': True, 'bull_use_spike': True, 'bull_rsi_required': True, 'bear_strategy': 'mean_reversion', 'bear_bb_std_mult': 3.235823185373784, 'bear_rsi_os': 45, 'bear_rsi_ob': 82, 'bear_adx_thresh': 6.3647444170411145, 'bear_atr_min_pct': 0.012307251891008175, 'bear_atr_max_pct': 0.11743768145160219, 'bear_tp_mult': 2.4707964316852764, 'bear_tsl_mult': 0.22435351448922314, 'bear_time_stop': 5, 'bear_use_sma': True, 'bear_use_ema': False, 'bear_use_atr': True, 'bear_use_adx': True, 'bear_use_spike': False, 'bear_rsi_required': False, 'sideways_strategy': 'breakout', 'sideways_bb_std_mult': 3.002580387092131, 'sideways_rsi_os': 31, 'sideways_rsi_ob': 70, 'sideways_adx_thresh': 23.25403423139032, 'sideways_atr_min_pct': 0.029975015322180047, 'sideways_atr_max_pct': 0.1367219562628203, 'sideways_tp_mult': 2.597695666656575, 'sideways_tsl_mult': 0.6665712412028333, 'sideways_time_stop': 176, 'sideways_use_sma': True, 'sideways_use_ema': True, 'sideways_use_atr': True, 'sideways_use_adx': False, 'sideways_use_spike': False, 'sideways_rsi_required': False}.
[I 2025-08-30 19:16:48,170] Trial 316 finished with values: [-0.01835861479545542, 0.018360358765688978] and parameters: {'p_sma': 16, 'p_std': 20, 'p_atr': 11, 'p_adx': 9, 'rsi_period': 74, 'ema1': 25, 'ema2': 18, 'slip_atr_k': 0.01812653716941085, 'slip_spread_k': 0.4298148503144343, 'spread_hl_frac': 0.007293467646706662, 'bb_std_mult': 3.597427192215262, 'rsi_os': 36, 'rsi_ob': 56, 'vol_spike': 0.25645485332883644, 'adx_thresh': 8.841803249011164, 'atr_min_pct': 0.022333722389409186, 'atr_max_pct': 0.054692280197388574, 'tp_mult': 2.180453080817326, 'tsl_mult': 0.7691341431741161, 'strategy': 'breakout', 'time_stop': 34, 'use_sma': False, 'use_atr': False, 'use_adx': True, 'use_ema': False, 'use_spike': True, 'rsi_required': False, 'edge_k': 0.1470905465636163, 'edge_cap': 0.5395467171200221, 'bull_strategy': 'breakout', 'bull_bb_std_mult': 1.9544735628728005, 'bull_rsi_os': 10, 'bull_rsi_ob': 78, 'bull_adx_thresh': 18.53824705610222, 'bull_atr_min_pct': 0.0018791644841986243, 'bull_atr_max_pct': 0.0827430641717169, 'bull_tp_mult': 2.3676299175432014, 'bull_tsl_mult': 0.9834196554257236, 'bull_time_stop': 197, 'bull_use_sma': True, 'bull_use_ema': False, 'bull_use_atr': False, 'bull_use_adx': True, 'bull_use_spike': True, 'bull_rsi_required': True, 'bear_strategy': 'mean_reversion', 'bear_bb_std_mult': 3.2245156951690417, 'bear_rsi_os': 45, 'bear_rsi_ob': 82, 'bear_adx_thresh': 6.039624928706051, 'bear_atr_min_pct': 0.014662725040182725, 'bear_atr_max_pct': 0.040397771776407757, 'bear_tp_mult': 1.6657025991856889, 'bear_tsl_mult': 0.08223775426915592, 'bear_time_stop': 138, 'bear_use_sma': True, 'bear_use_ema': False, 'bear_use_atr': False, 'bear_use_adx': False, 'bear_use_spike': False, 'bear_rsi_required': True, 'sideways_strategy': 'mean_reversion', 'sideways_bb_std_mult': 3.439852193343949, 'sideways_rsi_os': 20, 'sideways_rsi_ob': 66, 'sideways_adx_thresh': 8.611541325001614, 'sideways_atr_min_pct': 0.007696833102322022, 'sideways_atr_max_pct': 0.08373495620667926, 'sideways_tp_mult': 1.6160044202003474, 'sideways_tsl_mult': 0.7213395054220343, 'sideways_time_stop': 187, 'sideways_use_sma': True, 'sideways_use_ema': True, 'sideways_use_atr': False, 'sideways_use_adx': False, 'sideways_use_spike': False, 'sideways_rsi_required': False}.
[I 2025-08-30 19:16:48,628] Trial 319 finished with values: [-1000000000.0, 1000000000.0] and parameters: {'p_sma': 54, 'p_std': 50, 'p_atr': 11, 'p_adx': 9, 'rsi_period': 73, 'ema1': 26, 'ema2': 18, 'slip_atr_k': 0.1798512237459777, 'slip_spread_k': 0.16819608161911964, 'spread_hl_frac': 0.04993264986277211, 'bb_std_mult': 1.0094621678390427, 'rsi_os': 23, 'rsi_ob': 93, 'vol_spike': 0.035798349106702876, 'adx_thresh': 9.8514633460109, 'atr_min_pct': 0.00861339804947332, 'atr_max_pct': 0.12791214122994238, 'tp_mult': 2.159446632863109, 'tsl_mult': 0.7048752597628699, 'strategy': 'mean_reversion', 'time_stop': 24, 'use_sma': False, 'use_atr': True, 'use_adx': True, 'use_ema': False, 'use_spike': True, 'rsi_required': True, 'edge_k': 1.1834082494624099, 'edge_cap': 0.5482168256026958, 'bull_strategy': 'mean_reversion', 'bull_bb_std_mult': 1.9541757372750892, 'bull_rsi_os': 36, 'bull_rsi_ob': 79, 'bull_adx_thresh': 25.639469462641376, 'bull_atr_min_pct': 0.02100475588504378, 'bull_atr_max_pct': 0.030133401755878426, 'bull_tp_mult': 2.3704656357013816, 'bull_tsl_mult': 0.9993442635497051, 'bull_time_stop': 289, 'bull_use_sma': True, 'bull_use_ema': False, 'bull_use_atr': False, 'bull_use_adx': True, 'bull_use_spike': True, 'bull_rsi_required': True, 'bear_strategy': 'mean_reversion', 'bear_bb_std_mult': 3.502084011234529, 'bear_rsi_os': 45, 'bear_rsi_ob': 82, 'bear_adx_thresh': 6.32552200232734, 'bear_atr_min_pct': 0.012905206992564968, 'bear_atr_max_pct': 0.11659764025507796, 'bear_tp_mult': 1.5631945442752002, 'bear_tsl_mult': 0.9256398833460506, 'bear_time_stop': 243, 'bear_use_sma': True, 'bear_use_ema': False, 'bear_use_atr': True, 'bear_use_adx': True, 'bear_use_spike': False, 'bear_rsi_required': False, 'sideways_strategy': 'breakout', 'sideways_bb_std_mult': 2.2321957945741415, 'sideways_rsi_os': 16, 'sideways_rsi_ob': 72, 'sideways_adx_thresh': 5.015748815860119, 'sideways_atr_min_pct': 0.017872924775065063, 'sideways_atr_max_pct': 0.12196617049426689, 'sideways_tp_mult': 2.212149911604383, 'sideways_tsl_mult': 0.6678776953935025, 'sideways_time_stop': 210, 'sideways_use_sma': True, 'sideways_use_ema': True, 'sideways_use_atr': True, 'sideways_use_adx': False, 'sideways_use_spike': False, 'sideways_rsi_required': False}.
[I 2025-08-30 19:16:48,997] Trial 317 finished with values: [-1000000000.0, 1000000000.0] and parameters: {'p_sma': 21, 'p_std': 19, 'p_atr': 21, 'p_adx': 9, 'rsi_period': 27, 'ema1': 19, 'ema2': 19, 'slip_atr_k': 0.008025803011905197, 'slip_spread_k': 0.4459577483804593, 'spread_hl_frac': 0.0078298011758355, 'bb_std_mult': 1.036256045967186, 'rsi_os': 7, 'rsi_ob': 56, 'vol_spike': 0.05673426866395431, 'adx_thresh': 10.00643248484943, 'atr_min_pct': 0.008714566269422578, 'atr_max_pct': 0.1139810682260968, 'tp_mult': 2.0151734996800563, 'tsl_mult': 0.7311556263924397, 'strategy': 'mean_reversion', 'time_stop': 34, 'use_sma': False, 'use_atr': False, 'use_adx': True, 'use_ema': False, 'use_spike': True, 'rsi_required': True, 'edge_k': 0.1400017381842696, 'edge_cap': 0.2313472730446709, 'bull_strategy': 'breakout', 'bull_bb_std_mult': 2.060810735292225, 'bull_rsi_os': 18, 'bull_rsi_ob': 70, 'bull_adx_thresh': 18.410273085034813, 'bull_atr_min_pct': 0.01650578127908319, 'bull_atr_max_pct': 0.0323493509667668, 'bull_tp_mult': 1.8770032671523231, 'bull_tsl_mult': 0.627627369349763, 'bull_time_stop': 141, 'bull_use_sma': True, 'bull_use_ema': False, 'bull_use_atr': False, 'bull_use_adx': True, 'bull_use_spike': True, 'bull_rsi_required': True, 'bear_strategy': 'mean_reversion', 'bear_bb_std_mult': 3.2298484038622584, 'bear_rsi_os': 45, 'bear_rsi_ob': 82, 'bear_adx_thresh': 6.092584863510346, 'bear_atr_min_pct': 0.011744700580484211, 'bear_atr_max_pct': 0.06776043584082656, 'bear_tp_mult': 1.9435129728875375, 'bear_tsl_mult': 0.0840886335376259, 'bear_time_stop': 147, 'bear_use_sma': True, 'bear_use_ema': False, 'bear_use_atr': False, 'bear_use_adx': False, 'bear_use_spike': False, 'bear_rsi_required': True, 'sideways_strategy': 'mean_reversion', 'sideways_bb_std_mult': 2.9981975034399353, 'sideways_rsi_os': 16, 'sideways_rsi_ob': 84, 'sideways_adx_thresh': 8.476228553156771, 'sideways_atr_min_pct': 0.02104440925648891, 'sideways_atr_max_pct': 0.08478835786794604, 'sideways_tp_mult': 2.584916864973712, 'sideways_tsl_mult': 0.7193662956384688, 'sideways_time_stop': 289, 'sideways_use_sma': True, 'sideways_use_ema': True, 'sideways_use_atr': True, 'sideways_use_adx': False, 'sideways_use_spike': False, 'sideways_rsi_required': False}.
[I 2025-08-30 19:16:49,797] Trial 320 finished with values: [-1000000000.0, 1000000000.0] and parameters: {'p_sma': 21, 'p_std': 38, 'p_atr': 11, 'p_adx': 9, 'rsi_period': 55, 'ema1': 26, 'ema2': 17, 'slip_atr_k': 0.01731954666406186, 'slip_spread_k': 0.4309679632476528, 'spread_hl_frac': 0.0014021342252366403, 'bb_std_mult': 0.8783255174082634, 'rsi_os': 7, 'rsi_ob': 59, 'vol_spike': 0.026727650349842896, 'adx_thresh': 9.887673290538691, 'atr_min_pct': 0.022331735588325716, 'atr_max_pct': 0.1269410986060425, 'tp_mult': 2.1574092993856615, 'tsl_mult': 0.3934706383720286, 'strategy': 'breakout', 'time_stop': 35, 'use_sma': False, 'use_atr': False, 'use_adx': True, 'use_ema': False, 'use_spike': True, 'rsi_required': True, 'edge_k': 0.14107928712075923, 'edge_cap': 0.3022783980662118, 'bull_strategy': 'mean_reversion', 'bull_bb_std_mult': 2.4998101241736292, 'bull_rsi_os': 50, 'bull_rsi_ob': 67, 'bull_adx_thresh': 25.105029631919425, 'bull_atr_min_pct': 0.0019781874422476666, 'bull_atr_max_pct': 0.02970183805898657, 'bull_tp_mult': 2.341765168946563, 'bull_tsl_mult': 0.07931843803547545, 'bull_time_stop': 255, 'bull_use_sma': True, 'bull_use_ema': False, 'bull_use_atr': False, 'bull_use_adx': True, 'bull_use_spike': True, 'bull_rsi_required': True, 'bear_strategy': 'breakout', 'bear_bb_std_mult': 3.4738284340650893, 'bear_rsi_os': 45, 'bear_rsi_ob': 79, 'bear_adx_thresh': 5.7460496292812735, 'bear_atr_min_pct': 0.0181340601868022, 'bear_atr_max_pct': 0.06928499053563664, 'bear_tp_mult': 1.657460357682018, 'bear_tsl_mult': 0.11744374158614171, 'bear_time_stop': 146, 'bear_use_sma': True, 'bear_use_ema': False, 'bear_use_atr': False, 'bear_use_adx': False, 'bear_use_spike': False, 'bear_rsi_required': True, 'sideways_strategy': 'breakout', 'sideways_bb_std_mult': 2.227900763444082, 'sideways_rsi_os': 20, 'sideways_rsi_ob': 56, 'sideways_adx_thresh': 12.305977622674156, 'sideways_atr_min_pct': 0.017749501556743787, 'sideways_atr_max_pct': 0.12084997901673808, 'sideways_tp_mult': 1.6422785375365347, 'sideways_tsl_mult': 0.3074250658559241, 'sideways_time_stop': 287, 'sideways_use_sma': True, 'sideways_use_ema': True, 'sideways_use_atr': False, 'sideways_use_adx': False, 'sideways_use_spike': False, 'sideways_rsi_required': False}.
[I 2025-08-30 19:17:24,671] Trial 323 finished with values: [-1000000000.0, 1000000000.0] and parameters: {'p_sma': 33, 'p_std': 37, 'p_atr': 12, 'p_adx': 29, 'rsi_period': 56, 'ema1': 8, 'ema2': 17, 'slip_atr_k': 0.09342187933090577, 'slip_spread_k': 0.42384796945368525, 'spread_hl_frac': 0.0013831804771110355, 'bb_std_mult': 0.8727389636493952, 'rsi_os': 42, 'rsi_ob': 57, 'vol_spike': 0.10296762810796274, 'adx_thresh': 26.902095754853725, 'atr_min_pct': 0.022511777890420526, 'atr_max_pct': 0.13197140010014363, 'tp_mult': 2.0631115546618677, 'tsl_mult': 0.38729162026948355, 'strategy': 'breakout', 'time_stop': 32, 'use_sma': False, 'use_atr': True, 'use_adx': False, 'use_ema': True, 'use_spike': True, 'rsi_required': False, 'edge_k': 0.28884273661189336, 'edge_cap': 0.44710258932094554, 'bull_strategy': 'mean_reversion', 'bull_bb_std_mult': 2.5323896011915075, 'bull_rsi_os': 50, 'bull_rsi_ob': 68, 'bull_adx_thresh': 25.360080677739255, 'bull_atr_min_pct': 0.02378585995115578, 'bull_atr_max_pct': 0.08168798104811718, 'bull_tp_mult': 1.6202254486956384, 'bull_tsl_mult': 0.9389325381024727, 'bull_time_stop': 177, 'bull_use_sma': False, 'bull_use_ema': False, 'bull_use_atr': False, 'bull_use_adx': False, 'bull_use_spike': True, 'bull_rsi_required': False, 'bear_strategy': 'breakout', 'bear_bb_std_mult': 3.160068638070165, 'bear_rsi_os': 55, 'bear_rsi_ob': 48, 'bear_adx_thresh': 5.821250911069219, 'bear_atr_min_pct': 0.0178735111928095, 'bear_atr_max_pct': 0.06355458816825357, 'bear_tp_mult': 1.7625029550845215, 'bear_tsl_mult': 0.11451669831480768, 'bear_time_stop': 36, 'bear_use_sma': False, 'bear_use_ema': False, 'bear_use_atr': True, 'bear_use_adx': True, 'bear_use_spike': False, 'bear_rsi_required': False, 'sideways_strategy': 'breakout', 'sideways_bb_std_mult': 2.5238705867996845, 'sideways_rsi_os': 27, 'sideways_rsi_ob': 92, 'sideways_adx_thresh': 27.1733069186023, 'sideways_atr_min_pct': 0.00867001506268427, 'sideways_atr_max_pct': 0.053942530904655124, 'sideways_tp_mult': 1.6859096723402278, 'sideways_tsl_mult': 0.6348550332158549, 'sideways_time_stop': 36, 'sideways_use_sma': True, 'sideways_use_ema': True, 'sideways_use_atr': False, 'sideways_use_adx': True, 'sideways_use_spike': False, 'sideways_rsi_required': True}.
[I 2025-08-30 19:17:24,855] Trial 321 finished with values: [-1000000000.0, 1000000000.0] and parameters: {'p_sma': 21, 'p_std': 27, 'p_atr': 21, 'p_adx': 8, 'rsi_period': 35, 'ema1': 26, 'ema2': 18, 'slip_atr_k': 0.0187385374301921, 'slip_spread_k': 0.4325625263188151, 'spread_hl_frac': 0.005257508217610414, 'bb_std_mult': 0.8748350972171526, 'rsi_os': 33, 'rsi_ob': 59, 'vol_spike': 0.03703435810705537, 'adx_thresh': 18.174290211054352, 'atr_min_pct': 0.029500206693500446, 'atr_max_pct': 0.12808783786743533, 'tp_mult': 1.9965364002422354, 'tsl_mult': 0.7615341635786406, 'strategy': 'breakout', 'time_stop': 30, 'use_sma': False, 'use_atr': True, 'use_adx': True, 'use_ema': False, 'use_spike': True, 'rsi_required': True, 'edge_k': 0.15117574478851026, 'edge_cap': 0.4385244842841373, 'bull_strategy': 'mean_reversion', 'bull_bb_std_mult': 1.962070261204427, 'bull_rsi_os': 50, 'bull_rsi_ob': 76, 'bull_adx_thresh': 15.987399076596269, 'bull_atr_min_pct': 0.0019720284870750567, 'bull_atr_max_pct': 0.03144914252209818, 'bull_tp_mult': 2.146597303682604, 'bull_tsl_mult': 0.06957634606537805, 'bull_time_stop': 181, 'bull_use_sma': True, 'bull_use_ema': False, 'bull_use_atr': False, 'bull_use_adx': True, 'bull_use_spike': True, 'bull_rsi_required': True, 'bear_strategy': 'breakout', 'bear_bb_std_mult': 3.4675707211422413, 'bear_rsi_os': 55, 'bear_rsi_ob': 85, 'bear_adx_thresh': 5.880358326873782, 'bear_atr_min_pct': 0.011629810802828634, 'bear_atr_max_pct': 0.04791157781063775, 'bear_tp_mult': 1.6551322162914162, 'bear_tsl_mult': 0.6398331918228812, 'bear_time_stop': 151, 'bear_use_sma': True, 'bear_use_ema': False, 'bear_use_atr': False, 'bear_use_adx': False, 'bear_use_spike': False, 'bear_rsi_required': True, 'sideways_strategy': 'mean_reversion', 'sideways_bb_std_mult': 2.5580885874745665, 'sideways_rsi_os': 15, 'sideways_rsi_ob': 84, 'sideways_adx_thresh': 8.445074429884357, 'sideways_atr_min_pct': 0.017964840858901186, 'sideways_atr_max_pct': 0.053190625603099576, 'sideways_tp_mult': 1.622203666185326, 'sideways_tsl_mult': 0.7316444312674597, 'sideways_time_stop': 36, 'sideways_use_sma': True, 'sideways_use_ema': True, 'sideways_use_atr': False, 'sideways_use_adx': False, 'sideways_use_spike': False, 'sideways_rsi_required': False}.
[I 2025-08-30 19:17:24,959] Trial 322 finished with values: [-0.0160999438688868, 0.016064963338785994] and parameters: {'p_sma': 45, 'p_std': 27, 'p_atr': 12, 'p_adx': 8, 'rsi_period': 22, 'ema1': 8, 'ema2': 18, 'slip_atr_k': 0.018447022993149223, 'slip_spread_k': 0.43243126270938825, 'spread_hl_frac': 0.011157937502223356, 'bb_std_mult': 3.319333519279675, 'rsi_os': 15, 'rsi_ob': 95, 'vol_spike': 0.02881454798913837, 'adx_thresh': 10.551225105765386, 'atr_min_pct': 0.022273720123314307, 'atr_max_pct': 0.13138111141636463, 'tp_mult': 2.069303533549481, 'tsl_mult': 0.19766808351040815, 'strategy': 'breakout', 'time_stop': 33, 'use_sma': False, 'use_atr': True, 'use_adx': False, 'use_ema': False, 'use_spike': True, 'rsi_required': True, 'edge_k': 1.2544590187318456, 'edge_cap': 0.18394303404894136, 'bull_strategy': 'mean_reversion', 'bull_bb_std_mult': 1.8895578868716512, 'bull_rsi_os': 48, 'bull_rsi_ob': 69, 'bull_adx_thresh': 25.317441111289746, 'bull_atr_min_pct': 0.002378654463299375, 'bull_atr_max_pct': 0.027895757720917208, 'bull_tp_mult': 1.6870535582841608, 'bull_tsl_mult': 0.9394894021512388, 'bull_time_stop': 83, 'bull_use_sma': True, 'bull_use_ema': False, 'bull_use_atr': False, 'bull_use_adx': True, 'bull_use_spike': True, 'bull_rsi_required': True, 'bear_strategy': 'breakout', 'bear_bb_std_mult': 3.1717115119712984, 'bear_rsi_os': 24, 'bear_rsi_ob': 85, 'bear_adx_thresh': 5.742500260733859, 'bear_atr_min_pct': 0.018141145436392555, 'bear_atr_max_pct': 0.04101167397342756, 'bear_tp_mult': 1.9629828402344707, 'bear_tsl_mult': 0.12168490643436497, 'bear_time_stop': 218, 'bear_use_sma': False, 'bear_use_ema': False, 'bear_use_atr': False, 'bear_use_adx': False, 'bear_use_spike': False, 'bear_rsi_required': True, 'sideways_strategy': 'mean_reversion', 'sideways_bb_std_mult': 2.1067924644342875, 'sideways_rsi_os': 27, 'sideways_rsi_ob': 57, 'sideways_adx_thresh': 24.95278670062449, 'sideways_atr_min_pct': 0.028490733074040472, 'sideways_atr_max_pct': 0.0678008399816095, 'sideways_tp_mult': 1.708641718725155, 'sideways_tsl_mult': 0.7184992935372553, 'sideways_time_stop': 106, 'sideways_use_sma': True, 'sideways_use_ema': True, 'sideways_use_atr': False, 'sideways_use_adx': False, 'sideways_use_spike': False, 'sideways_rsi_required': True}.
