[I 2025-08-30 18:37:43,223] Trial 21 finished with values: [-1000000000.0, 1000000000.0] and parameters: {'p_sma': 37, 'p_std': 25, 'p_atr': 11, 'p_adx': 20, 'rsi_period': 26, 'ema1': 24, 'ema2': 26, 'slip_atr_k': 0.08965171596870265, 'slip_spread_k': 0.19736305249547192, 'spread_hl_frac': 0.04930369008993652, 'bb_std_mult': 1.2420595477509324, 'rsi_os': 26, 'rsi_ob': 47, 'vol_spike': 0.06504783620207628, 'adx_thresh': 34.60847566849201, 'atr_min_pct': 0.029267380309158337, 'atr_max_pct': 0.111018643000414, 'tp_mult': 2.0636682795352135, 'tsl_mult': 0.7167167691885845, 'strategy': 'mean_reversion', 'time_stop': 119, 'use_sma': True, 'use_atr': True, 'use_adx': False, 'use_ema': False, 'use_spike': True, 'rsi_required': True, 'edge_k': 0.30377974613530734, 'edge_cap': 0.2219986025511131, 'bull_strategy': 'mean_reversion', 'bull_bb_std_mult': 0.5230034252779678, 'bull_rsi_os': 22, 'bull_rsi_ob': 75, 'bull_adx_thresh': 34.90486252486465, 'bull_atr_min_pct': 0.0001365610012007655, 'bull_atr_max_pct': 0.12489056530793223, 'bull_tp_mult': 2.960868905553057, 'bull_tsl_mult': 0.6132359233746589, 'bull_time_stop': 124, 'bull_use_sma': False, 'bull_use_ema': False, 'bull_use_atr': True, 'bull_use_adx': True, 'bull_use_spike': True, 'bull_rsi_required': False, 'bear_strategy': 'breakout', 'bear_bb_std_mult': 1.4300356906269776, 'bear_rsi_os': 17, 'bear_rsi_ob': 63, 'bear_adx_thresh': 22.24101023203175, 'bear_atr_min_pct': 0.009525784085696732, 'bear_atr_max_pct': 0.06167777592378278, 'bear_tp_mult': 2.1137859112541504, 'bear_tsl_mult': 0.6306873664937614, 'bear_time_stop': 125, 'bear_use_sma': True, 'bear_use_ema': False, 'bear_use_atr': False, 'bear_use_adx': False, 'bear_use_spike': True, 'bear_rsi_required': True, 'sideways_strategy': 'breakout', 'sideways_bb_std_mult': 2.6711679212914397, 'sideways_rsi_os': 16, 'sideways_rsi_ob': 78, 'sideways_adx_thresh': 11.20326705708222, 'sideways_atr_min_pct': 0.0164587805814494, 'sideways_atr_max_pct': 0.055764204664065925, 'sideways_tp_mult': 2.1178467035487203, 'sideways_tsl_mult': 0.06353647868177242, 'sideways_time_stop': 298, 'sideways_use_sma': True, 'sideways_use_ema': False, 'sideways_use_atr': False, 'sideways_use_adx': True, 'sideways_use_spike': True, 'sideways_rsi_required': True}.
[I 2025-08-30 18:38:13,791] Trial 18 finished with values: [-1000000000.0, 1000000000.0] and parameters: {'p_sma': 43, 'p_std': 5, 'p_atr': 11, 'p_adx': 21, 'rsi_period': 27, 'ema1': 28, 'ema2': 22, 'slip_atr_k': 0.11298170644219993, 'slip_spread_k': 0.3743744477878226, 'spread_hl_frac': 0.03581273419378493, 'bb_std_mult': 1.0545946871179424, 'rsi_os': 30, 'rsi_ob': 79, 'vol_spike': 0.2970906865273246, 'adx_thresh': 17.667874156130605, 'atr_min_pct': 0.0005956208661363205, 'atr_max_pct': 0.10359558827479332, 'tp_mult': 2.146935603116874, 'tsl_mult': 0.28239082955069617, 'strategy': 'breakout', 'time_stop': 121, 'use_sma': False, 'use_atr': True, 'use_adx': False, 'use_ema': False, 'use_spike': True, 'rsi_required': True, 'edge_k': 0.9126445391839572, 'edge_cap': 0.15937513899030648, 'bull_strategy': 'breakout', 'bull_bb_std_mult': 3.107775329069178, 'bull_rsi_os': 15, 'bull_rsi_ob': 73, 'bull_adx_thresh': 24.641340823947168, 'bull_atr_min_pct': 0.004234712431140436, 'bull_atr_max_pct': 0.12536433285176857, 'bull_tp_mult': 2.29568112462561, 'bull_tsl_mult': 0.0008049050960340365, 'bull_time_stop': 21, 'bull_use_sma': True, 'bull_use_ema': False, 'bull_use_atr': True, 'bull_use_adx': False, 'bull_use_spike': True, 'bull_rsi_required': False, 'bear_strategy': 'breakout', 'bear_bb_std_mult': 2.3599954318900638, 'bear_rsi_os': 38, 'bear_rsi_ob': 66, 'bear_adx_thresh': 24.503386673574717, 'bear_atr_min_pct': 0.010590987597174629, 'bear_atr_max_pct': 0.11696514124323684, 'bear_tp_mult': 2.0316858278089285, 'bear_tsl_mult': 0.6992986490895443, 'bear_time_stop': 83, 'bear_use_sma': True, 'bear_use_ema': False, 'bear_use_atr': True, 'bear_use_adx': True, 'bear_use_spike': False, 'bear_rsi_required': False, 'sideways_strategy': 'mean_reversion', 'sideways_bb_std_mult': 1.6121124481316929, 'sideways_rsi_os': 13, 'sideways_rsi_ob': 75, 'sideways_adx_thresh': 5.2036836499163, 'sideways_atr_min_pct': 0.002209125704380345, 'sideways_atr_max_pct': 0.10686523778861372, 'sideways_tp_mult': 1.4236889207852716, 'sideways_tsl_mult': 0.5939580674824017, 'sideways_time_stop': 286, 'sideways_use_sma': True, 'sideways_use_ema': True, 'sideways_use_atr': False, 'sideways_use_adx': False, 'sideways_use_spike': False, 'sideways_rsi_required': False}.
[I 2025-08-30 18:38:14,844] Trial 19 finished with values: [-1000000000.0, 1000000000.0] and parameters: {'p_sma': 44, 'p_std': 6, 'p_atr': 10, 'p_adx': 20, 'rsi_period': 26, 'ema1': 25, 'ema2': 23, 'slip_atr_k': 0.1459062720190324, 'slip_spread_k': 0.48458215616336764, 'spread_hl_frac': 0.035236892012404736, 'bb_std_mult': 1.1194161377248195, 'rsi_os': 29, 'rsi_ob': 80, 'vol_spike': 0.2800832095403124, 'adx_thresh': 26.691287378734643, 'atr_min_pct': 0.029940363202170237, 'atr_max_pct': 0.10637177037129976, 'tp_mult': 2.229925219213444, 'tsl_mult': 0.28052439208138086, 'strategy': 'breakout', 'time_stop': 122, 'use_sma': False, 'use_atr': True, 'use_adx': False, 'use_ema': False, 'use_spike': True, 'rsi_required': True, 'edge_k': 0.27978688341369706, 'edge_cap': 0.22764845469588413, 'bull_strategy': 'breakout', 'bull_bb_std_mult': 0.5662398945886902, 'bull_rsi_os': 15, 'bull_rsi_ob': 74, 'bull_adx_thresh': 24.51316325441598, 'bull_atr_min_pct': 0.005265059645418332, 'bull_atr_max_pct': 0.12355589890838428, 'bull_tp_mult': 2.2884916797361954, 'bull_tsl_mult': 0.7090402756976738, 'bull_time_stop': 126, 'bull_use_sma': True, 'bull_use_ema': False, 'bull_use_atr': True, 'bull_use_adx': False, 'bull_use_spike': True, 'bull_rsi_required': False, 'bear_strategy': 'breakout', 'bear_bb_std_mult': 1.3013265519526525, 'bear_rsi_os': 37, 'bear_rsi_ob': 65, 'bear_adx_thresh': 21.961925826645583, 'bear_atr_min_pct': 0.00864863865726245, 'bear_atr_max_pct': 0.06642568536205792, 'bear_tp_mult': 1.6440446798314616, 'bear_tsl_mult': 0.8071028447963853, 'bear_time_stop': 123, 'bear_use_sma': True, 'bear_use_ema': False, 'bear_use_atr': True, 'bear_use_adx': True, 'bear_use_spike': False, 'bear_rsi_required': False, 'sideways_strategy': 'mean_reversion', 'sideways_bb_std_mult': 1.7761118676562468, 'sideways_rsi_os': 10, 'sideways_rsi_ob': 77, 'sideways_adx_thresh': 5.09163381622202, 'sideways_atr_min_pct': 0.01562240011387865, 'sideways_atr_max_pct': 0.06195564209470442, 'sideways_tp_mult': 1.3923901260440381, 'sideways_tsl_mult': 0.023472827999660495, 'sideways_time_stop': 296, 'sideways_use_sma': True, 'sideways_use_ema': True, 'sideways_use_atr': False, 'sideways_use_adx': False, 'sideways_use_spike': False, 'sideways_rsi_required': False}.
[I 2025-08-30 18:38:15,910] Trial 20 finished with values: [-0.021254920513889775, 0.02116192217221563] and parameters: {'p_sma': 44, 'p_std': 23, 'p_atr': 12, 'p_adx': 21, 'rsi_period': 28, 'ema1': 14, 'ema2': 26, 'slip_atr_k': 0.09034887703821377, 'slip_spread_k': 0.4710560710024267, 'spread_hl_frac': 0.008601445921075115, 'bb_std_mult': 1.142033826608442, 'rsi_os': 29, 'rsi_ob': 45, 'vol_spike': 0.06463142955858735, 'adx_thresh': 28.50090366005206, 'atr_min_pct': 0.000937220143338564, 'atr_max_pct': 0.10874398805834772, 'tp_mult': 2.172591905317637, 'tsl_mult': 0.6574354605777326, 'strategy': 'breakout', 'time_stop': 124, 'use_sma': False, 'use_atr': True, 'use_adx': False, 'use_ema': False, 'use_spike': True, 'rsi_required': True, 'edge_k': 0.8965588729003459, 'edge_cap': 0.17538332935797946, 'bull_strategy': 'mean_reversion', 'bull_bb_std_mult': 2.3604021764551235, 'bull_rsi_os': 12, 'bull_rsi_ob': 73, 'bull_adx_thresh': 34.63442707419569, 'bull_atr_min_pct': 0.00044831094565550567, 'bull_atr_max_pct': 0.12171502945739077, 'bull_tp_mult': 2.938329762275358, 'bull_tsl_mult': 0.6597146700427383, 'bull_time_stop': 117, 'bull_use_sma': True, 'bull_use_ema': False, 'bull_use_atr': True, 'bull_use_adx': False, 'bull_use_spike': True, 'bull_rsi_required': False, 'bear_strategy': 'breakout', 'bear_bb_std_mult': 1.3258942348111988, 'bear_rsi_os': 17, 'bear_rsi_ob': 65, 'bear_adx_thresh': 22.21105697865251, 'bear_atr_min_pct': 0.00974817854721983, 'bear_atr_max_pct': 0.07123566960558611, 'bear_tp_mult': 2.116658041660749, 'bear_tsl_mult': 0.6414693771122124, 'bear_time_stop': 127, 'bear_use_sma': True, 'bear_use_ema': False, 'bear_use_atr': True, 'bear_use_adx': True, 'bear_use_spike': False, 'bear_rsi_required': False, 'sideways_strategy': 'mean_reversion', 'sideways_bb_std_mult': 2.6913685606049054, 'sideways_rsi_os': 14, 'sideways_rsi_ob': 77, 'sideways_adx_thresh': 13.284924323646171, 'sideways_atr_min_pct': 0.016035755854405306, 'sideways_atr_max_pct': 0.05957402976766296, 'sideways_tp_mult': 2.0667850590869703, 'sideways_tsl_mult': 0.42635478041424246, 'sideways_time_stop': 236, 'sideways_use_sma': True, 'sideways_use_ema': True, 'sideways_use_atr': False, 'sideways_use_adx': False, 'sideways_use_spike': False, 'sideways_rsi_required': False}.
[I 2025-08-30 18:38:17,085] Trial 22 finished with values: [-1000000000.0, 1000000000.0] and parameters: {'p_sma': 16, 'p_std': 6, 'p_atr': 12, 'p_adx': 15, 'rsi_period': 47, 'ema1': 14, 'ema2': 37, 'slip_atr_k': 0.0858083910544443, 'slip_spread_k': 0.5157623568496909, 'spread_hl_frac': 0.01097641566377389, 'bb_std_mult': 1.0999668882921845, 'rsi_os': 31, 'rsi_ob': 95, 'vol_spike': 0.18067189332304956, 'adx_thresh': 26.91975243611168, 'atr_min_pct': 0.01755816277108043, 'atr_max_pct': 0.06384011428295844, 'tp_mult': 2.5006885386825544, 'tsl_mult': 0.17583308578097231, 'strategy': 'breakout', 'time_stop': 200, 'use_sma': False, 'use_atr': True, 'use_adx': False, 'use_ema': False, 'use_spike': True, 'rsi_required': True, 'edge_k': 0.813938664496122, 'edge_cap': 0.4711088817858633, 'bull_strategy': 'mean_reversion', 'bull_bb_std_mult': 2.41203351332298, 'bull_rsi_os': 13, 'bull_rsi_ob': 55, 'bull_adx_thresh': 25.810656674375064, 'bull_atr_min_pct': 0.015397841437149506, 'bull_atr_max_pct': 0.1265118921929192, 'bull_tp_mult': 2.237787371576929, 'bull_tsl_mult': 0.8350067762901238, 'bull_time_stop': 79, 'bull_use_sma': True, 'bull_use_ema': False, 'bull_use_atr': True, 'bull_use_adx': False, 'bull_use_spike': True, 'bull_rsi_required': False, 'bear_strategy': 'breakout', 'bear_bb_std_mult': 0.817717535991621, 'bear_rsi_os': 37, 'bear_rsi_ob': 85, 'bear_adx_thresh': 30.881140328377338, 'bear_atr_min_pct': 0.0022300135359198375, 'bear_atr_max_pct': 0.011101269311704312, 'bear_tp_mult': 1.589550254747457, 'bear_tsl_mult': 0.20777947812391234, 'bear_time_stop': 51, 'bear_use_sma': True, 'bear_use_ema': False, 'bear_use_atr': True, 'bear_use_adx': True, 'bear_use_spike': False, 'bear_rsi_required': False, 'sideways_strategy': 'mean_reversion', 'sideways_bb_std_mult': 1.7803284196209457, 'sideways_rsi_os': 14, 'sideways_rsi_ob': 79, 'sideways_adx_thresh': 13.724961728629157, 'sideways_atr_min_pct': 0.02298046433260178, 'sideways_atr_max_pct': 0.09092391890654992, 'sideways_tp_mult': 2.0079860078991003, 'sideways_tsl_mult': 0.37926657903984273, 'sideways_time_stop': 226, 'sideways_use_sma': True, 'sideways_use_ema': True, 'sideways_use_atr': False, 'sideways_use_adx': False, 'sideways_use_spike': False, 'sideways_rsi_required': False}.
[I 2025-08-30 18:38:48,723] Trial 23 finished with values: [-1000000000.0, 1000000000.0] and parameters: {'p_sma': 18, 'p_std': 24, 'p_atr': 14, 'p_adx': 30, 'rsi_period': 46, 'ema1': 14, 'ema2': 38, 'slip_atr_k': 0.158197112169083, 'slip_spread_k': 0.5268070212429011, 'spread_hl_frac': 0.009086662803676988, 'bb_std_mult': 1.7153901421596887, 'rsi_os': 33, 'rsi_ob': 45, 'vol_spike': 0.18789286973772226, 'adx_thresh': 26.772942255621427, 'atr_min_pct': 0.017241311720898416, 'atr_max_pct': 0.06237897061853044, 'tp_mult': 2.4257070763057347, 'tsl_mult': 0.1889130640157567, 'strategy': 'breakout', 'time_stop': 207, 'use_sma': False, 'use_atr': True, 'use_adx': False, 'use_ema': False, 'use_spike': True, 'rsi_required': True, 'edge_k': 1.5406890589497404, 'edge_cap': 0.4584285882167922, 'bull_strategy': 'mean_reversion', 'bull_bb_std_mult': 2.350263366020152, 'bull_rsi_os': 14, 'bull_rsi_ob': 88, 'bull_adx_thresh': 15.318675739970912, 'bull_atr_min_pct': 0.014993107442146688, 'bull_atr_max_pct': 0.1139959691153078, 'bull_tp_mult': 2.66892668085408, 'bull_tsl_mult': 0.8710296283614054, 'bull_time_stop': 85, 'bull_use_sma': True, 'bull_use_ema': False, 'bull_use_atr': True, 'bull_use_adx': False, 'bull_use_spike': True, 'bull_rsi_required': True, 'bear_strategy': 'breakout', 'bear_bb_std_mult': 0.8859768164464386, 'bear_rsi_os': 20, 'bear_rsi_ob': 86, 'bear_adx_thresh': 29.650174173358423, 'bear_atr_min_pct': 0.0009703484864145816, 'bear_atr_max_pct': 0.011381470465792742, 'bear_tp_mult': 1.6369169166449526, 'bear_tsl_mult': 0.21613635939499648, 'bear_time_stop': 50, 'bear_use_sma': True, 'bear_use_ema': False, 'bear_use_atr': True, 'bear_use_adx': True, 'bear_use_spike': False, 'bear_rsi_required': False, 'sideways_strategy': 'mean_reversion', 'sideways_bb_std_mult': 1.8841282144086486, 'sideways_rsi_os': 55, 'sideways_rsi_ob': 57, 'sideways_adx_thresh': 14.30784001026845, 'sideways_atr_min_pct': 0.01473167890472524, 'sideways_atr_max_pct': 0.1267374514801612, 'sideways_tp_mult': 1.9779590518857684, 'sideways_tsl_mult': 0.3637581719941939, 'sideways_time_stop': 228, 'sideways_use_sma': True, 'sideways_use_ema': True, 'sideways_use_atr': False, 'sideways_use_adx': False, 'sideways_use_spike': False, 'sideways_rsi_required': False}.
[I 2025-08-30 18:38:50,915] Trial 24 finished with values: [-1000000000.0, 1000000000.0] and parameters: {'p_sma': 18, 'p_std': 22, 'p_atr': 25, 'p_adx': 15, 'rsi_period': 69, 'ema1': 14, 'ema2': 37, 'slip_atr_k': 0.1706104429295446, 'slip_spread_k': 0.21429082116428072, 'spread_hl_frac': 0.04378719693193552, 'bb_std_mult': 1.639086593657639, 'rsi_os': 47, 'rsi_ob': 54, 'vol_spike': 0.17358056007249145, 'adx_thresh': 12.454513661382986, 'atr_min_pct': 0.019564243220787796, 'atr_max_pct': 0.06743682203930867, 'tp_mult': 2.554005253004126, 'tsl_mult': 0.02833027676466865, 'strategy': 'mean_reversion', 'time_stop': 81, 'use_sma': True, 'use_atr': True, 'use_adx': True, 'use_ema': False, 'use_spike': True, 'rsi_required': False, 'edge_k': 1.1572710393241983, 'edge_cap': 0.9570773939992165, 'bull_strategy': 'mean_reversion', 'bull_bb_std_mult': 2.4870882150983094, 'bull_rsi_os': 44, 'bull_rsi_ob': 54, 'bull_adx_thresh': 16.84697003483333, 'bull_atr_min_pct': 0.016611466646339293, 'bull_atr_max_pct': 0.013446952841939308, 'bull_tp_mult': 1.9592294468675389, 'bull_tsl_mult': 0.8542829413067892, 'bull_time_stop': 224, 'bull_use_sma': False, 'bull_use_ema': False, 'bull_use_atr': True, 'bull_use_adx': True, 'bull_use_spike': True, 'bull_rsi_required': True, 'bear_strategy': 'breakout', 'bear_bb_std_mult': 1.0226465684244743, 'bear_rsi_os': 16, 'bear_rsi_ob': 49, 'bear_adx_thresh': 29.333797487287065, 'bear_atr_min_pct': 0.016294594649364055, 'bear_atr_max_pct': 0.10055899130613379, 'bear_tp_mult': 1.1144780067160909, 'bear_tsl_mult': 0.599195590661629, 'bear_time_stop': 52, 'bear_use_sma': True, 'bear_use_ema': True, 'bear_use_atr': True, 'bear_use_adx': True, 'bear_use_spike': False, 'bear_rsi_required': True, 'sideways_strategy': 'mean_reversion', 'sideways_bb_std_mult': 0.9954973756239078, 'sideways_rsi_os': 37, 'sideways_rsi_ob': 83, 'sideways_adx_thresh': 13.397121888873468, 'sideways_atr_min_pct': 0.023476978329581198, 'sideways_atr_max_pct': 0.09373022335930249, 'sideways_tp_mult': 1.984871592597167, 'sideways_tsl_mult': 0.40034108042792305, 'sideways_time_stop': 228, 'sideways_use_sma': False, 'sideways_use_ema': True, 'sideways_use_atr': False, 'sideways_use_adx': True, 'sideways_use_spike': True, 'sideways_rsi_required': True}.
[I 2025-08-30 18:38:51,042] Trial 25 finished with values: [-1000000000.0, 1000000000.0] and parameters: {'p_sma': 5, 'p_std': 23, 'p_atr': 14, 'p_adx': 14, 'rsi_period': 47, 'ema1': 15, 'ema2': 37, 'slip_atr_k': 0.16508892783324225, 'slip_spread_k': 0.540746740056163, 'spread_hl_frac': 0.009211837751672822, 'bb_std_mult': 1.4959146724799401, 'rsi_os': 45, 'rsi_ob': 94, 'vol_spike': 0.05696987350184607, 'adx_thresh': 19.785049859843237, 'atr_min_pct': 0.01797067430377921, 'atr_max_pct': 0.12460751247791244, 'tp_mult': 2.5820265025317095, 'tsl_mult': 0.16229433124036144, 'strategy': 'breakout', 'time_stop': 194, 'use_sma': False, 'use_atr': True, 'use_adx': False, 'use_ema': False, 'use_spike': True, 'rsi_required': True, 'edge_k': 1.6310035253650912, 'edge_cap': 0.4623698186030499, 'bull_strategy': 'mean_reversion', 'bull_bb_std_mult': 2.3158783427881806, 'bull_rsi_os': 11, 'bull_rsi_ob': 87, 'bull_adx_thresh': 15.021327898275892, 'bull_atr_min_pct': 0.015990249045789686, 'bull_atr_max_pct': 0.012193499368933935, 'bull_tp_mult': 1.7987295435243167, 'bull_tsl_mult': 0.859530897934206, 'bull_time_stop': 83, 'bull_use_sma': True, 'bull_use_ema': False, 'bull_use_atr': True, 'bull_use_adx': False, 'bull_use_spike': True, 'bull_rsi_required': True, 'bear_strategy': 'breakout', 'bear_bb_std_mult': 0.9267712537007762, 'bear_rsi_os': 14, 'bear_rsi_ob': 81, 'bear_adx_thresh': 29.67499901526149, 'bear_atr_min_pct': 0.02497397323241906, 'bear_atr_max_pct': 0.010140056523206209, 'bear_tp_mult': 1.1257421884219159, 'bear_tsl_mult': 0.20060847529164122, 'bear_time_stop': 60, 'bear_use_sma': True, 'bear_use_ema': False, 'bear_use_atr': True, 'bear_use_adx': True, 'bear_use_spike': False, 'bear_rsi_required': False, 'sideways_strategy': 'mean_reversion', 'sideways_bb_std_mult': 1.839142523286179, 'sideways_rsi_os': 55, 'sideways_rsi_ob': 55, 'sideways_adx_thresh': 13.584223351069719, 'sideways_atr_min_pct': 0.020310186322756437, 'sideways_atr_max_pct': 0.12677461808710724, 'sideways_tp_mult': 1.970858381289536, 'sideways_tsl_mult': 0.33094767468400865, 'sideways_time_stop': 226, 'sideways_use_sma': True, 'sideways_use_ema': True, 'sideways_use_atr': False, 'sideways_use_adx': False, 'sideways_use_spike': False, 'sideways_rsi_required': False}.
[I 2025-08-30 18:38:52,250] Trial 26 finished with values: [-1000000000.0, 1000000000.0] and parameters: {'p_sma': 5, 'p_std': 22, 'p_atr': 15, 'p_adx': 10, 'rsi_period': 47, 'ema1': 12, 'ema2': 48, 'slip_atr_k': 0.16039433269515324, 'slip_spread_k': 0.6674027093858537, 'spread_hl_frac': 0.006904235235405329, 'bb_std_mult': 1.5008599494424364, 'rsi_os': 44, 'rsi_ob': 71, 'vol_spike': 0.0530904619793737, 'adx_thresh': 20.15652325888883, 'atr_min_pct': 0.010818028570223386, 'atr_max_pct': 0.12285953177726476, 'tp_mult': 2.5858128581474125, 'tsl_mult': 0.4668453310341059, 'strategy': 'mean_reversion', 'time_stop': 82, 'use_sma': True, 'use_atr': True, 'use_adx': True, 'use_ema': False, 'use_spike': True, 'rsi_required': False, 'edge_k': 1.6727023986889393, 'edge_cap': 0.9940131984518378, 'bull_strategy': 'mean_reversion', 'bull_bb_std_mult': 2.2103897958239305, 'bull_rsi_os': 24, 'bull_rsi_ob': 90, 'bull_adx_thresh': 27.085425275047754, 'bull_atr_min_pct': 0.009524661202275282, 'bull_atr_max_pct': 0.10853915661509339, 'bull_tp_mult': 1.8254262315981782, 'bull_tsl_mult': 0.8780791400873866, 'bull_time_stop': 87, 'bull_use_sma': False, 'bull_use_ema': False, 'bull_use_atr': True, 'bull_use_adx': True, 'bull_use_spike': True, 'bull_rsi_required': True, 'bear_strategy': 'mean_reversion', 'bear_bb_std_mult': 0.9864330530673938, 'bear_rsi_os': 14, 'bear_rsi_ob': 79, 'bear_adx_thresh': 28.537165380515162, 'bear_atr_min_pct': 0.024984737902459087, 'bear_atr_max_pct': 0.09900973409019029, 'bear_tp_mult': 1.025262818028159, 'bear_tsl_mult': 0.5839603720802375, 'bear_time_stop': 55, 'bear_use_sma': True, 'bear_use_ema': True, 'bear_use_atr': False, 'bear_use_adx': False, 'bear_use_spike': True, 'bear_rsi_required': True, 'sideways_strategy': 'breakout', 'sideways_bb_std_mult': 1.1979380041419785, 'sideways_rsi_os': 55, 'sideways_rsi_ob': 56, 'sideways_adx_thresh': 21.54578445956856, 'sideways_atr_min_pct': 0.014046148793049672, 'sideways_atr_max_pct': 0.1324361155803952, 'sideways_tp_mult': 2.2888558719839347, 'sideways_tsl_mult': 0.3857788344702061, 'sideways_time_stop': 237, 'sideways_use_sma': False, 'sideways_use_ema': False, 'sideways_use_atr': False, 'sideways_use_adx': True, 'sideways_use_spike': True, 'sideways_rsi_required': True}.
