[I 2025-08-30 18:53:47,982] Trial 144 finished with values: [-1000000000.0, 1000000000.0] and parameters: {'p_sma': 58, 'p_std': 53, 'p_atr': 8, 'p_adx': 9, 'rsi_period': 74, 'ema1': 13, 'ema2': 18, 'slip_atr_k': 0.014948834470315718, 'slip_spread_k': 0.43886655274843955, 'spread_hl_frac': 0.005519265409861142, 'bb_std_mult': 0.778683315030219, 'rsi_os': 26, 'rsi_ob': 65, 'vol_spike': 0.022788481048621828, 'adx_thresh': 18.35312184624925, 'atr_min_pct': 0.01370844749248886, 'atr_max_pct': 0.13818946551568584, 'tp_mult': 2.2003305956185963, 'tsl_mult': 0.6488678867529996, 'strategy': 'breakout', 'time_stop': 146, 'use_sma': False, 'use_atr': True, 'use_adx': False, 'use_ema': True, 'use_spike': True, 'rsi_required': True, 'edge_k': 0.5980602401452699, 'edge_cap': 0.8143351460128632, 'bull_strategy': 'mean_reversion', 'bull_bb_std_mult': 1.775022525301812, 'bull_rsi_os': 17, 'bull_rsi_ob': 72, 'bull_adx_thresh': 26.6227187143969, 'bull_atr_min_pct': 0.027235066280652385, 'bull_atr_max_pct': 0.1494469332113992, 'bull_tp_mult': 2.1236451472913087, 'bull_tsl_mult': 0.22827173121940864, 'bull_time_stop': 208, 'bull_use_sma': True, 'bull_use_ema': False, 'bull_use_atr': False, 'bull_use_adx': True, 'bull_use_spike': True, 'bull_rsi_required': True, 'bear_strategy': 'breakout', 'bear_bb_std_mult': 1.8838612257765504, 'bear_rsi_os': 44, 'bear_rsi_ob': 76, 'bear_adx_thresh': 5.6194439699132115, 'bear_atr_min_pct': 0.016549425203124656, 'bear_atr_max_pct': 0.0530770843306754, 'bear_tp_mult': 1.7756023635560274, 'bear_tsl_mult': 0.1383514222435131, 'bear_time_stop': 69, 'bear_use_sma': True, 'bear_use_ema': True, 'bear_use_atr': True, 'bear_use_adx': True, 'bear_use_spike': False, 'bear_rsi_required': False, 'sideways_strategy': 'breakout', 'sideways_bb_std_mult': 2.138106904425504, 'sideways_rsi_os': 17, 'sideways_rsi_ob': 56, 'sideways_adx_thresh': 9.641603504718232, 'sideways_atr_min_pct': 0.018793891696413323, 'sideways_atr_max_pct': 0.119601152481582, 'sideways_tp_mult': 1.879155030822544, 'sideways_tsl_mult': 0.33273938982520135, 'sideways_time_stop': 284, 'sideways_use_sma': False, 'sideways_use_ema': True, 'sideways_use_atr': False, 'sideways_use_adx': False, 'sideways_use_spike': False, 'sideways_rsi_required': False}.
[I 2025-08-30 18:53:48,610] Trial 145 finished with values: [-1000000000.0, 1000000000.0] and parameters: {'p_sma': 19, 'p_std': 53, 'p_atr': 21, 'p_adx': 23, 'rsi_period': 10, 'ema1': 11, 'ema2': 38, 'slip_atr_k': 0.016538232947842804, 'slip_spread_k': 0.2009846898704294, 'spread_hl_frac': 0.031875966413715845, 'bb_std_mult': 2.615751819508237, 'rsi_os': 38, 'rsi_ob': 83, 'vol_spike': 0.02395997040490732, 'adx_thresh': 17.340591804894228, 'atr_min_pct': 0.014481088735756665, 'atr_max_pct': 0.13610938397664496, 'tp_mult': 2.5381055021431864, 'tsl_mult': 0.20764666796673886, 'strategy': 'breakout', 'time_stop': 20, 'use_sma': False, 'use_atr': False, 'use_adx': False, 'use_ema': False, 'use_spike': True, 'rsi_required': True, 'edge_k': 0.03548701500322371, 'edge_cap': 0.20882831474436442, 'bull_strategy': 'mean_reversion', 'bull_bb_std_mult': 1.7991054627301832, 'bull_rsi_os': 18, 'bull_rsi_ob': 72, 'bull_adx_thresh': 26.59033573730954, 'bull_atr_min_pct': 0.018898918762115538, 'bull_atr_max_pct': 0.07159272719822396, 'bull_tp_mult': 2.1324399367515645, 'bull_tsl_mult': 0.9617047190452548, 'bull_time_stop': 179, 'bull_use_sma': True, 'bull_use_ema': True, 'bull_use_atr': False, 'bull_use_adx': True, 'bull_use_spike': True, 'bull_rsi_required': True, 'bear_strategy': 'breakout', 'bear_bb_std_mult': 3.306787673838076, 'bear_rsi_os': 52, 'bear_rsi_ob': 94, 'bear_adx_thresh': 5.479814199039097, 'bear_atr_min_pct': 0.01801242414957312, 'bear_atr_max_pct': 0.14424770248247482, 'bear_tp_mult': 1.7753360475468298, 'bear_tsl_mult': 0.15391399772959674, 'bear_time_stop': 69, 'bear_use_sma': True, 'bear_use_ema': True, 'bear_use_atr': True, 'bear_use_adx': True, 'bear_use_spike': False, 'bear_rsi_required': False, 'sideways_strategy': 'breakout', 'sideways_bb_std_mult': 2.1601966605904037, 'sideways_rsi_os': 17, 'sideways_rsi_ob': 56, 'sideways_adx_thresh': 27.336441200049123, 'sideways_atr_min_pct': 0.018686696980001152, 'sideways_atr_max_pct': 0.12110864735190607, 'sideways_tp_mult': 2.637903987277451, 'sideways_tsl_mult': 0.5766842638897576, 'sideways_time_stop': 281, 'sideways_use_sma': False, 'sideways_use_ema': True, 'sideways_use_atr': False, 'sideways_use_adx': False, 'sideways_use_spike': False, 'sideways_rsi_required': False}.
[I 2025-08-30 18:53:49,259] Trial 146 finished with values: [-1000000000.0, 1000000000.0] and parameters: {'p_sma': 46, 'p_std': 53, 'p_atr': 21, 'p_adx': 7, 'rsi_period': 55, 'ema1': 29, 'ema2': 39, 'slip_atr_k': 0.023089588758197263, 'slip_spread_k': 0.43406884493989484, 'spread_hl_frac': 0.0035874610816625527, 'bb_std_mult': 2.577417604481011, 'rsi_os': 49, 'rsi_ob': 66, 'vol_spike': 0.06002886337946631, 'adx_thresh': 18.184162578291826, 'atr_min_pct': 0.02568245458526862, 'atr_max_pct': 0.13777009499737364, 'tp_mult': 2.289447335348427, 'tsl_mult': 0.17141810426073822, 'strategy': 'breakout', 'time_stop': 20, 'use_sma': False, 'use_atr': False, 'use_adx': False, 'use_ema': False, 'use_spike': True, 'rsi_required': True, 'edge_k': 1.11519743520846, 'edge_cap': 0.4202364229943613, 'bull_strategy': 'mean_reversion', 'bull_bb_std_mult': 1.7085003171079638, 'bull_rsi_os': 49, 'bull_rsi_ob': 72, 'bull_adx_thresh': 26.766082338150778, 'bull_atr_min_pct': 0.02741334153994828, 'bull_atr_max_pct': 0.025218458430149995, 'bull_tp_mult': 2.611449394965393, 'bull_tsl_mult': 0.6916288175572858, 'bull_time_stop': 79, 'bull_use_sma': False, 'bull_use_ema': True, 'bull_use_atr': False, 'bull_use_adx': True, 'bull_use_spike': True, 'bull_rsi_required': True, 'bear_strategy': 'breakout', 'bear_bb_std_mult': 3.2364731721207733, 'bear_rsi_os': 44, 'bear_rsi_ob': 63, 'bear_adx_thresh': 5.049612083232051, 'bear_atr_min_pct': 0.021575820563882308, 'bear_atr_max_pct': 0.03844451989319918, 'bear_tp_mult': 1.8160461370139485, 'bear_tsl_mult': 0.15359221643634952, 'bear_time_stop': 162, 'bear_use_sma': True, 'bear_use_ema': False, 'bear_use_atr': True, 'bear_use_adx': True, 'bear_use_spike': False, 'bear_rsi_required': False, 'sideways_strategy': 'mean_reversion', 'sideways_bb_std_mult': 1.9242677875953464, 'sideways_rsi_os': 17, 'sideways_rsi_ob': 56, 'sideways_adx_thresh': 8.872963642750056, 'sideways_atr_min_pct': 0.01611431260737116, 'sideways_atr_max_pct': 0.12103831752333917, 'sideways_tp_mult': 1.8820808701780105, 'sideways_tsl_mult': 0.9590185256921618, 'sideways_time_stop': 274, 'sideways_use_sma': True, 'sideways_use_ema': True, 'sideways_use_atr': False, 'sideways_use_adx': True, 'sideways_use_spike': False, 'sideways_rsi_required': True}.
[I 2025-08-30 18:53:49,700] Trial 150 finished with values: [-1000000000.0, 1000000000.0] and parameters: {'p_sma': 42, 'p_std': 26, 'p_atr': 12, 'p_adx': 20, 'rsi_period': 25, 'ema1': 23, 'ema2': 22, 'slip_atr_k': 0.18297518906504265, 'slip_spread_k': 0.6827142726801096, 'spread_hl_frac': 0.012987686239125969, 'bb_std_mult': 3.0976881146971995, 'rsi_os': 9, 'rsi_ob': 48, 'vol_spike': 0.03323422183128379, 'adx_thresh': 20.01725947590205, 'atr_min_pct': 0.026537156055652936, 'atr_max_pct': 0.1342244438714372, 'tp_mult': 2.1323029013829022, 'tsl_mult': 0.5477355543333648, 'strategy': 'mean_reversion', 'time_stop': 212, 'use_sma': True, 'use_atr': True, 'use_adx': False, 'use_ema': False, 'use_spike': False, 'rsi_required': True, 'edge_k': 1.9112500439596085, 'edge_cap': 0.6156691847782141, 'bull_strategy': 'mean_reversion', 'bull_bb_std_mult': 2.1581654258218053, 'bull_rsi_os': 42, 'bull_rsi_ob': 74, 'bull_adx_thresh': 24.545523848142214, 'bull_atr_min_pct': 0.005551160437537655, 'bull_atr_max_pct': 0.02177626996454571, 'bull_tp_mult': 2.400876266386267, 'bull_tsl_mult': 0.9236585617863986, 'bull_time_stop': 146, 'bull_use_sma': False, 'bull_use_ema': False, 'bull_use_atr': False, 'bull_use_adx': True, 'bull_use_spike': True, 'bull_rsi_required': False, 'bear_strategy': 'breakout', 'bear_bb_std_mult': 1.5272523011435575, 'bear_rsi_os': 21, 'bear_rsi_ob': 49, 'bear_adx_thresh': 22.695759740614214, 'bear_atr_min_pct': 0.027445723130918254, 'bear_atr_max_pct': 0.050319875484742205, 'bear_tp_mult': 1.9884829809703353, 'bear_tsl_mult': 0.07374636880119559, 'bear_time_stop': 26, 'bear_use_sma': True, 'bear_use_ema': False, 'bear_use_atr': True, 'bear_use_adx': True, 'bear_use_spike': True, 'bear_rsi_required': False, 'sideways_strategy': 'mean_reversion', 'sideways_bb_std_mult': 1.5250568381254688, 'sideways_rsi_os': 52, 'sideways_rsi_ob': 83, 'sideways_adx_thresh': 12.42852305072542, 'sideways_atr_min_pct': 0.00912934652392845, 'sideways_atr_max_pct': 0.11548459919174786, 'sideways_tp_mult': 1.8229766440574193, 'sideways_tsl_mult': 0.6854072654980414, 'sideways_time_stop': 260, 'sideways_use_sma': True, 'sideways_use_ema': True, 'sideways_use_atr': True, 'sideways_use_adx': True, 'sideways_use_spike': True, 'sideways_rsi_required': True}.
[I 2025-08-30 18:54:21,178] Trial 149 finished with values: [-1000000000.0, 1000000000.0] and parameters: {'p_sma': 46, 'p_std': 17, 'p_atr': 19, 'p_adx': 8, 'rsi_period': 26, 'ema1': 7, 'ema2': 22, 'slip_atr_k': 0.02352411333958934, 'slip_spread_k': 0.7705218169099337, 'spread_hl_frac': 0.022711883666442674, 'bb_std_mult': 2.403295610811069, 'rsi_os': 36, 'rsi_ob': 57, 'vol_spike': 0.03240858776546482, 'adx_thresh': 19.875176195225105, 'atr_min_pct': 0.025638963187401415, 'atr_max_pct': 0.10354038878611087, 'tp_mult': 2.2860133462383896, 'tsl_mult': 0.6909590962420794, 'strategy': 'mean_reversion', 'time_stop': 44, 'use_sma': False, 'use_atr': False, 'use_adx': False, 'use_ema': False, 'use_spike': False, 'rsi_required': True, 'edge_k': 1.1375286510194593, 'edge_cap': 0.24907585982734703, 'bull_strategy': 'mean_reversion', 'bull_bb_std_mult': 1.6923288049349696, 'bull_rsi_os': 49, 'bull_rsi_ob': 74, 'bull_adx_thresh': 27.86791960044104, 'bull_atr_min_pct': 0.028551071426562963, 'bull_atr_max_pct': 0.1381068270612707, 'bull_tp_mult': 1.9692965632561712, 'bull_tsl_mult': 0.5917707861041963, 'bull_time_stop': 199, 'bull_use_sma': False, 'bull_use_ema': True, 'bull_use_atr': False, 'bull_use_adx': True, 'bull_use_spike': True, 'bull_rsi_required': True, 'bear_strategy': 'breakout', 'bear_bb_std_mult': 3.230748637128454, 'bear_rsi_os': 16, 'bear_rsi_ob': 87, 'bear_adx_thresh': 22.416877762201057, 'bear_atr_min_pct': 0.0161273208190409, 'bear_atr_max_pct': 0.10494646214815195, 'bear_tp_mult': 2.714160809687258, 'bear_tsl_mult': 0.9908012788533469, 'bear_time_stop': 162, 'bear_use_sma': True, 'bear_use_ema': False, 'bear_use_atr': True, 'bear_use_adx': True, 'bear_use_spike': False, 'bear_rsi_required': False, 'sideways_strategy': 'mean_reversion', 'sideways_bb_std_mult': 1.5174704325421686, 'sideways_rsi_os': 53, 'sideways_rsi_ob': 53, 'sideways_adx_thresh': 8.751764891006555, 'sideways_atr_min_pct': 0.008904557695978182, 'sideways_atr_max_pct': 0.025394972812652968, 'sideways_tp_mult': 1.862006645056925, 'sideways_tsl_mult': 0.18796714134382309, 'sideways_time_stop': 275, 'sideways_use_sma': True, 'sideways_use_ema': True, 'sideways_use_atr': False, 'sideways_use_adx': True, 'sideways_use_spike': True, 'sideways_rsi_required': True}.
[I 2025-08-30 18:54:21,798] Trial 147 finished with values: [-1000000000.0, 1000000000.0] and parameters: {'p_sma': 42, 'p_std': 46, 'p_atr': 23, 'p_adx': 7, 'rsi_period': 52, 'ema1': 13, 'ema2': 47, 'slip_atr_k': 0.023373121996204976, 'slip_spread_k': 0.42317882911642946, 'spread_hl_frac': 0.02265639288295198, 'bb_std_mult': 2.3953774430562746, 'rsi_os': 48, 'rsi_ob': 65, 'vol_spike': 0.025138703064015236, 'adx_thresh': 17.365873940667267, 'atr_min_pct': 0.024309646532665125, 'atr_max_pct': 0.13631780411450922, 'tp_mult': 2.278252126266017, 'tsl_mult': 0.18561354836320038, 'strategy': 'breakout', 'time_stop': 42, 'use_sma': False, 'use_atr': False, 'use_adx': False, 'use_ema': False, 'use_spike': True, 'rsi_required': True, 'edge_k': 1.3026004866147394, 'edge_cap': 0.20492281058213258, 'bull_strategy': 'mean_reversion', 'bull_bb_std_mult': 2.12993211752939, 'bull_rsi_os': 11, 'bull_rsi_ob': 72, 'bull_adx_thresh': 26.560236874268192, 'bull_atr_min_pct': 0.027130353314083436, 'bull_atr_max_pct': 0.13810358937079162, 'bull_tp_mult': 2.1226442608716813, 'bull_tsl_mult': 0.9709320292780452, 'bull_time_stop': 179, 'bull_use_sma': False, 'bull_use_ema': True, 'bull_use_atr': False, 'bull_use_adx': True, 'bull_use_spike': True, 'bull_rsi_required': True, 'bear_strategy': 'breakout', 'bear_bb_std_mult': 3.238793729428968, 'bear_rsi_os': 45, 'bear_rsi_ob': 65, 'bear_adx_thresh': 5.086591655573061, 'bear_atr_min_pct': 0.01621762421650284, 'bear_atr_max_pct': 0.051451568233355, 'bear_tp_mult': 1.8231779853551935, 'bear_tsl_mult': 0.14678265120188086, 'bear_time_stop': 289, 'bear_use_sma': True, 'bear_use_ema': True, 'bear_use_atr': True, 'bear_use_adx': True, 'bear_use_spike': False, 'bear_rsi_required': False, 'sideways_strategy': 'mean_reversion', 'sideways_bb_std_mult': 1.9527586100348364, 'sideways_rsi_os': 12, 'sideways_rsi_ob': 56, 'sideways_adx_thresh': 12.01215196010883, 'sideways_atr_min_pct': 0.01797801144761925, 'sideways_atr_max_pct': 0.11996905053020625, 'sideways_tp_mult': 1.3732660053084618, 'sideways_tsl_mult': 0.3242178727210785, 'sideways_time_stop': 259, 'sideways_use_sma': False, 'sideways_use_ema': True, 'sideways_use_atr': False, 'sideways_use_adx': True, 'sideways_use_spike': False, 'sideways_rsi_required': True}.
[I 2025-08-30 18:54:21,984] Trial 148 finished with values: [-1000000000.0, 1000000000.0] and parameters: {'p_sma': 45, 'p_std': 17, 'p_atr': 21, 'p_adx': 23, 'rsi_period': 26, 'ema1': 7, 'ema2': 46, 'slip_atr_k': 0.022240727437480158, 'slip_spread_k': 0.7813872569262439, 'spread_hl_frac': 0.012901173904246624, 'bb_std_mult': 0.9982401325337046, 'rsi_os': 35, 'rsi_ob': 83, 'vol_spike': 0.06024261267872423, 'adx_thresh': 17.11369087880396, 'atr_min_pct': 0.017437084351878837, 'atr_max_pct': 0.13503339341132756, 'tp_mult': 2.2855575275437694, 'tsl_mult': 0.2005026801264499, 'strategy': 'breakout', 'time_stop': 42, 'use_sma': False, 'use_atr': False, 'use_adx': False, 'use_ema': False, 'use_spike': False, 'rsi_required': True, 'edge_k': 1.9294679933778087, 'edge_cap': 0.4269156833287336, 'bull_strategy': 'mean_reversion', 'bull_bb_std_mult': 2.110473265415246, 'bull_rsi_os': 43, 'bull_rsi_ob': 74, 'bull_adx_thresh': 21.172477824868118, 'bull_atr_min_pct': 0.0014108890108189998, 'bull_atr_max_pct': 0.02525745168064968, 'bull_tp_mult': 1.9759544381760032, 'bull_tsl_mult': 0.9731761228891201, 'bull_time_stop': 180, 'bull_use_sma': False, 'bull_use_ema': True, 'bull_use_atr': False, 'bull_use_adx': True, 'bull_use_spike': True, 'bull_rsi_required': True, 'bear_strategy': 'breakout', 'bear_bb_std_mult': 0.865559130893139, 'bear_rsi_os': 13, 'bear_rsi_ob': 49, 'bear_adx_thresh': 22.385677516669254, 'bear_atr_min_pct': 0.016116058059920956, 'bear_atr_max_pct': 0.05050076405475711, 'bear_tp_mult': 1.8240110507735408, 'bear_tsl_mult': 0.15451406547425175, 'bear_time_stop': 287, 'bear_use_sma': True, 'bear_use_ema': False, 'bear_use_atr': True, 'bear_use_adx': True, 'bear_use_spike': False, 'bear_rsi_required': False, 'sideways_strategy': 'mean_reversion', 'sideways_bb_std_mult': 1.9433378240628836, 'sideways_rsi_os': 20, 'sideways_rsi_ob': 53, 'sideways_adx_thresh': 8.939926610918354, 'sideways_atr_min_pct': 0.01623869034856307, 'sideways_atr_max_pct': 0.11573075744366401, 'sideways_tp_mult': 2.2758626574519996, 'sideways_tsl_mult': 0.11407076378088621, 'sideways_time_stop': 276, 'sideways_use_sma': True, 'sideways_use_ema': True, 'sideways_use_atr': False, 'sideways_use_adx': True, 'sideways_use_spike': True, 'sideways_rsi_required': True}.
[I 2025-08-30 18:54:22,158] Trial 151 finished with values: [-1000000000.0, 1000000000.0] and parameters: {'p_sma': 39, 'p_std': 17, 'p_atr': 19, 'p_adx': 7, 'rsi_period': 22, 'ema1': 9, 'ema2': 49, 'slip_atr_k': 0.20763831180752557, 'slip_spread_k': 0.4052645220890687, 'spread_hl_frac': 0.00794403873345843, 'bb_std_mult': 1.0197500693198356, 'rsi_os': 36, 'rsi_ob': 58, 'vol_spike': 0.0786512874443718, 'adx_thresh': 18.73170679789691, 'atr_min_pct': 0.024984705809319104, 'atr_max_pct': 0.0844383557863964, 'tp_mult': 2.614810688041727, 'tsl_mult': 0.24767404567407303, 'strategy': 'breakout', 'time_stop': 43, 'use_sma': False, 'use_atr': True, 'use_adx': True, 'use_ema': False, 'use_spike': True, 'rsi_required': True, 'edge_k': 1.6623216019304095, 'edge_cap': 0.47955058727282723, 'bull_strategy': 'mean_reversion', 'bull_bb_std_mult': 3.5857859279397353, 'bull_rsi_os': 25, 'bull_rsi_ob': 90, 'bull_adx_thresh': 28.28260426415242, 'bull_atr_min_pct': 0.003490741742159413, 'bull_atr_max_pct': 0.027507805368238304, 'bull_tp_mult': 1.9826896626655228, 'bull_tsl_mult': 0.0184628380214365, 'bull_time_stop': 198, 'bull_use_sma': True, 'bull_use_ema': False, 'bull_use_atr': False, 'bull_use_adx': True, 'bull_use_spike': True, 'bull_rsi_required': True, 'bear_strategy': 'breakout', 'bear_bb_std_mult': 0.8477514638508388, 'bear_rsi_os': 10, 'bear_rsi_ob': 90, 'bear_adx_thresh': 6.918306717164874, 'bear_atr_min_pct': 0.016180501004710798, 'bear_atr_max_pct': 0.04252354482722502, 'bear_tp_mult': 1.6090562944106956, 'bear_tsl_mult': 0.9848353227817122, 'bear_time_stop': 140, 'bear_use_sma': True, 'bear_use_ema': False, 'bear_use_atr': True, 'bear_use_adx': True, 'bear_use_spike': False, 'bear_rsi_required': False, 'sideways_strategy': 'breakout', 'sideways_bb_std_mult': 2.0613539510087246, 'sideways_rsi_os': 20, 'sideways_rsi_ob': 60, 'sideways_adx_thresh': 7.746352872500097, 'sideways_atr_min_pct': 0.022674538172519083, 'sideways_atr_max_pct': 0.11018515125167719, 'sideways_tp_mult': 1.0211119018974526, 'sideways_tsl_mult': 0.4169221551891156, 'sideways_time_stop': 181, 'sideways_use_sma': True, 'sideways_use_ema': False, 'sideways_use_atr': False, 'sideways_use_adx': False, 'sideways_use_spike': True, 'sideways_rsi_required': False}.
[I 2025-08-30 18:54:54,508] Trial 154 finished with values: [-1000000000.0, 1000000000.0] and parameters: {'p_sma': 39, 'p_std': 29, 'p_atr': 27, 'p_adx': 8, 'rsi_period': 50, 'ema1': 9, 'ema2': 50, 'slip_atr_k': 0.127467441365558, 'slip_spread_k': 0.37370780875207626, 'spread_hl_frac': 0.04766979677114595, 'bb_std_mult': 1.0862688994989633, 'rsi_os': 37, 'rsi_ob': 58, 'vol_spike': 0.04318390213495132, 'adx_thresh': 18.62402614246836, 'atr_min_pct': 0.02241657453642873, 'atr_max_pct': 0.062394443584336594, 'tp_mult': 2.617203468415871, 'tsl_mult': 0.8027848520400344, 'strategy': 'breakout', 'time_stop': 183, 'use_sma': False, 'use_atr': True, 'use_adx': True, 'use_ema': False, 'use_spike': True, 'rsi_required': True, 'edge_k': 1.049654551673067, 'edge_cap': 0.2698563110559119, 'bull_strategy': 'mean_reversion', 'bull_bb_std_mult': 1.9242563023224706, 'bull_rsi_os': 26, 'bull_rsi_ob': 90, 'bull_adx_thresh': 25.557678617467907, 'bull_atr_min_pct': 0.003588707964049523, 'bull_atr_max_pct': 0.026617168271046935, 'bull_tp_mult': 2.183216771801387, 'bull_tsl_mult': 0.2891026006262948, 'bull_time_stop': 32, 'bull_use_sma': True, 'bull_use_ema': False, 'bull_use_atr': True, 'bull_use_adx': False, 'bull_use_spike': True, 'bull_rsi_required': True, 'bear_strategy': 'mean_reversion', 'bear_bb_std_mult': 2.29120050740535, 'bear_rsi_os': 41, 'bear_rsi_ob': 81, 'bear_adx_thresh': 6.594128625338405, 'bear_atr_min_pct': 0.029940082927636676, 'bear_atr_max_pct': 0.08998804278399541, 'bear_tp_mult': 2.5410534426645635, 'bear_tsl_mult': 0.775487870455731, 'bear_time_stop': 135, 'bear_use_sma': False, 'bear_use_ema': False, 'bear_use_atr': False, 'bear_use_adx': False, 'bear_use_spike': False, 'bear_rsi_required': True, 'sideways_strategy': 'breakout', 'sideways_bb_std_mult': 2.071065967417981, 'sideways_rsi_os': 8, 'sideways_rsi_ob': 75, 'sideways_adx_thresh': 7.605628010941526, 'sideways_atr_min_pct': 0.020562423535319334, 'sideways_atr_max_pct': 0.10972318798779554, 'sideways_tp_mult': 1.9212283054750272, 'sideways_tsl_mult': 0.6571223171476128, 'sideways_time_stop': 182, 'sideways_use_sma': True, 'sideways_use_ema': False, 'sideways_use_atr': False, 'sideways_use_adx': False, 'sideways_use_spike': False, 'sideways_rsi_required': False}.
