[I 2025-08-30 19:39:46,171] Trial 486 finished with values: [-0.05896551522153659, 0.05889972846485295] and parameters: {'p_sma': 42, 'p_std': 14, 'p_atr': 9, 'p_adx': 9, 'rsi_period': 38, 'ema1': 24, 'ema2': 60, 'slip_atr_k': 0.01179159646843436, 'slip_spread_k': 0.6914600674458653, 'spread_hl_frac': 0.00371020626931961, 'bb_std_mult': 0.9264440820784002, 'rsi_os': 39, 'rsi_ob': 60, 'vol_spike': 0.05337881212083185, 'adx_thresh': 7.210876849050747, 'atr_min_pct': 0.022870026143088334, 'atr_max_pct': 0.1430211137855624, 'tp_mult': 1.5007511767093504, 'tsl_mult': 0.7299467043968044, 'strategy': 'breakout', 'time_stop': 209, 'use_sma': True, 'use_atr': True, 'use_adx': False, 'use_ema': False, 'use_spike': True, 'rsi_required': False, 'edge_k': 0.0626130417752037, 'edge_cap': 0.20259913576822278, 'bull_strategy': 'mean_reversion', 'bull_bb_std_mult': 1.856863753369978, 'bull_rsi_os': 10, 'bull_rsi_ob': 73, 'bull_adx_thresh': 14.088159975836742, 'bull_atr_min_pct': 0.0009517459371169131, 'bull_atr_max_pct': 0.02635565944090337, 'bull_tp_mult': 2.107117015362035, 'bull_tsl_mult': 0.32757838991998134, 'bull_time_stop': 142, 'bull_use_sma': True, 'bull_use_ema': False, 'bull_use_atr': False, 'bull_use_adx': True, 'bull_use_spike': False, 'bull_rsi_required': True, 'bear_strategy': 'breakout', 'bear_bb_std_mult': 3.355570614534238, 'bear_rsi_os': 45, 'bear_rsi_ob': 84, 'bear_adx_thresh': 22.614787311538908, 'bear_atr_min_pct': 0.0033644214854136947, 'bear_atr_max_pct': 0.14640198883299405, 'bear_tp_mult': 1.7603416982395892, 'bear_tsl_mult': 0.0008625825472092785, 'bear_time_stop': 46, 'bear_use_sma': True, 'bear_use_ema': True, 'bear_use_atr': False, 'bear_use_adx': False, 'bear_use_spike': False, 'bear_rsi_required': False, 'sideways_strategy': 'mean_reversion', 'sideways_bb_std_mult': 2.6858848766057286, 'sideways_rsi_os': 15, 'sideways_rsi_ob': 65, 'sideways_adx_thresh': 28.351819905929123, 'sideways_atr_min_pct': 0.01962279946233413, 'sideways_atr_max_pct': 0.10900367145167603, 'sideways_tp_mult': 2.3063612289751108, 'sideways_tsl_mult': 0.6798187821075128, 'sideways_time_stop': 300, 'sideways_use_sma': True, 'sideways_use_ema': True, 'sideways_use_atr': False, 'sideways_use_adx': False, 'sideways_use_spike': True, 'sideways_rsi_required': False}.
[I 2025-08-30 19:39:46,460] Trial 485 finished with values: [-1000000000.0, 1000000000.0] and parameters: {'p_sma': 5, 'p_std': 28, 'p_atr': 10, 'p_adx': 9, 'rsi_period': 9, 'ema1': 24, 'ema2': 47, 'slip_atr_k': 0.013751324892210107, 'slip_spread_k': 0.31401993307348286, 'spread_hl_frac': 0.012096482452311286, 'bb_std_mult': 1.0342316890866556, 'rsi_os': 37, 'rsi_ob': 57, 'vol_spike': 0.026917911478020307, 'adx_thresh': 19.14510733777708, 'atr_min_pct': 0.010071494350806943, 'atr_max_pct': 0.04683673147905869, 'tp_mult': 2.1448558231009813, 'tsl_mult': 0.7376713255736776, 'strategy': 'breakout', 'time_stop': 15, 'use_sma': True, 'use_atr': True, 'use_adx': False, 'use_ema': False, 'use_spike': True, 'rsi_required': False, 'edge_k': 0.06752504986895579, 'edge_cap': 0.06453972839222522, 'bull_strategy': 'mean_reversion', 'bull_bb_std_mult': 1.8623617575744706, 'bull_rsi_os': 50, 'bull_rsi_ob': 73, 'bull_adx_thresh': 24.481971501232266, 'bull_atr_min_pct': 0.0010102701001698015, 'bull_atr_max_pct': 0.04376908726743278, 'bull_tp_mult': 2.0969416559285747, 'bull_tsl_mult': 0.6370242638114143, 'bull_time_stop': 142, 'bull_use_sma': True, 'bull_use_ema': False, 'bull_use_atr': False, 'bull_use_adx': True, 'bull_use_spike': True, 'bull_rsi_required': True, 'bear_strategy': 'breakout', 'bear_bb_std_mult': 3.4797234607361442, 'bear_rsi_os': 46, 'bear_rsi_ob': 84, 'bear_adx_thresh': 9.610060828545643, 'bear_atr_min_pct': 0.015770201516852038, 'bear_atr_max_pct': 0.05622176909425646, 'bear_tp_mult': 1.2314914391052205, 'bear_tsl_mult': 0.16752264675136547, 'bear_time_stop': 218, 'bear_use_sma': True, 'bear_use_ema': True, 'bear_use_atr': False, 'bear_use_adx': False, 'bear_use_spike': False, 'bear_rsi_required': False, 'sideways_strategy': 'mean_reversion', 'sideways_bb_std_mult': 2.156856330244707, 'sideways_rsi_os': 49, 'sideways_rsi_ob': 59, 'sideways_adx_thresh': 28.245467249460372, 'sideways_atr_min_pct': 0.019695155985217778, 'sideways_atr_max_pct': 0.11010811822774318, 'sideways_tp_mult': 1.885447471466365, 'sideways_tsl_mult': 0.6751348174066296, 'sideways_time_stop': 281, 'sideways_use_sma': True, 'sideways_use_ema': True, 'sideways_use_atr': False, 'sideways_use_adx': False, 'sideways_use_spike': True, 'sideways_rsi_required': False}.
[I 2025-08-30 19:40:21,757] Trial 490 finished with values: [-1000000000.0, 1000000000.0] and parameters: {'p_sma': 40, 'p_std': 50, 'p_atr': 23, 'p_adx': 26, 'rsi_period': 52, 'ema1': 10, 'ema2': 11, 'slip_atr_k': 0.03544855228903204, 'slip_spread_k': 0.17678946463497786, 'spread_hl_frac': 0.005405416152434506, 'bb_std_mult': 1.6460354567101843, 'rsi_os': 44, 'rsi_ob': 57, 'vol_spike': 0.000192984721687689, 'adx_thresh': 34.03810884114628, 'atr_min_pct': 0.009720377462054747, 'atr_max_pct': 0.04708961143515502, 'tp_mult': 2.2023870685462215, 'tsl_mult': 0.44027711430292044, 'strategy': 'mean_reversion', 'time_stop': 24, 'use_sma': False, 'use_atr': False, 'use_adx': False, 'use_ema': True, 'use_spike': False, 'rsi_required': True, 'edge_k': 0.12122738753493906, 'edge_cap': 0.23328379538022942, 'bull_strategy': 'mean_reversion', 'bull_bb_std_mult': 1.7276026090025245, 'bull_rsi_os': 47, 'bull_rsi_ob': 71, 'bull_adx_thresh': 24.552291544776313, 'bull_atr_min_pct': 0.00629743059613363, 'bull_atr_max_pct': 0.04398460389289256, 'bull_tp_mult': 1.2975191809909608, 'bull_tsl_mult': 0.513610135159586, 'bull_time_stop': 155, 'bull_use_sma': False, 'bull_use_ema': True, 'bull_use_atr': False, 'bull_use_adx': False, 'bull_use_spike': True, 'bull_rsi_required': False, 'bear_strategy': 'breakout', 'bear_bb_std_mult': 3.4744549472060533, 'bear_rsi_os': 44, 'bear_rsi_ob': 81, 'bear_adx_thresh': 6.1600429155194965, 'bear_atr_min_pct': 0.01458537154981171, 'bear_atr_max_pct': 0.0703133816716785, 'bear_tp_mult': 1.6922231711546036, 'bear_tsl_mult': 0.10034828303174552, 'bear_time_stop': 36, 'bear_use_sma': False, 'bear_use_ema': False, 'bear_use_atr': True, 'bear_use_adx': True, 'bear_use_spike': False, 'bear_rsi_required': True, 'sideways_strategy': 'breakout', 'sideways_bb_std_mult': 2.292870350162241, 'sideways_rsi_os': 9, 'sideways_rsi_ob': 56, 'sideways_adx_thresh': 27.19877787934153, 'sideways_atr_min_pct': 0.017760182970299562, 'sideways_atr_max_pct': 0.12145971974696199, 'sideways_tp_mult': 2.1707118743297364, 'sideways_tsl_mult': 0.7264112777584066, 'sideways_time_stop': 271, 'sideways_use_sma': False, 'sideways_use_ema': False, 'sideways_use_atr': False, 'sideways_use_adx': True, 'sideways_use_spike': False, 'sideways_rsi_required': True}.
[I 2025-08-30 19:40:22,325] Trial 491 finished with values: [-1000000000.0, 1000000000.0] and parameters: {'p_sma': 44, 'p_std': 27, 'p_atr': 30, 'p_adx': 7, 'rsi_period': 52, 'ema1': 19, 'ema2': 20, 'slip_atr_k': 0.04072412251723247, 'slip_spread_k': 0.6476151396205094, 'spread_hl_frac': 0.005056141759806907, 'bb_std_mult': 1.5921097130501085, 'rsi_os': 49, 'rsi_ob': 77, 'vol_spike': 0.033436318815123316, 'adx_thresh': 34.06186002977313, 'atr_min_pct': 0.01772797418786133, 'atr_max_pct': 0.11869814354004529, 'tp_mult': 1.2214436575430327, 'tsl_mult': 0.4339808727762564, 'strategy': 'mean_reversion', 'time_stop': 24, 'use_sma': False, 'use_atr': False, 'use_adx': False, 'use_ema': True, 'use_spike': False, 'rsi_required': True, 'edge_k': 0.15529453282285763, 'edge_cap': 0.23665209685892272, 'bull_strategy': 'breakout', 'bull_bb_std_mult': 0.6094105039327038, 'bull_rsi_os': 41, 'bull_rsi_ob': 70, 'bull_adx_thresh': 26.914751243892514, 'bull_atr_min_pct': 0.010327973356425341, 'bull_atr_max_pct': 0.0292738616907782, 'bull_tp_mult': 2.2267933125450146, 'bull_tsl_mult': 0.9999221045366274, 'bull_time_stop': 52, 'bull_use_sma': False, 'bull_use_ema': True, 'bull_use_atr': True, 'bull_use_adx': False, 'bull_use_spike': True, 'bull_rsi_required': False, 'bear_strategy': 'breakout', 'bear_bb_std_mult': 1.5801183127241283, 'bear_rsi_os': 49, 'bear_rsi_ob': 69, 'bear_adx_thresh': 6.114449973920481, 'bear_atr_min_pct': 0.014650027119133484, 'bear_atr_max_pct': 0.050578504225924394, 'bear_tp_mult': 1.708828173573767, 'bear_tsl_mult': 0.10348715802430564, 'bear_time_stop': 192, 'bear_use_sma': False, 'bear_use_ema': False, 'bear_use_atr': True, 'bear_use_adx': True, 'bear_use_spike': True, 'bear_rsi_required': True, 'sideways_strategy': 'breakout', 'sideways_bb_std_mult': 1.2248853763674332, 'sideways_rsi_os': 18, 'sideways_rsi_ob': 82, 'sideways_adx_thresh': 26.287973528716137, 'sideways_atr_min_pct': 0.01793720639796279, 'sideways_atr_max_pct': 0.12055062288126814, 'sideways_tp_mult': 1.8606489609071972, 'sideways_tsl_mult': 0.72058499371826, 'sideways_time_stop': 75, 'sideways_use_sma': False, 'sideways_use_ema': False, 'sideways_use_atr': False, 'sideways_use_adx': True, 'sideways_use_spike': False, 'sideways_rsi_required': True}.
[I 2025-08-30 19:40:22,813] Trial 489 finished with values: [-1000000000.0, 1000000000.0] and parameters: {'p_sma': 5, 'p_std': 22, 'p_atr': 18, 'p_adx': 8, 'rsi_period': 52, 'ema1': 22, 'ema2': 11, 'slip_atr_k': 0.03898883922465136, 'slip_spread_k': 0.38676942354015054, 'spread_hl_frac': 0.003936061748756685, 'bb_std_mult': 1.6051384237185735, 'rsi_os': 49, 'rsi_ob': 57, 'vol_spike': 0.028528843443174554, 'adx_thresh': 30.28381343038437, 'atr_min_pct': 0.009785390377236098, 'atr_max_pct': 0.05088893535775961, 'tp_mult': 1.1691743574506068, 'tsl_mult': 0.6989143751333526, 'strategy': 'mean_reversion', 'time_stop': 23, 'use_sma': False, 'use_atr': False, 'use_adx': False, 'use_ema': True, 'use_spike': False, 'rsi_required': False, 'edge_k': 1.7618508049331232, 'edge_cap': 0.23494515770467167, 'bull_strategy': 'mean_reversion', 'bull_bb_std_mult': 1.7229759691352982, 'bull_rsi_os': 16, 'bull_rsi_ob': 70, 'bull_adx_thresh': 24.531083589470423, 'bull_atr_min_pct': 0.005738243483334734, 'bull_atr_max_pct': 0.031161970521610936, 'bull_tp_mult': 1.079734331484557, 'bull_tsl_mult': 0.33343826647903, 'bull_time_stop': 179, 'bull_use_sma': False, 'bull_use_ema': True, 'bull_use_atr': False, 'bull_use_adx': False, 'bull_use_spike': True, 'bull_rsi_required': True, 'bear_strategy': 'breakout', 'bear_bb_std_mult': 3.0623407735673194, 'bear_rsi_os': 45, 'bear_rsi_ob': 81, 'bear_adx_thresh': 12.084765690199635, 'bear_atr_min_pct': 0.014414609449799746, 'bear_atr_max_pct': 0.06408686490806653, 'bear_tp_mult': 1.757602519499404, 'bear_tsl_mult': 0.1728982574524699, 'bear_time_stop': 46, 'bear_use_sma': True, 'bear_use_ema': False, 'bear_use_atr': True, 'bear_use_adx': True, 'bear_use_spike': False, 'bear_rsi_required': True, 'sideways_strategy': 'breakout', 'sideways_bb_std_mult': 2.495625258021674, 'sideways_rsi_os': 15, 'sideways_rsi_ob': 57, 'sideways_adx_thresh': 10.992217174103171, 'sideways_atr_min_pct': 0.017841221503675425, 'sideways_atr_max_pct': 0.01022549786116457, 'sideways_tp_mult': 1.904523617745785, 'sideways_tsl_mult': 0.7695026558337827, 'sideways_time_stop': 259, 'sideways_use_sma': False, 'sideways_use_ema': True, 'sideways_use_atr': False, 'sideways_use_adx': True, 'sideways_use_spike': True, 'sideways_rsi_required': True}.
[I 2025-08-30 19:40:22,905] Trial 488 finished with values: [-1000000000.0, 1000000000.0] and parameters: {'p_sma': 40, 'p_std': 22, 'p_atr': 10, 'p_adx': 8, 'rsi_period': 53, 'ema1': 22, 'ema2': 20, 'slip_atr_k': 0.11087858653613947, 'slip_spread_k': 0.05939639234873423, 'spread_hl_frac': 0.005379155591566976, 'bb_std_mult': 0.9324524982483088, 'rsi_os': 15, 'rsi_ob': 57, 'vol_spike': 0.2853273486079577, 'adx_thresh': 18.321935782510064, 'atr_min_pct': 0.002354683860601829, 'atr_max_pct': 0.13798334646161384, 'tp_mult': 1.2235181337385157, 'tsl_mult': 0.6994132767122203, 'strategy': 'mean_reversion', 'time_stop': 23, 'use_sma': False, 'use_atr': False, 'use_adx': False, 'use_ema': True, 'use_spike': False, 'rsi_required': False, 'edge_k': 0.15878893344952807, 'edge_cap': 0.4093758168036488, 'bull_strategy': 'mean_reversion', 'bull_bb_std_mult': 0.6269424513763706, 'bull_rsi_os': 16, 'bull_rsi_ob': 70, 'bull_adx_thresh': 27.210866284810947, 'bull_atr_min_pct': 0.02937484886935355, 'bull_atr_max_pct': 0.030378677959976078, 'bull_tp_mult': 2.223011330452879, 'bull_tsl_mult': 0.5410533067006792, 'bull_time_stop': 74, 'bull_use_sma': False, 'bull_use_ema': True, 'bull_use_atr': False, 'bull_use_adx': False, 'bull_use_spike': True, 'bull_rsi_required': True, 'bear_strategy': 'breakout', 'bear_bb_std_mult': 2.8078931592896104, 'bear_rsi_os': 45, 'bear_rsi_ob': 69, 'bear_adx_thresh': 6.218262089597445, 'bear_atr_min_pct': 0.0145947778945602, 'bear_atr_max_pct': 0.06416926022349295, 'bear_tp_mult': 1.7474958075159028, 'bear_tsl_mult': 0.16213555610742525, 'bear_time_stop': 46, 'bear_use_sma': True, 'bear_use_ema': False, 'bear_use_atr': True, 'bear_use_adx': True, 'bear_use_spike': False, 'bear_rsi_required': True, 'sideways_strategy': 'breakout', 'sideways_bb_std_mult': 1.6031500526742644, 'sideways_rsi_os': 15, 'sideways_rsi_ob': 57, 'sideways_adx_thresh': 10.885584209806101, 'sideways_atr_min_pct': 0.017891983182374806, 'sideways_atr_max_pct': 0.1206187453633591, 'sideways_tp_mult': 1.8980900963023213, 'sideways_tsl_mult': 0.7189106380604448, 'sideways_time_stop': 196, 'sideways_use_sma': False, 'sideways_use_ema': True, 'sideways_use_atr': False, 'sideways_use_adx': True, 'sideways_use_spike': True, 'sideways_rsi_required': True}.
[I 2025-08-30 19:40:57,355] Trial 493 finished with values: [-1000000000.0, 1000000000.0] and parameters: {'p_sma': 30, 'p_std': 26, 'p_atr': 13, 'p_adx': 8, 'rsi_period': 61, 'ema1': 11, 'ema2': 16, 'slip_atr_k': 0.053543980764081955, 'slip_spread_k': 0.056876680726964945, 'spread_hl_frac': 0.0021750994784052514, 'bb_std_mult': 0.9370278682911347, 'rsi_os': 50, 'rsi_ob': 55, 'vol_spike': 0.04080813512297069, 'adx_thresh': 10.417833984592937, 'atr_min_pct': 0.020218518178852438, 'atr_max_pct': 0.09777318525283221, 'tp_mult': 2.0756810138959163, 'tsl_mult': 0.6986690823893723, 'strategy': 'breakout', 'time_stop': 31, 'use_sma': False, 'use_atr': True, 'use_adx': False, 'use_ema': False, 'use_spike': True, 'rsi_required': True, 'edge_k': 0.16197912722951668, 'edge_cap': 0.262355251518074, 'bull_strategy': 'mean_reversion', 'bull_bb_std_mult': 2.0207858779336703, 'bull_rsi_os': 49, 'bull_rsi_ob': 80, 'bull_adx_thresh': 12.89977810241367, 'bull_atr_min_pct': 0.01890174161816372, 'bull_atr_max_pct': 0.03091160453689338, 'bull_tp_mult': 2.7112493143567638, 'bull_tsl_mult': 0.6869480709926808, 'bull_time_stop': 193, 'bull_use_sma': True, 'bull_use_ema': False, 'bull_use_atr': False, 'bull_use_adx': True, 'bull_use_spike': True, 'bull_rsi_required': True, 'bear_strategy': 'mean_reversion', 'bear_bb_std_mult': 2.7650376711297833, 'bear_rsi_os': 42, 'bear_rsi_ob': 90, 'bear_adx_thresh': 5.567756182221354, 'bear_atr_min_pct': 0.004867067211345185, 'bear_atr_max_pct': 0.06379526381302125, 'bear_tp_mult': 1.7457816103588044, 'bear_tsl_mult': 0.14713464556843175, 'bear_time_stop': 84, 'bear_use_sma': True, 'bear_use_ema': False, 'bear_use_atr': True, 'bear_use_adx': True, 'bear_use_spike': False, 'bear_rsi_required': False, 'sideways_strategy': 'breakout', 'sideways_bb_std_mult': 2.090490364787518, 'sideways_rsi_os': 22, 'sideways_rsi_ob': 50, 'sideways_adx_thresh': 10.977258230542525, 'sideways_atr_min_pct': 0.02083515889416479, 'sideways_atr_max_pct': 0.12464939429226121, 'sideways_tp_mult': 2.6831025493939618, 'sideways_tsl_mult': 0.630613135811014, 'sideways_time_stop': 262, 'sideways_use_sma': True, 'sideways_use_ema': True, 'sideways_use_atr': False, 'sideways_use_adx': False, 'sideways_use_spike': False, 'sideways_rsi_required': False}.
[I 2025-08-30 19:40:57,356] Trial 492 finished with values: [-1000000000.0, 1000000000.0] and parameters: {'p_sma': 10, 'p_std': 22, 'p_atr': 30, 'p_adx': 7, 'rsi_period': 53, 'ema1': 22, 'ema2': 32, 'slip_atr_k': 0.22836624983700143, 'slip_spread_k': 0.3981316020090374, 'spread_hl_frac': 0.004358622361332155, 'bb_std_mult': 0.8922294148809193, 'rsi_os': 35, 'rsi_ob': 52, 'vol_spike': 0.28675570203020984, 'adx_thresh': 8.097376121119, 'atr_min_pct': 0.025538015663405973, 'atr_max_pct': 0.13124289433722944, 'tp_mult': 2.0799818040895612, 'tsl_mult': 0.6982171530027265, 'strategy': 'breakout', 'time_stop': 277, 'use_sma': False, 'use_atr': True, 'use_adx': False, 'use_ema': True, 'use_spike': False, 'rsi_required': True, 'edge_k': 0.3856018071743137, 'edge_cap': 0.648402949960521, 'bull_strategy': 'breakout', 'bull_bb_std_mult': 2.005354857116159, 'bull_rsi_os': 15, 'bull_rsi_ob': 69, 'bull_adx_thresh': 27.015343114739082, 'bull_atr_min_pct': 0.02937859897364123, 'bull_atr_max_pct': 0.028730603014298986, 'bull_tp_mult': 2.2242948356963366, 'bull_tsl_mult': 0.999697263571653, 'bull_time_stop': 38, 'bull_use_sma': False, 'bull_use_ema': True, 'bull_use_atr': True, 'bull_use_adx': False, 'bull_use_spike': True, 'bull_rsi_required': True, 'bear_strategy': 'mean_reversion', 'bear_bb_std_mult': 2.741917597764119, 'bear_rsi_os': 42, 'bear_rsi_ob': 69, 'bear_adx_thresh': 5.648867323548785, 'bear_atr_min_pct': 0.008841306764518261, 'bear_atr_max_pct': 0.06466230426895692, 'bear_tp_mult': 2.2783325782466117, 'bear_tsl_mult': 0.14434809120776557, 'bear_time_stop': 24, 'bear_use_sma': True, 'bear_use_ema': False, 'bear_use_atr': True, 'bear_use_adx': True, 'bear_use_spike': True, 'bear_rsi_required': False, 'sideways_strategy': 'breakout', 'sideways_bb_std_mult': 1.1205531965655822, 'sideways_rsi_os': 5, 'sideways_rsi_ob': 85, 'sideways_adx_thresh': 24.77273545738691, 'sideways_atr_min_pct': 0.01111698283253059, 'sideways_atr_max_pct': 0.11943078303682375, 'sideways_tp_mult': 2.6709565463397382, 'sideways_tsl_mult': 0.7132617612604495, 'sideways_time_stop': 258, 'sideways_use_sma': True, 'sideways_use_ema': True, 'sideways_use_atr': False, 'sideways_use_adx': True, 'sideways_use_spike': False, 'sideways_rsi_required': False}.
[I 2025-08-30 19:40:57,477] Trial 495 finished with values: [-1000000000.0, 1000000000.0] and parameters: {'p_sma': 10, 'p_std': 26, 'p_atr': 11, 'p_adx': 8, 'rsi_period': 56, 'ema1': 24, 'ema2': 57, 'slip_atr_k': 0.12709077694274223, 'slip_spread_k': 0.4556291180422764, 'spread_hl_frac': 0.007447281393994594, 'bb_std_mult': 1.1733473621234958, 'rsi_os': 35, 'rsi_ob': 55, 'vol_spike': 0.0826504409919262, 'adx_thresh': 8.406243214834808, 'atr_min_pct': 0.007524153746000347, 'atr_max_pct': 0.10260681192907553, 'tp_mult': 2.0694790393311036, 'tsl_mult': 0.3124554403737378, 'strategy': 'breakout', 'time_stop': 32, 'use_sma': False, 'use_atr': True, 'use_adx': True, 'use_ema': False, 'use_spike': True, 'rsi_required': True, 'edge_k': 0.6040028251748355, 'edge_cap': 0.2588206012908385, 'bull_strategy': 'breakout', 'bull_bb_std_mult': 1.7703812799734007, 'bull_rsi_os': 49, 'bull_rsi_ob': 72, 'bull_adx_thresh': 12.563673643428022, 'bull_atr_min_pct': 0.015504345833365398, 'bull_atr_max_pct': 0.0236431785682978, 'bull_tp_mult': 2.0541137253150272, 'bull_tsl_mult': 0.76720851602879, 'bull_time_stop': 5, 'bull_use_sma': True, 'bull_use_ema': False, 'bull_use_atr': True, 'bull_use_adx': True, 'bull_use_spike': False, 'bull_rsi_required': True, 'bear_strategy': 'mean_reversion', 'bear_bb_std_mult': 2.7114097441222853, 'bear_rsi_os': 43, 'bear_rsi_ob': 86, 'bear_adx_thresh': 6.712260358654527, 'bear_atr_min_pct': 0.016350869521581414, 'bear_atr_max_pct': 0.041378117449037695, 'bear_tp_mult': 1.037340873319684, 'bear_tsl_mult': 0.39423045049195415, 'bear_time_stop': 151, 'bear_use_sma': True, 'bear_use_ema': False, 'bear_use_atr': True, 'bear_use_adx': True, 'bear_use_spike': True, 'bear_rsi_required': False, 'sideways_strategy': 'breakout', 'sideways_bb_std_mult': 1.9902488564397043, 'sideways_rsi_os': 18, 'sideways_rsi_ob': 71, 'sideways_adx_thresh': 17.71271245574065, 'sideways_atr_min_pct': 0.014435570702199313, 'sideways_atr_max_pct': 0.058716097281897625, 'sideways_tp_mult': 2.4191786941770452, 'sideways_tsl_mult': 0.8574969325015818, 'sideways_time_stop': 269, 'sideways_use_sma': True, 'sideways_use_ema': True, 'sideways_use_atr': False, 'sideways_use_adx': False, 'sideways_use_spike': False, 'sideways_rsi_required': False}.
