[I 2025-08-30 19:12:51,817] Trial 285 finished with values: [-1000000000.0, 1000000000.0] and parameters: {'p_sma': 14, 'p_std': 25, 'p_atr': 11, 'p_adx': 16, 'rsi_period': 7, 'ema1': 20, 'ema2': 16, 'slip_atr_k': 0.031449902059868355, 'slip_spread_k': 0.08066942256889165, 'spread_hl_frac': 0.04327549597762294, 'bb_std_mult': 0.8050181260248834, 'rsi_os': 32, 'rsi_ob': 58, 'vol_spike': 0.12288463363069345, 'adx_thresh': 32.304130026195025, 'atr_min_pct': 0.0230153871454463, 'atr_max_pct': 0.1399604415639616, 'tp_mult': 2.173044918854892, 'tsl_mult': 0.7136353403157749, 'strategy': 'breakout', 'time_stop': 36, 'use_sma': False, 'use_atr': True, 'use_adx': False, 'use_ema': False, 'use_spike': True, 'rsi_required': False, 'edge_k': 0.19827803438462044, 'edge_cap': 0.9705564156489348, 'bull_strategy': 'mean_reversion', 'bull_bb_std_mult': 1.8176075331981563, 'bull_rsi_os': 50, 'bull_rsi_ob': 74, 'bull_adx_thresh': 25.916695779304217, 'bull_atr_min_pct': 0.0027943209492700817, 'bull_atr_max_pct': 0.02147755660355878, 'bull_tp_mult': 1.5531713194018468, 'bull_tsl_mult': 0.9076582029023701, 'bull_time_stop': 155, 'bull_use_sma': True, 'bull_use_ema': False, 'bull_use_atr': False, 'bull_use_adx': True, 'bull_use_spike': True, 'bull_rsi_required': True, 'bear_strategy': 'breakout', 'bear_bb_std_mult': 3.400374926032908, 'bear_rsi_os': 5, 'bear_rsi_ob': 83, 'bear_adx_thresh': 8.323748710745857, 'bear_atr_min_pct': 0.015341269615756308, 'bear_atr_max_pct': 0.07247523639207878, 'bear_tp_mult': 2.731194563619325, 'bear_tsl_mult': 0.12658826633792225, 'bear_time_stop': 49, 'bear_use_sma': True, 'bear_use_ema': False, 'bear_use_atr': True, 'bear_use_adx': True, 'bear_use_spike': False, 'bear_rsi_required': False, 'sideways_strategy': 'breakout', 'sideways_bb_std_mult': 0.6853954407431913, 'sideways_rsi_os': 14, 'sideways_rsi_ob': 48, 'sideways_adx_thresh': 8.028556141001445, 'sideways_atr_min_pct': 0.019361049797818948, 'sideways_atr_max_pct': 0.13891356720470646, 'sideways_tp_mult': 2.386170799764976, 'sideways_tsl_mult': 0.5636733129589017, 'sideways_time_stop': 193, 'sideways_use_sma': True, 'sideways_use_ema': True, 'sideways_use_atr': False, 'sideways_use_adx': False, 'sideways_use_spike': False, 'sideways_rsi_required': False}.
[I 2025-08-30 19:13:24,115] Trial 291 finished with values: [-1000000000.0, 1000000000.0] and parameters: {'p_sma': 41, 'p_std': 13, 'p_atr': 27, 'p_adx': 24, 'rsi_period': 37, 'ema1': 25, 'ema2': 28, 'slip_atr_k': 0.1965676763177612, 'slip_spread_k': 0.3993997889519137, 'spread_hl_frac': 0.023320525569619555, 'bb_std_mult': 1.1557838601773338, 'rsi_os': 36, 'rsi_ob': 55, 'vol_spike': 0.0321358541908884, 'adx_thresh': 18.456577112289516, 'atr_min_pct': 0.006849235129988493, 'atr_max_pct': 0.14092098904126732, 'tp_mult': 2.402560944675743, 'tsl_mult': 0.21622885307917655, 'strategy': 'breakout', 'time_stop': 25, 'use_sma': False, 'use_atr': True, 'use_adx': False, 'use_ema': True, 'use_spike': True, 'rsi_required': True, 'edge_k': 1.732931949637514, 'edge_cap': 0.18892995630123355, 'bull_strategy': 'mean_reversion', 'bull_bb_std_mult': 1.7100583434353072, 'bull_rsi_os': 49, 'bull_rsi_ob': 72, 'bull_adx_thresh': 24.798452439145837, 'bull_atr_min_pct': 0.026998275129573625, 'bull_atr_max_pct': 0.1360352403236989, 'bull_tp_mult': 2.0635132880611424, 'bull_tsl_mult': 0.7961964014285989, 'bull_time_stop': 173, 'bull_use_sma': False, 'bull_use_ema': True, 'bull_use_atr': True, 'bull_use_adx': False, 'bull_use_spike': False, 'bull_rsi_required': False, 'bear_strategy': 'breakout', 'bear_bb_std_mult': 2.137188135109206, 'bear_rsi_os': 27, 'bear_rsi_ob': 55, 'bear_adx_thresh': 27.356598526822104, 'bear_atr_min_pct': 0.015750797672763737, 'bear_atr_max_pct': 0.056512437556820345, 'bear_tp_mult': 1.6964768522415308, 'bear_tsl_mult': 0.5880810748560471, 'bear_time_stop': 41, 'bear_use_sma': True, 'bear_use_ema': False, 'bear_use_atr': True, 'bear_use_adx': True, 'bear_use_spike': True, 'bear_rsi_required': True, 'sideways_strategy': 'breakout', 'sideways_bb_std_mult': 2.131956479413831, 'sideways_rsi_os': 21, 'sideways_rsi_ob': 81, 'sideways_adx_thresh': 9.263445791506374, 'sideways_atr_min_pct': 0.018438414657994524, 'sideways_atr_max_pct': 0.1158979062689871, 'sideways_tp_mult': 2.6844377480110375, 'sideways_tsl_mult': 0.7073575781271589, 'sideways_time_stop': 50, 'sideways_use_sma': True, 'sideways_use_ema': False, 'sideways_use_atr': False, 'sideways_use_adx': True, 'sideways_use_spike': False, 'sideways_rsi_required': True}.
[I 2025-08-30 19:13:25,067] Trial 289 finished with values: [-1000000000.0, 1000000000.0] and parameters: {'p_sma': 42, 'p_std': 35, 'p_atr': 11, 'p_adx': 7, 'rsi_period': 29, 'ema1': 25, 'ema2': 60, 'slip_atr_k': 0.02677273086910159, 'slip_spread_k': 0.4621334503438556, 'spread_hl_frac': 0.04130444355547447, 'bb_std_mult': 0.9702982258733208, 'rsi_os': 43, 'rsi_ob': 57, 'vol_spike': 0.07276657875114569, 'adx_thresh': 18.531726901169716, 'atr_min_pct': 0.022938341568876527, 'atr_max_pct': 0.06883807422852507, 'tp_mult': 1.1345348365762757, 'tsl_mult': 0.6616983583421472, 'strategy': 'breakout', 'time_stop': 177, 'use_sma': False, 'use_atr': True, 'use_adx': False, 'use_ema': False, 'use_spike': True, 'rsi_required': False, 'edge_k': 0.11381523489633308, 'edge_cap': 0.25221138385089564, 'bull_strategy': 'mean_reversion', 'bull_bb_std_mult': 1.7253512058846305, 'bull_rsi_os': 6, 'bull_rsi_ob': 85, 'bull_adx_thresh': 32.07229911643011, 'bull_atr_min_pct': 0.003533568426196982, 'bull_atr_max_pct': 0.02573132902215808, 'bull_tp_mult': 2.1898531920986226, 'bull_tsl_mult': 0.9527271782502422, 'bull_time_stop': 174, 'bull_use_sma': True, 'bull_use_ema': True, 'bull_use_atr': False, 'bull_use_adx': True, 'bull_use_spike': False, 'bull_rsi_required': True, 'bear_strategy': 'breakout', 'bear_bb_std_mult': 2.7297248692270233, 'bear_rsi_os': 12, 'bear_rsi_ob': 81, 'bear_adx_thresh': 8.34264666561647, 'bear_atr_min_pct': 0.020250980865928386, 'bear_atr_max_pct': 0.06562948447748064, 'bear_tp_mult': 1.194350417997076, 'bear_tsl_mult': 0.14754910003245694, 'bear_time_stop': 31, 'bear_use_sma': True, 'bear_use_ema': True, 'bear_use_atr': True, 'bear_use_adx': True, 'bear_use_spike': False, 'bear_rsi_required': True, 'sideways_strategy': 'breakout', 'sideways_bb_std_mult': 1.0527288036855564, 'sideways_rsi_os': 45, 'sideways_rsi_ob': 60, 'sideways_adx_thresh': 30.643734260469063, 'sideways_atr_min_pct': 0.018515365518273836, 'sideways_atr_max_pct': 0.11160151381484748, 'sideways_tp_mult': 1.9033111467847441, 'sideways_tsl_mult': 0.9181695828272921, 'sideways_time_stop': 283, 'sideways_use_sma': False, 'sideways_use_ema': True, 'sideways_use_atr': False, 'sideways_use_adx': False, 'sideways_use_spike': False, 'sideways_rsi_required': True}.
[I 2025-08-30 19:13:25,461] Trial 290 finished with values: [-1000000000.0, 1000000000.0] and parameters: {'p_sma': 26, 'p_std': 44, 'p_atr': 11, 'p_adx': 7, 'rsi_period': 16, 'ema1': 25, 'ema2': 28, 'slip_atr_k': 0.013860057950742615, 'slip_spread_k': 0.5436757920137187, 'spread_hl_frac': 0.0322244626605552, 'bb_std_mult': 1.1525774167258631, 'rsi_os': 36, 'rsi_ob': 56, 'vol_spike': 0.11762322510635043, 'adx_thresh': 18.440401706653027, 'atr_min_pct': 0.006845458912077438, 'atr_max_pct': 0.14020583470672643, 'tp_mult': 1.6058187541137614, 'tsl_mult': 0.6816452309524996, 'strategy': 'breakout', 'time_stop': 177, 'use_sma': False, 'use_atr': True, 'use_adx': False, 'use_ema': False, 'use_spike': True, 'rsi_required': True, 'edge_k': 1.9446697896120133, 'edge_cap': 0.33052678536626356, 'bull_strategy': 'mean_reversion', 'bull_bb_std_mult': 1.88213202064528, 'bull_rsi_os': 50, 'bull_rsi_ob': 72, 'bull_adx_thresh': 31.847935495812614, 'bull_atr_min_pct': 0.0037103551588404896, 'bull_atr_max_pct': 0.018891136590214637, 'bull_tp_mult': 1.5481613308468243, 'bull_tsl_mult': 0.00374026169385433, 'bull_time_stop': 95, 'bull_use_sma': False, 'bull_use_ema': True, 'bull_use_atr': False, 'bull_use_adx': True, 'bull_use_spike': False, 'bull_rsi_required': True, 'bear_strategy': 'breakout', 'bear_bb_std_mult': 2.729492223955252, 'bear_rsi_os': 13, 'bear_rsi_ob': 81, 'bear_adx_thresh': 8.44090060234216, 'bear_atr_min_pct': 0.008978475129531394, 'bear_atr_max_pct': 0.0979251786156192, 'bear_tp_mult': 1.189582290560625, 'bear_tsl_mult': 0.09957120641746728, 'bear_time_stop': 273, 'bear_use_sma': False, 'bear_use_ema': True, 'bear_use_atr': True, 'bear_use_adx': True, 'bear_use_spike': True, 'bear_rsi_required': True, 'sideways_strategy': 'breakout', 'sideways_bb_std_mult': 2.1559218819421555, 'sideways_rsi_os': 45, 'sideways_rsi_ob': 80, 'sideways_adx_thresh': 19.884943840792328, 'sideways_atr_min_pct': 0.018197426088851734, 'sideways_atr_max_pct': 0.12293756706780648, 'sideways_tp_mult': 1.2122948478495914, 'sideways_tsl_mult': 0.4012901170681359, 'sideways_time_stop': 282, 'sideways_use_sma': False, 'sideways_use_ema': True, 'sideways_use_atr': False, 'sideways_use_adx': True, 'sideways_use_spike': False, 'sideways_rsi_required': True}.
[I 2025-08-30 19:13:25,628] Trial 292 finished with values: [-0.02511374272802691, 0.025009090069322625] and parameters: {'p_sma': 42, 'p_std': 40, 'p_atr': 9, 'p_adx': 8, 'rsi_period': 51, 'ema1': 25, 'ema2': 41, 'slip_atr_k': 0.05580951254089496, 'slip_spread_k': 0.1918226947626927, 'spread_hl_frac': 0.034976572993511396, 'bb_std_mult': 1.1438504616282958, 'rsi_os': 36, 'rsi_ob': 55, 'vol_spike': 0.028405015032880752, 'adx_thresh': 18.72641494004287, 'atr_min_pct': 0.007091155972989819, 'atr_max_pct': 0.039198758627474614, 'tp_mult': 2.3681122305242672, 'tsl_mult': 0.22356302086196383, 'strategy': 'breakout', 'time_stop': 26, 'use_sma': False, 'use_atr': True, 'use_adx': False, 'use_ema': True, 'use_spike': True, 'rsi_required': True, 'edge_k': 0.11334912321223559, 'edge_cap': 0.3319415656241961, 'bull_strategy': 'mean_reversion', 'bull_bb_std_mult': 1.7073467583567818, 'bull_rsi_os': 46, 'bull_rsi_ob': 71, 'bull_adx_thresh': 16.70806867021231, 'bull_atr_min_pct': 0.003747197216944018, 'bull_atr_max_pct': 0.0261319796437019, 'bull_tp_mult': 2.1942911025094447, 'bull_tsl_mult': 0.48692661685236055, 'bull_time_stop': 177, 'bull_use_sma': False, 'bull_use_ema': True, 'bull_use_atr': True, 'bull_use_adx': False, 'bull_use_spike': False, 'bull_rsi_required': False, 'bear_strategy': 'breakout', 'bear_bb_std_mult': 1.8453834328212069, 'bear_rsi_os': 45, 'bear_rsi_ob': 71, 'bear_adx_thresh': 5.473812319866897, 'bear_atr_min_pct': 0.015761123441692164, 'bear_atr_max_pct': 0.054757770435857195, 'bear_tp_mult': 1.6869745366506959, 'bear_tsl_mult': 0.10364002407732956, 'bear_time_stop': 201, 'bear_use_sma': True, 'bear_use_ema': True, 'bear_use_atr': False, 'bear_use_adx': False, 'bear_use_spike': True, 'bear_rsi_required': True, 'sideways_strategy': 'breakout', 'sideways_bb_std_mult': 2.1308857238950516, 'sideways_rsi_os': 47, 'sideways_rsi_ob': 89, 'sideways_adx_thresh': 9.420198492209847, 'sideways_atr_min_pct': 0.0025493119829134627, 'sideways_atr_max_pct': 0.129590323647115, 'sideways_tp_mult': 2.667802097528301, 'sideways_tsl_mult': 0.7102026452134096, 'sideways_time_stop': 204, 'sideways_use_sma': False, 'sideways_use_ema': False, 'sideways_use_atr': False, 'sideways_use_adx': True, 'sideways_use_spike': True, 'sideways_rsi_required': True}.
[I 2025-08-30 19:13:26,129] Trial 293 finished with values: [-1000000000.0, 1000000000.0] and parameters: {'p_sma': 37, 'p_std': 40, 'p_atr': 20, 'p_adx': 28, 'rsi_period': 51, 'ema1': 11, 'ema2': 41, 'slip_atr_k': 0.014790370264542607, 'slip_spread_k': 0.4647360720411564, 'spread_hl_frac': 1.237585315976529e-07, 'bb_std_mult': 1.918968009761669, 'rsi_os': 54, 'rsi_ob': 56, 'vol_spike': 0.07485758169755864, 'adx_thresh': 18.636246222426887, 'atr_min_pct': 0.020891888507158726, 'atr_max_pct': 0.11924070802792264, 'tp_mult': 1.1485492869635063, 'tsl_mult': 0.5541716423439894, 'strategy': 'mean_reversion', 'time_stop': 281, 'use_sma': False, 'use_atr': False, 'use_adx': False, 'use_ema': False, 'use_spike': True, 'rsi_required': True, 'edge_k': 1.9205863906548295, 'edge_cap': 0.32874944131298717, 'bull_strategy': 'breakout', 'bull_bb_std_mult': 2.774532082614544, 'bull_rsi_os': 8, 'bull_rsi_ob': 69, 'bull_adx_thresh': 22.830869374854988, 'bull_atr_min_pct': 0.0038744844546216486, 'bull_atr_max_pct': 0.018878799707532045, 'bull_tp_mult': 2.6995848595993275, 'bull_tsl_mult': 0.9870346425979584, 'bull_time_stop': 220, 'bull_use_sma': False, 'bull_use_ema': True, 'bull_use_atr': False, 'bull_use_adx': True, 'bull_use_spike': True, 'bull_rsi_required': True, 'bear_strategy': 'mean_reversion', 'bear_bb_std_mult': 1.6094677096326997, 'bear_rsi_os': 48, 'bear_rsi_ob': 81, 'bear_adx_thresh': 7.594450321005647, 'bear_atr_min_pct': 0.029745504524164704, 'bear_atr_max_pct': 0.04650167096336001, 'bear_tp_mult': 1.4106462934530346, 'bear_tsl_mult': 0.10200888904216403, 'bear_time_stop': 33, 'bear_use_sma': True, 'bear_use_ema': True, 'bear_use_atr': False, 'bear_use_adx': False, 'bear_use_spike': False, 'bear_rsi_required': True, 'sideways_strategy': 'mean_reversion', 'sideways_bb_std_mult': 2.329307790881528, 'sideways_rsi_os': 43, 'sideways_rsi_ob': 60, 'sideways_adx_thresh': 27.681864704154776, 'sideways_atr_min_pct': 0.02040974925156694, 'sideways_atr_max_pct': 0.1216090801387115, 'sideways_tp_mult': 1.8400206833637034, 'sideways_tsl_mult': 0.6672544842786003, 'sideways_time_stop': 283, 'sideways_use_sma': False, 'sideways_use_ema': True, 'sideways_use_atr': False, 'sideways_use_adx': True, 'sideways_use_spike': True, 'sideways_rsi_required': True}.
[I 2025-08-30 19:13:26,362] Trial 297 finished with values: [-1000000000.0, 1000000000.0] and parameters: {'p_sma': 45, 'p_std': 52, 'p_atr': 10, 'p_adx': 22, 'rsi_period': 60, 'ema1': 22, 'ema2': 45, 'slip_atr_k': 0.12745644120008384, 'slip_spread_k': 0.4130688729045688, 'spread_hl_frac': 0.0032635196901193747, 'bb_std_mult': 1.0657400366264262, 'rsi_os': 41, 'rsi_ob': 45, 'vol_spike': 0.03866873791360887, 'adx_thresh': 17.608046063064528, 'atr_min_pct': 0.027824048950416173, 'atr_max_pct': 0.01842890493891884, 'tp_mult': 1.2317311606096433, 'tsl_mult': 0.7619891459735666, 'strategy': 'mean_reversion', 'time_stop': 127, 'use_sma': True, 'use_atr': False, 'use_adx': False, 'use_ema': False, 'use_spike': False, 'rsi_required': True, 'edge_k': 0.2364597331173307, 'edge_cap': 0.846544648992942, 'bull_strategy': 'breakout', 'bull_bb_std_mult': 2.908186132448488, 'bull_rsi_os': 52, 'bull_rsi_ob': 83, 'bull_adx_thresh': 23.545760548478057, 'bull_atr_min_pct': 0.011873396768578535, 'bull_atr_max_pct': 0.029167684056880278, 'bull_tp_mult': 2.2750199736459136, 'bull_tsl_mult': 0.39332873890810266, 'bull_time_stop': 228, 'bull_use_sma': True, 'bull_use_ema': False, 'bull_use_atr': False, 'bull_use_adx': True, 'bull_use_spike': True, 'bull_rsi_required': True, 'bear_strategy': 'mean_reversion', 'bear_bb_std_mult': 1.5146714156058878, 'bear_rsi_os': 44, 'bear_rsi_ob': 94, 'bear_adx_thresh': 17.75961086474694, 'bear_atr_min_pct': 0.014512910448494785, 'bear_atr_max_pct': 0.1110487692179373, 'bear_tp_mult': 1.5274704878650498, 'bear_tsl_mult': 0.4936260035554493, 'bear_time_stop': 15, 'bear_use_sma': False, 'bear_use_ema': False, 'bear_use_atr': True, 'bear_use_adx': True, 'bear_use_spike': False, 'bear_rsi_required': False, 'sideways_strategy': 'mean_reversion', 'sideways_bb_std_mult': 3.2672598217423747, 'sideways_rsi_os': 16, 'sideways_rsi_ob': 57, 'sideways_adx_thresh': 6.61120612294693, 'sideways_atr_min_pct': 0.027619470235194014, 'sideways_atr_max_pct': 0.023168304641538663, 'sideways_tp_mult': 1.8254005991174211, 'sideways_tsl_mult': 0.7340709591910392, 'sideways_time_stop': 276, 'sideways_use_sma': True, 'sideways_use_ema': True, 'sideways_use_atr': True, 'sideways_use_adx': False, 'sideways_use_spike': False, 'sideways_rsi_required': False}.
[I 2025-08-30 19:13:58,503] Trial 295 finished with values: [-1000000000.0, 1000000000.0] and parameters: {'p_sma': 37, 'p_std': 28, 'p_atr': 9, 'p_adx': 8, 'rsi_period': 51, 'ema1': 22, 'ema2': 12, 'slip_atr_k': 0.08739767831569062, 'slip_spread_k': 0.4111480454837739, 'spread_hl_frac': 0.0038075102826832536, 'bb_std_mult': 2.6215255515983578, 'rsi_os': 30, 'rsi_ob': 55, 'vol_spike': 0.05309578563255915, 'adx_thresh': 6.8841869726348985, 'atr_min_pct': 0.004399669302901836, 'atr_max_pct': 0.03893529879820469, 'tp_mult': 2.1083056687565103, 'tsl_mult': 0.795253932929703, 'strategy': 'mean_reversion', 'time_stop': 114, 'use_sma': True, 'use_atr': False, 'use_adx': False, 'use_ema': True, 'use_spike': True, 'rsi_required': True, 'edge_k': 0.6840664135964589, 'edge_cap': 0.2502236238193341, 'bull_strategy': 'breakout', 'bull_bb_std_mult': 1.455837303682173, 'bull_rsi_os': 43, 'bull_rsi_ob': 69, 'bull_adx_thresh': 22.889610976428205, 'bull_atr_min_pct': 0.027709575093342147, 'bull_atr_max_pct': 0.03361689570925789, 'bull_tp_mult': 2.2603907518590987, 'bull_tsl_mult': 0.999092116804595, 'bull_time_stop': 219, 'bull_use_sma': True, 'bull_use_ema': False, 'bull_use_atr': True, 'bull_use_adx': False, 'bull_use_spike': True, 'bull_rsi_required': False, 'bear_strategy': 'mean_reversion', 'bear_bb_std_mult': 3.188290561913287, 'bear_rsi_os': 46, 'bear_rsi_ob': 71, 'bear_adx_thresh': 17.933388438621357, 'bear_atr_min_pct': 0.029699033715322235, 'bear_atr_max_pct': 0.13029928376502692, 'bear_tp_mult': 1.3117863167010388, 'bear_tsl_mult': 0.8556785820794273, 'bear_time_stop': 232, 'bear_use_sma': True, 'bear_use_ema': False, 'bear_use_atr': False, 'bear_use_adx': False, 'bear_use_spike': False, 'bear_rsi_required': False, 'sideways_strategy': 'mean_reversion', 'sideways_bb_std_mult': 2.828343323377711, 'sideways_rsi_os': 9, 'sideways_rsi_ob': 89, 'sideways_adx_thresh': 9.602123537324179, 'sideways_atr_min_pct': 0.020229720919854678, 'sideways_atr_max_pct': 0.11616200908756245, 'sideways_tp_mult': 1.842484972869902, 'sideways_tsl_mult': 0.8801011085679747, 'sideways_time_stop': 294, 'sideways_use_sma': True, 'sideways_use_ema': False, 'sideways_use_atr': True, 'sideways_use_adx': False, 'sideways_use_spike': True, 'sideways_rsi_required': False}.
[I 2025-08-30 19:13:59,306] Trial 296 finished with values: [-1000000000.0, 1000000000.0] and parameters: {'p_sma': 19, 'p_std': 26, 'p_atr': 10, 'p_adx': 28, 'rsi_period': 48, 'ema1': 22, 'ema2': 12, 'slip_atr_k': 0.12378362647392392, 'slip_spread_k': 0.40774586694799975, 'spread_hl_frac': 0.019395413835610283, 'bb_std_mult': 1.5178379336431074, 'rsi_os': 41, 'rsi_ob': 59, 'vol_spike': 0.03834494680083054, 'adx_thresh': 17.63894435649763, 'atr_min_pct': 0.010036052575772118, 'atr_max_pct': 0.13132810095684688, 'tp_mult': 2.1180258124783364, 'tsl_mult': 0.7518845042522966, 'strategy': 'mean_reversion', 'time_stop': 53, 'use_sma': True, 'use_atr': False, 'use_adx': False, 'use_ema': False, 'use_spike': False, 'rsi_required': True, 'edge_k': 1.4637935262556188, 'edge_cap': 0.2699503129033488, 'bull_strategy': 'breakout', 'bull_bb_std_mult': 1.4982696670668494, 'bull_rsi_os': 52, 'bull_rsi_ob': 71, 'bull_adx_thresh': 22.91416186146926, 'bull_atr_min_pct': 0.025217316187155843, 'bull_atr_max_pct': 0.031885156873157065, 'bull_tp_mult': 1.9419565561727916, 'bull_tsl_mult': 0.39617047220099877, 'bull_time_stop': 227, 'bull_use_sma': True, 'bull_use_ema': False, 'bull_use_atr': False, 'bull_use_adx': True, 'bull_use_spike': True, 'bull_rsi_required': True, 'bear_strategy': 'mean_reversion', 'bear_bb_std_mult': 1.6311084593895475, 'bear_rsi_os': 48, 'bear_rsi_ob': 64, 'bear_adx_thresh': 17.879941660290726, 'bear_atr_min_pct': 0.0145360073606654, 'bear_atr_max_pct': 0.052508193449141316, 'bear_tp_mult': 1.4745439375710878, 'bear_tsl_mult': 0.7454525236851431, 'bear_time_stop': 39, 'bear_use_sma': True, 'bear_use_ema': False, 'bear_use_atr': False, 'bear_use_adx': False, 'bear_use_spike': False, 'bear_rsi_required': False, 'sideways_strategy': 'mean_reversion', 'sideways_bb_std_mult': 1.2155556915834942, 'sideways_rsi_os': 16, 'sideways_rsi_ob': 57, 'sideways_adx_thresh': 11.539610689039227, 'sideways_atr_min_pct': 0.02771420355725708, 'sideways_atr_max_pct': 0.06457192053626601, 'sideways_tp_mult': 1.8204836463989675, 'sideways_tsl_mult': 0.7845162406427708, 'sideways_time_stop': 296, 'sideways_use_sma': True, 'sideways_use_ema': True, 'sideways_use_atr': True, 'sideways_use_adx': False, 'sideways_use_spike': True, 'sideways_rsi_required': False}.
