[I 2025-08-30 18:44:50,429] Trial 72 finished with values: [-1000000000.0, 1000000000.0] and parameters: {'p_sma': 30, 'p_std': 24, 'p_atr': 7, 'p_adx': 18, 'rsi_period': 70, 'ema1': 24, 'ema2': 19, 'slip_atr_k': 0.2049190640892785, 'slip_spread_k': 0.5393272462132307, 'spread_hl_frac': 0.008483415310175985, 'bb_std_mult': 0.7649282265191786, 'rsi_os': 46, 'rsi_ob': 61, 'vol_spike': 0.2559776488353237, 'adx_thresh': 19.002657958548863, 'atr_min_pct': 0.02248851107268043, 'atr_max_pct': 0.10768587590136983, 'tp_mult': 1.8490317882600729, 'tsl_mult': 0.43474995943760525, 'strategy': 'breakout', 'time_stop': 242, 'use_sma': False, 'use_atr': False, 'use_adx': True, 'use_ema': False, 'use_spike': True, 'rsi_required': False, 'edge_k': 1.165593685104868, 'edge_cap': 0.21107334371828906, 'bull_strategy': 'mean_reversion', 'bull_bb_std_mult': 2.282432373989803, 'bull_rsi_os': 31, 'bull_rsi_ob': 71, 'bull_adx_thresh': 28.78574093145419, 'bull_atr_min_pct': 0.007609588502453839, 'bull_atr_max_pct': 0.027521833532016073, 'bull_tp_mult': 2.615067768748358, 'bull_tsl_mult': 0.7591053562506083, 'bull_time_stop': 131, 'bull_use_sma': True, 'bull_use_ema': False, 'bull_use_atr': False, 'bull_use_adx': True, 'bull_use_spike': False, 'bull_rsi_required': True, 'bear_strategy': 'breakout', 'bear_bb_std_mult': 2.6514574903056927, 'bear_rsi_os': 47, 'bear_rsi_ob': 50, 'bear_adx_thresh': 10.99914830396165, 'bear_atr_min_pct': 0.008984361316044681, 'bear_atr_max_pct': 0.01631739138325583, 'bear_tp_mult': 1.4470564856799153, 'bear_tsl_mult': 0.11042858514421461, 'bear_time_stop': 5, 'bear_use_sma': True, 'bear_use_ema': False, 'bear_use_atr': True, 'bear_use_adx': True, 'bear_use_spike': False, 'bear_rsi_required': True, 'sideways_strategy': 'breakout', 'sideways_bb_std_mult': 1.291515911234033, 'sideways_rsi_os': 8, 'sideways_rsi_ob': 67, 'sideways_adx_thresh': 10.661877353369979, 'sideways_atr_min_pct': 0.019311889277152154, 'sideways_atr_max_pct': 0.10457381446570585, 'sideways_tp_mult': 1.104786916829563, 'sideways_tsl_mult': 0.8516016868025424, 'sideways_time_stop': 109, 'sideways_use_sma': True, 'sideways_use_ema': False, 'sideways_use_atr': True, 'sideways_use_adx': False, 'sideways_use_spike': False, 'sideways_rsi_required': False}.
[I 2025-08-30 18:44:51,342] Trial 74 finished with values: [-1000000000.0, 1000000000.0] and parameters: {'p_sma': 41, 'p_std': 30, 'p_atr': 10, 'p_adx': 9, 'rsi_period': 49, 'ema1': 24, 'ema2': 13, 'slip_atr_k': 0.20264128045668867, 'slip_spread_k': 0.0005737462678510052, 'spread_hl_frac': 0.008654810018837876, 'bb_std_mult': 0.9433239990669731, 'rsi_os': 25, 'rsi_ob': 51, 'vol_spike': 0.0448556268692282, 'adx_thresh': 18.938289464157375, 'atr_min_pct': 0.020635692658034277, 'atr_max_pct': 0.13910362875195595, 'tp_mult': 2.1168038060889307, 'tsl_mult': 0.5325834594905257, 'strategy': 'mean_reversion', 'time_stop': 39, 'use_sma': False, 'use_atr': True, 'use_adx': False, 'use_ema': False, 'use_spike': True, 'rsi_required': True, 'edge_k': 0.060595281707880935, 'edge_cap': 0.36044192594782076, 'bull_strategy': 'mean_reversion', 'bull_bb_std_mult': 1.9453726210531748, 'bull_rsi_os': 42, 'bull_rsi_ob': 74, 'bull_adx_thresh': 21.10147640420456, 'bull_atr_min_pct': 0.017646563734075003, 'bull_atr_max_pct': 0.024331509944227843, 'bull_tp_mult': 2.2376977794592507, 'bull_tsl_mult': 0.48540097485429234, 'bull_time_stop': 180, 'bull_use_sma': True, 'bull_use_ema': False, 'bull_use_atr': False, 'bull_use_adx': True, 'bull_use_spike': True, 'bull_rsi_required': True, 'bear_strategy': 'breakout', 'bear_bb_std_mult': 3.208940918594237, 'bear_rsi_os': 40, 'bear_rsi_ob': 52, 'bear_adx_thresh': 13.826078696829533, 'bear_atr_min_pct': 0.0028431286982912377, 'bear_atr_max_pct': 0.06545176779887883, 'bear_tp_mult': 1.9230419623614112, 'bear_tsl_mult': 0.6920502083271193, 'bear_time_stop': 20, 'bear_use_sma': True, 'bear_use_ema': True, 'bear_use_atr': True, 'bear_use_adx': True, 'bear_use_spike': False, 'bear_rsi_required': False, 'sideways_strategy': 'breakout', 'sideways_bb_std_mult': 0.8024890960488118, 'sideways_rsi_os': 19, 'sideways_rsi_ob': 54, 'sideways_adx_thresh': 10.202698244200231, 'sideways_atr_min_pct': 0.023997927572776103, 'sideways_atr_max_pct': 0.1332409118280795, 'sideways_tp_mult': 1.932736557679994, 'sideways_tsl_mult': 0.6876222803881001, 'sideways_time_stop': 288, 'sideways_use_sma': False, 'sideways_use_ema': True, 'sideways_use_atr': True, 'sideways_use_adx': False, 'sideways_use_spike': False, 'sideways_rsi_required': False}.
[I 2025-08-30 18:44:51,623] Trial 75 finished with values: [-0.024973275229673852, 0.024889445236418034] and parameters: {'p_sma': 20, 'p_std': 30, 'p_atr': 10, 'p_adx': 9, 'rsi_period': 69, 'ema1': 24, 'ema2': 39, 'slip_atr_k': 0.19669120254628225, 'slip_spread_k': 0.03906293594247073, 'spread_hl_frac': 0.0042988328398775675, 'bb_std_mult': 0.9100435522979338, 'rsi_os': 18, 'rsi_ob': 66, 'vol_spike': 0.03240678581637226, 'adx_thresh': 19.156656215679728, 'atr_min_pct': 0.022640019907218818, 'atr_max_pct': 0.136686665813794, 'tp_mult': 2.1192027406593597, 'tsl_mult': 0.5198102824243982, 'strategy': 'mean_reversion', 'time_stop': 35, 'use_sma': True, 'use_atr': True, 'use_adx': False, 'use_ema': False, 'use_spike': True, 'rsi_required': True, 'edge_k': 1.0119328607158702, 'edge_cap': 0.27688475767548526, 'bull_strategy': 'mean_reversion', 'bull_bb_std_mult': 1.938148233036403, 'bull_rsi_os': 43, 'bull_rsi_ob': 75, 'bull_adx_thresh': 21.43312212427203, 'bull_atr_min_pct': 8.176769941316449e-05, 'bull_atr_max_pct': 0.026776438566907354, 'bull_tp_mult': 2.201496067548886, 'bull_tsl_mult': 0.5185498126095209, 'bull_time_stop': 185, 'bull_use_sma': False, 'bull_use_ema': False, 'bull_use_atr': False, 'bull_use_adx': True, 'bull_use_spike': True, 'bull_rsi_required': True, 'bear_strategy': 'mean_reversion', 'bear_bb_std_mult': 3.2298417823201215, 'bear_rsi_os': 22, 'bear_rsi_ob': 52, 'bear_adx_thresh': 11.61108221389374, 'bear_atr_min_pct': 0.014828301206571602, 'bear_atr_max_pct': 0.060852246995239404, 'bear_tp_mult': 1.7014765926704059, 'bear_tsl_mult': 0.3379384506980511, 'bear_time_stop': 74, 'bear_use_sma': True, 'bear_use_ema': True, 'bear_use_atr': True, 'bear_use_adx': True, 'bear_use_spike': False, 'bear_rsi_required': False, 'sideways_strategy': 'breakout', 'sideways_bb_std_mult': 1.329073391089389, 'sideways_rsi_os': 19, 'sideways_rsi_ob': 54, 'sideways_adx_thresh': 10.528636303662104, 'sideways_atr_min_pct': 0.018831381278160243, 'sideways_atr_max_pct': 0.08045129228942675, 'sideways_tp_mult': 2.0674944567771263, 'sideways_tsl_mult': 0.6601792210554808, 'sideways_time_stop': 29, 'sideways_use_sma': False, 'sideways_use_ema': True, 'sideways_use_atr': False, 'sideways_use_adx': True, 'sideways_use_spike': False, 'sideways_rsi_required': True}.
[I 2025-08-30 18:44:51,705] Trial 73 finished with values: [-1000000000.0, 1000000000.0] and parameters: {'p_sma': 30, 'p_std': 38, 'p_atr': 15, 'p_adx': 18, 'rsi_period': 48, 'ema1': 24, 'ema2': 18, 'slip_atr_k': 0.13172168475554585, 'slip_spread_k': 0.5377011359437401, 'spread_hl_frac': 0.008548957903363383, 'bb_std_mult': 0.8062404050060508, 'rsi_os': 46, 'rsi_ob': 92, 'vol_spike': 0.07729146201850381, 'adx_thresh': 13.356686390955836, 'atr_min_pct': 0.022958667549972903, 'atr_max_pct': 0.10638011715584175, 'tp_mult': 2.124122410293276, 'tsl_mult': 0.4092060306704256, 'strategy': 'mean_reversion', 'time_stop': 55, 'use_sma': False, 'use_atr': False, 'use_adx': True, 'use_ema': False, 'use_spike': True, 'rsi_required': True, 'edge_k': 1.7128253048747193, 'edge_cap': 0.2796133991057146, 'bull_strategy': 'mean_reversion', 'bull_bb_std_mult': 1.5568702202872433, 'bull_rsi_os': 55, 'bull_rsi_ob': 52, 'bull_adx_thresh': 28.846477502577315, 'bull_atr_min_pct': 0.005233008034660149, 'bull_atr_max_pct': 0.026810617973249778, 'bull_tp_mult': 1.898680628154781, 'bull_tsl_mult': 0.9704378639158666, 'bull_time_stop': 181, 'bull_use_sma': False, 'bull_use_ema': False, 'bull_use_atr': False, 'bull_use_adx': True, 'bull_use_spike': False, 'bull_rsi_required': True, 'bear_strategy': 'mean_reversion', 'bear_bb_std_mult': 2.6382621964744675, 'bear_rsi_os': 47, 'bear_rsi_ob': 51, 'bear_adx_thresh': 10.867900953250999, 'bear_atr_min_pct': 0.005541343018047337, 'bear_atr_max_pct': 0.060297839114252995, 'bear_tp_mult': 1.433786942154812, 'bear_tsl_mult': 0.11480907995144211, 'bear_time_stop': 74, 'bear_use_sma': True, 'bear_use_ema': True, 'bear_use_atr': True, 'bear_use_adx': True, 'bear_use_spike': False, 'bear_rsi_required': False, 'sideways_strategy': 'breakout', 'sideways_bb_std_mult': 1.334110189879271, 'sideways_rsi_os': 40, 'sideways_rsi_ob': 67, 'sideways_adx_thresh': 24.7603898357755, 'sideways_atr_min_pct': 0.019228457660457256, 'sideways_atr_max_pct': 0.14349827600367826, 'sideways_tp_mult': 1.1153702773131444, 'sideways_tsl_mult': 0.9418443749435662, 'sideways_time_stop': 112, 'sideways_use_sma': False, 'sideways_use_ema': True, 'sideways_use_atr': True, 'sideways_use_adx': True, 'sideways_use_spike': False, 'sideways_rsi_required': True}.
[I 2025-08-30 18:44:52,086] Trial 78 finished with values: [-1000000000.0, 1000000000.0] and parameters: {'p_sma': 21, 'p_std': 34, 'p_atr': 9, 'p_adx': 12, 'rsi_period': 44, 'ema1': 26, 'ema2': 27, 'slip_atr_k': 0.0347989679051805, 'slip_spread_k': 0.3963121057662274, 'spread_hl_frac': 0.0026939551685965495, 'bb_std_mult': 1.1843261990325, 'rsi_os': 30, 'rsi_ob': 70, 'vol_spike': 0.03176335425025663, 'adx_thresh': 22.81007288435133, 'atr_min_pct': 0.024818541012773022, 'atr_max_pct': 0.012816991647990411, 'tp_mult': 2.2698440250050442, 'tsl_mult': 0.3252684801033314, 'strategy': 'breakout', 'time_stop': 16, 'use_sma': True, 'use_atr': True, 'use_adx': False, 'use_ema': False, 'use_spike': False, 'rsi_required': True, 'edge_k': 0.19656432273620505, 'edge_cap': 0.14754159384361865, 'bull_strategy': 'breakout', 'bull_bb_std_mult': 1.8094094665837377, 'bull_rsi_os': 49, 'bull_rsi_ob': 76, 'bull_adx_thresh': 22.631977598228254, 'bull_atr_min_pct': 0.011127950534404817, 'bull_atr_max_pct': 0.039850871379264734, 'bull_tp_mult': 1.3659031390206164, 'bull_tsl_mult': 0.448846147093411, 'bull_time_stop': 300, 'bull_use_sma': False, 'bull_use_ema': True, 'bull_use_atr': False, 'bull_use_adx': True, 'bull_use_spike': True, 'bull_rsi_required': False, 'bear_strategy': 'mean_reversion', 'bear_bb_std_mult': 2.8458126181420242, 'bear_rsi_os': 54, 'bear_rsi_ob': 77, 'bear_adx_thresh': 16.504078511290224, 'bear_atr_min_pct': 0.013219325723414048, 'bear_atr_max_pct': 0.04900114390144573, 'bear_tp_mult': 2.9786381567008284, 'bear_tsl_mult': 0.3246560245036422, 'bear_time_stop': 53, 'bear_use_sma': True, 'bear_use_ema': False, 'bear_use_atr': True, 'bear_use_adx': True, 'bear_use_spike': False, 'bear_rsi_required': False, 'sideways_strategy': 'breakout', 'sideways_bb_std_mult': 2.5985592477947317, 'sideways_rsi_os': 32, 'sideways_rsi_ob': 64, 'sideways_adx_thresh': 22.566353896043296, 'sideways_atr_min_pct': 0.00479235834838075, 'sideways_atr_max_pct': 0.09704324290849226, 'sideways_tp_mult': 2.5528835043199565, 'sideways_tsl_mult': 0.6262340349644243, 'sideways_time_stop': 260, 'sideways_use_sma': True, 'sideways_use_ema': True, 'sideways_use_atr': False, 'sideways_use_adx': True, 'sideways_use_spike': True, 'sideways_rsi_required': True}.
[I 2025-08-30 18:44:52,363] Trial 80 finished with values: [-1000000000.0, 1000000000.0] and parameters: {'p_sma': 25, 'p_std': 14, 'p_atr': 8, 'p_adx': 8, 'rsi_period': 57, 'ema1': 26, 'ema2': 40, 'slip_atr_k': 0.01090817739798287, 'slip_spread_k': 0.06430353838185171, 'spread_hl_frac': 6.819069710397099e-05, 'bb_std_mult': 2.2210853959764996, 'rsi_os': 52, 'rsi_ob': 65, 'vol_spike': 0.2875017529682632, 'adx_thresh': 28.083964681501662, 'atr_min_pct': 0.025474151134711943, 'atr_max_pct': 0.09913297180355872, 'tp_mult': 1.3445862313354286, 'tsl_mult': 0.521213042329055, 'strategy': 'mean_reversion', 'time_stop': 40, 'use_sma': True, 'use_atr': True, 'use_adx': False, 'use_ema': False, 'use_spike': False, 'rsi_required': True, 'edge_k': 0.1628326368877343, 'edge_cap': 0.3370836119734347, 'bull_strategy': 'mean_reversion', 'bull_bb_std_mult': 1.5943228110543943, 'bull_rsi_os': 44, 'bull_rsi_ob': 91, 'bull_adx_thresh': 8.204124304936217, 'bull_atr_min_pct': 0.0017878559018021233, 'bull_atr_max_pct': 0.07883557423228046, 'bull_tp_mult': 2.268938106083928, 'bull_tsl_mult': 0.34998289510266956, 'bull_time_stop': 156, 'bull_use_sma': True, 'bull_use_ema': False, 'bull_use_atr': False, 'bull_use_adx': True, 'bull_use_spike': True, 'bull_rsi_required': True, 'bear_strategy': 'breakout', 'bear_bb_std_mult': 3.3117934260744883, 'bear_rsi_os': 22, 'bear_rsi_ob': 47, 'bear_adx_thresh': 7.915038838271954, 'bear_atr_min_pct': 0.02619445415856568, 'bear_atr_max_pct': 0.09084094327948575, 'bear_tp_mult': 1.707072608396864, 'bear_tsl_mult': 0.7468744760974576, 'bear_time_stop': 274, 'bear_use_sma': True, 'bear_use_ema': False, 'bear_use_atr': True, 'bear_use_adx': True, 'bear_use_spike': False, 'bear_rsi_required': True, 'sideways_strategy': 'breakout', 'sideways_bb_std_mult': 1.7248940360990495, 'sideways_rsi_os': 16, 'sideways_rsi_ob': 80, 'sideways_adx_thresh': 26.451693300534377, 'sideways_atr_min_pct': 0.022856562222191977, 'sideways_atr_max_pct': 0.0794268467671726, 'sideways_tp_mult': 2.0664812550666705, 'sideways_tsl_mult': 0.758037686531333, 'sideways_time_stop': 270, 'sideways_use_sma': True, 'sideways_use_ema': True, 'sideways_use_atr': False, 'sideways_use_adx': False, 'sideways_use_spike': True, 'sideways_rsi_required': True}.
[I 2025-08-30 18:45:24,373] Trial 76 finished with values: [-1000000000.0, 1000000000.0] and parameters: {'p_sma': 45, 'p_std': 30, 'p_atr': 10, 'p_adx': 9, 'rsi_period': 49, 'ema1': 26, 'ema2': 27, 'slip_atr_k': 0.031527185150949696, 'slip_spread_k': 0.40836222980006937, 'spread_hl_frac': 0.004398683556804033, 'bb_std_mult': 0.9195667339985099, 'rsi_os': 11, 'rsi_ob': 65, 'vol_spike': 0.04843192265173986, 'adx_thresh': 23.00837733604077, 'atr_min_pct': 0.020528089547637657, 'atr_max_pct': 0.13881106920651565, 'tp_mult': 2.146402879113782, 'tsl_mult': 0.5319937001012878, 'strategy': 'mean_reversion', 'time_stop': 42, 'use_sma': True, 'use_atr': True, 'use_adx': False, 'use_ema': False, 'use_spike': True, 'rsi_required': True, 'edge_k': 0.04603404424546148, 'edge_cap': 0.2877146092023338, 'bull_strategy': 'mean_reversion', 'bull_bb_std_mult': 1.8878165479816558, 'bull_rsi_os': 42, 'bull_rsi_ob': 74, 'bull_adx_thresh': 8.74041703578869, 'bull_atr_min_pct': 0.017588691087308067, 'bull_atr_max_pct': 0.024443702073663653, 'bull_tp_mult': 2.2034628156393237, 'bull_tsl_mult': 0.5197573746426544, 'bull_time_stop': 183, 'bull_use_sma': False, 'bull_use_ema': False, 'bull_use_atr': False, 'bull_use_adx': True, 'bull_use_spike': True, 'bull_rsi_required': True, 'bear_strategy': 'mean_reversion', 'bear_bb_std_mult': 3.2138304545515552, 'bear_rsi_os': 11, 'bear_rsi_ob': 78, 'bear_adx_thresh': 16.54391768030002, 'bear_atr_min_pct': 0.026830677040093016, 'bear_atr_max_pct': 0.09119082175665631, 'bear_tp_mult': 1.92580745084703, 'bear_tsl_mult': 0.33650747601747566, 'bear_time_stop': 72, 'bear_use_sma': True, 'bear_use_ema': True, 'bear_use_atr': True, 'bear_use_adx': True, 'bear_use_spike': False, 'bear_rsi_required': False, 'sideways_strategy': 'breakout', 'sideways_bb_std_mult': 2.3891231194191516, 'sideways_rsi_os': 16, 'sideways_rsi_ob': 54, 'sideways_adx_thresh': 23.487084328683217, 'sideways_atr_min_pct': 0.022048918770137624, 'sideways_atr_max_pct': 0.08076986831801544, 'sideways_tp_mult': 2.064441826436922, 'sideways_tsl_mult': 0.6667628271981101, 'sideways_time_stop': 46, 'sideways_use_sma': False, 'sideways_use_ema': True, 'sideways_use_atr': False, 'sideways_use_adx': True, 'sideways_use_spike': False, 'sideways_rsi_required': True}.
[I 2025-08-30 18:45:25,355] Trial 79 finished with values: [-1000000000.0, 1000000000.0] and parameters: {'p_sma': 45, 'p_std': 25, 'p_atr': 9, 'p_adx': 8, 'rsi_period': 67, 'ema1': 26, 'ema2': 27, 'slip_atr_k': 0.03152918705924057, 'slip_spread_k': 0.40463918920194103, 'spread_hl_frac': 3.438299133220546e-05, 'bb_std_mult': 2.22682737167072, 'rsi_os': 10, 'rsi_ob': 73, 'vol_spike': 0.29125455825097735, 'adx_thresh': 27.38664062915546, 'atr_min_pct': 0.02475480593994678, 'atr_max_pct': 0.09773065318612464, 'tp_mult': 2.347384276025357, 'tsl_mult': 0.9378768190516255, 'strategy': 'breakout', 'time_stop': 214, 'use_sma': True, 'use_atr': True, 'use_adx': False, 'use_ema': False, 'use_spike': False, 'rsi_required': True, 'edge_k': 0.18149405408460642, 'edge_cap': 0.43420092791594, 'bull_strategy': 'breakout', 'bull_bb_std_mult': 1.6115070257628064, 'bull_rsi_os': 48, 'bull_rsi_ob': 92, 'bull_adx_thresh': 31.641329355146365, 'bull_atr_min_pct': 0.029763121502192624, 'bull_atr_max_pct': 0.010063738335692511, 'bull_tp_mult': 1.4060866994118715, 'bull_tsl_mult': 0.9770520764199009, 'bull_time_stop': 170, 'bull_use_sma': False, 'bull_use_ema': True, 'bull_use_atr': False, 'bull_use_adx': True, 'bull_use_spike': True, 'bull_rsi_required': False, 'bear_strategy': 'mean_reversion', 'bear_bb_std_mult': 3.2816597960042477, 'bear_rsi_os': 36, 'bear_rsi_ob': 77, 'bear_adx_thresh': 8.125369014049353, 'bear_atr_min_pct': 0.026526093297046922, 'bear_atr_max_pct': 0.04958877762801057, 'bear_tp_mult': 1.716927291009996, 'bear_tsl_mult': 0.3365111227275428, 'bear_time_stop': 294, 'bear_use_sma': True, 'bear_use_ema': False, 'bear_use_atr': True, 'bear_use_adx': True, 'bear_use_spike': False, 'bear_rsi_required': False, 'sideways_strategy': 'breakout', 'sideways_bb_std_mult': 2.6028611001825563, 'sideways_rsi_os': 53, 'sideways_rsi_ob': 62, 'sideways_adx_thresh': 8.55794315525932, 'sideways_atr_min_pct': 0.022190572796828706, 'sideways_atr_max_pct': 0.07902709385405499, 'sideways_tp_mult': 1.8414676867271222, 'sideways_tsl_mult': 0.6644556320581404, 'sideways_time_stop': 39, 'sideways_use_sma': True, 'sideways_use_ema': True, 'sideways_use_atr': False, 'sideways_use_adx': True, 'sideways_use_spike': True, 'sideways_rsi_required': True}.
[I 2025-08-30 18:45:25,521] Trial 77 finished with values: [-0.023904793764720544, 0.023830518517669187] and parameters: {'p_sma': 45, 'p_std': 30, 'p_atr': 9, 'p_adx': 16, 'rsi_period': 68, 'ema1': 26, 'ema2': 28, 'slip_atr_k': 0.034721136007092986, 'slip_spread_k': 0.40518482455876775, 'spread_hl_frac': 0.003814465400489726, 'bb_std_mult': 1.2044631069776148, 'rsi_os': 12, 'rsi_ob': 65, 'vol_spike': 0.2884794261590759, 'adx_thresh': 31.258754913769614, 'atr_min_pct': 0.02281455838610412, 'atr_max_pct': 0.042163811409537996, 'tp_mult': 2.264075265474463, 'tsl_mult': 0.7142886343738613, 'strategy': 'mean_reversion', 'time_stop': 219, 'use_sma': True, 'use_atr': True, 'use_adx': False, 'use_ema': False, 'use_spike': True, 'rsi_required': True, 'edge_k': 0.18209189300496842, 'edge_cap': 0.27920177026987936, 'bull_strategy': 'mean_reversion', 'bull_bb_std_mult': 1.7745554835267234, 'bull_rsi_os': 35, 'bull_rsi_ob': 91, 'bull_adx_thresh': 22.008322751482094, 'bull_atr_min_pct': 7.851657779396788e-05, 'bull_atr_max_pct': 0.01066475244979504, 'bull_tp_mult': 1.867443323492028, 'bull_tsl_mult': 0.5581761456215325, 'bull_time_stop': 183, 'bull_use_sma': False, 'bull_use_ema': False, 'bull_use_atr': False, 'bull_use_adx': True, 'bull_use_spike': True, 'bull_rsi_required': True, 'bear_strategy': 'mean_reversion', 'bear_bb_std_mult': 2.8325144719674515, 'bear_rsi_os': 11, 'bear_rsi_ob': 77, 'bear_adx_thresh': 8.034266388807051, 'bear_atr_min_pct': 0.0001455263026191901, 'bear_atr_max_pct': 0.08889715979710727, 'bear_tp_mult': 1.7076363295163675, 'bear_tsl_mult': 0.3236802861788236, 'bear_time_stop': 292, 'bear_use_sma': True, 'bear_use_ema': True, 'bear_use_atr': True, 'bear_use_adx': True, 'bear_use_spike': False, 'bear_rsi_required': False, 'sideways_strategy': 'breakout', 'sideways_bb_std_mult': 2.391533090502097, 'sideways_rsi_os': 39, 'sideways_rsi_ob': 49, 'sideways_adx_thresh': 24.284872249153583, 'sideways_atr_min_pct': 0.02204377918495536, 'sideways_atr_max_pct': 0.09608744669095237, 'sideways_tp_mult': 2.0308603955105937, 'sideways_tsl_mult': 0.6327070471775064, 'sideways_time_stop': 265, 'sideways_use_sma': False, 'sideways_use_ema': True, 'sideways_use_atr': False, 'sideways_use_adx': True, 'sideways_use_spike': True, 'sideways_rsi_required': True}.
