[I 2025-08-30 19:58:57,522] Trial 633 finished with values: [-1000000000.0, 1000000000.0] and parameters: {'p_sma': 48, 'p_std': 26, 'p_atr': 10, 'p_adx': 9, 'rsi_period': 56, 'ema1': 25, 'ema2': 14, 'slip_atr_k': 0.011894666212397667, 'slip_spread_k': 0.39875442183056087, 'spread_hl_frac': 0.0036404744702762566, 'bb_std_mult': 1.0156260701430515, 'rsi_os': 37, 'rsi_ob': 75, 'vol_spike': 0.04210032645235176, 'adx_thresh': 17.22134411138577, 'atr_min_pct': 0.024370374124621612, 'atr_max_pct': 0.021732597139807595, 'tp_mult': 2.607465525239027, 'tsl_mult': 0.38384472861313135, 'strategy': 'mean_reversion', 'time_stop': 243, 'use_sma': False, 'use_atr': True, 'use_adx': False, 'use_ema': False, 'use_spike': True, 'rsi_required': True, 'edge_k': 1.4263392725372042, 'edge_cap': 0.252740351514644, 'bull_strategy': 'mean_reversion', 'bull_bb_std_mult': 2.6530135373377046, 'bull_rsi_os': 31, 'bull_rsi_ob': 73, 'bull_adx_thresh': 24.627477516403413, 'bull_atr_min_pct': 0.001929649882359724, 'bull_atr_max_pct': 0.08047282192818207, 'bull_tp_mult': 2.245504816417164, 'bull_tsl_mult': 0.024611312139160624, 'bull_time_stop': 171, 'bull_use_sma': True, 'bull_use_ema': True, 'bull_use_atr': False, 'bull_use_adx': True, 'bull_use_spike': True, 'bull_rsi_required': True, 'bear_strategy': 'mean_reversion', 'bear_bb_std_mult': 3.207682249179685, 'bear_rsi_os': 17, 'bear_rsi_ob': 91, 'bear_adx_thresh': 6.9800687360202325, 'bear_atr_min_pct': 0.016567372545531613, 'bear_atr_max_pct': 0.09921714643858744, 'bear_tp_mult': 1.136576530374854, 'bear_tsl_mult': 0.8997317341648277, 'bear_time_stop': 153, 'bear_use_sma': False, 'bear_use_ema': False, 'bear_use_atr': True, 'bear_use_adx': True, 'bear_use_spike': False, 'bear_rsi_required': False, 'sideways_strategy': 'breakout', 'sideways_bb_std_mult': 1.9616479484818967, 'sideways_rsi_os': 18, 'sideways_rsi_ob': 58, 'sideways_adx_thresh': 19.187987140552917, 'sideways_atr_min_pct': 0.008422200538715625, 'sideways_atr_max_pct': 0.010040101941030333, 'sideways_tp_mult': 2.7382800513958543, 'sideways_tsl_mult': 0.6458129783040462, 'sideways_time_stop': 139, 'sideways_use_sma': True, 'sideways_use_ema': True, 'sideways_use_atr': False, 'sideways_use_adx': False, 'sideways_use_spike': True, 'sideways_rsi_required': False}.
[I 2025-08-30 19:59:30,104] Trial 630 finished with values: [-1000000000.0, 1000000000.0] and parameters: {'p_sma': 35, 'p_std': 24, 'p_atr': 27, 'p_adx': 10, 'rsi_period': 26, 'ema1': 25, 'ema2': 14, 'slip_atr_k': 0.11768948299100018, 'slip_spread_k': 0.3976426078603641, 'spread_hl_frac': 0.0068619651096717155, 'bb_std_mult': 1.1135607409560035, 'rsi_os': 37, 'rsi_ob': 59, 'vol_spike': 0.039607713424107835, 'adx_thresh': 17.380836583984635, 'atr_min_pct': 0.02455548881959954, 'atr_max_pct': 0.1428710309624446, 'tp_mult': 1.148117988800698, 'tsl_mult': 0.3859910339065928, 'strategy': 'breakout', 'time_stop': 46, 'use_sma': False, 'use_atr': True, 'use_adx': False, 'use_ema': True, 'use_spike': False, 'rsi_required': True, 'edge_k': 0.8679073167771535, 'edge_cap': 0.25955167662301337, 'bull_strategy': 'mean_reversion', 'bull_bb_std_mult': 0.660606348399462, 'bull_rsi_os': 49, 'bull_rsi_ob': 71, 'bull_adx_thresh': 24.309698178574497, 'bull_atr_min_pct': 0.024640510004288678, 'bull_atr_max_pct': 0.04064094554696649, 'bull_tp_mult': 2.2367320150077608, 'bull_tsl_mult': 0.9308754005465136, 'bull_time_stop': 189, 'bull_use_sma': True, 'bull_use_ema': True, 'bull_use_atr': False, 'bull_use_adx': True, 'bull_use_spike': True, 'bull_rsi_required': False, 'bear_strategy': 'breakout', 'bear_bb_std_mult': 3.264608835504142, 'bear_rsi_os': 44, 'bear_rsi_ob': 83, 'bear_adx_thresh': 32.24847422373239, 'bear_atr_min_pct': 0.015438332611204307, 'bear_atr_max_pct': 0.056776033138453065, 'bear_tp_mult': 1.6357443438279242, 'bear_tsl_mult': 0.9446237822987938, 'bear_time_stop': 193, 'bear_use_sma': False, 'bear_use_ema': False, 'bear_use_atr': True, 'bear_use_adx': True, 'bear_use_spike': False, 'bear_rsi_required': True, 'sideways_strategy': 'breakout', 'sideways_bb_std_mult': 1.4916814719471605, 'sideways_rsi_os': 17, 'sideways_rsi_ob': 54, 'sideways_adx_thresh': 18.94707084151117, 'sideways_atr_min_pct': 0.023285410003533836, 'sideways_atr_max_pct': 0.0943958863807222, 'sideways_tp_mult': 1.10755925108155, 'sideways_tsl_mult': 0.8330540887157454, 'sideways_time_stop': 278, 'sideways_use_sma': True, 'sideways_use_ema': False, 'sideways_use_atr': False, 'sideways_use_adx': False, 'sideways_use_spike': True, 'sideways_rsi_required': False}.
[I 2025-08-30 19:59:30,764] Trial 631 finished with values: [-1000000000.0, 1000000000.0] and parameters: {'p_sma': 27, 'p_std': 59, 'p_atr': 21, 'p_adx': 9, 'rsi_period': 56, 'ema1': 23, 'ema2': 14, 'slip_atr_k': 0.013530033536298263, 'slip_spread_k': 0.20035146942483878, 'spread_hl_frac': 0.008162163665521246, 'bb_std_mult': 2.003985515134241, 'rsi_os': 52, 'rsi_ob': 79, 'vol_spike': 0.22538045043443788, 'adx_thresh': 19.229967604506783, 'atr_min_pct': 0.008892265470963973, 'atr_max_pct': 0.02696860289173964, 'tp_mult': 2.6375064299001707, 'tsl_mult': 0.7369372369677899, 'strategy': 'breakout', 'time_stop': 182, 'use_sma': False, 'use_atr': True, 'use_adx': False, 'use_ema': False, 'use_spike': True, 'rsi_required': True, 'edge_k': 1.6875666886402332, 'edge_cap': 0.870838366949259, 'bull_strategy': 'mean_reversion', 'bull_bb_std_mult': 1.8299429435040564, 'bull_rsi_os': 16, 'bull_rsi_ob': 71, 'bull_adx_thresh': 24.77166692555236, 'bull_atr_min_pct': 0.0021796141095587044, 'bull_atr_max_pct': 0.018219042397583603, 'bull_tp_mult': 2.2412729311582065, 'bull_tsl_mult': 0.9275432260377454, 'bull_time_stop': 172, 'bull_use_sma': True, 'bull_use_ema': True, 'bull_use_atr': False, 'bull_use_adx': True, 'bull_use_spike': True, 'bull_rsi_required': True, 'bear_strategy': 'breakout', 'bear_bb_std_mult': 3.2160565490496587, 'bear_rsi_os': 18, 'bear_rsi_ob': 70, 'bear_adx_thresh': 7.003820380848423, 'bear_atr_min_pct': 0.01657264760794269, 'bear_atr_max_pct': 0.07522537292132384, 'bear_tp_mult': 1.6427034310629098, 'bear_tsl_mult': 0.1402438125543037, 'bear_time_stop': 257, 'bear_use_sma': False, 'bear_use_ema': False, 'bear_use_atr': True, 'bear_use_adx': True, 'bear_use_spike': False, 'bear_rsi_required': False, 'sideways_strategy': 'breakout', 'sideways_bb_std_mult': 1.7201723343055897, 'sideways_rsi_os': 26, 'sideways_rsi_ob': 81, 'sideways_adx_thresh': 16.470596351230743, 'sideways_atr_min_pct': 0.008341708800015796, 'sideways_atr_max_pct': 0.1196198269765659, 'sideways_tp_mult': 1.8407464559629654, 'sideways_tsl_mult': 0.647119440335304, 'sideways_time_stop': 237, 'sideways_use_sma': True, 'sideways_use_ema': True, 'sideways_use_atr': False, 'sideways_use_adx': False, 'sideways_use_spike': True, 'sideways_rsi_required': False}.
[I 2025-08-30 19:59:31,270] Trial 632 finished with values: [-1000000000.0, 1000000000.0] and parameters: {'p_sma': 41, 'p_std': 31, 'p_atr': 10, 'p_adx': 12, 'rsi_period': 55, 'ema1': 25, 'ema2': 14, 'slip_atr_k': 0.017539577505411262, 'slip_spread_k': 0.39522305399010177, 'spread_hl_frac': 0.03207391080052108, 'bb_std_mult': 1.0313791836849902, 'rsi_os': 37, 'rsi_ob': 59, 'vol_spike': 0.22404791519629805, 'adx_thresh': 19.440261993513463, 'atr_min_pct': 0.013144179634506765, 'atr_max_pct': 0.1305097281193067, 'tp_mult': 2.191718361114729, 'tsl_mult': 0.059015121507993096, 'strategy': 'mean_reversion', 'time_stop': 42, 'use_sma': True, 'use_atr': True, 'use_adx': False, 'use_ema': False, 'use_spike': True, 'rsi_required': True, 'edge_k': 1.6398363864204524, 'edge_cap': 0.4777682269335335, 'bull_strategy': 'mean_reversion', 'bull_bb_std_mult': 0.684282852653787, 'bull_rsi_os': 29, 'bull_rsi_ob': 73, 'bull_adx_thresh': 26.03251095137205, 'bull_atr_min_pct': 0.002085095595716642, 'bull_atr_max_pct': 0.10475566683266785, 'bull_tp_mult': 2.2319016801189333, 'bull_tsl_mult': 0.023928933166654787, 'bull_time_stop': 47, 'bull_use_sma': True, 'bull_use_ema': True, 'bull_use_atr': False, 'bull_use_adx': True, 'bull_use_spike': True, 'bull_rsi_required': True, 'bear_strategy': 'breakout', 'bear_bb_std_mult': 3.19608058305596, 'bear_rsi_os': 42, 'bear_rsi_ob': 83, 'bear_adx_thresh': 8.609430683746563, 'bear_atr_min_pct': 0.014872624220718538, 'bear_atr_max_pct': 0.02513250880724044, 'bear_tp_mult': 1.7225701258937116, 'bear_tsl_mult': 0.1444297723441398, 'bear_time_stop': 16, 'bear_use_sma': False, 'bear_use_ema': False, 'bear_use_atr': True, 'bear_use_adx': True, 'bear_use_spike': False, 'bear_rsi_required': False, 'sideways_strategy': 'breakout', 'sideways_bb_std_mult': 2.825418408931695, 'sideways_rsi_os': 17, 'sideways_rsi_ob': 58, 'sideways_adx_thresh': 22.95381002794459, 'sideways_atr_min_pct': 0.018349735687958, 'sideways_atr_max_pct': 0.11965710831690557, 'sideways_tp_mult': 1.8479813113439367, 'sideways_tsl_mult': 0.7376623495127378, 'sideways_time_stop': 118, 'sideways_use_sma': True, 'sideways_use_ema': True, 'sideways_use_atr': False, 'sideways_use_adx': False, 'sideways_use_spike': True, 'sideways_rsi_required': False}.
[I 2025-08-30 19:59:32,286] Trial 634 finished with values: [-1000000000.0, 1000000000.0] and parameters: {'p_sma': 41, 'p_std': 27, 'p_atr': 16, 'p_adx': 12, 'rsi_period': 26, 'ema1': 25, 'ema2': 15, 'slip_atr_k': 0.09624681167211341, 'slip_spread_k': 0.1983893268444653, 'spread_hl_frac': 0.0285520990726199, 'bb_std_mult': 2.5954784574061103, 'rsi_os': 9, 'rsi_ob': 57, 'vol_spike': 0.1775837564361116, 'adx_thresh': 33.725574798484466, 'atr_min_pct': 0.014417739849971573, 'atr_max_pct': 0.1428353656601564, 'tp_mult': 2.2554754667228205, 'tsl_mult': 0.08232122461393421, 'strategy': 'breakout', 'time_stop': 184, 'use_sma': False, 'use_atr': True, 'use_adx': False, 'use_ema': False, 'use_spike': True, 'rsi_required': True, 'edge_k': 1.326106856719364, 'edge_cap': 0.4710293514186133, 'bull_strategy': 'mean_reversion', 'bull_bb_std_mult': 1.4300693988548292, 'bull_rsi_os': 48, 'bull_rsi_ob': 70, 'bull_adx_thresh': 27.5329424469408, 'bull_atr_min_pct': 0.02466626395491037, 'bull_atr_max_pct': 0.018151382767881686, 'bull_tp_mult': 2.20996048746409, 'bull_tsl_mult': 0.5668794960951902, 'bull_time_stop': 197, 'bull_use_sma': True, 'bull_use_ema': False, 'bull_use_atr': False, 'bull_use_adx': True, 'bull_use_spike': True, 'bull_rsi_required': True, 'bear_strategy': 'breakout', 'bear_bb_std_mult': 3.2946521320324083, 'bear_rsi_os': 43, 'bear_rsi_ob': 70, 'bear_adx_thresh': 31.0506260048986, 'bear_atr_min_pct': 0.023029915972049758, 'bear_atr_max_pct': 0.03207561419311508, 'bear_tp_mult': 1.715451568701652, 'bear_tsl_mult': 0.469756656336209, 'bear_time_stop': 196, 'bear_use_sma': True, 'bear_use_ema': False, 'bear_use_atr': True, 'bear_use_adx': True, 'bear_use_spike': False, 'bear_rsi_required': False, 'sideways_strategy': 'breakout', 'sideways_bb_std_mult': 2.827893568757032, 'sideways_rsi_os': 31, 'sideways_rsi_ob': 59, 'sideways_adx_thresh': 22.154283507265006, 'sideways_atr_min_pct': 0.013128078319280739, 'sideways_atr_max_pct': 0.11975854550109011, 'sideways_tp_mult': 1.3925011179543212, 'sideways_tsl_mult': 0.18111848015589704, 'sideways_time_stop': 63, 'sideways_use_sma': True, 'sideways_use_ema': True, 'sideways_use_atr': False, 'sideways_use_adx': False, 'sideways_use_spike': False, 'sideways_rsi_required': False}.
[I 2025-08-30 20:00:08,443] Trial 636 finished with values: [-1000000000.0, 1000000000.0] and parameters: {'p_sma': 42, 'p_std': 35, 'p_atr': 11, 'p_adx': 20, 'rsi_period': 38, 'ema1': 24, 'ema2': 15, 'slip_atr_k': 0.03405570444123314, 'slip_spread_k': 0.7937807380375164, 'spread_hl_frac': 0.03778932754728968, 'bb_std_mult': 2.582600220330578, 'rsi_os': 41, 'rsi_ob': 57, 'vol_spike': 0.1872866275549591, 'adx_thresh': 16.32579851584983, 'atr_min_pct': 0.013175995330549755, 'atr_max_pct': 0.12978379134233778, 'tp_mult': 2.2753131975166134, 'tsl_mult': 0.056575712806173906, 'strategy': 'mean_reversion', 'time_stop': 221, 'use_sma': True, 'use_atr': True, 'use_adx': False, 'use_ema': False, 'use_spike': True, 'rsi_required': True, 'edge_k': 0.1120464241170297, 'edge_cap': 0.35899699994374273, 'bull_strategy': 'mean_reversion', 'bull_bb_std_mult': 3.162306460251795, 'bull_rsi_os': 40, 'bull_rsi_ob': 73, 'bull_adx_thresh': 25.81421207943685, 'bull_atr_min_pct': 0.026303707431565196, 'bull_atr_max_pct': 0.03181992446603092, 'bull_tp_mult': 2.0377557442213954, 'bull_tsl_mult': 0.32556795710405534, 'bull_time_stop': 90, 'bull_use_sma': True, 'bull_use_ema': False, 'bull_use_atr': False, 'bull_use_adx': True, 'bull_use_spike': False, 'bull_rsi_required': True, 'bear_strategy': 'mean_reversion', 'bear_bb_std_mult': 3.424189764210772, 'bear_rsi_os': 43, 'bear_rsi_ob': 79, 'bear_adx_thresh': 5.512731276062837, 'bear_atr_min_pct': 0.003215449625027393, 'bear_atr_max_pct': 0.12183793298459572, 'bear_tp_mult': 1.7171925306585423, 'bear_tsl_mult': 0.010747259297500256, 'bear_time_stop': 16, 'bear_use_sma': True, 'bear_use_ema': False, 'bear_use_atr': True, 'bear_use_adx': True, 'bear_use_spike': False, 'bear_rsi_required': False, 'sideways_strategy': 'breakout', 'sideways_bb_std_mult': 2.0307387468205, 'sideways_rsi_os': 36, 'sideways_rsi_ob': 46, 'sideways_adx_thresh': 11.822387784068162, 'sideways_atr_min_pct': 0.018115681707759755, 'sideways_atr_max_pct': 0.11656056678861876, 'sideways_tp_mult': 2.3400210597753826, 'sideways_tsl_mult': 0.3759931180927566, 'sideways_time_stop': 64, 'sideways_use_sma': True, 'sideways_use_ema': True, 'sideways_use_atr': False, 'sideways_use_adx': False, 'sideways_use_spike': False, 'sideways_rsi_required': False}.
[I 2025-08-30 20:00:08,474] Trial 637 finished with values: [-1000000000.0, 1000000000.0] and parameters: {'p_sma': 42, 'p_std': 29, 'p_atr': 11, 'p_adx': 20, 'rsi_period': 52, 'ema1': 17, 'ema2': 31, 'slip_atr_k': 0.12831507686580945, 'slip_spread_k': 0.9643076332984293, 'spread_hl_frac': 0.024179427794953655, 'bb_std_mult': 2.5220051750140313, 'rsi_os': 55, 'rsi_ob': 88, 'vol_spike': 0.18322784484063614, 'adx_thresh': 30.69886019808109, 'atr_min_pct': 0.010714629457162438, 'atr_max_pct': 0.1371639737915916, 'tp_mult': 2.266117146828127, 'tsl_mult': 0.9671983976386243, 'strategy': 'breakout', 'time_stop': 130, 'use_sma': False, 'use_atr': True, 'use_adx': False, 'use_ema': False, 'use_spike': True, 'rsi_required': True, 'edge_k': 0.22883072194416632, 'edge_cap': 0.3535136234877573, 'bull_strategy': 'mean_reversion', 'bull_bb_std_mult': 2.125837449371782, 'bull_rsi_os': 54, 'bull_rsi_ob': 73, 'bull_adx_thresh': 30.01208047327186, 'bull_atr_min_pct': 0.0030741957389791258, 'bull_atr_max_pct': 0.023848755536281147, 'bull_tp_mult': 1.4034121759640885, 'bull_tsl_mult': 0.9704211941629688, 'bull_time_stop': 198, 'bull_use_sma': True, 'bull_use_ema': False, 'bull_use_atr': False, 'bull_use_adx': True, 'bull_use_spike': False, 'bull_rsi_required': True, 'bear_strategy': 'mean_reversion', 'bear_bb_std_mult': 3.020919268999962, 'bear_rsi_os': 43, 'bear_rsi_ob': 65, 'bear_adx_thresh': 17.201708784076637, 'bear_atr_min_pct': 0.014095723413318441, 'bear_atr_max_pct': 0.06335321017408627, 'bear_tp_mult': 1.810575068874986, 'bear_tsl_mult': 0.09064550846496207, 'bear_time_stop': 186, 'bear_use_sma': True, 'bear_use_ema': False, 'bear_use_atr': True, 'bear_use_adx': True, 'bear_use_spike': False, 'bear_rsi_required': False, 'sideways_strategy': 'breakout', 'sideways_bb_std_mult': 2.0439134653329165, 'sideways_rsi_os': 19, 'sideways_rsi_ob': 59, 'sideways_adx_thresh': 25.135008166431813, 'sideways_atr_min_pct': 0.02011043952497022, 'sideways_atr_max_pct': 0.12513211706195776, 'sideways_tp_mult': 2.2511642762273203, 'sideways_tsl_mult': 0.2782904531053476, 'sideways_time_stop': 129, 'sideways_use_sma': True, 'sideways_use_ema': True, 'sideways_use_atr': False, 'sideways_use_adx': False, 'sideways_use_spike': False, 'sideways_rsi_required': False}.
[I 2025-08-30 20:00:08,790] Trial 635 finished with values: [-1000000000.0, 1000000000.0] and parameters: {'p_sma': 42, 'p_std': 6, 'p_atr': 30, 'p_adx': 20, 'rsi_period': 54, 'ema1': 22, 'ema2': 31, 'slip_atr_k': 0.211529023454616, 'slip_spread_k': 0.9490066062239049, 'spread_hl_frac': 0.005859394417865287, 'bb_std_mult': 0.8253169889088919, 'rsi_os': 19, 'rsi_ob': 57, 'vol_spike': 0.034985610197380834, 'adx_thresh': 19.235823371620082, 'atr_min_pct': 0.014363368488098093, 'atr_max_pct': 0.026323842963896144, 'tp_mult': 2.2526446107302, 'tsl_mult': 0.8920611628038426, 'strategy': 'mean_reversion', 'time_stop': 40, 'use_sma': False, 'use_atr': True, 'use_adx': False, 'use_ema': False, 'use_spike': True, 'rsi_required': True, 'edge_k': 1.634873494042546, 'edge_cap': 0.9000967220072434, 'bull_strategy': 'mean_reversion', 'bull_bb_std_mult': 1.8841347684831373, 'bull_rsi_os': 51, 'bull_rsi_ob': 70, 'bull_adx_thresh': 25.0384765923517, 'bull_atr_min_pct': 0.017359408596116763, 'bull_atr_max_pct': 0.030814136399699363, 'bull_tp_mult': 1.0634741967139916, 'bull_tsl_mult': 0.9739789104424293, 'bull_time_stop': 197, 'bull_use_sma': True, 'bull_use_ema': False, 'bull_use_atr': False, 'bull_use_adx': True, 'bull_use_spike': True, 'bull_rsi_required': True, 'bear_strategy': 'breakout', 'bear_bb_std_mult': 3.4262190890606425, 'bear_rsi_os': 42, 'bear_rsi_ob': 79, 'bear_adx_thresh': 6.391545154657642, 'bear_atr_min_pct': 0.0031388145012423863, 'bear_atr_max_pct': 0.12179680038659382, 'bear_tp_mult': 1.713336683088237, 'bear_tsl_mult': 0.13928179295008597, 'bear_time_stop': 184, 'bear_use_sma': True, 'bear_use_ema': False, 'bear_use_atr': True, 'bear_use_adx': True, 'bear_use_spike': False, 'bear_rsi_required': False, 'sideways_strategy': 'breakout', 'sideways_bb_std_mult': 2.0563647544916726, 'sideways_rsi_os': 19, 'sideways_rsi_ob': 58, 'sideways_adx_thresh': 34.98630724381715, 'sideways_atr_min_pct': 0.020077829234812897, 'sideways_atr_max_pct': 0.1197675393126727, 'sideways_tp_mult': 1.8389951784080434, 'sideways_tsl_mult': 0.6666912996231255, 'sideways_time_stop': 251, 'sideways_use_sma': True, 'sideways_use_ema': True, 'sideways_use_atr': False, 'sideways_use_adx': False, 'sideways_use_spike': False, 'sideways_rsi_required': False}.
[I 2025-08-30 20:00:08,902] Trial 638 finished with values: [-1000000000.0, 1000000000.0] and parameters: {'p_sma': 42, 'p_std': 29, 'p_atr': 11, 'p_adx': 13, 'rsi_period': 52, 'ema1': 24, 'ema2': 33, 'slip_atr_k': 0.0644898539915146, 'slip_spread_k': 0.41917926467968775, 'spread_hl_frac': 0.013685527705263706, 'bb_std_mult': 0.8125012195780684, 'rsi_os': 49, 'rsi_ob': 53, 'vol_spike': 0.15549431940248767, 'adx_thresh': 30.690945510651336, 'atr_min_pct': 0.0018130023605666679, 'atr_max_pct': 0.13558698052939072, 'tp_mult': 2.8439995291521756, 'tsl_mult': 0.4549501768198091, 'strategy': 'breakout', 'time_stop': 272, 'use_sma': False, 'use_atr': True, 'use_adx': False, 'use_ema': False, 'use_spike': True, 'rsi_required': True, 'edge_k': 0.2308539612736502, 'edge_cap': 0.18666978823459074, 'bull_strategy': 'mean_reversion', 'bull_bb_std_mult': 2.1294715216555655, 'bull_rsi_os': 50, 'bull_rsi_ob': 73, 'bull_adx_thresh': 25.870482465880233, 'bull_atr_min_pct': 0.02125646787067369, 'bull_atr_max_pct': 0.03076919067062511, 'bull_tp_mult': 2.1474748577498706, 'bull_tsl_mult': 0.31557964086107987, 'bull_time_stop': 90, 'bull_use_sma': False, 'bull_use_ema': False, 'bull_use_atr': False, 'bull_use_adx': True, 'bull_use_spike': False, 'bull_rsi_required': True, 'bear_strategy': 'mean_reversion', 'bear_bb_std_mult': 3.4276417777828323, 'bear_rsi_os': 24, 'bear_rsi_ob': 82, 'bear_adx_thresh': 17.227642804583333, 'bear_atr_min_pct': 0.0030794600120435285, 'bear_atr_max_pct': 0.10832768460229637, 'bear_tp_mult': 1.8088390727757817, 'bear_tsl_mult': 0.09716788829557343, 'bear_time_stop': 269, 'bear_use_sma': True, 'bear_use_ema': False, 'bear_use_atr': True, 'bear_use_adx': True, 'bear_use_spike': False, 'bear_rsi_required': False, 'sideways_strategy': 'breakout', 'sideways_bb_std_mult': 2.0410494779191044, 'sideways_rsi_os': 33, 'sideways_rsi_ob': 57, 'sideways_adx_thresh': 25.12508929150446, 'sideways_atr_min_pct': 0.006502388790295117, 'sideways_atr_max_pct': 0.062483318406740034, 'sideways_tp_mult': 2.1036968153136923, 'sideways_tsl_mult': 0.6698080323283363, 'sideways_time_stop': 31, 'sideways_use_sma': True, 'sideways_use_ema': True, 'sideways_use_atr': False, 'sideways_use_adx': True, 'sideways_use_spike': False, 'sideways_rsi_required': False}.
