[I 2025-08-30 20:07:52,709] Trial 693 finished with values: [-1000000000.0, 1000000000.0] and parameters: {'p_sma': 40, 'p_std': 25, 'p_atr': 28, 'p_adx': 18, 'rsi_period': 49, 'ema1': 20, 'ema2': 59, 'slip_atr_k': 0.02758360379541125, 'slip_spread_k': 0.11997663258841601, 'spread_hl_frac': 0.0030603995564436708, 'bb_std_mult': 1.0514097036111707, 'rsi_os': 41, 'rsi_ob': 67, 'vol_spike': 0.04175739753537133, 'adx_thresh': 18.212262152199916, 'atr_min_pct': 0.020677717766720026, 'atr_max_pct': 0.13230053726628055, 'tp_mult': 2.110068700143963, 'tsl_mult': 0.8667728617844517, 'strategy': 'breakout', 'time_stop': 34, 'use_sma': True, 'use_atr': False, 'use_adx': False, 'use_ema': True, 'use_spike': False, 'rsi_required': True, 'edge_k': 0.14860508319531562, 'edge_cap': 0.2505959551002537, 'bull_strategy': 'breakout', 'bull_bb_std_mult': 1.894089421691162, 'bull_rsi_os': 51, 'bull_rsi_ob': 52, 'bull_adx_thresh': 32.91629394367206, 'bull_atr_min_pct': 0.0012953616969532573, 'bull_atr_max_pct': 0.027023981370440688, 'bull_tp_mult': 1.1549205974749612, 'bull_tsl_mult': 0.9718881249618186, 'bull_time_stop': 248, 'bull_use_sma': True, 'bull_use_ema': False, 'bull_use_atr': False, 'bull_use_adx': True, 'bull_use_spike': True, 'bull_rsi_required': False, 'bear_strategy': 'breakout', 'bear_bb_std_mult': 3.247507209213108, 'bear_rsi_os': 11, 'bear_rsi_ob': 86, 'bear_adx_thresh': 7.4596232177849515, 'bear_atr_min_pct': 0.014610493568505722, 'bear_atr_max_pct': 0.06596309713822152, 'bear_tp_mult': 1.85513082093712, 'bear_tsl_mult': 0.04760380723861421, 'bear_time_stop': 40, 'bear_use_sma': True, 'bear_use_ema': True, 'bear_use_atr': False, 'bear_use_adx': False, 'bear_use_spike': False, 'bear_rsi_required': False, 'sideways_strategy': 'breakout', 'sideways_bb_std_mult': 1.2200676004189237, 'sideways_rsi_os': 16, 'sideways_rsi_ob': 55, 'sideways_adx_thresh': 12.276091865764963, 'sideways_atr_min_pct': 0.016736243135924093, 'sideways_atr_max_pct': 0.129694409439905, 'sideways_tp_mult': 1.8318739398462631, 'sideways_tsl_mult': 0.11329235965462658, 'sideways_time_stop': 290, 'sideways_use_sma': False, 'sideways_use_ema': True, 'sideways_use_atr': False, 'sideways_use_adx': False, 'sideways_use_spike': False, 'sideways_rsi_required': True}.
[I 2025-08-30 20:08:25,603] Trial 694 finished with values: [-0.020787816324638886, 0.020715227089293377] and parameters: {'p_sma': 21, 'p_std': 26, 'p_atr': 25, 'p_adx': 9, 'rsi_period': 49, 'ema1': 22, 'ema2': 16, 'slip_atr_k': 0.028263882173443416, 'slip_spread_k': 0.40684747808299726, 'spread_hl_frac': 0.0031521252611231977, 'bb_std_mult': 0.7804980564409907, 'rsi_os': 35, 'rsi_ob': 63, 'vol_spike': 0.04010674193981639, 'adx_thresh': 19.241394744135043, 'atr_min_pct': 0.01989467665917428, 'atr_max_pct': 0.13614263374937227, 'tp_mult': 2.1215682014390467, 'tsl_mult': 0.7413469265984747, 'strategy': 'breakout', 'time_stop': 19, 'use_sma': True, 'use_atr': True, 'use_adx': True, 'use_ema': True, 'use_spike': False, 'rsi_required': True, 'edge_k': 1.0052477929289232, 'edge_cap': 0.9986135249417705, 'bull_strategy': 'mean_reversion', 'bull_bb_std_mult': 2.5544924627750247, 'bull_rsi_os': 41, 'bull_rsi_ob': 58, 'bull_adx_thresh': 25.367222231231178, 'bull_atr_min_pct': 0.0012728055803345603, 'bull_atr_max_pct': 0.1307558773481788, 'bull_tp_mult': 2.0640874707964203, 'bull_tsl_mult': 0.9685562078791666, 'bull_time_stop': 178, 'bull_use_sma': True, 'bull_use_ema': False, 'bull_use_atr': False, 'bull_use_adx': True, 'bull_use_spike': True, 'bull_rsi_required': False, 'bear_strategy': 'breakout', 'bear_bb_std_mult': 2.961883073328779, 'bear_rsi_os': 30, 'bear_rsi_ob': 86, 'bear_adx_thresh': 16.365585415571722, 'bear_atr_min_pct': 0.014535819061610462, 'bear_atr_max_pct': 0.11809321823549757, 'bear_tp_mult': 1.8566238120669847, 'bear_tsl_mult': 0.054520033324021444, 'bear_time_stop': 41, 'bear_use_sma': True, 'bear_use_ema': True, 'bear_use_atr': True, 'bear_use_adx': True, 'bear_use_spike': False, 'bear_rsi_required': True, 'sideways_strategy': 'mean_reversion', 'sideways_bb_std_mult': 0.5011223602804364, 'sideways_rsi_os': 16, 'sideways_rsi_ob': 56, 'sideways_adx_thresh': 22.53678825507321, 'sideways_atr_min_pct': 0.010838588291925567, 'sideways_atr_max_pct': 0.12294636995453251, 'sideways_tp_mult': 1.7866186411550926, 'sideways_tsl_mult': 0.7429033532206252, 'sideways_time_stop': 267, 'sideways_use_sma': True, 'sideways_use_ema': False, 'sideways_use_atr': False, 'sideways_use_adx': False, 'sideways_use_spike': False, 'sideways_rsi_required': False}.
[I 2025-08-30 20:08:25,897] Trial 696 finished with values: [-1000000000.0, 1000000000.0] and parameters: {'p_sma': 40, 'p_std': 40, 'p_atr': 19, 'p_adx': 9, 'rsi_period': 44, 'ema1': 22, 'ema2': 17, 'slip_atr_k': 0.028045996038745663, 'slip_spread_k': 0.11189825140957305, 'spread_hl_frac': 0.002264810675505258, 'bb_std_mult': 3.2529876218391784, 'rsi_os': 41, 'rsi_ob': 53, 'vol_spike': 0.03572911848829155, 'adx_thresh': 20.052392708894875, 'atr_min_pct': 0.007636744496259609, 'atr_max_pct': 0.13702818855950594, 'tp_mult': 1.3629790132409187, 'tsl_mult': 0.41861065054668073, 'strategy': 'breakout', 'time_stop': 238, 'use_sma': False, 'use_atr': True, 'use_adx': True, 'use_ema': False, 'use_spike': True, 'rsi_required': False, 'edge_k': 0.16624359006582487, 'edge_cap': 0.2674564203355371, 'bull_strategy': 'mean_reversion', 'bull_bb_std_mult': 1.304267737245353, 'bull_rsi_os': 17, 'bull_rsi_ob': 93, 'bull_adx_thresh': 25.329889187893304, 'bull_atr_min_pct': 0.005739145253293474, 'bull_atr_max_pct': 0.08516301242325514, 'bull_tp_mult': 2.0537922834972044, 'bull_tsl_mult': 0.68424199907501, 'bull_time_stop': 191, 'bull_use_sma': False, 'bull_use_ema': False, 'bull_use_atr': True, 'bull_use_adx': False, 'bull_use_spike': True, 'bull_rsi_required': True, 'bear_strategy': 'breakout', 'bear_bb_std_mult': 2.975951542593476, 'bear_rsi_os': 47, 'bear_rsi_ob': 80, 'bear_adx_thresh': 20.593342604450406, 'bear_atr_min_pct': 0.015249859969615583, 'bear_atr_max_pct': 0.06668249349882521, 'bear_tp_mult': 1.9113970982808826, 'bear_tsl_mult': 0.5956895447976179, 'bear_time_stop': 273, 'bear_use_sma': True, 'bear_use_ema': False, 'bear_use_atr': True, 'bear_use_adx': True, 'bear_use_spike': True, 'bear_rsi_required': True, 'sideways_strategy': 'mean_reversion', 'sideways_bb_std_mult': 1.8661358397839767, 'sideways_rsi_os': 19, 'sideways_rsi_ob': 56, 'sideways_adx_thresh': 22.5200107789008, 'sideways_atr_min_pct': 0.02307155757436406, 'sideways_atr_max_pct': 0.12361365404643591, 'sideways_tp_mult': 1.7245517390057374, 'sideways_tsl_mult': 0.7382762315408291, 'sideways_time_stop': 290, 'sideways_use_sma': True, 'sideways_use_ema': False, 'sideways_use_atr': True, 'sideways_use_adx': True, 'sideways_use_spike': False, 'sideways_rsi_required': False}.
[I 2025-08-30 20:08:26,221] Trial 695 finished with values: [-1000000000.0, 1000000000.0] and parameters: {'p_sma': 40, 'p_std': 20, 'p_atr': 21, 'p_adx': 9, 'rsi_period': 24, 'ema1': 24, 'ema2': 15, 'slip_atr_k': 0.026312162709930694, 'slip_spread_k': 0.933474552624413, 'spread_hl_frac': 0.030394233635747052, 'bb_std_mult': 3.2435226332774203, 'rsi_os': 41, 'rsi_ob': 53, 'vol_spike': 0.29815059617158557, 'adx_thresh': 19.328162573351086, 'atr_min_pct': 0.02025345618493802, 'atr_max_pct': 0.13094204432185724, 'tp_mult': 1.6241715489047759, 'tsl_mult': 0.9077173776306099, 'strategy': 'breakout', 'time_stop': 17, 'use_sma': False, 'use_atr': True, 'use_adx': True, 'use_ema': True, 'use_spike': False, 'rsi_required': False, 'edge_k': 0.16956777424523445, 'edge_cap': 0.2012526946242798, 'bull_strategy': 'mean_reversion', 'bull_bb_std_mult': 1.9215083611082682, 'bull_rsi_os': 30, 'bull_rsi_ob': 58, 'bull_adx_thresh': 22.82747683541886, 'bull_atr_min_pct': 0.00966798571177733, 'bull_atr_max_pct': 0.026629643118719907, 'bull_tp_mult': 1.090018101138429, 'bull_tsl_mult': 0.35973885757704105, 'bull_time_stop': 209, 'bull_use_sma': False, 'bull_use_ema': False, 'bull_use_atr': True, 'bull_use_adx': False, 'bull_use_spike': True, 'bull_rsi_required': False, 'bear_strategy': 'breakout', 'bear_bb_std_mult': 1.5276122195085247, 'bear_rsi_os': 53, 'bear_rsi_ob': 81, 'bear_adx_thresh': 20.622766014064403, 'bear_atr_min_pct': 0.01515321989928291, 'bear_atr_max_pct': 0.09025034250082568, 'bear_tp_mult': 1.0430131430044558, 'bear_tsl_mult': 0.614881328292185, 'bear_time_stop': 223, 'bear_use_sma': True, 'bear_use_ema': True, 'bear_use_atr': True, 'bear_use_adx': True, 'bear_use_spike': True, 'bear_rsi_required': True, 'sideways_strategy': 'mean_reversion', 'sideways_bb_std_mult': 3.388187375420641, 'sideways_rsi_os': 19, 'sideways_rsi_ob': 56, 'sideways_adx_thresh': 28.13272431956844, 'sideways_atr_min_pct': 0.010660435200146747, 'sideways_atr_max_pct': 0.11374799514491385, 'sideways_tp_mult': 1.7818011911218494, 'sideways_tsl_mult': 0.7354390246997634, 'sideways_time_stop': 267, 'sideways_use_sma': True, 'sideways_use_ema': False, 'sideways_use_atr': True, 'sideways_use_adx': True, 'sideways_use_spike': False, 'sideways_rsi_required': False}.
[I 2025-08-30 20:08:26,365] Trial 697 finished with values: [-1000000000.0, 1000000000.0] and parameters: {'p_sma': 9, 'p_std': 41, 'p_atr': 9, 'p_adx': 7, 'rsi_period': 45, 'ema1': 21, 'ema2': 16, 'slip_atr_k': 0.20478936913333629, 'slip_spread_k': 0.24429226641632484, 'spread_hl_frac': 0.027508995928874305, 'bb_std_mult': 3.226890715746681, 'rsi_os': 37, 'rsi_ob': 59, 'vol_spike': 0.03591352774580547, 'adx_thresh': 32.24380897134458, 'atr_min_pct': 0.023399786410632395, 'atr_max_pct': 0.1368310130234548, 'tp_mult': 1.617555977435429, 'tsl_mult': 0.7189911496934431, 'strategy': 'breakout', 'time_stop': 18, 'use_sma': False, 'use_atr': True, 'use_adx': True, 'use_ema': False, 'use_spike': True, 'rsi_required': False, 'edge_k': 0.17502600560167927, 'edge_cap': 0.6005901267230911, 'bull_strategy': 'mean_reversion', 'bull_bb_std_mult': 1.7326957018556834, 'bull_rsi_os': 14, 'bull_rsi_ob': 72, 'bull_adx_thresh': 25.09300751305256, 'bull_atr_min_pct': 0.008899973432409537, 'bull_atr_max_pct': 0.13171208853297728, 'bull_tp_mult': 2.08928636841623, 'bull_tsl_mult': 0.5563143867854199, 'bull_time_stop': 211, 'bull_use_sma': False, 'bull_use_ema': False, 'bull_use_atr': True, 'bull_use_adx': False, 'bull_use_spike': True, 'bull_rsi_required': True, 'bear_strategy': 'breakout', 'bear_bb_std_mult': 2.960435050973337, 'bear_rsi_os': 47, 'bear_rsi_ob': 80, 'bear_adx_thresh': 5.018124327417468, 'bear_atr_min_pct': 0.015076784279554657, 'bear_atr_max_pct': 0.0544983987775165, 'bear_tp_mult': 1.0608808721777672, 'bear_tsl_mult': 0.15342861248830258, 'bear_time_stop': 28, 'bear_use_sma': True, 'bear_use_ema': False, 'bear_use_atr': True, 'bear_use_adx': True, 'bear_use_spike': True, 'bear_rsi_required': True, 'sideways_strategy': 'mean_reversion', 'sideways_bb_std_mult': 3.470879971331531, 'sideways_rsi_os': 36, 'sideways_rsi_ob': 79, 'sideways_adx_thresh': 17.99073181854953, 'sideways_atr_min_pct': 0.020635144652262797, 'sideways_atr_max_pct': 0.10205782980292602, 'sideways_tp_mult': 1.7308162744230138, 'sideways_tsl_mult': 0.7410995645552808, 'sideways_time_stop': 18, 'sideways_use_sma': True, 'sideways_use_ema': False, 'sideways_use_atr': True, 'sideways_use_adx': True, 'sideways_use_spike': False, 'sideways_rsi_required': False}.
[I 2025-08-30 20:08:59,696] Trial 698 finished with values: [-1000000000.0, 1000000000.0] and parameters: {'p_sma': 39, 'p_std': 38, 'p_atr': 18, 'p_adx': 17, 'rsi_period': 35, 'ema1': 11, 'ema2': 13, 'slip_atr_k': 0.1255651841278841, 'slip_spread_k': 0.4018786524518359, 'spread_hl_frac': 0.04601622065676357, 'bb_std_mult': 1.3262375912164583, 'rsi_os': 37, 'rsi_ob': 51, 'vol_spike': 0.0344741071310089, 'adx_thresh': 13.331032892408642, 'atr_min_pct': 0.0077566828344840695, 'atr_max_pct': 0.1379143681258181, 'tp_mult': 1.6196620115177323, 'tsl_mult': 0.7813604016859923, 'strategy': 'breakout', 'time_stop': 239, 'use_sma': False, 'use_atr': True, 'use_adx': True, 'use_ema': False, 'use_spike': True, 'rsi_required': False, 'edge_k': 1.4347940602227405, 'edge_cap': 0.9654277477317699, 'bull_strategy': 'mean_reversion', 'bull_bb_std_mult': 1.7152597891602388, 'bull_rsi_os': 29, 'bull_rsi_ob': 71, 'bull_adx_thresh': 25.018932816486092, 'bull_atr_min_pct': 0.0024189575824016553, 'bull_atr_max_pct': 0.01919450571931819, 'bull_tp_mult': 2.090012867596493, 'bull_tsl_mult': 0.3631305142801234, 'bull_time_stop': 190, 'bull_use_sma': False, 'bull_use_ema': False, 'bull_use_atr': True, 'bull_use_adx': False, 'bull_use_spike': True, 'bull_rsi_required': True, 'bear_strategy': 'breakout', 'bear_bb_std_mult': 3.3703584827476227, 'bear_rsi_os': 39, 'bear_rsi_ob': 62, 'bear_adx_thresh': 5.536989728658259, 'bear_atr_min_pct': 0.005908533233695308, 'bear_atr_max_pct': 0.1298929746349571, 'bear_tp_mult': 1.0616408340008667, 'bear_tsl_mult': 0.1489637487863115, 'bear_time_stop': 50, 'bear_use_sma': True, 'bear_use_ema': False, 'bear_use_atr': True, 'bear_use_adx': True, 'bear_use_spike': True, 'bear_rsi_required': True, 'sideways_strategy': 'mean_reversion', 'sideways_bb_std_mult': 1.8953058615012692, 'sideways_rsi_os': 46, 'sideways_rsi_ob': 68, 'sideways_adx_thresh': 9.297044365664568, 'sideways_atr_min_pct': 0.022961545209629522, 'sideways_atr_max_pct': 0.11936686180409084, 'sideways_tp_mult': 1.7250560112300963, 'sideways_tsl_mult': 0.47347293007598806, 'sideways_time_stop': 135, 'sideways_use_sma': True, 'sideways_use_ema': False, 'sideways_use_atr': True, 'sideways_use_adx': True, 'sideways_use_spike': False, 'sideways_rsi_required': False}.
[I 2025-08-30 20:09:00,523] Trial 700 finished with values: [-0.02360777659372182, 0.02357325722052031] and parameters: {'p_sma': 42, 'p_std': 38, 'p_atr': 9, 'p_adx': 7, 'rsi_period': 51, 'ema1': 23, 'ema2': 32, 'slip_atr_k': 0.18094547313438417, 'slip_spread_k': 0.4472545420423254, 'spread_hl_frac': 0.023437420457001337, 'bb_std_mult': 2.102111444626493, 'rsi_os': 37, 'rsi_ob': 59, 'vol_spike': 0.01391974050978792, 'adx_thresh': 31.829855528471455, 'atr_min_pct': 0.02500345752158867, 'atr_max_pct': 0.13898330088886432, 'tp_mult': 2.366071258828629, 'tsl_mult': 0.7773687330316525, 'strategy': 'breakout', 'time_stop': 45, 'use_sma': False, 'use_atr': True, 'use_adx': False, 'use_ema': False, 'use_spike': True, 'rsi_required': True, 'edge_k': 0.21093697171433762, 'edge_cap': 0.803787969823438, 'bull_strategy': 'mean_reversion', 'bull_bb_std_mult': 1.7267314233258468, 'bull_rsi_os': 48, 'bull_rsi_ob': 71, 'bull_adx_thresh': 6.781085503651489, 'bull_atr_min_pct': 0.0019814437930157623, 'bull_atr_max_pct': 0.10723484630802209, 'bull_tp_mult': 2.0971326409787583, 'bull_tsl_mult': 0.9826027124123144, 'bull_time_stop': 182, 'bull_use_sma': True, 'bull_use_ema': False, 'bull_use_atr': False, 'bull_use_adx': True, 'bull_use_spike': True, 'bull_rsi_required': True, 'bear_strategy': 'breakout', 'bear_bb_std_mult': 3.3590129040327037, 'bear_rsi_os': 7, 'bear_rsi_ob': 50, 'bear_adx_thresh': 5.37895307646379, 'bear_atr_min_pct': 0.018866072573291624, 'bear_atr_max_pct': 0.10536286909565515, 'bear_tp_mult': 1.176147161644516, 'bear_tsl_mult': 0.4189380535507281, 'bear_time_stop': 27, 'bear_use_sma': True, 'bear_use_ema': False, 'bear_use_atr': True, 'bear_use_adx': True, 'bear_use_spike': False, 'bear_rsi_required': False, 'sideways_strategy': 'breakout', 'sideways_bb_std_mult': 2.0926020833183907, 'sideways_rsi_os': 15, 'sideways_rsi_ob': 69, 'sideways_adx_thresh': 9.288593350833086, 'sideways_atr_min_pct': 0.012835893040480275, 'sideways_atr_max_pct': 0.11696080842748088, 'sideways_tp_mult': 2.766022815308919, 'sideways_tsl_mult': 0.9287322457360843, 'sideways_time_stop': 249, 'sideways_use_sma': True, 'sideways_use_ema': True, 'sideways_use_atr': False, 'sideways_use_adx': False, 'sideways_use_spike': False, 'sideways_rsi_required': False}.
[I 2025-08-30 20:09:00,701] Trial 699 finished with values: [-1000000000.0, 1000000000.0] and parameters: {'p_sma': 42, 'p_std': 38, 'p_atr': 18, 'p_adx': 15, 'rsi_period': 51, 'ema1': 8, 'ema2': 13, 'slip_atr_k': 0.019305580677013046, 'slip_spread_k': 0.0006878735912108636, 'spread_hl_frac': 0.004323268894675933, 'bb_std_mult': 0.9844335493248937, 'rsi_os': 37, 'rsi_ob': 59, 'vol_spike': 0.2811531024029848, 'adx_thresh': 32.704345495401604, 'atr_min_pct': 0.006243087779528211, 'atr_max_pct': 0.13164808823595064, 'tp_mult': 2.1926569489109347, 'tsl_mult': 0.7053048494070326, 'strategy': 'breakout', 'time_stop': 45, 'use_sma': False, 'use_atr': True, 'use_adx': False, 'use_ema': False, 'use_spike': True, 'rsi_required': False, 'edge_k': 0.801524522759913, 'edge_cap': 0.9758594706289494, 'bull_strategy': 'mean_reversion', 'bull_bb_std_mult': 1.7422986169947408, 'bull_rsi_os': 30, 'bull_rsi_ob': 71, 'bull_adx_thresh': 24.81180283801637, 'bull_atr_min_pct': 0.0019406889048175376, 'bull_atr_max_pct': 0.019654972552937067, 'bull_tp_mult': 2.0955732822335, 'bull_tsl_mult': 0.3601700657304997, 'bull_time_stop': 300, 'bull_use_sma': False, 'bull_use_ema': False, 'bull_use_atr': True, 'bull_use_adx': False, 'bull_use_spike': True, 'bull_rsi_required': True, 'bear_strategy': 'breakout', 'bear_bb_std_mult': 3.36439976028286, 'bear_rsi_os': 8, 'bear_rsi_ob': 60, 'bear_adx_thresh': 27.29079414597954, 'bear_atr_min_pct': 0.015306052965600675, 'bear_atr_max_pct': 0.010016771338863154, 'bear_tp_mult': 2.1103295680983902, 'bear_tsl_mult': 0.4215004222648059, 'bear_time_stop': 238, 'bear_use_sma': True, 'bear_use_ema': False, 'bear_use_atr': True, 'bear_use_adx': True, 'bear_use_spike': True, 'bear_rsi_required': False, 'sideways_strategy': 'breakout', 'sideways_bb_std_mult': 1.331035151381192, 'sideways_rsi_os': 35, 'sideways_rsi_ob': 68, 'sideways_adx_thresh': 9.457773977291028, 'sideways_atr_min_pct': 0.017495500843197356, 'sideways_atr_max_pct': 0.11921513797370002, 'sideways_tp_mult': 1.7876541970840472, 'sideways_tsl_mult': 0.6829272598034485, 'sideways_time_stop': 132, 'sideways_use_sma': True, 'sideways_use_ema': True, 'sideways_use_atr': True, 'sideways_use_adx': True, 'sideways_use_spike': False, 'sideways_rsi_required': False}.
[I 2025-08-30 20:09:00,958] Trial 701 finished with values: [-1000000000.0, 1000000000.0] and parameters: {'p_sma': 43, 'p_std': 24, 'p_atr': 11, 'p_adx': 8, 'rsi_period': 68, 'ema1': 23, 'ema2': 12, 'slip_atr_k': 0.019781236479054807, 'slip_spread_k': 0.6407526438210884, 'spread_hl_frac': 0.004273189425955112, 'bb_std_mult': 3.1153780852710566, 'rsi_os': 37, 'rsi_ob': 55, 'vol_spike': 0.2495590258199547, 'adx_thresh': 29.04578565042746, 'atr_min_pct': 0.0013854597357444553, 'atr_max_pct': 0.04007560803268431, 'tp_mult': 2.4029301409647466, 'tsl_mult': 0.7836174511710238, 'strategy': 'breakout', 'time_stop': 196, 'use_sma': False, 'use_atr': True, 'use_adx': False, 'use_ema': False, 'use_spike': True, 'rsi_required': True, 'edge_k': 0.11070902301797872, 'edge_cap': 0.7810562148139033, 'bull_strategy': 'mean_reversion', 'bull_bb_std_mult': 1.0966697837430859, 'bull_rsi_os': 48, 'bull_rsi_ob': 71, 'bull_adx_thresh': 18.185693741530862, 'bull_atr_min_pct': 0.002215166398889725, 'bull_atr_max_pct': 0.01674689712742012, 'bull_tp_mult': 2.158402064423771, 'bull_tsl_mult': 0.1316467371496285, 'bull_time_stop': 151, 'bull_use_sma': True, 'bull_use_ema': True, 'bull_use_atr': False, 'bull_use_adx': True, 'bull_use_spike': False, 'bull_rsi_required': True, 'bear_strategy': 'mean_reversion', 'bear_bb_std_mult': 3.3811961158071395, 'bear_rsi_os': 8, 'bear_rsi_ob': 59, 'bear_adx_thresh': 6.531012197888495, 'bear_atr_min_pct': 0.012304623151337499, 'bear_atr_max_pct': 0.1409164985719167, 'bear_tp_mult': 1.1566109651903278, 'bear_tsl_mult': 0.00027065319825242407, 'bear_time_stop': 48, 'bear_use_sma': False, 'bear_use_ema': False, 'bear_use_atr': True, 'bear_use_adx': True, 'bear_use_spike': False, 'bear_rsi_required': False, 'sideways_strategy': 'breakout', 'sideways_bb_std_mult': 1.77003613419458, 'sideways_rsi_os': 55, 'sideways_rsi_ob': 59, 'sideways_adx_thresh': 9.206384961147526, 'sideways_atr_min_pct': 0.005371293181060624, 'sideways_atr_max_pct': 0.11923552082320482, 'sideways_tp_mult': 1.3590754570371029, 'sideways_tsl_mult': 0.6859806412175591, 'sideways_time_stop': 273, 'sideways_use_sma': True, 'sideways_use_ema': True, 'sideways_use_atr': False, 'sideways_use_adx': False, 'sideways_use_spike': True, 'sideways_rsi_required': False}.
