[I 2025-08-30 19:26:15,581] Trial 387 finished with values: [-1000000000.0, 1000000000.0] and parameters: {'p_sma': 43, 'p_std': 16, 'p_atr': 9, 'p_adx': 8, 'rsi_period': 47, 'ema1': 23, 'ema2': 19, 'slip_atr_k': 0.037488603803820325, 'slip_spread_k': 0.20897917677428013, 'spread_hl_frac': 0.028118608352848535, 'bb_std_mult': 1.4800768389723453, 'rsi_os': 24, 'rsi_ob': 70, 'vol_spike': 0.034228986519577564, 'adx_thresh': 11.701484996498909, 'atr_min_pct': 0.009155238805743196, 'atr_max_pct': 0.025209956027330997, 'tp_mult': 2.2746828964839847, 'tsl_mult': 0.3576341345196949, 'strategy': 'breakout', 'time_stop': 58, 'use_sma': False, 'use_atr': True, 'use_adx': False, 'use_ema': False, 'use_spike': False, 'rsi_required': True, 'edge_k': 0.19927288521461023, 'edge_cap': 0.30645316905278874, 'bull_strategy': 'breakout', 'bull_bb_std_mult': 1.7971888478343214, 'bull_rsi_os': 33, 'bull_rsi_ob': 89, 'bull_adx_thresh': 25.88470690821552, 'bull_atr_min_pct': 0.023482455042446157, 'bull_atr_max_pct': 0.05624324797809574, 'bull_tp_mult': 2.107969095662123, 'bull_tsl_mult': 0.9839901244471676, 'bull_time_stop': 216, 'bull_use_sma': True, 'bull_use_ema': False, 'bull_use_atr': False, 'bull_use_adx': True, 'bull_use_spike': True, 'bull_rsi_required': True, 'bear_strategy': 'breakout', 'bear_bb_std_mult': 0.9700630135180912, 'bear_rsi_os': 8, 'bear_rsi_ob': 83, 'bear_adx_thresh': 12.393817695017749, 'bear_atr_min_pct': 0.01808880494877377, 'bear_atr_max_pct': 0.05959833269307602, 'bear_tp_mult': 1.7735075266162, 'bear_tsl_mult': 0.012211962695032552, 'bear_time_stop': 215, 'bear_use_sma': True, 'bear_use_ema': False, 'bear_use_atr': True, 'bear_use_adx': True, 'bear_use_spike': True, 'bear_rsi_required': False, 'sideways_strategy': 'breakout', 'sideways_bb_std_mult': 1.9839187498224076, 'sideways_rsi_os': 50, 'sideways_rsi_ob': 76, 'sideways_adx_thresh': 29.236072104883362, 'sideways_atr_min_pct': 0.018477077633552965, 'sideways_atr_max_pct': 0.12290467286849513, 'sideways_tp_mult': 1.81614422569268, 'sideways_tsl_mult': 0.6495288244763544, 'sideways_time_stop': 284, 'sideways_use_sma': True, 'sideways_use_ema': True, 'sideways_use_atr': True, 'sideways_use_adx': False, 'sideways_use_spike': False, 'sideways_rsi_required': False}.
[I 2025-08-30 19:26:15,732] Trial 388 finished with values: [-1000000000.0, 1000000000.0] and parameters: {'p_sma': 43, 'p_std': 29, 'p_atr': 9, 'p_adx': 21, 'rsi_period': 43, 'ema1': 17, 'ema2': 53, 'slip_atr_k': 0.00020911737496048452, 'slip_spread_k': 0.4435820077161235, 'spread_hl_frac': 0.04914417879804847, 'bb_std_mult': 2.2750224251942046, 'rsi_os': 37, 'rsi_ob': 49, 'vol_spike': 0.09632134262589495, 'adx_thresh': 19.92296377954946, 'atr_min_pct': 0.009333372859456894, 'atr_max_pct': 0.018147407469034996, 'tp_mult': 2.2559598140167605, 'tsl_mult': 0.7466818340977059, 'strategy': 'breakout', 'time_stop': 19, 'use_sma': False, 'use_atr': True, 'use_adx': True, 'use_ema': False, 'use_spike': False, 'rsi_required': True, 'edge_k': 0.19936077989485285, 'edge_cap': 0.28992184941735016, 'bull_strategy': 'breakout', 'bull_bb_std_mult': 1.813781828293154, 'bull_rsi_os': 33, 'bull_rsi_ob': 46, 'bull_adx_thresh': 12.609518582796625, 'bull_atr_min_pct': 0.002616637102821381, 'bull_atr_max_pct': 0.02132599863978316, 'bull_tp_mult': 2.111280313598856, 'bull_tsl_mult': 0.9999993659476624, 'bull_time_stop': 191, 'bull_use_sma': True, 'bull_use_ema': False, 'bull_use_atr': False, 'bull_use_adx': False, 'bull_use_spike': True, 'bull_rsi_required': True, 'bear_strategy': 'breakout', 'bear_bb_std_mult': 1.210525080026116, 'bear_rsi_os': 45, 'bear_rsi_ob': 83, 'bear_adx_thresh': 19.603337788515134, 'bear_atr_min_pct': 0.017161744372549657, 'bear_atr_max_pct': 0.12803418663634958, 'bear_tp_mult': 1.7712733078629133, 'bear_tsl_mult': 0.0743304550596467, 'bear_time_stop': 122, 'bear_use_sma': True, 'bear_use_ema': False, 'bear_use_atr': True, 'bear_use_adx': True, 'bear_use_spike': True, 'bear_rsi_required': False, 'sideways_strategy': 'breakout', 'sideways_bb_std_mult': 1.7643415249843466, 'sideways_rsi_os': 13, 'sideways_rsi_ob': 58, 'sideways_adx_thresh': 25.88448016841852, 'sideways_atr_min_pct': 0.01990309569326912, 'sideways_atr_max_pct': 0.0321326850635393, 'sideways_tp_mult': 1.8060210968733457, 'sideways_tsl_mult': 0.6471239774372076, 'sideways_time_stop': 174, 'sideways_use_sma': True, 'sideways_use_ema': True, 'sideways_use_atr': True, 'sideways_use_adx': False, 'sideways_use_spike': False, 'sideways_rsi_required': False}.
[I 2025-08-30 19:26:16,375] Trial 389 finished with values: [-1000000000.0, 1000000000.0] and parameters: {'p_sma': 42, 'p_std': 5, 'p_atr': 9, 'p_adx': 8, 'rsi_period': 47, 'ema1': 23, 'ema2': 17, 'slip_atr_k': 0.2096151056346197, 'slip_spread_k': 0.4380357787708961, 'spread_hl_frac': 0.005455808773341624, 'bb_std_mult': 1.1256874498125649, 'rsi_os': 34, 'rsi_ob': 46, 'vol_spike': 0.03462365249061668, 'adx_thresh': 18.471867467206444, 'atr_min_pct': 0.023341468090330664, 'atr_max_pct': 0.011705241943796116, 'tp_mult': 2.258826407732084, 'tsl_mult': 0.6898888944816202, 'strategy': 'breakout', 'time_stop': 19, 'use_sma': False, 'use_atr': True, 'use_adx': False, 'use_ema': False, 'use_spike': False, 'rsi_required': True, 'edge_k': 0.1873400866566628, 'edge_cap': 0.17346396200990294, 'bull_strategy': 'breakout', 'bull_bb_std_mult': 1.8072954642806096, 'bull_rsi_os': 33, 'bull_rsi_ob': 71, 'bull_adx_thresh': 24.86114857144892, 'bull_atr_min_pct': 0.002725448874534366, 'bull_atr_max_pct': 0.06880911083512518, 'bull_tp_mult': 2.605425515162, 'bull_tsl_mult': 0.9844351447257823, 'bull_time_stop': 150, 'bull_use_sma': True, 'bull_use_ema': False, 'bull_use_atr': False, 'bull_use_adx': True, 'bull_use_spike': True, 'bull_rsi_required': True, 'bear_strategy': 'breakout', 'bear_bb_std_mult': 1.4644856686293894, 'bear_rsi_os': 45, 'bear_rsi_ob': 78, 'bear_adx_thresh': 19.489298799532005, 'bear_atr_min_pct': 0.007614812842489379, 'bear_atr_max_pct': 0.06001945844003167, 'bear_tp_mult': 1.5897898566684825, 'bear_tsl_mult': 0.08354834714201037, 'bear_time_stop': 99, 'bear_use_sma': False, 'bear_use_ema': False, 'bear_use_atr': True, 'bear_use_adx': True, 'bear_use_spike': True, 'bear_rsi_required': False, 'sideways_strategy': 'breakout', 'sideways_bb_std_mult': 1.9835279680080093, 'sideways_rsi_os': 42, 'sideways_rsi_ob': 58, 'sideways_adx_thresh': 10.744918603073053, 'sideways_atr_min_pct': 0.0008622885094222554, 'sideways_atr_max_pct': 0.12209101194253344, 'sideways_tp_mult': 1.8102321674748285, 'sideways_tsl_mult': 0.21376791179446614, 'sideways_time_stop': 290, 'sideways_use_sma': True, 'sideways_use_ema': True, 'sideways_use_atr': True, 'sideways_use_adx': False, 'sideways_use_spike': False, 'sideways_rsi_required': False}.
[I 2025-08-30 19:26:48,912] Trial 392 finished with values: [-1000000000.0, 1000000000.0] and parameters: {'p_sma': 16, 'p_std': 43, 'p_atr': 10, 'p_adx': 11, 'rsi_period': 15, 'ema1': 9, 'ema2': 17, 'slip_atr_k': 0.014008694387610016, 'slip_spread_k': 0.11405678974107147, 'spread_hl_frac': 0.04081628442620923, 'bb_std_mult': 1.1285207182867305, 'rsi_os': 37, 'rsi_ob': 75, 'vol_spike': 0.03664492114387899, 'adx_thresh': 16.9994269658294, 'atr_min_pct': 0.023571613258916053, 'atr_max_pct': 0.040949711883487575, 'tp_mult': 2.2379458282423585, 'tsl_mult': 0.04135302207051994, 'strategy': 'mean_reversion', 'time_stop': 40, 'use_sma': True, 'use_atr': True, 'use_adx': False, 'use_ema': False, 'use_spike': True, 'rsi_required': False, 'edge_k': 1.5182888428167503, 'edge_cap': 0.17633111248017275, 'bull_strategy': 'mean_reversion', 'bull_bb_std_mult': 1.9441175163014746, 'bull_rsi_os': 51, 'bull_rsi_ob': 71, 'bull_adx_thresh': 24.642646902049975, 'bull_atr_min_pct': 0.003987508281471541, 'bull_atr_max_pct': 0.06788990107639117, 'bull_tp_mult': 1.3211016571631395, 'bull_tsl_mult': 0.09869730057800807, 'bull_time_stop': 149, 'bull_use_sma': True, 'bull_use_ema': False, 'bull_use_atr': False, 'bull_use_adx': True, 'bull_use_spike': True, 'bull_rsi_required': False, 'bear_strategy': 'breakout', 'bear_bb_std_mult': 3.594968057401042, 'bear_rsi_os': 37, 'bear_rsi_ob': 78, 'bear_adx_thresh': 13.461596657375203, 'bear_atr_min_pct': 0.004586123390975243, 'bear_atr_max_pct': 0.0402118945336927, 'bear_tp_mult': 1.6586098250745882, 'bear_tsl_mult': 0.09465143670214587, 'bear_time_stop': 24, 'bear_use_sma': False, 'bear_use_ema': False, 'bear_use_atr': True, 'bear_use_adx': True, 'bear_use_spike': False, 'bear_rsi_required': False, 'sideways_strategy': 'breakout', 'sideways_bb_std_mult': 1.930346369527819, 'sideways_rsi_os': 10, 'sideways_rsi_ob': 57, 'sideways_adx_thresh': 11.053589860641793, 'sideways_atr_min_pct': 0.016526273241909122, 'sideways_atr_max_pct': 0.050588819542791735, 'sideways_tp_mult': 1.7726058449351334, 'sideways_tsl_mult': 0.7380260887526288, 'sideways_time_stop': 193, 'sideways_use_sma': True, 'sideways_use_ema': False, 'sideways_use_atr': False, 'sideways_use_adx': False, 'sideways_use_spike': False, 'sideways_rsi_required': False}.
[I 2025-08-30 19:26:51,117] Trial 391 finished with values: [-1000000000.0, 1000000000.0] and parameters: {'p_sma': 40, 'p_std': 5, 'p_atr': 16, 'p_adx': 14, 'rsi_period': 9, 'ema1': 19, 'ema2': 25, 'slip_atr_k': 0.23726079154895885, 'slip_spread_k': 0.43801834298535075, 'spread_hl_frac': 0.010802196228473896, 'bb_std_mult': 1.3747489119228513, 'rsi_os': 37, 'rsi_ob': 56, 'vol_spike': 0.036109964435363746, 'adx_thresh': 29.46441720053268, 'atr_min_pct': 0.023548041842775976, 'atr_max_pct': 0.1413062662278995, 'tp_mult': 2.23189019984339, 'tsl_mult': 0.7619057874829664, 'strategy': 'mean_reversion', 'time_stop': 41, 'use_sma': False, 'use_atr': True, 'use_adx': False, 'use_ema': False, 'use_spike': True, 'rsi_required': True, 'edge_k': 0.1954016522132674, 'edge_cap': 0.17392971036457416, 'bull_strategy': 'mean_reversion', 'bull_bb_std_mult': 2.1637521070963226, 'bull_rsi_os': 51, 'bull_rsi_ob': 71, 'bull_adx_thresh': 24.66896144075951, 'bull_atr_min_pct': 0.025858788900037823, 'bull_atr_max_pct': 0.02136202106438715, 'bull_tp_mult': 1.289222996139694, 'bull_tsl_mult': 0.2817708183904333, 'bull_time_stop': 192, 'bull_use_sma': True, 'bull_use_ema': False, 'bull_use_atr': False, 'bull_use_adx': True, 'bull_use_spike': True, 'bull_rsi_required': True, 'bear_strategy': 'breakout', 'bear_bb_std_mult': 3.066121358272154, 'bear_rsi_os': 37, 'bear_rsi_ob': 82, 'bear_adx_thresh': 7.049618527441432, 'bear_atr_min_pct': 0.012786339030557, 'bear_atr_max_pct': 0.1291225444453071, 'bear_tp_mult': 2.376879887683641, 'bear_tsl_mult': 0.08943668758996044, 'bear_time_stop': 121, 'bear_use_sma': False, 'bear_use_ema': False, 'bear_use_atr': True, 'bear_use_adx': True, 'bear_use_spike': True, 'bear_rsi_required': False, 'sideways_strategy': 'breakout', 'sideways_bb_std_mult': 1.92316737491419, 'sideways_rsi_os': 15, 'sideways_rsi_ob': 58, 'sideways_adx_thresh': 28.30143589688097, 'sideways_atr_min_pct': 0.00723232478865287, 'sideways_atr_max_pct': 0.11691160181837441, 'sideways_tp_mult': 1.796427963998137, 'sideways_tsl_mult': 0.20610807576442092, 'sideways_time_stop': 291, 'sideways_use_sma': True, 'sideways_use_ema': False, 'sideways_use_atr': True, 'sideways_use_adx': False, 'sideways_use_spike': False, 'sideways_rsi_required': False}.
[I 2025-08-30 19:26:51,599] Trial 390 finished with values: [-1000000000.0, 1000000000.0] and parameters: {'p_sma': 16, 'p_std': 59, 'p_atr': 10, 'p_adx': 8, 'rsi_period': 54, 'ema1': 23, 'ema2': 25, 'slip_atr_k': 0.03589706938511567, 'slip_spread_k': 0.597809848869772, 'spread_hl_frac': 0.0059855466952925766, 'bb_std_mult': 1.4862012450542201, 'rsi_os': 37, 'rsi_ob': 46, 'vol_spike': 0.033188869399695814, 'adx_thresh': 18.702747074030444, 'atr_min_pct': 0.023348917798263362, 'atr_max_pct': 0.12925035187443418, 'tp_mult': 2.2595402556381607, 'tsl_mult': 0.3548796354871063, 'strategy': 'breakout', 'time_stop': 34, 'use_sma': False, 'use_atr': True, 'use_adx': False, 'use_ema': False, 'use_spike': False, 'rsi_required': True, 'edge_k': 0.1845000921378931, 'edge_cap': 0.3853642557552719, 'bull_strategy': 'breakout', 'bull_bb_std_mult': 2.7467186925439075, 'bull_rsi_os': 33, 'bull_rsi_ob': 88, 'bull_adx_thresh': 25.893099748923643, 'bull_atr_min_pct': 0.0025775163249156866, 'bull_atr_max_pct': 0.042568677365848184, 'bull_tp_mult': 2.1172696443799603, 'bull_tsl_mult': 0.27151180618890414, 'bull_time_stop': 170, 'bull_use_sma': True, 'bull_use_ema': False, 'bull_use_atr': False, 'bull_use_adx': True, 'bull_use_spike': True, 'bull_rsi_required': True, 'bear_strategy': 'breakout', 'bear_bb_std_mult': 3.2742643340585986, 'bear_rsi_os': 16, 'bear_rsi_ob': 77, 'bear_adx_thresh': 19.60815710377689, 'bear_atr_min_pct': 0.001599281897791436, 'bear_atr_max_pct': 0.10690269202914207, 'bear_tp_mult': 2.393817839069434, 'bear_tsl_mult': 0.06915725655329977, 'bear_time_stop': 26, 'bear_use_sma': True, 'bear_use_ema': False, 'bear_use_atr': True, 'bear_use_adx': True, 'bear_use_spike': True, 'bear_rsi_required': False, 'sideways_strategy': 'breakout', 'sideways_bb_std_mult': 1.9650057111466104, 'sideways_rsi_os': 14, 'sideways_rsi_ob': 58, 'sideways_adx_thresh': 25.53420414110473, 'sideways_atr_min_pct': 0.01975815055570964, 'sideways_atr_max_pct': 0.14260914661588353, 'sideways_tp_mult': 1.8080151112104186, 'sideways_tsl_mult': 0.70420517184579, 'sideways_time_stop': 175, 'sideways_use_sma': True, 'sideways_use_ema': True, 'sideways_use_atr': True, 'sideways_use_adx': False, 'sideways_use_spike': False, 'sideways_rsi_required': False}.
[I 2025-08-30 19:26:52,037] Trial 393 finished with values: [-1000000000.0, 1000000000.0] and parameters: {'p_sma': 16, 'p_std': 7, 'p_atr': 10, 'p_adx': 8, 'rsi_period': 20, 'ema1': 19, 'ema2': 49, 'slip_atr_k': 0.164212970777596, 'slip_spread_k': 0.3789203808164404, 'spread_hl_frac': 0.0030227833438012754, 'bb_std_mult': 1.2270289467631408, 'rsi_os': 37, 'rsi_ob': 59, 'vol_spike': 0.06145131278443183, 'adx_thresh': 16.850111231798838, 'atr_min_pct': 0.02387728684225509, 'atr_max_pct': 0.14079028924439513, 'tp_mult': 2.2173819176206573, 'tsl_mult': 0.031204996256353423, 'strategy': 'mean_reversion', 'time_stop': 34, 'use_sma': True, 'use_atr': True, 'use_adx': False, 'use_ema': False, 'use_spike': True, 'rsi_required': False, 'edge_k': 0.09106011640383808, 'edge_cap': 0.26734691583746845, 'bull_strategy': 'mean_reversion', 'bull_bb_std_mult': 1.9404542070947868, 'bull_rsi_os': 51, 'bull_rsi_ob': 68, 'bull_adx_thresh': 9.294571978575387, 'bull_atr_min_pct': 0.007631153952463257, 'bull_atr_max_pct': 0.04628534520238124, 'bull_tp_mult': 2.169096024806643, 'bull_tsl_mult': 0.8085519116896712, 'bull_time_stop': 184, 'bull_use_sma': True, 'bull_use_ema': False, 'bull_use_atr': False, 'bull_use_adx': True, 'bull_use_spike': True, 'bull_rsi_required': False, 'bear_strategy': 'breakout', 'bear_bb_std_mult': 3.0514773451055257, 'bear_rsi_os': 16, 'bear_rsi_ob': 77, 'bear_adx_thresh': 13.354051182989572, 'bear_atr_min_pct': 0.0012047632350659018, 'bear_atr_max_pct': 0.03943451463047358, 'bear_tp_mult': 2.510450896191445, 'bear_tsl_mult': 0.11825371326504751, 'bear_time_stop': 17, 'bear_use_sma': True, 'bear_use_ema': False, 'bear_use_atr': True, 'bear_use_adx': True, 'bear_use_spike': False, 'bear_rsi_required': False, 'sideways_strategy': 'breakout', 'sideways_bb_std_mult': 0.6002772085048211, 'sideways_rsi_os': 15, 'sideways_rsi_ob': 60, 'sideways_adx_thresh': 10.089245902846589, 'sideways_atr_min_pct': 0.019146455822474238, 'sideways_atr_max_pct': 0.12924381215198716, 'sideways_tp_mult': 1.0534608417642826, 'sideways_tsl_mult': 0.7353473602403262, 'sideways_time_stop': 277, 'sideways_use_sma': True, 'sideways_use_ema': False, 'sideways_use_atr': False, 'sideways_use_adx': False, 'sideways_use_spike': False, 'sideways_rsi_required': False}.
[I 2025-08-30 19:27:23,064] Trial 394 finished with values: [-0.022515109274755196, 0.022413886417120783] and parameters: {'p_sma': 40, 'p_std': 59, 'p_atr': 10, 'p_adx': 9, 'rsi_period': 54, 'ema1': 26, 'ema2': 49, 'slip_atr_k': 0.01852809784418066, 'slip_spread_k': 0.16105846042667055, 'spread_hl_frac': 0.011000221761735105, 'bb_std_mult': 1.2495717080812203, 'rsi_os': 37, 'rsi_ob': 56, 'vol_spike': 0.023310157097416885, 'adx_thresh': 18.819207870377962, 'atr_min_pct': 0.023944771671411277, 'atr_max_pct': 0.1294638314730885, 'tp_mult': 1.6190387685189456, 'tsl_mult': 0.7743308662566817, 'strategy': 'mean_reversion', 'time_stop': 36, 'use_sma': False, 'use_atr': True, 'use_adx': False, 'use_ema': True, 'use_spike': True, 'rsi_required': True, 'edge_k': 0.11229591116952631, 'edge_cap': 0.3868517981307638, 'bull_strategy': 'mean_reversion', 'bull_bb_std_mult': 1.2599745398898456, 'bull_rsi_os': 54, 'bull_rsi_ob': 70, 'bull_adx_thresh': 16.350294976824596, 'bull_atr_min_pct': 0.012015433411173813, 'bull_atr_max_pct': 0.09081016206100818, 'bull_tp_mult': 2.6787751733253065, 'bull_tsl_mult': 0.6079801724357334, 'bull_time_stop': 184, 'bull_use_sma': True, 'bull_use_ema': False, 'bull_use_atr': False, 'bull_use_adx': True, 'bull_use_spike': False, 'bull_rsi_required': True, 'bear_strategy': 'breakout', 'bear_bb_std_mult': 3.2678926140180518, 'bear_rsi_os': 41, 'bear_rsi_ob': 88, 'bear_adx_thresh': 6.829810835314255, 'bear_atr_min_pct': 0.012998383772213237, 'bear_atr_max_pct': 0.06348894040307079, 'bear_tp_mult': 2.511328409321469, 'bear_tsl_mult': 0.1213680776899331, 'bear_time_stop': 58, 'bear_use_sma': True, 'bear_use_ema': False, 'bear_use_atr': True, 'bear_use_adx': True, 'bear_use_spike': False, 'bear_rsi_required': False, 'sideways_strategy': 'mean_reversion', 'sideways_bb_std_mult': 1.6576313185740177, 'sideways_rsi_os': 55, 'sideways_rsi_ob': 60, 'sideways_adx_thresh': 10.173814715843559, 'sideways_atr_min_pct': 0.0018191079597658436, 'sideways_atr_max_pct': 0.13448329773645826, 'sideways_tp_mult': 1.7273697204354141, 'sideways_tsl_mult': 0.6997424457370319, 'sideways_time_stop': 277, 'sideways_use_sma': True, 'sideways_use_ema': False, 'sideways_use_atr': False, 'sideways_use_adx': False, 'sideways_use_spike': False, 'sideways_rsi_required': False}.
[I 2025-08-30 19:27:25,314] Trial 395 finished with values: [-0.017985508320986443, 0.017914273387794995] and parameters: {'p_sma': 40, 'p_std': 26, 'p_atr': 10, 'p_adx': 9, 'rsi_period': 81, 'ema1': 24, 'ema2': 16, 'slip_atr_k': 0.02744787593337391, 'slip_spread_k': 0.6154356763853358, 'spread_hl_frac': 0.02381642302826547, 'bb_std_mult': 0.9564399513523176, 'rsi_os': 38, 'rsi_ob': 59, 'vol_spike': 0.044447794303405355, 'adx_thresh': 19.007931618978496, 'atr_min_pct': 0.025323427624842923, 'atr_max_pct': 0.13033042684998414, 'tp_mult': 1.670339055063766, 'tsl_mult': 0.5064202321477694, 'strategy': 'breakout', 'time_stop': 33, 'use_sma': False, 'use_atr': False, 'use_adx': False, 'use_ema': True, 'use_spike': True, 'rsi_required': True, 'edge_k': 0.09481917179250376, 'edge_cap': 0.7602836432600214, 'bull_strategy': 'mean_reversion', 'bull_bb_std_mult': 2.758288904275803, 'bull_rsi_os': 52, 'bull_rsi_ob': 53, 'bull_adx_thresh': 25.543442366989918, 'bull_atr_min_pct': 0.0020036861270552736, 'bull_atr_max_pct': 0.1468591525824233, 'bull_tp_mult': 2.6819485267999204, 'bull_tsl_mult': 0.9509777706335277, 'bull_time_stop': 132, 'bull_use_sma': True, 'bull_use_ema': False, 'bull_use_atr': False, 'bull_use_adx': True, 'bull_use_spike': False, 'bull_rsi_required': False, 'bear_strategy': 'breakout', 'bear_bb_std_mult': 3.2686776346304067, 'bear_rsi_os': 21, 'bear_rsi_ob': 89, 'bear_adx_thresh': 5.705584414204662, 'bear_atr_min_pct': 0.015281181671060354, 'bear_atr_max_pct': 0.13515405751593695, 'bear_tp_mult': 1.7456679870838148, 'bear_tsl_mult': 0.12240606558441511, 'bear_time_stop': 187, 'bear_use_sma': True, 'bear_use_ema': False, 'bear_use_atr': True, 'bear_use_adx': True, 'bear_use_spike': False, 'bear_rsi_required': False, 'sideways_strategy': 'mean_reversion', 'sideways_bb_std_mult': 2.0876071367004894, 'sideways_rsi_os': 16, 'sideways_rsi_ob': 60, 'sideways_adx_thresh': 10.025501064650744, 'sideways_atr_min_pct': 0.019022802017623512, 'sideways_atr_max_pct': 0.13437236242870762, 'sideways_tp_mult': 2.640948099044548, 'sideways_tsl_mult': 0.7034930698166015, 'sideways_time_stop': 278, 'sideways_use_sma': True, 'sideways_use_ema': True, 'sideways_use_atr': False, 'sideways_use_adx': False, 'sideways_use_spike': False, 'sideways_rsi_required': True}.
