[I 2025-08-30 19:10:32,378] Trial 271 finished with values: [-0.03442112064043357, 0.03435567017653416] and parameters: {'p_sma': 42, 'p_std': 26, 'p_atr': 29, 'p_adx': 8, 'rsi_period': 49, 'ema1': 13, 'ema2': 15, 'slip_atr_k': 0.01842580197561617, 'slip_spread_k': 0.380261233042108, 'spread_hl_frac': 0.004236135383600515, 'bb_std_mult': 1.0010414712722504, 'rsi_os': 37, 'rsi_ob': 77, 'vol_spike': 0.04343633942132384, 'adx_thresh': 18.896544892807437, 'atr_min_pct': 0.020124673185467845, 'atr_max_pct': 0.1425968513499039, 'tp_mult': 1.2822920589907394, 'tsl_mult': 0.778187603416009, 'strategy': 'breakout', 'time_stop': 37, 'use_sma': True, 'use_atr': True, 'use_adx': False, 'use_ema': False, 'use_spike': True, 'rsi_required': False, 'edge_k': 0.6172170138192385, 'edge_cap': 0.5690979733352127, 'bull_strategy': 'mean_reversion', 'bull_bb_std_mult': 2.0935843726015957, 'bull_rsi_os': 52, 'bull_rsi_ob': 82, 'bull_adx_thresh': 25.844586662537008, 'bull_atr_min_pct': 0.0009205372968209922, 'bull_atr_max_pct': 0.032172668218187137, 'bull_tp_mult': 2.107121005382702, 'bull_tsl_mult': 0.9992131606619304, 'bull_time_stop': 193, 'bull_use_sma': True, 'bull_use_ema': False, 'bull_use_atr': False, 'bull_use_adx': True, 'bull_use_spike': True, 'bull_rsi_required': True, 'bear_strategy': 'breakout', 'bear_bb_std_mult': 3.1914958830457123, 'bear_rsi_os': 38, 'bear_rsi_ob': 46, 'bear_adx_thresh': 25.036472964738266, 'bear_atr_min_pct': 0.00537753500109631, 'bear_atr_max_pct': 0.05263831707780445, 'bear_tp_mult': 1.7243389226354602, 'bear_tsl_mult': 0.11440739132917525, 'bear_time_stop': 21, 'bear_use_sma': False, 'bear_use_ema': False, 'bear_use_atr': True, 'bear_use_adx': True, 'bear_use_spike': False, 'bear_rsi_required': False, 'sideways_strategy': 'breakout', 'sideways_bb_std_mult': 2.8873969297163886, 'sideways_rsi_os': 18, 'sideways_rsi_ob': 60, 'sideways_adx_thresh': 8.746066666953235, 'sideways_atr_min_pct': 0.02062596397219645, 'sideways_atr_max_pct': 0.10778563119304878, 'sideways_tp_mult': 1.8636084364542995, 'sideways_tsl_mult': 0.7385764617112073, 'sideways_time_stop': 57, 'sideways_use_sma': True, 'sideways_use_ema': True, 'sideways_use_atr': False, 'sideways_use_adx': False, 'sideways_use_spike': False, 'sideways_rsi_required': False}.
[I 2025-08-30 19:10:32,485] Trial 270 finished with values: [-1000000000.0, 1000000000.0] and parameters: {'p_sma': 12, 'p_std': 8, 'p_atr': 29, 'p_adx': 8, 'rsi_period': 49, 'ema1': 12, 'ema2': 15, 'slip_atr_k': 0.01822006893185599, 'slip_spread_k': 0.3774640871363168, 'spread_hl_frac': 0.04877582944452317, 'bb_std_mult': 1.0017718520716743, 'rsi_os': 37, 'rsi_ob': 94, 'vol_spike': 0.21512711714237465, 'adx_thresh': 16.105306493908536, 'atr_min_pct': 0.020167639108642325, 'atr_max_pct': 0.06431345240293584, 'tp_mult': 2.123789675650305, 'tsl_mult': 0.6712340105328959, 'strategy': 'breakout', 'time_stop': 238, 'use_sma': False, 'use_atr': True, 'use_adx': False, 'use_ema': False, 'use_spike': True, 'rsi_required': False, 'edge_k': 1.8065644177419347, 'edge_cap': 0.29684605782867485, 'bull_strategy': 'mean_reversion', 'bull_bb_std_mult': 1.8965593315987912, 'bull_rsi_os': 52, 'bull_rsi_ob': 88, 'bull_adx_thresh': 10.831525023335079, 'bull_atr_min_pct': 0.005655729379610211, 'bull_atr_max_pct': 0.030030901074816707, 'bull_tp_mult': 1.8379487117726734, 'bull_tsl_mult': 0.9624112626097945, 'bull_time_stop': 196, 'bull_use_sma': True, 'bull_use_ema': False, 'bull_use_atr': False, 'bull_use_adx': True, 'bull_use_spike': True, 'bull_rsi_required': True, 'bear_strategy': 'breakout', 'bear_bb_std_mult': 3.2274078314321026, 'bear_rsi_os': 20, 'bear_rsi_ob': 75, 'bear_adx_thresh': 24.921432349885386, 'bear_atr_min_pct': 0.004914958663873474, 'bear_atr_max_pct': 0.053867420292552474, 'bear_tp_mult': 1.7283775658308467, 'bear_tsl_mult': 0.08601722388896738, 'bear_time_stop': 213, 'bear_use_sma': False, 'bear_use_ema': False, 'bear_use_atr': True, 'bear_use_adx': True, 'bear_use_spike': False, 'bear_rsi_required': False, 'sideways_strategy': 'breakout', 'sideways_bb_std_mult': 1.567486005544322, 'sideways_rsi_os': 15, 'sideways_rsi_ob': 50, 'sideways_adx_thresh': 8.822062709314778, 'sideways_atr_min_pct': 0.020809807001777134, 'sideways_atr_max_pct': 0.12301240755845824, 'sideways_tp_mult': 1.8597559736992204, 'sideways_tsl_mult': 0.0619547011610162, 'sideways_time_stop': 94, 'sideways_use_sma': True, 'sideways_use_ema': True, 'sideways_use_atr': False, 'sideways_use_adx': False, 'sideways_use_spike': False, 'sideways_rsi_required': False}.
[I 2025-08-30 19:10:32,651] Trial 269 finished with values: [-0.020231619198032402, 0.020198478149911957] and parameters: {'p_sma': 11, 'p_std': 5, 'p_atr': 24, 'p_adx': 27, 'rsi_period': 30, 'ema1': 24, 'ema2': 13, 'slip_atr_k': 0.04176595495072598, 'slip_spread_k': 0.0066269729248221165, 'spread_hl_frac': 0.0043238171301533245, 'bb_std_mult': 0.9821859925403249, 'rsi_os': 37, 'rsi_ob': 55, 'vol_spike': 0.12069654877460223, 'adx_thresh': 18.532393818287215, 'atr_min_pct': 0.02647782383006932, 'atr_max_pct': 0.04864529120777003, 'tp_mult': 2.12326286801003, 'tsl_mult': 0.9997525561747813, 'strategy': 'breakout', 'time_stop': 35, 'use_sma': False, 'use_atr': True, 'use_adx': False, 'use_ema': False, 'use_spike': True, 'rsi_required': False, 'edge_k': 0.03368154344807177, 'edge_cap': 0.2975864576106169, 'bull_strategy': 'breakout', 'bull_bb_std_mult': 1.8603219695479682, 'bull_rsi_os': 52, 'bull_rsi_ob': 63, 'bull_adx_thresh': 28.467548153624378, 'bull_atr_min_pct': 0.00154924817812904, 'bull_atr_max_pct': 0.025756794108063218, 'bull_tp_mult': 2.0972949124815408, 'bull_tsl_mult': 0.9571189235925609, 'bull_time_stop': 193, 'bull_use_sma': False, 'bull_use_ema': False, 'bull_use_atr': False, 'bull_use_adx': True, 'bull_use_spike': True, 'bull_rsi_required': True, 'bear_strategy': 'breakout', 'bear_bb_std_mult': 3.1946851733553348, 'bear_rsi_os': 8, 'bear_rsi_ob': 88, 'bear_adx_thresh': 32.889497865753256, 'bear_atr_min_pct': 0.02257166891327097, 'bear_atr_max_pct': 0.05953485295639144, 'bear_tp_mult': 1.7242150203807654, 'bear_tsl_mult': 0.9619266316913246, 'bear_time_stop': 20, 'bear_use_sma': True, 'bear_use_ema': False, 'bear_use_atr': True, 'bear_use_adx': True, 'bear_use_spike': False, 'bear_rsi_required': False, 'sideways_strategy': 'breakout', 'sideways_bb_std_mult': 3.061588232388919, 'sideways_rsi_os': 18, 'sideways_rsi_ob': 50, 'sideways_adx_thresh': 33.30586126595325, 'sideways_atr_min_pct': 0.009686290507363821, 'sideways_atr_max_pct': 0.12057105268557203, 'sideways_tp_mult': 2.675469558308694, 'sideways_tsl_mult': 0.563863994176973, 'sideways_time_stop': 265, 'sideways_use_sma': True, 'sideways_use_ema': True, 'sideways_use_atr': False, 'sideways_use_adx': True, 'sideways_use_spike': False, 'sideways_rsi_required': False}.
[I 2025-08-30 19:11:06,464] Trial 274 finished with values: [-1000000000.0, 1000000000.0] and parameters: {'p_sma': 24, 'p_std': 24, 'p_atr': 26, 'p_adx': 8, 'rsi_period': 52, 'ema1': 23, 'ema2': 18, 'slip_atr_k': 0.2047264482194487, 'slip_spread_k': 0.2740780338209161, 'spread_hl_frac': 0.0019841394968588967, 'bb_std_mult': 1.0729198282808994, 'rsi_os': 38, 'rsi_ob': 68, 'vol_spike': 0.04887301478081402, 'adx_thresh': 16.594928232624348, 'atr_min_pct': 0.02634099591414094, 'atr_max_pct': 0.14524145876045982, 'tp_mult': 2.063628757578358, 'tsl_mult': 0.49871876247961916, 'strategy': 'breakout', 'time_stop': 206, 'use_sma': False, 'use_atr': True, 'use_adx': False, 'use_ema': False, 'use_spike': True, 'rsi_required': False, 'edge_k': 1.8827254420727106, 'edge_cap': 0.7481671901184952, 'bull_strategy': 'mean_reversion', 'bull_bb_std_mult': 3.0518576597744644, 'bull_rsi_os': 40, 'bull_rsi_ob': 68, 'bull_adx_thresh': 26.963962187004547, 'bull_atr_min_pct': 0.017445571392606038, 'bull_atr_max_pct': 0.14965694684854186, 'bull_tp_mult': 2.2140407650800666, 'bull_tsl_mult': 0.9305185723553022, 'bull_time_stop': 174, 'bull_use_sma': True, 'bull_use_ema': False, 'bull_use_atr': False, 'bull_use_adx': True, 'bull_use_spike': False, 'bull_rsi_required': True, 'bear_strategy': 'breakout', 'bear_bb_std_mult': 0.9353628902404081, 'bear_rsi_os': 10, 'bear_rsi_ob': 84, 'bear_adx_thresh': 23.10837586891555, 'bear_atr_min_pct': 0.005886324915543747, 'bear_atr_max_pct': 0.05488734347414153, 'bear_tp_mult': 2.887670051768037, 'bear_tsl_mult': 0.0850379271064802, 'bear_time_stop': 210, 'bear_use_sma': True, 'bear_use_ema': True, 'bear_use_atr': True, 'bear_use_adx': True, 'bear_use_spike': False, 'bear_rsi_required': False, 'sideways_strategy': 'breakout', 'sideways_bb_std_mult': 1.9403876971986067, 'sideways_rsi_os': 15, 'sideways_rsi_ob': 59, 'sideways_adx_thresh': 9.497991312750463, 'sideways_atr_min_pct': 0.01846211295871426, 'sideways_atr_max_pct': 0.14564718602473292, 'sideways_tp_mult': 2.5308016074505915, 'sideways_tsl_mult': 0.9955572530704493, 'sideways_time_stop': 78, 'sideways_use_sma': False, 'sideways_use_ema': False, 'sideways_use_atr': False, 'sideways_use_adx': False, 'sideways_use_spike': False, 'sideways_rsi_required': False}.
[I 2025-08-30 19:11:06,708] Trial 273 finished with values: [-1000000000.0, 1000000000.0] and parameters: {'p_sma': 28, 'p_std': 25, 'p_atr': 24, 'p_adx': 8, 'rsi_period': 49, 'ema1': 23, 'ema2': 15, 'slip_atr_k': 0.21089859938856556, 'slip_spread_k': 0.3738420215907039, 'spread_hl_frac': 0.0018228896262645197, 'bb_std_mult': 1.0863738795947844, 'rsi_os': 37, 'rsi_ob': 68, 'vol_spike': 0.21474118436859124, 'adx_thresh': 25.06330036640603, 'atr_min_pct': 0.023105483635651465, 'atr_max_pct': 0.048872197412401105, 'tp_mult': 1.2895303777351954, 'tsl_mult': 0.7810075532495889, 'strategy': 'breakout', 'time_stop': 274, 'use_sma': True, 'use_atr': True, 'use_adx': False, 'use_ema': False, 'use_spike': True, 'rsi_required': False, 'edge_k': 0.48336303010180415, 'edge_cap': 0.21116317137870305, 'bull_strategy': 'mean_reversion', 'bull_bb_std_mult': 2.609566937349341, 'bull_rsi_os': 40, 'bull_rsi_ob': 77, 'bull_adx_thresh': 27.028524726570293, 'bull_atr_min_pct': 0.012734403619345028, 'bull_atr_max_pct': 0.030803544263737194, 'bull_tp_mult': 2.3120275282908307, 'bull_tsl_mult': 0.23673845403444038, 'bull_time_stop': 195, 'bull_use_sma': True, 'bull_use_ema': False, 'bull_use_atr': False, 'bull_use_adx': True, 'bull_use_spike': False, 'bull_rsi_required': True, 'bear_strategy': 'breakout', 'bear_bb_std_mult': 2.820803614318471, 'bear_rsi_os': 47, 'bear_rsi_ob': 86, 'bear_adx_thresh': 21.589138937990985, 'bear_atr_min_pct': 0.004823894927914428, 'bear_atr_max_pct': 0.05354378294298879, 'bear_tp_mult': 1.7316752141556788, 'bear_tsl_mult': 0.07770813806893723, 'bear_time_stop': 20, 'bear_use_sma': False, 'bear_use_ema': True, 'bear_use_atr': True, 'bear_use_adx': True, 'bear_use_spike': False, 'bear_rsi_required': False, 'sideways_strategy': 'breakout', 'sideways_bb_std_mult': 1.921369532458144, 'sideways_rsi_os': 27, 'sideways_rsi_ob': 86, 'sideways_adx_thresh': 9.243878760339117, 'sideways_atr_min_pct': 0.0208250437672959, 'sideways_atr_max_pct': 0.14702850624203073, 'sideways_tp_mult': 2.4693243471907826, 'sideways_tsl_mult': 0.16910789359729966, 'sideways_time_stop': 43, 'sideways_use_sma': False, 'sideways_use_ema': False, 'sideways_use_atr': False, 'sideways_use_adx': False, 'sideways_use_spike': False, 'sideways_rsi_required': False}.
[I 2025-08-30 19:11:06,895] Trial 276 finished with values: [-1000000000.0, 1000000000.0] and parameters: {'p_sma': 55, 'p_std': 36, 'p_atr': 15, 'p_adx': 8, 'rsi_period': 52, 'ema1': 23, 'ema2': 18, 'slip_atr_k': 0.2383078881990316, 'slip_spread_k': 0.4424714666438822, 'spread_hl_frac': 0.002161290827820313, 'bb_std_mult': 3.0050012825501575, 'rsi_os': 38, 'rsi_ob': 57, 'vol_spike': 0.0462935963579565, 'adx_thresh': 7.549677046845904, 'atr_min_pct': 0.008017405589840883, 'atr_max_pct': 0.14692688798011827, 'tp_mult': 2.0474714824889517, 'tsl_mult': 0.28270620639314287, 'strategy': 'breakout', 'time_stop': 206, 'use_sma': True, 'use_atr': True, 'use_adx': False, 'use_ema': False, 'use_spike': True, 'rsi_required': True, 'edge_k': 0.4743312112702246, 'edge_cap': 0.2117146660518185, 'bull_strategy': 'mean_reversion', 'bull_bb_std_mult': 1.017627879496033, 'bull_rsi_os': 48, 'bull_rsi_ob': 71, 'bull_adx_thresh': 26.93754067609671, 'bull_atr_min_pct': 0.0033967712348512476, 'bull_atr_max_pct': 0.11931908288882452, 'bull_tp_mult': 2.222397824942703, 'bull_tsl_mult': 0.9318616833929652, 'bull_time_stop': 63, 'bull_use_sma': True, 'bull_use_ema': False, 'bull_use_atr': False, 'bull_use_adx': False, 'bull_use_spike': False, 'bull_rsi_required': True, 'bear_strategy': 'breakout', 'bear_bb_std_mult': 3.0734548656099356, 'bear_rsi_os': 47, 'bear_rsi_ob': 86, 'bear_adx_thresh': 29.869972909712214, 'bear_atr_min_pct': 0.015863192903511708, 'bear_atr_max_pct': 0.058783984999381006, 'bear_tp_mult': 1.7527416728716605, 'bear_tsl_mult': 0.15134644490265214, 'bear_time_stop': 170, 'bear_use_sma': True, 'bear_use_ema': True, 'bear_use_atr': True, 'bear_use_adx': True, 'bear_use_spike': False, 'bear_rsi_required': False, 'sideways_strategy': 'breakout', 'sideways_bb_std_mult': 1.934744067551471, 'sideways_rsi_os': 49, 'sideways_rsi_ob': 58, 'sideways_adx_thresh': 33.564140676373356, 'sideways_atr_min_pct': 0.017929713018206634, 'sideways_atr_max_pct': 0.14622008014002663, 'sideways_tp_mult': 2.462897830550098, 'sideways_tsl_mult': 0.16930988647379785, 'sideways_time_stop': 40, 'sideways_use_sma': False, 'sideways_use_ema': False, 'sideways_use_atr': False, 'sideways_use_adx': False, 'sideways_use_spike': False, 'sideways_rsi_required': False}.
[I 2025-08-30 19:11:07,033] Trial 275 finished with values: [-1000000000.0, 1000000000.0] and parameters: {'p_sma': 24, 'p_std': 24, 'p_atr': 10, 'p_adx': 8, 'rsi_period': 52, 'ema1': 30, 'ema2': 43, 'slip_atr_k': 0.01302471094271785, 'slip_spread_k': 0.2695273358604595, 'spread_hl_frac': 0.00173283934508957, 'bb_std_mult': 1.0981260589436643, 'rsi_os': 38, 'rsi_ob': 68, 'vol_spike': 0.016453061760007704, 'adx_thresh': 20.687895206940762, 'atr_min_pct': 0.026141979959288696, 'atr_max_pct': 0.04930430941801063, 'tp_mult': 2.2753073848568146, 'tsl_mult': 0.7441661185854935, 'strategy': 'breakout', 'time_stop': 195, 'use_sma': True, 'use_atr': True, 'use_adx': False, 'use_ema': False, 'use_spike': True, 'rsi_required': True, 'edge_k': 0.4582920439954057, 'edge_cap': 0.2145168144410713, 'bull_strategy': 'mean_reversion', 'bull_bb_std_mult': 1.9460440280971105, 'bull_rsi_os': 40, 'bull_rsi_ob': 77, 'bull_adx_thresh': 25.162982329878258, 'bull_atr_min_pct': 0.002102241435473318, 'bull_atr_max_pct': 0.0274939282211507, 'bull_tp_mult': 2.310207774463958, 'bull_tsl_mult': 0.7341859144447681, 'bull_time_stop': 274, 'bull_use_sma': True, 'bull_use_ema': False, 'bull_use_atr': False, 'bull_use_adx': True, 'bull_use_spike': False, 'bull_rsi_required': True, 'bear_strategy': 'breakout', 'bear_bb_std_mult': 2.8299560809476985, 'bear_rsi_os': 9, 'bear_rsi_ob': 85, 'bear_adx_thresh': 15.223406812144312, 'bear_atr_min_pct': 0.008160760779663255, 'bear_atr_max_pct': 0.0573535172717492, 'bear_tp_mult': 2.907835447750474, 'bear_tsl_mult': 0.9970055540338177, 'bear_time_stop': 300, 'bear_use_sma': True, 'bear_use_ema': True, 'bear_use_atr': True, 'bear_use_adx': True, 'bear_use_spike': False, 'bear_rsi_required': False, 'sideways_strategy': 'breakout', 'sideways_bb_std_mult': 1.9321646113182291, 'sideways_rsi_os': 7, 'sideways_rsi_ob': 76, 'sideways_adx_thresh': 33.51968926295785, 'sideways_atr_min_pct': 0.009600452482166046, 'sideways_atr_max_pct': 0.02954881613788677, 'sideways_tp_mult': 1.7795545139277371, 'sideways_tsl_mult': 0.16792796578051017, 'sideways_time_stop': 266, 'sideways_use_sma': False, 'sideways_use_ema': False, 'sideways_use_atr': False, 'sideways_use_adx': False, 'sideways_use_spike': False, 'sideways_rsi_required': False}.
[I 2025-08-30 19:11:41,350] Trial 278 finished with values: [-1000000000.0, 1000000000.0] and parameters: {'p_sma': 40, 'p_std': 49, 'p_atr': 8, 'p_adx': 13, 'rsi_period': 56, 'ema1': 17, 'ema2': 56, 'slip_atr_k': 0.04383675379152903, 'slip_spread_k': 0.4223803852508067, 'spread_hl_frac': 0.021381665936712337, 'bb_std_mult': 1.1985393331884517, 'rsi_os': 40, 'rsi_ob': 56, 'vol_spike': 0.021483042899399434, 'adx_thresh': 20.821508987268817, 'atr_min_pct': 0.02384206305760013, 'atr_max_pct': 0.05719142503408857, 'tp_mult': 2.2650457718315593, 'tsl_mult': 0.7509428328075514, 'strategy': 'mean_reversion', 'time_stop': 30, 'use_sma': False, 'use_atr': False, 'use_adx': False, 'use_ema': False, 'use_spike': False, 'rsi_required': True, 'edge_k': 0.14212616718054583, 'edge_cap': 0.7234190083726248, 'bull_strategy': 'breakout', 'bull_bb_std_mult': 0.8055529475112762, 'bull_rsi_os': 51, 'bull_rsi_ob': 59, 'bull_adx_thresh': 25.274680654721458, 'bull_atr_min_pct': 0.028875033109122334, 'bull_atr_max_pct': 0.026965277820659418, 'bull_tp_mult': 1.7826010348678694, 'bull_tsl_mult': 0.8773315280728669, 'bull_time_stop': 282, 'bull_use_sma': False, 'bull_use_ema': True, 'bull_use_atr': True, 'bull_use_adx': True, 'bull_use_spike': True, 'bull_rsi_required': False, 'bear_strategy': 'mean_reversion', 'bear_bb_std_mult': 3.3352769166025364, 'bear_rsi_os': 29, 'bear_rsi_ob': 85, 'bear_adx_thresh': 5.597463905450358, 'bear_atr_min_pct': 0.014813741764211586, 'bear_atr_max_pct': 0.0818683992520546, 'bear_tp_mult': 1.5842111632842553, 'bear_tsl_mult': 0.708115967684251, 'bear_time_stop': 33, 'bear_use_sma': True, 'bear_use_ema': False, 'bear_use_atr': False, 'bear_use_adx': False, 'bear_use_spike': False, 'bear_rsi_required': False, 'sideways_strategy': 'mean_reversion', 'sideways_bb_std_mult': 2.051499846908698, 'sideways_rsi_os': 16, 'sideways_rsi_ob': 58, 'sideways_adx_thresh': 10.288637496605169, 'sideways_atr_min_pct': 0.019387305167627124, 'sideways_atr_max_pct': 0.1204137809186835, 'sideways_tp_mult': 2.88285672571723, 'sideways_tsl_mult': 0.6641626649489397, 'sideways_time_stop': 251, 'sideways_use_sma': True, 'sideways_use_ema': True, 'sideways_use_atr': False, 'sideways_use_adx': True, 'sideways_use_spike': True, 'sideways_rsi_required': True}.
[I 2025-08-30 19:11:41,551] Trial 277 finished with values: [-1000000000.0, 1000000000.0] and parameters: {'p_sma': 40, 'p_std': 5, 'p_atr': 22, 'p_adx': 29, 'rsi_period': 53, 'ema1': 24, 'ema2': 21, 'slip_atr_k': 0.04245928808859388, 'slip_spread_k': 0.44482566081832264, 'spread_hl_frac': 0.021773012628651247, 'bb_std_mult': 3.011813329902872, 'rsi_os': 40, 'rsi_ob': 57, 'vol_spike': 0.024937256502922084, 'adx_thresh': 29.1433594362277, 'atr_min_pct': 0.025524865488160443, 'atr_max_pct': 0.1015478440793334, 'tp_mult': 2.2756484658383114, 'tsl_mult': 0.28530688803874543, 'strategy': 'mean_reversion', 'time_stop': 248, 'use_sma': False, 'use_atr': False, 'use_adx': False, 'use_ema': False, 'use_spike': False, 'rsi_required': True, 'edge_k': 0.13861827332468846, 'edge_cap': 0.1444226538256866, 'bull_strategy': 'breakout', 'bull_bb_std_mult': 1.8418137405134625, 'bull_rsi_os': 51, 'bull_rsi_ob': 94, 'bull_adx_thresh': 25.16437420273038, 'bull_atr_min_pct': 0.00212176731089765, 'bull_atr_max_pct': 0.08597829833079958, 'bull_tp_mult': 2.5888220802899067, 'bull_tsl_mult': 0.8776360784474031, 'bull_time_stop': 210, 'bull_use_sma': False, 'bull_use_ema': True, 'bull_use_atr': False, 'bull_use_adx': False, 'bull_use_spike': True, 'bull_rsi_required': True, 'bear_strategy': 'mean_reversion', 'bear_bb_std_mult': 3.093801833346506, 'bear_rsi_os': 8, 'bear_rsi_ob': 88, 'bear_adx_thresh': 6.814229135274024, 'bear_atr_min_pct': 0.015629417177076433, 'bear_atr_max_pct': 0.059039511978600856, 'bear_tp_mult': 1.7733613468179679, 'bear_tsl_mult': 0.12683530707159113, 'bear_time_stop': 33, 'bear_use_sma': True, 'bear_use_ema': False, 'bear_use_atr': False, 'bear_use_adx': False, 'bear_use_spike': False, 'bear_rsi_required': False, 'sideways_strategy': 'mean_reversion', 'sideways_bb_std_mult': 2.0350508968069487, 'sideways_rsi_os': 16, 'sideways_rsi_ob': 58, 'sideways_adx_thresh': 10.532715445909169, 'sideways_atr_min_pct': 0.029178714106789766, 'sideways_atr_max_pct': 0.1210242191191772, 'sideways_tp_mult': 1.778207181056906, 'sideways_tsl_mult': 0.2804022658538896, 'sideways_time_stop': 250, 'sideways_use_sma': True, 'sideways_use_ema': True, 'sideways_use_atr': False, 'sideways_use_adx': True, 'sideways_use_spike': True, 'sideways_rsi_required': True}.
