[I 2025-08-30 20:25:33,549] Trial 818 finished with values: [-0.010217842573615576, 0.011816272725614944] and parameters: {'p_sma': 46, 'p_std': 9, 'p_atr': 10, 'p_adx': 7, 'rsi_period': 82, 'ema1': 13, 'ema2': 15, 'slip_atr_k': 0.018804657009884068, 'slip_spread_k': 0.6289046107522221, 'spread_hl_frac': 0.04056466018073092, 'bb_std_mult': 1.033716420311204, 'rsi_os': 37, 'rsi_ob': 61, 'vol_spike': 0.1348863883105635, 'adx_thresh': 21.141689299118177, 'atr_min_pct': 0.023066517639484387, 'atr_max_pct': 0.1322143779891497, 'tp_mult': 2.2442737906693995, 'tsl_mult': 0.7239652556154896, 'strategy': 'breakout', 'time_stop': 39, 'use_sma': False, 'use_atr': True, 'use_adx': False, 'use_ema': False, 'use_spike': True, 'rsi_required': True, 'edge_k': 1.347013859939764, 'edge_cap': 0.4385708312739548, 'bull_strategy': 'mean_reversion', 'bull_bb_std_mult': 1.8501519832247864, 'bull_rsi_os': 19, 'bull_rsi_ob': 72, 'bull_adx_thresh': 25.17358004995902, 'bull_atr_min_pct': 0.0033933599324837086, 'bull_atr_max_pct': 0.08343329598435997, 'bull_tp_mult': 2.1082583675936726, 'bull_tsl_mult': 0.9493054853977133, 'bull_time_stop': 191, 'bull_use_sma': True, 'bull_use_ema': False, 'bull_use_atr': False, 'bull_use_adx': True, 'bull_use_spike': True, 'bull_rsi_required': True, 'bear_strategy': 'breakout', 'bear_bb_std_mult': 3.3892692143358363, 'bear_rsi_os': 46, 'bear_rsi_ob': 46, 'bear_adx_thresh': 5.460423122131128, 'bear_atr_min_pct': 0.009340070743198144, 'bear_atr_max_pct': 0.11014392252570765, 'bear_tp_mult': 2.996518902177157, 'bear_tsl_mult': 0.1211459110335505, 'bear_time_stop': 14, 'bear_use_sma': True, 'bear_use_ema': False, 'bear_use_atr': True, 'bear_use_adx': True, 'bear_use_spike': False, 'bear_rsi_required': True, 'sideways_strategy': 'mean_reversion', 'sideways_bb_std_mult': 2.058550029265291, 'sideways_rsi_os': 20, 'sideways_rsi_ob': 57, 'sideways_adx_thresh': 27.003015065179884, 'sideways_atr_min_pct': 0.025938432605383713, 'sideways_atr_max_pct': 0.037034851118021725, 'sideways_tp_mult': 1.3307377663766569, 'sideways_tsl_mult': 0.8715417362146436, 'sideways_time_stop': 278, 'sideways_use_sma': False, 'sideways_use_ema': True, 'sideways_use_atr': False, 'sideways_use_adx': False, 'sideways_use_spike': False, 'sideways_rsi_required': True}.
[I 2025-08-30 20:25:33,820] Trial 820 finished with values: [-1000000000.0, 1000000000.0] and parameters: {'p_sma': 28, 'p_std': 30, 'p_atr': 10, 'p_adx': 7, 'rsi_period': 26, 'ema1': 29, 'ema2': 17, 'slip_atr_k': 0.008503342701372433, 'slip_spread_k': 0.40410271201603826, 'spread_hl_frac': 0.002823147676809884, 'bb_std_mult': 0.9786493096917517, 'rsi_os': 37, 'rsi_ob': 61, 'vol_spike': 0.04493608603141161, 'adx_thresh': 32.72108262514561, 'atr_min_pct': 0.02469313360619641, 'atr_max_pct': 0.13182742317848553, 'tp_mult': 1.12561981686688, 'tsl_mult': 0.17052082113777745, 'strategy': 'breakout', 'time_stop': 174, 'use_sma': False, 'use_atr': True, 'use_adx': True, 'use_ema': True, 'use_spike': False, 'rsi_required': True, 'edge_k': 0.17767847448511945, 'edge_cap': 0.2845403623507227, 'bull_strategy': 'breakout', 'bull_bb_std_mult': 2.479839812643928, 'bull_rsi_os': 37, 'bull_rsi_ob': 52, 'bull_adx_thresh': 13.447837579810834, 'bull_atr_min_pct': 0.026608363458413643, 'bull_atr_max_pct': 0.09429256067117336, 'bull_tp_mult': 2.18357560832764, 'bull_tsl_mult': 0.9534301758191768, 'bull_time_stop': 126, 'bull_use_sma': True, 'bull_use_ema': False, 'bull_use_atr': False, 'bull_use_adx': False, 'bull_use_spike': True, 'bull_rsi_required': False, 'bear_strategy': 'mean_reversion', 'bear_bb_std_mult': 1.5387680056695712, 'bear_rsi_os': 46, 'bear_rsi_ob': 75, 'bear_adx_thresh': 5.485305050870795, 'bear_atr_min_pct': 0.01676799910475957, 'bear_atr_max_pct': 0.12451725159590704, 'bear_tp_mult': 2.473128554016164, 'bear_tsl_mult': 0.07599847064554557, 'bear_time_stop': 23, 'bear_use_sma': True, 'bear_use_ema': False, 'bear_use_atr': True, 'bear_use_adx': True, 'bear_use_spike': True, 'bear_rsi_required': True, 'sideways_strategy': 'mean_reversion', 'sideways_bb_std_mult': 2.0638054247333173, 'sideways_rsi_os': 5, 'sideways_rsi_ob': 54, 'sideways_adx_thresh': 9.77542879148466, 'sideways_atr_min_pct': 0.019169480409918793, 'sideways_atr_max_pct': 0.11838690908896078, 'sideways_tp_mult': 1.9669799071961385, 'sideways_tsl_mult': 0.29422647508780875, 'sideways_time_stop': 276, 'sideways_use_sma': False, 'sideways_use_ema': True, 'sideways_use_atr': False, 'sideways_use_adx': False, 'sideways_use_spike': False, 'sideways_rsi_required': True}.
[I 2025-08-30 20:26:09,254] Trial 824 finished with values: [-1000000000.0, 1000000000.0] and parameters: {'p_sma': 47, 'p_std': 12, 'p_atr': 12, 'p_adx': 7, 'rsi_period': 82, 'ema1': 14, 'ema2': 12, 'slip_atr_k': 0.017711757410355643, 'slip_spread_k': 0.6289758071968119, 'spread_hl_frac': 0.042373959909389476, 'bb_std_mult': 1.2085879114559333, 'rsi_os': 34, 'rsi_ob': 68, 'vol_spike': 0.13362707349901504, 'adx_thresh': 22.024003638012875, 'atr_min_pct': 0.02200131696870261, 'atr_max_pct': 0.125622641055127, 'tp_mult': 2.337239987700044, 'tsl_mult': 0.6807567041625718, 'strategy': 'mean_reversion', 'time_stop': 54, 'use_sma': False, 'use_atr': False, 'use_adx': True, 'use_ema': True, 'use_spike': False, 'rsi_required': False, 'edge_k': 1.2618695106015931, 'edge_cap': 0.4592426841002993, 'bull_strategy': 'mean_reversion', 'bull_bb_std_mult': 1.8322204598680336, 'bull_rsi_os': 23, 'bull_rsi_ob': 73, 'bull_adx_thresh': 23.667892187660826, 'bull_atr_min_pct': 0.00873550266279758, 'bull_atr_max_pct': 0.08329707177236104, 'bull_tp_mult': 2.052938246737663, 'bull_tsl_mult': 0.9164105675498908, 'bull_time_stop': 204, 'bull_use_sma': True, 'bull_use_ema': True, 'bull_use_atr': False, 'bull_use_adx': True, 'bull_use_spike': False, 'bull_rsi_required': False, 'bear_strategy': 'mean_reversion', 'bear_bb_std_mult': 3.526287814084882, 'bear_rsi_os': 48, 'bear_rsi_ob': 48, 'bear_adx_thresh': 5.1821311468252285, 'bear_atr_min_pct': 0.009003401626180376, 'bear_atr_max_pct': 0.10449764948680054, 'bear_tp_mult': 2.9588039587535904, 'bear_tsl_mult': 0.1797073696835504, 'bear_time_stop': 9, 'bear_use_sma': False, 'bear_use_ema': False, 'bear_use_atr': True, 'bear_use_adx': True, 'bear_use_spike': False, 'bear_rsi_required': True, 'sideways_strategy': 'mean_reversion', 'sideways_bb_std_mult': 2.2608424152564783, 'sideways_rsi_os': 22, 'sideways_rsi_ob': 55, 'sideways_adx_thresh': 28.49258224085617, 'sideways_atr_min_pct': 0.02556663708146748, 'sideways_atr_max_pct': 0.036070566940897116, 'sideways_tp_mult': 1.260951342650293, 'sideways_tsl_mult': 0.852058664618006, 'sideways_time_stop': 294, 'sideways_use_sma': False, 'sideways_use_ema': False, 'sideways_use_atr': False, 'sideways_use_adx': False, 'sideways_use_spike': False, 'sideways_rsi_required': True}.
[I 2025-08-30 20:26:09,563] Trial 823 finished with values: [-1000000000.0, 1000000000.0] and parameters: {'p_sma': 47, 'p_std': 9, 'p_atr': 10, 'p_adx': 7, 'rsi_period': 82, 'ema1': 13, 'ema2': 13, 'slip_atr_k': 0.021863860495527594, 'slip_spread_k': 0.6291050545998899, 'spread_hl_frac': 0.04177805498516389, 'bb_std_mult': 1.2077168886766727, 'rsi_os': 34, 'rsi_ob': 63, 'vol_spike': 0.13350363480656813, 'adx_thresh': 23.1716935587894, 'atr_min_pct': 0.02198413989198794, 'atr_max_pct': 0.12440806029781284, 'tp_mult': 2.3194941788489127, 'tsl_mult': 0.7112414511919721, 'strategy': 'mean_reversion', 'time_stop': 56, 'use_sma': False, 'use_atr': False, 'use_adx': True, 'use_ema': True, 'use_spike': False, 'rsi_required': False, 'edge_k': 1.3503580651365965, 'edge_cap': 0.40771087580327636, 'bull_strategy': 'breakout', 'bull_bb_std_mult': 1.8246620217029204, 'bull_rsi_os': 23, 'bull_rsi_ob': 73, 'bull_adx_thresh': 23.228727723773503, 'bull_atr_min_pct': 0.008485421536608778, 'bull_atr_max_pct': 0.0838789382423102, 'bull_tp_mult': 2.0165951414978807, 'bull_tsl_mult': 0.8989928921249578, 'bull_time_stop': 211, 'bull_use_sma': True, 'bull_use_ema': True, 'bull_use_atr': False, 'bull_use_adx': True, 'bull_use_spike': False, 'bull_rsi_required': False, 'bear_strategy': 'mean_reversion', 'bear_bb_std_mult': 3.549239004269292, 'bear_rsi_os': 47, 'bear_rsi_ob': 45, 'bear_adx_thresh': 5.353401469371889, 'bear_atr_min_pct': 0.009346234285190111, 'bear_atr_max_pct': 0.1231070659308797, 'bear_tp_mult': 2.9720402617850334, 'bear_tsl_mult': 0.17109792984211555, 'bear_time_stop': 5, 'bear_use_sma': False, 'bear_use_ema': False, 'bear_use_atr': True, 'bear_use_adx': True, 'bear_use_spike': True, 'bear_rsi_required': True, 'sideways_strategy': 'mean_reversion', 'sideways_bb_std_mult': 2.1676229997797494, 'sideways_rsi_os': 22, 'sideways_rsi_ob': 54, 'sideways_adx_thresh': 26.567380803259653, 'sideways_atr_min_pct': 0.025566150496113844, 'sideways_atr_max_pct': 0.03675709444442419, 'sideways_tp_mult': 1.294265386665518, 'sideways_tsl_mult': 0.8503579114786627, 'sideways_time_stop': 295, 'sideways_use_sma': False, 'sideways_use_ema': False, 'sideways_use_atr': False, 'sideways_use_adx': False, 'sideways_use_spike': False, 'sideways_rsi_required': True}.
[I 2025-08-30 20:26:09,826] Trial 822 finished with values: [-1000000000.0, 1000000000.0] and parameters: {'p_sma': 29, 'p_std': 30, 'p_atr': 10, 'p_adx': 19, 'rsi_period': 53, 'ema1': 14, 'ema2': 17, 'slip_atr_k': 0.02153330252419007, 'slip_spread_k': 0.9730289083272863, 'spread_hl_frac': 0.014433305698692962, 'bb_std_mult': 0.9644778223845661, 'rsi_os': 36, 'rsi_ob': 58, 'vol_spike': 0.117202784640001, 'adx_thresh': 25.02981729768427, 'atr_min_pct': 0.012995167681084474, 'atr_max_pct': 0.12948009080928707, 'tp_mult': 2.2324672371550784, 'tsl_mult': 0.5051768380578947, 'strategy': 'mean_reversion', 'time_stop': 115, 'use_sma': False, 'use_atr': True, 'use_adx': True, 'use_ema': True, 'use_spike': False, 'rsi_required': False, 'edge_k': 1.347634561758018, 'edge_cap': 0.9802465642226272, 'bull_strategy': 'mean_reversion', 'bull_bb_std_mult': 1.84262491634144, 'bull_rsi_os': 51, 'bull_rsi_ob': 73, 'bull_adx_thresh': 24.911611302117652, 'bull_atr_min_pct': 0.0023071509448148657, 'bull_atr_max_pct': 0.0301187805837367, 'bull_tp_mult': 1.4930658635886447, 'bull_tsl_mult': 0.40828890854895006, 'bull_time_stop': 76, 'bull_use_sma': True, 'bull_use_ema': True, 'bull_use_atr': False, 'bull_use_adx': True, 'bull_use_spike': False, 'bull_rsi_required': False, 'bear_strategy': 'mean_reversion', 'bear_bb_std_mult': 3.319740474378694, 'bear_rsi_os': 46, 'bear_rsi_ob': 83, 'bear_adx_thresh': 31.927940663279927, 'bear_atr_min_pct': 0.01681085071498529, 'bear_atr_max_pct': 0.12950231664546025, 'bear_tp_mult': 2.4550066172999263, 'bear_tsl_mult': 0.8964729422415727, 'bear_time_stop': 270, 'bear_use_sma': False, 'bear_use_ema': False, 'bear_use_atr': True, 'bear_use_adx': True, 'bear_use_spike': False, 'bear_rsi_required': False, 'sideways_strategy': 'breakout', 'sideways_bb_std_mult': 1.8409039670058363, 'sideways_rsi_os': 20, 'sideways_rsi_ob': 47, 'sideways_adx_thresh': 9.033282586361427, 'sideways_atr_min_pct': 0.01925168971859435, 'sideways_atr_max_pct': 0.11463927114559666, 'sideways_tp_mult': 1.879920976243381, 'sideways_tsl_mult': 0.628122927967141, 'sideways_time_stop': 276, 'sideways_use_sma': True, 'sideways_use_ema': True, 'sideways_use_atr': False, 'sideways_use_adx': False, 'sideways_use_spike': False, 'sideways_rsi_required': False}.
[I 2025-08-30 20:26:10,006] Trial 821 finished with values: [-1000000000.0, 1000000000.0] and parameters: {'p_sma': 38, 'p_std': 42, 'p_atr': 24, 'p_adx': 7, 'rsi_period': 25, 'ema1': 15, 'ema2': 17, 'slip_atr_k': 0.02035593432999377, 'slip_spread_k': 0.9719648486287045, 'spread_hl_frac': 0.029618463660290396, 'bb_std_mult': 2.3742364270523084, 'rsi_os': 37, 'rsi_ob': 76, 'vol_spike': 0.04606485248273319, 'adx_thresh': 14.351369358124616, 'atr_min_pct': 0.02394216510540992, 'atr_max_pct': 0.13075245150187353, 'tp_mult': 1.096020547023341, 'tsl_mult': 0.30414849702938107, 'strategy': 'mean_reversion', 'time_stop': 114, 'use_sma': False, 'use_atr': True, 'use_adx': True, 'use_ema': True, 'use_spike': False, 'rsi_required': False, 'edge_k': 0.1744630875363561, 'edge_cap': 0.27316871226016187, 'bull_strategy': 'mean_reversion', 'bull_bb_std_mult': 1.8470877568132915, 'bull_rsi_os': 37, 'bull_rsi_ob': 73, 'bull_adx_thresh': 29.517776251863538, 'bull_atr_min_pct': 0.02666569187425722, 'bull_atr_max_pct': 0.08107502493762875, 'bull_tp_mult': 2.4415675773110017, 'bull_tsl_mult': 0.17901080120546348, 'bull_time_stop': 123, 'bull_use_sma': True, 'bull_use_ema': False, 'bull_use_atr': False, 'bull_use_adx': True, 'bull_use_spike': True, 'bull_rsi_required': False, 'bear_strategy': 'mean_reversion', 'bear_bb_std_mult': 0.9287973094613673, 'bear_rsi_os': 22, 'bear_rsi_ob': 83, 'bear_adx_thresh': 5.518492154181795, 'bear_atr_min_pct': 0.016629164574305765, 'bear_atr_max_pct': 0.05579325325736577, 'bear_tp_mult': 2.48338374674483, 'bear_tsl_mult': 0.0746181131657631, 'bear_time_stop': 6, 'bear_use_sma': True, 'bear_use_ema': False, 'bear_use_atr': True, 'bear_use_adx': True, 'bear_use_spike': False, 'bear_rsi_required': True, 'sideways_strategy': 'mean_reversion', 'sideways_bb_std_mult': 2.084930834131575, 'sideways_rsi_os': 16, 'sideways_rsi_ob': 57, 'sideways_adx_thresh': 32.99646078685194, 'sideways_atr_min_pct': 0.019053645577863123, 'sideways_atr_max_pct': 0.14107769289915337, 'sideways_tp_mult': 1.8342859552105941, 'sideways_tsl_mult': 0.6213987757371734, 'sideways_time_stop': 13, 'sideways_use_sma': False, 'sideways_use_ema': True, 'sideways_use_atr': False, 'sideways_use_adx': False, 'sideways_use_spike': False, 'sideways_rsi_required': True}.
[I 2025-08-30 20:26:45,247] Trial 825 finished with values: [-1000000000.0, 1000000000.0] and parameters: {'p_sma': 47, 'p_std': 9, 'p_atr': 10, 'p_adx': 7, 'rsi_period': 83, 'ema1': 14, 'ema2': 14, 'slip_atr_k': 0.027327862045518257, 'slip_spread_k': 0.636863004210789, 'spread_hl_frac': 0.03979601310087225, 'bb_std_mult': 1.185764162251258, 'rsi_os': 46, 'rsi_ob': 65, 'vol_spike': 0.13431912851928432, 'adx_thresh': 23.127028795794516, 'atr_min_pct': 0.021831986383757468, 'atr_max_pct': 0.12536012920280243, 'tp_mult': 2.3112732310249693, 'tsl_mult': 0.6637739373885643, 'strategy': 'mean_reversion', 'time_stop': 53, 'use_sma': False, 'use_atr': True, 'use_adx': False, 'use_ema': False, 'use_spike': True, 'rsi_required': False, 'edge_k': 1.3669620275732475, 'edge_cap': 0.40356187503293894, 'bull_strategy': 'mean_reversion', 'bull_bb_std_mult': 1.7648337970449024, 'bull_rsi_os': 20, 'bull_rsi_ob': 69, 'bull_adx_thresh': 23.56623407757909, 'bull_atr_min_pct': 0.011630823899734308, 'bull_atr_max_pct': 0.08100150291796059, 'bull_tp_mult': 2.0204229032534755, 'bull_tsl_mult': 0.8964609366233338, 'bull_time_stop': 214, 'bull_use_sma': True, 'bull_use_ema': False, 'bull_use_atr': False, 'bull_use_adx': True, 'bull_use_spike': True, 'bull_rsi_required': True, 'bear_strategy': 'breakout', 'bear_bb_std_mult': 3.5498068978756465, 'bear_rsi_os': 47, 'bear_rsi_ob': 49, 'bear_adx_thresh': 5.327551169213274, 'bear_atr_min_pct': 0.00974820141105549, 'bear_atr_max_pct': 0.1148423389362716, 'bear_tp_mult': 2.9983777860190934, 'bear_tsl_mult': 0.17136074887200636, 'bear_time_stop': 9, 'bear_use_sma': True, 'bear_use_ema': False, 'bear_use_atr': False, 'bear_use_adx': False, 'bear_use_spike': False, 'bear_rsi_required': True, 'sideways_strategy': 'mean_reversion', 'sideways_bb_std_mult': 2.151446423890904, 'sideways_rsi_os': 21, 'sideways_rsi_ob': 55, 'sideways_adx_thresh': 26.749224820145308, 'sideways_atr_min_pct': 0.026245051603256013, 'sideways_atr_max_pct': 0.039608190092561904, 'sideways_tp_mult': 1.346493767121357, 'sideways_tsl_mult': 0.8316926145962227, 'sideways_time_stop': 294, 'sideways_use_sma': False, 'sideways_use_ema': True, 'sideways_use_atr': False, 'sideways_use_adx': False, 'sideways_use_spike': False, 'sideways_rsi_required': True}.
[I 2025-08-30 20:26:46,481] Trial 828 finished with values: [-1000000000.0, 1000000000.0] and parameters: {'p_sma': 47, 'p_std': 7, 'p_atr': 16, 'p_adx': 7, 'rsi_period': 83, 'ema1': 12, 'ema2': 13, 'slip_atr_k': 0.028787757712819124, 'slip_spread_k': 0.652753426926229, 'spread_hl_frac': 0.03748606339255122, 'bb_std_mult': 1.1715818869838404, 'rsi_os': 18, 'rsi_ob': 64, 'vol_spike': 0.1258951935312532, 'adx_thresh': 23.065771039482808, 'atr_min_pct': 0.02170311060816034, 'atr_max_pct': 0.12696806430044355, 'tp_mult': 2.30761584595884, 'tsl_mult': 0.6619913959195555, 'strategy': 'breakout', 'time_stop': 53, 'use_sma': True, 'use_atr': True, 'use_adx': False, 'use_ema': False, 'use_spike': True, 'rsi_required': True, 'edge_k': 1.3691942517725033, 'edge_cap': 0.43206977952005443, 'bull_strategy': 'mean_reversion', 'bull_bb_std_mult': 1.6531972214595412, 'bull_rsi_os': 17, 'bull_rsi_ob': 50, 'bull_adx_thresh': 23.80212001567203, 'bull_atr_min_pct': 0.0076962446198983, 'bull_atr_max_pct': 0.08551890948618715, 'bull_tp_mult': 2.004771375012239, 'bull_tsl_mult': 0.9229834954960917, 'bull_time_stop': 204, 'bull_use_sma': True, 'bull_use_ema': False, 'bull_use_atr': True, 'bull_use_adx': False, 'bull_use_spike': True, 'bull_rsi_required': True, 'bear_strategy': 'breakout', 'bear_bb_std_mult': 3.5696472110848676, 'bear_rsi_os': 48, 'bear_rsi_ob': 46, 'bear_adx_thresh': 5.103407174564636, 'bear_atr_min_pct': 0.009773261689815778, 'bear_atr_max_pct': 0.10013906350780463, 'bear_tp_mult': 2.9186589819409656, 'bear_tsl_mult': 0.1499807358808776, 'bear_time_stop': 10, 'bear_use_sma': True, 'bear_use_ema': True, 'bear_use_atr': False, 'bear_use_adx': False, 'bear_use_spike': False, 'bear_rsi_required': True, 'sideways_strategy': 'mean_reversion', 'sideways_bb_std_mult': 2.196156083432591, 'sideways_rsi_os': 23, 'sideways_rsi_ob': 55, 'sideways_adx_thresh': 25.221471490862196, 'sideways_atr_min_pct': 0.026722467180759848, 'sideways_atr_max_pct': 0.03103829055375489, 'sideways_tp_mult': 1.3585217879511045, 'sideways_tsl_mult': 0.8341207393343499, 'sideways_time_stop': 288, 'sideways_use_sma': False, 'sideways_use_ema': True, 'sideways_use_atr': False, 'sideways_use_adx': False, 'sideways_use_spike': True, 'sideways_rsi_required': True}.
[I 2025-08-30 20:26:46,807] Trial 826 finished with values: [-1000000000.0, 1000000000.0] and parameters: {'p_sma': 46, 'p_std': 10, 'p_atr': 23, 'p_adx': 7, 'rsi_period': 83, 'ema1': 14, 'ema2': 14, 'slip_atr_k': 0.02816440577493296, 'slip_spread_k': 0.6476152888204493, 'spread_hl_frac': 0.03815006927257843, 'bb_std_mult': 1.111225078332315, 'rsi_os': 36, 'rsi_ob': 67, 'vol_spike': 0.1402768010928358, 'adx_thresh': 22.642526500752773, 'atr_min_pct': 0.022155161342819033, 'atr_max_pct': 0.1279144840158478, 'tp_mult': 2.305783260081463, 'tsl_mult': 0.6693635195116435, 'strategy': 'breakout', 'time_stop': 62, 'use_sma': False, 'use_atr': True, 'use_adx': False, 'use_ema': False, 'use_spike': True, 'rsi_required': True, 'edge_k': 1.370928339219801, 'edge_cap': 0.4901763267661731, 'bull_strategy': 'mean_reversion', 'bull_bb_std_mult': 1.6634534849957987, 'bull_rsi_os': 20, 'bull_rsi_ob': 50, 'bull_adx_thresh': 23.724127533989332, 'bull_atr_min_pct': 0.007246542000528731, 'bull_atr_max_pct': 0.08182546940826166, 'bull_tp_mult': 2.0168624668537363, 'bull_tsl_mult': 0.8988689695496326, 'bull_time_stop': 202, 'bull_use_sma': True, 'bull_use_ema': False, 'bull_use_atr': False, 'bull_use_adx': True, 'bull_use_spike': True, 'bull_rsi_required': True, 'bear_strategy': 'breakout', 'bear_bb_std_mult': 3.5406730656531993, 'bear_rsi_os': 47, 'bear_rsi_ob': 46, 'bear_adx_thresh': 5.054683998890243, 'bear_atr_min_pct': 0.009457655365248332, 'bear_atr_max_pct': 0.11474793605445277, 'bear_tp_mult': 2.9081592102717053, 'bear_tsl_mult': 0.16456313506533446, 'bear_time_stop': 6, 'bear_use_sma': True, 'bear_use_ema': False, 'bear_use_atr': False, 'bear_use_adx': False, 'bear_use_spike': False, 'bear_rsi_required': True, 'sideways_strategy': 'mean_reversion', 'sideways_bb_std_mult': 2.210674825959442, 'sideways_rsi_os': 23, 'sideways_rsi_ob': 55, 'sideways_adx_thresh': 25.840995948585665, 'sideways_atr_min_pct': 0.02618993334014589, 'sideways_atr_max_pct': 0.04001174554458869, 'sideways_tp_mult': 1.3200873594524982, 'sideways_tsl_mult': 0.8289178845323377, 'sideways_time_stop': 291, 'sideways_use_sma': False, 'sideways_use_ema': True, 'sideways_use_atr': False, 'sideways_use_adx': False, 'sideways_use_spike': True, 'sideways_rsi_required': True}.
