[I 2025-08-30 18:52:38,902] Trial 134 finished with values: [-1000000000.0, 1000000000.0] and parameters: {'p_sma': 41, 'p_std': 57, 'p_atr': 9, 'p_adx': 28, 'rsi_period': 51, 'ema1': 26, 'ema2': 16, 'slip_atr_k': 0.23877028930764654, 'slip_spread_k': 0.5612061780780747, 'spread_hl_frac': 0.007022270814556048, 'bb_std_mult': 3.335863855164561, 'rsi_os': 40, 'rsi_ob': 53, 'vol_spike': 0.23563925584426182, 'adx_thresh': 14.29000521614302, 'atr_min_pct': 0.023038756403361945, 'atr_max_pct': 0.07111893468904454, 'tp_mult': 2.1671148513273155, 'tsl_mult': 0.7315312567115104, 'strategy': 'mean_reversion', 'time_stop': 88, 'use_sma': False, 'use_atr': False, 'use_adx': False, 'use_ema': False, 'use_spike': True, 'rsi_required': True, 'edge_k': 0.426162135991644, 'edge_cap': 0.22034359500626752, 'bull_strategy': 'mean_reversion', 'bull_bb_std_mult': 1.8841136303633303, 'bull_rsi_os': 5, 'bull_rsi_ob': 87, 'bull_adx_thresh': 25.285810614654807, 'bull_atr_min_pct': 0.002116488146781645, 'bull_atr_max_pct': 0.01805029491592572, 'bull_tp_mult': 2.1598591097340964, 'bull_tsl_mult': 0.9402806972391636, 'bull_time_stop': 190, 'bull_use_sma': False, 'bull_use_ema': True, 'bull_use_atr': False, 'bull_use_adx': True, 'bull_use_spike': True, 'bull_rsi_required': True, 'bear_strategy': 'breakout', 'bear_bb_std_mult': 1.9974448773233098, 'bear_rsi_os': 43, 'bear_rsi_ob': 84, 'bear_adx_thresh': 15.565114089729743, 'bear_atr_min_pct': 0.014726451740363434, 'bear_atr_max_pct': 0.014992222435045555, 'bear_tp_mult': 2.890008350624013, 'bear_tsl_mult': 0.05818859847840315, 'bear_time_stop': 275, 'bear_use_sma': True, 'bear_use_ema': False, 'bear_use_atr': True, 'bear_use_adx': True, 'bear_use_spike': False, 'bear_rsi_required': False, 'sideways_strategy': 'mean_reversion', 'sideways_bb_std_mult': 2.0527503126394904, 'sideways_rsi_os': 16, 'sideways_rsi_ob': 61, 'sideways_adx_thresh': 10.422561276615658, 'sideways_atr_min_pct': 0.020729370945211135, 'sideways_atr_max_pct': 0.08353726957126237, 'sideways_tp_mult': 1.7921595029200326, 'sideways_tsl_mult': 0.7725034403236436, 'sideways_time_stop': 202, 'sideways_use_sma': True, 'sideways_use_ema': True, 'sideways_use_atr': True, 'sideways_use_adx': True, 'sideways_use_spike': False, 'sideways_rsi_required': True}.
[I 2025-08-30 18:52:39,724] Trial 136 finished with values: [-1000000000.0, 1000000000.0] and parameters: {'p_sma': 31, 'p_std': 56, 'p_atr': 10, 'p_adx': 17, 'rsi_period': 43, 'ema1': 24, 'ema2': 16, 'slip_atr_k': 0.037505283401462, 'slip_spread_k': 0.35246241449091953, 'spread_hl_frac': 0.042493789945605306, 'bb_std_mult': 0.927475757476407, 'rsi_os': 50, 'rsi_ob': 48, 'vol_spike': 0.036839781770079, 'adx_thresh': 20.654105136584864, 'atr_min_pct': 0.02267919746560553, 'atr_max_pct': 0.11007047968706869, 'tp_mult': 2.72341661190497, 'tsl_mult': 0.9977913776553539, 'strategy': 'breakout', 'time_stop': 58, 'use_sma': True, 'use_atr': True, 'use_adx': True, 'use_ema': False, 'use_spike': True, 'rsi_required': True, 'edge_k': 0.7193182068308641, 'edge_cap': 0.18381239310678732, 'bull_strategy': 'mean_reversion', 'bull_bb_std_mult': 3.361493328392556, 'bull_rsi_os': 38, 'bull_rsi_ob': 95, 'bull_adx_thresh': 13.483966005297667, 'bull_atr_min_pct': 0.001690088466795321, 'bull_atr_max_pct': 0.03148136504601838, 'bull_tp_mult': 1.1749681331972415, 'bull_tsl_mult': 0.9980862534277907, 'bull_time_stop': 190, 'bull_use_sma': True, 'bull_use_ema': False, 'bull_use_atr': False, 'bull_use_adx': True, 'bull_use_spike': False, 'bull_rsi_required': False, 'bear_strategy': 'breakout', 'bear_bb_std_mult': 3.470283939787077, 'bear_rsi_os': 7, 'bear_rsi_ob': 85, 'bear_adx_thresh': 34.92483966055124, 'bear_atr_min_pct': 0.009410061222629742, 'bear_atr_max_pct': 0.05866484111530632, 'bear_tp_mult': 1.6939509248496676, 'bear_tsl_mult': 0.054760642972580285, 'bear_time_stop': 45, 'bear_use_sma': True, 'bear_use_ema': False, 'bear_use_atr': False, 'bear_use_adx': False, 'bear_use_spike': True, 'bear_rsi_required': False, 'sideways_strategy': 'breakout', 'sideways_bb_std_mult': 1.2223226249113144, 'sideways_rsi_os': 28, 'sideways_rsi_ob': 69, 'sideways_adx_thresh': 21.364572909858754, 'sideways_atr_min_pct': 0.019457491386347652, 'sideways_atr_max_pct': 0.14670004284441474, 'sideways_tp_mult': 1.7993114449817413, 'sideways_tsl_mult': 0.6911949325493616, 'sideways_time_stop': 105, 'sideways_use_sma': True, 'sideways_use_ema': False, 'sideways_use_atr': True, 'sideways_use_adx': False, 'sideways_use_spike': False, 'sideways_rsi_required': False}.
[I 2025-08-30 18:52:39,818] Trial 137 finished with values: [-1000000000.0, 1000000000.0] and parameters: {'p_sma': 36, 'p_std': 55, 'p_atr': 9, 'p_adx': 13, 'rsi_period': 53, 'ema1': 25, 'ema2': 16, 'slip_atr_k': 0.004652207987568328, 'slip_spread_k': 0.8189475420848491, 'spread_hl_frac': 0.0031207991962848088, 'bb_std_mult': 0.9045977711567978, 'rsi_os': 33, 'rsi_ob': 92, 'vol_spike': 0.23086166207323017, 'adx_thresh': 20.808506029334044, 'atr_min_pct': 0.023411975985384578, 'atr_max_pct': 0.12280789740445328, 'tp_mult': 2.3785652604086955, 'tsl_mult': 0.6076645706507188, 'strategy': 'breakout', 'time_stop': 229, 'use_sma': False, 'use_atr': True, 'use_adx': True, 'use_ema': False, 'use_spike': True, 'rsi_required': True, 'edge_k': 0.686144580453597, 'edge_cap': 0.23111004659643303, 'bull_strategy': 'mean_reversion', 'bull_bb_std_mult': 2.6671136593930145, 'bull_rsi_os': 38, 'bull_rsi_ob': 76, 'bull_adx_thresh': 25.647983006778066, 'bull_atr_min_pct': 0.0019449757990422992, 'bull_atr_max_pct': 0.0322179222779733, 'bull_tp_mult': 1.2261368297390565, 'bull_tsl_mult': 0.3213451951590125, 'bull_time_stop': 189, 'bull_use_sma': True, 'bull_use_ema': False, 'bull_use_atr': False, 'bull_use_adx': True, 'bull_use_spike': False, 'bull_rsi_required': True, 'bear_strategy': 'breakout', 'bear_bb_std_mult': 3.5234381118877014, 'bear_rsi_os': 48, 'bear_rsi_ob': 67, 'bear_adx_thresh': 6.397391127634695, 'bear_atr_min_pct': 0.014471907882633151, 'bear_atr_max_pct': 0.058133783772420455, 'bear_tp_mult': 1.7610875105344566, 'bear_tsl_mult': 0.050841379609637236, 'bear_time_stop': 47, 'bear_use_sma': False, 'bear_use_ema': False, 'bear_use_atr': True, 'bear_use_adx': True, 'bear_use_spike': False, 'bear_rsi_required': False, 'sideways_strategy': 'breakout', 'sideways_bb_std_mult': 1.216842228992883, 'sideways_rsi_os': 37, 'sideways_rsi_ob': 69, 'sideways_adx_thresh': 10.443100726531934, 'sideways_atr_min_pct': 0.015178177335795795, 'sideways_atr_max_pct': 0.1470056411187071, 'sideways_tp_mult': 1.7266873393153694, 'sideways_tsl_mult': 0.7772961519906039, 'sideways_time_stop': 33, 'sideways_use_sma': True, 'sideways_use_ema': False, 'sideways_use_atr': False, 'sideways_use_adx': False, 'sideways_use_spike': False, 'sideways_rsi_required': False}.
[I 2025-08-30 18:53:13,387] Trial 139 finished with values: [-1000000000.0, 1000000000.0] and parameters: {'p_sma': 37, 'p_std': 23, 'p_atr': 10, 'p_adx': 17, 'rsi_period': 56, 'ema1': 18, 'ema2': 18, 'slip_atr_k': 0.0046037793953948095, 'slip_spread_k': 0.35127143175014824, 'spread_hl_frac': 0.002988728522268825, 'bb_std_mult': 0.9378562823826854, 'rsi_os': 13, 'rsi_ob': 87, 'vol_spike': 0.04100149271821155, 'adx_thresh': 19.155636207402935, 'atr_min_pct': 0.004730193336849741, 'atr_max_pct': 0.1244331211622074, 'tp_mult': 1.5940777459916076, 'tsl_mult': 0.5699040070048778, 'strategy': 'breakout', 'time_stop': 34, 'use_sma': True, 'use_atr': True, 'use_adx': True, 'use_ema': False, 'use_spike': True, 'rsi_required': False, 'edge_k': 0.7492750325204907, 'edge_cap': 0.27703243419657264, 'bull_strategy': 'breakout', 'bull_bb_std_mult': 1.969378367724703, 'bull_rsi_os': 48, 'bull_rsi_ob': 57, 'bull_adx_thresh': 25.80895404735495, 'bull_atr_min_pct': 0.0029152574472626506, 'bull_atr_max_pct': 0.12113842909777314, 'bull_tp_mult': 2.020648984799598, 'bull_tsl_mult': 0.5128144973499793, 'bull_time_stop': 129, 'bull_use_sma': True, 'bull_use_ema': False, 'bull_use_atr': True, 'bull_use_adx': False, 'bull_use_spike': False, 'bull_rsi_required': False, 'bear_strategy': 'mean_reversion', 'bear_bb_std_mult': 3.485389849162934, 'bear_rsi_os': 38, 'bear_rsi_ob': 80, 'bear_adx_thresh': 10.302312072807464, 'bear_atr_min_pct': 0.01266934171674729, 'bear_atr_max_pct': 0.058901705757534596, 'bear_tp_mult': 1.7269727905369276, 'bear_tsl_mult': 0.0968587059089591, 'bear_time_stop': 40, 'bear_use_sma': False, 'bear_use_ema': False, 'bear_use_atr': False, 'bear_use_adx': False, 'bear_use_spike': True, 'bear_rsi_required': True, 'sideways_strategy': 'breakout', 'sideways_bb_std_mult': 0.6600239427870276, 'sideways_rsi_os': 18, 'sideways_rsi_ob': 59, 'sideways_adx_thresh': 34.036853621767364, 'sideways_atr_min_pct': 0.017123594082460527, 'sideways_atr_max_pct': 0.10713349770709252, 'sideways_tp_mult': 1.7214257135880546, 'sideways_tsl_mult': 0.6577574558222025, 'sideways_time_stop': 294, 'sideways_use_sma': True, 'sideways_use_ema': False, 'sideways_use_atr': False, 'sideways_use_adx': False, 'sideways_use_spike': False, 'sideways_rsi_required': False}.
[I 2025-08-30 18:53:14,496] Trial 138 finished with values: [-1000000000.0, 1000000000.0] and parameters: {'p_sma': 36, 'p_std': 23, 'p_atr': 24, 'p_adx': 17, 'rsi_period': 46, 'ema1': 16, 'ema2': 42, 'slip_atr_k': 0.03618388068426728, 'slip_spread_k': 0.822241330971039, 'spread_hl_frac': 0.0009208281427387291, 'bb_std_mult': 0.9449608561715475, 'rsi_os': 14, 'rsi_ob': 91, 'vol_spike': 0.2845279340777993, 'adx_thresh': 19.338072943815444, 'atr_min_pct': 0.004690061112224248, 'atr_max_pct': 0.12297508468154046, 'tp_mult': 1.5668344500114502, 'tsl_mult': 0.6106730740872063, 'strategy': 'breakout', 'time_stop': 34, 'use_sma': True, 'use_atr': True, 'use_adx': False, 'use_ema': False, 'use_spike': True, 'rsi_required': True, 'edge_k': 0.7051189564450387, 'edge_cap': 0.2319302998503352, 'bull_strategy': 'mean_reversion', 'bull_bb_std_mult': 2.8658403723031443, 'bull_rsi_os': 45, 'bull_rsi_ob': 76, 'bull_adx_thresh': 11.473509437310481, 'bull_atr_min_pct': 0.002861916108624858, 'bull_atr_max_pct': 0.03137180921150211, 'bull_tp_mult': 2.0530911579964664, 'bull_tsl_mult': 0.9976525978885613, 'bull_time_stop': 189, 'bull_use_sma': True, 'bull_use_ema': False, 'bull_use_atr': False, 'bull_use_adx': False, 'bull_use_spike': False, 'bull_rsi_required': False, 'bear_strategy': 'mean_reversion', 'bear_bb_std_mult': 3.4905434314020396, 'bear_rsi_os': 46, 'bear_rsi_ob': 84, 'bear_adx_thresh': 25.174788212216505, 'bear_atr_min_pct': 0.014364098667409564, 'bear_atr_max_pct': 0.059590966078290314, 'bear_tp_mult': 1.3749090883928088, 'bear_tsl_mult': 0.7203708038090914, 'bear_time_stop': 45, 'bear_use_sma': False, 'bear_use_ema': False, 'bear_use_atr': False, 'bear_use_adx': False, 'bear_use_spike': True, 'bear_rsi_required': False, 'sideways_strategy': 'breakout', 'sideways_bb_std_mult': 0.5693621474944783, 'sideways_rsi_os': 14, 'sideways_rsi_ob': 59, 'sideways_adx_thresh': 9.955537001685315, 'sideways_atr_min_pct': 0.019316863642642883, 'sideways_atr_max_pct': 0.10763186514718497, 'sideways_tp_mult': 1.7746002804131873, 'sideways_tsl_mult': 0.7668590686298388, 'sideways_time_stop': 267, 'sideways_use_sma': True, 'sideways_use_ema': True, 'sideways_use_atr': True, 'sideways_use_adx': False, 'sideways_use_spike': False, 'sideways_rsi_required': False}.
[I 2025-08-30 18:53:14,973] Trial 141 finished with values: [-0.027144996642541774, 0.027045837197840504] and parameters: {'p_sma': 40, 'p_std': 23, 'p_atr': 25, 'p_adx': 25, 'rsi_period': 58, 'ema1': 16, 'ema2': 14, 'slip_atr_k': 0.06811821494759376, 'slip_spread_k': 0.38392954560093845, 'spread_hl_frac': 0.04811525622965951, 'bb_std_mult': 2.162185783787787, 'rsi_os': 20, 'rsi_ob': 60, 'vol_spike': 0.04213711276203888, 'adx_thresh': 19.005032356951993, 'atr_min_pct': 0.011040163154740299, 'atr_max_pct': 0.03593785868860688, 'tp_mult': 1.573385362824462, 'tsl_mult': 0.5770244142281602, 'strategy': 'breakout', 'time_stop': 35, 'use_sma': False, 'use_atr': True, 'use_adx': False, 'use_ema': True, 'use_spike': True, 'rsi_required': False, 'edge_k': 0.26602738575496143, 'edge_cap': 0.27792732901467704, 'bull_strategy': 'breakout', 'bull_bb_std_mult': 1.9632693175644154, 'bull_rsi_os': 45, 'bull_rsi_ob': 71, 'bull_adx_thresh': 11.782014600661439, 'bull_atr_min_pct': 0.00042663868884845486, 'bull_atr_max_pct': 0.12197415552248603, 'bull_tp_mult': 2.0530161546896113, 'bull_tsl_mult': 0.16954644772140187, 'bull_time_stop': 135, 'bull_use_sma': True, 'bull_use_ema': False, 'bull_use_atr': True, 'bull_use_adx': False, 'bull_use_spike': True, 'bull_rsi_required': True, 'bear_strategy': 'mean_reversion', 'bear_bb_std_mult': 2.3156904262224534, 'bear_rsi_os': 38, 'bear_rsi_ob': 81, 'bear_adx_thresh': 7.889220833620136, 'bear_atr_min_pct': 0.012708189003054954, 'bear_atr_max_pct': 0.06087644193663677, 'bear_tp_mult': 2.2092089842406604, 'bear_tsl_mult': 0.08447849901772998, 'bear_time_stop': 193, 'bear_use_sma': False, 'bear_use_ema': False, 'bear_use_atr': False, 'bear_use_adx': False, 'bear_use_spike': False, 'bear_rsi_required': True, 'sideways_strategy': 'breakout', 'sideways_bb_std_mult': 0.5768405899264457, 'sideways_rsi_os': 14, 'sideways_rsi_ob': 58, 'sideways_adx_thresh': 29.499047025915786, 'sideways_atr_min_pct': 0.011267230890744313, 'sideways_atr_max_pct': 0.04095399038348123, 'sideways_tp_mult': 1.1544056159293041, 'sideways_tsl_mult': 0.6626894490799727, 'sideways_time_stop': 267, 'sideways_use_sma': True, 'sideways_use_ema': True, 'sideways_use_atr': False, 'sideways_use_adx': False, 'sideways_use_spike': False, 'sideways_rsi_required': False}.
[I 2025-08-30 18:53:15,125] Trial 140 finished with values: [-1000000000.0, 1000000000.0] and parameters: {'p_sma': 23, 'p_std': 23, 'p_atr': 8, 'p_adx': 25, 'rsi_period': 59, 'ema1': 18, 'ema2': 18, 'slip_atr_k': 0.08142012582933279, 'slip_spread_k': 0.2911034765759595, 'spread_hl_frac': 0.003018432595883077, 'bb_std_mult': 1.1019401785956522, 'rsi_os': 13, 'rsi_ob': 60, 'vol_spike': 0.283127663795615, 'adx_thresh': 19.099087751841047, 'atr_min_pct': 0.0234805280253563, 'atr_max_pct': 0.12277548264167865, 'tp_mult': 2.3792649992117703, 'tsl_mult': 0.6438388271368811, 'strategy': 'breakout', 'time_stop': 142, 'use_sma': False, 'use_atr': True, 'use_adx': False, 'use_ema': True, 'use_spike': True, 'rsi_required': False, 'edge_k': 0.5610986481085112, 'edge_cap': 0.6821676478331349, 'bull_strategy': 'breakout', 'bull_bb_std_mult': 2.6512240132063143, 'bull_rsi_os': 45, 'bull_rsi_ob': 76, 'bull_adx_thresh': 23.86028638711809, 'bull_atr_min_pct': 0.003068410588231039, 'bull_atr_max_pct': 0.10234374574418598, 'bull_tp_mult': 2.030708964880119, 'bull_tsl_mult': 0.2343195061806504, 'bull_time_stop': 206, 'bull_use_sma': True, 'bull_use_ema': False, 'bull_use_atr': True, 'bull_use_adx': False, 'bull_use_spike': False, 'bull_rsi_required': True, 'bear_strategy': 'mean_reversion', 'bear_bb_std_mult': 1.8453447444393112, 'bear_rsi_os': 38, 'bear_rsi_ob': 76, 'bear_adx_thresh': 6.304314700082162, 'bear_atr_min_pct': 0.012755470526295403, 'bear_atr_max_pct': 0.053102901189893026, 'bear_tp_mult': 2.195625830987706, 'bear_tsl_mult': 0.8335529286543895, 'bear_time_stop': 39, 'bear_use_sma': False, 'bear_use_ema': False, 'bear_use_atr': True, 'bear_use_adx': True, 'bear_use_spike': False, 'bear_rsi_required': True, 'sideways_strategy': 'breakout', 'sideways_bb_std_mult': 3.1288620493213033, 'sideways_rsi_os': 14, 'sideways_rsi_ob': 59, 'sideways_adx_thresh': 9.913572732639738, 'sideways_atr_min_pct': 0.027085325661405597, 'sideways_atr_max_pct': 0.04063671138784893, 'sideways_tp_mult': 1.7227846841689745, 'sideways_tsl_mult': 0.8853114306013709, 'sideways_time_stop': 286, 'sideways_use_sma': True, 'sideways_use_ema': True, 'sideways_use_atr': False, 'sideways_use_adx': False, 'sideways_use_spike': False, 'sideways_rsi_required': False}.
[I 2025-08-30 18:53:15,546] Trial 143 finished with values: [-1000000000.0, 1000000000.0] and parameters: {'p_sma': 40, 'p_std': 26, 'p_atr': 8, 'p_adx': 9, 'rsi_period': 73, 'ema1': 22, 'ema2': 14, 'slip_atr_k': 0.016480609967450283, 'slip_spread_k': 0.2364479358198387, 'spread_hl_frac': 0.0053036872218229945, 'bb_std_mult': 2.175323681008487, 'rsi_os': 38, 'rsi_ob': 60, 'vol_spike': 0.2988172588075208, 'adx_thresh': 18.321252718226994, 'atr_min_pct': 0.011232931880051904, 'atr_max_pct': 0.010444064160853153, 'tp_mult': 2.206843056130072, 'tsl_mult': 0.6446265940591666, 'strategy': 'breakout', 'time_stop': 48, 'use_sma': False, 'use_atr': True, 'use_adx': False, 'use_ema': True, 'use_spike': True, 'rsi_required': False, 'edge_k': 0.5742591233212405, 'edge_cap': 0.8205000609029225, 'bull_strategy': 'breakout', 'bull_bb_std_mult': 1.785984110799571, 'bull_rsi_os': 20, 'bull_rsi_ob': 71, 'bull_adx_thresh': 23.925596417934177, 'bull_atr_min_pct': 0.0005318876353966021, 'bull_atr_max_pct': 0.04570843763121665, 'bull_tp_mult': 2.7674937868944083, 'bull_tsl_mult': 0.1538458148409036, 'bull_time_stop': 62, 'bull_use_sma': True, 'bull_use_ema': False, 'bull_use_atr': True, 'bull_use_adx': True, 'bull_use_spike': True, 'bull_rsi_required': True, 'bear_strategy': 'breakout', 'bear_bb_std_mult': 1.8416311217225922, 'bear_rsi_os': 53, 'bear_rsi_ob': 59, 'bear_adx_thresh': 8.011725278648456, 'bear_atr_min_pct': 0.0178144702029437, 'bear_atr_max_pct': 0.053995839329792385, 'bear_tp_mult': 1.4908867909821677, 'bear_tsl_mult': 0.8501763832001414, 'bear_time_stop': 300, 'bear_use_sma': True, 'bear_use_ema': True, 'bear_use_atr': True, 'bear_use_adx': True, 'bear_use_spike': False, 'bear_rsi_required': True, 'sideways_strategy': 'breakout', 'sideways_bb_std_mult': 2.1600774163844743, 'sideways_rsi_os': 17, 'sideways_rsi_ob': 58, 'sideways_adx_thresh': 27.060484465317778, 'sideways_atr_min_pct': 0.018650059161385454, 'sideways_atr_max_pct': 0.07605169483005436, 'sideways_tp_mult': 2.632415699031249, 'sideways_tsl_mult': 0.5798825339154341, 'sideways_time_stop': 284, 'sideways_use_sma': False, 'sideways_use_ema': True, 'sideways_use_atr': False, 'sideways_use_adx': False, 'sideways_use_spike': False, 'sideways_rsi_required': False}.
[I 2025-08-30 18:53:47,021] Trial 142 finished with values: [-1000000000.0, 1000000000.0] and parameters: {'p_sma': 44, 'p_std': 25, 'p_atr': 15, 'p_adx': 11, 'rsi_period': 46, 'ema1': 29, 'ema2': 14, 'slip_atr_k': 0.03319644073379411, 'slip_spread_k': 0.5266826640944807, 'spread_hl_frac': 0.024549262539401314, 'bb_std_mult': 0.7566170213140233, 'rsi_os': 26, 'rsi_ob': 51, 'vol_spike': 0.27773977836315467, 'adx_thresh': 18.197747415468207, 'atr_min_pct': 0.014114441762880023, 'atr_max_pct': 0.020729426774987, 'tp_mult': 2.1936824891607585, 'tsl_mult': 0.8319831181410597, 'strategy': 'breakout', 'time_stop': 21, 'use_sma': False, 'use_atr': True, 'use_adx': False, 'use_ema': True, 'use_spike': True, 'rsi_required': False, 'edge_k': 1.9891955690600511, 'edge_cap': 0.5522014900176095, 'bull_strategy': 'breakout', 'bull_bb_std_mult': 2.2085876544556093, 'bull_rsi_os': 20, 'bull_rsi_ob': 71, 'bull_adx_thresh': 11.520364784736028, 'bull_atr_min_pct': 0.009299816611619379, 'bull_atr_max_pct': 0.07118955339195178, 'bull_tp_mult': 2.779213490962567, 'bull_tsl_mult': 0.9650153894557874, 'bull_time_stop': 77, 'bull_use_sma': True, 'bull_use_ema': False, 'bull_use_atr': False, 'bull_use_adx': False, 'bull_use_spike': True, 'bull_rsi_required': True, 'bear_strategy': 'mean_reversion', 'bear_bb_std_mult': 3.1249959214853043, 'bear_rsi_os': 44, 'bear_rsi_ob': 70, 'bear_adx_thresh': 5.728839488975721, 'bear_atr_min_pct': 0.017882301843516607, 'bear_atr_max_pct': 0.11939744816658972, 'bear_tp_mult': 1.4923591707130188, 'bear_tsl_mult': 0.7179981039057217, 'bear_time_stop': 186, 'bear_use_sma': True, 'bear_use_ema': False, 'bear_use_atr': True, 'bear_use_adx': True, 'bear_use_spike': False, 'bear_rsi_required': False, 'sideways_strategy': 'breakout', 'sideways_bb_std_mult': 2.1524926903730397, 'sideways_rsi_os': 17, 'sideways_rsi_ob': 58, 'sideways_adx_thresh': 9.834306929473648, 'sideways_atr_min_pct': 0.026774227981078348, 'sideways_atr_max_pct': 0.12168346596978216, 'sideways_tp_mult': 1.1756712589543934, 'sideways_tsl_mult': 0.581153797524828, 'sideways_time_stop': 268, 'sideways_use_sma': True, 'sideways_use_ema': True, 'sideways_use_atr': False, 'sideways_use_adx': False, 'sideways_use_spike': False, 'sideways_rsi_required': False}.
