[I 2025-08-30 20:13:07,652] Trial 729 finished with values: [-1000000000.0, 1000000000.0] and parameters: {'p_sma': 49, 'p_std': 27, 'p_atr': 14, 'p_adx': 28, 'rsi_period': 80, 'ema1': 25, 'ema2': 40, 'slip_atr_k': 0.017014254271231957, 'slip_spread_k': 0.8437893362883908, 'spread_hl_frac': 0.040152163747689616, 'bb_std_mult': 1.1324012278916786, 'rsi_os': 20, 'rsi_ob': 56, 'vol_spike': 0.05003835547456693, 'adx_thresh': 12.122017242526887, 'atr_min_pct': 0.025406299225656435, 'atr_max_pct': 0.1024760550218291, 'tp_mult': 2.554372821238307, 'tsl_mult': 0.7185016362424871, 'strategy': 'breakout', 'time_stop': 32, 'use_sma': False, 'use_atr': True, 'use_adx': False, 'use_ema': True, 'use_spike': False, 'rsi_required': True, 'edge_k': 0.2309796858707382, 'edge_cap': 0.31759890400704077, 'bull_strategy': 'mean_reversion', 'bull_bb_std_mult': 1.029155906908022, 'bull_rsi_os': 50, 'bull_rsi_ob': 71, 'bull_adx_thresh': 26.434212473455933, 'bull_atr_min_pct': 0.002577639285207088, 'bull_atr_max_pct': 0.0204486162474199, 'bull_tp_mult': 1.2186877171544088, 'bull_tsl_mult': 0.9828302343826874, 'bull_time_stop': 263, 'bull_use_sma': True, 'bull_use_ema': False, 'bull_use_atr': False, 'bull_use_adx': True, 'bull_use_spike': True, 'bull_rsi_required': False, 'bear_strategy': 'breakout', 'bear_bb_std_mult': 2.4817659919945556, 'bear_rsi_os': 44, 'bear_rsi_ob': 82, 'bear_adx_thresh': 7.106053777997342, 'bear_atr_min_pct': 0.015304956303491744, 'bear_atr_max_pct': 0.05113243844130004, 'bear_tp_mult': 1.8373811188464757, 'bear_tsl_mult': 0.029355274193593905, 'bear_time_stop': 153, 'bear_use_sma': True, 'bear_use_ema': False, 'bear_use_atr': True, 'bear_use_adx': True, 'bear_use_spike': False, 'bear_rsi_required': False, 'sideways_strategy': 'breakout', 'sideways_bb_std_mult': 2.1357946745487153, 'sideways_rsi_os': 17, 'sideways_rsi_ob': 82, 'sideways_adx_thresh': 30.471289155077123, 'sideways_atr_min_pct': 0.025784564159797838, 'sideways_atr_max_pct': 0.08032433300864714, 'sideways_tp_mult': 1.75968925069619, 'sideways_tsl_mult': 0.32158519293169535, 'sideways_time_stop': 89, 'sideways_use_sma': True, 'sideways_use_ema': True, 'sideways_use_atr': False, 'sideways_use_adx': False, 'sideways_use_spike': False, 'sideways_rsi_required': False}.
[I 2025-08-30 20:13:07,750] Trial 728 finished with values: [-0.08731772657682524, 0.08713563589745306] and parameters: {'p_sma': 46, 'p_std': 26, 'p_atr': 13, 'p_adx': 9, 'rsi_period': 84, 'ema1': 25, 'ema2': 26, 'slip_atr_k': 0.24512083478223567, 'slip_spread_k': 0.3947284494403893, 'spread_hl_frac': 0.005979475544412244, 'bb_std_mult': 1.1471236237483864, 'rsi_os': 19, 'rsi_ob': 56, 'vol_spike': 0.04814983754178527, 'adx_thresh': 19.297969116261147, 'atr_min_pct': 0.023130686635875024, 'atr_max_pct': 0.1380972995611255, 'tp_mult': 2.1579660184679934, 'tsl_mult': 0.6511432568589631, 'strategy': 'breakout', 'time_stop': 32, 'use_sma': False, 'use_atr': True, 'use_adx': False, 'use_ema': False, 'use_spike': True, 'rsi_required': True, 'edge_k': 1.5069520531799854, 'edge_cap': 0.4979047406444306, 'bull_strategy': 'mean_reversion', 'bull_bb_std_mult': 1.9348537810290123, 'bull_rsi_os': 50, 'bull_rsi_ob': 71, 'bull_adx_thresh': 24.949464772719807, 'bull_atr_min_pct': 0.01050845971596118, 'bull_atr_max_pct': 0.027795250025291617, 'bull_tp_mult': 2.287222628983467, 'bull_tsl_mult': 0.7240572482562638, 'bull_time_stop': 264, 'bull_use_sma': True, 'bull_use_ema': False, 'bull_use_atr': False, 'bull_use_adx': True, 'bull_use_spike': True, 'bull_rsi_required': True, 'bear_strategy': 'breakout', 'bear_bb_std_mult': 3.2585032692218987, 'bear_rsi_os': 44, 'bear_rsi_ob': 58, 'bear_adx_thresh': 12.342275291799416, 'bear_atr_min_pct': 2.29566289026914e-05, 'bear_atr_max_pct': 0.01906265992619336, 'bear_tp_mult': 1.8290090677440372, 'bear_tsl_mult': 0.10142100825196827, 'bear_time_stop': 110, 'bear_use_sma': True, 'bear_use_ema': False, 'bear_use_atr': True, 'bear_use_adx': True, 'bear_use_spike': False, 'bear_rsi_required': False, 'sideways_strategy': 'breakout', 'sideways_bb_std_mult': 3.5225661620537547, 'sideways_rsi_os': 17, 'sideways_rsi_ob': 63, 'sideways_adx_thresh': 6.956892779915403, 'sideways_atr_min_pct': 5.4597050169242003e-05, 'sideways_atr_max_pct': 0.0288003047861106, 'sideways_tp_mult': 1.8080126157706042, 'sideways_tsl_mult': 0.31367440821622516, 'sideways_time_stop': 115, 'sideways_use_sma': True, 'sideways_use_ema': True, 'sideways_use_atr': False, 'sideways_use_adx': False, 'sideways_use_spike': False, 'sideways_rsi_required': False}.
[I 2025-08-30 20:13:42,714] Trial 733 finished with values: [-1000000000.0, 1000000000.0] and parameters: {'p_sma': 46, 'p_std': 16, 'p_atr': 10, 'p_adx': 11, 'rsi_period': 71, 'ema1': 15, 'ema2': 16, 'slip_atr_k': 0.13063591828518847, 'slip_spread_k': 0.4378734799491977, 'spread_hl_frac': 0.0035398979987581224, 'bb_std_mult': 1.3632272139029362, 'rsi_os': 40, 'rsi_ob': 58, 'vol_spike': 0.03711175992593935, 'adx_thresh': 33.34265703008987, 'atr_min_pct': 0.02418090670148805, 'atr_max_pct': 0.13659909046099938, 'tp_mult': 2.0477103317048235, 'tsl_mult': 0.9570417803584808, 'strategy': 'breakout', 'time_stop': 218, 'use_sma': False, 'use_atr': False, 'use_adx': False, 'use_ema': True, 'use_spike': False, 'rsi_required': False, 'edge_k': 1.185668575141285, 'edge_cap': 0.23603812900964793, 'bull_strategy': 'breakout', 'bull_bb_std_mult': 0.7553927717219937, 'bull_rsi_os': 49, 'bull_rsi_ob': 66, 'bull_adx_thresh': 27.19983481946673, 'bull_atr_min_pct': 0.015140933890427576, 'bull_atr_max_pct': 0.031857456603274756, 'bull_tp_mult': 2.1670029357329805, 'bull_tsl_mult': 0.9993460330268452, 'bull_time_stop': 128, 'bull_use_sma': False, 'bull_use_ema': False, 'bull_use_atr': True, 'bull_use_adx': False, 'bull_use_spike': True, 'bull_rsi_required': False, 'bear_strategy': 'breakout', 'bear_bb_std_mult': 2.114592774705841, 'bear_rsi_os': 43, 'bear_rsi_ob': 83, 'bear_adx_thresh': 5.905362357873212, 'bear_atr_min_pct': 0.01471070422251979, 'bear_atr_max_pct': 0.055877379921405575, 'bear_tp_mult': 1.9221331874649294, 'bear_tsl_mult': 0.9951005323511546, 'bear_time_stop': 169, 'bear_use_sma': True, 'bear_use_ema': True, 'bear_use_atr': False, 'bear_use_adx': False, 'bear_use_spike': False, 'bear_rsi_required': False, 'sideways_strategy': 'breakout', 'sideways_bb_std_mult': 1.957742322424212, 'sideways_rsi_os': 16, 'sideways_rsi_ob': 84, 'sideways_adx_thresh': 10.40077489209983, 'sideways_atr_min_pct': 0.020005447527250406, 'sideways_atr_max_pct': 0.12090260394828627, 'sideways_tp_mult': 1.6945996829324308, 'sideways_tsl_mult': 0.18269740852582367, 'sideways_time_stop': 246, 'sideways_use_sma': True, 'sideways_use_ema': True, 'sideways_use_atr': True, 'sideways_use_adx': True, 'sideways_use_spike': False, 'sideways_rsi_required': False}.
[I 2025-08-30 20:13:42,926] Trial 731 finished with values: [-1000000000.0, 1000000000.0] and parameters: {'p_sma': 46, 'p_std': 26, 'p_atr': 10, 'p_adx': 29, 'rsi_period': 82, 'ema1': 18, 'ema2': 16, 'slip_atr_k': 0.005483691761939295, 'slip_spread_k': 0.7332261990368865, 'spread_hl_frac': 0.005449093434441588, 'bb_std_mult': 1.1477311587835386, 'rsi_os': 24, 'rsi_ob': 71, 'vol_spike': 0.06291788241283282, 'adx_thresh': 12.400687632550545, 'atr_min_pct': 0.02298746575536943, 'atr_max_pct': 0.033830676042746054, 'tp_mult': 2.3160250075068314, 'tsl_mult': 0.7119336364769919, 'strategy': 'breakout', 'time_stop': 53, 'use_sma': False, 'use_atr': True, 'use_adx': False, 'use_ema': True, 'use_spike': False, 'rsi_required': False, 'edge_k': 0.22240581227720763, 'edge_cap': 0.5021367212037854, 'bull_strategy': 'mean_reversion', 'bull_bb_std_mult': 1.933725297891467, 'bull_rsi_os': 50, 'bull_rsi_ob': 50, 'bull_adx_thresh': 27.03740689048277, 'bull_atr_min_pct': 0.002588045756452281, 'bull_atr_max_pct': 0.02173777715537803, 'bull_tp_mult': 1.3919708919745284, 'bull_tsl_mult': 0.9859016945398262, 'bull_time_stop': 183, 'bull_use_sma': True, 'bull_use_ema': False, 'bull_use_atr': False, 'bull_use_adx': True, 'bull_use_spike': True, 'bull_rsi_required': False, 'bear_strategy': 'breakout', 'bear_bb_std_mult': 1.406437453351018, 'bear_rsi_os': 44, 'bear_rsi_ob': 76, 'bear_adx_thresh': 25.487709801226295, 'bear_atr_min_pct': 0.014702297828908684, 'bear_atr_max_pct': 0.0575446159637997, 'bear_tp_mult': 1.9406041621593872, 'bear_tsl_mult': 0.1536197442433585, 'bear_time_stop': 35, 'bear_use_sma': True, 'bear_use_ema': False, 'bear_use_atr': True, 'bear_use_adx': True, 'bear_use_spike': False, 'bear_rsi_required': False, 'sideways_strategy': 'breakout', 'sideways_bb_std_mult': 2.280094529103286, 'sideways_rsi_os': 17, 'sideways_rsi_ob': 57, 'sideways_adx_thresh': 6.919724039561277, 'sideways_atr_min_pct': 0.020023419971465624, 'sideways_atr_max_pct': 0.11471462520346208, 'sideways_tp_mult': 1.7700923305548377, 'sideways_tsl_mult': 0.6663739581117085, 'sideways_time_stop': 88, 'sideways_use_sma': True, 'sideways_use_ema': True, 'sideways_use_atr': False, 'sideways_use_adx': False, 'sideways_use_spike': False, 'sideways_rsi_required': False}.
[I 2025-08-30 20:13:43,340] Trial 732 finished with values: [-0.028359628888315225, 0.02823411909571674] and parameters: {'p_sma': 35, 'p_std': 16, 'p_atr': 10, 'p_adx': 8, 'rsi_period': 80, 'ema1': 30, 'ema2': 16, 'slip_atr_k': 0.21445286971240707, 'slip_spread_k': 0.3911272642034861, 'spread_hl_frac': 0.005925448785649774, 'bb_std_mult': 1.136242252621408, 'rsi_os': 47, 'rsi_ob': 95, 'vol_spike': 0.02368242583699913, 'adx_thresh': 12.272768076959863, 'atr_min_pct': 0.02553658153297698, 'atr_max_pct': 0.13720052643302746, 'tp_mult': 2.051322936824688, 'tsl_mult': 0.7184804325966739, 'strategy': 'breakout', 'time_stop': 72, 'use_sma': False, 'use_atr': True, 'use_adx': False, 'use_ema': True, 'use_spike': False, 'rsi_required': False, 'edge_k': 0.2265567933221332, 'edge_cap': 0.43840449673798343, 'bull_strategy': 'mean_reversion', 'bull_bb_std_mult': 1.927872642935089, 'bull_rsi_os': 50, 'bull_rsi_ob': 72, 'bull_adx_thresh': 25.00664659792941, 'bull_atr_min_pct': 0.0022798563810998945, 'bull_atr_max_pct': 0.08874628501993903, 'bull_tp_mult': 1.2156899765647826, 'bull_tsl_mult': 0.9841237600784296, 'bull_time_stop': 182, 'bull_use_sma': True, 'bull_use_ema': False, 'bull_use_atr': False, 'bull_use_adx': True, 'bull_use_spike': True, 'bull_rsi_required': False, 'bear_strategy': 'breakout', 'bear_bb_std_mult': 0.5130983643909368, 'bear_rsi_os': 45, 'bear_rsi_ob': 82, 'bear_adx_thresh': 5.951086917531971, 'bear_atr_min_pct': 0.014649059227564886, 'bear_atr_max_pct': 0.1446198078694932, 'bear_tp_mult': 1.8317908234094094, 'bear_tsl_mult': 0.022381327254564154, 'bear_time_stop': 108, 'bear_use_sma': True, 'bear_use_ema': False, 'bear_use_atr': True, 'bear_use_adx': True, 'bear_use_spike': False, 'bear_rsi_required': False, 'sideways_strategy': 'breakout', 'sideways_bb_std_mult': 1.9940966163129767, 'sideways_rsi_os': 17, 'sideways_rsi_ob': 82, 'sideways_adx_thresh': 23.348278416129816, 'sideways_atr_min_pct': 0.024391214604049794, 'sideways_atr_max_pct': 0.12061442361939487, 'sideways_tp_mult': 1.7551751828327147, 'sideways_tsl_mult': 0.6715446730573335, 'sideways_time_stop': 268, 'sideways_use_sma': True, 'sideways_use_ema': True, 'sideways_use_atr': False, 'sideways_use_adx': False, 'sideways_use_spike': False, 'sideways_rsi_required': False}.
[I 2025-08-30 20:13:43,454] Trial 734 finished with values: [-0.05646987468458231, 0.056344514229772] and parameters: {'p_sma': 35, 'p_std': 25, 'p_atr': 10, 'p_adx': 11, 'rsi_period': 31, 'ema1': 18, 'ema2': 16, 'slip_atr_k': 0.023537635950708742, 'slip_spread_k': 0.4380826271275834, 'spread_hl_frac': 0.0036457056617392263, 'bb_std_mult': 1.0018487095927353, 'rsi_os': 40, 'rsi_ob': 88, 'vol_spike': 0.06586186337431962, 'adx_thresh': 17.620220725672606, 'atr_min_pct': 0.024098716206110534, 'atr_max_pct': 0.13676478430402092, 'tp_mult': 2.727583517691818, 'tsl_mult': 0.8852065440129663, 'strategy': 'breakout', 'time_stop': 132, 'use_sma': False, 'use_atr': False, 'use_adx': False, 'use_ema': True, 'use_spike': False, 'rsi_required': False, 'edge_k': 1.3840728816338361, 'edge_cap': 0.23610319846681543, 'bull_strategy': 'breakout', 'bull_bb_std_mult': 1.8912495255071387, 'bull_rsi_os': 49, 'bull_rsi_ob': 53, 'bull_adx_thresh': 19.316295005150522, 'bull_atr_min_pct': 0.023189483426010595, 'bull_atr_max_pct': 0.032232196784745634, 'bull_tp_mult': 2.1698426883669972, 'bull_tsl_mult': 0.9992224716868869, 'bull_time_stop': 169, 'bull_use_sma': False, 'bull_use_ema': False, 'bull_use_atr': True, 'bull_use_adx': False, 'bull_use_spike': True, 'bull_rsi_required': False, 'bear_strategy': 'breakout', 'bear_bb_std_mult': 3.3401323128134157, 'bear_rsi_os': 43, 'bear_rsi_ob': 72, 'bear_adx_thresh': 25.36595494459377, 'bear_atr_min_pct': 0.0013523097341971487, 'bear_atr_max_pct': 0.14506600818847182, 'bear_tp_mult': 1.9239311388608833, 'bear_tsl_mult': 0.15446415731651056, 'bear_time_stop': 267, 'bear_use_sma': True, 'bear_use_ema': True, 'bear_use_atr': False, 'bear_use_adx': False, 'bear_use_spike': False, 'bear_rsi_required': False, 'sideways_strategy': 'breakout', 'sideways_bb_std_mult': 2.2688805208420435, 'sideways_rsi_os': 51, 'sideways_rsi_ob': 46, 'sideways_adx_thresh': 18.638889543804233, 'sideways_atr_min_pct': 0.024531213902084965, 'sideways_atr_max_pct': 0.012828956658942764, 'sideways_tp_mult': 1.6954617441033868, 'sideways_tsl_mult': 0.675650165931284, 'sideways_time_stop': 234, 'sideways_use_sma': True, 'sideways_use_ema': True, 'sideways_use_atr': True, 'sideways_use_adx': True, 'sideways_use_spike': False, 'sideways_rsi_required': False}.
[I 2025-08-30 20:14:17,911] Trial 737 finished with values: [-1000000000.0, 1000000000.0] and parameters: {'p_sma': 49, 'p_std': 30, 'p_atr': 10, 'p_adx': 17, 'rsi_period': 47, 'ema1': 6, 'ema2': 18, 'slip_atr_k': 0.16583605715002256, 'slip_spread_k': 0.4105075619479534, 'spread_hl_frac': 0.00443073993919802, 'bb_std_mult': 0.7613653333509465, 'rsi_os': 37, 'rsi_ob': 75, 'vol_spike': 0.27273058445213677, 'adx_thresh': 18.433662331912828, 'atr_min_pct': 0.02344603334797855, 'atr_max_pct': 0.11891467665498517, 'tp_mult': 2.1389097304370073, 'tsl_mult': 0.6816784923657325, 'strategy': 'mean_reversion', 'time_stop': 48, 'use_sma': False, 'use_atr': True, 'use_adx': False, 'use_ema': False, 'use_spike': True, 'rsi_required': True, 'edge_k': 0.18590396197004658, 'edge_cap': 0.27229634159616445, 'bull_strategy': 'mean_reversion', 'bull_bb_std_mult': 2.0996290181475716, 'bull_rsi_os': 47, 'bull_rsi_ob': 84, 'bull_adx_thresh': 25.8726104093187, 'bull_atr_min_pct': 0.003681625320811674, 'bull_atr_max_pct': 0.029537055599672013, 'bull_tp_mult': 2.014901585992315, 'bull_tsl_mult': 0.8068756617783526, 'bull_time_stop': 188, 'bull_use_sma': True, 'bull_use_ema': False, 'bull_use_atr': False, 'bull_use_adx': True, 'bull_use_spike': True, 'bull_rsi_required': True, 'bear_strategy': 'breakout', 'bear_bb_std_mult': 3.13780928556595, 'bear_rsi_os': 42, 'bear_rsi_ob': 45, 'bear_adx_thresh': 6.356396249248624, 'bear_atr_min_pct': 0.016488435693916996, 'bear_atr_max_pct': 0.06306284924425135, 'bear_tp_mult': 1.7310974061946132, 'bear_tsl_mult': 0.9609085756700093, 'bear_time_stop': 59, 'bear_use_sma': True, 'bear_use_ema': False, 'bear_use_atr': True, 'bear_use_adx': True, 'bear_use_spike': False, 'bear_rsi_required': True, 'sideways_strategy': 'breakout', 'sideways_bb_std_mult': 1.869151878236843, 'sideways_rsi_os': 49, 'sideways_rsi_ob': 86, 'sideways_adx_thresh': 8.110327939964213, 'sideways_atr_min_pct': 0.01830083888225203, 'sideways_atr_max_pct': 0.12599888482867577, 'sideways_tp_mult': 1.9151269529112194, 'sideways_tsl_mult': 0.6554016107326471, 'sideways_time_stop': 274, 'sideways_use_sma': True, 'sideways_use_ema': False, 'sideways_use_atr': False, 'sideways_use_adx': False, 'sideways_use_spike': False, 'sideways_rsi_required': False}.
[I 2025-08-30 20:14:18,240] Trial 738 finished with values: [-1000000000.0, 1000000000.0] and parameters: {'p_sma': 36, 'p_std': 30, 'p_atr': 10, 'p_adx': 12, 'rsi_period': 48, 'ema1': 6, 'ema2': 46, 'slip_atr_k': 0.2375190112612518, 'slip_spread_k': 0.5920346722630598, 'spread_hl_frac': 0.004780380038820836, 'bb_std_mult': 2.821874950788005, 'rsi_os': 37, 'rsi_ob': 54, 'vol_spike': 0.008989107966016208, 'adx_thresh': 18.42350022284709, 'atr_min_pct': 0.023736497026689705, 'atr_max_pct': 0.12158518867186092, 'tp_mult': 2.9009709532082875, 'tsl_mult': 0.690947946456165, 'strategy': 'mean_reversion', 'time_stop': 38, 'use_sma': False, 'use_atr': True, 'use_adx': False, 'use_ema': False, 'use_spike': True, 'rsi_required': True, 'edge_k': 0.7430541800727601, 'edge_cap': 0.6131742779313315, 'bull_strategy': 'mean_reversion', 'bull_bb_std_mult': 0.8167801180282599, 'bull_rsi_os': 40, 'bull_rsi_ob': 74, 'bull_adx_thresh': 11.56513967335761, 'bull_atr_min_pct': 0.003361904278036029, 'bull_atr_max_pct': 0.054313944550271664, 'bull_tp_mult': 2.910231303010051, 'bull_tsl_mult': 0.9519596724719845, 'bull_time_stop': 49, 'bull_use_sma': True, 'bull_use_ema': False, 'bull_use_atr': False, 'bull_use_adx': True, 'bull_use_spike': True, 'bull_rsi_required': True, 'bear_strategy': 'breakout', 'bear_bb_std_mult': 3.31515209229582, 'bear_rsi_os': 42, 'bear_rsi_ob': 86, 'bear_adx_thresh': 29.93114908426695, 'bear_atr_min_pct': 0.007113325241973861, 'bear_atr_max_pct': 0.06314841525500786, 'bear_tp_mult': 1.7373136949504302, 'bear_tsl_mult': 0.5851578978622768, 'bear_time_stop': 56, 'bear_use_sma': True, 'bear_use_ema': False, 'bear_use_atr': True, 'bear_use_adx': True, 'bear_use_spike': False, 'bear_rsi_required': True, 'sideways_strategy': 'breakout', 'sideways_bb_std_mult': 1.867968954437627, 'sideways_rsi_os': 44, 'sideways_rsi_ob': 58, 'sideways_adx_thresh': 28.763113944348166, 'sideways_atr_min_pct': 0.018636144802511273, 'sideways_atr_max_pct': 0.12785516824569731, 'sideways_tp_mult': 1.053917106728084, 'sideways_tsl_mult': 0.5485768971043715, 'sideways_time_stop': 285, 'sideways_use_sma': True, 'sideways_use_ema': False, 'sideways_use_atr': False, 'sideways_use_adx': False, 'sideways_use_spike': False, 'sideways_rsi_required': False}.
[I 2025-08-30 20:14:18,618] Trial 735 finished with values: [-1000000000.0, 1000000000.0] and parameters: {'p_sma': 33, 'p_std': 55, 'p_atr': 10, 'p_adx': 8, 'rsi_period': 47, 'ema1': 19, 'ema2': 18, 'slip_atr_k': 0.14339667294304365, 'slip_spread_k': 0.25742578558361173, 'spread_hl_frac': 0.005652261425450084, 'bb_std_mult': 0.9961187461550695, 'rsi_os': 47, 'rsi_ob': 88, 'vol_spike': 0.0649835236468378, 'adx_thresh': 10.648600333127304, 'atr_min_pct': 0.022957627251883175, 'atr_max_pct': 0.13981377236525155, 'tp_mult': 2.1358895472350516, 'tsl_mult': 0.8168375100104726, 'strategy': 'mean_reversion', 'time_stop': 129, 'use_sma': False, 'use_atr': True, 'use_adx': False, 'use_ema': False, 'use_spike': True, 'rsi_required': True, 'edge_k': 0.4570130790619068, 'edge_cap': 0.27962754264882916, 'bull_strategy': 'mean_reversion', 'bull_bb_std_mult': 1.9386076836699162, 'bull_rsi_os': 53, 'bull_rsi_ob': 72, 'bull_adx_thresh': 25.086944553658828, 'bull_atr_min_pct': 0.0022891121316248315, 'bull_atr_max_pct': 0.052928495864151964, 'bull_tp_mult': 2.1828143763774386, 'bull_tsl_mult': 0.9573548345338235, 'bull_time_stop': 184, 'bull_use_sma': True, 'bull_use_ema': False, 'bull_use_atr': False, 'bull_use_adx': True, 'bull_use_spike': True, 'bull_rsi_required': True, 'bear_strategy': 'breakout', 'bear_bb_std_mult': 2.8861261992629226, 'bear_rsi_os': 45, 'bear_rsi_ob': 73, 'bear_adx_thresh': 6.545521452509336, 'bear_atr_min_pct': 0.021320653330965826, 'bear_atr_max_pct': 0.14385896561920003, 'bear_tp_mult': 1.4706665006282162, 'bear_tsl_mult': 0.10407145904225097, 'bear_time_stop': 35, 'bear_use_sma': True, 'bear_use_ema': False, 'bear_use_atr': True, 'bear_use_adx': True, 'bear_use_spike': False, 'bear_rsi_required': True, 'sideways_strategy': 'breakout', 'sideways_bb_std_mult': 2.775845446636957, 'sideways_rsi_os': 45, 'sideways_rsi_ob': 57, 'sideways_adx_thresh': 9.01258424654418, 'sideways_atr_min_pct': 0.018351018200058793, 'sideways_atr_max_pct': 0.11504725906777366, 'sideways_tp_mult': 1.748246487128518, 'sideways_tsl_mult': 0.6719971260684459, 'sideways_time_stop': 270, 'sideways_use_sma': True, 'sideways_use_ema': True, 'sideways_use_atr': False, 'sideways_use_adx': False, 'sideways_use_spike': False, 'sideways_rsi_required': False}.
