[I 2025-08-30 18:54:54,670] Trial 152 finished with values: [-1000000000.0, 1000000000.0] and parameters: {'p_sma': 7, 'p_std': 30, 'p_atr': 28, 'p_adx': 7, 'rsi_period': 53, 'ema1': 9, 'ema2': 47, 'slip_atr_k': 0.00019851644502726085, 'slip_spread_k': 0.39546795201020135, 'spread_hl_frac': 0.04631910650628056, 'bb_std_mult': 1.017272396386766, 'rsi_os': 35, 'rsi_ob': 78, 'vol_spike': 0.05177960413429672, 'adx_thresh': 17.307673128125874, 'atr_min_pct': 0.024893704528480005, 'atr_max_pct': 0.1288296483692775, 'tp_mult': 2.4358614110247334, 'tsl_mult': 0.35224713681321007, 'strategy': 'breakout', 'time_stop': 26, 'use_sma': False, 'use_atr': True, 'use_adx': True, 'use_ema': False, 'use_spike': True, 'rsi_required': True, 'edge_k': 1.542149743631165, 'edge_cap': 0.44577929526858406, 'bull_strategy': 'mean_reversion', 'bull_bb_std_mult': 1.3264138336145765, 'bull_rsi_os': 41, 'bull_rsi_ob': 46, 'bull_adx_thresh': 21.090114213910702, 'bull_atr_min_pct': 0.001415096136534495, 'bull_atr_max_pct': 0.028006057777942975, 'bull_tp_mult': 2.1888010894285417, 'bull_tsl_mult': 0.018726307287824262, 'bull_time_stop': 183, 'bull_use_sma': True, 'bull_use_ema': False, 'bull_use_atr': False, 'bull_use_adx': True, 'bull_use_spike': True, 'bull_rsi_required': True, 'bear_strategy': 'breakout', 'bear_bb_std_mult': 0.8630095511669145, 'bear_rsi_os': 49, 'bear_rsi_ob': 65, 'bear_adx_thresh': 23.628456815708393, 'bear_atr_min_pct': 0.018735397766069105, 'bear_atr_max_pct': 0.06305751188696428, 'bear_tp_mult': 1.608833907463105, 'bear_tsl_mult': 0.29534190271878036, 'bear_time_stop': 132, 'bear_use_sma': True, 'bear_use_ema': False, 'bear_use_atr': True, 'bear_use_adx': True, 'bear_use_spike': False, 'bear_rsi_required': False, 'sideways_strategy': 'breakout', 'sideways_bb_std_mult': 1.0933388503318249, 'sideways_rsi_os': 21, 'sideways_rsi_ob': 75, 'sideways_adx_thresh': 16.967621017658253, 'sideways_atr_min_pct': 0.020543335580195055, 'sideways_atr_max_pct': 0.14001742351678975, 'sideways_tp_mult': 2.248540631704369, 'sideways_tsl_mult': 0.7312914955855985, 'sideways_time_stop': 252, 'sideways_use_sma': True, 'sideways_use_ema': False, 'sideways_use_atr': False, 'sideways_use_adx': False, 'sideways_use_spike': False, 'sideways_rsi_required': False}.
[I 2025-08-30 18:54:54,786] Trial 153 finished with values: [-0.05433204512080936, 0.054250602441896306] and parameters: {'p_sma': 39, 'p_std': 29, 'p_atr': 10, 'p_adx': 21, 'rsi_period': 22, 'ema1': 24, 'ema2': 12, 'slip_atr_k': 0.2082982949914393, 'slip_spread_k': 0.39663510977310795, 'spread_hl_frac': 0.00184682952823254, 'bb_std_mult': 1.0202117988953858, 'rsi_os': 41, 'rsi_ob': 46, 'vol_spike': 0.05192874801454166, 'adx_thresh': 18.770947196049622, 'atr_min_pct': 0.0011492511314167668, 'atr_max_pct': 0.016341483726141234, 'tp_mult': 2.6048557258011105, 'tsl_mult': 0.3392290735634238, 'strategy': 'breakout', 'time_stop': 180, 'use_sma': False, 'use_atr': True, 'use_adx': True, 'use_ema': False, 'use_spike': True, 'rsi_required': True, 'edge_k': 0.07357019171417928, 'edge_cap': 0.3099598309310593, 'bull_strategy': 'mean_reversion', 'bull_bb_std_mult': 3.5586798280624907, 'bull_rsi_os': 26, 'bull_rsi_ob': 69, 'bull_adx_thresh': 10.347845754282526, 'bull_atr_min_pct': 0.0035398906765833245, 'bull_atr_max_pct': 0.028260310798470443, 'bull_tp_mult': 2.1971060249554077, 'bull_tsl_mult': 0.019778040998692625, 'bull_time_stop': 106, 'bull_use_sma': True, 'bull_use_ema': False, 'bull_use_atr': False, 'bull_use_adx': True, 'bull_use_spike': True, 'bull_rsi_required': True, 'bear_strategy': 'breakout', 'bear_bb_std_mult': 0.8850144043390182, 'bear_rsi_os': 42, 'bear_rsi_ob': 74, 'bear_adx_thresh': 6.816890709839912, 'bear_atr_min_pct': 0.0038450104417590246, 'bear_atr_max_pct': 0.021954481776534855, 'bear_tp_mult': 2.0641305970087678, 'bear_tsl_mult': 0.3028670883515988, 'bear_time_stop': 137, 'bear_use_sma': True, 'bear_use_ema': False, 'bear_use_atr': False, 'bear_use_adx': False, 'bear_use_spike': True, 'bear_rsi_required': False, 'sideways_strategy': 'breakout', 'sideways_bb_std_mult': 3.5972071469207183, 'sideways_rsi_os': 20, 'sideways_rsi_ob': 50, 'sideways_adx_thresh': 26.00415080956592, 'sideways_atr_min_pct': 7.38317993703233e-05, 'sideways_atr_max_pct': 0.11534678825824318, 'sideways_tp_mult': 2.216524308924792, 'sideways_tsl_mult': 0.41486480503154044, 'sideways_time_stop': 180, 'sideways_use_sma': True, 'sideways_use_ema': False, 'sideways_use_atr': True, 'sideways_use_adx': False, 'sideways_use_spike': False, 'sideways_rsi_required': False}.
[I 2025-08-30 18:54:55,258] Trial 155 finished with values: [-1000000000.0, 1000000000.0] and parameters: {'p_sma': 40, 'p_std': 25, 'p_atr': 10, 'p_adx': 8, 'rsi_period': 49, 'ema1': 24, 'ema2': 17, 'slip_atr_k': 0.009284203837529533, 'slip_spread_k': 0.3944065313077755, 'spread_hl_frac': 0.047054154204823215, 'bb_std_mult': 1.0941535292700564, 'rsi_os': 34, 'rsi_ob': 79, 'vol_spike': 0.04069620257239092, 'adx_thresh': 19.500127038297045, 'atr_min_pct': 0.021457515100090942, 'atr_max_pct': 0.037577201651874864, 'tp_mult': 2.079169954196862, 'tsl_mult': 0.7751477560773272, 'strategy': 'breakout', 'time_stop': 35, 'use_sma': True, 'use_atr': True, 'use_adx': False, 'use_ema': False, 'use_spike': True, 'rsi_required': False, 'edge_k': 1.4913072266341223, 'edge_cap': 0.27935376323108696, 'bull_strategy': 'breakout', 'bull_bb_std_mult': 1.257673124636477, 'bull_rsi_os': 51, 'bull_rsi_ob': 69, 'bull_adx_thresh': 12.885873461717582, 'bull_atr_min_pct': 0.0025047585874484247, 'bull_atr_max_pct': 0.020461823568510576, 'bull_tp_mult': 2.184683898377725, 'bull_tsl_mult': 0.28668427323036727, 'bull_time_stop': 30, 'bull_use_sma': True, 'bull_use_ema': False, 'bull_use_atr': True, 'bull_use_adx': False, 'bull_use_spike': True, 'bull_rsi_required': False, 'bear_strategy': 'mean_reversion', 'bear_bb_std_mult': 3.332041629602956, 'bear_rsi_os': 42, 'bear_rsi_ob': 82, 'bear_adx_thresh': 7.5108774785966235, 'bear_atr_min_pct': 0.0034968103752722295, 'bear_atr_max_pct': 0.06152632890443647, 'bear_tp_mult': 2.995297605058046, 'bear_tsl_mult': 0.08519753096906113, 'bear_time_stop': 35, 'bear_use_sma': False, 'bear_use_ema': False, 'bear_use_atr': False, 'bear_use_adx': False, 'bear_use_spike': True, 'bear_rsi_required': True, 'sideways_strategy': 'breakout', 'sideways_bb_std_mult': 2.28777117947073, 'sideways_rsi_os': 14, 'sideways_rsi_ob': 87, 'sideways_adx_thresh': 25.842223435548387, 'sideways_atr_min_pct': 0.024120036419673543, 'sideways_atr_max_pct': 0.11839633190677391, 'sideways_tp_mult': 2.2087409351044576, 'sideways_tsl_mult': 0.6549135511844024, 'sideways_time_stop': 269, 'sideways_use_sma': True, 'sideways_use_ema': True, 'sideways_use_atr': True, 'sideways_use_adx': False, 'sideways_use_spike': False, 'sideways_rsi_required': False}.
[I 2025-08-30 18:55:28,095] Trial 156 finished with values: [-1000000000.0, 1000000000.0] and parameters: {'p_sma': 40, 'p_std': 25, 'p_atr': 10, 'p_adx': 9, 'rsi_period': 54, 'ema1': 24, 'ema2': 32, 'slip_atr_k': 0.0676183625544721, 'slip_spread_k': 0.3818203479779043, 'spread_hl_frac': 0.0013273377545149588, 'bb_std_mult': 2.037211528636818, 'rsi_os': 21, 'rsi_ob': 46, 'vol_spike': 0.044784695264556515, 'adx_thresh': 19.151136378373174, 'atr_min_pct': 0.02145704675943811, 'atr_max_pct': 0.13081709800730187, 'tp_mult': 2.0821223636495283, 'tsl_mult': 0.7746295485500168, 'strategy': 'breakout', 'time_stop': 34, 'use_sma': True, 'use_atr': True, 'use_adx': False, 'use_ema': True, 'use_spike': True, 'rsi_required': False, 'edge_k': 0.09107899249528636, 'edge_cap': 0.5083581178854181, 'bull_strategy': 'breakout', 'bull_bb_std_mult': 1.9641484541787457, 'bull_rsi_os': 51, 'bull_rsi_ob': 82, 'bull_adx_thresh': 31.3438169577833, 'bull_atr_min_pct': 0.002523519961478517, 'bull_atr_max_pct': 0.08231983814455068, 'bull_tp_mult': 1.4335376795964225, 'bull_tsl_mult': 0.9489816230628838, 'bull_time_stop': 138, 'bull_use_sma': True, 'bull_use_ema': False, 'bull_use_atr': True, 'bull_use_adx': True, 'bull_use_spike': False, 'bull_rsi_required': False, 'bear_strategy': 'breakout', 'bear_bb_std_mult': 0.9435266025553075, 'bear_rsi_os': 28, 'bear_rsi_ob': 82, 'bear_adx_thresh': 26.78961960674151, 'bear_atr_min_pct': 0.0011131898681887627, 'bear_atr_max_pct': 0.0609894020863908, 'bear_tp_mult': 1.886230928325042, 'bear_tsl_mult': 0.30855345121901284, 'bear_time_stop': 189, 'bear_use_sma': False, 'bear_use_ema': False, 'bear_use_atr': False, 'bear_use_adx': False, 'bear_use_spike': True, 'bear_rsi_required': True, 'sideways_strategy': 'breakout', 'sideways_bb_std_mult': 2.2700908232064103, 'sideways_rsi_os': 14, 'sideways_rsi_ob': 61, 'sideways_adx_thresh': 29.329451244722442, 'sideways_atr_min_pct': 0.017269124219348224, 'sideways_atr_max_pct': 0.08716018949917416, 'sideways_tp_mult': 1.7593002235900717, 'sideways_tsl_mult': 0.7320446942359458, 'sideways_time_stop': 249, 'sideways_use_sma': True, 'sideways_use_ema': True, 'sideways_use_atr': True, 'sideways_use_adx': False, 'sideways_use_spike': False, 'sideways_rsi_required': False}.
[I 2025-08-30 18:55:28,816] Trial 158 finished with values: [-1000000000.0, 1000000000.0] and parameters: {'p_sma': 40, 'p_std': 25, 'p_atr': 11, 'p_adx': 9, 'rsi_period': 71, 'ema1': 25, 'ema2': 17, 'slip_atr_k': 0.16023943152154568, 'slip_spread_k': 0.4715353713338622, 'spread_hl_frac': 0.01562798998281384, 'bb_std_mult': 1.6161850764217691, 'rsi_os': 39, 'rsi_ob': 71, 'vol_spike': 0.04351080466359872, 'adx_thresh': 19.56534899121691, 'atr_min_pct': 0.021269488330360388, 'atr_max_pct': 0.1412259667353448, 'tp_mult': 2.1482631947450836, 'tsl_mult': 0.7738237281380719, 'strategy': 'mean_reversion', 'time_stop': 299, 'use_sma': True, 'use_atr': True, 'use_adx': False, 'use_ema': True, 'use_spike': True, 'rsi_required': False, 'edge_k': 0.9728582227742408, 'edge_cap': 0.26143037733881636, 'bull_strategy': 'breakout', 'bull_bb_std_mult': 1.2031705483695556, 'bull_rsi_os': 50, 'bull_rsi_ob': 81, 'bull_adx_thresh': 24.785862971717503, 'bull_atr_min_pct': 0.00259120388468802, 'bull_atr_max_pct': 0.022240895163493743, 'bull_tp_mult': 2.8826017761963967, 'bull_tsl_mult': 0.9456970575333463, 'bull_time_stop': 243, 'bull_use_sma': True, 'bull_use_ema': False, 'bull_use_atr': True, 'bull_use_adx': False, 'bull_use_spike': False, 'bull_rsi_required': False, 'bear_strategy': 'mean_reversion', 'bear_bb_std_mult': 2.5898985369942844, 'bear_rsi_os': 46, 'bear_rsi_ob': 82, 'bear_adx_thresh': 26.97650283051698, 'bear_atr_min_pct': 0.012044952255003499, 'bear_atr_max_pct': 0.056125675253739606, 'bear_tp_mult': 1.6606337196697016, 'bear_tsl_mult': 0.08644430661658675, 'bear_time_stop': 51, 'bear_use_sma': False, 'bear_use_ema': False, 'bear_use_atr': False, 'bear_use_adx': False, 'bear_use_spike': True, 'bear_rsi_required': True, 'sideways_strategy': 'breakout', 'sideways_bb_std_mult': 2.7946975475379983, 'sideways_rsi_os': 14, 'sideways_rsi_ob': 62, 'sideways_adx_thresh': 29.41818147198193, 'sideways_atr_min_pct': 0.011267605884884627, 'sideways_atr_max_pct': 0.04714109811409423, 'sideways_tp_mult': 1.7550897568616646, 'sideways_tsl_mult': 0.6719148314984789, 'sideways_time_stop': 269, 'sideways_use_sma': True, 'sideways_use_ema': True, 'sideways_use_atr': True, 'sideways_use_adx': False, 'sideways_use_spike': False, 'sideways_rsi_required': False}.
[I 2025-08-30 18:55:28,901] Trial 159 finished with values: [-1000000000.0, 1000000000.0] and parameters: {'p_sma': 44, 'p_std': 27, 'p_atr': 11, 'p_adx': 10, 'rsi_period': 57, 'ema1': 25, 'ema2': 20, 'slip_atr_k': 0.1619559897829233, 'slip_spread_k': 0.47016204392358063, 'spread_hl_frac': 0.015828103143463113, 'bb_std_mult': 1.169150755805517, 'rsi_os': 40, 'rsi_ob': 69, 'vol_spike': 0.07227680372619638, 'adx_thresh': 20.226528674712394, 'atr_min_pct': 0.023424826831317143, 'atr_max_pct': 0.09686003282333575, 'tp_mult': 2.805004431398777, 'tsl_mult': 0.14600978069564247, 'strategy': 'mean_reversion', 'time_stop': 55, 'use_sma': True, 'use_atr': True, 'use_adx': False, 'use_ema': True, 'use_spike': True, 'rsi_required': False, 'edge_k': 0.2681792286786787, 'edge_cap': 0.5115478478844193, 'bull_strategy': 'breakout', 'bull_bb_std_mult': 2.470235563291091, 'bull_rsi_os': 48, 'bull_rsi_ob': 66, 'bull_adx_thresh': 32.855410731036244, 'bull_atr_min_pct': 0.02447231665403262, 'bull_atr_max_pct': 0.0834962743625887, 'bull_tp_mult': 2.088679786963076, 'bull_tsl_mult': 0.4125992491525538, 'bull_time_stop': 242, 'bull_use_sma': True, 'bull_use_ema': False, 'bull_use_atr': False, 'bull_use_adx': True, 'bull_use_spike': False, 'bull_rsi_required': False, 'bear_strategy': 'breakout', 'bear_bb_std_mult': 1.15030023740034, 'bear_rsi_os': 46, 'bear_rsi_ob': 82, 'bear_adx_thresh': 29.85096461997902, 'bear_atr_min_pct': 0.017089848944908895, 'bear_atr_max_pct': 0.05580445018159062, 'bear_tp_mult': 1.6789941514127003, 'bear_tsl_mult': 0.10453812571868211, 'bear_time_stop': 50, 'bear_use_sma': True, 'bear_use_ema': False, 'bear_use_atr': True, 'bear_use_adx': True, 'bear_use_spike': False, 'bear_rsi_required': True, 'sideways_strategy': 'breakout', 'sideways_bb_std_mult': 1.840150295157453, 'sideways_rsi_os': 55, 'sideways_rsi_ob': 58, 'sideways_adx_thresh': 11.257960449300061, 'sideways_atr_min_pct': 0.00547139291210492, 'sideways_atr_max_pct': 0.06278319881774136, 'sideways_tp_mult': 1.7557836652598504, 'sideways_tsl_mult': 0.6718651388530681, 'sideways_time_stop': 290, 'sideways_use_sma': True, 'sideways_use_ema': True, 'sideways_use_atr': False, 'sideways_use_adx': False, 'sideways_use_spike': False, 'sideways_rsi_required': False}.
[I 2025-08-30 18:55:29,155] Trial 157 finished with values: [-1000000000.0, 1000000000.0] and parameters: {'p_sma': 41, 'p_std': 25, 'p_atr': 11, 'p_adx': 9, 'rsi_period': 54, 'ema1': 25, 'ema2': 17, 'slip_atr_k': 0.16001227885172759, 'slip_spread_k': 0.462628431497204, 'spread_hl_frac': 0.035448245646862886, 'bb_std_mult': 1.1359981740640508, 'rsi_os': 39, 'rsi_ob': 68, 'vol_spike': 0.042469608353368014, 'adx_thresh': 30.610401942275956, 'atr_min_pct': 0.021479140965469178, 'atr_max_pct': 0.03573178792871581, 'tp_mult': 2.146780002079441, 'tsl_mult': 0.7513723195935933, 'strategy': 'mean_reversion', 'time_stop': 35, 'use_sma': True, 'use_atr': True, 'use_adx': False, 'use_ema': True, 'use_spike': True, 'rsi_required': False, 'edge_k': 0.2625132439375865, 'edge_cap': 0.05255850180641247, 'bull_strategy': 'breakout', 'bull_bb_std_mult': 1.2356560375006735, 'bull_rsi_os': 50, 'bull_rsi_ob': 70, 'bull_adx_thresh': 24.769876044415224, 'bull_atr_min_pct': 0.0024271204240629077, 'bull_atr_max_pct': 0.08541455459151172, 'bull_tp_mult': 1.4354656568250719, 'bull_tsl_mult': 0.945944685584628, 'bull_time_stop': 134, 'bull_use_sma': True, 'bull_use_ema': False, 'bull_use_atr': True, 'bull_use_adx': False, 'bull_use_spike': False, 'bull_rsi_required': False, 'bear_strategy': 'mean_reversion', 'bear_bb_std_mult': 0.9785489734648058, 'bear_rsi_os': 46, 'bear_rsi_ob': 82, 'bear_adx_thresh': 26.781504259060505, 'bear_atr_min_pct': 0.015391955021345254, 'bear_atr_max_pct': 0.05492455389177818, 'bear_tp_mult': 1.8840755481215625, 'bear_tsl_mult': 0.6099448738617781, 'bear_time_stop': 35, 'bear_use_sma': False, 'bear_use_ema': False, 'bear_use_atr': False, 'bear_use_adx': False, 'bear_use_spike': True, 'bear_rsi_required': True, 'sideways_strategy': 'breakout', 'sideways_bb_std_mult': 2.294006781913285, 'sideways_rsi_os': 14, 'sideways_rsi_ob': 81, 'sideways_adx_thresh': 11.315819127762328, 'sideways_atr_min_pct': 0.005821898787263155, 'sideways_atr_max_pct': 0.06132511426218567, 'sideways_tp_mult': 2.3881748340838382, 'sideways_tsl_mult': 0.674655894937106, 'sideways_time_stop': 271, 'sideways_use_sma': True, 'sideways_use_ema': True, 'sideways_use_atr': True, 'sideways_use_adx': False, 'sideways_use_spike': False, 'sideways_rsi_required': False}.
[I 2025-08-30 18:56:05,859] Trial 162 finished with values: [-0.041549908491477994, 0.0414784669327933] and parameters: {'p_sma': 42, 'p_std': 24, 'p_atr': 12, 'p_adx': 8, 'rsi_period': 66, 'ema1': 23, 'ema2': 60, 'slip_atr_k': 0.0290255076057487, 'slip_spread_k': 0.9206494101734222, 'spread_hl_frac': 0.04863199752387605, 'bb_std_mult': 0.5969829051146838, 'rsi_os': 28, 'rsi_ob': 85, 'vol_spike': 0.12063392982157639, 'adx_thresh': 30.505513993278235, 'atr_min_pct': 0.015971528429363856, 'atr_max_pct': 0.14665318361872093, 'tp_mult': 2.2298535947031595, 'tsl_mult': 0.752366749395172, 'strategy': 'breakout', 'time_stop': 12, 'use_sma': False, 'use_atr': True, 'use_adx': False, 'use_ema': False, 'use_spike': False, 'rsi_required': True, 'edge_k': 0.12522397914638045, 'edge_cap': 0.19533957438300936, 'bull_strategy': 'mean_reversion', 'bull_bb_std_mult': 1.5453114530011627, 'bull_rsi_os': 47, 'bull_rsi_ob': 60, 'bull_adx_thresh': 6.12442115329231, 'bull_atr_min_pct': 0.0006929292434862909, 'bull_atr_max_pct': 0.03420692120472138, 'bull_tp_mult': 1.2989993408748035, 'bull_tsl_mult': 0.9990193322245413, 'bull_time_stop': 214, 'bull_use_sma': True, 'bull_use_ema': False, 'bull_use_atr': False, 'bull_use_adx': True, 'bull_use_spike': True, 'bull_rsi_required': True, 'bear_strategy': 'breakout', 'bear_bb_std_mult': 2.116402221164097, 'bear_rsi_os': 48, 'bear_rsi_ob': 84, 'bear_adx_thresh': 34.116424742627515, 'bear_atr_min_pct': 0.006421246807334998, 'bear_atr_max_pct': 0.031590759575122425, 'bear_tp_mult': 1.735916876290485, 'bear_tsl_mult': 0.6107519448808283, 'bear_time_stop': 22, 'bear_use_sma': True, 'bear_use_ema': True, 'bear_use_atr': True, 'bear_use_adx': True, 'bear_use_spike': False, 'bear_rsi_required': False, 'sideways_strategy': 'breakout', 'sideways_bb_std_mult': 3.4057183605096273, 'sideways_rsi_os': 18, 'sideways_rsi_ob': 55, 'sideways_adx_thresh': 6.676913384855121, 'sideways_atr_min_pct': 0.0041158203087334234, 'sideways_atr_max_pct': 0.1297678245989514, 'sideways_tp_mult': 2.096830365465563, 'sideways_tsl_mult': 0.6994228649817261, 'sideways_time_stop': 62, 'sideways_use_sma': False, 'sideways_use_ema': True, 'sideways_use_atr': False, 'sideways_use_adx': False, 'sideways_use_spike': False, 'sideways_rsi_required': False}.
[I 2025-08-30 18:56:06,699] Trial 160 finished with values: [-1000000000.0, 1000000000.0] and parameters: {'p_sma': 43, 'p_std': 26, 'p_atr': 11, 'p_adx': 10, 'rsi_period': 70, 'ema1': 15, 'ema2': 19, 'slip_atr_k': 0.028766995427116256, 'slip_spread_k': 0.4833326046744377, 'spread_hl_frac': 0.016179119228389542, 'bb_std_mult': 1.5720949863912606, 'rsi_os': 38, 'rsi_ob': 71, 'vol_spike': 0.011923784463931247, 'adx_thresh': 9.081186416614099, 'atr_min_pct': 0.016749153499719005, 'atr_max_pct': 0.14553525651884885, 'tp_mult': 2.8099317686004, 'tsl_mult': 0.7531925975409011, 'strategy': 'mean_reversion', 'time_stop': 299, 'use_sma': False, 'use_atr': True, 'use_adx': False, 'use_ema': True, 'use_spike': False, 'rsi_required': True, 'edge_k': 0.2548218176914471, 'edge_cap': 0.3754561136737364, 'bull_strategy': 'mean_reversion', 'bull_bb_std_mult': 1.8571006220985762, 'bull_rsi_os': 47, 'bull_rsi_ob': 80, 'bull_adx_thresh': 6.047864314383208, 'bull_atr_min_pct': 0.014429812991507708, 'bull_atr_max_pct': 0.03394038276143681, 'bull_tp_mult': 1.3541558603813761, 'bull_tsl_mult': 0.6396686040925342, 'bull_time_stop': 245, 'bull_use_sma': True, 'bull_use_ema': False, 'bull_use_atr': False, 'bull_use_adx': True, 'bull_use_spike': False, 'bull_rsi_required': True, 'bear_strategy': 'breakout', 'bear_bb_std_mult': 1.0764223970468276, 'bear_rsi_os': 46, 'bear_rsi_ob': 84, 'bear_adx_thresh': 31.964797501287716, 'bear_atr_min_pct': 0.017100359538596607, 'bear_atr_max_pct': 0.05534489587819677, 'bear_tp_mult': 1.7528730234859795, 'bear_tsl_mult': 0.09398147736632438, 'bear_time_stop': 239, 'bear_use_sma': True, 'bear_use_ema': True, 'bear_use_atr': True, 'bear_use_adx': True, 'bear_use_spike': False, 'bear_rsi_required': False, 'sideways_strategy': 'breakout', 'sideways_bb_std_mult': 1.8446034331396601, 'sideways_rsi_os': 44, 'sideways_rsi_ob': 64, 'sideways_adx_thresh': 11.397254822669062, 'sideways_atr_min_pct': 0.019435245557262264, 'sideways_atr_max_pct': 0.020556243747267743, 'sideways_tp_mult': 2.105902812564083, 'sideways_tsl_mult': 0.6244366238832768, 'sideways_time_stop': 292, 'sideways_use_sma': False, 'sideways_use_ema': True, 'sideways_use_atr': False, 'sideways_use_adx': False, 'sideways_use_spike': False, 'sideways_rsi_required': False}.
