[I 2025-08-30 20:19:05,016] Trial 776 finished with values: [-1000000000.0, 1000000000.0] and parameters: {'p_sma': 24, 'p_std': 28, 'p_atr': 16, 'p_adx': 7, 'rsi_period': 45, 'ema1': 5, 'ema2': 35, 'slip_atr_k': 0.2061254373078406, 'slip_spread_k': 0.47987404816596635, 'spread_hl_frac': 0.01611369266744215, 'bb_std_mult': 1.2937387577227537, 'rsi_os': 48, 'rsi_ob': 49, 'vol_spike': 0.23755652446183928, 'adx_thresh': 17.61062213284065, 'atr_min_pct': 0.02417194453564181, 'atr_max_pct': 0.13689778204920647, 'tp_mult': 2.338514169571609, 'tsl_mult': 0.4199552194963738, 'strategy': 'mean_reversion', 'time_stop': 192, 'use_sma': False, 'use_atr': False, 'use_adx': False, 'use_ema': False, 'use_spike': True, 'rsi_required': True, 'edge_k': 0.09217255251195522, 'edge_cap': 0.8910058159235312, 'bull_strategy': 'mean_reversion', 'bull_bb_std_mult': 1.9343098166152857, 'bull_rsi_os': 51, 'bull_rsi_ob': 69, 'bull_adx_thresh': 9.363273657113512, 'bull_atr_min_pct': 0.00296690700176328, 'bull_atr_max_pct': 0.013403351275476115, 'bull_tp_mult': 2.662532528077771, 'bull_tsl_mult': 0.5455238662565303, 'bull_time_stop': 208, 'bull_use_sma': True, 'bull_use_ema': True, 'bull_use_atr': False, 'bull_use_adx': True, 'bull_use_spike': False, 'bull_rsi_required': True, 'bear_strategy': 'breakout', 'bear_bb_std_mult': 3.1942090408560415, 'bear_rsi_os': 45, 'bear_rsi_ob': 75, 'bear_adx_thresh': 13.716322388108445, 'bear_atr_min_pct': 0.025995417169653208, 'bear_atr_max_pct': 0.03354915995419489, 'bear_tp_mult': 2.180763026765982, 'bear_tsl_mult': 0.11561109528525498, 'bear_time_stop': 196, 'bear_use_sma': False, 'bear_use_ema': False, 'bear_use_atr': False, 'bear_use_adx': False, 'bear_use_spike': False, 'bear_rsi_required': False, 'sideways_strategy': 'mean_reversion', 'sideways_bb_std_mult': 3.592226111247916, 'sideways_rsi_os': 31, 'sideways_rsi_ob': 57, 'sideways_adx_thresh': 11.350760985463413, 'sideways_atr_min_pct': 0.011396632748200367, 'sideways_atr_max_pct': 0.12746902455003142, 'sideways_tp_mult': 2.950380198868359, 'sideways_tsl_mult': 0.6305614669404024, 'sideways_time_stop': 290, 'sideways_use_sma': False, 'sideways_use_ema': True, 'sideways_use_atr': False, 'sideways_use_adx': False, 'sideways_use_spike': True, 'sideways_rsi_required': True}.
[I 2025-08-30 20:19:05,273] Trial 777 finished with values: [-1000000000.0, 1000000000.0] and parameters: {'p_sma': 24, 'p_std': 34, 'p_atr': 9, 'p_adx': 7, 'rsi_period': 52, 'ema1': 5, 'ema2': 18, 'slip_atr_k': 0.12210641661101979, 'slip_spread_k': 0.4148648680246588, 'spread_hl_frac': 0.002756572605206231, 'bb_std_mult': 1.0052195589521773, 'rsi_os': 9, 'rsi_ob': 49, 'vol_spike': 0.04464217099872704, 'adx_thresh': 9.416136524745978, 'atr_min_pct': 0.01664300283232587, 'atr_max_pct': 0.05686953240848576, 'tp_mult': 2.869351527806766, 'tsl_mult': 0.723197805365794, 'strategy': 'mean_reversion', 'time_stop': 108, 'use_sma': True, 'use_atr': False, 'use_adx': False, 'use_ema': False, 'use_spike': True, 'rsi_required': False, 'edge_k': 0.08899011893897646, 'edge_cap': 0.270330623464505, 'bull_strategy': 'mean_reversion', 'bull_bb_std_mult': 1.9662110526929173, 'bull_rsi_os': 51, 'bull_rsi_ob': 83, 'bull_adx_thresh': 26.781125092468045, 'bull_atr_min_pct': 0.009109793398582573, 'bull_atr_max_pct': 0.02583448555844884, 'bull_tp_mult': 2.6788291235276764, 'bull_tsl_mult': 0.9628669256497043, 'bull_time_stop': 209, 'bull_use_sma': True, 'bull_use_ema': True, 'bull_use_atr': False, 'bull_use_adx': True, 'bull_use_spike': False, 'bull_rsi_required': True, 'bear_strategy': 'breakout', 'bear_bb_std_mult': 2.599142946518648, 'bear_rsi_os': 42, 'bear_rsi_ob': 79, 'bear_adx_thresh': 13.378709036745525, 'bear_atr_min_pct': 0.014904649694222831, 'bear_atr_max_pct': 0.0594294160388401, 'bear_tp_mult': 1.017058614234077, 'bear_tsl_mult': 0.11899934461061903, 'bear_time_stop': 218, 'bear_use_sma': False, 'bear_use_ema': False, 'bear_use_atr': False, 'bear_use_adx': False, 'bear_use_spike': False, 'bear_rsi_required': False, 'sideways_strategy': 'mean_reversion', 'sideways_bb_std_mult': 3.595545669836966, 'sideways_rsi_os': 29, 'sideways_rsi_ob': 80, 'sideways_adx_thresh': 10.710433850527739, 'sideways_atr_min_pct': 0.020548342327392007, 'sideways_atr_max_pct': 0.12590488217435575, 'sideways_tp_mult': 2.7687002276870256, 'sideways_tsl_mult': 0.623493914984876, 'sideways_time_stop': 142, 'sideways_use_sma': False, 'sideways_use_ema': True, 'sideways_use_atr': False, 'sideways_use_adx': False, 'sideways_use_spike': True, 'sideways_rsi_required': True}.
[I 2025-08-30 20:19:38,101] Trial 775 finished with values: [-1000000000.0, 1000000000.0] and parameters: {'p_sma': 38, 'p_std': 53, 'p_atr': 9, 'p_adx': 12, 'rsi_period': 52, 'ema1': 25, 'ema2': 34, 'slip_atr_k': 0.004888046671797791, 'slip_spread_k': 0.3732352901196777, 'spread_hl_frac': 0.04379803018811708, 'bb_std_mult': 1.2874927363329194, 'rsi_os': 36, 'rsi_ob': 64, 'vol_spike': 0.04678883948778104, 'adx_thresh': 17.809886475217017, 'atr_min_pct': 0.009045428345333789, 'atr_max_pct': 0.14292091407853097, 'tp_mult': 2.333087350552166, 'tsl_mult': 0.7180016742906102, 'strategy': 'breakout', 'time_stop': 259, 'use_sma': False, 'use_atr': False, 'use_adx': False, 'use_ema': False, 'use_spike': True, 'rsi_required': True, 'edge_k': 1.264178644500012, 'edge_cap': 0.2251148086442224, 'bull_strategy': 'mean_reversion', 'bull_bb_std_mult': 2.8842892209640247, 'bull_rsi_os': 53, 'bull_rsi_ob': 90, 'bull_adx_thresh': 9.566027452479895, 'bull_atr_min_pct': 0.0028642529431896287, 'bull_atr_max_pct': 0.014206661938690546, 'bull_tp_mult': 2.684190467494755, 'bull_tsl_mult': 0.9597616861276955, 'bull_time_stop': 207, 'bull_use_sma': True, 'bull_use_ema': True, 'bull_use_atr': False, 'bull_use_adx': True, 'bull_use_spike': False, 'bull_rsi_required': True, 'bear_strategy': 'breakout', 'bear_bb_std_mult': 3.1876882907005184, 'bear_rsi_os': 45, 'bear_rsi_ob': 81, 'bear_adx_thresh': 13.1899422676982, 'bear_atr_min_pct': 0.014825732999539884, 'bear_atr_max_pct': 0.05207562961074549, 'bear_tp_mult': 1.7536203012362437, 'bear_tsl_mult': 0.11781431855456609, 'bear_time_stop': 33, 'bear_use_sma': False, 'bear_use_ema': False, 'bear_use_atr': False, 'bear_use_adx': False, 'bear_use_spike': False, 'bear_rsi_required': False, 'sideways_strategy': 'breakout', 'sideways_bb_std_mult': 2.5880672862729424, 'sideways_rsi_os': 17, 'sideways_rsi_ob': 57, 'sideways_adx_thresh': 11.100775782841268, 'sideways_atr_min_pct': 0.025199274665916302, 'sideways_atr_max_pct': 0.12773356285725204, 'sideways_tp_mult': 2.6288624682209147, 'sideways_tsl_mult': 0.6264115505459615, 'sideways_time_stop': 290, 'sideways_use_sma': True, 'sideways_use_ema': True, 'sideways_use_atr': False, 'sideways_use_adx': False, 'sideways_use_spike': True, 'sideways_rsi_required': False}.
[I 2025-08-30 20:19:38,327] Trial 774 finished with values: [-1000000000.0, 1000000000.0] and parameters: {'p_sma': 38, 'p_std': 34, 'p_atr': 9, 'p_adx': 12, 'rsi_period': 52, 'ema1': 25, 'ema2': 20, 'slip_atr_k': 0.005691035686589699, 'slip_spread_k': 0.37197418798477166, 'spread_hl_frac': 0.0028385310643681333, 'bb_std_mult': 1.398988096742955, 'rsi_os': 49, 'rsi_ob': 48, 'vol_spike': 0.033695088272811945, 'adx_thresh': 17.497978012867044, 'atr_min_pct': 0.016644236813510453, 'atr_max_pct': 0.14103866786615354, 'tp_mult': 2.229182926376269, 'tsl_mult': 0.9249714752829078, 'strategy': 'breakout', 'time_stop': 195, 'use_sma': False, 'use_atr': False, 'use_adx': False, 'use_ema': False, 'use_spike': True, 'rsi_required': True, 'edge_k': 1.5451877487073227, 'edge_cap': 0.46205687900126213, 'bull_strategy': 'mean_reversion', 'bull_bb_std_mult': 1.9670487175479927, 'bull_rsi_os': 39, 'bull_rsi_ob': 69, 'bull_adx_thresh': 27.23107985183504, 'bull_atr_min_pct': 0.0025569733302151444, 'bull_atr_max_pct': 0.02467664205059728, 'bull_tp_mult': 2.1327547162560547, 'bull_tsl_mult': 0.3342466094355132, 'bull_time_stop': 165, 'bull_use_sma': True, 'bull_use_ema': True, 'bull_use_atr': False, 'bull_use_adx': True, 'bull_use_spike': False, 'bull_rsi_required': True, 'bear_strategy': 'breakout', 'bear_bb_std_mult': 2.7340659765145237, 'bear_rsi_os': 44, 'bear_rsi_ob': 82, 'bear_adx_thresh': 6.129646021815834, 'bear_atr_min_pct': 0.014956588520124941, 'bear_atr_max_pct': 0.05165606933415769, 'bear_tp_mult': 1.3230397106000014, 'bear_tsl_mult': 0.7628806657660285, 'bear_time_stop': 36, 'bear_use_sma': False, 'bear_use_ema': False, 'bear_use_atr': False, 'bear_use_adx': False, 'bear_use_spike': False, 'bear_rsi_required': False, 'sideways_strategy': 'breakout', 'sideways_bb_std_mult': 2.3525202281607935, 'sideways_rsi_os': 29, 'sideways_rsi_ob': 62, 'sideways_adx_thresh': 10.883736247371514, 'sideways_atr_min_pct': 0.016227667624897874, 'sideways_atr_max_pct': 0.1273532546864589, 'sideways_tp_mult': 1.7847990360235406, 'sideways_tsl_mult': 0.14098692307602606, 'sideways_time_stop': 68, 'sideways_use_sma': True, 'sideways_use_ema': True, 'sideways_use_atr': False, 'sideways_use_adx': False, 'sideways_use_spike': True, 'sideways_rsi_required': False}.
[I 2025-08-30 20:19:40,253] Trial 778 finished with values: [-1000000000.0, 1000000000.0] and parameters: {'p_sma': 44, 'p_std': 23, 'p_atr': 21, 'p_adx': 8, 'rsi_period': 52, 'ema1': 15, 'ema2': 18, 'slip_atr_k': 0.03204761525730237, 'slip_spread_k': 0.4195736756883509, 'spread_hl_frac': 0.002892010923626516, 'bb_std_mult': 1.0028819604452746, 'rsi_os': 36, 'rsi_ob': 55, 'vol_spike': 0.04645793791144333, 'adx_thresh': 21.32179561696331, 'atr_min_pct': 0.016663971911678312, 'atr_max_pct': 0.06694140018217987, 'tp_mult': 1.2359751801420118, 'tsl_mult': 0.724812640419417, 'strategy': 'breakout', 'time_stop': 294, 'use_sma': True, 'use_atr': False, 'use_adx': False, 'use_ema': False, 'use_spike': True, 'rsi_required': False, 'edge_k': 1.4876959947293815, 'edge_cap': 0.22763830610611174, 'bull_strategy': 'breakout', 'bull_bb_std_mult': 2.6084106059711374, 'bull_rsi_os': 31, 'bull_rsi_ob': 76, 'bull_adx_thresh': 27.265394870060227, 'bull_atr_min_pct': 0.00694861684302317, 'bull_atr_max_pct': 0.025140566999044215, 'bull_tp_mult': 2.0408191484251104, 'bull_tsl_mult': 0.3395719964779854, 'bull_time_stop': 193, 'bull_use_sma': True, 'bull_use_ema': False, 'bull_use_atr': True, 'bull_use_adx': True, 'bull_use_spike': True, 'bull_rsi_required': True, 'bear_strategy': 'breakout', 'bear_bb_std_mult': 2.155461045945613, 'bear_rsi_os': 45, 'bear_rsi_ob': 81, 'bear_adx_thresh': 7.038783290980483, 'bear_atr_min_pct': 0.01494528258077925, 'bear_atr_max_pct': 0.0594222081148738, 'bear_tp_mult': 1.018973289263457, 'bear_tsl_mult': 0.045807967522725535, 'bear_time_stop': 33, 'bear_use_sma': False, 'bear_use_ema': True, 'bear_use_atr': False, 'bear_use_adx': False, 'bear_use_spike': False, 'bear_rsi_required': False, 'sideways_strategy': 'breakout', 'sideways_bb_std_mult': 2.3335837315487216, 'sideways_rsi_os': 13, 'sideways_rsi_ob': 67, 'sideways_adx_thresh': 33.75912919813344, 'sideways_atr_min_pct': 0.020868338964235587, 'sideways_atr_max_pct': 0.11781480090836609, 'sideways_tp_mult': 2.756343380676544, 'sideways_tsl_mult': 0.7195445861089728, 'sideways_time_stop': 69, 'sideways_use_sma': True, 'sideways_use_ema': False, 'sideways_use_atr': True, 'sideways_use_adx': False, 'sideways_use_spike': False, 'sideways_rsi_required': False}.
[I 2025-08-30 20:19:40,930] Trial 779 finished with values: [-1000000000.0, 1000000000.0] and parameters: {'p_sma': 44, 'p_std': 23, 'p_atr': 9, 'p_adx': 19, 'rsi_period': 73, 'ema1': 27, 'ema2': 18, 'slip_atr_k': 0.031214757917300006, 'slip_spread_k': 0.46178799085843775, 'spread_hl_frac': 0.005527923544156851, 'bb_std_mult': 2.5569110989241794, 'rsi_os': 19, 'rsi_ob': 54, 'vol_spike': 0.023269450000681244, 'adx_thresh': 18.962505406583023, 'atr_min_pct': 0.023559517068307174, 'atr_max_pct': 0.13879331704335496, 'tp_mult': 2.2200381409466328, 'tsl_mult': 0.9198179608152192, 'strategy': 'breakout', 'time_stop': 15, 'use_sma': False, 'use_atr': True, 'use_adx': False, 'use_ema': False, 'use_spike': True, 'rsi_required': True, 'edge_k': 0.024913552594378968, 'edge_cap': 0.22290994921520513, 'bull_strategy': 'breakout', 'bull_bb_std_mult': 1.722394995692346, 'bull_rsi_os': 21, 'bull_rsi_ob': 73, 'bull_adx_thresh': 27.504213203805293, 'bull_atr_min_pct': 0.0049019700257548655, 'bull_atr_max_pct': 0.024663412082809734, 'bull_tp_mult': 2.1030637286950356, 'bull_tsl_mult': 0.99942851174642, 'bull_time_stop': 192, 'bull_use_sma': False, 'bull_use_ema': False, 'bull_use_atr': True, 'bull_use_adx': True, 'bull_use_spike': True, 'bull_rsi_required': True, 'bear_strategy': 'breakout', 'bear_bb_std_mult': 2.1648412784776383, 'bear_rsi_os': 46, 'bear_rsi_ob': 51, 'bear_adx_thresh': 6.349958173462361, 'bear_atr_min_pct': 0.005167625276292418, 'bear_atr_max_pct': 0.061882584938133124, 'bear_tp_mult': 1.7478662854484557, 'bear_tsl_mult': 0.28218784957209, 'bear_time_stop': 32, 'bear_use_sma': True, 'bear_use_ema': True, 'bear_use_atr': True, 'bear_use_adx': True, 'bear_use_spike': False, 'bear_rsi_required': False, 'sideways_strategy': 'breakout', 'sideways_bb_std_mult': 0.960378562943613, 'sideways_rsi_os': 33, 'sideways_rsi_ob': 69, 'sideways_adx_thresh': 20.74876159154879, 'sideways_atr_min_pct': 0.01811233960193119, 'sideways_atr_max_pct': 0.07752875789749246, 'sideways_tp_mult': 2.263849909293291, 'sideways_tsl_mult': 0.7144990934402659, 'sideways_time_stop': 80, 'sideways_use_sma': True, 'sideways_use_ema': False, 'sideways_use_atr': True, 'sideways_use_adx': True, 'sideways_use_spike': False, 'sideways_rsi_required': False}.
[I 2025-08-30 20:20:13,063] Trial 780 finished with values: [-1000000000.0, 1000000000.0] and parameters: {'p_sma': 14, 'p_std': 13, 'p_atr': 10, 'p_adx': 8, 'rsi_period': 73, 'ema1': 29, 'ema2': 13, 'slip_atr_k': 0.031204858298442675, 'slip_spread_k': 0.7228442362304931, 'spread_hl_frac': 0.03267745676118896, 'bb_std_mult': 2.939641154929948, 'rsi_os': 21, 'rsi_ob': 59, 'vol_spike': 0.024177746857869473, 'adx_thresh': 10.407260505247015, 'atr_min_pct': 0.02335135368946819, 'atr_max_pct': 0.1372463373305432, 'tp_mult': 2.218670898077776, 'tsl_mult': 0.27050142719006776, 'strategy': 'breakout', 'time_stop': 220, 'use_sma': True, 'use_atr': True, 'use_adx': False, 'use_ema': False, 'use_spike': True, 'rsi_required': False, 'edge_k': 0.029081928816592106, 'edge_cap': 0.2578597990648482, 'bull_strategy': 'breakout', 'bull_bb_std_mult': 1.409946688980142, 'bull_rsi_os': 49, 'bull_rsi_ob': 76, 'bull_adx_thresh': 13.039068074283252, 'bull_atr_min_pct': 0.0037081976395532557, 'bull_atr_max_pct': 0.02440960090549867, 'bull_tp_mult': 2.9691082828810544, 'bull_tsl_mult': 0.9842497502925672, 'bull_time_stop': 131, 'bull_use_sma': False, 'bull_use_ema': False, 'bull_use_atr': True, 'bull_use_adx': True, 'bull_use_spike': True, 'bull_rsi_required': True, 'bear_strategy': 'breakout', 'bear_bb_std_mult': 2.157596560434546, 'bear_rsi_os': 28, 'bear_rsi_ob': 83, 'bear_adx_thresh': 21.13439929665204, 'bear_atr_min_pct': 0.016927934237461376, 'bear_atr_max_pct': 0.061600291601837984, 'bear_tp_mult': 1.7390925017009529, 'bear_tsl_mult': 0.2749453947146793, 'bear_time_stop': 278, 'bear_use_sma': True, 'bear_use_ema': True, 'bear_use_atr': True, 'bear_use_adx': True, 'bear_use_spike': False, 'bear_rsi_required': False, 'sideways_strategy': 'breakout', 'sideways_bb_std_mult': 2.3191387797284833, 'sideways_rsi_os': 33, 'sideways_rsi_ob': 91, 'sideways_adx_thresh': 33.91798303891588, 'sideways_atr_min_pct': 0.021199616398564207, 'sideways_atr_max_pct': 0.07406673856813746, 'sideways_tp_mult': 2.0310123071971806, 'sideways_tsl_mult': 0.7150304446497433, 'sideways_time_stop': 263, 'sideways_use_sma': True, 'sideways_use_ema': False, 'sideways_use_atr': True, 'sideways_use_adx': True, 'sideways_use_spike': False, 'sideways_rsi_required': False}.
[I 2025-08-30 20:20:13,706] Trial 781 finished with values: [-1000000000.0, 1000000000.0] and parameters: {'p_sma': 14, 'p_std': 13, 'p_atr': 21, 'p_adx': 24, 'rsi_period': 50, 'ema1': 24, 'ema2': 16, 'slip_atr_k': 0.1983087990165221, 'slip_spread_k': 0.45747491180905275, 'spread_hl_frac': 0.0054827775838875645, 'bb_std_mult': 1.1234657156247732, 'rsi_os': 31, 'rsi_ob': 74, 'vol_spike': 0.026301631340574443, 'adx_thresh': 13.400711218991937, 'atr_min_pct': 0.023533674123454168, 'atr_max_pct': 0.10528462119614453, 'tp_mult': 2.154110871379758, 'tsl_mult': 0.26611889046593484, 'strategy': 'breakout', 'time_stop': 221, 'use_sma': True, 'use_atr': True, 'use_adx': False, 'use_ema': False, 'use_spike': True, 'rsi_required': False, 'edge_k': 1.4717807875137163, 'edge_cap': 0.2601141270320203, 'bull_strategy': 'breakout', 'bull_bb_std_mult': 0.9371280740677148, 'bull_rsi_os': 31, 'bull_rsi_ob': 76, 'bull_adx_thresh': 26.037300862045278, 'bull_atr_min_pct': 0.005097482021064407, 'bull_atr_max_pct': 0.0287100186616467, 'bull_tp_mult': 2.3810920306160224, 'bull_tsl_mult': 0.10640609047170474, 'bull_time_stop': 191, 'bull_use_sma': False, 'bull_use_ema': False, 'bull_use_atr': True, 'bull_use_adx': True, 'bull_use_spike': True, 'bull_rsi_required': True, 'bear_strategy': 'breakout', 'bear_bb_std_mult': 3.406771962307954, 'bear_rsi_os': 19, 'bear_rsi_ob': 51, 'bear_adx_thresh': 8.344098118693156, 'bear_atr_min_pct': 0.005206665611748634, 'bear_atr_max_pct': 0.037801183463872526, 'bear_tp_mult': 2.9204113934771345, 'bear_tsl_mult': 0.8631061903940684, 'bear_time_stop': 133, 'bear_use_sma': True, 'bear_use_ema': True, 'bear_use_atr': True, 'bear_use_adx': True, 'bear_use_spike': False, 'bear_rsi_required': False, 'sideways_strategy': 'breakout', 'sideways_bb_std_mult': 1.5880849318525059, 'sideways_rsi_os': 13, 'sideways_rsi_ob': 94, 'sideways_adx_thresh': 7.493161906048956, 'sideways_atr_min_pct': 0.005006546486414997, 'sideways_atr_max_pct': 0.11646942827549273, 'sideways_tp_mult': 1.4745896608837392, 'sideways_tsl_mult': 0.7197733636583198, 'sideways_time_stop': 105, 'sideways_use_sma': True, 'sideways_use_ema': False, 'sideways_use_atr': True, 'sideways_use_adx': True, 'sideways_use_spike': False, 'sideways_rsi_required': False}.
[I 2025-08-30 20:20:14,683] Trial 782 finished with values: [-1000000000.0, 1000000000.0] and parameters: {'p_sma': 52, 'p_std': 27, 'p_atr': 24, 'p_adx': 14, 'rsi_period': 54, 'ema1': 24, 'ema2': 16, 'slip_atr_k': 0.012132577921307999, 'slip_spread_k': 0.698103053084115, 'spread_hl_frac': 0.03242588104342753, 'bb_std_mult': 1.0921543593134724, 'rsi_os': 38, 'rsi_ob': 75, 'vol_spike': 0.05768634045267624, 'adx_thresh': 13.557424470990094, 'atr_min_pct': 0.02351573519011579, 'atr_max_pct': 0.1374607074026938, 'tp_mult': 2.93105496530507, 'tsl_mult': 0.11484122454733409, 'strategy': 'breakout', 'time_stop': 44, 'use_sma': False, 'use_atr': True, 'use_adx': False, 'use_ema': True, 'use_spike': False, 'rsi_required': True, 'edge_k': 0.20705708014908175, 'edge_cap': 0.26089316199323237, 'bull_strategy': 'breakout', 'bull_bb_std_mult': 1.7135529524145892, 'bull_rsi_os': 33, 'bull_rsi_ob': 73, 'bull_adx_thresh': 17.821843620044028, 'bull_atr_min_pct': 0.00367826955211035, 'bull_atr_max_pct': 0.029434748881681336, 'bull_tp_mult': 2.0973284977120152, 'bull_tsl_mult': 0.4519168025147947, 'bull_time_stop': 285, 'bull_use_sma': False, 'bull_use_ema': False, 'bull_use_atr': True, 'bull_use_adx': False, 'bull_use_spike': True, 'bull_rsi_required': True, 'bear_strategy': 'breakout', 'bear_bb_std_mult': 3.37493434022634, 'bear_rsi_os': 42, 'bear_rsi_ob': 65, 'bear_adx_thresh': 8.509979916207389, 'bear_atr_min_pct': 0.00831537344725326, 'bear_atr_max_pct': 0.05625161836666441, 'bear_tp_mult': 1.7543479272304083, 'bear_tsl_mult': 0.8546825606854556, 'bear_time_stop': 141, 'bear_use_sma': True, 'bear_use_ema': True, 'bear_use_atr': True, 'bear_use_adx': True, 'bear_use_spike': True, 'bear_rsi_required': False, 'sideways_strategy': 'breakout', 'sideways_bb_std_mult': 1.8089327713505872, 'sideways_rsi_os': 34, 'sideways_rsi_ob': 88, 'sideways_adx_thresh': 8.77789006359337, 'sideways_atr_min_pct': 0.018136042504850108, 'sideways_atr_max_pct': 0.11757447185019657, 'sideways_tp_mult': 1.5848511934442735, 'sideways_tsl_mult': 0.70611010181238, 'sideways_time_stop': 262, 'sideways_use_sma': True, 'sideways_use_ema': False, 'sideways_use_atr': True, 'sideways_use_adx': True, 'sideways_use_spike': False, 'sideways_rsi_required': False}.
