[I 2025-08-30 19:43:19,046] Trial 512 finished with values: [-1000000000.0, 1000000000.0] and parameters: {'p_sma': 40, 'p_std': 20, 'p_atr': 9, 'p_adx': 18, 'rsi_period': 25, 'ema1': 25, 'ema2': 25, 'slip_atr_k': 0.24142877028405496, 'slip_spread_k': 0.4561836758133534, 'spread_hl_frac': 0.015514784489341871, 'bb_std_mult': 3.4904019484138953, 'rsi_os': 8, 'rsi_ob': 61, 'vol_spike': 0.0404138217535283, 'adx_thresh': 13.884806083391076, 'atr_min_pct': 0.02497450241603913, 'atr_max_pct': 0.13280811386336264, 'tp_mult': 2.211615388045797, 'tsl_mult': 0.7192707226864314, 'strategy': 'mean_reversion', 'time_stop': 30, 'use_sma': False, 'use_atr': False, 'use_adx': True, 'use_ema': False, 'use_spike': True, 'rsi_required': True, 'edge_k': 1.6637353040390577, 'edge_cap': 0.43915725085129714, 'bull_strategy': 'breakout', 'bull_bb_std_mult': 0.6916982946975523, 'bull_rsi_os': 19, 'bull_rsi_ob': 77, 'bull_adx_thresh': 8.829489514847486, 'bull_atr_min_pct': 0.003159054084140831, 'bull_atr_max_pct': 0.05186125179648714, 'bull_tp_mult': 1.1615893657403062, 'bull_tsl_mult': 0.005959524702636165, 'bull_time_stop': 275, 'bull_use_sma': True, 'bull_use_ema': False, 'bull_use_atr': False, 'bull_use_adx': False, 'bull_use_spike': True, 'bull_rsi_required': True, 'bear_strategy': 'breakout', 'bear_bb_std_mult': 0.5653407587555197, 'bear_rsi_os': 44, 'bear_rsi_ob': 94, 'bear_adx_thresh': 5.007626264629448, 'bear_atr_min_pct': 0.02702897752615597, 'bear_atr_max_pct': 0.02388388714439512, 'bear_tp_mult': 2.562734186883108, 'bear_tsl_mult': 0.5265128741837575, 'bear_time_stop': 34, 'bear_use_sma': True, 'bear_use_ema': False, 'bear_use_atr': True, 'bear_use_adx': True, 'bear_use_spike': False, 'bear_rsi_required': True, 'sideways_strategy': 'breakout', 'sideways_bb_std_mult': 2.0945231872333947, 'sideways_rsi_os': 51, 'sideways_rsi_ob': 56, 'sideways_adx_thresh': 23.61324617388034, 'sideways_atr_min_pct': 0.020327655768980886, 'sideways_atr_max_pct': 0.11841713283619232, 'sideways_tp_mult': 1.3629049778152784, 'sideways_tsl_mult': 0.3676323353409762, 'sideways_time_stop': 95, 'sideways_use_sma': False, 'sideways_use_ema': True, 'sideways_use_atr': True, 'sideways_use_adx': False, 'sideways_use_spike': False, 'sideways_rsi_required': True}.
[I 2025-08-30 19:43:52,140] Trial 516 finished with values: [-1000000000.0, 1000000000.0] and parameters: {'p_sma': 40, 'p_std': 27, 'p_atr': 12, 'p_adx': 11, 'rsi_period': 53, 'ema1': 24, 'ema2': 15, 'slip_atr_k': 0.033877790291556034, 'slip_spread_k': 0.3968752016978727, 'spread_hl_frac': 0.03855505811826645, 'bb_std_mult': 1.137637737623163, 'rsi_os': 5, 'rsi_ob': 54, 'vol_spike': 0.043553939930378684, 'adx_thresh': 20.64073970360651, 'atr_min_pct': 0.008010105692322574, 'atr_max_pct': 0.14425189183544407, 'tp_mult': 2.2147378254230334, 'tsl_mult': 0.9142509689923286, 'strategy': 'breakout', 'time_stop': 33, 'use_sma': False, 'use_atr': False, 'use_adx': False, 'use_ema': False, 'use_spike': True, 'rsi_required': True, 'edge_k': 0.1686583098061666, 'edge_cap': 0.23281066091308084, 'bull_strategy': 'breakout', 'bull_bb_std_mult': 1.7083269463920987, 'bull_rsi_os': 53, 'bull_rsi_ob': 75, 'bull_adx_thresh': 26.50719704772711, 'bull_atr_min_pct': 0.013103527504713457, 'bull_atr_max_pct': 0.07225732431812933, 'bull_tp_mult': 1.8452473210996152, 'bull_tsl_mult': 0.9644242355518469, 'bull_time_stop': 273, 'bull_use_sma': False, 'bull_use_ema': False, 'bull_use_atr': False, 'bull_use_adx': False, 'bull_use_spike': False, 'bull_rsi_required': False, 'bear_strategy': 'breakout', 'bear_bb_std_mult': 3.5971208582054497, 'bear_rsi_os': 40, 'bear_rsi_ob': 82, 'bear_adx_thresh': 29.272670618250295, 'bear_atr_min_pct': 0.005819429345272036, 'bear_atr_max_pct': 0.029271180799967107, 'bear_tp_mult': 1.7780725956952455, 'bear_tsl_mult': 0.06159186404829403, 'bear_time_stop': 300, 'bear_use_sma': False, 'bear_use_ema': False, 'bear_use_atr': True, 'bear_use_adx': True, 'bear_use_spike': False, 'bear_rsi_required': True, 'sideways_strategy': 'breakout', 'sideways_bb_std_mult': 2.0746852271367757, 'sideways_rsi_os': 28, 'sideways_rsi_ob': 72, 'sideways_adx_thresh': 9.634253656798213, 'sideways_atr_min_pct': 0.00553041160245509, 'sideways_atr_max_pct': 0.12210174719495644, 'sideways_tp_mult': 1.7834566656185722, 'sideways_tsl_mult': 0.22314196432104977, 'sideways_time_stop': 278, 'sideways_use_sma': False, 'sideways_use_ema': False, 'sideways_use_atr': False, 'sideways_use_adx': True, 'sideways_use_spike': False, 'sideways_rsi_required': True}.
[I 2025-08-30 19:43:52,484] Trial 515 finished with values: [-0.023254703718458947, 0.023166720202263173] and parameters: {'p_sma': 40, 'p_std': 34, 'p_atr': 8, 'p_adx': 11, 'rsi_period': 53, 'ema1': 29, 'ema2': 53, 'slip_atr_k': 0.2420417274965377, 'slip_spread_k': 0.7225517213445587, 'spread_hl_frac': 0.005410746043781217, 'bb_std_mult': 1.1507152357855128, 'rsi_os': 40, 'rsi_ob': 58, 'vol_spike': 0.04465105451836323, 'adx_thresh': 6.647454480957617, 'atr_min_pct': 0.021816478156319027, 'atr_max_pct': 0.14466665996591943, 'tp_mult': 1.4305279441796406, 'tsl_mult': 0.7502109125994497, 'strategy': 'breakout', 'time_stop': 30, 'use_sma': False, 'use_atr': True, 'use_adx': True, 'use_ema': False, 'use_spike': True, 'rsi_required': True, 'edge_k': 1.5593948674448164, 'edge_cap': 0.2305836140543638, 'bull_strategy': 'mean_reversion', 'bull_bb_std_mult': 0.8132248371643644, 'bull_rsi_os': 49, 'bull_rsi_ob': 64, 'bull_adx_thresh': 26.41024818044252, 'bull_atr_min_pct': 0.0016022328008592954, 'bull_atr_max_pct': 0.020535068863684038, 'bull_tp_mult': 2.061680224269803, 'bull_tsl_mult': 0.9646672006164029, 'bull_time_stop': 189, 'bull_use_sma': False, 'bull_use_ema': False, 'bull_use_atr': False, 'bull_use_adx': True, 'bull_use_spike': False, 'bull_rsi_required': False, 'bear_strategy': 'breakout', 'bear_bb_std_mult': 1.998738232009268, 'bear_rsi_os': 47, 'bear_rsi_ob': 94, 'bear_adx_thresh': 5.001105052607845, 'bear_atr_min_pct': 0.0251636952230957, 'bear_atr_max_pct': 0.029390768009842458, 'bear_tp_mult': 2.0598750049790597, 'bear_tsl_mult': 0.5162911215350006, 'bear_time_stop': 31, 'bear_use_sma': False, 'bear_use_ema': False, 'bear_use_atr': True, 'bear_use_adx': True, 'bear_use_spike': False, 'bear_rsi_required': False, 'sideways_strategy': 'breakout', 'sideways_bb_std_mult': 2.0964248501758385, 'sideways_rsi_os': 19, 'sideways_rsi_ob': 75, 'sideways_adx_thresh': 19.504329141341767, 'sideways_atr_min_pct': 0.02049676630148825, 'sideways_atr_max_pct': 0.13203146901434012, 'sideways_tp_mult': 1.8059359188667656, 'sideways_tsl_mult': 0.45121639343138126, 'sideways_time_stop': 93, 'sideways_use_sma': True, 'sideways_use_ema': False, 'sideways_use_atr': True, 'sideways_use_adx': True, 'sideways_use_spike': False, 'sideways_rsi_required': False}.
[I 2025-08-30 19:43:52,487] Trial 514 finished with values: [-1000000000.0, 1000000000.0] and parameters: {'p_sma': 28, 'p_std': 20, 'p_atr': 11, 'p_adx': 10, 'rsi_period': 70, 'ema1': 24, 'ema2': 52, 'slip_atr_k': 0.24083081415089969, 'slip_spread_k': 0.4544442701505831, 'spread_hl_frac': 0.004774287176498103, 'bb_std_mult': 1.9450014755131437, 'rsi_os': 40, 'rsi_ob': 95, 'vol_spike': 0.04208217898997196, 'adx_thresh': 20.54681829990578, 'atr_min_pct': 0.02458432208043902, 'atr_max_pct': 0.132507752930239, 'tp_mult': 2.2215394728817524, 'tsl_mult': 0.7181776453610187, 'strategy': 'breakout', 'time_stop': 31, 'use_sma': False, 'use_atr': True, 'use_adx': True, 'use_ema': False, 'use_spike': True, 'rsi_required': True, 'edge_k': 0.1641569410154986, 'edge_cap': 0.369152821297377, 'bull_strategy': 'mean_reversion', 'bull_bb_std_mult': 2.4530249098422727, 'bull_rsi_os': 49, 'bull_rsi_ob': 75, 'bull_adx_thresh': 26.03900851299478, 'bull_atr_min_pct': 0.009684723687763314, 'bull_atr_max_pct': 0.052770906760198855, 'bull_tp_mult': 2.33238572852575, 'bull_tsl_mult': 0.9986613790744537, 'bull_time_stop': 188, 'bull_use_sma': False, 'bull_use_ema': False, 'bull_use_atr': False, 'bull_use_adx': True, 'bull_use_spike': False, 'bull_rsi_required': False, 'bear_strategy': 'breakout', 'bear_bb_std_mult': 2.242220334947577, 'bear_rsi_os': 40, 'bear_rsi_ob': 82, 'bear_adx_thresh': 5.670845510793434, 'bear_atr_min_pct': 0.005880229082088814, 'bear_atr_max_pct': 0.028171849885651204, 'bear_tp_mult': 1.7753824108214964, 'bear_tsl_mult': 0.5453572356735786, 'bear_time_stop': 31, 'bear_use_sma': False, 'bear_use_ema': False, 'bear_use_atr': True, 'bear_use_adx': True, 'bear_use_spike': False, 'bear_rsi_required': False, 'sideways_strategy': 'breakout', 'sideways_bb_std_mult': 2.0829482703221913, 'sideways_rsi_os': 51, 'sideways_rsi_ob': 72, 'sideways_adx_thresh': 8.518220942320935, 'sideways_atr_min_pct': 0.020323820389988128, 'sideways_atr_max_pct': 0.11891689642365322, 'sideways_tp_mult': 2.924549366848632, 'sideways_tsl_mult': 0.4522312711572082, 'sideways_time_stop': 93, 'sideways_use_sma': True, 'sideways_use_ema': False, 'sideways_use_atr': True, 'sideways_use_adx': True, 'sideways_use_spike': False, 'sideways_rsi_required': False}.
[I 2025-08-30 19:43:52,627] Trial 517 finished with values: [-0.0376909188016431, 0.03761073160105034] and parameters: {'p_sma': 43, 'p_std': 13, 'p_atr': 12, 'p_adx': 8, 'rsi_period': 50, 'ema1': 19, 'ema2': 53, 'slip_atr_k': 0.1595475738699699, 'slip_spread_k': 0.39402711556451653, 'spread_hl_frac': 0.03820154370535365, 'bb_std_mult': 1.157430401923968, 'rsi_os': 46, 'rsi_ob': 54, 'vol_spike': 0.04299967070520346, 'adx_thresh': 20.307960427243145, 'atr_min_pct': 0.008123493428829839, 'atr_max_pct': 0.13851853901190062, 'tp_mult': 1.5995333290132696, 'tsl_mult': 0.9220430032178143, 'strategy': 'breakout', 'time_stop': 72, 'use_sma': False, 'use_atr': True, 'use_adx': False, 'use_ema': False, 'use_spike': True, 'rsi_required': True, 'edge_k': 0.16655080687046175, 'edge_cap': 0.22103961492101704, 'bull_strategy': 'mean_reversion', 'bull_bb_std_mult': 1.7115550238789015, 'bull_rsi_os': 49, 'bull_rsi_ob': 61, 'bull_adx_thresh': 7.087214497509981, 'bull_atr_min_pct': 0.0016085146198269182, 'bull_atr_max_pct': 0.021464481366868002, 'bull_tp_mult': 2.129988158826391, 'bull_tsl_mult': 0.9655330562848328, 'bull_time_stop': 199, 'bull_use_sma': False, 'bull_use_ema': False, 'bull_use_atr': False, 'bull_use_adx': True, 'bull_use_spike': False, 'bull_rsi_required': False, 'bear_strategy': 'breakout', 'bear_bb_std_mult': 2.14312295208055, 'bear_rsi_os': 36, 'bear_rsi_ob': 82, 'bear_adx_thresh': 17.83860831695553, 'bear_atr_min_pct': 0.01509746357355847, 'bear_atr_max_pct': 0.028468540479767386, 'bear_tp_mult': 1.6766105902804773, 'bear_tsl_mult': 0.06395810306329236, 'bear_time_stop': 300, 'bear_use_sma': False, 'bear_use_ema': False, 'bear_use_atr': True, 'bear_use_adx': True, 'bear_use_spike': False, 'bear_rsi_required': False, 'sideways_strategy': 'breakout', 'sideways_bb_std_mult': 2.065986550310742, 'sideways_rsi_os': 47, 'sideways_rsi_ob': 95, 'sideways_adx_thresh': 34.91689615428109, 'sideways_atr_min_pct': 0.004392092001225338, 'sideways_atr_max_pct': 0.04766262756025757, 'sideways_tp_mult': 1.7893922236764692, 'sideways_tsl_mult': 0.6603291106742556, 'sideways_time_stop': 279, 'sideways_use_sma': True, 'sideways_use_ema': False, 'sideways_use_atr': False, 'sideways_use_adx': True, 'sideways_use_spike': False, 'sideways_rsi_required': False}.
[I 2025-08-30 19:44:24,054] Trial 518 finished with values: [-0.026440769011415455, 0.026357581473279552] and parameters: {'p_sma': 42, 'p_std': 23, 'p_atr': 11, 'p_adx': 8, 'rsi_period': 50, 'ema1': 24, 'ema2': 14, 'slip_atr_k': 0.20693767458972084, 'slip_spread_k': 0.48647718591690503, 'spread_hl_frac': 0.0046064645997452155, 'bb_std_mult': 1.900484586245887, 'rsi_os': 40, 'rsi_ob': 58, 'vol_spike': 0.020154551517332753, 'adx_thresh': 20.05849208089472, 'atr_min_pct': 0.01968404681244126, 'atr_max_pct': 0.13829976977388778, 'tp_mult': 2.0242144213041153, 'tsl_mult': 0.7438415438734711, 'strategy': 'breakout', 'time_stop': 71, 'use_sma': False, 'use_atr': True, 'use_adx': False, 'use_ema': False, 'use_spike': True, 'rsi_required': True, 'edge_k': 0.04868223936362909, 'edge_cap': 0.20636712907874005, 'bull_strategy': 'mean_reversion', 'bull_bb_std_mult': 1.8791558531134662, 'bull_rsi_os': 50, 'bull_rsi_ob': 64, 'bull_adx_thresh': 25.57097632229263, 'bull_atr_min_pct': 0.0015574970427106598, 'bull_atr_max_pct': 0.020710680564782376, 'bull_tp_mult': 2.3340112289431496, 'bull_tsl_mult': 0.9996299659787773, 'bull_time_stop': 198, 'bull_use_sma': False, 'bull_use_ema': False, 'bull_use_atr': False, 'bull_use_adx': True, 'bull_use_spike': False, 'bull_rsi_required': False, 'bear_strategy': 'breakout', 'bear_bb_std_mult': 2.5201447621591937, 'bear_rsi_os': 48, 'bear_rsi_ob': 83, 'bear_adx_thresh': 17.951014629706684, 'bear_atr_min_pct': 0.015127638516867268, 'bear_atr_max_pct': 0.061272007505331086, 'bear_tp_mult': 1.67682785621908, 'bear_tsl_mult': 0.1173666778338716, 'bear_time_stop': 186, 'bear_use_sma': False, 'bear_use_ema': False, 'bear_use_atr': True, 'bear_use_adx': True, 'bear_use_spike': True, 'bear_rsi_required': False, 'sideways_strategy': 'breakout', 'sideways_bb_std_mult': 1.9872747150602597, 'sideways_rsi_os': 17, 'sideways_rsi_ob': 75, 'sideways_adx_thresh': 19.745313671527523, 'sideways_atr_min_pct': 0.01894737007848698, 'sideways_atr_max_pct': 0.04801933540183238, 'sideways_tp_mult': 1.7824048819958747, 'sideways_tsl_mult': 0.6631552934339726, 'sideways_time_stop': 171, 'sideways_use_sma': True, 'sideways_use_ema': False, 'sideways_use_atr': False, 'sideways_use_adx': True, 'sideways_use_spike': False, 'sideways_rsi_required': False}.
[I 2025-08-30 19:44:24,899] Trial 521 finished with values: [-1000000000.0, 1000000000.0] and parameters: {'p_sma': 42, 'p_std': 23, 'p_atr': 22, 'p_adx': 30, 'rsi_period': 37, 'ema1': 24, 'ema2': 17, 'slip_atr_k': 0.06275573898745573, 'slip_spread_k': 0.34409701005512366, 'spread_hl_frac': 0.009956513931227831, 'bb_std_mult': 0.9608869092594957, 'rsi_os': 37, 'rsi_ob': 76, 'vol_spike': 0.018757054604426948, 'adx_thresh': 27.811009256911444, 'atr_min_pct': 0.019566980496281482, 'atr_max_pct': 0.13571662535609488, 'tp_mult': 2.1140853604702774, 'tsl_mult': 0.15322015340161393, 'strategy': 'mean_reversion', 'time_stop': 287, 'use_sma': True, 'use_atr': True, 'use_adx': False, 'use_ema': False, 'use_spike': True, 'rsi_required': True, 'edge_k': 1.6010738735614707, 'edge_cap': 0.2514690380351194, 'bull_strategy': 'mean_reversion', 'bull_bb_std_mult': 1.8471451307490927, 'bull_rsi_os': 10, 'bull_rsi_ob': 73, 'bull_adx_thresh': 32.85057643904741, 'bull_atr_min_pct': 0.003743528934793733, 'bull_atr_max_pct': 0.01406245057407185, 'bull_tp_mult': 2.0230829331783258, 'bull_tsl_mult': 0.9483462505314492, 'bull_time_stop': 264, 'bull_use_sma': True, 'bull_use_ema': False, 'bull_use_atr': False, 'bull_use_adx': True, 'bull_use_spike': True, 'bull_rsi_required': True, 'bear_strategy': 'breakout', 'bear_bb_std_mult': 2.5126125512389645, 'bear_rsi_os': 19, 'bear_rsi_ob': 83, 'bear_adx_thresh': 6.385628934399033, 'bear_atr_min_pct': 0.014715166968695318, 'bear_atr_max_pct': 0.06831245305207488, 'bear_tp_mult': 1.4714692648565495, 'bear_tsl_mult': 0.22047560531733762, 'bear_time_stop': 67, 'bear_use_sma': True, 'bear_use_ema': True, 'bear_use_atr': False, 'bear_use_adx': False, 'bear_use_spike': True, 'bear_rsi_required': False, 'sideways_strategy': 'mean_reversion', 'sideways_bb_std_mult': 1.9898712294548055, 'sideways_rsi_os': 17, 'sideways_rsi_ob': 59, 'sideways_adx_thresh': 13.204346221065983, 'sideways_atr_min_pct': 0.016656711466774592, 'sideways_atr_max_pct': 0.07851121876308952, 'sideways_tp_mult': 1.722093998129196, 'sideways_tsl_mult': 0.7066229455980229, 'sideways_time_stop': 264, 'sideways_use_sma': True, 'sideways_use_ema': True, 'sideways_use_atr': False, 'sideways_use_adx': False, 'sideways_use_spike': False, 'sideways_rsi_required': False}.
[I 2025-08-30 19:44:25,185] Trial 520 finished with values: [-0.019726385883395814, 0.019635574482400338] and parameters: {'p_sma': 42, 'p_std': 52, 'p_atr': 14, 'p_adx': 9, 'rsi_period': 50, 'ema1': 8, 'ema2': 14, 'slip_atr_k': 0.15768254378234148, 'slip_spread_k': 0.4836271930805879, 'spread_hl_frac': 0.008545196568146923, 'bb_std_mult': 0.9641186350589127, 'rsi_os': 32, 'rsi_ob': 75, 'vol_spike': 0.024686778597648798, 'adx_thresh': 31.27857232293544, 'atr_min_pct': 0.012687717950761651, 'atr_max_pct': 0.13843591262059868, 'tp_mult': 2.1313685722060804, 'tsl_mult': 0.7717468387035281, 'strategy': 'mean_reversion', 'time_stop': 288, 'use_sma': True, 'use_atr': True, 'use_adx': False, 'use_ema': False, 'use_spike': True, 'rsi_required': True, 'edge_k': 0.319082341174292, 'edge_cap': 0.5878366894810003, 'bull_strategy': 'mean_reversion', 'bull_bb_std_mult': 2.7134376514877334, 'bull_rsi_os': 43, 'bull_rsi_ob': 73, 'bull_adx_thresh': 25.403323124831868, 'bull_atr_min_pct': 0.001312054237394628, 'bull_atr_max_pct': 0.027252202087688943, 'bull_tp_mult': 2.3982863565564845, 'bull_tsl_mult': 0.9454237443309587, 'bull_time_stop': 112, 'bull_use_sma': True, 'bull_use_ema': False, 'bull_use_atr': False, 'bull_use_adx': True, 'bull_use_spike': True, 'bull_rsi_required': True, 'bear_strategy': 'breakout', 'bear_bb_std_mult': 1.1788402068143058, 'bear_rsi_os': 36, 'bear_rsi_ob': 83, 'bear_adx_thresh': 6.295121123931478, 'bear_atr_min_pct': 0.02613273041861787, 'bear_atr_max_pct': 0.061250544928955805, 'bear_tp_mult': 2.769130040161357, 'bear_tsl_mult': 0.22081583561645646, 'bear_time_stop': 23, 'bear_use_sma': True, 'bear_use_ema': True, 'bear_use_atr': False, 'bear_use_adx': False, 'bear_use_spike': True, 'bear_rsi_required': False, 'sideways_strategy': 'mean_reversion', 'sideways_bb_std_mult': 1.9959283846039026, 'sideways_rsi_os': 23, 'sideways_rsi_ob': 57, 'sideways_adx_thresh': 21.368011235060756, 'sideways_atr_min_pct': 0.016628728453030185, 'sideways_atr_max_pct': 0.04698972155397521, 'sideways_tp_mult': 1.7760653828154314, 'sideways_tsl_mult': 0.6664290692253207, 'sideways_time_stop': 262, 'sideways_use_sma': True, 'sideways_use_ema': True, 'sideways_use_atr': False, 'sideways_use_adx': False, 'sideways_use_spike': False, 'sideways_rsi_required': False}.
[I 2025-08-30 19:44:25,278] Trial 519 finished with values: [-0.023370391581346683, 0.023342738961898077] and parameters: {'p_sma': 42, 'p_std': 23, 'p_atr': 14, 'p_adx': 9, 'rsi_period': 81, 'ema1': 12, 'ema2': 14, 'slip_atr_k': 0.020883415312085013, 'slip_spread_k': 0.3480368718734506, 'spread_hl_frac': 0.004037674077699792, 'bb_std_mult': 0.7306327688346077, 'rsi_os': 37, 'rsi_ob': 56, 'vol_spike': 0.021351759550953253, 'adx_thresh': 19.63242057599596, 'atr_min_pct': 0.012878676642283218, 'atr_max_pct': 0.1374953982148787, 'tp_mult': 1.585744960861893, 'tsl_mult': 0.6284533938856405, 'strategy': 'mean_reversion', 'time_stop': 45, 'use_sma': True, 'use_atr': True, 'use_adx': False, 'use_ema': False, 'use_spike': True, 'rsi_required': True, 'edge_k': 0.06892208844974568, 'edge_cap': 0.25113480647578607, 'bull_strategy': 'mean_reversion', 'bull_bb_std_mult': 1.8506770913600694, 'bull_rsi_os': 50, 'bull_rsi_ob': 73, 'bull_adx_thresh': 32.73963125336855, 'bull_atr_min_pct': 0.0014656250355787415, 'bull_atr_max_pct': 0.027756949253785135, 'bull_tp_mult': 1.332174189014491, 'bull_tsl_mult': 0.9431688970635863, 'bull_time_stop': 112, 'bull_use_sma': True, 'bull_use_ema': False, 'bull_use_atr': False, 'bull_use_adx': True, 'bull_use_spike': True, 'bull_rsi_required': True, 'bear_strategy': 'breakout', 'bear_bb_std_mult': 3.414634421275188, 'bear_rsi_os': 19, 'bear_rsi_ob': 71, 'bear_adx_thresh': 17.835599233545057, 'bear_atr_min_pct': 6.867080672883982e-06, 'bear_atr_max_pct': 0.1267792588203768, 'bear_tp_mult': 1.7163859845910583, 'bear_tsl_mult': 0.7802734211554925, 'bear_time_stop': 281, 'bear_use_sma': True, 'bear_use_ema': True, 'bear_use_atr': False, 'bear_use_adx': False, 'bear_use_spike': True, 'bear_rsi_required': False, 'sideways_strategy': 'mean_reversion', 'sideways_bb_std_mult': 1.9831655230106722, 'sideways_rsi_os': 10, 'sideways_rsi_ob': 59, 'sideways_adx_thresh': 18.70524291176791, 'sideways_atr_min_pct': 0.008667599913643038, 'sideways_atr_max_pct': 0.048242160314452574, 'sideways_tp_mult': 1.2178514449734061, 'sideways_tsl_mult': 0.01746661196633359, 'sideways_time_stop': 232, 'sideways_use_sma': True, 'sideways_use_ema': True, 'sideways_use_atr': False, 'sideways_use_adx': False, 'sideways_use_spike': False, 'sideways_rsi_required': False}.
