[I 2025-08-30 19:56:36,113] Trial 612 finished with values: [-1000000000.0, 1000000000.0] and parameters: {'p_sma': 43, 'p_std': 26, 'p_atr': 11, 'p_adx': 9, 'rsi_period': 51, 'ema1': 24, 'ema2': 19, 'slip_atr_k': 0.015931826650481234, 'slip_spread_k': 0.37889844561697744, 'spread_hl_frac': 0.003131890618379287, 'bb_std_mult': 0.5831844847707479, 'rsi_os': 18, 'rsi_ob': 73, 'vol_spike': 0.048677866338417385, 'adx_thresh': 25.591202059801397, 'atr_min_pct': 0.02136380869396865, 'atr_max_pct': 0.1324686923537197, 'tp_mult': 2.237267829221068, 'tsl_mult': 0.7941376817659047, 'strategy': 'breakout', 'time_stop': 21, 'use_sma': False, 'use_atr': True, 'use_adx': False, 'use_ema': False, 'use_spike': True, 'rsi_required': False, 'edge_k': 0.07703587909287027, 'edge_cap': 0.2296537876349629, 'bull_strategy': 'mean_reversion', 'bull_bb_std_mult': 1.8431866756518291, 'bull_rsi_os': 53, 'bull_rsi_ob': 50, 'bull_adx_thresh': 15.927496260405988, 'bull_atr_min_pct': 0.01016885610590619, 'bull_atr_max_pct': 0.1336305046442674, 'bull_tp_mult': 2.2123810289282413, 'bull_tsl_mult': 0.9545540572593824, 'bull_time_stop': 171, 'bull_use_sma': True, 'bull_use_ema': True, 'bull_use_atr': True, 'bull_use_adx': False, 'bull_use_spike': True, 'bull_rsi_required': True, 'bear_strategy': 'breakout', 'bear_bb_std_mult': 3.0742773920804676, 'bear_rsi_os': 41, 'bear_rsi_ob': 62, 'bear_adx_thresh': 7.2822940368949425, 'bear_atr_min_pct': 0.01596256054822105, 'bear_atr_max_pct': 0.05201438930641292, 'bear_tp_mult': 1.0628498603767877, 'bear_tsl_mult': 0.14804190614293739, 'bear_time_stop': 27, 'bear_use_sma': False, 'bear_use_ema': True, 'bear_use_atr': True, 'bear_use_adx': True, 'bear_use_spike': True, 'bear_rsi_required': True, 'sideways_strategy': 'mean_reversion', 'sideways_bb_std_mult': 0.9052083152458046, 'sideways_rsi_os': 5, 'sideways_rsi_ob': 73, 'sideways_adx_thresh': 8.92480069763446, 'sideways_atr_min_pct': 0.017175554403937674, 'sideways_atr_max_pct': 0.11651175557192027, 'sideways_tp_mult': 1.4516553717053444, 'sideways_tsl_mult': 0.10499036133167294, 'sideways_time_stop': 280, 'sideways_use_sma': True, 'sideways_use_ema': False, 'sideways_use_atr': True, 'sideways_use_adx': False, 'sideways_use_spike': True, 'sideways_rsi_required': False}.
[I 2025-08-30 19:56:36,397] Trial 610 finished with values: [-1000000000.0, 1000000000.0] and parameters: {'p_sma': 43, 'p_std': 33, 'p_atr': 10, 'p_adx': 16, 'rsi_period': 71, 'ema1': 10, 'ema2': 51, 'slip_atr_k': 0.038770083293703156, 'slip_spread_k': 0.12845642839609728, 'spread_hl_frac': 0.0031931296930437837, 'bb_std_mult': 2.89923392824846, 'rsi_os': 18, 'rsi_ob': 76, 'vol_spike': 0.048940897958343596, 'adx_thresh': 14.065557692840063, 'atr_min_pct': 0.0028271178102957963, 'atr_max_pct': 0.1337426899065222, 'tp_mult': 2.2187051784901133, 'tsl_mult': 0.8472829925020164, 'strategy': 'breakout', 'time_stop': 100, 'use_sma': False, 'use_atr': True, 'use_adx': False, 'use_ema': False, 'use_spike': True, 'rsi_required': True, 'edge_k': 0.048787444565305815, 'edge_cap': 0.23662042150952228, 'bull_strategy': 'mean_reversion', 'bull_bb_std_mult': 3.2528076273858018, 'bull_rsi_os': 50, 'bull_rsi_ob': 67, 'bull_adx_thresh': 21.041449224067357, 'bull_atr_min_pct': 0.002508112914217921, 'bull_atr_max_pct': 0.0344811231788986, 'bull_tp_mult': 2.443773269433033, 'bull_tsl_mult': 0.6640639098247856, 'bull_time_stop': 177, 'bull_use_sma': True, 'bull_use_ema': True, 'bull_use_atr': False, 'bull_use_adx': True, 'bull_use_spike': True, 'bull_rsi_required': True, 'bear_strategy': 'breakout', 'bear_bb_std_mult': 1.9505576041624113, 'bear_rsi_os': 11, 'bear_rsi_ob': 68, 'bear_adx_thresh': 6.370138080826562, 'bear_atr_min_pct': 0.016136374314990272, 'bear_atr_max_pct': 0.12533073406026027, 'bear_tp_mult': 1.6802928534116424, 'bear_tsl_mult': 0.13257853291471086, 'bear_time_stop': 146, 'bear_use_sma': False, 'bear_use_ema': False, 'bear_use_atr': True, 'bear_use_adx': True, 'bear_use_spike': False, 'bear_rsi_required': False, 'sideways_strategy': 'breakout', 'sideways_bb_std_mult': 1.8983944869549005, 'sideways_rsi_os': 14, 'sideways_rsi_ob': 68, 'sideways_adx_thresh': 8.952922340966655, 'sideways_atr_min_pct': 0.026694170219876044, 'sideways_atr_max_pct': 0.11827907527322182, 'sideways_tp_mult': 1.908126485519145, 'sideways_tsl_mult': 0.031764023685484144, 'sideways_time_stop': 205, 'sideways_use_sma': True, 'sideways_use_ema': True, 'sideways_use_atr': False, 'sideways_use_adx': False, 'sideways_use_spike': True, 'sideways_rsi_required': False}.
[I 2025-08-30 19:57:11,365] Trial 616 finished with values: [-0.03461650011544337, 0.03451775986443958] and parameters: {'p_sma': 40, 'p_std': 28, 'p_atr': 9, 'p_adx': 11, 'rsi_period': 23, 'ema1': 7, 'ema2': 45, 'slip_atr_k': 0.1545578719571024, 'slip_spread_k': 0.4036510274475665, 'spread_hl_frac': 0.004133913142296996, 'bb_std_mult': 2.66910968840978, 'rsi_os': 36, 'rsi_ob': 56, 'vol_spike': 0.03372831187817101, 'adx_thresh': 18.001717589227532, 'atr_min_pct': 0.002449335788458398, 'atr_max_pct': 0.12117799060767726, 'tp_mult': 2.1024879382990114, 'tsl_mult': 0.4320667303794038, 'strategy': 'breakout', 'time_stop': 43, 'use_sma': False, 'use_atr': True, 'use_adx': False, 'use_ema': True, 'use_spike': False, 'rsi_required': True, 'edge_k': 1.1655508841176645, 'edge_cap': 0.2834748521133635, 'bull_strategy': 'mean_reversion', 'bull_bb_std_mult': 1.7008136898631563, 'bull_rsi_os': 35, 'bull_rsi_ob': 70, 'bull_adx_thresh': 18.64919519919375, 'bull_atr_min_pct': 0.01641308482507615, 'bull_atr_max_pct': 0.09892354986699727, 'bull_tp_mult': 2.0739011095637707, 'bull_tsl_mult': 0.9704838208011335, 'bull_time_stop': 161, 'bull_use_sma': False, 'bull_use_ema': False, 'bull_use_atr': False, 'bull_use_adx': True, 'bull_use_spike': True, 'bull_rsi_required': False, 'bear_strategy': 'mean_reversion', 'bear_bb_std_mult': 2.645275563712341, 'bear_rsi_os': 38, 'bear_rsi_ob': 83, 'bear_adx_thresh': 5.532854980900345, 'bear_atr_min_pct': 0.013217468717497623, 'bear_atr_max_pct': 0.06035751614124427, 'bear_tp_mult': 2.704999116694465, 'bear_tsl_mult': 0.09179714076099312, 'bear_time_stop': 36, 'bear_use_sma': True, 'bear_use_ema': False, 'bear_use_atr': True, 'bear_use_adx': True, 'bear_use_spike': False, 'bear_rsi_required': False, 'sideways_strategy': 'breakout', 'sideways_bb_std_mult': 1.902168921612799, 'sideways_rsi_os': 38, 'sideways_rsi_ob': 56, 'sideways_adx_thresh': 14.76987955305059, 'sideways_atr_min_pct': 0.0024185738411548214, 'sideways_atr_max_pct': 0.10983008931974683, 'sideways_tp_mult': 1.7976383294657399, 'sideways_tsl_mult': 0.6172034878745237, 'sideways_time_stop': 286, 'sideways_use_sma': True, 'sideways_use_ema': True, 'sideways_use_atr': False, 'sideways_use_adx': True, 'sideways_use_spike': False, 'sideways_rsi_required': False}.
[I 2025-08-30 19:57:11,622] Trial 615 finished with values: [-1000000000.0, 1000000000.0] and parameters: {'p_sma': 18, 'p_std': 28, 'p_atr': 9, 'p_adx': 14, 'rsi_period': 55, 'ema1': 25, 'ema2': 18, 'slip_atr_k': 0.030735204687165674, 'slip_spread_k': 0.7372002136041187, 'spread_hl_frac': 0.004768636100749148, 'bb_std_mult': 0.9836208787413695, 'rsi_os': 36, 'rsi_ob': 56, 'vol_spike': 0.033230544166035776, 'adx_thresh': 27.487426964408016, 'atr_min_pct': 0.005214020207723689, 'atr_max_pct': 0.06321595621060233, 'tp_mult': 1.253092097602349, 'tsl_mult': 0.7652694112573022, 'strategy': 'breakout', 'time_stop': 14, 'use_sma': False, 'use_atr': True, 'use_adx': False, 'use_ema': True, 'use_spike': False, 'rsi_required': True, 'edge_k': 1.5267996449901906, 'edge_cap': 0.2884982706738189, 'bull_strategy': 'mean_reversion', 'bull_bb_std_mult': 1.6891208896804641, 'bull_rsi_os': 50, 'bull_rsi_ob': 78, 'bull_adx_thresh': 25.35048746078307, 'bull_atr_min_pct': 0.029672657669941496, 'bull_atr_max_pct': 0.033722934756958464, 'bull_tp_mult': 1.7309523025705218, 'bull_tsl_mult': 0.9644140174765942, 'bull_time_stop': 161, 'bull_use_sma': False, 'bull_use_ema': False, 'bull_use_atr': False, 'bull_use_adx': True, 'bull_use_spike': True, 'bull_rsi_required': False, 'bear_strategy': 'mean_reversion', 'bear_bb_std_mult': 1.9516374485931278, 'bear_rsi_os': 44, 'bear_rsi_ob': 83, 'bear_adx_thresh': 34.94376106344988, 'bear_atr_min_pct': 0.02996142575089495, 'bear_atr_max_pct': 0.05996823558428752, 'bear_tp_mult': 2.1630938666174666, 'bear_tsl_mult': 0.6987106257854471, 'bear_time_stop': 79, 'bear_use_sma': True, 'bear_use_ema': False, 'bear_use_atr': True, 'bear_use_adx': True, 'bear_use_spike': False, 'bear_rsi_required': False, 'sideways_strategy': 'breakout', 'sideways_bb_std_mult': 2.0800550107673015, 'sideways_rsi_os': 15, 'sideways_rsi_ob': 56, 'sideways_adx_thresh': 14.842226525490112, 'sideways_atr_min_pct': 0.005801546602737871, 'sideways_atr_max_pct': 0.05162822880116775, 'sideways_tp_mult': 1.7883226666461722, 'sideways_tsl_mult': 0.6808651235936561, 'sideways_time_stop': 283, 'sideways_use_sma': True, 'sideways_use_ema': True, 'sideways_use_atr': False, 'sideways_use_adx': True, 'sideways_use_spike': False, 'sideways_rsi_required': False}.
[I 2025-08-30 19:57:11,623] Trial 617 finished with values: [-1000000000.0, 1000000000.0] and parameters: {'p_sma': 40, 'p_std': 28, 'p_atr': 26, 'p_adx': 7, 'rsi_period': 59, 'ema1': 20, 'ema2': 49, 'slip_atr_k': 0.22354606674486643, 'slip_spread_k': 0.7645695360628904, 'spread_hl_frac': 0.004441776633075757, 'bb_std_mult': 0.9817631719295657, 'rsi_os': 36, 'rsi_ob': 56, 'vol_spike': 0.2832609201927153, 'adx_thresh': 17.49785335245155, 'atr_min_pct': 0.02372053027546011, 'atr_max_pct': 0.10882138449484591, 'tp_mult': 1.2617765205811662, 'tsl_mult': 0.7636400547360117, 'strategy': 'breakout', 'time_stop': 35, 'use_sma': True, 'use_atr': True, 'use_adx': False, 'use_ema': True, 'use_spike': False, 'rsi_required': True, 'edge_k': 0.13038534874831437, 'edge_cap': 0.282168530107921, 'bull_strategy': 'mean_reversion', 'bull_bb_std_mult': 1.6759352474790896, 'bull_rsi_os': 20, 'bull_rsi_ob': 91, 'bull_adx_thresh': 25.018834556505663, 'bull_atr_min_pct': 0.0026200319564441735, 'bull_atr_max_pct': 0.029620188426912747, 'bull_tp_mult': 1.3081682176281202, 'bull_tsl_mult': 0.9645968840229606, 'bull_time_stop': 283, 'bull_use_sma': False, 'bull_use_ema': False, 'bull_use_atr': False, 'bull_use_adx': True, 'bull_use_spike': True, 'bull_rsi_required': False, 'bear_strategy': 'mean_reversion', 'bear_bb_std_mult': 1.333196975902716, 'bear_rsi_os': 44, 'bear_rsi_ob': 71, 'bear_adx_thresh': 13.089703491277614, 'bear_atr_min_pct': 0.013159705867761884, 'bear_atr_max_pct': 0.06056187411158318, 'bear_tp_mult': 1.919723098414163, 'bear_tsl_mult': 0.19074156237391532, 'bear_time_stop': 36, 'bear_use_sma': True, 'bear_use_ema': False, 'bear_use_atr': True, 'bear_use_adx': True, 'bear_use_spike': False, 'bear_rsi_required': False, 'sideways_strategy': 'breakout', 'sideways_bb_std_mult': 2.080654117679127, 'sideways_rsi_os': 15, 'sideways_rsi_ob': 56, 'sideways_adx_thresh': 11.304415084625829, 'sideways_atr_min_pct': 0.017974588327177847, 'sideways_atr_max_pct': 0.10971854429213951, 'sideways_tp_mult': 1.7870886210488732, 'sideways_tsl_mult': 0.6124998991615518, 'sideways_time_stop': 286, 'sideways_use_sma': True, 'sideways_use_ema': True, 'sideways_use_atr': False, 'sideways_use_adx': True, 'sideways_use_spike': False, 'sideways_rsi_required': False}.
[I 2025-08-30 19:57:11,717] Trial 614 finished with values: [-1000000000.0, 1000000000.0] and parameters: {'p_sma': 40, 'p_std': 38, 'p_atr': 11, 'p_adx': 17, 'rsi_period': 9, 'ema1': 20, 'ema2': 18, 'slip_atr_k': 0.022263232371065797, 'slip_spread_k': 0.4058808812215493, 'spread_hl_frac': 0.004845718049137353, 'bb_std_mult': 2.135617914228512, 'rsi_os': 35, 'rsi_ob': 83, 'vol_spike': 0.03443378150549469, 'adx_thresh': 5.0944948995700745, 'atr_min_pct': 0.021298050116105076, 'atr_max_pct': 0.10114925432745402, 'tp_mult': 2.22180615234497, 'tsl_mult': 0.7451857634489599, 'strategy': 'breakout', 'time_stop': 25, 'use_sma': False, 'use_atr': True, 'use_adx': False, 'use_ema': False, 'use_spike': True, 'rsi_required': True, 'edge_k': 0.07870478614078184, 'edge_cap': 0.21141410389136153, 'bull_strategy': 'mean_reversion', 'bull_bb_std_mult': 1.9436794495727467, 'bull_rsi_os': 12, 'bull_rsi_ob': 53, 'bull_adx_thresh': 25.405374550269233, 'bull_atr_min_pct': 0.016527600948101396, 'bull_atr_max_pct': 0.034582280143261035, 'bull_tp_mult': 2.2127710160349747, 'bull_tsl_mult': 0.9449059279456171, 'bull_time_stop': 26, 'bull_use_sma': True, 'bull_use_ema': True, 'bull_use_atr': False, 'bull_use_adx': True, 'bull_use_spike': True, 'bull_rsi_required': True, 'bear_strategy': 'mean_reversion', 'bear_bb_std_mult': 2.581705989918074, 'bear_rsi_os': 31, 'bear_rsi_ob': 79, 'bear_adx_thresh': 34.96627732376403, 'bear_atr_min_pct': 0.016019683665089213, 'bear_atr_max_pct': 0.05172731905346902, 'bear_tp_mult': 1.9034453474689406, 'bear_tsl_mult': 0.10138387020726025, 'bear_time_stop': 25, 'bear_use_sma': False, 'bear_use_ema': False, 'bear_use_atr': True, 'bear_use_adx': True, 'bear_use_spike': False, 'bear_rsi_required': True, 'sideways_strategy': 'breakout', 'sideways_bb_std_mult': 1.063128829511161, 'sideways_rsi_os': 15, 'sideways_rsi_ob': 71, 'sideways_adx_thresh': 9.162422722157974, 'sideways_atr_min_pct': 0.017680174580030943, 'sideways_atr_max_pct': 0.13183930186724938, 'sideways_tp_mult': 1.9130538462794273, 'sideways_tsl_mult': 0.6139522200503179, 'sideways_time_stop': 202, 'sideways_use_sma': True, 'sideways_use_ema': False, 'sideways_use_atr': False, 'sideways_use_adx': False, 'sideways_use_spike': True, 'sideways_rsi_required': False}.
[I 2025-08-30 19:57:45,069] Trial 621 finished with values: [-0.019737329118975522, 0.01970973506840199] and parameters: {'p_sma': 41, 'p_std': 22, 'p_atr': 10, 'p_adx': 26, 'rsi_period': 32, 'ema1': 21, 'ema2': 10, 'slip_atr_k': 0.16237953165569713, 'slip_spread_k': 0.4283391431157301, 'spread_hl_frac': 0.007220563437276088, 'bb_std_mult': 1.1543161897083538, 'rsi_os': 46, 'rsi_ob': 90, 'vol_spike': 0.08127833481191513, 'adx_thresh': 19.18132355386876, 'atr_min_pct': 0.024674947002588845, 'atr_max_pct': 0.14100365562487385, 'tp_mult': 2.7943029168153464, 'tsl_mult': 0.676007510039559, 'strategy': 'mean_reversion', 'time_stop': 234, 'use_sma': True, 'use_atr': True, 'use_adx': False, 'use_ema': False, 'use_spike': True, 'rsi_required': True, 'edge_k': 0.4803499572508134, 'edge_cap': 0.6264431287273079, 'bull_strategy': 'mean_reversion', 'bull_bb_std_mult': 1.7637229960507648, 'bull_rsi_os': 52, 'bull_rsi_ob': 58, 'bull_adx_thresh': 31.24033128071447, 'bull_atr_min_pct': 0.0017622101440290289, 'bull_atr_max_pct': 0.05534557991337055, 'bull_tp_mult': 2.180874725958946, 'bull_tsl_mult': 0.4492023743147154, 'bull_time_stop': 182, 'bull_use_sma': True, 'bull_use_ema': False, 'bull_use_atr': False, 'bull_use_adx': True, 'bull_use_spike': False, 'bull_rsi_required': True, 'bear_strategy': 'breakout', 'bear_bb_std_mult': 3.2454001234290595, 'bear_rsi_os': 35, 'bear_rsi_ob': 50, 'bear_adx_thresh': 5.012066179752617, 'bear_atr_min_pct': 0.014927205914843714, 'bear_atr_max_pct': 0.05370220597476092, 'bear_tp_mult': 1.8055311035793609, 'bear_tsl_mult': 0.34024480867932916, 'bear_time_stop': 238, 'bear_use_sma': True, 'bear_use_ema': False, 'bear_use_atr': True, 'bear_use_adx': True, 'bear_use_spike': False, 'bear_rsi_required': False, 'sideways_strategy': 'breakout', 'sideways_bb_std_mult': 0.5644913506292768, 'sideways_rsi_os': 40, 'sideways_rsi_ob': 91, 'sideways_adx_thresh': 9.882485046758388, 'sideways_atr_min_pct': 0.01905000227251844, 'sideways_atr_max_pct': 0.1212229752092879, 'sideways_tp_mult': 1.276627948948735, 'sideways_tsl_mult': 0.7785417959555403, 'sideways_time_stop': 245, 'sideways_use_sma': True, 'sideways_use_ema': True, 'sideways_use_atr': False, 'sideways_use_adx': False, 'sideways_use_spike': False, 'sideways_rsi_required': False}.
[I 2025-08-30 19:57:45,321] Trial 618 finished with values: [-1000000000.0, 1000000000.0] and parameters: {'p_sma': 52, 'p_std': 25, 'p_atr': 10, 'p_adx': 30, 'rsi_period': 66, 'ema1': 25, 'ema2': 18, 'slip_atr_k': 0.045725805335235126, 'slip_spread_k': 0.7429849076180528, 'spread_hl_frac': 0.005039184838069494, 'bb_std_mult': 0.9849309417088142, 'rsi_os': 35, 'rsi_ob': 81, 'vol_spike': 0.08171662570678719, 'adx_thresh': 19.556479870691696, 'atr_min_pct': 0.023797177309210094, 'atr_max_pct': 0.12465935463029118, 'tp_mult': 1.4106474348199591, 'tsl_mult': 0.7482457087644329, 'strategy': 'breakout', 'time_stop': 282, 'use_sma': True, 'use_atr': True, 'use_adx': False, 'use_ema': False, 'use_spike': True, 'rsi_required': True, 'edge_k': 1.531430436928623, 'edge_cap': 0.20662290834271468, 'bull_strategy': 'mean_reversion', 'bull_bb_std_mult': 1.9544615788827078, 'bull_rsi_os': 23, 'bull_rsi_ob': 72, 'bull_adx_thresh': 25.414321982256027, 'bull_atr_min_pct': 0.0027190927231846764, 'bull_atr_max_pct': 0.055671460841731746, 'bull_tp_mult': 2.1700104808019898, 'bull_tsl_mult': 0.12462547556619163, 'bull_time_stop': 20, 'bull_use_sma': True, 'bull_use_ema': False, 'bull_use_atr': False, 'bull_use_adx': True, 'bull_use_spike': False, 'bull_rsi_required': True, 'bear_strategy': 'mean_reversion', 'bear_bb_std_mult': 3.3340150648435354, 'bear_rsi_os': 34, 'bear_rsi_ob': 82, 'bear_adx_thresh': 18.468986725405642, 'bear_atr_min_pct': 0.015169809249045015, 'bear_atr_max_pct': 0.052106474525962704, 'bear_tp_mult': 1.9626040991530789, 'bear_tsl_mult': 0.18299143161892842, 'bear_time_stop': 43, 'bear_use_sma': True, 'bear_use_ema': False, 'bear_use_atr': True, 'bear_use_adx': True, 'bear_use_spike': False, 'bear_rsi_required': False, 'sideways_strategy': 'breakout', 'sideways_bb_std_mult': 2.0976503115712246, 'sideways_rsi_os': 15, 'sideways_rsi_ob': 59, 'sideways_adx_thresh': 9.849622029865401, 'sideways_atr_min_pct': 0.018993788833969096, 'sideways_atr_max_pct': 0.06686608468068696, 'sideways_tp_mult': 1.7810179968838402, 'sideways_tsl_mult': 0.6818610889448934, 'sideways_time_stop': 277, 'sideways_use_sma': True, 'sideways_use_ema': True, 'sideways_use_atr': False, 'sideways_use_adx': False, 'sideways_use_spike': False, 'sideways_rsi_required': False}.
[I 2025-08-30 19:57:45,466] Trial 619 finished with values: [-1000000000.0, 1000000000.0] and parameters: {'p_sma': 41, 'p_std': 22, 'p_atr': 7, 'p_adx': 17, 'rsi_period': 67, 'ema1': 19, 'ema2': 17, 'slip_atr_k': 0.021399419499908964, 'slip_spread_k': 0.4237366404586704, 'spread_hl_frac': 0.0009420061570921574, 'bb_std_mult': 1.2697202047381264, 'rsi_os': 35, 'rsi_ob': 58, 'vol_spike': 0.039337309048526746, 'adx_thresh': 15.351354843693061, 'atr_min_pct': 0.01599878921498575, 'atr_max_pct': 0.09025779670702509, 'tp_mult': 1.3994030759185956, 'tsl_mult': 0.7420572678762924, 'strategy': 'mean_reversion', 'time_stop': 26, 'use_sma': False, 'use_atr': True, 'use_adx': False, 'use_ema': False, 'use_spike': True, 'rsi_required': True, 'edge_k': 1.2440453341576223, 'edge_cap': 0.63333114412241, 'bull_strategy': 'mean_reversion', 'bull_bb_std_mult': 2.465460288037826, 'bull_rsi_os': 46, 'bull_rsi_ob': 72, 'bull_adx_thresh': 22.339408423045693, 'bull_atr_min_pct': 0.012095926498778246, 'bull_atr_max_pct': 0.05830270995324666, 'bull_tp_mult': 2.163572244738543, 'bull_tsl_mult': 0.5125955170141231, 'bull_time_stop': 27, 'bull_use_sma': True, 'bull_use_ema': False, 'bull_use_atr': False, 'bull_use_adx': True, 'bull_use_spike': False, 'bull_rsi_required': True, 'bear_strategy': 'breakout', 'bear_bb_std_mult': 3.364840761000753, 'bear_rsi_os': 35, 'bear_rsi_ob': 82, 'bear_adx_thresh': 5.447588730253758, 'bear_atr_min_pct': 0.016978011325689036, 'bear_atr_max_pct': 0.03917862202196534, 'bear_tp_mult': 2.6055278496915424, 'bear_tsl_mult': 0.061226967067235, 'bear_time_stop': 122, 'bear_use_sma': True, 'bear_use_ema': False, 'bear_use_atr': True, 'bear_use_adx': True, 'bear_use_spike': False, 'bear_rsi_required': False, 'sideways_strategy': 'breakout', 'sideways_bb_std_mult': 3.4416533011346484, 'sideways_rsi_os': 16, 'sideways_rsi_ob': 78, 'sideways_adx_thresh': 9.679885099666166, 'sideways_atr_min_pct': 0.011349243050660159, 'sideways_atr_max_pct': 0.1242944097258999, 'sideways_tp_mult': 1.8292873286313835, 'sideways_tsl_mult': 0.6839188212041899, 'sideways_time_stop': 275, 'sideways_use_sma': True, 'sideways_use_ema': True, 'sideways_use_atr': False, 'sideways_use_adx': False, 'sideways_use_spike': False, 'sideways_rsi_required': False}.
