[I 2025-08-30 19:09:24,526] Trial 261 finished with values: [-1000000000.0, 1000000000.0] and parameters: {'p_sma': 44, 'p_std': 29, 'p_atr': 28, 'p_adx': 8, 'rsi_period': 53, 'ema1': 24, 'ema2': 19, 'slip_atr_k': 0.003614354936173932, 'slip_spread_k': 0.842699142545331, 'spread_hl_frac': 0.04643196061776558, 'bb_std_mult': 1.5675419888091153, 'rsi_os': 49, 'rsi_ob': 72, 'vol_spike': 0.14428200811761377, 'adx_thresh': 15.48069763869434, 'atr_min_pct': 0.023517857415389688, 'atr_max_pct': 0.13481370009708318, 'tp_mult': 2.244083978670449, 'tsl_mult': 0.08673227432728281, 'strategy': 'mean_reversion', 'time_stop': 134, 'use_sma': False, 'use_atr': False, 'use_adx': True, 'use_ema': False, 'use_spike': False, 'rsi_required': True, 'edge_k': 0.0953919975673476, 'edge_cap': 0.2342417971956661, 'bull_strategy': 'mean_reversion', 'bull_bb_std_mult': 2.6934922604694185, 'bull_rsi_os': 54, 'bull_rsi_ob': 72, 'bull_adx_thresh': 8.2716669872079, 'bull_atr_min_pct': 0.003933761090892548, 'bull_atr_max_pct': 0.10274259419482139, 'bull_tp_mult': 2.1674880214626926, 'bull_tsl_mult': 0.5959912327958792, 'bull_time_stop': 102, 'bull_use_sma': True, 'bull_use_ema': True, 'bull_use_atr': False, 'bull_use_adx': True, 'bull_use_spike': True, 'bull_rsi_required': True, 'bear_strategy': 'mean_reversion', 'bear_bb_std_mult': 1.4071337394466816, 'bear_rsi_os': 42, 'bear_rsi_ob': 59, 'bear_adx_thresh': 8.09352545347071, 'bear_atr_min_pct': 0.028113965288294282, 'bear_atr_max_pct': 0.05066465875727479, 'bear_tp_mult': 1.885504708983341, 'bear_tsl_mult': 0.5401096684956375, 'bear_time_stop': 53, 'bear_use_sma': True, 'bear_use_ema': False, 'bear_use_atr': False, 'bear_use_adx': False, 'bear_use_spike': False, 'bear_rsi_required': False, 'sideways_strategy': 'mean_reversion', 'sideways_bb_std_mult': 1.2713313857815542, 'sideways_rsi_os': 36, 'sideways_rsi_ob': 57, 'sideways_adx_thresh': 15.943824185776222, 'sideways_atr_min_pct': 0.01358653008271759, 'sideways_atr_max_pct': 0.12510800918154785, 'sideways_tp_mult': 1.7303409300181825, 'sideways_tsl_mult': 0.6003392064484548, 'sideways_time_stop': 285, 'sideways_use_sma': True, 'sideways_use_ema': True, 'sideways_use_atr': False, 'sideways_use_adx': False, 'sideways_use_spike': False, 'sideways_rsi_required': True}.
[I 2025-08-30 19:09:24,526] Trial 264 finished with values: [-1000000000.0, 1000000000.0] and parameters: {'p_sma': 38, 'p_std': 29, 'p_atr': 28, 'p_adx': 7, 'rsi_period': 55, 'ema1': 22, 'ema2': 26, 'slip_atr_k': 0.17242865322410625, 'slip_spread_k': 0.8396503534366766, 'spread_hl_frac': 0.0065389236830979275, 'bb_std_mult': 0.9219628542447105, 'rsi_os': 18, 'rsi_ob': 51, 'vol_spike': 0.05252020316617268, 'adx_thresh': 15.243913441669704, 'atr_min_pct': 0.024924729970030965, 'atr_max_pct': 0.13481985984407832, 'tp_mult': 2.238449534223227, 'tsl_mult': 0.36936597820192146, 'strategy': 'breakout', 'time_stop': 10, 'use_sma': False, 'use_atr': True, 'use_adx': False, 'use_ema': True, 'use_spike': False, 'rsi_required': True, 'edge_k': 0.17882414990334133, 'edge_cap': 0.2319935657712432, 'bull_strategy': 'mean_reversion', 'bull_bb_std_mult': 2.8564846612717356, 'bull_rsi_os': 47, 'bull_rsi_ob': 47, 'bull_adx_thresh': 25.92391944656344, 'bull_atr_min_pct': 0.0259457527871976, 'bull_atr_max_pct': 0.11599267669159141, 'bull_tp_mult': 2.173586510526894, 'bull_tsl_mult': 0.2974943800915326, 'bull_time_stop': 11, 'bull_use_sma': True, 'bull_use_ema': False, 'bull_use_atr': False, 'bull_use_adx': True, 'bull_use_spike': True, 'bull_rsi_required': False, 'bear_strategy': 'mean_reversion', 'bear_bb_std_mult': 3.361810084716591, 'bear_rsi_os': 45, 'bear_rsi_ob': 73, 'bear_adx_thresh': 7.2835898622695945, 'bear_atr_min_pct': 0.023475324166434813, 'bear_atr_max_pct': 0.04913953060361386, 'bear_tp_mult': 1.773314051263447, 'bear_tsl_mult': 0.0002168132696206415, 'bear_time_stop': 60, 'bear_use_sma': True, 'bear_use_ema': False, 'bear_use_atr': False, 'bear_use_adx': False, 'bear_use_spike': False, 'bear_rsi_required': True, 'sideways_strategy': 'breakout', 'sideways_bb_std_mult': 1.8718951069708691, 'sideways_rsi_os': 12, 'sideways_rsi_ob': 57, 'sideways_adx_thresh': 7.78642702677936, 'sideways_atr_min_pct': 0.019814876188600727, 'sideways_atr_max_pct': 0.07770964925579847, 'sideways_tp_mult': 1.6606125277249288, 'sideways_tsl_mult': 0.6243113426113824, 'sideways_time_stop': 125, 'sideways_use_sma': True, 'sideways_use_ema': False, 'sideways_use_atr': False, 'sideways_use_adx': False, 'sideways_use_spike': False, 'sideways_rsi_required': False}.
[I 2025-08-30 19:09:25,139] Trial 262 finished with values: [-1000000000.0, 1000000000.0] and parameters: {'p_sma': 32, 'p_std': 28, 'p_atr': 21, 'p_adx': 22, 'rsi_period': 80, 'ema1': 25, 'ema2': 26, 'slip_atr_k': 0.0008340454245368972, 'slip_spread_k': 0.6824686656383931, 'spread_hl_frac': 0.045984083278235596, 'bb_std_mult': 0.9215591412961803, 'rsi_os': 35, 'rsi_ob': 59, 'vol_spike': 0.14040105882851617, 'adx_thresh': 18.08338428351556, 'atr_min_pct': 0.0039052611776117744, 'atr_max_pct': 0.07474825746180133, 'tp_mult': 2.5710699414499385, 'tsl_mult': 0.07491000521301389, 'strategy': 'breakout', 'time_stop': 24, 'use_sma': False, 'use_atr': True, 'use_adx': False, 'use_ema': True, 'use_spike': False, 'rsi_required': True, 'edge_k': 0.0943849767448442, 'edge_cap': 0.22905821352381445, 'bull_strategy': 'mean_reversion', 'bull_bb_std_mult': 1.7481950101302037, 'bull_rsi_os': 54, 'bull_rsi_ob': 70, 'bull_adx_thresh': 26.16109910777901, 'bull_atr_min_pct': 0.01590914067283663, 'bull_atr_max_pct': 0.028835629745592513, 'bull_tp_mult': 2.9339639542789335, 'bull_tsl_mult': 0.9576038285530349, 'bull_time_stop': 180, 'bull_use_sma': True, 'bull_use_ema': False, 'bull_use_atr': False, 'bull_use_adx': True, 'bull_use_spike': True, 'bull_rsi_required': True, 'bear_strategy': 'mean_reversion', 'bear_bb_std_mult': 0.7930354076007522, 'bear_rsi_os': 41, 'bear_rsi_ob': 59, 'bear_adx_thresh': 12.151690490730243, 'bear_atr_min_pct': 0.023457821238291463, 'bear_atr_max_pct': 0.022551789324242448, 'bear_tp_mult': 1.8999450771778423, 'bear_tsl_mult': 0.059125749790486064, 'bear_time_stop': 114, 'bear_use_sma': True, 'bear_use_ema': False, 'bear_use_atr': False, 'bear_use_adx': False, 'bear_use_spike': False, 'bear_rsi_required': True, 'sideways_strategy': 'breakout', 'sideways_bb_std_mult': 2.2243646689641423, 'sideways_rsi_os': 29, 'sideways_rsi_ob': 56, 'sideways_adx_thresh': 32.17561402148103, 'sideways_atr_min_pct': 0.0199537817125117, 'sideways_atr_max_pct': 0.1248879151392654, 'sideways_tp_mult': 2.622787982339558, 'sideways_tsl_mult': 0.20136075286260513, 'sideways_time_stop': 285, 'sideways_use_sma': True, 'sideways_use_ema': True, 'sideways_use_atr': True, 'sideways_use_adx': False, 'sideways_use_spike': False, 'sideways_rsi_required': False}.
[I 2025-08-30 19:09:25,232] Trial 263 finished with values: [-1000000000.0, 1000000000.0] and parameters: {'p_sma': 38, 'p_std': 29, 'p_atr': 16, 'p_adx': 8, 'rsi_period': 80, 'ema1': 5, 'ema2': 26, 'slip_atr_k': 0.004603009606388375, 'slip_spread_k': 0.49687490571852794, 'spread_hl_frac': 0.003910450045857498, 'bb_std_mult': 0.9196527251221109, 'rsi_os': 35, 'rsi_ob': 63, 'vol_spike': 0.09673283228204516, 'adx_thresh': 18.111393688049567, 'atr_min_pct': 0.024813063403613545, 'atr_max_pct': 0.0739550444754208, 'tp_mult': 1.4845918399838531, 'tsl_mult': 0.7123804806549235, 'strategy': 'breakout', 'time_stop': 95, 'use_sma': False, 'use_atr': True, 'use_adx': False, 'use_ema': True, 'use_spike': False, 'rsi_required': True, 'edge_k': 0.16014458931590211, 'edge_cap': 0.23056586144062913, 'bull_strategy': 'mean_reversion', 'bull_bb_std_mult': 3.2446433660183494, 'bull_rsi_os': 54, 'bull_rsi_ob': 70, 'bull_adx_thresh': 8.152771479805143, 'bull_atr_min_pct': 0.019108309392571198, 'bull_atr_max_pct': 0.02409287290407317, 'bull_tp_mult': 2.159232185362132, 'bull_tsl_mult': 0.10751270816189501, 'bull_time_stop': 42, 'bull_use_sma': True, 'bull_use_ema': False, 'bull_use_atr': True, 'bull_use_adx': True, 'bull_use_spike': True, 'bull_rsi_required': False, 'bear_strategy': 'mean_reversion', 'bear_bb_std_mult': 3.465068395504245, 'bear_rsi_os': 41, 'bear_rsi_ob': 82, 'bear_adx_thresh': 8.89960091910165, 'bear_atr_min_pct': 0.01661386741504042, 'bear_atr_max_pct': 0.04880754288449071, 'bear_tp_mult': 1.63814640969624, 'bear_tsl_mult': 0.6199122530754396, 'bear_time_stop': 244, 'bear_use_sma': True, 'bear_use_ema': False, 'bear_use_atr': False, 'bear_use_adx': False, 'bear_use_spike': True, 'bear_rsi_required': True, 'sideways_strategy': 'breakout', 'sideways_bb_std_mult': 2.756892756364195, 'sideways_rsi_os': 12, 'sideways_rsi_ob': 77, 'sideways_adx_thresh': 22.764800858387645, 'sideways_atr_min_pct': 0.019799040774977652, 'sideways_atr_max_pct': 0.14172316860551976, 'sideways_tp_mult': 1.7303822947276362, 'sideways_tsl_mult': 0.9517269098168464, 'sideways_time_stop': 286, 'sideways_use_sma': True, 'sideways_use_ema': True, 'sideways_use_atr': True, 'sideways_use_adx': False, 'sideways_use_spike': False, 'sideways_rsi_required': False}.
[I 2025-08-30 19:09:57,510] Trial 268 finished with values: [-1000000000.0, 1000000000.0] and parameters: {'p_sma': 35, 'p_std': 12, 'p_atr': 11, 'p_adx': 17, 'rsi_period': 55, 'ema1': 9, 'ema2': 16, 'slip_atr_k': 0.11179620243071998, 'slip_spread_k': 0.41725338613831836, 'spread_hl_frac': 0.03624765101157615, 'bb_std_mult': 2.534940776463233, 'rsi_os': 39, 'rsi_ob': 88, 'vol_spike': 0.007733010472866619, 'adx_thresh': 19.40808109354624, 'atr_min_pct': 0.024208923050323062, 'atr_max_pct': 0.13960797186698304, 'tp_mult': 2.159644659774353, 'tsl_mult': 0.7339522501036537, 'strategy': 'breakout', 'time_stop': 222, 'use_sma': False, 'use_atr': True, 'use_adx': False, 'use_ema': False, 'use_spike': True, 'rsi_required': True, 'edge_k': 0.045589719816998844, 'edge_cap': 0.7026744597606601, 'bull_strategy': 'breakout', 'bull_bb_std_mult': 1.3045955549595716, 'bull_rsi_os': 30, 'bull_rsi_ob': 72, 'bull_adx_thresh': 23.579219742220484, 'bull_atr_min_pct': 0.004558531560230169, 'bull_atr_max_pct': 0.017717984536298935, 'bull_tp_mult': 2.4572951606019324, 'bull_tsl_mult': 0.9950963336744483, 'bull_time_stop': 79, 'bull_use_sma': False, 'bull_use_ema': False, 'bull_use_atr': False, 'bull_use_adx': True, 'bull_use_spike': True, 'bull_rsi_required': True, 'bear_strategy': 'breakout', 'bear_bb_std_mult': 2.0612072084155564, 'bear_rsi_os': 37, 'bear_rsi_ob': 77, 'bear_adx_thresh': 24.142572459679144, 'bear_atr_min_pct': 0.024713625995724596, 'bear_atr_max_pct': 0.06292630435127813, 'bear_tp_mult': 2.4208287048930903, 'bear_tsl_mult': 0.1973206922048546, 'bear_time_stop': 86, 'bear_use_sma': True, 'bear_use_ema': False, 'bear_use_atr': True, 'bear_use_adx': True, 'bear_use_spike': False, 'bear_rsi_required': False, 'sideways_strategy': 'breakout', 'sideways_bb_std_mult': 2.1096748371949205, 'sideways_rsi_os': 19, 'sideways_rsi_ob': 66, 'sideways_adx_thresh': 20.710172190159177, 'sideways_atr_min_pct': 0.0009063536979043458, 'sideways_atr_max_pct': 0.06921857241782013, 'sideways_tp_mult': 1.808448428616277, 'sideways_tsl_mult': 0.6895584652257689, 'sideways_time_stop': 277, 'sideways_use_sma': False, 'sideways_use_ema': False, 'sideways_use_atr': False, 'sideways_use_adx': True, 'sideways_use_spike': False, 'sideways_rsi_required': False}.
[I 2025-08-30 19:09:58,190] Trial 266 finished with values: [-1000000000.0, 1000000000.0] and parameters: {'p_sma': 9, 'p_std': 24, 'p_atr': 10, 'p_adx': 27, 'rsi_period': 31, 'ema1': 24, 'ema2': 13, 'slip_atr_k': 0.028972045138830144, 'slip_spread_k': 0.0005749659672145135, 'spread_hl_frac': 0.02805637769203051, 'bb_std_mult': 3.5441293318154314, 'rsi_os': 35, 'rsi_ob': 89, 'vol_spike': 0.17494240675324157, 'adx_thresh': 18.267328828363247, 'atr_min_pct': 0.0026852401270984066, 'atr_max_pct': 0.13859508773311552, 'tp_mult': 2.1478825501978216, 'tsl_mult': 0.7293411333445852, 'strategy': 'breakout', 'time_stop': 221, 'use_sma': False, 'use_atr': True, 'use_adx': False, 'use_ema': True, 'use_spike': True, 'rsi_required': True, 'edge_k': 0.05244527064397772, 'edge_cap': 0.2681144973305348, 'bull_strategy': 'breakout', 'bull_bb_std_mult': 1.8534828011374755, 'bull_rsi_os': 21, 'bull_rsi_ob': 70, 'bull_adx_thresh': 20.718371278973798, 'bull_atr_min_pct': 0.004506721155550052, 'bull_atr_max_pct': 0.02472790020946028, 'bull_tp_mult': 1.3905831991900746, 'bull_tsl_mult': 0.10976906418776716, 'bull_time_stop': 42, 'bull_use_sma': False, 'bull_use_ema': False, 'bull_use_atr': True, 'bull_use_adx': True, 'bull_use_spike': True, 'bull_rsi_required': False, 'bear_strategy': 'breakout', 'bear_bb_std_mult': 0.7724747222140493, 'bear_rsi_os': 35, 'bear_rsi_ob': 82, 'bear_adx_thresh': 6.285775170208653, 'bear_atr_min_pct': 0.02913737211326676, 'bear_atr_max_pct': 0.062013395448926804, 'bear_tp_mult': 2.412345541403895, 'bear_tsl_mult': 0.2835389252624301, 'bear_time_stop': 128, 'bear_use_sma': True, 'bear_use_ema': False, 'bear_use_atr': True, 'bear_use_adx': True, 'bear_use_spike': True, 'bear_rsi_required': True, 'sideways_strategy': 'breakout', 'sideways_bb_std_mult': 3.5501010567577467, 'sideways_rsi_os': 51, 'sideways_rsi_ob': 61, 'sideways_adx_thresh': 20.98635466176883, 'sideways_atr_min_pct': 0.01028901831216183, 'sideways_atr_max_pct': 0.10338906868813927, 'sideways_tp_mult': 1.8044038887016671, 'sideways_tsl_mult': 0.03266713414311401, 'sideways_time_stop': 277, 'sideways_use_sma': True, 'sideways_use_ema': True, 'sideways_use_atr': True, 'sideways_use_adx': True, 'sideways_use_spike': False, 'sideways_rsi_required': False}.
[I 2025-08-30 19:09:58,456] Trial 267 finished with values: [-0.01719159127748715, 0.017484331006489575] and parameters: {'p_sma': 12, 'p_std': 26, 'p_atr': 24, 'p_adx': 8, 'rsi_period': 30, 'ema1': 20, 'ema2': 13, 'slip_atr_k': 0.0302803107563871, 'slip_spread_k': 0.27063833635929146, 'spread_hl_frac': 0.004147393754276999, 'bb_std_mult': 0.986299154089418, 'rsi_os': 6, 'rsi_ob': 77, 'vol_spike': 0.009361835182210954, 'adx_thresh': 18.298193558375615, 'atr_min_pct': 0.024531123152242672, 'atr_max_pct': 0.13957365567887223, 'tp_mult': 2.1120061402710473, 'tsl_mult': 0.7143102533752251, 'strategy': 'breakout', 'time_stop': 39, 'use_sma': False, 'use_atr': True, 'use_adx': False, 'use_ema': False, 'use_spike': True, 'rsi_required': True, 'edge_k': 0.4589791163568394, 'edge_cap': 0.2607691632223346, 'bull_strategy': 'breakout', 'bull_bb_std_mult': 1.8602275496839338, 'bull_rsi_os': 52, 'bull_rsi_ob': 69, 'bull_adx_thresh': 23.5701347992996, 'bull_atr_min_pct': 0.0010410502292886432, 'bull_atr_max_pct': 0.023946908133192123, 'bull_tp_mult': 2.481849788539342, 'bull_tsl_mult': 0.9946964036224945, 'bull_time_stop': 196, 'bull_use_sma': False, 'bull_use_ema': False, 'bull_use_atr': True, 'bull_use_adx': True, 'bull_use_spike': True, 'bull_rsi_required': False, 'bear_strategy': 'breakout', 'bear_bb_std_mult': 3.501433265181671, 'bear_rsi_os': 37, 'bear_rsi_ob': 77, 'bear_adx_thresh': 14.964459539360108, 'bear_atr_min_pct': 0.005186674562763114, 'bear_atr_max_pct': 0.0634837982907678, 'bear_tp_mult': 1.6366613003995734, 'bear_tsl_mult': 0.09300997137134118, 'bear_time_stop': 32, 'bear_use_sma': True, 'bear_use_ema': False, 'bear_use_atr': True, 'bear_use_adx': True, 'bear_use_spike': True, 'bear_rsi_required': False, 'sideways_strategy': 'breakout', 'sideways_bb_std_mult': 1.3714009369745215, 'sideways_rsi_os': 52, 'sideways_rsi_ob': 76, 'sideways_adx_thresh': 8.639357163527652, 'sideways_atr_min_pct': 0.020967059532341504, 'sideways_atr_max_pct': 0.1381673632884645, 'sideways_tp_mult': 1.8047505860011976, 'sideways_tsl_mult': 0.9497179407549781, 'sideways_time_stop': 91, 'sideways_use_sma': False, 'sideways_use_ema': True, 'sideways_use_atr': False, 'sideways_use_adx': True, 'sideways_use_spike': False, 'sideways_rsi_required': False}.
[I 2025-08-30 19:09:58,542] Trial 265 finished with values: [-1000000000.0, 1000000000.0] and parameters: {'p_sma': 31, 'p_std': 26, 'p_atr': 30, 'p_adx': 19, 'rsi_period': 53, 'ema1': 24, 'ema2': 13, 'slip_atr_k': 0.11050103014584944, 'slip_spread_k': 0.4057707128172639, 'spread_hl_frac': 0.004408036019665073, 'bb_std_mult': 0.9884465843500096, 'rsi_os': 39, 'rsi_ob': 63, 'vol_spike': 0.040552378154039725, 'adx_thresh': 26.43343743604482, 'atr_min_pct': 0.02454316416982052, 'atr_max_pct': 0.07550028444380169, 'tp_mult': 1.460261746558585, 'tsl_mult': 0.7037521886847953, 'strategy': 'breakout', 'time_stop': 22, 'use_sma': False, 'use_atr': True, 'use_adx': False, 'use_ema': True, 'use_spike': True, 'rsi_required': True, 'edge_k': 0.057072642360438214, 'edge_cap': 0.2953805236503467, 'bull_strategy': 'breakout', 'bull_bb_std_mult': 3.516454362765433, 'bull_rsi_os': 31, 'bull_rsi_ob': 70, 'bull_adx_thresh': 14.898223392994277, 'bull_atr_min_pct': 0.005032621009806016, 'bull_atr_max_pct': 0.024484153090267795, 'bull_tp_mult': 2.0924686537645254, 'bull_tsl_mult': 0.963381065743576, 'bull_time_stop': 39, 'bull_use_sma': False, 'bull_use_ema': False, 'bull_use_atr': True, 'bull_use_adx': True, 'bull_use_spike': True, 'bull_rsi_required': False, 'bear_strategy': 'breakout', 'bear_bb_std_mult': 3.518876105592542, 'bear_rsi_os': 21, 'bear_rsi_ob': 82, 'bear_adx_thresh': 12.816529026323348, 'bear_atr_min_pct': 0.022620167867012573, 'bear_atr_max_pct': 0.06346718363128251, 'bear_tp_mult': 2.4426205044306277, 'bear_tsl_mult': 0.19867037478334953, 'bear_time_stop': 127, 'bear_use_sma': True, 'bear_use_ema': False, 'bear_use_atr': True, 'bear_use_adx': True, 'bear_use_spike': True, 'bear_rsi_required': True, 'sideways_strategy': 'breakout', 'sideways_bb_std_mult': 3.072406033622158, 'sideways_rsi_os': 51, 'sideways_rsi_ob': 61, 'sideways_adx_thresh': 8.60118907417856, 'sideways_atr_min_pct': 0.004071822842357679, 'sideways_atr_max_pct': 0.1049088582621297, 'sideways_tp_mult': 1.8124468846013517, 'sideways_tsl_mult': 0.9506162260364903, 'sideways_time_stop': 88, 'sideways_use_sma': True, 'sideways_use_ema': True, 'sideways_use_atr': True, 'sideways_use_adx': True, 'sideways_use_spike': False, 'sideways_rsi_required': False}.
[I 2025-08-30 19:10:32,158] Trial 272 finished with values: [-0.024531745315438225, 0.02446330046339569] and parameters: {'p_sma': 42, 'p_std': 25, 'p_atr': 9, 'p_adx': 8, 'rsi_period': 48, 'ema1': 23, 'ema2': 21, 'slip_atr_k': 0.016791893620902658, 'slip_spread_k': 0.07294026581164514, 'spread_hl_frac': 0.0028805875498761125, 'bb_std_mult': 1.0829165816353505, 'rsi_os': 37, 'rsi_ob': 53, 'vol_spike': 0.12038647982117096, 'adx_thresh': 18.786626999315768, 'atr_min_pct': 0.02354296525893092, 'atr_max_pct': 0.10166169566505333, 'tp_mult': 2.2754113313999476, 'tsl_mult': 0.7775899165460213, 'strategy': 'breakout', 'time_stop': 37, 'use_sma': True, 'use_atr': True, 'use_adx': False, 'use_ema': False, 'use_spike': True, 'rsi_required': False, 'edge_k': 1.8861010874724653, 'edge_cap': 0.20649326329961235, 'bull_strategy': 'mean_reversion', 'bull_bb_std_mult': 1.9212851572226286, 'bull_rsi_os': 52, 'bull_rsi_ob': 73, 'bull_adx_thresh': 28.69843163956489, 'bull_atr_min_pct': 0.00140379205953017, 'bull_atr_max_pct': 0.027409768418475457, 'bull_tp_mult': 2.5775139628915187, 'bull_tsl_mult': 0.0040643969962275706, 'bull_time_stop': 201, 'bull_use_sma': True, 'bull_use_ema': False, 'bull_use_atr': False, 'bull_use_adx': True, 'bull_use_spike': False, 'bull_rsi_required': True, 'bear_strategy': 'breakout', 'bear_bb_std_mult': 1.9699256195971322, 'bear_rsi_os': 39, 'bear_rsi_ob': 88, 'bear_adx_thresh': 34.3887323646922, 'bear_atr_min_pct': 0.015785998291880793, 'bear_atr_max_pct': 0.054074918044919956, 'bear_tp_mult': 1.732910736481878, 'bear_tsl_mult': 0.9995008059586609, 'bear_time_stop': 298, 'bear_use_sma': False, 'bear_use_ema': True, 'bear_use_atr': True, 'bear_use_adx': True, 'bear_use_spike': False, 'bear_rsi_required': False, 'sideways_strategy': 'breakout', 'sideways_bb_std_mult': 2.0507564938627363, 'sideways_rsi_os': 18, 'sideways_rsi_ob': 60, 'sideways_adx_thresh': 9.348664005881314, 'sideways_atr_min_pct': 0.02047704432669987, 'sideways_atr_max_pct': 0.1464004655605281, 'sideways_tp_mult': 2.883958483209508, 'sideways_tsl_mult': 0.4642670938492041, 'sideways_time_stop': 265, 'sideways_use_sma': False, 'sideways_use_ema': False, 'sideways_use_atr': False, 'sideways_use_adx': False, 'sideways_use_spike': False, 'sideways_rsi_required': False}.
