[I 2025-08-30 20:04:14,879] Trial 666 finished with values: [-1000000000.0, 1000000000.0] and parameters: {'p_sma': 37, 'p_std': 17, 'p_atr': 22, 'p_adx': 22, 'rsi_period': 10, 'ema1': 14, 'ema2': 17, 'slip_atr_k': 0.00867094059255577, 'slip_spread_k': 0.4637628984459501, 'spread_hl_frac': 0.04965634196629667, 'bb_std_mult': 2.422695573578982, 'rsi_os': 48, 'rsi_ob': 58, 'vol_spike': 0.040104017401102074, 'adx_thresh': 17.792814866420127, 'atr_min_pct': 0.023751390890552896, 'atr_max_pct': 0.1287797691339907, 'tp_mult': 2.3253123647179548, 'tsl_mult': 0.6847793787788719, 'strategy': 'mean_reversion', 'time_stop': 204, 'use_sma': True, 'use_atr': True, 'use_adx': False, 'use_ema': False, 'use_spike': True, 'rsi_required': True, 'edge_k': 0.7249605901597289, 'edge_cap': 0.32796552631688347, 'bull_strategy': 'mean_reversion', 'bull_bb_std_mult': 1.7139248648976493, 'bull_rsi_os': 50, 'bull_rsi_ob': 68, 'bull_adx_thresh': 26.149102511826367, 'bull_atr_min_pct': 0.003351639887191332, 'bull_atr_max_pct': 0.1281816115883719, 'bull_tp_mult': 2.8644311921606267, 'bull_tsl_mult': 0.9729671427218319, 'bull_time_stop': 100, 'bull_use_sma': True, 'bull_use_ema': True, 'bull_use_atr': False, 'bull_use_adx': True, 'bull_use_spike': True, 'bull_rsi_required': True, 'bear_strategy': 'breakout', 'bear_bb_std_mult': 3.599010943042056, 'bear_rsi_os': 48, 'bear_rsi_ob': 80, 'bear_adx_thresh': 6.847801715512811, 'bear_atr_min_pct': 0.010537029849331013, 'bear_atr_max_pct': 0.06238506096398307, 'bear_tp_mult': 1.7793324578632137, 'bear_tsl_mult': 0.03627789422470329, 'bear_time_stop': 26, 'bear_use_sma': True, 'bear_use_ema': False, 'bear_use_atr': True, 'bear_use_adx': True, 'bear_use_spike': False, 'bear_rsi_required': False, 'sideways_strategy': 'breakout', 'sideways_bb_std_mult': 3.0183663746534686, 'sideways_rsi_os': 18, 'sideways_rsi_ob': 61, 'sideways_adx_thresh': 28.928428755943294, 'sideways_atr_min_pct': 0.019177279003731347, 'sideways_atr_max_pct': 0.036247744823953106, 'sideways_tp_mult': 2.8067290552810915, 'sideways_tsl_mult': 0.8985072552969777, 'sideways_time_stop': 261, 'sideways_use_sma': True, 'sideways_use_ema': True, 'sideways_use_atr': False, 'sideways_use_adx': False, 'sideways_use_spike': True, 'sideways_rsi_required': False}.
[I 2025-08-30 20:04:15,264] Trial 667 finished with values: [-1000000000.0, 1000000000.0] and parameters: {'p_sma': 45, 'p_std': 21, 'p_atr': 27, 'p_adx': 9, 'rsi_period': 60, 'ema1': 14, 'ema2': 15, 'slip_atr_k': 0.10430555669408775, 'slip_spread_k': 0.46270968869247797, 'spread_hl_frac': 0.00016274823752940098, 'bb_std_mult': 1.0117048803284043, 'rsi_os': 37, 'rsi_ob': 78, 'vol_spike': 0.03695549032304507, 'adx_thresh': 6.7191228375183005, 'atr_min_pct': 0.01793886283718388, 'atr_max_pct': 0.13993335698413872, 'tp_mult': 2.171745646523255, 'tsl_mult': 0.5645665088843781, 'strategy': 'mean_reversion', 'time_stop': 256, 'use_sma': False, 'use_atr': True, 'use_adx': False, 'use_ema': False, 'use_spike': True, 'rsi_required': True, 'edge_k': 0.12663785828431479, 'edge_cap': 0.23976584786156274, 'bull_strategy': 'mean_reversion', 'bull_bb_std_mult': 3.388909858113556, 'bull_rsi_os': 45, 'bull_rsi_ob': 70, 'bull_adx_thresh': 9.280626939331869, 'bull_atr_min_pct': 0.003391460852241882, 'bull_atr_max_pct': 0.049499202486102234, 'bull_tp_mult': 2.179902410770723, 'bull_tsl_mult': 0.20826084313138543, 'bull_time_stop': 185, 'bull_use_sma': True, 'bull_use_ema': True, 'bull_use_atr': False, 'bull_use_adx': True, 'bull_use_spike': False, 'bull_rsi_required': True, 'bear_strategy': 'mean_reversion', 'bear_bb_std_mult': 2.8610137353419347, 'bear_rsi_os': 40, 'bear_rsi_ob': 84, 'bear_adx_thresh': 6.671982966178621, 'bear_atr_min_pct': 0.020390422000953496, 'bear_atr_max_pct': 0.05782674381393024, 'bear_tp_mult': 1.793389402169554, 'bear_tsl_mult': 0.4462108194771831, 'bear_time_stop': 27, 'bear_use_sma': False, 'bear_use_ema': False, 'bear_use_atr': True, 'bear_use_adx': True, 'bear_use_spike': False, 'bear_rsi_required': False, 'sideways_strategy': 'breakout', 'sideways_bb_std_mult': 2.0671758142883383, 'sideways_rsi_os': 52, 'sideways_rsi_ob': 61, 'sideways_adx_thresh': 8.883512091659966, 'sideways_atr_min_pct': 0.019269148078116232, 'sideways_atr_max_pct': 0.11858369925955783, 'sideways_tp_mult': 1.0796971650043075, 'sideways_tsl_mult': 0.9001236941271956, 'sideways_time_stop': 162, 'sideways_use_sma': True, 'sideways_use_ema': True, 'sideways_use_atr': False, 'sideways_use_adx': False, 'sideways_use_spike': True, 'sideways_rsi_required': False}.
[I 2025-08-30 20:04:15,489] Trial 668 finished with values: [-1000000000.0, 1000000000.0] and parameters: {'p_sma': 37, 'p_std': 28, 'p_atr': 10, 'p_adx': 9, 'rsi_period': 55, 'ema1': 30, 'ema2': 46, 'slip_atr_k': 0.00894165279464772, 'slip_spread_k': 0.06744876021882307, 'spread_hl_frac': 0.01028625344718942, 'bb_std_mult': 1.0158011180780215, 'rsi_os': 38, 'rsi_ob': 66, 'vol_spike': 0.030873679569115197, 'adx_thresh': 8.99901753891919, 'atr_min_pct': 0.023857002021234593, 'atr_max_pct': 0.13905432591567948, 'tp_mult': 2.21569964812723, 'tsl_mult': 0.7971501464681092, 'strategy': 'mean_reversion', 'time_stop': 160, 'use_sma': False, 'use_atr': True, 'use_adx': False, 'use_ema': False, 'use_spike': True, 'rsi_required': True, 'edge_k': 0.5069630328791559, 'edge_cap': 0.10379867274462445, 'bull_strategy': 'mean_reversion', 'bull_bb_std_mult': 1.917375877531588, 'bull_rsi_os': 50, 'bull_rsi_ob': 84, 'bull_adx_thresh': 22.024779285244687, 'bull_atr_min_pct': 0.029986841083372275, 'bull_atr_max_pct': 0.010300623231423292, 'bull_tp_mult': 2.175847096018504, 'bull_tsl_mult': 0.9458111729141082, 'bull_time_stop': 177, 'bull_use_sma': True, 'bull_use_ema': True, 'bull_use_atr': False, 'bull_use_adx': True, 'bull_use_spike': False, 'bull_rsi_required': True, 'bear_strategy': 'mean_reversion', 'bear_bb_std_mult': 3.4640994685761077, 'bear_rsi_os': 52, 'bear_rsi_ob': 83, 'bear_adx_thresh': 21.357891392461074, 'bear_atr_min_pct': 0.0015836980306685369, 'bear_atr_max_pct': 0.05690340822235116, 'bear_tp_mult': 1.7810630864427568, 'bear_tsl_mult': 0.11429514291621659, 'bear_time_stop': 229, 'bear_use_sma': False, 'bear_use_ema': False, 'bear_use_atr': True, 'bear_use_adx': True, 'bear_use_spike': False, 'bear_rsi_required': False, 'sideways_strategy': 'breakout', 'sideways_bb_std_mult': 2.0339596026637494, 'sideways_rsi_os': 53, 'sideways_rsi_ob': 48, 'sideways_adx_thresh': 19.801758154174898, 'sideways_atr_min_pct': 0.019383728526887602, 'sideways_atr_max_pct': 0.11849035451261393, 'sideways_tp_mult': 1.8505966177316695, 'sideways_tsl_mult': 0.06179271995140484, 'sideways_time_stop': 57, 'sideways_use_sma': True, 'sideways_use_ema': True, 'sideways_use_atr': False, 'sideways_use_adx': False, 'sideways_use_spike': True, 'sideways_rsi_required': False}.
[I 2025-08-30 20:04:50,651] Trial 672 finished with values: [-0.013817964052065368, 0.01414814741721897] and parameters: {'p_sma': 45, 'p_std': 46, 'p_atr': 9, 'p_adx': 8, 'rsi_period': 54, 'ema1': 23, 'ema2': 19, 'slip_atr_k': 0.028776200256059314, 'slip_spread_k': 0.6672142657773059, 'spread_hl_frac': 0.006381510112407066, 'bb_std_mult': 1.1018728187406204, 'rsi_os': 36, 'rsi_ob': 57, 'vol_spike': 0.04677964175609685, 'adx_thresh': 15.6804685506611, 'atr_min_pct': 0.009928008183659917, 'atr_max_pct': 0.1326937252857972, 'tp_mult': 2.2292249723285287, 'tsl_mult': 0.13733062465856094, 'strategy': 'breakout', 'time_stop': 36, 'use_sma': False, 'use_atr': False, 'use_adx': False, 'use_ema': False, 'use_spike': True, 'rsi_required': True, 'edge_k': 0.12596428484512415, 'edge_cap': 0.5218477295946382, 'bull_strategy': 'breakout', 'bull_bb_std_mult': 2.0731615113344892, 'bull_rsi_os': 51, 'bull_rsi_ob': 73, 'bull_adx_thresh': 24.378265275314472, 'bull_atr_min_pct': 0.0005363098141378132, 'bull_atr_max_pct': 0.10002198683002894, 'bull_tp_mult': 1.8722607635184, 'bull_tsl_mult': 0.054232613394532336, 'bull_time_stop': 137, 'bull_use_sma': True, 'bull_use_ema': False, 'bull_use_atr': False, 'bull_use_adx': True, 'bull_use_spike': True, 'bull_rsi_required': True, 'bear_strategy': 'breakout', 'bear_bb_std_mult': 3.0496869800399447, 'bear_rsi_os': 51, 'bear_rsi_ob': 83, 'bear_adx_thresh': 31.75667411374356, 'bear_atr_min_pct': 0.015058650518556503, 'bear_atr_max_pct': 0.048606210798766744, 'bear_tp_mult': 1.8582768938116538, 'bear_tsl_mult': 0.134052333804708, 'bear_time_stop': 282, 'bear_use_sma': True, 'bear_use_ema': True, 'bear_use_atr': False, 'bear_use_adx': False, 'bear_use_spike': False, 'bear_rsi_required': False, 'sideways_strategy': 'breakout', 'sideways_bb_std_mult': 1.953990094089284, 'sideways_rsi_os': 14, 'sideways_rsi_ob': 56, 'sideways_adx_thresh': 5.410141172756479, 'sideways_atr_min_pct': 0.020482015433390923, 'sideways_atr_max_pct': 0.1208915814781053, 'sideways_tp_mult': 1.7584303190957147, 'sideways_tsl_mult': 0.5768438562468671, 'sideways_time_stop': 268, 'sideways_use_sma': False, 'sideways_use_ema': True, 'sideways_use_atr': False, 'sideways_use_adx': False, 'sideways_use_spike': False, 'sideways_rsi_required': True}.
[I 2025-08-30 20:04:50,988] Trial 671 finished with values: [-0.020085240099175117, 0.01997462872531499] and parameters: {'p_sma': 38, 'p_std': 42, 'p_atr': 9, 'p_adx': 8, 'rsi_period': 55, 'ema1': 28, 'ema2': 26, 'slip_atr_k': 0.02956295072721199, 'slip_spread_k': 0.06474640945399668, 'spread_hl_frac': 0.016690952544648252, 'bb_std_mult': 2.745777332854945, 'rsi_os': 38, 'rsi_ob': 85, 'vol_spike': 0.03058472213345756, 'adx_thresh': 15.808299951091769, 'atr_min_pct': 0.024089172830093434, 'atr_max_pct': 0.1310615395522715, 'tp_mult': 2.215279390189174, 'tsl_mult': 0.7991218937919913, 'strategy': 'breakout', 'time_stop': 36, 'use_sma': False, 'use_atr': False, 'use_adx': False, 'use_ema': False, 'use_spike': True, 'rsi_required': True, 'edge_k': 0.9469259098856545, 'edge_cap': 0.17917058624661772, 'bull_strategy': 'breakout', 'bull_bb_std_mult': 3.0015061830327783, 'bull_rsi_os': 51, 'bull_rsi_ob': 73, 'bull_adx_thresh': 24.34783252226866, 'bull_atr_min_pct': 0.0007530509674269089, 'bull_atr_max_pct': 0.14369090532044848, 'bull_tp_mult': 1.8974571269569473, 'bull_tsl_mult': 0.9463335181187635, 'bull_time_stop': 178, 'bull_use_sma': True, 'bull_use_ema': False, 'bull_use_atr': False, 'bull_use_adx': True, 'bull_use_spike': False, 'bull_rsi_required': True, 'bear_strategy': 'mean_reversion', 'bear_bb_std_mult': 3.451586344709151, 'bear_rsi_os': 40, 'bear_rsi_ob': 82, 'bear_adx_thresh': 5.403574820560764, 'bear_atr_min_pct': 0.025464444437959713, 'bear_atr_max_pct': 0.056547293153302196, 'bear_tp_mult': 1.8786594328218624, 'bear_tsl_mult': 0.1126628006395526, 'bear_time_stop': 20, 'bear_use_sma': False, 'bear_use_ema': False, 'bear_use_atr': False, 'bear_use_adx': False, 'bear_use_spike': False, 'bear_rsi_required': False, 'sideways_strategy': 'breakout', 'sideways_bb_std_mult': 1.387761302920603, 'sideways_rsi_os': 14, 'sideways_rsi_ob': 53, 'sideways_adx_thresh': 9.855474813928177, 'sideways_atr_min_pct': 0.024832619963048638, 'sideways_atr_max_pct': 0.11505216979852333, 'sideways_tp_mult': 1.600244773082402, 'sideways_tsl_mult': 0.6544046476587498, 'sideways_time_stop': 270, 'sideways_use_sma': False, 'sideways_use_ema': True, 'sideways_use_atr': False, 'sideways_use_adx': False, 'sideways_use_spike': False, 'sideways_rsi_required': True}.
[I 2025-08-30 20:04:51,489] Trial 669 finished with values: [-0.023191306609200546, 0.023082969502816554] and parameters: {'p_sma': 37, 'p_std': 21, 'p_atr': 9, 'p_adx': 26, 'rsi_period': 54, 'ema1': 5, 'ema2': 44, 'slip_atr_k': 0.00880628839476757, 'slip_spread_k': 0.4283441369703051, 'spread_hl_frac': 0.025812382191930907, 'bb_std_mult': 2.4645612407808004, 'rsi_os': 37, 'rsi_ob': 85, 'vol_spike': 0.12223600336015637, 'adx_thresh': 18.001664429075905, 'atr_min_pct': 0.023845973499979516, 'atr_max_pct': 0.12907611872257907, 'tp_mult': 2.935098319179837, 'tsl_mult': 0.7572543805433405, 'strategy': 'mean_reversion', 'time_stop': 254, 'use_sma': False, 'use_atr': False, 'use_adx': False, 'use_ema': False, 'use_spike': True, 'rsi_required': True, 'edge_k': 0.5206321484083277, 'edge_cap': 0.5168967398350729, 'bull_strategy': 'breakout', 'bull_bb_std_mult': 1.9177891046186573, 'bull_rsi_os': 50, 'bull_rsi_ob': 70, 'bull_adx_thresh': 14.70589487011053, 'bull_atr_min_pct': 0.000528139127500416, 'bull_atr_max_pct': 0.07338385984159271, 'bull_tp_mult': 2.1748227760606604, 'bull_tsl_mult': 0.9472869122942666, 'bull_time_stop': 101, 'bull_use_sma': True, 'bull_use_ema': True, 'bull_use_atr': False, 'bull_use_adx': True, 'bull_use_spike': False, 'bull_rsi_required': True, 'bear_strategy': 'mean_reversion', 'bear_bb_std_mult': 2.2432550722050655, 'bear_rsi_os': 51, 'bear_rsi_ob': 83, 'bear_adx_thresh': 5.035956342526858, 'bear_atr_min_pct': 0.014982619947692805, 'bear_atr_max_pct': 0.05688397103924359, 'bear_tp_mult': 2.3611707758412495, 'bear_tsl_mult': 0.12844985714453333, 'bear_time_stop': 27, 'bear_use_sma': False, 'bear_use_ema': False, 'bear_use_atr': False, 'bear_use_adx': False, 'bear_use_spike': False, 'bear_rsi_required': False, 'sideways_strategy': 'breakout', 'sideways_bb_std_mult': 2.416374735109603, 'sideways_rsi_os': 52, 'sideways_rsi_ob': 87, 'sideways_adx_thresh': 8.842591184286118, 'sideways_atr_min_pct': 0.0201767405514355, 'sideways_atr_max_pct': 0.11599125794565572, 'sideways_tp_mult': 2.805620348595742, 'sideways_tsl_mult': 0.05322493672926454, 'sideways_time_stop': 268, 'sideways_use_sma': False, 'sideways_use_ema': True, 'sideways_use_atr': False, 'sideways_use_adx': False, 'sideways_use_spike': True, 'sideways_rsi_required': True}.
[I 2025-08-30 20:04:51,722] Trial 670 finished with values: [-1000000000.0, 1000000000.0] and parameters: {'p_sma': 37, 'p_std': 43, 'p_atr': 9, 'p_adx': 8, 'rsi_period': 55, 'ema1': 25, 'ema2': 50, 'slip_atr_k': 0.05130385481176594, 'slip_spread_k': 0.07013545655146497, 'spread_hl_frac': 0.026086833469646138, 'bb_std_mult': 2.7358019564156093, 'rsi_os': 37, 'rsi_ob': 66, 'vol_spike': 0.12373039861418188, 'adx_thresh': 29.718905118534394, 'atr_min_pct': 0.023959203553661566, 'atr_max_pct': 0.13976642327350947, 'tp_mult': 2.218253871722201, 'tsl_mult': 0.7588583631211882, 'strategy': 'mean_reversion', 'time_stop': 138, 'use_sma': False, 'use_atr': False, 'use_adx': False, 'use_ema': False, 'use_spike': True, 'rsi_required': True, 'edge_k': 0.13186438345723556, 'edge_cap': 0.10490966542470176, 'bull_strategy': 'breakout', 'bull_bb_std_mult': 1.936216004903282, 'bull_rsi_os': 51, 'bull_rsi_ob': 70, 'bull_adx_thresh': 19.947329927541045, 'bull_atr_min_pct': 0.023051362785662645, 'bull_atr_max_pct': 0.14159193412948834, 'bull_tp_mult': 2.178334451972716, 'bull_tsl_mult': 0.3430808317780023, 'bull_time_stop': 204, 'bull_use_sma': True, 'bull_use_ema': True, 'bull_use_atr': False, 'bull_use_adx': True, 'bull_use_spike': False, 'bull_rsi_required': True, 'bear_strategy': 'mean_reversion', 'bear_bb_std_mult': 1.8378615498297617, 'bear_rsi_os': 40, 'bear_rsi_ob': 67, 'bear_adx_thresh': 5.409161639949595, 'bear_atr_min_pct': 0.02032892489291458, 'bear_atr_max_pct': 0.05688818210978776, 'bear_tp_mult': 2.7957682912862305, 'bear_tsl_mult': 0.11569988327247462, 'bear_time_stop': 75, 'bear_use_sma': False, 'bear_use_ema': False, 'bear_use_atr': False, 'bear_use_adx': False, 'bear_use_spike': False, 'bear_rsi_required': False, 'sideways_strategy': 'breakout', 'sideways_bb_std_mult': 2.426313859596272, 'sideways_rsi_os': 52, 'sideways_rsi_ob': 53, 'sideways_adx_thresh': 8.778173575462983, 'sideways_atr_min_pct': 0.020333668515574423, 'sideways_atr_max_pct': 0.11833464752308982, 'sideways_tp_mult': 1.8491618334372697, 'sideways_tsl_mult': 0.6553037132311776, 'sideways_time_stop': 268, 'sideways_use_sma': False, 'sideways_use_ema': True, 'sideways_use_atr': False, 'sideways_use_adx': False, 'sideways_use_spike': True, 'sideways_rsi_required': True}.
[I 2025-08-30 20:05:25,489] Trial 676 finished with values: [-0.05706960210721279, 0.05697301289439692] and parameters: {'p_sma': 41, 'p_std': 26, 'p_atr': 10, 'p_adx': 7, 'rsi_period': 52, 'ema1': 26, 'ema2': 20, 'slip_atr_k': 0.042130927925868575, 'slip_spread_k': 0.6675165049129889, 'spread_hl_frac': 0.011621442037429174, 'bb_std_mult': 1.0841608454273788, 'rsi_os': 32, 'rsi_ob': 45, 'vol_spike': 0.047394874960655614, 'adx_thresh': 18.796702812886235, 'atr_min_pct': 0.025375718827453417, 'atr_max_pct': 0.051199939512766614, 'tp_mult': 2.16105700063537, 'tsl_mult': 0.8275594130638473, 'strategy': 'breakout', 'time_stop': 279, 'use_sma': True, 'use_atr': True, 'use_adx': True, 'use_ema': True, 'use_spike': False, 'rsi_required': True, 'edge_k': 0.20443303537934182, 'edge_cap': 0.9218569689241547, 'bull_strategy': 'mean_reversion', 'bull_bb_std_mult': 1.7850405397103626, 'bull_rsi_os': 48, 'bull_rsi_ob': 72, 'bull_adx_thresh': 11.334771469543602, 'bull_atr_min_pct': 0.0018810837057173081, 'bull_atr_max_pct': 0.022347783465975147, 'bull_tp_mult': 1.6456670059338272, 'bull_tsl_mult': 0.0579285156036069, 'bull_time_stop': 252, 'bull_use_sma': True, 'bull_use_ema': False, 'bull_use_atr': False, 'bull_use_adx': True, 'bull_use_spike': True, 'bull_rsi_required': False, 'bear_strategy': 'breakout', 'bear_bb_std_mult': 2.0286745801594, 'bear_rsi_os': 37, 'bear_rsi_ob': 81, 'bear_adx_thresh': 31.589876714170348, 'bear_atr_min_pct': 0.0005098252081607198, 'bear_atr_max_pct': 0.012480254240378907, 'bear_tp_mult': 1.7047977710928546, 'bear_tsl_mult': 0.1863787693992433, 'bear_time_stop': 158, 'bear_use_sma': True, 'bear_use_ema': True, 'bear_use_atr': True, 'bear_use_adx': True, 'bear_use_spike': True, 'bear_rsi_required': True, 'sideways_strategy': 'mean_reversion', 'sideways_bb_std_mult': 1.906748470271556, 'sideways_rsi_os': 21, 'sideways_rsi_ob': 56, 'sideways_adx_thresh': 5.574163724012182, 'sideways_atr_min_pct': 0.01180261328896931, 'sideways_atr_max_pct': 0.10748763899620405, 'sideways_tp_mult': 1.327494496107223, 'sideways_tsl_mult': 0.5736295677434946, 'sideways_time_stop': 277, 'sideways_use_sma': True, 'sideways_use_ema': False, 'sideways_use_atr': True, 'sideways_use_adx': False, 'sideways_use_spike': False, 'sideways_rsi_required': False}.
[I 2025-08-30 20:05:26,170] Trial 673 finished with values: [-0.028852556530382212, 0.028870202696761292] and parameters: {'p_sma': 17, 'p_std': 24, 'p_atr': 9, 'p_adx': 10, 'rsi_period': 54, 'ema1': 26, 'ema2': 19, 'slip_atr_k': 0.028728545572062475, 'slip_spread_k': 0.42465509192720924, 'spread_hl_frac': 0.0016271431596322282, 'bb_std_mult': 3.51894306033336, 'rsi_os': 36, 'rsi_ob': 57, 'vol_spike': 0.04653719536727888, 'adx_thresh': 18.78811582071286, 'atr_min_pct': 0.02336899973188824, 'atr_max_pct': 0.05009303571691335, 'tp_mult': 2.235573930011839, 'tsl_mult': 0.7593749821615068, 'strategy': 'breakout', 'time_stop': 35, 'use_sma': False, 'use_atr': False, 'use_adx': False, 'use_ema': False, 'use_spike': True, 'rsi_required': True, 'edge_k': 1.2962951700614511, 'edge_cap': 0.2713893526476658, 'bull_strategy': 'breakout', 'bull_bb_std_mult': 2.2846015526467487, 'bull_rsi_os': 51, 'bull_rsi_ob': 73, 'bull_adx_thresh': 27.128034118243686, 'bull_atr_min_pct': 0.0006719783766381004, 'bull_atr_max_pct': 0.13818944087692253, 'bull_tp_mult': 1.860782484073295, 'bull_tsl_mult': 0.8643577355655763, 'bull_time_stop': 202, 'bull_use_sma': True, 'bull_use_ema': False, 'bull_use_atr': False, 'bull_use_adx': True, 'bull_use_spike': True, 'bull_rsi_required': True, 'bear_strategy': 'breakout', 'bear_bb_std_mult': 2.2144779379316817, 'bear_rsi_os': 40, 'bear_rsi_ob': 67, 'bear_adx_thresh': 5.0680406498955985, 'bear_atr_min_pct': 0.0043894303586505725, 'bear_atr_max_pct': 0.10161269721105143, 'bear_tp_mult': 2.6382892888164458, 'bear_tsl_mult': 0.5439766059779729, 'bear_time_stop': 20, 'bear_use_sma': True, 'bear_use_ema': True, 'bear_use_atr': False, 'bear_use_adx': False, 'bear_use_spike': False, 'bear_rsi_required': False, 'sideways_strategy': 'breakout', 'sideways_bb_std_mult': 1.0898536541460793, 'sideways_rsi_os': 39, 'sideways_rsi_ob': 89, 'sideways_adx_thresh': 9.8486118312961, 'sideways_atr_min_pct': 0.011914765402847593, 'sideways_atr_max_pct': 0.1155397088008066, 'sideways_tp_mult': 1.7576474284415735, 'sideways_tsl_mult': 0.6617235272109734, 'sideways_time_stop': 38, 'sideways_use_sma': False, 'sideways_use_ema': True, 'sideways_use_atr': False, 'sideways_use_adx': False, 'sideways_use_spike': False, 'sideways_rsi_required': True}.
