[I 2025-08-30 19:40:57,687] Trial 494 finished with values: [-1000000000.0, 1000000000.0] and parameters: {'p_sma': 10, 'p_std': 58, 'p_atr': 10, 'p_adx': 14, 'rsi_period': 54, 'ema1': 15, 'ema2': 16, 'slip_atr_k': 0.004007684421214805, 'slip_spread_k': 0.4846005031535174, 'spread_hl_frac': 0.0021076798394674967, 'bb_std_mult': 0.9331539038934764, 'rsi_os': 14, 'rsi_ob': 88, 'vol_spike': 0.041792467363691216, 'adx_thresh': 24.043288076235665, 'atr_min_pct': 0.003983520660662364, 'atr_max_pct': 0.13828193298474162, 'tp_mult': 2.2015945127358894, 'tsl_mult': 0.7020799841467072, 'strategy': 'breakout', 'time_stop': 226, 'use_sma': False, 'use_atr': True, 'use_adx': True, 'use_ema': False, 'use_spike': True, 'rsi_required': True, 'edge_k': 0.38375325359544954, 'edge_cap': 0.6522688747733086, 'bull_strategy': 'breakout', 'bull_bb_std_mult': 3.578242763552006, 'bull_rsi_os': 49, 'bull_rsi_ob': 80, 'bull_adx_thresh': 12.817550458184563, 'bull_atr_min_pct': 0.0017528149695866047, 'bull_atr_max_pct': 0.07490268659658467, 'bull_tp_mult': 2.844486401853925, 'bull_tsl_mult': 0.9497178037641287, 'bull_time_stop': 195, 'bull_use_sma': True, 'bull_use_ema': False, 'bull_use_atr': True, 'bull_use_adx': True, 'bull_use_spike': False, 'bull_rsi_required': True, 'bear_strategy': 'mean_reversion', 'bear_bb_std_mult': 2.751865436299493, 'bear_rsi_os': 42, 'bear_rsi_ob': 74, 'bear_adx_thresh': 5.725948943924338, 'bear_atr_min_pct': 0.016584807764178727, 'bear_atr_max_pct': 0.05949601231949313, 'bear_tp_mult': 2.641138022707484, 'bear_tsl_mult': 0.9018014343649043, 'bear_time_stop': 14, 'bear_use_sma': True, 'bear_use_ema': False, 'bear_use_atr': True, 'bear_use_adx': True, 'bear_use_spike': False, 'bear_rsi_required': False, 'sideways_strategy': 'breakout', 'sideways_bb_std_mult': 1.1199807449143888, 'sideways_rsi_os': 40, 'sideways_rsi_ob': 55, 'sideways_adx_thresh': 6.440974910193022, 'sideways_atr_min_pct': 0.02844469998031204, 'sideways_atr_max_pct': 0.09721350223711847, 'sideways_tp_mult': 2.704723039184372, 'sideways_tsl_mult': 0.5881852691633963, 'sideways_time_stop': 240, 'sideways_use_sma': True, 'sideways_use_ema': True, 'sideways_use_atr': False, 'sideways_use_adx': False, 'sideways_use_spike': False, 'sideways_rsi_required': False}.
[I 2025-08-30 19:40:58,531] Trial 497 finished with values: [-1000000000.0, 1000000000.0] and parameters: {'p_sma': 17, 'p_std': 19, 'p_atr': 12, 'p_adx': 19, 'rsi_period': 51, 'ema1': 27, 'ema2': 16, 'slip_atr_k': 0.08271209603085772, 'slip_spread_k': 0.5878116465532113, 'spread_hl_frac': 0.0011444504994132425, 'bb_std_mult': 2.3395721025747926, 'rsi_os': 55, 'rsi_ob': 45, 'vol_spike': 0.1420599488256685, 'adx_thresh': 5.584223425427808, 'atr_min_pct': 0.023986495923748644, 'atr_max_pct': 0.020109587004937354, 'tp_mult': 2.354976175096973, 'tsl_mult': 0.8446285971129106, 'strategy': 'breakout', 'time_stop': 225, 'use_sma': False, 'use_atr': True, 'use_adx': True, 'use_ema': False, 'use_spike': True, 'rsi_required': True, 'edge_k': 0.1952851836813687, 'edge_cap': 0.2077409049127772, 'bull_strategy': 'mean_reversion', 'bull_bb_std_mult': 2.791868387834768, 'bull_rsi_os': 52, 'bull_rsi_ob': 78, 'bull_adx_thresh': 28.357054097269113, 'bull_atr_min_pct': 0.0024764239790171145, 'bull_atr_max_pct': 0.01783139162802691, 'bull_tp_mult': 2.4670468615623804, 'bull_tsl_mult': 0.9453465680036877, 'bull_time_stop': 185, 'bull_use_sma': True, 'bull_use_ema': False, 'bull_use_atr': False, 'bull_use_adx': True, 'bull_use_spike': False, 'bull_rsi_required': False, 'bear_strategy': 'breakout', 'bear_bb_std_mult': 0.9902934440491724, 'bear_rsi_os': 35, 'bear_rsi_ob': 83, 'bear_adx_thresh': 7.883810141705085, 'bear_atr_min_pct': 0.015316556219049161, 'bear_atr_max_pct': 0.05974200992284706, 'bear_tp_mult': 1.8183277743116613, 'bear_tsl_mult': 0.12053838213971893, 'bear_time_stop': 113, 'bear_use_sma': False, 'bear_use_ema': False, 'bear_use_atr': True, 'bear_use_adx': True, 'bear_use_spike': False, 'bear_rsi_required': False, 'sideways_strategy': 'breakout', 'sideways_bb_std_mult': 1.9481585605634528, 'sideways_rsi_os': 13, 'sideways_rsi_ob': 55, 'sideways_adx_thresh': 9.388020765620217, 'sideways_atr_min_pct': 0.028526981394615708, 'sideways_atr_max_pct': 0.12827134598740547, 'sideways_tp_mult': 1.8082979837231485, 'sideways_tsl_mult': 0.9593192888029386, 'sideways_time_stop': 277, 'sideways_use_sma': True, 'sideways_use_ema': False, 'sideways_use_atr': True, 'sideways_use_adx': False, 'sideways_use_spike': False, 'sideways_rsi_required': False}.
[I 2025-08-30 19:41:29,803] Trial 496 finished with values: [-1000000000.0, 1000000000.0] and parameters: {'p_sma': 17, 'p_std': 18, 'p_atr': 12, 'p_adx': 24, 'rsi_period': 51, 'ema1': 27, 'ema2': 35, 'slip_atr_k': 0.0042515928937172116, 'slip_spread_k': 0.5576940054777634, 'spread_hl_frac': 0.0013100530614999803, 'bb_std_mult': 0.7900292694616939, 'rsi_os': 38, 'rsi_ob': 45, 'vol_spike': 0.052840221429213505, 'adx_thresh': 23.887974199668978, 'atr_min_pct': 0.0238551075925665, 'atr_max_pct': 0.14029748569775555, 'tp_mult': 2.2294460819041424, 'tsl_mult': 0.7952160147991738, 'strategy': 'breakout', 'time_stop': 225, 'use_sma': False, 'use_atr': True, 'use_adx': True, 'use_ema': False, 'use_spike': True, 'rsi_required': True, 'edge_k': 1.0881732491560687, 'edge_cap': 0.8516243298753674, 'bull_strategy': 'mean_reversion', 'bull_bb_std_mult': 1.9086101155962147, 'bull_rsi_os': 29, 'bull_rsi_ob': 59, 'bull_adx_thresh': 30.628590945394315, 'bull_atr_min_pct': 0.0017881301639594007, 'bull_atr_max_pct': 0.11444203498273389, 'bull_tp_mult': 2.8465873092100584, 'bull_tsl_mult': 0.9555184467371535, 'bull_time_stop': 65, 'bull_use_sma': True, 'bull_use_ema': False, 'bull_use_atr': False, 'bull_use_adx': True, 'bull_use_spike': False, 'bull_rsi_required': False, 'bear_strategy': 'breakout', 'bear_bb_std_mult': 1.012781526824874, 'bear_rsi_os': 44, 'bear_rsi_ob': 83, 'bear_adx_thresh': 31.213861197187367, 'bear_atr_min_pct': 0.017019978884010772, 'bear_atr_max_pct': 0.1382169360994112, 'bear_tp_mult': 1.782278618718321, 'bear_tsl_mult': 0.11905921297441686, 'bear_time_stop': 15, 'bear_use_sma': False, 'bear_use_ema': False, 'bear_use_atr': True, 'bear_use_adx': True, 'bear_use_spike': False, 'bear_rsi_required': False, 'sideways_strategy': 'breakout', 'sideways_bb_std_mult': 3.3295584962521456, 'sideways_rsi_os': 13, 'sideways_rsi_ob': 55, 'sideways_adx_thresh': 6.286042718713865, 'sideways_atr_min_pct': 0.010013423389706774, 'sideways_atr_max_pct': 0.06690604068296473, 'sideways_tp_mult': 1.7471829418957538, 'sideways_tsl_mult': 0.686492006098806, 'sideways_time_stop': 276, 'sideways_use_sma': True, 'sideways_use_ema': False, 'sideways_use_atr': True, 'sideways_use_adx': False, 'sideways_use_spike': False, 'sideways_rsi_required': False}.
[I 2025-08-30 19:41:30,230] Trial 498 finished with values: [-0.015988177678714077, 0.015955043057467175] and parameters: {'p_sma': 28, 'p_std': 20, 'p_atr': 12, 'p_adx': 14, 'rsi_period': 51, 'ema1': 15, 'ema2': 16, 'slip_atr_k': 0.004533396825400831, 'slip_spread_k': 0.4859646098896618, 'spread_hl_frac': 0.002733219756549608, 'bb_std_mult': 0.775084777016714, 'rsi_os': 38, 'rsi_ob': 59, 'vol_spike': 0.1426260204721885, 'adx_thresh': 24.051608184471633, 'atr_min_pct': 0.02392387008657629, 'atr_max_pct': 0.13980854898494244, 'tp_mult': 1.0104784078081765, 'tsl_mult': 0.8330371026520911, 'strategy': 'breakout', 'time_stop': 40, 'use_sma': False, 'use_atr': True, 'use_adx': True, 'use_ema': False, 'use_spike': True, 'rsi_required': True, 'edge_k': 1.6723429849459253, 'edge_cap': 0.8685132173332478, 'bull_strategy': 'mean_reversion', 'bull_bb_std_mult': 1.8968117342219168, 'bull_rsi_os': 52, 'bull_rsi_ob': 74, 'bull_adx_thresh': 25.592809956459668, 'bull_atr_min_pct': 0.0017823090486593128, 'bull_atr_max_pct': 0.11824812439584617, 'bull_tp_mult': 2.1560581968484858, 'bull_tsl_mult': 0.4815988476924609, 'bull_time_stop': 186, 'bull_use_sma': True, 'bull_use_ema': False, 'bull_use_atr': False, 'bull_use_adx': True, 'bull_use_spike': False, 'bull_rsi_required': False, 'bear_strategy': 'breakout', 'bear_bb_std_mult': 3.3034491577548963, 'bear_rsi_os': 44, 'bear_rsi_ob': 52, 'bear_adx_thresh': 5.420934083148589, 'bear_atr_min_pct': 0.015319813576940506, 'bear_atr_max_pct': 0.13788298944490043, 'bear_tp_mult': 1.3454256301365533, 'bear_tsl_mult': 0.19625924839890874, 'bear_time_stop': 40, 'bear_use_sma': False, 'bear_use_ema': False, 'bear_use_atr': True, 'bear_use_adx': True, 'bear_use_spike': False, 'bear_rsi_required': False, 'sideways_strategy': 'breakout', 'sideways_bb_std_mult': 2.79023320832102, 'sideways_rsi_os': 13, 'sideways_rsi_ob': 55, 'sideways_adx_thresh': 6.355668231181706, 'sideways_atr_min_pct': 0.009868128308617143, 'sideways_atr_max_pct': 0.0473176707733271, 'sideways_tp_mult': 1.7515318006361777, 'sideways_tsl_mult': 0.595015893268269, 'sideways_time_stop': 40, 'sideways_use_sma': True, 'sideways_use_ema': False, 'sideways_use_atr': True, 'sideways_use_adx': False, 'sideways_use_spike': False, 'sideways_rsi_required': False}.
[I 2025-08-30 19:41:30,397] Trial 499 finished with values: [-1000000000.0, 1000000000.0] and parameters: {'p_sma': 45, 'p_std': 33, 'p_atr': 28, 'p_adx': 9, 'rsi_period': 51, 'ema1': 27, 'ema2': 34, 'slip_atr_k': 0.019047975697931898, 'slip_spread_k': 0.8071976527456667, 'spread_hl_frac': 0.025659966140908333, 'bb_std_mult': 1.0010315113367891, 'rsi_os': 39, 'rsi_ob': 58, 'vol_spike': 0.12425727260280116, 'adx_thresh': 19.172211312155667, 'atr_min_pct': 0.005670622698595465, 'atr_max_pct': 0.14035390397871256, 'tp_mult': 2.353291574609111, 'tsl_mult': 0.8279988282151756, 'strategy': 'breakout', 'time_stop': 40, 'use_sma': True, 'use_atr': True, 'use_adx': False, 'use_ema': False, 'use_spike': True, 'rsi_required': True, 'edge_k': 0.13756198271308856, 'edge_cap': 0.8643547354652265, 'bull_strategy': 'mean_reversion', 'bull_bb_std_mult': 1.9121630734722481, 'bull_rsi_os': 52, 'bull_rsi_ob': 74, 'bull_adx_thresh': 25.88512001559743, 'bull_atr_min_pct': 0.0025334213915811517, 'bull_atr_max_pct': 0.10815867996789591, 'bull_tp_mult': 2.141705252377476, 'bull_tsl_mult': 0.21673558831630813, 'bull_time_stop': 185, 'bull_use_sma': True, 'bull_use_ema': False, 'bull_use_atr': False, 'bull_use_adx': True, 'bull_use_spike': True, 'bull_rsi_required': False, 'bear_strategy': 'breakout', 'bear_bb_std_mult': 1.3203000746686888, 'bear_rsi_os': 44, 'bear_rsi_ob': 62, 'bear_adx_thresh': 20.295282927665244, 'bear_atr_min_pct': 0.02196420133554145, 'bear_atr_max_pct': 0.05823576623696601, 'bear_tp_mult': 2.7190471553337012, 'bear_tsl_mult': 0.19439664555729252, 'bear_time_stop': 36, 'bear_use_sma': False, 'bear_use_ema': True, 'bear_use_atr': False, 'bear_use_adx': False, 'bear_use_spike': False, 'bear_rsi_required': False, 'sideways_strategy': 'mean_reversion', 'sideways_bb_std_mult': 1.9386095829135006, 'sideways_rsi_os': 38, 'sideways_rsi_ob': 60, 'sideways_adx_thresh': 7.542076438263959, 'sideways_atr_min_pct': 0.018420231156952457, 'sideways_atr_max_pct': 0.1174500100357061, 'sideways_tp_mult': 1.7541563287864137, 'sideways_tsl_mult': 0.1898053701074105, 'sideways_time_stop': 14, 'sideways_use_sma': True, 'sideways_use_ema': False, 'sideways_use_atr': True, 'sideways_use_adx': False, 'sideways_use_spike': False, 'sideways_rsi_required': False}.
[I 2025-08-30 19:41:31,687] Trial 500 finished with values: [-1000000000.0, 1000000000.0] and parameters: {'p_sma': 41, 'p_std': 24, 'p_atr': 11, 'p_adx': 25, 'rsi_period': 43, 'ema1': 24, 'ema2': 38, 'slip_atr_k': 0.018108262628508443, 'slip_spread_k': 0.9132239137703586, 'spread_hl_frac': 0.025951908255895804, 'bb_std_mult': 0.5979245448817241, 'rsi_os': 39, 'rsi_ob': 58, 'vol_spike': 0.17398981175219658, 'adx_thresh': 19.160594250245982, 'atr_min_pct': 0.02352667971847705, 'atr_max_pct': 0.08558080799099756, 'tp_mult': 2.1594990220270067, 'tsl_mult': 0.7943816162596822, 'strategy': 'breakout', 'time_stop': 40, 'use_sma': True, 'use_atr': True, 'use_adx': False, 'use_ema': False, 'use_spike': True, 'rsi_required': True, 'edge_k': 1.9063834190374496, 'edge_cap': 0.251450074434138, 'bull_strategy': 'mean_reversion', 'bull_bb_std_mult': 1.9118876934576186, 'bull_rsi_os': 18, 'bull_rsi_ob': 74, 'bull_adx_thresh': 30.46822638514926, 'bull_atr_min_pct': 0.003712942395605807, 'bull_atr_max_pct': 0.03590782831663722, 'bull_tp_mult': 2.922084637067213, 'bull_tsl_mult': 0.9794954748787976, 'bull_time_stop': 67, 'bull_use_sma': True, 'bull_use_ema': False, 'bull_use_atr': False, 'bull_use_adx': True, 'bull_use_spike': True, 'bull_rsi_required': True, 'bear_strategy': 'breakout', 'bear_bb_std_mult': 3.287874616708653, 'bear_rsi_os': 39, 'bear_rsi_ob': 81, 'bear_adx_thresh': 31.36874187912955, 'bear_atr_min_pct': 0.021750055093662332, 'bear_atr_max_pct': 0.05217113846499229, 'bear_tp_mult': 2.8338608797141074, 'bear_tsl_mult': 0.12706405677777433, 'bear_time_stop': 37, 'bear_use_sma': True, 'bear_use_ema': True, 'bear_use_atr': False, 'bear_use_adx': False, 'bear_use_spike': False, 'bear_rsi_required': False, 'sideways_strategy': 'mean_reversion', 'sideways_bb_std_mult': 2.1392858267941284, 'sideways_rsi_os': 16, 'sideways_rsi_ob': 60, 'sideways_adx_thresh': 7.395499483869122, 'sideways_atr_min_pct': 0.007662926707962839, 'sideways_atr_max_pct': 0.1410360905214757, 'sideways_tp_mult': 1.7451814993458834, 'sideways_tsl_mult': 0.6918696707569886, 'sideways_time_stop': 287, 'sideways_use_sma': True, 'sideways_use_ema': True, 'sideways_use_atr': False, 'sideways_use_adx': False, 'sideways_use_spike': False, 'sideways_rsi_required': False}.
[I 2025-08-30 19:41:32,443] Trial 504 finished with values: [-1000000000.0, 1000000000.0] and parameters: {'p_sma': 25, 'p_std': 44, 'p_atr': 21, 'p_adx': 13, 'rsi_period': 33, 'ema1': 23, 'ema2': 31, 'slip_atr_k': 0.027484182841182737, 'slip_spread_k': 0.36479826593271253, 'spread_hl_frac': 0.006519072340549635, 'bb_std_mult': 2.1632834523785434, 'rsi_os': 36, 'rsi_ob': 48, 'vol_spike': 0.03260784258887215, 'adx_thresh': 12.925804164292373, 'atr_min_pct': 0.025191444754763568, 'atr_max_pct': 0.12588592141082836, 'tp_mult': 2.5665311964764896, 'tsl_mult': 0.7568837781153149, 'strategy': 'mean_reversion', 'time_stop': 141, 'use_sma': False, 'use_atr': False, 'use_adx': False, 'use_ema': False, 'use_spike': True, 'rsi_required': True, 'edge_k': 0.8452756700946128, 'edge_cap': 0.7472428242818423, 'bull_strategy': 'mean_reversion', 'bull_bb_std_mult': 2.6029386991344268, 'bull_rsi_os': 26, 'bull_rsi_ob': 71, 'bull_adx_thresh': 18.113318983814796, 'bull_atr_min_pct': 0.0028437599523283355, 'bull_atr_max_pct': 0.02802769717441662, 'bull_tp_mult': 2.252367665243178, 'bull_tsl_mult': 0.45215147132886857, 'bull_time_stop': 215, 'bull_use_sma': True, 'bull_use_ema': False, 'bull_use_atr': False, 'bull_use_adx': True, 'bull_use_spike': True, 'bull_rsi_required': True, 'bear_strategy': 'breakout', 'bear_bb_std_mult': 3.298758642253646, 'bear_rsi_os': 23, 'bear_rsi_ob': 85, 'bear_adx_thresh': 5.140450818693984, 'bear_atr_min_pct': 0.013653385496091788, 'bear_atr_max_pct': 0.11957678954527326, 'bear_tp_mult': 1.6827309101416836, 'bear_tsl_mult': 0.09398531051469595, 'bear_time_stop': 294, 'bear_use_sma': True, 'bear_use_ema': False, 'bear_use_atr': True, 'bear_use_adx': True, 'bear_use_spike': True, 'bear_rsi_required': True, 'sideways_strategy': 'breakout', 'sideways_bb_std_mult': 2.0373796191265785, 'sideways_rsi_os': 34, 'sideways_rsi_ob': 69, 'sideways_adx_thresh': 9.25244308804734, 'sideways_atr_min_pct': 0.019136124135881883, 'sideways_atr_max_pct': 0.12453180061946359, 'sideways_tp_mult': 2.5181466358596944, 'sideways_tsl_mult': 0.6679709250709538, 'sideways_time_stop': 268, 'sideways_use_sma': False, 'sideways_use_ema': True, 'sideways_use_atr': False, 'sideways_use_adx': False, 'sideways_use_spike': True, 'sideways_rsi_required': True}.
[I 2025-08-30 19:42:07,076] Trial 501 finished with values: [-1000000000.0, 1000000000.0] and parameters: {'p_sma': 37, 'p_std': 54, 'p_atr': 9, 'p_adx': 8, 'rsi_period': 47, 'ema1': 23, 'ema2': 45, 'slip_atr_k': 0.01713631835717128, 'slip_spread_k': 0.8393499298283862, 'spread_hl_frac': 0.006748417296092081, 'bb_std_mult': 1.005645257500108, 'rsi_os': 36, 'rsi_ob': 48, 'vol_spike': 0.16382435586983618, 'adx_thresh': 19.144726044873703, 'atr_min_pct': 0.00579007804123262, 'atr_max_pct': 0.08473652767759499, 'tp_mult': 2.1614708426658145, 'tsl_mult': 0.7607924753813721, 'strategy': 'breakout', 'time_stop': 40, 'use_sma': True, 'use_atr': True, 'use_adx': False, 'use_ema': False, 'use_spike': True, 'rsi_required': True, 'edge_k': 0.8228645430220183, 'edge_cap': 0.9563879580604655, 'bull_strategy': 'mean_reversion', 'bull_bb_std_mult': 2.6269631299199365, 'bull_rsi_os': 22, 'bull_rsi_ob': 74, 'bull_adx_thresh': 25.669176461536594, 'bull_atr_min_pct': 0.0028654482195201885, 'bull_atr_max_pct': 0.08331505934490403, 'bull_tp_mult': 2.1771168660702562, 'bull_tsl_mult': 0.9805455397927488, 'bull_time_stop': 166, 'bull_use_sma': True, 'bull_use_ema': False, 'bull_use_atr': False, 'bull_use_adx': True, 'bull_use_spike': True, 'bull_rsi_required': True, 'bear_strategy': 'breakout', 'bear_bb_std_mult': 3.2872604117897866, 'bear_rsi_os': 47, 'bear_rsi_ob': 51, 'bear_adx_thresh': 5.040888342346984, 'bear_atr_min_pct': 0.013758119336258073, 'bear_atr_max_pct': 0.05155392976076008, 'bear_tp_mult': 2.8414314785153185, 'bear_tsl_mult': 0.05598097113219591, 'bear_time_stop': 39, 'bear_use_sma': True, 'bear_use_ema': True, 'bear_use_atr': False, 'bear_use_adx': False, 'bear_use_spike': False, 'bear_rsi_required': False, 'sideways_strategy': 'mean_reversion', 'sideways_bb_std_mult': 2.78611545500298, 'sideways_rsi_os': 37, 'sideways_rsi_ob': 60, 'sideways_adx_thresh': 7.627202687657455, 'sideways_atr_min_pct': 0.02098621997840783, 'sideways_atr_max_pct': 0.07328701869283774, 'sideways_tp_mult': 2.5177786408894414, 'sideways_tsl_mult': 0.15576021328103484, 'sideways_time_stop': 38, 'sideways_use_sma': True, 'sideways_use_ema': True, 'sideways_use_atr': False, 'sideways_use_adx': False, 'sideways_use_spike': False, 'sideways_rsi_required': False}.
[I 2025-08-30 19:42:07,677] Trial 502 finished with values: [-1000000000.0, 1000000000.0] and parameters: {'p_sma': 37, 'p_std': 25, 'p_atr': 8, 'p_adx': 9, 'rsi_period': 50, 'ema1': 23, 'ema2': 18, 'slip_atr_k': 0.019601681351258067, 'slip_spread_k': 0.8389696060209172, 'spread_hl_frac': 0.020841903344575686, 'bb_std_mult': 1.0249133767055572, 'rsi_os': 36, 'rsi_ob': 82, 'vol_spike': 0.02169347136612195, 'adx_thresh': 19.14670298257499, 'atr_min_pct': 0.005696668805029495, 'atr_max_pct': 0.13615719848813543, 'tp_mult': 2.169144882837883, 'tsl_mult': 0.8240789035613758, 'strategy': 'breakout', 'time_stop': 40, 'use_sma': True, 'use_atr': True, 'use_adx': False, 'use_ema': False, 'use_spike': True, 'rsi_required': True, 'edge_k': 0.12075749124727839, 'edge_cap': 0.9458414049580092, 'bull_strategy': 'mean_reversion', 'bull_bb_std_mult': 1.7708961940069994, 'bull_rsi_os': 38, 'bull_rsi_ob': 49, 'bull_adx_thresh': 18.150526065190324, 'bull_atr_min_pct': 0.0043175294900168505, 'bull_atr_max_pct': 0.027958663081225445, 'bull_tp_mult': 2.1460847738201188, 'bull_tsl_mult': 0.9756258043733358, 'bull_time_stop': 167, 'bull_use_sma': True, 'bull_use_ema': False, 'bull_use_atr': False, 'bull_use_adx': True, 'bull_use_spike': True, 'bull_rsi_required': True, 'bear_strategy': 'breakout', 'bear_bb_std_mult': 3.2665703916309536, 'bear_rsi_os': 44, 'bear_rsi_ob': 51, 'bear_adx_thresh': 6.6160696158872145, 'bear_atr_min_pct': 0.013795545502547373, 'bear_atr_max_pct': 0.014702128010791113, 'bear_tp_mult': 1.3505214664723058, 'bear_tsl_mult': 0.09579377067766821, 'bear_time_stop': 40, 'bear_use_sma': True, 'bear_use_ema': True, 'bear_use_atr': False, 'bear_use_adx': False, 'bear_use_spike': True, 'bear_rsi_required': False, 'sideways_strategy': 'mean_reversion', 'sideways_bb_std_mult': 2.020677612835798, 'sideways_rsi_os': 33, 'sideways_rsi_ob': 47, 'sideways_adx_thresh': 9.184198964759506, 'sideways_atr_min_pct': 0.018610318521759497, 'sideways_atr_max_pct': 0.1422513332119055, 'sideways_tp_mult': 1.6745636590654922, 'sideways_tsl_mult': 0.664349025461728, 'sideways_time_stop': 283, 'sideways_use_sma': True, 'sideways_use_ema': True, 'sideways_use_atr': False, 'sideways_use_adx': False, 'sideways_use_spike': False, 'sideways_rsi_required': False}.
