[I 2025-08-30 19:07:42,465] Trial 252 finished with values: [-1000000000.0, 1000000000.0] and parameters: {'p_sma': 41, 'p_std': 60, 'p_atr': 11, 'p_adx': 9, 'rsi_period': 50, 'ema1': 18, 'ema2': 18, 'slip_atr_k': 0.02172023537259128, 'slip_spread_k': 0.4699560076609466, 'spread_hl_frac': 0.0055045719392485355, 'bb_std_mult': 0.5574971597600633, 'rsi_os': 8, 'rsi_ob': 59, 'vol_spike': 0.04784619062048305, 'adx_thresh': 20.190610947143178, 'atr_min_pct': 0.02365479936528275, 'atr_max_pct': 0.09096897895335262, 'tp_mult': 2.0897558931351137, 'tsl_mult': 0.47213219565563064, 'strategy': 'breakout', 'time_stop': 185, 'use_sma': True, 'use_atr': True, 'use_adx': False, 'use_ema': False, 'use_spike': True, 'rsi_required': True, 'edge_k': 1.3530799848168777, 'edge_cap': 0.25767030822945053, 'bull_strategy': 'mean_reversion', 'bull_bb_std_mult': 1.37448860126854, 'bull_rsi_os': 25, 'bull_rsi_ob': 57, 'bull_adx_thresh': 6.605206178650075, 'bull_atr_min_pct': 0.0024004698414482563, 'bull_atr_max_pct': 0.0616054976382773, 'bull_tp_mult': 1.2644153213878897, 'bull_tsl_mult': 0.760822388461401, 'bull_time_stop': 191, 'bull_use_sma': True, 'bull_use_ema': False, 'bull_use_atr': False, 'bull_use_adx': True, 'bull_use_spike': False, 'bull_rsi_required': False, 'bear_strategy': 'breakout', 'bear_bb_std_mult': 1.6805652836368903, 'bear_rsi_os': 31, 'bear_rsi_ob': 53, 'bear_adx_thresh': 31.07258715782008, 'bear_atr_min_pct': 0.014115699661775342, 'bear_atr_max_pct': 0.057385688104349616, 'bear_tp_mult': 2.359770480381306, 'bear_tsl_mult': 0.26315192814806987, 'bear_time_stop': 37, 'bear_use_sma': False, 'bear_use_ema': True, 'bear_use_atr': True, 'bear_use_adx': True, 'bear_use_spike': False, 'bear_rsi_required': False, 'sideways_strategy': 'breakout', 'sideways_bb_std_mult': 1.9273275039999405, 'sideways_rsi_os': 17, 'sideways_rsi_ob': 74, 'sideways_adx_thresh': 17.216221564063936, 'sideways_atr_min_pct': 0.004990015799004301, 'sideways_atr_max_pct': 0.12034550307772277, 'sideways_tp_mult': 1.34358592922852, 'sideways_tsl_mult': 0.22809813890461877, 'sideways_time_stop': 293, 'sideways_use_sma': False, 'sideways_use_ema': True, 'sideways_use_atr': False, 'sideways_use_adx': False, 'sideways_use_spike': False, 'sideways_rsi_required': False}.
[I 2025-08-30 19:08:15,772] Trial 255 finished with values: [-1000000000.0, 1000000000.0] and parameters: {'p_sma': 15, 'p_std': 10, 'p_atr': 23, 'p_adx': 9, 'rsi_period': 52, 'ema1': 18, 'ema2': 17, 'slip_atr_k': 0.14299092052503942, 'slip_spread_k': 0.43209646403612445, 'spread_hl_frac': 0.005406857231897514, 'bb_std_mult': 1.0431923319894025, 'rsi_os': 22, 'rsi_ob': 58, 'vol_spike': 0.16293724125567313, 'adx_thresh': 17.33331287409027, 'atr_min_pct': 0.025609567680927463, 'atr_max_pct': 0.027149684556360035, 'tp_mult': 1.9123459332327377, 'tsl_mult': 0.6983149791990434, 'strategy': 'breakout', 'time_stop': 47, 'use_sma': True, 'use_atr': True, 'use_adx': False, 'use_ema': False, 'use_spike': True, 'rsi_required': False, 'edge_k': 1.2162226447825701, 'edge_cap': 0.24367592067167987, 'bull_strategy': 'mean_reversion', 'bull_bb_std_mult': 0.5874221728100764, 'bull_rsi_os': 49, 'bull_rsi_ob': 79, 'bull_adx_thresh': 25.32081571518713, 'bull_atr_min_pct': 0.00906422772775772, 'bull_atr_max_pct': 0.030242429389779814, 'bull_tp_mult': 2.784794567738088, 'bull_tsl_mult': 0.06700359090802471, 'bull_time_stop': 169, 'bull_use_sma': True, 'bull_use_ema': False, 'bull_use_atr': True, 'bull_use_adx': True, 'bull_use_spike': False, 'bull_rsi_required': True, 'bear_strategy': 'breakout', 'bear_bb_std_mult': 3.2092816569116414, 'bear_rsi_os': 44, 'bear_rsi_ob': 64, 'bear_adx_thresh': 6.450673496443177, 'bear_atr_min_pct': 0.014230227185528757, 'bear_atr_max_pct': 0.10798760629028686, 'bear_tp_mult': 1.822315650442973, 'bear_tsl_mult': 0.10905414735663427, 'bear_time_stop': 17, 'bear_use_sma': False, 'bear_use_ema': True, 'bear_use_atr': True, 'bear_use_adx': True, 'bear_use_spike': False, 'bear_rsi_required': False, 'sideways_strategy': 'breakout', 'sideways_bb_std_mult': 2.0244293094992147, 'sideways_rsi_os': 11, 'sideways_rsi_ob': 61, 'sideways_adx_thresh': 10.206857837846732, 'sideways_atr_min_pct': 0.004989085621561449, 'sideways_atr_max_pct': 0.1203084515828313, 'sideways_tp_mult': 1.8711641823869458, 'sideways_tsl_mult': 0.8366303054103081, 'sideways_time_stop': 64, 'sideways_use_sma': True, 'sideways_use_ema': True, 'sideways_use_atr': False, 'sideways_use_adx': False, 'sideways_use_spike': False, 'sideways_rsi_required': False}.
[I 2025-08-30 19:08:15,814] Trial 253 finished with values: [-1000000000.0, 1000000000.0] and parameters: {'p_sma': 41, 'p_std': 47, 'p_atr': 11, 'p_adx': 9, 'rsi_period': 51, 'ema1': 24, 'ema2': 17, 'slip_atr_k': 0.14003353551540465, 'slip_spread_k': 0.04812983918481778, 'spread_hl_frac': 0.005504645187673244, 'bb_std_mult': 0.554134098149546, 'rsi_os': 38, 'rsi_ob': 58, 'vol_spike': 0.16267732158983345, 'adx_thresh': 9.336761083214205, 'atr_min_pct': 0.015084854198847909, 'atr_max_pct': 0.12777071609302376, 'tp_mult': 1.9050474617900617, 'tsl_mult': 0.730352712474108, 'strategy': 'breakout', 'time_stop': 27, 'use_sma': True, 'use_atr': True, 'use_adx': False, 'use_ema': False, 'use_spike': True, 'rsi_required': False, 'edge_k': 0.21601222411670024, 'edge_cap': 0.19386132368368422, 'bull_strategy': 'breakout', 'bull_bb_std_mult': 1.8908086249399774, 'bull_rsi_os': 49, 'bull_rsi_ob': 71, 'bull_adx_thresh': 9.020681972312657, 'bull_atr_min_pct': 0.007831533612988491, 'bull_atr_max_pct': 0.09735023824688317, 'bull_tp_mult': 2.2015169815296334, 'bull_tsl_mult': 0.7552939588210755, 'bull_time_stop': 169, 'bull_use_sma': True, 'bull_use_ema': False, 'bull_use_atr': False, 'bull_use_adx': True, 'bull_use_spike': False, 'bull_rsi_required': True, 'bear_strategy': 'breakout', 'bear_bb_std_mult': 3.285801559998277, 'bear_rsi_os': 44, 'bear_rsi_ob': 83, 'bear_adx_thresh': 26.362491919736712, 'bear_atr_min_pct': 0.014120802080785344, 'bear_atr_max_pct': 0.057867758669403746, 'bear_tp_mult': 1.8194961557656657, 'bear_tsl_mult': 0.386424784678525, 'bear_time_stop': 292, 'bear_use_sma': False, 'bear_use_ema': True, 'bear_use_atr': True, 'bear_use_adx': True, 'bear_use_spike': False, 'bear_rsi_required': False, 'sideways_strategy': 'breakout', 'sideways_bb_std_mult': 2.129818085600156, 'sideways_rsi_os': 6, 'sideways_rsi_ob': 59, 'sideways_adx_thresh': 9.3726575825891, 'sideways_atr_min_pct': 0.018954232351009008, 'sideways_atr_max_pct': 0.025273845474299103, 'sideways_tp_mult': 1.5771655474483943, 'sideways_tsl_mult': 0.6669042064412098, 'sideways_time_stop': 69, 'sideways_use_sma': True, 'sideways_use_ema': True, 'sideways_use_atr': False, 'sideways_use_adx': False, 'sideways_use_spike': False, 'sideways_rsi_required': False}.
[I 2025-08-30 19:08:16,268] Trial 254 finished with values: [-1000000000.0, 1000000000.0] and parameters: {'p_sma': 41, 'p_std': 10, 'p_atr': 11, 'p_adx': 9, 'rsi_period': 44, 'ema1': 18, 'ema2': 24, 'slip_atr_k': 0.010216433316218031, 'slip_spread_k': 0.04581147726255874, 'spread_hl_frac': 0.0032129514442296586, 'bb_std_mult': 0.5367732817997881, 'rsi_os': 38, 'rsi_ob': 74, 'vol_spike': 0.2722458899595041, 'adx_thresh': 17.473701384089207, 'atr_min_pct': 0.021966217495611073, 'atr_max_pct': 0.12851300526238219, 'tp_mult': 2.0922814015054008, 'tsl_mult': 0.2486710051800306, 'strategy': 'breakout', 'time_stop': 46, 'use_sma': True, 'use_atr': True, 'use_adx': False, 'use_ema': False, 'use_spike': True, 'rsi_required': False, 'edge_k': 0.3693461242343544, 'edge_cap': 0.1901096388936215, 'bull_strategy': 'breakout', 'bull_bb_std_mult': 3.3061996367923885, 'bull_rsi_os': 25, 'bull_rsi_ob': 71, 'bull_adx_thresh': 6.810349882045102, 'bull_atr_min_pct': 0.0031569093427909717, 'bull_atr_max_pct': 0.13958882702595876, 'bull_tp_mult': 2.7500714429792055, 'bull_tsl_mult': 0.9558238919989275, 'bull_time_stop': 192, 'bull_use_sma': True, 'bull_use_ema': False, 'bull_use_atr': False, 'bull_use_adx': True, 'bull_use_spike': False, 'bull_rsi_required': True, 'bear_strategy': 'breakout', 'bear_bb_std_mult': 3.288044443801834, 'bear_rsi_os': 43, 'bear_rsi_ob': 83, 'bear_adx_thresh': 19.1050672581581, 'bear_atr_min_pct': 0.014233015064835826, 'bear_atr_max_pct': 0.10203339272213346, 'bear_tp_mult': 1.8229627256556427, 'bear_tsl_mult': 0.3202410536196024, 'bear_time_stop': 36, 'bear_use_sma': False, 'bear_use_ema': True, 'bear_use_atr': True, 'bear_use_adx': True, 'bear_use_spike': False, 'bear_rsi_required': False, 'sideways_strategy': 'breakout', 'sideways_bb_std_mult': 2.1483939481407455, 'sideways_rsi_os': 40, 'sideways_rsi_ob': 59, 'sideways_adx_thresh': 10.090830104262889, 'sideways_atr_min_pct': 0.019031822859385056, 'sideways_atr_max_pct': 0.1323778198849676, 'sideways_tp_mult': 2.8075986960384904, 'sideways_tsl_mult': 0.8375887600699374, 'sideways_time_stop': 66, 'sideways_use_sma': True, 'sideways_use_ema': True, 'sideways_use_atr': False, 'sideways_use_adx': False, 'sideways_use_spike': False, 'sideways_rsi_required': False}.
[I 2025-08-30 19:08:16,427] Trial 256 finished with values: [-1000000000.0, 1000000000.0] and parameters: {'p_sma': 41, 'p_std': 46, 'p_atr': 9, 'p_adx': 9, 'rsi_period': 44, 'ema1': 25, 'ema2': 17, 'slip_atr_k': 0.1360732662399848, 'slip_spread_k': 0.43297339912533356, 'spread_hl_frac': 0.005299584003752411, 'bb_std_mult': 1.0390735187763853, 'rsi_os': 22, 'rsi_ob': 57, 'vol_spike': 0.03412641543544513, 'adx_thresh': 17.329102914518142, 'atr_min_pct': 0.012104154076689718, 'atr_max_pct': 0.026844808284994526, 'tp_mult': 1.339325301003815, 'tsl_mult': 0.6980492892944924, 'strategy': 'breakout', 'time_stop': 48, 'use_sma': True, 'use_atr': True, 'use_adx': False, 'use_ema': False, 'use_spike': True, 'rsi_required': False, 'edge_k': 0.23228482842967146, 'edge_cap': 0.4954870078174343, 'bull_strategy': 'mean_reversion', 'bull_bb_std_mult': 0.6765674791452292, 'bull_rsi_os': 50, 'bull_rsi_ob': 73, 'bull_adx_thresh': 25.139788283444574, 'bull_atr_min_pct': 0.009062165388477886, 'bull_atr_max_pct': 0.09289731114198795, 'bull_tp_mult': 2.1507549670974533, 'bull_tsl_mult': 0.4668009398155832, 'bull_time_stop': 128, 'bull_use_sma': True, 'bull_use_ema': False, 'bull_use_atr': True, 'bull_use_adx': False, 'bull_use_spike': False, 'bull_rsi_required': True, 'bear_strategy': 'breakout', 'bear_bb_std_mult': 2.560877864897974, 'bear_rsi_os': 25, 'bear_rsi_ob': 50, 'bear_adx_thresh': 19.158771940169828, 'bear_atr_min_pct': 0.01451319002757526, 'bear_atr_max_pct': 0.010248864733961124, 'bear_tp_mult': 1.8353011078245933, 'bear_tsl_mult': 0.10456774063380589, 'bear_time_stop': 160, 'bear_use_sma': False, 'bear_use_ema': True, 'bear_use_atr': True, 'bear_use_adx': True, 'bear_use_spike': False, 'bear_rsi_required': False, 'sideways_strategy': 'breakout', 'sideways_bb_std_mult': 2.022860815080984, 'sideways_rsi_os': 40, 'sideways_rsi_ob': 59, 'sideways_adx_thresh': 10.21026040472974, 'sideways_atr_min_pct': 0.006071640365819014, 'sideways_atr_max_pct': 0.1336249337586733, 'sideways_tp_mult': 1.5774595116044428, 'sideways_tsl_mult': 0.644740825408036, 'sideways_time_stop': 272, 'sideways_use_sma': True, 'sideways_use_ema': True, 'sideways_use_atr': False, 'sideways_use_adx': False, 'sideways_use_spike': True, 'sideways_rsi_required': False}.
[I 2025-08-30 19:08:50,181] Trial 260 finished with values: [-1000000000.0, 1000000000.0] and parameters: {'p_sma': 20, 'p_std': 27, 'p_atr': 10, 'p_adx': 10, 'rsi_period': 10, 'ema1': 23, 'ema2': 53, 'slip_atr_k': 0.017039364485796467, 'slip_spread_k': 0.5210963058217034, 'spread_hl_frac': 0.03001423420426374, 'bb_std_mult': 0.8544313800871196, 'rsi_os': 37, 'rsi_ob': 55, 'vol_spike': 0.023889582533964032, 'adx_thresh': 10.876620561049563, 'atr_min_pct': 0.02288245790288274, 'atr_max_pct': 0.1170330215550632, 'tp_mult': 2.184792875677214, 'tsl_mult': 0.33280640411379775, 'strategy': 'mean_reversion', 'time_stop': 20, 'use_sma': False, 'use_atr': False, 'use_adx': True, 'use_ema': False, 'use_spike': True, 'rsi_required': True, 'edge_k': 1.0816737625174753, 'edge_cap': 0.9976437727977232, 'bull_strategy': 'mean_reversion', 'bull_bb_std_mult': 1.638268363941218, 'bull_rsi_os': 37, 'bull_rsi_ob': 75, 'bull_adx_thresh': 24.39029018269846, 'bull_atr_min_pct': 0.022930496520394077, 'bull_atr_max_pct': 0.03488745591598158, 'bull_tp_mult': 1.0129345615389078, 'bull_tsl_mult': 0.9364853580755772, 'bull_time_stop': 295, 'bull_use_sma': True, 'bull_use_ema': True, 'bull_use_atr': False, 'bull_use_adx': False, 'bull_use_spike': True, 'bull_rsi_required': True, 'bear_strategy': 'breakout', 'bear_bb_std_mult': 1.0099008353598922, 'bear_rsi_os': 49, 'bear_rsi_ob': 67, 'bear_adx_thresh': 5.850493393673978, 'bear_atr_min_pct': 0.0073508183078801964, 'bear_atr_max_pct': 0.06611016469510532, 'bear_tp_mult': 1.9864299095985456, 'bear_tsl_mult': 0.1361667798818308, 'bear_time_stop': 28, 'bear_use_sma': True, 'bear_use_ema': False, 'bear_use_atr': True, 'bear_use_adx': True, 'bear_use_spike': True, 'bear_rsi_required': False, 'sideways_strategy': 'mean_reversion', 'sideways_bb_std_mult': 2.625177882116417, 'sideways_rsi_os': 25, 'sideways_rsi_ob': 55, 'sideways_adx_thresh': 18.256485273437267, 'sideways_atr_min_pct': 0.017726995931364304, 'sideways_atr_max_pct': 0.11371439952894173, 'sideways_tp_mult': 2.923980930348012, 'sideways_tsl_mult': 0.7074694186486642, 'sideways_time_stop': 109, 'sideways_use_sma': True, 'sideways_use_ema': False, 'sideways_use_atr': True, 'sideways_use_adx': False, 'sideways_use_spike': True, 'sideways_rsi_required': True}.
[I 2025-08-30 19:08:50,597] Trial 258 finished with values: [-1000000000.0, 1000000000.0] and parameters: {'p_sma': 44, 'p_std': 56, 'p_atr': 10, 'p_adx': 14, 'rsi_period': 42, 'ema1': 26, 'ema2': 36, 'slip_atr_k': 0.009398433460550014, 'slip_spread_k': 0.44607956437873164, 'spread_hl_frac': 0.044053588448398046, 'bb_std_mult': 1.4317902956085737, 'rsi_os': 14, 'rsi_ob': 74, 'vol_spike': 0.03220815143461697, 'adx_thresh': 21.67552197222727, 'atr_min_pct': 0.022333588021206722, 'atr_max_pct': 0.14194180455989286, 'tp_mult': 2.8470759602409856, 'tsl_mult': 0.7514921361166869, 'strategy': 'mean_reversion', 'time_stop': 50, 'use_sma': False, 'use_atr': False, 'use_adx': True, 'use_ema': False, 'use_spike': True, 'rsi_required': True, 'edge_k': 0.7446909864368563, 'edge_cap': 0.5227767904323001, 'bull_strategy': 'mean_reversion', 'bull_bb_std_mult': 2.70650072472711, 'bull_rsi_os': 51, 'bull_rsi_ob': 75, 'bull_adx_thresh': 24.695289544129604, 'bull_atr_min_pct': 0.002962094619872445, 'bull_atr_max_pct': 0.022521348061925423, 'bull_tp_mult': 1.7529211235923543, 'bull_tsl_mult': 0.5944238168370098, 'bull_time_stop': 128, 'bull_use_sma': True, 'bull_use_ema': True, 'bull_use_atr': False, 'bull_use_adx': False, 'bull_use_spike': True, 'bull_rsi_required': True, 'bear_strategy': 'breakout', 'bear_bb_std_mult': 1.2710012009461997, 'bear_rsi_os': 42, 'bear_rsi_ob': 80, 'bear_adx_thresh': 16.009308739617964, 'bear_atr_min_pct': 0.009852434212756672, 'bear_atr_max_pct': 0.10225745745309245, 'bear_tp_mult': 1.7210856839525972, 'bear_tsl_mult': 0.1425472741509527, 'bear_time_stop': 28, 'bear_use_sma': True, 'bear_use_ema': False, 'bear_use_atr': True, 'bear_use_adx': True, 'bear_use_spike': False, 'bear_rsi_required': False, 'sideways_strategy': 'mean_reversion', 'sideways_bb_std_mult': 1.991005764186368, 'sideways_rsi_os': 40, 'sideways_rsi_ob': 84, 'sideways_adx_thresh': 16.013720448455274, 'sideways_atr_min_pct': 0.006063080737165636, 'sideways_atr_max_pct': 0.11420908271824438, 'sideways_tp_mult': 2.808554581507357, 'sideways_tsl_mult': 0.6516204439536571, 'sideways_time_stop': 274, 'sideways_use_sma': True, 'sideways_use_ema': True, 'sideways_use_atr': False, 'sideways_use_adx': False, 'sideways_use_spike': True, 'sideways_rsi_required': True}.
[I 2025-08-30 19:08:50,747] Trial 257 finished with values: [-1000000000.0, 1000000000.0] and parameters: {'p_sma': 53, 'p_std': 27, 'p_atr': 10, 'p_adx': 10, 'rsi_period': 10, 'ema1': 26, 'ema2': 37, 'slip_atr_k': 0.016632752253872014, 'slip_spread_k': 0.7590059061808581, 'spread_hl_frac': 0.002051233280097141, 'bb_std_mult': 0.8309761583548553, 'rsi_os': 49, 'rsi_ob': 57, 'vol_spike': 0.13929799873155954, 'adx_thresh': 19.47682762968825, 'atr_min_pct': 0.022033939041718492, 'atr_max_pct': 0.022953721656558353, 'tp_mult': 1.3333796469955024, 'tsl_mult': 0.7678881676191973, 'strategy': 'mean_reversion', 'time_stop': 120, 'use_sma': False, 'use_atr': False, 'use_adx': True, 'use_ema': False, 'use_spike': True, 'rsi_required': True, 'edge_k': 0.09576551656691985, 'edge_cap': 0.5293882103746325, 'bull_strategy': 'mean_reversion', 'bull_bb_std_mult': 2.012003205987035, 'bull_rsi_os': 50, 'bull_rsi_ob': 75, 'bull_adx_thresh': 5.493237687289833, 'bull_atr_min_pct': 0.022833080330173394, 'bull_atr_max_pct': 0.028389720960724965, 'bull_tp_mult': 1.686598401792491, 'bull_tsl_mult': 0.9487312803036378, 'bull_time_stop': 181, 'bull_use_sma': True, 'bull_use_ema': True, 'bull_use_atr': False, 'bull_use_adx': False, 'bull_use_spike': True, 'bull_rsi_required': True, 'bear_strategy': 'breakout', 'bear_bb_std_mult': 1.0207142682150092, 'bear_rsi_os': 49, 'bear_rsi_ob': 80, 'bear_adx_thresh': 5.762759323836027, 'bear_atr_min_pct': 0.014968724980999198, 'bear_atr_max_pct': 0.02411100227007948, 'bear_tp_mult': 1.8763473652016147, 'bear_tsl_mult': 0.3180064049649455, 'bear_time_stop': 37, 'bear_use_sma': True, 'bear_use_ema': False, 'bear_use_atr': True, 'bear_use_adx': True, 'bear_use_spike': False, 'bear_rsi_required': False, 'sideways_strategy': 'mean_reversion', 'sideways_bb_std_mult': 2.6289518888744023, 'sideways_rsi_os': 41, 'sideways_rsi_ob': 57, 'sideways_adx_thresh': 31.990870175572162, 'sideways_atr_min_pct': 0.024606870064311052, 'sideways_atr_max_pct': 0.1253449986465787, 'sideways_tp_mult': 2.263334269964232, 'sideways_tsl_mult': 0.7121127690359648, 'sideways_time_stop': 272, 'sideways_use_sma': True, 'sideways_use_ema': True, 'sideways_use_atr': False, 'sideways_use_adx': False, 'sideways_use_spike': True, 'sideways_rsi_required': True}.
[I 2025-08-30 19:08:50,821] Trial 259 finished with values: [-1000000000.0, 1000000000.0] and parameters: {'p_sma': 44, 'p_std': 28, 'p_atr': 9, 'p_adx': 12, 'rsi_period': 75, 'ema1': 25, 'ema2': 19, 'slip_atr_k': 0.0767934678369622, 'slip_spread_k': 0.1215749755754858, 'spread_hl_frac': 0.04533840803970548, 'bb_std_mult': 0.8645727385194153, 'rsi_os': 14, 'rsi_ob': 57, 'vol_spike': 0.03241339010668398, 'adx_thresh': 21.619848502198046, 'atr_min_pct': 0.02270892567455355, 'atr_max_pct': 0.09751689800511788, 'tp_mult': 2.1910511429378943, 'tsl_mult': 0.7620360232320356, 'strategy': 'mean_reversion', 'time_stop': 136, 'use_sma': False, 'use_atr': False, 'use_adx': True, 'use_ema': False, 'use_spike': True, 'rsi_required': True, 'edge_k': 0.10836905882678338, 'edge_cap': 0.6661990670169379, 'bull_strategy': 'mean_reversion', 'bull_bb_std_mult': 3.2233321884389765, 'bull_rsi_os': 37, 'bull_rsi_ob': 73, 'bull_adx_thresh': 24.440580392209885, 'bull_atr_min_pct': 0.02300492129982503, 'bull_atr_max_pct': 0.035306970960996484, 'bull_tp_mult': 2.1590187628168067, 'bull_tsl_mult': 0.8419322367055835, 'bull_time_stop': 181, 'bull_use_sma': True, 'bull_use_ema': True, 'bull_use_atr': True, 'bull_use_adx': False, 'bull_use_spike': True, 'bull_rsi_required': True, 'bear_strategy': 'breakout', 'bear_bb_std_mult': 1.261982220222611, 'bear_rsi_os': 42, 'bear_rsi_ob': 59, 'bear_adx_thresh': 9.074579466060731, 'bear_atr_min_pct': 0.00728856847678061, 'bear_atr_max_pct': 0.02500059090807781, 'bear_tp_mult': 1.8743650820386293, 'bear_tsl_mult': 0.06766199256016175, 'bear_time_stop': 112, 'bear_use_sma': True, 'bear_use_ema': False, 'bear_use_atr': True, 'bear_use_adx': True, 'bear_use_spike': True, 'bear_rsi_required': False, 'sideways_strategy': 'mean_reversion', 'sideways_bb_std_mult': 1.9826132542760397, 'sideways_rsi_os': 29, 'sideways_rsi_ob': 55, 'sideways_adx_thresh': 22.78084709431848, 'sideways_atr_min_pct': 0.026574714589960975, 'sideways_atr_max_pct': 0.11356031496364258, 'sideways_tp_mult': 1.735368968652133, 'sideways_tsl_mult': 0.19843368220827234, 'sideways_time_stop': 271, 'sideways_use_sma': True, 'sideways_use_ema': True, 'sideways_use_atr': True, 'sideways_use_adx': False, 'sideways_use_spike': True, 'sideways_rsi_required': True}.
