[I 2025-08-30 20:26:46,819] Trial 827 finished with values: [-1000000000.0, 1000000000.0] and parameters: {'p_sma': 47, 'p_std': 10, 'p_atr': 11, 'p_adx': 7, 'rsi_period': 83, 'ema1': 12, 'ema2': 13, 'slip_atr_k': 0.014360879932361478, 'slip_spread_k': 0.6472320171257109, 'spread_hl_frac': 0.04011435178348431, 'bb_std_mult': 1.1686797435868144, 'rsi_os': 23, 'rsi_ob': 66, 'vol_spike': 0.12699497770675003, 'adx_thresh': 22.3714339175232, 'atr_min_pct': 0.021393842575939778, 'atr_max_pct': 0.12626285351438604, 'tp_mult': 2.371792770121141, 'tsl_mult': 0.6691310223256273, 'strategy': 'breakout', 'time_stop': 59, 'use_sma': False, 'use_atr': True, 'use_adx': False, 'use_ema': False, 'use_spike': True, 'rsi_required': True, 'edge_k': 1.427101005389929, 'edge_cap': 0.37297120681097484, 'bull_strategy': 'mean_reversion', 'bull_bb_std_mult': 1.6494019072930393, 'bull_rsi_os': 17, 'bull_rsi_ob': 93, 'bull_adx_thresh': 23.91506842531517, 'bull_atr_min_pct': 0.007388941751092721, 'bull_atr_max_pct': 0.08129148354376206, 'bull_tp_mult': 1.994847267320815, 'bull_tsl_mult': 0.9048012165438698, 'bull_time_stop': 205, 'bull_use_sma': True, 'bull_use_ema': False, 'bull_use_atr': True, 'bull_use_adx': False, 'bull_use_spike': True, 'bull_rsi_required': True, 'bear_strategy': 'breakout', 'bear_bb_std_mult': 3.4902825333258947, 'bear_rsi_os': 48, 'bear_rsi_ob': 48, 'bear_adx_thresh': 5.388740058069596, 'bear_atr_min_pct': 0.009763249725021485, 'bear_atr_max_pct': 0.10796738873409384, 'bear_tp_mult': 2.9951404916705413, 'bear_tsl_mult': 0.17026999602477966, 'bear_time_stop': 6, 'bear_use_sma': True, 'bear_use_ema': True, 'bear_use_atr': False, 'bear_use_adx': False, 'bear_use_spike': False, 'bear_rsi_required': True, 'sideways_strategy': 'mean_reversion', 'sideways_bb_std_mult': 2.238180707707727, 'sideways_rsi_os': 22, 'sideways_rsi_ob': 55, 'sideways_adx_thresh': 27.13843445143565, 'sideways_atr_min_pct': 0.026418785218856263, 'sideways_atr_max_pct': 0.0402846410047067, 'sideways_tp_mult': 1.3336684614094974, 'sideways_tsl_mult': 0.8310839486917495, 'sideways_time_stop': 289, 'sideways_use_sma': False, 'sideways_use_ema': True, 'sideways_use_atr': False, 'sideways_use_adx': False, 'sideways_use_spike': True, 'sideways_rsi_required': True}.
[I 2025-08-30 20:27:20,660] Trial 832 finished with values: [-1000000000.0, 1000000000.0] and parameters: {'p_sma': 46, 'p_std': 7, 'p_atr': 10, 'p_adx': 7, 'rsi_period': 81, 'ema1': 13, 'ema2': 13, 'slip_atr_k': 0.007592503542761378, 'slip_spread_k': 0.615989887513388, 'spread_hl_frac': 0.03571933657388758, 'bb_std_mult': 1.254142349366892, 'rsi_os': 38, 'rsi_ob': 65, 'vol_spike': 0.1431207528390827, 'adx_thresh': 21.717928369613098, 'atr_min_pct': 0.021337150201282205, 'atr_max_pct': 0.1236042204369326, 'tp_mult': 2.3465682696372614, 'tsl_mult': 0.697757691398569, 'strategy': 'breakout', 'time_stop': 51, 'use_sma': True, 'use_atr': False, 'use_adx': False, 'use_ema': False, 'use_spike': True, 'rsi_required': True, 'edge_k': 1.3280826372762, 'edge_cap': 0.5486249940430887, 'bull_strategy': 'breakout', 'bull_bb_std_mult': 1.7783187627679604, 'bull_rsi_os': 25, 'bull_rsi_ob': 70, 'bull_adx_thresh': 23.187717448200033, 'bull_atr_min_pct': 0.009442848730445302, 'bull_atr_max_pct': 0.08744255207550192, 'bull_tp_mult': 2.058138043411343, 'bull_tsl_mult': 0.9127982010482811, 'bull_time_stop': 200, 'bull_use_sma': False, 'bull_use_ema': False, 'bull_use_atr': False, 'bull_use_adx': True, 'bull_use_spike': True, 'bull_rsi_required': True, 'bear_strategy': 'breakout', 'bear_bb_std_mult': 3.485403924718616, 'bear_rsi_os': 47, 'bear_rsi_ob': 50, 'bear_adx_thresh': 5.537710963566122, 'bear_atr_min_pct': 0.008217506695466052, 'bear_atr_max_pct': 0.09608571037261049, 'bear_tp_mult': 2.886829657633416, 'bear_tsl_mult': 0.1327995767387866, 'bear_time_stop': 12, 'bear_use_sma': True, 'bear_use_ema': False, 'bear_use_atr': True, 'bear_use_adx': True, 'bear_use_spike': True, 'bear_rsi_required': True, 'sideways_strategy': 'mean_reversion', 'sideways_bb_std_mult': 2.126845934324797, 'sideways_rsi_os': 21, 'sideways_rsi_ob': 55, 'sideways_adx_thresh': 27.75087615518992, 'sideways_atr_min_pct': 0.025127999592234548, 'sideways_atr_max_pct': 0.033669903074032025, 'sideways_tp_mult': 1.235045935245827, 'sideways_tsl_mult': 0.8961583232960068, 'sideways_time_stop': 289, 'sideways_use_sma': False, 'sideways_use_ema': False, 'sideways_use_atr': True, 'sideways_use_adx': True, 'sideways_use_spike': False, 'sideways_rsi_required': True}.
[I 2025-08-30 20:27:20,660] Trial 831 finished with values: [-1000000000.0, 1000000000.0] and parameters: {'p_sma': 46, 'p_std': 8, 'p_atr': 15, 'p_adx': 7, 'rsi_period': 81, 'ema1': 15, 'ema2': 14, 'slip_atr_k': 0.010674974743266842, 'slip_spread_k': 0.6124638669628861, 'spread_hl_frac': 0.035369036895495774, 'bb_std_mult': 1.1513342807880316, 'rsi_os': 41, 'rsi_ob': 63, 'vol_spike': 0.13731934524916098, 'adx_thresh': 21.909915548397038, 'atr_min_pct': 0.022312999031206322, 'atr_max_pct': 0.13055478465870898, 'tp_mult': 2.3357966665728767, 'tsl_mult': 0.6854854759324205, 'strategy': 'breakout', 'time_stop': 48, 'use_sma': True, 'use_atr': False, 'use_adx': False, 'use_ema': False, 'use_spike': True, 'rsi_required': True, 'edge_k': 1.3127652127781593, 'edge_cap': 0.5105579828454427, 'bull_strategy': 'breakout', 'bull_bb_std_mult': 1.728066490438884, 'bull_rsi_os': 21, 'bull_rsi_ob': 46, 'bull_adx_thresh': 24.210465202391376, 'bull_atr_min_pct': 0.009938150003990624, 'bull_atr_max_pct': 0.08625883399211377, 'bull_tp_mult': 2.0428775968166444, 'bull_tsl_mult': 0.9190803227562888, 'bull_time_stop': 199, 'bull_use_sma': False, 'bull_use_ema': False, 'bull_use_atr': False, 'bull_use_adx': True, 'bull_use_spike': True, 'bull_rsi_required': True, 'bear_strategy': 'breakout', 'bear_bb_std_mult': 3.478359412680523, 'bear_rsi_os': 47, 'bear_rsi_ob': 45, 'bear_adx_thresh': 5.032264323817984, 'bear_atr_min_pct': 0.008438097554247423, 'bear_atr_max_pct': 0.09440704322507759, 'bear_tp_mult': 2.946906137719027, 'bear_tsl_mult': 0.21287694729437784, 'bear_time_stop': 11, 'bear_use_sma': True, 'bear_use_ema': False, 'bear_use_atr': True, 'bear_use_adx': True, 'bear_use_spike': True, 'bear_rsi_required': True, 'sideways_strategy': 'mean_reversion', 'sideways_bb_std_mult': 2.147668886129013, 'sideways_rsi_os': 24, 'sideways_rsi_ob': 54, 'sideways_adx_thresh': 28.027845163551333, 'sideways_atr_min_pct': 0.02511281125051968, 'sideways_atr_max_pct': 0.03206632436698866, 'sideways_tp_mult': 1.2214881848068433, 'sideways_tsl_mult': 0.86761024229074, 'sideways_time_stop': 287, 'sideways_use_sma': False, 'sideways_use_ema': False, 'sideways_use_atr': True, 'sideways_use_adx': True, 'sideways_use_spike': False, 'sideways_rsi_required': True}.
[I 2025-08-30 20:27:21,673] Trial 829 finished with values: [-1000000000.0, 1000000000.0] and parameters: {'p_sma': 46, 'p_std': 7, 'p_atr': 16, 'p_adx': 7, 'rsi_period': 81, 'ema1': 13, 'ema2': 13, 'slip_atr_k': 0.013093777689857127, 'slip_spread_k': 0.6098891786975305, 'spread_hl_frac': 0.038163930866621266, 'bb_std_mult': 1.1220441561239118, 'rsi_os': 41, 'rsi_ob': 66, 'vol_spike': 0.14721810578764086, 'adx_thresh': 22.367416757567483, 'atr_min_pct': 0.0221896502013997, 'atr_max_pct': 0.12710717867540047, 'tp_mult': 2.3049157225057577, 'tsl_mult': 0.6998441596597773, 'strategy': 'breakout', 'time_stop': 51, 'use_sma': True, 'use_atr': True, 'use_adx': False, 'use_ema': False, 'use_spike': True, 'rsi_required': True, 'edge_k': 1.3848152696395395, 'edge_cap': 0.4937655536124476, 'bull_strategy': 'mean_reversion', 'bull_bb_std_mult': 1.6502555960764442, 'bull_rsi_os': 26, 'bull_rsi_ob': 59, 'bull_adx_thresh': 23.82928393930893, 'bull_atr_min_pct': 0.007478912593745618, 'bull_atr_max_pct': 0.08510503276577235, 'bull_tp_mult': 1.995489890093901, 'bull_tsl_mult': 0.9016643387380159, 'bull_time_stop': 204, 'bull_use_sma': True, 'bull_use_ema': False, 'bull_use_atr': True, 'bull_use_adx': False, 'bull_use_spike': True, 'bull_rsi_required': True, 'bear_strategy': 'breakout', 'bear_bb_std_mult': 3.4656408749340084, 'bear_rsi_os': 48, 'bear_rsi_ob': 45, 'bear_adx_thresh': 5.032996887012164, 'bear_atr_min_pct': 0.008667852649545236, 'bear_atr_max_pct': 0.10857971152109842, 'bear_tp_mult': 2.8886762942806192, 'bear_tsl_mult': 0.1499507149786595, 'bear_time_stop': 11, 'bear_use_sma': True, 'bear_use_ema': True, 'bear_use_atr': False, 'bear_use_adx': False, 'bear_use_spike': False, 'bear_rsi_required': True, 'sideways_strategy': 'mean_reversion', 'sideways_bb_std_mult': 2.236056730782844, 'sideways_rsi_os': 23, 'sideways_rsi_ob': 55, 'sideways_adx_thresh': 27.21470230798677, 'sideways_atr_min_pct': 0.02678437945494967, 'sideways_atr_max_pct': 0.032220646068019304, 'sideways_tp_mult': 1.3414679199650876, 'sideways_tsl_mult': 0.8903681517362975, 'sideways_time_stop': 294, 'sideways_use_sma': False, 'sideways_use_ema': True, 'sideways_use_atr': False, 'sideways_use_adx': False, 'sideways_use_spike': True, 'sideways_rsi_required': True}.
[I 2025-08-30 20:27:21,953] Trial 830 finished with values: [-1000000000.0, 1000000000.0] and parameters: {'p_sma': 46, 'p_std': 10, 'p_atr': 11, 'p_adx': 7, 'rsi_period': 81, 'ema1': 13, 'ema2': 13, 'slip_atr_k': 0.011974198921207461, 'slip_spread_k': 0.6085406242473339, 'spread_hl_frac': 0.04070743406956733, 'bb_std_mult': 1.1241930040072359, 'rsi_os': 23, 'rsi_ob': 65, 'vol_spike': 0.13936771120280675, 'adx_thresh': 21.902535695529348, 'atr_min_pct': 0.021362333131488696, 'atr_max_pct': 0.12727809632205064, 'tp_mult': 2.3638671203127473, 'tsl_mult': 0.6943225339380635, 'strategy': 'breakout', 'time_stop': 50, 'use_sma': False, 'use_atr': False, 'use_adx': False, 'use_ema': False, 'use_spike': True, 'rsi_required': True, 'edge_k': 1.2880880335149352, 'edge_cap': 0.5055584771896663, 'bull_strategy': 'mean_reversion', 'bull_bb_std_mult': 1.6916756141960514, 'bull_rsi_os': 21, 'bull_rsi_ob': 65, 'bull_adx_thresh': 24.290146295308936, 'bull_atr_min_pct': 0.009395099826417097, 'bull_atr_max_pct': 0.08448424014842765, 'bull_tp_mult': 2.0090888242877956, 'bull_tsl_mult': 0.9062800482909189, 'bull_time_stop': 203, 'bull_use_sma': True, 'bull_use_ema': False, 'bull_use_atr': False, 'bull_use_adx': True, 'bull_use_spike': True, 'bull_rsi_required': True, 'bear_strategy': 'breakout', 'bear_bb_std_mult': 3.5091192987190833, 'bear_rsi_os': 47, 'bear_rsi_ob': 48, 'bear_adx_thresh': 5.413550730416975, 'bear_atr_min_pct': 0.008541577078756246, 'bear_atr_max_pct': 0.10831911749109224, 'bear_tp_mult': 2.883073426985394, 'bear_tsl_mult': 0.1514029679563266, 'bear_time_stop': 5, 'bear_use_sma': True, 'bear_use_ema': False, 'bear_use_atr': True, 'bear_use_adx': True, 'bear_use_spike': True, 'bear_rsi_required': True, 'sideways_strategy': 'mean_reversion', 'sideways_bb_std_mult': 2.2676546784149156, 'sideways_rsi_os': 24, 'sideways_rsi_ob': 55, 'sideways_adx_thresh': 27.236824055435278, 'sideways_atr_min_pct': 0.026067769964865137, 'sideways_atr_max_pct': 0.04220347303081534, 'sideways_tp_mult': 1.3141211148489562, 'sideways_tsl_mult': 0.893445834268722, 'sideways_time_stop': 288, 'sideways_use_sma': False, 'sideways_use_ema': True, 'sideways_use_atr': True, 'sideways_use_adx': False, 'sideways_use_spike': True, 'sideways_rsi_required': True}.
[I 2025-08-30 20:27:56,998] Trial 833 finished with values: [-1000000000.0, 1000000000.0] and parameters: {'p_sma': 48, 'p_std': 6, 'p_atr': 14, 'p_adx': 7, 'rsi_period': 80, 'ema1': 13, 'ema2': 13, 'slip_atr_k': 0.17404925524690582, 'slip_spread_k': 0.6009262493611927, 'spread_hl_frac': 0.03899012546279768, 'bb_std_mult': 1.1414123159544796, 'rsi_os': 44, 'rsi_ob': 51, 'vol_spike': 0.12067874913911336, 'adx_thresh': 23.576294447664996, 'atr_min_pct': 0.022409037808101086, 'atr_max_pct': 0.1280299474665246, 'tp_mult': 2.30747708671587, 'tsl_mult': 0.7022140947598332, 'strategy': 'breakout', 'time_stop': 49, 'use_sma': False, 'use_atr': True, 'use_adx': False, 'use_ema': False, 'use_spike': True, 'rsi_required': True, 'edge_k': 1.4934337410966616, 'edge_cap': 0.4462247783245667, 'bull_strategy': 'mean_reversion', 'bull_bb_std_mult': 2.7769701584795996, 'bull_rsi_os': 12, 'bull_rsi_ob': 71, 'bull_adx_thresh': 24.202462278436105, 'bull_atr_min_pct': 0.01048719504491425, 'bull_atr_max_pct': 0.08367187134077052, 'bull_tp_mult': 2.002727219455979, 'bull_tsl_mult': 0.8966477506220126, 'bull_time_stop': 207, 'bull_use_sma': True, 'bull_use_ema': True, 'bull_use_atr': False, 'bull_use_adx': True, 'bull_use_spike': False, 'bull_rsi_required': True, 'bear_strategy': 'breakout', 'bear_bb_std_mult': 3.464604712812724, 'bear_rsi_os': 48, 'bear_rsi_ob': 47, 'bear_adx_thresh': 5.076666338735851, 'bear_atr_min_pct': 0.008757636760527966, 'bear_atr_max_pct': 0.11741111146705549, 'bear_tp_mult': 2.8075845539617466, 'bear_tsl_mult': 0.13816123657587648, 'bear_time_stop': 5, 'bear_use_sma': False, 'bear_use_ema': False, 'bear_use_atr': True, 'bear_use_adx': True, 'bear_use_spike': False, 'bear_rsi_required': True, 'sideways_strategy': 'mean_reversion', 'sideways_bb_std_mult': 2.4313843005255813, 'sideways_rsi_os': 23, 'sideways_rsi_ob': 56, 'sideways_adx_thresh': 28.790968441680878, 'sideways_atr_min_pct': 0.026926564603010128, 'sideways_atr_max_pct': 0.02874258751779963, 'sideways_tp_mult': 1.3954090694209993, 'sideways_tsl_mult': 0.9205498773007817, 'sideways_time_stop': 287, 'sideways_use_sma': False, 'sideways_use_ema': True, 'sideways_use_atr': False, 'sideways_use_adx': False, 'sideways_use_spike': False, 'sideways_rsi_required': True}.
[I 2025-08-30 20:27:57,173] Trial 836 finished with values: [-1000000000.0, 1000000000.0] and parameters: {'p_sma': 48, 'p_std': 13, 'p_atr': 8, 'p_adx': 7, 'rsi_period': 84, 'ema1': 11, 'ema2': 13, 'slip_atr_k': 0.018929124451141578, 'slip_spread_k': 0.6253156867912467, 'spread_hl_frac': 0.044315997566334, 'bb_std_mult': 1.221500167246, 'rsi_os': 38, 'rsi_ob': 63, 'vol_spike': 0.12148657374522256, 'adx_thresh': 23.823739049054584, 'atr_min_pct': 0.02205916190127352, 'atr_max_pct': 0.12902804292106582, 'tp_mult': 2.287756868507424, 'tsl_mult': 0.7154276586489521, 'strategy': 'breakout', 'time_stop': 45, 'use_sma': False, 'use_atr': True, 'use_adx': False, 'use_ema': False, 'use_spike': True, 'rsi_required': True, 'edge_k': 1.160432599779134, 'edge_cap': 0.4427416173509288, 'bull_strategy': 'mean_reversion', 'bull_bb_std_mult': 3.3165135374956973, 'bull_rsi_os': 12, 'bull_rsi_ob': 71, 'bull_adx_thresh': 24.51673703019928, 'bull_atr_min_pct': 0.0056049062541524575, 'bull_atr_max_pct': 0.07838989557981413, 'bull_tp_mult': 2.034067509328173, 'bull_tsl_mult': 0.9232076749874576, 'bull_time_stop': 199, 'bull_use_sma': True, 'bull_use_ema': True, 'bull_use_atr': False, 'bull_use_adx': True, 'bull_use_spike': False, 'bull_rsi_required': True, 'bear_strategy': 'breakout', 'bear_bb_std_mult': 3.4712726127383906, 'bear_rsi_os': 47, 'bear_rsi_ob': 50, 'bear_adx_thresh': 5.733655177671841, 'bear_atr_min_pct': 0.010446459622142409, 'bear_atr_max_pct': 0.11879273287516695, 'bear_tp_mult': 2.8316231911030068, 'bear_tsl_mult': 0.19507298254417338, 'bear_time_stop': 14, 'bear_use_sma': False, 'bear_use_ema': False, 'bear_use_atr': True, 'bear_use_adx': True, 'bear_use_spike': False, 'bear_rsi_required': True, 'sideways_strategy': 'mean_reversion', 'sideways_bb_std_mult': 2.3939195446340746, 'sideways_rsi_os': 22, 'sideways_rsi_ob': 56, 'sideways_adx_thresh': 26.087824096110214, 'sideways_atr_min_pct': 0.025691996754381132, 'sideways_atr_max_pct': 0.044961177713350786, 'sideways_tp_mult': 1.3893403133419107, 'sideways_tsl_mult': 0.9095400687779218, 'sideways_time_stop': 285, 'sideways_use_sma': False, 'sideways_use_ema': True, 'sideways_use_atr': False, 'sideways_use_adx': False, 'sideways_use_spike': False, 'sideways_rsi_required': True}.
[I 2025-08-30 20:27:57,179] Trial 834 finished with values: [-1000000000.0, 1000000000.0] and parameters: {'p_sma': 48, 'p_std': 5, 'p_atr': 14, 'p_adx': 7, 'rsi_period': 80, 'ema1': 13, 'ema2': 13, 'slip_atr_k': 0.04854981765844403, 'slip_spread_k': 0.6083510574767945, 'spread_hl_frac': 0.043569422963684656, 'bb_std_mult': 1.1306671574239204, 'rsi_os': 35, 'rsi_ob': 71, 'vol_spike': 0.12124907923471169, 'adx_thresh': 23.537199333880167, 'atr_min_pct': 0.02234118229760432, 'atr_max_pct': 0.12958517905167308, 'tp_mult': 2.290651239754227, 'tsl_mult': 0.7030865947608723, 'strategy': 'breakout', 'time_stop': 49, 'use_sma': False, 'use_atr': True, 'use_adx': False, 'use_ema': False, 'use_spike': True, 'rsi_required': True, 'edge_k': 1.5288041855837404, 'edge_cap': 0.48311183008896197, 'bull_strategy': 'mean_reversion', 'bull_bb_std_mult': 1.9030031165485881, 'bull_rsi_os': 26, 'bull_rsi_ob': 59, 'bull_adx_thresh': 24.326789359835956, 'bull_atr_min_pct': 0.005479470811232561, 'bull_atr_max_pct': 0.08561173662704676, 'bull_tp_mult': 2.0218745057999974, 'bull_tsl_mult': 0.8879003210603632, 'bull_time_stop': 207, 'bull_use_sma': True, 'bull_use_ema': True, 'bull_use_atr': False, 'bull_use_adx': True, 'bull_use_spike': False, 'bull_rsi_required': True, 'bear_strategy': 'breakout', 'bear_bb_std_mult': 3.449798477123703, 'bear_rsi_os': 48, 'bear_rsi_ob': 48, 'bear_adx_thresh': 5.004421856714611, 'bear_atr_min_pct': 0.008808466364458875, 'bear_atr_max_pct': 0.12145602907522718, 'bear_tp_mult': 2.8105615404964905, 'bear_tsl_mult': 0.1447173709503563, 'bear_time_stop': 17, 'bear_use_sma': False, 'bear_use_ema': False, 'bear_use_atr': True, 'bear_use_adx': True, 'bear_use_spike': False, 'bear_rsi_required': True, 'sideways_strategy': 'mean_reversion', 'sideways_bb_std_mult': 0.8189385736736243, 'sideways_rsi_os': 23, 'sideways_rsi_ob': 56, 'sideways_adx_thresh': 29.033917284999568, 'sideways_atr_min_pct': 0.02580302584271275, 'sideways_atr_max_pct': 0.04378457720088556, 'sideways_tp_mult': 1.3855077679157553, 'sideways_tsl_mult': 0.8936704772456335, 'sideways_time_stop': 284, 'sideways_use_sma': False, 'sideways_use_ema': True, 'sideways_use_atr': False, 'sideways_use_adx': False, 'sideways_use_spike': False, 'sideways_rsi_required': True}.
[I 2025-08-30 20:27:57,292] Trial 835 finished with values: [-1000000000.0, 1000000000.0] and parameters: {'p_sma': 48, 'p_std': 12, 'p_atr': 18, 'p_adx': 7, 'rsi_period': 84, 'ema1': 11, 'ema2': 13, 'slip_atr_k': 0.17786382174308024, 'slip_spread_k': 0.630884676617706, 'spread_hl_frac': 0.04106899143401313, 'bb_std_mult': 1.130551730625574, 'rsi_os': 44, 'rsi_ob': 72, 'vol_spike': 0.12302386170366632, 'adx_thresh': 23.727027823210097, 'atr_min_pct': 0.021823243329182188, 'atr_max_pct': 0.12805928132651576, 'tp_mult': 2.281217685789041, 'tsl_mult': 0.9535858705111502, 'strategy': 'breakout', 'time_stop': 48, 'use_sma': False, 'use_atr': True, 'use_adx': False, 'use_ema': False, 'use_spike': True, 'rsi_required': True, 'edge_k': 1.1491169475257692, 'edge_cap': 0.4523545521956975, 'bull_strategy': 'mean_reversion', 'bull_bb_std_mult': 2.7303533654893957, 'bull_rsi_os': 22, 'bull_rsi_ob': 87, 'bull_adx_thresh': 24.755981323502414, 'bull_atr_min_pct': 0.012865216749115371, 'bull_atr_max_pct': 0.08418176578056441, 'bull_tp_mult': 2.034040825377669, 'bull_tsl_mult': 0.9211438495452898, 'bull_time_stop': 210, 'bull_use_sma': True, 'bull_use_ema': True, 'bull_use_atr': False, 'bull_use_adx': True, 'bull_use_spike': False, 'bull_rsi_required': True, 'bear_strategy': 'breakout', 'bear_bb_std_mult': 3.539332231098955, 'bear_rsi_os': 47, 'bear_rsi_ob': 48, 'bear_adx_thresh': 5.690785874793862, 'bear_atr_min_pct': 0.010385188903590081, 'bear_atr_max_pct': 0.11928451457532468, 'bear_tp_mult': 2.809996445882727, 'bear_tsl_mult': 0.14795702277528022, 'bear_time_stop': 12, 'bear_use_sma': False, 'bear_use_ema': False, 'bear_use_atr': True, 'bear_use_adx': True, 'bear_use_spike': False, 'bear_rsi_required': True, 'sideways_strategy': 'mean_reversion', 'sideways_bb_std_mult': 2.1150139445737905, 'sideways_rsi_os': 24, 'sideways_rsi_ob': 56, 'sideways_adx_thresh': 26.177994378329394, 'sideways_atr_min_pct': 0.0258352111382837, 'sideways_atr_max_pct': 0.04391112024071409, 'sideways_tp_mult': 1.4043754023518984, 'sideways_tsl_mult': 0.9303480860225843, 'sideways_time_stop': 287, 'sideways_use_sma': False, 'sideways_use_ema': True, 'sideways_use_atr': False, 'sideways_use_adx': False, 'sideways_use_spike': False, 'sideways_rsi_required': True}.
