[I 2025-08-30 20:29:44,517] Trial 846 finished with values: [-1000000000.0, 1000000000.0] and parameters: {'p_sma': 48, 'p_std': 9, 'p_atr': 11, 'p_adx': 7, 'rsi_period': 82, 'ema1': 17, 'ema2': 11, 'slip_atr_k': 0.01565479465099273, 'slip_spread_k': 0.586819910215999, 'spread_hl_frac': 0.04653439909182611, 'bb_std_mult': 1.089347664066642, 'rsi_os': 38, 'rsi_ob': 62, 'vol_spike': 0.11322649185187264, 'adx_thresh': 24.114197850518558, 'atr_min_pct': 0.022162543451312734, 'atr_max_pct': 0.12973251661746452, 'tp_mult': 2.2938293057102603, 'tsl_mult': 0.7114998264386322, 'strategy': 'mean_reversion', 'time_stop': 57, 'use_sma': True, 'use_atr': True, 'use_adx': False, 'use_ema': False, 'use_spike': True, 'rsi_required': False, 'edge_k': 1.4903326210626453, 'edge_cap': 0.6065076618641951, 'bull_strategy': 'mean_reversion', 'bull_bb_std_mult': 3.07441670540429, 'bull_rsi_os': 24, 'bull_rsi_ob': 70, 'bull_adx_thresh': 24.07088289217482, 'bull_atr_min_pct': 0.006316299747564485, 'bull_atr_max_pct': 0.07957975811794621, 'bull_tp_mult': 2.094358901811294, 'bull_tsl_mult': 0.8938542734475894, 'bull_time_stop': 195, 'bull_use_sma': True, 'bull_use_ema': False, 'bull_use_atr': False, 'bull_use_adx': True, 'bull_use_spike': True, 'bull_rsi_required': True, 'bear_strategy': 'breakout', 'bear_bb_std_mult': 3.5936106402527273, 'bear_rsi_os': 49, 'bear_rsi_ob': 50, 'bear_adx_thresh': 5.8602132329139724, 'bear_atr_min_pct': 0.01031474841300659, 'bear_atr_max_pct': 0.12402438634935867, 'bear_tp_mult': 2.68595952629063, 'bear_tsl_mult': 0.7869635657166916, 'bear_time_stop': 5, 'bear_use_sma': True, 'bear_use_ema': False, 'bear_use_atr': False, 'bear_use_adx': False, 'bear_use_spike': False, 'bear_rsi_required': True, 'sideways_strategy': 'mean_reversion', 'sideways_bb_std_mult': 3.262080458192383, 'sideways_rsi_os': 22, 'sideways_rsi_ob': 55, 'sideways_adx_thresh': 28.587137072653395, 'sideways_atr_min_pct': 0.02640196647386225, 'sideways_atr_max_pct': 0.05001961187072301, 'sideways_tp_mult': 1.5197585379042595, 'sideways_tsl_mult': 0.9144047240856071, 'sideways_time_stop': 281, 'sideways_use_sma': False, 'sideways_use_ema': True, 'sideways_use_atr': False, 'sideways_use_adx': False, 'sideways_use_spike': True, 'sideways_rsi_required': True}.
[I 2025-08-30 20:29:44,955] Trial 849 finished with values: [-1000000000.0, 1000000000.0] and parameters: {'p_sma': 49, 'p_std': 6, 'p_atr': 11, 'p_adx': 7, 'rsi_period': 82, 'ema1': 11, 'ema2': 11, 'slip_atr_k': 0.018026460122222147, 'slip_spread_k': 0.586365166422039, 'spread_hl_frac': 0.03887398996081262, 'bb_std_mult': 1.081480965013634, 'rsi_os': 38, 'rsi_ob': 62, 'vol_spike': 0.11349769446201168, 'adx_thresh': 24.817449026872364, 'atr_min_pct': 0.021720558323726245, 'atr_max_pct': 0.12971634289846512, 'tp_mult': 2.275883806030674, 'tsl_mult': 0.1312753614837608, 'strategy': 'breakout', 'time_stop': 56, 'use_sma': False, 'use_atr': True, 'use_adx': False, 'use_ema': False, 'use_spike': True, 'rsi_required': True, 'edge_k': 1.4043758122944348, 'edge_cap': 0.4681869829517718, 'bull_strategy': 'mean_reversion', 'bull_bb_std_mult': 1.7654479090707549, 'bull_rsi_os': 24, 'bull_rsi_ob': 70, 'bull_adx_thresh': 24.92259327068977, 'bull_atr_min_pct': 0.00906816849893529, 'bull_atr_max_pct': 0.07821670083319981, 'bull_tp_mult': 2.091879661315359, 'bull_tsl_mult': 0.9339447812928781, 'bull_time_stop': 196, 'bull_use_sma': True, 'bull_use_ema': True, 'bull_use_atr': False, 'bull_use_adx': True, 'bull_use_spike': False, 'bull_rsi_required': True, 'bear_strategy': 'breakout', 'bear_bb_std_mult': 3.5750493264522105, 'bear_rsi_os': 47, 'bear_rsi_ob': 49, 'bear_adx_thresh': 5.019525637812148, 'bear_atr_min_pct': 0.01070836823908557, 'bear_atr_max_pct': 0.11163196522178218, 'bear_tp_mult': 2.8797492150273403, 'bear_tsl_mult': 0.16056500722999983, 'bear_time_stop': 5, 'bear_use_sma': False, 'bear_use_ema': False, 'bear_use_atr': True, 'bear_use_adx': True, 'bear_use_spike': False, 'bear_rsi_required': True, 'sideways_strategy': 'mean_reversion', 'sideways_bb_std_mult': 1.5191047610486752, 'sideways_rsi_os': 23, 'sideways_rsi_ob': 56, 'sideways_adx_thresh': 28.346855454599645, 'sideways_atr_min_pct': 0.026253286232412524, 'sideways_atr_max_pct': 0.031116488511307234, 'sideways_tp_mult': 1.0930767528719754, 'sideways_tsl_mult': 0.9151272539170848, 'sideways_time_stop': 283, 'sideways_use_sma': False, 'sideways_use_ema': True, 'sideways_use_atr': False, 'sideways_use_adx': False, 'sideways_use_spike': False, 'sideways_rsi_required': True}.
[I 2025-08-30 20:29:45,255] Trial 848 finished with values: [-1000000000.0, 1000000000.0] and parameters: {'p_sma': 49, 'p_std': 6, 'p_atr': 11, 'p_adx': 7, 'rsi_period': 82, 'ema1': 17, 'ema2': 11, 'slip_atr_k': 0.016128386510778657, 'slip_spread_k': 0.5852910546644086, 'spread_hl_frac': 0.033844496104595015, 'bb_std_mult': 1.0788804907243819, 'rsi_os': 38, 'rsi_ob': 71, 'vol_spike': 0.11368091449291576, 'adx_thresh': 21.031287084394513, 'atr_min_pct': 0.021582711385832017, 'atr_max_pct': 0.12381386850451856, 'tp_mult': 2.2682417128064194, 'tsl_mult': 0.031085944695013412, 'strategy': 'breakout', 'time_stop': 58, 'use_sma': False, 'use_atr': True, 'use_adx': False, 'use_ema': False, 'use_spike': True, 'rsi_required': True, 'edge_k': 1.5090553515796121, 'edge_cap': 0.4677821406781818, 'bull_strategy': 'mean_reversion', 'bull_bb_std_mult': 1.8239851003584024, 'bull_rsi_os': 10, 'bull_rsi_ob': 54, 'bull_adx_thresh': 10.215800103215104, 'bull_atr_min_pct': 0.01206281447151901, 'bull_atr_max_pct': 0.07700935256722778, 'bull_tp_mult': 2.0905575761075763, 'bull_tsl_mult': 0.932436019036627, 'bull_time_stop': 91, 'bull_use_sma': True, 'bull_use_ema': True, 'bull_use_atr': False, 'bull_use_adx': True, 'bull_use_spike': False, 'bull_rsi_required': True, 'bear_strategy': 'breakout', 'bear_bb_std_mult': 3.5812035158664166, 'bear_rsi_os': 47, 'bear_rsi_ob': 49, 'bear_adx_thresh': 27.07303867509444, 'bear_atr_min_pct': 0.010115300138508037, 'bear_atr_max_pct': 0.1277558974675208, 'bear_tp_mult': 2.8657852193696893, 'bear_tsl_mult': 0.15025084355614587, 'bear_time_stop': 5, 'bear_use_sma': False, 'bear_use_ema': False, 'bear_use_atr': True, 'bear_use_adx': True, 'bear_use_spike': False, 'bear_rsi_required': True, 'sideways_strategy': 'mean_reversion', 'sideways_bb_std_mult': 2.834056407075803, 'sideways_rsi_os': 23, 'sideways_rsi_ob': 56, 'sideways_adx_thresh': 28.58965721998995, 'sideways_atr_min_pct': 0.026316192575626462, 'sideways_atr_max_pct': 0.04924780362717354, 'sideways_tp_mult': 1.5234145403965282, 'sideways_tsl_mult': 0.8144480021876055, 'sideways_time_stop': 281, 'sideways_use_sma': False, 'sideways_use_ema': True, 'sideways_use_atr': False, 'sideways_use_adx': False, 'sideways_use_spike': False, 'sideways_rsi_required': True}.
[I 2025-08-30 20:29:45,676] Trial 847 finished with values: [-1000000000.0, 1000000000.0] and parameters: {'p_sma': 48, 'p_std': 9, 'p_atr': 11, 'p_adx': 7, 'rsi_period': 82, 'ema1': 10, 'ema2': 11, 'slip_atr_k': 0.016452256038749197, 'slip_spread_k': 0.5898610533408931, 'spread_hl_frac': 0.047609711763433274, 'bb_std_mult': 1.0830984042238212, 'rsi_os': 38, 'rsi_ob': 62, 'vol_spike': 0.13793595201359365, 'adx_thresh': 24.913478951614497, 'atr_min_pct': 0.022055118808196553, 'atr_max_pct': 0.12908471102061286, 'tp_mult': 2.27659776936983, 'tsl_mult': 0.7169261234868399, 'strategy': 'mean_reversion', 'time_stop': 57, 'use_sma': True, 'use_atr': True, 'use_adx': False, 'use_ema': False, 'use_spike': True, 'rsi_required': False, 'edge_k': 1.5135361026326315, 'edge_cap': 0.5325006407799968, 'bull_strategy': 'mean_reversion', 'bull_bb_std_mult': 3.0624317210107375, 'bull_rsi_os': 28, 'bull_rsi_ob': 70, 'bull_adx_thresh': 24.75198860960674, 'bull_atr_min_pct': 0.011992391156128334, 'bull_atr_max_pct': 0.08024078336569884, 'bull_tp_mult': 2.0864854420256282, 'bull_tsl_mult': 0.8879803209129474, 'bull_time_stop': 196, 'bull_use_sma': True, 'bull_use_ema': False, 'bull_use_atr': False, 'bull_use_adx': True, 'bull_use_spike': True, 'bull_rsi_required': True, 'bear_strategy': 'breakout', 'bear_bb_std_mult': 3.418224583899568, 'bear_rsi_os': 47, 'bear_rsi_ob': 50, 'bear_adx_thresh': 12.703597596573324, 'bear_atr_min_pct': 0.009938354176198433, 'bear_atr_max_pct': 0.12698985345238753, 'bear_tp_mult': 2.999069158199226, 'bear_tsl_mult': 0.19055763292420075, 'bear_time_stop': 5, 'bear_use_sma': True, 'bear_use_ema': False, 'bear_use_atr': False, 'bear_use_adx': False, 'bear_use_spike': False, 'bear_rsi_required': True, 'sideways_strategy': 'mean_reversion', 'sideways_bb_std_mult': 2.83477254273879, 'sideways_rsi_os': 26, 'sideways_rsi_ob': 56, 'sideways_adx_thresh': 27.918373365830448, 'sideways_atr_min_pct': 0.02597098759497656, 'sideways_atr_max_pct': 0.03009068099812689, 'sideways_tp_mult': 1.5273333742813973, 'sideways_tsl_mult': 0.8098105399348937, 'sideways_time_stop': 291, 'sideways_use_sma': False, 'sideways_use_ema': True, 'sideways_use_atr': False, 'sideways_use_adx': False, 'sideways_use_spike': True, 'sideways_rsi_required': True}.
[I 2025-08-30 20:30:19,974] Trial 853 finished with values: [-1000000000.0, 1000000000.0] and parameters: {'p_sma': 45, 'p_std': 17, 'p_atr': 12, 'p_adx': 7, 'rsi_period': 80, 'ema1': 9, 'ema2': 14, 'slip_atr_k': 0.007246543559422598, 'slip_spread_k': 0.6167924055829038, 'spread_hl_frac': 0.04135072203910614, 'bb_std_mult': 1.047290422889094, 'rsi_os': 13, 'rsi_ob': 70, 'vol_spike': 0.157209104123206, 'adx_thresh': 25.6299872649278, 'atr_min_pct': 0.02295783258489264, 'atr_max_pct': 0.12121662335732157, 'tp_mult': 2.3294465194480103, 'tsl_mult': 0.45369682307003945, 'strategy': 'breakout', 'time_stop': 40, 'use_sma': False, 'use_atr': True, 'use_adx': False, 'use_ema': False, 'use_spike': False, 'rsi_required': True, 'edge_k': 1.6275984539144983, 'edge_cap': 0.5177110038151478, 'bull_strategy': 'breakout', 'bull_bb_std_mult': 3.466638825539164, 'bull_rsi_os': 29, 'bull_rsi_ob': 68, 'bull_adx_thresh': 23.16681731834345, 'bull_atr_min_pct': 0.016954068945914065, 'bull_atr_max_pct': 0.08599318526459249, 'bull_tp_mult': 2.0288026048892527, 'bull_tsl_mult': 0.8659363637546362, 'bull_time_stop': 205, 'bull_use_sma': True, 'bull_use_ema': False, 'bull_use_atr': True, 'bull_use_adx': False, 'bull_use_spike': True, 'bull_rsi_required': True, 'bear_strategy': 'breakout', 'bear_bb_std_mult': 3.491280260216748, 'bear_rsi_os': 48, 'bear_rsi_ob': 46, 'bear_adx_thresh': 21.397557694132377, 'bear_atr_min_pct': 0.008987404111829361, 'bear_atr_max_pct': 0.09864868863046274, 'bear_tp_mult': 2.7869903118451522, 'bear_tsl_mult': 0.7342303882729215, 'bear_time_stop': 18, 'bear_use_sma': True, 'bear_use_ema': True, 'bear_use_atr': True, 'bear_use_adx': True, 'bear_use_spike': False, 'bear_rsi_required': True, 'sideways_strategy': 'mean_reversion', 'sideways_bb_std_mult': 3.0874076482867965, 'sideways_rsi_os': 24, 'sideways_rsi_ob': 57, 'sideways_adx_thresh': 25.84412095673582, 'sideways_atr_min_pct': 0.025621770026081334, 'sideways_atr_max_pct': 0.04122817064289499, 'sideways_tp_mult': 1.1813119587830738, 'sideways_tsl_mult': 0.8511481401849336, 'sideways_time_stop': 77, 'sideways_use_sma': False, 'sideways_use_ema': False, 'sideways_use_atr': False, 'sideways_use_adx': False, 'sideways_use_spike': False, 'sideways_rsi_required': True}.
[I 2025-08-30 20:30:20,235] Trial 851 finished with values: [-1000000000.0, 1000000000.0] and parameters: {'p_sma': 45, 'p_std': 11, 'p_atr': 19, 'p_adx': 7, 'rsi_period': 81, 'ema1': 17, 'ema2': 14, 'slip_atr_k': 0.00688654742591558, 'slip_spread_k': 0.6686417543500127, 'spread_hl_frac': 0.040118112056782916, 'bb_std_mult': 1.1646523184344886, 'rsi_os': 35, 'rsi_ob': 64, 'vol_spike': 0.15744702294503937, 'adx_thresh': 21.144062255611548, 'atr_min_pct': 0.022881865266590362, 'atr_max_pct': 0.12558677846862293, 'tp_mult': 2.270062159632948, 'tsl_mult': 0.9014778396445835, 'strategy': 'breakout', 'time_stop': 49, 'use_sma': False, 'use_atr': True, 'use_adx': False, 'use_ema': False, 'use_spike': True, 'rsi_required': True, 'edge_k': 1.317143074218136, 'edge_cap': 0.3572488799058444, 'bull_strategy': 'mean_reversion', 'bull_bb_std_mult': 0.7772201258956175, 'bull_rsi_os': 29, 'bull_rsi_ob': 71, 'bull_adx_thresh': 24.914976861981557, 'bull_atr_min_pct': 0.010161998795775128, 'bull_atr_max_pct': 0.08626695298439957, 'bull_tp_mult': 2.076149451328786, 'bull_tsl_mult': 0.9296575522472482, 'bull_time_stop': 92, 'bull_use_sma': True, 'bull_use_ema': False, 'bull_use_atr': False, 'bull_use_adx': True, 'bull_use_spike': True, 'bull_rsi_required': True, 'bear_strategy': 'breakout', 'bear_bb_std_mult': 3.4939987040329696, 'bear_rsi_os': 48, 'bear_rsi_ob': 45, 'bear_adx_thresh': 5.006228853585765, 'bear_atr_min_pct': 0.009834106711286678, 'bear_atr_max_pct': 0.12585312980610755, 'bear_tp_mult': 2.965618725820499, 'bear_tsl_mult': 0.7451498016314048, 'bear_time_stop': 13, 'bear_use_sma': True, 'bear_use_ema': False, 'bear_use_atr': True, 'bear_use_adx': True, 'bear_use_spike': False, 'bear_rsi_required': True, 'sideways_strategy': 'mean_reversion', 'sideways_bb_std_mult': 2.057239142777304, 'sideways_rsi_os': 25, 'sideways_rsi_ob': 56, 'sideways_adx_thresh': 26.74223754643338, 'sideways_atr_min_pct': 0.025791337752542037, 'sideways_atr_max_pct': 0.02476212677003385, 'sideways_tp_mult': 1.1858777059898613, 'sideways_tsl_mult': 0.8138778608580174, 'sideways_time_stop': 280, 'sideways_use_sma': False, 'sideways_use_ema': True, 'sideways_use_atr': False, 'sideways_use_adx': False, 'sideways_use_spike': False, 'sideways_rsi_required': True}.
[I 2025-08-30 20:30:20,517] Trial 850 finished with values: [-1000000000.0, 1000000000.0] and parameters: {'p_sma': 49, 'p_std': 14, 'p_atr': 12, 'p_adx': 7, 'rsi_period': 82, 'ema1': 11, 'ema2': 14, 'slip_atr_k': 0.017349582659517342, 'slip_spread_k': 0.6779775372092591, 'spread_hl_frac': 0.039006884554713094, 'bb_std_mult': 1.0627164232377104, 'rsi_os': 35, 'rsi_ob': 73, 'vol_spike': 0.13755048853992702, 'adx_thresh': 25.083116177497015, 'atr_min_pct': 0.022860244373379045, 'atr_max_pct': 0.12313159322596062, 'tp_mult': 2.278577942112344, 'tsl_mult': 0.8980806125248196, 'strategy': 'breakout', 'time_stop': 44, 'use_sma': False, 'use_atr': True, 'use_adx': False, 'use_ema': False, 'use_spike': True, 'rsi_required': True, 'edge_k': 1.395831757924095, 'edge_cap': 0.532170042106969, 'bull_strategy': 'mean_reversion', 'bull_bb_std_mult': 1.7980968161223778, 'bull_rsi_os': 14, 'bull_rsi_ob': 71, 'bull_adx_thresh': 24.972153275092808, 'bull_atr_min_pct': 0.011764556783918188, 'bull_atr_max_pct': 0.07808674780682431, 'bull_tp_mult': 2.0811922290613447, 'bull_tsl_mult': 0.9255754444082327, 'bull_time_stop': 193, 'bull_use_sma': True, 'bull_use_ema': True, 'bull_use_atr': False, 'bull_use_adx': True, 'bull_use_spike': False, 'bull_rsi_required': True, 'bear_strategy': 'breakout', 'bear_bb_std_mult': 3.416185212829954, 'bear_rsi_os': 47, 'bear_rsi_ob': 45, 'bear_adx_thresh': 5.077298145048146, 'bear_atr_min_pct': 0.00890843461763179, 'bear_atr_max_pct': 0.12707537634618743, 'bear_tp_mult': 2.8708430058864756, 'bear_tsl_mult': 0.7407245476290343, 'bear_time_stop': 16, 'bear_use_sma': False, 'bear_use_ema': False, 'bear_use_atr': True, 'bear_use_adx': True, 'bear_use_spike': False, 'bear_rsi_required': True, 'sideways_strategy': 'mean_reversion', 'sideways_bb_std_mult': 2.8132911502720166, 'sideways_rsi_os': 24, 'sideways_rsi_ob': 56, 'sideways_adx_thresh': 25.76658814897197, 'sideways_atr_min_pct': 0.026287563234923064, 'sideways_atr_max_pct': 0.03127688976801705, 'sideways_tp_mult': 1.1413383546544582, 'sideways_tsl_mult': 0.8165675551896121, 'sideways_time_stop': 281, 'sideways_use_sma': False, 'sideways_use_ema': True, 'sideways_use_atr': False, 'sideways_use_adx': False, 'sideways_use_spike': False, 'sideways_rsi_required': True}.
[I 2025-08-30 20:30:20,761] Trial 852 finished with values: [-1000000000.0, 1000000000.0] and parameters: {'p_sma': 45, 'p_std': 17, 'p_atr': 30, 'p_adx': 7, 'rsi_period': 81, 'ema1': 8, 'ema2': 14, 'slip_atr_k': 0.006635909809593318, 'slip_spread_k': 0.6718597743913641, 'spread_hl_frac': 0.04170705077241694, 'bb_std_mult': 1.1883772217985096, 'rsi_os': 13, 'rsi_ob': 70, 'vol_spike': 0.13815383175312812, 'adx_thresh': 23.03059606198266, 'atr_min_pct': 0.022798938434064425, 'atr_max_pct': 0.12612979007055702, 'tp_mult': 2.3146409992885335, 'tsl_mult': 0.7439594963309933, 'strategy': 'breakout', 'time_stop': 45, 'use_sma': False, 'use_atr': True, 'use_adx': False, 'use_ema': False, 'use_spike': True, 'rsi_required': True, 'edge_k': 1.2953328816290144, 'edge_cap': 0.5382118422352696, 'bull_strategy': 'mean_reversion', 'bull_bb_std_mult': 0.7870565318491667, 'bull_rsi_os': 13, 'bull_rsi_ob': 71, 'bull_adx_thresh': 8.817101461074282, 'bull_atr_min_pct': 0.011308918783157951, 'bull_atr_max_pct': 0.0849776246848176, 'bull_tp_mult': 2.0323082881076924, 'bull_tsl_mult': 0.9099725985492725, 'bull_time_stop': 203, 'bull_use_sma': True, 'bull_use_ema': False, 'bull_use_atr': False, 'bull_use_adx': True, 'bull_use_spike': True, 'bull_rsi_required': True, 'bear_strategy': 'breakout', 'bear_bb_std_mult': 3.50980519926037, 'bear_rsi_os': 46, 'bear_rsi_ob': 45, 'bear_adx_thresh': 22.469039585277258, 'bear_atr_min_pct': 0.010036311333929382, 'bear_atr_max_pct': 0.0965921022621591, 'bear_tp_mult': 2.995559862023896, 'bear_tsl_mult': 0.7354706173657072, 'bear_time_stop': 18, 'bear_use_sma': True, 'bear_use_ema': False, 'bear_use_atr': True, 'bear_use_adx': True, 'bear_use_spike': False, 'bear_rsi_required': True, 'sideways_strategy': 'mean_reversion', 'sideways_bb_std_mult': 2.192616817808412, 'sideways_rsi_os': 20, 'sideways_rsi_ob': 56, 'sideways_adx_thresh': 26.833604556879983, 'sideways_atr_min_pct': 0.02537180577109333, 'sideways_atr_max_pct': 0.04109853798158172, 'sideways_tp_mult': 1.1665598816720737, 'sideways_tsl_mult': 0.841947059456587, 'sideways_time_stop': 286, 'sideways_use_sma': False, 'sideways_use_ema': True, 'sideways_use_atr': False, 'sideways_use_adx': False, 'sideways_use_spike': False, 'sideways_rsi_required': True}.
[I 2025-08-30 20:30:54,076] Trial 857 finished with values: [-1000000000.0, 1000000000.0] and parameters: {'p_sma': 46, 'p_std': 15, 'p_atr': 17, 'p_adx': 7, 'rsi_period': 83, 'ema1': 9, 'ema2': 15, 'slip_atr_k': 0.20952064793547404, 'slip_spread_k': 0.6213837299151441, 'spread_hl_frac': 0.03434362752851918, 'bb_std_mult': 1.3566631680011971, 'rsi_os': 36, 'rsi_ob': 52, 'vol_spike': 0.1429412500679384, 'adx_thresh': 21.912514650345308, 'atr_min_pct': 0.02135778659198803, 'atr_max_pct': 0.1296723308180278, 'tp_mult': 2.2642508913319705, 'tsl_mult': 0.689641781618374, 'strategy': 'breakout', 'time_stop': 52, 'use_sma': False, 'use_atr': False, 'use_adx': True, 'use_ema': True, 'use_spike': False, 'rsi_required': True, 'edge_k': 1.1325957063353014, 'edge_cap': 0.6509264905420455, 'bull_strategy': 'breakout', 'bull_bb_std_mult': 1.8564650760066317, 'bull_rsi_os': 21, 'bull_rsi_ob': 73, 'bull_adx_thresh': 12.559527911805802, 'bull_atr_min_pct': 0.013399409404940109, 'bull_atr_max_pct': 0.08304496695601823, 'bull_tp_mult': 2.0417534399856634, 'bull_tsl_mult': 0.9025813043058012, 'bull_time_stop': 101, 'bull_use_sma': False, 'bull_use_ema': False, 'bull_use_atr': True, 'bull_use_adx': False, 'bull_use_spike': True, 'bull_rsi_required': False, 'bear_strategy': 'mean_reversion', 'bear_bb_std_mult': 3.4428461197349733, 'bear_rsi_os': 46, 'bear_rsi_ob': 53, 'bear_adx_thresh': 28.626626424400918, 'bear_atr_min_pct': 0.007689692611057503, 'bear_atr_max_pct': 0.13400536156875695, 'bear_tp_mult': 2.728231519958663, 'bear_tsl_mult': 0.11627002183978953, 'bear_time_stop': 17, 'bear_use_sma': True, 'bear_use_ema': True, 'bear_use_atr': True, 'bear_use_adx': True, 'bear_use_spike': True, 'bear_rsi_required': True, 'sideways_strategy': 'mean_reversion', 'sideways_bb_std_mult': 2.2939234106780373, 'sideways_rsi_os': 22, 'sideways_rsi_ob': 53, 'sideways_adx_thresh': 30.17411400557563, 'sideways_atr_min_pct': 0.024243973278243895, 'sideways_atr_max_pct': 0.04746608608577176, 'sideways_tp_mult': 1.3341523781402016, 'sideways_tsl_mult': 0.8860337139114565, 'sideways_time_stop': 293, 'sideways_use_sma': False, 'sideways_use_ema': False, 'sideways_use_atr': False, 'sideways_use_adx': True, 'sideways_use_spike': False, 'sideways_rsi_required': True}.
