[I 2025-08-30 20:27:58,855] Trial 840 finished with values: [-1000000000.0, 1000000000.0] and parameters: {'p_sma': 46, 'p_std': 15, 'p_atr': 9, 'p_adx': 7, 'rsi_period': 82, 'ema1': 14, 'ema2': 14, 'slip_atr_k': 0.02424687666310959, 'slip_spread_k': 0.6641770003386829, 'spread_hl_frac': 0.0423603455990217, 'bb_std_mult': 1.1004920190446907, 'rsi_os': 55, 'rsi_ob': 50, 'vol_spike': 0.1307764113821975, 'adx_thresh': 21.540318669440463, 'atr_min_pct': 0.02089437345457584, 'atr_max_pct': 0.12375650191025432, 'tp_mult': 2.359184920335716, 'tsl_mult': 0.08466400678271874, 'strategy': 'mean_reversion', 'time_stop': 47, 'use_sma': False, 'use_atr': True, 'use_adx': True, 'use_ema': True, 'use_spike': False, 'rsi_required': False, 'edge_k': 1.206675503433885, 'edge_cap': 0.4141677463577807, 'bull_strategy': 'breakout', 'bull_bb_std_mult': 2.5812548375553845, 'bull_rsi_os': 13, 'bull_rsi_ob': 75, 'bull_adx_thresh': 23.231737105664052, 'bull_atr_min_pct': 0.0068051646800271134, 'bull_atr_max_pct': 0.07966146940917138, 'bull_tp_mult': 2.0696502989108287, 'bull_tsl_mult': 0.9249586055955773, 'bull_time_stop': 199, 'bull_use_sma': False, 'bull_use_ema': False, 'bull_use_atr': True, 'bull_use_adx': False, 'bull_use_spike': True, 'bull_rsi_required': False, 'bear_strategy': 'mean_reversion', 'bear_bb_std_mult': 3.4529587982546177, 'bear_rsi_os': 47, 'bear_rsi_ob': 46, 'bear_adx_thresh': 18.107840961744238, 'bear_atr_min_pct': 0.009425037770844155, 'bear_atr_max_pct': 0.10423173154715996, 'bear_tp_mult': 2.9464355947594782, 'bear_tsl_mult': 0.1266513885720181, 'bear_time_stop': 15, 'bear_use_sma': True, 'bear_use_ema': True, 'bear_use_atr': True, 'bear_use_adx': True, 'bear_use_spike': False, 'bear_rsi_required': True, 'sideways_strategy': 'mean_reversion', 'sideways_bb_std_mult': 1.381811518751623, 'sideways_rsi_os': 21, 'sideways_rsi_ob': 56, 'sideways_adx_thresh': 25.4231556451723, 'sideways_atr_min_pct': 0.02470995463319469, 'sideways_atr_max_pct': 0.036097476816265, 'sideways_tp_mult': 1.1811271305409816, 'sideways_tsl_mult': 0.8580196098876258, 'sideways_time_stop': 297, 'sideways_use_sma': False, 'sideways_use_ema': False, 'sideways_use_atr': False, 'sideways_use_adx': True, 'sideways_use_spike': False, 'sideways_rsi_required': True}.
[I 2025-08-30 20:28:31,068] Trial 838 finished with values: [-1000000000.0, 1000000000.0] and parameters: {'p_sma': 46, 'p_std': 14, 'p_atr': 9, 'p_adx': 7, 'rsi_period': 84, 'ema1': 15, 'ema2': 14, 'slip_atr_k': 0.07920781579524123, 'slip_spread_k': 0.6561713682681446, 'spread_hl_frac': 0.04274670140258358, 'bb_std_mult': 1.2680119553072866, 'rsi_os': 37, 'rsi_ob': 67, 'vol_spike': 0.12807065665016895, 'adx_thresh': 21.424795820039705, 'atr_min_pct': 0.02079568064329246, 'atr_max_pct': 0.1252684396808938, 'tp_mult': 2.355204569834665, 'tsl_mult': 0.3774436377443086, 'strategy': 'breakout', 'time_stop': 46, 'use_sma': False, 'use_atr': True, 'use_adx': True, 'use_ema': True, 'use_spike': False, 'rsi_required': True, 'edge_k': 1.4369599423363166, 'edge_cap': 0.37451603869663774, 'bull_strategy': 'breakout', 'bull_bb_std_mult': 1.5473380494974993, 'bull_rsi_os': 18, 'bull_rsi_ob': 74, 'bull_adx_thresh': 24.50751688137569, 'bull_atr_min_pct': 0.012790119690261649, 'bull_atr_max_pct': 0.08890666200245166, 'bull_tp_mult': 2.067147636138138, 'bull_tsl_mult': 0.9223406672044485, 'bull_time_stop': 214, 'bull_use_sma': False, 'bull_use_ema': False, 'bull_use_atr': True, 'bull_use_adx': False, 'bull_use_spike': True, 'bull_rsi_required': False, 'bear_strategy': 'mean_reversion', 'bear_bb_std_mult': 3.449972281956866, 'bear_rsi_os': 47, 'bear_rsi_ob': 46, 'bear_adx_thresh': 19.043262831093834, 'bear_atr_min_pct': 0.010197203712178604, 'bear_atr_max_pct': 0.09025518486806916, 'bear_tp_mult': 2.9259766609706377, 'bear_tsl_mult': 0.12310105619426631, 'bear_time_stop': 10, 'bear_use_sma': True, 'bear_use_ema': True, 'bear_use_atr': True, 'bear_use_adx': True, 'bear_use_spike': False, 'bear_rsi_required': True, 'sideways_strategy': 'mean_reversion', 'sideways_bb_std_mult': 2.1383761568114283, 'sideways_rsi_os': 20, 'sideways_rsi_ob': 56, 'sideways_adx_thresh': 24.46155800247727, 'sideways_atr_min_pct': 0.025024441181095952, 'sideways_atr_max_pct': 0.035016217420922834, 'sideways_tp_mult': 1.4501509573159237, 'sideways_tsl_mult': 0.8735801130202253, 'sideways_time_stop': 282, 'sideways_use_sma': False, 'sideways_use_ema': False, 'sideways_use_atr': False, 'sideways_use_adx': True, 'sideways_use_spike': False, 'sideways_rsi_required': True}.
[I 2025-08-30 20:28:31,710] Trial 837 finished with values: [-1000000000.0, 1000000000.0] and parameters: {'p_sma': 46, 'p_std': 12, 'p_atr': 9, 'p_adx': 7, 'rsi_period': 84, 'ema1': 16, 'ema2': 14, 'slip_atr_k': 0.03571428534826572, 'slip_spread_k': 0.6592659757645178, 'spread_hl_frac': 0.04502577065933571, 'bb_std_mult': 1.1752714536766462, 'rsi_os': 11, 'rsi_ob': 67, 'vol_spike': 0.1313568825622109, 'adx_thresh': 22.474300787848755, 'atr_min_pct': 0.022551427015256302, 'atr_max_pct': 0.1271952897624603, 'tp_mult': 2.354869146089, 'tsl_mult': 0.39221390426701364, 'strategy': 'breakout', 'time_stop': 45, 'use_sma': False, 'use_atr': True, 'use_adx': True, 'use_ema': True, 'use_spike': False, 'rsi_required': True, 'edge_k': 1.1991346825143339, 'edge_cap': 0.42193627217390095, 'bull_strategy': 'breakout', 'bull_bb_std_mult': 0.9857736839187774, 'bull_rsi_os': 15, 'bull_rsi_ob': 74, 'bull_adx_thresh': 24.624358358123235, 'bull_atr_min_pct': 0.010958168960437178, 'bull_atr_max_pct': 0.08880609595335778, 'bull_tp_mult': 2.0664417500512964, 'bull_tsl_mult': 0.9319810790026792, 'bull_time_stop': 200, 'bull_use_sma': False, 'bull_use_ema': False, 'bull_use_atr': True, 'bull_use_adx': False, 'bull_use_spike': True, 'bull_rsi_required': False, 'bear_strategy': 'mean_reversion', 'bear_bb_std_mult': 3.5163549051347602, 'bear_rsi_os': 47, 'bear_rsi_ob': 47, 'bear_adx_thresh': 17.981756368070236, 'bear_atr_min_pct': 0.009408379058106986, 'bear_atr_max_pct': 0.11352899590937206, 'bear_tp_mult': 2.935848486174315, 'bear_tsl_mult': 0.6114315728146195, 'bear_time_stop': 11, 'bear_use_sma': True, 'bear_use_ema': True, 'bear_use_atr': True, 'bear_use_adx': True, 'bear_use_spike': False, 'bear_rsi_required': True, 'sideways_strategy': 'mean_reversion', 'sideways_bb_std_mult': 0.7242916602362042, 'sideways_rsi_os': 21, 'sideways_rsi_ob': 56, 'sideways_adx_thresh': 24.57844389257799, 'sideways_atr_min_pct': 0.02559901870150214, 'sideways_atr_max_pct': 0.035260801381817614, 'sideways_tp_mult': 1.436205024328129, 'sideways_tsl_mult': 0.863828559346617, 'sideways_time_stop': 283, 'sideways_use_sma': False, 'sideways_use_ema': False, 'sideways_use_atr': False, 'sideways_use_adx': True, 'sideways_use_spike': False, 'sideways_rsi_required': True}.
[I 2025-08-30 20:28:31,818] Trial 839 finished with values: [-1000000000.0, 1000000000.0] and parameters: {'p_sma': 46, 'p_std': 12, 'p_atr': 9, 'p_adx': 7, 'rsi_period': 84, 'ema1': 15, 'ema2': 14, 'slip_atr_k': 0.022596289595404634, 'slip_spread_k': 0.637078079486324, 'spread_hl_frac': 0.04259865872761492, 'bb_std_mult': 1.2551947263872494, 'rsi_os': 11, 'rsi_ob': 67, 'vol_spike': 0.12936347261805575, 'adx_thresh': 21.444725745972395, 'atr_min_pct': 0.022552851215202542, 'atr_max_pct': 0.12496679473194187, 'tp_mult': 2.3896458375806184, 'tsl_mult': 0.3737748322006776, 'strategy': 'breakout', 'time_stop': 48, 'use_sma': False, 'use_atr': True, 'use_adx': True, 'use_ema': True, 'use_spike': False, 'rsi_required': True, 'edge_k': 1.448341768446504, 'edge_cap': 0.3791985974954447, 'bull_strategy': 'breakout', 'bull_bb_std_mult': 1.515956429226872, 'bull_rsi_os': 16, 'bull_rsi_ob': 74, 'bull_adx_thresh': 24.623915911844414, 'bull_atr_min_pct': 0.014432537172211797, 'bull_atr_max_pct': 0.08884064510227696, 'bull_tp_mult': 2.066402551757849, 'bull_tsl_mult': 0.9265945602795854, 'bull_time_stop': 216, 'bull_use_sma': False, 'bull_use_ema': False, 'bull_use_atr': True, 'bull_use_adx': False, 'bull_use_spike': True, 'bull_rsi_required': False, 'bear_strategy': 'mean_reversion', 'bear_bb_std_mult': 3.4586029076274403, 'bear_rsi_os': 47, 'bear_rsi_ob': 47, 'bear_adx_thresh': 24.812280493486618, 'bear_atr_min_pct': 0.009385916174421438, 'bear_atr_max_pct': 0.09076827489969314, 'bear_tp_mult': 2.9372910207638414, 'bear_tsl_mult': 0.12597961704611566, 'bear_time_stop': 16, 'bear_use_sma': True, 'bear_use_ema': True, 'bear_use_atr': True, 'bear_use_adx': True, 'bear_use_spike': False, 'bear_rsi_required': True, 'sideways_strategy': 'mean_reversion', 'sideways_bb_std_mult': 2.1035808809241963, 'sideways_rsi_os': 22, 'sideways_rsi_ob': 53, 'sideways_adx_thresh': 26.398857244328223, 'sideways_atr_min_pct': 0.024957602011508363, 'sideways_atr_max_pct': 0.03644301702274284, 'sideways_tp_mult': 1.4194453357394297, 'sideways_tsl_mult': 0.8657262050709449, 'sideways_time_stop': 282, 'sideways_use_sma': False, 'sideways_use_ema': False, 'sideways_use_atr': False, 'sideways_use_adx': True, 'sideways_use_spike': False, 'sideways_rsi_required': True}.
[I 2025-08-30 20:28:33,695] Trial 841 finished with values: [-1000000000.0, 1000000000.0] and parameters: {'p_sma': 46, 'p_std': 5, 'p_atr': 9, 'p_adx': 7, 'rsi_period': 82, 'ema1': 16, 'ema2': 14, 'slip_atr_k': 0.10657756330367209, 'slip_spread_k': 0.6421630993336204, 'spread_hl_frac': 0.03647570439283084, 'bb_std_mult': 1.1677721649566515, 'rsi_os': 39, 'rsi_ob': 62, 'vol_spike': 0.13162908427690223, 'adx_thresh': 21.231714826640605, 'atr_min_pct': 0.022577411020320702, 'atr_max_pct': 0.12809581852664434, 'tp_mult': 2.318359357573392, 'tsl_mult': 0.7353795211165991, 'strategy': 'breakout', 'time_stop': 45, 'use_sma': False, 'use_atr': True, 'use_adx': False, 'use_ema': False, 'use_spike': True, 'rsi_required': True, 'edge_k': 1.6323340833402955, 'edge_cap': 0.37061633446019066, 'bull_strategy': 'mean_reversion', 'bull_bb_std_mult': 1.86658468351253, 'bull_rsi_os': 18, 'bull_rsi_ob': 72, 'bull_adx_thresh': 24.529417857140764, 'bull_atr_min_pct': 0.013986545801202776, 'bull_atr_max_pct': 0.08998639344848114, 'bull_tp_mult': 1.955549943277341, 'bull_tsl_mult': 0.9122536506969601, 'bull_time_stop': 213, 'bull_use_sma': True, 'bull_use_ema': False, 'bull_use_atr': False, 'bull_use_adx': True, 'bull_use_spike': True, 'bull_rsi_required': True, 'bear_strategy': 'breakout', 'bear_bb_std_mult': 3.45125224395237, 'bear_rsi_os': 47, 'bear_rsi_ob': 52, 'bear_adx_thresh': 22.00103275186358, 'bear_atr_min_pct': 0.009312485890083932, 'bear_atr_max_pct': 0.08722670941894256, 'bear_tp_mult': 2.924703811268403, 'bear_tsl_mult': 0.6192515774918312, 'bear_time_stop': 11, 'bear_use_sma': True, 'bear_use_ema': False, 'bear_use_atr': True, 'bear_use_adx': True, 'bear_use_spike': False, 'bear_rsi_required': True, 'sideways_strategy': 'mean_reversion', 'sideways_bb_std_mult': 2.1212155191350606, 'sideways_rsi_os': 21, 'sideways_rsi_ob': 54, 'sideways_adx_thresh': 29.49879971690229, 'sideways_atr_min_pct': 0.025255203843509155, 'sideways_atr_max_pct': 0.0352111317904529, 'sideways_tp_mult': 1.461964161386847, 'sideways_tsl_mult': 0.874321247569287, 'sideways_time_stop': 299, 'sideways_use_sma': False, 'sideways_use_ema': True, 'sideways_use_atr': True, 'sideways_use_adx': False, 'sideways_use_spike': False, 'sideways_rsi_required': True}.
[I 2025-08-30 20:29:10,145] Trial 842 finished with values: [-1000000000.0, 1000000000.0] and parameters: {'p_sma': 47, 'p_std': 9, 'p_atr': 10, 'p_adx': 7, 'rsi_period': 79, 'ema1': 16, 'ema2': 14, 'slip_atr_k': 0.035263676188516835, 'slip_spread_k': 0.634322495289189, 'spread_hl_frac': 0.04516375551734693, 'bb_std_mult': 1.1163164631550426, 'rsi_os': 36, 'rsi_ob': 68, 'vol_spike': 0.14943159764505093, 'adx_thresh': 22.40751550775312, 'atr_min_pct': 0.022509953161917458, 'atr_max_pct': 0.128572969631733, 'tp_mult': 2.2931288897357374, 'tsl_mult': 0.7297019624055189, 'strategy': 'breakout', 'time_stop': 43, 'use_sma': False, 'use_atr': False, 'use_adx': False, 'use_ema': False, 'use_spike': True, 'rsi_required': True, 'edge_k': 1.272834039247205, 'edge_cap': 0.5666433575376015, 'bull_strategy': 'mean_reversion', 'bull_bb_std_mult': 2.102851069185378, 'bull_rsi_os': 15, 'bull_rsi_ob': 90, 'bull_adx_thresh': 22.868015909825832, 'bull_atr_min_pct': 0.008101259584291752, 'bull_atr_max_pct': 0.08853480244479965, 'bull_tp_mult': 2.0496498303977915, 'bull_tsl_mult': 0.9227698508729466, 'bull_time_stop': 200, 'bull_use_sma': True, 'bull_use_ema': False, 'bull_use_atr': False, 'bull_use_adx': True, 'bull_use_spike': True, 'bull_rsi_required': True, 'bear_strategy': 'breakout', 'bear_bb_std_mult': 3.495770821084404, 'bear_rsi_os': 49, 'bear_rsi_ob': 49, 'bear_adx_thresh': 5.893224023486946, 'bear_atr_min_pct': 0.00906263461072105, 'bear_atr_max_pct': 0.12831225957224507, 'bear_tp_mult': 2.9990690199182026, 'bear_tsl_mult': 0.702596237664563, 'bear_time_stop': 12, 'bear_use_sma': True, 'bear_use_ema': False, 'bear_use_atr': True, 'bear_use_adx': True, 'bear_use_spike': True, 'bear_rsi_required': True, 'sideways_strategy': 'mean_reversion', 'sideways_bb_std_mult': 3.455536757093383, 'sideways_rsi_os': 21, 'sideways_rsi_ob': 54, 'sideways_adx_thresh': 29.837333282946172, 'sideways_atr_min_pct': 0.02705747973316394, 'sideways_atr_max_pct': 0.026014762074458506, 'sideways_tp_mult': 1.2620445892052463, 'sideways_tsl_mult': 0.8441549806294031, 'sideways_time_stop': 299, 'sideways_use_sma': False, 'sideways_use_ema': True, 'sideways_use_atr': True, 'sideways_use_adx': False, 'sideways_use_spike': False, 'sideways_rsi_required': True}.
[I 2025-08-30 20:29:10,152] Trial 843 finished with values: [-1000000000.0, 1000000000.0] and parameters: {'p_sma': 47, 'p_std': 8, 'p_atr': 25, 'p_adx': 7, 'rsi_period': 80, 'ema1': 12, 'ema2': 12, 'slip_atr_k': 0.05721114478074121, 'slip_spread_k': 0.6328383249436185, 'spread_hl_frac': 0.0367884558425783, 'bb_std_mult': 1.2125268082383032, 'rsi_os': 29, 'rsi_ob': 64, 'vol_spike': 0.15166425112247534, 'adx_thresh': 24.35094485588285, 'atr_min_pct': 0.022549483146560984, 'atr_max_pct': 0.13265186473957416, 'tp_mult': 2.3106922661774, 'tsl_mult': 0.7261669364412217, 'strategy': 'breakout', 'time_stop': 42, 'use_sma': True, 'use_atr': False, 'use_adx': False, 'use_ema': False, 'use_spike': True, 'rsi_required': True, 'edge_k': 1.5607221782514895, 'edge_cap': 0.33836366162407294, 'bull_strategy': 'mean_reversion', 'bull_bb_std_mult': 2.378118508682916, 'bull_rsi_os': 19, 'bull_rsi_ob': 72, 'bull_adx_thresh': 24.10044004235667, 'bull_atr_min_pct': 0.015427901073985213, 'bull_atr_max_pct': 0.082264143905465, 'bull_tp_mult': 1.9577722316867765, 'bull_tsl_mult': 0.9204989107783454, 'bull_time_stop': 197, 'bull_use_sma': True, 'bull_use_ema': False, 'bull_use_atr': False, 'bull_use_adx': True, 'bull_use_spike': True, 'bull_rsi_required': True, 'bear_strategy': 'breakout', 'bear_bb_std_mult': 3.437850839950701, 'bear_rsi_os': 49, 'bear_rsi_ob': 52, 'bear_adx_thresh': 5.761365421055333, 'bear_atr_min_pct': 0.007975653999682475, 'bear_atr_max_pct': 0.10189781496143692, 'bear_tp_mult': 2.860341411526278, 'bear_tsl_mult': 0.6421998819071022, 'bear_time_stop': 16, 'bear_use_sma': True, 'bear_use_ema': False, 'bear_use_atr': True, 'bear_use_adx': True, 'bear_use_spike': True, 'bear_rsi_required': True, 'sideways_strategy': 'mean_reversion', 'sideways_bb_std_mult': 0.9171561678132709, 'sideways_rsi_os': 25, 'sideways_rsi_ob': 54, 'sideways_adx_thresh': 30.68152899535472, 'sideways_atr_min_pct': 0.027041743574636283, 'sideways_atr_max_pct': 0.038161072918642076, 'sideways_tp_mult': 1.2086104015058947, 'sideways_tsl_mult': 0.9453123198803373, 'sideways_time_stop': 284, 'sideways_use_sma': False, 'sideways_use_ema': True, 'sideways_use_atr': True, 'sideways_use_adx': False, 'sideways_use_spike': False, 'sideways_rsi_required': True}.
[I 2025-08-30 20:29:10,401] Trial 845 finished with values: [-1000000000.0, 1000000000.0] and parameters: {'p_sma': 47, 'p_std': 9, 'p_atr': 10, 'p_adx': 7, 'rsi_period': 79, 'ema1': 10, 'ema2': 12, 'slip_atr_k': 0.14565718010364795, 'slip_spread_k': 0.5970861769984834, 'spread_hl_frac': 0.04710224349869341, 'bb_std_mult': 1.0886520778379964, 'rsi_os': 30, 'rsi_ob': 65, 'vol_spike': 0.14777210814761338, 'adx_thresh': 22.998684474904508, 'atr_min_pct': 0.02201004109445874, 'atr_max_pct': 0.1291087473518317, 'tp_mult': 2.2795393984605683, 'tsl_mult': 0.6398458583472765, 'strategy': 'mean_reversion', 'time_stop': 43, 'use_sma': True, 'use_atr': False, 'use_adx': False, 'use_ema': False, 'use_spike': True, 'rsi_required': False, 'edge_k': 1.5867106986350201, 'edge_cap': 0.5589562218609649, 'bull_strategy': 'mean_reversion', 'bull_bb_std_mult': 1.9105759698753384, 'bull_rsi_os': 19, 'bull_rsi_ob': 72, 'bull_adx_thresh': 24.126947741313042, 'bull_atr_min_pct': 0.01547713857623278, 'bull_atr_max_pct': 0.08216648681999102, 'bull_tp_mult': 2.0811908882573995, 'bull_tsl_mult': 0.8823594801850834, 'bull_time_stop': 196, 'bull_use_sma': True, 'bull_use_ema': False, 'bull_use_atr': False, 'bull_use_adx': True, 'bull_use_spike': True, 'bull_rsi_required': True, 'bear_strategy': 'breakout', 'bear_bb_std_mult': 3.4236659794664246, 'bear_rsi_os': 48, 'bear_rsi_ob': 50, 'bear_adx_thresh': 6.023485721793302, 'bear_atr_min_pct': 0.008107455726817085, 'bear_atr_max_pct': 0.10260688445006237, 'bear_tp_mult': 2.7114829312145785, 'bear_tsl_mult': 0.32905762428541, 'bear_time_stop': 13, 'bear_use_sma': True, 'bear_use_ema': False, 'bear_use_atr': False, 'bear_use_adx': False, 'bear_use_spike': True, 'bear_rsi_required': True, 'sideways_strategy': 'mean_reversion', 'sideways_bb_std_mult': 2.063824370387351, 'sideways_rsi_os': 20, 'sideways_rsi_ob': 56, 'sideways_adx_thresh': 27.967945192481658, 'sideways_atr_min_pct': 0.027156909334774496, 'sideways_atr_max_pct': 0.02774154030486718, 'sideways_tp_mult': 1.2844874643749293, 'sideways_tsl_mult': 0.9449745675366332, 'sideways_time_stop': 290, 'sideways_use_sma': False, 'sideways_use_ema': True, 'sideways_use_atr': True, 'sideways_use_adx': False, 'sideways_use_spike': True, 'sideways_rsi_required': True}.
[I 2025-08-30 20:29:10,481] Trial 844 finished with values: [-1000000000.0, 1000000000.0] and parameters: {'p_sma': 47, 'p_std': 8, 'p_atr': 10, 'p_adx': 7, 'rsi_period': 79, 'ema1': 12, 'ema2': 14, 'slip_atr_k': 0.05675998837808026, 'slip_spread_k': 0.6298754590199928, 'spread_hl_frac': 0.03633970710449728, 'bb_std_mult': 1.0951193231147869, 'rsi_os': 30, 'rsi_ob': 70, 'vol_spike': 0.14732551198168076, 'adx_thresh': 24.325414964684203, 'atr_min_pct': 0.022561816940449488, 'atr_max_pct': 0.12995427513872854, 'tp_mult': 2.271473191094835, 'tsl_mult': 0.7307866669730475, 'strategy': 'mean_reversion', 'time_stop': 57, 'use_sma': True, 'use_atr': False, 'use_adx': False, 'use_ema': False, 'use_spike': True, 'rsi_required': False, 'edge_k': 1.582189321643013, 'edge_cap': 0.6022565089111833, 'bull_strategy': 'mean_reversion', 'bull_bb_std_mult': 3.084252249439125, 'bull_rsi_os': 11, 'bull_rsi_ob': 72, 'bull_adx_thresh': 23.886401469143173, 'bull_atr_min_pct': 0.013963866525461145, 'bull_atr_max_pct': 0.0819521785787156, 'bull_tp_mult': 1.9488536694641116, 'bull_tsl_mult': 0.8799188787671925, 'bull_time_stop': 199, 'bull_use_sma': True, 'bull_use_ema': False, 'bull_use_atr': False, 'bull_use_adx': True, 'bull_use_spike': True, 'bull_rsi_required': True, 'bear_strategy': 'breakout', 'bear_bb_std_mult': 3.4259224296492117, 'bear_rsi_os': 49, 'bear_rsi_ob': 52, 'bear_adx_thresh': 5.784726395082723, 'bear_atr_min_pct': 0.010852185473132507, 'bear_atr_max_pct': 0.10158591059403904, 'bear_tp_mult': 2.677514409703583, 'bear_tsl_mult': 0.33465850271959313, 'bear_time_stop': 5, 'bear_use_sma': True, 'bear_use_ema': False, 'bear_use_atr': False, 'bear_use_adx': False, 'bear_use_spike': True, 'bear_rsi_required': True, 'sideways_strategy': 'mean_reversion', 'sideways_bb_std_mult': 2.1716391779433155, 'sideways_rsi_os': 26, 'sideways_rsi_ob': 56, 'sideways_adx_thresh': 29.349881064066373, 'sideways_atr_min_pct': 0.02712701222391274, 'sideways_atr_max_pct': 0.027532361468102708, 'sideways_tp_mult': 1.2727734945320937, 'sideways_tsl_mult': 0.9438542703454162, 'sideways_time_stop': 300, 'sideways_use_sma': False, 'sideways_use_ema': True, 'sideways_use_atr': True, 'sideways_use_adx': False, 'sideways_use_spike': True, 'sideways_rsi_required': True}.
