[I 2025-08-30 20:30:54,665] Trial 856 finished with values: [-1000000000.0, 1000000000.0] and parameters: {'p_sma': 46, 'p_std': 15, 'p_atr': 30, 'p_adx': 7, 'rsi_period': 80, 'ema1': 13, 'ema2': 12, 'slip_atr_k': 0.027471726210321498, 'slip_spread_k': 0.6190793003448991, 'spread_hl_frac': 0.04374959763695555, 'bb_std_mult': 1.1955273424270587, 'rsi_os': 39, 'rsi_ob': 50, 'vol_spike': 0.14420945329270662, 'adx_thresh': 22.91643510828425, 'atr_min_pct': 0.0227754265711027, 'atr_max_pct': 0.13092067898177173, 'tp_mult': 2.33707091818535, 'tsl_mult': 0.7539141982536484, 'strategy': 'breakout', 'time_stop': 102, 'use_sma': False, 'use_atr': False, 'use_adx': True, 'use_ema': True, 'use_spike': True, 'rsi_required': True, 'edge_k': 1.1348916545500236, 'edge_cap': 0.6559511947883296, 'bull_strategy': 'mean_reversion', 'bull_bb_std_mult': 1.910411522169022, 'bull_rsi_os': 27, 'bull_rsi_ob': 83, 'bull_adx_thresh': 25.127654889252852, 'bull_atr_min_pct': 0.011014789949271882, 'bull_atr_max_pct': 0.08503907636434627, 'bull_tp_mult': 2.02798444681685, 'bull_tsl_mult': 0.9115089704083995, 'bull_time_stop': 103, 'bull_use_sma': False, 'bull_use_ema': False, 'bull_use_atr': False, 'bull_use_adx': True, 'bull_use_spike': True, 'bull_rsi_required': False, 'bear_strategy': 'mean_reversion', 'bear_bb_std_mult': 3.4086864973481408, 'bear_rsi_os': 46, 'bear_rsi_ob': 51, 'bear_adx_thresh': 6.225658348109029, 'bear_atr_min_pct': 0.008600429730884897, 'bear_atr_max_pct': 0.10606177122748699, 'bear_tp_mult': 2.7262978255585955, 'bear_tsl_mult': 0.5817374474103033, 'bear_time_stop': 15, 'bear_use_sma': True, 'bear_use_ema': False, 'bear_use_atr': True, 'bear_use_adx': True, 'bear_use_spike': False, 'bear_rsi_required': True, 'sideways_strategy': 'mean_reversion', 'sideways_bb_std_mult': 2.2004342694844277, 'sideways_rsi_os': 20, 'sideways_rsi_ob': 57, 'sideways_adx_thresh': 30.227874476673882, 'sideways_atr_min_pct': 0.024240741365571975, 'sideways_atr_max_pct': 0.03896274895466142, 'sideways_tp_mult': 1.3192491669177313, 'sideways_tsl_mult': 0.8849375557314771, 'sideways_time_stop': 148, 'sideways_use_sma': False, 'sideways_use_ema': True, 'sideways_use_atr': False, 'sideways_use_adx': True, 'sideways_use_spike': False, 'sideways_rsi_required': True}.
[I 2025-08-30 20:30:54,766] Trial 854 finished with values: [-1000000000.0, 1000000000.0] and parameters: {'p_sma': 46, 'p_std': 15, 'p_atr': 19, 'p_adx': 7, 'rsi_period': 81, 'ema1': 15, 'ema2': 14, 'slip_atr_k': 0.20990577103675329, 'slip_spread_k': 0.6711073916105792, 'spread_hl_frac': 0.039548658066865805, 'bb_std_mult': 1.1593364123350363, 'rsi_os': 16, 'rsi_ob': 64, 'vol_spike': 0.14374284201351215, 'adx_thresh': 21.001497691290922, 'atr_min_pct': 0.022706888569822177, 'atr_max_pct': 0.12571525716515253, 'tp_mult': 2.259035740292202, 'tsl_mult': 0.8383718485506744, 'strategy': 'breakout', 'time_stop': 42, 'use_sma': False, 'use_atr': True, 'use_adx': True, 'use_ema': True, 'use_spike': True, 'rsi_required': True, 'edge_k': 1.287192161033614, 'edge_cap': 0.5797283850913744, 'bull_strategy': 'mean_reversion', 'bull_bb_std_mult': 1.9069368712568182, 'bull_rsi_os': 14, 'bull_rsi_ob': 71, 'bull_adx_thresh': 8.473813280496532, 'bull_atr_min_pct': 0.010323790126239608, 'bull_atr_max_pct': 0.08405858350488438, 'bull_tp_mult': 2.0791398616704893, 'bull_tsl_mult': 0.9065440276681703, 'bull_time_stop': 193, 'bull_use_sma': False, 'bull_use_ema': False, 'bull_use_atr': False, 'bull_use_adx': True, 'bull_use_spike': True, 'bull_rsi_required': False, 'bear_strategy': 'mean_reversion', 'bear_bb_std_mult': 3.4833522987411674, 'bear_rsi_os': 46, 'bear_rsi_ob': 45, 'bear_adx_thresh': 5.026339279279056, 'bear_atr_min_pct': 0.008766567108814492, 'bear_atr_max_pct': 0.1328148548572096, 'bear_tp_mult': 2.8339602971154525, 'bear_tsl_mult': 0.5883661124246091, 'bear_time_stop': 16, 'bear_use_sma': True, 'bear_use_ema': False, 'bear_use_atr': True, 'bear_use_adx': True, 'bear_use_spike': False, 'bear_rsi_required': True, 'sideways_strategy': 'mean_reversion', 'sideways_bb_std_mult': 2.199222604294437, 'sideways_rsi_os': 21, 'sideways_rsi_ob': 56, 'sideways_adx_thresh': 26.781825710483538, 'sideways_atr_min_pct': 0.024303475678009126, 'sideways_atr_max_pct': 0.023653975843151303, 'sideways_tp_mult': 1.3406879773734137, 'sideways_tsl_mult': 0.8865609345916802, 'sideways_time_stop': 279, 'sideways_use_sma': False, 'sideways_use_ema': True, 'sideways_use_atr': False, 'sideways_use_adx': True, 'sideways_use_spike': False, 'sideways_rsi_required': True}.
[I 2025-08-30 20:30:54,947] Trial 855 finished with values: [-1000000000.0, 1000000000.0] and parameters: {'p_sma': 46, 'p_std': 15, 'p_atr': 30, 'p_adx': 7, 'rsi_period': 81, 'ema1': 11, 'ema2': 14, 'slip_atr_k': 0.028328307306663608, 'slip_spread_k': 0.6140736131982044, 'spread_hl_frac': 0.03458107302484079, 'bb_std_mult': 1.2005974671297475, 'rsi_os': 25, 'rsi_ob': 73, 'vol_spike': 0.1383353722066305, 'adx_thresh': 22.54439071688864, 'atr_min_pct': 0.022655995134876074, 'atr_max_pct': 0.13078753572895302, 'tp_mult': 2.391742569565695, 'tsl_mult': 0.6788146135112025, 'strategy': 'breakout', 'time_stop': 43, 'use_sma': False, 'use_atr': True, 'use_adx': True, 'use_ema': True, 'use_spike': True, 'rsi_required': True, 'edge_k': 1.2633038812866833, 'edge_cap': 0.6354270433459733, 'bull_strategy': 'mean_reversion', 'bull_bb_std_mult': 1.881507795173475, 'bull_rsi_os': 13, 'bull_rsi_ob': 73, 'bull_adx_thresh': 8.598832404537749, 'bull_atr_min_pct': 0.013236785626714667, 'bull_atr_max_pct': 0.08367635188732732, 'bull_tp_mult': 2.053629559934645, 'bull_tsl_mult': 0.9191229646230261, 'bull_time_stop': 192, 'bull_use_sma': False, 'bull_use_ema': False, 'bull_use_atr': False, 'bull_use_adx': True, 'bull_use_spike': True, 'bull_rsi_required': False, 'bear_strategy': 'mean_reversion', 'bear_bb_std_mult': 3.412439742218679, 'bear_rsi_os': 46, 'bear_rsi_ob': 53, 'bear_adx_thresh': 28.6958033891938, 'bear_atr_min_pct': 0.008064050952756302, 'bear_atr_max_pct': 0.13259059679449617, 'bear_tp_mult': 2.7302526077087124, 'bear_tsl_mult': 0.9370404235210964, 'bear_time_stop': 17, 'bear_use_sma': True, 'bear_use_ema': False, 'bear_use_atr': True, 'bear_use_adx': True, 'bear_use_spike': False, 'bear_rsi_required': True, 'sideways_strategy': 'mean_reversion', 'sideways_bb_std_mult': 1.9640942503462704, 'sideways_rsi_os': 21, 'sideways_rsi_ob': 55, 'sideways_adx_thresh': 25.09014809856442, 'sideways_atr_min_pct': 0.024650166493711156, 'sideways_atr_max_pct': 0.03889381355502273, 'sideways_tp_mult': 1.1502337211241627, 'sideways_tsl_mult': 0.8823444033399728, 'sideways_time_stop': 287, 'sideways_use_sma': False, 'sideways_use_ema': True, 'sideways_use_atr': False, 'sideways_use_adx': True, 'sideways_use_spike': False, 'sideways_rsi_required': True}.
[I 2025-08-30 20:30:55,992] Trial 861 finished with values: [-1000000000.0, 1000000000.0] and parameters: {'p_sma': 47, 'p_std': 11, 'p_atr': 10, 'p_adx': 7, 'rsi_period': 84, 'ema1': 12, 'ema2': 15, 'slip_atr_k': 0.02204103341876448, 'slip_spread_k': 0.6469625919178752, 'spread_hl_frac': 0.03791280462617296, 'bb_std_mult': 1.0380784091423398, 'rsi_os': 20, 'rsi_ob': 48, 'vol_spike': 0.1268748555940739, 'adx_thresh': 23.551499250644806, 'atr_min_pct': 0.02156968136540213, 'atr_max_pct': 0.128149585592656, 'tp_mult': 2.2514153209645316, 'tsl_mult': 0.6142774715555986, 'strategy': 'mean_reversion', 'time_stop': 40, 'use_sma': False, 'use_atr': True, 'use_adx': False, 'use_ema': False, 'use_spike': False, 'rsi_required': False, 'edge_k': 1.467360778242075, 'edge_cap': 0.3868338390892248, 'bull_strategy': 'breakout', 'bull_bb_std_mult': 0.6579538131265861, 'bull_rsi_os': 22, 'bull_rsi_ob': 69, 'bull_adx_thresh': 11.933234834465297, 'bull_atr_min_pct': 0.008551110820379475, 'bull_atr_max_pct': 0.08013109301319096, 'bull_tp_mult': 1.9919677389823964, 'bull_tsl_mult': 0.9326423858585473, 'bull_time_stop': 20, 'bull_use_sma': True, 'bull_use_ema': True, 'bull_use_atr': True, 'bull_use_adx': False, 'bull_use_spike': False, 'bull_rsi_required': True, 'bear_strategy': 'breakout', 'bear_bb_std_mult': 3.418136956598506, 'bear_rsi_os': 48, 'bear_rsi_ob': 47, 'bear_adx_thresh': 5.653324271991532, 'bear_atr_min_pct': 0.01090750438943866, 'bear_atr_max_pct': 0.12241126679135449, 'bear_tp_mult': 2.90596767371787, 'bear_tsl_mult': 0.9078645664819385, 'bear_time_stop': 11, 'bear_use_sma': False, 'bear_use_ema': True, 'bear_use_atr': False, 'bear_use_adx': False, 'bear_use_spike': True, 'bear_rsi_required': True, 'sideways_strategy': 'mean_reversion', 'sideways_bb_std_mult': 2.0894530698501774, 'sideways_rsi_os': 20, 'sideways_rsi_ob': 57, 'sideways_adx_thresh': 23.989955392381002, 'sideways_atr_min_pct': 0.02650014818910354, 'sideways_atr_max_pct': 0.04506215935482006, 'sideways_tp_mult': 1.485139451419811, 'sideways_tsl_mult': 0.9203652045493351, 'sideways_time_stop': 278, 'sideways_use_sma': False, 'sideways_use_ema': False, 'sideways_use_atr': True, 'sideways_use_adx': False, 'sideways_use_spike': True, 'sideways_rsi_required': True}.
[I 2025-08-30 20:31:32,126] Trial 858 finished with values: [-1000000000.0, 1000000000.0] and parameters: {'p_sma': 47, 'p_std': 11, 'p_atr': 28, 'p_adx': 7, 'rsi_period': 78, 'ema1': 12, 'ema2': 13, 'slip_atr_k': 0.029120539388832148, 'slip_spread_k': 0.641037693510274, 'spread_hl_frac': 0.04358513888763026, 'bb_std_mult': 1.216207926290745, 'rsi_os': 40, 'rsi_ob': 50, 'vol_spike': 0.14416520280069078, 'adx_thresh': 22.360278189910417, 'atr_min_pct': 0.02287022299670214, 'atr_max_pct': 0.13143302773644777, 'tp_mult': 2.407855185758753, 'tsl_mult': 0.6143157093487357, 'strategy': 'breakout', 'time_stop': 43, 'use_sma': False, 'use_atr': True, 'use_adx': True, 'use_ema': True, 'use_spike': True, 'rsi_required': True, 'edge_k': 1.4663344587309308, 'edge_cap': 0.38846114692491396, 'bull_strategy': 'mean_reversion', 'bull_bb_std_mult': 1.8962548047864594, 'bull_rsi_os': 9, 'bull_rsi_ob': 61, 'bull_adx_thresh': 15.7846470302355, 'bull_atr_min_pct': 0.016164057726551474, 'bull_atr_max_pct': 0.0832799119641253, 'bull_tp_mult': 1.984887561992659, 'bull_tsl_mult': 0.9315897417557423, 'bull_time_stop': 253, 'bull_use_sma': False, 'bull_use_ema': False, 'bull_use_atr': False, 'bull_use_adx': True, 'bull_use_spike': True, 'bull_rsi_required': False, 'bear_strategy': 'mean_reversion', 'bear_bb_std_mult': 3.3966765098079206, 'bear_rsi_os': 46, 'bear_rsi_ob': 51, 'bear_adx_thresh': 6.234704604052535, 'bear_atr_min_pct': 0.008336628224444063, 'bear_atr_max_pct': 0.10638045565764065, 'bear_tp_mult': 2.7596230157156114, 'bear_tsl_mult': 0.5462572541293697, 'bear_time_stop': 11, 'bear_use_sma': True, 'bear_use_ema': False, 'bear_use_atr': True, 'bear_use_adx': True, 'bear_use_spike': False, 'bear_rsi_required': True, 'sideways_strategy': 'mean_reversion', 'sideways_bb_std_mult': 1.202084918726432, 'sideways_rsi_os': 20, 'sideways_rsi_ob': 57, 'sideways_adx_thresh': 23.23649978980999, 'sideways_atr_min_pct': 0.026589732911376635, 'sideways_atr_max_pct': 0.04443988486477214, 'sideways_tp_mult': 1.2247530094948285, 'sideways_tsl_mult': 0.9045993517361365, 'sideways_time_stop': 279, 'sideways_use_sma': False, 'sideways_use_ema': True, 'sideways_use_atr': False, 'sideways_use_adx': True, 'sideways_use_spike': False, 'sideways_rsi_required': True}.
[I 2025-08-30 20:31:32,608] Trial 859 finished with values: [-1000000000.0, 1000000000.0] and parameters: {'p_sma': 47, 'p_std': 5, 'p_atr': 10, 'p_adx': 7, 'rsi_period': 84, 'ema1': 12, 'ema2': 15, 'slip_atr_k': 0.04266690012967468, 'slip_spread_k': 0.6457441974915499, 'spread_hl_frac': 0.04823882697241477, 'bb_std_mult': 1.0415427639799648, 'rsi_os': 37, 'rsi_ob': 68, 'vol_spike': 0.1253225538024786, 'adx_thresh': 22.29124518691278, 'atr_min_pct': 0.0229104372909369, 'atr_max_pct': 0.13103525935506893, 'tp_mult': 2.2448427310131858, 'tsl_mult': 0.21393858733410226, 'strategy': 'mean_reversion', 'time_stop': 41, 'use_sma': False, 'use_atr': True, 'use_adx': False, 'use_ema': False, 'use_spike': True, 'rsi_required': False, 'edge_k': 1.0392456243889696, 'edge_cap': 0.38623306495250814, 'bull_strategy': 'mean_reversion', 'bull_bb_std_mult': 3.542875119475796, 'bull_rsi_os': 22, 'bull_rsi_ob': 61, 'bull_adx_thresh': 19.942733587864925, 'bull_atr_min_pct': 0.006650466031497123, 'bull_atr_max_pct': 0.08058327278593597, 'bull_tp_mult': 1.9705584224920756, 'bull_tsl_mult': 0.9351634075407328, 'bull_time_stop': 252, 'bull_use_sma': True, 'bull_use_ema': True, 'bull_use_atr': False, 'bull_use_adx': True, 'bull_use_spike': False, 'bull_rsi_required': True, 'bear_strategy': 'breakout', 'bear_bb_std_mult': 3.410382510095187, 'bear_rsi_os': 48, 'bear_rsi_ob': 47, 'bear_adx_thresh': 5.634709899263007, 'bear_atr_min_pct': 0.011126081530679979, 'bear_atr_max_pct': 0.08304361497159483, 'bear_tp_mult': 2.9173038719360465, 'bear_tsl_mult': 0.9983796156686615, 'bear_time_stop': 10, 'bear_use_sma': False, 'bear_use_ema': False, 'bear_use_atr': False, 'bear_use_adx': False, 'bear_use_spike': True, 'bear_rsi_required': True, 'sideways_strategy': 'mean_reversion', 'sideways_bb_std_mult': 1.9789949380389433, 'sideways_rsi_os': 21, 'sideways_rsi_ob': 55, 'sideways_adx_thresh': 27.552089687656935, 'sideways_atr_min_pct': 0.027515184347509113, 'sideways_atr_max_pct': 0.04492586476452488, 'sideways_tp_mult': 1.2472533221438842, 'sideways_tsl_mult': 0.9112671457119164, 'sideways_time_stop': 128, 'sideways_use_sma': False, 'sideways_use_ema': True, 'sideways_use_atr': True, 'sideways_use_adx': False, 'sideways_use_spike': True, 'sideways_rsi_required': True}.
[I 2025-08-30 20:31:32,818] Trial 860 finished with values: [-1000000000.0, 1000000000.0] and parameters: {'p_sma': 47, 'p_std': 11, 'p_atr': 10, 'p_adx': 7, 'rsi_period': 84, 'ema1': 14, 'ema2': 15, 'slip_atr_k': 0.11874948845837682, 'slip_spread_k': 0.6489812127710181, 'spread_hl_frac': 0.037553806360573344, 'bb_std_mult': 1.0399932804500547, 'rsi_os': 25, 'rsi_ob': 68, 'vol_spike': 0.12289451591192974, 'adx_thresh': 22.578775069417283, 'atr_min_pct': 0.021289148817575487, 'atr_max_pct': 0.13142914816692405, 'tp_mult': 2.4138531714949916, 'tsl_mult': 0.7834358452463442, 'strategy': 'mean_reversion', 'time_stop': 42, 'use_sma': False, 'use_atr': True, 'use_adx': False, 'use_ema': False, 'use_spike': True, 'rsi_required': False, 'edge_k': 1.0443517081914073, 'edge_cap': 0.41200270917619897, 'bull_strategy': 'mean_reversion', 'bull_bb_std_mult': 1.7454656284239998, 'bull_rsi_os': 22, 'bull_rsi_ob': 89, 'bull_adx_thresh': 25.093477682883165, 'bull_atr_min_pct': 0.006699853720619755, 'bull_atr_max_pct': 0.08723679451788187, 'bull_tp_mult': 1.9954886903492646, 'bull_tsl_mult': 0.931534595370229, 'bull_time_stop': 191, 'bull_use_sma': True, 'bull_use_ema': True, 'bull_use_atr': False, 'bull_use_adx': True, 'bull_use_spike': False, 'bull_rsi_required': True, 'bear_strategy': 'breakout', 'bear_bb_std_mult': 3.5223445205783426, 'bear_rsi_os': 48, 'bear_rsi_ob': 47, 'bear_adx_thresh': 33.68100660142079, 'bear_atr_min_pct': 0.011047984893914823, 'bear_atr_max_pct': 0.08478668508259903, 'bear_tp_mult': 2.780830612435788, 'bear_tsl_mult': 0.13042627861222944, 'bear_time_stop': 10, 'bear_use_sma': False, 'bear_use_ema': False, 'bear_use_atr': False, 'bear_use_adx': False, 'bear_use_spike': True, 'bear_rsi_required': True, 'sideways_strategy': 'mean_reversion', 'sideways_bb_std_mult': 3.5287987678561694, 'sideways_rsi_os': 22, 'sideways_rsi_ob': 55, 'sideways_adx_thresh': 24.653892214257006, 'sideways_atr_min_pct': 0.02657908241990446, 'sideways_atr_max_pct': 0.04361233986699313, 'sideways_tp_mult': 1.247299416180648, 'sideways_tsl_mult': 0.9043498030667299, 'sideways_time_stop': 34, 'sideways_use_sma': False, 'sideways_use_ema': True, 'sideways_use_atr': True, 'sideways_use_adx': False, 'sideways_use_spike': True, 'sideways_rsi_required': True}.
[I 2025-08-30 20:31:33,754] Trial 862 finished with values: [-1000000000.0, 1000000000.0] and parameters: {'p_sma': 45, 'p_std': 7, 'p_atr': 10, 'p_adx': 7, 'rsi_period': 79, 'ema1': 14, 'ema2': 13, 'slip_atr_k': 0.11844561063359148, 'slip_spread_k': 0.6483744079883317, 'spread_hl_frac': 0.04847104231233627, 'bb_std_mult': 1.6967348115347738, 'rsi_os': 51, 'rsi_ob': 66, 'vol_spike': 0.11944597944520738, 'adx_thresh': 22.053253226407772, 'atr_min_pct': 0.020738487262754818, 'atr_max_pct': 0.13153275403422926, 'tp_mult': 2.3214961282126048, 'tsl_mult': 0.48577101054614813, 'strategy': 'breakout', 'time_stop': 70, 'use_sma': True, 'use_atr': True, 'use_adx': False, 'use_ema': False, 'use_spike': True, 'rsi_required': True, 'edge_k': 1.2411039486320155, 'edge_cap': 0.32765707294946034, 'bull_strategy': 'mean_reversion', 'bull_bb_std_mult': 1.7261045029803666, 'bull_rsi_os': 6, 'bull_rsi_ob': 72, 'bull_adx_thresh': 23.40291047023198, 'bull_atr_min_pct': 0.005720242047485585, 'bull_atr_max_pct': 0.08740588543530033, 'bull_tp_mult': 2.1065103127251406, 'bull_tsl_mult': 0.9378639290824528, 'bull_time_stop': 83, 'bull_use_sma': True, 'bull_use_ema': False, 'bull_use_atr': False, 'bull_use_adx': True, 'bull_use_spike': True, 'bull_rsi_required': True, 'bear_strategy': 'breakout', 'bear_bb_std_mult': 3.3890856698145435, 'bear_rsi_os': 46, 'bear_rsi_ob': 51, 'bear_adx_thresh': 33.54652853395173, 'bear_atr_min_pct': 0.009250868303409706, 'bear_atr_max_pct': 0.08378671586010611, 'bear_tp_mult': 2.7912250430539514, 'bear_tsl_mult': 0.13708553603103438, 'bear_time_stop': 13, 'bear_use_sma': True, 'bear_use_ema': False, 'bear_use_atr': True, 'bear_use_adx': True, 'bear_use_spike': False, 'bear_rsi_required': True, 'sideways_strategy': 'mean_reversion', 'sideways_bb_std_mult': 0.6293544283230108, 'sideways_rsi_os': 26, 'sideways_rsi_ob': 57, 'sideways_adx_thresh': 27.531961930132614, 'sideways_atr_min_pct': 0.02525994653188072, 'sideways_atr_max_pct': 0.042839486658922094, 'sideways_tp_mult': 1.2486688677089497, 'sideways_tsl_mult': 0.8564765429384529, 'sideways_time_stop': 130, 'sideways_use_sma': False, 'sideways_use_ema': True, 'sideways_use_atr': False, 'sideways_use_adx': False, 'sideways_use_spike': False, 'sideways_rsi_required': True}.
[I 2025-08-30 20:32:08,957] Trial 866 finished with values: [-1000000000.0, 1000000000.0] and parameters: {'p_sma': 48, 'p_std': 13, 'p_atr': 8, 'p_adx': 7, 'rsi_period': 80, 'ema1': 16, 'ema2': 15, 'slip_atr_k': 0.022771123808451938, 'slip_spread_k': 0.6002651668435887, 'spread_hl_frac': 0.03604178724620592, 'bb_std_mult': 1.136935114304623, 'rsi_os': 37, 'rsi_ob': 63, 'vol_spike': 0.10966559251452561, 'adx_thresh': 26.31731180333896, 'atr_min_pct': 0.02234304018236099, 'atr_max_pct': 0.12707476573473447, 'tp_mult': 2.3141426546218127, 'tsl_mult': 0.566802121522449, 'strategy': 'breakout', 'time_stop': 65, 'use_sma': True, 'use_atr': False, 'use_adx': False, 'use_ema': False, 'use_spike': False, 'rsi_required': True, 'edge_k': 1.1960133468865952, 'edge_cap': 0.4365497276243073, 'bull_strategy': 'breakout', 'bull_bb_std_mult': 2.227931735376704, 'bull_rsi_os': 16, 'bull_rsi_ob': 78, 'bull_adx_thresh': 5.469373536875215, 'bull_atr_min_pct': 0.009635302031371966, 'bull_atr_max_pct': 0.0770061215117342, 'bull_tp_mult': 2.1028370533788263, 'bull_tsl_mult': 0.9419524550408768, 'bull_time_stop': 200, 'bull_use_sma': True, 'bull_use_ema': False, 'bull_use_atr': True, 'bull_use_adx': False, 'bull_use_spike': True, 'bull_rsi_required': True, 'bear_strategy': 'breakout', 'bear_bb_std_mult': 3.5035543069128186, 'bear_rsi_os': 50, 'bear_rsi_ob': 48, 'bear_adx_thresh': 6.35058707696269, 'bear_atr_min_pct': 0.007430542443122391, 'bear_atr_max_pct': 0.13911942039021274, 'bear_tp_mult': 2.958160369550848, 'bear_tsl_mult': 0.12228637848219741, 'bear_time_stop': 18, 'bear_use_sma': True, 'bear_use_ema': True, 'bear_use_atr': True, 'bear_use_adx': True, 'bear_use_spike': False, 'bear_rsi_required': True, 'sideways_strategy': 'mean_reversion', 'sideways_bb_std_mult': 2.0412539371318172, 'sideways_rsi_os': 23, 'sideways_rsi_ob': 95, 'sideways_adx_thresh': 29.221432271932557, 'sideways_atr_min_pct': 0.025708826679076598, 'sideways_atr_max_pct': 0.03229151286593156, 'sideways_tp_mult': 1.3689145542331944, 'sideways_tsl_mult': 0.8402708574461741, 'sideways_time_stop': 292, 'sideways_use_sma': False, 'sideways_use_ema': False, 'sideways_use_atr': False, 'sideways_use_adx': False, 'sideways_use_spike': False, 'sideways_rsi_required': True}.
