[I 2025-08-30 19:57:45,612] Trial 620 finished with values: [-1000000000.0, 1000000000.0] and parameters: {'p_sma': 52, 'p_std': 22, 'p_atr': 10, 'p_adx': 8, 'rsi_period': 53, 'ema1': 24, 'ema2': 17, 'slip_atr_k': 0.021908417840557543, 'slip_spread_k': 0.4235796994908733, 'spread_hl_frac': 0.0013162128697261676, 'bb_std_mult': 2.999641457285761, 'rsi_os': 38, 'rsi_ob': 81, 'vol_spike': 0.08165441339909195, 'adx_thresh': 5.020291298641972, 'atr_min_pct': 0.016132061027564974, 'atr_max_pct': 0.04915604705456841, 'tp_mult': 2.1499243550451417, 'tsl_mult': 0.7140818279850722, 'strategy': 'mean_reversion', 'time_stop': 24, 'use_sma': False, 'use_atr': True, 'use_adx': False, 'use_ema': False, 'use_spike': True, 'rsi_required': True, 'edge_k': 0.10217626103836305, 'edge_cap': 0.6334825751529889, 'bull_strategy': 'mean_reversion', 'bull_bb_std_mult': 1.941346030027283, 'bull_rsi_os': 23, 'bull_rsi_ob': 72, 'bull_adx_thresh': 26.773661623877942, 'bull_atr_min_pct': 0.011956019950523394, 'bull_atr_max_pct': 0.0572617966652617, 'bull_tp_mult': 2.168517764778683, 'bull_tsl_mult': 0.8269825125972236, 'bull_time_stop': 183, 'bull_use_sma': True, 'bull_use_ema': False, 'bull_use_atr': False, 'bull_use_adx': True, 'bull_use_spike': False, 'bull_rsi_required': True, 'bear_strategy': 'breakout', 'bear_bb_std_mult': 1.6918840530914814, 'bear_rsi_os': 45, 'bear_rsi_ob': 59, 'bear_adx_thresh': 24.209181497091198, 'bear_atr_min_pct': 0.015152811144391811, 'bear_atr_max_pct': 0.05267930103249742, 'bear_tp_mult': 2.5811739116752737, 'bear_tsl_mult': 0.060652863249689604, 'bear_time_stop': 44, 'bear_use_sma': True, 'bear_use_ema': False, 'bear_use_atr': True, 'bear_use_adx': True, 'bear_use_spike': False, 'bear_rsi_required': False, 'sideways_strategy': 'breakout', 'sideways_bb_std_mult': 0.5411106757392246, 'sideways_rsi_os': 40, 'sideways_rsi_ob': 89, 'sideways_adx_thresh': 9.477867008133673, 'sideways_atr_min_pct': 0.018971902468412356, 'sideways_atr_max_pct': 0.06602237861891413, 'sideways_tp_mult': 1.2487634229281646, 'sideways_tsl_mult': 0.6577125168759951, 'sideways_time_stop': 276, 'sideways_use_sma': True, 'sideways_use_ema': True, 'sideways_use_atr': False, 'sideways_use_adx': False, 'sideways_use_spike': False, 'sideways_rsi_required': False}.
[I 2025-08-30 19:58:21,078] Trial 622 finished with values: [-1000000000.0, 1000000000.0] and parameters: {'p_sma': 42, 'p_std': 49, 'p_atr': 9, 'p_adx': 8, 'rsi_period': 53, 'ema1': 24, 'ema2': 17, 'slip_atr_k': 0.02735139197514294, 'slip_spread_k': 0.08769786764210447, 'spread_hl_frac': 0.0007634313958467935, 'bb_std_mult': 0.9424575520953687, 'rsi_os': 33, 'rsi_ob': 58, 'vol_spike': 0.0425527247596367, 'adx_thresh': 32.91814516658201, 'atr_min_pct': 0.025314258233495576, 'atr_max_pct': 0.09173977951667235, 'tp_mult': 2.1447301417812694, 'tsl_mult': 0.22051118576731094, 'strategy': 'breakout', 'time_stop': 35, 'use_sma': False, 'use_atr': True, 'use_adx': False, 'use_ema': False, 'use_spike': True, 'rsi_required': True, 'edge_k': 0.18399789670520464, 'edge_cap': 0.2611383187024703, 'bull_strategy': 'mean_reversion', 'bull_bb_std_mult': 1.9102283081747704, 'bull_rsi_os': 42, 'bull_rsi_ob': 87, 'bull_adx_thresh': 26.812051833657392, 'bull_atr_min_pct': 0.00381638420687271, 'bull_atr_max_pct': 0.08495271712759715, 'bull_tp_mult': 2.104561848136809, 'bull_tsl_mult': 0.8265215593574932, 'bull_time_stop': 130, 'bull_use_sma': True, 'bull_use_ema': False, 'bull_use_atr': False, 'bull_use_adx': True, 'bull_use_spike': False, 'bull_rsi_required': True, 'bear_strategy': 'breakout', 'bear_bb_std_mult': 3.3505021121161973, 'bear_rsi_os': 34, 'bear_rsi_ob': 47, 'bear_adx_thresh': 27.341968466073894, 'bear_atr_min_pct': 0.028800580140547854, 'bear_atr_max_pct': 0.03821172473926357, 'bear_tp_mult': 2.9995939141820793, 'bear_tsl_mult': 0.1167119521867499, 'bear_time_stop': 103, 'bear_use_sma': True, 'bear_use_ema': False, 'bear_use_atr': True, 'bear_use_adx': True, 'bear_use_spike': True, 'bear_rsi_required': False, 'sideways_strategy': 'mean_reversion', 'sideways_bb_std_mult': 2.171540820587379, 'sideways_rsi_os': 16, 'sideways_rsi_ob': 58, 'sideways_adx_thresh': 7.530876554186758, 'sideways_atr_min_pct': 0.019517693171888787, 'sideways_atr_max_pct': 0.05683267232147074, 'sideways_tp_mult': 2.1877761431954825, 'sideways_tsl_mult': 0.9995201748410567, 'sideways_time_stop': 188, 'sideways_use_sma': True, 'sideways_use_ema': True, 'sideways_use_atr': False, 'sideways_use_adx': False, 'sideways_use_spike': False, 'sideways_rsi_required': False}.
[I 2025-08-30 19:58:22,289] Trial 623 finished with values: [-1000000000.0, 1000000000.0] and parameters: {'p_sma': 6, 'p_std': 23, 'p_atr': 15, 'p_adx': 8, 'rsi_period': 18, 'ema1': 24, 'ema2': 16, 'slip_atr_k': 0.1337269895026876, 'slip_spread_k': 0.6511403540812489, 'spread_hl_frac': 0.036375768548309595, 'bb_std_mult': 1.2646675837575325, 'rsi_os': 38, 'rsi_ob': 91, 'vol_spike': 0.0378793503617293, 'adx_thresh': 11.400699301659074, 'atr_min_pct': 0.016302473718954637, 'atr_max_pct': 0.036773518792656695, 'tp_mult': 1.982937495119902, 'tsl_mult': 0.7173965816152728, 'strategy': 'breakout', 'time_stop': 33, 'use_sma': False, 'use_atr': True, 'use_adx': False, 'use_ema': False, 'use_spike': True, 'rsi_required': False, 'edge_k': 0.17692783120315125, 'edge_cap': 0.42024620552547487, 'bull_strategy': 'mean_reversion', 'bull_bb_std_mult': 0.9782859304163238, 'bull_rsi_os': 37, 'bull_rsi_ob': 72, 'bull_adx_thresh': 26.555884876022752, 'bull_atr_min_pct': 0.0007928444230674583, 'bull_atr_max_pct': 0.028844778530011987, 'bull_tp_mult': 2.106266592501461, 'bull_tsl_mult': 0.7052188869578057, 'bull_time_stop': 71, 'bull_use_sma': True, 'bull_use_ema': False, 'bull_use_atr': True, 'bull_use_adx': False, 'bull_use_spike': True, 'bull_rsi_required': True, 'bear_strategy': 'breakout', 'bear_bb_std_mult': 3.136257287715349, 'bear_rsi_os': 45, 'bear_rsi_ob': 58, 'bear_adx_thresh': 20.06029739270834, 'bear_atr_min_pct': 0.007942717167982439, 'bear_atr_max_pct': 0.08608630520841752, 'bear_tp_mult': 1.2910065456401645, 'bear_tsl_mult': 0.06927647496747516, 'bear_time_stop': 104, 'bear_use_sma': True, 'bear_use_ema': True, 'bear_use_atr': True, 'bear_use_adx': True, 'bear_use_spike': True, 'bear_rsi_required': False, 'sideways_strategy': 'mean_reversion', 'sideways_bb_std_mult': 2.1786465534948944, 'sideways_rsi_os': 7, 'sideways_rsi_ob': 87, 'sideways_adx_thresh': 7.198372192552963, 'sideways_atr_min_pct': 0.01646192019488392, 'sideways_atr_max_pct': 0.0556222015736685, 'sideways_tp_mult': 2.6115048888094368, 'sideways_tsl_mult': 0.9938764097548027, 'sideways_time_stop': 263, 'sideways_use_sma': True, 'sideways_use_ema': True, 'sideways_use_atr': True, 'sideways_use_adx': False, 'sideways_use_spike': False, 'sideways_rsi_required': False}.
[I 2025-08-30 19:58:22,448] Trial 625 finished with values: [-0.026163385505488024, 0.026054495455946746] and parameters: {'p_sma': 42, 'p_std': 26, 'p_atr': 9, 'p_adx': 21, 'rsi_period': 49, 'ema1': 23, 'ema2': 16, 'slip_atr_k': 0.009839923019712201, 'slip_spread_k': 0.6911499289381816, 'spread_hl_frac': 0.021855910564318175, 'bb_std_mult': 1.9486288455800909, 'rsi_os': 38, 'rsi_ob': 55, 'vol_spike': 0.12961257146560484, 'adx_thresh': 28.626986307562486, 'atr_min_pct': 0.025029318307705176, 'atr_max_pct': 0.06915687590262093, 'tp_mult': 1.964452987013842, 'tsl_mult': 0.6448993567245456, 'strategy': 'breakout', 'time_stop': 53, 'use_sma': False, 'use_atr': False, 'use_adx': True, 'use_ema': False, 'use_spike': True, 'rsi_required': False, 'edge_k': 0.18474005955048187, 'edge_cap': 0.7932780705865841, 'bull_strategy': 'breakout', 'bull_bb_std_mult': 0.9776768245885521, 'bull_rsi_os': 49, 'bull_rsi_ob': 86, 'bull_adx_thresh': 5.784763929000466, 'bull_atr_min_pct': 0.003994396839732806, 'bull_atr_max_pct': 0.026777793183555738, 'bull_tp_mult': 2.0982609960425442, 'bull_tsl_mult': 0.24479209277786457, 'bull_time_stop': 195, 'bull_use_sma': True, 'bull_use_ema': False, 'bull_use_atr': True, 'bull_use_adx': False, 'bull_use_spike': True, 'bull_rsi_required': True, 'bear_strategy': 'breakout', 'bear_bb_std_mult': 3.120887856331885, 'bear_rsi_os': 46, 'bear_rsi_ob': 86, 'bear_adx_thresh': 15.762618837694426, 'bear_atr_min_pct': 0.0038849888006569286, 'bear_atr_max_pct': 0.056698173907226326, 'bear_tp_mult': 1.7634854464384018, 'bear_tsl_mult': 0.10974165326552286, 'bear_time_stop': 28, 'bear_use_sma': True, 'bear_use_ema': True, 'bear_use_atr': False, 'bear_use_adx': False, 'bear_use_spike': True, 'bear_rsi_required': False, 'sideways_strategy': 'mean_reversion', 'sideways_bb_std_mult': 2.970242881116084, 'sideways_rsi_os': 47, 'sideways_rsi_ob': 58, 'sideways_adx_thresh': 7.247511078914188, 'sideways_atr_min_pct': 0.020521477515122125, 'sideways_atr_max_pct': 0.044671429402530854, 'sideways_tp_mult': 1.6537973580939307, 'sideways_tsl_mult': 0.5164301774076778, 'sideways_time_stop': 263, 'sideways_use_sma': False, 'sideways_use_ema': True, 'sideways_use_atr': True, 'sideways_use_adx': False, 'sideways_use_spike': False, 'sideways_rsi_required': True}.
[I 2025-08-30 19:58:22,550] Trial 624 finished with values: [-1000000000.0, 1000000000.0] and parameters: {'p_sma': 49, 'p_std': 49, 'p_atr': 15, 'p_adx': 8, 'rsi_period': 18, 'ema1': 24, 'ema2': 16, 'slip_atr_k': 0.0560001841498296, 'slip_spread_k': 0.9101577390007305, 'spread_hl_frac': 0.001837248616850474, 'bb_std_mult': 3.5942419396726697, 'rsi_os': 39, 'rsi_ob': 68, 'vol_spike': 0.07559479953417902, 'adx_thresh': 18.483578770930173, 'atr_min_pct': 0.02257256140774832, 'atr_max_pct': 0.13858563977915522, 'tp_mult': 1.7457472065733395, 'tsl_mult': 0.7228106810466457, 'strategy': 'breakout', 'time_stop': 34, 'use_sma': False, 'use_atr': False, 'use_adx': True, 'use_ema': False, 'use_spike': True, 'rsi_required': False, 'edge_k': 0.17389818135869956, 'edge_cap': 0.9646440502388861, 'bull_strategy': 'breakout', 'bull_bb_std_mult': 0.5650904882857231, 'bull_rsi_os': 8, 'bull_rsi_ob': 75, 'bull_adx_thresh': 26.87228563906131, 'bull_atr_min_pct': 0.0037701228779657256, 'bull_atr_max_pct': 0.027141439681306737, 'bull_tp_mult': 2.095460888746219, 'bull_tsl_mult': 0.8306321922977236, 'bull_time_stop': 74, 'bull_use_sma': True, 'bull_use_ema': False, 'bull_use_atr': True, 'bull_use_adx': False, 'bull_use_spike': True, 'bull_rsi_required': True, 'bear_strategy': 'breakout', 'bear_bb_std_mult': 3.5370376055962605, 'bear_rsi_os': 45, 'bear_rsi_ob': 85, 'bear_adx_thresh': 24.248562986355626, 'bear_atr_min_pct': 0.019288661302349352, 'bear_atr_max_pct': 0.10425796847797426, 'bear_tp_mult': 2.026443098709509, 'bear_tsl_mult': 0.11418768859096035, 'bear_time_stop': 46, 'bear_use_sma': True, 'bear_use_ema': True, 'bear_use_atr': False, 'bear_use_adx': False, 'bear_use_spike': True, 'bear_rsi_required': False, 'sideways_strategy': 'mean_reversion', 'sideways_bb_std_mult': 2.193313394759626, 'sideways_rsi_os': 7, 'sideways_rsi_ob': 60, 'sideways_adx_thresh': 17.404740344824862, 'sideways_atr_min_pct': 0.019459192542400323, 'sideways_atr_max_pct': 0.0562827642402183, 'sideways_tp_mult': 2.6112118277153766, 'sideways_tsl_mult': 0.9949372793204284, 'sideways_time_stop': 265, 'sideways_use_sma': False, 'sideways_use_ema': True, 'sideways_use_atr': True, 'sideways_use_adx': False, 'sideways_use_spike': False, 'sideways_rsi_required': True}.
[I 2025-08-30 19:58:55,615] Trial 628 finished with values: [-1000000000.0, 1000000000.0] and parameters: {'p_sma': 39, 'p_std': 25, 'p_atr': 14, 'p_adx': 24, 'rsi_period': 43, 'ema1': 6, 'ema2': 23, 'slip_atr_k': 0.17078336851007203, 'slip_spread_k': 0.44577338465436034, 'spread_hl_frac': 0.04209114389569506, 'bb_std_mult': 0.8938857532290667, 'rsi_os': 40, 'rsi_ob': 69, 'vol_spike': 0.027761508988656772, 'adx_thresh': 18.47509377507496, 'atr_min_pct': 0.02271867132303231, 'atr_max_pct': 0.13932660781043774, 'tp_mult': 1.7487518270779483, 'tsl_mult': 0.10582035792573896, 'strategy': 'breakout', 'time_stop': 39, 'use_sma': True, 'use_atr': False, 'use_adx': True, 'use_ema': True, 'use_spike': False, 'rsi_required': True, 'edge_k': 0.5628062787160629, 'edge_cap': 0.8172122525282496, 'bull_strategy': 'breakout', 'bull_bb_std_mult': 1.8172441072288725, 'bull_rsi_os': 44, 'bull_rsi_ob': 75, 'bull_adx_thresh': 26.04642224637524, 'bull_atr_min_pct': 0.0030185290490052172, 'bull_atr_max_pct': 0.021428624697237872, 'bull_tp_mult': 2.5181192542821544, 'bull_tsl_mult': 0.9803492299557356, 'bull_time_stop': 14, 'bull_use_sma': False, 'bull_use_ema': False, 'bull_use_atr': False, 'bull_use_adx': True, 'bull_use_spike': True, 'bull_rsi_required': False, 'bear_strategy': 'breakout', 'bear_bb_std_mult': 3.500742387448809, 'bear_rsi_os': 25, 'bear_rsi_ob': 81, 'bear_adx_thresh': 6.130529143159924, 'bear_atr_min_pct': 0.008789098404259184, 'bear_atr_max_pct': 0.04677253431296914, 'bear_tp_mult': 2.3925125010751316, 'bear_tsl_mult': 0.0807372426148974, 'bear_time_stop': 36, 'bear_use_sma': True, 'bear_use_ema': False, 'bear_use_atr': False, 'bear_use_adx': False, 'bear_use_spike': False, 'bear_rsi_required': True, 'sideways_strategy': 'breakout', 'sideways_bb_std_mult': 2.0325226476626512, 'sideways_rsi_os': 43, 'sideways_rsi_ob': 60, 'sideways_adx_thresh': 10.730460896804905, 'sideways_atr_min_pct': 0.01964642194107817, 'sideways_atr_max_pct': 0.11393078521208927, 'sideways_tp_mult': 1.7303155049330883, 'sideways_tsl_mult': 0.3381188630170685, 'sideways_time_stop': 270, 'sideways_use_sma': False, 'sideways_use_ema': False, 'sideways_use_atr': False, 'sideways_use_adx': True, 'sideways_use_spike': False, 'sideways_rsi_required': True}.
[I 2025-08-30 19:58:56,238] Trial 627 finished with values: [-0.11373995142261539, 0.11371478782044091] and parameters: {'p_sma': 35, 'p_std': 25, 'p_atr': 20, 'p_adx': 7, 'rsi_period': 49, 'ema1': 6, 'ema2': 37, 'slip_atr_k': 0.05783603861779921, 'slip_spread_k': 0.8557818217502411, 'spread_hl_frac': 0.04173624640330948, 'bb_std_mult': 1.097313077031271, 'rsi_os': 37, 'rsi_ob': 55, 'vol_spike': 0.027205882219229968, 'adx_thresh': 18.391863767872444, 'atr_min_pct': 0.022383676606969532, 'atr_max_pct': 0.11435267830375623, 'tp_mult': 1.1457720297413867, 'tsl_mult': 0.6484300543320823, 'strategy': 'breakout', 'time_stop': 55, 'use_sma': False, 'use_atr': False, 'use_adx': True, 'use_ema': True, 'use_spike': False, 'rsi_required': False, 'edge_k': 0.12484843397106364, 'edge_cap': 0.3051995836875064, 'bull_strategy': 'breakout', 'bull_bb_std_mult': 1.605201293951451, 'bull_rsi_os': 49, 'bull_rsi_ob': 75, 'bull_adx_thresh': 24.345793861048218, 'bull_atr_min_pct': 0.013767960317833021, 'bull_atr_max_pct': 0.04044914184608545, 'bull_tp_mult': 2.5687503570292147, 'bull_tsl_mult': 0.9997783546368171, 'bull_time_stop': 190, 'bull_use_sma': False, 'bull_use_ema': False, 'bull_use_atr': True, 'bull_use_adx': False, 'bull_use_spike': True, 'bull_rsi_required': False, 'bear_strategy': 'breakout', 'bear_bb_std_mult': 3.263197499387757, 'bear_rsi_os': 40, 'bear_rsi_ob': 85, 'bear_adx_thresh': 22.885090500664063, 'bear_atr_min_pct': 0.015403608123656544, 'bear_atr_max_pct': 0.04698209568639425, 'bear_tp_mult': 2.2199948398519136, 'bear_tsl_mult': 0.9361931983354173, 'bear_time_stop': 29, 'bear_use_sma': True, 'bear_use_ema': True, 'bear_use_atr': False, 'bear_use_adx': False, 'bear_use_spike': False, 'bear_rsi_required': True, 'sideways_strategy': 'breakout', 'sideways_bb_std_mult': 3.547874318850072, 'sideways_rsi_os': 47, 'sideways_rsi_ob': 60, 'sideways_adx_thresh': 10.588101918241236, 'sideways_atr_min_pct': 0.0008076779993784686, 'sideways_atr_max_pct': 0.09354216812628713, 'sideways_tp_mult': 2.5453296734413104, 'sideways_tsl_mult': 0.34008203337838167, 'sideways_time_stop': 268, 'sideways_use_sma': False, 'sideways_use_ema': False, 'sideways_use_atr': True, 'sideways_use_adx': True, 'sideways_use_spike': False, 'sideways_rsi_required': True}.
[I 2025-08-30 19:58:56,502] Trial 626 finished with values: [-1000000000.0, 1000000000.0] and parameters: {'p_sma': 6, 'p_std': 24, 'p_atr': 15, 'p_adx': 7, 'rsi_period': 18, 'ema1': 23, 'ema2': 27, 'slip_atr_k': 0.17224674478548524, 'slip_spread_k': 0.9243243097759468, 'spread_hl_frac': 0.002510838413953034, 'bb_std_mult': 1.9578373849415627, 'rsi_os': 38, 'rsi_ob': 55, 'vol_spike': 0.23994342698472382, 'adx_thresh': 11.730787870023137, 'atr_min_pct': 0.02223085673904402, 'atr_max_pct': 0.14045199832677466, 'tp_mult': 1.9704017473283086, 'tsl_mult': 0.8122868912800901, 'strategy': 'breakout', 'time_stop': 50, 'use_sma': False, 'use_atr': False, 'use_adx': True, 'use_ema': True, 'use_spike': False, 'rsi_required': False, 'edge_k': 1.9304932076701034, 'edge_cap': 0.4205948198774899, 'bull_strategy': 'breakout', 'bull_bb_std_mult': 1.8255125337883469, 'bull_rsi_os': 15, 'bull_rsi_ob': 70, 'bull_adx_thresh': 5.558037252855646, 'bull_atr_min_pct': 0.01978512392899369, 'bull_atr_max_pct': 0.02662458936401103, 'bull_tp_mult': 1.1281188629951675, 'bull_tsl_mult': 0.6258053615819718, 'bull_time_stop': 191, 'bull_use_sma': True, 'bull_use_ema': False, 'bull_use_atr': True, 'bull_use_adx': False, 'bull_use_spike': True, 'bull_rsi_required': False, 'bear_strategy': 'breakout', 'bear_bb_std_mult': 3.5179595889777806, 'bear_rsi_os': 46, 'bear_rsi_ob': 90, 'bear_adx_thresh': 25.83738139585905, 'bear_atr_min_pct': 0.019380999209810658, 'bear_atr_max_pct': 0.057107556062901126, 'bear_tp_mult': 1.2723812716561707, 'bear_tsl_mult': 0.10622495519204311, 'bear_time_stop': 256, 'bear_use_sma': True, 'bear_use_ema': True, 'bear_use_atr': False, 'bear_use_adx': False, 'bear_use_spike': True, 'bear_rsi_required': True, 'sideways_strategy': 'mean_reversion', 'sideways_bb_std_mult': 1.4989575561013282, 'sideways_rsi_os': 10, 'sideways_rsi_ob': 81, 'sideways_adx_thresh': 11.008445426850031, 'sideways_atr_min_pct': 0.02050136528276848, 'sideways_atr_max_pct': 0.11394791956746211, 'sideways_tp_mult': 1.6510789319865649, 'sideways_tsl_mult': 0.8329199838526555, 'sideways_time_stop': 264, 'sideways_use_sma': False, 'sideways_use_ema': False, 'sideways_use_atr': True, 'sideways_use_adx': False, 'sideways_use_spike': False, 'sideways_rsi_required': True}.
[I 2025-08-30 19:58:56,637] Trial 629 finished with values: [-1000000000.0, 1000000000.0] and parameters: {'p_sma': 45, 'p_std': 24, 'p_atr': 12, 'p_adx': 7, 'rsi_period': 50, 'ema1': 23, 'ema2': 20, 'slip_atr_k': 0.24948236698684878, 'slip_spread_k': 0.4473801289248506, 'spread_hl_frac': 0.008140360228198844, 'bb_std_mult': 0.9069681074896299, 'rsi_os': 52, 'rsi_ob': 92, 'vol_spike': 0.027677660086999192, 'adx_thresh': 18.39403485248297, 'atr_min_pct': 0.007000178057441492, 'atr_max_pct': 0.13906949869792615, 'tp_mult': 2.3384542683312968, 'tsl_mult': 0.6774065667315681, 'strategy': 'breakout', 'time_stop': 46, 'use_sma': True, 'use_atr': True, 'use_adx': False, 'use_ema': True, 'use_spike': False, 'rsi_required': True, 'edge_k': 1.937463022289451, 'edge_cap': 0.30595050888962944, 'bull_strategy': 'mean_reversion', 'bull_bb_std_mult': 1.814192840079866, 'bull_rsi_os': 18, 'bull_rsi_ob': 71, 'bull_adx_thresh': 26.038876386555426, 'bull_atr_min_pct': 2.9432788327964782e-05, 'bull_atr_max_pct': 0.022706803853530015, 'bull_tp_mult': 2.5079995733017286, 'bull_tsl_mult': 0.6285669180948533, 'bull_time_stop': 13, 'bull_use_sma': False, 'bull_use_ema': True, 'bull_use_atr': False, 'bull_use_adx': True, 'bull_use_spike': True, 'bull_rsi_required': False, 'bear_strategy': 'breakout', 'bear_bb_std_mult': 2.1074827416964492, 'bear_rsi_os': 40, 'bear_rsi_ob': 81, 'bear_adx_thresh': 26.02558334430982, 'bear_atr_min_pct': 0.015580899459084514, 'bear_atr_max_pct': 0.024726953029795946, 'bear_tp_mult': 2.2652563146555798, 'bear_tsl_mult': 0.7703655093080151, 'bear_time_stop': 36, 'bear_use_sma': False, 'bear_use_ema': False, 'bear_use_atr': True, 'bear_use_adx': True, 'bear_use_spike': False, 'bear_rsi_required': True, 'sideways_strategy': 'breakout', 'sideways_bb_std_mult': 1.71154412057945, 'sideways_rsi_os': 17, 'sideways_rsi_ob': 54, 'sideways_adx_thresh': 10.871016637942018, 'sideways_atr_min_pct': 0.0005286389926476651, 'sideways_atr_max_pct': 0.09402584201047463, 'sideways_tp_mult': 2.8711665760219685, 'sideways_tsl_mult': 0.3396192642807964, 'sideways_time_stop': 100, 'sideways_use_sma': True, 'sideways_use_ema': False, 'sideways_use_atr': False, 'sideways_use_adx': True, 'sideways_use_spike': True, 'sideways_rsi_required': False}.
