[I 2025-08-30 20:14:18,729] Trial 736 finished with values: [-1000000000.0, 1000000000.0] and parameters: {'p_sma': 33, 'p_std': 25, 'p_atr': 10, 'p_adx': 24, 'rsi_period': 48, 'ema1': 30, 'ema2': 17, 'slip_atr_k': 0.030712719698268623, 'slip_spread_k': 0.40340037140493157, 'spread_hl_frac': 0.031832674128296344, 'bb_std_mult': 1.0064444815945393, 'rsi_os': 39, 'rsi_ob': 57, 'vol_spike': 0.02451636163483513, 'adx_thresh': 30.168855267236566, 'atr_min_pct': 0.023721926433447782, 'atr_max_pct': 0.12203683246842584, 'tp_mult': 2.2406322997714883, 'tsl_mult': 0.8183244155101468, 'strategy': 'mean_reversion', 'time_stop': 130, 'use_sma': False, 'use_atr': True, 'use_adx': False, 'use_ema': False, 'use_spike': True, 'rsi_required': True, 'edge_k': 1.104351173848433, 'edge_cap': 0.6160022476831009, 'bull_strategy': 'mean_reversion', 'bull_bb_std_mult': 2.0816081618109665, 'bull_rsi_os': 48, 'bull_rsi_ob': 72, 'bull_adx_thresh': 16.294094409817262, 'bull_atr_min_pct': 0.0036199294438688974, 'bull_atr_max_pct': 0.05197708247149099, 'bull_tp_mult': 2.7739257825983152, 'bull_tsl_mult': 0.4207178145021339, 'bull_time_stop': 49, 'bull_use_sma': True, 'bull_use_ema': False, 'bull_use_atr': False, 'bull_use_adx': True, 'bull_use_spike': True, 'bull_rsi_required': True, 'bear_strategy': 'breakout', 'bear_bb_std_mult': 3.333505560824343, 'bear_rsi_os': 45, 'bear_rsi_ob': 73, 'bear_adx_thresh': 10.49637575881086, 'bear_atr_min_pct': 0.02155442430410346, 'bear_atr_max_pct': 0.06384251776864805, 'bear_tp_mult': 1.2538606378288129, 'bear_tsl_mult': 0.09888165012509736, 'bear_time_stop': 51, 'bear_use_sma': True, 'bear_use_ema': False, 'bear_use_atr': True, 'bear_use_adx': True, 'bear_use_spike': False, 'bear_rsi_required': True, 'sideways_strategy': 'breakout', 'sideways_bb_std_mult': 1.869934824590919, 'sideways_rsi_os': 49, 'sideways_rsi_ob': 86, 'sideways_adx_thresh': 18.672134852064257, 'sideways_atr_min_pct': 0.018395275686105016, 'sideways_atr_max_pct': 0.03479219450031339, 'sideways_tp_mult': 1.743481444322903, 'sideways_tsl_mult': 0.6798877725765647, 'sideways_time_stop': 267, 'sideways_use_sma': True, 'sideways_use_ema': True, 'sideways_use_atr': False, 'sideways_use_adx': False, 'sideways_use_spike': False, 'sideways_rsi_required': False}.
[I 2025-08-30 20:14:19,860] Trial 741 finished with values: [-1000000000.0, 1000000000.0] and parameters: {'p_sma': 45, 'p_std': 27, 'p_atr': 10, 'p_adx': 9, 'rsi_period': 53, 'ema1': 23, 'ema2': 19, 'slip_atr_k': 0.07635792500041833, 'slip_spread_k': 0.4700502649940247, 'spread_hl_frac': 0.022085501691142546, 'bb_std_mult': 1.8331708263700106, 'rsi_os': 39, 'rsi_ob': 57, 'vol_spike': 0.11761190270285787, 'adx_thresh': 19.243288700350934, 'atr_min_pct': 0.015589482696354974, 'atr_max_pct': 0.012255200680348396, 'tp_mult': 2.2380128172735447, 'tsl_mult': 0.728413773275367, 'strategy': 'breakout', 'time_stop': 29, 'use_sma': True, 'use_atr': False, 'use_adx': False, 'use_ema': False, 'use_spike': True, 'rsi_required': True, 'edge_k': 1.0967472501659148, 'edge_cap': 0.20269232230176532, 'bull_strategy': 'breakout', 'bull_bb_std_mult': 2.7659946353016105, 'bull_rsi_os': 42, 'bull_rsi_ob': 68, 'bull_adx_thresh': 16.285480239757163, 'bull_atr_min_pct': 0.028952846788175335, 'bull_atr_max_pct': 0.023928696364262703, 'bull_tp_mult': 1.4691984256202075, 'bull_tsl_mult': 0.933715125378312, 'bull_time_stop': 173, 'bull_use_sma': True, 'bull_use_ema': True, 'bull_use_atr': True, 'bull_use_adx': False, 'bull_use_spike': False, 'bull_rsi_required': True, 'bear_strategy': 'breakout', 'bear_bb_std_mult': 3.3909278818773743, 'bear_rsi_os': 45, 'bear_rsi_ob': 54, 'bear_adx_thresh': 19.438962386254282, 'bear_atr_min_pct': 0.0025169911166576728, 'bear_atr_max_pct': 0.11177725208329078, 'bear_tp_mult': 1.2485313632179653, 'bear_tsl_mult': 0.6932765849574837, 'bear_time_stop': 47, 'bear_use_sma': False, 'bear_use_ema': True, 'bear_use_atr': False, 'bear_use_adx': False, 'bear_use_spike': True, 'bear_rsi_required': False, 'sideways_strategy': 'breakout', 'sideways_bb_std_mult': 2.0760835696043647, 'sideways_rsi_os': 15, 'sideways_rsi_ob': 95, 'sideways_adx_thresh': 11.339854408230885, 'sideways_atr_min_pct': 0.004115922414521224, 'sideways_atr_max_pct': 0.10646677355349185, 'sideways_tp_mult': 2.8549272262145045, 'sideways_tsl_mult': 0.6917695685872198, 'sideways_time_stop': 280, 'sideways_use_sma': True, 'sideways_use_ema': True, 'sideways_use_atr': True, 'sideways_use_adx': False, 'sideways_use_spike': True, 'sideways_rsi_required': False}.
[I 2025-08-30 20:14:53,112] Trial 739 finished with values: [-1000000000.0, 1000000000.0] and parameters: {'p_sma': 33, 'p_std': 55, 'p_atr': 10, 'p_adx': 8, 'rsi_period': 53, 'ema1': 26, 'ema2': 21, 'slip_atr_k': 0.03247547695695383, 'slip_spread_k': 0.45451311967092733, 'spread_hl_frac': 0.022208331187670342, 'bb_std_mult': 2.150289047010164, 'rsi_os': 36, 'rsi_ob': 54, 'vol_spike': 0.24401792194726998, 'adx_thresh': 20.90413754153266, 'atr_min_pct': 0.013504099493635237, 'atr_max_pct': 0.12205537006670679, 'tp_mult': 2.2368431210274187, 'tsl_mult': 0.16974053162953007, 'strategy': 'mean_reversion', 'time_stop': 27, 'use_sma': True, 'use_atr': True, 'use_adx': False, 'use_ema': False, 'use_spike': True, 'rsi_required': True, 'edge_k': 1.0983868181949772, 'edge_cap': 0.6828375354984002, 'bull_strategy': 'mean_reversion', 'bull_bb_std_mult': 1.6858226396772498, 'bull_rsi_os': 24, 'bull_rsi_ob': 74, 'bull_adx_thresh': 7.3417297659798315, 'bull_atr_min_pct': 0.026060839146949476, 'bull_atr_max_pct': 0.02367560291830409, 'bull_tp_mult': 2.910784217115207, 'bull_tsl_mult': 0.9536494285217935, 'bull_time_stop': 49, 'bull_use_sma': True, 'bull_use_ema': False, 'bull_use_atr': False, 'bull_use_adx': True, 'bull_use_spike': True, 'bull_rsi_required': True, 'bear_strategy': 'breakout', 'bear_bb_std_mult': 3.3129703674013524, 'bear_rsi_os': 45, 'bear_rsi_ob': 49, 'bear_adx_thresh': 23.848299027663106, 'bear_atr_min_pct': 0.028728139366700968, 'bear_atr_max_pct': 0.026931203878361433, 'bear_tp_mult': 2.960354432366287, 'bear_tsl_mult': 0.060316181131459014, 'bear_time_stop': 49, 'bear_use_sma': True, 'bear_use_ema': False, 'bear_use_atr': True, 'bear_use_adx': True, 'bear_use_spike': False, 'bear_rsi_required': True, 'sideways_strategy': 'breakout', 'sideways_bb_std_mult': 2.747496576537594, 'sideways_rsi_os': 15, 'sideways_rsi_ob': 49, 'sideways_adx_thresh': 9.058795440906115, 'sideways_atr_min_pct': 0.004325045466001997, 'sideways_atr_max_pct': 0.1436751352803715, 'sideways_tp_mult': 1.7138166271763937, 'sideways_tsl_mult': 0.0026827803672167527, 'sideways_time_stop': 285, 'sideways_use_sma': True, 'sideways_use_ema': True, 'sideways_use_atr': False, 'sideways_use_adx': False, 'sideways_use_spike': False, 'sideways_rsi_required': False}.
[I 2025-08-30 20:14:54,062] Trial 742 finished with values: [-1000000000.0, 1000000000.0] and parameters: {'p_sma': 45, 'p_std': 45, 'p_atr': 10, 'p_adx': 9, 'rsi_period': 53, 'ema1': 26, 'ema2': 21, 'slip_atr_k': 0.02255194540622534, 'slip_spread_k': 0.4701489153886533, 'spread_hl_frac': 0.007680695906631382, 'bb_std_mult': 2.288309960709613, 'rsi_os': 10, 'rsi_ob': 73, 'vol_spike': 0.03670188307289175, 'adx_thresh': 14.360724964698122, 'atr_min_pct': 0.02452806262005158, 'atr_max_pct': 0.13252601830587007, 'tp_mult': 2.592513604812659, 'tsl_mult': 0.5843959332558977, 'strategy': 'breakout', 'time_stop': 28, 'use_sma': True, 'use_atr': False, 'use_adx': True, 'use_ema': False, 'use_spike': True, 'rsi_required': True, 'edge_k': 0.053374727315842474, 'edge_cap': 0.250856516190019, 'bull_strategy': 'breakout', 'bull_bb_std_mult': 1.6861034239079618, 'bull_rsi_os': 51, 'bull_rsi_ob': 88, 'bull_adx_thresh': 28.610951858903938, 'bull_atr_min_pct': 0.02120960795744023, 'bull_atr_max_pct': 0.02500059124683359, 'bull_tp_mult': 2.2331651299316477, 'bull_tsl_mult': 0.9666583033798866, 'bull_time_stop': 172, 'bull_use_sma': False, 'bull_use_ema': True, 'bull_use_atr': True, 'bull_use_adx': False, 'bull_use_spike': False, 'bull_rsi_required': True, 'bear_strategy': 'mean_reversion', 'bear_bb_std_mult': 3.0395801536288434, 'bear_rsi_os': 46, 'bear_rsi_ob': 91, 'bear_adx_thresh': 23.90057113483546, 'bear_atr_min_pct': 0.004224580438831529, 'bear_atr_max_pct': 0.06802895003974815, 'bear_tp_mult': 2.5535264720110646, 'bear_tsl_mult': 0.06260866596589901, 'bear_time_stop': 46, 'bear_use_sma': False, 'bear_use_ema': True, 'bear_use_atr': False, 'bear_use_adx': False, 'bear_use_spike': True, 'bear_rsi_required': False, 'sideways_strategy': 'mean_reversion', 'sideways_bb_std_mult': 2.0938544022154004, 'sideways_rsi_os': 41, 'sideways_rsi_ob': 74, 'sideways_adx_thresh': 11.164988737800225, 'sideways_atr_min_pct': 0.0038651317034645687, 'sideways_atr_max_pct': 0.11830756231320631, 'sideways_tp_mult': 1.2922665588709557, 'sideways_tsl_mult': 0.07649922445772767, 'sideways_time_stop': 279, 'sideways_use_sma': False, 'sideways_use_ema': True, 'sideways_use_atr': True, 'sideways_use_adx': True, 'sideways_use_spike': True, 'sideways_rsi_required': True}.
[I 2025-08-30 20:14:54,189] Trial 740 finished with values: [-1000000000.0, 1000000000.0] and parameters: {'p_sma': 45, 'p_std': 59, 'p_atr': 10, 'p_adx': 21, 'rsi_period': 66, 'ema1': 19, 'ema2': 45, 'slip_atr_k': 0.029888330623464528, 'slip_spread_k': 0.26304935415999525, 'spread_hl_frac': 0.008232184176686926, 'bb_std_mult': 0.9281495233608384, 'rsi_os': 10, 'rsi_ob': 57, 'vol_spike': 0.03574947754446309, 'adx_thresh': 26.326462186931643, 'atr_min_pct': 0.02269070532198154, 'atr_max_pct': 0.13214031130829998, 'tp_mult': 2.221146684874884, 'tsl_mult': 0.7306490328889543, 'strategy': 'breakout', 'time_stop': 91, 'use_sma': True, 'use_atr': False, 'use_adx': False, 'use_ema': False, 'use_spike': True, 'rsi_required': True, 'edge_k': 1.0872712368859945, 'edge_cap': 0.2828392946085423, 'bull_strategy': 'mean_reversion', 'bull_bb_std_mult': 1.6689637449479162, 'bull_rsi_os': 42, 'bull_rsi_ob': 72, 'bull_adx_thresh': 34.15312050169489, 'bull_atr_min_pct': 0.026008658949630416, 'bull_atr_max_pct': 0.023477961057524428, 'bull_tp_mult': 2.192980258235706, 'bull_tsl_mult': 0.952467510201874, 'bull_time_stop': 275, 'bull_use_sma': True, 'bull_use_ema': True, 'bull_use_atr': False, 'bull_use_adx': True, 'bull_use_spike': False, 'bull_rsi_required': True, 'bear_strategy': 'breakout', 'bear_bb_std_mult': 3.3828206918611157, 'bear_rsi_os': 45, 'bear_rsi_ob': 54, 'bear_adx_thresh': 5.559491314117239, 'bear_atr_min_pct': 0.015415613413047142, 'bear_atr_max_pct': 0.10770391040304828, 'bear_tp_mult': 1.2393653935101234, 'bear_tsl_mult': 0.48725528149780506, 'bear_time_stop': 189, 'bear_use_sma': False, 'bear_use_ema': False, 'bear_use_atr': False, 'bear_use_adx': False, 'bear_use_spike': False, 'bear_rsi_required': False, 'sideways_strategy': 'breakout', 'sideways_bb_std_mult': 0.8834434023757942, 'sideways_rsi_os': 15, 'sideways_rsi_ob': 60, 'sideways_adx_thresh': 16.23116537108076, 'sideways_atr_min_pct': 0.019510524419918712, 'sideways_atr_max_pct': 0.14340213174975908, 'sideways_tp_mult': 2.472815013301382, 'sideways_tsl_mult': 0.0011553273081871818, 'sideways_time_stop': 151, 'sideways_use_sma': True, 'sideways_use_ema': True, 'sideways_use_atr': False, 'sideways_use_adx': False, 'sideways_use_spike': True, 'sideways_rsi_required': False}.
[I 2025-08-30 20:14:55,113] Trial 743 finished with values: [-1000000000.0, 1000000000.0] and parameters: {'p_sma': 45, 'p_std': 11, 'p_atr': 11, 'p_adx': 9, 'rsi_period': 60, 'ema1': 26, 'ema2': 14, 'slip_atr_k': 0.024799716529243843, 'slip_spread_k': 0.42068941861798015, 'spread_hl_frac': 0.010888495597437722, 'bb_std_mult': 1.585061987914249, 'rsi_os': 36, 'rsi_ob': 72, 'vol_spike': 0.1974517114524268, 'adx_thresh': 17.877348524616202, 'atr_min_pct': 0.01862638362700998, 'atr_max_pct': 0.1499997202590288, 'tp_mult': 2.209189340250438, 'tsl_mult': 0.7313730469116477, 'strategy': 'breakout', 'time_stop': 202, 'use_sma': True, 'use_atr': True, 'use_adx': True, 'use_ema': False, 'use_spike': True, 'rsi_required': True, 'edge_k': 0.1179590177789446, 'edge_cap': 0.9098407803903346, 'bull_strategy': 'mean_reversion', 'bull_bb_std_mult': 3.367094921832291, 'bull_rsi_os': 10, 'bull_rsi_ob': 59, 'bull_adx_thresh': 34.22677923212913, 'bull_atr_min_pct': 0.007555986645128359, 'bull_atr_max_pct': 0.03912309173034559, 'bull_tp_mult': 2.474024377841028, 'bull_tsl_mult': 0.9650932643110142, 'bull_time_stop': 204, 'bull_use_sma': False, 'bull_use_ema': False, 'bull_use_atr': False, 'bull_use_adx': True, 'bull_use_spike': True, 'bull_rsi_required': True, 'bear_strategy': 'mean_reversion', 'bear_bb_std_mult': 3.0389992302636255, 'bear_rsi_os': 46, 'bear_rsi_ob': 85, 'bear_adx_thresh': 5.033960957983924, 'bear_atr_min_pct': 0.004182662747817454, 'bear_atr_max_pct': 0.06856551571963386, 'bear_tp_mult': 2.559841592222455, 'bear_tsl_mult': 0.5532655912586761, 'bear_time_stop': 30, 'bear_use_sma': True, 'bear_use_ema': False, 'bear_use_atr': True, 'bear_use_adx': True, 'bear_use_spike': False, 'bear_rsi_required': False, 'sideways_strategy': 'mean_reversion', 'sideways_bb_std_mult': 0.8566815464938706, 'sideways_rsi_os': 18, 'sideways_rsi_ob': 60, 'sideways_adx_thresh': 5.882555593401861, 'sideways_atr_min_pct': 0.019496614382201512, 'sideways_atr_max_pct': 0.03893140593033436, 'sideways_tp_mult': 1.8092359825676954, 'sideways_tsl_mult': 0.6450877738180185, 'sideways_time_stop': 125, 'sideways_use_sma': False, 'sideways_use_ema': True, 'sideways_use_atr': False, 'sideways_use_adx': True, 'sideways_use_spike': True, 'sideways_rsi_required': True}.
[I 2025-08-30 20:15:28,587] Trial 745 finished with values: [-1000000000.0, 1000000000.0] and parameters: {'p_sma': 36, 'p_std': 11, 'p_atr': 11, 'p_adx': 8, 'rsi_period': 76, 'ema1': 25, 'ema2': 25, 'slip_atr_k': 0.019246013548968804, 'slip_spread_k': 0.4120425321931928, 'spread_hl_frac': 0.04781300492839589, 'bb_std_mult': 2.0277692692270572, 'rsi_os': 29, 'rsi_ob': 82, 'vol_spike': 0.03798945831423453, 'adx_thresh': 17.996500514478722, 'atr_min_pct': 0.012496625783651887, 'atr_max_pct': 0.014765889289490061, 'tp_mult': 1.772468385057803, 'tsl_mult': 0.08271750065591171, 'strategy': 'breakout', 'time_stop': 140, 'use_sma': False, 'use_atr': True, 'use_adx': False, 'use_ema': False, 'use_spike': True, 'rsi_required': True, 'edge_k': 0.11751993315749223, 'edge_cap': 0.9136308058592706, 'bull_strategy': 'mean_reversion', 'bull_bb_std_mult': 1.7904198134175395, 'bull_rsi_os': 52, 'bull_rsi_ob': 56, 'bull_adx_thresh': 23.003196050363414, 'bull_atr_min_pct': 0.024305602822053185, 'bull_atr_max_pct': 0.019519422492314385, 'bull_tp_mult': 2.1299114405081756, 'bull_tsl_mult': 0.6106244191237671, 'bull_time_stop': 204, 'bull_use_sma': False, 'bull_use_ema': False, 'bull_use_atr': False, 'bull_use_adx': True, 'bull_use_spike': True, 'bull_rsi_required': True, 'bear_strategy': 'breakout', 'bear_bb_std_mult': 1.929384685420226, 'bear_rsi_os': 43, 'bear_rsi_ob': 79, 'bear_adx_thresh': 5.464835866673968, 'bear_atr_min_pct': 0.015526911085455855, 'bear_atr_max_pct': 0.054042351958535406, 'bear_tp_mult': 1.384733891833428, 'bear_tsl_mult': 0.4785847264408739, 'bear_time_stop': 24, 'bear_use_sma': True, 'bear_use_ema': False, 'bear_use_atr': True, 'bear_use_adx': True, 'bear_use_spike': False, 'bear_rsi_required': False, 'sideways_strategy': 'breakout', 'sideways_bb_std_mult': 2.9728024699166355, 'sideways_rsi_os': 16, 'sideways_rsi_ob': 60, 'sideways_adx_thresh': 10.294428596259019, 'sideways_atr_min_pct': 0.01957826159904511, 'sideways_atr_max_pct': 0.12201105685048079, 'sideways_tp_mult': 1.793885550463298, 'sideways_tsl_mult': 0.6363185369753488, 'sideways_time_stop': 177, 'sideways_use_sma': True, 'sideways_use_ema': False, 'sideways_use_atr': False, 'sideways_use_adx': True, 'sideways_use_spike': False, 'sideways_rsi_required': False}.
[I 2025-08-30 20:15:28,613] Trial 747 finished with values: [-0.02722004789435617, 0.02711833664206748] and parameters: {'p_sma': 36, 'p_std': 22, 'p_atr': 24, 'p_adx': 8, 'rsi_period': 76, 'ema1': 25, 'ema2': 17, 'slip_atr_k': 0.06790956206802229, 'slip_spread_k': 0.08764973831433964, 'spread_hl_frac': 0.0036608297731734346, 'bb_std_mult': 3.3120282153815253, 'rsi_os': 45, 'rsi_ob': 59, 'vol_spike': 0.12969899179904265, 'adx_thresh': 19.119161648146413, 'atr_min_pct': 0.012302484147366642, 'atr_max_pct': 0.13483958819497335, 'tp_mult': 1.783308438799999, 'tsl_mult': 0.7682598132967068, 'strategy': 'breakout', 'time_stop': 115, 'use_sma': False, 'use_atr': True, 'use_adx': False, 'use_ema': False, 'use_spike': True, 'rsi_required': False, 'edge_k': 0.1571993962691591, 'edge_cap': 0.30194541761898974, 'bull_strategy': 'mean_reversion', 'bull_bb_std_mult': 1.7807051459604657, 'bull_rsi_os': 26, 'bull_rsi_ob': 71, 'bull_adx_thresh': 27.9749308667395, 'bull_atr_min_pct': 0.0015694325798378812, 'bull_atr_max_pct': 0.027149651509385277, 'bull_tp_mult': 2.6022246722419387, 'bull_tsl_mult': 0.9740127305583769, 'bull_time_stop': 69, 'bull_use_sma': True, 'bull_use_ema': False, 'bull_use_atr': False, 'bull_use_adx': True, 'bull_use_spike': True, 'bull_rsi_required': True, 'bear_strategy': 'breakout', 'bear_bb_std_mult': 0.9439608396748345, 'bear_rsi_os': 43, 'bear_rsi_ob': 83, 'bear_adx_thresh': 21.80513581585858, 'bear_atr_min_pct': 0.02272470534370767, 'bear_atr_max_pct': 0.05317081830326422, 'bear_tp_mult': 2.0012377103575294, 'bear_tsl_mult': 0.22675475954691177, 'bear_time_stop': 16, 'bear_use_sma': True, 'bear_use_ema': False, 'bear_use_atr': True, 'bear_use_adx': True, 'bear_use_spike': False, 'bear_rsi_required': False, 'sideways_strategy': 'breakout', 'sideways_bb_std_mult': 2.1725126205192713, 'sideways_rsi_os': 23, 'sideways_rsi_ob': 56, 'sideways_adx_thresh': 10.368368250142009, 'sideways_atr_min_pct': 0.002514738526789356, 'sideways_atr_max_pct': 0.12090044202016552, 'sideways_tp_mult': 1.7820971848316145, 'sideways_tsl_mult': 0.7146037764317492, 'sideways_time_stop': 177, 'sideways_use_sma': True, 'sideways_use_ema': False, 'sideways_use_atr': False, 'sideways_use_adx': False, 'sideways_use_spike': False, 'sideways_rsi_required': False}.
[I 2025-08-30 20:15:28,751] Trial 746 finished with values: [-1000000000.0, 1000000000.0] and parameters: {'p_sma': 37, 'p_std': 11, 'p_atr': 21, 'p_adx': 8, 'rsi_period': 76, 'ema1': 25, 'ema2': 17, 'slip_atr_k': 0.01454222172928921, 'slip_spread_k': 0.4222727738339096, 'spread_hl_frac': 0.018915331814551063, 'bb_std_mult': 0.9281163290827696, 'rsi_os': 31, 'rsi_ob': 58, 'vol_spike': 0.12939044182640944, 'adx_thresh': 18.981915714043165, 'atr_min_pct': 0.029439158946989875, 'atr_max_pct': 0.07779427091132209, 'tp_mult': 1.7157379723608055, 'tsl_mult': 0.2880113054004985, 'strategy': 'breakout', 'time_stop': 249, 'use_sma': False, 'use_atr': True, 'use_adx': True, 'use_ema': False, 'use_spike': True, 'rsi_required': True, 'edge_k': 0.12569503583997588, 'edge_cap': 0.2988678205897836, 'bull_strategy': 'mean_reversion', 'bull_bb_std_mult': 2.291526191983198, 'bull_rsi_os': 10, 'bull_rsi_ob': 91, 'bull_adx_thresh': 32.30641718391722, 'bull_atr_min_pct': 0.0032162515129001076, 'bull_atr_max_pct': 0.028345883326744578, 'bull_tp_mult': 2.119670572541198, 'bull_tsl_mult': 0.979693723961521, 'bull_time_stop': 33, 'bull_use_sma': False, 'bull_use_ema': False, 'bull_use_atr': False, 'bull_use_adx': True, 'bull_use_spike': True, 'bull_rsi_required': True, 'bear_strategy': 'mean_reversion', 'bear_bb_std_mult': 2.000947743057543, 'bear_rsi_os': 43, 'bear_rsi_ob': 66, 'bear_adx_thresh': 17.65683007794645, 'bear_atr_min_pct': 0.01567948138348174, 'bear_atr_max_pct': 0.05360329723424522, 'bear_tp_mult': 2.444953262546231, 'bear_tsl_mult': 0.13402151916968044, 'bear_time_stop': 30, 'bear_use_sma': True, 'bear_use_ema': False, 'bear_use_atr': True, 'bear_use_adx': True, 'bear_use_spike': False, 'bear_rsi_required': False, 'sideways_strategy': 'mean_reversion', 'sideways_bb_std_mult': 2.2043350452652577, 'sideways_rsi_os': 13, 'sideways_rsi_ob': 59, 'sideways_adx_thresh': 10.246986251657372, 'sideways_atr_min_pct': 0.019240039155638298, 'sideways_atr_max_pct': 0.09006344842551488, 'sideways_tp_mult': 2.2287864829292423, 'sideways_tsl_mult': 0.43984154079932447, 'sideways_time_stop': 124, 'sideways_use_sma': False, 'sideways_use_ema': False, 'sideways_use_atr': False, 'sideways_use_adx': True, 'sideways_use_spike': False, 'sideways_rsi_required': True}.
