[I 2025-08-30 19:01:43,738] Trial 204 finished with values: [-1000000000.0, 1000000000.0] and parameters: {'p_sma': 42, 'p_std': 51, 'p_atr': 9, 'p_adx': 20, 'rsi_period': 56, 'ema1': 28, 'ema2': 40, 'slip_atr_k': 0.014684950677965283, 'slip_spread_k': 0.4012917342061299, 'spread_hl_frac': 0.006188316728559212, 'bb_std_mult': 0.7458740960377732, 'rsi_os': 35, 'rsi_ob': 60, 'vol_spike': 0.03713939616796659, 'adx_thresh': 18.37329600645737, 'atr_min_pct': 0.024030565644807798, 'atr_max_pct': 0.14348080233051094, 'tp_mult': 2.212682601466885, 'tsl_mult': 0.7349856562570802, 'strategy': 'breakout', 'time_stop': 281, 'use_sma': False, 'use_atr': True, 'use_adx': False, 'use_ema': False, 'use_spike': True, 'rsi_required': True, 'edge_k': 0.5253490416825473, 'edge_cap': 0.4724470417321571, 'bull_strategy': 'mean_reversion', 'bull_bb_std_mult': 1.8952103829409548, 'bull_rsi_os': 14, 'bull_rsi_ob': 70, 'bull_adx_thresh': 13.810256846401575, 'bull_atr_min_pct': 0.002384344972171937, 'bull_atr_max_pct': 0.048317920569693154, 'bull_tp_mult': 2.189038229141196, 'bull_tsl_mult': 0.43312236204657517, 'bull_time_stop': 100, 'bull_use_sma': True, 'bull_use_ema': False, 'bull_use_atr': False, 'bull_use_adx': True, 'bull_use_spike': True, 'bull_rsi_required': True, 'bear_strategy': 'breakout', 'bear_bb_std_mult': 3.199985875637988, 'bear_rsi_os': 20, 'bear_rsi_ob': 83, 'bear_adx_thresh': 5.501922174297867, 'bear_atr_min_pct': 0.0028396716096643383, 'bear_atr_max_pct': 0.1049497056379344, 'bear_tp_mult': 1.7747892079881575, 'bear_tsl_mult': 0.0713363648268115, 'bear_time_stop': 30, 'bear_use_sma': True, 'bear_use_ema': False, 'bear_use_atr': True, 'bear_use_adx': True, 'bear_use_spike': False, 'bear_rsi_required': False, 'sideways_strategy': 'mean_reversion', 'sideways_bb_std_mult': 2.07788582648605, 'sideways_rsi_os': 54, 'sideways_rsi_ob': 82, 'sideways_adx_thresh': 8.391400277256778, 'sideways_atr_min_pct': 0.009320522194307925, 'sideways_atr_max_pct': 0.1431012928625398, 'sideways_tp_mult': 1.7501190585851756, 'sideways_tsl_mult': 0.9738176323333817, 'sideways_time_stop': 275, 'sideways_use_sma': True, 'sideways_use_ema': True, 'sideways_use_atr': False, 'sideways_use_adx': False, 'sideways_use_spike': True, 'sideways_rsi_required': False}.
[I 2025-08-30 19:02:18,638] Trial 211 finished with values: [-1000000000.0, 1000000000.0] and parameters: {'p_sma': 19, 'p_std': 27, 'p_atr': 10, 'p_adx': 8, 'rsi_period': 15, 'ema1': 25, 'ema2': 18, 'slip_atr_k': 0.23479001921996656, 'slip_spread_k': 0.44846842706953005, 'spread_hl_frac': 0.03496776479391532, 'bb_std_mult': 1.0036211852101018, 'rsi_os': 41, 'rsi_ob': 56, 'vol_spike': 0.1705705993985757, 'adx_thresh': 20.994118183014198, 'atr_min_pct': 0.024926430672048024, 'atr_max_pct': 0.13891046922987282, 'tp_mult': 2.1644737373067415, 'tsl_mult': 0.6973529276292861, 'strategy': 'mean_reversion', 'time_stop': 58, 'use_sma': True, 'use_atr': True, 'use_adx': True, 'use_ema': False, 'use_spike': True, 'rsi_required': False, 'edge_k': 0.8957063625319497, 'edge_cap': 0.2394184006108408, 'bull_strategy': 'mean_reversion', 'bull_bb_std_mult': 1.756466967447638, 'bull_rsi_os': 52, 'bull_rsi_ob': 62, 'bull_adx_thresh': 24.14527221620063, 'bull_atr_min_pct': 0.013834932055921394, 'bull_atr_max_pct': 0.12169528886355249, 'bull_tp_mult': 2.0817938988809295, 'bull_tsl_mult': 0.9681794952203148, 'bull_time_stop': 182, 'bull_use_sma': False, 'bull_use_ema': True, 'bull_use_atr': False, 'bull_use_adx': False, 'bull_use_spike': True, 'bull_rsi_required': False, 'bear_strategy': 'mean_reversion', 'bear_bb_std_mult': 3.3042263846870177, 'bear_rsi_os': 30, 'bear_rsi_ob': 95, 'bear_adx_thresh': 6.463750410048757, 'bear_atr_min_pct': 0.004326937125344219, 'bear_atr_max_pct': 0.01843256604885289, 'bear_tp_mult': 1.7374515045863657, 'bear_tsl_mult': 0.4278375716328644, 'bear_time_stop': 44, 'bear_use_sma': True, 'bear_use_ema': False, 'bear_use_atr': False, 'bear_use_adx': False, 'bear_use_spike': True, 'bear_rsi_required': True, 'sideways_strategy': 'breakout', 'sideways_bb_std_mult': 2.111042172640619, 'sideways_rsi_os': 18, 'sideways_rsi_ob': 63, 'sideways_adx_thresh': 7.508925845750928, 'sideways_atr_min_pct': 0.011474887941942796, 'sideways_atr_max_pct': 0.12440408455207509, 'sideways_tp_mult': 1.8547286636709859, 'sideways_tsl_mult': 0.6374611109792924, 'sideways_time_stop': 264, 'sideways_use_sma': True, 'sideways_use_ema': True, 'sideways_use_atr': True, 'sideways_use_adx': True, 'sideways_use_spike': False, 'sideways_rsi_required': True}.
[I 2025-08-30 19:02:18,774] Trial 208 finished with values: [-1000000000.0, 1000000000.0] and parameters: {'p_sma': 42, 'p_std': 14, 'p_atr': 18, 'p_adx': 20, 'rsi_period': 57, 'ema1': 25, 'ema2': 11, 'slip_atr_k': 0.013804873977444551, 'slip_spread_k': 0.3872073943490326, 'spread_hl_frac': 0.043724472931735085, 'bb_std_mult': 1.0195215704149512, 'rsi_os': 24, 'rsi_ob': 90, 'vol_spike': 0.043610648943333656, 'adx_thresh': 18.948139239870834, 'atr_min_pct': 0.02423955042799906, 'atr_max_pct': 0.1433751987095564, 'tp_mult': 1.714603324431255, 'tsl_mult': 0.7031817776636654, 'strategy': 'breakout', 'time_stop': 137, 'use_sma': True, 'use_atr': True, 'use_adx': False, 'use_ema': False, 'use_spike': True, 'rsi_required': False, 'edge_k': 0.5395226582732426, 'edge_cap': 0.22004456875338996, 'bull_strategy': 'mean_reversion', 'bull_bb_std_mult': 1.9053127703959745, 'bull_rsi_os': 6, 'bull_rsi_ob': 70, 'bull_adx_thresh': 12.187724155883267, 'bull_atr_min_pct': 0.009556325276529023, 'bull_atr_max_pct': 0.14677822053006234, 'bull_tp_mult': 2.191537792581025, 'bull_tsl_mult': 0.974855180611131, 'bull_time_stop': 250, 'bull_use_sma': True, 'bull_use_ema': False, 'bull_use_atr': False, 'bull_use_adx': True, 'bull_use_spike': True, 'bull_rsi_required': True, 'bear_strategy': 'breakout', 'bear_bb_std_mult': 3.278514484642304, 'bear_rsi_os': 9, 'bear_rsi_ob': 48, 'bear_adx_thresh': 6.025059650746281, 'bear_atr_min_pct': 0.0028695858467291824, 'bear_atr_max_pct': 0.08895165595224697, 'bear_tp_mult': 1.730176827470751, 'bear_tsl_mult': 0.12310270669540979, 'bear_time_stop': 21, 'bear_use_sma': True, 'bear_use_ema': False, 'bear_use_atr': True, 'bear_use_adx': True, 'bear_use_spike': False, 'bear_rsi_required': False, 'sideways_strategy': 'breakout', 'sideways_bb_std_mult': 0.7599049361200401, 'sideways_rsi_os': 18, 'sideways_rsi_ob': 68, 'sideways_adx_thresh': 26.64717506230958, 'sideways_atr_min_pct': 0.025590959417091393, 'sideways_atr_max_pct': 0.056419114538123996, 'sideways_tp_mult': 1.7586907637384557, 'sideways_tsl_mult': 0.3901375961477341, 'sideways_time_stop': 134, 'sideways_use_sma': True, 'sideways_use_ema': True, 'sideways_use_atr': False, 'sideways_use_adx': False, 'sideways_use_spike': False, 'sideways_rsi_required': False}.
[I 2025-08-30 19:02:18,775] Trial 209 finished with values: [-1000000000.0, 1000000000.0] and parameters: {'p_sma': 37, 'p_std': 27, 'p_atr': 18, 'p_adx': 8, 'rsi_period': 56, 'ema1': 26, 'ema2': 17, 'slip_atr_k': 0.11373272651371695, 'slip_spread_k': 0.38506989263595176, 'spread_hl_frac': 0.007518398495284581, 'bb_std_mult': 1.0186061684596153, 'rsi_os': 38, 'rsi_ob': 60, 'vol_spike': 0.14843352732544676, 'adx_thresh': 20.435449483174786, 'atr_min_pct': 0.025175735633916722, 'atr_max_pct': 0.08477056634722517, 'tp_mult': 2.2148135216401803, 'tsl_mult': 0.6967745271701364, 'strategy': 'breakout', 'time_stop': 57, 'use_sma': True, 'use_atr': True, 'use_adx': True, 'use_ema': False, 'use_spike': True, 'rsi_required': False, 'edge_k': 0.8872052059782449, 'edge_cap': 0.46868508631991335, 'bull_strategy': 'mean_reversion', 'bull_bb_std_mult': 1.7489384511211121, 'bull_rsi_os': 12, 'bull_rsi_ob': 70, 'bull_adx_thresh': 25.425280057523565, 'bull_atr_min_pct': 0.011670413968707001, 'bull_atr_max_pct': 0.02691790158942402, 'bull_tp_mult': 2.096377523273648, 'bull_tsl_mult': 0.4059667575661573, 'bull_time_stop': 234, 'bull_use_sma': True, 'bull_use_ema': True, 'bull_use_atr': False, 'bull_use_adx': False, 'bull_use_spike': True, 'bull_rsi_required': True, 'bear_strategy': 'breakout', 'bear_bb_std_mult': 3.309236607437359, 'bear_rsi_os': 43, 'bear_rsi_ob': 84, 'bear_adx_thresh': 5.992960954294528, 'bear_atr_min_pct': 0.018459592193771326, 'bear_atr_max_pct': 0.12719370302664945, 'bear_tp_mult': 1.7442823718084102, 'bear_tsl_mult': 0.42759503794543874, 'bear_time_stop': 43, 'bear_use_sma': True, 'bear_use_ema': False, 'bear_use_atr': False, 'bear_use_adx': False, 'bear_use_spike': False, 'bear_rsi_required': False, 'sideways_strategy': 'breakout', 'sideways_bb_std_mult': 2.078624413052605, 'sideways_rsi_os': 54, 'sideways_rsi_ob': 61, 'sideways_adx_thresh': 8.42396316505341, 'sideways_atr_min_pct': 0.01870857943371482, 'sideways_atr_max_pct': 0.12364379291121062, 'sideways_tp_mult': 2.9854326830726556, 'sideways_tsl_mult': 0.3848649643134967, 'sideways_time_stop': 84, 'sideways_use_sma': True, 'sideways_use_ema': True, 'sideways_use_atr': False, 'sideways_use_adx': False, 'sideways_use_spike': False, 'sideways_rsi_required': False}.
[I 2025-08-30 19:02:18,969] Trial 210 finished with values: [-1000000000.0, 1000000000.0] and parameters: {'p_sma': 37, 'p_std': 14, 'p_atr': 10, 'p_adx': 22, 'rsi_period': 46, 'ema1': 25, 'ema2': 18, 'slip_atr_k': 0.03192441774222822, 'slip_spread_k': 0.8417297488323646, 'spread_hl_frac': 0.0024353719905004564, 'bb_std_mult': 1.0075701527483834, 'rsi_os': 23, 'rsi_ob': 56, 'vol_spike': 0.04303977717350339, 'adx_thresh': 5.0024815441308625, 'atr_min_pct': 0.0251756275917243, 'atr_max_pct': 0.13912092156741107, 'tp_mult': 2.1712092270670635, 'tsl_mult': 0.6966590735279781, 'strategy': 'mean_reversion', 'time_stop': 85, 'use_sma': True, 'use_atr': True, 'use_adx': True, 'use_ema': False, 'use_spike': True, 'rsi_required': False, 'edge_k': 0.05205026494263086, 'edge_cap': 0.24219768062898953, 'bull_strategy': 'mean_reversion', 'bull_bb_std_mult': 3.007039709247633, 'bull_rsi_os': 7, 'bull_rsi_ob': 71, 'bull_adx_thresh': 25.512142654167498, 'bull_atr_min_pct': 0.029925816181414745, 'bull_atr_max_pct': 0.12274465586389899, 'bull_tp_mult': 1.558599327074853, 'bull_tsl_mult': 0.9671968181900896, 'bull_time_stop': 234, 'bull_use_sma': False, 'bull_use_ema': True, 'bull_use_atr': False, 'bull_use_adx': False, 'bull_use_spike': True, 'bull_rsi_required': False, 'bear_strategy': 'mean_reversion', 'bear_bb_std_mult': 2.075485149573015, 'bear_rsi_os': 39, 'bear_rsi_ob': 48, 'bear_adx_thresh': 6.1529797423440735, 'bear_atr_min_pct': 0.01846539359263463, 'bear_atr_max_pct': 0.05467248379801243, 'bear_tp_mult': 1.3918863696585544, 'bear_tsl_mult': 0.15346256999140562, 'bear_time_stop': 282, 'bear_use_sma': True, 'bear_use_ema': False, 'bear_use_atr': False, 'bear_use_adx': False, 'bear_use_spike': True, 'bear_rsi_required': True, 'sideways_strategy': 'breakout', 'sideways_bb_std_mult': 1.767167576761229, 'sideways_rsi_os': 18, 'sideways_rsi_ob': 52, 'sideways_adx_thresh': 34.57297569046983, 'sideways_atr_min_pct': 0.0197161208333335, 'sideways_atr_max_pct': 0.11804502938354325, 'sideways_tp_mult': 2.4210109962022988, 'sideways_tsl_mult': 0.6282467497280152, 'sideways_time_stop': 258, 'sideways_use_sma': True, 'sideways_use_ema': True, 'sideways_use_atr': True, 'sideways_use_adx': True, 'sideways_use_spike': False, 'sideways_rsi_required': True}.
[I 2025-08-30 19:02:55,149] Trial 214 finished with values: [-0.013425456197311503, 0.014759788438758444] and parameters: {'p_sma': 40, 'p_std': 44, 'p_atr': 10, 'p_adx': 9, 'rsi_period': 39, 'ema1': 23, 'ema2': 34, 'slip_atr_k': 0.030800516315590432, 'slip_spread_k': 0.22125452330515888, 'spread_hl_frac': 0.002637903859437364, 'bb_std_mult': 0.849178331127687, 'rsi_os': 29, 'rsi_ob': 52, 'vol_spike': 0.04358210107706563, 'adx_thresh': 11.766323084462565, 'atr_min_pct': 0.02301629441142497, 'atr_max_pct': 0.1309588675977785, 'tp_mult': 2.3086193912187367, 'tsl_mult': 0.7893502169068292, 'strategy': 'mean_reversion', 'time_stop': 26, 'use_sma': False, 'use_atr': False, 'use_adx': False, 'use_ema': True, 'use_spike': False, 'rsi_required': True, 'edge_k': 0.9677308720175865, 'edge_cap': 0.560072212830406, 'bull_strategy': 'breakout', 'bull_bb_std_mult': 2.851136885846913, 'bull_rsi_os': 48, 'bull_rsi_ob': 71, 'bull_adx_thresh': 26.344763908862326, 'bull_atr_min_pct': 0.000993920299083058, 'bull_atr_max_pct': 0.022874795186592512, 'bull_tp_mult': 1.5592331217574318, 'bull_tsl_mult': 0.5966119908922707, 'bull_time_stop': 189, 'bull_use_sma': True, 'bull_use_ema': False, 'bull_use_atr': True, 'bull_use_adx': True, 'bull_use_spike': False, 'bull_rsi_required': False, 'bear_strategy': 'breakout', 'bear_bb_std_mult': 3.4014238285006297, 'bear_rsi_os': 47, 'bear_rsi_ob': 85, 'bear_adx_thresh': 5.025796775129048, 'bear_atr_min_pct': 0.009889068798820837, 'bear_atr_max_pct': 0.05689204286447733, 'bear_tp_mult': 2.6703620792927407, 'bear_tsl_mult': 0.1489015595254579, 'bear_time_stop': 174, 'bear_use_sma': False, 'bear_use_ema': True, 'bear_use_atr': True, 'bear_use_adx': True, 'bear_use_spike': True, 'bear_rsi_required': False, 'sideways_strategy': 'breakout', 'sideways_bb_std_mult': 3.226713198667044, 'sideways_rsi_os': 17, 'sideways_rsi_ob': 58, 'sideways_adx_thresh': 17.718307368135694, 'sideways_atr_min_pct': 0.019733063396401757, 'sideways_atr_max_pct': 0.1186480682474397, 'sideways_tp_mult': 1.8332666247712486, 'sideways_tsl_mult': 0.6209312560441703, 'sideways_time_stop': 226, 'sideways_use_sma': False, 'sideways_use_ema': False, 'sideways_use_atr': True, 'sideways_use_adx': False, 'sideways_use_spike': False, 'sideways_rsi_required': True}.
[I 2025-08-30 19:02:55,331] Trial 213 finished with values: [-0.020015382732505138, 0.019910487099030864] and parameters: {'p_sma': 40, 'p_std': 46, 'p_atr': 24, 'p_adx': 9, 'rsi_period': 54, 'ema1': 27, 'ema2': 15, 'slip_atr_k': 0.07658443250955257, 'slip_spread_k': 0.7526750765601682, 'spread_hl_frac': 0.040925860026792424, 'bb_std_mult': 2.315610073789367, 'rsi_os': 29, 'rsi_ob': 52, 'vol_spike': 0.18373563584486377, 'adx_thresh': 19.703023849759244, 'atr_min_pct': 0.009270825936157934, 'atr_max_pct': 0.13551688060433395, 'tp_mult': 2.2531128879493316, 'tsl_mult': 0.7626746398077775, 'strategy': 'mean_reversion', 'time_stop': 218, 'use_sma': False, 'use_atr': False, 'use_adx': False, 'use_ema': True, 'use_spike': False, 'rsi_required': True, 'edge_k': 0.08373356851491556, 'edge_cap': 0.2662664027149928, 'bull_strategy': 'breakout', 'bull_bb_std_mult': 2.84403081204126, 'bull_rsi_os': 48, 'bull_rsi_ob': 71, 'bull_adx_thresh': 26.214973117069878, 'bull_atr_min_pct': 0.0008889808846532683, 'bull_atr_max_pct': 0.06547040339255658, 'bull_tp_mult': 2.136830919154851, 'bull_tsl_mult': 0.9667518201512113, 'bull_time_stop': 188, 'bull_use_sma': True, 'bull_use_ema': False, 'bull_use_atr': True, 'bull_use_adx': True, 'bull_use_spike': False, 'bull_rsi_required': False, 'bear_strategy': 'breakout', 'bear_bb_std_mult': 2.0667184396273024, 'bear_rsi_os': 39, 'bear_rsi_ob': 63, 'bear_adx_thresh': 5.362517940804001, 'bear_atr_min_pct': 0.025956899702912928, 'bear_atr_max_pct': 0.05651342851939391, 'bear_tp_mult': 1.3976163698732988, 'bear_tsl_mult': 0.11643156080234723, 'bear_time_stop': 37, 'bear_use_sma': False, 'bear_use_ema': True, 'bear_use_atr': True, 'bear_use_adx': True, 'bear_use_spike': True, 'bear_rsi_required': False, 'sideways_strategy': 'breakout', 'sideways_bb_std_mult': 1.6154167762962568, 'sideways_rsi_os': 17, 'sideways_rsi_ob': 74, 'sideways_adx_thresh': 17.926783081035865, 'sideways_atr_min_pct': 0.019697506809439692, 'sideways_atr_max_pct': 0.032226614063829075, 'sideways_tp_mult': 2.42963789479545, 'sideways_tsl_mult': 0.9040143441579094, 'sideways_time_stop': 258, 'sideways_use_sma': False, 'sideways_use_ema': False, 'sideways_use_atr': True, 'sideways_use_adx': False, 'sideways_use_spike': False, 'sideways_rsi_required': True}.
[I 2025-08-30 19:02:55,497] Trial 215 finished with values: [-1000000000.0, 1000000000.0] and parameters: {'p_sma': 48, 'p_std': 45, 'p_atr': 11, 'p_adx': 8, 'rsi_period': 54, 'ema1': 17, 'ema2': 15, 'slip_atr_k': 0.1281538042212524, 'slip_spread_k': 0.18694011543333217, 'spread_hl_frac': 0.004472909873234593, 'bb_std_mult': 1.4858454429223067, 'rsi_os': 10, 'rsi_ob': 54, 'vol_spike': 0.030342651918681397, 'adx_thresh': 11.570769386124493, 'atr_min_pct': 0.023400271549098756, 'atr_max_pct': 0.13560991405376016, 'tp_mult': 2.065785257001593, 'tsl_mult': 0.7631831283007855, 'strategy': 'breakout', 'time_stop': 28, 'use_sma': False, 'use_atr': False, 'use_adx': False, 'use_ema': True, 'use_spike': False, 'rsi_required': True, 'edge_k': 1.0475674436109244, 'edge_cap': 0.2810242618234831, 'bull_strategy': 'breakout', 'bull_bb_std_mult': 1.429854281716152, 'bull_rsi_os': 48, 'bull_rsi_ob': 73, 'bull_adx_thresh': 26.24637509000301, 'bull_atr_min_pct': 0.013180160270217884, 'bull_atr_max_pct': 0.06558595806279624, 'bull_tp_mult': 1.6591962004929242, 'bull_tsl_mult': 0.3156718879400596, 'bull_time_stop': 189, 'bull_use_sma': True, 'bull_use_ema': False, 'bull_use_atr': True, 'bull_use_adx': True, 'bull_use_spike': False, 'bull_rsi_required': True, 'bear_strategy': 'breakout', 'bear_bb_std_mult': 0.6982774042869362, 'bear_rsi_os': 47, 'bear_rsi_ob': 63, 'bear_adx_thresh': 5.0493227943928805, 'bear_atr_min_pct': 0.013294101510439874, 'bear_atr_max_pct': 0.05621021740445457, 'bear_tp_mult': 2.5700497502158512, 'bear_tsl_mult': 0.5950102270882625, 'bear_time_stop': 123, 'bear_use_sma': False, 'bear_use_ema': True, 'bear_use_atr': True, 'bear_use_adx': True, 'bear_use_spike': False, 'bear_rsi_required': False, 'sideways_strategy': 'breakout', 'sideways_bb_std_mult': 3.235886333813526, 'sideways_rsi_os': 27, 'sideways_rsi_ob': 58, 'sideways_adx_thresh': 17.84167584983546, 'sideways_atr_min_pct': 0.02083396730063882, 'sideways_atr_max_pct': 0.04021145837107315, 'sideways_tp_mult': 2.580914813461251, 'sideways_tsl_mult': 0.9220028441255461, 'sideways_time_stop': 99, 'sideways_use_sma': False, 'sideways_use_ema': False, 'sideways_use_atr': False, 'sideways_use_adx': False, 'sideways_use_spike': False, 'sideways_rsi_required': False}.
[I 2025-08-30 19:02:55,629] Trial 212 finished with values: [-0.02336540090350514, 0.023276312027995565] and parameters: {'p_sma': 32, 'p_std': 30, 'p_atr': 7, 'p_adx': 9, 'rsi_period': 36, 'ema1': 11, 'ema2': 34, 'slip_atr_k': 0.12760509554260824, 'slip_spread_k': 0.8338728936869451, 'spread_hl_frac': 0.004417629819675247, 'bb_std_mult': 2.328965084432878, 'rsi_os': 28, 'rsi_ob': 52, 'vol_spike': 0.04195495490636245, 'adx_thresh': 19.640522803840017, 'atr_min_pct': 0.0228951361580742, 'atr_max_pct': 0.13037972430620465, 'tp_mult': 1.9466181494699846, 'tsl_mult': 0.7531559817892137, 'strategy': 'mean_reversion', 'time_stop': 26, 'use_sma': False, 'use_atr': False, 'use_adx': False, 'use_ema': True, 'use_spike': False, 'rsi_required': True, 'edge_k': 0.07371689252830538, 'edge_cap': 0.2708943256225925, 'bull_strategy': 'breakout', 'bull_bb_std_mult': 1.8246196550336347, 'bull_rsi_os': 48, 'bull_rsi_ob': 71, 'bull_adx_thresh': 10.585516471937778, 'bull_atr_min_pct': 0.0009845631002667072, 'bull_atr_max_pct': 0.06301317291439061, 'bull_tp_mult': 1.6095272823989828, 'bull_tsl_mult': 0.9648885544927195, 'bull_time_stop': 186, 'bull_use_sma': True, 'bull_use_ema': False, 'bull_use_atr': True, 'bull_use_adx': True, 'bull_use_spike': False, 'bull_rsi_required': False, 'bear_strategy': 'breakout', 'bear_bb_std_mult': 1.7742542319721109, 'bear_rsi_os': 34, 'bear_rsi_ob': 63, 'bear_adx_thresh': 5.313006973555128, 'bear_atr_min_pct': 0.013142570985953388, 'bear_atr_max_pct': 0.055026147274147716, 'bear_tp_mult': 2.5527876944645005, 'bear_tsl_mult': 0.24251530483596273, 'bear_time_stop': 93, 'bear_use_sma': False, 'bear_use_ema': True, 'bear_use_atr': True, 'bear_use_adx': True, 'bear_use_spike': True, 'bear_rsi_required': False, 'sideways_strategy': 'breakout', 'sideways_bb_std_mult': 1.9838931679125045, 'sideways_rsi_os': 15, 'sideways_rsi_ob': 58, 'sideways_adx_thresh': 11.94968889000183, 'sideways_atr_min_pct': 0.020835822642650763, 'sideways_atr_max_pct': 0.11785620189167034, 'sideways_tp_mult': 2.594642093870845, 'sideways_tsl_mult': 0.3044566560382008, 'sideways_time_stop': 258, 'sideways_use_sma': False, 'sideways_use_ema': False, 'sideways_use_atr': True, 'sideways_use_adx': False, 'sideways_use_spike': False, 'sideways_rsi_required': True}.
