[I 2025-08-30 19:49:38,075] Trial 558 finished with values: [-1000000000.0, 1000000000.0] and parameters: {'p_sma': 38, 'p_std': 25, 'p_atr': 23, 'p_adx': 9, 'rsi_period': 57, 'ema1': 5, 'ema2': 47, 'slip_atr_k': 0.02036820843178553, 'slip_spread_k': 0.43775513350086986, 'spread_hl_frac': 0.007379634781093415, 'bb_std_mult': 0.8992558994762588, 'rsi_os': 9, 'rsi_ob': 77, 'vol_spike': 0.0636061967184263, 'adx_thresh': 19.73259543230515, 'atr_min_pct': 0.003566193250714363, 'atr_max_pct': 0.14256708036132962, 'tp_mult': 2.0287039752919416, 'tsl_mult': 0.1761856601202978, 'strategy': 'mean_reversion', 'time_stop': 43, 'use_sma': True, 'use_atr': True, 'use_adx': False, 'use_ema': False, 'use_spike': True, 'rsi_required': True, 'edge_k': 1.032027609172149, 'edge_cap': 0.22640930739746015, 'bull_strategy': 'mean_reversion', 'bull_bb_std_mult': 1.3410807378035159, 'bull_rsi_os': 11, 'bull_rsi_ob': 88, 'bull_adx_thresh': 22.487094454341186, 'bull_atr_min_pct': 0.027641605388913987, 'bull_atr_max_pct': 0.011617588574584267, 'bull_tp_mult': 2.6676838177678093, 'bull_tsl_mult': 0.4312042643201992, 'bull_time_stop': 45, 'bull_use_sma': True, 'bull_use_ema': True, 'bull_use_atr': False, 'bull_use_adx': False, 'bull_use_spike': True, 'bull_rsi_required': True, 'bear_strategy': 'breakout', 'bear_bb_std_mult': 3.262087103483399, 'bear_rsi_os': 32, 'bear_rsi_ob': 48, 'bear_adx_thresh': 26.218853706099317, 'bear_atr_min_pct': 0.015113032085356744, 'bear_atr_max_pct': 0.14134352503815806, 'bear_tp_mult': 1.6098121828757364, 'bear_tsl_mult': 0.13003315317914993, 'bear_time_stop': 12, 'bear_use_sma': False, 'bear_use_ema': False, 'bear_use_atr': True, 'bear_use_adx': True, 'bear_use_spike': False, 'bear_rsi_required': True, 'sideways_strategy': 'breakout', 'sideways_bb_std_mult': 1.716814300327794, 'sideways_rsi_os': 8, 'sideways_rsi_ob': 62, 'sideways_adx_thresh': 31.4519021503775, 'sideways_atr_min_pct': 0.02014007798329118, 'sideways_atr_max_pct': 0.12286464091141211, 'sideways_tp_mult': 2.6381995554943405, 'sideways_tsl_mult': 0.6717307576962925, 'sideways_time_stop': 212, 'sideways_use_sma': True, 'sideways_use_ema': False, 'sideways_use_atr': False, 'sideways_use_adx': False, 'sideways_use_spike': True, 'sideways_rsi_required': False}.
[I 2025-08-30 19:49:38,185] Trial 556 finished with values: [-1000000000.0, 1000000000.0] and parameters: {'p_sma': 60, 'p_std': 45, 'p_atr': 27, 'p_adx': 8, 'rsi_period': 57, 'ema1': 24, 'ema2': 47, 'slip_atr_k': 0.02627547332368402, 'slip_spread_k': 0.4361880314609724, 'spread_hl_frac': 0.017581286293875276, 'bb_std_mult': 0.8919804257920676, 'rsi_os': 37, 'rsi_ob': 57, 'vol_spike': 0.2534484901820424, 'adx_thresh': 17.801488301856626, 'atr_min_pct': 0.017440402208097307, 'atr_max_pct': 0.14172146929863, 'tp_mult': 1.8259753269780463, 'tsl_mult': 0.33602388307440706, 'strategy': 'breakout', 'time_stop': 27, 'use_sma': False, 'use_atr': True, 'use_adx': False, 'use_ema': False, 'use_spike': True, 'rsi_required': True, 'edge_k': 1.7387840041968228, 'edge_cap': 0.05008075485626162, 'bull_strategy': 'mean_reversion', 'bull_bb_std_mult': 1.4183173752035947, 'bull_rsi_os': 47, 'bull_rsi_ob': 79, 'bull_adx_thresh': 32.16550950808437, 'bull_atr_min_pct': 0.018947105134075992, 'bull_atr_max_pct': 0.012552844876948258, 'bull_tp_mult': 2.2725340082746253, 'bull_tsl_mult': 0.9999223944820523, 'bull_time_stop': 241, 'bull_use_sma': False, 'bull_use_ema': False, 'bull_use_atr': False, 'bull_use_adx': False, 'bull_use_spike': True, 'bull_rsi_required': True, 'bear_strategy': 'breakout', 'bear_bb_std_mult': 3.2554476307747064, 'bear_rsi_os': 41, 'bear_rsi_ob': 53, 'bear_adx_thresh': 5.474290918878801, 'bear_atr_min_pct': 0.014838402212491792, 'bear_atr_max_pct': 0.0527870257907436, 'bear_tp_mult': 1.766221109233654, 'bear_tsl_mult': 0.6769057925991822, 'bear_time_stop': 287, 'bear_use_sma': True, 'bear_use_ema': False, 'bear_use_atr': True, 'bear_use_adx': True, 'bear_use_spike': False, 'bear_rsi_required': False, 'sideways_strategy': 'breakout', 'sideways_bb_std_mult': 3.598578163028448, 'sideways_rsi_os': 48, 'sideways_rsi_ob': 59, 'sideways_adx_thresh': 31.315288236977544, 'sideways_atr_min_pct': 0.017455377571117783, 'sideways_atr_max_pct': 0.12884063262981016, 'sideways_tp_mult': 2.319295008011171, 'sideways_tsl_mult': 0.6699104686799243, 'sideways_time_stop': 275, 'sideways_use_sma': True, 'sideways_use_ema': True, 'sideways_use_atr': False, 'sideways_use_adx': True, 'sideways_use_spike': False, 'sideways_rsi_required': False}.
[I 2025-08-30 19:49:39,009] Trial 562 finished with values: [-1000000000.0, 1000000000.0] and parameters: {'p_sma': 6, 'p_std': 47, 'p_atr': 25, 'p_adx': 7, 'rsi_period': 76, 'ema1': 20, 'ema2': 48, 'slip_atr_k': 0.023502604639678765, 'slip_spread_k': 0.3948069828083003, 'spread_hl_frac': 0.005115786230287665, 'bb_std_mult': 0.8112502973506948, 'rsi_os': 38, 'rsi_ob': 92, 'vol_spike': 0.1377136374517054, 'adx_thresh': 28.364303453965483, 'atr_min_pct': 0.02265031632277172, 'atr_max_pct': 0.017026802767567004, 'tp_mult': 2.2068409902260204, 'tsl_mult': 0.7102745481203666, 'strategy': 'breakout', 'time_stop': 42, 'use_sma': False, 'use_atr': False, 'use_adx': True, 'use_ema': False, 'use_spike': True, 'rsi_required': True, 'edge_k': 0.0448073997671722, 'edge_cap': 0.13758897852093704, 'bull_strategy': 'breakout', 'bull_bb_std_mult': 3.2144964739925737, 'bull_rsi_os': 27, 'bull_rsi_ob': 75, 'bull_adx_thresh': 32.12331194614323, 'bull_atr_min_pct': 0.0006137358172334378, 'bull_atr_max_pct': 0.07850669421629887, 'bull_tp_mult': 2.194549295168917, 'bull_tsl_mult': 0.9623510334119153, 'bull_time_stop': 222, 'bull_use_sma': True, 'bull_use_ema': False, 'bull_use_atr': False, 'bull_use_adx': True, 'bull_use_spike': False, 'bull_rsi_required': True, 'bear_strategy': 'mean_reversion', 'bear_bb_std_mult': 3.438216995335371, 'bear_rsi_os': 43, 'bear_rsi_ob': 75, 'bear_adx_thresh': 5.558298411641958, 'bear_atr_min_pct': 0.028157402009730062, 'bear_atr_max_pct': 0.14523099222446503, 'bear_tp_mult': 1.4354521136193088, 'bear_tsl_mult': 0.06788914157203861, 'bear_time_stop': 149, 'bear_use_sma': True, 'bear_use_ema': False, 'bear_use_atr': False, 'bear_use_adx': False, 'bear_use_spike': True, 'bear_rsi_required': False, 'sideways_strategy': 'mean_reversion', 'sideways_bb_std_mult': 2.0591144486043333, 'sideways_rsi_os': 15, 'sideways_rsi_ob': 74, 'sideways_adx_thresh': 8.321042717098807, 'sideways_atr_min_pct': 0.021348361719013904, 'sideways_atr_max_pct': 0.11423115172749475, 'sideways_tp_mult': 2.0650570586758, 'sideways_tsl_mult': 0.29759155069203835, 'sideways_time_stop': 267, 'sideways_use_sma': False, 'sideways_use_ema': True, 'sideways_use_atr': True, 'sideways_use_adx': False, 'sideways_use_spike': False, 'sideways_rsi_required': True}.
[I 2025-08-30 19:50:11,087] Trial 563 finished with values: [-1000000000.0, 1000000000.0] and parameters: {'p_sma': 42, 'p_std': 47, 'p_atr': 9, 'p_adx': 20, 'rsi_period': 19, 'ema1': 25, 'ema2': 22, 'slip_atr_k': 0.0496752152363803, 'slip_spread_k': 0.3911499024422899, 'spread_hl_frac': 0.021085447518766794, 'bb_std_mult': 3.029275320862875, 'rsi_os': 15, 'rsi_ob': 55, 'vol_spike': 0.025711681075094427, 'adx_thresh': 18.675219422048826, 'atr_min_pct': 0.007153369813066716, 'atr_max_pct': 0.016852536131718804, 'tp_mult': 2.2052332232471437, 'tsl_mult': 0.20138864364954007, 'strategy': 'breakout', 'time_stop': 41, 'use_sma': False, 'use_atr': False, 'use_adx': True, 'use_ema': True, 'use_spike': False, 'rsi_required': False, 'edge_k': 0.04902840406986808, 'edge_cap': 0.2642022821270126, 'bull_strategy': 'breakout', 'bull_bb_std_mult': 1.0483744254970966, 'bull_rsi_os': 51, 'bull_rsi_ob': 74, 'bull_adx_thresh': 29.911276961741216, 'bull_atr_min_pct': 0.005431054974128151, 'bull_atr_max_pct': 0.035322594702415014, 'bull_tp_mult': 2.181230612754287, 'bull_tsl_mult': 0.9544649533206226, 'bull_time_stop': 60, 'bull_use_sma': True, 'bull_use_ema': False, 'bull_use_atr': True, 'bull_use_adx': True, 'bull_use_spike': False, 'bull_rsi_required': False, 'bear_strategy': 'mean_reversion', 'bear_bb_std_mult': 3.4774312783682353, 'bear_rsi_os': 47, 'bear_rsi_ob': 95, 'bear_adx_thresh': 5.01425888650488, 'bear_atr_min_pct': 0.023696890216027493, 'bear_atr_max_pct': 0.146137803907008, 'bear_tp_mult': 1.9428649603724537, 'bear_tsl_mult': 0.5660617474273861, 'bear_time_stop': 118, 'bear_use_sma': True, 'bear_use_ema': True, 'bear_use_atr': False, 'bear_use_adx': False, 'bear_use_spike': True, 'bear_rsi_required': False, 'sideways_strategy': 'mean_reversion', 'sideways_bb_std_mult': 2.1243741492467465, 'sideways_rsi_os': 15, 'sideways_rsi_ob': 57, 'sideways_adx_thresh': 24.372939653079676, 'sideways_atr_min_pct': 0.021260880922976937, 'sideways_atr_max_pct': 0.1139827356322227, 'sideways_tp_mult': 1.7301670383102707, 'sideways_tsl_mult': 0.2940692132676071, 'sideways_time_stop': 267, 'sideways_use_sma': False, 'sideways_use_ema': True, 'sideways_use_atr': True, 'sideways_use_adx': False, 'sideways_use_spike': False, 'sideways_rsi_required': True}.
[I 2025-08-30 19:50:12,039] Trial 560 finished with values: [-1000000000.0, 1000000000.0] and parameters: {'p_sma': 42, 'p_std': 21, 'p_atr': 28, 'p_adx': 7, 'rsi_period': 57, 'ema1': 25, 'ema2': 16, 'slip_atr_k': 0.123300716701127, 'slip_spread_k': 0.43897561910151023, 'spread_hl_frac': 0.0075199873950795885, 'bb_std_mult': 1.0173714167036787, 'rsi_os': 34, 'rsi_ob': 61, 'vol_spike': 0.06395137222252774, 'adx_thresh': 16.65046823333413, 'atr_min_pct': 0.003578621872683466, 'atr_max_pct': 0.13265599905052292, 'tp_mult': 2.777377836063457, 'tsl_mult': 0.17990630212022624, 'strategy': 'breakout', 'time_stop': 42, 'use_sma': False, 'use_atr': True, 'use_adx': True, 'use_ema': False, 'use_spike': True, 'rsi_required': True, 'edge_k': 1.0732016457451805, 'edge_cap': 0.15225888832348422, 'bull_strategy': 'mean_reversion', 'bull_bb_std_mult': 1.8292324672633493, 'bull_rsi_os': 47, 'bull_rsi_ob': 53, 'bull_adx_thresh': 26.044227710981296, 'bull_atr_min_pct': 0.027415745047499537, 'bull_atr_max_pct': 0.019490047439111053, 'bull_tp_mult': 2.889201940093219, 'bull_tsl_mult': 0.5565277779977699, 'bull_time_stop': 242, 'bull_use_sma': True, 'bull_use_ema': False, 'bull_use_atr': False, 'bull_use_adx': False, 'bull_use_spike': True, 'bull_rsi_required': True, 'bear_strategy': 'breakout', 'bear_bb_std_mult': 3.271089897208287, 'bear_rsi_os': 50, 'bear_rsi_ob': 89, 'bear_adx_thresh': 5.540442200577685, 'bear_atr_min_pct': 0.01649934613274591, 'bear_atr_max_pct': 0.05288490210082824, 'bear_tp_mult': 1.5635609584713763, 'bear_tsl_mult': 0.1323006395610993, 'bear_time_stop': 287, 'bear_use_sma': True, 'bear_use_ema': False, 'bear_use_atr': True, 'bear_use_adx': True, 'bear_use_spike': False, 'bear_rsi_required': False, 'sideways_strategy': 'breakout', 'sideways_bb_std_mult': 2.137264757001047, 'sideways_rsi_os': 17, 'sideways_rsi_ob': 57, 'sideways_adx_thresh': 13.944455916490291, 'sideways_atr_min_pct': 0.01928830003814387, 'sideways_atr_max_pct': 0.14863399631168026, 'sideways_tp_mult': 1.7329808934582331, 'sideways_tsl_mult': 0.08087085882979772, 'sideways_time_stop': 275, 'sideways_use_sma': True, 'sideways_use_ema': True, 'sideways_use_atr': False, 'sideways_use_adx': False, 'sideways_use_spike': False, 'sideways_rsi_required': False}.
[I 2025-08-30 19:50:12,761] Trial 561 finished with values: [-1000000000.0, 1000000000.0] and parameters: {'p_sma': 42, 'p_std': 25, 'p_atr': 28, 'p_adx': 7, 'rsi_period': 52, 'ema1': 25, 'ema2': 26, 'slip_atr_k': 0.12215630118419231, 'slip_spread_k': 0.3924091214095895, 'spread_hl_frac': 0.006819023107648118, 'bb_std_mult': 1.0070379719053564, 'rsi_os': 38, 'rsi_ob': 55, 'vol_spike': 0.013291545403740983, 'adx_thresh': 10.564163407757416, 'atr_min_pct': 0.02258915696079654, 'atr_max_pct': 0.14712776934406097, 'tp_mult': 2.163873183525964, 'tsl_mult': 0.78853037546346, 'strategy': 'breakout', 'time_stop': 43, 'use_sma': False, 'use_atr': False, 'use_adx': True, 'use_ema': False, 'use_spike': True, 'rsi_required': True, 'edge_k': 0.040633975194205196, 'edge_cap': 0.42130108189956417, 'bull_strategy': 'breakout', 'bull_bb_std_mult': 1.0658583245429345, 'bull_rsi_os': 25, 'bull_rsi_ob': 75, 'bull_adx_thresh': 24.817704993052594, 'bull_atr_min_pct': 0.027301225016763558, 'bull_atr_max_pct': 0.019680164361371398, 'bull_tp_mult': 2.1703358879867753, 'bull_tsl_mult': 0.17978515090557107, 'bull_time_stop': 185, 'bull_use_sma': True, 'bull_use_ema': True, 'bull_use_atr': False, 'bull_use_adx': True, 'bull_use_spike': True, 'bull_rsi_required': True, 'bear_strategy': 'breakout', 'bear_bb_std_mult': 3.4780818241373197, 'bear_rsi_os': 50, 'bear_rsi_ob': 48, 'bear_adx_thresh': 5.544978465704034, 'bear_atr_min_pct': 0.003626384987766169, 'bear_atr_max_pct': 0.13950601021232348, 'bear_tp_mult': 2.008659460349226, 'bear_tsl_mult': 0.4023960651985725, 'bear_time_stop': 264, 'bear_use_sma': True, 'bear_use_ema': False, 'bear_use_atr': False, 'bear_use_adx': False, 'bear_use_spike': False, 'bear_rsi_required': False, 'sideways_strategy': 'breakout', 'sideways_bb_std_mult': 2.1176845765186285, 'sideways_rsi_os': 15, 'sideways_rsi_ob': 57, 'sideways_adx_thresh': 24.427954790780912, 'sideways_atr_min_pct': 0.02007842636860717, 'sideways_atr_max_pct': 0.02429424375165666, 'sideways_tp_mult': 2.058905486314113, 'sideways_tsl_mult': 0.08218581835028271, 'sideways_time_stop': 32, 'sideways_use_sma': False, 'sideways_use_ema': True, 'sideways_use_atr': False, 'sideways_use_adx': False, 'sideways_use_spike': True, 'sideways_rsi_required': True}.
[I 2025-08-30 19:50:13,163] Trial 564 finished with values: [-1000000000.0, 1000000000.0] and parameters: {'p_sma': 42, 'p_std': 28, 'p_atr': 12, 'p_adx': 30, 'rsi_period': 52, 'ema1': 25, 'ema2': 16, 'slip_atr_k': 0.0283801158422771, 'slip_spread_k': 0.4015517836318737, 'spread_hl_frac': 0.006090221221877797, 'bb_std_mult': 2.9199199309185118, 'rsi_os': 38, 'rsi_ob': 55, 'vol_spike': 0.026008129846698293, 'adx_thresh': 16.522161538711153, 'atr_min_pct': 0.023425957847572416, 'atr_max_pct': 0.1318611728229812, 'tp_mult': 2.15622873390358, 'tsl_mult': 0.7848593651453072, 'strategy': 'breakout', 'time_stop': 139, 'use_sma': False, 'use_atr': False, 'use_adx': True, 'use_ema': True, 'use_spike': False, 'rsi_required': False, 'edge_k': 0.10301442643568993, 'edge_cap': 0.25772953566273005, 'bull_strategy': 'breakout', 'bull_bb_std_mult': 3.537917785081828, 'bull_rsi_os': 54, 'bull_rsi_ob': 67, 'bull_adx_thresh': 14.344391286857, 'bull_atr_min_pct': 0.020749075442427108, 'bull_atr_max_pct': 0.01943073667230962, 'bull_tp_mult': 1.5603849850550477, 'bull_tsl_mult': 0.8378460876651184, 'bull_time_stop': 96, 'bull_use_sma': True, 'bull_use_ema': False, 'bull_use_atr': True, 'bull_use_adx': True, 'bull_use_spike': True, 'bull_rsi_required': False, 'bear_strategy': 'breakout', 'bear_bb_std_mult': 3.533169850885209, 'bear_rsi_os': 6, 'bear_rsi_ob': 45, 'bear_adx_thresh': 6.20373064590099, 'bear_atr_min_pct': 0.01654641241147488, 'bear_atr_max_pct': 0.06600045578871955, 'bear_tp_mult': 2.3567999470101, 'bear_tsl_mult': 0.17150249712914944, 'bear_time_stop': 28, 'bear_use_sma': True, 'bear_use_ema': True, 'bear_use_atr': False, 'bear_use_adx': False, 'bear_use_spike': False, 'bear_rsi_required': False, 'sideways_strategy': 'breakout', 'sideways_bb_std_mult': 2.1306238741508663, 'sideways_rsi_os': 19, 'sideways_rsi_ob': 57, 'sideways_adx_thresh': 9.297914850652043, 'sideways_atr_min_pct': 0.01170743979661586, 'sideways_atr_max_pct': 0.14804341566178436, 'sideways_tp_mult': 1.7310937309588545, 'sideways_tsl_mult': 0.38996576858300386, 'sideways_time_stop': 20, 'sideways_use_sma': False, 'sideways_use_ema': True, 'sideways_use_atr': False, 'sideways_use_adx': False, 'sideways_use_spike': False, 'sideways_rsi_required': True}.
[I 2025-08-30 19:50:46,759] Trial 568 finished with values: [-0.021180187031082598, 0.021135423441403362] and parameters: {'p_sma': 40, 'p_std': 27, 'p_atr': 13, 'p_adx': 13, 'rsi_period': 34, 'ema1': 14, 'ema2': 15, 'slip_atr_k': 0.013710195768813774, 'slip_spread_k': 0.4153842975225882, 'spread_hl_frac': 0.03714934468427329, 'bb_std_mult': 2.5190821683717304, 'rsi_os': 11, 'rsi_ob': 58, 'vol_spike': 0.04788925086610083, 'adx_thresh': 15.775409667333946, 'atr_min_pct': 0.02984591616505544, 'atr_max_pct': 0.13941030824662617, 'tp_mult': 2.2614585492066577, 'tsl_mult': 0.7541147286583062, 'strategy': 'mean_reversion', 'time_stop': 131, 'use_sma': False, 'use_atr': True, 'use_adx': False, 'use_ema': False, 'use_spike': True, 'rsi_required': True, 'edge_k': 0.17000222636641388, 'edge_cap': 0.28987837562813473, 'bull_strategy': 'mean_reversion', 'bull_bb_std_mult': 0.735695119226313, 'bull_rsi_os': 49, 'bull_rsi_ob': 71, 'bull_adx_thresh': 33.51848808015394, 'bull_atr_min_pct': 0.00127251176599773, 'bull_atr_max_pct': 0.02366046251970656, 'bull_tp_mult': 1.77131974720533, 'bull_tsl_mult': 0.6147115400238062, 'bull_time_stop': 187, 'bull_use_sma': True, 'bull_use_ema': False, 'bull_use_atr': False, 'bull_use_adx': True, 'bull_use_spike': True, 'bull_rsi_required': True, 'bear_strategy': 'breakout', 'bear_bb_std_mult': 3.377447484468391, 'bear_rsi_os': 25, 'bear_rsi_ob': 83, 'bear_adx_thresh': 21.223469189823973, 'bear_atr_min_pct': 0.015698050818647235, 'bear_atr_max_pct': 0.04357375759194499, 'bear_tp_mult': 1.8647780249914334, 'bear_tsl_mult': 0.09805528914211391, 'bear_time_stop': 40, 'bear_use_sma': False, 'bear_use_ema': False, 'bear_use_atr': True, 'bear_use_adx': True, 'bear_use_spike': False, 'bear_rsi_required': True, 'sideways_strategy': 'breakout', 'sideways_bb_std_mult': 1.8511940613018938, 'sideways_rsi_os': 52, 'sideways_rsi_ob': 90, 'sideways_adx_thresh': 10.845786673256656, 'sideways_atr_min_pct': 0.004860070394271743, 'sideways_atr_max_pct': 0.13383678403475813, 'sideways_tp_mult': 1.415284954293548, 'sideways_tsl_mult': 0.7561646007870615, 'sideways_time_stop': 126, 'sideways_use_sma': True, 'sideways_use_ema': False, 'sideways_use_atr': False, 'sideways_use_adx': False, 'sideways_use_spike': False, 'sideways_rsi_required': False}.
[I 2025-08-30 19:50:47,142] Trial 566 finished with values: [-1000000000.0, 1000000000.0] and parameters: {'p_sma': 40, 'p_std': 27, 'p_atr': 12, 'p_adx': 9, 'rsi_period': 52, 'ema1': 30, 'ema2': 54, 'slip_atr_k': 0.02878097486911843, 'slip_spread_k': 0.40944269589701876, 'spread_hl_frac': 0.028912532577886084, 'bb_std_mult': 2.1870918223080693, 'rsi_os': 36, 'rsi_ob': 54, 'vol_spike': 0.04628648081504153, 'adx_thresh': 19.415341195619405, 'atr_min_pct': 0.02581129243123746, 'atr_max_pct': 0.14742633462549642, 'tp_mult': 2.1586628459332307, 'tsl_mult': 0.4058634488290093, 'strategy': 'breakout', 'time_stop': 275, 'use_sma': False, 'use_atr': True, 'use_adx': False, 'use_ema': False, 'use_spike': True, 'rsi_required': True, 'edge_k': 1.114778752605002, 'edge_cap': 0.28978168644522073, 'bull_strategy': 'mean_reversion', 'bull_bb_std_mult': 1.9464979606488928, 'bull_rsi_os': 35, 'bull_rsi_ob': 71, 'bull_adx_thresh': 14.21207443849293, 'bull_atr_min_pct': 0.001405445386226783, 'bull_atr_max_pct': 0.023894489437922706, 'bull_tp_mult': 1.5617472330679207, 'bull_tsl_mult': 0.1730994913745273, 'bull_time_stop': 183, 'bull_use_sma': True, 'bull_use_ema': True, 'bull_use_atr': False, 'bull_use_adx': True, 'bull_use_spike': True, 'bull_rsi_required': True, 'bear_strategy': 'breakout', 'bear_bb_std_mult': 2.418402402894425, 'bear_rsi_os': 6, 'bear_rsi_ob': 83, 'bear_adx_thresh': 6.414838528710531, 'bear_atr_min_pct': 0.015764148159632924, 'bear_atr_max_pct': 0.10083588052831925, 'bear_tp_mult': 2.9486103524528446, 'bear_tsl_mult': 0.16508001852321513, 'bear_time_stop': 40, 'bear_use_sma': False, 'bear_use_ema': False, 'bear_use_atr': True, 'bear_use_adx': True, 'bear_use_spike': False, 'bear_rsi_required': True, 'sideways_strategy': 'breakout', 'sideways_bb_std_mult': 1.9960429851728627, 'sideways_rsi_os': 39, 'sideways_rsi_ob': 76, 'sideways_adx_thresh': 9.74028224906927, 'sideways_atr_min_pct': 0.007007882247652808, 'sideways_atr_max_pct': 0.11929492731863225, 'sideways_tp_mult': 1.82299221038476, 'sideways_tsl_mult': 0.04558555781912632, 'sideways_time_stop': 252, 'sideways_use_sma': True, 'sideways_use_ema': False, 'sideways_use_atr': False, 'sideways_use_adx': False, 'sideways_use_spike': True, 'sideways_rsi_required': False}.
