[I 2025-08-30 19:22:05,438] Trial 362 finished with values: [-1000000000.0, 1000000000.0] and parameters: {'p_sma': 47, 'p_std': 23, 'p_atr': 11, 'p_adx': 8, 'rsi_period': 51, 'ema1': 22, 'ema2': 17, 'slip_atr_k': 0.0757749784513349, 'slip_spread_k': 0.7502659780078355, 'spread_hl_frac': 0.031541147896046916, 'bb_std_mult': 0.6703137862054012, 'rsi_os': 40, 'rsi_ob': 45, 'vol_spike': 0.0382336431030525, 'adx_thresh': 17.841742371697205, 'atr_min_pct': 0.022604127877547044, 'atr_max_pct': 0.138694114154472, 'tp_mult': 1.706784821103959, 'tsl_mult': 0.1627508531060889, 'strategy': 'mean_reversion', 'time_stop': 16, 'use_sma': True, 'use_atr': False, 'use_adx': False, 'use_ema': False, 'use_spike': True, 'rsi_required': False, 'edge_k': 0.07211923509098295, 'edge_cap': 0.9538174024362862, 'bull_strategy': 'breakout', 'bull_bb_std_mult': 1.9878118803040545, 'bull_rsi_os': 24, 'bull_rsi_ob': 71, 'bull_adx_thresh': 24.349759273387335, 'bull_atr_min_pct': 0.0021948405050847522, 'bull_atr_max_pct': 0.03250444745594687, 'bull_tp_mult': 2.9267701503733976, 'bull_tsl_mult': 0.9978435927629737, 'bull_time_stop': 181, 'bull_use_sma': True, 'bull_use_ema': True, 'bull_use_atr': False, 'bull_use_adx': False, 'bull_use_spike': True, 'bull_rsi_required': False, 'bear_strategy': 'breakout', 'bear_bb_std_mult': 3.207679034899005, 'bear_rsi_os': 10, 'bear_rsi_ob': 84, 'bear_adx_thresh': 6.402715031086387, 'bear_atr_min_pct': 0.014314413318405354, 'bear_atr_max_pct': 0.0905631360522636, 'bear_tp_mult': 2.3012549640982574, 'bear_tsl_mult': 0.291976400390502, 'bear_time_stop': 40, 'bear_use_sma': True, 'bear_use_ema': False, 'bear_use_atr': True, 'bear_use_adx': True, 'bear_use_spike': True, 'bear_rsi_required': False, 'sideways_strategy': 'breakout', 'sideways_bb_std_mult': 0.9885937916926453, 'sideways_rsi_os': 30, 'sideways_rsi_ob': 94, 'sideways_adx_thresh': 10.530196288881681, 'sideways_atr_min_pct': 0.018788083522815205, 'sideways_atr_max_pct': 0.1156874065154032, 'sideways_tp_mult': 1.8303667490435074, 'sideways_tsl_mult': 0.5894552294281361, 'sideways_time_stop': 271, 'sideways_use_sma': True, 'sideways_use_ema': True, 'sideways_use_atr': False, 'sideways_use_adx': False, 'sideways_use_spike': False, 'sideways_rsi_required': False}.
[I 2025-08-30 19:22:39,037] Trial 361 finished with values: [-1000000000.0, 1000000000.0] and parameters: {'p_sma': 25, 'p_std': 26, 'p_atr': 24, 'p_adx': 8, 'rsi_period': 13, 'ema1': 22, 'ema2': 17, 'slip_atr_k': 0.10135279677152231, 'slip_spread_k': 0.8795370370060684, 'spread_hl_frac': 0.011947224995036268, 'bb_std_mult': 1.1380825877511005, 'rsi_os': 36, 'rsi_ob': 73, 'vol_spike': 0.009677757860812819, 'adx_thresh': 18.249951237825268, 'atr_min_pct': 0.024951945706142436, 'atr_max_pct': 0.13886074862964226, 'tp_mult': 1.5817411464012598, 'tsl_mult': 0.6844503619701304, 'strategy': 'mean_reversion', 'time_stop': 229, 'use_sma': True, 'use_atr': False, 'use_adx': False, 'use_ema': False, 'use_spike': True, 'rsi_required': False, 'edge_k': 0.0018204927418564443, 'edge_cap': 0.9531256076876389, 'bull_strategy': 'mean_reversion', 'bull_bb_std_mult': 1.589239472633532, 'bull_rsi_os': 8, 'bull_rsi_ob': 95, 'bull_adx_thresh': 26.104608964277723, 'bull_atr_min_pct': 0.002071287680659403, 'bull_atr_max_pct': 0.02043567973495229, 'bull_tp_mult': 1.3677126230657506, 'bull_tsl_mult': 0.9762543138923397, 'bull_time_stop': 115, 'bull_use_sma': True, 'bull_use_ema': False, 'bull_use_atr': False, 'bull_use_adx': True, 'bull_use_spike': True, 'bull_rsi_required': False, 'bear_strategy': 'breakout', 'bear_bb_std_mult': 0.894655182413828, 'bear_rsi_os': 6, 'bear_rsi_ob': 80, 'bear_adx_thresh': 7.1876476109844205, 'bear_atr_min_pct': 0.02529848575116571, 'bear_atr_max_pct': 0.09109384008689009, 'bear_tp_mult': 1.7460460055378608, 'bear_tsl_mult': 0.05669692614576033, 'bear_time_stop': 36, 'bear_use_sma': True, 'bear_use_ema': False, 'bear_use_atr': True, 'bear_use_adx': True, 'bear_use_spike': False, 'bear_rsi_required': False, 'sideways_strategy': 'breakout', 'sideways_bb_std_mult': 0.516951093521435, 'sideways_rsi_os': 47, 'sideways_rsi_ob': 57, 'sideways_adx_thresh': 10.15923744475634, 'sideways_atr_min_pct': 0.027120089578128656, 'sideways_atr_max_pct': 0.12514922503676065, 'sideways_tp_mult': 1.7548899067342927, 'sideways_tsl_mult': 0.7004151500402371, 'sideways_time_stop': 280, 'sideways_use_sma': True, 'sideways_use_ema': True, 'sideways_use_atr': False, 'sideways_use_adx': False, 'sideways_use_spike': True, 'sideways_rsi_required': False}.
[I 2025-08-30 19:22:39,049] Trial 363 finished with values: [-1000000000.0, 1000000000.0] and parameters: {'p_sma': 55, 'p_std': 25, 'p_atr': 8, 'p_adx': 8, 'rsi_period': 69, 'ema1': 22, 'ema2': 29, 'slip_atr_k': 0.022450263407004026, 'slip_spread_k': 0.7505709197634443, 'spread_hl_frac': 0.03017906366504348, 'bb_std_mult': 1.887767186194897, 'rsi_os': 36, 'rsi_ob': 73, 'vol_spike': 0.027387326337302884, 'adx_thresh': 18.057328244256166, 'atr_min_pct': 0.022110463982759652, 'atr_max_pct': 0.13822019909861077, 'tp_mult': 2.4795158746320425, 'tsl_mult': 0.1591487345716336, 'strategy': 'breakout', 'time_stop': 215, 'use_sma': True, 'use_atr': True, 'use_adx': False, 'use_ema': False, 'use_spike': True, 'rsi_required': False, 'edge_k': 1.7900299637226997, 'edge_cap': 0.21844941204125068, 'bull_strategy': 'mean_reversion', 'bull_bb_std_mult': 2.0043881622202844, 'bull_rsi_os': 7, 'bull_rsi_ob': 59, 'bull_adx_thresh': 33.77057947431712, 'bull_atr_min_pct': 0.0022220637245577764, 'bull_atr_max_pct': 0.020585594990162305, 'bull_tp_mult': 2.144864776185751, 'bull_tsl_mult': 0.9984510750452119, 'bull_time_stop': 116, 'bull_use_sma': True, 'bull_use_ema': True, 'bull_use_atr': False, 'bull_use_adx': False, 'bull_use_spike': True, 'bull_rsi_required': True, 'bear_strategy': 'breakout', 'bear_bb_std_mult': 2.1245954732496672, 'bear_rsi_os': 10, 'bear_rsi_ob': 81, 'bear_adx_thresh': 25.518202760466057, 'bear_atr_min_pct': 0.01753254009534741, 'bear_atr_max_pct': 0.02141237402369798, 'bear_tp_mult': 2.223390474043312, 'bear_tsl_mult': 0.04976283647689114, 'bear_time_stop': 37, 'bear_use_sma': True, 'bear_use_ema': False, 'bear_use_atr': True, 'bear_use_adx': True, 'bear_use_spike': False, 'bear_rsi_required': False, 'sideways_strategy': 'breakout', 'sideways_bb_std_mult': 0.5010513421053686, 'sideways_rsi_os': 28, 'sideways_rsi_ob': 94, 'sideways_adx_thresh': 8.121262578803643, 'sideways_atr_min_pct': 0.018882125949003365, 'sideways_atr_max_pct': 0.11699288874136425, 'sideways_tp_mult': 1.753116241892574, 'sideways_tsl_mult': 0.7025674586745474, 'sideways_time_stop': 269, 'sideways_use_sma': True, 'sideways_use_ema': True, 'sideways_use_atr': False, 'sideways_use_adx': False, 'sideways_use_spike': True, 'sideways_rsi_required': False}.
[I 2025-08-30 19:22:39,260] Trial 360 finished with values: [-1000000000.0, 1000000000.0] and parameters: {'p_sma': 5, 'p_std': 26, 'p_atr': 14, 'p_adx': 19, 'rsi_period': 39, 'ema1': 7, 'ema2': 55, 'slip_atr_k': 0.10205849386706198, 'slip_spread_k': 0.885097747330233, 'spread_hl_frac': 0.04208858264076669, 'bb_std_mult': 1.8976679121528346, 'rsi_os': 37, 'rsi_ob': 73, 'vol_spike': 0.27986232391768673, 'adx_thresh': 18.42563424148956, 'atr_min_pct': 0.02855898056018008, 'atr_max_pct': 0.13867993383491087, 'tp_mult': 2.1474851504934387, 'tsl_mult': 0.7614958645484168, 'strategy': 'breakout', 'time_stop': 11, 'use_sma': False, 'use_atr': True, 'use_adx': False, 'use_ema': False, 'use_spike': True, 'rsi_required': True, 'edge_k': 0.11366377832648619, 'edge_cap': 0.982423006739532, 'bull_strategy': 'mean_reversion', 'bull_bb_std_mult': 1.992110634622683, 'bull_rsi_os': 24, 'bull_rsi_ob': 80, 'bull_adx_thresh': 27.345012286884163, 'bull_atr_min_pct': 0.014394038557159098, 'bull_atr_max_pct': 0.02836106764187312, 'bull_tp_mult': 2.0747335214077567, 'bull_tsl_mult': 0.9830543501351113, 'bull_time_stop': 261, 'bull_use_sma': True, 'bull_use_ema': False, 'bull_use_atr': False, 'bull_use_adx': True, 'bull_use_spike': True, 'bull_rsi_required': True, 'bear_strategy': 'breakout', 'bear_bb_std_mult': 3.2825550610816405, 'bear_rsi_os': 20, 'bear_rsi_ob': 63, 'bear_adx_thresh': 6.361709205588419, 'bear_atr_min_pct': 0.014399616188905846, 'bear_atr_max_pct': 0.14947099289205532, 'bear_tp_mult': 2.292964222069006, 'bear_tsl_mult': 0.2853921806925558, 'bear_time_stop': 205, 'bear_use_sma': False, 'bear_use_ema': False, 'bear_use_atr': True, 'bear_use_adx': True, 'bear_use_spike': False, 'bear_rsi_required': False, 'sideways_strategy': 'breakout', 'sideways_bb_std_mult': 2.1255221412058933, 'sideways_rsi_os': 23, 'sideways_rsi_ob': 57, 'sideways_adx_thresh': 10.498804594956585, 'sideways_atr_min_pct': 0.018688391581383874, 'sideways_atr_max_pct': 0.11597619200450533, 'sideways_tp_mult': 1.6662026584536482, 'sideways_tsl_mult': 0.06384500114934916, 'sideways_time_stop': 121, 'sideways_use_sma': True, 'sideways_use_ema': True, 'sideways_use_atr': False, 'sideways_use_adx': False, 'sideways_use_spike': True, 'sideways_rsi_required': True}.
[I 2025-08-30 19:22:39,461] Trial 364 finished with values: [-1000000000.0, 1000000000.0] and parameters: {'p_sma': 41, 'p_std': 25, 'p_atr': 12, 'p_adx': 29, 'rsi_period': 70, 'ema1': 7, 'ema2': 14, 'slip_atr_k': 0.02260311334956985, 'slip_spread_k': 0.3947370457182375, 'spread_hl_frac': 0.005168207060856146, 'bb_std_mult': 1.0003406296133581, 'rsi_os': 39, 'rsi_ob': 55, 'vol_spike': 0.2786787853652848, 'adx_thresh': 18.708975581486307, 'atr_min_pct': 0.005877870623957171, 'atr_max_pct': 0.13860098286327666, 'tp_mult': 2.9467621571011002, 'tsl_mult': 0.688294372468709, 'strategy': 'breakout', 'time_stop': 213, 'use_sma': False, 'use_atr': True, 'use_adx': False, 'use_ema': False, 'use_spike': True, 'rsi_required': True, 'edge_k': 0.20598788999477063, 'edge_cap': 0.976878599653366, 'bull_strategy': 'mean_reversion', 'bull_bb_std_mult': 2.8243701353174693, 'bull_rsi_os': 11, 'bull_rsi_ob': 52, 'bull_adx_thresh': 20.64702285294012, 'bull_atr_min_pct': 0.00404624352357332, 'bull_atr_max_pct': 0.053685624764685164, 'bull_tp_mult': 2.0677321182726205, 'bull_tsl_mult': 0.9851937844088628, 'bull_time_stop': 62, 'bull_use_sma': True, 'bull_use_ema': False, 'bull_use_atr': False, 'bull_use_adx': True, 'bull_use_spike': True, 'bull_rsi_required': True, 'bear_strategy': 'breakout', 'bear_bb_std_mult': 3.3752454435433625, 'bear_rsi_os': 43, 'bear_rsi_ob': 90, 'bear_adx_thresh': 27.583808025608167, 'bear_atr_min_pct': 0.006812081306397188, 'bear_atr_max_pct': 0.14962638131436903, 'bear_tp_mult': 1.7580496784111597, 'bear_tsl_mult': 0.0545144812757165, 'bear_time_stop': 249, 'bear_use_sma': True, 'bear_use_ema': False, 'bear_use_atr': True, 'bear_use_adx': True, 'bear_use_spike': False, 'bear_rsi_required': False, 'sideways_strategy': 'breakout', 'sideways_bb_std_mult': 1.2732573998767398, 'sideways_rsi_os': 20, 'sideways_rsi_ob': 60, 'sideways_adx_thresh': 8.635773879899514, 'sideways_atr_min_pct': 0.004130447271453841, 'sideways_atr_max_pct': 0.11074180458717098, 'sideways_tp_mult': 1.7613833778711372, 'sideways_tsl_mult': 0.9755851806235931, 'sideways_time_stop': 267, 'sideways_use_sma': True, 'sideways_use_ema': True, 'sideways_use_atr': False, 'sideways_use_adx': False, 'sideways_use_spike': True, 'sideways_rsi_required': False}.
[I 2025-08-30 19:23:17,983] Trial 367 finished with values: [-1000000000.0, 1000000000.0] and parameters: {'p_sma': 41, 'p_std': 50, 'p_atr': 12, 'p_adx': 20, 'rsi_period': 64, 'ema1': 26, 'ema2': 14, 'slip_atr_k': 0.08371830403666511, 'slip_spread_k': 0.39696351259134527, 'spread_hl_frac': 0.0054438934903441, 'bb_std_mult': 1.0052741208481957, 'rsi_os': 47, 'rsi_ob': 55, 'vol_spike': 0.04676563890616406, 'adx_thresh': 31.00658370240692, 'atr_min_pct': 0.015155510520094255, 'atr_max_pct': 0.028685368649503863, 'tp_mult': 2.9551956599013356, 'tsl_mult': 0.9801675004507275, 'strategy': 'breakout', 'time_stop': 45, 'use_sma': False, 'use_atr': True, 'use_adx': False, 'use_ema': False, 'use_spike': True, 'rsi_required': True, 'edge_k': 0.24568635236463182, 'edge_cap': 0.6809487079362503, 'bull_strategy': 'mean_reversion', 'bull_bb_std_mult': 3.3621489551204125, 'bull_rsi_os': 50, 'bull_rsi_ob': 56, 'bull_adx_thresh': 8.646276024267808, 'bull_atr_min_pct': 0.025265461714779468, 'bull_atr_max_pct': 0.11575192045479277, 'bull_tp_mult': 1.6556772851042263, 'bull_tsl_mult': 0.7875802635258609, 'bull_time_stop': 204, 'bull_use_sma': True, 'bull_use_ema': False, 'bull_use_atr': True, 'bull_use_adx': True, 'bull_use_spike': True, 'bull_rsi_required': True, 'bear_strategy': 'breakout', 'bear_bb_std_mult': 3.4532407804956775, 'bear_rsi_os': 45, 'bear_rsi_ob': 82, 'bear_adx_thresh': 27.466107414160525, 'bear_atr_min_pct': 0.0081538462535546, 'bear_atr_max_pct': 0.0327433025478954, 'bear_tp_mult': 2.865016390603186, 'bear_tsl_mult': 0.6111261959036753, 'bear_time_stop': 47, 'bear_use_sma': True, 'bear_use_ema': True, 'bear_use_atr': True, 'bear_use_adx': True, 'bear_use_spike': False, 'bear_rsi_required': False, 'sideways_strategy': 'mean_reversion', 'sideways_bb_std_mult': 0.8131289734217781, 'sideways_rsi_os': 6, 'sideways_rsi_ob': 70, 'sideways_adx_thresh': 8.932566638527, 'sideways_atr_min_pct': 0.019430672053161232, 'sideways_atr_max_pct': 0.12148062714063346, 'sideways_tp_mult': 1.7131284181239135, 'sideways_tsl_mult': 0.6373151085565542, 'sideways_time_stop': 300, 'sideways_use_sma': True, 'sideways_use_ema': True, 'sideways_use_atr': False, 'sideways_use_adx': False, 'sideways_use_spike': False, 'sideways_rsi_required': False}.
[I 2025-08-30 19:23:18,492] Trial 365 finished with values: [-1000000000.0, 1000000000.0] and parameters: {'p_sma': 45, 'p_std': 24, 'p_atr': 12, 'p_adx': 7, 'rsi_period': 77, 'ema1': 7, 'ema2': 14, 'slip_atr_k': 0.060125380495747505, 'slip_spread_k': 0.4816103180993895, 'spread_hl_frac': 0.0053112798597340725, 'bb_std_mult': 0.9933631329340922, 'rsi_os': 35, 'rsi_ob': 56, 'vol_spike': 0.016271009488142068, 'adx_thresh': 20.72961330443378, 'atr_min_pct': 0.01530185920606926, 'atr_max_pct': 0.14183944595986192, 'tp_mult': 2.218364943230845, 'tsl_mult': 0.7963598537563714, 'strategy': 'breakout', 'time_stop': 45, 'use_sma': False, 'use_atr': True, 'use_adx': False, 'use_ema': False, 'use_spike': True, 'rsi_required': True, 'edge_k': 0.13383926952005423, 'edge_cap': 0.5732097469610863, 'bull_strategy': 'mean_reversion', 'bull_bb_std_mult': 3.190063280547012, 'bull_rsi_os': 50, 'bull_rsi_ob': 73, 'bull_adx_thresh': 20.656533552431963, 'bull_atr_min_pct': 0.02513698602352494, 'bull_atr_max_pct': 0.08488458047167936, 'bull_tp_mult': 2.062155120562604, 'bull_tsl_mult': 0.7846005051957605, 'bull_time_stop': 62, 'bull_use_sma': True, 'bull_use_ema': False, 'bull_use_atr': True, 'bull_use_adx': True, 'bull_use_spike': True, 'bull_rsi_required': True, 'bear_strategy': 'breakout', 'bear_bb_std_mult': 3.452028236632496, 'bear_rsi_os': 43, 'bear_rsi_ob': 82, 'bear_adx_thresh': 27.810289021111416, 'bear_atr_min_pct': 0.008397081573077215, 'bear_atr_max_pct': 0.10327975063742717, 'bear_tp_mult': 1.515804252140096, 'bear_tsl_mult': 0.13155137766321406, 'bear_time_stop': 28, 'bear_use_sma': True, 'bear_use_ema': True, 'bear_use_atr': True, 'bear_use_adx': True, 'bear_use_spike': False, 'bear_rsi_required': False, 'sideways_strategy': 'breakout', 'sideways_bb_std_mult': 2.8484376397681213, 'sideways_rsi_os': 6, 'sideways_rsi_ob': 60, 'sideways_adx_thresh': 32.884630630027615, 'sideways_atr_min_pct': 0.029353355249024077, 'sideways_atr_max_pct': 0.1108384844063987, 'sideways_tp_mult': 1.8382093110206152, 'sideways_tsl_mult': 0.7416644272784957, 'sideways_time_stop': 248, 'sideways_use_sma': True, 'sideways_use_ema': True, 'sideways_use_atr': False, 'sideways_use_adx': False, 'sideways_use_spike': False, 'sideways_rsi_required': False}.
[I 2025-08-30 19:23:18,663] Trial 366 finished with values: [-1000000000.0, 1000000000.0] and parameters: {'p_sma': 45, 'p_std': 24, 'p_atr': 12, 'p_adx': 20, 'rsi_period': 31, 'ema1': 23, 'ema2': 14, 'slip_atr_k': 0.1905138600606675, 'slip_spread_k': 0.3911822848187465, 'spread_hl_frac': 0.03401317944275481, 'bb_std_mult': 0.9910448698003516, 'rsi_os': 35, 'rsi_ob': 56, 'vol_spike': 0.27791413243288177, 'adx_thresh': 18.83411593235121, 'atr_min_pct': 0.023641355465476875, 'atr_max_pct': 0.10944845556362925, 'tp_mult': 2.213038507709832, 'tsl_mult': 0.1281154910031485, 'strategy': 'breakout', 'time_stop': 10, 'use_sma': False, 'use_atr': True, 'use_adx': False, 'use_ema': False, 'use_spike': True, 'rsi_required': True, 'edge_k': 0.3801877588605681, 'edge_cap': 0.6757782426953487, 'bull_strategy': 'mean_reversion', 'bull_bb_std_mult': 2.8312335349561613, 'bull_rsi_os': 50, 'bull_rsi_ob': 73, 'bull_adx_thresh': 30.456268148445112, 'bull_atr_min_pct': 0.008459168305515833, 'bull_atr_max_pct': 0.02526915120158467, 'bull_tp_mult': 2.0621748874697716, 'bull_tsl_mult': 0.23880638962685513, 'bull_time_stop': 125, 'bull_use_sma': True, 'bull_use_ema': False, 'bull_use_atr': True, 'bull_use_adx': True, 'bull_use_spike': True, 'bull_rsi_required': True, 'bear_strategy': 'breakout', 'bear_bb_std_mult': 2.0334696687751785, 'bear_rsi_os': 43, 'bear_rsi_ob': 82, 'bear_adx_thresh': 27.476925863472093, 'bear_atr_min_pct': 0.02124456784105051, 'bear_atr_max_pct': 0.10299825592915277, 'bear_tp_mult': 2.875309916262005, 'bear_tsl_mult': 0.6001214436226951, 'bear_time_stop': 236, 'bear_use_sma': True, 'bear_use_ema': True, 'bear_use_atr': True, 'bear_use_adx': True, 'bear_use_spike': False, 'bear_rsi_required': False, 'sideways_strategy': 'breakout', 'sideways_bb_std_mult': 2.8490372054470012, 'sideways_rsi_os': 17, 'sideways_rsi_ob': 50, 'sideways_adx_thresh': 32.93984969250722, 'sideways_atr_min_pct': 0.004072029511814743, 'sideways_atr_max_pct': 0.12073606882860459, 'sideways_tp_mult': 1.7038019653574716, 'sideways_tsl_mult': 0.1423655911544487, 'sideways_time_stop': 238, 'sideways_use_sma': True, 'sideways_use_ema': True, 'sideways_use_atr': False, 'sideways_use_adx': False, 'sideways_use_spike': False, 'sideways_rsi_required': False}.
[I 2025-08-30 19:23:18,776] Trial 368 finished with values: [-1000000000.0, 1000000000.0] and parameters: {'p_sma': 41, 'p_std': 23, 'p_atr': 29, 'p_adx': 9, 'rsi_period': 32, 'ema1': 24, 'ema2': 16, 'slip_atr_k': 0.016543743912469676, 'slip_spread_k': 0.48080333577640333, 'spread_hl_frac': 0.0033428097153551774, 'bb_std_mult': 1.0406159616368256, 'rsi_os': 41, 'rsi_ob': 56, 'vol_spike': 0.01636871958959834, 'adx_thresh': 20.535290164473714, 'atr_min_pct': 0.017669653678604055, 'atr_max_pct': 0.04558627984012472, 'tp_mult': 2.28276051980722, 'tsl_mult': 0.2390761726174595, 'strategy': 'breakout', 'time_stop': 44, 'use_sma': False, 'use_atr': True, 'use_adx': False, 'use_ema': False, 'use_spike': True, 'rsi_required': True, 'edge_k': 1.5968195566663907, 'edge_cap': 0.6810300604961363, 'bull_strategy': 'breakout', 'bull_bb_std_mult': 1.1722230926190949, 'bull_rsi_os': 50, 'bull_rsi_ob': 78, 'bull_adx_thresh': 14.238251287848318, 'bull_atr_min_pct': 0.008582493256240376, 'bull_atr_max_pct': 0.03614385002124547, 'bull_tp_mult': 1.7352405325091906, 'bull_tsl_mult': 0.9399098051284942, 'bull_time_stop': 192, 'bull_use_sma': True, 'bull_use_ema': False, 'bull_use_atr': True, 'bull_use_adx': True, 'bull_use_spike': True, 'bull_rsi_required': True, 'bear_strategy': 'breakout', 'bear_bb_std_mult': 3.440540323878108, 'bear_rsi_os': 45, 'bear_rsi_ob': 58, 'bear_adx_thresh': 29.987746949511276, 'bear_atr_min_pct': 0.008315727555518406, 'bear_atr_max_pct': 0.012238351175583778, 'bear_tp_mult': 1.1524001966818167, 'bear_tsl_mult': 0.7200570365819703, 'bear_time_stop': 45, 'bear_use_sma': True, 'bear_use_ema': True, 'bear_use_atr': True, 'bear_use_adx': True, 'bear_use_spike': True, 'bear_rsi_required': False, 'sideways_strategy': 'mean_reversion', 'sideways_bb_std_mult': 2.0569092103717224, 'sideways_rsi_os': 44, 'sideways_rsi_ob': 59, 'sideways_adx_thresh': 9.649037699577747, 'sideways_atr_min_pct': 0.0065834413024113605, 'sideways_atr_max_pct': 0.07238678593851272, 'sideways_tp_mult': 1.825218647237745, 'sideways_tsl_mult': 0.6526444944271395, 'sideways_time_stop': 272, 'sideways_use_sma': True, 'sideways_use_ema': True, 'sideways_use_atr': False, 'sideways_use_adx': False, 'sideways_use_spike': False, 'sideways_rsi_required': False}.
