[I 2025-08-30 19:36:15,343] Trial 462 finished with values: [-1000000000.0, 1000000000.0] and parameters: {'p_sma': 22, 'p_std': 51, 'p_atr': 11, 'p_adx': 7, 'rsi_period': 13, 'ema1': 25, 'ema2': 19, 'slip_atr_k': 0.0203177136089095, 'slip_spread_k': 0.367824787229718, 'spread_hl_frac': 0.0035186008917896658, 'bb_std_mult': 0.8546216685508944, 'rsi_os': 33, 'rsi_ob': 56, 'vol_spike': 0.039614967337198326, 'adx_thresh': 18.626110687821473, 'atr_min_pct': 0.008425753594992879, 'atr_max_pct': 0.1330597152150514, 'tp_mult': 2.914509280847445, 'tsl_mult': 0.7907082680133293, 'strategy': 'breakout', 'time_stop': 240, 'use_sma': False, 'use_atr': True, 'use_adx': False, 'use_ema': False, 'use_spike': True, 'rsi_required': True, 'edge_k': 0.10811618896432476, 'edge_cap': 0.1908038941117228, 'bull_strategy': 'mean_reversion', 'bull_bb_std_mult': 3.3640362177524423, 'bull_rsi_os': 53, 'bull_rsi_ob': 70, 'bull_adx_thresh': 27.535274416903313, 'bull_atr_min_pct': 0.018019197776589172, 'bull_atr_max_pct': 0.0367830318195492, 'bull_tp_mult': 1.1370824037206497, 'bull_tsl_mult': 0.9820221827565173, 'bull_time_stop': 207, 'bull_use_sma': True, 'bull_use_ema': False, 'bull_use_atr': False, 'bull_use_adx': True, 'bull_use_spike': True, 'bull_rsi_required': True, 'bear_strategy': 'breakout', 'bear_bb_std_mult': 1.5018966295540088, 'bear_rsi_os': 40, 'bear_rsi_ob': 73, 'bear_adx_thresh': 12.695938666243505, 'bear_atr_min_pct': 0.014552403247206342, 'bear_atr_max_pct': 0.10727289894068576, 'bear_tp_mult': 1.7555713235999124, 'bear_tsl_mult': 0.06715414423937219, 'bear_time_stop': 43, 'bear_use_sma': True, 'bear_use_ema': False, 'bear_use_atr': True, 'bear_use_adx': True, 'bear_use_spike': False, 'bear_rsi_required': False, 'sideways_strategy': 'breakout', 'sideways_bb_std_mult': 2.036705011567367, 'sideways_rsi_os': 39, 'sideways_rsi_ob': 59, 'sideways_adx_thresh': 7.43347175081368, 'sideways_atr_min_pct': 0.01785648450939956, 'sideways_atr_max_pct': 0.1397448928381695, 'sideways_tp_mult': 1.8652851176037595, 'sideways_tsl_mult': 0.29526766219265543, 'sideways_time_stop': 259, 'sideways_use_sma': True, 'sideways_use_ema': True, 'sideways_use_atr': False, 'sideways_use_adx': False, 'sideways_use_spike': False, 'sideways_rsi_required': False}.
[I 2025-08-30 19:36:15,511] Trial 460 finished with values: [-1000000000.0, 1000000000.0] and parameters: {'p_sma': 22, 'p_std': 29, 'p_atr': 11, 'p_adx': 11, 'rsi_period': 53, 'ema1': 30, 'ema2': 20, 'slip_atr_k': 0.2114192089191681, 'slip_spread_k': 0.13028747760244963, 'spread_hl_frac': 0.0368633860364047, 'bb_std_mult': 0.8735554625684865, 'rsi_os': 38, 'rsi_ob': 56, 'vol_spike': 0.271462911975872, 'adx_thresh': 18.63979686449345, 'atr_min_pct': 0.02435886895809207, 'atr_max_pct': 0.13239239320301618, 'tp_mult': 2.2364294160774785, 'tsl_mult': 0.7586406598392733, 'strategy': 'breakout', 'time_stop': 233, 'use_sma': False, 'use_atr': True, 'use_adx': False, 'use_ema': False, 'use_spike': True, 'rsi_required': True, 'edge_k': 1.2186758891173528, 'edge_cap': 0.9948955023567083, 'bull_strategy': 'mean_reversion', 'bull_bb_std_mult': 1.81005034392883, 'bull_rsi_os': 49, 'bull_rsi_ob': 71, 'bull_adx_thresh': 24.377481146234757, 'bull_atr_min_pct': 0.012606511482048997, 'bull_atr_max_pct': 0.025846475180977786, 'bull_tp_mult': 2.0786200052354937, 'bull_tsl_mult': 0.9235632405855192, 'bull_time_stop': 16, 'bull_use_sma': True, 'bull_use_ema': False, 'bull_use_atr': False, 'bull_use_adx': True, 'bull_use_spike': True, 'bull_rsi_required': True, 'bear_strategy': 'breakout', 'bear_bb_std_mult': 1.499664146204911, 'bear_rsi_os': 46, 'bear_rsi_ob': 86, 'bear_adx_thresh': 33.9655486026806, 'bear_atr_min_pct': 0.019838010900515558, 'bear_atr_max_pct': 0.1169668996500704, 'bear_tp_mult': 1.7590161000467897, 'bear_tsl_mult': 0.3093185901226927, 'bear_time_stop': 22, 'bear_use_sma': False, 'bear_use_ema': False, 'bear_use_atr': True, 'bear_use_adx': True, 'bear_use_spike': False, 'bear_rsi_required': False, 'sideways_strategy': 'breakout', 'sideways_bb_std_mult': 3.026630139753184, 'sideways_rsi_os': 12, 'sideways_rsi_ob': 58, 'sideways_adx_thresh': 9.653723310274442, 'sideways_atr_min_pct': 0.0251999900069355, 'sideways_atr_max_pct': 0.021587188141986506, 'sideways_tp_mult': 1.7952724029085048, 'sideways_tsl_mult': 0.6665870189877643, 'sideways_time_stop': 62, 'sideways_use_sma': True, 'sideways_use_ema': True, 'sideways_use_atr': False, 'sideways_use_adx': False, 'sideways_use_spike': False, 'sideways_rsi_required': False}.
[I 2025-08-30 19:36:15,727] Trial 459 finished with values: [-1000000000.0, 1000000000.0] and parameters: {'p_sma': 22, 'p_std': 30, 'p_atr': 24, 'p_adx': 10, 'rsi_period': 53, 'ema1': 24, 'ema2': 23, 'slip_atr_k': 0.22209075191877792, 'slip_spread_k': 0.051847450173337806, 'spread_hl_frac': 0.008066484760016049, 'bb_std_mult': 1.387721667663226, 'rsi_os': 38, 'rsi_ob': 60, 'vol_spike': 0.03466242604373876, 'adx_thresh': 25.98797174010533, 'atr_min_pct': 0.0232558929961489, 'atr_max_pct': 0.13849193526149028, 'tp_mult': 2.2322583080197274, 'tsl_mult': 0.7505770205842937, 'strategy': 'breakout', 'time_stop': 200, 'use_sma': False, 'use_atr': True, 'use_adx': False, 'use_ema': False, 'use_spike': True, 'rsi_required': True, 'edge_k': 0.28510968001021453, 'edge_cap': 0.21676198150824866, 'bull_strategy': 'mean_reversion', 'bull_bb_std_mult': 1.0427078987880884, 'bull_rsi_os': 14, 'bull_rsi_ob': 74, 'bull_adx_thresh': 24.037009932766182, 'bull_atr_min_pct': 0.020224726114416475, 'bull_atr_max_pct': 0.016071015650904363, 'bull_tp_mult': 2.182136208930598, 'bull_tsl_mult': 0.9773956926950275, 'bull_time_stop': 184, 'bull_use_sma': True, 'bull_use_ema': False, 'bull_use_atr': False, 'bull_use_adx': True, 'bull_use_spike': True, 'bull_rsi_required': True, 'bear_strategy': 'breakout', 'bear_bb_std_mult': 0.6223853749661301, 'bear_rsi_os': 24, 'bear_rsi_ob': 49, 'bear_adx_thresh': 6.653125738466707, 'bear_atr_min_pct': 0.023027867411664488, 'bear_atr_max_pct': 0.08865447801198731, 'bear_tp_mult': 1.759074734616132, 'bear_tsl_mult': 0.3396855488499865, 'bear_time_stop': 43, 'bear_use_sma': False, 'bear_use_ema': False, 'bear_use_atr': True, 'bear_use_adx': True, 'bear_use_spike': False, 'bear_rsi_required': False, 'sideways_strategy': 'breakout', 'sideways_bb_std_mult': 2.5782843288129174, 'sideways_rsi_os': 21, 'sideways_rsi_ob': 59, 'sideways_adx_thresh': 29.90834274212765, 'sideways_atr_min_pct': 0.01813843073282883, 'sideways_atr_max_pct': 0.12361206560678412, 'sideways_tp_mult': 2.105140900707386, 'sideways_tsl_mult': 0.7471509176764277, 'sideways_time_stop': 209, 'sideways_use_sma': True, 'sideways_use_ema': True, 'sideways_use_atr': False, 'sideways_use_adx': False, 'sideways_use_spike': False, 'sideways_rsi_required': False}.
[I 2025-08-30 19:36:16,005] Trial 461 finished with values: [-0.01618873761551254, 0.016097562445361004] and parameters: {'p_sma': 38, 'p_std': 29, 'p_atr': 25, 'p_adx': 25, 'rsi_period': 53, 'ema1': 22, 'ema2': 22, 'slip_atr_k': 0.018399263087852186, 'slip_spread_k': 0.49839047011017445, 'spread_hl_frac': 0.004714575574512464, 'bb_std_mult': 2.832372548062285, 'rsi_os': 38, 'rsi_ob': 60, 'vol_spike': 0.2909955286540341, 'adx_thresh': 30.42976637259762, 'atr_min_pct': 0.024479020627958217, 'atr_max_pct': 0.14991244186538702, 'tp_mult': 2.1587358374019563, 'tsl_mult': 0.7802105866737667, 'strategy': 'breakout', 'time_stop': 26, 'use_sma': False, 'use_atr': True, 'use_adx': False, 'use_ema': False, 'use_spike': True, 'rsi_required': True, 'edge_k': 0.09590782130616597, 'edge_cap': 0.18421905230116703, 'bull_strategy': 'mean_reversion', 'bull_bb_std_mult': 1.4695023496507067, 'bull_rsi_os': 43, 'bull_rsi_ob': 75, 'bull_adx_thresh': 25.985962352217744, 'bull_atr_min_pct': 0.0013787667322564328, 'bull_atr_max_pct': 0.09154415771436261, 'bull_tp_mult': 1.5147219626833373, 'bull_tsl_mult': 0.9230266304228472, 'bull_time_stop': 208, 'bull_use_sma': True, 'bull_use_ema': False, 'bull_use_atr': False, 'bull_use_adx': True, 'bull_use_spike': True, 'bull_rsi_required': True, 'bear_strategy': 'breakout', 'bear_bb_std_mult': 3.2884580895350823, 'bear_rsi_os': 46, 'bear_rsi_ob': 86, 'bear_adx_thresh': 17.52119556303063, 'bear_atr_min_pct': 0.014529288344049903, 'bear_atr_max_pct': 0.10947777340926983, 'bear_tp_mult': 1.1003832903551731, 'bear_tsl_mult': 0.07179707717979333, 'bear_time_stop': 53, 'bear_use_sma': False, 'bear_use_ema': False, 'bear_use_atr': True, 'bear_use_adx': True, 'bear_use_spike': False, 'bear_rsi_required': False, 'sideways_strategy': 'breakout', 'sideways_bb_std_mult': 1.950769949625846, 'sideways_rsi_os': 16, 'sideways_rsi_ob': 59, 'sideways_adx_thresh': 9.59782448626651, 'sideways_atr_min_pct': 0.025736409477887218, 'sideways_atr_max_pct': 0.14015051859550182, 'sideways_tp_mult': 1.5295094841848105, 'sideways_tsl_mult': 0.8590591118705225, 'sideways_time_stop': 137, 'sideways_use_sma': True, 'sideways_use_ema': True, 'sideways_use_atr': False, 'sideways_use_adx': False, 'sideways_use_spike': False, 'sideways_rsi_required': False}.
[I 2025-08-30 19:36:48,783] Trial 465 finished with values: [-1000000000.0, 1000000000.0] and parameters: {'p_sma': 39, 'p_std': 28, 'p_atr': 26, 'p_adx': 30, 'rsi_period': 49, 'ema1': 28, 'ema2': 13, 'slip_atr_k': 0.1680010777976753, 'slip_spread_k': 0.49377083249456666, 'spread_hl_frac': 0.0017905213933459333, 'bb_std_mult': 2.8383740363600056, 'rsi_os': 53, 'rsi_ob': 50, 'vol_spike': 0.13270901978973307, 'adx_thresh': 17.905823725362485, 'atr_min_pct': 0.006394606700394656, 'atr_max_pct': 0.13521414344253907, 'tp_mult': 2.152171003384901, 'tsl_mult': 0.7079314440650392, 'strategy': 'breakout', 'time_stop': 28, 'use_sma': False, 'use_atr': True, 'use_adx': False, 'use_ema': False, 'use_spike': True, 'rsi_required': True, 'edge_k': 1.8033657849855054, 'edge_cap': 0.2517507932431285, 'bull_strategy': 'breakout', 'bull_bb_std_mult': 1.130232251477875, 'bull_rsi_os': 45, 'bull_rsi_ob': 72, 'bull_adx_thresh': 25.89167559617138, 'bull_atr_min_pct': 0.0013788885989407802, 'bull_atr_max_pct': 0.09091438431759888, 'bull_tp_mult': 2.153960544744345, 'bull_tsl_mult': 0.954193600906339, 'bull_time_stop': 43, 'bull_use_sma': True, 'bull_use_ema': False, 'bull_use_atr': False, 'bull_use_adx': True, 'bull_use_spike': True, 'bull_rsi_required': False, 'bear_strategy': 'breakout', 'bear_bb_std_mult': 2.1846702904427233, 'bear_rsi_os': 7, 'bear_rsi_ob': 80, 'bear_adx_thresh': 29.460758349421045, 'bear_atr_min_pct': 0.02658576884550188, 'bear_atr_max_pct': 0.1430157469308008, 'bear_tp_mult': 1.8850722988491124, 'bear_tsl_mult': 0.11020123056780573, 'bear_time_stop': 38, 'bear_use_sma': True, 'bear_use_ema': False, 'bear_use_atr': True, 'bear_use_adx': True, 'bear_use_spike': False, 'bear_rsi_required': False, 'sideways_strategy': 'breakout', 'sideways_bb_std_mult': 1.9665412506524311, 'sideways_rsi_os': 16, 'sideways_rsi_ob': 57, 'sideways_adx_thresh': 10.737253908030006, 'sideways_atr_min_pct': 0.026155122099338998, 'sideways_atr_max_pct': 0.016421209199668954, 'sideways_tp_mult': 1.823605531660721, 'sideways_tsl_mult': 0.7126882654862052, 'sideways_time_stop': 248, 'sideways_use_sma': True, 'sideways_use_ema': False, 'sideways_use_atr': False, 'sideways_use_adx': False, 'sideways_use_spike': False, 'sideways_rsi_required': False}.
[I 2025-08-30 19:36:48,813] Trial 464 finished with values: [-1000000000.0, 1000000000.0] and parameters: {'p_sma': 48, 'p_std': 32, 'p_atr': 24, 'p_adx': 17, 'rsi_period': 54, 'ema1': 28, 'ema2': 48, 'slip_atr_k': 0.234232015361668, 'slip_spread_k': 0.496968366688633, 'spread_hl_frac': 0.001621157989187202, 'bb_std_mult': 1.1770344091230176, 'rsi_os': 53, 'rsi_ob': 51, 'vol_spike': 0.2514682614764058, 'adx_thresh': 16.805868545296956, 'atr_min_pct': 0.006607350029252525, 'atr_max_pct': 0.13569478817128527, 'tp_mult': 2.1632987183139427, 'tsl_mult': 0.21746113466070577, 'strategy': 'breakout', 'time_stop': 182, 'use_sma': False, 'use_atr': True, 'use_adx': False, 'use_ema': False, 'use_spike': True, 'rsi_required': True, 'edge_k': 1.712544307996307, 'edge_cap': 0.7988344424616912, 'bull_strategy': 'breakout', 'bull_bb_std_mult': 0.8461902216115231, 'bull_rsi_os': 51, 'bull_rsi_ob': 75, 'bull_adx_thresh': 25.80551004296062, 'bull_atr_min_pct': 0.001561892710372235, 'bull_atr_max_pct': 0.01617562371836512, 'bull_tp_mult': 1.8327955908845737, 'bull_tsl_mult': 0.9801877972198713, 'bull_time_stop': 184, 'bull_use_sma': True, 'bull_use_ema': False, 'bull_use_atr': False, 'bull_use_adx': True, 'bull_use_spike': True, 'bull_rsi_required': False, 'bear_strategy': 'breakout', 'bear_bb_std_mult': 1.2325978100381447, 'bear_rsi_os': 24, 'bear_rsi_ob': 48, 'bear_adx_thresh': 5.946032892270248, 'bear_atr_min_pct': 0.0028098357994688697, 'bear_atr_max_pct': 0.025504646471592896, 'bear_tp_mult': 1.8808018558468702, 'bear_tsl_mult': 0.11205989067121859, 'bear_time_stop': 232, 'bear_use_sma': True, 'bear_use_ema': False, 'bear_use_atr': True, 'bear_use_adx': True, 'bear_use_spike': False, 'bear_rsi_required': False, 'sideways_strategy': 'breakout', 'sideways_bb_std_mult': 0.5733443534406051, 'sideways_rsi_os': 16, 'sideways_rsi_ob': 88, 'sideways_adx_thresh': 10.136837392279517, 'sideways_atr_min_pct': 0.019397727616386393, 'sideways_atr_max_pct': 0.13120469036245763, 'sideways_tp_mult': 1.6671658734712187, 'sideways_tsl_mult': 0.6518272723878571, 'sideways_time_stop': 248, 'sideways_use_sma': True, 'sideways_use_ema': False, 'sideways_use_atr': False, 'sideways_use_adx': False, 'sideways_use_spike': False, 'sideways_rsi_required': False}.
[I 2025-08-30 19:36:49,056] Trial 466 finished with values: [-1000000000.0, 1000000000.0] and parameters: {'p_sma': 26, 'p_std': 48, 'p_atr': 10, 'p_adx': 9, 'rsi_period': 54, 'ema1': 28, 'ema2': 17, 'slip_atr_k': 0.013666696776911225, 'slip_spread_k': 0.5020094529492606, 'spread_hl_frac': 0.016558086129948794, 'bb_std_mult': 2.853566742696568, 'rsi_os': 36, 'rsi_ob': 74, 'vol_spike': 0.061958862243277554, 'adx_thresh': 12.344207831009584, 'atr_min_pct': 0.024265793946785942, 'atr_max_pct': 0.14537258691498564, 'tp_mult': 2.9982174998221485, 'tsl_mult': 0.40347977018106607, 'strategy': 'breakout', 'time_stop': 54, 'use_sma': False, 'use_atr': True, 'use_adx': False, 'use_ema': False, 'use_spike': True, 'rsi_required': True, 'edge_k': 0.08509323765899635, 'edge_cap': 0.25660194790058877, 'bull_strategy': 'breakout', 'bull_bb_std_mult': 0.9327552757516255, 'bull_rsi_os': 45, 'bull_rsi_ob': 68, 'bull_adx_thresh': 26.06548313076089, 'bull_atr_min_pct': 0.011311440031882268, 'bull_atr_max_pct': 0.09610319746850561, 'bull_tp_mult': 2.288983984038788, 'bull_tsl_mult': 0.9991560612267799, 'bull_time_stop': 184, 'bull_use_sma': True, 'bull_use_ema': False, 'bull_use_atr': False, 'bull_use_adx': True, 'bull_use_spike': True, 'bull_rsi_required': False, 'bear_strategy': 'breakout', 'bear_bb_std_mult': 3.295991786649853, 'bear_rsi_os': 7, 'bear_rsi_ob': 84, 'bear_adx_thresh': 5.9066992016437085, 'bear_atr_min_pct': 0.00410106052459481, 'bear_atr_max_pct': 0.1318142968802653, 'bear_tp_mult': 1.8656672460161632, 'bear_tsl_mult': 0.7262251924146886, 'bear_time_stop': 236, 'bear_use_sma': True, 'bear_use_ema': False, 'bear_use_atr': True, 'bear_use_adx': True, 'bear_use_spike': False, 'bear_rsi_required': False, 'sideways_strategy': 'breakout', 'sideways_bb_std_mult': 1.9405477063787324, 'sideways_rsi_os': 16, 'sideways_rsi_ob': 88, 'sideways_adx_thresh': 10.742323463890177, 'sideways_atr_min_pct': 0.0069857393390938705, 'sideways_atr_max_pct': 0.10679105518921908, 'sideways_tp_mult': 1.5371423102301478, 'sideways_tsl_mult': 0.8889246763705065, 'sideways_time_stop': 283, 'sideways_use_sma': True, 'sideways_use_ema': False, 'sideways_use_atr': False, 'sideways_use_adx': False, 'sideways_use_spike': False, 'sideways_rsi_required': False}.
[I 2025-08-30 19:36:49,137] Trial 463 finished with values: [-1000000000.0, 1000000000.0] and parameters: {'p_sma': 48, 'p_std': 36, 'p_atr': 21, 'p_adx': 17, 'rsi_period': 54, 'ema1': 28, 'ema2': 39, 'slip_atr_k': 0.2351345835938659, 'slip_spread_k': 0.5051774198269452, 'spread_hl_frac': 0.004718297816784454, 'bb_std_mult': 1.7442623684111043, 'rsi_os': 34, 'rsi_ob': 50, 'vol_spike': 0.1308946247846065, 'adx_thresh': 23.061983429495847, 'atr_min_pct': 0.025254661451975514, 'atr_max_pct': 0.14837440653739803, 'tp_mult': 2.1705475027516363, 'tsl_mult': 0.24208494832013433, 'strategy': 'breakout', 'time_stop': 13, 'use_sma': False, 'use_atr': True, 'use_adx': False, 'use_ema': False, 'use_spike': True, 'rsi_required': True, 'edge_k': 0.8891639760687021, 'edge_cap': 0.8102687104211712, 'bull_strategy': 'breakout', 'bull_bb_std_mult': 2.2224368703109927, 'bull_rsi_os': 51, 'bull_rsi_ob': 75, 'bull_adx_thresh': 19.292038701548098, 'bull_atr_min_pct': 0.024203761014955742, 'bull_atr_max_pct': 0.07808479902617517, 'bull_tp_mult': 2.1791583927803004, 'bull_tsl_mult': 0.9815938646468471, 'bull_time_stop': 183, 'bull_use_sma': True, 'bull_use_ema': False, 'bull_use_atr': False, 'bull_use_adx': True, 'bull_use_spike': True, 'bull_rsi_required': False, 'bear_strategy': 'breakout', 'bear_bb_std_mult': 2.654490477370093, 'bear_rsi_os': 31, 'bear_rsi_ob': 49, 'bear_adx_thresh': 5.942340472612228, 'bear_atr_min_pct': 0.014943668807748374, 'bear_atr_max_pct': 0.09590681294755718, 'bear_tp_mult': 1.3060072687963733, 'bear_tsl_mult': 0.7280763475383331, 'bear_time_stop': 42, 'bear_use_sma': True, 'bear_use_ema': False, 'bear_use_atr': True, 'bear_use_adx': True, 'bear_use_spike': False, 'bear_rsi_required': False, 'sideways_strategy': 'breakout', 'sideways_bb_std_mult': 1.9508961171270298, 'sideways_rsi_os': 16, 'sideways_rsi_ob': 59, 'sideways_adx_thresh': 10.607923158865052, 'sideways_atr_min_pct': 0.019317420105833257, 'sideways_atr_max_pct': 0.1155907182575546, 'sideways_tp_mult': 2.105244813616254, 'sideways_tsl_mult': 0.12553910798036982, 'sideways_time_stop': 152, 'sideways_use_sma': True, 'sideways_use_ema': False, 'sideways_use_atr': False, 'sideways_use_adx': False, 'sideways_use_spike': False, 'sideways_rsi_required': False}.
[I 2025-08-30 19:37:25,087] Trial 470 finished with values: [-1000000000.0, 1000000000.0] and parameters: {'p_sma': 41, 'p_std': 24, 'p_atr': 15, 'p_adx': 18, 'rsi_period': 68, 'ema1': 23, 'ema2': 56, 'slip_atr_k': 0.15256897649166984, 'slip_spread_k': 0.7103365795526004, 'spread_hl_frac': 0.041047906642413645, 'bb_std_mult': 1.1038310808920746, 'rsi_os': 29, 'rsi_ob': 93, 'vol_spike': 0.15616770108561737, 'adx_thresh': 19.70165191783393, 'atr_min_pct': 0.029129915586814267, 'atr_max_pct': 0.1422978289627498, 'tp_mult': 1.3765923131617708, 'tsl_mult': 0.05672294051765281, 'strategy': 'mean_reversion', 'time_stop': 32, 'use_sma': False, 'use_atr': False, 'use_adx': False, 'use_ema': False, 'use_spike': True, 'rsi_required': False, 'edge_k': 1.9534832942422138, 'edge_cap': 0.9088213158716307, 'bull_strategy': 'mean_reversion', 'bull_bb_std_mult': 1.447985553250216, 'bull_rsi_os': 43, 'bull_rsi_ob': 50, 'bull_adx_thresh': 24.963238134204655, 'bull_atr_min_pct': 0.025825540706138805, 'bull_atr_max_pct': 0.023262419726337243, 'bull_tp_mult': 2.1138789279571712, 'bull_tsl_mult': 0.9568379730967597, 'bull_time_stop': 192, 'bull_use_sma': True, 'bull_use_ema': False, 'bull_use_atr': False, 'bull_use_adx': False, 'bull_use_spike': False, 'bull_rsi_required': True, 'bear_strategy': 'mean_reversion', 'bear_bb_std_mult': 3.008946472315431, 'bear_rsi_os': 48, 'bear_rsi_ob': 56, 'bear_adx_thresh': 5.075588080730461, 'bear_atr_min_pct': 0.01653200978780582, 'bear_atr_max_pct': 0.05730058841591403, 'bear_tp_mult': 1.7116338308438372, 'bear_tsl_mult': 0.13626677030501605, 'bear_time_stop': 260, 'bear_use_sma': True, 'bear_use_ema': False, 'bear_use_atr': True, 'bear_use_adx': True, 'bear_use_spike': True, 'bear_rsi_required': True, 'sideways_strategy': 'breakout', 'sideways_bb_std_mult': 2.2126717151288826, 'sideways_rsi_os': 10, 'sideways_rsi_ob': 58, 'sideways_adx_thresh': 9.090972303757125, 'sideways_atr_min_pct': 0.020096885148683775, 'sideways_atr_max_pct': 0.11267710361051966, 'sideways_tp_mult': 2.2429967370610835, 'sideways_tsl_mult': 0.265771518738074, 'sideways_time_stop': 275, 'sideways_use_sma': False, 'sideways_use_ema': True, 'sideways_use_atr': True, 'sideways_use_adx': False, 'sideways_use_spike': False, 'sideways_rsi_required': True}.
