[I 2025-08-30 19:27:25,830] Trial 396 finished with values: [-0.04462560659297854, 0.04454690289561902] and parameters: {'p_sma': 53, 'p_std': 13, 'p_atr': 10, 'p_adx': 16, 'rsi_period': 53, 'ema1': 12, 'ema2': 18, 'slip_atr_k': 0.1620334227201863, 'slip_spread_k': 0.3679453944066874, 'spread_hl_frac': 0.00841366221900158, 'bb_std_mult': 1.254185234705223, 'rsi_os': 51, 'rsi_ob': 59, 'vol_spike': 0.02362354485037857, 'adx_thresh': 19.10447383478028, 'atr_min_pct': 0.025289758428148297, 'atr_max_pct': 0.13694188614321104, 'tp_mult': 1.6346270256883408, 'tsl_mult': 0.7840565467917473, 'strategy': 'breakout', 'time_stop': 26, 'use_sma': True, 'use_atr': False, 'use_adx': True, 'use_ema': True, 'use_spike': True, 'rsi_required': False, 'edge_k': 0.0979202733221172, 'edge_cap': 0.761120800599384, 'bull_strategy': 'mean_reversion', 'bull_bb_std_mult': 1.8852913838081953, 'bull_rsi_os': 30, 'bull_rsi_ob': 81, 'bull_adx_thresh': 9.367909757257532, 'bull_atr_min_pct': 0.0016525073547403687, 'bull_atr_max_pct': 0.14564832845728792, 'bull_tp_mult': 1.054996921843848, 'bull_tsl_mult': 0.6138080434618154, 'bull_time_stop': 202, 'bull_use_sma': True, 'bull_use_ema': False, 'bull_use_atr': False, 'bull_use_adx': False, 'bull_use_spike': False, 'bull_rsi_required': False, 'bear_strategy': 'breakout', 'bear_bb_std_mult': 3.155812173129211, 'bear_rsi_os': 41, 'bear_rsi_ob': 86, 'bear_adx_thresh': 5.656461854352885, 'bear_atr_min_pct': 0.029093190326173354, 'bear_atr_max_pct': 0.05361048036325318, 'bear_tp_mult': 2.4669877453126348, 'bear_tsl_mult': 0.7404905799132429, 'bear_time_stop': 259, 'bear_use_sma': True, 'bear_use_ema': False, 'bear_use_atr': True, 'bear_use_adx': True, 'bear_use_spike': False, 'bear_rsi_required': False, 'sideways_strategy': 'mean_reversion', 'sideways_bb_std_mult': 2.260354315304974, 'sideways_rsi_os': 16, 'sideways_rsi_ob': 60, 'sideways_adx_thresh': 23.637705598904304, 'sideways_atr_min_pct': 0.01918259689322265, 'sideways_atr_max_pct': 0.12378186989466364, 'sideways_tp_mult': 2.654124125897905, 'sideways_tsl_mult': 0.8746745729263916, 'sideways_time_stop': 275, 'sideways_use_sma': True, 'sideways_use_ema': True, 'sideways_use_atr': False, 'sideways_use_adx': False, 'sideways_use_spike': False, 'sideways_rsi_required': True}.
[I 2025-08-30 19:27:26,050] Trial 397 finished with values: [-1000000000.0, 1000000000.0] and parameters: {'p_sma': 53, 'p_std': 55, 'p_atr': 10, 'p_adx': 9, 'rsi_period': 53, 'ema1': 24, 'ema2': 55, 'slip_atr_k': 0.05003113141905896, 'slip_spread_k': 0.1531134845580821, 'spread_hl_frac': 0.023229520900533276, 'bb_std_mult': 0.9541267742452131, 'rsi_os': 39, 'rsi_ob': 55, 'vol_spike': 0.15926178080629483, 'adx_thresh': 19.069172045090824, 'atr_min_pct': 0.02502495302546747, 'atr_max_pct': 0.13697401016814204, 'tp_mult': 2.186969801347133, 'tsl_mult': 0.7203096532661422, 'strategy': 'breakout', 'time_stop': 168, 'use_sma': False, 'use_atr': False, 'use_adx': True, 'use_ema': True, 'use_spike': True, 'rsi_required': True, 'edge_k': 0.11195011038112096, 'edge_cap': 0.4313161169630486, 'bull_strategy': 'mean_reversion', 'bull_bb_std_mult': 1.888258226518725, 'bull_rsi_os': 53, 'bull_rsi_ob': 53, 'bull_adx_thresh': 31.214411821912627, 'bull_atr_min_pct': 0.016380897462155396, 'bull_atr_max_pct': 0.02673463607822924, 'bull_tp_mult': 1.5843072503669533, 'bull_tsl_mult': 0.9195788824463101, 'bull_time_stop': 203, 'bull_use_sma': True, 'bull_use_ema': False, 'bull_use_atr': False, 'bull_use_adx': False, 'bull_use_spike': False, 'bull_rsi_required': True, 'bear_strategy': 'breakout', 'bear_bb_std_mult': 3.157976689311555, 'bear_rsi_os': 41, 'bear_rsi_ob': 85, 'bear_adx_thresh': 5.599080411882503, 'bear_atr_min_pct': 0.015146397753240894, 'bear_atr_max_pct': 0.0186859951721164, 'bear_tp_mult': 1.7362350103854063, 'bear_tsl_mult': 0.11675946452312054, 'bear_time_stop': 175, 'bear_use_sma': True, 'bear_use_ema': False, 'bear_use_atr': False, 'bear_use_adx': False, 'bear_use_spike': False, 'bear_rsi_required': False, 'sideways_strategy': 'mean_reversion', 'sideways_bb_std_mult': 2.248836874079765, 'sideways_rsi_os': 36, 'sideways_rsi_ob': 52, 'sideways_adx_thresh': 22.458723505669347, 'sideways_atr_min_pct': 0.022206601360034574, 'sideways_atr_max_pct': 0.1345730794183581, 'sideways_tp_mult': 1.6304613670394075, 'sideways_tsl_mult': 0.9064996603874221, 'sideways_time_stop': 269, 'sideways_use_sma': True, 'sideways_use_ema': True, 'sideways_use_atr': False, 'sideways_use_adx': False, 'sideways_use_spike': True, 'sideways_rsi_required': True}.
[I 2025-08-30 19:27:59,578] Trial 398 finished with values: [-0.03469962784208014, 0.03460398617610514] and parameters: {'p_sma': 53, 'p_std': 28, 'p_atr': 11, 'p_adx': 22, 'rsi_period': 79, 'ema1': 24, 'ema2': 55, 'slip_atr_k': 0.23101486697016177, 'slip_spread_k': 0.3208617648169417, 'spread_hl_frac': 0.012717628642255412, 'bb_std_mult': 1.294468085010826, 'rsi_os': 48, 'rsi_ob': 65, 'vol_spike': 0.020566522342436114, 'adx_thresh': 26.428659972850614, 'atr_min_pct': 0.025077258471600233, 'atr_max_pct': 0.13635151397444215, 'tp_mult': 1.2549246100982119, 'tsl_mult': 0.7860208816962154, 'strategy': 'breakout', 'time_stop': 269, 'use_sma': False, 'use_atr': False, 'use_adx': True, 'use_ema': True, 'use_spike': True, 'rsi_required': True, 'edge_k': 1.387453032820645, 'edge_cap': 0.12459000324049102, 'bull_strategy': 'mean_reversion', 'bull_bb_std_mult': 1.872530461771638, 'bull_rsi_os': 55, 'bull_rsi_ob': 83, 'bull_adx_thresh': 16.50811188516517, 'bull_atr_min_pct': 0.0019149974412225044, 'bull_atr_max_pct': 0.02649665771401163, 'bull_tp_mult': 2.7341449414551557, 'bull_tsl_mult': 0.9100506579835239, 'bull_time_stop': 199, 'bull_use_sma': True, 'bull_use_ema': False, 'bull_use_atr': False, 'bull_use_adx': False, 'bull_use_spike': False, 'bull_rsi_required': True, 'bear_strategy': 'breakout', 'bear_bb_std_mult': 1.1421873066617585, 'bear_rsi_os': 41, 'bear_rsi_ob': 60, 'bear_adx_thresh': 33.62148263851834, 'bear_atr_min_pct': 0.0290968388190947, 'bear_atr_max_pct': 0.06366741784428472, 'bear_tp_mult': 1.7392061509842993, 'bear_tsl_mult': 0.7993390436764193, 'bear_time_stop': 177, 'bear_use_sma': True, 'bear_use_ema': False, 'bear_use_atr': False, 'bear_use_adx': False, 'bear_use_spike': False, 'bear_rsi_required': False, 'sideways_strategy': 'mean_reversion', 'sideways_bb_std_mult': 2.2664138034166927, 'sideways_rsi_os': 37, 'sideways_rsi_ob': 59, 'sideways_adx_thresh': 11.948006206078096, 'sideways_atr_min_pct': 0.01924744224282471, 'sideways_atr_max_pct': 0.12386451447292003, 'sideways_tp_mult': 1.869406710400083, 'sideways_tsl_mult': 0.6722392818266348, 'sideways_time_stop': 127, 'sideways_use_sma': True, 'sideways_use_ema': True, 'sideways_use_atr': False, 'sideways_use_adx': False, 'sideways_use_spike': False, 'sideways_rsi_required': True}.
[I 2025-08-30 19:28:01,287] Trial 401 finished with values: [-1000000000.0, 1000000000.0] and parameters: {'p_sma': 44, 'p_std': 28, 'p_atr': 11, 'p_adx': 7, 'rsi_period': 79, 'ema1': 24, 'ema2': 16, 'slip_atr_k': 0.029712859544581693, 'slip_spread_k': 0.30831915874054266, 'spread_hl_frac': 0.003946660525421338, 'bb_std_mult': 1.6510727792115587, 'rsi_os': 48, 'rsi_ob': 65, 'vol_spike': 0.12746942996515684, 'adx_thresh': 27.439607925583285, 'atr_min_pct': 0.022591958399500355, 'atr_max_pct': 0.03720177975329558, 'tp_mult': 1.2571111078737087, 'tsl_mult': 0.20490315499802852, 'strategy': 'breakout', 'time_stop': 270, 'use_sma': False, 'use_atr': True, 'use_adx': False, 'use_ema': False, 'use_spike': True, 'rsi_required': True, 'edge_k': 0.5117404942028605, 'edge_cap': 0.221220716856607, 'bull_strategy': 'mean_reversion', 'bull_bb_std_mult': 2.6343654483716517, 'bull_rsi_os': 52, 'bull_rsi_ob': 58, 'bull_adx_thresh': 6.399319047049559, 'bull_atr_min_pct': 0.013467820333893654, 'bull_atr_max_pct': 0.07543038486437537, 'bull_tp_mult': 2.3820031977899516, 'bull_tsl_mult': 0.4462836362584268, 'bull_time_stop': 189, 'bull_use_sma': False, 'bull_use_ema': True, 'bull_use_atr': True, 'bull_use_adx': True, 'bull_use_spike': True, 'bull_rsi_required': True, 'bear_strategy': 'mean_reversion', 'bear_bb_std_mult': 3.3969548181609124, 'bear_rsi_os': 43, 'bear_rsi_ob': 66, 'bear_adx_thresh': 32.47831676786464, 'bear_atr_min_pct': 0.015325878626658119, 'bear_atr_max_pct': 0.13626534710594007, 'bear_tp_mult': 1.7418135875113414, 'bear_tsl_mult': 0.43098957615592903, 'bear_time_stop': 48, 'bear_use_sma': True, 'bear_use_ema': True, 'bear_use_atr': True, 'bear_use_adx': True, 'bear_use_spike': False, 'bear_rsi_required': False, 'sideways_strategy': 'breakout', 'sideways_bb_std_mult': 2.4586222748031266, 'sideways_rsi_os': 19, 'sideways_rsi_ob': 85, 'sideways_adx_thresh': 9.117692400112473, 'sideways_atr_min_pct': 0.008969177069315323, 'sideways_atr_max_pct': 0.0842956324367812, 'sideways_tp_mult': 1.8651970202803545, 'sideways_tsl_mult': 0.6193228763802585, 'sideways_time_stop': 29, 'sideways_use_sma': False, 'sideways_use_ema': True, 'sideways_use_atr': False, 'sideways_use_adx': True, 'sideways_use_spike': False, 'sideways_rsi_required': False}.
[I 2025-08-30 19:28:01,487] Trial 399 finished with values: [-1000000000.0, 1000000000.0] and parameters: {'p_sma': 47, 'p_std': 12, 'p_atr': 11, 'p_adx': 16, 'rsi_period': 52, 'ema1': 24, 'ema2': 16, 'slip_atr_k': 0.1425940299222705, 'slip_spread_k': 0.3092655639453509, 'spread_hl_frac': 0.0038166069102914956, 'bb_std_mult': 0.9832147780714752, 'rsi_os': 38, 'rsi_ob': 59, 'vol_spike': 0.04260228762196233, 'adx_thresh': 19.36951711860704, 'atr_min_pct': 0.025002428176581513, 'atr_max_pct': 0.03314128781071246, 'tp_mult': 2.1809274116123656, 'tsl_mult': 0.7200859196244165, 'strategy': 'breakout', 'time_stop': 26, 'use_sma': False, 'use_atr': False, 'use_adx': True, 'use_ema': False, 'use_spike': True, 'rsi_required': True, 'edge_k': 0.3520421678754977, 'edge_cap': 0.6252878260805701, 'bull_strategy': 'mean_reversion', 'bull_bb_std_mult': 1.5218172747402217, 'bull_rsi_os': 53, 'bull_rsi_ob': 57, 'bull_adx_thresh': 30.945105769871972, 'bull_atr_min_pct': 0.013451939304498717, 'bull_atr_max_pct': 0.10057602098420337, 'bull_tp_mult': 2.2164752175377473, 'bull_tsl_mult': 0.4615043944698196, 'bull_time_stop': 204, 'bull_use_sma': True, 'bull_use_ema': False, 'bull_use_atr': False, 'bull_use_adx': False, 'bull_use_spike': False, 'bull_rsi_required': True, 'bear_strategy': 'breakout', 'bear_bb_std_mult': 3.153284884680563, 'bear_rsi_os': 43, 'bear_rsi_ob': 50, 'bear_adx_thresh': 6.202817834345962, 'bear_atr_min_pct': 0.015229446029338203, 'bear_atr_max_pct': 0.1342803330569179, 'bear_tp_mult': 1.7398525747435458, 'bear_tsl_mult': 0.6373693779379934, 'bear_time_stop': 228, 'bear_use_sma': True, 'bear_use_ema': False, 'bear_use_atr': False, 'bear_use_adx': False, 'bear_use_spike': False, 'bear_rsi_required': False, 'sideways_strategy': 'mean_reversion', 'sideways_bb_std_mult': 2.4134557888031845, 'sideways_rsi_os': 19, 'sideways_rsi_ob': 85, 'sideways_adx_thresh': 12.081768686294774, 'sideways_atr_min_pct': 0.019151810282962277, 'sideways_atr_max_pct': 0.10541067122433807, 'sideways_tp_mult': 1.8649517773417983, 'sideways_tsl_mult': 0.666723582772536, 'sideways_time_stop': 268, 'sideways_use_sma': True, 'sideways_use_ema': True, 'sideways_use_atr': False, 'sideways_use_adx': False, 'sideways_use_spike': True, 'sideways_rsi_required': True}.
[I 2025-08-30 19:28:01,622] Trial 400 finished with values: [-0.02086978356316216, 0.02083807462404211] and parameters: {'p_sma': 44, 'p_std': 29, 'p_atr': 27, 'p_adx': 23, 'rsi_period': 50, 'ema1': 24, 'ema2': 59, 'slip_atr_k': 0.008516040474612479, 'slip_spread_k': 0.28957849221424803, 'spread_hl_frac': 0.026732107779358652, 'bb_std_mult': 0.9661022537059141, 'rsi_os': 38, 'rsi_ob': 65, 'vol_spike': 0.041214607771915386, 'adx_thresh': 32.972447456462824, 'atr_min_pct': 0.025047318029192318, 'atr_max_pct': 0.13599576654566106, 'tp_mult': 2.8751929734026986, 'tsl_mult': 0.7171653773884021, 'strategy': 'breakout', 'time_stop': 43, 'use_sma': False, 'use_atr': False, 'use_adx': True, 'use_ema': False, 'use_spike': True, 'rsi_required': True, 'edge_k': 0.5105973344199759, 'edge_cap': 0.6150067420058992, 'bull_strategy': 'mean_reversion', 'bull_bb_std_mult': 1.5156387347915217, 'bull_rsi_os': 53, 'bull_rsi_ob': 73, 'bull_adx_thresh': 27.940097697599516, 'bull_atr_min_pct': 0.0005371052773347346, 'bull_atr_max_pct': 0.026646152946426076, 'bull_tp_mult': 2.22372607075339, 'bull_tsl_mult': 0.902436991516183, 'bull_time_stop': 190, 'bull_use_sma': True, 'bull_use_ema': False, 'bull_use_atr': False, 'bull_use_adx': True, 'bull_use_spike': True, 'bull_rsi_required': True, 'bear_strategy': 'breakout', 'bear_bb_std_mult': 3.4197760748694113, 'bear_rsi_os': 43, 'bear_rsi_ob': 50, 'bear_adx_thresh': 33.04260140266881, 'bear_atr_min_pct': 0.014941647901251357, 'bear_atr_max_pct': 0.05591834892666972, 'bear_tp_mult': 1.730129655975438, 'bear_tsl_mult': 0.42582233968780203, 'bear_time_stop': 158, 'bear_use_sma': True, 'bear_use_ema': False, 'bear_use_atr': False, 'bear_use_adx': False, 'bear_use_spike': False, 'bear_rsi_required': False, 'sideways_strategy': 'breakout', 'sideways_bb_std_mult': 2.094271555807245, 'sideways_rsi_os': 30, 'sideways_rsi_ob': 56, 'sideways_adx_thresh': 11.961215779146151, 'sideways_atr_min_pct': 0.009523407971102323, 'sideways_atr_max_pct': 0.11723477014485457, 'sideways_tp_mult': 1.8557233881222415, 'sideways_tsl_mult': 0.6690195074695552, 'sideways_time_stop': 269, 'sideways_use_sma': True, 'sideways_use_ema': True, 'sideways_use_atr': False, 'sideways_use_adx': False, 'sideways_use_spike': True, 'sideways_rsi_required': True}.
[I 2025-08-30 19:28:34,696] Trial 402 finished with values: [-1000000000.0, 1000000000.0] and parameters: {'p_sma': 41, 'p_std': 29, 'p_atr': 9, 'p_adx': 7, 'rsi_period': 50, 'ema1': 24, 'ema2': 15, 'slip_atr_k': 0.02812869507912673, 'slip_spread_k': 0.5339692038422195, 'spread_hl_frac': 0.003822119356136847, 'bb_std_mult': 1.0125536871431826, 'rsi_os': 32, 'rsi_ob': 57, 'vol_spike': 0.04164395503339698, 'adx_thresh': 6.901409452521765, 'atr_min_pct': 0.027421847431792528, 'atr_max_pct': 0.1443633004735823, 'tp_mult': 2.8896521619037423, 'tsl_mult': 0.5046528619898448, 'strategy': 'breakout', 'time_stop': 48, 'use_sma': False, 'use_atr': True, 'use_adx': False, 'use_ema': False, 'use_spike': True, 'rsi_required': True, 'edge_k': 0.4200717394508655, 'edge_cap': 0.8960999301721548, 'bull_strategy': 'mean_reversion', 'bull_bb_std_mult': 1.6310406999651008, 'bull_rsi_os': 47, 'bull_rsi_ob': 73, 'bull_adx_thresh': 19.686425988490335, 'bull_atr_min_pct': 0.0005698386274834927, 'bull_atr_max_pct': 0.10021870178461137, 'bull_tp_mult': 2.2359330492949954, 'bull_tsl_mult': 0.9505883074545919, 'bull_time_stop': 31, 'bull_use_sma': False, 'bull_use_ema': True, 'bull_use_atr': True, 'bull_use_adx': True, 'bull_use_spike': True, 'bull_rsi_required': True, 'bear_strategy': 'mean_reversion', 'bear_bb_std_mult': 3.1992287729001485, 'bear_rsi_os': 44, 'bear_rsi_ob': 80, 'bear_adx_thresh': 5.008175403115577, 'bear_atr_min_pct': 0.015336386592048844, 'bear_atr_max_pct': 0.05538390458792853, 'bear_tp_mult': 2.8259159869642483, 'bear_tsl_mult': 0.837309570592104, 'bear_time_stop': 187, 'bear_use_sma': True, 'bear_use_ema': True, 'bear_use_atr': True, 'bear_use_adx': True, 'bear_use_spike': False, 'bear_rsi_required': True, 'sideways_strategy': 'breakout', 'sideways_bb_std_mult': 2.4437467035992206, 'sideways_rsi_os': 19, 'sideways_rsi_ob': 57, 'sideways_adx_thresh': 7.09583657049752, 'sideways_atr_min_pct': 0.02036420647486326, 'sideways_atr_max_pct': 0.04648999181542245, 'sideways_tp_mult': 1.5900151120593766, 'sideways_tsl_mult': 0.6221097549746409, 'sideways_time_stop': 264, 'sideways_use_sma': False, 'sideways_use_ema': True, 'sideways_use_atr': False, 'sideways_use_adx': True, 'sideways_use_spike': False, 'sideways_rsi_required': False}.
[I 2025-08-30 19:28:35,719] Trial 403 finished with values: [-1000000000.0, 1000000000.0] and parameters: {'p_sma': 41, 'p_std': 10, 'p_atr': 9, 'p_adx': 8, 'rsi_period': 51, 'ema1': 29, 'ema2': 18, 'slip_atr_k': 0.13953449645753785, 'slip_spread_k': 0.2832166310165214, 'spread_hl_frac': 0.0018808819650949762, 'bb_std_mult': 1.0353926946102763, 'rsi_os': 36, 'rsi_ob': 58, 'vol_spike': 0.04185891821859753, 'adx_thresh': 18.13659773892767, 'atr_min_pct': 0.01878937944099671, 'atr_max_pct': 0.1444428107606687, 'tp_mult': 2.0233750175956073, 'tsl_mult': 0.6970907774313785, 'strategy': 'breakout', 'time_stop': 279, 'use_sma': False, 'use_atr': True, 'use_adx': False, 'use_ema': False, 'use_spike': True, 'rsi_required': True, 'edge_k': 1.7531691950102304, 'edge_cap': 0.24276067210143273, 'bull_strategy': 'mean_reversion', 'bull_bb_std_mult': 0.8667303439681386, 'bull_rsi_os': 47, 'bull_rsi_ob': 73, 'bull_adx_thresh': 27.813766920112315, 'bull_atr_min_pct': 0.010738874850722849, 'bull_atr_max_pct': 0.08011971667955427, 'bull_tp_mult': 2.2159178250961142, 'bull_tsl_mult': 0.9560464938413638, 'bull_time_stop': 176, 'bull_use_sma': True, 'bull_use_ema': False, 'bull_use_atr': False, 'bull_use_adx': True, 'bull_use_spike': True, 'bull_rsi_required': True, 'bear_strategy': 'breakout', 'bear_bb_std_mult': 2.7678225571426656, 'bear_rsi_os': 44, 'bear_rsi_ob': 80, 'bear_adx_thresh': 21.631923265462866, 'bear_atr_min_pct': 0.014862494861969147, 'bear_atr_max_pct': 0.08610956117639859, 'bear_tp_mult': 1.8086362624141386, 'bear_tsl_mult': 0.024848418166055014, 'bear_time_stop': 32, 'bear_use_sma': False, 'bear_use_ema': False, 'bear_use_atr': True, 'bear_use_adx': True, 'bear_use_spike': False, 'bear_rsi_required': True, 'sideways_strategy': 'breakout', 'sideways_bb_std_mult': 1.3522972044874164, 'sideways_rsi_os': 41, 'sideways_rsi_ob': 56, 'sideways_adx_thresh': 8.36833527653075, 'sideways_atr_min_pct': 0.020428515629781683, 'sideways_atr_max_pct': 0.039635884413073356, 'sideways_tp_mult': 1.7559280921113898, 'sideways_tsl_mult': 0.6816675835270681, 'sideways_time_stop': 255, 'sideways_use_sma': True, 'sideways_use_ema': True, 'sideways_use_atr': False, 'sideways_use_adx': False, 'sideways_use_spike': True, 'sideways_rsi_required': False}.
[I 2025-08-30 19:28:35,883] Trial 404 finished with values: [-1000000000.0, 1000000000.0] and parameters: {'p_sma': 41, 'p_std': 26, 'p_atr': 9, 'p_adx': 30, 'rsi_period': 50, 'ema1': 25, 'ema2': 17, 'slip_atr_k': 0.008666879861423983, 'slip_spread_k': 0.5196079851394924, 'spread_hl_frac': 0.0018238550845489036, 'bb_std_mult': 0.6962106366510868, 'rsi_os': 22, 'rsi_ob': 57, 'vol_spike': 0.25093900122010476, 'adx_thresh': 21.438981333589172, 'atr_min_pct': 0.010139329319599419, 'atr_max_pct': 0.06811330047653655, 'tp_mult': 2.8664403127382454, 'tsl_mult': 0.30260105746644594, 'strategy': 'breakout', 'time_stop': 47, 'use_sma': True, 'use_atr': True, 'use_adx': False, 'use_ema': False, 'use_spike': True, 'rsi_required': False, 'edge_k': 0.42289506381873765, 'edge_cap': 0.19673767904992556, 'bull_strategy': 'breakout', 'bull_bb_std_mult': 2.4307117521443895, 'bull_rsi_os': 47, 'bull_rsi_ob': 72, 'bull_adx_thresh': 34.28136123495875, 'bull_atr_min_pct': 0.0007861768281867338, 'bull_atr_max_pct': 0.022366254355199688, 'bull_tp_mult': 2.853126716958361, 'bull_tsl_mult': 0.9514806797626273, 'bull_time_stop': 177, 'bull_use_sma': True, 'bull_use_ema': False, 'bull_use_atr': False, 'bull_use_adx': True, 'bull_use_spike': True, 'bull_rsi_required': False, 'bear_strategy': 'breakout', 'bear_bb_std_mult': 1.5660574973129424, 'bear_rsi_os': 22, 'bear_rsi_ob': 71, 'bear_adx_thresh': 16.690333428491186, 'bear_atr_min_pct': 0.014856492951072496, 'bear_atr_max_pct': 0.08099014937472723, 'bear_tp_mult': 1.8074385599344853, 'bear_tsl_mult': 0.9479289815685799, 'bear_time_stop': 32, 'bear_use_sma': False, 'bear_use_ema': False, 'bear_use_atr': True, 'bear_use_adx': True, 'bear_use_spike': False, 'bear_rsi_required': True, 'sideways_strategy': 'breakout', 'sideways_bb_std_mult': 2.1098960334153642, 'sideways_rsi_os': 16, 'sideways_rsi_ob': 57, 'sideways_adx_thresh': 8.144139497603781, 'sideways_atr_min_pct': 0.023945206095770222, 'sideways_atr_max_pct': 0.0643733185748256, 'sideways_tp_mult': 2.2884897897942342, 'sideways_tsl_mult': 0.6845448326729101, 'sideways_time_stop': 256, 'sideways_use_sma': True, 'sideways_use_ema': True, 'sideways_use_atr': False, 'sideways_use_adx': False, 'sideways_use_spike': False, 'sideways_rsi_required': False}.
