[I 2025-08-30 19:00:34,641] Trial 196 finished with values: [-1000000000.0, 1000000000.0] and parameters: {'p_sma': 40, 'p_std': 19, 'p_atr': 10, 'p_adx': 16, 'rsi_period': 63, 'ema1': 24, 'ema2': 32, 'slip_atr_k': 0.02123334604371721, 'slip_spread_k': 0.6038384578227927, 'spread_hl_frac': 0.0033838185600847275, 'bb_std_mult': 3.029405191852979, 'rsi_os': 36, 'rsi_ob': 61, 'vol_spike': 0.2254383856564584, 'adx_thresh': 24.51891719836531, 'atr_min_pct': 0.02318153886564047, 'atr_max_pct': 0.13778835792263824, 'tp_mult': 2.2580640854217346, 'tsl_mult': 0.6993931753457392, 'strategy': 'breakout', 'time_stop': 174, 'use_sma': True, 'use_atr': True, 'use_adx': False, 'use_ema': False, 'use_spike': False, 'rsi_required': False, 'edge_k': 0.11649479978114485, 'edge_cap': 0.22752937747712224, 'bull_strategy': 'mean_reversion', 'bull_bb_std_mult': 1.1209016967676513, 'bull_rsi_os': 50, 'bull_rsi_ob': 74, 'bull_adx_thresh': 24.88568481277827, 'bull_atr_min_pct': 0.02909307626095898, 'bull_atr_max_pct': 0.028847376531192882, 'bull_tp_mult': 1.4935406939359308, 'bull_tsl_mult': 0.94589866029955, 'bull_time_stop': 193, 'bull_use_sma': True, 'bull_use_ema': True, 'bull_use_atr': True, 'bull_use_adx': True, 'bull_use_spike': True, 'bull_rsi_required': True, 'bear_strategy': 'mean_reversion', 'bear_bb_std_mult': 2.31444088495964, 'bear_rsi_os': 42, 'bear_rsi_ob': 68, 'bear_adx_thresh': 19.657484269403984, 'bear_atr_min_pct': 0.013882270662688573, 'bear_atr_max_pct': 0.05928048425516535, 'bear_tp_mult': 1.3395669447234129, 'bear_tsl_mult': 0.0910853482269956, 'bear_time_stop': 36, 'bear_use_sma': False, 'bear_use_ema': False, 'bear_use_atr': True, 'bear_use_adx': True, 'bear_use_spike': True, 'bear_rsi_required': False, 'sideways_strategy': 'breakout', 'sideways_bb_std_mult': 3.062652083229434, 'sideways_rsi_os': 37, 'sideways_rsi_ob': 58, 'sideways_adx_thresh': 10.081301521747372, 'sideways_atr_min_pct': 0.027559134307405815, 'sideways_atr_max_pct': 0.11866572064509633, 'sideways_tp_mult': 1.7957042989551828, 'sideways_tsl_mult': 0.6977372728506471, 'sideways_time_stop': 116, 'sideways_use_sma': True, 'sideways_use_ema': True, 'sideways_use_atr': True, 'sideways_use_adx': False, 'sideways_use_spike': False, 'sideways_rsi_required': False}.
[I 2025-08-30 19:00:35,157] Trial 202 finished with values: [-1000000000.0, 1000000000.0] and parameters: {'p_sma': 7, 'p_std': 23, 'p_atr': 20, 'p_adx': 8, 'rsi_period': 76, 'ema1': 25, 'ema2': 51, 'slip_atr_k': 0.013717530663020297, 'slip_spread_k': 0.4294200971310584, 'spread_hl_frac': 0.029428025989824646, 'bb_std_mult': 0.9241994896664014, 'rsi_os': 37, 'rsi_ob': 54, 'vol_spike': 0.03340578302975579, 'adx_thresh': 26.256983886179086, 'atr_min_pct': 0.026037831704733103, 'atr_max_pct': 0.016037420900258045, 'tp_mult': 2.5389496507685996, 'tsl_mult': 0.7397438453842078, 'strategy': 'breakout', 'time_stop': 22, 'use_sma': False, 'use_atr': False, 'use_adx': False, 'use_ema': False, 'use_spike': True, 'rsi_required': True, 'edge_k': 1.4554415610599327, 'edge_cap': 0.19769292729431015, 'bull_strategy': 'breakout', 'bull_bb_std_mult': 1.6854365314862199, 'bull_rsi_os': 52, 'bull_rsi_ob': 72, 'bull_adx_thresh': 23.752137682315613, 'bull_atr_min_pct': 0.0016972168534035072, 'bull_atr_max_pct': 0.031469452609962305, 'bull_tp_mult': 1.808850481767738, 'bull_tsl_mult': 0.48942703879477745, 'bull_time_stop': 199, 'bull_use_sma': False, 'bull_use_ema': False, 'bull_use_atr': False, 'bull_use_adx': True, 'bull_use_spike': True, 'bull_rsi_required': True, 'bear_strategy': 'breakout', 'bear_bb_std_mult': 3.3465462328117836, 'bear_rsi_os': 45, 'bear_rsi_ob': 81, 'bear_adx_thresh': 23.108064726827994, 'bear_atr_min_pct': 0.014866074133043725, 'bear_atr_max_pct': 0.06727726092418017, 'bear_tp_mult': 1.7116224833057732, 'bear_tsl_mult': 0.16179008814066814, 'bear_time_stop': 111, 'bear_use_sma': True, 'bear_use_ema': False, 'bear_use_atr': True, 'bear_use_adx': True, 'bear_use_spike': False, 'bear_rsi_required': True, 'sideways_strategy': 'breakout', 'sideways_bb_std_mult': 2.226778848616477, 'sideways_rsi_os': 16, 'sideways_rsi_ob': 95, 'sideways_adx_thresh': 16.447901439906413, 'sideways_atr_min_pct': 0.01630842993934626, 'sideways_atr_max_pct': 0.07591699384253865, 'sideways_tp_mult': 2.1660836438350004, 'sideways_tsl_mult': 0.08487415615686766, 'sideways_time_stop': 284, 'sideways_use_sma': True, 'sideways_use_ema': True, 'sideways_use_atr': False, 'sideways_use_adx': True, 'sideways_use_spike': False, 'sideways_rsi_required': True}.
[I 2025-08-30 19:01:08,097] Trial 200 finished with values: [-1000000000.0, 1000000000.0] and parameters: {'p_sma': 8, 'p_std': 20, 'p_atr': 20, 'p_adx': 8, 'rsi_period': 49, 'ema1': 24, 'ema2': 26, 'slip_atr_k': 0.05049755928430846, 'slip_spread_k': 0.4306068635330755, 'spread_hl_frac': 0.02595966377023692, 'bb_std_mult': 0.9051762069270066, 'rsi_os': 39, 'rsi_ob': 58, 'vol_spike': 0.017247473576917725, 'adx_thresh': 19.384695259949204, 'atr_min_pct': 0.022576981412236102, 'atr_max_pct': 0.06539134715350307, 'tp_mult': 2.255610983608022, 'tsl_mult': 0.3784195807721319, 'strategy': 'breakout', 'time_stop': 171, 'use_sma': False, 'use_atr': False, 'use_adx': False, 'use_ema': False, 'use_spike': True, 'rsi_required': True, 'edge_k': 0.1741994416374782, 'edge_cap': 0.19614091950024076, 'bull_strategy': 'breakout', 'bull_bb_std_mult': 2.6014972541649155, 'bull_rsi_os': 50, 'bull_rsi_ob': 73, 'bull_adx_thresh': 29.135147707870004, 'bull_atr_min_pct': 0.0017473793424250652, 'bull_atr_max_pct': 0.14382589609804194, 'bull_tp_mult': 1.2457160556741393, 'bull_tsl_mult': 0.26086628734750916, 'bull_time_stop': 193, 'bull_use_sma': True, 'bull_use_ema': False, 'bull_use_atr': False, 'bull_use_adx': True, 'bull_use_spike': True, 'bull_rsi_required': True, 'bear_strategy': 'breakout', 'bear_bb_std_mult': 3.3678613491260965, 'bear_rsi_os': 53, 'bear_rsi_ob': 54, 'bear_adx_thresh': 20.710041240416718, 'bear_atr_min_pct': 0.014013001274847949, 'bear_atr_max_pct': 0.13500456335094238, 'bear_tp_mult': 1.7164449277193723, 'bear_tsl_mult': 0.10098963174706521, 'bear_time_stop': 48, 'bear_use_sma': True, 'bear_use_ema': False, 'bear_use_atr': True, 'bear_use_adx': True, 'bear_use_spike': False, 'bear_rsi_required': False, 'sideways_strategy': 'breakout', 'sideways_bb_std_mult': 2.992912984884504, 'sideways_rsi_os': 16, 'sideways_rsi_ob': 48, 'sideways_adx_thresh': 10.51887408023075, 'sideways_atr_min_pct': 0.02882921992949376, 'sideways_atr_max_pct': 0.11898676706541231, 'sideways_tp_mult': 1.799784078463659, 'sideways_tsl_mult': 0.090291402485977, 'sideways_time_stop': 287, 'sideways_use_sma': True, 'sideways_use_ema': True, 'sideways_use_atr': False, 'sideways_use_adx': False, 'sideways_use_spike': False, 'sideways_rsi_required': False}.
[I 2025-08-30 19:01:08,124] Trial 201 finished with values: [-1000000000.0, 1000000000.0] and parameters: {'p_sma': 50, 'p_std': 24, 'p_atr': 8, 'p_adx': 7, 'rsi_period': 49, 'ema1': 24, 'ema2': 14, 'slip_atr_k': 0.08371396556009485, 'slip_spread_k': 0.410031725577797, 'spread_hl_frac': 0.03223010577511943, 'bb_std_mult': 0.9205367830768201, 'rsi_os': 37, 'rsi_ob': 58, 'vol_spike': 0.22315673206477737, 'adx_thresh': 29.172847058849506, 'atr_min_pct': 0.005533795071737608, 'atr_max_pct': 0.0747437902472991, 'tp_mult': 2.151910751480618, 'tsl_mult': 0.7362004926227489, 'strategy': 'breakout', 'time_stop': 20, 'use_sma': False, 'use_atr': False, 'use_adx': False, 'use_ema': False, 'use_spike': True, 'rsi_required': True, 'edge_k': 0.163911446603903, 'edge_cap': 0.270401772437506, 'bull_strategy': 'breakout', 'bull_bb_std_mult': 2.2704541852466886, 'bull_rsi_os': 50, 'bull_rsi_ob': 72, 'bull_adx_thresh': 13.155795001204277, 'bull_atr_min_pct': 0.01578770362066158, 'bull_atr_max_pct': 0.05919157689295987, 'bull_tp_mult': 2.3370442825639457, 'bull_tsl_mult': 0.04996250286491272, 'bull_time_stop': 191, 'bull_use_sma': True, 'bull_use_ema': False, 'bull_use_atr': False, 'bull_use_adx': True, 'bull_use_spike': True, 'bull_rsi_required': True, 'bear_strategy': 'breakout', 'bear_bb_std_mult': 0.5174132949594421, 'bear_rsi_os': 45, 'bear_rsi_ob': 81, 'bear_adx_thresh': 6.9765742904039865, 'bear_atr_min_pct': 0.006816495705608619, 'bear_atr_max_pct': 0.05160730998664434, 'bear_tp_mult': 1.7057069763445698, 'bear_tsl_mult': 0.10151457327214165, 'bear_time_stop': 49, 'bear_use_sma': True, 'bear_use_ema': False, 'bear_use_atr': True, 'bear_use_adx': True, 'bear_use_spike': False, 'bear_rsi_required': False, 'sideways_strategy': 'breakout', 'sideways_bb_std_mult': 3.3734237809510743, 'sideways_rsi_os': 16, 'sideways_rsi_ob': 95, 'sideways_adx_thresh': 10.408340169708723, 'sideways_atr_min_pct': 0.01670569505379446, 'sideways_atr_max_pct': 0.0662559782539966, 'sideways_tp_mult': 1.809200839014436, 'sideways_tsl_mult': 0.09231344676942549, 'sideways_time_stop': 283, 'sideways_use_sma': True, 'sideways_use_ema': True, 'sideways_use_atr': False, 'sideways_use_adx': False, 'sideways_use_spike': False, 'sideways_rsi_required': True}.
[I 2025-08-30 19:01:08,466] Trial 199 finished with values: [-0.03339121823530222, 0.03342835385321829] and parameters: {'p_sma': 48, 'p_std': 20, 'p_atr': 9, 'p_adx': 8, 'rsi_period': 55, 'ema1': 24, 'ema2': 21, 'slip_atr_k': 0.012633452401689305, 'slip_spread_k': 0.40758189282438684, 'spread_hl_frac': 0.037114861751756795, 'bb_std_mult': 0.7361993120160597, 'rsi_os': 40, 'rsi_ob': 58, 'vol_spike': 0.2231361994290471, 'adx_thresh': 11.57073548984945, 'atr_min_pct': 0.02371645665072794, 'atr_max_pct': 0.1376174513082303, 'tp_mult': 2.257845894894904, 'tsl_mult': 0.5345065428671727, 'strategy': 'breakout', 'time_stop': 46, 'use_sma': True, 'use_atr': False, 'use_adx': False, 'use_ema': False, 'use_spike': True, 'rsi_required': False, 'edge_k': 0.5355673325504753, 'edge_cap': 0.22420490005084942, 'bull_strategy': 'breakout', 'bull_bb_std_mult': 2.2956251625816613, 'bull_rsi_os': 14, 'bull_rsi_ob': 85, 'bull_adx_thresh': 26.57805941080456, 'bull_atr_min_pct': 0.002278126366672564, 'bull_atr_max_pct': 0.029410941009671877, 'bull_tp_mult': 2.0999399883297825, 'bull_tsl_mult': 0.25556229755030757, 'bull_time_stop': 197, 'bull_use_sma': False, 'bull_use_ema': True, 'bull_use_atr': False, 'bull_use_adx': True, 'bull_use_spike': True, 'bull_rsi_required': True, 'bear_strategy': 'breakout', 'bear_bb_std_mult': 3.328649861131655, 'bear_rsi_os': 36, 'bear_rsi_ob': 84, 'bear_adx_thresh': 5.94252506783107, 'bear_atr_min_pct': 0.0015898555809501658, 'bear_atr_max_pct': 0.05401081123056532, 'bear_tp_mult': 1.3457469088510825, 'bear_tsl_mult': 0.5639557271028773, 'bear_time_stop': 48, 'bear_use_sma': True, 'bear_use_ema': False, 'bear_use_atr': True, 'bear_use_adx': True, 'bear_use_spike': False, 'bear_rsi_required': False, 'sideways_strategy': 'breakout', 'sideways_bb_std_mult': 1.7611037013456587, 'sideways_rsi_os': 54, 'sideways_rsi_ob': 68, 'sideways_adx_thresh': 10.37453936680646, 'sideways_atr_min_pct': 0.021647781977188172, 'sideways_atr_max_pct': 0.08210848598205764, 'sideways_tp_mult': 1.8080195988294125, 'sideways_tsl_mult': 0.752211094902929, 'sideways_time_stop': 287, 'sideways_use_sma': True, 'sideways_use_ema': True, 'sideways_use_atr': False, 'sideways_use_adx': True, 'sideways_use_spike': False, 'sideways_rsi_required': False}.
[I 2025-08-30 19:01:08,970] Trial 203 finished with values: [-1000000000.0, 1000000000.0] and parameters: {'p_sma': 50, 'p_std': 24, 'p_atr': 8, 'p_adx': 7, 'rsi_period': 49, 'ema1': 28, 'ema2': 40, 'slip_atr_k': 0.050413008314704987, 'slip_spread_k': 0.25531732306011945, 'spread_hl_frac': 0.006081959056623821, 'bb_std_mult': 0.7461898753481455, 'rsi_os': 39, 'rsi_ob': 58, 'vol_spike': 0.020113902542363404, 'adx_thresh': 25.22365960334855, 'atr_min_pct': 0.022205699146598958, 'atr_max_pct': 0.05419496812721054, 'tp_mult': 1.4889084445933927, 'tsl_mult': 0.7238927051590324, 'strategy': 'breakout', 'time_stop': 30, 'use_sma': False, 'use_atr': True, 'use_adx': False, 'use_ema': False, 'use_spike': True, 'rsi_required': True, 'edge_k': 0.16833864371895912, 'edge_cap': 0.30822315507924203, 'bull_strategy': 'mean_reversion', 'bull_bb_std_mult': 2.2895499614602786, 'bull_rsi_os': 50, 'bull_rsi_ob': 56, 'bull_adx_thresh': 13.658173042922186, 'bull_atr_min_pct': 0.007362434884619331, 'bull_atr_max_pct': 0.14287869073931148, 'bull_tp_mult': 2.173760017200936, 'bull_tsl_mult': 0.99951591046994, 'bull_time_stop': 181, 'bull_use_sma': True, 'bull_use_ema': False, 'bull_use_atr': False, 'bull_use_adx': True, 'bull_use_spike': True, 'bull_rsi_required': True, 'bear_strategy': 'breakout', 'bear_bb_std_mult': 0.510686354764665, 'bear_rsi_os': 51, 'bear_rsi_ob': 84, 'bear_adx_thresh': 20.816265734611747, 'bear_atr_min_pct': 0.017618723989203416, 'bear_atr_max_pct': 0.10599670953105447, 'bear_tp_mult': 1.7924665494778178, 'bear_tsl_mult': 0.06866951371539932, 'bear_time_stop': 54, 'bear_use_sma': True, 'bear_use_ema': False, 'bear_use_atr': True, 'bear_use_adx': True, 'bear_use_spike': False, 'bear_rsi_required': False, 'sideways_strategy': 'breakout', 'sideways_bb_std_mult': 1.8959333268085887, 'sideways_rsi_os': 7, 'sideways_rsi_ob': 49, 'sideways_adx_thresh': 10.775197807662593, 'sideways_atr_min_pct': 0.004631992408570606, 'sideways_atr_max_pct': 0.017429387711612926, 'sideways_tp_mult': 1.6434783859689306, 'sideways_tsl_mult': 0.9712014793371464, 'sideways_time_stop': 46, 'sideways_use_sma': True, 'sideways_use_ema': True, 'sideways_use_atr': False, 'sideways_use_adx': False, 'sideways_use_spike': False, 'sideways_rsi_required': False}.
[I 2025-08-30 19:01:43,328] Trial 207 finished with values: [-1000000000.0, 1000000000.0] and parameters: {'p_sma': 40, 'p_std': 51, 'p_atr': 9, 'p_adx': 15, 'rsi_period': 52, 'ema1': 23, 'ema2': 19, 'slip_atr_k': 0.12070272839824579, 'slip_spread_k': 0.4112546375830741, 'spread_hl_frac': 0.036998843718493914, 'bb_std_mult': 1.1377451289221143, 'rsi_os': 35, 'rsi_ob': 93, 'vol_spike': 0.03299096025820342, 'adx_thresh': 18.264646886219776, 'atr_min_pct': 0.023839436012382628, 'atr_max_pct': 0.13678792759949138, 'tp_mult': 2.1401602270861706, 'tsl_mult': 0.7444072271773129, 'strategy': 'breakout', 'time_stop': 45, 'use_sma': False, 'use_atr': True, 'use_adx': False, 'use_ema': False, 'use_spike': True, 'rsi_required': True, 'edge_k': 0.1230527698227512, 'edge_cap': 0.9227972181870595, 'bull_strategy': 'mean_reversion', 'bull_bb_std_mult': 0.9899114910859761, 'bull_rsi_os': 14, 'bull_rsi_ob': 86, 'bull_adx_thresh': 26.0317990114642, 'bull_atr_min_pct': 0.00247708298112008, 'bull_atr_max_pct': 0.10503382587472587, 'bull_tp_mult': 2.8276239061485584, 'bull_tsl_mult': 0.43406409581830124, 'bull_time_stop': 285, 'bull_use_sma': False, 'bull_use_ema': False, 'bull_use_atr': False, 'bull_use_adx': True, 'bull_use_spike': True, 'bull_rsi_required': True, 'bear_strategy': 'breakout', 'bear_bb_std_mult': 3.199647877709428, 'bear_rsi_os': 28, 'bear_rsi_ob': 82, 'bear_adx_thresh': 5.6117014564556715, 'bear_atr_min_pct': 0.02476336672337543, 'bear_atr_max_pct': 0.11307184922174714, 'bear_tp_mult': 1.8093969815746116, 'bear_tsl_mult': 0.7578317053101197, 'bear_time_stop': 33, 'bear_use_sma': True, 'bear_use_ema': False, 'bear_use_atr': True, 'bear_use_adx': True, 'bear_use_spike': False, 'bear_rsi_required': True, 'sideways_strategy': 'mean_reversion', 'sideways_bb_std_mult': 2.8090650834113284, 'sideways_rsi_os': 49, 'sideways_rsi_ob': 54, 'sideways_adx_thresh': 9.546133492041703, 'sideways_atr_min_pct': 0.02160888775079595, 'sideways_atr_max_pct': 0.04941209898216499, 'sideways_tp_mult': 2.790987394646363, 'sideways_tsl_mult': 0.6721107907131295, 'sideways_time_stop': 147, 'sideways_use_sma': True, 'sideways_use_ema': True, 'sideways_use_atr': False, 'sideways_use_adx': True, 'sideways_use_spike': True, 'sideways_rsi_required': False}.
[I 2025-08-30 19:01:43,504] Trial 205 finished with values: [-0.05155802550821387, 0.051539081789375205] and parameters: {'p_sma': 42, 'p_std': 25, 'p_atr': 22, 'p_adx': 9, 'rsi_period': 52, 'ema1': 6, 'ema2': 40, 'slip_atr_k': 0.09461449052962342, 'slip_spread_k': 0.017115384586348925, 'spread_hl_frac': 0.03095970844525302, 'bb_std_mult': 0.7233151314825845, 'rsi_os': 35, 'rsi_ob': 88, 'vol_spike': 0.04177386570823856, 'adx_thresh': 18.97225991894192, 'atr_min_pct': 0.023893247472202808, 'atr_max_pct': 0.14365517199964117, 'tp_mult': 2.1339900830947416, 'tsl_mult': 0.7287530369334824, 'strategy': 'breakout', 'time_stop': 31, 'use_sma': False, 'use_atr': True, 'use_adx': False, 'use_ema': False, 'use_spike': True, 'rsi_required': True, 'edge_k': 1.5535341939710663, 'edge_cap': 0.2200306695712762, 'bull_strategy': 'mean_reversion', 'bull_bb_std_mult': 1.915383702844933, 'bull_rsi_os': 29, 'bull_rsi_ob': 69, 'bull_adx_thresh': 13.955901107509915, 'bull_atr_min_pct': 0.0023887929614306207, 'bull_atr_max_pct': 0.027057115298095652, 'bull_tp_mult': 2.1872793020740784, 'bull_tsl_mult': 0.9861312139533903, 'bull_time_stop': 20, 'bull_use_sma': True, 'bull_use_ema': False, 'bull_use_atr': False, 'bull_use_adx': True, 'bull_use_spike': True, 'bull_rsi_required': True, 'bear_strategy': 'breakout', 'bear_bb_std_mult': 2.540760537758996, 'bear_rsi_os': 49, 'bear_rsi_ob': 83, 'bear_adx_thresh': 5.612818032864342, 'bear_atr_min_pct': 0.0031197508438586524, 'bear_atr_max_pct': 0.1135048467103397, 'bear_tp_mult': 1.7902772197199817, 'bear_tsl_mult': 0.7764348137828359, 'bear_time_stop': 32, 'bear_use_sma': True, 'bear_use_ema': False, 'bear_use_atr': True, 'bear_use_adx': True, 'bear_use_spike': False, 'bear_rsi_required': False, 'sideways_strategy': 'mean_reversion', 'sideways_bb_std_mult': 1.887336420209828, 'sideways_rsi_os': 41, 'sideways_rsi_ob': 59, 'sideways_adx_thresh': 9.552498911368573, 'sideways_atr_min_pct': 0.025894863607120594, 'sideways_atr_max_pct': 0.018659221199167526, 'sideways_tp_mult': 1.2231707116625108, 'sideways_tsl_mult': 0.6731450030817675, 'sideways_time_stop': 133, 'sideways_use_sma': True, 'sideways_use_ema': True, 'sideways_use_atr': False, 'sideways_use_adx': False, 'sideways_use_spike': True, 'sideways_rsi_required': False}.
[I 2025-08-30 19:01:43,737] Trial 206 finished with values: [-1000000000.0, 1000000000.0] and parameters: {'p_sma': 42, 'p_std': 25, 'p_atr': 22, 'p_adx': 20, 'rsi_period': 52, 'ema1': 6, 'ema2': 11, 'slip_atr_k': 0.11992763016370868, 'slip_spread_k': 0.40055701102334085, 'spread_hl_frac': 0.005939293866702909, 'bb_std_mult': 0.7276835929809726, 'rsi_os': 38, 'rsi_ob': 87, 'vol_spike': 0.26438163662981795, 'adx_thresh': 18.254826833517306, 'atr_min_pct': 0.02393669869285366, 'atr_max_pct': 0.05237203789213252, 'tp_mult': 2.2096090895791005, 'tsl_mult': 0.7322246230602224, 'strategy': 'breakout', 'time_stop': 113, 'use_sma': False, 'use_atr': True, 'use_adx': False, 'use_ema': False, 'use_spike': True, 'rsi_required': True, 'edge_k': 0.12927115394478142, 'edge_cap': 0.32126433026290196, 'bull_strategy': 'mean_reversion', 'bull_bb_std_mult': 1.9158643703391387, 'bull_rsi_os': 17, 'bull_rsi_ob': 69, 'bull_adx_thresh': 12.261466331257918, 'bull_atr_min_pct': 0.020730196490725963, 'bull_atr_max_pct': 0.027266709206092563, 'bull_tp_mult': 2.1814764274304994, 'bull_tsl_mult': 0.9997718678476165, 'bull_time_stop': 251, 'bull_use_sma': True, 'bull_use_ema': False, 'bull_use_atr': False, 'bull_use_adx': True, 'bull_use_spike': True, 'bull_rsi_required': True, 'bear_strategy': 'breakout', 'bear_bb_std_mult': 3.1456857632388764, 'bear_rsi_os': 28, 'bear_rsi_ob': 84, 'bear_adx_thresh': 6.0355660154042, 'bear_atr_min_pct': 0.002501563264264905, 'bear_atr_max_pct': 0.1287407033456553, 'bear_tp_mult': 1.7818023362556341, 'bear_tsl_mult': 0.06936989169331063, 'bear_time_stop': 31, 'bear_use_sma': True, 'bear_use_ema': False, 'bear_use_atr': True, 'bear_use_adx': True, 'bear_use_spike': False, 'bear_rsi_required': False, 'sideways_strategy': 'mean_reversion', 'sideways_bb_std_mult': 1.995934115784466, 'sideways_rsi_os': 15, 'sideways_rsi_ob': 68, 'sideways_adx_thresh': 9.521205725057628, 'sideways_atr_min_pct': 0.021557262861374767, 'sideways_atr_max_pct': 0.08038603318008403, 'sideways_tp_mult': 2.869050646100475, 'sideways_tsl_mult': 0.18276363310816723, 'sideways_time_stop': 275, 'sideways_use_sma': True, 'sideways_use_ema': True, 'sideways_use_atr': False, 'sideways_use_adx': False, 'sideways_use_spike': True, 'sideways_rsi_required': False}.
