[I 2025-08-30 19:06:32,256] Trial 241 finished with values: [-1000000000.0, 1000000000.0] and parameters: {'p_sma': 39, 'p_std': 22, 'p_atr': 10, 'p_adx': 7, 'rsi_period': 54, 'ema1': 7, 'ema2': 22, 'slip_atr_k': 0.18627725537011208, 'slip_spread_k': 0.6311577215233264, 'spread_hl_frac': 0.009380939723253294, 'bb_std_mult': 1.0517586061335484, 'rsi_os': 35, 'rsi_ob': 54, 'vol_spike': 0.03602698643343845, 'adx_thresh': 18.417331682534037, 'atr_min_pct': 0.027084946789857782, 'atr_max_pct': 0.13861306044719912, 'tp_mult': 2.181330114785637, 'tsl_mult': 0.012807085813976271, 'strategy': 'breakout', 'time_stop': 40, 'use_sma': False, 'use_atr': False, 'use_adx': True, 'use_ema': False, 'use_spike': True, 'rsi_required': True, 'edge_k': 1.7693692314096077, 'edge_cap': 0.9429811030258164, 'bull_strategy': 'mean_reversion', 'bull_bb_std_mult': 1.9539237869854478, 'bull_rsi_os': 16, 'bull_rsi_ob': 71, 'bull_adx_thresh': 25.307098069471454, 'bull_atr_min_pct': 0.010971440474839313, 'bull_atr_max_pct': 0.04518380728681814, 'bull_tp_mult': 2.6369384052362834, 'bull_tsl_mult': 0.9329218104409396, 'bull_time_stop': 121, 'bull_use_sma': True, 'bull_use_ema': False, 'bull_use_atr': False, 'bull_use_adx': False, 'bull_use_spike': True, 'bull_rsi_required': True, 'bear_strategy': 'breakout', 'bear_bb_std_mult': 3.136194865194394, 'bear_rsi_os': 46, 'bear_rsi_ob': 81, 'bear_adx_thresh': 5.370911400458698, 'bear_atr_min_pct': 0.015281838154534667, 'bear_atr_max_pct': 0.14166256936481608, 'bear_tp_mult': 1.0643074230954743, 'bear_tsl_mult': 0.08981645963138135, 'bear_time_stop': 32, 'bear_use_sma': True, 'bear_use_ema': False, 'bear_use_atr': True, 'bear_use_adx': True, 'bear_use_spike': True, 'bear_rsi_required': False, 'sideways_strategy': 'mean_reversion', 'sideways_bb_std_mult': 2.0795593792686398, 'sideways_rsi_os': 34, 'sideways_rsi_ob': 46, 'sideways_adx_thresh': 10.921685488357708, 'sideways_atr_min_pct': 0.01982973656536211, 'sideways_atr_max_pct': 0.12466743758050601, 'sideways_tp_mult': 1.7845253097383857, 'sideways_tsl_mult': 0.6457077788902623, 'sideways_time_stop': 151, 'sideways_use_sma': True, 'sideways_use_ema': True, 'sideways_use_atr': True, 'sideways_use_adx': False, 'sideways_use_spike': True, 'sideways_rsi_required': False}.
[I 2025-08-30 19:07:08,286] Trial 245 finished with values: [-1000000000.0, 1000000000.0] and parameters: {'p_sma': 41, 'p_std': 27, 'p_atr': 10, 'p_adx': 25, 'rsi_period': 54, 'ema1': 7, 'ema2': 12, 'slip_atr_k': 0.01469708180839932, 'slip_spread_k': 0.4020894001283375, 'spread_hl_frac': 0.004835785007526711, 'bb_std_mult': 3.1283069471383245, 'rsi_os': 36, 'rsi_ob': 48, 'vol_spike': 0.0409381469757486, 'adx_thresh': 29.827651419279928, 'atr_min_pct': 0.02441500014211656, 'atr_max_pct': 0.1393806446130315, 'tp_mult': 2.7061285528525967, 'tsl_mult': 0.6851464796620119, 'strategy': 'breakout', 'time_stop': 41, 'use_sma': False, 'use_atr': True, 'use_adx': False, 'use_ema': False, 'use_spike': True, 'rsi_required': True, 'edge_k': 1.4961465308240174, 'edge_cap': 0.897772264133714, 'bull_strategy': 'mean_reversion', 'bull_bb_std_mult': 2.5260152229652677, 'bull_rsi_os': 16, 'bull_rsi_ob': 65, 'bull_adx_thresh': 30.83401875056332, 'bull_atr_min_pct': 0.0028968399579238657, 'bull_atr_max_pct': 0.021851136589706305, 'bull_tp_mult': 2.1208952252549746, 'bull_tsl_mult': 0.5142871891320677, 'bull_time_stop': 143, 'bull_use_sma': True, 'bull_use_ema': False, 'bull_use_atr': False, 'bull_use_adx': True, 'bull_use_spike': True, 'bull_rsi_required': True, 'bear_strategy': 'breakout', 'bear_bb_std_mult': 3.158934652853182, 'bear_rsi_os': 15, 'bear_rsi_ob': 82, 'bear_adx_thresh': 6.739517088443804, 'bear_atr_min_pct': 0.015155833318835478, 'bear_atr_max_pct': 0.11694669259187945, 'bear_tp_mult': 1.747438760499697, 'bear_tsl_mult': 0.730043530876639, 'bear_time_stop': 32, 'bear_use_sma': True, 'bear_use_ema': False, 'bear_use_atr': False, 'bear_use_adx': False, 'bear_use_spike': False, 'bear_rsi_required': False, 'sideways_strategy': 'breakout', 'sideways_bb_std_mult': 2.0694798164762633, 'sideways_rsi_os': 15, 'sideways_rsi_ob': 46, 'sideways_adx_thresh': 24.545594123594846, 'sideways_atr_min_pct': 0.012524654513377888, 'sideways_atr_max_pct': 0.06357931002624528, 'sideways_tp_mult': 1.2611299629364687, 'sideways_tsl_mult': 0.6977712062335459, 'sideways_time_stop': 152, 'sideways_use_sma': True, 'sideways_use_ema': True, 'sideways_use_atr': False, 'sideways_use_adx': False, 'sideways_use_spike': False, 'sideways_rsi_required': False}.
[I 2025-08-30 19:07:08,772] Trial 244 finished with values: [-0.01681379333763, 0.016725904220019017] and parameters: {'p_sma': 33, 'p_std': 26, 'p_atr': 15, 'p_adx': 9, 'rsi_period': 54, 'ema1': 7, 'ema2': 44, 'slip_atr_k': 0.014774090869192173, 'slip_spread_k': 0.567986937695504, 'spread_hl_frac': 0.03392117295900367, 'bb_std_mult': 1.754681331228929, 'rsi_os': 8, 'rsi_ob': 58, 'vol_spike': 0.03617049425073012, 'adx_thresh': 18.601923361075656, 'atr_min_pct': 0.023520160692919, 'atr_max_pct': 0.13888298976672597, 'tp_mult': 2.498009156752871, 'tsl_mult': 0.6816325083412822, 'strategy': 'breakout', 'time_stop': 198, 'use_sma': False, 'use_atr': True, 'use_adx': False, 'use_ema': False, 'use_spike': True, 'rsi_required': True, 'edge_k': 0.15152521385730355, 'edge_cap': 0.10659076174685889, 'bull_strategy': 'mean_reversion', 'bull_bb_std_mult': 3.387009453422011, 'bull_rsi_os': 51, 'bull_rsi_ob': 71, 'bull_adx_thresh': 24.243365995475514, 'bull_atr_min_pct': 0.0020666297310038186, 'bull_atr_max_pct': 0.02159699072575638, 'bull_tp_mult': 2.114350036439418, 'bull_tsl_mult': 0.9751546790968816, 'bull_time_stop': 124, 'bull_use_sma': True, 'bull_use_ema': False, 'bull_use_atr': False, 'bull_use_adx': True, 'bull_use_spike': True, 'bull_rsi_required': True, 'bear_strategy': 'breakout', 'bear_bb_std_mult': 3.165988979093324, 'bear_rsi_os': 15, 'bear_rsi_ob': 81, 'bear_adx_thresh': 14.30911599714753, 'bear_atr_min_pct': 0.015149746015051861, 'bear_atr_max_pct': 0.05775808323707089, 'bear_tp_mult': 1.7405786129540028, 'bear_tsl_mult': 0.38413584366954423, 'bear_time_stop': 146, 'bear_use_sma': True, 'bear_use_ema': False, 'bear_use_atr': False, 'bear_use_adx': False, 'bear_use_spike': False, 'bear_rsi_required': False, 'sideways_strategy': 'breakout', 'sideways_bb_std_mult': 2.078055485861111, 'sideways_rsi_os': 17, 'sideways_rsi_ob': 93, 'sideways_adx_thresh': 24.404328582108995, 'sideways_atr_min_pct': 0.012732281754883314, 'sideways_atr_max_pct': 0.11482695309440018, 'sideways_tp_mult': 1.7928258017080074, 'sideways_tsl_mult': 0.7033235066980755, 'sideways_time_stop': 189, 'sideways_use_sma': True, 'sideways_use_ema': True, 'sideways_use_atr': False, 'sideways_use_adx': False, 'sideways_use_spike': False, 'sideways_rsi_required': False}.
[I 2025-08-30 19:07:09,018] Trial 246 finished with values: [-1000000000.0, 1000000000.0] and parameters: {'p_sma': 29, 'p_std': 26, 'p_atr': 10, 'p_adx': 25, 'rsi_period': 72, 'ema1': 24, 'ema2': 10, 'slip_atr_k': 0.22522040387092324, 'slip_spread_k': 0.8978759043640525, 'spread_hl_frac': 0.010859686561345153, 'bb_std_mult': 2.8299763306398797, 'rsi_os': 34, 'rsi_ob': 79, 'vol_spike': 0.19500740186045423, 'adx_thresh': 18.785584576449722, 'atr_min_pct': 0.027164593808399418, 'atr_max_pct': 0.13734569206385364, 'tp_mult': 2.5033660506522346, 'tsl_mult': 0.723080791792556, 'strategy': 'breakout', 'time_stop': 39, 'use_sma': False, 'use_atr': True, 'use_adx': False, 'use_ema': False, 'use_spike': True, 'rsi_required': True, 'edge_k': 0.1388083593575543, 'edge_cap': 0.8319374510488277, 'bull_strategy': 'mean_reversion', 'bull_bb_std_mult': 1.8124418305818846, 'bull_rsi_os': 48, 'bull_rsi_ob': 66, 'bull_adx_thresh': 33.41517866345938, 'bull_atr_min_pct': 0.010966395446505711, 'bull_atr_max_pct': 0.02036583113838158, 'bull_tp_mult': 2.120794954208133, 'bull_tsl_mult': 0.9774421174664814, 'bull_time_stop': 120, 'bull_use_sma': True, 'bull_use_ema': False, 'bull_use_atr': False, 'bull_use_adx': False, 'bull_use_spike': True, 'bull_rsi_required': True, 'bear_strategy': 'breakout', 'bear_bb_std_mult': 3.1623403174334705, 'bear_rsi_os': 51, 'bear_rsi_ob': 82, 'bear_adx_thresh': 6.559012897092128, 'bear_atr_min_pct': 0.015396556878535065, 'bear_atr_max_pct': 0.09259877482382597, 'bear_tp_mult': 1.7643884912146708, 'bear_tsl_mult': 0.8571757863384755, 'bear_time_stop': 43, 'bear_use_sma': True, 'bear_use_ema': False, 'bear_use_atr': False, 'bear_use_adx': False, 'bear_use_spike': False, 'bear_rsi_required': False, 'sideways_strategy': 'breakout', 'sideways_bb_std_mult': 2.4356683216639414, 'sideways_rsi_os': 15, 'sideways_rsi_ob': 46, 'sideways_adx_thresh': 8.340018159395223, 'sideways_atr_min_pct': 0.019165661397651204, 'sideways_atr_max_pct': 0.05910845837511344, 'sideways_tp_mult': 1.7853690254946455, 'sideways_tsl_mult': 0.6921350065623224, 'sideways_time_stop': 266, 'sideways_use_sma': True, 'sideways_use_ema': True, 'sideways_use_atr': False, 'sideways_use_adx': False, 'sideways_use_spike': False, 'sideways_rsi_required': False}.
[I 2025-08-30 19:07:09,019] Trial 247 finished with values: [-1000000000.0, 1000000000.0] and parameters: {'p_sma': 57, 'p_std': 26, 'p_atr': 15, 'p_adx': 23, 'rsi_period': 24, 'ema1': 25, 'ema2': 44, 'slip_atr_k': 0.014062680596429613, 'slip_spread_k': 0.4094080430190703, 'spread_hl_frac': 0.03413979305954016, 'bb_std_mult': 1.0036442724572936, 'rsi_os': 37, 'rsi_ob': 60, 'vol_spike': 0.04202447745236226, 'adx_thresh': 18.59928152198268, 'atr_min_pct': 0.02386171225563981, 'atr_max_pct': 0.13648824175395746, 'tp_mult': 1.8459677808881176, 'tsl_mult': 0.7174481485789559, 'strategy': 'breakout', 'time_stop': 201, 'use_sma': False, 'use_atr': True, 'use_adx': False, 'use_ema': False, 'use_spike': True, 'rsi_required': True, 'edge_k': 0.16397206351722082, 'edge_cap': 0.8030546193578101, 'bull_strategy': 'breakout', 'bull_bb_std_mult': 1.8071941054040288, 'bull_rsi_os': 48, 'bull_rsi_ob': 66, 'bull_adx_thresh': 26.289092950561187, 'bull_atr_min_pct': 0.02047201578002589, 'bull_atr_max_pct': 0.020869970488361853, 'bull_tp_mult': 2.114716784609837, 'bull_tsl_mult': 0.9754551532486228, 'bull_time_stop': 265, 'bull_use_sma': False, 'bull_use_ema': False, 'bull_use_atr': False, 'bull_use_adx': True, 'bull_use_spike': True, 'bull_rsi_required': False, 'bear_strategy': 'breakout', 'bear_bb_std_mult': 3.2863258940974447, 'bear_rsi_os': 15, 'bear_rsi_ob': 83, 'bear_adx_thresh': 13.697578378462982, 'bear_atr_min_pct': 0.015300089133926768, 'bear_atr_max_pct': 0.09260165457899981, 'bear_tp_mult': 1.760789732927662, 'bear_tsl_mult': 0.1265895994993967, 'bear_time_stop': 266, 'bear_use_sma': True, 'bear_use_ema': False, 'bear_use_atr': False, 'bear_use_adx': False, 'bear_use_spike': False, 'bear_rsi_required': False, 'sideways_strategy': 'breakout', 'sideways_bb_std_mult': 2.0119336358886537, 'sideways_rsi_os': 15, 'sideways_rsi_ob': 59, 'sideways_adx_thresh': 18.982955440051455, 'sideways_atr_min_pct': 0.01847445075601955, 'sideways_atr_max_pct': 0.05465944441847072, 'sideways_tp_mult': 1.1465973911836336, 'sideways_tsl_mult': 0.7043777492223566, 'sideways_time_stop': 27, 'sideways_use_sma': True, 'sideways_use_ema': True, 'sideways_use_atr': False, 'sideways_use_adx': True, 'sideways_use_spike': False, 'sideways_rsi_required': False}.
[I 2025-08-30 19:07:09,539] Trial 250 finished with values: [-1000000000.0, 1000000000.0] and parameters: {'p_sma': 42, 'p_std': 28, 'p_atr': 12, 'p_adx': 15, 'rsi_period': 65, 'ema1': 14, 'ema2': 50, 'slip_atr_k': 0.0234780139222988, 'slip_spread_k': 0.35331946163810524, 'spread_hl_frac': 0.033185564685614316, 'bb_std_mult': 0.9384400156007212, 'rsi_os': 53, 'rsi_ob': 63, 'vol_spike': 0.13032994166692588, 'adx_thresh': 27.41780857150281, 'atr_min_pct': 0.005115838023122715, 'atr_max_pct': 0.13237516500472093, 'tp_mult': 2.261266684643454, 'tsl_mult': 0.7889482291475363, 'strategy': 'mean_reversion', 'time_stop': 32, 'use_sma': False, 'use_atr': True, 'use_adx': False, 'use_ema': True, 'use_spike': False, 'rsi_required': True, 'edge_k': 0.648897299998139, 'edge_cap': 0.22545010348043729, 'bull_strategy': 'mean_reversion', 'bull_bb_std_mult': 3.4040071250520114, 'bull_rsi_os': 51, 'bull_rsi_ob': 55, 'bull_adx_thresh': 26.618506796358027, 'bull_atr_min_pct': 0.018273024129195764, 'bull_atr_max_pct': 0.025237602352212164, 'bull_tp_mult': 2.207723072449321, 'bull_tsl_mult': 0.9817059183209729, 'bull_time_stop': 186, 'bull_use_sma': False, 'bull_use_ema': True, 'bull_use_atr': False, 'bull_use_adx': True, 'bull_use_spike': True, 'bull_rsi_required': True, 'bear_strategy': 'mean_reversion', 'bear_bb_std_mult': 3.380787594326144, 'bear_rsi_os': 18, 'bear_rsi_ob': 84, 'bear_adx_thresh': 11.1153310106602, 'bear_atr_min_pct': 0.01619611449394347, 'bear_atr_max_pct': 0.07832734374977664, 'bear_tp_mult': 1.6843140185384797, 'bear_tsl_mult': 0.9026712986827534, 'bear_time_stop': 43, 'bear_use_sma': True, 'bear_use_ema': False, 'bear_use_atr': True, 'bear_use_adx': True, 'bear_use_spike': False, 'bear_rsi_required': True, 'sideways_strategy': 'breakout', 'sideways_bb_std_mult': 1.0064240707433156, 'sideways_rsi_os': 17, 'sideways_rsi_ob': 81, 'sideways_adx_thresh': 8.676714469920483, 'sideways_atr_min_pct': 0.019701509301304796, 'sideways_atr_max_pct': 0.117343664382446, 'sideways_tp_mult': 2.3185946758287077, 'sideways_tsl_mult': 0.673855645011497, 'sideways_time_stop': 165, 'sideways_use_sma': False, 'sideways_use_ema': False, 'sideways_use_atr': False, 'sideways_use_adx': True, 'sideways_use_spike': False, 'sideways_rsi_required': True}.
[I 2025-08-30 19:07:41,227] Trial 251 finished with values: [-0.05012677812473609, 0.049912939908922836] and parameters: {'p_sma': 42, 'p_std': 54, 'p_atr': 12, 'p_adx': 15, 'rsi_period': 50, 'ema1': 14, 'ema2': 51, 'slip_atr_k': 0.02364516107185697, 'slip_spread_k': 0.3518300227186014, 'spread_hl_frac': 0.020672841914500605, 'bb_std_mult': 2.7825582779996854, 'rsi_os': 9, 'rsi_ob': 91, 'vol_spike': 0.1295695630873128, 'adx_thresh': 20.044437785773656, 'atr_min_pct': 0.016895580736810727, 'atr_max_pct': 0.13238554500230085, 'tp_mult': 1.6727001483037884, 'tsl_mult': 0.4699663174988761, 'strategy': 'mean_reversion', 'time_stop': 185, 'use_sma': False, 'use_atr': True, 'use_adx': False, 'use_ema': True, 'use_spike': False, 'rsi_required': True, 'edge_k': 1.3570746388895714, 'edge_cap': 0.6134447654349812, 'bull_strategy': 'mean_reversion', 'bull_bb_std_mult': 1.8945161612408463, 'bull_rsi_os': 27, 'bull_rsi_ob': 55, 'bull_adx_thresh': 29.96096716794518, 'bull_atr_min_pct': 0.0021654010526547746, 'bull_atr_max_pct': 0.02587022246298934, 'bull_tp_mult': 1.2739100415001523, 'bull_tsl_mult': 0.9818036055348894, 'bull_time_stop': 186, 'bull_use_sma': False, 'bull_use_ema': True, 'bull_use_atr': False, 'bull_use_adx': True, 'bull_use_spike': True, 'bull_rsi_required': True, 'bear_strategy': 'mean_reversion', 'bear_bb_std_mult': 3.399032440007156, 'bear_rsi_os': 53, 'bear_rsi_ob': 53, 'bear_adx_thresh': 14.272151633052893, 'bear_atr_min_pct': 0.0007872170995740762, 'bear_atr_max_pct': 0.13780873464992502, 'bear_tp_mult': 1.6941087571751534, 'bear_tsl_mult': 0.9137057920342821, 'bear_time_stop': 45, 'bear_use_sma': True, 'bear_use_ema': False, 'bear_use_atr': True, 'bear_use_adx': True, 'bear_use_spike': False, 'bear_rsi_required': True, 'sideways_strategy': 'breakout', 'sideways_bb_std_mult': 1.9036324621188334, 'sideways_rsi_os': 17, 'sideways_rsi_ob': 93, 'sideways_adx_thresh': 28.782655288347243, 'sideways_atr_min_pct': 0.007254598908041229, 'sideways_atr_max_pct': 0.14974440179506765, 'sideways_tp_mult': 1.352419782602742, 'sideways_tsl_mult': 0.42898826845829985, 'sideways_time_stop': 257, 'sideways_use_sma': False, 'sideways_use_ema': False, 'sideways_use_atr': False, 'sideways_use_adx': True, 'sideways_use_spike': False, 'sideways_rsi_required': True}.
[I 2025-08-30 19:07:41,239] Trial 249 finished with values: [-1000000000.0, 1000000000.0] and parameters: {'p_sma': 42, 'p_std': 26, 'p_atr': 9, 'p_adx': 23, 'rsi_period': 24, 'ema1': 24, 'ema2': 10, 'slip_atr_k': 0.02476343363196088, 'slip_spread_k': 0.4703199596015072, 'spread_hl_frac': 0.003229048674863855, 'bb_std_mult': 0.9820316902744539, 'rsi_os': 39, 'rsi_ob': 91, 'vol_spike': 0.0810767158321528, 'adx_thresh': 27.74523706153455, 'atr_min_pct': 0.02362524168414573, 'atr_max_pct': 0.1323098083852265, 'tp_mult': 2.926993775213375, 'tsl_mult': 0.39803745455021566, 'strategy': 'breakout', 'time_stop': 33, 'use_sma': False, 'use_atr': True, 'use_adx': False, 'use_ema': False, 'use_spike': False, 'rsi_required': True, 'edge_k': 1.297709358337233, 'edge_cap': 0.605331416222763, 'bull_strategy': 'mean_reversion', 'bull_bb_std_mult': 1.8011541136549107, 'bull_rsi_os': 23, 'bull_rsi_ob': 57, 'bull_adx_thresh': 33.395577792791016, 'bull_atr_min_pct': 0.002203879688086897, 'bull_atr_max_pct': 0.010001438957748535, 'bull_tp_mult': 1.262306450231957, 'bull_tsl_mult': 0.9801028880466673, 'bull_time_stop': 113, 'bull_use_sma': False, 'bull_use_ema': False, 'bull_use_atr': False, 'bull_use_adx': True, 'bull_use_spike': True, 'bull_rsi_required': False, 'bear_strategy': 'breakout', 'bear_bb_std_mult': 2.435582768584005, 'bear_rsi_os': 54, 'bear_rsi_ob': 84, 'bear_adx_thresh': 16.850635753593572, 'bear_atr_min_pct': 0.01558416316309533, 'bear_atr_max_pct': 0.1224554381309777, 'bear_tp_mult': 2.356222674392241, 'bear_tsl_mult': 0.2534679829442186, 'bear_time_stop': 145, 'bear_use_sma': True, 'bear_use_ema': False, 'bear_use_atr': True, 'bear_use_adx': True, 'bear_use_spike': False, 'bear_rsi_required': False, 'sideways_strategy': 'breakout', 'sideways_bb_std_mult': 3.478018303510698, 'sideways_rsi_os': 17, 'sideways_rsi_ob': 60, 'sideways_adx_thresh': 17.288453671973937, 'sideways_atr_min_pct': 0.01834843526757874, 'sideways_atr_max_pct': 0.11714709143268164, 'sideways_tp_mult': 2.064599495018133, 'sideways_tsl_mult': 0.6830128355328604, 'sideways_time_stop': 259, 'sideways_use_sma': False, 'sideways_use_ema': False, 'sideways_use_atr': False, 'sideways_use_adx': True, 'sideways_use_spike': False, 'sideways_rsi_required': False}.
[I 2025-08-30 19:07:41,403] Trial 248 finished with values: [-1000000000.0, 1000000000.0] and parameters: {'p_sma': 57, 'p_std': 60, 'p_atr': 10, 'p_adx': 8, 'rsi_period': 51, 'ema1': 21, 'ema2': 24, 'slip_atr_k': 0.023201139506034904, 'slip_spread_k': 0.5715173087778271, 'spread_hl_frac': 0.0033336363095530703, 'bb_std_mult': 0.5008075142418398, 'rsi_os': 9, 'rsi_ob': 79, 'vol_spike': 0.04942956361828069, 'adx_thresh': 28.05922618251234, 'atr_min_pct': 0.005243612524154588, 'atr_max_pct': 0.13640033779421512, 'tp_mult': 2.4897468264824463, 'tsl_mult': 0.7281075249913537, 'strategy': 'breakout', 'time_stop': 33, 'use_sma': False, 'use_atr': True, 'use_adx': False, 'use_ema': True, 'use_spike': True, 'rsi_required': True, 'edge_k': 1.323428046406222, 'edge_cap': 0.28015599846906547, 'bull_strategy': 'breakout', 'bull_bb_std_mult': 3.3207717727101422, 'bull_rsi_os': 25, 'bull_rsi_ob': 55, 'bull_adx_thresh': 32.86419346380649, 'bull_atr_min_pct': 0.01804218976684382, 'bull_atr_max_pct': 0.09773528975511304, 'bull_tp_mult': 2.210588791010641, 'bull_tsl_mult': 0.9774296890009425, 'bull_time_stop': 187, 'bull_use_sma': False, 'bull_use_ema': False, 'bull_use_atr': False, 'bull_use_adx': True, 'bull_use_spike': True, 'bull_rsi_required': False, 'bear_strategy': 'mean_reversion', 'bear_bb_std_mult': 3.3074670109984816, 'bear_rsi_os': 31, 'bear_rsi_ob': 84, 'bear_adx_thresh': 13.564230285462239, 'bear_atr_min_pct': 0.01563399881792715, 'bear_atr_max_pct': 0.07941421424127262, 'bear_tp_mult': 1.682590994523336, 'bear_tsl_mult': 0.0423500265198713, 'bear_time_stop': 44, 'bear_use_sma': True, 'bear_use_ema': False, 'bear_use_atr': False, 'bear_use_adx': False, 'bear_use_spike': False, 'bear_rsi_required': True, 'sideways_strategy': 'breakout', 'sideways_bb_std_mult': 0.8691862593615065, 'sideways_rsi_os': 17, 'sideways_rsi_ob': 93, 'sideways_adx_thresh': 19.20115041814215, 'sideways_atr_min_pct': 0.018961531038553803, 'sideways_atr_max_pct': 0.11695244198738838, 'sideways_tp_mult': 2.327168863164427, 'sideways_tsl_mult': 0.6730392700185145, 'sideways_time_stop': 291, 'sideways_use_sma': False, 'sideways_use_ema': True, 'sideways_use_atr': False, 'sideways_use_adx': True, 'sideways_use_spike': False, 'sideways_rsi_required': False}.
