[I 2025-08-30 18:46:31,598] Trial 89 finished with values: [-1000000000.0, 1000000000.0] and parameters: {'p_sma': 39, 'p_std': 50, 'p_atr': 18, 'p_adx': 21, 'rsi_period': 78, 'ema1': 21, 'ema2': 14, 'slip_atr_k': 0.005469365704259583, 'slip_spread_k': 0.871973403981863, 'spread_hl_frac': 0.04421907311052347, 'bb_std_mult': 1.0785865349245147, 'rsi_os': 34, 'rsi_ob': 52, 'vol_spike': 0.052891860784307035, 'adx_thresh': 31.54841321698195, 'atr_min_pct': 0.005539336827314823, 'atr_max_pct': 0.1326076824256843, 'tp_mult': 2.2535377034181145, 'tsl_mult': 0.8160782517625285, 'strategy': 'mean_reversion', 'time_stop': 33, 'use_sma': False, 'use_atr': False, 'use_adx': True, 'use_ema': True, 'use_spike': False, 'rsi_required': False, 'edge_k': 1.864794419912017, 'edge_cap': 0.19577905026502146, 'bull_strategy': 'mean_reversion', 'bull_bb_std_mult': 2.134893282987306, 'bull_rsi_os': 44, 'bull_rsi_ob': 75, 'bull_adx_thresh': 26.0388132402409, 'bull_atr_min_pct': 0.0034461561291036294, 'bull_atr_max_pct': 0.07311129315455106, 'bull_tp_mult': 1.958205742373841, 'bull_tsl_mult': 0.8923208225059294, 'bull_time_stop': 150, 'bull_use_sma': True, 'bull_use_ema': False, 'bull_use_atr': False, 'bull_use_adx': True, 'bull_use_spike': False, 'bull_rsi_required': True, 'bear_strategy': 'breakout', 'bear_bb_std_mult': 3.159029020876769, 'bear_rsi_os': 55, 'bear_rsi_ob': 81, 'bear_adx_thresh': 8.031526413019272, 'bear_atr_min_pct': 0.01590663957897008, 'bear_atr_max_pct': 0.07598889035366685, 'bear_tp_mult': 1.9637357834632678, 'bear_tsl_mult': 0.09080073702187075, 'bear_time_stop': 230, 'bear_use_sma': True, 'bear_use_ema': True, 'bear_use_atr': True, 'bear_use_adx': True, 'bear_use_spike': True, 'bear_rsi_required': False, 'sideways_strategy': 'breakout', 'sideways_bb_std_mult': 1.811775628910972, 'sideways_rsi_os': 30, 'sideways_rsi_ob': 49, 'sideways_adx_thresh': 20.50348256731, 'sideways_atr_min_pct': 0.014508061258763742, 'sideways_atr_max_pct': 0.10942807814831187, 'sideways_tp_mult': 1.9566791849041332, 'sideways_tsl_mult': 0.9965676305931328, 'sideways_time_stop': 23, 'sideways_use_sma': False, 'sideways_use_ema': False, 'sideways_use_atr': False, 'sideways_use_adx': False, 'sideways_use_spike': True, 'sideways_rsi_required': False}.
[I 2025-08-30 18:46:33,287] Trial 91 finished with values: [-0.04633975726492012, 0.04626364575723647] and parameters: {'p_sma': 18, 'p_std': 36, 'p_atr': 12, 'p_adx': 26, 'rsi_period': 12, 'ema1': 21, 'ema2': 30, 'slip_atr_k': 0.14815150952628392, 'slip_spread_k': 0.9122721883795923, 'spread_hl_frac': 0.014503949806128196, 'bb_std_mult': 1.0907143411079745, 'rsi_os': 8, 'rsi_ob': 52, 'vol_spike': 0.2215602302587677, 'adx_thresh': 19.42466204852851, 'atr_min_pct': 0.005722836552276334, 'atr_max_pct': 0.14088216383354082, 'tp_mult': 2.2698473805386903, 'tsl_mult': 0.25430410633256517, 'strategy': 'mean_reversion', 'time_stop': 32, 'use_sma': False, 'use_atr': True, 'use_adx': False, 'use_ema': False, 'use_spike': False, 'rsi_required': True, 'edge_k': 1.4386804389810304, 'edge_cap': 0.3211456068811693, 'bull_strategy': 'breakout', 'bull_bb_std_mult': 3.439435808008418, 'bull_rsi_os': 51, 'bull_rsi_ob': 67, 'bull_adx_thresh': 16.91391589600126, 'bull_atr_min_pct': 0.0031280713731473104, 'bull_atr_max_pct': 0.037974583207418124, 'bull_tp_mult': 2.3749836388235694, 'bull_tsl_mult': 0.9960050070520594, 'bull_time_stop': 73, 'bull_use_sma': True, 'bull_use_ema': False, 'bull_use_atr': False, 'bull_use_adx': True, 'bull_use_spike': True, 'bull_rsi_required': True, 'bear_strategy': 'breakout', 'bear_bb_std_mult': 1.025060867518285, 'bear_rsi_os': 55, 'bear_rsi_ob': 89, 'bear_adx_thresh': 18.87814062618003, 'bear_atr_min_pct': 0.015291772357454169, 'bear_atr_max_pct': 0.11461710404166817, 'bear_tp_mult': 2.1581414070218154, 'bear_tsl_mult': 0.1312263861950885, 'bear_time_stop': 47, 'bear_use_sma': True, 'bear_use_ema': False, 'bear_use_atr': True, 'bear_use_adx': True, 'bear_use_spike': False, 'bear_rsi_required': False, 'sideways_strategy': 'breakout', 'sideways_bb_std_mult': 1.7990798991434926, 'sideways_rsi_os': 15, 'sideways_rsi_ob': 85, 'sideways_adx_thresh': 6.977108540128503, 'sideways_atr_min_pct': 0.0003565964591432467, 'sideways_atr_max_pct': 0.1305480456701018, 'sideways_tp_mult': 2.016452922497924, 'sideways_tsl_mult': 0.6991025052383261, 'sideways_time_stop': 11, 'sideways_use_sma': True, 'sideways_use_ema': True, 'sideways_use_atr': True, 'sideways_use_adx': False, 'sideways_use_spike': True, 'sideways_rsi_required': False}.
[I 2025-08-30 18:47:05,673] Trial 93 finished with values: [-1000000000.0, 1000000000.0] and parameters: {'p_sma': 43, 'p_std': 47, 'p_atr': 12, 'p_adx': 8, 'rsi_period': 79, 'ema1': 21, 'ema2': 10, 'slip_atr_k': 0.14846462724891504, 'slip_spread_k': 0.21919321577627449, 'spread_hl_frac': 0.01387197465973252, 'bb_std_mult': 3.4610855332384682, 'rsi_os': 8, 'rsi_ob': 80, 'vol_spike': 0.07681852923835976, 'adx_thresh': 21.11572164162121, 'atr_min_pct': 0.02358441098256826, 'atr_max_pct': 0.14101933388438853, 'tp_mult': 2.3914866146535854, 'tsl_mult': 0.6354251582776178, 'strategy': 'mean_reversion', 'time_stop': 36, 'use_sma': True, 'use_atr': False, 'use_adx': False, 'use_ema': False, 'use_spike': False, 'rsi_required': True, 'edge_k': 1.4147002874231651, 'edge_cap': 0.8091232940410469, 'bull_strategy': 'mean_reversion', 'bull_bb_std_mult': 1.9533791552605093, 'bull_rsi_os': 50, 'bull_rsi_ob': 66, 'bull_adx_thresh': 16.848767400260392, 'bull_atr_min_pct': 0.005263483775367428, 'bull_atr_max_pct': 0.03623253700140985, 'bull_tp_mult': 2.367177854658621, 'bull_tsl_mult': 0.8583178210177431, 'bull_time_stop': 217, 'bull_use_sma': False, 'bull_use_ema': True, 'bull_use_atr': False, 'bull_use_adx': False, 'bull_use_spike': True, 'bull_rsi_required': True, 'bear_strategy': 'mean_reversion', 'bear_bb_std_mult': 2.88284329704375, 'bear_rsi_os': 12, 'bear_rsi_ob': 86, 'bear_adx_thresh': 18.630906588130742, 'bear_atr_min_pct': 0.015914842481846332, 'bear_atr_max_pct': 0.057501290731576955, 'bear_tp_mult': 2.5723172104189542, 'bear_tsl_mult': 0.12980733657683616, 'bear_time_stop': 156, 'bear_use_sma': True, 'bear_use_ema': True, 'bear_use_atr': True, 'bear_use_adx': True, 'bear_use_spike': False, 'bear_rsi_required': False, 'sideways_strategy': 'mean_reversion', 'sideways_bb_std_mult': 2.2447996525997165, 'sideways_rsi_os': 43, 'sideways_rsi_ob': 65, 'sideways_adx_thresh': 7.013239637031158, 'sideways_atr_min_pct': 0.016632108221695033, 'sideways_atr_max_pct': 0.13109052466478174, 'sideways_tp_mult': 1.9532388062528705, 'sideways_tsl_mult': 0.6870732762106886, 'sideways_time_stop': 291, 'sideways_use_sma': False, 'sideways_use_ema': True, 'sideways_use_atr': True, 'sideways_use_adx': True, 'sideways_use_spike': True, 'sideways_rsi_required': True}.
[I 2025-08-30 18:47:06,448] Trial 94 finished with values: [-1000000000.0, 1000000000.0] and parameters: {'p_sma': 43, 'p_std': 27, 'p_atr': 12, 'p_adx': 9, 'rsi_period': 52, 'ema1': 23, 'ema2': 60, 'slip_atr_k': 0.049214913406516334, 'slip_spread_k': 0.6185868621255816, 'spread_hl_frac': 0.00285599155961129, 'bb_std_mult': 1.6539382698452998, 'rsi_os': 30, 'rsi_ob': 80, 'vol_spike': 0.026069163518100708, 'adx_thresh': 21.506684453685843, 'atr_min_pct': 0.024135839045663878, 'atr_max_pct': 0.026057200122648318, 'tp_mult': 2.0012732471040247, 'tsl_mult': 0.8936682743492393, 'strategy': 'breakout', 'time_stop': 20, 'use_sma': True, 'use_atr': True, 'use_adx': False, 'use_ema': False, 'use_spike': True, 'rsi_required': True, 'edge_k': 1.235276786552022, 'edge_cap': 0.389864334033828, 'bull_strategy': 'mean_reversion', 'bull_bb_std_mult': 1.9956558468659251, 'bull_rsi_os': 50, 'bull_rsi_ob': 73, 'bull_adx_thresh': 21.75358220224962, 'bull_atr_min_pct': 0.0021240452226432855, 'bull_atr_max_pct': 0.030234441237764767, 'bull_tp_mult': 2.3509801646204345, 'bull_tsl_mult': 0.9878198717416525, 'bull_time_stop': 219, 'bull_use_sma': False, 'bull_use_ema': True, 'bull_use_atr': True, 'bull_use_adx': False, 'bull_use_spike': True, 'bull_rsi_required': True, 'bear_strategy': 'mean_reversion', 'bear_bb_std_mult': 3.4791067733316496, 'bear_rsi_os': 27, 'bear_rsi_ob': 85, 'bear_adx_thresh': 19.010297654353046, 'bear_atr_min_pct': 0.015544302470042919, 'bear_atr_max_pct': 0.05700614441978468, 'bear_tp_mult': 2.6031195019473685, 'bear_tsl_mult': 0.13868035229991899, 'bear_time_stop': 29, 'bear_use_sma': True, 'bear_use_ema': True, 'bear_use_atr': True, 'bear_use_adx': True, 'bear_use_spike': False, 'bear_rsi_required': False, 'sideways_strategy': 'mean_reversion', 'sideways_bb_std_mult': 1.9832968536634445, 'sideways_rsi_os': 48, 'sideways_rsi_ob': 95, 'sideways_adx_thresh': 7.191956198566294, 'sideways_atr_min_pct': 0.016701717613570116, 'sideways_atr_max_pct': 0.13161759228557446, 'sideways_tp_mult': 1.7574228736907758, 'sideways_tsl_mult': 0.6436674679574366, 'sideways_time_stop': 289, 'sideways_use_sma': False, 'sideways_use_ema': True, 'sideways_use_atr': True, 'sideways_use_adx': True, 'sideways_use_spike': False, 'sideways_rsi_required': True}.
[I 2025-08-30 18:47:06,677] Trial 92 finished with values: [-1000000000.0, 1000000000.0] and parameters: {'p_sma': 43, 'p_std': 53, 'p_atr': 12, 'p_adx': 11, 'rsi_period': 72, 'ema1': 21, 'ema2': 30, 'slip_atr_k': 0.005845126020037823, 'slip_spread_k': 0.7992539146316229, 'spread_hl_frac': 0.0031139778986485874, 'bb_std_mult': 1.7768426506105839, 'rsi_os': 23, 'rsi_ob': 52, 'vol_spike': 0.026525625238713962, 'adx_thresh': 21.285647597996963, 'atr_min_pct': 0.023712688469620123, 'atr_max_pct': 0.12008229576531917, 'tp_mult': 1.4542533855211999, 'tsl_mult': 0.6324768027859838, 'strategy': 'mean_reversion', 'time_stop': 23, 'use_sma': False, 'use_atr': False, 'use_adx': False, 'use_ema': False, 'use_spike': False, 'rsi_required': True, 'edge_k': 1.3472543796185044, 'edge_cap': 0.3198068015620994, 'bull_strategy': 'mean_reversion', 'bull_bb_std_mult': 2.247041775637207, 'bull_rsi_os': 50, 'bull_rsi_ob': 67, 'bull_adx_thresh': 24.468161378286414, 'bull_atr_min_pct': 0.00501468797547651, 'bull_atr_max_pct': 0.036970376634217414, 'bull_tp_mult': 2.3666330901423565, 'bull_tsl_mult': 0.8608030041941851, 'bull_time_stop': 138, 'bull_use_sma': False, 'bull_use_ema': False, 'bull_use_atr': False, 'bull_use_adx': False, 'bull_use_spike': True, 'bull_rsi_required': True, 'bear_strategy': 'breakout', 'bear_bb_std_mult': 2.7985297189955767, 'bear_rsi_os': 55, 'bear_rsi_ob': 60, 'bear_adx_thresh': 5.499057712931096, 'bear_atr_min_pct': 0.02395623686849355, 'bear_atr_max_pct': 0.11522547090782949, 'bear_tp_mult': 2.6341513543491795, 'bear_tsl_mult': 0.9118406641186162, 'bear_time_stop': 229, 'bear_use_sma': True, 'bear_use_ema': True, 'bear_use_atr': True, 'bear_use_adx': True, 'bear_use_spike': False, 'bear_rsi_required': False, 'sideways_strategy': 'mean_reversion', 'sideways_bb_std_mult': 1.7804601536502158, 'sideways_rsi_os': 15, 'sideways_rsi_ob': 94, 'sideways_adx_thresh': 7.065429909673441, 'sideways_atr_min_pct': 0.005375344619270264, 'sideways_atr_max_pct': 0.09146898233152942, 'sideways_tp_mult': 1.946717066400545, 'sideways_tsl_mult': 0.7066230077468421, 'sideways_time_stop': 11, 'sideways_use_sma': False, 'sideways_use_ema': True, 'sideways_use_atr': True, 'sideways_use_adx': True, 'sideways_use_spike': True, 'sideways_rsi_required': True}.
[I 2025-08-30 18:47:07,057] Trial 95 finished with values: [-1000000000.0, 1000000000.0] and parameters: {'p_sma': 43, 'p_std': 27, 'p_atr': 23, 'p_adx': 9, 'rsi_period': 52, 'ema1': 23, 'ema2': 39, 'slip_atr_k': 0.12319360051737516, 'slip_spread_k': 0.8076286498781773, 'spread_hl_frac': 0.0029653411217036847, 'bb_std_mult': 1.759706421930132, 'rsi_os': 30, 'rsi_ob': 83, 'vol_spike': 0.023436881434419438, 'adx_thresh': 21.399404781085806, 'atr_min_pct': 0.025388672272445453, 'atr_max_pct': 0.02580812200686973, 'tp_mult': 2.076747889631957, 'tsl_mult': 0.8990821460429157, 'strategy': 'breakout', 'time_stop': 20, 'use_sma': True, 'use_atr': True, 'use_adx': False, 'use_ema': False, 'use_spike': True, 'rsi_required': True, 'edge_k': 0.05293877175103853, 'edge_cap': 0.3906044117529224, 'bull_strategy': 'mean_reversion', 'bull_bb_std_mult': 1.9782828407207698, 'bull_rsi_os': 49, 'bull_rsi_ob': 73, 'bull_adx_thresh': 27.75663636424422, 'bull_atr_min_pct': 0.0017584295070198755, 'bull_atr_max_pct': 0.0299000555893999, 'bull_tp_mult': 2.274803446254908, 'bull_tsl_mult': 0.8588852567771583, 'bull_time_stop': 217, 'bull_use_sma': False, 'bull_use_ema': True, 'bull_use_atr': True, 'bull_use_adx': False, 'bull_use_spike': True, 'bull_rsi_required': False, 'bear_strategy': 'mean_reversion', 'bear_bb_std_mult': 2.809978921316058, 'bear_rsi_os': 26, 'bear_rsi_ob': 85, 'bear_adx_thresh': 9.800110599104038, 'bear_atr_min_pct': 0.013759168744291625, 'bear_atr_max_pct': 0.0586621383660387, 'bear_tp_mult': 1.743454854533259, 'bear_tsl_mult': 0.818385736468224, 'bear_time_stop': 155, 'bear_use_sma': True, 'bear_use_ema': True, 'bear_use_atr': True, 'bear_use_adx': True, 'bear_use_spike': False, 'bear_rsi_required': False, 'sideways_strategy': 'mean_reversion', 'sideways_bb_std_mult': 2.240390796794368, 'sideways_rsi_os': 12, 'sideways_rsi_ob': 60, 'sideways_adx_thresh': 14.262196970875607, 'sideways_atr_min_pct': 0.016640724300506945, 'sideways_atr_max_pct': 0.135139619103255, 'sideways_tp_mult': 1.7802368068222243, 'sideways_tsl_mult': 0.7580047366803886, 'sideways_time_stop': 254, 'sideways_use_sma': False, 'sideways_use_ema': True, 'sideways_use_atr': True, 'sideways_use_adx': True, 'sideways_use_spike': False, 'sideways_rsi_required': True}.
[I 2025-08-30 18:47:38,220] Trial 96 finished with values: [-0.019621369740821515, 0.01954866363630149] and parameters: {'p_sma': 42, 'p_std': 26, 'p_atr': 10, 'p_adx': 9, 'rsi_period': 52, 'ema1': 25, 'ema2': 49, 'slip_atr_k': 0.05221189215061642, 'slip_spread_k': 0.7892754147237235, 'spread_hl_frac': 0.005549014518052374, 'bb_std_mult': 0.8557850240598064, 'rsi_os': 23, 'rsi_ob': 82, 'vol_spike': 0.02690897396210986, 'adx_thresh': 21.705483753180275, 'atr_min_pct': 0.021082645311273813, 'atr_max_pct': 0.11929325080681807, 'tp_mult': 1.9980662529316284, 'tsl_mult': 0.8728514233881948, 'strategy': 'breakout', 'time_stop': 283, 'use_sma': False, 'use_atr': True, 'use_adx': False, 'use_ema': False, 'use_spike': True, 'rsi_required': True, 'edge_k': 0.07543620894353886, 'edge_cap': 0.577435357049686, 'bull_strategy': 'mean_reversion', 'bull_bb_std_mult': 1.9997981750656868, 'bull_rsi_os': 53, 'bull_rsi_ob': 72, 'bull_adx_thresh': 24.518291289031463, 'bull_atr_min_pct': 0.002027991417615028, 'bull_atr_max_pct': 0.028915054617719663, 'bull_tp_mult': 2.4533618154895716, 'bull_tsl_mult': 0.2008305608426234, 'bull_time_stop': 136, 'bull_use_sma': True, 'bull_use_ema': False, 'bull_use_atr': True, 'bull_use_adx': False, 'bull_use_spike': True, 'bull_rsi_required': False, 'bear_strategy': 'breakout', 'bear_bb_std_mult': 0.7066572868786698, 'bear_rsi_os': 28, 'bear_rsi_ob': 85, 'bear_adx_thresh': 21.213488092608678, 'bear_atr_min_pct': 0.013925129379170034, 'bear_atr_max_pct': 0.05098402546228056, 'bear_tp_mult': 1.7565813346481896, 'bear_tsl_mult': 0.00026664496516461134, 'bear_time_stop': 33, 'bear_use_sma': True, 'bear_use_ema': False, 'bear_use_atr': True, 'bear_use_adx': True, 'bear_use_spike': False, 'bear_rsi_required': False, 'sideways_strategy': 'mean_reversion', 'sideways_bb_std_mult': 2.000628161666294, 'sideways_rsi_os': 39, 'sideways_rsi_ob': 61, 'sideways_adx_thresh': 5.683545491267015, 'sideways_atr_min_pct': 0.02966991546000436, 'sideways_atr_max_pct': 0.015782634972066195, 'sideways_tp_mult': 1.7258882309441104, 'sideways_tsl_mult': 0.6403988980822255, 'sideways_time_stop': 254, 'sideways_use_sma': True, 'sideways_use_ema': True, 'sideways_use_atr': False, 'sideways_use_adx': False, 'sideways_use_spike': False, 'sideways_rsi_required': False}.
[I 2025-08-30 18:47:39,103] Trial 97 finished with values: [-1000000000.0, 1000000000.0] and parameters: {'p_sma': 35, 'p_std': 23, 'p_atr': 10, 'p_adx': 23, 'rsi_period': 29, 'ema1': 25, 'ema2': 49, 'slip_atr_k': 0.024620000532299884, 'slip_spread_k': 0.44470809592093746, 'spread_hl_frac': 0.0061931063339147555, 'bb_std_mult': 0.9722105050376265, 'rsi_os': 14, 'rsi_ob': 66, 'vol_spike': 0.18801775720865765, 'adx_thresh': 15.646836227179072, 'atr_min_pct': 0.025487390970986925, 'atr_max_pct': 0.12110875179846164, 'tp_mult': 2.176498921697504, 'tsl_mult': 0.6037541564789661, 'strategy': 'breakout', 'time_stop': 187, 'use_sma': False, 'use_atr': True, 'use_adx': False, 'use_ema': False, 'use_spike': True, 'rsi_required': True, 'edge_k': 0.070013167578786, 'edge_cap': 0.5714139531635878, 'bull_strategy': 'mean_reversion', 'bull_bb_std_mult': 2.4287543803571556, 'bull_rsi_os': 37, 'bull_rsi_ob': 89, 'bull_adx_thresh': 24.775080005641247, 'bull_atr_min_pct': 0.014309564973124031, 'bull_atr_max_pct': 0.02236292453763613, 'bull_tp_mult': 2.4492913061556445, 'bull_tsl_mult': 0.9138815416632661, 'bull_time_stop': 187, 'bull_use_sma': True, 'bull_use_ema': False, 'bull_use_atr': True, 'bull_use_adx': True, 'bull_use_spike': True, 'bull_rsi_required': False, 'bear_strategy': 'breakout', 'bear_bb_std_mult': 1.4599540753525067, 'bear_rsi_os': 9, 'bear_rsi_ob': 80, 'bear_adx_thresh': 7.375497778532374, 'bear_atr_min_pct': 0.014195586619314844, 'bear_atr_max_pct': 0.05155022613135816, 'bear_tp_mult': 2.336243737914845, 'bear_tsl_mult': 0.8071170232354288, 'bear_time_stop': 36, 'bear_use_sma': False, 'bear_use_ema': False, 'bear_use_atr': True, 'bear_use_adx': True, 'bear_use_spike': False, 'bear_rsi_required': False, 'sideways_strategy': 'breakout', 'sideways_bb_std_mult': 1.715361420733577, 'sideways_rsi_os': 12, 'sideways_rsi_ob': 60, 'sideways_adx_thresh': 5.633140296699169, 'sideways_atr_min_pct': 0.02381167545453547, 'sideways_atr_max_pct': 0.1356373690733621, 'sideways_tp_mult': 1.7186647660989118, 'sideways_tsl_mult': 0.5603070588117454, 'sideways_time_stop': 279, 'sideways_use_sma': True, 'sideways_use_ema': True, 'sideways_use_atr': False, 'sideways_use_adx': False, 'sideways_use_spike': False, 'sideways_rsi_required': False}.
[I 2025-08-30 18:47:39,183] Trial 99 finished with values: [-0.0228945624780319, 0.02281586549135197] and parameters: {'p_sma': 35, 'p_std': 23, 'p_atr': 10, 'p_adx': 8, 'rsi_period': 22, 'ema1': 25, 'ema2': 20, 'slip_atr_k': 0.023944382178276016, 'slip_spread_k': 0.4432840419326519, 'spread_hl_frac': 0.005411095420231337, 'bb_std_mult': 0.9617812555753151, 'rsi_os': 17, 'rsi_ob': 58, 'vol_spike': 0.17443120889084776, 'adx_thresh': 23.936454776368308, 'atr_min_pct': 0.021077505087217143, 'atr_max_pct': 0.13626435469700932, 'tp_mult': 2.186317329691484, 'tsl_mult': 0.6733936101000045, 'strategy': 'breakout', 'time_stop': 48, 'use_sma': False, 'use_atr': True, 'use_adx': False, 'use_ema': False, 'use_spike': True, 'rsi_required': True, 'edge_k': 0.1415844381969229, 'edge_cap': 0.2649994293228409, 'bull_strategy': 'breakout', 'bull_bb_std_mult': 1.8836806476695842, 'bull_rsi_os': 13, 'bull_rsi_ob': 80, 'bull_adx_thresh': 24.791088427786466, 'bull_atr_min_pct': 0.001075336171150187, 'bull_atr_max_pct': 0.022322294081368238, 'bull_tp_mult': 2.205962551909325, 'bull_tsl_mult': 0.5841675855252493, 'bull_time_stop': 120, 'bull_use_sma': True, 'bull_use_ema': False, 'bull_use_atr': False, 'bull_use_adx': True, 'bull_use_spike': True, 'bull_rsi_required': False, 'bear_strategy': 'breakout', 'bear_bb_std_mult': 0.7447087747394121, 'bear_rsi_os': 8, 'bear_rsi_ob': 68, 'bear_adx_thresh': 24.859425362859024, 'bear_atr_min_pct': 0.021022604222188566, 'bear_atr_max_pct': 0.05081458934545824, 'bear_tp_mult': 2.318535512259146, 'bear_tsl_mult': 0.22370658699277213, 'bear_time_stop': 36, 'bear_use_sma': False, 'bear_use_ema': False, 'bear_use_atr': True, 'bear_use_adx': True, 'bear_use_spike': False, 'bear_rsi_required': True, 'sideways_strategy': 'breakout', 'sideways_bb_std_mult': 1.5042684241017206, 'sideways_rsi_os': 23, 'sideways_rsi_ob': 55, 'sideways_adx_thresh': 9.517672376316717, 'sideways_atr_min_pct': 0.012901888526585865, 'sideways_atr_max_pct': 0.068194326065149, 'sideways_tp_mult': 2.383559218761819, 'sideways_tsl_mult': 0.5134512530130899, 'sideways_time_stop': 272, 'sideways_use_sma': True, 'sideways_use_ema': True, 'sideways_use_atr': False, 'sideways_use_adx': False, 'sideways_use_spike': False, 'sideways_rsi_required': False}.
