[I 2025-08-30 19:20:51,873] Trial 353 finished with values: [-1000000000.0, 1000000000.0] and parameters: {'p_sma': 35, 'p_std': 52, 'p_atr': 20, 'p_adx': 7, 'rsi_period': 46, 'ema1': 25, 'ema2': 35, 'slip_atr_k': 0.0320364513883754, 'slip_spread_k': 0.3716272664159285, 'spread_hl_frac': 0.04739817841648605, 'bb_std_mult': 1.0334933293144324, 'rsi_os': 54, 'rsi_ob': 54, 'vol_spike': 0.21924083935352023, 'adx_thresh': 28.587588017803675, 'atr_min_pct': 0.023539473351500907, 'atr_max_pct': 0.14210791823055527, 'tp_mult': 2.1916195524544446, 'tsl_mult': 0.48752485079720814, 'strategy': 'mean_reversion', 'time_stop': 122, 'use_sma': True, 'use_atr': False, 'use_adx': False, 'use_ema': False, 'use_spike': False, 'rsi_required': False, 'edge_k': 0.11066603051956711, 'edge_cap': 0.7327513257502754, 'bull_strategy': 'breakout', 'bull_bb_std_mult': 2.357694415855598, 'bull_rsi_os': 50, 'bull_rsi_ob': 50, 'bull_adx_thresh': 25.7442325576055, 'bull_atr_min_pct': 0.0016193555390361146, 'bull_atr_max_pct': 0.11307951754766017, 'bull_tp_mult': 2.229365648661759, 'bull_tsl_mult': 0.9603008369288683, 'bull_time_stop': 35, 'bull_use_sma': False, 'bull_use_ema': False, 'bull_use_atr': False, 'bull_use_adx': False, 'bull_use_spike': False, 'bull_rsi_required': False, 'bear_strategy': 'mean_reversion', 'bear_bb_std_mult': 0.5776148218236854, 'bear_rsi_os': 27, 'bear_rsi_ob': 84, 'bear_adx_thresh': 5.40851440834113, 'bear_atr_min_pct': 0.016730943668665777, 'bear_atr_max_pct': 0.05356834664474347, 'bear_tp_mult': 1.8601897436544763, 'bear_tsl_mult': 0.08273634097347765, 'bear_time_stop': 198, 'bear_use_sma': True, 'bear_use_ema': False, 'bear_use_atr': False, 'bear_use_adx': False, 'bear_use_spike': False, 'bear_rsi_required': True, 'sideways_strategy': 'breakout', 'sideways_bb_std_mult': 1.4063794228586106, 'sideways_rsi_os': 16, 'sideways_rsi_ob': 55, 'sideways_adx_thresh': 11.233443943507435, 'sideways_atr_min_pct': 0.02018795126627675, 'sideways_atr_max_pct': 0.10201462843254451, 'sideways_tp_mult': 1.2395312697975456, 'sideways_tsl_mult': 0.6364678113587309, 'sideways_time_stop': 269, 'sideways_use_sma': False, 'sideways_use_ema': True, 'sideways_use_atr': True, 'sideways_use_adx': True, 'sideways_use_spike': False, 'sideways_rsi_required': False}.
[I 2025-08-30 19:21:24,781] Trial 351 finished with values: [-1000000000.0, 1000000000.0] and parameters: {'p_sma': 36, 'p_std': 57, 'p_atr': 20, 'p_adx': 12, 'rsi_period': 46, 'ema1': 30, 'ema2': 44, 'slip_atr_k': 0.0214485905435145, 'slip_spread_k': 0.4566915064672509, 'spread_hl_frac': 0.003594594764195719, 'bb_std_mult': 0.7887425387732749, 'rsi_os': 28, 'rsi_ob': 78, 'vol_spike': 0.16594289704067805, 'adx_thresh': 22.12433511296447, 'atr_min_pct': 0.02654981172255349, 'atr_max_pct': 0.06483818531748867, 'tp_mult': 2.088288910925653, 'tsl_mult': 0.41968585436033506, 'strategy': 'breakout', 'time_stop': 32, 'use_sma': False, 'use_atr': True, 'use_adx': False, 'use_ema': False, 'use_spike': False, 'rsi_required': True, 'edge_k': 0.0610340807054105, 'edge_cap': 0.29801210113948695, 'bull_strategy': 'mean_reversion', 'bull_bb_std_mult': 1.0696806433140011, 'bull_rsi_os': 27, 'bull_rsi_ob': 72, 'bull_adx_thresh': 25.63813942462478, 'bull_atr_min_pct': 0.005216377712084719, 'bull_atr_max_pct': 0.13327813075197212, 'bull_tp_mult': 2.2324742017270642, 'bull_tsl_mult': 0.505061815478567, 'bull_time_stop': 175, 'bull_use_sma': False, 'bull_use_ema': False, 'bull_use_atr': True, 'bull_use_adx': True, 'bull_use_spike': False, 'bull_rsi_required': True, 'bear_strategy': 'mean_reversion', 'bear_bb_std_mult': 1.915219120669303, 'bear_rsi_os': 43, 'bear_rsi_ob': 95, 'bear_adx_thresh': 5.503843707420002, 'bear_atr_min_pct': 0.016534930304329794, 'bear_atr_max_pct': 0.05399716048425939, 'bear_tp_mult': 1.8545961471586947, 'bear_tsl_mult': 0.08875032516986583, 'bear_time_stop': 198, 'bear_use_sma': True, 'bear_use_ema': True, 'bear_use_atr': False, 'bear_use_adx': False, 'bear_use_spike': False, 'bear_rsi_required': True, 'sideways_strategy': 'mean_reversion', 'sideways_bb_std_mult': 2.321701808511074, 'sideways_rsi_os': 12, 'sideways_rsi_ob': 55, 'sideways_adx_thresh': 11.25557579981174, 'sideways_atr_min_pct': 0.020269470562418672, 'sideways_atr_max_pct': 0.08955401470994784, 'sideways_tp_mult': 1.1952781785795967, 'sideways_tsl_mult': 0.5465890935859968, 'sideways_time_stop': 11, 'sideways_use_sma': False, 'sideways_use_ema': True, 'sideways_use_atr': True, 'sideways_use_adx': True, 'sideways_use_spike': False, 'sideways_rsi_required': False}.
[I 2025-08-30 19:21:25,140] Trial 354 finished with values: [-1000000000.0, 1000000000.0] and parameters: {'p_sma': 36, 'p_std': 27, 'p_atr': 20, 'p_adx': 7, 'rsi_period': 25, 'ema1': 14, 'ema2': 18, 'slip_atr_k': 0.03210004513798463, 'slip_spread_k': 0.45564000730436316, 'spread_hl_frac': 0.04784184437367242, 'bb_std_mult': 2.9178409613934155, 'rsi_os': 28, 'rsi_ob': 59, 'vol_spike': 0.1352709197403983, 'adx_thresh': 13.311721316216705, 'atr_min_pct': 0.023622381705730233, 'atr_max_pct': 0.08780348046995073, 'tp_mult': 2.1855628878636897, 'tsl_mult': 0.5440690439128477, 'strategy': 'mean_reversion', 'time_stop': 32, 'use_sma': True, 'use_atr': False, 'use_adx': False, 'use_ema': False, 'use_spike': False, 'rsi_required': False, 'edge_k': 0.2174358062469877, 'edge_cap': 0.15777823342575448, 'bull_strategy': 'breakout', 'bull_bb_std_mult': 1.7588301081120647, 'bull_rsi_os': 29, 'bull_rsi_ob': 75, 'bull_adx_thresh': 25.730408655236836, 'bull_atr_min_pct': 0.01558001028856091, 'bull_atr_max_pct': 0.022535531892710618, 'bull_tp_mult': 2.240786382392928, 'bull_tsl_mult': 0.9622861945982044, 'bull_time_stop': 101, 'bull_use_sma': False, 'bull_use_ema': False, 'bull_use_atr': False, 'bull_use_adx': False, 'bull_use_spike': False, 'bull_rsi_required': False, 'bear_strategy': 'mean_reversion', 'bear_bb_std_mult': 3.3232747746400215, 'bear_rsi_os': 43, 'bear_rsi_ob': 95, 'bear_adx_thresh': 5.091057430812062, 'bear_atr_min_pct': 0.01668643385750134, 'bear_atr_max_pct': 0.0955339476016654, 'bear_tp_mult': 1.857114054141184, 'bear_tsl_mult': 0.08803053642737127, 'bear_time_stop': 107, 'bear_use_sma': True, 'bear_use_ema': False, 'bear_use_atr': False, 'bear_use_adx': False, 'bear_use_spike': False, 'bear_rsi_required': True, 'sideways_strategy': 'breakout', 'sideways_bb_std_mult': 3.188207059271048, 'sideways_rsi_os': 16, 'sideways_rsi_ob': 82, 'sideways_adx_thresh': 6.818817651850468, 'sideways_atr_min_pct': 0.02027955405983345, 'sideways_atr_max_pct': 0.10154662901813458, 'sideways_tp_mult': 1.8693713040564481, 'sideways_tsl_mult': 0.025919372826576526, 'sideways_time_stop': 220, 'sideways_use_sma': False, 'sideways_use_ema': True, 'sideways_use_atr': True, 'sideways_use_adx': True, 'sideways_use_spike': False, 'sideways_rsi_required': False}.
[I 2025-08-30 19:21:26,102] Trial 352 finished with values: [-1000000000.0, 1000000000.0] and parameters: {'p_sma': 36, 'p_std': 13, 'p_atr': 20, 'p_adx': 17, 'rsi_period': 45, 'ema1': 11, 'ema2': 44, 'slip_atr_k': 0.032709443024364904, 'slip_spread_k': 0.019690331124062266, 'spread_hl_frac': 0.04769404011536511, 'bb_std_mult': 0.7819930633680587, 'rsi_os': 34, 'rsi_ob': 78, 'vol_spike': 0.18536090971226937, 'adx_thresh': 28.34897949954331, 'atr_min_pct': 0.026734236518010004, 'atr_max_pct': 0.06654737394436547, 'tp_mult': 2.104355475373345, 'tsl_mult': 0.41620136433642657, 'strategy': 'breakout', 'time_stop': 190, 'use_sma': False, 'use_atr': True, 'use_adx': False, 'use_ema': False, 'use_spike': False, 'rsi_required': True, 'edge_k': 0.9328302677223724, 'edge_cap': 0.2922478992152431, 'bull_strategy': 'mean_reversion', 'bull_bb_std_mult': 1.7795587637894157, 'bull_rsi_os': 51, 'bull_rsi_ob': 63, 'bull_adx_thresh': 24.897771678272253, 'bull_atr_min_pct': 0.015893972029135332, 'bull_atr_max_pct': 0.023160760149641607, 'bull_tp_mult': 2.2392230429080464, 'bull_tsl_mult': 0.9622357331483019, 'bull_time_stop': 175, 'bull_use_sma': False, 'bull_use_ema': False, 'bull_use_atr': True, 'bull_use_adx': True, 'bull_use_spike': False, 'bull_rsi_required': True, 'bear_strategy': 'mean_reversion', 'bear_bb_std_mult': 3.019842259263321, 'bear_rsi_os': 27, 'bear_rsi_ob': 76, 'bear_adx_thresh': 13.022062231823526, 'bear_atr_min_pct': 0.016471407317439304, 'bear_atr_max_pct': 0.053428551583731436, 'bear_tp_mult': 1.803546003875342, 'bear_tsl_mult': 0.08938161635082477, 'bear_time_stop': 108, 'bear_use_sma': True, 'bear_use_ema': True, 'bear_use_atr': False, 'bear_use_adx': False, 'bear_use_spike': False, 'bear_rsi_required': True, 'sideways_strategy': 'mean_reversion', 'sideways_bb_std_mult': 1.0703474616916226, 'sideways_rsi_os': 12, 'sideways_rsi_ob': 64, 'sideways_adx_thresh': 19.563821433857925, 'sideways_atr_min_pct': 0.01936899923556459, 'sideways_atr_max_pct': 0.10204048489490444, 'sideways_tp_mult': 2.8424208359520264, 'sideways_tsl_mult': 0.020676833076105627, 'sideways_time_stop': 261, 'sideways_use_sma': False, 'sideways_use_ema': True, 'sideways_use_atr': True, 'sideways_use_adx': True, 'sideways_use_spike': False, 'sideways_rsi_required': False}.
[I 2025-08-30 19:21:26,954] Trial 355 finished with values: [-1000000000.0, 1000000000.0] and parameters: {'p_sma': 12, 'p_std': 57, 'p_atr': 18, 'p_adx': 17, 'rsi_period': 53, 'ema1': 23, 'ema2': 18, 'slip_atr_k': 0.04707728345384983, 'slip_spread_k': 0.45484758689135774, 'spread_hl_frac': 0.003634225633314876, 'bb_std_mult': 0.80916347622798, 'rsi_os': 34, 'rsi_ob': 59, 'vol_spike': 0.18321242202777396, 'adx_thresh': 19.47796783516535, 'atr_min_pct': 0.010611031793249313, 'atr_max_pct': 0.1306358268970368, 'tp_mult': 2.6048579583501024, 'tsl_mult': 0.5361904909445334, 'strategy': 'breakout', 'time_stop': 31, 'use_sma': False, 'use_atr': True, 'use_adx': False, 'use_ema': False, 'use_spike': False, 'rsi_required': True, 'edge_k': 0.21340479324986128, 'edge_cap': 0.2398208492772939, 'bull_strategy': 'mean_reversion', 'bull_bb_std_mult': 1.7790397492029406, 'bull_rsi_os': 51, 'bull_rsi_ob': 72, 'bull_adx_thresh': 5.683695943405942, 'bull_atr_min_pct': 0.0005339548035011251, 'bull_atr_max_pct': 0.01848460053040906, 'bull_tp_mult': 2.171438164567859, 'bull_tsl_mult': 0.1324268800910962, 'bull_time_stop': 239, 'bull_use_sma': False, 'bull_use_ema': False, 'bull_use_atr': False, 'bull_use_adx': True, 'bull_use_spike': True, 'bull_rsi_required': True, 'bear_strategy': 'mean_reversion', 'bear_bb_std_mult': 3.3314037684271054, 'bear_rsi_os': 45, 'bear_rsi_ob': 60, 'bear_adx_thresh': 23.517529802302207, 'bear_atr_min_pct': 0.02860272024336294, 'bear_atr_max_pct': 0.12072319145960395, 'bear_tp_mult': 1.785494036771326, 'bear_tsl_mult': 0.14337306002656483, 'bear_time_stop': 278, 'bear_use_sma': True, 'bear_use_ema': False, 'bear_use_atr': False, 'bear_use_adx': False, 'bear_use_spike': False, 'bear_rsi_required': True, 'sideways_strategy': 'mean_reversion', 'sideways_bb_std_mult': 1.8182673430360254, 'sideways_rsi_os': 13, 'sideways_rsi_ob': 82, 'sideways_adx_thresh': 9.291631684017805, 'sideways_atr_min_pct': 0.01928082436973923, 'sideways_atr_max_pct': 0.12256505492041483, 'sideways_tp_mult': 2.090435716147825, 'sideways_tsl_mult': 0.4312755625318319, 'sideways_time_stop': 253, 'sideways_use_sma': True, 'sideways_use_ema': True, 'sideways_use_atr': True, 'sideways_use_adx': True, 'sideways_use_spike': False, 'sideways_rsi_required': False}.
[I 2025-08-30 19:22:03,559] Trial 357 finished with values: [-1000000000.0, 1000000000.0] and parameters: {'p_sma': 51, 'p_std': 28, 'p_atr': 10, 'p_adx': 17, 'rsi_period': 53, 'ema1': 9, 'ema2': 58, 'slip_atr_k': 0.012475032056600305, 'slip_spread_k': 0.4318179724584467, 'spread_hl_frac': 0.0045703186260896535, 'bb_std_mult': 1.19580194917777, 'rsi_os': 37, 'rsi_ob': 57, 'vol_spike': 0.1962513074907186, 'adx_thresh': 19.59280444290242, 'atr_min_pct': 0.022709661430529108, 'atr_max_pct': 0.12362036018674842, 'tp_mult': 2.6125250151047466, 'tsl_mult': 0.7700343642106563, 'strategy': 'breakout', 'time_stop': 198, 'use_sma': False, 'use_atr': True, 'use_adx': True, 'use_ema': True, 'use_spike': True, 'rsi_required': True, 'edge_k': 0.9147958070310621, 'edge_cap': 0.24020109235016618, 'bull_strategy': 'mean_reversion', 'bull_bb_std_mult': 3.49168409309208, 'bull_rsi_os': 51, 'bull_rsi_ob': 63, 'bull_adx_thresh': 25.215893142152616, 'bull_atr_min_pct': 0.01944871060478834, 'bull_atr_max_pct': 0.023927244905689832, 'bull_tp_mult': 2.1726864523585743, 'bull_tsl_mult': 0.1602424436517637, 'bull_time_stop': 24, 'bull_use_sma': True, 'bull_use_ema': False, 'bull_use_atr': False, 'bull_use_adx': True, 'bull_use_spike': True, 'bull_rsi_required': True, 'bear_strategy': 'breakout', 'bear_bb_std_mult': 3.1906446000267947, 'bear_rsi_os': 45, 'bear_rsi_ob': 51, 'bear_adx_thresh': 22.82834831368919, 'bear_atr_min_pct': 0.028186091381404686, 'bear_atr_max_pct': 0.05038138821678227, 'bear_tp_mult': 1.617251964025265, 'bear_tsl_mult': 0.7614216800118593, 'bear_time_stop': 55, 'bear_use_sma': False, 'bear_use_ema': False, 'bear_use_atr': True, 'bear_use_adx': True, 'bear_use_spike': False, 'bear_rsi_required': False, 'sideways_strategy': 'breakout', 'sideways_bb_std_mult': 1.9837159668677387, 'sideways_rsi_os': 35, 'sideways_rsi_ob': 64, 'sideways_adx_thresh': 20.505954899306367, 'sideways_atr_min_pct': 0.015003459958575233, 'sideways_atr_max_pct': 0.06127269600545694, 'sideways_tp_mult': 1.9308646428508487, 'sideways_tsl_mult': 0.6688228556159769, 'sideways_time_stop': 288, 'sideways_use_sma': True, 'sideways_use_ema': False, 'sideways_use_atr': False, 'sideways_use_adx': False, 'sideways_use_spike': False, 'sideways_rsi_required': False}.
[I 2025-08-30 19:22:04,067] Trial 358 finished with values: [-1000000000.0, 1000000000.0] and parameters: {'p_sma': 6, 'p_std': 42, 'p_atr': 18, 'p_adx': 25, 'rsi_period': 54, 'ema1': 25, 'ema2': 17, 'slip_atr_k': 0.010720518213396396, 'slip_spread_k': 0.4318548486536853, 'spread_hl_frac': 0.04189022028216863, 'bb_std_mult': 3.400182759959913, 'rsi_os': 37, 'rsi_ob': 57, 'vol_spike': 0.23699425859996062, 'adx_thresh': 19.69310349318621, 'atr_min_pct': 0.028383719286750663, 'atr_max_pct': 0.1304649968600626, 'tp_mult': 2.1424645014535413, 'tsl_mult': 0.7581298499300357, 'strategy': 'breakout', 'time_stop': 36, 'use_sma': False, 'use_atr': True, 'use_adx': True, 'use_ema': True, 'use_spike': True, 'rsi_required': True, 'edge_k': 0.1194015553392164, 'edge_cap': 0.23562727165700506, 'bull_strategy': 'mean_reversion', 'bull_bb_std_mult': 1.9309557448181889, 'bull_rsi_os': 53, 'bull_rsi_ob': 90, 'bull_adx_thresh': 27.40985486630926, 'bull_atr_min_pct': 0.019601073046284393, 'bull_atr_max_pct': 0.028611841902031258, 'bull_tp_mult': 2.087503509342261, 'bull_tsl_mult': 0.16552222900539737, 'bull_time_stop': 263, 'bull_use_sma': True, 'bull_use_ema': False, 'bull_use_atr': False, 'bull_use_adx': True, 'bull_use_spike': True, 'bull_rsi_required': True, 'bear_strategy': 'breakout', 'bear_bb_std_mult': 3.3200729882661935, 'bear_rsi_os': 42, 'bear_rsi_ob': 73, 'bear_adx_thresh': 26.443978407236038, 'bear_atr_min_pct': 0.014498080799508619, 'bear_atr_max_pct': 0.11990323088131785, 'bear_tp_mult': 1.6329101449815613, 'bear_tsl_mult': 0.14475617988154482, 'bear_time_stop': 52, 'bear_use_sma': False, 'bear_use_ema': False, 'bear_use_atr': True, 'bear_use_adx': True, 'bear_use_spike': False, 'bear_rsi_required': False, 'sideways_strategy': 'breakout', 'sideways_bb_std_mult': 2.114571454265872, 'sideways_rsi_os': 21, 'sideways_rsi_ob': 57, 'sideways_adx_thresh': 9.355606749669436, 'sideways_atr_min_pct': 0.009932425464385766, 'sideways_atr_max_pct': 0.12260010521000927, 'sideways_tp_mult': 1.3104038204549586, 'sideways_tsl_mult': 0.6690512097048859, 'sideways_time_stop': 286, 'sideways_use_sma': True, 'sideways_use_ema': False, 'sideways_use_atr': False, 'sideways_use_adx': False, 'sideways_use_spike': False, 'sideways_rsi_required': True}.
[I 2025-08-30 19:22:04,420] Trial 359 finished with values: [-1000000000.0, 1000000000.0] and parameters: {'p_sma': 30, 'p_std': 27, 'p_atr': 10, 'p_adx': 8, 'rsi_period': 75, 'ema1': 25, 'ema2': 33, 'slip_atr_k': 0.011332683613781237, 'slip_spread_k': 0.3402695311846765, 'spread_hl_frac': 0.001315479811833426, 'bb_std_mult': 1.1588846577676457, 'rsi_os': 37, 'rsi_ob': 57, 'vol_spike': 0.02852920952694598, 'adx_thresh': 18.413329713787395, 'atr_min_pct': 0.02475279113922054, 'atr_max_pct': 0.12386829527244884, 'tp_mult': 2.1585456211226925, 'tsl_mult': 0.9074348075390231, 'strategy': 'breakout', 'time_stop': 195, 'use_sma': False, 'use_atr': True, 'use_adx': True, 'use_ema': True, 'use_spike': True, 'rsi_required': True, 'edge_k': 0.10924331430218155, 'edge_cap': 0.25255494201868506, 'bull_strategy': 'mean_reversion', 'bull_bb_std_mult': 1.560831308508078, 'bull_rsi_os': 44, 'bull_rsi_ob': 84, 'bull_adx_thresh': 27.239814880221893, 'bull_atr_min_pct': 0.01952561685941722, 'bull_atr_max_pct': 0.12460030545239104, 'bull_tp_mult': 2.1090281766698964, 'bull_tsl_mult': 0.16584451254415905, 'bull_time_stop': 107, 'bull_use_sma': True, 'bull_use_ema': False, 'bull_use_atr': False, 'bull_use_adx': True, 'bull_use_spike': True, 'bull_rsi_required': True, 'bear_strategy': 'breakout', 'bear_bb_std_mult': 3.2790912476018286, 'bear_rsi_os': 6, 'bear_rsi_ob': 63, 'bear_adx_thresh': 7.054683115459432, 'bear_atr_min_pct': 0.01832724092212977, 'bear_atr_max_pct': 0.05066659221228902, 'bear_tp_mult': 1.0859748433814322, 'bear_tsl_mult': 0.47573132811582414, 'bear_time_stop': 52, 'bear_use_sma': False, 'bear_use_ema': False, 'bear_use_atr': True, 'bear_use_adx': True, 'bear_use_spike': False, 'bear_rsi_required': False, 'sideways_strategy': 'breakout', 'sideways_bb_std_mult': 1.9727666083401172, 'sideways_rsi_os': 48, 'sideways_rsi_ob': 57, 'sideways_adx_thresh': 20.433445602411386, 'sideways_atr_min_pct': 0.011019596932444824, 'sideways_atr_max_pct': 0.1170642360304502, 'sideways_tp_mult': 1.6687833727927055, 'sideways_tsl_mult': 0.07681911830718957, 'sideways_time_stop': 280, 'sideways_use_sma': True, 'sideways_use_ema': False, 'sideways_use_atr': False, 'sideways_use_adx': False, 'sideways_use_spike': True, 'sideways_rsi_required': True}.
[I 2025-08-30 19:22:04,655] Trial 356 finished with values: [-0.017642158787750883, 0.017569971116884627] and parameters: {'p_sma': 41, 'p_std': 27, 'p_atr': 10, 'p_adx': 8, 'rsi_period': 38, 'ema1': 9, 'ema2': 29, 'slip_atr_k': 0.048387681532708754, 'slip_spread_k': 0.43847545902657015, 'spread_hl_frac': 0.0047210566526426165, 'bb_std_mult': 1.2073261275245142, 'rsi_os': 34, 'rsi_ob': 59, 'vol_spike': 0.23649460304319148, 'adx_thresh': 19.448451630516796, 'atr_min_pct': 0.022387043891041288, 'atr_max_pct': 0.13044679898409606, 'tp_mult': 1.5816585550023803, 'tsl_mult': 0.7737680676960921, 'strategy': 'breakout', 'time_stop': 228, 'use_sma': False, 'use_atr': True, 'use_adx': False, 'use_ema': False, 'use_spike': True, 'rsi_required': True, 'edge_k': 0.2132788983460746, 'edge_cap': 0.15785770642605024, 'bull_strategy': 'mean_reversion', 'bull_bb_std_mult': 1.7730872766659098, 'bull_rsi_os': 7, 'bull_rsi_ob': 84, 'bull_adx_thresh': 25.00286183831883, 'bull_atr_min_pct': 0.0020900880319633702, 'bull_atr_max_pct': 0.022743848722053282, 'bull_tp_mult': 2.07156890274456, 'bull_tsl_mult': 0.9990778366457657, 'bull_time_stop': 204, 'bull_use_sma': True, 'bull_use_ema': False, 'bull_use_atr': False, 'bull_use_adx': True, 'bull_use_spike': True, 'bull_rsi_required': True, 'bear_strategy': 'breakout', 'bear_bb_std_mult': 1.8091141371310762, 'bear_rsi_os': 11, 'bear_rsi_ob': 73, 'bear_adx_thresh': 30.068582553565207, 'bear_atr_min_pct': 0.006685831054322598, 'bear_atr_max_pct': 0.05222006580844529, 'bear_tp_mult': 1.6175376385503977, 'bear_tsl_mult': 0.14760195951930188, 'bear_time_stop': 50, 'bear_use_sma': True, 'bear_use_ema': False, 'bear_use_atr': True, 'bear_use_adx': True, 'bear_use_spike': False, 'bear_rsi_required': False, 'sideways_strategy': 'breakout', 'sideways_bb_std_mult': 1.086481515634886, 'sideways_rsi_os': 13, 'sideways_rsi_ob': 82, 'sideways_adx_thresh': 6.871233050918759, 'sideways_atr_min_pct': 0.019327441242167197, 'sideways_atr_max_pct': 0.11563652723812703, 'sideways_tp_mult': 1.674005323566607, 'sideways_tsl_mult': 0.6685545678575762, 'sideways_time_stop': 246, 'sideways_use_sma': True, 'sideways_use_ema': True, 'sideways_use_atr': False, 'sideways_use_adx': False, 'sideways_use_spike': False, 'sideways_rsi_required': False}.
