[I 2025-08-30 19:38:37,198] Trial 478 finished with values: [-1000000000.0, 1000000000.0] and parameters: {'p_sma': 39, 'p_std': 24, 'p_atr': 25, 'p_adx': 15, 'rsi_period': 56, 'ema1': 6, 'ema2': 15, 'slip_atr_k': 0.018646426454022185, 'slip_spread_k': 0.33304255362180324, 'spread_hl_frac': 0.005499951087445515, 'bb_std_mult': 3.250194036757866, 'rsi_os': 7, 'rsi_ob': 64, 'vol_spike': 0.11450125867841321, 'adx_thresh': 18.74490848562712, 'atr_min_pct': 0.02379819374411229, 'atr_max_pct': 0.028303721027052926, 'tp_mult': 2.8106043684285162, 'tsl_mult': 0.33734671241143366, 'strategy': 'mean_reversion', 'time_stop': 126, 'use_sma': False, 'use_atr': False, 'use_adx': True, 'use_ema': False, 'use_spike': True, 'rsi_required': True, 'edge_k': 0.1369121362238101, 'edge_cap': 0.16218118943236104, 'bull_strategy': 'mean_reversion', 'bull_bb_std_mult': 1.6106385794337208, 'bull_rsi_os': 50, 'bull_rsi_ob': 66, 'bull_adx_thresh': 29.167304132243245, 'bull_atr_min_pct': 0.014074524645316753, 'bull_atr_max_pct': 0.12799225323376323, 'bull_tp_mult': 1.9771682723461637, 'bull_tsl_mult': 0.4065983746653594, 'bull_time_stop': 31, 'bull_use_sma': True, 'bull_use_ema': False, 'bull_use_atr': False, 'bull_use_adx': False, 'bull_use_spike': True, 'bull_rsi_required': True, 'bear_strategy': 'mean_reversion', 'bear_bb_std_mult': 3.234075897065372, 'bear_rsi_os': 12, 'bear_rsi_ob': 82, 'bear_adx_thresh': 5.5087011038053735, 'bear_atr_min_pct': 0.01594186390392469, 'bear_atr_max_pct': 0.05033315326433494, 'bear_tp_mult': 2.121967010211685, 'bear_tsl_mult': 0.5947337434502055, 'bear_time_stop': 96, 'bear_use_sma': True, 'bear_use_ema': False, 'bear_use_atr': True, 'bear_use_adx': True, 'bear_use_spike': False, 'bear_rsi_required': True, 'sideways_strategy': 'breakout', 'sideways_bb_std_mult': 1.4272088249312942, 'sideways_rsi_os': 54, 'sideways_rsi_ob': 61, 'sideways_adx_thresh': 22.10779072458227, 'sideways_atr_min_pct': 0.018676754815086242, 'sideways_atr_max_pct': 0.03869175051431332, 'sideways_tp_mult': 1.7496721227944148, 'sideways_tsl_mult': 0.5090664729029514, 'sideways_time_stop': 26, 'sideways_use_sma': False, 'sideways_use_ema': True, 'sideways_use_atr': False, 'sideways_use_adx': False, 'sideways_use_spike': False, 'sideways_rsi_required': True}.
[I 2025-08-30 19:38:37,204] Trial 477 finished with values: [-1000000000.0, 1000000000.0] and parameters: {'p_sma': 39, 'p_std': 24, 'p_atr': 25, 'p_adx': 16, 'rsi_period': 58, 'ema1': 12, 'ema2': 15, 'slip_atr_k': 0.13596500146235832, 'slip_spread_k': 0.4600841260350045, 'spread_hl_frac': 0.02337051290304032, 'bb_std_mult': 0.9325733918737787, 'rsi_os': 24, 'rsi_ob': 57, 'vol_spike': 0.11605391884547497, 'adx_thresh': 29.115842766127123, 'atr_min_pct': 0.01615622618251797, 'atr_max_pct': 0.05686094634545359, 'tp_mult': 1.6766621604974818, 'tsl_mult': 0.7734954106862053, 'strategy': 'mean_reversion', 'time_stop': 38, 'use_sma': False, 'use_atr': False, 'use_adx': True, 'use_ema': False, 'use_spike': True, 'rsi_required': True, 'edge_k': 1.4246798029747014, 'edge_cap': 0.25100120074393795, 'bull_strategy': 'mean_reversion', 'bull_bb_std_mult': 1.7919873775615385, 'bull_rsi_os': 49, 'bull_rsi_ob': 67, 'bull_adx_thresh': 29.40150559514779, 'bull_atr_min_pct': 0.002982286345278186, 'bull_atr_max_pct': 0.143607736388368, 'bull_tp_mult': 1.7176325177316292, 'bull_tsl_mult': 0.9299543389874108, 'bull_time_stop': 190, 'bull_use_sma': True, 'bull_use_ema': False, 'bull_use_atr': False, 'bull_use_adx': False, 'bull_use_spike': True, 'bull_rsi_required': True, 'bear_strategy': 'mean_reversion', 'bear_bb_std_mult': 3.228251874596519, 'bear_rsi_os': 12, 'bear_rsi_ob': 82, 'bear_adx_thresh': 17.2565708030117, 'bear_atr_min_pct': 0.013471904330127767, 'bear_atr_max_pct': 0.054391114505268595, 'bear_tp_mult': 1.7931799037073526, 'bear_tsl_mult': 0.1429569251208598, 'bear_time_stop': 52, 'bear_use_sma': True, 'bear_use_ema': False, 'bear_use_atr': True, 'bear_use_adx': True, 'bear_use_spike': False, 'bear_rsi_required': True, 'sideways_strategy': 'breakout', 'sideways_bb_std_mult': 1.9832912440130848, 'sideways_rsi_os': 18, 'sideways_rsi_ob': 54, 'sideways_adx_thresh': 8.347686381057681, 'sideways_atr_min_pct': 0.018914223074992756, 'sideways_atr_max_pct': 0.1170952657984837, 'sideways_tp_mult': 1.0807788561071647, 'sideways_tsl_mult': 0.5098380415498817, 'sideways_time_stop': 291, 'sideways_use_sma': False, 'sideways_use_ema': True, 'sideways_use_atr': False, 'sideways_use_adx': False, 'sideways_use_spike': False, 'sideways_rsi_required': True}.
[I 2025-08-30 19:38:37,335] Trial 476 finished with values: [-1000000000.0, 1000000000.0] and parameters: {'p_sma': 38, 'p_std': 38, 'p_atr': 11, 'p_adx': 12, 'rsi_period': 72, 'ema1': 6, 'ema2': 19, 'slip_atr_k': 0.018177790895229903, 'slip_spread_k': 0.10557373448232382, 'spread_hl_frac': 0.0222381968309718, 'bb_std_mult': 3.266171692661639, 'rsi_os': 21, 'rsi_ob': 55, 'vol_spike': 0.21586436317390567, 'adx_thresh': 30.83044352165192, 'atr_min_pct': 0.023473085045236892, 'atr_max_pct': 0.02845315950566437, 'tp_mult': 1.8846986877075098, 'tsl_mult': 0.7604030301568585, 'strategy': 'breakout', 'time_stop': 126, 'use_sma': False, 'use_atr': True, 'use_adx': True, 'use_ema': True, 'use_spike': False, 'rsi_required': True, 'edge_k': 0.10335857397513143, 'edge_cap': 0.5190279738712615, 'bull_strategy': 'mean_reversion', 'bull_bb_std_mult': 1.6651146067897415, 'bull_rsi_os': 55, 'bull_rsi_ob': 72, 'bull_adx_thresh': 29.134854610134873, 'bull_atr_min_pct': 0.003311260320826631, 'bull_atr_max_pct': 0.05615593744872159, 'bull_tp_mult': 2.157339923526755, 'bull_tsl_mult': 0.9316096648793409, 'bull_time_stop': 189, 'bull_use_sma': False, 'bull_use_ema': True, 'bull_use_atr': False, 'bull_use_adx': True, 'bull_use_spike': True, 'bull_rsi_required': True, 'bear_strategy': 'breakout', 'bear_bb_std_mult': 3.3896388708506424, 'bear_rsi_os': 12, 'bear_rsi_ob': 82, 'bear_adx_thresh': 17.235626367718766, 'bear_atr_min_pct': 0.014365625689611417, 'bear_atr_max_pct': 0.05434908817907362, 'bear_tp_mult': 1.7947727381060885, 'bear_tsl_mult': 0.10105565125984863, 'bear_time_stop': 97, 'bear_use_sma': True, 'bear_use_ema': False, 'bear_use_atr': True, 'bear_use_adx': True, 'bear_use_spike': False, 'bear_rsi_required': False, 'sideways_strategy': 'breakout', 'sideways_bb_std_mult': 3.165871831008374, 'sideways_rsi_os': 54, 'sideways_rsi_ob': 90, 'sideways_adx_thresh': 8.206016505566998, 'sideways_atr_min_pct': 0.018899895731399014, 'sideways_atr_max_pct': 0.11806207834873111, 'sideways_tp_mult': 1.774795759821868, 'sideways_tsl_mult': 0.7004365418040465, 'sideways_time_stop': 5, 'sideways_use_sma': True, 'sideways_use_ema': True, 'sideways_use_atr': False, 'sideways_use_adx': True, 'sideways_use_spike': False, 'sideways_rsi_required': False}.
[I 2025-08-30 19:39:11,096] Trial 483 finished with values: [-1000000000.0, 1000000000.0] and parameters: {'p_sma': 43, 'p_std': 60, 'p_atr': 8, 'p_adx': 8, 'rsi_period': 49, 'ema1': 25, 'ema2': 18, 'slip_atr_k': 0.02553457417161266, 'slip_spread_k': 0.6153412037799055, 'spread_hl_frac': 0.03528516399745014, 'bb_std_mult': 2.5394625969374847, 'rsi_os': 45, 'rsi_ob': 54, 'vol_spike': 0.07073235039982555, 'adx_thresh': 16.30397840964151, 'atr_min_pct': 0.024535207312277364, 'atr_max_pct': 0.13478292017560095, 'tp_mult': 1.994120869278336, 'tsl_mult': 0.8872898414852504, 'strategy': 'breakout', 'time_stop': 48, 'use_sma': False, 'use_atr': True, 'use_adx': False, 'use_ema': False, 'use_spike': True, 'rsi_required': True, 'edge_k': 1.0204102327503082, 'edge_cap': 0.7190308496807816, 'bull_strategy': 'breakout', 'bull_bb_std_mult': 3.000679187712872, 'bull_rsi_os': 52, 'bull_rsi_ob': 88, 'bull_adx_thresh': 33.94282345485991, 'bull_atr_min_pct': 0.009076909752664885, 'bull_atr_max_pct': 0.021509979035005733, 'bull_tp_mult': 2.1975946361735743, 'bull_tsl_mult': 0.9622150012964104, 'bull_time_stop': 89, 'bull_use_sma': True, 'bull_use_ema': False, 'bull_use_atr': True, 'bull_use_adx': True, 'bull_use_spike': True, 'bull_rsi_required': False, 'bear_strategy': 'breakout', 'bear_bb_std_mult': 2.56946693295437, 'bear_rsi_os': 45, 'bear_rsi_ob': 87, 'bear_adx_thresh': 6.256493897401057, 'bear_atr_min_pct': 0.015181717263948818, 'bear_atr_max_pct': 0.0996283312939165, 'bear_tp_mult': 1.7202839409170498, 'bear_tsl_mult': 0.7510436914320597, 'bear_time_stop': 35, 'bear_use_sma': True, 'bear_use_ema': False, 'bear_use_atr': True, 'bear_use_adx': True, 'bear_use_spike': True, 'bear_rsi_required': False, 'sideways_strategy': 'breakout', 'sideways_bb_std_mult': 3.4241905585932173, 'sideways_rsi_os': 17, 'sideways_rsi_ob': 57, 'sideways_adx_thresh': 10.224163361864044, 'sideways_atr_min_pct': 0.0014170795609327238, 'sideways_atr_max_pct': 0.11479606815043347, 'sideways_tp_mult': 1.4217382220081376, 'sideways_tsl_mult': 0.6532761790495901, 'sideways_time_stop': 266, 'sideways_use_sma': True, 'sideways_use_ema': False, 'sideways_use_atr': True, 'sideways_use_adx': False, 'sideways_use_spike': False, 'sideways_rsi_required': False}.
[I 2025-08-30 19:39:11,488] Trial 482 finished with values: [-1000000000.0, 1000000000.0] and parameters: {'p_sma': 42, 'p_std': 60, 'p_atr': 7, 'p_adx': 9, 'rsi_period': 49, 'ema1': 25, 'ema2': 18, 'slip_atr_k': 0.024467941198727416, 'slip_spread_k': 0.34689758059905507, 'spread_hl_frac': 0.0026738799266008972, 'bb_std_mult': 1.8442845086794977, 'rsi_os': 19, 'rsi_ob': 59, 'vol_spike': 0.03896752056038363, 'adx_thresh': 20.35127984554278, 'atr_min_pct': 0.024562563057885532, 'atr_max_pct': 0.08143367348695822, 'tp_mult': 2.724318915197133, 'tsl_mult': 0.5947792566576647, 'strategy': 'breakout', 'time_stop': 49, 'use_sma': False, 'use_atr': True, 'use_adx': False, 'use_ema': False, 'use_spike': True, 'rsi_required': True, 'edge_k': 0.477516608686656, 'edge_cap': 0.27808943542319603, 'bull_strategy': 'mean_reversion', 'bull_bb_std_mult': 1.864869113497267, 'bull_rsi_os': 51, 'bull_rsi_ob': 86, 'bull_adx_thresh': 25.335949072343936, 'bull_atr_min_pct': 0.00803747934418041, 'bull_atr_max_pct': 0.06651868080059252, 'bull_tp_mult': 2.169915961909701, 'bull_tsl_mult': 0.7164947534278451, 'bull_time_stop': 186, 'bull_use_sma': True, 'bull_use_ema': False, 'bull_use_atr': False, 'bull_use_adx': True, 'bull_use_spike': True, 'bull_rsi_required': True, 'bear_strategy': 'breakout', 'bear_bb_std_mult': 1.079823249253203, 'bear_rsi_os': 17, 'bear_rsi_ob': 76, 'bear_adx_thresh': 18.71264549218683, 'bear_atr_min_pct': 0.015049330560554656, 'bear_atr_max_pct': 0.059410734467051814, 'bear_tp_mult': 1.9951258687189652, 'bear_tsl_mult': 0.11962895864105907, 'bear_time_stop': 126, 'bear_use_sma': True, 'bear_use_ema': False, 'bear_use_atr': True, 'bear_use_adx': True, 'bear_use_spike': False, 'bear_rsi_required': False, 'sideways_strategy': 'breakout', 'sideways_bb_std_mult': 1.8231587475236082, 'sideways_rsi_os': 17, 'sideways_rsi_ob': 45, 'sideways_adx_thresh': 29.150571163567214, 'sideways_atr_min_pct': 0.022676732716927096, 'sideways_atr_max_pct': 0.1131626889847974, 'sideways_tp_mult': 1.8073961448524367, 'sideways_tsl_mult': 0.6529346932059773, 'sideways_time_stop': 140, 'sideways_use_sma': True, 'sideways_use_ema': True, 'sideways_use_atr': True, 'sideways_use_adx': False, 'sideways_use_spike': False, 'sideways_rsi_required': False}.
[I 2025-08-30 19:39:11,670] Trial 480 finished with values: [-1000000000.0, 1000000000.0] and parameters: {'p_sma': 43, 'p_std': 28, 'p_atr': 19, 'p_adx': 8, 'rsi_period': 29, 'ema1': 25, 'ema2': 15, 'slip_atr_k': 0.020783001640723577, 'slip_spread_k': 0.3453963509916752, 'spread_hl_frac': 0.01435868703689772, 'bb_std_mult': 1.024750267080181, 'rsi_os': 7, 'rsi_ob': 57, 'vol_spike': 0.11646134229009, 'adx_thresh': 28.93180053019208, 'atr_min_pct': 0.024578903924217656, 'atr_max_pct': 0.13440797514969471, 'tp_mult': 2.135513951237412, 'tsl_mult': 0.7366986077465768, 'strategy': 'breakout', 'time_stop': 49, 'use_sma': False, 'use_atr': True, 'use_adx': True, 'use_ema': False, 'use_spike': True, 'rsi_required': True, 'edge_k': 0.5475296355669903, 'edge_cap': 0.08111062391230861, 'bull_strategy': 'mean_reversion', 'bull_bb_std_mult': 1.651122888164216, 'bull_rsi_os': 50, 'bull_rsi_ob': 56, 'bull_adx_thresh': 15.25843996947744, 'bull_atr_min_pct': 0.014047579742426998, 'bull_atr_max_pct': 0.02148053799900119, 'bull_tp_mult': 1.9697019429547211, 'bull_tsl_mult': 0.7156687949120829, 'bull_time_stop': 30, 'bull_use_sma': True, 'bull_use_ema': False, 'bull_use_atr': False, 'bull_use_adx': True, 'bull_use_spike': True, 'bull_rsi_required': True, 'bear_strategy': 'mean_reversion', 'bear_bb_std_mult': 3.2516529453000844, 'bear_rsi_os': 46, 'bear_rsi_ob': 76, 'bear_adx_thresh': 9.71834506927671, 'bear_atr_min_pct': 0.015870372188589558, 'bear_atr_max_pct': 0.05440590390655987, 'bear_tp_mult': 1.8008904159232004, 'bear_tsl_mult': 0.5805514970436655, 'bear_time_stop': 128, 'bear_use_sma': True, 'bear_use_ema': False, 'bear_use_atr': True, 'bear_use_adx': True, 'bear_use_spike': False, 'bear_rsi_required': False, 'sideways_strategy': 'breakout', 'sideways_bb_std_mult': 3.4273174919080143, 'sideways_rsi_os': 54, 'sideways_rsi_ob': 77, 'sideways_adx_thresh': 8.661219313521629, 'sideways_atr_min_pct': 0.018855709874530748, 'sideways_atr_max_pct': 0.08909656138692923, 'sideways_tp_mult': 1.8055003259790678, 'sideways_tsl_mult': 0.6490000425384459, 'sideways_time_stop': 289, 'sideways_use_sma': True, 'sideways_use_ema': True, 'sideways_use_atr': True, 'sideways_use_adx': False, 'sideways_use_spike': False, 'sideways_rsi_required': False}.
[I 2025-08-30 19:39:11,960] Trial 481 finished with values: [-1000000000.0, 1000000000.0] and parameters: {'p_sma': 42, 'p_std': 27, 'p_atr': 19, 'p_adx': 9, 'rsi_period': 49, 'ema1': 25, 'ema2': 18, 'slip_atr_k': 0.023931623413472748, 'slip_spread_k': 0.7653487627497566, 'spread_hl_frac': 0.014087294391564132, 'bb_std_mult': 1.033798935546569, 'rsi_os': 21, 'rsi_ob': 67, 'vol_spike': 0.037753879130244125, 'adx_thresh': 16.19464983972243, 'atr_min_pct': 0.02431960782686516, 'atr_max_pct': 0.1342496494806049, 'tp_mult': 2.6484457316628767, 'tsl_mult': 0.5777572817901918, 'strategy': 'breakout', 'time_stop': 208, 'use_sma': False, 'use_atr': True, 'use_adx': False, 'use_ema': False, 'use_spike': True, 'rsi_required': True, 'edge_k': 0.0820371437015003, 'edge_cap': 0.07679325597717312, 'bull_strategy': 'mean_reversion', 'bull_bb_std_mult': 1.6764328280153582, 'bull_rsi_os': 51, 'bull_rsi_ob': 46, 'bull_adx_thresh': 25.483164559426026, 'bull_atr_min_pct': 0.00905699372249683, 'bull_atr_max_pct': 0.02276358622948766, 'bull_tp_mult': 2.1853154822911964, 'bull_tsl_mult': 0.9652762508208179, 'bull_time_stop': 86, 'bull_use_sma': True, 'bull_use_ema': False, 'bull_use_atr': False, 'bull_use_adx': True, 'bull_use_spike': True, 'bull_rsi_required': True, 'bear_strategy': 'breakout', 'bear_bb_std_mult': 3.391346056221783, 'bear_rsi_os': 21, 'bear_rsi_ob': 84, 'bear_adx_thresh': 14.788745591943279, 'bear_atr_min_pct': 0.015136548458238653, 'bear_atr_max_pct': 0.10943900442470798, 'bear_tp_mult': 2.999777382999856, 'bear_tsl_mult': 0.9815967913456229, 'bear_time_stop': 129, 'bear_use_sma': True, 'bear_use_ema': False, 'bear_use_atr': True, 'bear_use_adx': True, 'bear_use_spike': False, 'bear_rsi_required': False, 'sideways_strategy': 'breakout', 'sideways_bb_std_mult': 2.689178748558388, 'sideways_rsi_os': 17, 'sideways_rsi_ob': 45, 'sideways_adx_thresh': 10.142074990112835, 'sideways_atr_min_pct': 0.019428071059613125, 'sideways_atr_max_pct': 0.11495132843942733, 'sideways_tp_mult': 2.997293296058973, 'sideways_tsl_mult': 0.6460387188629285, 'sideways_time_stop': 5, 'sideways_use_sma': True, 'sideways_use_ema': True, 'sideways_use_atr': True, 'sideways_use_adx': False, 'sideways_use_spike': False, 'sideways_rsi_required': False}.
[I 2025-08-30 19:39:45,334] Trial 484 finished with values: [-1000000000.0, 1000000000.0] and parameters: {'p_sma': 42, 'p_std': 28, 'p_atr': 19, 'p_adx': 22, 'rsi_period': 30, 'ema1': 24, 'ema2': 13, 'slip_atr_k': 0.010135785467929828, 'slip_spread_k': 0.0027594607099391544, 'spread_hl_frac': 0.014435273045669274, 'bb_std_mult': 1.8098440717302176, 'rsi_os': 37, 'rsi_ob': 59, 'vol_spike': 0.19050279715873308, 'adx_thresh': 17.14174003269746, 'atr_min_pct': 0.02304377204713398, 'atr_max_pct': 0.06921218245582543, 'tp_mult': 1.4928068248606006, 'tsl_mult': 0.7339540705266154, 'strategy': 'breakout', 'time_stop': 110, 'use_sma': True, 'use_atr': True, 'use_adx': False, 'use_ema': False, 'use_spike': True, 'rsi_required': True, 'edge_k': 0.7960992654734897, 'edge_cap': 0.2809948589015247, 'bull_strategy': 'mean_reversion', 'bull_bb_std_mult': 1.8695249182257547, 'bull_rsi_os': 50, 'bull_rsi_ob': 56, 'bull_adx_thresh': 15.378801902161179, 'bull_atr_min_pct': 0.00383679181356843, 'bull_atr_max_pct': 0.02509557618033478, 'bull_tp_mult': 2.1127163271695495, 'bull_tsl_mult': 0.981240436183771, 'bull_time_stop': 195, 'bull_use_sma': True, 'bull_use_ema': False, 'bull_use_atr': False, 'bull_use_adx': True, 'bull_use_spike': True, 'bull_rsi_required': True, 'bear_strategy': 'breakout', 'bear_bb_std_mult': 3.369723955533501, 'bear_rsi_os': 46, 'bear_rsi_ob': 84, 'bear_adx_thresh': 19.017322243094718, 'bear_atr_min_pct': 0.015697108218474778, 'bear_atr_max_pct': 0.10944533273835949, 'bear_tp_mult': 1.8400934971133744, 'bear_tsl_mult': 0.9794258328225034, 'bear_time_stop': 132, 'bear_use_sma': True, 'bear_use_ema': True, 'bear_use_atr': False, 'bear_use_adx': False, 'bear_use_spike': False, 'bear_rsi_required': False, 'sideways_strategy': 'mean_reversion', 'sideways_bb_std_mult': 2.8899882884201, 'sideways_rsi_os': 49, 'sideways_rsi_ob': 80, 'sideways_adx_thresh': 8.808862749171494, 'sideways_atr_min_pct': 0.019544087273121, 'sideways_atr_max_pct': 0.12385166763846638, 'sideways_tp_mult': 1.8208876386524881, 'sideways_tsl_mult': 0.4055431496481544, 'sideways_time_stop': 141, 'sideways_use_sma': True, 'sideways_use_ema': True, 'sideways_use_atr': True, 'sideways_use_adx': False, 'sideways_use_spike': False, 'sideways_rsi_required': False}.
[I 2025-08-30 19:39:45,373] Trial 487 finished with values: [-0.021410584697383106, 0.021331320735723903] and parameters: {'p_sma': 18, 'p_std': 11, 'p_atr': 9, 'p_adx': 22, 'rsi_period': 65, 'ema1': 24, 'ema2': 14, 'slip_atr_k': 0.011088433420736586, 'slip_spread_k': 0.8618146565893159, 'spread_hl_frac': 0.04894198565220125, 'bb_std_mult': 0.8430015422692296, 'rsi_os': 37, 'rsi_ob': 89, 'vol_spike': 0.027303058043324488, 'adx_thresh': 21.418869273184168, 'atr_min_pct': 0.026912295079689084, 'atr_max_pct': 0.14269120282019243, 'tp_mult': 1.4851503955642391, 'tsl_mult': 0.7311356267136644, 'strategy': 'breakout', 'time_stop': 14, 'use_sma': True, 'use_atr': True, 'use_adx': False, 'use_ema': False, 'use_spike': True, 'rsi_required': False, 'edge_k': 0.06267143747081368, 'edge_cap': 0.19631958023699114, 'bull_strategy': 'breakout', 'bull_bb_std_mult': 1.8272669203505083, 'bull_rsi_os': 50, 'bull_rsi_ob': 73, 'bull_adx_thresh': 26.1431533282739, 'bull_atr_min_pct': 0.0009645224166012331, 'bull_atr_max_pct': 0.026524539816563917, 'bull_tp_mult': 2.097755029216367, 'bull_tsl_mult': 0.6376833997346933, 'bull_time_stop': 209, 'bull_use_sma': True, 'bull_use_ema': False, 'bull_use_atr': True, 'bull_use_adx': True, 'bull_use_spike': False, 'bull_rsi_required': False, 'bear_strategy': 'breakout', 'bear_bb_std_mult': 1.4343769725137547, 'bear_rsi_os': 46, 'bear_rsi_ob': 79, 'bear_adx_thresh': 25.192065691086782, 'bear_atr_min_pct': 0.02368812435154477, 'bear_atr_max_pct': 0.057157939975196644, 'bear_tp_mult': 1.7196450511965957, 'bear_tsl_mult': 0.12869041164712366, 'bear_time_stop': 218, 'bear_use_sma': False, 'bear_use_ema': True, 'bear_use_atr': False, 'bear_use_adx': False, 'bear_use_spike': True, 'bear_rsi_required': False, 'sideways_strategy': 'mean_reversion', 'sideways_bb_std_mult': 3.5704284458191697, 'sideways_rsi_os': 35, 'sideways_rsi_ob': 59, 'sideways_adx_thresh': 9.676550126416746, 'sideways_atr_min_pct': 0.01693804385194592, 'sideways_atr_max_pct': 0.04459661052165889, 'sideways_tp_mult': 1.6984484221190654, 'sideways_tsl_mult': 0.6735068013759918, 'sideways_time_stop': 281, 'sideways_use_sma': True, 'sideways_use_ema': False, 'sideways_use_atr': False, 'sideways_use_adx': False, 'sideways_use_spike': True, 'sideways_rsi_required': False}.
