[I 2025-08-30 19:42:08,145] Trial 503 finished with values: [-1000000000.0, 1000000000.0] and parameters: {'p_sma': 25, 'p_std': 25, 'p_atr': 8, 'p_adx': 8, 'rsi_period': 47, 'ema1': 23, 'ema2': 30, 'slip_atr_k': 0.18905318317524256, 'slip_spread_k': 0.5176453436875769, 'spread_hl_frac': 0.003019004927930661, 'bb_std_mult': 0.855930817641716, 'rsi_os': 36, 'rsi_ob': 59, 'vol_spike': 0.03335247701978553, 'adx_thresh': 18.99537037539222, 'atr_min_pct': 0.023170523558120472, 'atr_max_pct': 0.13676780966224364, 'tp_mult': 1.0102185020401393, 'tsl_mult': 0.020667025132788563, 'strategy': 'breakout', 'time_stop': 58, 'use_sma': True, 'use_atr': True, 'use_adx': False, 'use_ema': False, 'use_spike': True, 'rsi_required': True, 'edge_k': 0.10174240880343886, 'edge_cap': 0.9330849665079631, 'bull_strategy': 'mean_reversion', 'bull_bb_std_mult': 3.117215688028292, 'bull_rsi_os': 22, 'bull_rsi_ob': 71, 'bull_adx_thresh': 17.79359042328183, 'bull_atr_min_pct': 0.0046083005779547475, 'bull_atr_max_pct': 0.03404496090950177, 'bull_tp_mult': 2.2647734580872325, 'bull_tsl_mult': 0.9776030070589172, 'bull_time_stop': 167, 'bull_use_sma': True, 'bull_use_ema': False, 'bull_use_atr': False, 'bull_use_adx': True, 'bull_use_spike': True, 'bull_rsi_required': True, 'bear_strategy': 'breakout', 'bear_bb_std_mult': 3.2928630444206792, 'bear_rsi_os': 5, 'bear_rsi_ob': 85, 'bear_adx_thresh': 21.81112217884892, 'bear_atr_min_pct': 0.013744039850864368, 'bear_atr_max_pct': 0.053266379119146, 'bear_tp_mult': 2.8349832112065823, 'bear_tsl_mult': 0.9239614799706455, 'bear_time_stop': 41, 'bear_use_sma': True, 'bear_use_ema': True, 'bear_use_atr': False, 'bear_use_adx': False, 'bear_use_spike': True, 'bear_rsi_required': False, 'sideways_strategy': 'mean_reversion', 'sideways_bb_std_mult': 2.7960703471368644, 'sideways_rsi_os': 33, 'sideways_rsi_ob': 47, 'sideways_adx_thresh': 10.145302898760258, 'sideways_atr_min_pct': 0.007773206316094866, 'sideways_atr_max_pct': 0.1244842035694906, 'sideways_tp_mult': 1.6937732217140824, 'sideways_tsl_mult': 0.6212368097538132, 'sideways_time_stop': 286, 'sideways_use_sma': True, 'sideways_use_ema': True, 'sideways_use_atr': False, 'sideways_use_adx': False, 'sideways_use_spike': False, 'sideways_rsi_required': False}.
[I 2025-08-30 19:42:08,679] Trial 505 finished with values: [-1000000000.0, 1000000000.0] and parameters: {'p_sma': 35, 'p_std': 30, 'p_atr': 10, 'p_adx': 8, 'rsi_period': 55, 'ema1': 5, 'ema2': 19, 'slip_atr_k': 0.19945649250329, 'slip_spread_k': 0.5167507415537674, 'spread_hl_frac': 0.03986656987687361, 'bb_std_mult': 0.8534793992181563, 'rsi_os': 34, 'rsi_ob': 83, 'vol_spike': 0.0359816477236207, 'adx_thresh': 18.42816866275068, 'atr_min_pct': 0.023090971229292573, 'atr_max_pct': 0.11038764677044016, 'tp_mult': 2.182549985461085, 'tsl_mult': 0.2797866933470832, 'strategy': 'breakout', 'time_stop': 57, 'use_sma': False, 'use_atr': True, 'use_adx': False, 'use_ema': False, 'use_spike': True, 'rsi_required': True, 'edge_k': 1.27789509795183, 'edge_cap': 0.3423964747102548, 'bull_strategy': 'mean_reversion', 'bull_bb_std_mult': 1.7829536087379532, 'bull_rsi_os': 47, 'bull_rsi_ob': 51, 'bull_adx_thresh': 25.10869989036546, 'bull_atr_min_pct': 0.02121848456621567, 'bull_atr_max_pct': 0.02386593738063623, 'bull_tp_mult': 2.1758580815308246, 'bull_tsl_mult': 0.8679198777887134, 'bull_time_stop': 167, 'bull_use_sma': True, 'bull_use_ema': False, 'bull_use_atr': False, 'bull_use_adx': True, 'bull_use_spike': True, 'bull_rsi_required': True, 'bear_strategy': 'breakout', 'bear_bb_std_mult': 3.258779706323531, 'bear_rsi_os': 43, 'bear_rsi_ob': 51, 'bear_adx_thresh': 6.979787733108214, 'bear_atr_min_pct': 0.007588929704211722, 'bear_atr_max_pct': 0.048094401399609125, 'bear_tp_mult': 1.594183229186529, 'bear_tsl_mult': 0.2581247572922606, 'bear_time_stop': 26, 'bear_use_sma': True, 'bear_use_ema': False, 'bear_use_atr': True, 'bear_use_adx': True, 'bear_use_spike': False, 'bear_rsi_required': False, 'sideways_strategy': 'breakout', 'sideways_bb_std_mult': 2.207563183691216, 'sideways_rsi_os': 43, 'sideways_rsi_ob': 58, 'sideways_adx_thresh': 10.122512108205717, 'sideways_atr_min_pct': 0.02098270922156767, 'sideways_atr_max_pct': 0.11538342619648141, 'sideways_tp_mult': 1.6533147409885844, 'sideways_tsl_mult': 0.6161562929108502, 'sideways_time_stop': 284, 'sideways_use_sma': True, 'sideways_use_ema': True, 'sideways_use_atr': False, 'sideways_use_adx': False, 'sideways_use_spike': False, 'sideways_rsi_required': False}.
[I 2025-08-30 19:42:42,097] Trial 509 finished with values: [-1000000000.0, 1000000000.0] and parameters: {'p_sma': 12, 'p_std': 42, 'p_atr': 15, 'p_adx': 7, 'rsi_period': 55, 'ema1': 21, 'ema2': 50, 'slip_atr_k': 0.02692921729351404, 'slip_spread_k': 0.41378401132645826, 'spread_hl_frac': 0.003233677276125758, 'bb_std_mult': 2.963151796429563, 'rsi_os': 38, 'rsi_ob': 56, 'vol_spike': 0.049678618370912114, 'adx_thresh': 16.70350357444662, 'atr_min_pct': 0.023993388364519263, 'atr_max_pct': 0.09459465467536722, 'tp_mult': 2.2551228865412374, 'tsl_mult': 0.5508091038483365, 'strategy': 'mean_reversion', 'time_stop': 97, 'use_sma': False, 'use_atr': False, 'use_adx': False, 'use_ema': True, 'use_spike': False, 'rsi_required': False, 'edge_k': 0.19514779452023803, 'edge_cap': 0.18335558807623936, 'bull_strategy': 'breakout', 'bull_bb_std_mult': 1.8190454755109275, 'bull_rsi_os': 51, 'bull_rsi_ob': 83, 'bull_adx_thresh': 23.585872716765877, 'bull_atr_min_pct': 0.002298583818350625, 'bull_atr_max_pct': 0.018617710487830497, 'bull_tp_mult': 1.7797091797484326, 'bull_tsl_mult': 0.49344762649415064, 'bull_time_stop': 180, 'bull_use_sma': False, 'bull_use_ema': True, 'bull_use_atr': True, 'bull_use_adx': False, 'bull_use_spike': False, 'bull_rsi_required': False, 'bear_strategy': 'mean_reversion', 'bear_bb_std_mult': 3.1602228122525595, 'bear_rsi_os': 26, 'bear_rsi_ob': 65, 'bear_adx_thresh': 6.02425418961087, 'bear_atr_min_pct': 0.0012318570103568415, 'bear_atr_max_pct': 0.05705708933831258, 'bear_tp_mult': 1.9550671116495548, 'bear_tsl_mult': 0.13398233403615853, 'bear_time_stop': 54, 'bear_use_sma': False, 'bear_use_ema': False, 'bear_use_atr': True, 'bear_use_adx': True, 'bear_use_spike': False, 'bear_rsi_required': True, 'sideways_strategy': 'breakout', 'sideways_bb_std_mult': 0.8819401526149724, 'sideways_rsi_os': 16, 'sideways_rsi_ob': 83, 'sideways_adx_thresh': 16.09878440741009, 'sideways_atr_min_pct': 0.027072928817806777, 'sideways_atr_max_pct': 0.11202247844079866, 'sideways_tp_mult': 2.7942245909524352, 'sideways_tsl_mult': 0.690504223355547, 'sideways_time_stop': 178, 'sideways_use_sma': False, 'sideways_use_ema': False, 'sideways_use_atr': False, 'sideways_use_adx': True, 'sideways_use_spike': True, 'sideways_rsi_required': True}.
[I 2025-08-30 19:42:42,201] Trial 506 finished with values: [-0.02423263375308493, 0.024163459755102732] and parameters: {'p_sma': 59, 'p_std': 30, 'p_atr': 10, 'p_adx': 20, 'rsi_period': 55, 'ema1': 24, 'ema2': 18, 'slip_atr_k': 0.025073670577780666, 'slip_spread_k': 0.5279127336076074, 'spread_hl_frac': 0.0031945346905723447, 'bb_std_mult': 0.8653020764232172, 'rsi_os': 34, 'rsi_ob': 82, 'vol_spike': 0.24268848549468708, 'adx_thresh': 18.41359066553737, 'atr_min_pct': 0.023106558327347475, 'atr_max_pct': 0.11105864493737985, 'tp_mult': 1.3102678362319038, 'tsl_mult': 0.6685706714632839, 'strategy': 'breakout', 'time_stop': 61, 'use_sma': False, 'use_atr': True, 'use_adx': False, 'use_ema': False, 'use_spike': True, 'rsi_required': False, 'edge_k': 1.2798710362639865, 'edge_cap': 0.9332987106101096, 'bull_strategy': 'mean_reversion', 'bull_bb_std_mult': 2.1064365278612587, 'bull_rsi_os': 48, 'bull_rsi_ob': 72, 'bull_adx_thresh': 21.771133641588996, 'bull_atr_min_pct': 0.0021651491442416216, 'bull_atr_max_pct': 0.02432287726414905, 'bull_tp_mult': 2.151215187360183, 'bull_tsl_mult': 0.3525297389811138, 'bull_time_stop': 236, 'bull_use_sma': True, 'bull_use_ema': False, 'bull_use_atr': True, 'bull_use_adx': True, 'bull_use_spike': True, 'bull_rsi_required': True, 'bear_strategy': 'breakout', 'bear_bb_std_mult': 3.148209549706392, 'bear_rsi_os': 55, 'bear_rsi_ob': 64, 'bear_adx_thresh': 6.51324762402647, 'bear_atr_min_pct': 0.007564628573680583, 'bear_atr_max_pct': 0.014227885095544887, 'bear_tp_mult': 1.8296143887743515, 'bear_tsl_mult': 0.09364027735522351, 'bear_time_stop': 54, 'bear_use_sma': True, 'bear_use_ema': False, 'bear_use_atr': True, 'bear_use_adx': True, 'bear_use_spike': True, 'bear_rsi_required': False, 'sideways_strategy': 'breakout', 'sideways_bb_std_mult': 1.0410672351353691, 'sideways_rsi_os': 16, 'sideways_rsi_ob': 58, 'sideways_adx_thresh': 10.258982658780097, 'sideways_atr_min_pct': 0.019636657207160253, 'sideways_atr_max_pct': 0.11540302400592738, 'sideways_tp_mult': 1.8501853947426923, 'sideways_tsl_mult': 0.6237249355021892, 'sideways_time_stop': 129, 'sideways_use_sma': True, 'sideways_use_ema': True, 'sideways_use_atr': False, 'sideways_use_adx': False, 'sideways_use_spike': False, 'sideways_rsi_required': False}.
[I 2025-08-30 19:42:42,787] Trial 507 finished with values: [-1000000000.0, 1000000000.0] and parameters: {'p_sma': 27, 'p_std': 31, 'p_atr': 10, 'p_adx': 7, 'rsi_period': 55, 'ema1': 16, 'ema2': 19, 'slip_atr_k': 0.028822489978112403, 'slip_spread_k': 0.5344154195279341, 'spread_hl_frac': 0.003526195405308823, 'bb_std_mult': 0.8643230790910996, 'rsi_os': 26, 'rsi_ob': 59, 'vol_spike': 0.04861415835642967, 'adx_thresh': 17.315334300119265, 'atr_min_pct': 0.023102380481234183, 'atr_max_pct': 0.11270393277312768, 'tp_mult': 1.772855990678381, 'tsl_mult': 0.5502202471642121, 'strategy': 'breakout', 'time_stop': 255, 'use_sma': False, 'use_atr': True, 'use_adx': False, 'use_ema': True, 'use_spike': False, 'rsi_required': False, 'edge_k': 0.09156799243902725, 'edge_cap': 0.3353973528161083, 'bull_strategy': 'mean_reversion', 'bull_bb_std_mult': 1.181750732368902, 'bull_rsi_os': 36, 'bull_rsi_ob': 72, 'bull_adx_thresh': 9.819328618424347, 'bull_atr_min_pct': 0.002158630389465746, 'bull_atr_max_pct': 0.10484313501276105, 'bull_tp_mult': 2.1971807262451493, 'bull_tsl_mult': 0.4923709742852324, 'bull_time_stop': 118, 'bull_use_sma': True, 'bull_use_ema': True, 'bull_use_atr': True, 'bull_use_adx': True, 'bull_use_spike': True, 'bull_rsi_required': True, 'bear_strategy': 'mean_reversion', 'bear_bb_std_mult': 0.7057718648439437, 'bear_rsi_os': 32, 'bear_rsi_ob': 54, 'bear_adx_thresh': 21.782675669462254, 'bear_atr_min_pct': 0.015778352064377842, 'bear_atr_max_pct': 0.05608911461740952, 'bear_tp_mult': 1.621074896105333, 'bear_tsl_mult': 0.2584396393723656, 'bear_time_stop': 54, 'bear_use_sma': True, 'bear_use_ema': False, 'bear_use_atr': True, 'bear_use_adx': True, 'bear_use_spike': False, 'bear_rsi_required': False, 'sideways_strategy': 'breakout', 'sideways_bb_std_mult': 1.5456752930316013, 'sideways_rsi_os': 16, 'sideways_rsi_ob': 62, 'sideways_adx_thresh': 16.053461195160224, 'sideways_atr_min_pct': 0.0272805403778985, 'sideways_atr_max_pct': 0.11546600184916367, 'sideways_tp_mult': 1.8458996643664545, 'sideways_tsl_mult': 0.6209172153888662, 'sideways_time_stop': 270, 'sideways_use_sma': True, 'sideways_use_ema': True, 'sideways_use_atr': False, 'sideways_use_adx': False, 'sideways_use_spike': True, 'sideways_rsi_required': False}.
[I 2025-08-30 19:42:42,942] Trial 508 finished with values: [-1000000000.0, 1000000000.0] and parameters: {'p_sma': 50, 'p_std': 29, 'p_atr': 10, 'p_adx': 7, 'rsi_period': 55, 'ema1': 25, 'ema2': 21, 'slip_atr_k': 0.11652121648538637, 'slip_spread_k': 0.14518538897937888, 'spread_hl_frac': 0.01581342656516135, 'bb_std_mult': 1.0584566735746022, 'rsi_os': 38, 'rsi_ob': 60, 'vol_spike': 0.09095980903109945, 'adx_thresh': 18.124145159038434, 'atr_min_pct': 0.014960325055162647, 'atr_max_pct': 0.13009033486974655, 'tp_mult': 2.273208690058359, 'tsl_mult': 0.6731745627536657, 'strategy': 'mean_reversion', 'time_stop': 254, 'use_sma': False, 'use_atr': False, 'use_adx': False, 'use_ema': True, 'use_spike': False, 'rsi_required': False, 'edge_k': 1.6796769530017293, 'edge_cap': 0.34278186343271116, 'bull_strategy': 'breakout', 'bull_bb_std_mult': 1.818472217670972, 'bull_rsi_os': 34, 'bull_rsi_ob': 72, 'bull_adx_thresh': 25.04805253936203, 'bull_atr_min_pct': 0.0023613626100206482, 'bull_atr_max_pct': 0.023760301628756253, 'bull_tp_mult': 2.196356206789386, 'bull_tsl_mult': 0.9176562224640391, 'bull_time_stop': 179, 'bull_use_sma': True, 'bull_use_ema': True, 'bull_use_atr': True, 'bull_use_adx': False, 'bull_use_spike': True, 'bull_rsi_required': True, 'bear_strategy': 'mean_reversion', 'bear_bb_std_mult': 3.1319552308297007, 'bear_rsi_os': 55, 'bear_rsi_ob': 54, 'bear_adx_thresh': 26.717353697519812, 'bear_atr_min_pct': 0.02851047398854633, 'bear_atr_max_pct': 0.05637850853994149, 'bear_tp_mult': 2.3954430777625433, 'bear_tsl_mult': 0.2755017347007942, 'bear_time_stop': 51, 'bear_use_sma': True, 'bear_use_ema': False, 'bear_use_atr': True, 'bear_use_adx': True, 'bear_use_spike': False, 'bear_rsi_required': True, 'sideways_strategy': 'breakout', 'sideways_bb_std_mult': 1.548211774270318, 'sideways_rsi_os': 16, 'sideways_rsi_ob': 58, 'sideways_adx_thresh': 23.84400558358948, 'sideways_atr_min_pct': 0.019743129739076586, 'sideways_atr_max_pct': 0.0924832306427855, 'sideways_tp_mult': 1.8361924661619606, 'sideways_tsl_mult': 0.4271567082196006, 'sideways_time_stop': 178, 'sideways_use_sma': False, 'sideways_use_ema': True, 'sideways_use_atr': False, 'sideways_use_adx': False, 'sideways_use_spike': True, 'sideways_rsi_required': True}.
[I 2025-08-30 19:43:17,579] Trial 513 finished with values: [-0.01617474221222981, 0.016108318087037252] and parameters: {'p_sma': 40, 'p_std': 27, 'p_atr': 9, 'p_adx': 11, 'rsi_period': 67, 'ema1': 25, 'ema2': 17, 'slip_atr_k': 0.013814173072402357, 'slip_spread_k': 0.45835070089910224, 'spread_hl_frac': 0.004909855264437331, 'bb_std_mult': 1.155809397492912, 'rsi_os': 17, 'rsi_ob': 75, 'vol_spike': 0.04215921258077751, 'adx_thresh': 20.533780691535796, 'atr_min_pct': 0.024787407505421175, 'atr_max_pct': 0.06580782122164075, 'tp_mult': 2.2151880569305473, 'tsl_mult': 0.7189252198787246, 'strategy': 'breakout', 'time_stop': 29, 'use_sma': False, 'use_atr': True, 'use_adx': True, 'use_ema': False, 'use_spike': True, 'rsi_required': True, 'edge_k': 1.5924581610506536, 'edge_cap': 0.22474464287189888, 'bull_strategy': 'mean_reversion', 'bull_bb_std_mult': 1.704553789939108, 'bull_rsi_os': 54, 'bull_rsi_ob': 77, 'bull_adx_thresh': 26.048145470935808, 'bull_atr_min_pct': 0.0015051896436395539, 'bull_atr_max_pct': 0.02135408094119905, 'bull_tp_mult': 1.9043269046312228, 'bull_tsl_mult': 0.9985119073131007, 'bull_time_stop': 188, 'bull_use_sma': False, 'bull_use_ema': False, 'bull_use_atr': False, 'bull_use_adx': True, 'bull_use_spike': False, 'bull_rsi_required': False, 'bear_strategy': 'breakout', 'bear_bb_std_mult': 3.3572397064728072, 'bear_rsi_os': 36, 'bear_rsi_ob': 83, 'bear_adx_thresh': 5.701974667410054, 'bear_atr_min_pct': 0.01521822032762204, 'bear_atr_max_pct': 0.1042416488342704, 'bear_tp_mult': 1.1958528895879592, 'bear_tsl_mult': 0.5504491050338804, 'bear_time_stop': 31, 'bear_use_sma': False, 'bear_use_ema': False, 'bear_use_atr': True, 'bear_use_adx': True, 'bear_use_spike': False, 'bear_rsi_required': False, 'sideways_strategy': 'breakout', 'sideways_bb_std_mult': 2.0919368304715444, 'sideways_rsi_os': 12, 'sideways_rsi_ob': 91, 'sideways_adx_thresh': 21.151807641513553, 'sideways_atr_min_pct': 0.02027956559724858, 'sideways_atr_max_pct': 0.04853061045127292, 'sideways_tp_mult': 1.3623093200160863, 'sideways_tsl_mult': 0.6648170320177603, 'sideways_time_stop': 277, 'sideways_use_sma': True, 'sideways_use_ema': False, 'sideways_use_atr': True, 'sideways_use_adx': True, 'sideways_use_spike': False, 'sideways_rsi_required': False}.
[I 2025-08-30 19:43:18,406] Trial 511 finished with values: [-1000000000.0, 1000000000.0] and parameters: {'p_sma': 20, 'p_std': 27, 'p_atr': 10, 'p_adx': 18, 'rsi_period': 58, 'ema1': 25, 'ema2': 17, 'slip_atr_k': 0.013955244439650832, 'slip_spread_k': 0.999223722387782, 'spread_hl_frac': 0.031701878300632966, 'bb_std_mult': 2.4660982127592885, 'rsi_os': 42, 'rsi_ob': 66, 'vol_spike': 0.09134857155829965, 'adx_thresh': 17.42360970008287, 'atr_min_pct': 0.014857861319306111, 'atr_max_pct': 0.13281150800957833, 'tp_mult': 1.7957591281405165, 'tsl_mult': 0.7182559966143887, 'strategy': 'breakout', 'time_stop': 163, 'use_sma': False, 'use_atr': True, 'use_adx': True, 'use_ema': True, 'use_spike': False, 'rsi_required': True, 'edge_k': 0.013039994426995355, 'edge_cap': 0.7706058835598726, 'bull_strategy': 'mean_reversion', 'bull_bb_std_mult': 1.9780546293448644, 'bull_rsi_os': 51, 'bull_rsi_ob': 72, 'bull_adx_thresh': 26.258292449990904, 'bull_atr_min_pct': 0.003504224125610883, 'bull_atr_max_pct': 0.05197663848228244, 'bull_tp_mult': 1.1816392918558467, 'bull_tsl_mult': 0.24133455281607008, 'bull_time_stop': 176, 'bull_use_sma': True, 'bull_use_ema': True, 'bull_use_atr': False, 'bull_use_adx': True, 'bull_use_spike': True, 'bull_rsi_required': True, 'bear_strategy': 'mean_reversion', 'bear_bb_std_mult': 3.347980960244525, 'bear_rsi_os': 43, 'bear_rsi_ob': 83, 'bear_adx_thresh': 5.555055102084827, 'bear_atr_min_pct': 0.015419269255265133, 'bear_atr_max_pct': 0.10398398803981238, 'bear_tp_mult': 1.176732060919432, 'bear_tsl_mult': 0.1120416554950067, 'bear_time_stop': 32, 'bear_use_sma': True, 'bear_use_ema': False, 'bear_use_atr': True, 'bear_use_adx': True, 'bear_use_spike': False, 'bear_rsi_required': False, 'sideways_strategy': 'breakout', 'sideways_bb_std_mult': 1.777282302935554, 'sideways_rsi_os': 15, 'sideways_rsi_ob': 58, 'sideways_adx_thresh': 8.810105236724425, 'sideways_atr_min_pct': 0.019937555479462337, 'sideways_atr_max_pct': 0.11755333272919932, 'sideways_tp_mult': 1.8370537844296666, 'sideways_tsl_mult': 0.3612906048203765, 'sideways_time_stop': 272, 'sideways_use_sma': True, 'sideways_use_ema': True, 'sideways_use_atr': True, 'sideways_use_adx': False, 'sideways_use_spike': True, 'sideways_rsi_required': False}.
[I 2025-08-30 19:43:18,703] Trial 510 finished with values: [-1000000000.0, 1000000000.0] and parameters: {'p_sma': 50, 'p_std': 35, 'p_atr': 9, 'p_adx': 21, 'rsi_period': 69, 'ema1': 25, 'ema2': 17, 'slip_atr_k': 0.07307052745962193, 'slip_spread_k': 0.45590315090744404, 'spread_hl_frac': 0.031406529751995635, 'bb_std_mult': 2.4406008347668147, 'rsi_os': 42, 'rsi_ob': 69, 'vol_spike': 0.243423976040432, 'adx_thresh': 26.97625298844571, 'atr_min_pct': 0.022118237750571805, 'atr_max_pct': 0.11611433632081913, 'tp_mult': 1.2910471937565298, 'tsl_mult': 0.6711769648102714, 'strategy': 'breakout', 'time_stop': 30, 'use_sma': False, 'use_atr': True, 'use_adx': True, 'use_ema': True, 'use_spike': False, 'rsi_required': False, 'edge_k': 1.5614959862337912, 'edge_cap': 0.26950953089669, 'bull_strategy': 'mean_reversion', 'bull_bb_std_mult': 1.1931758667960817, 'bull_rsi_os': 19, 'bull_rsi_ob': 72, 'bull_adx_thresh': 21.77866284028669, 'bull_atr_min_pct': 0.0030438558881105584, 'bull_atr_max_pct': 0.1237906882207628, 'bull_tp_mult': 2.2079362172751114, 'bull_tsl_mult': 0.3553337682415467, 'bull_time_stop': 189, 'bull_use_sma': True, 'bull_use_ema': True, 'bull_use_atr': True, 'bull_use_adx': True, 'bull_use_spike': True, 'bull_rsi_required': True, 'bear_strategy': 'breakout', 'bear_bb_std_mult': 3.348955445749652, 'bear_rsi_os': 43, 'bear_rsi_ob': 80, 'bear_adx_thresh': 5.6287406450861255, 'bear_atr_min_pct': 0.015689490512787504, 'bear_atr_max_pct': 0.05499133113677516, 'bear_tp_mult': 2.0666972409033115, 'bear_tsl_mult': 0.5355053198399524, 'bear_time_stop': 32, 'bear_use_sma': True, 'bear_use_ema': False, 'bear_use_atr': True, 'bear_use_adx': True, 'bear_use_spike': False, 'bear_rsi_required': False, 'sideways_strategy': 'breakout', 'sideways_bb_std_mult': 1.7674978099132217, 'sideways_rsi_os': 19, 'sideways_rsi_ob': 58, 'sideways_adx_thresh': 8.454830491386707, 'sideways_atr_min_pct': 0.02008154312594977, 'sideways_atr_max_pct': 0.11804886166962451, 'sideways_tp_mult': 1.3537599068746153, 'sideways_tsl_mult': 0.6339415470018122, 'sideways_time_stop': 272, 'sideways_use_sma': True, 'sideways_use_ema': True, 'sideways_use_atr': True, 'sideways_use_adx': False, 'sideways_use_spike': False, 'sideways_rsi_required': False}.
