[I 2025-08-30 19:48:28,770] Trial 550 finished with values: [-1000000000.0, 1000000000.0] and parameters: {'p_sma': 52, 'p_std': 32, 'p_atr': 8, 'p_adx': 19, 'rsi_period': 53, 'ema1': 22, 'ema2': 33, 'slip_atr_k': 0.13076111553273143, 'slip_spread_k': 0.4164880450327464, 'spread_hl_frac': 0.004430875121540135, 'bb_std_mult': 2.007977678344303, 'rsi_os': 39, 'rsi_ob': 59, 'vol_spike': 0.10001390882112522, 'adx_thresh': 18.906490823018796, 'atr_min_pct': 0.02630277932443119, 'atr_max_pct': 0.12435152506115554, 'tp_mult': 2.953182205098056, 'tsl_mult': 0.3651803214006277, 'strategy': 'breakout', 'time_stop': 35, 'use_sma': False, 'use_atr': True, 'use_adx': True, 'use_ema': False, 'use_spike': True, 'rsi_required': True, 'edge_k': 1.395892180986621, 'edge_cap': 0.2435462739435637, 'bull_strategy': 'mean_reversion', 'bull_bb_std_mult': 3.025525400734879, 'bull_rsi_os': 52, 'bull_rsi_ob': 77, 'bull_adx_thresh': 20.422327411540916, 'bull_atr_min_pct': 0.003353172695374537, 'bull_atr_max_pct': 0.023136862733415184, 'bull_tp_mult': 2.5001446574568624, 'bull_tsl_mult': 0.2692284225418978, 'bull_time_stop': 158, 'bull_use_sma': True, 'bull_use_ema': False, 'bull_use_atr': False, 'bull_use_adx': True, 'bull_use_spike': True, 'bull_rsi_required': True, 'bear_strategy': 'breakout', 'bear_bb_std_mult': 3.181948977729586, 'bear_rsi_os': 17, 'bear_rsi_ob': 91, 'bear_adx_thresh': 5.0198313292441235, 'bear_atr_min_pct': 0.014025402030326777, 'bear_atr_max_pct': 0.1306004421168357, 'bear_tp_mult': 1.7089576474713366, 'bear_tsl_mult': 0.32585842828307676, 'bear_time_stop': 33, 'bear_use_sma': True, 'bear_use_ema': False, 'bear_use_atr': True, 'bear_use_adx': True, 'bear_use_spike': False, 'bear_rsi_required': False, 'sideways_strategy': 'breakout', 'sideways_bb_std_mult': 1.4435399860380773, 'sideways_rsi_os': 14, 'sideways_rsi_ob': 58, 'sideways_adx_thresh': 8.004205551438401, 'sideways_atr_min_pct': 0.018444770823595292, 'sideways_atr_max_pct': 0.11653101031104822, 'sideways_tp_mult': 1.9424502413662763, 'sideways_tsl_mult': 0.7036827052548911, 'sideways_time_stop': 283, 'sideways_use_sma': True, 'sideways_use_ema': True, 'sideways_use_atr': False, 'sideways_use_adx': False, 'sideways_use_spike': False, 'sideways_rsi_required': False}.
[I 2025-08-30 19:48:29,136] Trial 549 finished with values: [-0.018191138080343117, 0.018120094317403718] and parameters: {'p_sma': 38, 'p_std': 25, 'p_atr': 20, 'p_adx': 14, 'rsi_period': 8, 'ema1': 24, 'ema2': 15, 'slip_atr_k': 0.010320448329590231, 'slip_spread_k': 0.3924875412779457, 'spread_hl_frac': 0.004340368383636313, 'bb_std_mult': 1.0028293241780377, 'rsi_os': 39, 'rsi_ob': 61, 'vol_spike': 0.25640202637863885, 'adx_thresh': 18.923121443804618, 'atr_min_pct': 0.024219469231133783, 'atr_max_pct': 0.13996069201952743, 'tp_mult': 2.038155221399421, 'tsl_mult': 0.34257186337175094, 'strategy': 'breakout', 'time_stop': 22, 'use_sma': False, 'use_atr': True, 'use_adx': True, 'use_ema': False, 'use_spike': True, 'rsi_required': True, 'edge_k': 0.1528191899296547, 'edge_cap': 0.26483422005322266, 'bull_strategy': 'mean_reversion', 'bull_bb_std_mult': 2.9893959045976395, 'bull_rsi_os': 12, 'bull_rsi_ob': 74, 'bull_adx_thresh': 10.765388750696456, 'bull_atr_min_pct': 0.0022096771155678003, 'bull_atr_max_pct': 0.022986174152774888, 'bull_tp_mult': 2.168819437443393, 'bull_tsl_mult': 0.9167503901070357, 'bull_time_stop': 200, 'bull_use_sma': True, 'bull_use_ema': False, 'bull_use_atr': False, 'bull_use_adx': True, 'bull_use_spike': True, 'bull_rsi_required': True, 'bear_strategy': 'breakout', 'bear_bb_std_mult': 1.6810375580494996, 'bear_rsi_os': 17, 'bear_rsi_ob': 91, 'bear_adx_thresh': 5.00867024444733, 'bear_atr_min_pct': 0.01581761906210362, 'bear_atr_max_pct': 0.09139964830138947, 'bear_tp_mult': 1.8873124950451936, 'bear_tsl_mult': 0.02860206322960579, 'bear_time_stop': 29, 'bear_use_sma': True, 'bear_use_ema': False, 'bear_use_atr': True, 'bear_use_adx': True, 'bear_use_spike': False, 'bear_rsi_required': False, 'sideways_strategy': 'breakout', 'sideways_bb_std_mult': 1.6910435552557475, 'sideways_rsi_os': 14, 'sideways_rsi_ob': 62, 'sideways_adx_thresh': 9.741251779603045, 'sideways_atr_min_pct': 0.01840492205153081, 'sideways_atr_max_pct': 0.10439007547758025, 'sideways_tp_mult': 1.8168461954765842, 'sideways_tsl_mult': 0.17957224387055737, 'sideways_time_stop': 281, 'sideways_use_sma': True, 'sideways_use_ema': True, 'sideways_use_atr': False, 'sideways_use_adx': False, 'sideways_use_spike': False, 'sideways_rsi_required': False}.
[I 2025-08-30 19:48:29,228] Trial 548 finished with values: [-1000000000.0, 1000000000.0] and parameters: {'p_sma': 56, 'p_std': 29, 'p_atr': 8, 'p_adx': 24, 'rsi_period': 54, 'ema1': 24, 'ema2': 15, 'slip_atr_k': 0.10744934531718978, 'slip_spread_k': 0.4141334672391176, 'spread_hl_frac': 0.004538315748453584, 'bb_std_mult': 2.0899622231386488, 'rsi_os': 39, 'rsi_ob': 57, 'vol_spike': 0.032013363621891285, 'adx_thresh': 18.41476276956625, 'atr_min_pct': 0.027247012326974678, 'atr_max_pct': 0.05634756813434798, 'tp_mult': 1.3707177664485606, 'tsl_mult': 0.6888350366379257, 'strategy': 'breakout', 'time_stop': 35, 'use_sma': False, 'use_atr': False, 'use_adx': True, 'use_ema': False, 'use_spike': True, 'rsi_required': False, 'edge_k': 1.3285507686302407, 'edge_cap': 0.2401364413287355, 'bull_strategy': 'breakout', 'bull_bb_std_mult': 1.7375976507643112, 'bull_rsi_os': 52, 'bull_rsi_ob': 72, 'bull_adx_thresh': 19.89336717536194, 'bull_atr_min_pct': 0.0022250570634211172, 'bull_atr_max_pct': 0.021964520664753247, 'bull_tp_mult': 1.9256881148935623, 'bull_tsl_mult': 0.9199616676278333, 'bull_time_stop': 177, 'bull_use_sma': True, 'bull_use_ema': False, 'bull_use_atr': False, 'bull_use_adx': True, 'bull_use_spike': True, 'bull_rsi_required': True, 'bear_strategy': 'breakout', 'bear_bb_std_mult': 1.9171815892261517, 'bear_rsi_os': 44, 'bear_rsi_ob': 68, 'bear_adx_thresh': 27.981094046662363, 'bear_atr_min_pct': 0.015917493873259237, 'bear_atr_max_pct': 0.058532205388782316, 'bear_tp_mult': 1.7079521701457783, 'bear_tsl_mult': 0.19884648891995169, 'bear_time_stop': 35, 'bear_use_sma': True, 'bear_use_ema': False, 'bear_use_atr': True, 'bear_use_adx': True, 'bear_use_spike': False, 'bear_rsi_required': False, 'sideways_strategy': 'breakout', 'sideways_bb_std_mult': 2.2147406436656065, 'sideways_rsi_os': 36, 'sideways_rsi_ob': 51, 'sideways_adx_thresh': 9.74990194619855, 'sideways_atr_min_pct': 0.022472533619337424, 'sideways_atr_max_pct': 0.11695970471228878, 'sideways_tp_mult': 1.1098896122911652, 'sideways_tsl_mult': 0.7028695757293061, 'sideways_time_stop': 283, 'sideways_use_sma': False, 'sideways_use_ema': True, 'sideways_use_atr': False, 'sideways_use_adx': False, 'sideways_use_spike': False, 'sideways_rsi_required': True}.
[I 2025-08-30 19:49:02,080] Trial 555 finished with values: [-1000000000.0, 1000000000.0] and parameters: {'p_sma': 47, 'p_std': 39, 'p_atr': 20, 'p_adx': 8, 'rsi_period': 42, 'ema1': 21, 'ema2': 50, 'slip_atr_k': 0.007880393113581602, 'slip_spread_k': 0.4347926261521368, 'spread_hl_frac': 0.03046004134284964, 'bb_std_mult': 1.0906352783905966, 'rsi_os': 20, 'rsi_ob': 72, 'vol_spike': 0.1493155815440869, 'adx_thresh': 33.287967069499786, 'atr_min_pct': 0.011702178692443246, 'atr_max_pct': 0.13606577967523992, 'tp_mult': 2.334147279310885, 'tsl_mult': 0.5066424866386454, 'strategy': 'breakout', 'time_stop': 23, 'use_sma': False, 'use_atr': True, 'use_adx': False, 'use_ema': True, 'use_spike': False, 'rsi_required': True, 'edge_k': 0.5761794434003389, 'edge_cap': 0.3935838315960625, 'bull_strategy': 'mean_reversion', 'bull_bb_std_mult': 1.8707336928251137, 'bull_rsi_os': 37, 'bull_rsi_ob': 69, 'bull_adx_thresh': 26.047548380643757, 'bull_atr_min_pct': 0.0026322871520209398, 'bull_atr_max_pct': 0.0870359082958873, 'bull_tp_mult': 2.5795768298398816, 'bull_tsl_mult': 0.07171646240488572, 'bull_time_stop': 280, 'bull_use_sma': False, 'bull_use_ema': False, 'bull_use_atr': False, 'bull_use_adx': True, 'bull_use_spike': False, 'bull_rsi_required': False, 'bear_strategy': 'mean_reversion', 'bear_bb_std_mult': 0.7982994198691347, 'bear_rsi_os': 42, 'bear_rsi_ob': 85, 'bear_adx_thresh': 6.876861247316459, 'bear_atr_min_pct': 0.01860326824735844, 'bear_atr_max_pct': 0.10593921918863286, 'bear_tp_mult': 1.8932308360351855, 'bear_tsl_mult': 0.024949535316848737, 'bear_time_stop': 176, 'bear_use_sma': True, 'bear_use_ema': False, 'bear_use_atr': True, 'bear_use_adx': True, 'bear_use_spike': True, 'bear_rsi_required': False, 'sideways_strategy': 'breakout', 'sideways_bb_std_mult': 0.8323690643421835, 'sideways_rsi_os': 41, 'sideways_rsi_ob': 86, 'sideways_adx_thresh': 17.286195372281195, 'sideways_atr_min_pct': 0.02082598892037577, 'sideways_atr_max_pct': 0.12002423050828817, 'sideways_tp_mult': 2.457149272002058, 'sideways_tsl_mult': 0.8720439996676357, 'sideways_time_stop': 61, 'sideways_use_sma': True, 'sideways_use_ema': False, 'sideways_use_atr': True, 'sideways_use_adx': True, 'sideways_use_spike': False, 'sideways_rsi_required': False}.
[I 2025-08-30 19:49:02,832] Trial 554 finished with values: [-1000000000.0, 1000000000.0] and parameters: {'p_sma': 19, 'p_std': 57, 'p_atr': 27, 'p_adx': 8, 'rsi_period': 11, 'ema1': 24, 'ema2': 20, 'slip_atr_k': 0.06763268137855014, 'slip_spread_k': 0.3919018344200657, 'spread_hl_frac': 0.003237917051253456, 'bb_std_mult': 3.3745608463236727, 'rsi_os': 37, 'rsi_ob': 89, 'vol_spike': 0.04026008013116246, 'adx_thresh': 17.774304154018374, 'atr_min_pct': 0.018318445233684658, 'atr_max_pct': 0.05543634935766059, 'tp_mult': 2.1660650919754145, 'tsl_mult': 0.7303216504322199, 'strategy': 'breakout', 'time_stop': 234, 'use_sma': False, 'use_atr': True, 'use_adx': False, 'use_ema': False, 'use_spike': True, 'rsi_required': True, 'edge_k': 0.14442076200832699, 'edge_cap': 0.26990675644574336, 'bull_strategy': 'mean_reversion', 'bull_bb_std_mult': 1.8843790651031789, 'bull_rsi_os': 13, 'bull_rsi_ob': 69, 'bull_adx_thresh': 10.871805380508533, 'bull_atr_min_pct': 0.002430556358747479, 'bull_atr_max_pct': 0.09824672905112905, 'bull_tp_mult': 2.2613943845953286, 'bull_tsl_mult': 0.9731979428485722, 'bull_time_stop': 201, 'bull_use_sma': False, 'bull_use_ema': False, 'bull_use_atr': False, 'bull_use_adx': True, 'bull_use_spike': False, 'bull_rsi_required': True, 'bear_strategy': 'mean_reversion', 'bear_bb_std_mult': 1.2771577485179402, 'bear_rsi_os': 47, 'bear_rsi_ob': 53, 'bear_adx_thresh': 6.749157824783442, 'bear_atr_min_pct': 0.006770899884917376, 'bear_atr_max_pct': 0.12242843070795609, 'bear_tp_mult': 1.7693690928556975, 'bear_tsl_mult': 0.6814043195329683, 'bear_time_stop': 41, 'bear_use_sma': True, 'bear_use_ema': False, 'bear_use_atr': True, 'bear_use_adx': True, 'bear_use_spike': False, 'bear_rsi_required': False, 'sideways_strategy': 'breakout', 'sideways_bb_std_mult': 0.5630779971537232, 'sideways_rsi_os': 31, 'sideways_rsi_ob': 60, 'sideways_adx_thresh': 11.058457291034085, 'sideways_atr_min_pct': 0.02246274644514672, 'sideways_atr_max_pct': 0.04156696190099678, 'sideways_tp_mult': 1.822506213346623, 'sideways_tsl_mult': 0.23844103125030774, 'sideways_time_stop': 157, 'sideways_use_sma': True, 'sideways_use_ema': True, 'sideways_use_atr': False, 'sideways_use_adx': True, 'sideways_use_spike': False, 'sideways_rsi_required': False}.
[I 2025-08-30 19:49:03,333] Trial 552 finished with values: [-0.04210282977078639, 0.0420381448519838] and parameters: {'p_sma': 49, 'p_std': 27, 'p_atr': 20, 'p_adx': 25, 'rsi_period': 8, 'ema1': 23, 'ema2': 46, 'slip_atr_k': 0.008901402319031547, 'slip_spread_k': 0.41559785024368606, 'spread_hl_frac': 0.003667165712547252, 'bb_std_mult': 3.1982259192903566, 'rsi_os': 37, 'rsi_ob': 72, 'vol_spike': 0.09898860448316207, 'adx_thresh': 18.97203106071725, 'atr_min_pct': 0.011496591772717507, 'atr_max_pct': 0.055829436498675986, 'tp_mult': 1.9222098710826574, 'tsl_mult': 0.3437459317427064, 'strategy': 'breakout', 'time_stop': 22, 'use_sma': False, 'use_atr': True, 'use_adx': False, 'use_ema': False, 'use_spike': True, 'rsi_required': True, 'edge_k': 1.7249616014211524, 'edge_cap': 0.26254237617886433, 'bull_strategy': 'mean_reversion', 'bull_bb_std_mult': 1.7491768490031112, 'bull_rsi_os': 49, 'bull_rsi_ob': 70, 'bull_adx_thresh': 10.846377917583784, 'bull_atr_min_pct': 0.01688888655774454, 'bull_atr_max_pct': 0.08697573390459251, 'bull_tp_mult': 2.264993694331606, 'bull_tsl_mult': 0.9728776244966676, 'bull_time_stop': 196, 'bull_use_sma': False, 'bull_use_ema': False, 'bull_use_atr': False, 'bull_use_adx': True, 'bull_use_spike': True, 'bull_rsi_required': True, 'bear_strategy': 'breakout', 'bear_bb_std_mult': 1.8673094381807216, 'bear_rsi_os': 41, 'bear_rsi_ob': 84, 'bear_adx_thresh': 5.568046482179346, 'bear_atr_min_pct': 0.018467961752426217, 'bear_atr_max_pct': 0.058572812650704756, 'bear_tp_mult': 1.2507774382207097, 'bear_tsl_mult': 0.027465136031348092, 'bear_time_stop': 181, 'bear_use_sma': True, 'bear_use_ema': False, 'bear_use_atr': True, 'bear_use_adx': True, 'bear_use_spike': False, 'bear_rsi_required': False, 'sideways_strategy': 'breakout', 'sideways_bb_std_mult': 2.2113570043519535, 'sideways_rsi_os': 14, 'sideways_rsi_ob': 51, 'sideways_adx_thresh': 7.818133743780055, 'sideways_atr_min_pct': 0.0010123568253153324, 'sideways_atr_max_pct': 0.04164903050629071, 'sideways_tp_mult': 2.35409233516106, 'sideways_tsl_mult': 0.6992621944036884, 'sideways_time_stop': 104, 'sideways_use_sma': True, 'sideways_use_ema': True, 'sideways_use_atr': False, 'sideways_use_adx': True, 'sideways_use_spike': False, 'sideways_rsi_required': False}.
[I 2025-08-30 19:49:03,454] Trial 553 finished with values: [-1000000000.0, 1000000000.0] and parameters: {'p_sma': 58, 'p_std': 57, 'p_atr': 11, 'p_adx': 8, 'rsi_period': 61, 'ema1': 5, 'ema2': 59, 'slip_atr_k': 0.00931112371923319, 'slip_spread_k': 0.39457369315290514, 'spread_hl_frac': 0.003413963973085203, 'bb_std_mult': 1.09418202759556, 'rsi_os': 20, 'rsi_ob': 57, 'vol_spike': 0.15091330213286802, 'adx_thresh': 18.01043358823726, 'atr_min_pct': 0.011183869166320214, 'atr_max_pct': 0.13680379348807564, 'tp_mult': 2.035702918747264, 'tsl_mult': 0.7304879171656704, 'strategy': 'breakout', 'time_stop': 84, 'use_sma': False, 'use_atr': True, 'use_adx': False, 'use_ema': False, 'use_spike': True, 'rsi_required': True, 'edge_k': 0.26334722266388005, 'edge_cap': 0.22563329718712116, 'bull_strategy': 'mean_reversion', 'bull_bb_std_mult': 1.7406775779172872, 'bull_rsi_os': 49, 'bull_rsi_ob': 89, 'bull_adx_thresh': 10.611769686316512, 'bull_atr_min_pct': 0.026032142652646646, 'bull_atr_max_pct': 0.0126686033149455, 'bull_tp_mult': 1.1109706282395528, 'bull_tsl_mult': 0.9738835826722719, 'bull_time_stop': 197, 'bull_use_sma': False, 'bull_use_ema': False, 'bull_use_atr': False, 'bull_use_adx': True, 'bull_use_spike': True, 'bull_rsi_required': True, 'bear_strategy': 'breakout', 'bear_bb_std_mult': 1.866972979871237, 'bear_rsi_os': 41, 'bear_rsi_ob': 85, 'bear_adx_thresh': 12.50260341767671, 'bear_atr_min_pct': 0.02930210541540529, 'bear_atr_max_pct': 0.0592138792360427, 'bear_tp_mult': 1.6073788037974825, 'bear_tsl_mult': 0.6751174352608966, 'bear_time_stop': 18, 'bear_use_sma': True, 'bear_use_ema': False, 'bear_use_atr': True, 'bear_use_adx': True, 'bear_use_spike': False, 'bear_rsi_required': False, 'sideways_strategy': 'breakout', 'sideways_bb_std_mult': 3.2448567106710433, 'sideways_rsi_os': 41, 'sideways_rsi_ob': 86, 'sideways_adx_thresh': 22.657823394695793, 'sideways_atr_min_pct': 0.022608210457813183, 'sideways_atr_max_pct': 0.1294813258614479, 'sideways_tp_mult': 2.9010461246794264, 'sideways_tsl_mult': 0.6755000518306875, 'sideways_time_stop': 103, 'sideways_use_sma': True, 'sideways_use_ema': True, 'sideways_use_atr': False, 'sideways_use_adx': True, 'sideways_use_spike': False, 'sideways_rsi_required': False}.
[I 2025-08-30 19:49:37,328] Trial 559 finished with values: [-1000000000.0, 1000000000.0] and parameters: {'p_sma': 39, 'p_std': 45, 'p_atr': 23, 'p_adx': 17, 'rsi_period': 49, 'ema1': 24, 'ema2': 17, 'slip_atr_k': 0.020160950261995606, 'slip_spread_k': 0.4373332977734611, 'spread_hl_frac': 0.002153387565958332, 'bb_std_mult': 0.8867444156919405, 'rsi_os': 18, 'rsi_ob': 53, 'vol_spike': 0.039866372707903386, 'adx_thresh': 20.141331804384883, 'atr_min_pct': 0.024311423640722404, 'atr_max_pct': 0.14196883093423382, 'tp_mult': 2.2161867850657284, 'tsl_mult': 0.653224323979344, 'strategy': 'mean_reversion', 'time_stop': 28, 'use_sma': True, 'use_atr': True, 'use_adx': False, 'use_ema': True, 'use_spike': False, 'rsi_required': True, 'edge_k': 0.7140573016068605, 'edge_cap': 0.22222622802892583, 'bull_strategy': 'mean_reversion', 'bull_bb_std_mult': 3.3367945383146917, 'bull_rsi_os': 50, 'bull_rsi_ob': 82, 'bull_adx_thresh': 16.722291899822093, 'bull_atr_min_pct': 0.01917845800895981, 'bull_atr_max_pct': 0.1485435128694494, 'bull_tp_mult': 2.118898629723544, 'bull_tsl_mult': 0.9977589157735637, 'bull_time_stop': 151, 'bull_use_sma': True, 'bull_use_ema': True, 'bull_use_atr': True, 'bull_use_adx': False, 'bull_use_spike': True, 'bull_rsi_required': False, 'bear_strategy': 'breakout', 'bear_bb_std_mult': 1.6878133185878264, 'bear_rsi_os': 32, 'bear_rsi_ob': 57, 'bear_adx_thresh': 20.208904407738675, 'bear_atr_min_pct': 0.01491199560197908, 'bear_atr_max_pct': 0.07250292560439293, 'bear_tp_mult': 1.755435038665321, 'bear_tsl_mult': 0.13063955434854937, 'bear_time_stop': 11, 'bear_use_sma': False, 'bear_use_ema': True, 'bear_use_atr': True, 'bear_use_adx': True, 'bear_use_spike': True, 'bear_rsi_required': True, 'sideways_strategy': 'mean_reversion', 'sideways_bb_std_mult': 2.8832516302531, 'sideways_rsi_os': 8, 'sideways_rsi_ob': 62, 'sideways_adx_thresh': 27.712132235098608, 'sideways_atr_min_pct': 0.01723367882103668, 'sideways_atr_max_pct': 0.03763023475361864, 'sideways_tp_mult': 1.696431003977117, 'sideways_tsl_mult': 0.6619802226780325, 'sideways_time_stop': 243, 'sideways_use_sma': True, 'sideways_use_ema': False, 'sideways_use_atr': True, 'sideways_use_adx': False, 'sideways_use_spike': True, 'sideways_rsi_required': False}.
[I 2025-08-30 19:49:37,790] Trial 557 finished with values: [-1000000000.0, 1000000000.0] and parameters: {'p_sma': 60, 'p_std': 6, 'p_atr': 11, 'p_adx': 21, 'rsi_period': 50, 'ema1': 23, 'ema2': 17, 'slip_atr_k': 0.019968512194490567, 'slip_spread_k': 0.43559851219605294, 'spread_hl_frac': 0.0025152847851862155, 'bb_std_mult': 3.1983974052420217, 'rsi_os': 34, 'rsi_ob': 57, 'vol_spike': 0.25352885508983225, 'adx_thresh': 18.93859578478268, 'atr_min_pct': 0.0020696049927469966, 'atr_max_pct': 0.14314146381842108, 'tp_mult': 2.7319958921561125, 'tsl_mult': 0.16549307322692114, 'strategy': 'mean_reversion', 'time_stop': 27, 'use_sma': True, 'use_atr': True, 'use_adx': False, 'use_ema': False, 'use_spike': True, 'rsi_required': True, 'edge_k': 1.03744695074512, 'edge_cap': 0.22299448941574893, 'bull_strategy': 'mean_reversion', 'bull_bb_std_mult': 3.3325492195802617, 'bull_rsi_os': 11, 'bull_rsi_ob': 89, 'bull_adx_thresh': 25.91066773097743, 'bull_atr_min_pct': 0.003387287050166888, 'bull_atr_max_pct': 0.09048843075743107, 'bull_tp_mult': 2.118414999064383, 'bull_tsl_mult': 0.9802404581416728, 'bull_time_stop': 244, 'bull_use_sma': True, 'bull_use_ema': False, 'bull_use_atr': False, 'bull_use_adx': False, 'bull_use_spike': True, 'bull_rsi_required': True, 'bear_strategy': 'breakout', 'bear_bb_std_mult': 3.260414915751107, 'bear_rsi_os': 37, 'bear_rsi_ob': 89, 'bear_adx_thresh': 7.57321782832411, 'bear_atr_min_pct': 0.015076484034631793, 'bear_atr_max_pct': 0.052929675588006396, 'bear_tp_mult': 1.5882595563273247, 'bear_tsl_mult': 0.13503299561515741, 'bear_time_stop': 10, 'bear_use_sma': True, 'bear_use_ema': False, 'bear_use_atr': True, 'bear_use_adx': True, 'bear_use_spike': False, 'bear_rsi_required': False, 'sideways_strategy': 'breakout', 'sideways_bb_std_mult': 2.8977049855696793, 'sideways_rsi_os': 17, 'sideways_rsi_ob': 54, 'sideways_adx_thresh': 29.348408794057868, 'sideways_atr_min_pct': 0.019410142618183128, 'sideways_atr_max_pct': 0.10766766429814335, 'sideways_tp_mult': 1.4989734154954446, 'sideways_tsl_mult': 0.6694786654905673, 'sideways_time_stop': 276, 'sideways_use_sma': True, 'sideways_use_ema': True, 'sideways_use_atr': False, 'sideways_use_adx': False, 'sideways_use_spike': False, 'sideways_rsi_required': False}.
