[I 2025-08-30 18:49:17,885] Trial 108 finished with values: [-1000000000.0, 1000000000.0] and parameters: {'p_sma': 27, 'p_std': 21, 'p_atr': 19, 'p_adx': 7, 'rsi_period': 47, 'ema1': 19, 'ema2': 17, 'slip_atr_k': 0.02951417171882248, 'slip_spread_k': 0.3647528839766934, 'spread_hl_frac': 0.007519045507803872, 'bb_std_mult': 1.2444241760310248, 'rsi_os': 38, 'rsi_ob': 55, 'vol_spike': 0.1136718627059484, 'adx_thresh': 25.646178715730855, 'atr_min_pct': 0.008552356671711739, 'atr_max_pct': 0.1460748576346399, 'tp_mult': 1.891070031974456, 'tsl_mult': 0.7093501458320942, 'strategy': 'breakout', 'time_stop': 160, 'use_sma': False, 'use_atr': False, 'use_adx': False, 'use_ema': True, 'use_spike': False, 'rsi_required': False, 'edge_k': 0.2405123384189627, 'edge_cap': 0.7321968429035659, 'bull_strategy': 'mean_reversion', 'bull_bb_std_mult': 0.8243959794021949, 'bull_rsi_os': 30, 'bull_rsi_ob': 54, 'bull_adx_thresh': 9.97897050918925, 'bull_atr_min_pct': 0.0010310262922394592, 'bull_atr_max_pct': 0.12990371975241824, 'bull_tp_mult': 1.6552134050323906, 'bull_tsl_mult': 0.9999143402213582, 'bull_time_stop': 232, 'bull_use_sma': True, 'bull_use_ema': True, 'bull_use_atr': False, 'bull_use_adx': False, 'bull_use_spike': True, 'bull_rsi_required': True, 'bear_strategy': 'breakout', 'bear_bb_std_mult': 2.4948942259363114, 'bear_rsi_os': 42, 'bear_rsi_ob': 71, 'bear_adx_thresh': 5.6147205507911755, 'bear_atr_min_pct': 0.011351742041622634, 'bear_atr_max_pct': 0.0647367735426318, 'bear_tp_mult': 1.6609628249641393, 'bear_tsl_mult': 0.443274544993867, 'bear_time_stop': 26, 'bear_use_sma': True, 'bear_use_ema': False, 'bear_use_atr': True, 'bear_use_adx': True, 'bear_use_spike': True, 'bear_rsi_required': False, 'sideways_strategy': 'mean_reversion', 'sideways_bb_std_mult': 2.314200378844889, 'sideways_rsi_os': 23, 'sideways_rsi_ob': 45, 'sideways_adx_thresh': 9.506484821990977, 'sideways_atr_min_pct': 0.013127614382098213, 'sideways_atr_max_pct': 0.015020148844625561, 'sideways_tp_mult': 1.6435025909359804, 'sideways_tsl_mult': 0.6095804922673185, 'sideways_time_stop': 76, 'sideways_use_sma': True, 'sideways_use_ema': True, 'sideways_use_atr': False, 'sideways_use_adx': False, 'sideways_use_spike': True, 'sideways_rsi_required': False}.
[I 2025-08-30 18:49:18,009] Trial 111 finished with values: [-1000000000.0, 1000000000.0] and parameters: {'p_sma': 27, 'p_std': 29, 'p_atr': 25, 'p_adx': 7, 'rsi_period': 84, 'ema1': 15, 'ema2': 15, 'slip_atr_k': 0.020332053898212313, 'slip_spread_k': 0.506925138312776, 'spread_hl_frac': 0.007662940556765719, 'bb_std_mult': 2.3624670732505533, 'rsi_os': 40, 'rsi_ob': 59, 'vol_spike': 0.11537426146790239, 'adx_thresh': 18.459394861664432, 'atr_min_pct': 0.024072882209327098, 'atr_max_pct': 0.13492121912673133, 'tp_mult': 1.3009124042638693, 'tsl_mult': 0.7325132165758768, 'strategy': 'breakout', 'time_stop': 68, 'use_sma': True, 'use_atr': True, 'use_adx': False, 'use_ema': False, 'use_spike': False, 'rsi_required': False, 'edge_k': 0.5160390566818436, 'edge_cap': 0.7179329295623256, 'bull_strategy': 'mean_reversion', 'bull_bb_std_mult': 2.08274217911867, 'bull_rsi_os': 22, 'bull_rsi_ob': 56, 'bull_adx_thresh': 24.415953387086482, 'bull_atr_min_pct': 0.010227540527174863, 'bull_atr_max_pct': 0.041349241316322116, 'bull_tp_mult': 2.1037938890037733, 'bull_tsl_mult': 0.6658650374326753, 'bull_time_stop': 257, 'bull_use_sma': True, 'bull_use_ema': False, 'bull_use_atr': True, 'bull_use_adx': True, 'bull_use_spike': True, 'bull_rsi_required': True, 'bear_strategy': 'mean_reversion', 'bear_bb_std_mult': 3.3547710636539674, 'bear_rsi_os': 42, 'bear_rsi_ob': 93, 'bear_adx_thresh': 26.19804668471696, 'bear_atr_min_pct': 0.0070222132466006715, 'bear_atr_max_pct': 0.03594667229814547, 'bear_tp_mult': 1.7932687682184778, 'bear_tsl_mult': 0.4134825457073792, 'bear_time_stop': 252, 'bear_use_sma': True, 'bear_use_ema': False, 'bear_use_atr': True, 'bear_use_adx': True, 'bear_use_spike': True, 'bear_rsi_required': False, 'sideways_strategy': 'breakout', 'sideways_bb_std_mult': 2.1925522347856647, 'sideways_rsi_os': 23, 'sideways_rsi_ob': 45, 'sideways_adx_thresh': 9.481442610652532, 'sideways_atr_min_pct': 0.021112489499707825, 'sideways_atr_max_pct': 0.1272991830786191, 'sideways_tp_mult': 1.185219318398652, 'sideways_tsl_mult': 0.41549994225663034, 'sideways_time_stop': 294, 'sideways_use_sma': True, 'sideways_use_ema': True, 'sideways_use_atr': True, 'sideways_use_adx': False, 'sideways_use_spike': True, 'sideways_rsi_required': False}.
[I 2025-08-30 18:49:18,109] Trial 110 finished with values: [-1000000000.0, 1000000000.0] and parameters: {'p_sma': 42, 'p_std': 12, 'p_atr': 21, 'p_adx': 7, 'rsi_period': 55, 'ema1': 23, 'ema2': 17, 'slip_atr_k': 0.01973883803182484, 'slip_spread_k': 0.46141529976969586, 'spread_hl_frac': 0.0018440239096932341, 'bb_std_mult': 1.2759923344731505, 'rsi_os': 38, 'rsi_ob': 58, 'vol_spike': 0.16721332607579714, 'adx_thresh': 25.87697719303511, 'atr_min_pct': 0.024079108094966085, 'atr_max_pct': 0.0459928428115354, 'tp_mult': 1.9785622990488911, 'tsl_mult': 0.7098525637140842, 'strategy': 'breakout', 'time_stop': 117, 'use_sma': True, 'use_atr': True, 'use_adx': False, 'use_ema': True, 'use_spike': False, 'rsi_required': False, 'edge_k': 0.0010098439517368385, 'edge_cap': 0.7739532181001721, 'bull_strategy': 'mean_reversion', 'bull_bb_std_mult': 2.3664024392560474, 'bull_rsi_os': 22, 'bull_rsi_ob': 74, 'bull_adx_thresh': 26.599375999765407, 'bull_atr_min_pct': 0.02649025443250624, 'bull_atr_max_pct': 0.04105430245705648, 'bull_tp_mult': 2.026469026813587, 'bull_tsl_mult': 0.6561507580407985, 'bull_time_stop': 58, 'bull_use_sma': True, 'bull_use_ema': True, 'bull_use_atr': True, 'bull_use_adx': True, 'bull_use_spike': True, 'bull_rsi_required': True, 'bear_strategy': 'mean_reversion', 'bear_bb_std_mult': 3.59789601959934, 'bear_rsi_os': 42, 'bear_rsi_ob': 83, 'bear_adx_thresh': 5.019742912086668, 'bear_atr_min_pct': 0.011342591516998157, 'bear_atr_max_pct': 0.0681725984260417, 'bear_tp_mult': 1.8060196980009573, 'bear_tsl_mult': 0.4350479372911239, 'bear_time_stop': 274, 'bear_use_sma': True, 'bear_use_ema': False, 'bear_use_atr': True, 'bear_use_adx': True, 'bear_use_spike': True, 'bear_rsi_required': False, 'sideways_strategy': 'mean_reversion', 'sideways_bb_std_mult': 2.203307762342972, 'sideways_rsi_os': 20, 'sideways_rsi_ob': 55, 'sideways_adx_thresh': 14.066054080762374, 'sideways_atr_min_pct': 0.0037322352623895133, 'sideways_atr_max_pct': 0.12087620260411955, 'sideways_tp_mult': 1.9121723342555481, 'sideways_tsl_mult': 0.6097218173718822, 'sideways_time_stop': 242, 'sideways_use_sma': True, 'sideways_use_ema': True, 'sideways_use_atr': False, 'sideways_use_adx': False, 'sideways_use_spike': True, 'sideways_rsi_required': False}.
[I 2025-08-30 18:49:18,365] Trial 109 finished with values: [-1000000000.0, 1000000000.0] and parameters: {'p_sma': 42, 'p_std': 22, 'p_atr': 14, 'p_adx': 7, 'rsi_period': 61, 'ema1': 13, 'ema2': 17, 'slip_atr_k': 0.02075172252339195, 'slip_spread_k': 0.36888811005034844, 'spread_hl_frac': 0.025051599998788504, 'bb_std_mult': 1.2638595953493534, 'rsi_os': 38, 'rsi_ob': 60, 'vol_spike': 0.1784141264889295, 'adx_thresh': 25.600833173997206, 'atr_min_pct': 0.024041929705546087, 'atr_max_pct': 0.13533746540778024, 'tp_mult': 2.3175807859443815, 'tsl_mult': 0.7149308521704401, 'strategy': 'breakout', 'time_stop': 117, 'use_sma': True, 'use_atr': True, 'use_adx': False, 'use_ema': True, 'use_spike': False, 'rsi_required': False, 'edge_k': 0.010687409047359986, 'edge_cap': 0.7428370002081033, 'bull_strategy': 'mean_reversion', 'bull_bb_std_mult': 2.3457116422217137, 'bull_rsi_os': 40, 'bull_rsi_ob': 52, 'bull_adx_thresh': 31.46787103300347, 'bull_atr_min_pct': 0.004570936179567772, 'bull_atr_max_pct': 0.0961046721278793, 'bull_tp_mult': 1.313290431112625, 'bull_tsl_mult': 0.37004239077164147, 'bull_time_stop': 231, 'bull_use_sma': True, 'bull_use_ema': True, 'bull_use_atr': True, 'bull_use_adx': True, 'bull_use_spike': True, 'bull_rsi_required': True, 'bear_strategy': 'mean_reversion', 'bear_bb_std_mult': 2.0278945702988973, 'bear_rsi_os': 42, 'bear_rsi_ob': 83, 'bear_adx_thresh': 5.841703460117193, 'bear_atr_min_pct': 0.02950553764489173, 'bear_atr_max_pct': 0.06751819969887556, 'bear_tp_mult': 1.7889184377308376, 'bear_tsl_mult': 0.48862559668497957, 'bear_time_stop': 257, 'bear_use_sma': True, 'bear_use_ema': False, 'bear_use_atr': True, 'bear_use_adx': True, 'bear_use_spike': True, 'bear_rsi_required': False, 'sideways_strategy': 'mean_reversion', 'sideways_bb_std_mult': 2.2113136491216334, 'sideways_rsi_os': 21, 'sideways_rsi_ob': 55, 'sideways_adx_thresh': 8.125772710420456, 'sideways_atr_min_pct': 0.0211866665781035, 'sideways_atr_max_pct': 0.12058588513717172, 'sideways_tp_mult': 2.8418403098043057, 'sideways_tsl_mult': 0.608281121107612, 'sideways_time_stop': 284, 'sideways_use_sma': True, 'sideways_use_ema': True, 'sideways_use_atr': False, 'sideways_use_adx': False, 'sideways_use_spike': True, 'sideways_rsi_required': False}.
[I 2025-08-30 18:49:50,990] Trial 115 finished with values: [-1000000000.0, 1000000000.0] and parameters: {'p_sma': 20, 'p_std': 7, 'p_atr': 10, 'p_adx': 22, 'rsi_period': 53, 'ema1': 24, 'ema2': 24, 'slip_atr_k': 0.10974346975417981, 'slip_spread_k': 0.38829725612898075, 'spread_hl_frac': 0.004363555343839384, 'bb_std_mult': 1.3671418821397294, 'rsi_os': 33, 'rsi_ob': 69, 'vol_spike': 0.038128784117807554, 'adx_thresh': 16.333734108572095, 'atr_min_pct': 0.014339923788023089, 'atr_max_pct': 0.05689109853673395, 'tp_mult': 2.1088546223009814, 'tsl_mult': 0.5566078811812123, 'strategy': 'mean_reversion', 'time_stop': 290, 'use_sma': False, 'use_atr': True, 'use_adx': False, 'use_ema': False, 'use_spike': True, 'rsi_required': True, 'edge_k': 0.31191785127553684, 'edge_cap': 0.9908545984360013, 'bull_strategy': 'mean_reversion', 'bull_bb_std_mult': 3.4994272757019953, 'bull_rsi_os': 16, 'bull_rsi_ob': 75, 'bull_adx_thresh': 21.93549372662416, 'bull_atr_min_pct': 0.029115169213407625, 'bull_atr_max_pct': 0.02658475119457207, 'bull_tp_mult': 2.2101162216381116, 'bull_tsl_mult': 0.27921931475674633, 'bull_time_stop': 160, 'bull_use_sma': False, 'bull_use_ema': False, 'bull_use_atr': False, 'bull_use_adx': True, 'bull_use_spike': True, 'bull_rsi_required': False, 'bear_strategy': 'breakout', 'bear_bb_std_mult': 3.231660529314439, 'bear_rsi_os': 47, 'bear_rsi_ob': 74, 'bear_adx_thresh': 8.711033167172682, 'bear_atr_min_pct': 0.014795070069892705, 'bear_atr_max_pct': 0.02828272672882791, 'bear_tp_mult': 1.7241463990626542, 'bear_tsl_mult': 0.09175056490994393, 'bear_time_stop': 217, 'bear_use_sma': True, 'bear_use_ema': True, 'bear_use_atr': True, 'bear_use_adx': True, 'bear_use_spike': False, 'bear_rsi_required': False, 'sideways_strategy': 'breakout', 'sideways_bb_std_mult': 1.8664990473512373, 'sideways_rsi_os': 15, 'sideways_rsi_ob': 59, 'sideways_adx_thresh': 8.872565879413509, 'sideways_atr_min_pct': 0.01903466275404227, 'sideways_atr_max_pct': 0.11787470607639186, 'sideways_tp_mult': 1.706941614716598, 'sideways_tsl_mult': 0.6519478268366627, 'sideways_time_stop': 265, 'sideways_use_sma': False, 'sideways_use_ema': True, 'sideways_use_atr': False, 'sideways_use_adx': True, 'sideways_use_spike': False, 'sideways_rsi_required': True}.
[I 2025-08-30 18:49:51,074] Trial 112 finished with values: [-1000000000.0, 1000000000.0] and parameters: {'p_sma': 38, 'p_std': 24, 'p_atr': 14, 'p_adx': 27, 'rsi_period': 53, 'ema1': 24, 'ema2': 21, 'slip_atr_k': 0.1557179321716922, 'slip_spread_k': 0.6967887300242482, 'spread_hl_frac': 0.004607090625797132, 'bb_std_mult': 1.3671882907489596, 'rsi_os': 42, 'rsi_ob': 67, 'vol_spike': 0.17924421850338482, 'adx_thresh': 16.200597045094312, 'atr_min_pct': 0.023093024430934767, 'atr_max_pct': 0.13814431732560797, 'tp_mult': 2.320924973367874, 'tsl_mult': 0.7944550981511991, 'strategy': 'mean_reversion', 'time_stop': 286, 'use_sma': False, 'use_atr': True, 'use_adx': False, 'use_ema': False, 'use_spike': True, 'rsi_required': True, 'edge_k': 0.31606659298146633, 'edge_cap': 0.24261548400973787, 'bull_strategy': 'mean_reversion', 'bull_bb_std_mult': 1.914926903509082, 'bull_rsi_os': 41, 'bull_rsi_ob': 74, 'bull_adx_thresh': 25.426169411274955, 'bull_atr_min_pct': 0.002596155453266519, 'bull_atr_max_pct': 0.034602484777800785, 'bull_tp_mult': 2.2235312647088086, 'bull_tsl_mult': 0.7200092073914924, 'bull_time_stop': 161, 'bull_use_sma': False, 'bull_use_ema': False, 'bull_use_atr': False, 'bull_use_adx': True, 'bull_use_spike': True, 'bull_rsi_required': True, 'bear_strategy': 'mean_reversion', 'bear_bb_std_mult': 3.196919488198451, 'bear_rsi_os': 47, 'bear_rsi_ob': 60, 'bear_adx_thresh': 8.973103673783127, 'bear_atr_min_pct': 0.014950875015412042, 'bear_atr_max_pct': 0.02782186738856423, 'bear_tp_mult': 1.69683906583395, 'bear_tsl_mult': 0.08239421723765084, 'bear_time_stop': 120, 'bear_use_sma': True, 'bear_use_ema': True, 'bear_use_atr': True, 'bear_use_adx': True, 'bear_use_spike': False, 'bear_rsi_required': False, 'sideways_strategy': 'breakout', 'sideways_bb_std_mult': 1.8754007038486118, 'sideways_rsi_os': 15, 'sideways_rsi_ob': 59, 'sideways_adx_thresh': 8.207589002972671, 'sideways_atr_min_pct': 0.010925290667378336, 'sideways_atr_max_pct': 0.11754366065729886, 'sideways_tp_mult': 2.23914420255455, 'sideways_tsl_mult': 0.7418497602633535, 'sideways_time_stop': 262, 'sideways_use_sma': False, 'sideways_use_ema': True, 'sideways_use_atr': False, 'sideways_use_adx': True, 'sideways_use_spike': False, 'sideways_rsi_required': True}.
[I 2025-08-30 18:49:51,159] Trial 114 finished with values: [-1000000000.0, 1000000000.0] and parameters: {'p_sma': 38, 'p_std': 35, 'p_atr': 14, 'p_adx': 27, 'rsi_period': 24, 'ema1': 13, 'ema2': 25, 'slip_atr_k': 0.04469820359588969, 'slip_spread_k': 0.053120034248271, 'spread_hl_frac': 0.004402126191290494, 'bb_std_mult': 1.3642890026342147, 'rsi_os': 39, 'rsi_ob': 69, 'vol_spike': 0.03830289498966921, 'adx_thresh': 16.304074583012806, 'atr_min_pct': 0.023225105236132432, 'atr_max_pct': 0.0593692761541226, 'tp_mult': 2.111762799786463, 'tsl_mult': 0.789350399902086, 'strategy': 'mean_reversion', 'time_stop': 27, 'use_sma': False, 'use_atr': True, 'use_adx': False, 'use_ema': False, 'use_spike': True, 'rsi_required': True, 'edge_k': 0.3181145708605505, 'edge_cap': 0.2436596572290191, 'bull_strategy': 'mean_reversion', 'bull_bb_std_mult': 3.150050257508072, 'bull_rsi_os': 13, 'bull_rsi_ob': 85, 'bull_adx_thresh': 28.3034239346803, 'bull_atr_min_pct': 0.004581531982860586, 'bull_atr_max_pct': 0.02800002383222406, 'bull_tp_mult': 2.2055589033022205, 'bull_tsl_mult': 0.3872890470907615, 'bull_time_stop': 160, 'bull_use_sma': False, 'bull_use_ema': False, 'bull_use_atr': False, 'bull_use_adx': True, 'bull_use_spike': True, 'bull_rsi_required': True, 'bear_strategy': 'mean_reversion', 'bear_bb_std_mult': 3.271962055589035, 'bear_rsi_os': 46, 'bear_rsi_ob': 83, 'bear_adx_thresh': 8.659774237832432, 'bear_atr_min_pct': 0.014502938260842547, 'bear_atr_max_pct': 0.029442618285557276, 'bear_tp_mult': 2.0600847986518636, 'bear_tsl_mult': 0.493829963664042, 'bear_time_stop': 219, 'bear_use_sma': True, 'bear_use_ema': True, 'bear_use_atr': True, 'bear_use_adx': True, 'bear_use_spike': False, 'bear_rsi_required': False, 'sideways_strategy': 'breakout', 'sideways_bb_std_mult': 1.868431676866292, 'sideways_rsi_os': 15, 'sideways_rsi_ob': 59, 'sideways_adx_thresh': 8.11788683156887, 'sideways_atr_min_pct': 0.001463037863704851, 'sideways_atr_max_pct': 0.11832105834725949, 'sideways_tp_mult': 2.842025071457946, 'sideways_tsl_mult': 0.7459776764306735, 'sideways_time_stop': 163, 'sideways_use_sma': False, 'sideways_use_ema': True, 'sideways_use_atr': False, 'sideways_use_adx': True, 'sideways_use_spike': False, 'sideways_rsi_required': True}.
[I 2025-08-30 18:49:51,340] Trial 113 finished with values: [-1000000000.0, 1000000000.0] and parameters: {'p_sma': 38, 'p_std': 31, 'p_atr': 10, 'p_adx': 27, 'rsi_period': 58, 'ema1': 6, 'ema2': 25, 'slip_atr_k': 0.0428610283075308, 'slip_spread_k': 0.07528532821358902, 'spread_hl_frac': 0.004479826178098576, 'bb_std_mult': 1.3447468479721238, 'rsi_os': 39, 'rsi_ob': 67, 'vol_spike': 0.05606634056475028, 'adx_thresh': 16.363821261986313, 'atr_min_pct': 0.028715912218917637, 'atr_max_pct': 0.0768545580100821, 'tp_mult': 2.118739860841358, 'tsl_mult': 0.7978012186315508, 'strategy': 'mean_reversion', 'time_stop': 286, 'use_sma': False, 'use_atr': True, 'use_adx': False, 'use_ema': False, 'use_spike': True, 'rsi_required': True, 'edge_k': 0.9050922031131787, 'edge_cap': 0.9876578625659104, 'bull_strategy': 'mean_reversion', 'bull_bb_std_mult': 1.9151795322661451, 'bull_rsi_os': 40, 'bull_rsi_ob': 75, 'bull_adx_thresh': 22.133789292436184, 'bull_atr_min_pct': 0.004520387503900036, 'bull_atr_max_pct': 0.026385800711330204, 'bull_tp_mult': 2.2101289184252013, 'bull_tsl_mult': 0.38002216473120387, 'bull_time_stop': 160, 'bull_use_sma': False, 'bull_use_ema': False, 'bull_use_atr': False, 'bull_use_adx': True, 'bull_use_spike': True, 'bull_rsi_required': True, 'bear_strategy': 'mean_reversion', 'bear_bb_std_mult': 3.254041335654852, 'bear_rsi_os': 47, 'bear_rsi_ob': 83, 'bear_adx_thresh': 8.89241018184127, 'bear_atr_min_pct': 0.013904220722192275, 'bear_atr_max_pct': 0.02657437642630197, 'bear_tp_mult': 1.7305844954982563, 'bear_tsl_mult': 0.3740562451623649, 'bear_time_stop': 214, 'bear_use_sma': True, 'bear_use_ema': True, 'bear_use_atr': True, 'bear_use_adx': True, 'bear_use_spike': False, 'bear_rsi_required': False, 'sideways_strategy': 'breakout', 'sideways_bb_std_mult': 2.032342292270259, 'sideways_rsi_os': 15, 'sideways_rsi_ob': 80, 'sideways_adx_thresh': 8.566720033241275, 'sideways_atr_min_pct': 0.018938548634123642, 'sideways_atr_max_pct': 0.11726291605817141, 'sideways_tp_mult': 2.536002283620771, 'sideways_tsl_mult': 0.742564409810978, 'sideways_time_stop': 220, 'sideways_use_sma': False, 'sideways_use_ema': True, 'sideways_use_atr': False, 'sideways_use_adx': True, 'sideways_use_spike': False, 'sideways_rsi_required': True}.
[I 2025-08-30 18:50:23,704] Trial 119 finished with values: [-1000000000.0, 1000000000.0] and parameters: {'p_sma': 44, 'p_std': 29, 'p_atr': 9, 'p_adx': 14, 'rsi_period': 50, 'ema1': 22, 'ema2': 58, 'slip_atr_k': 0.09464482200381631, 'slip_spread_k': 0.6226053044952335, 'spread_hl_frac': 0.0010396005765327737, 'bb_std_mult': 0.6862093684700588, 'rsi_os': 35, 'rsi_ob': 82, 'vol_spike': 0.21488146313109788, 'adx_thresh': 10.459835940521552, 'atr_min_pct': 0.025909324807406507, 'atr_max_pct': 0.1295588575549459, 'tp_mult': 2.2135961969196174, 'tsl_mult': 0.8747940758102271, 'strategy': 'breakout', 'time_stop': 29, 'use_sma': True, 'use_atr': True, 'use_adx': True, 'use_ema': False, 'use_spike': True, 'rsi_required': True, 'edge_k': 0.12969717775789044, 'edge_cap': 0.9303916657591217, 'bull_strategy': 'breakout', 'bull_bb_std_mult': 1.4902665519396558, 'bull_rsi_os': 46, 'bull_rsi_ob': 68, 'bull_adx_thresh': 26.224664984862258, 'bull_atr_min_pct': 0.02127095272515874, 'bull_atr_max_pct': 0.014363487843857645, 'bull_tp_mult': 1.526794994408255, 'bull_tsl_mult': 0.4586480070302915, 'bull_time_stop': 176, 'bull_use_sma': True, 'bull_use_ema': False, 'bull_use_atr': False, 'bull_use_adx': True, 'bull_use_spike': False, 'bull_rsi_required': False, 'bear_strategy': 'breakout', 'bear_bb_std_mult': 1.0992437818419987, 'bear_rsi_os': 5, 'bear_rsi_ob': 55, 'bear_adx_thresh': 7.402208618254331, 'bear_atr_min_pct': 0.0035864855685971645, 'bear_atr_max_pct': 0.10183327322846553, 'bear_tp_mult': 1.1069730274291634, 'bear_tsl_mult': 0.2259911747383307, 'bear_time_stop': 57, 'bear_use_sma': False, 'bear_use_ema': False, 'bear_use_atr': True, 'bear_use_adx': True, 'bear_use_spike': False, 'bear_rsi_required': False, 'sideways_strategy': 'breakout', 'sideways_bb_std_mult': 3.4577450262501808, 'sideways_rsi_os': 18, 'sideways_rsi_ob': 72, 'sideways_adx_thresh': 10.193806714522916, 'sideways_atr_min_pct': 0.019980406392899254, 'sideways_atr_max_pct': 0.11255685276066633, 'sideways_tp_mult': 1.779820995269693, 'sideways_tsl_mult': 0.6780109062100919, 'sideways_time_stop': 256, 'sideways_use_sma': True, 'sideways_use_ema': False, 'sideways_use_atr': True, 'sideways_use_adx': False, 'sideways_use_spike': False, 'sideways_rsi_required': False}.
