[I 2025-08-30 20:01:19,220] Trial 651 finished with values: [-1000000000.0, 1000000000.0] and parameters: {'p_sma': 45, 'p_std': 12, 'p_atr': 17, 'p_adx': 8, 'rsi_period': 64, 'ema1': 26, 'ema2': 52, 'slip_atr_k': 0.0862341983024699, 'slip_spread_k': 0.22999280498701252, 'spread_hl_frac': 0.03574375314921334, 'bb_std_mult': 2.064957253293916, 'rsi_os': 16, 'rsi_ob': 49, 'vol_spike': 0.03665021352004061, 'adx_thresh': 14.762324240755033, 'atr_min_pct': 0.0258621626969691, 'atr_max_pct': 0.13759964773847327, 'tp_mult': 2.188414665606044, 'tsl_mult': 0.6788633414735813, 'strategy': 'mean_reversion', 'time_stop': 33, 'use_sma': False, 'use_atr': True, 'use_adx': False, 'use_ema': False, 'use_spike': True, 'rsi_required': True, 'edge_k': 0.6944358598524385, 'edge_cap': 0.5416498709592782, 'bull_strategy': 'mean_reversion', 'bull_bb_std_mult': 2.020293823723887, 'bull_rsi_os': 48, 'bull_rsi_ob': 63, 'bull_adx_thresh': 34.558381328094576, 'bull_atr_min_pct': 0.015696114514793462, 'bull_atr_max_pct': 0.045741079654480224, 'bull_tp_mult': 2.1960982453949374, 'bull_tsl_mult': 0.7989341932806471, 'bull_time_stop': 270, 'bull_use_sma': True, 'bull_use_ema': True, 'bull_use_atr': False, 'bull_use_adx': True, 'bull_use_spike': True, 'bull_rsi_required': True, 'bear_strategy': 'breakout', 'bear_bb_std_mult': 3.3626956964091006, 'bear_rsi_os': 49, 'bear_rsi_ob': 92, 'bear_adx_thresh': 5.607576399988956, 'bear_atr_min_pct': 0.014757412386171849, 'bear_atr_max_pct': 0.06193489573770557, 'bear_tp_mult': 1.3834036561788468, 'bear_tsl_mult': 0.8015031315261429, 'bear_time_stop': 54, 'bear_use_sma': True, 'bear_use_ema': False, 'bear_use_atr': True, 'bear_use_adx': True, 'bear_use_spike': False, 'bear_rsi_required': False, 'sideways_strategy': 'breakout', 'sideways_bb_std_mult': 2.1477170558664374, 'sideways_rsi_os': 15, 'sideways_rsi_ob': 66, 'sideways_adx_thresh': 26.514685833046833, 'sideways_atr_min_pct': 0.021069162181688167, 'sideways_atr_max_pct': 0.12914933609251464, 'sideways_tp_mult': 1.7131102732356873, 'sideways_tsl_mult': 0.5579501306887389, 'sideways_time_stop': 274, 'sideways_use_sma': True, 'sideways_use_ema': True, 'sideways_use_atr': False, 'sideways_use_adx': False, 'sideways_use_spike': True, 'sideways_rsi_required': False}.
[I 2025-08-30 20:01:49,732] Trial 647 finished with values: [-1000000000.0, 1000000000.0] and parameters: {'p_sma': 40, 'p_std': 15, 'p_atr': 19, 'p_adx': 8, 'rsi_period': 64, 'ema1': 26, 'ema2': 57, 'slip_atr_k': 0.016495458467687626, 'slip_spread_k': 0.46052375069076074, 'spread_hl_frac': 0.005495594862686516, 'bb_std_mult': 1.6480269912269851, 'rsi_os': 36, 'rsi_ob': 60, 'vol_spike': 0.04522900049380481, 'adx_thresh': 23.43996709555234, 'atr_min_pct': 0.00464285210898234, 'atr_max_pct': 0.1383545449710077, 'tp_mult': 1.580543856413919, 'tsl_mult': 0.731781651353476, 'strategy': 'mean_reversion', 'time_stop': 85, 'use_sma': True, 'use_atr': False, 'use_adx': False, 'use_ema': True, 'use_spike': False, 'rsi_required': True, 'edge_k': 1.831819423793897, 'edge_cap': 0.23899325325551396, 'bull_strategy': 'breakout', 'bull_bb_std_mult': 1.2324709462591863, 'bull_rsi_os': 47, 'bull_rsi_ob': 81, 'bull_adx_thresh': 25.497322518150895, 'bull_atr_min_pct': 0.015211621365220609, 'bull_atr_max_pct': 0.04553786474324501, 'bull_tp_mult': 1.9647188858572087, 'bull_tsl_mult': 0.9379854405158983, 'bull_time_stop': 182, 'bull_use_sma': True, 'bull_use_ema': True, 'bull_use_atr': False, 'bull_use_adx': True, 'bull_use_spike': False, 'bull_rsi_required': False, 'bear_strategy': 'breakout', 'bear_bb_std_mult': 3.2630602759747656, 'bear_rsi_os': 44, 'bear_rsi_ob': 82, 'bear_adx_thresh': 22.137611567648726, 'bear_atr_min_pct': 0.012578459231877137, 'bear_atr_max_pct': 0.05497355898449137, 'bear_tp_mult': 1.7656803616688033, 'bear_tsl_mult': 0.08119286096512149, 'bear_time_stop': 208, 'bear_use_sma': True, 'bear_use_ema': False, 'bear_use_atr': False, 'bear_use_adx': False, 'bear_use_spike': False, 'bear_rsi_required': False, 'sideways_strategy': 'breakout', 'sideways_bb_std_mult': 1.9437542523152063, 'sideways_rsi_os': 14, 'sideways_rsi_ob': 59, 'sideways_adx_thresh': 27.35290781626733, 'sideways_atr_min_pct': 0.017432664486181998, 'sideways_atr_max_pct': 0.11574370332876696, 'sideways_tp_mult': 1.809195175253915, 'sideways_tsl_mult': 0.6286378414177187, 'sideways_time_stop': 274, 'sideways_use_sma': False, 'sideways_use_ema': True, 'sideways_use_atr': False, 'sideways_use_adx': False, 'sideways_use_spike': True, 'sideways_rsi_required': True}.
[I 2025-08-30 20:01:50,178] Trial 649 finished with values: [-1000000000.0, 1000000000.0] and parameters: {'p_sma': 40, 'p_std': 14, 'p_atr': 10, 'p_adx': 7, 'rsi_period': 53, 'ema1': 11, 'ema2': 17, 'slip_atr_k': 0.00028129792228270487, 'slip_spread_k': 0.6228134249354821, 'spread_hl_frac': 0.03299188751265135, 'bb_std_mult': 1.0025565154792822, 'rsi_os': 15, 'rsi_ob': 86, 'vol_spike': 0.021475578877768374, 'adx_thresh': 16.851283373979097, 'atr_min_pct': 0.027452638246248096, 'atr_max_pct': 0.07382340956340083, 'tp_mult': 2.192143298058774, 'tsl_mult': 0.7383555268695687, 'strategy': 'mean_reversion', 'time_stop': 36, 'use_sma': False, 'use_atr': True, 'use_adx': False, 'use_ema': False, 'use_spike': True, 'rsi_required': True, 'edge_k': 0.09610903387812081, 'edge_cap': 0.27628065259458556, 'bull_strategy': 'mean_reversion', 'bull_bb_std_mult': 1.219978152138977, 'bull_rsi_os': 7, 'bull_rsi_ob': 71, 'bull_adx_thresh': 25.45890035843348, 'bull_atr_min_pct': 0.0025871166838783853, 'bull_atr_max_pct': 0.07050487513248686, 'bull_tp_mult': 2.058893572963716, 'bull_tsl_mult': 0.9693114778942152, 'bull_time_stop': 271, 'bull_use_sma': True, 'bull_use_ema': True, 'bull_use_atr': False, 'bull_use_adx': True, 'bull_use_spike': False, 'bull_rsi_required': True, 'bear_strategy': 'mean_reversion', 'bear_bb_std_mult': 3.3499388004751527, 'bear_rsi_os': 44, 'bear_rsi_ob': 95, 'bear_adx_thresh': 7.380595625396575, 'bear_atr_min_pct': 0.0238342729483645, 'bear_atr_max_pct': 0.05512666933601479, 'bear_tp_mult': 1.7685869678371196, 'bear_tsl_mult': 0.1604825903777352, 'bear_time_stop': 172, 'bear_use_sma': False, 'bear_use_ema': False, 'bear_use_atr': True, 'bear_use_adx': True, 'bear_use_spike': False, 'bear_rsi_required': False, 'sideways_strategy': 'breakout', 'sideways_bb_std_mult': 3.3173106886569967, 'sideways_rsi_os': 24, 'sideways_rsi_ob': 59, 'sideways_adx_thresh': 26.00986745026096, 'sideways_atr_min_pct': 0.020910694377383934, 'sideways_atr_max_pct': 0.03214297961543108, 'sideways_tp_mult': 1.8713842252698174, 'sideways_tsl_mult': 0.6289307477441606, 'sideways_time_stop': 273, 'sideways_use_sma': True, 'sideways_use_ema': True, 'sideways_use_atr': False, 'sideways_use_adx': False, 'sideways_use_spike': True, 'sideways_rsi_required': False}.
[I 2025-08-30 20:01:50,276] Trial 650 finished with values: [-1000000000.0, 1000000000.0] and parameters: {'p_sma': 46, 'p_std': 14, 'p_atr': 10, 'p_adx': 8, 'rsi_period': 45, 'ema1': 22, 'ema2': 42, 'slip_atr_k': 0.2021761689850078, 'slip_spread_k': 0.2230419017355859, 'spread_hl_frac': 0.015390647396667899, 'bb_std_mult': 1.413640868939468, 'rsi_os': 16, 'rsi_ob': 57, 'vol_spike': 0.022313949298790048, 'adx_thresh': 10.858444947773894, 'atr_min_pct': 0.025699742598365855, 'atr_max_pct': 0.04501373540478096, 'tp_mult': 2.201963210892023, 'tsl_mult': 0.7420312280176082, 'strategy': 'mean_reversion', 'time_stop': 21, 'use_sma': False, 'use_atr': True, 'use_adx': False, 'use_ema': False, 'use_spike': True, 'rsi_required': True, 'edge_k': 0.09565533379672402, 'edge_cap': 0.27000743001312427, 'bull_strategy': 'mean_reversion', 'bull_bb_std_mult': 1.9742863624521383, 'bull_rsi_os': 48, 'bull_rsi_ob': 45, 'bull_adx_thresh': 25.62810398576743, 'bull_atr_min_pct': 0.002618848151229878, 'bull_atr_max_pct': 0.02719263738433507, 'bull_tp_mult': 2.2013961476690924, 'bull_tsl_mult': 0.9810358953347411, 'bull_time_stop': 40, 'bull_use_sma': True, 'bull_use_ema': True, 'bull_use_atr': False, 'bull_use_adx': True, 'bull_use_spike': False, 'bull_rsi_required': True, 'bear_strategy': 'mean_reversion', 'bear_bb_std_mult': 3.360780464476896, 'bear_rsi_os': 39, 'bear_rsi_ob': 95, 'bear_adx_thresh': 5.003937802488714, 'bear_atr_min_pct': 0.014634351742617416, 'bear_atr_max_pct': 0.05465278634054816, 'bear_tp_mult': 1.4499864154483675, 'bear_tsl_mult': 0.1633668861621882, 'bear_time_stop': 66, 'bear_use_sma': False, 'bear_use_ema': False, 'bear_use_atr': True, 'bear_use_adx': True, 'bear_use_spike': False, 'bear_rsi_required': False, 'sideways_strategy': 'breakout', 'sideways_bb_std_mult': 2.302515960285766, 'sideways_rsi_os': 20, 'sideways_rsi_ob': 59, 'sideways_adx_thresh': 27.624375328206263, 'sideways_atr_min_pct': 0.01013113629345919, 'sideways_atr_max_pct': 0.038832782937009265, 'sideways_tp_mult': 1.8035999909232354, 'sideways_tsl_mult': 0.1616126694706505, 'sideways_time_stop': 76, 'sideways_use_sma': True, 'sideways_use_ema': True, 'sideways_use_atr': False, 'sideways_use_adx': False, 'sideways_use_spike': True, 'sideways_rsi_required': False}.
[I 2025-08-30 20:01:55,084] Trial 652 finished with values: [-0.021426042518446042, 0.021412885860158506] and parameters: {'p_sma': 36, 'p_std': 9, 'p_atr': 18, 'p_adx': 25, 'rsi_period': 48, 'ema1': 23, 'ema2': 17, 'slip_atr_k': 0.014277063590332307, 'slip_spread_k': 0.5773464528358355, 'spread_hl_frac': 0.030984392489263112, 'bb_std_mult': 1.181210449462593, 'rsi_os': 39, 'rsi_ob': 59, 'vol_spike': 0.03149812846153106, 'adx_thresh': 17.110662054655545, 'atr_min_pct': 0.027098261440422326, 'atr_max_pct': 0.07410100455537552, 'tp_mult': 2.558775707200316, 'tsl_mult': 0.003309679059264825, 'strategy': 'breakout', 'time_stop': 123, 'use_sma': False, 'use_atr': True, 'use_adx': False, 'use_ema': False, 'use_spike': True, 'rsi_required': True, 'edge_k': 0.08515745357045394, 'edge_cap': 0.2326746195593423, 'bull_strategy': 'mean_reversion', 'bull_bb_std_mult': 1.9735720750320263, 'bull_rsi_os': 27, 'bull_rsi_ob': 72, 'bull_adx_thresh': 19.115057029552784, 'bull_atr_min_pct': 0.0024642036260201414, 'bull_atr_max_pct': 0.06122627239528361, 'bull_tp_mult': 2.0566838991335654, 'bull_tsl_mult': 0.48010900678305124, 'bull_time_stop': 175, 'bull_use_sma': True, 'bull_use_ema': False, 'bull_use_atr': False, 'bull_use_adx': True, 'bull_use_spike': False, 'bull_rsi_required': True, 'bear_strategy': 'mean_reversion', 'bear_bb_std_mult': 3.25073704850716, 'bear_rsi_os': 39, 'bear_rsi_ob': 83, 'bear_adx_thresh': 23.484856810792742, 'bear_atr_min_pct': 0.024041007023118045, 'bear_atr_max_pct': 0.05866826765462524, 'bear_tp_mult': 1.824131932836214, 'bear_tsl_mult': 0.15987602320655267, 'bear_time_stop': 47, 'bear_use_sma': False, 'bear_use_ema': False, 'bear_use_atr': True, 'bear_use_adx': True, 'bear_use_spike': False, 'bear_rsi_required': False, 'sideways_strategy': 'breakout', 'sideways_bb_std_mult': 1.6242974100125909, 'sideways_rsi_os': 13, 'sideways_rsi_ob': 59, 'sideways_adx_thresh': 23.550215060052366, 'sideways_atr_min_pct': 0.01722403553615457, 'sideways_atr_max_pct': 0.031479918893684726, 'sideways_tp_mult': 1.1608039387909295, 'sideways_tsl_mult': 0.22945907076816385, 'sideways_time_stop': 290, 'sideways_use_sma': True, 'sideways_use_ema': True, 'sideways_use_atr': False, 'sideways_use_adx': False, 'sideways_use_spike': False, 'sideways_rsi_required': False}.
[I 2025-08-30 20:02:28,167] Trial 654 finished with values: [-1000000000.0, 1000000000.0] and parameters: {'p_sma': 36, 'p_std': 28, 'p_atr': 8, 'p_adx': 25, 'rsi_period': 47, 'ema1': 22, 'ema2': 18, 'slip_atr_k': 0.19627008245929362, 'slip_spread_k': 0.4089948797023747, 'spread_hl_frac': 0.015390729932699439, 'bb_std_mult': 1.2094130503767149, 'rsi_os': 39, 'rsi_ob': 59, 'vol_spike': 0.1352628330158855, 'adx_thresh': 21.69809496160954, 'atr_min_pct': 0.023121738571746406, 'atr_max_pct': 0.03472936460198317, 'tp_mult': 2.140180284901176, 'tsl_mult': 0.7497632685966571, 'strategy': 'breakout', 'time_stop': 120, 'use_sma': False, 'use_atr': True, 'use_adx': False, 'use_ema': False, 'use_spike': True, 'rsi_required': True, 'edge_k': 0.28743802718096545, 'edge_cap': 0.2207091188254962, 'bull_strategy': 'mean_reversion', 'bull_bb_std_mult': 2.9375184237881906, 'bull_rsi_os': 27, 'bull_rsi_ob': 72, 'bull_adx_thresh': 23.427204436095497, 'bull_atr_min_pct': 0.002589666298744361, 'bull_atr_max_pct': 0.1116673101735072, 'bull_tp_mult': 2.314146327203749, 'bull_tsl_mult': 0.4794892544629832, 'bull_time_stop': 34, 'bull_use_sma': True, 'bull_use_ema': False, 'bull_use_atr': False, 'bull_use_adx': True, 'bull_use_spike': True, 'bull_rsi_required': True, 'bear_strategy': 'breakout', 'bear_bb_std_mult': 0.6523085802963613, 'bear_rsi_os': 38, 'bear_rsi_ob': 52, 'bear_adx_thresh': 29.274908231798697, 'bear_atr_min_pct': 0.015547915380821172, 'bear_atr_max_pct': 0.05920118356527759, 'bear_tp_mult': 2.938996751885622, 'bear_tsl_mult': 0.12260259268752748, 'bear_time_stop': 36, 'bear_use_sma': True, 'bear_use_ema': False, 'bear_use_atr': True, 'bear_use_adx': True, 'bear_use_spike': False, 'bear_rsi_required': False, 'sideways_strategy': 'breakout', 'sideways_bb_std_mult': 1.5769031430916585, 'sideways_rsi_os': 11, 'sideways_rsi_ob': 60, 'sideways_adx_thresh': 6.67812014594737, 'sideways_atr_min_pct': 0.029558841459453485, 'sideways_atr_max_pct': 0.11171270953957281, 'sideways_tp_mult': 1.7723213459113463, 'sideways_tsl_mult': 0.6983754776277478, 'sideways_time_stop': 109, 'sideways_use_sma': True, 'sideways_use_ema': True, 'sideways_use_atr': False, 'sideways_use_adx': False, 'sideways_use_spike': False, 'sideways_rsi_required': False}.
[I 2025-08-30 20:02:28,763] Trial 655 finished with values: [-1000000000.0, 1000000000.0] and parameters: {'p_sma': 36, 'p_std': 27, 'p_atr': 28, 'p_adx': 19, 'rsi_period': 48, 'ema1': 24, 'ema2': 18, 'slip_atr_k': 0.1958137394074873, 'slip_spread_k': 0.4094145601343243, 'spread_hl_frac': 0.0027282184984113427, 'bb_std_mult': 1.1865438229397447, 'rsi_os': 43, 'rsi_ob': 59, 'vol_spike': 0.1369275304668914, 'adx_thresh': 18.1010989161907, 'atr_min_pct': 0.023195504290576364, 'atr_max_pct': 0.1413139881775575, 'tp_mult': 2.121982737117144, 'tsl_mult': 0.5943539353092302, 'strategy': 'breakout', 'time_stop': 300, 'use_sma': False, 'use_atr': True, 'use_adx': False, 'use_ema': False, 'use_spike': True, 'rsi_required': True, 'edge_k': 0.15291491623774128, 'edge_cap': 0.137840389177038, 'bull_strategy': 'mean_reversion', 'bull_bb_std_mult': 2.901256380960989, 'bull_rsi_os': 53, 'bull_rsi_ob': 72, 'bull_adx_thresh': 24.947521196913815, 'bull_atr_min_pct': 0.018586256465746465, 'bull_atr_max_pct': 0.025005892825016977, 'bull_tp_mult': 1.344339765646424, 'bull_tsl_mult': 0.9097033017152618, 'bull_time_stop': 212, 'bull_use_sma': True, 'bull_use_ema': False, 'bull_use_atr': False, 'bull_use_adx': True, 'bull_use_spike': True, 'bull_rsi_required': True, 'bear_strategy': 'breakout', 'bear_bb_std_mult': 3.095756400972964, 'bear_rsi_os': 39, 'bear_rsi_ob': 83, 'bear_adx_thresh': 6.585763961088782, 'bear_atr_min_pct': 0.015581229387879654, 'bear_atr_max_pct': 0.14816151697593627, 'bear_tp_mult': 1.8259437813967079, 'bear_tsl_mult': 0.4841513084045055, 'bear_time_stop': 46, 'bear_use_sma': True, 'bear_use_ema': False, 'bear_use_atr': True, 'bear_use_adx': True, 'bear_use_spike': False, 'bear_rsi_required': False, 'sideways_strategy': 'breakout', 'sideways_bb_std_mult': 2.0984889893765404, 'sideways_rsi_os': 48, 'sideways_rsi_ob': 76, 'sideways_adx_thresh': 21.69991978621949, 'sideways_atr_min_pct': 0.021909605828113618, 'sideways_atr_max_pct': 0.14095993745188368, 'sideways_tp_mult': 1.145455420982309, 'sideways_tsl_mult': 0.6976155495863156, 'sideways_time_stop': 23, 'sideways_use_sma': True, 'sideways_use_ema': True, 'sideways_use_atr': False, 'sideways_use_adx': False, 'sideways_use_spike': False, 'sideways_rsi_required': False}.
[I 2025-08-30 20:02:28,939] Trial 653 finished with values: [-1000000000.0, 1000000000.0] and parameters: {'p_sma': 36, 'p_std': 25, 'p_atr': 10, 'p_adx': 15, 'rsi_period': 53, 'ema1': 23, 'ema2': 41, 'slip_atr_k': 0.011003408360221545, 'slip_spread_k': 0.4075452323887649, 'spread_hl_frac': 0.0026610557944905743, 'bb_std_mult': 1.1697139451661582, 'rsi_os': 39, 'rsi_ob': 48, 'vol_spike': 0.06618330286771153, 'adx_thresh': 9.985858652529942, 'atr_min_pct': 0.023034138319101102, 'atr_max_pct': 0.07391091296002099, 'tp_mult': 2.1454438426425364, 'tsl_mult': 0.3595811771522575, 'strategy': 'breakout', 'time_stop': 300, 'use_sma': False, 'use_atr': True, 'use_adx': False, 'use_ema': False, 'use_spike': True, 'rsi_required': True, 'edge_k': 0.0964239639910367, 'edge_cap': 0.26867736042727786, 'bull_strategy': 'mean_reversion', 'bull_bb_std_mult': 0.7966124705582751, 'bull_rsi_os': 27, 'bull_rsi_ob': 77, 'bull_adx_thresh': 25.05239654590967, 'bull_atr_min_pct': 0.018502090650011474, 'bull_atr_max_pct': 0.026103608055217706, 'bull_tp_mult': 2.1930510897142956, 'bull_tsl_mult': 0.48060678064385376, 'bull_time_stop': 294, 'bull_use_sma': True, 'bull_use_ema': False, 'bull_use_atr': False, 'bull_use_adx': True, 'bull_use_spike': True, 'bull_rsi_required': True, 'bear_strategy': 'mean_reversion', 'bear_bb_std_mult': 2.680218855343666, 'bear_rsi_os': 38, 'bear_rsi_ob': 75, 'bear_adx_thresh': 29.177835181770963, 'bear_atr_min_pct': 0.02413928415194174, 'bear_atr_max_pct': 0.058862878539221224, 'bear_tp_mult': 1.8278711672825723, 'bear_tsl_mult': 0.20928458270002115, 'bear_time_stop': 48, 'bear_use_sma': False, 'bear_use_ema': False, 'bear_use_atr': True, 'bear_use_adx': True, 'bear_use_spike': False, 'bear_rsi_required': False, 'sideways_strategy': 'breakout', 'sideways_bb_std_mult': 2.002531787673135, 'sideways_rsi_os': 42, 'sideways_rsi_ob': 58, 'sideways_adx_thresh': 33.29024131484003, 'sideways_atr_min_pct': 0.021743822972170958, 'sideways_atr_max_pct': 0.1122733678009906, 'sideways_tp_mult': 1.8834585609904666, 'sideways_tsl_mult': 0.6948989825418659, 'sideways_time_stop': 109, 'sideways_use_sma': True, 'sideways_use_ema': True, 'sideways_use_atr': False, 'sideways_use_adx': False, 'sideways_use_spike': False, 'sideways_rsi_required': False}.
[I 2025-08-30 20:02:29,015] Trial 656 finished with values: [-1000000000.0, 1000000000.0] and parameters: {'p_sma': 47, 'p_std': 25, 'p_atr': 29, 'p_adx': 19, 'rsi_period': 69, 'ema1': 24, 'ema2': 20, 'slip_atr_k': 0.024660014543353176, 'slip_spread_k': 0.40488980799294144, 'spread_hl_frac': 0.0027999701160500746, 'bb_std_mult': 0.9028219640814018, 'rsi_os': 38, 'rsi_ob': 56, 'vol_spike': 0.09572894868630388, 'adx_thresh': 9.908638355332695, 'atr_min_pct': 0.02288772653772482, 'atr_max_pct': 0.14165138507015443, 'tp_mult': 1.200532915068567, 'tsl_mult': 0.7098772761236825, 'strategy': 'breakout', 'time_stop': 10, 'use_sma': False, 'use_atr': True, 'use_adx': True, 'use_ema': False, 'use_spike': True, 'rsi_required': True, 'edge_k': 0.15802058342906167, 'edge_cap': 0.1964075629037817, 'bull_strategy': 'mean_reversion', 'bull_bb_std_mult': 2.2116477786651423, 'bull_rsi_os': 52, 'bull_rsi_ob': 51, 'bull_adx_thresh': 5.010403797708076, 'bull_atr_min_pct': 0.018560943150914496, 'bull_atr_max_pct': 0.11138600855491969, 'bull_tp_mult': 2.278251959257524, 'bull_tsl_mult': 0.959204037867246, 'bull_time_stop': 60, 'bull_use_sma': True, 'bull_use_ema': False, 'bull_use_atr': False, 'bull_use_adx': True, 'bull_use_spike': True, 'bull_rsi_required': True, 'bear_strategy': 'breakout', 'bear_bb_std_mult': 3.1823397277921153, 'bear_rsi_os': 38, 'bear_rsi_ob': 52, 'bear_adx_thresh': 5.9691714053663, 'bear_atr_min_pct': 0.015288312928979756, 'bear_atr_max_pct': 0.06015590910432159, 'bear_tp_mult': 1.6688977496431459, 'bear_tsl_mult': 0.29714173818763945, 'bear_time_stop': 38, 'bear_use_sma': True, 'bear_use_ema': False, 'bear_use_atr': True, 'bear_use_adx': True, 'bear_use_spike': True, 'bear_rsi_required': True, 'sideways_strategy': 'mean_reversion', 'sideways_bb_std_mult': 2.1028704323632117, 'sideways_rsi_os': 16, 'sideways_rsi_ob': 62, 'sideways_adx_thresh': 6.374274363366533, 'sideways_atr_min_pct': 0.0076650213803981125, 'sideways_atr_max_pct': 0.11211184214438374, 'sideways_tp_mult': 1.766645332419505, 'sideways_tsl_mult': 0.6930273092972635, 'sideways_time_stop': 87, 'sideways_use_sma': True, 'sideways_use_ema': False, 'sideways_use_atr': False, 'sideways_use_adx': False, 'sideways_use_spike': False, 'sideways_rsi_required': False}.
