[I 2025-08-30 20:09:38,110] Trial 703 finished with values: [-1000000000.0, 1000000000.0] and parameters: {'p_sma': 43, 'p_std': 53, 'p_atr': 13, 'p_adx': 8, 'rsi_period': 20, 'ema1': 23, 'ema2': 22, 'slip_atr_k': 0.221642449107388, 'slip_spread_k': 0.3724324286026242, 'spread_hl_frac': 0.004170816444947924, 'bb_std_mult': 0.9732190135459856, 'rsi_os': 39, 'rsi_ob': 56, 'vol_spike': 0.00024149973734519103, 'adx_thresh': 17.329899798987114, 'atr_min_pct': 0.02208971927320583, 'atr_max_pct': 0.03725501565345425, 'tp_mult': 2.2025697744485275, 'tsl_mult': 0.7008013539100907, 'strategy': 'breakout', 'time_stop': 30, 'use_sma': False, 'use_atr': True, 'use_adx': False, 'use_ema': False, 'use_spike': True, 'rsi_required': True, 'edge_k': 0.12231864785752554, 'edge_cap': 0.22378988856481302, 'bull_strategy': 'mean_reversion', 'bull_bb_std_mult': 2.7024730141339246, 'bull_rsi_os': 49, 'bull_rsi_ob': 69, 'bull_adx_thresh': 21.59585396438958, 'bull_atr_min_pct': 0.00296912266107068, 'bull_atr_max_pct': 0.014844489018496613, 'bull_tp_mult': 2.1579571730856495, 'bull_tsl_mult': 0.9996241991963417, 'bull_time_stop': 288, 'bull_use_sma': True, 'bull_use_ema': True, 'bull_use_atr': False, 'bull_use_adx': True, 'bull_use_spike': False, 'bull_rsi_required': True, 'bear_strategy': 'mean_reversion', 'bear_bb_std_mult': 3.294342354799394, 'bear_rsi_os': 49, 'bear_rsi_ob': 82, 'bear_adx_thresh': 18.519303603414105, 'bear_atr_min_pct': 0.014069937985801778, 'bear_atr_max_pct': 0.09451123230174661, 'bear_tp_mult': 1.7201367985224616, 'bear_tsl_mult': 0.12686038978060463, 'bear_time_stop': 200, 'bear_use_sma': False, 'bear_use_ema': False, 'bear_use_atr': True, 'bear_use_adx': True, 'bear_use_spike': False, 'bear_rsi_required': False, 'sideways_strategy': 'breakout', 'sideways_bb_std_mult': 1.3193753464299935, 'sideways_rsi_os': 55, 'sideways_rsi_ob': 59, 'sideways_adx_thresh': 21.12668928078474, 'sideways_atr_min_pct': 0.017653863083600924, 'sideways_atr_max_pct': 0.12076457472824477, 'sideways_tp_mult': 1.8236635510231582, 'sideways_tsl_mult': 0.6920176345761454, 'sideways_time_stop': 46, 'sideways_use_sma': True, 'sideways_use_ema': True, 'sideways_use_atr': False, 'sideways_use_adx': False, 'sideways_use_spike': True, 'sideways_rsi_required': False}.
[I 2025-08-30 20:09:38,709] Trial 704 finished with values: [-1000000000.0, 1000000000.0] and parameters: {'p_sma': 29, 'p_std': 48, 'p_atr': 16, 'p_adx': 10, 'rsi_period': 69, 'ema1': 25, 'ema2': 18, 'slip_atr_k': 0.22353641121897563, 'slip_spread_k': 0.565712531841887, 'spread_hl_frac': 0.004540678936958553, 'bb_std_mult': 2.3891941260813714, 'rsi_os': 11, 'rsi_ob': 56, 'vol_spike': 0.2298630882379042, 'adx_thresh': 28.843771110323424, 'atr_min_pct': 0.015049790238556739, 'atr_max_pct': 0.041700960790170855, 'tp_mult': 2.2762739471380207, 'tsl_mult': 0.6843203805413781, 'strategy': 'mean_reversion', 'time_stop': 33, 'use_sma': False, 'use_atr': True, 'use_adx': False, 'use_ema': False, 'use_spike': True, 'rsi_required': True, 'edge_k': 0.11327572780918427, 'edge_cap': 0.7815850337164157, 'bull_strategy': 'mean_reversion', 'bull_bb_std_mult': 1.8111111827675679, 'bull_rsi_os': 49, 'bull_rsi_ob': 73, 'bull_adx_thresh': 26.040317291014738, 'bull_atr_min_pct': 0.0028365674324806757, 'bull_atr_max_pct': 0.13462896362206134, 'bull_tp_mult': 2.148664909946868, 'bull_tsl_mult': 0.8984349086084481, 'bull_time_stop': 108, 'bull_use_sma': True, 'bull_use_ema': True, 'bull_use_atr': False, 'bull_use_adx': True, 'bull_use_spike': False, 'bull_rsi_required': True, 'bear_strategy': 'mean_reversion', 'bear_bb_std_mult': 3.3028129342662655, 'bear_rsi_os': 13, 'bear_rsi_ob': 82, 'bear_adx_thresh': 32.49054051293567, 'bear_atr_min_pct': 0.01619263488288062, 'bear_atr_max_pct': 0.1406052019545561, 'bear_tp_mult': 1.7058417279228684, 'bear_tsl_mult': 0.6463826276840197, 'bear_time_stop': 20, 'bear_use_sma': False, 'bear_use_ema': False, 'bear_use_atr': True, 'bear_use_adx': True, 'bear_use_spike': False, 'bear_rsi_required': False, 'sideways_strategy': 'breakout', 'sideways_bb_std_mult': 1.1495756600421696, 'sideways_rsi_os': 15, 'sideways_rsi_ob': 90, 'sideways_adx_thresh': 24.19031385159951, 'sideways_atr_min_pct': 0.02034084226273616, 'sideways_atr_max_pct': 0.12125637637819153, 'sideways_tp_mult': 2.0405860909233824, 'sideways_tsl_mult': 0.02913992689965389, 'sideways_time_stop': 99, 'sideways_use_sma': True, 'sideways_use_ema': True, 'sideways_use_atr': False, 'sideways_use_adx': False, 'sideways_use_spike': True, 'sideways_rsi_required': False}.
[I 2025-08-30 20:09:38,710] Trial 705 finished with values: [-1000000000.0, 1000000000.0] and parameters: {'p_sma': 43, 'p_std': 44, 'p_atr': 16, 'p_adx': 10, 'rsi_period': 7, 'ema1': 29, 'ema2': 22, 'slip_atr_k': 0.13676589954047333, 'slip_spread_k': 0.4442579781836374, 'spread_hl_frac': 0.033485230099143545, 'bb_std_mult': 2.3578278116902442, 'rsi_os': 29, 'rsi_ob': 80, 'vol_spike': 0.22936488983884923, 'adx_thresh': 34.095374582000034, 'atr_min_pct': 0.003406959362412648, 'atr_max_pct': 0.1256053765601185, 'tp_mult': 2.150581299199154, 'tsl_mult': 0.6316106885466621, 'strategy': 'mean_reversion', 'time_stop': 5, 'use_sma': False, 'use_atr': True, 'use_adx': False, 'use_ema': False, 'use_spike': True, 'rsi_required': True, 'edge_k': 0.13699922979764945, 'edge_cap': 0.22792143095717118, 'bull_strategy': 'mean_reversion', 'bull_bb_std_mult': 2.680585593900279, 'bull_rsi_os': 12, 'bull_rsi_ob': 69, 'bull_adx_thresh': 27.980105517986754, 'bull_atr_min_pct': 0.0028753037690230146, 'bull_atr_max_pct': 0.11656674777623215, 'bull_tp_mult': 2.293487846028615, 'bull_tsl_mult': 0.045589280514770625, 'bull_time_stop': 85, 'bull_use_sma': True, 'bull_use_ema': True, 'bull_use_atr': False, 'bull_use_adx': True, 'bull_use_spike': False, 'bull_rsi_required': True, 'bear_strategy': 'mean_reversion', 'bear_bb_std_mult': 3.297100720135638, 'bear_rsi_os': 16, 'bear_rsi_ob': 71, 'bear_adx_thresh': 18.523895764707135, 'bear_atr_min_pct': 0.009743501792494813, 'bear_atr_max_pct': 0.052246174475018003, 'bear_tp_mult': 1.6878208915801711, 'bear_tsl_mult': 0.13183190899957536, 'bear_time_stop': 203, 'bear_use_sma': False, 'bear_use_ema': False, 'bear_use_atr': True, 'bear_use_adx': True, 'bear_use_spike': False, 'bear_rsi_required': False, 'sideways_strategy': 'breakout', 'sideways_bb_std_mult': 2.0352212400879948, 'sideways_rsi_os': 28, 'sideways_rsi_ob': 58, 'sideways_adx_thresh': 10.518148082062634, 'sideways_atr_min_pct': 0.01847188109762586, 'sideways_atr_max_pct': 0.07226586726405805, 'sideways_tp_mult': 2.079163341398387, 'sideways_tsl_mult': 0.656402678819645, 'sideways_time_stop': 284, 'sideways_use_sma': True, 'sideways_use_ema': True, 'sideways_use_atr': False, 'sideways_use_adx': False, 'sideways_use_spike': True, 'sideways_rsi_required': False}.
[I 2025-08-30 20:09:38,823] Trial 702 finished with values: [-1000000000.0, 1000000000.0] and parameters: {'p_sma': 31, 'p_std': 13, 'p_atr': 11, 'p_adx': 8, 'rsi_period': 51, 'ema1': 8, 'ema2': 35, 'slip_atr_k': 0.18218401641908538, 'slip_spread_k': 0.4449206238992321, 'spread_hl_frac': 0.03370193444523966, 'bb_std_mult': 1.7240043207293747, 'rsi_os': 38, 'rsi_ob': 55, 'vol_spike': 0.01803850039219887, 'adx_thresh': 29.08493189082556, 'atr_min_pct': 0.0060229145510236354, 'atr_max_pct': 0.038288137514885565, 'tp_mult': 2.357016737818783, 'tsl_mult': 0.7010195348052886, 'strategy': 'breakout', 'time_stop': 47, 'use_sma': False, 'use_atr': True, 'use_adx': False, 'use_ema': False, 'use_spike': True, 'rsi_required': True, 'edge_k': 0.7987258115920791, 'edge_cap': 0.22106127061865347, 'bull_strategy': 'mean_reversion', 'bull_bb_std_mult': 3.0712291549797865, 'bull_rsi_os': 48, 'bull_rsi_ob': 80, 'bull_adx_thresh': 25.921196346044677, 'bull_atr_min_pct': 0.002049715608317722, 'bull_atr_max_pct': 0.015688819496092694, 'bull_tp_mult': 2.140625701100382, 'bull_tsl_mult': 0.250101401127668, 'bull_time_stop': 82, 'bull_use_sma': True, 'bull_use_ema': True, 'bull_use_atr': False, 'bull_use_adx': True, 'bull_use_spike': False, 'bull_rsi_required': True, 'bear_strategy': 'mean_reversion', 'bear_bb_std_mult': 3.324039375706495, 'bear_rsi_os': 48, 'bear_rsi_ob': 46, 'bear_adx_thresh': 6.408773762838434, 'bear_atr_min_pct': 0.00986124044411156, 'bear_atr_max_pct': 0.09742409498265517, 'bear_tp_mult': 1.5464789071374048, 'bear_tsl_mult': 0.0783684046709609, 'bear_time_stop': 205, 'bear_use_sma': False, 'bear_use_ema': False, 'bear_use_atr': True, 'bear_use_adx': True, 'bear_use_spike': False, 'bear_rsi_required': False, 'sideways_strategy': 'breakout', 'sideways_bb_std_mult': 2.0793364226541446, 'sideways_rsi_os': 55, 'sideways_rsi_ob': 90, 'sideways_adx_thresh': 31.106873294368164, 'sideways_atr_min_pct': 0.01774448129278571, 'sideways_atr_max_pct': 0.11815990144195472, 'sideways_tp_mult': 1.375583227907926, 'sideways_tsl_mult': 0.02018762073758823, 'sideways_time_stop': 276, 'sideways_use_sma': True, 'sideways_use_ema': True, 'sideways_use_atr': False, 'sideways_use_adx': False, 'sideways_use_spike': True, 'sideways_rsi_required': False}.
[I 2025-08-30 20:10:13,443] Trial 709 finished with values: [-1000000000.0, 1000000000.0] and parameters: {'p_sma': 41, 'p_std': 27, 'p_atr': 12, 'p_adx': 7, 'rsi_period': 54, 'ema1': 24, 'ema2': 17, 'slip_atr_k': 0.03441823541376149, 'slip_spread_k': 0.3912291126906978, 'spread_hl_frac': 0.02885923985228545, 'bb_std_mult': 0.8373327838958077, 'rsi_os': 5, 'rsi_ob': 58, 'vol_spike': 0.057448822441347525, 'adx_thresh': 18.997365711244015, 'atr_min_pct': 0.009684756818298767, 'atr_max_pct': 0.1080522610772543, 'tp_mult': 2.8168814462338587, 'tsl_mult': 0.7236578405635121, 'strategy': 'breakout', 'time_stop': 265, 'use_sma': True, 'use_atr': False, 'use_adx': False, 'use_ema': False, 'use_spike': True, 'rsi_required': True, 'edge_k': 0.04739874105955011, 'edge_cap': 0.2764446608358389, 'bull_strategy': 'breakout', 'bull_bb_std_mult': 1.9655042844258312, 'bull_rsi_os': 19, 'bull_rsi_ob': 47, 'bull_adx_thresh': 6.3249066117537485, 'bull_atr_min_pct': 0.004771470173078161, 'bull_atr_max_pct': 0.022926488371859278, 'bull_tp_mult': 1.0424140860045417, 'bull_tsl_mult': 0.08127534838795308, 'bull_time_stop': 185, 'bull_use_sma': True, 'bull_use_ema': False, 'bull_use_atr': False, 'bull_use_adx': True, 'bull_use_spike': True, 'bull_rsi_required': True, 'bear_strategy': 'breakout', 'bear_bb_std_mult': 2.5371756716366134, 'bear_rsi_os': 18, 'bear_rsi_ob': 74, 'bear_adx_thresh': 7.13588502739977, 'bear_atr_min_pct': 0.015872264322484578, 'bear_atr_max_pct': 0.05706530949317243, 'bear_tp_mult': 1.8038034107868695, 'bear_tsl_mult': 0.08707743493091012, 'bear_time_stop': 249, 'bear_use_sma': True, 'bear_use_ema': False, 'bear_use_atr': False, 'bear_use_adx': False, 'bear_use_spike': False, 'bear_rsi_required': False, 'sideways_strategy': 'breakout', 'sideways_bb_std_mult': 2.003117118483666, 'sideways_rsi_os': 37, 'sideways_rsi_ob': 57, 'sideways_adx_thresh': 10.095437884071677, 'sideways_atr_min_pct': 0.02127077307545923, 'sideways_atr_max_pct': 0.0763817758706691, 'sideways_tp_mult': 2.3054862498950826, 'sideways_tsl_mult': 0.5303537280610132, 'sideways_time_stop': 220, 'sideways_use_sma': False, 'sideways_use_ema': True, 'sideways_use_atr': False, 'sideways_use_adx': False, 'sideways_use_spike': False, 'sideways_rsi_required': True}.
[I 2025-08-30 20:10:13,807] Trial 708 finished with values: [-1000000000.0, 1000000000.0] and parameters: {'p_sma': 31, 'p_std': 28, 'p_atr': 7, 'p_adx': 30, 'rsi_period': 54, 'ema1': 24, 'ema2': 44, 'slip_atr_k': 0.0351281805756057, 'slip_spread_k': 0.39743732451071545, 'spread_hl_frac': 0.00248165011206821, 'bb_std_mult': 1.4648264253251502, 'rsi_os': 36, 'rsi_ob': 91, 'vol_spike': 0.04783721996526732, 'adx_thresh': 18.723649722641557, 'atr_min_pct': 0.023435295210823097, 'atr_max_pct': 0.029842762587384636, 'tp_mult': 1.1166835185896522, 'tsl_mult': 0.32320038619232583, 'strategy': 'breakout', 'time_stop': 264, 'use_sma': True, 'use_atr': False, 'use_adx': False, 'use_ema': False, 'use_spike': True, 'rsi_required': True, 'edge_k': 1.245284143876307, 'edge_cap': 0.27606430735582166, 'bull_strategy': 'breakout', 'bull_bb_std_mult': 1.972935743433016, 'bull_rsi_os': 43, 'bull_rsi_ob': 47, 'bull_adx_thresh': 26.78055319427467, 'bull_atr_min_pct': 0.0016282749621962548, 'bull_atr_max_pct': 0.029681788701183334, 'bull_tp_mult': 2.555349299453532, 'bull_tsl_mult': 0.08728539289271187, 'bull_time_stop': 187, 'bull_use_sma': True, 'bull_use_ema': False, 'bull_use_atr': False, 'bull_use_adx': True, 'bull_use_spike': True, 'bull_rsi_required': True, 'bear_strategy': 'breakout', 'bear_bb_std_mult': 3.19473997250089, 'bear_rsi_os': 18, 'bear_rsi_ob': 64, 'bear_adx_thresh': 6.476509898723055, 'bear_atr_min_pct': 0.01586311521259266, 'bear_atr_max_pct': 0.05724085563623882, 'bear_tp_mult': 1.541575630084754, 'bear_tsl_mult': 0.08349465041652318, 'bear_time_stop': 294, 'bear_use_sma': True, 'bear_use_ema': False, 'bear_use_atr': False, 'bear_use_adx': False, 'bear_use_spike': False, 'bear_rsi_required': False, 'sideways_strategy': 'breakout', 'sideways_bb_std_mult': 1.9925051714672388, 'sideways_rsi_os': 18, 'sideways_rsi_ob': 75, 'sideways_adx_thresh': 31.918908397669206, 'sideways_atr_min_pct': 0.003256847735329837, 'sideways_atr_max_pct': 0.11600021323307509, 'sideways_tp_mult': 1.6545006377791145, 'sideways_tsl_mult': 0.6197541055572381, 'sideways_time_stop': 221, 'sideways_use_sma': False, 'sideways_use_ema': True, 'sideways_use_atr': False, 'sideways_use_adx': False, 'sideways_use_spike': False, 'sideways_rsi_required': True}.
[I 2025-08-30 20:10:13,807] Trial 706 finished with values: [-1000000000.0, 1000000000.0] and parameters: {'p_sma': 50, 'p_std': 48, 'p_atr': 12, 'p_adx': 8, 'rsi_period': 7, 'ema1': 25, 'ema2': 17, 'slip_atr_k': 2.2767181953816523e-05, 'slip_spread_k': 0.4469853257468566, 'spread_hl_frac': 0.002434688354280349, 'bb_std_mult': 1.519428973455052, 'rsi_os': 8, 'rsi_ob': 58, 'vol_spike': 0.05555992021026652, 'adx_thresh': 34.28611161352279, 'atr_min_pct': 0.009358267913368192, 'atr_max_pct': 0.1347791896523718, 'tp_mult': 2.1564424833571323, 'tsl_mult': 0.31394091257937834, 'strategy': 'mean_reversion', 'time_stop': 172, 'use_sma': False, 'use_atr': True, 'use_adx': False, 'use_ema': False, 'use_spike': True, 'rsi_required': True, 'edge_k': 0.1346209776583067, 'edge_cap': 0.24213080042471155, 'bull_strategy': 'mean_reversion', 'bull_bb_std_mult': 3.1087703834699303, 'bull_rsi_os': 49, 'bull_rsi_ob': 80, 'bull_adx_thresh': 25.89981866920044, 'bull_atr_min_pct': 0.0029109082272318477, 'bull_atr_max_pct': 0.022868823780001196, 'bull_tp_mult': 2.5605152207358772, 'bull_tsl_mult': 0.9410250967666959, 'bull_time_stop': 107, 'bull_use_sma': True, 'bull_use_ema': False, 'bull_use_atr': False, 'bull_use_adx': True, 'bull_use_spike': True, 'bull_rsi_required': True, 'bear_strategy': 'breakout', 'bear_bb_std_mult': 3.1697998717610023, 'bear_rsi_os': 16, 'bear_rsi_ob': 83, 'bear_adx_thresh': 6.170822872348382, 'bear_atr_min_pct': 0.016129490276334476, 'bear_atr_max_pct': 0.05194101879997988, 'bear_tp_mult': 1.6815347981444282, 'bear_tsl_mult': 0.5215062588761532, 'bear_time_stop': 20, 'bear_use_sma': True, 'bear_use_ema': False, 'bear_use_atr': True, 'bear_use_adx': True, 'bear_use_spike': False, 'bear_rsi_required': False, 'sideways_strategy': 'breakout', 'sideways_bb_std_mult': 2.9126591973776983, 'sideways_rsi_os': 20, 'sideways_rsi_ob': 92, 'sideways_adx_thresh': 10.52257611311466, 'sideways_atr_min_pct': 0.018443250270110314, 'sideways_atr_max_pct': 0.11582940914094099, 'sideways_tp_mult': 1.6645002272885667, 'sideways_tsl_mult': 0.6552280134244239, 'sideways_time_stop': 283, 'sideways_use_sma': True, 'sideways_use_ema': True, 'sideways_use_atr': False, 'sideways_use_adx': False, 'sideways_use_spike': False, 'sideways_rsi_required': False}.
[I 2025-08-30 20:10:13,929] Trial 707 finished with values: [-1000000000.0, 1000000000.0] and parameters: {'p_sma': 31, 'p_std': 27, 'p_atr': 11, 'p_adx': 30, 'rsi_period': 54, 'ema1': 24, 'ema2': 56, 'slip_atr_k': 0.012266490864058496, 'slip_spread_k': 0.9989484973784065, 'spread_hl_frac': 0.044439956520054086, 'bb_std_mult': 1.4876481639946562, 'rsi_os': 26, 'rsi_ob': 58, 'vol_spike': 0.0553610602507763, 'adx_thresh': 18.903463817775528, 'atr_min_pct': 0.023664488252708754, 'atr_max_pct': 0.13379381121074319, 'tp_mult': 2.663450022856806, 'tsl_mult': 0.7261694607816795, 'strategy': 'breakout', 'time_stop': 105, 'use_sma': True, 'use_atr': False, 'use_adx': False, 'use_ema': False, 'use_spike': True, 'rsi_required': True, 'edge_k': 0.30035502501380945, 'edge_cap': 0.24194027262997644, 'bull_strategy': 'breakout', 'bull_bb_std_mult': 3.2150501481850577, 'bull_rsi_os': 50, 'bull_rsi_ob': 73, 'bull_adx_thresh': 26.54629996727857, 'bull_atr_min_pct': 0.0015826013324357815, 'bull_atr_max_pct': 0.02323102540562974, 'bull_tp_mult': 2.200797311252382, 'bull_tsl_mult': 0.08647785367154492, 'bull_time_stop': 189, 'bull_use_sma': True, 'bull_use_ema': False, 'bull_use_atr': False, 'bull_use_adx': True, 'bull_use_spike': True, 'bull_rsi_required': True, 'bear_strategy': 'breakout', 'bear_bb_std_mult': 2.568828067584331, 'bear_rsi_os': 36, 'bear_rsi_ob': 85, 'bear_adx_thresh': 6.320745723248207, 'bear_atr_min_pct': 0.01582962042985943, 'bear_atr_max_pct': 0.05706431920884477, 'bear_tp_mult': 1.7967607057768331, 'bear_tsl_mult': 0.08103918287680395, 'bear_time_stop': 40, 'bear_use_sma': True, 'bear_use_ema': False, 'bear_use_atr': False, 'bear_use_adx': False, 'bear_use_spike': False, 'bear_rsi_required': False, 'sideways_strategy': 'breakout', 'sideways_bb_std_mult': 0.5987135605589409, 'sideways_rsi_os': 11, 'sideways_rsi_ob': 57, 'sideways_adx_thresh': 5.143176146351195, 'sideways_atr_min_pct': 0.0013218455228142974, 'sideways_atr_max_pct': 0.04278251488956549, 'sideways_tp_mult': 1.6562732337434345, 'sideways_tsl_mult': 0.6136133548922227, 'sideways_time_stop': 281, 'sideways_use_sma': False, 'sideways_use_ema': True, 'sideways_use_atr': False, 'sideways_use_adx': False, 'sideways_use_spike': False, 'sideways_rsi_required': True}.
[I 2025-08-30 20:10:47,428] Trial 713 finished with values: [-1000000000.0, 1000000000.0] and parameters: {'p_sma': 16, 'p_std': 58, 'p_atr': 10, 'p_adx': 13, 'rsi_period': 59, 'ema1': 28, 'ema2': 54, 'slip_atr_k': 0.04697440642215896, 'slip_spread_k': 0.6988192202887481, 'spread_hl_frac': 0.042546187023111304, 'bb_std_mult': 1.0698682983950893, 'rsi_os': 39, 'rsi_ob': 57, 'vol_spike': 0.028051841796873086, 'adx_thresh': 16.22179391316809, 'atr_min_pct': 0.0262123950969611, 'atr_max_pct': 0.06927981981357605, 'tp_mult': 2.26686898644123, 'tsl_mult': 0.8383853017698543, 'strategy': 'breakout', 'time_stop': 30, 'use_sma': False, 'use_atr': True, 'use_adx': True, 'use_ema': True, 'use_spike': False, 'rsi_required': True, 'edge_k': 0.8556823265325358, 'edge_cap': 0.18829879217292939, 'bull_strategy': 'mean_reversion', 'bull_bb_std_mult': 1.5526320292767126, 'bull_rsi_os': 53, 'bull_rsi_ob': 75, 'bull_adx_thresh': 25.526617407606825, 'bull_atr_min_pct': 0.0025115320609946142, 'bull_atr_max_pct': 0.03081556747312108, 'bull_tp_mult': 2.256748304785755, 'bull_tsl_mult': 0.5856700775349357, 'bull_time_stop': 177, 'bull_use_sma': True, 'bull_use_ema': False, 'bull_use_atr': False, 'bull_use_adx': True, 'bull_use_spike': True, 'bull_rsi_required': False, 'bear_strategy': 'breakout', 'bear_bb_std_mult': 1.3500302807683875, 'bear_rsi_os': 41, 'bear_rsi_ob': 83, 'bear_adx_thresh': 8.15116857105641, 'bear_atr_min_pct': 0.01300913050434744, 'bear_atr_max_pct': 0.04772704544695537, 'bear_tp_mult': 1.7738516975262983, 'bear_tsl_mult': 0.1127464029623075, 'bear_time_stop': 12, 'bear_use_sma': True, 'bear_use_ema': True, 'bear_use_atr': True, 'bear_use_adx': True, 'bear_use_spike': True, 'bear_rsi_required': True, 'sideways_strategy': 'mean_reversion', 'sideways_bb_std_mult': 0.7342726073636086, 'sideways_rsi_os': 17, 'sideways_rsi_ob': 58, 'sideways_adx_thresh': 7.673940270347318, 'sideways_atr_min_pct': 0.028913511918306656, 'sideways_atr_max_pct': 0.12388467903104458, 'sideways_tp_mult': 1.4208105255784134, 'sideways_tsl_mult': 0.15761001205296404, 'sideways_time_stop': 275, 'sideways_use_sma': True, 'sideways_use_ema': False, 'sideways_use_atr': False, 'sideways_use_adx': False, 'sideways_use_spike': False, 'sideways_rsi_required': False}.
