[I 2025-08-30 19:37:25,367] Trial 468 finished with values: [-0.05776197330723076, 0.057507591349438336] and parameters: {'p_sma': 41, 'p_std': 48, 'p_atr': 10, 'p_adx': 8, 'rsi_period': 52, 'ema1': 23, 'ema2': 27, 'slip_atr_k': 0.1505413451075499, 'slip_spread_k': 0.7376330017454592, 'spread_hl_frac': 0.004669419886845911, 'bb_std_mult': 1.1004492410654647, 'rsi_os': 41, 'rsi_ob': 93, 'vol_spike': 0.05905227796828011, 'adx_thresh': 19.92024343692893, 'atr_min_pct': 0.021874689822355492, 'atr_max_pct': 0.14678702554480472, 'tp_mult': 2.067425521420784, 'tsl_mult': 0.6379596317256752, 'strategy': 'breakout', 'time_stop': 32, 'use_sma': False, 'use_atr': True, 'use_adx': False, 'use_ema': False, 'use_spike': True, 'rsi_required': True, 'edge_k': 0.08994461656860034, 'edge_cap': 0.4911704454978646, 'bull_strategy': 'mean_reversion', 'bull_bb_std_mult': 0.9233454877681628, 'bull_rsi_os': 39, 'bull_rsi_ob': 93, 'bull_adx_thresh': 24.90374810559851, 'bull_atr_min_pct': 0.0021915959481755083, 'bull_atr_max_pct': 0.09661477958809059, 'bull_tp_mult': 2.2883416404913786, 'bull_tsl_mult': 0.8131109453654488, 'bull_time_stop': 257, 'bull_use_sma': True, 'bull_use_ema': False, 'bull_use_atr': False, 'bull_use_adx': True, 'bull_use_spike': False, 'bull_rsi_required': True, 'bear_strategy': 'breakout', 'bear_bb_std_mult': 3.325596268216585, 'bear_rsi_os': 40, 'bear_rsi_ob': 55, 'bear_adx_thresh': 6.078721541617507, 'bear_atr_min_pct': 0.00229099846377797, 'bear_atr_max_pct': 0.08411103329581618, 'bear_tp_mult': 1.6979787614570998, 'bear_tsl_mult': 0.6797621722865284, 'bear_time_stop': 271, 'bear_use_sma': True, 'bear_use_ema': False, 'bear_use_atr': True, 'bear_use_adx': True, 'bear_use_spike': True, 'bear_rsi_required': False, 'sideways_strategy': 'breakout', 'sideways_bb_std_mult': 1.3125287289567193, 'sideways_rsi_os': 52, 'sideways_rsi_ob': 58, 'sideways_adx_thresh': 5.514028767624467, 'sideways_atr_min_pct': 0.02031829144105913, 'sideways_atr_max_pct': 0.10525371914242604, 'sideways_tp_mult': 1.5118953369657218, 'sideways_tsl_mult': 0.2595729925539043, 'sideways_time_stop': 274, 'sideways_use_sma': True, 'sideways_use_ema': True, 'sideways_use_atr': False, 'sideways_use_adx': False, 'sideways_use_spike': False, 'sideways_rsi_required': False}.
[I 2025-08-30 19:37:25,762] Trial 469 finished with values: [-0.029501779672751027, 0.02942791819893345] and parameters: {'p_sma': 41, 'p_std': 9, 'p_atr': 10, 'p_adx': 29, 'rsi_period': 18, 'ema1': 23, 'ema2': 39, 'slip_atr_k': 0.18537184326755035, 'slip_spread_k': 0.5195523350101078, 'spread_hl_frac': 8.938739524972554e-05, 'bb_std_mult': 1.1073724569998844, 'rsi_os': 40, 'rsi_ob': 93, 'vol_spike': 0.04607536871896125, 'adx_thresh': 19.583103054026562, 'atr_min_pct': 0.00046101824013924757, 'atr_max_pct': 0.1498304848574168, 'tp_mult': 2.285438199222975, 'tsl_mult': 0.48749146887254097, 'strategy': 'breakout', 'time_stop': 92, 'use_sma': False, 'use_atr': True, 'use_adx': False, 'use_ema': False, 'use_spike': True, 'rsi_required': True, 'edge_k': 0.9480090804313323, 'edge_cap': 0.48962369744670586, 'bull_strategy': 'mean_reversion', 'bull_bb_std_mult': 2.135501200751057, 'bull_rsi_os': 48, 'bull_rsi_ob': 90, 'bull_adx_thresh': 23.310841895953104, 'bull_atr_min_pct': 0.002214742242496383, 'bull_atr_max_pct': 0.08727942928100038, 'bull_tp_mult': 1.4952128798592677, 'bull_tsl_mult': 0.9631761609119752, 'bull_time_stop': 178, 'bull_use_sma': True, 'bull_use_ema': False, 'bull_use_atr': False, 'bull_use_adx': True, 'bull_use_spike': False, 'bull_rsi_required': True, 'bear_strategy': 'mean_reversion', 'bear_bb_std_mult': 3.261412352220164, 'bear_rsi_os': 48, 'bear_rsi_ob': 85, 'bear_adx_thresh': 26.12648065099355, 'bear_atr_min_pct': 0.0071398724271398185, 'bear_atr_max_pct': 0.04580498452292073, 'bear_tp_mult': 1.6382448446574422, 'bear_tsl_mult': 0.18161313459841016, 'bear_time_stop': 269, 'bear_use_sma': True, 'bear_use_ema': False, 'bear_use_atr': True, 'bear_use_adx': True, 'bear_use_spike': True, 'bear_rsi_required': False, 'sideways_strategy': 'breakout', 'sideways_bb_std_mult': 1.6843977073365866, 'sideways_rsi_os': 14, 'sideways_rsi_ob': 58, 'sideways_adx_thresh': 9.096517703911767, 'sideways_atr_min_pct': 0.020195335347753092, 'sideways_atr_max_pct': 0.06282882139163554, 'sideways_tp_mult': 1.950241580794873, 'sideways_tsl_mult': 0.05530128073579016, 'sideways_time_stop': 274, 'sideways_use_sma': True, 'sideways_use_ema': True, 'sideways_use_atr': True, 'sideways_use_adx': False, 'sideways_use_spike': False, 'sideways_rsi_required': False}.
[I 2025-08-30 19:37:25,892] Trial 467 finished with values: [-1000000000.0, 1000000000.0] and parameters: {'p_sma': 41, 'p_std': 7, 'p_atr': 10, 'p_adx': 28, 'rsi_period': 11, 'ema1': 23, 'ema2': 17, 'slip_atr_k': 0.151075648271008, 'slip_spread_k': 0.9801356357355802, 'spread_hl_frac': 0.01872290907426511, 'bb_std_mult': 1.0919798562345275, 'rsi_os': 29, 'rsi_ob': 79, 'vol_spike': 0.06117853255863987, 'adx_thresh': 19.723377614564118, 'atr_min_pct': 0.014244090296407963, 'atr_max_pct': 0.04258155258333318, 'tp_mult': 2.1811397302623363, 'tsl_mult': 0.4880595349209972, 'strategy': 'breakout', 'time_stop': 89, 'use_sma': False, 'use_atr': True, 'use_adx': False, 'use_ema': False, 'use_spike': True, 'rsi_required': True, 'edge_k': 0.9029734607975002, 'edge_cap': 0.2220452233156267, 'bull_strategy': 'mean_reversion', 'bull_bb_std_mult': 2.3799740419448696, 'bull_rsi_os': 36, 'bull_rsi_ob': 81, 'bull_adx_thresh': 20.104089612611777, 'bull_atr_min_pct': 0.02405367208809406, 'bull_atr_max_pct': 0.12060235246381754, 'bull_tp_mult': 2.302837014991214, 'bull_tsl_mult': 0.9989457878116923, 'bull_time_stop': 177, 'bull_use_sma': True, 'bull_use_ema': False, 'bull_use_atr': False, 'bull_use_adx': True, 'bull_use_spike': False, 'bull_rsi_required': True, 'bear_strategy': 'breakout', 'bear_bb_std_mult': 3.299926664052699, 'bear_rsi_os': 29, 'bear_rsi_ob': 55, 'bear_adx_thresh': 7.584211439814265, 'bear_atr_min_pct': 0.016651269151075395, 'bear_atr_max_pct': 0.057778390033894234, 'bear_tp_mult': 1.2951931429645116, 'bear_tsl_mult': 0.873405492622247, 'bear_time_stop': 30, 'bear_use_sma': True, 'bear_use_ema': False, 'bear_use_atr': True, 'bear_use_adx': True, 'bear_use_spike': True, 'bear_rsi_required': False, 'sideways_strategy': 'breakout', 'sideways_bb_std_mult': 2.222543718714483, 'sideways_rsi_os': 14, 'sideways_rsi_ob': 93, 'sideways_adx_thresh': 8.905717032579972, 'sideways_atr_min_pct': 0.02022213297936008, 'sideways_atr_max_pct': 0.049842669958039466, 'sideways_tp_mult': 1.981440472598214, 'sideways_tsl_mult': 0.0656518820591383, 'sideways_time_stop': 149, 'sideways_use_sma': True, 'sideways_use_ema': True, 'sideways_use_atr': False, 'sideways_use_adx': False, 'sideways_use_spike': False, 'sideways_rsi_required': False}.
[I 2025-08-30 19:37:26,679] Trial 472 finished with values: [-1000000000.0, 1000000000.0] and parameters: {'p_sma': 33, 'p_std': 9, 'p_atr': 22, 'p_adx': 7, 'rsi_period': 15, 'ema1': 14, 'ema2': 17, 'slip_atr_k': 0.0977191469794963, 'slip_spread_k': 0.38080505821139965, 'spread_hl_frac': 0.0029217566505578495, 'bb_std_mult': 1.3138479761655317, 'rsi_os': 37, 'rsi_ob': 79, 'vol_spike': 0.04619078046414227, 'adx_thresh': 17.774958040271017, 'atr_min_pct': 0.022551298525981492, 'atr_max_pct': 0.016015254878863114, 'tp_mult': 2.2827078356186434, 'tsl_mult': 0.6958142123905843, 'strategy': 'breakout', 'time_stop': 26, 'use_sma': True, 'use_atr': True, 'use_adx': False, 'use_ema': False, 'use_spike': True, 'rsi_required': True, 'edge_k': 0.23240772876754925, 'edge_cap': 0.21634068449110172, 'bull_strategy': 'mean_reversion', 'bull_bb_std_mult': 1.9290549579195948, 'bull_rsi_os': 48, 'bull_rsi_ob': 58, 'bull_adx_thresh': 26.67356856567389, 'bull_atr_min_pct': 0.022677141398009908, 'bull_atr_max_pct': 0.06061877398315936, 'bull_tp_mult': 1.2353251256546791, 'bull_tsl_mult': 0.12228690440070528, 'bull_time_stop': 178, 'bull_use_sma': True, 'bull_use_ema': False, 'bull_use_atr': True, 'bull_use_adx': True, 'bull_use_spike': True, 'bull_rsi_required': True, 'bear_strategy': 'breakout', 'bear_bb_std_mult': 1.6333773826077882, 'bear_rsi_os': 42, 'bear_rsi_ob': 85, 'bear_adx_thresh': 7.350013270152134, 'bear_atr_min_pct': 0.015452074063147348, 'bear_atr_max_pct': 0.06668303640394022, 'bear_tp_mult': 1.6546392962059562, 'bear_tsl_mult': 0.8673760399367212, 'bear_time_stop': 29, 'bear_use_sma': False, 'bear_use_ema': False, 'bear_use_atr': True, 'bear_use_adx': True, 'bear_use_spike': False, 'bear_rsi_required': False, 'sideways_strategy': 'breakout', 'sideways_bb_std_mult': 2.0422513160987164, 'sideways_rsi_os': 14, 'sideways_rsi_ob': 93, 'sideways_adx_thresh': 9.585636658030298, 'sideways_atr_min_pct': 0.006201760935212639, 'sideways_atr_max_pct': 0.12137014982382714, 'sideways_tp_mult': 1.9742965472422624, 'sideways_tsl_mult': 0.48336314369857086, 'sideways_time_stop': 221, 'sideways_use_sma': True, 'sideways_use_ema': True, 'sideways_use_atr': True, 'sideways_use_adx': False, 'sideways_use_spike': False, 'sideways_rsi_required': False}.
[I 2025-08-30 19:38:01,182] Trial 474 finished with values: [-1000000000.0, 1000000000.0] and parameters: {'p_sma': 33, 'p_std': 26, 'p_atr': 9, 'p_adx': 7, 'rsi_period': 47, 'ema1': 9, 'ema2': 43, 'slip_atr_k': 0.031312112944081136, 'slip_spread_k': 0.37566297077584676, 'spread_hl_frac': 0.002967428139897591, 'bb_std_mult': 3.068264037959902, 'rsi_os': 36, 'rsi_ob': 56, 'vol_spike': 0.1004300639127336, 'adx_thresh': 18.040270540136913, 'atr_min_pct': 0.022371029175749686, 'atr_max_pct': 0.036719735754246384, 'tp_mult': 1.1125920279371746, 'tsl_mult': 0.6665359559817527, 'strategy': 'mean_reversion', 'time_stop': 38, 'use_sma': True, 'use_atr': False, 'use_adx': False, 'use_ema': True, 'use_spike': False, 'rsi_required': False, 'edge_k': 0.22174788955285613, 'edge_cap': 0.1846680735313317, 'bull_strategy': 'mean_reversion', 'bull_bb_std_mult': 1.9535900244373514, 'bull_rsi_os': 52, 'bull_rsi_ob': 61, 'bull_adx_thresh': 8.385062120290815, 'bull_atr_min_pct': 0.0273988661336596, 'bull_atr_max_pct': 0.13191818586783327, 'bull_tp_mult': 1.6617224596760185, 'bull_tsl_mult': 0.11507831250359846, 'bull_time_stop': 201, 'bull_use_sma': False, 'bull_use_ema': True, 'bull_use_atr': True, 'bull_use_adx': False, 'bull_use_spike': True, 'bull_rsi_required': True, 'bear_strategy': 'breakout', 'bear_bb_std_mult': 3.1909203577558256, 'bear_rsi_os': 42, 'bear_rsi_ob': 60, 'bear_adx_thresh': 15.78439699054939, 'bear_atr_min_pct': 0.02994814096481431, 'bear_atr_max_pct': 0.06205142475260675, 'bear_tp_mult': 1.5197761965637575, 'bear_tsl_mult': 0.08192654358575754, 'bear_time_stop': 63, 'bear_use_sma': False, 'bear_use_ema': True, 'bear_use_atr': False, 'bear_use_adx': False, 'bear_use_spike': False, 'bear_rsi_required': True, 'sideways_strategy': 'mean_reversion', 'sideways_bb_std_mult': 2.040067327318314, 'sideways_rsi_os': 26, 'sideways_rsi_ob': 73, 'sideways_adx_thresh': 9.82374638983118, 'sideways_atr_min_pct': 0.02089902940818299, 'sideways_atr_max_pct': 0.14519665975000717, 'sideways_tp_mult': 1.6049407534902334, 'sideways_tsl_mult': 0.9160837333062629, 'sideways_time_stop': 135, 'sideways_use_sma': False, 'sideways_use_ema': True, 'sideways_use_atr': False, 'sideways_use_adx': True, 'sideways_use_spike': True, 'sideways_rsi_required': True}.
[I 2025-08-30 19:38:01,495] Trial 471 finished with values: [-0.05831588512196817, 0.05824869039749717] and parameters: {'p_sma': 38, 'p_std': 26, 'p_atr': 10, 'p_adx': 8, 'rsi_period': 51, 'ema1': 23, 'ema2': 17, 'slip_atr_k': 0.03053670423649509, 'slip_spread_k': 0.10763529201998828, 'spread_hl_frac': 0.004058253387202046, 'bb_std_mult': 0.5077801246848395, 'rsi_os': 41, 'rsi_ob': 56, 'vol_spike': 0.04679866677810474, 'adx_thresh': 17.65006307015608, 'atr_min_pct': 0.022319068537418257, 'atr_max_pct': 0.1316289419907386, 'tp_mult': 1.0598241064391272, 'tsl_mult': 0.6584329973093522, 'strategy': 'breakout', 'time_stop': 25, 'use_sma': False, 'use_atr': True, 'use_adx': False, 'use_ema': False, 'use_spike': True, 'rsi_required': True, 'edge_k': 0.2373516447652114, 'edge_cap': 0.5253195545214888, 'bull_strategy': 'mean_reversion', 'bull_bb_std_mult': 1.9446716331125458, 'bull_rsi_os': 48, 'bull_rsi_ob': 90, 'bull_adx_thresh': 21.085379201910197, 'bull_atr_min_pct': 0.00208949944369065, 'bull_atr_max_pct': 0.05652091377373068, 'bull_tp_mult': 1.522976409165987, 'bull_tsl_mult': 0.8154145239838813, 'bull_time_stop': 202, 'bull_use_sma': True, 'bull_use_ema': False, 'bull_use_atr': False, 'bull_use_adx': True, 'bull_use_spike': False, 'bull_rsi_required': True, 'bear_strategy': 'breakout', 'bear_bb_std_mult': 3.3456925737145715, 'bear_rsi_os': 38, 'bear_rsi_ob': 61, 'bear_adx_thresh': 7.125630530109904, 'bear_atr_min_pct': 0.00024428465562908487, 'bear_atr_max_pct': 0.04679283900341478, 'bear_tp_mult': 1.6578707706668614, 'bear_tsl_mult': 0.0775395133425357, 'bear_time_stop': 247, 'bear_use_sma': True, 'bear_use_ema': False, 'bear_use_atr': True, 'bear_use_adx': True, 'bear_use_spike': False, 'bear_rsi_required': False, 'sideways_strategy': 'breakout', 'sideways_bb_std_mult': 0.6412912224294631, 'sideways_rsi_os': 14, 'sideways_rsi_ob': 81, 'sideways_adx_thresh': 9.64973802571346, 'sideways_atr_min_pct': 0.00632971835547147, 'sideways_atr_max_pct': 0.12159906971737051, 'sideways_tp_mult': 1.9689295324755067, 'sideways_tsl_mult': 0.9106432644512877, 'sideways_time_stop': 223, 'sideways_use_sma': True, 'sideways_use_ema': True, 'sideways_use_atr': False, 'sideways_use_adx': False, 'sideways_use_spike': False, 'sideways_rsi_required': False}.
[I 2025-08-30 19:38:01,628] Trial 473 finished with values: [-1000000000.0, 1000000000.0] and parameters: {'p_sma': 15, 'p_std': 26, 'p_atr': 11, 'p_adx': 12, 'rsi_period': 51, 'ema1': 14, 'ema2': 17, 'slip_atr_k': 0.09593076179710601, 'slip_spread_k': 0.3662002443106619, 'spread_hl_frac': 0.018833970154028983, 'bb_std_mult': 2.2468789477186117, 'rsi_os': 11, 'rsi_ob': 62, 'vol_spike': 0.02163709204786496, 'adx_thresh': 17.786264175959058, 'atr_min_pct': 0.01850474721599101, 'atr_max_pct': 0.1405436924658043, 'tp_mult': 1.8656130860914837, 'tsl_mult': 0.696590641783476, 'strategy': 'breakout', 'time_stop': 266, 'use_sma': True, 'use_atr': True, 'use_adx': False, 'use_ema': True, 'use_spike': False, 'rsi_required': False, 'edge_k': 0.22738559935713146, 'edge_cap': 0.2223490136312011, 'bull_strategy': 'mean_reversion', 'bull_bb_std_mult': 1.9324597862885287, 'bull_rsi_os': 54, 'bull_rsi_ob': 72, 'bull_adx_thresh': 26.44408251359331, 'bull_atr_min_pct': 0.016487456781859172, 'bull_atr_max_pct': 0.024765485743448484, 'bull_tp_mult': 2.1484707733071033, 'bull_tsl_mult': 0.18498500711170784, 'bull_time_stop': 221, 'bull_use_sma': False, 'bull_use_ema': True, 'bull_use_atr': True, 'bull_use_adx': True, 'bull_use_spike': True, 'bull_rsi_required': True, 'bear_strategy': 'breakout', 'bear_bb_std_mult': 3.176561925558655, 'bear_rsi_os': 28, 'bear_rsi_ob': 92, 'bear_adx_thresh': 7.350112839351449, 'bear_atr_min_pct': 0.014313545348637054, 'bear_atr_max_pct': 0.06113852282472147, 'bear_tp_mult': 1.8021135521984504, 'bear_tsl_mult': 0.07321842156670624, 'bear_time_stop': 29, 'bear_use_sma': False, 'bear_use_ema': True, 'bear_use_atr': False, 'bear_use_adx': False, 'bear_use_spike': False, 'bear_rsi_required': False, 'sideways_strategy': 'mean_reversion', 'sideways_bb_std_mult': 2.046786456329861, 'sideways_rsi_os': 20, 'sideways_rsi_ob': 93, 'sideways_adx_thresh': 20.080711785163718, 'sideways_atr_min_pct': 0.015229922021066466, 'sideways_atr_max_pct': 0.12908247748241325, 'sideways_tp_mult': 1.5979692351013255, 'sideways_tsl_mult': 0.6982008405930162, 'sideways_time_stop': 222, 'sideways_use_sma': True, 'sideways_use_ema': True, 'sideways_use_atr': False, 'sideways_use_adx': True, 'sideways_use_spike': True, 'sideways_rsi_required': False}.
[I 2025-08-30 19:38:02,544] Trial 475 finished with values: [-1000000000.0, 1000000000.0] and parameters: {'p_sma': 38, 'p_std': 26, 'p_atr': 9, 'p_adx': 12, 'rsi_period': 75, 'ema1': 9, 'ema2': 19, 'slip_atr_k': 0.1367829415274044, 'slip_spread_k': 0.10222141257036427, 'spread_hl_frac': 0.003620069880648013, 'bb_std_mult': 2.2655711246305863, 'rsi_os': 12, 'rsi_ob': 56, 'vol_spike': 0.2911609539417921, 'adx_thresh': 18.83662818154802, 'atr_min_pct': 0.018850740687000586, 'atr_max_pct': 0.13057164815041722, 'tp_mult': 1.0879763724742744, 'tsl_mult': 0.9818701388105324, 'strategy': 'mean_reversion', 'time_stop': 38, 'use_sma': False, 'use_atr': False, 'use_adx': False, 'use_ema': True, 'use_spike': False, 'rsi_required': False, 'edge_k': 0.13768100020963817, 'edge_cap': 0.12704401333830756, 'bull_strategy': 'mean_reversion', 'bull_bb_std_mult': 3.2255602112658392, 'bull_rsi_os': 25, 'bull_rsi_ob': 66, 'bull_adx_thresh': 11.155868119313874, 'bull_atr_min_pct': 0.017170885660521485, 'bull_atr_max_pct': 0.1295414788299246, 'bull_tp_mult': 1.7124280239386556, 'bull_tsl_mult': 0.9326284057934366, 'bull_time_stop': 202, 'bull_use_sma': False, 'bull_use_ema': True, 'bull_use_atr': False, 'bull_use_adx': False, 'bull_use_spike': True, 'bull_rsi_required': True, 'bear_strategy': 'breakout', 'bear_bb_std_mult': 3.1763754950529783, 'bear_rsi_os': 11, 'bear_rsi_ob': 92, 'bear_adx_thresh': 5.449253255690963, 'bear_atr_min_pct': 0.014158363529370156, 'bear_atr_max_pct': 0.06164545764155529, 'bear_tp_mult': 1.5252378908742044, 'bear_tsl_mult': 0.08093810548211466, 'bear_time_stop': 97, 'bear_use_sma': False, 'bear_use_ema': True, 'bear_use_atr': False, 'bear_use_adx': False, 'bear_use_spike': False, 'bear_rsi_required': True, 'sideways_strategy': 'mean_reversion', 'sideways_bb_std_mult': 0.7876165606469925, 'sideways_rsi_os': 19, 'sideways_rsi_ob': 67, 'sideways_adx_thresh': 22.11622389506852, 'sideways_atr_min_pct': 0.0034913482038431837, 'sideways_atr_max_pct': 0.11798106571127737, 'sideways_tp_mult': 2.9606576042720394, 'sideways_tsl_mult': 0.6972122191295692, 'sideways_time_stop': 167, 'sideways_use_sma': False, 'sideways_use_ema': True, 'sideways_use_atr': False, 'sideways_use_adx': True, 'sideways_use_spike': True, 'sideways_rsi_required': True}.
[I 2025-08-30 19:38:35,936] Trial 479 finished with values: [-1000000000.0, 1000000000.0] and parameters: {'p_sma': 40, 'p_std': 24, 'p_atr': 11, 'p_adx': 15, 'rsi_period': 26, 'ema1': 17, 'ema2': 22, 'slip_atr_k': 0.01580642353783037, 'slip_spread_k': 0.46645394037707794, 'spread_hl_frac': 0.04677575338435454, 'bb_std_mult': 0.7575398246632273, 'rsi_os': 35, 'rsi_ob': 71, 'vol_spike': 0.21568903797034553, 'adx_thresh': 18.57542612698103, 'atr_min_pct': 0.023577389622736613, 'atr_max_pct': 0.13889458530377652, 'tp_mult': 2.462143322444542, 'tsl_mult': 0.7738428075745638, 'strategy': 'breakout', 'time_stop': 149, 'use_sma': False, 'use_atr': True, 'use_adx': True, 'use_ema': False, 'use_spike': True, 'rsi_required': True, 'edge_k': 0.11867893105670409, 'edge_cap': 0.31561356581891464, 'bull_strategy': 'breakout', 'bull_bb_std_mult': 1.7959182362063886, 'bull_rsi_os': 46, 'bull_rsi_ob': 69, 'bull_adx_thresh': 29.12798607498034, 'bull_atr_min_pct': 0.0031739644547397724, 'bull_atr_max_pct': 0.03347104079041836, 'bull_tp_mult': 2.3699469708247927, 'bull_tsl_mult': 0.9815771984724413, 'bull_time_stop': 164, 'bull_use_sma': True, 'bull_use_ema': False, 'bull_use_atr': False, 'bull_use_adx': True, 'bull_use_spike': True, 'bull_rsi_required': False, 'bear_strategy': 'mean_reversion', 'bear_bb_std_mult': 2.3006786126965406, 'bear_rsi_os': 54, 'bear_rsi_ob': 83, 'bear_adx_thresh': 5.008682637413183, 'bear_atr_min_pct': 0.01365016780613385, 'bear_atr_max_pct': 0.05306257623647334, 'bear_tp_mult': 2.445532467222246, 'bear_tsl_mult': 0.46284319473906343, 'bear_time_stop': 19, 'bear_use_sma': True, 'bear_use_ema': False, 'bear_use_atr': True, 'bear_use_adx': True, 'bear_use_spike': False, 'bear_rsi_required': False, 'sideways_strategy': 'breakout', 'sideways_bb_std_mult': 3.17838213657337, 'sideways_rsi_os': 31, 'sideways_rsi_ob': 61, 'sideways_adx_thresh': 7.95146404757018, 'sideways_atr_min_pct': 0.011854926560304046, 'sideways_atr_max_pct': 0.12565541163214575, 'sideways_tp_mult': 1.7576117123219295, 'sideways_tsl_mult': 0.6272537171567463, 'sideways_time_stop': 27, 'sideways_use_sma': True, 'sideways_use_ema': False, 'sideways_use_atr': False, 'sideways_use_adx': False, 'sideways_use_spike': False, 'sideways_rsi_required': False}.
