[I 2025-08-30 19:30:57,080] Trial 422 finished with values: [-1000000000.0, 1000000000.0] and parameters: {'p_sma': 13, 'p_std': 30, 'p_atr': 11, 'p_adx': 11, 'rsi_period': 63, 'ema1': 13, 'ema2': 51, 'slip_atr_k': 0.19590773081278795, 'slip_spread_k': 0.29487515049311863, 'spread_hl_frac': 0.04508129119696503, 'bb_std_mult': 2.8745647929317473, 'rsi_os': 33, 'rsi_ob': 61, 'vol_spike': 0.26399773145269556, 'adx_thresh': 17.11611305525679, 'atr_min_pct': 0.01669317770313444, 'atr_max_pct': 0.086521468787125, 'tp_mult': 2.4449101865117875, 'tsl_mult': 0.8076463499105562, 'strategy': 'breakout', 'time_stop': 118, 'use_sma': False, 'use_atr': True, 'use_adx': False, 'use_ema': False, 'use_spike': True, 'rsi_required': True, 'edge_k': 0.9737540367298241, 'edge_cap': 0.278071389862635, 'bull_strategy': 'mean_reversion', 'bull_bb_std_mult': 3.5370576667235887, 'bull_rsi_os': 5, 'bull_rsi_ob': 72, 'bull_adx_thresh': 26.222671680984057, 'bull_atr_min_pct': 0.021876481702775178, 'bull_atr_max_pct': 0.026628655413012223, 'bull_tp_mult': 2.1362137928435003, 'bull_tsl_mult': 0.9708946301407236, 'bull_time_stop': 213, 'bull_use_sma': True, 'bull_use_ema': False, 'bull_use_atr': False, 'bull_use_adx': True, 'bull_use_spike': True, 'bull_rsi_required': True, 'bear_strategy': 'breakout', 'bear_bb_std_mult': 3.3759042593325685, 'bear_rsi_os': 52, 'bear_rsi_ob': 81, 'bear_adx_thresh': 24.629087841874455, 'bear_atr_min_pct': 0.005540405990275096, 'bear_atr_max_pct': 0.07063182330521704, 'bear_tp_mult': 1.7334144777630383, 'bear_tsl_mult': 0.06332547026062676, 'bear_time_stop': 169, 'bear_use_sma': False, 'bear_use_ema': False, 'bear_use_atr': True, 'bear_use_adx': True, 'bear_use_spike': True, 'bear_rsi_required': True, 'sideways_strategy': 'breakout', 'sideways_bb_std_mult': 0.8553962819159655, 'sideways_rsi_os': 43, 'sideways_rsi_ob': 59, 'sideways_adx_thresh': 11.267868908374338, 'sideways_atr_min_pct': 0.020757539855014488, 'sideways_atr_max_pct': 0.11520760710646338, 'sideways_tp_mult': 2.844791338461833, 'sideways_tsl_mult': 0.6975801570203393, 'sideways_time_stop': 266, 'sideways_use_sma': True, 'sideways_use_ema': True, 'sideways_use_atr': True, 'sideways_use_adx': False, 'sideways_use_spike': False, 'sideways_rsi_required': False}.
[I 2025-08-30 19:31:32,801] Trial 427 finished with values: [-1000000000.0, 1000000000.0] and parameters: {'p_sma': 42, 'p_std': 35, 'p_atr': 30, 'p_adx': 9, 'rsi_period': 30, 'ema1': 24, 'ema2': 43, 'slip_atr_k': 0.011592632595264966, 'slip_spread_k': 0.3399148583898747, 'spread_hl_frac': 0.007213118000117997, 'bb_std_mult': 2.04374913002207, 'rsi_os': 19, 'rsi_ob': 58, 'vol_spike': 0.029191815111225775, 'adx_thresh': 18.78224198810869, 'atr_min_pct': 0.004018911665054671, 'atr_max_pct': 0.1412636581464735, 'tp_mult': 2.1732463886527653, 'tsl_mult': 0.4715332461277044, 'strategy': 'breakout', 'time_stop': 22, 'use_sma': False, 'use_atr': True, 'use_adx': False, 'use_ema': True, 'use_spike': False, 'rsi_required': False, 'edge_k': 0.10706509605974468, 'edge_cap': 0.2468525102238669, 'bull_strategy': 'breakout', 'bull_bb_std_mult': 2.192483032931963, 'bull_rsi_os': 51, 'bull_rsi_ob': 69, 'bull_adx_thresh': 10.20216453734395, 'bull_atr_min_pct': 0.005948400575160015, 'bull_atr_max_pct': 0.012954727688648221, 'bull_tp_mult': 2.2341994746240728, 'bull_tsl_mult': 0.2239996728590239, 'bull_time_stop': 232, 'bull_use_sma': False, 'bull_use_ema': True, 'bull_use_atr': True, 'bull_use_adx': False, 'bull_use_spike': True, 'bull_rsi_required': False, 'bear_strategy': 'mean_reversion', 'bear_bb_std_mult': 3.208815015492669, 'bear_rsi_os': 45, 'bear_rsi_ob': 53, 'bear_adx_thresh': 6.680248258455975, 'bear_atr_min_pct': 0.015933614319875316, 'bear_atr_max_pct': 0.06366675700355047, 'bear_tp_mult': 1.6782114916143132, 'bear_tsl_mult': 0.041857293178367894, 'bear_time_stop': 90, 'bear_use_sma': True, 'bear_use_ema': True, 'bear_use_atr': False, 'bear_use_adx': False, 'bear_use_spike': False, 'bear_rsi_required': False, 'sideways_strategy': 'breakout', 'sideways_bb_std_mult': 1.9907066915911975, 'sideways_rsi_os': 18, 'sideways_rsi_ob': 61, 'sideways_adx_thresh': 32.28588327815831, 'sideways_atr_min_pct': 0.010493050380287952, 'sideways_atr_max_pct': 0.03460993352731721, 'sideways_tp_mult': 1.6925988185559033, 'sideways_tsl_mult': 0.14880945764093567, 'sideways_time_stop': 262, 'sideways_use_sma': False, 'sideways_use_ema': False, 'sideways_use_atr': False, 'sideways_use_adx': True, 'sideways_use_spike': False, 'sideways_rsi_required': False}.
[I 2025-08-30 19:31:33,134] Trial 426 finished with values: [-1000000000.0, 1000000000.0] and parameters: {'p_sma': 13, 'p_std': 45, 'p_atr': 7, 'p_adx': 8, 'rsi_period': 50, 'ema1': 24, 'ema2': 17, 'slip_atr_k': 0.012167074858924714, 'slip_spread_k': 0.4817430182645038, 'spread_hl_frac': 0.005453761430664813, 'bb_std_mult': 3.33870239473777, 'rsi_os': 46, 'rsi_ob': 58, 'vol_spike': 0.026251367308137222, 'adx_thresh': 18.995092203228246, 'atr_min_pct': 0.023996672957491465, 'atr_max_pct': 0.134566235672003, 'tp_mult': 2.17381197805007, 'tsl_mult': 0.8056012568496944, 'strategy': 'breakout', 'time_stop': 21, 'use_sma': False, 'use_atr': True, 'use_adx': False, 'use_ema': True, 'use_spike': False, 'rsi_required': True, 'edge_k': 0.07880941993861365, 'edge_cap': 0.9293815170129498, 'bull_strategy': 'breakout', 'bull_bb_std_mult': 2.5681223162149105, 'bull_rsi_os': 51, 'bull_rsi_ob': 54, 'bull_adx_thresh': 24.047583245634776, 'bull_atr_min_pct': 0.021867461039285357, 'bull_atr_max_pct': 0.01927977252105409, 'bull_tp_mult': 2.0335485146742367, 'bull_tsl_mult': 0.05704193431915233, 'bull_time_stop': 189, 'bull_use_sma': False, 'bull_use_ema': True, 'bull_use_atr': True, 'bull_use_adx': False, 'bull_use_spike': True, 'bull_rsi_required': False, 'bear_strategy': 'breakout', 'bear_bb_std_mult': 3.3951436259879264, 'bear_rsi_os': 47, 'bear_rsi_ob': 70, 'bear_adx_thresh': 6.598933726494375, 'bear_atr_min_pct': 0.01630758284921069, 'bear_atr_max_pct': 0.0643978393740472, 'bear_tp_mult': 1.4004809042115518, 'bear_tsl_mult': 0.03139980858891306, 'bear_time_stop': 38, 'bear_use_sma': False, 'bear_use_ema': True, 'bear_use_atr': True, 'bear_use_adx': True, 'bear_use_spike': False, 'bear_rsi_required': False, 'sideways_strategy': 'breakout', 'sideways_bb_std_mult': 2.1777599717971237, 'sideways_rsi_os': 38, 'sideways_rsi_ob': 62, 'sideways_adx_thresh': 11.487193019005897, 'sideways_atr_min_pct': 0.019342884005449115, 'sideways_atr_max_pct': 0.12862104414465458, 'sideways_tp_mult': 1.8348436874896015, 'sideways_tsl_mult': 0.039655271422417315, 'sideways_time_stop': 90, 'sideways_use_sma': False, 'sideways_use_ema': False, 'sideways_use_atr': False, 'sideways_use_adx': True, 'sideways_use_spike': False, 'sideways_rsi_required': False}.
[I 2025-08-30 19:31:33,414] Trial 424 finished with values: [-1000000000.0, 1000000000.0] and parameters: {'p_sma': 50, 'p_std': 23, 'p_atr': 15, 'p_adx': 8, 'rsi_period': 17, 'ema1': 24, 'ema2': 40, 'slip_atr_k': 0.006530976636758445, 'slip_spread_k': 0.4799101311254169, 'spread_hl_frac': 0.024461557254686142, 'bb_std_mult': 2.049527908092272, 'rsi_os': 54, 'rsi_ob': 82, 'vol_spike': 0.26431127098746854, 'adx_thresh': 19.14594667615858, 'atr_min_pct': 0.023138791098308513, 'atr_max_pct': 0.14082200431670164, 'tp_mult': 2.1575017286434837, 'tsl_mult': 0.7322751894380102, 'strategy': 'breakout', 'time_stop': 257, 'use_sma': False, 'use_atr': True, 'use_adx': False, 'use_ema': False, 'use_spike': True, 'rsi_required': False, 'edge_k': 0.08195890940103887, 'edge_cap': 0.2860607389618186, 'bull_strategy': 'mean_reversion', 'bull_bb_std_mult': 1.67770593275801, 'bull_rsi_os': 51, 'bull_rsi_ob': 55, 'bull_adx_thresh': 13.375693064485624, 'bull_atr_min_pct': 0.006862386427167888, 'bull_atr_max_pct': 0.03442255148061481, 'bull_tp_mult': 2.132901119682059, 'bull_tsl_mult': 0.3842198625637537, 'bull_time_stop': 21, 'bull_use_sma': True, 'bull_use_ema': False, 'bull_use_atr': False, 'bull_use_adx': False, 'bull_use_spike': True, 'bull_rsi_required': True, 'bear_strategy': 'breakout', 'bear_bb_std_mult': 2.0722435702697934, 'bear_rsi_os': 42, 'bear_rsi_ob': 70, 'bear_adx_thresh': 24.54675343884174, 'bear_atr_min_pct': 0.010163795271723413, 'bear_atr_max_pct': 0.061456451317706676, 'bear_tp_mult': 1.4008089060436646, 'bear_tsl_mult': 0.03918670713397636, 'bear_time_stop': 168, 'bear_use_sma': False, 'bear_use_ema': True, 'bear_use_atr': True, 'bear_use_adx': True, 'bear_use_spike': False, 'bear_rsi_required': True, 'sideways_strategy': 'breakout', 'sideways_bb_std_mult': 2.180943121844502, 'sideways_rsi_os': 20, 'sideways_rsi_ob': 49, 'sideways_adx_thresh': 11.065099021498236, 'sideways_atr_min_pct': 0.019257373432207306, 'sideways_atr_max_pct': 0.035150618850697306, 'sideways_tp_mult': 1.8346723853242621, 'sideways_tsl_mult': 0.3203458244130524, 'sideways_time_stop': 288, 'sideways_use_sma': False, 'sideways_use_ema': True, 'sideways_use_atr': False, 'sideways_use_adx': False, 'sideways_use_spike': False, 'sideways_rsi_required': False}.
[I 2025-08-30 19:31:33,613] Trial 425 finished with values: [-1000000000.0, 1000000000.0] and parameters: {'p_sma': 57, 'p_std': 46, 'p_atr': 12, 'p_adx': 8, 'rsi_period': 50, 'ema1': 24, 'ema2': 52, 'slip_atr_k': 0.012873923427931266, 'slip_spread_k': 0.28935578740740403, 'spread_hl_frac': 0.005776988852780395, 'bb_std_mult': 3.3386114044984265, 'rsi_os': 10, 'rsi_ob': 83, 'vol_spike': 0.20760040125537615, 'adx_thresh': 19.30137832644149, 'atr_min_pct': 0.024226387116276102, 'atr_max_pct': 0.1404093359684792, 'tp_mult': 2.6987876484503843, 'tsl_mult': 0.7657984226161774, 'strategy': 'breakout', 'time_stop': 22, 'use_sma': False, 'use_atr': True, 'use_adx': False, 'use_ema': False, 'use_spike': True, 'rsi_required': True, 'edge_k': 0.08568909518466779, 'edge_cap': 0.7417130958240767, 'bull_strategy': 'mean_reversion', 'bull_bb_std_mult': 1.7430977072432505, 'bull_rsi_os': 50, 'bull_rsi_ob': 55, 'bull_adx_thresh': 10.377039215569486, 'bull_atr_min_pct': 0.0027345094891850687, 'bull_atr_max_pct': 0.025711261333830396, 'bull_tp_mult': 2.0301584812883924, 'bull_tsl_mult': 0.9257364113443572, 'bull_time_stop': 182, 'bull_use_sma': True, 'bull_use_ema': False, 'bull_use_atr': False, 'bull_use_adx': False, 'bull_use_spike': True, 'bull_rsi_required': True, 'bear_strategy': 'breakout', 'bear_bb_std_mult': 3.205540914869668, 'bear_rsi_os': 46, 'bear_rsi_ob': 83, 'bear_adx_thresh': 24.36781741048677, 'bear_atr_min_pct': 0.016124776480544483, 'bear_atr_max_pct': 0.06561566476119798, 'bear_tp_mult': 1.6699831874549482, 'bear_tsl_mult': 0.0442316157701968, 'bear_time_stop': 38, 'bear_use_sma': False, 'bear_use_ema': True, 'bear_use_atr': True, 'bear_use_adx': True, 'bear_use_spike': False, 'bear_rsi_required': False, 'sideways_strategy': 'breakout', 'sideways_bb_std_mult': 2.145565302970171, 'sideways_rsi_os': 13, 'sideways_rsi_ob': 61, 'sideways_adx_thresh': 11.230549446771462, 'sideways_atr_min_pct': 0.01918719484598505, 'sideways_atr_max_pct': 0.11887459926303129, 'sideways_tp_mult': 2.7130663882318746, 'sideways_tsl_mult': 0.3118380068474431, 'sideways_time_stop': 285, 'sideways_use_sma': False, 'sideways_use_ema': True, 'sideways_use_atr': False, 'sideways_use_adx': False, 'sideways_use_spike': False, 'sideways_rsi_required': False}.
[I 2025-08-30 19:31:34,279] Trial 431 finished with values: [-1000000000.0, 1000000000.0] and parameters: {'p_sma': 41, 'p_std': 37, 'p_atr': 10, 'p_adx': 14, 'rsi_period': 55, 'ema1': 22, 'ema2': 16, 'slip_atr_k': 0.053566509936716494, 'slip_spread_k': 0.5714978361499761, 'spread_hl_frac': 0.03828153299774703, 'bb_std_mult': 3.5155246031559333, 'rsi_os': 6, 'rsi_ob': 95, 'vol_spike': 0.055402144810161036, 'adx_thresh': 33.49776450956576, 'atr_min_pct': 0.024578862859369617, 'atr_max_pct': 0.01443505761596331, 'tp_mult': 2.2138773068134663, 'tsl_mult': 0.1372189613015174, 'strategy': 'mean_reversion', 'time_stop': 74, 'use_sma': False, 'use_atr': False, 'use_adx': False, 'use_ema': False, 'use_spike': True, 'rsi_required': True, 'edge_k': 0.1272562936613759, 'edge_cap': 0.881783509267885, 'bull_strategy': 'mean_reversion', 'bull_bb_std_mult': 3.1290859740158723, 'bull_rsi_os': 52, 'bull_rsi_ob': 73, 'bull_adx_thresh': 7.143089092106958, 'bull_atr_min_pct': 0.0015788811991376752, 'bull_atr_max_pct': 0.12336810562438211, 'bull_tp_mult': 2.094925446809436, 'bull_tsl_mult': 0.6730965841372385, 'bull_time_stop': 157, 'bull_use_sma': True, 'bull_use_ema': False, 'bull_use_atr': False, 'bull_use_adx': True, 'bull_use_spike': False, 'bull_rsi_required': True, 'bear_strategy': 'mean_reversion', 'bear_bb_std_mult': 1.3771888685425164, 'bear_rsi_os': 36, 'bear_rsi_ob': 62, 'bear_adx_thresh': 5.541712999091472, 'bear_atr_min_pct': 0.014171851833760954, 'bear_atr_max_pct': 0.05614189457951544, 'bear_tp_mult': 1.0474205710422708, 'bear_tsl_mult': 0.10627136425072624, 'bear_time_stop': 48, 'bear_use_sma': True, 'bear_use_ema': False, 'bear_use_atr': False, 'bear_use_adx': False, 'bear_use_spike': False, 'bear_rsi_required': False, 'sideways_strategy': 'mean_reversion', 'sideways_bb_std_mult': 1.8963469535256436, 'sideways_rsi_os': 33, 'sideways_rsi_ob': 81, 'sideways_adx_thresh': 8.835145935622641, 'sideways_atr_min_pct': 0.017385872785643224, 'sideways_atr_max_pct': 0.12349394362823683, 'sideways_tp_mult': 2.5543452214497115, 'sideways_tsl_mult': 0.6663279224946034, 'sideways_time_stop': 276, 'sideways_use_sma': True, 'sideways_use_ema': True, 'sideways_use_atr': False, 'sideways_use_adx': False, 'sideways_use_spike': True, 'sideways_rsi_required': True}.
[I 2025-08-30 19:32:07,857] Trial 428 finished with values: [-1000000000.0, 1000000000.0] and parameters: {'p_sma': 11, 'p_std': 46, 'p_atr': 14, 'p_adx': 8, 'rsi_period': 50, 'ema1': 18, 'ema2': 41, 'slip_atr_k': 0.085701950927224, 'slip_spread_k': 0.4839501797816186, 'spread_hl_frac': 0.005385590019324327, 'bb_std_mult': 1.03067108285604, 'rsi_os': 6, 'rsi_ob': 53, 'vol_spike': 0.2076695918582253, 'adx_thresh': 19.422365840538372, 'atr_min_pct': 0.02442362520616416, 'atr_max_pct': 0.13407802279977968, 'tp_mult': 2.1377713351164593, 'tsl_mult': 0.7679329790477636, 'strategy': 'mean_reversion', 'time_stop': 17, 'use_sma': False, 'use_atr': False, 'use_adx': False, 'use_ema': False, 'use_spike': True, 'rsi_required': True, 'edge_k': 0.07626144173293714, 'edge_cap': 0.5051834631399595, 'bull_strategy': 'mean_reversion', 'bull_bb_std_mult': 2.6747063108531637, 'bull_rsi_os': 49, 'bull_rsi_ob': 72, 'bull_adx_thresh': 13.512191445340619, 'bull_atr_min_pct': 0.0028570990311693883, 'bull_atr_max_pct': 0.019590190381722425, 'bull_tp_mult': 2.0418706278983665, 'bull_tsl_mult': 0.3616504791300203, 'bull_time_stop': 188, 'bull_use_sma': True, 'bull_use_ema': False, 'bull_use_atr': False, 'bull_use_adx': False, 'bull_use_spike': True, 'bull_rsi_required': True, 'bear_strategy': 'breakout', 'bear_bb_std_mult': 3.3124384614662414, 'bear_rsi_os': 5, 'bear_rsi_ob': 83, 'bear_adx_thresh': 5.008569540794295, 'bear_atr_min_pct': 0.01406696658906841, 'bear_atr_max_pct': 0.06200982741927841, 'bear_tp_mult': 1.7882491580288224, 'bear_tsl_mult': 0.10312550976498386, 'bear_time_stop': 48, 'bear_use_sma': True, 'bear_use_ema': True, 'bear_use_atr': True, 'bear_use_adx': True, 'bear_use_spike': False, 'bear_rsi_required': False, 'sideways_strategy': 'mean_reversion', 'sideways_bb_std_mult': 2.168543646798378, 'sideways_rsi_os': 30, 'sideways_rsi_ob': 57, 'sideways_adx_thresh': 8.608085540156813, 'sideways_atr_min_pct': 0.015929469949690363, 'sideways_atr_max_pct': 0.060020643934993, 'sideways_tp_mult': 1.8294648846242816, 'sideways_tsl_mult': 0.6657632322738428, 'sideways_time_stop': 277, 'sideways_use_sma': False, 'sideways_use_ema': True, 'sideways_use_atr': False, 'sideways_use_adx': False, 'sideways_use_spike': False, 'sideways_rsi_required': True}.
[I 2025-08-30 19:32:08,017] Trial 429 finished with values: [-1000000000.0, 1000000000.0] and parameters: {'p_sma': 23, 'p_std': 29, 'p_atr': 10, 'p_adx': 8, 'rsi_period': 55, 'ema1': 18, 'ema2': 40, 'slip_atr_k': 0.1204260322959308, 'slip_spread_k': 0.22970559813240538, 'spread_hl_frac': 0.02496071500390952, 'bb_std_mult': 0.6082385530866568, 'rsi_os': 36, 'rsi_ob': 54, 'vol_spike': 0.058337451508996385, 'adx_thresh': 19.387703333049792, 'atr_min_pct': 0.02301386586348684, 'atr_max_pct': 0.13469343298364495, 'tp_mult': 1.5544782364046181, 'tsl_mult': 0.7670912450994398, 'strategy': 'mean_reversion', 'time_stop': 158, 'use_sma': False, 'use_atr': False, 'use_adx': False, 'use_ema': False, 'use_spike': True, 'rsi_required': True, 'edge_k': 0.12326257633750842, 'edge_cap': 0.7790468541061273, 'bull_strategy': 'mean_reversion', 'bull_bb_std_mult': 1.8591538046057465, 'bull_rsi_os': 26, 'bull_rsi_ob': 91, 'bull_adx_thresh': 24.765715898883787, 'bull_atr_min_pct': 0.0027743384777339612, 'bull_atr_max_pct': 0.02461725991258689, 'bull_tp_mult': 2.090610077427785, 'bull_tsl_mult': 0.7729454305902222, 'bull_time_stop': 191, 'bull_use_sma': True, 'bull_use_ema': False, 'bull_use_atr': False, 'bull_use_adx': True, 'bull_use_spike': False, 'bull_rsi_required': True, 'bear_strategy': 'breakout', 'bear_bb_std_mult': 3.3009422738342713, 'bear_rsi_os': 43, 'bear_rsi_ob': 47, 'bear_adx_thresh': 5.538415654158586, 'bear_atr_min_pct': 0.010166572503069312, 'bear_atr_max_pct': 0.06143578331905564, 'bear_tp_mult': 2.2446091276588156, 'bear_tsl_mult': 0.4857018838706117, 'bear_time_stop': 48, 'bear_use_sma': True, 'bear_use_ema': False, 'bear_use_atr': True, 'bear_use_adx': True, 'bear_use_spike': False, 'bear_rsi_required': False, 'sideways_strategy': 'mean_reversion', 'sideways_bb_std_mult': 2.6458954795800143, 'sideways_rsi_os': 50, 'sideways_rsi_ob': 58, 'sideways_adx_thresh': 9.124377994568324, 'sideways_atr_min_pct': 0.018846657777151946, 'sideways_atr_max_pct': 0.12359068452306565, 'sideways_tp_mult': 1.8271193982107137, 'sideways_tsl_mult': 0.32346815948898394, 'sideways_time_stop': 276, 'sideways_use_sma': True, 'sideways_use_ema': True, 'sideways_use_atr': False, 'sideways_use_adx': False, 'sideways_use_spike': False, 'sideways_rsi_required': True}.
[I 2025-08-30 19:32:08,602] Trial 430 finished with values: [-0.0171624622323292, 0.01706611960824564] and parameters: {'p_sma': 55, 'p_std': 27, 'p_atr': 12, 'p_adx': 9, 'rsi_period': 44, 'ema1': 5, 'ema2': 16, 'slip_atr_k': 0.02373317454058435, 'slip_spread_k': 0.32444224201934174, 'spread_hl_frac': 0.00453651767287731, 'bb_std_mult': 0.6119165707467169, 'rsi_os': 35, 'rsi_ob': 60, 'vol_spike': 0.058027709640027486, 'adx_thresh': 26.940000731438843, 'atr_min_pct': 0.024552035292034632, 'atr_max_pct': 0.09017834108537168, 'tp_mult': 2.1248274555588016, 'tsl_mult': 0.7554808417865219, 'strategy': 'mean_reversion', 'time_stop': 5, 'use_sma': False, 'use_atr': False, 'use_adx': False, 'use_ema': False, 'use_spike': True, 'rsi_required': True, 'edge_k': 0.13636617191384637, 'edge_cap': 0.7423355327624217, 'bull_strategy': 'mean_reversion', 'bull_bb_std_mult': 1.7338618065279083, 'bull_rsi_os': 49, 'bull_rsi_ob': 73, 'bull_adx_thresh': 24.732906146248183, 'bull_atr_min_pct': 0.002643442534206509, 'bull_atr_max_pct': 0.127569037911764, 'bull_tp_mult': 2.085462344276493, 'bull_tsl_mult': 0.9291127583860811, 'bull_time_stop': 182, 'bull_use_sma': True, 'bull_use_ema': False, 'bull_use_atr': False, 'bull_use_adx': True, 'bull_use_spike': False, 'bull_rsi_required': True, 'bear_strategy': 'mean_reversion', 'bear_bb_std_mult': 1.3726843907358233, 'bear_rsi_os': 9, 'bear_rsi_ob': 84, 'bear_adx_thresh': 26.78480818154768, 'bear_atr_min_pct': 0.013960058796447086, 'bear_atr_max_pct': 0.0559174438713819, 'bear_tp_mult': 1.7861912582815405, 'bear_tsl_mult': 0.1940660973367102, 'bear_time_stop': 48, 'bear_use_sma': True, 'bear_use_ema': False, 'bear_use_atr': True, 'bear_use_adx': True, 'bear_use_spike': False, 'bear_rsi_required': False, 'sideways_strategy': 'mean_reversion', 'sideways_bb_std_mult': 1.899188479058045, 'sideways_rsi_os': 24, 'sideways_rsi_ob': 57, 'sideways_adx_thresh': 8.939003433929164, 'sideways_atr_min_pct': 0.01726931916650845, 'sideways_atr_max_pct': 0.09198420417168562, 'sideways_tp_mult': 1.7244817073840428, 'sideways_tsl_mult': 0.6490243852004736, 'sideways_time_stop': 273, 'sideways_use_sma': True, 'sideways_use_ema': True, 'sideways_use_atr': False, 'sideways_use_adx': False, 'sideways_use_spike': False, 'sideways_rsi_required': True}.
