[I 2025-08-30 18:36:35,680] Trial 6 finished with values: [-1000000000.0, 1000000000.0] and parameters: {'p_sma': 58, 'p_std': 51, 'p_atr': 30, 'p_adx': 17, 'rsi_period': 36, 'ema1': 18, 'ema2': 43, 'slip_atr_k': 0.03653300103433843, 'slip_spread_k': 0.04222528365757516, 'spread_hl_frac': 0.01929133713766587, 'bb_std_mult': 2.7843519002359867, 'rsi_os': 39, 'rsi_ob': 75, 'vol_spike': 0.09541846360870745, 'adx_thresh': 22.614569256095127, 'atr_min_pct': 0.003692401064071876, 'atr_max_pct': 0.08170272678176728, 'tp_mult': 1.0500489251432532, 'tsl_mult': 0.9173547033063909, 'strategy': 'breakout', 'time_stop': 106, 'use_sma': False, 'use_atr': False, 'use_adx': False, 'use_ema': True, 'use_spike': False, 'rsi_required': False, 'edge_k': 1.4383530635569568, 'edge_cap': 0.4498412489206893, 'bull_strategy': 'mean_reversion', 'bull_bb_std_mult': 2.419875173558743, 'bull_rsi_os': 28, 'bull_rsi_ob': 94, 'bull_adx_thresh': 28.60229806799099, 'bull_atr_min_pct': 0.0105210503499515, 'bull_atr_max_pct': 0.11104752323556853, 'bull_tp_mult': 1.9861538814827089, 'bull_tsl_mult': 0.32114808034604014, 'bull_time_stop': 52, 'bull_use_sma': True, 'bull_use_ema': True, 'bull_use_atr': True, 'bull_use_adx': False, 'bull_use_spike': False, 'bull_rsi_required': True, 'bear_strategy': 'mean_reversion', 'bear_bb_std_mult': 3.5673249278562196, 'bear_rsi_os': 45, 'bear_rsi_ob': 67, 'bear_adx_thresh': 31.77775312980829, 'bear_atr_min_pct': 0.0017771912206268402, 'bear_atr_max_pct': 0.025810463741751423, 'bear_tp_mult': 2.20523342038902, 'bear_tsl_mult': 0.9931615739053468, 'bear_time_stop': 33, 'bear_use_sma': True, 'bear_use_ema': True, 'bear_use_atr': True, 'bear_use_adx': True, 'bear_use_spike': False, 'bear_rsi_required': False, 'sideways_strategy': 'breakout', 'sideways_bb_std_mult': 3.3347373198304346, 'sideways_rsi_os': 32, 'sideways_rsi_ob': 54, 'sideways_adx_thresh': 17.858051933857222, 'sideways_atr_min_pct': 0.02926264564874388, 'sideways_atr_max_pct': 0.12384496095642666, 'sideways_tp_mult': 2.598264431811578, 'sideways_tsl_mult': 0.47349421115145607, 'sideways_time_stop': 249, 'sideways_use_sma': False, 'sideways_use_ema': True, 'sideways_use_atr': True, 'sideways_use_adx': True, 'sideways_use_spike': False, 'sideways_rsi_required': False}.
[I 2025-08-30 18:37:08,900] Trial 12 finished with values: [-1000000000.0, 1000000000.0] and parameters: {'p_sma': 49, 'p_std': 45, 'p_atr': 16, 'p_adx': 12, 'rsi_period': 57, 'ema1': 7, 'ema2': 57, 'slip_atr_k': 0.0014631238082511155, 'slip_spread_k': 0.760844370242011, 'spread_hl_frac': 0.0003069535779178789, 'bb_std_mult': 3.0191032744991766, 'rsi_os': 51, 'rsi_ob': 69, 'vol_spike': 0.15136046007144657, 'adx_thresh': 23.238311473829974, 'atr_min_pct': 0.023425356792346044, 'atr_max_pct': 0.13080878435792073, 'tp_mult': 1.9932563773444536, 'tsl_mult': 0.38958206316101796, 'strategy': 'breakout', 'time_stop': 222, 'use_sma': False, 'use_atr': True, 'use_adx': False, 'use_ema': True, 'use_spike': False, 'rsi_required': False, 'edge_k': 1.2614771379499718, 'edge_cap': 0.576443251290035, 'bull_strategy': 'mean_reversion', 'bull_bb_std_mult': 1.0820580996820963, 'bull_rsi_os': 37, 'bull_rsi_ob': 75, 'bull_adx_thresh': 19.762022556062536, 'bull_atr_min_pct': 0.020116620717838447, 'bull_atr_max_pct': 0.10282726189135753, 'bull_tp_mult': 2.5137552558579648, 'bull_tsl_mult': 0.14227205916704144, 'bull_time_stop': 101, 'bull_use_sma': True, 'bull_use_ema': True, 'bull_use_atr': False, 'bull_use_adx': False, 'bull_use_spike': True, 'bull_rsi_required': True, 'bear_strategy': 'breakout', 'bear_bb_std_mult': 0.7981334229805681, 'bear_rsi_os': 31, 'bear_rsi_ob': 94, 'bear_adx_thresh': 11.107579853825156, 'bear_atr_min_pct': 0.01791550300628715, 'bear_atr_max_pct': 0.14299590379106888, 'bear_tp_mult': 1.0526327321981737, 'bear_tsl_mult': 0.15836247347484134, 'bear_time_stop': 246, 'bear_use_sma': False, 'bear_use_ema': False, 'bear_use_atr': True, 'bear_use_adx': False, 'bear_use_spike': True, 'bear_rsi_required': False, 'sideways_strategy': 'breakout', 'sideways_bb_std_mult': 2.2175501816692367, 'sideways_rsi_os': 31, 'sideways_rsi_ob': 69, 'sideways_adx_thresh': 10.006337480501935, 'sideways_atr_min_pct': 0.02984865326351333, 'sideways_atr_max_pct': 0.14343269047990673, 'sideways_tp_mult': 1.0577604367326798, 'sideways_tsl_mult': 0.7859793576253369, 'sideways_time_stop': 206, 'sideways_use_sma': True, 'sideways_use_ema': False, 'sideways_use_atr': True, 'sideways_use_adx': False, 'sideways_use_spike': False, 'sideways_rsi_required': False}.
[I 2025-08-30 18:37:09,494] Trial 9 finished with values: [-1000000000.0, 1000000000.0] and parameters: {'p_sma': 55, 'p_std': 36, 'p_atr': 14, 'p_adx': 7, 'rsi_period': 76, 'ema1': 18, 'ema2': 41, 'slip_atr_k': 0.1925636110536104, 'slip_spread_k': 0.6855251323775925, 'spread_hl_frac': 0.014671351525870326, 'bb_std_mult': 2.0972928255601118, 'rsi_os': 47, 'rsi_ob': 89, 'vol_spike': 0.13382277959881392, 'adx_thresh': 30.48812709020294, 'atr_min_pct': 0.013976279023272349, 'atr_max_pct': 0.12374880266467804, 'tp_mult': 1.8150842562350946, 'tsl_mult': 0.9827668285105408, 'strategy': 'breakout', 'time_stop': 35, 'use_sma': False, 'use_atr': False, 'use_adx': False, 'use_ema': False, 'use_spike': False, 'rsi_required': True, 'edge_k': 0.37825460610382944, 'edge_cap': 0.8909158499773753, 'bull_strategy': 'mean_reversion', 'bull_bb_std_mult': 0.8536460236753775, 'bull_rsi_os': 18, 'bull_rsi_ob': 83, 'bull_adx_thresh': 10.826311023473616, 'bull_atr_min_pct': 0.02367720137955795, 'bull_atr_max_pct': 0.03847229660143183, 'bull_tp_mult': 1.1304043206946703, 'bull_tsl_mult': 0.967777519270021, 'bull_time_stop': 272, 'bull_use_sma': False, 'bull_use_ema': True, 'bull_use_atr': True, 'bull_use_adx': True, 'bull_use_spike': False, 'bull_rsi_required': True, 'bear_strategy': 'mean_reversion', 'bear_bb_std_mult': 1.2955084560297832, 'bear_rsi_os': 29, 'bear_rsi_ob': 85, 'bear_adx_thresh': 6.841772099804175, 'bear_atr_min_pct': 0.011470975419444618, 'bear_atr_max_pct': 0.14581212143798997, 'bear_tp_mult': 2.516771518145343, 'bear_tsl_mult': 0.29362108413229726, 'bear_time_stop': 30, 'bear_use_sma': True, 'bear_use_ema': True, 'bear_use_atr': True, 'bear_use_adx': True, 'bear_use_spike': False, 'bear_rsi_required': False, 'sideways_strategy': 'mean_reversion', 'sideways_bb_std_mult': 2.1685818335848763, 'sideways_rsi_os': 22, 'sideways_rsi_ob': 68, 'sideways_adx_thresh': 34.78184894582464, 'sideways_atr_min_pct': 0.008376089628503365, 'sideways_atr_max_pct': 0.07008625944652938, 'sideways_tp_mult': 1.762426178893453, 'sideways_tsl_mult': 0.39358692497140146, 'sideways_time_stop': 154, 'sideways_use_sma': False, 'sideways_use_ema': True, 'sideways_use_atr': True, 'sideways_use_adx': True, 'sideways_use_spike': False, 'sideways_rsi_required': False}.
[I 2025-08-30 18:37:10,498] Trial 11 finished with values: [-1000000000.0, 1000000000.0] and parameters: {'p_sma': 27, 'p_std': 29, 'p_atr': 22, 'p_adx': 24, 'rsi_period': 32, 'ema1': 10, 'ema2': 55, 'slip_atr_k': 0.24393444634234632, 'slip_spread_k': 0.003882779313540974, 'spread_hl_frac': 0.010256028916501559, 'bb_std_mult': 3.308832132857719, 'rsi_os': 55, 'rsi_ob': 55, 'vol_spike': 0.00869835982693291, 'adx_thresh': 8.82316606968838, 'atr_min_pct': 0.009104567944349872, 'atr_max_pct': 0.10107209191252146, 'tp_mult': 2.7655375092486874, 'tsl_mult': 0.16341383726407033, 'strategy': 'breakout', 'time_stop': 62, 'use_sma': False, 'use_atr': False, 'use_adx': False, 'use_ema': False, 'use_spike': False, 'rsi_required': True, 'edge_k': 0.7151421617441978, 'edge_cap': 0.34550927704447176, 'bull_strategy': 'mean_reversion', 'bull_bb_std_mult': 2.025584635691684, 'bull_rsi_os': 27, 'bull_rsi_ob': 92, 'bull_adx_thresh': 10.874730374901045, 'bull_atr_min_pct': 0.02015842496964881, 'bull_atr_max_pct': 0.09299114752287514, 'bull_tp_mult': 1.643043527729849, 'bull_tsl_mult': 0.3769589265773915, 'bull_time_stop': 173, 'bull_use_sma': True, 'bull_use_ema': True, 'bull_use_atr': False, 'bull_use_adx': True, 'bull_use_spike': True, 'bull_rsi_required': True, 'bear_strategy': 'mean_reversion', 'bear_bb_std_mult': 2.878019429204446, 'bear_rsi_os': 48, 'bear_rsi_ob': 78, 'bear_adx_thresh': 10.054039803357227, 'bear_atr_min_pct': 0.014727042793006684, 'bear_atr_max_pct': 0.1436684066647131, 'bear_tp_mult': 1.3807020495908033, 'bear_tsl_mult': 0.4929758682383578, 'bear_time_stop': 140, 'bear_use_sma': False, 'bear_use_ema': False, 'bear_use_atr': False, 'bear_use_adx': True, 'bear_use_spike': False, 'bear_rsi_required': False, 'sideways_strategy': 'mean_reversion', 'sideways_bb_std_mult': 1.4178522197725816, 'sideways_rsi_os': 32, 'sideways_rsi_ob': 46, 'sideways_adx_thresh': 15.956198700150953, 'sideways_atr_min_pct': 0.028293391380617573, 'sideways_atr_max_pct': 0.040170978445123566, 'sideways_tp_mult': 1.7995330142912493, 'sideways_tsl_mult': 0.18946572862460687, 'sideways_time_stop': 53, 'sideways_use_sma': False, 'sideways_use_ema': True, 'sideways_use_atr': True, 'sideways_use_adx': False, 'sideways_use_spike': True, 'sideways_rsi_required': True}.
[I 2025-08-30 18:37:10,764] Trial 13 finished with values: [-1000000000.0, 1000000000.0] and parameters: {'p_sma': 45, 'p_std': 20, 'p_atr': 7, 'p_adx': 7, 'rsi_period': 60, 'ema1': 6, 'ema2': 10, 'slip_atr_k': 0.00023668403096729906, 'slip_spread_k': 0.36954410730069975, 'spread_hl_frac': 0.0009575121872845323, 'bb_std_mult': 0.5203403599402967, 'rsi_os': 51, 'rsi_ob': 66, 'vol_spike': 0.13459188197361024, 'adx_thresh': 16.754717314602267, 'atr_min_pct': 0.013193113799770638, 'atr_max_pct': 0.14686831108445428, 'tp_mult': 2.7359253609288063, 'tsl_mult': 0.6370567290740416, 'strategy': 'breakout', 'time_stop': 190, 'use_sma': False, 'use_atr': True, 'use_adx': False, 'use_ema': False, 'use_spike': True, 'rsi_required': True, 'edge_k': 0.04100935839132247, 'edge_cap': 0.11072002099515016, 'bull_strategy': 'breakout', 'bull_bb_std_mult': 3.536987100108057, 'bull_rsi_os': 54, 'bull_rsi_ob': 65, 'bull_adx_thresh': 14.893267181585975, 'bull_atr_min_pct': 0.026743277489010904, 'bull_atr_max_pct': 0.14334384281568668, 'bull_tp_mult': 1.0987696066098054, 'bull_tsl_mult': 0.9925995723326039, 'bull_time_stop': 294, 'bull_use_sma': True, 'bull_use_ema': False, 'bull_use_atr': True, 'bull_use_adx': False, 'bull_use_spike': True, 'bull_rsi_required': True, 'bear_strategy': 'mean_reversion', 'bear_bb_std_mult': 2.74825653688491, 'bear_rsi_os': 54, 'bear_rsi_ob': 74, 'bear_adx_thresh': 25.29527110097999, 'bear_atr_min_pct': 0.028587159183772422, 'bear_atr_max_pct': 0.14492321560625251, 'bear_tp_mult': 1.8583351183974608, 'bear_tsl_mult': 0.3643993496356714, 'bear_time_stop': 87, 'bear_use_sma': False, 'bear_use_ema': False, 'bear_use_atr': True, 'bear_use_adx': True, 'bear_use_spike': True, 'bear_rsi_required': False, 'sideways_strategy': 'mean_reversion', 'sideways_bb_std_mult': 0.8196013697198801, 'sideways_rsi_os': 44, 'sideways_rsi_ob': 64, 'sideways_adx_thresh': 24.40866678238065, 'sideways_atr_min_pct': 0.02027062955734462, 'sideways_atr_max_pct': 0.10981984633698363, 'sideways_tp_mult': 1.654079262023713, 'sideways_tsl_mult': 0.837787586478764, 'sideways_time_stop': 38, 'sideways_use_sma': True, 'sideways_use_ema': True, 'sideways_use_atr': False, 'sideways_use_adx': False, 'sideways_use_spike': False, 'sideways_rsi_required': False}.
[I 2025-08-30 18:37:40,742] Trial 14 finished with values: [-1000000000.0, 1000000000.0] and parameters: {'p_sma': 24, 'p_std': 14, 'p_atr': 7, 'p_adx': 7, 'rsi_period': 58, 'ema1': 30, 'ema2': 43, 'slip_atr_k': 0.13510170039556121, 'slip_spread_k': 0.3697451992482713, 'spread_hl_frac': 0.0015911364184946174, 'bb_std_mult': 0.5127207433727479, 'rsi_os': 41, 'rsi_ob': 64, 'vol_spike': 0.11311662345628883, 'adx_thresh': 16.09117483824935, 'atr_min_pct': 0.013618788841860047, 'atr_max_pct': 0.1413546735188382, 'tp_mult': 2.971373922396164, 'tsl_mult': 0.26735884154676814, 'strategy': 'breakout', 'time_stop': 157, 'use_sma': False, 'use_atr': True, 'use_adx': False, 'use_ema': False, 'use_spike': True, 'rsi_required': True, 'edge_k': 0.022822726509461932, 'edge_cap': 0.06725365775223299, 'bull_strategy': 'breakout', 'bull_bb_std_mult': 3.463587502915542, 'bull_rsi_os': 54, 'bull_rsi_ob': 65, 'bull_adx_thresh': 19.96847553526173, 'bull_atr_min_pct': 0.02852550245301598, 'bull_atr_max_pct': 0.14813518715606758, 'bull_tp_mult': 1.1050059313825344, 'bull_tsl_mult': 0.9611159179267899, 'bull_time_stop': 289, 'bull_use_sma': True, 'bull_use_ema': False, 'bull_use_atr': True, 'bull_use_adx': False, 'bull_use_spike': True, 'bull_rsi_required': True, 'bear_strategy': 'breakout', 'bear_bb_std_mult': 2.769209892498533, 'bear_rsi_os': 55, 'bear_rsi_ob': 74, 'bear_adx_thresh': 26.811029508557162, 'bear_atr_min_pct': 0.029498626388517357, 'bear_atr_max_pct': 0.1215399502677972, 'bear_tp_mult': 1.8579784628748912, 'bear_tsl_mult': 0.37492193745437186, 'bear_time_stop': 79, 'bear_use_sma': False, 'bear_use_ema': False, 'bear_use_atr': True, 'bear_use_adx': True, 'bear_use_spike': False, 'bear_rsi_required': False, 'sideways_strategy': 'mean_reversion', 'sideways_bb_std_mult': 0.5058154575368217, 'sideways_rsi_os': 41, 'sideways_rsi_ob': 62, 'sideways_adx_thresh': 25.249463732533687, 'sideways_atr_min_pct': 0.019846907766953553, 'sideways_atr_max_pct': 0.11075834701980987, 'sideways_tp_mult': 1.717392913767156, 'sideways_tsl_mult': 0.9807132128201062, 'sideways_time_stop': 23, 'sideways_use_sma': True, 'sideways_use_ema': True, 'sideways_use_atr': False, 'sideways_use_adx': False, 'sideways_use_spike': False, 'sideways_rsi_required': False}.
[I 2025-08-30 18:37:41,609] Trial 15 finished with values: [-1000000000.0, 1000000000.0] and parameters: {'p_sma': 29, 'p_std': 13, 'p_atr': 8, 'p_adx': 7, 'rsi_period': 56, 'ema1': 30, 'ema2': 16, 'slip_atr_k': 0.1170340891221371, 'slip_spread_k': 0.33076443628314084, 'spread_hl_frac': 0.03618800061217498, 'bb_std_mult': 0.5608999317266836, 'rsi_os': 38, 'rsi_ob': 64, 'vol_spike': 0.08233304848773965, 'adx_thresh': 16.866166311138784, 'atr_min_pct': 9.322929683945255e-06, 'atr_max_pct': 0.1440866227248385, 'tp_mult': 2.9772776348433045, 'tsl_mult': 0.2904051741658753, 'strategy': 'breakout', 'time_stop': 155, 'use_sma': False, 'use_atr': True, 'use_adx': False, 'use_ema': False, 'use_spike': True, 'rsi_required': True, 'edge_k': 0.007263026281547208, 'edge_cap': 0.08973919428180199, 'bull_strategy': 'breakout', 'bull_bb_std_mult': 3.331650599737476, 'bull_rsi_os': 49, 'bull_rsi_ob': 63, 'bull_adx_thresh': 20.492859798090272, 'bull_atr_min_pct': 0.029494111037374083, 'bull_atr_max_pct': 0.1464578892619653, 'bull_tp_mult': 1.2823191515441965, 'bull_tsl_mult': 0.006123952027465573, 'bull_time_stop': 22, 'bull_use_sma': True, 'bull_use_ema': False, 'bull_use_atr': True, 'bull_use_adx': False, 'bull_use_spike': True, 'bull_rsi_required': True, 'bear_strategy': 'breakout', 'bear_bb_std_mult': 2.744379612098899, 'bear_rsi_os': 54, 'bear_rsi_ob': 72, 'bear_adx_thresh': 25.372107171361115, 'bear_atr_min_pct': 0.02780915996460421, 'bear_atr_max_pct': 0.11529314293228471, 'bear_tp_mult': 1.8821287837281975, 'bear_tsl_mult': 0.4071441869754992, 'bear_time_stop': 87, 'bear_use_sma': False, 'bear_use_ema': False, 'bear_use_atr': True, 'bear_use_adx': True, 'bear_use_spike': False, 'bear_rsi_required': False, 'sideways_strategy': 'mean_reversion', 'sideways_bb_std_mult': 1.423679030979947, 'sideways_rsi_os': 42, 'sideways_rsi_ob': 61, 'sideways_adx_thresh': 5.215734256060021, 'sideways_atr_min_pct': 0.0007904167215363449, 'sideways_atr_max_pct': 0.11044586098516287, 'sideways_tp_mult': 1.508898770474741, 'sideways_tsl_mult': 0.641606406286324, 'sideways_time_stop': 57, 'sideways_use_sma': True, 'sideways_use_ema': True, 'sideways_use_atr': False, 'sideways_use_adx': False, 'sideways_use_spike': False, 'sideways_rsi_required': False}.
[I 2025-08-30 18:37:42,794] Trial 17 finished with values: [-1000000000.0, 1000000000.0] and parameters: {'p_sma': 23, 'p_std': 7, 'p_atr': 10, 'p_adx': 19, 'rsi_period': 55, 'ema1': 27, 'ema2': 21, 'slip_atr_k': 0.13390429173803164, 'slip_spread_k': 0.3866124685465474, 'spread_hl_frac': 0.037504941606297415, 'bb_std_mult': 0.7206217626182587, 'rsi_os': 38, 'rsi_ob': 62, 'vol_spike': 0.2728166749327311, 'adx_thresh': 16.843310194051593, 'atr_min_pct': 0.01839496101549308, 'atr_max_pct': 0.13887052639791367, 'tp_mult': 2.935458261479506, 'tsl_mult': 0.3188882256640835, 'strategy': 'breakout', 'time_stop': 156, 'use_sma': False, 'use_atr': True, 'use_adx': False, 'use_ema': False, 'use_spike': True, 'rsi_required': True, 'edge_k': 0.037734623584386284, 'edge_cap': 0.08078568980388615, 'bull_strategy': 'breakout', 'bull_bb_std_mult': 3.591387671264732, 'bull_rsi_os': 15, 'bull_rsi_ob': 59, 'bull_adx_thresh': 22.664092766768366, 'bull_atr_min_pct': 0.004157428836005433, 'bull_atr_max_pct': 0.14745746406874471, 'bull_tp_mult': 2.3115748726087313, 'bull_tsl_mult': 0.7264200199269744, 'bull_time_stop': 39, 'bull_use_sma': True, 'bull_use_ema': False, 'bull_use_atr': True, 'bull_use_adx': False, 'bull_use_spike': True, 'bull_rsi_required': True, 'bear_strategy': 'breakout', 'bear_bb_std_mult': 2.4740683310501232, 'bear_rsi_os': 37, 'bear_rsi_ob': 71, 'bear_adx_thresh': 25.856225921096854, 'bear_atr_min_pct': 0.026688737382406118, 'bear_atr_max_pct': 0.12022545373284631, 'bear_tp_mult': 1.7664811958110227, 'bear_tsl_mult': 0.7403776901212946, 'bear_time_stop': 76, 'bear_use_sma': True, 'bear_use_ema': False, 'bear_use_atr': True, 'bear_use_adx': True, 'bear_use_spike': False, 'bear_rsi_required': False, 'sideways_strategy': 'mean_reversion', 'sideways_bb_std_mult': 1.4472816363172258, 'sideways_rsi_os': 10, 'sideways_rsi_ob': 59, 'sideways_adx_thresh': 6.613993193860028, 'sideways_atr_min_pct': 0.001538099957432872, 'sideways_atr_max_pct': 0.10939633302874784, 'sideways_tp_mult': 1.3209416492427057, 'sideways_tsl_mult': 0.582453597091102, 'sideways_time_stop': 293, 'sideways_use_sma': True, 'sideways_use_ema': True, 'sideways_use_atr': False, 'sideways_use_adx': False, 'sideways_use_spike': False, 'sideways_rsi_required': False}.
[I 2025-08-30 18:37:42,950] Trial 16 finished with values: [-1000000000.0, 1000000000.0] and parameters: {'p_sma': 44, 'p_std': 15, 'p_atr': 7, 'p_adx': 7, 'rsi_period': 56, 'ema1': 29, 'ema2': 19, 'slip_atr_k': 0.12270759416155436, 'slip_spread_k': 0.39299330537008725, 'spread_hl_frac': 0.036713547323464726, 'bb_std_mult': 0.552056442392536, 'rsi_os': 39, 'rsi_ob': 65, 'vol_spike': 0.29944271075397366, 'adx_thresh': 15.873201175424313, 'atr_min_pct': 0.0008978311613239039, 'atr_max_pct': 0.14821500683250263, 'tp_mult': 2.829073972681694, 'tsl_mult': 0.28101880140881363, 'strategy': 'breakout', 'time_stop': 151, 'use_sma': False, 'use_atr': True, 'use_adx': False, 'use_ema': False, 'use_spike': True, 'rsi_required': True, 'edge_k': 0.009874691954812526, 'edge_cap': 0.08284667002197138, 'bull_strategy': 'breakout', 'bull_bb_std_mult': 3.5833750153969777, 'bull_rsi_os': 55, 'bull_rsi_ob': 62, 'bull_adx_thresh': 20.900631372504506, 'bull_atr_min_pct': 0.0049145772275666355, 'bull_atr_max_pct': 0.1478148597717109, 'bull_tp_mult': 1.0974148149138938, 'bull_tsl_mult': 0.7330246271489632, 'bull_time_stop': 18, 'bull_use_sma': True, 'bull_use_ema': False, 'bull_use_atr': True, 'bull_use_adx': False, 'bull_use_spike': True, 'bull_rsi_required': True, 'bear_strategy': 'breakout', 'bear_bb_std_mult': 2.5572470950026105, 'bear_rsi_os': 55, 'bear_rsi_ob': 70, 'bear_adx_thresh': 25.987454272827627, 'bear_atr_min_pct': 0.029445678031904666, 'bear_atr_max_pct': 0.1106523366373392, 'bear_tp_mult': 1.8833619052515662, 'bear_tsl_mult': 0.33724365209900575, 'bear_time_stop': 92, 'bear_use_sma': False, 'bear_use_ema': False, 'bear_use_atr': True, 'bear_use_adx': True, 'bear_use_spike': False, 'bear_rsi_required': False, 'sideways_strategy': 'mean_reversion', 'sideways_bb_std_mult': 0.6666479581345472, 'sideways_rsi_os': 47, 'sideways_rsi_ob': 60, 'sideways_adx_thresh': 6.0662100359690765, 'sideways_atr_min_pct': 0.0010649934701859563, 'sideways_atr_max_pct': 0.10673539412058239, 'sideways_tp_mult': 1.426151504453347, 'sideways_tsl_mult': 0.9676636241969997, 'sideways_time_stop': 62, 'sideways_use_sma': True, 'sideways_use_ema': True, 'sideways_use_atr': False, 'sideways_use_adx': False, 'sideways_use_spike': False, 'sideways_rsi_required': False}.
