[I 2025-08-30 18:50:24,091] Trial 116 finished with values: [-1000000000.0, 1000000000.0] and parameters: {'p_sma': 10, 'p_std': 31, 'p_atr': 17, 'p_adx': 12, 'rsi_period': 50, 'ema1': 6, 'ema2': 57, 'slip_atr_k': 0.09716078163851533, 'slip_spread_k': 0.6220781268057298, 'spread_hl_frac': 0.005466785288236925, 'bb_std_mult': 1.0263559335234427, 'rsi_os': 40, 'rsi_ob': 72, 'vol_spike': 0.10052170327057315, 'adx_thresh': 20.014062423428985, 'atr_min_pct': 0.018811034839533645, 'atr_max_pct': 0.077855615195371, 'tp_mult': 2.966464721486967, 'tsl_mult': 0.8687341644061645, 'strategy': 'mean_reversion', 'time_stop': 28, 'use_sma': False, 'use_atr': True, 'use_adx': False, 'use_ema': False, 'use_spike': True, 'rsi_required': True, 'edge_k': 0.12312531758849159, 'edge_cap': 0.8619707716771399, 'bull_strategy': 'mean_reversion', 'bull_bb_std_mult': 1.4886994372849236, 'bull_rsi_os': 47, 'bull_rsi_ob': 70, 'bull_adx_thresh': 26.166901522046224, 'bull_atr_min_pct': 0.016189677545534315, 'bull_atr_max_pct': 0.05787292853369766, 'bull_tp_mult': 1.5169617358014507, 'bull_tsl_mult': 0.4290852855592984, 'bull_time_stop': 95, 'bull_use_sma': True, 'bull_use_ema': False, 'bull_use_atr': False, 'bull_use_adx': True, 'bull_use_spike': False, 'bull_rsi_required': True, 'bear_strategy': 'breakout', 'bear_bb_std_mult': 3.264729657100258, 'bear_rsi_os': 46, 'bear_rsi_ob': 88, 'bear_adx_thresh': 7.29747085379283, 'bear_atr_min_pct': 0.01353899581673344, 'bear_atr_max_pct': 0.13395093947775927, 'bear_tp_mult': 1.0960766922674452, 'bear_tsl_mult': 0.3696568114880803, 'bear_time_stop': 59, 'bear_use_sma': False, 'bear_use_ema': False, 'bear_use_atr': True, 'bear_use_adx': True, 'bear_use_spike': False, 'bear_rsi_required': False, 'sideways_strategy': 'breakout', 'sideways_bb_std_mult': 1.0960618538333005, 'sideways_rsi_os': 13, 'sideways_rsi_ob': 53, 'sideways_adx_thresh': 11.77022223476219, 'sideways_atr_min_pct': 0.01990641641997275, 'sideways_atr_max_pct': 0.11279349922166533, 'sideways_tp_mult': 2.5231276513795353, 'sideways_tsl_mult': 0.6665665437960913, 'sideways_time_stop': 169, 'sideways_use_sma': True, 'sideways_use_ema': True, 'sideways_use_atr': True, 'sideways_use_adx': False, 'sideways_use_spike': False, 'sideways_rsi_required': True}.
[I 2025-08-30 18:50:24,289] Trial 117 finished with values: [-1000000000.0, 1000000000.0] and parameters: {'p_sma': 44, 'p_std': 31, 'p_atr': 17, 'p_adx': 14, 'rsi_period': 82, 'ema1': 25, 'ema2': 19, 'slip_atr_k': 0.198089186566549, 'slip_spread_k': 0.07430665942537895, 'spread_hl_frac': 0.0039908239004831855, 'bb_std_mult': 1.0370947226430376, 'rsi_os': 17, 'rsi_ob': 73, 'vol_spike': 0.06860822057136486, 'adx_thresh': 19.777988226720975, 'atr_min_pct': 0.01836338618820663, 'atr_max_pct': 0.14344880054902276, 'tp_mult': 2.946374007898692, 'tsl_mult': 0.5117498312676824, 'strategy': 'mean_reversion', 'time_stop': 28, 'use_sma': False, 'use_atr': True, 'use_adx': False, 'use_ema': False, 'use_spike': True, 'rsi_required': True, 'edge_k': 0.11790979263633483, 'edge_cap': 0.9338095714092666, 'bull_strategy': 'mean_reversion', 'bull_bb_std_mult': 1.0632291430087777, 'bull_rsi_os': 46, 'bull_rsi_ob': 84, 'bull_adx_thresh': 33.18065258797541, 'bull_atr_min_pct': 0.02130859396365801, 'bull_atr_max_pct': 0.10672476540367828, 'bull_tp_mult': 2.1833037190814846, 'bull_tsl_mult': 0.982253052449931, 'bull_time_stop': 193, 'bull_use_sma': True, 'bull_use_ema': False, 'bull_use_atr': False, 'bull_use_adx': True, 'bull_use_spike': False, 'bull_rsi_required': True, 'bear_strategy': 'breakout', 'bear_bb_std_mult': 3.103913632439955, 'bear_rsi_os': 39, 'bear_rsi_ob': 47, 'bear_adx_thresh': 7.198963676422503, 'bear_atr_min_pct': 0.013548203681683713, 'bear_atr_max_pct': 0.10109870927983548, 'bear_tp_mult': 1.073220368159555, 'bear_tsl_mult': 0.188242715930992, 'bear_time_stop': 52, 'bear_use_sma': False, 'bear_use_ema': False, 'bear_use_atr': True, 'bear_use_adx': True, 'bear_use_spike': False, 'bear_rsi_required': False, 'sideways_strategy': 'breakout', 'sideways_bb_std_mult': 2.0025297782825264, 'sideways_rsi_os': 18, 'sideways_rsi_ob': 63, 'sideways_adx_thresh': 10.070073577140855, 'sideways_atr_min_pct': 0.0014107391013114187, 'sideways_atr_max_pct': 0.11204903482803441, 'sideways_tp_mult': 1.8319720518012688, 'sideways_tsl_mult': 0.6793479894320619, 'sideways_time_stop': 213, 'sideways_use_sma': True, 'sideways_use_ema': True, 'sideways_use_atr': True, 'sideways_use_adx': False, 'sideways_use_spike': False, 'sideways_rsi_required': True}.
[I 2025-08-30 18:50:24,398] Trial 118 finished with values: [-1000000000.0, 1000000000.0] and parameters: {'p_sma': 10, 'p_std': 33, 'p_atr': 9, 'p_adx': 12, 'rsi_period': 57, 'ema1': 22, 'ema2': 19, 'slip_atr_k': 0.19474577317558847, 'slip_spread_k': 0.2785968935385557, 'spread_hl_frac': 0.005827940109857321, 'bb_std_mult': 0.6841906430685998, 'rsi_os': 35, 'rsi_ob': 88, 'vol_spike': 0.21481662236597548, 'adx_thresh': 22.391261692228092, 'atr_min_pct': 0.018518514076486376, 'atr_max_pct': 0.1286418907357392, 'tp_mult': 1.0717847761982249, 'tsl_mult': 0.5103163775136648, 'strategy': 'breakout', 'time_stop': 15, 'use_sma': True, 'use_atr': True, 'use_adx': False, 'use_ema': False, 'use_spike': True, 'rsi_required': True, 'edge_k': 0.10857929657146546, 'edge_cap': 0.8512896907207128, 'bull_strategy': 'mean_reversion', 'bull_bb_std_mult': 2.7961680721080984, 'bull_rsi_os': 47, 'bull_rsi_ob': 64, 'bull_adx_thresh': 26.30028644592736, 'bull_atr_min_pct': 0.02149546348120728, 'bull_atr_max_pct': 0.01426975488480529, 'bull_tp_mult': 2.9071463007792895, 'bull_tsl_mult': 0.9786689096003034, 'bull_time_stop': 278, 'bull_use_sma': True, 'bull_use_ema': False, 'bull_use_atr': False, 'bull_use_adx': True, 'bull_use_spike': False, 'bull_rsi_required': False, 'bear_strategy': 'breakout', 'bear_bb_std_mult': 3.3881512393403552, 'bear_rsi_os': 40, 'bear_rsi_ob': 88, 'bear_adx_thresh': 33.39471636922296, 'bear_atr_min_pct': 0.013506164977167202, 'bear_atr_max_pct': 0.09630224925778386, 'bear_tp_mult': 1.580140833109574, 'bear_tsl_mult': 0.19007686810340335, 'bear_time_stop': 52, 'bear_use_sma': False, 'bear_use_ema': False, 'bear_use_atr': True, 'bear_use_adx': True, 'bear_use_spike': False, 'bear_rsi_required': False, 'sideways_strategy': 'breakout', 'sideways_bb_std_mult': 2.0280705947965956, 'sideways_rsi_os': 53, 'sideways_rsi_ob': 72, 'sideways_adx_thresh': 10.864212402893873, 'sideways_atr_min_pct': 0.02016376323420555, 'sideways_atr_max_pct': 0.11422587348117078, 'sideways_tp_mult': 1.8407190210281903, 'sideways_tsl_mult': 0.47715321475317757, 'sideways_time_stop': 221, 'sideways_use_sma': True, 'sideways_use_ema': True, 'sideways_use_atr': True, 'sideways_use_adx': False, 'sideways_use_spike': False, 'sideways_rsi_required': False}.
[I 2025-08-30 18:50:56,608] Trial 123 finished with values: [-1000000000.0, 1000000000.0] and parameters: {'p_sma': 7, 'p_std': 19, 'p_atr': 30, 'p_adx': 10, 'rsi_period': 55, 'ema1': 28, 'ema2': 11, 'slip_atr_k': 0.13223868336805844, 'slip_spread_k': 0.33257341193126294, 'spread_hl_frac': 0.03300552902385804, 'bb_std_mult': 2.6922097734104478, 'rsi_os': 44, 'rsi_ob': 95, 'vol_spike': 0.25237257108016903, 'adx_thresh': 28.64512046632941, 'atr_min_pct': 0.02191228854949108, 'atr_max_pct': 0.13776893523718237, 'tp_mult': 2.474956445115428, 'tsl_mult': 0.005171697537827202, 'strategy': 'breakout', 'time_stop': 52, 'use_sma': False, 'use_atr': False, 'use_adx': True, 'use_ema': False, 'use_spike': True, 'rsi_required': True, 'edge_k': 0.1821985512316632, 'edge_cap': 0.21416143997897683, 'bull_strategy': 'breakout', 'bull_bb_std_mult': 1.3762067181297477, 'bull_rsi_os': 7, 'bull_rsi_ob': 68, 'bull_adx_thresh': 24.942761661317775, 'bull_atr_min_pct': 0.0027068466691623477, 'bull_atr_max_pct': 0.1448585470175358, 'bull_tp_mult': 1.0670803390746237, 'bull_tsl_mult': 0.9384731072003789, 'bull_time_stop': 171, 'bull_use_sma': True, 'bull_use_ema': False, 'bull_use_atr': True, 'bull_use_adx': False, 'bull_use_spike': True, 'bull_rsi_required': True, 'bear_strategy': 'breakout', 'bear_bb_std_mult': 2.9417583911983445, 'bear_rsi_os': 43, 'bear_rsi_ob': 81, 'bear_adx_thresh': 19.74919276168243, 'bear_atr_min_pct': 0.028538330113631, 'bear_atr_max_pct': 0.055008871197031184, 'bear_tp_mult': 1.7646853536156302, 'bear_tsl_mult': 0.5578048129504962, 'bear_time_stop': 89, 'bear_use_sma': True, 'bear_use_ema': False, 'bear_use_atr': False, 'bear_use_adx': False, 'bear_use_spike': False, 'bear_rsi_required': True, 'sideways_strategy': 'breakout', 'sideways_bb_std_mult': 2.4684061653621074, 'sideways_rsi_os': 33, 'sideways_rsi_ob': 74, 'sideways_adx_thresh': 30.561675528237316, 'sideways_atr_min_pct': 0.008719291785022325, 'sideways_atr_max_pct': 0.12559242926718076, 'sideways_tp_mult': 2.0202473592028047, 'sideways_tsl_mult': 0.9386990975223983, 'sideways_time_stop': 277, 'sideways_use_sma': True, 'sideways_use_ema': False, 'sideways_use_atr': False, 'sideways_use_adx': False, 'sideways_use_spike': False, 'sideways_rsi_required': False}.
[I 2025-08-30 18:50:57,072] Trial 121 finished with values: [-1000000000.0, 1000000000.0] and parameters: {'p_sma': 34, 'p_std': 15, 'p_atr': 29, 'p_adx': 24, 'rsi_period': 67, 'ema1': 25, 'ema2': 19, 'slip_atr_k': 0.19050201520422627, 'slip_spread_k': 0.3214498422511941, 'spread_hl_frac': 0.03421241675803773, 'bb_std_mult': 2.7696441138454837, 'rsi_os': 17, 'rsi_ob': 95, 'vol_spike': 0.015397936909481658, 'adx_thresh': 34.03401400707424, 'atr_min_pct': 0.020095847887680932, 'atr_max_pct': 0.14305122669165313, 'tp_mult': 1.0405987699750174, 'tsl_mult': 0.4550926171586246, 'strategy': 'breakout', 'time_stop': 205, 'use_sma': False, 'use_atr': False, 'use_adx': False, 'use_ema': False, 'use_spike': True, 'rsi_required': True, 'edge_k': 0.1670352477511551, 'edge_cap': 0.2944927428996786, 'bull_strategy': 'mean_reversion', 'bull_bb_std_mult': 1.082886821027946, 'bull_rsi_os': 52, 'bull_rsi_ob': 68, 'bull_adx_thresh': 24.75875687189764, 'bull_atr_min_pct': 0.015272389486378284, 'bull_atr_max_pct': 0.11217591177574418, 'bull_tp_mult': 1.020930016583959, 'bull_tsl_mult': 0.97995315786549, 'bull_time_stop': 280, 'bull_use_sma': True, 'bull_use_ema': False, 'bull_use_atr': True, 'bull_use_adx': False, 'bull_use_spike': True, 'bull_rsi_required': True, 'bear_strategy': 'breakout', 'bear_bb_std_mult': 3.0836483763067952, 'bear_rsi_os': 48, 'bear_rsi_ob': 86, 'bear_adx_thresh': 33.1870064301155, 'bear_atr_min_pct': 0.016600354577878736, 'bear_atr_max_pct': 0.05549212665687378, 'bear_tp_mult': 1.1677089224713382, 'bear_tsl_mult': 0.5730347611068745, 'bear_time_stop': 88, 'bear_use_sma': True, 'bear_use_ema': False, 'bear_use_atr': True, 'bear_use_adx': True, 'bear_use_spike': False, 'bear_rsi_required': True, 'sideways_strategy': 'breakout', 'sideways_bb_std_mult': 3.290900143715331, 'sideways_rsi_os': 6, 'sideways_rsi_ob': 63, 'sideways_adx_thresh': 18.836299056052074, 'sideways_atr_min_pct': 0.02191873197967467, 'sideways_atr_max_pct': 0.12371460985131186, 'sideways_tp_mult': 1.8431254206319578, 'sideways_tsl_mult': 0.2433473149196161, 'sideways_time_stop': 142, 'sideways_use_sma': True, 'sideways_use_ema': True, 'sideways_use_atr': False, 'sideways_use_adx': False, 'sideways_use_spike': False, 'sideways_rsi_required': False}.
[I 2025-08-30 18:50:57,287] Trial 120 finished with values: [-1000000000.0, 1000000000.0] and parameters: {'p_sma': 10, 'p_std': 39, 'p_atr': 30, 'p_adx': 19, 'rsi_period': 35, 'ema1': 25, 'ema2': 19, 'slip_atr_k': 0.01480316840491952, 'slip_spread_k': 0.9626578516811295, 'spread_hl_frac': 0.0398632064349242, 'bb_std_mult': 1.0459416211089705, 'rsi_os': 42, 'rsi_ob': 72, 'vol_spike': 0.25698292278045093, 'adx_thresh': 28.545973081687173, 'atr_min_pct': 0.018508085810105657, 'atr_max_pct': 0.14265442465049682, 'tp_mult': 2.9348347157818693, 'tsl_mult': 0.9227990258171348, 'strategy': 'breakout', 'time_stop': 199, 'use_sma': False, 'use_atr': True, 'use_adx': False, 'use_ema': False, 'use_spike': True, 'rsi_required': True, 'edge_k': 0.18332950088459432, 'edge_cap': 0.2968917357463598, 'bull_strategy': 'mean_reversion', 'bull_bb_std_mult': 1.7037442087035648, 'bull_rsi_os': 52, 'bull_rsi_ob': 70, 'bull_adx_thresh': 15.728796130668886, 'bull_atr_min_pct': 0.0022630573877924966, 'bull_atr_max_pct': 0.029537142132149998, 'bull_tp_mult': 2.3133697423985122, 'bull_tsl_mult': 0.9791679875430591, 'bull_time_stop': 96, 'bull_use_sma': True, 'bull_use_ema': False, 'bull_use_atr': True, 'bull_use_adx': False, 'bull_use_spike': False, 'bull_rsi_required': True, 'bear_strategy': 'breakout', 'bear_bb_std_mult': 3.397834547100876, 'bear_rsi_os': 40, 'bear_rsi_ob': 47, 'bear_adx_thresh': 5.04691032057933, 'bear_atr_min_pct': 0.013416466572162297, 'bear_atr_max_pct': 0.13451931563186367, 'bear_tp_mult': 2.3044937287907112, 'bear_tsl_mult': 0.6675447494135045, 'bear_time_stop': 63, 'bear_use_sma': False, 'bear_use_ema': False, 'bear_use_atr': True, 'bear_use_adx': True, 'bear_use_spike': False, 'bear_rsi_required': True, 'sideways_strategy': 'breakout', 'sideways_bb_std_mult': 1.9884420917128822, 'sideways_rsi_os': 13, 'sideways_rsi_ob': 52, 'sideways_adx_thresh': 31.08815560116303, 'sideways_atr_min_pct': 0.021855118101075717, 'sideways_atr_max_pct': 0.12536532394617272, 'sideways_tp_mult': 1.7365008875963346, 'sideways_tsl_mult': 0.09838884063107856, 'sideways_time_stop': 277, 'sideways_use_sma': True, 'sideways_use_ema': True, 'sideways_use_atr': True, 'sideways_use_adx': False, 'sideways_use_spike': False, 'sideways_rsi_required': False}.
[I 2025-08-30 18:50:57,365] Trial 122 finished with values: [-1000000000.0, 1000000000.0] and parameters: {'p_sma': 48, 'p_std': 39, 'p_atr': 26, 'p_adx': 10, 'rsi_period': 7, 'ema1': 23, 'ema2': 28, 'slip_atr_k': 0.18954292976972842, 'slip_spread_k': 0.32395397204473775, 'spread_hl_frac': 0.028358133230455655, 'bb_std_mult': 1.1581917467652953, 'rsi_os': 42, 'rsi_ob': 46, 'vol_spike': 0.26792834450630154, 'adx_thresh': 28.52317248862753, 'atr_min_pct': 0.021919980960528083, 'atr_max_pct': 0.1392296331097505, 'tp_mult': 1.7732332554792363, 'tsl_mult': 0.7655190518355071, 'strategy': 'breakout', 'time_stop': 14, 'use_sma': True, 'use_atr': False, 'use_adx': False, 'use_ema': False, 'use_spike': True, 'rsi_required': True, 'edge_k': 0.1787296039270004, 'edge_cap': 0.29780791993434813, 'bull_strategy': 'breakout', 'bull_bb_std_mult': 1.6424055523551615, 'bull_rsi_os': 8, 'bull_rsi_ob': 93, 'bull_adx_thresh': 34.9973893508043, 'bull_atr_min_pct': 0.002259615799517572, 'bull_atr_max_pct': 0.024036460553082267, 'bull_tp_mult': 1.0496372820335753, 'bull_tsl_mult': 0.5813656976656204, 'bull_time_stop': 278, 'bull_use_sma': True, 'bull_use_ema': False, 'bull_use_atr': True, 'bull_use_adx': False, 'bull_use_spike': True, 'bull_rsi_required': False, 'bear_strategy': 'breakout', 'bear_bb_std_mult': 3.393520747401997, 'bear_rsi_os': 45, 'bear_rsi_ob': 86, 'bear_adx_thresh': 33.06662082147082, 'bear_atr_min_pct': 0.016923900844285945, 'bear_atr_max_pct': 0.060044603129048774, 'bear_tp_mult': 2.30798907085222, 'bear_tsl_mult': 0.26622538810593577, 'bear_time_stop': 43, 'bear_use_sma': True, 'bear_use_ema': False, 'bear_use_atr': False, 'bear_use_adx': False, 'bear_use_spike': False, 'bear_rsi_required': True, 'sideways_strategy': 'breakout', 'sideways_bb_std_mult': 2.4995766937882147, 'sideways_rsi_os': 33, 'sideways_rsi_ob': 62, 'sideways_adx_thresh': 30.422234816913004, 'sideways_atr_min_pct': 0.02181592760112749, 'sideways_atr_max_pct': 0.12430078393815071, 'sideways_tp_mult': 2.0133044493185412, 'sideways_tsl_mult': 0.47475499356656264, 'sideways_time_stop': 137, 'sideways_use_sma': True, 'sideways_use_ema': True, 'sideways_use_atr': False, 'sideways_use_adx': False, 'sideways_use_spike': False, 'sideways_rsi_required': False}.
[I 2025-08-30 18:51:30,509] Trial 127 finished with values: [-1000000000.0, 1000000000.0] and parameters: {'p_sma': 51, 'p_std': 24, 'p_atr': 28, 'p_adx': 9, 'rsi_period': 54, 'ema1': 24, 'ema2': 56, 'slip_atr_k': 0.007353975604021897, 'slip_spread_k': 0.4593815710067047, 'spread_hl_frac': 0.018474003692287234, 'bb_std_mult': 1.8697215132839, 'rsi_os': 37, 'rsi_ob': 63, 'vol_spike': 0.02993528909983912, 'adx_thresh': 17.625137392038884, 'atr_min_pct': 0.006782236612530575, 'atr_max_pct': 0.13594530664782542, 'tp_mult': 2.0360263977973587, 'tsl_mult': 0.626481789294764, 'strategy': 'breakout', 'time_stop': 38, 'use_sma': False, 'use_atr': True, 'use_adx': True, 'use_ema': True, 'use_spike': False, 'rsi_required': False, 'edge_k': 1.2028745256115427, 'edge_cap': 0.16268900610261083, 'bull_strategy': 'mean_reversion', 'bull_bb_std_mult': 1.7901202303024186, 'bull_rsi_os': 53, 'bull_rsi_ob': 73, 'bull_adx_thresh': 29.619147399355313, 'bull_atr_min_pct': 0.02544456383738035, 'bull_atr_max_pct': 0.021502753015575676, 'bull_tp_mult': 1.1295476616966793, 'bull_tsl_mult': 0.9225517244893887, 'bull_time_stop': 180, 'bull_use_sma': False, 'bull_use_ema': True, 'bull_use_atr': False, 'bull_use_adx': True, 'bull_use_spike': True, 'bull_rsi_required': True, 'bear_strategy': 'breakout', 'bear_bb_std_mult': 1.343048367408755, 'bear_rsi_os': 19, 'bear_rsi_ob': 80, 'bear_adx_thresh': 11.978376328462645, 'bear_atr_min_pct': 0.01577479664835095, 'bear_atr_max_pct': 0.1257587297610031, 'bear_tp_mult': 1.846096960080829, 'bear_tsl_mult': 0.0009797774278956228, 'bear_time_stop': 36, 'bear_use_sma': True, 'bear_use_ema': False, 'bear_use_atr': True, 'bear_use_adx': True, 'bear_use_spike': True, 'bear_rsi_required': False, 'sideways_strategy': 'mean_reversion', 'sideways_bb_std_mult': 1.6709642677940426, 'sideways_rsi_os': 42, 'sideways_rsi_ob': 57, 'sideways_adx_thresh': 22.261791364825037, 'sideways_atr_min_pct': 0.017864251569275548, 'sideways_atr_max_pct': 0.060641445683060534, 'sideways_tp_mult': 1.6629527487838327, 'sideways_tsl_mult': 0.7174046266879756, 'sideways_time_stop': 245, 'sideways_use_sma': True, 'sideways_use_ema': False, 'sideways_use_atr': False, 'sideways_use_adx': True, 'sideways_use_spike': True, 'sideways_rsi_required': False}.
[I 2025-08-30 18:51:30,977] Trial 124 finished with values: [-1000000000.0, 1000000000.0] and parameters: {'p_sma': 46, 'p_std': 15, 'p_atr': 29, 'p_adx': 9, 'rsi_period': 7, 'ema1': 23, 'ema2': 21, 'slip_atr_k': 0.13951207790045972, 'slip_spread_k': 0.45049316420284174, 'spread_hl_frac': 0.04020411196699285, 'bb_std_mult': 0.8925161069357707, 'rsi_os': 37, 'rsi_ob': 63, 'vol_spike': 0.01709949918746828, 'adx_thresh': 30.520017577611156, 'atr_min_pct': 0.012372670833889847, 'atr_max_pct': 0.13999603586133144, 'tp_mult': 2.0455672512844485, 'tsl_mult': 0.7623886941372054, 'strategy': 'breakout', 'time_stop': 201, 'use_sma': False, 'use_atr': True, 'use_adx': False, 'use_ema': True, 'use_spike': True, 'rsi_required': True, 'edge_k': 0.18252991765586826, 'edge_cap': 0.16056257087212228, 'bull_strategy': 'mean_reversion', 'bull_bb_std_mult': 1.6537425518986533, 'bull_rsi_os': 54, 'bull_rsi_ob': 73, 'bull_adx_thresh': 16.049363693147995, 'bull_atr_min_pct': 0.015319142964064957, 'bull_atr_max_pct': 0.028775256197718216, 'bull_tp_mult': 2.31147156014213, 'bull_tsl_mult': 0.06812075472863177, 'bull_time_stop': 287, 'bull_use_sma': True, 'bull_use_ema': False, 'bull_use_atr': True, 'bull_use_adx': True, 'bull_use_spike': True, 'bull_rsi_required': True, 'bear_strategy': 'breakout', 'bear_bb_std_mult': 3.389234211073748, 'bear_rsi_os': 19, 'bear_rsi_ob': 53, 'bear_adx_thresh': 5.70912461013894, 'bear_atr_min_pct': 0.01552144036671722, 'bear_atr_max_pct': 0.12481238219349114, 'bear_tp_mult': 1.1665543332504809, 'bear_tsl_mult': 0.11176373870925047, 'bear_time_stop': 32, 'bear_use_sma': True, 'bear_use_ema': False, 'bear_use_atr': True, 'bear_use_adx': True, 'bear_use_spike': False, 'bear_rsi_required': True, 'sideways_strategy': 'breakout', 'sideways_bb_std_mult': 2.3201517061195163, 'sideways_rsi_os': 48, 'sideways_rsi_ob': 57, 'sideways_adx_thresh': 32.895361275203285, 'sideways_atr_min_pct': 0.02202510758165913, 'sideways_atr_max_pct': 0.12349798176428826, 'sideways_tp_mult': 1.6748470050232374, 'sideways_tsl_mult': 0.7128038146851051, 'sideways_time_stop': 145, 'sideways_use_sma': True, 'sideways_use_ema': True, 'sideways_use_atr': False, 'sideways_use_adx': False, 'sideways_use_spike': False, 'sideways_rsi_required': False}.
