[I 2025-08-30 20:15:29,020] Trial 744 finished with values: [-1000000000.0, 1000000000.0] and parameters: {'p_sma': 45, 'p_std': 27, 'p_atr': 11, 'p_adx': 27, 'rsi_period': 66, 'ema1': 25, 'ema2': 14, 'slip_atr_k': 0.10240408436103587, 'slip_spread_k': 0.41823375729251433, 'spread_hl_frac': 0.007587083083381282, 'bb_std_mult': 2.2782748870474805, 'rsi_os': 6, 'rsi_ob': 59, 'vol_spike': 0.033182432784403304, 'adx_thresh': 17.85701466762148, 'atr_min_pct': 0.0019415126860387426, 'atr_max_pct': 0.13226271269130752, 'tp_mult': 1.840423263709761, 'tsl_mult': 0.7330380158707374, 'strategy': 'breakout', 'time_stop': 203, 'use_sma': False, 'use_atr': False, 'use_adx': True, 'use_ema': False, 'use_spike': True, 'rsi_required': True, 'edge_k': 0.1262195977770031, 'edge_cap': 0.2940007980740057, 'bull_strategy': 'breakout', 'bull_bb_std_mult': 1.784919388721901, 'bull_rsi_os': 51, 'bull_rsi_ob': 92, 'bull_adx_thresh': 22.677263893074837, 'bull_atr_min_pct': 0.021194296991890075, 'bull_atr_max_pct': 0.027009930440770862, 'bull_tp_mult': 1.7127847802665854, 'bull_tsl_mult': 0.9694767083260798, 'bull_time_stop': 277, 'bull_use_sma': False, 'bull_use_ema': True, 'bull_use_atr': False, 'bull_use_adx': True, 'bull_use_spike': False, 'bull_rsi_required': True, 'bear_strategy': 'mean_reversion', 'bear_bb_std_mult': 2.298528937441072, 'bear_rsi_os': 46, 'bear_rsi_ob': 62, 'bear_adx_thresh': 24.660026341154392, 'bear_atr_min_pct': 0.015503276526351627, 'bear_atr_max_pct': 0.05332048485444855, 'bear_tp_mult': 2.5719660278317553, 'bear_tsl_mult': 0.13426159105432428, 'bear_time_stop': 30, 'bear_use_sma': False, 'bear_use_ema': False, 'bear_use_atr': False, 'bear_use_adx': False, 'bear_use_spike': True, 'bear_rsi_required': False, 'sideways_strategy': 'mean_reversion', 'sideways_bb_std_mult': 2.1885609874739513, 'sideways_rsi_os': 18, 'sideways_rsi_ob': 60, 'sideways_adx_thresh': 10.293103090617786, 'sideways_atr_min_pct': 0.01953085506555243, 'sideways_atr_max_pct': 0.11869202902892793, 'sideways_tp_mult': 1.288545469094347, 'sideways_tsl_mult': 0.43689304337420054, 'sideways_time_stop': 276, 'sideways_use_sma': False, 'sideways_use_ema': False, 'sideways_use_atr': False, 'sideways_use_adx': True, 'sideways_use_spike': True, 'sideways_rsi_required': True}.
[I 2025-08-30 20:16:03,365] Trial 748 finished with values: [-1000000000.0, 1000000000.0] and parameters: {'p_sma': 37, 'p_std': 27, 'p_atr': 23, 'p_adx': 27, 'rsi_period': 55, 'ema1': 23, 'ema2': 43, 'slip_atr_k': 0.10455405367953005, 'slip_spread_k': 0.9666235799058325, 'spread_hl_frac': 0.012031038105711649, 'bb_std_mult': 3.4724486311165137, 'rsi_os': 38, 'rsi_ob': 90, 'vol_spike': 0.18156607871664687, 'adx_thresh': 18.91284054425765, 'atr_min_pct': 0.021799398282335746, 'atr_max_pct': 0.1396831524606362, 'tp_mult': 2.1007661931000676, 'tsl_mult': 0.7049082010196894, 'strategy': 'breakout', 'time_stop': 38, 'use_sma': False, 'use_atr': True, 'use_adx': True, 'use_ema': True, 'use_spike': False, 'rsi_required': True, 'edge_k': 0.3432134392101879, 'edge_cap': 0.3340661645296742, 'bull_strategy': 'breakout', 'bull_bb_std_mult': 0.5157311923413961, 'bull_rsi_os': 48, 'bull_rsi_ob': 65, 'bull_adx_thresh': 31.993275559006907, 'bull_atr_min_pct': 0.0030652702022510303, 'bull_atr_max_pct': 0.026796979177965318, 'bull_tp_mult': 1.7513282647758017, 'bull_tsl_mult': 0.0007495190858215484, 'bull_time_stop': 5, 'bull_use_sma': True, 'bull_use_ema': False, 'bull_use_atr': True, 'bull_use_adx': False, 'bull_use_spike': True, 'bull_rsi_required': False, 'bear_strategy': 'mean_reversion', 'bear_bb_std_mult': 3.552782288014247, 'bear_rsi_os': 42, 'bear_rsi_ob': 62, 'bear_adx_thresh': 7.166112767978281, 'bear_atr_min_pct': 0.02644816206308053, 'bear_atr_max_pct': 0.057971028679182135, 'bear_tp_mult': 1.8784386132906294, 'bear_tsl_mult': 0.13853695128592122, 'bear_time_stop': 285, 'bear_use_sma': True, 'bear_use_ema': True, 'bear_use_atr': True, 'bear_use_adx': True, 'bear_use_spike': True, 'bear_rsi_required': False, 'sideways_strategy': 'breakout', 'sideways_bb_std_mult': 1.0331558584944585, 'sideways_rsi_os': 19, 'sideways_rsi_ob': 59, 'sideways_adx_thresh': 9.319578201874267, 'sideways_atr_min_pct': 0.028454872827494638, 'sideways_atr_max_pct': 0.11696336685189324, 'sideways_tp_mult': 1.8356501370977207, 'sideways_tsl_mult': 0.8492533006604347, 'sideways_time_stop': 24, 'sideways_use_sma': True, 'sideways_use_ema': True, 'sideways_use_atr': True, 'sideways_use_adx': False, 'sideways_use_spike': False, 'sideways_rsi_required': False}.
[I 2025-08-30 20:16:03,366] Trial 750 finished with values: [-1000000000.0, 1000000000.0] and parameters: {'p_sma': 50, 'p_std': 28, 'p_atr': 9, 'p_adx': 27, 'rsi_period': 55, 'ema1': 22, 'ema2': 19, 'slip_atr_k': 0.008540835458171523, 'slip_spread_k': 0.38797764788583644, 'spread_hl_frac': 0.00944361726169993, 'bb_std_mult': 1.2333737253202512, 'rsi_os': 38, 'rsi_ob': 47, 'vol_spike': 0.21252473321622067, 'adx_thresh': 19.676639599295957, 'atr_min_pct': 0.00280512550743953, 'atr_max_pct': 0.1391668235759903, 'tp_mult': 2.0850363286767273, 'tsl_mult': 0.9795470818606737, 'strategy': 'breakout', 'time_stop': 40, 'use_sma': False, 'use_atr': True, 'use_adx': False, 'use_ema': True, 'use_spike': False, 'rsi_required': False, 'edge_k': 0.5561888675479555, 'edge_cap': 0.7110104585928559, 'bull_strategy': 'breakout', 'bull_bb_std_mult': 2.0206223773858176, 'bull_rsi_os': 55, 'bull_rsi_ob': 69, 'bull_adx_thresh': 25.857322897993516, 'bull_atr_min_pct': 0.0021338912312059534, 'bull_atr_max_pct': 0.11328816795921437, 'bull_tp_mult': 2.278672736605354, 'bull_tsl_mult': 0.7434936187630203, 'bull_time_stop': 155, 'bull_use_sma': True, 'bull_use_ema': False, 'bull_use_atr': True, 'bull_use_adx': False, 'bull_use_spike': True, 'bull_rsi_required': False, 'bear_strategy': 'breakout', 'bear_bb_std_mult': 3.1990416501992742, 'bear_rsi_os': 42, 'bear_rsi_ob': 82, 'bear_adx_thresh': 7.550869759017641, 'bear_atr_min_pct': 0.010783947265247323, 'bear_atr_max_pct': 0.014227316017845978, 'bear_tp_mult': 1.7009609698450097, 'bear_tsl_mult': 0.6620013103071966, 'bear_time_stop': 118, 'bear_use_sma': True, 'bear_use_ema': True, 'bear_use_atr': True, 'bear_use_adx': True, 'bear_use_spike': True, 'bear_rsi_required': False, 'sideways_strategy': 'breakout', 'sideways_bb_std_mult': 1.9900492070812539, 'sideways_rsi_os': 39, 'sideways_rsi_ob': 76, 'sideways_adx_thresh': 21.74619758960057, 'sideways_atr_min_pct': 0.021306367856569586, 'sideways_atr_max_pct': 0.019100731020585307, 'sideways_tp_mult': 2.924929981559887, 'sideways_tsl_mult': 0.6969939084070739, 'sideways_time_stop': 10, 'sideways_use_sma': True, 'sideways_use_ema': True, 'sideways_use_atr': True, 'sideways_use_adx': False, 'sideways_use_spike': False, 'sideways_rsi_required': False}.
[I 2025-08-30 20:16:03,827] Trial 749 finished with values: [-1000000000.0, 1000000000.0] and parameters: {'p_sma': 37, 'p_std': 19, 'p_atr': 9, 'p_adx': 7, 'rsi_period': 51, 'ema1': 17, 'ema2': 52, 'slip_atr_k': 0.015512955025176849, 'slip_spread_k': 0.38491734857150417, 'spread_hl_frac': 0.014607840833493518, 'bb_std_mult': 0.9159616292787638, 'rsi_os': 38, 'rsi_ob': 58, 'vol_spike': 0.14203883701848607, 'adx_thresh': 11.174996218661999, 'atr_min_pct': 0.001872180066619867, 'atr_max_pct': 0.13954586198336308, 'tp_mult': 2.089601127868145, 'tsl_mult': 0.9757610400758627, 'strategy': 'breakout', 'time_stop': 39, 'use_sma': False, 'use_atr': True, 'use_adx': True, 'use_ema': True, 'use_spike': False, 'rsi_required': True, 'edge_k': 0.0032278990943463842, 'edge_cap': 0.22135939692692078, 'bull_strategy': 'breakout', 'bull_bb_std_mult': 2.0008177391889483, 'bull_rsi_os': 28, 'bull_rsi_ob': 49, 'bull_adx_thresh': 34.989128497930714, 'bull_atr_min_pct': 0.0023744038233252415, 'bull_atr_max_pct': 0.02970700566075987, 'bull_tp_mult': 2.271067928833335, 'bull_tsl_mult': 0.6949878439255481, 'bull_time_stop': 156, 'bull_use_sma': True, 'bull_use_ema': False, 'bull_use_atr': True, 'bull_use_adx': False, 'bull_use_spike': True, 'bull_rsi_required': False, 'bear_strategy': 'mean_reversion', 'bear_bb_std_mult': 1.8189234316618919, 'bear_rsi_os': 42, 'bear_rsi_ob': 84, 'bear_adx_thresh': 7.769339992120869, 'bear_atr_min_pct': 0.013279777951922095, 'bear_atr_max_pct': 0.05755035208127555, 'bear_tp_mult': 1.683022064390036, 'bear_tsl_mult': 0.13458879771576165, 'bear_time_stop': 36, 'bear_use_sma': True, 'bear_use_ema': True, 'bear_use_atr': True, 'bear_use_adx': True, 'bear_use_spike': True, 'bear_rsi_required': False, 'sideways_strategy': 'breakout', 'sideways_bb_std_mult': 1.5326968761373407, 'sideways_rsi_os': 19, 'sideways_rsi_ob': 59, 'sideways_adx_thresh': 9.507101125880602, 'sideways_atr_min_pct': 0.009060749989458387, 'sideways_atr_max_pct': 0.018199587670497078, 'sideways_tp_mult': 1.5382024497615174, 'sideways_tsl_mult': 0.21889239194765825, 'sideways_time_stop': 158, 'sideways_use_sma': True, 'sideways_use_ema': True, 'sideways_use_atr': True, 'sideways_use_adx': False, 'sideways_use_spike': False, 'sideways_rsi_required': False}.
[I 2025-08-30 20:16:04,020] Trial 751 finished with values: [-1000000000.0, 1000000000.0] and parameters: {'p_sma': 51, 'p_std': 5, 'p_atr': 22, 'p_adx': 28, 'rsi_period': 55, 'ema1': 22, 'ema2': 10, 'slip_atr_k': 0.007261736718755633, 'slip_spread_k': 0.3876404479177842, 'spread_hl_frac': 0.003064735062019163, 'bb_std_mult': 3.148628079608347, 'rsi_os': 38, 'rsi_ob': 93, 'vol_spike': 0.043534818804759526, 'adx_thresh': 19.56467671440425, 'atr_min_pct': 0.02496468071337096, 'atr_max_pct': 0.13984892172624927, 'tp_mult': 2.1032151621621673, 'tsl_mult': 0.37421056716852613, 'strategy': 'breakout', 'time_stop': 39, 'use_sma': False, 'use_atr': True, 'use_adx': False, 'use_ema': True, 'use_spike': False, 'rsi_required': False, 'edge_k': 1.9990455276200338, 'edge_cap': 0.7194724689939396, 'bull_strategy': 'mean_reversion', 'bull_bb_std_mult': 0.5641394612080473, 'bull_rsi_os': 49, 'bull_rsi_ob': 49, 'bull_adx_thresh': 25.848224262584743, 'bull_atr_min_pct': 0.004497324848553568, 'bull_atr_max_pct': 0.03064366851121608, 'bull_tp_mult': 2.276870008426747, 'bull_tsl_mult': 0.7034190448345358, 'bull_time_stop': 156, 'bull_use_sma': True, 'bull_use_ema': False, 'bull_use_atr': True, 'bull_use_adx': False, 'bull_use_spike': True, 'bull_rsi_required': False, 'bear_strategy': 'breakout', 'bear_bb_std_mult': 3.2016771039368352, 'bear_rsi_os': 44, 'bear_rsi_ob': 82, 'bear_adx_thresh': 7.663468979018674, 'bear_atr_min_pct': 0.013581869864381469, 'bear_atr_max_pct': 0.058027210363011845, 'bear_tp_mult': 1.8833250990108101, 'bear_tsl_mult': 0.09278762600289278, 'bear_time_stop': 284, 'bear_use_sma': True, 'bear_use_ema': True, 'bear_use_atr': True, 'bear_use_adx': True, 'bear_use_spike': False, 'bear_rsi_required': False, 'sideways_strategy': 'breakout', 'sideways_bb_std_mult': 1.986451129574949, 'sideways_rsi_os': 19, 'sideways_rsi_ob': 85, 'sideways_adx_thresh': 8.17945595249544, 'sideways_atr_min_pct': 0.02230489180049507, 'sideways_atr_max_pct': 0.06562939267424656, 'sideways_tp_mult': 1.8325758428554817, 'sideways_tsl_mult': 0.9744908211425081, 'sideways_time_stop': 265, 'sideways_use_sma': True, 'sideways_use_ema': True, 'sideways_use_atr': True, 'sideways_use_adx': False, 'sideways_use_spike': False, 'sideways_rsi_required': False}.
[I 2025-08-30 20:16:39,404] Trial 752 finished with values: [-1000000000.0, 1000000000.0] and parameters: {'p_sma': 34, 'p_std': 24, 'p_atr': 10, 'p_adx': 25, 'rsi_period': 11, 'ema1': 9, 'ema2': 18, 'slip_atr_k': 0.19038175241892058, 'slip_spread_k': 0.027156207179474923, 'spread_hl_frac': 0.003118703093507097, 'bb_std_mult': 0.5674485311689286, 'rsi_os': 35, 'rsi_ob': 56, 'vol_spike': 0.043543631106861685, 'adx_thresh': 6.954021102975716, 'atr_min_pct': 0.02431433146567269, 'atr_max_pct': 0.13491853788754313, 'tp_mult': 2.173775719341596, 'tsl_mult': 0.6549130616014989, 'strategy': 'breakout', 'time_stop': 44, 'use_sma': False, 'use_atr': True, 'use_adx': False, 'use_ema': False, 'use_spike': True, 'rsi_required': True, 'edge_k': 1.3259295923155792, 'edge_cap': 0.07937598469861579, 'bull_strategy': 'mean_reversion', 'bull_bb_std_mult': 1.4841649917564288, 'bull_rsi_os': 49, 'bull_rsi_ob': 74, 'bull_adx_thresh': 12.380964835328331, 'bull_atr_min_pct': 0.004081151566622036, 'bull_atr_max_pct': 0.07351676130384503, 'bull_tp_mult': 2.140606948055663, 'bull_tsl_mult': 0.9998670792312914, 'bull_time_stop': 190, 'bull_use_sma': True, 'bull_use_ema': False, 'bull_use_atr': False, 'bull_use_adx': True, 'bull_use_spike': True, 'bull_rsi_required': True, 'bear_strategy': 'breakout', 'bear_bb_std_mult': 3.248847728751641, 'bear_rsi_os': 44, 'bear_rsi_ob': 84, 'bear_adx_thresh': 27.87153025048964, 'bear_atr_min_pct': 0.013408588878341213, 'bear_atr_max_pct': 0.04930059039580013, 'bear_tp_mult': 1.798222402100348, 'bear_tsl_mult': 0.10840998384692033, 'bear_time_stop': 37, 'bear_use_sma': True, 'bear_use_ema': False, 'bear_use_atr': True, 'bear_use_adx': True, 'bear_use_spike': False, 'bear_rsi_required': True, 'sideways_strategy': 'breakout', 'sideways_bb_std_mult': 1.7810940883625361, 'sideways_rsi_os': 16, 'sideways_rsi_ob': 64, 'sideways_adx_thresh': 32.78712841616105, 'sideways_atr_min_pct': 0.009091467260692702, 'sideways_atr_max_pct': 0.1235534769419402, 'sideways_tp_mult': 1.8873566705754405, 'sideways_tsl_mult': 0.23153669240567115, 'sideways_time_stop': 292, 'sideways_use_sma': True, 'sideways_use_ema': True, 'sideways_use_atr': False, 'sideways_use_adx': False, 'sideways_use_spike': False, 'sideways_rsi_required': False}.
[I 2025-08-30 20:16:39,521] Trial 755 finished with values: [-1000000000.0, 1000000000.0] and parameters: {'p_sma': 54, 'p_std': 46, 'p_atr': 25, 'p_adx': 16, 'rsi_period': 33, 'ema1': 24, 'ema2': 18, 'slip_atr_k': 0.01976497014910811, 'slip_spread_k': 0.03363851044040056, 'spread_hl_frac': 0.0027917977360834637, 'bb_std_mult': 2.5114452078472542, 'rsi_os': 35, 'rsi_ob': 56, 'vol_spike': 0.10668425710356537, 'adx_thresh': 20.68966516854083, 'atr_min_pct': 0.024178613627417866, 'atr_max_pct': 0.1261352056269888, 'tp_mult': 2.1715699280732914, 'tsl_mult': 0.6741980664985676, 'strategy': 'mean_reversion', 'time_stop': 271, 'use_sma': False, 'use_atr': False, 'use_adx': False, 'use_ema': False, 'use_spike': True, 'rsi_required': True, 'edge_k': 1.5999884199682253, 'edge_cap': 0.08723373134428103, 'bull_strategy': 'mean_reversion', 'bull_bb_std_mult': 1.174991944090766, 'bull_rsi_os': 46, 'bull_rsi_ob': 78, 'bull_adx_thresh': 24.197335577495934, 'bull_atr_min_pct': 0.022637193715599194, 'bull_atr_max_pct': 0.02059616958103517, 'bull_tp_mult': 1.9219795835040754, 'bull_tsl_mult': 0.9992968390325714, 'bull_time_stop': 194, 'bull_use_sma': True, 'bull_use_ema': True, 'bull_use_atr': False, 'bull_use_adx': True, 'bull_use_spike': False, 'bull_rsi_required': True, 'bear_strategy': 'breakout', 'bear_bb_std_mult': 3.2601487510748273, 'bear_rsi_os': 55, 'bear_rsi_ob': 83, 'bear_adx_thresh': 27.793745308222533, 'bear_atr_min_pct': 0.016343776863140917, 'bear_atr_max_pct': 0.04891126034668388, 'bear_tp_mult': 1.6440788662459809, 'bear_tsl_mult': 0.11507059744852904, 'bear_time_stop': 8, 'bear_use_sma': False, 'bear_use_ema': False, 'bear_use_atr': False, 'bear_use_adx': False, 'bear_use_spike': False, 'bear_rsi_required': True, 'sideways_strategy': 'breakout', 'sideways_bb_std_mult': 2.0526921535552445, 'sideways_rsi_os': 16, 'sideways_rsi_ob': 58, 'sideways_adx_thresh': 9.650387304261113, 'sideways_atr_min_pct': 0.029778462572187636, 'sideways_atr_max_pct': 0.0688369351808767, 'sideways_tp_mult': 2.413651690088519, 'sideways_tsl_mult': 0.7143772914279118, 'sideways_time_stop': 273, 'sideways_use_sma': True, 'sideways_use_ema': True, 'sideways_use_atr': False, 'sideways_use_adx': False, 'sideways_use_spike': False, 'sideways_rsi_required': False}.
[I 2025-08-30 20:16:39,844] Trial 753 finished with values: [-1000000000.0, 1000000000.0] and parameters: {'p_sma': 12, 'p_std': 19, 'p_atr': 10, 'p_adx': 25, 'rsi_period': 51, 'ema1': 9, 'ema2': 33, 'slip_atr_k': 0.018179618547158216, 'slip_spread_k': 0.7517872738503435, 'spread_hl_frac': 6.092227568295361e-05, 'bb_std_mult': 0.9683658130320629, 'rsi_os': 34, 'rsi_ob': 56, 'vol_spike': 0.14167121154102072, 'adx_thresh': 6.68354261772909, 'atr_min_pct': 0.025067760312813676, 'atr_max_pct': 0.14538168620852987, 'tp_mult': 2.180661323722835, 'tsl_mult': 0.6597260879528382, 'strategy': 'breakout', 'time_stop': 46, 'use_sma': False, 'use_atr': True, 'use_adx': False, 'use_ema': False, 'use_spike': True, 'rsi_required': True, 'edge_k': 0.05887325410237994, 'edge_cap': 0.22084542373676155, 'bull_strategy': 'mean_reversion', 'bull_bb_std_mult': 1.8746138982649432, 'bull_rsi_os': 34, 'bull_rsi_ob': 74, 'bull_adx_thresh': 24.622556374655254, 'bull_atr_min_pct': 0.012218806967444578, 'bull_atr_max_pct': 0.031033377270082152, 'bull_tp_mult': 1.681096843659452, 'bull_tsl_mult': 0.6981476556323274, 'bull_time_stop': 191, 'bull_use_sma': True, 'bull_use_ema': False, 'bull_use_atr': False, 'bull_use_adx': True, 'bull_use_spike': True, 'bull_rsi_required': True, 'bear_strategy': 'breakout', 'bear_bb_std_mult': 1.238773006752325, 'bear_rsi_os': 44, 'bear_rsi_ob': 84, 'bear_adx_thresh': 28.012729450324464, 'bear_atr_min_pct': 0.013514072504471553, 'bear_atr_max_pct': 0.07956272745257179, 'bear_tp_mult': 1.6495375994300026, 'bear_tsl_mult': 0.11115701683818562, 'bear_time_stop': 175, 'bear_use_sma': True, 'bear_use_ema': False, 'bear_use_atr': True, 'bear_use_adx': True, 'bear_use_spike': False, 'bear_rsi_required': True, 'sideways_strategy': 'breakout', 'sideways_bb_std_mult': 3.13674643807548, 'sideways_rsi_os': 16, 'sideways_rsi_ob': 58, 'sideways_adx_thresh': 8.166541058898575, 'sideways_atr_min_pct': 0.008935789880168452, 'sideways_atr_max_pct': 0.06562345842749238, 'sideways_tp_mult': 2.6687501878930875, 'sideways_tsl_mult': 0.65078856177877, 'sideways_time_stop': 189, 'sideways_use_sma': True, 'sideways_use_ema': True, 'sideways_use_atr': False, 'sideways_use_adx': False, 'sideways_use_spike': False, 'sideways_rsi_required': False}.
[I 2025-08-30 20:16:40,030] Trial 754 finished with values: [-1000000000.0, 1000000000.0] and parameters: {'p_sma': 12, 'p_std': 23, 'p_atr': 10, 'p_adx': 25, 'rsi_period': 33, 'ema1': 24, 'ema2': 10, 'slip_atr_k': 0.19181096375556306, 'slip_spread_k': 0.046807566778446885, 'spread_hl_frac': 0.03532663428397789, 'bb_std_mult': 3.146696510412238, 'rsi_os': 35, 'rsi_ob': 61, 'vol_spike': 0.04519518578115827, 'adx_thresh': 17.384684066634634, 'atr_min_pct': 0.02472521601412502, 'atr_max_pct': 0.1464452925560355, 'tp_mult': 2.177932506480454, 'tsl_mult': 0.6641574196454727, 'strategy': 'mean_reversion', 'time_stop': 180, 'use_sma': False, 'use_atr': True, 'use_adx': False, 'use_ema': False, 'use_spike': True, 'rsi_required': False, 'edge_k': 0.055260248967863496, 'edge_cap': 0.08426941344287192, 'bull_strategy': 'mean_reversion', 'bull_bb_std_mult': 1.1813633983039928, 'bull_rsi_os': 49, 'bull_rsi_ob': 74, 'bull_adx_thresh': 24.244592300772627, 'bull_atr_min_pct': 0.004158279926618012, 'bull_atr_max_pct': 0.020783874479739773, 'bull_tp_mult': 2.150422766942321, 'bull_tsl_mult': 0.9990484203397901, 'bull_time_stop': 218, 'bull_use_sma': True, 'bull_use_ema': False, 'bull_use_atr': False, 'bull_use_adx': True, 'bull_use_spike': True, 'bull_rsi_required': True, 'bear_strategy': 'breakout', 'bear_bb_std_mult': 1.247842392604074, 'bear_rsi_os': 14, 'bear_rsi_ob': 88, 'bear_adx_thresh': 16.8971459404402, 'bear_atr_min_pct': 0.016555476761262587, 'bear_atr_max_pct': 0.04959536512916773, 'bear_tp_mult': 1.8111071765480267, 'bear_tsl_mult': 0.09217021919865193, 'bear_time_stop': 178, 'bear_use_sma': True, 'bear_use_ema': False, 'bear_use_atr': True, 'bear_use_adx': True, 'bear_use_spike': False, 'bear_rsi_required': True, 'sideways_strategy': 'breakout', 'sideways_bb_std_mult': 3.1245658368833764, 'sideways_rsi_os': 16, 'sideways_rsi_ob': 64, 'sideways_adx_thresh': 8.186935609866543, 'sideways_atr_min_pct': 0.029971030093393275, 'sideways_atr_max_pct': 0.12446717082332304, 'sideways_tp_mult': 1.8840130077315849, 'sideways_tsl_mult': 0.5075166164162844, 'sideways_time_stop': 188, 'sideways_use_sma': True, 'sideways_use_ema': True, 'sideways_use_atr': False, 'sideways_use_adx': False, 'sideways_use_spike': False, 'sideways_rsi_required': False}.
