[I 2025-08-30 19:47:18,246] Trial 540 finished with values: [-1000000000.0, 1000000000.0] and parameters: {'p_sma': 43, 'p_std': 26, 'p_atr': 9, 'p_adx': 7, 'rsi_period': 52, 'ema1': 13, 'ema2': 21, 'slip_atr_k': 0.166546359692194, 'slip_spread_k': 0.4726897763701593, 'spread_hl_frac': 0.0011742866644310185, 'bb_std_mult': 1.2219829419793178, 'rsi_os': 38, 'rsi_ob': 74, 'vol_spike': 0.1596063649022017, 'adx_thresh': 21.360219689523177, 'atr_min_pct': 0.024755332388628187, 'atr_max_pct': 0.13358176516403403, 'tp_mult': 2.2508204130458362, 'tsl_mult': 0.7506141666811299, 'strategy': 'breakout', 'time_stop': 41, 'use_sma': True, 'use_atr': True, 'use_adx': False, 'use_ema': False, 'use_spike': True, 'rsi_required': True, 'edge_k': 0.1349849687914628, 'edge_cap': 0.8205332020768176, 'bull_strategy': 'mean_reversion', 'bull_bb_std_mult': 1.9168322476890518, 'bull_rsi_os': 20, 'bull_rsi_ob': 85, 'bull_adx_thresh': 24.60719844235277, 'bull_atr_min_pct': 0.011320641103913157, 'bull_atr_max_pct': 0.026196244385344025, 'bull_tp_mult': 2.175783316381129, 'bull_tsl_mult': 0.5995616127792149, 'bull_time_stop': 188, 'bull_use_sma': True, 'bull_use_ema': False, 'bull_use_atr': False, 'bull_use_adx': True, 'bull_use_spike': True, 'bull_rsi_required': True, 'bear_strategy': 'breakout', 'bear_bb_std_mult': 3.079053941609445, 'bear_rsi_os': 15, 'bear_rsi_ob': 83, 'bear_adx_thresh': 23.890181090016313, 'bear_atr_min_pct': 0.015422384795440683, 'bear_atr_max_pct': 0.06186803349369632, 'bear_tp_mult': 1.1088849612865366, 'bear_tsl_mult': 0.8497535033403303, 'bear_time_stop': 48, 'bear_use_sma': True, 'bear_use_ema': True, 'bear_use_atr': False, 'bear_use_adx': False, 'bear_use_spike': False, 'bear_rsi_required': False, 'sideways_strategy': 'mean_reversion', 'sideways_bb_std_mult': 2.035218574768602, 'sideways_rsi_os': 42, 'sideways_rsi_ob': 60, 'sideways_adx_thresh': 10.46843535151717, 'sideways_atr_min_pct': 0.0028790635740404812, 'sideways_atr_max_pct': 0.06489085594700199, 'sideways_tp_mult': 2.2803963255918784, 'sideways_tsl_mult': 0.34001960350901916, 'sideways_time_stop': 41, 'sideways_use_sma': True, 'sideways_use_ema': True, 'sideways_use_atr': True, 'sideways_use_adx': False, 'sideways_use_spike': False, 'sideways_rsi_required': False}.
[I 2025-08-30 19:47:18,424] Trial 541 finished with values: [-0.018226720923753548, 0.01815803749401016] and parameters: {'p_sma': 45, 'p_std': 26, 'p_atr': 9, 'p_adx': 23, 'rsi_period': 53, 'ema1': 22, 'ema2': 18, 'slip_atr_k': 0.00018909380566213552, 'slip_spread_k': 0.37237705603737353, 'spread_hl_frac': 0.0005149932275862051, 'bb_std_mult': 0.9934020238702941, 'rsi_os': 9, 'rsi_ob': 62, 'vol_spike': 0.03817498029517051, 'adx_thresh': 9.50504308147234, 'atr_min_pct': 0.020737749783404077, 'atr_max_pct': 0.13484732006599856, 'tp_mult': 1.3594706470585773, 'tsl_mult': 0.17621267181052575, 'strategy': 'breakout', 'time_stop': 202, 'use_sma': True, 'use_atr': True, 'use_adx': False, 'use_ema': False, 'use_spike': True, 'rsi_required': True, 'edge_k': 1.238366481406773, 'edge_cap': 0.1995831042456816, 'bull_strategy': 'mean_reversion', 'bull_bb_std_mult': 1.4673650692714972, 'bull_rsi_os': 52, 'bull_rsi_ob': 48, 'bull_adx_thresh': 6.69721614492833, 'bull_atr_min_pct': 0.0021534980355721973, 'bull_atr_max_pct': 0.0787523324354107, 'bull_tp_mult': 2.083182169095483, 'bull_tsl_mult': 0.4255572067074905, 'bull_time_stop': 243, 'bull_use_sma': True, 'bull_use_ema': False, 'bull_use_atr': False, 'bull_use_adx': True, 'bull_use_spike': True, 'bull_rsi_required': True, 'bear_strategy': 'breakout', 'bear_bb_std_mult': 3.081165670826959, 'bear_rsi_os': 27, 'bear_rsi_ob': 83, 'bear_adx_thresh': 25.712762173819772, 'bear_atr_min_pct': 0.015207910822796674, 'bear_atr_max_pct': 0.06152745932213725, 'bear_tp_mult': 1.6531426255177275, 'bear_tsl_mult': 0.3514864946431685, 'bear_time_stop': 175, 'bear_use_sma': True, 'bear_use_ema': False, 'bear_use_atr': False, 'bear_use_adx': False, 'bear_use_spike': False, 'bear_rsi_required': False, 'sideways_strategy': 'mean_reversion', 'sideways_bb_std_mult': 2.034510043291331, 'sideways_rsi_os': 16, 'sideways_rsi_ob': 52, 'sideways_adx_thresh': 9.032040453813698, 'sideways_atr_min_pct': 0.019454789334700157, 'sideways_atr_max_pct': 0.12095616610957927, 'sideways_tp_mult': 2.453022206469108, 'sideways_tsl_mult': 0.11345210976417319, 'sideways_time_stop': 262, 'sideways_use_sma': True, 'sideways_use_ema': True, 'sideways_use_atr': True, 'sideways_use_adx': False, 'sideways_use_spike': False, 'sideways_rsi_required': False}.
[I 2025-08-30 19:47:19,673] Trial 543 finished with values: [-1000000000.0, 1000000000.0] and parameters: {'p_sma': 14, 'p_std': 49, 'p_atr': 16, 'p_adx': 7, 'rsi_period': 17, 'ema1': 25, 'ema2': 18, 'slip_atr_k': 0.018986796934281104, 'slip_spread_k': 0.47555085993477764, 'spread_hl_frac': 0.04216867526760132, 'bb_std_mult': 0.7990670402094262, 'rsi_os': 10, 'rsi_ob': 56, 'vol_spike': 0.19437026537428082, 'adx_thresh': 21.515424881609764, 'atr_min_pct': 0.023467632414269843, 'atr_max_pct': 0.1346984014366756, 'tp_mult': 2.1112678297521206, 'tsl_mult': 0.8720068477872636, 'strategy': 'breakout', 'time_stop': 200, 'use_sma': False, 'use_atr': True, 'use_adx': False, 'use_ema': True, 'use_spike': False, 'rsi_required': True, 'edge_k': 0.09609293052851563, 'edge_cap': 0.2016398047794185, 'bull_strategy': 'mean_reversion', 'bull_bb_std_mult': 1.7962480323855377, 'bull_rsi_os': 50, 'bull_rsi_ob': 57, 'bull_adx_thresh': 24.624130772242417, 'bull_atr_min_pct': 0.003957734465584332, 'bull_atr_max_pct': 0.017177570013685077, 'bull_tp_mult': 2.2300059737061657, 'bull_tsl_mult': 0.4001021528615718, 'bull_time_stop': 16, 'bull_use_sma': True, 'bull_use_ema': False, 'bull_use_atr': True, 'bull_use_adx': False, 'bull_use_spike': True, 'bull_rsi_required': True, 'bear_strategy': 'breakout', 'bear_bb_std_mult': 3.3889279684959854, 'bear_rsi_os': 10, 'bear_rsi_ob': 78, 'bear_adx_thresh': 15.491117000691778, 'bear_atr_min_pct': 0.0020550805346918923, 'bear_atr_max_pct': 0.04829282868686117, 'bear_tp_mult': 1.7698059068304064, 'bear_tsl_mult': 0.17063092207760622, 'bear_time_stop': 74, 'bear_use_sma': True, 'bear_use_ema': False, 'bear_use_atr': True, 'bear_use_adx': True, 'bear_use_spike': False, 'bear_rsi_required': True, 'sideways_strategy': 'breakout', 'sideways_bb_std_mult': 2.0268767914599404, 'sideways_rsi_os': 29, 'sideways_rsi_ob': 59, 'sideways_adx_thresh': 9.123816769431219, 'sideways_atr_min_pct': 0.019660087991133238, 'sideways_atr_max_pct': 0.1263664961752733, 'sideways_tp_mult': 1.0396491136953583, 'sideways_tsl_mult': 0.7435172435144448, 'sideways_time_stop': 273, 'sideways_use_sma': True, 'sideways_use_ema': True, 'sideways_use_atr': True, 'sideways_use_adx': False, 'sideways_use_spike': False, 'sideways_rsi_required': False}.
[I 2025-08-30 19:47:19,745] Trial 542 finished with values: [-1000000000.0, 1000000000.0] and parameters: {'p_sma': 41, 'p_std': 26, 'p_atr': 10, 'p_adx': 7, 'rsi_period': 53, 'ema1': 11, 'ema2': 17, 'slip_atr_k': 0.16777812465484318, 'slip_spread_k': 0.48542722362313007, 'spread_hl_frac': 0.04827547904846873, 'bb_std_mult': 3.1311557729849815, 'rsi_os': 38, 'rsi_ob': 68, 'vol_spike': 0.16003993537036035, 'adx_thresh': 19.544792857220724, 'atr_min_pct': 0.023446728295079492, 'atr_max_pct': 0.13508506780090881, 'tp_mult': 2.0911034231391183, 'tsl_mult': 0.7429863801711273, 'strategy': 'breakout', 'time_stop': 197, 'use_sma': True, 'use_atr': True, 'use_adx': False, 'use_ema': False, 'use_spike': True, 'rsi_required': True, 'edge_k': 1.2163416381339753, 'edge_cap': 0.20089177718750817, 'bull_strategy': 'mean_reversion', 'bull_bb_std_mult': 1.8149663285853685, 'bull_rsi_os': 32, 'bull_rsi_ob': 65, 'bull_adx_thresh': 6.684963376121598, 'bull_atr_min_pct': 0.003933580431429777, 'bull_atr_max_pct': 0.029262420073748956, 'bull_tp_mult': 2.0811742757875145, 'bull_tsl_mult': 0.9534844497957593, 'bull_time_stop': 190, 'bull_use_sma': True, 'bull_use_ema': False, 'bull_use_atr': False, 'bull_use_adx': True, 'bull_use_spike': True, 'bull_rsi_required': True, 'bear_strategy': 'breakout', 'bear_bb_std_mult': 3.327895202843082, 'bear_rsi_os': 46, 'bear_rsi_ob': 78, 'bear_adx_thresh': 30.587385423782283, 'bear_atr_min_pct': 0.013118258253440781, 'bear_atr_max_pct': 0.06648144888300979, 'bear_tp_mult': 1.8232389942962246, 'bear_tsl_mult': 0.8509721666630564, 'bear_time_stop': 48, 'bear_use_sma': True, 'bear_use_ema': False, 'bear_use_atr': False, 'bear_use_adx': False, 'bear_use_spike': False, 'bear_rsi_required': False, 'sideways_strategy': 'mean_reversion', 'sideways_bb_std_mult': 1.1898959979694244, 'sideways_rsi_os': 16, 'sideways_rsi_ob': 79, 'sideways_adx_thresh': 8.853955033313346, 'sideways_atr_min_pct': 0.012404595973212971, 'sideways_atr_max_pct': 0.12153215495519197, 'sideways_tp_mult': 1.0544514430079643, 'sideways_tsl_mult': 0.7284108146259599, 'sideways_time_stop': 270, 'sideways_use_sma': True, 'sideways_use_ema': True, 'sideways_use_atr': False, 'sideways_use_adx': False, 'sideways_use_spike': False, 'sideways_rsi_required': False}.
[I 2025-08-30 19:47:53,844] Trial 545 finished with values: [-0.07845342298124547, 0.07831372809915049] and parameters: {'p_sma': 41, 'p_std': 26, 'p_atr': 12, 'p_adx': 8, 'rsi_period': 28, 'ema1': 24, 'ema2': 18, 'slip_atr_k': 0.1773611942018177, 'slip_spread_k': 0.40860985480839757, 'spread_hl_frac': 0.04852051015968521, 'bb_std_mult': 1.0058315774037545, 'rsi_os': 47, 'rsi_ob': 56, 'vol_spike': 0.039155483970070584, 'adx_thresh': 19.628632331565747, 'atr_min_pct': 0.02085695151186422, 'atr_max_pct': 0.13011029390094658, 'tp_mult': 2.6252160330723493, 'tsl_mult': 0.863408319440008, 'strategy': 'breakout', 'time_stop': 262, 'use_sma': False, 'use_atr': False, 'use_adx': False, 'use_ema': True, 'use_spike': False, 'rsi_required': False, 'edge_k': 0.08872008258753243, 'edge_cap': 0.7864291842733055, 'bull_strategy': 'breakout', 'bull_bb_std_mult': 2.3272264903273876, 'bull_rsi_os': 50, 'bull_rsi_ob': 87, 'bull_adx_thresh': 26.632794994920683, 'bull_atr_min_pct': 0.004138580826722277, 'bull_atr_max_pct': 0.017528639260130163, 'bull_tp_mult': 2.2221678251116233, 'bull_tsl_mult': 0.7978076319230587, 'bull_time_stop': 79, 'bull_use_sma': True, 'bull_use_ema': True, 'bull_use_atr': True, 'bull_use_adx': False, 'bull_use_spike': True, 'bull_rsi_required': True, 'bear_strategy': 'breakout', 'bear_bb_std_mult': 3.328231558619631, 'bear_rsi_os': 42, 'bear_rsi_ob': 66, 'bear_adx_thresh': 8.927446136849616, 'bear_atr_min_pct': 0.0018252958606618398, 'bear_atr_max_pct': 0.04663476661409336, 'bear_tp_mult': 2.6026639241431537, 'bear_tsl_mult': 0.3535478379210062, 'bear_time_stop': 39, 'bear_use_sma': True, 'bear_use_ema': False, 'bear_use_atr': True, 'bear_use_adx': True, 'bear_use_spike': False, 'bear_rsi_required': True, 'sideways_strategy': 'breakout', 'sideways_bb_std_mult': 2.0662515762996554, 'sideways_rsi_os': 16, 'sideways_rsi_ob': 59, 'sideways_adx_thresh': 9.097881339226005, 'sideways_atr_min_pct': 0.012477984213357924, 'sideways_atr_max_pct': 0.05738640481637461, 'sideways_tp_mult': 1.63730862785426, 'sideways_tsl_mult': 0.5318546899680419, 'sideways_time_stop': 273, 'sideways_use_sma': False, 'sideways_use_ema': True, 'sideways_use_atr': False, 'sideways_use_adx': False, 'sideways_use_spike': False, 'sideways_rsi_required': True}.
[I 2025-08-30 19:47:54,169] Trial 546 finished with values: [-1000000000.0, 1000000000.0] and parameters: {'p_sma': 40, 'p_std': 29, 'p_atr': 7, 'p_adx': 8, 'rsi_period': 54, 'ema1': 24, 'ema2': 18, 'slip_atr_k': 0.1782783083140746, 'slip_spread_k': 0.40772722849340237, 'spread_hl_frac': 0.04850442627907035, 'bb_std_mult': 0.9100543435307137, 'rsi_os': 47, 'rsi_ob': 58, 'vol_spike': 0.03263106088327191, 'adx_thresh': 9.561969434943688, 'atr_min_pct': 0.02158338428039943, 'atr_max_pct': 0.12948425013813017, 'tp_mult': 1.978471185944723, 'tsl_mult': 0.6842890738806771, 'strategy': 'breakout', 'time_stop': 151, 'use_sma': False, 'use_atr': False, 'use_adx': False, 'use_ema': False, 'use_spike': True, 'rsi_required': False, 'edge_k': 1.215423909718702, 'edge_cap': 0.23583943716610925, 'bull_strategy': 'breakout', 'bull_bb_std_mult': 2.334971802805359, 'bull_rsi_os': 32, 'bull_rsi_ob': 73, 'bull_adx_thresh': 26.57399803065965, 'bull_atr_min_pct': 0.0021500763856738114, 'bull_atr_max_pct': 0.030341449211953572, 'bull_tp_mult': 2.0085634313550873, 'bull_tsl_mult': 0.5239432740344007, 'bull_time_stop': 227, 'bull_use_sma': True, 'bull_use_ema': True, 'bull_use_atr': True, 'bull_use_adx': True, 'bull_use_spike': True, 'bull_rsi_required': True, 'bear_strategy': 'breakout', 'bear_bb_std_mult': 3.32342596304633, 'bear_rsi_os': 46, 'bear_rsi_ob': 66, 'bear_adx_thresh': 30.398458487920834, 'bear_atr_min_pct': 0.013148715952613306, 'bear_atr_max_pct': 0.08301296312654298, 'bear_tp_mult': 1.811109705349828, 'bear_tsl_mult': 0.19481430111916953, 'bear_time_stop': 91, 'bear_use_sma': True, 'bear_use_ema': False, 'bear_use_atr': True, 'bear_use_adx': True, 'bear_use_spike': False, 'bear_rsi_required': False, 'sideways_strategy': 'breakout', 'sideways_bb_std_mult': 1.9504541274138216, 'sideways_rsi_os': 16, 'sideways_rsi_ob': 58, 'sideways_adx_thresh': 8.788530919716207, 'sideways_atr_min_pct': 0.010345819652461626, 'sideways_atr_max_pct': 0.12069910071196978, 'sideways_tp_mult': 1.2743008952181145, 'sideways_tsl_mult': 0.7122986506546678, 'sideways_time_stop': 268, 'sideways_use_sma': False, 'sideways_use_ema': True, 'sideways_use_atr': False, 'sideways_use_adx': False, 'sideways_use_spike': False, 'sideways_rsi_required': True}.
[I 2025-08-30 19:47:54,339] Trial 544 finished with values: [-0.012690569859152512, 0.01322741374063251] and parameters: {'p_sma': 47, 'p_std': 39, 'p_atr': 10, 'p_adx': 20, 'rsi_period': 54, 'ema1': 24, 'ema2': 18, 'slip_atr_k': 0.02061587460498851, 'slip_spread_k': 0.38465999197266604, 'spread_hl_frac': 0.004448947311175266, 'bb_std_mult': 0.9965723310027654, 'rsi_os': 47, 'rsi_ob': 56, 'vol_spike': 0.02585212787869954, 'adx_thresh': 19.741860828882086, 'atr_min_pct': 0.020725909681150533, 'atr_max_pct': 0.1302772479649368, 'tp_mult': 2.6149876917383907, 'tsl_mult': 0.17913645867423328, 'strategy': 'breakout', 'time_stop': 24, 'use_sma': False, 'use_atr': True, 'use_adx': False, 'use_ema': True, 'use_spike': False, 'rsi_required': False, 'edge_k': 0.08949099765658898, 'edge_cap': 0.23834729915799016, 'bull_strategy': 'mean_reversion', 'bull_bb_std_mult': 1.7749634259666411, 'bull_rsi_os': 11, 'bull_rsi_ob': 57, 'bull_adx_thresh': 16.221921481638006, 'bull_atr_min_pct': 0.0021628722504536766, 'bull_atr_max_pct': 0.08757201332711985, 'bull_tp_mult': 2.2204044080728687, 'bull_tsl_mult': 0.9137531907191652, 'bull_time_stop': 228, 'bull_use_sma': True, 'bull_use_ema': False, 'bull_use_atr': True, 'bull_use_adx': False, 'bull_use_spike': True, 'bull_rsi_required': True, 'bear_strategy': 'breakout', 'bear_bb_std_mult': 3.3729192120510954, 'bear_rsi_os': 46, 'bear_rsi_ob': 66, 'bear_adx_thresh': 13.114617905000049, 'bear_atr_min_pct': 0.013197683817022644, 'bear_atr_max_pct': 0.08329223485467357, 'bear_tp_mult': 1.5648465287136757, 'bear_tsl_mult': 0.32859233955016387, 'bear_time_stop': 89, 'bear_use_sma': True, 'bear_use_ema': False, 'bear_use_atr': True, 'bear_use_adx': True, 'bear_use_spike': False, 'bear_rsi_required': True, 'sideways_strategy': 'breakout', 'sideways_bb_std_mult': 2.025072297903468, 'sideways_rsi_os': 36, 'sideways_rsi_ob': 59, 'sideways_adx_thresh': 8.906428931147376, 'sideways_atr_min_pct': 0.01843655539255665, 'sideways_atr_max_pct': 0.12743479294271237, 'sideways_tp_mult': 2.4661982135877234, 'sideways_tsl_mult': 0.7266882315582524, 'sideways_time_stop': 155, 'sideways_use_sma': True, 'sideways_use_ema': True, 'sideways_use_atr': False, 'sideways_use_adx': False, 'sideways_use_spike': False, 'sideways_rsi_required': False}.
[I 2025-08-30 19:47:54,353] Trial 547 finished with values: [-1000000000.0, 1000000000.0] and parameters: {'p_sma': 40, 'p_std': 16, 'p_atr': 8, 'p_adx': 19, 'rsi_period': 28, 'ema1': 17, 'ema2': 15, 'slip_atr_k': 0.17741626538233243, 'slip_spread_k': 0.4064505298666663, 'spread_hl_frac': 0.0045057134311148744, 'bb_std_mult': 1.3175768875605676, 'rsi_os': 24, 'rsi_ob': 62, 'vol_spike': 0.0331623324152745, 'adx_thresh': 18.524975473842165, 'atr_min_pct': 0.024424023841318126, 'atr_max_pct': 0.12984844426763928, 'tp_mult': 2.9705934348987997, 'tsl_mult': 0.6878498611135516, 'strategy': 'breakout', 'time_stop': 261, 'use_sma': False, 'use_atr': False, 'use_adx': False, 'use_ema': True, 'use_spike': False, 'rsi_required': False, 'edge_k': 0.1505283872126543, 'edge_cap': 0.2453909836568637, 'bull_strategy': 'breakout', 'bull_bb_std_mult': 2.3495515182386475, 'bull_rsi_os': 52, 'bull_rsi_ob': 72, 'bull_adx_thresh': 16.166582149307374, 'bull_atr_min_pct': 0.02486506092848393, 'bull_atr_max_pct': 0.1425576868355735, 'bull_tp_mult': 1.9303338726671666, 'bull_tsl_mult': 0.9207798972807414, 'bull_time_stop': 202, 'bull_use_sma': True, 'bull_use_ema': True, 'bull_use_atr': True, 'bull_use_adx': False, 'bull_use_spike': True, 'bull_rsi_required': True, 'bear_strategy': 'breakout', 'bear_bb_std_mult': 3.1713204595039564, 'bear_rsi_os': 53, 'bear_rsi_ob': 46, 'bear_adx_thresh': 13.276164217784597, 'bear_atr_min_pct': 0.01401568274539714, 'bear_atr_max_pct': 0.09262618351312739, 'bear_tp_mult': 1.7173929706485906, 'bear_tsl_mult': 0.35782823584425716, 'bear_time_stop': 139, 'bear_use_sma': True, 'bear_use_ema': False, 'bear_use_atr': True, 'bear_use_adx': True, 'bear_use_spike': False, 'bear_rsi_required': True, 'sideways_strategy': 'breakout', 'sideways_bb_std_mult': 1.935979951334905, 'sideways_rsi_os': 44, 'sideways_rsi_ob': 84, 'sideways_adx_thresh': 9.730769567846696, 'sideways_atr_min_pct': 0.01857137653108734, 'sideways_atr_max_pct': 0.11768584178927914, 'sideways_tp_mult': 1.6432420297361972, 'sideways_tsl_mult': 0.7116131631566049, 'sideways_time_stop': 283, 'sideways_use_sma': False, 'sideways_use_ema': True, 'sideways_use_atr': False, 'sideways_use_adx': False, 'sideways_use_spike': False, 'sideways_rsi_required': True}.
[I 2025-08-30 19:48:27,964] Trial 551 finished with values: [-0.023632144176839898, 0.02355659947895144] and parameters: {'p_sma': 38, 'p_std': 24, 'p_atr': 11, 'p_adx': 8, 'rsi_period': 59, 'ema1': 26, 'ema2': 24, 'slip_atr_k': 0.10902931265827007, 'slip_spread_k': 0.4263338975903603, 'spread_hl_frac': 0.0022905352887526193, 'bb_std_mult': 3.5442104620331034, 'rsi_os': 39, 'rsi_ob': 70, 'vol_spike': 0.045762538544317166, 'adx_thresh': 19.268089133549672, 'atr_min_pct': 0.023539352298596977, 'atr_max_pct': 0.1407923139188545, 'tp_mult': 2.8423634611202693, 'tsl_mult': 0.7029012302845264, 'strategy': 'breakout', 'time_stop': 34, 'use_sma': False, 'use_atr': True, 'use_adx': True, 'use_ema': False, 'use_spike': True, 'rsi_required': True, 'edge_k': 1.3998786400632306, 'edge_cap': 0.9769682490403506, 'bull_strategy': 'mean_reversion', 'bull_bb_std_mult': 1.4841605579919506, 'bull_rsi_os': 52, 'bull_rsi_ob': 74, 'bull_adx_thresh': 20.728211909317032, 'bull_atr_min_pct': 0.0021021357945173705, 'bull_atr_max_pct': 0.06244582870616705, 'bull_tp_mult': 2.163274432506663, 'bull_tsl_mult': 0.26409331183072604, 'bull_time_stop': 176, 'bull_use_sma': True, 'bull_use_ema': False, 'bull_use_atr': False, 'bull_use_adx': True, 'bull_use_spike': True, 'bull_rsi_required': False, 'bear_strategy': 'breakout', 'bear_bb_std_mult': 2.622435816695231, 'bear_rsi_os': 49, 'bear_rsi_ob': 87, 'bear_adx_thresh': 28.00847985598875, 'bear_atr_min_pct': 0.019502750696009263, 'bear_atr_max_pct': 0.055556788435284214, 'bear_tp_mult': 2.1471561094293836, 'bear_tsl_mult': 0.7579964796102596, 'bear_time_stop': 29, 'bear_use_sma': False, 'bear_use_ema': False, 'bear_use_atr': True, 'bear_use_adx': True, 'bear_use_spike': False, 'bear_rsi_required': False, 'sideways_strategy': 'breakout', 'sideways_bb_std_mult': 1.4477586878158708, 'sideways_rsi_os': 15, 'sideways_rsi_ob': 92, 'sideways_adx_thresh': 9.715734199508713, 'sideways_atr_min_pct': 0.019560468772847412, 'sideways_atr_max_pct': 0.10314284912388738, 'sideways_tp_mult': 1.9379636412264092, 'sideways_tsl_mult': 0.17234438188310897, 'sideways_time_stop': 290, 'sideways_use_sma': True, 'sideways_use_ema': False, 'sideways_use_atr': True, 'sideways_use_adx': False, 'sideways_use_spike': True, 'sideways_rsi_required': False}.
