[I 2025-08-30 19:18:32,927] Trial 332 finished with values: [-1000000000.0, 1000000000.0] and parameters: {'p_sma': 34, 'p_std': 28, 'p_atr': 17, 'p_adx': 20, 'rsi_period': 82, 'ema1': 13, 'ema2': 39, 'slip_atr_k': 0.21658379359611002, 'slip_spread_k': 0.516531725467007, 'spread_hl_frac': 0.004001084241974332, 'bb_std_mult': 1.0916195122830106, 'rsi_os': 35, 'rsi_ob': 56, 'vol_spike': 0.06750968981043803, 'adx_thresh': 18.183308810748642, 'atr_min_pct': 0.02310004026922531, 'atr_max_pct': 0.14004187673237198, 'tp_mult': 2.2023401262230258, 'tsl_mult': 0.8026367462015955, 'strategy': 'mean_reversion', 'time_stop': 39, 'use_sma': True, 'use_atr': False, 'use_adx': False, 'use_ema': False, 'use_spike': True, 'rsi_required': False, 'edge_k': 0.5790265603404672, 'edge_cap': 0.8654382091056831, 'bull_strategy': 'mean_reversion', 'bull_bb_std_mult': 1.345734934699268, 'bull_rsi_os': 51, 'bull_rsi_ob': 70, 'bull_adx_thresh': 17.063076561397637, 'bull_atr_min_pct': 0.0018100753514263533, 'bull_atr_max_pct': 0.01695820819708052, 'bull_tp_mult': 1.999883804365871, 'bull_tsl_mult': 0.1940058159597548, 'bull_time_stop': 197, 'bull_use_sma': False, 'bull_use_ema': False, 'bull_use_atr': True, 'bull_use_adx': False, 'bull_use_spike': False, 'bull_rsi_required': True, 'bear_strategy': 'mean_reversion', 'bear_bb_std_mult': 3.2241988021120904, 'bear_rsi_os': 46, 'bear_rsi_ob': 86, 'bear_adx_thresh': 16.258924898998966, 'bear_atr_min_pct': 0.012576532073846307, 'bear_atr_max_pct': 0.05628081003924891, 'bear_tp_mult': 2.683920836276115, 'bear_tsl_mult': 0.13126377658002059, 'bear_time_stop': 38, 'bear_use_sma': True, 'bear_use_ema': True, 'bear_use_atr': False, 'bear_use_adx': False, 'bear_use_spike': False, 'bear_rsi_required': True, 'sideways_strategy': 'mean_reversion', 'sideways_bb_std_mult': 1.6291251076174693, 'sideways_rsi_os': 32, 'sideways_rsi_ob': 77, 'sideways_adx_thresh': 12.910176005337968, 'sideways_atr_min_pct': 0.01972945014376199, 'sideways_atr_max_pct': 0.11776728036501286, 'sideways_tp_mult': 1.8100259218773058, 'sideways_tsl_mult': 0.22645668184541784, 'sideways_time_stop': 281, 'sideways_use_sma': True, 'sideways_use_ema': True, 'sideways_use_atr': True, 'sideways_use_adx': True, 'sideways_use_spike': False, 'sideways_rsi_required': False}.
[I 2025-08-30 19:18:33,584] Trial 337 finished with values: [-1000000000.0, 1000000000.0] and parameters: {'p_sma': 44, 'p_std': 54, 'p_atr': 9, 'p_adx': 8, 'rsi_period': 54, 'ema1': 10, 'ema2': 16, 'slip_atr_k': 0.17214020281812703, 'slip_spread_k': 0.6768747063451278, 'spread_hl_frac': 0.004648102196592363, 'bb_std_mult': 0.9531985181820309, 'rsi_os': 18, 'rsi_ob': 57, 'vol_spike': 0.04378727865778256, 'adx_thresh': 12.258996402781223, 'atr_min_pct': 0.016798944661508317, 'atr_max_pct': 0.013785497427453802, 'tp_mult': 2.304967154946768, 'tsl_mult': 0.7202860005647408, 'strategy': 'breakout', 'time_stop': 141, 'use_sma': False, 'use_atr': True, 'use_adx': True, 'use_ema': False, 'use_spike': False, 'rsi_required': True, 'edge_k': 1.8360372411594048, 'edge_cap': 0.22399477173998197, 'bull_strategy': 'breakout', 'bull_bb_std_mult': 1.8090178216827886, 'bull_rsi_os': 55, 'bull_rsi_ob': 74, 'bull_adx_thresh': 22.15207738789847, 'bull_atr_min_pct': 0.0029974859658726295, 'bull_atr_max_pct': 0.07677352292199054, 'bull_tp_mult': 2.470882412253933, 'bull_tsl_mult': 0.852051385126701, 'bull_time_stop': 54, 'bull_use_sma': True, 'bull_use_ema': False, 'bull_use_atr': False, 'bull_use_adx': True, 'bull_use_spike': True, 'bull_rsi_required': False, 'bear_strategy': 'breakout', 'bear_bb_std_mult': 3.2841444969455718, 'bear_rsi_os': 44, 'bear_rsi_ob': 84, 'bear_adx_thresh': 6.788296391982156, 'bear_atr_min_pct': 0.0164586307177004, 'bear_atr_max_pct': 0.05162897439003968, 'bear_tp_mult': 1.012928792186909, 'bear_tsl_mult': 0.07970601460855704, 'bear_time_stop': 219, 'bear_use_sma': True, 'bear_use_ema': False, 'bear_use_atr': True, 'bear_use_adx': True, 'bear_use_spike': False, 'bear_rsi_required': False, 'sideways_strategy': 'breakout', 'sideways_bb_std_mult': 2.0157708452245733, 'sideways_rsi_os': 8, 'sideways_rsi_ob': 59, 'sideways_adx_thresh': 7.613446508088146, 'sideways_atr_min_pct': 0.028605186029667377, 'sideways_atr_max_pct': 0.046912674320655746, 'sideways_tp_mult': 1.7915336707156, 'sideways_tsl_mult': 0.7198943415556234, 'sideways_time_stop': 139, 'sideways_use_sma': True, 'sideways_use_ema': True, 'sideways_use_atr': False, 'sideways_use_adx': False, 'sideways_use_spike': False, 'sideways_rsi_required': False}.
[I 2025-08-30 19:19:05,241] Trial 335 finished with values: [-1000000000.0, 1000000000.0] and parameters: {'p_sma': 18, 'p_std': 8, 'p_atr': 15, 'p_adx': 8, 'rsi_period': 66, 'ema1': 25, 'ema2': 16, 'slip_atr_k': 0.13335329499870172, 'slip_spread_k': 0.1285222130356805, 'spread_hl_frac': 0.0039847224833656015, 'bb_std_mult': 1.0756167724899088, 'rsi_os': 10, 'rsi_ob': 57, 'vol_spike': 0.03376698936944003, 'adx_thresh': 7.678509599371109, 'atr_min_pct': 0.023187292857849966, 'atr_max_pct': 0.083360006225379, 'tp_mult': 2.750264265868246, 'tsl_mult': 0.3262389677568394, 'strategy': 'mean_reversion', 'time_stop': 38, 'use_sma': True, 'use_atr': False, 'use_adx': False, 'use_ema': False, 'use_spike': True, 'rsi_required': False, 'edge_k': 1.8379753001971195, 'edge_cap': 0.7712060992412465, 'bull_strategy': 'mean_reversion', 'bull_bb_std_mult': 0.5730250362866771, 'bull_rsi_os': 10, 'bull_rsi_ob': 92, 'bull_adx_thresh': 22.022717170931593, 'bull_atr_min_pct': 0.018771054789381233, 'bull_atr_max_pct': 0.058845315650593144, 'bull_tp_mult': 1.997864882857115, 'bull_tsl_mult': 0.6542846532158488, 'bull_time_stop': 196, 'bull_use_sma': False, 'bull_use_ema': False, 'bull_use_atr': False, 'bull_use_adx': False, 'bull_use_spike': False, 'bull_rsi_required': False, 'bear_strategy': 'mean_reversion', 'bear_bb_std_mult': 3.236498269606597, 'bear_rsi_os': 46, 'bear_rsi_ob': 83, 'bear_adx_thresh': 6.80921687415136, 'bear_atr_min_pct': 0.019134131912661324, 'bear_atr_max_pct': 0.059914969999167705, 'bear_tp_mult': 1.7598707839227414, 'bear_tsl_mult': 0.13509045612470216, 'bear_time_stop': 33, 'bear_use_sma': True, 'bear_use_ema': False, 'bear_use_atr': False, 'bear_use_adx': False, 'bear_use_spike': False, 'bear_rsi_required': True, 'sideways_strategy': 'mean_reversion', 'sideways_bb_std_mult': 3.5958803031124797, 'sideways_rsi_os': 9, 'sideways_rsi_ob': 59, 'sideways_adx_thresh': 7.626764449927494, 'sideways_atr_min_pct': 0.019045607831273674, 'sideways_atr_max_pct': 0.019688068768302577, 'sideways_tp_mult': 1.8103226783868915, 'sideways_tsl_mult': 0.7225719133836797, 'sideways_time_stop': 160, 'sideways_use_sma': True, 'sideways_use_ema': True, 'sideways_use_atr': True, 'sideways_use_adx': True, 'sideways_use_spike': False, 'sideways_rsi_required': False}.
[I 2025-08-30 19:19:06,413] Trial 334 finished with values: [-1000000000.0, 1000000000.0] and parameters: {'p_sma': 40, 'p_std': 26, 'p_atr': 27, 'p_adx': 8, 'rsi_period': 66, 'ema1': 29, 'ema2': 16, 'slip_atr_k': 0.13207349362355145, 'slip_spread_k': 0.7772440732543786, 'spread_hl_frac': 0.006417710998881606, 'bb_std_mult': 1.425294607002043, 'rsi_os': 18, 'rsi_ob': 80, 'vol_spike': 0.25875392295654304, 'adx_thresh': 10.76217049935093, 'atr_min_pct': 0.023101595497473107, 'atr_max_pct': 0.03471460933759509, 'tp_mult': 2.7604362707797865, 'tsl_mult': 0.3266809899606641, 'strategy': 'breakout', 'time_stop': 38, 'use_sma': True, 'use_atr': False, 'use_adx': False, 'use_ema': False, 'use_spike': True, 'rsi_required': True, 'edge_k': 0.028480893271736876, 'edge_cap': 0.22156178808710697, 'bull_strategy': 'mean_reversion', 'bull_bb_std_mult': 0.5936019222209281, 'bull_rsi_os': 39, 'bull_rsi_ob': 70, 'bull_adx_thresh': 17.07775246910076, 'bull_atr_min_pct': 0.013063970108259168, 'bull_atr_max_pct': 0.08789905221353221, 'bull_tp_mult': 2.0439926025559583, 'bull_tsl_mult': 0.9435815793436797, 'bull_time_stop': 210, 'bull_use_sma': False, 'bull_use_ema': False, 'bull_use_atr': True, 'bull_use_adx': False, 'bull_use_spike': True, 'bull_rsi_required': True, 'bear_strategy': 'mean_reversion', 'bear_bb_std_mult': 2.599231882025245, 'bear_rsi_os': 7, 'bear_rsi_ob': 86, 'bear_adx_thresh': 6.72933594174402, 'bear_atr_min_pct': 0.013035799778815214, 'bear_atr_max_pct': 0.05733340716158887, 'bear_tp_mult': 1.2620208466490408, 'bear_tsl_mult': 0.6785291807208632, 'bear_time_stop': 265, 'bear_use_sma': True, 'bear_use_ema': True, 'bear_use_atr': False, 'bear_use_adx': False, 'bear_use_spike': False, 'bear_rsi_required': True, 'sideways_strategy': 'mean_reversion', 'sideways_bb_std_mult': 3.4299604143219247, 'sideways_rsi_os': 32, 'sideways_rsi_ob': 74, 'sideways_adx_thresh': 7.769908739825706, 'sideways_atr_min_pct': 0.028360723478322494, 'sideways_atr_max_pct': 0.11938969841294118, 'sideways_tp_mult': 1.7989671511191752, 'sideways_tsl_mult': 0.7115953197364179, 'sideways_time_stop': 231, 'sideways_use_sma': True, 'sideways_use_ema': True, 'sideways_use_atr': True, 'sideways_use_adx': True, 'sideways_use_spike': False, 'sideways_rsi_required': False}.
[I 2025-08-30 19:19:06,634] Trial 336 finished with values: [-1000000000.0, 1000000000.0] and parameters: {'p_sma': 44, 'p_std': 28, 'p_atr': 17, 'p_adx': 8, 'rsi_period': 54, 'ema1': 24, 'ema2': 57, 'slip_atr_k': 0.02628952658979119, 'slip_spread_k': 0.684072682705271, 'spread_hl_frac': 0.04458367486547057, 'bb_std_mult': 2.6921503203253767, 'rsi_os': 38, 'rsi_ob': 80, 'vol_spike': 0.03405208459282896, 'adx_thresh': 8.089669515003406, 'atr_min_pct': 0.01621324574211007, 'atr_max_pct': 0.13359492127152342, 'tp_mult': 2.542831119270446, 'tsl_mult': 0.6660899716020461, 'strategy': 'breakout', 'time_stop': 92, 'use_sma': True, 'use_atr': False, 'use_adx': True, 'use_ema': False, 'use_spike': False, 'rsi_required': True, 'edge_k': 1.0559825688878657, 'edge_cap': 0.6994265173640482, 'bull_strategy': 'breakout', 'bull_bb_std_mult': 1.7882357530572968, 'bull_rsi_os': 15, 'bull_rsi_ob': 74, 'bull_adx_thresh': 17.245635232953436, 'bull_atr_min_pct': 0.009918482904063707, 'bull_atr_max_pct': 0.021298826490876503, 'bull_tp_mult': 1.9905434113101876, 'bull_tsl_mult': 0.944657973278846, 'bull_time_stop': 209, 'bull_use_sma': False, 'bull_use_ema': False, 'bull_use_atr': False, 'bull_use_adx': False, 'bull_use_spike': True, 'bull_rsi_required': False, 'bear_strategy': 'mean_reversion', 'bear_bb_std_mult': 3.2452179910939933, 'bear_rsi_os': 43, 'bear_rsi_ob': 83, 'bear_adx_thresh': 11.067192761369183, 'bear_atr_min_pct': 0.018981464162714522, 'bear_atr_max_pct': 0.0834399423571276, 'bear_tp_mult': 1.7582015424950825, 'bear_tsl_mult': 0.07395624459994832, 'bear_time_stop': 40, 'bear_use_sma': True, 'bear_use_ema': False, 'bear_use_atr': False, 'bear_use_adx': False, 'bear_use_spike': False, 'bear_rsi_required': True, 'sideways_strategy': 'breakout', 'sideways_bb_std_mult': 2.74163672902977, 'sideways_rsi_os': 14, 'sideways_rsi_ob': 59, 'sideways_adx_thresh': 9.53187888937292, 'sideways_atr_min_pct': 0.001298172966295405, 'sideways_atr_max_pct': 0.11908681539077902, 'sideways_tp_mult': 2.279772576354895, 'sideways_tsl_mult': 0.7154570060842974, 'sideways_time_stop': 159, 'sideways_use_sma': True, 'sideways_use_ema': True, 'sideways_use_atr': True, 'sideways_use_adx': True, 'sideways_use_spike': False, 'sideways_rsi_required': False}.
[I 2025-08-30 19:19:07,733] Trial 338 finished with values: [-1000000000.0, 1000000000.0] and parameters: {'p_sma': 18, 'p_std': 26, 'p_atr': 30, 'p_adx': 8, 'rsi_period': 67, 'ema1': 5, 'ema2': 19, 'slip_atr_k': 0.13153982942843215, 'slip_spread_k': 0.29654267431552556, 'spread_hl_frac': 0.006114752802191757, 'bb_std_mult': 0.9630470098690491, 'rsi_os': 38, 'rsi_ob': 90, 'vol_spike': 0.03160008377022682, 'adx_thresh': 7.742887504789049, 'atr_min_pct': 0.011547928023662526, 'atr_max_pct': 0.08403671134683337, 'tp_mult': 2.7630560012935, 'tsl_mult': 0.6662067886722318, 'strategy': 'breakout', 'time_stop': 23, 'use_sma': False, 'use_atr': True, 'use_adx': False, 'use_ema': True, 'use_spike': True, 'rsi_required': True, 'edge_k': 0.024112275166671693, 'edge_cap': 0.7046843941186706, 'bull_strategy': 'mean_reversion', 'bull_bb_std_mult': 1.9293581227448569, 'bull_rsi_os': 50, 'bull_rsi_ob': 71, 'bull_adx_thresh': 25.457125463558775, 'bull_atr_min_pct': 0.004103198011854412, 'bull_atr_max_pct': 0.11925119521453226, 'bull_tp_mult': 2.18115590336027, 'bull_tsl_mult': 0.6535948261835842, 'bull_time_stop': 186, 'bull_use_sma': True, 'bull_use_ema': False, 'bull_use_atr': False, 'bull_use_adx': True, 'bull_use_spike': True, 'bull_rsi_required': False, 'bear_strategy': 'breakout', 'bear_bb_std_mult': 2.265608382471019, 'bear_rsi_os': 46, 'bear_rsi_ob': 83, 'bear_adx_thresh': 20.456720527202908, 'bear_atr_min_pct': 0.018964590765501714, 'bear_atr_max_pct': 0.060827642429426024, 'bear_tp_mult': 1.7556612752020173, 'bear_tsl_mult': 0.10469435337759371, 'bear_time_stop': 263, 'bear_use_sma': False, 'bear_use_ema': False, 'bear_use_atr': True, 'bear_use_adx': True, 'bear_use_spike': False, 'bear_rsi_required': False, 'sideways_strategy': 'breakout', 'sideways_bb_std_mult': 2.1760354451667934, 'sideways_rsi_os': 25, 'sideways_rsi_ob': 58, 'sideways_adx_thresh': 9.923294603509488, 'sideways_atr_min_pct': 0.019105135847150616, 'sideways_atr_max_pct': 0.12054539854666867, 'sideways_tp_mult': 1.9565952064501788, 'sideways_tsl_mult': 0.6525132610133932, 'sideways_time_stop': 111, 'sideways_use_sma': True, 'sideways_use_ema': True, 'sideways_use_atr': False, 'sideways_use_adx': False, 'sideways_use_spike': False, 'sideways_rsi_required': False}.
[I 2025-08-30 19:19:39,221] Trial 339 finished with values: [-1000000000.0, 1000000000.0] and parameters: {'p_sma': 38, 'p_std': 59, 'p_atr': 30, 'p_adx': 15, 'rsi_period': 8, 'ema1': 5, 'ema2': 19, 'slip_atr_k': 0.026879574238416616, 'slip_spread_k': 0.4460589402432167, 'spread_hl_frac': 0.00685540277738185, 'bb_std_mult': 1.9721934284099372, 'rsi_os': 21, 'rsi_ob': 84, 'vol_spike': 0.17565879105897939, 'adx_thresh': 16.606616918600867, 'atr_min_pct': 0.02410705030989353, 'atr_max_pct': 0.051775991254783146, 'tp_mult': 2.1669018915213445, 'tsl_mult': 0.6647597473721575, 'strategy': 'breakout', 'time_stop': 73, 'use_sma': False, 'use_atr': True, 'use_adx': True, 'use_ema': True, 'use_spike': False, 'rsi_required': True, 'edge_k': 0.7431203639441735, 'edge_cap': 0.22565829182245675, 'bull_strategy': 'breakout', 'bull_bb_std_mult': 3.0703012264511087, 'bull_rsi_os': 17, 'bull_rsi_ob': 82, 'bull_adx_thresh': 27.501960381157247, 'bull_atr_min_pct': 0.01251368899830193, 'bull_atr_max_pct': 0.12811806920634258, 'bull_tp_mult': 2.165375538061215, 'bull_tsl_mult': 0.949365885478256, 'bull_time_stop': 157, 'bull_use_sma': True, 'bull_use_ema': False, 'bull_use_atr': False, 'bull_use_adx': True, 'bull_use_spike': True, 'bull_rsi_required': True, 'bear_strategy': 'breakout', 'bear_bb_std_mult': 2.248616500540164, 'bear_rsi_os': 35, 'bear_rsi_ob': 83, 'bear_adx_thresh': 22.141340949853344, 'bear_atr_min_pct': 0.01310782149709546, 'bear_atr_max_pct': 0.05312335320954345, 'bear_tp_mult': 1.2529615867140949, 'bear_tsl_mult': 0.6929360035228953, 'bear_time_stop': 23, 'bear_use_sma': False, 'bear_use_ema': False, 'bear_use_atr': True, 'bear_use_adx': True, 'bear_use_spike': False, 'bear_rsi_required': False, 'sideways_strategy': 'breakout', 'sideways_bb_std_mult': 0.6517798119063101, 'sideways_rsi_os': 14, 'sideways_rsi_ob': 58, 'sideways_adx_thresh': 24.9232360477195, 'sideways_atr_min_pct': 0.02107486283007213, 'sideways_atr_max_pct': 0.10806348398934995, 'sideways_tp_mult': 1.098976245981262, 'sideways_tsl_mult': 0.654086420837356, 'sideways_time_stop': 104, 'sideways_use_sma': True, 'sideways_use_ema': False, 'sideways_use_atr': False, 'sideways_use_adx': False, 'sideways_use_spike': False, 'sideways_rsi_required': True}.
[I 2025-08-30 19:19:40,175] Trial 341 finished with values: [-1000000000.0, 1000000000.0] and parameters: {'p_sma': 28, 'p_std': 11, 'p_atr': 11, 'p_adx': 9, 'rsi_period': 50, 'ema1': 24, 'ema2': 19, 'slip_atr_k': 0.22747431325447431, 'slip_spread_k': 0.9302331944528194, 'spread_hl_frac': 0.028856503646200807, 'bb_std_mult': 2.4427742192569646, 'rsi_os': 31, 'rsi_ob': 89, 'vol_spike': 0.0004469217711528528, 'adx_thresh': 33.80208193950128, 'atr_min_pct': 0.024249871810419887, 'atr_max_pct': 0.0715736845663574, 'tp_mult': 2.140362173363836, 'tsl_mult': 0.5933640431348834, 'strategy': 'breakout', 'time_stop': 82, 'use_sma': False, 'use_atr': True, 'use_adx': False, 'use_ema': True, 'use_spike': True, 'rsi_required': True, 'edge_k': 0.7469575563173135, 'edge_cap': 0.27234693820087286, 'bull_strategy': 'mean_reversion', 'bull_bb_std_mult': 3.585073300429011, 'bull_rsi_os': 34, 'bull_rsi_ob': 76, 'bull_adx_thresh': 13.170702715024044, 'bull_atr_min_pct': 0.0035015759875018345, 'bull_atr_max_pct': 0.06445387701268117, 'bull_tp_mult': 1.4123327970597948, 'bull_tsl_mult': 0.997573916083142, 'bull_time_stop': 77, 'bull_use_sma': True, 'bull_use_ema': False, 'bull_use_atr': False, 'bull_use_adx': True, 'bull_use_spike': True, 'bull_rsi_required': True, 'bear_strategy': 'breakout', 'bear_bb_std_mult': 1.7207021233812054, 'bear_rsi_os': 35, 'bear_rsi_ob': 85, 'bear_adx_thresh': 5.643539896470987, 'bear_atr_min_pct': 0.01773700636519731, 'bear_atr_max_pct': 0.06494728700141213, 'bear_tp_mult': 1.7140769539564413, 'bear_tsl_mult': 0.1021592698103365, 'bear_time_stop': 20, 'bear_use_sma': False, 'bear_use_ema': False, 'bear_use_atr': True, 'bear_use_adx': True, 'bear_use_spike': False, 'bear_rsi_required': False, 'sideways_strategy': 'breakout', 'sideways_bb_std_mult': 3.106972712922243, 'sideways_rsi_os': 15, 'sideways_rsi_ob': 57, 'sideways_adx_thresh': 10.030417380737896, 'sideways_atr_min_pct': 0.020970859979254713, 'sideways_atr_max_pct': 0.10729597229195384, 'sideways_tp_mult': 2.431183836146773, 'sideways_tsl_mult': 0.6597245718642392, 'sideways_time_stop': 104, 'sideways_use_sma': False, 'sideways_use_ema': False, 'sideways_use_atr': False, 'sideways_use_adx': False, 'sideways_use_spike': True, 'sideways_rsi_required': True}.
[I 2025-08-30 19:19:40,259] Trial 342 finished with values: [-1000000000.0, 1000000000.0] and parameters: {'p_sma': 27, 'p_std': 47, 'p_atr': 28, 'p_adx': 15, 'rsi_period': 50, 'ema1': 24, 'ema2': 17, 'slip_atr_k': 0.025318348319408223, 'slip_spread_k': 0.9291220724949034, 'spread_hl_frac': 0.002454839986054909, 'bb_std_mult': 2.5628544347980324, 'rsi_os': 37, 'rsi_ob': 84, 'vol_spike': 0.05125395830444232, 'adx_thresh': 16.440465048367702, 'atr_min_pct': 0.02381049600425026, 'atr_max_pct': 0.09654656480443925, 'tp_mult': 2.163792387597905, 'tsl_mult': 0.6960012043864859, 'strategy': 'breakout', 'time_stop': 299, 'use_sma': False, 'use_atr': True, 'use_adx': False, 'use_ema': True, 'use_spike': True, 'rsi_required': True, 'edge_k': 0.7377161059258202, 'edge_cap': 0.27460342404549876, 'bull_strategy': 'mean_reversion', 'bull_bb_std_mult': 1.9975509785602183, 'bull_rsi_os': 20, 'bull_rsi_ob': 76, 'bull_adx_thresh': 26.556578660733308, 'bull_atr_min_pct': 0.0034812186571148485, 'bull_atr_max_pct': 0.14219897398614373, 'bull_tp_mult': 2.747172909721631, 'bull_tsl_mult': 0.031285049189554825, 'bull_time_stop': 178, 'bull_use_sma': True, 'bull_use_ema': False, 'bull_use_atr': False, 'bull_use_adx': True, 'bull_use_spike': True, 'bull_rsi_required': True, 'bear_strategy': 'breakout', 'bear_bb_std_mult': 3.102724925032295, 'bear_rsi_os': 16, 'bear_rsi_ob': 52, 'bear_adx_thresh': 28.969984233128955, 'bear_atr_min_pct': 0.013388745077855788, 'bear_atr_max_pct': 0.1324213458033717, 'bear_tp_mult': 1.7000214985094695, 'bear_tsl_mult': 0.4139145115894954, 'bear_time_stop': 22, 'bear_use_sma': False, 'bear_use_ema': False, 'bear_use_atr': True, 'bear_use_adx': True, 'bear_use_spike': False, 'bear_rsi_required': False, 'sideways_strategy': 'breakout', 'sideways_bb_std_mult': 2.03774092929311, 'sideways_rsi_os': 15, 'sideways_rsi_ob': 66, 'sideways_adx_thresh': 17.914949361535, 'sideways_atr_min_pct': 0.02251707988985459, 'sideways_atr_max_pct': 0.11231558594829005, 'sideways_tp_mult': 1.8628997657015451, 'sideways_tsl_mult': 0.8187390044075837, 'sideways_time_stop': 275, 'sideways_use_sma': False, 'sideways_use_ema': False, 'sideways_use_atr': False, 'sideways_use_adx': False, 'sideways_use_spike': True, 'sideways_rsi_required': True}.
