[I 2025-08-30 19:55:24,914] Trial 602 finished with values: [-1000000000.0, 1000000000.0] and parameters: {'p_sma': 40, 'p_std': 24, 'p_atr': 10, 'p_adx': 15, 'rsi_period': 49, 'ema1': 26, 'ema2': 17, 'slip_atr_k': 0.031398691200959276, 'slip_spread_k': 0.4538860893749906, 'spread_hl_frac': 0.0030899619056989486, 'bb_std_mult': 2.326397247550709, 'rsi_os': 37, 'rsi_ob': 57, 'vol_spike': 0.14454858912949242, 'adx_thresh': 18.908833038659907, 'atr_min_pct': 0.02298669711807889, 'atr_max_pct': 0.1362117541126639, 'tp_mult': 2.1794832352087643, 'tsl_mult': 0.9348249164068104, 'strategy': 'breakout', 'time_stop': 204, 'use_sma': False, 'use_atr': True, 'use_adx': False, 'use_ema': False, 'use_spike': True, 'rsi_required': True, 'edge_k': 0.11122153508871481, 'edge_cap': 0.8491919134632517, 'bull_strategy': 'mean_reversion', 'bull_bb_std_mult': 3.064104811265545, 'bull_rsi_os': 48, 'bull_rsi_ob': 72, 'bull_adx_thresh': 27.196162949448375, 'bull_atr_min_pct': 0.02369830362056282, 'bull_atr_max_pct': 0.06693005702974453, 'bull_tp_mult': 2.8005270991245297, 'bull_tsl_mult': 0.9864601606171769, 'bull_time_stop': 83, 'bull_use_sma': True, 'bull_use_ema': False, 'bull_use_atr': False, 'bull_use_adx': True, 'bull_use_spike': True, 'bull_rsi_required': True, 'bear_strategy': 'breakout', 'bear_bb_std_mult': 3.173955934875649, 'bear_rsi_os': 43, 'bear_rsi_ob': 81, 'bear_adx_thresh': 20.827263076623826, 'bear_atr_min_pct': 0.014788677398970964, 'bear_atr_max_pct': 0.010996967475060931, 'bear_tp_mult': 1.7413213046421194, 'bear_tsl_mult': 0.12696560395179235, 'bear_time_stop': 41, 'bear_use_sma': True, 'bear_use_ema': False, 'bear_use_atr': True, 'bear_use_adx': True, 'bear_use_spike': False, 'bear_rsi_required': False, 'sideways_strategy': 'breakout', 'sideways_bb_std_mult': 2.1444942307807824, 'sideways_rsi_os': 55, 'sideways_rsi_ob': 59, 'sideways_adx_thresh': 15.626628215755563, 'sideways_atr_min_pct': 0.02370409941902702, 'sideways_atr_max_pct': 0.12212294974949865, 'sideways_tp_mult': 1.7507488408427538, 'sideways_tsl_mult': 0.6585067516777499, 'sideways_time_stop': 265, 'sideways_use_sma': True, 'sideways_use_ema': True, 'sideways_use_atr': False, 'sideways_use_adx': False, 'sideways_use_spike': False, 'sideways_rsi_required': False}.
[I 2025-08-30 19:55:25,169] Trial 604 finished with values: [-1000000000.0, 1000000000.0] and parameters: {'p_sma': 43, 'p_std': 27, 'p_atr': 24, 'p_adx': 8, 'rsi_period': 83, 'ema1': 26, 'ema2': 35, 'slip_atr_k': 0.20801759004024487, 'slip_spread_k': 0.4153116266915269, 'spread_hl_frac': 0.026653350724921976, 'bb_std_mult': 1.0349036392275677, 'rsi_os': 37, 'rsi_ob': 52, 'vol_spike': 0.19398597201270118, 'adx_thresh': 18.90938661282209, 'atr_min_pct': 0.0253332826090581, 'atr_max_pct': 0.13670438553675449, 'tp_mult': 2.178335285612502, 'tsl_mult': 0.14639284310883943, 'strategy': 'breakout', 'time_stop': 31, 'use_sma': False, 'use_atr': True, 'use_adx': False, 'use_ema': False, 'use_spike': True, 'rsi_required': True, 'edge_k': 0.9869678014158892, 'edge_cap': 0.25369743748643786, 'bull_strategy': 'mean_reversion', 'bull_bb_std_mult': 3.588492064662744, 'bull_rsi_os': 51, 'bull_rsi_ob': 72, 'bull_adx_thresh': 11.616462432749483, 'bull_atr_min_pct': 0.02381448293420908, 'bull_atr_max_pct': 0.06551294357973082, 'bull_tp_mult': 1.9947903334172832, 'bull_tsl_mult': 0.9818952206489753, 'bull_time_stop': 146, 'bull_use_sma': True, 'bull_use_ema': False, 'bull_use_atr': False, 'bull_use_adx': True, 'bull_use_spike': True, 'bull_rsi_required': True, 'bear_strategy': 'breakout', 'bear_bb_std_mult': 0.7431789418946855, 'bear_rsi_os': 23, 'bear_rsi_ob': 74, 'bear_adx_thresh': 5.542456111540539, 'bear_atr_min_pct': 0.014230101369486235, 'bear_atr_max_pct': 0.06474242209920228, 'bear_tp_mult': 1.2105874706227178, 'bear_tsl_mult': 0.11749687427561122, 'bear_time_stop': 41, 'bear_use_sma': True, 'bear_use_ema': False, 'bear_use_atr': True, 'bear_use_adx': True, 'bear_use_spike': False, 'bear_rsi_required': False, 'sideways_strategy': 'breakout', 'sideways_bb_std_mult': 2.24333639914441, 'sideways_rsi_os': 44, 'sideways_rsi_ob': 61, 'sideways_adx_thresh': 29.82472348316788, 'sideways_atr_min_pct': 0.0192965434850583, 'sideways_atr_max_pct': 0.10450303164299554, 'sideways_tp_mult': 1.1840852041120358, 'sideways_tsl_mult': 0.7030836635981529, 'sideways_time_stop': 265, 'sideways_use_sma': True, 'sideways_use_ema': True, 'sideways_use_atr': False, 'sideways_use_adx': False, 'sideways_use_spike': False, 'sideways_rsi_required': False}.
[I 2025-08-30 19:55:26,112] Trial 608 finished with values: [-1000000000.0, 1000000000.0] and parameters: {'p_sma': 39, 'p_std': 58, 'p_atr': 8, 'p_adx': 28, 'rsi_period': 53, 'ema1': 24, 'ema2': 38, 'slip_atr_k': 0.02052252172542464, 'slip_spread_k': 0.5986061204766085, 'spread_hl_frac': 0.001827846648406148, 'bb_std_mult': 0.9219267055667358, 'rsi_os': 51, 'rsi_ob': 61, 'vol_spike': 0.10591433359274993, 'adx_thresh': 20.155917200780458, 'atr_min_pct': 0.024174531768524746, 'atr_max_pct': 0.05292123056218364, 'tp_mult': 2.2316886580285025, 'tsl_mult': 0.5300465574547849, 'strategy': 'mean_reversion', 'time_stop': 49, 'use_sma': True, 'use_atr': False, 'use_adx': True, 'use_ema': False, 'use_spike': True, 'rsi_required': True, 'edge_k': 0.34585818789259415, 'edge_cap': 0.16195252500042123, 'bull_strategy': 'breakout', 'bull_bb_std_mult': 1.8924096477266836, 'bull_rsi_os': 52, 'bull_rsi_ob': 65, 'bull_adx_thresh': 25.349182833461924, 'bull_atr_min_pct': 0.0009272597670972821, 'bull_atr_max_pct': 0.02924796768810225, 'bull_tp_mult': 2.1332130777217047, 'bull_tsl_mult': 0.9994861107192875, 'bull_time_stop': 195, 'bull_use_sma': True, 'bull_use_ema': False, 'bull_use_atr': False, 'bull_use_adx': True, 'bull_use_spike': False, 'bull_rsi_required': True, 'bear_strategy': 'mean_reversion', 'bear_bb_std_mult': 3.2947819361648447, 'bear_rsi_os': 45, 'bear_rsi_ob': 83, 'bear_adx_thresh': 14.920659503932551, 'bear_atr_min_pct': 0.011979094822871145, 'bear_atr_max_pct': 0.04486238663645134, 'bear_tp_mult': 1.4926605630232377, 'bear_tsl_mult': 0.07861544545088443, 'bear_time_stop': 233, 'bear_use_sma': True, 'bear_use_ema': False, 'bear_use_atr': False, 'bear_use_adx': False, 'bear_use_spike': False, 'bear_rsi_required': False, 'sideways_strategy': 'breakout', 'sideways_bb_std_mult': 1.9912921339541785, 'sideways_rsi_os': 17, 'sideways_rsi_ob': 79, 'sideways_adx_thresh': 10.292078160889936, 'sideways_atr_min_pct': 0.021832372355465233, 'sideways_atr_max_pct': 0.11821207387742555, 'sideways_tp_mult': 1.840179876784521, 'sideways_tsl_mult': 0.935559216456176, 'sideways_time_stop': 274, 'sideways_use_sma': False, 'sideways_use_ema': True, 'sideways_use_atr': False, 'sideways_use_adx': False, 'sideways_use_spike': False, 'sideways_rsi_required': True}.
[I 2025-08-30 19:55:58,383] Trial 607 finished with values: [-0.019509594008136455, 0.019419387397277648] and parameters: {'p_sma': 38, 'p_std': 27, 'p_atr': 25, 'p_adx': 18, 'rsi_period': 83, 'ema1': 24, 'ema2': 32, 'slip_atr_k': 0.1474462272746908, 'slip_spread_k': 0.40421667539455075, 'spread_hl_frac': 0.03466308795960559, 'bb_std_mult': 1.3407806463410759, 'rsi_os': 14, 'rsi_ob': 58, 'vol_spike': 0.03279455687782215, 'adx_thresh': 20.141955735893923, 'atr_min_pct': 0.017202170527540278, 'atr_max_pct': 0.10606744474566226, 'tp_mult': 1.8708670261249547, 'tsl_mult': 0.6960417254002039, 'strategy': 'mean_reversion', 'time_stop': 30, 'use_sma': True, 'use_atr': False, 'use_adx': True, 'use_ema': False, 'use_spike': True, 'rsi_required': True, 'edge_k': 0.3594940351073084, 'edge_cap': 0.7406769432983642, 'bull_strategy': 'breakout', 'bull_bb_std_mult': 1.8986773720781247, 'bull_rsi_os': 51, 'bull_rsi_ob': 69, 'bull_adx_thresh': 9.778757143008086, 'bull_atr_min_pct': 0.0018275431462442802, 'bull_atr_max_pct': 0.015692928676843895, 'bull_tp_mult': 2.133608519875344, 'bull_tsl_mult': 0.9986750350451603, 'bull_time_stop': 194, 'bull_use_sma': True, 'bull_use_ema': False, 'bull_use_atr': False, 'bull_use_adx': True, 'bull_use_spike': False, 'bull_rsi_required': True, 'bear_strategy': 'mean_reversion', 'bear_bb_std_mult': 3.295285386722383, 'bear_rsi_os': 27, 'bear_rsi_ob': 64, 'bear_adx_thresh': 5.787896856742988, 'bear_atr_min_pct': 0.014206526588013186, 'bear_atr_max_pct': 0.06532615884997087, 'bear_tp_mult': 1.5015176578409588, 'bear_tsl_mult': 0.15502903326438897, 'bear_time_stop': 135, 'bear_use_sma': True, 'bear_use_ema': False, 'bear_use_atr': False, 'bear_use_adx': False, 'bear_use_spike': False, 'bear_rsi_required': False, 'sideways_strategy': 'breakout', 'sideways_bb_std_mult': 2.0026673558418056, 'sideways_rsi_os': 9, 'sideways_rsi_ob': 58, 'sideways_adx_thresh': 10.161193907282588, 'sideways_atr_min_pct': 0.0015980029961082162, 'sideways_atr_max_pct': 0.10543113205092002, 'sideways_tp_mult': 1.8613325495693427, 'sideways_tsl_mult': 0.709386658289048, 'sideways_time_stop': 270, 'sideways_use_sma': False, 'sideways_use_ema': True, 'sideways_use_atr': False, 'sideways_use_adx': False, 'sideways_use_spike': False, 'sideways_rsi_required': True}.
[I 2025-08-30 19:55:59,104] Trial 605 finished with values: [-1000000000.0, 1000000000.0] and parameters: {'p_sma': 56, 'p_std': 27, 'p_atr': 8, 'p_adx': 8, 'rsi_period': 53, 'ema1': 10, 'ema2': 38, 'slip_atr_k': 0.18459378901792287, 'slip_spread_k': 0.4552480874092696, 'spread_hl_frac': 0.034613387402863745, 'bb_std_mult': 1.0679757307208977, 'rsi_os': 38, 'rsi_ob': 94, 'vol_spike': 0.024471112079641907, 'adx_thresh': 20.031031241251032, 'atr_min_pct': 0.017146638256978246, 'atr_max_pct': 0.05947759240381775, 'tp_mult': 2.167230733309311, 'tsl_mult': 0.6932816711888372, 'strategy': 'breakout', 'time_stop': 30, 'use_sma': False, 'use_atr': False, 'use_adx': True, 'use_ema': False, 'use_spike': True, 'rsi_required': True, 'edge_k': 0.03800346077345132, 'edge_cap': 0.25269707211490305, 'bull_strategy': 'breakout', 'bull_bb_std_mult': 1.7836211608314367, 'bull_rsi_os': 51, 'bull_rsi_ob': 60, 'bull_adx_thresh': 28.318321726396707, 'bull_atr_min_pct': 0.007367772112226619, 'bull_atr_max_pct': 0.09392542845560889, 'bull_tp_mult': 2.790545901983289, 'bull_tsl_mult': 0.9839017602807076, 'bull_time_stop': 145, 'bull_use_sma': True, 'bull_use_ema': False, 'bull_use_atr': False, 'bull_use_adx': True, 'bull_use_spike': True, 'bull_rsi_required': True, 'bear_strategy': 'breakout', 'bear_bb_std_mult': 0.7736704799264593, 'bear_rsi_os': 27, 'bear_rsi_ob': 82, 'bear_adx_thresh': 5.984499337631503, 'bear_atr_min_pct': 0.01431413726897742, 'bear_atr_max_pct': 0.06604795488241216, 'bear_tp_mult': 1.3249520029879212, 'bear_tsl_mult': 0.12721256574658982, 'bear_time_stop': 69, 'bear_use_sma': True, 'bear_use_ema': False, 'bear_use_atr': False, 'bear_use_adx': False, 'bear_use_spike': False, 'bear_rsi_required': False, 'sideways_strategy': 'breakout', 'sideways_bb_std_mult': 1.991546504392802, 'sideways_rsi_os': 13, 'sideways_rsi_ob': 61, 'sideways_adx_thresh': 29.73731200390835, 'sideways_atr_min_pct': 0.024068460846416725, 'sideways_atr_max_pct': 0.11869777729620021, 'sideways_tp_mult': 1.8594919135868775, 'sideways_tsl_mult': 0.9577610659814486, 'sideways_time_stop': 228, 'sideways_use_sma': False, 'sideways_use_ema': True, 'sideways_use_atr': False, 'sideways_use_adx': False, 'sideways_use_spike': False, 'sideways_rsi_required': True}.
[I 2025-08-30 19:55:59,104] Trial 606 finished with values: [-1000000000.0, 1000000000.0] and parameters: {'p_sma': 39, 'p_std': 33, 'p_atr': 25, 'p_adx': 8, 'rsi_period': 75, 'ema1': 10, 'ema2': 17, 'slip_atr_k': 0.037959168362058246, 'slip_spread_k': 0.137726349100651, 'spread_hl_frac': 0.03465060310732091, 'bb_std_mult': 1.0606499347638023, 'rsi_os': 42, 'rsi_ob': 57, 'vol_spike': 0.19593914253016653, 'adx_thresh': 19.987315414772727, 'atr_min_pct': 0.024151456551743233, 'atr_max_pct': 0.13698561185649316, 'tp_mult': 1.635099640092645, 'tsl_mult': 0.6954083010122191, 'strategy': 'mean_reversion', 'time_stop': 155, 'use_sma': True, 'use_atr': False, 'use_adx': True, 'use_ema': False, 'use_spike': True, 'rsi_required': True, 'edge_k': 0.045015206750470674, 'edge_cap': 0.16013445837794738, 'bull_strategy': 'breakout', 'bull_bb_std_mult': 1.2730016697668105, 'bull_rsi_os': 51, 'bull_rsi_ob': 69, 'bull_adx_thresh': 21.164254120235498, 'bull_atr_min_pct': 0.002018912153063588, 'bull_atr_max_pct': 0.06641253957028646, 'bull_tp_mult': 2.7046757912062303, 'bull_tsl_mult': 0.6701509002030531, 'bull_time_stop': 178, 'bull_use_sma': True, 'bull_use_ema': False, 'bull_use_atr': False, 'bull_use_adx': True, 'bull_use_spike': False, 'bull_rsi_required': True, 'bear_strategy': 'breakout', 'bear_bb_std_mult': 3.1662949178152955, 'bear_rsi_os': 15, 'bear_rsi_ob': 52, 'bear_adx_thresh': 14.857935672792477, 'bear_atr_min_pct': 0.014194894013194154, 'bear_atr_max_pct': 0.06457773620360593, 'bear_tp_mult': 1.2205066421888437, 'bear_tsl_mult': 0.7401479979754697, 'bear_time_stop': 163, 'bear_use_sma': True, 'bear_use_ema': False, 'bear_use_atr': False, 'bear_use_adx': False, 'bear_use_spike': False, 'bear_rsi_required': False, 'sideways_strategy': 'breakout', 'sideways_bb_std_mult': 2.5346160021881357, 'sideways_rsi_os': 17, 'sideways_rsi_ob': 69, 'sideways_adx_thresh': 29.6772482291041, 'sideways_atr_min_pct': 0.026695908929165478, 'sideways_atr_max_pct': 0.08590795338220068, 'sideways_tp_mult': 2.9417296301073033, 'sideways_tsl_mult': 0.7031188877824596, 'sideways_time_stop': 269, 'sideways_use_sma': False, 'sideways_use_ema': True, 'sideways_use_atr': False, 'sideways_use_adx': False, 'sideways_use_spike': False, 'sideways_rsi_required': True}.
[I 2025-08-30 19:56:00,005] Trial 609 finished with values: [-1000000000.0, 1000000000.0] and parameters: {'p_sma': 38, 'p_std': 44, 'p_atr': 19, 'p_adx': 18, 'rsi_period': 52, 'ema1': 10, 'ema2': 25, 'slip_atr_k': 0.0156368440396175, 'slip_spread_k': 0.8120059312884995, 'spread_hl_frac': 0.0032580841850192604, 'bb_std_mult': 2.907713233506973, 'rsi_os': 31, 'rsi_ob': 95, 'vol_spike': 0.025111773087591306, 'adx_thresh': 17.926736491756625, 'atr_min_pct': 0.01536138753958428, 'atr_max_pct': 0.13154557127275113, 'tp_mult': 1.85156164822859, 'tsl_mult': 0.7007102837999415, 'strategy': 'mean_reversion', 'time_stop': 157, 'use_sma': False, 'use_atr': False, 'use_adx': True, 'use_ema': False, 'use_spike': True, 'rsi_required': True, 'edge_k': 0.19699234809978672, 'edge_cap': 0.5065316062737354, 'bull_strategy': 'breakout', 'bull_bb_std_mult': 1.8391405430915824, 'bull_rsi_os': 26, 'bull_rsi_ob': 69, 'bull_adx_thresh': 26.080556351379045, 'bull_atr_min_pct': 0.007217698034104681, 'bull_atr_max_pct': 0.01573722500047904, 'bull_tp_mult': 2.356002426830525, 'bull_tsl_mult': 0.5404559689601782, 'bull_time_stop': 178, 'bull_use_sma': True, 'bull_use_ema': False, 'bull_use_atr': False, 'bull_use_adx': True, 'bull_use_spike': True, 'bull_rsi_required': True, 'bear_strategy': 'breakout', 'bear_bb_std_mult': 3.2026397511840106, 'bear_rsi_os': 8, 'bear_rsi_ob': 63, 'bear_adx_thresh': 6.022211701745562, 'bear_atr_min_pct': 0.015729526613800376, 'bear_atr_max_pct': 0.125524439233752, 'bear_tp_mult': 1.5425011655461693, 'bear_tsl_mult': 0.1541840589191631, 'bear_time_stop': 5, 'bear_use_sma': True, 'bear_use_ema': False, 'bear_use_atr': False, 'bear_use_adx': False, 'bear_use_spike': False, 'bear_rsi_required': False, 'sideways_strategy': 'breakout', 'sideways_bb_std_mult': 2.635509588291217, 'sideways_rsi_os': 21, 'sideways_rsi_ob': 70, 'sideways_adx_thresh': 9.761989872928519, 'sideways_atr_min_pct': 0.02650047971248594, 'sideways_atr_max_pct': 0.11516728300741805, 'sideways_tp_mult': 2.002539775190761, 'sideways_tsl_mult': 0.7059174816364622, 'sideways_time_stop': 227, 'sideways_use_sma': False, 'sideways_use_ema': True, 'sideways_use_atr': False, 'sideways_use_adx': False, 'sideways_use_spike': False, 'sideways_rsi_required': True}.
[I 2025-08-30 19:56:35,355] Trial 613 finished with values: [-1000000000.0, 1000000000.0] and parameters: {'p_sma': 13, 'p_std': 9, 'p_atr': 22, 'p_adx': 9, 'rsi_period': 51, 'ema1': 14, 'ema2': 19, 'slip_atr_k': 0.0698593303925294, 'slip_spread_k': 0.3791157172210635, 'spread_hl_frac': 0.0181406414233801, 'bb_std_mult': 0.769941673158702, 'rsi_os': 39, 'rsi_ob': 73, 'vol_spike': 0.05075053730073145, 'adx_thresh': 14.000098844031676, 'atr_min_pct': 0.012363556368110108, 'atr_max_pct': 0.13408783210017688, 'tp_mult': 2.3751036321680097, 'tsl_mult': 0.32127870119581226, 'strategy': 'breakout', 'time_stop': 267, 'use_sma': False, 'use_atr': True, 'use_adx': False, 'use_ema': False, 'use_spike': True, 'rsi_required': False, 'edge_k': 0.6211056060357907, 'edge_cap': 0.23073330699691644, 'bull_strategy': 'mean_reversion', 'bull_bb_std_mult': 1.1395510782803098, 'bull_rsi_os': 5, 'bull_rsi_ob': 73, 'bull_adx_thresh': 15.037754226870078, 'bull_atr_min_pct': 0.0031159590144263123, 'bull_atr_max_pct': 0.024521909425367944, 'bull_tp_mult': 1.8297662273543176, 'bull_tsl_mult': 0.9480078101199239, 'bull_time_stop': 188, 'bull_use_sma': True, 'bull_use_ema': True, 'bull_use_atr': True, 'bull_use_adx': False, 'bull_use_spike': True, 'bull_rsi_required': True, 'bear_strategy': 'breakout', 'bear_bb_std_mult': 2.817637498297529, 'bear_rsi_os': 46, 'bear_rsi_ob': 57, 'bear_adx_thresh': 6.955905112285053, 'bear_atr_min_pct': 0.024798504128391977, 'bear_atr_max_pct': 0.05815426155049399, 'bear_tp_mult': 1.6749859865475532, 'bear_tsl_mult': 0.23458785293990797, 'bear_time_stop': 145, 'bear_use_sma': False, 'bear_use_ema': True, 'bear_use_atr': True, 'bear_use_adx': True, 'bear_use_spike': True, 'bear_rsi_required': True, 'sideways_strategy': 'mean_reversion', 'sideways_bb_std_mult': 1.1787396804803554, 'sideways_rsi_os': 5, 'sideways_rsi_ob': 84, 'sideways_adx_thresh': 8.822513707741967, 'sideways_atr_min_pct': 0.02113290961233715, 'sideways_atr_max_pct': 0.10030051544176606, 'sideways_tp_mult': 1.7546228882077672, 'sideways_tsl_mult': 0.25903786412847624, 'sideways_time_stop': 154, 'sideways_use_sma': True, 'sideways_use_ema': False, 'sideways_use_atr': True, 'sideways_use_adx': False, 'sideways_use_spike': True, 'sideways_rsi_required': False}.
[I 2025-08-30 19:56:36,113] Trial 611 finished with values: [-1000000000.0, 1000000000.0] and parameters: {'p_sma': 43, 'p_std': 26, 'p_atr': 11, 'p_adx': 9, 'rsi_period': 51, 'ema1': 17, 'ema2': 51, 'slip_atr_k': 0.01593908835375052, 'slip_spread_k': 0.38076784708461936, 'spread_hl_frac': 0.029714830348249874, 'bb_std_mult': 3.087967502065297, 'rsi_os': 39, 'rsi_ob': 70, 'vol_spike': 0.24798833271155557, 'adx_thresh': 16.82839576217593, 'atr_min_pct': 0.021189681772812906, 'atr_max_pct': 0.09981007929758828, 'tp_mult': 2.2298615678728364, 'tsl_mult': 0.7862684816609578, 'strategy': 'breakout', 'time_stop': 99, 'use_sma': False, 'use_atr': True, 'use_adx': False, 'use_ema': False, 'use_spike': True, 'rsi_required': False, 'edge_k': 0.2971326905812073, 'edge_cap': 0.23101863750411256, 'bull_strategy': 'mean_reversion', 'bull_bb_std_mult': 1.124559989596211, 'bull_rsi_os': 50, 'bull_rsi_ob': 67, 'bull_adx_thresh': 13.47184187975473, 'bull_atr_min_pct': 0.022570986013413577, 'bull_atr_max_pct': 0.02462064623853633, 'bull_tp_mult': 2.353277400211727, 'bull_tsl_mult': 0.9334206086973166, 'bull_time_stop': 188, 'bull_use_sma': True, 'bull_use_ema': True, 'bull_use_atr': True, 'bull_use_adx': False, 'bull_use_spike': True, 'bull_rsi_required': True, 'bear_strategy': 'breakout', 'bear_bb_std_mult': 2.957204335469048, 'bear_rsi_os': 41, 'bear_rsi_ob': 86, 'bear_adx_thresh': 6.396710066908405, 'bear_atr_min_pct': 0.015963113722417956, 'bear_atr_max_pct': 0.12473795107598126, 'bear_tp_mult': 1.685117156395697, 'bear_tsl_mult': 0.5765420797939748, 'bear_time_stop': 275, 'bear_use_sma': False, 'bear_use_ema': True, 'bear_use_atr': True, 'bear_use_adx': True, 'bear_use_spike': True, 'bear_rsi_required': True, 'sideways_strategy': 'mean_reversion', 'sideways_bb_std_mult': 3.143299779932562, 'sideways_rsi_os': 14, 'sideways_rsi_ob': 85, 'sideways_adx_thresh': 8.9522294029947, 'sideways_atr_min_pct': 0.020796262924563463, 'sideways_atr_max_pct': 0.13227979908833987, 'sideways_tp_mult': 1.922751025352835, 'sideways_tsl_mult': 0.8568572298324072, 'sideways_time_stop': 171, 'sideways_use_sma': True, 'sideways_use_ema': False, 'sideways_use_atr': True, 'sideways_use_adx': False, 'sideways_use_spike': True, 'sideways_rsi_required': False}.
