[I 2025-08-30 19:29:45,336] Trial 414 finished with values: [-1000000000.0, 1000000000.0] and parameters: {'p_sma': 38, 'p_std': 27, 'p_atr': 16, 'p_adx': 10, 'rsi_period': 54, 'ema1': 23, 'ema2': 29, 'slip_atr_k': 0.026878239230844633, 'slip_spread_k': 0.27650421904714184, 'spread_hl_frac': 0.03479441036468648, 'bb_std_mult': 1.7738968774471482, 'rsi_os': 38, 'rsi_ob': 55, 'vol_spike': 0.006510098417917637, 'adx_thresh': 18.196630927701502, 'atr_min_pct': 0.022171823870989024, 'atr_max_pct': 0.08116657233509383, 'tp_mult': 1.4003429157364784, 'tsl_mult': 0.7169855982275127, 'strategy': 'breakout', 'time_stop': 134, 'use_sma': False, 'use_atr': False, 'use_adx': False, 'use_ema': True, 'use_spike': True, 'rsi_required': True, 'edge_k': 0.5662419664294773, 'edge_cap': 0.23885170935545239, 'bull_strategy': 'mean_reversion', 'bull_bb_std_mult': 1.379128857116805, 'bull_rsi_os': 49, 'bull_rsi_ob': 77, 'bull_adx_thresh': 25.352788896147533, 'bull_atr_min_pct': 0.00013262670565949335, 'bull_atr_max_pct': 0.07277776889422072, 'bull_tp_mult': 2.3192233561553133, 'bull_tsl_mult': 0.32801497781842415, 'bull_time_stop': 195, 'bull_use_sma': False, 'bull_use_ema': True, 'bull_use_atr': True, 'bull_use_adx': False, 'bull_use_spike': False, 'bull_rsi_required': True, 'bear_strategy': 'mean_reversion', 'bear_bb_std_mult': 0.503359196107378, 'bear_rsi_os': 28, 'bear_rsi_ob': 84, 'bear_adx_thresh': 6.17102338721213, 'bear_atr_min_pct': 0.014440947369482926, 'bear_atr_max_pct': 0.05309607677534792, 'bear_tp_mult': 2.128480231850287, 'bear_tsl_mult': 0.10243688777328702, 'bear_time_stop': 39, 'bear_use_sma': True, 'bear_use_ema': True, 'bear_use_atr': False, 'bear_use_adx': False, 'bear_use_spike': False, 'bear_rsi_required': False, 'sideways_strategy': 'mean_reversion', 'sideways_bb_std_mult': 2.0098666711643007, 'sideways_rsi_os': 28, 'sideways_rsi_ob': 78, 'sideways_adx_thresh': 10.566936812020602, 'sideways_atr_min_pct': 0.00572892922573129, 'sideways_atr_max_pct': 0.018147257630458234, 'sideways_tp_mult': 1.4566318243991052, 'sideways_tsl_mult': 0.6383775253588675, 'sideways_time_stop': 281, 'sideways_use_sma': False, 'sideways_use_ema': True, 'sideways_use_atr': False, 'sideways_use_adx': True, 'sideways_use_spike': True, 'sideways_rsi_required': True}.
[I 2025-08-30 19:29:45,950] Trial 416 finished with values: [-1000000000.0, 1000000000.0] and parameters: {'p_sma': 44, 'p_std': 27, 'p_atr': 26, 'p_adx': 8, 'rsi_period': 48, 'ema1': 27, 'ema2': 35, 'slip_atr_k': 0.026938753912003788, 'slip_spread_k': 0.5840055535425184, 'spread_hl_frac': 0.021762743163375585, 'bb_std_mult': 0.9679501105553974, 'rsi_os': 52, 'rsi_ob': 55, 'vol_spike': 0.04762403715391191, 'adx_thresh': 18.56356876892025, 'atr_min_pct': 0.02211823396449789, 'atr_max_pct': 0.0211094119573721, 'tp_mult': 1.6891497713513286, 'tsl_mult': 0.8531933481743537, 'strategy': 'breakout', 'time_stop': 42, 'use_sma': True, 'use_atr': True, 'use_adx': True, 'use_ema': False, 'use_spike': True, 'rsi_required': True, 'edge_k': 0.1619499171025494, 'edge_cap': 0.22629507516629582, 'bull_strategy': 'mean_reversion', 'bull_bb_std_mult': 1.3602827592803117, 'bull_rsi_os': 50, 'bull_rsi_ob': 71, 'bull_adx_thresh': 18.692990631684445, 'bull_atr_min_pct': 0.029161387149363685, 'bull_atr_max_pct': 0.018609190960609662, 'bull_tp_mult': 2.3413096406570775, 'bull_tsl_mult': 0.8598138703708942, 'bull_time_stop': 196, 'bull_use_sma': True, 'bull_use_ema': False, 'bull_use_atr': False, 'bull_use_adx': True, 'bull_use_spike': False, 'bull_rsi_required': True, 'bear_strategy': 'breakout', 'bear_bb_std_mult': 3.2441738653969807, 'bear_rsi_os': 11, 'bear_rsi_ob': 85, 'bear_adx_thresh': 5.7240575415668165, 'bear_atr_min_pct': 0.015126340081272912, 'bear_atr_max_pct': 0.06016987159617277, 'bear_tp_mult': 1.7710585537827257, 'bear_tsl_mult': 0.10274095502739003, 'bear_time_stop': 24, 'bear_use_sma': True, 'bear_use_ema': False, 'bear_use_atr': True, 'bear_use_adx': True, 'bear_use_spike': False, 'bear_rsi_required': False, 'sideways_strategy': 'breakout', 'sideways_bb_std_mult': 3.278521574194385, 'sideways_rsi_os': 8, 'sideways_rsi_ob': 55, 'sideways_adx_thresh': 9.090171111290832, 'sideways_atr_min_pct': 0.008381881943019389, 'sideways_atr_max_pct': 0.08683031281202865, 'sideways_tp_mult': 1.179064481759742, 'sideways_tsl_mult': 0.577394365150737, 'sideways_time_stop': 8, 'sideways_use_sma': True, 'sideways_use_ema': True, 'sideways_use_atr': False, 'sideways_use_adx': False, 'sideways_use_spike': True, 'sideways_rsi_required': False}.
[I 2025-08-30 19:30:19,972] Trial 415 finished with values: [-0.016713532383736518, 0.016630159995529102] and parameters: {'p_sma': 38, 'p_std': 27, 'p_atr': 8, 'p_adx': 8, 'rsi_period': 48, 'ema1': 21, 'ema2': 52, 'slip_atr_k': 0.1147590931600469, 'slip_spread_k': 0.6138723738734164, 'spread_hl_frac': 0.0007331706063351926, 'bb_std_mult': 3.4891708148993885, 'rsi_os': 38, 'rsi_ob': 91, 'vol_spike': 0.049551236098205116, 'adx_thresh': 18.32895969809313, 'atr_min_pct': 0.021952618595425275, 'atr_max_pct': 0.047712230450360375, 'tp_mult': 1.7798186909631417, 'tsl_mult': 0.8718853706920172, 'strategy': 'breakout', 'time_stop': 42, 'use_sma': True, 'use_atr': True, 'use_adx': True, 'use_ema': False, 'use_spike': True, 'rsi_required': True, 'edge_k': 0.15267054729013368, 'edge_cap': 0.22006209958495873, 'bull_strategy': 'mean_reversion', 'bull_bb_std_mult': 0.5105446609312236, 'bull_rsi_os': 50, 'bull_rsi_ob': 71, 'bull_adx_thresh': 10.059664677547307, 'bull_atr_min_pct': 0.0025370192376654127, 'bull_atr_max_pct': 0.019619190150021212, 'bull_tp_mult': 2.134045620838983, 'bull_tsl_mult': 0.7703417122661589, 'bull_time_stop': 96, 'bull_use_sma': True, 'bull_use_ema': False, 'bull_use_atr': False, 'bull_use_adx': True, 'bull_use_spike': False, 'bull_rsi_required': True, 'bear_strategy': 'breakout', 'bear_bb_std_mult': 3.2594707399104457, 'bear_rsi_os': 47, 'bear_rsi_ob': 85, 'bear_adx_thresh': 6.139217080077512, 'bear_atr_min_pct': 0.015040345071893344, 'bear_atr_max_pct': 0.06125379433246592, 'bear_tp_mult': 1.4184299220004024, 'bear_tsl_mult': 0.10427056557893988, 'bear_time_stop': 66, 'bear_use_sma': True, 'bear_use_ema': False, 'bear_use_atr': True, 'bear_use_adx': True, 'bear_use_spike': False, 'bear_rsi_required': False, 'sideways_strategy': 'breakout', 'sideways_bb_std_mult': 3.123071879872178, 'sideways_rsi_os': 8, 'sideways_rsi_ob': 55, 'sideways_adx_thresh': 8.72262712784751, 'sideways_atr_min_pct': 0.0207412488517852, 'sideways_atr_max_pct': 0.01712996195470816, 'sideways_tp_mult': 1.1205882419827602, 'sideways_tsl_mult': 0.6998911912746001, 'sideways_time_stop': 265, 'sideways_use_sma': True, 'sideways_use_ema': True, 'sideways_use_atr': False, 'sideways_use_adx': False, 'sideways_use_spike': True, 'sideways_rsi_required': False}.
[I 2025-08-30 19:30:20,437] Trial 417 finished with values: [-1000000000.0, 1000000000.0] and parameters: {'p_sma': 38, 'p_std': 27, 'p_atr': 18, 'p_adx': 24, 'rsi_period': 48, 'ema1': 14, 'ema2': 29, 'slip_atr_k': 0.11425290636113819, 'slip_spread_k': 0.561721346322825, 'spread_hl_frac': 0.0010604631622580184, 'bb_std_mult': 3.448322175881344, 'rsi_os': 40, 'rsi_ob': 90, 'vol_spike': 0.04584696105643018, 'adx_thresh': 18.441513105940416, 'atr_min_pct': 0.0222390565250637, 'atr_max_pct': 0.1348900028082324, 'tp_mult': 2.0850890661124115, 'tsl_mult': 0.7499870712053622, 'strategy': 'breakout', 'time_stop': 42, 'use_sma': True, 'use_atr': True, 'use_adx': True, 'use_ema': False, 'use_spike': True, 'rsi_required': True, 'edge_k': 0.1556612225351934, 'edge_cap': 0.22939791451386943, 'bull_strategy': 'mean_reversion', 'bull_bb_std_mult': 0.5280415467752764, 'bull_rsi_os': 50, 'bull_rsi_ob': 71, 'bull_adx_thresh': 26.03703203156061, 'bull_atr_min_pct': 0.0024034643074938755, 'bull_atr_max_pct': 0.029873212037019856, 'bull_tp_mult': 2.4924462491785806, 'bull_tsl_mult': 0.9984478420584286, 'bull_time_stop': 169, 'bull_use_sma': True, 'bull_use_ema': False, 'bull_use_atr': False, 'bull_use_adx': True, 'bull_use_spike': False, 'bull_rsi_required': True, 'bear_strategy': 'breakout', 'bear_bb_std_mult': 3.2654268124164503, 'bear_rsi_os': 45, 'bear_rsi_ob': 87, 'bear_adx_thresh': 5.713867236462892, 'bear_atr_min_pct': 0.014940030114475289, 'bear_atr_max_pct': 0.06039745353580013, 'bear_tp_mult': 1.4853798221600907, 'bear_tsl_mult': 0.9084219130105257, 'bear_time_stop': 24, 'bear_use_sma': True, 'bear_use_ema': False, 'bear_use_atr': True, 'bear_use_adx': True, 'bear_use_spike': False, 'bear_rsi_required': False, 'sideways_strategy': 'breakout', 'sideways_bb_std_mult': 3.1186552887763868, 'sideways_rsi_os': 15, 'sideways_rsi_ob': 55, 'sideways_adx_thresh': 13.053731574341484, 'sideways_atr_min_pct': 0.01996273246178299, 'sideways_atr_max_pct': 0.025501464600786554, 'sideways_tp_mult': 1.1733900881692634, 'sideways_tsl_mult': 0.4205944881287145, 'sideways_time_stop': 272, 'sideways_use_sma': True, 'sideways_use_ema': True, 'sideways_use_atr': False, 'sideways_use_adx': False, 'sideways_use_spike': True, 'sideways_rsi_required': False}.
[I 2025-08-30 19:30:20,600] Trial 418 finished with values: [-1000000000.0, 1000000000.0] and parameters: {'p_sma': 43, 'p_std': 25, 'p_atr': 29, 'p_adx': 8, 'rsi_period': 48, 'ema1': 24, 'ema2': 30, 'slip_atr_k': 0.24996940231687856, 'slip_spread_k': 0.5317361246288741, 'spread_hl_frac': 0.0009662090637352055, 'bb_std_mult': 0.9693104697727368, 'rsi_os': 17, 'rsi_ob': 91, 'vol_spike': 0.03685935766119912, 'adx_thresh': 15.691723125311167, 'atr_min_pct': 0.02378531333597476, 'atr_max_pct': 0.13753295337250435, 'tp_mult': 2.205342098977106, 'tsl_mult': 0.09315149063946293, 'strategy': 'breakout', 'time_stop': 42, 'use_sma': True, 'use_atr': True, 'use_adx': True, 'use_ema': False, 'use_spike': True, 'rsi_required': True, 'edge_k': 0.15634116379734142, 'edge_cap': 0.21874474722617177, 'bull_strategy': 'mean_reversion', 'bull_bb_std_mult': 3.295993495253758, 'bull_rsi_os': 16, 'bull_rsi_ob': 71, 'bull_adx_thresh': 34.88433225171895, 'bull_atr_min_pct': 0.026645442208017008, 'bull_atr_max_pct': 0.030168622954864437, 'bull_tp_mult': 2.1938059405953805, 'bull_tsl_mult': 0.9970262498751832, 'bull_time_stop': 99, 'bull_use_sma': True, 'bull_use_ema': False, 'bull_use_atr': False, 'bull_use_adx': True, 'bull_use_spike': False, 'bull_rsi_required': True, 'bear_strategy': 'breakout', 'bear_bb_std_mult': 3.2665056590332413, 'bear_rsi_os': 46, 'bear_rsi_ob': 82, 'bear_adx_thresh': 28.470745790085683, 'bear_atr_min_pct': 0.014878991012660391, 'bear_atr_max_pct': 0.04887798408598187, 'bear_tp_mult': 1.7710468397336894, 'bear_tsl_mult': 0.3210109551518423, 'bear_time_stop': 66, 'bear_use_sma': True, 'bear_use_ema': False, 'bear_use_atr': True, 'bear_use_adx': True, 'bear_use_spike': True, 'bear_rsi_required': False, 'sideways_strategy': 'breakout', 'sideways_bb_std_mult': 2.098612093675161, 'sideways_rsi_os': 22, 'sideways_rsi_ob': 69, 'sideways_adx_thresh': 19.206959778477586, 'sideways_atr_min_pct': 0.019998683558227925, 'sideways_atr_max_pct': 0.12036421859682717, 'sideways_tp_mult': 1.1226784501749054, 'sideways_tsl_mult': 0.6653679547942806, 'sideways_time_stop': 97, 'sideways_use_sma': True, 'sideways_use_ema': True, 'sideways_use_atr': True, 'sideways_use_adx': False, 'sideways_use_spike': True, 'sideways_rsi_required': False}.
[I 2025-08-30 19:30:21,320] Trial 419 finished with values: [-1000000000.0, 1000000000.0] and parameters: {'p_sma': 39, 'p_std': 24, 'p_atr': 10, 'p_adx': 21, 'rsi_period': 23, 'ema1': 29, 'ema2': 18, 'slip_atr_k': 0.1933626343556229, 'slip_spread_k': 0.611553778124036, 'spread_hl_frac': 0.004448684982284236, 'bb_std_mult': 3.4175187648595724, 'rsi_os': 42, 'rsi_ob': 56, 'vol_spike': 0.037147354737428466, 'adx_thresh': 15.763858439016396, 'atr_min_pct': 0.01795065829595825, 'atr_max_pct': 0.04923748501378433, 'tp_mult': 2.089520301589965, 'tsl_mult': 0.11235261366377491, 'strategy': 'breakout', 'time_stop': 117, 'use_sma': True, 'use_atr': True, 'use_adx': True, 'use_ema': False, 'use_spike': True, 'rsi_required': True, 'edge_k': 0.00169814283067804, 'edge_cap': 0.21783503564384873, 'bull_strategy': 'mean_reversion', 'bull_bb_std_mult': 1.870276579025441, 'bull_rsi_os': 37, 'bull_rsi_ob': 72, 'bull_adx_thresh': 28.85122440966574, 'bull_atr_min_pct': 0.02683646687484299, 'bull_atr_max_pct': 0.026750799665506655, 'bull_tp_mult': 2.1895455822797327, 'bull_tsl_mult': 0.9996916842783308, 'bull_time_stop': 97, 'bull_use_sma': True, 'bull_use_ema': False, 'bull_use_atr': False, 'bull_use_adx': True, 'bull_use_spike': True, 'bull_rsi_required': True, 'bear_strategy': 'breakout', 'bear_bb_std_mult': 1.2952646006548734, 'bear_rsi_os': 34, 'bear_rsi_ob': 82, 'bear_adx_thresh': 34.98291104112873, 'bear_atr_min_pct': 0.0054546738335256376, 'bear_atr_max_pct': 0.048974363501470844, 'bear_tp_mult': 2.6332311407825326, 'bear_tsl_mult': 0.07113825222695123, 'bear_time_stop': 18, 'bear_use_sma': True, 'bear_use_ema': False, 'bear_use_atr': True, 'bear_use_adx': True, 'bear_use_spike': True, 'bear_rsi_required': False, 'sideways_strategy': 'breakout', 'sideways_bb_std_mult': 3.0780693408860156, 'sideways_rsi_os': 14, 'sideways_rsi_ob': 90, 'sideways_adx_thresh': 19.10816549885641, 'sideways_atr_min_pct': 0.019851218668814032, 'sideways_atr_max_pct': 0.025671539531172995, 'sideways_tp_mult': 1.896149032575746, 'sideways_tsl_mult': 0.6984361861168806, 'sideways_time_stop': 73, 'sideways_use_sma': True, 'sideways_use_ema': True, 'sideways_use_atr': True, 'sideways_use_adx': False, 'sideways_use_spike': False, 'sideways_rsi_required': False}.
[I 2025-08-30 19:30:55,983] Trial 420 finished with values: [-1000000000.0, 1000000000.0] and parameters: {'p_sma': 25, 'p_std': 25, 'p_atr': 11, 'p_adx': 7, 'rsi_period': 24, 'ema1': 13, 'ema2': 15, 'slip_atr_k': 0.1471550077758904, 'slip_spread_k': 0.3411348976485336, 'spread_hl_frac': 0.0006290609107237762, 'bb_std_mult': 1.1083113236346442, 'rsi_os': 40, 'rsi_ob': 91, 'vol_spike': 0.2198837237823791, 'adx_thresh': 29.934567949283984, 'atr_min_pct': 0.01714643369027829, 'atr_max_pct': 0.0541337513503789, 'tp_mult': 1.7770706884472558, 'tsl_mult': 0.0659208468703763, 'strategy': 'breakout', 'time_stop': 187, 'use_sma': True, 'use_atr': True, 'use_adx': True, 'use_ema': False, 'use_spike': True, 'rsi_required': True, 'edge_k': 0.06370143333888269, 'edge_cap': 0.3134491302304098, 'bull_strategy': 'mean_reversion', 'bull_bb_std_mult': 0.5298891712846532, 'bull_rsi_os': 41, 'bull_rsi_ob': 49, 'bull_adx_thresh': 26.22754866564017, 'bull_atr_min_pct': 0.02678462363819823, 'bull_atr_max_pct': 0.030284998414160116, 'bull_tp_mult': 2.810430909904637, 'bull_tsl_mult': 0.9668487615433816, 'bull_time_stop': 168, 'bull_use_sma': True, 'bull_use_ema': False, 'bull_use_atr': False, 'bull_use_adx': True, 'bull_use_spike': True, 'bull_rsi_required': True, 'bear_strategy': 'breakout', 'bear_bb_std_mult': 2.5246787519289304, 'bear_rsi_os': 52, 'bear_rsi_ob': 82, 'bear_adx_thresh': 28.40424599814698, 'bear_atr_min_pct': 0.014940942072948318, 'bear_atr_max_pct': 0.054142904373145284, 'bear_tp_mult': 2.753119349938842, 'bear_tsl_mult': 0.24229336755463476, 'bear_time_stop': 134, 'bear_use_sma': True, 'bear_use_ema': False, 'bear_use_atr': True, 'bear_use_adx': True, 'bear_use_spike': True, 'bear_rsi_required': True, 'sideways_strategy': 'breakout', 'sideways_bb_std_mult': 0.9502697087993495, 'sideways_rsi_os': 15, 'sideways_rsi_ob': 71, 'sideways_adx_thresh': 10.049687879074252, 'sideways_atr_min_pct': 0.020600423572328663, 'sideways_atr_max_pct': 0.12104846412062292, 'sideways_tp_mult': 2.8304666258887634, 'sideways_tsl_mult': 0.7009220525446866, 'sideways_time_stop': 272, 'sideways_use_sma': True, 'sideways_use_ema': True, 'sideways_use_atr': True, 'sideways_use_adx': False, 'sideways_use_spike': False, 'sideways_rsi_required': False}.
[I 2025-08-30 19:30:56,708] Trial 423 finished with values: [-1000000000.0, 1000000000.0] and parameters: {'p_sma': 51, 'p_std': 23, 'p_atr': 25, 'p_adx': 29, 'rsi_period': 63, 'ema1': 6, 'ema2': 15, 'slip_atr_k': 0.0065538256088865515, 'slip_spread_k': 0.30658338227504084, 'spread_hl_frac': 0.0031071615528232384, 'bb_std_mult': 2.9564752420773326, 'rsi_os': 38, 'rsi_ob': 61, 'vol_spike': 0.0768249111612668, 'adx_thresh': 17.143290347274302, 'atr_min_pct': 0.02327946276985615, 'atr_max_pct': 0.09418710981555899, 'tp_mult': 2.7915967125407755, 'tsl_mult': 0.732940597156969, 'strategy': 'breakout', 'time_stop': 187, 'use_sma': False, 'use_atr': True, 'use_adx': False, 'use_ema': False, 'use_spike': True, 'rsi_required': False, 'edge_k': 1.0854622320726335, 'edge_cap': 0.2658713236393306, 'bull_strategy': 'mean_reversion', 'bull_bb_std_mult': 1.6661074063438575, 'bull_rsi_os': 5, 'bull_rsi_ob': 60, 'bull_adx_thresh': 26.094793683263152, 'bull_atr_min_pct': 0.007011784995160111, 'bull_atr_max_pct': 0.03395066419681995, 'bull_tp_mult': 2.1459463556667906, 'bull_tsl_mult': 0.3778457086659981, 'bull_time_stop': 186, 'bull_use_sma': True, 'bull_use_ema': False, 'bull_use_atr': False, 'bull_use_adx': True, 'bull_use_spike': True, 'bull_rsi_required': True, 'bear_strategy': 'breakout', 'bear_bb_std_mult': 2.0892520411017967, 'bear_rsi_os': 42, 'bear_rsi_ob': 81, 'bear_adx_thresh': 32.830875614516806, 'bear_atr_min_pct': 0.014120942644301932, 'bear_atr_max_pct': 0.0540266179083968, 'bear_tp_mult': 1.8484488330001696, 'bear_tsl_mult': 0.21108706950125275, 'bear_time_stop': 56, 'bear_use_sma': False, 'bear_use_ema': False, 'bear_use_atr': True, 'bear_use_adx': True, 'bear_use_spike': False, 'bear_rsi_required': True, 'sideways_strategy': 'breakout', 'sideways_bb_std_mult': 1.11460307687282, 'sideways_rsi_os': 29, 'sideways_rsi_ob': 49, 'sideways_adx_thresh': 15.984082011552317, 'sideways_atr_min_pct': 0.020658545240527886, 'sideways_atr_max_pct': 0.11415664121157952, 'sideways_tp_mult': 2.8492016797949287, 'sideways_tsl_mult': 0.6981518670971443, 'sideways_time_stop': 245, 'sideways_use_sma': True, 'sideways_use_ema': True, 'sideways_use_atr': False, 'sideways_use_adx': False, 'sideways_use_spike': False, 'sideways_rsi_required': False}.
[I 2025-08-30 19:30:56,944] Trial 421 finished with values: [-1000000000.0, 1000000000.0] and parameters: {'p_sma': 43, 'p_std': 23, 'p_atr': 11, 'p_adx': 7, 'rsi_period': 63, 'ema1': 28, 'ema2': 51, 'slip_atr_k': 0.02295935426983744, 'slip_spread_k': 0.5262942886529179, 'spread_hl_frac': 0.04531975536888685, 'bb_std_mult': 1.11652183487424, 'rsi_os': 38, 'rsi_ob': 92, 'vol_spike': 0.03656859338134113, 'adx_thresh': 19.257051931786915, 'atr_min_pct': 0.02384178657030159, 'atr_max_pct': 0.053070111527594305, 'tp_mult': 1.3150125583562282, 'tsl_mult': 0.10321390844018935, 'strategy': 'breakout', 'time_stop': 117, 'use_sma': False, 'use_atr': True, 'use_adx': False, 'use_ema': False, 'use_spike': True, 'rsi_required': True, 'edge_k': 0.0025997416820350977, 'edge_cap': 0.28002011551211303, 'bull_strategy': 'mean_reversion', 'bull_bb_std_mult': 3.2901919835592865, 'bull_rsi_os': 19, 'bull_rsi_ob': 60, 'bull_adx_thresh': 32.50719706872949, 'bull_atr_min_pct': 0.006960679022521189, 'bull_atr_max_pct': 0.026571975504057484, 'bull_tp_mult': 2.799010083485777, 'bull_tsl_mult': 0.9672504825794088, 'bull_time_stop': 183, 'bull_use_sma': True, 'bull_use_ema': False, 'bull_use_atr': False, 'bull_use_adx': True, 'bull_use_spike': True, 'bull_rsi_required': True, 'bear_strategy': 'breakout', 'bear_bb_std_mult': 2.0689390381670907, 'bear_rsi_os': 52, 'bear_rsi_ob': 82, 'bear_adx_thresh': 33.014376672386405, 'bear_atr_min_pct': 0.014953834083881318, 'bear_atr_max_pct': 0.05052836139467927, 'bear_tp_mult': 1.8576273901936364, 'bear_tsl_mult': 0.2363376493648609, 'bear_time_stop': 17, 'bear_use_sma': True, 'bear_use_ema': False, 'bear_use_atr': True, 'bear_use_adx': True, 'bear_use_spike': True, 'bear_rsi_required': True, 'sideways_strategy': 'breakout', 'sideways_bb_std_mult': 1.2356639188441672, 'sideways_rsi_os': 14, 'sideways_rsi_ob': 49, 'sideways_adx_thresh': 6.31905976697961, 'sideways_atr_min_pct': 0.020618009385054967, 'sideways_atr_max_pct': 0.11997985864663308, 'sideways_tp_mult': 2.8438080858875265, 'sideways_tsl_mult': 0.5991330119812014, 'sideways_time_stop': 286, 'sideways_use_sma': True, 'sideways_use_ema': True, 'sideways_use_atr': True, 'sideways_use_adx': False, 'sideways_use_spike': False, 'sideways_rsi_required': False}.
