[I 2025-08-30 20:22:00,221] Trial 794 finished with values: [-1000000000.0, 1000000000.0] and parameters: {'p_sma': 45, 'p_std': 26, 'p_atr': 23, 'p_adx': 17, 'rsi_period': 50, 'ema1': 21, 'ema2': 50, 'slip_atr_k': 0.24945307818511625, 'slip_spread_k': 0.582773553816162, 'spread_hl_frac': 0.006740219044067162, 'bb_std_mult': 1.023711194801632, 'rsi_os': 36, 'rsi_ob': 81, 'vol_spike': 0.09538231821109083, 'adx_thresh': 25.980822631216494, 'atr_min_pct': 0.02302362376523001, 'atr_max_pct': 0.12736861683931072, 'tp_mult': 2.1713673328232956, 'tsl_mult': 0.7300493709974434, 'strategy': 'breakout', 'time_stop': 81, 'use_sma': True, 'use_atr': False, 'use_adx': False, 'use_ema': False, 'use_spike': True, 'rsi_required': False, 'edge_k': 1.7969832007219968, 'edge_cap': 0.283048318696745, 'bull_strategy': 'mean_reversion', 'bull_bb_std_mult': 1.833536240546111, 'bull_rsi_os': 51, 'bull_rsi_ob': 53, 'bull_adx_thresh': 25.932082987634324, 'bull_atr_min_pct': 0.002747063551176886, 'bull_atr_max_pct': 0.12775174942523715, 'bull_tp_mult': 2.140056889805038, 'bull_tsl_mult': 0.9680946648324923, 'bull_time_stop': 227, 'bull_use_sma': True, 'bull_use_ema': True, 'bull_use_atr': False, 'bull_use_adx': True, 'bull_use_spike': False, 'bull_rsi_required': True, 'bear_strategy': 'breakout', 'bear_bb_std_mult': 3.0760899117053677, 'bear_rsi_os': 32, 'bear_rsi_ob': 80, 'bear_adx_thresh': 34.2792112931884, 'bear_atr_min_pct': 0.007560116952832832, 'bear_atr_max_pct': 0.05772963299937972, 'bear_tp_mult': 2.618157329345557, 'bear_tsl_mult': 0.1383272920122957, 'bear_time_stop': 61, 'bear_use_sma': False, 'bear_use_ema': False, 'bear_use_atr': False, 'bear_use_adx': False, 'bear_use_spike': False, 'bear_rsi_required': False, 'sideways_strategy': 'breakout', 'sideways_bb_std_mult': 1.0938225561459634, 'sideways_rsi_os': 46, 'sideways_rsi_ob': 53, 'sideways_adx_thresh': 10.153416269577434, 'sideways_atr_min_pct': 0.020098880125689205, 'sideways_atr_max_pct': 0.04669797708033562, 'sideways_tp_mult': 2.4346978392486265, 'sideways_tsl_mult': 0.6430690562297535, 'sideways_time_stop': 285, 'sideways_use_sma': True, 'sideways_use_ema': True, 'sideways_use_atr': False, 'sideways_use_adx': False, 'sideways_use_spike': True, 'sideways_rsi_required': False}.
[I 2025-08-30 20:22:00,466] Trial 792 finished with values: [-1000000000.0, 1000000000.0] and parameters: {'p_sma': 45, 'p_std': 60, 'p_atr': 11, 'p_adx': 7, 'rsi_period': 22, 'ema1': 23, 'ema2': 50, 'slip_atr_k': 0.24930197447586122, 'slip_spread_k': 0.4907170802023979, 'spread_hl_frac': 0.0036698488029688293, 'bb_std_mult': 1.1947307452981089, 'rsi_os': 37, 'rsi_ob': 59, 'vol_spike': 0.26289300114993586, 'adx_thresh': 18.294519500950774, 'atr_min_pct': 0.02495605251023388, 'atr_max_pct': 0.07645269521673276, 'tp_mult': 1.6539717770771252, 'tsl_mult': 0.7351663491176502, 'strategy': 'breakout', 'time_stop': 37, 'use_sma': True, 'use_atr': True, 'use_adx': False, 'use_ema': False, 'use_spike': True, 'rsi_required': True, 'edge_k': 1.8933573076995915, 'edge_cap': 0.9352940227545535, 'bull_strategy': 'mean_reversion', 'bull_bb_std_mult': 1.3293008309451761, 'bull_rsi_os': 52, 'bull_rsi_ob': 70, 'bull_adx_thresh': 25.25543157470418, 'bull_atr_min_pct': 0.014905855025473551, 'bull_atr_max_pct': 0.13396279589023724, 'bull_tp_mult': 2.153933009075667, 'bull_tsl_mult': 0.6675780551973449, 'bull_time_stop': 196, 'bull_use_sma': True, 'bull_use_ema': True, 'bull_use_atr': False, 'bull_use_adx': True, 'bull_use_spike': False, 'bull_rsi_required': True, 'bear_strategy': 'breakout', 'bear_bb_std_mult': 2.393020328682724, 'bear_rsi_os': 17, 'bear_rsi_ob': 83, 'bear_adx_thresh': 34.106913077506036, 'bear_atr_min_pct': 0.0008092029867436557, 'bear_atr_max_pct': 0.06415719824302946, 'bear_tp_mult': 1.6998531195415147, 'bear_tsl_mult': 0.13644458253188538, 'bear_time_stop': 62, 'bear_use_sma': False, 'bear_use_ema': False, 'bear_use_atr': True, 'bear_use_adx': True, 'bear_use_spike': False, 'bear_rsi_required': False, 'sideways_strategy': 'breakout', 'sideways_bb_std_mult': 1.0978717595812035, 'sideways_rsi_os': 15, 'sideways_rsi_ob': 73, 'sideways_adx_thresh': 10.233028880034128, 'sideways_atr_min_pct': 0.018755723242577738, 'sideways_atr_max_pct': 0.014714520274307238, 'sideways_tp_mult': 2.31010768512972, 'sideways_tsl_mult': 0.261589930992975, 'sideways_time_stop': 215, 'sideways_use_sma': True, 'sideways_use_ema': True, 'sideways_use_atr': False, 'sideways_use_adx': False, 'sideways_use_spike': True, 'sideways_rsi_required': False}.
[I 2025-08-30 20:22:00,651] Trial 795 finished with values: [-1000000000.0, 1000000000.0] and parameters: {'p_sma': 45, 'p_std': 26, 'p_atr': 7, 'p_adx': 17, 'rsi_period': 19, 'ema1': 25, 'ema2': 50, 'slip_atr_k': 0.08806299607565311, 'slip_spread_k': 0.42815142863127376, 'spread_hl_frac': 0.0032876489190579034, 'bb_std_mult': 3.431956614568753, 'rsi_os': 54, 'rsi_ob': 89, 'vol_spike': 0.04129735612823897, 'adx_thresh': 19.736242149220658, 'atr_min_pct': 0.02422850587401765, 'atr_max_pct': 0.12836554697871289, 'tp_mult': 1.937043149571172, 'tsl_mult': 0.767635687337916, 'strategy': 'breakout', 'time_stop': 161, 'use_sma': True, 'use_atr': False, 'use_adx': False, 'use_ema': False, 'use_spike': True, 'rsi_required': False, 'edge_k': 0.15213946978687154, 'edge_cap': 0.29055062770822304, 'bull_strategy': 'mean_reversion', 'bull_bb_std_mult': 3.1581955219646183, 'bull_rsi_os': 52, 'bull_rsi_ob': 72, 'bull_adx_thresh': 25.78672486105389, 'bull_atr_min_pct': 0.025140547414113045, 'bull_atr_max_pct': 0.08693196951422538, 'bull_tp_mult': 2.157013080707156, 'bull_tsl_mult': 0.04643268107124826, 'bull_time_stop': 228, 'bull_use_sma': True, 'bull_use_ema': True, 'bull_use_atr': False, 'bull_use_adx': True, 'bull_use_spike': False, 'bull_rsi_required': True, 'bear_strategy': 'breakout', 'bear_bb_std_mult': 2.0647604841025364, 'bear_rsi_os': 28, 'bear_rsi_ob': 80, 'bear_adx_thresh': 5.687802933001425, 'bear_atr_min_pct': 0.023158392785249393, 'bear_atr_max_pct': 0.09874006549025197, 'bear_tp_mult': 1.1306302678910018, 'bear_tsl_mult': 0.13777502758099605, 'bear_time_stop': 45, 'bear_use_sma': False, 'bear_use_ema': False, 'bear_use_atr': False, 'bear_use_adx': False, 'bear_use_spike': False, 'bear_rsi_required': False, 'sideways_strategy': 'breakout', 'sideways_bb_std_mult': 1.9609213512673642, 'sideways_rsi_os': 14, 'sideways_rsi_ob': 45, 'sideways_adx_thresh': 10.249828721533436, 'sideways_atr_min_pct': 0.029115117286307717, 'sideways_atr_max_pct': 0.04668003872289511, 'sideways_tp_mult': 1.7649557872811772, 'sideways_tsl_mult': 0.6826030983922715, 'sideways_time_stop': 214, 'sideways_use_sma': True, 'sideways_use_ema': True, 'sideways_use_atr': False, 'sideways_use_adx': False, 'sideways_use_spike': True, 'sideways_rsi_required': False}.
[I 2025-08-30 20:22:00,821] Trial 793 finished with values: [-1000000000.0, 1000000000.0] and parameters: {'p_sma': 45, 'p_std': 47, 'p_atr': 11, 'p_adx': 8, 'rsi_period': 50, 'ema1': 25, 'ema2': 51, 'slip_atr_k': 0.022778273574208585, 'slip_spread_k': 0.49902651924340874, 'spread_hl_frac': 0.006800857406795301, 'bb_std_mult': 0.8196064125760809, 'rsi_os': 36, 'rsi_ob': 55, 'vol_spike': 0.08583142035154412, 'adx_thresh': 19.700835728527807, 'atr_min_pct': 0.02450369959982646, 'atr_max_pct': 0.09563066580376543, 'tp_mult': 2.178686721626369, 'tsl_mult': 0.6806141817881828, 'strategy': 'breakout', 'time_stop': 80, 'use_sma': True, 'use_atr': False, 'use_adx': False, 'use_ema': False, 'use_spike': True, 'rsi_required': True, 'edge_k': 0.16425915002705696, 'edge_cap': 0.2762272256846535, 'bull_strategy': 'mean_reversion', 'bull_bb_std_mult': 1.840146890408988, 'bull_rsi_os': 52, 'bull_rsi_ob': 71, 'bull_adx_thresh': 30.26017921526848, 'bull_atr_min_pct': 0.0032628763903296103, 'bull_atr_max_pct': 0.12827650013517758, 'bull_tp_mult': 2.147926882160368, 'bull_tsl_mult': 0.03581685520971689, 'bull_time_stop': 186, 'bull_use_sma': True, 'bull_use_ema': True, 'bull_use_atr': False, 'bull_use_adx': True, 'bull_use_spike': False, 'bull_rsi_required': True, 'bear_strategy': 'breakout', 'bear_bb_std_mult': 1.0386077741194422, 'bear_rsi_os': 44, 'bear_rsi_ob': 80, 'bear_adx_thresh': 19.940660009033387, 'bear_atr_min_pct': 0.01395183806946415, 'bear_atr_max_pct': 0.06366572508147295, 'bear_tp_mult': 1.7311197591143297, 'bear_tsl_mult': 0.38341087314701916, 'bear_time_stop': 62, 'bear_use_sma': False, 'bear_use_ema': False, 'bear_use_atr': False, 'bear_use_adx': False, 'bear_use_spike': False, 'bear_rsi_required': False, 'sideways_strategy': 'breakout', 'sideways_bb_std_mult': 3.3270812466870936, 'sideways_rsi_os': 15, 'sideways_rsi_ob': 72, 'sideways_adx_thresh': 10.236663370625834, 'sideways_atr_min_pct': 0.018918097913359827, 'sideways_atr_max_pct': 0.11679148003341777, 'sideways_tp_mult': 1.6934621129066894, 'sideways_tsl_mult': 0.8027174434536297, 'sideways_time_stop': 19, 'sideways_use_sma': True, 'sideways_use_ema': True, 'sideways_use_atr': False, 'sideways_use_adx': False, 'sideways_use_spike': True, 'sideways_rsi_required': False}.
[I 2025-08-30 20:22:35,293] Trial 797 finished with values: [-1000000000.0, 1000000000.0] and parameters: {'p_sma': 37, 'p_std': 39, 'p_atr': 7, 'p_adx': 8, 'rsi_period': 19, 'ema1': 25, 'ema2': 36, 'slip_atr_k': 0.18665997621829394, 'slip_spread_k': 0.42436593285846796, 'spread_hl_frac': 0.003123598019702246, 'bb_std_mult': 0.7909630264258503, 'rsi_os': 54, 'rsi_ob': 55, 'vol_spike': 0.07181700219634493, 'adx_thresh': 14.889062768039764, 'atr_min_pct': 0.024198028511923077, 'atr_max_pct': 0.0713982957723828, 'tp_mult': 1.9519070019815565, 'tsl_mult': 0.6885564518198829, 'strategy': 'breakout', 'time_stop': 234, 'use_sma': False, 'use_atr': False, 'use_adx': False, 'use_ema': False, 'use_spike': True, 'rsi_required': True, 'edge_k': 0.9529903803400428, 'edge_cap': 0.31327476699225887, 'bull_strategy': 'breakout', 'bull_bb_std_mult': 1.647804689236178, 'bull_rsi_os': 50, 'bull_rsi_ob': 75, 'bull_adx_thresh': 16.89133506351391, 'bull_atr_min_pct': 0.025042225327718815, 'bull_atr_max_pct': 0.018446799772316502, 'bull_tp_mult': 1.5493198436336493, 'bull_tsl_mult': 0.5021472403488008, 'bull_time_stop': 29, 'bull_use_sma': True, 'bull_use_ema': False, 'bull_use_atr': True, 'bull_use_adx': True, 'bull_use_spike': True, 'bull_rsi_required': True, 'bear_strategy': 'breakout', 'bear_bb_std_mult': 1.8771318300650095, 'bear_rsi_os': 35, 'bear_rsi_ob': 85, 'bear_adx_thresh': 12.039960605582083, 'bear_atr_min_pct': 0.016355677272201816, 'bear_atr_max_pct': 0.025932761387153086, 'bear_tp_mult': 1.129573888118073, 'bear_tsl_mult': 0.12366267775239123, 'bear_time_stop': 45, 'bear_use_sma': True, 'bear_use_ema': True, 'bear_use_atr': False, 'bear_use_adx': False, 'bear_use_spike': False, 'bear_rsi_required': False, 'sideways_strategy': 'breakout', 'sideways_bb_std_mult': 3.351326424199633, 'sideways_rsi_os': 14, 'sideways_rsi_ob': 83, 'sideways_adx_thresh': 9.317009860064145, 'sideways_atr_min_pct': 0.008100069868891127, 'sideways_atr_max_pct': 0.11527964849156405, 'sideways_tp_mult': 1.0137093630253582, 'sideways_tsl_mult': 0.7524431347946225, 'sideways_time_stop': 163, 'sideways_use_sma': True, 'sideways_use_ema': False, 'sideways_use_atr': True, 'sideways_use_adx': False, 'sideways_use_spike': False, 'sideways_rsi_required': False}.
[I 2025-08-30 20:22:35,550] Trial 799 finished with values: [-1000000000.0, 1000000000.0] and parameters: {'p_sma': 20, 'p_std': 39, 'p_atr': 10, 'p_adx': 30, 'rsi_period': 46, 'ema1': 26, 'ema2': 16, 'slip_atr_k': 0.18748653153390865, 'slip_spread_k': 0.32954238060910934, 'spread_hl_frac': 0.049036878209413465, 'bb_std_mult': 1.0565173478324414, 'rsi_os': 8, 'rsi_ob': 58, 'vol_spike': 0.275860461045324, 'adx_thresh': 16.55841941519125, 'atr_min_pct': 0.013934037452469546, 'atr_max_pct': 0.13829924689761283, 'tp_mult': 2.0650483944234854, 'tsl_mult': 0.7075210396879278, 'strategy': 'breakout', 'time_stop': 33, 'use_sma': False, 'use_atr': True, 'use_adx': False, 'use_ema': False, 'use_spike': True, 'rsi_required': True, 'edge_k': 0.14011291789342994, 'edge_cap': 0.2175911154154764, 'bull_strategy': 'breakout', 'bull_bb_std_mult': 1.7416839288492705, 'bull_rsi_os': 50, 'bull_rsi_ob': 61, 'bull_adx_thresh': 22.238933258316262, 'bull_atr_min_pct': 0.02936738708231046, 'bull_atr_max_pct': 0.03352555243990908, 'bull_tp_mult': 1.5357700283293623, 'bull_tsl_mult': 0.5041491593577092, 'bull_time_stop': 27, 'bull_use_sma': False, 'bull_use_ema': False, 'bull_use_atr': True, 'bull_use_adx': True, 'bull_use_spike': True, 'bull_rsi_required': True, 'bear_strategy': 'breakout', 'bear_bb_std_mult': 3.2629260261866637, 'bear_rsi_os': 43, 'bear_rsi_ob': 85, 'bear_adx_thresh': 11.272728437787578, 'bear_atr_min_pct': 0.016354292082894586, 'bear_atr_max_pct': 0.05304718863060621, 'bear_tp_mult': 1.7695041762511903, 'bear_tsl_mult': 0.19878140335872763, 'bear_time_stop': 39, 'bear_use_sma': True, 'bear_use_ema': True, 'bear_use_atr': True, 'bear_use_adx': True, 'bear_use_spike': False, 'bear_rsi_required': False, 'sideways_strategy': 'breakout', 'sideways_bb_std_mult': 2.0524738837470338, 'sideways_rsi_os': 36, 'sideways_rsi_ob': 60, 'sideways_adx_thresh': 9.595427636276856, 'sideways_atr_min_pct': 0.028156160438847187, 'sideways_atr_max_pct': 0.12416866098219433, 'sideways_tp_mult': 1.249627707519914, 'sideways_tsl_mult': 0.541747395392369, 'sideways_time_stop': 266, 'sideways_use_sma': True, 'sideways_use_ema': False, 'sideways_use_atr': True, 'sideways_use_adx': True, 'sideways_use_spike': False, 'sideways_rsi_required': False}.
[I 2025-08-30 20:22:35,893] Trial 798 finished with values: [-1000000000.0, 1000000000.0] and parameters: {'p_sma': 37, 'p_std': 39, 'p_atr': 10, 'p_adx': 8, 'rsi_period': 54, 'ema1': 24, 'ema2': 16, 'slip_atr_k': 0.06075772268215554, 'slip_spread_k': 0.42307384158794226, 'spread_hl_frac': 0.01734492478450737, 'bb_std_mult': 0.9162965710393034, 'rsi_os': 5, 'rsi_ob': 54, 'vol_spike': 0.012312538504159781, 'adx_thresh': 19.716014162558956, 'atr_min_pct': 0.017599908273634245, 'atr_max_pct': 0.08443751349596762, 'tp_mult': 2.0513685987182346, 'tsl_mult': 0.6875334169302121, 'strategy': 'breakout', 'time_stop': 88, 'use_sma': False, 'use_atr': True, 'use_adx': False, 'use_ema': False, 'use_spike': True, 'rsi_required': True, 'edge_k': 0.12961660770032535, 'edge_cap': 0.21699270886959685, 'bull_strategy': 'breakout', 'bull_bb_std_mult': 1.8692703047610422, 'bull_rsi_os': 50, 'bull_rsi_ob': 63, 'bull_adx_thresh': 22.219618868965366, 'bull_atr_min_pct': 0.02994195191001303, 'bull_atr_max_pct': 0.01667522822337647, 'bull_tp_mult': 2.050958595065579, 'bull_tsl_mult': 0.13447869888200265, 'bull_time_stop': 26, 'bull_use_sma': False, 'bull_use_ema': False, 'bull_use_atr': True, 'bull_use_adx': True, 'bull_use_spike': True, 'bull_rsi_required': True, 'bear_strategy': 'breakout', 'bear_bb_std_mult': 1.8791060952909264, 'bear_rsi_os': 46, 'bear_rsi_ob': 86, 'bear_adx_thresh': 11.84181070314977, 'bear_atr_min_pct': 0.014127305768337053, 'bear_atr_max_pct': 0.06692048393206995, 'bear_tp_mult': 2.850559851874112, 'bear_tsl_mult': 0.9800615730177662, 'bear_time_stop': 291, 'bear_use_sma': True, 'bear_use_ema': True, 'bear_use_atr': True, 'bear_use_adx': True, 'bear_use_spike': False, 'bear_rsi_required': False, 'sideways_strategy': 'breakout', 'sideways_bb_std_mult': 3.337969502753582, 'sideways_rsi_os': 16, 'sideways_rsi_ob': 60, 'sideways_adx_thresh': 9.171494572643972, 'sideways_atr_min_pct': 0.0203914432972511, 'sideways_atr_max_pct': 0.1170015229169298, 'sideways_tp_mult': 1.7065934240023857, 'sideways_tsl_mult': 0.48902678332925453, 'sideways_time_stop': 267, 'sideways_use_sma': True, 'sideways_use_ema': False, 'sideways_use_atr': True, 'sideways_use_adx': True, 'sideways_use_spike': False, 'sideways_rsi_required': False}.
[I 2025-08-30 20:22:36,078] Trial 796 finished with values: [-1000000000.0, 1000000000.0] and parameters: {'p_sma': 37, 'p_std': 52, 'p_atr': 15, 'p_adx': 8, 'rsi_period': 43, 'ema1': 25, 'ema2': 59, 'slip_atr_k': 0.08868064009392479, 'slip_spread_k': 0.434879371663978, 'spread_hl_frac': 0.003387165097559802, 'bb_std_mult': 0.8211304087768726, 'rsi_os': 22, 'rsi_ob': 51, 'vol_spike': 0.04253500568436349, 'adx_thresh': 19.750169799701062, 'atr_min_pct': 0.02426221774818861, 'atr_max_pct': 0.13835293946255645, 'tp_mult': 2.0705784951950297, 'tsl_mult': 0.5384521739047675, 'strategy': 'breakout', 'time_stop': 37, 'use_sma': True, 'use_atr': False, 'use_adx': False, 'use_ema': False, 'use_spike': True, 'rsi_required': True, 'edge_k': 0.15084243425785676, 'edge_cap': 0.21953732636979129, 'bull_strategy': 'mean_reversion', 'bull_bb_std_mult': 2.345805615937915, 'bull_rsi_os': 50, 'bull_rsi_ob': 85, 'bull_adx_thresh': 19.51763104766828, 'bull_atr_min_pct': 0.029427909453392437, 'bull_atr_max_pct': 0.02721550755972106, 'bull_tp_mult': 2.0702705909028536, 'bull_tsl_mult': 0.9993165340321503, 'bull_time_stop': 239, 'bull_use_sma': True, 'bull_use_ema': True, 'bull_use_atr': False, 'bull_use_adx': True, 'bull_use_spike': False, 'bull_rsi_required': True, 'bear_strategy': 'breakout', 'bear_bb_std_mult': 3.2577620445911175, 'bear_rsi_os': 43, 'bear_rsi_ob': 71, 'bear_adx_thresh': 11.360706464420632, 'bear_atr_min_pct': 0.029951007541851402, 'bear_atr_max_pct': 0.09747944745292648, 'bear_tp_mult': 1.5034835970599167, 'bear_tsl_mult': 0.40112968192478515, 'bear_time_stop': 45, 'bear_use_sma': False, 'bear_use_ema': False, 'bear_use_atr': False, 'bear_use_adx': False, 'bear_use_spike': False, 'bear_rsi_required': False, 'sideways_strategy': 'breakout', 'sideways_bb_std_mult': 3.3623219713633112, 'sideways_rsi_os': 37, 'sideways_rsi_ob': 45, 'sideways_adx_thresh': 9.581419166605627, 'sideways_atr_min_pct': 0.008167152317792213, 'sideways_atr_max_pct': 0.11643411909511658, 'sideways_tp_mult': 1.621746199059688, 'sideways_tsl_mult': 0.4881404992589857, 'sideways_time_stop': 5, 'sideways_use_sma': True, 'sideways_use_ema': True, 'sideways_use_atr': False, 'sideways_use_adx': False, 'sideways_use_spike': True, 'sideways_rsi_required': False}.
[I 2025-08-30 20:23:09,609] Trial 800 finished with values: [-1000000000.0, 1000000000.0] and parameters: {'p_sma': 44, 'p_std': 52, 'p_atr': 30, 'p_adx': 16, 'rsi_period': 35, 'ema1': 24, 'ema2': 16, 'slip_atr_k': 0.21889171084917916, 'slip_spread_k': 0.28595297966324296, 'spread_hl_frac': 0.017337224891126993, 'bb_std_mult': 1.6236707699559456, 'rsi_os': 38, 'rsi_ob': 57, 'vol_spike': 0.29903136768402716, 'adx_thresh': 16.548471991392994, 'atr_min_pct': 0.000959253219623318, 'atr_max_pct': 0.016675919384783036, 'tp_mult': 2.12483552257984, 'tsl_mult': 0.705751528722529, 'strategy': 'breakout', 'time_stop': 51, 'use_sma': False, 'use_atr': True, 'use_adx': False, 'use_ema': False, 'use_spike': True, 'rsi_required': True, 'edge_k': 1.417049086802082, 'edge_cap': 0.21796796474574154, 'bull_strategy': 'breakout', 'bull_bb_std_mult': 1.921971506910914, 'bull_rsi_os': 41, 'bull_rsi_ob': 86, 'bull_adx_thresh': 22.254173847215835, 'bull_atr_min_pct': 0.002319382319456208, 'bull_atr_max_pct': 0.021961006670517313, 'bull_tp_mult': 2.0605433237880857, 'bull_tsl_mult': 0.9624620812361409, 'bull_time_stop': 188, 'bull_use_sma': False, 'bull_use_ema': False, 'bull_use_atr': False, 'bull_use_adx': True, 'bull_use_spike': True, 'bull_rsi_required': True, 'bear_strategy': 'breakout', 'bear_bb_std_mult': 2.843303286783236, 'bear_rsi_os': 46, 'bear_rsi_ob': 71, 'bear_adx_thresh': 6.197454320717354, 'bear_atr_min_pct': 0.014124630336109126, 'bear_atr_max_pct': 0.06641134174525377, 'bear_tp_mult': 2.8602569911275633, 'bear_tsl_mult': 0.45766484256460155, 'bear_time_stop': 38, 'bear_use_sma': True, 'bear_use_ema': False, 'bear_use_atr': True, 'bear_use_adx': True, 'bear_use_spike': True, 'bear_rsi_required': False, 'sideways_strategy': 'breakout', 'sideways_bb_std_mult': 2.15894143450881, 'sideways_rsi_os': 16, 'sideways_rsi_ob': 61, 'sideways_adx_thresh': 8.446518210199345, 'sideways_atr_min_pct': 0.02138046441064935, 'sideways_atr_max_pct': 0.12477909956100551, 'sideways_tp_mult': 1.4391639797587223, 'sideways_tsl_mult': 0.4241994216706033, 'sideways_time_stop': 267, 'sideways_use_sma': True, 'sideways_use_ema': False, 'sideways_use_atr': False, 'sideways_use_adx': True, 'sideways_use_spike': False, 'sideways_rsi_required': False}.
