[I 2025-08-30 19:25:04,358] Trial 380 finished with values: [-1000000000.0, 1000000000.0] and parameters: {'p_sma': 39, 'p_std': 36, 'p_atr': 13, 'p_adx': 26, 'rsi_period': 53, 'ema1': 18, 'ema2': 15, 'slip_atr_k': 0.006781772441362372, 'slip_spread_k': 0.9566640219791744, 'spread_hl_frac': 0.015958677289329044, 'bb_std_mult': 2.3668052268214566, 'rsi_os': 38, 'rsi_ob': 57, 'vol_spike': 0.054139687156394105, 'adx_thresh': 12.76691558969803, 'atr_min_pct': 0.024578373651589703, 'atr_max_pct': 0.13338370606478267, 'tp_mult': 2.11243022166299, 'tsl_mult': 0.7071278080970759, 'strategy': 'breakout', 'time_stop': 87, 'use_sma': False, 'use_atr': True, 'use_adx': False, 'use_ema': False, 'use_spike': False, 'rsi_required': True, 'edge_k': 1.4565291817382375, 'edge_cap': 0.08036766943491197, 'bull_strategy': 'mean_reversion', 'bull_bb_std_mult': 1.7081326428662993, 'bull_rsi_os': 13, 'bull_rsi_ob': 70, 'bull_adx_thresh': 15.374760329731682, 'bull_atr_min_pct': 0.02865656743548579, 'bull_atr_max_pct': 0.028845148611506565, 'bull_tp_mult': 2.4314753591532723, 'bull_tsl_mult': 0.9752229837326496, 'bull_time_stop': 278, 'bull_use_sma': True, 'bull_use_ema': False, 'bull_use_atr': False, 'bull_use_adx': True, 'bull_use_spike': True, 'bull_rsi_required': True, 'bear_strategy': 'breakout', 'bear_bb_std_mult': 3.352220253013185, 'bear_rsi_os': 42, 'bear_rsi_ob': 92, 'bear_adx_thresh': 6.680275482662178, 'bear_atr_min_pct': 0.023108600157176296, 'bear_atr_max_pct': 0.04460506398046748, 'bear_tp_mult': 1.80028623342839, 'bear_tsl_mult': 0.13091771501795088, 'bear_time_stop': 37, 'bear_use_sma': True, 'bear_use_ema': False, 'bear_use_atr': True, 'bear_use_adx': True, 'bear_use_spike': False, 'bear_rsi_required': False, 'sideways_strategy': 'breakout', 'sideways_bb_std_mult': 2.6905371749926728, 'sideways_rsi_os': 18, 'sideways_rsi_ob': 58, 'sideways_adx_thresh': 31.679479986504234, 'sideways_atr_min_pct': 0.017953962669047693, 'sideways_atr_max_pct': 0.11302311767936882, 'sideways_tp_mult': 2.738192828560158, 'sideways_tsl_mult': 0.6334564294126518, 'sideways_time_stop': 147, 'sideways_use_sma': True, 'sideways_use_ema': True, 'sideways_use_atr': True, 'sideways_use_adx': False, 'sideways_use_spike': True, 'sideways_rsi_required': False}.
[I 2025-08-30 19:25:05,125] Trial 378 finished with values: [-1000000000.0, 1000000000.0] and parameters: {'p_sma': 8, 'p_std': 25, 'p_atr': 13, 'p_adx': 18, 'rsi_period': 59, 'ema1': 10, 'ema2': 17, 'slip_atr_k': 0.008230869523384891, 'slip_spread_k': 0.2603846692372005, 'spread_hl_frac': 0.0023929783862381604, 'bb_std_mult': 0.8615682754956557, 'rsi_os': 30, 'rsi_ob': 57, 'vol_spike': 0.04717260611042703, 'adx_thresh': 5.361613137822516, 'atr_min_pct': 0.02451585919795393, 'atr_max_pct': 0.13290735969186723, 'tp_mult': 2.6811418118265755, 'tsl_mult': 0.5672317192697957, 'strategy': 'breakout', 'time_stop': 27, 'use_sma': False, 'use_atr': False, 'use_adx': False, 'use_ema': False, 'use_spike': True, 'rsi_required': True, 'edge_k': 1.4578444025913804, 'edge_cap': 0.2560317040814932, 'bull_strategy': 'mean_reversion', 'bull_bb_std_mult': 1.7332144049483704, 'bull_rsi_os': 13, 'bull_rsi_ob': 74, 'bull_adx_thresh': 23.60841306787726, 'bull_atr_min_pct': 0.004702365184528286, 'bull_atr_max_pct': 0.027712779375547794, 'bull_tp_mult': 2.3178026470893998, 'bull_tsl_mult': 0.9587220409316854, 'bull_time_stop': 162, 'bull_use_sma': True, 'bull_use_ema': False, 'bull_use_atr': False, 'bull_use_adx': True, 'bull_use_spike': True, 'bull_rsi_required': True, 'bear_strategy': 'breakout', 'bear_bb_std_mult': 3.340454420014981, 'bear_rsi_os': 42, 'bear_rsi_ob': 84, 'bear_adx_thresh': 6.523961826590086, 'bear_atr_min_pct': 0.011880849292072747, 'bear_atr_max_pct': 0.056562913769484545, 'bear_tp_mult': 1.6840906047852944, 'bear_tsl_mult': 0.13475147283109165, 'bear_time_stop': 35, 'bear_use_sma': True, 'bear_use_ema': False, 'bear_use_atr': True, 'bear_use_adx': True, 'bear_use_spike': False, 'bear_rsi_required': False, 'sideways_strategy': 'breakout', 'sideways_bb_std_mult': 1.9331684771695756, 'sideways_rsi_os': 26, 'sideways_rsi_ob': 47, 'sideways_adx_thresh': 8.951583711949388, 'sideways_atr_min_pct': 0.01767288665377617, 'sideways_atr_max_pct': 0.11338422868055076, 'sideways_tp_mult': 1.924138660239339, 'sideways_tsl_mult': 0.7845828751738904, 'sideways_time_stop': 144, 'sideways_use_sma': True, 'sideways_use_ema': True, 'sideways_use_atr': False, 'sideways_use_adx': False, 'sideways_use_spike': True, 'sideways_rsi_required': True}.
[I 2025-08-30 19:25:05,212] Trial 379 finished with values: [-1000000000.0, 1000000000.0] and parameters: {'p_sma': 39, 'p_std': 26, 'p_atr': 13, 'p_adx': 28, 'rsi_period': 52, 'ema1': 25, 'ema2': 46, 'slip_atr_k': 0.18260361104720885, 'slip_spread_k': 0.9568380524376628, 'spread_hl_frac': 0.004711232506469516, 'bb_std_mult': 0.852253069428259, 'rsi_os': 30, 'rsi_ob': 60, 'vol_spike': 0.082156177833271, 'adx_thresh': 14.959611373827695, 'atr_min_pct': 0.024518566483328282, 'atr_max_pct': 0.13360892158763124, 'tp_mult': 2.1132361893783704, 'tsl_mult': 0.5629761506218017, 'strategy': 'breakout', 'time_stop': 27, 'use_sma': False, 'use_atr': False, 'use_adx': False, 'use_ema': False, 'use_spike': True, 'rsi_required': True, 'edge_k': 1.4571748479507183, 'edge_cap': 0.25680748209616944, 'bull_strategy': 'mean_reversion', 'bull_bb_std_mult': 1.7068086422575848, 'bull_rsi_os': 49, 'bull_rsi_ob': 74, 'bull_adx_thresh': 24.178398008170166, 'bull_atr_min_pct': 0.004818943599588187, 'bull_atr_max_pct': 0.017015546121241336, 'bull_tp_mult': 2.203614394570652, 'bull_tsl_mult': 0.9632648620679117, 'bull_time_stop': 194, 'bull_use_sma': True, 'bull_use_ema': False, 'bull_use_atr': False, 'bull_use_adx': True, 'bull_use_spike': True, 'bull_rsi_required': True, 'bear_strategy': 'breakout', 'bear_bb_std_mult': 3.330822739060668, 'bear_rsi_os': 25, 'bear_rsi_ob': 84, 'bear_adx_thresh': 5.000370263779287, 'bear_atr_min_pct': 0.026627820439317162, 'bear_atr_max_pct': 0.043333160958844374, 'bear_tp_mult': 1.9651021566298177, 'bear_tsl_mult': 0.5253177461101387, 'bear_time_stop': 164, 'bear_use_sma': True, 'bear_use_ema': False, 'bear_use_atr': True, 'bear_use_adx': True, 'bear_use_spike': False, 'bear_rsi_required': False, 'sideways_strategy': 'breakout', 'sideways_bb_std_mult': 1.1632673470776893, 'sideways_rsi_os': 17, 'sideways_rsi_ob': 56, 'sideways_adx_thresh': 31.552503339385666, 'sideways_atr_min_pct': 0.017577351447773552, 'sideways_atr_max_pct': 0.11487615459853374, 'sideways_tp_mult': 2.3869182069535757, 'sideways_tsl_mult': 0.11161567271290623, 'sideways_time_stop': 212, 'sideways_use_sma': True, 'sideways_use_ema': True, 'sideways_use_atr': False, 'sideways_use_adx': False, 'sideways_use_spike': True, 'sideways_rsi_required': True}.
[I 2025-08-30 19:25:36,867] Trial 383 finished with values: [-1000000000.0, 1000000000.0] and parameters: {'p_sma': 49, 'p_std': 41, 'p_atr': 19, 'p_adx': 7, 'rsi_period': 51, 'ema1': 8, 'ema2': 47, 'slip_atr_k': 0.02769160548644104, 'slip_spread_k': 0.44582229684233854, 'spread_hl_frac': 0.004483808699765714, 'bb_std_mult': 2.7434060140870784, 'rsi_os': 39, 'rsi_ob': 60, 'vol_spike': 0.04335373773759276, 'adx_thresh': 22.770673931150156, 'atr_min_pct': 0.002681351095543098, 'atr_max_pct': 0.11824983061181958, 'tp_mult': 2.1736237121013184, 'tsl_mult': 0.9425008432847386, 'strategy': 'mean_reversion', 'time_stop': 290, 'use_sma': False, 'use_atr': True, 'use_adx': False, 'use_ema': True, 'use_spike': True, 'rsi_required': True, 'edge_k': 0.050411525603285226, 'edge_cap': 0.539207950752312, 'bull_strategy': 'mean_reversion', 'bull_bb_std_mult': 2.076699643338191, 'bull_rsi_os': 49, 'bull_rsi_ob': 92, 'bull_adx_thresh': 24.34374137529936, 'bull_atr_min_pct': 0.02775259136335593, 'bull_atr_max_pct': 0.03206245977907204, 'bull_tp_mult': 2.154244147166369, 'bull_tsl_mult': 0.5279150229537174, 'bull_time_stop': 180, 'bull_use_sma': False, 'bull_use_ema': True, 'bull_use_atr': True, 'bull_use_adx': True, 'bull_use_spike': False, 'bull_rsi_required': False, 'bear_strategy': 'mean_reversion', 'bear_bb_std_mult': 3.15493315977767, 'bear_rsi_os': 29, 'bear_rsi_ob': 81, 'bear_adx_thresh': 5.502101143414654, 'bear_atr_min_pct': 0.014840489420841223, 'bear_atr_max_pct': 0.05127019703065516, 'bear_tp_mult': 1.8339027821780294, 'bear_tsl_mult': 0.10525838798246197, 'bear_time_stop': 294, 'bear_use_sma': True, 'bear_use_ema': True, 'bear_use_atr': False, 'bear_use_adx': False, 'bear_use_spike': False, 'bear_rsi_required': True, 'sideways_strategy': 'mean_reversion', 'sideways_bb_std_mult': 2.1596629762122275, 'sideways_rsi_os': 17, 'sideways_rsi_ob': 72, 'sideways_adx_thresh': 14.64374714103895, 'sideways_atr_min_pct': 0.02038050809645963, 'sideways_atr_max_pct': 0.1197253101932258, 'sideways_tp_mult': 1.5446886405305698, 'sideways_tsl_mult': 0.7046125561397883, 'sideways_time_stop': 45, 'sideways_use_sma': False, 'sideways_use_ema': False, 'sideways_use_atr': False, 'sideways_use_adx': True, 'sideways_use_spike': False, 'sideways_rsi_required': False}.
[I 2025-08-30 19:25:37,121] Trial 384 finished with values: [-1000000000.0, 1000000000.0] and parameters: {'p_sma': 41, 'p_std': 41, 'p_atr': 22, 'p_adx': 7, 'rsi_period': 51, 'ema1': 27, 'ema2': 42, 'slip_atr_k': 0.022968273866506763, 'slip_spread_k': 0.4010023799103066, 'spread_hl_frac': 0.020436122421743422, 'bb_std_mult': 0.9504467198824713, 'rsi_os': 36, 'rsi_ob': 94, 'vol_spike': 0.2937125632748485, 'adx_thresh': 9.216491202464812, 'atr_min_pct': 0.022346889229634747, 'atr_max_pct': 0.09183973396265635, 'tp_mult': 1.5172519755528782, 'tsl_mult': 0.8903536468440495, 'strategy': 'mean_reversion', 'time_stop': 226, 'use_sma': False, 'use_atr': True, 'use_adx': True, 'use_ema': True, 'use_spike': True, 'rsi_required': True, 'edge_k': 0.049059265321515805, 'edge_cap': 0.05076462098974033, 'bull_strategy': 'mean_reversion', 'bull_bb_std_mult': 2.0897981148371843, 'bull_rsi_os': 20, 'bull_rsi_ob': 72, 'bull_adx_thresh': 25.78620261173101, 'bull_atr_min_pct': 0.0025592094648612725, 'bull_atr_max_pct': 0.032367323211720055, 'bull_tp_mult': 2.260364323328197, 'bull_tsl_mult': 0.7428696949621145, 'bull_time_stop': 180, 'bull_use_sma': False, 'bull_use_ema': True, 'bull_use_atr': True, 'bull_use_adx': False, 'bull_use_spike': False, 'bull_rsi_required': False, 'bear_strategy': 'mean_reversion', 'bear_bb_std_mult': 2.6828538543009772, 'bear_rsi_os': 14, 'bear_rsi_ob': 49, 'bear_adx_thresh': 11.424969653729818, 'bear_atr_min_pct': 0.01371963504618229, 'bear_atr_max_pct': 0.06768707362242828, 'bear_tp_mult': 1.828469094165172, 'bear_tsl_mult': 0.10672587037365089, 'bear_time_stop': 43, 'bear_use_sma': True, 'bear_use_ema': True, 'bear_use_atr': False, 'bear_use_adx': False, 'bear_use_spike': False, 'bear_rsi_required': True, 'sideways_strategy': 'mean_reversion', 'sideways_bb_std_mult': 2.152285676870072, 'sideways_rsi_os': 46, 'sideways_rsi_ob': 62, 'sideways_adx_thresh': 30.428131066865753, 'sideways_atr_min_pct': 0.021304945233749904, 'sideways_atr_max_pct': 0.12009395509121727, 'sideways_tp_mult': 1.727900216683721, 'sideways_tsl_mult': 0.2752719431451927, 'sideways_time_stop': 47, 'sideways_use_sma': False, 'sideways_use_ema': False, 'sideways_use_atr': False, 'sideways_use_adx': True, 'sideways_use_spike': False, 'sideways_rsi_required': False}.
[I 2025-08-30 19:25:38,094] Trial 382 finished with values: [-1000000000.0, 1000000000.0] and parameters: {'p_sma': 8, 'p_std': 25, 'p_atr': 10, 'p_adx': 7, 'rsi_period': 27, 'ema1': 8, 'ema2': 42, 'slip_atr_k': 0.023843873899908802, 'slip_spread_k': 0.4032781905819245, 'spread_hl_frac': 0.002775810637516145, 'bb_std_mult': 3.1675320437230097, 'rsi_os': 5, 'rsi_ob': 94, 'vol_spike': 0.228894202143123, 'adx_thresh': 34.38846940105024, 'atr_min_pct': 0.011937763572261412, 'atr_max_pct': 0.06185056896977558, 'tp_mult': 2.3622889285957838, 'tsl_mult': 0.7021500694462571, 'strategy': 'breakout', 'time_stop': 29, 'use_sma': False, 'use_atr': True, 'use_adx': False, 'use_ema': True, 'use_spike': True, 'rsi_required': True, 'edge_k': 0.04512255571656856, 'edge_cap': 0.2324416658081085, 'bull_strategy': 'mean_reversion', 'bull_bb_std_mult': 2.939235789893049, 'bull_rsi_os': 48, 'bull_rsi_ob': 93, 'bull_adx_thresh': 24.10501384552016, 'bull_atr_min_pct': 0.029999726873767445, 'bull_atr_max_pct': 0.0315608388689627, 'bull_tp_mult': 2.2706768665627215, 'bull_tsl_mult': 0.31355032362437507, 'bull_time_stop': 164, 'bull_use_sma': False, 'bull_use_ema': True, 'bull_use_atr': True, 'bull_use_adx': True, 'bull_use_spike': False, 'bull_rsi_required': True, 'bear_strategy': 'mean_reversion', 'bear_bb_std_mult': 3.3013108328831646, 'bear_rsi_os': 23, 'bear_rsi_ob': 81, 'bear_adx_thresh': 5.52726202822457, 'bear_atr_min_pct': 0.014796460221691258, 'bear_atr_max_pct': 0.05618124394099416, 'bear_tp_mult': 1.693811996547278, 'bear_tsl_mult': 0.15196690860073722, 'bear_time_stop': 291, 'bear_use_sma': True, 'bear_use_ema': True, 'bear_use_atr': False, 'bear_use_adx': False, 'bear_use_spike': False, 'bear_rsi_required': True, 'sideways_strategy': 'mean_reversion', 'sideways_bb_std_mult': 0.7147489600177928, 'sideways_rsi_os': 17, 'sideways_rsi_ob': 56, 'sideways_adx_thresh': 13.663701090077083, 'sideways_atr_min_pct': 0.02129863290681252, 'sideways_atr_max_pct': 0.12041212088682558, 'sideways_tp_mult': 2.238900178110731, 'sideways_tsl_mult': 0.28152233705528784, 'sideways_time_stop': 134, 'sideways_use_sma': False, 'sideways_use_ema': True, 'sideways_use_atr': False, 'sideways_use_adx': True, 'sideways_use_spike': True, 'sideways_rsi_required': False}.
[I 2025-08-30 19:25:38,298] Trial 381 finished with values: [-1000000000.0, 1000000000.0] and parameters: {'p_sma': 39, 'p_std': 25, 'p_atr': 9, 'p_adx': 26, 'rsi_period': 11, 'ema1': 8, 'ema2': 15, 'slip_atr_k': 0.2231708966309088, 'slip_spread_k': 0.25279922990598325, 'spread_hl_frac': 0.0279599379224755, 'bb_std_mult': 0.9637166835220886, 'rsi_os': 38, 'rsi_ob': 55, 'vol_spike': 0.04572214127134827, 'adx_thresh': 9.040926571655708, 'atr_min_pct': 0.011987999131081775, 'atr_max_pct': 0.13577985848541727, 'tp_mult': 2.161460555067479, 'tsl_mult': 0.9454428523730727, 'strategy': 'breakout', 'time_stop': 128, 'use_sma': False, 'use_atr': True, 'use_adx': False, 'use_ema': False, 'use_spike': True, 'rsi_required': True, 'edge_k': 0.8098044294817303, 'edge_cap': 0.23267792962950587, 'bull_strategy': 'mean_reversion', 'bull_bb_std_mult': 2.0661901617841574, 'bull_rsi_os': 48, 'bull_rsi_ob': 85, 'bull_adx_thresh': 25.645539432308425, 'bull_atr_min_pct': 0.023563298704273424, 'bull_atr_max_pct': 0.01797565336691426, 'bull_tp_mult': 2.43497808577158, 'bull_tsl_mult': 0.7428134685125849, 'bull_time_stop': 10, 'bull_use_sma': False, 'bull_use_ema': True, 'bull_use_atr': True, 'bull_use_adx': True, 'bull_use_spike': True, 'bull_rsi_required': True, 'bear_strategy': 'mean_reversion', 'bear_bb_std_mult': 3.3402468338873192, 'bear_rsi_os': 25, 'bear_rsi_ob': 83, 'bear_adx_thresh': 18.41399270266695, 'bear_atr_min_pct': 0.0005153042501470778, 'bear_atr_max_pct': 0.0442223920451902, 'bear_tp_mult': 1.9751047680753337, 'bear_tsl_mult': 0.13309537208211758, 'bear_time_stop': 39, 'bear_use_sma': True, 'bear_use_ema': True, 'bear_use_atr': True, 'bear_use_adx': True, 'bear_use_spike': False, 'bear_rsi_required': True, 'sideways_strategy': 'breakout', 'sideways_bb_std_mult': 2.1320140750718513, 'sideways_rsi_os': 53, 'sideways_rsi_ob': 47, 'sideways_adx_thresh': 13.735367353106609, 'sideways_atr_min_pct': 0.021406856078851753, 'sideways_atr_max_pct': 0.11874217151003244, 'sideways_tp_mult': 1.9357138070155024, 'sideways_tsl_mult': 0.7901918542200335, 'sideways_time_stop': 47, 'sideways_use_sma': False, 'sideways_use_ema': True, 'sideways_use_atr': False, 'sideways_use_adx': True, 'sideways_use_spike': True, 'sideways_rsi_required': False}.
[I 2025-08-30 19:26:14,795] Trial 385 finished with values: [-1000000000.0, 1000000000.0] and parameters: {'p_sma': 41, 'p_std': 38, 'p_atr': 22, 'p_adx': 8, 'rsi_period': 27, 'ema1': 17, 'ema2': 20, 'slip_atr_k': 0.022007012289899458, 'slip_spread_k': 0.21245608006098715, 'spread_hl_frac': 0.007295388482097376, 'bb_std_mult': 0.9100718400509363, 'rsi_os': 36, 'rsi_ob': 49, 'vol_spike': 0.093319303509289, 'adx_thresh': 8.852880321815915, 'atr_min_pct': 0.00929440184263243, 'atr_max_pct': 0.13655917500903808, 'tp_mult': 2.5111049572025506, 'tsl_mult': 0.7457437039074544, 'strategy': 'breakout', 'time_stop': 238, 'use_sma': False, 'use_atr': True, 'use_adx': True, 'use_ema': False, 'use_spike': True, 'rsi_required': True, 'edge_k': 0.08740242975136514, 'edge_cap': 0.23102744254397015, 'bull_strategy': 'mean_reversion', 'bull_bb_std_mult': 2.947387881320946, 'bull_rsi_os': 48, 'bull_rsi_ob': 72, 'bull_adx_thresh': 25.79834399222738, 'bull_atr_min_pct': 0.01716075962124835, 'bull_atr_max_pct': 0.11038149479189634, 'bull_tp_mult': 1.526122107664231, 'bull_tsl_mult': 0.7422842488180161, 'bull_time_stop': 9, 'bull_use_sma': False, 'bull_use_ema': True, 'bull_use_atr': True, 'bull_use_adx': False, 'bull_use_spike': True, 'bull_rsi_required': True, 'bear_strategy': 'mean_reversion', 'bear_bb_std_mult': 2.1901122683255605, 'bear_rsi_os': 41, 'bear_rsi_ob': 83, 'bear_adx_thresh': 11.742315847491618, 'bear_atr_min_pct': 0.013971174869961564, 'bear_atr_max_pct': 0.07761715289425117, 'bear_tp_mult': 1.7781033548039935, 'bear_tsl_mult': 0.1518921039179914, 'bear_time_stop': 42, 'bear_use_sma': True, 'bear_use_ema': True, 'bear_use_atr': False, 'bear_use_adx': False, 'bear_use_spike': False, 'bear_rsi_required': True, 'sideways_strategy': 'breakout', 'sideways_bb_std_mult': 0.6911336651527944, 'sideways_rsi_os': 13, 'sideways_rsi_ob': 61, 'sideways_adx_thresh': 8.333107074976557, 'sideways_atr_min_pct': 0.021425025263950122, 'sideways_atr_max_pct': 0.0307790587467153, 'sideways_tp_mult': 2.9461459089034507, 'sideways_tsl_mult': 0.6527947134255612, 'sideways_time_stop': 284, 'sideways_use_sma': False, 'sideways_use_ema': True, 'sideways_use_atr': False, 'sideways_use_adx': True, 'sideways_use_spike': False, 'sideways_rsi_required': False}.
[I 2025-08-30 19:26:15,405] Trial 386 finished with values: [-0.021065974100307194, 0.02100490402171012] and parameters: {'p_sma': 53, 'p_std': 5, 'p_atr': 9, 'p_adx': 8, 'rsi_period': 20, 'ema1': 23, 'ema2': 17, 'slip_atr_k': 0.022194884660358384, 'slip_spread_k': 0.4373682796734647, 'spread_hl_frac': 0.007010147687107649, 'bb_std_mult': 1.1176902806422506, 'rsi_os': 38, 'rsi_ob': 69, 'vol_spike': 0.03465615093624404, 'adx_thresh': 11.599693507055719, 'atr_min_pct': 0.012166096265636764, 'atr_max_pct': 0.032332813662987056, 'tp_mult': 2.241813776120097, 'tsl_mult': 0.7038259682245571, 'strategy': 'breakout', 'time_stop': 18, 'use_sma': False, 'use_atr': True, 'use_adx': False, 'use_ema': False, 'use_spike': True, 'rsi_required': True, 'edge_k': 1.5237082405831128, 'edge_cap': 0.425259007348652, 'bull_strategy': 'mean_reversion', 'bull_bb_std_mult': 2.7469310088469028, 'bull_rsi_os': 33, 'bull_rsi_ob': 71, 'bull_adx_thresh': 25.88111164416109, 'bull_atr_min_pct': 0.0026244539171269266, 'bull_atr_max_pct': 0.06998208756129078, 'bull_tp_mult': 2.6933411712289903, 'bull_tsl_mult': 0.27850844376247463, 'bull_time_stop': 9, 'bull_use_sma': True, 'bull_use_ema': False, 'bull_use_atr': False, 'bull_use_adx': True, 'bull_use_spike': True, 'bull_rsi_required': True, 'bear_strategy': 'breakout', 'bear_bb_std_mult': 1.1271938889525337, 'bear_rsi_os': 41, 'bear_rsi_ob': 83, 'bear_adx_thresh': 7.108295715207391, 'bear_atr_min_pct': 0.017503071634543, 'bear_atr_max_pct': 0.07806142489015246, 'bear_tp_mult': 1.5766756532376167, 'bear_tsl_mult': 0.8076508944212031, 'bear_time_stop': 58, 'bear_use_sma': True, 'bear_use_ema': False, 'bear_use_atr': True, 'bear_use_adx': True, 'bear_use_spike': False, 'bear_rsi_required': False, 'sideways_strategy': 'breakout', 'sideways_bb_std_mult': 1.9889588704791958, 'sideways_rsi_os': 41, 'sideways_rsi_ob': 76, 'sideways_adx_thresh': 8.149629664602303, 'sideways_atr_min_pct': 0.016140569924485655, 'sideways_atr_max_pct': 0.08381753198112855, 'sideways_tp_mult': 1.8191736702302534, 'sideways_tsl_mult': 0.7254020146958053, 'sideways_time_stop': 286, 'sideways_use_sma': True, 'sideways_use_ema': True, 'sideways_use_atr': False, 'sideways_use_adx': False, 'sideways_use_spike': False, 'sideways_rsi_required': False}.
