[I 2025-08-30 20:24:24,055] Trial 809 finished with values: [-1000000000.0, 1000000000.0] and parameters: {'p_sma': 33, 'p_std': 25, 'p_atr': 26, 'p_adx': 8, 'rsi_period': 51, 'ema1': 26, 'ema2': 41, 'slip_atr_k': 0.03616349895477229, 'slip_spread_k': 0.5466136651742108, 'spread_hl_frac': 0.04461603764721384, 'bb_std_mult': 0.9699392826348541, 'rsi_os': 7, 'rsi_ob': 92, 'vol_spike': 0.018837481627000486, 'adx_thresh': 19.139398932845495, 'atr_min_pct': 0.0033262054242283283, 'atr_max_pct': 0.04373919732328072, 'tp_mult': 2.19776062112375, 'tsl_mult': 0.22978376281564872, 'strategy': 'breakout', 'time_stop': 30, 'use_sma': False, 'use_atr': True, 'use_adx': False, 'use_ema': False, 'use_spike': True, 'rsi_required': True, 'edge_k': 0.8310512522173078, 'edge_cap': 0.15183916040777412, 'bull_strategy': 'mean_reversion', 'bull_bb_std_mult': 1.2448089891598408, 'bull_rsi_os': 8, 'bull_rsi_ob': 48, 'bull_adx_thresh': 27.97280016994197, 'bull_atr_min_pct': 0.006319329683400361, 'bull_atr_max_pct': 0.026890240021314526, 'bull_tp_mult': 1.3465450923766693, 'bull_tsl_mult': 0.936992852960505, 'bull_time_stop': 182, 'bull_use_sma': True, 'bull_use_ema': False, 'bull_use_atr': True, 'bull_use_adx': True, 'bull_use_spike': True, 'bull_rsi_required': True, 'bear_strategy': 'breakout', 'bear_bb_std_mult': 3.152771443246491, 'bear_rsi_os': 44, 'bear_rsi_ob': 84, 'bear_adx_thresh': 10.249915932298164, 'bear_atr_min_pct': 0.015793039621035083, 'bear_atr_max_pct': 0.053777812714285986, 'bear_tp_mult': 2.767559317621879, 'bear_tsl_mult': 0.532433262155413, 'bear_time_stop': 246, 'bear_use_sma': True, 'bear_use_ema': True, 'bear_use_atr': True, 'bear_use_adx': True, 'bear_use_spike': False, 'bear_rsi_required': False, 'sideways_strategy': 'breakout', 'sideways_bb_std_mult': 1.6755264646108174, 'sideways_rsi_os': 12, 'sideways_rsi_ob': 65, 'sideways_adx_thresh': 6.3923944492659786, 'sideways_atr_min_pct': 0.019665469782245485, 'sideways_atr_max_pct': 0.09160690269264249, 'sideways_tp_mult': 1.7558382412709097, 'sideways_tsl_mult': 0.6571631475296352, 'sideways_time_stop': 204, 'sideways_use_sma': True, 'sideways_use_ema': True, 'sideways_use_atr': True, 'sideways_use_adx': False, 'sideways_use_spike': False, 'sideways_rsi_required': False}.
[I 2025-08-30 20:24:24,358] Trial 810 finished with values: [-1000000000.0, 1000000000.0] and parameters: {'p_sma': 11, 'p_std': 22, 'p_atr': 26, 'p_adx': 14, 'rsi_period': 61, 'ema1': 23, 'ema2': 60, 'slip_atr_k': 0.16026910064680672, 'slip_spread_k': 0.38771631765801307, 'spread_hl_frac': 0.0051983200514986744, 'bb_std_mult': 1.0594283336751624, 'rsi_os': 51, 'rsi_ob': 95, 'vol_spike': 0.030040646916167077, 'adx_thresh': 19.03691901476748, 'atr_min_pct': 0.00842441783940158, 'atr_max_pct': 0.04751328660783805, 'tp_mult': 2.1976231233097114, 'tsl_mult': 0.714932912861731, 'strategy': 'breakout', 'time_stop': 28, 'use_sma': True, 'use_atr': True, 'use_adx': False, 'use_ema': False, 'use_spike': True, 'rsi_required': True, 'edge_k': 0.3156867943992677, 'edge_cap': 0.18820410850997268, 'bull_strategy': 'mean_reversion', 'bull_bb_std_mult': 1.9769142959454882, 'bull_rsi_os': 14, 'bull_rsi_ob': 92, 'bull_adx_thresh': 25.410968327827, 'bull_atr_min_pct': 0.021769337243135026, 'bull_atr_max_pct': 0.07055319348815332, 'bull_tp_mult': 2.1201939477585268, 'bull_tsl_mult': 0.7982614490377267, 'bull_time_stop': 12, 'bull_use_sma': True, 'bull_use_ema': False, 'bull_use_atr': True, 'bull_use_adx': True, 'bull_use_spike': True, 'bull_rsi_required': True, 'bear_strategy': 'breakout', 'bear_bb_std_mult': 2.2579020859600183, 'bear_rsi_os': 44, 'bear_rsi_ob': 64, 'bear_adx_thresh': 14.444341258858724, 'bear_atr_min_pct': 0.0037207994446590564, 'bear_atr_max_pct': 0.040829556560496964, 'bear_tp_mult': 2.240434173406938, 'bear_tsl_mult': 0.682232996135532, 'bear_time_stop': 50, 'bear_use_sma': True, 'bear_use_ema': True, 'bear_use_atr': True, 'bear_use_adx': True, 'bear_use_spike': False, 'bear_rsi_required': False, 'sideways_strategy': 'breakout', 'sideways_bb_std_mult': 1.6583513168517305, 'sideways_rsi_os': 16, 'sideways_rsi_ob': 59, 'sideways_adx_thresh': 21.32256577406554, 'sideways_atr_min_pct': 0.007341238828366328, 'sideways_atr_max_pct': 0.10831016786576032, 'sideways_tp_mult': 1.7646779182500647, 'sideways_tsl_mult': 0.6769968988072607, 'sideways_time_stop': 138, 'sideways_use_sma': True, 'sideways_use_ema': True, 'sideways_use_atr': True, 'sideways_use_adx': False, 'sideways_use_spike': False, 'sideways_rsi_required': False}.
[I 2025-08-30 20:24:24,615] Trial 811 finished with values: [-1000000000.0, 1000000000.0] and parameters: {'p_sma': 33, 'p_std': 25, 'p_atr': 9, 'p_adx': 22, 'rsi_period': 56, 'ema1': 19, 'ema2': 40, 'slip_atr_k': 0.16859332343244435, 'slip_spread_k': 0.2353134302168698, 'spread_hl_frac': 0.03916110797010459, 'bb_std_mult': 2.1759779604432428, 'rsi_os': 42, 'rsi_ob': 91, 'vol_spike': 0.018396426136999145, 'adx_thresh': 18.644729592463683, 'atr_min_pct': 0.0261800420674682, 'atr_max_pct': 0.13522762199289706, 'tp_mult': 1.011089506647557, 'tsl_mult': 0.23019526448992778, 'strategy': 'breakout', 'time_stop': 31, 'use_sma': True, 'use_atr': False, 'use_adx': False, 'use_ema': False, 'use_spike': True, 'rsi_required': True, 'edge_k': 1.0511909706314715, 'edge_cap': 0.19694411843808474, 'bull_strategy': 'mean_reversion', 'bull_bb_std_mult': 1.9793299695401618, 'bull_rsi_os': 8, 'bull_rsi_ob': 81, 'bull_adx_thresh': 25.488391258226283, 'bull_atr_min_pct': 0.003992220487660538, 'bull_atr_max_pct': 0.02337483862833408, 'bull_tp_mult': 1.259368082512539, 'bull_tsl_mult': 0.843467149547142, 'bull_time_stop': 66, 'bull_use_sma': True, 'bull_use_ema': True, 'bull_use_atr': True, 'bull_use_adx': True, 'bull_use_spike': False, 'bull_rsi_required': True, 'bear_strategy': 'breakout', 'bear_bb_std_mult': 3.22336169806654, 'bear_rsi_os': 44, 'bear_rsi_ob': 59, 'bear_adx_thresh': 10.37893463590623, 'bear_atr_min_pct': 0.014748318133745943, 'bear_atr_max_pct': 0.0590711508444077, 'bear_tp_mult': 2.74800013142756, 'bear_tsl_mult': 0.16277729757113976, 'bear_time_stop': 126, 'bear_use_sma': False, 'bear_use_ema': True, 'bear_use_atr': False, 'bear_use_adx': False, 'bear_use_spike': False, 'bear_rsi_required': False, 'sideways_strategy': 'breakout', 'sideways_bb_std_mult': 1.986529798023312, 'sideways_rsi_os': 15, 'sideways_rsi_ob': 59, 'sideways_adx_thresh': 31.290084845485058, 'sideways_atr_min_pct': 0.022174149811255327, 'sideways_atr_max_pct': 0.10752463038867037, 'sideways_tp_mult': 1.7753802755401906, 'sideways_tsl_mult': 0.6745868632134714, 'sideways_time_stop': 284, 'sideways_use_sma': True, 'sideways_use_ema': True, 'sideways_use_atr': True, 'sideways_use_adx': False, 'sideways_use_spike': True, 'sideways_rsi_required': False}.
[I 2025-08-30 20:24:57,229] Trial 816 finished with values: [-1000000000.0, 1000000000.0] and parameters: {'p_sma': 8, 'p_std': 26, 'p_atr': 11, 'p_adx': 26, 'rsi_period': 30, 'ema1': 22, 'ema2': 44, 'slip_atr_k': 0.09947411418698879, 'slip_spread_k': 0.7902145091756929, 'spread_hl_frac': 0.012443737977895953, 'bb_std_mult': 0.885439471928471, 'rsi_os': 39, 'rsi_ob': 59, 'vol_spike': 0.0362594765135579, 'adx_thresh': 17.890368767835426, 'atr_min_pct': 0.015174058608507783, 'atr_max_pct': 0.1404704056413614, 'tp_mult': 1.8634854610371776, 'tsl_mult': 0.7704854157084298, 'strategy': 'breakout', 'time_stop': 141, 'use_sma': False, 'use_atr': True, 'use_adx': True, 'use_ema': False, 'use_spike': True, 'rsi_required': True, 'edge_k': 0.03859654047830821, 'edge_cap': 0.24991411000149966, 'bull_strategy': 'breakout', 'bull_bb_std_mult': 3.393798803118461, 'bull_rsi_os': 51, 'bull_rsi_ob': 57, 'bull_adx_thresh': 26.086732828775656, 'bull_atr_min_pct': 0.002613047166308532, 'bull_atr_max_pct': 0.09872732417640545, 'bull_tp_mult': 2.1886215998369978, 'bull_tsl_mult': 0.9104734269378094, 'bull_time_stop': 196, 'bull_use_sma': False, 'bull_use_ema': False, 'bull_use_atr': False, 'bull_use_adx': True, 'bull_use_spike': True, 'bull_rsi_required': True, 'bear_strategy': 'breakout', 'bear_bb_std_mult': 3.2911005003027385, 'bear_rsi_os': 43, 'bear_rsi_ob': 88, 'bear_adx_thresh': 6.717000267948777, 'bear_atr_min_pct': 0.011261326152736163, 'bear_atr_max_pct': 0.06150935111461695, 'bear_tp_mult': 1.7776088165218145, 'bear_tsl_mult': 0.1367141335757701, 'bear_time_stop': 299, 'bear_use_sma': True, 'bear_use_ema': False, 'bear_use_atr': True, 'bear_use_adx': True, 'bear_use_spike': False, 'bear_rsi_required': False, 'sideways_strategy': 'breakout', 'sideways_bb_std_mult': 2.716462032899056, 'sideways_rsi_os': 18, 'sideways_rsi_ob': 79, 'sideways_adx_thresh': 14.471407489305811, 'sideways_atr_min_pct': 0.0201059286661113, 'sideways_atr_max_pct': 0.12210712035142178, 'sideways_tp_mult': 2.203923572603159, 'sideways_tsl_mult': 0.639768282772396, 'sideways_time_stop': 294, 'sideways_use_sma': True, 'sideways_use_ema': False, 'sideways_use_atr': False, 'sideways_use_adx': True, 'sideways_use_spike': False, 'sideways_rsi_required': False}.
[I 2025-08-30 20:24:57,588] Trial 815 finished with values: [-1000000000.0, 1000000000.0] and parameters: {'p_sma': 57, 'p_std': 26, 'p_atr': 9, 'p_adx': 29, 'rsi_period': 51, 'ema1': 20, 'ema2': 25, 'slip_atr_k': 0.12857325868296687, 'slip_spread_k': 0.675869720275764, 'spread_hl_frac': 0.0037647829266774235, 'bb_std_mult': 0.9206703700410626, 'rsi_os': 28, 'rsi_ob': 56, 'vol_spike': 0.036308094009123236, 'adx_thresh': 34.81801027378047, 'atr_min_pct': 0.029979666832203503, 'atr_max_pct': 0.1368264061681755, 'tp_mult': 2.142178409944818, 'tsl_mult': 0.8748244028544041, 'strategy': 'breakout', 'time_stop': 35, 'use_sma': False, 'use_atr': False, 'use_adx': False, 'use_ema': False, 'use_spike': True, 'rsi_required': True, 'edge_k': 1.9588209312277787, 'edge_cap': 0.24466547721600268, 'bull_strategy': 'mean_reversion', 'bull_bb_std_mult': 1.738641004505436, 'bull_rsi_os': 49, 'bull_rsi_ob': 72, 'bull_adx_thresh': 7.109773490288177, 'bull_atr_min_pct': 0.004106919167728165, 'bull_atr_max_pct': 0.04985329967432732, 'bull_tp_mult': 2.259324211200423, 'bull_tsl_mult': 0.8559190867486611, 'bull_time_stop': 194, 'bull_use_sma': False, 'bull_use_ema': True, 'bull_use_atr': False, 'bull_use_adx': True, 'bull_use_spike': False, 'bull_rsi_required': True, 'bear_strategy': 'breakout', 'bear_bb_std_mult': 1.6878625682508324, 'bear_rsi_os': 43, 'bear_rsi_ob': 87, 'bear_adx_thresh': 26.22429289816619, 'bear_atr_min_pct': 0.014798438986856496, 'bear_atr_max_pct': 0.059013447136121236, 'bear_tp_mult': 2.305084003188366, 'bear_tsl_mult': 0.23737283928715047, 'bear_time_stop': 29, 'bear_use_sma': False, 'bear_use_ema': False, 'bear_use_atr': False, 'bear_use_adx': False, 'bear_use_spike': False, 'bear_rsi_required': False, 'sideways_strategy': 'breakout', 'sideways_bb_std_mult': 2.931843799779474, 'sideways_rsi_os': 14, 'sideways_rsi_ob': 51, 'sideways_adx_thresh': 10.757145101448144, 'sideways_atr_min_pct': 0.02233329171959178, 'sideways_atr_max_pct': 0.12165038106137828, 'sideways_tp_mult': 2.8331223852038114, 'sideways_tsl_mult': 0.1671116232217731, 'sideways_time_stop': 272, 'sideways_use_sma': True, 'sideways_use_ema': False, 'sideways_use_atr': False, 'sideways_use_adx': True, 'sideways_use_spike': True, 'sideways_rsi_required': False}.
[I 2025-08-30 20:24:58,208] Trial 813 finished with values: [-1000000000.0, 1000000000.0] and parameters: {'p_sma': 44, 'p_std': 25, 'p_atr': 11, 'p_adx': 7, 'rsi_period': 51, 'ema1': 22, 'ema2': 42, 'slip_atr_k': 0.1677961121154698, 'slip_spread_k': 0.7971985533118486, 'spread_hl_frac': 0.04057311559388804, 'bb_std_mult': 1.0588918199618236, 'rsi_os': 39, 'rsi_ob': 58, 'vol_spike': 0.016766600171263437, 'adx_thresh': 15.84966449527003, 'atr_min_pct': 0.0034276716480951524, 'atr_max_pct': 0.1358028648146998, 'tp_mult': 2.1865492311520827, 'tsl_mult': 0.8740863267550552, 'strategy': 'breakout', 'time_stop': 32, 'use_sma': False, 'use_atr': True, 'use_adx': False, 'use_ema': False, 'use_spike': True, 'rsi_required': True, 'edge_k': 1.2235462431502349, 'edge_cap': 0.2455215651900661, 'bull_strategy': 'mean_reversion', 'bull_bb_std_mult': 1.946955671524746, 'bull_rsi_os': 19, 'bull_rsi_ob': 68, 'bull_adx_thresh': 25.328967037740114, 'bull_atr_min_pct': 0.022088782255979954, 'bull_atr_max_pct': 0.06421317727543845, 'bull_tp_mult': 1.3606800282258515, 'bull_tsl_mult': 0.9095634100543125, 'bull_time_stop': 194, 'bull_use_sma': False, 'bull_use_ema': False, 'bull_use_atr': False, 'bull_use_adx': True, 'bull_use_spike': True, 'bull_rsi_required': True, 'bear_strategy': 'breakout', 'bear_bb_std_mult': 3.251156978135386, 'bear_rsi_os': 44, 'bear_rsi_ob': 84, 'bear_adx_thresh': 14.566476601179783, 'bear_atr_min_pct': 0.014679974562437777, 'bear_atr_max_pct': 0.05378984853039105, 'bear_tp_mult': 1.7807092298437002, 'bear_tsl_mult': 0.25060753588741924, 'bear_time_stop': 31, 'bear_use_sma': True, 'bear_use_ema': False, 'bear_use_atr': True, 'bear_use_adx': True, 'bear_use_spike': False, 'bear_rsi_required': False, 'sideways_strategy': 'breakout', 'sideways_bb_std_mult': 2.012223201316254, 'sideways_rsi_os': 18, 'sideways_rsi_ob': 75, 'sideways_adx_thresh': 16.36755552065783, 'sideways_atr_min_pct': 0.01997811744803412, 'sideways_atr_max_pct': 0.12166731561020136, 'sideways_tp_mult': 2.099164274000543, 'sideways_tsl_mult': 0.8663725367714665, 'sideways_time_stop': 225, 'sideways_use_sma': True, 'sideways_use_ema': True, 'sideways_use_atr': False, 'sideways_use_adx': True, 'sideways_use_spike': False, 'sideways_rsi_required': False}.
[I 2025-08-30 20:24:58,295] Trial 814 finished with values: [-1000000000.0, 1000000000.0] and parameters: {'p_sma': 46, 'p_std': 26, 'p_atr': 9, 'p_adx': 22, 'rsi_period': 51, 'ema1': 25, 'ema2': 15, 'slip_atr_k': 0.16082288679230036, 'slip_spread_k': 0.24241789246254453, 'spread_hl_frac': 0.005928720502289077, 'bb_std_mult': 1.0799912496020596, 'rsi_os': 39, 'rsi_ob': 59, 'vol_spike': 0.03785046083092256, 'adx_thresh': 17.936389934737775, 'atr_min_pct': 0.023098521464793822, 'atr_max_pct': 0.1359284095971148, 'tp_mult': 1.8585882457173715, 'tsl_mult': 0.863194343575098, 'strategy': 'breakout', 'time_stop': 34, 'use_sma': True, 'use_atr': True, 'use_adx': False, 'use_ema': False, 'use_spike': True, 'rsi_required': True, 'edge_k': 1.5711609389471364, 'edge_cap': 0.2439248065224241, 'bull_strategy': 'mean_reversion', 'bull_bb_std_mult': 1.9837336714891372, 'bull_rsi_os': 55, 'bull_rsi_ob': 81, 'bull_adx_thresh': 25.711658427196486, 'bull_atr_min_pct': 0.003547281505296764, 'bull_atr_max_pct': 0.019772644915719943, 'bull_tp_mult': 2.103508165270521, 'bull_tsl_mult': 0.6000405615402455, 'bull_time_stop': 190, 'bull_use_sma': False, 'bull_use_ema': False, 'bull_use_atr': False, 'bull_use_adx': True, 'bull_use_spike': True, 'bull_rsi_required': True, 'bear_strategy': 'breakout', 'bear_bb_std_mult': 2.6420104466161014, 'bear_rsi_os': 25, 'bear_rsi_ob': 78, 'bear_adx_thresh': 6.714839516331447, 'bear_atr_min_pct': 0.0143895478552153, 'bear_atr_max_pct': 0.058865223522866036, 'bear_tp_mult': 2.212603480918544, 'bear_tsl_mult': 0.12181601307522688, 'bear_time_stop': 29, 'bear_use_sma': True, 'bear_use_ema': False, 'bear_use_atr': True, 'bear_use_adx': True, 'bear_use_spike': False, 'bear_rsi_required': False, 'sideways_strategy': 'breakout', 'sideways_bb_std_mult': 2.02433176983546, 'sideways_rsi_os': 15, 'sideways_rsi_ob': 81, 'sideways_adx_thresh': 31.149539007557543, 'sideways_atr_min_pct': 0.014661303591322008, 'sideways_atr_max_pct': 0.12234472217029538, 'sideways_tp_mult': 1.1566316582854794, 'sideways_tsl_mult': 0.8794558502803139, 'sideways_time_stop': 284, 'sideways_use_sma': True, 'sideways_use_ema': True, 'sideways_use_atr': False, 'sideways_use_adx': True, 'sideways_use_spike': True, 'sideways_rsi_required': False}.
[I 2025-08-30 20:25:32,954] Trial 819 finished with values: [-1000000000.0, 1000000000.0] and parameters: {'p_sma': 10, 'p_std': 44, 'p_atr': 10, 'p_adx': 28, 'rsi_period': 48, 'ema1': 10, 'ema2': 57, 'slip_atr_k': 0.2390894700601503, 'slip_spread_k': 0.41000393127172724, 'spread_hl_frac': 0.0009822186900898186, 'bb_std_mult': 2.706064226221832, 'rsi_os': 36, 'rsi_ob': 59, 'vol_spike': 0.04489565212238868, 'adx_thresh': 30.760629407134413, 'atr_min_pct': 0.021454119567028435, 'atr_max_pct': 0.13310796960001853, 'tp_mult': 2.264699756371228, 'tsl_mult': 0.7293623211267314, 'strategy': 'breakout', 'time_stop': 175, 'use_sma': False, 'use_atr': True, 'use_adx': False, 'use_ema': False, 'use_spike': True, 'rsi_required': True, 'edge_k': 0.7671718572369584, 'edge_cap': 0.43181795593868166, 'bull_strategy': 'breakout', 'bull_bb_std_mult': 2.457262252113963, 'bull_rsi_os': 49, 'bull_rsi_ob': 71, 'bull_adx_thresh': 24.895479045870736, 'bull_atr_min_pct': 0.0011950876594183806, 'bull_atr_max_pct': 0.01929184666330251, 'bull_tp_mult': 1.4496149546067283, 'bull_tsl_mult': 0.9542336163304084, 'bull_time_stop': 188, 'bull_use_sma': True, 'bull_use_ema': False, 'bull_use_atr': False, 'bull_use_adx': False, 'bull_use_spike': True, 'bull_rsi_required': True, 'bear_strategy': 'breakout', 'bear_bb_std_mult': 3.3898077254391716, 'bear_rsi_os': 21, 'bear_rsi_ob': 78, 'bear_adx_thresh': 23.23597360791438, 'bear_atr_min_pct': 0.028510764411099628, 'bear_atr_max_pct': 0.11145280714423109, 'bear_tp_mult': 1.8857912411883544, 'bear_tsl_mult': 0.9518727025367781, 'bear_time_stop': 235, 'bear_use_sma': True, 'bear_use_ema': False, 'bear_use_atr': True, 'bear_use_adx': True, 'bear_use_spike': True, 'bear_rsi_required': True, 'sideways_strategy': 'mean_reversion', 'sideways_bb_std_mult': 2.0550258073863095, 'sideways_rsi_os': 38, 'sideways_rsi_ob': 54, 'sideways_adx_thresh': 9.706392480529919, 'sideways_atr_min_pct': 0.014546459852785536, 'sideways_atr_max_pct': 0.11873681820659084, 'sideways_tp_mult': 1.671059107448408, 'sideways_tsl_mult': 0.7298728823767257, 'sideways_time_stop': 279, 'sideways_use_sma': False, 'sideways_use_ema': True, 'sideways_use_atr': False, 'sideways_use_adx': False, 'sideways_use_spike': False, 'sideways_rsi_required': True}.
[I 2025-08-30 20:25:33,149] Trial 817 finished with values: [-1000000000.0, 1000000000.0] and parameters: {'p_sma': 26, 'p_std': 27, 'p_atr': 11, 'p_adx': 7, 'rsi_period': 68, 'ema1': 10, 'ema2': 25, 'slip_atr_k': 0.12778632772040194, 'slip_spread_k': 0.4019476176466398, 'spread_hl_frac': 0.004026290105244673, 'bb_std_mult': 1.0401808846350895, 'rsi_os': 37, 'rsi_ob': 56, 'vol_spike': 0.04508976370335217, 'adx_thresh': 6.266304173446766, 'atr_min_pct': 0.02155541144444336, 'atr_max_pct': 0.13255349786115922, 'tp_mult': 1.1033972995861292, 'tsl_mult': 0.4300162051911632, 'strategy': 'breakout', 'time_stop': 37, 'use_sma': False, 'use_atr': True, 'use_adx': False, 'use_ema': False, 'use_spike': True, 'rsi_required': True, 'edge_k': 1.2287965590097307, 'edge_cap': 0.5794106071970411, 'bull_strategy': 'mean_reversion', 'bull_bb_std_mult': 1.7593017938311268, 'bull_rsi_os': 54, 'bull_rsi_ob': 72, 'bull_adx_thresh': 6.395926323614592, 'bull_atr_min_pct': 0.026634781163794762, 'bull_atr_max_pct': 0.02007486912152521, 'bull_tp_mult': 2.2746011449295893, 'bull_tsl_mult': 0.9503565730425011, 'bull_time_stop': 191, 'bull_use_sma': False, 'bull_use_ema': False, 'bull_use_atr': False, 'bull_use_adx': True, 'bull_use_spike': True, 'bull_rsi_required': True, 'bear_strategy': 'breakout', 'bear_bb_std_mult': 1.7048632099261964, 'bear_rsi_os': 46, 'bear_rsi_ob': 84, 'bear_adx_thresh': 26.09351143912867, 'bear_atr_min_pct': 0.014733546658217913, 'bear_atr_max_pct': 0.11093452690244507, 'bear_tp_mult': 1.712217933843382, 'bear_tsl_mult': 0.2584745511456743, 'bear_time_stop': 13, 'bear_use_sma': True, 'bear_use_ema': False, 'bear_use_atr': True, 'bear_use_adx': True, 'bear_use_spike': False, 'bear_rsi_required': True, 'sideways_strategy': 'mean_reversion', 'sideways_bb_std_mult': 2.067368140539172, 'sideways_rsi_os': 21, 'sideways_rsi_ob': 54, 'sideways_adx_thresh': 16.673416122754727, 'sideways_atr_min_pct': 0.02609527478797688, 'sideways_atr_max_pct': 0.03702068818818624, 'sideways_tp_mult': 1.8278887808245885, 'sideways_tsl_mult': 0.880458002776527, 'sideways_time_stop': 272, 'sideways_use_sma': False, 'sideways_use_ema': True, 'sideways_use_atr': False, 'sideways_use_adx': True, 'sideways_use_spike': False, 'sideways_rsi_required': True}.
