[I 2025-08-30 18:59:28,812] Trial 189 finished with values: [-1000000000.0, 1000000000.0] and parameters: {'p_sma': 42, 'p_std': 9, 'p_atr': 11, 'p_adx': 8, 'rsi_period': 54, 'ema1': 19, 'ema2': 13, 'slip_atr_k': 0.016881194573492807, 'slip_spread_k': 0.3660390057861976, 'spread_hl_frac': 0.02174809532938436, 'bb_std_mult': 2.535789700436152, 'rsi_os': 51, 'rsi_ob': 57, 'vol_spike': 0.036927050171846845, 'adx_thresh': 23.418514885432067, 'atr_min_pct': 0.014938585278390626, 'atr_max_pct': 0.07046171321103764, 'tp_mult': 2.9988658385988956, 'tsl_mult': 0.8916495670504986, 'strategy': 'mean_reversion', 'time_stop': 40, 'use_sma': False, 'use_atr': True, 'use_adx': False, 'use_ema': False, 'use_spike': True, 'rsi_required': True, 'edge_k': 0.209561483235958, 'edge_cap': 0.591319508349876, 'bull_strategy': 'mean_reversion', 'bull_bb_std_mult': 0.6393705583344123, 'bull_rsi_os': 49, 'bull_rsi_ob': 84, 'bull_adx_thresh': 30.767751623427817, 'bull_atr_min_pct': 7.261737002551769e-05, 'bull_atr_max_pct': 0.05448570596090868, 'bull_tp_mult': 2.6497681390606793, 'bull_tsl_mult': 0.9557504084084993, 'bull_time_stop': 89, 'bull_use_sma': True, 'bull_use_ema': False, 'bull_use_atr': False, 'bull_use_adx': False, 'bull_use_spike': True, 'bull_rsi_required': True, 'bear_strategy': 'breakout', 'bear_bb_std_mult': 3.4315305353998937, 'bear_rsi_os': 45, 'bear_rsi_ob': 79, 'bear_adx_thresh': 27.966857718477293, 'bear_atr_min_pct': 0.014807482721571267, 'bear_atr_max_pct': 0.06206050791378143, 'bear_tp_mult': 1.7552276306579881, 'bear_tsl_mult': 0.34795536953145645, 'bear_time_stop': 250, 'bear_use_sma': True, 'bear_use_ema': False, 'bear_use_atr': False, 'bear_use_adx': False, 'bear_use_spike': False, 'bear_rsi_required': False, 'sideways_strategy': 'mean_reversion', 'sideways_bb_std_mult': 2.383243779766856, 'sideways_rsi_os': 17, 'sideways_rsi_ob': 57, 'sideways_adx_thresh': 8.98430415871232, 'sideways_atr_min_pct': 0.012337009112400358, 'sideways_atr_max_pct': 0.12139128870444592, 'sideways_tp_mult': 1.845648539941802, 'sideways_tsl_mult': 0.6363768670529787, 'sideways_time_stop': 269, 'sideways_use_sma': True, 'sideways_use_ema': True, 'sideways_use_atr': False, 'sideways_use_adx': False, 'sideways_use_spike': False, 'sideways_rsi_required': False}.
[I 2025-08-30 18:59:28,882] Trial 190 finished with values: [-1000000000.0, 1000000000.0] and parameters: {'p_sma': 43, 'p_std': 28, 'p_atr': 9, 'p_adx': 9, 'rsi_period': 53, 'ema1': 10, 'ema2': 16, 'slip_atr_k': 0.00721071371705736, 'slip_spread_k': 0.7109584110164539, 'spread_hl_frac': 0.03916558452337182, 'bb_std_mult': 3.4527843078318927, 'rsi_os': 51, 'rsi_ob': 55, 'vol_spike': 0.2938023904728526, 'adx_thresh': 18.98029697927148, 'atr_min_pct': 0.0067354190178972855, 'atr_max_pct': 0.13827646248388817, 'tp_mult': 1.378816337151247, 'tsl_mult': 0.8751313245365728, 'strategy': 'mean_reversion', 'time_stop': 79, 'use_sma': False, 'use_atr': True, 'use_adx': False, 'use_ema': False, 'use_spike': True, 'rsi_required': True, 'edge_k': 0.06701672304146045, 'edge_cap': 0.6666438946671125, 'bull_strategy': 'mean_reversion', 'bull_bb_std_mult': 0.8939015430308428, 'bull_rsi_os': 49, 'bull_rsi_ob': 58, 'bull_adx_thresh': 17.703760121363842, 'bull_atr_min_pct': 0.012338329741999308, 'bull_atr_max_pct': 0.024241704225995454, 'bull_tp_mult': 2.2098506746608857, 'bull_tsl_mult': 0.7830029026304356, 'bull_time_stop': 176, 'bull_use_sma': True, 'bull_use_ema': False, 'bull_use_atr': False, 'bull_use_adx': False, 'bull_use_spike': True, 'bull_rsi_required': True, 'bear_strategy': 'breakout', 'bear_bb_std_mult': 3.117556306286629, 'bear_rsi_os': 12, 'bear_rsi_ob': 79, 'bear_adx_thresh': 29.1948038070918, 'bear_atr_min_pct': 0.016703739774244768, 'bear_atr_max_pct': 0.04747628826135396, 'bear_tp_mult': 2.6224490490411996, 'bear_tsl_mult': 0.35105955994677174, 'bear_time_stop': 249, 'bear_use_sma': True, 'bear_use_ema': False, 'bear_use_atr': False, 'bear_use_adx': False, 'bear_use_spike': False, 'bear_rsi_required': False, 'sideways_strategy': 'breakout', 'sideways_bb_std_mult': 2.6536952112327747, 'sideways_rsi_os': 24, 'sideways_rsi_ob': 60, 'sideways_adx_thresh': 8.8905335769464, 'sideways_atr_min_pct': 0.020694646994822125, 'sideways_atr_max_pct': 0.12076910682927526, 'sideways_tp_mult': 2.319842830697235, 'sideways_tsl_mult': 0.5986407557965386, 'sideways_time_stop': 268, 'sideways_use_sma': True, 'sideways_use_ema': True, 'sideways_use_atr': False, 'sideways_use_adx': False, 'sideways_use_spike': False, 'sideways_rsi_required': False}.
[I 2025-08-30 18:59:57,776] Trial 191 finished with values: [-1000000000.0, 1000000000.0] and parameters: {'p_sma': 34, 'p_std': 28, 'p_atr': 12, 'p_adx': 8, 'rsi_period': 10, 'ema1': 24, 'ema2': 16, 'slip_atr_k': 0.20050216986360964, 'slip_spread_k': 0.3658636119972261, 'spread_hl_frac': 0.0019625828691614703, 'bb_std_mult': 0.97522153672757, 'rsi_os': 39, 'rsi_ob': 55, 'vol_spike': 0.1963909157840512, 'adx_thresh': 5.9930300869587825, 'atr_min_pct': 0.01264595254481847, 'atr_max_pct': 0.10291069424834935, 'tp_mult': 2.092495482757917, 'tsl_mult': 0.8239377510841196, 'strategy': 'mean_reversion', 'time_stop': 37, 'use_sma': False, 'use_atr': True, 'use_adx': True, 'use_ema': True, 'use_spike': True, 'rsi_required': True, 'edge_k': 1.200256743556821, 'edge_cap': 0.258499117617356, 'bull_strategy': 'mean_reversion', 'bull_bb_std_mult': 0.8901737147285824, 'bull_rsi_os': 48, 'bull_rsi_ob': 88, 'bull_adx_thresh': 17.457828360291636, 'bull_atr_min_pct': 0.0039364145997103465, 'bull_atr_max_pct': 0.023627067654739816, 'bull_tp_mult': 2.2093460484630354, 'bull_tsl_mult': 0.7763015582167632, 'bull_time_stop': 175, 'bull_use_sma': True, 'bull_use_ema': False, 'bull_use_atr': False, 'bull_use_adx': False, 'bull_use_spike': False, 'bull_rsi_required': True, 'bear_strategy': 'breakout', 'bear_bb_std_mult': 3.1130343007823833, 'bear_rsi_os': 39, 'bear_rsi_ob': 79, 'bear_adx_thresh': 27.850236027392143, 'bear_atr_min_pct': 0.013100504699561803, 'bear_atr_max_pct': 0.14966175174363008, 'bear_tp_mult': 1.8497368314779252, 'bear_tsl_mult': 0.7026380358945878, 'bear_time_stop': 41, 'bear_use_sma': True, 'bear_use_ema': True, 'bear_use_atr': False, 'bear_use_adx': False, 'bear_use_spike': False, 'bear_rsi_required': False, 'sideways_strategy': 'breakout', 'sideways_bb_std_mult': 2.1430505009238625, 'sideways_rsi_os': 24, 'sideways_rsi_ob': 79, 'sideways_adx_thresh': 32.6886558726355, 'sideways_atr_min_pct': 0.023502273510566836, 'sideways_atr_max_pct': 0.12047151171897146, 'sideways_tp_mult': 1.850224426113936, 'sideways_tsl_mult': 0.04938775234533632, 'sideways_time_stop': 5, 'sideways_use_sma': False, 'sideways_use_ema': False, 'sideways_use_atr': False, 'sideways_use_adx': False, 'sideways_use_spike': False, 'sideways_rsi_required': False}.
[I 2025-08-30 18:59:58,194] Trial 192 finished with values: [-1000000000.0, 1000000000.0] and parameters: {'p_sma': 43, 'p_std': 28, 'p_atr': 23, 'p_adx': 18, 'rsi_period': 31, 'ema1': 10, 'ema2': 13, 'slip_atr_k': 0.006775566771858407, 'slip_spread_k': 0.6635072071569708, 'spread_hl_frac': 0.017213431137379286, 'bb_std_mult': 1.0631440739593472, 'rsi_os': 33, 'rsi_ob': 55, 'vol_spike': 0.0379627133468167, 'adx_thresh': 17.653425308206174, 'atr_min_pct': 0.0006244552558036486, 'atr_max_pct': 0.06956798121257164, 'tp_mult': 2.097557619563132, 'tsl_mult': 0.7192244710893544, 'strategy': 'mean_reversion', 'time_stop': 193, 'use_sma': False, 'use_atr': True, 'use_adx': True, 'use_ema': True, 'use_spike': False, 'rsi_required': True, 'edge_k': 0.06598244449012133, 'edge_cap': 0.2539735889141671, 'bull_strategy': 'mean_reversion', 'bull_bb_std_mult': 2.7489874374726124, 'bull_rsi_os': 35, 'bull_rsi_ob': 83, 'bull_adx_thresh': 17.677792833045192, 'bull_atr_min_pct': 0.025295626615260178, 'bull_atr_max_pct': 0.020865658979116717, 'bull_tp_mult': 2.4832314400024784, 'bull_tsl_mult': 0.6962251486981851, 'bull_time_stop': 85, 'bull_use_sma': True, 'bull_use_ema': False, 'bull_use_atr': False, 'bull_use_adx': False, 'bull_use_spike': False, 'bull_rsi_required': False, 'bear_strategy': 'breakout', 'bear_bb_std_mult': 1.6405445362562436, 'bear_rsi_os': 41, 'bear_rsi_ob': 83, 'bear_adx_thresh': 11.647900891961928, 'bear_atr_min_pct': 0.01691678914505018, 'bear_atr_max_pct': 0.06242792651591059, 'bear_tp_mult': 2.6322438078767862, 'bear_tsl_mult': 0.14144286885486151, 'bear_time_stop': 103, 'bear_use_sma': False, 'bear_use_ema': True, 'bear_use_atr': False, 'bear_use_adx': False, 'bear_use_spike': False, 'bear_rsi_required': False, 'sideways_strategy': 'breakout', 'sideways_bb_std_mult': 2.1425124046071797, 'sideways_rsi_os': 17, 'sideways_rsi_ob': 78, 'sideways_adx_thresh': 8.930358492673536, 'sideways_atr_min_pct': 0.0007788344045778078, 'sideways_atr_max_pct': 0.12149447616605127, 'sideways_tp_mult': 1.0683759624784437, 'sideways_tsl_mult': 0.8649156558720272, 'sideways_time_stop': 270, 'sideways_use_sma': False, 'sideways_use_ema': False, 'sideways_use_atr': False, 'sideways_use_adx': False, 'sideways_use_spike': False, 'sideways_rsi_required': False}.
[I 2025-08-30 19:00:00,206] Trial 193 finished with values: [-1000000000.0, 1000000000.0] and parameters: {'p_sma': 15, 'p_std': 33, 'p_atr': 27, 'p_adx': 7, 'rsi_period': 63, 'ema1': 10, 'ema2': 16, 'slip_atr_k': 0.004167409026465386, 'slip_spread_k': 0.6518630935577077, 'spread_hl_frac': 0.001513626102077178, 'bb_std_mult': 0.9911619079934166, 'rsi_os': 33, 'rsi_ob': 55, 'vol_spike': 0.08721330472283209, 'adx_thresh': 24.170301607214945, 'atr_min_pct': 0.023147359077959874, 'atr_max_pct': 0.023435169052029706, 'tp_mult': 2.104022231075806, 'tsl_mult': 0.27270496625002605, 'strategy': 'mean_reversion', 'time_stop': 34, 'use_sma': False, 'use_atr': True, 'use_adx': True, 'use_ema': True, 'use_spike': False, 'rsi_required': True, 'edge_k': 0.08224166430225978, 'edge_cap': 0.251860328947713, 'bull_strategy': 'mean_reversion', 'bull_bb_std_mult': 1.123936287024829, 'bull_rsi_os': 35, 'bull_rsi_ob': 68, 'bull_adx_thresh': 17.600784678339373, 'bull_atr_min_pct': 0.004087865620867173, 'bull_atr_max_pct': 0.012165033031359273, 'bull_tp_mult': 2.220153085947879, 'bull_tsl_mult': 0.9433063417650455, 'bull_time_stop': 176, 'bull_use_sma': True, 'bull_use_ema': False, 'bull_use_atr': False, 'bull_use_adx': False, 'bull_use_spike': False, 'bull_rsi_required': False, 'bear_strategy': 'breakout', 'bear_bb_std_mult': 2.2975907369876114, 'bear_rsi_os': 41, 'bear_rsi_ob': 68, 'bear_adx_thresh': 29.2152078757556, 'bear_atr_min_pct': 0.016551699338341275, 'bear_atr_max_pct': 0.0451397618248493, 'bear_tp_mult': 1.8434762903878568, 'bear_tsl_mult': 0.2094328164141135, 'bear_time_stop': 39, 'bear_use_sma': False, 'bear_use_ema': True, 'bear_use_atr': False, 'bear_use_adx': False, 'bear_use_spike': False, 'bear_rsi_required': False, 'sideways_strategy': 'breakout', 'sideways_bb_std_mult': 1.0548129885397384, 'sideways_rsi_os': 19, 'sideways_rsi_ob': 79, 'sideways_adx_thresh': 10.008298302338602, 'sideways_atr_min_pct': 0.027623996366463253, 'sideways_atr_max_pct': 0.13561411135010243, 'sideways_tp_mult': 1.7228464730398034, 'sideways_tsl_mult': 0.869520697969485, 'sideways_time_stop': 300, 'sideways_use_sma': False, 'sideways_use_ema': False, 'sideways_use_atr': False, 'sideways_use_adx': False, 'sideways_use_spike': False, 'sideways_rsi_required': False}.
[I 2025-08-30 19:00:00,572] Trial 194 finished with values: [-1000000000.0, 1000000000.0] and parameters: {'p_sma': 54, 'p_std': 19, 'p_atr': 10, 'p_adx': 13, 'rsi_period': 51, 'ema1': 24, 'ema2': 32, 'slip_atr_k': 0.021096179333588667, 'slip_spread_k': 0.5924798807445135, 'spread_hl_frac': 0.0034242368887620954, 'bb_std_mult': 0.9706164321855537, 'rsi_os': 36, 'rsi_ob': 60, 'vol_spike': 0.02210784376216492, 'adx_thresh': 19.98833460327621, 'atr_min_pct': 0.0017639196880050948, 'atr_max_pct': 0.10041350324926798, 'tp_mult': 2.4422816061721146, 'tsl_mult': 0.7075552093032862, 'strategy': 'breakout', 'time_stop': 37, 'use_sma': False, 'use_atr': True, 'use_adx': True, 'use_ema': True, 'use_spike': False, 'rsi_required': True, 'edge_k': 1.7076961981162548, 'edge_cap': 0.257123729780118, 'bull_strategy': 'mean_reversion', 'bull_bb_std_mult': 1.8911337933418653, 'bull_rsi_os': 51, 'bull_rsi_ob': 74, 'bull_adx_thresh': 25.050900504795997, 'bull_atr_min_pct': 0.0041229276268023255, 'bull_atr_max_pct': 0.02040499230401986, 'bull_tp_mult': 2.7164474817882738, 'bull_tsl_mult': 0.9489130900531257, 'bull_time_stop': 110, 'bull_use_sma': True, 'bull_use_ema': False, 'bull_use_atr': True, 'bull_use_adx': True, 'bull_use_spike': False, 'bull_rsi_required': False, 'bear_strategy': 'mean_reversion', 'bear_bb_std_mult': 3.194904438096793, 'bear_rsi_os': 42, 'bear_rsi_ob': 82, 'bear_adx_thresh': 8.560573588603912, 'bear_atr_min_pct': 0.012444118367973898, 'bear_atr_max_pct': 0.059101544657977165, 'bear_tp_mult': 1.8472948353740668, 'bear_tsl_mult': 0.13521644244677045, 'bear_time_stop': 129, 'bear_use_sma': False, 'bear_use_ema': True, 'bear_use_atr': True, 'bear_use_adx': True, 'bear_use_spike': True, 'bear_rsi_required': False, 'sideways_strategy': 'breakout', 'sideways_bb_std_mult': 2.037596546511842, 'sideways_rsi_os': 19, 'sideways_rsi_ob': 79, 'sideways_adx_thresh': 32.74086754364402, 'sideways_atr_min_pct': 0.017439264693425046, 'sideways_atr_max_pct': 0.027571139177285466, 'sideways_tp_mult': 1.053041649414514, 'sideways_tsl_mult': 0.0452064035719027, 'sideways_time_stop': 6, 'sideways_use_sma': False, 'sideways_use_ema': False, 'sideways_use_atr': True, 'sideways_use_adx': False, 'sideways_use_spike': False, 'sideways_rsi_required': False}.
[I 2025-08-30 19:00:33,577] Trial 195 finished with values: [-1000000000.0, 1000000000.0] and parameters: {'p_sma': 39, 'p_std': 32, 'p_atr': 10, 'p_adx': 16, 'rsi_period': 51, 'ema1': 25, 'ema2': 23, 'slip_atr_k': 0.17767506384291756, 'slip_spread_k': 0.660207237896766, 'spread_hl_frac': 0.0034011963711483733, 'bb_std_mult': 1.0584420711344646, 'rsi_os': 36, 'rsi_ob': 61, 'vol_spike': 0.09674703570366333, 'adx_thresh': 17.655648702624585, 'atr_min_pct': 0.0024748515729672935, 'atr_max_pct': 0.07915620008642009, 'tp_mult': 2.4401964255764237, 'tsl_mult': 0.7193617897257275, 'strategy': 'breakout', 'time_stop': 246, 'use_sma': True, 'use_atr': True, 'use_adx': False, 'use_ema': True, 'use_spike': False, 'rsi_required': False, 'edge_k': 0.11301272671897478, 'edge_cap': 0.24237852945259444, 'bull_strategy': 'mean_reversion', 'bull_bb_std_mult': 1.8703089231999157, 'bull_rsi_os': 35, 'bull_rsi_ob': 71, 'bull_adx_thresh': 25.10849338619076, 'bull_atr_min_pct': 0.0012097940145724734, 'bull_atr_max_pct': 0.019178600336587345, 'bull_tp_mult': 2.134126772781355, 'bull_tsl_mult': 0.9446158665700211, 'bull_time_stop': 167, 'bull_use_sma': True, 'bull_use_ema': True, 'bull_use_atr': True, 'bull_use_adx': True, 'bull_use_spike': False, 'bull_rsi_required': False, 'bear_strategy': 'mean_reversion', 'bear_bb_std_mult': 3.261530904345252, 'bear_rsi_os': 41, 'bear_rsi_ob': 83, 'bear_adx_thresh': 5.0099067666497294, 'bear_atr_min_pct': 0.027222214308667295, 'bear_atr_max_pct': 0.059530020708532784, 'bear_tp_mult': 2.5057083781982215, 'bear_tsl_mult': 0.12946724500612636, 'bear_time_stop': 102, 'bear_use_sma': False, 'bear_use_ema': True, 'bear_use_atr': True, 'bear_use_adx': True, 'bear_use_spike': True, 'bear_rsi_required': False, 'sideways_strategy': 'breakout', 'sideways_bb_std_mult': 2.035720417169629, 'sideways_rsi_os': 37, 'sideways_rsi_ob': 60, 'sideways_adx_thresh': 33.748743641654166, 'sideways_atr_min_pct': 0.006845915479271644, 'sideways_atr_max_pct': 0.013590724222232176, 'sideways_tp_mult': 1.7250078423072575, 'sideways_tsl_mult': 0.6916262489058453, 'sideways_time_stop': 118, 'sideways_use_sma': False, 'sideways_use_ema': False, 'sideways_use_atr': True, 'sideways_use_adx': False, 'sideways_use_spike': False, 'sideways_rsi_required': False}.
[I 2025-08-30 19:00:34,236] Trial 198 finished with values: [-1000000000.0, 1000000000.0] and parameters: {'p_sma': 39, 'p_std': 35, 'p_atr': 10, 'p_adx': 25, 'rsi_period': 55, 'ema1': 16, 'ema2': 21, 'slip_atr_k': 0.17635470828607203, 'slip_spread_k': 0.3895264935495201, 'spread_hl_frac': 0.003684541070511495, 'bb_std_mult': 1.0798658240376822, 'rsi_os': 40, 'rsi_ob': 53, 'vol_spike': 0.054738015008758134, 'adx_thresh': 17.693026946880344, 'atr_min_pct': 0.02344539865353408, 'atr_max_pct': 0.13829410415706148, 'tp_mult': 2.66260968566685, 'tsl_mult': 0.23187059094865292, 'strategy': 'breakout', 'time_stop': 47, 'use_sma': True, 'use_atr': False, 'use_adx': False, 'use_ema': False, 'use_spike': True, 'rsi_required': False, 'edge_k': 1.8231900768158098, 'edge_cap': 0.22736717174318277, 'bull_strategy': 'breakout', 'bull_bb_std_mult': 3.4650751022808723, 'bull_rsi_os': 10, 'bull_rsi_ob': 78, 'bull_adx_thresh': 26.850245312401483, 'bull_atr_min_pct': 0.023410276169100915, 'bull_atr_max_pct': 0.09884114632937618, 'bull_tp_mult': 2.1188340459049204, 'bull_tsl_mult': 0.9948751234216163, 'bull_time_stop': 269, 'bull_use_sma': False, 'bull_use_ema': True, 'bull_use_atr': True, 'bull_use_adx': True, 'bull_use_spike': True, 'bull_rsi_required': True, 'bear_strategy': 'mean_reversion', 'bear_bb_std_mult': 3.264414061786097, 'bear_rsi_os': 36, 'bear_rsi_ob': 84, 'bear_adx_thresh': 6.144281197336847, 'bear_atr_min_pct': 0.0016694611437904436, 'bear_atr_max_pct': 0.05488349128244217, 'bear_tp_mult': 2.4845344230091886, 'bear_tsl_mult': 0.5627601897686815, 'bear_time_stop': 81, 'bear_use_sma': True, 'bear_use_ema': False, 'bear_use_atr': True, 'bear_use_adx': True, 'bear_use_spike': True, 'bear_rsi_required': False, 'sideways_strategy': 'breakout', 'sideways_bb_std_mult': 1.9695310694679085, 'sideways_rsi_os': 38, 'sideways_rsi_ob': 58, 'sideways_adx_thresh': 5.153424437391477, 'sideways_atr_min_pct': 0.020245934444085442, 'sideways_atr_max_pct': 0.011641571113674642, 'sideways_tp_mult': 1.7994818229637428, 'sideways_tsl_mult': 0.6912277483441017, 'sideways_time_stop': 118, 'sideways_use_sma': True, 'sideways_use_ema': True, 'sideways_use_atr': True, 'sideways_use_adx': True, 'sideways_use_spike': False, 'sideways_rsi_required': False}.
[I 2025-08-30 19:00:34,484] Trial 197 finished with values: [-0.024291774574222158, 0.024142361253119672] and parameters: {'p_sma': 39, 'p_std': 20, 'p_atr': 10, 'p_adx': 7, 'rsi_period': 76, 'ema1': 24, 'ema2': 23, 'slip_atr_k': 0.11802827835226275, 'slip_spread_k': 0.4042941454397512, 'spread_hl_frac': 0.0328644466786764, 'bb_std_mult': 0.9343696491689977, 'rsi_os': 36, 'rsi_ob': 60, 'vol_spike': 0.05613611175555873, 'adx_thresh': 19.83522709440662, 'atr_min_pct': 0.023619265455901806, 'atr_max_pct': 0.1003035250293107, 'tp_mult': 2.2502505655303975, 'tsl_mult': 0.7356183172956543, 'strategy': 'breakout', 'time_stop': 175, 'use_sma': True, 'use_atr': False, 'use_adx': False, 'use_ema': False, 'use_spike': True, 'rsi_required': False, 'edge_k': 0.11802456556309728, 'edge_cap': 0.22138293625216848, 'bull_strategy': 'breakout', 'bull_bb_std_mult': 2.5878445930525804, 'bull_rsi_os': 50, 'bull_rsi_ob': 71, 'bull_adx_thresh': 24.75936687482089, 'bull_atr_min_pct': 0.0013123191459177798, 'bull_atr_max_pct': 0.050076974257096875, 'bull_tp_mult': 2.1178579941163727, 'bull_tsl_mult': 0.9932344549322497, 'bull_time_stop': 193, 'bull_use_sma': True, 'bull_use_ema': True, 'bull_use_atr': True, 'bull_use_adx': True, 'bull_use_spike': True, 'bull_rsi_required': True, 'bear_strategy': 'mean_reversion', 'bear_bb_std_mult': 3.2675576457748985, 'bear_rsi_os': 51, 'bear_rsi_ob': 82, 'bear_adx_thresh': 5.424527087008205, 'bear_atr_min_pct': 0.0021754345072621355, 'bear_atr_max_pct': 0.05939004611629358, 'bear_tp_mult': 1.7104783972395743, 'bear_tsl_mult': 0.09525989240801153, 'bear_time_stop': 128, 'bear_use_sma': True, 'bear_use_ema': False, 'bear_use_atr': True, 'bear_use_adx': True, 'bear_use_spike': True, 'bear_rsi_required': False, 'sideways_strategy': 'breakout', 'sideways_bb_std_mult': 2.0392375683331774, 'sideways_rsi_os': 38, 'sideways_rsi_ob': 60, 'sideways_adx_thresh': 33.555872119091106, 'sideways_atr_min_pct': 0.004649496032392989, 'sideways_atr_max_pct': 0.08165772035258881, 'sideways_tp_mult': 1.8019377088043356, 'sideways_tsl_mult': 0.6879980654652358, 'sideways_time_stop': 288, 'sideways_use_sma': True, 'sideways_use_ema': True, 'sideways_use_atr': True, 'sideways_use_adx': False, 'sideways_use_spike': False, 'sideways_rsi_required': False}.
