[I 2025-08-30 18:42:41,616] Trial 52 finished with values: [-0.020205504239930283, 0.020111222364582074] and parameters: {'p_sma': 41, 'p_std': 26, 'p_atr': 8, 'p_adx': 8, 'rsi_period': 53, 'ema1': 17, 'ema2': 41, 'slip_atr_k': 0.19613101525184723, 'slip_spread_k': 0.4665923271172359, 'spread_hl_frac': 0.033270996169043686, 'bb_std_mult': 2.657559730875264, 'rsi_os': 50, 'rsi_ob': 74, 'vol_spike': 0.015237222560956932, 'adx_thresh': 23.366571182281774, 'atr_min_pct': 0.024190841334407662, 'atr_max_pct': 0.1368460518300504, 'tp_mult': 2.1584412273022386, 'tsl_mult': 0.12048735054573784, 'strategy': 'breakout', 'time_stop': 165, 'use_sma': False, 'use_atr': True, 'use_adx': False, 'use_ema': False, 'use_spike': True, 'rsi_required': True, 'edge_k': 0.1172435631132241, 'edge_cap': 0.14455030666126156, 'bull_strategy': 'mean_reversion', 'bull_bb_std_mult': 1.6849847896048502, 'bull_rsi_os': 17, 'bull_rsi_ob': 72, 'bull_adx_thresh': 8.493646076082971, 'bull_atr_min_pct': 0.002627566869055501, 'bull_atr_max_pct': 0.026440931764412937, 'bull_tp_mult': 2.1923256659086414, 'bull_tsl_mult': 0.6703589380754817, 'bull_time_stop': 178, 'bull_use_sma': True, 'bull_use_ema': False, 'bull_use_atr': False, 'bull_use_adx': True, 'bull_use_spike': True, 'bull_rsi_required': True, 'bear_strategy': 'breakout', 'bear_bb_std_mult': 3.487045876725224, 'bear_rsi_os': 21, 'bear_rsi_ob': 83, 'bear_adx_thresh': 11.85767013625457, 'bear_atr_min_pct': 0.014489443406947885, 'bear_atr_max_pct': 0.14965107726594895, 'bear_tp_mult': 1.7483318119213758, 'bear_tsl_mult': 0.1386443814303777, 'bear_time_stop': 39, 'bear_use_sma': False, 'bear_use_ema': False, 'bear_use_atr': True, 'bear_use_adx': True, 'bear_use_spike': False, 'bear_rsi_required': False, 'sideways_strategy': 'breakout', 'sideways_bb_std_mult': 2.1401280549903814, 'sideways_rsi_os': 17, 'sideways_rsi_ob': 58, 'sideways_adx_thresh': 9.370832362458144, 'sideways_atr_min_pct': 0.021590032986593538, 'sideways_atr_max_pct': 0.11912466523023463, 'sideways_tp_mult': 2.130766696397935, 'sideways_tsl_mult': 0.6850947823124316, 'sideways_time_stop': 252, 'sideways_use_sma': True, 'sideways_use_ema': True, 'sideways_use_atr': False, 'sideways_use_adx': False, 'sideways_use_spike': False, 'sideways_rsi_required': False}.
[I 2025-08-30 18:42:41,920] Trial 53 finished with values: [-0.026966897406310864, 0.02687432981213284] and parameters: {'p_sma': 46, 'p_std': 17, 'p_atr': 8, 'p_adx': 8, 'rsi_period': 51, 'ema1': 13, 'ema2': 31, 'slip_atr_k': 0.1876723182953044, 'slip_spread_k': 0.4473168358484902, 'spread_hl_frac': 0.03317214467941611, 'bb_std_mult': 1.7472007493187576, 'rsi_os': 49, 'rsi_ob': 74, 'vol_spike': 0.040236904330455806, 'adx_thresh': 18.361689346867, 'atr_min_pct': 0.024520349485516006, 'atr_max_pct': 0.13605213399217242, 'tp_mult': 2.1763841259300287, 'tsl_mult': 0.1397887840407222, 'strategy': 'breakout', 'time_stop': 146, 'use_sma': False, 'use_atr': True, 'use_adx': False, 'use_ema': False, 'use_spike': True, 'rsi_required': True, 'edge_k': 0.11333488679263687, 'edge_cap': 0.16461418661537625, 'bull_strategy': 'mean_reversion', 'bull_bb_std_mult': 2.1500647756272255, 'bull_rsi_os': 17, 'bull_rsi_ob': 72, 'bull_adx_thresh': 26.452890241596076, 'bull_atr_min_pct': 0.0027143610381858917, 'bull_atr_max_pct': 0.10369360755462301, 'bull_tp_mult': 2.398706952236982, 'bull_tsl_mult': 0.6797833048211939, 'bull_time_stop': 245, 'bull_use_sma': True, 'bull_use_ema': False, 'bull_use_atr': False, 'bull_use_adx': True, 'bull_use_spike': True, 'bull_rsi_required': True, 'bear_strategy': 'breakout', 'bear_bb_std_mult': 3.2413738692710705, 'bear_rsi_os': 52, 'bear_rsi_ob': 69, 'bear_adx_thresh': 5.136089215260823, 'bear_atr_min_pct': 0.02081588160088407, 'bear_atr_max_pct': 0.10707592730708149, 'bear_tp_mult': 2.0985997873007105, 'bear_tsl_mult': 0.09427858971359748, 'bear_time_stop': 66, 'bear_use_sma': True, 'bear_use_ema': False, 'bear_use_atr': True, 'bear_use_adx': True, 'bear_use_spike': False, 'bear_rsi_required': False, 'sideways_strategy': 'breakout', 'sideways_bb_std_mult': 2.2943439141914554, 'sideways_rsi_os': 17, 'sideways_rsi_ob': 70, 'sideways_adx_thresh': 9.70106204773203, 'sideways_atr_min_pct': 0.01879163129076565, 'sideways_atr_max_pct': 0.11971923128740854, 'sideways_tp_mult': 1.792658595726225, 'sideways_tsl_mult': 0.12671437618255116, 'sideways_time_stop': 276, 'sideways_use_sma': True, 'sideways_use_ema': True, 'sideways_use_atr': False, 'sideways_use_adx': False, 'sideways_use_spike': False, 'sideways_rsi_required': False}.
[I 2025-08-30 18:43:14,800] Trial 56 finished with values: [-1000000000.0, 1000000000.0] and parameters: {'p_sma': 46, 'p_std': 38, 'p_atr': 17, 'p_adx': 8, 'rsi_period': 63, 'ema1': 23, 'ema2': 10, 'slip_atr_k': 0.014063358759179495, 'slip_spread_k': 0.31206831968490645, 'spread_hl_frac': 0.005075815845823329, 'bb_std_mult': 1.149113452531031, 'rsi_os': 37, 'rsi_ob': 62, 'vol_spike': 0.040119841915453446, 'adx_thresh': 17.873951601029436, 'atr_min_pct': 0.027459622864912613, 'atr_max_pct': 0.1424362871620423, 'tp_mult': 2.2299361715450354, 'tsl_mult': 0.6159433034123594, 'strategy': 'breakout', 'time_stop': 49, 'use_sma': False, 'use_atr': True, 'use_adx': False, 'use_ema': False, 'use_spike': True, 'rsi_required': True, 'edge_k': 0.11577911358343451, 'edge_cap': 0.186655738674049, 'bull_strategy': 'breakout', 'bull_bb_std_mult': 1.678109920584701, 'bull_rsi_os': 51, 'bull_rsi_ob': 61, 'bull_adx_thresh': 21.63354728633921, 'bull_atr_min_pct': 0.0030208621188545456, 'bull_atr_max_pct': 0.02063721645449079, 'bull_tp_mult': 1.2404429110344768, 'bull_tsl_mult': 0.24807368078700254, 'bull_time_stop': 242, 'bull_use_sma': True, 'bull_use_ema': True, 'bull_use_atr': False, 'bull_use_adx': True, 'bull_use_spike': True, 'bull_rsi_required': False, 'bear_strategy': 'breakout', 'bear_bb_std_mult': 3.356171251789121, 'bear_rsi_os': 46, 'bear_rsi_ob': 95, 'bear_adx_thresh': 5.258500603644926, 'bear_atr_min_pct': 0.01717020898051829, 'bear_atr_max_pct': 0.07382211064868334, 'bear_tp_mult': 1.6928943998111339, 'bear_tsl_mult': 0.13998224592708203, 'bear_time_stop': 40, 'bear_use_sma': True, 'bear_use_ema': False, 'bear_use_atr': True, 'bear_use_adx': True, 'bear_use_spike': False, 'bear_rsi_required': False, 'sideways_strategy': 'breakout', 'sideways_bb_std_mult': 2.164242753402291, 'sideways_rsi_os': 14, 'sideways_rsi_ob': 54, 'sideways_adx_thresh': 12.38501722645341, 'sideways_atr_min_pct': 0.021266069204543627, 'sideways_atr_max_pct': 0.11317827286853328, 'sideways_tp_mult': 2.4520259229160812, 'sideways_tsl_mult': 0.6199315598288623, 'sideways_time_stop': 284, 'sideways_use_sma': True, 'sideways_use_ema': True, 'sideways_use_atr': False, 'sideways_use_adx': False, 'sideways_use_spike': False, 'sideways_rsi_required': False}.
[I 2025-08-30 18:43:14,954] Trial 58 finished with values: [-0.016066858148786167, 0.015936958907174906] and parameters: {'p_sma': 47, 'p_std': 38, 'p_atr': 13, 'p_adx': 8, 'rsi_period': 65, 'ema1': 24, 'ema2': 10, 'slip_atr_k': 0.04282749324497703, 'slip_spread_k': 0.3132379925217529, 'spread_hl_frac': 0.0060369778838233745, 'bb_std_mult': 2.1379905249441826, 'rsi_os': 37, 'rsi_ob': 61, 'vol_spike': 0.1552385594877674, 'adx_thresh': 15.008332971381812, 'atr_min_pct': 0.02780315409597508, 'atr_max_pct': 0.14447301764505613, 'tp_mult': 2.215722389559322, 'tsl_mult': 0.6460661626194264, 'strategy': 'breakout', 'time_stop': 48, 'use_sma': False, 'use_atr': True, 'use_adx': False, 'use_ema': False, 'use_spike': True, 'rsi_required': True, 'edge_k': 0.2779511072795492, 'edge_cap': 0.2501100479300194, 'bull_strategy': 'breakout', 'bull_bb_std_mult': 1.6194082467810156, 'bull_rsi_os': 52, 'bull_rsi_ob': 61, 'bull_adx_thresh': 23.42715501699359, 'bull_atr_min_pct': 0.0009447084618054164, 'bull_atr_max_pct': 0.019918736660059236, 'bull_tp_mult': 2.0518268635172627, 'bull_tsl_mult': 0.9508672934079969, 'bull_time_stop': 158, 'bull_use_sma': True, 'bull_use_ema': True, 'bull_use_atr': False, 'bull_use_adx': True, 'bull_use_spike': True, 'bull_rsi_required': False, 'bear_strategy': 'breakout', 'bear_bb_std_mult': 2.9511228741328863, 'bear_rsi_os': 45, 'bear_rsi_ob': 83, 'bear_adx_thresh': 12.050906487989984, 'bear_atr_min_pct': 0.011221578048474661, 'bear_atr_max_pct': 0.07177592720365047, 'bear_tp_mult': 1.671944956294686, 'bear_tsl_mult': 0.13292290887146158, 'bear_time_stop': 99, 'bear_use_sma': True, 'bear_use_ema': False, 'bear_use_atr': True, 'bear_use_adx': True, 'bear_use_spike': False, 'bear_rsi_required': False, 'sideways_strategy': 'breakout', 'sideways_bb_std_mult': 1.9348849483484158, 'sideways_rsi_os': 15, 'sideways_rsi_ob': 60, 'sideways_adx_thresh': 33.69332165879009, 'sideways_atr_min_pct': 0.026541873707968327, 'sideways_atr_max_pct': 0.11469482914605728, 'sideways_tp_mult': 2.09951880362559, 'sideways_tsl_mult': 0.6363560331035532, 'sideways_time_stop': 259, 'sideways_use_sma': True, 'sideways_use_ema': True, 'sideways_use_atr': False, 'sideways_use_adx': False, 'sideways_use_spike': False, 'sideways_rsi_required': False}.
[I 2025-08-30 18:43:15,071] Trial 59 finished with values: [-0.01831546497189085, 0.018189732651103425] and parameters: {'p_sma': 46, 'p_std': 38, 'p_atr': 13, 'p_adx': 7, 'rsi_period': 63, 'ema1': 22, 'ema2': 10, 'slip_atr_k': 0.01739132287766111, 'slip_spread_k': 0.32567305603122004, 'spread_hl_frac': 0.006368764497048891, 'bb_std_mult': 1.0304652733534416, 'rsi_os': 28, 'rsi_ob': 63, 'vol_spike': 0.1230465579243655, 'adx_thresh': 15.25421120086045, 'atr_min_pct': 0.028222707322278537, 'atr_max_pct': 0.14274458279729954, 'tp_mult': 1.9295133377203284, 'tsl_mult': 0.6155053881991851, 'strategy': 'breakout', 'time_stop': 50, 'use_sma': False, 'use_atr': True, 'use_adx': False, 'use_ema': False, 'use_spike': True, 'rsi_required': True, 'edge_k': 0.3014486175152358, 'edge_cap': 0.2508071763647063, 'bull_strategy': 'breakout', 'bull_bb_std_mult': 1.9701003451515218, 'bull_rsi_os': 52, 'bull_rsi_ob': 60, 'bull_adx_thresh': 23.83059364207635, 'bull_atr_min_pct': 0.0008681037007265036, 'bull_atr_max_pct': 0.020815117140699013, 'bull_tp_mult': 2.2072835304304217, 'bull_tsl_mult': 0.959568439383344, 'bull_time_stop': 203, 'bull_use_sma': True, 'bull_use_ema': True, 'bull_use_atr': False, 'bull_use_adx': True, 'bull_use_spike': True, 'bull_rsi_required': False, 'bear_strategy': 'breakout', 'bear_bb_std_mult': 3.0229675218862235, 'bear_rsi_os': 46, 'bear_rsi_ob': 84, 'bear_adx_thresh': 12.447297258599288, 'bear_atr_min_pct': 0.017425096018196883, 'bear_atr_max_pct': 0.07188543762276518, 'bear_tp_mult': 1.677071929033096, 'bear_tsl_mult': 0.14767513073704552, 'bear_time_stop': 43, 'bear_use_sma': True, 'bear_use_ema': False, 'bear_use_atr': True, 'bear_use_adx': True, 'bear_use_spike': False, 'bear_rsi_required': False, 'sideways_strategy': 'breakout', 'sideways_bb_std_mult': 1.9758161720904326, 'sideways_rsi_os': 9, 'sideways_rsi_ob': 54, 'sideways_adx_thresh': 12.942858134648251, 'sideways_atr_min_pct': 0.027407617715580493, 'sideways_atr_max_pct': 0.11392110854396692, 'sideways_tp_mult': 1.8879088348372752, 'sideways_tsl_mult': 0.6310719922721654, 'sideways_time_stop': 283, 'sideways_use_sma': True, 'sideways_use_ema': True, 'sideways_use_atr': False, 'sideways_use_adx': False, 'sideways_use_spike': False, 'sideways_rsi_required': False}.
[I 2025-08-30 18:43:15,172] Trial 57 finished with values: [-1000000000.0, 1000000000.0] and parameters: {'p_sma': 47, 'p_std': 27, 'p_atr': 13, 'p_adx': 11, 'rsi_period': 64, 'ema1': 23, 'ema2': 11, 'slip_atr_k': 0.01511514617941035, 'slip_spread_k': 0.30485189459630535, 'spread_hl_frac': 0.004799539568327588, 'bb_std_mult': 3.3521781491520333, 'rsi_os': 29, 'rsi_ob': 63, 'vol_spike': 0.12623523124113295, 'adx_thresh': 14.613655871815908, 'atr_min_pct': 0.02364799662602797, 'atr_max_pct': 0.14219897159997344, 'tp_mult': 2.2172246429131457, 'tsl_mult': 0.5909189195727188, 'strategy': 'breakout', 'time_stop': 47, 'use_sma': False, 'use_atr': True, 'use_adx': False, 'use_ema': False, 'use_spike': True, 'rsi_required': True, 'edge_k': 0.08869684413431925, 'edge_cap': 0.1765419431751747, 'bull_strategy': 'breakout', 'bull_bb_std_mult': 1.6717032959398224, 'bull_rsi_os': 51, 'bull_rsi_ob': 45, 'bull_adx_thresh': 23.709010667855246, 'bull_atr_min_pct': 0.025738363388890267, 'bull_atr_max_pct': 0.021705172589718803, 'bull_tp_mult': 1.0221424327799802, 'bull_tsl_mult': 0.276548429668114, 'bull_time_stop': 248, 'bull_use_sma': True, 'bull_use_ema': True, 'bull_use_atr': False, 'bull_use_adx': True, 'bull_use_spike': True, 'bull_rsi_required': False, 'bear_strategy': 'breakout', 'bear_bb_std_mult': 2.9117018565174293, 'bear_rsi_os': 52, 'bear_rsi_ob': 95, 'bear_adx_thresh': 5.2744374694475855, 'bear_atr_min_pct': 0.01746122654662813, 'bear_atr_max_pct': 0.07202180843438405, 'bear_tp_mult': 1.6800360150546738, 'bear_tsl_mult': 0.1440912598394241, 'bear_time_stop': 67, 'bear_use_sma': True, 'bear_use_ema': False, 'bear_use_atr': True, 'bear_use_adx': True, 'bear_use_spike': False, 'bear_rsi_required': False, 'sideways_strategy': 'breakout', 'sideways_bb_std_mult': 2.184818807916098, 'sideways_rsi_os': 14, 'sideways_rsi_ob': 63, 'sideways_adx_thresh': 12.091578676015265, 'sideways_atr_min_pct': 0.02690622248562477, 'sideways_atr_max_pct': 0.10149554585796462, 'sideways_tp_mult': 2.4513222055206967, 'sideways_tsl_mult': 0.6410274733139775, 'sideways_time_stop': 283, 'sideways_use_sma': True, 'sideways_use_ema': True, 'sideways_use_atr': False, 'sideways_use_adx': False, 'sideways_use_spike': False, 'sideways_rsi_required': False}.
[I 2025-08-30 18:43:15,456] Trial 62 finished with values: [-1000000000.0, 1000000000.0] and parameters: {'p_sma': 52, 'p_std': 55, 'p_atr': 13, 'p_adx': 7, 'rsi_period': 64, 'ema1': 25, 'ema2': 16, 'slip_atr_k': 0.040098228354677024, 'slip_spread_k': 0.3326085893905302, 'spread_hl_frac': 0.00689493361504853, 'bb_std_mult': 3.227840727186286, 'rsi_os': 32, 'rsi_ob': 47, 'vol_spike': 0.12535252703770833, 'adx_thresh': 16.011908738540193, 'atr_min_pct': 0.01957982725530672, 'atr_max_pct': 0.05536442275023796, 'tp_mult': 2.0343674112684194, 'tsl_mult': 0.7772415888229048, 'strategy': 'mean_reversion', 'time_stop': 12, 'use_sma': True, 'use_atr': True, 'use_adx': False, 'use_ema': False, 'use_spike': False, 'rsi_required': True, 'edge_k': 0.27505377809977555, 'edge_cap': 0.24993559529674744, 'bull_strategy': 'breakout', 'bull_bb_std_mult': 2.539465155920939, 'bull_rsi_os': 52, 'bull_rsi_ob': 72, 'bull_adx_thresh': 23.572658228435976, 'bull_atr_min_pct': 0.0008748785781213027, 'bull_atr_max_pct': 0.03302790826568742, 'bull_tp_mult': 2.049331597277724, 'bull_tsl_mult': 0.9595173917195532, 'bull_time_stop': 203, 'bull_use_sma': False, 'bull_use_ema': True, 'bull_use_atr': False, 'bull_use_adx': True, 'bull_use_spike': True, 'bull_rsi_required': False, 'bear_strategy': 'mean_reversion', 'bear_bb_std_mult': 2.9695123733864137, 'bear_rsi_os': 39, 'bear_rsi_ob': 83, 'bear_adx_thresh': 9.138398609600074, 'bear_atr_min_pct': 0.01043391625459237, 'bear_atr_max_pct': 0.07189739287012138, 'bear_tp_mult': 1.6106755909482962, 'bear_tsl_mult': 0.1732924512571367, 'bear_time_stop': 99, 'bear_use_sma': True, 'bear_use_ema': False, 'bear_use_atr': True, 'bear_use_adx': True, 'bear_use_spike': False, 'bear_rsi_required': False, 'sideways_strategy': 'breakout', 'sideways_bb_std_mult': 1.912524500611104, 'sideways_rsi_os': 50, 'sideways_rsi_ob': 82, 'sideways_adx_thresh': 34.95436597039275, 'sideways_atr_min_pct': 0.027004798657101932, 'sideways_atr_max_pct': 0.03458354699853441, 'sideways_tp_mult': 2.056472670990817, 'sideways_tsl_mult': 0.6584911687053969, 'sideways_time_stop': 259, 'sideways_use_sma': True, 'sideways_use_ema': True, 'sideways_use_atr': False, 'sideways_use_adx': True, 'sideways_use_spike': True, 'sideways_rsi_required': True}.
[I 2025-08-30 18:43:15,480] Trial 61 finished with values: [-1000000000.0, 1000000000.0] and parameters: {'p_sma': 22, 'p_std': 28, 'p_atr': 13, 'p_adx': 29, 'rsi_period': 60, 'ema1': 25, 'ema2': 16, 'slip_atr_k': 0.040045687061594795, 'slip_spread_k': 0.3158974180141095, 'spread_hl_frac': 0.006203138070553159, 'bb_std_mult': 3.1949037477064133, 'rsi_os': 55, 'rsi_ob': 47, 'vol_spike': 0.12608826436795598, 'adx_thresh': 7.3166479827319275, 'atr_min_pct': 0.019600785181949732, 'atr_max_pct': 0.145061089776764, 'tp_mult': 2.0302145081490863, 'tsl_mult': 0.7803750217068282, 'strategy': 'mean_reversion', 'time_stop': 12, 'use_sma': True, 'use_atr': True, 'use_adx': False, 'use_ema': False, 'use_spike': False, 'rsi_required': True, 'edge_k': 0.2885453324177376, 'edge_cap': 0.24413893768754039, 'bull_strategy': 'breakout', 'bull_bb_std_mult': 2.5632301105814435, 'bull_rsi_os': 46, 'bull_rsi_ob': 65, 'bull_adx_thresh': 23.968063735194967, 'bull_atr_min_pct': 0.0006973136015802368, 'bull_atr_max_pct': 0.018311095836765174, 'bull_tp_mult': 2.0634461608571693, 'bull_tsl_mult': 0.9454413725609131, 'bull_time_stop': 164, 'bull_use_sma': False, 'bull_use_ema': True, 'bull_use_atr': False, 'bull_use_adx': True, 'bull_use_spike': True, 'bull_rsi_required': False, 'bear_strategy': 'mean_reversion', 'bear_bb_std_mult': 2.967466585338071, 'bear_rsi_os': 43, 'bear_rsi_ob': 84, 'bear_adx_thresh': 9.456000426111865, 'bear_atr_min_pct': 0.010801663131558666, 'bear_atr_max_pct': 0.038739708718013716, 'bear_tp_mult': 1.2390505127396347, 'bear_tsl_mult': 0.17354159199840102, 'bear_time_stop': 98, 'bear_use_sma': True, 'bear_use_ema': False, 'bear_use_atr': True, 'bear_use_adx': True, 'bear_use_spike': False, 'bear_rsi_required': False, 'sideways_strategy': 'breakout', 'sideways_bb_std_mult': 1.9303059287470137, 'sideways_rsi_os': 51, 'sideways_rsi_ob': 83, 'sideways_adx_thresh': 33.845190074672345, 'sideways_atr_min_pct': 0.028117215428742452, 'sideways_atr_max_pct': 0.03295053005053854, 'sideways_tp_mult': 1.4957398915536184, 'sideways_tsl_mult': 0.7227568819074291, 'sideways_time_stop': 89, 'sideways_use_sma': True, 'sideways_use_ema': True, 'sideways_use_atr': False, 'sideways_use_adx': True, 'sideways_use_spike': True, 'sideways_rsi_required': True}.
[I 2025-08-30 18:43:15,482] Trial 63 finished with values: [-1000000000.0, 1000000000.0] and parameters: {'p_sma': 9, 'p_std': 55, 'p_atr': 13, 'p_adx': 7, 'rsi_period': 58, 'ema1': 25, 'ema2': 15, 'slip_atr_k': 0.00596696290827959, 'slip_spread_k': 0.4964904264478672, 'spread_hl_frac': 0.007036691700756331, 'bb_std_mult': 0.9926361865351983, 'rsi_os': 33, 'rsi_ob': 47, 'vol_spike': 0.1594420662828031, 'adx_thresh': 15.518330626320976, 'atr_min_pct': 0.028447601526292617, 'atr_max_pct': 0.11985047893556343, 'tp_mult': 2.0270097196517955, 'tsl_mult': 0.7524080510905089, 'strategy': 'mean_reversion', 'time_stop': 6, 'use_sma': True, 'use_atr': False, 'use_adx': True, 'use_ema': False, 'use_spike': False, 'rsi_required': False, 'edge_k': 0.271387704195627, 'edge_cap': 0.24615842916601854, 'bull_strategy': 'breakout', 'bull_bb_std_mult': 2.539506035499218, 'bull_rsi_os': 46, 'bull_rsi_ob': 64, 'bull_adx_thresh': 23.812411822283, 'bull_atr_min_pct': 0.0009178477522297415, 'bull_atr_max_pct': 0.03257937257517011, 'bull_tp_mult': 2.0211899520644554, 'bull_tsl_mult': 0.96011010161231, 'bull_time_stop': 201, 'bull_use_sma': False, 'bull_use_ema': False, 'bull_use_atr': False, 'bull_use_adx': True, 'bull_use_spike': False, 'bull_rsi_required': False, 'bear_strategy': 'mean_reversion', 'bear_bb_std_mult': 3.0545311594234517, 'bear_rsi_os': 39, 'bear_rsi_ob': 84, 'bear_adx_thresh': 8.452177991523346, 'bear_atr_min_pct': 0.010851658019019637, 'bear_atr_max_pct': 0.053343091405461805, 'bear_tp_mult': 1.5730724519305028, 'bear_tsl_mult': 0.17856769544142248, 'bear_time_stop': 95, 'bear_use_sma': True, 'bear_use_ema': False, 'bear_use_atr': False, 'bear_use_adx': False, 'bear_use_spike': True, 'bear_rsi_required': False, 'sideways_strategy': 'breakout', 'sideways_bb_std_mult': 1.8752801502938652, 'sideways_rsi_os': 50, 'sideways_rsi_ob': 61, 'sideways_adx_thresh': 34.59905405531251, 'sideways_atr_min_pct': 0.0029862461028847334, 'sideways_atr_max_pct': 0.06611886054350789, 'sideways_tp_mult': 1.9035262223981249, 'sideways_tsl_mult': 0.7237819462791836, 'sideways_time_stop': 94, 'sideways_use_sma': True, 'sideways_use_ema': False, 'sideways_use_atr': False, 'sideways_use_adx': True, 'sideways_use_spike': True, 'sideways_rsi_required': True}.
