[I 2025-08-30 18:40:25,216] Trial 36 finished with values: [-1000000000.0, 1000000000.0] and parameters: {'p_sma': 39, 'p_std': 59, 'p_atr': 12, 'p_adx': 13, 'rsi_period': 19, 'ema1': 11, 'ema2': 25, 'slip_atr_k': 0.07299406575884088, 'slip_spread_k': 0.11970946706555585, 'spread_hl_frac': 0.021422307305544275, 'bb_std_mult': 1.286560387385035, 'rsi_os': 21, 'rsi_ob': 53, 'vol_spike': 0.0873519160120864, 'adx_thresh': 29.51196319003047, 'atr_min_pct': 0.00753941880085957, 'atr_max_pct': 0.11500250407777474, 'tp_mult': 1.0534824587225806, 'tsl_mult': 0.08511936051922835, 'strategy': 'mean_reversion', 'time_stop': 134, 'use_sma': False, 'use_atr': False, 'use_adx': False, 'use_ema': False, 'use_spike': True, 'rsi_required': True, 'edge_k': 0.4676899210071114, 'edge_cap': 0.39450065208364476, 'bull_strategy': 'mean_reversion', 'bull_bb_std_mult': 2.6497546704047585, 'bull_rsi_os': 6, 'bull_rsi_ob': 86, 'bull_adx_thresh': 29.481896479790272, 'bull_atr_min_pct': 0.01935547982897305, 'bull_atr_max_pct': 0.08804341597747276, 'bull_tp_mult': 2.5245101564269516, 'bull_tsl_mult': 0.7979919220747711, 'bull_time_stop': 258, 'bull_use_sma': True, 'bull_use_ema': True, 'bull_use_atr': False, 'bull_use_adx': False, 'bull_use_spike': False, 'bull_rsi_required': False, 'bear_strategy': 'breakout', 'bear_bb_std_mult': 1.85661810317815, 'bear_rsi_os': 6, 'bear_rsi_ob': 75, 'bear_adx_thresh': 17.82945385883661, 'bear_atr_min_pct': 0.004285156559639286, 'bear_atr_max_pct': 0.08266289736099491, 'bear_tp_mult': 1.3528343491268808, 'bear_tsl_mult': 0.04622163954343678, 'bear_time_stop': 228, 'bear_use_sma': True, 'bear_use_ema': False, 'bear_use_atr': True, 'bear_use_adx': True, 'bear_use_spike': False, 'bear_rsi_required': False, 'sideways_strategy': 'mean_reversion', 'sideways_bb_std_mult': 2.862211266505759, 'sideways_rsi_os': 24, 'sideways_rsi_ob': 46, 'sideways_adx_thresh': 27.453925291842555, 'sideways_atr_min_pct': 0.024803595747426632, 'sideways_atr_max_pct': 0.07485608326253171, 'sideways_tp_mult': 2.993576627092677, 'sideways_tsl_mult': 0.2903022827234273, 'sideways_time_stop': 131, 'sideways_use_sma': True, 'sideways_use_ema': True, 'sideways_use_atr': False, 'sideways_use_adx': False, 'sideways_use_spike': False, 'sideways_rsi_required': False}.
[I 2025-08-30 18:40:27,984] Trial 38 finished with values: [-1000000000.0, 1000000000.0] and parameters: {'p_sma': 39, 'p_std': 57, 'p_atr': 12, 'p_adx': 13, 'rsi_period': 81, 'ema1': 12, 'ema2': 24, 'slip_atr_k': 0.06805302217921716, 'slip_spread_k': 0.1042296267788893, 'spread_hl_frac': 0.04146965158954019, 'bb_std_mult': 3.5629752731106485, 'rsi_os': 7, 'rsi_ob': 54, 'vol_spike': 0.2446955866344056, 'adx_thresh': 24.551806351338506, 'atr_min_pct': 0.007337299721113459, 'atr_max_pct': 0.11261481207968457, 'tp_mult': 1.1412485976230502, 'tsl_mult': 0.09343103216978765, 'strategy': 'mean_reversion', 'time_stop': 6, 'use_sma': False, 'use_atr': False, 'use_adx': True, 'use_ema': False, 'use_spike': False, 'rsi_required': False, 'edge_k': 1.3274038475331453, 'edge_cap': 0.29843990383247104, 'bull_strategy': 'breakout', 'bull_bb_std_mult': 1.5351817310259488, 'bull_rsi_os': 40, 'bull_rsi_ob': 49, 'bull_adx_thresh': 22.468828195506294, 'bull_atr_min_pct': 0.018597946732322686, 'bull_atr_max_pct': 0.03837787486686626, 'bull_tp_mult': 2.4512190329652883, 'bull_tsl_mult': 0.9201868490852674, 'bull_time_stop': 112, 'bull_use_sma': True, 'bull_use_ema': True, 'bull_use_atr': True, 'bull_use_adx': False, 'bull_use_spike': False, 'bull_rsi_required': True, 'bear_strategy': 'breakout', 'bear_bb_std_mult': 1.9209869935206347, 'bear_rsi_os': 10, 'bear_rsi_ob': 75, 'bear_adx_thresh': 23.677369040994197, 'bear_atr_min_pct': 0.004570408765756765, 'bear_atr_max_pct': 0.0459131430483298, 'bear_tp_mult': 2.0269083797253304, 'bear_tsl_mult': 0.853644324294437, 'bear_time_stop': 207, 'bear_use_sma': True, 'bear_use_ema': False, 'bear_use_atr': True, 'bear_use_adx': True, 'bear_use_spike': False, 'bear_rsi_required': True, 'sideways_strategy': 'mean_reversion', 'sideways_bb_std_mult': 2.0178457781006838, 'sideways_rsi_os': 24, 'sideways_rsi_ob': 95, 'sideways_adx_thresh': 27.145572710150095, 'sideways_atr_min_pct': 0.01172192710432742, 'sideways_atr_max_pct': 0.11870689740256243, 'sideways_tp_mult': 2.9587298911356164, 'sideways_tsl_mult': 0.3237008165370792, 'sideways_time_stop': 153, 'sideways_use_sma': True, 'sideways_use_ema': True, 'sideways_use_atr': False, 'sideways_use_adx': False, 'sideways_use_spike': True, 'sideways_rsi_required': True}.
[I 2025-08-30 18:40:28,287] Trial 37 finished with values: [-1000000000.0, 1000000000.0] and parameters: {'p_sma': 39, 'p_std': 41, 'p_atr': 24, 'p_adx': 13, 'rsi_period': 16, 'ema1': 11, 'ema2': 26, 'slip_atr_k': 0.05997997354372849, 'slip_spread_k': 0.12060018399639982, 'spread_hl_frac': 0.04151496315426895, 'bb_std_mult': 2.460495396210513, 'rsi_os': 23, 'rsi_ob': 53, 'vol_spike': 0.241795853981369, 'adx_thresh': 29.78336812107029, 'atr_min_pct': 0.007548171322097016, 'atr_max_pct': 0.1150656828902909, 'tp_mult': 2.2970297072525203, 'tsl_mult': 0.09772690019975205, 'strategy': 'mean_reversion', 'time_stop': 96, 'use_sma': False, 'use_atr': False, 'use_adx': True, 'use_ema': False, 'use_spike': False, 'rsi_required': False, 'edge_k': 0.6717842637615244, 'edge_cap': 0.31231843286330707, 'bull_strategy': 'breakout', 'bull_bb_std_mult': 1.991448597074102, 'bull_rsi_os': 36, 'bull_rsi_ob': 69, 'bull_adx_thresh': 29.812835234878673, 'bull_atr_min_pct': 0.018853439797934662, 'bull_atr_max_pct': 0.09536895248677807, 'bull_tp_mult': 2.418789311994513, 'bull_tsl_mult': 0.933398139800063, 'bull_time_stop': 105, 'bull_use_sma': True, 'bull_use_ema': True, 'bull_use_atr': True, 'bull_use_adx': False, 'bull_use_spike': False, 'bull_rsi_required': False, 'bear_strategy': 'breakout', 'bear_bb_std_mult': 1.9384382319693358, 'bear_rsi_os': 32, 'bear_rsi_ob': 75, 'bear_adx_thresh': 22.658141500064314, 'bear_atr_min_pct': 0.020315457871436016, 'bear_atr_max_pct': 0.04848216048143661, 'bear_tp_mult': 2.0156978784010042, 'bear_tsl_mult': 0.028574318097143947, 'bear_time_stop': 198, 'bear_use_sma': True, 'bear_use_ema': False, 'bear_use_atr': True, 'bear_use_adx': True, 'bear_use_spike': False, 'bear_rsi_required': True, 'sideways_strategy': 'mean_reversion', 'sideways_bb_std_mult': 3.5416314700003406, 'sideways_rsi_os': 6, 'sideways_rsi_ob': 46, 'sideways_adx_thresh': 30.184610617428405, 'sideways_atr_min_pct': 0.012094134023895583, 'sideways_atr_max_pct': 0.02513718544154412, 'sideways_tp_mult': 2.9825270823471883, 'sideways_tsl_mult': 0.2682285001963884, 'sideways_time_stop': 153, 'sideways_use_sma': True, 'sideways_use_ema': True, 'sideways_use_atr': False, 'sideways_use_adx': False, 'sideways_use_spike': True, 'sideways_rsi_required': True}.
[I 2025-08-30 18:40:28,635] Trial 39 finished with values: [-1000000000.0, 1000000000.0] and parameters: {'p_sma': 50, 'p_std': 58, 'p_atr': 20, 'p_adx': 12, 'rsi_period': 42, 'ema1': 12, 'ema2': 25, 'slip_atr_k': 0.05550782123616213, 'slip_spread_k': 0.12337062383820596, 'spread_hl_frac': 0.04041808202285001, 'bb_std_mult': 1.2894295457491767, 'rsi_os': 15, 'rsi_ob': 67, 'vol_spike': 0.2311961433452328, 'adx_thresh': 24.873829817770076, 'atr_min_pct': 0.006412555839785675, 'atr_max_pct': 0.03893681844591144, 'tp_mult': 1.2296449263634224, 'tsl_mult': 0.06522966559284551, 'strategy': 'mean_reversion', 'time_stop': 98, 'use_sma': True, 'use_atr': True, 'use_adx': True, 'use_ema': False, 'use_spike': False, 'rsi_required': False, 'edge_k': 0.6620003664007023, 'edge_cap': 0.3077638631294368, 'bull_strategy': 'breakout', 'bull_bb_std_mult': 1.4744754175818497, 'bull_rsi_os': 44, 'bull_rsi_ob': 51, 'bull_adx_thresh': 30.272361461201463, 'bull_atr_min_pct': 0.02110356197292181, 'bull_atr_max_pct': 0.04259379544664116, 'bull_tp_mult': 2.002474628693254, 'bull_tsl_mult': 0.8973152542986353, 'bull_time_stop': 34, 'bull_use_sma': False, 'bull_use_ema': True, 'bull_use_atr': True, 'bull_use_adx': False, 'bull_use_spike': False, 'bull_rsi_required': True, 'bear_strategy': 'breakout', 'bear_bb_std_mult': 1.7921907748707, 'bear_rsi_os': 24, 'bear_rsi_ob': 89, 'bear_adx_thresh': 23.331136708834396, 'bear_atr_min_pct': 0.016399911357716568, 'bear_atr_max_pct': 0.0667410641645643, 'bear_tp_mult': 2.6735953303443427, 'bear_tsl_mult': 0.8748390342418914, 'bear_time_stop': 213, 'bear_use_sma': True, 'bear_use_ema': False, 'bear_use_atr': True, 'bear_use_adx': True, 'bear_use_spike': False, 'bear_rsi_required': True, 'sideways_strategy': 'mean_reversion', 'sideways_bb_std_mult': 3.545251305300813, 'sideways_rsi_os': 9, 'sideways_rsi_ob': 53, 'sideways_adx_thresh': 16.8301044749382, 'sideways_atr_min_pct': 0.011992325818014337, 'sideways_atr_max_pct': 0.02075171075776379, 'sideways_tp_mult': 1.889928034113982, 'sideways_tsl_mult': 0.26808525709629916, 'sideways_time_stop': 156, 'sideways_use_sma': True, 'sideways_use_ema': True, 'sideways_use_atr': False, 'sideways_use_adx': True, 'sideways_use_spike': True, 'sideways_rsi_required': True}.
[I 2025-08-30 18:41:01,973] Trial 40 finished with values: [-1000000000.0, 1000000000.0] and parameters: {'p_sma': 48, 'p_std': 45, 'p_atr': 20, 'p_adx': 9, 'rsi_period': 42, 'ema1': 5, 'ema2': 12, 'slip_atr_k': 0.0634133302347083, 'slip_spread_k': 0.2513741105991676, 'spread_hl_frac': 0.015562224948471688, 'bb_std_mult': 3.537264435686354, 'rsi_os': 6, 'rsi_ob': 68, 'vol_spike': 0.22375697317114002, 'adx_thresh': 24.99756875193089, 'atr_min_pct': 0.01536308665193024, 'atr_max_pct': 0.03213708747446572, 'tp_mult': 2.2968996649865825, 'tsl_mult': 0.0006424437718858811, 'strategy': 'mean_reversion', 'time_stop': 97, 'use_sma': True, 'use_atr': True, 'use_adx': True, 'use_ema': False, 'use_spike': False, 'rsi_required': False, 'edge_k': 1.3340108077451647, 'edge_cap': 0.2989634839425658, 'bull_strategy': 'breakout', 'bull_bb_std_mult': 1.5001792727118821, 'bull_rsi_os': 42, 'bull_rsi_ob': 48, 'bull_adx_thresh': 30.38452171722162, 'bull_atr_min_pct': 0.02296332634873728, 'bull_atr_max_pct': 0.03693011899137059, 'bull_tp_mult': 1.9137763829720935, 'bull_tsl_mult': 0.9132459739490854, 'bull_time_stop': 34, 'bull_use_sma': False, 'bull_use_ema': True, 'bull_use_atr': True, 'bull_use_adx': False, 'bull_use_spike': False, 'bull_rsi_required': True, 'bear_strategy': 'mean_reversion', 'bear_bb_std_mult': 1.1942281784902535, 'bear_rsi_os': 32, 'bear_rsi_ob': 91, 'bear_adx_thresh': 21.834155655529596, 'bear_atr_min_pct': 0.022515655410430085, 'bear_atr_max_pct': 0.04662104736225005, 'bear_tp_mult': 1.7479346915669314, 'bear_tsl_mult': 0.7941633711056656, 'bear_time_stop': 198, 'bear_use_sma': True, 'bear_use_ema': True, 'bear_use_atr': False, 'bear_use_adx': False, 'bear_use_spike': True, 'bear_rsi_required': True, 'sideways_strategy': 'mean_reversion', 'sideways_bb_std_mult': 3.199621939781472, 'sideways_rsi_os': 36, 'sideways_rsi_ob': 92, 'sideways_adx_thresh': 16.40622852788502, 'sideways_atr_min_pct': 0.006994311544774848, 'sideways_atr_max_pct': 0.024815686852985783, 'sideways_tp_mult': 2.6919159376559083, 'sideways_tsl_mult': 0.4475224870858076, 'sideways_time_stop': 151, 'sideways_use_sma': False, 'sideways_use_ema': False, 'sideways_use_atr': False, 'sideways_use_adx': True, 'sideways_use_spike': True, 'sideways_rsi_required': True}.
[I 2025-08-30 18:41:02,166] Trial 43 finished with values: [-1000000000.0, 1000000000.0] and parameters: {'p_sma': 54, 'p_std': 46, 'p_atr': 19, 'p_adx': 26, 'rsi_period': 38, 'ema1': 19, 'ema2': 34, 'slip_atr_k': 0.21391369322555256, 'slip_spread_k': 0.28658913695935706, 'spread_hl_frac': 0.026622191268991426, 'bb_std_mult': 3.0378146342119257, 'rsi_os': 41, 'rsi_ob': 78, 'vol_spike': 0.06917088827205678, 'adx_thresh': 9.380432966438661, 'atr_min_pct': 0.016016673657125814, 'atr_max_pct': 0.13119016300425895, 'tp_mult': 2.3907316565737085, 'tsl_mult': 0.23191112685066811, 'strategy': 'breakout', 'time_stop': 180, 'use_sma': True, 'use_atr': True, 'use_adx': False, 'use_ema': True, 'use_spike': False, 'rsi_required': True, 'edge_k': 1.8170506799736836, 'edge_cap': 0.528212697108629, 'bull_strategy': 'mean_reversion', 'bull_bb_std_mult': 0.947475839284367, 'bull_rsi_os': 28, 'bull_rsi_ob': 83, 'bull_adx_thresh': 6.0662998735772184, 'bull_atr_min_pct': 0.02313246849775214, 'bull_atr_max_pct': 0.05589779279203709, 'bull_tp_mult': 2.716723336883183, 'bull_tsl_mult': 0.9925085950273065, 'bull_time_stop': 5, 'bull_use_sma': False, 'bull_use_ema': False, 'bull_use_atr': True, 'bull_use_adx': True, 'bull_use_spike': True, 'bull_rsi_required': True, 'bear_strategy': 'mean_reversion', 'bear_bb_std_mult': 1.2196983653566233, 'bear_rsi_os': 24, 'bear_rsi_ob': 82, 'bear_adx_thresh': 27.47939959240058, 'bear_atr_min_pct': 0.02326579469871798, 'bear_atr_max_pct': 0.03427454988803298, 'bear_tp_mult': 1.4982660349717358, 'bear_tsl_mult': 0.5380459493886064, 'bear_time_stop': 260, 'bear_use_sma': True, 'bear_use_ema': True, 'bear_use_atr': False, 'bear_use_adx': False, 'bear_use_spike': True, 'bear_rsi_required': False, 'sideways_strategy': 'breakout', 'sideways_bb_std_mult': 3.2903675869719446, 'sideways_rsi_os': 28, 'sideways_rsi_ob': 87, 'sideways_adx_thresh': 19.254655253938164, 'sideways_atr_min_pct': 0.008303307480512896, 'sideways_atr_max_pct': 0.11693314862885287, 'sideways_tp_mult': 2.7341608031855773, 'sideways_tsl_mult': 0.44095904636880584, 'sideways_time_stop': 167, 'sideways_use_sma': False, 'sideways_use_ema': False, 'sideways_use_atr': True, 'sideways_use_adx': True, 'sideways_use_spike': False, 'sideways_rsi_required': False}.
[I 2025-08-30 18:41:02,249] Trial 42 finished with values: [-1000000000.0, 1000000000.0] and parameters: {'p_sma': 49, 'p_std': 49, 'p_atr': 20, 'p_adx': 27, 'rsi_period': 38, 'ema1': 5, 'ema2': 14, 'slip_atr_k': 0.21875645075958047, 'slip_spread_k': 0.5931367777343182, 'spread_hl_frac': 0.026491645825133203, 'bb_std_mult': 1.890694478612712, 'rsi_os': 12, 'rsi_ob': 68, 'vol_spike': 0.10265224462983594, 'adx_thresh': 22.011380889652692, 'atr_min_pct': 0.0024410820567278835, 'atr_max_pct': 0.03325663283094748, 'tp_mult': 1.2639187283376545, 'tsl_mult': 0.21014769336152178, 'strategy': 'breakout', 'time_stop': 105, 'use_sma': True, 'use_atr': True, 'use_adx': True, 'use_ema': True, 'use_spike': False, 'rsi_required': False, 'edge_k': 0.6028839462419304, 'edge_cap': 0.5483014706508207, 'bull_strategy': 'mean_reversion', 'bull_bb_std_mult': 0.9686101843741299, 'bull_rsi_os': 28, 'bull_rsi_ob': 82, 'bull_adx_thresh': 17.939816707943187, 'bull_atr_min_pct': 0.022229472966382096, 'bull_atr_max_pct': 0.11631590716820847, 'bull_tp_mult': 2.6800118730249887, 'bull_tsl_mult': 0.9034647499163319, 'bull_time_stop': 8, 'bull_use_sma': False, 'bull_use_ema': False, 'bull_use_atr': True, 'bull_use_adx': True, 'bull_use_spike': True, 'bull_rsi_required': True, 'bear_strategy': 'mean_reversion', 'bear_bb_std_mult': 1.199180980153962, 'bear_rsi_os': 25, 'bear_rsi_ob': 88, 'bear_adx_thresh': 27.508181948041745, 'bear_atr_min_pct': 0.02276504554282312, 'bear_atr_max_pct': 0.10846063284492083, 'bear_tp_mult': 2.6711433478657023, 'bear_tsl_mult': 0.5270631410228575, 'bear_time_stop': 260, 'bear_use_sma': True, 'bear_use_ema': True, 'bear_use_atr': False, 'bear_use_adx': False, 'bear_use_spike': True, 'bear_rsi_required': True, 'sideways_strategy': 'breakout', 'sideways_bb_std_mult': 3.169283912505122, 'sideways_rsi_os': 36, 'sideways_rsi_ob': 51, 'sideways_adx_thresh': 17.712142199735254, 'sideways_atr_min_pct': 0.006697792217527233, 'sideways_atr_max_pct': 0.08514976632278638, 'sideways_tp_mult': 2.745772884360127, 'sideways_tsl_mult': 0.5391527360852993, 'sideways_time_stop': 253, 'sideways_use_sma': False, 'sideways_use_ema': False, 'sideways_use_atr': True, 'sideways_use_adx': True, 'sideways_use_spike': False, 'sideways_rsi_required': False}.
[I 2025-08-30 18:41:02,421] Trial 41 finished with values: [-1000000000.0, 1000000000.0] and parameters: {'p_sma': 49, 'p_std': 43, 'p_atr': 24, 'p_adx': 9, 'rsi_period': 40, 'ema1': 5, 'ema2': 12, 'slip_atr_k': 0.04773174763634001, 'slip_spread_k': 0.7816011780512169, 'spread_hl_frac': 0.027021084774567453, 'bb_std_mult': 1.305668593850205, 'rsi_os': 15, 'rsi_ob': 68, 'vol_spike': 0.10729727801831296, 'adx_thresh': 21.881563003649635, 'atr_min_pct': 0.015437240129240982, 'atr_max_pct': 0.05033054178709122, 'tp_mult': 2.340577630684039, 'tsl_mult': 0.22104407667233059, 'strategy': 'breakout', 'time_stop': 99, 'use_sma': True, 'use_atr': True, 'use_adx': True, 'use_ema': True, 'use_spike': False, 'rsi_required': False, 'edge_k': 0.640571404517432, 'edge_cap': 0.3286092046723514, 'bull_strategy': 'mean_reversion', 'bull_bb_std_mult': 2.0817944827407477, 'bull_rsi_os': 10, 'bull_rsi_ob': 68, 'bull_adx_thresh': 30.554545857577757, 'bull_atr_min_pct': 0.02243474668289334, 'bull_atr_max_pct': 0.1166246926548133, 'bull_tp_mult': 1.950208378940618, 'bull_tsl_mult': 0.9186487777333822, 'bull_time_stop': 39, 'bull_use_sma': False, 'bull_use_ema': False, 'bull_use_atr': True, 'bull_use_adx': False, 'bull_use_spike': False, 'bull_rsi_required': True, 'bear_strategy': 'mean_reversion', 'bear_bb_std_mult': 1.28797388107381, 'bear_rsi_os': 33, 'bear_rsi_ob': 89, 'bear_adx_thresh': 27.399177302853488, 'bear_atr_min_pct': 0.021961345014568694, 'bear_atr_max_pct': 0.06445067100635381, 'bear_tp_mult': 1.5248809842021074, 'bear_tsl_mult': 0.5348112013158892, 'bear_time_stop': 186, 'bear_use_sma': True, 'bear_use_ema': True, 'bear_use_atr': False, 'bear_use_adx': False, 'bear_use_spike': True, 'bear_rsi_required': True, 'sideways_strategy': 'mean_reversion', 'sideways_bb_std_mult': 3.5615314318296423, 'sideways_rsi_os': 35, 'sideways_rsi_ob': 90, 'sideways_adx_thresh': 7.797241689837106, 'sideways_atr_min_pct': 0.007824593594957317, 'sideways_atr_max_pct': 0.02200889352288523, 'sideways_tp_mult': 2.715325503766951, 'sideways_tsl_mult': 0.43898698862347224, 'sideways_time_stop': 175, 'sideways_use_sma': False, 'sideways_use_ema': False, 'sideways_use_atr': False, 'sideways_use_adx': True, 'sideways_use_spike': True, 'sideways_rsi_required': True}.
[I 2025-08-30 18:41:35,228] Trial 44 finished with values: [-0.03707046348476428, 0.036986976159733176] and parameters: {'p_sma': 54, 'p_std': 9, 'p_atr': 10, 'p_adx': 9, 'rsi_period': 37, 'ema1': 18, 'ema2': 34, 'slip_atr_k': 0.23413416296208206, 'slip_spread_k': 0.585123857283095, 'spread_hl_frac': 0.026214854318682642, 'bb_std_mult': 3.01766992350324, 'rsi_os': 40, 'rsi_ob': 86, 'vol_spike': 0.019972221365153992, 'adx_thresh': 9.662305390100746, 'atr_min_pct': 0.014992507093067882, 'atr_max_pct': 0.13209491343316898, 'tp_mult': 2.43213742887808, 'tsl_mult': 0.22533777531595445, 'strategy': 'breakout', 'time_stop': 172, 'use_sma': False, 'use_atr': True, 'use_adx': False, 'use_ema': True, 'use_spike': False, 'rsi_required': True, 'edge_k': 0.41264494108978955, 'edge_cap': 0.5178976630148535, 'bull_strategy': 'mean_reversion', 'bull_bb_std_mult': 1.804396879156939, 'bull_rsi_os': 29, 'bull_rsi_ob': 84, 'bull_adx_thresh': 10.94459413654499, 'bull_atr_min_pct': 0.002545323287073283, 'bull_atr_max_pct': 0.11840964068660009, 'bull_tp_mult': 2.696584820522743, 'bull_tsl_mult': 0.9991188920867689, 'bull_time_stop': 6, 'bull_use_sma': True, 'bull_use_ema': False, 'bull_use_atr': True, 'bull_use_adx': True, 'bull_use_spike': True, 'bull_rsi_required': True, 'bear_strategy': 'mean_reversion', 'bear_bb_std_mult': 3.28314216770095, 'bear_rsi_os': 25, 'bear_rsi_ob': 81, 'bear_adx_thresh': 32.36761500347811, 'bear_atr_min_pct': 0.022151250923519647, 'bear_atr_max_pct': 0.02952725724336132, 'bear_tp_mult': 2.5002382133576004, 'bear_tsl_mult': 0.5351362558067874, 'bear_time_stop': 32, 'bear_use_sma': True, 'bear_use_ema': True, 'bear_use_atr': False, 'bear_use_adx': False, 'bear_use_spike': True, 'bear_rsi_required': False, 'sideways_strategy': 'breakout', 'sideways_bb_std_mult': 1.5624413096307619, 'sideways_rsi_os': 21, 'sideways_rsi_ob': 88, 'sideways_adx_thresh': 7.771770458014551, 'sideways_atr_min_pct': 0.009838910809869988, 'sideways_atr_max_pct': 0.11987732028891558, 'sideways_tp_mult': 1.6567442231074982, 'sideways_tsl_mult': 0.5289732666014171, 'sideways_time_stop': 250, 'sideways_use_sma': False, 'sideways_use_ema': False, 'sideways_use_atr': True, 'sideways_use_adx': False, 'sideways_use_spike': False, 'sideways_rsi_required': False}.
