[I 2025-08-30 18:51:31,568] Trial 126 finished with values: [-1000000000.0, 1000000000.0] and parameters: {'p_sma': 52, 'p_std': 25, 'p_atr': 11, 'p_adx': 9, 'rsi_period': 48, 'ema1': 23, 'ema2': 21, 'slip_atr_k': 0.11670253765124824, 'slip_spread_k': 0.4639883909557019, 'spread_hl_frac': 0.028687534069180485, 'bb_std_mult': 1.1721787586184846, 'rsi_os': 5, 'rsi_ob': 62, 'vol_spike': 0.029187662378098327, 'adx_thresh': 17.67386798227738, 'atr_min_pct': 0.021050752984791206, 'atr_max_pct': 0.05021890225102551, 'tp_mult': 2.0367056594421946, 'tsl_mult': 0.05394135452751775, 'strategy': 'breakout', 'time_stop': 38, 'use_sma': True, 'use_atr': True, 'use_adx': False, 'use_ema': True, 'use_spike': False, 'rsi_required': True, 'edge_k': 0.35555540903838123, 'edge_cap': 0.15487714776621986, 'bull_strategy': 'mean_reversion', 'bull_bb_std_mult': 1.6371059037377211, 'bull_rsi_os': 54, 'bull_rsi_ob': 73, 'bull_adx_thresh': 17.58524079457996, 'bull_atr_min_pct': 0.012807793762496116, 'bull_atr_max_pct': 0.023849794271178726, 'bull_tp_mult': 2.107004320597385, 'bull_tsl_mult': 0.08966618615995381, 'bull_time_stop': 197, 'bull_use_sma': False, 'bull_use_ema': True, 'bull_use_atr': False, 'bull_use_adx': True, 'bull_use_spike': True, 'bull_rsi_required': False, 'bear_strategy': 'breakout', 'bear_bb_std_mult': 0.6559350302139706, 'bear_rsi_os': 45, 'bear_rsi_ob': 78, 'bear_adx_thresh': 11.71157657718283, 'bear_atr_min_pct': 0.015293115374351808, 'bear_atr_max_pct': 0.04895402018921411, 'bear_tp_mult': 1.8342144766951547, 'bear_tsl_mult': 0.26871920696687024, 'bear_time_stop': 33, 'bear_use_sma': True, 'bear_use_ema': False, 'bear_use_atr': False, 'bear_use_adx': False, 'bear_use_spike': True, 'bear_rsi_required': False, 'sideways_strategy': 'mean_reversion', 'sideways_bb_std_mult': 2.0926788071374216, 'sideways_rsi_os': 48, 'sideways_rsi_ob': 57, 'sideways_adx_thresh': 9.0671184616407, 'sideways_atr_min_pct': 0.01764078768910743, 'sideways_atr_max_pct': 0.0953753375192489, 'sideways_tp_mult': 1.5815459432665027, 'sideways_tsl_mult': 0.705494053464718, 'sideways_time_stop': 62, 'sideways_use_sma': True, 'sideways_use_ema': True, 'sideways_use_atr': False, 'sideways_use_adx': True, 'sideways_use_spike': True, 'sideways_rsi_required': False}.
[I 2025-08-30 18:51:31,655] Trial 125 finished with values: [-0.02284748440380846, 0.02276516216012896] and parameters: {'p_sma': 56, 'p_std': 39, 'p_atr': 11, 'p_adx': 9, 'rsi_period': 48, 'ema1': 24, 'ema2': 13, 'slip_atr_k': 0.012837930747121131, 'slip_spread_k': 0.4072722671641955, 'spread_hl_frac': 0.028993383117917965, 'bb_std_mult': 1.1281795543422648, 'rsi_os': 37, 'rsi_ob': 63, 'vol_spike': 0.029286656726827613, 'adx_thresh': 30.658267457896788, 'atr_min_pct': 0.01170870866800056, 'atr_max_pct': 0.11657225502356, 'tp_mult': 1.3574505016684757, 'tsl_mult': 0.8355856070511312, 'strategy': 'breakout', 'time_stop': 36, 'use_sma': False, 'use_atr': True, 'use_adx': False, 'use_ema': True, 'use_spike': False, 'rsi_required': True, 'edge_k': 1.2299494841704537, 'edge_cap': 0.22627381947147643, 'bull_strategy': 'mean_reversion', 'bull_bb_std_mult': 2.034797675149897, 'bull_rsi_os': 9, 'bull_rsi_ob': 50, 'bull_adx_thresh': 17.777787673344147, 'bull_atr_min_pct': 0.002061468439567341, 'bull_atr_max_pct': 0.030250000918416446, 'bull_tp_mult': 1.1997993758845231, 'bull_tsl_mult': 0.7509376269705985, 'bull_time_stop': 15, 'bull_use_sma': True, 'bull_use_ema': False, 'bull_use_atr': False, 'bull_use_adx': True, 'bull_use_spike': True, 'bull_rsi_required': True, 'bear_strategy': 'breakout', 'bear_bb_std_mult': 0.6919484906350921, 'bear_rsi_os': 45, 'bear_rsi_ob': 57, 'bear_adx_thresh': 5.4750970547975975, 'bear_atr_min_pct': 0.006305904135674868, 'bear_atr_max_pct': 0.05907106557676619, 'bear_tp_mult': 2.43449350619909, 'bear_tsl_mult': 0.11198243507610052, 'bear_time_stop': 29, 'bear_use_sma': True, 'bear_use_ema': False, 'bear_use_atr': True, 'bear_use_adx': True, 'bear_use_spike': False, 'bear_rsi_required': False, 'sideways_strategy': 'breakout', 'sideways_bb_std_mult': 1.9385452559980187, 'sideways_rsi_os': 11, 'sideways_rsi_ob': 61, 'sideways_adx_thresh': 9.31829396291532, 'sideways_atr_min_pct': 0.017956295091194997, 'sideways_atr_max_pct': 0.09693755458928174, 'sideways_tp_mult': 1.735686843632802, 'sideways_tsl_mult': 0.7117188380001838, 'sideways_time_stop': 102, 'sideways_use_sma': True, 'sideways_use_ema': True, 'sideways_use_atr': False, 'sideways_use_adx': False, 'sideways_use_spike': True, 'sideways_rsi_required': False}.
[I 2025-08-30 18:52:05,198] Trial 130 finished with values: [-1000000000.0, 1000000000.0] and parameters: {'p_sma': 41, 'p_std': 28, 'p_atr': 11, 'p_adx': 8, 'rsi_period': 77, 'ema1': 24, 'ema2': 35, 'slip_atr_k': 0.027241572932013403, 'slip_spread_k': 0.4086700148829365, 'spread_hl_frac': 0.002139127140945528, 'bb_std_mult': 0.8479911089694662, 'rsi_os': 34, 'rsi_ob': 75, 'vol_spike': 0.005061671209656005, 'adx_thresh': 21.967554870528094, 'atr_min_pct': 0.009621160474649833, 'atr_max_pct': 0.029603724099602283, 'tp_mult': 2.239251361423311, 'tsl_mult': 0.13167019268088065, 'strategy': 'breakout', 'time_stop': 130, 'use_sma': False, 'use_atr': True, 'use_adx': False, 'use_ema': False, 'use_spike': True, 'rsi_required': False, 'edge_k': 1.5942702785002043, 'edge_cap': 0.3435602130595047, 'bull_strategy': 'breakout', 'bull_bb_std_mult': 2.0439960283017164, 'bull_rsi_os': 9, 'bull_rsi_ob': 61, 'bull_adx_thresh': 20.34651301918758, 'bull_atr_min_pct': 0.019906861580184364, 'bull_atr_max_pct': 0.061279704733865153, 'bull_tp_mult': 2.2655249947871643, 'bull_tsl_mult': 0.8138662236164523, 'bull_time_stop': 15, 'bull_use_sma': True, 'bull_use_ema': False, 'bull_use_atr': False, 'bull_use_adx': True, 'bull_use_spike': True, 'bull_rsi_required': True, 'bear_strategy': 'mean_reversion', 'bear_bb_std_mult': 3.1707399448552818, 'bear_rsi_os': 23, 'bear_rsi_ob': 56, 'bear_adx_thresh': 17.345366796562462, 'bear_atr_min_pct': 0.005780055911754177, 'bear_atr_max_pct': 0.14765215864660255, 'bear_tp_mult': 2.4178231657792186, 'bear_tsl_mult': 0.1470354768896962, 'bear_time_stop': 207, 'bear_use_sma': True, 'bear_use_ema': True, 'bear_use_atr': True, 'bear_use_adx': True, 'bear_use_spike': False, 'bear_rsi_required': False, 'sideways_strategy': 'breakout', 'sideways_bb_std_mult': 0.8527690641524772, 'sideways_rsi_os': 10, 'sideways_rsi_ob': 89, 'sideways_adx_thresh': 9.418290425047307, 'sideways_atr_min_pct': 0.002443165932695531, 'sideways_atr_max_pct': 0.10405980750267788, 'sideways_tp_mult': 1.2657884515090931, 'sideways_tsl_mult': 0.2946138436549507, 'sideways_time_stop': 122, 'sideways_use_sma': False, 'sideways_use_ema': True, 'sideways_use_atr': False, 'sideways_use_adx': False, 'sideways_use_spike': False, 'sideways_rsi_required': False}.
[I 2025-08-30 18:52:05,440] Trial 131 finished with values: [-1000000000.0, 1000000000.0] and parameters: {'p_sma': 56, 'p_std': 28, 'p_atr': 16, 'p_adx': 8, 'rsi_period': 14, 'ema1': 27, 'ema2': 15, 'slip_atr_k': 0.027706152977404752, 'slip_spread_k': 0.027448929415397172, 'spread_hl_frac': 0.002263124160255127, 'bb_std_mult': 2.8650208765261986, 'rsi_os': 22, 'rsi_ob': 75, 'vol_spike': 0.04718276618013021, 'adx_thresh': 8.090181517978872, 'atr_min_pct': 0.009658102416259983, 'atr_max_pct': 0.13123647489159562, 'tp_mult': 1.6945844902790668, 'tsl_mult': 0.6560773020535015, 'strategy': 'breakout', 'time_stop': 250, 'use_sma': False, 'use_atr': True, 'use_adx': True, 'use_ema': False, 'use_spike': True, 'rsi_required': False, 'edge_k': 0.8628975142607256, 'edge_cap': 0.26053032166979767, 'bull_strategy': 'breakout', 'bull_bb_std_mult': 2.0514287085148326, 'bull_rsi_os': 55, 'bull_rsi_ob': 71, 'bull_adx_thresh': 27.188409562839002, 'bull_atr_min_pct': 0.01695694766510365, 'bull_atr_max_pct': 0.03523795584847035, 'bull_tp_mult': 2.243556949391411, 'bull_tsl_mult': 0.8070792300731711, 'bull_time_stop': 264, 'bull_use_sma': True, 'bull_use_ema': False, 'bull_use_atr': False, 'bull_use_adx': True, 'bull_use_spike': True, 'bull_rsi_required': True, 'bear_strategy': 'mean_reversion', 'bear_bb_std_mult': 3.170556904794377, 'bear_rsi_os': 41, 'bear_rsi_ob': 92, 'bear_adx_thresh': 28.452005696290506, 'bear_atr_min_pct': 0.01603652863564275, 'bear_atr_max_pct': 0.0474263343115503, 'bear_tp_mult': 2.4266112536172004, 'bear_tsl_mult': 0.8825801389807056, 'bear_time_stop': 105, 'bear_use_sma': True, 'bear_use_ema': True, 'bear_use_atr': True, 'bear_use_adx': True, 'bear_use_spike': False, 'bear_rsi_required': False, 'sideways_strategy': 'breakout', 'sideways_bb_std_mult': 1.3720847499028688, 'sideways_rsi_os': 11, 'sideways_rsi_ob': 56, 'sideways_adx_thresh': 11.042801096191965, 'sideways_atr_min_pct': 0.007418841028925669, 'sideways_atr_max_pct': 0.10236245838780514, 'sideways_tp_mult': 1.2895014613643019, 'sideways_tsl_mult': 0.8274635980753933, 'sideways_time_stop': 122, 'sideways_use_sma': False, 'sideways_use_ema': False, 'sideways_use_atr': False, 'sideways_use_adx': False, 'sideways_use_spike': False, 'sideways_rsi_required': False}.
[I 2025-08-30 18:52:06,162] Trial 128 finished with values: [-1000000000.0, 1000000000.0] and parameters: {'p_sma': 13, 'p_std': 27, 'p_atr': 11, 'p_adx': 8, 'rsi_period': 48, 'ema1': 23, 'ema2': 15, 'slip_atr_k': 0.13779744990952042, 'slip_spread_k': 0.41282780461083324, 'spread_hl_frac': 0.02947783037030735, 'bb_std_mult': 0.8380943312582645, 'rsi_os': 37, 'rsi_ob': 76, 'vol_spike': 0.018719931695003123, 'adx_thresh': 13.019338089487936, 'atr_min_pct': 0.011848507134415863, 'atr_max_pct': 0.1327938630682867, 'tp_mult': 1.6836679391138174, 'tsl_mult': 0.3953048329511039, 'strategy': 'breakout', 'time_stop': 109, 'use_sma': False, 'use_atr': True, 'use_adx': False, 'use_ema': True, 'use_spike': False, 'rsi_required': True, 'edge_k': 0.3875660543781321, 'edge_cap': 0.3441997812169109, 'bull_strategy': 'mean_reversion', 'bull_bb_std_mult': 2.0288497307027833, 'bull_rsi_os': 55, 'bull_rsi_ob': 50, 'bull_adx_thresh': 27.18927265069272, 'bull_atr_min_pct': 0.006639839124643894, 'bull_atr_max_pct': 0.0906064257429031, 'bull_tp_mult': 2.0916170343790377, 'bull_tsl_mult': 0.08286283999895377, 'bull_time_stop': 195, 'bull_use_sma': True, 'bull_use_ema': False, 'bull_use_atr': False, 'bull_use_adx': True, 'bull_use_spike': True, 'bull_rsi_required': True, 'bear_strategy': 'breakout', 'bear_bb_std_mult': 0.7592092797303378, 'bear_rsi_os': 46, 'bear_rsi_ob': 78, 'bear_adx_thresh': 28.631495630965283, 'bear_atr_min_pct': 0.015084723816279512, 'bear_atr_max_pct': 0.04667525316064671, 'bear_tp_mult': 2.4851507577997536, 'bear_tsl_mult': 0.10815431091711064, 'bear_time_stop': 30, 'bear_use_sma': True, 'bear_use_ema': True, 'bear_use_atr': True, 'bear_use_adx': True, 'bear_use_spike': False, 'bear_rsi_required': False, 'sideways_strategy': 'breakout', 'sideways_bb_std_mult': 2.9144457661015055, 'sideways_rsi_os': 10, 'sideways_rsi_ob': 88, 'sideways_adx_thresh': 23.95725256132281, 'sideways_atr_min_pct': 0.002521868634219644, 'sideways_atr_max_pct': 0.1288373760364998, 'sideways_tp_mult': 2.781199755450231, 'sideways_tsl_mult': 0.6316577953765682, 'sideways_time_stop': 54, 'sideways_use_sma': False, 'sideways_use_ema': True, 'sideways_use_atr': False, 'sideways_use_adx': False, 'sideways_use_spike': True, 'sideways_rsi_required': False}.
[I 2025-08-30 18:52:06,266] Trial 129 finished with values: [-1000000000.0, 1000000000.0] and parameters: {'p_sma': 41, 'p_std': 27, 'p_atr': 11, 'p_adx': 8, 'rsi_period': 48, 'ema1': 26, 'ema2': 13, 'slip_atr_k': 0.21979804543066633, 'slip_spread_k': 0.394202382112949, 'spread_hl_frac': 0.006661814858640647, 'bb_std_mult': 0.8382481014427879, 'rsi_os': 5, 'rsi_ob': 54, 'vol_spike': 0.04923148797915104, 'adx_thresh': 6.371037490175567, 'atr_min_pct': 0.02456326870669748, 'atr_max_pct': 0.052050143748984125, 'tp_mult': 2.2490868474416787, 'tsl_mult': 0.2940948138230185, 'strategy': 'breakout', 'time_stop': 5, 'use_sma': False, 'use_atr': True, 'use_adx': False, 'use_ema': False, 'use_spike': False, 'rsi_required': True, 'edge_k': 0.4270057687099009, 'edge_cap': 0.3488350386728748, 'bull_strategy': 'mean_reversion', 'bull_bb_std_mult': 2.0294347205689425, 'bull_rsi_os': 5, 'bull_rsi_ob': 49, 'bull_adx_thresh': 18.355653715704424, 'bull_atr_min_pct': 0.019824483495439894, 'bull_atr_max_pct': 0.060939997240117894, 'bull_tp_mult': 2.2627253327271504, 'bull_tsl_mult': 0.7614473028817774, 'bull_time_stop': 45, 'bull_use_sma': False, 'bull_use_ema': True, 'bull_use_atr': False, 'bull_use_adx': True, 'bull_use_spike': True, 'bull_rsi_required': True, 'bear_strategy': 'breakout', 'bear_bb_std_mult': 0.7152622280018597, 'bear_rsi_os': 43, 'bear_rsi_ob': 56, 'bear_adx_thresh': 15.739240546389329, 'bear_atr_min_pct': 0.02541893827748054, 'bear_atr_max_pct': 0.048502601918365994, 'bear_tp_mult': 1.016535608735583, 'bear_tsl_mult': 0.9415142246777732, 'bear_time_stop': 29, 'bear_use_sma': True, 'bear_use_ema': True, 'bear_use_atr': True, 'bear_use_adx': True, 'bear_use_spike': False, 'bear_rsi_required': False, 'sideways_strategy': 'mean_reversion', 'sideways_bb_std_mult': 0.828755099842025, 'sideways_rsi_os': 20, 'sideways_rsi_ob': 61, 'sideways_adx_thresh': 23.685549321873967, 'sideways_atr_min_pct': 0.02826650656694902, 'sideways_atr_max_pct': 0.09907286388445516, 'sideways_tp_mult': 2.769422153352856, 'sideways_tsl_mult': 0.8114646070063279, 'sideways_time_stop': 54, 'sideways_use_sma': False, 'sideways_use_ema': True, 'sideways_use_atr': False, 'sideways_use_adx': True, 'sideways_use_spike': True, 'sideways_rsi_required': False}.
[I 2025-08-30 18:52:06,729] Trial 133 finished with values: [-1000000000.0, 1000000000.0] and parameters: {'p_sma': 13, 'p_std': 42, 'p_atr': 9, 'p_adx': 8, 'rsi_period': 51, 'ema1': 26, 'ema2': 13, 'slip_atr_k': 0.01229439126191834, 'slip_spread_k': 0.49570294065655796, 'spread_hl_frac': 0.006807838335355733, 'bb_std_mult': 3.3546600904686352, 'rsi_os': 53, 'rsi_ob': 54, 'vol_spike': 0.2392059345867133, 'adx_thresh': 12.799931401401759, 'atr_min_pct': 0.024604952485781845, 'atr_max_pct': 0.11706457419117927, 'tp_mult': 1.3871061188666889, 'tsl_mult': 0.7384703568116097, 'strategy': 'mean_reversion', 'time_stop': 65, 'use_sma': False, 'use_atr': False, 'use_adx': False, 'use_ema': False, 'use_spike': False, 'rsi_required': True, 'edge_k': 1.7831361773142547, 'edge_cap': 0.21879746052565963, 'bull_strategy': 'mean_reversion', 'bull_bb_std_mult': 1.8807895306841893, 'bull_rsi_os': 13, 'bull_rsi_ob': 50, 'bull_adx_thresh': 24.120907001781084, 'bull_atr_min_pct': 0.003868037991170614, 'bull_atr_max_pct': 0.018094960212443216, 'bull_tp_mult': 2.4957120140790603, 'bull_tsl_mult': 0.9051111595015748, 'bull_time_stop': 185, 'bull_use_sma': False, 'bull_use_ema': True, 'bull_use_atr': False, 'bull_use_adx': True, 'bull_use_spike': True, 'bull_rsi_required': True, 'bear_strategy': 'breakout', 'bear_bb_std_mult': 1.9768999720902032, 'bear_rsi_os': 43, 'bear_rsi_ob': 90, 'bear_adx_thresh': 15.685705335257147, 'bear_atr_min_pct': 0.023952901696388737, 'bear_atr_max_pct': 0.11045601177818334, 'bear_tp_mult': 2.909016977467398, 'bear_tsl_mult': 0.12189918267852784, 'bear_time_stop': 279, 'bear_use_sma': True, 'bear_use_ema': False, 'bear_use_atr': True, 'bear_use_adx': True, 'bear_use_spike': False, 'bear_rsi_required': False, 'sideways_strategy': 'mean_reversion', 'sideways_bb_std_mult': 2.9092584332731053, 'sideways_rsi_os': 16, 'sideways_rsi_ob': 78, 'sideways_adx_thresh': 23.763802671885408, 'sideways_atr_min_pct': 0.006306871848766627, 'sideways_atr_max_pct': 0.030424242132982872, 'sideways_tp_mult': 2.9442066063022536, 'sideways_tsl_mult': 0.6421652771361257, 'sideways_time_stop': 50, 'sideways_use_sma': True, 'sideways_use_ema': True, 'sideways_use_atr': False, 'sideways_use_adx': True, 'sideways_use_spike': True, 'sideways_rsi_required': True}.
[I 2025-08-30 18:52:06,812] Trial 135 finished with values: [-1000000000.0, 1000000000.0] and parameters: {'p_sma': 15, 'p_std': 8, 'p_atr': 10, 'p_adx': 29, 'rsi_period': 51, 'ema1': 24, 'ema2': 17, 'slip_atr_k': 0.2419902944049136, 'slip_spread_k': 0.4345141908395718, 'spread_hl_frac': 0.03675775659868264, 'bb_std_mult': 1.4581636274347731, 'rsi_os': 39, 'rsi_ob': 50, 'vol_spike': 0.055653213933171866, 'adx_thresh': 14.07337037395061, 'atr_min_pct': 0.02275580523744368, 'atr_max_pct': 0.11068697012394978, 'tp_mult': 2.1576009441825788, 'tsl_mult': 0.8378654541574507, 'strategy': 'mean_reversion', 'time_stop': 90, 'use_sma': True, 'use_atr': False, 'use_adx': False, 'use_ema': False, 'use_spike': True, 'rsi_required': True, 'edge_k': 0.08581366461345828, 'edge_cap': 0.18182137332749027, 'bull_strategy': 'mean_reversion', 'bull_bb_std_mult': 1.8736909478815933, 'bull_rsi_os': 51, 'bull_rsi_ob': 87, 'bull_adx_thresh': 25.196280223803193, 'bull_atr_min_pct': 0.0038755562410393556, 'bull_atr_max_pct': 0.05313333458088762, 'bull_tp_mult': 2.157199125631892, 'bull_tsl_mult': 0.939931134517777, 'bull_time_stop': 171, 'bull_use_sma': True, 'bull_use_ema': False, 'bull_use_atr': False, 'bull_use_adx': True, 'bull_use_spike': True, 'bull_rsi_required': False, 'bear_strategy': 'breakout', 'bear_bb_std_mult': 3.3161250274303473, 'bear_rsi_os': 7, 'bear_rsi_ob': 72, 'bear_adx_thresh': 13.634529088233746, 'bear_atr_min_pct': 0.024177496543845663, 'bear_atr_max_pct': 0.11098053533271289, 'bear_tp_mult': 1.6877276952448865, 'bear_tsl_mult': 0.12745559106362112, 'bear_time_stop': 269, 'bear_use_sma': True, 'bear_use_ema': False, 'bear_use_atr': False, 'bear_use_adx': False, 'bear_use_spike': True, 'bear_rsi_required': False, 'sideways_strategy': 'breakout', 'sideways_bb_std_mult': 1.9545224450644267, 'sideways_rsi_os': 28, 'sideways_rsi_ob': 54, 'sideways_adx_thresh': 20.647000120353436, 'sideways_atr_min_pct': 0.02315645597761565, 'sideways_atr_max_pct': 0.06889978574376152, 'sideways_tp_mult': 1.7951795606740466, 'sideways_tsl_mult': 0.856823601078936, 'sideways_time_stop': 105, 'sideways_use_sma': True, 'sideways_use_ema': True, 'sideways_use_atr': True, 'sideways_use_adx': False, 'sideways_use_spike': False, 'sideways_rsi_required': True}.
[I 2025-08-30 18:52:38,094] Trial 132 finished with values: [-1000000000.0, 1000000000.0] and parameters: {'p_sma': 25, 'p_std': 5, 'p_atr': 9, 'p_adx': 29, 'rsi_period': 43, 'ema1': 26, 'ema2': 16, 'slip_atr_k': 0.242953127010951, 'slip_spread_k': 0.5547730989234056, 'spread_hl_frac': 0.006723251670070091, 'bb_std_mult': 3.4598646173839103, 'rsi_os': 36, 'rsi_ob': 56, 'vol_spike': 0.23552720179178205, 'adx_thresh': 6.611687869115709, 'atr_min_pct': 0.024555363845720088, 'atr_max_pct': 0.11716439605675188, 'tp_mult': 1.6514916180167294, 'tsl_mult': 0.30215701264925765, 'strategy': 'mean_reversion', 'time_stop': 90, 'use_sma': False, 'use_atr': True, 'use_adx': True, 'use_ema': False, 'use_spike': False, 'rsi_required': True, 'edge_k': 1.7488389890638392, 'edge_cap': 0.24947491262257498, 'bull_strategy': 'mean_reversion', 'bull_bb_std_mult': 3.379647291286731, 'bull_rsi_os': 38, 'bull_rsi_ob': 50, 'bull_adx_thresh': 27.13362696776909, 'bull_atr_min_pct': 0.011482767769831077, 'bull_atr_max_pct': 0.01808012063164882, 'bull_tp_mult': 1.9164524799953688, 'bull_tsl_mult': 0.32017061388970347, 'bull_time_stop': 167, 'bull_use_sma': True, 'bull_use_ema': False, 'bull_use_atr': False, 'bull_use_adx': True, 'bull_use_spike': True, 'bull_rsi_required': True, 'bear_strategy': 'breakout', 'bear_bb_std_mult': 3.028265138877516, 'bear_rsi_os': 41, 'bear_rsi_ob': 73, 'bear_adx_thresh': 21.352323223182935, 'bear_atr_min_pct': 0.007834811481963529, 'bear_atr_max_pct': 0.07138466731288629, 'bear_tp_mult': 1.0191555591798231, 'bear_tsl_mult': 0.05634479144380816, 'bear_time_stop': 108, 'bear_use_sma': True, 'bear_use_ema': False, 'bear_use_atr': True, 'bear_use_adx': True, 'bear_use_spike': False, 'bear_rsi_required': False, 'sideways_strategy': 'breakout', 'sideways_bb_std_mult': 1.2819850071017693, 'sideways_rsi_os': 16, 'sideways_rsi_ob': 77, 'sideways_adx_thresh': 21.19594062545173, 'sideways_atr_min_pct': 0.02849040976059348, 'sideways_atr_max_pct': 0.1277184445329815, 'sideways_tp_mult': 1.9122367109191418, 'sideways_tsl_mult': 0.8260551180353929, 'sideways_time_stop': 195, 'sideways_use_sma': True, 'sideways_use_ema': False, 'sideways_use_atr': False, 'sideways_use_adx': False, 'sideways_use_spike': True, 'sideways_rsi_required': False}.
