[I 2025-08-30 19:28:36,169] Trial 405 finished with values: [-1000000000.0, 1000000000.0] and parameters: {'p_sma': 14, 'p_std': 26, 'p_atr': 9, 'p_adx': 25, 'rsi_period': 56, 'ema1': 25, 'ema2': 57, 'slip_atr_k': 0.018081027839126063, 'slip_spread_k': 0.33866468534216165, 'spread_hl_frac': 0.0020307184363034803, 'bb_std_mult': 0.906476040764443, 'rsi_os': 35, 'rsi_ob': 69, 'vol_spike': 0.04091413536278808, 'adx_thresh': 32.71907680055306, 'atr_min_pct': 0.004892924841527976, 'atr_max_pct': 0.14404079605067682, 'tp_mult': 2.053417830370904, 'tsl_mult': 0.29421073276735477, 'strategy': 'breakout', 'time_stop': 247, 'use_sma': False, 'use_atr': True, 'use_adx': False, 'use_ema': False, 'use_spike': False, 'rsi_required': False, 'edge_k': 0.24161665426449763, 'edge_cap': 0.19298814240517026, 'bull_strategy': 'breakout', 'bull_bb_std_mult': 1.7927571746018893, 'bull_rsi_os': 47, 'bull_rsi_ob': 73, 'bull_adx_thresh': 28.01153173112326, 'bull_atr_min_pct': 0.0036914466133505424, 'bull_atr_max_pct': 0.022651529654677087, 'bull_tp_mult': 2.1566764951553243, 'bull_tsl_mult': 0.9518048772914723, 'bull_time_stop': 179, 'bull_use_sma': False, 'bull_use_ema': True, 'bull_use_atr': True, 'bull_use_adx': True, 'bull_use_spike': True, 'bull_rsi_required': False, 'bear_strategy': 'mean_reversion', 'bear_bb_std_mult': 1.6776449487747633, 'bear_rsi_os': 21, 'bear_rsi_ob': 80, 'bear_adx_thresh': 5.046114856816937, 'bear_atr_min_pct': 0.015550219576945641, 'bear_atr_max_pct': 0.08119599832192587, 'bear_tp_mult': 1.3198313587024848, 'bear_tsl_mult': 0.16270684165947175, 'bear_time_stop': 32, 'bear_use_sma': False, 'bear_use_ema': True, 'bear_use_atr': True, 'bear_use_adx': True, 'bear_use_spike': False, 'bear_rsi_required': True, 'sideways_strategy': 'breakout', 'sideways_bb_std_mult': 2.1049450221622434, 'sideways_rsi_os': 16, 'sideways_rsi_ob': 56, 'sideways_adx_thresh': 7.119268420672959, 'sideways_atr_min_pct': 0.023881757164177137, 'sideways_atr_max_pct': 0.11761879275694909, 'sideways_tp_mult': 2.053587755405672, 'sideways_tsl_mult': 0.6851740651733996, 'sideways_time_stop': 256, 'sideways_use_sma': False, 'sideways_use_ema': True, 'sideways_use_atr': False, 'sideways_use_adx': True, 'sideways_use_spike': False, 'sideways_rsi_required': False}.
[I 2025-08-30 19:29:10,249] Trial 409 finished with values: [-1000000000.0, 1000000000.0] and parameters: {'p_sma': 42, 'p_std': 22, 'p_atr': 28, 'p_adx': 12, 'rsi_period': 38, 'ema1': 23, 'ema2': 59, 'slip_atr_k': 0.021726450832066355, 'slip_spread_k': 0.5043497037021119, 'spread_hl_frac': 0.00490241090905655, 'bb_std_mult': 1.0903187321669743, 'rsi_os': 36, 'rsi_ob': 54, 'vol_spike': 0.1906324512406613, 'adx_thresh': 19.94671110914047, 'atr_min_pct': 0.024276196177018265, 'atr_max_pct': 0.13151872853889238, 'tp_mult': 2.5799422329473196, 'tsl_mult': 0.6441276585848426, 'strategy': 'mean_reversion', 'time_stop': 207, 'use_sma': False, 'use_atr': True, 'use_adx': False, 'use_ema': False, 'use_spike': False, 'rsi_required': True, 'edge_k': 1.0380582931330196, 'edge_cap': 0.2672106451350713, 'bull_strategy': 'mean_reversion', 'bull_bb_std_mult': 1.8300727505710932, 'bull_rsi_os': 44, 'bull_rsi_ob': 70, 'bull_adx_thresh': 26.830660290205962, 'bull_atr_min_pct': 0.01846238412590588, 'bull_atr_max_pct': 0.029084936961279204, 'bull_tp_mult': 1.6894810585938032, 'bull_tsl_mult': 0.9795132943042637, 'bull_time_stop': 194, 'bull_use_sma': True, 'bull_use_ema': False, 'bull_use_atr': False, 'bull_use_adx': True, 'bull_use_spike': True, 'bull_rsi_required': True, 'bear_strategy': 'breakout', 'bear_bb_std_mult': 1.8863065722136796, 'bear_rsi_os': 46, 'bear_rsi_ob': 89, 'bear_adx_thresh': 25.877252890922733, 'bear_atr_min_pct': 0.014455221384847186, 'bear_atr_max_pct': 0.0481165587156234, 'bear_tp_mult': 1.7012493534341082, 'bear_tsl_mult': 0.5682726412646523, 'bear_time_stop': 42, 'bear_use_sma': True, 'bear_use_ema': False, 'bear_use_atr': False, 'bear_use_adx': False, 'bear_use_spike': True, 'bear_rsi_required': False, 'sideways_strategy': 'breakout', 'sideways_bb_std_mult': 2.041787528498853, 'sideways_rsi_os': 5, 'sideways_rsi_ob': 73, 'sideways_adx_thresh': 34.17965812766082, 'sideways_atr_min_pct': 0.002771204409740111, 'sideways_atr_max_pct': 0.012420265165176206, 'sideways_tp_mult': 1.6894121159652922, 'sideways_tsl_mult': 0.6591328753313543, 'sideways_time_stop': 114, 'sideways_use_sma': True, 'sideways_use_ema': False, 'sideways_use_atr': True, 'sideways_use_adx': False, 'sideways_use_spike': False, 'sideways_rsi_required': False}.
[I 2025-08-30 19:29:10,443] Trial 407 finished with values: [-1000000000.0, 1000000000.0] and parameters: {'p_sma': 42, 'p_std': 26, 'p_atr': 21, 'p_adx': 19, 'rsi_period': 57, 'ema1': 25, 'ema2': 17, 'slip_atr_k': 0.017724687102822226, 'slip_spread_k': 0.32554941443228613, 'spread_hl_frac': 0.006461295854626584, 'bb_std_mult': 0.6944294650841687, 'rsi_os': 22, 'rsi_ob': 81, 'vol_spike': 0.16942691989271857, 'adx_thresh': 20.011262890361174, 'atr_min_pct': 0.02432749652775221, 'atr_max_pct': 0.1326119248241308, 'tp_mult': 1.472346656319497, 'tsl_mult': 0.749525329716556, 'strategy': 'mean_reversion', 'time_stop': 247, 'use_sma': True, 'use_atr': True, 'use_adx': False, 'use_ema': False, 'use_spike': False, 'rsi_required': False, 'edge_k': 0.24345989337880364, 'edge_cap': 0.20644954771146995, 'bull_strategy': 'breakout', 'bull_bb_std_mult': 1.801000811806077, 'bull_rsi_os': 28, 'bull_rsi_ob': 72, 'bull_adx_thresh': 21.482502002584216, 'bull_atr_min_pct': 0.018467708597437262, 'bull_atr_max_pct': 0.023655166176231004, 'bull_tp_mult': 1.131351601563101, 'bull_tsl_mult': 0.980578316840076, 'bull_time_stop': 286, 'bull_use_sma': True, 'bull_use_ema': False, 'bull_use_atr': False, 'bull_use_adx': True, 'bull_use_spike': True, 'bull_rsi_required': False, 'bear_strategy': 'breakout', 'bear_bb_std_mult': 1.900829014593137, 'bear_rsi_os': 18, 'bear_rsi_ob': 55, 'bear_adx_thresh': 16.269420114351288, 'bear_atr_min_pct': 0.01559678808948811, 'bear_atr_max_pct': 0.10032906083642991, 'bear_tp_mult': 1.695805973897475, 'bear_tsl_mult': 0.9488031169290881, 'bear_time_stop': 155, 'bear_use_sma': False, 'bear_use_ema': False, 'bear_use_atr': True, 'bear_use_adx': True, 'bear_use_spike': True, 'bear_rsi_required': False, 'sideways_strategy': 'breakout', 'sideways_bb_std_mult': 1.8304873813550466, 'sideways_rsi_os': 16, 'sideways_rsi_ob': 57, 'sideways_adx_thresh': 9.631652317627337, 'sideways_atr_min_pct': 0.018334288472604463, 'sideways_atr_max_pct': 0.11716117529572785, 'sideways_tp_mult': 2.0590099165258633, 'sideways_tsl_mult': 0.7203605232501096, 'sideways_time_stop': 58, 'sideways_use_sma': True, 'sideways_use_ema': False, 'sideways_use_atr': True, 'sideways_use_adx': False, 'sideways_use_spike': False, 'sideways_rsi_required': False}.
[I 2025-08-30 19:29:10,668] Trial 406 finished with values: [-1000000000.0, 1000000000.0] and parameters: {'p_sma': 29, 'p_std': 10, 'p_atr': 24, 'p_adx': 23, 'rsi_period': 82, 'ema1': 25, 'ema2': 20, 'slip_atr_k': 0.017279131562350347, 'slip_spread_k': 0.507927488889823, 'spread_hl_frac': 0.014946723882708651, 'bb_std_mult': 2.5939747157942454, 'rsi_os': 36, 'rsi_ob': 58, 'vol_spike': 0.168754498309449, 'adx_thresh': 32.068553967295486, 'atr_min_pct': 0.029996472693388752, 'atr_max_pct': 0.09960986430233544, 'tp_mult': 2.0414568182819006, 'tsl_mult': 0.7013143265857292, 'strategy': 'mean_reversion', 'time_stop': 31, 'use_sma': False, 'use_atr': True, 'use_adx': False, 'use_ema': False, 'use_spike': False, 'rsi_required': False, 'edge_k': 1.6563312908676493, 'edge_cap': 0.25115065850054374, 'bull_strategy': 'breakout', 'bull_bb_std_mult': 2.290143401376096, 'bull_rsi_os': 44, 'bull_rsi_ob': 75, 'bull_adx_thresh': 27.005717611664405, 'bull_atr_min_pct': 0.003880856759808323, 'bull_atr_max_pct': 0.08095369940584003, 'bull_tp_mult': 2.1610926814440528, 'bull_tsl_mult': 0.9782676856085757, 'bull_time_stop': 177, 'bull_use_sma': True, 'bull_use_ema': False, 'bull_use_atr': False, 'bull_use_adx': True, 'bull_use_spike': True, 'bull_rsi_required': False, 'bear_strategy': 'breakout', 'bear_bb_std_mult': 3.392587712262104, 'bear_rsi_os': 18, 'bear_rsi_ob': 74, 'bear_adx_thresh': 16.450064756887798, 'bear_atr_min_pct': 0.015720472439771115, 'bear_atr_max_pct': 0.08046992496199774, 'bear_tp_mult': 1.8064180078181213, 'bear_tsl_mult': 0.9360996442839128, 'bear_time_stop': 158, 'bear_use_sma': False, 'bear_use_ema': False, 'bear_use_atr': True, 'bear_use_adx': True, 'bear_use_spike': False, 'bear_rsi_required': False, 'sideways_strategy': 'breakout', 'sideways_bb_std_mult': 1.3752400952208945, 'sideways_rsi_os': 16, 'sideways_rsi_ob': 45, 'sideways_adx_thresh': 7.927453044542579, 'sideways_atr_min_pct': 0.018416706939220553, 'sideways_atr_max_pct': 0.011735064524324879, 'sideways_tp_mult': 1.7674712190432773, 'sideways_tsl_mult': 0.9992423676064897, 'sideways_time_stop': 255, 'sideways_use_sma': True, 'sideways_use_ema': False, 'sideways_use_atr': False, 'sideways_use_adx': False, 'sideways_use_spike': False, 'sideways_rsi_required': False}.
[I 2025-08-30 19:29:10,668] Trial 408 finished with values: [-1000000000.0, 1000000000.0] and parameters: {'p_sma': 31, 'p_std': 26, 'p_atr': 27, 'p_adx': 9, 'rsi_period': 34, 'ema1': 25, 'ema2': 19, 'slip_atr_k': 0.01897275290229911, 'slip_spread_k': 0.3303478122702278, 'spread_hl_frac': 0.032671640641388965, 'bb_std_mult': 0.9194548989481031, 'rsi_os': 35, 'rsi_ob': 88, 'vol_spike': 0.05097140056662859, 'adx_thresh': 19.920598398396713, 'atr_min_pct': 0.0021424628171650157, 'atr_max_pct': 0.14039747587991905, 'tp_mult': 1.8959030066609261, 'tsl_mult': 0.6757151969469309, 'strategy': 'mean_reversion', 'time_stop': 31, 'use_sma': False, 'use_atr': True, 'use_adx': False, 'use_ema': False, 'use_spike': False, 'rsi_required': False, 'edge_k': 1.303821531280643, 'edge_cap': 0.6545140855037033, 'bull_strategy': 'breakout', 'bull_bb_std_mult': 1.7933580784048493, 'bull_rsi_os': 27, 'bull_rsi_ob': 70, 'bull_adx_thresh': 5.0450929498988835, 'bull_atr_min_pct': 0.0032244486316138194, 'bull_atr_max_pct': 0.09538469306491075, 'bull_tp_mult': 2.1734514100689046, 'bull_tsl_mult': 0.9826523100012728, 'bull_time_stop': 70, 'bull_use_sma': True, 'bull_use_ema': False, 'bull_use_atr': False, 'bull_use_adx': True, 'bull_use_spike': True, 'bull_rsi_required': False, 'bear_strategy': 'breakout', 'bear_bb_std_mult': 3.5271569892689123, 'bear_rsi_os': 54, 'bear_rsi_ob': 83, 'bear_adx_thresh': 7.2341463613395085, 'bear_atr_min_pct': 0.015666207283250026, 'bear_atr_max_pct': 0.05713358733500635, 'bear_tp_mult': 1.7018575637507962, 'bear_tsl_mult': 0.15570726907109717, 'bear_time_stop': 159, 'bear_use_sma': True, 'bear_use_ema': False, 'bear_use_atr': True, 'bear_use_adx': True, 'bear_use_spike': True, 'bear_rsi_required': False, 'sideways_strategy': 'breakout', 'sideways_bb_std_mult': 2.029861389519457, 'sideways_rsi_os': 16, 'sideways_rsi_ob': 68, 'sideways_adx_thresh': 9.622407789010468, 'sideways_atr_min_pct': 0.0187519046647885, 'sideways_atr_max_pct': 0.11681582993102198, 'sideways_tp_mult': 1.757680715841395, 'sideways_tsl_mult': 0.7204625118408411, 'sideways_time_stop': 202, 'sideways_use_sma': True, 'sideways_use_ema': False, 'sideways_use_atr': True, 'sideways_use_adx': False, 'sideways_use_spike': False, 'sideways_rsi_required': False}.
[I 2025-08-30 19:29:11,368] Trial 410 finished with values: [-1000000000.0, 1000000000.0] and parameters: {'p_sma': 29, 'p_std': 24, 'p_atr': 23, 'p_adx': 19, 'rsi_period': 52, 'ema1': 24, 'ema2': 16, 'slip_atr_k': 0.10738357559365413, 'slip_spread_k': 0.4961542780592527, 'spread_hl_frac': 0.03244700761237644, 'bb_std_mult': 0.8314960211722408, 'rsi_os': 55, 'rsi_ob': 80, 'vol_spike': 0.24311236249944196, 'adx_thresh': 17.752529428579294, 'atr_min_pct': 0.014593418932020926, 'atr_max_pct': 0.1390315896639267, 'tp_mult': 1.0533366385119192, 'tsl_mult': 0.673330925696068, 'strategy': 'mean_reversion', 'time_stop': 30, 'use_sma': False, 'use_atr': True, 'use_adx': False, 'use_ema': False, 'use_spike': True, 'rsi_required': True, 'edge_k': 1.3201798235845912, 'edge_cap': 0.8327710296081201, 'bull_strategy': 'mean_reversion', 'bull_bb_std_mult': 1.9510564503175096, 'bull_rsi_os': 21, 'bull_rsi_ob': 75, 'bull_adx_thresh': 25.456121715973442, 'bull_atr_min_pct': 0.003195679385417701, 'bull_atr_max_pct': 0.0402173696254026, 'bull_tp_mult': 2.960378503580718, 'bull_tsl_mult': 0.19346498467844142, 'bull_time_stop': 188, 'bull_use_sma': True, 'bull_use_ema': False, 'bull_use_atr': False, 'bull_use_adx': True, 'bull_use_spike': True, 'bull_rsi_required': True, 'bear_strategy': 'breakout', 'bear_bb_std_mult': 3.517627000373321, 'bear_rsi_os': 43, 'bear_rsi_ob': 65, 'bear_adx_thresh': 7.105254406256453, 'bear_atr_min_pct': 0.015532362550662275, 'bear_atr_max_pct': 0.056551615289225435, 'bear_tp_mult': 1.5579028028081572, 'bear_tsl_mult': 0.14129659644962, 'bear_time_stop': 79, 'bear_use_sma': True, 'bear_use_ema': False, 'bear_use_atr': True, 'bear_use_adx': True, 'bear_use_spike': False, 'bear_rsi_required': False, 'sideways_strategy': 'breakout', 'sideways_bb_std_mult': 1.861499820500764, 'sideways_rsi_os': 17, 'sideways_rsi_ob': 66, 'sideways_adx_thresh': 9.613365506640468, 'sideways_atr_min_pct': 0.018423785762815777, 'sideways_atr_max_pct': 0.07591682968665701, 'sideways_tp_mult': 1.7638661326924225, 'sideways_tsl_mult': 0.7164357014794122, 'sideways_time_stop': 202, 'sideways_use_sma': True, 'sideways_use_ema': False, 'sideways_use_atr': False, 'sideways_use_adx': False, 'sideways_use_spike': False, 'sideways_rsi_required': False}.
[I 2025-08-30 19:29:44,097] Trial 412 finished with values: [-1000000000.0, 1000000000.0] and parameters: {'p_sma': 40, 'p_std': 24, 'p_atr': 17, 'p_adx': 10, 'rsi_period': 52, 'ema1': 23, 'ema2': 38, 'slip_atr_k': 0.17054326037293355, 'slip_spread_k': 0.4965363630684901, 'spread_hl_frac': 0.026648419600628172, 'bb_std_mult': 2.9992649006062213, 'rsi_os': 39, 'rsi_ob': 57, 'vol_spike': 0.03013238507447645, 'adx_thresh': 17.552480259328323, 'atr_min_pct': 0.022716563471431608, 'atr_max_pct': 0.07257203355256878, 'tp_mult': 1.4212611380683193, 'tsl_mult': 0.7163547557104754, 'strategy': 'breakout', 'time_stop': 134, 'use_sma': False, 'use_atr': False, 'use_adx': False, 'use_ema': True, 'use_spike': True, 'rsi_required': True, 'edge_k': 0.6850379750614315, 'edge_cap': 0.28587863940548874, 'bull_strategy': 'mean_reversion', 'bull_bb_std_mult': 1.9959386021276901, 'bull_rsi_os': 52, 'bull_rsi_ob': 74, 'bull_adx_thresh': 25.354410999952872, 'bull_atr_min_pct': 0.009319484678300386, 'bull_atr_max_pct': 0.10390264216144782, 'bull_tp_mult': 2.2907938124123373, 'bull_tsl_mult': 0.8908405989089001, 'bull_time_stop': 133, 'bull_use_sma': False, 'bull_use_ema': True, 'bull_use_atr': True, 'bull_use_adx': False, 'bull_use_spike': True, 'bull_rsi_required': True, 'bear_strategy': 'mean_reversion', 'bear_bb_std_mult': 2.8528057112164213, 'bear_rsi_os': 44, 'bear_rsi_ob': 94, 'bear_adx_thresh': 6.345623778494792, 'bear_atr_min_pct': 0.014419908502047961, 'bear_atr_max_pct': 0.052178986898044205, 'bear_tp_mult': 1.6339652485247815, 'bear_tsl_mult': 0.13122274174551107, 'bear_time_stop': 48, 'bear_use_sma': True, 'bear_use_ema': True, 'bear_use_atr': False, 'bear_use_adx': False, 'bear_use_spike': False, 'bear_rsi_required': False, 'sideways_strategy': 'mean_reversion', 'sideways_bb_std_mult': 2.7741104321084085, 'sideways_rsi_os': 17, 'sideways_rsi_ob': 78, 'sideways_adx_thresh': 17.64134661812023, 'sideways_atr_min_pct': 0.009453399743172393, 'sideways_atr_max_pct': 0.10900043163467228, 'sideways_tp_mult': 1.839386686884226, 'sideways_tsl_mult': 0.634717258523023, 'sideways_time_stop': 272, 'sideways_use_sma': False, 'sideways_use_ema': True, 'sideways_use_atr': False, 'sideways_use_adx': True, 'sideways_use_spike': False, 'sideways_rsi_required': True}.
[I 2025-08-30 19:29:44,109] Trial 413 finished with values: [-1000000000.0, 1000000000.0] and parameters: {'p_sma': 40, 'p_std': 52, 'p_atr': 10, 'p_adx': 7, 'rsi_period': 52, 'ema1': 23, 'ema2': 32, 'slip_atr_k': 0.10591502953854462, 'slip_spread_k': 0.2809012891734444, 'spread_hl_frac': 0.0028609025425050012, 'bb_std_mult': 0.8200613192432915, 'rsi_os': 38, 'rsi_ob': 57, 'vol_spike': 0.13688371278021538, 'adx_thresh': 17.878228346826926, 'atr_min_pct': 0.007456845076116274, 'atr_max_pct': 0.12637525886989037, 'tp_mult': 2.149606322872545, 'tsl_mult': 0.7134359198817383, 'strategy': 'breakout', 'time_stop': 135, 'use_sma': False, 'use_atr': False, 'use_adx': False, 'use_ema': True, 'use_spike': True, 'rsi_required': True, 'edge_k': 0.6937972860279897, 'edge_cap': 0.8381865628667247, 'bull_strategy': 'mean_reversion', 'bull_bb_std_mult': 0.7148928545879356, 'bull_rsi_os': 21, 'bull_rsi_ob': 74, 'bull_adx_thresh': 11.286978245125693, 'bull_atr_min_pct': 0.0021620752106983367, 'bull_atr_max_pct': 0.038817222179050155, 'bull_tp_mult': 2.1000173691206165, 'bull_tsl_mult': 0.6376148373835494, 'bull_time_stop': 134, 'bull_use_sma': False, 'bull_use_ema': True, 'bull_use_atr': True, 'bull_use_adx': False, 'bull_use_spike': True, 'bull_rsi_required': True, 'bear_strategy': 'mean_reversion', 'bear_bb_std_mult': 2.8890738319226283, 'bear_rsi_os': 44, 'bear_rsi_ob': 93, 'bear_adx_thresh': 6.342372924335827, 'bear_atr_min_pct': 0.014430580742679052, 'bear_atr_max_pct': 0.14006250954343297, 'bear_tp_mult': 1.8857275990971254, 'bear_tsl_mult': 0.13777700790788677, 'bear_time_stop': 241, 'bear_use_sma': True, 'bear_use_ema': True, 'bear_use_atr': False, 'bear_use_adx': False, 'bear_use_spike': False, 'bear_rsi_required': False, 'sideways_strategy': 'mean_reversion', 'sideways_bb_std_mult': 2.1921534443944104, 'sideways_rsi_os': 17, 'sideways_rsi_ob': 59, 'sideways_adx_thresh': 10.394132834961423, 'sideways_atr_min_pct': 0.019687821577597582, 'sideways_atr_max_pct': 0.07645982786130036, 'sideways_tp_mult': 1.4528073152530916, 'sideways_tsl_mult': 0.18523680521326968, 'sideways_time_stop': 281, 'sideways_use_sma': False, 'sideways_use_ema': True, 'sideways_use_atr': False, 'sideways_use_adx': True, 'sideways_use_spike': False, 'sideways_rsi_required': True}.
[I 2025-08-30 19:29:44,241] Trial 411 finished with values: [-1000000000.0, 1000000000.0] and parameters: {'p_sma': 19, 'p_std': 49, 'p_atr': 23, 'p_adx': 8, 'rsi_period': 52, 'ema1': 24, 'ema2': 20, 'slip_atr_k': 0.013295525251741278, 'slip_spread_k': 0.5094360467445813, 'spread_hl_frac': 0.046401883271363666, 'bb_std_mult': 2.4672170839951164, 'rsi_os': 26, 'rsi_ob': 71, 'vol_spike': 0.050503351470120035, 'adx_thresh': 31.77475978805377, 'atr_min_pct': 0.022758734910757993, 'atr_max_pct': 0.07207545103191833, 'tp_mult': 2.1396802357405518, 'tsl_mult': 0.7068955983126425, 'strategy': 'breakout', 'time_stop': 32, 'use_sma': False, 'use_atr': False, 'use_adx': False, 'use_ema': True, 'use_spike': True, 'rsi_required': True, 'edge_k': 1.6316012575410888, 'edge_cap': 0.2531485774677275, 'bull_strategy': 'mean_reversion', 'bull_bb_std_mult': 0.7620487411108516, 'bull_rsi_os': 49, 'bull_rsi_ob': 66, 'bull_adx_thresh': 5.055768747633481, 'bull_atr_min_pct': 0.0031893317695969813, 'bull_atr_max_pct': 0.015325856468406767, 'bull_tp_mult': 2.975212665333413, 'bull_tsl_mult': 0.7052966664861351, 'bull_time_stop': 72, 'bull_use_sma': True, 'bull_use_ema': False, 'bull_use_atr': False, 'bull_use_adx': True, 'bull_use_spike': True, 'bull_rsi_required': True, 'bear_strategy': 'breakout', 'bear_bb_std_mult': 3.526737059745114, 'bear_rsi_os': 43, 'bear_rsi_ob': 57, 'bear_adx_thresh': 7.266660087512436, 'bear_atr_min_pct': 0.015712127974003034, 'bear_atr_max_pct': 0.05784270191693181, 'bear_tp_mult': 1.6207364273853835, 'bear_tsl_mult': 0.13938449362533178, 'bear_time_stop': 78, 'bear_use_sma': True, 'bear_use_ema': False, 'bear_use_atr': True, 'bear_use_adx': True, 'bear_use_spike': False, 'bear_rsi_required': False, 'sideways_strategy': 'breakout', 'sideways_bb_std_mult': 1.5910485345504985, 'sideways_rsi_os': 18, 'sideways_rsi_ob': 87, 'sideways_adx_thresh': 8.942549310045807, 'sideways_atr_min_pct': 0.008062634253701798, 'sideways_atr_max_pct': 0.07962626678962115, 'sideways_tp_mult': 1.7578766775779313, 'sideways_tsl_mult': 0.37141395257386034, 'sideways_time_stop': 280, 'sideways_use_sma': True, 'sideways_use_ema': True, 'sideways_use_atr': False, 'sideways_use_adx': False, 'sideways_use_spike': False, 'sideways_rsi_required': True}.
