[I 2025-08-30 20:32:09,180] Trial 864 finished with values: [-1000000000.0, 1000000000.0] and parameters: {'p_sma': 50, 'p_std': 13, 'p_atr': 10, 'p_adx': 7, 'rsi_period': 79, 'ema1': 15, 'ema2': 13, 'slip_atr_k': 0.11926368113997779, 'slip_spread_k': 0.5963312262464704, 'spread_hl_frac': 0.04586219152457912, 'bb_std_mult': 1.5427685546194432, 'rsi_os': 37, 'rsi_ob': 66, 'vol_spike': 0.10721263047976222, 'adx_thresh': 21.174627317512474, 'atr_min_pct': 0.0202016347281805, 'atr_max_pct': 0.12735970472863248, 'tp_mult': 2.3187550388381823, 'tsl_mult': 0.7859610028746697, 'strategy': 'breakout', 'time_stop': 187, 'use_sma': True, 'use_atr': False, 'use_adx': False, 'use_ema': False, 'use_spike': True, 'rsi_required': True, 'edge_k': 1.1832925287104101, 'edge_cap': 0.42306734418381786, 'bull_strategy': 'breakout', 'bull_bb_std_mult': 2.259932454387175, 'bull_rsi_os': 16, 'bull_rsi_ob': 66, 'bull_adx_thresh': 5.013795915803007, 'bull_atr_min_pct': 0.01465550215396038, 'bull_atr_max_pct': 0.08756203638635815, 'bull_tp_mult': 2.1143850794128567, 'bull_tsl_mult': 0.9448758268705589, 'bull_time_stop': 136, 'bull_use_sma': True, 'bull_use_ema': False, 'bull_use_atr': False, 'bull_use_adx': True, 'bull_use_spike': True, 'bull_rsi_required': True, 'bear_strategy': 'breakout', 'bear_bb_std_mult': 3.5480452894210606, 'bear_rsi_os': 46, 'bear_rsi_ob': 48, 'bear_adx_thresh': 5.56893963458564, 'bear_atr_min_pct': 0.0075503565042377135, 'bear_atr_max_pct': 0.07893809696014052, 'bear_tp_mult': 2.8400583615524337, 'bear_tsl_mult': 0.13399531653830232, 'bear_time_stop': 19, 'bear_use_sma': True, 'bear_use_ema': False, 'bear_use_atr': True, 'bear_use_adx': True, 'bear_use_spike': False, 'bear_rsi_required': True, 'sideways_strategy': 'mean_reversion', 'sideways_bb_std_mult': 3.520320926171603, 'sideways_rsi_os': 26, 'sideways_rsi_ob': 53, 'sideways_adx_thresh': 25.054297861529243, 'sideways_atr_min_pct': 0.02506093545799784, 'sideways_atr_max_pct': 0.030167629017119536, 'sideways_tp_mult': 1.4371174870730181, 'sideways_tsl_mult': 0.8516018187516983, 'sideways_time_stop': 291, 'sideways_use_sma': False, 'sideways_use_ema': False, 'sideways_use_atr': False, 'sideways_use_adx': False, 'sideways_use_spike': False, 'sideways_rsi_required': True}.
[I 2025-08-30 20:32:09,621] Trial 865 finished with values: [-1000000000.0, 1000000000.0] and parameters: {'p_sma': 45, 'p_std': 7, 'p_atr': 21, 'p_adx': 7, 'rsi_period': 79, 'ema1': 14, 'ema2': 13, 'slip_atr_k': 0.021917438431917804, 'slip_spread_k': 0.6028734044321149, 'spread_hl_frac': 0.0458141944525753, 'bb_std_mult': 1.6778633055013017, 'rsi_os': 33, 'rsi_ob': 66, 'vol_spike': 0.10926228486517697, 'adx_thresh': 26.30249470913051, 'atr_min_pct': 0.021928618182536337, 'atr_max_pct': 0.12815890434381497, 'tp_mult': 2.303837166511302, 'tsl_mult': 0.48312286384068637, 'strategy': 'breakout', 'time_stop': 67, 'use_sma': True, 'use_atr': False, 'use_adx': False, 'use_ema': False, 'use_spike': False, 'rsi_required': True, 'edge_k': 1.4095985118108116, 'edge_cap': 0.3295559093121015, 'bull_strategy': 'breakout', 'bull_bb_std_mult': 2.2502260461153054, 'bull_rsi_os': 16, 'bull_rsi_ob': 77, 'bull_adx_thresh': 23.650358133728986, 'bull_atr_min_pct': 0.017941463977402802, 'bull_atr_max_pct': 0.09051452681773417, 'bull_tp_mult': 2.1014304750499084, 'bull_tsl_mult': 0.939074695073134, 'bull_time_stop': 202, 'bull_use_sma': True, 'bull_use_ema': False, 'bull_use_atr': True, 'bull_use_adx': False, 'bull_use_spike': True, 'bull_rsi_required': True, 'bear_strategy': 'breakout', 'bear_bb_std_mult': 3.469722357058283, 'bear_rsi_os': 46, 'bear_rsi_ob': 48, 'bear_adx_thresh': 19.545104725173893, 'bear_atr_min_pct': 0.007442179970640175, 'bear_atr_max_pct': 0.1383270889271771, 'bear_tp_mult': 2.850300736607842, 'bear_tsl_mult': 0.11553799310412294, 'bear_time_stop': 19, 'bear_use_sma': True, 'bear_use_ema': True, 'bear_use_atr': True, 'bear_use_adx': True, 'bear_use_spike': False, 'bear_rsi_required': True, 'sideways_strategy': 'mean_reversion', 'sideways_bb_std_mult': 1.0223281216154685, 'sideways_rsi_os': 25, 'sideways_rsi_ob': 57, 'sideways_adx_thresh': 24.112876500769467, 'sideways_atr_min_pct': 0.02540316482977895, 'sideways_atr_max_pct': 0.029572437341328077, 'sideways_tp_mult': 1.4170995952661811, 'sideways_tsl_mult': 0.8552587766461894, 'sideways_time_stop': 288, 'sideways_use_sma': False, 'sideways_use_ema': False, 'sideways_use_atr': False, 'sideways_use_adx': False, 'sideways_use_spike': False, 'sideways_rsi_required': True}.
[I 2025-08-30 20:32:10,109] Trial 863 finished with values: [-1000000000.0, 1000000000.0] and parameters: {'p_sma': 45, 'p_std': 5, 'p_atr': 8, 'p_adx': 7, 'rsi_period': 84, 'ema1': 14, 'ema2': 15, 'slip_atr_k': 0.04216574000068597, 'slip_spread_k': 0.6535094334410358, 'spread_hl_frac': 0.048059953003232285, 'bb_std_mult': 1.039723800231036, 'rsi_os': 37, 'rsi_ob': 68, 'vol_spike': 0.12386474519729944, 'adx_thresh': 21.87725759565691, 'atr_min_pct': 0.02207897195439615, 'atr_max_pct': 0.1307609731983237, 'tp_mult': 2.298213456697105, 'tsl_mult': 0.7837626147959691, 'strategy': 'mean_reversion', 'time_stop': 64, 'use_sma': True, 'use_atr': True, 'use_adx': False, 'use_ema': False, 'use_spike': True, 'rsi_required': False, 'edge_k': 1.2292052393839525, 'edge_cap': 0.3390168219508648, 'bull_strategy': 'mean_reversion', 'bull_bb_std_mult': 0.5042765300539533, 'bull_rsi_os': 11, 'bull_rsi_ob': 89, 'bull_adx_thresh': 24.43253392986766, 'bull_atr_min_pct': 0.006878566807319854, 'bull_atr_max_pct': 0.08773154198209722, 'bull_tp_mult': 2.0984480176681557, 'bull_tsl_mult': 0.9386257547597564, 'bull_time_stop': 137, 'bull_use_sma': True, 'bull_use_ema': True, 'bull_use_atr': False, 'bull_use_adx': True, 'bull_use_spike': False, 'bull_rsi_required': True, 'bear_strategy': 'breakout', 'bear_bb_std_mult': 3.5425320129640014, 'bear_rsi_os': 47, 'bear_rsi_ob': 48, 'bear_adx_thresh': 5.594109771243166, 'bear_atr_min_pct': 0.009356512999059987, 'bear_atr_max_pct': 0.0860930160698123, 'bear_tp_mult': 2.8421381227677878, 'bear_tsl_mult': 0.1316746250112125, 'bear_time_stop': 11, 'bear_use_sma': True, 'bear_use_ema': False, 'bear_use_atr': False, 'bear_use_adx': False, 'bear_use_spike': False, 'bear_rsi_required': True, 'sideways_strategy': 'mean_reversion', 'sideways_bb_std_mult': 2.0226928474217813, 'sideways_rsi_os': 27, 'sideways_rsi_ob': 55, 'sideways_adx_thresh': 24.13053272166478, 'sideways_atr_min_pct': 0.02766768968274477, 'sideways_atr_max_pct': 0.034048093574011194, 'sideways_tp_mult': 1.2525035189701588, 'sideways_tsl_mult': 0.8403171492110061, 'sideways_time_stop': 196, 'sideways_use_sma': False, 'sideways_use_ema': True, 'sideways_use_atr': True, 'sideways_use_adx': False, 'sideways_use_spike': True, 'sideways_rsi_required': True}.
[I 2025-08-30 20:32:44,131] Trial 870 finished with values: [-1000000000.0, 1000000000.0] and parameters: {'p_sma': 48, 'p_std': 10, 'p_atr': 13, 'p_adx': 7, 'rsi_period': 82, 'ema1': 18, 'ema2': 15, 'slip_atr_k': 0.0009681926330917072, 'slip_spread_k': 0.6242037575638476, 'spread_hl_frac': 0.04081653139679169, 'bb_std_mult': 1.324876320880027, 'rsi_os': 27, 'rsi_ob': 74, 'vol_spike': 0.13350674191207207, 'adx_thresh': 21.45819083304759, 'atr_min_pct': 0.018695484402641006, 'atr_max_pct': 0.12048503909570954, 'tp_mult': 2.2496595033771367, 'tsl_mult': 0.7182052532849102, 'strategy': 'breakout', 'time_stop': 52, 'use_sma': False, 'use_atr': True, 'use_adx': False, 'use_ema': False, 'use_spike': True, 'rsi_required': True, 'edge_k': 1.3446542162186335, 'edge_cap': 0.4780140526598007, 'bull_strategy': 'mean_reversion', 'bull_bb_std_mult': 1.130988197846564, 'bull_rsi_os': 20, 'bull_rsi_ob': 75, 'bull_adx_thresh': 33.667230171158224, 'bull_atr_min_pct': 0.008025177660164057, 'bull_atr_max_pct': 0.08130947657814427, 'bull_tp_mult': 2.0543863072191684, 'bull_tsl_mult': 0.9097246970523227, 'bull_time_stop': 208, 'bull_use_sma': True, 'bull_use_ema': False, 'bull_use_atr': False, 'bull_use_adx': True, 'bull_use_spike': True, 'bull_rsi_required': True, 'bear_strategy': 'breakout', 'bear_bb_std_mult': 3.401670202316675, 'bear_rsi_os': 47, 'bear_rsi_ob': 46, 'bear_adx_thresh': 17.44179282072972, 'bear_atr_min_pct': 0.010196562150915434, 'bear_atr_max_pct': 0.09350290217699418, 'bear_tp_mult': 2.6415361216903728, 'bear_tsl_mult': 0.8353889578720761, 'bear_time_stop': 6, 'bear_use_sma': True, 'bear_use_ema': False, 'bear_use_atr': True, 'bear_use_adx': True, 'bear_use_spike': False, 'bear_rsi_required': True, 'sideways_strategy': 'mean_reversion', 'sideways_bb_std_mult': 2.107913141932221, 'sideways_rsi_os': 20, 'sideways_rsi_ob': 74, 'sideways_adx_thresh': 23.048574977785975, 'sideways_atr_min_pct': 0.02598993755290737, 'sideways_atr_max_pct': 0.050909109033662914, 'sideways_tp_mult': 1.5600778929570356, 'sideways_tsl_mult': 0.9644579079147341, 'sideways_time_stop': 112, 'sideways_use_sma': False, 'sideways_use_ema': True, 'sideways_use_atr': False, 'sideways_use_adx': False, 'sideways_use_spike': False, 'sideways_rsi_required': True}.
[I 2025-08-30 20:32:44,386] Trial 867 finished with values: [-1000000000.0, 1000000000.0] and parameters: {'p_sma': 50, 'p_std': 7, 'p_atr': 13, 'p_adx': 7, 'rsi_period': 82, 'ema1': 18, 'ema2': 13, 'slip_atr_k': 0.013325764439235457, 'slip_spread_k': 0.6230334983970459, 'spread_hl_frac': 0.045533455161667444, 'bb_std_mult': 1.7625406017850074, 'rsi_os': 34, 'rsi_ob': 66, 'vol_spike': 0.13534789807076428, 'adx_thresh': 21.709977661176953, 'atr_min_pct': 0.022234656490572338, 'atr_max_pct': 0.11969664800665808, 'tp_mult': 2.287022861273405, 'tsl_mult': 0.2865177589219994, 'strategy': 'breakout', 'time_stop': 269, 'use_sma': False, 'use_atr': True, 'use_adx': False, 'use_ema': False, 'use_spike': True, 'rsi_required': True, 'edge_k': 1.534308534957059, 'edge_cap': 0.6199984502669438, 'bull_strategy': 'mean_reversion', 'bull_bb_std_mult': 2.657782214731486, 'bull_rsi_os': 20, 'bull_rsi_ob': 75, 'bull_adx_thresh': 24.50460431679611, 'bull_atr_min_pct': 0.014871458517374543, 'bull_atr_max_pct': 0.08219661022990903, 'bull_tp_mult': 2.103390611273374, 'bull_tsl_mult': 0.8677852607608737, 'bull_time_stop': 143, 'bull_use_sma': True, 'bull_use_ema': False, 'bull_use_atr': False, 'bull_use_adx': True, 'bull_use_spike': True, 'bull_rsi_required': True, 'bear_strategy': 'breakout', 'bear_bb_std_mult': 3.449539772963026, 'bear_rsi_os': 47, 'bear_rsi_ob': 46, 'bear_adx_thresh': 19.63632390520864, 'bear_atr_min_pct': 0.009668866623248753, 'bear_atr_max_pct': 0.07842906046043296, 'bear_tp_mult': 2.8342750718608487, 'bear_tsl_mult': 0.41166300677815276, 'bear_time_stop': 5, 'bear_use_sma': True, 'bear_use_ema': False, 'bear_use_atr': True, 'bear_use_adx': True, 'bear_use_spike': False, 'bear_rsi_required': True, 'sideways_strategy': 'mean_reversion', 'sideways_bb_std_mult': 1.4826257986717444, 'sideways_rsi_os': 25, 'sideways_rsi_ob': 57, 'sideways_adx_thresh': 24.213575370906998, 'sideways_atr_min_pct': 0.0252289199892991, 'sideways_atr_max_pct': 0.03480082438008482, 'sideways_tp_mult': 1.4171096754034536, 'sideways_tsl_mult': 0.8654700053235159, 'sideways_time_stop': 234, 'sideways_use_sma': False, 'sideways_use_ema': True, 'sideways_use_atr': False, 'sideways_use_adx': False, 'sideways_use_spike': False, 'sideways_rsi_required': True}.
[I 2025-08-30 20:32:44,669] Trial 869 finished with values: [-1000000000.0, 1000000000.0] and parameters: {'p_sma': 48, 'p_std': 18, 'p_atr': 13, 'p_adx': 7, 'rsi_period': 82, 'ema1': 8, 'ema2': 15, 'slip_atr_k': 0.22704231170556455, 'slip_spread_k': 0.6268546255514785, 'spread_hl_frac': 0.049953477304352796, 'bb_std_mult': 3.314691732184442, 'rsi_os': 36, 'rsi_ob': 51, 'vol_spike': 0.1626532138073626, 'adx_thresh': 24.058820799573372, 'atr_min_pct': 0.023074321516206787, 'atr_max_pct': 0.1235091932104294, 'tp_mult': 2.255201974437895, 'tsl_mult': 0.10331750861734917, 'strategy': 'breakout', 'time_stop': 52, 'use_sma': False, 'use_atr': True, 'use_adx': False, 'use_ema': False, 'use_spike': True, 'rsi_required': True, 'edge_k': 1.7058328991758143, 'edge_cap': 0.48352816154481476, 'bull_strategy': 'mean_reversion', 'bull_bb_std_mult': 2.9320164042897208, 'bull_rsi_os': 25, 'bull_rsi_ob': 75, 'bull_adx_thresh': 24.221638425735296, 'bull_atr_min_pct': 0.00784033019530578, 'bull_atr_max_pct': 0.08238055259335618, 'bull_tp_mult': 2.065171223441451, 'bull_tsl_mult': 0.9004290611346217, 'bull_time_stop': 209, 'bull_use_sma': True, 'bull_use_ema': False, 'bull_use_atr': False, 'bull_use_adx': True, 'bull_use_spike': True, 'bull_rsi_required': True, 'bear_strategy': 'breakout', 'bear_bb_std_mult': 3.4373481486969597, 'bear_rsi_os': 47, 'bear_rsi_ob': 55, 'bear_adx_thresh': 6.105603971991807, 'bear_atr_min_pct': 0.009885067115074133, 'bear_atr_max_pct': 0.0927690561795595, 'bear_tp_mult': 2.627670989200378, 'bear_tsl_mult': 0.824887633883062, 'bear_time_stop': 5, 'bear_use_sma': True, 'bear_use_ema': False, 'bear_use_atr': True, 'bear_use_adx': True, 'bear_use_spike': False, 'bear_rsi_required': True, 'sideways_strategy': 'mean_reversion', 'sideways_bb_std_mult': 1.4799998785264832, 'sideways_rsi_os': 20, 'sideways_rsi_ob': 84, 'sideways_adx_thresh': 23.17442196512434, 'sideways_atr_min_pct': 0.0262746544314674, 'sideways_atr_max_pct': 0.03822739836866977, 'sideways_tp_mult': 1.0913952715791941, 'sideways_tsl_mult': 0.9598301000869338, 'sideways_time_stop': 48, 'sideways_use_sma': False, 'sideways_use_ema': True, 'sideways_use_atr': False, 'sideways_use_adx': False, 'sideways_use_spike': False, 'sideways_rsi_required': True}.
[I 2025-08-30 20:32:44,958] Trial 868 finished with values: [-1000000000.0, 1000000000.0] and parameters: {'p_sma': 45, 'p_std': 10, 'p_atr': 11, 'p_adx': 7, 'rsi_period': 83, 'ema1': 18, 'ema2': 15, 'slip_atr_k': 0.0021963290710960877, 'slip_spread_k': 0.6377893499903209, 'spread_hl_frac': 0.04466614245546152, 'bb_std_mult': 2.627200665283013, 'rsi_os': 34, 'rsi_ob': 51, 'vol_spike': 0.13400790651900782, 'adx_thresh': 24.106171348791293, 'atr_min_pct': 0.021964820208314154, 'atr_max_pct': 0.12067295730052625, 'tp_mult': 2.2613215048820994, 'tsl_mult': 0.7287661873926747, 'strategy': 'breakout', 'time_stop': 253, 'use_sma': False, 'use_atr': True, 'use_adx': False, 'use_ema': False, 'use_spike': False, 'rsi_required': True, 'edge_k': 1.343859285636589, 'edge_cap': 0.47487143420046285, 'bull_strategy': 'mean_reversion', 'bull_bb_std_mult': 2.0423927933712487, 'bull_rsi_os': 26, 'bull_rsi_ob': 52, 'bull_adx_thresh': 33.508668622653055, 'bull_atr_min_pct': 0.016575091659874044, 'bull_atr_max_pct': 0.09149740554223502, 'bull_tp_mult': 2.0763224866627255, 'bull_tsl_mult': 0.9038835532991694, 'bull_time_stop': 196, 'bull_use_sma': True, 'bull_use_ema': False, 'bull_use_atr': True, 'bull_use_adx': False, 'bull_use_spike': True, 'bull_rsi_required': True, 'bear_strategy': 'breakout', 'bear_bb_std_mult': 3.3987450261708085, 'bear_rsi_os': 47, 'bear_rsi_ob': 46, 'bear_adx_thresh': 19.53429288049038, 'bear_atr_min_pct': 0.009633276034359442, 'bear_atr_max_pct': 0.11694000076002, 'bear_tp_mult': 2.9641746344744186, 'bear_tsl_mult': 0.10897585965525558, 'bear_time_stop': 5, 'bear_use_sma': True, 'bear_use_ema': True, 'bear_use_atr': True, 'bear_use_adx': True, 'bear_use_spike': False, 'bear_rsi_required': True, 'sideways_strategy': 'mean_reversion', 'sideways_bb_std_mult': 2.108352497834039, 'sideways_rsi_os': 24, 'sideways_rsi_ob': 84, 'sideways_adx_thresh': 24.083623623599298, 'sideways_atr_min_pct': 0.02583459693697234, 'sideways_atr_max_pct': 0.037513709765084585, 'sideways_tp_mult': 1.2926415882160376, 'sideways_tsl_mult': 0.9607231342801936, 'sideways_time_stop': 235, 'sideways_use_sma': False, 'sideways_use_ema': True, 'sideways_use_atr': False, 'sideways_use_adx': False, 'sideways_use_spike': False, 'sideways_rsi_required': True}.
[I 2025-08-30 20:33:21,218] Trial 871 finished with values: [-1000000000.0, 1000000000.0] and parameters: {'p_sma': 46, 'p_std': 8, 'p_atr': 11, 'p_adx': 7, 'rsi_period': 83, 'ema1': 7, 'ema2': 12, 'slip_atr_k': 0.012396873927133147, 'slip_spread_k': 0.6234002443923451, 'spread_hl_frac': 0.044622223662113374, 'bb_std_mult': 3.3513062623566885, 'rsi_os': 34, 'rsi_ob': 65, 'vol_spike': 0.15590249915094967, 'adx_thresh': 23.172417378270882, 'atr_min_pct': 0.023106637299830975, 'atr_max_pct': 0.1320121717019679, 'tp_mult': 2.3726383046281168, 'tsl_mult': 0.19168552218336082, 'strategy': 'breakout', 'time_stop': 50, 'use_sma': False, 'use_atr': True, 'use_adx': False, 'use_ema': False, 'use_spike': True, 'rsi_required': True, 'edge_k': 1.7082593992696395, 'edge_cap': 0.4949025391589807, 'bull_strategy': 'mean_reversion', 'bull_bb_std_mult': 2.0383773461108246, 'bull_rsi_os': 25, 'bull_rsi_ob': 72, 'bull_adx_thresh': 24.561830074889645, 'bull_atr_min_pct': 0.01969390174391357, 'bull_atr_max_pct': 0.08300977266980335, 'bull_tp_mult': 2.078135872814636, 'bull_tsl_mult': 0.8973167317045514, 'bull_time_stop': 289, 'bull_use_sma': True, 'bull_use_ema': False, 'bull_use_atr': False, 'bull_use_adx': True, 'bull_use_spike': True, 'bull_rsi_required': True, 'bear_strategy': 'breakout', 'bear_bb_std_mult': 3.421265742396305, 'bear_rsi_os': 47, 'bear_rsi_ob': 53, 'bear_adx_thresh': 6.373494423570962, 'bear_atr_min_pct': 0.00977111884195429, 'bear_atr_max_pct': 0.11008761743203493, 'bear_tp_mult': 2.9565043872535366, 'bear_tsl_mult': 0.21384318167612149, 'bear_time_stop': 15, 'bear_use_sma': False, 'bear_use_ema': False, 'bear_use_atr': True, 'bear_use_adx': True, 'bear_use_spike': False, 'bear_rsi_required': True, 'sideways_strategy': 'mean_reversion', 'sideways_bb_std_mult': 2.1345218370890104, 'sideways_rsi_os': 22, 'sideways_rsi_ob': 57, 'sideways_adx_thresh': 26.406195840632492, 'sideways_atr_min_pct': 0.0267318457900624, 'sideways_atr_max_pct': 0.033915638649965565, 'sideways_tp_mult': 1.0842821458736567, 'sideways_tsl_mult': 0.7893882557318677, 'sideways_time_stop': 54, 'sideways_use_sma': False, 'sideways_use_ema': True, 'sideways_use_atr': False, 'sideways_use_adx': False, 'sideways_use_spike': False, 'sideways_rsi_required': True}.
[I 2025-08-30 20:33:22,075] Trial 872 finished with values: [-1000000000.0, 1000000000.0] and parameters: {'p_sma': 46, 'p_std': 8, 'p_atr': 27, 'p_adx': 7, 'rsi_period': 83, 'ema1': 8, 'ema2': 12, 'slip_atr_k': 0.07161204045501089, 'slip_spread_k': 0.6208672479947605, 'spread_hl_frac': 0.03353394877832348, 'bb_std_mult': 1.11112040243064, 'rsi_os': 36, 'rsi_ob': 72, 'vol_spike': 0.15411234167192478, 'adx_thresh': 23.41292260957379, 'atr_min_pct': 0.022971629424043877, 'atr_max_pct': 0.12394441195646465, 'tp_mult': 2.248593655753624, 'tsl_mult': 0.6935061852712232, 'strategy': 'breakout', 'time_stop': 249, 'use_sma': False, 'use_atr': True, 'use_adx': False, 'use_ema': True, 'use_spike': False, 'rsi_required': True, 'edge_k': 1.0050901828088474, 'edge_cap': 0.5592896836901574, 'bull_strategy': 'mean_reversion', 'bull_bb_std_mult': 1.803541531907798, 'bull_rsi_os': 25, 'bull_rsi_ob': 63, 'bull_adx_thresh': 25.21749053205891, 'bull_atr_min_pct': 0.012554250499749502, 'bull_atr_max_pct': 0.07573425357176446, 'bull_tp_mult': 2.05430191825481, 'bull_tsl_mult': 0.8981556172305895, 'bull_time_stop': 267, 'bull_use_sma': True, 'bull_use_ema': False, 'bull_use_atr': True, 'bull_use_adx': False, 'bull_use_spike': True, 'bull_rsi_required': False, 'bear_strategy': 'breakout', 'bear_bb_std_mult': 3.383834879109224, 'bear_rsi_os': 49, 'bear_rsi_ob': 55, 'bear_adx_thresh': 6.237711634617074, 'bear_atr_min_pct': 0.01048916604756614, 'bear_atr_max_pct': 0.11748841902410714, 'bear_tp_mult': 2.9634285869347528, 'bear_tsl_mult': 0.157540017011752, 'bear_time_stop': 19, 'bear_use_sma': False, 'bear_use_ema': True, 'bear_use_atr': True, 'bear_use_adx': True, 'bear_use_spike': True, 'bear_rsi_required': True, 'sideways_strategy': 'mean_reversion', 'sideways_bb_std_mult': 2.123767115149985, 'sideways_rsi_os': 24, 'sideways_rsi_ob': 85, 'sideways_adx_thresh': 25.56026667237392, 'sideways_atr_min_pct': 0.02673003448428737, 'sideways_atr_max_pct': 0.03932019140656232, 'sideways_tp_mult': 1.0763287632558713, 'sideways_tsl_mult': 0.937078423568545, 'sideways_time_stop': 278, 'sideways_use_sma': False, 'sideways_use_ema': True, 'sideways_use_atr': False, 'sideways_use_adx': False, 'sideways_use_spike': False, 'sideways_rsi_required': True}.
