[I 2025-08-30 18:39:19,854] Trial 27 finished with values: [-1000000000.0, 1000000000.0] and parameters: {'p_sma': 6, 'p_std': 20, 'p_atr': 28, 'p_adx': 10, 'rsi_period': 47, 'ema1': 21, 'ema2': 50, 'slip_atr_k': 0.03547044656356736, 'slip_spread_k': 0.6483175960396657, 'spread_hl_frac': 0.04409868337062437, 'bb_std_mult': 1.432531941277551, 'rsi_os': 47, 'rsi_ob': 71, 'vol_spike': 0.05148528131779054, 'adx_thresh': 21.178552031328408, 'atr_min_pct': 0.011911508772669747, 'atr_max_pct': 0.12495534956805596, 'tp_mult': 2.5605663816579454, 'tsl_mult': 0.4656506405594109, 'strategy': 'mean_reversion', 'time_stop': 295, 'use_sma': True, 'use_atr': True, 'use_adx': True, 'use_ema': False, 'use_spike': True, 'rsi_required': False, 'edge_k': 1.0773043726199578, 'edge_cap': 0.9650037964757863, 'bull_strategy': 'mean_reversion', 'bull_bb_std_mult': 1.2957485946410612, 'bull_rsi_os': 23, 'bull_rsi_ob': 70, 'bull_adx_thresh': 16.323942007116013, 'bull_atr_min_pct': 0.00879150359475382, 'bull_atr_max_pct': 0.012683779858633643, 'bull_tp_mult': 1.8321276749412367, 'bull_tsl_mult': 0.3964485011714479, 'bull_time_stop': 217, 'bull_use_sma': False, 'bull_use_ema': False, 'bull_use_atr': True, 'bull_use_adx': True, 'bull_use_spike': True, 'bull_rsi_required': True, 'bear_strategy': 'mean_reversion', 'bear_bb_std_mult': 1.5986779245420224, 'bear_rsi_os': 13, 'bear_rsi_ob': 78, 'bear_adx_thresh': 28.741316176683227, 'bear_atr_min_pct': 0.025137365525199643, 'bear_atr_max_pct': 0.09870044684982716, 'bear_tp_mult': 1.1818945812086774, 'bear_tsl_mult': 0.585764103274476, 'bear_time_stop': 12, 'bear_use_sma': True, 'bear_use_ema': True, 'bear_use_atr': False, 'bear_use_adx': False, 'bear_use_spike': True, 'bear_rsi_required': True, 'sideways_strategy': 'breakout', 'sideways_bb_std_mult': 1.1171732230804179, 'sideways_rsi_os': 38, 'sideways_rsi_ob': 66, 'sideways_adx_thresh': 8.956302570832785, 'sideways_atr_min_pct': 0.013537654425137666, 'sideways_atr_max_pct': 0.12974862001107187, 'sideways_tp_mult': 2.3196340858504696, 'sideways_tsl_mult': 0.7667151451455346, 'sideways_time_stop': 90, 'sideways_use_sma': False, 'sideways_use_ema': False, 'sideways_use_atr': False, 'sideways_use_adx': True, 'sideways_use_spike': True, 'sideways_rsi_required': True}.
[I 2025-08-30 18:39:23,543] Trial 28 finished with values: [-1000000000.0, 1000000000.0] and parameters: {'p_sma': 6, 'p_std': 29, 'p_atr': 15, 'p_adx': 10, 'rsi_period': 33, 'ema1': 21, 'ema2': 51, 'slip_atr_k': 0.030518798670770377, 'slip_spread_k': 0.650215876917294, 'spread_hl_frac': 0.03150170996691182, 'bb_std_mult': 0.8075868409468148, 'rsi_os': 44, 'rsi_ob': 71, 'vol_spike': 0.04901579251176314, 'adx_thresh': 19.756502485134753, 'atr_min_pct': 0.011702750776578537, 'atr_max_pct': 0.12400185616693994, 'tp_mult': 1.903924272092977, 'tsl_mult': 0.47988802426461946, 'strategy': 'breakout', 'time_stop': 297, 'use_sma': False, 'use_atr': True, 'use_adx': False, 'use_ema': False, 'use_spike': True, 'rsi_required': True, 'edge_k': 0.57702361673561, 'edge_cap': 0.7275424643049947, 'bull_strategy': 'mean_reversion', 'bull_bb_std_mult': 1.2786695441147404, 'bull_rsi_os': 24, 'bull_rsi_ob': 70, 'bull_adx_thresh': 32.34533504236035, 'bull_atr_min_pct': 0.009580927330971784, 'bull_atr_max_pct': 0.1358714124054738, 'bull_tp_mult': 1.4770902797892826, 'bull_tsl_mult': 0.42384445800054793, 'bull_time_stop': 53, 'bull_use_sma': True, 'bull_use_ema': False, 'bull_use_atr': True, 'bull_use_adx': False, 'bull_use_spike': True, 'bull_rsi_required': True, 'bear_strategy': 'mean_reversion', 'bear_bb_std_mult': 1.54857426068412, 'bear_rsi_os': 48, 'bear_rsi_ob': 80, 'bear_adx_thresh': 34.70054116413714, 'bear_atr_min_pct': 0.012876180373694628, 'bear_atr_max_pct': 0.12993581054422446, 'bear_tp_mult': 2.2622134195203882, 'bear_tsl_mult': 0.4588135073228024, 'bear_time_stop': 164, 'bear_use_sma': True, 'bear_use_ema': False, 'bear_use_atr': False, 'bear_use_adx': False, 'bear_use_spike': True, 'bear_rsi_required': False, 'sideways_strategy': 'breakout', 'sideways_bb_std_mult': 1.177937809108276, 'sideways_rsi_os': 19, 'sideways_rsi_ob': 66, 'sideways_adx_thresh': 21.18077896720804, 'sideways_atr_min_pct': 0.013580401096236965, 'sideways_atr_max_pct': 0.14999814844462606, 'sideways_tp_mult': 1.248632154515399, 'sideways_tsl_mult': 0.12447543864754895, 'sideways_time_stop': 93, 'sideways_use_sma': True, 'sideways_use_ema': False, 'sideways_use_atr': False, 'sideways_use_adx': False, 'sideways_use_spike': False, 'sideways_rsi_required': False}.
[I 2025-08-30 18:39:23,831] Trial 30 finished with values: [-1000000000.0, 1000000000.0] and parameters: {'p_sma': 32, 'p_std': 29, 'p_atr': 29, 'p_adx': 22, 'rsi_period': 8, 'ema1': 20, 'ema2': 28, 'slip_atr_k': 0.026035092719924345, 'slip_spread_k': 0.8528755540263251, 'spread_hl_frac': 0.030496584857799935, 'bb_std_mult': 0.8570868862236984, 'rsi_os': 35, 'rsi_ob': 59, 'vol_spike': 0.0019528992735890903, 'adx_thresh': 14.036015089883515, 'atr_min_pct': 0.0262803636695397, 'atr_max_pct': 0.09510831422995246, 'tp_mult': 1.506526219425412, 'tsl_mult': 0.5630926552004956, 'strategy': 'breakout', 'time_stop': 266, 'use_sma': False, 'use_atr': True, 'use_adx': False, 'use_ema': True, 'use_spike': True, 'rsi_required': True, 'edge_k': 0.19789687478787452, 'edge_cap': 0.2742132587773862, 'bull_strategy': 'mean_reversion', 'bull_bb_std_mult': 1.2940113171801482, 'bull_rsi_os': 32, 'bull_rsi_ob': 78, 'bull_adx_thresh': 32.26681489409733, 'bull_atr_min_pct': 0.007679944668523089, 'bull_atr_max_pct': 0.13573562029305186, 'bull_tp_mult': 2.117031837856832, 'bull_tsl_mult': 0.6049028016235902, 'bull_time_stop': 50, 'bull_use_sma': True, 'bull_use_ema': False, 'bull_use_atr': False, 'bull_use_adx': False, 'bull_use_spike': True, 'bull_rsi_required': True, 'bear_strategy': 'mean_reversion', 'bear_bb_std_mult': 1.572450818486227, 'bear_rsi_os': 50, 'bear_rsi_ob': 45, 'bear_adx_thresh': 34.55622700980557, 'bear_atr_min_pct': 0.013205485967025204, 'bear_atr_max_pct': 0.13033973762660694, 'bear_tp_mult': 2.2661041855971935, 'bear_tsl_mult': 0.45948307136608857, 'bear_time_stop': 168, 'bear_use_sma': False, 'bear_use_ema': False, 'bear_use_atr': False, 'bear_use_adx': False, 'bear_use_spike': True, 'bear_rsi_required': False, 'sideways_strategy': 'breakout', 'sideways_bb_std_mult': 2.500974133779915, 'sideways_rsi_os': 5, 'sideways_rsi_ob': 64, 'sideways_adx_thresh': 8.520939923429271, 'sideways_atr_min_pct': 0.017171732487328315, 'sideways_atr_max_pct': 0.014019651650875917, 'sideways_tp_mult': 1.5931550552749538, 'sideways_tsl_mult': 0.8474998455420114, 'sideways_time_stop': 197, 'sideways_use_sma': True, 'sideways_use_ema': False, 'sideways_use_atr': True, 'sideways_use_adx': False, 'sideways_use_spike': False, 'sideways_rsi_required': False}.
[I 2025-08-30 18:39:24,098] Trial 29 finished with values: [-1000000000.0, 1000000000.0] and parameters: {'p_sma': 32, 'p_std': 18, 'p_atr': 9, 'p_adx': 10, 'rsi_period': 32, 'ema1': 20, 'ema2': 51, 'slip_atr_k': 0.02934037819043303, 'slip_spread_k': 0.6528445055240024, 'spread_hl_frac': 0.03049160898777281, 'bb_std_mult': 0.8068305637336175, 'rsi_os': 35, 'rsi_ob': 59, 'vol_spike': 0.0028630931351258672, 'adx_thresh': 19.801311472285917, 'atr_min_pct': 0.009758002596799615, 'atr_max_pct': 0.0937054308332636, 'tp_mult': 1.8301312496155802, 'tsl_mult': 0.4764308053975355, 'strategy': 'mean_reversion', 'time_stop': 176, 'use_sma': True, 'use_atr': True, 'use_adx': True, 'use_ema': True, 'use_spike': True, 'rsi_required': False, 'edge_k': 0.22666532643780163, 'edge_cap': 0.8054918976617298, 'bull_strategy': 'mean_reversion', 'bull_bb_std_mult': 1.1900560346678746, 'bull_rsi_os': 24, 'bull_rsi_ob': 79, 'bull_adx_thresh': 32.34852131411003, 'bull_atr_min_pct': 0.00801722625458314, 'bull_atr_max_pct': 0.1316926632626155, 'bull_tp_mult': 1.4466316296790942, 'bull_tsl_mult': 0.6238422852207169, 'bull_time_stop': 56, 'bull_use_sma': False, 'bull_use_ema': False, 'bull_use_atr': False, 'bull_use_adx': True, 'bull_use_spike': True, 'bull_rsi_required': True, 'bear_strategy': 'mean_reversion', 'bear_bb_std_mult': 1.5889418585865727, 'bear_rsi_os': 49, 'bear_rsi_ob': 55, 'bear_adx_thresh': 34.31334731784416, 'bear_atr_min_pct': 0.01344821537922289, 'bear_atr_max_pct': 0.1297394734578961, 'bear_tp_mult': 2.247131274503941, 'bear_tsl_mult': 0.4433317698546651, 'bear_time_stop': 13, 'bear_use_sma': False, 'bear_use_ema': True, 'bear_use_atr': False, 'bear_use_adx': False, 'bear_use_spike': True, 'bear_rsi_required': True, 'sideways_strategy': 'breakout', 'sideways_bb_std_mult': 1.1546404367974794, 'sideways_rsi_os': 20, 'sideways_rsi_ob': 66, 'sideways_adx_thresh': 22.929514372470443, 'sideways_atr_min_pct': 0.017919147993501576, 'sideways_atr_max_pct': 0.14944854107687533, 'sideways_tp_mult': 2.3026990549832953, 'sideways_tsl_mult': 0.8245293312972818, 'sideways_time_stop': 189, 'sideways_use_sma': False, 'sideways_use_ema': False, 'sideways_use_atr': True, 'sideways_use_adx': True, 'sideways_use_spike': True, 'sideways_rsi_required': True}.
[I 2025-08-30 18:39:24,350] Trial 33 finished with values: [-1000000000.0, 1000000000.0] and parameters: {'p_sma': 50, 'p_std': 11, 'p_atr': 9, 'p_adx': 17, 'rsi_period': 65, 'ema1': 16, 'ema2': 17, 'slip_atr_k': 0.0892483418741006, 'slip_spread_k': 0.45455890038714714, 'spread_hl_frac': 0.023766336370425405, 'bb_std_mult': 1.9331321280658504, 'rsi_os': 27, 'rsi_ob': 50, 'vol_spike': 0.028659101827269315, 'adx_thresh': 24.34077079244682, 'atr_min_pct': 0.021759806103617167, 'atr_max_pct': 0.1347908556165166, 'tp_mult': 1.6349950743351742, 'tsl_mult': 0.376446061845921, 'strategy': 'mean_reversion', 'time_stop': 62, 'use_sma': True, 'use_atr': False, 'use_adx': True, 'use_ema': True, 'use_spike': False, 'rsi_required': False, 'edge_k': 0.9279587105335362, 'edge_cap': 0.18441191212487856, 'bull_strategy': 'breakout', 'bull_bb_std_mult': 2.886528776591652, 'bull_rsi_os': 18, 'bull_rsi_ob': 79, 'bull_adx_thresh': 27.969408980835873, 'bull_atr_min_pct': 0.0013339143250884315, 'bull_atr_max_pct': 0.06774202301538382, 'bull_tp_mult': 2.11537584670165, 'bull_tsl_mult': 0.6127797235598811, 'bull_time_stop': 145, 'bull_use_sma': False, 'bull_use_ema': True, 'bull_use_atr': False, 'bull_use_adx': True, 'bull_use_spike': False, 'bull_rsi_required': False, 'bear_strategy': 'breakout', 'bear_bb_std_mult': 2.1223296178671207, 'bear_rsi_os': 41, 'bear_rsi_ob': 55, 'bear_adx_thresh': 14.855336609573666, 'bear_atr_min_pct': 0.018517566787301865, 'bear_atr_max_pct': 0.07916444171531625, 'bear_tp_mult': 2.897704813178735, 'bear_tsl_mult': 0.1008878599625401, 'bear_time_stop': 11, 'bear_use_sma': False, 'bear_use_ema': True, 'bear_use_atr': True, 'bear_use_adx': True, 'bear_use_spike': False, 'bear_rsi_required': True, 'sideways_strategy': 'mean_reversion', 'sideways_bb_std_mult': 2.7791159441854756, 'sideways_rsi_os': 27, 'sideways_rsi_ob': 73, 'sideways_adx_thresh': 11.285055063419847, 'sideways_atr_min_pct': 0.0043765053492935396, 'sideways_atr_max_pct': 0.09838489178038116, 'sideways_tp_mult': 1.2028875102890142, 'sideways_tsl_mult': 0.5036790161260178, 'sideways_time_stop': 266, 'sideways_use_sma': False, 'sideways_use_ema': True, 'sideways_use_atr': True, 'sideways_use_adx': True, 'sideways_use_spike': True, 'sideways_rsi_required': True}.
[I 2025-08-30 18:39:51,880] Trial 31 finished with values: [-1000000000.0, 1000000000.0] and parameters: {'p_sma': 33, 'p_std': 30, 'p_atr': 9, 'p_adx': 22, 'rsi_period': 32, 'ema1': 16, 'ema2': 29, 'slip_atr_k': 0.09038649616177812, 'slip_spread_k': 0.8441009486861722, 'spread_hl_frac': 0.03106299568842763, 'bb_std_mult': 0.8931020159441223, 'rsi_os': 34, 'rsi_ob': 59, 'vol_spike': 0.006444082008529888, 'adx_thresh': 12.87118381324963, 'atr_min_pct': 0.003992965980923543, 'atr_max_pct': 0.09274797736667054, 'tp_mult': 1.9716298432472426, 'tsl_mult': 0.5361679221118638, 'strategy': 'breakout', 'time_stop': 244, 'use_sma': False, 'use_atr': True, 'use_adx': False, 'use_ema': True, 'use_spike': True, 'rsi_required': True, 'edge_k': 0.20346842671589627, 'edge_cap': 0.7316107802935174, 'bull_strategy': 'mean_reversion', 'bull_bb_std_mult': 3.0512026907121546, 'bull_rsi_os': 19, 'bull_rsi_ob': 79, 'bull_adx_thresh': 33.7590112117283, 'bull_atr_min_pct': 0.012180403600131031, 'bull_atr_max_pct': 0.13497625827928145, 'bull_tp_mult': 1.4784446914294418, 'bull_tsl_mult': 0.6240653067961756, 'bull_time_stop': 145, 'bull_use_sma': True, 'bull_use_ema': False, 'bull_use_atr': False, 'bull_use_adx': False, 'bull_use_spike': True, 'bull_rsi_required': True, 'bear_strategy': 'breakout', 'bear_bb_std_mult': 3.1660514640574986, 'bear_rsi_os': 50, 'bear_rsi_ob': 58, 'bear_adx_thresh': 33.694731192468566, 'bear_atr_min_pct': 0.011999127153945452, 'bear_atr_max_pct': 0.13036712777780335, 'bear_tp_mult': 2.2021163633483645, 'bear_tsl_mult': 0.28586199833281173, 'bear_time_stop': 111, 'bear_use_sma': False, 'bear_use_ema': False, 'bear_use_atr': True, 'bear_use_adx': True, 'bear_use_spike': False, 'bear_rsi_required': False, 'sideways_strategy': 'mean_reversion', 'sideways_bb_std_mult': 2.4633960598244453, 'sideways_rsi_os': 18, 'sideways_rsi_ob': 72, 'sideways_adx_thresh': 10.936897397764032, 'sideways_atr_min_pct': 0.01828143067642189, 'sideways_atr_max_pct': 0.14952449877381097, 'sideways_tp_mult': 1.2256674472198488, 'sideways_tsl_mult': 0.13917523820056188, 'sideways_time_stop': 192, 'sideways_use_sma': True, 'sideways_use_ema': True, 'sideways_use_atr': True, 'sideways_use_adx': False, 'sideways_use_spike': False, 'sideways_rsi_required': False}.
[I 2025-08-30 18:39:54,965] Trial 34 finished with values: [-1000000000.0, 1000000000.0] and parameters: {'p_sma': 38, 'p_std': 34, 'p_atr': 9, 'p_adx': 17, 'rsi_period': 40, 'ema1': 16, 'ema2': 31, 'slip_atr_k': 0.08864421827577053, 'slip_spread_k': 0.949368220994735, 'spread_hl_frac': 0.022829901076743556, 'bb_std_mult': 2.2533600207643376, 'rsi_os': 19, 'rsi_ob': 50, 'vol_spike': 0.024853021398491354, 'adx_thresh': 5.193508327045862, 'atr_min_pct': 0.00464258601326125, 'atr_max_pct': 0.0130565499018397, 'tp_mult': 1.6376685153231023, 'tsl_mult': 0.37487888529646024, 'strategy': 'breakout', 'time_stop': 136, 'use_sma': False, 'use_atr': False, 'use_adx': False, 'use_ema': True, 'use_spike': True, 'rsi_required': True, 'edge_k': 0.4971335549330023, 'edge_cap': 0.4032536289001026, 'bull_strategy': 'mean_reversion', 'bull_bb_std_mult': 2.7866937687758826, 'bull_rsi_os': 5, 'bull_rsi_ob': 86, 'bull_adx_thresh': 28.133891556478215, 'bull_atr_min_pct': 0.011945120241398651, 'bull_atr_max_pct': 0.07743792299725948, 'bull_tp_mult': 2.528026970108077, 'bull_tsl_mult': 0.7765052749220605, 'bull_time_stop': 141, 'bull_use_sma': True, 'bull_use_ema': True, 'bull_use_atr': False, 'bull_use_adx': False, 'bull_use_spike': False, 'bull_rsi_required': False, 'bear_strategy': 'breakout', 'bear_bb_std_mult': 2.1763552986034416, 'bear_rsi_os': 6, 'bear_rsi_ob': 69, 'bear_adx_thresh': 17.41835851650141, 'bear_atr_min_pct': 0.018728730570954828, 'bear_atr_max_pct': 0.08136567942363729, 'bear_tp_mult': 1.3284320885982632, 'bear_tsl_mult': 0.06720860892052721, 'bear_time_stop': 288, 'bear_use_sma': True, 'bear_use_ema': False, 'bear_use_atr': True, 'bear_use_adx': True, 'bear_use_spike': False, 'bear_rsi_required': False, 'sideways_strategy': 'mean_reversion', 'sideways_bb_std_mult': 2.8466658320065314, 'sideways_rsi_os': 25, 'sideways_rsi_ob': 73, 'sideways_adx_thresh': 11.063358751383339, 'sideways_atr_min_pct': 0.02496340633101509, 'sideways_atr_max_pct': 0.07378588693348903, 'sideways_tp_mult': 1.8548986246543056, 'sideways_tsl_mult': 0.48323968779306614, 'sideways_time_stop': 269, 'sideways_use_sma': True, 'sideways_use_ema': True, 'sideways_use_atr': False, 'sideways_use_adx': False, 'sideways_use_spike': False, 'sideways_rsi_required': False}.
[I 2025-08-30 18:39:55,436] Trial 32 finished with values: [-1000000000.0, 1000000000.0] and parameters: {'p_sma': 32, 'p_std': 40, 'p_atr': 8, 'p_adx': 23, 'rsi_period': 9, 'ema1': 8, 'ema2': 29, 'slip_atr_k': 0.09618264850662418, 'slip_spread_k': 0.8432378413522764, 'spread_hl_frac': 0.02282421884011454, 'bb_std_mult': 0.928916893935273, 'rsi_os': 35, 'rsi_ob': 59, 'vol_spike': 0.03237201583935333, 'adx_thresh': 30.0229515363705, 'atr_min_pct': 0.02157599299293483, 'atr_max_pct': 0.08928173758514761, 'tp_mult': 1.6062580337317363, 'tsl_mult': 0.3627096154734337, 'strategy': 'breakout', 'time_stop': 61, 'use_sma': False, 'use_atr': False, 'use_adx': False, 'use_ema': True, 'use_spike': True, 'rsi_required': True, 'edge_k': 0.17049964426201972, 'edge_cap': 0.773129567753446, 'bull_strategy': 'mean_reversion', 'bull_bb_std_mult': 2.715079136329997, 'bull_rsi_os': 33, 'bull_rsi_ob': 78, 'bull_adx_thresh': 28.07790198767842, 'bull_atr_min_pct': 0.0023154200855619467, 'bull_atr_max_pct': 0.13513036269365555, 'bull_tp_mult': 2.113510906739026, 'bull_tsl_mult': 0.6336447295306151, 'bull_time_stop': 156, 'bull_use_sma': True, 'bull_use_ema': False, 'bull_use_atr': False, 'bull_use_adx': False, 'bull_use_spike': False, 'bull_rsi_required': False, 'bear_strategy': 'breakout', 'bear_bb_std_mult': 2.130196767114555, 'bear_rsi_os': 42, 'bear_rsi_ob': 58, 'bear_adx_thresh': 15.215072417771907, 'bear_atr_min_pct': 0.018636750019154845, 'bear_atr_max_pct': 0.13151806939853508, 'bear_tp_mult': 2.9040168020328334, 'bear_tsl_mult': 0.2736651636609479, 'bear_time_stop': 10, 'bear_use_sma': False, 'bear_use_ema': False, 'bear_use_atr': True, 'bear_use_adx': True, 'bear_use_spike': False, 'bear_rsi_required': False, 'sideways_strategy': 'mean_reversion', 'sideways_bb_std_mult': 2.54610497026907, 'sideways_rsi_os': 5, 'sideways_rsi_ob': 47, 'sideways_adx_thresh': 11.279628718090471, 'sideways_atr_min_pct': 0.016814603938148952, 'sideways_atr_max_pct': 0.048528099211648364, 'sideways_tp_mult': 1.5629464207144144, 'sideways_tsl_mult': 0.9047343195714475, 'sideways_time_stop': 202, 'sideways_use_sma': True, 'sideways_use_ema': True, 'sideways_use_atr': True, 'sideways_use_adx': False, 'sideways_use_spike': False, 'sideways_rsi_required': False}.
[I 2025-08-30 18:39:55,969] Trial 35 finished with values: [-1000000000.0, 1000000000.0] and parameters: {'p_sma': 38, 'p_std': 34, 'p_atr': 12, 'p_adx': 14, 'rsi_period': 84, 'ema1': 12, 'ema2': 32, 'slip_atr_k': 0.07647031030481566, 'slip_spread_k': 0.9881653825891898, 'spread_hl_frac': 0.021150101382458084, 'bb_std_mult': 2.370497128924533, 'rsi_os': 24, 'rsi_ob': 51, 'vol_spike': 0.08464099692962615, 'adx_thresh': 29.384225569497666, 'atr_min_pct': 0.004367307097159129, 'atr_max_pct': 0.1155877221418406, 'tp_mult': 1.100169848417293, 'tsl_mult': 0.09652011191880787, 'strategy': 'breakout', 'time_stop': 133, 'use_sma': False, 'use_atr': False, 'use_adx': False, 'use_ema': False, 'use_spike': True, 'rsi_required': True, 'edge_k': 0.5064223936739884, 'edge_cap': 0.4061447807302854, 'bull_strategy': 'mean_reversion', 'bull_bb_std_mult': 2.7038683167989026, 'bull_rsi_os': 8, 'bull_rsi_ob': 69, 'bull_adx_thresh': 22.66830749980892, 'bull_atr_min_pct': 0.012400933842413142, 'bull_atr_max_pct': 0.09034825381676752, 'bull_tp_mult': 2.501401490800238, 'bull_tsl_mult': 0.7929502486281508, 'bull_time_stop': 106, 'bull_use_sma': True, 'bull_use_ema': True, 'bull_use_atr': False, 'bull_use_adx': False, 'bull_use_spike': False, 'bull_rsi_required': False, 'bear_strategy': 'breakout', 'bear_bb_std_mult': 2.0698918576895298, 'bear_rsi_os': 8, 'bear_rsi_ob': 75, 'bear_adx_thresh': 19.227191593978628, 'bear_atr_min_pct': 0.019643475652492373, 'bear_atr_max_pct': 0.08661603267845569, 'bear_tp_mult': 2.0192192872807966, 'bear_tsl_mult': 0.30441453088176335, 'bear_time_stop': 115, 'bear_use_sma': True, 'bear_use_ema': False, 'bear_use_atr': True, 'bear_use_adx': True, 'bear_use_spike': False, 'bear_rsi_required': False, 'sideways_strategy': 'mean_reversion', 'sideways_bb_std_mult': 2.3776746051785347, 'sideways_rsi_os': 24, 'sideways_rsi_ob': 47, 'sideways_adx_thresh': 29.777535088064386, 'sideways_atr_min_pct': 0.012257251597408057, 'sideways_atr_max_pct': 0.07271132843312364, 'sideways_tp_mult': 2.8974122821529966, 'sideways_tsl_mult': 0.3005303418181964, 'sideways_time_stop': 210, 'sideways_use_sma': True, 'sideways_use_ema': True, 'sideways_use_atr': False, 'sideways_use_adx': False, 'sideways_use_spike': False, 'sideways_rsi_required': False}.
