[I 2025-08-30 19:13:59,468] Trial 294 finished with values: [-1000000000.0, 1000000000.0] and parameters: {'p_sma': 37, 'p_std': 44, 'p_atr': 18, 'p_adx': 8, 'rsi_period': 14, 'ema1': 24, 'ema2': 14, 'slip_atr_k': 0.056524959856327495, 'slip_spread_k': 0.6060865574809949, 'spread_hl_frac': 0.003554314030324238, 'bb_std_mult': 1.0301525812022791, 'rsi_os': 36, 'rsi_ob': 56, 'vol_spike': 0.039174739954833046, 'adx_thresh': 17.706082357093937, 'atr_min_pct': 0.024899730415780905, 'atr_max_pct': 0.13032440158447403, 'tp_mult': 2.123561351084277, 'tsl_mult': 0.7514969284173747, 'strategy': 'mean_reversion', 'time_stop': 35, 'use_sma': False, 'use_atr': False, 'use_adx': False, 'use_ema': True, 'use_spike': True, 'rsi_required': True, 'edge_k': 1.936137753076376, 'edge_cap': 0.3211473287891861, 'bull_strategy': 'breakout', 'bull_bb_std_mult': 1.8887916539060996, 'bull_rsi_os': 46, 'bull_rsi_ob': 71, 'bull_adx_thresh': 25.514320952991532, 'bull_atr_min_pct': 0.0016502786253232424, 'bull_atr_max_pct': 0.09275521711981824, 'bull_tp_mult': 2.2633582225761137, 'bull_tsl_mult': 0.9990833665800286, 'bull_time_stop': 92, 'bull_use_sma': False, 'bull_use_ema': False, 'bull_use_atr': False, 'bull_use_adx': True, 'bull_use_spike': True, 'bull_rsi_required': False, 'bear_strategy': 'mean_reversion', 'bear_bb_std_mult': 1.537857154057171, 'bear_rsi_os': 45, 'bear_rsi_ob': 66, 'bear_adx_thresh': 7.537667550195151, 'bear_atr_min_pct': 0.00892496053355241, 'bear_atr_max_pct': 0.052170228738196815, 'bear_tp_mult': 1.75217045691744, 'bear_tsl_mult': 0.35720224741616047, 'bear_time_stop': 36, 'bear_use_sma': False, 'bear_use_ema': False, 'bear_use_atr': False, 'bear_use_adx': False, 'bear_use_spike': True, 'bear_rsi_required': False, 'sideways_strategy': 'mean_reversion', 'sideways_bb_std_mult': 1.4703343489718552, 'sideways_rsi_os': 16, 'sideways_rsi_ob': 57, 'sideways_adx_thresh': 27.938173472452306, 'sideways_atr_min_pct': 0.02018294219259995, 'sideways_atr_max_pct': 0.015340956789832175, 'sideways_tp_mult': 1.8375736396049023, 'sideways_tsl_mult': 0.6717058785889132, 'sideways_time_stop': 296, 'sideways_use_sma': True, 'sideways_use_ema': True, 'sideways_use_atr': True, 'sideways_use_adx': True, 'sideways_use_spike': True, 'sideways_rsi_required': False}.
[I 2025-08-30 19:14:00,290] Trial 298 finished with values: [-1000000000.0, 1000000000.0] and parameters: {'p_sma': 43, 'p_std': 28, 'p_atr': 10, 'p_adx': 8, 'rsi_period': 58, 'ema1': 24, 'ema2': 18, 'slip_atr_k': 0.008918032276123632, 'slip_spread_k': 0.43501115713846017, 'spread_hl_frac': 0.01911489974169834, 'bb_std_mult': 2.886077166126082, 'rsi_os': 29, 'rsi_ob': 59, 'vol_spike': 0.08514021886005263, 'adx_thresh': 23.99691238540309, 'atr_min_pct': 0.024689955426776645, 'atr_max_pct': 0.1353741357202864, 'tp_mult': 2.11816815873002, 'tsl_mult': 0.3067135987393612, 'strategy': 'breakout', 'time_stop': 113, 'use_sma': True, 'use_atr': True, 'use_adx': False, 'use_ema': True, 'use_spike': True, 'rsi_required': True, 'edge_k': 1.1050882166574822, 'edge_cap': 0.2802820993706943, 'bull_strategy': 'mean_reversion', 'bull_bb_std_mult': 1.912726172383422, 'bull_rsi_os': 51, 'bull_rsi_ob': 89, 'bull_adx_thresh': 25.561217553884248, 'bull_atr_min_pct': 0.015051918528335035, 'bull_atr_max_pct': 0.09363416725781518, 'bull_tp_mult': 2.126049953422629, 'bull_tsl_mult': 0.7039575000595861, 'bull_time_stop': 18, 'bull_use_sma': True, 'bull_use_ema': False, 'bull_use_atr': True, 'bull_use_adx': True, 'bull_use_spike': True, 'bull_rsi_required': False, 'bear_strategy': 'breakout', 'bear_bb_std_mult': 3.209974985008717, 'bear_rsi_os': 46, 'bear_rsi_ob': 65, 'bear_adx_thresh': 20.0129330461723, 'bear_atr_min_pct': 0.02120313450030812, 'bear_atr_max_pct': 0.05121177912067633, 'bear_tp_mult': 2.322057797390603, 'bear_tsl_mult': 0.5495795230006757, 'bear_time_stop': 42, 'bear_use_sma': True, 'bear_use_ema': False, 'bear_use_atr': True, 'bear_use_adx': True, 'bear_use_spike': False, 'bear_rsi_required': False, 'sideways_strategy': 'breakout', 'sideways_bb_std_mult': 3.3767470730976776, 'sideways_rsi_os': 15, 'sideways_rsi_ob': 83, 'sideways_adx_thresh': 9.949910829689268, 'sideways_atr_min_pct': 0.012053072825571044, 'sideways_atr_max_pct': 0.09697521069764817, 'sideways_tp_mult': 1.7644981934730986, 'sideways_tsl_mult': 0.6770588068472391, 'sideways_time_stop': 292, 'sideways_use_sma': True, 'sideways_use_ema': True, 'sideways_use_atr': True, 'sideways_use_adx': False, 'sideways_use_spike': False, 'sideways_rsi_required': False}.
[I 2025-08-30 19:14:33,060] Trial 299 finished with values: [-1000000000.0, 1000000000.0] and parameters: {'p_sma': 41, 'p_std': 56, 'p_atr': 7, 'p_adx': 14, 'rsi_period': 12, 'ema1': 24, 'ema2': 18, 'slip_atr_k': 0.23206329946195958, 'slip_spread_k': 0.7217795065415044, 'spread_hl_frac': 0.019631093155992946, 'bb_std_mult': 0.9973555678544856, 'rsi_os': 47, 'rsi_ob': 70, 'vol_spike': 0.04318455746775054, 'adx_thresh': 17.85346345718846, 'atr_min_pct': 0.006110892369521942, 'atr_max_pct': 0.031775717243237314, 'tp_mult': 2.1255204139334203, 'tsl_mult': 0.5174056072685588, 'strategy': 'breakout', 'time_stop': 53, 'use_sma': False, 'use_atr': True, 'use_adx': True, 'use_ema': False, 'use_spike': False, 'rsi_required': True, 'edge_k': 0.02042333231023151, 'edge_cap': 0.2792993926686736, 'bull_strategy': 'mean_reversion', 'bull_bb_std_mult': 1.907424214464343, 'bull_rsi_os': 51, 'bull_rsi_ob': 71, 'bull_adx_thresh': 26.397282649697548, 'bull_atr_min_pct': 0.015029899683912197, 'bull_atr_max_pct': 0.1074389328628493, 'bull_tp_mult': 2.124719640589341, 'bull_tsl_mult': 0.04962329012221944, 'bull_time_stop': 184, 'bull_use_sma': True, 'bull_use_ema': False, 'bull_use_atr': False, 'bull_use_adx': True, 'bull_use_spike': True, 'bull_rsi_required': True, 'bear_strategy': 'breakout', 'bear_bb_std_mult': 2.3808945305131157, 'bear_rsi_os': 17, 'bear_rsi_ob': 89, 'bear_adx_thresh': 28.352447974338226, 'bear_atr_min_pct': 0.016972840425103865, 'bear_atr_max_pct': 0.050634015267675095, 'bear_tp_mult': 1.246328924067106, 'bear_tsl_mult': 0.9664612388303231, 'bear_time_stop': 98, 'bear_use_sma': True, 'bear_use_ema': False, 'bear_use_atr': True, 'bear_use_adx': True, 'bear_use_spike': False, 'bear_rsi_required': False, 'sideways_strategy': 'breakout', 'sideways_bb_std_mult': 1.5012949141073388, 'sideways_rsi_os': 25, 'sideways_rsi_ob': 56, 'sideways_adx_thresh': 24.24695199780798, 'sideways_atr_min_pct': 0.018869796269571824, 'sideways_atr_max_pct': 0.015208025019030957, 'sideways_tp_mult': 1.7615161238535226, 'sideways_tsl_mult': 0.7569516643054417, 'sideways_time_stop': 99, 'sideways_use_sma': True, 'sideways_use_ema': True, 'sideways_use_atr': False, 'sideways_use_adx': False, 'sideways_use_spike': False, 'sideways_rsi_required': False}.
[I 2025-08-30 19:14:33,745] Trial 302 finished with values: [-1000000000.0, 1000000000.0] and parameters: {'p_sma': 30, 'p_std': 23, 'p_atr': 7, 'p_adx': 14, 'rsi_period': 71, 'ema1': 21, 'ema2': 33, 'slip_atr_k': 0.021352937552254495, 'slip_spread_k': 0.7234771041125122, 'spread_hl_frac': 0.006294839204621854, 'bb_std_mult': 0.8910292393472236, 'rsi_os': 46, 'rsi_ob': 70, 'vol_spike': 0.29942678526942723, 'adx_thresh': 19.571871153693138, 'atr_min_pct': 0.02351813057274531, 'atr_max_pct': 0.12601685692799897, 'tp_mult': 2.2257298439183195, 'tsl_mult': 0.7338970373724073, 'strategy': 'breakout', 'time_stop': 31, 'use_sma': False, 'use_atr': True, 'use_adx': True, 'use_ema': False, 'use_spike': True, 'rsi_required': True, 'edge_k': 0.030791545962929323, 'edge_cap': 0.20391270726265734, 'bull_strategy': 'mean_reversion', 'bull_bb_std_mult': 1.8233442341979906, 'bull_rsi_os': 27, 'bull_rsi_ob': 49, 'bull_adx_thresh': 29.40972180167395, 'bull_atr_min_pct': 0.020040203573226004, 'bull_atr_max_pct': 0.062246887559077764, 'bull_tp_mult': 1.3272922656926398, 'bull_tsl_mult': 0.9746076793939518, 'bull_time_stop': 184, 'bull_use_sma': True, 'bull_use_ema': False, 'bull_use_atr': False, 'bull_use_adx': True, 'bull_use_spike': True, 'bull_rsi_required': True, 'bear_strategy': 'breakout', 'bear_bb_std_mult': 3.1556012746714353, 'bear_rsi_os': 50, 'bear_rsi_ob': 50, 'bear_adx_thresh': 6.320134082876754, 'bear_atr_min_pct': 0.01351663815028911, 'bear_atr_max_pct': 0.057011734990931075, 'bear_tp_mult': 1.7154991549519556, 'bear_tsl_mult': 0.45222573419707873, 'bear_time_stop': 166, 'bear_use_sma': True, 'bear_use_ema': False, 'bear_use_atr': True, 'bear_use_adx': True, 'bear_use_spike': False, 'bear_rsi_required': False, 'sideways_strategy': 'breakout', 'sideways_bb_std_mult': 2.263145537065788, 'sideways_rsi_os': 17, 'sideways_rsi_ob': 59, 'sideways_adx_thresh': 24.10482499353861, 'sideways_atr_min_pct': 0.00015220969588382836, 'sideways_atr_max_pct': 0.08798541928091153, 'sideways_tp_mult': 2.026957099417539, 'sideways_tsl_mult': 0.5196188270755748, 'sideways_time_stop': 277, 'sideways_use_sma': True, 'sideways_use_ema': True, 'sideways_use_atr': False, 'sideways_use_adx': False, 'sideways_use_spike': False, 'sideways_rsi_required': False}.
[I 2025-08-30 19:14:33,752] Trial 301 finished with values: [-0.023484130449156315, 0.023370170641230502] and parameters: {'p_sma': 40, 'p_std': 18, 'p_atr': 9, 'p_adx': 8, 'rsi_period': 57, 'ema1': 21, 'ema2': 19, 'slip_atr_k': 0.06638170228229495, 'slip_spread_k': 0.8190099100577499, 'spread_hl_frac': 0.006189885272842521, 'bb_std_mult': 0.9031668856005693, 'rsi_os': 25, 'rsi_ob': 58, 'vol_spike': 0.1521951463459453, 'adx_thresh': 23.818667243113026, 'atr_min_pct': 0.024235199695271954, 'atr_max_pct': 0.1347279553023123, 'tp_mult': 2.2450880745541895, 'tsl_mult': 0.2585920076493241, 'strategy': 'breakout', 'time_stop': 153, 'use_sma': False, 'use_atr': True, 'use_adx': True, 'use_ema': False, 'use_spike': True, 'rsi_required': True, 'edge_k': 1.132811515652358, 'edge_cap': 0.8019483248329752, 'bull_strategy': 'mean_reversion', 'bull_bb_std_mult': 1.841546663346095, 'bull_rsi_os': 49, 'bull_rsi_ob': 74, 'bull_adx_thresh': 18.101245399462062, 'bull_atr_min_pct': 0.002175643968207376, 'bull_atr_max_pct': 0.0633788353967512, 'bull_tp_mult': 2.134006114584693, 'bull_tsl_mult': 0.5558586677357181, 'bull_time_stop': 184, 'bull_use_sma': True, 'bull_use_ema': False, 'bull_use_atr': False, 'bull_use_adx': True, 'bull_use_spike': True, 'bull_rsi_required': True, 'bear_strategy': 'breakout', 'bear_bb_std_mult': 3.133370661173811, 'bear_rsi_os': 51, 'bear_rsi_ob': 85, 'bear_adx_thresh': 6.354734361510189, 'bear_atr_min_pct': 0.013864747975593365, 'bear_atr_max_pct': 0.06093866950757194, 'bear_tp_mult': 1.716784908407184, 'bear_tsl_mult': 0.44741134947238875, 'bear_time_stop': 74, 'bear_use_sma': True, 'bear_use_ema': False, 'bear_use_atr': True, 'bear_use_adx': True, 'bear_use_spike': False, 'bear_rsi_required': False, 'sideways_strategy': 'breakout', 'sideways_bb_std_mult': 2.0858394558835203, 'sideways_rsi_os': 25, 'sideways_rsi_ob': 59, 'sideways_adx_thresh': 24.18488217815179, 'sideways_atr_min_pct': 0.018973011918450453, 'sideways_atr_max_pct': 0.11869952525938927, 'sideways_tp_mult': 1.7771168944074716, 'sideways_tsl_mult': 0.763757262434281, 'sideways_time_stop': 276, 'sideways_use_sma': True, 'sideways_use_ema': True, 'sideways_use_atr': False, 'sideways_use_adx': False, 'sideways_use_spike': False, 'sideways_rsi_required': False}.
[I 2025-08-30 19:14:33,859] Trial 300 finished with values: [-0.019321657781812607, 0.01930212375051793] and parameters: {'p_sma': 40, 'p_std': 24, 'p_atr': 9, 'p_adx': 30, 'rsi_period': 12, 'ema1': 24, 'ema2': 19, 'slip_atr_k': 0.2295994269251729, 'slip_spread_k': 0.6076822264393131, 'spread_hl_frac': 0.0061600439008632655, 'bb_std_mult': 2.234675106511223, 'rsi_os': 37, 'rsi_ob': 57, 'vol_spike': 0.04450157801602157, 'adx_thresh': 20.123969583060564, 'atr_min_pct': 0.024892522269191635, 'atr_max_pct': 0.1263353519717621, 'tp_mult': 2.2339898829515343, 'tsl_mult': 0.3088875031678599, 'strategy': 'breakout', 'time_stop': 35, 'use_sma': False, 'use_atr': True, 'use_adx': True, 'use_ema': False, 'use_spike': True, 'rsi_required': True, 'edge_k': 0.022378500539442236, 'edge_cap': 0.4412856129579471, 'bull_strategy': 'mean_reversion', 'bull_bb_std_mult': 1.8920136066036868, 'bull_rsi_os': 47, 'bull_rsi_ob': 49, 'bull_adx_thresh': 29.46790569473051, 'bull_atr_min_pct': 0.0018116025355654807, 'bull_atr_max_pct': 0.0641864123162536, 'bull_tp_mult': 2.132947142552691, 'bull_tsl_mult': 0.7059617956887206, 'bull_time_stop': 190, 'bull_use_sma': True, 'bull_use_ema': False, 'bull_use_atr': False, 'bull_use_adx': True, 'bull_use_spike': True, 'bull_rsi_required': True, 'bear_strategy': 'breakout', 'bear_bb_std_mult': 3.1467863635957913, 'bear_rsi_os': 42, 'bear_rsi_ob': 78, 'bear_adx_thresh': 28.253884793845305, 'bear_atr_min_pct': 0.013872412592356418, 'bear_atr_max_pct': 0.08884091995088925, 'bear_tp_mult': 1.7560952447099314, 'bear_tsl_mult': 0.06893050142441513, 'bear_time_stop': 42, 'bear_use_sma': True, 'bear_use_ema': False, 'bear_use_atr': True, 'bear_use_adx': True, 'bear_use_spike': False, 'bear_rsi_required': False, 'sideways_strategy': 'breakout', 'sideways_bb_std_mult': 2.4420663499190476, 'sideways_rsi_os': 25, 'sideways_rsi_ob': 56, 'sideways_adx_thresh': 11.040735726415935, 'sideways_atr_min_pct': 0.025301013538375786, 'sideways_atr_max_pct': 0.08889398911688376, 'sideways_tp_mult': 1.753028455590814, 'sideways_tsl_mult': 0.6765071147913156, 'sideways_time_stop': 257, 'sideways_use_sma': True, 'sideways_use_ema': True, 'sideways_use_atr': False, 'sideways_use_adx': False, 'sideways_use_spike': False, 'sideways_rsi_required': False}.
[I 2025-08-30 19:15:05,082] Trial 305 finished with values: [-1000000000.0, 1000000000.0] and parameters: {'p_sma': 39, 'p_std': 26, 'p_atr': 9, 'p_adx': 24, 'rsi_period': 54, 'ema1': 12, 'ema2': 17, 'slip_atr_k': 0.06527208888103145, 'slip_spread_k': 0.39436799716365883, 'spread_hl_frac': 0.03991502557177108, 'bb_std_mult': 3.079884560233333, 'rsi_os': 37, 'rsi_ob': 57, 'vol_spike': 0.029529356185748725, 'adx_thresh': 20.216325130384064, 'atr_min_pct': 0.003459900249945108, 'atr_max_pct': 0.14434464203518604, 'tp_mult': 2.3337854920609358, 'tsl_mult': 0.26532603801111954, 'strategy': 'breakout', 'time_stop': 18, 'use_sma': False, 'use_atr': True, 'use_adx': False, 'use_ema': False, 'use_spike': True, 'rsi_required': False, 'edge_k': 0.08398061048207632, 'edge_cap': 0.21844121697110017, 'bull_strategy': 'mean_reversion', 'bull_bb_std_mult': 1.6326222796466237, 'bull_rsi_os': 23, 'bull_rsi_ob': 73, 'bull_adx_thresh': 12.571886791009625, 'bull_atr_min_pct': 0.022205241220895733, 'bull_atr_max_pct': 0.022860911753613884, 'bull_tp_mult': 2.161548900900758, 'bull_tsl_mult': 0.44427954601124603, 'bull_time_stop': 193, 'bull_use_sma': True, 'bull_use_ema': False, 'bull_use_atr': False, 'bull_use_adx': False, 'bull_use_spike': True, 'bull_rsi_required': True, 'bear_strategy': 'breakout', 'bear_bb_std_mult': 2.515065771584381, 'bear_rsi_os': 44, 'bear_rsi_ob': 85, 'bear_adx_thresh': 5.935325172166558, 'bear_atr_min_pct': 0.013832793588399917, 'bear_atr_max_pct': 0.06195109565077053, 'bear_tp_mult': 1.8144768437802243, 'bear_tsl_mult': 0.07273761305162427, 'bear_time_stop': 28, 'bear_use_sma': False, 'bear_use_ema': False, 'bear_use_atr': True, 'bear_use_adx': True, 'bear_use_spike': False, 'bear_rsi_required': False, 'sideways_strategy': 'breakout', 'sideways_bb_std_mult': 1.9955031464066841, 'sideways_rsi_os': 19, 'sideways_rsi_ob': 58, 'sideways_adx_thresh': 7.232400558851925, 'sideways_atr_min_pct': 0.01953876324642599, 'sideways_atr_max_pct': 0.12340158307689923, 'sideways_tp_mult': 1.5311231697739167, 'sideways_tsl_mult': 0.6423638217962087, 'sideways_time_stop': 256, 'sideways_use_sma': True, 'sideways_use_ema': False, 'sideways_use_atr': False, 'sideways_use_adx': False, 'sideways_use_spike': False, 'sideways_rsi_required': False}.
[I 2025-08-30 19:15:05,719] Trial 303 finished with values: [-1000000000.0, 1000000000.0] and parameters: {'p_sma': 39, 'p_std': 23, 'p_atr': 9, 'p_adx': 26, 'rsi_period': 46, 'ema1': 21, 'ema2': 20, 'slip_atr_k': 0.06626782579561698, 'slip_spread_k': 0.8628969885599418, 'spread_hl_frac': 0.0060266287828848394, 'bb_std_mult': 2.2144827245856464, 'rsi_os': 37, 'rsi_ob': 57, 'vol_spike': 0.03245614631408589, 'adx_thresh': 20.193733571275743, 'atr_min_pct': 0.0032996276353122675, 'atr_max_pct': 0.1442766502528765, 'tp_mult': 2.2349534354523586, 'tsl_mult': 0.35357492256415557, 'strategy': 'breakout', 'time_stop': 105, 'use_sma': False, 'use_atr': True, 'use_adx': True, 'use_ema': False, 'use_spike': True, 'rsi_required': True, 'edge_k': 0.18402303959972455, 'edge_cap': 0.1720858204425731, 'bull_strategy': 'mean_reversion', 'bull_bb_std_mult': 2.4013987134060786, 'bull_rsi_os': 49, 'bull_rsi_ob': 74, 'bull_adx_thresh': 29.3949784752225, 'bull_atr_min_pct': 0.002306200684343405, 'bull_atr_max_pct': 0.027164565182866297, 'bull_tp_mult': 2.8482031902568137, 'bull_tsl_mult': 0.9753123718364965, 'bull_time_stop': 191, 'bull_use_sma': True, 'bull_use_ema': False, 'bull_use_atr': False, 'bull_use_adx': False, 'bull_use_spike': True, 'bull_rsi_required': True, 'bear_strategy': 'breakout', 'bear_bb_std_mult': 1.1250173555635943, 'bear_rsi_os': 33, 'bear_rsi_ob': 82, 'bear_adx_thresh': 6.227612241936743, 'bear_atr_min_pct': 0.013721578515323362, 'bear_atr_max_pct': 0.08770526578981616, 'bear_tp_mult': 1.7386645983472448, 'bear_tsl_mult': 0.4512418187181875, 'bear_time_stop': 27, 'bear_use_sma': True, 'bear_use_ema': False, 'bear_use_atr': True, 'bear_use_adx': True, 'bear_use_spike': False, 'bear_rsi_required': False, 'sideways_strategy': 'breakout', 'sideways_bb_std_mult': 2.070467708709765, 'sideways_rsi_os': 17, 'sideways_rsi_ob': 86, 'sideways_adx_thresh': 8.808964769834805, 'sideways_atr_min_pct': 0.01933917818120237, 'sideways_atr_max_pct': 0.1178652387354141, 'sideways_tp_mult': 1.7059471496387926, 'sideways_tsl_mult': 0.5278976377338395, 'sideways_time_stop': 276, 'sideways_use_sma': True, 'sideways_use_ema': False, 'sideways_use_atr': False, 'sideways_use_adx': False, 'sideways_use_spike': False, 'sideways_rsi_required': False}.
[I 2025-08-30 19:15:05,754] Trial 304 finished with values: [-1000000000.0, 1000000000.0] and parameters: {'p_sma': 39, 'p_std': 16, 'p_atr': 9, 'p_adx': 26, 'rsi_period': 33, 'ema1': 23, 'ema2': 17, 'slip_atr_k': 0.014258699530519808, 'slip_spread_k': 0.8185344919438244, 'spread_hl_frac': 0.0399646239675313, 'bb_std_mult': 0.9288201331569561, 'rsi_os': 37, 'rsi_ob': 57, 'vol_spike': 0.24199239514200221, 'adx_thresh': 20.173912983606296, 'atr_min_pct': 0.024110977368647875, 'atr_max_pct': 0.13452355189391121, 'tp_mult': 2.231056573552229, 'tsl_mult': 0.6829454024392417, 'strategy': 'breakout', 'time_stop': 18, 'use_sma': False, 'use_atr': True, 'use_adx': False, 'use_ema': False, 'use_spike': True, 'rsi_required': False, 'edge_k': 0.1849906767121244, 'edge_cap': 0.63716304237418, 'bull_strategy': 'mean_reversion', 'bull_bb_std_mult': 1.8393604393934095, 'bull_rsi_os': 47, 'bull_rsi_ob': 73, 'bull_adx_thresh': 24.828568334017927, 'bull_atr_min_pct': 0.010036797549983885, 'bull_atr_max_pct': 0.024559819179736795, 'bull_tp_mult': 2.1705408520937133, 'bull_tsl_mult': 0.5515669572433812, 'bull_time_stop': 191, 'bull_use_sma': True, 'bull_use_ema': False, 'bull_use_atr': False, 'bull_use_adx': False, 'bull_use_spike': True, 'bull_rsi_required': True, 'bear_strategy': 'breakout', 'bear_bb_std_mult': 3.022960457654489, 'bear_rsi_os': 44, 'bear_rsi_ob': 78, 'bear_adx_thresh': 5.569059488692179, 'bear_atr_min_pct': 0.003801871400194237, 'bear_atr_max_pct': 0.06139825951997339, 'bear_tp_mult': 1.784812226483851, 'bear_tsl_mult': 0.1802191305628872, 'bear_time_stop': 28, 'bear_use_sma': False, 'bear_use_ema': False, 'bear_use_atr': True, 'bear_use_adx': True, 'bear_use_spike': False, 'bear_rsi_required': False, 'sideways_strategy': 'breakout', 'sideways_bb_std_mult': 1.9970712764856555, 'sideways_rsi_os': 13, 'sideways_rsi_ob': 58, 'sideways_adx_thresh': 10.924655423136787, 'sideways_atr_min_pct': 0.006675433177657326, 'sideways_atr_max_pct': 0.11825020938768832, 'sideways_tp_mult': 2.9971709453762183, 'sideways_tsl_mult': 0.6230993086174312, 'sideways_time_stop': 256, 'sideways_use_sma': True, 'sideways_use_ema': False, 'sideways_use_atr': False, 'sideways_use_adx': False, 'sideways_use_spike': False, 'sideways_rsi_required': False}.
