[I 2025-08-30 18:41:35,446] Trial 47 finished with values: [-1000000000.0, 1000000000.0] and parameters: {'p_sma': 58, 'p_std': 10, 'p_atr': 22, 'p_adx': 8, 'rsi_period': 74, 'ema1': 17, 'ema2': 20, 'slip_atr_k': 0.10607333495474192, 'slip_spread_k': 0.5925169963973281, 'spread_hl_frac': 0.017904822885310194, 'bb_std_mult': 0.6862374619500753, 'rsi_os': 41, 'rsi_ob': 85, 'vol_spike': 0.019890780272419663, 'adx_thresh': 33.18280028202334, 'atr_min_pct': 0.020875073909061275, 'atr_max_pct': 0.07253101332247648, 'tp_mult': 2.676522076479301, 'tsl_mult': 0.8997105969537555, 'strategy': 'breakout', 'time_stop': 277, 'use_sma': False, 'use_atr': False, 'use_adx': False, 'use_ema': False, 'use_spike': True, 'rsi_required': True, 'edge_k': 0.40030272799101974, 'edge_cap': 0.6512687829902755, 'bull_strategy': 'mean_reversion', 'bull_bb_std_mult': 1.831126158349692, 'bull_rsi_os': 20, 'bull_rsi_ob': 76, 'bull_adx_thresh': 12.19504193968796, 'bull_atr_min_pct': 0.006294811787835938, 'bull_atr_max_pct': 0.14137240675966709, 'bull_tp_mult': 1.7040744609216247, 'bull_tsl_mult': 0.4943238729878147, 'bull_time_stop': 66, 'bull_use_sma': True, 'bull_use_ema': False, 'bull_use_atr': True, 'bull_use_adx': False, 'bull_use_spike': True, 'bull_rsi_required': True, 'bear_strategy': 'breakout', 'bear_bb_std_mult': 0.6407124610654736, 'bear_rsi_os': 41, 'bear_rsi_ob': 62, 'bear_adx_thresh': 32.55554094478618, 'bear_atr_min_pct': 0.01552593626684252, 'bear_atr_max_pct': 0.14047620027113022, 'bear_tp_mult': 2.382868908687709, 'bear_tsl_mult': 0.9576134884857035, 'bear_time_stop': 25, 'bear_use_sma': False, 'bear_use_ema': False, 'bear_use_atr': True, 'bear_use_adx': True, 'bear_use_spike': False, 'bear_rsi_required': False, 'sideways_strategy': 'mean_reversion', 'sideways_bb_std_mult': 1.601512871663168, 'sideways_rsi_os': 22, 'sideways_rsi_ob': 50, 'sideways_adx_thresh': 7.58736087734305, 'sideways_atr_min_pct': 0.009877705544620263, 'sideways_atr_max_pct': 0.13792383186595414, 'sideways_tp_mult': 1.684709728092216, 'sideways_tsl_mult': 0.69955908192633, 'sideways_time_stop': 243, 'sideways_use_sma': True, 'sideways_use_ema': True, 'sideways_use_atr': True, 'sideways_use_adx': False, 'sideways_use_spike': False, 'sideways_rsi_required': False}.
[I 2025-08-30 18:41:35,807] Trial 46 finished with values: [-1000000000.0, 1000000000.0] and parameters: {'p_sma': 35, 'p_std': 10, 'p_atr': 22, 'p_adx': 9, 'rsi_period': 29, 'ema1': 23, 'ema2': 18, 'slip_atr_k': 0.05012420784405604, 'slip_spread_k': 0.757798701161706, 'spread_hl_frac': 0.013318032805088685, 'bb_std_mult': 0.9958386701020365, 'rsi_os': 41, 'rsi_ob': 86, 'vol_spike': 0.02124878622369756, 'adx_thresh': 33.42951262162805, 'atr_min_pct': 0.02175780981662334, 'atr_max_pct': 0.0733078196029152, 'tp_mult': 2.6819273510963497, 'tsl_mult': 0.7537319977398764, 'strategy': 'breakout', 'time_stop': 33, 'use_sma': False, 'use_atr': False, 'use_adx': False, 'use_ema': False, 'use_spike': True, 'rsi_required': True, 'edge_k': 0.3338755133847645, 'edge_cap': 0.3653086090944735, 'bull_strategy': 'mean_reversion', 'bull_bb_std_mult': 1.8721111033447673, 'bull_rsi_os': 49, 'bull_rsi_ob': 73, 'bull_adx_thresh': 12.034543580164831, 'bull_atr_min_pct': 0.005729018206614314, 'bull_atr_max_pct': 0.14148732359843053, 'bull_tp_mult': 1.72603409403172, 'bull_tsl_mult': 0.13704861917772426, 'bull_time_stop': 191, 'bull_use_sma': True, 'bull_use_ema': False, 'bull_use_atr': True, 'bull_use_adx': False, 'bull_use_spike': True, 'bull_rsi_required': True, 'bear_strategy': 'breakout', 'bear_bb_std_mult': 0.5607891478317706, 'bear_rsi_os': 45, 'bear_rsi_ob': 62, 'bear_adx_thresh': 31.65102898976634, 'bear_atr_min_pct': 0.01581307770517785, 'bear_atr_max_pct': 0.13997665499869166, 'bear_tp_mult': 2.446784328852685, 'bear_tsl_mult': 0.9544715181193648, 'bear_time_stop': 30, 'bear_use_sma': True, 'bear_use_ema': False, 'bear_use_atr': True, 'bear_use_adx': True, 'bear_use_spike': False, 'bear_rsi_required': False, 'sideways_strategy': 'mean_reversion', 'sideways_bb_std_mult': 1.6098767459796575, 'sideways_rsi_os': 22, 'sideways_rsi_ob': 51, 'sideways_adx_thresh': 7.402628005899308, 'sideways_atr_min_pct': 0.019406830072369714, 'sideways_atr_max_pct': 0.13787968426888636, 'sideways_tp_mult': 1.6948644587962858, 'sideways_tsl_mult': 0.22273955980614052, 'sideways_time_stop': 6, 'sideways_use_sma': True, 'sideways_use_ema': True, 'sideways_use_atr': False, 'sideways_use_adx': False, 'sideways_use_spike': False, 'sideways_rsi_required': False}.
[I 2025-08-30 18:41:35,910] Trial 45 finished with values: [-0.025930655318966433, 0.025914436682395434] and parameters: {'p_sma': 35, 'p_std': 9, 'p_atr': 23, 'p_adx': 9, 'rsi_period': 37, 'ema1': 23, 'ema2': 59, 'slip_atr_k': 0.05008727660838098, 'slip_spread_k': 0.7482225070736829, 'spread_hl_frac': 0.018197420472068054, 'bb_std_mult': 1.870560000158755, 'rsi_os': 14, 'rsi_ob': 83, 'vol_spike': 0.016337492250114057, 'adx_thresh': 22.078259921567657, 'atr_min_pct': 0.021031723486473114, 'atr_max_pct': 0.13728172272954808, 'tp_mult': 2.705957485417279, 'tsl_mult': 0.8904586159989848, 'strategy': 'breakout', 'time_stop': 33, 'use_sma': False, 'use_atr': True, 'use_adx': False, 'use_ema': True, 'use_spike': True, 'rsi_required': True, 'edge_k': 0.37793443847609, 'edge_cap': 0.3614048334332431, 'bull_strategy': 'mean_reversion', 'bull_bb_std_mult': 1.939664312018978, 'bull_rsi_os': 10, 'bull_rsi_ob': 45, 'bull_adx_thresh': 11.172650130958239, 'bull_atr_min_pct': 0.0023664645786742235, 'bull_atr_max_pct': 0.027874968408174536, 'bull_tp_mult': 2.201016917163652, 'bull_tsl_mult': 0.5108401375371581, 'bull_time_stop': 188, 'bull_use_sma': True, 'bull_use_ema': False, 'bull_use_atr': True, 'bull_use_adx': True, 'bull_use_spike': True, 'bull_rsi_required': True, 'bear_strategy': 'breakout', 'bear_bb_std_mult': 0.6530976115214835, 'bear_rsi_os': 26, 'bear_rsi_ob': 63, 'bear_adx_thresh': 12.16957954606294, 'bear_atr_min_pct': 0.015142611150500362, 'bear_atr_max_pct': 0.10470373426310114, 'bear_tp_mult': 2.488728145696228, 'bear_tsl_mult': 0.9905275408512488, 'bear_time_stop': 30, 'bear_use_sma': True, 'bear_use_ema': True, 'bear_use_atr': True, 'bear_use_adx': True, 'bear_use_spike': False, 'bear_rsi_required': False, 'sideways_strategy': 'breakout', 'sideways_bb_std_mult': 1.6478515486579852, 'sideways_rsi_os': 22, 'sideways_rsi_ob': 52, 'sideways_adx_thresh': 7.465030556552207, 'sideways_atr_min_pct': 0.009304047532724017, 'sideways_atr_max_pct': 0.08483119795104817, 'sideways_tp_mult': 1.6954477008034523, 'sideways_tsl_mult': 0.5441510318269668, 'sideways_time_stop': 248, 'sideways_use_sma': False, 'sideways_use_ema': True, 'sideways_use_atr': True, 'sideways_use_adx': False, 'sideways_use_spike': False, 'sideways_rsi_required': False}.
[I 2025-08-30 18:42:08,792] Trial 50 finished with values: [-0.024527763217895737, 0.024441183325697446] and parameters: {'p_sma': 42, 'p_std': 26, 'p_atr': 8, 'p_adx': 8, 'rsi_period': 52, 'ema1': 9, 'ema2': 60, 'slip_atr_k': 0.18682278775064637, 'slip_spread_k': 0.4492292425026941, 'spread_hl_frac': 0.0037313562949225533, 'bb_std_mult': 1.176827822719239, 'rsi_os': 50, 'rsi_ob': 62, 'vol_spike': 0.03845787559041957, 'adx_thresh': 14.371550910712589, 'atr_min_pct': 0.024125050681677637, 'atr_max_pct': 0.13937552621316376, 'tp_mult': 2.2066561312103894, 'tsl_mult': 0.9995802904397104, 'strategy': 'breakout', 'time_stop': 74, 'use_sma': False, 'use_atr': True, 'use_adx': False, 'use_ema': False, 'use_spike': True, 'rsi_required': True, 'edge_k': 0.1615289876369204, 'edge_cap': 0.16520335236961647, 'bull_strategy': 'mean_reversion', 'bull_bb_std_mult': 1.6827611059687486, 'bull_rsi_os': 10, 'bull_rsi_ob': 45, 'bull_adx_thresh': 26.724054074658813, 'bull_atr_min_pct': 0.0023623047716686547, 'bull_atr_max_pct': 0.025522975768615605, 'bull_tp_mult': 2.192724103740412, 'bull_tsl_mult': 0.6861030563570323, 'bull_time_stop': 245, 'bull_use_sma': True, 'bull_use_ema': False, 'bull_use_atr': False, 'bull_use_adx': True, 'bull_use_spike': True, 'bull_rsi_required': True, 'bear_strategy': 'breakout', 'bear_bb_std_mult': 3.407726860008375, 'bear_rsi_os': 52, 'bear_rsi_ob': 68, 'bear_adx_thresh': 19.591510173406505, 'bear_atr_min_pct': 0.01751287697894802, 'bear_atr_max_pct': 0.056986214584494745, 'bear_tp_mult': 1.7235058032755144, 'bear_tsl_mult': 0.10100050350699616, 'bear_time_stop': 38, 'bear_use_sma': False, 'bear_use_ema': False, 'bear_use_atr': True, 'bear_use_adx': True, 'bear_use_spike': False, 'bear_rsi_required': False, 'sideways_strategy': 'breakout', 'sideways_bb_std_mult': 2.0227132160536576, 'sideways_rsi_os': 16, 'sideways_rsi_ob': 58, 'sideways_adx_thresh': 15.099733443388697, 'sideways_atr_min_pct': 0.021591012437759974, 'sideways_atr_max_pct': 0.10091660830014727, 'sideways_tp_mult': 2.1521844875577605, 'sideways_tsl_mult': 0.1694368048487352, 'sideways_time_stop': 276, 'sideways_use_sma': True, 'sideways_use_ema': True, 'sideways_use_atr': False, 'sideways_use_adx': False, 'sideways_use_spike': False, 'sideways_rsi_required': False}.
[I 2025-08-30 18:42:08,987] Trial 48 finished with values: [-1000000000.0, 1000000000.0] and parameters: {'p_sma': 41, 'p_std': 26, 'p_atr': 10, 'p_adx': 8, 'rsi_period': 75, 'ema1': 17, 'ema2': 20, 'slip_atr_k': 0.10410191277615764, 'slip_spread_k': 0.5759065722070772, 'spread_hl_frac': 0.04948574069577548, 'bb_std_mult': 2.6229164481904377, 'rsi_os': 42, 'rsi_ob': 85, 'vol_spike': 0.016732113337298394, 'adx_thresh': 32.59747113494549, 'atr_min_pct': 0.02639144555049841, 'atr_max_pct': 0.07453421921341107, 'tp_mult': 2.645361474979102, 'tsl_mult': 0.847088312514096, 'strategy': 'breakout', 'time_stop': 45, 'use_sma': False, 'use_atr': False, 'use_adx': False, 'use_ema': False, 'use_spike': True, 'rsi_required': True, 'edge_k': 0.37640596127301496, 'edge_cap': 0.6076848935811257, 'bull_strategy': 'mean_reversion', 'bull_bb_std_mult': 1.9066937676220581, 'bull_rsi_os': 19, 'bull_rsi_ob': 95, 'bull_adx_thresh': 12.810890580809307, 'bull_atr_min_pct': 0.006213118280134149, 'bull_atr_max_pct': 0.14004857744553464, 'bull_tp_mult': 2.1382036617270392, 'bull_tsl_mult': 0.11741056033843666, 'bull_time_stop': 178, 'bull_use_sma': True, 'bull_use_ema': False, 'bull_use_atr': True, 'bull_use_adx': False, 'bull_use_spike': True, 'bull_rsi_required': True, 'bear_strategy': 'breakout', 'bear_bb_std_mult': 0.5075775477151585, 'bear_rsi_os': 27, 'bear_rsi_ob': 62, 'bear_adx_thresh': 32.65379999370255, 'bear_atr_min_pct': 0.015215071793063507, 'bear_atr_max_pct': 0.14952390618386807, 'bear_tp_mult': 1.748681354161876, 'bear_tsl_mult': 0.9852830201249376, 'bear_time_stop': 33, 'bear_use_sma': False, 'bear_use_ema': False, 'bear_use_atr': True, 'bear_use_adx': True, 'bear_use_spike': False, 'bear_rsi_required': False, 'sideways_strategy': 'mean_reversion', 'sideways_bb_std_mult': 1.5688137092815977, 'sideways_rsi_os': 21, 'sideways_rsi_ob': 70, 'sideways_adx_thresh': 7.765767153638738, 'sideways_atr_min_pct': 0.009970942847780828, 'sideways_atr_max_pct': 0.13316416720019564, 'sideways_tp_mult': 1.6811131385775866, 'sideways_tsl_mult': 0.20682278506442064, 'sideways_time_stop': 246, 'sideways_use_sma': True, 'sideways_use_ema': True, 'sideways_use_atr': True, 'sideways_use_adx': False, 'sideways_use_spike': False, 'sideways_rsi_required': False}.
[I 2025-08-30 18:42:09,095] Trial 51 finished with values: [-1000000000.0, 1000000000.0] and parameters: {'p_sma': 41, 'p_std': 26, 'p_atr': 27, 'p_adx': 8, 'rsi_period': 53, 'ema1': 17, 'ema2': 41, 'slip_atr_k': 0.009145738760086189, 'slip_spread_k': 0.45474398695263324, 'spread_hl_frac': 0.04786503350766587, 'bb_std_mult': 2.629481052260208, 'rsi_os': 50, 'rsi_ob': 75, 'vol_spike': 0.038991604806639026, 'adx_thresh': 18.332836440925462, 'atr_min_pct': 0.02499641618651148, 'atr_max_pct': 0.13704055968182607, 'tp_mult': 2.1410864580673046, 'tsl_mult': 0.1348032367175806, 'strategy': 'breakout', 'time_stop': 170, 'use_sma': False, 'use_atr': True, 'use_adx': False, 'use_ema': False, 'use_spike': True, 'rsi_required': True, 'edge_k': 0.14115372729343045, 'edge_cap': 0.13027810762361977, 'bull_strategy': 'mean_reversion', 'bull_bb_std_mult': 2.182728084815104, 'bull_rsi_os': 11, 'bull_rsi_ob': 94, 'bull_adx_thresh': 25.98578592459721, 'bull_atr_min_pct': 0.0024903604417075313, 'bull_atr_max_pct': 0.10051019563008934, 'bull_tp_mult': 2.1651745856833773, 'bull_tsl_mult': 0.686402320475678, 'bull_time_stop': 175, 'bull_use_sma': True, 'bull_use_ema': False, 'bull_use_atr': False, 'bull_use_adx': True, 'bull_use_spike': True, 'bull_rsi_required': True, 'bear_strategy': 'breakout', 'bear_bb_std_mult': 3.4345083606411606, 'bear_rsi_os': 21, 'bear_rsi_ob': 77, 'bear_adx_thresh': 20.237576101090212, 'bear_atr_min_pct': 0.007517743563992129, 'bear_atr_max_pct': 0.10542977251826248, 'bear_tp_mult': 1.8075913569368545, 'bear_tsl_mult': 0.11926080066564343, 'bear_time_stop': 39, 'bear_use_sma': False, 'bear_use_ema': False, 'bear_use_atr': True, 'bear_use_adx': True, 'bear_use_spike': False, 'bear_rsi_required': False, 'sideways_strategy': 'breakout', 'sideways_bb_std_mult': 2.065454776551717, 'sideways_rsi_os': 17, 'sideways_rsi_ob': 70, 'sideways_adx_thresh': 9.66465153865697, 'sideways_atr_min_pct': 0.022655321090218856, 'sideways_atr_max_pct': 0.11966648114009164, 'sideways_tp_mult': 2.128403310595269, 'sideways_tsl_mult': 0.6757746752083854, 'sideways_time_stop': 276, 'sideways_use_sma': True, 'sideways_use_ema': True, 'sideways_use_atr': False, 'sideways_use_adx': False, 'sideways_use_spike': False, 'sideways_rsi_required': False}.
[I 2025-08-30 18:42:09,186] Trial 49 finished with values: [-0.012518580703100635, 0.01283397383129551] and parameters: {'p_sma': 41, 'p_std': 26, 'p_atr': 10, 'p_adx': 8, 'rsi_period': 52, 'ema1': 24, 'ema2': 17, 'slip_atr_k': 0.01880083700565305, 'slip_spread_k': 0.4159667850415419, 'spread_hl_frac': 0.0038415027351966433, 'bb_std_mult': 0.9816067591947889, 'rsi_os': 37, 'rsi_ob': 57, 'vol_spike': 0.038099596452330756, 'adx_thresh': 18.660797254082215, 'atr_min_pct': 0.023768677264740953, 'atr_max_pct': 0.13652664650988092, 'tp_mult': 2.1869558548018473, 'tsl_mult': 0.7269973507022232, 'strategy': 'breakout', 'time_stop': 34, 'use_sma': False, 'use_atr': True, 'use_adx': False, 'use_ema': False, 'use_spike': True, 'rsi_required': True, 'edge_k': 0.12701296657458905, 'edge_cap': 0.24006450736761184, 'bull_strategy': 'mean_reversion', 'bull_bb_std_mult': 1.854733737776357, 'bull_rsi_os': 50, 'bull_rsi_ob': 72, 'bull_adx_thresh': 25.571787336883254, 'bull_atr_min_pct': 0.002487764375401085, 'bull_atr_max_pct': 0.025908810382817435, 'bull_tp_mult': 2.168245417963411, 'bull_tsl_mult': 0.9855806574601902, 'bull_time_stop': 187, 'bull_use_sma': True, 'bull_use_ema': False, 'bull_use_atr': False, 'bull_use_adx': True, 'bull_use_spike': True, 'bull_rsi_required': True, 'bear_strategy': 'breakout', 'bear_bb_std_mult': 3.2795681742282055, 'bear_rsi_os': 44, 'bear_rsi_ob': 83, 'bear_adx_thresh': 5.702030698911543, 'bear_atr_min_pct': 0.015152807764450478, 'bear_atr_max_pct': 0.0569031861315373, 'bear_tp_mult': 1.7521243130072788, 'bear_tsl_mult': 0.11520521346366694, 'bear_time_stop': 36, 'bear_use_sma': True, 'bear_use_ema': False, 'bear_use_atr': True, 'bear_use_adx': True, 'bear_use_spike': False, 'bear_rsi_required': False, 'sideways_strategy': 'breakout', 'sideways_bb_std_mult': 2.0440023177922146, 'sideways_rsi_os': 16, 'sideways_rsi_ob': 58, 'sideways_adx_thresh': 9.586552576680864, 'sideways_atr_min_pct': 0.019340180343072284, 'sideways_atr_max_pct': 0.11933916268684108, 'sideways_tp_mult': 1.7973619124392373, 'sideways_tsl_mult': 0.6755913474436708, 'sideways_time_stop': 274, 'sideways_use_sma': True, 'sideways_use_ema': True, 'sideways_use_atr': False, 'sideways_use_adx': False, 'sideways_use_spike': False, 'sideways_rsi_required': False}.
[I 2025-08-30 18:42:41,373] Trial 55 finished with values: [-1000000000.0, 1000000000.0] and parameters: {'p_sma': 42, 'p_std': 32, 'p_atr': 11, 'p_adx': 11, 'rsi_period': 51, 'ema1': 26, 'ema2': 15, 'slip_atr_k': 0.017425952461967473, 'slip_spread_k': 0.42001604290194494, 'spread_hl_frac': 0.0034594171683734213, 'bb_std_mult': 0.6808590052972969, 'rsi_os': 32, 'rsi_ob': 57, 'vol_spike': 0.07172150607245609, 'adx_thresh': 11.394102017259522, 'atr_min_pct': 0.0232544730706296, 'atr_max_pct': 0.1491947445585927, 'tp_mult': 2.089736828335308, 'tsl_mult': 0.6885218658546387, 'strategy': 'breakout', 'time_stop': 20, 'use_sma': False, 'use_atr': True, 'use_adx': False, 'use_ema': False, 'use_spike': True, 'rsi_required': True, 'edge_k': 0.11128617594396174, 'edge_cap': 0.22071961584309605, 'bull_strategy': 'mean_reversion', 'bull_bb_std_mult': 1.688801929420613, 'bull_rsi_os': 50, 'bull_rsi_ob': 67, 'bull_adx_thresh': 8.590676941462354, 'bull_atr_min_pct': 0.024757329132616687, 'bull_atr_max_pct': 0.025680344224653283, 'bull_tp_mult': 2.3570580788479383, 'bull_tsl_mult': 0.9953132078155724, 'bull_time_stop': 199, 'bull_use_sma': True, 'bull_use_ema': False, 'bull_use_atr': False, 'bull_use_adx': True, 'bull_use_spike': True, 'bull_rsi_required': True, 'bear_strategy': 'breakout', 'bear_bb_std_mult': 3.117370242692375, 'bear_rsi_os': 35, 'bear_rsi_ob': 86, 'bear_adx_thresh': 6.609676889301838, 'bear_atr_min_pct': 0.013978673931753576, 'bear_atr_max_pct': 0.05840304332574404, 'bear_tp_mult': 1.928183596227247, 'bear_tsl_mult': 0.0063459714821780255, 'bear_time_stop': 60, 'bear_use_sma': True, 'bear_use_ema': False, 'bear_use_atr': True, 'bear_use_adx': True, 'bear_use_spike': False, 'bear_rsi_required': False, 'sideways_strategy': 'breakout', 'sideways_bb_std_mult': 2.290484465756889, 'sideways_rsi_os': 13, 'sideways_rsi_ob': 58, 'sideways_adx_thresh': 15.074903805663267, 'sideways_atr_min_pct': 0.021541926646968287, 'sideways_atr_max_pct': 0.10207498658336685, 'sideways_tp_mult': 1.8059504538539448, 'sideways_tsl_mult': 0.7440771572687812, 'sideways_time_stop': 274, 'sideways_use_sma': True, 'sideways_use_ema': True, 'sideways_use_atr': False, 'sideways_use_adx': False, 'sideways_use_spike': False, 'sideways_rsi_required': False}.
[I 2025-08-30 18:42:41,509] Trial 54 finished with values: [-0.029434496966337043, 0.029329734339922513] and parameters: {'p_sma': 28, 'p_std': 17, 'p_atr': 8, 'p_adx': 11, 'rsi_period': 51, 'ema1': 15, 'ema2': 59, 'slip_atr_k': 0.18104538098215917, 'slip_spread_k': 0.44035702619152, 'spread_hl_frac': 0.003745545308250945, 'bb_std_mult': 1.1802332009149425, 'rsi_os': 38, 'rsi_ob': 82, 'vol_spike': 0.0013701500058741767, 'adx_thresh': 23.404119609072737, 'atr_min_pct': 0.02404585582829188, 'atr_max_pct': 0.13056620811125358, 'tp_mult': 2.459098385341096, 'tsl_mult': 0.9859243449130957, 'strategy': 'breakout', 'time_stop': 144, 'use_sma': False, 'use_atr': True, 'use_adx': False, 'use_ema': False, 'use_spike': True, 'rsi_required': True, 'edge_k': 0.10564038935134543, 'edge_cap': 0.1723129081792404, 'bull_strategy': 'mean_reversion', 'bull_bb_std_mult': 1.7129464799788545, 'bull_rsi_os': 34, 'bull_rsi_ob': 45, 'bull_adx_thresh': 18.806738347658538, 'bull_atr_min_pct': 0.0016889785748085018, 'bull_atr_max_pct': 0.057429419058161534, 'bull_tp_mult': 1.2276514870249702, 'bull_tsl_mult': 0.3232374277672848, 'bull_time_stop': 241, 'bull_use_sma': True, 'bull_use_ema': False, 'bull_use_atr': True, 'bull_use_adx': False, 'bull_use_spike': True, 'bull_rsi_required': True, 'bear_strategy': 'breakout', 'bear_bb_std_mult': 1.4363509928085172, 'bear_rsi_os': 52, 'bear_rsi_ob': 95, 'bear_adx_thresh': 5.173219438694511, 'bear_atr_min_pct': 0.014114122544498849, 'bear_atr_max_pct': 0.13614758436069677, 'bear_tp_mult': 1.9426556448365278, 'bear_tsl_mult': 0.3997636974750666, 'bear_time_stop': 66, 'bear_use_sma': True, 'bear_use_ema': False, 'bear_use_atr': True, 'bear_use_adx': True, 'bear_use_spike': False, 'bear_rsi_required': False, 'sideways_strategy': 'mean_reversion', 'sideways_bb_std_mult': 2.2657549842714984, 'sideways_rsi_os': 14, 'sideways_rsi_ob': 63, 'sideways_adx_thresh': 12.20878689874197, 'sideways_atr_min_pct': 0.021366278321244034, 'sideways_atr_max_pct': 0.12190854914836698, 'sideways_tp_mult': 2.418981695195277, 'sideways_tsl_mult': 0.5477231711512183, 'sideways_time_stop': 216, 'sideways_use_sma': True, 'sideways_use_ema': True, 'sideways_use_atr': False, 'sideways_use_adx': False, 'sideways_use_spike': False, 'sideways_rsi_required': False}.
