[I 2025-08-30 18:43:15,855] Trial 65 finished with values: [-1000000000.0, 1000000000.0] and parameters: {'p_sma': 35, 'p_std': 32, 'p_atr': 30, 'p_adx': 19, 'rsi_period': 12, 'ema1': 28, 'ema2': 44, 'slip_atr_k': 0.019767897029274388, 'slip_spread_k': 0.419829333934403, 'spread_hl_frac': 0.0018013592571395, 'bb_std_mult': 2.0883493602004664, 'rsi_os': 27, 'rsi_ob': 89, 'vol_spike': 0.20115070759981804, 'adx_thresh': 18.86371644843572, 'atr_min_pct': 0.02614362917792663, 'atr_max_pct': 0.025531890030389158, 'tp_mult': 1.9275936741026236, 'tsl_mult': 0.9522001125643229, 'strategy': 'breakout', 'time_stop': 27, 'use_sma': False, 'use_atr': True, 'use_adx': False, 'use_ema': False, 'use_spike': True, 'rsi_required': True, 'edge_k': 1.9646297805042847, 'edge_cap': 0.894055178567278, 'bull_strategy': 'mean_reversion', 'bull_bb_std_mult': 0.6809932430228829, 'bull_rsi_os': 39, 'bull_rsi_ob': 76, 'bull_adx_thresh': 25.093134272691504, 'bull_atr_min_pct': 0.0036634994306862408, 'bull_atr_max_pct': 0.05154781473549161, 'bull_tp_mult': 2.2275770845853824, 'bull_tsl_mult': 0.8336851898935427, 'bull_time_stop': 225, 'bull_use_sma': True, 'bull_use_ema': False, 'bull_use_atr': False, 'bull_use_adx': True, 'bull_use_spike': True, 'bull_rsi_required': True, 'bear_strategy': 'breakout', 'bear_bb_std_mult': 3.557298247877946, 'bear_rsi_os': 34, 'bear_rsi_ob': 91, 'bear_adx_thresh': 12.4147588953108, 'bear_atr_min_pct': 0.012217574677800396, 'bear_atr_max_pct': 0.056292349536728396, 'bear_tp_mult': 2.7726749900279417, 'bear_tsl_mult': 0.24640580727635153, 'bear_time_stop': 19, 'bear_use_sma': False, 'bear_use_ema': True, 'bear_use_atr': True, 'bear_use_adx': True, 'bear_use_spike': False, 'bear_rsi_required': True, 'sideways_strategy': 'breakout', 'sideways_bb_std_mult': 1.7262620925588281, 'sideways_rsi_os': 10, 'sideways_rsi_ob': 59, 'sideways_adx_thresh': 6.270448430701125, 'sideways_atr_min_pct': 0.015908953609467622, 'sideways_atr_max_pct': 0.04590770959625392, 'sideways_tp_mult': 2.188577273586498, 'sideways_tsl_mult': 0.595372450678779, 'sideways_time_stop': 258, 'sideways_use_sma': False, 'sideways_use_ema': True, 'sideways_use_atr': False, 'sideways_use_adx': False, 'sideways_use_spike': False, 'sideways_rsi_required': False}.
[I 2025-08-30 18:43:46,594] Trial 60 finished with values: [-1000000000.0, 1000000000.0] and parameters: {'p_sma': 36, 'p_std': 27, 'p_atr': 13, 'p_adx': 7, 'rsi_period': 60, 'ema1': 28, 'ema2': 16, 'slip_atr_k': 0.03937936202840456, 'slip_spread_k': 0.3390849565028775, 'spread_hl_frac': 0.005966856694121822, 'bb_std_mult': 3.214192650436349, 'rsi_os': 28, 'rsi_ob': 47, 'vol_spike': 0.1301491440619181, 'adx_thresh': 14.90847812819767, 'atr_min_pct': 0.01910170153539693, 'atr_max_pct': 0.05525852121766192, 'tp_mult': 2.0708343014810717, 'tsl_mult': 0.7805610264765948, 'strategy': 'breakout', 'time_stop': 9, 'use_sma': False, 'use_atr': True, 'use_adx': False, 'use_ema': False, 'use_spike': True, 'rsi_required': True, 'edge_k': 0.27066046481412254, 'edge_cap': 0.26000374881442095, 'bull_strategy': 'breakout', 'bull_bb_std_mult': 2.571177409502977, 'bull_rsi_os': 52, 'bull_rsi_ob': 72, 'bull_adx_thresh': 24.054531738250116, 'bull_atr_min_pct': 0.004032211467807297, 'bull_atr_max_pct': 0.019631068444103145, 'bull_tp_mult': 2.047716590300897, 'bull_tsl_mult': 0.9459002741539285, 'bull_time_stop': 227, 'bull_use_sma': True, 'bull_use_ema': True, 'bull_use_atr': False, 'bull_use_adx': True, 'bull_use_spike': True, 'bull_rsi_required': False, 'bear_strategy': 'breakout', 'bear_bb_std_mult': 2.9982024099174542, 'bear_rsi_os': 43, 'bear_rsi_ob': 84, 'bear_adx_thresh': 9.353138646977573, 'bear_atr_min_pct': 0.010279903637778653, 'bear_atr_max_pct': 0.055772339205704846, 'bear_tp_mult': 1.5936609625717642, 'bear_tsl_mult': 0.1548315117902827, 'bear_time_stop': 144, 'bear_use_sma': False, 'bear_use_ema': False, 'bear_use_atr': True, 'bear_use_adx': True, 'bear_use_spike': False, 'bear_rsi_required': False, 'sideways_strategy': 'breakout', 'sideways_bb_std_mult': 1.9082582745828678, 'sideways_rsi_os': 11, 'sideways_rsi_ob': 60, 'sideways_adx_thresh': 12.507298482844044, 'sideways_atr_min_pct': 0.01567367373596168, 'sideways_atr_max_pct': 0.03812749788340634, 'sideways_tp_mult': 2.1645399267286676, 'sideways_tsl_mult': 0.7267553730856713, 'sideways_time_stop': 93, 'sideways_use_sma': True, 'sideways_use_ema': True, 'sideways_use_atr': False, 'sideways_use_adx': False, 'sideways_use_spike': True, 'sideways_rsi_required': False}.
[I 2025-08-30 18:43:48,189] Trial 64 finished with values: [-1000000000.0, 1000000000.0] and parameters: {'p_sma': 13, 'p_std': 32, 'p_atr': 11, 'p_adx': 29, 'rsi_period': 59, 'ema1': 27, 'ema2': 55, 'slip_atr_k': 0.00015194894585128516, 'slip_spread_k': 0.3525409852950844, 'spread_hl_frac': 0.0026456095179525877, 'bb_std_mult': 1.0244110769514152, 'rsi_os': 55, 'rsi_ob': 56, 'vol_spike': 0.14916945480794475, 'adx_thresh': 8.140704113438407, 'atr_min_pct': 0.026125669714196775, 'atr_max_pct': 0.11992046099095936, 'tp_mult': 1.9520531113501791, 'tsl_mult': 0.6570924349986621, 'strategy': 'breakout', 'time_stop': 25, 'use_sma': False, 'use_atr': True, 'use_adx': False, 'use_ema': False, 'use_spike': True, 'rsi_required': True, 'edge_k': 0.24979080059951808, 'edge_cap': 0.05228937100556302, 'bull_strategy': 'mean_reversion', 'bull_bb_std_mult': 0.7546701678718408, 'bull_rsi_os': 46, 'bull_rsi_ob': 58, 'bull_adx_thresh': 26.95475243055412, 'bull_atr_min_pct': 0.004113326015921567, 'bull_atr_max_pct': 0.0165048540281403, 'bull_tp_mult': 2.9962733007346607, 'bull_tsl_mult': 0.04661148742817017, 'bull_time_stop': 226, 'bull_use_sma': True, 'bull_use_ema': False, 'bull_use_atr': False, 'bull_use_adx': True, 'bull_use_spike': True, 'bull_rsi_required': True, 'bear_strategy': 'breakout', 'bear_bb_std_mult': 3.557451042681678, 'bear_rsi_os': 43, 'bear_rsi_ob': 91, 'bear_adx_thresh': 13.069363311575838, 'bear_atr_min_pct': 0.011999618479604497, 'bear_atr_max_pct': 0.05457141028742439, 'bear_tp_mult': 1.4231603551310044, 'bear_tsl_mult': 0.2430576685546621, 'bear_time_stop': 148, 'bear_use_sma': False, 'bear_use_ema': False, 'bear_use_atr': False, 'bear_use_adx': False, 'bear_use_spike': False, 'bear_rsi_required': False, 'sideways_strategy': 'breakout', 'sideways_bb_std_mult': 1.9192889312320562, 'sideways_rsi_os': 16, 'sideways_rsi_ob': 60, 'sideways_adx_thresh': 9.151829304447844, 'sideways_atr_min_pct': 0.015671024916478208, 'sideways_atr_max_pct': 0.12633392100583127, 'sideways_tp_mult': 1.8861128841318964, 'sideways_tsl_mult': 0.7204169705446974, 'sideways_time_stop': 88, 'sideways_use_sma': True, 'sideways_use_ema': True, 'sideways_use_atr': False, 'sideways_use_adx': False, 'sideways_use_spike': False, 'sideways_rsi_required': False}.
[I 2025-08-30 18:43:48,208] Trial 66 finished with values: [-1000000000.0, 1000000000.0] and parameters: {'p_sma': 43, 'p_std': 32, 'p_atr': 11, 'p_adx': 28, 'rsi_period': 54, 'ema1': 22, 'ema2': 22, 'slip_atr_k': 0.02668008982570392, 'slip_spread_k': 0.39742291242537575, 'spread_hl_frac': 0.0017905550244676468, 'bb_std_mult': 1.4070840368998019, 'rsi_os': 43, 'rsi_ob': 57, 'vol_spike': 0.20372399158636328, 'adx_thresh': 20.48800853817665, 'atr_min_pct': 0.01314856029313534, 'atr_max_pct': 0.08255787942287915, 'tp_mult': 1.9367130364528322, 'tsl_mult': 0.6880848608356132, 'strategy': 'breakout', 'time_stop': 28, 'use_sma': False, 'use_atr': True, 'use_adx': False, 'use_ema': False, 'use_spike': True, 'rsi_required': True, 'edge_k': 0.006834705720239823, 'edge_cap': 0.850952455695563, 'bull_strategy': 'mean_reversion', 'bull_bb_std_mult': 2.0627076032303235, 'bull_rsi_os': 39, 'bull_rsi_ob': 59, 'bull_adx_thresh': 25.24562623477601, 'bull_atr_min_pct': 0.003930682116027191, 'bull_atr_max_pct': 0.04945452971528182, 'bull_tp_mult': 2.83388629647874, 'bull_tsl_mult': 0.8321449040718314, 'bull_time_stop': 212, 'bull_use_sma': True, 'bull_use_ema': False, 'bull_use_atr': False, 'bull_use_adx': True, 'bull_use_spike': True, 'bull_rsi_required': True, 'bear_strategy': 'breakout', 'bear_bb_std_mult': 3.526122945800971, 'bear_rsi_os': 35, 'bear_rsi_ob': 92, 'bear_adx_thresh': 12.483517629791875, 'bear_atr_min_pct': 0.016630481423583737, 'bear_atr_max_pct': 0.051945193488662326, 'bear_tp_mult': 1.789098874471865, 'bear_tsl_mult': 0.24478830501328983, 'bear_time_stop': 22, 'bear_use_sma': False, 'bear_use_ema': True, 'bear_use_atr': True, 'bear_use_adx': True, 'bear_use_spike': False, 'bear_rsi_required': True, 'sideways_strategy': 'breakout', 'sideways_bb_std_mult': 2.070020185155889, 'sideways_rsi_os': 11, 'sideways_rsi_ob': 58, 'sideways_adx_thresh': 6.258681751212679, 'sideways_atr_min_pct': 0.015742126945584523, 'sideways_atr_max_pct': 0.1122168888143495, 'sideways_tp_mult': 2.142375925479406, 'sideways_tsl_mult': 0.5933021415002817, 'sideways_time_stop': 299, 'sideways_use_sma': False, 'sideways_use_ema': True, 'sideways_use_atr': False, 'sideways_use_adx': False, 'sideways_use_spike': False, 'sideways_rsi_required': False}.
[I 2025-08-30 18:43:48,721] Trial 67 finished with values: [-1000000000.0, 1000000000.0] and parameters: {'p_sma': 43, 'p_std': 20, 'p_atr': 11, 'p_adx': 25, 'rsi_period': 44, 'ema1': 22, 'ema2': 54, 'slip_atr_k': 0.023781905416296677, 'slip_spread_k': 0.34924340551765287, 'spread_hl_frac': 0.011596530653237238, 'bb_std_mult': 1.3615751632274586, 'rsi_os': 37, 'rsi_ob': 93, 'vol_spike': 0.06085470078741652, 'adx_thresh': 20.91976940334744, 'atr_min_pct': 0.008827608580533561, 'atr_max_pct': 0.08079444949310605, 'tp_mult': 1.7394635879871228, 'tsl_mult': 0.6599840805992628, 'strategy': 'breakout', 'time_stop': 78, 'use_sma': False, 'use_atr': True, 'use_adx': False, 'use_ema': True, 'use_spike': True, 'rsi_required': True, 'edge_k': 0.7637687824959337, 'edge_cap': 0.11275236790164156, 'bull_strategy': 'mean_reversion', 'bull_bb_std_mult': 2.048951021301455, 'bull_rsi_os': 26, 'bull_rsi_ob': 59, 'bull_adx_thresh': 27.068289984744425, 'bull_atr_min_pct': 0.00453310854245834, 'bull_atr_max_pct': 0.04661959011103386, 'bull_tp_mult': 2.822368883378073, 'bull_tsl_mult': 0.09628614049189493, 'bull_time_stop': 165, 'bull_use_sma': True, 'bull_use_ema': False, 'bull_use_atr': False, 'bull_use_adx': True, 'bull_use_spike': True, 'bull_rsi_required': True, 'bear_strategy': 'breakout', 'bear_bb_std_mult': 3.4518785095371673, 'bear_rsi_os': 19, 'bear_rsi_ob': 93, 'bear_adx_thresh': 6.945558867311093, 'bear_atr_min_pct': 0.016692265237183552, 'bear_atr_max_pct': 0.04161611104071578, 'bear_tp_mult': 1.8376819692232473, 'bear_tsl_mult': 0.06664417916831775, 'bear_time_stop': 139, 'bear_use_sma': False, 'bear_use_ema': False, 'bear_use_atr': False, 'bear_use_adx': False, 'bear_use_spike': True, 'bear_rsi_required': False, 'sideways_strategy': 'breakout', 'sideways_bb_std_mult': 3.0065185123567724, 'sideways_rsi_os': 12, 'sideways_rsi_ob': 56, 'sideways_adx_thresh': 14.927338224402561, 'sideways_atr_min_pct': 0.02044851645004652, 'sideways_atr_max_pct': 0.12485975999198506, 'sideways_tp_mult': 1.5920633386666279, 'sideways_tsl_mult': 0.7862280634001986, 'sideways_time_stop': 299, 'sideways_use_sma': True, 'sideways_use_ema': True, 'sideways_use_atr': False, 'sideways_use_adx': False, 'sideways_use_spike': False, 'sideways_rsi_required': False}.
[I 2025-08-30 18:44:19,363] Trial 68 finished with values: [-1000000000.0, 1000000000.0] and parameters: {'p_sma': 14, 'p_std': 20, 'p_atr': 11, 'p_adx': 10, 'rsi_period': 54, 'ema1': 22, 'ema2': 21, 'slip_atr_k': 0.0008811567523179763, 'slip_spread_k': 0.25146193413600815, 'spread_hl_frac': 0.011661846431096915, 'bb_std_mult': 1.0409732053242498, 'rsi_os': 37, 'rsi_ob': 57, 'vol_spike': 0.06375318245087122, 'adx_thresh': 17.205494652992748, 'atr_min_pct': 0.016838869272651706, 'atr_max_pct': 0.12774982405223592, 'tp_mult': 2.866996453668689, 'tsl_mult': 0.8455983582816623, 'strategy': 'breakout', 'time_stop': 71, 'use_sma': False, 'use_atr': True, 'use_adx': False, 'use_ema': True, 'use_spike': True, 'rsi_required': False, 'edge_k': 0.7880326766547034, 'edge_cap': 0.11942923895780827, 'bull_strategy': 'mean_reversion', 'bull_bb_std_mult': 3.2750100460473295, 'bull_rsi_os': 47, 'bull_rsi_ob': 56, 'bull_adx_thresh': 26.786876457327836, 'bull_atr_min_pct': 0.02802929453359606, 'bull_atr_max_pct': 0.031433960787750674, 'bull_tp_mult': 2.9524068660439085, 'bull_tsl_mult': 0.03677557326812092, 'bull_time_stop': 277, 'bull_use_sma': True, 'bull_use_ema': False, 'bull_use_atr': False, 'bull_use_adx': True, 'bull_use_spike': True, 'bull_rsi_required': True, 'bear_strategy': 'breakout', 'bear_bb_std_mult': 3.41450427423872, 'bear_rsi_os': 29, 'bear_rsi_ob': 87, 'bear_adx_thresh': 6.99181494680392, 'bear_atr_min_pct': 0.014374163168169748, 'bear_atr_max_pct': 0.041110281825954255, 'bear_tp_mult': 1.8480212770191664, 'bear_tsl_mult': 0.07043706789574758, 'bear_time_stop': 44, 'bear_use_sma': False, 'bear_use_ema': False, 'bear_use_atr': False, 'bear_use_adx': False, 'bear_use_spike': True, 'bear_rsi_required': False, 'sideways_strategy': 'breakout', 'sideways_bb_std_mult': 2.0600075108171194, 'sideways_rsi_os': 45, 'sideways_rsi_ob': 57, 'sideways_adx_thresh': 9.222237412477641, 'sideways_atr_min_pct': 0.017482592214953827, 'sideways_atr_max_pct': 0.1283908165731945, 'sideways_tp_mult': 1.7573357963348968, 'sideways_tsl_mult': 0.7893285799666128, 'sideways_time_stop': 300, 'sideways_use_sma': True, 'sideways_use_ema': False, 'sideways_use_atr': False, 'sideways_use_adx': False, 'sideways_use_spike': False, 'sideways_rsi_required': False}.
[I 2025-08-30 18:44:19,639] Trial 69 finished with values: [-1000000000.0, 1000000000.0] and parameters: {'p_sma': 60, 'p_std': 22, 'p_atr': 7, 'p_adx': 25, 'rsi_period': 54, 'ema1': 22, 'ema2': 22, 'slip_atr_k': 0.023935954427990326, 'slip_spread_k': 0.2692999618673392, 'spread_hl_frac': 0.00856672210012087, 'bb_std_mult': 0.6258424467998482, 'rsi_os': 43, 'rsi_ob': 61, 'vol_spike': 0.06158970394222231, 'adx_thresh': 17.151036224440276, 'atr_min_pct': 0.012797480384802145, 'atr_max_pct': 0.12794973230958737, 'tp_mult': 2.859579661486264, 'tsl_mult': 0.8542330487524212, 'strategy': 'breakout', 'time_stop': 73, 'use_sma': False, 'use_atr': False, 'use_adx': True, 'use_ema': True, 'use_spike': True, 'rsi_required': False, 'edge_k': 0.8235592564581032, 'edge_cap': 0.12487004247618122, 'bull_strategy': 'mean_reversion', 'bull_bb_std_mult': 1.398251228186595, 'bull_rsi_os': 39, 'bull_rsi_ob': 67, 'bull_adx_thresh': 25.252881227627483, 'bull_atr_min_pct': 0.00717764733755975, 'bull_atr_max_pct': 0.04742759558784161, 'bull_tp_mult': 2.331908315852763, 'bull_tsl_mult': 0.8325925141091153, 'bull_time_stop': 210, 'bull_use_sma': True, 'bull_use_ema': False, 'bull_use_atr': False, 'bull_use_adx': True, 'bull_use_spike': False, 'bull_rsi_required': True, 'bear_strategy': 'breakout', 'bear_bb_std_mult': 3.4372416786799787, 'bear_rsi_os': 30, 'bear_rsi_ob': 72, 'bear_adx_thresh': 7.055278766582418, 'bear_atr_min_pct': 0.016516701015764527, 'bear_atr_max_pct': 0.02181107597316556, 'bear_tp_mult': 1.7928621164433045, 'bear_tsl_mult': 0.06997034022870705, 'bear_time_stop': 40, 'bear_use_sma': True, 'bear_use_ema': False, 'bear_use_atr': True, 'bear_use_adx': True, 'bear_use_spike': True, 'bear_rsi_required': True, 'sideways_strategy': 'breakout', 'sideways_bb_std_mult': 2.06569802315974, 'sideways_rsi_os': 46, 'sideways_rsi_ob': 56, 'sideways_adx_thresh': 31.747477329200983, 'sideways_atr_min_pct': 0.02057470846340524, 'sideways_atr_max_pct': 0.1135126464373198, 'sideways_tp_mult': 1.0311192208086108, 'sideways_tsl_mult': 0.8035593024094205, 'sideways_time_stop': 71, 'sideways_use_sma': True, 'sideways_use_ema': False, 'sideways_use_atr': True, 'sideways_use_adx': False, 'sideways_use_spike': False, 'sideways_rsi_required': False}.
[I 2025-08-30 18:44:19,755] Trial 71 finished with values: [-1000000000.0, 1000000000.0] and parameters: {'p_sma': 60, 'p_std': 24, 'p_atr': 7, 'p_adx': 18, 'rsi_period': 23, 'ema1': 24, 'ema2': 18, 'slip_atr_k': 0.14807511678054222, 'slip_spread_k': 0.4788157829443537, 'spread_hl_frac': 0.0003572571591252088, 'bb_std_mult': 0.7621898562848347, 'rsi_os': 46, 'rsi_ob': 45, 'vol_spike': 0.2625578766018583, 'adx_thresh': 16.781675179701388, 'atr_min_pct': 0.02974223722473626, 'atr_max_pct': 0.12966992689195225, 'tp_mult': 1.8493515462332426, 'tsl_mult': 0.4384372954667677, 'strategy': 'breakout', 'time_stop': 56, 'use_sma': False, 'use_atr': False, 'use_adx': True, 'use_ema': True, 'use_spike': True, 'rsi_required': False, 'edge_k': 1.755824609244618, 'edge_cap': 0.6891521789763866, 'bull_strategy': 'mean_reversion', 'bull_bb_std_mult': 1.4322918742393438, 'bull_rsi_os': 55, 'bull_rsi_ob': 71, 'bull_adx_thresh': 29.005959469821008, 'bull_atr_min_pct': 0.007019215677363701, 'bull_atr_max_pct': 0.03270964515043277, 'bull_tp_mult': 1.5853210411056053, 'bull_tsl_mult': 0.20300686539907153, 'bull_time_stop': 270, 'bull_use_sma': True, 'bull_use_ema': False, 'bull_use_atr': False, 'bull_use_adx': True, 'bull_use_spike': False, 'bull_rsi_required': True, 'bear_strategy': 'breakout', 'bear_bb_std_mult': 2.70292771778346, 'bear_rsi_os': 29, 'bear_rsi_ob': 45, 'bear_adx_thresh': 10.996210145869213, 'bear_atr_min_pct': 0.0049266226289267825, 'bear_atr_max_pct': 0.01840912243872666, 'bear_tp_mult': 1.4383884854121922, 'bear_tsl_mult': 0.11612351701696366, 'bear_time_stop': 44, 'bear_use_sma': True, 'bear_use_ema': False, 'bear_use_atr': True, 'bear_use_adx': True, 'bear_use_spike': True, 'bear_rsi_required': False, 'sideways_strategy': 'breakout', 'sideways_bb_std_mult': 0.5986243981545161, 'sideways_rsi_os': 8, 'sideways_rsi_ob': 67, 'sideways_adx_thresh': 32.02501984927967, 'sideways_atr_min_pct': 0.01733033875403029, 'sideways_atr_max_pct': 0.10552493325882015, 'sideways_tp_mult': 1.7459848321323657, 'sideways_tsl_mult': 0.889446991398027, 'sideways_time_stop': 115, 'sideways_use_sma': True, 'sideways_use_ema': False, 'sideways_use_atr': True, 'sideways_use_adx': False, 'sideways_use_spike': False, 'sideways_rsi_required': False}.
[I 2025-08-30 18:44:19,896] Trial 70 finished with values: [-1000000000.0, 1000000000.0] and parameters: {'p_sma': 41, 'p_std': 21, 'p_atr': 7, 'p_adx': 24, 'rsi_period': 49, 'ema1': 22, 'ema2': 18, 'slip_atr_k': 0.009263550411004974, 'slip_spread_k': 0.547274190783807, 'spread_hl_frac': 0.011584030617500678, 'bb_std_mult': 0.7617901356809801, 'rsi_os': 37, 'rsi_ob': 61, 'vol_spike': 0.06329534986070182, 'adx_thresh': 17.01497653736006, 'atr_min_pct': 0.01634885470347413, 'atr_max_pct': 0.10631955169310407, 'tp_mult': 1.7432216870837443, 'tsl_mult': 0.4191530209226319, 'strategy': 'breakout', 'time_stop': 75, 'use_sma': False, 'use_atr': False, 'use_adx': True, 'use_ema': True, 'use_spike': True, 'rsi_required': False, 'edge_k': 1.5086453309966925, 'edge_cap': 0.20317852746109372, 'bull_strategy': 'mean_reversion', 'bull_bb_std_mult': 3.2782142455156444, 'bull_rsi_os': 54, 'bull_rsi_ob': 71, 'bull_adx_thresh': 27.464303007445537, 'bull_atr_min_pct': 0.027645469427104087, 'bull_atr_max_pct': 0.033150136988488614, 'bull_tp_mult': 1.5553270804410926, 'bull_tsl_mult': 0.8799606324204836, 'bull_time_stop': 163, 'bull_use_sma': True, 'bull_use_ema': False, 'bull_use_atr': False, 'bull_use_adx': True, 'bull_use_spike': False, 'bull_rsi_required': True, 'bear_strategy': 'breakout', 'bear_bb_std_mult': 3.404436432495164, 'bear_rsi_os': 30, 'bear_rsi_ob': 87, 'bear_adx_thresh': 6.952511845849382, 'bear_atr_min_pct': 0.008648058873034123, 'bear_atr_max_pct': 0.019842449649963928, 'bear_tp_mult': 1.8413855539423067, 'bear_tsl_mult': 0.06211138071049238, 'bear_time_stop': 5, 'bear_use_sma': True, 'bear_use_ema': False, 'bear_use_atr': False, 'bear_use_adx': False, 'bear_use_spike': True, 'bear_rsi_required': False, 'sideways_strategy': 'breakout', 'sideways_bb_std_mult': 0.680479874603765, 'sideways_rsi_os': 45, 'sideways_rsi_ob': 56, 'sideways_adx_thresh': 32.359254522267655, 'sideways_atr_min_pct': 0.017603334790108296, 'sideways_atr_max_pct': 0.1432607585619681, 'sideways_tp_mult': 1.106792242495616, 'sideways_tsl_mult': 0.7911173496361208, 'sideways_time_stop': 288, 'sideways_use_sma': True, 'sideways_use_ema': False, 'sideways_use_atr': True, 'sideways_use_adx': False, 'sideways_use_spike': False, 'sideways_rsi_required': False}.
