[I 2025-08-30 19:52:56,143] Trial 583 finished with values: [-1000000000.0, 1000000000.0] and parameters: {'p_sma': 32, 'p_std': 54, 'p_atr': 9, 'p_adx': 8, 'rsi_period': 48, 'ema1': 29, 'ema2': 17, 'slip_atr_k': 0.08042271329041942, 'slip_spread_k': 0.43379843834980164, 'spread_hl_frac': 0.0021063584669182333, 'bb_std_mult': 1.1505734357350579, 'rsi_os': 54, 'rsi_ob': 60, 'vol_spike': 0.005990457738375421, 'adx_thresh': 7.167112855618756, 'atr_min_pct': 0.024618887663531527, 'atr_max_pct': 0.13493669458511087, 'tp_mult': 2.206371897183568, 'tsl_mult': 0.8109972440445319, 'strategy': 'breakout', 'time_stop': 168, 'use_sma': False, 'use_atr': True, 'use_adx': False, 'use_ema': False, 'use_spike': True, 'rsi_required': True, 'edge_k': 0.08569132145289289, 'edge_cap': 0.6693545555589431, 'bull_strategy': 'mean_reversion', 'bull_bb_std_mult': 1.7891220408369422, 'bull_rsi_os': 49, 'bull_rsi_ob': 76, 'bull_adx_thresh': 23.921023966408935, 'bull_atr_min_pct': 0.0019104743925349925, 'bull_atr_max_pct': 0.11423381255185452, 'bull_tp_mult': 2.108515949627062, 'bull_tsl_mult': 0.9565285606073763, 'bull_time_stop': 200, 'bull_use_sma': True, 'bull_use_ema': False, 'bull_use_atr': False, 'bull_use_adx': True, 'bull_use_spike': True, 'bull_rsi_required': True, 'bear_strategy': 'breakout', 'bear_bb_std_mult': 0.5478749539422285, 'bear_rsi_os': 44, 'bear_rsi_ob': 93, 'bear_adx_thresh': 5.004674529393299, 'bear_atr_min_pct': 0.021242413121826564, 'bear_atr_max_pct': 0.06842754900702727, 'bear_tp_mult': 1.1819225406315248, 'bear_tsl_mult': 0.1440619820893315, 'bear_time_stop': 58, 'bear_use_sma': True, 'bear_use_ema': False, 'bear_use_atr': True, 'bear_use_adx': True, 'bear_use_spike': False, 'bear_rsi_required': False, 'sideways_strategy': 'breakout', 'sideways_bb_std_mult': 2.4682854222156694, 'sideways_rsi_os': 37, 'sideways_rsi_ob': 52, 'sideways_adx_thresh': 18.193411765036494, 'sideways_atr_min_pct': 0.018501374717067844, 'sideways_atr_max_pct': 0.07549409837714312, 'sideways_tp_mult': 1.7766574926581742, 'sideways_tsl_mult': 0.1368285952013208, 'sideways_time_stop': 273, 'sideways_use_sma': True, 'sideways_use_ema': True, 'sideways_use_atr': False, 'sideways_use_adx': False, 'sideways_use_spike': False, 'sideways_rsi_required': False}.
[I 2025-08-30 19:52:56,155] Trial 582 finished with values: [-1000000000.0, 1000000000.0] and parameters: {'p_sma': 32, 'p_std': 39, 'p_atr': 9, 'p_adx': 7, 'rsi_period': 55, 'ema1': 29, 'ema2': 12, 'slip_atr_k': 0.0764658726141786, 'slip_spread_k': 0.44425603088989696, 'spread_hl_frac': 0.0023167464527447325, 'bb_std_mult': 2.400585568331224, 'rsi_os': 28, 'rsi_ob': 60, 'vol_spike': 0.005100128940778437, 'adx_thresh': 20.794880420275575, 'atr_min_pct': 0.024778188239770828, 'atr_max_pct': 0.03108784885278574, 'tp_mult': 2.2152674095987166, 'tsl_mult': 0.9831084935150847, 'strategy': 'breakout', 'time_stop': 190, 'use_sma': False, 'use_atr': True, 'use_adx': False, 'use_ema': True, 'use_spike': False, 'rsi_required': True, 'edge_k': 0.7684010707366951, 'edge_cap': 0.21350331348875284, 'bull_strategy': 'mean_reversion', 'bull_bb_std_mult': 1.9838593983461155, 'bull_rsi_os': 51, 'bull_rsi_ob': 94, 'bull_adx_thresh': 23.887537167013324, 'bull_atr_min_pct': 0.008529871359188692, 'bull_atr_max_pct': 0.12181769614908994, 'bull_tp_mult': 1.4384643535488513, 'bull_tsl_mult': 0.9636447160639661, 'bull_time_stop': 200, 'bull_use_sma': False, 'bull_use_ema': False, 'bull_use_atr': False, 'bull_use_adx': True, 'bull_use_spike': True, 'bull_rsi_required': False, 'bear_strategy': 'breakout', 'bear_bb_std_mult': 1.6191249167891415, 'bear_rsi_os': 44, 'bear_rsi_ob': 82, 'bear_adx_thresh': 5.967946027409049, 'bear_atr_min_pct': 0.0208270125601199, 'bear_atr_max_pct': 0.017508061826770262, 'bear_tp_mult': 2.5132536811797035, 'bear_tsl_mult': 0.11902666258132424, 'bear_time_stop': 35, 'bear_use_sma': True, 'bear_use_ema': False, 'bear_use_atr': True, 'bear_use_adx': True, 'bear_use_spike': False, 'bear_rsi_required': False, 'sideways_strategy': 'breakout', 'sideways_bb_std_mult': 3.28533785060477, 'sideways_rsi_os': 16, 'sideways_rsi_ob': 52, 'sideways_adx_thresh': 10.637071152151428, 'sideways_atr_min_pct': 0.01840052274502989, 'sideways_atr_max_pct': 0.09128739017740438, 'sideways_tp_mult': 1.7505235298613129, 'sideways_tsl_mult': 0.6561648559349502, 'sideways_time_stop': 70, 'sideways_use_sma': True, 'sideways_use_ema': True, 'sideways_use_atr': False, 'sideways_use_adx': True, 'sideways_use_spike': False, 'sideways_rsi_required': False}.
[I 2025-08-30 19:52:59,170] Trial 587 finished with values: [-1000000000.0, 1000000000.0] and parameters: {'p_sma': 15, 'p_std': 31, 'p_atr': 10, 'p_adx': 27, 'rsi_period': 56, 'ema1': 19, 'ema2': 29, 'slip_atr_k': 0.024142869441574545, 'slip_spread_k': 0.42202059625840443, 'spread_hl_frac': 0.003778338869949199, 'bb_std_mult': 1.868231338954347, 'rsi_os': 36, 'rsi_ob': 58, 'vol_spike': 0.037812798865681174, 'adx_thresh': 18.206195067298406, 'atr_min_pct': 0.020534178859886443, 'atr_max_pct': 0.1341042536468833, 'tp_mult': 2.292270687012876, 'tsl_mult': 0.745853668395262, 'strategy': 'mean_reversion', 'time_stop': 37, 'use_sma': True, 'use_atr': False, 'use_adx': False, 'use_ema': False, 'use_spike': True, 'rsi_required': True, 'edge_k': 0.08101444512950345, 'edge_cap': 0.27037186952621745, 'bull_strategy': 'breakout', 'bull_bb_std_mult': 1.8287932133200588, 'bull_rsi_os': 50, 'bull_rsi_ob': 72, 'bull_adx_thresh': 24.528312018336866, 'bull_atr_min_pct': 0.0018228376242406027, 'bull_atr_max_pct': 0.037282308910595426, 'bull_tp_mult': 2.1458659818358328, 'bull_tsl_mult': 0.8948039140491968, 'bull_time_stop': 200, 'bull_use_sma': True, 'bull_use_ema': False, 'bull_use_atr': False, 'bull_use_adx': True, 'bull_use_spike': True, 'bull_rsi_required': True, 'bear_strategy': 'breakout', 'bear_bb_std_mult': 3.3585809176757224, 'bear_rsi_os': 48, 'bear_rsi_ob': 82, 'bear_adx_thresh': 11.750622876255928, 'bear_atr_min_pct': 0.015384195543390718, 'bear_atr_max_pct': 0.05479225795201637, 'bear_tp_mult': 2.310148156411149, 'bear_tsl_mult': 0.14357353165465353, 'bear_time_stop': 59, 'bear_use_sma': True, 'bear_use_ema': False, 'bear_use_atr': False, 'bear_use_adx': False, 'bear_use_spike': False, 'bear_rsi_required': False, 'sideways_strategy': 'breakout', 'sideways_bb_std_mult': 2.374993246619023, 'sideways_rsi_os': 11, 'sideways_rsi_ob': 60, 'sideways_adx_thresh': 9.103322770749191, 'sideways_atr_min_pct': 0.018948480482741774, 'sideways_atr_max_pct': 0.12168197327620628, 'sideways_tp_mult': 1.852130753399548, 'sideways_tsl_mult': 0.7223603649020804, 'sideways_time_stop': 147, 'sideways_use_sma': False, 'sideways_use_ema': True, 'sideways_use_atr': False, 'sideways_use_adx': False, 'sideways_use_spike': False, 'sideways_rsi_required': True}.
[I 2025-08-30 19:53:07,657] Trial 588 finished with values: [-1000000000.0, 1000000000.0] and parameters: {'p_sma': 46, 'p_std': 21, 'p_atr': 10, 'p_adx': 7, 'rsi_period': 48, 'ema1': 23, 'ema2': 29, 'slip_atr_k': 0.025066337230311434, 'slip_spread_k': 0.6746137024683879, 'spread_hl_frac': 0.003973975811903512, 'bb_std_mult': 1.7582290189443974, 'rsi_os': 40, 'rsi_ob': 85, 'vol_spike': 0.17318622500204017, 'adx_thresh': 22.564001890698563, 'atr_min_pct': 0.024254006505315083, 'atr_max_pct': 0.13380770718578153, 'tp_mult': 2.2828809693346526, 'tsl_mult': 0.695009905799762, 'strategy': 'mean_reversion', 'time_stop': 111, 'use_sma': True, 'use_atr': False, 'use_adx': False, 'use_ema': False, 'use_spike': True, 'rsi_required': True, 'edge_k': 0.08643971331768824, 'edge_cap': 0.6741225404152926, 'bull_strategy': 'breakout', 'bull_bb_std_mult': 1.692274718908304, 'bull_rsi_os': 53, 'bull_rsi_ob': 72, 'bull_adx_thresh': 24.640018667231587, 'bull_atr_min_pct': 0.002672651211014216, 'bull_atr_max_pct': 0.04853395500609059, 'bull_tp_mult': 2.141250425832609, 'bull_tsl_mult': 0.9341212506981481, 'bull_time_stop': 201, 'bull_use_sma': True, 'bull_use_ema': False, 'bull_use_atr': False, 'bull_use_adx': True, 'bull_use_spike': False, 'bull_rsi_required': True, 'bear_strategy': 'mean_reversion', 'bear_bb_std_mult': 0.6741525112783069, 'bear_rsi_os': 43, 'bear_rsi_ob': 81, 'bear_adx_thresh': 12.021759362556569, 'bear_atr_min_pct': 0.015321575706608033, 'bear_atr_max_pct': 0.05551788502338068, 'bear_tp_mult': 2.306463515853829, 'bear_tsl_mult': 0.1380541919498809, 'bear_time_stop': 251, 'bear_use_sma': True, 'bear_use_ema': False, 'bear_use_atr': False, 'bear_use_adx': False, 'bear_use_spike': False, 'bear_rsi_required': False, 'sideways_strategy': 'breakout', 'sideways_bb_std_mult': 1.9760684408353941, 'sideways_rsi_os': 14, 'sideways_rsi_ob': 64, 'sideways_adx_thresh': 9.47490462850946, 'sideways_atr_min_pct': 0.01915373793948376, 'sideways_atr_max_pct': 0.016231518351161905, 'sideways_tp_mult': 1.3172015497905047, 'sideways_tsl_mult': 0.1372386092272418, 'sideways_time_stop': 280, 'sideways_use_sma': False, 'sideways_use_ema': True, 'sideways_use_atr': False, 'sideways_use_adx': False, 'sideways_use_spike': False, 'sideways_rsi_required': True}.
[I 2025-08-30 19:53:29,381] Trial 589 finished with values: [-1000000000.0, 1000000000.0] and parameters: {'p_sma': 9, 'p_std': 41, 'p_atr': 10, 'p_adx': 9, 'rsi_period': 51, 'ema1': 22, 'ema2': 40, 'slip_atr_k': 0.010939389475866432, 'slip_spread_k': 0.4040256189836977, 'spread_hl_frac': 0.0038059783736351946, 'bb_std_mult': 1.776968669691816, 'rsi_os': 36, 'rsi_ob': 58, 'vol_spike': 0.05239693108411504, 'adx_thresh': 30.31707450744358, 'atr_min_pct': 0.0042501649585373735, 'atr_max_pct': 0.13982213985085798, 'tp_mult': 2.2864644180380256, 'tsl_mult': 0.02028825244274407, 'strategy': 'mean_reversion', 'time_stop': 108, 'use_sma': True, 'use_atr': False, 'use_adx': True, 'use_ema': False, 'use_spike': True, 'rsi_required': True, 'edge_k': 0.00011783732375869604, 'edge_cap': 0.26646100338817025, 'bull_strategy': 'breakout', 'bull_bb_std_mult': 3.1227255283134996, 'bull_rsi_os': 50, 'bull_rsi_ob': 74, 'bull_adx_thresh': 24.49442407727282, 'bull_atr_min_pct': 0.00022893380000678885, 'bull_atr_max_pct': 0.07513013956761243, 'bull_tp_mult': 1.0120192589626784, 'bull_tsl_mult': 0.2267501177088918, 'bull_time_stop': 257, 'bull_use_sma': True, 'bull_use_ema': False, 'bull_use_atr': False, 'bull_use_adx': True, 'bull_use_spike': False, 'bull_rsi_required': True, 'bear_strategy': 'mean_reversion', 'bear_bb_std_mult': 2.3142420862392568, 'bear_rsi_os': 20, 'bear_rsi_ob': 87, 'bear_adx_thresh': 29.703153417531553, 'bear_atr_min_pct': 0.01521464228100601, 'bear_atr_max_pct': 0.054637076391935824, 'bear_tp_mult': 1.8821116539886884, 'bear_tsl_mult': 0.10496764682471245, 'bear_time_stop': 23, 'bear_use_sma': True, 'bear_use_ema': False, 'bear_use_atr': False, 'bear_use_adx': False, 'bear_use_spike': False, 'bear_rsi_required': False, 'sideways_strategy': 'breakout', 'sideways_bb_std_mult': 1.919170636826083, 'sideways_rsi_os': 14, 'sideways_rsi_ob': 95, 'sideways_adx_thresh': 5.743487357651262, 'sideways_atr_min_pct': 0.0035255740410256742, 'sideways_atr_max_pct': 0.112817325381066, 'sideways_tp_mult': 2.7976020451595334, 'sideways_tsl_mult': 0.726245162387627, 'sideways_time_stop': 259, 'sideways_use_sma': False, 'sideways_use_ema': True, 'sideways_use_atr': False, 'sideways_use_adx': False, 'sideways_use_spike': False, 'sideways_rsi_required': True}.
[I 2025-08-30 19:53:31,442] Trial 590 finished with values: [-1000000000.0, 1000000000.0] and parameters: {'p_sma': 44, 'p_std': 25, 'p_atr': 10, 'p_adx': 9, 'rsi_period': 13, 'ema1': 11, 'ema2': 30, 'slip_atr_k': 0.024435127197595004, 'slip_spread_k': 0.18779239754961885, 'spread_hl_frac': 0.0249694008550476, 'bb_std_mult': 0.5391741324401271, 'rsi_os': 40, 'rsi_ob': 58, 'vol_spike': 0.23300491908102466, 'adx_thresh': 18.43711758452743, 'atr_min_pct': 0.025405605161107507, 'atr_max_pct': 0.043867222992922235, 'tp_mult': 1.6967181161836389, 'tsl_mult': 0.702174585735297, 'strategy': 'mean_reversion', 'time_stop': 27, 'use_sma': True, 'use_atr': False, 'use_adx': True, 'use_ema': False, 'use_spike': True, 'rsi_required': True, 'edge_k': 1.4779446810246628, 'edge_cap': 0.2730913276962784, 'bull_strategy': 'breakout', 'bull_bb_std_mult': 2.7901028687265823, 'bull_rsi_os': 41, 'bull_rsi_ob': 74, 'bull_adx_thresh': 24.841081281138603, 'bull_atr_min_pct': 0.01459563373615915, 'bull_atr_max_pct': 0.03733386862824241, 'bull_tp_mult': 2.172048430834274, 'bull_tsl_mult': 0.9061707620514844, 'bull_time_stop': 192, 'bull_use_sma': True, 'bull_use_ema': False, 'bull_use_atr': False, 'bull_use_adx': True, 'bull_use_spike': False, 'bull_rsi_required': True, 'bear_strategy': 'mean_reversion', 'bear_bb_std_mult': 3.352135155237892, 'bear_rsi_os': 48, 'bear_rsi_ob': 87, 'bear_adx_thresh': 33.49167917555721, 'bear_atr_min_pct': 0.016095831047372503, 'bear_atr_max_pct': 0.05476222845680023, 'bear_tp_mult': 2.31685490679502, 'bear_tsl_mult': 0.09957679435586755, 'bear_time_stop': 19, 'bear_use_sma': True, 'bear_use_ema': False, 'bear_use_atr': False, 'bear_use_adx': False, 'bear_use_spike': False, 'bear_rsi_required': False, 'sideways_strategy': 'breakout', 'sideways_bb_std_mult': 0.999165262360453, 'sideways_rsi_os': 15, 'sideways_rsi_ob': 94, 'sideways_adx_thresh': 9.658632829864587, 'sideways_atr_min_pct': 0.025708525678857216, 'sideways_atr_max_pct': 0.01670440243606386, 'sideways_tp_mult': 1.8459735529228845, 'sideways_tsl_mult': 0.6804814325338064, 'sideways_time_stop': 258, 'sideways_use_sma': False, 'sideways_use_ema': True, 'sideways_use_atr': False, 'sideways_use_adx': False, 'sideways_use_spike': False, 'sideways_rsi_required': True}.
[I 2025-08-30 19:53:35,412] Trial 591 finished with values: [-1000000000.0, 1000000000.0] and parameters: {'p_sma': 46, 'p_std': 28, 'p_atr': 16, 'p_adx': 8, 'rsi_period': 12, 'ema1': 25, 'ema2': 19, 'slip_atr_k': 0.02625849942283788, 'slip_spread_k': 0.3988956762352364, 'spread_hl_frac': 0.04695761399355684, 'bb_std_mult': 1.007321294460785, 'rsi_os': 38, 'rsi_ob': 87, 'vol_spike': 0.16933038123360003, 'adx_thresh': 22.130547895469963, 'atr_min_pct': 0.02217413352770171, 'atr_max_pct': 0.14009843519787216, 'tp_mult': 2.1253533603918098, 'tsl_mult': 0.6573320851811503, 'strategy': 'mean_reversion', 'time_stop': 26, 'use_sma': True, 'use_atr': False, 'use_adx': True, 'use_ema': False, 'use_spike': True, 'rsi_required': True, 'edge_k': 1.470629682327591, 'edge_cap': 0.6968008671153274, 'bull_strategy': 'breakout', 'bull_bb_std_mult': 1.5415264885032283, 'bull_rsi_os': 53, 'bull_rsi_ob': 74, 'bull_adx_thresh': 26.367273241983952, 'bull_atr_min_pct': 0.006446722602989044, 'bull_atr_max_pct': 0.14584912947960255, 'bull_tp_mult': 2.2404308028798665, 'bull_tsl_mult': 0.917541523783708, 'bull_time_stop': 181, 'bull_use_sma': True, 'bull_use_ema': True, 'bull_use_atr': False, 'bull_use_adx': True, 'bull_use_spike': False, 'bull_rsi_required': True, 'bear_strategy': 'mean_reversion', 'bear_bb_std_mult': 2.1963278567635505, 'bear_rsi_os': 21, 'bear_rsi_ob': 84, 'bear_adx_thresh': 6.750183582808154, 'bear_atr_min_pct': 0.01614062170936175, 'bear_atr_max_pct': 0.05527080196827808, 'bear_tp_mult': 1.7804944196407553, 'bear_tsl_mult': 0.0958197046203318, 'bear_time_stop': 20, 'bear_use_sma': True, 'bear_use_ema': False, 'bear_use_atr': False, 'bear_use_adx': False, 'bear_use_spike': False, 'bear_rsi_required': False, 'sideways_strategy': 'breakout', 'sideways_bb_std_mult': 1.9574071060058942, 'sideways_rsi_os': 30, 'sideways_rsi_ob': 55, 'sideways_adx_thresh': 27.000555269039324, 'sideways_atr_min_pct': 0.02897171700727246, 'sideways_atr_max_pct': 0.03440776154753954, 'sideways_tp_mult': 1.8078354197653437, 'sideways_tsl_mult': 0.6803080960857585, 'sideways_time_stop': 278, 'sideways_use_sma': False, 'sideways_use_ema': True, 'sideways_use_atr': False, 'sideways_use_adx': False, 'sideways_use_spike': True, 'sideways_rsi_required': True}.
[I 2025-08-30 19:53:41,356] Trial 592 finished with values: [-1000000000.0, 1000000000.0] and parameters: {'p_sma': 44, 'p_std': 25, 'p_atr': 11, 'p_adx': 8, 'rsi_period': 36, 'ema1': 22, 'ema2': 58, 'slip_atr_k': 0.004659728004587844, 'slip_spread_k': 0.4034538329129456, 'spread_hl_frac': 0.04689583470450132, 'bb_std_mult': 1.0026436960549971, 'rsi_os': 22, 'rsi_ob': 56, 'vol_spike': 0.017009302972370067, 'adx_thresh': 24.734578917900393, 'atr_min_pct': 0.022174094010377187, 'atr_max_pct': 0.08722200173826263, 'tp_mult': 2.1189660013243294, 'tsl_mult': 0.0231400408999497, 'strategy': 'breakout', 'time_stop': 93, 'use_sma': False, 'use_atr': True, 'use_adx': True, 'use_ema': False, 'use_spike': True, 'rsi_required': True, 'edge_k': 0.210000909862897, 'edge_cap': 0.2594698963716594, 'bull_strategy': 'mean_reversion', 'bull_bb_std_mult': 1.8718281884975208, 'bull_rsi_os': 6, 'bull_rsi_ob': 74, 'bull_adx_thresh': 26.19762097422753, 'bull_atr_min_pct': 0.006091155845781664, 'bull_atr_max_pct': 0.022374376004321066, 'bull_tp_mult': 1.2326680425182135, 'bull_tsl_mult': 0.22589732252037464, 'bull_time_stop': 192, 'bull_use_sma': True, 'bull_use_ema': True, 'bull_use_atr': False, 'bull_use_adx': True, 'bull_use_spike': False, 'bull_rsi_required': True, 'bear_strategy': 'mean_reversion', 'bear_bb_std_mult': 2.2824059786485495, 'bear_rsi_os': 47, 'bear_rsi_ob': 83, 'bear_adx_thresh': 6.581763057817575, 'bear_atr_min_pct': 0.02240142403065038, 'bear_atr_max_pct': 0.11881089859838598, 'bear_tp_mult': 1.7851139333298556, 'bear_tsl_mult': 0.10090084026818952, 'bear_time_stop': 23, 'bear_use_sma': False, 'bear_use_ema': False, 'bear_use_atr': True, 'bear_use_adx': True, 'bear_use_spike': True, 'bear_rsi_required': True, 'sideways_strategy': 'mean_reversion', 'sideways_bb_std_mult': 1.80568550001947, 'sideways_rsi_os': 15, 'sideways_rsi_ob': 48, 'sideways_adx_thresh': 28.628699684156892, 'sideways_atr_min_pct': 0.003956413364642123, 'sideways_atr_max_pct': 0.11241101360924821, 'sideways_tp_mult': 1.8094738750655868, 'sideways_tsl_mult': 0.4277928278456064, 'sideways_time_stop': 258, 'sideways_use_sma': True, 'sideways_use_ema': False, 'sideways_use_atr': False, 'sideways_use_adx': False, 'sideways_use_spike': True, 'sideways_rsi_required': False}.
[I 2025-08-30 19:54:13,558] Trial 593 finished with values: [-1000000000.0, 1000000000.0] and parameters: {'p_sma': 41, 'p_std': 36, 'p_atr': 11, 'p_adx': 23, 'rsi_period': 36, 'ema1': 25, 'ema2': 58, 'slip_atr_k': 0.004898566086732932, 'slip_spread_k': 0.7081700748992901, 'spread_hl_frac': 0.005868076076475944, 'bb_std_mult': 1.4441315714650775, 'rsi_os': 38, 'rsi_ob': 56, 'vol_spike': 0.05657689988505421, 'adx_thresh': 29.422778365433416, 'atr_min_pct': 0.0007744574054781208, 'atr_max_pct': 0.11648976573903519, 'tp_mult': 2.140138776232278, 'tsl_mult': 0.5757890021711021, 'strategy': 'breakout', 'time_stop': 93, 'use_sma': False, 'use_atr': True, 'use_adx': False, 'use_ema': False, 'use_spike': True, 'rsi_required': False, 'edge_k': 0.256292221651684, 'edge_cap': 0.22606973051164286, 'bull_strategy': 'mean_reversion', 'bull_bb_std_mult': 1.5273954900010667, 'bull_rsi_os': 51, 'bull_rsi_ob': 83, 'bull_adx_thresh': 19.515325523453427, 'bull_atr_min_pct': 0.00281105615183281, 'bull_atr_max_pct': 0.02175937718891519, 'bull_tp_mult': 2.176177449396806, 'bull_tsl_mult': 0.9984285636290294, 'bull_time_stop': 191, 'bull_use_sma': True, 'bull_use_ema': True, 'bull_use_atr': True, 'bull_use_adx': False, 'bull_use_spike': True, 'bull_rsi_required': True, 'bear_strategy': 'breakout', 'bear_bb_std_mult': 3.2399732240834784, 'bear_rsi_os': 40, 'bear_rsi_ob': 84, 'bear_adx_thresh': 6.592235798617494, 'bear_atr_min_pct': 0.022288784366875203, 'bear_atr_max_pct': 0.1150918451695758, 'bear_tp_mult': 1.7819407023798757, 'bear_tsl_mult': 0.5029918112545441, 'bear_time_stop': 51, 'bear_use_sma': False, 'bear_use_ema': True, 'bear_use_atr': True, 'bear_use_adx': True, 'bear_use_spike': True, 'bear_rsi_required': True, 'sideways_strategy': 'mean_reversion', 'sideways_bb_std_mult': 2.0655664137359855, 'sideways_rsi_os': 16, 'sideways_rsi_ob': 55, 'sideways_adx_thresh': 12.699983516183895, 'sideways_atr_min_pct': 0.013961171098771609, 'sideways_atr_max_pct': 0.11719133317683655, 'sideways_tp_mult': 1.6938757765036474, 'sideways_tsl_mult': 0.002954248021935224, 'sideways_time_stop': 277, 'sideways_use_sma': True, 'sideways_use_ema': False, 'sideways_use_atr': True, 'sideways_use_adx': False, 'sideways_use_spike': True, 'sideways_rsi_required': False}.
