[I 2025-08-30 19:04:10,322] Trial 224 finished with values: [-1000000000.0, 1000000000.0] and parameters: {'p_sma': 60, 'p_std': 39, 'p_atr': 10, 'p_adx': 21, 'rsi_period': 51, 'ema1': 24, 'ema2': 19, 'slip_atr_k': 0.21359205536591286, 'slip_spread_k': 0.43885506162350085, 'spread_hl_frac': 0.014212194527396554, 'bb_std_mult': 1.1138952038652161, 'rsi_os': 36, 'rsi_ob': 94, 'vol_spike': 0.2459190476537209, 'adx_thresh': 17.880467145059413, 'atr_min_pct': 0.013130320466811726, 'atr_max_pct': 0.1360636627574893, 'tp_mult': 1.948262064800308, 'tsl_mult': 0.7127633484184683, 'strategy': 'breakout', 'time_stop': 25, 'use_sma': False, 'use_atr': False, 'use_adx': True, 'use_ema': False, 'use_spike': True, 'rsi_required': True, 'edge_k': 0.14442138540750626, 'edge_cap': 0.0745244368645096, 'bull_strategy': 'mean_reversion', 'bull_bb_std_mult': 3.0991454041854167, 'bull_rsi_os': 49, 'bull_rsi_ob': 74, 'bull_adx_thresh': 24.61046851868165, 'bull_atr_min_pct': 0.0035113206273794345, 'bull_atr_max_pct': 0.032185452320873296, 'bull_tp_mult': 2.2377063602570764, 'bull_tsl_mult': 0.9994701483678698, 'bull_time_stop': 56, 'bull_use_sma': False, 'bull_use_ema': False, 'bull_use_atr': False, 'bull_use_adx': False, 'bull_use_spike': True, 'bull_rsi_required': True, 'bear_strategy': 'breakout', 'bear_bb_std_mult': 1.9249591121339804, 'bear_rsi_os': 42, 'bear_rsi_ob': 57, 'bear_adx_thresh': 8.570086351919134, 'bear_atr_min_pct': 0.026185909031855976, 'bear_atr_max_pct': 0.03822231773721492, 'bear_tp_mult': 2.269231308035275, 'bear_tsl_mult': 0.11190331999329889, 'bear_time_stop': 191, 'bear_use_sma': True, 'bear_use_ema': False, 'bear_use_atr': False, 'bear_use_adx': False, 'bear_use_spike': False, 'bear_rsi_required': False, 'sideways_strategy': 'mean_reversion', 'sideways_bb_std_mult': 2.0321285877765893, 'sideways_rsi_os': 47, 'sideways_rsi_ob': 71, 'sideways_adx_thresh': 9.091193350385206, 'sideways_atr_min_pct': 0.018640797068762763, 'sideways_atr_max_pct': 0.09871543613050904, 'sideways_tp_mult': 1.8215639164293271, 'sideways_tsl_mult': 0.6781008273967912, 'sideways_time_stop': 275, 'sideways_use_sma': True, 'sideways_use_ema': True, 'sideways_use_atr': False, 'sideways_use_adx': True, 'sideways_use_spike': True, 'sideways_rsi_required': False}.
[I 2025-08-30 19:04:10,832] Trial 227 finished with values: [-1000000000.0, 1000000000.0] and parameters: {'p_sma': 60, 'p_std': 6, 'p_atr': 10, 'p_adx': 8, 'rsi_period': 52, 'ema1': 24, 'ema2': 48, 'slip_atr_k': 0.03014859961419507, 'slip_spread_k': 0.7441997182930744, 'spread_hl_frac': 0.002708354553489918, 'bb_std_mult': 1.9835845499577376, 'rsi_os': 48, 'rsi_ob': 62, 'vol_spike': 0.06657906416110966, 'adx_thresh': 18.028978659296644, 'atr_min_pct': 0.022995425798575272, 'atr_max_pct': 0.01878514553158113, 'tp_mult': 1.4048942754573905, 'tsl_mult': 0.6841206528717332, 'strategy': 'breakout', 'time_stop': 42, 'use_sma': False, 'use_atr': True, 'use_adx': False, 'use_ema': False, 'use_spike': True, 'rsi_required': True, 'edge_k': 0.9479009099623757, 'edge_cap': 0.2120039828968586, 'bull_strategy': 'breakout', 'bull_bb_std_mult': 2.4541217572292973, 'bull_rsi_os': 50, 'bull_rsi_ob': 91, 'bull_adx_thresh': 11.05028889817171, 'bull_atr_min_pct': 0.0017511511070706887, 'bull_atr_max_pct': 0.07378208296277698, 'bull_tp_mult': 2.2360671416895097, 'bull_tsl_mult': 0.554648086759974, 'bull_time_stop': 188, 'bull_use_sma': False, 'bull_use_ema': False, 'bull_use_atr': False, 'bull_use_adx': False, 'bull_use_spike': True, 'bull_rsi_required': False, 'bear_strategy': 'breakout', 'bear_bb_std_mult': 1.5771344200166455, 'bear_rsi_os': 42, 'bear_rsi_ob': 83, 'bear_adx_thresh': 6.8980297669721224, 'bear_atr_min_pct': 4.41647853082483e-05, 'bear_atr_max_pct': 0.0522512822156596, 'bear_tp_mult': 2.682391950248174, 'bear_tsl_mult': 0.11799036490649703, 'bear_time_stop': 25, 'bear_use_sma': True, 'bear_use_ema': False, 'bear_use_atr': False, 'bear_use_adx': False, 'bear_use_spike': False, 'bear_rsi_required': False, 'sideways_strategy': 'mean_reversion', 'sideways_bb_std_mult': 2.9306120424941375, 'sideways_rsi_os': 32, 'sideways_rsi_ob': 71, 'sideways_adx_thresh': 9.793345525047295, 'sideways_atr_min_pct': 0.018846710561047753, 'sideways_atr_max_pct': 0.12173068969852502, 'sideways_tp_mult': 1.7153031075529923, 'sideways_tsl_mult': 0.6774707204898547, 'sideways_time_stop': 273, 'sideways_use_sma': True, 'sideways_use_ema': True, 'sideways_use_atr': False, 'sideways_use_adx': True, 'sideways_use_spike': False, 'sideways_rsi_required': False}.
[I 2025-08-30 19:04:42,117] Trial 226 finished with values: [-1000000000.0, 1000000000.0] and parameters: {'p_sma': 17, 'p_std': 25, 'p_atr': 10, 'p_adx': 21, 'rsi_period': 52, 'ema1': 24, 'ema2': 34, 'slip_atr_k': 0.031641218376055144, 'slip_spread_k': 0.37687260659009775, 'spread_hl_frac': 0.01234932481528755, 'bb_std_mult': 1.1198069243841093, 'rsi_os': 27, 'rsi_ob': 52, 'vol_spike': 0.0462070920293365, 'adx_thresh': 17.722558664170304, 'atr_min_pct': 0.007453395120976667, 'atr_max_pct': 0.13571741250160274, 'tp_mult': 2.177335867183411, 'tsl_mult': 0.10948749755273884, 'strategy': 'breakout', 'time_stop': 292, 'use_sma': False, 'use_atr': False, 'use_adx': False, 'use_ema': False, 'use_spike': True, 'rsi_required': True, 'edge_k': 0.788448245693963, 'edge_cap': 0.20211110177609282, 'bull_strategy': 'breakout', 'bull_bb_std_mult': 1.8568026147738297, 'bull_rsi_os': 19, 'bull_rsi_ob': 89, 'bull_adx_thresh': 20.16590336496414, 'bull_atr_min_pct': 0.006507668935558831, 'bull_atr_max_pct': 0.13072153071162051, 'bull_tp_mult': 2.2436863631400312, 'bull_tsl_mult': 0.957133321293668, 'bull_time_stop': 188, 'bull_use_sma': False, 'bull_use_ema': False, 'bull_use_atr': False, 'bull_use_adx': True, 'bull_use_spike': True, 'bull_rsi_required': False, 'bear_strategy': 'breakout', 'bear_bb_std_mult': 2.213418463137271, 'bear_rsi_os': 48, 'bear_rsi_ob': 85, 'bear_adx_thresh': 6.911322831556504, 'bear_atr_min_pct': 0.014498652963291765, 'bear_atr_max_pct': 0.0500179725651289, 'bear_tp_mult': 2.2521555656829966, 'bear_tsl_mult': 0.11790413399118657, 'bear_time_stop': 224, 'bear_use_sma': True, 'bear_use_ema': False, 'bear_use_atr': False, 'bear_use_adx': False, 'bear_use_spike': False, 'bear_rsi_required': False, 'sideways_strategy': 'breakout', 'sideways_bb_std_mult': 2.029351428014575, 'sideways_rsi_os': 14, 'sideways_rsi_ob': 58, 'sideways_adx_thresh': 9.801103008703873, 'sideways_atr_min_pct': 0.002043726513992877, 'sideways_atr_max_pct': 0.12238597429312056, 'sideways_tp_mult': 1.8320795749808991, 'sideways_tsl_mult': 0.35491035739358034, 'sideways_time_stop': 273, 'sideways_use_sma': True, 'sideways_use_ema': True, 'sideways_use_atr': False, 'sideways_use_adx': True, 'sideways_use_spike': False, 'sideways_rsi_required': False}.
[I 2025-08-30 19:04:44,686] Trial 229 finished with values: [-1000000000.0, 1000000000.0] and parameters: {'p_sma': 45, 'p_std': 25, 'p_atr': 16, 'p_adx': 29, 'rsi_period': 53, 'ema1': 25, 'ema2': 28, 'slip_atr_k': 0.01518418929727549, 'slip_spread_k': 0.22214410934159473, 'spread_hl_frac': 0.0023029854667635363, 'bb_std_mult': 0.9625338692997802, 'rsi_os': 47, 'rsi_ob': 57, 'vol_spike': 0.03127991421723325, 'adx_thresh': 18.65675706774529, 'atr_min_pct': 0.02322728195952207, 'atr_max_pct': 0.08217560323317158, 'tp_mult': 2.1485792858289456, 'tsl_mult': 0.7437564535910856, 'strategy': 'breakout', 'time_stop': 17, 'use_sma': False, 'use_atr': True, 'use_adx': False, 'use_ema': False, 'use_spike': True, 'rsi_required': True, 'edge_k': 0.07804144099482435, 'edge_cap': 0.21517631003714063, 'bull_strategy': 'breakout', 'bull_bb_std_mult': 1.8664820499664028, 'bull_rsi_os': 21, 'bull_rsi_ob': 51, 'bull_adx_thresh': 32.09817933447168, 'bull_atr_min_pct': 0.006560976163376966, 'bull_atr_max_pct': 0.0175017628757531, 'bull_tp_mult': 2.0516877011980443, 'bull_tsl_mult': 0.9798969941801233, 'bull_time_stop': 190, 'bull_use_sma': True, 'bull_use_ema': True, 'bull_use_atr': False, 'bull_use_adx': True, 'bull_use_spike': True, 'bull_rsi_required': False, 'bear_strategy': 'breakout', 'bear_bb_std_mult': 3.214405233970781, 'bear_rsi_os': 47, 'bear_rsi_ob': 83, 'bear_adx_thresh': 33.88042158974268, 'bear_atr_min_pct': 0.01464534205102367, 'bear_atr_max_pct': 0.0567394190933267, 'bear_tp_mult': 1.1509378164091673, 'bear_tsl_mult': 0.1425861843307044, 'bear_time_stop': 24, 'bear_use_sma': True, 'bear_use_ema': False, 'bear_use_atr': True, 'bear_use_adx': True, 'bear_use_spike': False, 'bear_rsi_required': False, 'sideways_strategy': 'breakout', 'sideways_bb_std_mult': 3.135716824637869, 'sideways_rsi_os': 14, 'sideways_rsi_ob': 58, 'sideways_adx_thresh': 9.927512547847218, 'sideways_atr_min_pct': 0.019677902913540525, 'sideways_atr_max_pct': 0.12215382755910112, 'sideways_tp_mult': 1.8403395328221526, 'sideways_tsl_mult': 0.35353793813013956, 'sideways_time_stop': 264, 'sideways_use_sma': True, 'sideways_use_ema': True, 'sideways_use_atr': False, 'sideways_use_adx': False, 'sideways_use_spike': False, 'sideways_rsi_required': False}.
[I 2025-08-30 19:04:44,937] Trial 228 finished with values: [-1000000000.0, 1000000000.0] and parameters: {'p_sma': 17, 'p_std': 25, 'p_atr': 7, 'p_adx': 21, 'rsi_period': 53, 'ema1': 24, 'ema2': 19, 'slip_atr_k': 0.00878638080962631, 'slip_spread_k': 0.4374540453692416, 'spread_hl_frac': 0.0027227748796561846, 'bb_std_mult': 1.1241864624372329, 'rsi_os': 36, 'rsi_ob': 62, 'vol_spike': 0.02729272350654971, 'adx_thresh': 17.97104881505431, 'atr_min_pct': 0.01147549832236525, 'atr_max_pct': 0.13470236949802472, 'tp_mult': 1.3953254963916937, 'tsl_mult': 0.743745513820105, 'strategy': 'breakout', 'time_stop': 96, 'use_sma': False, 'use_atr': True, 'use_adx': False, 'use_ema': False, 'use_spike': True, 'rsi_required': True, 'edge_k': 0.13355388019489345, 'edge_cap': 0.211244113146517, 'bull_strategy': 'breakout', 'bull_bb_std_mult': 1.8576904473829567, 'bull_rsi_os': 32, 'bull_rsi_ob': 61, 'bull_adx_thresh': 25.680890647540974, 'bull_atr_min_pct': 0.014743311664967514, 'bull_atr_max_pct': 0.07435262692489618, 'bull_tp_mult': 1.6083474621069958, 'bull_tsl_mult': 0.9581029142524469, 'bull_time_stop': 57, 'bull_use_sma': False, 'bull_use_ema': True, 'bull_use_atr': False, 'bull_use_adx': True, 'bull_use_spike': True, 'bull_rsi_required': False, 'bear_strategy': 'breakout', 'bear_bb_std_mult': 3.2413337238044075, 'bear_rsi_os': 48, 'bear_rsi_ob': 85, 'bear_adx_thresh': 18.404812360052684, 'bear_atr_min_pct': 0.0146875877789544, 'bear_atr_max_pct': 0.05608837251287177, 'bear_tp_mult': 2.663742848086099, 'bear_tsl_mult': 0.6853314464101778, 'bear_time_stop': 25, 'bear_use_sma': True, 'bear_use_ema': False, 'bear_use_atr': True, 'bear_use_adx': True, 'bear_use_spike': False, 'bear_rsi_required': False, 'sideways_strategy': 'breakout', 'sideways_bb_std_mult': 1.1484909905782943, 'sideways_rsi_os': 14, 'sideways_rsi_ob': 58, 'sideways_adx_thresh': 9.856294128444873, 'sideways_atr_min_pct': 0.019118559739890784, 'sideways_atr_max_pct': 0.12245270368338364, 'sideways_tp_mult': 1.8180959986407015, 'sideways_tsl_mult': 0.49027876851797775, 'sideways_time_stop': 272, 'sideways_use_sma': True, 'sideways_use_ema': True, 'sideways_use_atr': False, 'sideways_use_adx': True, 'sideways_use_spike': False, 'sideways_rsi_required': False}.
[I 2025-08-30 19:04:45,316] Trial 230 finished with values: [-1000000000.0, 1000000000.0] and parameters: {'p_sma': 11, 'p_std': 25, 'p_atr': 27, 'p_adx': 8, 'rsi_period': 54, 'ema1': 27, 'ema2': 29, 'slip_atr_k': 0.017874700503498483, 'slip_spread_k': 0.3786752125339799, 'spread_hl_frac': 0.0025244012992049654, 'bb_std_mult': 0.9550329075035388, 'rsi_os': 38, 'rsi_ob': 56, 'vol_spike': 0.2570505550246832, 'adx_thresh': 34.85763019852287, 'atr_min_pct': 0.009222561128716932, 'atr_max_pct': 0.14060538616713758, 'tp_mult': 2.129981187418968, 'tsl_mult': 0.7396362990103346, 'strategy': 'breakout', 'time_stop': 291, 'use_sma': True, 'use_atr': True, 'use_adx': False, 'use_ema': True, 'use_spike': True, 'rsi_required': False, 'edge_k': 0.10250674497790037, 'edge_cap': 0.3698806979903582, 'bull_strategy': 'breakout', 'bull_bb_std_mult': 1.8540648873657404, 'bull_rsi_os': 9, 'bull_rsi_ob': 51, 'bull_adx_thresh': 25.731212437254413, 'bull_atr_min_pct': 0.0065748619820778335, 'bull_atr_max_pct': 0.02556284789766545, 'bull_tp_mult': 2.0247050626631995, 'bull_tsl_mult': 0.9792708655375575, 'bull_time_stop': 194, 'bull_use_sma': True, 'bull_use_ema': True, 'bull_use_atr': True, 'bull_use_adx': True, 'bull_use_spike': False, 'bull_rsi_required': False, 'bear_strategy': 'breakout', 'bear_bb_std_mult': 3.269361124608755, 'bear_rsi_os': 11, 'bear_rsi_ob': 85, 'bear_adx_thresh': 7.49399307964774, 'bear_atr_min_pct': 0.014462006063640216, 'bear_atr_max_pct': 0.09812226996411125, 'bear_tp_mult': 2.7759651299150785, 'bear_tsl_mult': 0.1383268423445668, 'bear_time_stop': 37, 'bear_use_sma': True, 'bear_use_ema': True, 'bear_use_atr': True, 'bear_use_adx': True, 'bear_use_spike': False, 'bear_rsi_required': False, 'sideways_strategy': 'breakout', 'sideways_bb_std_mult': 2.1110124487676023, 'sideways_rsi_os': 14, 'sideways_rsi_ob': 58, 'sideways_adx_thresh': 9.852036103601103, 'sideways_atr_min_pct': 0.019297479760916746, 'sideways_atr_max_pct': 0.11977779678400637, 'sideways_tp_mult': 1.8390526640749367, 'sideways_tsl_mult': 0.7167012459101919, 'sideways_time_stop': 174, 'sideways_use_sma': False, 'sideways_use_ema': True, 'sideways_use_atr': False, 'sideways_use_adx': False, 'sideways_use_spike': False, 'sideways_rsi_required': False}.
[I 2025-08-30 19:04:46,112] Trial 232 finished with values: [-1000000000.0, 1000000000.0] and parameters: {'p_sma': 43, 'p_std': 43, 'p_atr': 7, 'p_adx': 8, 'rsi_period': 60, 'ema1': 29, 'ema2': 17, 'slip_atr_k': 0.009213244525061082, 'slip_spread_k': 0.42325437714895264, 'spread_hl_frac': 0.0005136437427359867, 'bb_std_mult': 2.141499365452365, 'rsi_os': 45, 'rsi_ob': 84, 'vol_spike': 0.025498605269342063, 'adx_thresh': 8.546819352696284, 'atr_min_pct': 0.011026861315729995, 'atr_max_pct': 0.010380679835281431, 'tp_mult': 2.128844775209801, 'tsl_mult': 0.7444374482534801, 'strategy': 'mean_reversion', 'time_stop': 163, 'use_sma': True, 'use_atr': True, 'use_adx': False, 'use_ema': True, 'use_spike': False, 'rsi_required': False, 'edge_k': 0.12864047364186795, 'edge_cap': 0.4149405095821891, 'bull_strategy': 'mean_reversion', 'bull_bb_std_mult': 1.685173512518855, 'bull_rsi_os': 9, 'bull_rsi_ob': 60, 'bull_adx_thresh': 26.18312730270474, 'bull_atr_min_pct': 0.00276297208737393, 'bull_atr_max_pct': 0.026625780594236762, 'bull_tp_mult': 2.8737832243742485, 'bull_tsl_mult': 0.9598689967006001, 'bull_time_stop': 197, 'bull_use_sma': True, 'bull_use_ema': True, 'bull_use_atr': True, 'bull_use_adx': True, 'bull_use_spike': False, 'bull_rsi_required': True, 'bear_strategy': 'breakout', 'bear_bb_std_mult': 3.2525644945954983, 'bear_rsi_os': 40, 'bear_rsi_ob': 61, 'bear_adx_thresh': 7.612720228829486, 'bear_atr_min_pct': 0.017417753155171863, 'bear_atr_max_pct': 0.05930122530818553, 'bear_tp_mult': 2.785899208769654, 'bear_tsl_mult': 0.7948685827678441, 'bear_time_stop': 76, 'bear_use_sma': False, 'bear_use_ema': True, 'bear_use_atr': True, 'bear_use_adx': True, 'bear_use_spike': False, 'bear_rsi_required': False, 'sideways_strategy': 'breakout', 'sideways_bb_std_mult': 2.696332247963235, 'sideways_rsi_os': 16, 'sideways_rsi_ob': 91, 'sideways_adx_thresh': 30.01652347607894, 'sideways_atr_min_pct': 0.018258001304367874, 'sideways_atr_max_pct': 0.11897297279260727, 'sideways_tp_mult': 1.8826119299751312, 'sideways_tsl_mult': 0.7354545892963593, 'sideways_time_stop': 16, 'sideways_use_sma': False, 'sideways_use_ema': False, 'sideways_use_atr': False, 'sideways_use_adx': False, 'sideways_use_spike': False, 'sideways_rsi_required': True}.
[I 2025-08-30 19:05:17,247] Trial 231 finished with values: [-1000000000.0, 1000000000.0] and parameters: {'p_sma': 24, 'p_std': 24, 'p_atr': 11, 'p_adx': 8, 'rsi_period': 47, 'ema1': 22, 'ema2': 59, 'slip_atr_k': 0.09897777154265344, 'slip_spread_k': 0.41803983684258283, 'spread_hl_frac': 0.0007025315446405815, 'bb_std_mult': 2.084843528691791, 'rsi_os': 45, 'rsi_ob': 56, 'vol_spike': 0.0301761068923153, 'adx_thresh': 34.27149479162107, 'atr_min_pct': 0.009477779900207164, 'atr_max_pct': 0.14077378951390745, 'tp_mult': 2.138622997076218, 'tsl_mult': 0.7546224581814701, 'strategy': 'mean_reversion', 'time_stop': 16, 'use_sma': True, 'use_atr': True, 'use_adx': False, 'use_ema': True, 'use_spike': False, 'rsi_required': False, 'edge_k': 0.067722661732453, 'edge_cap': 0.2929374263894582, 'bull_strategy': 'mean_reversion', 'bull_bb_std_mult': 1.692967263648104, 'bull_rsi_os': 52, 'bull_rsi_ob': 51, 'bull_adx_thresh': 25.70024889330116, 'bull_atr_min_pct': 0.002546286903249588, 'bull_atr_max_pct': 0.026379654617127456, 'bull_tp_mult': 2.027245608209851, 'bull_tsl_mult': 0.14875976876582425, 'bull_time_stop': 197, 'bull_use_sma': True, 'bull_use_ema': True, 'bull_use_atr': True, 'bull_use_adx': True, 'bull_use_spike': False, 'bull_rsi_required': True, 'bear_strategy': 'breakout', 'bear_bb_std_mult': 3.226975647428623, 'bear_rsi_os': 40, 'bear_rsi_ob': 61, 'bear_adx_thresh': 7.674361124500033, 'bear_atr_min_pct': 0.02069942185234549, 'bear_atr_max_pct': 0.14626886161202649, 'bear_tp_mult': 1.4577602079170051, 'bear_tsl_mult': 0.13927705527276446, 'bear_time_stop': 172, 'bear_use_sma': False, 'bear_use_ema': True, 'bear_use_atr': True, 'bear_use_adx': True, 'bear_use_spike': False, 'bear_rsi_required': False, 'sideways_strategy': 'breakout', 'sideways_bb_std_mult': 1.1553837450999924, 'sideways_rsi_os': 16, 'sideways_rsi_ob': 89, 'sideways_adx_thresh': 12.770597580139247, 'sideways_atr_min_pct': 0.01931165176890752, 'sideways_atr_max_pct': 0.11871236178117348, 'sideways_tp_mult': 2.7280256237931138, 'sideways_tsl_mult': 0.7235188329781851, 'sideways_time_stop': 264, 'sideways_use_sma': False, 'sideways_use_ema': False, 'sideways_use_atr': False, 'sideways_use_adx': False, 'sideways_use_spike': False, 'sideways_rsi_required': False}.
[I 2025-08-30 19:05:18,142] Trial 234 finished with values: [-1000000000.0, 1000000000.0] and parameters: {'p_sma': 43, 'p_std': 31, 'p_atr': 11, 'p_adx': 8, 'rsi_period': 48, 'ema1': 23, 'ema2': 14, 'slip_atr_k': 0.08870614858419426, 'slip_spread_k': 0.7905021071243048, 'spread_hl_frac': 0.001107419799619798, 'bb_std_mult': 2.0827018470312457, 'rsi_os': 43, 'rsi_ob': 84, 'vol_spike': 0.040182510823253775, 'adx_thresh': 10.188120409435513, 'atr_min_pct': 0.024228730087184663, 'atr_max_pct': 0.043305205870500595, 'tp_mult': 2.2190319873570914, 'tsl_mult': 0.4289314669545181, 'strategy': 'mean_reversion', 'time_stop': 28, 'use_sma': True, 'use_atr': True, 'use_adx': False, 'use_ema': False, 'use_spike': False, 'rsi_required': False, 'edge_k': 0.046300907885246406, 'edge_cap': 0.23204520027261635, 'bull_strategy': 'mean_reversion', 'bull_bb_std_mult': 0.5002210037152346, 'bull_rsi_os': 48, 'bull_rsi_ob': 81, 'bull_adx_thresh': 26.27224960465955, 'bull_atr_min_pct': 0.0025806372613654824, 'bull_atr_max_pct': 0.07984854728860835, 'bull_tp_mult': 2.172197315978004, 'bull_tsl_mult': 0.9997120182212348, 'bull_time_stop': 199, 'bull_use_sma': True, 'bull_use_ema': False, 'bull_use_atr': True, 'bull_use_adx': True, 'bull_use_spike': False, 'bull_rsi_required': True, 'bear_strategy': 'mean_reversion', 'bear_bb_std_mult': 3.343467457530971, 'bear_rsi_os': 43, 'bear_rsi_ob': 61, 'bear_adx_thresh': 24.276448839626077, 'bear_atr_min_pct': 0.01351558329993138, 'bear_atr_max_pct': 0.06033170489277403, 'bear_tp_mult': 1.7509550380886647, 'bear_tsl_mult': 0.5010291344090543, 'bear_time_stop': 39, 'bear_use_sma': False, 'bear_use_ema': True, 'bear_use_atr': True, 'bear_use_adx': True, 'bear_use_spike': False, 'bear_rsi_required': True, 'sideways_strategy': 'breakout', 'sideways_bb_std_mult': 1.9746431412658716, 'sideways_rsi_os': 16, 'sideways_rsi_ob': 90, 'sideways_adx_thresh': 29.96067693215697, 'sideways_atr_min_pct': 0.010789907079356023, 'sideways_atr_max_pct': 0.11630652001797115, 'sideways_tp_mult': 1.7349263767230028, 'sideways_tsl_mult': 0.6492308178502939, 'sideways_time_stop': 15, 'sideways_use_sma': True, 'sideways_use_ema': False, 'sideways_use_atr': False, 'sideways_use_adx': False, 'sideways_use_spike': False, 'sideways_rsi_required': True}.
