[I 2025-08-30 19:45:01,132] Trial 523 finished with values: [-1000000000.0, 1000000000.0] and parameters: {'p_sma': 34, 'p_std': 26, 'p_atr': 14, 'p_adx': 14, 'rsi_period': 81, 'ema1': 12, 'ema2': 16, 'slip_atr_k': 0.02206206112780479, 'slip_spread_k': 0.41929448250961515, 'spread_hl_frac': 0.03607631552641534, 'bb_std_mult': 0.7392587981600867, 'rsi_os': 38, 'rsi_ob': 90, 'vol_spike': 0.03082189263915889, 'adx_thresh': 18.093428294756368, 'atr_min_pct': 0.02385751313016735, 'atr_max_pct': 0.06632376944816865, 'tp_mult': 2.416069711076614, 'tsl_mult': 0.7765878667886388, 'strategy': 'breakout', 'time_stop': 294, 'use_sma': True, 'use_atr': True, 'use_adx': False, 'use_ema': False, 'use_spike': True, 'rsi_required': True, 'edge_k': 1.4978211828322634, 'edge_cap': 0.691484530216848, 'bull_strategy': 'mean_reversion', 'bull_bb_std_mult': 2.686589751159701, 'bull_rsi_os': 30, 'bull_rsi_ob': 69, 'bull_adx_thresh': 24.08897815895023, 'bull_atr_min_pct': 0.017802045200424235, 'bull_atr_max_pct': 0.028034386469316244, 'bull_tp_mult': 2.4158669941433044, 'bull_tsl_mult': 0.9381389031434701, 'bull_time_stop': 111, 'bull_use_sma': True, 'bull_use_ema': False, 'bull_use_atr': False, 'bull_use_adx': True, 'bull_use_spike': True, 'bull_rsi_required': True, 'bear_strategy': 'mean_reversion', 'bear_bb_std_mult': 3.2071662078415124, 'bear_rsi_os': 45, 'bear_rsi_ob': 72, 'bear_adx_thresh': 7.109281521096339, 'bear_atr_min_pct': 0.01616741088034457, 'bear_atr_max_pct': 0.05938576725483659, 'bear_tp_mult': 1.846282574965573, 'bear_tsl_mult': 0.7063813520853546, 'bear_time_stop': 278, 'bear_use_sma': True, 'bear_use_ema': True, 'bear_use_atr': False, 'bear_use_adx': False, 'bear_use_spike': False, 'bear_rsi_required': False, 'sideways_strategy': 'mean_reversion', 'sideways_bb_std_mult': 2.156944072951741, 'sideways_rsi_os': 14, 'sideways_rsi_ob': 53, 'sideways_adx_thresh': 21.233462963713027, 'sideways_atr_min_pct': 0.0299941900353261, 'sideways_atr_max_pct': 0.030576723453336778, 'sideways_tp_mult': 2.2043180706230348, 'sideways_tsl_mult': 0.9365479169126365, 'sideways_time_stop': 234, 'sideways_use_sma': True, 'sideways_use_ema': True, 'sideways_use_atr': False, 'sideways_use_adx': False, 'sideways_use_spike': True, 'sideways_rsi_required': False}.
[I 2025-08-30 19:45:01,310] Trial 525 finished with values: [-1000000000.0, 1000000000.0] and parameters: {'p_sma': 34, 'p_std': 55, 'p_atr': 9, 'p_adx': 16, 'rsi_period': 23, 'ema1': 20, 'ema2': 16, 'slip_atr_k': 0.007774637656473604, 'slip_spread_k': 0.3774700282313139, 'spread_hl_frac': 0.008853082331893004, 'bb_std_mult': 1.5369646336507072, 'rsi_os': 32, 'rsi_ob': 71, 'vol_spike': 0.007598209384192839, 'adx_thresh': 18.215168494505907, 'atr_min_pct': 0.02407622123064207, 'atr_max_pct': 0.1417493089515106, 'tp_mult': 2.138734008910838, 'tsl_mult': 0.77340850068691, 'strategy': 'breakout', 'time_stop': 299, 'use_sma': False, 'use_atr': True, 'use_adx': False, 'use_ema': False, 'use_spike': True, 'rsi_required': True, 'edge_k': 0.2629893046425264, 'edge_cap': 0.5545039216699298, 'bull_strategy': 'mean_reversion', 'bull_bb_std_mult': 2.246509798767246, 'bull_rsi_os': 51, 'bull_rsi_ob': 45, 'bull_adx_thresh': 25.045195665348636, 'bull_atr_min_pct': 0.005114700661386298, 'bull_atr_max_pct': 0.03837712265478203, 'bull_tp_mult': 2.2648333299505, 'bull_tsl_mult': 0.6617015715340239, 'bull_time_stop': 207, 'bull_use_sma': True, 'bull_use_ema': False, 'bull_use_atr': False, 'bull_use_adx': False, 'bull_use_spike': True, 'bull_rsi_required': True, 'bear_strategy': 'mean_reversion', 'bear_bb_std_mult': 1.1638457637268607, 'bear_rsi_os': 45, 'bear_rsi_ob': 86, 'bear_adx_thresh': 7.103530470207438, 'bear_atr_min_pct': 0.016082160899284985, 'bear_atr_max_pct': 0.11348511264307785, 'bear_tp_mult': 1.846100695485794, 'bear_tsl_mult': 0.6199864781583267, 'bear_time_stop': 24, 'bear_use_sma': True, 'bear_use_ema': False, 'bear_use_atr': True, 'bear_use_adx': True, 'bear_use_spike': False, 'bear_rsi_required': True, 'sideways_strategy': 'breakout', 'sideways_bb_std_mult': 2.180644336127415, 'sideways_rsi_os': 23, 'sideways_rsi_ob': 87, 'sideways_adx_thresh': 34.1167487612309, 'sideways_atr_min_pct': 0.02551537738621694, 'sideways_atr_max_pct': 0.12728396164688616, 'sideways_tp_mult': 1.8807039558841816, 'sideways_tsl_mult': 0.6824792506921473, 'sideways_time_stop': 68, 'sideways_use_sma': True, 'sideways_use_ema': True, 'sideways_use_atr': False, 'sideways_use_adx': False, 'sideways_use_spike': True, 'sideways_rsi_required': False}.
[I 2025-08-30 19:45:01,391] Trial 522 finished with values: [-1000000000.0, 1000000000.0] and parameters: {'p_sma': 44, 'p_std': 25, 'p_atr': 17, 'p_adx': 16, 'rsi_period': 81, 'ema1': 24, 'ema2': 16, 'slip_atr_k': 0.008788982349614421, 'slip_spread_k': 0.298449704057669, 'spread_hl_frac': 0.0026863003270566144, 'bb_std_mult': 0.962864609321012, 'rsi_os': 37, 'rsi_ob': 56, 'vol_spike': 0.03030834475856352, 'adx_thresh': 17.938772487484908, 'atr_min_pct': 0.02412311924994901, 'atr_max_pct': 0.0659062839806117, 'tp_mult': 2.118430207700871, 'tsl_mult': 0.6169089411777384, 'strategy': 'mean_reversion', 'time_stop': 44, 'use_sma': True, 'use_atr': True, 'use_adx': False, 'use_ema': False, 'use_spike': True, 'rsi_required': True, 'edge_k': 1.6119377341238033, 'edge_cap': 0.2519969892114511, 'bull_strategy': 'mean_reversion', 'bull_bb_std_mult': 0.9966865481011964, 'bull_rsi_os': 51, 'bull_rsi_ob': 73, 'bull_adx_thresh': 24.101418835791726, 'bull_atr_min_pct': 0.01773767052443806, 'bull_atr_max_pct': 0.0935005149542163, 'bull_tp_mult': 2.3921974115988673, 'bull_tsl_mult': 0.9384855473758722, 'bull_time_stop': 266, 'bull_use_sma': True, 'bull_use_ema': False, 'bull_use_atr': False, 'bull_use_adx': True, 'bull_use_spike': True, 'bull_rsi_required': True, 'bear_strategy': 'breakout', 'bear_bb_std_mult': 1.177620746565493, 'bear_rsi_os': 41, 'bear_rsi_ob': 72, 'bear_adx_thresh': 6.282274042960575, 'bear_atr_min_pct': 0.026250842463022554, 'bear_atr_max_pct': 0.06004468932850857, 'bear_tp_mult': 2.762950033590632, 'bear_tsl_mult': 0.1328579182772212, 'bear_time_stop': 24, 'bear_use_sma': True, 'bear_use_ema': True, 'bear_use_atr': False, 'bear_use_adx': False, 'bear_use_spike': True, 'bear_rsi_required': False, 'sideways_strategy': 'mean_reversion', 'sideways_bb_std_mult': 1.909071834907517, 'sideways_rsi_os': 26, 'sideways_rsi_ob': 59, 'sideways_adx_thresh': 32.299081406732284, 'sideways_atr_min_pct': 0.008784056914431897, 'sideways_atr_max_pct': 0.08658694189062888, 'sideways_tp_mult': 1.1380181595609171, 'sideways_tsl_mult': 0.7060858183510211, 'sideways_time_stop': 252, 'sideways_use_sma': True, 'sideways_use_ema': True, 'sideways_use_atr': False, 'sideways_use_adx': False, 'sideways_use_spike': False, 'sideways_rsi_required': False}.
[I 2025-08-30 19:45:01,567] Trial 524 finished with values: [-1000000000.0, 1000000000.0] and parameters: {'p_sma': 44, 'p_std': 26, 'p_atr': 29, 'p_adx': 8, 'rsi_period': 21, 'ema1': 7, 'ema2': 16, 'slip_atr_k': 0.02258680709234462, 'slip_spread_k': 0.31300224980465297, 'spread_hl_frac': 0.04418580029013966, 'bb_std_mult': 1.5136063844575474, 'rsi_os': 37, 'rsi_ob': 56, 'vol_spike': 0.027764690220697552, 'adx_thresh': 17.87756800616103, 'atr_min_pct': 0.023883088771466818, 'atr_max_pct': 0.06671500191986172, 'tp_mult': 2.3033951496959815, 'tsl_mult': 0.6310549495893336, 'strategy': 'breakout', 'time_stop': 293, 'use_sma': True, 'use_atr': True, 'use_adx': False, 'use_ema': False, 'use_spike': True, 'rsi_required': True, 'edge_k': 0.324835040414447, 'edge_cap': 0.2834811521550068, 'bull_strategy': 'mean_reversion', 'bull_bb_std_mult': 2.057875666586197, 'bull_rsi_os': 51, 'bull_rsi_ob': 92, 'bull_adx_thresh': 24.096391860643234, 'bull_atr_min_pct': 0.007687019072217733, 'bull_atr_max_pct': 0.02618344450891359, 'bull_tp_mult': 2.9972104454828807, 'bull_tsl_mult': 0.05451502746083409, 'bull_time_stop': 128, 'bull_use_sma': True, 'bull_use_ema': False, 'bull_use_atr': False, 'bull_use_adx': False, 'bull_use_spike': True, 'bull_rsi_required': True, 'bear_strategy': 'mean_reversion', 'bear_bb_std_mult': 3.430772020366744, 'bear_rsi_os': 45, 'bear_rsi_ob': 86, 'bear_adx_thresh': 11.328768569237198, 'bear_atr_min_pct': 0.016265670434699505, 'bear_atr_max_pct': 0.049861510323062935, 'bear_tp_mult': 2.7673611859482055, 'bear_tsl_mult': 0.14725201831446497, 'bear_time_stop': 25, 'bear_use_sma': True, 'bear_use_ema': False, 'bear_use_atr': False, 'bear_use_adx': False, 'bear_use_spike': False, 'bear_rsi_required': True, 'sideways_strategy': 'mean_reversion', 'sideways_bb_std_mult': 2.1697497607667695, 'sideways_rsi_os': 14, 'sideways_rsi_ob': 91, 'sideways_adx_thresh': 34.056957174893355, 'sideways_atr_min_pct': 0.02645187795329167, 'sideways_atr_max_pct': 0.1377320728787409, 'sideways_tp_mult': 1.2182572159355385, 'sideways_tsl_mult': 0.6810519422889961, 'sideways_time_stop': 185, 'sideways_use_sma': True, 'sideways_use_ema': True, 'sideways_use_atr': False, 'sideways_use_adx': False, 'sideways_use_spike': True, 'sideways_rsi_required': False}.
[I 2025-08-30 19:45:34,910] Trial 526 finished with values: [-1000000000.0, 1000000000.0] and parameters: {'p_sma': 44, 'p_std': 25, 'p_atr': 17, 'p_adx': 7, 'rsi_period': 48, 'ema1': 26, 'ema2': 17, 'slip_atr_k': 0.01461888705552646, 'slip_spread_k': 0.30864213546503183, 'spread_hl_frac': 0.002446887081002694, 'bb_std_mult': 1.4654066126598022, 'rsi_os': 35, 'rsi_ob': 57, 'vol_spike': 0.07743713460613517, 'adx_thresh': 32.4480013413418, 'atr_min_pct': 0.028490748204401638, 'atr_max_pct': 0.14065989302512225, 'tp_mult': 2.1350807836600216, 'tsl_mult': 0.521143716069618, 'strategy': 'breakout', 'time_stop': 18, 'use_sma': False, 'use_atr': False, 'use_adx': False, 'use_ema': False, 'use_spike': True, 'rsi_required': False, 'edge_k': 0.11723677862416458, 'edge_cap': 0.551474553948313, 'bull_strategy': 'breakout', 'bull_bb_std_mult': 2.245306033119012, 'bull_rsi_os': 54, 'bull_rsi_ob': 54, 'bull_adx_thresh': 24.984241754378754, 'bull_atr_min_pct': 0.028385013526819578, 'bull_atr_max_pct': 0.03365479124252112, 'bull_tp_mult': 2.138547776325099, 'bull_tsl_mult': 0.982339095888021, 'bull_time_stop': 208, 'bull_use_sma': True, 'bull_use_ema': False, 'bull_use_atr': False, 'bull_use_adx': False, 'bull_use_spike': True, 'bull_rsi_required': True, 'bear_strategy': 'breakout', 'bear_bb_std_mult': 1.178406200347623, 'bear_rsi_os': 45, 'bear_rsi_ob': 79, 'bear_adx_thresh': 14.018113007097723, 'bear_atr_min_pct': 0.016928246049150237, 'bear_atr_max_pct': 0.07699742561382684, 'bear_tp_mult': 2.216056704673254, 'bear_tsl_mult': 0.14571458952359667, 'bear_time_stop': 256, 'bear_use_sma': True, 'bear_use_ema': False, 'bear_use_atr': True, 'bear_use_adx': True, 'bear_use_spike': False, 'bear_rsi_required': True, 'sideways_strategy': 'breakout', 'sideways_bb_std_mult': 1.886469769121523, 'sideways_rsi_os': 12, 'sideways_rsi_ob': 57, 'sideways_adx_thresh': 9.452309548960585, 'sideways_atr_min_pct': 0.01818671712462866, 'sideways_atr_max_pct': 0.02103091373955232, 'sideways_tp_mult': 1.8911709280521005, 'sideways_tsl_mult': 0.6876765115442035, 'sideways_time_stop': 115, 'sideways_use_sma': False, 'sideways_use_ema': True, 'sideways_use_atr': False, 'sideways_use_adx': False, 'sideways_use_spike': False, 'sideways_rsi_required': True}.
[I 2025-08-30 19:45:36,179] Trial 527 finished with values: [-1000000000.0, 1000000000.0] and parameters: {'p_sma': 41, 'p_std': 28, 'p_atr': 10, 'p_adx': 8, 'rsi_period': 48, 'ema1': 7, 'ema2': 18, 'slip_atr_k': 0.014529397988321844, 'slip_spread_k': 0.9480424713483717, 'spread_hl_frac': 0.023891475947386408, 'bb_std_mult': 1.0452526375167432, 'rsi_os': 17, 'rsi_ob': 57, 'vol_spike': 0.05543174164173162, 'adx_thresh': 31.352283466235768, 'atr_min_pct': 0.0140267112431329, 'atr_max_pct': 0.12855291903793656, 'tp_mult': 2.290551255214871, 'tsl_mult': 0.07277875932739641, 'strategy': 'breakout', 'time_stop': 18, 'use_sma': False, 'use_atr': False, 'use_adx': False, 'use_ema': True, 'use_spike': False, 'rsi_required': False, 'edge_k': 0.6560633774008731, 'edge_cap': 0.28223546871694366, 'bull_strategy': 'breakout', 'bull_bb_std_mult': 2.0677513363360607, 'bull_rsi_os': 42, 'bull_rsi_ob': 54, 'bull_adx_thresh': 31.52348143328752, 'bull_atr_min_pct': 0.02327706820293984, 'bull_atr_max_pct': 0.03221876094638452, 'bull_tp_mult': 2.121779923056144, 'bull_tsl_mult': 0.9844184706489263, 'bull_time_stop': 173, 'bull_use_sma': True, 'bull_use_ema': True, 'bull_use_atr': True, 'bull_use_adx': False, 'bull_use_spike': True, 'bull_rsi_required': True, 'bear_strategy': 'breakout', 'bear_bb_std_mult': 1.7753962986453546, 'bear_rsi_os': 22, 'bear_rsi_ob': 80, 'bear_adx_thresh': 5.972259298814475, 'bear_atr_min_pct': 0.009623915761197775, 'bear_atr_max_pct': 0.05131309987409631, 'bear_tp_mult': 1.744210413269355, 'bear_tsl_mult': 0.1505514047671183, 'bear_time_stop': 44, 'bear_use_sma': True, 'bear_use_ema': False, 'bear_use_atr': True, 'bear_use_adx': True, 'bear_use_spike': False, 'bear_rsi_required': True, 'sideways_strategy': 'breakout', 'sideways_bb_std_mult': 0.9568421934865587, 'sideways_rsi_os': 12, 'sideways_rsi_ob': 57, 'sideways_adx_thresh': 14.506136762299027, 'sideways_atr_min_pct': 0.01823557754673645, 'sideways_atr_max_pct': 0.053429248225362456, 'sideways_tp_mult': 1.7584712746875657, 'sideways_tsl_mult': 0.6431898134174368, 'sideways_time_stop': 163, 'sideways_use_sma': False, 'sideways_use_ema': True, 'sideways_use_atr': False, 'sideways_use_adx': False, 'sideways_use_spike': False, 'sideways_rsi_required': True}.
[I 2025-08-30 19:45:36,763] Trial 528 finished with values: [-1000000000.0, 1000000000.0] and parameters: {'p_sma': 41, 'p_std': 28, 'p_atr': 10, 'p_adx': 8, 'rsi_period': 21, 'ema1': 8, 'ema2': 37, 'slip_atr_k': 0.01535923955767269, 'slip_spread_k': 0.9719700507411216, 'spread_hl_frac': 0.0059682223188073326, 'bb_std_mult': 1.0555288272141468, 'rsi_os': 35, 'rsi_ob': 58, 'vol_spike': 0.1084339385407124, 'adx_thresh': 24.689208295470856, 'atr_min_pct': 0.02821893797640528, 'atr_max_pct': 0.039413867210089264, 'tp_mult': 2.2964174636243357, 'tsl_mult': 0.735007430586652, 'strategy': 'breakout', 'time_stop': 36, 'use_sma': False, 'use_atr': False, 'use_adx': False, 'use_ema': True, 'use_spike': False, 'rsi_required': False, 'edge_k': 1.8444764579878008, 'edge_cap': 0.2768090774174108, 'bull_strategy': 'breakout', 'bull_bb_std_mult': 2.0594913063926183, 'bull_rsi_os': 46, 'bull_rsi_ob': 54, 'bull_adx_thresh': 25.508724403132682, 'bull_atr_min_pct': 0.0030110095594288733, 'bull_atr_max_pct': 0.11811708881596064, 'bull_tp_mult': 2.9894300443090844, 'bull_tsl_mult': 0.20200434828525177, 'bull_time_stop': 173, 'bull_use_sma': True, 'bull_use_ema': True, 'bull_use_atr': True, 'bull_use_adx': False, 'bull_use_spike': True, 'bull_rsi_required': True, 'bear_strategy': 'breakout', 'bear_bb_std_mult': 2.995683595487833, 'bear_rsi_os': 44, 'bear_rsi_ob': 84, 'bear_adx_thresh': 14.39991859037577, 'bear_atr_min_pct': 0.016882805055102496, 'bear_atr_max_pct': 0.03662223764254676, 'bear_tp_mult': 2.2451059271173857, 'bear_tsl_mult': 0.14701817832928876, 'bear_time_stop': 43, 'bear_use_sma': True, 'bear_use_ema': False, 'bear_use_atr': True, 'bear_use_adx': True, 'bear_use_spike': False, 'bear_rsi_required': True, 'sideways_strategy': 'breakout', 'sideways_bb_std_mult': 2.2608675980197974, 'sideways_rsi_os': 12, 'sideways_rsi_ob': 56, 'sideways_adx_thresh': 5.060690976064318, 'sideways_atr_min_pct': 0.013077593702476012, 'sideways_atr_max_pct': 0.020077589442187772, 'sideways_tp_mult': 1.7269105790502204, 'sideways_tsl_mult': 0.6844483510425065, 'sideways_time_stop': 276, 'sideways_use_sma': False, 'sideways_use_ema': True, 'sideways_use_atr': False, 'sideways_use_adx': False, 'sideways_use_spike': False, 'sideways_rsi_required': True}.
[I 2025-08-30 19:45:37,031] Trial 529 finished with values: [-1000000000.0, 1000000000.0] and parameters: {'p_sma': 39, 'p_std': 27, 'p_atr': 10, 'p_adx': 29, 'rsi_period': 48, 'ema1': 8, 'ema2': 28, 'slip_atr_k': 0.014042841440718497, 'slip_spread_k': 0.2215194921728585, 'spread_hl_frac': 0.006030770414845453, 'bb_std_mult': 1.0693668838026213, 'rsi_os': 23, 'rsi_ob': 57, 'vol_spike': 0.03616883734489362, 'adx_thresh': 29.80331617665685, 'atr_min_pct': 0.013843734314266071, 'atr_max_pct': 0.0397116916421582, 'tp_mult': 2.187301692727715, 'tsl_mult': 0.24868202007625817, 'strategy': 'breakout', 'time_stop': 36, 'use_sma': False, 'use_atr': False, 'use_adx': False, 'use_ema': True, 'use_spike': False, 'rsi_required': False, 'edge_k': 0.12149836772204516, 'edge_cap': 0.8840715323539942, 'bull_strategy': 'breakout', 'bull_bb_std_mult': 1.995640573955654, 'bull_rsi_os': 53, 'bull_rsi_ob': 70, 'bull_adx_thresh': 25.443523633445796, 'bull_atr_min_pct': 0.0028141478550350496, 'bull_atr_max_pct': 0.031427981880093825, 'bull_tp_mult': 2.755053793607308, 'bull_tsl_mult': 0.985007311959366, 'bull_time_stop': 23, 'bull_use_sma': True, 'bull_use_ema': True, 'bull_use_atr': True, 'bull_use_adx': True, 'bull_use_spike': True, 'bull_rsi_required': True, 'bear_strategy': 'breakout', 'bear_bb_std_mult': 1.768544124154136, 'bear_rsi_os': 22, 'bear_rsi_ob': 80, 'bear_adx_thresh': 6.029512726210268, 'bear_atr_min_pct': 0.011185355816273031, 'bear_atr_max_pct': 0.09712336214960783, 'bear_tp_mult': 1.7356613070959517, 'bear_tsl_mult': 0.07992263987529835, 'bear_time_stop': 44, 'bear_use_sma': True, 'bear_use_ema': False, 'bear_use_atr': True, 'bear_use_adx': True, 'bear_use_spike': False, 'bear_rsi_required': False, 'sideways_strategy': 'breakout', 'sideways_bb_std_mult': 2.969263471546843, 'sideways_rsi_os': 12, 'sideways_rsi_ob': 57, 'sideways_adx_thresh': 9.471965619801269, 'sideways_atr_min_pct': 0.013581242129594523, 'sideways_atr_max_pct': 0.12289590930995517, 'sideways_tp_mult': 2.5637845763335014, 'sideways_tsl_mult': 0.8199389496816085, 'sideways_time_stop': 114, 'sideways_use_sma': False, 'sideways_use_ema': True, 'sideways_use_atr': False, 'sideways_use_adx': False, 'sideways_use_spike': False, 'sideways_rsi_required': True}.
[I 2025-08-30 19:46:11,339] Trial 532 finished with values: [-1000000000.0, 1000000000.0] and parameters: {'p_sma': 39, 'p_std': 27, 'p_atr': 26, 'p_adx': 9, 'rsi_period': 52, 'ema1': 23, 'ema2': 19, 'slip_atr_k': 0.08707112925949023, 'slip_spread_k': 0.42430290985885605, 'spread_hl_frac': 0.02772594837111988, 'bb_std_mult': 0.9209760177129235, 'rsi_os': 39, 'rsi_ob': 81, 'vol_spike': 0.036964280158651545, 'adx_thresh': 18.59165504435183, 'atr_min_pct': 0.004810839851032039, 'atr_max_pct': 0.09160431344036876, 'tp_mult': 2.1914101611624512, 'tsl_mult': 0.2271470891172393, 'strategy': 'breakout', 'time_stop': 181, 'use_sma': False, 'use_atr': True, 'use_adx': True, 'use_ema': False, 'use_spike': True, 'rsi_required': True, 'edge_k': 1.3623794738064547, 'edge_cap': 0.8887614279493217, 'bull_strategy': 'mean_reversion', 'bull_bb_std_mult': 1.964205613688266, 'bull_rsi_os': 28, 'bull_rsi_ob': 71, 'bull_adx_thresh': 27.25913901771391, 'bull_atr_min_pct': 0.016088751651087533, 'bull_atr_max_pct': 0.025153284758018365, 'bull_tp_mult': 1.4674294098826157, 'bull_tsl_mult': 0.305318160543387, 'bull_time_stop': 183, 'bull_use_sma': True, 'bull_use_ema': False, 'bull_use_atr': False, 'bull_use_adx': True, 'bull_use_spike': True, 'bull_rsi_required': True, 'bear_strategy': 'breakout', 'bear_bb_std_mult': 2.9114967744961096, 'bear_rsi_os': 51, 'bear_rsi_ob': 88, 'bear_adx_thresh': 6.045687312003849, 'bear_atr_min_pct': 0.004377353700611099, 'bear_atr_max_pct': 0.053689457223749265, 'bear_tp_mult': 2.479904275833073, 'bear_tsl_mult': 0.08532508258790239, 'bear_time_stop': 242, 'bear_use_sma': True, 'bear_use_ema': False, 'bear_use_atr': True, 'bear_use_adx': True, 'bear_use_spike': False, 'bear_rsi_required': False, 'sideways_strategy': 'breakout', 'sideways_bb_std_mult': 2.028019897669774, 'sideways_rsi_os': 21, 'sideways_rsi_ob': 68, 'sideways_adx_thresh': 11.706377966569129, 'sideways_atr_min_pct': 0.019243990700326705, 'sideways_atr_max_pct': 0.013903368097852378, 'sideways_tp_mult': 1.811569597427417, 'sideways_tsl_mult': 0.7748924541427804, 'sideways_time_stop': 292, 'sideways_use_sma': True, 'sideways_use_ema': True, 'sideways_use_atr': True, 'sideways_use_adx': False, 'sideways_use_spike': False, 'sideways_rsi_required': False}.
