[I 2025-08-30 19:23:52,957] Trial 372 finished with values: [-1000000000.0, 1000000000.0] and parameters: {'p_sma': 10, 'p_std': 54, 'p_atr': 15, 'p_adx': 23, 'rsi_period': 41, 'ema1': 23, 'ema2': 36, 'slip_atr_k': 0.24466639507453725, 'slip_spread_k': 0.43242872446910385, 'spread_hl_frac': 0.0037364103170133755, 'bb_std_mult': 3.073510305160501, 'rsi_os': 39, 'rsi_ob': 86, 'vol_spike': 0.037145101752268705, 'adx_thresh': 25.208344707920183, 'atr_min_pct': 0.01977579259430362, 'atr_max_pct': 0.10488968985833741, 'tp_mult': 2.0472544120314344, 'tsl_mult': 0.8356896353808037, 'strategy': 'mean_reversion', 'time_stop': 66, 'use_sma': False, 'use_atr': False, 'use_adx': True, 'use_ema': True, 'use_spike': False, 'rsi_required': True, 'edge_k': 0.9974510588251876, 'edge_cap': 0.5093979689650169, 'bull_strategy': 'breakout', 'bull_bb_std_mult': 1.9058361440960274, 'bull_rsi_os': 48, 'bull_rsi_ob': 72, 'bull_adx_thresh': 25.09989958698325, 'bull_atr_min_pct': 0.003342381169577031, 'bull_atr_max_pct': 0.030665687040348225, 'bull_tp_mult': 2.198304632159673, 'bull_tsl_mult': 0.9825815893655115, 'bull_time_stop': 249, 'bull_use_sma': False, 'bull_use_ema': True, 'bull_use_atr': False, 'bull_use_adx': False, 'bull_use_spike': False, 'bull_rsi_required': False, 'bear_strategy': 'mean_reversion', 'bear_bb_std_mult': 3.1769710195653653, 'bear_rsi_os': 44, 'bear_rsi_ob': 85, 'bear_adx_thresh': 5.014727901831538, 'bear_atr_min_pct': 0.02389975718809601, 'bear_atr_max_pct': 0.06245259273304089, 'bear_tp_mult': 2.1593136480575823, 'bear_tsl_mult': 0.10824012358572792, 'bear_time_stop': 85, 'bear_use_sma': True, 'bear_use_ema': False, 'bear_use_atr': False, 'bear_use_adx': False, 'bear_use_spike': True, 'bear_rsi_required': True, 'sideways_strategy': 'breakout', 'sideways_bb_std_mult': 2.0123405438357245, 'sideways_rsi_os': 16, 'sideways_rsi_ob': 58, 'sideways_adx_thresh': 5.777889183433301, 'sideways_atr_min_pct': 0.013657152850735526, 'sideways_atr_max_pct': 0.1392183091239247, 'sideways_tp_mult': 1.8835153854821831, 'sideways_tsl_mult': 0.6708434830979788, 'sideways_time_stop': 279, 'sideways_use_sma': False, 'sideways_use_ema': False, 'sideways_use_atr': True, 'sideways_use_adx': True, 'sideways_use_spike': False, 'sideways_rsi_required': True}.
[I 2025-08-30 19:23:52,969] Trial 371 finished with values: [-1000000000.0, 1000000000.0] and parameters: {'p_sma': 43, 'p_std': 28, 'p_atr': 8, 'p_adx': 9, 'rsi_period': 61, 'ema1': 24, 'ema2': 16, 'slip_atr_k': 0.24285766788354418, 'slip_spread_k': 0.36818788471392494, 'spread_hl_frac': 0.00912148177861911, 'bb_std_mult': 1.062318000553487, 'rsi_os': 16, 'rsi_ob': 59, 'vol_spike': 0.14621906728155404, 'adx_thresh': 25.304305409263577, 'atr_min_pct': 0.01950351671573403, 'atr_max_pct': 0.10414819893145225, 'tp_mult': 2.4100963490931715, 'tsl_mult': 0.44849192386170683, 'strategy': 'mean_reversion', 'time_stop': 53, 'use_sma': False, 'use_atr': True, 'use_adx': True, 'use_ema': True, 'use_spike': True, 'rsi_required': True, 'edge_k': 0.6420742646626696, 'edge_cap': 0.20649682230223299, 'bull_strategy': 'breakout', 'bull_bb_std_mult': 1.4244917873614038, 'bull_rsi_os': 46, 'bull_rsi_ob': 78, 'bull_adx_thresh': 25.268327814052917, 'bull_atr_min_pct': 0.003448022721728698, 'bull_atr_max_pct': 0.013603191172262427, 'bull_tp_mult': 2.5223208129034838, 'bull_tsl_mult': 0.9351513210796454, 'bull_time_stop': 249, 'bull_use_sma': False, 'bull_use_ema': True, 'bull_use_atr': False, 'bull_use_adx': False, 'bull_use_spike': False, 'bull_rsi_required': False, 'bear_strategy': 'mean_reversion', 'bear_bb_std_mult': 1.8154268673873533, 'bear_rsi_os': 12, 'bear_rsi_ob': 79, 'bear_adx_thresh': 5.778972358820547, 'bear_atr_min_pct': 0.01541604056531458, 'bear_atr_max_pct': 0.07280908071709415, 'bear_tp_mult': 1.1434802757457925, 'bear_tsl_mult': 0.6608125129462419, 'bear_time_stop': 45, 'bear_use_sma': True, 'bear_use_ema': False, 'bear_use_atr': False, 'bear_use_adx': False, 'bear_use_spike': True, 'bear_rsi_required': True, 'sideways_strategy': 'mean_reversion', 'sideways_bb_std_mult': 2.049306597364988, 'sideways_rsi_os': 44, 'sideways_rsi_ob': 59, 'sideways_adx_thresh': 9.749720430858847, 'sideways_atr_min_pct': 0.013020898242026114, 'sideways_atr_max_pct': 0.023070255748721097, 'sideways_tp_mult': 1.8743790480909135, 'sideways_tsl_mult': 0.34522141502309356, 'sideways_time_stop': 80, 'sideways_use_sma': False, 'sideways_use_ema': False, 'sideways_use_atr': False, 'sideways_use_adx': True, 'sideways_use_spike': False, 'sideways_rsi_required': False}.
[I 2025-08-30 19:23:53,384] Trial 370 finished with values: [-1000000000.0, 1000000000.0] and parameters: {'p_sma': 43, 'p_std': 28, 'p_atr': 8, 'p_adx': 9, 'rsi_period': 49, 'ema1': 24, 'ema2': 16, 'slip_atr_k': 0.014972425098672547, 'slip_spread_k': 0.6996349308490302, 'spread_hl_frac': 0.0038648383455824552, 'bb_std_mult': 1.0620796791654985, 'rsi_os': 44, 'rsi_ob': 58, 'vol_spike': 0.03938414939369773, 'adx_thresh': 17.623726452848132, 'atr_min_pct': 0.013676123227755521, 'atr_max_pct': 0.04455352240886672, 'tp_mult': 2.3066576944110078, 'tsl_mult': 0.4481311211764354, 'strategy': 'mean_reversion', 'time_stop': 21, 'use_sma': False, 'use_atr': True, 'use_adx': True, 'use_ema': True, 'use_spike': True, 'rsi_required': True, 'edge_k': 0.6391399578445291, 'edge_cap': 0.20956258555061674, 'bull_strategy': 'breakout', 'bull_bb_std_mult': 1.9115446324382557, 'bull_rsi_os': 46, 'bull_rsi_ob': 61, 'bull_adx_thresh': 25.004398506771224, 'bull_atr_min_pct': 0.003140618618203094, 'bull_atr_max_pct': 0.03574663065367147, 'bull_tp_mult': 2.183670324193086, 'bull_tsl_mult': 0.9427585102532126, 'bull_time_stop': 251, 'bull_use_sma': False, 'bull_use_ema': True, 'bull_use_atr': False, 'bull_use_adx': False, 'bull_use_spike': False, 'bull_rsi_required': False, 'bear_strategy': 'mean_reversion', 'bear_bb_std_mult': 3.2258468552596797, 'bear_rsi_os': 44, 'bear_rsi_ob': 79, 'bear_adx_thresh': 29.827063171151863, 'bear_atr_min_pct': 0.0033045908214678153, 'bear_atr_max_pct': 0.06161238530289416, 'bear_tp_mult': 1.1367058499191787, 'bear_tsl_mult': 0.33987915257609547, 'bear_time_stop': 30, 'bear_use_sma': True, 'bear_use_ema': False, 'bear_use_atr': False, 'bear_use_adx': False, 'bear_use_spike': True, 'bear_rsi_required': True, 'sideways_strategy': 'mean_reversion', 'sideways_bb_std_mult': 2.0606685222709564, 'sideways_rsi_os': 16, 'sideways_rsi_ob': 59, 'sideways_adx_thresh': 9.480651981677651, 'sideways_atr_min_pct': 0.01330826388675689, 'sideways_atr_max_pct': 0.07315905746965375, 'sideways_tp_mult': 2.1840526796219564, 'sideways_tsl_mult': 0.40189148306861033, 'sideways_time_stop': 275, 'sideways_use_sma': False, 'sideways_use_ema': False, 'sideways_use_atr': False, 'sideways_use_adx': True, 'sideways_use_spike': False, 'sideways_rsi_required': False}.
[I 2025-08-30 19:23:53,794] Trial 369 finished with values: [-1000000000.0, 1000000000.0] and parameters: {'p_sma': 45, 'p_std': 23, 'p_atr': 8, 'p_adx': 9, 'rsi_period': 32, 'ema1': 24, 'ema2': 18, 'slip_atr_k': 0.017516081468503093, 'slip_spread_k': 0.3752678461179353, 'spread_hl_frac': 0.003334986117566748, 'bb_std_mult': 1.066612217908973, 'rsi_os': 41, 'rsi_ob': 67, 'vol_spike': 0.147658878240198, 'adx_thresh': 20.332078775619987, 'atr_min_pct': 0.013606229584333714, 'atr_max_pct': 0.1428435496628263, 'tp_mult': 2.2029411309664413, 'tsl_mult': 0.8191477660674253, 'strategy': 'breakout', 'time_stop': 51, 'use_sma': False, 'use_atr': True, 'use_adx': True, 'use_ema': False, 'use_spike': True, 'rsi_required': True, 'edge_k': 0.14895229862805245, 'edge_cap': 0.20648270273427555, 'bull_strategy': 'breakout', 'bull_bb_std_mult': 3.171059312151515, 'bull_rsi_os': 38, 'bull_rsi_ob': 73, 'bull_adx_thresh': 25.08376793785151, 'bull_atr_min_pct': 0.0030028574446778825, 'bull_atr_max_pct': 0.08393023626257576, 'bull_tp_mult': 1.9401086065864994, 'bull_tsl_mult': 0.9379158077366714, 'bull_time_stop': 247, 'bull_use_sma': True, 'bull_use_ema': False, 'bull_use_atr': False, 'bull_use_adx': False, 'bull_use_spike': True, 'bull_rsi_required': True, 'bear_strategy': 'breakout', 'bear_bb_std_mult': 3.22883437373912, 'bear_rsi_os': 44, 'bear_rsi_ob': 85, 'bear_adx_thresh': 30.3725910019049, 'bear_atr_min_pct': 0.0153998100153916, 'bear_atr_max_pct': 0.01443356223447484, 'bear_tp_mult': 2.0776328729285436, 'bear_tsl_mult': 0.16936314741150363, 'bear_time_stop': 29, 'bear_use_sma': True, 'bear_use_ema': False, 'bear_use_atr': True, 'bear_use_adx': True, 'bear_use_spike': True, 'bear_rsi_required': False, 'sideways_strategy': 'breakout', 'sideways_bb_std_mult': 2.0586626441456786, 'sideways_rsi_os': 34, 'sideways_rsi_ob': 86, 'sideways_adx_thresh': 26.85397324364644, 'sideways_atr_min_pct': 0.019819349329377837, 'sideways_atr_max_pct': 0.03643778293393044, 'sideways_tp_mult': 1.8441594946774016, 'sideways_tsl_mult': 0.6586522192758452, 'sideways_time_stop': 237, 'sideways_use_sma': True, 'sideways_use_ema': True, 'sideways_use_atr': False, 'sideways_use_adx': False, 'sideways_use_spike': False, 'sideways_rsi_required': False}.
[I 2025-08-30 19:24:28,817] Trial 373 finished with values: [-1000000000.0, 1000000000.0] and parameters: {'p_sma': 23, 'p_std': 27, 'p_atr': 11, 'p_adx': 27, 'rsi_period': 49, 'ema1': 20, 'ema2': 27, 'slip_atr_k': 0.20534310629374797, 'slip_spread_k': 0.42124238343214904, 'spread_hl_frac': 0.001700742218382574, 'bb_std_mult': 2.1131446872850796, 'rsi_os': 45, 'rsi_ob': 58, 'vol_spike': 0.027874176926344047, 'adx_thresh': 17.83620863477266, 'atr_min_pct': 0.02598826683941534, 'atr_max_pct': 0.057277730493488756, 'tp_mult': 2.1926210475433856, 'tsl_mult': 0.624678420583774, 'strategy': 'breakout', 'time_stop': 162, 'use_sma': True, 'use_atr': True, 'use_adx': False, 'use_ema': False, 'use_spike': True, 'rsi_required': False, 'edge_k': 0.14456162395307964, 'edge_cap': 0.46310396563748557, 'bull_strategy': 'mean_reversion', 'bull_bb_std_mult': 0.9578170889220139, 'bull_rsi_os': 38, 'bull_rsi_ob': 75, 'bull_adx_thresh': 26.31853634460042, 'bull_atr_min_pct': 0.020365353404568177, 'bull_atr_max_pct': 0.02443873637161315, 'bull_tp_mult': 2.143800869873302, 'bull_tsl_mult': 0.9991348135305007, 'bull_time_stop': 49, 'bull_use_sma': True, 'bull_use_ema': False, 'bull_use_atr': False, 'bull_use_adx': True, 'bull_use_spike': True, 'bull_rsi_required': True, 'bear_strategy': 'breakout', 'bear_bb_std_mult': 3.2487038893385365, 'bear_rsi_os': 53, 'bear_rsi_ob': 83, 'bear_adx_thresh': 15.316846956851508, 'bear_atr_min_pct': 0.016065591155251892, 'bear_atr_max_pct': 0.05949514256701148, 'bear_tp_mult': 2.9362093013174317, 'bear_tsl_mult': 0.1813386013387609, 'bear_time_stop': 28, 'bear_use_sma': False, 'bear_use_ema': False, 'bear_use_atr': True, 'bear_use_adx': True, 'bear_use_spike': False, 'bear_rsi_required': False, 'sideways_strategy': 'breakout', 'sideways_bb_std_mult': 2.2098060504294534, 'sideways_rsi_os': 14, 'sideways_rsi_ob': 67, 'sideways_adx_thresh': 26.78137133484723, 'sideways_atr_min_pct': 0.011865499423964913, 'sideways_atr_max_pct': 0.12542896162679934, 'sideways_tp_mult': 1.397999840290075, 'sideways_tsl_mult': 0.6845792123223448, 'sideways_time_stop': 262, 'sideways_use_sma': True, 'sideways_use_ema': True, 'sideways_use_atr': False, 'sideways_use_adx': False, 'sideways_use_spike': False, 'sideways_rsi_required': False}.
[I 2025-08-30 19:24:29,450] Trial 376 finished with values: [-0.02460017095423539, 0.024557331249091468] and parameters: {'p_sma': 38, 'p_std': 27, 'p_atr': 11, 'p_adx': 13, 'rsi_period': 55, 'ema1': 15, 'ema2': 27, 'slip_atr_k': 0.09210063339390191, 'slip_spread_k': 0.41979432104228837, 'spread_hl_frac': 0.018349925006190714, 'bb_std_mult': 1.5914065986574832, 'rsi_os': 8, 'rsi_ob': 54, 'vol_spike': 0.031273092708667224, 'adx_thresh': 19.188223253792493, 'atr_min_pct': 0.02588874175200684, 'atr_max_pct': 0.14627683725236915, 'tp_mult': 1.82222504235837, 'tsl_mult': 0.7302424398968281, 'strategy': 'breakout', 'time_stop': 37, 'use_sma': True, 'use_atr': False, 'use_adx': False, 'use_ema': False, 'use_spike': False, 'rsi_required': False, 'edge_k': 1.7116897943850908, 'edge_cap': 0.4683126979964227, 'bull_strategy': 'mean_reversion', 'bull_bb_std_mult': 0.6466179888097421, 'bull_rsi_os': 53, 'bull_rsi_ob': 67, 'bull_adx_thresh': 26.369053790418462, 'bull_atr_min_pct': 0.001462323844720408, 'bull_atr_max_pct': 0.025227662295381977, 'bull_tp_mult': 2.1342349356767985, 'bull_tsl_mult': 0.6850329894921856, 'bull_time_stop': 49, 'bull_use_sma': True, 'bull_use_ema': False, 'bull_use_atr': False, 'bull_use_adx': True, 'bull_use_spike': True, 'bull_rsi_required': True, 'bear_strategy': 'breakout', 'bear_bb_std_mult': 2.945473750664959, 'bear_rsi_os': 47, 'bear_rsi_ob': 84, 'bear_adx_thresh': 6.056472263248366, 'bear_atr_min_pct': 0.01608594200869722, 'bear_atr_max_pct': 0.11294668875127865, 'bear_tp_mult': 1.7257107091604593, 'bear_tsl_mult': 0.21203453996979238, 'bear_time_stop': 142, 'bear_use_sma': False, 'bear_use_ema': False, 'bear_use_atr': True, 'bear_use_adx': True, 'bear_use_spike': False, 'bear_rsi_required': False, 'sideways_strategy': 'breakout', 'sideways_bb_std_mult': 2.9360882518344957, 'sideways_rsi_os': 15, 'sideways_rsi_ob': 54, 'sideways_adx_thresh': 16.86235035201001, 'sideways_atr_min_pct': 0.011472731966988921, 'sideways_atr_max_pct': 0.1256123682018181, 'sideways_tp_mult': 1.9895077037853952, 'sideways_tsl_mult': 0.6826464606470951, 'sideways_time_stop': 23, 'sideways_use_sma': True, 'sideways_use_ema': True, 'sideways_use_atr': True, 'sideways_use_adx': False, 'sideways_use_spike': False, 'sideways_rsi_required': True}.
[I 2025-08-30 19:24:29,450] Trial 374 finished with values: [-0.02346060204719891, 0.023363286604574676] and parameters: {'p_sma': 42, 'p_std': 27, 'p_atr': 11, 'p_adx': 8, 'rsi_period': 49, 'ema1': 13, 'ema2': 18, 'slip_atr_k': 0.016498314434777638, 'slip_spread_k': 0.5509534238621516, 'spread_hl_frac': 0.0002285418092014685, 'bb_std_mult': 1.5471169724493188, 'rsi_os': 20, 'rsi_ob': 58, 'vol_spike': 0.20058790892556366, 'adx_thresh': 17.58548148988029, 'atr_min_pct': 0.02065973058153584, 'atr_max_pct': 0.05928953541852246, 'tp_mult': 2.318209007891986, 'tsl_mult': 0.7290140563786408, 'strategy': 'breakout', 'time_stop': 36, 'use_sma': True, 'use_atr': True, 'use_adx': False, 'use_ema': False, 'use_spike': True, 'rsi_required': False, 'edge_k': 0.279837983515844, 'edge_cap': 0.46150062282833115, 'bull_strategy': 'mean_reversion', 'bull_bb_std_mult': 1.8612861751208811, 'bull_rsi_os': 18, 'bull_rsi_ob': 48, 'bull_adx_thresh': 26.542772261298815, 'bull_atr_min_pct': 0.0013849063986304336, 'bull_atr_max_pct': 0.024248530893255377, 'bull_tp_mult': 1.0944448116400518, 'bull_tsl_mult': 0.9994282108692659, 'bull_time_stop': 292, 'bull_use_sma': True, 'bull_use_ema': False, 'bull_use_atr': False, 'bull_use_adx': True, 'bull_use_spike': True, 'bull_rsi_required': True, 'bear_strategy': 'breakout', 'bear_bb_std_mult': 0.8188658664002246, 'bear_rsi_os': 46, 'bear_rsi_ob': 47, 'bear_adx_thresh': 15.311153650719667, 'bear_atr_min_pct': 0.016249561030542484, 'bear_atr_max_pct': 0.11291114653522871, 'bear_tp_mult': 2.7341273049299994, 'bear_tsl_mult': 0.18317629812018854, 'bear_time_stop': 140, 'bear_use_sma': False, 'bear_use_ema': False, 'bear_use_atr': True, 'bear_use_adx': True, 'bear_use_spike': False, 'bear_rsi_required': False, 'sideways_strategy': 'breakout', 'sideways_bb_std_mult': 1.871708739789036, 'sideways_rsi_os': 15, 'sideways_rsi_ob': 80, 'sideways_adx_thresh': 16.87299935035976, 'sideways_atr_min_pct': 0.019493756774330472, 'sideways_atr_max_pct': 0.056909238759915215, 'sideways_tp_mult': 1.7927441611753443, 'sideways_tsl_mult': 0.00010128629390637744, 'sideways_time_stop': 262, 'sideways_use_sma': True, 'sideways_use_ema': True, 'sideways_use_atr': False, 'sideways_use_adx': False, 'sideways_use_spike': False, 'sideways_rsi_required': False}.
[I 2025-08-30 19:24:29,581] Trial 375 finished with values: [-1000000000.0, 1000000000.0] and parameters: {'p_sma': 38, 'p_std': 48, 'p_atr': 25, 'p_adx': 18, 'rsi_period': 55, 'ema1': 20, 'ema2': 18, 'slip_atr_k': 0.1811516160711886, 'slip_spread_k': 0.5420469095454816, 'spread_hl_frac': 0.001442538506197915, 'bb_std_mult': 0.856864148168658, 'rsi_os': 20, 'rsi_ob': 67, 'vol_spike': 0.028238200536989083, 'adx_thresh': 13.943846693101534, 'atr_min_pct': 0.004417943573640115, 'atr_max_pct': 0.14701802196192798, 'tp_mult': 1.3516760323590824, 'tsl_mult': 0.7358307601391039, 'strategy': 'breakout', 'time_stop': 108, 'use_sma': True, 'use_atr': False, 'use_adx': False, 'use_ema': False, 'use_spike': True, 'rsi_required': False, 'edge_k': 0.1454780256781937, 'edge_cap': 0.4648986898086567, 'bull_strategy': 'mean_reversion', 'bull_bb_std_mult': 0.9885008270152369, 'bull_rsi_os': 49, 'bull_rsi_ob': 48, 'bull_adx_thresh': 26.540815978929682, 'bull_atr_min_pct': 0.001166147345632966, 'bull_atr_max_pct': 0.02446771970980649, 'bull_tp_mult': 1.9504490688871654, 'bull_tsl_mult': 0.9699652868766339, 'bull_time_stop': 198, 'bull_use_sma': True, 'bull_use_ema': False, 'bull_use_atr': False, 'bull_use_adx': True, 'bull_use_spike': True, 'bull_rsi_required': True, 'bear_strategy': 'breakout', 'bear_bb_std_mult': 2.9850405682995174, 'bear_rsi_os': 46, 'bear_rsi_ob': 84, 'bear_adx_thresh': 6.038232108052633, 'bear_atr_min_pct': 0.01601039435353498, 'bear_atr_max_pct': 0.05641692774520142, 'bear_tp_mult': 2.062083773634037, 'bear_tsl_mult': 0.5334578949432714, 'bear_time_stop': 270, 'bear_use_sma': False, 'bear_use_ema': False, 'bear_use_atr': True, 'bear_use_adx': True, 'bear_use_spike': False, 'bear_rsi_required': False, 'sideways_strategy': 'breakout', 'sideways_bb_std_mult': 1.5418330316830735, 'sideways_rsi_os': 39, 'sideways_rsi_ob': 54, 'sideways_adx_thresh': 16.741163377066105, 'sideways_atr_min_pct': 0.02464585627198683, 'sideways_atr_max_pct': 0.1265372484512711, 'sideways_tp_mult': 2.0066974239500714, 'sideways_tsl_mult': 0.6801606879848611, 'sideways_time_stop': 226, 'sideways_use_sma': True, 'sideways_use_ema': True, 'sideways_use_atr': False, 'sideways_use_adx': False, 'sideways_use_spike': False, 'sideways_rsi_required': True}.
[I 2025-08-30 19:25:04,161] Trial 377 finished with values: [-1000000000.0, 1000000000.0] and parameters: {'p_sma': 42, 'p_std': 26, 'p_atr': 9, 'p_adx': 8, 'rsi_period': 56, 'ema1': 25, 'ema2': 46, 'slip_atr_k': 0.09100107998660621, 'slip_spread_k': 0.5545773413730317, 'spread_hl_frac': 0.004795726024020652, 'bb_std_mult': 0.8897330056511803, 'rsi_os': 11, 'rsi_ob': 57, 'vol_spike': 0.05480612507013946, 'adx_thresh': 19.254018688903567, 'atr_min_pct': 0.02076348416909293, 'atr_max_pct': 0.132902174635473, 'tp_mult': 2.115120165760509, 'tsl_mult': 0.7268264333514987, 'strategy': 'breakout', 'time_stop': 146, 'use_sma': True, 'use_atr': False, 'use_adx': False, 'use_ema': False, 'use_spike': False, 'rsi_required': False, 'edge_k': 0.2743974086327301, 'edge_cap': 0.2559099583024094, 'bull_strategy': 'mean_reversion', 'bull_bb_std_mult': 1.7253684893783694, 'bull_rsi_os': 52, 'bull_rsi_ob': 69, 'bull_adx_thresh': 23.417225019894516, 'bull_atr_min_pct': 0.004694006787736497, 'bull_atr_max_pct': 0.027867768779592746, 'bull_tp_mult': 2.1981587933411175, 'bull_tsl_mult': 0.9666325779341512, 'bull_time_stop': 273, 'bull_use_sma': True, 'bull_use_ema': False, 'bull_use_atr': False, 'bull_use_adx': True, 'bull_use_spike': True, 'bull_rsi_required': True, 'bear_strategy': 'breakout', 'bear_bb_std_mult': 2.94205790577392, 'bear_rsi_os': 47, 'bear_rsi_ob': 87, 'bear_adx_thresh': 6.054750280834206, 'bear_atr_min_pct': 0.011973704832767362, 'bear_atr_max_pct': 0.02677896888932685, 'bear_tp_mult': 1.722357019100016, 'bear_tsl_mult': 0.8655715356476539, 'bear_time_stop': 36, 'bear_use_sma': True, 'bear_use_ema': False, 'bear_use_atr': True, 'bear_use_adx': True, 'bear_use_spike': False, 'bear_rsi_required': False, 'sideways_strategy': 'breakout', 'sideways_bb_std_mult': 2.953897710687243, 'sideways_rsi_os': 18, 'sideways_rsi_ob': 54, 'sideways_adx_thresh': 16.695553965146285, 'sideways_atr_min_pct': 0.02464508038135871, 'sideways_atr_max_pct': 0.11398543985940124, 'sideways_tp_mult': 1.7910878035668363, 'sideways_tsl_mult': 0.9312647930315255, 'sideways_time_stop': 183, 'sideways_use_sma': True, 'sideways_use_ema': True, 'sideways_use_atr': True, 'sideways_use_adx': False, 'sideways_use_spike': False, 'sideways_rsi_required': True}.
