[I 2025-08-30 19:32:09,232] Trial 432 finished with values: [-1000000000.0, 1000000000.0] and parameters: {'p_sma': 20, 'p_std': 27, 'p_atr': 14, 'p_adx': 13, 'rsi_period': 55, 'ema1': 25, 'ema2': 19, 'slip_atr_k': 0.17665280709998177, 'slip_spread_k': 0.6315964735465975, 'spread_hl_frac': 0.004463965376276742, 'bb_std_mult': 1.0359603629714667, 'rsi_os': 36, 'rsi_ob': 53, 'vol_spike': 0.10790168305441092, 'adx_thresh': 20.908672916646687, 'atr_min_pct': 0.025986509184660497, 'atr_max_pct': 0.1320395192069868, 'tp_mult': 1.5504448313697043, 'tsl_mult': 0.18161101876869795, 'strategy': 'mean_reversion', 'time_stop': 54, 'use_sma': False, 'use_atr': False, 'use_adx': False, 'use_ema': False, 'use_spike': True, 'rsi_required': True, 'edge_k': 0.17117196526221173, 'edge_cap': 0.09629812927612719, 'bull_strategy': 'mean_reversion', 'bull_bb_std_mult': 1.2159016352193643, 'bull_rsi_os': 42, 'bull_rsi_ob': 74, 'bull_adx_thresh': 24.760611664606326, 'bull_atr_min_pct': 0.0023151054304438147, 'bull_atr_max_pct': 0.10745401599771637, 'bull_tp_mult': 2.1885965233561793, 'bull_tsl_mult': 0.4848190167027057, 'bull_time_stop': 191, 'bull_use_sma': True, 'bull_use_ema': False, 'bull_use_atr': False, 'bull_use_adx': True, 'bull_use_spike': True, 'bull_rsi_required': True, 'bear_strategy': 'breakout', 'bear_bb_std_mult': 3.2842198767674806, 'bear_rsi_os': 43, 'bear_rsi_ob': 84, 'bear_adx_thresh': 18.5345502164213, 'bear_atr_min_pct': 0.02771797997415238, 'bear_atr_max_pct': 0.05857791327404825, 'bear_tp_mult': 2.0243599284593157, 'bear_tsl_mult': 0.1731790900626215, 'bear_time_stop': 32, 'bear_use_sma': True, 'bear_use_ema': False, 'bear_use_atr': True, 'bear_use_adx': True, 'bear_use_spike': False, 'bear_rsi_required': False, 'sideways_strategy': 'mean_reversion', 'sideways_bb_std_mult': 3.372533371047598, 'sideways_rsi_os': 24, 'sideways_rsi_ob': 95, 'sideways_adx_thresh': 9.400309918642474, 'sideways_atr_min_pct': 0.01602774572056517, 'sideways_atr_max_pct': 0.08262225696960852, 'sideways_tp_mult': 2.4391625280317455, 'sideways_tsl_mult': 0.5312903801880144, 'sideways_time_stop': 267, 'sideways_use_sma': True, 'sideways_use_ema': True, 'sideways_use_atr': False, 'sideways_use_adx': False, 'sideways_use_spike': False, 'sideways_rsi_required': True}.
[I 2025-08-30 19:32:41,561] Trial 434 finished with values: [-1000000000.0, 1000000000.0] and parameters: {'p_sma': 40, 'p_std': 27, 'p_atr': 10, 'p_adx': 27, 'rsi_period': 59, 'ema1': 25, 'ema2': 19, 'slip_atr_k': 0.1745375763113327, 'slip_spread_k': 0.3506750876332877, 'spread_hl_frac': 0.003388612846632739, 'bb_std_mult': 0.8836667032428844, 'rsi_os': 50, 'rsi_ob': 60, 'vol_spike': 0.04349409156000436, 'adx_thresh': 5.020153153822875, 'atr_min_pct': 0.026034157425910077, 'atr_max_pct': 0.03100088244541368, 'tp_mult': 2.315851028548126, 'tsl_mult': 0.6938871669659987, 'strategy': 'breakout', 'time_stop': 38, 'use_sma': True, 'use_atr': True, 'use_adx': True, 'use_ema': True, 'use_spike': False, 'rsi_required': True, 'edge_k': 0.18277712031601315, 'edge_cap': 0.34798072029248706, 'bull_strategy': 'breakout', 'bull_bb_std_mult': 1.9662509347830555, 'bull_rsi_os': 49, 'bull_rsi_ob': 69, 'bull_adx_thresh': 27.144472622803427, 'bull_atr_min_pct': 0.0009695922903880088, 'bull_atr_max_pct': 0.12671331085056026, 'bull_tp_mult': 1.4233406288627846, 'bull_tsl_mult': 0.8438963107514114, 'bull_time_stop': 91, 'bull_use_sma': False, 'bull_use_ema': True, 'bull_use_atr': True, 'bull_use_adx': True, 'bull_use_spike': True, 'bull_rsi_required': False, 'bear_strategy': 'mean_reversion', 'bear_bb_std_mult': 3.1006994605296114, 'bear_rsi_os': 33, 'bear_rsi_ob': 45, 'bear_adx_thresh': 21.084526079361517, 'bear_atr_min_pct': 0.025784140264867514, 'bear_atr_max_pct': 0.058336138917076265, 'bear_tp_mult': 2.5928455578006577, 'bear_tsl_mult': 0.5084113076642852, 'bear_time_stop': 33, 'bear_use_sma': True, 'bear_use_ema': False, 'bear_use_atr': True, 'bear_use_adx': True, 'bear_use_spike': False, 'bear_rsi_required': False, 'sideways_strategy': 'breakout', 'sideways_bb_std_mult': 2.085765670393864, 'sideways_rsi_os': 24, 'sideways_rsi_ob': 75, 'sideways_adx_thresh': 24.98843731485793, 'sideways_atr_min_pct': 0.017883432244223833, 'sideways_atr_max_pct': 0.11278296411273883, 'sideways_tp_mult': 1.723236780848182, 'sideways_tsl_mult': 0.9463455218653014, 'sideways_time_stop': 157, 'sideways_use_sma': True, 'sideways_use_ema': False, 'sideways_use_atr': False, 'sideways_use_adx': True, 'sideways_use_spike': False, 'sideways_rsi_required': False}.
[I 2025-08-30 19:32:41,693] Trial 435 finished with values: [-1000000000.0, 1000000000.0] and parameters: {'p_sma': 60, 'p_std': 27, 'p_atr': 9, 'p_adx': 13, 'rsi_period': 54, 'ema1': 5, 'ema2': 10, 'slip_atr_k': 0.021949296032608034, 'slip_spread_k': 0.6647184651883503, 'spread_hl_frac': 0.031069823758477274, 'bb_std_mult': 0.9027345824216625, 'rsi_os': 36, 'rsi_ob': 77, 'vol_spike': 0.04314358671625876, 'adx_thresh': 11.138864925661396, 'atr_min_pct': 0.010805514853093634, 'atr_max_pct': 0.13142210741382665, 'tp_mult': 2.3200361070749906, 'tsl_mult': 0.9657294797016649, 'strategy': 'breakout', 'time_stop': 295, 'use_sma': True, 'use_atr': True, 'use_adx': True, 'use_ema': True, 'use_spike': False, 'rsi_required': True, 'edge_k': 0.3222953681053642, 'edge_cap': 0.24604029754193052, 'bull_strategy': 'breakout', 'bull_bb_std_mult': 1.9618934396596317, 'bull_rsi_os': 48, 'bull_rsi_ob': 47, 'bull_adx_thresh': 25.682473462528332, 'bull_atr_min_pct': 0.020909197850311, 'bull_atr_max_pct': 0.1402469893967551, 'bull_tp_mult': 1.0157742465853583, 'bull_tsl_mult': 0.966878629955911, 'bull_time_stop': 198, 'bull_use_sma': False, 'bull_use_ema': True, 'bull_use_atr': True, 'bull_use_adx': True, 'bull_use_spike': True, 'bull_rsi_required': False, 'bear_strategy': 'mean_reversion', 'bear_bb_std_mult': 0.739868550935155, 'bear_rsi_os': 33, 'bear_rsi_ob': 52, 'bear_adx_thresh': 6.1414889207670065, 'bear_atr_min_pct': 0.02752814319779507, 'bear_atr_max_pct': 0.029708951740359535, 'bear_tp_mult': 1.7453309003877955, 'bear_tsl_mult': 0.8100613081545887, 'bear_time_stop': 209, 'bear_use_sma': True, 'bear_use_ema': False, 'bear_use_atr': True, 'bear_use_adx': True, 'bear_use_spike': False, 'bear_rsi_required': False, 'sideways_strategy': 'breakout', 'sideways_bb_std_mult': 2.0930827285388434, 'sideways_rsi_os': 24, 'sideways_rsi_ob': 59, 'sideways_adx_thresh': 9.984649397862743, 'sideways_atr_min_pct': 2.6591498872787986e-05, 'sideways_atr_max_pct': 0.09108803514738993, 'sideways_tp_mult': 2.9009884932227687, 'sideways_tsl_mult': 0.7588643583658106, 'sideways_time_stop': 216, 'sideways_use_sma': True, 'sideways_use_ema': False, 'sideways_use_atr': False, 'sideways_use_adx': True, 'sideways_use_spike': False, 'sideways_rsi_required': False}.
[I 2025-08-30 19:32:41,863] Trial 433 finished with values: [-0.14451297018214138, 0.14445587926007167] and parameters: {'p_sma': 32, 'p_std': 27, 'p_atr': 10, 'p_adx': 27, 'rsi_period': 60, 'ema1': 10, 'ema2': 10, 'slip_atr_k': 0.023485963123441138, 'slip_spread_k': 0.6608651754773943, 'spread_hl_frac': 0.0031607495824829647, 'bb_std_mult': 0.911048958485382, 'rsi_os': 36, 'rsi_ob': 54, 'vol_spike': 0.04587261178876602, 'adx_thresh': 20.723912420016077, 'atr_min_pct': 0.025656650639813337, 'atr_max_pct': 0.11176616368384232, 'tp_mult': 2.300153994433424, 'tsl_mult': 0.1891664025244773, 'strategy': 'breakout', 'time_stop': 157, 'use_sma': False, 'use_atr': True, 'use_adx': False, 'use_ema': False, 'use_spike': True, 'rsi_required': True, 'edge_k': 0.12495168304122864, 'edge_cap': 0.7175214284898035, 'bull_strategy': 'breakout', 'bull_bb_std_mult': 1.878800434362441, 'bull_rsi_os': 49, 'bull_rsi_ob': 68, 'bull_adx_thresh': 24.692372509359668, 'bull_atr_min_pct': 0.0010267518290830759, 'bull_atr_max_pct': 0.14977230994732985, 'bull_tp_mult': 1.4143518850793502, 'bull_tsl_mult': 0.8438315003342072, 'bull_time_stop': 190, 'bull_use_sma': True, 'bull_use_ema': False, 'bull_use_atr': False, 'bull_use_adx': True, 'bull_use_spike': False, 'bull_rsi_required': False, 'bear_strategy': 'breakout', 'bear_bb_std_mult': 3.4445420880512754, 'bear_rsi_os': 44, 'bear_rsi_ob': 46, 'bear_adx_thresh': 5.711611358481733, 'bear_atr_min_pct': 0.027660170624492074, 'bear_atr_max_pct': 0.09377081835790588, 'bear_tp_mult': 1.7431106273819987, 'bear_tsl_mult': 0.8109340867123691, 'bear_time_stop': 30, 'bear_use_sma': True, 'bear_use_ema': False, 'bear_use_atr': True, 'bear_use_adx': True, 'bear_use_spike': False, 'bear_rsi_required': False, 'sideways_strategy': 'breakout', 'sideways_bb_std_mult': 2.0925417911225974, 'sideways_rsi_os': 48, 'sideways_rsi_ob': 58, 'sideways_adx_thresh': 9.988667913925037, 'sideways_atr_min_pct': 0.00019541603843804475, 'sideways_atr_max_pct': 0.08230572381287782, 'sideways_tp_mult': 2.349356201207357, 'sideways_tsl_mult': 0.6401606236436891, 'sideways_time_stop': 269, 'sideways_use_sma': True, 'sideways_use_ema': False, 'sideways_use_atr': False, 'sideways_use_adx': False, 'sideways_use_spike': False, 'sideways_rsi_required': False}.
[I 2025-08-30 19:32:42,101] Trial 436 finished with values: [-0.016638413275594566, 0.01669560541665615] and parameters: {'p_sma': 60, 'p_std': 25, 'p_atr': 10, 'p_adx': 9, 'rsi_period': 59, 'ema1': 23, 'ema2': 10, 'slip_atr_k': 0.02364208762167149, 'slip_spread_k': 0.6615561352100952, 'spread_hl_frac': 0.031049763100969397, 'bb_std_mult': 0.8962708744140185, 'rsi_os': 39, 'rsi_ob': 85, 'vol_spike': 0.04400667671241478, 'adx_thresh': 11.139311802134632, 'atr_min_pct': 0.010896910890941865, 'atr_max_pct': 0.11196583321098441, 'tp_mult': 2.215949817880617, 'tsl_mult': 0.9201275474490422, 'strategy': 'breakout', 'time_stop': 37, 'use_sma': True, 'use_atr': True, 'use_adx': True, 'use_ema': True, 'use_spike': False, 'rsi_required': False, 'edge_k': 0.208694367119577, 'edge_cap': 0.7243271436476459, 'bull_strategy': 'breakout', 'bull_bb_std_mult': 1.9507419604899687, 'bull_rsi_os': 49, 'bull_rsi_ob': 70, 'bull_adx_thresh': 26.79145468771326, 'bull_atr_min_pct': 0.001218099521284291, 'bull_atr_max_pct': 0.11942435592527867, 'bull_tp_mult': 1.411252630235813, 'bull_tsl_mult': 0.5738970199014977, 'bull_time_stop': 297, 'bull_use_sma': False, 'bull_use_ema': True, 'bull_use_atr': True, 'bull_use_adx': True, 'bull_use_spike': True, 'bull_rsi_required': False, 'bear_strategy': 'mean_reversion', 'bear_bb_std_mult': 3.427120580439338, 'bear_rsi_os': 45, 'bear_rsi_ob': 84, 'bear_adx_thresh': 26.966610243436964, 'bear_atr_min_pct': 0.015274496387857923, 'bear_atr_max_pct': 0.05585971708373174, 'bear_tp_mult': 2.692348083195629, 'bear_tsl_mult': 0.19208750126832458, 'bear_time_stop': 207, 'bear_use_sma': True, 'bear_use_ema': False, 'bear_use_atr': False, 'bear_use_adx': False, 'bear_use_spike': False, 'bear_rsi_required': False, 'sideways_strategy': 'breakout', 'sideways_bb_std_mult': 2.063930748861042, 'sideways_rsi_os': 39, 'sideways_rsi_ob': 59, 'sideways_adx_thresh': 10.192625821633762, 'sideways_atr_min_pct': 0.017977224278607717, 'sideways_atr_max_pct': 0.09069479493993214, 'sideways_tp_mult': 1.7142006077949352, 'sideways_tsl_mult': 0.7575981225083732, 'sideways_time_stop': 230, 'sideways_use_sma': True, 'sideways_use_ema': False, 'sideways_use_atr': False, 'sideways_use_adx': True, 'sideways_use_spike': True, 'sideways_rsi_required': False}.
[I 2025-08-30 19:33:17,393] Trial 438 finished with values: [-1000000000.0, 1000000000.0] and parameters: {'p_sma': 7, 'p_std': 25, 'p_atr': 9, 'p_adx': 9, 'rsi_period': 41, 'ema1': 23, 'ema2': 17, 'slip_atr_k': 0.030471548662323215, 'slip_spread_k': 0.24629420297848292, 'spread_hl_frac': 0.00266851800220279, 'bb_std_mult': 0.7680907097924767, 'rsi_os': 39, 'rsi_ob': 57, 'vol_spike': 0.030442697798002218, 'adx_thresh': 18.134198974192977, 'atr_min_pct': 0.025448129374553142, 'atr_max_pct': 0.12823807680067215, 'tp_mult': 2.216940406487851, 'tsl_mult': 0.6154797355105492, 'strategy': 'breakout', 'time_stop': 81, 'use_sma': False, 'use_atr': True, 'use_adx': False, 'use_ema': False, 'use_spike': True, 'rsi_required': False, 'edge_k': 0.048250402857062724, 'edge_cap': 0.1940175329175428, 'bull_strategy': 'mean_reversion', 'bull_bb_std_mult': 1.8981726507946788, 'bull_rsi_os': 35, 'bull_rsi_ob': 73, 'bull_adx_thresh': 11.880595647127205, 'bull_atr_min_pct': 0.0040530126148647936, 'bull_atr_max_pct': 0.023217794438030476, 'bull_tp_mult': 1.748834427176916, 'bull_tsl_mult': 0.9997756489879319, 'bull_time_stop': 181, 'bull_use_sma': True, 'bull_use_ema': False, 'bull_use_atr': False, 'bull_use_adx': True, 'bull_use_spike': False, 'bull_rsi_required': True, 'bear_strategy': 'breakout', 'bear_bb_std_mult': 3.439883926534212, 'bear_rsi_os': 9, 'bear_rsi_ob': 75, 'bear_adx_thresh': 22.273658091012408, 'bear_atr_min_pct': 0.01539326928970091, 'bear_atr_max_pct': 0.12461530979145449, 'bear_tp_mult': 1.795287725014244, 'bear_tsl_mult': 0.12076683509458402, 'bear_time_stop': 43, 'bear_use_sma': True, 'bear_use_ema': False, 'bear_use_atr': False, 'bear_use_adx': False, 'bear_use_spike': True, 'bear_rsi_required': False, 'sideways_strategy': 'breakout', 'sideways_bb_std_mult': 2.0139726714556376, 'sideways_rsi_os': 15, 'sideways_rsi_ob': 79, 'sideways_adx_thresh': 10.46836031431803, 'sideways_atr_min_pct': 0.012369751321812587, 'sideways_atr_max_pct': 0.09880467166736073, 'sideways_tp_mult': 1.9227867853065104, 'sideways_tsl_mult': 0.8395338997908351, 'sideways_time_stop': 294, 'sideways_use_sma': True, 'sideways_use_ema': True, 'sideways_use_atr': True, 'sideways_use_adx': False, 'sideways_use_spike': True, 'sideways_rsi_required': False}.
[I 2025-08-30 19:33:17,516] Trial 440 finished with values: [-1000000000.0, 1000000000.0] and parameters: {'p_sma': 42, 'p_std': 15, 'p_atr': 19, 'p_adx': 9, 'rsi_period': 71, 'ema1': 15, 'ema2': 16, 'slip_atr_k': 0.029951996050329298, 'slip_spread_k': 0.25634454896503023, 'spread_hl_frac': 0.004208310552525331, 'bb_std_mult': 1.9617886598803833, 'rsi_os': 35, 'rsi_ob': 57, 'vol_spike': 0.030765609504646057, 'adx_thresh': 18.320946681629746, 'atr_min_pct': 0.023683891474433342, 'atr_max_pct': 0.12755476009953898, 'tp_mult': 1.841890048510284, 'tsl_mult': 0.2697564275781973, 'strategy': 'breakout', 'time_stop': 37, 'use_sma': False, 'use_atr': True, 'use_adx': False, 'use_ema': False, 'use_spike': True, 'rsi_required': False, 'edge_k': 0.6121815381438336, 'edge_cap': 0.20440300406439332, 'bull_strategy': 'mean_reversion', 'bull_bb_std_mult': 1.7417976843865037, 'bull_rsi_os': 52, 'bull_rsi_ob': 52, 'bull_adx_thresh': 23.031827760182352, 'bull_atr_min_pct': 0.004171656909428259, 'bull_atr_max_pct': 0.023386617487983676, 'bull_tp_mult': 2.5346006307141233, 'bull_tsl_mult': 0.9995118477394127, 'bull_time_stop': 80, 'bull_use_sma': True, 'bull_use_ema': False, 'bull_use_atr': False, 'bull_use_adx': True, 'bull_use_spike': True, 'bull_rsi_required': True, 'bear_strategy': 'breakout', 'bear_bb_std_mult': 3.3530687388338882, 'bear_rsi_os': 14, 'bear_rsi_ob': 86, 'bear_adx_thresh': 10.519013543940469, 'bear_atr_min_pct': 0.015415457115616907, 'bear_atr_max_pct': 0.12329486381323279, 'bear_tp_mult': 2.6926981209220866, 'bear_tsl_mult': 0.19454814698738424, 'bear_time_stop': 43, 'bear_use_sma': True, 'bear_use_ema': False, 'bear_use_atr': False, 'bear_use_adx': False, 'bear_use_spike': True, 'bear_rsi_required': True, 'sideways_strategy': 'breakout', 'sideways_bb_std_mult': 1.9609593333236248, 'sideways_rsi_os': 14, 'sideways_rsi_ob': 60, 'sideways_adx_thresh': 10.556350565538077, 'sideways_atr_min_pct': 0.0270135299695157, 'sideways_atr_max_pct': 0.12624976051615225, 'sideways_tp_mult': 1.909732293428643, 'sideways_tsl_mult': 0.5592548052234042, 'sideways_time_stop': 262, 'sideways_use_sma': True, 'sideways_use_ema': True, 'sideways_use_atr': True, 'sideways_use_adx': False, 'sideways_use_spike': True, 'sideways_rsi_required': False}.
[I 2025-08-30 19:33:17,911] Trial 437 finished with values: [-0.09401946892267332, 0.09399134203740252] and parameters: {'p_sma': 7, 'p_std': 28, 'p_atr': 9, 'p_adx': 28, 'rsi_period': 41, 'ema1': 23, 'ema2': 33, 'slip_atr_k': 0.02220357232312839, 'slip_spread_k': 0.18548326771503948, 'spread_hl_frac': 0.02983236163499673, 'bb_std_mult': 0.9200425813760743, 'rsi_os': 35, 'rsi_ob': 59, 'vol_spike': 0.01873648646229939, 'adx_thresh': 11.32540497208691, 'atr_min_pct': 0.01118063617946997, 'atr_max_pct': 0.12955043878673564, 'tp_mult': 2.214684560485019, 'tsl_mult': 0.6538054373124583, 'strategy': 'breakout', 'time_stop': 80, 'use_sma': False, 'use_atr': True, 'use_adx': False, 'use_ema': False, 'use_spike': True, 'rsi_required': False, 'edge_k': 1.8725542683796654, 'edge_cap': 0.24649648130507196, 'bull_strategy': 'mean_reversion', 'bull_bb_std_mult': 1.9311069289267306, 'bull_rsi_os': 31, 'bull_rsi_ob': 79, 'bull_adx_thresh': 33.28721324587755, 'bull_atr_min_pct': 0.0018231696748029493, 'bull_atr_max_pct': 0.13883247590684436, 'bull_tp_mult': 2.5359850320000623, 'bull_tsl_mult': 0.13675527496772488, 'bull_time_stop': 172, 'bull_use_sma': True, 'bull_use_ema': False, 'bull_use_atr': False, 'bull_use_adx': True, 'bull_use_spike': False, 'bull_rsi_required': True, 'bear_strategy': 'breakout', 'bear_bb_std_mult': 3.4307601126598875, 'bear_rsi_os': 9, 'bear_rsi_ob': 67, 'bear_adx_thresh': 6.0900884925157035, 'bear_atr_min_pct': 0.015329702329489145, 'bear_atr_max_pct': 0.05513636769837765, 'bear_tp_mult': 1.7341214288908957, 'bear_tsl_mult': 0.12484155220310385, 'bear_time_stop': 209, 'bear_use_sma': True, 'bear_use_ema': False, 'bear_use_atr': False, 'bear_use_adx': False, 'bear_use_spike': False, 'bear_rsi_required': False, 'sideways_strategy': 'breakout', 'sideways_bb_std_mult': 2.0124106264735264, 'sideways_rsi_os': 53, 'sideways_rsi_ob': 52, 'sideways_adx_thresh': 10.061596663322995, 'sideways_atr_min_pct': 0.00038890826100885546, 'sideways_atr_max_pct': 0.1263889273894355, 'sideways_tp_mult': 1.9084171944520876, 'sideways_tsl_mult': 0.6295169295053474, 'sideways_time_stop': 19, 'sideways_use_sma': True, 'sideways_use_ema': True, 'sideways_use_atr': False, 'sideways_use_adx': False, 'sideways_use_spike': True, 'sideways_rsi_required': False}.
[I 2025-08-30 19:33:17,922] Trial 439 finished with values: [-1000000000.0, 1000000000.0] and parameters: {'p_sma': 42, 'p_std': 15, 'p_atr': 9, 'p_adx': 9, 'rsi_period': 7, 'ema1': 23, 'ema2': 24, 'slip_atr_k': 0.15791350830796944, 'slip_spread_k': 0.31410860795794493, 'spread_hl_frac': 0.004248943277356668, 'bb_std_mult': 0.9948090267733302, 'rsi_os': 35, 'rsi_ob': 57, 'vol_spike': 0.17979332705323464, 'adx_thresh': 18.21872513013723, 'atr_min_pct': 0.023303011405325407, 'atr_max_pct': 0.1273948945483023, 'tp_mult': 1.14281513332545, 'tsl_mult': 0.9203636212378143, 'strategy': 'breakout', 'time_stop': 286, 'use_sma': False, 'use_atr': True, 'use_adx': False, 'use_ema': False, 'use_spike': True, 'rsi_required': False, 'edge_k': 0.21626779070023872, 'edge_cap': 0.6116783218448206, 'bull_strategy': 'mean_reversion', 'bull_bb_std_mult': 2.0378019407160695, 'bull_rsi_os': 31, 'bull_rsi_ob': 52, 'bull_adx_thresh': 11.941647401880244, 'bull_atr_min_pct': 0.004229656401762977, 'bull_atr_max_pct': 0.02430025133193514, 'bull_tp_mult': 2.566718422483582, 'bull_tsl_mult': 0.25027877573881085, 'bull_time_stop': 180, 'bull_use_sma': True, 'bull_use_ema': False, 'bull_use_atr': False, 'bull_use_adx': True, 'bull_use_spike': True, 'bull_rsi_required': True, 'bear_strategy': 'breakout', 'bear_bb_std_mult': 3.332489691708643, 'bear_rsi_os': 14, 'bear_rsi_ob': 67, 'bear_adx_thresh': 10.799731578982989, 'bear_atr_min_pct': 0.015471371521522705, 'bear_atr_max_pct': 0.03719792107518729, 'bear_tp_mult': 1.7895178586765654, 'bear_tsl_mult': 0.698886556240646, 'bear_time_stop': 278, 'bear_use_sma': True, 'bear_use_ema': False, 'bear_use_atr': False, 'bear_use_adx': False, 'bear_use_spike': True, 'bear_rsi_required': False, 'sideways_strategy': 'breakout', 'sideways_bb_std_mult': 2.009830028859991, 'sideways_rsi_os': 15, 'sideways_rsi_ob': 56, 'sideways_adx_thresh': 27.628141187977374, 'sideways_atr_min_pct': 0.01846873673481506, 'sideways_atr_max_pct': 0.12651193385264062, 'sideways_tp_mult': 1.786363656253121, 'sideways_tsl_mult': 0.6816211616040659, 'sideways_time_stop': 294, 'sideways_use_sma': True, 'sideways_use_ema': True, 'sideways_use_atr': True, 'sideways_use_adx': False, 'sideways_use_spike': True, 'sideways_rsi_required': False}.
