[I 2025-08-30 20:33:22,189] Trial 873 finished with values: [-1000000000.0, 1000000000.0] and parameters: {'p_sma': 45, 'p_std': 12, 'p_atr': 9, 'p_adx': 7, 'rsi_period': 83, 'ema1': 9, 'ema2': 14, 'slip_atr_k': 0.01112460154624202, 'slip_spread_k': 0.5699414962404465, 'spread_hl_frac': 0.04461439803403576, 'bb_std_mult': 1.1211875989738382, 'rsi_os': 19, 'rsi_ob': 72, 'vol_spike': 0.15452943631183566, 'adx_thresh': 25.691545320794326, 'atr_min_pct': 0.004722834604816761, 'atr_max_pct': 0.13231179792141662, 'tp_mult': 2.378375632157055, 'tsl_mult': 0.7441805249347819, 'strategy': 'breakout', 'time_stop': 274, 'use_sma': False, 'use_atr': True, 'use_adx': True, 'use_ema': True, 'use_spike': False, 'rsi_required': True, 'edge_k': 1.3458064655650517, 'edge_cap': 0.5565695815889191, 'bull_strategy': 'mean_reversion', 'bull_bb_std_mult': 2.0286563763432914, 'bull_rsi_os': 30, 'bull_rsi_ob': 72, 'bull_adx_thresh': 18.719838879701662, 'bull_atr_min_pct': 0.01911842522076533, 'bull_atr_max_pct': 0.0760949197531493, 'bull_tp_mult': 2.072008515448657, 'bull_tsl_mult': 0.9174622063170987, 'bull_time_stop': 282, 'bull_use_sma': False, 'bull_use_ema': False, 'bull_use_atr': True, 'bull_use_adx': False, 'bull_use_spike': True, 'bull_rsi_required': False, 'bear_strategy': 'mean_reversion', 'bear_bb_std_mult': 3.390172989436355, 'bear_rsi_os': 48, 'bear_rsi_ob': 49, 'bear_adx_thresh': 9.029553183021939, 'bear_atr_min_pct': 0.00903147246194473, 'bear_atr_max_pct': 0.11638889572415488, 'bear_tp_mult': 2.690649907498244, 'bear_tsl_mult': 0.18345494224652004, 'bear_time_stop': 20, 'bear_use_sma': False, 'bear_use_ema': True, 'bear_use_atr': True, 'bear_use_adx': True, 'bear_use_spike': True, 'bear_rsi_required': True, 'sideways_strategy': 'mean_reversion', 'sideways_bb_std_mult': 3.0147467415070675, 'sideways_rsi_os': 28, 'sideways_rsi_ob': 91, 'sideways_adx_thresh': 25.506758130603416, 'sideways_atr_min_pct': 0.02688542358302964, 'sideways_atr_max_pct': 0.03777252644844888, 'sideways_tp_mult': 1.123134327270429, 'sideways_tsl_mult': 0.7869786838941313, 'sideways_time_stop': 278, 'sideways_use_sma': False, 'sideways_use_ema': True, 'sideways_use_atr': False, 'sideways_use_adx': True, 'sideways_use_spike': False, 'sideways_rsi_required': True}.
[I 2025-08-30 20:33:22,616] Trial 874 finished with values: [-1000000000.0, 1000000000.0] and parameters: {'p_sma': 46, 'p_std': 8, 'p_atr': 29, 'p_adx': 7, 'rsi_period': 80, 'ema1': 9, 'ema2': 15, 'slip_atr_k': 0.011782495570559322, 'slip_spread_k': 0.5705107891533194, 'spread_hl_frac': 0.043015994909248755, 'bb_std_mult': 1.1240667777572555, 'rsi_os': 39, 'rsi_ob': 71, 'vol_spike': 0.15198162359432932, 'adx_thresh': 23.399221268930784, 'atr_min_pct': 0.023165952332931748, 'atr_max_pct': 0.1319661665022514, 'tp_mult': 2.357762664430496, 'tsl_mult': 0.6900283101888525, 'strategy': 'mean_reversion', 'time_stop': 95, 'use_sma': False, 'use_atr': True, 'use_adx': True, 'use_ema': True, 'use_spike': True, 'rsi_required': False, 'edge_k': 1.6431535857887698, 'edge_cap': 0.5525062245075062, 'bull_strategy': 'mean_reversion', 'bull_bb_std_mult': 1.8017272947551966, 'bull_rsi_os': 28, 'bull_rsi_ob': 63, 'bull_adx_thresh': 10.961486892387905, 'bull_atr_min_pct': 0.006064335911775169, 'bull_atr_max_pct': 0.07872906685887589, 'bull_tp_mult': 2.036864876088384, 'bull_tsl_mult': 0.9174871472933622, 'bull_time_stop': 291, 'bull_use_sma': False, 'bull_use_ema': False, 'bull_use_atr': False, 'bull_use_adx': True, 'bull_use_spike': True, 'bull_rsi_required': False, 'bear_strategy': 'mean_reversion', 'bear_bb_std_mult': 3.3864998839811324, 'bear_rsi_os': 49, 'bear_rsi_ob': 53, 'bear_adx_thresh': 6.343080349627448, 'bear_atr_min_pct': 0.008528588011635977, 'bear_atr_max_pct': 0.11273168110650361, 'bear_tp_mult': 2.9169433375799922, 'bear_tsl_mult': 0.16614018534062217, 'bear_time_stop': 16, 'bear_use_sma': False, 'bear_use_ema': False, 'bear_use_atr': False, 'bear_use_adx': False, 'bear_use_spike': True, 'bear_rsi_required': True, 'sideways_strategy': 'mean_reversion', 'sideways_bb_std_mult': 2.0202521381330163, 'sideways_rsi_os': 21, 'sideways_rsi_ob': 57, 'sideways_adx_thresh': 25.73081126572386, 'sideways_atr_min_pct': 0.02693556521542454, 'sideways_atr_max_pct': 0.024700541889052196, 'sideways_tp_mult': 1.3496638478591472, 'sideways_tsl_mult': 0.9352807136044278, 'sideways_time_stop': 278, 'sideways_use_sma': False, 'sideways_use_ema': True, 'sideways_use_atr': True, 'sideways_use_adx': True, 'sideways_use_spike': True, 'sideways_rsi_required': True}.
[I 2025-08-30 20:33:23,777] Trial 877 finished with values: [-1000000000.0, 1000000000.0] and parameters: {'p_sma': 47, 'p_std': 16, 'p_atr': 15, 'p_adx': 7, 'rsi_period': 80, 'ema1': 10, 'ema2': 15, 'slip_atr_k': 0.23577123033149855, 'slip_spread_k': 0.6795502907057053, 'spread_hl_frac': 0.04194412976481295, 'bb_std_mult': 0.578391258448264, 'rsi_os': 39, 'rsi_ob': 47, 'vol_spike': 0.11755202325215942, 'adx_thresh': 21.07654612563541, 'atr_min_pct': 0.021261541768256526, 'atr_max_pct': 0.12827650021504203, 'tp_mult': 2.2445542658223796, 'tsl_mult': 0.7090954539393723, 'strategy': 'mean_reversion', 'time_stop': 226, 'use_sma': False, 'use_atr': False, 'use_adx': True, 'use_ema': False, 'use_spike': True, 'rsi_required': False, 'edge_k': 1.6346983855096529, 'edge_cap': 0.5919220768906832, 'bull_strategy': 'breakout', 'bull_bb_std_mult': 1.8100026351041554, 'bull_rsi_os': 18, 'bull_rsi_ob': 73, 'bull_adx_thresh': 25.32950555419424, 'bull_atr_min_pct': 0.0088314612658849, 'bull_atr_max_pct': 0.07969673838627936, 'bull_tp_mult': 2.033880896392943, 'bull_tsl_mult': 0.9272269220824733, 'bull_time_stop': 191, 'bull_use_sma': False, 'bull_use_ema': True, 'bull_use_atr': False, 'bull_use_adx': True, 'bull_use_spike': False, 'bull_rsi_required': True, 'bear_strategy': 'mean_reversion', 'bear_bb_std_mult': 3.495451676492733, 'bear_rsi_os': 46, 'bear_rsi_ob': 51, 'bear_adx_thresh': 32.2613643376484, 'bear_atr_min_pct': 0.008298153935089743, 'bear_atr_max_pct': 0.11299691061048141, 'bear_tp_mult': 2.889283123673201, 'bear_tsl_mult': 0.013955806143148508, 'bear_time_stop': 11, 'bear_use_sma': True, 'bear_use_ema': False, 'bear_use_atr': False, 'bear_use_adx': False, 'bear_use_spike': False, 'bear_rsi_required': True, 'sideways_strategy': 'mean_reversion', 'sideways_bb_std_mult': 3.4148094990936477, 'sideways_rsi_os': 22, 'sideways_rsi_ob': 56, 'sideways_adx_thresh': 29.062589639536643, 'sideways_atr_min_pct': 0.024648173194556974, 'sideways_atr_max_pct': 0.023655161065475237, 'sideways_tp_mult': 1.359201081071979, 'sideways_tsl_mult': 0.8276781591258981, 'sideways_time_stop': 85, 'sideways_use_sma': False, 'sideways_use_ema': False, 'sideways_use_atr': True, 'sideways_use_adx': True, 'sideways_use_spike': True, 'sideways_rsi_required': True}.
[I 2025-08-30 20:33:23,883] Trial 878 finished with values: [-1000000000.0, 1000000000.0] and parameters: {'p_sma': 48, 'p_std': 14, 'p_atr': 10, 'p_adx': 7, 'rsi_period': 81, 'ema1': 11, 'ema2': 14, 'slip_atr_k': 0.020697586679202976, 'slip_spread_k': 0.652402396207519, 'spread_hl_frac': 0.03988465642936654, 'bb_std_mult': 1.4310475840529637, 'rsi_os': 48, 'rsi_ob': 47, 'vol_spike': 0.11552128128384385, 'adx_thresh': 24.871075013120535, 'atr_min_pct': 0.006407168660900121, 'atr_max_pct': 0.12828577275821332, 'tp_mult': 2.2566690571589287, 'tsl_mult': 0.8136281631122088, 'strategy': 'mean_reversion', 'time_stop': 135, 'use_sma': False, 'use_atr': False, 'use_adx': False, 'use_ema': False, 'use_spike': True, 'rsi_required': False, 'edge_k': 1.0898663476647679, 'edge_cap': 0.5865103118078503, 'bull_strategy': 'breakout', 'bull_bb_std_mult': 1.9588549198133658, 'bull_rsi_os': 33, 'bull_rsi_ob': 73, 'bull_adx_thresh': 22.654863663579384, 'bull_atr_min_pct': 0.00880687896834972, 'bull_atr_max_pct': 0.0848506834132238, 'bull_tp_mult': 1.9227393173879477, 'bull_tsl_mult': 0.623272637159098, 'bull_time_stop': 191, 'bull_use_sma': True, 'bull_use_ema': True, 'bull_use_atr': False, 'bull_use_adx': True, 'bull_use_spike': False, 'bull_rsi_required': True, 'bear_strategy': 'breakout', 'bear_bb_std_mult': 3.594880612602007, 'bear_rsi_os': 46, 'bear_rsi_ob': 50, 'bear_adx_thresh': 5.504358805144889, 'bear_atr_min_pct': 0.008369750723131007, 'bear_atr_max_pct': 0.13630558719359961, 'bear_tp_mult': 2.9042763268231973, 'bear_tsl_mult': 0.14798907892501562, 'bear_time_stop': 11, 'bear_use_sma': True, 'bear_use_ema': False, 'bear_use_atr': False, 'bear_use_adx': False, 'bear_use_spike': False, 'bear_rsi_required': True, 'sideways_strategy': 'mean_reversion', 'sideways_bb_std_mult': 1.7634224650660255, 'sideways_rsi_os': 24, 'sideways_rsi_ob': 87, 'sideways_adx_thresh': 30.872854261470327, 'sideways_atr_min_pct': 0.02484706407339178, 'sideways_atr_max_pct': 0.02038169576304393, 'sideways_tp_mult': 1.480908504946626, 'sideways_tsl_mult': 0.8232253863283475, 'sideways_time_stop': 184, 'sideways_use_sma': False, 'sideways_use_ema': False, 'sideways_use_atr': True, 'sideways_use_adx': False, 'sideways_use_spike': True, 'sideways_rsi_required': True}.
[I 2025-08-30 20:33:53,519] Trial 876 finished with values: [-1000000000.0, 1000000000.0] and parameters: {'p_sma': 47, 'p_std': 14, 'p_atr': 9, 'p_adx': 7, 'rsi_period': 80, 'ema1': 13, 'ema2': 14, 'slip_atr_k': 0.24400110143120302, 'slip_spread_k': 0.5739794383963278, 'spread_hl_frac': 0.042699874192949926, 'bb_std_mult': 1.4313357189709406, 'rsi_os': 39, 'rsi_ob': 63, 'vol_spike': 0.11682794479621102, 'adx_thresh': 25.22897047563256, 'atr_min_pct': 0.023289728195912726, 'atr_max_pct': 0.12910482317756924, 'tp_mult': 2.2429912415119206, 'tsl_mult': 0.3279410111022304, 'strategy': 'mean_reversion', 'time_stop': 230, 'use_sma': False, 'use_atr': False, 'use_adx': True, 'use_ema': True, 'use_spike': True, 'rsi_required': False, 'edge_k': 1.0743548375977026, 'edge_cap': 0.6814515947823432, 'bull_strategy': 'breakout', 'bull_bb_std_mult': 1.984923186568309, 'bull_rsi_os': 32, 'bull_rsi_ob': 73, 'bull_adx_thresh': 22.764959609475724, 'bull_atr_min_pct': 0.0053104313006309255, 'bull_atr_max_pct': 0.07913032708840116, 'bull_tp_mult': 1.9122945959821882, 'bull_tsl_mult': 0.9436677546915078, 'bull_time_stop': 189, 'bull_use_sma': False, 'bull_use_ema': True, 'bull_use_atr': False, 'bull_use_adx': True, 'bull_use_spike': False, 'bull_rsi_required': False, 'bear_strategy': 'mean_reversion', 'bear_bb_std_mult': 3.5960968480854425, 'bear_rsi_os': 46, 'bear_rsi_ob': 49, 'bear_adx_thresh': 5.012072450553244, 'bear_atr_min_pct': 0.009020284371041163, 'bear_atr_max_pct': 0.11299995508512424, 'bear_tp_mult': 2.8901382852998236, 'bear_tsl_mult': 0.18684141757634554, 'bear_time_stop': 14, 'bear_use_sma': True, 'bear_use_ema': False, 'bear_use_atr': False, 'bear_use_adx': False, 'bear_use_spike': True, 'bear_rsi_required': True, 'sideways_strategy': 'mean_reversion', 'sideways_bb_std_mult': 2.0413879108423556, 'sideways_rsi_os': 22, 'sideways_rsi_ob': 56, 'sideways_adx_thresh': 31.576591671166234, 'sideways_atr_min_pct': 0.02472244116139202, 'sideways_atr_max_pct': 0.024911415178368347, 'sideways_tp_mult': 1.481904321396108, 'sideways_tsl_mult': 0.8245509791123504, 'sideways_time_stop': 283, 'sideways_use_sma': False, 'sideways_use_ema': False, 'sideways_use_atr': True, 'sideways_use_adx': True, 'sideways_use_spike': True, 'sideways_rsi_required': True}.
[I 2025-08-30 20:33:54,133] Trial 875 finished with values: [-1000000000.0, 1000000000.0] and parameters: {'p_sma': 46, 'p_std': 14, 'p_atr': 9, 'p_adx': 7, 'rsi_period': 80, 'ema1': 10, 'ema2': 15, 'slip_atr_k': 0.020349362683533795, 'slip_spread_k': 0.5781904673556777, 'spread_hl_frac': 0.043194538483402, 'bb_std_mult': 1.431286392083678, 'rsi_os': 39, 'rsi_ob': 72, 'vol_spike': 0.14938598823461918, 'adx_thresh': 23.674667277856013, 'atr_min_pct': 0.004594972238844213, 'atr_max_pct': 0.1286936254899699, 'tp_mult': 2.24640129174679, 'tsl_mult': 0.6908360845653292, 'strategy': 'mean_reversion', 'time_stop': 95, 'use_sma': False, 'use_atr': False, 'use_adx': True, 'use_ema': True, 'use_spike': True, 'rsi_required': False, 'edge_k': 1.0033196517740628, 'edge_cap': 0.6711123513325997, 'bull_strategy': 'breakout', 'bull_bb_std_mult': 1.8007344947222164, 'bull_rsi_os': 32, 'bull_rsi_ob': 82, 'bull_adx_thresh': 7.8137477349073325, 'bull_atr_min_pct': 0.0191210605544413, 'bull_atr_max_pct': 0.07551825256781954, 'bull_tp_mult': 2.010050573736366, 'bull_tsl_mult': 0.937508713049096, 'bull_time_stop': 281, 'bull_use_sma': False, 'bull_use_ema': True, 'bull_use_atr': False, 'bull_use_adx': True, 'bull_use_spike': False, 'bull_rsi_required': False, 'bear_strategy': 'mean_reversion', 'bear_bb_std_mult': 3.3707133675046967, 'bear_rsi_os': 49, 'bear_rsi_ob': 49, 'bear_adx_thresh': 5.539124971216357, 'bear_atr_min_pct': 0.008396605267236196, 'bear_atr_max_pct': 0.14712954676251166, 'bear_tp_mult': 2.902134332338559, 'bear_tsl_mult': 0.16055056638404375, 'bear_time_stop': 20, 'bear_use_sma': False, 'bear_use_ema': False, 'bear_use_atr': False, 'bear_use_adx': False, 'bear_use_spike': True, 'bear_rsi_required': True, 'sideways_strategy': 'mean_reversion', 'sideways_bb_std_mult': 2.032945749025012, 'sideways_rsi_os': 23, 'sideways_rsi_ob': 54, 'sideways_adx_thresh': 31.66756121130628, 'sideways_atr_min_pct': 0.024751981040636882, 'sideways_atr_max_pct': 0.04138626767260078, 'sideways_tp_mult': 1.4859732973377162, 'sideways_tsl_mult': 0.9326894217052504, 'sideways_time_stop': 278, 'sideways_use_sma': False, 'sideways_use_ema': True, 'sideways_use_atr': True, 'sideways_use_adx': True, 'sideways_use_spike': True, 'sideways_rsi_required': True}.
[I 2025-08-30 20:33:58,879] Trial 879 finished with values: [-1000000000.0, 1000000000.0] and parameters: {'p_sma': 45, 'p_std': 14, 'p_atr': 9, 'p_adx': 7, 'rsi_period': 78, 'ema1': 13, 'ema2': 14, 'slip_atr_k': 0.14161844096095136, 'slip_spread_k': 0.6596886247361055, 'spread_hl_frac': 0.03557176721841702, 'bb_std_mult': 3.1759246198436544, 'rsi_os': 32, 'rsi_ob': 64, 'vol_spike': 0.14855249797173897, 'adx_thresh': 24.676280617991775, 'atr_min_pct': 0.01079644510813254, 'atr_max_pct': 0.12902231899406974, 'tp_mult': 2.238427911808634, 'tsl_mult': 0.3176668170237817, 'strategy': 'breakout', 'time_stop': 38, 'use_sma': False, 'use_atr': False, 'use_adx': False, 'use_ema': False, 'use_spike': True, 'rsi_required': True, 'edge_k': 1.4353846307356246, 'edge_cap': 0.35752220953337516, 'bull_strategy': 'breakout', 'bull_bb_std_mult': 3.256456710992497, 'bull_rsi_os': 9, 'bull_rsi_ob': 57, 'bull_adx_thresh': 13.814763438510443, 'bull_atr_min_pct': 0.022902169958650503, 'bull_atr_max_pct': 0.08504236705507817, 'bull_tp_mult': 2.110833941903018, 'bull_tsl_mult': 0.9367085364662084, 'bull_time_stop': 300, 'bull_use_sma': True, 'bull_use_ema': True, 'bull_use_atr': False, 'bull_use_adx': True, 'bull_use_spike': False, 'bull_rsi_required': True, 'bear_strategy': 'breakout', 'bear_bb_std_mult': 3.586190860691139, 'bear_rsi_os': 46, 'bear_rsi_ob': 50, 'bear_adx_thresh': 20.379371782754482, 'bear_atr_min_pct': 0.007921310205086499, 'bear_atr_max_pct': 0.09953219574050194, 'bear_tp_mult': 2.7675800087537974, 'bear_tsl_mult': 0.11015547397873957, 'bear_time_stop': 11, 'bear_use_sma': True, 'bear_use_ema': False, 'bear_use_atr': True, 'bear_use_adx': True, 'bear_use_spike': False, 'bear_rsi_required': True, 'sideways_strategy': 'mean_reversion', 'sideways_bb_std_mult': 2.481803431032787, 'sideways_rsi_os': 23, 'sideways_rsi_ob': 54, 'sideways_adx_thresh': 30.792211043592797, 'sideways_atr_min_pct': 0.0257517135548484, 'sideways_atr_max_pct': 0.05378361373753124, 'sideways_tp_mult': 1.4899636546632387, 'sideways_tsl_mult': 0.8773186830327737, 'sideways_time_stop': 284, 'sideways_use_sma': False, 'sideways_use_ema': False, 'sideways_use_atr': False, 'sideways_use_adx': False, 'sideways_use_spike': False, 'sideways_rsi_required': True}.
[I 2025-08-30 20:34:00,370] Trial 880 finished with values: [-1000000000.0, 1000000000.0] and parameters: {'p_sma': 49, 'p_std': 10, 'p_atr': 10, 'p_adx': 7, 'rsi_period': 77, 'ema1': 16, 'ema2': 15, 'slip_atr_k': 0.1331445402642231, 'slip_spread_k': 0.5997364496822731, 'spread_hl_frac': 0.035377154959546374, 'bb_std_mult': 2.9652777185182275, 'rsi_os': 53, 'rsi_ob': 63, 'vol_spike': 0.12787736852713127, 'adx_thresh': 21.721806310905933, 'atr_min_pct': 0.019514523442307617, 'atr_max_pct': 0.1296593642301439, 'tp_mult': 2.2970070100438704, 'tsl_mult': 0.6556014402171666, 'strategy': 'breakout', 'time_stop': 215, 'use_sma': True, 'use_atr': True, 'use_adx': False, 'use_ema': False, 'use_spike': True, 'rsi_required': True, 'edge_k': 1.427156763559112, 'edge_cap': 0.3589478434089942, 'bull_strategy': 'mean_reversion', 'bull_bb_std_mult': 1.4045775541924046, 'bull_rsi_os': 7, 'bull_rsi_ob': 69, 'bull_adx_thresh': 32.40560324914733, 'bull_atr_min_pct': 0.005481614209866623, 'bull_atr_max_pct': 0.08587739898728872, 'bull_tp_mult': 2.1189765474174704, 'bull_tsl_mult': 0.9354190734663517, 'bull_time_stop': 198, 'bull_use_sma': True, 'bull_use_ema': False, 'bull_use_atr': False, 'bull_use_adx': True, 'bull_use_spike': True, 'bull_rsi_required': True, 'bear_strategy': 'breakout', 'bear_bb_std_mult': 3.4842613704256253, 'bear_rsi_os': 46, 'bear_rsi_ob': 45, 'bear_adx_thresh': 20.49276434482559, 'bear_atr_min_pct': 0.006977158935184599, 'bear_atr_max_pct': 0.13017236617616426, 'bear_tp_mult': 2.785760484345331, 'bear_tsl_mult': 0.10602780376685526, 'bear_time_stop': 19, 'bear_use_sma': True, 'bear_use_ema': False, 'bear_use_atr': True, 'bear_use_adx': True, 'bear_use_spike': False, 'bear_rsi_required': True, 'sideways_strategy': 'mean_reversion', 'sideways_bb_std_mult': 1.9632572348504158, 'sideways_rsi_os': 20, 'sideways_rsi_ob': 67, 'sideways_adx_thresh': 27.107919107584824, 'sideways_atr_min_pct': 0.02603053967058158, 'sideways_atr_max_pct': 0.04833215181993501, 'sideways_tp_mult': 1.1949361586771106, 'sideways_tsl_mult': 0.873359161516332, 'sideways_time_stop': 284, 'sideways_use_sma': False, 'sideways_use_ema': True, 'sideways_use_atr': False, 'sideways_use_adx': False, 'sideways_use_spike': False, 'sideways_rsi_required': True}.
