[I 2025-08-30 19:50:47,423] Trial 567 finished with values: [-0.028620279141864158, 0.028533312272626565] and parameters: {'p_sma': 40, 'p_std': 27, 'p_atr': 13, 'p_adx': 10, 'rsi_period': 34, 'ema1': 24, 'ema2': 54, 'slip_atr_k': 0.21434028485064135, 'slip_spread_k': 0.4098711937117276, 'spread_hl_frac': 0.019860201774021372, 'bb_std_mult': 2.7168000105219843, 'rsi_os': 35, 'rsi_ob': 84, 'vol_spike': 0.27329955350869795, 'adx_thresh': 19.579354427002414, 'atr_min_pct': 0.00872740823183719, 'atr_max_pct': 0.073354814915371, 'tp_mult': 2.2526062720394773, 'tsl_mult': 0.04564753433499069, 'strategy': 'breakout', 'time_stop': 19, 'use_sma': False, 'use_atr': True, 'use_adx': False, 'use_ema': True, 'use_spike': False, 'rsi_required': False, 'edge_k': 0.11266564438964802, 'edge_cap': 0.9134505414669891, 'bull_strategy': 'mean_reversion', 'bull_bb_std_mult': 0.7524985903326618, 'bull_rsi_os': 50, 'bull_rsi_ob': 91, 'bull_adx_thresh': 33.39442990700454, 'bull_atr_min_pct': 0.0013808762524852268, 'bull_atr_max_pct': 0.05923267984825646, 'bull_tp_mult': 2.152871201008033, 'bull_tsl_mult': 0.8824350291334556, 'bull_time_stop': 96, 'bull_use_sma': True, 'bull_use_ema': False, 'bull_use_atr': True, 'bull_use_adx': True, 'bull_use_spike': True, 'bull_rsi_required': False, 'bear_strategy': 'breakout', 'bear_bb_std_mult': 3.390159546026767, 'bear_rsi_os': 43, 'bear_rsi_ob': 83, 'bear_adx_thresh': 25.527918399683788, 'bear_atr_min_pct': 0.015850929100871523, 'bear_atr_max_pct': 0.041565369311961364, 'bear_tp_mult': 1.840868454326061, 'bear_tsl_mult': 0.16707863512316393, 'bear_time_stop': 29, 'bear_use_sma': False, 'bear_use_ema': True, 'bear_use_atr': True, 'bear_use_adx': True, 'bear_use_spike': False, 'bear_rsi_required': True, 'sideways_strategy': 'breakout', 'sideways_bb_std_mult': 2.025332544338416, 'sideways_rsi_os': 25, 'sideways_rsi_ob': 55, 'sideways_adx_thresh': 9.361128551467134, 'sideways_atr_min_pct': 0.025038045342290906, 'sideways_atr_max_pct': 0.09656208186191877, 'sideways_tp_mult': 1.827654833898508, 'sideways_tsl_mult': 0.7539402105640333, 'sideways_time_stop': 278, 'sideways_use_sma': True, 'sideways_use_ema': False, 'sideways_use_atr': False, 'sideways_use_adx': False, 'sideways_use_spike': False, 'sideways_rsi_required': False}.
[I 2025-08-30 19:50:47,739] Trial 565 finished with values: [-1000000000.0, 1000000000.0] and parameters: {'p_sma': 42, 'p_std': 11, 'p_atr': 13, 'p_adx': 9, 'rsi_period': 52, 'ema1': 30, 'ema2': 15, 'slip_atr_k': 0.035785107369388044, 'slip_spread_k': 0.41322074245115237, 'spread_hl_frac': 0.019840238978801744, 'bb_std_mult': 1.0204434719779505, 'rsi_os': 35, 'rsi_ob': 66, 'vol_spike': 0.0454739337171118, 'adx_thresh': 13.536518599271254, 'atr_min_pct': 0.029953319447127043, 'atr_max_pct': 0.14677029634576497, 'tp_mult': 2.2579846939927544, 'tsl_mult': 0.4047907921888581, 'strategy': 'breakout', 'time_stop': 19, 'use_sma': False, 'use_atr': True, 'use_adx': False, 'use_ema': False, 'use_spike': True, 'rsi_required': True, 'edge_k': 0.10996526909711549, 'edge_cap': 0.29394816072656466, 'bull_strategy': 'mean_reversion', 'bull_bb_std_mult': 2.1711872236688072, 'bull_rsi_os': 45, 'bull_rsi_ob': 70, 'bull_adx_thresh': 24.807281018053985, 'bull_atr_min_pct': 0.0011943604013123499, 'bull_atr_max_pct': 0.019985068982679106, 'bull_tp_mult': 1.5813833474780146, 'bull_tsl_mult': 0.9845250286481291, 'bull_time_stop': 186, 'bull_use_sma': True, 'bull_use_ema': True, 'bull_use_atr': False, 'bull_use_adx': True, 'bull_use_spike': True, 'bull_rsi_required': True, 'bear_strategy': 'breakout', 'bear_bb_std_mult': 2.42363316547392, 'bear_rsi_os': 46, 'bear_rsi_ob': 45, 'bear_adx_thresh': 6.34649250896871, 'bear_atr_min_pct': 0.016475938419892228, 'bear_atr_max_pct': 0.06342541642212493, 'bear_tp_mult': 2.10334530325835, 'bear_tsl_mult': 0.1669123211411317, 'bear_time_stop': 29, 'bear_use_sma': True, 'bear_use_ema': False, 'bear_use_atr': True, 'bear_use_adx': True, 'bear_use_spike': False, 'bear_rsi_required': False, 'sideways_strategy': 'breakout', 'sideways_bb_std_mult': 1.8744401594221682, 'sideways_rsi_os': 53, 'sideways_rsi_ob': 58, 'sideways_adx_thresh': 9.224671930645615, 'sideways_atr_min_pct': 0.005148357465100716, 'sideways_atr_max_pct': 0.11908229053456869, 'sideways_tp_mult': 1.831364022249476, 'sideways_tsl_mult': 0.6405375618458735, 'sideways_time_stop': 193, 'sideways_use_sma': True, 'sideways_use_ema': True, 'sideways_use_atr': False, 'sideways_use_adx': False, 'sideways_use_spike': True, 'sideways_rsi_required': False}.
[I 2025-08-30 19:50:48,711] Trial 572 finished with values: [-1000000000.0, 1000000000.0] and parameters: {'p_sma': 28, 'p_std': 42, 'p_atr': 21, 'p_adx': 15, 'rsi_period': 78, 'ema1': 23, 'ema2': 13, 'slip_atr_k': 0.05857124281677645, 'slip_spread_k': 0.4252996182054318, 'spread_hl_frac': 0.045758661935826256, 'bb_std_mult': 1.2021404738466746, 'rsi_os': 26, 'rsi_ob': 50, 'vol_spike': 0.18545584363254203, 'adx_thresh': 18.366599831885992, 'atr_min_pct': 0.023978357408801228, 'atr_max_pct': 0.13437522107229385, 'tp_mult': 2.175380464013545, 'tsl_mult': 0.7401928989416525, 'strategy': 'mean_reversion', 'time_stop': 5, 'use_sma': True, 'use_atr': True, 'use_adx': False, 'use_ema': False, 'use_spike': True, 'rsi_required': True, 'edge_k': 0.17327315638189816, 'edge_cap': 0.7252435731024481, 'bull_strategy': 'mean_reversion', 'bull_bb_std_mult': 1.6175404424957691, 'bull_rsi_os': 17, 'bull_rsi_ob': 49, 'bull_adx_thresh': 26.850414947774027, 'bull_atr_min_pct': 0.015391025255610133, 'bull_atr_max_pct': 0.02832826420565461, 'bull_tp_mult': 2.083316550302898, 'bull_tsl_mult': 0.7587281381548265, 'bull_time_stop': 213, 'bull_use_sma': False, 'bull_use_ema': False, 'bull_use_atr': False, 'bull_use_adx': True, 'bull_use_spike': False, 'bull_rsi_required': True, 'bear_strategy': 'mean_reversion', 'bear_bb_std_mult': 3.158675403679895, 'bear_rsi_os': 38, 'bear_rsi_ob': 82, 'bear_adx_thresh': 7.258048016678367, 'bear_atr_min_pct': 0.009156464244264861, 'bear_atr_max_pct': 0.055123044498293014, 'bear_tp_mult': 1.647912723039984, 'bear_tsl_mult': 0.054320632309059536, 'bear_time_stop': 111, 'bear_use_sma': True, 'bear_use_ema': False, 'bear_use_atr': True, 'bear_use_adx': True, 'bear_use_spike': True, 'bear_rsi_required': False, 'sideways_strategy': 'mean_reversion', 'sideways_bb_std_mult': 2.5998497863850556, 'sideways_rsi_os': 13, 'sideways_rsi_ob': 60, 'sideways_adx_thresh': 33.405405822519235, 'sideways_atr_min_pct': 0.010796153205255144, 'sideways_atr_max_pct': 0.12439887045334036, 'sideways_tp_mult': 2.1454673051610142, 'sideways_tsl_mult': 0.5688292471595908, 'sideways_time_stop': 300, 'sideways_use_sma': True, 'sideways_use_ema': True, 'sideways_use_atr': True, 'sideways_use_adx': True, 'sideways_use_spike': False, 'sideways_rsi_required': False}.
[I 2025-08-30 19:51:21,371] Trial 570 finished with values: [-0.026146884779482016, 0.02603431811366963] and parameters: {'p_sma': 37, 'p_std': 11, 'p_atr': 22, 'p_adx': 9, 'rsi_period': 46, 'ema1': 24, 'ema2': 36, 'slip_atr_k': 0.22617445769694058, 'slip_spread_k': 0.4207663012258372, 'spread_hl_frac': 0.012779387029598967, 'bb_std_mult': 1.2156595615071222, 'rsi_os': 35, 'rsi_ob': 49, 'vol_spike': 0.03977602141203847, 'adx_thresh': 17.34178247663039, 'atr_min_pct': 0.02417106034364791, 'atr_max_pct': 0.07111280676371536, 'tp_mult': 1.1799109213441294, 'tsl_mult': 0.9013663338367326, 'strategy': 'breakout', 'time_stop': 65, 'use_sma': True, 'use_atr': True, 'use_adx': False, 'use_ema': True, 'use_spike': False, 'rsi_required': True, 'edge_k': 1.8021409407848794, 'edge_cap': 0.48238873602376336, 'bull_strategy': 'mean_reversion', 'bull_bb_std_mult': 1.8088233528100175, 'bull_rsi_os': 50, 'bull_rsi_ob': 48, 'bull_adx_thresh': 25.15957494106015, 'bull_atr_min_pct': 0.0026118274730185386, 'bull_atr_max_pct': 0.028329314959134377, 'bull_tp_mult': 2.1586793858287434, 'bull_tsl_mult': 0.9785821544424459, 'bull_time_stop': 189, 'bull_use_sma': True, 'bull_use_ema': False, 'bull_use_atr': False, 'bull_use_adx': True, 'bull_use_spike': False, 'bull_rsi_required': False, 'bear_strategy': 'mean_reversion', 'bear_bb_std_mult': 0.8996821079009854, 'bear_rsi_os': 46, 'bear_rsi_ob': 82, 'bear_adx_thresh': 25.18523043781576, 'bear_atr_min_pct': 0.009286537287774631, 'bear_atr_max_pct': 0.04973913485958929, 'bear_tp_mult': 1.818526910480227, 'bear_tsl_mult': 0.4678548288116866, 'bear_time_stop': 33, 'bear_use_sma': True, 'bear_use_ema': False, 'bear_use_atr': True, 'bear_use_adx': True, 'bear_use_spike': True, 'bear_rsi_required': False, 'sideways_strategy': 'mean_reversion', 'sideways_bb_std_mult': 2.0300136410596177, 'sideways_rsi_os': 16, 'sideways_rsi_ob': 70, 'sideways_adx_thresh': 8.606862152616435, 'sideways_atr_min_pct': 0.019033139407550134, 'sideways_atr_max_pct': 0.12467802123129167, 'sideways_tp_mult': 1.7792572281543038, 'sideways_tsl_mult': 0.6402184102063019, 'sideways_time_stop': 194, 'sideways_use_sma': True, 'sideways_use_ema': True, 'sideways_use_atr': True, 'sideways_use_adx': False, 'sideways_use_spike': False, 'sideways_rsi_required': False}.
[I 2025-08-30 19:51:21,962] Trial 571 finished with values: [-0.07079960601942403, 0.07073531739235744] and parameters: {'p_sma': 29, 'p_std': 23, 'p_atr': 11, 'p_adx': 9, 'rsi_period': 40, 'ema1': 23, 'ema2': 13, 'slip_atr_k': 0.09946553323100786, 'slip_spread_k': 0.41960302036115227, 'spread_hl_frac': 0.04461329641292603, 'bb_std_mult': 0.9568030881429163, 'rsi_os': 44, 'rsi_ob': 63, 'vol_spike': 0.03736010965916058, 'adx_thresh': 18.317289303516752, 'atr_min_pct': 0.02440883551835574, 'atr_max_pct': 0.13416234256812723, 'tp_mult': 2.473290741031565, 'tsl_mult': 0.7152361398369473, 'strategy': 'breakout', 'time_stop': 122, 'use_sma': True, 'use_atr': True, 'use_adx': False, 'use_ema': False, 'use_spike': True, 'rsi_required': True, 'edge_k': 0.19563819301362415, 'edge_cap': 0.3178096458583969, 'bull_strategy': 'mean_reversion', 'bull_bb_std_mult': 1.6589466041427432, 'bull_rsi_os': 51, 'bull_rsi_ob': 48, 'bull_adx_thresh': 26.79846551036953, 'bull_atr_min_pct': 0.003202365143224698, 'bull_atr_max_pct': 0.02839426011046456, 'bull_tp_mult': 2.0794504465754424, 'bull_tsl_mult': 0.9839420151975823, 'bull_time_stop': 300, 'bull_use_sma': False, 'bull_use_ema': False, 'bull_use_atr': False, 'bull_use_adx': True, 'bull_use_spike': False, 'bull_rsi_required': True, 'bear_strategy': 'mean_reversion', 'bear_bb_std_mult': 3.1185175564724816, 'bear_rsi_os': 46, 'bear_rsi_ob': 56, 'bear_adx_thresh': 7.119560391043693, 'bear_atr_min_pct': 0.0009074892491761789, 'bear_atr_max_pct': 0.055103560595450456, 'bear_tp_mult': 2.436946712927094, 'bear_tsl_mult': 0.07640843929442986, 'bear_time_stop': 50, 'bear_use_sma': True, 'bear_use_ema': False, 'bear_use_atr': True, 'bear_use_adx': True, 'bear_use_spike': True, 'bear_rsi_required': False, 'sideways_strategy': 'mean_reversion', 'sideways_bb_std_mult': 1.9132349020464299, 'sideways_rsi_os': 46, 'sideways_rsi_ob': 59, 'sideways_adx_thresh': 8.553177043936817, 'sideways_atr_min_pct': 0.01818813289048971, 'sideways_atr_max_pct': 0.12514557847398577, 'sideways_tp_mult': 2.1457510095179733, 'sideways_tsl_mult': 0.640440897359414, 'sideways_time_stop': 195, 'sideways_use_sma': True, 'sideways_use_ema': True, 'sideways_use_atr': True, 'sideways_use_adx': True, 'sideways_use_spike': False, 'sideways_rsi_required': False}.
[I 2025-08-30 19:51:22,670] Trial 569 finished with values: [-1000000000.0, 1000000000.0] and parameters: {'p_sma': 37, 'p_std': 26, 'p_atr': 21, 'p_adx': 10, 'rsi_period': 46, 'ema1': 24, 'ema2': 27, 'slip_atr_k': 0.09061829788740353, 'slip_spread_k': 0.41263786285410525, 'spread_hl_frac': 0.019622938808831175, 'bb_std_mult': 0.965687437612371, 'rsi_os': 43, 'rsi_ob': 80, 'vol_spike': 0.0375339114329459, 'adx_thresh': 19.3767089711711, 'atr_min_pct': 0.02590379621597233, 'atr_max_pct': 0.10371177526140986, 'tp_mult': 2.2298187916089875, 'tsl_mult': 0.26463050357473583, 'strategy': 'breakout', 'time_stop': 248, 'use_sma': True, 'use_atr': True, 'use_adx': False, 'use_ema': False, 'use_spike': True, 'rsi_required': True, 'edge_k': 1.7936550865564622, 'edge_cap': 0.19788221845110654, 'bull_strategy': 'mean_reversion', 'bull_bb_std_mult': 1.9228623094372677, 'bull_rsi_os': 9, 'bull_rsi_ob': 70, 'bull_adx_thresh': 26.691878278287167, 'bull_atr_min_pct': 0.003464323223230583, 'bull_atr_max_pct': 0.02851275480098783, 'bull_tp_mult': 2.140381228978258, 'bull_tsl_mult': 0.979464676554728, 'bull_time_stop': 215, 'bull_use_sma': True, 'bull_use_ema': True, 'bull_use_atr': False, 'bull_use_adx': True, 'bull_use_spike': False, 'bull_rsi_required': True, 'bear_strategy': 'mean_reversion', 'bear_bb_std_mult': 0.9214857211712111, 'bear_rsi_os': 43, 'bear_rsi_ob': 83, 'bear_adx_thresh': 6.403969127921462, 'bear_atr_min_pct': 0.014153855492255275, 'bear_atr_max_pct': 0.04902205089732678, 'bear_tp_mult': 1.7916332419590968, 'bear_tsl_mult': 0.07201574798227373, 'bear_time_stop': 111, 'bear_use_sma': False, 'bear_use_ema': False, 'bear_use_atr': True, 'bear_use_adx': True, 'bear_use_spike': False, 'bear_rsi_required': True, 'sideways_strategy': 'breakout', 'sideways_bb_std_mult': 2.0132314641838085, 'sideways_rsi_os': 13, 'sideways_rsi_ob': 58, 'sideways_adx_thresh': 20.27453962946251, 'sideways_atr_min_pct': 0.007022273749341385, 'sideways_atr_max_pct': 0.06132708310703949, 'sideways_tp_mult': 1.8174109611948157, 'sideways_tsl_mult': 0.6391215406739489, 'sideways_time_stop': 253, 'sideways_use_sma': True, 'sideways_use_ema': True, 'sideways_use_atr': False, 'sideways_use_adx': False, 'sideways_use_spike': True, 'sideways_rsi_required': False}.
[I 2025-08-30 19:51:23,355] Trial 573 finished with values: [-1000000000.0, 1000000000.0] and parameters: {'p_sma': 12, 'p_std': 8, 'p_atr': 11, 'p_adx': 26, 'rsi_period': 46, 'ema1': 16, 'ema2': 18, 'slip_atr_k': 0.10200223827835517, 'slip_spread_k': 0.45392647031812866, 'spread_hl_frac': 0.012694129455770737, 'bb_std_mult': 0.9737339324632066, 'rsi_os': 37, 'rsi_ob': 58, 'vol_spike': 0.22119453549135676, 'adx_thresh': 17.513242068131827, 'atr_min_pct': 0.010510759121388054, 'atr_max_pct': 0.13751899467205042, 'tp_mult': 2.459408322830859, 'tsl_mult': 0.713828303403827, 'strategy': 'breakout', 'time_stop': 249, 'use_sma': True, 'use_atr': True, 'use_adx': False, 'use_ema': False, 'use_spike': True, 'rsi_required': True, 'edge_k': 1.8847713247230193, 'edge_cap': 0.31814586108880194, 'bull_strategy': 'mean_reversion', 'bull_bb_std_mult': 1.805005464482568, 'bull_rsi_os': 9, 'bull_rsi_ob': 59, 'bull_adx_thresh': 7.845747277339893, 'bull_atr_min_pct': 0.003100072128211495, 'bull_atr_max_pct': 0.03356752130391344, 'bull_tp_mult': 2.0500388740879893, 'bull_tsl_mult': 0.03657246792108765, 'bull_time_stop': 179, 'bull_use_sma': True, 'bull_use_ema': False, 'bull_use_atr': False, 'bull_use_adx': True, 'bull_use_spike': False, 'bull_rsi_required': True, 'bear_strategy': 'mean_reversion', 'bear_bb_std_mult': 0.8731866015562173, 'bear_rsi_os': 42, 'bear_rsi_ob': 84, 'bear_adx_thresh': 8.087051677747251, 'bear_atr_min_pct': 0.017596594077879283, 'bear_atr_max_pct': 0.049832912557075504, 'bear_tp_mult': 1.8033606667765283, 'bear_tsl_mult': 0.07936722333876978, 'bear_time_stop': 191, 'bear_use_sma': True, 'bear_use_ema': False, 'bear_use_atr': True, 'bear_use_adx': True, 'bear_use_spike': False, 'bear_rsi_required': False, 'sideways_strategy': 'mean_reversion', 'sideways_bb_std_mult': 3.363398000103446, 'sideways_rsi_os': 18, 'sideways_rsi_ob': 46, 'sideways_adx_thresh': 8.461981800383949, 'sideways_atr_min_pct': 0.01470162887714516, 'sideways_atr_max_pct': 0.11507991330667733, 'sideways_tp_mult': 1.784730663906808, 'sideways_tsl_mult': 0.636408846084493, 'sideways_time_stop': 280, 'sideways_use_sma': True, 'sideways_use_ema': True, 'sideways_use_atr': False, 'sideways_use_adx': False, 'sideways_use_spike': False, 'sideways_rsi_required': False}.
[I 2025-08-30 19:51:56,769] Trial 577 finished with values: [-1000000000.0, 1000000000.0] and parameters: {'p_sma': 39, 'p_std': 24, 'p_atr': 9, 'p_adx': 8, 'rsi_period': 65, 'ema1': 9, 'ema2': 19, 'slip_atr_k': 0.004280257156824348, 'slip_spread_k': 0.3825784197590916, 'spread_hl_frac': 0.003444369070052315, 'bb_std_mult': 0.8051395759015754, 'rsi_os': 41, 'rsi_ob': 56, 'vol_spike': 0.29605979217681716, 'adx_thresh': 5.9733583863690445, 'atr_min_pct': 0.023174110371770282, 'atr_max_pct': 0.13955536323293932, 'tp_mult': 2.1258840784040074, 'tsl_mult': 0.7442872402915853, 'strategy': 'mean_reversion', 'time_stop': 32, 'use_sma': False, 'use_atr': False, 'use_adx': False, 'use_ema': False, 'use_spike': True, 'rsi_required': False, 'edge_k': 0.152298222977909, 'edge_cap': 0.2464176615844088, 'bull_strategy': 'breakout', 'bull_bb_std_mult': 1.8710275229040627, 'bull_rsi_os': 48, 'bull_rsi_ob': 73, 'bull_adx_thresh': 27.69607571746814, 'bull_atr_min_pct': 0.004475355194151756, 'bull_atr_max_pct': 0.025697266628560266, 'bull_tp_mult': 2.210684868067912, 'bull_tsl_mult': 0.9418173166112964, 'bull_time_stop': 193, 'bull_use_sma': True, 'bull_use_ema': False, 'bull_use_atr': True, 'bull_use_adx': False, 'bull_use_spike': True, 'bull_rsi_required': True, 'bear_strategy': 'breakout', 'bear_bb_std_mult': 3.214309908336292, 'bear_rsi_os': 29, 'bear_rsi_ob': 81, 'bear_adx_thresh': 5.762589573242617, 'bear_atr_min_pct': 0.010578208228588567, 'bear_atr_max_pct': 0.058574168416322764, 'bear_tp_mult': 1.744486591126965, 'bear_tsl_mult': 0.10263615860564607, 'bear_time_stop': 21, 'bear_use_sma': True, 'bear_use_ema': True, 'bear_use_atr': False, 'bear_use_adx': False, 'bear_use_spike': False, 'bear_rsi_required': False, 'sideways_strategy': 'breakout', 'sideways_bb_std_mult': 2.728781955645239, 'sideways_rsi_os': 16, 'sideways_rsi_ob': 56, 'sideways_adx_thresh': 6.937799166941942, 'sideways_atr_min_pct': 0.02794368504285634, 'sideways_atr_max_pct': 0.11015234034726118, 'sideways_tp_mult': 1.686746724078101, 'sideways_tsl_mult': 0.6899140162709492, 'sideways_time_stop': 289, 'sideways_use_sma': False, 'sideways_use_ema': False, 'sideways_use_atr': False, 'sideways_use_adx': False, 'sideways_use_spike': False, 'sideways_rsi_required': True}.
[I 2025-08-30 19:51:57,529] Trial 574 finished with values: [-1000000000.0, 1000000000.0] and parameters: {'p_sma': 39, 'p_std': 24, 'p_atr': 10, 'p_adx': 8, 'rsi_period': 50, 'ema1': 9, 'ema2': 20, 'slip_atr_k': 0.19018118876036333, 'slip_spread_k': 0.38418194368403286, 'spread_hl_frac': 0.022682937669348653, 'bb_std_mult': 0.9536278309318057, 'rsi_os': 37, 'rsi_ob': 47, 'vol_spike': 0.2936679492669385, 'adx_thresh': 18.974768015659404, 'atr_min_pct': 0.02907602277486726, 'atr_max_pct': 0.1370865157413537, 'tp_mult': 1.4506080858501678, 'tsl_mult': 0.7115113276910444, 'strategy': 'breakout', 'time_stop': 33, 'use_sma': False, 'use_atr': True, 'use_adx': False, 'use_ema': False, 'use_spike': True, 'rsi_required': True, 'edge_k': 0.19444570117972537, 'edge_cap': 0.19387223738968, 'bull_strategy': 'mean_reversion', 'bull_bb_std_mult': 1.9143352774177873, 'bull_rsi_os': 9, 'bull_rsi_ob': 73, 'bull_adx_thresh': 27.692531349604916, 'bull_atr_min_pct': 0.004499755667296502, 'bull_atr_max_pct': 0.03219409514747507, 'bull_tp_mult': 2.036399071138502, 'bull_tsl_mult': 0.7316061362162145, 'bull_time_stop': 37, 'bull_use_sma': True, 'bull_use_ema': False, 'bull_use_atr': True, 'bull_use_adx': False, 'bull_use_spike': True, 'bull_rsi_required': True, 'bear_strategy': 'breakout', 'bear_bb_std_mult': 3.1226268069077228, 'bear_rsi_os': 29, 'bear_rsi_ob': 85, 'bear_adx_thresh': 26.945097739130027, 'bear_atr_min_pct': 0.0009205573490391004, 'bear_atr_max_pct': 0.058040325647197626, 'bear_tp_mult': 2.4278079263708365, 'bear_tsl_mult': 0.6065141097789131, 'bear_time_stop': 214, 'bear_use_sma': True, 'bear_use_ema': True, 'bear_use_atr': True, 'bear_use_adx': True, 'bear_use_spike': False, 'bear_rsi_required': False, 'sideways_strategy': 'breakout', 'sideways_bb_std_mult': 1.6508606903950303, 'sideways_rsi_os': 6, 'sideways_rsi_ob': 56, 'sideways_adx_thresh': 10.022212675404699, 'sideways_atr_min_pct': 0.028010781111970015, 'sideways_atr_max_pct': 0.14504275653562612, 'sideways_tp_mult': 1.87966652327145, 'sideways_tsl_mult': 0.6920007889719522, 'sideways_time_stop': 294, 'sideways_use_sma': True, 'sideways_use_ema': True, 'sideways_use_atr': False, 'sideways_use_adx': False, 'sideways_use_spike': False, 'sideways_rsi_required': False}.
