[I 2025-08-30 20:11:55,406] Trial 720 finished with values: [-1000000000.0, 1000000000.0] and parameters: {'p_sma': 48, 'p_std': 31, 'p_atr': 27, 'p_adx': 8, 'rsi_period': 52, 'ema1': 24, 'ema2': 49, 'slip_atr_k': 0.1188136123893081, 'slip_spread_k': 0.18155564100904087, 'spread_hl_frac': 0.0009733880091373158, 'bb_std_mult': 2.6733259221533308, 'rsi_os': 38, 'rsi_ob': 55, 'vol_spike': 0.030486325077606, 'adx_thresh': 23.94047742264772, 'atr_min_pct': 0.021764684275630324, 'atr_max_pct': 0.09338100986381143, 'tp_mult': 2.1993659002352244, 'tsl_mult': 0.7529702233452663, 'strategy': 'mean_reversion', 'time_stop': 42, 'use_sma': False, 'use_atr': True, 'use_adx': False, 'use_ema': False, 'use_spike': True, 'rsi_required': True, 'edge_k': 1.845608040836681, 'edge_cap': 0.8572239656062538, 'bull_strategy': 'mean_reversion', 'bull_bb_std_mult': 1.8514656882463947, 'bull_rsi_os': 7, 'bull_rsi_ob': 72, 'bull_adx_thresh': 25.539484559066103, 'bull_atr_min_pct': 0.0065511701558906114, 'bull_atr_max_pct': 0.03551434746288376, 'bull_tp_mult': 1.5312440022902185, 'bull_tsl_mult': 0.7810116021481189, 'bull_time_stop': 199, 'bull_use_sma': False, 'bull_use_ema': True, 'bull_use_atr': False, 'bull_use_adx': True, 'bull_use_spike': False, 'bull_rsi_required': True, 'bear_strategy': 'breakout', 'bear_bb_std_mult': 3.407057173364345, 'bear_rsi_os': 45, 'bear_rsi_ob': 81, 'bear_adx_thresh': 15.375037352891551, 'bear_atr_min_pct': 0.013957551760745642, 'bear_atr_max_pct': 0.060100512330512834, 'bear_tp_mult': 2.2668286748948745, 'bear_tsl_mult': 0.12502111636892035, 'bear_time_stop': 83, 'bear_use_sma': True, 'bear_use_ema': False, 'bear_use_atr': True, 'bear_use_adx': True, 'bear_use_spike': False, 'bear_rsi_required': True, 'sideways_strategy': 'breakout', 'sideways_bb_std_mult': 1.939852633156599, 'sideways_rsi_os': 15, 'sideways_rsi_ob': 72, 'sideways_adx_thresh': 11.241045619920262, 'sideways_atr_min_pct': 0.02010267459240434, 'sideways_atr_max_pct': 0.11732912366902723, 'sideways_tp_mult': 1.8637944443192553, 'sideways_tsl_mult': 0.27365298404689853, 'sideways_time_stop': 262, 'sideways_use_sma': True, 'sideways_use_ema': False, 'sideways_use_atr': False, 'sideways_use_adx': True, 'sideways_use_spike': True, 'sideways_rsi_required': False}.
[I 2025-08-30 20:11:55,721] Trial 721 finished with values: [-1000000000.0, 1000000000.0] and parameters: {'p_sma': 35, 'p_std': 24, 'p_atr': 26, 'p_adx': 7, 'rsi_period': 56, 'ema1': 7, 'ema2': 15, 'slip_atr_k': 0.06147580012617042, 'slip_spread_k': 0.9015238324411876, 'spread_hl_frac': 0.0011289235727667884, 'bb_std_mult': 0.9374367754119635, 'rsi_os': 14, 'rsi_ob': 55, 'vol_spike': 0.030981793934187332, 'adx_thresh': 8.34290500007186, 'atr_min_pct': 0.010843767245723626, 'atr_max_pct': 0.023277083574032985, 'tp_mult': 2.2195357317994246, 'tsl_mult': 0.03266409442424778, 'strategy': 'mean_reversion', 'time_stop': 163, 'use_sma': False, 'use_atr': True, 'use_adx': False, 'use_ema': False, 'use_spike': True, 'rsi_required': True, 'edge_k': 0.08451113783426219, 'edge_cap': 0.20258175770986636, 'bull_strategy': 'mean_reversion', 'bull_bb_std_mult': 1.8152255442919734, 'bull_rsi_os': 45, 'bull_rsi_ob': 76, 'bull_adx_thresh': 15.000170982920938, 'bull_atr_min_pct': 0.0009779592759012854, 'bull_atr_max_pct': 0.10371146187892885, 'bull_tp_mult': 2.329334147055059, 'bull_tsl_mult': 0.9999349265440565, 'bull_time_stop': 192, 'bull_use_sma': True, 'bull_use_ema': True, 'bull_use_atr': False, 'bull_use_adx': True, 'bull_use_spike': False, 'bull_rsi_required': True, 'bear_strategy': 'breakout', 'bear_bb_std_mult': 3.2691466602390524, 'bear_rsi_os': 45, 'bear_rsi_ob': 81, 'bear_adx_thresh': 15.301530869211788, 'bear_atr_min_pct': 0.014013293737751854, 'bear_atr_max_pct': 0.05941328908027442, 'bear_tp_mult': 2.405640038773162, 'bear_tsl_mult': 0.12478540813425179, 'bear_time_stop': 26, 'bear_use_sma': False, 'bear_use_ema': False, 'bear_use_atr': True, 'bear_use_adx': True, 'bear_use_spike': True, 'bear_rsi_required': True, 'sideways_strategy': 'breakout', 'sideways_bb_std_mult': 2.041167869043292, 'sideways_rsi_os': 38, 'sideways_rsi_ob': 58, 'sideways_adx_thresh': 9.72391437531791, 'sideways_atr_min_pct': 0.015160181171442886, 'sideways_atr_max_pct': 0.09954502149194573, 'sideways_tp_mult': 2.1578165722993248, 'sideways_tsl_mult': 0.6325895575215356, 'sideways_time_stop': 270, 'sideways_use_sma': True, 'sideways_use_ema': False, 'sideways_use_atr': False, 'sideways_use_adx': False, 'sideways_use_spike': True, 'sideways_rsi_required': False}.
[I 2025-08-30 20:11:57,194] Trial 722 finished with values: [-1000000000.0, 1000000000.0] and parameters: {'p_sma': 48, 'p_std': 51, 'p_atr': 10, 'p_adx': 8, 'rsi_period': 56, 'ema1': 24, 'ema2': 19, 'slip_atr_k': 0.022824731060170505, 'slip_spread_k': 0.3691720761366566, 'spread_hl_frac': 0.0007030820431625168, 'bb_std_mult': 2.6514451857490036, 'rsi_os': 17, 'rsi_ob': 55, 'vol_spike': 0.0328755304861863, 'adx_thresh': 18.657495085310977, 'atr_min_pct': 0.005160462701965778, 'atr_max_pct': 0.04733161060895438, 'tp_mult': 2.1957496926920044, 'tsl_mult': 0.04142454267172935, 'strategy': 'breakout', 'time_stop': 33, 'use_sma': False, 'use_atr': True, 'use_adx': True, 'use_ema': False, 'use_spike': True, 'rsi_required': True, 'edge_k': 1.84636985581677, 'edge_cap': 0.8365315513426669, 'bull_strategy': 'mean_reversion', 'bull_bb_std_mult': 1.8060590623349204, 'bull_rsi_os': 52, 'bull_rsi_ob': 70, 'bull_adx_thresh': 15.367159902995851, 'bull_atr_min_pct': 0.017649529298426527, 'bull_atr_max_pct': 0.09742668447715368, 'bull_tp_mult': 2.1163158896553322, 'bull_tsl_mult': 0.9825877735977492, 'bull_time_stop': 192, 'bull_use_sma': True, 'bull_use_ema': True, 'bull_use_atr': False, 'bull_use_adx': True, 'bull_use_spike': False, 'bull_rsi_required': True, 'bear_strategy': 'mean_reversion', 'bear_bb_std_mult': 0.7292013942836004, 'bear_rsi_os': 44, 'bear_rsi_ob': 81, 'bear_adx_thresh': 5.01181298535359, 'bear_atr_min_pct': 0.01762843759282543, 'bear_atr_max_pct': 0.05485299253204741, 'bear_tp_mult': 2.2592609354009308, 'bear_tsl_mult': 0.888038309019425, 'bear_time_stop': 51, 'bear_use_sma': False, 'bear_use_ema': False, 'bear_use_atr': True, 'bear_use_adx': True, 'bear_use_spike': True, 'bear_rsi_required': False, 'sideways_strategy': 'breakout', 'sideways_bb_std_mult': 2.051491452933694, 'sideways_rsi_os': 32, 'sideways_rsi_ob': 61, 'sideways_adx_thresh': 9.836667189348821, 'sideways_atr_min_pct': 0.02033851573216497, 'sideways_atr_max_pct': 0.11767395932136024, 'sideways_tp_mult': 1.832388463776246, 'sideways_tsl_mult': 0.7046796343159162, 'sideways_time_stop': 74, 'sideways_use_sma': True, 'sideways_use_ema': False, 'sideways_use_atr': False, 'sideways_use_adx': False, 'sideways_use_spike': True, 'sideways_rsi_required': False}.
[I 2025-08-30 20:12:32,124] Trial 726 finished with values: [-1000000000.0, 1000000000.0] and parameters: {'p_sma': 46, 'p_std': 29, 'p_atr': 11, 'p_adx': 7, 'rsi_period': 50, 'ema1': 23, 'ema2': 17, 'slip_atr_k': 0.08340174935133295, 'slip_spread_k': 0.8187776704163254, 'spread_hl_frac': 0.00488905767881938, 'bb_std_mult': 3.379448079161418, 'rsi_os': 38, 'rsi_ob': 57, 'vol_spike': 0.15465607922472, 'adx_thresh': 16.967183862376192, 'atr_min_pct': 0.024701568042058416, 'atr_max_pct': 0.11451569474969261, 'tp_mult': 1.5542721792685517, 'tsl_mult': 0.6801319234886647, 'strategy': 'breakout', 'time_stop': 288, 'use_sma': True, 'use_atr': False, 'use_adx': True, 'use_ema': False, 'use_spike': True, 'rsi_required': True, 'edge_k': 0.9233601143288006, 'edge_cap': 0.2537626932113521, 'bull_strategy': 'breakout', 'bull_bb_std_mult': 2.4003009493658856, 'bull_rsi_os': 51, 'bull_rsi_ob': 75, 'bull_adx_thresh': 25.715121575277287, 'bull_atr_min_pct': 0.016140141781016238, 'bull_atr_max_pct': 0.02539628942446166, 'bull_tp_mult': 2.2414275473083953, 'bull_tsl_mult': 0.45773301734992333, 'bull_time_stop': 225, 'bull_use_sma': True, 'bull_use_ema': False, 'bull_use_atr': False, 'bull_use_adx': True, 'bull_use_spike': True, 'bull_rsi_required': True, 'bear_strategy': 'mean_reversion', 'bear_bb_std_mult': 0.8595753699085027, 'bear_rsi_os': 43, 'bear_rsi_ob': 84, 'bear_adx_thresh': 23.051117463307705, 'bear_atr_min_pct': 0.016584487096462593, 'bear_atr_max_pct': 0.08470160770328174, 'bear_tp_mult': 1.72775789458069, 'bear_tsl_mult': 0.45262073165940647, 'bear_time_stop': 214, 'bear_use_sma': True, 'bear_use_ema': False, 'bear_use_atr': False, 'bear_use_adx': False, 'bear_use_spike': False, 'bear_rsi_required': False, 'sideways_strategy': 'mean_reversion', 'sideways_bb_std_mult': 2.2063925088582517, 'sideways_rsi_os': 16, 'sideways_rsi_ob': 54, 'sideways_adx_thresh': 9.100305887248313, 'sideways_atr_min_pct': 0.018632106062979385, 'sideways_atr_max_pct': 0.12623168776198418, 'sideways_tp_mult': 2.5491519946131875, 'sideways_tsl_mult': 0.35965204214458324, 'sideways_time_stop': 276, 'sideways_use_sma': False, 'sideways_use_ema': True, 'sideways_use_atr': False, 'sideways_use_adx': False, 'sideways_use_spike': False, 'sideways_rsi_required': True}.
[I 2025-08-30 20:12:32,734] Trial 725 finished with values: [-1000000000.0, 1000000000.0] and parameters: {'p_sma': 51, 'p_std': 35, 'p_atr': 20, 'p_adx': 8, 'rsi_period': 50, 'ema1': 24, 'ema2': 37, 'slip_atr_k': 0.2322162166275905, 'slip_spread_k': 0.37392268606045614, 'spread_hl_frac': 0.003415661490627073, 'bb_std_mult': 0.880165949674529, 'rsi_os': 55, 'rsi_ob': 70, 'vol_spike': 0.1755671377603221, 'adx_thresh': 21.88750135273081, 'atr_min_pct': 0.005178529647596214, 'atr_max_pct': 0.12894210544431622, 'tp_mult': 2.166175090873884, 'tsl_mult': 0.7463166484510162, 'strategy': 'breakout', 'time_stop': 12, 'use_sma': True, 'use_atr': False, 'use_adx': True, 'use_ema': False, 'use_spike': True, 'rsi_required': True, 'edge_k': 0.3827624826077053, 'edge_cap': 0.2580719048449132, 'bull_strategy': 'breakout', 'bull_bb_std_mult': 1.3812174516162061, 'bull_rsi_os': 44, 'bull_rsi_ob': 70, 'bull_adx_thresh': 25.46828314176354, 'bull_atr_min_pct': 0.025326635905517092, 'bull_atr_max_pct': 0.09673410300079424, 'bull_tp_mult': 2.128474087202319, 'bull_tsl_mult': 0.9127524686764648, 'bull_time_stop': 20, 'bull_use_sma': True, 'bull_use_ema': False, 'bull_use_atr': False, 'bull_use_adx': True, 'bull_use_spike': True, 'bull_rsi_required': True, 'bear_strategy': 'mean_reversion', 'bear_bb_std_mult': 2.7956079760210057, 'bear_rsi_os': 43, 'bear_rsi_ob': 84, 'bear_adx_thresh': 22.510370668376726, 'bear_atr_min_pct': 0.01730080829677054, 'bear_atr_max_pct': 0.05428117230486906, 'bear_tp_mult': 2.886785073444689, 'bear_tsl_mult': 0.8790551745410854, 'bear_time_stop': 32, 'bear_use_sma': False, 'bear_use_ema': False, 'bear_use_atr': False, 'bear_use_adx': False, 'bear_use_spike': True, 'bear_rsi_required': False, 'sideways_strategy': 'mean_reversion', 'sideways_bb_std_mult': 2.503127402524873, 'sideways_rsi_os': 12, 'sideways_rsi_ob': 78, 'sideways_adx_thresh': 25.86165112703366, 'sideways_atr_min_pct': 0.005920981248197853, 'sideways_atr_max_pct': 0.13873666606978388, 'sideways_tp_mult': 2.573222717650612, 'sideways_tsl_mult': 0.7026911081590026, 'sideways_time_stop': 279, 'sideways_use_sma': False, 'sideways_use_ema': True, 'sideways_use_atr': False, 'sideways_use_adx': False, 'sideways_use_spike': False, 'sideways_rsi_required': True}.
[I 2025-08-30 20:12:32,883] Trial 724 finished with values: [-1000000000.0, 1000000000.0] and parameters: {'p_sma': 34, 'p_std': 23, 'p_atr': 20, 'p_adx': 7, 'rsi_period': 56, 'ema1': 23, 'ema2': 39, 'slip_atr_k': 0.08347204015174718, 'slip_spread_k': 0.8044564006485204, 'spread_hl_frac': 0.024839983590197706, 'bb_std_mult': 0.8452297755015148, 'rsi_os': 53, 'rsi_ob': 84, 'vol_spike': 0.15296351002535152, 'adx_thresh': 17.064256889751434, 'atr_min_pct': 0.004342327394863539, 'atr_max_pct': 0.12927670391442886, 'tp_mult': 2.162806633203064, 'tsl_mult': 0.7483927737617126, 'strategy': 'breakout', 'time_stop': 11, 'use_sma': True, 'use_atr': True, 'use_adx': True, 'use_ema': False, 'use_spike': True, 'rsi_required': True, 'edge_k': 0.10332691291517308, 'edge_cap': 0.9477944221313901, 'bull_strategy': 'mean_reversion', 'bull_bb_std_mult': 2.1641976843041077, 'bull_rsi_os': 20, 'bull_rsi_ob': 75, 'bull_adx_thresh': 29.67690204809273, 'bull_atr_min_pct': 0.019921157233140547, 'bull_atr_max_pct': 0.02563323763564308, 'bull_tp_mult': 1.8237119749689972, 'bull_tsl_mult': 0.9140249488331558, 'bull_time_stop': 186, 'bull_use_sma': True, 'bull_use_ema': True, 'bull_use_atr': False, 'bull_use_adx': True, 'bull_use_spike': False, 'bull_rsi_required': True, 'bear_strategy': 'mean_reversion', 'bear_bb_std_mult': 3.24455569948984, 'bear_rsi_os': 43, 'bear_rsi_ob': 84, 'bear_adx_thresh': 30.955438919812785, 'bear_atr_min_pct': 0.017356401500055345, 'bear_atr_max_pct': 0.055021401675957385, 'bear_tp_mult': 1.7258367614712506, 'bear_tsl_mult': 0.7855987014556937, 'bear_time_stop': 31, 'bear_use_sma': False, 'bear_use_ema': False, 'bear_use_atr': True, 'bear_use_adx': True, 'bear_use_spike': True, 'bear_rsi_required': False, 'sideways_strategy': 'mean_reversion', 'sideways_bb_std_mult': 2.4985082755487946, 'sideways_rsi_os': 15, 'sideways_rsi_ob': 61, 'sideways_adx_thresh': 9.822289138389497, 'sideways_atr_min_pct': 0.02080962060763141, 'sideways_atr_max_pct': 0.022445398091169903, 'sideways_tp_mult': 1.8088819265701301, 'sideways_tsl_mult': 0.8162413414201372, 'sideways_time_stop': 271, 'sideways_use_sma': False, 'sideways_use_ema': True, 'sideways_use_atr': False, 'sideways_use_adx': False, 'sideways_use_spike': True, 'sideways_rsi_required': True}.
[I 2025-08-30 20:12:33,092] Trial 723 finished with values: [-1000000000.0, 1000000000.0] and parameters: {'p_sma': 48, 'p_std': 24, 'p_atr': 26, 'p_adx': 7, 'rsi_period': 50, 'ema1': 5, 'ema2': 39, 'slip_atr_k': 0.23101405188785862, 'slip_spread_k': 0.3593874849211719, 'spread_hl_frac': 0.001052490307451021, 'bb_std_mult': 0.8493045613719931, 'rsi_os': 17, 'rsi_ob': 84, 'vol_spike': 0.15282427285122138, 'adx_thresh': 8.003433197349082, 'atr_min_pct': 0.01114616711864073, 'atr_max_pct': 0.10203718807234322, 'tp_mult': 2.2050808803583486, 'tsl_mult': 0.7567306557617786, 'strategy': 'breakout', 'time_stop': 289, 'use_sma': False, 'use_atr': True, 'use_adx': True, 'use_ema': False, 'use_spike': True, 'rsi_required': True, 'edge_k': 1.911596780626464, 'edge_cap': 0.21310414701153235, 'bull_strategy': 'mean_reversion', 'bull_bb_std_mult': 1.7833669780859662, 'bull_rsi_os': 51, 'bull_rsi_ob': 70, 'bull_adx_thresh': 15.078742829042348, 'bull_atr_min_pct': 0.004444337408763538, 'bull_atr_max_pct': 0.025187418360287726, 'bull_tp_mult': 2.243020718731373, 'bull_tsl_mult': 0.5065824987026872, 'bull_time_stop': 192, 'bull_use_sma': True, 'bull_use_ema': True, 'bull_use_atr': False, 'bull_use_adx': True, 'bull_use_spike': False, 'bull_rsi_required': True, 'bear_strategy': 'mean_reversion', 'bear_bb_std_mult': 0.7035037536991544, 'bear_rsi_os': 44, 'bear_rsi_ob': 81, 'bear_adx_thresh': 5.578767567768061, 'bear_atr_min_pct': 0.01543835445344348, 'bear_atr_max_pct': 0.08588450803293482, 'bear_tp_mult': 1.1091957032954238, 'bear_tsl_mult': 0.12929012099400172, 'bear_time_stop': 151, 'bear_use_sma': False, 'bear_use_ema': False, 'bear_use_atr': True, 'bear_use_adx': True, 'bear_use_spike': True, 'bear_rsi_required': False, 'sideways_strategy': 'mean_reversion', 'sideways_bb_std_mult': 2.060257455942111, 'sideways_rsi_os': 6, 'sideways_rsi_ob': 78, 'sideways_adx_thresh': 20.080734124280255, 'sideways_atr_min_pct': 0.015161556488111386, 'sideways_atr_max_pct': 0.13853932433673172, 'sideways_tp_mult': 2.1675888689131906, 'sideways_tsl_mult': 0.3195661550216627, 'sideways_time_stop': 167, 'sideways_use_sma': False, 'sideways_use_ema': True, 'sideways_use_atr': False, 'sideways_use_adx': False, 'sideways_use_spike': True, 'sideways_rsi_required': True}.
[I 2025-08-30 20:13:07,210] Trial 727 finished with values: [-0.0326414230233788, 0.03254490586287954] and parameters: {'p_sma': 47, 'p_std': 28, 'p_atr': 22, 'p_adx': 10, 'rsi_period': 53, 'ema1': 9, 'ema2': 37, 'slip_atr_k': 0.017620922690628284, 'slip_spread_k': 0.35867812247691633, 'spread_hl_frac': 0.024941192450634517, 'bb_std_mult': 0.8520075143913929, 'rsi_os': 21, 'rsi_ob': 56, 'vol_spike': 0.04727924323305838, 'adx_thresh': 22.023190871696507, 'atr_min_pct': 0.004043077822866734, 'atr_max_pct': 0.1293527615917946, 'tp_mult': 2.5459642437628904, 'tsl_mult': 0.7468106103153719, 'strategy': 'breakout', 'time_stop': 188, 'use_sma': True, 'use_atr': True, 'use_adx': False, 'use_ema': False, 'use_spike': True, 'rsi_required': True, 'edge_k': 0.020986876338727978, 'edge_cap': 0.22389089313269891, 'bull_strategy': 'mean_reversion', 'bull_bb_std_mult': 2.1868114263983554, 'bull_rsi_os': 54, 'bull_rsi_ob': 70, 'bull_adx_thresh': 26.357723717167385, 'bull_atr_min_pct': 4.265688584434435e-05, 'bull_atr_max_pct': 0.027907722037524573, 'bull_tp_mult': 2.1171227366557863, 'bull_tsl_mult': 0.9167907659401674, 'bull_time_stop': 261, 'bull_use_sma': True, 'bull_use_ema': False, 'bull_use_atr': False, 'bull_use_adx': True, 'bull_use_spike': True, 'bull_rsi_required': True, 'bear_strategy': 'breakout', 'bear_bb_std_mult': 2.4667766579367507, 'bear_rsi_os': 44, 'bear_rsi_ob': 78, 'bear_adx_thresh': 6.942399148192562, 'bear_atr_min_pct': 0.015249164002545855, 'bear_atr_max_pct': 0.05078658268806345, 'bear_tp_mult': 1.6077716489899478, 'bear_tsl_mult': 0.3051472651473048, 'bear_time_stop': 70, 'bear_use_sma': True, 'bear_use_ema': False, 'bear_use_atr': True, 'bear_use_adx': True, 'bear_use_spike': False, 'bear_rsi_required': False, 'sideways_strategy': 'mean_reversion', 'sideways_bb_std_mult': 2.133102409007629, 'sideways_rsi_os': 12, 'sideways_rsi_ob': 51, 'sideways_adx_thresh': 13.22936389397649, 'sideways_atr_min_pct': 0.020795839307098173, 'sideways_atr_max_pct': 0.12131798451608397, 'sideways_tp_mult': 1.8088994195650656, 'sideways_tsl_mult': 0.9482723357209104, 'sideways_time_stop': 288, 'sideways_use_sma': False, 'sideways_use_ema': True, 'sideways_use_atr': False, 'sideways_use_adx': False, 'sideways_use_spike': False, 'sideways_rsi_required': True}.
[I 2025-08-30 20:13:07,451] Trial 730 finished with values: [-0.01637602941615257, 0.01631533694338762] and parameters: {'p_sma': 45, 'p_std': 16, 'p_atr': 14, 'p_adx': 11, 'rsi_period': 48, 'ema1': 25, 'ema2': 26, 'slip_atr_k': 0.019149343638299725, 'slip_spread_k': 0.40252440194586797, 'spread_hl_frac': 0.00578227185861908, 'bb_std_mult': 1.148165393169262, 'rsi_os': 20, 'rsi_ob': 56, 'vol_spike': 0.048331078633085056, 'adx_thresh': 30.066329408833504, 'atr_min_pct': 0.022966773798511367, 'atr_max_pct': 0.13780031501752343, 'tp_mult': 2.147216876649562, 'tsl_mult': 0.7140374188033143, 'strategy': 'breakout', 'time_stop': 71, 'use_sma': False, 'use_atr': True, 'use_adx': False, 'use_ema': True, 'use_spike': False, 'rsi_required': True, 'edge_k': 0.00042469824798369027, 'edge_cap': 0.2328378466630828, 'bull_strategy': 'mean_reversion', 'bull_bb_std_mult': 0.7856447925614216, 'bull_rsi_os': 49, 'bull_rsi_ob': 71, 'bull_adx_thresh': 26.239398487700427, 'bull_atr_min_pct': 0.0024276021052339076, 'bull_atr_max_pct': 0.019699598954758743, 'bull_tp_mult': 2.283154098166878, 'bull_tsl_mult': 0.4184544720291644, 'bull_time_stop': 183, 'bull_use_sma': True, 'bull_use_ema': False, 'bull_use_atr': False, 'bull_use_adx': True, 'bull_use_spike': True, 'bull_rsi_required': False, 'bear_strategy': 'breakout', 'bear_bb_std_mult': 3.325536783977741, 'bear_rsi_os': 44, 'bear_rsi_ob': 58, 'bear_adx_thresh': 10.411983414794742, 'bear_atr_min_pct': 0.015014851900189, 'bear_atr_max_pct': 0.051057441288537814, 'bear_tp_mult': 2.002023793266511, 'bear_tsl_mult': 0.028433835123560208, 'bear_time_stop': 58, 'bear_use_sma': True, 'bear_use_ema': False, 'bear_use_atr': True, 'bear_use_adx': True, 'bear_use_spike': False, 'bear_rsi_required': False, 'sideways_strategy': 'breakout', 'sideways_bb_std_mult': 2.145982704850051, 'sideways_rsi_os': 17, 'sideways_rsi_ob': 85, 'sideways_adx_thresh': 11.321525026173045, 'sideways_atr_min_pct': 0.023786236275501915, 'sideways_atr_max_pct': 0.14384580201740266, 'sideways_tp_mult': 1.7581212736055227, 'sideways_tsl_mult': 0.6728955561111521, 'sideways_time_stop': 287, 'sideways_use_sma': True, 'sideways_use_ema': True, 'sideways_use_atr': False, 'sideways_use_adx': False, 'sideways_use_spike': False, 'sideways_rsi_required': False}.
