[I 2025-08-30 20:05:26,360] Trial 675 finished with values: [-0.019317899241539038, 0.01922685139715982] and parameters: {'p_sma': 19, 'p_std': 7, 'p_atr': 8, 'p_adx': 21, 'rsi_period': 77, 'ema1': 26, 'ema2': 11, 'slip_atr_k': 0.01539803404630289, 'slip_spread_k': 0.6742321398665293, 'spread_hl_frac': 0.0014762254450861466, 'bb_std_mult': 0.8571837033967877, 'rsi_os': 36, 'rsi_ob': 57, 'vol_spike': 0.04559192596227728, 'adx_thresh': 19.08005377097725, 'atr_min_pct': 0.010144447485513023, 'atr_max_pct': 0.05124455662027017, 'tp_mult': 2.241319940094078, 'tsl_mult': 0.7099979390564102, 'strategy': 'breakout', 'time_stop': 278, 'use_sma': True, 'use_atr': True, 'use_adx': False, 'use_ema': False, 'use_spike': True, 'rsi_required': True, 'edge_k': 0.11819431106748064, 'edge_cap': 0.2562164423808137, 'bull_strategy': 'mean_reversion', 'bull_bb_std_mult': 2.485838671186131, 'bull_rsi_os': 36, 'bull_rsi_ob': 87, 'bull_adx_thresh': 27.419952082846066, 'bull_atr_min_pct': 0.0022264183413007793, 'bull_atr_max_pct': 0.022463948911731556, 'bull_tp_mult': 2.4676936582987734, 'bull_tsl_mult': 0.4355459231495815, 'bull_time_stop': 202, 'bull_use_sma': True, 'bull_use_ema': False, 'bull_use_atr': False, 'bull_use_adx': True, 'bull_use_spike': True, 'bull_rsi_required': True, 'bear_strategy': 'breakout', 'bear_bb_std_mult': 3.3865343677257504, 'bear_rsi_os': 37, 'bear_rsi_ob': 81, 'bear_adx_thresh': 19.918309346225115, 'bear_atr_min_pct': 0.027077255358501397, 'bear_atr_max_pct': 0.016263032772035974, 'bear_tp_mult': 1.703689450972264, 'bear_tsl_mult': 0.1812579447312707, 'bear_time_stop': 55, 'bear_use_sma': True, 'bear_use_ema': True, 'bear_use_atr': True, 'bear_use_adx': True, 'bear_use_spike': False, 'bear_rsi_required': False, 'sideways_strategy': 'breakout', 'sideways_bb_std_mult': 1.9632165304136955, 'sideways_rsi_os': 15, 'sideways_rsi_ob': 58, 'sideways_adx_thresh': 11.368065124391583, 'sideways_atr_min_pct': 0.014102286621348926, 'sideways_atr_max_pct': 0.12173473229637385, 'sideways_tp_mult': 1.752166772483045, 'sideways_tsl_mult': 0.7253929070859302, 'sideways_time_stop': 278, 'sideways_use_sma': True, 'sideways_use_ema': True, 'sideways_use_atr': False, 'sideways_use_adx': False, 'sideways_use_spike': False, 'sideways_rsi_required': False}.
[I 2025-08-30 20:05:26,440] Trial 674 finished with values: [-1000000000.0, 1000000000.0] and parameters: {'p_sma': 55, 'p_std': 26, 'p_atr': 8, 'p_adx': 10, 'rsi_period': 42, 'ema1': 25, 'ema2': 48, 'slip_atr_k': 0.014519407957459068, 'slip_spread_k': 0.021581758864628375, 'spread_hl_frac': 0.03930927300458424, 'bb_std_mult': 1.100468030297239, 'rsi_os': 36, 'rsi_ob': 74, 'vol_spike': 0.04738905764618957, 'adx_thresh': 18.537205234613634, 'atr_min_pct': 0.025318073943658852, 'atr_max_pct': 0.13426224092348357, 'tp_mult': 2.2483236228028045, 'tsl_mult': 0.7565941291178888, 'strategy': 'breakout', 'time_stop': 229, 'use_sma': False, 'use_atr': False, 'use_adx': False, 'use_ema': False, 'use_spike': True, 'rsi_required': True, 'edge_k': 1.1967905449293308, 'edge_cap': 0.5175889668704651, 'bull_strategy': 'breakout', 'bull_bb_std_mult': 2.426603507109736, 'bull_rsi_os': 34, 'bull_rsi_ob': 90, 'bull_adx_thresh': 20.26098901298415, 'bull_atr_min_pct': 0.0018255963644053916, 'bull_atr_max_pct': 0.14951335052201775, 'bull_tp_mult': 2.9531405781521585, 'bull_tsl_mult': 0.883686878762525, 'bull_time_stop': 137, 'bull_use_sma': True, 'bull_use_ema': False, 'bull_use_atr': False, 'bull_use_adx': True, 'bull_use_spike': True, 'bull_rsi_required': True, 'bear_strategy': 'breakout', 'bear_bb_std_mult': 3.253258714168042, 'bear_rsi_os': 26, 'bear_rsi_ob': 67, 'bear_adx_thresh': 31.667957409687407, 'bear_atr_min_pct': 0.015154138263912332, 'bear_atr_max_pct': 0.11456445201523635, 'bear_tp_mult': 2.1464766178704346, 'bear_tsl_mult': 0.17844956057948258, 'bear_time_stop': 77, 'bear_use_sma': True, 'bear_use_ema': True, 'bear_use_atr': False, 'bear_use_adx': False, 'bear_use_spike': False, 'bear_rsi_required': False, 'sideways_strategy': 'breakout', 'sideways_bb_std_mult': 1.946410982175701, 'sideways_rsi_os': 15, 'sideways_rsi_ob': 58, 'sideways_adx_thresh': 11.756962067228608, 'sideways_atr_min_pct': 0.02067571193725302, 'sideways_atr_max_pct': 0.10837272763515238, 'sideways_tp_mult': 1.7663910745305473, 'sideways_tsl_mult': 0.5777627586800902, 'sideways_time_stop': 278, 'sideways_use_sma': False, 'sideways_use_ema': True, 'sideways_use_atr': False, 'sideways_use_adx': False, 'sideways_use_spike': False, 'sideways_rsi_required': True}.
[I 2025-08-30 20:05:59,146] Trial 679 finished with values: [-1000000000.0, 1000000000.0] and parameters: {'p_sma': 43, 'p_std': 46, 'p_atr': 24, 'p_adx': 10, 'rsi_period': 28, 'ema1': 12, 'ema2': 15, 'slip_atr_k': 0.015447051773431843, 'slip_spread_k': 0.38893035854362046, 'spread_hl_frac': 0.006492251264226761, 'bb_std_mult': 1.8210045139048903, 'rsi_os': 35, 'rsi_ob': 83, 'vol_spike': 0.03482011769754077, 'adx_thresh': 25.618776273247217, 'atr_min_pct': 0.024679408405374262, 'atr_max_pct': 0.13414617594448253, 'tp_mult': 2.065511022262587, 'tsl_mult': 0.7282079951125798, 'strategy': 'breakout', 'time_stop': 229, 'use_sma': False, 'use_atr': True, 'use_adx': True, 'use_ema': False, 'use_spike': True, 'rsi_required': False, 'edge_k': 0.0022831955805341364, 'edge_cap': 0.563107921908113, 'bull_strategy': 'mean_reversion', 'bull_bb_std_mult': 2.0722342280872263, 'bull_rsi_os': 53, 'bull_rsi_ob': 71, 'bull_adx_thresh': 26.138574105680966, 'bull_atr_min_pct': 0.001517160200908376, 'bull_atr_max_pct': 0.09526018284712758, 'bull_tp_mult': 2.0000701192652777, 'bull_tsl_mult': 0.9790291328158814, 'bull_time_stop': 135, 'bull_use_sma': False, 'bull_use_ema': False, 'bull_use_atr': True, 'bull_use_adx': False, 'bull_use_spike': True, 'bull_rsi_required': True, 'bear_strategy': 'breakout', 'bear_bb_std_mult': 3.0452045798389755, 'bear_rsi_os': 39, 'bear_rsi_ob': 87, 'bear_adx_thresh': 9.921888897049731, 'bear_atr_min_pct': 0.015695320799768677, 'bear_atr_max_pct': 0.041808556629712466, 'bear_tp_mult': 1.420530268270409, 'bear_tsl_mult': 0.0670917342627919, 'bear_time_stop': 124, 'bear_use_sma': True, 'bear_use_ema': False, 'bear_use_atr': True, 'bear_use_adx': True, 'bear_use_spike': False, 'bear_rsi_required': True, 'sideways_strategy': 'breakout', 'sideways_bb_std_mult': 2.071782193057341, 'sideways_rsi_os': 17, 'sideways_rsi_ob': 60, 'sideways_adx_thresh': 7.794216843995906, 'sideways_atr_min_pct': 0.026065555502421275, 'sideways_atr_max_pct': 0.12113462398149068, 'sideways_tp_mult': 2.205956250961428, 'sideways_tsl_mult': 0.597607278400983, 'sideways_time_stop': 287, 'sideways_use_sma': True, 'sideways_use_ema': False, 'sideways_use_atr': False, 'sideways_use_adx': True, 'sideways_use_spike': False, 'sideways_rsi_required': False}.
[I 2025-08-30 20:05:59,779] Trial 680 finished with values: [-1000000000.0, 1000000000.0] and parameters: {'p_sma': 23, 'p_std': 30, 'p_atr': 10, 'p_adx': 9, 'rsi_period': 30, 'ema1': 23, 'ema2': 36, 'slip_atr_k': 0.035718165557211856, 'slip_spread_k': 0.3867261858522548, 'spread_hl_frac': 0.006611703580489105, 'bb_std_mult': 3.057438261908757, 'rsi_os': 7, 'rsi_ob': 89, 'vol_spike': 0.23720697490737055, 'adx_thresh': 17.542329808123025, 'atr_min_pct': 0.02656962157479719, 'atr_max_pct': 0.10456693397691269, 'tp_mult': 1.0589382049582494, 'tsl_mult': 0.7255168964471936, 'strategy': 'breakout', 'time_stop': 50, 'use_sma': False, 'use_atr': True, 'use_adx': True, 'use_ema': True, 'use_spike': False, 'rsi_required': False, 'edge_k': 1.7644646647216222, 'edge_cap': 0.5633391286796838, 'bull_strategy': 'mean_reversion', 'bull_bb_std_mult': 2.069560089069001, 'bull_rsi_os': 54, 'bull_rsi_ob': 66, 'bull_adx_thresh': 25.835727584223935, 'bull_atr_min_pct': 0.0027513108894775744, 'bull_atr_max_pct': 0.01737328123472326, 'bull_tp_mult': 2.0223390333243847, 'bull_tsl_mult': 0.9837605544844009, 'bull_time_stop': 196, 'bull_use_sma': False, 'bull_use_ema': False, 'bull_use_atr': True, 'bull_use_adx': False, 'bull_use_spike': True, 'bull_rsi_required': False, 'bear_strategy': 'breakout', 'bear_bb_std_mult': 1.0959758337717087, 'bear_rsi_os': 47, 'bear_rsi_ob': 87, 'bear_adx_thresh': 10.959649654284917, 'bear_atr_min_pct': 0.013688711792885075, 'bear_atr_max_pct': 0.04340229107838254, 'bear_tp_mult': 2.7227965874117683, 'bear_tsl_mult': 0.07001104591898447, 'bear_time_stop': 116, 'bear_use_sma': True, 'bear_use_ema': False, 'bear_use_atr': True, 'bear_use_adx': True, 'bear_use_spike': True, 'bear_rsi_required': True, 'sideways_strategy': 'mean_reversion', 'sideways_bb_std_mult': 2.0691660768764426, 'sideways_rsi_os': 17, 'sideways_rsi_ob': 80, 'sideways_adx_thresh': 7.862683828398756, 'sideways_atr_min_pct': 0.01575479742281723, 'sideways_atr_max_pct': 0.13539274327590148, 'sideways_tp_mult': 1.678500072963679, 'sideways_tsl_mult': 0.6762096014511532, 'sideways_time_stop': 10, 'sideways_use_sma': True, 'sideways_use_ema': False, 'sideways_use_atr': True, 'sideways_use_adx': True, 'sideways_use_spike': False, 'sideways_rsi_required': False}.
[I 2025-08-30 20:06:00,043] Trial 678 finished with values: [-1000000000.0, 1000000000.0] and parameters: {'p_sma': 19, 'p_std': 32, 'p_atr': 8, 'p_adx': 21, 'rsi_period': 42, 'ema1': 12, 'ema2': 11, 'slip_atr_k': 0.013892144923361067, 'slip_spread_k': 0.36506308399719795, 'spread_hl_frac': 0.006754514462881278, 'bb_std_mult': 0.6207965448706545, 'rsi_os': 40, 'rsi_ob': 57, 'vol_spike': 0.28849976901955576, 'adx_thresh': 25.374063004409507, 'atr_min_pct': 0.022651578954976263, 'atr_max_pct': 0.06045221056871257, 'tp_mult': 2.0737311218155434, 'tsl_mult': 0.705501532344822, 'strategy': 'breakout', 'time_stop': 23, 'use_sma': True, 'use_atr': True, 'use_adx': False, 'use_ema': False, 'use_spike': True, 'rsi_required': False, 'edge_k': 1.7668207086127978, 'edge_cap': 0.7323392118271465, 'bull_strategy': 'mean_reversion', 'bull_bb_std_mult': 1.4801796912627592, 'bull_rsi_os': 35, 'bull_rsi_ob': 86, 'bull_adx_thresh': 31.60358836710082, 'bull_atr_min_pct': 0.014459832992177554, 'bull_atr_max_pct': 0.03716180897996199, 'bull_tp_mult': 2.1050196532937577, 'bull_tsl_mult': 0.10921755781915421, 'bull_time_stop': 194, 'bull_use_sma': False, 'bull_use_ema': False, 'bull_use_atr': True, 'bull_use_adx': False, 'bull_use_spike': True, 'bull_rsi_required': True, 'bear_strategy': 'breakout', 'bear_bb_std_mult': 1.101062737181679, 'bear_rsi_os': 26, 'bear_rsi_ob': 65, 'bear_adx_thresh': 6.040555725268066, 'bear_atr_min_pct': 0.0267083739292161, 'bear_atr_max_pct': 0.11485134824903391, 'bear_tp_mult': 2.7317895926191644, 'bear_tsl_mult': 0.7376231872568444, 'bear_time_stop': 55, 'bear_use_sma': True, 'bear_use_ema': False, 'bear_use_atr': True, 'bear_use_adx': True, 'bear_use_spike': False, 'bear_rsi_required': False, 'sideways_strategy': 'breakout', 'sideways_bb_std_mult': 2.0049747289476136, 'sideways_rsi_os': 17, 'sideways_rsi_ob': 58, 'sideways_adx_thresh': 10.73513731585336, 'sideways_atr_min_pct': 0.013731146139973406, 'sideways_atr_max_pct': 0.14982896264097836, 'sideways_tp_mult': 1.9700037268894341, 'sideways_tsl_mult': 0.7712395038411932, 'sideways_time_stop': 279, 'sideways_use_sma': True, 'sideways_use_ema': True, 'sideways_use_atr': False, 'sideways_use_adx': True, 'sideways_use_spike': False, 'sideways_rsi_required': False}.
[I 2025-08-30 20:06:00,215] Trial 677 finished with values: [-1000000000.0, 1000000000.0] and parameters: {'p_sma': 43, 'p_std': 37, 'p_atr': 8, 'p_adx': 10, 'rsi_period': 49, 'ema1': 23, 'ema2': 28, 'slip_atr_k': 0.0157928942479797, 'slip_spread_k': 0.38660418196119, 'spread_hl_frac': 0.0017295225531081602, 'bb_std_mult': 0.641787812585235, 'rsi_os': 36, 'rsi_ob': 57, 'vol_spike': 0.0344494020397633, 'adx_thresh': 18.679466373392398, 'atr_min_pct': 0.02311373789488783, 'atr_max_pct': 0.05925481928004655, 'tp_mult': 1.467553776558208, 'tsl_mult': 0.12996464841330613, 'strategy': 'breakout', 'time_stop': 50, 'use_sma': False, 'use_atr': True, 'use_adx': False, 'use_ema': False, 'use_spike': True, 'rsi_required': False, 'edge_k': 0.11568787853293191, 'edge_cap': 0.25685384509074893, 'bull_strategy': 'mean_reversion', 'bull_bb_std_mult': 2.0157683120031726, 'bull_rsi_os': 36, 'bull_rsi_ob': 85, 'bull_adx_thresh': 27.34798836548955, 'bull_atr_min_pct': 0.0022570411319320746, 'bull_atr_max_pct': 0.0324324144723173, 'bull_tp_mult': 2.2596346631727853, 'bull_tsl_mult': 0.9873543335518064, 'bull_time_stop': 196, 'bull_use_sma': False, 'bull_use_ema': False, 'bull_use_atr': True, 'bull_use_adx': False, 'bull_use_spike': True, 'bull_rsi_required': True, 'bear_strategy': 'breakout', 'bear_bb_std_mult': 3.0935541897278425, 'bear_rsi_os': 26, 'bear_rsi_ob': 49, 'bear_adx_thresh': 9.688460697212413, 'bear_atr_min_pct': 0.013762026368774567, 'bear_atr_max_pct': 0.10151998536264581, 'bear_tp_mult': 2.6522529115875253, 'bear_tsl_mult': 0.7256635424475344, 'bear_time_stop': 45, 'bear_use_sma': True, 'bear_use_ema': True, 'bear_use_atr': True, 'bear_use_adx': True, 'bear_use_spike': False, 'bear_rsi_required': False, 'sideways_strategy': 'breakout', 'sideways_bb_std_mult': 3.105038263441228, 'sideways_rsi_os': 17, 'sideways_rsi_ob': 58, 'sideways_adx_thresh': 11.695031337949445, 'sideways_atr_min_pct': 0.015903543143497727, 'sideways_atr_max_pct': 0.13584740075389456, 'sideways_tp_mult': 1.9834243181369402, 'sideways_tsl_mult': 0.7951539303717641, 'sideways_time_stop': 38, 'sideways_use_sma': True, 'sideways_use_ema': True, 'sideways_use_atr': False, 'sideways_use_adx': True, 'sideways_use_spike': False, 'sideways_rsi_required': False}.
[I 2025-08-30 20:06:37,993] Trial 684 finished with values: [-1000000000.0, 1000000000.0] and parameters: {'p_sma': 30, 'p_std': 28, 'p_atr': 11, 'p_adx': 7, 'rsi_period': 52, 'ema1': 17, 'ema2': 16, 'slip_atr_k': 0.022642965493413714, 'slip_spread_k': 0.4121254336605494, 'spread_hl_frac': 0.00328602202053371, 'bb_std_mult': 0.8022836363120083, 'rsi_os': 33, 'rsi_ob': 64, 'vol_spike': 0.20466812378296484, 'adx_thresh': 22.93319085005613, 'atr_min_pct': 0.012108409454539603, 'atr_max_pct': 0.09806805833972586, 'tp_mult': 2.1574913365201365, 'tsl_mult': 0.48215743161443503, 'strategy': 'breakout', 'time_stop': 147, 'use_sma': False, 'use_atr': True, 'use_adx': False, 'use_ema': True, 'use_spike': False, 'rsi_required': True, 'edge_k': 0.24887231319495146, 'edge_cap': 0.6535419931574878, 'bull_strategy': 'mean_reversion', 'bull_bb_std_mult': 1.8473626372442833, 'bull_rsi_os': 11, 'bull_rsi_ob': 55, 'bull_adx_thresh': 25.147753708657213, 'bull_atr_min_pct': 0.02182342512414899, 'bull_atr_max_pct': 0.02036177826118089, 'bull_tp_mult': 1.280208205197248, 'bull_tsl_mult': 0.5286287954020553, 'bull_time_stop': 53, 'bull_use_sma': True, 'bull_use_ema': False, 'bull_use_atr': False, 'bull_use_adx': True, 'bull_use_spike': True, 'bull_rsi_required': False, 'bear_strategy': 'breakout', 'bear_bb_std_mult': 1.2838195572439481, 'bear_rsi_os': 41, 'bear_rsi_ob': 93, 'bear_adx_thresh': 5.969482888509009, 'bear_atr_min_pct': 0.011617328644174979, 'bear_atr_max_pct': 0.05384537573374513, 'bear_tp_mult': 1.9743098583397478, 'bear_tsl_mult': 0.1426567651327585, 'bear_time_stop': 282, 'bear_use_sma': True, 'bear_use_ema': False, 'bear_use_atr': True, 'bear_use_adx': True, 'bear_use_spike': True, 'bear_rsi_required': False, 'sideways_strategy': 'mean_reversion', 'sideways_bb_std_mult': 2.1405793903376344, 'sideways_rsi_os': 9, 'sideways_rsi_ob': 56, 'sideways_adx_thresh': 34.418820790368805, 'sideways_atr_min_pct': 0.018694629469736098, 'sideways_atr_max_pct': 0.09745359786492913, 'sideways_tp_mult': 1.811483795255504, 'sideways_tsl_mult': 0.6307970653449912, 'sideways_time_stop': 173, 'sideways_use_sma': True, 'sideways_use_ema': True, 'sideways_use_atr': True, 'sideways_use_adx': False, 'sideways_use_spike': False, 'sideways_rsi_required': False}.
[I 2025-08-30 20:06:38,011] Trial 682 finished with values: [-1000000000.0, 1000000000.0] and parameters: {'p_sma': 41, 'p_std': 29, 'p_atr': 11, 'p_adx': 7, 'rsi_period': 57, 'ema1': 22, 'ema2': 16, 'slip_atr_k': 0.022895839970748434, 'slip_spread_k': 0.36269092107029305, 'spread_hl_frac': 0.009055520359207668, 'bb_std_mult': 1.0056897498214181, 'rsi_os': 33, 'rsi_ob': 71, 'vol_spike': 0.08944675302172014, 'adx_thresh': 18.144431722759695, 'atr_min_pct': 0.01916712368640081, 'atr_max_pct': 0.0615183552922655, 'tp_mult': 1.0160269116351848, 'tsl_mult': 0.6634854618940174, 'strategy': 'breakout', 'time_stop': 146, 'use_sma': True, 'use_atr': True, 'use_adx': False, 'use_ema': False, 'use_spike': True, 'rsi_required': True, 'edge_k': 0.5923484357323023, 'edge_cap': 0.6624647082519952, 'bull_strategy': 'mean_reversion', 'bull_bb_std_mult': 3.2881275054612886, 'bull_rsi_os': 25, 'bull_rsi_ob': 62, 'bull_adx_thresh': 30.73667630439515, 'bull_atr_min_pct': 0.019524932842808568, 'bull_atr_max_pct': 0.03371193865136274, 'bull_tp_mult': 2.260449271974075, 'bull_tsl_mult': 0.9991418626439306, 'bull_time_stop': 188, 'bull_use_sma': True, 'bull_use_ema': False, 'bull_use_atr': False, 'bull_use_adx': True, 'bull_use_spike': True, 'bull_rsi_required': True, 'bear_strategy': 'breakout', 'bear_bb_std_mult': 3.106471050103797, 'bear_rsi_os': 47, 'bear_rsi_ob': 93, 'bear_adx_thresh': 12.782285563906175, 'bear_atr_min_pct': 0.029349996681235446, 'bear_atr_max_pct': 0.04984757307686542, 'bear_tp_mult': 1.6387475277633743, 'bear_tsl_mult': 0.14042536786108145, 'bear_time_stop': 45, 'bear_use_sma': True, 'bear_use_ema': False, 'bear_use_atr': True, 'bear_use_adx': True, 'bear_use_spike': False, 'bear_rsi_required': False, 'sideways_strategy': 'breakout', 'sideways_bb_std_mult': 2.1668473246246602, 'sideways_rsi_os': 13, 'sideways_rsi_ob': 83, 'sideways_adx_thresh': 34.395575091445544, 'sideways_atr_min_pct': 0.019863238002980125, 'sideways_atr_max_pct': 0.12518903828708805, 'sideways_tp_mult': 2.0022871068760306, 'sideways_tsl_mult': 0.7672229543662642, 'sideways_time_stop': 272, 'sideways_use_sma': True, 'sideways_use_ema': True, 'sideways_use_atr': False, 'sideways_use_adx': False, 'sideways_use_spike': False, 'sideways_rsi_required': False}.
[I 2025-08-30 20:06:38,381] Trial 683 finished with values: [-1000000000.0, 1000000000.0] and parameters: {'p_sma': 39, 'p_std': 25, 'p_atr': 11, 'p_adx': 14, 'rsi_period': 57, 'ema1': 18, 'ema2': 28, 'slip_atr_k': 0.07232518710412197, 'slip_spread_k': 0.7769134594712579, 'spread_hl_frac': 0.02103155258519166, 'bb_std_mult': 0.9983620809555934, 'rsi_os': 33, 'rsi_ob': 56, 'vol_spike': 0.20320213074846127, 'adx_thresh': 26.81849845276813, 'atr_min_pct': 0.028072917978167654, 'atr_max_pct': 0.14317773708784173, 'tp_mult': 1.2985459620784598, 'tsl_mult': 0.6677115316369625, 'strategy': 'breakout', 'time_stop': 26, 'use_sma': False, 'use_atr': True, 'use_adx': False, 'use_ema': False, 'use_spike': True, 'rsi_required': True, 'edge_k': 1.0661482086811003, 'edge_cap': 0.23422751760039534, 'bull_strategy': 'mean_reversion', 'bull_bb_std_mult': 2.004244782935961, 'bull_rsi_os': 46, 'bull_rsi_ob': 74, 'bull_adx_thresh': 13.065386813595559, 'bull_atr_min_pct': 0.022165667978977795, 'bull_atr_max_pct': 0.03219295032997758, 'bull_tp_mult': 1.2863006881936179, 'bull_tsl_mult': 0.5311869462664465, 'bull_time_stop': 186, 'bull_use_sma': True, 'bull_use_ema': False, 'bull_use_atr': False, 'bull_use_adx': True, 'bull_use_spike': True, 'bull_rsi_required': True, 'bear_strategy': 'breakout', 'bear_bb_std_mult': 1.6446933912854442, 'bear_rsi_os': 41, 'bear_rsi_ob': 84, 'bear_adx_thresh': 5.954678315851274, 'bear_atr_min_pct': 0.02930771177218411, 'bear_atr_max_pct': 0.04908757281565229, 'bear_tp_mult': 1.6215075414773903, 'bear_tsl_mult': 0.14099744323807417, 'bear_time_stop': 33, 'bear_use_sma': True, 'bear_use_ema': False, 'bear_use_atr': True, 'bear_use_adx': True, 'bear_use_spike': True, 'bear_rsi_required': False, 'sideways_strategy': 'mean_reversion', 'sideways_bb_std_mult': 2.5344195796002604, 'sideways_rsi_os': 34, 'sideways_rsi_ob': 57, 'sideways_adx_thresh': 9.352822896701948, 'sideways_atr_min_pct': 0.019772664823059314, 'sideways_atr_max_pct': 0.12522616238963669, 'sideways_tp_mult': 1.8001055411171218, 'sideways_tsl_mult': 0.4985262780234038, 'sideways_time_stop': 241, 'sideways_use_sma': True, 'sideways_use_ema': True, 'sideways_use_atr': False, 'sideways_use_adx': False, 'sideways_use_spike': False, 'sideways_rsi_required': False}.
