[I 2025-08-30 19:17:25,371] Trial 324 finished with values: [-1000000000.0, 1000000000.0] and parameters: {'p_sma': 49, 'p_std': 24, 'p_atr': 13, 'p_adx': 10, 'rsi_period': 51, 'ema1': 6, 'ema2': 18, 'slip_atr_k': 0.020058566687353323, 'slip_spread_k': 0.3853915545404253, 'spread_hl_frac': 0.03758405466542548, 'bb_std_mult': 0.8259765109444992, 'rsi_os': 33, 'rsi_ob': 95, 'vol_spike': 0.10148342066608745, 'adx_thresh': 31.80411866767912, 'atr_min_pct': 0.02489999512910626, 'atr_max_pct': 0.13087753926154028, 'tp_mult': 2.069892340228567, 'tsl_mult': 0.8605933085232131, 'strategy': 'breakout', 'time_stop': 30, 'use_sma': False, 'use_atr': True, 'use_adx': False, 'use_ema': True, 'use_spike': True, 'rsi_required': False, 'edge_k': 0.3326286481721743, 'edge_cap': 0.25472936833897336, 'bull_strategy': 'mean_reversion', 'bull_bb_std_mult': 2.237473961927307, 'bull_rsi_os': 42, 'bull_rsi_ob': 58, 'bull_adx_thresh': 14.711380641194163, 'bull_atr_min_pct': 0.002550255634846214, 'bull_atr_max_pct': 0.026144825329857714, 'bull_tp_mult': 2.2029502876058853, 'bull_tsl_mult': 0.9408377306465988, 'bull_time_stop': 181, 'bull_use_sma': False, 'bull_use_ema': True, 'bull_use_atr': False, 'bull_use_adx': False, 'bull_use_spike': True, 'bull_rsi_required': False, 'bear_strategy': 'breakout', 'bear_bb_std_mult': 3.158418146085279, 'bear_rsi_os': 24, 'bear_rsi_ob': 84, 'bear_adx_thresh': 5.666520374514251, 'bear_atr_min_pct': 0.016990141248825096, 'bear_atr_max_pct': 0.04091530181863052, 'bear_tp_mult': 2.973873254310327, 'bear_tsl_mult': 0.15909064340155815, 'bear_time_stop': 177, 'bear_use_sma': False, 'bear_use_ema': False, 'bear_use_atr': True, 'bear_use_adx': True, 'bear_use_spike': True, 'bear_rsi_required': False, 'sideways_strategy': 'breakout', 'sideways_bb_std_mult': 2.5367757612485544, 'sideways_rsi_os': 49, 'sideways_rsi_ob': 92, 'sideways_adx_thresh': 21.76475304765678, 'sideways_atr_min_pct': 0.007650068916848251, 'sideways_atr_max_pct': 0.05199737703267864, 'sideways_tp_mult': 1.7049615887597145, 'sideways_tsl_mult': 0.6453485001943902, 'sideways_time_stop': 278, 'sideways_use_sma': True, 'sideways_use_ema': True, 'sideways_use_atr': False, 'sideways_use_adx': True, 'sideways_use_spike': True, 'sideways_rsi_required': True}.
[I 2025-08-30 19:17:25,972] Trial 325 finished with values: [-1000000000.0, 1000000000.0] and parameters: {'p_sma': 16, 'p_std': 24, 'p_atr': 22, 'p_adx': 10, 'rsi_period': 52, 'ema1': 24, 'ema2': 18, 'slip_atr_k': 0.020574543676601848, 'slip_spread_k': 0.3942947606622822, 'spread_hl_frac': 0.005347073088032776, 'bb_std_mult': 1.6983110935811463, 'rsi_os': 32, 'rsi_ob': 76, 'vol_spike': 0.042540650348331016, 'adx_thresh': 8.71668992170462, 'atr_min_pct': 0.029379823227704282, 'atr_max_pct': 0.021738165495603208, 'tp_mult': 2.835967501335639, 'tsl_mult': 0.7494678932702439, 'strategy': 'breakout', 'time_stop': 28, 'use_sma': False, 'use_atr': True, 'use_adx': False, 'use_ema': False, 'use_spike': True, 'rsi_required': True, 'edge_k': 0.084798680352722, 'edge_cap': 0.2525304592210983, 'bull_strategy': 'mean_reversion', 'bull_bb_std_mult': 3.4245808753314946, 'bull_rsi_os': 41, 'bull_rsi_ob': 87, 'bull_adx_thresh': 30.109534171687898, 'bull_atr_min_pct': 0.007126614332024052, 'bull_atr_max_pct': 0.025788647442451813, 'bull_tp_mult': 2.2206310088017616, 'bull_tsl_mult': 0.9686872136656358, 'bull_time_stop': 85, 'bull_use_sma': True, 'bull_use_ema': True, 'bull_use_atr': False, 'bull_use_adx': True, 'bull_use_spike': True, 'bull_rsi_required': True, 'bear_strategy': 'breakout', 'bear_bb_std_mult': 0.6484572756085292, 'bear_rsi_os': 42, 'bear_rsi_ob': 84, 'bear_adx_thresh': 6.537840734753313, 'bear_atr_min_pct': 0.017121066924916484, 'bear_atr_max_pct': 0.13766963906083413, 'bear_tp_mult': 1.3665346553061282, 'bear_tsl_mult': 0.15963518686691514, 'bear_time_stop': 64, 'bear_use_sma': True, 'bear_use_ema': False, 'bear_use_atr': True, 'bear_use_adx': True, 'bear_use_spike': True, 'bear_rsi_required': False, 'sideways_strategy': 'mean_reversion', 'sideways_bb_std_mult': 1.9700084209902984, 'sideways_rsi_os': 36, 'sideways_rsi_ob': 91, 'sideways_adx_thresh': 10.166724912972533, 'sideways_atr_min_pct': 0.018725400784053152, 'sideways_atr_max_pct': 0.12338888850302045, 'sideways_tp_mult': 1.7500811672266623, 'sideways_tsl_mult': 0.3746036353365446, 'sideways_time_stop': 167, 'sideways_use_sma': False, 'sideways_use_ema': True, 'sideways_use_atr': False, 'sideways_use_adx': False, 'sideways_use_spike': True, 'sideways_rsi_required': False}.
[I 2025-08-30 19:17:56,646] Trial 328 finished with values: [-1000000000.0, 1000000000.0] and parameters: {'p_sma': 43, 'p_std': 6, 'p_atr': 10, 'p_adx': 8, 'rsi_period': 52, 'ema1': 17, 'ema2': 16, 'slip_atr_k': 0.013526263005851389, 'slip_spread_k': 0.3245591959401195, 'spread_hl_frac': 0.027163494865709268, 'bb_std_mult': 1.7121658443385535, 'rsi_os': 25, 'rsi_ob': 58, 'vol_spike': 0.09007392151351583, 'adx_thresh': 19.08046164462041, 'atr_min_pct': 0.024543101404201875, 'atr_max_pct': 0.13610293357151945, 'tp_mult': 1.2053750774465848, 'tsl_mult': 0.19458038071292078, 'strategy': 'breakout', 'time_stop': 253, 'use_sma': False, 'use_atr': True, 'use_adx': False, 'use_ema': False, 'use_spike': False, 'rsi_required': True, 'edge_k': 1.2582279576198105, 'edge_cap': 0.18944547152762925, 'bull_strategy': 'breakout', 'bull_bb_std_mult': 0.8878521448674277, 'bull_rsi_os': 48, 'bull_rsi_ob': 47, 'bull_adx_thresh': 23.72845040993172, 'bull_atr_min_pct': 0.008008997828519694, 'bull_atr_max_pct': 0.021043747824693385, 'bull_tp_mult': 2.0971817674325686, 'bull_tsl_mult': 0.9704965484900503, 'bull_time_stop': 200, 'bull_use_sma': True, 'bull_use_ema': True, 'bull_use_atr': False, 'bull_use_adx': True, 'bull_use_spike': True, 'bull_rsi_required': True, 'bear_strategy': 'breakout', 'bear_bb_std_mult': 3.30598680337003, 'bear_rsi_os': 44, 'bear_rsi_ob': 46, 'bear_adx_thresh': 31.371838551948123, 'bear_atr_min_pct': 0.013460351277610989, 'bear_atr_max_pct': 0.14420227971987798, 'bear_tp_mult': 1.3647003926121415, 'bear_tsl_mult': 0.0484224555119077, 'bear_time_stop': 119, 'bear_use_sma': True, 'bear_use_ema': False, 'bear_use_atr': True, 'bear_use_adx': True, 'bear_use_spike': True, 'bear_rsi_required': False, 'sideways_strategy': 'breakout', 'sideways_bb_std_mult': 1.9602809232936647, 'sideways_rsi_os': 17, 'sideways_rsi_ob': 57, 'sideways_adx_thresh': 34.1861060831973, 'sideways_atr_min_pct': 0.003356314986606915, 'sideways_atr_max_pct': 0.12362555154295839, 'sideways_tp_mult': 1.7423322177530256, 'sideways_tsl_mult': 0.6820257428325991, 'sideways_time_stop': 260, 'sideways_use_sma': False, 'sideways_use_ema': False, 'sideways_use_atr': False, 'sideways_use_adx': False, 'sideways_use_spike': False, 'sideways_rsi_required': False}.
[I 2025-08-30 19:17:58,454] Trial 327 finished with values: [-1000000000.0, 1000000000.0] and parameters: {'p_sma': 43, 'p_std': 24, 'p_atr': 10, 'p_adx': 10, 'rsi_period': 22, 'ema1': 16, 'ema2': 54, 'slip_atr_k': 0.012818701822527645, 'slip_spread_k': 0.3838288944117472, 'spread_hl_frac': 0.00252886990820847, 'bb_std_mult': 3.315803480879195, 'rsi_os': 40, 'rsi_ob': 76, 'vol_spike': 0.021532400199292118, 'adx_thresh': 25.79613289607085, 'atr_min_pct': 0.0248216645884502, 'atr_max_pct': 0.1374841088474837, 'tp_mult': 1.8079279724619053, 'tsl_mult': 0.7466258387957423, 'strategy': 'breakout', 'time_stop': 13, 'use_sma': False, 'use_atr': True, 'use_adx': False, 'use_ema': True, 'use_spike': True, 'rsi_required': True, 'edge_k': 0.08128075212259593, 'edge_cap': 0.18615638841557414, 'bull_strategy': 'mean_reversion', 'bull_bb_std_mult': 1.8851663866096424, 'bull_rsi_os': 48, 'bull_rsi_ob': 87, 'bull_adx_thresh': 9.439628397952136, 'bull_atr_min_pct': 0.002341661941322432, 'bull_atr_max_pct': 0.025522441116889227, 'bull_tp_mult': 1.6936363968485817, 'bull_tsl_mult': 0.41895134157560976, 'bull_time_stop': 85, 'bull_use_sma': True, 'bull_use_ema': True, 'bull_use_atr': False, 'bull_use_adx': True, 'bull_use_spike': True, 'bull_rsi_required': False, 'bear_strategy': 'breakout', 'bear_bb_std_mult': 0.6474755328976045, 'bear_rsi_os': 42, 'bear_rsi_ob': 54, 'bear_adx_thresh': 6.590788924417263, 'bear_atr_min_pct': 0.01718597465432112, 'bear_atr_max_pct': 0.12386683901679243, 'bear_tp_mult': 2.976710507981047, 'bear_tsl_mult': 0.15983848959974617, 'bear_time_stop': 61, 'bear_use_sma': False, 'bear_use_ema': False, 'bear_use_atr': True, 'bear_use_adx': True, 'bear_use_spike': True, 'bear_rsi_required': False, 'sideways_strategy': 'breakout', 'sideways_bb_std_mult': 2.128694408427646, 'sideways_rsi_os': 11, 'sideways_rsi_ob': 91, 'sideways_adx_thresh': 21.433900817224266, 'sideways_atr_min_pct': 0.01866380587398385, 'sideways_atr_max_pct': 0.12068029534256647, 'sideways_tp_mult': 1.737860771139296, 'sideways_tsl_mult': 0.49229614759385926, 'sideways_time_stop': 276, 'sideways_use_sma': False, 'sideways_use_ema': True, 'sideways_use_atr': False, 'sideways_use_adx': False, 'sideways_use_spike': True, 'sideways_rsi_required': False}.
[I 2025-08-30 19:17:58,590] Trial 326 finished with values: [-1000000000.0, 1000000000.0] and parameters: {'p_sma': 59, 'p_std': 24, 'p_atr': 8, 'p_adx': 10, 'rsi_period': 22, 'ema1': 16, 'ema2': 18, 'slip_atr_k': 0.01202175706849797, 'slip_spread_k': 0.38537436706744543, 'spread_hl_frac': 0.03757081107947737, 'bb_std_mult': 0.9670770042944195, 'rsi_os': 15, 'rsi_ob': 58, 'vol_spike': 0.022562094135500588, 'adx_thresh': 18.92232427702653, 'atr_min_pct': 0.025361147806656922, 'atr_max_pct': 0.10548807444560364, 'tp_mult': 2.8317213516451316, 'tsl_mult': 0.7484497396936242, 'strategy': 'breakout', 'time_stop': 60, 'use_sma': False, 'use_atr': True, 'use_adx': False, 'use_ema': True, 'use_spike': True, 'rsi_required': True, 'edge_k': 1.2513758686784469, 'edge_cap': 0.2568315039580793, 'bull_strategy': 'mean_reversion', 'bull_bb_std_mult': 3.4242139032762493, 'bull_rsi_os': 22, 'bull_rsi_ob': 72, 'bull_adx_thresh': 34.78525023515758, 'bull_atr_min_pct': 0.002498355845496662, 'bull_atr_max_pct': 0.026074749083239125, 'bull_tp_mult': 2.219785927592471, 'bull_tsl_mult': 0.9719243986580439, 'bull_time_stop': 169, 'bull_use_sma': True, 'bull_use_ema': True, 'bull_use_atr': False, 'bull_use_adx': True, 'bull_use_spike': True, 'bull_rsi_required': True, 'bear_strategy': 'breakout', 'bear_bb_std_mult': 2.4640242464912547, 'bear_rsi_os': 42, 'bear_rsi_ob': 62, 'bear_adx_thresh': 31.291106156782586, 'bear_atr_min_pct': 0.016963649033039197, 'bear_atr_max_pct': 0.028506558338506016, 'bear_tp_mult': 2.9768567124904872, 'bear_tsl_mult': 0.380922156862752, 'bear_time_stop': 19, 'bear_use_sma': False, 'bear_use_ema': False, 'bear_use_atr': True, 'bear_use_adx': True, 'bear_use_spike': True, 'bear_rsi_required': False, 'sideways_strategy': 'breakout', 'sideways_bb_std_mult': 1.9627598598764981, 'sideways_rsi_os': 17, 'sideways_rsi_ob': 63, 'sideways_adx_thresh': 10.411693631409316, 'sideways_atr_min_pct': 0.002945080888249999, 'sideways_atr_max_pct': 0.06723887724131501, 'sideways_tp_mult': 1.7414551441617794, 'sideways_tsl_mult': 0.49516776985694044, 'sideways_time_stop': 167, 'sideways_use_sma': False, 'sideways_use_ema': True, 'sideways_use_atr': False, 'sideways_use_adx': False, 'sideways_use_spike': True, 'sideways_rsi_required': True}.
[I 2025-08-30 19:17:58,603] Trial 329 finished with values: [-1000000000.0, 1000000000.0] and parameters: {'p_sma': 59, 'p_std': 27, 'p_atr': 10, 'p_adx': 8, 'rsi_period': 48, 'ema1': 16, 'ema2': 16, 'slip_atr_k': 0.14578983505713422, 'slip_spread_k': 0.4537283984663614, 'spread_hl_frac': 0.016910132141074938, 'bb_std_mult': 3.2761371978725817, 'rsi_os': 15, 'rsi_ob': 58, 'vol_spike': 0.023470527021769008, 'adx_thresh': 19.146879017903252, 'atr_min_pct': 0.012686915241328742, 'atr_max_pct': 0.13642593423735086, 'tp_mult': 1.1864395514504973, 'tsl_mult': 0.06600977873455893, 'strategy': 'breakout', 'time_stop': 283, 'use_sma': False, 'use_atr': True, 'use_adx': False, 'use_ema': False, 'use_spike': False, 'rsi_required': True, 'edge_k': 1.2694892766818742, 'edge_cap': 0.19195702295528128, 'bull_strategy': 'breakout', 'bull_bb_std_mult': 1.8792615203433334, 'bull_rsi_os': 48, 'bull_rsi_ob': 72, 'bull_adx_thresh': 26.023563951055916, 'bull_atr_min_pct': 0.004337851156650854, 'bull_atr_max_pct': 0.07152309130437579, 'bull_tp_mult': 2.083073413735201, 'bull_tsl_mult': 0.21525716033166448, 'bull_time_stop': 300, 'bull_use_sma': True, 'bull_use_ema': False, 'bull_use_atr': False, 'bull_use_adx': True, 'bull_use_spike': True, 'bull_rsi_required': True, 'bear_strategy': 'breakout', 'bear_bb_std_mult': 3.372886694226259, 'bear_rsi_os': 44, 'bear_rsi_ob': 80, 'bear_adx_thresh': 5.095546453642926, 'bear_atr_min_pct': 0.0257075108681149, 'bear_atr_max_pct': 0.14407937403294113, 'bear_tp_mult': 1.8188855404737736, 'bear_tsl_mult': 0.37077892786580613, 'bear_time_stop': 136, 'bear_use_sma': True, 'bear_use_ema': False, 'bear_use_atr': True, 'bear_use_adx': True, 'bear_use_spike': False, 'bear_rsi_required': False, 'sideways_strategy': 'breakout', 'sideways_bb_std_mult': 2.1233063590975725, 'sideways_rsi_os': 17, 'sideways_rsi_ob': 62, 'sideways_adx_thresh': 9.094186680831832, 'sideways_atr_min_pct': 0.01271298787521655, 'sideways_atr_max_pct': 0.11405163693899642, 'sideways_tp_mult': 1.843482030600252, 'sideways_tsl_mult': 0.6797584420036711, 'sideways_time_stop': 262, 'sideways_use_sma': True, 'sideways_use_ema': False, 'sideways_use_atr': False, 'sideways_use_adx': False, 'sideways_use_spike': False, 'sideways_rsi_required': False}.
[I 2025-08-30 19:18:31,955] Trial 331 finished with values: [-1000000000.0, 1000000000.0] and parameters: {'p_sma': 46, 'p_std': 27, 'p_atr': 23, 'p_adx': 18, 'rsi_period': 49, 'ema1': 24, 'ema2': 37, 'slip_atr_k': 0.21595609084411976, 'slip_spread_k': 0.5133801441476142, 'spread_hl_frac': 0.017021938676162036, 'bb_std_mult': 3.592210297135675, 'rsi_os': 35, 'rsi_ob': 56, 'vol_spike': 0.06517176447960166, 'adx_thresh': 6.477061007170761, 'atr_min_pct': 0.02550582165884655, 'atr_max_pct': 0.1406124455738074, 'tp_mult': 1.6487029655082346, 'tsl_mult': 0.09709513462147146, 'strategy': 'mean_reversion', 'time_stop': 39, 'use_sma': False, 'use_atr': True, 'use_adx': False, 'use_ema': False, 'use_spike': True, 'rsi_required': False, 'edge_k': 0.19533483047178263, 'edge_cap': 0.49114854868329855, 'bull_strategy': 'mean_reversion', 'bull_bb_std_mult': 1.6383516238179963, 'bull_rsi_os': 5, 'bull_rsi_ob': 72, 'bull_adx_thresh': 31.218357447412863, 'bull_atr_min_pct': 0.005926759231419134, 'bull_atr_max_pct': 0.10105670369404848, 'bull_tp_mult': 2.8033009888531986, 'bull_tsl_mult': 0.9854545082420606, 'bull_time_stop': 269, 'bull_use_sma': True, 'bull_use_ema': False, 'bull_use_atr': True, 'bull_use_adx': True, 'bull_use_spike': False, 'bull_rsi_required': True, 'bear_strategy': 'breakout', 'bear_bb_std_mult': 2.464478586233787, 'bear_rsi_os': 19, 'bear_rsi_ob': 80, 'bear_adx_thresh': 5.060297565937089, 'bear_atr_min_pct': 0.012302255719699926, 'bear_atr_max_pct': 0.055426484944021435, 'bear_tp_mult': 2.806214151464534, 'bear_tsl_mult': 0.373957330045514, 'bear_time_stop': 71, 'bear_use_sma': True, 'bear_use_ema': True, 'bear_use_atr': True, 'bear_use_adx': True, 'bear_use_spike': False, 'bear_rsi_required': False, 'sideways_strategy': 'breakout', 'sideways_bb_std_mult': 2.0933359061892607, 'sideways_rsi_os': 42, 'sideways_rsi_ob': 78, 'sideways_adx_thresh': 10.59765132607567, 'sideways_atr_min_pct': 0.01970690434310643, 'sideways_atr_max_pct': 0.028193285564101257, 'sideways_tp_mult': 1.8612117307482619, 'sideways_tsl_mult': 0.2480716704142767, 'sideways_time_stop': 282, 'sideways_use_sma': True, 'sideways_use_ema': False, 'sideways_use_atr': False, 'sideways_use_adx': False, 'sideways_use_spike': False, 'sideways_rsi_required': True}.
[I 2025-08-30 19:18:32,570] Trial 330 finished with values: [-1000000000.0, 1000000000.0] and parameters: {'p_sma': 41, 'p_std': 26, 'p_atr': 10, 'p_adx': 27, 'rsi_period': 48, 'ema1': 25, 'ema2': 38, 'slip_atr_k': 0.2166827313121822, 'slip_spread_k': 0.775289882121946, 'spread_hl_frac': 0.010403136446190854, 'bb_std_mult': 3.232275027906578, 'rsi_os': 40, 'rsi_ob': 72, 'vol_spike': 0.2583445884533687, 'adx_thresh': 10.796652232647892, 'atr_min_pct': 0.012728969936137233, 'atr_max_pct': 0.13817165093845432, 'tp_mult': 2.1993751321959514, 'tsl_mult': 0.7752589834915424, 'strategy': 'breakout', 'time_stop': 152, 'use_sma': False, 'use_atr': True, 'use_adx': False, 'use_ema': False, 'use_spike': True, 'rsi_required': True, 'edge_k': 0.11272479318235344, 'edge_cap': 0.06913610411654325, 'bull_strategy': 'mean_reversion', 'bull_bb_std_mult': 1.6774366295925474, 'bull_rsi_os': 22, 'bull_rsi_ob': 94, 'bull_adx_thresh': 25.967946834724053, 'bull_atr_min_pct': 0.01747757625675466, 'bull_atr_max_pct': 0.0892450665306314, 'bull_tp_mult': 2.028143719917446, 'bull_tsl_mult': 0.4146847731577613, 'bull_time_stop': 170, 'bull_use_sma': True, 'bull_use_ema': False, 'bull_use_atr': True, 'bull_use_adx': True, 'bull_use_spike': True, 'bull_rsi_required': True, 'bear_strategy': 'breakout', 'bear_bb_std_mult': 2.453603349248107, 'bear_rsi_os': 25, 'bear_rsi_ob': 54, 'bear_adx_thresh': 33.47429368364544, 'bear_atr_min_pct': 0.012317788129558098, 'bear_atr_max_pct': 0.05525376457584449, 'bear_tp_mult': 1.8072099825411327, 'bear_tsl_mult': 0.38313890827886077, 'bear_time_stop': 71, 'bear_use_sma': True, 'bear_use_ema': True, 'bear_use_atr': True, 'bear_use_adx': True, 'bear_use_spike': False, 'bear_rsi_required': False, 'sideways_strategy': 'breakout', 'sideways_bb_std_mult': 2.096535493005668, 'sideways_rsi_os': 32, 'sideways_rsi_ob': 75, 'sideways_adx_thresh': 9.046341026237789, 'sideways_atr_min_pct': 0.019732462762713215, 'sideways_atr_max_pct': 0.06773002256882049, 'sideways_tp_mult': 1.2734878132144605, 'sideways_tsl_mult': 0.25559843046710073, 'sideways_time_stop': 74, 'sideways_use_sma': True, 'sideways_use_ema': True, 'sideways_use_atr': False, 'sideways_use_adx': False, 'sideways_use_spike': False, 'sideways_rsi_required': False}.
[I 2025-08-30 19:18:32,739] Trial 333 finished with values: [-0.029635097757713447, 0.0295550555452445] and parameters: {'p_sma': 41, 'p_std': 8, 'p_atr': 23, 'p_adx': 7, 'rsi_period': 58, 'ema1': 27, 'ema2': 46, 'slip_atr_k': 0.15683870816710954, 'slip_spread_k': 0.42138119326282986, 'spread_hl_frac': 0.015221688271729743, 'bb_std_mult': 1.0808479088123342, 'rsi_os': 35, 'rsi_ob': 56, 'vol_spike': 0.2574499167447261, 'adx_thresh': 17.997058461784043, 'atr_min_pct': 0.023091132439232293, 'atr_max_pct': 0.14234019462799427, 'tp_mult': 2.2006912262063945, 'tsl_mult': 0.7803931679024746, 'strategy': 'mean_reversion', 'time_stop': 41, 'use_sma': True, 'use_atr': False, 'use_adx': False, 'use_ema': False, 'use_spike': True, 'rsi_required': False, 'edge_k': 0.24921378536444005, 'edge_cap': 0.858938089483342, 'bull_strategy': 'mean_reversion', 'bull_bb_std_mult': 1.6793167235709485, 'bull_rsi_os': 39, 'bull_rsi_ob': 70, 'bull_adx_thresh': 19.675776907337426, 'bull_atr_min_pct': 0.001813476672821261, 'bull_atr_max_pct': 0.05908985464618456, 'bull_tp_mult': 2.1564213462057777, 'bull_tsl_mult': 0.8258067371722502, 'bull_time_stop': 197, 'bull_use_sma': False, 'bull_use_ema': False, 'bull_use_atr': True, 'bull_use_adx': False, 'bull_use_spike': False, 'bull_rsi_required': True, 'bear_strategy': 'mean_reversion', 'bear_bb_std_mult': 2.6097805843647155, 'bear_rsi_os': 18, 'bear_rsi_ob': 86, 'bear_adx_thresh': 17.14572939551141, 'bear_atr_min_pct': 0.0009977398613547558, 'bear_atr_max_pct': 0.07530017204362591, 'bear_tp_mult': 2.6619116999528436, 'bear_tsl_mult': 0.12443657196716137, 'bear_time_stop': 156, 'bear_use_sma': True, 'bear_use_ema': True, 'bear_use_atr': False, 'bear_use_adx': False, 'bear_use_spike': False, 'bear_rsi_required': True, 'sideways_strategy': 'mean_reversion', 'sideways_bb_std_mult': 1.871736374077577, 'sideways_rsi_os': 32, 'sideways_rsi_ob': 74, 'sideways_adx_thresh': 9.149855268637399, 'sideways_atr_min_pct': 0.01978689226565737, 'sideways_atr_max_pct': 0.027721607604659873, 'sideways_tp_mult': 2.76640875020396, 'sideways_tsl_mult': 0.9001136221949341, 'sideways_time_stop': 283, 'sideways_use_sma': True, 'sideways_use_ema': True, 'sideways_use_atr': True, 'sideways_use_adx': True, 'sideways_use_spike': False, 'sideways_rsi_required': False}.
