[I 2025-08-30 19:35:02,043] Trial 450 finished with values: [-1000000000.0, 1000000000.0] and parameters: {'p_sma': 9, 'p_std': 26, 'p_atr': 10, 'p_adx': 8, 'rsi_period': 57, 'ema1': 16, 'ema2': 54, 'slip_atr_k': 0.03471735440946559, 'slip_spread_k': 0.4709719593203011, 'spread_hl_frac': 0.009507613586555136, 'bb_std_mult': 0.975790291192808, 'rsi_os': 39, 'rsi_ob': 55, 'vol_spike': 0.23448771192505863, 'adx_thresh': 14.350023136176933, 'atr_min_pct': 0.02268150125187292, 'atr_max_pct': 0.024219854020913326, 'tp_mult': 1.9414354473696716, 'tsl_mult': 0.0010518235254926567, 'strategy': 'breakout', 'time_stop': 171, 'use_sma': False, 'use_atr': True, 'use_adx': False, 'use_ema': False, 'use_spike': True, 'rsi_required': True, 'edge_k': 0.03586973760354249, 'edge_cap': 0.23456483133881273, 'bull_strategy': 'mean_reversion', 'bull_bb_std_mult': 1.840915302193344, 'bull_rsi_os': 51, 'bull_rsi_ob': 72, 'bull_adx_thresh': 23.741335915958484, 'bull_atr_min_pct': 0.014897336512461948, 'bull_atr_max_pct': 0.031174857359348187, 'bull_tp_mult': 2.2082167273130797, 'bull_tsl_mult': 0.5867054118589565, 'bull_time_stop': 240, 'bull_use_sma': True, 'bull_use_ema': False, 'bull_use_atr': False, 'bull_use_adx': True, 'bull_use_spike': False, 'bull_rsi_required': True, 'bear_strategy': 'mean_reversion', 'bear_bb_std_mult': 0.9373563496727937, 'bear_rsi_os': 26, 'bear_rsi_ob': 58, 'bear_adx_thresh': 5.119053648603978, 'bear_atr_min_pct': 0.01488297178420905, 'bear_atr_max_pct': 0.07441217998845324, 'bear_tp_mult': 2.181024125507622, 'bear_tsl_mult': 0.15587039723815646, 'bear_time_stop': 222, 'bear_use_sma': True, 'bear_use_ema': False, 'bear_use_atr': True, 'bear_use_adx': True, 'bear_use_spike': True, 'bear_rsi_required': False, 'sideways_strategy': 'breakout', 'sideways_bb_std_mult': 2.0660035362243967, 'sideways_rsi_os': 35, 'sideways_rsi_ob': 63, 'sideways_adx_thresh': 14.247945526207833, 'sideways_atr_min_pct': 0.01997891667695046, 'sideways_atr_max_pct': 0.1194510719639942, 'sideways_tp_mult': 1.7065747093526809, 'sideways_tsl_mult': 0.6051377485943077, 'sideways_time_stop': 189, 'sideways_use_sma': True, 'sideways_use_ema': True, 'sideways_use_atr': True, 'sideways_use_adx': False, 'sideways_use_spike': False, 'sideways_rsi_required': False}.
[I 2025-08-30 19:35:02,290] Trial 452 finished with values: [-1000000000.0, 1000000000.0] and parameters: {'p_sma': 40, 'p_std': 56, 'p_atr': 10, 'p_adx': 8, 'rsi_period': 36, 'ema1': 26, 'ema2': 58, 'slip_atr_k': 0.06090237631763154, 'slip_spread_k': 0.47748318483841423, 'spread_hl_frac': 0.0064831771539397105, 'bb_std_mult': 0.977172629761888, 'rsi_os': 27, 'rsi_ob': 75, 'vol_spike': 0.013741796462824356, 'adx_thresh': 14.649709662721804, 'atr_min_pct': 0.02391609008786127, 'atr_max_pct': 0.10731083641942761, 'tp_mult': 2.19130995961383, 'tsl_mult': 0.8758859372406536, 'strategy': 'mean_reversion', 'time_stop': 35, 'use_sma': False, 'use_atr': False, 'use_adx': False, 'use_ema': False, 'use_spike': True, 'rsi_required': False, 'edge_k': 0.03741923952966131, 'edge_cap': 0.24487356219189108, 'bull_strategy': 'mean_reversion', 'bull_bb_std_mult': 2.4933747786187106, 'bull_rsi_os': 48, 'bull_rsi_ob': 76, 'bull_adx_thresh': 22.503991680241164, 'bull_atr_min_pct': 0.014645727915328435, 'bull_atr_max_pct': 0.03273170102924671, 'bull_tp_mult': 2.121299521659509, 'bull_tsl_mult': 0.5690788760801059, 'bull_time_stop': 124, 'bull_use_sma': True, 'bull_use_ema': False, 'bull_use_atr': False, 'bull_use_adx': False, 'bull_use_spike': False, 'bull_rsi_required': True, 'bear_strategy': 'mean_reversion', 'bear_bb_std_mult': 3.099729169423704, 'bear_rsi_os': 20, 'bear_rsi_ob': 90, 'bear_adx_thresh': 5.50589812427125, 'bear_atr_min_pct': 0.02154686486638488, 'bear_atr_max_pct': 0.074061474020169, 'bear_tp_mult': 1.771641584604719, 'bear_tsl_mult': 0.7747624889466351, 'bear_time_stop': 116, 'bear_use_sma': True, 'bear_use_ema': False, 'bear_use_atr': False, 'bear_use_adx': False, 'bear_use_spike': True, 'bear_rsi_required': True, 'sideways_strategy': 'breakout', 'sideways_bb_std_mult': 3.2328600280110065, 'sideways_rsi_os': 16, 'sideways_rsi_ob': 60, 'sideways_adx_thresh': 8.777951600377548, 'sideways_atr_min_pct': 0.014131412885964697, 'sideways_atr_max_pct': 0.11940277687316649, 'sideways_tp_mult': 2.767651415576679, 'sideways_tsl_mult': 0.09219224108584118, 'sideways_time_stop': 110, 'sideways_use_sma': False, 'sideways_use_ema': True, 'sideways_use_atr': True, 'sideways_use_adx': False, 'sideways_use_spike': True, 'sideways_rsi_required': True}.
[I 2025-08-30 19:35:02,465] Trial 451 finished with values: [-1000000000.0, 1000000000.0] and parameters: {'p_sma': 40, 'p_std': 43, 'p_atr': 29, 'p_adx': 8, 'rsi_period': 77, 'ema1': 26, 'ema2': 45, 'slip_atr_k': 0.00013916482827201065, 'slip_spread_k': 0.46825550212949524, 'spread_hl_frac': 0.01771964027877327, 'bb_std_mult': 0.9877325005623137, 'rsi_os': 39, 'rsi_ob': 58, 'vol_spike': 0.2369101725091517, 'adx_thresh': 19.827015683592208, 'atr_min_pct': 0.021136428359946308, 'atr_max_pct': 0.14254980261557543, 'tp_mult': 2.1850428804570323, 'tsl_mult': 0.7352274068058215, 'strategy': 'mean_reversion', 'time_stop': 35, 'use_sma': False, 'use_atr': False, 'use_adx': False, 'use_ema': False, 'use_spike': True, 'rsi_required': False, 'edge_k': 1.3588275416267441, 'edge_cap': 0.23745747739033138, 'bull_strategy': 'mean_reversion', 'bull_bb_std_mult': 1.8613184667717437, 'bull_rsi_os': 7, 'bull_rsi_ob': 84, 'bull_adx_thresh': 26.638347092360014, 'bull_atr_min_pct': 0.011883051422012127, 'bull_atr_max_pct': 0.020300909540893357, 'bull_tp_mult': 2.6213504392181646, 'bull_tsl_mult': 0.9590861983425922, 'bull_time_stop': 107, 'bull_use_sma': True, 'bull_use_ema': False, 'bull_use_atr': False, 'bull_use_adx': False, 'bull_use_spike': False, 'bull_rsi_required': True, 'bear_strategy': 'mean_reversion', 'bear_bb_std_mult': 3.12460112258739, 'bear_rsi_os': 44, 'bear_rsi_ob': 83, 'bear_adx_thresh': 13.991065649473322, 'bear_atr_min_pct': 0.02082070571937458, 'bear_atr_max_pct': 0.05932078841476527, 'bear_tp_mult': 1.9187249994895563, 'bear_tsl_mult': 0.6269504304477305, 'bear_time_stop': 37, 'bear_use_sma': True, 'bear_use_ema': False, 'bear_use_atr': False, 'bear_use_adx': False, 'bear_use_spike': True, 'bear_rsi_required': True, 'sideways_strategy': 'breakout', 'sideways_bb_std_mult': 2.364914737564028, 'sideways_rsi_os': 7, 'sideways_rsi_ob': 60, 'sideways_adx_thresh': 22.98157497337178, 'sideways_atr_min_pct': 0.019815557493597178, 'sideways_atr_max_pct': 0.11961412853102156, 'sideways_tp_mult': 1.784981801858777, 'sideways_tsl_mult': 0.0978070354501937, 'sideways_time_stop': 182, 'sideways_use_sma': False, 'sideways_use_ema': True, 'sideways_use_atr': True, 'sideways_use_adx': False, 'sideways_use_spike': True, 'sideways_rsi_required': True}.
[I 2025-08-30 19:35:03,128] Trial 453 finished with values: [-1000000000.0, 1000000000.0] and parameters: {'p_sma': 37, 'p_std': 56, 'p_atr': 10, 'p_adx': 8, 'rsi_period': 56, 'ema1': 26, 'ema2': 16, 'slip_atr_k': 0.025969910726009918, 'slip_spread_k': 0.030063326349361208, 'spread_hl_frac': 0.006051257146036458, 'bb_std_mult': 0.9906060571280849, 'rsi_os': 34, 'rsi_ob': 55, 'vol_spike': 0.02672265885596574, 'adx_thresh': 14.80626707577921, 'atr_min_pct': 0.02282557293809334, 'atr_max_pct': 0.010374248119714616, 'tp_mult': 1.9415026461482474, 'tsl_mult': 0.7210533232389716, 'strategy': 'mean_reversion', 'time_stop': 44, 'use_sma': False, 'use_atr': False, 'use_adx': True, 'use_ema': False, 'use_spike': True, 'rsi_required': False, 'edge_k': 0.18117894629363304, 'edge_cap': 0.23286313416394028, 'bull_strategy': 'mean_reversion', 'bull_bb_std_mult': 1.2924334978468424, 'bull_rsi_os': 7, 'bull_rsi_ob': 73, 'bull_adx_thresh': 7.741491401306822, 'bull_atr_min_pct': 0.028212985957210307, 'bull_atr_max_pct': 0.020804021215684917, 'bull_tp_mult': 2.1298752585097542, 'bull_tsl_mult': 0.5825177181696813, 'bull_time_stop': 173, 'bull_use_sma': True, 'bull_use_ema': False, 'bull_use_atr': True, 'bull_use_adx': False, 'bull_use_spike': False, 'bull_rsi_required': True, 'bear_strategy': 'mean_reversion', 'bear_bb_std_mult': 3.1253051578183593, 'bear_rsi_os': 44, 'bear_rsi_ob': 58, 'bear_adx_thresh': 30.68011196544562, 'bear_atr_min_pct': 0.025083896256526975, 'bear_atr_max_pct': 0.051110973548427474, 'bear_tp_mult': 2.79297422113331, 'bear_tsl_mult': 0.6507984483733033, 'bear_time_stop': 287, 'bear_use_sma': True, 'bear_use_ema': False, 'bear_use_atr': False, 'bear_use_adx': False, 'bear_use_spike': True, 'bear_rsi_required': True, 'sideways_strategy': 'breakout', 'sideways_bb_std_mult': 2.3728359841917896, 'sideways_rsi_os': 15, 'sideways_rsi_ob': 56, 'sideways_adx_thresh': 23.244907970690765, 'sideways_atr_min_pct': 0.029444016253965748, 'sideways_atr_max_pct': 0.11958587092314109, 'sideways_tp_mult': 1.8647476505139755, 'sideways_tsl_mult': 0.6093712221875386, 'sideways_time_stop': 265, 'sideways_use_sma': False, 'sideways_use_ema': True, 'sideways_use_atr': True, 'sideways_use_adx': False, 'sideways_use_spike': True, 'sideways_rsi_required': True}.
[I 2025-08-30 19:35:03,189] Trial 456 finished with values: [-1000000000.0, 1000000000.0] and parameters: {'p_sma': 43, 'p_std': 40, 'p_atr': 10, 'p_adx': 9, 'rsi_period': 49, 'ema1': 24, 'ema2': 16, 'slip_atr_k': 0.00667276330148449, 'slip_spread_k': 0.32475693023610397, 'spread_hl_frac': 0.0032337296587903967, 'bb_std_mult': 3.5918904785313295, 'rsi_os': 31, 'rsi_ob': 58, 'vol_spike': 0.02542644175929297, 'adx_thresh': 28.00300660555866, 'atr_min_pct': 0.02482655554711759, 'atr_max_pct': 0.010044129795382703, 'tp_mult': 2.2679034163655145, 'tsl_mult': 0.7165531711045834, 'strategy': 'breakout', 'time_stop': 44, 'use_sma': True, 'use_atr': True, 'use_adx': True, 'use_ema': True, 'use_spike': False, 'rsi_required': True, 'edge_k': 0.18643562134843183, 'edge_cap': 0.29921217420077617, 'bull_strategy': 'mean_reversion', 'bull_bb_std_mult': 1.9223107967115542, 'bull_rsi_os': 29, 'bull_rsi_ob': 73, 'bull_adx_thresh': 25.44425052373184, 'bull_atr_min_pct': 0.0025998833483739533, 'bull_atr_max_pct': 0.010247467688027617, 'bull_tp_mult': 1.3599844410803064, 'bull_tsl_mult': 0.2999745866032515, 'bull_time_stop': 172, 'bull_use_sma': False, 'bull_use_ema': True, 'bull_use_atr': True, 'bull_use_adx': True, 'bull_use_spike': True, 'bull_rsi_required': True, 'bear_strategy': 'breakout', 'bear_bb_std_mult': 1.8159964720960067, 'bear_rsi_os': 43, 'bear_rsi_ob': 81, 'bear_adx_thresh': 5.0055074461528255, 'bear_atr_min_pct': 0.01587586446545031, 'bear_atr_max_pct': 0.05264044302822489, 'bear_tp_mult': 1.668512982709558, 'bear_tsl_mult': 0.8406243678726468, 'bear_time_stop': 28, 'bear_use_sma': True, 'bear_use_ema': True, 'bear_use_atr': True, 'bear_use_adx': True, 'bear_use_spike': False, 'bear_rsi_required': False, 'sideways_strategy': 'mean_reversion', 'sideways_bb_std_mult': 2.12800198372603, 'sideways_rsi_os': 13, 'sideways_rsi_ob': 57, 'sideways_adx_thresh': 20.979392587638053, 'sideways_atr_min_pct': 0.021989186910808214, 'sideways_atr_max_pct': 0.11539227282541457, 'sideways_tp_mult': 2.6162702133450577, 'sideways_tsl_mult': 0.35259573645955933, 'sideways_time_stop': 264, 'sideways_use_sma': True, 'sideways_use_ema': True, 'sideways_use_atr': False, 'sideways_use_adx': True, 'sideways_use_spike': False, 'sideways_rsi_required': False}.
[I 2025-08-30 19:35:35,708] Trial 454 finished with values: [-1000000000.0, 1000000000.0] and parameters: {'p_sma': 55, 'p_std': 22, 'p_atr': 16, 'p_adx': 23, 'rsi_period': 84, 'ema1': 26, 'ema2': 16, 'slip_atr_k': 0.12328210838562559, 'slip_spread_k': 0.013959226271537284, 'spread_hl_frac': 0.006001458429708628, 'bb_std_mult': 3.1334336644106373, 'rsi_os': 23, 'rsi_ob': 58, 'vol_spike': 0.013259561057921893, 'adx_thresh': 34.94585514382666, 'atr_min_pct': 0.02385453232494671, 'atr_max_pct': 0.10741550327670679, 'tp_mult': 1.7316385953312612, 'tsl_mult': 0.7210483061817408, 'strategy': 'mean_reversion', 'time_stop': 44, 'use_sma': True, 'use_atr': False, 'use_adx': True, 'use_ema': True, 'use_spike': False, 'rsi_required': False, 'edge_k': 0.17898609202910049, 'edge_cap': 0.24072847160592936, 'bull_strategy': 'mean_reversion', 'bull_bb_std_mult': 2.0152640458091655, 'bull_rsi_os': 23, 'bull_rsi_ob': 84, 'bull_adx_thresh': 26.67889729723283, 'bull_atr_min_pct': 0.005178062028609291, 'bull_atr_max_pct': 0.04699843188601118, 'bull_tp_mult': 2.643540508774821, 'bull_tsl_mult': 0.9006614199726521, 'bull_time_stop': 172, 'bull_use_sma': False, 'bull_use_ema': True, 'bull_use_atr': True, 'bull_use_adx': False, 'bull_use_spike': True, 'bull_rsi_required': True, 'bear_strategy': 'mean_reversion', 'bear_bb_std_mult': 1.9691901813607169, 'bear_rsi_os': 19, 'bear_rsi_ob': 83, 'bear_adx_thresh': 5.6288731611778395, 'bear_atr_min_pct': 0.015987460589835925, 'bear_atr_max_pct': 0.05515303227507268, 'bear_tp_mult': 1.8256945087749221, 'bear_tsl_mult': 0.6561895999426783, 'bear_time_stop': 34, 'bear_use_sma': True, 'bear_use_ema': True, 'bear_use_atr': False, 'bear_use_adx': False, 'bear_use_spike': True, 'bear_rsi_required': True, 'sideways_strategy': 'mean_reversion', 'sideways_bb_std_mult': 2.0708685523274424, 'sideways_rsi_os': 46, 'sideways_rsi_ob': 60, 'sideways_adx_thresh': 8.517693038623682, 'sideways_atr_min_pct': 0.021856709716796402, 'sideways_atr_max_pct': 0.05553243246340756, 'sideways_tp_mult': 1.2946782967908506, 'sideways_tsl_mult': 0.6910874658487299, 'sideways_time_stop': 108, 'sideways_use_sma': False, 'sideways_use_ema': True, 'sideways_use_atr': True, 'sideways_use_adx': True, 'sideways_use_spike': True, 'sideways_rsi_required': True}.
[I 2025-08-30 19:35:36,055] Trial 455 finished with values: [-1000000000.0, 1000000000.0] and parameters: {'p_sma': 43, 'p_std': 40, 'p_atr': 16, 'p_adx': 10, 'rsi_period': 77, 'ema1': 24, 'ema2': 16, 'slip_atr_k': 0.026298743509097115, 'slip_spread_k': 0.3295184795530267, 'spread_hl_frac': 0.0337226749222958, 'bb_std_mult': 1.0525481073322762, 'rsi_os': 9, 'rsi_ob': 58, 'vol_spike': 0.29890036617345905, 'adx_thresh': 26.15061329095137, 'atr_min_pct': 0.023136756684528862, 'atr_max_pct': 0.13853715589891183, 'tp_mult': 2.1935903161897596, 'tsl_mult': 0.7173412012031188, 'strategy': 'mean_reversion', 'time_stop': 104, 'use_sma': True, 'use_atr': True, 'use_adx': True, 'use_ema': True, 'use_spike': False, 'rsi_required': False, 'edge_k': 0.18110319729381025, 'edge_cap': 0.3019710677024875, 'bull_strategy': 'mean_reversion', 'bull_bb_std_mult': 1.2909138552155213, 'bull_rsi_os': 23, 'bull_rsi_ob': 74, 'bull_adx_thresh': 25.407239276504324, 'bull_atr_min_pct': 0.0025874221366978065, 'bull_atr_max_pct': 0.01959335442142634, 'bull_tp_mult': 2.6139306633744686, 'bull_tsl_mult': 0.43063695213412984, 'bull_time_stop': 105, 'bull_use_sma': False, 'bull_use_ema': True, 'bull_use_atr': True, 'bull_use_adx': False, 'bull_use_spike': True, 'bull_rsi_required': True, 'bear_strategy': 'breakout', 'bear_bb_std_mult': 0.6001885614763227, 'bear_rsi_os': 44, 'bear_rsi_ob': 83, 'bear_adx_thresh': 6.638684255774428, 'bear_atr_min_pct': 0.020585729480685395, 'bear_atr_max_pct': 0.08763871604650601, 'bear_tp_mult': 1.8330069848694197, 'bear_tsl_mult': 0.35925749032492893, 'bear_time_stop': 35, 'bear_use_sma': True, 'bear_use_ema': True, 'bear_use_atr': False, 'bear_use_adx': False, 'bear_use_spike': False, 'bear_rsi_required': True, 'sideways_strategy': 'mean_reversion', 'sideways_bb_std_mult': 2.1217471869469593, 'sideways_rsi_os': 45, 'sideways_rsi_ob': 56, 'sideways_adx_thresh': 12.359395362376285, 'sideways_atr_min_pct': 0.029123793880570816, 'sideways_atr_max_pct': 0.12220712004462632, 'sideways_tp_mult': 1.3167328000494078, 'sideways_tsl_mult': 0.973560905120779, 'sideways_time_stop': 121, 'sideways_use_sma': False, 'sideways_use_ema': True, 'sideways_use_atr': False, 'sideways_use_adx': True, 'sideways_use_spike': True, 'sideways_rsi_required': False}.
[I 2025-08-30 19:35:37,968] Trial 457 finished with values: [-1000000000.0, 1000000000.0] and parameters: {'p_sma': 42, 'p_std': 28, 'p_atr': 17, 'p_adx': 9, 'rsi_period': 81, 'ema1': 30, 'ema2': 17, 'slip_atr_k': 0.008329733338771093, 'slip_spread_k': 0.9040238596145016, 'spread_hl_frac': 0.020324046915643858, 'bb_std_mult': 1.055060631691113, 'rsi_os': 31, 'rsi_ob': 58, 'vol_spike': 0.033709048147980966, 'adx_thresh': 26.06601128091762, 'atr_min_pct': 0.027762786017180054, 'atr_max_pct': 0.13905730490964857, 'tp_mult': 2.2366045786825306, 'tsl_mult': 0.7458219369311929, 'strategy': 'breakout', 'time_stop': 67, 'use_sma': True, 'use_atr': True, 'use_adx': True, 'use_ema': True, 'use_spike': False, 'rsi_required': True, 'edge_k': 0.2816608456884918, 'edge_cap': 0.2947943324885762, 'bull_strategy': 'mean_reversion', 'bull_bb_std_mult': 2.01930729192614, 'bull_rsi_os': 49, 'bull_rsi_ob': 71, 'bull_adx_thresh': 25.381122861131036, 'bull_atr_min_pct': 0.0027437111303419454, 'bull_atr_max_pct': 0.13552936157787454, 'bull_tp_mult': 1.572775016718025, 'bull_tsl_mult': 0.025669686804066116, 'bull_time_stop': 283, 'bull_use_sma': False, 'bull_use_ema': True, 'bull_use_atr': True, 'bull_use_adx': True, 'bull_use_spike': True, 'bull_rsi_required': True, 'bear_strategy': 'breakout', 'bear_bb_std_mult': 0.8212705138503704, 'bear_rsi_os': 43, 'bear_rsi_ob': 82, 'bear_adx_thresh': 6.607683163444839, 'bear_atr_min_pct': 0.019929103896853415, 'bear_atr_max_pct': 0.11597486867837219, 'bear_tp_mult': 1.445264628278232, 'bear_tsl_mult': 0.3055831972041544, 'bear_time_stop': 27, 'bear_use_sma': False, 'bear_use_ema': True, 'bear_use_atr': True, 'bear_use_adx': True, 'bear_use_spike': False, 'bear_rsi_required': False, 'sideways_strategy': 'mean_reversion', 'sideways_bb_std_mult': 2.1333319185230106, 'sideways_rsi_os': 45, 'sideways_rsi_ob': 57, 'sideways_adx_thresh': 12.514235545199858, 'sideways_atr_min_pct': 0.017125013614605757, 'sideways_atr_max_pct': 0.11528157371731527, 'sideways_tp_mult': 1.2455503869777644, 'sideways_tsl_mult': 0.7386044267388565, 'sideways_time_stop': 121, 'sideways_use_sma': True, 'sideways_use_ema': True, 'sideways_use_atr': False, 'sideways_use_adx': True, 'sideways_use_spike': False, 'sideways_rsi_required': False}.
[I 2025-08-30 19:35:38,123] Trial 458 finished with values: [-1000000000.0, 1000000000.0] and parameters: {'p_sma': 55, 'p_std': 53, 'p_atr': 28, 'p_adx': 25, 'rsi_period': 84, 'ema1': 22, 'ema2': 23, 'slip_atr_k': 0.020010408493689458, 'slip_spread_k': 0.36375063446877914, 'spread_hl_frac': 0.0046844760492967576, 'bb_std_mult': 1.3984252606734144, 'rsi_os': 38, 'rsi_ob': 59, 'vol_spike': 0.0331987307643971, 'adx_thresh': 20.253905566817398, 'atr_min_pct': 0.023696010406239063, 'atr_max_pct': 0.1358613628162366, 'tp_mult': 2.237577604510781, 'tsl_mult': 0.7424980415258235, 'strategy': 'breakout', 'time_stop': 144, 'use_sma': True, 'use_atr': True, 'use_adx': False, 'use_ema': True, 'use_spike': False, 'rsi_required': True, 'edge_k': 0.12833994573875973, 'edge_cap': 0.21442100051680707, 'bull_strategy': 'mean_reversion', 'bull_bb_std_mult': 3.4705802447937124, 'bull_rsi_os': 14, 'bull_rsi_ob': 71, 'bull_adx_thresh': 24.149593019322573, 'bull_atr_min_pct': 1.4931760130697247e-05, 'bull_atr_max_pct': 0.046804000423527746, 'bull_tp_mult': 2.077974005565876, 'bull_tsl_mult': 0.9014323961187353, 'bull_time_stop': 57, 'bull_use_sma': False, 'bull_use_ema': True, 'bull_use_atr': False, 'bull_use_adx': True, 'bull_use_spike': True, 'bull_rsi_required': True, 'bear_strategy': 'breakout', 'bear_bb_std_mult': 2.403782864095949, 'bear_rsi_os': 50, 'bear_rsi_ob': 82, 'bear_adx_thresh': 6.751254378315507, 'bear_atr_min_pct': 0.01989152280097376, 'bear_atr_max_pct': 0.08831024898031954, 'bear_tp_mult': 1.0978938398326499, 'bear_tsl_mult': 0.12996962669378462, 'bear_time_stop': 53, 'bear_use_sma': False, 'bear_use_ema': True, 'bear_use_atr': True, 'bear_use_adx': True, 'bear_use_spike': False, 'bear_rsi_required': False, 'sideways_strategy': 'mean_reversion', 'sideways_bb_std_mult': 2.5777261039438955, 'sideways_rsi_os': 15, 'sideways_rsi_ob': 70, 'sideways_adx_thresh': 12.394400826768395, 'sideways_atr_min_pct': 0.002268154897317994, 'sideways_atr_max_pct': 0.12244712351569673, 'sideways_tp_mult': 1.7770146383493273, 'sideways_tsl_mult': 0.738758658783945, 'sideways_time_stop': 282, 'sideways_use_sma': True, 'sideways_use_ema': True, 'sideways_use_atr': False, 'sideways_use_adx': True, 'sideways_use_spike': False, 'sideways_rsi_required': False}.
