[I 2025-08-30 18:45:25,961] Trial 81 finished with values: [-1000000000.0, 1000000000.0] and parameters: {'p_sma': 45, 'p_std': 30, 'p_atr': 9, 'p_adx': 10, 'rsi_period': 62, 'ema1': 7, 'ema2': 47, 'slip_atr_k': 0.24896592831536596, 'slip_spread_k': 0.15370048243743933, 'spread_hl_frac': 0.0044502471030384546, 'bb_std_mult': 2.806272306627524, 'rsi_os': 39, 'rsi_ob': 73, 'vol_spike': 0.09134728379511986, 'adx_thresh': 11.279546360998218, 'atr_min_pct': 0.022437046864574147, 'atr_max_pct': 0.14628824758179207, 'tp_mult': 2.1865509250482793, 'tsl_mult': 0.9552567345928341, 'strategy': 'breakout', 'time_stop': 265, 'use_sma': True, 'use_atr': True, 'use_adx': False, 'use_ema': False, 'use_spike': True, 'rsi_required': True, 'edge_k': 1.0871185995136872, 'edge_cap': 0.2821351827552573, 'bull_strategy': 'mean_reversion', 'bull_bb_std_mult': 3.0313020182434314, 'bull_rsi_os': 48, 'bull_rsi_ob': 69, 'bull_adx_thresh': 5.230862437973174, 'bull_atr_min_pct': 0.013388469305884854, 'bull_atr_max_pct': 0.011577148785043172, 'bull_tp_mult': 2.1646546327055134, 'bull_tsl_mult': 0.5538610724350931, 'bull_time_stop': 196, 'bull_use_sma': False, 'bull_use_ema': True, 'bull_use_atr': False, 'bull_use_adx': True, 'bull_use_spike': True, 'bull_rsi_required': False, 'bear_strategy': 'mean_reversion', 'bear_bb_std_mult': 2.379321329752069, 'bear_rsi_os': 36, 'bear_rsi_ob': 79, 'bear_adx_thresh': 6.058571349683093, 'bear_atr_min_pct': 0.027775687384742176, 'bear_atr_max_pct': 0.06926436577486396, 'bear_tp_mult': 1.5255986486798627, 'bear_tsl_mult': 0.20785824087840044, 'bear_time_stop': 80, 'bear_use_sma': True, 'bear_use_ema': True, 'bear_use_atr': True, 'bear_use_adx': True, 'bear_use_spike': False, 'bear_rsi_required': False, 'sideways_strategy': 'breakout', 'sideways_bb_std_mult': 2.388489874201191, 'sideways_rsi_os': 19, 'sideways_rsi_ob': 76, 'sideways_adx_thresh': 8.521451255269682, 'sideways_atr_min_pct': 0.018295368822960505, 'sideways_atr_max_pct': 0.11568900561641202, 'sideways_tp_mult': 1.811071878970993, 'sideways_tsl_mult': 0.16261545062458366, 'sideways_time_stop': 41, 'sideways_use_sma': False, 'sideways_use_ema': True, 'sideways_use_atr': False, 'sideways_use_adx': True, 'sideways_use_spike': False, 'sideways_rsi_required': False}.
[I 2025-08-30 18:45:58,780] Trial 83 finished with values: [-1000000000.0, 1000000000.0] and parameters: {'p_sma': 9, 'p_std': 28, 'p_atr': 26, 'p_adx': 10, 'rsi_period': 45, 'ema1': 9, 'ema2': 46, 'slip_atr_k': 0.04505461153241738, 'slip_spread_k': 0.15654102982371548, 'spread_hl_frac': 0.028945606964785427, 'bb_std_mult': 0.6054720861516337, 'rsi_os': 19, 'rsi_ob': 77, 'vol_spike': 0.09271192795599631, 'adx_thresh': 12.232386493216717, 'atr_min_pct': 0.027480289484658044, 'atr_max_pct': 0.0425879962185268, 'tp_mult': 2.4989247057971307, 'tsl_mult': 0.5720113194944879, 'strategy': 'breakout', 'time_stop': 262, 'use_sma': False, 'use_atr': True, 'use_adx': False, 'use_ema': False, 'use_spike': True, 'rsi_required': True, 'edge_k': 0.992380667632597, 'edge_cap': 0.23085643502784228, 'bull_strategy': 'mean_reversion', 'bull_bb_std_mult': 1.1779341767664357, 'bull_rsi_os': 53, 'bull_rsi_ob': 69, 'bull_adx_thresh': 5.40454577801812, 'bull_atr_min_pct': 0.00030763600678824186, 'bull_atr_max_pct': 0.06426677839267264, 'bull_tp_mult': 1.8557075788827746, 'bull_tsl_mult': 0.9366990350530537, 'bull_time_stop': 194, 'bull_use_sma': True, 'bull_use_ema': False, 'bull_use_atr': False, 'bull_use_adx': True, 'bull_use_spike': True, 'bull_rsi_required': True, 'bear_strategy': 'breakout', 'bear_bb_std_mult': 3.090261154325203, 'bear_rsi_os': 45, 'bear_rsi_ob': 66, 'bear_adx_thresh': 6.127979779615513, 'bear_atr_min_pct': 0.018167576996950905, 'bear_atr_max_pct': 0.06156351610098636, 'bear_tp_mult': 1.5391772944860753, 'bear_tsl_mult': 0.021848150107349765, 'bear_time_stop': 58, 'bear_use_sma': False, 'bear_use_ema': False, 'bear_use_atr': False, 'bear_use_adx': False, 'bear_use_spike': False, 'bear_rsi_required': True, 'sideways_strategy': 'breakout', 'sideways_bb_std_mult': 0.9145140921194548, 'sideways_rsi_os': 19, 'sideways_rsi_ob': 58, 'sideways_adx_thresh': 13.032654326699745, 'sideways_atr_min_pct': 0.01843096302280422, 'sideways_atr_max_pct': 0.05696743376714663, 'sideways_tp_mult': 1.5360249728334634, 'sideways_tsl_mult': 0.563336830314663, 'sideways_time_stop': 234, 'sideways_use_sma': True, 'sideways_use_ema': True, 'sideways_use_atr': False, 'sideways_use_adx': False, 'sideways_use_spike': False, 'sideways_rsi_required': False}.
[I 2025-08-30 18:45:58,994] Trial 84 finished with values: [-0.03733762655701833, 0.03722516424253768] and parameters: {'p_sma': 37, 'p_std': 28, 'p_atr': 27, 'p_adx': 16, 'rsi_period': 52, 'ema1': 8, 'ema2': 24, 'slip_atr_k': 0.231914412976304, 'slip_spread_k': 0.1638562554392431, 'spread_hl_frac': 0.03820600796705713, 'bb_std_mult': 0.8873780884780585, 'rsi_os': 18, 'rsi_ob': 78, 'vol_spike': 0.011041183600982322, 'adx_thresh': 5.2700329643371955, 'atr_min_pct': 0.02764340328608468, 'atr_max_pct': 0.14928273984634033, 'tp_mult': 1.526340456234623, 'tsl_mult': 0.713047231024053, 'strategy': 'breakout', 'time_stop': 254, 'use_sma': False, 'use_atr': True, 'use_adx': False, 'use_ema': False, 'use_spike': True, 'rsi_required': True, 'edge_k': 0.3322565646226091, 'edge_cap': 0.22968842204380066, 'bull_strategy': 'mean_reversion', 'bull_bb_std_mult': 2.9298886670081177, 'bull_rsi_os': 36, 'bull_rsi_ob': 69, 'bull_adx_thresh': 19.10576855598472, 'bull_atr_min_pct': 0.00013577249566359062, 'bull_atr_max_pct': 0.015432720260858134, 'bull_tp_mult': 2.169816030445793, 'bull_tsl_mult': 0.929356648764026, 'bull_time_stop': 191, 'bull_use_sma': True, 'bull_use_ema': False, 'bull_use_atr': False, 'bull_use_adx': True, 'bull_use_spike': True, 'bull_rsi_required': True, 'bear_strategy': 'breakout', 'bear_bb_std_mult': 2.39404016088464, 'bear_rsi_os': 51, 'bear_rsi_ob': 80, 'bear_adx_thresh': 6.111331698866402, 'bear_atr_min_pct': 0.018016199976487266, 'bear_atr_max_pct': 0.061912949676288215, 'bear_tp_mult': 1.532454713620885, 'bear_tsl_mult': 0.022118148562319126, 'bear_time_stop': 175, 'bear_use_sma': True, 'bear_use_ema': False, 'bear_use_atr': False, 'bear_use_adx': False, 'bear_use_spike': False, 'bear_rsi_required': True, 'sideways_strategy': 'breakout', 'sideways_bb_std_mult': 1.994744334573727, 'sideways_rsi_os': 19, 'sideways_rsi_ob': 58, 'sideways_adx_thresh': 28.9184264946954, 'sideways_atr_min_pct': 0.018290158486056703, 'sideways_atr_max_pct': 0.010369758736971588, 'sideways_tp_mult': 1.4967149868789371, 'sideways_tsl_mult': 0.1655874556031416, 'sideways_time_stop': 236, 'sideways_use_sma': True, 'sideways_use_ema': True, 'sideways_use_atr': False, 'sideways_use_adx': False, 'sideways_use_spike': False, 'sideways_rsi_required': False}.
[I 2025-08-30 18:45:59,157] Trial 82 finished with values: [-0.030550162743591347, 0.03040323154141239] and parameters: {'p_sma': 52, 'p_std': 25, 'p_atr': 9, 'p_adx': 10, 'rsi_period': 34, 'ema1': 8, 'ema2': 12, 'slip_atr_k': 0.22958281558972315, 'slip_spread_k': 0.47658787867084856, 'spread_hl_frac': 0.03821846481048707, 'bb_std_mult': 2.9283593478666434, 'rsi_os': 39, 'rsi_ob': 76, 'vol_spike': 0.09078732262351308, 'adx_thresh': 11.929640221370242, 'atr_min_pct': 0.022683597573905024, 'atr_max_pct': 0.040345247801515216, 'tp_mult': 2.3532617794615014, 'tsl_mult': 0.9573157833553179, 'strategy': 'breakout', 'time_stop': 85, 'use_sma': False, 'use_atr': True, 'use_adx': False, 'use_ema': False, 'use_spike': True, 'rsi_required': True, 'edge_k': 1.003870139717132, 'edge_cap': 0.4895773396578302, 'bull_strategy': 'breakout', 'bull_bb_std_mult': 2.991686256660565, 'bull_rsi_os': 48, 'bull_rsi_ob': 81, 'bull_adx_thresh': 13.911507249730414, 'bull_atr_min_pct': 0.00013955641594001018, 'bull_atr_max_pct': 0.06509622316447523, 'bull_tp_mult': 1.854206071500008, 'bull_tsl_mult': 0.9673847301082914, 'bull_time_stop': 172, 'bull_use_sma': True, 'bull_use_ema': True, 'bull_use_atr': False, 'bull_use_adx': True, 'bull_use_spike': True, 'bull_rsi_required': False, 'bear_strategy': 'breakout', 'bear_bb_std_mult': 2.245016101478199, 'bear_rsi_os': 17, 'bear_rsi_ob': 73, 'bear_adx_thresh': 14.822419155129804, 'bear_atr_min_pct': 0.0192955455852798, 'bear_atr_max_pct': 0.06883691256355201, 'bear_tp_mult': 1.2867300466784823, 'bear_tsl_mult': 0.031607521918583334, 'bear_time_stop': 176, 'bear_use_sma': True, 'bear_use_ema': False, 'bear_use_atr': False, 'bear_use_adx': False, 'bear_use_spike': False, 'bear_rsi_required': True, 'sideways_strategy': 'breakout', 'sideways_bb_std_mult': 2.3764570648303516, 'sideways_rsi_os': 19, 'sideways_rsi_ob': 62, 'sideways_adx_thresh': 28.570444290686822, 'sideways_atr_min_pct': 0.018374884487682555, 'sideways_atr_max_pct': 0.11569583346536016, 'sideways_tp_mult': 1.8277543337742825, 'sideways_tsl_mult': 0.026171049807271807, 'sideways_time_stop': 237, 'sideways_use_sma': True, 'sideways_use_ema': True, 'sideways_use_atr': False, 'sideways_use_adx': False, 'sideways_use_spike': False, 'sideways_rsi_required': False}.
[I 2025-08-30 18:45:59,406] Trial 85 finished with values: [-0.03883203627339704, 0.038720260281670506] and parameters: {'p_sma': 37, 'p_std': 18, 'p_atr': 29, 'p_adx': 16, 'rsi_period': 45, 'ema1': 20, 'ema2': 23, 'slip_atr_k': 0.22717301479926982, 'slip_spread_k': 0.48231245504369014, 'spread_hl_frac': 0.03871541867979847, 'bb_std_mult': 1.2150086403791696, 'rsi_os': 21, 'rsi_ob': 49, 'vol_spike': 0.034842334279290836, 'adx_thresh': 5.454226470702093, 'atr_min_pct': 0.00214534123758889, 'atr_max_pct': 0.1495481956680475, 'tp_mult': 1.5224368007245428, 'tsl_mult': 0.5851069407223912, 'strategy': 'breakout', 'time_stop': 230, 'use_sma': False, 'use_atr': True, 'use_adx': False, 'use_ema': False, 'use_spike': True, 'rsi_required': True, 'edge_k': 1.0258690609977232, 'edge_cap': 0.9027539318917834, 'bull_strategy': 'mean_reversion', 'bull_bb_std_mult': 1.7515430137555357, 'bull_rsi_os': 53, 'bull_rsi_ob': 78, 'bull_adx_thresh': 14.23580578513823, 'bull_atr_min_pct': 0.001678329690954763, 'bull_atr_max_pct': 0.06559310264336621, 'bull_tp_mult': 2.076753932800457, 'bull_tsl_mult': 0.9349594281257366, 'bull_time_stop': 189, 'bull_use_sma': True, 'bull_use_ema': False, 'bull_use_atr': False, 'bull_use_adx': True, 'bull_use_spike': True, 'bull_rsi_required': True, 'bear_strategy': 'breakout', 'bear_bb_std_mult': 3.0644802939557683, 'bear_rsi_os': 45, 'bear_rsi_ob': 82, 'bear_adx_thresh': 6.128507819879813, 'bear_atr_min_pct': 0.014734030942145947, 'bear_atr_max_pct': 0.03463100831108596, 'bear_tp_mult': 2.1091111328818815, 'bear_tsl_mult': 0.6274714624803872, 'bear_time_stop': 170, 'bear_use_sma': False, 'bear_use_ema': False, 'bear_use_atr': False, 'bear_use_adx': False, 'bear_use_spike': False, 'bear_rsi_required': True, 'sideways_strategy': 'breakout', 'sideways_bb_std_mult': 0.9996777898898188, 'sideways_rsi_os': 18, 'sideways_rsi_ob': 58, 'sideways_adx_thresh': 19.61754100553554, 'sideways_atr_min_pct': 0.019866895962401685, 'sideways_atr_max_pct': 0.05752415821984953, 'sideways_tp_mult': 1.5149899903595725, 'sideways_tsl_mult': 0.6174989095130415, 'sideways_time_stop': 264, 'sideways_use_sma': True, 'sideways_use_ema': True, 'sideways_use_atr': False, 'sideways_use_adx': False, 'sideways_use_spike': False, 'sideways_rsi_required': False}.
[I 2025-08-30 18:45:59,711] Trial 88 finished with values: [-1000000000.0, 1000000000.0] and parameters: {'p_sma': 33, 'p_std': 23, 'p_atr': 18, 'p_adx': 21, 'rsi_period': 56, 'ema1': 29, 'ema2': 14, 'slip_atr_k': 0.020035749878993123, 'slip_spread_k': 0.5120268409534862, 'spread_hl_frac': 0.045541306156168575, 'bb_std_mult': 1.1282343361201388, 'rsi_os': 34, 'rsi_ob': 49, 'vol_spike': 0.03388413812768623, 'adx_thresh': 26.00959662302442, 'atr_min_pct': 0.003152244313299883, 'atr_max_pct': 0.13272347451361943, 'tp_mult': 2.2687689855811892, 'tsl_mult': 0.8179451393246641, 'strategy': 'mean_reversion', 'time_stop': 53, 'use_sma': False, 'use_atr': False, 'use_adx': True, 'use_ema': True, 'use_spike': False, 'rsi_required': False, 'edge_k': 1.5973897070579826, 'edge_cap': 0.9109252242846106, 'bull_strategy': 'mean_reversion', 'bull_bb_std_mult': 1.7540440821601053, 'bull_rsi_os': 45, 'bull_rsi_ob': 77, 'bull_adx_thresh': 25.92943397896234, 'bull_atr_min_pct': 0.003446044311100923, 'bull_atr_max_pct': 0.07526250171455155, 'bull_tp_mult': 2.109019486917892, 'bull_tsl_mult': 0.8897527776650995, 'bull_time_stop': 209, 'bull_use_sma': True, 'bull_use_ema': False, 'bull_use_atr': False, 'bull_use_adx': True, 'bull_use_spike': False, 'bull_rsi_required': True, 'bear_strategy': 'breakout', 'bear_bb_std_mult': 3.147586798042437, 'bear_rsi_os': 49, 'bear_rsi_ob': 82, 'bear_adx_thresh': 7.632248124760465, 'bear_atr_min_pct': 0.000405211464963735, 'bear_atr_max_pct': 0.07768844930664812, 'bear_tp_mult': 1.6543743581022021, 'bear_tsl_mult': 0.09262799973544668, 'bear_time_stop': 132, 'bear_use_sma': False, 'bear_use_ema': False, 'bear_use_atr': True, 'bear_use_adx': True, 'bear_use_spike': True, 'bear_rsi_required': False, 'sideways_strategy': 'breakout', 'sideways_bb_std_mult': 2.1312660234750718, 'sideways_rsi_os': 17, 'sideways_rsi_ob': 48, 'sideways_adx_thresh': 11.599248804201032, 'sideways_atr_min_pct': 0.02077714495118138, 'sideways_atr_max_pct': 0.1238469407204991, 'sideways_tp_mult': 2.840345122566489, 'sideways_tsl_mult': 0.9955340528617979, 'sideways_time_stop': 138, 'sideways_use_sma': True, 'sideways_use_ema': False, 'sideways_use_atr': False, 'sideways_use_adx': False, 'sideways_use_spike': True, 'sideways_rsi_required': False}.
[I 2025-08-30 18:45:59,960] Trial 90 finished with values: [-1000000000.0, 1000000000.0] and parameters: {'p_sma': 40, 'p_std': 49, 'p_atr': 21, 'p_adx': 7, 'rsi_period': 42, 'ema1': 27, 'ema2': 36, 'slip_atr_k': 0.0796804218636494, 'slip_spread_k': 0.3681340146331678, 'spread_hl_frac': 0.03367335991067194, 'bb_std_mult': 1.5403772459306118, 'rsi_os': 48, 'rsi_ob': 55, 'vol_spike': 0.05512259916175995, 'adx_thresh': 31.627327528188754, 'atr_min_pct': 0.0221455882334934, 'atr_max_pct': 0.016598716537842298, 'tp_mult': 2.2127876409013063, 'tsl_mult': 0.49172141791704504, 'strategy': 'breakout', 'time_stop': 63, 'use_sma': False, 'use_atr': True, 'use_adx': True, 'use_ema': True, 'use_spike': True, 'rsi_required': False, 'edge_k': 1.9022629887673423, 'edge_cap': 0.1957397279446543, 'bull_strategy': 'mean_reversion', 'bull_bb_std_mult': 2.1420098147201205, 'bull_rsi_os': 43, 'bull_rsi_ob': 62, 'bull_adx_thresh': 33.89029354712214, 'bull_atr_min_pct': 0.02069591197197149, 'bull_atr_max_pct': 0.08215919601086555, 'bull_tp_mult': 1.7725897014124448, 'bull_tsl_mult': 0.5665577785689, 'bull_time_stop': 154, 'bull_use_sma': True, 'bull_use_ema': False, 'bull_use_atr': False, 'bull_use_adx': True, 'bull_use_spike': False, 'bull_rsi_required': True, 'bear_strategy': 'breakout', 'bear_bb_std_mult': 3.343425937361669, 'bear_rsi_os': 38, 'bear_rsi_ob': 54, 'bear_adx_thresh': 8.679734529300612, 'bear_atr_min_pct': 0.012811330599773223, 'bear_atr_max_pct': 0.04448048497667535, 'bear_tp_mult': 1.9647041535241794, 'bear_tsl_mult': 0.1877434997953042, 'bear_time_stop': 242, 'bear_use_sma': True, 'bear_use_ema': True, 'bear_use_atr': True, 'bear_use_adx': True, 'bear_use_spike': True, 'bear_rsi_required': False, 'sideways_strategy': 'breakout', 'sideways_bb_std_mult': 3.4043099508486696, 'sideways_rsi_os': 30, 'sideways_rsi_ob': 52, 'sideways_adx_thresh': 10.158452924887175, 'sideways_atr_min_pct': 0.014678671324550079, 'sideways_atr_max_pct': 0.10950081657294777, 'sideways_tp_mult': 1.6263852800981407, 'sideways_tsl_mult': 0.07972374632537454, 'sideways_time_stop': 279, 'sideways_use_sma': False, 'sideways_use_ema': False, 'sideways_use_atr': False, 'sideways_use_adx': False, 'sideways_use_spike': False, 'sideways_rsi_required': False}.
[I 2025-08-30 18:46:30,615] Trial 87 finished with values: [-1000000000.0, 1000000000.0] and parameters: {'p_sma': 39, 'p_std': 50, 'p_atr': 18, 'p_adx': 20, 'rsi_period': 12, 'ema1': 20, 'ema2': 13, 'slip_atr_k': 0.016410076984395106, 'slip_spread_k': 0.8930189566939002, 'spread_hl_frac': 0.047233965201671786, 'bb_std_mult': 1.0889229385301622, 'rsi_os': 35, 'rsi_ob': 49, 'vol_spike': 0.03342559738050045, 'adx_thresh': 31.701934838947988, 'atr_min_pct': 0.0017304530804312674, 'atr_max_pct': 0.1338915830298406, 'tp_mult': 2.2987983512975783, 'tsl_mult': 0.815932429140933, 'strategy': 'breakout', 'time_stop': 223, 'use_sma': False, 'use_atr': True, 'use_adx': True, 'use_ema': True, 'use_spike': True, 'rsi_required': False, 'edge_k': 1.8589581513589257, 'edge_cap': 0.4940598254262658, 'bull_strategy': 'breakout', 'bull_bb_std_mult': 1.7539828680557954, 'bull_rsi_os': 43, 'bull_rsi_ob': 77, 'bull_adx_thresh': 25.638072770067595, 'bull_atr_min_pct': 0.0032266647190735825, 'bull_atr_max_pct': 0.08468539231257771, 'bull_tp_mult': 1.7704700855908775, 'bull_tsl_mult': 0.9778012366863651, 'bull_time_stop': 207, 'bull_use_sma': True, 'bull_use_ema': False, 'bull_use_atr': False, 'bull_use_adx': True, 'bull_use_spike': False, 'bull_rsi_required': True, 'bear_strategy': 'breakout', 'bear_bb_std_mult': 2.239954665337322, 'bear_rsi_os': 49, 'bear_rsi_ob': 89, 'bear_adx_thresh': 8.009061674601451, 'bear_atr_min_pct': 0.019158882024698645, 'bear_atr_max_pct': 0.12476426812981743, 'bear_tp_mult': 2.1312115211297686, 'bear_tsl_mult': 0.6349441753792702, 'bear_time_stop': 46, 'bear_use_sma': True, 'bear_use_ema': False, 'bear_use_atr': True, 'bear_use_adx': True, 'bear_use_spike': True, 'bear_rsi_required': False, 'sideways_strategy': 'breakout', 'sideways_bb_std_mult': 2.125993490839719, 'sideways_rsi_os': 34, 'sideways_rsi_ob': 85, 'sideways_adx_thresh': 11.454944030940931, 'sideways_atr_min_pct': 0.01981060535562104, 'sideways_atr_max_pct': 0.10786470032175041, 'sideways_tp_mult': 1.3316442156470085, 'sideways_tsl_mult': 0.04473709035667517, 'sideways_time_stop': 265, 'sideways_use_sma': True, 'sideways_use_ema': False, 'sideways_use_atr': False, 'sideways_use_adx': False, 'sideways_use_spike': False, 'sideways_rsi_required': False}.
[I 2025-08-30 18:46:31,048] Trial 86 finished with values: [-0.08861415331697242, 0.08843441394774586] and parameters: {'p_sma': 39, 'p_std': 51, 'p_atr': 16, 'p_adx': 7, 'rsi_period': 56, 'ema1': 20, 'ema2': 23, 'slip_atr_k': 0.22707887839688295, 'slip_spread_k': 0.4761804679213416, 'spread_hl_frac': 0.03806821635744748, 'bb_std_mult': 0.8732801437070894, 'rsi_os': 34, 'rsi_ob': 49, 'vol_spike': 0.010830508664045585, 'adx_thresh': 34.944266779789956, 'atr_min_pct': 0.0029428268792586077, 'atr_max_pct': 0.14979272663151524, 'tp_mult': 1.5058818299688457, 'tsl_mult': 0.728383503515045, 'strategy': 'breakout', 'time_stop': 61, 'use_sma': False, 'use_atr': True, 'use_adx': False, 'use_ema': True, 'use_spike': True, 'rsi_required': False, 'edge_k': 1.8543299957936359, 'edge_cap': 0.19935928057756971, 'bull_strategy': 'mean_reversion', 'bull_bb_std_mult': 1.7530358224353528, 'bull_rsi_os': 44, 'bull_rsi_ob': 77, 'bull_adx_thresh': 19.65070059814551, 'bull_atr_min_pct': 0.0032922843166616777, 'bull_atr_max_pct': 0.016020635137462186, 'bull_tp_mult': 2.0715826525476313, 'bull_tsl_mult': 0.8827525673722589, 'bull_time_stop': 92, 'bull_use_sma': True, 'bull_use_ema': False, 'bull_use_atr': False, 'bull_use_adx': True, 'bull_use_spike': True, 'bull_rsi_required': True, 'bear_strategy': 'breakout', 'bear_bb_std_mult': 3.3266825716333797, 'bear_rsi_os': 50, 'bear_rsi_ob': 82, 'bear_adx_thresh': 5.90890717454502, 'bear_atr_min_pct': 0.0001774659950959656, 'bear_atr_max_pct': 0.07819660299501925, 'bear_tp_mult': 1.2946891258233713, 'bear_tsl_mult': 0.9060724121651621, 'bear_time_stop': 179, 'bear_use_sma': True, 'bear_use_ema': False, 'bear_use_atr': False, 'bear_use_adx': False, 'bear_use_spike': True, 'bear_rsi_required': False, 'sideways_strategy': 'breakout', 'sideways_bb_std_mult': 1.7892398192719432, 'sideways_rsi_os': 15, 'sideways_rsi_ob': 85, 'sideways_adx_thresh': 28.369251460981495, 'sideways_atr_min_pct': 0.014451652498821587, 'sideways_atr_max_pct': 0.12248764604280596, 'sideways_tp_mult': 1.3338496869539458, 'sideways_tsl_mult': 0.06205546720006927, 'sideways_time_stop': 24, 'sideways_use_sma': True, 'sideways_use_ema': True, 'sideways_use_atr': False, 'sideways_use_adx': False, 'sideways_use_spike': False, 'sideways_rsi_required': False}.
