[I 2025-08-30 20:10:47,605] Trial 712 finished with values: [-1000000000.0, 1000000000.0] and parameters: {'p_sma': 39, 'p_std': 26, 'p_atr': 10, 'p_adx': 16, 'rsi_period': 47, 'ema1': 13, 'ema2': 20, 'slip_atr_k': 0.01168754262656289, 'slip_spread_k': 0.9993560519822178, 'spread_hl_frac': 0.01342959388062023, 'bb_std_mult': 1.0368352957323124, 'rsi_os': 50, 'rsi_ob': 57, 'vol_spike': 0.11339037117744102, 'adx_thresh': 16.277819222113166, 'atr_min_pct': 0.024966406363718233, 'atr_max_pct': 0.14064928144762537, 'tp_mult': 2.2430036439499403, 'tsl_mult': 0.24674858438880415, 'strategy': 'breakout', 'time_stop': 24, 'use_sma': False, 'use_atr': True, 'use_adx': False, 'use_ema': True, 'use_spike': False, 'rsi_required': True, 'edge_k': 1.7112175855131326, 'edge_cap': 0.244784048774946, 'bull_strategy': 'mean_reversion', 'bull_bb_std_mult': 0.6069678858333138, 'bull_rsi_os': 38, 'bull_rsi_ob': 89, 'bull_adx_thresh': 33.75416420875089, 'bull_atr_min_pct': 0.003454535051970061, 'bull_atr_max_pct': 0.043137231861887754, 'bull_tp_mult': 2.208436568464378, 'bull_tsl_mult': 0.9833364703672436, 'bull_time_stop': 178, 'bull_use_sma': True, 'bull_use_ema': False, 'bull_use_atr': False, 'bull_use_adx': True, 'bull_use_spike': True, 'bull_rsi_required': False, 'bear_strategy': 'breakout', 'bear_bb_std_mult': 0.5855069059266071, 'bear_rsi_os': 23, 'bear_rsi_ob': 85, 'bear_adx_thresh': 5.028579369007945, 'bear_atr_min_pct': 0.025105060989080673, 'bear_atr_max_pct': 0.04645331597704015, 'bear_tp_mult': 1.7783283909093823, 'bear_tsl_mult': 0.2105099837567595, 'bear_time_stop': 130, 'bear_use_sma': True, 'bear_use_ema': True, 'bear_use_atr': True, 'bear_use_adx': True, 'bear_use_spike': False, 'bear_rsi_required': False, 'sideways_strategy': 'breakout', 'sideways_bb_std_mult': 0.6135357276614279, 'sideways_rsi_os': 17, 'sideways_rsi_ob': 57, 'sideways_adx_thresh': 8.128375162328311, 'sideways_atr_min_pct': 0.0011152837155363297, 'sideways_atr_max_pct': 0.04487998748512676, 'sideways_tp_mult': 1.2186360759691313, 'sideways_tsl_mult': 0.6708813419607228, 'sideways_time_stop': 274, 'sideways_use_sma': True, 'sideways_use_ema': True, 'sideways_use_atr': False, 'sideways_use_adx': False, 'sideways_use_spike': False, 'sideways_rsi_required': False}.
[I 2025-08-30 20:10:47,693] Trial 710 finished with values: [-1000000000.0, 1000000000.0] and parameters: {'p_sma': 16, 'p_std': 28, 'p_atr': 10, 'p_adx': 8, 'rsi_period': 37, 'ema1': 16, 'ema2': 30, 'slip_atr_k': 0.012477910178263989, 'slip_spread_k': 0.40279975032849596, 'spread_hl_frac': 0.0024014678678315826, 'bb_std_mult': 1.0552665613039665, 'rsi_os': 35, 'rsi_ob': 69, 'vol_spike': 0.024763091523022793, 'adx_thresh': 15.427003414990946, 'atr_min_pct': 0.023625786445531358, 'atr_max_pct': 0.13386276301353853, 'tp_mult': 2.6602458107279885, 'tsl_mult': 0.4526523273368963, 'strategy': 'breakout', 'time_stop': 23, 'use_sma': False, 'use_atr': True, 'use_adx': False, 'use_ema': True, 'use_spike': False, 'rsi_required': True, 'edge_k': 0.2082575874934045, 'edge_cap': 0.17455140874432212, 'bull_strategy': 'mean_reversion', 'bull_bb_std_mult': 3.5973950303447646, 'bull_rsi_os': 50, 'bull_rsi_ob': 73, 'bull_adx_thresh': 26.82629404126751, 'bull_atr_min_pct': 0.013529863121315211, 'bull_atr_max_pct': 0.030267066337085004, 'bull_tp_mult': 2.2061102206336516, 'bull_tsl_mult': 0.9401752084762618, 'bull_time_stop': 177, 'bull_use_sma': True, 'bull_use_ema': False, 'bull_use_atr': False, 'bull_use_adx': True, 'bull_use_spike': True, 'bull_rsi_required': False, 'bear_strategy': 'breakout', 'bear_bb_std_mult': 3.162127167540506, 'bear_rsi_os': 39, 'bear_rsi_ob': 83, 'bear_adx_thresh': 28.60239590192566, 'bear_atr_min_pct': 0.012777307495481798, 'bear_atr_max_pct': 0.0469323071496761, 'bear_tp_mult': 1.768579972797127, 'bear_tsl_mult': 0.5191188714928197, 'bear_time_stop': 41, 'bear_use_sma': True, 'bear_use_ema': True, 'bear_use_atr': True, 'bear_use_adx': True, 'bear_use_spike': False, 'bear_rsi_required': False, 'sideways_strategy': 'breakout', 'sideways_bb_std_mult': 1.6666252722421477, 'sideways_rsi_os': 18, 'sideways_rsi_ob': 47, 'sideways_adx_thresh': 10.806250541536434, 'sideways_atr_min_pct': 0.001404438802692769, 'sideways_atr_max_pct': 0.042383399942405316, 'sideways_tp_mult': 1.6329240677290748, 'sideways_tsl_mult': 0.6560624807968553, 'sideways_time_stop': 299, 'sideways_use_sma': True, 'sideways_use_ema': True, 'sideways_use_atr': False, 'sideways_use_adx': False, 'sideways_use_spike': False, 'sideways_rsi_required': False}.
[I 2025-08-30 20:10:47,923] Trial 711 finished with values: [-1000000000.0, 1000000000.0] and parameters: {'p_sma': 39, 'p_std': 26, 'p_atr': 10, 'p_adx': 13, 'rsi_period': 38, 'ema1': 24, 'ema2': 20, 'slip_atr_k': 0.011520346093482462, 'slip_spread_k': 0.4210963872704423, 'spread_hl_frac': 0.013110831317236244, 'bb_std_mult': 1.0617597623696733, 'rsi_os': 50, 'rsi_ob': 87, 'vol_spike': 0.04214396331712269, 'adx_thresh': 15.401167577053922, 'atr_min_pct': 0.026293273826296586, 'atr_max_pct': 0.0696757125155641, 'tp_mult': 2.2639688708368593, 'tsl_mult': 0.24583029438488085, 'strategy': 'breakout', 'time_stop': 24, 'use_sma': False, 'use_atr': True, 'use_adx': False, 'use_ema': True, 'use_spike': False, 'rsi_required': True, 'edge_k': 0.29028408659847593, 'edge_cap': 0.18614458445451193, 'bull_strategy': 'mean_reversion', 'bull_bb_std_mult': 3.2078789647760546, 'bull_rsi_os': 5, 'bull_rsi_ob': 73, 'bull_adx_thresh': 24.491978828076018, 'bull_atr_min_pct': 0.01336742053085739, 'bull_atr_max_pct': 0.06918870591577354, 'bull_tp_mult': 2.417094902435728, 'bull_tsl_mult': 0.17142935893240796, 'bull_time_stop': 120, 'bull_use_sma': True, 'bull_use_ema': False, 'bull_use_atr': False, 'bull_use_adx': True, 'bull_use_spike': True, 'bull_rsi_required': False, 'bear_strategy': 'breakout', 'bear_bb_std_mult': 3.155421710053266, 'bear_rsi_os': 28, 'bear_rsi_ob': 85, 'bear_adx_thresh': 14.42201793924606, 'bear_atr_min_pct': 0.02500261426780097, 'bear_atr_max_pct': 0.06366408462463388, 'bear_tp_mult': 1.7685733164587996, 'bear_tsl_mult': 0.8330010244035803, 'bear_time_stop': 42, 'bear_use_sma': True, 'bear_use_ema': True, 'bear_use_atr': True, 'bear_use_adx': True, 'bear_use_spike': False, 'bear_rsi_required': False, 'sideways_strategy': 'breakout', 'sideways_bb_std_mult': 2.1217453562028137, 'sideways_rsi_os': 26, 'sideways_rsi_ob': 88, 'sideways_adx_thresh': 16.878881676740328, 'sideways_atr_min_pct': 0.0013361250577913642, 'sideways_atr_max_pct': 0.12335106265734058, 'sideways_tp_mult': 2.358072302670095, 'sideways_tsl_mult': 0.6048528181124334, 'sideways_time_stop': 298, 'sideways_use_sma': True, 'sideways_use_ema': True, 'sideways_use_atr': False, 'sideways_use_adx': False, 'sideways_use_spike': False, 'sideways_rsi_required': False}.
[I 2025-08-30 20:11:21,722] Trial 717 finished with values: [-0.015856744559551994, 0.015763186421352295] and parameters: {'p_sma': 13, 'p_std': 23, 'p_atr': 9, 'p_adx': 9, 'rsi_period': 52, 'ema1': 7, 'ema2': 18, 'slip_atr_k': 0.020164528272040932, 'slip_spread_k': 0.8205537125211986, 'spread_hl_frac': 0.0006153848716602076, 'bb_std_mult': 0.9551097144122925, 'rsi_os': 20, 'rsi_ob': 55, 'vol_spike': 0.0425311844590728, 'adx_thresh': 8.544013431610619, 'atr_min_pct': 0.008697553939945655, 'atr_max_pct': 0.14255212189660565, 'tp_mult': 1.5575304247274409, 'tsl_mult': 0.749959034239293, 'strategy': 'mean_reversion', 'time_stop': 41, 'use_sma': False, 'use_atr': True, 'use_adx': True, 'use_ema': False, 'use_spike': True, 'rsi_required': False, 'edge_k': 0.07066412647236753, 'edge_cap': 0.8418334756680594, 'bull_strategy': 'mean_reversion', 'bull_bb_std_mult': 2.5972519528841094, 'bull_rsi_os': 8, 'bull_rsi_ob': 72, 'bull_adx_thresh': 8.139494206154612, 'bull_atr_min_pct': 0.0008046996954202612, 'bull_atr_max_pct': 0.03501911503124947, 'bull_tp_mult': 2.3308280782932114, 'bull_tsl_mult': 0.9568428500622511, 'bull_time_stop': 199, 'bull_use_sma': False, 'bull_use_ema': False, 'bull_use_atr': True, 'bull_use_adx': False, 'bull_use_spike': True, 'bull_rsi_required': True, 'bear_strategy': 'breakout', 'bear_bb_std_mult': 3.4551074461823794, 'bear_rsi_os': 55, 'bear_rsi_ob': 81, 'bear_adx_thresh': 5.555186698700461, 'bear_atr_min_pct': 0.014018159050764287, 'bear_atr_max_pct': 0.0596228150232528, 'bear_tp_mult': 1.6481829656332114, 'bear_tsl_mult': 0.8830560336920905, 'bear_time_stop': 31, 'bear_use_sma': True, 'bear_use_ema': False, 'bear_use_atr': True, 'bear_use_adx': True, 'bear_use_spike': True, 'bear_rsi_required': True, 'sideways_strategy': 'mean_reversion', 'sideways_bb_std_mult': 1.930040524606213, 'sideways_rsi_os': 15, 'sideways_rsi_ob': 65, 'sideways_adx_thresh': 30.248398678046584, 'sideways_atr_min_pct': 0.019314474800980287, 'sideways_atr_max_pct': 0.14366347027891596, 'sideways_tp_mult': 1.8220881128732003, 'sideways_tsl_mult': 0.2733423335724391, 'sideways_time_stop': 263, 'sideways_use_sma': True, 'sideways_use_ema': False, 'sideways_use_atr': True, 'sideways_use_adx': True, 'sideways_use_spike': False, 'sideways_rsi_required': False}.
[I 2025-08-30 20:11:22,340] Trial 716 finished with values: [-0.01339981816920377, 0.013306184892905793] and parameters: {'p_sma': 13, 'p_std': 24, 'p_atr': 9, 'p_adx': 9, 'rsi_period': 71, 'ema1': 19, 'ema2': 40, 'slip_atr_k': 0.017979265028621058, 'slip_spread_k': 0.47541388670185114, 'spread_hl_frac': 0.0010813642768059024, 'bb_std_mult': 0.9369427080007957, 'rsi_os': 13, 'rsi_ob': 55, 'vol_spike': 0.04376376931471815, 'adx_thresh': 19.930880066016243, 'atr_min_pct': 0.02171058043287389, 'atr_max_pct': 0.04672490124509385, 'tp_mult': 1.7085565647118077, 'tsl_mult': 0.9604603230848734, 'strategy': 'mean_reversion', 'time_stop': 39, 'use_sma': False, 'use_atr': True, 'use_adx': False, 'use_ema': False, 'use_spike': True, 'rsi_required': False, 'edge_k': 1.129673884642486, 'edge_cap': 0.2640816837045482, 'bull_strategy': 'mean_reversion', 'bull_bb_std_mult': 1.3937992037993334, 'bull_rsi_os': 52, 'bull_rsi_ob': 88, 'bull_adx_thresh': 24.99563843558207, 'bull_atr_min_pct': 0.0009875408544212639, 'bull_atr_max_pct': 0.06939886967535895, 'bull_tp_mult': 2.4243928151259766, 'bull_tsl_mult': 0.9998349435527144, 'bull_time_stop': 199, 'bull_use_sma': False, 'bull_use_ema': False, 'bull_use_atr': True, 'bull_use_adx': False, 'bull_use_spike': True, 'bull_rsi_required': True, 'bear_strategy': 'breakout', 'bear_bb_std_mult': 3.429751570981856, 'bear_rsi_os': 28, 'bear_rsi_ob': 82, 'bear_adx_thresh': 5.726158867731751, 'bear_atr_min_pct': 0.014111928006296121, 'bear_atr_max_pct': 0.08581028097195169, 'bear_tp_mult': 1.1084734836791788, 'bear_tsl_mult': 0.849691684077271, 'bear_time_stop': 109, 'bear_use_sma': True, 'bear_use_ema': False, 'bear_use_atr': True, 'bear_use_adx': True, 'bear_use_spike': False, 'bear_rsi_required': False, 'sideways_strategy': 'breakout', 'sideways_bb_std_mult': 3.2252551360073536, 'sideways_rsi_os': 12, 'sideways_rsi_ob': 50, 'sideways_adx_thresh': 16.388319582565835, 'sideways_atr_min_pct': 0.019170182408978297, 'sideways_atr_max_pct': 0.028775539370593753, 'sideways_tp_mult': 1.767275658859729, 'sideways_tsl_mult': 0.8606559390261016, 'sideways_time_stop': 263, 'sideways_use_sma': True, 'sideways_use_ema': True, 'sideways_use_atr': True, 'sideways_use_adx': True, 'sideways_use_spike': False, 'sideways_rsi_required': False}.
[I 2025-08-30 20:11:22,438] Trial 714 finished with values: [-1000000000.0, 1000000000.0] and parameters: {'p_sma': 25, 'p_std': 26, 'p_atr': 29, 'p_adx': 26, 'rsi_period': 37, 'ema1': 13, 'ema2': 30, 'slip_atr_k': 0.006765506030668514, 'slip_spread_k': 0.4664659160545801, 'spread_hl_frac': 0.03762302663794741, 'bb_std_mult': 0.9539211276648998, 'rsi_os': 35, 'rsi_ob': 60, 'vol_spike': 0.04068273591323936, 'adx_thresh': 19.985497989714677, 'atr_min_pct': 0.016880459061664924, 'atr_max_pct': 0.14090816419429908, 'tp_mult': 1.9088279903386833, 'tsl_mult': 0.44233169707777614, 'strategy': 'breakout', 'time_stop': 23, 'use_sma': False, 'use_atr': True, 'use_adx': False, 'use_ema': True, 'use_spike': False, 'rsi_required': False, 'edge_k': 1.141737158897526, 'edge_cap': 0.1676497527473039, 'bull_strategy': 'mean_reversion', 'bull_bb_std_mult': 2.6178306675547045, 'bull_rsi_os': 32, 'bull_rsi_ob': 73, 'bull_adx_thresh': 24.55515381541345, 'bull_atr_min_pct': 0.00345795547714897, 'bull_atr_max_pct': 0.06284617054625058, 'bull_tp_mult': 2.213895420051698, 'bull_tsl_mult': 0.9563588737333174, 'bull_time_stop': 118, 'bull_use_sma': False, 'bull_use_ema': False, 'bull_use_atr': True, 'bull_use_adx': False, 'bull_use_spike': True, 'bull_rsi_required': False, 'bear_strategy': 'breakout', 'bear_bb_std_mult': 3.442269618263546, 'bear_rsi_os': 22, 'bear_rsi_ob': 89, 'bear_adx_thresh': 5.513225875736625, 'bear_atr_min_pct': 0.00787133900368817, 'bear_atr_max_pct': 0.06254440481401241, 'bear_tp_mult': 2.80874850329614, 'bear_tsl_mult': 0.8434622082091362, 'bear_time_stop': 41, 'bear_use_sma': True, 'bear_use_ema': True, 'bear_use_atr': True, 'bear_use_adx': True, 'bear_use_spike': False, 'bear_rsi_required': False, 'sideways_strategy': 'breakout', 'sideways_bb_std_mult': 3.2132106794473216, 'sideways_rsi_os': 14, 'sideways_rsi_ob': 66, 'sideways_adx_thresh': 17.179873438005018, 'sideways_atr_min_pct': 0.019336093156678117, 'sideways_atr_max_pct': 0.1128834465688291, 'sideways_tp_mult': 2.3646114707596473, 'sideways_tsl_mult': 0.6698258357118285, 'sideways_time_stop': 297, 'sideways_use_sma': True, 'sideways_use_ema': True, 'sideways_use_atr': True, 'sideways_use_adx': True, 'sideways_use_spike': False, 'sideways_rsi_required': False}.
[I 2025-08-30 20:11:22,577] Trial 715 finished with values: [-1000000000.0, 1000000000.0] and parameters: {'p_sma': 41, 'p_std': 8, 'p_atr': 9, 'p_adx': 9, 'rsi_period': 40, 'ema1': 16, 'ema2': 49, 'slip_atr_k': 0.09379784203825997, 'slip_spread_k': 0.4234631369188033, 'spread_hl_frac': 0.01758949610220041, 'bb_std_mult': 0.9966633899741765, 'rsi_os': 36, 'rsi_ob': 92, 'vol_spike': 0.0417316809881842, 'adx_thresh': 20.043141044820093, 'atr_min_pct': 0.024266686077012666, 'atr_max_pct': 0.14288745870000966, 'tp_mult': 2.3142826572383646, 'tsl_mult': 0.1414497472245715, 'strategy': 'mean_reversion', 'time_stop': 41, 'use_sma': False, 'use_atr': True, 'use_adx': False, 'use_ema': False, 'use_spike': True, 'rsi_required': False, 'edge_k': 0.19784407765143186, 'edge_cap': 0.265164620757559, 'bull_strategy': 'mean_reversion', 'bull_bb_std_mult': 1.8618392318685937, 'bull_rsi_os': 6, 'bull_rsi_ob': 73, 'bull_adx_thresh': 24.564501607121063, 'bull_atr_min_pct': 0.0137043322384529, 'bull_atr_max_pct': 0.03489167735153888, 'bull_tp_mult': 2.4124547577959436, 'bull_tsl_mult': 0.8521129716536836, 'bull_time_stop': 198, 'bull_use_sma': False, 'bull_use_ema': False, 'bull_use_atr': True, 'bull_use_adx': False, 'bull_use_spike': True, 'bull_rsi_required': True, 'bear_strategy': 'breakout', 'bear_bb_std_mult': 3.4811347956009726, 'bear_rsi_os': 52, 'bear_rsi_ob': 69, 'bear_adx_thresh': 5.585532558154168, 'bear_atr_min_pct': 0.023352906527233527, 'bear_atr_max_pct': 0.030940317065282358, 'bear_tp_mult': 2.8176681749498016, 'bear_tsl_mult': 0.16512114804346648, 'bear_time_stop': 41, 'bear_use_sma': True, 'bear_use_ema': False, 'bear_use_atr': True, 'bear_use_adx': True, 'bear_use_spike': False, 'bear_rsi_required': False, 'sideways_strategy': 'breakout', 'sideways_bb_std_mult': 1.942017578922405, 'sideways_rsi_os': 14, 'sideways_rsi_ob': 59, 'sideways_adx_thresh': 10.869135706850948, 'sideways_atr_min_pct': 0.019274642555306275, 'sideways_atr_max_pct': 0.11044655595264481, 'sideways_tp_mult': 1.8707501599487528, 'sideways_tsl_mult': 0.8637718549181459, 'sideways_time_stop': 263, 'sideways_use_sma': True, 'sideways_use_ema': True, 'sideways_use_atr': True, 'sideways_use_adx': True, 'sideways_use_spike': False, 'sideways_rsi_required': False}.
[I 2025-08-30 20:11:23,530] Trial 719 finished with values: [-1000000000.0, 1000000000.0] and parameters: {'p_sma': 35, 'p_std': 24, 'p_atr': 9, 'p_adx': 7, 'rsi_period': 52, 'ema1': 24, 'ema2': 15, 'slip_atr_k': 0.09451193821321817, 'slip_spread_k': 0.8959436839398851, 'spread_hl_frac': 0.03704147159800311, 'bb_std_mult': 1.9014503717591549, 'rsi_os': 14, 'rsi_ob': 50, 'vol_spike': 0.19030756162090928, 'adx_thresh': 19.758233651874523, 'atr_min_pct': 0.008470047146095845, 'atr_max_pct': 0.14295784863525846, 'tp_mult': 1.694860412324177, 'tsl_mult': 0.10293907355220538, 'strategy': 'mean_reversion', 'time_stop': 41, 'use_sma': False, 'use_atr': True, 'use_adx': False, 'use_ema': False, 'use_spike': True, 'rsi_required': True, 'edge_k': 0.07296098625772385, 'edge_cap': 0.8740972356469406, 'bull_strategy': 'mean_reversion', 'bull_bb_std_mult': 1.831253913972945, 'bull_rsi_os': 8, 'bull_rsi_ob': 72, 'bull_adx_thresh': 23.774092631155916, 'bull_atr_min_pct': 0.0009649003541537665, 'bull_atr_max_pct': 0.03523638653300147, 'bull_tp_mult': 2.166304856061197, 'bull_tsl_mult': 0.9631423301476425, 'bull_time_stop': 198, 'bull_use_sma': False, 'bull_use_ema': False, 'bull_use_atr': True, 'bull_use_adx': False, 'bull_use_spike': True, 'bull_rsi_required': True, 'bear_strategy': 'breakout', 'bear_bb_std_mult': 3.443359199932008, 'bear_rsi_os': 45, 'bear_rsi_ob': 90, 'bear_adx_thresh': 15.415080614294874, 'bear_atr_min_pct': 0.014154838852976519, 'bear_atr_max_pct': 0.06004895037536879, 'bear_tp_mult': 2.4879312889976726, 'bear_tsl_mult': 0.2798585922234885, 'bear_time_stop': 27, 'bear_use_sma': True, 'bear_use_ema': False, 'bear_use_atr': True, 'bear_use_adx': True, 'bear_use_spike': False, 'bear_rsi_required': True, 'sideways_strategy': 'breakout', 'sideways_bb_std_mult': 3.285226643247273, 'sideways_rsi_os': 22, 'sideways_rsi_ob': 58, 'sideways_adx_thresh': 9.630970090613278, 'sideways_atr_min_pct': 0.01909023564364691, 'sideways_atr_max_pct': 0.11140239600388256, 'sideways_tp_mult': 1.8653343090139498, 'sideways_tsl_mult': 0.6350083883833871, 'sideways_time_stop': 261, 'sideways_use_sma': True, 'sideways_use_ema': False, 'sideways_use_atr': True, 'sideways_use_adx': True, 'sideways_use_spike': False, 'sideways_rsi_required': False}.
[I 2025-08-30 20:11:53,978] Trial 718 finished with values: [-1000000000.0, 1000000000.0] and parameters: {'p_sma': 57, 'p_std': 8, 'p_atr': 9, 'p_adx': 9, 'rsi_period': 52, 'ema1': 7, 'ema2': 18, 'slip_atr_k': 0.09473433287140925, 'slip_spread_k': 0.47070229845997086, 'spread_hl_frac': 0.036594673977605394, 'bb_std_mult': 0.9457783925094021, 'rsi_os': 13, 'rsi_ob': 60, 'vol_spike': 0.0420634281364319, 'adx_thresh': 20.127390403031335, 'atr_min_pct': 0.022443412605965874, 'atr_max_pct': 0.1427675378450063, 'tp_mult': 1.8963571403694357, 'tsl_mult': 0.14932587481117915, 'strategy': 'mean_reversion', 'time_stop': 38, 'use_sma': False, 'use_atr': True, 'use_adx': False, 'use_ema': False, 'use_spike': True, 'rsi_required': False, 'edge_k': 0.07834142349047832, 'edge_cap': 0.8588258801941249, 'bull_strategy': 'mean_reversion', 'bull_bb_std_mult': 1.8695626423816274, 'bull_rsi_os': 15, 'bull_rsi_ob': 72, 'bull_adx_thresh': 23.70078835092209, 'bull_atr_min_pct': 0.016799057387993904, 'bull_atr_max_pct': 0.08202398876246032, 'bull_tp_mult': 2.1755411360257666, 'bull_tsl_mult': 0.9688840548129888, 'bull_time_stop': 199, 'bull_use_sma': False, 'bull_use_ema': False, 'bull_use_atr': True, 'bull_use_adx': False, 'bull_use_spike': True, 'bull_rsi_required': True, 'bear_strategy': 'breakout', 'bear_bb_std_mult': 3.436901432202616, 'bear_rsi_os': 46, 'bear_rsi_ob': 89, 'bear_adx_thresh': 11.527574885900572, 'bear_atr_min_pct': 0.01484489713375664, 'bear_atr_max_pct': 0.059771369956604654, 'bear_tp_mult': 1.6544588767707213, 'bear_tsl_mult': 0.11290632372988547, 'bear_time_stop': 96, 'bear_use_sma': True, 'bear_use_ema': False, 'bear_use_atr': True, 'bear_use_adx': True, 'bear_use_spike': False, 'bear_rsi_required': True, 'sideways_strategy': 'breakout', 'sideways_bb_std_mult': 3.2143595048970504, 'sideways_rsi_os': 32, 'sideways_rsi_ob': 59, 'sideways_adx_thresh': 9.67904597876506, 'sideways_atr_min_pct': 0.019067478082424393, 'sideways_atr_max_pct': 0.11238011731140972, 'sideways_tp_mult': 1.8571663531775868, 'sideways_tsl_mult': 0.7105446313843193, 'sideways_time_stop': 261, 'sideways_use_sma': True, 'sideways_use_ema': False, 'sideways_use_atr': True, 'sideways_use_adx': True, 'sideways_use_spike': False, 'sideways_rsi_required': False}.
