[I 2025-08-30 19:19:40,368] Trial 340 finished with values: [-1000000000.0, 1000000000.0] and parameters: {'p_sma': 38, 'p_std': 47, 'p_atr': 11, 'p_adx': 9, 'rsi_period': 51, 'ema1': 24, 'ema2': 19, 'slip_atr_k': 0.026742896469759653, 'slip_spread_k': 0.9315569831457913, 'spread_hl_frac': 0.0027318346124181447, 'bb_std_mult': 2.6834098243075433, 'rsi_os': 39, 'rsi_ob': 84, 'vol_spike': 0.03186440022076621, 'adx_thresh': 16.15801975016478, 'atr_min_pct': 0.024160725233797736, 'atr_max_pct': 0.13335835301605595, 'tp_mult': 1.4381286585704007, 'tsl_mult': 0.5959337783211749, 'strategy': 'breakout', 'time_stop': 243, 'use_sma': False, 'use_atr': True, 'use_adx': True, 'use_ema': True, 'use_spike': False, 'rsi_required': True, 'edge_k': 0.7226518266997863, 'edge_cap': 0.8212266082538415, 'bull_strategy': 'breakout', 'bull_bb_std_mult': 3.0562611270964695, 'bull_rsi_os': 15, 'bull_rsi_ob': 54, 'bull_adx_thresh': 26.592250319772308, 'bull_atr_min_pct': 0.009896339969156273, 'bull_atr_max_pct': 0.14097206340369067, 'bull_tp_mult': 2.1951391890015186, 'bull_tsl_mult': 0.47186206349049886, 'bull_time_stop': 187, 'bull_use_sma': True, 'bull_use_ema': False, 'bull_use_atr': False, 'bull_use_adx': True, 'bull_use_spike': True, 'bull_rsi_required': True, 'bear_strategy': 'breakout', 'bear_bb_std_mult': 1.418203924083403, 'bear_rsi_os': 30, 'bear_rsi_ob': 83, 'bear_adx_thresh': 32.03897337745957, 'bear_atr_min_pct': 0.013302813671625143, 'bear_atr_max_pct': 0.12664655335394984, 'bear_tp_mult': 1.6861135554010698, 'bear_tsl_mult': 0.8896204118955364, 'bear_time_stop': 23, 'bear_use_sma': False, 'bear_use_ema': False, 'bear_use_atr': True, 'bear_use_adx': True, 'bear_use_spike': False, 'bear_rsi_required': False, 'sideways_strategy': 'breakout', 'sideways_bb_std_mult': 2.19039169759371, 'sideways_rsi_os': 14, 'sideways_rsi_ob': 58, 'sideways_adx_thresh': 9.84773396526627, 'sideways_atr_min_pct': 0.022926409593672196, 'sideways_atr_max_pct': 0.13086612524884864, 'sideways_tp_mult': 1.8339210775704913, 'sideways_tsl_mult': 0.8189754636335687, 'sideways_time_stop': 198, 'sideways_use_sma': True, 'sideways_use_ema': False, 'sideways_use_atr': False, 'sideways_use_adx': False, 'sideways_use_spike': True, 'sideways_rsi_required': True}.
[I 2025-08-30 19:20:14,949] Trial 346 finished with values: [-1000000000.0, 1000000000.0] and parameters: {'p_sma': 42, 'p_std': 29, 'p_atr': 10, 'p_adx': 7, 'rsi_period': 57, 'ema1': 23, 'ema2': 31, 'slip_atr_k': 0.07050688379936094, 'slip_spread_k': 0.4072787908134467, 'spread_hl_frac': 0.03616231552338434, 'bb_std_mult': 1.0184682489439247, 'rsi_os': 36, 'rsi_ob': 55, 'vol_spike': 0.04400993932344709, 'adx_thresh': 24.580972037923697, 'atr_min_pct': 0.0007440266218360862, 'atr_max_pct': 0.0781639997214367, 'tp_mult': 2.223651712970134, 'tsl_mult': 0.7159251628807436, 'strategy': 'mean_reversion', 'time_stop': 46, 'use_sma': False, 'use_atr': True, 'use_adx': False, 'use_ema': False, 'use_spike': True, 'rsi_required': False, 'edge_k': 0.12036417644141337, 'edge_cap': 0.24339613762190002, 'bull_strategy': 'mean_reversion', 'bull_bb_std_mult': 1.846134914818429, 'bull_rsi_os': 49, 'bull_rsi_ob': 73, 'bull_adx_thresh': 32.62376235745384, 'bull_atr_min_pct': 0.0026564251945409927, 'bull_atr_max_pct': 0.028177159298352697, 'bull_tp_mult': 1.8025303618365291, 'bull_tsl_mult': 0.7224076002785932, 'bull_time_stop': 189, 'bull_use_sma': True, 'bull_use_ema': True, 'bull_use_atr': False, 'bull_use_adx': True, 'bull_use_spike': False, 'bull_rsi_required': True, 'bear_strategy': 'breakout', 'bear_bb_std_mult': 3.3992390726457447, 'bear_rsi_os': 32, 'bear_rsi_ob': 82, 'bear_adx_thresh': 5.994819567695534, 'bear_atr_min_pct': 0.011084815996090815, 'bear_atr_max_pct': 0.048132865779976386, 'bear_tp_mult': 1.7977367124814327, 'bear_tsl_mult': 0.5042725580195402, 'bear_time_stop': 32, 'bear_use_sma': True, 'bear_use_ema': False, 'bear_use_atr': True, 'bear_use_adx': True, 'bear_use_spike': True, 'bear_rsi_required': False, 'sideways_strategy': 'breakout', 'sideways_bb_std_mult': 1.9060290856769873, 'sideways_rsi_os': 16, 'sideways_rsi_ob': 56, 'sideways_adx_thresh': 11.550710019583212, 'sideways_atr_min_pct': 0.01825128640222107, 'sideways_atr_max_pct': 0.12499035499551941, 'sideways_tp_mult': 1.4836075691596438, 'sideways_tsl_mult': 0.6898584237523637, 'sideways_time_stop': 267, 'sideways_use_sma': True, 'sideways_use_ema': True, 'sideways_use_atr': False, 'sideways_use_adx': False, 'sideways_use_spike': False, 'sideways_rsi_required': False}.
[I 2025-08-30 19:20:15,140] Trial 345 finished with values: [-1000000000.0, 1000000000.0] and parameters: {'p_sma': 42, 'p_std': 29, 'p_atr': 11, 'p_adx': 22, 'rsi_period': 52, 'ema1': 23, 'ema2': 31, 'slip_atr_k': 0.2005289683985188, 'slip_spread_k': 0.409316340397175, 'spread_hl_frac': 0.035837281698053454, 'bb_std_mult': 2.0433996608495852, 'rsi_os': 36, 'rsi_ob': 92, 'vol_spike': 0.04214140579373402, 'adx_thresh': 21.13416009609263, 'atr_min_pct': 0.007837385342480647, 'atr_max_pct': 0.07847388149385967, 'tp_mult': 1.7650043812148748, 'tsl_mult': 0.7187540479132553, 'strategy': 'breakout', 'time_stop': 100, 'use_sma': False, 'use_atr': True, 'use_adx': False, 'use_ema': False, 'use_spike': True, 'rsi_required': True, 'edge_k': 0.1610809956715774, 'edge_cap': 0.3593745699654505, 'bull_strategy': 'mean_reversion', 'bull_bb_std_mult': 2.123685358407039, 'bull_rsi_os': 49, 'bull_rsi_ob': 73, 'bull_adx_thresh': 23.84970722179965, 'bull_atr_min_pct': 0.021479652607027225, 'bull_atr_max_pct': 0.027775335250020905, 'bull_tp_mult': 1.8024266753527387, 'bull_tsl_mult': 0.5698093261595636, 'bull_time_stop': 185, 'bull_use_sma': True, 'bull_use_ema': True, 'bull_use_atr': False, 'bull_use_adx': True, 'bull_use_spike': True, 'bull_rsi_required': True, 'bear_strategy': 'breakout', 'bear_bb_std_mult': 3.387983144762052, 'bear_rsi_os': 41, 'bear_rsi_ob': 45, 'bear_adx_thresh': 23.956488568955503, 'bear_atr_min_pct': 0.02227213824529345, 'bear_atr_max_pct': 0.046406913037860986, 'bear_tp_mult': 2.032298342175643, 'bear_tsl_mult': 0.8268902100285027, 'bear_time_stop': 32, 'bear_use_sma': True, 'bear_use_ema': False, 'bear_use_atr': True, 'bear_use_adx': True, 'bear_use_spike': True, 'bear_rsi_required': False, 'sideways_strategy': 'breakout', 'sideways_bb_std_mult': 1.9198856618891813, 'sideways_rsi_os': 19, 'sideways_rsi_ob': 61, 'sideways_adx_thresh': 31.11648598655965, 'sideways_atr_min_pct': 0.018153404889333143, 'sideways_atr_max_pct': 0.13119250952850992, 'sideways_tp_mult': 1.7073568215288213, 'sideways_tsl_mult': 0.6881489756596636, 'sideways_time_stop': 86, 'sideways_use_sma': True, 'sideways_use_ema': True, 'sideways_use_atr': False, 'sideways_use_adx': False, 'sideways_use_spike': False, 'sideways_rsi_required': False}.
[I 2025-08-30 19:20:15,255] Trial 343 finished with values: [-1000000000.0, 1000000000.0] and parameters: {'p_sma': 27, 'p_std': 15, 'p_atr': 26, 'p_adx': 9, 'rsi_period': 50, 'ema1': 24, 'ema2': 17, 'slip_atr_k': 0.002972084824801279, 'slip_spread_k': 0.4143190370509841, 'spread_hl_frac': 0.002471071505909633, 'bb_std_mult': 2.5119404890461983, 'rsi_os': 13, 'rsi_ob': 48, 'vol_spike': 0.050282460226127146, 'adx_thresh': 17.2365594462351, 'atr_min_pct': 0.019076264336065227, 'atr_max_pct': 0.09658272629000844, 'tp_mult': 2.1445741497364805, 'tsl_mult': 0.7059337945399194, 'strategy': 'breakout', 'time_stop': 51, 'use_sma': False, 'use_atr': True, 'use_adx': False, 'use_ema': False, 'use_spike': True, 'rsi_required': True, 'edge_k': 0.16544032009985782, 'edge_cap': 0.27317029374367174, 'bull_strategy': 'mean_reversion', 'bull_bb_std_mult': 1.8582688882015697, 'bull_rsi_os': 51, 'bull_rsi_ob': 64, 'bull_adx_thresh': 7.293986044057515, 'bull_atr_min_pct': 0.0027497725818189447, 'bull_atr_max_pct': 0.06490903587315114, 'bull_tp_mult': 2.130766059977174, 'bull_tsl_mult': 0.9815637040169533, 'bull_time_stop': 187, 'bull_use_sma': True, 'bull_use_ema': True, 'bull_use_atr': False, 'bull_use_adx': True, 'bull_use_spike': True, 'bull_rsi_required': True, 'bear_strategy': 'breakout', 'bear_bb_std_mult': 3.086557924422023, 'bear_rsi_os': 30, 'bear_rsi_ob': 56, 'bear_adx_thresh': 5.935496693006096, 'bear_atr_min_pct': 0.010968964624296144, 'bear_atr_max_pct': 0.06424101855062148, 'bear_tp_mult': 2.602154140610067, 'bear_tsl_mult': 0.5795717100830078, 'bear_time_stop': 33, 'bear_use_sma': True, 'bear_use_ema': False, 'bear_use_atr': True, 'bear_use_adx': True, 'bear_use_spike': True, 'bear_rsi_required': False, 'sideways_strategy': 'breakout', 'sideways_bb_std_mult': 2.0386304578033925, 'sideways_rsi_os': 15, 'sideways_rsi_ob': 56, 'sideways_adx_thresh': 8.585935665149009, 'sideways_atr_min_pct': 0.01833929657519406, 'sideways_atr_max_pct': 0.11420132005774596, 'sideways_tp_mult': 1.4978882251848988, 'sideways_tsl_mult': 0.6869838027802938, 'sideways_time_stop': 274, 'sideways_use_sma': False, 'sideways_use_ema': False, 'sideways_use_atr': False, 'sideways_use_adx': False, 'sideways_use_spike': True, 'sideways_rsi_required': True}.
[I 2025-08-30 19:20:15,658] Trial 344 finished with values: [-1000000000.0, 1000000000.0] and parameters: {'p_sma': 42, 'p_std': 45, 'p_atr': 9, 'p_adx': 7, 'rsi_period': 52, 'ema1': 24, 'ema2': 52, 'slip_atr_k': 0.003383848377742053, 'slip_spread_k': 0.41690949395061894, 'spread_hl_frac': 0.0022834299118666317, 'bb_std_mult': 3.510102649331299, 'rsi_os': 13, 'rsi_ob': 47, 'vol_spike': 0.050557448502724915, 'adx_thresh': 15.999112990275934, 'atr_min_pct': 0.0008198150690115376, 'atr_max_pct': 0.12129033017136377, 'tp_mult': 2.234459166441643, 'tsl_mult': 0.7086827111733212, 'strategy': 'breakout', 'time_stop': 99, 'use_sma': False, 'use_atr': True, 'use_adx': False, 'use_ema': False, 'use_spike': True, 'rsi_required': True, 'edge_k': 0.17087079698915936, 'edge_cap': 0.359403743148221, 'bull_strategy': 'mean_reversion', 'bull_bb_std_mult': 3.005742597967215, 'bull_rsi_os': 47, 'bull_rsi_ob': 69, 'bull_adx_thresh': 26.496030570396925, 'bull_atr_min_pct': 0.0027925119142649182, 'bull_atr_max_pct': 0.1368195867186403, 'bull_tp_mult': 1.812624058101567, 'bull_tsl_mult': 0.03786729640119196, 'bull_time_stop': 188, 'bull_use_sma': True, 'bull_use_ema': True, 'bull_use_atr': False, 'bull_use_adx': True, 'bull_use_spike': True, 'bull_rsi_required': True, 'bear_strategy': 'breakout', 'bear_bb_std_mult': 2.3509997158780997, 'bear_rsi_os': 32, 'bear_rsi_ob': 82, 'bear_adx_thresh': 28.941255236125542, 'bear_atr_min_pct': 0.013915735559726755, 'bear_atr_max_pct': 0.10943618844974237, 'bear_tp_mult': 1.6721699142876776, 'bear_tsl_mult': 0.8855867334621599, 'bear_time_stop': 41, 'bear_use_sma': True, 'bear_use_ema': False, 'bear_use_atr': True, 'bear_use_adx': True, 'bear_use_spike': True, 'bear_rsi_required': False, 'sideways_strategy': 'breakout', 'sideways_bb_std_mult': 3.330793254134695, 'sideways_rsi_os': 19, 'sideways_rsi_ob': 61, 'sideways_adx_thresh': 18.53767448138286, 'sideways_atr_min_pct': 0.00542339545537545, 'sideways_atr_max_pct': 0.041945442355402866, 'sideways_tp_mult': 2.3540850948729046, 'sideways_tsl_mult': 0.8546157810742658, 'sideways_time_stop': 274, 'sideways_use_sma': True, 'sideways_use_ema': True, 'sideways_use_atr': False, 'sideways_use_adx': False, 'sideways_use_spike': True, 'sideways_rsi_required': False}.
[I 2025-08-30 19:20:50,804] Trial 350 finished with values: [-0.023950982793194076, 0.023872223328820216] and parameters: {'p_sma': 40, 'p_std': 25, 'p_atr': 10, 'p_adx': 24, 'rsi_period': 17, 'ema1': 28, 'ema2': 15, 'slip_atr_k': 0.01810250240234058, 'slip_spread_k': 0.580707029685656, 'spread_hl_frac': 0.013444498212205142, 'bb_std_mult': 0.9401134328109706, 'rsi_os': 38, 'rsi_ob': 87, 'vol_spike': 0.2702208170188985, 'adx_thresh': 18.684695722573284, 'atr_min_pct': 0.02159467108655337, 'atr_max_pct': 0.13520788353684718, 'tp_mult': 2.287538676571926, 'tsl_mult': 0.7402542048967825, 'strategy': 'mean_reversion', 'time_stop': 273, 'use_sma': True, 'use_atr': False, 'use_adx': True, 'use_ema': False, 'use_spike': True, 'rsi_required': False, 'edge_k': 1.1271366426247027, 'edge_cap': 0.5967233741260398, 'bull_strategy': 'breakout', 'bull_bb_std_mult': 0.7885237180037592, 'bull_rsi_os': 52, 'bull_rsi_ob': 71, 'bull_adx_thresh': 11.692269338378546, 'bull_atr_min_pct': 0.0012900265982077736, 'bull_atr_max_pct': 0.03419846948290843, 'bull_tp_mult': 2.285221807007749, 'bull_tsl_mult': 0.9207899560995855, 'bull_time_stop': 196, 'bull_use_sma': True, 'bull_use_ema': False, 'bull_use_atr': True, 'bull_use_adx': False, 'bull_use_spike': False, 'bull_rsi_required': False, 'bear_strategy': 'breakout', 'bear_bb_std_mult': 1.3330031373726265, 'bear_rsi_os': 44, 'bear_rsi_ob': 74, 'bear_adx_thresh': 5.4981442076536045, 'bear_atr_min_pct': 0.0061662057216642155, 'bear_atr_max_pct': 0.05820434500648735, 'bear_tp_mult': 1.9122305468252188, 'bear_tsl_mult': 0.1177115702330323, 'bear_time_stop': 12, 'bear_use_sma': True, 'bear_use_ema': True, 'bear_use_atr': True, 'bear_use_adx': True, 'bear_use_spike': False, 'bear_rsi_required': False, 'sideways_strategy': 'mean_reversion', 'sideways_bb_std_mult': 3.513574431506046, 'sideways_rsi_os': 17, 'sideways_rsi_ob': 88, 'sideways_adx_thresh': 15.422683867179094, 'sideways_atr_min_pct': 0.017015374569796078, 'sideways_atr_max_pct': 0.09388356880507934, 'sideways_tp_mult': 1.7758495482894405, 'sideways_tsl_mult': 0.6129035639776105, 'sideways_time_stop': 93, 'sideways_use_sma': True, 'sideways_use_ema': True, 'sideways_use_atr': False, 'sideways_use_adx': False, 'sideways_use_spike': False, 'sideways_rsi_required': False}.
[I 2025-08-30 19:20:50,831] Trial 348 finished with values: [-0.020941698360547156, 0.020909932222732606] and parameters: {'p_sma': 36, 'p_std': 25, 'p_atr': 20, 'p_adx': 21, 'rsi_period': 45, 'ema1': 25, 'ema2': 15, 'slip_atr_k': 0.016128499058438675, 'slip_spread_k': 0.43080980111661415, 'spread_hl_frac': 0.0038476831044718086, 'bb_std_mult': 0.9146713422059017, 'rsi_os': 13, 'rsi_ob': 57, 'vol_spike': 0.038676116987168205, 'adx_thresh': 17.333220871539424, 'atr_min_pct': 0.024680908795433863, 'atr_max_pct': 0.12446843964884116, 'tp_mult': 2.6867516457730556, 'tsl_mult': 0.1325512220504627, 'strategy': 'breakout', 'time_stop': 192, 'use_sma': False, 'use_atr': True, 'use_adx': False, 'use_ema': False, 'use_spike': True, 'rsi_required': True, 'edge_k': 1.1465349561876883, 'edge_cap': 0.20786438188580147, 'bull_strategy': 'mean_reversion', 'bull_bb_std_mult': 1.5578917360472877, 'bull_rsi_os': 52, 'bull_rsi_ob': 95, 'bull_adx_thresh': 24.981488057112983, 'bull_atr_min_pct': 0.0013361569532552855, 'bull_atr_max_pct': 0.11232436169106504, 'bull_tp_mult': 2.1415456101674737, 'bull_tsl_mult': 0.9848043945762657, 'bull_time_stop': 133, 'bull_use_sma': True, 'bull_use_ema': False, 'bull_use_atr': True, 'bull_use_adx': True, 'bull_use_spike': True, 'bull_rsi_required': True, 'bear_strategy': 'breakout', 'bear_bb_std_mult': 3.320782022226717, 'bear_rsi_os': 44, 'bear_rsi_ob': 67, 'bear_adx_thresh': 5.666903627438622, 'bear_atr_min_pct': 0.0064655502378179654, 'bear_atr_max_pct': 0.14996323929229488, 'bear_tp_mult': 1.6199403446107619, 'bear_tsl_mult': 0.11859210401423065, 'bear_time_stop': 205, 'bear_use_sma': True, 'bear_use_ema': True, 'bear_use_atr': True, 'bear_use_adx': True, 'bear_use_spike': False, 'bear_rsi_required': False, 'sideways_strategy': 'mean_reversion', 'sideways_bb_std_mult': 3.5044296629120013, 'sideways_rsi_os': 18, 'sideways_rsi_ob': 55, 'sideways_adx_thresh': 32.98300465720382, 'sideways_atr_min_pct': 0.019291233376072282, 'sideways_atr_max_pct': 0.09452474937913964, 'sideways_tp_mult': 2.377060511970983, 'sideways_tsl_mult': 0.5464471401202619, 'sideways_time_stop': 272, 'sideways_use_sma': True, 'sideways_use_ema': True, 'sideways_use_atr': False, 'sideways_use_adx': False, 'sideways_use_spike': False, 'sideways_rsi_required': False}.
[I 2025-08-30 19:20:51,028] Trial 347 finished with values: [-1000000000.0, 1000000000.0] and parameters: {'p_sma': 40, 'p_std': 26, 'p_atr': 26, 'p_adx': 21, 'rsi_period': 52, 'ema1': 25, 'ema2': 50, 'slip_atr_k': 0.004761587591127214, 'slip_spread_k': 0.9977584929139632, 'spread_hl_frac': 0.02252349114896996, 'bb_std_mult': 0.9239800895863481, 'rsi_os': 13, 'rsi_ob': 87, 'vol_spike': 0.04028982492769979, 'adx_thresh': 17.34994196240955, 'atr_min_pct': 0.021701069256303242, 'atr_max_pct': 0.13459657035189784, 'tp_mult': 2.254402536154337, 'tsl_mult': 0.7329768006823182, 'strategy': 'breakout', 'time_stop': 23, 'use_sma': False, 'use_atr': True, 'use_adx': False, 'use_ema': False, 'use_spike': True, 'rsi_required': True, 'edge_k': 0.16562394226671975, 'edge_cap': 0.5920123441494923, 'bull_strategy': 'mean_reversion', 'bull_bb_std_mult': 1.8976448315249335, 'bull_rsi_os': 31, 'bull_rsi_ob': 69, 'bull_adx_thresh': 24.095746222793096, 'bull_atr_min_pct': 0.026407059590303306, 'bull_atr_max_pct': 0.10510860531162823, 'bull_tp_mult': 2.118992673454216, 'bull_tsl_mult': 0.9185266540105932, 'bull_time_stop': 136, 'bull_use_sma': True, 'bull_use_ema': True, 'bull_use_atr': False, 'bull_use_adx': True, 'bull_use_spike': True, 'bull_rsi_required': True, 'bear_strategy': 'breakout', 'bear_bb_std_mult': 3.555696712756625, 'bear_rsi_os': 44, 'bear_rsi_ob': 67, 'bear_adx_thresh': 6.110383227198232, 'bear_atr_min_pct': 0.022327130504302597, 'bear_atr_max_pct': 0.05838155967211932, 'bear_tp_mult': 1.916607540220143, 'bear_tsl_mult': 0.1166483354533173, 'bear_time_stop': 13, 'bear_use_sma': True, 'bear_use_ema': False, 'bear_use_atr': True, 'bear_use_adx': True, 'bear_use_spike': True, 'bear_rsi_required': False, 'sideways_strategy': 'breakout', 'sideways_bb_std_mult': 3.4924099618832543, 'sideways_rsi_os': 18, 'sideways_rsi_ob': 53, 'sideways_adx_thresh': 8.701954337892904, 'sideways_atr_min_pct': 0.015759908236001607, 'sideways_atr_max_pct': 0.0779227848726962, 'sideways_tp_mult': 2.544309822387616, 'sideways_tsl_mult': 0.6215105237714939, 'sideways_time_stop': 58, 'sideways_use_sma': True, 'sideways_use_ema': True, 'sideways_use_atr': False, 'sideways_use_adx': False, 'sideways_use_spike': False, 'sideways_rsi_required': False}.
[I 2025-08-30 19:20:51,045] Trial 349 finished with values: [-1000000000.0, 1000000000.0] and parameters: {'p_sma': 40, 'p_std': 25, 'p_atr': 9, 'p_adx': 11, 'rsi_period': 55, 'ema1': 30, 'ema2': 15, 'slip_atr_k': 0.017658826462448013, 'slip_spread_k': 0.6419916305001909, 'spread_hl_frac': 0.024771503899850802, 'bb_std_mult': 0.9145788108696854, 'rsi_os': 38, 'rsi_ob': 78, 'vol_spike': 0.03688040771647451, 'adx_thresh': 5.91470512485707, 'atr_min_pct': 0.021470286082583296, 'atr_max_pct': 0.1358265160176013, 'tp_mult': 2.091270967462702, 'tsl_mult': 0.4190379424880715, 'strategy': 'breakout', 'time_stop': 26, 'use_sma': False, 'use_atr': True, 'use_adx': False, 'use_ema': False, 'use_spike': True, 'rsi_required': True, 'edge_k': 0.0735230138803587, 'edge_cap': 0.20552970498582612, 'bull_strategy': 'mean_reversion', 'bull_bb_std_mult': 1.0936728057495235, 'bull_rsi_os': 52, 'bull_rsi_ob': 71, 'bull_adx_thresh': 24.987336227218023, 'bull_atr_min_pct': 0.011281584152748925, 'bull_atr_max_pct': 0.13274942492035516, 'bull_tp_mult': 2.2807191352047527, 'bull_tsl_mult': 0.5035491035314953, 'bull_time_stop': 175, 'bull_use_sma': True, 'bull_use_ema': False, 'bull_use_atr': True, 'bull_use_adx': True, 'bull_use_spike': True, 'bull_rsi_required': True, 'bear_strategy': 'breakout', 'bear_bb_std_mult': 2.347918734891435, 'bear_rsi_os': 44, 'bear_rsi_ob': 81, 'bear_adx_thresh': 21.115194930261403, 'bear_atr_min_pct': 0.009639854066529497, 'bear_atr_max_pct': 0.057747497469681525, 'bear_tp_mult': 1.43633222023097, 'bear_tsl_mult': 0.11154241338627176, 'bear_time_stop': 41, 'bear_use_sma': True, 'bear_use_ema': True, 'bear_use_atr': True, 'bear_use_adx': True, 'bear_use_spike': False, 'bear_rsi_required': False, 'sideways_strategy': 'mean_reversion', 'sideways_bb_std_mult': 2.320268438276386, 'sideways_rsi_os': 18, 'sideways_rsi_ob': 88, 'sideways_adx_thresh': 10.548873810996932, 'sideways_atr_min_pct': 0.01708840695607794, 'sideways_atr_max_pct': 0.09487533278135435, 'sideways_tp_mult': 2.499930523515111, 'sideways_tsl_mult': 0.7580872467942978, 'sideways_time_stop': 265, 'sideways_use_sma': True, 'sideways_use_ema': True, 'sideways_use_atr': False, 'sideways_use_adx': False, 'sideways_use_spike': False, 'sideways_rsi_required': False}.
