[I 2025-09-01 10:33:50,297] Trial 579 finished with values: [-1000000000.0, 1000000000.0] and parameters: {'p_sma': 17, 'p_std': 46, 'p_atr': 29, 'p_adx': 22, 'rsi_period': 67, 'ema1': 22, 'ema2': 41, 'slip_atr_k': 0.04507406998890336, 'slip_spread_k': 0.17459133533478782, 'spread_hl_frac': 0.02973926553691495, 'bb_std_mult': 3.39693611436943, 'rsi_os': 23, 'rsi_ob': 80, 'vol_spike': 0.2902614679033576, 'adx_thresh': 6.389268991295117, 'atr_min_pct': 0.010794885179645526, 'atr_max_pct': 0.07660141714459087, 'tp_mult': 2.7301230190865367, 'tsl_mult': 0.0320286255844344, 'strategy': 'breakout', 'time_stop': 76, 'use_sma': True, 'use_atr': False, 'use_adx': True, 'use_ema': False, 'use_spike': False, 'rsi_required': True, 'edge_k': 0.8846879847939035, 'edge_cap': 0.6724868573281042, 'bull_strategy': 'mean_reversion', 'bull_bb_std_mult': 0.7382612932922198, 'bull_rsi_os': 33, 'bull_rsi_ob': 53, 'bull_adx_thresh': 5.005468236024125, 'bull_atr_min_pct': 0.02937326208841529, 'bull_atr_max_pct': 0.09327606037460942, 'bull_tp_mult': 2.834981772243752, 'bull_tsl_mult': 0.5310247678415847, 'bull_time_stop': 17, 'bull_use_sma': False, 'bull_use_ema': True, 'bull_use_atr': True, 'bull_use_adx': False, 'bull_use_spike': False, 'bull_rsi_required': True, 'bear_strategy': 'mean_reversion', 'bear_bb_std_mult': 2.8061500613513664, 'bear_rsi_os': 24, 'bear_rsi_ob': 87, 'bear_adx_thresh': 13.026929455716294, 'bear_atr_min_pct': 0.01619970698211313, 'bear_atr_max_pct': 0.06486889108329592, 'bear_tp_mult': 1.9309290516138164, 'bear_tsl_mult': 0.42926021196570224, 'bear_time_stop': 143, 'bear_use_sma': True, 'bear_use_ema': True, 'bear_use_atr': True, 'bear_use_adx': True, 'bear_use_spike': True, 'bear_rsi_required': True, 'sideways_strategy': 'mean_reversion', 'sideways_bb_std_mult': 3.3798366932398816, 'sideways_rsi_os': 55, 'sideways_rsi_ob': 74, 'sideways_adx_thresh': 14.972135654502221, 'sideways_atr_min_pct': 0.002251599544134825, 'sideways_atr_max_pct': 0.0788835113713962, 'sideways_tp_mult': 1.4374276331958875, 'sideways_tsl_mult': 0.5732430143265523, 'sideways_time_stop': 161, 'sideways_use_sma': False, 'sideways_use_ema': True, 'sideways_use_atr': False, 'sideways_use_adx': False, 'sideways_use_spike': True, 'sideways_rsi_required': True}.
[I 2025-09-01 10:33:50,783] Trial 577 finished with values: [-1000000000.0, 1000000000.0] and parameters: {'p_sma': 20, 'p_std': 46, 'p_atr': 29, 'p_adx': 22, 'rsi_period': 64, 'ema1': 20, 'ema2': 38, 'slip_atr_k': 0.045496900753941805, 'slip_spread_k': 0.17692949966860572, 'spread_hl_frac': 0.02575403339784977, 'bb_std_mult': 3.1064233729578703, 'rsi_os': 19, 'rsi_ob': 73, 'vol_spike': 0.07929377963548365, 'adx_thresh': 29.379525877079992, 'atr_min_pct': 0.025986001243999742, 'atr_max_pct': 0.07602790652963738, 'tp_mult': 2.6410275421883544, 'tsl_mult': 0.9202996413647543, 'strategy': 'breakout', 'time_stop': 160, 'use_sma': True, 'use_atr': False, 'use_adx': True, 'use_ema': False, 'use_spike': False, 'rsi_required': True, 'edge_k': 1.1137791135855022, 'edge_cap': 0.5541482361007841, 'bull_strategy': 'mean_reversion', 'bull_bb_std_mult': 2.2032205536933307, 'bull_rsi_os': 19, 'bull_rsi_ob': 56, 'bull_adx_thresh': 10.892127520728964, 'bull_atr_min_pct': 0.029346316902465305, 'bull_atr_max_pct': 0.08776738610597667, 'bull_tp_mult': 1.879997200280427, 'bull_tsl_mult': 0.5530316392457952, 'bull_time_stop': 171, 'bull_use_sma': True, 'bull_use_ema': True, 'bull_use_atr': True, 'bull_use_adx': False, 'bull_use_spike': False, 'bull_rsi_required': True, 'bear_strategy': 'mean_reversion', 'bear_bb_std_mult': 3.549153619833125, 'bear_rsi_os': 40, 'bear_rsi_ob': 45, 'bear_adx_thresh': 12.897428267738574, 'bear_atr_min_pct': 0.016064435329285955, 'bear_atr_max_pct': 0.06585386799081089, 'bear_tp_mult': 1.9250345342124813, 'bear_tsl_mult': 0.4288043402719655, 'bear_time_stop': 126, 'bear_use_sma': True, 'bear_use_ema': False, 'bear_use_atr': True, 'bear_use_adx': True, 'bear_use_spike': True, 'bear_rsi_required': False, 'sideways_strategy': 'breakout', 'sideways_bb_std_mult': 3.448128606560861, 'sideways_rsi_os': 7, 'sideways_rsi_ob': 94, 'sideways_adx_thresh': 28.330877263637525, 'sideways_atr_min_pct': 0.0019223096131308225, 'sideways_atr_max_pct': 0.06562633348935751, 'sideways_tp_mult': 2.4171313095853213, 'sideways_tsl_mult': 0.37260509796740304, 'sideways_time_stop': 285, 'sideways_use_sma': False, 'sideways_use_ema': True, 'sideways_use_atr': False, 'sideways_use_adx': False, 'sideways_use_spike': True, 'sideways_rsi_required': True}.
[I 2025-09-01 10:33:51,262] Trial 578 finished with values: [-0.06849901495999544, 0.06829717417552848] and parameters: {'p_sma': 26, 'p_std': 46, 'p_atr': 29, 'p_adx': 22, 'rsi_period': 67, 'ema1': 30, 'ema2': 52, 'slip_atr_k': 0.04404086089383873, 'slip_spread_k': 0.1811032671023144, 'spread_hl_frac': 0.0259048782756117, 'bb_std_mult': 3.395691825996553, 'rsi_os': 18, 'rsi_ob': 79, 'vol_spike': 0.048829697276845135, 'adx_thresh': 10.548804177407584, 'atr_min_pct': 0.015642272816391436, 'atr_max_pct': 0.05445175207361305, 'tp_mult': 2.1716362070837762, 'tsl_mult': 0.45043953254104, 'strategy': 'breakout', 'time_stop': 151, 'use_sma': True, 'use_atr': False, 'use_adx': True, 'use_ema': False, 'use_spike': False, 'rsi_required': True, 'edge_k': 0.8825425644679006, 'edge_cap': 0.44961173736096277, 'bull_strategy': 'mean_reversion', 'bull_bb_std_mult': 1.2216745847890444, 'bull_rsi_os': 12, 'bull_rsi_ob': 94, 'bull_adx_thresh': 19.20605777381481, 'bull_atr_min_pct': 0.02937742084816298, 'bull_atr_max_pct': 0.03327478902813988, 'bull_tp_mult': 1.7490495992861534, 'bull_tsl_mult': 0.5257912146592095, 'bull_time_stop': 163, 'bull_use_sma': True, 'bull_use_ema': True, 'bull_use_atr': True, 'bull_use_adx': False, 'bull_use_spike': False, 'bull_rsi_required': True, 'bear_strategy': 'mean_reversion', 'bear_bb_std_mult': 1.960157043457827, 'bear_rsi_os': 46, 'bear_rsi_ob': 45, 'bear_adx_thresh': 12.94566223881746, 'bear_atr_min_pct': 0.016404093285744395, 'bear_atr_max_pct': 0.06533731168609636, 'bear_tp_mult': 1.9300774405974386, 'bear_tsl_mult': 0.42728132859615653, 'bear_time_stop': 125, 'bear_use_sma': True, 'bear_use_ema': True, 'bear_use_atr': True, 'bear_use_adx': True, 'bear_use_spike': True, 'bear_rsi_required': False, 'sideways_strategy': 'breakout', 'sideways_bb_std_mult': 3.4049865541242275, 'sideways_rsi_os': 51, 'sideways_rsi_ob': 88, 'sideways_adx_thresh': 27.573562242006297, 'sideways_atr_min_pct': 0.002244546475412521, 'sideways_atr_max_pct': 0.06499864853641645, 'sideways_tp_mult': 2.435471300244188, 'sideways_tsl_mult': 0.05884207988494011, 'sideways_time_stop': 141, 'sideways_use_sma': False, 'sideways_use_ema': True, 'sideways_use_atr': False, 'sideways_use_adx': False, 'sideways_use_spike': True, 'sideways_rsi_required': True}.
[I 2025-09-01 10:33:51,445] Trial 576 finished with values: [-0.25867876753044605, 0.2589710615316895] and parameters: {'p_sma': 14, 'p_std': 46, 'p_atr': 29, 'p_adx': 22, 'rsi_period': 64, 'ema1': 20, 'ema2': 56, 'slip_atr_k': 0.04326800287001976, 'slip_spread_k': 0.10956811672637001, 'spread_hl_frac': 0.02196893577372096, 'bb_std_mult': 0.5768793956944334, 'rsi_os': 19, 'rsi_ob': 51, 'vol_spike': 0.07795391416871046, 'adx_thresh': 30.257109927046265, 'atr_min_pct': 0.015547833839678156, 'atr_max_pct': 0.07909167574264964, 'tp_mult': 2.1895821885241675, 'tsl_mult': 0.037193944548560814, 'strategy': 'breakout', 'time_stop': 75, 'use_sma': True, 'use_atr': False, 'use_adx': True, 'use_ema': False, 'use_spike': False, 'rsi_required': True, 'edge_k': 0.25556180376945237, 'edge_cap': 0.45731811351848983, 'bull_strategy': 'mean_reversion', 'bull_bb_std_mult': 3.1583918485070996, 'bull_rsi_os': 25, 'bull_rsi_ob': 72, 'bull_adx_thresh': 10.257446009489986, 'bull_atr_min_pct': 0.029377000864174014, 'bull_atr_max_pct': 0.029318273753204283, 'bull_tp_mult': 1.7502262811393938, 'bull_tsl_mult': 0.6246286292774159, 'bull_time_stop': 5, 'bull_use_sma': True, 'bull_use_ema': True, 'bull_use_atr': True, 'bull_use_adx': False, 'bull_use_spike': False, 'bull_rsi_required': True, 'bear_strategy': 'mean_reversion', 'bear_bb_std_mult': 1.9180556922770313, 'bear_rsi_os': 27, 'bear_rsi_ob': 47, 'bear_adx_thresh': 12.755884695167039, 'bear_atr_min_pct': 9.015616941748794e-06, 'bear_atr_max_pct': 0.06612060265990918, 'bear_tp_mult': 1.294763872084089, 'bear_tsl_mult': 0.4299864075403039, 'bear_time_stop': 145, 'bear_use_sma': True, 'bear_use_ema': False, 'bear_use_atr': True, 'bear_use_adx': True, 'bear_use_spike': True, 'bear_rsi_required': False, 'sideways_strategy': 'breakout', 'sideways_bb_std_mult': 3.4922294146362516, 'sideways_rsi_os': 46, 'sideways_rsi_ob': 89, 'sideways_adx_thresh': 33.65492792768808, 'sideways_atr_min_pct': 0.002039276060760484, 'sideways_atr_max_pct': 0.06502770764519474, 'sideways_tp_mult': 2.474131107007369, 'sideways_tsl_mult': 0.8474404250090143, 'sideways_time_stop': 192, 'sideways_use_sma': False, 'sideways_use_ema': True, 'sideways_use_atr': False, 'sideways_use_adx': False, 'sideways_use_spike': True, 'sideways_rsi_required': True}.
[I 2025-09-01 10:33:52,520] Trial 583 finished with values: [-1000000000.0, 1000000000.0] and parameters: {'p_sma': 56, 'p_std': 21, 'p_atr': 30, 'p_adx': 24, 'rsi_period': 7, 'ema1': 12, 'ema2': 58, 'slip_atr_k': 0.09867192015076326, 'slip_spread_k': 0.15199114027809052, 'spread_hl_frac': 0.023620231921785036, 'bb_std_mult': 3.282383521000274, 'rsi_os': 29, 'rsi_ob': 48, 'vol_spike': 0.28794871873145284, 'adx_thresh': 15.573247072467426, 'atr_min_pct': 0.025258175740346035, 'atr_max_pct': 0.08840414144703224, 'tp_mult': 2.6835202918380423, 'tsl_mult': 0.05427991713399333, 'strategy': 'mean_reversion', 'time_stop': 144, 'use_sma': True, 'use_atr': False, 'use_adx': False, 'use_ema': True, 'use_spike': False, 'rsi_required': False, 'edge_k': 0.962621556247387, 'edge_cap': 0.6463105212672443, 'bull_strategy': 'mean_reversion', 'bull_bb_std_mult': 1.9020324945139278, 'bull_rsi_os': 21, 'bull_rsi_ob': 83, 'bull_adx_thresh': 6.022594148403431, 'bull_atr_min_pct': 0.02154350453774544, 'bull_atr_max_pct': 0.1453581397637823, 'bull_tp_mult': 2.335389505928857, 'bull_tsl_mult': 0.07042858447852643, 'bull_time_stop': 140, 'bull_use_sma': False, 'bull_use_ema': False, 'bull_use_atr': False, 'bull_use_adx': True, 'bull_use_spike': False, 'bull_rsi_required': False, 'bear_strategy': 'breakout', 'bear_bb_std_mult': 3.1230488243727854, 'bear_rsi_os': 16, 'bear_rsi_ob': 83, 'bear_adx_thresh': 11.32133292702943, 'bear_atr_min_pct': 0.01927717044745385, 'bear_atr_max_pct': 0.01475056380935022, 'bear_tp_mult': 1.2224304603720457, 'bear_tsl_mult': 0.7220839169417939, 'bear_time_stop': 136, 'bear_use_sma': False, 'bear_use_ema': True, 'bear_use_atr': False, 'bear_use_adx': False, 'bear_use_spike': True, 'bear_rsi_required': True, 'sideways_strategy': 'mean_reversion', 'sideways_bb_std_mult': 3.228237498337922, 'sideways_rsi_os': 15, 'sideways_rsi_ob': 47, 'sideways_adx_thresh': 19.477045912808403, 'sideways_atr_min_pct': 0.02607378611184825, 'sideways_atr_max_pct': 0.05962512749821747, 'sideways_tp_mult': 2.5575686641684134, 'sideways_tsl_mult': 0.817916014279677, 'sideways_time_stop': 11, 'sideways_use_sma': True, 'sideways_use_ema': True, 'sideways_use_atr': False, 'sideways_use_adx': False, 'sideways_use_spike': False, 'sideways_rsi_required': False}.
[I 2025-09-01 10:34:32,710] Trial 582 finished with values: [-0.0645427929699186, 0.06429673462072708] and parameters: {'p_sma': 40, 'p_std': 43, 'p_atr': 30, 'p_adx': 11, 'rsi_period': 45, 'ema1': 24, 'ema2': 50, 'slip_atr_k': 0.06340568588636951, 'slip_spread_k': 0.22819487892722723, 'spread_hl_frac': 0.023089068892827344, 'bb_std_mult': 1.9988670798931105, 'rsi_os': 35, 'rsi_ob': 48, 'vol_spike': 0.28755132315559534, 'adx_thresh': 25.629537250606376, 'atr_min_pct': 0.025065208453839572, 'atr_max_pct': 0.07155972018157035, 'tp_mult': 1.3054677590712416, 'tsl_mult': 0.3305809628195666, 'strategy': 'breakout', 'time_stop': 145, 'use_sma': True, 'use_atr': False, 'use_adx': False, 'use_ema': True, 'use_spike': False, 'rsi_required': False, 'edge_k': 0.24724303756254196, 'edge_cap': 0.6118220276788039, 'bull_strategy': 'mean_reversion', 'bull_bb_std_mult': 1.032844682124697, 'bull_rsi_os': 44, 'bull_rsi_ob': 83, 'bull_adx_thresh': 9.955090593992853, 'bull_atr_min_pct': 0.02156213937902232, 'bull_atr_max_pct': 0.08088716515486648, 'bull_tp_mult': 1.9472040741300538, 'bull_tsl_mult': 0.05478274251856299, 'bull_time_stop': 25, 'bull_use_sma': True, 'bull_use_ema': False, 'bull_use_atr': False, 'bull_use_adx': True, 'bull_use_spike': False, 'bull_rsi_required': False, 'bear_strategy': 'breakout', 'bear_bb_std_mult': 3.1243834568064695, 'bear_rsi_os': 19, 'bear_rsi_ob': 77, 'bear_adx_thresh': 11.262246684241251, 'bear_atr_min_pct': 0.005115571024819106, 'bear_atr_max_pct': 0.07205722066658997, 'bear_tp_mult': 1.399876328844942, 'bear_tsl_mult': 0.47119380090069585, 'bear_time_stop': 132, 'bear_use_sma': False, 'bear_use_ema': True, 'bear_use_atr': False, 'bear_use_adx': False, 'bear_use_spike': True, 'bear_rsi_required': False, 'sideways_strategy': 'breakout', 'sideways_bb_std_mult': 3.257821113660562, 'sideways_rsi_os': 50, 'sideways_rsi_ob': 51, 'sideways_adx_thresh': 29.14125130552643, 'sideways_atr_min_pct': 0.0028529843446316173, 'sideways_atr_max_pct': 0.010379956219153233, 'sideways_tp_mult': 2.8170766429044143, 'sideways_tsl_mult': 0.8261540130782625, 'sideways_time_stop': 202, 'sideways_use_sma': True, 'sideways_use_ema': True, 'sideways_use_atr': False, 'sideways_use_adx': False, 'sideways_use_spike': False, 'sideways_rsi_required': False}.
[I 2025-09-01 10:34:32,738] Trial 581 finished with values: [-0.03404932059870569, 0.03366479645471915] and parameters: {'p_sma': 23, 'p_std': 9, 'p_atr': 20, 'p_adx': 23, 'rsi_period': 43, 'ema1': 21, 'ema2': 56, 'slip_atr_k': 0.0520615024919545, 'slip_spread_k': 0.9184232508681122, 'spread_hl_frac': 0.02295196850382676, 'bb_std_mult': 1.2777272589962423, 'rsi_os': 29, 'rsi_ob': 76, 'vol_spike': 0.29066223785389883, 'adx_thresh': 15.857281492396858, 'atr_min_pct': 0.024928073022998272, 'atr_max_pct': 0.10536447087334826, 'tp_mult': 2.827089882282762, 'tsl_mult': 0.7375359387932743, 'strategy': 'breakout', 'time_stop': 151, 'use_sma': True, 'use_atr': False, 'use_adx': True, 'use_ema': True, 'use_spike': False, 'rsi_required': False, 'edge_k': 1.2262836855647288, 'edge_cap': 0.6116436865853875, 'bull_strategy': 'mean_reversion', 'bull_bb_std_mult': 1.71145831750661, 'bull_rsi_os': 15, 'bull_rsi_ob': 72, 'bull_adx_thresh': 6.143996169700367, 'bull_atr_min_pct': 0.004716056908640636, 'bull_atr_max_pct': 0.1488088941866058, 'bull_tp_mult': 1.744136409863087, 'bull_tsl_mult': 0.4812139612721507, 'bull_time_stop': 160, 'bull_use_sma': True, 'bull_use_ema': False, 'bull_use_atr': True, 'bull_use_adx': True, 'bull_use_spike': False, 'bull_rsi_required': False, 'bear_strategy': 'breakout', 'bear_bb_std_mult': 2.9069047511587973, 'bear_rsi_os': 45, 'bear_rsi_ob': 85, 'bear_adx_thresh': 9.529806507529784, 'bear_atr_min_pct': 0.023068098111824642, 'bear_atr_max_pct': 0.07089184924824278, 'bear_tp_mult': 1.2230178309975213, 'bear_tsl_mult': 0.7208780501119644, 'bear_time_stop': 49, 'bear_use_sma': False, 'bear_use_ema': True, 'bear_use_atr': True, 'bear_use_adx': False, 'bear_use_spike': True, 'bear_rsi_required': False, 'sideways_strategy': 'breakout', 'sideways_bb_std_mult': 3.257980067730495, 'sideways_rsi_os': 52, 'sideways_rsi_ob': 51, 'sideways_adx_thresh': 27.57936857125415, 'sideways_atr_min_pct': 0.026335943769060368, 'sideways_atr_max_pct': 0.07388690418298136, 'sideways_tp_mult': 2.8189960507808856, 'sideways_tsl_mult': 0.8202218184846638, 'sideways_time_stop': 111, 'sideways_use_sma': True, 'sideways_use_ema': True, 'sideways_use_atr': False, 'sideways_use_adx': False, 'sideways_use_spike': False, 'sideways_rsi_required': False}.
[I 2025-09-01 10:34:33,002] Trial 584 finished with values: [-1000000000.0, 1000000000.0] and parameters: {'p_sma': 5, 'p_std': 17, 'p_atr': 27, 'p_adx': 23, 'rsi_period': 70, 'ema1': 14, 'ema2': 49, 'slip_atr_k': 0.05296480555529556, 'slip_spread_k': 0.9165567539284543, 'spread_hl_frac': 0.009738579863012565, 'bb_std_mult': 3.180996146282468, 'rsi_os': 35, 'rsi_ob': 76, 'vol_spike': 0.2918137839884446, 'adx_thresh': 7.5176524829788605, 'atr_min_pct': 0.023407096274432233, 'atr_max_pct': 0.07183574137154376, 'tp_mult': 2.836253478280419, 'tsl_mult': 0.0016013088820338514, 'strategy': 'breakout', 'time_stop': 42, 'use_sma': False, 'use_atr': False, 'use_adx': True, 'use_ema': True, 'use_spike': True, 'rsi_required': False, 'edge_k': 0.9255735315154153, 'edge_cap': 0.6153198889661375, 'bull_strategy': 'mean_reversion', 'bull_bb_std_mult': 1.020217057609473, 'bull_rsi_os': 44, 'bull_rsi_ob': 54, 'bull_adx_thresh': 14.782131690516625, 'bull_atr_min_pct': 0.0035594146821213805, 'bull_atr_max_pct': 0.08273920755761284, 'bull_tp_mult': 2.747203352143785, 'bull_tsl_mult': 0.05022998161500991, 'bull_time_stop': 156, 'bull_use_sma': True, 'bull_use_ema': False, 'bull_use_atr': True, 'bull_use_adx': True, 'bull_use_spike': False, 'bull_rsi_required': False, 'bear_strategy': 'breakout', 'bear_bb_std_mult': 3.4616582618970013, 'bear_rsi_os': 49, 'bear_rsi_ob': 72, 'bear_adx_thresh': 14.434072200886508, 'bear_atr_min_pct': 0.018313364564194332, 'bear_atr_max_pct': 0.07181113140283898, 'bear_tp_mult': 1.133916817998897, 'bear_tsl_mult': 0.4605472390650027, 'bear_time_stop': 95, 'bear_use_sma': False, 'bear_use_ema': True, 'bear_use_atr': True, 'bear_use_adx': False, 'bear_use_spike': True, 'bear_rsi_required': False, 'sideways_strategy': 'breakout', 'sideways_bb_std_mult': 3.3475058588705933, 'sideways_rsi_os': 50, 'sideways_rsi_ob': 49, 'sideways_adx_thresh': 29.469511477944113, 'sideways_atr_min_pct': 0.01079899878591938, 'sideways_atr_max_pct': 0.07224651854388343, 'sideways_tp_mult': 1.6396021276465096, 'sideways_tsl_mult': 0.46183778287264754, 'sideways_time_stop': 204, 'sideways_use_sma': True, 'sideways_use_ema': False, 'sideways_use_atr': False, 'sideways_use_adx': False, 'sideways_use_spike': False, 'sideways_rsi_required': False}.
[I 2025-09-01 10:34:33,204] Trial 580 finished with values: [-1000000000.0, 1000000000.0] and parameters: {'p_sma': 39, 'p_std': 53, 'p_atr': 29, 'p_adx': 22, 'rsi_period': 7, 'ema1': 20, 'ema2': 50, 'slip_atr_k': 0.09254336464112, 'slip_spread_k': 0.10793990210600996, 'spread_hl_frac': 0.027618443287913436, 'bb_std_mult': 3.0895383162192003, 'rsi_os': 18, 'rsi_ob': 79, 'vol_spike': 0.28713528218976353, 'adx_thresh': 30.22798385968837, 'atr_min_pct': 0.02481301625270444, 'atr_max_pct': 0.07808948034339046, 'tp_mult': 2.659653775725734, 'tsl_mult': 0.0009961672579113512, 'strategy': 'breakout', 'time_stop': 160, 'use_sma': True, 'use_atr': False, 'use_adx': True, 'use_ema': True, 'use_spike': False, 'rsi_required': False, 'edge_k': 0.21189893332824716, 'edge_cap': 0.4340914612107659, 'bull_strategy': 'mean_reversion', 'bull_bb_std_mult': 1.9025076265900713, 'bull_rsi_os': 44, 'bull_rsi_ob': 45, 'bull_adx_thresh': 10.431131833597028, 'bull_atr_min_pct': 0.02944382626381699, 'bull_atr_max_pct': 0.03193026247126431, 'bull_tp_mult': 1.5794487861209676, 'bull_tsl_mult': 0.0018772267445835572, 'bull_time_stop': 26, 'bull_use_sma': True, 'bull_use_ema': False, 'bull_use_atr': True, 'bull_use_adx': True, 'bull_use_spike': False, 'bull_rsi_required': True, 'bear_strategy': 'breakout', 'bear_bb_std_mult': 1.6725383913456116, 'bear_rsi_os': 28, 'bear_rsi_ob': 45, 'bear_adx_thresh': 34.02955351946631, 'bear_atr_min_pct': 0.004993870780544536, 'bear_atr_max_pct': 0.07184865094092426, 'bear_tp_mult': 1.2223494915907904, 'bear_tsl_mult': 0.45872076432859793, 'bear_time_stop': 125, 'bear_use_sma': False, 'bear_use_ema': True, 'bear_use_atr': True, 'bear_use_adx': False, 'bear_use_spike': True, 'bear_rsi_required': False, 'sideways_strategy': 'breakout', 'sideways_bb_std_mult': 3.231596682516462, 'sideways_rsi_os': 7, 'sideways_rsi_ob': 51, 'sideways_adx_thresh': 27.330062485671917, 'sideways_atr_min_pct': 0.01095936149324591, 'sideways_atr_max_pct': 0.05888239483278618, 'sideways_tp_mult': 1.2660905901724988, 'sideways_tsl_mult': 0.22537097337350243, 'sideways_time_stop': 204, 'sideways_use_sma': True, 'sideways_use_ema': True, 'sideways_use_atr': False, 'sideways_use_adx': False, 'sideways_use_spike': False, 'sideways_rsi_required': False}.
