[I 2025-09-01 09:57:54,119] Trial 360 finished with values: [-1000000000.0, 1000000000.0] and parameters: {'p_sma': 21, 'p_std': 55, 'p_atr': 27, 'p_adx': 22, 'rsi_period': 22, 'ema1': 10, 'ema2': 51, 'slip_atr_k': 0.046863333864929205, 'slip_spread_k': 0.14066228329682418, 'spread_hl_frac': 0.04003299705597575, 'bb_std_mult': 3.0511890369183097, 'rsi_os': 18, 'rsi_ob': 62, 'vol_spike': 0.1848534035949464, 'adx_thresh': 5.600346918275093, 'atr_min_pct': 0.014194260828004047, 'atr_max_pct': 0.0794963923855411, 'tp_mult': 2.5872517272785562, 'tsl_mult': 0.12092232018763832, 'strategy': 'mean_reversion', 'time_stop': 81, 'use_sma': False, 'use_atr': True, 'use_adx': False, 'use_ema': True, 'use_spike': False, 'rsi_required': True, 'edge_k': 0.8391762546364323, 'edge_cap': 0.3629514041684542, 'bull_strategy': 'breakout', 'bull_bb_std_mult': 0.8044219460066314, 'bull_rsi_os': 48, 'bull_rsi_ob': 89, 'bull_adx_thresh': 23.373814045513686, 'bull_atr_min_pct': 0.008225931021805796, 'bull_atr_max_pct': 0.017895801768147507, 'bull_tp_mult': 1.9956428312769405, 'bull_tsl_mult': 0.05747247736815032, 'bull_time_stop': 242, 'bull_use_sma': False, 'bull_use_ema': True, 'bull_use_atr': True, 'bull_use_adx': True, 'bull_use_spike': False, 'bull_rsi_required': False, 'bear_strategy': 'mean_reversion', 'bear_bb_std_mult': 1.2293564690498466, 'bear_rsi_os': 48, 'bear_rsi_ob': 47, 'bear_adx_thresh': 34.059853721302474, 'bear_atr_min_pct': 0.016731818089146432, 'bear_atr_max_pct': 0.06903011102064596, 'bear_tp_mult': 1.3130973056686397, 'bear_tsl_mult': 0.46685616377302125, 'bear_time_stop': 144, 'bear_use_sma': True, 'bear_use_ema': False, 'bear_use_atr': False, 'bear_use_adx': False, 'bear_use_spike': True, 'bear_rsi_required': False, 'sideways_strategy': 'breakout', 'sideways_bb_std_mult': 2.825944993087124, 'sideways_rsi_os': 26, 'sideways_rsi_ob': 49, 'sideways_adx_thresh': 27.946154926744406, 'sideways_atr_min_pct': 0.020427590382536144, 'sideways_atr_max_pct': 0.07020782060178689, 'sideways_tp_mult': 2.2119482111210527, 'sideways_tsl_mult': 0.847352664247256, 'sideways_time_stop': 5, 'sideways_use_sma': True, 'sideways_use_ema': True, 'sideways_use_atr': True, 'sideways_use_adx': True, 'sideways_use_spike': True, 'sideways_rsi_required': True}.
[I 2025-09-01 09:57:54,728] Trial 362 finished with values: [-0.17239572896049826, 0.17192485350672598] and parameters: {'p_sma': 34, 'p_std': 8, 'p_atr': 25, 'p_adx': 22, 'rsi_period': 39, 'ema1': 21, 'ema2': 46, 'slip_atr_k': 0.16882552773771559, 'slip_spread_k': 0.1726171851941202, 'spread_hl_frac': 0.0013727419884782092, 'bb_std_mult': 3.0488986622268994, 'rsi_os': 42, 'rsi_ob': 78, 'vol_spike': 0.28256671124005134, 'adx_thresh': 5.702462285810653, 'atr_min_pct': 0.006670840970092367, 'atr_max_pct': 0.07982305673083324, 'tp_mult': 2.811654283902988, 'tsl_mult': 0.8340915459650593, 'strategy': 'breakout', 'time_stop': 159, 'use_sma': True, 'use_atr': True, 'use_adx': False, 'use_ema': False, 'use_spike': True, 'rsi_required': True, 'edge_k': 0.9271571728913137, 'edge_cap': 0.45627940705518494, 'bull_strategy': 'breakout', 'bull_bb_std_mult': 2.5977039209081414, 'bull_rsi_os': 10, 'bull_rsi_ob': 89, 'bull_adx_thresh': 31.882304040669098, 'bull_atr_min_pct': 0.0299853621826796, 'bull_atr_max_pct': 0.08734400853931053, 'bull_tp_mult': 2.9022441992073444, 'bull_tsl_mult': 0.04953830306194207, 'bull_time_stop': 265, 'bull_use_sma': True, 'bull_use_ema': True, 'bull_use_atr': True, 'bull_use_adx': True, 'bull_use_spike': False, 'bull_rsi_required': True, 'bear_strategy': 'breakout', 'bear_bb_std_mult': 3.424833772595936, 'bear_rsi_os': 33, 'bear_rsi_ob': 90, 'bear_adx_thresh': 18.18727522324415, 'bear_atr_min_pct': 4.721485821621539e-05, 'bear_atr_max_pct': 0.07265560283666668, 'bear_tp_mult': 1.239414401104429, 'bear_tsl_mult': 0.4352716693655686, 'bear_time_stop': 134, 'bear_use_sma': True, 'bear_use_ema': False, 'bear_use_atr': False, 'bear_use_adx': False, 'bear_use_spike': True, 'bear_rsi_required': True, 'sideways_strategy': 'mean_reversion', 'sideways_bb_std_mult': 2.313558611863222, 'sideways_rsi_os': 54, 'sideways_rsi_ob': 88, 'sideways_adx_thresh': 17.72294130918169, 'sideways_atr_min_pct': 0.003340492400891372, 'sideways_atr_max_pct': 0.09907706876962571, 'sideways_tp_mult': 1.4078443293685359, 'sideways_tsl_mult': 0.8366412128785358, 'sideways_time_stop': 190, 'sideways_use_sma': False, 'sideways_use_ema': True, 'sideways_use_atr': False, 'sideways_use_adx': True, 'sideways_use_spike': True, 'sideways_rsi_required': True}.
[I 2025-09-01 09:57:54,728] Trial 361 finished with values: [-0.09667934504335896, 0.09683936486434776] and parameters: {'p_sma': 44, 'p_std': 56, 'p_atr': 21, 'p_adx': 9, 'rsi_period': 40, 'ema1': 8, 'ema2': 56, 'slip_atr_k': 0.04626616372384061, 'slip_spread_k': 0.16801547009809037, 'spread_hl_frac': 0.001353788386294734, 'bb_std_mult': 2.634224246132522, 'rsi_os': 42, 'rsi_ob': 65, 'vol_spike': 0.022234024908000943, 'adx_thresh': 5.571458113260098, 'atr_min_pct': 0.02381675428040696, 'atr_max_pct': 0.08010545709152839, 'tp_mult': 2.0575402513206607, 'tsl_mult': 0.044745850371391956, 'strategy': 'breakout', 'time_stop': 85, 'use_sma': True, 'use_atr': True, 'use_adx': False, 'use_ema': False, 'use_spike': True, 'rsi_required': True, 'edge_k': 0.9245364889755258, 'edge_cap': 0.353670844261055, 'bull_strategy': 'breakout', 'bull_bb_std_mult': 2.8439950659349664, 'bull_rsi_os': 11, 'bull_rsi_ob': 91, 'bull_adx_thresh': 22.331102472144547, 'bull_atr_min_pct': 0.029985605405299164, 'bull_atr_max_pct': 0.017438867728707508, 'bull_tp_mult': 1.6994767422582204, 'bull_tsl_mult': 0.5078160192396615, 'bull_time_stop': 162, 'bull_use_sma': True, 'bull_use_ema': True, 'bull_use_atr': True, 'bull_use_adx': True, 'bull_use_spike': False, 'bull_rsi_required': True, 'bear_strategy': 'breakout', 'bear_bb_std_mult': 3.100726611579544, 'bear_rsi_os': 33, 'bear_rsi_ob': 90, 'bear_adx_thresh': 5.593891235651228, 'bear_atr_min_pct': 7.975958675363569e-05, 'bear_atr_max_pct': 0.083977923686782, 'bear_tp_mult': 1.2274024747669896, 'bear_tsl_mult': 0.6779924187583608, 'bear_time_stop': 134, 'bear_use_sma': True, 'bear_use_ema': False, 'bear_use_atr': False, 'bear_use_adx': False, 'bear_use_spike': True, 'bear_rsi_required': True, 'sideways_strategy': 'mean_reversion', 'sideways_bb_std_mult': 2.263293957053246, 'sideways_rsi_os': 22, 'sideways_rsi_ob': 49, 'sideways_adx_thresh': 27.924332252069767, 'sideways_atr_min_pct': 0.013111894878557906, 'sideways_atr_max_pct': 0.10493658098651663, 'sideways_tp_mult': 1.5267831942205694, 'sideways_tsl_mult': 0.835684380655039, 'sideways_time_stop': 271, 'sideways_use_sma': False, 'sideways_use_ema': True, 'sideways_use_atr': False, 'sideways_use_adx': True, 'sideways_use_spike': True, 'sideways_rsi_required': True}.
[I 2025-09-01 09:58:37,600] Trial 364 finished with values: [-1000000000.0, 1000000000.0] and parameters: {'p_sma': 44, 'p_std': 35, 'p_atr': 22, 'p_adx': 9, 'rsi_period': 40, 'ema1': 8, 'ema2': 56, 'slip_atr_k': 0.04985262118692785, 'slip_spread_k': 0.18462297669868033, 'spread_hl_frac': 0.001622798273817113, 'bb_std_mult': 3.1604765850278183, 'rsi_os': 25, 'rsi_ob': 78, 'vol_spike': 0.006965864261238491, 'adx_thresh': 14.887567746596872, 'atr_min_pct': 0.002611458226522716, 'atr_max_pct': 0.07201905692835937, 'tp_mult': 2.995903909035808, 'tsl_mult': 0.7262235229437871, 'strategy': 'breakout', 'time_stop': 151, 'use_sma': True, 'use_atr': True, 'use_adx': False, 'use_ema': False, 'use_spike': True, 'rsi_required': False, 'edge_k': 0.9421402447945936, 'edge_cap': 0.6003187698323967, 'bull_strategy': 'mean_reversion', 'bull_bb_std_mult': 2.8325956087998456, 'bull_rsi_os': 10, 'bull_rsi_ob': 54, 'bull_adx_thresh': 32.56925900650132, 'bull_atr_min_pct': 0.029391132665251896, 'bull_atr_max_pct': 0.12399704701729164, 'bull_tp_mult': 1.8871208796357035, 'bull_tsl_mult': 0.029665226828916355, 'bull_time_stop': 161, 'bull_use_sma': True, 'bull_use_ema': False, 'bull_use_atr': True, 'bull_use_adx': True, 'bull_use_spike': False, 'bull_rsi_required': True, 'bear_strategy': 'breakout', 'bear_bb_std_mult': 3.0986390589686215, 'bear_rsi_os': 33, 'bear_rsi_ob': 90, 'bear_adx_thresh': 5.584760547745587, 'bear_atr_min_pct': 0.023177009000954794, 'bear_atr_max_pct': 0.07307793563540005, 'bear_tp_mult': 1.2329759881950257, 'bear_tsl_mult': 0.9658972255812717, 'bear_time_stop': 133, 'bear_use_sma': False, 'bear_use_ema': True, 'bear_use_atr': False, 'bear_use_adx': True, 'bear_use_spike': True, 'bear_rsi_required': True, 'sideways_strategy': 'mean_reversion', 'sideways_bb_std_mult': 3.239671863008452, 'sideways_rsi_os': 49, 'sideways_rsi_ob': 51, 'sideways_adx_thresh': 26.671152412185542, 'sideways_atr_min_pct': 0.025472171485605564, 'sideways_atr_max_pct': 0.09332908380915818, 'sideways_tp_mult': 1.5313328425550423, 'sideways_tsl_mult': 0.8373190595984265, 'sideways_time_stop': 299, 'sideways_use_sma': False, 'sideways_use_ema': True, 'sideways_use_atr': False, 'sideways_use_adx': True, 'sideways_use_spike': False, 'sideways_rsi_required': False}.
[I 2025-09-01 09:58:37,671] Trial 365 finished with values: [-0.2354005431934425, 0.23520689187619043] and parameters: {'p_sma': 16, 'p_std': 46, 'p_atr': 26, 'p_adx': 26, 'rsi_period': 65, 'ema1': 24, 'ema2': 51, 'slip_atr_k': 0.050303465396154705, 'slip_spread_k': 0.01956986703799507, 'spread_hl_frac': 0.01887654131802841, 'bb_std_mult': 3.1850791448044373, 'rsi_os': 25, 'rsi_ob': 81, 'vol_spike': 0.12272717643104473, 'adx_thresh': 27.78479062330978, 'atr_min_pct': 9.027526559014787e-05, 'atr_max_pct': 0.0869749783947234, 'tp_mult': 2.714497940653241, 'tsl_mult': 0.931934868978471, 'strategy': 'breakout', 'time_stop': 148, 'use_sma': True, 'use_atr': False, 'use_adx': True, 'use_ema': False, 'use_spike': False, 'rsi_required': False, 'edge_k': 0.23360163568345838, 'edge_cap': 0.22377831325649994, 'bull_strategy': 'mean_reversion', 'bull_bb_std_mult': 1.0366255273763663, 'bull_rsi_os': 45, 'bull_rsi_ob': 54, 'bull_adx_thresh': 6.052088662054231, 'bull_atr_min_pct': 0.0293670104603718, 'bull_atr_max_pct': 0.13378161259860283, 'bull_tp_mult': 1.8891310023651886, 'bull_tsl_mult': 0.99236344569929, 'bull_time_stop': 146, 'bull_use_sma': True, 'bull_use_ema': False, 'bull_use_atr': True, 'bull_use_adx': True, 'bull_use_spike': False, 'bull_rsi_required': True, 'bear_strategy': 'mean_reversion', 'bear_bb_std_mult': 2.0984478675340665, 'bear_rsi_os': 47, 'bear_rsi_ob': 45, 'bear_adx_thresh': 5.025684352354045, 'bear_atr_min_pct': 0.01830096288641917, 'bear_atr_max_pct': 0.02486521624466869, 'bear_tp_mult': 1.1540920112010398, 'bear_tsl_mult': 0.4865734376922032, 'bear_time_stop': 140, 'bear_use_sma': False, 'bear_use_ema': True, 'bear_use_atr': True, 'bear_use_adx': True, 'bear_use_spike': True, 'bear_rsi_required': False, 'sideways_strategy': 'breakout', 'sideways_bb_std_mult': 3.2043493275702692, 'sideways_rsi_os': 49, 'sideways_rsi_ob': 82, 'sideways_adx_thresh': 14.715871356420209, 'sideways_atr_min_pct': 0.0012542586801662613, 'sideways_atr_max_pct': 0.09385215355362281, 'sideways_tp_mult': 1.389376835284719, 'sideways_tsl_mult': 0.7780290482216343, 'sideways_time_stop': 101, 'sideways_use_sma': False, 'sideways_use_ema': True, 'sideways_use_atr': False, 'sideways_use_adx': False, 'sideways_use_spike': False, 'sideways_rsi_required': False}.
[I 2025-09-01 09:58:38,391] Trial 366 finished with values: [-1000000000.0, 1000000000.0] and parameters: {'p_sma': 23, 'p_std': 35, 'p_atr': 12, 'p_adx': 21, 'rsi_period': 65, 'ema1': 15, 'ema2': 51, 'slip_atr_k': 0.05669102909133844, 'slip_spread_k': 0.025544258993053626, 'spread_hl_frac': 0.03363058501183144, 'bb_std_mult': 2.24174610184522, 'rsi_os': 25, 'rsi_ob': 58, 'vol_spike': 0.07961815524599035, 'adx_thresh': 6.4884035866933285, 'atr_min_pct': 0.012638823814610303, 'atr_max_pct': 0.07328534152407337, 'tp_mult': 1.223913605825604, 'tsl_mult': 0.7299916678716656, 'strategy': 'breakout', 'time_stop': 106, 'use_sma': True, 'use_atr': False, 'use_adx': True, 'use_ema': False, 'use_spike': False, 'rsi_required': False, 'edge_k': 0.9699006993603515, 'edge_cap': 0.6080606648892505, 'bull_strategy': 'mean_reversion', 'bull_bb_std_mult': 2.1582823190613865, 'bull_rsi_os': 31, 'bull_rsi_ob': 86, 'bull_adx_thresh': 6.158408365581661, 'bull_atr_min_pct': 0.029492199687193726, 'bull_atr_max_pct': 0.09233247453455327, 'bull_tp_mult': 1.884333809166847, 'bull_tsl_mult': 9.518833943607252e-05, 'bull_time_stop': 13, 'bull_use_sma': True, 'bull_use_ema': False, 'bull_use_atr': True, 'bull_use_adx': True, 'bull_use_spike': False, 'bull_rsi_required': True, 'bear_strategy': 'mean_reversion', 'bear_bb_std_mult': 2.73067506741913, 'bear_rsi_os': 46, 'bear_rsi_ob': 45, 'bear_adx_thresh': 29.704312251064536, 'bear_atr_min_pct': 0.0029105120281669207, 'bear_atr_max_pct': 0.09183374799169071, 'bear_tp_mult': 1.415073500896439, 'bear_tsl_mult': 0.10463791934295402, 'bear_time_stop': 149, 'bear_use_sma': False, 'bear_use_ema': True, 'bear_use_atr': True, 'bear_use_adx': True, 'bear_use_spike': True, 'bear_rsi_required': False, 'sideways_strategy': 'breakout', 'sideways_bb_std_mult': 3.194859736644063, 'sideways_rsi_os': 12, 'sideways_rsi_ob': 90, 'sideways_adx_thresh': 26.916971395886204, 'sideways_atr_min_pct': 0.025210516126618523, 'sideways_atr_max_pct': 0.06915077899519192, 'sideways_tp_mult': 1.3843127111331868, 'sideways_tsl_mult': 0.3820817708145616, 'sideways_time_stop': 199, 'sideways_use_sma': False, 'sideways_use_ema': True, 'sideways_use_atr': False, 'sideways_use_adx': False, 'sideways_use_spike': False, 'sideways_rsi_required': False}.
[I 2025-09-01 09:58:39,091] Trial 363 finished with values: [-0.10810442154740718, 0.108766814065748] and parameters: {'p_sma': 36, 'p_std': 56, 'p_atr': 21, 'p_adx': 21, 'rsi_period': 28, 'ema1': 17, 'ema2': 54, 'slip_atr_k': 0.04924300477715478, 'slip_spread_k': 0.0015990303409446627, 'spread_hl_frac': 0.0024830284553460126, 'bb_std_mult': 3.027574820652797, 'rsi_os': 42, 'rsi_ob': 78, 'vol_spike': 0.007574690687739999, 'adx_thresh': 5.491817917461459, 'atr_min_pct': 0.023824076979477336, 'atr_max_pct': 0.073230708254099, 'tp_mult': 2.7259453387626684, 'tsl_mult': 0.9302830737193568, 'strategy': 'breakout', 'time_stop': 86, 'use_sma': True, 'use_atr': True, 'use_adx': False, 'use_ema': False, 'use_spike': True, 'rsi_required': True, 'edge_k': 0.9204756205834697, 'edge_cap': 0.3471499241150714, 'bull_strategy': 'breakout', 'bull_bb_std_mult': 2.801531181910704, 'bull_rsi_os': 47, 'bull_rsi_ob': 89, 'bull_adx_thresh': 14.18468864854873, 'bull_atr_min_pct': 0.02222840140172931, 'bull_atr_max_pct': 0.016924850928475232, 'bull_tp_mult': 1.9948573098184814, 'bull_tsl_mult': 0.5172274658843273, 'bull_time_stop': 162, 'bull_use_sma': True, 'bull_use_ema': True, 'bull_use_atr': True, 'bull_use_adx': True, 'bull_use_spike': False, 'bull_rsi_required': True, 'bear_strategy': 'breakout', 'bear_bb_std_mult': 3.1965419663549373, 'bear_rsi_os': 48, 'bear_rsi_ob': 94, 'bear_adx_thresh': 34.213199160614, 'bear_atr_min_pct': 0.0027786713955820167, 'bear_atr_max_pct': 0.07428351208423979, 'bear_tp_mult': 1.5611602423764501, 'bear_tsl_mult': 0.6717791165575561, 'bear_time_stop': 133, 'bear_use_sma': True, 'bear_use_ema': False, 'bear_use_atr': False, 'bear_use_adx': True, 'bear_use_spike': True, 'bear_rsi_required': True, 'sideways_strategy': 'mean_reversion', 'sideways_bb_std_mult': 3.591063489005969, 'sideways_rsi_os': 51, 'sideways_rsi_ob': 49, 'sideways_adx_thresh': 15.3620400440382, 'sideways_atr_min_pct': 0.027021811452383748, 'sideways_atr_max_pct': 0.1028234410061537, 'sideways_tp_mult': 1.4070294391105094, 'sideways_tsl_mult': 0.8322679518968928, 'sideways_time_stop': 300, 'sideways_use_sma': False, 'sideways_use_ema': True, 'sideways_use_atr': False, 'sideways_use_adx': True, 'sideways_use_spike': True, 'sideways_rsi_required': True}.
[I 2025-09-01 09:59:17,092] Trial 370 finished with values: [-1000000000.0, 1000000000.0] and parameters: {'p_sma': 54, 'p_std': 50, 'p_atr': 10, 'p_adx': 24, 'rsi_period': 73, 'ema1': 5, 'ema2': 48, 'slip_atr_k': 0.10118705197447822, 'slip_spread_k': 0.14162197381137262, 'spread_hl_frac': 0.027446281936557602, 'bb_std_mult': 2.843192188777694, 'rsi_os': 28, 'rsi_ob': 77, 'vol_spike': 0.2682834624541497, 'adx_thresh': 13.105218192859944, 'atr_min_pct': 0.008314901104316107, 'atr_max_pct': 0.0814733500219882, 'tp_mult': 1.4850093076140605, 'tsl_mult': 0.05227007073404155, 'strategy': 'breakout', 'time_stop': 154, 'use_sma': True, 'use_atr': False, 'use_adx': True, 'use_ema': False, 'use_spike': False, 'rsi_required': False, 'edge_k': 0.5108758591628383, 'edge_cap': 0.576914965619957, 'bull_strategy': 'mean_reversion', 'bull_bb_std_mult': 2.3304524017632575, 'bull_rsi_os': 36, 'bull_rsi_ob': 68, 'bull_adx_thresh': 25.76259906654152, 'bull_atr_min_pct': 0.029332312306667708, 'bull_atr_max_pct': 0.09879876055486343, 'bull_tp_mult': 1.0958742420249947, 'bull_tsl_mult': 0.4780052161989272, 'bull_time_stop': 146, 'bull_use_sma': True, 'bull_use_ema': False, 'bull_use_atr': True, 'bull_use_adx': True, 'bull_use_spike': False, 'bull_rsi_required': True, 'bear_strategy': 'mean_reversion', 'bear_bb_std_mult': 0.6956460933600552, 'bear_rsi_os': 9, 'bear_rsi_ob': 85, 'bear_adx_thresh': 10.845926932967519, 'bear_atr_min_pct': 0.017389079563826546, 'bear_atr_max_pct': 0.14540915991825887, 'bear_tp_mult': 1.2721210909717167, 'bear_tsl_mult': 0.27735257196105656, 'bear_time_stop': 65, 'bear_use_sma': False, 'bear_use_ema': True, 'bear_use_atr': True, 'bear_use_adx': False, 'bear_use_spike': True, 'bear_rsi_required': False, 'sideways_strategy': 'breakout', 'sideways_bb_std_mult': 2.5488385206705324, 'sideways_rsi_os': 30, 'sideways_rsi_ob': 54, 'sideways_adx_thresh': 27.213523722710534, 'sideways_atr_min_pct': 0.0032997956701625087, 'sideways_atr_max_pct': 0.0755922070288972, 'sideways_tp_mult': 1.2892849685309653, 'sideways_tsl_mult': 0.5288961258027254, 'sideways_time_stop': 253, 'sideways_use_sma': False, 'sideways_use_ema': True, 'sideways_use_atr': False, 'sideways_use_adx': False, 'sideways_use_spike': False, 'sideways_rsi_required': False}.
[I 2025-09-01 09:59:17,670] Trial 368 finished with values: [-0.21125125803764855, 0.2108794922184505] and parameters: {'p_sma': 36, 'p_std': 13, 'p_atr': 10, 'p_adx': 21, 'rsi_period': 34, 'ema1': 21, 'ema2': 48, 'slip_atr_k': 0.14378691996031806, 'slip_spread_k': 0.8362765862559085, 'spread_hl_frac': 0.027555309562509643, 'bb_std_mult': 3.2921913466346133, 'rsi_os': 52, 'rsi_ob': 72, 'vol_spike': 0.07492919937210617, 'adx_thresh': 6.353964252823179, 'atr_min_pct': 0.012581951008100698, 'atr_max_pct': 0.07390713606734345, 'tp_mult': 1.4788033821583184, 'tsl_mult': 0.04575640352479213, 'strategy': 'breakout', 'time_stop': 154, 'use_sma': True, 'use_atr': False, 'use_adx': True, 'use_ema': False, 'use_spike': False, 'rsi_required': False, 'edge_k': 0.9911172594304711, 'edge_cap': 0.258264026194507, 'bull_strategy': 'mean_reversion', 'bull_bb_std_mult': 2.1078630408145598, 'bull_rsi_os': 36, 'bull_rsi_ob': 52, 'bull_adx_thresh': 5.451790032302293, 'bull_atr_min_pct': 0.004196136402144878, 'bull_atr_max_pct': 0.08837997830399305, 'bull_tp_mult': 1.1655233066065755, 'bull_tsl_mult': 0.48696635822203127, 'bull_time_stop': 68, 'bull_use_sma': True, 'bull_use_ema': False, 'bull_use_atr': True, 'bull_use_adx': True, 'bull_use_spike': False, 'bull_rsi_required': True, 'bear_strategy': 'mean_reversion', 'bear_bb_std_mult': 2.7241581765377583, 'bear_rsi_os': 24, 'bear_rsi_ob': 81, 'bear_adx_thresh': 12.240568106299733, 'bear_atr_min_pct': 0.017376365989884537, 'bear_atr_max_pct': 0.06672053769533771, 'bear_tp_mult': 1.5675957715636533, 'bear_tsl_mult': 0.4325699353400716, 'bear_time_stop': 149, 'bear_use_sma': False, 'bear_use_ema': True, 'bear_use_atr': True, 'bear_use_adx': False, 'bear_use_spike': True, 'bear_rsi_required': False, 'sideways_strategy': 'breakout', 'sideways_bb_std_mult': 3.3980358280917793, 'sideways_rsi_os': 51, 'sideways_rsi_ob': 50, 'sideways_adx_thresh': 12.011494504064922, 'sideways_atr_min_pct': 0.003202179615732505, 'sideways_atr_max_pct': 0.07027789574189977, 'sideways_tp_mult': 1.2888765651024772, 'sideways_tsl_mult': 0.2493097215124515, 'sideways_time_stop': 199, 'sideways_use_sma': False, 'sideways_use_ema': True, 'sideways_use_atr': False, 'sideways_use_adx': False, 'sideways_use_spike': False, 'sideways_rsi_required': False}.
