[I 2025-09-01 09:22:29,356] Trial 156 finished with values: [-1000000000.0, 1000000000.0] and parameters: {'p_sma': 26, 'p_std': 27, 'p_atr': 24, 'p_adx': 28, 'rsi_period': 28, 'ema1': 11, 'ema2': 51, 'slip_atr_k': 0.050999595846139285, 'slip_spread_k': 0.33325062303402425, 'spread_hl_frac': 0.012513006231022977, 'bb_std_mult': 1.7830429152128093, 'rsi_os': 13, 'rsi_ob': 63, 'vol_spike': 0.2264136510156733, 'adx_thresh': 12.407178038556829, 'atr_min_pct': 0.02049099495229405, 'atr_max_pct': 0.01812928957704186, 'tp_mult': 1.7707908399297654, 'tsl_mult': 0.4592142133701722, 'strategy': 'breakout', 'time_stop': 213, 'use_sma': True, 'use_atr': True, 'use_adx': True, 'use_ema': False, 'use_spike': False, 'rsi_required': False, 'edge_k': 1.1736188166516068, 'edge_cap': 0.2771795905192005, 'bull_strategy': 'mean_reversion', 'bull_bb_std_mult': 0.5045829666184876, 'bull_rsi_os': 29, 'bull_rsi_ob': 49, 'bull_adx_thresh': 9.378124040248409, 'bull_atr_min_pct': 0.029981921414040356, 'bull_atr_max_pct': 0.13615078288756893, 'bull_tp_mult': 2.087690079616288, 'bull_tsl_mult': 0.0522303516948531, 'bull_time_stop': 122, 'bull_use_sma': True, 'bull_use_ema': False, 'bull_use_atr': False, 'bull_use_adx': False, 'bull_use_spike': False, 'bull_rsi_required': True, 'bear_strategy': 'mean_reversion', 'bear_bb_std_mult': 3.4434363273395214, 'bear_rsi_os': 46, 'bear_rsi_ob': 92, 'bear_adx_thresh': 11.8582488244341, 'bear_atr_min_pct': 0.022927274999961673, 'bear_atr_max_pct': 0.12044418012606845, 'bear_tp_mult': 2.1213133410857887, 'bear_tsl_mult': 0.7217029526654059, 'bear_time_stop': 205, 'bear_use_sma': True, 'bear_use_ema': True, 'bear_use_atr': True, 'bear_use_adx': False, 'bear_use_spike': True, 'bear_rsi_required': False, 'sideways_strategy': 'mean_reversion', 'sideways_bb_std_mult': 3.009636866485868, 'sideways_rsi_os': 43, 'sideways_rsi_ob': 45, 'sideways_adx_thresh': 9.931525167037995, 'sideways_atr_min_pct': 0.01938057117888442, 'sideways_atr_max_pct': 0.09796577247013939, 'sideways_tp_mult': 2.7494402919641576, 'sideways_tsl_mult': 0.9807385342825234, 'sideways_time_stop': 14, 'sideways_use_sma': False, 'sideways_use_ema': True, 'sideways_use_atr': False, 'sideways_use_adx': True, 'sideways_use_spike': False, 'sideways_rsi_required': False}.
[I 2025-09-01 09:23:08,706] Trial 154 finished with values: [-1000000000.0, 1000000000.0] and parameters: {'p_sma': 58, 'p_std': 26, 'p_atr': 17, 'p_adx': 14, 'rsi_period': 48, 'ema1': 18, 'ema2': 51, 'slip_atr_k': 0.24754824969695194, 'slip_spread_k': 0.4345701744273891, 'spread_hl_frac': 0.013014584059794, 'bb_std_mult': 1.7921516937396809, 'rsi_os': 13, 'rsi_ob': 91, 'vol_spike': 0.22778844501185389, 'adx_thresh': 15.258562655774881, 'atr_min_pct': 0.020723003730566483, 'atr_max_pct': 0.11782071625828403, 'tp_mult': 1.7634590176790164, 'tsl_mult': 0.8714017412714596, 'strategy': 'breakout', 'time_stop': 234, 'use_sma': True, 'use_atr': True, 'use_adx': True, 'use_ema': False, 'use_spike': False, 'rsi_required': False, 'edge_k': 1.2418185684258733, 'edge_cap': 0.5038647883101607, 'bull_strategy': 'mean_reversion', 'bull_bb_std_mult': 0.6426310786029064, 'bull_rsi_os': 29, 'bull_rsi_ob': 88, 'bull_adx_thresh': 26.4797312340065, 'bull_atr_min_pct': 0.029976830003193677, 'bull_atr_max_pct': 0.06498373899166443, 'bull_tp_mult': 2.0890678702700662, 'bull_tsl_mult': 0.004460823520153867, 'bull_time_stop': 139, 'bull_use_sma': True, 'bull_use_ema': False, 'bull_use_atr': False, 'bull_use_adx': False, 'bull_use_spike': False, 'bull_rsi_required': True, 'bear_strategy': 'mean_reversion', 'bear_bb_std_mult': 3.4565993727430224, 'bear_rsi_os': 48, 'bear_rsi_ob': 86, 'bear_adx_thresh': 13.7187341291369, 'bear_atr_min_pct': 0.01694216107921978, 'bear_atr_max_pct': 0.12242604765222462, 'bear_tp_mult': 2.121152945067907, 'bear_tsl_mult': 0.7274816432287324, 'bear_time_stop': 21, 'bear_use_sma': True, 'bear_use_ema': True, 'bear_use_atr': True, 'bear_use_adx': False, 'bear_use_spike': True, 'bear_rsi_required': False, 'sideways_strategy': 'breakout', 'sideways_bb_std_mult': 1.3289202142200482, 'sideways_rsi_os': 43, 'sideways_rsi_ob': 45, 'sideways_adx_thresh': 28.20770855291105, 'sideways_atr_min_pct': 0.005349847478666469, 'sideways_atr_max_pct': 0.12903125142041383, 'sideways_tp_mult': 2.526615363187128, 'sideways_tsl_mult': 0.9786860235777632, 'sideways_time_stop': 293, 'sideways_use_sma': False, 'sideways_use_ema': True, 'sideways_use_atr': False, 'sideways_use_adx': True, 'sideways_use_spike': False, 'sideways_rsi_required': False}.
[I 2025-09-01 09:23:09,675] Trial 155 finished with values: [-1000000000.0, 1000000000.0] and parameters: {'p_sma': 29, 'p_std': 26, 'p_atr': 26, 'p_adx': 14, 'rsi_period': 47, 'ema1': 22, 'ema2': 58, 'slip_atr_k': 0.06062508901350537, 'slip_spread_k': 0.27692389876058005, 'spread_hl_frac': 0.012808927208027135, 'bb_std_mult': 0.8544520323266069, 'rsi_os': 13, 'rsi_ob': 91, 'vol_spike': 0.227530591903286, 'adx_thresh': 12.787493064592004, 'atr_min_pct': 0.020539488611260235, 'atr_max_pct': 0.13804797540605074, 'tp_mult': 1.847548399749751, 'tsl_mult': 0.45186329143294907, 'strategy': 'breakout', 'time_stop': 222, 'use_sma': True, 'use_atr': True, 'use_adx': True, 'use_ema': False, 'use_spike': False, 'rsi_required': False, 'edge_k': 1.1769889924579937, 'edge_cap': 0.515225733205259, 'bull_strategy': 'mean_reversion', 'bull_bb_std_mult': 0.6726312514140915, 'bull_rsi_os': 31, 'bull_rsi_ob': 89, 'bull_adx_thresh': 34.848552869857656, 'bull_atr_min_pct': 0.029979533443278385, 'bull_atr_max_pct': 0.06588111086032696, 'bull_tp_mult': 2.0961979018888095, 'bull_tsl_mult': 0.37698925787924814, 'bull_time_stop': 204, 'bull_use_sma': True, 'bull_use_ema': False, 'bull_use_atr': False, 'bull_use_adx': False, 'bull_use_spike': False, 'bull_rsi_required': True, 'bear_strategy': 'mean_reversion', 'bear_bb_std_mult': 1.705801781147916, 'bear_rsi_os': 33, 'bear_rsi_ob': 65, 'bear_adx_thresh': 13.722914179865153, 'bear_atr_min_pct': 0.016828812003688586, 'bear_atr_max_pct': 0.06195727284276012, 'bear_tp_mult': 2.113687239239756, 'bear_tsl_mult': 0.7229409385459548, 'bear_time_stop': 222, 'bear_use_sma': True, 'bear_use_ema': True, 'bear_use_atr': True, 'bear_use_adx': False, 'bear_use_spike': True, 'bear_rsi_required': False, 'sideways_strategy': 'breakout', 'sideways_bb_std_mult': 2.0927910583821645, 'sideways_rsi_os': 43, 'sideways_rsi_ob': 45, 'sideways_adx_thresh': 28.23013572507341, 'sideways_atr_min_pct': 0.013462628519323182, 'sideways_atr_max_pct': 0.03593025740252639, 'sideways_tp_mult': 2.5401804679592024, 'sideways_tsl_mult': 0.299573203401851, 'sideways_time_stop': 33, 'sideways_use_sma': False, 'sideways_use_ema': True, 'sideways_use_atr': False, 'sideways_use_adx': True, 'sideways_use_spike': False, 'sideways_rsi_required': False}.
[I 2025-09-01 09:23:10,067] Trial 153 finished with values: [-1000000000.0, 1000000000.0] and parameters: {'p_sma': 58, 'p_std': 26, 'p_atr': 14, 'p_adx': 11, 'rsi_period': 46, 'ema1': 16, 'ema2': 21, 'slip_atr_k': 0.06081716199506089, 'slip_spread_k': 0.403959999350022, 'spread_hl_frac': 0.03331163347102955, 'bb_std_mult': 1.7743664542567028, 'rsi_os': 33, 'rsi_ob': 91, 'vol_spike': 0.04512897228718496, 'adx_thresh': 15.046243359239835, 'atr_min_pct': 0.026175776252743733, 'atr_max_pct': 0.08236681436499489, 'tp_mult': 1.4329302383053757, 'tsl_mult': 0.04312904116895422, 'strategy': 'breakout', 'time_stop': 222, 'use_sma': True, 'use_atr': False, 'use_adx': True, 'use_ema': False, 'use_spike': False, 'rsi_required': False, 'edge_k': 1.1998833847591737, 'edge_cap': 0.07216594806176206, 'bull_strategy': 'mean_reversion', 'bull_bb_std_mult': 0.6549005634985842, 'bull_rsi_os': 18, 'bull_rsi_ob': 58, 'bull_adx_thresh': 34.18781820115164, 'bull_atr_min_pct': 0.028390864081400145, 'bull_atr_max_pct': 0.06733096587284011, 'bull_tp_mult': 2.407211121197821, 'bull_tsl_mult': 0.10138729079737603, 'bull_time_stop': 138, 'bull_use_sma': True, 'bull_use_ema': False, 'bull_use_atr': False, 'bull_use_adx': False, 'bull_use_spike': False, 'bull_rsi_required': True, 'bear_strategy': 'mean_reversion', 'bear_bb_std_mult': 3.4480681101767408, 'bear_rsi_os': 32, 'bear_rsi_ob': 71, 'bear_adx_thresh': 12.816898074535173, 'bear_atr_min_pct': 0.016816693774423033, 'bear_atr_max_pct': 0.04971291745563253, 'bear_tp_mult': 2.1229341052960122, 'bear_tsl_mult': 0.5485432227946019, 'bear_time_stop': 63, 'bear_use_sma': False, 'bear_use_ema': True, 'bear_use_atr': True, 'bear_use_adx': False, 'bear_use_spike': False, 'bear_rsi_required': False, 'sideways_strategy': 'breakout', 'sideways_bb_std_mult': 3.353224269904007, 'sideways_rsi_os': 33, 'sideways_rsi_ob': 45, 'sideways_adx_thresh': 5.1659556475801605, 'sideways_atr_min_pct': 0.0050702803022414705, 'sideways_atr_max_pct': 0.05889908346850875, 'sideways_tp_mult': 2.524999465618006, 'sideways_tsl_mult': 0.30725004082871965, 'sideways_time_stop': 111, 'sideways_use_sma': False, 'sideways_use_ema': True, 'sideways_use_atr': False, 'sideways_use_adx': False, 'sideways_use_spike': False, 'sideways_rsi_required': False}.
[I 2025-09-01 09:23:10,322] Trial 157 finished with values: [-1000000000.0, 1000000000.0] and parameters: {'p_sma': 24, 'p_std': 26, 'p_atr': 26, 'p_adx': 14, 'rsi_period': 68, 'ema1': 14, 'ema2': 18, 'slip_atr_k': 0.24899885216359358, 'slip_spread_k': 0.27075226266558394, 'spread_hl_frac': 0.020170449223509718, 'bb_std_mult': 1.9798776000205551, 'rsi_os': 8, 'rsi_ob': 91, 'vol_spike': 0.2305266366178229, 'adx_thresh': 32.655904934321285, 'atr_min_pct': 0.008014742327029607, 'atr_max_pct': 0.10726368084201025, 'tp_mult': 1.8367622800778838, 'tsl_mult': 0.04917775570739164, 'strategy': 'breakout', 'time_stop': 212, 'use_sma': True, 'use_atr': False, 'use_adx': True, 'use_ema': False, 'use_spike': False, 'rsi_required': True, 'edge_k': 0.95498306006498, 'edge_cap': 0.654690107189227, 'bull_strategy': 'mean_reversion', 'bull_bb_std_mult': 0.6661302501548924, 'bull_rsi_os': 9, 'bull_rsi_ob': 58, 'bull_adx_thresh': 34.3121619493439, 'bull_atr_min_pct': 0.009175994574320799, 'bull_atr_max_pct': 0.14297894782499346, 'bull_tp_mult': 1.1600356970095034, 'bull_tsl_mult': 0.38603941373281964, 'bull_time_stop': 198, 'bull_use_sma': True, 'bull_use_ema': False, 'bull_use_atr': False, 'bull_use_adx': False, 'bull_use_spike': False, 'bull_rsi_required': True, 'bear_strategy': 'mean_reversion', 'bear_bb_std_mult': 1.6791913421641462, 'bear_rsi_os': 48, 'bear_rsi_ob': 65, 'bear_adx_thresh': 24.497284441072118, 'bear_atr_min_pct': 0.016802070030501076, 'bear_atr_max_pct': 0.0308410882443466, 'bear_tp_mult': 2.1980613290487767, 'bear_tsl_mult': 0.5907120632764647, 'bear_time_stop': 222, 'bear_use_sma': False, 'bear_use_ema': True, 'bear_use_atr': True, 'bear_use_adx': True, 'bear_use_spike': False, 'bear_rsi_required': True, 'sideways_strategy': 'breakout', 'sideways_bb_std_mult': 0.9172985426768019, 'sideways_rsi_os': 40, 'sideways_rsi_ob': 46, 'sideways_adx_thresh': 28.29926892139658, 'sideways_atr_min_pct': 0.005370579095727146, 'sideways_atr_max_pct': 0.0741535672997765, 'sideways_tp_mult': 1.7720964992638089, 'sideways_tsl_mult': 0.8818580043623774, 'sideways_time_stop': 290, 'sideways_use_sma': False, 'sideways_use_ema': True, 'sideways_use_atr': False, 'sideways_use_adx': False, 'sideways_use_spike': False, 'sideways_rsi_required': False}.
[I 2025-09-01 09:23:51,263] Trial 159 finished with values: [-1000000000.0, 1000000000.0] and parameters: {'p_sma': 25, 'p_std': 28, 'p_atr': 15, 'p_adx': 16, 'rsi_period': 84, 'ema1': 19, 'ema2': 18, 'slip_atr_k': 0.03461291338299938, 'slip_spread_k': 0.25963858417467295, 'spread_hl_frac': 0.032961961319842, 'bb_std_mult': 2.84604938745487, 'rsi_os': 32, 'rsi_ob': 87, 'vol_spike': 0.09634856965438529, 'adx_thresh': 30.285638050357612, 'atr_min_pct': 0.018440675119977254, 'atr_max_pct': 0.14718414984654266, 'tp_mult': 2.83811209844591, 'tsl_mult': 0.052171618225587635, 'strategy': 'breakout', 'time_stop': 190, 'use_sma': True, 'use_atr': False, 'use_adx': True, 'use_ema': False, 'use_spike': False, 'rsi_required': True, 'edge_k': 1.4733112368591639, 'edge_cap': 0.09693426565946459, 'bull_strategy': 'mean_reversion', 'bull_bb_std_mult': 0.5062382014989217, 'bull_rsi_os': 10, 'bull_rsi_ob': 74, 'bull_adx_thresh': 15.965367979152274, 'bull_atr_min_pct': 0.028327703876214045, 'bull_atr_max_pct': 0.1439228750687785, 'bull_tp_mult': 2.2331311271031353, 'bull_tsl_mult': 0.16378695655789488, 'bull_time_stop': 100, 'bull_use_sma': True, 'bull_use_ema': False, 'bull_use_atr': False, 'bull_use_adx': False, 'bull_use_spike': False, 'bull_rsi_required': True, 'bear_strategy': 'breakout', 'bear_bb_std_mult': 3.3339169067022225, 'bear_rsi_os': 45, 'bear_rsi_ob': 82, 'bear_adx_thresh': 12.638335892830796, 'bear_atr_min_pct': 0.013793963927169162, 'bear_atr_max_pct': 0.020921350312464088, 'bear_tp_mult': 2.184692676707901, 'bear_tsl_mult': 0.8464878353813937, 'bear_time_stop': 286, 'bear_use_sma': False, 'bear_use_ema': True, 'bear_use_atr': True, 'bear_use_adx': True, 'bear_use_spike': False, 'bear_rsi_required': True, 'sideways_strategy': 'mean_reversion', 'sideways_bb_std_mult': 3.142635936994393, 'sideways_rsi_os': 20, 'sideways_rsi_ob': 46, 'sideways_adx_thresh': 22.98751151652177, 'sideways_atr_min_pct': 0.02725692784564268, 'sideways_atr_max_pct': 0.0564464049515466, 'sideways_tp_mult': 1.8770705327760193, 'sideways_tsl_mult': 0.8768341839768999, 'sideways_time_stop': 50, 'sideways_use_sma': False, 'sideways_use_ema': True, 'sideways_use_atr': False, 'sideways_use_adx': False, 'sideways_use_spike': False, 'sideways_rsi_required': False}.
[I 2025-09-01 09:23:51,664] Trial 161 finished with values: [-1000000000.0, 1000000000.0] and parameters: {'p_sma': 26, 'p_std': 8, 'p_atr': 15, 'p_adx': 16, 'rsi_period': 65, 'ema1': 19, 'ema2': 17, 'slip_atr_k': 0.03261998916934031, 'slip_spread_k': 0.32418916901465744, 'spread_hl_frac': 0.015447704933223297, 'bb_std_mult': 1.7124912661074614, 'rsi_os': 10, 'rsi_ob': 87, 'vol_spike': 0.24110719600172917, 'adx_thresh': 20.598356119571722, 'atr_min_pct': 0.009720243155891822, 'atr_max_pct': 0.0957610500497037, 'tp_mult': 1.8020320263973522, 'tsl_mult': 0.17886515373594541, 'strategy': 'breakout', 'time_stop': 187, 'use_sma': True, 'use_atr': False, 'use_adx': True, 'use_ema': False, 'use_spike': False, 'rsi_required': True, 'edge_k': 1.4939187424207414, 'edge_cap': 0.3558114944596741, 'bull_strategy': 'mean_reversion', 'bull_bb_std_mult': 0.8769012273856899, 'bull_rsi_os': 18, 'bull_rsi_ob': 56, 'bull_adx_thresh': 15.970013560232662, 'bull_atr_min_pct': 0.011187253935368732, 'bull_atr_max_pct': 0.05716310677673226, 'bull_tp_mult': 2.2332623590071536, 'bull_tsl_mult': 0.1967837378134732, 'bull_time_stop': 103, 'bull_use_sma': True, 'bull_use_ema': False, 'bull_use_atr': False, 'bull_use_adx': False, 'bull_use_spike': False, 'bull_rsi_required': True, 'bear_strategy': 'breakout', 'bear_bb_std_mult': 0.823690232818888, 'bear_rsi_os': 15, 'bear_rsi_ob': 73, 'bear_adx_thresh': 10.629024916739054, 'bear_atr_min_pct': 0.013817751682919094, 'bear_atr_max_pct': 0.07912554329999373, 'bear_tp_mult': 2.848978593173424, 'bear_tsl_mult': 0.7924170345635582, 'bear_time_stop': 270, 'bear_use_sma': False, 'bear_use_ema': True, 'bear_use_atr': True, 'bear_use_adx': True, 'bear_use_spike': False, 'bear_rsi_required': True, 'sideways_strategy': 'mean_reversion', 'sideways_bb_std_mult': 3.583404627122159, 'sideways_rsi_os': 41, 'sideways_rsi_ob': 48, 'sideways_adx_thresh': 24.420623773434677, 'sideways_atr_min_pct': 0.003083537483258799, 'sideways_atr_max_pct': 0.056064332540785224, 'sideways_tp_mult': 1.88917442751077, 'sideways_tsl_mult': 0.8530102469546215, 'sideways_time_stop': 68, 'sideways_use_sma': False, 'sideways_use_ema': True, 'sideways_use_atr': False, 'sideways_use_adx': False, 'sideways_use_spike': False, 'sideways_rsi_required': False}.
[I 2025-09-01 09:23:51,943] Trial 158 finished with values: [-1000000000.0, 1000000000.0] and parameters: {'p_sma': 24, 'p_std': 43, 'p_atr': 26, 'p_adx': 11, 'rsi_period': 46, 'ema1': 16, 'ema2': 18, 'slip_atr_k': 0.1506912580471605, 'slip_spread_k': 0.27186884123685756, 'spread_hl_frac': 0.014043646052699199, 'bb_std_mult': 3.412322326467707, 'rsi_os': 32, 'rsi_ob': 48, 'vol_spike': 0.24377223523065697, 'adx_thresh': 30.997990886867562, 'atr_min_pct': 0.018086142404162377, 'atr_max_pct': 0.10620348619369932, 'tp_mult': 1.8507790420294323, 'tsl_mult': 0.04861685876408209, 'strategy': 'breakout', 'time_stop': 212, 'use_sma': True, 'use_atr': False, 'use_adx': True, 'use_ema': False, 'use_spike': False, 'rsi_required': True, 'edge_k': 1.4788378139531657, 'edge_cap': 0.6593818706798749, 'bull_strategy': 'mean_reversion', 'bull_bb_std_mult': 0.6574581825628695, 'bull_rsi_os': 18, 'bull_rsi_ob': 58, 'bull_adx_thresh': 7.3914940756960466, 'bull_atr_min_pct': 0.028402214471982955, 'bull_atr_max_pct': 0.05609408263890811, 'bull_tp_mult': 2.219748614706573, 'bull_tsl_mult': 0.39625533056183176, 'bull_time_stop': 100, 'bull_use_sma': True, 'bull_use_ema': False, 'bull_use_atr': False, 'bull_use_adx': False, 'bull_use_spike': False, 'bull_rsi_required': True, 'bear_strategy': 'breakout', 'bear_bb_std_mult': 1.746042076977245, 'bear_rsi_os': 34, 'bear_rsi_ob': 65, 'bear_adx_thresh': 24.547999988262568, 'bear_atr_min_pct': 0.015289756045077494, 'bear_atr_max_pct': 0.11038801657976777, 'bear_tp_mult': 2.188772680958512, 'bear_tsl_mult': 0.8255902926257814, 'bear_time_stop': 122, 'bear_use_sma': False, 'bear_use_ema': True, 'bear_use_atr': True, 'bear_use_adx': True, 'bear_use_spike': False, 'bear_rsi_required': True, 'sideways_strategy': 'breakout', 'sideways_bb_std_mult': 0.7241406380621815, 'sideways_rsi_os': 20, 'sideways_rsi_ob': 46, 'sideways_adx_thresh': 23.013781169569107, 'sideways_atr_min_pct': 0.013367195617906035, 'sideways_atr_max_pct': 0.07405997148640182, 'sideways_tp_mult': 1.8834526015116455, 'sideways_tsl_mult': 0.8810678400334605, 'sideways_time_stop': 29, 'sideways_use_sma': False, 'sideways_use_ema': True, 'sideways_use_atr': False, 'sideways_use_adx': False, 'sideways_use_spike': False, 'sideways_rsi_required': False}.
[I 2025-09-01 09:23:52,267] Trial 160 finished with values: [-1000000000.0, 1000000000.0] and parameters: {'p_sma': 24, 'p_std': 28, 'p_atr': 15, 'p_adx': 18, 'rsi_period': 68, 'ema1': 14, 'ema2': 17, 'slip_atr_k': 0.03399073646917698, 'slip_spread_k': 0.5710584442197193, 'spread_hl_frac': 0.014401733648808767, 'bb_std_mult': 3.2586953946585417, 'rsi_os': 10, 'rsi_ob': 87, 'vol_spike': 0.24536829476911065, 'adx_thresh': 5.815826342171416, 'atr_min_pct': 0.009822527065995597, 'atr_max_pct': 0.14996215518152683, 'tp_mult': 1.833039963971546, 'tsl_mult': 0.18308692028838264, 'strategy': 'breakout', 'time_stop': 144, 'use_sma': True, 'use_atr': False, 'use_adx': True, 'use_ema': False, 'use_spike': False, 'rsi_required': True, 'edge_k': 1.4826924837600246, 'edge_cap': 0.6608573234230525, 'bull_strategy': 'mean_reversion', 'bull_bb_std_mult': 0.8874143245118172, 'bull_rsi_os': 16, 'bull_rsi_ob': 54, 'bull_adx_thresh': 16.05398162066316, 'bull_atr_min_pct': 0.011053369196514864, 'bull_atr_max_pct': 0.057590445471807604, 'bull_tp_mult': 2.2464513942479742, 'bull_tsl_mult': 0.32397037235376547, 'bull_time_stop': 22, 'bull_use_sma': True, 'bull_use_ema': False, 'bull_use_atr': False, 'bull_use_adx': False, 'bull_use_spike': False, 'bull_rsi_required': True, 'bear_strategy': 'breakout', 'bear_bb_std_mult': 3.352581240176238, 'bear_rsi_os': 15, 'bear_rsi_ob': 60, 'bear_adx_thresh': 11.556011409462068, 'bear_atr_min_pct': 0.01542359569732521, 'bear_atr_max_pct': 0.02472474448833737, 'bear_tp_mult': 2.192700091787046, 'bear_tsl_mult': 0.6841584313424063, 'bear_time_stop': 125, 'bear_use_sma': False, 'bear_use_ema': True, 'bear_use_atr': True, 'bear_use_adx': True, 'bear_use_spike': False, 'bear_rsi_required': True, 'sideways_strategy': 'mean_reversion', 'sideways_bb_std_mult': 3.5930072061903173, 'sideways_rsi_os': 20, 'sideways_rsi_ob': 46, 'sideways_adx_thresh': 29.066330998085245, 'sideways_atr_min_pct': 0.002352585448578209, 'sideways_atr_max_pct': 0.07446926963045197, 'sideways_tp_mult': 1.7895828166697971, 'sideways_tsl_mult': 0.03835486839597407, 'sideways_time_stop': 249, 'sideways_use_sma': False, 'sideways_use_ema': True, 'sideways_use_atr': False, 'sideways_use_adx': False, 'sideways_use_spike': False, 'sideways_rsi_required': False}.
