[I 2025-09-01 09:49:57,427] Trial 316 finished with values: [-1000000000.0, 1000000000.0] and parameters: {'p_sma': 22, 'p_std': 41, 'p_atr': 30, 'p_adx': 21, 'rsi_period': 68, 'ema1': 20, 'ema2': 49, 'slip_atr_k': 0.04144775533178937, 'slip_spread_k': 0.21504963341095612, 'spread_hl_frac': 0.029862483895952235, 'bb_std_mult': 3.3438601674527164, 'rsi_os': 16, 'rsi_ob': 76, 'vol_spike': 0.2746584656131961, 'adx_thresh': 6.64296506895021, 'atr_min_pct': 0.02420967073961445, 'atr_max_pct': 0.14007590430581313, 'tp_mult': 2.634839918075302, 'tsl_mult': 0.04858514093448876, 'strategy': 'breakout', 'time_stop': 156, 'use_sma': True, 'use_atr': False, 'use_adx': True, 'use_ema': False, 'use_spike': False, 'rsi_required': False, 'edge_k': 0.993350957290268, 'edge_cap': 0.5783083531446047, 'bull_strategy': 'mean_reversion', 'bull_bb_std_mult': 1.0046602333952817, 'bull_rsi_os': 17, 'bull_rsi_ob': 57, 'bull_adx_thresh': 9.25265465600317, 'bull_atr_min_pct': 0.027453594442556507, 'bull_atr_max_pct': 0.09444852176686615, 'bull_tp_mult': 1.959925183272038, 'bull_tsl_mult': 0.02262652705471916, 'bull_time_stop': 161, 'bull_use_sma': True, 'bull_use_ema': False, 'bull_use_atr': True, 'bull_use_adx': True, 'bull_use_spike': False, 'bull_rsi_required': True, 'bear_strategy': 'mean_reversion', 'bear_bb_std_mult': 3.5932784447448887, 'bear_rsi_os': 48, 'bear_rsi_ob': 50, 'bear_adx_thresh': 12.391879869641468, 'bear_atr_min_pct': 0.014201672363447375, 'bear_atr_max_pct': 0.06225744812088507, 'bear_tp_mult': 1.996934308069533, 'bear_tsl_mult': 0.4228340537600917, 'bear_time_stop': 142, 'bear_use_sma': False, 'bear_use_ema': True, 'bear_use_atr': True, 'bear_use_adx': False, 'bear_use_spike': True, 'bear_rsi_required': False, 'sideways_strategy': 'breakout', 'sideways_bb_std_mult': 3.395816264198489, 'sideways_rsi_os': 47, 'sideways_rsi_ob': 46, 'sideways_adx_thresh': 30.044722731350376, 'sideways_atr_min_pct': 0.00406546772800397, 'sideways_atr_max_pct': 0.05989781675074764, 'sideways_tp_mult': 1.2626222103985123, 'sideways_tsl_mult': 0.9504590890879693, 'sideways_time_stop': 185, 'sideways_use_sma': False, 'sideways_use_ema': True, 'sideways_use_atr': False, 'sideways_use_adx': False, 'sideways_use_spike': False, 'sideways_rsi_required': False}.
[I 2025-09-01 09:49:57,466] Trial 317 finished with values: [-1000000000.0, 1000000000.0] and parameters: {'p_sma': 22, 'p_std': 41, 'p_atr': 30, 'p_adx': 22, 'rsi_period': 68, 'ema1': 20, 'ema2': 27, 'slip_atr_k': 0.04122448120812094, 'slip_spread_k': 0.21787894468726832, 'spread_hl_frac': 0.029842926415437343, 'bb_std_mult': 3.3411021829635135, 'rsi_os': 16, 'rsi_ob': 76, 'vol_spike': 0.2749648884588781, 'adx_thresh': 8.190802406017454, 'atr_min_pct': 0.02464433887256125, 'atr_max_pct': 0.14249622888628363, 'tp_mult': 2.657962108384791, 'tsl_mult': 0.03568278452959547, 'strategy': 'breakout', 'time_stop': 175, 'use_sma': True, 'use_atr': False, 'use_adx': True, 'use_ema': False, 'use_spike': False, 'rsi_required': False, 'edge_k': 0.986431247074061, 'edge_cap': 0.5903692171340831, 'bull_strategy': 'mean_reversion', 'bull_bb_std_mult': 1.0028817908784817, 'bull_rsi_os': 17, 'bull_rsi_ob': 59, 'bull_adx_thresh': 6.383515874707797, 'bull_atr_min_pct': 0.02611521800110323, 'bull_atr_max_pct': 0.09505085109623441, 'bull_tp_mult': 1.9689942604027093, 'bull_tsl_mult': 0.05201451195858257, 'bull_time_stop': 157, 'bull_use_sma': True, 'bull_use_ema': False, 'bull_use_atr': True, 'bull_use_adx': True, 'bull_use_spike': False, 'bull_rsi_required': True, 'bear_strategy': 'mean_reversion', 'bear_bb_std_mult': 3.5438206500038967, 'bear_rsi_os': 49, 'bear_rsi_ob': 46, 'bear_adx_thresh': 14.326916692321044, 'bear_atr_min_pct': 0.0128497640929426, 'bear_atr_max_pct': 0.06284653143722915, 'bear_tp_mult': 2.4424626656515684, 'bear_tsl_mult': 0.3102964817181658, 'bear_time_stop': 162, 'bear_use_sma': False, 'bear_use_ema': True, 'bear_use_atr': True, 'bear_use_adx': False, 'bear_use_spike': True, 'bear_rsi_required': False, 'sideways_strategy': 'breakout', 'sideways_bb_std_mult': 3.225268382600654, 'sideways_rsi_os': 47, 'sideways_rsi_ob': 48, 'sideways_adx_thresh': 30.013023670262218, 'sideways_atr_min_pct': 0.0035093114102066002, 'sideways_atr_max_pct': 0.06068172240724094, 'sideways_tp_mult': 1.4184165498255779, 'sideways_tsl_mult': 0.944472646338091, 'sideways_time_stop': 186, 'sideways_use_sma': False, 'sideways_use_ema': True, 'sideways_use_atr': False, 'sideways_use_adx': False, 'sideways_use_spike': False, 'sideways_rsi_required': False}.
[I 2025-09-01 09:49:57,472] Trial 318 finished with values: [-1000000000.0, 1000000000.0] and parameters: {'p_sma': 22, 'p_std': 41, 'p_atr': 28, 'p_adx': 22, 'rsi_period': 62, 'ema1': 20, 'ema2': 25, 'slip_atr_k': 0.04040807867467945, 'slip_spread_k': 0.21174549099595216, 'spread_hl_frac': 0.02639173199644127, 'bb_std_mult': 3.3261967561987906, 'rsi_os': 24, 'rsi_ob': 77, 'vol_spike': 0.29236924216540666, 'adx_thresh': 6.309646207117792, 'atr_min_pct': 0.023019252002574098, 'atr_max_pct': 0.14253769326132704, 'tp_mult': 2.7249769443699994, 'tsl_mult': 0.043398201909826226, 'strategy': 'breakout', 'time_stop': 155, 'use_sma': True, 'use_atr': False, 'use_adx': True, 'use_ema': False, 'use_spike': False, 'rsi_required': False, 'edge_k': 0.9005830086050399, 'edge_cap': 0.5325560346777697, 'bull_strategy': 'mean_reversion', 'bull_bb_std_mult': 0.9909917396980676, 'bull_rsi_os': 17, 'bull_rsi_ob': 59, 'bull_adx_thresh': 6.4187948934837635, 'bull_atr_min_pct': 0.029058024480969467, 'bull_atr_max_pct': 0.08662838906800194, 'bull_tp_mult': 1.9588036713113015, 'bull_tsl_mult': 0.026057342809397054, 'bull_time_stop': 162, 'bull_use_sma': True, 'bull_use_ema': False, 'bull_use_atr': True, 'bull_use_adx': True, 'bull_use_spike': False, 'bull_rsi_required': True, 'bear_strategy': 'mean_reversion', 'bear_bb_std_mult': 3.550221715207904, 'bear_rsi_os': 49, 'bear_rsi_ob': 46, 'bear_adx_thresh': 14.36025975147076, 'bear_atr_min_pct': 0.01453057167245321, 'bear_atr_max_pct': 0.05530382473952315, 'bear_tp_mult': 2.0337778913315523, 'bear_tsl_mult': 0.3100877477582178, 'bear_time_stop': 130, 'bear_use_sma': False, 'bear_use_ema': True, 'bear_use_atr': True, 'bear_use_adx': False, 'bear_use_spike': True, 'bear_rsi_required': False, 'sideways_strategy': 'breakout', 'sideways_bb_std_mult': 3.2494753565028263, 'sideways_rsi_os': 48, 'sideways_rsi_ob': 48, 'sideways_adx_thresh': 30.151657552164476, 'sideways_atr_min_pct': 0.00428367535676373, 'sideways_atr_max_pct': 0.0603570345037338, 'sideways_tp_mult': 1.290884935750714, 'sideways_tsl_mult': 0.9441046144782819, 'sideways_time_stop': 181, 'sideways_use_sma': False, 'sideways_use_ema': True, 'sideways_use_atr': False, 'sideways_use_adx': False, 'sideways_use_spike': False, 'sideways_rsi_required': False}.
[I 2025-09-01 09:49:58,046] Trial 315 finished with values: [-1000000000.0, 1000000000.0] and parameters: {'p_sma': 22, 'p_std': 38, 'p_atr': 30, 'p_adx': 23, 'rsi_period': 68, 'ema1': 20, 'ema2': 39, 'slip_atr_k': 0.04229591802263875, 'slip_spread_k': 0.21105908874523424, 'spread_hl_frac': 0.026251299560457395, 'bb_std_mult': 3.3431969891363154, 'rsi_os': 19, 'rsi_ob': 80, 'vol_spike': 0.2733801469947093, 'adx_thresh': 6.691202738940791, 'atr_min_pct': 0.023947705429639726, 'atr_max_pct': 0.138659097081624, 'tp_mult': 2.638414359778981, 'tsl_mult': 0.0452618036737, 'strategy': 'breakout', 'time_stop': 174, 'use_sma': True, 'use_atr': False, 'use_adx': True, 'use_ema': False, 'use_spike': False, 'rsi_required': False, 'edge_k': 0.8877102571912238, 'edge_cap': 0.5309290516746857, 'bull_strategy': 'mean_reversion', 'bull_bb_std_mult': 0.7961006696637323, 'bull_rsi_os': 17, 'bull_rsi_ob': 57, 'bull_adx_thresh': 9.180557201393672, 'bull_atr_min_pct': 0.027302751197631946, 'bull_atr_max_pct': 0.09401227199944444, 'bull_tp_mult': 1.981557261990788, 'bull_tsl_mult': 0.05313778271016631, 'bull_time_stop': 140, 'bull_use_sma': True, 'bull_use_ema': False, 'bull_use_atr': True, 'bull_use_adx': True, 'bull_use_spike': False, 'bull_rsi_required': True, 'bear_strategy': 'mean_reversion', 'bear_bb_std_mult': 3.5440715267809377, 'bear_rsi_os': 48, 'bear_rsi_ob': 48, 'bear_adx_thresh': 14.282152893641985, 'bear_atr_min_pct': 0.014204158745820978, 'bear_atr_max_pct': 0.06214537815178185, 'bear_tp_mult': 2.460639815110584, 'bear_tsl_mult': 0.420705235108605, 'bear_time_stop': 160, 'bear_use_sma': False, 'bear_use_ema': True, 'bear_use_atr': True, 'bear_use_adx': False, 'bear_use_spike': True, 'bear_rsi_required': False, 'sideways_strategy': 'breakout', 'sideways_bb_std_mult': 3.241907585601041, 'sideways_rsi_os': 48, 'sideways_rsi_ob': 46, 'sideways_adx_thresh': 26.474759508249697, 'sideways_atr_min_pct': 0.004030749903673357, 'sideways_atr_max_pct': 0.06464817083022535, 'sideways_tp_mult': 1.2579681071281104, 'sideways_tsl_mult': 0.9472165414911968, 'sideways_time_stop': 182, 'sideways_use_sma': False, 'sideways_use_ema': True, 'sideways_use_atr': False, 'sideways_use_adx': False, 'sideways_use_spike': False, 'sideways_rsi_required': False}.
[I 2025-09-01 09:50:37,701] Trial 322 finished with values: [-1000000000.0, 1000000000.0] and parameters: {'p_sma': 24, 'p_std': 42, 'p_atr': 29, 'p_adx': 21, 'rsi_period': 64, 'ema1': 19, 'ema2': 32, 'slip_atr_k': 0.06282229782946205, 'slip_spread_k': 0.24095208939590848, 'spread_hl_frac': 0.027970276576114683, 'bb_std_mult': 3.2323267973836343, 'rsi_os': 22, 'rsi_ob': 75, 'vol_spike': 0.28962322976250704, 'adx_thresh': 9.805669316347943, 'atr_min_pct': 0.023278005844078086, 'atr_max_pct': 0.13021477474630141, 'tp_mult': 2.609645111509685, 'tsl_mult': 0.015438311110482793, 'strategy': 'breakout', 'time_stop': 161, 'use_sma': True, 'use_atr': False, 'use_adx': True, 'use_ema': False, 'use_spike': False, 'rsi_required': False, 'edge_k': 1.0525507947015647, 'edge_cap': 0.5560015817032851, 'bull_strategy': 'mean_reversion', 'bull_bb_std_mult': 0.9155713185308306, 'bull_rsi_os': 15, 'bull_rsi_ob': 55, 'bull_adx_thresh': 7.705675073370522, 'bull_atr_min_pct': 0.029106210867237733, 'bull_atr_max_pct': 0.08753047610372157, 'bull_tp_mult': 1.7943525875252413, 'bull_tsl_mult': 0.08694366447469054, 'bull_time_stop': 142, 'bull_use_sma': True, 'bull_use_ema': False, 'bull_use_atr': True, 'bull_use_adx': True, 'bull_use_spike': False, 'bull_rsi_required': True, 'bear_strategy': 'mean_reversion', 'bear_bb_std_mult': 3.593464530633592, 'bear_rsi_os': 52, 'bear_rsi_ob': 49, 'bear_adx_thresh': 13.367092634843015, 'bear_atr_min_pct': 0.016078939524598136, 'bear_atr_max_pct': 0.05846992011471745, 'bear_tp_mult': 2.3943396613852843, 'bear_tsl_mult': 0.397256024978997, 'bear_time_stop': 155, 'bear_use_sma': False, 'bear_use_ema': True, 'bear_use_atr': True, 'bear_use_adx': False, 'bear_use_spike': True, 'bear_rsi_required': False, 'sideways_strategy': 'breakout', 'sideways_bb_std_mult': 3.3530320627521326, 'sideways_rsi_os': 50, 'sideways_rsi_ob': 47, 'sideways_adx_thresh': 29.38728977069428, 'sideways_atr_min_pct': 0.005243660011529934, 'sideways_atr_max_pct': 0.07348211484526036, 'sideways_tp_mult': 1.3036838513736657, 'sideways_tsl_mult': 0.9065725768925899, 'sideways_time_stop': 177, 'sideways_use_sma': False, 'sideways_use_ema': True, 'sideways_use_atr': False, 'sideways_use_adx': False, 'sideways_use_spike': False, 'sideways_rsi_required': False}.
[I 2025-09-01 09:50:38,514] Trial 319 finished with values: [-1000000000.0, 1000000000.0] and parameters: {'p_sma': 24, 'p_std': 42, 'p_atr': 30, 'p_adx': 21, 'rsi_period': 70, 'ema1': 19, 'ema2': 35, 'slip_atr_k': 0.05958628557200732, 'slip_spread_k': 0.23382088834156278, 'spread_hl_frac': 0.031986659493210445, 'bb_std_mult': 3.2740358145949893, 'rsi_os': 20, 'rsi_ob': 75, 'vol_spike': 0.29268846496797946, 'adx_thresh': 7.737325287353144, 'atr_min_pct': 0.023647930719388314, 'atr_max_pct': 0.13027952800148979, 'tp_mult': 2.6150680299829165, 'tsl_mult': 0.019484385702197023, 'strategy': 'breakout', 'time_stop': 162, 'use_sma': True, 'use_atr': False, 'use_adx': True, 'use_ema': False, 'use_spike': False, 'rsi_required': False, 'edge_k': 1.0846065203954076, 'edge_cap': 0.5431797189322739, 'bull_strategy': 'mean_reversion', 'bull_bb_std_mult': 0.8891175562245758, 'bull_rsi_os': 15, 'bull_rsi_ob': 57, 'bull_adx_thresh': 7.700749256452184, 'bull_atr_min_pct': 0.029135554713920774, 'bull_atr_max_pct': 0.08910089968013078, 'bull_tp_mult': 1.8018836917690968, 'bull_tsl_mult': 0.08926435087102672, 'bull_time_stop': 140, 'bull_use_sma': True, 'bull_use_ema': False, 'bull_use_atr': True, 'bull_use_adx': True, 'bull_use_spike': False, 'bull_rsi_required': True, 'bear_strategy': 'mean_reversion', 'bear_bb_std_mult': 3.528857448227443, 'bear_rsi_os': 52, 'bear_rsi_ob': 48, 'bear_adx_thresh': 13.39472055693934, 'bear_atr_min_pct': 0.017364216671545522, 'bear_atr_max_pct': 0.05703773198691615, 'bear_tp_mult': 1.8481286705231312, 'bear_tsl_mult': 0.3999790349172108, 'bear_time_stop': 145, 'bear_use_sma': False, 'bear_use_ema': True, 'bear_use_atr': True, 'bear_use_adx': False, 'bear_use_spike': True, 'bear_rsi_required': False, 'sideways_strategy': 'breakout', 'sideways_bb_std_mult': 3.1501973658760187, 'sideways_rsi_os': 51, 'sideways_rsi_ob': 47, 'sideways_adx_thresh': 29.41480318678755, 'sideways_atr_min_pct': 0.005372803295984429, 'sideways_atr_max_pct': 0.07326598997427604, 'sideways_tp_mult': 1.2886667122487026, 'sideways_tsl_mult': 0.9095946908710817, 'sideways_time_stop': 175, 'sideways_use_sma': False, 'sideways_use_ema': True, 'sideways_use_atr': False, 'sideways_use_adx': False, 'sideways_use_spike': False, 'sideways_rsi_required': False}.
[I 2025-09-01 09:50:38,711] Trial 321 finished with values: [-1000000000.0, 1000000000.0] and parameters: {'p_sma': 24, 'p_std': 44, 'p_atr': 30, 'p_adx': 21, 'rsi_period': 71, 'ema1': 19, 'ema2': 34, 'slip_atr_k': 0.05983168218937516, 'slip_spread_k': 0.23686815973221892, 'spread_hl_frac': 0.029012313177653133, 'bb_std_mult': 3.2149118364908613, 'rsi_os': 19, 'rsi_ob': 78, 'vol_spike': 0.29226025077751183, 'adx_thresh': 5.989286079861378, 'atr_min_pct': 0.023398170507395663, 'atr_max_pct': 0.13092813153274196, 'tp_mult': 2.62476164817364, 'tsl_mult': 0.0003746528598749764, 'strategy': 'breakout', 'time_stop': 164, 'use_sma': True, 'use_atr': False, 'use_adx': True, 'use_ema': False, 'use_spike': False, 'rsi_required': False, 'edge_k': 1.0416100519934757, 'edge_cap': 0.537876369052447, 'bull_strategy': 'mean_reversion', 'bull_bb_std_mult': 0.9363799773484843, 'bull_rsi_os': 16, 'bull_rsi_ob': 57, 'bull_adx_thresh': 7.544582738417565, 'bull_atr_min_pct': 0.02921033143629728, 'bull_atr_max_pct': 0.09012963714333837, 'bull_tp_mult': 1.7953421958848397, 'bull_tsl_mult': 0.08708806834991195, 'bull_time_stop': 140, 'bull_use_sma': True, 'bull_use_ema': False, 'bull_use_atr': True, 'bull_use_adx': True, 'bull_use_spike': False, 'bull_rsi_required': True, 'bear_strategy': 'mean_reversion', 'bear_bb_std_mult': 3.5940423068846257, 'bear_rsi_os': 52, 'bear_rsi_ob': 48, 'bear_adx_thresh': 11.207467392911848, 'bear_atr_min_pct': 0.017405556192150028, 'bear_atr_max_pct': 0.058024528881669674, 'bear_tp_mult': 2.4099849422087636, 'bear_tsl_mult': 0.39512348033335326, 'bear_time_stop': 146, 'bear_use_sma': False, 'bear_use_ema': True, 'bear_use_atr': True, 'bear_use_adx': False, 'bear_use_spike': True, 'bear_rsi_required': False, 'sideways_strategy': 'breakout', 'sideways_bb_std_mult': 3.131370063959059, 'sideways_rsi_os': 50, 'sideways_rsi_ob': 47, 'sideways_adx_thresh': 29.23517281536736, 'sideways_atr_min_pct': 0.0054809145695856, 'sideways_atr_max_pct': 0.07327874906583198, 'sideways_tp_mult': 1.4022666710200977, 'sideways_tsl_mult': 0.9117115794640113, 'sideways_time_stop': 176, 'sideways_use_sma': False, 'sideways_use_ema': True, 'sideways_use_atr': False, 'sideways_use_adx': False, 'sideways_use_spike': False, 'sideways_rsi_required': False}.
[I 2025-09-01 09:50:38,913] Trial 320 finished with values: [-0.013119004598302175, 0.013802828951781879] and parameters: {'p_sma': 24, 'p_std': 40, 'p_atr': 30, 'p_adx': 21, 'rsi_period': 70, 'ema1': 19, 'ema2': 34, 'slip_atr_k': 0.0631631769026651, 'slip_spread_k': 0.23576655427426052, 'spread_hl_frac': 0.028912212793026415, 'bb_std_mult': 3.262402552006953, 'rsi_os': 22, 'rsi_ob': 75, 'vol_spike': 0.2928968628560037, 'adx_thresh': 7.735736161236508, 'atr_min_pct': 0.02339384802888199, 'atr_max_pct': 0.1305793053216768, 'tp_mult': 2.6091391447444248, 'tsl_mult': 0.020854112516452243, 'strategy': 'breakout', 'time_stop': 168, 'use_sma': True, 'use_atr': False, 'use_adx': True, 'use_ema': False, 'use_spike': False, 'rsi_required': False, 'edge_k': 1.0967829468751649, 'edge_cap': 0.542534073946874, 'bull_strategy': 'mean_reversion', 'bull_bb_std_mult': 0.8859630841741406, 'bull_rsi_os': 15, 'bull_rsi_ob': 57, 'bull_adx_thresh': 7.602135892966349, 'bull_atr_min_pct': 0.029212789585000995, 'bull_atr_max_pct': 0.08735279100314407, 'bull_tp_mult': 1.8018207050822153, 'bull_tsl_mult': 0.08360128495029276, 'bull_time_stop': 140, 'bull_use_sma': True, 'bull_use_ema': False, 'bull_use_atr': True, 'bull_use_adx': True, 'bull_use_spike': False, 'bull_rsi_required': True, 'bear_strategy': 'mean_reversion', 'bear_bb_std_mult': 3.599197033705965, 'bear_rsi_os': 52, 'bear_rsi_ob': 48, 'bear_adx_thresh': 13.282812918754228, 'bear_atr_min_pct': 0.01713605918666901, 'bear_atr_max_pct': 0.06945438474194252, 'bear_tp_mult': 1.8529445558016555, 'bear_tsl_mult': 0.39421429224159943, 'bear_time_stop': 157, 'bear_use_sma': False, 'bear_use_ema': True, 'bear_use_atr': True, 'bear_use_adx': False, 'bear_use_spike': True, 'bear_rsi_required': False, 'sideways_strategy': 'breakout', 'sideways_bb_std_mult': 3.122435629710677, 'sideways_rsi_os': 50, 'sideways_rsi_ob': 47, 'sideways_adx_thresh': 29.26245510096836, 'sideways_atr_min_pct': 0.0034215572112458446, 'sideways_atr_max_pct': 0.07304549425558061, 'sideways_tp_mult': 1.4110655226394204, 'sideways_tsl_mult': 0.9077888315256853, 'sideways_time_stop': 170, 'sideways_use_sma': False, 'sideways_use_ema': True, 'sideways_use_atr': False, 'sideways_use_adx': False, 'sideways_use_spike': False, 'sideways_rsi_required': False}.
[I 2025-09-01 09:51:19,570] Trial 326 finished with values: [-1000000000.0, 1000000000.0] and parameters: {'p_sma': 21, 'p_std': 41, 'p_atr': 29, 'p_adx': 21, 'rsi_period': 62, 'ema1': 22, 'ema2': 33, 'slip_atr_k': 0.04788469280008038, 'slip_spread_k': 0.1281139896008907, 'spread_hl_frac': 0.03083281231861999, 'bb_std_mult': 3.3631213784207747, 'rsi_os': 25, 'rsi_ob': 76, 'vol_spike': 0.2860583566842404, 'adx_thresh': 6.044412320963969, 'atr_min_pct': 0.0246361326045625, 'atr_max_pct': 0.137142804292274, 'tp_mult': 2.7018375492614304, 'tsl_mult': 0.06664753643028136, 'strategy': 'breakout', 'time_stop': 155, 'use_sma': True, 'use_atr': False, 'use_adx': True, 'use_ema': False, 'use_spike': False, 'rsi_required': False, 'edge_k': 1.0259326295083253, 'edge_cap': 0.590962657776378, 'bull_strategy': 'mean_reversion', 'bull_bb_std_mult': 0.7534668114954761, 'bull_rsi_os': 18, 'bull_rsi_ob': 55, 'bull_adx_thresh': 5.799576201382763, 'bull_atr_min_pct': 0.029975476581482023, 'bull_atr_max_pct': 0.08048445778885344, 'bull_tp_mult': 1.8606803472718647, 'bull_tsl_mult': 0.13304706925097437, 'bull_time_stop': 151, 'bull_use_sma': True, 'bull_use_ema': False, 'bull_use_atr': True, 'bull_use_adx': True, 'bull_use_spike': False, 'bull_rsi_required': True, 'bear_strategy': 'mean_reversion', 'bear_bb_std_mult': 3.4455440912287894, 'bear_rsi_os': 47, 'bear_rsi_ob': 62, 'bear_adx_thresh': 12.768969020575407, 'bear_atr_min_pct': 0.015093713538183761, 'bear_atr_max_pct': 0.0656506967607183, 'bear_tp_mult': 1.3571564454753626, 'bear_tsl_mult': 0.42897494883527165, 'bear_time_stop': 138, 'bear_use_sma': False, 'bear_use_ema': True, 'bear_use_atr': True, 'bear_use_adx': False, 'bear_use_spike': True, 'bear_rsi_required': False, 'sideways_strategy': 'breakout', 'sideways_bb_std_mult': 3.1143416501782757, 'sideways_rsi_os': 49, 'sideways_rsi_ob': 49, 'sideways_adx_thresh': 31.641624219956462, 'sideways_atr_min_pct': 0.009671918749968388, 'sideways_atr_max_pct': 0.11632195486658417, 'sideways_tp_mult': 1.3187540448040727, 'sideways_tsl_mult': 0.8519656403042717, 'sideways_time_stop': 201, 'sideways_use_sma': False, 'sideways_use_ema': True, 'sideways_use_atr': False, 'sideways_use_adx': False, 'sideways_use_spike': False, 'sideways_rsi_required': False}.
