[I 2025-09-01 09:47:51,798] Trial 303 finished with values: [-0.022253241071122143, 0.022230620942502635] and parameters: {'p_sma': 23, 'p_std': 39, 'p_atr': 30, 'p_adx': 21, 'rsi_period': 61, 'ema1': 20, 'ema2': 39, 'slip_atr_k': 0.047969202878376374, 'slip_spread_k': 0.14616972470558767, 'spread_hl_frac': 0.029054986625470566, 'bb_std_mult': 3.12991734359928, 'rsi_os': 21, 'rsi_ob': 76, 'vol_spike': 0.29080885872292506, 'adx_thresh': 6.851735975185843, 'atr_min_pct': 0.02420387063925222, 'atr_max_pct': 0.12749541520265942, 'tp_mult': 2.679116447763105, 'tsl_mult': 0.0029117947082073076, 'strategy': 'breakout', 'time_stop': 160, 'use_sma': True, 'use_atr': False, 'use_adx': True, 'use_ema': False, 'use_spike': False, 'rsi_required': False, 'edge_k': 1.044390312582025, 'edge_cap': 0.5141737898374189, 'bull_strategy': 'mean_reversion', 'bull_bb_std_mult': 0.840128554381456, 'bull_rsi_os': 15, 'bull_rsi_ob': 60, 'bull_adx_thresh': 7.704782427440217, 'bull_atr_min_pct': 0.02863991320958778, 'bull_atr_max_pct': 0.08773183778747634, 'bull_tp_mult': 1.8874520352419286, 'bull_tsl_mult': 0.09694843566063369, 'bull_time_stop': 144, 'bull_use_sma': True, 'bull_use_ema': False, 'bull_use_atr': True, 'bull_use_adx': True, 'bull_use_spike': False, 'bull_rsi_required': True, 'bear_strategy': 'mean_reversion', 'bear_bb_std_mult': 3.598533053346691, 'bear_rsi_os': 48, 'bear_rsi_ob': 49, 'bear_adx_thresh': 12.933265611397418, 'bear_atr_min_pct': 0.014050642688862034, 'bear_atr_max_pct': 0.06992594585069911, 'bear_tp_mult': 1.3601078112036507, 'bear_tsl_mult': 0.4026199557174627, 'bear_time_stop': 145, 'bear_use_sma': False, 'bear_use_ema': True, 'bear_use_atr': True, 'bear_use_adx': False, 'bear_use_spike': True, 'bear_rsi_required': False, 'sideways_strategy': 'breakout', 'sideways_bb_std_mult': 3.168294620546809, 'sideways_rsi_os': 51, 'sideways_rsi_ob': 51, 'sideways_adx_thresh': 27.744453527397436, 'sideways_atr_min_pct': 0.003174976116008184, 'sideways_atr_max_pct': 0.06467701882502051, 'sideways_tp_mult': 1.3446175627232344, 'sideways_tsl_mult': 0.8923694721330986, 'sideways_time_stop': 191, 'sideways_use_sma': False, 'sideways_use_ema': True, 'sideways_use_atr': False, 'sideways_use_adx': False, 'sideways_use_spike': False, 'sideways_rsi_required': False}.
[I 2025-09-01 09:48:34,569] Trial 307 finished with values: [-0.012245382935248239, 0.01298567331880084] and parameters: {'p_sma': 23, 'p_std': 40, 'p_atr': 30, 'p_adx': 21, 'rsi_period': 61, 'ema1': 20, 'ema2': 39, 'slip_atr_k': 0.04798003899451305, 'slip_spread_k': 0.1623344351182478, 'spread_hl_frac': 0.02961164211299215, 'bb_std_mult': 3.240881707636845, 'rsi_os': 21, 'rsi_ob': 76, 'vol_spike': 0.28670911056385234, 'adx_thresh': 6.852576058913392, 'atr_min_pct': 0.02603686430490015, 'atr_max_pct': 0.13895115661351745, 'tp_mult': 2.6082311989116795, 'tsl_mult': 0.003460028435998349, 'strategy': 'breakout', 'time_stop': 171, 'use_sma': True, 'use_atr': False, 'use_adx': True, 'use_ema': False, 'use_spike': False, 'rsi_required': False, 'edge_k': 0.9767217277977157, 'edge_cap': 0.5274548345057483, 'bull_strategy': 'mean_reversion', 'bull_bb_std_mult': 0.8234395705782328, 'bull_rsi_os': 19, 'bull_rsi_ob': 60, 'bull_adx_thresh': 7.7000343790338395, 'bull_atr_min_pct': 0.028768239931405856, 'bull_atr_max_pct': 0.08686755084523476, 'bull_tp_mult': 1.8789861307697622, 'bull_tsl_mult': 0.11219537143940198, 'bull_time_stop': 144, 'bull_use_sma': True, 'bull_use_ema': False, 'bull_use_atr': True, 'bull_use_adx': True, 'bull_use_spike': False, 'bull_rsi_required': True, 'bear_strategy': 'mean_reversion', 'bear_bb_std_mult': 3.541905642523078, 'bear_rsi_os': 49, 'bear_rsi_ob': 50, 'bear_adx_thresh': 12.997595867371144, 'bear_atr_min_pct': 0.01270804609903856, 'bear_atr_max_pct': 0.07175276909584019, 'bear_tp_mult': 1.330098721320564, 'bear_tsl_mult': 0.4014334453384584, 'bear_time_stop': 134, 'bear_use_sma': False, 'bear_use_ema': True, 'bear_use_atr': True, 'bear_use_adx': False, 'bear_use_spike': True, 'bear_rsi_required': False, 'sideways_strategy': 'breakout', 'sideways_bb_std_mult': 3.1954029733998786, 'sideways_rsi_os': 49, 'sideways_rsi_ob': 51, 'sideways_adx_thresh': 27.809326408202153, 'sideways_atr_min_pct': 0.0034397025159745064, 'sideways_atr_max_pct': 0.06030885185872894, 'sideways_tp_mult': 1.22838035747405, 'sideways_tsl_mult': 0.9493231566694057, 'sideways_time_stop': 189, 'sideways_use_sma': False, 'sideways_use_ema': True, 'sideways_use_atr': False, 'sideways_use_adx': False, 'sideways_use_spike': False, 'sideways_rsi_required': False}.
[I 2025-09-01 09:48:35,322] Trial 309 finished with values: [-1000000000.0, 1000000000.0] and parameters: {'p_sma': 20, 'p_std': 40, 'p_atr': 30, 'p_adx': 23, 'rsi_period': 68, 'ema1': 20, 'ema2': 39, 'slip_atr_k': 0.0692581490441865, 'slip_spread_k': 0.1667593722719662, 'spread_hl_frac': 0.029207792381516377, 'bb_std_mult': 3.3315900628680115, 'rsi_os': 19, 'rsi_ob': 76, 'vol_spike': 0.2872798033054505, 'adx_thresh': 6.660844319208227, 'atr_min_pct': 0.026012800395567665, 'atr_max_pct': 0.1399591761617843, 'tp_mult': 2.6087521829655245, 'tsl_mult': 0.0028174928633999674, 'strategy': 'breakout', 'time_stop': 172, 'use_sma': True, 'use_atr': False, 'use_adx': True, 'use_ema': False, 'use_spike': False, 'rsi_required': False, 'edge_k': 0.9643031744554199, 'edge_cap': 0.5158612886653201, 'bull_strategy': 'mean_reversion', 'bull_bb_std_mult': 0.7683623335470975, 'bull_rsi_os': 20, 'bull_rsi_ob': 60, 'bull_adx_thresh': 7.865651467976382, 'bull_atr_min_pct': 0.028767246104988632, 'bull_atr_max_pct': 0.08446366403842977, 'bull_tp_mult': 1.8930248523382798, 'bull_tsl_mult': 0.11666687367114573, 'bull_time_stop': 159, 'bull_use_sma': True, 'bull_use_ema': False, 'bull_use_atr': True, 'bull_use_adx': True, 'bull_use_spike': False, 'bull_rsi_required': True, 'bear_strategy': 'mean_reversion', 'bear_bb_std_mult': 3.5341942998260065, 'bear_rsi_os': 53, 'bear_rsi_ob': 45, 'bear_adx_thresh': 13.00126316840764, 'bear_atr_min_pct': 0.014992294074271209, 'bear_atr_max_pct': 0.06438791354772343, 'bear_tp_mult': 1.322239229303701, 'bear_tsl_mult': 0.40361703293974494, 'bear_time_stop': 127, 'bear_use_sma': False, 'bear_use_ema': True, 'bear_use_atr': True, 'bear_use_adx': False, 'bear_use_spike': True, 'bear_rsi_required': False, 'sideways_strategy': 'breakout', 'sideways_bb_std_mult': 3.164947979156426, 'sideways_rsi_os': 47, 'sideways_rsi_ob': 51, 'sideways_adx_thresh': 29.402432161129624, 'sideways_atr_min_pct': 0.0034476348793694273, 'sideways_atr_max_pct': 0.05938003810666953, 'sideways_tp_mult': 1.2982784529762323, 'sideways_tsl_mult': 0.955235608849955, 'sideways_time_stop': 192, 'sideways_use_sma': False, 'sideways_use_ema': True, 'sideways_use_atr': False, 'sideways_use_adx': False, 'sideways_use_spike': False, 'sideways_rsi_required': False}.
[I 2025-09-01 09:48:35,861] Trial 310 finished with values: [-0.01391529682475956, 0.014873027111904044] and parameters: {'p_sma': 23, 'p_std': 38, 'p_atr': 30, 'p_adx': 23, 'rsi_period': 68, 'ema1': 20, 'ema2': 39, 'slip_atr_k': 0.04667127402032769, 'slip_spread_k': 0.21844723149605313, 'spread_hl_frac': 0.029705458621628794, 'bb_std_mult': 3.343047123434715, 'rsi_os': 21, 'rsi_ob': 76, 'vol_spike': 0.28846805961034144, 'adx_thresh': 6.81399206744031, 'atr_min_pct': 0.024052973921892443, 'atr_max_pct': 0.13905718160477745, 'tp_mult': 2.6137089215565132, 'tsl_mult': 0.00024566209959631726, 'strategy': 'breakout', 'time_stop': 176, 'use_sma': True, 'use_atr': False, 'use_adx': True, 'use_ema': False, 'use_spike': False, 'rsi_required': False, 'edge_k': 0.9788473664136221, 'edge_cap': 0.5088512161350561, 'bull_strategy': 'mean_reversion', 'bull_bb_std_mult': 0.8164917592569512, 'bull_rsi_os': 20, 'bull_rsi_ob': 60, 'bull_adx_thresh': 9.366091220766677, 'bull_atr_min_pct': 0.02730234538236313, 'bull_atr_max_pct': 0.09393467825942824, 'bull_tp_mult': 1.8751500099907106, 'bull_tsl_mult': 0.11207909014894812, 'bull_time_stop': 143, 'bull_use_sma': True, 'bull_use_ema': False, 'bull_use_atr': True, 'bull_use_adx': True, 'bull_use_spike': False, 'bull_rsi_required': True, 'bear_strategy': 'mean_reversion', 'bear_bb_std_mult': 3.5939992218112042, 'bear_rsi_os': 48, 'bear_rsi_ob': 45, 'bear_adx_thresh': 12.938721695519455, 'bear_atr_min_pct': 0.012639372798144342, 'bear_atr_max_pct': 0.06557727089561483, 'bear_tp_mult': 1.339731895586748, 'bear_tsl_mult': 0.3998941375984973, 'bear_time_stop': 131, 'bear_use_sma': False, 'bear_use_ema': True, 'bear_use_atr': True, 'bear_use_adx': False, 'bear_use_spike': True, 'bear_rsi_required': False, 'sideways_strategy': 'breakout', 'sideways_bb_std_mult': 3.223194484803581, 'sideways_rsi_os': 48, 'sideways_rsi_ob': 51, 'sideways_adx_thresh': 29.28847607862732, 'sideways_atr_min_pct': 0.00339495411304701, 'sideways_atr_max_pct': 0.06073320056004693, 'sideways_tp_mult': 1.2915809058705932, 'sideways_tsl_mult': 0.9523452125728411, 'sideways_time_stop': 193, 'sideways_use_sma': False, 'sideways_use_ema': True, 'sideways_use_atr': False, 'sideways_use_adx': False, 'sideways_use_spike': False, 'sideways_rsi_required': False}.
[I 2025-09-01 09:48:36,300] Trial 308 finished with values: [-0.27804791043101884, 0.2778485814070534] and parameters: {'p_sma': 23, 'p_std': 39, 'p_atr': 30, 'p_adx': 19, 'rsi_period': 61, 'ema1': 20, 'ema2': 39, 'slip_atr_k': 0.06991757044830062, 'slip_spread_k': 0.16108593086129427, 'spread_hl_frac': 0.029430152923987627, 'bb_std_mult': 3.416811484970668, 'rsi_os': 21, 'rsi_ob': 76, 'vol_spike': 0.28676833374385013, 'adx_thresh': 6.961461032637757, 'atr_min_pct': 0.02402631314262263, 'atr_max_pct': 0.13879851161112366, 'tp_mult': 2.688738338675109, 'tsl_mult': 0.0025871987575163333, 'strategy': 'breakout', 'time_stop': 170, 'use_sma': True, 'use_atr': False, 'use_adx': True, 'use_ema': False, 'use_spike': False, 'rsi_required': False, 'edge_k': 0.9689079886793504, 'edge_cap': 0.5170938517204531, 'bull_strategy': 'mean_reversion', 'bull_bb_std_mult': 0.7995340167812587, 'bull_rsi_os': 19, 'bull_rsi_ob': 61, 'bull_adx_thresh': 7.718497648409069, 'bull_atr_min_pct': 0.028860399619960973, 'bull_atr_max_pct': 0.09276824683162718, 'bull_tp_mult': 1.8910404357416166, 'bull_tsl_mult': 0.10748821181645807, 'bull_time_stop': 145, 'bull_use_sma': True, 'bull_use_ema': False, 'bull_use_atr': True, 'bull_use_adx': True, 'bull_use_spike': False, 'bull_rsi_required': True, 'bear_strategy': 'mean_reversion', 'bear_bb_std_mult': 3.5999291551077444, 'bear_rsi_os': 48, 'bear_rsi_ob': 49, 'bear_adx_thresh': 13.047283975175588, 'bear_atr_min_pct': 0.015084914631793215, 'bear_atr_max_pct': 0.06561015463006285, 'bear_tp_mult': 1.3354758329605918, 'bear_tsl_mult': 0.4037306973138437, 'bear_time_stop': 135, 'bear_use_sma': False, 'bear_use_ema': True, 'bear_use_atr': True, 'bear_use_adx': False, 'bear_use_spike': True, 'bear_rsi_required': False, 'sideways_strategy': 'breakout', 'sideways_bb_std_mult': 3.1988533275990423, 'sideways_rsi_os': 48, 'sideways_rsi_ob': 49, 'sideways_adx_thresh': 29.266376858577924, 'sideways_atr_min_pct': 0.000994131781548186, 'sideways_atr_max_pct': 0.06242767835520844, 'sideways_tp_mult': 1.35657353439651, 'sideways_tsl_mult': 0.9545723457119957, 'sideways_time_stop': 193, 'sideways_use_sma': False, 'sideways_use_ema': True, 'sideways_use_atr': False, 'sideways_use_adx': False, 'sideways_use_spike': False, 'sideways_rsi_required': False}.
[I 2025-09-01 09:49:14,283] Trial 314 finished with values: [-1000000000.0, 1000000000.0] and parameters: {'p_sma': 23, 'p_std': 42, 'p_atr': 30, 'p_adx': 18, 'rsi_period': 68, 'ema1': 20, 'ema2': 40, 'slip_atr_k': 0.046589624334906626, 'slip_spread_k': 0.22404859314886155, 'spread_hl_frac': 0.03243198273597984, 'bb_std_mult': 3.286594505427101, 'rsi_os': 22, 'rsi_ob': 73, 'vol_spike': 0.29960953729528017, 'adx_thresh': 6.597473779822175, 'atr_min_pct': 0.024016026540101185, 'atr_max_pct': 0.1407919517807791, 'tp_mult': 2.560973601846483, 'tsl_mult': 0.0431080984889758, 'strategy': 'breakout', 'time_stop': 179, 'use_sma': True, 'use_atr': False, 'use_adx': True, 'use_ema': False, 'use_spike': False, 'rsi_required': False, 'edge_k': 0.940117276099144, 'edge_cap': 0.6002347528814678, 'bull_strategy': 'mean_reversion', 'bull_bb_std_mult': 0.9137392336021449, 'bull_rsi_os': 16, 'bull_rsi_ob': 57, 'bull_adx_thresh': 8.611891765896656, 'bull_atr_min_pct': 0.027102083071810827, 'bull_atr_max_pct': 0.08767802384370756, 'bull_tp_mult': 1.8572168865765721, 'bull_tsl_mult': 0.13585351135110396, 'bull_time_stop': 150, 'bull_use_sma': True, 'bull_use_ema': False, 'bull_use_atr': True, 'bull_use_adx': True, 'bull_use_spike': False, 'bull_rsi_required': True, 'bear_strategy': 'mean_reversion', 'bear_bb_std_mult': 3.4423766755048963, 'bear_rsi_os': 48, 'bear_rsi_ob': 74, 'bear_adx_thresh': 12.452826500117709, 'bear_atr_min_pct': 0.0165323622820222, 'bear_atr_max_pct': 0.060779057205369295, 'bear_tp_mult': 1.3795193787441684, 'bear_tsl_mult': 0.4158067663531365, 'bear_time_stop': 142, 'bear_use_sma': False, 'bear_use_ema': True, 'bear_use_atr': True, 'bear_use_adx': False, 'bear_use_spike': True, 'bear_rsi_required': False, 'sideways_strategy': 'breakout', 'sideways_bb_std_mult': 3.2426021493164114, 'sideways_rsi_os': 49, 'sideways_rsi_ob': 46, 'sideways_adx_thresh': 27.575328305941554, 'sideways_atr_min_pct': 0.0037559305130138968, 'sideways_atr_max_pct': 0.0633734852207292, 'sideways_tp_mult': 1.3036258892720576, 'sideways_tsl_mult': 0.9009407823761193, 'sideways_time_stop': 166, 'sideways_use_sma': False, 'sideways_use_ema': True, 'sideways_use_atr': False, 'sideways_use_adx': False, 'sideways_use_spike': False, 'sideways_rsi_required': False}.
[I 2025-09-01 09:49:14,894] Trial 311 finished with values: [-0.012090030085623926, 0.012509591843302427] and parameters: {'p_sma': 23, 'p_std': 40, 'p_atr': 30, 'p_adx': 19, 'rsi_period': 68, 'ema1': 20, 'ema2': 39, 'slip_atr_k': 0.046019720649445935, 'slip_spread_k': 0.2214805059975586, 'spread_hl_frac': 0.030085164445034424, 'bb_std_mult': 3.3283734669151563, 'rsi_os': 19, 'rsi_ob': 76, 'vol_spike': 0.28713378193680283, 'adx_thresh': 6.775985942847691, 'atr_min_pct': 0.023774532254881037, 'atr_max_pct': 0.13953967335267684, 'tp_mult': 2.600514397694652, 'tsl_mult': 0.041862027902837294, 'strategy': 'breakout', 'time_stop': 176, 'use_sma': True, 'use_atr': False, 'use_adx': True, 'use_ema': False, 'use_spike': False, 'rsi_required': False, 'edge_k': 0.9683859925157385, 'edge_cap': 0.6157556331227172, 'bull_strategy': 'mean_reversion', 'bull_bb_std_mult': 0.7804215098584969, 'bull_rsi_os': 19, 'bull_rsi_ob': 60, 'bull_adx_thresh': 7.827998371156519, 'bull_atr_min_pct': 0.027246086896010387, 'bull_atr_max_pct': 0.08567996889804697, 'bull_tp_mult': 1.9213310667297245, 'bull_tsl_mult': 0.11883535714198551, 'bull_time_stop': 153, 'bull_use_sma': True, 'bull_use_ema': False, 'bull_use_atr': True, 'bull_use_adx': True, 'bull_use_spike': False, 'bull_rsi_required': True, 'bear_strategy': 'mean_reversion', 'bear_bb_std_mult': 3.5958347938214357, 'bear_rsi_os': 48, 'bear_rsi_ob': 45, 'bear_adx_thresh': 12.955273648336863, 'bear_atr_min_pct': 0.015000287435800123, 'bear_atr_max_pct': 0.06451903123365764, 'bear_tp_mult': 1.3546870273940887, 'bear_tsl_mult': 0.4048814185360655, 'bear_time_stop': 129, 'bear_use_sma': False, 'bear_use_ema': True, 'bear_use_atr': True, 'bear_use_adx': False, 'bear_use_spike': True, 'bear_rsi_required': False, 'sideways_strategy': 'breakout', 'sideways_bb_std_mult': 3.1937128763827785, 'sideways_rsi_os': 48, 'sideways_rsi_ob': 46, 'sideways_adx_thresh': 27.639127289756953, 'sideways_atr_min_pct': 0.0035262171772433523, 'sideways_atr_max_pct': 0.059676387466664274, 'sideways_tp_mult': 1.291921042640889, 'sideways_tsl_mult': 0.959927628463871, 'sideways_time_stop': 191, 'sideways_use_sma': False, 'sideways_use_ema': True, 'sideways_use_atr': False, 'sideways_use_adx': False, 'sideways_use_spike': False, 'sideways_rsi_required': False}.
[I 2025-09-01 09:49:15,370] Trial 312 finished with values: [-1000000000.0, 1000000000.0] and parameters: {'p_sma': 22, 'p_std': 38, 'p_atr': 30, 'p_adx': 19, 'rsi_period': 64, 'ema1': 20, 'ema2': 41, 'slip_atr_k': 0.04712074500906741, 'slip_spread_k': 0.1846449380520757, 'spread_hl_frac': 0.029756260520630275, 'bb_std_mult': 3.2685211480085052, 'rsi_os': 21, 'rsi_ob': 75, 'vol_spike': 0.29083127370257894, 'adx_thresh': 6.6399434930069905, 'atr_min_pct': 0.02371228754977367, 'atr_max_pct': 0.13970120910895414, 'tp_mult': 2.5665644820289364, 'tsl_mult': 0.0010069724623044674, 'strategy': 'breakout', 'time_stop': 158, 'use_sma': True, 'use_atr': False, 'use_adx': True, 'use_ema': False, 'use_spike': False, 'rsi_required': False, 'edge_k': 0.9573141821822202, 'edge_cap': 0.6099968150854268, 'bull_strategy': 'mean_reversion', 'bull_bb_std_mult': 0.8165452403189897, 'bull_rsi_os': 19, 'bull_rsi_ob': 61, 'bull_adx_thresh': 9.430018011439337, 'bull_atr_min_pct': 0.027370212799214973, 'bull_atr_max_pct': 0.09213248182329031, 'bull_tp_mult': 1.9260912099070637, 'bull_tsl_mult': 0.11023177557535373, 'bull_time_stop': 150, 'bull_use_sma': True, 'bull_use_ema': False, 'bull_use_atr': True, 'bull_use_adx': True, 'bull_use_spike': False, 'bull_rsi_required': True, 'bear_strategy': 'mean_reversion', 'bear_bb_std_mult': 3.4310498863341614, 'bear_rsi_os': 48, 'bear_rsi_ob': 50, 'bear_adx_thresh': 12.268286874006828, 'bear_atr_min_pct': 0.014047240498320145, 'bear_atr_max_pct': 0.06550941232869058, 'bear_tp_mult': 1.3611897532500796, 'bear_tsl_mult': 0.4150521940573323, 'bear_time_stop': 143, 'bear_use_sma': False, 'bear_use_ema': True, 'bear_use_atr': True, 'bear_use_adx': False, 'bear_use_spike': True, 'bear_rsi_required': False, 'sideways_strategy': 'breakout', 'sideways_bb_std_mult': 3.3802377892464364, 'sideways_rsi_os': 49, 'sideways_rsi_ob': 46, 'sideways_adx_thresh': 26.726813348875456, 'sideways_atr_min_pct': 0.0038524694697953566, 'sideways_atr_max_pct': 0.06390146333173172, 'sideways_tp_mult': 1.240562424665762, 'sideways_tsl_mult': 0.895949960613718, 'sideways_time_stop': 195, 'sideways_use_sma': False, 'sideways_use_ema': True, 'sideways_use_atr': False, 'sideways_use_adx': False, 'sideways_use_spike': False, 'sideways_rsi_required': False}.
[I 2025-09-01 09:49:15,685] Trial 313 finished with values: [-0.25680051746458443, 0.25659809923090976] and parameters: {'p_sma': 23, 'p_std': 38, 'p_atr': 30, 'p_adx': 19, 'rsi_period': 68, 'ema1': 20, 'ema2': 43, 'slip_atr_k': 0.04673665281798827, 'slip_spread_k': 0.2161937079782614, 'spread_hl_frac': 0.030405080982605356, 'bb_std_mult': 3.2419145949600288, 'rsi_os': 21, 'rsi_ob': 80, 'vol_spike': 0.29947161241620296, 'adx_thresh': 6.725036258675052, 'atr_min_pct': 0.02426646299119647, 'atr_max_pct': 0.1387022704352654, 'tp_mult': 2.568162326913371, 'tsl_mult': 0.03957783053572768, 'strategy': 'breakout', 'time_stop': 174, 'use_sma': True, 'use_atr': False, 'use_adx': True, 'use_ema': False, 'use_spike': False, 'rsi_required': False, 'edge_k': 0.9782968161803608, 'edge_cap': 0.6105643987169376, 'bull_strategy': 'mean_reversion', 'bull_bb_std_mult': 0.7894002430212897, 'bull_rsi_os': 19, 'bull_rsi_ob': 61, 'bull_adx_thresh': 8.422966650886485, 'bull_atr_min_pct': 0.027235412605238186, 'bull_atr_max_pct': 0.09438902539259561, 'bull_tp_mult': 1.881773732143696, 'bull_tsl_mult': 0.10636563217734728, 'bull_time_stop': 151, 'bull_use_sma': True, 'bull_use_ema': False, 'bull_use_atr': True, 'bull_use_adx': True, 'bull_use_spike': False, 'bull_rsi_required': True, 'bear_strategy': 'mean_reversion', 'bear_bb_std_mult': 3.42820855053949, 'bear_rsi_os': 48, 'bear_rsi_ob': 48, 'bear_adx_thresh': 12.2281648574707, 'bear_atr_min_pct': 0.012564263591950953, 'bear_atr_max_pct': 0.06004119310127639, 'bear_tp_mult': 2.4430421585787587, 'bear_tsl_mult': 0.4210539613591841, 'bear_time_stop': 134, 'bear_use_sma': False, 'bear_use_ema': True, 'bear_use_atr': True, 'bear_use_adx': False, 'bear_use_spike': True, 'bear_rsi_required': False, 'sideways_strategy': 'breakout', 'sideways_bb_std_mult': 3.390824626365401, 'sideways_rsi_os': 47, 'sideways_rsi_ob': 46, 'sideways_adx_thresh': 29.2846118077328, 'sideways_atr_min_pct': 0.000968180329516918, 'sideways_atr_max_pct': 0.06436950918603193, 'sideways_tp_mult': 1.2420909772584103, 'sideways_tsl_mult': 0.9454856223729046, 'sideways_time_stop': 196, 'sideways_use_sma': False, 'sideways_use_ema': True, 'sideways_use_atr': False, 'sideways_use_adx': False, 'sideways_use_spike': False, 'sideways_rsi_required': False}.
