[I 2025-09-01 09:43:33,217] Trial 279 finished with values: [-1000000000.0, 1000000000.0] and parameters: {'p_sma': 27, 'p_std': 15, 'p_atr': 30, 'p_adx': 14, 'rsi_period': 54, 'ema1': 21, 'ema2': 15, 'slip_atr_k': 0.04963738417411501, 'slip_spread_k': 0.4815914320631364, 'spread_hl_frac': 0.005841261820898138, 'bb_std_mult': 3.2934927388436894, 'rsi_os': 9, 'rsi_ob': 89, 'vol_spike': 0.05025020392373404, 'adx_thresh': 7.64051375593899, 'atr_min_pct': 0.02220805871737184, 'atr_max_pct': 0.034483418741823785, 'tp_mult': 1.7964889228323506, 'tsl_mult': 0.7063121510910336, 'strategy': 'mean_reversion', 'time_stop': 155, 'use_sma': True, 'use_atr': False, 'use_adx': True, 'use_ema': False, 'use_spike': False, 'rsi_required': True, 'edge_k': 1.5951722563317654, 'edge_cap': 0.07816824118410486, 'bull_strategy': 'mean_reversion', 'bull_bb_std_mult': 2.2378552946452013, 'bull_rsi_os': 34, 'bull_rsi_ob': 71, 'bull_adx_thresh': 8.753439021376503, 'bull_atr_min_pct': 0.02935612286607757, 'bull_atr_max_pct': 0.06443868991667034, 'bull_tp_mult': 1.3719936205149628, 'bull_tsl_mult': 0.22499868422059666, 'bull_time_stop': 135, 'bull_use_sma': True, 'bull_use_ema': False, 'bull_use_atr': False, 'bull_use_adx': False, 'bull_use_spike': False, 'bull_rsi_required': True, 'bear_strategy': 'mean_reversion', 'bear_bb_std_mult': 2.2579644335902076, 'bear_rsi_os': 46, 'bear_rsi_ob': 76, 'bear_adx_thresh': 13.347282248108764, 'bear_atr_min_pct': 0.013432535941846787, 'bear_atr_max_pct': 0.01097539563128326, 'bear_tp_mult': 2.120122762286093, 'bear_tsl_mult': 0.5284793299780873, 'bear_time_stop': 294, 'bear_use_sma': False, 'bear_use_ema': True, 'bear_use_atr': True, 'bear_use_adx': False, 'bear_use_spike': False, 'bear_rsi_required': False, 'sideways_strategy': 'breakout', 'sideways_bb_std_mult': 1.1973008003903374, 'sideways_rsi_os': 43, 'sideways_rsi_ob': 64, 'sideways_adx_thresh': 9.63093270740442, 'sideways_atr_min_pct': 0.028325684837468237, 'sideways_atr_max_pct': 0.06269324131469674, 'sideways_tp_mult': 1.8082734346105473, 'sideways_tsl_mult': 0.01647594319083473, 'sideways_time_stop': 17, 'sideways_use_sma': False, 'sideways_use_ema': True, 'sideways_use_atr': False, 'sideways_use_adx': False, 'sideways_use_spike': False, 'sideways_rsi_required': False}.
[I 2025-09-01 09:43:34,831] Trial 282 finished with values: [-0.14666323870334785, 0.14642874331238248] and parameters: {'p_sma': 22, 'p_std': 41, 'p_atr': 30, 'p_adx': 21, 'rsi_period': 63, 'ema1': 20, 'ema2': 39, 'slip_atr_k': 0.06209167438194703, 'slip_spread_k': 0.17405183283698328, 'spread_hl_frac': 0.03019187417693806, 'bb_std_mult': 3.3538686103342448, 'rsi_os': 21, 'rsi_ob': 76, 'vol_spike': 0.29325245161734775, 'adx_thresh': 8.804129521913516, 'atr_min_pct': 0.023729939139356056, 'atr_max_pct': 0.13005211596700367, 'tp_mult': 2.7632676705711123, 'tsl_mult': 0.002152070704189161, 'strategy': 'breakout', 'time_stop': 157, 'use_sma': True, 'use_atr': False, 'use_adx': True, 'use_ema': False, 'use_spike': False, 'rsi_required': False, 'edge_k': 0.9451888213004429, 'edge_cap': 0.5873313189452999, 'bull_strategy': 'mean_reversion', 'bull_bb_std_mult': 1.0796989524675966, 'bull_rsi_os': 16, 'bull_rsi_ob': 60, 'bull_adx_thresh': 8.884545148929963, 'bull_atr_min_pct': 0.026706851504488552, 'bull_atr_max_pct': 0.09194914214014584, 'bull_tp_mult': 1.8607854893585156, 'bull_tsl_mult': 0.04252717385765158, 'bull_time_stop': 166, 'bull_use_sma': True, 'bull_use_ema': False, 'bull_use_atr': True, 'bull_use_adx': True, 'bull_use_spike': False, 'bull_rsi_required': True, 'bear_strategy': 'mean_reversion', 'bear_bb_std_mult': 3.5912696143538514, 'bear_rsi_os': 50, 'bear_rsi_ob': 48, 'bear_adx_thresh': 14.681299692760826, 'bear_atr_min_pct': 0.01543095400039789, 'bear_atr_max_pct': 0.06831959572830137, 'bear_tp_mult': 1.3799370410892886, 'bear_tsl_mult': 0.37243152641355737, 'bear_time_stop': 137, 'bear_use_sma': False, 'bear_use_ema': True, 'bear_use_atr': True, 'bear_use_adx': False, 'bear_use_spike': True, 'bear_rsi_required': False, 'sideways_strategy': 'breakout', 'sideways_bb_std_mult': 3.1246533354455632, 'sideways_rsi_os': 48, 'sideways_rsi_ob': 49, 'sideways_adx_thresh': 28.111804896096103, 'sideways_atr_min_pct': 0.001472491852070232, 'sideways_atr_max_pct': 0.06478406052999257, 'sideways_tp_mult': 1.277869737104502, 'sideways_tsl_mult': 0.904454129337026, 'sideways_time_stop': 186, 'sideways_use_sma': False, 'sideways_use_ema': True, 'sideways_use_atr': False, 'sideways_use_adx': False, 'sideways_use_spike': False, 'sideways_rsi_required': False}.
[I 2025-09-01 09:43:35,119] Trial 281 finished with values: [-0.046559163989821406, 0.04684161948555962] and parameters: {'p_sma': 22, 'p_std': 41, 'p_atr': 30, 'p_adx': 21, 'rsi_period': 63, 'ema1': 20, 'ema2': 40, 'slip_atr_k': 0.06497818295081148, 'slip_spread_k': 0.176733097464076, 'spread_hl_frac': 0.02942199723234194, 'bb_std_mult': 3.302579399299403, 'rsi_os': 22, 'rsi_ob': 78, 'vol_spike': 0.2932019705739147, 'adx_thresh': 7.886334904391467, 'atr_min_pct': 0.023456289220204755, 'atr_max_pct': 0.1318357462245497, 'tp_mult': 2.588284806783696, 'tsl_mult': 0.00024891252343939643, 'strategy': 'breakout', 'time_stop': 158, 'use_sma': True, 'use_atr': False, 'use_adx': True, 'use_ema': False, 'use_spike': False, 'rsi_required': False, 'edge_k': 1.0052742888260322, 'edge_cap': 0.5896169384362205, 'bull_strategy': 'mean_reversion', 'bull_bb_std_mult': 0.9784708135917739, 'bull_rsi_os': 16, 'bull_rsi_ob': 60, 'bull_adx_thresh': 8.124842112637587, 'bull_atr_min_pct': 0.027345275045659766, 'bull_atr_max_pct': 0.09100276516799477, 'bull_tp_mult': 1.644651557207209, 'bull_tsl_mult': 0.04360198133244136, 'bull_time_stop': 157, 'bull_use_sma': True, 'bull_use_ema': False, 'bull_use_atr': True, 'bull_use_adx': True, 'bull_use_spike': False, 'bull_rsi_required': True, 'bear_strategy': 'mean_reversion', 'bear_bb_std_mult': 3.5741853347164203, 'bear_rsi_os': 51, 'bear_rsi_ob': 49, 'bear_adx_thresh': 15.495112033405796, 'bear_atr_min_pct': 0.013596382269018038, 'bear_atr_max_pct': 0.06696725332114882, 'bear_tp_mult': 1.2289525678752515, 'bear_tsl_mult': 0.37038240258082084, 'bear_time_stop': 142, 'bear_use_sma': False, 'bear_use_ema': True, 'bear_use_atr': True, 'bear_use_adx': False, 'bear_use_spike': True, 'bear_rsi_required': False, 'sideways_strategy': 'breakout', 'sideways_bb_std_mult': 3.395558477877936, 'sideways_rsi_os': 52, 'sideways_rsi_ob': 49, 'sideways_adx_thresh': 28.032858212883163, 'sideways_atr_min_pct': 0.0025466095477424213, 'sideways_atr_max_pct': 0.06389221585195132, 'sideways_tp_mult': 1.2707541679158698, 'sideways_tsl_mult': 0.8977157530609955, 'sideways_time_stop': 185, 'sideways_use_sma': False, 'sideways_use_ema': True, 'sideways_use_atr': False, 'sideways_use_adx': False, 'sideways_use_spike': False, 'sideways_rsi_required': False}.
[I 2025-09-01 09:43:35,484] Trial 280 finished with values: [-0.0858721334255853, 0.08566922699819661] and parameters: {'p_sma': 22, 'p_std': 41, 'p_atr': 30, 'p_adx': 21, 'rsi_period': 62, 'ema1': 20, 'ema2': 40, 'slip_atr_k': 0.05973292669392199, 'slip_spread_k': 0.16899895084447758, 'spread_hl_frac': 0.03036534920316446, 'bb_std_mult': 3.046248828903989, 'rsi_os': 22, 'rsi_ob': 76, 'vol_spike': 0.2906078379127704, 'adx_thresh': 8.227851327153763, 'atr_min_pct': 0.023134607016139515, 'atr_max_pct': 0.13175093735721555, 'tp_mult': 2.7538262540059324, 'tsl_mult': 0.002385792594340609, 'strategy': 'breakout', 'time_stop': 173, 'use_sma': True, 'use_atr': False, 'use_adx': True, 'use_ema': False, 'use_spike': False, 'rsi_required': False, 'edge_k': 0.970866686709958, 'edge_cap': 0.5930662406187776, 'bull_strategy': 'mean_reversion', 'bull_bb_std_mult': 0.9631009987496911, 'bull_rsi_os': 16, 'bull_rsi_ob': 60, 'bull_adx_thresh': 7.9912403489086525, 'bull_atr_min_pct': 0.026693289695276626, 'bull_atr_max_pct': 0.08952713954055588, 'bull_tp_mult': 1.660708170115821, 'bull_tsl_mult': 0.03962429459252718, 'bull_time_stop': 166, 'bull_use_sma': True, 'bull_use_ema': False, 'bull_use_atr': True, 'bull_use_adx': True, 'bull_use_spike': False, 'bull_rsi_required': True, 'bear_strategy': 'mean_reversion', 'bear_bb_std_mult': 3.585911250082895, 'bear_rsi_os': 51, 'bear_rsi_ob': 49, 'bear_adx_thresh': 15.696190221237442, 'bear_atr_min_pct': 0.015316568282216746, 'bear_atr_max_pct': 0.06527748716176567, 'bear_tp_mult': 1.4185464362818232, 'bear_tsl_mult': 0.3783337746303509, 'bear_time_stop': 140, 'bear_use_sma': False, 'bear_use_ema': True, 'bear_use_atr': True, 'bear_use_adx': False, 'bear_use_spike': True, 'bear_rsi_required': False, 'sideways_strategy': 'breakout', 'sideways_bb_std_mult': 3.004101468758153, 'sideways_rsi_os': 48, 'sideways_rsi_ob': 49, 'sideways_adx_thresh': 28.052815834291824, 'sideways_atr_min_pct': 0.0019458128783480472, 'sideways_atr_max_pct': 0.06369731628026348, 'sideways_tp_mult': 1.2513587347736495, 'sideways_tsl_mult': 0.9026666600650919, 'sideways_time_stop': 188, 'sideways_use_sma': False, 'sideways_use_ema': True, 'sideways_use_atr': False, 'sideways_use_adx': False, 'sideways_use_spike': False, 'sideways_rsi_required': False}.
[I 2025-09-01 09:44:15,847] Trial 285 finished with values: [-0.040336606210803594, 0.040203241328889396] and parameters: {'p_sma': 19, 'p_std': 42, 'p_atr': 30, 'p_adx': 22, 'rsi_period': 65, 'ema1': 19, 'ema2': 41, 'slip_atr_k': 0.05797347687267404, 'slip_spread_k': 0.1961660631634065, 'spread_hl_frac': 0.028314461807291007, 'bb_std_mult': 3.0680774435567786, 'rsi_os': 22, 'rsi_ob': 75, 'vol_spike': 0.28823235594323704, 'adx_thresh': 8.208314442100292, 'atr_min_pct': 0.024987953494301232, 'atr_max_pct': 0.13242401722714733, 'tp_mult': 2.7039090120719464, 'tsl_mult': 0.004816650461222148, 'strategy': 'breakout', 'time_stop': 163, 'use_sma': True, 'use_atr': False, 'use_adx': True, 'use_ema': False, 'use_spike': False, 'rsi_required': False, 'edge_k': 0.8372010925519384, 'edge_cap': 0.542684315328665, 'bull_strategy': 'mean_reversion', 'bull_bb_std_mult': 0.9273346988600016, 'bull_rsi_os': 18, 'bull_rsi_ob': 59, 'bull_adx_thresh': 8.029510858058307, 'bull_atr_min_pct': 0.028178367406575446, 'bull_atr_max_pct': 0.08209291873489057, 'bull_tp_mult': 1.6074746913789348, 'bull_tsl_mult': 0.015136547218538701, 'bull_time_stop': 168, 'bull_use_sma': True, 'bull_use_ema': False, 'bull_use_atr': True, 'bull_use_adx': True, 'bull_use_spike': False, 'bull_rsi_required': True, 'bear_strategy': 'mean_reversion', 'bear_bb_std_mult': 3.5242249898480424, 'bear_rsi_os': 51, 'bear_rsi_ob': 48, 'bear_adx_thresh': 15.972804408575033, 'bear_atr_min_pct': 0.014678577125878348, 'bear_atr_max_pct': 0.06496930784183165, 'bear_tp_mult': 1.2088774707347594, 'bear_tsl_mult': 0.3845248213708355, 'bear_time_stop': 147, 'bear_use_sma': False, 'bear_use_ema': True, 'bear_use_atr': True, 'bear_use_adx': False, 'bear_use_spike': True, 'bear_rsi_required': False, 'sideways_strategy': 'breakout', 'sideways_bb_std_mult': 3.029806030677137, 'sideways_rsi_os': 50, 'sideways_rsi_ob': 48, 'sideways_adx_thresh': 27.398401251122905, 'sideways_atr_min_pct': 0.0024550915851966645, 'sideways_atr_max_pct': 0.06675824306005762, 'sideways_tp_mult': 1.3432810824211845, 'sideways_tsl_mult': 0.8661896418183234, 'sideways_time_stop': 173, 'sideways_use_sma': False, 'sideways_use_ema': True, 'sideways_use_atr': False, 'sideways_use_adx': False, 'sideways_use_spike': False, 'sideways_rsi_required': False}.
[I 2025-09-01 09:44:16,420] Trial 284 finished with values: [-0.09829862477713702, 0.0980995093421777] and parameters: {'p_sma': 19, 'p_std': 40, 'p_atr': 29, 'p_adx': 22, 'rsi_period': 65, 'ema1': 19, 'ema2': 40, 'slip_atr_k': 0.05729661592018469, 'slip_spread_k': 0.19809217688855746, 'spread_hl_frac': 0.028623937386815426, 'bb_std_mult': 3.450771612507436, 'rsi_os': 23, 'rsi_ob': 75, 'vol_spike': 0.2879717002662414, 'adx_thresh': 8.332515104475675, 'atr_min_pct': 0.025203289079423458, 'atr_max_pct': 0.1335854211399888, 'tp_mult': 2.2458653571416805, 'tsl_mult': 0.008815689034620948, 'strategy': 'breakout', 'time_stop': 167, 'use_sma': True, 'use_atr': False, 'use_adx': True, 'use_ema': False, 'use_spike': False, 'rsi_required': False, 'edge_k': 1.0704956242812655, 'edge_cap': 0.564214805942393, 'bull_strategy': 'mean_reversion', 'bull_bb_std_mult': 0.9340821709075531, 'bull_rsi_os': 18, 'bull_rsi_ob': 59, 'bull_adx_thresh': 6.897665178538361, 'bull_atr_min_pct': 0.027984061522527845, 'bull_atr_max_pct': 0.08564135091026881, 'bull_tp_mult': 1.9306533740265215, 'bull_tsl_mult': 0.06715280474076384, 'bull_time_stop': 173, 'bull_use_sma': True, 'bull_use_ema': False, 'bull_use_atr': True, 'bull_use_adx': True, 'bull_use_spike': False, 'bull_rsi_required': True, 'bear_strategy': 'mean_reversion', 'bear_bb_std_mult': 3.533834605597768, 'bear_rsi_os': 50, 'bear_rsi_ob': 48, 'bear_adx_thresh': 15.760313560889095, 'bear_atr_min_pct': 0.014805350462292002, 'bear_atr_max_pct': 0.05844211871146568, 'bear_tp_mult': 1.190434081832865, 'bear_tsl_mult': 0.38128191388515775, 'bear_time_stop': 138, 'bear_use_sma': False, 'bear_use_ema': True, 'bear_use_atr': True, 'bear_use_adx': False, 'bear_use_spike': True, 'bear_rsi_required': False, 'sideways_strategy': 'breakout', 'sideways_bb_std_mult': 3.0416082923850176, 'sideways_rsi_os': 52, 'sideways_rsi_ob': 48, 'sideways_adx_thresh': 28.253922403137622, 'sideways_atr_min_pct': 0.001811472639233954, 'sideways_atr_max_pct': 0.06894733172543693, 'sideways_tp_mult': 1.3112988986137617, 'sideways_tsl_mult': 0.8693748336923881, 'sideways_time_stop': 190, 'sideways_use_sma': False, 'sideways_use_ema': True, 'sideways_use_atr': False, 'sideways_use_adx': False, 'sideways_use_spike': False, 'sideways_rsi_required': False}.
[I 2025-09-01 09:44:16,688] Trial 283 finished with values: [-0.11168532340058213, 0.11156015291233846] and parameters: {'p_sma': 22, 'p_std': 41, 'p_atr': 30, 'p_adx': 21, 'rsi_period': 62, 'ema1': 20, 'ema2': 40, 'slip_atr_k': 0.06412540031976557, 'slip_spread_k': 0.17993315508174, 'spread_hl_frac': 0.029504046645615248, 'bb_std_mult': 3.534825367721788, 'rsi_os': 22, 'rsi_ob': 74, 'vol_spike': 0.29627143122967, 'adx_thresh': 8.718011735581218, 'atr_min_pct': 0.02344283034872545, 'atr_max_pct': 0.12966779994157163, 'tp_mult': 2.5762392959818317, 'tsl_mult': 0.002476250820292768, 'strategy': 'breakout', 'time_stop': 162, 'use_sma': True, 'use_atr': False, 'use_adx': True, 'use_ema': False, 'use_spike': False, 'rsi_required': False, 'edge_k': 0.9645042926831029, 'edge_cap': 0.5448207666579316, 'bull_strategy': 'mean_reversion', 'bull_bb_std_mult': 0.9559554360950312, 'bull_rsi_os': 16, 'bull_rsi_ob': 59, 'bull_adx_thresh': 8.052189091704962, 'bull_atr_min_pct': 0.027167482079393644, 'bull_atr_max_pct': 0.09083835653121998, 'bull_tp_mult': 1.6022422511714567, 'bull_tsl_mult': 0.04132129107211913, 'bull_time_stop': 168, 'bull_use_sma': True, 'bull_use_ema': False, 'bull_use_atr': True, 'bull_use_adx': True, 'bull_use_spike': False, 'bull_rsi_required': True, 'bear_strategy': 'mean_reversion', 'bear_bb_std_mult': 3.599286738565077, 'bear_rsi_os': 51, 'bear_rsi_ob': 48, 'bear_adx_thresh': 14.238994093318023, 'bear_atr_min_pct': 0.015281108492925424, 'bear_atr_max_pct': 0.06801999396275586, 'bear_tp_mult': 1.221368967572867, 'bear_tsl_mult': 0.37237703788697335, 'bear_time_stop': 140, 'bear_use_sma': False, 'bear_use_ema': True, 'bear_use_atr': True, 'bear_use_adx': False, 'bear_use_spike': True, 'bear_rsi_required': False, 'sideways_strategy': 'breakout', 'sideways_bb_std_mult': 3.0602071360114826, 'sideways_rsi_os': 52, 'sideways_rsi_ob': 50, 'sideways_adx_thresh': 27.978070391914144, 'sideways_atr_min_pct': 0.0018188387512398834, 'sideways_atr_max_pct': 0.06572029184456339, 'sideways_tp_mult': 1.270511142457468, 'sideways_tsl_mult': 0.9044407482601332, 'sideways_time_stop': 187, 'sideways_use_sma': False, 'sideways_use_ema': True, 'sideways_use_atr': False, 'sideways_use_adx': False, 'sideways_use_spike': False, 'sideways_rsi_required': False}.
[I 2025-09-01 09:44:16,987] Trial 286 finished with values: [-0.028162211083324507, 0.02822810209839525] and parameters: {'p_sma': 18, 'p_std': 42, 'p_atr': 29, 'p_adx': 22, 'rsi_period': 66, 'ema1': 19, 'ema2': 41, 'slip_atr_k': 0.05347146276188566, 'slip_spread_k': 0.1948222048493466, 'spread_hl_frac': 0.028413535199398793, 'bb_std_mult': 3.534485359509893, 'rsi_os': 23, 'rsi_ob': 74, 'vol_spike': 0.2798375636166783, 'adx_thresh': 7.611278522191203, 'atr_min_pct': 0.024895801021997982, 'atr_max_pct': 0.13384057306627492, 'tp_mult': 2.9450400129681493, 'tsl_mult': 0.02060826303227123, 'strategy': 'breakout', 'time_stop': 164, 'use_sma': True, 'use_atr': False, 'use_adx': True, 'use_ema': False, 'use_spike': False, 'rsi_required': False, 'edge_k': 0.8415044003973399, 'edge_cap': 0.5656387794593737, 'bull_strategy': 'mean_reversion', 'bull_bb_std_mult': 0.9439289315464304, 'bull_rsi_os': 18, 'bull_rsi_ob': 58, 'bull_adx_thresh': 6.959390672019346, 'bull_atr_min_pct': 0.028021387850237865, 'bull_atr_max_pct': 0.07771624629684626, 'bull_tp_mult': 1.613052376052233, 'bull_tsl_mult': 0.06672205545283028, 'bull_time_stop': 178, 'bull_use_sma': True, 'bull_use_ema': False, 'bull_use_atr': True, 'bull_use_adx': True, 'bull_use_spike': False, 'bull_rsi_required': True, 'bear_strategy': 'mean_reversion', 'bear_bb_std_mult': 3.5157463453731155, 'bear_rsi_os': 50, 'bear_rsi_ob': 47, 'bear_adx_thresh': 13.832951711678112, 'bear_atr_min_pct': 0.014624332598746249, 'bear_atr_max_pct': 0.05763014120945348, 'bear_tp_mult': 1.2038487937304896, 'bear_tsl_mult': 0.3622381254013631, 'bear_time_stop': 150, 'bear_use_sma': False, 'bear_use_ema': True, 'bear_use_atr': True, 'bear_use_adx': False, 'bear_use_spike': True, 'bear_rsi_required': False, 'sideways_strategy': 'breakout', 'sideways_bb_std_mult': 3.299717192106188, 'sideways_rsi_os': 50, 'sideways_rsi_ob': 48, 'sideways_adx_thresh': 28.407495757220456, 'sideways_atr_min_pct': 0.0027718282787226487, 'sideways_atr_max_pct': 0.06728718110573699, 'sideways_tp_mult': 1.3179855014664692, 'sideways_tsl_mult': 0.8705928978612985, 'sideways_time_stop': 173, 'sideways_use_sma': False, 'sideways_use_ema': True, 'sideways_use_atr': False, 'sideways_use_adx': False, 'sideways_use_spike': False, 'sideways_rsi_required': False}.
[I 2025-09-01 09:44:59,684] Trial 288 finished with values: [-0.02281182504472512, 0.022538684747389497] and parameters: {'p_sma': 20, 'p_std': 43, 'p_atr': 29, 'p_adx': 23, 'rsi_period': 66, 'ema1': 21, 'ema2': 38, 'slip_atr_k': 0.052203316345694195, 'slip_spread_k': 0.19408030081025648, 'spread_hl_frac': 0.0291402741293589, 'bb_std_mult': 3.530157382350434, 'rsi_os': 20, 'rsi_ob': 77, 'vol_spike': 0.2790653634004368, 'adx_thresh': 7.475679452492848, 'atr_min_pct': 0.026191497443069246, 'atr_max_pct': 0.1283987543646081, 'tp_mult': 2.899294015175512, 'tsl_mult': 0.02626628118329002, 'strategy': 'breakout', 'time_stop': 148, 'use_sma': True, 'use_atr': False, 'use_adx': True, 'use_ema': False, 'use_spike': False, 'rsi_required': False, 'edge_k': 0.9971065337026569, 'edge_cap': 0.5092563858108442, 'bull_strategy': 'mean_reversion', 'bull_bb_std_mult': 0.8596120194700032, 'bull_rsi_os': 17, 'bull_rsi_ob': 58, 'bull_adx_thresh': 7.264021947851109, 'bull_atr_min_pct': 0.0275561278966915, 'bull_atr_max_pct': 0.07698393681227127, 'bull_tp_mult': 1.7487548637520511, 'bull_tsl_mult': 0.09256379552258268, 'bull_time_stop': 146, 'bull_use_sma': True, 'bull_use_ema': False, 'bull_use_atr': True, 'bull_use_adx': True, 'bull_use_spike': False, 'bull_rsi_required': True, 'bear_strategy': 'mean_reversion', 'bear_bb_std_mult': 3.596538284904198, 'bear_rsi_os': 50, 'bear_rsi_ob': 47, 'bear_adx_thresh': 13.827897443256543, 'bear_atr_min_pct': 0.015663409439118686, 'bear_atr_max_pct': 0.07090316647973507, 'bear_tp_mult': 1.318352310651837, 'bear_tsl_mult': 0.3429784593143132, 'bear_time_stop': 153, 'bear_use_sma': False, 'bear_use_ema': True, 'bear_use_atr': True, 'bear_use_adx': False, 'bear_use_spike': True, 'bear_rsi_required': False, 'sideways_strategy': 'breakout', 'sideways_bb_std_mult': 3.3021891244566786, 'sideways_rsi_os': 47, 'sideways_rsi_ob': 50, 'sideways_adx_thresh': 28.77646117464789, 'sideways_atr_min_pct': 0.0028879717109266683, 'sideways_atr_max_pct': 0.06659504257467001, 'sideways_tp_mult': 1.2110841850786411, 'sideways_tsl_mult': 0.9208177374314954, 'sideways_time_stop': 176, 'sideways_use_sma': False, 'sideways_use_ema': True, 'sideways_use_atr': False, 'sideways_use_adx': False, 'sideways_use_spike': False, 'sideways_rsi_required': False}.
