[I 2025-09-01 10:14:30,878] Trial 460 finished with values: [-0.039967542896884645, 0.03983165095268342] and parameters: {'p_sma': 56, 'p_std': 18, 'p_atr': 29, 'p_adx': 22, 'rsi_period': 68, 'ema1': 21, 'ema2': 24, 'slip_atr_k': 0.046019850152369285, 'slip_spread_k': 0.5905893881094727, 'spread_hl_frac': 0.036963405934761315, 'bb_std_mult': 3.0889175735847934, 'rsi_os': 23, 'rsi_ob': 77, 'vol_spike': 0.09399672906789336, 'adx_thresh': 16.9348114114644, 'atr_min_pct': 0.01039827291977823, 'atr_max_pct': 0.07432490377874412, 'tp_mult': 2.6404707028905934, 'tsl_mult': 0.9059735611410431, 'strategy': 'breakout', 'time_stop': 126, 'use_sma': True, 'use_atr': False, 'use_adx': True, 'use_ema': False, 'use_spike': False, 'rsi_required': False, 'edge_k': 1.3233241013228285, 'edge_cap': 0.5548598007654344, 'bull_strategy': 'mean_reversion', 'bull_bb_std_mult': 0.7246954193362296, 'bull_rsi_os': 17, 'bull_rsi_ob': 48, 'bull_adx_thresh': 26.056266947129345, 'bull_atr_min_pct': 0.028668218552967403, 'bull_atr_max_pct': 0.0876994662215636, 'bull_tp_mult': 2.6711121228221955, 'bull_tsl_mult': 0.5010764045460167, 'bull_time_stop': 154, 'bull_use_sma': True, 'bull_use_ema': True, 'bull_use_atr': True, 'bull_use_adx': True, 'bull_use_spike': False, 'bull_rsi_required': True, 'bear_strategy': 'mean_reversion', 'bear_bb_std_mult': 1.0927513088458753, 'bear_rsi_os': 51, 'bear_rsi_ob': 46, 'bear_adx_thresh': 24.00504357791511, 'bear_atr_min_pct': 0.02095973289907701, 'bear_atr_max_pct': 0.07419949757396066, 'bear_tp_mult': 1.3156488941836733, 'bear_tsl_mult': 0.384964705573649, 'bear_time_stop': 118, 'bear_use_sma': False, 'bear_use_ema': False, 'bear_use_atr': True, 'bear_use_adx': False, 'bear_use_spike': True, 'bear_rsi_required': False, 'sideways_strategy': 'breakout', 'sideways_bb_std_mult': 1.3800840724665284, 'sideways_rsi_os': 48, 'sideways_rsi_ob': 70, 'sideways_adx_thresh': 27.734602413655992, 'sideways_atr_min_pct': 0.0034043546852008666, 'sideways_atr_max_pct': 0.11095586424661141, 'sideways_tp_mult': 1.3047900547439217, 'sideways_tsl_mult': 0.8372590312791823, 'sideways_time_stop': 200, 'sideways_use_sma': False, 'sideways_use_ema': False, 'sideways_use_atr': False, 'sideways_use_adx': False, 'sideways_use_spike': False, 'sideways_rsi_required': False}.
[I 2025-09-01 10:14:31,749] Trial 459 finished with values: [-1000000000.0, 1000000000.0] and parameters: {'p_sma': 21, 'p_std': 45, 'p_atr': 29, 'p_adx': 23, 'rsi_period': 67, 'ema1': 20, 'ema2': 49, 'slip_atr_k': 0.045926470264815875, 'slip_spread_k': 0.5486441897795009, 'spread_hl_frac': 0.027565843604389115, 'bb_std_mult': 0.8865334768956328, 'rsi_os': 35, 'rsi_ob': 50, 'vol_spike': 0.012463225564259134, 'adx_thresh': 9.484376106946808, 'atr_min_pct': 0.0253333653428594, 'atr_max_pct': 0.08134630996150152, 'tp_mult': 2.6368624868703043, 'tsl_mult': 0.9025614707108993, 'strategy': 'breakout', 'time_stop': 300, 'use_sma': False, 'use_atr': False, 'use_adx': True, 'use_ema': False, 'use_spike': False, 'rsi_required': False, 'edge_k': 0.42834162065180514, 'edge_cap': 0.246308497254782, 'bull_strategy': 'mean_reversion', 'bull_bb_std_mult': 0.8182619932404455, 'bull_rsi_os': 34, 'bull_rsi_ob': 54, 'bull_adx_thresh': 31.494970240436217, 'bull_atr_min_pct': 0.013148132946745954, 'bull_atr_max_pct': 0.09140170847739522, 'bull_tp_mult': 1.2320356096049, 'bull_tsl_mult': 0.016790724706221893, 'bull_time_stop': 153, 'bull_use_sma': True, 'bull_use_ema': False, 'bull_use_atr': True, 'bull_use_adx': True, 'bull_use_spike': False, 'bull_rsi_required': True, 'bear_strategy': 'mean_reversion', 'bear_bb_std_mult': 3.4734674984571514, 'bear_rsi_os': 30, 'bear_rsi_ob': 46, 'bear_adx_thresh': 24.032217782876323, 'bear_atr_min_pct': 0.01732838464840157, 'bear_atr_max_pct': 0.06646135273715806, 'bear_tp_mult': 1.2976638296511187, 'bear_tsl_mult': 0.3872773061630533, 'bear_time_stop': 127, 'bear_use_sma': False, 'bear_use_ema': True, 'bear_use_atr': True, 'bear_use_adx': False, 'bear_use_spike': True, 'bear_rsi_required': False, 'sideways_strategy': 'breakout', 'sideways_bb_std_mult': 3.304788657303261, 'sideways_rsi_os': 23, 'sideways_rsi_ob': 82, 'sideways_adx_thresh': 28.141342125735378, 'sideways_atr_min_pct': 0.015057260884257751, 'sideways_atr_max_pct': 0.06994695907156165, 'sideways_tp_mult': 1.600798266419365, 'sideways_tsl_mult': 0.07873169270961661, 'sideways_time_stop': 148, 'sideways_use_sma': False, 'sideways_use_ema': True, 'sideways_use_atr': False, 'sideways_use_adx': False, 'sideways_use_spike': False, 'sideways_rsi_required': False}.
[I 2025-09-01 10:14:31,961] Trial 461 finished with values: [-1000000000.0, 1000000000.0] and parameters: {'p_sma': 21, 'p_std': 44, 'p_atr': 28, 'p_adx': 28, 'rsi_period': 73, 'ema1': 20, 'ema2': 49, 'slip_atr_k': 0.040667070096784795, 'slip_spread_k': 0.9530807127031911, 'spread_hl_frac': 0.03727899699724077, 'bb_std_mult': 3.0740452777929312, 'rsi_os': 19, 'rsi_ob': 76, 'vol_spike': 0.04429421912012786, 'adx_thresh': 9.395743056494542, 'atr_min_pct': 0.02541183243553612, 'atr_max_pct': 0.06003453393356063, 'tp_mult': 2.7226149048204475, 'tsl_mult': 0.5549222246129754, 'strategy': 'breakout', 'time_stop': 122, 'use_sma': True, 'use_atr': True, 'use_adx': True, 'use_ema': False, 'use_spike': False, 'rsi_required': False, 'edge_k': 0.9869696761234608, 'edge_cap': 0.16321172212062346, 'bull_strategy': 'mean_reversion', 'bull_bb_std_mult': 0.7201872900745137, 'bull_rsi_os': 21, 'bull_rsi_ob': 54, 'bull_adx_thresh': 29.827543456778574, 'bull_atr_min_pct': 0.018514572087633196, 'bull_atr_max_pct': 0.1273682521640721, 'bull_tp_mult': 1.8674153384053878, 'bull_tsl_mult': 0.07968580195365929, 'bull_time_stop': 154, 'bull_use_sma': True, 'bull_use_ema': False, 'bull_use_atr': True, 'bull_use_adx': True, 'bull_use_spike': False, 'bull_rsi_required': True, 'bear_strategy': 'mean_reversion', 'bear_bb_std_mult': 2.6535828767232723, 'bear_rsi_os': 50, 'bear_rsi_ob': 93, 'bear_adx_thresh': 28.856761220418534, 'bear_atr_min_pct': 0.016140262485201756, 'bear_atr_max_pct': 0.07397251192749693, 'bear_tp_mult': 1.3154112508087206, 'bear_tsl_mult': 0.5021136906669333, 'bear_time_stop': 130, 'bear_use_sma': True, 'bear_use_ema': True, 'bear_use_atr': True, 'bear_use_adx': False, 'bear_use_spike': True, 'bear_rsi_required': False, 'sideways_strategy': 'breakout', 'sideways_bb_std_mult': 3.086772331042434, 'sideways_rsi_os': 36, 'sideways_rsi_ob': 93, 'sideways_adx_thresh': 27.97739309175855, 'sideways_atr_min_pct': 0.0033856800483312507, 'sideways_atr_max_pct': 0.05934432451334472, 'sideways_tp_mult': 1.1651788128826617, 'sideways_tsl_mult': 0.08068724736841631, 'sideways_time_stop': 210, 'sideways_use_sma': False, 'sideways_use_ema': True, 'sideways_use_atr': False, 'sideways_use_adx': True, 'sideways_use_spike': False, 'sideways_rsi_required': True}.
[I 2025-09-01 10:14:31,969] Trial 462 finished with values: [-1000000000.0, 1000000000.0] and parameters: {'p_sma': 21, 'p_std': 19, 'p_atr': 30, 'p_adx': 22, 'rsi_period': 66, 'ema1': 20, 'ema2': 34, 'slip_atr_k': 0.06654497929940845, 'slip_spread_k': 0.755987611002165, 'spread_hl_frac': 0.03813800981515274, 'bb_std_mult': 3.0771037060445536, 'rsi_os': 23, 'rsi_ob': 76, 'vol_spike': 0.04516384481885487, 'adx_thresh': 12.85111402815356, 'atr_min_pct': 0.014685553673113486, 'atr_max_pct': 0.017698815068364383, 'tp_mult': 2.633175014885393, 'tsl_mult': 0.3816580719524608, 'strategy': 'mean_reversion', 'time_stop': 180, 'use_sma': True, 'use_atr': True, 'use_adx': False, 'use_ema': False, 'use_spike': False, 'rsi_required': False, 'edge_k': 1.2806275019670728, 'edge_cap': 0.5517404686668766, 'bull_strategy': 'mean_reversion', 'bull_bb_std_mult': 2.658857166806698, 'bull_rsi_os': 6, 'bull_rsi_ob': 85, 'bull_adx_thresh': 6.026477381834934, 'bull_atr_min_pct': 0.029347021883257093, 'bull_atr_max_pct': 0.08835330735923778, 'bull_tp_mult': 1.0858458142820364, 'bull_tsl_mult': 0.08643027179186857, 'bull_time_stop': 299, 'bull_use_sma': True, 'bull_use_ema': False, 'bull_use_atr': True, 'bull_use_adx': True, 'bull_use_spike': False, 'bull_rsi_required': True, 'bear_strategy': 'mean_reversion', 'bear_bb_std_mult': 2.4366800441118137, 'bear_rsi_os': 51, 'bear_rsi_ob': 60, 'bear_adx_thresh': 13.042423394655934, 'bear_atr_min_pct': 0.020711819400399324, 'bear_atr_max_pct': 0.033936681922259695, 'bear_tp_mult': 1.3263909684841628, 'bear_tsl_mult': 0.38267325569673744, 'bear_time_stop': 121, 'bear_use_sma': True, 'bear_use_ema': True, 'bear_use_atr': False, 'bear_use_adx': False, 'bear_use_spike': True, 'bear_rsi_required': False, 'sideways_strategy': 'breakout', 'sideways_bb_std_mult': 3.1229546290541212, 'sideways_rsi_os': 23, 'sideways_rsi_ob': 53, 'sideways_adx_thresh': 28.025233420816424, 'sideways_atr_min_pct': 0.01538126277824066, 'sideways_atr_max_pct': 0.06936275415752578, 'sideways_tp_mult': 2.7005788931430574, 'sideways_tsl_mult': 0.8035198923428446, 'sideways_time_stop': 73, 'sideways_use_sma': False, 'sideways_use_ema': True, 'sideways_use_atr': True, 'sideways_use_adx': True, 'sideways_use_spike': False, 'sideways_rsi_required': True}.
[I 2025-09-01 10:15:14,632] Trial 463 finished with values: [-1000000000.0, 1000000000.0] and parameters: {'p_sma': 21, 'p_std': 45, 'p_atr': 30, 'p_adx': 21, 'rsi_period': 65, 'ema1': 11, 'ema2': 49, 'slip_atr_k': 0.22329959860322313, 'slip_spread_k': 0.7471807226797489, 'spread_hl_frac': 0.02607489652597415, 'bb_std_mult': 1.354363041210933, 'rsi_os': 29, 'rsi_ob': 75, 'vol_spike': 0.1443712384407489, 'adx_thresh': 7.0087626908671465, 'atr_min_pct': 0.005444922118753914, 'atr_max_pct': 0.062444002338021845, 'tp_mult': 2.7006577542806394, 'tsl_mult': 0.04695845628002638, 'strategy': 'mean_reversion', 'time_stop': 177, 'use_sma': True, 'use_atr': True, 'use_adx': False, 'use_ema': False, 'use_spike': False, 'rsi_required': False, 'edge_k': 0.9916062000606718, 'edge_cap': 0.16542700545622263, 'bull_strategy': 'mean_reversion', 'bull_bb_std_mult': 0.8417576930620932, 'bull_rsi_os': 6, 'bull_rsi_ob': 54, 'bull_adx_thresh': 31.462278881431175, 'bull_atr_min_pct': 0.013394501210850314, 'bull_atr_max_pct': 0.03528725318442263, 'bull_tp_mult': 1.876063302958073, 'bull_tsl_mult': 0.7221734936941177, 'bull_time_stop': 170, 'bull_use_sma': False, 'bull_use_ema': False, 'bull_use_atr': True, 'bull_use_adx': True, 'bull_use_spike': False, 'bull_rsi_required': True, 'bear_strategy': 'mean_reversion', 'bear_bb_std_mult': 3.4208965134369373, 'bear_rsi_os': 32, 'bear_rsi_ob': 45, 'bear_adx_thresh': 21.895212709152876, 'bear_atr_min_pct': 0.01607553654525548, 'bear_atr_max_pct': 0.033466841742487145, 'bear_tp_mult': 1.1797158564209873, 'bear_tsl_mult': 0.9716080766572681, 'bear_time_stop': 150, 'bear_use_sma': True, 'bear_use_ema': True, 'bear_use_atr': False, 'bear_use_adx': False, 'bear_use_spike': True, 'bear_rsi_required': True, 'sideways_strategy': 'mean_reversion', 'sideways_bb_std_mult': 3.2331235129693296, 'sideways_rsi_os': 23, 'sideways_rsi_ob': 53, 'sideways_adx_thresh': 16.861304342185285, 'sideways_atr_min_pct': 0.015262015226268391, 'sideways_atr_max_pct': 0.06933736986092148, 'sideways_tp_mult': 2.0790068749336585, 'sideways_tsl_mult': 0.801404138607267, 'sideways_time_stop': 210, 'sideways_use_sma': False, 'sideways_use_ema': True, 'sideways_use_atr': True, 'sideways_use_adx': True, 'sideways_use_spike': False, 'sideways_rsi_required': True}.
[I 2025-09-01 10:15:16,286] Trial 466 finished with values: [-1000000000.0, 1000000000.0] and parameters: {'p_sma': 25, 'p_std': 45, 'p_atr': 30, 'p_adx': 10, 'rsi_period': 65, 'ema1': 21, 'ema2': 10, 'slip_atr_k': 0.1782292612256628, 'slip_spread_k': 0.2340240385249843, 'spread_hl_frac': 0.026731686922176052, 'bb_std_mult': 2.618832573067913, 'rsi_os': 5, 'rsi_ob': 71, 'vol_spike': 0.2797730252606173, 'adx_thresh': 6.852831616854387, 'atr_min_pct': 0.024012148755286015, 'atr_max_pct': 0.06982218802211539, 'tp_mult': 1.2078448329354405, 'tsl_mult': 0.042720656610265556, 'strategy': 'mean_reversion', 'time_stop': 163, 'use_sma': True, 'use_atr': False, 'use_adx': False, 'use_ema': False, 'use_spike': False, 'rsi_required': True, 'edge_k': 0.882433980365133, 'edge_cap': 0.627139446977141, 'bull_strategy': 'mean_reversion', 'bull_bb_std_mult': 3.0849266786363945, 'bull_rsi_os': 42, 'bull_rsi_ob': 45, 'bull_adx_thresh': 6.269060966896474, 'bull_atr_min_pct': 0.02997414387152043, 'bull_atr_max_pct': 0.08290060530065202, 'bull_tp_mult': 1.6520109347176164, 'bull_tsl_mult': 0.03442262731211767, 'bull_time_stop': 169, 'bull_use_sma': False, 'bull_use_ema': False, 'bull_use_atr': True, 'bull_use_adx': True, 'bull_use_spike': False, 'bull_rsi_required': True, 'bear_strategy': 'mean_reversion', 'bear_bb_std_mult': 1.3055535425410973, 'bear_rsi_os': 48, 'bear_rsi_ob': 85, 'bear_adx_thresh': 6.132913078306993, 'bear_atr_min_pct': 0.0063527785616032135, 'bear_atr_max_pct': 0.13639682449909957, 'bear_tp_mult': 1.184907202498505, 'bear_tsl_mult': 0.41937681407656424, 'bear_time_stop': 17, 'bear_use_sma': False, 'bear_use_ema': True, 'bear_use_atr': False, 'bear_use_adx': True, 'bear_use_spike': True, 'bear_rsi_required': True, 'sideways_strategy': 'mean_reversion', 'sideways_bb_std_mult': 3.4292129427951563, 'sideways_rsi_os': 49, 'sideways_rsi_ob': 51, 'sideways_adx_thresh': 26.994236576106868, 'sideways_atr_min_pct': 0.0014529754735729903, 'sideways_atr_max_pct': 0.14990263284810773, 'sideways_tp_mult': 1.4301543539314043, 'sideways_tsl_mult': 0.8359409619111908, 'sideways_time_stop': 195, 'sideways_use_sma': False, 'sideways_use_ema': True, 'sideways_use_atr': True, 'sideways_use_adx': False, 'sideways_use_spike': True, 'sideways_rsi_required': False}.
[I 2025-09-01 10:15:17,220] Trial 464 finished with values: [-1000000000.0, 1000000000.0] and parameters: {'p_sma': 45, 'p_std': 45, 'p_atr': 30, 'p_adx': 22, 'rsi_period': 65, 'ema1': 23, 'ema2': 42, 'slip_atr_k': 0.22326079518016756, 'slip_spread_k': 0.10889256789604373, 'spread_hl_frac': 0.040205259060011364, 'bb_std_mult': 3.2130101949886454, 'rsi_os': 33, 'rsi_ob': 78, 'vol_spike': 0.13893712467516148, 'adx_thresh': 7.08891340609649, 'atr_min_pct': 0.024114630309663935, 'atr_max_pct': 0.06792948947648271, 'tp_mult': 2.696068881649847, 'tsl_mult': 0.977923970884069, 'strategy': 'mean_reversion', 'time_stop': 164, 'use_sma': True, 'use_atr': False, 'use_adx': False, 'use_ema': False, 'use_spike': False, 'rsi_required': True, 'edge_k': 0.7855329810206868, 'edge_cap': 0.5856689442039208, 'bull_strategy': 'mean_reversion', 'bull_bb_std_mult': 2.3692619738231047, 'bull_rsi_os': 31, 'bull_rsi_ob': 68, 'bull_adx_thresh': 6.2022288433924775, 'bull_atr_min_pct': 0.017430958515020783, 'bull_atr_max_pct': 0.03479131131780125, 'bull_tp_mult': 1.899966004764518, 'bull_tsl_mult': 0.03514423605016288, 'bull_time_stop': 171, 'bull_use_sma': False, 'bull_use_ema': False, 'bull_use_atr': True, 'bull_use_adx': True, 'bull_use_spike': False, 'bull_rsi_required': True, 'bear_strategy': 'mean_reversion', 'bear_bb_std_mult': 3.169934409683466, 'bear_rsi_os': 34, 'bear_rsi_ob': 51, 'bear_adx_thresh': 15.094884362369514, 'bear_atr_min_pct': 0.016638248403656773, 'bear_atr_max_pct': 0.06964918322144621, 'bear_tp_mult': 2.6029978647574348, 'bear_tsl_mult': 0.4228464040829873, 'bear_time_stop': 142, 'bear_use_sma': False, 'bear_use_ema': True, 'bear_use_atr': False, 'bear_use_adx': True, 'bear_use_spike': True, 'bear_rsi_required': True, 'sideways_strategy': 'mean_reversion', 'sideways_bb_std_mult': 3.428159255770272, 'sideways_rsi_os': 49, 'sideways_rsi_ob': 63, 'sideways_adx_thresh': 16.82580348097222, 'sideways_atr_min_pct': 0.0013720449489131562, 'sideways_atr_max_pct': 0.05594418921991826, 'sideways_tp_mult': 1.0957118245858344, 'sideways_tsl_mult': 0.4585215167303572, 'sideways_time_stop': 195, 'sideways_use_sma': False, 'sideways_use_ema': True, 'sideways_use_atr': True, 'sideways_use_adx': False, 'sideways_use_spike': True, 'sideways_rsi_required': False}.
[I 2025-09-01 10:15:18,256] Trial 465 finished with values: [-1000000000.0, 1000000000.0] and parameters: {'p_sma': 19, 'p_std': 45, 'p_atr': 30, 'p_adx': 21, 'rsi_period': 65, 'ema1': 23, 'ema2': 56, 'slip_atr_k': 0.05558489350799359, 'slip_spread_k': 0.6246059474184686, 'spread_hl_frac': 0.04056027136281998, 'bb_std_mult': 1.3930225714758424, 'rsi_os': 5, 'rsi_ob': 75, 'vol_spike': 0.28090687355800814, 'adx_thresh': 6.995646881134459, 'atr_min_pct': 0.023914002472634237, 'atr_max_pct': 0.10850314957191874, 'tp_mult': 2.7055152586793296, 'tsl_mult': 0.2340879112807231, 'strategy': 'mean_reversion', 'time_stop': 163, 'use_sma': True, 'use_atr': False, 'use_adx': False, 'use_ema': False, 'use_spike': False, 'rsi_required': True, 'edge_k': 0.8879137210884838, 'edge_cap': 0.583887143151238, 'bull_strategy': 'mean_reversion', 'bull_bb_std_mult': 1.0445328277200694, 'bull_rsi_os': 42, 'bull_rsi_ob': 68, 'bull_adx_thresh': 18.21695556817899, 'bull_atr_min_pct': 0.029413735175502387, 'bull_atr_max_pct': 0.08060894494215513, 'bull_tp_mult': 1.8964456458963403, 'bull_tsl_mult': 0.0340781659941062, 'bull_time_stop': 169, 'bull_use_sma': False, 'bull_use_ema': False, 'bull_use_atr': True, 'bull_use_adx': True, 'bull_use_spike': False, 'bull_rsi_required': True, 'bear_strategy': 'mean_reversion', 'bear_bb_std_mult': 1.0051720814202825, 'bear_rsi_os': 46, 'bear_rsi_ob': 62, 'bear_adx_thresh': 13.939404837295774, 'bear_atr_min_pct': 0.0051166961291615395, 'bear_atr_max_pct': 0.04123871260200243, 'bear_tp_mult': 1.193638069466858, 'bear_tsl_mult': 0.423335697239549, 'bear_time_stop': 142, 'bear_use_sma': False, 'bear_use_ema': True, 'bear_use_atr': False, 'bear_use_adx': True, 'bear_use_spike': True, 'bear_rsi_required': True, 'sideways_strategy': 'mean_reversion', 'sideways_bb_std_mult': 3.2259153652404624, 'sideways_rsi_os': 49, 'sideways_rsi_ob': 63, 'sideways_adx_thresh': 16.98554406962329, 'sideways_atr_min_pct': 0.0015695259300410962, 'sideways_atr_max_pct': 0.14953505076038365, 'sideways_tp_mult': 1.4331102844504964, 'sideways_tsl_mult': 0.4459610383559559, 'sideways_time_stop': 193, 'sideways_use_sma': False, 'sideways_use_ema': True, 'sideways_use_atr': True, 'sideways_use_adx': False, 'sideways_use_spike': True, 'sideways_rsi_required': False}.
[I 2025-09-01 10:15:59,308] Trial 469 finished with values: [-0.06175307789501894, 0.06335221026339864] and parameters: {'p_sma': 18, 'p_std': 44, 'p_atr': 29, 'p_adx': 21, 'rsi_period': 47, 'ema1': 22, 'ema2': 45, 'slip_atr_k': 0.03488548124048593, 'slip_spread_k': 0.17621189039659463, 'spread_hl_frac': 0.03057484691218825, 'bb_std_mult': 3.216036264202222, 'rsi_os': 21, 'rsi_ob': 78, 'vol_spike': 0.2879296289719974, 'adx_thresh': 34.9659271837275, 'atr_min_pct': 0.02468809697943352, 'atr_max_pct': 0.04638586916314037, 'tp_mult': 2.775694227061414, 'tsl_mult': 0.08462388248538727, 'strategy': 'breakout', 'time_stop': 154, 'use_sma': True, 'use_atr': False, 'use_adx': True, 'use_ema': True, 'use_spike': True, 'rsi_required': False, 'edge_k': 0.9266047385811905, 'edge_cap': 0.5638695848849734, 'bull_strategy': 'breakout', 'bull_bb_std_mult': 2.9680717083919363, 'bull_rsi_os': 20, 'bull_rsi_ob': 57, 'bull_adx_thresh': 33.00380680619986, 'bull_atr_min_pct': 0.0055431900042116535, 'bull_atr_max_pct': 0.08717633262894935, 'bull_tp_mult': 1.5640828556527622, 'bull_tsl_mult': 0.37284729175255005, 'bull_time_stop': 159, 'bull_use_sma': True, 'bull_use_ema': True, 'bull_use_atr': True, 'bull_use_adx': True, 'bull_use_spike': True, 'bull_rsi_required': False, 'bear_strategy': 'breakout', 'bear_bb_std_mult': 2.9266094471296498, 'bear_rsi_os': 46, 'bear_rsi_ob': 45, 'bear_adx_thresh': 12.838558419366887, 'bear_atr_min_pct': 0.0036148639721094254, 'bear_atr_max_pct': 0.040994447253675285, 'bear_tp_mult': 1.5244834983792264, 'bear_tsl_mult': 0.44907821360047473, 'bear_time_stop': 139, 'bear_use_sma': False, 'bear_use_ema': False, 'bear_use_atr': True, 'bear_use_adx': False, 'bear_use_spike': True, 'bear_rsi_required': False, 'sideways_strategy': 'breakout', 'sideways_bb_std_mult': 2.584460588552121, 'sideways_rsi_os': 17, 'sideways_rsi_ob': 55, 'sideways_adx_thresh': 25.296416025195533, 'sideways_atr_min_pct': 0.01761661678865313, 'sideways_atr_max_pct': 0.038355652391329965, 'sideways_tp_mult': 1.3106646666661215, 'sideways_tsl_mult': 0.8492649200616146, 'sideways_time_stop': 205, 'sideways_use_sma': True, 'sideways_use_ema': False, 'sideways_use_atr': False, 'sideways_use_adx': False, 'sideways_use_spike': False, 'sideways_rsi_required': False}.
