[I 2025-09-01 09:25:57,736] Trial 172 finished with values: [-1000000000.0, 1000000000.0] and parameters: {'p_sma': 29, 'p_std': 25, 'p_atr': 17, 'p_adx': 14, 'rsi_period': 59, 'ema1': 20, 'ema2': 26, 'slip_atr_k': 0.04193574487354371, 'slip_spread_k': 0.2913861909102782, 'spread_hl_frac': 0.037389340804369786, 'bb_std_mult': 1.7295777457118082, 'rsi_os': 17, 'rsi_ob': 53, 'vol_spike': 0.07794113376989642, 'adx_thresh': 6.098557334991268, 'atr_min_pct': 0.011210536162301889, 'atr_max_pct': 0.12454417328674339, 'tp_mult': 1.898787499285369, 'tsl_mult': 0.07003926581242836, 'strategy': 'mean_reversion', 'time_stop': 207, 'use_sma': True, 'use_atr': True, 'use_adx': False, 'use_ema': False, 'use_spike': False, 'rsi_required': False, 'edge_k': 1.6241177234653654, 'edge_cap': 0.1234814831671871, 'bull_strategy': 'mean_reversion', 'bull_bb_std_mult': 1.1596110314862489, 'bull_rsi_os': 26, 'bull_rsi_ob': 78, 'bull_adx_thresh': 6.556866553502994, 'bull_atr_min_pct': 0.006498095674291642, 'bull_atr_max_pct': 0.1497297456048564, 'bull_tp_mult': 2.0467967522201906, 'bull_tsl_mult': 0.4987447250546118, 'bull_time_stop': 132, 'bull_use_sma': True, 'bull_use_ema': False, 'bull_use_atr': False, 'bull_use_adx': False, 'bull_use_spike': False, 'bull_rsi_required': True, 'bear_strategy': 'mean_reversion', 'bear_bb_std_mult': 1.8305939516959606, 'bear_rsi_os': 47, 'bear_rsi_ob': 69, 'bear_adx_thresh': 26.108888117292732, 'bear_atr_min_pct': 0.005271349432196204, 'bear_atr_max_pct': 0.1191464797420148, 'bear_tp_mult': 1.557416521175535, 'bear_tsl_mult': 0.885286250094019, 'bear_time_stop': 217, 'bear_use_sma': False, 'bear_use_ema': True, 'bear_use_atr': False, 'bear_use_adx': False, 'bear_use_spike': True, 'bear_rsi_required': False, 'sideways_strategy': 'mean_reversion', 'sideways_bb_std_mult': 0.8075013291422254, 'sideways_rsi_os': 40, 'sideways_rsi_ob': 54, 'sideways_adx_thresh': 7.996722247432293, 'sideways_atr_min_pct': 0.009421193337662444, 'sideways_atr_max_pct': 0.09989952026014279, 'sideways_tp_mult': 1.0910833064560768, 'sideways_tsl_mult': 0.9505444797878521, 'sideways_time_stop': 209, 'sideways_use_sma': False, 'sideways_use_ema': True, 'sideways_use_atr': True, 'sideways_use_adx': False, 'sideways_use_spike': False, 'sideways_rsi_required': False}.
[I 2025-09-01 09:25:57,763] Trial 170 finished with values: [-0.04231575966045453, 0.042074013165752225] and parameters: {'p_sma': 29, 'p_std': 25, 'p_atr': 28, 'p_adx': 14, 'rsi_period': 63, 'ema1': 20, 'ema2': 56, 'slip_atr_k': 0.05004084286743392, 'slip_spread_k': 0.08463516971782753, 'spread_hl_frac': 0.040342528990398654, 'bb_std_mult': 1.733670292964774, 'rsi_os': 38, 'rsi_ob': 52, 'vol_spike': 0.2216983957494461, 'adx_thresh': 6.896935643094333, 'atr_min_pct': 0.02174099058713377, 'atr_max_pct': 0.042732709786621415, 'tp_mult': 1.8843066943413596, 'tsl_mult': 0.020987286676137362, 'strategy': 'mean_reversion', 'time_stop': 198, 'use_sma': True, 'use_atr': False, 'use_adx': False, 'use_ema': False, 'use_spike': True, 'rsi_required': False, 'edge_k': 1.6464056843758212, 'edge_cap': 0.5481620689982478, 'bull_strategy': 'mean_reversion', 'bull_bb_std_mult': 0.7239746995770678, 'bull_rsi_os': 14, 'bull_rsi_ob': 60, 'bull_adx_thresh': 11.419469044566046, 'bull_atr_min_pct': 0.0030864370996485264, 'bull_atr_max_pct': 0.14861559830068272, 'bull_tp_mult': 2.048193763758576, 'bull_tsl_mult': 0.05586096998711093, 'bull_time_stop': 129, 'bull_use_sma': True, 'bull_use_ema': False, 'bull_use_atr': False, 'bull_use_adx': False, 'bull_use_spike': False, 'bull_rsi_required': True, 'bear_strategy': 'mean_reversion', 'bear_bb_std_mult': 3.558404720245573, 'bear_rsi_os': 20, 'bear_rsi_ob': 68, 'bear_adx_thresh': 13.15405774513209, 'bear_atr_min_pct': 0.0035470917555274224, 'bear_atr_max_pct': 0.12549609395635317, 'bear_tp_mult': 2.5878229453665904, 'bear_tsl_mult': 0.26280179273980675, 'bear_time_stop': 114, 'bear_use_sma': False, 'bear_use_ema': True, 'bear_use_atr': False, 'bear_use_adx': False, 'bear_use_spike': False, 'bear_rsi_required': False, 'sideways_strategy': 'breakout', 'sideways_bb_std_mult': 1.4006066652067266, 'sideways_rsi_os': 38, 'sideways_rsi_ob': 47, 'sideways_adx_thresh': 19.92841441146336, 'sideways_atr_min_pct': 0.009245251880608183, 'sideways_atr_max_pct': 0.05186869119146531, 'sideways_tp_mult': 2.3098797935703335, 'sideways_tsl_mult': 0.9203969209575906, 'sideways_time_stop': 206, 'sideways_use_sma': False, 'sideways_use_ema': True, 'sideways_use_atr': True, 'sideways_use_adx': False, 'sideways_use_spike': False, 'sideways_rsi_required': False}.
[I 2025-09-01 09:25:57,969] Trial 171 finished with values: [-1000000000.0, 1000000000.0] and parameters: {'p_sma': 29, 'p_std': 30, 'p_atr': 17, 'p_adx': 14, 'rsi_period': 81, 'ema1': 20, 'ema2': 35, 'slip_atr_k': 0.04110737760487252, 'slip_spread_k': 0.4762757084203158, 'spread_hl_frac': 0.00019430322029741903, 'bb_std_mult': 1.73202880637525, 'rsi_os': 29, 'rsi_ob': 62, 'vol_spike': 0.2335343169144349, 'adx_thresh': 6.284169918177428, 'atr_min_pct': 0.001500909656784866, 'atr_max_pct': 0.14521708037724523, 'tp_mult': 1.8866956277123217, 'tsl_mult': 0.7948826761474956, 'strategy': 'mean_reversion', 'time_stop': 210, 'use_sma': True, 'use_atr': True, 'use_adx': False, 'use_ema': False, 'use_spike': False, 'rsi_required': False, 'edge_k': 1.623854564496814, 'edge_cap': 0.13414155944819117, 'bull_strategy': 'mean_reversion', 'bull_bb_std_mult': 0.7180933306506986, 'bull_rsi_os': 15, 'bull_rsi_ob': 47, 'bull_adx_thresh': 10.18345662177166, 'bull_atr_min_pct': 0.016739014049455242, 'bull_atr_max_pct': 0.05958139444486793, 'bull_tp_mult': 1.0744785058745752, 'bull_tsl_mult': 0.10506830302839647, 'bull_time_stop': 129, 'bull_use_sma': True, 'bull_use_ema': False, 'bull_use_atr': False, 'bull_use_adx': False, 'bull_use_spike': False, 'bull_rsi_required': True, 'bear_strategy': 'mean_reversion', 'bear_bb_std_mult': 3.5517806584438336, 'bear_rsi_os': 18, 'bear_rsi_ob': 69, 'bear_adx_thresh': 13.514033867895709, 'bear_atr_min_pct': 0.01609520466785402, 'bear_atr_max_pct': 0.09924624751428847, 'bear_tp_mult': 2.669225356520434, 'bear_tsl_mult': 0.7706945482708218, 'bear_time_stop': 216, 'bear_use_sma': False, 'bear_use_ema': True, 'bear_use_atr': False, 'bear_use_adx': False, 'bear_use_spike': True, 'bear_rsi_required': False, 'sideways_strategy': 'breakout', 'sideways_bb_std_mult': 1.198961544860402, 'sideways_rsi_os': 42, 'sideways_rsi_ob': 48, 'sideways_adx_thresh': 29.219519962027494, 'sideways_atr_min_pct': 0.00693068008675992, 'sideways_atr_max_pct': 0.12210792907710681, 'sideways_tp_mult': 1.7030144903511093, 'sideways_tsl_mult': 0.9138890751545048, 'sideways_time_stop': 209, 'sideways_use_sma': False, 'sideways_use_ema': True, 'sideways_use_atr': True, 'sideways_use_adx': False, 'sideways_use_spike': False, 'sideways_rsi_required': False}.
[I 2025-09-01 09:26:37,859] Trial 176 finished with values: [-1000000000.0, 1000000000.0] and parameters: {'p_sma': 42, 'p_std': 30, 'p_atr': 16, 'p_adx': 13, 'rsi_period': 65, 'ema1': 21, 'ema2': 16, 'slip_atr_k': 0.13453787981625986, 'slip_spread_k': 0.3401391214601842, 'spread_hl_frac': 0.013251091233792835, 'bb_std_mult': 2.443933713074207, 'rsi_os': 29, 'rsi_ob': 90, 'vol_spike': 0.16365244304479865, 'adx_thresh': 9.280108690636856, 'atr_min_pct': 0.002843480425901178, 'atr_max_pct': 0.1478325384338693, 'tp_mult': 1.7982700465408872, 'tsl_mult': 0.3213831047083575, 'strategy': 'breakout', 'time_stop': 192, 'use_sma': False, 'use_atr': False, 'use_adx': True, 'use_ema': False, 'use_spike': False, 'rsi_required': True, 'edge_k': 1.7197315526666994, 'edge_cap': 0.1378560464679533, 'bull_strategy': 'breakout', 'bull_bb_std_mult': 0.6001481554339623, 'bull_rsi_os': 17, 'bull_rsi_ob': 47, 'bull_adx_thresh': 8.837367440566265, 'bull_atr_min_pct': 0.029267391881985367, 'bull_atr_max_pct': 0.06516303603207016, 'bull_tp_mult': 1.0453975583770034, 'bull_tsl_mult': 0.10629459062466634, 'bull_time_stop': 113, 'bull_use_sma': True, 'bull_use_ema': True, 'bull_use_atr': False, 'bull_use_adx': False, 'bull_use_spike': True, 'bull_rsi_required': False, 'bear_strategy': 'breakout', 'bear_bb_std_mult': 3.4717157301554917, 'bear_rsi_os': 49, 'bear_rsi_ob': 66, 'bear_adx_thresh': 12.554106251955066, 'bear_atr_min_pct': 0.014891288734530321, 'bear_atr_max_pct': 0.11745384453962596, 'bear_tp_mult': 2.0717927146248787, 'bear_tsl_mult': 0.7677792156694174, 'bear_time_stop': 207, 'bear_use_sma': False, 'bear_use_ema': False, 'bear_use_atr': True, 'bear_use_adx': True, 'bear_use_spike': False, 'bear_rsi_required': True, 'sideways_strategy': 'breakout', 'sideways_bb_std_mult': 0.9426499524031728, 'sideways_rsi_os': 42, 'sideways_rsi_ob': 79, 'sideways_adx_thresh': 29.856155904929246, 'sideways_atr_min_pct': 0.010422885185529734, 'sideways_atr_max_pct': 0.045204700981638604, 'sideways_tp_mult': 1.7237606093659086, 'sideways_tsl_mult': 0.2639721435964342, 'sideways_time_stop': 275, 'sideways_use_sma': False, 'sideways_use_ema': False, 'sideways_use_atr': False, 'sideways_use_adx': False, 'sideways_use_spike': False, 'sideways_rsi_required': False}.
[I 2025-09-01 09:26:39,376] Trial 177 finished with values: [-1000000000.0, 1000000000.0] and parameters: {'p_sma': 27, 'p_std': 41, 'p_atr': 9, 'p_adx': 12, 'rsi_period': 67, 'ema1': 19, 'ema2': 16, 'slip_atr_k': 0.019879254024528968, 'slip_spread_k': 0.3431126509103155, 'spread_hl_frac': 0.013480513787391821, 'bb_std_mult': 2.4478397724881034, 'rsi_os': 46, 'rsi_ob': 90, 'vol_spike': 0.1419665893025071, 'adx_thresh': 9.455246829857927, 'atr_min_pct': 0.02024472734445692, 'atr_max_pct': 0.13690410267414116, 'tp_mult': 1.7885322707704432, 'tsl_mult': 0.021591385242282227, 'strategy': 'breakout', 'time_stop': 192, 'use_sma': False, 'use_atr': False, 'use_adx': True, 'use_ema': False, 'use_spike': False, 'rsi_required': True, 'edge_k': 1.345234735568333, 'edge_cap': 0.08766708691082757, 'bull_strategy': 'breakout', 'bull_bb_std_mult': 1.03707429451416, 'bull_rsi_os': 21, 'bull_rsi_ob': 66, 'bull_adx_thresh': 9.41250554488388, 'bull_atr_min_pct': 0.028855027290246166, 'bull_atr_max_pct': 0.06454222780940691, 'bull_tp_mult': 1.3755670730116845, 'bull_tsl_mult': 0.039717287614468855, 'bull_time_stop': 65, 'bull_use_sma': True, 'bull_use_ema': True, 'bull_use_atr': False, 'bull_use_adx': False, 'bull_use_spike': True, 'bull_rsi_required': False, 'bear_strategy': 'breakout', 'bear_bb_std_mult': 2.533242952013916, 'bear_rsi_os': 45, 'bear_rsi_ob': 66, 'bear_adx_thresh': 34.65765060543096, 'bear_atr_min_pct': 0.025138606479318676, 'bear_atr_max_pct': 0.12132054145685973, 'bear_tp_mult': 1.1630287406915625, 'bear_tsl_mult': 0.5146169542600704, 'bear_time_stop': 206, 'bear_use_sma': False, 'bear_use_ema': False, 'bear_use_atr': True, 'bear_use_adx': True, 'bear_use_spike': False, 'bear_rsi_required': True, 'sideways_strategy': 'breakout', 'sideways_bb_std_mult': 0.9452698992572259, 'sideways_rsi_os': 41, 'sideways_rsi_ob': 79, 'sideways_adx_thresh': 12.96157151993333, 'sideways_atr_min_pct': 0.01048343247288139, 'sideways_atr_max_pct': 0.06944568000901055, 'sideways_tp_mult': 1.7464040277384147, 'sideways_tsl_mult': 0.6821705748071094, 'sideways_time_stop': 277, 'sideways_use_sma': True, 'sideways_use_ema': False, 'sideways_use_atr': False, 'sideways_use_adx': False, 'sideways_use_spike': False, 'sideways_rsi_required': False}.
[I 2025-09-01 09:26:39,838] Trial 175 finished with values: [-0.1305733193638282, 0.13037153004586574] and parameters: {'p_sma': 42, 'p_std': 23, 'p_atr': 9, 'p_adx': 12, 'rsi_period': 67, 'ema1': 21, 'ema2': 16, 'slip_atr_k': 0.21707117739764276, 'slip_spread_k': 0.30974966597101494, 'spread_hl_frac': 0.046125319883423194, 'bb_std_mult': 3.3381804993917115, 'rsi_os': 46, 'rsi_ob': 65, 'vol_spike': 0.22192181841698932, 'adx_thresh': 13.952884487570564, 'atr_min_pct': 0.02043191069697679, 'atr_max_pct': 0.14471110234287424, 'tp_mult': 2.272081333895238, 'tsl_mult': 0.018723173183862078, 'strategy': 'breakout', 'time_stop': 202, 'use_sma': False, 'use_atr': False, 'use_adx': True, 'use_ema': False, 'use_spike': False, 'rsi_required': False, 'edge_k': 1.414020815756932, 'edge_cap': 0.13876427688751847, 'bull_strategy': 'mean_reversion', 'bull_bb_std_mult': 0.6177204045405399, 'bull_rsi_os': 5, 'bull_rsi_ob': 84, 'bull_adx_thresh': 7.857295027610454, 'bull_atr_min_pct': 0.0032053267057105157, 'bull_atr_max_pct': 0.06517048970749328, 'bull_tp_mult': 1.0687120860617427, 'bull_tsl_mult': 0.10548145337912967, 'bull_time_stop': 65, 'bull_use_sma': True, 'bull_use_ema': False, 'bull_use_atr': False, 'bull_use_adx': False, 'bull_use_spike': False, 'bull_rsi_required': False, 'bear_strategy': 'mean_reversion', 'bear_bb_std_mult': 3.5921141404140386, 'bear_rsi_os': 5, 'bear_rsi_ob': 67, 'bear_adx_thresh': 13.545765117004938, 'bear_atr_min_pct': 0.014849263241317861, 'bear_atr_max_pct': 0.015843322250672295, 'bear_tp_mult': 2.0673332063532017, 'bear_tsl_mult': 0.7656792704717319, 'bear_time_stop': 209, 'bear_use_sma': False, 'bear_use_ema': False, 'bear_use_atr': True, 'bear_use_adx': False, 'bear_use_spike': False, 'bear_rsi_required': False, 'sideways_strategy': 'breakout', 'sideways_bb_std_mult': 1.1541483426534662, 'sideways_rsi_os': 41, 'sideways_rsi_ob': 48, 'sideways_adx_thresh': 29.188142098605972, 'sideways_atr_min_pct': 0.010662301619242366, 'sideways_atr_max_pct': 0.14326238304988437, 'sideways_tp_mult': 1.7079611780284674, 'sideways_tsl_mult': 0.5868418816015583, 'sideways_time_stop': 153, 'sideways_use_sma': False, 'sideways_use_ema': True, 'sideways_use_atr': False, 'sideways_use_adx': False, 'sideways_use_spike': False, 'sideways_rsi_required': False}.
[I 2025-09-01 09:26:40,207] Trial 174 finished with values: [-1000000000.0, 1000000000.0] and parameters: {'p_sma': 28, 'p_std': 30, 'p_atr': 17, 'p_adx': 12, 'rsi_period': 66, 'ema1': 20, 'ema2': 26, 'slip_atr_k': 0.10880508736453735, 'slip_spread_k': 0.7321758702113755, 'spread_hl_frac': 0.013598578058011138, 'bb_std_mult': 1.7277162986783843, 'rsi_os': 14, 'rsi_ob': 90, 'vol_spike': 0.22338018543158103, 'adx_thresh': 6.0730631642944815, 'atr_min_pct': 0.020112119712268603, 'atr_max_pct': 0.1451550968128785, 'tp_mult': 1.7942798309045793, 'tsl_mult': 0.018069107441774784, 'strategy': 'breakout', 'time_stop': 205, 'use_sma': False, 'use_atr': True, 'use_adx': True, 'use_ema': False, 'use_spike': False, 'rsi_required': False, 'edge_k': 1.4402752709606732, 'edge_cap': 0.14034041260353639, 'bull_strategy': 'mean_reversion', 'bull_bb_std_mult': 3.3403735084143262, 'bull_rsi_os': 5, 'bull_rsi_ob': 79, 'bull_adx_thresh': 6.579721058584376, 'bull_atr_min_pct': 0.029142123760006085, 'bull_atr_max_pct': 0.10766018293305454, 'bull_tp_mult': 1.055342720612484, 'bull_tsl_mult': 0.10964900277061984, 'bull_time_stop': 224, 'bull_use_sma': True, 'bull_use_ema': False, 'bull_use_atr': False, 'bull_use_adx': False, 'bull_use_spike': False, 'bull_rsi_required': False, 'bear_strategy': 'mean_reversion', 'bear_bb_std_mult': 3.5897711601286146, 'bear_rsi_os': 48, 'bear_rsi_ob': 61, 'bear_adx_thresh': 12.250451666836355, 'bear_atr_min_pct': 0.014935301115408802, 'bear_atr_max_pct': 0.1209856897005331, 'bear_tp_mult': 1.4481157258456634, 'bear_tsl_mult': 0.7666625193557018, 'bear_time_stop': 217, 'bear_use_sma': False, 'bear_use_ema': False, 'bear_use_atr': True, 'bear_use_adx': False, 'bear_use_spike': True, 'bear_rsi_required': False, 'sideways_strategy': 'breakout', 'sideways_bb_std_mult': 0.8742916987285214, 'sideways_rsi_os': 42, 'sideways_rsi_ob': 79, 'sideways_adx_thresh': 20.209684667825787, 'sideways_atr_min_pct': 0.0103749073421078, 'sideways_atr_max_pct': 0.05197196298294437, 'sideways_tp_mult': 1.7200913843198435, 'sideways_tsl_mult': 0.9656133898942555, 'sideways_time_stop': 275, 'sideways_use_sma': False, 'sideways_use_ema': True, 'sideways_use_atr': True, 'sideways_use_adx': False, 'sideways_use_spike': False, 'sideways_rsi_required': False}.
[I 2025-09-01 09:27:21,927] Trial 180 finished with values: [-1000000000.0, 1000000000.0] and parameters: {'p_sma': 26, 'p_std': 39, 'p_atr': 21, 'p_adx': 16, 'rsi_period': 70, 'ema1': 19, 'ema2': 54, 'slip_atr_k': 0.2370786537324759, 'slip_spread_k': 0.706221304559722, 'spread_hl_frac': 0.034750246289030555, 'bb_std_mult': 1.846771350846176, 'rsi_os': 14, 'rsi_ob': 89, 'vol_spike': 0.038674849585142126, 'adx_thresh': 5.489403438855105, 'atr_min_pct': 0.006455063942513139, 'atr_max_pct': 0.03792572822382359, 'tp_mult': 1.9629047706240217, 'tsl_mult': 0.5572467788742588, 'strategy': 'breakout', 'time_stop': 182, 'use_sma': True, 'use_atr': False, 'use_adx': True, 'use_ema': False, 'use_spike': False, 'rsi_required': False, 'edge_k': 1.427413044979877, 'edge_cap': 0.1080662719954529, 'bull_strategy': 'mean_reversion', 'bull_bb_std_mult': 3.4858483209694784, 'bull_rsi_os': 41, 'bull_rsi_ob': 56, 'bull_adx_thresh': 6.252736643545605, 'bull_atr_min_pct': 0.024478953455283156, 'bull_atr_max_pct': 0.024770667215422454, 'bull_tp_mult': 2.1475414201386167, 'bull_tsl_mult': 0.4298544757880193, 'bull_time_stop': 30, 'bull_use_sma': True, 'bull_use_ema': False, 'bull_use_atr': True, 'bull_use_adx': False, 'bull_use_spike': False, 'bull_rsi_required': True, 'bear_strategy': 'mean_reversion', 'bear_bb_std_mult': 2.301133882464552, 'bear_rsi_os': 26, 'bear_rsi_ob': 73, 'bear_adx_thresh': 22.836767764283227, 'bear_atr_min_pct': 0.012990386398081175, 'bear_atr_max_pct': 0.04475283655010757, 'bear_tp_mult': 1.2562864858724223, 'bear_tsl_mult': 0.12710198536175105, 'bear_time_stop': 294, 'bear_use_sma': False, 'bear_use_ema': True, 'bear_use_atr': True, 'bear_use_adx': False, 'bear_use_spike': False, 'bear_rsi_required': False, 'sideways_strategy': 'mean_reversion', 'sideways_bb_std_mult': 1.351245493956058, 'sideways_rsi_os': 40, 'sideways_rsi_ob': 91, 'sideways_adx_thresh': 16.94319135967994, 'sideways_atr_min_pct': 0.0030866873589512206, 'sideways_atr_max_pct': 0.13825719316759225, 'sideways_tp_mult': 1.8228513739017416, 'sideways_tsl_mult': 0.083132576708975, 'sideways_time_stop': 195, 'sideways_use_sma': True, 'sideways_use_ema': True, 'sideways_use_atr': False, 'sideways_use_adx': False, 'sideways_use_spike': False, 'sideways_rsi_required': False}.
[I 2025-09-01 09:27:21,930] Trial 179 finished with values: [-1000000000.0, 1000000000.0] and parameters: {'p_sma': 45, 'p_std': 39, 'p_atr': 21, 'p_adx': 16, 'rsi_period': 70, 'ema1': 19, 'ema2': 28, 'slip_atr_k': 0.03649731997228569, 'slip_spread_k': 0.7040746034073864, 'spread_hl_frac': 0.015352386570549402, 'bb_std_mult': 1.6545483348328456, 'rsi_os': 10, 'rsi_ob': 92, 'vol_spike': 0.20595562833776657, 'adx_thresh': 29.127704425246666, 'atr_min_pct': 0.019706688971149758, 'atr_max_pct': 0.10208497746580363, 'tp_mult': 2.352899380670875, 'tsl_mult': 0.5771108887041316, 'strategy': 'breakout', 'time_stop': 61, 'use_sma': True, 'use_atr': False, 'use_adx': True, 'use_ema': False, 'use_spike': False, 'rsi_required': False, 'edge_k': 0.4304691444861716, 'edge_cap': 0.11331196399827997, 'bull_strategy': 'mean_reversion', 'bull_bb_std_mult': 3.377367099012242, 'bull_rsi_os': 41, 'bull_rsi_ob': 81, 'bull_adx_thresh': 6.327830791518745, 'bull_atr_min_pct': 0.02418525376572269, 'bull_atr_max_pct': 0.11086520229001624, 'bull_tp_mult': 2.4789437319877368, 'bull_tsl_mult': 0.960605551226624, 'bull_time_stop': 30, 'bull_use_sma': True, 'bull_use_ema': False, 'bull_use_atr': True, 'bull_use_adx': False, 'bull_use_spike': False, 'bull_rsi_required': True, 'bear_strategy': 'mean_reversion', 'bear_bb_std_mult': 3.0748676124417633, 'bear_rsi_os': 29, 'bear_rsi_ob': 73, 'bear_adx_thresh': 22.87655414939959, 'bear_atr_min_pct': 0.012964505276504234, 'bear_atr_max_pct': 0.0943471116371228, 'bear_tp_mult': 2.748165968158028, 'bear_tsl_mult': 0.9734173212532917, 'bear_time_stop': 32, 'bear_use_sma': False, 'bear_use_ema': True, 'bear_use_atr': True, 'bear_use_adx': False, 'bear_use_spike': False, 'bear_rsi_required': False, 'sideways_strategy': 'mean_reversion', 'sideways_bb_std_mult': 1.3435321844209838, 'sideways_rsi_os': 10, 'sideways_rsi_ob': 91, 'sideways_adx_thresh': 17.162285533655222, 'sideways_atr_min_pct': 0.0030858566161929427, 'sideways_atr_max_pct': 0.14670110823770371, 'sideways_tp_mult': 1.6544355700113713, 'sideways_tsl_mult': 0.08451455566656352, 'sideways_time_stop': 195, 'sideways_use_sma': True, 'sideways_use_ema': True, 'sideways_use_atr': False, 'sideways_use_adx': False, 'sideways_use_spike': False, 'sideways_rsi_required': False}.
