[I 2025-09-01 10:34:34,205] Trial 585 finished with values: [-1000000000.0, 1000000000.0] and parameters: {'p_sma': 7, 'p_std': 53, 'p_atr': 13, 'p_adx': 12, 'rsi_period': 28, 'ema1': 21, 'ema2': 29, 'slip_atr_k': 0.12062387791120015, 'slip_spread_k': 0.21468368359540488, 'spread_hl_frac': 0.01839148276991259, 'bb_std_mult': 3.1976905485910847, 'rsi_os': 52, 'rsi_ob': 76, 'vol_spike': 0.009568135743666967, 'adx_thresh': 6.15501093416307, 'atr_min_pct': 0.005837229141956134, 'atr_max_pct': 0.0791077838740755, 'tp_mult': 2.7625874144475953, 'tsl_mult': 0.013174508806307852, 'strategy': 'mean_reversion', 'time_stop': 167, 'use_sma': False, 'use_atr': True, 'use_adx': True, 'use_ema': False, 'use_spike': True, 'rsi_required': False, 'edge_k': 1.6379633118584274, 'edge_cap': 0.5702699390389926, 'bull_strategy': 'mean_reversion', 'bull_bb_std_mult': 0.8222191579168872, 'bull_rsi_os': 37, 'bull_rsi_ob': 67, 'bull_adx_thresh': 7.034456933687458, 'bull_atr_min_pct': 0.00657012183790447, 'bull_atr_max_pct': 0.08434295100632451, 'bull_tp_mult': 2.7341234237443564, 'bull_tsl_mult': 0.5836453415502794, 'bull_time_stop': 250, 'bull_use_sma': True, 'bull_use_ema': False, 'bull_use_atr': True, 'bull_use_adx': True, 'bull_use_spike': False, 'bull_rsi_required': True, 'bear_strategy': 'mean_reversion', 'bear_bb_std_mult': 3.4786382201743558, 'bear_rsi_os': 49, 'bear_rsi_ob': 72, 'bear_adx_thresh': 13.816320344892832, 'bear_atr_min_pct': 0.0037444941036128433, 'bear_atr_max_pct': 0.020088176013718345, 'bear_tp_mult': 1.3280123797652081, 'bear_tsl_mult': 0.45793928915813076, 'bear_time_stop': 258, 'bear_use_sma': False, 'bear_use_ema': True, 'bear_use_atr': True, 'bear_use_adx': False, 'bear_use_spike': True, 'bear_rsi_required': False, 'sideways_strategy': 'mean_reversion', 'sideways_bb_std_mult': 3.375356103636041, 'sideways_rsi_os': 48, 'sideways_rsi_ob': 49, 'sideways_adx_thresh': 34.7757464608718, 'sideways_atr_min_pct': 0.017685013628448407, 'sideways_atr_max_pct': 0.043896292556839196, 'sideways_tp_mult': 1.2669002278105936, 'sideways_tsl_mult': 0.30248121928688665, 'sideways_time_stop': 54, 'sideways_use_sma': False, 'sideways_use_ema': False, 'sideways_use_atr': False, 'sideways_use_adx': True, 'sideways_use_spike': False, 'sideways_rsi_required': False}.
[I 2025-09-01 10:35:16,478] Trial 588 finished with values: [-0.06501126730307127, 0.06517216119397079] and parameters: {'p_sma': 33, 'p_std': 45, 'p_atr': 29, 'p_adx': 17, 'rsi_period': 13, 'ema1': 28, 'ema2': 53, 'slip_atr_k': 0.11704393174261345, 'slip_spread_k': 0.21415986703633255, 'spread_hl_frac': 0.029771848559592966, 'bb_std_mult': 2.8360191045403926, 'rsi_os': 33, 'rsi_ob': 54, 'vol_spike': 0.2757801286579395, 'adx_thresh': 5.967219796111052, 'atr_min_pct': 0.024147692185562203, 'atr_max_pct': 0.0745376555256047, 'tp_mult': 2.757763348085031, 'tsl_mult': 0.5360373431038767, 'strategy': 'mean_reversion', 'time_stop': 165, 'use_sma': False, 'use_atr': True, 'use_adx': True, 'use_ema': False, 'use_spike': True, 'rsi_required': False, 'edge_k': 0.825710572558294, 'edge_cap': 0.57572135799398, 'bull_strategy': 'breakout', 'bull_bb_std_mult': 3.5000596492455225, 'bull_rsi_os': 50, 'bull_rsi_ob': 58, 'bull_adx_thresh': 25.456556520595612, 'bull_atr_min_pct': 0.028886531622853078, 'bull_atr_max_pct': 0.08744222212858761, 'bull_tp_mult': 1.298590585198447, 'bull_tsl_mult': 0.13014038361071412, 'bull_time_stop': 87, 'bull_use_sma': False, 'bull_use_ema': False, 'bull_use_atr': True, 'bull_use_adx': True, 'bull_use_spike': True, 'bull_rsi_required': True, 'bear_strategy': 'mean_reversion', 'bear_bb_std_mult': 3.485428389924392, 'bear_rsi_os': 48, 'bear_rsi_ob': 46, 'bear_adx_thresh': 13.696502896080434, 'bear_atr_min_pct': 0.004296367318075152, 'bear_atr_max_pct': 0.07665667673075026, 'bear_tp_mult': 2.5042704659698036, 'bear_tsl_mult': 0.1342917040010964, 'bear_time_stop': 143, 'bear_use_sma': False, 'bear_use_ema': True, 'bear_use_atr': True, 'bear_use_adx': False, 'bear_use_spike': True, 'bear_rsi_required': True, 'sideways_strategy': 'mean_reversion', 'sideways_bb_std_mult': 2.660754984685777, 'sideways_rsi_os': 48, 'sideways_rsi_ob': 83, 'sideways_adx_thresh': 26.588273666295493, 'sideways_atr_min_pct': 0.0036781141555102107, 'sideways_atr_max_pct': 0.12934708982268178, 'sideways_tp_mult': 1.1965308797334684, 'sideways_tsl_mult': 0.8746705596390489, 'sideways_time_stop': 180, 'sideways_use_sma': False, 'sideways_use_ema': False, 'sideways_use_atr': False, 'sideways_use_adx': True, 'sideways_use_spike': False, 'sideways_rsi_required': False}.
[I 2025-09-01 10:35:17,251] Trial 586 finished with values: [-1000000000.0, 1000000000.0] and parameters: {'p_sma': 10, 'p_std': 59, 'p_atr': 8, 'p_adx': 17, 'rsi_period': 27, 'ema1': 28, 'ema2': 52, 'slip_atr_k': 0.049423478999896256, 'slip_spread_k': 0.21691885108205933, 'spread_hl_frac': 0.005123149347728541, 'bb_std_mult': 3.093530409065748, 'rsi_os': 26, 'rsi_ob': 78, 'vol_spike': 0.12596079961027337, 'adx_thresh': 5.988570429741594, 'atr_min_pct': 0.005820449273464014, 'atr_max_pct': 0.07975599356770628, 'tp_mult': 2.767656951995995, 'tsl_mult': 0.01839827908965514, 'strategy': 'mean_reversion', 'time_stop': 165, 'use_sma': True, 'use_atr': True, 'use_adx': True, 'use_ema': False, 'use_spike': False, 'rsi_required': False, 'edge_k': 0.6036074743708324, 'edge_cap': 0.5814242027528002, 'bull_strategy': 'mean_reversion', 'bull_bb_std_mult': 0.8074010513554383, 'bull_rsi_os': 18, 'bull_rsi_ob': 67, 'bull_adx_thresh': 6.698724594308736, 'bull_atr_min_pct': 0.028679717896853592, 'bull_atr_max_pct': 0.1221221142277445, 'bull_tp_mult': 1.2835028420539931, 'bull_tsl_mult': 0.2702012874744628, 'bull_time_stop': 154, 'bull_use_sma': False, 'bull_use_ema': False, 'bull_use_atr': True, 'bull_use_adx': True, 'bull_use_spike': False, 'bull_rsi_required': True, 'bear_strategy': 'mean_reversion', 'bear_bb_std_mult': 3.4727570377764794, 'bear_rsi_os': 52, 'bear_rsi_ob': 46, 'bear_adx_thresh': 19.698272241296277, 'bear_atr_min_pct': 0.01769097147437477, 'bear_atr_max_pct': 0.03932435033262123, 'bear_tp_mult': 2.8583388603491535, 'bear_tsl_mult': 0.1659389393356775, 'bear_time_stop': 142, 'bear_use_sma': False, 'bear_use_ema': True, 'bear_use_atr': True, 'bear_use_adx': False, 'bear_use_spike': True, 'bear_rsi_required': True, 'sideways_strategy': 'mean_reversion', 'sideways_bb_std_mult': 3.0701850227192002, 'sideways_rsi_os': 48, 'sideways_rsi_ob': 81, 'sideways_adx_thresh': 34.79308052320454, 'sideways_atr_min_pct': 0.017821106024845445, 'sideways_atr_max_pct': 0.07028496274056102, 'sideways_tp_mult': 1.2590002198651533, 'sideways_tsl_mult': 0.23477822986451097, 'sideways_time_stop': 180, 'sideways_use_sma': False, 'sideways_use_ema': True, 'sideways_use_atr': False, 'sideways_use_adx': True, 'sideways_use_spike': False, 'sideways_rsi_required': False}.
[I 2025-09-01 10:35:18,049] Trial 587 finished with values: [-1000000000.0, 1000000000.0] and parameters: {'p_sma': 20, 'p_std': 45, 'p_atr': 13, 'p_adx': 17, 'rsi_period': 13, 'ema1': 28, 'ema2': 29, 'slip_atr_k': 0.10563754672790177, 'slip_spread_k': 0.24479619283877166, 'spread_hl_frac': 0.018362197432343408, 'bb_std_mult': 2.856154507560517, 'rsi_os': 24, 'rsi_ob': 75, 'vol_spike': 0.26843752543096766, 'adx_thresh': 12.057567136492636, 'atr_min_pct': 0.023957393462107394, 'atr_max_pct': 0.07886145223067931, 'tp_mult': 2.736713557675668, 'tsl_mult': 0.018869771881900387, 'strategy': 'mean_reversion', 'time_stop': 158, 'use_sma': True, 'use_atr': True, 'use_adx': True, 'use_ema': False, 'use_spike': False, 'rsi_required': False, 'edge_k': 0.825085232276444, 'edge_cap': 0.5787110224907493, 'bull_strategy': 'mean_reversion', 'bull_bb_std_mult': 0.8129579608251611, 'bull_rsi_os': 40, 'bull_rsi_ob': 58, 'bull_adx_thresh': 6.744630300195052, 'bull_atr_min_pct': 0.028827510176589653, 'bull_atr_max_pct': 0.04952305000973918, 'bull_tp_mult': 1.215947013131522, 'bull_tsl_mult': 0.8520864749134371, 'bull_time_stop': 86, 'bull_use_sma': False, 'bull_use_ema': False, 'bull_use_atr': True, 'bull_use_adx': True, 'bull_use_spike': False, 'bull_rsi_required': True, 'bear_strategy': 'mean_reversion', 'bear_bb_std_mult': 3.48475281591034, 'bear_rsi_os': 48, 'bear_rsi_ob': 46, 'bear_adx_thresh': 13.630251515597461, 'bear_atr_min_pct': 0.017653906456517713, 'bear_atr_max_pct': 0.07687029335535656, 'bear_tp_mult': 2.504849201644088, 'bear_tsl_mult': 0.41058111976964573, 'bear_time_stop': 257, 'bear_use_sma': False, 'bear_use_ema': True, 'bear_use_atr': True, 'bear_use_adx': False, 'bear_use_spike': True, 'bear_rsi_required': True, 'sideways_strategy': 'mean_reversion', 'sideways_bb_std_mult': 2.1970244810455077, 'sideways_rsi_os': 34, 'sideways_rsi_ob': 48, 'sideways_adx_thresh': 26.56839994296563, 'sideways_atr_min_pct': 0.006743517709369463, 'sideways_atr_max_pct': 0.06928000535882584, 'sideways_tp_mult': 1.2665732486552157, 'sideways_tsl_mult': 0.6246655533330296, 'sideways_time_stop': 52, 'sideways_use_sma': False, 'sideways_use_ema': True, 'sideways_use_atr': False, 'sideways_use_adx': True, 'sideways_use_spike': False, 'sideways_rsi_required': False}.
[I 2025-09-01 10:35:19,138] Trial 589 finished with values: [-0.15784020427218015, 0.15766892602199997] and parameters: {'p_sma': 33, 'p_std': 45, 'p_atr': 8, 'p_adx': 10, 'rsi_period': 19, 'ema1': 22, 'ema2': 13, 'slip_atr_k': 0.2388384397999827, 'slip_spread_k': 0.24600516298443983, 'spread_hl_frac': 0.030825838609196524, 'bb_std_mult': 1.522193224494612, 'rsi_os': 16, 'rsi_ob': 54, 'vol_spike': 0.26812068593132554, 'adx_thresh': 5.538138136553993, 'atr_min_pct': 0.02415099867379799, 'atr_max_pct': 0.07486172478667824, 'tp_mult': 2.697822239968084, 'tsl_mult': 0.5146123903825013, 'strategy': 'breakout', 'time_stop': 154, 'use_sma': True, 'use_atr': True, 'use_adx': False, 'use_ema': False, 'use_spike': False, 'rsi_required': False, 'edge_k': 0.8314076675035021, 'edge_cap': 0.5809482683648627, 'bull_strategy': 'breakout', 'bull_bb_std_mult': 0.8874473853709148, 'bull_rsi_os': 18, 'bull_rsi_ob': 88, 'bull_adx_thresh': 6.76091196680611, 'bull_atr_min_pct': 0.02883705015966336, 'bull_atr_max_pct': 0.08877007372754671, 'bull_tp_mult': 2.2572095863035737, 'bull_tsl_mult': 0.07891312081685627, 'bull_time_stop': 67, 'bull_use_sma': False, 'bull_use_ema': False, 'bull_use_atr': False, 'bull_use_adx': True, 'bull_use_spike': True, 'bull_rsi_required': True, 'bear_strategy': 'mean_reversion', 'bear_bb_std_mult': 1.0256168522431015, 'bear_rsi_os': 48, 'bear_rsi_ob': 46, 'bear_adx_thresh': 12.379924831943658, 'bear_atr_min_pct': 0.007835804407312701, 'bear_atr_max_pct': 0.06842134329246365, 'bear_tp_mult': 1.279247579370821, 'bear_tsl_mult': 0.16210256276163826, 'bear_time_stop': 285, 'bear_use_sma': False, 'bear_use_ema': True, 'bear_use_atr': False, 'bear_use_adx': False, 'bear_use_spike': True, 'bear_rsi_required': True, 'sideways_strategy': 'breakout', 'sideways_bb_std_mult': 2.5325202849001056, 'sideways_rsi_os': 47, 'sideways_rsi_ob': 80, 'sideways_adx_thresh': 12.792864179375634, 'sideways_atr_min_pct': 0.0036004909095685095, 'sideways_atr_max_pct': 0.06938303137317955, 'sideways_tp_mult': 1.2019032006726502, 'sideways_tsl_mult': 0.8742754320872328, 'sideways_time_stop': 182, 'sideways_use_sma': False, 'sideways_use_ema': True, 'sideways_use_atr': False, 'sideways_use_adx': True, 'sideways_use_spike': False, 'sideways_rsi_required': False}.
[I 2025-09-01 10:35:59,314] Trial 591 finished with values: [-1000000000.0, 1000000000.0] and parameters: {'p_sma': 45, 'p_std': 45, 'p_atr': 30, 'p_adx': 16, 'rsi_period': 61, 'ema1': 22, 'ema2': 43, 'slip_atr_k': 0.23984135186073344, 'slip_spread_k': 0.24075669472500227, 'spread_hl_frac': 0.03656727913121832, 'bb_std_mult': 1.5519049852991729, 'rsi_os': 24, 'rsi_ob': 75, 'vol_spike': 0.2711997308054576, 'adx_thresh': 11.986371023461656, 'atr_min_pct': 0.01732540214210364, 'atr_max_pct': 0.08433036750002612, 'tp_mult': 2.1129267180167695, 'tsl_mult': 0.7613375803061229, 'strategy': 'breakout', 'time_stop': 181, 'use_sma': True, 'use_atr': False, 'use_adx': False, 'use_ema': False, 'use_spike': False, 'rsi_required': False, 'edge_k': 0.054058318374778036, 'edge_cap': 0.8300938096535813, 'bull_strategy': 'mean_reversion', 'bull_bb_std_mult': 0.8952970243411323, 'bull_rsi_os': 17, 'bull_rsi_ob': 56, 'bull_adx_thresh': 24.554320494447964, 'bull_atr_min_pct': 0.027886372942468388, 'bull_atr_max_pct': 0.09011194418232799, 'bull_tp_mult': 1.8538770105342963, 'bull_tsl_mult': 0.022519613053231316, 'bull_time_stop': 69, 'bull_use_sma': True, 'bull_use_ema': False, 'bull_use_atr': False, 'bull_use_adx': True, 'bull_use_spike': False, 'bull_rsi_required': True, 'bear_strategy': 'mean_reversion', 'bear_bb_std_mult': 3.3774521100818937, 'bear_rsi_os': 54, 'bear_rsi_ob': 64, 'bear_adx_thresh': 12.162435008344774, 'bear_atr_min_pct': 0.015565817234427072, 'bear_atr_max_pct': 0.07023033895060488, 'bear_tp_mult': 1.2750406446372842, 'bear_tsl_mult': 0.9059785551905617, 'bear_time_stop': 133, 'bear_use_sma': False, 'bear_use_ema': True, 'bear_use_atr': False, 'bear_use_adx': False, 'bear_use_spike': False, 'bear_rsi_required': False, 'sideways_strategy': 'breakout', 'sideways_bb_std_mult': 3.133806114088918, 'sideways_rsi_os': 47, 'sideways_rsi_ob': 80, 'sideways_adx_thresh': 28.5723687789495, 'sideways_atr_min_pct': 0.004551800156322642, 'sideways_atr_max_pct': 0.06913140690852869, 'sideways_tp_mult': 1.4025264278720542, 'sideways_tsl_mult': 0.6185540037408178, 'sideways_time_stop': 198, 'sideways_use_sma': False, 'sideways_use_ema': True, 'sideways_use_atr': True, 'sideways_use_adx': False, 'sideways_use_spike': False, 'sideways_rsi_required': False}.
[I 2025-09-01 10:36:00,149] Trial 593 finished with values: [-1000000000.0, 1000000000.0] and parameters: {'p_sma': 52, 'p_std': 5, 'p_atr': 30, 'p_adx': 30, 'rsi_period': 62, 'ema1': 8, 'ema2': 47, 'slip_atr_k': 0.05589573872851031, 'slip_spread_k': 0.9999536425104937, 'spread_hl_frac': 0.03971100405361991, 'bb_std_mult': 3.0013708597532855, 'rsi_os': 31, 'rsi_ob': 81, 'vol_spike': 0.17746925424596696, 'adx_thresh': 7.042009106128288, 'atr_min_pct': 0.023454473144239374, 'atr_max_pct': 0.04270897502049239, 'tp_mult': 2.6842363875110227, 'tsl_mult': 0.06696167895013216, 'strategy': 'breakout', 'time_stop': 177, 'use_sma': True, 'use_atr': False, 'use_adx': False, 'use_ema': False, 'use_spike': False, 'rsi_required': True, 'edge_k': 0.9715768622060268, 'edge_cap': 0.5420468824632136, 'bull_strategy': 'mean_reversion', 'bull_bb_std_mult': 0.9023767627764313, 'bull_rsi_os': 19, 'bull_rsi_ob': 56, 'bull_adx_thresh': 22.042337694784244, 'bull_atr_min_pct': 0.02803704259688632, 'bull_atr_max_pct': 0.09049700507194942, 'bull_tp_mult': 2.471569313180732, 'bull_tsl_mult': 0.028539574134950122, 'bull_time_stop': 141, 'bull_use_sma': True, 'bull_use_ema': True, 'bull_use_atr': False, 'bull_use_adx': False, 'bull_use_spike': False, 'bull_rsi_required': True, 'bear_strategy': 'mean_reversion', 'bear_bb_std_mult': 3.3484217145984467, 'bear_rsi_os': 23, 'bear_rsi_ob': 61, 'bear_adx_thresh': 12.355548701924253, 'bear_atr_min_pct': 0.015731101270181305, 'bear_atr_max_pct': 0.0701531001446733, 'bear_tp_mult': 2.718179381872278, 'bear_tsl_mult': 0.5683815769353371, 'bear_time_stop': 148, 'bear_use_sma': True, 'bear_use_ema': False, 'bear_use_atr': False, 'bear_use_adx': True, 'bear_use_spike': False, 'bear_rsi_required': False, 'sideways_strategy': 'breakout', 'sideways_bb_std_mult': 2.305889572684837, 'sideways_rsi_os': 22, 'sideways_rsi_ob': 50, 'sideways_adx_thresh': 28.727900984297317, 'sideways_atr_min_pct': 0.018751711396167166, 'sideways_atr_max_pct': 0.10271750360069318, 'sideways_tp_mult': 1.5019338060556857, 'sideways_tsl_mult': 0.7986003532242094, 'sideways_time_stop': 200, 'sideways_use_sma': False, 'sideways_use_ema': True, 'sideways_use_atr': False, 'sideways_use_adx': False, 'sideways_use_spike': True, 'sideways_rsi_required': True}.
[I 2025-09-01 10:36:00,572] Trial 590 finished with values: [-1000000000.0, 1000000000.0] and parameters: {'p_sma': 20, 'p_std': 45, 'p_atr': 30, 'p_adx': 16, 'rsi_period': 61, 'ema1': 7, 'ema2': 23, 'slip_atr_k': 0.027017386960914918, 'slip_spread_k': 0.24149043944431692, 'spread_hl_frac': 0.031017850458794453, 'bb_std_mult': 2.588434569970262, 'rsi_os': 31, 'rsi_ob': 81, 'vol_spike': 0.2686245546275469, 'adx_thresh': 24.086858845806976, 'atr_min_pct': 0.02422432793553119, 'atr_max_pct': 0.12439635033538779, 'tp_mult': 2.710251189294797, 'tsl_mult': 0.7650614839274045, 'strategy': 'breakout', 'time_stop': 153, 'use_sma': True, 'use_atr': False, 'use_adx': False, 'use_ema': False, 'use_spike': False, 'rsi_required': False, 'edge_k': 0.9822840572847541, 'edge_cap': 0.548762112295578, 'bull_strategy': 'mean_reversion', 'bull_bb_std_mult': 0.8964933630636576, 'bull_rsi_os': 19, 'bull_rsi_ob': 55, 'bull_adx_thresh': 5.471282172729158, 'bull_atr_min_pct': 0.009646975321564397, 'bull_atr_max_pct': 0.08893927283046897, 'bull_tp_mult': 1.8385265456826068, 'bull_tsl_mult': 0.021161182216289175, 'bull_time_stop': 66, 'bull_use_sma': True, 'bull_use_ema': False, 'bull_use_atr': False, 'bull_use_adx': True, 'bull_use_spike': False, 'bull_rsi_required': True, 'bear_strategy': 'mean_reversion', 'bear_bb_std_mult': 3.3456325658166124, 'bear_rsi_os': 54, 'bear_rsi_ob': 93, 'bear_adx_thresh': 12.067404275216562, 'bear_atr_min_pct': 0.015761305574272973, 'bear_atr_max_pct': 0.06828139215173698, 'bear_tp_mult': 1.851348795631245, 'bear_tsl_mult': 0.028737275788488836, 'bear_time_stop': 131, 'bear_use_sma': False, 'bear_use_ema': True, 'bear_use_atr': False, 'bear_use_adx': False, 'bear_use_spike': False, 'bear_rsi_required': False, 'sideways_strategy': 'breakout', 'sideways_bb_std_mult': 3.1661086931460236, 'sideways_rsi_os': 47, 'sideways_rsi_ob': 48, 'sideways_adx_thresh': 28.395824507728147, 'sideways_atr_min_pct': 0.0037911116205430083, 'sideways_atr_max_pct': 0.06931881931834799, 'sideways_tp_mult': 1.4980804413283852, 'sideways_tsl_mult': 0.4008936763779155, 'sideways_time_stop': 197, 'sideways_use_sma': False, 'sideways_use_ema': True, 'sideways_use_atr': True, 'sideways_use_adx': False, 'sideways_use_spike': False, 'sideways_rsi_required': False}.
[I 2025-09-01 10:36:00,923] Trial 592 finished with values: [-1000000000.0, 1000000000.0] and parameters: {'p_sma': 12, 'p_std': 33, 'p_atr': 30, 'p_adx': 10, 'rsi_period': 76, 'ema1': 22, 'ema2': 43, 'slip_atr_k': 0.037206989632177986, 'slip_spread_k': 0.1931225087851485, 'spread_hl_frac': 0.033366742017506244, 'bb_std_mult': 1.531995945104176, 'rsi_os': 31, 'rsi_ob': 77, 'vol_spike': 0.17453793051351185, 'adx_thresh': 24.056679242337577, 'atr_min_pct': 0.02315543390587506, 'atr_max_pct': 0.08541540723312552, 'tp_mult': 2.705731699403136, 'tsl_mult': 0.06748610371782934, 'strategy': 'breakout', 'time_stop': 152, 'use_sma': True, 'use_atr': False, 'use_adx': False, 'use_ema': False, 'use_spike': False, 'rsi_required': True, 'edge_k': 0.9708534765637742, 'edge_cap': 0.5510171763535038, 'bull_strategy': 'breakout', 'bull_bb_std_mult': 0.8816236177799198, 'bull_rsi_os': 20, 'bull_rsi_ob': 52, 'bull_adx_thresh': 20.367776684141116, 'bull_atr_min_pct': 0.029994448889585978, 'bull_atr_max_pct': 0.08913255157282952, 'bull_tp_mult': 2.483181870703732, 'bull_tsl_mult': 0.08005483585772272, 'bull_time_stop': 240, 'bull_use_sma': True, 'bull_use_ema': True, 'bull_use_atr': False, 'bull_use_adx': True, 'bull_use_spike': True, 'bull_rsi_required': True, 'bear_strategy': 'mean_reversion', 'bear_bb_std_mult': 3.3500809525330273, 'bear_rsi_os': 23, 'bear_rsi_ob': 93, 'bear_adx_thresh': 12.53671006508304, 'bear_atr_min_pct': 0.01686115119820956, 'bear_atr_max_pct': 0.06862374324393279, 'bear_tp_mult': 1.2685594645641691, 'bear_tsl_mult': 0.5700045366265581, 'bear_time_stop': 149, 'bear_use_sma': True, 'bear_use_ema': False, 'bear_use_atr': False, 'bear_use_adx': True, 'bear_use_spike': False, 'bear_rsi_required': False, 'sideways_strategy': 'breakout', 'sideways_bb_std_mult': 3.133525065385162, 'sideways_rsi_os': 53, 'sideways_rsi_ob': 65, 'sideways_adx_thresh': 28.504145934824567, 'sideways_atr_min_pct': 0.004303566126924368, 'sideways_atr_max_pct': 0.05291321107006333, 'sideways_tp_mult': 1.4183708019789765, 'sideways_tsl_mult': 0.0956118999794216, 'sideways_time_stop': 199, 'sideways_use_sma': False, 'sideways_use_ema': True, 'sideways_use_atr': True, 'sideways_use_adx': False, 'sideways_use_spike': True, 'sideways_rsi_required': True}.
