[I 2025-09-01 09:24:31,593] Trial 164 finished with values: [-1000000000.0, 1000000000.0] and parameters: {'p_sma': 27, 'p_std': 21, 'p_atr': 12, 'p_adx': 20, 'rsi_period': 66, 'ema1': 11, 'ema2': 15, 'slip_atr_k': 0.05612448796784018, 'slip_spread_k': 0.310531156994418, 'spread_hl_frac': 0.029580342364166706, 'bb_std_mult': 3.0142527477525345, 'rsi_os': 50, 'rsi_ob': 84, 'vol_spike': 0.001992166245114224, 'adx_thresh': 5.766257446009339, 'atr_min_pct': 0.019648297572908154, 'atr_max_pct': 0.143028140859697, 'tp_mult': 1.2117081502600695, 'tsl_mult': 0.07950167204918446, 'strategy': 'breakout', 'time_stop': 300, 'use_sma': True, 'use_atr': False, 'use_adx': True, 'use_ema': False, 'use_spike': False, 'rsi_required': False, 'edge_k': 1.7966502278841703, 'edge_cap': 0.09406575044171853, 'bull_strategy': 'mean_reversion', 'bull_bb_std_mult': 3.2125617219093776, 'bull_rsi_os': 16, 'bull_rsi_ob': 54, 'bull_adx_thresh': 8.881399406044057, 'bull_atr_min_pct': 0.029138393115628727, 'bull_atr_max_pct': 0.06958701241211453, 'bull_tp_mult': 2.2715449126062386, 'bull_tsl_mult': 0.3544423907692714, 'bull_time_stop': 16, 'bull_use_sma': True, 'bull_use_ema': False, 'bull_use_atr': False, 'bull_use_adx': False, 'bull_use_spike': False, 'bull_rsi_required': True, 'bear_strategy': 'mean_reversion', 'bear_bb_std_mult': 2.600278319860689, 'bear_rsi_os': 44, 'bear_rsi_ob': 77, 'bear_adx_thresh': 11.753906392800909, 'bear_atr_min_pct': 0.026003286602355236, 'bear_atr_max_pct': 0.1184262191465542, 'bear_tp_mult': 1.383344638288643, 'bear_tsl_mult': 0.3494080980631983, 'bear_time_stop': 48, 'bear_use_sma': False, 'bear_use_ema': True, 'bear_use_atr': True, 'bear_use_adx': False, 'bear_use_spike': False, 'bear_rsi_required': False, 'sideways_strategy': 'breakout', 'sideways_bb_std_mult': 1.271721969553442, 'sideways_rsi_os': 27, 'sideways_rsi_ob': 49, 'sideways_adx_thresh': 32.08848202509531, 'sideways_atr_min_pct': 0.004620107530144303, 'sideways_atr_max_pct': 0.06717687680484523, 'sideways_tp_mult': 1.790157501813678, 'sideways_tsl_mult': 0.9484175262133072, 'sideways_time_stop': 215, 'sideways_use_sma': True, 'sideways_use_ema': False, 'sideways_use_atr': False, 'sideways_use_adx': False, 'sideways_use_spike': False, 'sideways_rsi_required': False}.
[I 2025-09-01 09:24:31,595] Trial 165 finished with values: [-1000000000.0, 1000000000.0] and parameters: {'p_sma': 27, 'p_std': 22, 'p_atr': 12, 'p_adx': 12, 'rsi_period': 66, 'ema1': 21, 'ema2': 15, 'slip_atr_k': 0.026621703211988562, 'slip_spread_k': 0.22008488847287278, 'spread_hl_frac': 0.027330026377726906, 'bb_std_mult': 1.6002525212121808, 'rsi_os': 8, 'rsi_ob': 67, 'vol_spike': 0.2144551762700593, 'adx_thresh': 5.508167142757533, 'atr_min_pct': 0.004106703475072205, 'atr_max_pct': 0.14343148255596777, 'tp_mult': 1.9162622934572777, 'tsl_mult': 0.42773489971903045, 'strategy': 'mean_reversion', 'time_stop': 91, 'use_sma': True, 'use_atr': True, 'use_adx': False, 'use_ema': False, 'use_spike': False, 'rsi_required': False, 'edge_k': 1.3281871139528252, 'edge_cap': 0.10003097904107498, 'bull_strategy': 'mean_reversion', 'bull_bb_std_mult': 1.459772386180298, 'bull_rsi_os': 13, 'bull_rsi_ob': 68, 'bull_adx_thresh': 12.80733709844586, 'bull_atr_min_pct': 0.013830997201518539, 'bull_atr_max_pct': 0.06996667699458425, 'bull_tp_mult': 2.3316783397921244, 'bull_tsl_mult': 0.13095842426523424, 'bull_time_stop': 116, 'bull_use_sma': True, 'bull_use_ema': False, 'bull_use_atr': False, 'bull_use_adx': False, 'bull_use_spike': False, 'bull_rsi_required': True, 'bear_strategy': 'mean_reversion', 'bear_bb_std_mult': 0.5089604659012803, 'bear_rsi_os': 43, 'bear_rsi_ob': 77, 'bear_adx_thresh': 18.828449180020662, 'bear_atr_min_pct': 0.014447605667548892, 'bear_atr_max_pct': 0.11372940788373197, 'bear_tp_mult': 2.9442929645361255, 'bear_tsl_mult': 0.6462467566978994, 'bear_time_stop': 198, 'bear_use_sma': False, 'bear_use_ema': True, 'bear_use_atr': False, 'bear_use_adx': False, 'bear_use_spike': True, 'bear_rsi_required': False, 'sideways_strategy': 'breakout', 'sideways_bb_std_mult': 0.9994638915594511, 'sideways_rsi_os': 16, 'sideways_rsi_ob': 81, 'sideways_adx_thresh': 31.774957498325993, 'sideways_atr_min_pct': 0.004590809550179852, 'sideways_atr_max_pct': 0.06632310402079199, 'sideways_tp_mult': 1.833072791591842, 'sideways_tsl_mult': 0.7120995354102299, 'sideways_time_stop': 216, 'sideways_use_sma': True, 'sideways_use_ema': False, 'sideways_use_atr': True, 'sideways_use_adx': False, 'sideways_use_spike': False, 'sideways_rsi_required': False}.
[I 2025-09-01 09:24:32,450] Trial 163 finished with values: [-1000000000.0, 1000000000.0] and parameters: {'p_sma': 31, 'p_std': 21, 'p_atr': 23, 'p_adx': 18, 'rsi_period': 72, 'ema1': 21, 'ema2': 15, 'slip_atr_k': 0.05681220058774443, 'slip_spread_k': 0.5591036296316897, 'spread_hl_frac': 0.010524500316912558, 'bb_std_mult': 3.2428850512439293, 'rsi_os': 12, 'rsi_ob': 46, 'vol_spike': 0.25807891707520375, 'adx_thresh': 17.041920232392236, 'atr_min_pct': 3.162402905925246e-05, 'atr_max_pct': 0.054490350189896716, 'tp_mult': 2.7419858818854204, 'tsl_mult': 0.13016852678168794, 'strategy': 'breakout', 'time_stop': 91, 'use_sma': True, 'use_atr': False, 'use_adx': True, 'use_ema': False, 'use_spike': False, 'rsi_required': False, 'edge_k': 1.7922578297935041, 'edge_cap': 0.6234091037370356, 'bull_strategy': 'mean_reversion', 'bull_bb_std_mult': 2.8045961900432803, 'bull_rsi_os': 16, 'bull_rsi_ob': 54, 'bull_adx_thresh': 7.231245517269559, 'bull_atr_min_pct': 0.013646128206256911, 'bull_atr_max_pct': 0.07005579312832626, 'bull_tp_mult': 2.3225003109525484, 'bull_tsl_mult': 0.135613448724491, 'bull_time_stop': 119, 'bull_use_sma': True, 'bull_use_ema': False, 'bull_use_atr': False, 'bull_use_adx': False, 'bull_use_spike': False, 'bull_rsi_required': True, 'bear_strategy': 'mean_reversion', 'bear_bb_std_mult': 3.346968050620809, 'bear_rsi_os': 44, 'bear_rsi_ob': 75, 'bear_adx_thresh': 15.576666451416294, 'bear_atr_min_pct': 0.01455381855506404, 'bear_atr_max_pct': 0.11284296768846626, 'bear_tp_mult': 2.389063032388643, 'bear_tsl_mult': 0.6796659310055224, 'bear_time_stop': 121, 'bear_use_sma': False, 'bear_use_ema': True, 'bear_use_atr': True, 'bear_use_adx': False, 'bear_use_spike': False, 'bear_rsi_required': False, 'sideways_strategy': 'breakout', 'sideways_bb_std_mult': 0.72720749462894, 'sideways_rsi_os': 27, 'sideways_rsi_ob': 49, 'sideways_adx_thresh': 32.36227432578118, 'sideways_atr_min_pct': 0.0062471330793513954, 'sideways_atr_max_pct': 0.0726827758292214, 'sideways_tp_mult': 2.1850204115390692, 'sideways_tsl_mult': 0.7077668959283253, 'sideways_time_stop': 216, 'sideways_use_sma': False, 'sideways_use_ema': False, 'sideways_use_atr': False, 'sideways_use_adx': False, 'sideways_use_spike': False, 'sideways_rsi_required': False}.
[I 2025-09-01 09:24:32,915] Trial 162 finished with values: [-0.02306067934844358, 0.022835781996692964] and parameters: {'p_sma': 27, 'p_std': 43, 'p_atr': 28, 'p_adx': 12, 'rsi_period': 66, 'ema1': 21, 'ema2': 15, 'slip_atr_k': 0.05720482510039378, 'slip_spread_k': 0.7277440069911213, 'spread_hl_frac': 0.027636895419761588, 'bb_std_mult': 1.7066365648533823, 'rsi_os': 10, 'rsi_ob': 60, 'vol_spike': 0.24483313684682131, 'adx_thresh': 5.992065917859393, 'atr_min_pct': 0.017848359105912762, 'atr_max_pct': 0.04361861557428569, 'tp_mult': 2.935845346362513, 'tsl_mult': 0.06571908325596094, 'strategy': 'breakout', 'time_stop': 184, 'use_sma': True, 'use_atr': False, 'use_adx': True, 'use_ema': False, 'use_spike': False, 'rsi_required': False, 'edge_k': 1.79636539024293, 'edge_cap': 0.5595524737369332, 'bull_strategy': 'mean_reversion', 'bull_bb_std_mult': 1.1378291327523287, 'bull_rsi_os': 19, 'bull_rsi_ob': 56, 'bull_adx_thresh': 11.61718400209805, 'bull_atr_min_pct': 0.017248824415359004, 'bull_atr_max_pct': 0.05664704043477321, 'bull_tp_mult': 1.0562721967797577, 'bull_tsl_mult': 0.14039333025777367, 'bull_time_stop': 116, 'bull_use_sma': True, 'bull_use_ema': False, 'bull_use_atr': False, 'bull_use_adx': False, 'bull_use_spike': False, 'bull_rsi_required': True, 'bear_strategy': 'breakout', 'bear_bb_std_mult': 3.360057857340394, 'bear_rsi_os': 44, 'bear_rsi_ob': 73, 'bear_adx_thresh': 10.700484006030855, 'bear_atr_min_pct': 0.015312751699633191, 'bear_atr_max_pct': 0.07918859126603521, 'bear_tp_mult': 1.3721912087475678, 'bear_tsl_mult': 0.7675702439189616, 'bear_time_stop': 197, 'bear_use_sma': False, 'bear_use_ema': True, 'bear_use_atr': True, 'bear_use_adx': False, 'bear_use_spike': False, 'bear_rsi_required': False, 'sideways_strategy': 'breakout', 'sideways_bb_std_mult': 0.746412788459573, 'sideways_rsi_os': 41, 'sideways_rsi_ob': 48, 'sideways_adx_thresh': 32.18508637708341, 'sideways_atr_min_pct': 0.0030989181598784984, 'sideways_atr_max_pct': 0.14645985142190163, 'sideways_tp_mult': 2.9414847736132415, 'sideways_tsl_mult': 0.8527908206076955, 'sideways_time_stop': 247, 'sideways_use_sma': False, 'sideways_use_ema': False, 'sideways_use_atr': False, 'sideways_use_adx': False, 'sideways_use_spike': False, 'sideways_rsi_required': False}.
[I 2025-09-01 09:25:14,455] Trial 169 finished with values: [-1000000000.0, 1000000000.0] and parameters: {'p_sma': 33, 'p_std': 12, 'p_atr': 16, 'p_adx': 15, 'rsi_period': 69, 'ema1': 20, 'ema2': 20, 'slip_atr_k': 0.08358001792177314, 'slip_spread_k': 0.24000819159273817, 'spread_hl_frac': 0.007947744327761293, 'bb_std_mult': 1.9251628391823365, 'rsi_os': 52, 'rsi_ob': 60, 'vol_spike': 0.05335820128411098, 'adx_thresh': 5.045605310252271, 'atr_min_pct': 0.016778619848773837, 'atr_max_pct': 0.03640428667664494, 'tp_mult': 1.7412915462786898, 'tsl_mult': 0.7457354573764804, 'strategy': 'breakout', 'time_stop': 281, 'use_sma': True, 'use_atr': False, 'use_adx': True, 'use_ema': True, 'use_spike': True, 'rsi_required': False, 'edge_k': 1.7291887545841735, 'edge_cap': 0.05427586344332956, 'bull_strategy': 'mean_reversion', 'bull_bb_std_mult': 2.46248646260375, 'bull_rsi_os': 19, 'bull_rsi_ob': 52, 'bull_adx_thresh': 5.282554259159214, 'bull_atr_min_pct': 0.029289793627200893, 'bull_atr_max_pct': 0.06209241709520317, 'bull_tp_mult': 2.1174886326810336, 'bull_tsl_mult': 0.08674811874173396, 'bull_time_stop': 187, 'bull_use_sma': False, 'bull_use_ema': False, 'bull_use_atr': True, 'bull_use_adx': True, 'bull_use_spike': False, 'bull_rsi_required': True, 'bear_strategy': 'mean_reversion', 'bear_bb_std_mult': 1.3567681253392703, 'bear_rsi_os': 46, 'bear_rsi_ob': 63, 'bear_adx_thresh': 14.465614122052145, 'bear_atr_min_pct': 0.01850983950232346, 'bear_atr_max_pct': 0.07198631675062644, 'bear_tp_mult': 2.2335799687050164, 'bear_tsl_mult': 0.17043813567987726, 'bear_time_stop': 231, 'bear_use_sma': True, 'bear_use_ema': True, 'bear_use_atr': True, 'bear_use_adx': False, 'bear_use_spike': False, 'bear_rsi_required': False, 'sideways_strategy': 'breakout', 'sideways_bb_std_mult': 1.056232562598877, 'sideways_rsi_os': 50, 'sideways_rsi_ob': 47, 'sideways_adx_thresh': 26.908186144081906, 'sideways_atr_min_pct': 0.014635629429179373, 'sideways_atr_max_pct': 0.07932402028260888, 'sideways_tp_mult': 2.4113352352405593, 'sideways_tsl_mult': 0.7500265405801951, 'sideways_time_stop': 228, 'sideways_use_sma': False, 'sideways_use_ema': True, 'sideways_use_atr': False, 'sideways_use_adx': True, 'sideways_use_spike': True, 'sideways_rsi_required': True}.
[I 2025-09-01 09:25:15,343] Trial 166 finished with values: [-1000000000.0, 1000000000.0] and parameters: {'p_sma': 33, 'p_std': 12, 'p_atr': 28, 'p_adx': 15, 'rsi_period': 64, 'ema1': 18, 'ema2': 33, 'slip_atr_k': 0.05045155533992687, 'slip_spread_k': 0.08759440937356483, 'spread_hl_frac': 0.010090207471875813, 'bb_std_mult': 1.9425466807266503, 'rsi_os': 38, 'rsi_ob': 57, 'vol_spike': 0.023548633386441753, 'adx_thresh': 6.781335253747843, 'atr_min_pct': 0.021411264537206057, 'atr_max_pct': 0.14044849555416788, 'tp_mult': 2.918849952169069, 'tsl_mult': 0.2198189491343202, 'strategy': 'breakout', 'time_stop': 197, 'use_sma': True, 'use_atr': False, 'use_adx': True, 'use_ema': True, 'use_spike': True, 'rsi_required': False, 'edge_k': 1.54916158532284, 'edge_cap': 0.05178152078874376, 'bull_strategy': 'mean_reversion', 'bull_bb_std_mult': 2.7937855879493068, 'bull_rsi_os': 19, 'bull_rsi_ob': 62, 'bull_adx_thresh': 11.466209020681669, 'bull_atr_min_pct': 0.015512939648817146, 'bull_atr_max_pct': 0.062424255253273254, 'bull_tp_mult': 2.140560915929498, 'bull_tsl_mult': 0.060022246911691376, 'bull_time_stop': 122, 'bull_use_sma': False, 'bull_use_ema': False, 'bull_use_atr': True, 'bull_use_adx': True, 'bull_use_spike': False, 'bull_rsi_required': True, 'bear_strategy': 'mean_reversion', 'bear_bb_std_mult': 2.8278774696007076, 'bear_rsi_os': 45, 'bear_rsi_ob': 63, 'bear_adx_thresh': 14.387215998582274, 'bear_atr_min_pct': 0.003408022142632545, 'bear_atr_max_pct': 0.12433725080535654, 'bear_tp_mult': 2.3823750885879313, 'bear_tsl_mult': 0.17647145347020288, 'bear_time_stop': 111, 'bear_use_sma': True, 'bear_use_ema': True, 'bear_use_atr': True, 'bear_use_adx': False, 'bear_use_spike': False, 'bear_rsi_required': False, 'sideways_strategy': 'breakout', 'sideways_bb_std_mult': 1.4304443548617929, 'sideways_rsi_os': 38, 'sideways_rsi_ob': 87, 'sideways_adx_thresh': 26.944987237633338, 'sideways_atr_min_pct': 0.005937697073568631, 'sideways_atr_max_pct': 0.07899990085733645, 'sideways_tp_mult': 1.950527599475492, 'sideways_tsl_mult': 0.7512323469607036, 'sideways_time_stop': 227, 'sideways_use_sma': False, 'sideways_use_ema': True, 'sideways_use_atr': False, 'sideways_use_adx': True, 'sideways_use_spike': True, 'sideways_rsi_required': True}.
[I 2025-09-01 09:25:15,678] Trial 167 finished with values: [-1000000000.0, 1000000000.0] and parameters: {'p_sma': 29, 'p_std': 5, 'p_atr': 16, 'p_adx': 15, 'rsi_period': 72, 'ema1': 13, 'ema2': 34, 'slip_atr_k': 0.04973319959045262, 'slip_spread_k': 0.08439342849830422, 'spread_hl_frac': 0.010648428955254759, 'bb_std_mult': 1.936781456977037, 'rsi_os': 12, 'rsi_ob': 93, 'vol_spike': 0.23443734525369014, 'adx_thresh': 6.867818810171212, 'atr_min_pct': 0.01699470824763164, 'atr_max_pct': 0.05644421716288867, 'tp_mult': 1.509166534277392, 'tsl_mult': 0.21965673015134407, 'strategy': 'breakout', 'time_stop': 283, 'use_sma': True, 'use_atr': False, 'use_adx': True, 'use_ema': True, 'use_spike': True, 'rsi_required': False, 'edge_k': 1.5429278497540497, 'edge_cap': 0.05300634041968111, 'bull_strategy': 'mean_reversion', 'bull_bb_std_mult': 0.7427729711563986, 'bull_rsi_os': 15, 'bull_rsi_ob': 52, 'bull_adx_thresh': 24.58474646575803, 'bull_atr_min_pct': 0.016876461391703113, 'bull_atr_max_pct': 0.06019838789195149, 'bull_tp_mult': 1.7270792565650748, 'bull_tsl_mult': 0.06773933078573993, 'bull_time_stop': 121, 'bull_use_sma': False, 'bull_use_ema': False, 'bull_use_atr': True, 'bull_use_adx': True, 'bull_use_spike': False, 'bull_rsi_required': True, 'bear_strategy': 'mean_reversion', 'bear_bb_std_mult': 3.5432202974436917, 'bear_rsi_os': 46, 'bear_rsi_ob': 54, 'bear_adx_thresh': 14.65835771480095, 'bear_atr_min_pct': 0.015874663559870546, 'bear_atr_max_pct': 0.12671269059134097, 'bear_tp_mult': 2.6074397431188543, 'bear_tsl_mult': 0.205040724016265, 'bear_time_stop': 231, 'bear_use_sma': True, 'bear_use_ema': True, 'bear_use_atr': True, 'bear_use_adx': False, 'bear_use_spike': False, 'bear_rsi_required': False, 'sideways_strategy': 'breakout', 'sideways_bb_std_mult': 1.0476970962560865, 'sideways_rsi_os': 38, 'sideways_rsi_ob': 47, 'sideways_adx_thresh': 27.009285561632357, 'sideways_atr_min_pct': 0.006062754462184584, 'sideways_atr_max_pct': 0.08962208809235425, 'sideways_tp_mult': 2.1722296607910434, 'sideways_tsl_mult': 0.9122772395873392, 'sideways_time_stop': 228, 'sideways_use_sma': False, 'sideways_use_ema': True, 'sideways_use_atr': False, 'sideways_use_adx': True, 'sideways_use_spike': True, 'sideways_rsi_required': True}.
[I 2025-09-01 09:25:15,982] Trial 168 finished with values: [-0.03727981728787999, 0.037643635560990193] and parameters: {'p_sma': 30, 'p_std': 25, 'p_atr': 16, 'p_adx': 15, 'rsi_period': 63, 'ema1': 20, 'ema2': 56, 'slip_atr_k': 0.082069192239397, 'slip_spread_k': 0.24515944498663708, 'spread_hl_frac': 0.011833411399136995, 'bb_std_mult': 1.918233467126914, 'rsi_os': 38, 'rsi_ob': 52, 'vol_spike': 0.020470812146345857, 'adx_thresh': 5.091352482302234, 'atr_min_pct': 0.02136643359832158, 'atr_max_pct': 0.04449863434129276, 'tp_mult': 2.9219732743504196, 'tsl_mult': 0.6834141972730128, 'strategy': 'mean_reversion', 'time_stop': 119, 'use_sma': True, 'use_atr': False, 'use_adx': False, 'use_ema': True, 'use_spike': True, 'rsi_required': False, 'edge_k': 1.5460103090279251, 'edge_cap': 0.5508512139962183, 'bull_strategy': 'mean_reversion', 'bull_bb_std_mult': 0.7335140000378221, 'bull_rsi_os': 19, 'bull_rsi_ob': 60, 'bull_adx_thresh': 24.52156578484518, 'bull_atr_min_pct': 0.017052517351309044, 'bull_atr_max_pct': 0.060870480438160214, 'bull_tp_mult': 2.0416209389869295, 'bull_tsl_mult': 0.061369007245203167, 'bull_time_stop': 189, 'bull_use_sma': False, 'bull_use_ema': False, 'bull_use_atr': True, 'bull_use_adx': True, 'bull_use_spike': False, 'bull_rsi_required': True, 'bear_strategy': 'mean_reversion', 'bear_bb_std_mult': 2.8499714378071945, 'bear_rsi_os': 18, 'bear_rsi_ob': 69, 'bear_adx_thresh': 14.447197145643061, 'bear_atr_min_pct': 0.015922373876554704, 'bear_atr_max_pct': 0.12466779877626952, 'bear_tp_mult': 2.2346214570864724, 'bear_tsl_mult': 0.3881120096212123, 'bear_time_stop': 78, 'bear_use_sma': True, 'bear_use_ema': True, 'bear_use_atr': False, 'bear_use_adx': False, 'bear_use_spike': False, 'bear_rsi_required': False, 'sideways_strategy': 'breakout', 'sideways_bb_std_mult': 1.4213943757936676, 'sideways_rsi_os': 51, 'sideways_rsi_ob': 47, 'sideways_adx_thresh': 7.893889331922134, 'sideways_atr_min_pct': 0.003970112161726601, 'sideways_atr_max_pct': 0.035267903250391586, 'sideways_tp_mult': 1.9560506808411213, 'sideways_tsl_mult': 0.9195962408314338, 'sideways_time_stop': 225, 'sideways_use_sma': False, 'sideways_use_ema': True, 'sideways_use_atr': True, 'sideways_use_adx': True, 'sideways_use_spike': True, 'sideways_rsi_required': True}.
[I 2025-09-01 09:25:55,711] Trial 173 finished with values: [-1000000000.0, 1000000000.0] and parameters: {'p_sma': 38, 'p_std': 25, 'p_atr': 17, 'p_adx': 29, 'rsi_period': 59, 'ema1': 20, 'ema2': 17, 'slip_atr_k': 0.041210608311982574, 'slip_spread_k': 0.2881936662459496, 'spread_hl_frac': 0.042095441336414005, 'bb_std_mult': 1.8225882278143315, 'rsi_os': 7, 'rsi_ob': 85, 'vol_spike': 0.2193365164871153, 'adx_thresh': 6.149755585669813, 'atr_min_pct': 0.010937815148288479, 'atr_max_pct': 0.14559333880050204, 'tp_mult': 1.8937506498950292, 'tsl_mult': 0.8459694630365426, 'strategy': 'mean_reversion', 'time_stop': 209, 'use_sma': True, 'use_atr': True, 'use_adx': False, 'use_ema': False, 'use_spike': False, 'rsi_required': False, 'edge_k': 1.6276949633376692, 'edge_cap': 0.4447623297585362, 'bull_strategy': 'breakout', 'bull_bb_std_mult': 0.5447882955909623, 'bull_rsi_os': 14, 'bull_rsi_ob': 56, 'bull_adx_thresh': 10.017683404904318, 'bull_atr_min_pct': 0.02706291792970543, 'bull_atr_max_pct': 0.07322180715957187, 'bull_tp_mult': 1.9790547655324786, 'bull_tsl_mult': 0.8299329148985425, 'bull_time_stop': 107, 'bull_use_sma': True, 'bull_use_ema': True, 'bull_use_atr': False, 'bull_use_adx': False, 'bull_use_spike': True, 'bull_rsi_required': True, 'bear_strategy': 'breakout', 'bear_bb_std_mult': 1.233347103334146, 'bear_rsi_os': 47, 'bear_rsi_ob': 80, 'bear_adx_thresh': 26.268381821915355, 'bear_atr_min_pct': 0.0280286630415074, 'bear_atr_max_pct': 0.1071611846040455, 'bear_tp_mult': 2.3508369837525005, 'bear_tsl_mult': 0.06901412514958077, 'bear_time_stop': 91, 'bear_use_sma': False, 'bear_use_ema': True, 'bear_use_atr': False, 'bear_use_adx': False, 'bear_use_spike': True, 'bear_rsi_required': False, 'sideways_strategy': 'mean_reversion', 'sideways_bb_std_mult': 1.192334298224777, 'sideways_rsi_os': 6, 'sideways_rsi_ob': 64, 'sideways_adx_thresh': 15.204127925806949, 'sideways_atr_min_pct': 0.011527913652815086, 'sideways_atr_max_pct': 0.10095187264905636, 'sideways_tp_mult': 2.295632115163046, 'sideways_tsl_mult': 0.9470944245826894, 'sideways_time_stop': 208, 'sideways_use_sma': True, 'sideways_use_ema': False, 'sideways_use_atr': False, 'sideways_use_adx': False, 'sideways_use_spike': False, 'sideways_rsi_required': False}.
