[I 2025-09-01 09:51:20,687] Trial 324 finished with values: [-0.011355351097808275, 0.011734311436602744] and parameters: {'p_sma': 21, 'p_std': 44, 'p_atr': 29, 'p_adx': 22, 'rsi_period': 65, 'ema1': 21, 'ema2': 50, 'slip_atr_k': 0.048676195031470325, 'slip_spread_k': 0.18967047624346267, 'spread_hl_frac': 0.02798617915042591, 'bb_std_mult': 3.1921202573143113, 'rsi_os': 25, 'rsi_ob': 77, 'vol_spike': 0.28496785429130744, 'adx_thresh': 5.92537319437172, 'atr_min_pct': 0.024592057816780227, 'atr_max_pct': 0.07745341783615334, 'tp_mult': 2.7012851659432706, 'tsl_mult': 0.025359241900357807, 'strategy': 'breakout', 'time_stop': 154, 'use_sma': True, 'use_atr': False, 'use_adx': True, 'use_ema': False, 'use_spike': False, 'rsi_required': False, 'edge_k': 0.9322624549114911, 'edge_cap': 0.5808317548805176, 'bull_strategy': 'mean_reversion', 'bull_bb_std_mult': 0.8569037396538379, 'bull_rsi_os': 18, 'bull_rsi_ob': 55, 'bull_adx_thresh': 5.926001766933653, 'bull_atr_min_pct': 0.029984739444275495, 'bull_atr_max_pct': 0.0864282461456467, 'bull_tp_mult': 1.872040462956766, 'bull_tsl_mult': 0.053835067103045676, 'bull_time_stop': 155, 'bull_use_sma': True, 'bull_use_ema': False, 'bull_use_atr': True, 'bull_use_adx': True, 'bull_use_spike': False, 'bull_rsi_required': True, 'bear_strategy': 'mean_reversion', 'bear_bb_std_mult': 3.4599692924637666, 'bear_rsi_os': 47, 'bear_rsi_ob': 45, 'bear_adx_thresh': 12.84438296430195, 'bear_atr_min_pct': 0.016860199950152782, 'bear_atr_max_pct': 0.07014755942105029, 'bear_tp_mult': 1.2484967710765416, 'bear_tsl_mult': 0.4366222860357724, 'bear_time_stop': 139, 'bear_use_sma': False, 'bear_use_ema': True, 'bear_use_atr': True, 'bear_use_adx': False, 'bear_use_spike': True, 'bear_rsi_required': False, 'sideways_strategy': 'breakout', 'sideways_bb_std_mult': 3.330313940388244, 'sideways_rsi_os': 49, 'sideways_rsi_ob': 49, 'sideways_adx_thresh': 28.008020750404366, 'sideways_atr_min_pct': 0.0033804057310759658, 'sideways_atr_max_pct': 0.06858533565186457, 'sideways_tp_mult': 1.3249408714837678, 'sideways_tsl_mult': 0.851969005194452, 'sideways_time_stop': 199, 'sideways_use_sma': False, 'sideways_use_ema': True, 'sideways_use_atr': False, 'sideways_use_adx': False, 'sideways_use_spike': False, 'sideways_rsi_required': False}.
[I 2025-09-01 09:51:21,386] Trial 325 finished with values: [-1000000000.0, 1000000000.0] and parameters: {'p_sma': 21, 'p_std': 40, 'p_atr': 29, 'p_adx': 22, 'rsi_period': 62, 'ema1': 20, 'ema2': 57, 'slip_atr_k': 0.047901255562143856, 'slip_spread_k': 0.17886595043535886, 'spread_hl_frac': 0.028805448712523885, 'bb_std_mult': 3.3561743481176713, 'rsi_os': 25, 'rsi_ob': 76, 'vol_spike': 0.29971190448721946, 'adx_thresh': 5.9814196828924615, 'atr_min_pct': 0.02462988633230796, 'atr_max_pct': 0.025311952472833375, 'tp_mult': 2.7054220513747707, 'tsl_mult': 0.05997014454164037, 'strategy': 'breakout', 'time_stop': 154, 'use_sma': True, 'use_atr': False, 'use_adx': True, 'use_ema': False, 'use_spike': False, 'rsi_required': False, 'edge_k': 0.9287671072584045, 'edge_cap': 0.5514113643321513, 'bull_strategy': 'mean_reversion', 'bull_bb_std_mult': 0.7495875604768878, 'bull_rsi_os': 12, 'bull_rsi_ob': 55, 'bull_adx_thresh': 6.056398278369479, 'bull_atr_min_pct': 0.029960676791532418, 'bull_atr_max_pct': 0.08767553404219623, 'bull_tp_mult': 1.8561813982371251, 'bull_tsl_mult': 0.12125985274116607, 'bull_time_stop': 153, 'bull_use_sma': True, 'bull_use_ema': False, 'bull_use_atr': True, 'bull_use_adx': True, 'bull_use_spike': False, 'bull_rsi_required': True, 'bear_strategy': 'mean_reversion', 'bear_bb_std_mult': 3.4008848985033775, 'bear_rsi_os': 47, 'bear_rsi_ob': 45, 'bear_adx_thresh': 12.798182972386646, 'bear_atr_min_pct': 0.016996767965399916, 'bear_atr_max_pct': 0.06912689403340257, 'bear_tp_mult': 1.2576893606723238, 'bear_tsl_mult': 0.431343169604871, 'bear_time_stop': 139, 'bear_use_sma': False, 'bear_use_ema': True, 'bear_use_atr': True, 'bear_use_adx': False, 'bear_use_spike': True, 'bear_rsi_required': False, 'sideways_strategy': 'breakout', 'sideways_bb_std_mult': 3.3072946374633445, 'sideways_rsi_os': 49, 'sideways_rsi_ob': 49, 'sideways_adx_thresh': 31.355300193715408, 'sideways_atr_min_pct': 0.003523927185566959, 'sideways_atr_max_pct': 0.06968791650480684, 'sideways_tp_mult': 1.404970385920041, 'sideways_tsl_mult': 0.9748874716071299, 'sideways_time_stop': 202, 'sideways_use_sma': False, 'sideways_use_ema': True, 'sideways_use_atr': False, 'sideways_use_adx': False, 'sideways_use_spike': False, 'sideways_rsi_required': False}.
[I 2025-09-01 09:51:21,625] Trial 323 finished with values: [-0.011603661487934569, 0.011929195922101824] and parameters: {'p_sma': 24, 'p_std': 44, 'p_atr': 30, 'p_adx': 21, 'rsi_period': 70, 'ema1': 21, 'ema2': 57, 'slip_atr_k': 0.059201396859256905, 'slip_spread_k': 0.1907444292623164, 'spread_hl_frac': 0.028911989689062934, 'bb_std_mult': 3.1878972671869215, 'rsi_os': 25, 'rsi_ob': 77, 'vol_spike': 0.2923791514114241, 'adx_thresh': 6.00173009163719, 'atr_min_pct': 0.0245428462964247, 'atr_max_pct': 0.1313443225351964, 'tp_mult': 2.6177940849647174, 'tsl_mult': 0.022342785473525254, 'strategy': 'breakout', 'time_stop': 164, 'use_sma': True, 'use_atr': False, 'use_adx': True, 'use_ema': False, 'use_spike': False, 'rsi_required': False, 'edge_k': 0.940978654458722, 'edge_cap': 0.5378902155177451, 'bull_strategy': 'mean_reversion', 'bull_bb_std_mult': 0.9014184118075356, 'bull_rsi_os': 18, 'bull_rsi_ob': 56, 'bull_adx_thresh': 5.7163035707634515, 'bull_atr_min_pct': 0.029375827593189158, 'bull_atr_max_pct': 0.08187980637310074, 'bull_tp_mult': 1.8683479927971505, 'bull_tsl_mult': 0.13295896987215555, 'bull_time_stop': 139, 'bull_use_sma': True, 'bull_use_ema': False, 'bull_use_atr': True, 'bull_use_adx': True, 'bull_use_spike': False, 'bull_rsi_required': True, 'bear_strategy': 'mean_reversion', 'bear_bb_std_mult': 3.4705691921930524, 'bear_rsi_os': 47, 'bear_rsi_ob': 48, 'bear_adx_thresh': 10.785983234823243, 'bear_atr_min_pct': 0.017281514499074786, 'bear_atr_max_pct': 0.06832198972670547, 'bear_tp_mult': 1.2448723764263152, 'bear_tsl_mult': 0.38345997154925004, 'bear_time_stop': 138, 'bear_use_sma': False, 'bear_use_ema': True, 'bear_use_atr': True, 'bear_use_adx': False, 'bear_use_spike': True, 'bear_rsi_required': False, 'sideways_strategy': 'breakout', 'sideways_bb_std_mult': 3.1844403723823618, 'sideways_rsi_os': 50, 'sideways_rsi_ob': 47, 'sideways_adx_thresh': 29.190304220528514, 'sideways_atr_min_pct': 0.003411774528575476, 'sideways_atr_max_pct': 0.06957538862917591, 'sideways_tp_mult': 1.412431653772125, 'sideways_tsl_mult': 0.8346210687650583, 'sideways_time_stop': 173, 'sideways_use_sma': False, 'sideways_use_ema': True, 'sideways_use_atr': False, 'sideways_use_adx': False, 'sideways_use_spike': False, 'sideways_rsi_required': False}.
[I 2025-09-01 09:52:01,415] Trial 328 finished with values: [-1000000000.0, 1000000000.0] and parameters: {'p_sma': 20, 'p_std': 49, 'p_atr': 28, 'p_adx': 22, 'rsi_period': 35, 'ema1': 22, 'ema2': 57, 'slip_atr_k': 0.013504842016076588, 'slip_spread_k': 0.17740445735140004, 'spread_hl_frac': 0.025018554318569416, 'bb_std_mult': 3.1723879599502003, 'rsi_os': 26, 'rsi_ob': 79, 'vol_spike': 0.27251278179015903, 'adx_thresh': 14.342744398823642, 'atr_min_pct': 0.02517633124232218, 'atr_max_pct': 0.07790867793479962, 'tp_mult': 2.8757292495964526, 'tsl_mult': 0.40884171291769644, 'strategy': 'mean_reversion', 'time_stop': 145, 'use_sma': False, 'use_atr': True, 'use_adx': False, 'use_ema': True, 'use_spike': True, 'rsi_required': False, 'edge_k': 0.8598229886355355, 'edge_cap': 0.6206511152049041, 'bull_strategy': 'breakout', 'bull_bb_std_mult': 0.8700237201632706, 'bull_rsi_os': 21, 'bull_rsi_ob': 52, 'bull_adx_thresh': 5.316123232858088, 'bull_atr_min_pct': 0.02989134065290013, 'bull_atr_max_pct': 0.08292491623962184, 'bull_tp_mult': 1.8762608396519762, 'bull_tsl_mult': 0.0018124079876578325, 'bull_time_stop': 160, 'bull_use_sma': False, 'bull_use_ema': True, 'bull_use_atr': True, 'bull_use_adx': True, 'bull_use_spike': True, 'bull_rsi_required': False, 'bear_strategy': 'breakout', 'bear_bb_std_mult': 3.235866719797507, 'bear_rsi_os': 47, 'bear_rsi_ob': 45, 'bear_adx_thresh': 30.552763610077733, 'bear_atr_min_pct': 0.017983087654514795, 'bear_atr_max_pct': 0.07408085168400744, 'bear_tp_mult': 1.1119097907173414, 'bear_tsl_mult': 0.7893244017167391, 'bear_time_stop': 128, 'bear_use_sma': True, 'bear_use_ema': False, 'bear_use_atr': False, 'bear_use_adx': True, 'bear_use_spike': True, 'bear_rsi_required': True, 'sideways_strategy': 'mean_reversion', 'sideways_bb_std_mult': 3.4273720449962735, 'sideways_rsi_os': 50, 'sideways_rsi_ob': 51, 'sideways_adx_thresh': 27.040244057732025, 'sideways_atr_min_pct': 0.02400529601073615, 'sideways_atr_max_pct': 0.02279571560248985, 'sideways_tp_mult': 1.4063509128105838, 'sideways_tsl_mult': 0.7313694702603996, 'sideways_time_stop': 200, 'sideways_use_sma': True, 'sideways_use_ema': False, 'sideways_use_atr': True, 'sideways_use_adx': True, 'sideways_use_spike': True, 'sideways_rsi_required': True}.
[I 2025-09-01 09:52:02,140] Trial 327 finished with values: [-0.013525410415787475, 0.01375554889024408] and parameters: {'p_sma': 24, 'p_std': 40, 'p_atr': 30, 'p_adx': 22, 'rsi_period': 65, 'ema1': 20, 'ema2': 47, 'slip_atr_k': 0.04764279936997461, 'slip_spread_k': 0.17680619295216068, 'spread_hl_frac': 0.028082895095538126, 'bb_std_mult': 3.312149252069356, 'rsi_os': 6, 'rsi_ob': 76, 'vol_spike': 0.29392717480623365, 'adx_thresh': 5.732097189116212, 'atr_min_pct': 0.02245570767766684, 'atr_max_pct': 0.1437022275559905, 'tp_mult': 2.6554616419890067, 'tsl_mult': 0.01800074793000126, 'strategy': 'breakout', 'time_stop': 181, 'use_sma': True, 'use_atr': False, 'use_adx': True, 'use_ema': False, 'use_spike': False, 'rsi_required': False, 'edge_k': 0.9338524990485533, 'edge_cap': 0.5509807657547174, 'bull_strategy': 'mean_reversion', 'bull_bb_std_mult': 0.8128755880652515, 'bull_rsi_os': 20, 'bull_rsi_ob': 56, 'bull_adx_thresh': 6.366099314764831, 'bull_atr_min_pct': 0.02871699378541284, 'bull_atr_max_pct': 0.0864114188762396, 'bull_tp_mult': 1.9140397378554455, 'bull_tsl_mult': 0.11746466387384824, 'bull_time_stop': 155, 'bull_use_sma': True, 'bull_use_ema': False, 'bull_use_atr': True, 'bull_use_adx': True, 'bull_use_spike': False, 'bull_rsi_required': True, 'bear_strategy': 'mean_reversion', 'bear_bb_std_mult': 3.5988263161975826, 'bear_rsi_os': 47, 'bear_rsi_ob': 72, 'bear_adx_thresh': 14.955417290677438, 'bear_atr_min_pct': 0.013539911300129515, 'bear_atr_max_pct': 0.06882301453950669, 'bear_tp_mult': 1.25114093469152, 'bear_tsl_mult': 0.378959066419129, 'bear_time_stop': 130, 'bear_use_sma': False, 'bear_use_ema': True, 'bear_use_atr': True, 'bear_use_adx': False, 'bear_use_spike': True, 'bear_rsi_required': False, 'sideways_strategy': 'breakout', 'sideways_bb_std_mult': 3.3011904820228186, 'sideways_rsi_os': 50, 'sideways_rsi_ob': 48, 'sideways_adx_thresh': 27.816960449152738, 'sideways_atr_min_pct': 0.0034475871438634006, 'sideways_atr_max_pct': 0.06941636111995637, 'sideways_tp_mult': 1.186013543913448, 'sideways_tsl_mult': 0.9656516445338214, 'sideways_time_stop': 159, 'sideways_use_sma': False, 'sideways_use_ema': True, 'sideways_use_atr': False, 'sideways_use_adx': False, 'sideways_use_spike': False, 'sideways_rsi_required': False}.
[I 2025-09-01 09:52:02,141] Trial 330 finished with values: [-1000000000.0, 1000000000.0] and parameters: {'p_sma': 19, 'p_std': 45, 'p_atr': 28, 'p_adx': 23, 'rsi_period': 36, 'ema1': 22, 'ema2': 51, 'slip_atr_k': 0.16221083253671373, 'slip_spread_k': 0.12168516368477374, 'spread_hl_frac': 0.024932114068601824, 'bb_std_mult': 3.135814373901787, 'rsi_os': 27, 'rsi_ob': 79, 'vol_spike': 0.27368736560120127, 'adx_thresh': 30.70774402527952, 'atr_min_pct': 0.025033759793829442, 'atr_max_pct': 0.07783439863399547, 'tp_mult': 2.8631444461193567, 'tsl_mult': 0.9434947034437925, 'strategy': 'mean_reversion', 'time_stop': 148, 'use_sma': False, 'use_atr': True, 'use_adx': False, 'use_ema': True, 'use_spike': True, 'rsi_required': True, 'edge_k': 0.8616113321668428, 'edge_cap': 0.610512039715982, 'bull_strategy': 'breakout', 'bull_bb_std_mult': 0.8604127610928646, 'bull_rsi_os': 21, 'bull_rsi_ob': 53, 'bull_adx_thresh': 5.383800742857966, 'bull_atr_min_pct': 0.02996927387820091, 'bull_atr_max_pct': 0.08228037571257957, 'bull_tp_mult': 1.907313515966354, 'bull_tsl_mult': 0.0035512380721538367, 'bull_time_stop': 163, 'bull_use_sma': False, 'bull_use_ema': True, 'bull_use_atr': True, 'bull_use_adx': True, 'bull_use_spike': True, 'bull_rsi_required': False, 'bear_strategy': 'breakout', 'bear_bb_std_mult': 3.2823872250913846, 'bear_rsi_os': 9, 'bear_rsi_ob': 45, 'bear_adx_thresh': 25.97150453590153, 'bear_atr_min_pct': 0.017652085867818877, 'bear_atr_max_pct': 0.07444459260790713, 'bear_tp_mult': 1.1857173033105939, 'bear_tsl_mult': 0.4816788710016285, 'bear_time_stop': 127, 'bear_use_sma': True, 'bear_use_ema': False, 'bear_use_atr': False, 'bear_use_adx': True, 'bear_use_spike': True, 'bear_rsi_required': True, 'sideways_strategy': 'mean_reversion', 'sideways_bb_std_mult': 3.46092305405335, 'sideways_rsi_os': 51, 'sideways_rsi_ob': 51, 'sideways_adx_thresh': 26.966031987974898, 'sideways_atr_min_pct': 0.02409118296831956, 'sideways_atr_max_pct': 0.012214846957819159, 'sideways_tp_mult': 1.3400091171000925, 'sideways_tsl_mult': 0.8301977091422614, 'sideways_time_stop': 198, 'sideways_use_sma': True, 'sideways_use_ema': False, 'sideways_use_atr': True, 'sideways_use_adx': True, 'sideways_use_spike': True, 'sideways_rsi_required': True}.
[I 2025-09-01 09:52:02,498] Trial 329 finished with values: [-0.06268352587690929, 0.06242447361163042] and parameters: {'p_sma': 19, 'p_std': 47, 'p_atr': 28, 'p_adx': 23, 'rsi_period': 41, 'ema1': 22, 'ema2': 52, 'slip_atr_k': 0.15780893626362757, 'slip_spread_k': 0.13358776818166507, 'spread_hl_frac': 0.025297977835108516, 'bb_std_mult': 3.168276011913715, 'rsi_os': 27, 'rsi_ob': 79, 'vol_spike': 0.2699308974169246, 'adx_thresh': 11.53054995994527, 'atr_min_pct': 0.025257627364704535, 'atr_max_pct': 0.0787502029940229, 'tp_mult': 2.742961857262487, 'tsl_mult': 0.13643372819395688, 'strategy': 'mean_reversion', 'time_stop': 142, 'use_sma': False, 'use_atr': True, 'use_adx': False, 'use_ema': True, 'use_spike': True, 'rsi_required': True, 'edge_k': 0.855879847843088, 'edge_cap': 0.6001199010632338, 'bull_strategy': 'breakout', 'bull_bb_std_mult': 0.8415210562004292, 'bull_rsi_os': 21, 'bull_rsi_ob': 53, 'bull_adx_thresh': 5.07236146293617, 'bull_atr_min_pct': 0.0298433938218239, 'bull_atr_max_pct': 0.082249153750958, 'bull_tp_mult': 1.9160171532703365, 'bull_tsl_mult': 0.007634999020484083, 'bull_time_stop': 159, 'bull_use_sma': False, 'bull_use_ema': True, 'bull_use_atr': True, 'bull_use_adx': True, 'bull_use_spike': True, 'bull_rsi_required': False, 'bear_strategy': 'breakout', 'bear_bb_std_mult': 3.339153587677487, 'bear_rsi_os': 32, 'bear_rsi_ob': 45, 'bear_adx_thresh': 19.118435617650423, 'bear_atr_min_pct': 0.017917986563736842, 'bear_atr_max_pct': 0.07401873722302486, 'bear_tp_mult': 1.1167063506873771, 'bear_tsl_mult': 0.0716523686482039, 'bear_time_stop': 125, 'bear_use_sma': True, 'bear_use_ema': False, 'bear_use_atr': False, 'bear_use_adx': True, 'bear_use_spike': True, 'bear_rsi_required': True, 'sideways_strategy': 'mean_reversion', 'sideways_bb_std_mult': 3.445077446663761, 'sideways_rsi_os': 50, 'sideways_rsi_ob': 51, 'sideways_adx_thresh': 26.993371303884924, 'sideways_atr_min_pct': 0.002157696911616446, 'sideways_atr_max_pct': 0.07869036105044583, 'sideways_tp_mult': 1.3303729485984517, 'sideways_tsl_mult': 0.7623726594724811, 'sideways_time_stop': 197, 'sideways_use_sma': True, 'sideways_use_ema': False, 'sideways_use_atr': True, 'sideways_use_adx': True, 'sideways_use_spike': True, 'sideways_rsi_required': True}.
[I 2025-09-01 09:52:42,691] Trial 333 finished with values: [-0.09932541423337893, 0.09906307604881233] and parameters: {'p_sma': 16, 'p_std': 47, 'p_atr': 27, 'p_adx': 22, 'rsi_period': 45, 'ema1': 22, 'ema2': 52, 'slip_atr_k': 0.21123960558283944, 'slip_spread_k': 0.1614755915475325, 'spread_hl_frac': 0.025802192509600124, 'bb_std_mult': 3.068161393906381, 'rsi_os': 29, 'rsi_ob': 78, 'vol_spike': 0.28585082292698283, 'adx_thresh': 25.910289085571055, 'atr_min_pct': 0.025346942874434536, 'atr_max_pct': 0.08101223963095791, 'tp_mult': 2.7512470854339828, 'tsl_mult': 0.5208489608808727, 'strategy': 'mean_reversion', 'time_stop': 143, 'use_sma': False, 'use_atr': True, 'use_adx': False, 'use_ema': True, 'use_spike': True, 'rsi_required': True, 'edge_k': 0.9081004902208739, 'edge_cap': 0.6274878996710335, 'bull_strategy': 'breakout', 'bull_bb_std_mult': 0.949772342753494, 'bull_rsi_os': 20, 'bull_rsi_ob': 53, 'bull_adx_thresh': 5.144583766961302, 'bull_atr_min_pct': 0.02970823538204132, 'bull_atr_max_pct': 0.08464684937885152, 'bull_tp_mult': 1.9271310305403455, 'bull_tsl_mult': 0.021358046019275503, 'bull_time_stop': 158, 'bull_use_sma': False, 'bull_use_ema': True, 'bull_use_atr': True, 'bull_use_adx': True, 'bull_use_spike': True, 'bull_rsi_required': False, 'bear_strategy': 'breakout', 'bear_bb_std_mult': 3.362194452937923, 'bear_rsi_os': 38, 'bear_rsi_ob': 45, 'bear_adx_thresh': 24.098253132024922, 'bear_atr_min_pct': 0.017698217504069, 'bear_atr_max_pct': 0.07246939169951913, 'bear_tp_mult': 1.2234699419277428, 'bear_tsl_mult': 0.23915531211835594, 'bear_time_stop': 120, 'bear_use_sma': True, 'bear_use_ema': False, 'bear_use_atr': False, 'bear_use_adx': True, 'bear_use_spike': True, 'bear_rsi_required': True, 'sideways_strategy': 'mean_reversion', 'sideways_bb_std_mult': 3.4127694709865004, 'sideways_rsi_os': 50, 'sideways_rsi_ob': 52, 'sideways_adx_thresh': 26.22364527863615, 'sideways_atr_min_pct': 0.0017840577238688192, 'sideways_atr_max_pct': 0.03508535769984871, 'sideways_tp_mult': 1.3398666592474642, 'sideways_tsl_mult': 0.8193210678660757, 'sideways_time_stop': 198, 'sideways_use_sma': True, 'sideways_use_ema': False, 'sideways_use_atr': True, 'sideways_use_adx': True, 'sideways_use_spike': True, 'sideways_rsi_required': True}.
[I 2025-09-01 09:52:43,300] Trial 334 finished with values: [-1000000000.0, 1000000000.0] and parameters: {'p_sma': 16, 'p_std': 48, 'p_atr': 25, 'p_adx': 22, 'rsi_period': 31, 'ema1': 22, 'ema2': 54, 'slip_atr_k': 0.09983129651272071, 'slip_spread_k': 0.15974023177017155, 'spread_hl_frac': 0.025688163055905187, 'bb_std_mult': 3.061222029335932, 'rsi_os': 30, 'rsi_ob': 78, 'vol_spike': 0.26682253940997147, 'adx_thresh': 20.239437279294506, 'atr_min_pct': 0.0255380270346792, 'atr_max_pct': 0.08134868612911654, 'tp_mult': 2.7799071934114554, 'tsl_mult': 0.09468852348376877, 'strategy': 'mean_reversion', 'time_stop': 137, 'use_sma': False, 'use_atr': True, 'use_adx': False, 'use_ema': True, 'use_spike': True, 'rsi_required': True, 'edge_k': 0.9125076125123841, 'edge_cap': 0.5889504208676039, 'bull_strategy': 'breakout', 'bull_bb_std_mult': 1.9632912215775957, 'bull_rsi_os': 20, 'bull_rsi_ob': 53, 'bull_adx_thresh': 5.007014144632201, 'bull_atr_min_pct': 0.02997814152706656, 'bull_atr_max_pct': 0.08470203535258039, 'bull_tp_mult': 1.8714048880242906, 'bull_tsl_mult': 0.02615898892977564, 'bull_time_stop': 157, 'bull_use_sma': False, 'bull_use_ema': True, 'bull_use_atr': True, 'bull_use_adx': True, 'bull_use_spike': True, 'bull_rsi_required': False, 'bear_strategy': 'breakout', 'bear_bb_std_mult': 3.3732502478277233, 'bear_rsi_os': 38, 'bear_rsi_ob': 45, 'bear_adx_thresh': 22.449966189981645, 'bear_atr_min_pct': 0.017582126141072924, 'bear_atr_max_pct': 0.07761394743679922, 'bear_tp_mult': 1.187180214327959, 'bear_tsl_mult': 0.4707171721561871, 'bear_time_stop': 132, 'bear_use_sma': True, 'bear_use_ema': False, 'bear_use_atr': False, 'bear_use_adx': True, 'bear_use_spike': True, 'bear_rsi_required': True, 'sideways_strategy': 'mean_reversion', 'sideways_bb_std_mult': 3.3467379996855184, 'sideways_rsi_os': 49, 'sideways_rsi_ob': 52, 'sideways_adx_thresh': 26.253846913750657, 'sideways_atr_min_pct': 0.027453812207074598, 'sideways_atr_max_pct': 0.07583877074581671, 'sideways_tp_mult': 1.4849870373494483, 'sideways_tsl_mult': 0.8026237103841808, 'sideways_time_stop': 202, 'sideways_use_sma': True, 'sideways_use_ema': False, 'sideways_use_atr': True, 'sideways_use_adx': True, 'sideways_use_spike': True, 'sideways_rsi_required': True}.
