[I 2025-09-01 09:59:17,848] Trial 369 finished with values: [-1000000000.0, 1000000000.0] and parameters: {'p_sma': 22, 'p_std': 37, 'p_atr': 25, 'p_adx': 21, 'rsi_period': 34, 'ema1': 21, 'ema2': 54, 'slip_atr_k': 0.10203983213110532, 'slip_spread_k': 0.1492192736081978, 'spread_hl_frac': 0.027526018291242682, 'bb_std_mult': 3.2833263685577707, 'rsi_os': 28, 'rsi_ob': 77, 'vol_spike': 0.1789656544646942, 'adx_thresh': 10.960769492262694, 'atr_min_pct': 0.015305072986133945, 'atr_max_pct': 0.07338377099495702, 'tp_mult': 2.6555552388679637, 'tsl_mult': 0.04573042000497429, 'strategy': 'breakout', 'time_stop': 153, 'use_sma': True, 'use_atr': False, 'use_adx': True, 'use_ema': False, 'use_spike': False, 'rsi_required': False, 'edge_k': 0.5198931139757753, 'edge_cap': 0.32424657085426944, 'bull_strategy': 'mean_reversion', 'bull_bb_std_mult': 0.9669101053017111, 'bull_rsi_os': 21, 'bull_rsi_ob': 55, 'bull_adx_thresh': 25.50117598427278, 'bull_atr_min_pct': 0.003532839217086182, 'bull_atr_max_pct': 0.08908055772230701, 'bull_tp_mult': 1.1741839622963162, 'bull_tsl_mult': 0.3736314881540399, 'bull_time_stop': 208, 'bull_use_sma': True, 'bull_use_ema': False, 'bull_use_atr': True, 'bull_use_adx': True, 'bull_use_spike': False, 'bull_rsi_required': True, 'bear_strategy': 'mean_reversion', 'bear_bb_std_mult': 0.6283044688465362, 'bear_rsi_os': 31, 'bear_rsi_ob': 82, 'bear_adx_thresh': 12.051506839824699, 'bear_atr_min_pct': 0.021727663751344013, 'bear_atr_max_pct': 0.14165533070269065, 'bear_tp_mult': 1.581216123531585, 'bear_tsl_mult': 0.7007881668458456, 'bear_time_stop': 148, 'bear_use_sma': False, 'bear_use_ema': True, 'bear_use_atr': True, 'bear_use_adx': False, 'bear_use_spike': True, 'bear_rsi_required': False, 'sideways_strategy': 'breakout', 'sideways_bb_std_mult': 3.390852443100128, 'sideways_rsi_os': 30, 'sideways_rsi_ob': 78, 'sideways_adx_thresh': 16.829548430974384, 'sideways_atr_min_pct': 0.026983058610080123, 'sideways_atr_max_pct': 0.07220373234888763, 'sideways_tp_mult': 1.2879076418126814, 'sideways_tsl_mult': 0.5457110374707571, 'sideways_time_stop': 56, 'sideways_use_sma': False, 'sideways_use_ema': True, 'sideways_use_atr': False, 'sideways_use_adx': False, 'sideways_use_spike': False, 'sideways_rsi_required': False}.
[I 2025-09-01 09:59:18,049] Trial 367 finished with values: [-1000000000.0, 0.5206100521377941] and parameters: {'p_sma': 36, 'p_std': 48, 'p_atr': 12, 'p_adx': 21, 'rsi_period': 7, 'ema1': 26, 'ema2': 48, 'slip_atr_k': 0.057192606425609374, 'slip_spread_k': 0.8454616630898393, 'spread_hl_frac': 0.027530460671713303, 'bb_std_mult': 3.26448059283248, 'rsi_os': 24, 'rsi_ob': 77, 'vol_spike': 0.07645406996147983, 'adx_thresh': 6.390745764755775, 'atr_min_pct': 0.0058293774992238204, 'atr_max_pct': 0.07327368638141611, 'tp_mult': 1.4812095900506235, 'tsl_mult': 0.2118959019101173, 'strategy': 'breakout', 'time_stop': 39, 'use_sma': True, 'use_atr': False, 'use_adx': True, 'use_ema': False, 'use_spike': False, 'rsi_required': False, 'edge_k': 1.0050809770701223, 'edge_cap': 0.6225880977738881, 'bull_strategy': 'mean_reversion', 'bull_bb_std_mult': 3.1241628443564107, 'bull_rsi_os': 36, 'bull_rsi_ob': 55, 'bull_adx_thresh': 5.008227606655828, 'bull_atr_min_pct': 0.018669412239397498, 'bull_atr_max_pct': 0.09226047121019892, 'bull_tp_mult': 1.825711054360643, 'bull_tsl_mult': 0.01565149806449015, 'bull_time_stop': 294, 'bull_use_sma': True, 'bull_use_ema': False, 'bull_use_atr': True, 'bull_use_adx': True, 'bull_use_spike': False, 'bull_rsi_required': True, 'bear_strategy': 'mean_reversion', 'bear_bb_std_mult': 2.7291393133592483, 'bear_rsi_os': 45, 'bear_rsi_ob': 82, 'bear_adx_thresh': 10.878691805269103, 'bear_atr_min_pct': 0.0027049861288405107, 'bear_atr_max_pct': 0.09076186156710143, 'bear_tp_mult': 1.252956086650016, 'bear_tsl_mult': 0.1230161705231379, 'bear_time_stop': 147, 'bear_use_sma': False, 'bear_use_ema': True, 'bear_use_atr': True, 'bear_use_adx': False, 'bear_use_spike': True, 'bear_rsi_required': False, 'sideways_strategy': 'breakout', 'sideways_bb_std_mult': 3.5653128351430157, 'sideways_rsi_os': 51, 'sideways_rsi_ob': 51, 'sideways_adx_thresh': 27.20699755601832, 'sideways_atr_min_pct': 0.00046618881760787396, 'sideways_atr_max_pct': 0.06972135969357561, 'sideways_tp_mult': 1.072965187110858, 'sideways_tsl_mult': 0.8676418569139356, 'sideways_time_stop': 198, 'sideways_use_sma': False, 'sideways_use_ema': True, 'sideways_use_atr': False, 'sideways_use_adx': False, 'sideways_use_spike': False, 'sideways_rsi_required': False}.
[I 2025-09-01 10:00:00,672] Trial 372 finished with values: [-1000000000.0, 1000000000.0] and parameters: {'p_sma': 14, 'p_std': 18, 'p_atr': 19, 'p_adx': 23, 'rsi_period': 52, 'ema1': 22, 'ema2': 43, 'slip_atr_k': 0.038299804912758875, 'slip_spread_k': 0.1868706222306334, 'spread_hl_frac': 0.03004332424420176, 'bb_std_mult': 0.9489011404147092, 'rsi_os': 45, 'rsi_ob': 74, 'vol_spike': 0.152197387655407, 'adx_thresh': 21.594817623367852, 'atr_min_pct': 0.01650717587263656, 'atr_max_pct': 0.07541941020471304, 'tp_mult': 2.8587352388603646, 'tsl_mult': 0.1758519245822147, 'strategy': 'breakout', 'time_stop': 146, 'use_sma': False, 'use_atr': False, 'use_adx': True, 'use_ema': False, 'use_spike': False, 'rsi_required': False, 'edge_k': 0.8636206563092605, 'edge_cap': 0.5478015063439906, 'bull_strategy': 'mean_reversion', 'bull_bb_std_mult': 2.6621083142163218, 'bull_rsi_os': 25, 'bull_rsi_ob': 45, 'bull_adx_thresh': 6.33626226379965, 'bull_atr_min_pct': 0.029947816096283095, 'bull_atr_max_pct': 0.04735538324600756, 'bull_tp_mult': 1.8251563908372042, 'bull_tsl_mult': 0.016743288844492624, 'bull_time_stop': 33, 'bull_use_sma': False, 'bull_use_ema': False, 'bull_use_atr': True, 'bull_use_adx': True, 'bull_use_spike': False, 'bull_rsi_required': True, 'bear_strategy': 'mean_reversion', 'bear_bb_std_mult': 3.4319755521357935, 'bear_rsi_os': 45, 'bear_rsi_ob': 58, 'bear_adx_thresh': 12.963125983435843, 'bear_atr_min_pct': 0.0196344663874439, 'bear_atr_max_pct': 0.10140462749411219, 'bear_tp_mult': 1.1163234808186513, 'bear_tsl_mult': 0.5341388496831228, 'bear_time_stop': 126, 'bear_use_sma': False, 'bear_use_ema': True, 'bear_use_atr': True, 'bear_use_adx': False, 'bear_use_spike': True, 'bear_rsi_required': False, 'sideways_strategy': 'breakout', 'sideways_bb_std_mult': 3.3155047369938058, 'sideways_rsi_os': 47, 'sideways_rsi_ob': 71, 'sideways_adx_thresh': 27.795583764059977, 'sideways_atr_min_pct': 0.014377729307870275, 'sideways_atr_max_pct': 0.11548688798903815, 'sideways_tp_mult': 1.0567748486792383, 'sideways_tsl_mult': 0.5744056640438946, 'sideways_time_stop': 193, 'sideways_use_sma': True, 'sideways_use_ema': True, 'sideways_use_atr': True, 'sideways_use_adx': False, 'sideways_use_spike': False, 'sideways_rsi_required': False}.
[I 2025-09-01 10:00:00,775] Trial 374 finished with values: [-0.06501596734012616, 0.06471611071321998] and parameters: {'p_sma': 11, 'p_std': 5, 'p_atr': 19, 'p_adx': 27, 'rsi_period': 14, 'ema1': 16, 'ema2': 44, 'slip_atr_k': 0.041223124430298824, 'slip_spread_k': 0.09711648858204275, 'spread_hl_frac': 0.030109892245244442, 'bb_std_mult': 3.112037829766676, 'rsi_os': 37, 'rsi_ob': 51, 'vol_spike': 0.03654553472563418, 'adx_thresh': 18.329111512540926, 'atr_min_pct': 0.0014866759750886641, 'atr_max_pct': 0.07555234488675208, 'tp_mult': 2.87091025578364, 'tsl_mult': 0.03572436647399705, 'strategy': 'breakout', 'time_stop': 286, 'use_sma': False, 'use_atr': False, 'use_adx': True, 'use_ema': True, 'use_spike': False, 'rsi_required': False, 'edge_k': 0.089709671991686, 'edge_cap': 0.7716261029654219, 'bull_strategy': 'mean_reversion', 'bull_bb_std_mult': 0.8778520308681943, 'bull_rsi_os': 25, 'bull_rsi_ob': 83, 'bull_adx_thresh': 19.143989457453106, 'bull_atr_min_pct': 0.009302094877224906, 'bull_atr_max_pct': 0.08706200143238298, 'bull_tp_mult': 1.8193749409621036, 'bull_tsl_mult': 0.243641396550694, 'bull_time_stop': 170, 'bull_use_sma': False, 'bull_use_ema': False, 'bull_use_atr': True, 'bull_use_adx': True, 'bull_use_spike': True, 'bull_rsi_required': False, 'bear_strategy': 'mean_reversion', 'bear_bb_std_mult': 3.3738274969958146, 'bear_rsi_os': 7, 'bear_rsi_ob': 58, 'bear_adx_thresh': 32.152335160065675, 'bear_atr_min_pct': 0.0255676134256821, 'bear_atr_max_pct': 0.046017508649406375, 'bear_tp_mult': 1.1871056314181947, 'bear_tsl_mult': 0.4363845879147254, 'bear_time_stop': 36, 'bear_use_sma': False, 'bear_use_ema': True, 'bear_use_atr': True, 'bear_use_adx': False, 'bear_use_spike': True, 'bear_rsi_required': False, 'sideways_strategy': 'breakout', 'sideways_bb_std_mult': 3.2764977246833173, 'sideways_rsi_os': 24, 'sideways_rsi_ob': 71, 'sideways_adx_thresh': 5.513335370935172, 'sideways_atr_min_pct': 0.002566027335537369, 'sideways_atr_max_pct': 0.13094759539635112, 'sideways_tp_mult': 2.3037048486074916, 'sideways_tsl_mult': 0.8109582765827038, 'sideways_time_stop': 188, 'sideways_use_sma': True, 'sideways_use_ema': False, 'sideways_use_atr': True, 'sideways_use_adx': False, 'sideways_use_spike': False, 'sideways_rsi_required': False}.
[I 2025-09-01 10:00:01,374] Trial 373 finished with values: [-0.030966791448628128, 0.03099086577641099] and parameters: {'p_sma': 11, 'p_std': 48, 'p_atr': 19, 'p_adx': 23, 'rsi_period': 63, 'ema1': 11, 'ema2': 43, 'slip_atr_k': 0.03949310975408348, 'slip_spread_k': 0.1904452839123205, 'spread_hl_frac': 0.030167017328328587, 'bb_std_mult': 0.9527099055985748, 'rsi_os': 24, 'rsi_ob': 75, 'vol_spike': 0.29341537688840563, 'adx_thresh': 6.877296902722606, 'atr_min_pct': 0.02492919428235997, 'atr_max_pct': 0.07489848781673586, 'tp_mult': 2.4229486622285052, 'tsl_mult': 0.8763321583814252, 'strategy': 'breakout', 'time_stop': 287, 'use_sma': False, 'use_atr': False, 'use_adx': True, 'use_ema': False, 'use_spike': False, 'rsi_required': False, 'edge_k': 0.8828880598679252, 'edge_cap': 0.5678520135648977, 'bull_strategy': 'mean_reversion', 'bull_bb_std_mult': 0.8642042274849799, 'bull_rsi_os': 33, 'bull_rsi_ob': 54, 'bull_adx_thresh': 6.385968164950048, 'bull_atr_min_pct': 0.015119245043906975, 'bull_atr_max_pct': 0.08180307985978727, 'bull_tp_mult': 1.8168454713744806, 'bull_tsl_mult': 0.02493851510749878, 'bull_time_stop': 293, 'bull_use_sma': False, 'bull_use_ema': False, 'bull_use_atr': True, 'bull_use_adx': True, 'bull_use_spike': False, 'bull_rsi_required': True, 'bear_strategy': 'mean_reversion', 'bear_bb_std_mult': 1.7143762479322238, 'bear_rsi_os': 45, 'bear_rsi_ob': 46, 'bear_adx_thresh': 12.9407206547437, 'bear_atr_min_pct': 0.01832141210223005, 'bear_atr_max_pct': 0.06979114059865082, 'bear_tp_mult': 2.760230442677524, 'bear_tsl_mult': 0.9996618307414686, 'bear_time_stop': 138, 'bear_use_sma': False, 'bear_use_ema': True, 'bear_use_atr': True, 'bear_use_adx': False, 'bear_use_spike': True, 'bear_rsi_required': False, 'sideways_strategy': 'breakout', 'sideways_bb_std_mult': 3.326426972691666, 'sideways_rsi_os': 47, 'sideways_rsi_ob': 74, 'sideways_adx_thresh': 24.769647141399428, 'sideways_atr_min_pct': 0.0025181143676108308, 'sideways_atr_max_pct': 0.13129293780324605, 'sideways_tp_mult': 1.2039962450927688, 'sideways_tsl_mult': 0.627220104642475, 'sideways_time_stop': 188, 'sideways_use_sma': True, 'sideways_use_ema': True, 'sideways_use_atr': True, 'sideways_use_adx': False, 'sideways_use_spike': False, 'sideways_rsi_required': False}.
[I 2025-09-01 10:00:01,662] Trial 371 finished with values: [-0.07546843166704731, 0.07516792961755954] and parameters: {'p_sma': 18, 'p_std': 37, 'p_atr': 25, 'p_adx': 21, 'rsi_period': 53, 'ema1': 16, 'ema2': 53, 'slip_atr_k': 0.04182790115335472, 'slip_spread_k': 0.19689370060259362, 'spread_hl_frac': 0.025830147456708814, 'bb_std_mult': 3.2963465336387974, 'rsi_os': 24, 'rsi_ob': 77, 'vol_spike': 0.07330310253043798, 'adx_thresh': 18.33658293651714, 'atr_min_pct': 0.005876969534752984, 'atr_max_pct': 0.07383935055413628, 'tp_mult': 2.6571350745305127, 'tsl_mult': 0.5666343297171321, 'strategy': 'breakout', 'time_stop': 272, 'use_sma': True, 'use_atr': False, 'use_adx': True, 'use_ema': False, 'use_spike': False, 'rsi_required': False, 'edge_k': 0.9926848463770658, 'edge_cap': 0.625899128277636, 'bull_strategy': 'mean_reversion', 'bull_bb_std_mult': 0.8914520296517077, 'bull_rsi_os': 18, 'bull_rsi_ob': 83, 'bull_adx_thresh': 29.595441936477883, 'bull_atr_min_pct': 0.0018332924585154203, 'bull_atr_max_pct': 0.08805785213952401, 'bull_tp_mult': 1.823400995537588, 'bull_tsl_mult': 0.03442412843810749, 'bull_time_stop': 156, 'bull_use_sma': True, 'bull_use_ema': False, 'bull_use_atr': True, 'bull_use_adx': True, 'bull_use_spike': False, 'bull_rsi_required': True, 'bear_strategy': 'mean_reversion', 'bear_bb_std_mult': 2.655614677691435, 'bear_rsi_os': 29, 'bear_rsi_ob': 81, 'bear_adx_thresh': 12.246362807742646, 'bear_atr_min_pct': 0.02584922973575958, 'bear_atr_max_pct': 0.06606432027278661, 'bear_tp_mult': 1.1933110780885998, 'bear_tsl_mult': 0.43694277504318974, 'bear_time_stop': 149, 'bear_use_sma': False, 'bear_use_ema': True, 'bear_use_atr': True, 'bear_use_adx': False, 'bear_use_spike': True, 'bear_rsi_required': False, 'sideways_strategy': 'breakout', 'sideways_bb_std_mult': 3.3838125718669345, 'sideways_rsi_os': 48, 'sideways_rsi_ob': 50, 'sideways_adx_thresh': 6.826425605374279, 'sideways_atr_min_pct': 0.002617051418570354, 'sideways_atr_max_pct': 0.042719864324619064, 'sideways_tp_mult': 2.0524507491610806, 'sideways_tsl_mult': 0.24154564265955603, 'sideways_time_stop': 189, 'sideways_use_sma': False, 'sideways_use_ema': True, 'sideways_use_atr': False, 'sideways_use_adx': False, 'sideways_use_spike': False, 'sideways_rsi_required': False}.
[I 2025-09-01 10:00:43,348] Trial 376 finished with values: [-1000000000.0, 1000000000.0] and parameters: {'p_sma': 18, 'p_std': 60, 'p_atr': 23, 'p_adx': 7, 'rsi_period': 31, 'ema1': 12, 'ema2': 57, 'slip_atr_k': 0.04427709981717506, 'slip_spread_k': 0.604647558601698, 'spread_hl_frac': 0.02602034362344146, 'bb_std_mult': 3.212734088381676, 'rsi_os': 23, 'rsi_ob': 63, 'vol_spike': 0.2921267979662209, 'adx_thresh': 6.771677229415814, 'atr_min_pct': 0.02487474620793076, 'atr_max_pct': 0.07919586037617833, 'tp_mult': 2.310338320863183, 'tsl_mult': 0.08956151224395009, 'strategy': 'mean_reversion', 'time_stop': 164, 'use_sma': True, 'use_atr': False, 'use_adx': True, 'use_ema': False, 'use_spike': False, 'rsi_required': False, 'edge_k': 1.0993814226363057, 'edge_cap': 0.5726180659412573, 'bull_strategy': 'mean_reversion', 'bull_bb_std_mult': 0.8066360608996758, 'bull_rsi_os': 18, 'bull_rsi_ob': 54, 'bull_adx_thresh': 5.588279310986827, 'bull_atr_min_pct': 0.029970854214051372, 'bull_atr_max_pct': 0.08242206850405612, 'bull_tp_mult': 1.9124662432793218, 'bull_tsl_mult': 0.9265996640574257, 'bull_time_stop': 154, 'bull_use_sma': True, 'bull_use_ema': False, 'bull_use_atr': True, 'bull_use_adx': True, 'bull_use_spike': False, 'bull_rsi_required': True, 'bear_strategy': 'mean_reversion', 'bear_bb_std_mult': 1.6104933749030332, 'bear_rsi_os': 47, 'bear_rsi_ob': 46, 'bear_adx_thresh': 8.736267704369954, 'bear_atr_min_pct': 0.005857063497642315, 'bear_atr_max_pct': 0.07055758941681288, 'bear_tp_mult': 1.3159284622056118, 'bear_tsl_mult': 0.9194354348872011, 'bear_time_stop': 269, 'bear_use_sma': False, 'bear_use_ema': True, 'bear_use_atr': True, 'bear_use_adx': False, 'bear_use_spike': True, 'bear_rsi_required': True, 'sideways_strategy': 'mean_reversion', 'sideways_bb_std_mult': 2.7072378191826703, 'sideways_rsi_os': 53, 'sideways_rsi_ob': 63, 'sideways_adx_thresh': 25.293416433279052, 'sideways_atr_min_pct': 0.02629402847036177, 'sideways_atr_max_pct': 0.034967614305521776, 'sideways_tp_mult': 1.3551894324075515, 'sideways_tsl_mult': 0.000667192776999892, 'sideways_time_stop': 209, 'sideways_use_sma': False, 'sideways_use_ema': True, 'sideways_use_atr': False, 'sideways_use_adx': False, 'sideways_use_spike': False, 'sideways_rsi_required': False}.
[I 2025-09-01 10:00:44,198] Trial 377 finished with values: [-1000000000.0, 1000000000.0] and parameters: {'p_sma': 21, 'p_std': 47, 'p_atr': 26, 'p_adx': 7, 'rsi_period': 45, 'ema1': 22, 'ema2': 50, 'slip_atr_k': 0.19075039280793604, 'slip_spread_k': 0.6028107894371617, 'spread_hl_frac': 0.04429872612924698, 'bb_std_mult': 3.1953481515308484, 'rsi_os': 35, 'rsi_ob': 56, 'vol_spike': 0.28006938330824216, 'adx_thresh': 20.57048593866582, 'atr_min_pct': 0.024638583740536214, 'atr_max_pct': 0.09069339151679265, 'tp_mult': 2.9320191204160064, 'tsl_mult': 0.09884103035316524, 'strategy': 'mean_reversion', 'time_stop': 162, 'use_sma': True, 'use_atr': False, 'use_adx': True, 'use_ema': True, 'use_spike': True, 'rsi_required': False, 'edge_k': 1.9986090527930724, 'edge_cap': 0.5937454400239973, 'bull_strategy': 'mean_reversion', 'bull_bb_std_mult': 1.0194895457071613, 'bull_rsi_os': 18, 'bull_rsi_ob': 65, 'bull_adx_thresh': 5.712888159142653, 'bull_atr_min_pct': 0.0072783858750128235, 'bull_atr_max_pct': 0.09717255360263757, 'bull_tp_mult': 1.7420308846857173, 'bull_tsl_mult': 0.9380941442936259, 'bull_time_stop': 85, 'bull_use_sma': True, 'bull_use_ema': False, 'bull_use_atr': True, 'bull_use_adx': True, 'bull_use_spike': False, 'bull_rsi_required': False, 'bear_strategy': 'breakout', 'bear_bb_std_mult': 1.5137353797316968, 'bear_rsi_os': 29, 'bear_rsi_ob': 46, 'bear_adx_thresh': 20.1130249412039, 'bear_atr_min_pct': 0.00572093759237976, 'bear_atr_max_pct': 0.07551749890443091, 'bear_tp_mult': 1.3354976338254974, 'bear_tsl_mult': 0.05874751970035419, 'bear_time_stop': 140, 'bear_use_sma': False, 'bear_use_ema': True, 'bear_use_atr': True, 'bear_use_adx': False, 'bear_use_spike': True, 'bear_rsi_required': True, 'sideways_strategy': 'mean_reversion', 'sideways_bb_std_mult': 2.119505315025893, 'sideways_rsi_os': 48, 'sideways_rsi_ob': 50, 'sideways_adx_thresh': 28.038799802504045, 'sideways_atr_min_pct': 0.0036152339368107785, 'sideways_atr_max_pct': 0.03461373081854653, 'sideways_tp_mult': 1.3307974693822788, 'sideways_tsl_mult': 0.8766052247138654, 'sideways_time_stop': 207, 'sideways_use_sma': False, 'sideways_use_ema': True, 'sideways_use_atr': False, 'sideways_use_adx': False, 'sideways_use_spike': False, 'sideways_rsi_required': False}.
[I 2025-09-01 10:00:44,492] Trial 375 finished with values: [-0.18655902885747377, 0.186319382953107] and parameters: {'p_sma': 18, 'p_std': 5, 'p_atr': 11, 'p_adx': 27, 'rsi_period': 32, 'ema1': 11, 'ema2': 44, 'slip_atr_k': 0.041759327035826195, 'slip_spread_k': 0.1923211466066101, 'spread_hl_frac': 0.04404369894988741, 'bb_std_mult': 3.1237081003766987, 'rsi_os': 26, 'rsi_ob': 63, 'vol_spike': 0.04232758088566968, 'adx_thresh': 6.89959481479361, 'atr_min_pct': 0.025020644017770332, 'atr_max_pct': 0.07613583291318823, 'tp_mult': 2.9238683768379627, 'tsl_mult': 0.8786452585359763, 'strategy': 'mean_reversion', 'time_stop': 162, 'use_sma': True, 'use_atr': False, 'use_adx': True, 'use_ema': True, 'use_spike': False, 'rsi_required': False, 'edge_k': 0.41483951829965116, 'edge_cap': 0.5733857131915439, 'bull_strategy': 'mean_reversion', 'bull_bb_std_mult': 0.8224273650845499, 'bull_rsi_os': 33, 'bull_rsi_ob': 83, 'bull_adx_thresh': 17.81624323438203, 'bull_atr_min_pct': 0.009341221689174877, 'bull_atr_max_pct': 0.08196786589949134, 'bull_tp_mult': 1.7483594466311196, 'bull_tsl_mult': 0.9272580121048518, 'bull_time_stop': 170, 'bull_use_sma': True, 'bull_use_ema': False, 'bull_use_atr': True, 'bull_use_adx': True, 'bull_use_spike': True, 'bull_rsi_required': False, 'bear_strategy': 'mean_reversion', 'bear_bb_std_mult': 3.422244450038131, 'bear_rsi_os': 22, 'bear_rsi_ob': 46, 'bear_adx_thresh': 12.667903377396202, 'bear_atr_min_pct': 0.005808331466727344, 'bear_atr_max_pct': 0.07037711131381004, 'bear_tp_mult': 1.1822266370439332, 'bear_tsl_mult': 0.43058158535819896, 'bear_time_stop': 35, 'bear_use_sma': False, 'bear_use_ema': True, 'bear_use_atr': True, 'bear_use_adx': False, 'bear_use_spike': True, 'bear_rsi_required': False, 'sideways_strategy': 'breakout', 'sideways_bb_std_mult': 3.317772878771384, 'sideways_rsi_os': 48, 'sideways_rsi_ob': 64, 'sideways_adx_thresh': 24.805353364112023, 'sideways_atr_min_pct': 0.0024869451232643514, 'sideways_atr_max_pct': 0.07316481937165267, 'sideways_tp_mult': 1.2108283187027, 'sideways_tsl_mult': 0.8127392553539122, 'sideways_time_stop': 109, 'sideways_use_sma': False, 'sideways_use_ema': False, 'sideways_use_atr': False, 'sideways_use_adx': False, 'sideways_use_spike': False, 'sideways_rsi_required': False}.
