[I 2025-09-01 10:30:51,628] Trial 558 finished with values: [-1000000000.0, 1000000000.0] and parameters: {'p_sma': 11, 'p_std': 45, 'p_atr': 10, 'p_adx': 23, 'rsi_period': 67, 'ema1': 21, 'ema2': 39, 'slip_atr_k': 0.13572080710384338, 'slip_spread_k': 0.6951852806079861, 'spread_hl_frac': 0.04200481094175626, 'bb_std_mult': 2.237388158308663, 'rsi_os': 34, 'rsi_ob': 95, 'vol_spike': 0.1851094145951928, 'adx_thresh': 14.98145420346528, 'atr_min_pct': 0.023304670234985263, 'atr_max_pct': 0.07954823103730323, 'tp_mult': 2.658509944299609, 'tsl_mult': 0.0007130978763794128, 'strategy': 'breakout', 'time_stop': 148, 'use_sma': False, 'use_atr': False, 'use_adx': True, 'use_ema': False, 'use_spike': True, 'rsi_required': True, 'edge_k': 0.8404137715134111, 'edge_cap': 0.7347735083908319, 'bull_strategy': 'mean_reversion', 'bull_bb_std_mult': 3.3147199594177845, 'bull_rsi_os': 16, 'bull_rsi_ob': 57, 'bull_adx_thresh': 6.116303502873202, 'bull_atr_min_pct': 0.02883669831036325, 'bull_atr_max_pct': 0.05275698518361848, 'bull_tp_mult': 1.5098446354836224, 'bull_tsl_mult': 0.681227069504738, 'bull_time_stop': 157, 'bull_use_sma': True, 'bull_use_ema': False, 'bull_use_atr': True, 'bull_use_adx': False, 'bull_use_spike': False, 'bull_rsi_required': True, 'bear_strategy': 'mean_reversion', 'bear_bb_std_mult': 2.0747359717201195, 'bear_rsi_os': 46, 'bear_rsi_ob': 47, 'bear_adx_thresh': 28.446157929073728, 'bear_atr_min_pct': 0.015492060036483707, 'bear_atr_max_pct': 0.04968223529576059, 'bear_tp_mult': 2.0796783566589347, 'bear_tsl_mult': 0.8365344725485331, 'bear_time_stop': 137, 'bear_use_sma': True, 'bear_use_ema': True, 'bear_use_atr': True, 'bear_use_adx': True, 'bear_use_spike': True, 'bear_rsi_required': False, 'sideways_strategy': 'breakout', 'sideways_bb_std_mult': 1.7960304389836133, 'sideways_rsi_os': 51, 'sideways_rsi_ob': 52, 'sideways_adx_thresh': 15.90607177878697, 'sideways_atr_min_pct': 0.00946314008227915, 'sideways_atr_max_pct': 0.0681677464939303, 'sideways_tp_mult': 1.4598568047266416, 'sideways_tsl_mult': 0.8579698689025286, 'sideways_time_stop': 207, 'sideways_use_sma': False, 'sideways_use_ema': False, 'sideways_use_atr': False, 'sideways_use_adx': False, 'sideways_use_spike': True, 'sideways_rsi_required': True}.
[I 2025-09-01 10:30:53,073] Trial 560 finished with values: [-1000000000.0, 1000000000.0] and parameters: {'p_sma': 21, 'p_std': 29, 'p_atr': 19, 'p_adx': 25, 'rsi_period': 15, 'ema1': 21, 'ema2': 48, 'slip_atr_k': 0.05869371057751524, 'slip_spread_k': 0.13671144520495607, 'spread_hl_frac': 0.03195319064281883, 'bb_std_mult': 3.193161398596386, 'rsi_os': 45, 'rsi_ob': 95, 'vol_spike': 0.1865830724755547, 'adx_thresh': 9.986722811157152, 'atr_min_pct': 0.02559032921910407, 'atr_max_pct': 0.06242424231084482, 'tp_mult': 2.7471784943872275, 'tsl_mult': 0.0017745863293957935, 'strategy': 'breakout', 'time_stop': 184, 'use_sma': True, 'use_atr': False, 'use_adx': True, 'use_ema': False, 'use_spike': False, 'rsi_required': True, 'edge_k': 0.8540208034469322, 'edge_cap': 0.534124680105484, 'bull_strategy': 'mean_reversion', 'bull_bb_std_mult': 3.4213102056432128, 'bull_rsi_os': 16, 'bull_rsi_ob': 57, 'bull_adx_thresh': 23.782163729227825, 'bull_atr_min_pct': 0.02997051207400242, 'bull_atr_max_pct': 0.08532008322540678, 'bull_tp_mult': 2.5195365017942035, 'bull_tsl_mult': 0.04530916974290795, 'bull_time_stop': 152, 'bull_use_sma': True, 'bull_use_ema': True, 'bull_use_atr': True, 'bull_use_adx': False, 'bull_use_spike': False, 'bull_rsi_required': True, 'bear_strategy': 'mean_reversion', 'bear_bb_std_mult': 3.363123484927626, 'bear_rsi_os': 21, 'bear_rsi_ob': 59, 'bear_adx_thresh': 12.438147292544015, 'bear_atr_min_pct': 0.01590841686798188, 'bear_atr_max_pct': 0.07547754623534195, 'bear_tp_mult': 1.2574657841276984, 'bear_tsl_mult': 0.49313654045855027, 'bear_time_stop': 138, 'bear_use_sma': True, 'bear_use_ema': True, 'bear_use_atr': True, 'bear_use_adx': True, 'bear_use_spike': True, 'bear_rsi_required': False, 'sideways_strategy': 'breakout', 'sideways_bb_std_mult': 1.777764343922116, 'sideways_rsi_os': 49, 'sideways_rsi_ob': 52, 'sideways_adx_thresh': 20.828277799087495, 'sideways_atr_min_pct': 0.020237540863398275, 'sideways_atr_max_pct': 0.06775531388847843, 'sideways_tp_mult': 1.378986307785757, 'sideways_tsl_mult': 0.17210342171650783, 'sideways_time_stop': 199, 'sideways_use_sma': False, 'sideways_use_ema': True, 'sideways_use_atr': False, 'sideways_use_adx': False, 'sideways_use_spike': True, 'sideways_rsi_required': True}.
[I 2025-09-01 10:30:53,204] Trial 561 finished with values: [-1000000000.0, 1000000000.0] and parameters: {'p_sma': 21, 'p_std': 46, 'p_atr': 13, 'p_adx': 26, 'rsi_period': 31, 'ema1': 21, 'ema2': 32, 'slip_atr_k': 0.05628355402298663, 'slip_spread_k': 0.16903016493128414, 'spread_hl_frac': 0.02556301820924159, 'bb_std_mult': 3.261079797403751, 'rsi_os': 6, 'rsi_ob': 67, 'vol_spike': 0.10704346373940295, 'adx_thresh': 6.703097202207725, 'atr_min_pct': 0.022104808672209264, 'atr_max_pct': 0.07348119267112953, 'tp_mult': 2.7445183758846134, 'tsl_mult': 0.022618743678331076, 'strategy': 'breakout', 'time_stop': 129, 'use_sma': True, 'use_atr': False, 'use_adx': True, 'use_ema': False, 'use_spike': False, 'rsi_required': True, 'edge_k': 0.8635166300362624, 'edge_cap': 0.5389192123624198, 'bull_strategy': 'mean_reversion', 'bull_bb_std_mult': 2.311702304814827, 'bull_rsi_os': 16, 'bull_rsi_ob': 55, 'bull_adx_thresh': 23.47959126047487, 'bull_atr_min_pct': 0.02998541059570545, 'bull_atr_max_pct': 0.04336786603145212, 'bull_tp_mult': 1.810975836096752, 'bull_tsl_mult': 0.6849155674352674, 'bull_time_stop': 101, 'bull_use_sma': True, 'bull_use_ema': False, 'bull_use_atr': True, 'bull_use_adx': True, 'bull_use_spike': False, 'bull_rsi_required': True, 'bear_strategy': 'mean_reversion', 'bear_bb_std_mult': 3.5384786719233063, 'bear_rsi_os': 49, 'bear_rsi_ob': 53, 'bear_adx_thresh': 28.62139609548904, 'bear_atr_min_pct': 0.015486486464029448, 'bear_atr_max_pct': 0.012799945868586418, 'bear_tp_mult': 1.2015010168552271, 'bear_tsl_mult': 0.8252534629699432, 'bear_time_stop': 138, 'bear_use_sma': True, 'bear_use_ema': True, 'bear_use_atr': True, 'bear_use_adx': True, 'bear_use_spike': True, 'bear_rsi_required': False, 'sideways_strategy': 'breakout', 'sideways_bb_std_mult': 2.1519664320458554, 'sideways_rsi_os': 53, 'sideways_rsi_ob': 77, 'sideways_adx_thresh': 27.85460394497034, 'sideways_atr_min_pct': 0.020560745382337493, 'sideways_atr_max_pct': 0.10991319108359827, 'sideways_tp_mult': 1.0532508093883233, 'sideways_tsl_mult': 0.026985598324131, 'sideways_time_stop': 179, 'sideways_use_sma': False, 'sideways_use_ema': True, 'sideways_use_atr': False, 'sideways_use_adx': False, 'sideways_use_spike': True, 'sideways_rsi_required': True}.
[I 2025-09-01 10:30:53,352] Trial 559 finished with values: [-1000000000.0, 1000000000.0] and parameters: {'p_sma': 22, 'p_std': 45, 'p_atr': 11, 'p_adx': 25, 'rsi_period': 67, 'ema1': 5, 'ema2': 48, 'slip_atr_k': 0.13894945501189815, 'slip_spread_k': 0.35027769797178, 'spread_hl_frac': 0.031630629800476165, 'bb_std_mult': 3.23463157043291, 'rsi_os': 34, 'rsi_ob': 78, 'vol_spike': 0.055699229860562624, 'adx_thresh': 7.6930850113708775, 'atr_min_pct': 0.007393759831034592, 'atr_max_pct': 0.07316309959717149, 'tp_mult': 2.795880293179007, 'tsl_mult': 0.028832552552295065, 'strategy': 'breakout', 'time_stop': 130, 'use_sma': True, 'use_atr': False, 'use_adx': True, 'use_ema': False, 'use_spike': False, 'rsi_required': True, 'edge_k': 1.1811789287130594, 'edge_cap': 0.573903304872853, 'bull_strategy': 'mean_reversion', 'bull_bb_std_mult': 3.592720341359576, 'bull_rsi_os': 16, 'bull_rsi_ob': 49, 'bull_adx_thresh': 6.022018399440329, 'bull_atr_min_pct': 0.01908129642805662, 'bull_atr_max_pct': 0.08009269961644915, 'bull_tp_mult': 1.8082953784611706, 'bull_tsl_mult': 0.6785007642410965, 'bull_time_stop': 152, 'bull_use_sma': True, 'bull_use_ema': True, 'bull_use_atr': True, 'bull_use_adx': False, 'bull_use_spike': False, 'bull_rsi_required': True, 'bear_strategy': 'mean_reversion', 'bear_bb_std_mult': 1.8468292846962924, 'bear_rsi_os': 21, 'bear_rsi_ob': 81, 'bear_adx_thresh': 32.98176902328443, 'bear_atr_min_pct': 0.02921527207845958, 'bear_atr_max_pct': 0.049294421210839386, 'bear_tp_mult': 1.1877692002717382, 'bear_tsl_mult': 0.4889140577120869, 'bear_time_stop': 138, 'bear_use_sma': True, 'bear_use_ema': True, 'bear_use_atr': True, 'bear_use_adx': True, 'bear_use_spike': True, 'bear_rsi_required': False, 'sideways_strategy': 'breakout', 'sideways_bb_std_mult': 3.378577872214113, 'sideways_rsi_os': 49, 'sideways_rsi_ob': 71, 'sideways_adx_thresh': 28.01862107764015, 'sideways_atr_min_pct': 0.020480132424630627, 'sideways_atr_max_pct': 0.06783428544227149, 'sideways_tp_mult': 1.3611810011296106, 'sideways_tsl_mult': 0.330846340049468, 'sideways_time_stop': 207, 'sideways_use_sma': False, 'sideways_use_ema': True, 'sideways_use_atr': False, 'sideways_use_adx': False, 'sideways_use_spike': True, 'sideways_rsi_required': True}.
[I 2025-09-01 10:30:54,466] Trial 562 finished with values: [-1000000000.0, 1000000000.0] and parameters: {'p_sma': 22, 'p_std': 60, 'p_atr': 19, 'p_adx': 16, 'rsi_period': 69, 'ema1': 21, 'ema2': 57, 'slip_atr_k': 0.058054453995471704, 'slip_spread_k': 0.17223125455578692, 'spread_hl_frac': 0.03017167840380674, 'bb_std_mult': 3.2310751193114933, 'rsi_os': 6, 'rsi_ob': 78, 'vol_spike': 0.14560203869643398, 'adx_thresh': 8.01017987538336, 'atr_min_pct': 0.025607498851735196, 'atr_max_pct': 0.021893069783054935, 'tp_mult': 2.8189146943079746, 'tsl_mult': 0.024828834971244686, 'strategy': 'breakout', 'time_stop': 155, 'use_sma': True, 'use_atr': False, 'use_adx': True, 'use_ema': False, 'use_spike': False, 'rsi_required': True, 'edge_k': 0.4033264294805913, 'edge_cap': 0.5414970502910663, 'bull_strategy': 'mean_reversion', 'bull_bb_std_mult': 0.7835405138385447, 'bull_rsi_os': 5, 'bull_rsi_ob': 50, 'bull_adx_thresh': 5.004879720452385, 'bull_atr_min_pct': 0.029999189534326082, 'bull_atr_max_pct': 0.10676787615319, 'bull_tp_mult': 1.8010120510170122, 'bull_tsl_mult': 0.059871001251957365, 'bull_time_stop': 152, 'bull_use_sma': True, 'bull_use_ema': True, 'bull_use_atr': True, 'bull_use_adx': True, 'bull_use_spike': False, 'bull_rsi_required': True, 'bear_strategy': 'mean_reversion', 'bear_bb_std_mult': 3.3408121646672613, 'bear_rsi_os': 48, 'bear_rsi_ob': 45, 'bear_adx_thresh': 12.194315717489594, 'bear_atr_min_pct': 0.01612482456915974, 'bear_atr_max_pct': 0.06326670601658038, 'bear_tp_mult': 1.656342157468474, 'bear_tsl_mult': 0.5169058421228521, 'bear_time_stop': 120, 'bear_use_sma': True, 'bear_use_ema': True, 'bear_use_atr': True, 'bear_use_adx': True, 'bear_use_spike': True, 'bear_rsi_required': False, 'sideways_strategy': 'breakout', 'sideways_bb_std_mult': 3.372343362997226, 'sideways_rsi_os': 49, 'sideways_rsi_ob': 58, 'sideways_adx_thresh': 27.775328359339312, 'sideways_atr_min_pct': 0.003156620748287692, 'sideways_atr_max_pct': 0.06640249536948278, 'sideways_tp_mult': 1.382262005056995, 'sideways_tsl_mult': 0.3339312828635709, 'sideways_time_stop': 201, 'sideways_use_sma': False, 'sideways_use_ema': True, 'sideways_use_atr': False, 'sideways_use_adx': False, 'sideways_use_spike': True, 'sideways_rsi_required': True}.
[I 2025-09-01 10:31:35,593] Trial 566 finished with values: [-0.049467151274298016, 0.04928240754871031] and parameters: {'p_sma': 19, 'p_std': 44, 'p_atr': 9, 'p_adx': 20, 'rsi_period': 64, 'ema1': 20, 'ema2': 42, 'slip_atr_k': 0.04881454517514242, 'slip_spread_k': 0.6095403908843922, 'spread_hl_frac': 0.02804288491669453, 'bb_std_mult': 3.0457499593618698, 'rsi_os': 20, 'rsi_ob': 77, 'vol_spike': 0.2822565350306158, 'adx_thresh': 6.091268342639264, 'atr_min_pct': 0.001090190502438573, 'atr_max_pct': 0.0686754353608318, 'tp_mult': 2.695328314798144, 'tsl_mult': 0.5964141518850563, 'strategy': 'breakout', 'time_stop': 233, 'use_sma': True, 'use_atr': True, 'use_adx': False, 'use_ema': False, 'use_spike': False, 'rsi_required': False, 'edge_k': 0.9096443109812608, 'edge_cap': 0.5860286819740113, 'bull_strategy': 'breakout', 'bull_bb_std_mult': 0.7456278054032854, 'bull_rsi_os': 22, 'bull_rsi_ob': 70, 'bull_adx_thresh': 5.60173712937171, 'bull_atr_min_pct': 0.026276386975377937, 'bull_atr_max_pct': 0.08982934780414405, 'bull_tp_mult': 1.860325692196171, 'bull_tsl_mult': 0.22961347253182895, 'bull_time_stop': 145, 'bull_use_sma': True, 'bull_use_ema': False, 'bull_use_atr': False, 'bull_use_adx': True, 'bull_use_spike': True, 'bull_rsi_required': False, 'bear_strategy': 'mean_reversion', 'bear_bb_std_mult': 3.0695929309289216, 'bear_rsi_os': 51, 'bear_rsi_ob': 47, 'bear_adx_thresh': 10.838091605234373, 'bear_atr_min_pct': 0.02783400949259714, 'bear_atr_max_pct': 0.03119212069651453, 'bear_tp_mult': 1.2346201254754516, 'bear_tsl_mult': 0.6118907782170104, 'bear_time_stop': 128, 'bear_use_sma': False, 'bear_use_ema': False, 'bear_use_atr': False, 'bear_use_adx': False, 'bear_use_spike': True, 'bear_rsi_required': False, 'sideways_strategy': 'breakout', 'sideways_bb_std_mult': 2.985502913387784, 'sideways_rsi_os': 48, 'sideways_rsi_ob': 82, 'sideways_adx_thresh': 26.959810809839915, 'sideways_atr_min_pct': 0.003801713841059366, 'sideways_atr_max_pct': 0.13617572079269472, 'sideways_tp_mult': 1.1493465651096062, 'sideways_tsl_mult': 0.6717636917789476, 'sideways_time_stop': 195, 'sideways_use_sma': False, 'sideways_use_ema': True, 'sideways_use_atr': False, 'sideways_use_adx': False, 'sideways_use_spike': False, 'sideways_rsi_required': False}.
[I 2025-09-01 10:31:35,998] Trial 563 finished with values: [-0.05956325363888171, 0.05979552850845278] and parameters: {'p_sma': 22, 'p_std': 44, 'p_atr': 12, 'p_adx': 20, 'rsi_period': 60, 'ema1': 21, 'ema2': 46, 'slip_atr_k': 0.05240927382731175, 'slip_spread_k': 0.7746525828963032, 'spread_hl_frac': 0.02986171952204044, 'bb_std_mult': 3.2402444465306983, 'rsi_os': 19, 'rsi_ob': 67, 'vol_spike': 0.11010012396785865, 'adx_thresh': 6.736414632944655, 'atr_min_pct': 0.0220441749955595, 'atr_max_pct': 0.07361884631341314, 'tp_mult': 2.7517215152150545, 'tsl_mult': 0.09037897273246914, 'strategy': 'breakout', 'time_stop': 155, 'use_sma': True, 'use_atr': False, 'use_adx': False, 'use_ema': False, 'use_spike': False, 'rsi_required': False, 'edge_k': 1.0205895329114636, 'edge_cap': 0.5722398035917664, 'bull_strategy': 'mean_reversion', 'bull_bb_std_mult': 2.3182266158520086, 'bull_rsi_os': 18, 'bull_rsi_ob': 65, 'bull_adx_thresh': 5.706695141133728, 'bull_atr_min_pct': 0.02918518515330038, 'bull_atr_max_pct': 0.07866699955169106, 'bull_tp_mult': 1.8092782960900484, 'bull_tsl_mult': 0.45783298306867465, 'bull_time_stop': 148, 'bull_use_sma': True, 'bull_use_ema': True, 'bull_use_atr': False, 'bull_use_adx': True, 'bull_use_spike': False, 'bull_rsi_required': True, 'bear_strategy': 'mean_reversion', 'bear_bb_std_mult': 1.8492205530653865, 'bear_rsi_os': 48, 'bear_rsi_ob': 80, 'bear_adx_thresh': 15.060974080831802, 'bear_atr_min_pct': 0.016626644321942212, 'bear_atr_max_pct': 0.06807326466771166, 'bear_tp_mult': 1.1893237079634156, 'bear_tsl_mult': 0.6793007365661685, 'bear_time_stop': 176, 'bear_use_sma': False, 'bear_use_ema': True, 'bear_use_atr': False, 'bear_use_adx': False, 'bear_use_spike': True, 'bear_rsi_required': False, 'sideways_strategy': 'breakout', 'sideways_bb_std_mult': 2.3722101112717104, 'sideways_rsi_os': 49, 'sideways_rsi_ob': 69, 'sideways_adx_thresh': 18.466446205959382, 'sideways_atr_min_pct': 0.0035819671074430186, 'sideways_atr_max_pct': 0.12399506473534556, 'sideways_tp_mult': 1.369358712761344, 'sideways_tsl_mult': 0.6406945754883435, 'sideways_time_stop': 238, 'sideways_use_sma': False, 'sideways_use_ema': True, 'sideways_use_atr': False, 'sideways_use_adx': False, 'sideways_use_spike': False, 'sideways_rsi_required': False}.
[I 2025-09-01 10:31:36,247] Trial 564 finished with values: [-0.030733073456929327, 0.030491036747784556] and parameters: {'p_sma': 22, 'p_std': 44, 'p_atr': 30, 'p_adx': 22, 'rsi_period': 11, 'ema1': 20, 'ema2': 36, 'slip_atr_k': 0.08345751425773146, 'slip_spread_k': 0.7688398559265521, 'spread_hl_frac': 0.03836714719948049, 'bb_std_mult': 3.235184033296711, 'rsi_os': 31, 'rsi_ob': 78, 'vol_spike': 0.29899271593010335, 'adx_thresh': 31.02121921953239, 'atr_min_pct': 0.02458399114516511, 'atr_max_pct': 0.10159621005609137, 'tp_mult': 2.6988408218400117, 'tsl_mult': 0.5984303580312287, 'strategy': 'breakout', 'time_stop': 156, 'use_sma': True, 'use_atr': False, 'use_adx': False, 'use_ema': False, 'use_spike': False, 'rsi_required': False, 'edge_k': 0.9955411310992365, 'edge_cap': 0.5656589616462591, 'bull_strategy': 'mean_reversion', 'bull_bb_std_mult': 2.9475127038070124, 'bull_rsi_os': 18, 'bull_rsi_ob': 92, 'bull_adx_thresh': 5.313742820448673, 'bull_atr_min_pct': 0.029358836437175545, 'bull_atr_max_pct': 0.09065266900643135, 'bull_tp_mult': 1.8540611828852906, 'bull_tsl_mult': 0.06588015933854013, 'bull_time_stop': 147, 'bull_use_sma': True, 'bull_use_ema': True, 'bull_use_atr': False, 'bull_use_adx': True, 'bull_use_spike': False, 'bull_rsi_required': True, 'bear_strategy': 'mean_reversion', 'bear_bb_std_mult': 1.4621569294135304, 'bear_rsi_os': 42, 'bear_rsi_ob': 94, 'bear_adx_thresh': 10.479753944269312, 'bear_atr_min_pct': 0.016746664770334423, 'bear_atr_max_pct': 0.06843170650535184, 'bear_tp_mult': 1.1788635025465164, 'bear_tsl_mult': 0.28647512252773727, 'bear_time_stop': 15, 'bear_use_sma': False, 'bear_use_ema': True, 'bear_use_atr': False, 'bear_use_adx': False, 'bear_use_spike': True, 'bear_rsi_required': False, 'sideways_strategy': 'breakout', 'sideways_bb_std_mult': 3.1852798434785616, 'sideways_rsi_os': 49, 'sideways_rsi_ob': 69, 'sideways_adx_thresh': 26.95816698520641, 'sideways_atr_min_pct': 0.003065079460068295, 'sideways_atr_max_pct': 0.07551461221598166, 'sideways_tp_mult': 1.368443429021377, 'sideways_tsl_mult': 0.6708487920845453, 'sideways_time_stop': 132, 'sideways_use_sma': False, 'sideways_use_ema': True, 'sideways_use_atr': False, 'sideways_use_adx': False, 'sideways_use_spike': False, 'sideways_rsi_required': False}.
[I 2025-09-01 10:31:36,265] Trial 565 finished with values: [-0.03222394423231267, 0.03184180741549012] and parameters: {'p_sma': 19, 'p_std': 44, 'p_atr': 30, 'p_adx': 22, 'rsi_period': 69, 'ema1': 21, 'ema2': 54, 'slip_atr_k': 0.1501464676240205, 'slip_spread_k': 0.6448625764500859, 'spread_hl_frac': 0.03861462210353883, 'bb_std_mult': 3.0454312484277097, 'rsi_os': 31, 'rsi_ob': 65, 'vol_spike': 0.2993781606960626, 'adx_thresh': 6.120747359266888, 'atr_min_pct': 0.024699114744868272, 'atr_max_pct': 0.06873529997545405, 'tp_mult': 1.5311058702145979, 'tsl_mult': 0.3642622419591961, 'strategy': 'breakout', 'time_stop': 232, 'use_sma': True, 'use_atr': False, 'use_adx': False, 'use_ema': False, 'use_spike': False, 'rsi_required': False, 'edge_k': 1.019055749069388, 'edge_cap': 0.3609646991801678, 'bull_strategy': 'mean_reversion', 'bull_bb_std_mult': 0.7818946881125588, 'bull_rsi_os': 5, 'bull_rsi_ob': 54, 'bull_adx_thresh': 5.777221796272469, 'bull_atr_min_pct': 0.029996364628916923, 'bull_atr_max_pct': 0.09101876047354655, 'bull_tp_mult': 1.8623437676148162, 'bull_tsl_mult': 0.06964197860704258, 'bull_time_stop': 148, 'bull_use_sma': True, 'bull_use_ema': False, 'bull_use_atr': False, 'bull_use_adx': True, 'bull_use_spike': False, 'bull_rsi_required': True, 'bear_strategy': 'mean_reversion', 'bear_bb_std_mult': 3.3441458615534807, 'bear_rsi_os': 42, 'bear_rsi_ob': 45, 'bear_adx_thresh': 30.351690259002527, 'bear_atr_min_pct': 0.016830247952167674, 'bear_atr_max_pct': 0.06853018617952614, 'bear_tp_mult': 1.8801479395144391, 'bear_tsl_mult': 0.6162262867700118, 'bear_time_stop': 5, 'bear_use_sma': False, 'bear_use_ema': True, 'bear_use_atr': False, 'bear_use_adx': False, 'bear_use_spike': True, 'bear_rsi_required': False, 'sideways_strategy': 'breakout', 'sideways_bb_std_mult': 3.191046116148861, 'sideways_rsi_os': 48, 'sideways_rsi_ob': 69, 'sideways_adx_thresh': 25.24753707492549, 'sideways_atr_min_pct': 0.003106005332120527, 'sideways_atr_max_pct': 0.075372999282407, 'sideways_tp_mult': 2.627980144460394, 'sideways_tsl_mult': 0.8914588687188633, 'sideways_time_stop': 200, 'sideways_use_sma': False, 'sideways_use_ema': True, 'sideways_use_atr': False, 'sideways_use_adx': False, 'sideways_use_spike': False, 'sideways_rsi_required': False}.
