[I 2025-09-01 10:18:52,904] Trial 486 finished with values: [-1000000000.0, 1000000000.0] and parameters: {'p_sma': 25, 'p_std': 46, 'p_atr': 30, 'p_adx': 21, 'rsi_period': 84, 'ema1': 21, 'ema2': 50, 'slip_atr_k': 0.14915127245957044, 'slip_spread_k': 0.16238362465506745, 'spread_hl_frac': 0.0271262234373207, 'bb_std_mult': 3.094003839067224, 'rsi_os': 22, 'rsi_ob': 76, 'vol_spike': 0.2938348494587147, 'adx_thresh': 6.305189359623809, 'atr_min_pct': 0.026373096214067533, 'atr_max_pct': 0.08386021801780624, 'tp_mult': 1.265860939642434, 'tsl_mult': 0.047351880966870194, 'strategy': 'breakout', 'time_stop': 142, 'use_sma': True, 'use_atr': True, 'use_adx': True, 'use_ema': True, 'use_spike': True, 'rsi_required': True, 'edge_k': 0.8740986187327819, 'edge_cap': 0.7523955965120921, 'bull_strategy': 'breakout', 'bull_bb_std_mult': 1.8611507291575833, 'bull_rsi_os': 13, 'bull_rsi_ob': 50, 'bull_adx_thresh': 19.51908630908067, 'bull_atr_min_pct': 0.02841553248499663, 'bull_atr_max_pct': 0.08339871402168662, 'bull_tp_mult': 2.550113563763806, 'bull_tsl_mult': 0.9149124252136513, 'bull_time_stop': 241, 'bull_use_sma': False, 'bull_use_ema': True, 'bull_use_atr': True, 'bull_use_adx': True, 'bull_use_spike': True, 'bull_rsi_required': False, 'bear_strategy': 'breakout', 'bear_bb_std_mult': 2.220350045813951, 'bear_rsi_os': 14, 'bear_rsi_ob': 49, 'bear_adx_thresh': 14.041988903966388, 'bear_atr_min_pct': 0.015987131646180815, 'bear_atr_max_pct': 0.016288501623632726, 'bear_tp_mult': 2.3581097475194395, 'bear_tsl_mult': 0.40474582846488716, 'bear_time_stop': 130, 'bear_use_sma': True, 'bear_use_ema': True, 'bear_use_atr': True, 'bear_use_adx': True, 'bear_use_spike': True, 'bear_rsi_required': False, 'sideways_strategy': 'breakout', 'sideways_bb_std_mult': 1.4703967470037222, 'sideways_rsi_os': 20, 'sideways_rsi_ob': 50, 'sideways_adx_thresh': 27.68400330374098, 'sideways_atr_min_pct': 0.003258808654495698, 'sideways_atr_max_pct': 0.03316884581151825, 'sideways_tp_mult': 2.7439977210216675, 'sideways_tsl_mult': 0.8439505015799682, 'sideways_time_stop': 34, 'sideways_use_sma': True, 'sideways_use_ema': True, 'sideways_use_atr': False, 'sideways_use_adx': True, 'sideways_use_spike': True, 'sideways_rsi_required': True}.
[I 2025-09-01 10:18:53,275] Trial 487 finished with values: [-0.023324150017695833, 0.02394380647484448] and parameters: {'p_sma': 46, 'p_std': 46, 'p_atr': 30, 'p_adx': 21, 'rsi_period': 84, 'ema1': 22, 'ema2': 50, 'slip_atr_k': 0.07826254686315942, 'slip_spread_k': 0.16505642940465495, 'spread_hl_frac': 0.02660748453524016, 'bb_std_mult': 3.094003641654388, 'rsi_os': 45, 'rsi_ob': 77, 'vol_spike': 0.2930274671380064, 'adx_thresh': 6.262468621802814, 'atr_min_pct': 0.026468431649214436, 'atr_max_pct': 0.08348055139719815, 'tp_mult': 1.2534530430700674, 'tsl_mult': 0.3346592567636592, 'strategy': 'breakout', 'time_stop': 139, 'use_sma': True, 'use_atr': True, 'use_adx': True, 'use_ema': True, 'use_spike': True, 'rsi_required': True, 'edge_k': 0.8975123156565257, 'edge_cap': 0.5624917227272318, 'bull_strategy': 'breakout', 'bull_bb_std_mult': 0.8338887712443565, 'bull_rsi_os': 18, 'bull_rsi_ob': 53, 'bull_adx_thresh': 19.923373479173105, 'bull_atr_min_pct': 0.0030002466841056123, 'bull_atr_max_pct': 0.08182101411222806, 'bull_tp_mult': 1.7709654989984411, 'bull_tsl_mult': 0.9122717486469755, 'bull_time_stop': 19, 'bull_use_sma': True, 'bull_use_ema': True, 'bull_use_atr': True, 'bull_use_adx': True, 'bull_use_spike': False, 'bull_rsi_required': False, 'bear_strategy': 'breakout', 'bear_bb_std_mult': 3.3960623387225253, 'bear_rsi_os': 48, 'bear_rsi_ob': 94, 'bear_adx_thresh': 12.452540807943507, 'bear_atr_min_pct': 0.016711829843509794, 'bear_atr_max_pct': 0.1413065783426002, 'bear_tp_mult': 2.365759557648901, 'bear_tsl_mult': 0.4396331149364377, 'bear_time_stop': 150, 'bear_use_sma': True, 'bear_use_ema': True, 'bear_use_atr': True, 'bear_use_adx': True, 'bear_use_spike': True, 'bear_rsi_required': False, 'sideways_strategy': 'breakout', 'sideways_bb_std_mult': 3.3449950802263304, 'sideways_rsi_os': 12, 'sideways_rsi_ob': 48, 'sideways_adx_thresh': 20.92346650937052, 'sideways_atr_min_pct': 0.011342291203746663, 'sideways_atr_max_pct': 0.07190650910417962, 'sideways_tp_mult': 2.050382827199861, 'sideways_tsl_mult': 0.8452292456850721, 'sideways_time_stop': 203, 'sideways_use_sma': True, 'sideways_use_ema': True, 'sideways_use_atr': False, 'sideways_use_adx': True, 'sideways_use_spike': True, 'sideways_rsi_required': True}.
[I 2025-09-01 10:18:53,695] Trial 485 finished with values: [-0.07235145698670808, 0.07397354198511331] and parameters: {'p_sma': 49, 'p_std': 7, 'p_atr': 30, 'p_adx': 21, 'rsi_period': 64, 'ema1': 18, 'ema2': 44, 'slip_atr_k': 0.04813145862734643, 'slip_spread_k': 0.14569020745247951, 'spread_hl_frac': 0.02684848903508498, 'bb_std_mult': 3.116145073335713, 'rsi_os': 23, 'rsi_ob': 76, 'vol_spike': 0.29433512114024757, 'adx_thresh': 17.826406391942832, 'atr_min_pct': 0.02671504214876739, 'atr_max_pct': 0.08344992388512369, 'tp_mult': 2.6139013661532813, 'tsl_mult': 0.04452612374927545, 'strategy': 'breakout', 'time_stop': 158, 'use_sma': True, 'use_atr': True, 'use_adx': True, 'use_ema': False, 'use_spike': True, 'rsi_required': True, 'edge_k': 0.8632332326547075, 'edge_cap': 0.27522734797639337, 'bull_strategy': 'breakout', 'bull_bb_std_mult': 0.8250204658607148, 'bull_rsi_os': 13, 'bull_rsi_ob': 53, 'bull_adx_thresh': 25.121276975567874, 'bull_atr_min_pct': 0.002668212439341955, 'bull_atr_max_pct': 0.08301599166456627, 'bull_tp_mult': 1.783613981357011, 'bull_tsl_mult': 0.1676564564048027, 'bull_time_stop': 196, 'bull_use_sma': False, 'bull_use_ema': True, 'bull_use_atr': True, 'bull_use_adx': True, 'bull_use_spike': False, 'bull_rsi_required': True, 'bear_strategy': 'mean_reversion', 'bear_bb_std_mult': 3.4314938497438217, 'bear_rsi_os': 14, 'bear_rsi_ob': 49, 'bear_adx_thresh': 12.542269974879959, 'bear_atr_min_pct': 0.01660197685169621, 'bear_atr_max_pct': 0.049275469700582865, 'bear_tp_mult': 1.238972615611072, 'bear_tsl_mult': 0.2588963414700587, 'bear_time_stop': 131, 'bear_use_sma': True, 'bear_use_ema': True, 'bear_use_atr': True, 'bear_use_adx': True, 'bear_use_spike': True, 'bear_rsi_required': False, 'sideways_strategy': 'breakout', 'sideways_bb_std_mult': 3.315050986529532, 'sideways_rsi_os': 46, 'sideways_rsi_ob': 82, 'sideways_adx_thresh': 27.735873792961556, 'sideways_atr_min_pct': 0.0033822454651703192, 'sideways_atr_max_pct': 0.06465984414886854, 'sideways_tp_mult': 1.395252566063618, 'sideways_tsl_mult': 0.8432241508532506, 'sideways_time_stop': 43, 'sideways_use_sma': False, 'sideways_use_ema': True, 'sideways_use_atr': False, 'sideways_use_adx': True, 'sideways_use_spike': True, 'sideways_rsi_required': True}.
[I 2025-09-01 10:19:36,695] Trial 490 finished with values: [-1000000000.0, 1000000000.0] and parameters: {'p_sma': 19, 'p_std': 44, 'p_atr': 28, 'p_adx': 20, 'rsi_period': 61, 'ema1': 10, 'ema2': 57, 'slip_atr_k': 0.04791748975069729, 'slip_spread_k': 0.0003016576460156406, 'spread_hl_frac': 0.04662564410287459, 'bb_std_mult': 3.2177730274281826, 'rsi_os': 23, 'rsi_ob': 74, 'vol_spike': 0.28471989247775675, 'adx_thresh': 11.612172500187002, 'atr_min_pct': 0.024993291607295683, 'atr_max_pct': 0.07758417489128114, 'tp_mult': 1.1756092852481441, 'tsl_mult': 0.5987338725444601, 'strategy': 'breakout', 'time_stop': 158, 'use_sma': False, 'use_atr': False, 'use_adx': True, 'use_ema': False, 'use_spike': False, 'rsi_required': False, 'edge_k': 0.9902665111853524, 'edge_cap': 0.5820049920026711, 'bull_strategy': 'mean_reversion', 'bull_bb_std_mult': 0.8832120344121809, 'bull_rsi_os': 19, 'bull_rsi_ob': 55, 'bull_adx_thresh': 10.442463691939357, 'bull_atr_min_pct': 0.02039375350805081, 'bull_atr_max_pct': 0.13670064718686706, 'bull_tp_mult': 2.6325585485665637, 'bull_tsl_mult': 0.35592635222377067, 'bull_time_stop': 161, 'bull_use_sma': True, 'bull_use_ema': False, 'bull_use_atr': True, 'bull_use_adx': True, 'bull_use_spike': False, 'bull_rsi_required': True, 'bear_strategy': 'mean_reversion', 'bear_bb_std_mult': 3.3307590558154616, 'bear_rsi_os': 46, 'bear_rsi_ob': 73, 'bear_adx_thresh': 12.751028616012668, 'bear_atr_min_pct': 0.024294343658533564, 'bear_atr_max_pct': 0.08973783987684919, 'bear_tp_mult': 1.2436502004242325, 'bear_tsl_mult': 0.45141829097687913, 'bear_time_stop': 191, 'bear_use_sma': False, 'bear_use_ema': True, 'bear_use_atr': True, 'bear_use_adx': False, 'bear_use_spike': False, 'bear_rsi_required': True, 'sideways_strategy': 'mean_reversion', 'sideways_bb_std_mult': 3.2577160139149797, 'sideways_rsi_os': 25, 'sideways_rsi_ob': 57, 'sideways_adx_thresh': 15.312955030836193, 'sideways_atr_min_pct': 0.007317720914214936, 'sideways_atr_max_pct': 0.06408381270468352, 'sideways_tp_mult': 2.217748128230885, 'sideways_tsl_mult': 0.11929500808978744, 'sideways_time_stop': 193, 'sideways_use_sma': False, 'sideways_use_ema': True, 'sideways_use_atr': False, 'sideways_use_adx': False, 'sideways_use_spike': False, 'sideways_rsi_required': False}.
[I 2025-09-01 10:19:37,236] Trial 492 finished with values: [-1000000000.0, 1000000000.0] and parameters: {'p_sma': 18, 'p_std': 43, 'p_atr': 28, 'p_adx': 19, 'rsi_period': 66, 'ema1': 5, 'ema2': 29, 'slip_atr_k': 0.07111421366641185, 'slip_spread_k': 0.23024281587014214, 'spread_hl_frac': 0.04275312455836678, 'bb_std_mult': 3.2046419212662487, 'rsi_os': 28, 'rsi_ob': 75, 'vol_spike': 0.2842880418890261, 'adx_thresh': 11.614885390427283, 'atr_min_pct': 0.024733374176526383, 'atr_max_pct': 0.07662592682849208, 'tp_mult': 1.636093007546795, 'tsl_mult': 0.6572354507633144, 'strategy': 'mean_reversion', 'time_stop': 166, 'use_sma': False, 'use_atr': False, 'use_adx': False, 'use_ema': False, 'use_spike': False, 'rsi_required': False, 'edge_k': 0.0008751904638932828, 'edge_cap': 0.5822444942476158, 'bull_strategy': 'mean_reversion', 'bull_bb_std_mult': 3.366192870918815, 'bull_rsi_os': 17, 'bull_rsi_ob': 55, 'bull_adx_thresh': 28.482733136621544, 'bull_atr_min_pct': 0.011729311919742276, 'bull_atr_max_pct': 0.09575087503044186, 'bull_tp_mult': 1.9335251861201523, 'bull_tsl_mult': 0.3550988597792232, 'bull_time_stop': 155, 'bull_use_sma': True, 'bull_use_ema': False, 'bull_use_atr': True, 'bull_use_adx': True, 'bull_use_spike': False, 'bull_rsi_required': True, 'bear_strategy': 'mean_reversion', 'bear_bb_std_mult': 0.6836727397083495, 'bear_rsi_os': 45, 'bear_rsi_ob': 45, 'bear_adx_thresh': 11.727823319355881, 'bear_atr_min_pct': 0.01934206565868206, 'bear_atr_max_pct': 0.06987872103548516, 'bear_tp_mult': 1.2870883755276528, 'bear_tsl_mult': 0.4410446241152077, 'bear_time_stop': 239, 'bear_use_sma': False, 'bear_use_ema': True, 'bear_use_atr': False, 'bear_use_adx': False, 'bear_use_spike': False, 'bear_rsi_required': True, 'sideways_strategy': 'mean_reversion', 'sideways_bb_std_mult': 1.6506372209288476, 'sideways_rsi_os': 49, 'sideways_rsi_ob': 56, 'sideways_adx_thresh': 29.07534188222111, 'sideways_atr_min_pct': 0.007131002606854304, 'sideways_atr_max_pct': 0.08715828991644216, 'sideways_tp_mult': 2.8324691334338894, 'sideways_tsl_mult': 0.11452445113343962, 'sideways_time_stop': 199, 'sideways_use_sma': False, 'sideways_use_ema': True, 'sideways_use_atr': True, 'sideways_use_adx': False, 'sideways_use_spike': False, 'sideways_rsi_required': False}.
[I 2025-09-01 10:19:38,067] Trial 491 finished with values: [-1000000000.0, 1000000000.0] and parameters: {'p_sma': 9, 'p_std': 6, 'p_atr': 28, 'p_adx': 20, 'rsi_period': 11, 'ema1': 18, 'ema2': 52, 'slip_atr_k': 0.049732156728157687, 'slip_spread_k': 0.22345430882900386, 'spread_hl_frac': 0.031039509639215413, 'bb_std_mult': 3.2017200862678825, 'rsi_os': 28, 'rsi_ob': 75, 'vol_spike': 0.2839901581096816, 'adx_thresh': 18.001000972941092, 'atr_min_pct': 0.02492980294483818, 'atr_max_pct': 0.07848126239799662, 'tp_mult': 1.647708803537254, 'tsl_mult': 0.02135182545868052, 'strategy': 'breakout', 'time_stop': 170, 'use_sma': False, 'use_atr': False, 'use_adx': True, 'use_ema': False, 'use_spike': False, 'rsi_required': False, 'edge_k': 0.9187720859053166, 'edge_cap': 0.5851174534819772, 'bull_strategy': 'mean_reversion', 'bull_bb_std_mult': 1.7763745321726543, 'bull_rsi_os': 19, 'bull_rsi_ob': 55, 'bull_adx_thresh': 28.380529485043287, 'bull_atr_min_pct': 0.011748576709113485, 'bull_atr_max_pct': 0.09395253364863872, 'bull_tp_mult': 2.021522590010989, 'bull_tsl_mult': 0.02363077176928097, 'bull_time_stop': 162, 'bull_use_sma': True, 'bull_use_ema': False, 'bull_use_atr': True, 'bull_use_adx': True, 'bull_use_spike': False, 'bull_rsi_required': True, 'bear_strategy': 'mean_reversion', 'bear_bb_std_mult': 3.310168057796382, 'bear_rsi_os': 53, 'bear_rsi_ob': 45, 'bear_adx_thresh': 12.871596846174187, 'bear_atr_min_pct': 0.024249364442622934, 'bear_atr_max_pct': 0.08157046008810606, 'bear_tp_mult': 2.0587539801218413, 'bear_tsl_mult': 0.5411036879753282, 'bear_time_stop': 135, 'bear_use_sma': False, 'bear_use_ema': True, 'bear_use_atr': True, 'bear_use_adx': False, 'bear_use_spike': False, 'bear_rsi_required': True, 'sideways_strategy': 'mean_reversion', 'sideways_bb_std_mult': 2.0828758972800747, 'sideways_rsi_os': 52, 'sideways_rsi_ob': 51, 'sideways_adx_thresh': 29.10933859086987, 'sideways_atr_min_pct': 0.004719173509382484, 'sideways_atr_max_pct': 0.028418821698223982, 'sideways_tp_mult': 1.3911666097533504, 'sideways_tsl_mult': 0.6838823687668927, 'sideways_time_stop': 191, 'sideways_use_sma': False, 'sideways_use_ema': True, 'sideways_use_atr': False, 'sideways_use_adx': False, 'sideways_use_spike': False, 'sideways_rsi_required': False}.
[I 2025-09-01 10:19:38,308] Trial 489 finished with values: [-1000000000.0, 1000000000.0] and parameters: {'p_sma': 25, 'p_std': 44, 'p_atr': 30, 'p_adx': 22, 'rsi_period': 38, 'ema1': 22, 'ema2': 36, 'slip_atr_k': 0.04945002205831518, 'slip_spread_k': 0.6741121665648762, 'spread_hl_frac': 0.01751330356472073, 'bb_std_mult': 3.2007695640403075, 'rsi_os': 23, 'rsi_ob': 57, 'vol_spike': 0.2865813757904014, 'adx_thresh': 17.830591272718294, 'atr_min_pct': 0.01673669425687894, 'atr_max_pct': 0.0645039025050665, 'tp_mult': 2.78408815863651, 'tsl_mult': 0.9990768755434493, 'strategy': 'breakout', 'time_stop': 169, 'use_sma': False, 'use_atr': False, 'use_adx': True, 'use_ema': False, 'use_spike': True, 'rsi_required': False, 'edge_k': 0.9153579319719948, 'edge_cap': 0.5753703638308888, 'bull_strategy': 'mean_reversion', 'bull_bb_std_mult': 0.8504377052542889, 'bull_rsi_os': 18, 'bull_rsi_ob': 54, 'bull_adx_thresh': 6.416558251831333, 'bull_atr_min_pct': 0.011420693826890007, 'bull_atr_max_pct': 0.08045940435908584, 'bull_tp_mult': 1.779831891956038, 'bull_tsl_mult': 0.16788024619038577, 'bull_time_stop': 22, 'bull_use_sma': False, 'bull_use_ema': False, 'bull_use_atr': True, 'bull_use_adx': True, 'bull_use_spike': False, 'bull_rsi_required': True, 'bear_strategy': 'mean_reversion', 'bear_bb_std_mult': 3.3032019484386987, 'bear_rsi_os': 45, 'bear_rsi_ob': 45, 'bear_adx_thresh': 12.867823238485924, 'bear_atr_min_pct': 0.015974302633684268, 'bear_atr_max_pct': 0.14135020245005056, 'bear_tp_mult': 2.3686026933988136, 'bear_tsl_mult': 0.4408886355970096, 'bear_time_stop': 9, 'bear_use_sma': False, 'bear_use_ema': True, 'bear_use_atr': True, 'bear_use_adx': False, 'bear_use_spike': True, 'bear_rsi_required': True, 'sideways_strategy': 'mean_reversion', 'sideways_bb_std_mult': 3.3067489140751367, 'sideways_rsi_os': 49, 'sideways_rsi_ob': 51, 'sideways_adx_thresh': 15.194478082347707, 'sideways_atr_min_pct': 0.0032382731417050555, 'sideways_atr_max_pct': 0.08143817938808544, 'sideways_tp_mult': 2.9533689125265195, 'sideways_tsl_mult': 0.8364445140569142, 'sideways_time_stop': 42, 'sideways_use_sma': False, 'sideways_use_ema': True, 'sideways_use_atr': False, 'sideways_use_adx': False, 'sideways_use_spike': False, 'sideways_rsi_required': False}.
[I 2025-09-01 10:20:17,753] Trial 493 finished with values: [-1000000000.0, 1000000000.0] and parameters: {'p_sma': 33, 'p_std': 44, 'p_atr': 29, 'p_adx': 24, 'rsi_period': 68, 'ema1': 11, 'ema2': 59, 'slip_atr_k': 0.06455740134572732, 'slip_spread_k': 0.2301158747457703, 'spread_hl_frac': 0.042899023323642156, 'bb_std_mult': 3.1881717758734784, 'rsi_os': 28, 'rsi_ob': 56, 'vol_spike': 0.05363286334861571, 'adx_thresh': 5.57013258066447, 'atr_min_pct': 0.012232654630590985, 'atr_max_pct': 0.06599470060071783, 'tp_mult': 2.0923143882529622, 'tsl_mult': 0.8436527395260944, 'strategy': 'mean_reversion', 'time_stop': 39, 'use_sma': False, 'use_atr': False, 'use_adx': False, 'use_ema': False, 'use_spike': False, 'rsi_required': False, 'edge_k': 0.9223946775473948, 'edge_cap': 0.5381204922058549, 'bull_strategy': 'mean_reversion', 'bull_bb_std_mult': 0.7561351986222784, 'bull_rsi_os': 52, 'bull_rsi_ob': 54, 'bull_adx_thresh': 28.13562572579012, 'bull_atr_min_pct': 0.009981312352430338, 'bull_atr_max_pct': 0.09343924765320252, 'bull_tp_mult': 1.9260898523704606, 'bull_tsl_mult': 0.32563448233336156, 'bull_time_stop': 226, 'bull_use_sma': True, 'bull_use_ema': False, 'bull_use_atr': True, 'bull_use_adx': True, 'bull_use_spike': False, 'bull_rsi_required': True, 'bear_strategy': 'mean_reversion', 'bear_bb_std_mult': 3.0888811228266757, 'bear_rsi_os': 45, 'bear_rsi_ob': 79, 'bear_adx_thresh': 22.72203564704606, 'bear_atr_min_pct': 0.01749307949106985, 'bear_atr_max_pct': 0.06955971431326421, 'bear_tp_mult': 1.3770668561873014, 'bear_tsl_mult': 0.43501858340940724, 'bear_time_stop': 135, 'bear_use_sma': False, 'bear_use_ema': True, 'bear_use_atr': False, 'bear_use_adx': False, 'bear_use_spike': True, 'bear_rsi_required': True, 'sideways_strategy': 'mean_reversion', 'sideways_bb_std_mult': 2.0934522032911276, 'sideways_rsi_os': 55, 'sideways_rsi_ob': 62, 'sideways_adx_thresh': 29.06487981897878, 'sideways_atr_min_pct': 0.004420583599491123, 'sideways_atr_max_pct': 0.08140938852354476, 'sideways_tp_mult': 1.9224334239053864, 'sideways_tsl_mult': 0.7872267374960149, 'sideways_time_stop': 198, 'sideways_use_sma': False, 'sideways_use_ema': True, 'sideways_use_atr': True, 'sideways_use_adx': False, 'sideways_use_spike': False, 'sideways_rsi_required': False}.
[I 2025-09-01 10:20:17,755] Trial 495 finished with values: [-1000000000.0, 1000000000.0] and parameters: {'p_sma': 41, 'p_std': 43, 'p_atr': 29, 'p_adx': 24, 'rsi_period': 62, 'ema1': 12, 'ema2': 58, 'slip_atr_k': 0.05919206453332761, 'slip_spread_k': 0.6668342355162786, 'spread_hl_frac': 0.017425203480923832, 'bb_std_mult': 2.0763098529647555, 'rsi_os': 47, 'rsi_ob': 78, 'vol_spike': 0.26901777815684524, 'adx_thresh': 15.898487778620753, 'atr_min_pct': 0.017300473712802807, 'atr_max_pct': 0.06504243944847639, 'tp_mult': 2.769534261993386, 'tsl_mult': 0.01901479868984935, 'strategy': 'mean_reversion', 'time_stop': 44, 'use_sma': True, 'use_atr': False, 'use_adx': False, 'use_ema': False, 'use_spike': False, 'rsi_required': False, 'edge_k': 0.5386085479454238, 'edge_cap': 0.6836254772661101, 'bull_strategy': 'mean_reversion', 'bull_bb_std_mult': 0.7634271040980509, 'bull_rsi_os': 27, 'bull_rsi_ob': 76, 'bull_adx_thresh': 21.523530146906005, 'bull_atr_min_pct': 0.02391993089928437, 'bull_atr_max_pct': 0.08974656623045485, 'bull_tp_mult': 1.8708445148063078, 'bull_tsl_mult': 0.7040547327212625, 'bull_time_stop': 79, 'bull_use_sma': True, 'bull_use_ema': False, 'bull_use_atr': False, 'bull_use_adx': False, 'bull_use_spike': True, 'bull_rsi_required': True, 'bear_strategy': 'mean_reversion', 'bear_bb_std_mult': 2.3419890837035218, 'bear_rsi_os': 44, 'bear_rsi_ob': 61, 'bear_adx_thresh': 22.69758054986616, 'bear_atr_min_pct': 0.006716668084783635, 'bear_atr_max_pct': 0.010323988615193957, 'bear_tp_mult': 1.386805561362383, 'bear_tsl_mult': 0.20264382356337945, 'bear_time_stop': 143, 'bear_use_sma': False, 'bear_use_ema': True, 'bear_use_atr': False, 'bear_use_adx': False, 'bear_use_spike': True, 'bear_rsi_required': False, 'sideways_strategy': 'breakout', 'sideways_bb_std_mult': 0.6689748920358993, 'sideways_rsi_os': 28, 'sideways_rsi_ob': 73, 'sideways_adx_thresh': 25.580394902374927, 'sideways_atr_min_pct': 0.028786110797646324, 'sideways_atr_max_pct': 0.06961102108525788, 'sideways_tp_mult': 1.3288214623706693, 'sideways_tsl_mult': 0.7613428392837147, 'sideways_time_stop': 287, 'sideways_use_sma': False, 'sideways_use_ema': True, 'sideways_use_atr': False, 'sideways_use_adx': False, 'sideways_use_spike': False, 'sideways_rsi_required': False}.
