[I 2025-09-01 10:21:44,495] Trial 504 finished with values: [-0.026936334462092204, 0.02754815726677003] and parameters: {'p_sma': 34, 'p_std': 43, 'p_atr': 28, 'p_adx': 10, 'rsi_period': 35, 'ema1': 13, 'ema2': 37, 'slip_atr_k': 0.0376017278482569, 'slip_spread_k': 0.5602653982888737, 'spread_hl_frac': 0.00834923127574333, 'bb_std_mult': 1.1865112503682549, 'rsi_os': 16, 'rsi_ob': 77, 'vol_spike': 0.2538595119198061, 'adx_thresh': 5.846069693814817, 'atr_min_pct': 0.024329613566696256, 'atr_max_pct': 0.07782271957262475, 'tp_mult': 1.09508995397024, 'tsl_mult': 0.07295529592196112, 'strategy': 'breakout', 'time_stop': 153, 'use_sma': True, 'use_atr': True, 'use_adx': True, 'use_ema': False, 'use_spike': True, 'rsi_required': True, 'edge_k': 1.2467832132769445, 'edge_cap': 0.6033504403702034, 'bull_strategy': 'breakout', 'bull_bb_std_mult': 0.9535923448266489, 'bull_rsi_os': 20, 'bull_rsi_ob': 64, 'bull_adx_thresh': 16.45308614390551, 'bull_atr_min_pct': 0.029089559521111575, 'bull_atr_max_pct': 0.10472083649145514, 'bull_tp_mult': 1.8205904348523334, 'bull_tsl_mult': 0.5816134945397039, 'bull_time_stop': 153, 'bull_use_sma': False, 'bull_use_ema': True, 'bull_use_atr': False, 'bull_use_adx': True, 'bull_use_spike': False, 'bull_rsi_required': True, 'bear_strategy': 'mean_reversion', 'bear_bb_std_mult': 2.9960181268855868, 'bear_rsi_os': 55, 'bear_rsi_ob': 55, 'bear_adx_thresh': 21.14647201798859, 'bear_atr_min_pct': 0.015905901659504503, 'bear_atr_max_pct': 0.06646388208292457, 'bear_tp_mult': 2.829882819974538, 'bear_tsl_mult': 0.387601543274891, 'bear_time_stop': 139, 'bear_use_sma': True, 'bear_use_ema': True, 'bear_use_atr': True, 'bear_use_adx': True, 'bear_use_spike': False, 'bear_rsi_required': False, 'sideways_strategy': 'breakout', 'sideways_bb_std_mult': 3.4755932391274618, 'sideways_rsi_os': 31, 'sideways_rsi_ob': 65, 'sideways_adx_thresh': 27.669045764413113, 'sideways_atr_min_pct': 0.002296176477091705, 'sideways_atr_max_pct': 0.0726583858240436, 'sideways_tp_mult': 1.351473987706712, 'sideways_tsl_mult': 0.23298165899469853, 'sideways_time_stop': 182, 'sideways_use_sma': False, 'sideways_use_ema': True, 'sideways_use_atr': True, 'sideways_use_adx': True, 'sideways_use_spike': True, 'sideways_rsi_required': True}.
[I 2025-09-01 10:21:45,397] Trial 502 finished with values: [-0.08133033269539225, 0.08127109971137718] and parameters: {'p_sma': 22, 'p_std': 45, 'p_atr': 28, 'p_adx': 11, 'rsi_period': 35, 'ema1': 17, 'ema2': 54, 'slip_atr_k': 0.043982656262289, 'slip_spread_k': 0.19565073863454527, 'spread_hl_frac': 0.008207885079914594, 'bb_std_mult': 1.3097964025428226, 'rsi_os': 16, 'rsi_ob': 76, 'vol_spike': 0.2996099150863746, 'adx_thresh': 8.86003446567979, 'atr_min_pct': 0.004574511915267832, 'atr_max_pct': 0.07755854005006166, 'tp_mult': 2.6808849730838675, 'tsl_mult': 0.9399258630233815, 'strategy': 'breakout', 'time_stop': 155, 'use_sma': True, 'use_atr': True, 'use_adx': True, 'use_ema': False, 'use_spike': False, 'rsi_required': True, 'edge_k': 1.8826065365659677, 'edge_cap': 0.601543263975639, 'bull_strategy': 'breakout', 'bull_bb_std_mult': 2.0322487974207024, 'bull_rsi_os': 20, 'bull_rsi_ob': 64, 'bull_adx_thresh': 5.883343787477841, 'bull_atr_min_pct': 0.029989019219579922, 'bull_atr_max_pct': 0.04067739081889445, 'bull_tp_mult': 1.1746208519184536, 'bull_tsl_mult': 0.07478367069401526, 'bull_time_stop': 155, 'bull_use_sma': True, 'bull_use_ema': True, 'bull_use_atr': False, 'bull_use_adx': False, 'bull_use_spike': False, 'bull_rsi_required': True, 'bear_strategy': 'mean_reversion', 'bear_bb_std_mult': 2.4804693381597125, 'bear_rsi_os': 47, 'bear_rsi_ob': 46, 'bear_adx_thresh': 18.549495068934107, 'bear_atr_min_pct': 0.004454803398987222, 'bear_atr_max_pct': 0.05394083270829465, 'bear_tp_mult': 1.5438763266488602, 'bear_tsl_mult': 0.4585191878880519, 'bear_time_stop': 145, 'bear_use_sma': True, 'bear_use_ema': True, 'bear_use_atr': True, 'bear_use_adx': True, 'bear_use_spike': False, 'bear_rsi_required': False, 'sideways_strategy': 'breakout', 'sideways_bb_std_mult': 3.2226257250357495, 'sideways_rsi_os': 47, 'sideways_rsi_ob': 79, 'sideways_adx_thresh': 7.674750039930364, 'sideways_atr_min_pct': 0.0029026386106471274, 'sideways_atr_max_pct': 0.10017777694524913, 'sideways_tp_mult': 1.2020984977907734, 'sideways_tsl_mult': 0.8583528608613569, 'sideways_time_stop': 25, 'sideways_use_sma': False, 'sideways_use_ema': True, 'sideways_use_atr': False, 'sideways_use_adx': True, 'sideways_use_spike': True, 'sideways_rsi_required': True}.
[I 2025-09-01 10:22:25,030] Trial 507 finished with values: [-1000000000.0, 1000000000.0] and parameters: {'p_sma': 47, 'p_std': 42, 'p_atr': 30, 'p_adx': 22, 'rsi_period': 64, 'ema1': 23, 'ema2': 21, 'slip_atr_k': 0.04362166150598102, 'slip_spread_k': 0.7222266950369701, 'spread_hl_frac': 0.02971625595222194, 'bb_std_mult': 2.9870495244826625, 'rsi_os': 37, 'rsi_ob': 80, 'vol_spike': 0.290193280638484, 'adx_thresh': 6.747881880432856, 'atr_min_pct': 0.02197130428128066, 'atr_max_pct': 0.07235361560302217, 'tp_mult': 2.7107902505891155, 'tsl_mult': 0.5431859435039268, 'strategy': 'mean_reversion', 'time_stop': 156, 'use_sma': True, 'use_atr': False, 'use_adx': False, 'use_ema': False, 'use_spike': False, 'rsi_required': False, 'edge_k': 0.8216580701897064, 'edge_cap': 0.5081915528134799, 'bull_strategy': 'mean_reversion', 'bull_bb_std_mult': 2.0572403981071576, 'bull_rsi_os': 18, 'bull_rsi_ob': 56, 'bull_adx_thresh': 5.898242870432608, 'bull_atr_min_pct': 0.022062041069915005, 'bull_atr_max_pct': 0.13262205855000775, 'bull_tp_mult': 2.909195732219399, 'bull_tsl_mult': 0.027221099609559707, 'bull_time_stop': 180, 'bull_use_sma': True, 'bull_use_ema': False, 'bull_use_atr': True, 'bull_use_adx': True, 'bull_use_spike': False, 'bull_rsi_required': True, 'bear_strategy': 'mean_reversion', 'bear_bb_std_mult': 3.3904497591940026, 'bear_rsi_os': 25, 'bear_rsi_ob': 48, 'bear_adx_thresh': 18.405945090467725, 'bear_atr_min_pct': 0.012853443725807838, 'bear_atr_max_pct': 0.0669465703836273, 'bear_tp_mult': 1.1787890092678848, 'bear_tsl_mult': 0.9910784201228799, 'bear_time_stop': 157, 'bear_use_sma': False, 'bear_use_ema': True, 'bear_use_atr': False, 'bear_use_adx': False, 'bear_use_spike': True, 'bear_rsi_required': True, 'sideways_strategy': 'mean_reversion', 'sideways_bb_std_mult': 3.2888410571426014, 'sideways_rsi_os': 47, 'sideways_rsi_ob': 50, 'sideways_adx_thresh': 19.756379465162418, 'sideways_atr_min_pct': 0.005561066614134809, 'sideways_atr_max_pct': 0.12973907812013122, 'sideways_tp_mult': 1.371551296462443, 'sideways_tsl_mult': 0.18582565359172898, 'sideways_time_stop': 198, 'sideways_use_sma': False, 'sideways_use_ema': True, 'sideways_use_atr': False, 'sideways_use_adx': False, 'sideways_use_spike': False, 'sideways_rsi_required': False}.
[I 2025-09-01 10:22:26,156] Trial 508 finished with values: [-1000000000.0, 1000000000.0] and parameters: {'p_sma': 20, 'p_std': 45, 'p_atr': 30, 'p_adx': 22, 'rsi_period': 64, 'ema1': 17, 'ema2': 51, 'slip_atr_k': 0.044721881534612096, 'slip_spread_k': 0.732378541584707, 'spread_hl_frac': 0.021297464624995967, 'bb_std_mult': 3.0176148029924805, 'rsi_os': 7, 'rsi_ob': 94, 'vol_spike': 0.2814208634453248, 'adx_thresh': 7.36352644656177, 'atr_min_pct': 0.006914467649382949, 'atr_max_pct': 0.03504251717183969, 'tp_mult': 2.7142331227199628, 'tsl_mult': 0.5223651076065, 'strategy': 'mean_reversion', 'time_stop': 113, 'use_sma': False, 'use_atr': False, 'use_adx': False, 'use_ema': False, 'use_spike': False, 'rsi_required': False, 'edge_k': 0.9469137501581212, 'edge_cap': 0.19325119675538416, 'bull_strategy': 'mean_reversion', 'bull_bb_std_mult': 0.8031336705657186, 'bull_rsi_os': 18, 'bull_rsi_ob': 54, 'bull_adx_thresh': 11.023922339775627, 'bull_atr_min_pct': 0.021970571875937293, 'bull_atr_max_pct': 0.02601212907170926, 'bull_tp_mult': 1.1392815687312063, 'bull_tsl_mult': 0.025090385931143704, 'bull_time_stop': 181, 'bull_use_sma': True, 'bull_use_ema': False, 'bull_use_atr': True, 'bull_use_adx': True, 'bull_use_spike': False, 'bull_rsi_required': True, 'bear_strategy': 'mean_reversion', 'bear_bb_std_mult': 3.4410370987376275, 'bear_rsi_os': 40, 'bear_rsi_ob': 78, 'bear_adx_thresh': 29.889108541014302, 'bear_atr_min_pct': 0.01691174568543754, 'bear_atr_max_pct': 0.07230851430585192, 'bear_tp_mult': 1.2077478136598057, 'bear_tsl_mult': 0.687955536358712, 'bear_time_stop': 156, 'bear_use_sma': False, 'bear_use_ema': True, 'bear_use_atr': False, 'bear_use_adx': False, 'bear_use_spike': True, 'bear_rsi_required': True, 'sideways_strategy': 'mean_reversion', 'sideways_bb_std_mult': 2.009770611115117, 'sideways_rsi_os': 47, 'sideways_rsi_ob': 93, 'sideways_adx_thresh': 23.31518406659864, 'sideways_atr_min_pct': 0.021688705431273526, 'sideways_atr_max_pct': 0.10726372258933219, 'sideways_tp_mult': 2.6551774799200647, 'sideways_tsl_mult': 0.3171500180371606, 'sideways_time_stop': 271, 'sideways_use_sma': False, 'sideways_use_ema': True, 'sideways_use_atr': False, 'sideways_use_adx': False, 'sideways_use_spike': False, 'sideways_rsi_required': False}.
[I 2025-09-01 10:22:26,805] Trial 509 finished with values: [-1000000000.0, 1000000000.0] and parameters: {'p_sma': 20, 'p_std': 42, 'p_atr': 30, 'p_adx': 16, 'rsi_period': 64, 'ema1': 14, 'ema2': 12, 'slip_atr_k': 0.15671771356953976, 'slip_spread_k': 0.14717343992051896, 'spread_hl_frac': 0.03914361905016724, 'bb_std_mult': 3.0315338693482854, 'rsi_os': 24, 'rsi_ob': 94, 'vol_spike': 0.15051207489499016, 'adx_thresh': 22.419369282297787, 'atr_min_pct': 0.025035410650404284, 'atr_max_pct': 0.09567894381553296, 'tp_mult': 2.718340240535321, 'tsl_mult': 0.03901086577778022, 'strategy': 'mean_reversion', 'time_stop': 82, 'use_sma': False, 'use_atr': False, 'use_adx': False, 'use_ema': False, 'use_spike': False, 'rsi_required': False, 'edge_k': 0.945955649953554, 'edge_cap': 0.33438973621803314, 'bull_strategy': 'mean_reversion', 'bull_bb_std_mult': 3.023106171929719, 'bull_rsi_os': 17, 'bull_rsi_ob': 54, 'bull_adx_thresh': 6.459490868254429, 'bull_atr_min_pct': 0.01872561931045863, 'bull_atr_max_pct': 0.07742652166988878, 'bull_tp_mult': 1.9323235465203148, 'bull_tsl_mult': 0.028463669646767054, 'bull_time_stop': 216, 'bull_use_sma': True, 'bull_use_ema': False, 'bull_use_atr': True, 'bull_use_adx': True, 'bull_use_spike': False, 'bull_rsi_required': True, 'bear_strategy': 'mean_reversion', 'bear_bb_std_mult': 3.38795697517681, 'bear_rsi_os': 29, 'bear_rsi_ob': 48, 'bear_adx_thresh': 14.694275945862682, 'bear_atr_min_pct': 0.009766940804647437, 'bear_atr_max_pct': 0.07219604604859443, 'bear_tp_mult': 1.176159234659207, 'bear_tsl_mult': 0.8749382114699364, 'bear_time_stop': 283, 'bear_use_sma': False, 'bear_use_ema': True, 'bear_use_atr': False, 'bear_use_adx': False, 'bear_use_spike': True, 'bear_rsi_required': True, 'sideways_strategy': 'mean_reversion', 'sideways_bb_std_mult': 3.367681599739591, 'sideways_rsi_os': 48, 'sideways_rsi_ob': 50, 'sideways_adx_thresh': 32.084101816873556, 'sideways_atr_min_pct': 0.005635570329393954, 'sideways_atr_max_pct': 0.06494474122527606, 'sideways_tp_mult': 1.310797246416517, 'sideways_tsl_mult': 0.5483680985148927, 'sideways_time_stop': 199, 'sideways_use_sma': False, 'sideways_use_ema': True, 'sideways_use_atr': False, 'sideways_use_adx': False, 'sideways_use_spike': False, 'sideways_rsi_required': False}.
[I 2025-09-01 10:22:27,603] Trial 506 finished with values: [-0.17833130055994284, 0.17821835816274725] and parameters: {'p_sma': 20, 'p_std': 19, 'p_atr': 28, 'p_adx': 7, 'rsi_period': 72, 'ema1': 17, 'ema2': 56, 'slip_atr_k': 0.04625534605609971, 'slip_spread_k': 0.7059083637909787, 'spread_hl_frac': 0.008329007773757176, 'bb_std_mult': 2.945146396965628, 'rsi_os': 34, 'rsi_ob': 77, 'vol_spike': 0.2902883804620188, 'adx_thresh': 8.635361696857254, 'atr_min_pct': 0.024583028416955775, 'atr_max_pct': 0.1226810844664141, 'tp_mult': 2.6807976445970727, 'tsl_mult': 0.9390342707812537, 'strategy': 'breakout', 'time_stop': 114, 'use_sma': True, 'use_atr': True, 'use_adx': False, 'use_ema': False, 'use_spike': False, 'rsi_required': True, 'edge_k': 0.6323648614149524, 'edge_cap': 0.5614834970208542, 'bull_strategy': 'breakout', 'bull_bb_std_mult': 0.8443463304754334, 'bull_rsi_os': 17, 'bull_rsi_ob': 55, 'bull_adx_thresh': 32.255279857626185, 'bull_atr_min_pct': 0.0289199113422634, 'bull_atr_max_pct': 0.026329243257574138, 'bull_tp_mult': 1.9057801859014751, 'bull_tsl_mult': 0.02989633333519318, 'bull_time_stop': 63, 'bull_use_sma': True, 'bull_use_ema': False, 'bull_use_atr': False, 'bull_use_adx': True, 'bull_use_spike': False, 'bull_rsi_required': True, 'bear_strategy': 'mean_reversion', 'bear_bb_std_mult': 3.44655238812084, 'bear_rsi_os': 46, 'bear_rsi_ob': 78, 'bear_adx_thresh': 18.132764676036828, 'bear_atr_min_pct': 0.016350054250468087, 'bear_atr_max_pct': 0.06651011611619372, 'bear_tp_mult': 1.5470387074310747, 'bear_tsl_mult': 0.8922161976556489, 'bear_time_stop': 156, 'bear_use_sma': True, 'bear_use_ema': True, 'bear_use_atr': False, 'bear_use_adx': True, 'bear_use_spike': False, 'bear_rsi_required': False, 'sideways_strategy': 'breakout', 'sideways_bb_std_mult': 3.495298788323325, 'sideways_rsi_os': 49, 'sideways_rsi_ob': 83, 'sideways_adx_thresh': 24.47804430307641, 'sideways_atr_min_pct': 0.0018386226624869534, 'sideways_atr_max_pct': 0.13947383961440557, 'sideways_tp_mult': 2.3493102146339777, 'sideways_tsl_mult': 0.811588827807844, 'sideways_time_stop': 107, 'sideways_use_sma': False, 'sideways_use_ema': True, 'sideways_use_atr': False, 'sideways_use_adx': True, 'sideways_use_spike': True, 'sideways_rsi_required': True}.
[I 2025-09-01 10:23:08,829] Trial 513 finished with values: [-1000000000.0, 1000000000.0] and parameters: {'p_sma': 18, 'p_std': 16, 'p_atr': 29, 'p_adx': 22, 'rsi_period': 41, 'ema1': 6, 'ema2': 45, 'slip_atr_k': 0.1167883334261676, 'slip_spread_k': 0.17169201796118502, 'spread_hl_frac': 0.032235280867441186, 'bb_std_mult': 3.160032836931045, 'rsi_os': 29, 'rsi_ob': 75, 'vol_spike': 0.06894417517164236, 'adx_thresh': 6.6892629707614, 'atr_min_pct': 0.013471981427130669, 'atr_max_pct': 0.08593007164919712, 'tp_mult': 2.801086203886213, 'tsl_mult': 0.013860057623797065, 'strategy': 'breakout', 'time_stop': 133, 'use_sma': True, 'use_atr': False, 'use_adx': True, 'use_ema': False, 'use_spike': True, 'rsi_required': False, 'edge_k': 1.0087144109287831, 'edge_cap': 0.804343772750374, 'bull_strategy': 'mean_reversion', 'bull_bb_std_mult': 0.7015579637145983, 'bull_rsi_os': 31, 'bull_rsi_ob': 52, 'bull_adx_thresh': 17.346319375109747, 'bull_atr_min_pct': 0.02937606355393365, 'bull_atr_max_pct': 0.08955923479990947, 'bull_tp_mult': 1.954965476160736, 'bull_tsl_mult': 0.5177174304937715, 'bull_time_stop': 282, 'bull_use_sma': False, 'bull_use_ema': False, 'bull_use_atr': True, 'bull_use_adx': False, 'bull_use_spike': True, 'bull_rsi_required': True, 'bear_strategy': 'mean_reversion', 'bear_bb_std_mult': 1.9787832248073953, 'bear_rsi_os': 46, 'bear_rsi_ob': 71, 'bear_adx_thresh': 12.19770273079343, 'bear_atr_min_pct': 0.0006008648540983767, 'bear_atr_max_pct': 0.0700776273347326, 'bear_tp_mult': 1.8157398158539664, 'bear_tsl_mult': 0.04380961138237621, 'bear_time_stop': 123, 'bear_use_sma': False, 'bear_use_ema': True, 'bear_use_atr': True, 'bear_use_adx': False, 'bear_use_spike': True, 'bear_rsi_required': False, 'sideways_strategy': 'breakout', 'sideways_bb_std_mult': 1.8727106051656826, 'sideways_rsi_os': 50, 'sideways_rsi_ob': 48, 'sideways_adx_thresh': 28.422547420600505, 'sideways_atr_min_pct': 0.026641064592878187, 'sideways_atr_max_pct': 0.06808084231120298, 'sideways_tp_mult': 2.86229987951535, 'sideways_tsl_mult': 0.8335048221151449, 'sideways_time_stop': 214, 'sideways_use_sma': False, 'sideways_use_ema': False, 'sideways_use_atr': False, 'sideways_use_adx': False, 'sideways_use_spike': False, 'sideways_rsi_required': False}.
[I 2025-09-01 10:23:10,147] Trial 510 finished with values: [-1000000000.0, 1000000000.0] and parameters: {'p_sma': 43, 'p_std': 19, 'p_atr': 30, 'p_adx': 29, 'rsi_period': 61, 'ema1': 16, 'ema2': 51, 'slip_atr_k': 0.05093194399275382, 'slip_spread_k': 0.15025652117361346, 'spread_hl_frac': 0.02609195713702439, 'bb_std_mult': 3.047155033616678, 'rsi_os': 7, 'rsi_ob': 83, 'vol_spike': 0.12293600667165047, 'adx_thresh': 7.330669750307038, 'atr_min_pct': 0.025106242260162982, 'atr_max_pct': 0.07428716088181933, 'tp_mult': 2.6028065466152777, 'tsl_mult': 0.013960144490645811, 'strategy': 'mean_reversion', 'time_stop': 163, 'use_sma': False, 'use_atr': False, 'use_adx': False, 'use_ema': False, 'use_spike': False, 'rsi_required': False, 'edge_k': 0.9481556551234321, 'edge_cap': 0.33542369551620477, 'bull_strategy': 'mean_reversion', 'bull_bb_std_mult': 3.0350766970107506, 'bull_rsi_os': 50, 'bull_rsi_ob': 54, 'bull_adx_thresh': 17.30420150109135, 'bull_atr_min_pct': 0.02939344099375532, 'bull_atr_max_pct': 0.09110761245566282, 'bull_tp_mult': 1.9492210372272398, 'bull_tsl_mult': 0.7977339126994918, 'bull_time_stop': 161, 'bull_use_sma': True, 'bull_use_ema': False, 'bull_use_atr': True, 'bull_use_adx': True, 'bull_use_spike': False, 'bull_rsi_required': True, 'bear_strategy': 'mean_reversion', 'bear_bb_std_mult': 3.530189979265701, 'bear_rsi_os': 28, 'bear_rsi_ob': 45, 'bear_adx_thresh': 14.607428540238779, 'bear_atr_min_pct': 0.009670831029507401, 'bear_atr_max_pct': 0.07163820622919198, 'bear_tp_mult': 1.8131460512118365, 'bear_tsl_mult': 0.4154708333428192, 'bear_time_stop': 119, 'bear_use_sma': False, 'bear_use_ema': True, 'bear_use_atr': False, 'bear_use_adx': False, 'bear_use_spike': True, 'bear_rsi_required': False, 'sideways_strategy': 'breakout', 'sideways_bb_std_mult': 3.1343130239188937, 'sideways_rsi_os': 49, 'sideways_rsi_ob': 48, 'sideways_adx_thresh': 23.391631845124312, 'sideways_atr_min_pct': 0.027773110338735685, 'sideways_atr_max_pct': 0.06477542184881581, 'sideways_tp_mult': 1.3027742962377773, 'sideways_tsl_mult': 0.805269516570202, 'sideways_time_stop': 189, 'sideways_use_sma': False, 'sideways_use_ema': True, 'sideways_use_atr': False, 'sideways_use_adx': False, 'sideways_use_spike': False, 'sideways_rsi_required': False}.
[I 2025-09-01 10:23:10,589] Trial 512 finished with values: [-1000000000.0, 1000000000.0] and parameters: {'p_sma': 18, 'p_std': 44, 'p_atr': 29, 'p_adx': 29, 'rsi_period': 41, 'ema1': 20, 'ema2': 27, 'slip_atr_k': 0.05129400963458369, 'slip_spread_k': 0.8514691634851423, 'spread_hl_frac': 0.033050797562199724, 'bb_std_mult': 0.5044779025053516, 'rsi_os': 29, 'rsi_ob': 59, 'vol_spike': 0.06721498994759639, 'adx_thresh': 6.624875416301379, 'atr_min_pct': 0.02355746148494901, 'atr_max_pct': 0.08571170872371112, 'tp_mult': 2.8081776311475397, 'tsl_mult': 0.012469491765905024, 'strategy': 'breakout', 'time_stop': 135, 'use_sma': True, 'use_atr': False, 'use_adx': True, 'use_ema': False, 'use_spike': True, 'rsi_required': False, 'edge_k': 1.00312054656417, 'edge_cap': 0.5568414377277293, 'bull_strategy': 'mean_reversion', 'bull_bb_std_mult': 0.721344511922981, 'bull_rsi_os': 17, 'bull_rsi_ob': 55, 'bull_adx_thresh': 33.82370153430115, 'bull_atr_min_pct': 0.007819776957504703, 'bull_atr_max_pct': 0.08878474891685689, 'bull_tp_mult': 1.8954462855568206, 'bull_tsl_mult': 0.4898582926113137, 'bull_time_stop': 166, 'bull_use_sma': False, 'bull_use_ema': False, 'bull_use_atr': True, 'bull_use_adx': True, 'bull_use_spike': True, 'bull_rsi_required': True, 'bear_strategy': 'mean_reversion', 'bear_bb_std_mult': 1.787355920112229, 'bear_rsi_os': 46, 'bear_rsi_ob': 45, 'bear_adx_thresh': 12.209847060359024, 'bear_atr_min_pct': 0.01656948461906613, 'bear_atr_max_pct': 0.06929521185624614, 'bear_tp_mult': 1.230843598628351, 'bear_tsl_mult': 0.41939792213753524, 'bear_time_stop': 136, 'bear_use_sma': False, 'bear_use_ema': True, 'bear_use_atr': True, 'bear_use_adx': False, 'bear_use_spike': True, 'bear_rsi_required': False, 'sideways_strategy': 'breakout', 'sideways_bb_std_mult': 2.6874904982608046, 'sideways_rsi_os': 50, 'sideways_rsi_ob': 48, 'sideways_adx_thresh': 25.80105430611048, 'sideways_atr_min_pct': 0.027246138319829985, 'sideways_atr_max_pct': 0.06838622044596458, 'sideways_tp_mult': 2.361948715438417, 'sideways_tsl_mult': 0.8278338354494104, 'sideways_time_stop': 115, 'sideways_use_sma': False, 'sideways_use_ema': True, 'sideways_use_atr': False, 'sideways_use_adx': False, 'sideways_use_spike': False, 'sideways_rsi_required': False}.
