[I 2025-09-01 10:36:41,911] Trial 595 finished with values: [-1000000000.0, 1000000000.0] and parameters: {'p_sma': 15, 'p_std': 43, 'p_atr': 28, 'p_adx': 27, 'rsi_period': 76, 'ema1': 21, 'ema2': 54, 'slip_atr_k': 0.019452871125204677, 'slip_spread_k': 0.14166544891341895, 'spread_hl_frac': 0.048656181513381296, 'bb_std_mult': 2.1878741186814725, 'rsi_os': 36, 'rsi_ob': 83, 'vol_spike': 0.2844460450099869, 'adx_thresh': 6.666046022716414, 'atr_min_pct': 0.026511038247212394, 'atr_max_pct': 0.12429116400772625, 'tp_mult': 2.5654386093712835, 'tsl_mult': 0.04228110461122892, 'strategy': 'breakout', 'time_stop': 151, 'use_sma': False, 'use_atr': False, 'use_adx': True, 'use_ema': False, 'use_spike': True, 'rsi_required': False, 'edge_k': 0.4386339181231961, 'edge_cap': 0.8921707341367613, 'bull_strategy': 'mean_reversion', 'bull_bb_std_mult': 2.6272052617003276, 'bull_rsi_os': 20, 'bull_rsi_ob': 54, 'bull_adx_thresh': 5.551604155785378, 'bull_atr_min_pct': 0.023722654169473854, 'bull_atr_max_pct': 0.08147417229396368, 'bull_tp_mult': 1.9523909197917706, 'bull_tsl_mult': 0.9707858734744186, 'bull_time_stop': 239, 'bull_use_sma': True, 'bull_use_ema': False, 'bull_use_atr': True, 'bull_use_adx': True, 'bull_use_spike': False, 'bull_rsi_required': True, 'bear_strategy': 'mean_reversion', 'bear_bb_std_mult': 3.2190417334141723, 'bear_rsi_os': 32, 'bear_rsi_ob': 51, 'bear_adx_thresh': 8.11991861606096, 'bear_atr_min_pct': 0.016678021638359367, 'bear_atr_max_pct': 0.13879282148963315, 'bear_tp_mult': 1.160748709625295, 'bear_tsl_mult': 0.4072902127299505, 'bear_time_stop': 40, 'bear_use_sma': False, 'bear_use_ema': True, 'bear_use_atr': True, 'bear_use_adx': True, 'bear_use_spike': True, 'bear_rsi_required': False, 'sideways_strategy': 'breakout', 'sideways_bb_std_mult': 3.484168157093551, 'sideways_rsi_os': 50, 'sideways_rsi_ob': 68, 'sideways_adx_thresh': 11.547602184179542, 'sideways_atr_min_pct': 0.004041517354977615, 'sideways_atr_max_pct': 0.02629265070273506, 'sideways_tp_mult': 1.333931699219274, 'sideways_tsl_mult': 0.8406343671443299, 'sideways_time_stop': 78, 'sideways_use_sma': False, 'sideways_use_ema': False, 'sideways_use_atr': True, 'sideways_use_adx': False, 'sideways_use_spike': False, 'sideways_rsi_required': False}.
[I 2025-09-01 10:36:42,751] Trial 597 finished with values: [-0.028158110989061735, 0.027934012472467157] and parameters: {'p_sma': 18, 'p_std': 41, 'p_atr': 28, 'p_adx': 27, 'rsi_period': 66, 'ema1': 21, 'ema2': 31, 'slip_atr_k': 0.04909798690756233, 'slip_spread_k': 0.14769051757872081, 'spread_hl_frac': 0.026815285632471545, 'bb_std_mult': 2.189473926273678, 'rsi_os': 46, 'rsi_ob': 56, 'vol_spike': 0.28270649734328035, 'adx_thresh': 11.032456733060377, 'atr_min_pct': 0.026382366289471645, 'atr_max_pct': 0.08239787654578186, 'tp_mult': 2.622863947811599, 'tsl_mult': 0.0388644611043252, 'strategy': 'breakout', 'time_stop': 142, 'use_sma': False, 'use_atr': False, 'use_adx': True, 'use_ema': False, 'use_spike': True, 'rsi_required': False, 'edge_k': 0.8868573334932864, 'edge_cap': 0.3934545599360031, 'bull_strategy': 'mean_reversion', 'bull_bb_std_mult': 0.7178746765890576, 'bull_rsi_os': 17, 'bull_rsi_ob': 81, 'bull_adx_thresh': 33.67159246165721, 'bull_atr_min_pct': 0.01996379536871405, 'bull_atr_max_pct': 0.12876666337028173, 'bull_tp_mult': 1.9075655822460436, 'bull_tsl_mult': 0.15296458022927678, 'bull_time_stop': 163, 'bull_use_sma': True, 'bull_use_ema': False, 'bull_use_atr': True, 'bull_use_adx': False, 'bull_use_spike': False, 'bull_rsi_required': False, 'bear_strategy': 'mean_reversion', 'bear_bb_std_mult': 3.274400717082618, 'bear_rsi_os': 17, 'bear_rsi_ob': 56, 'bear_adx_thresh': 27.005572763841883, 'bear_atr_min_pct': 0.018828395909490925, 'bear_atr_max_pct': 0.028997985669927936, 'bear_tp_mult': 1.161715570496852, 'bear_tsl_mult': 0.7791297458655833, 'bear_time_stop': 139, 'bear_use_sma': False, 'bear_use_ema': True, 'bear_use_atr': True, 'bear_use_adx': False, 'bear_use_spike': True, 'bear_rsi_required': False, 'sideways_strategy': 'breakout', 'sideways_bb_std_mult': 3.339966716099829, 'sideways_rsi_os': 51, 'sideways_rsi_ob': 49, 'sideways_adx_thresh': 24.248106288695645, 'sideways_atr_min_pct': 0.0028487232025068408, 'sideways_atr_max_pct': 0.0741294414058034, 'sideways_tp_mult': 1.339868154815591, 'sideways_tsl_mult': 0.20600804221351854, 'sideways_time_stop': 209, 'sideways_use_sma': False, 'sideways_use_ema': False, 'sideways_use_atr': False, 'sideways_use_adx': False, 'sideways_use_spike': False, 'sideways_rsi_required': False}.
[I 2025-09-01 10:36:44,197] Trial 596 finished with values: [-0.04129430570361603, 0.041205271308660085] and parameters: {'p_sma': 15, 'p_std': 43, 'p_atr': 28, 'p_adx': 8, 'rsi_period': 66, 'ema1': 21, 'ema2': 40, 'slip_atr_k': 0.06841770581697493, 'slip_spread_k': 0.15014024266965523, 'spread_hl_frac': 0.027734104121631364, 'bb_std_mult': 3.2892336250024807, 'rsi_os': 47, 'rsi_ob': 77, 'vol_spike': 0.260433865811854, 'adx_thresh': 5.02076844963298, 'atr_min_pct': 0.01403730719975853, 'atr_max_pct': 0.08231467428653985, 'tp_mult': 2.6377799567369355, 'tsl_mult': 0.8878886882390249, 'strategy': 'breakout', 'time_stop': 245, 'use_sma': False, 'use_atr': False, 'use_adx': True, 'use_ema': False, 'use_spike': True, 'rsi_required': True, 'edge_k': 0.9147098546555041, 'edge_cap': 0.8870929658633179, 'bull_strategy': 'breakout', 'bull_bb_std_mult': 0.6638309823330804, 'bull_rsi_os': 31, 'bull_rsi_ob': 53, 'bull_adx_thresh': 6.054638175336359, 'bull_atr_min_pct': 0.029991399986270335, 'bull_atr_max_pct': 0.11412903237671379, 'bull_tp_mult': 1.9378735985810651, 'bull_tsl_mult': 0.18568985066103033, 'bull_time_stop': 163, 'bull_use_sma': True, 'bull_use_ema': True, 'bull_use_atr': True, 'bull_use_adx': True, 'bull_use_spike': True, 'bull_rsi_required': False, 'bear_strategy': 'mean_reversion', 'bear_bb_std_mult': 2.7050648006020155, 'bear_rsi_os': 32, 'bear_rsi_ob': 48, 'bear_adx_thresh': 13.00199125708537, 'bear_atr_min_pct': 0.01698013678057948, 'bear_atr_max_pct': 0.04348113319802642, 'bear_tp_mult': 2.6058352574317007, 'bear_tsl_mult': 0.7711105301671941, 'bear_time_stop': 139, 'bear_use_sma': True, 'bear_use_ema': False, 'bear_use_atr': True, 'bear_use_adx': True, 'bear_use_spike': True, 'bear_rsi_required': False, 'sideways_strategy': 'breakout', 'sideways_bb_std_mult': 1.983788059089981, 'sideways_rsi_os': 51, 'sideways_rsi_ob': 67, 'sideways_adx_thresh': 16.461978911012725, 'sideways_atr_min_pct': 0.002831517385849844, 'sideways_atr_max_pct': 0.02196130873848321, 'sideways_tp_mult': 1.3346695974165428, 'sideways_tsl_mult': 0.1338050334658895, 'sideways_time_stop': 80, 'sideways_use_sma': False, 'sideways_use_ema': False, 'sideways_use_atr': False, 'sideways_use_adx': False, 'sideways_use_spike': True, 'sideways_rsi_required': True}.
[I 2025-09-01 10:36:45,048] Trial 594 finished with values: [-1000000000.0, 1000000000.0] and parameters: {'p_sma': 16, 'p_std': 40, 'p_atr': 28, 'p_adx': 21, 'rsi_period': 66, 'ema1': 8, 'ema2': 46, 'slip_atr_k': 0.07017863525010196, 'slip_spread_k': 0.14078108216859703, 'spread_hl_frac': 0.027481476762633895, 'bb_std_mult': 2.101710411233756, 'rsi_os': 30, 'rsi_ob': 82, 'vol_spike': 0.283794277723992, 'adx_thresh': 6.975868058649226, 'atr_min_pct': 0.02301441237215291, 'atr_max_pct': 0.04409308613077758, 'tp_mult': 1.9879543704877776, 'tsl_mult': 0.06646163899502892, 'strategy': 'breakout', 'time_stop': 151, 'use_sma': True, 'use_atr': False, 'use_adx': True, 'use_ema': False, 'use_spike': False, 'rsi_required': True, 'edge_k': 0.9722733719643603, 'edge_cap': 0.5584801511329825, 'bull_strategy': 'mean_reversion', 'bull_bb_std_mult': 2.603940166548414, 'bull_rsi_os': 19, 'bull_rsi_ob': 47, 'bull_adx_thresh': 5.523827435187636, 'bull_atr_min_pct': 0.029995738664038776, 'bull_atr_max_pct': 0.09362546166887131, 'bull_tp_mult': 1.8912746671494904, 'bull_tsl_mult': 0.15283176804044418, 'bull_time_stop': 163, 'bull_use_sma': True, 'bull_use_ema': True, 'bull_use_atr': True, 'bull_use_adx': False, 'bull_use_spike': False, 'bull_rsi_required': True, 'bear_strategy': 'mean_reversion', 'bear_bb_std_mult': 3.2593942455080795, 'bear_rsi_os': 46, 'bear_rsi_ob': 61, 'bear_adx_thresh': 12.47234764648622, 'bear_atr_min_pct': 0.016942159993600915, 'bear_atr_max_pct': 0.02815098617416939, 'bear_tp_mult': 2.5949668981617524, 'bear_tsl_mult': 0.4044833298319316, 'bear_time_stop': 149, 'bear_use_sma': True, 'bear_use_ema': False, 'bear_use_atr': True, 'bear_use_adx': True, 'bear_use_spike': False, 'bear_rsi_required': False, 'sideways_strategy': 'breakout', 'sideways_bb_std_mult': 3.329848328168989, 'sideways_rsi_os': 52, 'sideways_rsi_ob': 66, 'sideways_adx_thresh': 28.32246717989311, 'sideways_atr_min_pct': 0.021507601600749, 'sideways_atr_max_pct': 0.11767745236491847, 'sideways_tp_mult': 1.499693324966058, 'sideways_tsl_mult': 0.7907994207690214, 'sideways_time_stop': 32, 'sideways_use_sma': False, 'sideways_use_ema': True, 'sideways_use_atr': True, 'sideways_use_adx': False, 'sideways_use_spike': True, 'sideways_rsi_required': True}.
[I 2025-09-01 10:37:04,642] Trial 598 finished with values: [-1000000000.0, 1000000000.0] and parameters: {'p_sma': 18, 'p_std': 48, 'p_atr': 9, 'p_adx': 21, 'rsi_period': 66, 'ema1': 21, 'ema2': 40, 'slip_atr_k': 0.07033853561483723, 'slip_spread_k': 0.16657717267039587, 'spread_hl_frac': 0.027401771785713493, 'bb_std_mult': 0.9893316540276345, 'rsi_os': 22, 'rsi_ob': 77, 'vol_spike': 0.2766125062305687, 'adx_thresh': 5.614840305722578, 'atr_min_pct': 0.02759427323093014, 'atr_max_pct': 0.08262274530190994, 'tp_mult': 1.420732669693309, 'tsl_mult': 0.3836432581166076, 'strategy': 'breakout', 'time_stop': 145, 'use_sma': True, 'use_atr': False, 'use_adx': True, 'use_ema': False, 'use_spike': False, 'rsi_required': False, 'edge_k': 0.9004347051546697, 'edge_cap': 0.638013259496965, 'bull_strategy': 'mean_reversion', 'bull_bb_std_mult': 0.6668346417852793, 'bull_rsi_os': 46, 'bull_rsi_ob': 77, 'bull_adx_thresh': 17.751692839627378, 'bull_atr_min_pct': 0.012402421090833053, 'bull_atr_max_pct': 0.07620086627487226, 'bull_tp_mult': 1.8895023373129503, 'bull_tsl_mult': 0.053791188433062305, 'bull_time_stop': 133, 'bull_use_sma': True, 'bull_use_ema': False, 'bull_use_atr': True, 'bull_use_adx': False, 'bull_use_spike': False, 'bull_rsi_required': False, 'bear_strategy': 'mean_reversion', 'bear_bb_std_mult': 3.564735843536899, 'bear_rsi_os': 17, 'bear_rsi_ob': 56, 'bear_adx_thresh': 15.71799548501928, 'bear_atr_min_pct': 0.01701521901780434, 'bear_atr_max_pct': 0.043877816323411284, 'bear_tp_mult': 2.593720547439187, 'bear_tsl_mult': 0.7721235271640194, 'bear_time_stop': 58, 'bear_use_sma': False, 'bear_use_ema': True, 'bear_use_atr': True, 'bear_use_adx': False, 'bear_use_spike': True, 'bear_rsi_required': False, 'sideways_strategy': 'breakout', 'sideways_bb_std_mult': 3.3272625772499276, 'sideways_rsi_os': 52, 'sideways_rsi_ob': 47, 'sideways_adx_thresh': 16.547128269558094, 'sideways_atr_min_pct': 0.01313107396302984, 'sideways_atr_max_pct': 0.07407580078395276, 'sideways_tp_mult': 1.3388334759417675, 'sideways_tsl_mult': 0.851634070075627, 'sideways_time_stop': 210, 'sideways_use_sma': True, 'sideways_use_ema': True, 'sideways_use_atr': False, 'sideways_use_adx': False, 'sideways_use_spike': False, 'sideways_rsi_required': False}.
[I 2025-09-01 10:37:05,164] Trial 599 finished with values: [-1000000000.0, 1000000000.0] and parameters: {'p_sma': 23, 'p_std': 48, 'p_atr': 29, 'p_adx': 21, 'rsi_period': 65, 'ema1': 10, 'ema2': 60, 'slip_atr_k': 0.060431214384678134, 'slip_spread_k': 0.16873685731973195, 'spread_hl_frac': 0.003387131070059255, 'bb_std_mult': 1.3647650748422653, 'rsi_os': 22, 'rsi_ob': 77, 'vol_spike': 0.1345068639483104, 'adx_thresh': 8.930814815412091, 'atr_min_pct': 0.006565651465348193, 'atr_max_pct': 0.075283277512173, 'tp_mult': 2.6530832217728353, 'tsl_mult': 0.8139723625961188, 'strategy': 'breakout', 'time_stop': 246, 'use_sma': True, 'use_atr': False, 'use_adx': True, 'use_ema': True, 'use_spike': False, 'rsi_required': True, 'edge_k': 0.9266494446667475, 'edge_cap': 0.6349195135189986, 'bull_strategy': 'mean_reversion', 'bull_bb_std_mult': 2.7812887554433074, 'bull_rsi_os': 28, 'bull_rsi_ob': 69, 'bull_adx_thresh': 9.000882669546613, 'bull_atr_min_pct': 0.012765424870636435, 'bull_atr_max_pct': 0.07617410586940711, 'bull_tp_mult': 2.7847232815852663, 'bull_tsl_mult': 0.04920378465022929, 'bull_time_stop': 132, 'bull_use_sma': True, 'bull_use_ema': False, 'bull_use_atr': True, 'bull_use_adx': True, 'bull_use_spike': False, 'bull_rsi_required': False, 'bear_strategy': 'breakout', 'bear_bb_std_mult': 0.8245349854153798, 'bear_rsi_os': 15, 'bear_rsi_ob': 47, 'bear_adx_thresh': 13.232858170212664, 'bear_atr_min_pct': 0.006361841665231724, 'bear_atr_max_pct': 0.14376968886575253, 'bear_tp_mult': 2.601630883226192, 'bear_tsl_mult': 0.367808291111508, 'bear_time_stop': 133, 'bear_use_sma': True, 'bear_use_ema': True, 'bear_use_atr': True, 'bear_use_adx': False, 'bear_use_spike': True, 'bear_rsi_required': False, 'sideways_strategy': 'breakout', 'sideways_bb_std_mult': 3.419228377805762, 'sideways_rsi_os': 52, 'sideways_rsi_ob': 57, 'sideways_adx_thresh': 27.29334062027953, 'sideways_atr_min_pct': 0.005254840510774378, 'sideways_atr_max_pct': 0.020252625408931114, 'sideways_tp_mult': 1.3224463839923601, 'sideways_tsl_mult': 0.8970722642738311, 'sideways_time_stop': 31, 'sideways_use_sma': True, 'sideways_use_ema': True, 'sideways_use_atr': False, 'sideways_use_adx': False, 'sideways_use_spike': True, 'sideways_rsi_required': True}.
Starting optimization (600 trials, n_jobs=4) | multi-objective=True
Saved trials CSV -> runs/REAL_RECHECK_prev_winner/h_broad_r0.04_s912/trials_metrics.csv
Saved Pareto plot -> runs/REAL_RECHECK_prev_winner/h_broad_r0.04_s912/pareto_return_vs_drawdown.png
Top-K under DD cap: [97] (agg='median')
=== Selected trial(s) ===
top_k=1 selected_trial_numbers=[97] primary=97
ret%_train=0.00% dd%_train=0.00% trades=0
ret%_test=0.00% dd%_test=0.00% pnl_test=0.00 trades_test=0
WFO fold 1: OOS PnL=0.00 trades=0 win_rate=0.00% avg=0.000000 ret%=0.00% maxDD=0.000000 maxDD%=0.00%
WFO fold 2: OOS PnL=0.00 trades=0 win_rate=0.00% avg=0.000000 ret%=0.00% maxDD=0.000000 maxDD%=0.00%
WFO fold 3: OOS PnL=0.00 trades=0 win_rate=0.00% avg=0.000000 ret%=0.00% maxDD=0.000000 maxDD%=0.00%
WFO fold 4: OOS PnL=0.00 trades=0 win_rate=0.00% avg=0.000000 ret%=0.00% maxDD=0.000000 maxDD%=0.00%
WFO fold 5: OOS PnL=0.00 trades=0 win_rate=0.00% avg=0.000000 ret%=0.00% maxDD=0.000000 maxDD%=0.00%
WFO fold 6: OOS PnL=0.00 trades=0 win_rate=0.00% avg=0.000000 ret%=0.00% maxDD=0.000000 maxDD%=0.00%
WFO summary: meanPnL=0.00 stdPnL=0.00 meanWR=0.00% meanAvg=0.000000 meanRet%=0.00% worstDD=0.000000 worstDD%=0.00% folds=6 trades=0
Wrote runs/REAL_RECHECK_prev_winner/h_broad_r0.04_s912/strategy_profile.json
=== ECHO SELECTED PARAMS (JSON) ===
{
  "adx_thresh": 23.400410960702846,
  "aggregate_params": "median",
  "atr_max_pct": 0.04225651667239701,
  "atr_min_pct": 0.017455446139984693,
  "bar_priority": "stop_first",
  "bb_std_mult": 1.1389675341250336,
  "bear_adx_thresh": 7.231881191050189,
  "bear_atr_max_pct": 0.05217481609285648,
  "bear_atr_min_pct": 0.008526235536624075,
  "bear_bb_std_mult": 0.9198537005694825,
  "bear_rsi_ob": 60,
  "bear_rsi_os": 41,
  "bear_rsi_required": false,
  "bear_strategy": "mean_reversion",
  "bear_time_stop": 184,
  "bear_tp_mult": 1.4399855980314076,
  "bear_tsl_mult": 0.9165575230564789,
  "bear_use_adx": false,
  "bear_use_atr": true,
  "bear_use_ema": false,
  "bear_use_sma": false,
  "bear_use_spike": false,
  "bull_adx_thresh": 22.59091710825725,
  "bull_atr_max_pct": 0.07158568280198925,
  "bull_atr_min_pct": 0.018723389860861334,
  "bull_bb_std_mult": 1.7765461603612651,
  "bull_rsi_ob": 45,
  "bull_rsi_os": 44,
  "bull_rsi_required": false,
  "bull_strategy": "breakout",
  "bull_time_stop": 255,
  "bull_tp_mult": 2.999221635500193,
  "bull_tsl_mult": 0.7465723702205617,
  "bull_use_adx": false,
  "bull_use_atr": true,
  "bull_use_ema": true,
  "bull_use_sma": true,
  "bull_use_spike": true,
  "cooldown_bars": 30,
  "daily_loss_limit_pct": 0.12,
  "edge_cap": 0.1504017315348466,
  "edge_k": 1.653603189472172,
  "ema1": 21,
  "ema2": 28,
  "embargo_bars": 150,
  "fee": 0.001,
  "fill_timing": "next_open",
  "include_hours_set": "{0, 1, 2, 3, 14, 15, 16, 17, 18, 19, 20, 22}",
  "lockout_bars": 100,
  "max_consec_losses": 7,
  "max_notional_pct_equity": 1.0,
  "min_notional": 5.0,
  "ml_thresh": 0.0,
  "objective": "multi",
  "p_adx": 26,
  "p_atr": 14,
  "p_sma": 25,
  "p_std": 47,
  "participation_cap": 1.0,
  "price_step": 0.0001,
  "proba_temp": 1.0,
  "qty_step": 0.0001,
  "regime_adapt": true,
  "regime_band": 0.006,
  "regime_fast": 50,
  "regime_overrides": {
    "bear": {
      "adx": 20.0,
      "allowed_sides": [
        "long",
        "short"
      ],
      "atr_range": [
        0.0015,
        0.06
      ],
      "bb_std_mult": 1.2571599337995167,
      "mode": "breakout",
      "rsi_required": true,
      "time_stop_bars": 122,
      "tp_mult": 1.7149673432024581,
      "tsl_mult": 0.25,
      "use_adx": true,
      "use_atr": true
    },
    "bull": {
      "adx": 18.0,
      "allowed_sides": [
        "long",
        "short"
      ],
      "atr_range": [
        0.0008,
        0.06
      ],
      "bb_std_mult": 2.0169431746748376,
      "mode": "mean_reversion",
      "rsi_required": false,
      "time_stop_bars": 214,
      "tp_mult": 1.9194251920826044,
      "tsl_mult": 0.6891458682949287,
      "use_adx": true,
      "use_atr": true
    },
    "sideways": {
      "adx": 15.0,
      "allowed_sides": [
        "long",
        "short"
      ],
      "atr_range": [
        0.001,
        0.14
      ],
      "bb_std_mult": 1.5828092896467827,
      "mode": "breakout",
      "rsi_required": true,
      "time_stop_bars": 235,
      "tp_mult": 2.341879695778944,
      "tsl_mult": 0.651967765830165,
      "use_adx": true,
      "use_atr": true
    }
  },
  "regime_slow": 200,
  "risk_min_stop_frac": 0.001,
  "risk_per_trade": 0.04,
  "risk_stop_atr_mult": 1.0,
  "round_exits": true,
  "rsi_key": "rsi73",
  "rsi_ob": 63,
  "rsi_os": 30,
  "rsi_period": 73,
  "rsi_required": false,
  "select_top_k": 1,
  "session_end": 24,
  "session_start": 0,
  "sides": "short",
  "sideways_adx_thresh": 28.581762536902367,
  "sideways_atr_max_pct": 0.0794640537854306,
  "sideways_atr_min_pct": 0.008245108855055404,
  "sideways_bb_std_mult": 2.7012650400201452,
  "sideways_rsi_ob": 75,
  "sideways_rsi_os": 45,
  "sideways_rsi_required": false,
  "sideways_strategy": "breakout",
  "sideways_time_stop": 18,
  "sideways_tp_mult": 1.1508689013779776,
  "sideways_tsl_mult": 0.39747604759363575,
  "sideways_use_adx": false,
  "sideways_use_atr": false,
  "sideways_use_ema": true,
  "sideways_use_sma": false,
  "sideways_use_spike": false,
  "slip_atr_k": 0.027014892959383613,
  "slip_spread_k": 0.8153032063897889,
  "slippage": 0.0006,
  "spread_hl_frac": 0.01405255505872842,
  "start_equity": 20000.0,
  "stop_extra_slip": 0.0,
  "strategy": "mean_reversion",
  "time_stop": 115,
  "tp_mult": 2.320576508124498,
  "tsl_mult": 0.3810939998983063,
  "use_adx": true,
  "use_atr": false,
  "use_ema": false,
  "use_ml": false,
  "use_sma": false,
  "use_spike": true,
  "vol_spike": 0.22612085701977805,
  "wfo_folds": 6
}
Wrote runs/REAL_RECHECK_prev_winner/h_broad_r0.04_s912/best_params.pkl
