[I 2025-09-01 09:40:09,937] Trial 258 finished with values: [-1000000000.0, 1000000000.0] and parameters: {'p_sma': 26, 'p_std': 29, 'p_atr': 29, 'p_adx': 14, 'rsi_period': 61, 'ema1': 21, 'ema2': 23, 'slip_atr_k': 0.13221799088227426, 'slip_spread_k': 0.2903868896343773, 'spread_hl_frac': 0.012232628515929735, 'bb_std_mult': 1.8240118955014097, 'rsi_os': 12, 'rsi_ob': 89, 'vol_spike': 0.22768342542870554, 'adx_thresh': 5.591214509274208, 'atr_min_pct': 0.0037933630361868774, 'atr_max_pct': 0.0450194331561249, 'tp_mult': 2.1895581614789705, 'tsl_mult': 0.28135523898617687, 'strategy': 'breakout', 'time_stop': 280, 'use_sma': True, 'use_atr': False, 'use_adx': False, 'use_ema': False, 'use_spike': True, 'rsi_required': False, 'edge_k': 1.4133399308170675, 'edge_cap': 0.09049353866218665, 'bull_strategy': 'breakout', 'bull_bb_std_mult': 0.7784766951717476, 'bull_rsi_os': 54, 'bull_rsi_ob': 57, 'bull_adx_thresh': 25.34233778150383, 'bull_atr_min_pct': 0.023065029554594316, 'bull_atr_max_pct': 0.06639892867166204, 'bull_tp_mult': 2.635034509592939, 'bull_tsl_mult': 0.4499672673661862, 'bull_time_stop': 129, 'bull_use_sma': True, 'bull_use_ema': True, 'bull_use_atr': True, 'bull_use_adx': True, 'bull_use_spike': True, 'bull_rsi_required': False, 'bear_strategy': 'breakout', 'bear_bb_std_mult': 3.54916310509702, 'bear_rsi_os': 18, 'bear_rsi_ob': 56, 'bear_adx_thresh': 14.927600591192402, 'bear_atr_min_pct': 0.0008388859483462203, 'bear_atr_max_pct': 0.1499077622756037, 'bear_tp_mult': 1.9449974856309196, 'bear_tsl_mult': 0.901118480273551, 'bear_time_stop': 220, 'bear_use_sma': False, 'bear_use_ema': False, 'bear_use_atr': False, 'bear_use_adx': True, 'bear_use_spike': True, 'bear_rsi_required': False, 'sideways_strategy': 'breakout', 'sideways_bb_std_mult': 1.0604901513339338, 'sideways_rsi_os': 11, 'sideways_rsi_ob': 46, 'sideways_adx_thresh': 30.656897613273266, 'sideways_atr_min_pct': 0.006000636951657664, 'sideways_atr_max_pct': 0.07581878528386192, 'sideways_tp_mult': 1.8541827063322776, 'sideways_tsl_mult': 0.9793161526959587, 'sideways_time_stop': 81, 'sideways_use_sma': True, 'sideways_use_ema': True, 'sideways_use_atr': True, 'sideways_use_adx': False, 'sideways_use_spike': False, 'sideways_rsi_required': False}.
[I 2025-09-01 09:40:47,704] Trial 262 finished with values: [-1000000000.0, 1000000000.0] and parameters: {'p_sma': 39, 'p_std': 39, 'p_atr': 9, 'p_adx': 30, 'rsi_period': 63, 'ema1': 17, 'ema2': 17, 'slip_atr_k': 0.24234248749659465, 'slip_spread_k': 0.29408051867683327, 'spread_hl_frac': 0.012140807267982346, 'bb_std_mult': 1.8676864093680599, 'rsi_os': 10, 'rsi_ob': 69, 'vol_spike': 0.11227280188555475, 'adx_thresh': 22.20315405180827, 'atr_min_pct': 0.02725417881835812, 'atr_max_pct': 0.13040233079792699, 'tp_mult': 1.91984352576283, 'tsl_mult': 0.03978755815980653, 'strategy': 'breakout', 'time_stop': 200, 'use_sma': False, 'use_atr': False, 'use_adx': False, 'use_ema': True, 'use_spike': False, 'rsi_required': True, 'edge_k': 1.480240786811227, 'edge_cap': 0.08691465263200428, 'bull_strategy': 'mean_reversion', 'bull_bb_std_mult': 2.0548845477252806, 'bull_rsi_os': 55, 'bull_rsi_ob': 90, 'bull_adx_thresh': 7.6400293909309225, 'bull_atr_min_pct': 0.015317867375012999, 'bull_atr_max_pct': 0.07086836666251674, 'bull_tp_mult': 2.1258136677282775, 'bull_tsl_mult': 0.3054165682402572, 'bull_time_stop': 131, 'bull_use_sma': True, 'bull_use_ema': False, 'bull_use_atr': False, 'bull_use_adx': False, 'bull_use_spike': False, 'bull_rsi_required': True, 'bear_strategy': 'breakout', 'bear_bb_std_mult': 2.595112707295759, 'bear_rsi_os': 47, 'bear_rsi_ob': 56, 'bear_adx_thresh': 11.824058433402891, 'bear_atr_min_pct': 0.0162437214304758, 'bear_atr_max_pct': 0.11563044714426371, 'bear_tp_mult': 2.630653215895086, 'bear_tsl_mult': 0.9788444370442304, 'bear_time_stop': 251, 'bear_use_sma': False, 'bear_use_ema': False, 'bear_use_atr': False, 'bear_use_adx': False, 'bear_use_spike': False, 'bear_rsi_required': True, 'sideways_strategy': 'breakout', 'sideways_bb_std_mult': 1.03271416262485, 'sideways_rsi_os': 46, 'sideways_rsi_ob': 92, 'sideways_adx_thresh': 22.20373577471938, 'sideways_atr_min_pct': 0.006716464556654119, 'sideways_atr_max_pct': 0.07558996013617708, 'sideways_tp_mult': 2.0076377893114885, 'sideways_tsl_mult': 0.9129412372919508, 'sideways_time_stop': 207, 'sideways_use_sma': False, 'sideways_use_ema': False, 'sideways_use_atr': False, 'sideways_use_adx': False, 'sideways_use_spike': False, 'sideways_rsi_required': False}.
[I 2025-09-01 09:40:48,634] Trial 263 finished with values: [-1000000000.0, 1000000000.0] and parameters: {'p_sma': 29, 'p_std': 20, 'p_atr': 16, 'p_adx': 28, 'rsi_period': 63, 'ema1': 16, 'ema2': 17, 'slip_atr_k': 0.024049285548580872, 'slip_spread_k': 0.28428094996434017, 'spread_hl_frac': 0.012356754494808535, 'bb_std_mult': 1.6377417063632485, 'rsi_os': 33, 'rsi_ob': 88, 'vol_spike': 0.23962364093260805, 'adx_thresh': 22.171342833227722, 'atr_min_pct': 0.011740948899342175, 'atr_max_pct': 0.13846245439812932, 'tp_mult': 2.5328743137662397, 'tsl_mult': 0.27474384628919357, 'strategy': 'breakout', 'time_stop': 198, 'use_sma': False, 'use_atr': True, 'use_adx': False, 'use_ema': True, 'use_spike': False, 'rsi_required': True, 'edge_k': 1.6669996772257043, 'edge_cap': 0.6450956007348907, 'bull_strategy': 'mean_reversion', 'bull_bb_std_mult': 0.7796068503064675, 'bull_rsi_os': 40, 'bull_rsi_ob': 56, 'bull_adx_thresh': 7.574544633363017, 'bull_atr_min_pct': 0.026986016707203936, 'bull_atr_max_pct': 0.12102956022103006, 'bull_tp_mult': 2.1211870601477445, 'bull_tsl_mult': 0.09638810616787882, 'bull_time_stop': 271, 'bull_use_sma': False, 'bull_use_ema': False, 'bull_use_atr': False, 'bull_use_adx': True, 'bull_use_spike': False, 'bull_rsi_required': True, 'bear_strategy': 'breakout', 'bear_bb_std_mult': 3.5119944507708594, 'bear_rsi_os': 20, 'bear_rsi_ob': 56, 'bear_adx_thresh': 34.52691349206731, 'bear_atr_min_pct': 0.014075107196285092, 'bear_atr_max_pct': 0.09439958397938412, 'bear_tp_mult': 2.635793470707216, 'bear_tsl_mult': 0.4940322518702889, 'bear_time_stop': 207, 'bear_use_sma': True, 'bear_use_ema': False, 'bear_use_atr': False, 'bear_use_adx': False, 'bear_use_spike': False, 'bear_rsi_required': True, 'sideways_strategy': 'breakout', 'sideways_bb_std_mult': 1.0325097491864423, 'sideways_rsi_os': 46, 'sideways_rsi_ob': 66, 'sideways_adx_thresh': 30.597314599273417, 'sideways_atr_min_pct': 0.016351237431314457, 'sideways_atr_max_pct': 0.01659684532461951, 'sideways_tp_mult': 1.8150316620668092, 'sideways_tsl_mult': 0.0689240804960195, 'sideways_time_stop': 46, 'sideways_use_sma': False, 'sideways_use_ema': False, 'sideways_use_atr': False, 'sideways_use_adx': True, 'sideways_use_spike': True, 'sideways_rsi_required': True}.
[I 2025-09-01 09:40:49,987] Trial 265 finished with values: [-0.06518749812619995, 0.06499807008006528] and parameters: {'p_sma': 48, 'p_std': 21, 'p_atr': 18, 'p_adx': 22, 'rsi_period': 67, 'ema1': 10, 'ema2': 16, 'slip_atr_k': 0.24342081512121705, 'slip_spread_k': 0.7614398528241072, 'spread_hl_frac': 0.010923256950328895, 'bb_std_mult': 1.0557664051387812, 'rsi_os': 10, 'rsi_ob': 91, 'vol_spike': 0.15470227645939866, 'adx_thresh': 6.158265776666417, 'atr_min_pct': 0.0007187535728287731, 'atr_max_pct': 0.13192978079859363, 'tp_mult': 1.0889831402167731, 'tsl_mult': 0.47741913840433464, 'strategy': 'breakout', 'time_stop': 200, 'use_sma': True, 'use_atr': True, 'use_adx': True, 'use_ema': True, 'use_spike': False, 'rsi_required': True, 'edge_k': 1.0403154535531791, 'edge_cap': 0.635325100480092, 'bull_strategy': 'mean_reversion', 'bull_bb_std_mult': 0.6152006824678169, 'bull_rsi_os': 22, 'bull_rsi_ob': 55, 'bull_adx_thresh': 6.594088947708598, 'bull_atr_min_pct': 0.00392408424085997, 'bull_atr_max_pct': 0.07362622378356255, 'bull_tp_mult': 2.1230901645177425, 'bull_tsl_mult': 0.1946878541629815, 'bull_time_stop': 159, 'bull_use_sma': False, 'bull_use_ema': False, 'bull_use_atr': False, 'bull_use_adx': False, 'bull_use_spike': False, 'bull_rsi_required': True, 'bear_strategy': 'mean_reversion', 'bear_bb_std_mult': 3.0483058179898985, 'bear_rsi_os': 44, 'bear_rsi_ob': 66, 'bear_adx_thresh': 28.202022012798302, 'bear_atr_min_pct': 0.014274327796042338, 'bear_atr_max_pct': 0.1143914744315895, 'bear_tp_mult': 2.258695743098805, 'bear_tsl_mult': 0.3615829471901746, 'bear_time_stop': 247, 'bear_use_sma': True, 'bear_use_ema': True, 'bear_use_atr': True, 'bear_use_adx': False, 'bear_use_spike': False, 'bear_rsi_required': True, 'sideways_strategy': 'breakout', 'sideways_bb_std_mult': 3.4597348251738294, 'sideways_rsi_os': 14, 'sideways_rsi_ob': 78, 'sideways_adx_thresh': 26.218485345976177, 'sideways_atr_min_pct': 0.003547784412169844, 'sideways_atr_max_pct': 0.06097731780081924, 'sideways_tp_mult': 2.145794212144134, 'sideways_tsl_mult': 0.8921390136113707, 'sideways_time_stop': 46, 'sideways_use_sma': False, 'sideways_use_ema': True, 'sideways_use_atr': False, 'sideways_use_adx': True, 'sideways_use_spike': True, 'sideways_rsi_required': True}.
[I 2025-09-01 09:40:50,588] Trial 264 finished with values: [-1000000000.0, 1000000000.0] and parameters: {'p_sma': 28, 'p_std': 22, 'p_atr': 17, 'p_adx': 29, 'rsi_period': 71, 'ema1': 18, 'ema2': 23, 'slip_atr_k': 0.19763177663443204, 'slip_spread_k': 0.2864749130669246, 'spread_hl_frac': 0.012384325058983011, 'bb_std_mult': 1.8856914183551554, 'rsi_os': 10, 'rsi_ob': 69, 'vol_spike': 0.23835715084575285, 'adx_thresh': 6.203637759603283, 'atr_min_pct': 0.02702877919715723, 'atr_max_pct': 0.12678190130839556, 'tp_mult': 1.9104870015788735, 'tsl_mult': 0.03631433680995545, 'strategy': 'breakout', 'time_stop': 178, 'use_sma': True, 'use_atr': True, 'use_adx': True, 'use_ema': True, 'use_spike': False, 'rsi_required': False, 'edge_k': 1.4801812082867492, 'edge_cap': 0.6093801248210214, 'bull_strategy': 'mean_reversion', 'bull_bb_std_mult': 0.6004717809208726, 'bull_rsi_os': 15, 'bull_rsi_ob': 90, 'bull_adx_thresh': 17.06254800326675, 'bull_atr_min_pct': 0.021499724698593587, 'bull_atr_max_pct': 0.07225450418791655, 'bull_tp_mult': 2.1256091455238053, 'bull_tsl_mult': 0.0930573342163722, 'bull_time_stop': 272, 'bull_use_sma': False, 'bull_use_ema': False, 'bull_use_atr': False, 'bull_use_adx': True, 'bull_use_spike': False, 'bull_rsi_required': True, 'bear_strategy': 'mean_reversion', 'bear_bb_std_mult': 2.594787736231075, 'bear_rsi_os': 44, 'bear_rsi_ob': 56, 'bear_adx_thresh': 15.063168534821642, 'bear_atr_min_pct': 0.01408726068359, 'bear_atr_max_pct': 0.1137468649710893, 'bear_tp_mult': 1.3463263894482753, 'bear_tsl_mult': 0.9838871823923078, 'bear_time_stop': 246, 'bear_use_sma': True, 'bear_use_ema': True, 'bear_use_atr': True, 'bear_use_adx': False, 'bear_use_spike': False, 'bear_rsi_required': False, 'sideways_strategy': 'breakout', 'sideways_bb_std_mult': 1.2609684578919742, 'sideways_rsi_os': 13, 'sideways_rsi_ob': 92, 'sideways_adx_thresh': 12.639542382897853, 'sideways_atr_min_pct': 0.026573347155300964, 'sideways_atr_max_pct': 0.12713731832646408, 'sideways_tp_mult': 1.3945202693556573, 'sideways_tsl_mult': 0.4462094472548768, 'sideways_time_stop': 261, 'sideways_use_sma': False, 'sideways_use_ema': True, 'sideways_use_atr': False, 'sideways_use_adx': True, 'sideways_use_spike': True, 'sideways_rsi_required': True}.
[I 2025-09-01 09:41:31,317] Trial 268 finished with values: [-1000000000.0, 1000000000.0] and parameters: {'p_sma': 59, 'p_std': 34, 'p_atr': 14, 'p_adx': 15, 'rsi_period': 69, 'ema1': 14, 'ema2': 19, 'slip_atr_k': 0.035590538421341036, 'slip_spread_k': 0.33298053126337984, 'spread_hl_frac': 0.013532415447879096, 'bb_std_mult': 1.7621196310516847, 'rsi_os': 20, 'rsi_ob': 90, 'vol_spike': 0.1639118703262667, 'adx_thresh': 6.282642267216632, 'atr_min_pct': 0.01934831218634034, 'atr_max_pct': 0.1291155196631875, 'tp_mult': 2.1283517764871496, 'tsl_mult': 0.033507818990640925, 'strategy': 'mean_reversion', 'time_stop': 212, 'use_sma': True, 'use_atr': False, 'use_adx': True, 'use_ema': False, 'use_spike': False, 'rsi_required': False, 'edge_k': 1.527623407217635, 'edge_cap': 0.06849759956029007, 'bull_strategy': 'mean_reversion', 'bull_bb_std_mult': 1.0085408915694722, 'bull_rsi_os': 15, 'bull_rsi_ob': 54, 'bull_adx_thresh': 30.24220698223954, 'bull_atr_min_pct': 0.009564729049561255, 'bull_atr_max_pct': 0.061924715653781756, 'bull_tp_mult': 1.53698557982055, 'bull_tsl_mult': 0.5768009756493302, 'bull_time_stop': 70, 'bull_use_sma': True, 'bull_use_ema': False, 'bull_use_atr': False, 'bull_use_adx': False, 'bull_use_spike': False, 'bull_rsi_required': True, 'bear_strategy': 'mean_reversion', 'bear_bb_std_mult': 0.5670339209721633, 'bear_rsi_os': 45, 'bear_rsi_ob': 70, 'bear_adx_thresh': 18.219812857339992, 'bear_atr_min_pct': 0.015578468059038585, 'bear_atr_max_pct': 0.10652605776288078, 'bear_tp_mult': 2.2804330732881075, 'bear_tsl_mult': 0.4536001372661983, 'bear_time_stop': 282, 'bear_use_sma': False, 'bear_use_ema': True, 'bear_use_atr': True, 'bear_use_adx': False, 'bear_use_spike': False, 'bear_rsi_required': False, 'sideways_strategy': 'mean_reversion', 'sideways_bb_std_mult': 1.2882434614488139, 'sideways_rsi_os': 40, 'sideways_rsi_ob': 48, 'sideways_adx_thresh': 27.580113803593225, 'sideways_atr_min_pct': 0.02027466675854563, 'sideways_atr_max_pct': 0.09597668963510292, 'sideways_tp_mult': 2.9961567525370203, 'sideways_tsl_mult': 0.4470534049833186, 'sideways_time_stop': 231, 'sideways_use_sma': False, 'sideways_use_ema': True, 'sideways_use_atr': False, 'sideways_use_adx': False, 'sideways_use_spike': False, 'sideways_rsi_required': False}.
[I 2025-09-01 09:41:32,798] Trial 269 finished with values: [-1000000000.0, 1000000000.0] and parameters: {'p_sma': 54, 'p_std': 26, 'p_atr': 21, 'p_adx': 15, 'rsi_period': 12, 'ema1': 14, 'ema2': 31, 'slip_atr_k': 0.03551607820031713, 'slip_spread_k': 0.32743282831051923, 'spread_hl_frac': 0.013535547275816812, 'bb_std_mult': 1.7547286389642267, 'rsi_os': 8, 'rsi_ob': 73, 'vol_spike': 0.22088134193247175, 'adx_thresh': 5.6184162911221245, 'atr_min_pct': 0.021257878196023695, 'atr_max_pct': 0.13234781209739666, 'tp_mult': 2.122285572676963, 'tsl_mult': 0.43610348424401135, 'strategy': 'mean_reversion', 'time_stop': 5, 'use_sma': True, 'use_atr': False, 'use_adx': True, 'use_ema': False, 'use_spike': False, 'rsi_required': False, 'edge_k': 1.8268911498512685, 'edge_cap': 0.16431118470971223, 'bull_strategy': 'mean_reversion', 'bull_bb_std_mult': 0.6834014579811806, 'bull_rsi_os': 25, 'bull_rsi_ob': 66, 'bull_adx_thresh': 29.2392696746274, 'bull_atr_min_pct': 0.009794234793210574, 'bull_atr_max_pct': 0.06333498268575077, 'bull_tp_mult': 1.725984932889474, 'bull_tsl_mult': 0.8153108818728896, 'bull_time_stop': 110, 'bull_use_sma': True, 'bull_use_ema': False, 'bull_use_atr': False, 'bull_use_adx': False, 'bull_use_spike': False, 'bull_rsi_required': True, 'bear_strategy': 'mean_reversion', 'bear_bb_std_mult': 0.5514026193776227, 'bear_rsi_os': 40, 'bear_rsi_ob': 51, 'bear_adx_thresh': 12.67392916147034, 'bear_atr_min_pct': 0.015755281624799562, 'bear_atr_max_pct': 0.12723794762729235, 'bear_tp_mult': 2.9973035232050877, 'bear_tsl_mult': 0.41195727679985394, 'bear_time_stop': 229, 'bear_use_sma': False, 'bear_use_ema': True, 'bear_use_atr': True, 'bear_use_adx': False, 'bear_use_spike': False, 'bear_rsi_required': False, 'sideways_strategy': 'mean_reversion', 'sideways_bb_std_mult': 0.9141245479381239, 'sideways_rsi_os': 41, 'sideways_rsi_ob': 48, 'sideways_adx_thresh': 27.494020734085016, 'sideways_atr_min_pct': 0.0048426526165883, 'sideways_atr_max_pct': 0.09683819684933799, 'sideways_tp_mult': 1.6454853157135767, 'sideways_tsl_mult': 0.9647560450390753, 'sideways_time_stop': 222, 'sideways_use_sma': True, 'sideways_use_ema': True, 'sideways_use_atr': True, 'sideways_use_adx': False, 'sideways_use_spike': False, 'sideways_rsi_required': False}.
[I 2025-09-01 09:41:33,661] Trial 267 finished with values: [-0.293721094122972, 0.29361113670206773] and parameters: {'p_sma': 59, 'p_std': 21, 'p_atr': 27, 'p_adx': 15, 'rsi_period': 69, 'ema1': 11, 'ema2': 29, 'slip_atr_k': 0.0352305848932702, 'slip_spread_k': 0.2624953577052971, 'spread_hl_frac': 0.04689263067285618, 'bb_std_mult': 3.5950347898411286, 'rsi_os': 11, 'rsi_ob': 91, 'vol_spike': 0.08832228354231082, 'adx_thresh': 6.312260471035025, 'atr_min_pct': 0.02141144148135105, 'atr_max_pct': 0.12796472980447587, 'tp_mult': 1.7139073113298493, 'tsl_mult': 0.5855289020665762, 'strategy': 'breakout', 'time_stop': 245, 'use_sma': True, 'use_atr': True, 'use_adx': True, 'use_ema': False, 'use_spike': False, 'rsi_required': False, 'edge_k': 1.5060201848257193, 'edge_cap': 0.061536421861450766, 'bull_strategy': 'mean_reversion', 'bull_bb_std_mult': 0.5847235672431357, 'bull_rsi_os': 17, 'bull_rsi_ob': 54, 'bull_adx_thresh': 6.786167982627251, 'bull_atr_min_pct': 0.027561485069227912, 'bull_atr_max_pct': 0.052892845634116184, 'bull_tp_mult': 2.237846019240381, 'bull_tsl_mult': 0.8314750656637515, 'bull_time_stop': 111, 'bull_use_sma': False, 'bull_use_ema': False, 'bull_use_atr': False, 'bull_use_adx': False, 'bull_use_spike': False, 'bull_rsi_required': True, 'bear_strategy': 'mean_reversion', 'bear_bb_std_mult': 2.0623048441688754, 'bear_rsi_os': 44, 'bear_rsi_ob': 67, 'bear_adx_thresh': 12.63176960211221, 'bear_atr_min_pct': 0.019943990060007015, 'bear_atr_max_pct': 0.10453750382036786, 'bear_tp_mult': 1.348469951374823, 'bear_tsl_mult': 0.35804624245713096, 'bear_time_stop': 229, 'bear_use_sma': True, 'bear_use_ema': True, 'bear_use_atr': True, 'bear_use_adx': False, 'bear_use_spike': False, 'bear_rsi_required': False, 'sideways_strategy': 'breakout', 'sideways_bb_std_mult': 1.272551028372562, 'sideways_rsi_os': 41, 'sideways_rsi_ob': 68, 'sideways_adx_thresh': 12.774451763904903, 'sideways_atr_min_pct': 1.1213726342825664e-06, 'sideways_atr_max_pct': 0.06066181466255591, 'sideways_tp_mult': 2.5672466259375675, 'sideways_tsl_mult': 0.8890480036146955, 'sideways_time_stop': 221, 'sideways_use_sma': False, 'sideways_use_ema': True, 'sideways_use_atr': False, 'sideways_use_adx': True, 'sideways_use_spike': True, 'sideways_rsi_required': True}.
[I 2025-09-01 09:41:34,197] Trial 266 finished with values: [-0.11429259126643387, 0.11408501496802646] and parameters: {'p_sma': 47, 'p_std': 20, 'p_atr': 18, 'p_adx': 15, 'rsi_period': 69, 'ema1': 20, 'ema2': 29, 'slip_atr_k': 0.03357143649487972, 'slip_spread_k': 0.2675015700946616, 'spread_hl_frac': 0.010818162409177733, 'bb_std_mult': 3.2219065415851276, 'rsi_os': 51, 'rsi_ob': 91, 'vol_spike': 0.24018125271424667, 'adx_thresh': 6.267436268445036, 'atr_min_pct': 0.0010210243006614703, 'atr_max_pct': 0.1327010112324223, 'tp_mult': 2.1092394979200337, 'tsl_mult': 0.5828763810725006, 'strategy': 'breakout', 'time_stop': 185, 'use_sma': True, 'use_atr': True, 'use_adx': True, 'use_ema': False, 'use_spike': False, 'rsi_required': False, 'edge_k': 1.6693821817126313, 'edge_cap': 0.9469744653912846, 'bull_strategy': 'mean_reversion', 'bull_bb_std_mult': 0.5844436073064996, 'bull_rsi_os': 40, 'bull_rsi_ob': 54, 'bull_adx_thresh': 20.923259777912023, 'bull_atr_min_pct': 0.0024627480714322844, 'bull_atr_max_pct': 0.06205954707630826, 'bull_tp_mult': 2.1400325070252504, 'bull_tsl_mult': 0.09714008669293452, 'bull_time_stop': 111, 'bull_use_sma': False, 'bull_use_ema': False, 'bull_use_atr': False, 'bull_use_adx': False, 'bull_use_spike': False, 'bull_rsi_required': True, 'bear_strategy': 'mean_reversion', 'bear_bb_std_mult': 3.010423383311631, 'bear_rsi_os': 40, 'bear_rsi_ob': 52, 'bear_adx_thresh': 34.888917322547215, 'bear_atr_min_pct': 0.014452748227368438, 'bear_atr_max_pct': 0.1278121996171262, 'bear_tp_mult': 2.259272675866602, 'bear_tsl_mult': 0.4555551905256964, 'bear_time_stop': 231, 'bear_use_sma': True, 'bear_use_ema': True, 'bear_use_atr': True, 'bear_use_adx': False, 'bear_use_spike': False, 'bear_rsi_required': False, 'sideways_strategy': 'breakout', 'sideways_bb_std_mult': 1.2748250465228164, 'sideways_rsi_os': 41, 'sideways_rsi_ob': 66, 'sideways_adx_thresh': 28.898709486688887, 'sideways_atr_min_pct': 0.00478827365036512, 'sideways_atr_max_pct': 0.060660410349654414, 'sideways_tp_mult': 2.1545418400219267, 'sideways_tsl_mult': 0.8818555962301002, 'sideways_time_stop': 231, 'sideways_use_sma': False, 'sideways_use_ema': True, 'sideways_use_atr': False, 'sideways_use_adx': True, 'sideways_use_spike': True, 'sideways_rsi_required': True}.
