[I 2025-09-01 09:19:40,764] Trial 134 finished with values: [-0.0548127392093114, 0.05450306683650075] and parameters: {'p_sma': 40, 'p_std': 27, 'p_atr': 17, 'p_adx': 29, 'rsi_period': 66, 'ema1': 22, 'ema2': 19, 'slip_atr_k': 0.03845979588124113, 'slip_spread_k': 0.13702509311817956, 'spread_hl_frac': 0.003306835985478627, 'bb_std_mult': 3.148827576619687, 'rsi_os': 18, 'rsi_ob': 94, 'vol_spike': 0.2384098318134269, 'adx_thresh': 16.46343398554474, 'atr_min_pct': 0.018660222742100725, 'atr_max_pct': 0.14311592560500513, 'tp_mult': 1.808447292972181, 'tsl_mult': 0.027372768515793185, 'strategy': 'breakout', 'time_stop': 194, 'use_sma': True, 'use_atr': False, 'use_adx': True, 'use_ema': False, 'use_spike': False, 'rsi_required': False, 'edge_k': 1.5764930348810426, 'edge_cap': 0.6689262516815871, 'bull_strategy': 'mean_reversion', 'bull_bb_std_mult': 1.3141144219196468, 'bull_rsi_os': 16, 'bull_rsi_ob': 69, 'bull_adx_thresh': 9.471267756018833, 'bull_atr_min_pct': 0.028764996664577047, 'bull_atr_max_pct': 0.017684597775706107, 'bull_tp_mult': 2.0613467261194933, 'bull_tsl_mult': 0.09221510521202199, 'bull_time_stop': 119, 'bull_use_sma': True, 'bull_use_ema': False, 'bull_use_atr': False, 'bull_use_adx': False, 'bull_use_spike': False, 'bull_rsi_required': True, 'bear_strategy': 'mean_reversion', 'bear_bb_std_mult': 3.5946346091720867, 'bear_rsi_os': 55, 'bear_rsi_ob': 72, 'bear_adx_thresh': 20.501316120377098, 'bear_atr_min_pct': 0.024545571538212272, 'bear_atr_max_pct': 0.12275227068834946, 'bear_tp_mult': 2.151028009545328, 'bear_tsl_mult': 0.585098032480015, 'bear_time_stop': 219, 'bear_use_sma': False, 'bear_use_ema': True, 'bear_use_atr': True, 'bear_use_adx': False, 'bear_use_spike': False, 'bear_rsi_required': False, 'sideways_strategy': 'breakout', 'sideways_bb_std_mult': 1.9532637672636137, 'sideways_rsi_os': 44, 'sideways_rsi_ob': 56, 'sideways_adx_thresh': 31.420937544136216, 'sideways_atr_min_pct': 0.002718440209913798, 'sideways_atr_max_pct': 0.08607935564763897, 'sideways_tp_mult': 2.68878032883113, 'sideways_tsl_mult': 0.7784070899105602, 'sideways_time_stop': 211, 'sideways_use_sma': False, 'sideways_use_ema': True, 'sideways_use_atr': False, 'sideways_use_adx': False, 'sideways_use_spike': False, 'sideways_rsi_required': False}.
[I 2025-09-01 09:20:20,371] Trial 137 finished with values: [-1000000000.0, 1000000000.0] and parameters: {'p_sma': 26, 'p_std': 25, 'p_atr': 29, 'p_adx': 30, 'rsi_period': 66, 'ema1': 20, 'ema2': 19, 'slip_atr_k': 0.03992114872493062, 'slip_spread_k': 0.2510596156122029, 'spread_hl_frac': 0.011342064030667863, 'bb_std_mult': 0.6983846260253104, 'rsi_os': 12, 'rsi_ob': 88, 'vol_spike': 0.06080888816645949, 'adx_thresh': 8.350051845692912, 'atr_min_pct': 0.019889504832210705, 'atr_max_pct': 0.03493108624241613, 'tp_mult': 1.8097955947540871, 'tsl_mult': 0.03748428190772236, 'strategy': 'breakout', 'time_stop': 260, 'use_sma': True, 'use_atr': False, 'use_adx': True, 'use_ema': False, 'use_spike': False, 'rsi_required': False, 'edge_k': 1.559053681847681, 'edge_cap': 0.12210552717276638, 'bull_strategy': 'mean_reversion', 'bull_bb_std_mult': 1.2608292042110318, 'bull_rsi_os': 21, 'bull_rsi_ob': 59, 'bull_adx_thresh': 30.891372879949657, 'bull_atr_min_pct': 0.028678734638620307, 'bull_atr_max_pct': 0.051354373681373994, 'bull_tp_mult': 2.2537869543829485, 'bull_tsl_mult': 0.11595375159238036, 'bull_time_stop': 126, 'bull_use_sma': True, 'bull_use_ema': False, 'bull_use_atr': False, 'bull_use_adx': False, 'bull_use_spike': False, 'bull_rsi_required': True, 'bear_strategy': 'breakout', 'bear_bb_std_mult': 3.4642636889654037, 'bear_rsi_os': 47, 'bear_rsi_ob': 67, 'bear_adx_thresh': 33.99143362355352, 'bear_atr_min_pct': 0.023548820988503496, 'bear_atr_max_pct': 0.05581027018033357, 'bear_tp_mult': 2.14821911411259, 'bear_tsl_mult': 0.06576153538328972, 'bear_time_stop': 194, 'bear_use_sma': True, 'bear_use_ema': True, 'bear_use_atr': True, 'bear_use_adx': False, 'bear_use_spike': True, 'bear_rsi_required': False, 'sideways_strategy': 'breakout', 'sideways_bb_std_mult': 1.9378419296637164, 'sideways_rsi_os': 37, 'sideways_rsi_ob': 45, 'sideways_adx_thresh': 31.52835519252961, 'sideways_atr_min_pct': 0.023655148382475025, 'sideways_atr_max_pct': 0.08180563262122356, 'sideways_tp_mult': 1.7917414352780003, 'sideways_tsl_mult': 0.9298756282408436, 'sideways_time_stop': 209, 'sideways_use_sma': False, 'sideways_use_ema': True, 'sideways_use_atr': False, 'sideways_use_adx': True, 'sideways_use_spike': False, 'sideways_rsi_required': False}.
[I 2025-09-01 09:20:21,605] Trial 139 finished with values: [-1000000000.0, 1000000000.0] and parameters: {'p_sma': 48, 'p_std': 40, 'p_atr': 29, 'p_adx': 13, 'rsi_period': 64, 'ema1': 17, 'ema2': 27, 'slip_atr_k': 0.16711037173529975, 'slip_spread_k': 0.2996824929455128, 'spread_hl_frac': 0.011496810450566379, 'bb_std_mult': 2.0461441725472818, 'rsi_os': 53, 'rsi_ob': 88, 'vol_spike': 0.13317995283586453, 'adx_thresh': 8.286733502667417, 'atr_min_pct': 0.01762367910691624, 'atr_max_pct': 0.06373922623407886, 'tp_mult': 1.7937748084693919, 'tsl_mult': 0.9980600972020209, 'strategy': 'breakout', 'time_stop': 219, 'use_sma': True, 'use_atr': False, 'use_adx': True, 'use_ema': False, 'use_spike': False, 'rsi_required': False, 'edge_k': 0.6237508408591199, 'edge_cap': 0.1143749219698692, 'bull_strategy': 'mean_reversion', 'bull_bb_std_mult': 0.6112665319914593, 'bull_rsi_os': 21, 'bull_rsi_ob': 82, 'bull_adx_thresh': 5.712164322166266, 'bull_atr_min_pct': 0.029062087523536555, 'bull_atr_max_pct': 0.04945832848134768, 'bull_tp_mult': 1.3224770914850295, 'bull_tsl_mult': 0.11257431196033756, 'bull_time_stop': 126, 'bull_use_sma': True, 'bull_use_ema': False, 'bull_use_atr': False, 'bull_use_adx': False, 'bull_use_spike': False, 'bull_rsi_required': True, 'bear_strategy': 'breakout', 'bear_bb_std_mult': 2.770966515854272, 'bear_rsi_os': 44, 'bear_rsi_ob': 67, 'bear_adx_thresh': 14.143140208656295, 'bear_atr_min_pct': 0.013322050869928251, 'bear_atr_max_pct': 0.11439768721898878, 'bear_tp_mult': 1.1605296575234196, 'bear_tsl_mult': 0.507666319862315, 'bear_time_stop': 213, 'bear_use_sma': True, 'bear_use_ema': True, 'bear_use_atr': True, 'bear_use_adx': False, 'bear_use_spike': True, 'bear_rsi_required': False, 'sideways_strategy': 'mean_reversion', 'sideways_bb_std_mult': 1.5185422478689419, 'sideways_rsi_os': 38, 'sideways_rsi_ob': 46, 'sideways_adx_thresh': 11.349799713669848, 'sideways_atr_min_pct': 0.02362913266501295, 'sideways_atr_max_pct': 0.1330155171050073, 'sideways_tp_mult': 2.436846049731305, 'sideways_tsl_mult': 0.9391593898286331, 'sideways_time_stop': 232, 'sideways_use_sma': False, 'sideways_use_ema': True, 'sideways_use_atr': False, 'sideways_use_adx': True, 'sideways_use_spike': False, 'sideways_rsi_required': False}.
[I 2025-09-01 09:20:23,064] Trial 138 finished with values: [-1000000000.0, 1000000000.0] and parameters: {'p_sma': 28, 'p_std': 10, 'p_atr': 29, 'p_adx': 13, 'rsi_period': 66, 'ema1': 20, 'ema2': 19, 'slip_atr_k': 0.03822277892013857, 'slip_spread_k': 0.30546924154172095, 'spread_hl_frac': 0.011457823173423289, 'bb_std_mult': 2.0568556243147667, 'rsi_os': 11, 'rsi_ob': 88, 'vol_spike': 0.15911276595863746, 'adx_thresh': 5.032629170901507, 'atr_min_pct': 0.019967842901962286, 'atr_max_pct': 0.08817618197805464, 'tp_mult': 1.7850338797399168, 'tsl_mult': 0.028818143488633596, 'strategy': 'breakout', 'time_stop': 272, 'use_sma': True, 'use_atr': False, 'use_adx': True, 'use_ema': False, 'use_spike': False, 'rsi_required': False, 'edge_k': 1.5824938179649428, 'edge_cap': 0.11607338735101361, 'bull_strategy': 'mean_reversion', 'bull_bb_std_mult': 0.5801489948336376, 'bull_rsi_os': 14, 'bull_rsi_ob': 55, 'bull_adx_thresh': 30.739590162542456, 'bull_atr_min_pct': 0.007947933077565732, 'bull_atr_max_pct': 0.0981118507440901, 'bull_tp_mult': 1.3065811912923175, 'bull_tsl_mult': 0.33045566687568373, 'bull_time_stop': 48, 'bull_use_sma': True, 'bull_use_ema': False, 'bull_use_atr': False, 'bull_use_adx': False, 'bull_use_spike': False, 'bull_rsi_required': True, 'bear_strategy': 'breakout', 'bear_bb_std_mult': 1.5348066821613564, 'bear_rsi_os': 51, 'bear_rsi_ob': 69, 'bear_adx_thresh': 22.05902252400825, 'bear_atr_min_pct': 0.02152681039310759, 'bear_atr_max_pct': 0.056282771103736084, 'bear_tp_mult': 2.1510961422024804, 'bear_tsl_mult': 0.6455524218946345, 'bear_time_stop': 213, 'bear_use_sma': True, 'bear_use_ema': True, 'bear_use_atr': True, 'bear_use_adx': False, 'bear_use_spike': True, 'bear_rsi_required': False, 'sideways_strategy': 'breakout', 'sideways_bb_std_mult': 1.963491711174356, 'sideways_rsi_os': 41, 'sideways_rsi_ob': 57, 'sideways_adx_thresh': 23.7061535865473, 'sideways_atr_min_pct': 0.010093265381307163, 'sideways_atr_max_pct': 0.011123341717405616, 'sideways_tp_mult': 2.6687384773056424, 'sideways_tsl_mult': 0.931809038284484, 'sideways_time_stop': 209, 'sideways_use_sma': False, 'sideways_use_ema': True, 'sideways_use_atr': False, 'sideways_use_adx': True, 'sideways_use_spike': False, 'sideways_rsi_required': False}.
[I 2025-09-01 09:20:23,510] Trial 136 finished with values: [-0.3191759717186903, 0.31927279268355163] and parameters: {'p_sma': 39, 'p_std': 25, 'p_atr': 18, 'p_adx': 13, 'rsi_period': 67, 'ema1': 20, 'ema2': 19, 'slip_atr_k': 0.16616548864775502, 'slip_spread_k': 0.29975328809314516, 'spread_hl_frac': 0.036645247086247196, 'bb_std_mult': 1.7166080142677382, 'rsi_os': 12, 'rsi_ob': 88, 'vol_spike': 0.13380043562002591, 'adx_thresh': 5.034440553127082, 'atr_min_pct': 0.01981172205735901, 'atr_max_pct': 0.14553453536585736, 'tp_mult': 2.1592996289659485, 'tsl_mult': 0.03604872330823156, 'strategy': 'breakout', 'time_stop': 272, 'use_sma': True, 'use_atr': False, 'use_adx': True, 'use_ema': False, 'use_spike': False, 'rsi_required': False, 'edge_k': 0.6365533258681593, 'edge_cap': 0.11496693079074669, 'bull_strategy': 'mean_reversion', 'bull_bb_std_mult': 0.600602203920099, 'bull_rsi_os': 21, 'bull_rsi_ob': 55, 'bull_adx_thresh': 5.78053170738206, 'bull_atr_min_pct': 0.02887478518547668, 'bull_atr_max_pct': 0.04966724400963081, 'bull_tp_mult': 2.345006159058776, 'bull_tsl_mult': 0.1250756026791417, 'bull_time_stop': 123, 'bull_use_sma': True, 'bull_use_ema': False, 'bull_use_atr': False, 'bull_use_adx': False, 'bull_use_spike': False, 'bull_rsi_required': True, 'bear_strategy': 'breakout', 'bear_bb_std_mult': 1.5310335068962488, 'bear_rsi_os': 42, 'bear_rsi_ob': 67, 'bear_adx_thresh': 14.23547075336231, 'bear_atr_min_pct': 0.002246640768768524, 'bear_atr_max_pct': 0.12247872620085395, 'bear_tp_mult': 2.153833144827528, 'bear_tsl_mult': 0.44736703990080506, 'bear_time_stop': 214, 'bear_use_sma': True, 'bear_use_ema': True, 'bear_use_atr': True, 'bear_use_adx': False, 'bear_use_spike': True, 'bear_rsi_required': False, 'sideways_strategy': 'breakout', 'sideways_bb_std_mult': 1.9799030497834118, 'sideways_rsi_os': 37, 'sideways_rsi_ob': 57, 'sideways_adx_thresh': 30.915899845799558, 'sideways_atr_min_pct': 0.004955683095525603, 'sideways_atr_max_pct': 0.0813883866685751, 'sideways_tp_mult': 1.807493641351531, 'sideways_tsl_mult': 0.9021335610968811, 'sideways_time_stop': 232, 'sideways_use_sma': False, 'sideways_use_ema': True, 'sideways_use_atr': False, 'sideways_use_adx': True, 'sideways_use_spike': False, 'sideways_rsi_required': False}.
[I 2025-09-01 09:20:23,926] Trial 142 finished with values: [-1000000000.0, 1000000000.0] and parameters: {'p_sma': 36, 'p_std': 15, 'p_atr': 18, 'p_adx': 16, 'rsi_period': 69, 'ema1': 8, 'ema2': 17, 'slip_atr_k': 0.028977803072002442, 'slip_spread_k': 0.2620281649309937, 'spread_hl_frac': 0.014803012800107007, 'bb_std_mult': 1.6107744114198286, 'rsi_os': 15, 'rsi_ob': 85, 'vol_spike': 0.25235468149563545, 'adx_thresh': 6.6454001050930485, 'atr_min_pct': 0.028954428098005476, 'atr_max_pct': 0.027363999460861294, 'tp_mult': 1.681956169727649, 'tsl_mult': 0.5997616015693013, 'strategy': 'breakout', 'time_stop': 289, 'use_sma': True, 'use_atr': True, 'use_adx': True, 'use_ema': False, 'use_spike': False, 'rsi_required': False, 'edge_k': 1.2986851255782703, 'edge_cap': 0.06964988953348873, 'bull_strategy': 'mean_reversion', 'bull_bb_std_mult': 0.8012795651325316, 'bull_rsi_os': 38, 'bull_rsi_ob': 85, 'bull_adx_thresh': 11.361123950391935, 'bull_atr_min_pct': 0.006135226200590593, 'bull_atr_max_pct': 0.010356193555954032, 'bull_tp_mult': 2.118243160662236, 'bull_tsl_mult': 0.4523149056834787, 'bull_time_stop': 110, 'bull_use_sma': True, 'bull_use_ema': False, 'bull_use_atr': False, 'bull_use_adx': True, 'bull_use_spike': False, 'bull_rsi_required': True, 'bear_strategy': 'mean_reversion', 'bear_bb_std_mult': 0.716176342855972, 'bear_rsi_os': 42, 'bear_rsi_ob': 64, 'bear_adx_thresh': 11.634758511948364, 'bear_atr_min_pct': 0.016560332223626382, 'bear_atr_max_pct': 0.10884727794844562, 'bear_tp_mult': 2.2340583063835697, 'bear_tsl_mult': 0.03064234882611716, 'bear_time_stop': 24, 'bear_use_sma': False, 'bear_use_ema': True, 'bear_use_atr': True, 'bear_use_adx': True, 'bear_use_spike': False, 'bear_rsi_required': True, 'sideways_strategy': 'mean_reversion', 'sideways_bb_std_mult': 0.7402453228242413, 'sideways_rsi_os': 30, 'sideways_rsi_ob': 89, 'sideways_adx_thresh': 30.73088626878422, 'sideways_atr_min_pct': 0.01774486010269523, 'sideways_atr_max_pct': 0.05413272411005933, 'sideways_tp_mult': 1.7460163553457266, 'sideways_tsl_mult': 0.8945481199577235, 'sideways_time_stop': 199, 'sideways_use_sma': False, 'sideways_use_ema': True, 'sideways_use_atr': False, 'sideways_use_adx': False, 'sideways_use_spike': False, 'sideways_rsi_required': False}.
[I 2025-09-01 09:21:04,184] Trial 141 finished with values: [-1000000000.0, 1000000000.0] and parameters: {'p_sma': 28, 'p_std': 30, 'p_atr': 18, 'p_adx': 26, 'rsi_period': 68, 'ema1': 21, 'ema2': 18, 'slip_atr_k': 0.11309617319046222, 'slip_spread_k': 0.27152143570745524, 'spread_hl_frac': 0.009333235716974036, 'bb_std_mult': 0.5005616526625052, 'rsi_os': 15, 'rsi_ob': 87, 'vol_spike': 0.22285144546184982, 'adx_thresh': 6.434471594210235, 'atr_min_pct': 0.029538021023544667, 'atr_max_pct': 0.08897870546176614, 'tp_mult': 1.6814517354946439, 'tsl_mult': 0.022602970648171083, 'strategy': 'breakout', 'time_stop': 293, 'use_sma': True, 'use_atr': True, 'use_adx': True, 'use_ema': False, 'use_spike': False, 'rsi_required': False, 'edge_k': 0.02268558405224863, 'edge_cap': 0.6027222698203953, 'bull_strategy': 'mean_reversion', 'bull_bb_std_mult': 0.566670048764528, 'bull_rsi_os': 14, 'bull_rsi_ob': 55, 'bull_adx_thresh': 29.15611891149638, 'bull_atr_min_pct': 0.007664370503730219, 'bull_atr_max_pct': 0.11658056897536738, 'bull_tp_mult': 2.1187137046129974, 'bull_tsl_mult': 0.28722147473935766, 'bull_time_stop': 109, 'bull_use_sma': True, 'bull_use_ema': False, 'bull_use_atr': False, 'bull_use_adx': False, 'bull_use_spike': False, 'bull_rsi_required': True, 'bear_strategy': 'mean_reversion', 'bear_bb_std_mult': 2.692727602527102, 'bear_rsi_os': 52, 'bear_rsi_ob': 69, 'bear_adx_thresh': 10.013892529050693, 'bear_atr_min_pct': 0.002407939295323607, 'bear_atr_max_pct': 0.10203834576836739, 'bear_tp_mult': 2.2252598231192016, 'bear_tsl_mult': 0.6185025279819889, 'bear_time_stop': 210, 'bear_use_sma': False, 'bear_use_ema': True, 'bear_use_atr': True, 'bear_use_adx': True, 'bear_use_spike': False, 'bear_rsi_required': True, 'sideways_strategy': 'breakout', 'sideways_bb_std_mult': 1.6413893398865043, 'sideways_rsi_os': 41, 'sideways_rsi_ob': 93, 'sideways_adx_thresh': 6.469559507524382, 'sideways_atr_min_pct': 0.015291036340559604, 'sideways_atr_max_pct': 0.010027975218133645, 'sideways_tp_mult': 1.7369482106292653, 'sideways_tsl_mult': 0.17425147029523191, 'sideways_time_stop': 201, 'sideways_use_sma': False, 'sideways_use_ema': True, 'sideways_use_atr': False, 'sideways_use_adx': False, 'sideways_use_spike': False, 'sideways_rsi_required': False}.
[I 2025-09-01 09:21:04,686] Trial 140 finished with values: [-1000000000.0, 1000000000.0] and parameters: {'p_sma': 47, 'p_std': 19, 'p_atr': 18, 'p_adx': 13, 'rsi_period': 64, 'ema1': 17, 'ema2': 18, 'slip_atr_k': 0.03200977162744399, 'slip_spread_k': 0.29557810431979636, 'spread_hl_frac': 0.014032936894701345, 'bb_std_mult': 2.0621032520915477, 'rsi_os': 9, 'rsi_ob': 81, 'vol_spike': 0.2517032311465765, 'adx_thresh': 5.021192835745742, 'atr_min_pct': 0.005500921564157124, 'atr_max_pct': 0.027189863333247175, 'tp_mult': 1.6878966467843253, 'tsl_mult': 6.248322662751049e-05, 'strategy': 'breakout', 'time_stop': 185, 'use_sma': True, 'use_atr': False, 'use_adx': True, 'use_ema': False, 'use_spike': False, 'rsi_required': False, 'edge_k': 1.2991452964418102, 'edge_cap': 0.5993645508588348, 'bull_strategy': 'mean_reversion', 'bull_bb_std_mult': 0.5696669223041337, 'bull_rsi_os': 39, 'bull_rsi_ob': 55, 'bull_adx_thresh': 5.83357699739558, 'bull_atr_min_pct': 0.007843053994339166, 'bull_atr_max_pct': 0.06850650086312673, 'bull_tp_mult': 1.2317632054979304, 'bull_tsl_mult': 0.053356736746251736, 'bull_time_stop': 111, 'bull_use_sma': True, 'bull_use_ema': False, 'bull_use_atr': False, 'bull_use_adx': False, 'bull_use_spike': False, 'bull_rsi_required': True, 'bear_strategy': 'breakout', 'bear_bb_std_mult': 2.448512756890076, 'bear_rsi_os': 51, 'bear_rsi_ob': 67, 'bear_adx_thresh': 22.350221988930592, 'bear_atr_min_pct': 0.013303139266308607, 'bear_atr_max_pct': 0.10854514348546856, 'bear_tp_mult': 2.9148401848767476, 'bear_tsl_mult': 0.447340481863666, 'bear_time_stop': 211, 'bear_use_sma': True, 'bear_use_ema': True, 'bear_use_atr': True, 'bear_use_adx': True, 'bear_use_spike': False, 'bear_rsi_required': True, 'sideways_strategy': 'mean_reversion', 'sideways_bb_std_mult': 1.5034597261112843, 'sideways_rsi_os': 41, 'sideways_rsi_ob': 89, 'sideways_adx_thresh': 30.59072132369643, 'sideways_atr_min_pct': 0.0019324308449649996, 'sideways_atr_max_pct': 0.1494887785552526, 'sideways_tp_mult': 1.6151127923526047, 'sideways_tsl_mult': 0.8998349246028419, 'sideways_time_stop': 200, 'sideways_use_sma': False, 'sideways_use_ema': True, 'sideways_use_atr': False, 'sideways_use_adx': True, 'sideways_use_spike': False, 'sideways_rsi_required': False}.
[I 2025-09-01 09:21:05,113] Trial 143 finished with values: [-1000000000.0, 1000000000.0] and parameters: {'p_sma': 36, 'p_std': 14, 'p_atr': 16, 'p_adx': 15, 'rsi_period': 75, 'ema1': 21, 'ema2': 17, 'slip_atr_k': 0.007039327753192444, 'slip_spread_k': 0.20682174438885548, 'spread_hl_frac': 0.009404427827929092, 'bb_std_mult': 0.5980519361686947, 'rsi_os': 14, 'rsi_ob': 82, 'vol_spike': 0.1120130046910348, 'adx_thresh': 6.509510131552915, 'atr_min_pct': 0.024652161867206195, 'atr_max_pct': 0.1441346230310946, 'tp_mult': 1.7308711086197415, 'tsl_mult': 0.00020130930911272174, 'strategy': 'breakout', 'time_stop': 103, 'use_sma': True, 'use_atr': True, 'use_adx': True, 'use_ema': False, 'use_spike': False, 'rsi_required': True, 'edge_k': 1.0194570163646748, 'edge_cap': 0.2143320768981976, 'bull_strategy': 'mean_reversion', 'bull_bb_std_mult': 0.8094541209557347, 'bull_rsi_os': 14, 'bull_rsi_ob': 71, 'bull_adx_thresh': 13.29927289723139, 'bull_atr_min_pct': 0.029654384747591224, 'bull_atr_max_pct': 0.06629731438454309, 'bull_tp_mult': 1.558199926813796, 'bull_tsl_mult': 0.04984448554112751, 'bull_time_stop': 64, 'bull_use_sma': True, 'bull_use_ema': False, 'bull_use_atr': False, 'bull_use_adx': True, 'bull_use_spike': False, 'bull_rsi_required': True, 'bear_strategy': 'mean_reversion', 'bear_bb_std_mult': 0.6841122155725237, 'bear_rsi_os': 49, 'bear_rsi_ob': 64, 'bear_adx_thresh': 31.85904806771344, 'bear_atr_min_pct': 0.016219064847494327, 'bear_atr_max_pct': 0.06805513939608632, 'bear_tp_mult': 2.2337460417471244, 'bear_tsl_mult': 0.1706963401496932, 'bear_time_stop': 242, 'bear_use_sma': False, 'bear_use_ema': True, 'bear_use_atr': True, 'bear_use_adx': True, 'bear_use_spike': False, 'bear_rsi_required': True, 'sideways_strategy': 'mean_reversion', 'sideways_bb_std_mult': 0.5518985699314516, 'sideways_rsi_os': 47, 'sideways_rsi_ob': 93, 'sideways_adx_thresh': 30.55578691828374, 'sideways_atr_min_pct': 0.015879885342106128, 'sideways_atr_max_pct': 0.053839119388740926, 'sideways_tp_mult': 1.754082941364605, 'sideways_tsl_mult': 0.00032977446126292165, 'sideways_time_stop': 267, 'sideways_use_sma': False, 'sideways_use_ema': True, 'sideways_use_atr': False, 'sideways_use_adx': False, 'sideways_use_spike': False, 'sideways_rsi_required': False}.
