[I 2025-09-01 09:34:55,934] Trial 226 finished with values: [-0.029712425414152532, 0.02957628135867406] and parameters: {'p_sma': 25, 'p_std': 25, 'p_atr': 13, 'p_adx': 13, 'rsi_period': 26, 'ema1': 21, 'ema2': 42, 'slip_atr_k': 0.154099925294707, 'slip_spread_k': 0.26771149489652274, 'spread_hl_frac': 0.014136671891611621, 'bb_std_mult': 1.8605757915431214, 'rsi_os': 54, 'rsi_ob': 87, 'vol_spike': 0.2802190475497791, 'adx_thresh': 17.114073562620558, 'atr_min_pct': 0.019637607634124737, 'atr_max_pct': 0.14634979672339643, 'tp_mult': 1.8959707994267248, 'tsl_mult': 0.8527603616180822, 'strategy': 'breakout', 'time_stop': 118, 'use_sma': False, 'use_atr': True, 'use_adx': True, 'use_ema': True, 'use_spike': False, 'rsi_required': True, 'edge_k': 1.129057809719452, 'edge_cap': 0.05068836672180861, 'bull_strategy': 'breakout', 'bull_bb_std_mult': 0.5641754774357108, 'bull_rsi_os': 32, 'bull_rsi_ob': 56, 'bull_adx_thresh': 7.3607673657118315, 'bull_atr_min_pct': 0.013029805489440792, 'bull_atr_max_pct': 0.06179666744097592, 'bull_tp_mult': 2.091933136850384, 'bull_tsl_mult': 0.6058147955152232, 'bull_time_stop': 195, 'bull_use_sma': True, 'bull_use_ema': True, 'bull_use_atr': False, 'bull_use_adx': False, 'bull_use_spike': True, 'bull_rsi_required': False, 'bear_strategy': 'mean_reversion', 'bear_bb_std_mult': 0.7854706261922031, 'bear_rsi_os': 43, 'bear_rsi_ob': 67, 'bear_adx_thresh': 11.547209202380245, 'bear_atr_min_pct': 0.014693266764904825, 'bear_atr_max_pct': 0.1264900758802555, 'bear_tp_mult': 2.220087264369499, 'bear_tsl_mult': 0.4473502837408096, 'bear_time_stop': 224, 'bear_use_sma': False, 'bear_use_ema': True, 'bear_use_atr': True, 'bear_use_adx': False, 'bear_use_spike': False, 'bear_rsi_required': False, 'sideways_strategy': 'breakout', 'sideways_bb_std_mult': 0.9240889807902037, 'sideways_rsi_os': 53, 'sideways_rsi_ob': 53, 'sideways_adx_thresh': 29.946834357961407, 'sideways_atr_min_pct': 0.0048537031768732634, 'sideways_atr_max_pct': 0.027170426104131146, 'sideways_tp_mult': 1.748624265826815, 'sideways_tsl_mult': 0.9197839942865134, 'sideways_time_stop': 127, 'sideways_use_sma': False, 'sideways_use_ema': False, 'sideways_use_atr': False, 'sideways_use_adx': False, 'sideways_use_spike': False, 'sideways_rsi_required': False}.
[I 2025-09-01 09:34:56,673] Trial 228 finished with values: [-1000000000.0, 1000000000.0] and parameters: {'p_sma': 25, 'p_std': 23, 'p_atr': 7, 'p_adx': 13, 'rsi_period': 69, 'ema1': 21, 'ema2': 16, 'slip_atr_k': 0.15373007842209604, 'slip_spread_k': 0.9534819157752039, 'spread_hl_frac': 0.016382971405050246, 'bb_std_mult': 2.4873876472544825, 'rsi_os': 9, 'rsi_ob': 87, 'vol_spike': 0.19945752249499188, 'adx_thresh': 5.896868367985004, 'atr_min_pct': 0.019642800945847493, 'atr_max_pct': 0.14424605339644836, 'tp_mult': 1.910991695125662, 'tsl_mult': 0.020230891235053505, 'strategy': 'breakout', 'time_stop': 123, 'use_sma': True, 'use_atr': True, 'use_adx': True, 'use_ema': False, 'use_spike': False, 'rsi_required': True, 'edge_k': 1.071572983171786, 'edge_cap': 0.789385609462601, 'bull_strategy': 'breakout', 'bull_bb_std_mult': 0.5572743828571195, 'bull_rsi_os': 18, 'bull_rsi_ob': 56, 'bull_adx_thresh': 5.517111133034352, 'bull_atr_min_pct': 0.02712328933764357, 'bull_atr_max_pct': 0.07956229875280017, 'bull_tp_mult': 1.3357683543263335, 'bull_tsl_mult': 0.13429378272492204, 'bull_time_stop': 124, 'bull_use_sma': True, 'bull_use_ema': True, 'bull_use_atr': False, 'bull_use_adx': False, 'bull_use_spike': False, 'bull_rsi_required': True, 'bear_strategy': 'mean_reversion', 'bear_bb_std_mult': 0.8049118351041529, 'bear_rsi_os': 43, 'bear_rsi_ob': 66, 'bear_adx_thresh': 5.131572883586973, 'bear_atr_min_pct': 0.027439099647176418, 'bear_atr_max_pct': 0.0217168630776901, 'bear_tp_mult': 2.1441690066428025, 'bear_tsl_mult': 0.4091509129431911, 'bear_time_stop': 206, 'bear_use_sma': False, 'bear_use_ema': True, 'bear_use_atr': True, 'bear_use_adx': True, 'bear_use_spike': True, 'bear_rsi_required': True, 'sideways_strategy': 'breakout', 'sideways_bb_std_mult': 3.1179618126979567, 'sideways_rsi_os': 15, 'sideways_rsi_ob': 45, 'sideways_adx_thresh': 31.058757509143533, 'sideways_atr_min_pct': 0.004495979441954755, 'sideways_atr_max_pct': 0.0724176053218748, 'sideways_tp_mult': 1.8068556006386856, 'sideways_tsl_mult': 0.8781678756508873, 'sideways_time_stop': 88, 'sideways_use_sma': True, 'sideways_use_ema': False, 'sideways_use_atr': False, 'sideways_use_adx': False, 'sideways_use_spike': False, 'sideways_rsi_required': False}.
[I 2025-09-01 09:34:57,561] Trial 227 finished with values: [-0.042693739888363225, 0.04230706948307318] and parameters: {'p_sma': 25, 'p_std': 48, 'p_atr': 7, 'p_adx': 20, 'rsi_period': 63, 'ema1': 21, 'ema2': 54, 'slip_atr_k': 0.04331478322742448, 'slip_spread_k': 0.9515399923597972, 'spread_hl_frac': 0.03762100461446421, 'bb_std_mult': 2.529776163334311, 'rsi_os': 54, 'rsi_ob': 82, 'vol_spike': 0.015302122449765115, 'adx_thresh': 31.254134685504777, 'atr_min_pct': 0.0197181239167481, 'atr_max_pct': 0.1473519983601179, 'tp_mult': 1.5275835774889361, 'tsl_mult': 0.022045864981519055, 'strategy': 'breakout', 'time_stop': 121, 'use_sma': True, 'use_atr': False, 'use_adx': True, 'use_ema': True, 'use_spike': False, 'rsi_required': True, 'edge_k': 1.4810488680425213, 'edge_cap': 0.8922308567554655, 'bull_strategy': 'breakout', 'bull_bb_std_mult': 0.5642801024265198, 'bull_rsi_os': 31, 'bull_rsi_ob': 56, 'bull_adx_thresh': 28.799596241665625, 'bull_atr_min_pct': 0.02793922538338143, 'bull_atr_max_pct': 0.01565601255326171, 'bull_tp_mult': 2.1096906313449524, 'bull_tsl_mult': 0.7114148539760827, 'bull_time_stop': 245, 'bull_use_sma': True, 'bull_use_ema': True, 'bull_use_atr': False, 'bull_use_adx': False, 'bull_use_spike': False, 'bull_rsi_required': True, 'bear_strategy': 'mean_reversion', 'bear_bb_std_mult': 0.8214205631476268, 'bear_rsi_os': 44, 'bear_rsi_ob': 67, 'bear_adx_thresh': 23.799580045670695, 'bear_atr_min_pct': 0.008025027692228971, 'bear_atr_max_pct': 0.11709694539216295, 'bear_tp_mult': 2.134811730555862, 'bear_tsl_mult': 0.4506270126989291, 'bear_time_stop': 223, 'bear_use_sma': False, 'bear_use_ema': True, 'bear_use_atr': True, 'bear_use_adx': True, 'bear_use_spike': False, 'bear_rsi_required': True, 'sideways_strategy': 'breakout', 'sideways_bb_std_mult': 0.6895534156784471, 'sideways_rsi_os': 39, 'sideways_rsi_ob': 45, 'sideways_adx_thresh': 31.059982031550675, 'sideways_atr_min_pct': 0.0038810314156784275, 'sideways_atr_max_pct': 0.12983250974549665, 'sideways_tp_mult': 1.765760249825281, 'sideways_tsl_mult': 0.91939674523154, 'sideways_time_stop': 254, 'sideways_use_sma': True, 'sideways_use_ema': False, 'sideways_use_atr': False, 'sideways_use_adx': False, 'sideways_use_spike': False, 'sideways_rsi_required': False}.
[I 2025-09-01 09:34:57,781] Trial 225 finished with values: [-0.04379344866593837, 0.0434653204883336] and parameters: {'p_sma': 25, 'p_std': 26, 'p_atr': 13, 'p_adx': 20, 'rsi_period': 9, 'ema1': 21, 'ema2': 44, 'slip_atr_k': 0.14066290627953515, 'slip_spread_k': 0.2643989931849409, 'spread_hl_frac': 0.03621750150360912, 'bb_std_mult': 2.5131762034107825, 'rsi_os': 13, 'rsi_ob': 82, 'vol_spike': 0.20048494005329445, 'adx_thresh': 5.909590735820925, 'atr_min_pct': 0.019580557623722298, 'atr_max_pct': 0.14685514928222282, 'tp_mult': 1.5236859037561854, 'tsl_mult': 0.015414177304089227, 'strategy': 'breakout', 'time_stop': 13, 'use_sma': False, 'use_atr': True, 'use_adx': True, 'use_ema': True, 'use_spike': False, 'rsi_required': True, 'edge_k': 0.60135843763492, 'edge_cap': 0.786024721024985, 'bull_strategy': 'breakout', 'bull_bb_std_mult': 0.5714197620344756, 'bull_rsi_os': 14, 'bull_rsi_ob': 82, 'bull_adx_thresh': 7.389939894707165, 'bull_atr_min_pct': 0.028076744723482386, 'bull_atr_max_pct': 0.03966568433281703, 'bull_tp_mult': 2.1145438207874925, 'bull_tsl_mult': 0.1376545383095867, 'bull_time_stop': 125, 'bull_use_sma': True, 'bull_use_ema': True, 'bull_use_atr': False, 'bull_use_adx': False, 'bull_use_spike': True, 'bull_rsi_required': False, 'bear_strategy': 'mean_reversion', 'bear_bb_std_mult': 0.7521792876803326, 'bear_rsi_os': 43, 'bear_rsi_ob': 67, 'bear_adx_thresh': 33.19481359146923, 'bear_atr_min_pct': 0.014564903578307701, 'bear_atr_max_pct': 0.12651538340131638, 'bear_tp_mult': 2.1420350027860655, 'bear_tsl_mult': 0.4137220248149015, 'bear_time_stop': 161, 'bear_use_sma': False, 'bear_use_ema': True, 'bear_use_atr': True, 'bear_use_adx': False, 'bear_use_spike': False, 'bear_rsi_required': False, 'sideways_strategy': 'breakout', 'sideways_bb_std_mult': 0.8925866180123476, 'sideways_rsi_os': 43, 'sideways_rsi_ob': 53, 'sideways_adx_thresh': 15.977066738855306, 'sideways_atr_min_pct': 0.004299133784235599, 'sideways_atr_max_pct': 0.07195515783402368, 'sideways_tp_mult': 1.7619688445560437, 'sideways_tsl_mult': 0.9211899398593795, 'sideways_time_stop': 229, 'sideways_use_sma': False, 'sideways_use_ema': False, 'sideways_use_atr': False, 'sideways_use_adx': False, 'sideways_use_spike': False, 'sideways_rsi_required': False}.
[I 2025-09-01 09:35:41,419] Trial 229 finished with values: [-1000000000.0, 0.42529253469467115] and parameters: {'p_sma': 26, 'p_std': 26, 'p_atr': 12, 'p_adx': 14, 'rsi_period': 26, 'ema1': 21, 'ema2': 25, 'slip_atr_k': 0.04320013867015367, 'slip_spread_k': 0.27266451310926265, 'spread_hl_frac': 0.01587449082920879, 'bb_std_mult': 0.6295864497562385, 'rsi_os': 13, 'rsi_ob': 89, 'vol_spike': 0.039640927951248864, 'adx_thresh': 5.92887397569358, 'atr_min_pct': 0.018016547351907164, 'atr_max_pct': 0.02002026442092649, 'tp_mult': 1.6573991330360398, 'tsl_mult': 0.021629896830575084, 'strategy': 'breakout', 'time_stop': 211, 'use_sma': True, 'use_atr': False, 'use_adx': True, 'use_ema': False, 'use_spike': False, 'rsi_required': True, 'edge_k': 1.1242676475121542, 'edge_cap': 0.05007637576728734, 'bull_strategy': 'breakout', 'bull_bb_std_mult': 0.5702725589224659, 'bull_rsi_os': 18, 'bull_rsi_ob': 82, 'bull_adx_thresh': 7.330426448154145, 'bull_atr_min_pct': 0.02813603474854113, 'bull_atr_max_pct': 0.013345924272609735, 'bull_tp_mult': 1.3206025911725074, 'bull_tsl_mult': 0.1252525558920608, 'bull_time_stop': 128, 'bull_use_sma': True, 'bull_use_ema': True, 'bull_use_atr': False, 'bull_use_adx': False, 'bull_use_spike': False, 'bull_rsi_required': True, 'bear_strategy': 'mean_reversion', 'bear_bb_std_mult': 3.4251889966122095, 'bear_rsi_os': 46, 'bear_rsi_ob': 66, 'bear_adx_thresh': 13.326035498130151, 'bear_atr_min_pct': 0.008161233389593271, 'bear_atr_max_pct': 0.118008256554141, 'bear_tp_mult': 2.148945411911147, 'bear_tsl_mult': 0.40850992713408973, 'bear_time_stop': 208, 'bear_use_sma': False, 'bear_use_ema': True, 'bear_use_atr': True, 'bear_use_adx': True, 'bear_use_spike': False, 'bear_rsi_required': True, 'sideways_strategy': 'breakout', 'sideways_bb_std_mult': 1.1490858919289604, 'sideways_rsi_os': 39, 'sideways_rsi_ob': 62, 'sideways_adx_thresh': 30.93519961604277, 'sideways_atr_min_pct': 0.0007176252061114555, 'sideways_atr_max_pct': 0.0729898278509368, 'sideways_tp_mult': 1.8236097746494613, 'sideways_tsl_mult': 0.8822902394764084, 'sideways_time_stop': 224, 'sideways_use_sma': True, 'sideways_use_ema': False, 'sideways_use_atr': False, 'sideways_use_adx': False, 'sideways_use_spike': False, 'sideways_rsi_required': False}.
[I 2025-09-01 09:35:42,765] Trial 230 finished with values: [-1000000000.0, 1000000000.0] and parameters: {'p_sma': 44, 'p_std': 26, 'p_atr': 24, 'p_adx': 14, 'rsi_period': 64, 'ema1': 21, 'ema2': 18, 'slip_atr_k': 0.07612225374191697, 'slip_spread_k': 0.2652018141805144, 'spread_hl_frac': 0.00951293422366067, 'bb_std_mult': 3.0978791375217756, 'rsi_os': 44, 'rsi_ob': 89, 'vol_spike': 0.22985816572646656, 'adx_thresh': 5.5216164373529635, 'atr_min_pct': 0.025522770707343496, 'atr_max_pct': 0.10029743431696034, 'tp_mult': 1.8522172512046975, 'tsl_mult': 0.04222519562824254, 'strategy': 'breakout', 'time_stop': 256, 'use_sma': True, 'use_atr': False, 'use_adx': True, 'use_ema': False, 'use_spike': False, 'rsi_required': False, 'edge_k': 0.6060946193587908, 'edge_cap': 0.05174846215123106, 'bull_strategy': 'mean_reversion', 'bull_bb_std_mult': 3.398772487708794, 'bull_rsi_os': 32, 'bull_rsi_ob': 55, 'bull_adx_thresh': 7.555855436603245, 'bull_atr_min_pct': 0.028090668726489174, 'bull_atr_max_pct': 0.04105969119964389, 'bull_tp_mult': 2.1014137532221335, 'bull_tsl_mult': 0.9316912485349574, 'bull_time_stop': 249, 'bull_use_sma': False, 'bull_use_ema': False, 'bull_use_atr': False, 'bull_use_adx': False, 'bull_use_spike': False, 'bull_rsi_required': True, 'bear_strategy': 'mean_reversion', 'bear_bb_std_mult': 1.7884206527522957, 'bear_rsi_os': 44, 'bear_rsi_ob': 68, 'bear_adx_thresh': 9.154845834733301, 'bear_atr_min_pct': 0.014587295756198347, 'bear_atr_max_pct': 0.08865455462610092, 'bear_tp_mult': 2.2793541968220423, 'bear_tsl_mult': 0.45609976094169313, 'bear_time_stop': 160, 'bear_use_sma': True, 'bear_use_ema': True, 'bear_use_atr': True, 'bear_use_adx': False, 'bear_use_spike': False, 'bear_rsi_required': False, 'sideways_strategy': 'breakout', 'sideways_bb_std_mult': 1.1669031138939854, 'sideways_rsi_os': 39, 'sideways_rsi_ob': 67, 'sideways_adx_thresh': 16.001086541138143, 'sideways_atr_min_pct': 0.013911231554745515, 'sideways_atr_max_pct': 0.11186264266738566, 'sideways_tp_mult': 1.743744877404672, 'sideways_tsl_mult': 0.41859824509196114, 'sideways_time_stop': 225, 'sideways_use_sma': False, 'sideways_use_ema': True, 'sideways_use_atr': False, 'sideways_use_adx': True, 'sideways_use_spike': False, 'sideways_rsi_required': True}.
[I 2025-09-01 09:35:43,342] Trial 231 finished with values: [-1000000000.0, 1000000000.0] and parameters: {'p_sma': 7, 'p_std': 26, 'p_atr': 15, 'p_adx': 14, 'rsi_period': 57, 'ema1': 25, 'ema2': 18, 'slip_atr_k': 0.034529857246119414, 'slip_spread_k': 0.3174320373631793, 'spread_hl_frac': 0.008947786428088477, 'bb_std_mult': 0.6280894227982943, 'rsi_os': 31, 'rsi_ob': 89, 'vol_spike': 0.22881977533651715, 'adx_thresh': 5.632547540650094, 'atr_min_pct': 0.02180665142833315, 'atr_max_pct': 0.10052088836298848, 'tp_mult': 1.8495893174829638, 'tsl_mult': 0.039514543915659464, 'strategy': 'breakout', 'time_stop': 17, 'use_sma': True, 'use_atr': False, 'use_adx': True, 'use_ema': False, 'use_spike': False, 'rsi_required': False, 'edge_k': 1.5954281752698085, 'edge_cap': 0.12405837357516636, 'bull_strategy': 'mean_reversion', 'bull_bb_std_mult': 1.5966900613360226, 'bull_rsi_os': 17, 'bull_rsi_ob': 55, 'bull_adx_thresh': 19.87594482579331, 'bull_atr_min_pct': 0.01594802074260768, 'bull_atr_max_pct': 0.06720697588740777, 'bull_tp_mult': 1.0112347889835924, 'bull_tsl_mult': 0.6089449674888542, 'bull_time_stop': 128, 'bull_use_sma': False, 'bull_use_ema': False, 'bull_use_atr': False, 'bull_use_adx': False, 'bull_use_spike': False, 'bull_rsi_required': True, 'bear_strategy': 'mean_reversion', 'bear_bb_std_mult': 1.778724536796597, 'bear_rsi_os': 25, 'bear_rsi_ob': 68, 'bear_adx_thresh': 13.078677477408437, 'bear_atr_min_pct': 0.02982811121684087, 'bear_atr_max_pct': 0.11330929897746488, 'bear_tp_mult': 2.2777417872281966, 'bear_tsl_mult': 0.4144755544669625, 'bear_time_stop': 230, 'bear_use_sma': True, 'bear_use_ema': True, 'bear_use_atr': True, 'bear_use_adx': False, 'bear_use_spike': False, 'bear_rsi_required': False, 'sideways_strategy': 'mean_reversion', 'sideways_bb_std_mult': 1.157006048769037, 'sideways_rsi_os': 42, 'sideways_rsi_ob': 47, 'sideways_adx_thresh': 13.396301531920912, 'sideways_atr_min_pct': 0.0031433365758182846, 'sideways_atr_max_pct': 0.10744140259492875, 'sideways_tp_mult': 1.8365889345337205, 'sideways_tsl_mult': 0.6655676217702999, 'sideways_time_stop': 226, 'sideways_use_sma': False, 'sideways_use_ema': True, 'sideways_use_atr': False, 'sideways_use_adx': True, 'sideways_use_spike': True, 'sideways_rsi_required': True}.
[I 2025-09-01 09:35:43,911] Trial 232 finished with values: [-1000000000.0, 1000000000.0] and parameters: {'p_sma': 27, 'p_std': 25, 'p_atr': 24, 'p_adx': 14, 'rsi_period': 28, 'ema1': 19, 'ema2': 18, 'slip_atr_k': 0.08747217794936807, 'slip_spread_k': 0.30751584697422274, 'spread_hl_frac': 0.009746843256323823, 'bb_std_mult': 0.6268750252254742, 'rsi_os': 31, 'rsi_ob': 89, 'vol_spike': 0.24762563308448346, 'adx_thresh': 10.07772382940202, 'atr_min_pct': 0.025521404285352, 'atr_max_pct': 0.13857770830681018, 'tp_mult': 1.6602084138334994, 'tsl_mult': 0.048993876150873264, 'strategy': 'mean_reversion', 'time_stop': 73, 'use_sma': True, 'use_atr': False, 'use_adx': True, 'use_ema': False, 'use_spike': False, 'rsi_required': False, 'edge_k': 1.443493300389344, 'edge_cap': 0.05146316642530885, 'bull_strategy': 'mean_reversion', 'bull_bb_std_mult': 1.6048304735679992, 'bull_rsi_os': 18, 'bull_rsi_ob': 55, 'bull_adx_thresh': 20.162504947486823, 'bull_atr_min_pct': 0.0225031692549851, 'bull_atr_max_pct': 0.10591507400827588, 'bull_tp_mult': 2.527250205811777, 'bull_tsl_mult': 0.04952920358154236, 'bull_time_stop': 141, 'bull_use_sma': False, 'bull_use_ema': False, 'bull_use_atr': False, 'bull_use_adx': False, 'bull_use_spike': False, 'bull_rsi_required': True, 'bear_strategy': 'mean_reversion', 'bear_bb_std_mult': 3.4302521431228494, 'bear_rsi_os': 25, 'bear_rsi_ob': 68, 'bear_adx_thresh': 31.862918266311365, 'bear_atr_min_pct': 0.02499647875535119, 'bear_atr_max_pct': 0.113706790666314, 'bear_tp_mult': 2.270810897725771, 'bear_tsl_mult': 0.4571990467642261, 'bear_time_stop': 217, 'bear_use_sma': True, 'bear_use_ema': True, 'bear_use_atr': True, 'bear_use_adx': False, 'bear_use_spike': False, 'bear_rsi_required': False, 'sideways_strategy': 'mean_reversion', 'sideways_bb_std_mult': 1.1740133371995076, 'sideways_rsi_os': 41, 'sideways_rsi_ob': 83, 'sideways_adx_thresh': 6.0367803446327475, 'sideways_atr_min_pct': 0.0029863918563866948, 'sideways_atr_max_pct': 0.06816353522639011, 'sideways_tp_mult': 1.5440985301833665, 'sideways_tsl_mult': 0.9772176414565431, 'sideways_time_stop': 224, 'sideways_use_sma': False, 'sideways_use_ema': True, 'sideways_use_atr': False, 'sideways_use_adx': True, 'sideways_use_spike': True, 'sideways_rsi_required': True}.
[I 2025-09-01 09:35:44,584] Trial 234 finished with values: [-1000000000.0, 1000000000.0] and parameters: {'p_sma': 7, 'p_std': 13, 'p_atr': 15, 'p_adx': 14, 'rsi_period': 65, 'ema1': 25, 'ema2': 20, 'slip_atr_k': 0.08736367091330732, 'slip_spread_k': 0.30881445045623235, 'spread_hl_frac': 0.013358717662145294, 'bb_std_mult': 1.866170229409897, 'rsi_os': 31, 'rsi_ob': 90, 'vol_spike': 0.24890147656530662, 'adx_thresh': 24.18506330448723, 'atr_min_pct': 0.020604039653349556, 'atr_max_pct': 0.013266780006465903, 'tp_mult': 1.388346335902805, 'tsl_mult': 0.6242330829004679, 'strategy': 'mean_reversion', 'time_stop': 207, 'use_sma': True, 'use_atr': False, 'use_adx': True, 'use_ema': False, 'use_spike': False, 'rsi_required': False, 'edge_k': 1.557722897887222, 'edge_cap': 0.07590810961837027, 'bull_strategy': 'mean_reversion', 'bull_bb_std_mult': 0.6382755469559814, 'bull_rsi_os': 27, 'bull_rsi_ob': 55, 'bull_adx_thresh': 19.682636273337614, 'bull_atr_min_pct': 0.005763741438264247, 'bull_atr_max_pct': 0.06709934649724153, 'bull_tp_mult': 2.5386252678374492, 'bull_tsl_mult': 0.07993056258183806, 'bull_time_stop': 97, 'bull_use_sma': False, 'bull_use_ema': False, 'bull_use_atr': False, 'bull_use_adx': True, 'bull_use_spike': False, 'bull_rsi_required': True, 'bear_strategy': 'mean_reversion', 'bear_bb_std_mult': 3.5576320934844765, 'bear_rsi_os': 25, 'bear_rsi_ob': 86, 'bear_adx_thresh': 31.842595488556505, 'bear_atr_min_pct': 0.01512914620082877, 'bear_atr_max_pct': 0.018658195583249784, 'bear_tp_mult': 1.4684092315973272, 'bear_tsl_mult': 0.43544628393195495, 'bear_time_stop': 218, 'bear_use_sma': True, 'bear_use_ema': True, 'bear_use_atr': True, 'bear_use_adx': False, 'bear_use_spike': True, 'bear_rsi_required': False, 'sideways_strategy': 'mean_reversion', 'sideways_bb_std_mult': 1.0786091770326602, 'sideways_rsi_os': 41, 'sideways_rsi_ob': 83, 'sideways_adx_thresh': 30.047333297743098, 'sideways_atr_min_pct': 0.0030282843155720225, 'sideways_atr_max_pct': 0.06893242580380345, 'sideways_tp_mult': 2.0538722469119306, 'sideways_tsl_mult': 0.970905507363122, 'sideways_time_stop': 107, 'sideways_use_sma': False, 'sideways_use_ema': True, 'sideways_use_atr': False, 'sideways_use_adx': True, 'sideways_use_spike': True, 'sideways_rsi_required': True}.
