[I 2025-09-01 10:04:55,416] Trial 405 finished with values: [-1000000000.0, 1000000000.0] and parameters: {'p_sma': 42, 'p_std': 13, 'p_atr': 26, 'p_adx': 23, 'rsi_period': 78, 'ema1': 23, 'ema2': 49, 'slip_atr_k': 0.21466960918582428, 'slip_spread_k': 0.18436427999808175, 'spread_hl_frac': 0.027796860194550566, 'bb_std_mult': 2.1272628731067575, 'rsi_os': 25, 'rsi_ob': 61, 'vol_spike': 0.2878747287440784, 'adx_thresh': 6.511719672906897, 'atr_min_pct': 0.025875797591491848, 'atr_max_pct': 0.1035682054285739, 'tp_mult': 1.4029362528745963, 'tsl_mult': 0.07391255347043757, 'strategy': 'breakout', 'time_stop': 158, 'use_sma': True, 'use_atr': False, 'use_adx': True, 'use_ema': False, 'use_spike': False, 'rsi_required': False, 'edge_k': 0.8496291677683148, 'edge_cap': 0.6866890053086062, 'bull_strategy': 'mean_reversion', 'bull_bb_std_mult': 1.0854218789477539, 'bull_rsi_os': 20, 'bull_rsi_ob': 72, 'bull_adx_thresh': 5.011137359438316, 'bull_atr_min_pct': 0.028692741231141485, 'bull_atr_max_pct': 0.09234690014330302, 'bull_tp_mult': 2.5463434255946904, 'bull_tsl_mult': 0.07272952042414149, 'bull_time_stop': 54, 'bull_use_sma': True, 'bull_use_ema': False, 'bull_use_atr': True, 'bull_use_adx': True, 'bull_use_spike': False, 'bull_rsi_required': True, 'bear_strategy': 'mean_reversion', 'bear_bb_std_mult': 1.8769163035615686, 'bear_rsi_os': 46, 'bear_rsi_ob': 76, 'bear_adx_thresh': 12.663137400445748, 'bear_atr_min_pct': 0.016341414827818507, 'bear_atr_max_pct': 0.07472041957715038, 'bear_tp_mult': 1.3614038607370567, 'bear_tsl_mult': 0.6595688119954255, 'bear_time_stop': 122, 'bear_use_sma': False, 'bear_use_ema': True, 'bear_use_atr': True, 'bear_use_adx': False, 'bear_use_spike': True, 'bear_rsi_required': False, 'sideways_strategy': 'breakout', 'sideways_bb_std_mult': 3.156657689854258, 'sideways_rsi_os': 13, 'sideways_rsi_ob': 48, 'sideways_adx_thresh': 27.248786541419555, 'sideways_atr_min_pct': 0.007156089842661034, 'sideways_atr_max_pct': 0.07586546726002068, 'sideways_tp_mult': 1.276568159967995, 'sideways_tsl_mult': 0.6491501482135292, 'sideways_time_stop': 187, 'sideways_use_sma': False, 'sideways_use_ema': True, 'sideways_use_atr': False, 'sideways_use_adx': False, 'sideways_use_spike': False, 'sideways_rsi_required': False}.
[I 2025-09-01 10:04:56,106] Trial 409 finished with values: [-1000000000.0, 1000000000.0] and parameters: {'p_sma': 55, 'p_std': 40, 'p_atr': 23, 'p_adx': 17, 'rsi_period': 64, 'ema1': 21, 'ema2': 51, 'slip_atr_k': 0.18207758530520984, 'slip_spread_k': 0.15118104818072567, 'spread_hl_frac': 0.02530200627218702, 'bb_std_mult': 2.5598063737058485, 'rsi_os': 22, 'rsi_ob': 74, 'vol_spike': 0.13619936574143787, 'adx_thresh': 24.499803659433432, 'atr_min_pct': 0.028672564023347905, 'atr_max_pct': 0.02810278550711135, 'tp_mult': 1.3190377212795523, 'tsl_mult': 0.019957052162010838, 'strategy': 'breakout', 'time_stop': 157, 'use_sma': True, 'use_atr': False, 'use_adx': True, 'use_ema': True, 'use_spike': False, 'rsi_required': False, 'edge_k': 0.9391649057030907, 'edge_cap': 0.8006105687669114, 'bull_strategy': 'breakout', 'bull_bb_std_mult': 1.2804966515142848, 'bull_rsi_os': 46, 'bull_rsi_ob': 56, 'bull_adx_thresh': 18.67223047694181, 'bull_atr_min_pct': 0.0010064364408095654, 'bull_atr_max_pct': 0.08774000881834079, 'bull_tp_mult': 1.368612613793081, 'bull_tsl_mult': 0.0367825922819507, 'bull_time_stop': 158, 'bull_use_sma': True, 'bull_use_ema': True, 'bull_use_atr': True, 'bull_use_adx': True, 'bull_use_spike': True, 'bull_rsi_required': False, 'bear_strategy': 'breakout', 'bear_bb_std_mult': 1.156965537863945, 'bear_rsi_os': 16, 'bear_rsi_ob': 61, 'bear_adx_thresh': 13.226263173946332, 'bear_atr_min_pct': 0.018039905733492446, 'bear_atr_max_pct': 0.0805576611849323, 'bear_tp_mult': 1.7384045216573445, 'bear_tsl_mult': 0.47964025049366077, 'bear_time_stop': 188, 'bear_use_sma': False, 'bear_use_ema': False, 'bear_use_atr': True, 'bear_use_adx': True, 'bear_use_spike': True, 'bear_rsi_required': False, 'sideways_strategy': 'breakout', 'sideways_bb_std_mult': 3.2580352246550603, 'sideways_rsi_os': 50, 'sideways_rsi_ob': 50, 'sideways_adx_thresh': 34.72894514737549, 'sideways_atr_min_pct': 0.0033222895757843867, 'sideways_atr_max_pct': 0.06884347947692904, 'sideways_tp_mult': 2.7858541345814842, 'sideways_tsl_mult': 0.8058421832689393, 'sideways_time_stop': 200, 'sideways_use_sma': False, 'sideways_use_ema': True, 'sideways_use_atr': False, 'sideways_use_adx': False, 'sideways_use_spike': False, 'sideways_rsi_required': False}.
[I 2025-09-01 10:05:36,527] Trial 407 finished with values: [-0.023808384570334407, 0.023533233949077772] and parameters: {'p_sma': 18, 'p_std': 40, 'p_atr': 26, 'p_adx': 23, 'rsi_period': 78, 'ema1': 22, 'ema2': 49, 'slip_atr_k': 0.037773792570587994, 'slip_spread_k': 0.38204936443755105, 'spread_hl_frac': 0.023432003694493147, 'bb_std_mult': 2.9577511985688694, 'rsi_os': 22, 'rsi_ob': 74, 'vol_spike': 0.2825110182243528, 'adx_thresh': 24.381921540791772, 'atr_min_pct': 0.02578977915721621, 'atr_max_pct': 0.03779670323668215, 'tp_mult': 1.4309350393549773, 'tsl_mult': 0.5017255577477332, 'strategy': 'breakout', 'time_stop': 157, 'use_sma': False, 'use_atr': False, 'use_adx': True, 'use_ema': True, 'use_spike': False, 'rsi_required': False, 'edge_k': 1.7752474484057723, 'edge_cap': 0.20586257863575302, 'bull_strategy': 'breakout', 'bull_bb_std_mult': 3.0271263123767165, 'bull_rsi_os': 13, 'bull_rsi_ob': 71, 'bull_adx_thresh': 5.542939423480964, 'bull_atr_min_pct': 0.025777312753611694, 'bull_atr_max_pct': 0.09249689476123063, 'bull_tp_mult': 1.3623048435415055, 'bull_tsl_mult': 0.0443714158042593, 'bull_time_stop': 75, 'bull_use_sma': False, 'bull_use_ema': True, 'bull_use_atr': True, 'bull_use_adx': True, 'bull_use_spike': True, 'bull_rsi_required': False, 'bear_strategy': 'breakout', 'bear_bb_std_mult': 2.033987274372919, 'bear_rsi_os': 54, 'bear_rsi_ob': 46, 'bear_adx_thresh': 13.1478426316282, 'bear_atr_min_pct': 0.018277337182980684, 'bear_atr_max_pct': 0.0722939955248873, 'bear_tp_mult': 1.366186338699086, 'bear_tsl_mult': 0.6594303448375028, 'bear_time_stop': 123, 'bear_use_sma': False, 'bear_use_ema': False, 'bear_use_atr': True, 'bear_use_adx': False, 'bear_use_spike': True, 'bear_rsi_required': False, 'sideways_strategy': 'breakout', 'sideways_bb_std_mult': 3.2607982369024264, 'sideways_rsi_os': 51, 'sideways_rsi_ob': 48, 'sideways_adx_thresh': 25.594924445964153, 'sideways_atr_min_pct': 0.0029754621783539287, 'sideways_atr_max_pct': 0.06875380284513521, 'sideways_tp_mult': 2.248026117510179, 'sideways_tsl_mult': 0.5055276254885358, 'sideways_time_stop': 202, 'sideways_use_sma': True, 'sideways_use_ema': True, 'sideways_use_atr': False, 'sideways_use_adx': False, 'sideways_use_spike': False, 'sideways_rsi_required': False}.
[I 2025-09-01 10:05:37,707] Trial 408 finished with values: [-1000000000.0, 1000000000.0] and parameters: {'p_sma': 17, 'p_std': 35, 'p_atr': 24, 'p_adx': 23, 'rsi_period': 64, 'ema1': 6, 'ema2': 51, 'slip_atr_k': 0.19951343297086138, 'slip_spread_k': 0.22711423917774254, 'spread_hl_frac': 0.023174163877129852, 'bb_std_mult': 2.9691040537929774, 'rsi_os': 25, 'rsi_ob': 74, 'vol_spike': 0.28751645489196004, 'adx_thresh': 6.400726929133791, 'atr_min_pct': 0.026034077363013216, 'atr_max_pct': 0.07724898849141593, 'tp_mult': 2.8733413383632964, 'tsl_mult': 0.6730067011197806, 'strategy': 'breakout', 'time_stop': 67, 'use_sma': True, 'use_atr': False, 'use_adx': True, 'use_ema': True, 'use_spike': False, 'rsi_required': False, 'edge_k': 1.7592617529904853, 'edge_cap': 0.529989244120303, 'bull_strategy': 'breakout', 'bull_bb_std_mult': 0.7814213474599071, 'bull_rsi_os': 46, 'bull_rsi_ob': 56, 'bull_adx_thresh': 5.453849719793759, 'bull_atr_min_pct': 0.028915777678181157, 'bull_atr_max_pct': 0.0920810062135684, 'bull_tp_mult': 1.8920594384217482, 'bull_tsl_mult': 0.033243977271553884, 'bull_time_stop': 56, 'bull_use_sma': True, 'bull_use_ema': True, 'bull_use_atr': True, 'bull_use_adx': True, 'bull_use_spike': True, 'bull_rsi_required': False, 'bear_strategy': 'breakout', 'bear_bb_std_mult': 2.8530220959628654, 'bear_rsi_os': 54, 'bear_rsi_ob': 46, 'bear_adx_thresh': 13.085368947850704, 'bear_atr_min_pct': 0.01657546756614959, 'bear_atr_max_pct': 0.07155084247473079, 'bear_tp_mult': 1.7328107444406413, 'bear_tsl_mult': 0.4439719620745837, 'bear_time_stop': 186, 'bear_use_sma': False, 'bear_use_ema': False, 'bear_use_atr': True, 'bear_use_adx': True, 'bear_use_spike': True, 'bear_rsi_required': False, 'sideways_strategy': 'breakout', 'sideways_bb_std_mult': 3.1727825796274285, 'sideways_rsi_os': 50, 'sideways_rsi_ob': 50, 'sideways_adx_thresh': 27.73543854836476, 'sideways_atr_min_pct': 0.01345666079422668, 'sideways_atr_max_pct': 0.0684662480530448, 'sideways_tp_mult': 1.3229213625040241, 'sideways_tsl_mult': 0.22461209489073608, 'sideways_time_stop': 76, 'sideways_use_sma': False, 'sideways_use_ema': True, 'sideways_use_atr': False, 'sideways_use_adx': False, 'sideways_use_spike': False, 'sideways_rsi_required': False}.
[I 2025-09-01 10:05:38,489] Trial 406 finished with values: [-0.21627458275434097, 0.21610176668548903] and parameters: {'p_sma': 42, 'p_std': 40, 'p_atr': 26, 'p_adx': 23, 'rsi_period': 64, 'ema1': 23, 'ema2': 49, 'slip_atr_k': 0.24407754424519293, 'slip_spread_k': 0.5465652802498631, 'spread_hl_frac': 0.023085341087985642, 'bb_std_mult': 2.551021605987952, 'rsi_os': 30, 'rsi_ob': 74, 'vol_spike': 0.030307774575803734, 'adx_thresh': 6.510815723335828, 'atr_min_pct': 0.025809259975339675, 'atr_max_pct': 0.05148080043292565, 'tp_mult': 2.489884962479158, 'tsl_mult': 0.6145126908218783, 'strategy': 'breakout', 'time_stop': 67, 'use_sma': True, 'use_atr': False, 'use_adx': True, 'use_ema': False, 'use_spike': False, 'rsi_required': False, 'edge_k': 0.9341457476827596, 'edge_cap': 0.5885939458206849, 'bull_strategy': 'mean_reversion', 'bull_bb_std_mult': 2.9055265994598125, 'bull_rsi_os': 20, 'bull_rsi_ob': 63, 'bull_adx_thresh': 23.003333157783445, 'bull_atr_min_pct': 0.0005106193025448021, 'bull_atr_max_pct': 0.08728918211832155, 'bull_tp_mult': 1.8883857151687964, 'bull_tsl_mult': 0.2699038044228743, 'bull_time_stop': 54, 'bull_use_sma': False, 'bull_use_ema': False, 'bull_use_atr': True, 'bull_use_adx': True, 'bull_use_spike': False, 'bull_rsi_required': True, 'bear_strategy': 'mean_reversion', 'bear_bb_std_mult': 1.4139730459425623, 'bear_rsi_os': 46, 'bear_rsi_ob': 46, 'bear_adx_thresh': 13.228388825558612, 'bear_atr_min_pct': 0.016438100261098508, 'bear_atr_max_pct': 0.07378327825532126, 'bear_tp_mult': 1.7195503180512288, 'bear_tsl_mult': 0.4829846052345052, 'bear_time_stop': 120, 'bear_use_sma': False, 'bear_use_ema': True, 'bear_use_atr': True, 'bear_use_adx': False, 'bear_use_spike': True, 'bear_rsi_required': False, 'sideways_strategy': 'breakout', 'sideways_bb_std_mult': 3.2775458220298557, 'sideways_rsi_os': 50, 'sideways_rsi_ob': 51, 'sideways_adx_thresh': 27.22826933052991, 'sideways_atr_min_pct': 0.0025538349843267547, 'sideways_atr_max_pct': 0.06553396989019715, 'sideways_tp_mult': 2.6626969759035406, 'sideways_tsl_mult': 0.509268334861524, 'sideways_time_stop': 202, 'sideways_use_sma': False, 'sideways_use_ema': True, 'sideways_use_atr': False, 'sideways_use_adx': False, 'sideways_use_spike': False, 'sideways_rsi_required': False}.
[I 2025-09-01 10:05:40,005] Trial 410 finished with values: [-1000000000.0, 1000000000.0] and parameters: {'p_sma': 18, 'p_std': 34, 'p_atr': 25, 'p_adx': 10, 'rsi_period': 72, 'ema1': 6, 'ema2': 35, 'slip_atr_k': 0.036414476599430284, 'slip_spread_k': 0.38588169747074696, 'spread_hl_frac': 0.03085447059501216, 'bb_std_mult': 2.987210253846708, 'rsi_os': 53, 'rsi_ob': 72, 'vol_spike': 0.2646826130175113, 'adx_thresh': 33.325140921675676, 'atr_min_pct': 0.025932283537169754, 'atr_max_pct': 0.07596751402321512, 'tp_mult': 2.5567761330822676, 'tsl_mult': 0.6164559376103348, 'strategy': 'breakout', 'time_stop': 153, 'use_sma': False, 'use_atr': False, 'use_adx': True, 'use_ema': False, 'use_spike': False, 'rsi_required': False, 'edge_k': 0.9284196550460317, 'edge_cap': 0.41930185963086214, 'bull_strategy': 'mean_reversion', 'bull_bb_std_mult': 0.7587084988934356, 'bull_rsi_os': 18, 'bull_rsi_ob': 85, 'bull_adx_thresh': 15.77574933667201, 'bull_atr_min_pct': 0.025566829345552877, 'bull_atr_max_pct': 0.08558426292108348, 'bull_tp_mult': 1.8925547695627098, 'bull_tsl_mult': 0.5304280679617617, 'bull_time_stop': 158, 'bull_use_sma': False, 'bull_use_ema': False, 'bull_use_atr': True, 'bull_use_adx': True, 'bull_use_spike': False, 'bull_rsi_required': True, 'bear_strategy': 'mean_reversion', 'bear_bb_std_mult': 1.7514903441722338, 'bear_rsi_os': 48, 'bear_rsi_ob': 46, 'bear_adx_thresh': 17.13934491619617, 'bear_atr_min_pct': 0.017008552965811084, 'bear_atr_max_pct': 0.10000050638825277, 'bear_tp_mult': 1.278451750276229, 'bear_tsl_mult': 0.4435851120076299, 'bear_time_stop': 76, 'bear_use_sma': False, 'bear_use_ema': True, 'bear_use_atr': True, 'bear_use_adx': False, 'bear_use_spike': True, 'bear_rsi_required': False, 'sideways_strategy': 'breakout', 'sideways_bb_std_mult': 3.271112182815512, 'sideways_rsi_os': 24, 'sideways_rsi_ob': 73, 'sideways_adx_thresh': 15.550159756571876, 'sideways_atr_min_pct': 0.019933152757348242, 'sideways_atr_max_pct': 0.05136523517602211, 'sideways_tp_mult': 1.329448847904413, 'sideways_tsl_mult': 0.8775574424605538, 'sideways_time_stop': 208, 'sideways_use_sma': True, 'sideways_use_ema': True, 'sideways_use_atr': False, 'sideways_use_adx': False, 'sideways_use_spike': False, 'sideways_rsi_required': False}.
[I 2025-09-01 10:06:18,884] Trial 411 finished with values: [-1000000000.0, 1000000000.0] and parameters: {'p_sma': 19, 'p_std': 46, 'p_atr': 24, 'p_adx': 30, 'rsi_period': 63, 'ema1': 29, 'ema2': 47, 'slip_atr_k': 0.0493925946638586, 'slip_spread_k': 0.46545228870359373, 'spread_hl_frac': 0.029834246376130764, 'bb_std_mult': 3.12024429514473, 'rsi_os': 48, 'rsi_ob': 76, 'vol_spike': 0.10643884090531827, 'adx_thresh': 11.37145703821329, 'atr_min_pct': 0.02292811279581101, 'atr_max_pct': 0.0757623316228855, 'tp_mult': 2.573725269363071, 'tsl_mult': 0.6767839537183612, 'strategy': 'breakout', 'time_stop': 77, 'use_sma': True, 'use_atr': False, 'use_adx': True, 'use_ema': False, 'use_spike': False, 'rsi_required': False, 'edge_k': 0.12400884155357161, 'edge_cap': 0.5261163970008927, 'bull_strategy': 'mean_reversion', 'bull_bb_std_mult': 0.7777228150246874, 'bull_rsi_os': 17, 'bull_rsi_ob': 54, 'bull_adx_thresh': 34.975602698993924, 'bull_atr_min_pct': 0.015628244068271513, 'bull_atr_max_pct': 0.07905992111042401, 'bull_tp_mult': 1.882849469786094, 'bull_tsl_mult': 0.07561980511206229, 'bull_time_stop': 157, 'bull_use_sma': True, 'bull_use_ema': False, 'bull_use_atr': True, 'bull_use_adx': True, 'bull_use_spike': False, 'bull_rsi_required': True, 'bear_strategy': 'mean_reversion', 'bear_bb_std_mult': 0.9614628721424072, 'bear_rsi_os': 17, 'bear_rsi_ob': 47, 'bear_adx_thresh': 16.48955666942269, 'bear_atr_min_pct': 0.01693363657093729, 'bear_atr_max_pct': 0.02238655912469567, 'bear_tp_mult': 1.0991289847832553, 'bear_tsl_mult': 0.43901359121643585, 'bear_time_stop': 131, 'bear_use_sma': False, 'bear_use_ema': True, 'bear_use_atr': True, 'bear_use_adx': True, 'bear_use_spike': True, 'bear_rsi_required': False, 'sideways_strategy': 'breakout', 'sideways_bb_std_mult': 3.397883056422542, 'sideways_rsi_os': 49, 'sideways_rsi_ob': 50, 'sideways_adx_thresh': 28.218303772122283, 'sideways_atr_min_pct': 0.003779634194042179, 'sideways_atr_max_pct': 0.14019757102482025, 'sideways_tp_mult': 1.48220341383159, 'sideways_tsl_mult': 0.2928457663257986, 'sideways_time_stop': 148, 'sideways_use_sma': False, 'sideways_use_ema': True, 'sideways_use_atr': False, 'sideways_use_adx': False, 'sideways_use_spike': False, 'sideways_rsi_required': False}.
[I 2025-09-01 10:06:19,888] Trial 412 finished with values: [-0.06007899927852467, 0.059767602756165446] and parameters: {'p_sma': 19, 'p_std': 34, 'p_atr': 25, 'p_adx': 9, 'rsi_period': 61, 'ema1': 15, 'ema2': 32, 'slip_atr_k': 0.24262270517623263, 'slip_spread_k': 0.19868518286858025, 'spread_hl_frac': 0.03040595380101438, 'bb_std_mult': 3.107250829775858, 'rsi_os': 48, 'rsi_ob': 68, 'vol_spike': 0.10401875123771029, 'adx_thresh': 17.389967198578276, 'atr_min_pct': 0.023713389364435213, 'atr_max_pct': 0.07572003558479147, 'tp_mult': 2.5475097738943298, 'tsl_mult': 0.13056040878094227, 'strategy': 'breakout', 'time_stop': 75, 'use_sma': True, 'use_atr': False, 'use_adx': True, 'use_ema': False, 'use_spike': False, 'rsi_required': False, 'edge_k': 0.13221810267956524, 'edge_cap': 0.7544466963372946, 'bull_strategy': 'mean_reversion', 'bull_bb_std_mult': 0.7643443119499083, 'bull_rsi_os': 26, 'bull_rsi_ob': 54, 'bull_adx_thresh': 5.981626054116227, 'bull_atr_min_pct': 0.0024913241248657354, 'bull_atr_max_pct': 0.0817611937987109, 'bull_tp_mult': 1.8752049815019491, 'bull_tsl_mult': 0.07541955477250206, 'bull_time_stop': 157, 'bull_use_sma': True, 'bull_use_ema': False, 'bull_use_atr': True, 'bull_use_adx': True, 'bull_use_spike': False, 'bull_rsi_required': True, 'bear_strategy': 'mean_reversion', 'bear_bb_std_mult': 2.1741885211862764, 'bear_rsi_os': 21, 'bear_rsi_ob': 91, 'bear_adx_thresh': 17.022116802224502, 'bear_atr_min_pct': 0.003928081432980188, 'bear_atr_max_pct': 0.01674826293050377, 'bear_tp_mult': 2.582050563254462, 'bear_tsl_mult': 0.6128840788685276, 'bear_time_stop': 130, 'bear_use_sma': False, 'bear_use_ema': True, 'bear_use_atr': True, 'bear_use_adx': False, 'bear_use_spike': True, 'bear_rsi_required': False, 'sideways_strategy': 'breakout', 'sideways_bb_std_mult': 3.378220368758898, 'sideways_rsi_os': 26, 'sideways_rsi_ob': 75, 'sideways_adx_thresh': 28.31616449846606, 'sideways_atr_min_pct': 0.0009238763689168161, 'sideways_atr_max_pct': 0.10953128489543298, 'sideways_tp_mult': 1.3958645603810582, 'sideways_tsl_mult': 0.32759565874917157, 'sideways_time_stop': 279, 'sideways_use_sma': False, 'sideways_use_ema': True, 'sideways_use_atr': False, 'sideways_use_adx': False, 'sideways_use_spike': False, 'sideways_rsi_required': False}.
[I 2025-09-01 10:06:20,659] Trial 413 finished with values: [-1000000000.0, 1000000000.0] and parameters: {'p_sma': 19, 'p_std': 34, 'p_atr': 25, 'p_adx': 25, 'rsi_period': 61, 'ema1': 21, 'ema2': 33, 'slip_atr_k': 0.027073460819706144, 'slip_spread_k': 0.19846384339896328, 'spread_hl_frac': 0.02986853811235302, 'bb_std_mult': 3.11703976917855, 'rsi_os': 20, 'rsi_ob': 76, 'vol_spike': 0.2812194925658248, 'adx_thresh': 5.707545727398188, 'atr_min_pct': 0.023699498871627492, 'atr_max_pct': 0.07509326646889555, 'tp_mult': 2.5706967610535094, 'tsl_mult': 0.06925579188898412, 'strategy': 'breakout', 'time_stop': 247, 'use_sma': True, 'use_atr': False, 'use_adx': True, 'use_ema': False, 'use_spike': False, 'rsi_required': False, 'edge_k': 0.3664805272536067, 'edge_cap': 0.3047520329688021, 'bull_strategy': 'mean_reversion', 'bull_bb_std_mult': 0.7674990950260716, 'bull_rsi_os': 18, 'bull_rsi_ob': 75, 'bull_adx_thresh': 10.678531418412991, 'bull_atr_min_pct': 0.015585406522010944, 'bull_atr_max_pct': 0.08199564596613229, 'bull_tp_mult': 2.5030631993907995, 'bull_tsl_mult': 0.5991381728304368, 'bull_time_stop': 157, 'bull_use_sma': True, 'bull_use_ema': False, 'bull_use_atr': True, 'bull_use_adx': True, 'bull_use_spike': False, 'bull_rsi_required': True, 'bear_strategy': 'mean_reversion', 'bear_bb_std_mult': 3.305053024516897, 'bear_rsi_os': 8, 'bear_rsi_ob': 47, 'bear_adx_thresh': 11.870986648039684, 'bear_atr_min_pct': 0.017258450556633626, 'bear_atr_max_pct': 0.06749261028523104, 'bear_tp_mult': 1.1103549844523892, 'bear_tsl_mult': 0.6129121969833746, 'bear_time_stop': 132, 'bear_use_sma': False, 'bear_use_ema': True, 'bear_use_atr': True, 'bear_use_adx': False, 'bear_use_spike': True, 'bear_rsi_required': True, 'sideways_strategy': 'mean_reversion', 'sideways_bb_std_mult': 2.646300113958739, 'sideways_rsi_os': 25, 'sideways_rsi_ob': 65, 'sideways_adx_thresh': 34.98048287507811, 'sideways_atr_min_pct': 0.01988048709043931, 'sideways_atr_max_pct': 0.054637343040343817, 'sideways_tp_mult': 1.4791166195449712, 'sideways_tsl_mult': 0.8760510832175312, 'sideways_time_stop': 256, 'sideways_use_sma': False, 'sideways_use_ema': True, 'sideways_use_atr': True, 'sideways_use_adx': False, 'sideways_use_spike': False, 'sideways_rsi_required': False}.
