[I 2025-09-01 09:15:30,914] Trial 109 finished with values: [-0.01674253345796073, 0.01689417080767473] and parameters: {'p_sma': 28, 'p_std': 27, 'p_atr': 15, 'p_adx': 15, 'rsi_period': 44, 'ema1': 19, 'ema2': 16, 'slip_atr_k': 0.051090586385253586, 'slip_spread_k': 0.3547059521904462, 'spread_hl_frac': 0.01221458188723569, 'bb_std_mult': 1.9754387346664293, 'rsi_os': 24, 'rsi_ob': 88, 'vol_spike': 0.2123738459445389, 'adx_thresh': 7.229594179130212, 'atr_min_pct': 0.0199421009358396, 'atr_max_pct': 0.1465263522824296, 'tp_mult': 1.7040643620061797, 'tsl_mult': 0.005661765108960857, 'strategy': 'breakout', 'time_stop': 193, 'use_sma': True, 'use_atr': False, 'use_adx': True, 'use_ema': False, 'use_spike': False, 'rsi_required': False, 'edge_k': 1.419142957625196, 'edge_cap': 0.07449931818098657, 'bull_strategy': 'mean_reversion', 'bull_bb_std_mult': 0.6734166514236921, 'bull_rsi_os': 20, 'bull_rsi_ob': 61, 'bull_adx_thresh': 5.890937283591564, 'bull_atr_min_pct': 0.028835902112443294, 'bull_atr_max_pct': 0.08001476770164385, 'bull_tp_mult': 2.099363667923207, 'bull_tsl_mult': 0.09206279765095496, 'bull_time_stop': 122, 'bull_use_sma': False, 'bull_use_ema': False, 'bull_use_atr': False, 'bull_use_adx': False, 'bull_use_spike': False, 'bull_rsi_required': True, 'bear_strategy': 'mean_reversion', 'bear_bb_std_mult': 2.100904248172857, 'bear_rsi_os': 44, 'bear_rsi_ob': 74, 'bear_adx_thresh': 11.808860685450018, 'bear_atr_min_pct': 0.014687088355017681, 'bear_atr_max_pct': 0.11914093970986489, 'bear_tp_mult': 2.346727690506927, 'bear_tsl_mult': 0.48000285226736966, 'bear_time_stop': 215, 'bear_use_sma': False, 'bear_use_ema': True, 'bear_use_atr': True, 'bear_use_adx': True, 'bear_use_spike': False, 'bear_rsi_required': False, 'sideways_strategy': 'breakout', 'sideways_bb_std_mult': 1.3115484292777466, 'sideways_rsi_os': 40, 'sideways_rsi_ob': 45, 'sideways_adx_thresh': 31.173679210262033, 'sideways_atr_min_pct': 0.004339281551347157, 'sideways_atr_max_pct': 0.08363879599395102, 'sideways_tp_mult': 1.7546747879038442, 'sideways_tsl_mult': 0.9447278424154876, 'sideways_time_stop': 191, 'sideways_use_sma': False, 'sideways_use_ema': True, 'sideways_use_atr': False, 'sideways_use_adx': False, 'sideways_use_spike': False, 'sideways_rsi_required': False}.
[I 2025-09-01 09:15:31,121] Trial 106 finished with values: [-1000000000.0, 1000000000.0] and parameters: {'p_sma': 29, 'p_std': 22, 'p_atr': 30, 'p_adx': 15, 'rsi_period': 69, 'ema1': 18, 'ema2': 15, 'slip_atr_k': 0.038476573738078106, 'slip_spread_k': 0.4192664093703794, 'spread_hl_frac': 0.015992633401019096, 'bb_std_mult': 1.9681641674044017, 'rsi_os': 24, 'rsi_ob': 89, 'vol_spike': 0.21273059491738824, 'adx_thresh': 6.928917192927295, 'atr_min_pct': 0.023959269215948438, 'atr_max_pct': 0.1410471722455354, 'tp_mult': 1.7783139060556208, 'tsl_mult': 0.8651006949852553, 'strategy': 'breakout', 'time_stop': 213, 'use_sma': True, 'use_atr': False, 'use_adx': True, 'use_ema': False, 'use_spike': False, 'rsi_required': False, 'edge_k': 1.3628493344011536, 'edge_cap': 0.08244677166187643, 'bull_strategy': 'mean_reversion', 'bull_bb_std_mult': 0.5878898741570364, 'bull_rsi_os': 20, 'bull_rsi_ob': 63, 'bull_adx_thresh': 5.8872500432095975, 'bull_atr_min_pct': 0.029436100392476437, 'bull_atr_max_pct': 0.06929628019632891, 'bull_tp_mult': 2.0926720279120192, 'bull_tsl_mult': 0.11337016953882398, 'bull_time_stop': 124, 'bull_use_sma': True, 'bull_use_ema': False, 'bull_use_atr': False, 'bull_use_adx': False, 'bull_use_spike': False, 'bull_rsi_required': True, 'bear_strategy': 'mean_reversion', 'bear_bb_std_mult': 3.585683978401852, 'bear_rsi_os': 45, 'bear_rsi_ob': 74, 'bear_adx_thresh': 14.226060820290035, 'bear_atr_min_pct': 0.016034086622192568, 'bear_atr_max_pct': 0.12548068577184793, 'bear_tp_mult': 2.341575380404534, 'bear_tsl_mult': 0.4301916499498567, 'bear_time_stop': 217, 'bear_use_sma': False, 'bear_use_ema': True, 'bear_use_atr': True, 'bear_use_adx': False, 'bear_use_spike': False, 'bear_rsi_required': False, 'sideways_strategy': 'breakout', 'sideways_bb_std_mult': 1.3723960536577147, 'sideways_rsi_os': 40, 'sideways_rsi_ob': 46, 'sideways_adx_thresh': 31.0323032840494, 'sideways_atr_min_pct': 0.005409168508837997, 'sideways_atr_max_pct': 0.07315643709161018, 'sideways_tp_mult': 1.7557520046345965, 'sideways_tsl_mult': 0.9531326866969795, 'sideways_time_stop': 216, 'sideways_use_sma': False, 'sideways_use_ema': True, 'sideways_use_atr': False, 'sideways_use_adx': False, 'sideways_use_spike': False, 'sideways_rsi_required': False}.
[I 2025-09-01 09:15:31,506] Trial 110 finished with values: [-1000000000.0, 1000000000.0] and parameters: {'p_sma': 27, 'p_std': 27, 'p_atr': 18, 'p_adx': 17, 'rsi_period': 33, 'ema1': 18, 'ema2': 20, 'slip_atr_k': 0.20233329219808416, 'slip_spread_k': 0.24182774337933444, 'spread_hl_frac': 0.012309824684253845, 'bb_std_mult': 1.9159840458820456, 'rsi_os': 20, 'rsi_ob': 85, 'vol_spike': 0.20909641700163192, 'adx_thresh': 7.498404842748493, 'atr_min_pct': 0.02027651868325648, 'atr_max_pct': 0.010197279781817281, 'tp_mult': 1.6925865904488564, 'tsl_mult': 0.007652773571316607, 'strategy': 'breakout', 'time_stop': 190, 'use_sma': True, 'use_atr': False, 'use_adx': True, 'use_ema': False, 'use_spike': False, 'rsi_required': False, 'edge_k': 1.5904553356301285, 'edge_cap': 0.182982147254484, 'bull_strategy': 'mean_reversion', 'bull_bb_std_mult': 1.112163027814175, 'bull_rsi_os': 15, 'bull_rsi_ob': 60, 'bull_adx_thresh': 6.3610589182842165, 'bull_atr_min_pct': 0.028294433709715655, 'bull_atr_max_pct': 0.08294367023830737, 'bull_tp_mult': 2.2157045344661896, 'bull_tsl_mult': 0.17408100565869608, 'bull_time_stop': 136, 'bull_use_sma': True, 'bull_use_ema': False, 'bull_use_atr': False, 'bull_use_adx': False, 'bull_use_spike': False, 'bull_rsi_required': True, 'bear_strategy': 'mean_reversion', 'bear_bb_std_mult': 3.517440242875764, 'bear_rsi_os': 48, 'bear_rsi_ob': 66, 'bear_adx_thresh': 21.99138788428105, 'bear_atr_min_pct': 0.01497738141821331, 'bear_atr_max_pct': 0.11810366400090408, 'bear_tp_mult': 2.1972701084898736, 'bear_tsl_mult': 0.48256160782169055, 'bear_time_stop': 240, 'bear_use_sma': False, 'bear_use_ema': True, 'bear_use_atr': True, 'bear_use_adx': True, 'bear_use_spike': False, 'bear_rsi_required': False, 'sideways_strategy': 'breakout', 'sideways_bb_std_mult': 0.831701676691627, 'sideways_rsi_os': 40, 'sideways_rsi_ob': 50, 'sideways_adx_thresh': 31.206441166466508, 'sideways_atr_min_pct': 0.017803682642511566, 'sideways_atr_max_pct': 0.07365562612442465, 'sideways_tp_mult': 2.041505694852699, 'sideways_tsl_mult': 0.9982226301555037, 'sideways_time_stop': 229, 'sideways_use_sma': False, 'sideways_use_ema': True, 'sideways_use_atr': False, 'sideways_use_adx': False, 'sideways_use_spike': False, 'sideways_rsi_required': False}.
[I 2025-09-01 09:16:11,224] Trial 111 finished with values: [-1000000000.0, 1000000000.0] and parameters: {'p_sma': 27, 'p_std': 17, 'p_atr': 16, 'p_adx': 17, 'rsi_period': 56, 'ema1': 18, 'ema2': 20, 'slip_atr_k': 0.20146476725163484, 'slip_spread_k': 0.26767450909637514, 'spread_hl_frac': 0.012178805533054822, 'bb_std_mult': 1.8249997450738322, 'rsi_os': 19, 'rsi_ob': 83, 'vol_spike': 0.20828112677881522, 'adx_thresh': 5.115782441875279, 'atr_min_pct': 0.023826315481481022, 'atr_max_pct': 0.05139626082393979, 'tp_mult': 1.948360916541888, 'tsl_mult': 0.008355014526369442, 'strategy': 'breakout', 'time_stop': 190, 'use_sma': True, 'use_atr': False, 'use_adx': True, 'use_ema': False, 'use_spike': False, 'rsi_required': False, 'edge_k': 1.5330956612184967, 'edge_cap': 0.12011714491591519, 'bull_strategy': 'mean_reversion', 'bull_bb_std_mult': 0.5354400924230894, 'bull_rsi_os': 15, 'bull_rsi_ob': 60, 'bull_adx_thresh': 7.638248980350536, 'bull_atr_min_pct': 0.02795659046476011, 'bull_atr_max_pct': 0.07526096950717123, 'bull_tp_mult': 2.212490037658818, 'bull_tsl_mult': 0.1843762163427321, 'bull_time_stop': 98, 'bull_use_sma': False, 'bull_use_ema': False, 'bull_use_atr': False, 'bull_use_adx': True, 'bull_use_spike': False, 'bull_rsi_required': True, 'bear_strategy': 'mean_reversion', 'bear_bb_std_mult': 3.5006219049311063, 'bear_rsi_os': 48, 'bear_rsi_ob': 66, 'bear_adx_thresh': 18.645081394107308, 'bear_atr_min_pct': 0.014872900055657699, 'bear_atr_max_pct': 0.11852429083577602, 'bear_tp_mult': 2.183957013995539, 'bear_tsl_mult': 0.48738481093632585, 'bear_time_stop': 225, 'bear_use_sma': False, 'bear_use_ema': True, 'bear_use_atr': True, 'bear_use_adx': False, 'bear_use_spike': False, 'bear_rsi_required': False, 'sideways_strategy': 'breakout', 'sideways_bb_std_mult': 0.8333959671596233, 'sideways_rsi_os': 18, 'sideways_rsi_ob': 49, 'sideways_adx_thresh': 30.89281500952571, 'sideways_atr_min_pct': 0.012357311549564313, 'sideways_atr_max_pct': 0.07194610484029836, 'sideways_tp_mult': 2.063292039245991, 'sideways_tsl_mult': 0.9859131028286297, 'sideways_time_stop': 206, 'sideways_use_sma': False, 'sideways_use_ema': True, 'sideways_use_atr': False, 'sideways_use_adx': False, 'sideways_use_spike': False, 'sideways_rsi_required': False}.
[I 2025-09-01 09:16:12,564] Trial 113 finished with values: [-1000000000.0, 1000000000.0] and parameters: {'p_sma': 23, 'p_std': 17, 'p_atr': 16, 'p_adx': 17, 'rsi_period': 44, 'ema1': 18, 'ema2': 20, 'slip_atr_k': 0.03207419924406787, 'slip_spread_k': 0.3234052107239659, 'spread_hl_frac': 0.046893358826893154, 'bb_std_mult': 1.8320616649396348, 'rsi_os': 20, 'rsi_ob': 84, 'vol_spike': 0.20934826554269903, 'adx_thresh': 5.26905730093841, 'atr_min_pct': 0.02025291893152262, 'atr_max_pct': 0.13623731910964895, 'tp_mult': 1.9483880473249253, 'tsl_mult': 0.08291835517725026, 'strategy': 'breakout', 'time_stop': 188, 'use_sma': True, 'use_atr': False, 'use_adx': True, 'use_ema': False, 'use_spike': False, 'rsi_required': False, 'edge_k': 1.5963469174921259, 'edge_cap': 0.1709821286429536, 'bull_strategy': 'mean_reversion', 'bull_bb_std_mult': 0.5262237047282119, 'bull_rsi_os': 15, 'bull_rsi_ob': 58, 'bull_adx_thresh': 8.841930890796986, 'bull_atr_min_pct': 0.028130228984412753, 'bull_atr_max_pct': 0.08228697689231401, 'bull_tp_mult': 2.2095477036629534, 'bull_tsl_mult': 0.17490708833464164, 'bull_time_stop': 135, 'bull_use_sma': False, 'bull_use_ema': False, 'bull_use_atr': False, 'bull_use_adx': True, 'bull_use_spike': False, 'bull_rsi_required': True, 'bear_strategy': 'mean_reversion', 'bear_bb_std_mult': 3.5027042472302936, 'bear_rsi_os': 48, 'bear_rsi_ob': 69, 'bear_adx_thresh': 18.026937120831406, 'bear_atr_min_pct': 0.014836935502794388, 'bear_atr_max_pct': 0.1182802614140873, 'bear_tp_mult': 2.3001222674936206, 'bear_tsl_mult': 0.4736677438492235, 'bear_time_stop': 225, 'bear_use_sma': False, 'bear_use_ema': True, 'bear_use_atr': True, 'bear_use_adx': True, 'bear_use_spike': False, 'bear_rsi_required': False, 'sideways_strategy': 'breakout', 'sideways_bb_std_mult': 0.8185703801651371, 'sideways_rsi_os': 29, 'sideways_rsi_ob': 49, 'sideways_adx_thresh': 29.49767637189774, 'sideways_atr_min_pct': 0.012495244890611136, 'sideways_atr_max_pct': 0.07096813109683428, 'sideways_tp_mult': 1.680970849743003, 'sideways_tsl_mult': 0.9955010492017857, 'sideways_time_stop': 205, 'sideways_use_sma': False, 'sideways_use_ema': True, 'sideways_use_atr': False, 'sideways_use_adx': False, 'sideways_use_spike': True, 'sideways_rsi_required': True}.
[I 2025-09-01 09:16:12,842] Trial 112 finished with values: [-1000000000.0, 1000000000.0] and parameters: {'p_sma': 23, 'p_std': 27, 'p_atr': 16, 'p_adx': 17, 'rsi_period': 49, 'ema1': 18, 'ema2': 20, 'slip_atr_k': 0.03414493846287932, 'slip_spread_k': 0.32886904050093024, 'spread_hl_frac': 0.012279238169940547, 'bb_std_mult': 1.787457772258801, 'rsi_os': 15, 'rsi_ob': 84, 'vol_spike': 0.20489526785985668, 'adx_thresh': 5.616857659620722, 'atr_min_pct': 0.020507896533465672, 'atr_max_pct': 0.1368218799506953, 'tp_mult': 1.9403903204166464, 'tsl_mult': 0.011344970988955354, 'strategy': 'breakout', 'time_stop': 192, 'use_sma': True, 'use_atr': False, 'use_adx': True, 'use_ema': False, 'use_spike': False, 'rsi_required': False, 'edge_k': 1.513465540747427, 'edge_cap': 0.19518938726129148, 'bull_strategy': 'mean_reversion', 'bull_bb_std_mult': 0.5017654287250125, 'bull_rsi_os': 15, 'bull_rsi_ob': 60, 'bull_adx_thresh': 8.384901869322787, 'bull_atr_min_pct': 0.028012855074407095, 'bull_atr_max_pct': 0.14681202539333893, 'bull_tp_mult': 2.2028436076877846, 'bull_tsl_mult': 0.18116849270787339, 'bull_time_stop': 134, 'bull_use_sma': False, 'bull_use_ema': False, 'bull_use_atr': False, 'bull_use_adx': True, 'bull_use_spike': False, 'bull_rsi_required': True, 'bear_strategy': 'mean_reversion', 'bear_bb_std_mult': 3.5144494971222913, 'bear_rsi_os': 49, 'bear_rsi_ob': 66, 'bear_adx_thresh': 17.973773809598143, 'bear_atr_min_pct': 0.014973902119466065, 'bear_atr_max_pct': 0.11788237416721792, 'bear_tp_mult': 2.1948174722363754, 'bear_tsl_mult': 0.47711835597684193, 'bear_time_stop': 227, 'bear_use_sma': False, 'bear_use_ema': True, 'bear_use_atr': True, 'bear_use_adx': True, 'bear_use_spike': False, 'bear_rsi_required': False, 'sideways_strategy': 'breakout', 'sideways_bb_std_mult': 0.8246130034081081, 'sideways_rsi_os': 18, 'sideways_rsi_ob': 50, 'sideways_adx_thresh': 29.32978018374735, 'sideways_atr_min_pct': 0.023539419464046692, 'sideways_atr_max_pct': 0.06979948192755613, 'sideways_tp_mult': 1.6620888517560977, 'sideways_tsl_mult': 0.870621651241892, 'sideways_time_stop': 227, 'sideways_use_sma': False, 'sideways_use_ema': True, 'sideways_use_atr': False, 'sideways_use_adx': False, 'sideways_use_spike': True, 'sideways_rsi_required': True}.
[I 2025-09-01 09:16:13,009] Trial 114 finished with values: [-1000000000.0, 1000000000.0] and parameters: {'p_sma': 23, 'p_std': 24, 'p_atr': 16, 'p_adx': 12, 'rsi_period': 44, 'ema1': 20, 'ema2': 19, 'slip_atr_k': 0.048983657412064126, 'slip_spread_k': 0.31882762465050446, 'spread_hl_frac': 0.047014967758281345, 'bb_std_mult': 1.8153478170413795, 'rsi_os': 18, 'rsi_ob': 92, 'vol_spike': 0.19634595013209166, 'adx_thresh': 5.0203847883626604, 'atr_min_pct': 0.01897143828400208, 'atr_max_pct': 0.13667685473010155, 'tp_mult': 1.9305175992574517, 'tsl_mult': 0.08439289804186328, 'strategy': 'breakout', 'time_stop': 227, 'use_sma': True, 'use_atr': False, 'use_adx': True, 'use_ema': False, 'use_spike': False, 'rsi_required': False, 'edge_k': 1.2967936921586527, 'edge_cap': 0.12859233052680563, 'bull_strategy': 'mean_reversion', 'bull_bb_std_mult': 0.7736445854014808, 'bull_rsi_os': 18, 'bull_rsi_ob': 58, 'bull_adx_thresh': 7.656537235847291, 'bull_atr_min_pct': 0.027826549369882582, 'bull_atr_max_pct': 0.07573679523952974, 'bull_tp_mult': 1.8476828072269562, 'bull_tsl_mult': 0.0626749662616107, 'bull_time_stop': 136, 'bull_use_sma': False, 'bull_use_ema': False, 'bull_use_atr': False, 'bull_use_adx': True, 'bull_use_spike': False, 'bull_rsi_required': True, 'bear_strategy': 'mean_reversion', 'bear_bb_std_mult': 3.4940029898891534, 'bear_rsi_os': 43, 'bear_rsi_ob': 72, 'bear_adx_thresh': 29.54639506117251, 'bear_atr_min_pct': 0.01493018987587557, 'bear_atr_max_pct': 0.11265154792818757, 'bear_tp_mult': 2.61418425191863, 'bear_tsl_mult': 0.9540113526046674, 'bear_time_stop': 224, 'bear_use_sma': False, 'bear_use_ema': True, 'bear_use_atr': True, 'bear_use_adx': False, 'bear_use_spike': False, 'bear_rsi_required': False, 'sideways_strategy': 'breakout', 'sideways_bb_std_mult': 1.192017446377922, 'sideways_rsi_os': 43, 'sideways_rsi_ob': 48, 'sideways_adx_thresh': 29.785356428089937, 'sideways_atr_min_pct': 0.0119140976798362, 'sideways_atr_max_pct': 0.06894611075567113, 'sideways_tp_mult': 1.8247125756303988, 'sideways_tsl_mult': 0.9293749449472412, 'sideways_time_stop': 206, 'sideways_use_sma': False, 'sideways_use_ema': True, 'sideways_use_atr': False, 'sideways_use_adx': False, 'sideways_use_spike': True, 'sideways_rsi_required': True}.
[I 2025-09-01 09:16:51,516] Trial 118 finished with values: [-1000000000.0, 1000000000.0] and parameters: {'p_sma': 32, 'p_std': 23, 'p_atr': 18, 'p_adx': 13, 'rsi_period': 60, 'ema1': 14, 'ema2': 17, 'slip_atr_k': 0.02540998382008024, 'slip_spread_k': 0.284628287539489, 'spread_hl_frac': 0.009576839115017957, 'bb_std_mult': 2.0920307795752993, 'rsi_os': 12, 'rsi_ob': 87, 'vol_spike': 0.22295743391625975, 'adx_thresh': 8.61239407231434, 'atr_min_pct': 0.01821981760788911, 'atr_max_pct': 0.05713507150416515, 'tp_mult': 1.6128997637597347, 'tsl_mult': 0.768209805315899, 'strategy': 'breakout', 'time_stop': 221, 'use_sma': True, 'use_atr': False, 'use_adx': True, 'use_ema': False, 'use_spike': True, 'rsi_required': False, 'edge_k': 0.42523373301738854, 'edge_cap': 0.05871908046868374, 'bull_strategy': 'mean_reversion', 'bull_bb_std_mult': 0.8510779694514804, 'bull_rsi_os': 23, 'bull_rsi_ob': 57, 'bull_adx_thresh': 9.836106849835879, 'bull_atr_min_pct': 0.029940909972528726, 'bull_atr_max_pct': 0.07890074465239642, 'bull_tp_mult': 2.2827287239363945, 'bull_tsl_mult': 0.0698664475427063, 'bull_time_stop': 113, 'bull_use_sma': True, 'bull_use_ema': False, 'bull_use_atr': False, 'bull_use_adx': False, 'bull_use_spike': False, 'bull_rsi_required': True, 'bear_strategy': 'mean_reversion', 'bear_bb_std_mult': 3.3797821259420986, 'bear_rsi_os': 46, 'bear_rsi_ob': 61, 'bear_adx_thresh': 12.044297485284241, 'bear_atr_min_pct': 0.017990792731771458, 'bear_atr_max_pct': 0.02341694219392195, 'bear_tp_mult': 2.0455623373813734, 'bear_tsl_mult': 0.5328123961042, 'bear_time_stop': 210, 'bear_use_sma': False, 'bear_use_ema': True, 'bear_use_atr': True, 'bear_use_adx': False, 'bear_use_spike': False, 'bear_rsi_required': False, 'sideways_strategy': 'breakout', 'sideways_bb_std_mult': 1.0108375372473841, 'sideways_rsi_os': 37, 'sideways_rsi_ob': 46, 'sideways_adx_thresh': 27.7238731096217, 'sideways_atr_min_pct': 0.00461973941663917, 'sideways_atr_max_pct': 0.08901390851988691, 'sideways_tp_mult': 1.8506008793480522, 'sideways_tsl_mult': 0.9058509857121584, 'sideways_time_stop': 62, 'sideways_use_sma': False, 'sideways_use_ema': True, 'sideways_use_atr': False, 'sideways_use_adx': False, 'sideways_use_spike': False, 'sideways_rsi_required': False}.
[I 2025-09-01 09:16:51,528] Trial 116 finished with values: [-0.08145146728080277, 0.08129274162130931] and parameters: {'p_sma': 24, 'p_std': 24, 'p_atr': 17, 'p_adx': 12, 'rsi_period': 60, 'ema1': 20, 'ema2': 17, 'slip_atr_k': 0.04988446023062638, 'slip_spread_k': 0.28826194087482365, 'spread_hl_frac': 0.014442372216387746, 'bb_std_mult': 1.6863864569507325, 'rsi_os': 16, 'rsi_ob': 92, 'vol_spike': 0.00767673455865453, 'adx_thresh': 6.014093408893527, 'atr_min_pct': 0.019048577526175458, 'atr_max_pct': 0.14678181053231198, 'tp_mult': 1.6251672339262138, 'tsl_mult': 0.05459200507361453, 'strategy': 'breakout', 'time_stop': 227, 'use_sma': True, 'use_atr': False, 'use_adx': True, 'use_ema': False, 'use_spike': False, 'rsi_required': False, 'edge_k': 1.5139922799839423, 'edge_cap': 0.05649732653335074, 'bull_strategy': 'mean_reversion', 'bull_bb_std_mult': 0.8386603407168388, 'bull_rsi_os': 18, 'bull_rsi_ob': 57, 'bull_adx_thresh': 11.967471807737759, 'bull_atr_min_pct': 0.029977089387225223, 'bull_atr_max_pct': 0.11782408000363076, 'bull_tp_mult': 2.2960576252242464, 'bull_tsl_mult': 0.05312567914537106, 'bull_time_stop': 113, 'bull_use_sma': True, 'bull_use_ema': False, 'bull_use_atr': False, 'bull_use_adx': False, 'bull_use_spike': False, 'bull_rsi_required': True, 'bear_strategy': 'mean_reversion', 'bear_bb_std_mult': 1.3734040940138152, 'bear_rsi_os': 44, 'bear_rsi_ob': 62, 'bear_adx_thresh': 29.39518907338558, 'bear_atr_min_pct': 0.0016515151479148203, 'bear_atr_max_pct': 0.11252037837071183, 'bear_tp_mult': 2.0403280151597456, 'bear_tsl_mult': 0.95309699773628, 'bear_time_stop': 229, 'bear_use_sma': False, 'bear_use_ema': True, 'bear_use_atr': True, 'bear_use_adx': False, 'bear_use_spike': False, 'bear_rsi_required': False, 'sideways_strategy': 'breakout', 'sideways_bb_std_mult': 0.9939907676139077, 'sideways_rsi_os': 43, 'sideways_rsi_ob': 46, 'sideways_adx_thresh': 27.256972405659695, 'sideways_atr_min_pct': 0.0025220405156639748, 'sideways_atr_max_pct': 0.0688896247659232, 'sideways_tp_mult': 1.9092091899384669, 'sideways_tsl_mult': 0.8884058896729233, 'sideways_time_stop': 147, 'sideways_use_sma': False, 'sideways_use_ema': True, 'sideways_use_atr': False, 'sideways_use_adx': False, 'sideways_use_spike': False, 'sideways_rsi_required': False}.
