[I 2025-09-01 09:12:45,926] Trial 91 finished with values: [-0.03893340708756987, 0.03913728396154198] and parameters: {'p_sma': 17, 'p_std': 31, 'p_atr': 21, 'p_adx': 7, 'rsi_period': 11, 'ema1': 24, 'ema2': 24, 'slip_atr_k': 0.0938175315724219, 'slip_spread_k': 0.6440643767216055, 'spread_hl_frac': 0.019046220516004006, 'bb_std_mult': 1.2719313851452365, 'rsi_os': 7, 'rsi_ob': 72, 'vol_spike': 0.2915691142330479, 'adx_thresh': 24.64153850972294, 'atr_min_pct': 0.01661675990434558, 'atr_max_pct': 0.02324591324265679, 'tp_mult': 2.053976615509106, 'tsl_mult': 0.15683357093859032, 'strategy': 'mean_reversion', 'time_stop': 169, 'use_sma': False, 'use_atr': False, 'use_adx': True, 'use_ema': False, 'use_spike': False, 'rsi_required': False, 'edge_k': 1.9219425064894504, 'edge_cap': 0.7862527522709355, 'bull_strategy': 'breakout', 'bull_bb_std_mult': 1.9691704683824975, 'bull_rsi_os': 48, 'bull_rsi_ob': 63, 'bull_adx_thresh': 31.663828464616472, 'bull_atr_min_pct': 0.02012390488091205, 'bull_atr_max_pct': 0.13996965289899777, 'bull_tp_mult': 1.1196528535279464, 'bull_tsl_mult': 0.6241691157041935, 'bull_time_stop': 158, 'bull_use_sma': True, 'bull_use_ema': True, 'bull_use_atr': False, 'bull_use_adx': False, 'bull_use_spike': True, 'bull_rsi_required': False, 'bear_strategy': 'mean_reversion', 'bear_bb_std_mult': 2.9578289733616523, 'bear_rsi_os': 52, 'bear_rsi_ob': 47, 'bear_adx_thresh': 16.83453599761819, 'bear_atr_min_pct': 0.012466215157175048, 'bear_atr_max_pct': 0.015393364779129226, 'bear_tp_mult': 1.7028367539544034, 'bear_tsl_mult': 0.8108624254878332, 'bear_time_stop': 174, 'bear_use_sma': False, 'bear_use_ema': False, 'bear_use_atr': True, 'bear_use_adx': False, 'bear_use_spike': False, 'bear_rsi_required': False, 'sideways_strategy': 'breakout', 'sideways_bb_std_mult': 2.7715009760557385, 'sideways_rsi_os': 49, 'sideways_rsi_ob': 74, 'sideways_adx_thresh': 19.25328606222396, 'sideways_atr_min_pct': 0.0034990665404875396, 'sideways_atr_max_pct': 0.05037725356822108, 'sideways_tp_mult': 1.354247130544014, 'sideways_tsl_mult': 0.6314348964547583, 'sideways_time_stop': 74, 'sideways_use_sma': False, 'sideways_use_ema': True, 'sideways_use_atr': False, 'sideways_use_adx': False, 'sideways_use_spike': False, 'sideways_rsi_required': False}.
[I 2025-09-01 09:12:45,982] Trial 92 finished with values: [-1000000000.0, 0.7293273642354545] and parameters: {'p_sma': 31, 'p_std': 21, 'p_atr': 11, 'p_adx': 7, 'rsi_period': 11, 'ema1': 24, 'ema2': 46, 'slip_atr_k': 0.07218948076561366, 'slip_spread_k': 0.7042382981939015, 'spread_hl_frac': 0.00849133564919505, 'bb_std_mult': 1.2532525301762127, 'rsi_os': 6, 'rsi_ob': 77, 'vol_spike': 0.29140530350225713, 'adx_thresh': 24.810694099995388, 'atr_min_pct': 0.016169746056497684, 'atr_max_pct': 0.04788717992297081, 'tp_mult': 2.0350113993093473, 'tsl_mult': 0.1601891972051927, 'strategy': 'mean_reversion', 'time_stop': 92, 'use_sma': False, 'use_atr': False, 'use_adx': True, 'use_ema': False, 'use_spike': False, 'rsi_required': False, 'edge_k': 1.9403354656349285, 'edge_cap': 0.8320723150685119, 'bull_strategy': 'breakout', 'bull_bb_std_mult': 2.081718974985355, 'bull_rsi_os': 10, 'bull_rsi_ob': 47, 'bull_adx_thresh': 28.23296026962029, 'bull_atr_min_pct': 0.02024854659999498, 'bull_atr_max_pct': 0.045525987052234665, 'bull_tp_mult': 1.1116568982454424, 'bull_tsl_mult': 0.7656169425278245, 'bull_time_stop': 245, 'bull_use_sma': True, 'bull_use_ema': True, 'bull_use_atr': True, 'bull_use_adx': False, 'bull_use_spike': True, 'bull_rsi_required': True, 'bear_strategy': 'mean_reversion', 'bear_bb_std_mult': 0.7695781593166455, 'bear_rsi_os': 12, 'bear_rsi_ob': 55, 'bear_adx_thresh': 8.759940058440622, 'bear_atr_min_pct': 0.01043688074526327, 'bear_atr_max_pct': 0.07656756854170786, 'bear_tp_mult': 1.7112104913869832, 'bear_tsl_mult': 0.8065159632591385, 'bear_time_stop': 141, 'bear_use_sma': False, 'bear_use_ema': False, 'bear_use_atr': True, 'bear_use_adx': False, 'bear_use_spike': False, 'bear_rsi_required': False, 'sideways_strategy': 'breakout', 'sideways_bb_std_mult': 2.5846783825957065, 'sideways_rsi_os': 49, 'sideways_rsi_ob': 73, 'sideways_adx_thresh': 18.95026322884863, 'sideways_atr_min_pct': 0.0002966222816598073, 'sideways_atr_max_pct': 0.05039801138696915, 'sideways_tp_mult': 1.3429053582011918, 'sideways_tsl_mult': 0.44078228024062516, 'sideways_time_stop': 205, 'sideways_use_sma': False, 'sideways_use_ema': False, 'sideways_use_atr': False, 'sideways_use_adx': False, 'sideways_use_spike': False, 'sideways_rsi_required': False}.
[I 2025-09-01 09:12:46,570] Trial 93 finished with values: [-1000000000.0, 0.6433170538105064] and parameters: {'p_sma': 17, 'p_std': 26, 'p_atr': 11, 'p_adx': 7, 'rsi_period': 11, 'ema1': 24, 'ema2': 22, 'slip_atr_k': 0.07129638222651642, 'slip_spread_k': 0.9816676575962924, 'spread_hl_frac': 0.008675784661926773, 'bb_std_mult': 1.746802105195477, 'rsi_os': 6, 'rsi_ob': 77, 'vol_spike': 0.2506844584893945, 'adx_thresh': 25.99414579786077, 'atr_min_pct': 0.01614365241538786, 'atr_max_pct': 0.13938080798340596, 'tp_mult': 1.2048576844455843, 'tsl_mult': 0.15148318278643497, 'strategy': 'breakout', 'time_stop': 243, 'use_sma': False, 'use_atr': False, 'use_adx': True, 'use_ema': False, 'use_spike': False, 'rsi_required': False, 'edge_k': 1.8086016634346775, 'edge_cap': 0.11052130395408444, 'bull_strategy': 'breakout', 'bull_bb_std_mult': 2.0869988895593528, 'bull_rsi_os': 11, 'bull_rsi_ob': 54, 'bull_adx_thresh': 17.277762991210956, 'bull_atr_min_pct': 0.026058362275514897, 'bull_atr_max_pct': 0.05752386938957252, 'bull_tp_mult': 1.1281872041116425, 'bull_tsl_mult': 0.6983225516847597, 'bull_time_stop': 285, 'bull_use_sma': True, 'bull_use_ema': True, 'bull_use_atr': False, 'bull_use_adx': False, 'bull_use_spike': True, 'bull_rsi_required': True, 'bear_strategy': 'mean_reversion', 'bear_bb_std_mult': 2.963158769653891, 'bear_rsi_os': 13, 'bear_rsi_ob': 47, 'bear_adx_thresh': 8.97433198336924, 'bear_atr_min_pct': 0.012624674285154618, 'bear_atr_max_pct': 0.017728599476439337, 'bear_tp_mult': 1.7137482591914006, 'bear_tsl_mult': 0.6626616352555771, 'bear_time_stop': 175, 'bear_use_sma': False, 'bear_use_ema': False, 'bear_use_atr': True, 'bear_use_adx': False, 'bear_use_spike': False, 'bear_rsi_required': False, 'sideways_strategy': 'breakout', 'sideways_bb_std_mult': 0.7422883185299367, 'sideways_rsi_os': 35, 'sideways_rsi_ob': 73, 'sideways_adx_thresh': 18.75178909100514, 'sideways_atr_min_pct': 0.00010246047499236528, 'sideways_atr_max_pct': 0.060389564997418446, 'sideways_tp_mult': 1.3463135114855405, 'sideways_tsl_mult': 0.43264351799021017, 'sideways_time_stop': 103, 'sideways_use_sma': False, 'sideways_use_ema': True, 'sideways_use_atr': False, 'sideways_use_adx': False, 'sideways_use_spike': False, 'sideways_rsi_required': False}.
[I 2025-09-01 09:12:47,066] Trial 90 finished with values: [-0.02154753044251123, 0.021286419342338214] and parameters: {'p_sma': 17, 'p_std': 50, 'p_atr': 14, 'p_adx': 7, 'rsi_period': 76, 'ema1': 24, 'ema2': 21, 'slip_atr_k': 0.050549913941468905, 'slip_spread_k': 0.8182615386293878, 'spread_hl_frac': 0.015333155237516683, 'bb_std_mult': 1.2650102235489749, 'rsi_os': 29, 'rsi_ob': 66, 'vol_spike': 0.22761138827630467, 'adx_thresh': 24.575688901979294, 'atr_min_pct': 0.014978815780394108, 'atr_max_pct': 0.04330540878518145, 'tp_mult': 2.033388804378251, 'tsl_mult': 0.15199609103946587, 'strategy': 'mean_reversion', 'time_stop': 77, 'use_sma': False, 'use_atr': False, 'use_adx': True, 'use_ema': False, 'use_spike': True, 'rsi_required': False, 'edge_k': 1.6790175541739312, 'edge_cap': 0.14807754193357475, 'bull_strategy': 'breakout', 'bull_bb_std_mult': 1.987689492002512, 'bull_rsi_os': 49, 'bull_rsi_ob': 46, 'bull_adx_thresh': 21.705973910069154, 'bull_atr_min_pct': 0.020133784234226963, 'bull_atr_max_pct': 0.0573939627058594, 'bull_tp_mult': 2.931595016182289, 'bull_tsl_mult': 0.7459937420357087, 'bull_time_stop': 288, 'bull_use_sma': True, 'bull_use_ema': True, 'bull_use_atr': True, 'bull_use_adx': False, 'bull_use_spike': True, 'bull_rsi_required': False, 'bear_strategy': 'mean_reversion', 'bear_bb_std_mult': 0.728436233752566, 'bear_rsi_os': 39, 'bear_rsi_ob': 60, 'bear_adx_thresh': 6.689319872031208, 'bear_atr_min_pct': 0.009856090153105637, 'bear_atr_max_pct': 0.09331229704387356, 'bear_tp_mult': 1.710494446087801, 'bear_tsl_mult': 0.8029821726311029, 'bear_time_stop': 171, 'bear_use_sma': False, 'bear_use_ema': False, 'bear_use_atr': True, 'bear_use_adx': False, 'bear_use_spike': False, 'bear_rsi_required': False, 'sideways_strategy': 'breakout', 'sideways_bb_std_mult': 2.5234993990750723, 'sideways_rsi_os': 43, 'sideways_rsi_ob': 73, 'sideways_adx_thresh': 21.823858471902554, 'sideways_atr_min_pct': 0.004204078786432165, 'sideways_atr_max_pct': 0.06055858250475576, 'sideways_tp_mult': 1.3084585900093941, 'sideways_tsl_mult': 0.4419835277491132, 'sideways_time_stop': 77, 'sideways_use_sma': False, 'sideways_use_ema': True, 'sideways_use_atr': False, 'sideways_use_adx': False, 'sideways_use_spike': False, 'sideways_rsi_required': False}.
[I 2025-09-01 09:13:25,557] Trial 96 finished with values: [-1000000000.0, 1000000000.0] and parameters: {'p_sma': 60, 'p_std': 56, 'p_atr': 14, 'p_adx': 15, 'rsi_period': 71, 'ema1': 28, 'ema2': 37, 'slip_atr_k': 0.09122401325553575, 'slip_spread_k': 0.6491952961786444, 'spread_hl_frac': 0.01920572745531261, 'bb_std_mult': 1.3210605572076475, 'rsi_os': 8, 'rsi_ob': 86, 'vol_spike': 0.2832462871187696, 'adx_thresh': 27.49644346707159, 'atr_min_pct': 0.01454524758320356, 'atr_max_pct': 0.0237408129869454, 'tp_mult': 1.0281208762541958, 'tsl_mult': 0.06464867501119356, 'strategy': 'mean_reversion', 'time_stop': 76, 'use_sma': False, 'use_atr': False, 'use_adx': True, 'use_ema': False, 'use_spike': False, 'rsi_required': False, 'edge_k': 1.6850096904848164, 'edge_cap': 0.8902888961067331, 'bull_strategy': 'breakout', 'bull_bb_std_mult': 1.9705216470367488, 'bull_rsi_os': 51, 'bull_rsi_ob': 53, 'bull_adx_thresh': 10.269724132742748, 'bull_atr_min_pct': 0.02417993768362019, 'bull_atr_max_pct': 0.10852851575605953, 'bull_tp_mult': 2.660848792203162, 'bull_tsl_mult': 0.6324782157852661, 'bull_time_stop': 288, 'bull_use_sma': True, 'bull_use_ema': True, 'bull_use_atr': True, 'bull_use_adx': False, 'bull_use_spike': True, 'bull_rsi_required': False, 'bear_strategy': 'mean_reversion', 'bear_bb_std_mult': 0.9301834344132711, 'bear_rsi_os': 49, 'bear_rsi_ob': 61, 'bear_adx_thresh': 13.546464797056922, 'bear_atr_min_pct': 0.011920647895756498, 'bear_atr_max_pct': 0.09693233752896187, 'bear_tp_mult': 1.949840310920552, 'bear_tsl_mult': 0.9012743667098602, 'bear_time_stop': 146, 'bear_use_sma': False, 'bear_use_ema': False, 'bear_use_atr': True, 'bear_use_adx': False, 'bear_use_spike': False, 'bear_rsi_required': False, 'sideways_strategy': 'breakout', 'sideways_bb_std_mult': 1.5908436171070675, 'sideways_rsi_os': 13, 'sideways_rsi_ob': 71, 'sideways_adx_thresh': 21.61739033569744, 'sideways_atr_min_pct': 0.005343353749219473, 'sideways_atr_max_pct': 0.05823838613885841, 'sideways_tp_mult': 1.6451312458473388, 'sideways_tsl_mult': 0.8814255855358604, 'sideways_time_stop': 228, 'sideways_use_sma': False, 'sideways_use_ema': False, 'sideways_use_atr': False, 'sideways_use_adx': False, 'sideways_use_spike': False, 'sideways_rsi_required': False}.
[I 2025-09-01 09:13:27,209] Trial 95 finished with values: [-1000000000.0, 1000000000.0] and parameters: {'p_sma': 9, 'p_std': 30, 'p_atr': 14, 'p_adx': 24, 'rsi_period': 72, 'ema1': 24, 'ema2': 22, 'slip_atr_k': 0.11112005305832044, 'slip_spread_k': 0.6377344444083843, 'spread_hl_frac': 0.01508960688330203, 'bb_std_mult': 1.4007702023328912, 'rsi_os': 7, 'rsi_ob': 87, 'vol_spike': 0.2540138662528036, 'adx_thresh': 25.66921714140535, 'atr_min_pct': 0.014777935957556446, 'atr_max_pct': 0.021281345796585978, 'tp_mult': 1.053404834656616, 'tsl_mult': 0.14014620621429397, 'strategy': 'breakout', 'time_stop': 171, 'use_sma': False, 'use_atr': False, 'use_adx': True, 'use_ema': False, 'use_spike': False, 'rsi_required': False, 'edge_k': 1.999724857072428, 'edge_cap': 0.15181290645953255, 'bull_strategy': 'breakout', 'bull_bb_std_mult': 1.9992159146274575, 'bull_rsi_os': 48, 'bull_rsi_ob': 54, 'bull_adx_thresh': 17.487974575901955, 'bull_atr_min_pct': 0.026873252878052045, 'bull_atr_max_pct': 0.13829774623290808, 'bull_tp_mult': 2.666158154563848, 'bull_tsl_mult': 0.6269272456416064, 'bull_time_stop': 288, 'bull_use_sma': True, 'bull_use_ema': True, 'bull_use_atr': False, 'bull_use_adx': False, 'bull_use_spike': True, 'bull_rsi_required': False, 'bear_strategy': 'mean_reversion', 'bear_bb_std_mult': 2.955706775260888, 'bear_rsi_os': 49, 'bear_rsi_ob': 47, 'bear_adx_thresh': 13.723995202475571, 'bear_atr_min_pct': 0.011822938711642956, 'bear_atr_max_pct': 0.10196193362351308, 'bear_tp_mult': 2.8321918154038537, 'bear_tsl_mult': 0.6739072473390576, 'bear_time_stop': 173, 'bear_use_sma': False, 'bear_use_ema': False, 'bear_use_atr': True, 'bear_use_adx': False, 'bear_use_spike': False, 'bear_rsi_required': False, 'sideways_strategy': 'breakout', 'sideways_bb_std_mult': 0.7518508474738379, 'sideways_rsi_os': 35, 'sideways_rsi_ob': 71, 'sideways_adx_thresh': 17.281880131699968, 'sideways_atr_min_pct': 0.0036405424592741743, 'sideways_atr_max_pct': 0.059952999551399086, 'sideways_tp_mult': 1.6331634837776055, 'sideways_tsl_mult': 0.40081732787364394, 'sideways_time_stop': 104, 'sideways_use_sma': False, 'sideways_use_ema': True, 'sideways_use_atr': False, 'sideways_use_adx': False, 'sideways_use_spike': False, 'sideways_rsi_required': False}.
[I 2025-09-01 09:13:27,209] Trial 94 finished with values: [-0.01472038501208206, 0.014424444606944236] and parameters: {'p_sma': 26, 'p_std': 26, 'p_atr': 16, 'p_adx': 15, 'rsi_period': 72, 'ema1': 24, 'ema2': 22, 'slip_atr_k': 0.04240662548690144, 'slip_spread_k': 0.26027870456989943, 'spread_hl_frac': 0.014332078117234607, 'bb_std_mult': 1.7622824011343459, 'rsi_os': 7, 'rsi_ob': 89, 'vol_spike': 0.25143937952851947, 'adx_thresh': 25.991785569097082, 'atr_min_pct': 0.016711666014122422, 'atr_max_pct': 0.13692136274694572, 'tp_mult': 1.824424178146323, 'tsl_mult': 0.06854971582151725, 'strategy': 'breakout', 'time_stop': 199, 'use_sma': False, 'use_atr': False, 'use_adx': True, 'use_ema': False, 'use_spike': False, 'rsi_required': False, 'edge_k': 1.6597775078495123, 'edge_cap': 0.10372090615938001, 'bull_strategy': 'breakout', 'bull_bb_std_mult': 1.986232337231675, 'bull_rsi_os': 17, 'bull_rsi_ob': 53, 'bull_adx_thresh': 17.27981778857748, 'bull_atr_min_pct': 0.027309754908771546, 'bull_atr_max_pct': 0.0564616912239302, 'bull_tp_mult': 2.163484264402964, 'bull_tsl_mult': 0.6159460393908697, 'bull_time_stop': 290, 'bull_use_sma': True, 'bull_use_ema': True, 'bull_use_atr': False, 'bull_use_adx': False, 'bull_use_spike': True, 'bull_rsi_required': False, 'bear_strategy': 'mean_reversion', 'bear_bb_std_mult': 3.408719013216725, 'bear_rsi_os': 49, 'bear_rsi_ob': 60, 'bear_adx_thresh': 12.992284051011879, 'bear_atr_min_pct': 0.011771836788797854, 'bear_atr_max_pct': 0.11784101330780308, 'bear_tp_mult': 2.242562034475852, 'bear_tsl_mult': 0.6469944640239298, 'bear_time_stop': 173, 'bear_use_sma': False, 'bear_use_ema': False, 'bear_use_atr': True, 'bear_use_adx': False, 'bear_use_spike': False, 'bear_rsi_required': False, 'sideways_strategy': 'breakout', 'sideways_bb_std_mult': 0.626528368241577, 'sideways_rsi_os': 41, 'sideways_rsi_ob': 71, 'sideways_adx_thresh': 28.948438003380623, 'sideways_atr_min_pct': 0.004088292747019509, 'sideways_atr_max_pct': 0.05747358013172796, 'sideways_tp_mult': 1.6449319106202287, 'sideways_tsl_mult': 0.9175087366146051, 'sideways_time_stop': 217, 'sideways_use_sma': False, 'sideways_use_ema': True, 'sideways_use_atr': False, 'sideways_use_adx': False, 'sideways_use_spike': False, 'sideways_rsi_required': False}.
[I 2025-09-01 09:13:27,477] Trial 97 finished with values: [-1000000000.0, 1000000000.0] and parameters: {'p_sma': 25, 'p_std': 47, 'p_atr': 14, 'p_adx': 26, 'rsi_period': 73, 'ema1': 21, 'ema2': 28, 'slip_atr_k': 0.027014892959383613, 'slip_spread_k': 0.8153032063897889, 'spread_hl_frac': 0.01405255505872842, 'bb_std_mult': 1.1389675341250336, 'rsi_os': 30, 'rsi_ob': 63, 'vol_spike': 0.22612085701977805, 'adx_thresh': 23.400410960702846, 'atr_min_pct': 0.017455446139984693, 'atr_max_pct': 0.04225651667239701, 'tp_mult': 2.320576508124498, 'tsl_mult': 0.3810939998983063, 'strategy': 'mean_reversion', 'time_stop': 115, 'use_sma': False, 'use_atr': False, 'use_adx': True, 'use_ema': False, 'use_spike': True, 'rsi_required': False, 'edge_k': 1.653603189472172, 'edge_cap': 0.1504017315348466, 'bull_strategy': 'breakout', 'bull_bb_std_mult': 1.7765461603612651, 'bull_rsi_os': 44, 'bull_rsi_ob': 45, 'bull_adx_thresh': 22.59091710825725, 'bull_atr_min_pct': 0.018723389860861334, 'bull_atr_max_pct': 0.07158568280198925, 'bull_tp_mult': 2.999221635500193, 'bull_tsl_mult': 0.7465723702205617, 'bull_time_stop': 255, 'bull_use_sma': True, 'bull_use_ema': True, 'bull_use_atr': True, 'bull_use_adx': False, 'bull_use_spike': True, 'bull_rsi_required': False, 'bear_strategy': 'mean_reversion', 'bear_bb_std_mult': 0.9198537005694825, 'bear_rsi_os': 41, 'bear_rsi_ob': 60, 'bear_adx_thresh': 7.231881191050189, 'bear_atr_min_pct': 0.008526235536624075, 'bear_atr_max_pct': 0.05217481609285648, 'bear_tp_mult': 1.4399855980314076, 'bear_tsl_mult': 0.9165575230564789, 'bear_time_stop': 184, 'bear_use_sma': False, 'bear_use_ema': False, 'bear_use_atr': True, 'bear_use_adx': False, 'bear_use_spike': False, 'bear_rsi_required': False, 'sideways_strategy': 'breakout', 'sideways_bb_std_mult': 2.7012650400201452, 'sideways_rsi_os': 45, 'sideways_rsi_ob': 75, 'sideways_adx_thresh': 28.581762536902367, 'sideways_atr_min_pct': 0.008245108855055404, 'sideways_atr_max_pct': 0.0794640537854306, 'sideways_tp_mult': 1.1508689013779776, 'sideways_tsl_mult': 0.39747604759363575, 'sideways_time_stop': 18, 'sideways_use_sma': False, 'sideways_use_ema': True, 'sideways_use_atr': False, 'sideways_use_adx': False, 'sideways_use_spike': False, 'sideways_rsi_required': False}.
[I 2025-09-01 09:14:08,266] Trial 99 finished with values: [-1000000000.0, 1000000000.0] and parameters: {'p_sma': 26, 'p_std': 24, 'p_atr': 17, 'p_adx': 14, 'rsi_period': 74, 'ema1': 21, 'ema2': 18, 'slip_atr_k': 0.04293704345691012, 'slip_spread_k': 0.2601141633066879, 'spread_hl_frac': 0.013166599969398406, 'bb_std_mult': 1.7891647080951798, 'rsi_os': 14, 'rsi_ob': 90, 'vol_spike': 0.2264685889146558, 'adx_thresh': 27.711879238119824, 'atr_min_pct': 0.026175144305990234, 'atr_max_pct': 0.14379590443034146, 'tp_mult': 1.8250826243052811, 'tsl_mult': 0.022173688066177637, 'strategy': 'breakout', 'time_stop': 200, 'use_sma': True, 'use_atr': False, 'use_adx': True, 'use_ema': False, 'use_spike': True, 'rsi_required': False, 'edge_k': 1.58468356551749, 'edge_cap': 0.06171374257943449, 'bull_strategy': 'mean_reversion', 'bull_bb_std_mult': 1.7470853221500366, 'bull_rsi_os': 17, 'bull_rsi_ob': 56, 'bull_adx_thresh': 7.7324527017959, 'bull_atr_min_pct': 0.02851334696679657, 'bull_atr_max_pct': 0.07280603590844618, 'bull_tp_mult': 2.143132334468343, 'bull_tsl_mult': 0.9401611217716095, 'bull_time_stop': 260, 'bull_use_sma': True, 'bull_use_ema': False, 'bull_use_atr': False, 'bull_use_adx': False, 'bull_use_spike': False, 'bull_rsi_required': False, 'bear_strategy': 'mean_reversion', 'bear_bb_std_mult': 3.5353260800910267, 'bear_rsi_os': 41, 'bear_rsi_ob': 66, 'bear_adx_thresh': 12.818070935636037, 'bear_atr_min_pct': 0.008737247385586136, 'bear_atr_max_pct': 0.11566537370196173, 'bear_tp_mult': 2.2192558375081726, 'bear_tsl_mult': 0.6248552914779378, 'bear_time_stop': 186, 'bear_use_sma': False, 'bear_use_ema': True, 'bear_use_atr': True, 'bear_use_adx': False, 'bear_use_spike': False, 'bear_rsi_required': False, 'sideways_strategy': 'breakout', 'sideways_bb_std_mult': 1.0572337034405332, 'sideways_rsi_os': 41, 'sideways_rsi_ob': 69, 'sideways_adx_thresh': 28.46311502562375, 'sideways_atr_min_pct': 0.006791145790511559, 'sideways_atr_max_pct': 0.07478229240993188, 'sideways_tp_mult': 1.815890178728868, 'sideways_tsl_mult': 0.8952442604528615, 'sideways_time_stop': 261, 'sideways_use_sma': False, 'sideways_use_ema': True, 'sideways_use_atr': False, 'sideways_use_adx': False, 'sideways_use_spike': False, 'sideways_rsi_required': False}.
