[I 2025-09-01 09:52:44,076] Trial 331 finished with values: [-0.15629116639851093, 0.15624366536280349] and parameters: {'p_sma': 19, 'p_std': 45, 'p_atr': 28, 'p_adx': 23, 'rsi_period': 42, 'ema1': 22, 'ema2': 50, 'slip_atr_k': 0.163219393911597, 'slip_spread_k': 0.12835545029049575, 'spread_hl_frac': 0.025342454663481367, 'bb_std_mult': 3.1691272443625005, 'rsi_os': 27, 'rsi_ob': 78, 'vol_spike': 0.27215419633670057, 'adx_thresh': 12.532288115094271, 'atr_min_pct': 0.025496058155595556, 'atr_max_pct': 0.08156946131881176, 'tp_mult': 2.830217389505927, 'tsl_mult': 0.10628253117171865, 'strategy': 'mean_reversion', 'time_stop': 146, 'use_sma': False, 'use_atr': True, 'use_adx': False, 'use_ema': True, 'use_spike': True, 'rsi_required': True, 'edge_k': 0.8709806513581441, 'edge_cap': 0.6050865868574958, 'bull_strategy': 'breakout', 'bull_bb_std_mult': 0.8307106440544038, 'bull_rsi_os': 22, 'bull_rsi_ob': 53, 'bull_adx_thresh': 5.517256610621778, 'bull_atr_min_pct': 0.029686047351242608, 'bull_atr_max_pct': 0.08349613849677429, 'bull_tp_mult': 1.9133460034907115, 'bull_tsl_mult': 0.003574262728255749, 'bull_time_stop': 163, 'bull_use_sma': False, 'bull_use_ema': True, 'bull_use_atr': True, 'bull_use_adx': True, 'bull_use_spike': True, 'bull_rsi_required': False, 'bear_strategy': 'breakout', 'bear_bb_std_mult': 3.296643336258781, 'bear_rsi_os': 34, 'bear_rsi_ob': 45, 'bear_adx_thresh': 19.27482987200704, 'bear_atr_min_pct': 0.018223324344823044, 'bear_atr_max_pct': 0.0770980128008031, 'bear_tp_mult': 1.2115543004561955, 'bear_tsl_mult': 0.47960659993265875, 'bear_time_stop': 121, 'bear_use_sma': True, 'bear_use_ema': False, 'bear_use_atr': False, 'bear_use_adx': True, 'bear_use_spike': True, 'bear_rsi_required': True, 'sideways_strategy': 'mean_reversion', 'sideways_bb_std_mult': 3.4400264513882384, 'sideways_rsi_os': 51, 'sideways_rsi_ob': 50, 'sideways_adx_thresh': 25.88222499768274, 'sideways_atr_min_pct': 0.0015546468579694488, 'sideways_atr_max_pct': 0.07801750207799846, 'sideways_tp_mult': 1.3271550040586848, 'sideways_tsl_mult': 0.8271625092934098, 'sideways_time_stop': 201, 'sideways_use_sma': True, 'sideways_use_ema': False, 'sideways_use_atr': True, 'sideways_use_adx': True, 'sideways_use_spike': True, 'sideways_rsi_required': True}.
[I 2025-09-01 09:52:44,089] Trial 332 finished with values: [-0.14361962748344725, 0.14337396077395034] and parameters: {'p_sma': 17, 'p_std': 48, 'p_atr': 27, 'p_adx': 22, 'rsi_period': 29, 'ema1': 22, 'ema2': 53, 'slip_atr_k': 0.1951054872753601, 'slip_spread_k': 0.16629444398118903, 'spread_hl_frac': 0.025905820943802844, 'bb_std_mult': 3.1773387207719934, 'rsi_os': 28, 'rsi_ob': 78, 'vol_spike': 0.2708913007492543, 'adx_thresh': 10.393076654572106, 'atr_min_pct': 0.02521936773765564, 'atr_max_pct': 0.08112287989539203, 'tp_mult': 2.832590916299625, 'tsl_mult': 0.9977252543398357, 'strategy': 'mean_reversion', 'time_stop': 146, 'use_sma': False, 'use_atr': True, 'use_adx': False, 'use_ema': True, 'use_spike': True, 'rsi_required': True, 'edge_k': 0.8872490321045923, 'edge_cap': 0.6280857498549925, 'bull_strategy': 'breakout', 'bull_bb_std_mult': 0.9676556859449763, 'bull_rsi_os': 22, 'bull_rsi_ob': 53, 'bull_adx_thresh': 5.045604427893061, 'bull_atr_min_pct': 0.029934653036636918, 'bull_atr_max_pct': 0.08380393009724918, 'bull_tp_mult': 1.9087355642070003, 'bull_tsl_mult': 0.024968424543937495, 'bull_time_stop': 156, 'bull_use_sma': False, 'bull_use_ema': True, 'bull_use_atr': True, 'bull_use_adx': True, 'bull_use_spike': True, 'bull_rsi_required': False, 'bear_strategy': 'breakout', 'bear_bb_std_mult': 3.3366274893569177, 'bear_rsi_os': 14, 'bear_rsi_ob': 45, 'bear_adx_thresh': 22.56966404352257, 'bear_atr_min_pct': 0.01813514499673699, 'bear_atr_max_pct': 0.0767904657363591, 'bear_tp_mult': 1.2214109328698382, 'bear_tsl_mult': 0.4720458027872814, 'bear_time_stop': 122, 'bear_use_sma': True, 'bear_use_ema': False, 'bear_use_atr': False, 'bear_use_adx': True, 'bear_use_spike': True, 'bear_rsi_required': True, 'sideways_strategy': 'mean_reversion', 'sideways_bb_std_mult': 3.4363781493057317, 'sideways_rsi_os': 54, 'sideways_rsi_ob': 51, 'sideways_adx_thresh': 26.147266336211786, 'sideways_atr_min_pct': 0.0015997643386187286, 'sideways_atr_max_pct': 0.07785312447702337, 'sideways_tp_mult': 1.3165600633714933, 'sideways_tsl_mult': 0.817610204248516, 'sideways_time_stop': 195, 'sideways_use_sma': True, 'sideways_use_ema': False, 'sideways_use_atr': True, 'sideways_use_adx': True, 'sideways_use_spike': True, 'sideways_rsi_required': True}.
[I 2025-09-01 09:53:21,658] Trial 336 finished with values: [-1000000000.0, 1000000000.0] and parameters: {'p_sma': 17, 'p_std': 46, 'p_atr': 26, 'p_adx': 23, 'rsi_period': 59, 'ema1': 22, 'ema2': 47, 'slip_atr_k': 0.23233102045550216, 'slip_spread_k': 0.18555018337310336, 'spread_hl_frac': 0.026786115606854816, 'bb_std_mult': 3.1886290276972735, 'rsi_os': 28, 'rsi_ob': 78, 'vol_spike': 0.28410741833123826, 'adx_thresh': 23.6799058085588, 'atr_min_pct': 0.024489828890813668, 'atr_max_pct': 0.07653918541949357, 'tp_mult': 2.842867857273929, 'tsl_mult': 0.814179645195364, 'strategy': 'mean_reversion', 'time_stop': 150, 'use_sma': False, 'use_atr': True, 'use_adx': False, 'use_ema': True, 'use_spike': True, 'rsi_required': True, 'edge_k': 0.9356919267399967, 'edge_cap': 0.6170674329938366, 'bull_strategy': 'breakout', 'bull_bb_std_mult': 0.9942058631041668, 'bull_rsi_os': 8, 'bull_rsi_ob': 54, 'bull_adx_thresh': 5.626156515623869, 'bull_atr_min_pct': 0.029579597494031072, 'bull_atr_max_pct': 0.08024248685234725, 'bull_tp_mult': 1.83010616887488, 'bull_tsl_mult': 0.042358141224609985, 'bull_time_stop': 163, 'bull_use_sma': False, 'bull_use_ema': True, 'bull_use_atr': True, 'bull_use_adx': True, 'bull_use_spike': True, 'bull_rsi_required': False, 'bear_strategy': 'breakout', 'bear_bb_std_mult': 3.258735452719609, 'bear_rsi_os': 15, 'bear_rsi_ob': 45, 'bear_adx_thresh': 32.548989486176154, 'bear_atr_min_pct': 0.01711567693428897, 'bear_atr_max_pct': 0.07022213890893533, 'bear_tp_mult': 1.2270689677925728, 'bear_tsl_mult': 0.0001776575341930764, 'bear_time_stop': 135, 'bear_use_sma': True, 'bear_use_ema': False, 'bear_use_atr': False, 'bear_use_adx': True, 'bear_use_spike': True, 'bear_rsi_required': True, 'sideways_strategy': 'mean_reversion', 'sideways_bb_std_mult': 3.350630915267831, 'sideways_rsi_os': 49, 'sideways_rsi_ob': 50, 'sideways_adx_thresh': 27.424945116190607, 'sideways_atr_min_pct': 0.022932768165063372, 'sideways_atr_max_pct': 0.1237141926856071, 'sideways_tp_mult': 1.2824162681245892, 'sideways_tsl_mult': 0.8298144598877174, 'sideways_time_stop': 196, 'sideways_use_sma': True, 'sideways_use_ema': False, 'sideways_use_atr': True, 'sideways_use_adx': True, 'sideways_use_spike': True, 'sideways_rsi_required': True}.
[I 2025-09-01 09:53:23,722] Trial 335 finished with values: [-1000000000.0, 1000000000.0] and parameters: {'p_sma': 17, 'p_std': 46, 'p_atr': 26, 'p_adx': 23, 'rsi_period': 58, 'ema1': 22, 'ema2': 50, 'slip_atr_k': 0.09234344913614348, 'slip_spread_k': 0.17343313230451857, 'spread_hl_frac': 0.02660866116761528, 'bb_std_mult': 3.1940033470399976, 'rsi_os': 28, 'rsi_ob': 78, 'vol_spike': 0.2833070443121955, 'adx_thresh': 32.583947910329485, 'atr_min_pct': 0.024299001960311158, 'atr_max_pct': 0.07488489855402714, 'tp_mult': 2.502630327016636, 'tsl_mult': 0.986170715072419, 'strategy': 'mean_reversion', 'time_stop': 151, 'use_sma': False, 'use_atr': True, 'use_adx': False, 'use_ema': True, 'use_spike': True, 'rsi_required': True, 'edge_k': 0.8841985782320934, 'edge_cap': 0.6158514727320425, 'bull_strategy': 'breakout', 'bull_bb_std_mult': 0.9823159158811186, 'bull_rsi_os': 42, 'bull_rsi_ob': 54, 'bull_adx_thresh': 5.614534533011138, 'bull_atr_min_pct': 0.02996712901222781, 'bull_atr_max_pct': 0.08694559137202407, 'bull_tp_mult': 1.8270655644159781, 'bull_tsl_mult': 0.027133934918956028, 'bull_time_stop': 164, 'bull_use_sma': False, 'bull_use_ema': True, 'bull_use_atr': True, 'bull_use_adx': True, 'bull_use_spike': True, 'bull_rsi_required': False, 'bear_strategy': 'breakout', 'bear_bb_std_mult': 3.2651152465928637, 'bear_rsi_os': 14, 'bear_rsi_ob': 45, 'bear_adx_thresh': 6.812255939600044, 'bear_atr_min_pct': 0.01854529636983646, 'bear_atr_max_pct': 0.06961038446471976, 'bear_tp_mult': 1.2305639203332446, 'bear_tsl_mult': 0.47245938854861796, 'bear_time_stop': 134, 'bear_use_sma': True, 'bear_use_ema': False, 'bear_use_atr': False, 'bear_use_adx': True, 'bear_use_spike': True, 'bear_rsi_required': True, 'sideways_strategy': 'mean_reversion', 'sideways_bb_std_mult': 3.3591027389299097, 'sideways_rsi_os': 49, 'sideways_rsi_ob': 50, 'sideways_adx_thresh': 25.646919317929978, 'sideways_atr_min_pct': 0.019494567668023998, 'sideways_atr_max_pct': 0.07662340454729367, 'sideways_tp_mult': 1.2884041262739176, 'sideways_tsl_mult': 0.8270562940349412, 'sideways_time_stop': 192, 'sideways_use_sma': True, 'sideways_use_ema': False, 'sideways_use_atr': True, 'sideways_use_adx': True, 'sideways_use_spike': True, 'sideways_rsi_required': True}.
[I 2025-09-01 09:53:24,412] Trial 337 finished with values: [-1000000000.0, 1000000000.0] and parameters: {'p_sma': 17, 'p_std': 54, 'p_atr': 23, 'p_adx': 23, 'rsi_period': 58, 'ema1': 23, 'ema2': 47, 'slip_atr_k': 0.23198050956644783, 'slip_spread_k': 0.18321135202815386, 'spread_hl_frac': 0.027184360987067883, 'bb_std_mult': 3.2220586778552045, 'rsi_os': 26, 'rsi_ob': 77, 'vol_spike': 0.2830627681543252, 'adx_thresh': 34.14686233206595, 'atr_min_pct': 0.02434855414525805, 'atr_max_pct': 0.07595785613006835, 'tp_mult': 2.522539190824861, 'tsl_mult': 0.8890249494071438, 'strategy': 'mean_reversion', 'time_stop': 152, 'use_sma': False, 'use_atr': True, 'use_adx': False, 'use_ema': True, 'use_spike': True, 'rsi_required': True, 'edge_k': 0.9460348064065366, 'edge_cap': 0.5913602623746652, 'bull_strategy': 'breakout', 'bull_bb_std_mult': 2.9328665748044664, 'bull_rsi_os': 8, 'bull_rsi_ob': 54, 'bull_adx_thresh': 5.774737075321042, 'bull_atr_min_pct': 0.02988283293847647, 'bull_atr_max_pct': 0.08092186000524577, 'bull_tp_mult': 1.852433124627198, 'bull_tsl_mult': 0.01694618810319372, 'bull_time_stop': 167, 'bull_use_sma': False, 'bull_use_ema': True, 'bull_use_atr': True, 'bull_use_adx': True, 'bull_use_spike': True, 'bull_rsi_required': False, 'bear_strategy': 'breakout', 'bear_bb_std_mult': 3.3006735021848543, 'bear_rsi_os': 55, 'bear_rsi_ob': 46, 'bear_adx_thresh': 10.19001831525496, 'bear_atr_min_pct': 0.01889120456715502, 'bear_atr_max_pct': 0.07004119063954856, 'bear_tp_mult': 1.1624606138265818, 'bear_tsl_mult': 0.20068541626272496, 'bear_time_stop': 133, 'bear_use_sma': True, 'bear_use_ema': False, 'bear_use_atr': False, 'bear_use_adx': True, 'bear_use_spike': True, 'bear_rsi_required': True, 'sideways_strategy': 'mean_reversion', 'sideways_bb_std_mult': 3.351470981362445, 'sideways_rsi_os': 48, 'sideways_rsi_ob': 49, 'sideways_adx_thresh': 27.804014281588948, 'sideways_atr_min_pct': 0.02931742345157378, 'sideways_atr_max_pct': 0.10899855861404088, 'sideways_tp_mult': 1.169203551744848, 'sideways_tsl_mult': 0.8316854124181597, 'sideways_time_stop': 204, 'sideways_use_sma': True, 'sideways_use_ema': False, 'sideways_use_atr': True, 'sideways_use_adx': True, 'sideways_use_spike': True, 'sideways_rsi_required': True}.
[I 2025-09-01 09:53:25,434] Trial 338 finished with values: [-1000000000.0, 1000000000.0] and parameters: {'p_sma': 17, 'p_std': 53, 'p_atr': 26, 'p_adx': 23, 'rsi_period': 48, 'ema1': 23, 'ema2': 47, 'slip_atr_k': 0.09408881625553195, 'slip_spread_k': 0.17974255804315709, 'spread_hl_frac': 0.02754360578828624, 'bb_std_mult': 3.2094355909351555, 'rsi_os': 26, 'rsi_ob': 77, 'vol_spike': 0.26115379839155206, 'adx_thresh': 32.23392436313186, 'atr_min_pct': 0.02467076395576905, 'atr_max_pct': 0.0757578372562176, 'tp_mult': 2.7808606765658377, 'tsl_mult': 0.38496287943669066, 'strategy': 'mean_reversion', 'time_stop': 153, 'use_sma': False, 'use_atr': True, 'use_adx': False, 'use_ema': True, 'use_spike': True, 'rsi_required': True, 'edge_k': 0.9324877918812462, 'edge_cap': 0.5847282187705389, 'bull_strategy': 'breakout', 'bull_bb_std_mult': 2.9919075172741785, 'bull_rsi_os': 42, 'bull_rsi_ob': 54, 'bull_adx_thresh': 22.786539445553945, 'bull_atr_min_pct': 0.02996899451853494, 'bull_atr_max_pct': 0.08125036818843377, 'bull_tp_mult': 1.8500552213311874, 'bull_tsl_mult': 0.032221119039328214, 'bull_time_stop': 166, 'bull_use_sma': False, 'bull_use_ema': True, 'bull_use_atr': True, 'bull_use_adx': True, 'bull_use_spike': True, 'bull_rsi_required': False, 'bear_strategy': 'breakout', 'bear_bb_std_mult': 3.2856674663040795, 'bear_rsi_os': 12, 'bear_rsi_ob': 46, 'bear_adx_thresh': 16.621387870264, 'bear_atr_min_pct': 0.017180912877667112, 'bear_atr_max_pct': 0.07056152852250487, 'bear_tp_mult': 1.1714856459662901, 'bear_tsl_mult': 0.2073368565054921, 'bear_time_stop': 133, 'bear_use_sma': True, 'bear_use_ema': False, 'bear_use_atr': False, 'bear_use_adx': True, 'bear_use_spike': True, 'bear_rsi_required': True, 'sideways_strategy': 'mean_reversion', 'sideways_bb_std_mult': 3.3625401304167917, 'sideways_rsi_os': 48, 'sideways_rsi_ob': 50, 'sideways_adx_thresh': 27.339789631513273, 'sideways_atr_min_pct': 0.023372063897013746, 'sideways_atr_max_pct': 0.0733956052600435, 'sideways_tp_mult': 1.1812472487543526, 'sideways_tsl_mult': 0.8466581422869734, 'sideways_time_stop': 204, 'sideways_use_sma': True, 'sideways_use_ema': False, 'sideways_use_atr': True, 'sideways_use_adx': True, 'sideways_use_spike': True, 'sideways_rsi_required': True}.
[I 2025-09-01 09:54:07,325] Trial 341 finished with values: [-1000000000.0, 1000000000.0] and parameters: {'p_sma': 18, 'p_std': 50, 'p_atr': 24, 'p_adx': 24, 'rsi_period': 48, 'ema1': 23, 'ema2': 46, 'slip_atr_k': 0.22095609259568316, 'slip_spread_k': 0.19824079643315287, 'spread_hl_frac': 0.028016586999957342, 'bb_std_mult': 3.009353004829301, 'rsi_os': 26, 'rsi_ob': 80, 'vol_spike': 0.26287005560851107, 'adx_thresh': 24.76399651408768, 'atr_min_pct': 0.02394481472198553, 'atr_max_pct': 0.08507774683962303, 'tp_mult': 2.3837356387883952, 'tsl_mult': 0.7777406058527134, 'strategy': 'mean_reversion', 'time_stop': 138, 'use_sma': True, 'use_atr': True, 'use_adx': False, 'use_ema': True, 'use_spike': True, 'rsi_required': True, 'edge_k': 0.8352274649005723, 'edge_cap': 0.5796757566900281, 'bull_strategy': 'breakout', 'bull_bb_std_mult': 0.9132927083670576, 'bull_rsi_os': 47, 'bull_rsi_ob': 64, 'bull_adx_thresh': 5.800205475007931, 'bull_atr_min_pct': 0.029249187869673718, 'bull_atr_max_pct': 0.08717595961164791, 'bull_tp_mult': 1.7666979506340725, 'bull_tsl_mult': 0.709875567502413, 'bull_time_stop': 155, 'bull_use_sma': False, 'bull_use_ema': True, 'bull_use_atr': True, 'bull_use_adx': True, 'bull_use_spike': False, 'bull_rsi_required': False, 'bear_strategy': 'breakout', 'bear_bb_std_mult': 1.2827497589341588, 'bear_rsi_os': 8, 'bear_rsi_ob': 46, 'bear_adx_thresh': 23.41648721513832, 'bear_atr_min_pct': 0.017074001227565014, 'bear_atr_max_pct': 0.07351798879866048, 'bear_tp_mult': 1.2557823503136747, 'bear_tsl_mult': 0.03763301414667286, 'bear_time_stop': 130, 'bear_use_sma': True, 'bear_use_ema': False, 'bear_use_atr': False, 'bear_use_adx': True, 'bear_use_spike': True, 'bear_rsi_required': True, 'sideways_strategy': 'mean_reversion', 'sideways_bb_std_mult': 3.3499001869207334, 'sideways_rsi_os': 52, 'sideways_rsi_ob': 50, 'sideways_adx_thresh': 27.362225165246844, 'sideways_atr_min_pct': 0.009051427995935134, 'sideways_atr_max_pct': 0.07349321839802449, 'sideways_tp_mult': 1.0115444884740792, 'sideways_tsl_mult': 0.8451486229715096, 'sideways_time_stop': 204, 'sideways_use_sma': True, 'sideways_use_ema': False, 'sideways_use_atr': True, 'sideways_use_adx': True, 'sideways_use_spike': True, 'sideways_rsi_required': True}.
[I 2025-09-01 09:54:08,327] Trial 339 finished with values: [-1000000000.0, 1000000000.0] and parameters: {'p_sma': 18, 'p_std': 53, 'p_atr': 24, 'p_adx': 24, 'rsi_period': 48, 'ema1': 23, 'ema2': 46, 'slip_atr_k': 0.061815130988747295, 'slip_spread_k': 0.6216956608062323, 'spread_hl_frac': 0.027687301442793716, 'bb_std_mult': 3.0848795746109072, 'rsi_os': 26, 'rsi_ob': 77, 'vol_spike': 0.2763719879866369, 'adx_thresh': 33.481070822098886, 'atr_min_pct': 0.024199102965009635, 'atr_max_pct': 0.07406472818813206, 'tp_mult': 2.361653267478457, 'tsl_mult': 0.24681639146032097, 'strategy': 'mean_reversion', 'time_stop': 152, 'use_sma': False, 'use_atr': True, 'use_adx': False, 'use_ema': True, 'use_spike': True, 'rsi_required': True, 'edge_k': 0.9474047645598053, 'edge_cap': 0.5867212338171045, 'bull_strategy': 'breakout', 'bull_bb_std_mult': 1.522967390838037, 'bull_rsi_os': 26, 'bull_rsi_ob': 64, 'bull_adx_thresh': 5.489386199095324, 'bull_atr_min_pct': 0.029880830494487278, 'bull_atr_max_pct': 0.08648661540222925, 'bull_tp_mult': 1.86191926005945, 'bull_tsl_mult': 0.03857860891084785, 'bull_time_stop': 166, 'bull_use_sma': False, 'bull_use_ema': True, 'bull_use_atr': True, 'bull_use_adx': True, 'bull_use_spike': True, 'bull_rsi_required': False, 'bear_strategy': 'breakout', 'bear_bb_std_mult': 3.309937853529299, 'bear_rsi_os': 55, 'bear_rsi_ob': 46, 'bear_adx_thresh': 17.07910650008934, 'bear_atr_min_pct': 0.01873262188952922, 'bear_atr_max_pct': 0.0697716972539841, 'bear_tp_mult': 1.164312947466612, 'bear_tsl_mult': 0.5149594262768846, 'bear_time_stop': 139, 'bear_use_sma': True, 'bear_use_ema': False, 'bear_use_atr': False, 'bear_use_adx': True, 'bear_use_spike': True, 'bear_rsi_required': True, 'sideways_strategy': 'mean_reversion', 'sideways_bb_std_mult': 3.3552577745675816, 'sideways_rsi_os': 48, 'sideways_rsi_ob': 50, 'sideways_adx_thresh': 27.56184594941545, 'sideways_atr_min_pct': 0.019363918413627994, 'sideways_atr_max_pct': 0.07425216798131336, 'sideways_tp_mult': 1.4508290010174827, 'sideways_tsl_mult': 0.8355574864543546, 'sideways_time_stop': 205, 'sideways_use_sma': True, 'sideways_use_ema': False, 'sideways_use_atr': True, 'sideways_use_adx': True, 'sideways_use_spike': True, 'sideways_rsi_required': True}.
[I 2025-09-01 09:54:09,129] Trial 340 finished with values: [-1000000000.0, 1000000000.0] and parameters: {'p_sma': 15, 'p_std': 54, 'p_atr': 24, 'p_adx': 22, 'rsi_period': 80, 'ema1': 23, 'ema2': 55, 'slip_atr_k': 0.06277459038423215, 'slip_spread_k': 0.18872764735722902, 'spread_hl_frac': 0.027674172998700033, 'bb_std_mult': 3.006104706024927, 'rsi_os': 26, 'rsi_ob': 77, 'vol_spike': 0.2628411902649192, 'adx_thresh': 30.056860840960347, 'atr_min_pct': 0.024033215921093115, 'atr_max_pct': 0.08478070042039873, 'tp_mult': 2.3666248832278707, 'tsl_mult': 0.9056423811754041, 'strategy': 'mean_reversion', 'time_stop': 153, 'use_sma': False, 'use_atr': True, 'use_adx': False, 'use_ema': True, 'use_spike': True, 'rsi_required': True, 'edge_k': 0.9487785949821346, 'edge_cap': 0.588140973353084, 'bull_strategy': 'breakout', 'bull_bb_std_mult': 3.3248237782656633, 'bull_rsi_os': 30, 'bull_rsi_ob': 51, 'bull_adx_thresh': 30.948893030900262, 'bull_atr_min_pct': 0.006688517655573977, 'bull_atr_max_pct': 0.08123531828795552, 'bull_tp_mult': 1.8686786792964414, 'bull_tsl_mult': 0.04206569526583842, 'bull_time_stop': 154, 'bull_use_sma': False, 'bull_use_ema': True, 'bull_use_atr': True, 'bull_use_adx': True, 'bull_use_spike': True, 'bull_rsi_required': False, 'bear_strategy': 'breakout', 'bear_bb_std_mult': 2.372020610427737, 'bear_rsi_os': 47, 'bear_rsi_ob': 46, 'bear_adx_thresh': 23.42043944869421, 'bear_atr_min_pct': 0.019158925935217994, 'bear_atr_max_pct': 0.07220156517694915, 'bear_tp_mult': 1.16618146343788, 'bear_tsl_mult': 0.515082816121194, 'bear_time_stop': 130, 'bear_use_sma': True, 'bear_use_ema': False, 'bear_use_atr': False, 'bear_use_adx': True, 'bear_use_spike': True, 'bear_rsi_required': True, 'sideways_strategy': 'mean_reversion', 'sideways_bb_std_mult': 3.3534400041213432, 'sideways_rsi_os': 48, 'sideways_rsi_ob': 50, 'sideways_adx_thresh': 27.506627584958803, 'sideways_atr_min_pct': 0.011019896063858323, 'sideways_atr_max_pct': 0.11207219416771487, 'sideways_tp_mult': 1.1617151652843196, 'sideways_tsl_mult': 0.8414216506961594, 'sideways_time_stop': 205, 'sideways_use_sma': True, 'sideways_use_ema': False, 'sideways_use_atr': True, 'sideways_use_adx': True, 'sideways_use_spike': True, 'sideways_rsi_required': True}.
