[I 2025-09-01 09:28:46,404] Trial 189 finished with values: [-1000000000.0, 1000000000.0] and parameters: {'p_sma': 49, 'p_std': 24, 'p_atr': 8, 'p_adx': 27, 'rsi_period': 23, 'ema1': 20, 'ema2': 20, 'slip_atr_k': 0.04447548535290966, 'slip_spread_k': 0.258779688982754, 'spread_hl_frac': 0.012259688267590526, 'bb_std_mult': 2.2426204415472304, 'rsi_os': 10, 'rsi_ob': 89, 'vol_spike': 0.11705689006655337, 'adx_thresh': 5.581446356648156, 'atr_min_pct': 0.028061725642086935, 'atr_max_pct': 0.03194321187616269, 'tp_mult': 1.7381632189921055, 'tsl_mult': 0.0007762281690542085, 'strategy': 'breakout', 'time_stop': 266, 'use_sma': False, 'use_atr': True, 'use_adx': True, 'use_ema': False, 'use_spike': True, 'rsi_required': False, 'edge_k': 1.5336567530802494, 'edge_cap': 0.7435544807477251, 'bull_strategy': 'mean_reversion', 'bull_bb_std_mult': 0.621038932612124, 'bull_rsi_os': 18, 'bull_rsi_ob': 64, 'bull_adx_thresh': 26.110257219424817, 'bull_atr_min_pct': 0.028598216324188675, 'bull_atr_max_pct': 0.06276473387139811, 'bull_tp_mult': 2.098468272289004, 'bull_tsl_mult': 0.08621311368026084, 'bull_time_stop': 124, 'bull_use_sma': True, 'bull_use_ema': False, 'bull_use_atr': False, 'bull_use_adx': False, 'bull_use_spike': False, 'bull_rsi_required': False, 'bear_strategy': 'mean_reversion', 'bear_bb_std_mult': 2.4235310690874843, 'bear_rsi_os': 44, 'bear_rsi_ob': 64, 'bear_adx_thresh': 13.22469074452834, 'bear_atr_min_pct': 0.015539193846638261, 'bear_atr_max_pct': 0.11161926730708675, 'bear_tp_mult': 2.241614113452063, 'bear_tsl_mult': 0.6046019704176064, 'bear_time_stop': 200, 'bear_use_sma': False, 'bear_use_ema': True, 'bear_use_atr': True, 'bear_use_adx': False, 'bear_use_spike': True, 'bear_rsi_required': False, 'sideways_strategy': 'breakout', 'sideways_bb_std_mult': 1.6093524333876181, 'sideways_rsi_os': 24, 'sideways_rsi_ob': 45, 'sideways_adx_thresh': 16.271716682870377, 'sideways_atr_min_pct': 0.02173495025499493, 'sideways_atr_max_pct': 0.0844096519470637, 'sideways_tp_mult': 2.9569802694099194, 'sideways_tsl_mult': 0.9319516774214729, 'sideways_time_stop': 62, 'sideways_use_sma': False, 'sideways_use_ema': True, 'sideways_use_atr': False, 'sideways_use_adx': False, 'sideways_use_spike': False, 'sideways_rsi_required': False}.
[I 2025-09-01 09:28:46,640] Trial 188 finished with values: [-1000000000.0, 1000000000.0] and parameters: {'p_sma': 26, 'p_std': 35, 'p_atr': 8, 'p_adx': 17, 'rsi_period': 30, 'ema1': 21, 'ema2': 19, 'slip_atr_k': 0.12560630297021133, 'slip_spread_k': 0.2786605118368528, 'spread_hl_frac': 0.011610539032024757, 'bb_std_mult': 1.8545205628833852, 'rsi_os': 9, 'rsi_ob': 88, 'vol_spike': 0.2305589254961485, 'adx_thresh': 11.205371463556949, 'atr_min_pct': 0.021017268746358304, 'atr_max_pct': 0.06545613470386125, 'tp_mult': 1.3100856996820371, 'tsl_mult': 4.742057424775292e-06, 'strategy': 'breakout', 'time_stop': 220, 'use_sma': True, 'use_atr': True, 'use_adx': True, 'use_ema': False, 'use_spike': True, 'rsi_required': False, 'edge_k': 1.5108350641518435, 'edge_cap': 0.07151892142619307, 'bull_strategy': 'mean_reversion', 'bull_bb_std_mult': 0.6032875799178539, 'bull_rsi_os': 18, 'bull_rsi_ob': 49, 'bull_adx_thresh': 26.234338796755395, 'bull_atr_min_pct': 0.023406385240143174, 'bull_atr_max_pct': 0.0685690911893671, 'bull_tp_mult': 1.6802906796525905, 'bull_tsl_mult': 0.5429652238048465, 'bull_time_stop': 237, 'bull_use_sma': True, 'bull_use_ema': False, 'bull_use_atr': False, 'bull_use_adx': False, 'bull_use_spike': False, 'bull_rsi_required': True, 'bear_strategy': 'mean_reversion', 'bear_bb_std_mult': 2.4216838032930257, 'bear_rsi_os': 44, 'bear_rsi_ob': 60, 'bear_adx_thresh': 26.98840411587417, 'bear_atr_min_pct': 0.015489182966179647, 'bear_atr_max_pct': 0.13041042015444518, 'bear_tp_mult': 2.2469477548576786, 'bear_tsl_mult': 0.09808717001867728, 'bear_time_stop': 226, 'bear_use_sma': False, 'bear_use_ema': True, 'bear_use_atr': True, 'bear_use_adx': False, 'bear_use_spike': True, 'bear_rsi_required': False, 'sideways_strategy': 'breakout', 'sideways_bb_std_mult': 0.6187534040374776, 'sideways_rsi_os': 14, 'sideways_rsi_ob': 45, 'sideways_adx_thresh': 28.803480180494148, 'sideways_atr_min_pct': 0.017738625820315924, 'sideways_atr_max_pct': 0.08505486459323511, 'sideways_tp_mult': 1.8378007247374355, 'sideways_tsl_mult': 0.9325468877468845, 'sideways_time_stop': 221, 'sideways_use_sma': False, 'sideways_use_ema': True, 'sideways_use_atr': False, 'sideways_use_adx': False, 'sideways_use_spike': False, 'sideways_rsi_required': False}.
[I 2025-09-01 09:28:47,303] Trial 194 finished with values: [-1000000000.0, 1000000000.0] and parameters: {'p_sma': 18, 'p_std': 23, 'p_atr': 16, 'p_adx': 14, 'rsi_period': 37, 'ema1': 15, 'ema2': 16, 'slip_atr_k': 0.037327256364580064, 'slip_spread_k': 0.3053718865447514, 'spread_hl_frac': 0.013838364044973114, 'bb_std_mult': 0.992606185652569, 'rsi_os': 55, 'rsi_ob': 59, 'vol_spike': 0.18875760773118141, 'adx_thresh': 22.759813497025927, 'atr_min_pct': 0.020117378105066006, 'atr_max_pct': 0.07018261485811429, 'tp_mult': 1.934796059002554, 'tsl_mult': 0.03588097646062606, 'strategy': 'mean_reversion', 'time_stop': 201, 'use_sma': True, 'use_atr': False, 'use_adx': False, 'use_ema': False, 'use_spike': False, 'rsi_required': False, 'edge_k': 1.58752400287977, 'edge_cap': 0.31029098379686987, 'bull_strategy': 'mean_reversion', 'bull_bb_std_mult': 3.5995092594095466, 'bull_rsi_os': 20, 'bull_rsi_ob': 93, 'bull_adx_thresh': 22.037365850285642, 'bull_atr_min_pct': 0.011863973900351085, 'bull_atr_max_pct': 0.031903685623088825, 'bull_tp_mult': 1.7621409917247763, 'bull_tsl_mult': 0.1253339363984393, 'bull_time_stop': 109, 'bull_use_sma': True, 'bull_use_ema': False, 'bull_use_atr': True, 'bull_use_adx': False, 'bull_use_spike': False, 'bull_rsi_required': True, 'bear_strategy': 'breakout', 'bear_bb_std_mult': 3.5217616184836342, 'bear_rsi_os': 47, 'bear_rsi_ob': 75, 'bear_adx_thresh': 8.330567623292573, 'bear_atr_min_pct': 0.01413144110044496, 'bear_atr_max_pct': 0.12305820075588418, 'bear_tp_mult': 2.170660035242259, 'bear_tsl_mult': 0.04469443741367918, 'bear_time_stop': 5, 'bear_use_sma': False, 'bear_use_ema': False, 'bear_use_atr': False, 'bear_use_adx': True, 'bear_use_spike': False, 'bear_rsi_required': False, 'sideways_strategy': 'mean_reversion', 'sideways_bb_std_mult': 1.7095733865534029, 'sideways_rsi_os': 31, 'sideways_rsi_ob': 55, 'sideways_adx_thresh': 29.619507882538343, 'sideways_atr_min_pct': 0.004741527273991511, 'sideways_atr_max_pct': 0.10407100490444181, 'sideways_tp_mult': 1.3070587221524548, 'sideways_tsl_mult': 0.14466708283106544, 'sideways_time_stop': 213, 'sideways_use_sma': True, 'sideways_use_ema': True, 'sideways_use_atr': True, 'sideways_use_adx': False, 'sideways_use_spike': False, 'sideways_rsi_required': False}.
[I 2025-09-01 09:29:29,090] Trial 193 finished with values: [-1000000000.0, 1000000000.0] and parameters: {'p_sma': 18, 'p_std': 34, 'p_atr': 16, 'p_adx': 14, 'rsi_period': 68, 'ema1': 21, 'ema2': 17, 'slip_atr_k': 0.03043583093851722, 'slip_spread_k': 0.19134711125009793, 'spread_hl_frac': 0.0038789843955142136, 'bb_std_mult': 1.0042249025616232, 'rsi_os': 12, 'rsi_ob': 59, 'vol_spike': 0.24808874307772752, 'adx_thresh': 22.861679679713973, 'atr_min_pct': 0.00720181576456692, 'atr_max_pct': 0.07080614909573134, 'tp_mult': 2.612127546170255, 'tsl_mult': 0.03874590650383709, 'strategy': 'mean_reversion', 'time_stop': 203, 'use_sma': True, 'use_atr': False, 'use_adx': True, 'use_ema': False, 'use_spike': False, 'rsi_required': False, 'edge_k': 1.5024194862664246, 'edge_cap': 0.23750542047967643, 'bull_strategy': 'mean_reversion', 'bull_bb_std_mult': 0.501255797000008, 'bull_rsi_os': 27, 'bull_rsi_ob': 53, 'bull_adx_thresh': 11.126117653946684, 'bull_atr_min_pct': 0.029407690904033345, 'bull_atr_max_pct': 0.0586106868846083, 'bull_tp_mult': 2.2007449160793477, 'bull_tsl_mult': 0.29768051862209577, 'bull_time_stop': 108, 'bull_use_sma': True, 'bull_use_ema': False, 'bull_use_atr': False, 'bull_use_adx': False, 'bull_use_spike': False, 'bull_rsi_required': True, 'bear_strategy': 'mean_reversion', 'bear_bb_std_mult': 1.8875478902113692, 'bear_rsi_os': 13, 'bear_rsi_ob': 75, 'bear_adx_thresh': 17.49446904247648, 'bear_atr_min_pct': 0.014132490430160592, 'bear_atr_max_pct': 0.0910262058427938, 'bear_tp_mult': 2.164520270628592, 'bear_tsl_mult': 0.931552026711491, 'bear_time_stop': 221, 'bear_use_sma': False, 'bear_use_ema': True, 'bear_use_atr': True, 'bear_use_adx': False, 'bear_use_spike': False, 'bear_rsi_required': False, 'sideways_strategy': 'mean_reversion', 'sideways_bb_std_mult': 1.5117477009630464, 'sideways_rsi_os': 31, 'sideways_rsi_ob': 66, 'sideways_adx_thresh': 29.61141383230531, 'sideways_atr_min_pct': 0.00761281386529915, 'sideways_atr_max_pct': 0.09199010609465233, 'sideways_tp_mult': 1.4429269064580597, 'sideways_tsl_mult': 0.8375757602794588, 'sideways_time_stop': 221, 'sideways_use_sma': False, 'sideways_use_ema': True, 'sideways_use_atr': True, 'sideways_use_adx': False, 'sideways_use_spike': False, 'sideways_rsi_required': False}.
[I 2025-09-01 09:29:29,707] Trial 191 finished with values: [-1000000000.0, 1000000000.0] and parameters: {'p_sma': 21, 'p_std': 9, 'p_atr': 16, 'p_adx': 17, 'rsi_period': 65, 'ema1': 30, 'ema2': 17, 'slip_atr_k': 0.20808474621235298, 'slip_spread_k': 0.15280985979064088, 'spread_hl_frac': 0.005260591215750225, 'bb_std_mult': 1.9916760467783563, 'rsi_os': 12, 'rsi_ob': 89, 'vol_spike': 0.22942164511860147, 'adx_thresh': 5.604811211900482, 'atr_min_pct': 0.02686608110694693, 'atr_max_pct': 0.07165315019667352, 'tp_mult': 1.7146989166459918, 'tsl_mult': 0.02869721104265317, 'strategy': 'breakout', 'time_stop': 266, 'use_sma': True, 'use_atr': False, 'use_adx': True, 'use_ema': False, 'use_spike': True, 'rsi_required': False, 'edge_k': 1.5176621370919792, 'edge_cap': 0.3130923768587907, 'bull_strategy': 'mean_reversion', 'bull_bb_std_mult': 0.630976449611099, 'bull_rsi_os': 16, 'bull_rsi_ob': 76, 'bull_adx_thresh': 12.300776360332133, 'bull_atr_min_pct': 0.02872368726136327, 'bull_atr_max_pct': 0.0747016762838537, 'bull_tp_mult': 2.1189265832462567, 'bull_tsl_mult': 0.07661646265945651, 'bull_time_stop': 90, 'bull_use_sma': True, 'bull_use_ema': False, 'bull_use_atr': False, 'bull_use_adx': False, 'bull_use_spike': False, 'bull_rsi_required': True, 'bear_strategy': 'mean_reversion', 'bear_bb_std_mult': 2.4383767921227837, 'bear_rsi_os': 45, 'bear_rsi_ob': 68, 'bear_adx_thresh': 26.901567614446243, 'bear_atr_min_pct': 0.007136540270076191, 'bear_atr_max_pct': 0.029582116696147936, 'bear_tp_mult': 2.2228065475712624, 'bear_tsl_mult': 0.6469212868711681, 'bear_time_stop': 6, 'bear_use_sma': False, 'bear_use_ema': True, 'bear_use_atr': True, 'bear_use_adx': False, 'bear_use_spike': True, 'bear_rsi_required': False, 'sideways_strategy': 'breakout', 'sideways_bb_std_mult': 1.585530940385991, 'sideways_rsi_os': 40, 'sideways_rsi_ob': 46, 'sideways_adx_thresh': 29.68912567158052, 'sideways_atr_min_pct': 0.018346027409036614, 'sideways_atr_max_pct': 0.0715679900896315, 'sideways_tp_mult': 1.830893201411436, 'sideways_tsl_mult': 0.15552291673421575, 'sideways_time_stop': 222, 'sideways_use_sma': False, 'sideways_use_ema': True, 'sideways_use_atr': True, 'sideways_use_adx': False, 'sideways_use_spike': False, 'sideways_rsi_required': False}.
[I 2025-09-01 09:29:30,182] Trial 195 finished with values: [-0.02937181407812839, 0.02905110831814601] and parameters: {'p_sma': 21, 'p_std': 25, 'p_atr': 16, 'p_adx': 15, 'rsi_period': 67, 'ema1': 21, 'ema2': 40, 'slip_atr_k': 0.1766433566691979, 'slip_spread_k': 0.2324994253578684, 'spread_hl_frac': 0.028266493741953107, 'bb_std_mult': 0.7306797364113542, 'rsi_os': 12, 'rsi_ob': 92, 'vol_spike': 0.24951195311269542, 'adx_thresh': 5.62423335586363, 'atr_min_pct': 0.007266142480741694, 'atr_max_pct': 0.06018418429687106, 'tp_mult': 1.8158995235292568, 'tsl_mult': 0.058503899113111914, 'strategy': 'breakout', 'time_stop': 188, 'use_sma': True, 'use_atr': False, 'use_adx': True, 'use_ema': False, 'use_spike': False, 'rsi_required': False, 'edge_k': 1.4598472239524294, 'edge_cap': 0.23812086538686972, 'bull_strategy': 'breakout', 'bull_bb_std_mult': 0.5010496145136802, 'bull_rsi_os': 16, 'bull_rsi_ob': 53, 'bull_adx_thresh': 8.700638230993992, 'bull_atr_min_pct': 0.029391308586538732, 'bull_atr_max_pct': 0.05856261436804357, 'bull_tp_mult': 2.1391550588364625, 'bull_tsl_mult': 0.07353361947596275, 'bull_time_stop': 90, 'bull_use_sma': False, 'bull_use_ema': True, 'bull_use_atr': False, 'bull_use_adx': True, 'bull_use_spike': False, 'bull_rsi_required': True, 'bear_strategy': 'mean_reversion', 'bear_bb_std_mult': 1.8945177604482157, 'bear_rsi_os': 48, 'bear_rsi_ob': 79, 'bear_adx_thresh': 17.516964809762847, 'bear_atr_min_pct': 0.01620714928236313, 'bear_atr_max_pct': 0.11827318551043181, 'bear_tp_mult': 2.2041569236256926, 'bear_tsl_mult': 0.9338477479434214, 'bear_time_stop': 214, 'bear_use_sma': True, 'bear_use_ema': True, 'bear_use_atr': True, 'bear_use_adx': False, 'bear_use_spike': False, 'bear_rsi_required': False, 'sideways_strategy': 'breakout', 'sideways_bb_std_mult': 1.4958986888137478, 'sideways_rsi_os': 40, 'sideways_rsi_ob': 66, 'sideways_adx_thresh': 11.312826116953143, 'sideways_atr_min_pct': 0.0037151581728914335, 'sideways_atr_max_pct': 0.07066289183858812, 'sideways_tp_mult': 1.4532982174103999, 'sideways_tsl_mult': 0.9703157696914233, 'sideways_time_stop': 130, 'sideways_use_sma': False, 'sideways_use_ema': True, 'sideways_use_atr': True, 'sideways_use_adx': True, 'sideways_use_spike': False, 'sideways_rsi_required': False}.
[I 2025-09-01 09:29:30,424] Trial 192 finished with values: [-1000000000.0, 1000000000.0] and parameters: {'p_sma': 21, 'p_std': 24, 'p_atr': 15, 'p_adx': 23, 'rsi_period': 68, 'ema1': 30, 'ema2': 17, 'slip_atr_k': 0.17543213097566157, 'slip_spread_k': 0.15075479220465288, 'spread_hl_frac': 0.012023373277755385, 'bb_std_mult': 1.7968972193872357, 'rsi_os': 12, 'rsi_ob': 69, 'vol_spike': 0.23259888365735149, 'adx_thresh': 5.557414302865233, 'atr_min_pct': 0.022495429149505305, 'atr_max_pct': 0.14970809535649365, 'tp_mult': 2.0755950948850024, 'tsl_mult': 0.03593926964205226, 'strategy': 'breakout', 'time_stop': 265, 'use_sma': True, 'use_atr': False, 'use_adx': True, 'use_ema': False, 'use_spike': False, 'rsi_required': False, 'edge_k': 1.512672989248751, 'edge_cap': 0.09436003842119131, 'bull_strategy': 'mean_reversion', 'bull_bb_std_mult': 0.6939474855673563, 'bull_rsi_os': 20, 'bull_rsi_ob': 70, 'bull_adx_thresh': 23.160381546108752, 'bull_atr_min_pct': 0.02179771908601986, 'bull_atr_max_pct': 0.05836664821297445, 'bull_tp_mult': 2.5719288262062903, 'bull_tsl_mult': 0.0754966221400006, 'bull_time_stop': 111, 'bull_use_sma': True, 'bull_use_ema': False, 'bull_use_atr': False, 'bull_use_adx': False, 'bull_use_spike': False, 'bull_rsi_required': True, 'bear_strategy': 'mean_reversion', 'bear_bb_std_mult': 3.59992941907781, 'bear_rsi_os': 13, 'bear_rsi_ob': 92, 'bear_adx_thresh': 17.52369858125366, 'bear_atr_min_pct': 0.014357301077395107, 'bear_atr_max_pct': 0.12202086744036693, 'bear_tp_mult': 2.1599062707772347, 'bear_tsl_mult': 0.42427382439202965, 'bear_time_stop': 282, 'bear_use_sma': False, 'bear_use_ema': True, 'bear_use_atr': True, 'bear_use_adx': False, 'bear_use_spike': False, 'bear_rsi_required': False, 'sideways_strategy': 'breakout', 'sideways_bb_std_mult': 1.6071046481328481, 'sideways_rsi_os': 31, 'sideways_rsi_ob': 55, 'sideways_adx_thresh': 29.917724947562576, 'sideways_atr_min_pct': 0.005530221284107275, 'sideways_atr_max_pct': 0.09108320292656544, 'sideways_tp_mult': 1.187655718819979, 'sideways_tsl_mult': 0.16374960580409542, 'sideways_time_stop': 219, 'sideways_use_sma': False, 'sideways_use_ema': True, 'sideways_use_atr': True, 'sideways_use_adx': False, 'sideways_use_spike': False, 'sideways_rsi_required': False}.
[I 2025-09-01 09:30:11,174] Trial 199 finished with values: [-1000000000.0, 1000000000.0] and parameters: {'p_sma': 28, 'p_std': 57, 'p_atr': 15, 'p_adx': 15, 'rsi_period': 62, 'ema1': 20, 'ema2': 18, 'slip_atr_k': 0.09702226013825302, 'slip_spread_k': 0.22945797797363798, 'spread_hl_frac': 0.01499830777513218, 'bb_std_mult': 2.880290135514544, 'rsi_os': 11, 'rsi_ob': 92, 'vol_spike': 0.21664397304929067, 'adx_thresh': 5.013409543236382, 'atr_min_pct': 0.01956866600872167, 'atr_max_pct': 0.11052119120153409, 'tp_mult': 1.8210720566451286, 'tsl_mult': 0.060852839283942764, 'strategy': 'breakout', 'time_stop': 193, 'use_sma': False, 'use_atr': False, 'use_adx': False, 'use_ema': True, 'use_spike': False, 'rsi_required': True, 'edge_k': 1.4579085176356823, 'edge_cap': 0.09784323600501575, 'bull_strategy': 'breakout', 'bull_bb_std_mult': 2.274976452295743, 'bull_rsi_os': 16, 'bull_rsi_ob': 57, 'bull_adx_thresh': 7.63782580482744, 'bull_atr_min_pct': 0.027679300515653794, 'bull_atr_max_pct': 0.0990375501298395, 'bull_tp_mult': 1.2610611124964806, 'bull_tsl_mult': 0.46731653131974316, 'bull_time_stop': 42, 'bull_use_sma': False, 'bull_use_ema': True, 'bull_use_atr': True, 'bull_use_adx': True, 'bull_use_spike': True, 'bull_rsi_required': True, 'bear_strategy': 'breakout', 'bear_bb_std_mult': 3.5211976761586428, 'bear_rsi_os': 48, 'bear_rsi_ob': 71, 'bear_adx_thresh': 6.600355147650122, 'bear_atr_min_pct': 0.021701294075358295, 'bear_atr_max_pct': 0.14585094134647947, 'bear_tp_mult': 2.2900225164653745, 'bear_tsl_mult': 0.15309085706975561, 'bear_time_stop': 216, 'bear_use_sma': True, 'bear_use_ema': False, 'bear_use_atr': False, 'bear_use_adx': True, 'bear_use_spike': False, 'bear_rsi_required': True, 'sideways_strategy': 'breakout', 'sideways_bb_std_mult': 0.7754190893918933, 'sideways_rsi_os': 7, 'sideways_rsi_ob': 58, 'sideways_adx_thresh': 27.661338555910863, 'sideways_atr_min_pct': 0.02427914143751205, 'sideways_atr_max_pct': 0.0673527548561726, 'sideways_tp_mult': 2.6008059581364025, 'sideways_tsl_mult': 0.95896570586881, 'sideways_time_stop': 131, 'sideways_use_sma': True, 'sideways_use_ema': False, 'sideways_use_atr': False, 'sideways_use_adx': True, 'sideways_use_spike': True, 'sideways_rsi_required': True}.
[I 2025-09-01 09:30:12,737] Trial 197 finished with values: [-1000000000.0, 1000000000.0] and parameters: {'p_sma': 28, 'p_std': 57, 'p_atr': 15, 'p_adx': 15, 'rsi_period': 62, 'ema1': 20, 'ema2': 40, 'slip_atr_k': 0.09406654568110794, 'slip_spread_k': 0.2274566609463321, 'spread_hl_frac': 0.015119879365942713, 'bb_std_mult': 1.7792313476919137, 'rsi_os': 43, 'rsi_ob': 76, 'vol_spike': 0.2126397281618377, 'adx_thresh': 7.978269015905634, 'atr_min_pct': 0.01959829709643191, 'atr_max_pct': 0.14986115798200286, 'tp_mult': 2.4984264614492835, 'tsl_mult': 0.05592007915221271, 'strategy': 'breakout', 'time_stop': 156, 'use_sma': False, 'use_atr': False, 'use_adx': True, 'use_ema': True, 'use_spike': False, 'rsi_required': True, 'edge_k': 1.4506828635169655, 'edge_cap': 0.09344186142939818, 'bull_strategy': 'breakout', 'bull_bb_std_mult': 2.3188394751572177, 'bull_rsi_os': 37, 'bull_rsi_ob': 70, 'bull_adx_thresh': 32.94316766456245, 'bull_atr_min_pct': 0.027687509840462022, 'bull_atr_max_pct': 0.11914934495674293, 'bull_tp_mult': 2.1499806828927537, 'bull_tsl_mult': 0.8829575881571317, 'bull_time_stop': 174, 'bull_use_sma': False, 'bull_use_ema': True, 'bull_use_atr': True, 'bull_use_adx': True, 'bull_use_spike': True, 'bull_rsi_required': True, 'bear_strategy': 'breakout', 'bear_bb_std_mult': 0.900109301487817, 'bear_rsi_os': 48, 'bear_rsi_ob': 92, 'bear_adx_thresh': 6.515343029363848, 'bear_atr_min_pct': 0.016425845747891396, 'bear_atr_max_pct': 0.06089613387383848, 'bear_tp_mult': 1.8210529861603098, 'bear_tsl_mult': 0.4230977197473457, 'bear_time_stop': 211, 'bear_use_sma': True, 'bear_use_ema': False, 'bear_use_atr': True, 'bear_use_adx': True, 'bear_use_spike': False, 'bear_rsi_required': True, 'sideways_strategy': 'breakout', 'sideways_bb_std_mult': 1.0015704953523452, 'sideways_rsi_os': 43, 'sideways_rsi_ob': 47, 'sideways_adx_thresh': 30.290238272916085, 'sideways_atr_min_pct': 0.005571606433302528, 'sideways_atr_max_pct': 0.11904794970369645, 'sideways_tp_mult': 1.1968401872071355, 'sideways_tsl_mult': 0.9632409701313792, 'sideways_time_stop': 232, 'sideways_use_sma': True, 'sideways_use_ema': False, 'sideways_use_atr': False, 'sideways_use_adx': True, 'sideways_use_spike': True, 'sideways_rsi_required': True}.
